================================================================================
                        FULL GAME - Team_075 vs Team_077                        
================================================================================

================================================================================
                       1ST QUARTER - Team_075 vs Team_077                       
================================================================================

[12:00] Team_075 possession (Score: 0-0)
Derrick Stewart makes the Layup and draws the foul on Draymond Dosunmu! And-1! Derrick Stewart to the line for 1. [Team fouls: 1] (Draymond Dosunmu: 1 personal fouls)   FT 1/1: GOOD Derrick Stewart makes 1/1 from the line.
Score: 3-0

[11:46] Team_077 possession (Score: 3-0)
Draymond Dosunmu throws a bad pass out of bounds! TURNOVER! (dead ball)

[11:31] Team_075 possession (Score: 3-0)
Larry McCollum drives to the basket... FOUL! Offensive foul on Larry McCollum! Ja Ball drew the charge! [Team fouls: 1] (Larry McCollum: 1 personal fouls) TURNOVER! (dead ball)

[11:19] Team_077 possession (Score: 3-0)
Dejounte Allen attempts a 3Pt. Wide open! Kawhi Ingram is 6.5 feet away. [MAN] DEJOUNTE ALLEN MAKES IT!
Score: 3-3

[11:09] Team_075 possession (Score: 3-3)
Derrick Stewart loses control! Ball rolls out of bounds! TURNOVER! (dead ball)

[10:54] Team_077 possession (Score: 3-3)
Russell Harden drives to the basket... Russell Harden throws a bad pass! Stolen by Derrick Stewart! TURNOVER! (live ball)

[10:35] Team_075 possession (Score: 3-3)
Klay Jokic makes the Layup and draws the foul on Draymond Dosunmu! And-1! Klay Jokic to the line for 1. [Team fouls: 2] (Draymond Dosunmu: 2 personal fouls)   FT 1/1: GOOD Klay Jokic makes 1/1 from the line.
Score: 6-3

[10:24] Team_077 possession (Score: 6-3)
Russell Harden drives, picks up Derrick Stewart. Help arrives from Larry McCollum! Russell Harden attempts a Dunk. Heavily contested by Larry McCollum (0.8 feet, MAN)! RUSSELL HARDEN MAKES IT! Assist: Ja Ball
Score: 6-5

[10:08] Team_075 possession (Score: 6-5)
Derrick Stewart attempts a Layup. BLOCKED BY RUSSELL HARDEN! Ball deflects out of bounds off Derrick Stewart.

[09:52] Team_077 possession (Score: 6-5)
Russell Harden drives to the basket... Russell Harden loses the ball! Stripped by Derrick Stewart! TURNOVER! (live ball)

[09:38] Team_075 possession (Score: 6-5)
Klay Jokic attempts a 3Pt. Contested by Dejounte Allen (5.5 feet, ZONE). Klay Jokic misses. Rebound secured by Chris Ginobili.

[09:23] Team_077 possession (Score: 6-5)
Chris Ginobili attempts a 3Pt. Contested by Derrick Stewart (3.0 feet, ZONE). Chris Ginobili misses. Offensive rebound by Draymond Dosunmu! Draymond Dosunmu kicks it out.

[09:05] Team_077 possession (Score: 6-5)
Russell Harden drives and kicks out. Dejounte Allen attempts a 3Pt. Contested by Larry McCollum (4.6 feet, ZONE). Dejounte Allen misses. Rebound secured by Derrick Stewart.

[08:52] Team_075 possession (Score: 6-5)
Kawhi Ingram drives to the basket... Kawhi Ingram throws a bad pass! Stolen by Russell Harden! TURNOVER! (live ball)

[08:36] Team_077 possession (Score: 6-5)
Russell Harden drives, picks up Derrick Stewart. Help arrives from Larry McCollum! Russell Harden attempts a Layup. Contested by Larry McCollum (4.6 feet, ZONE). Russell Harden misses. Rebound secured by Klay Jokic.

[08:25] Team_075 possession (Score: 6-5)
Derrick Stewart attempts a 3Pt. Contested by Dejounte Allen (3.6 feet, ZONE). DERRICK STEWART MAKES IT! Assist: Larry McCollum
Score: 9-5

[08:13] Team_077 possession (Score: 9-5)
Draymond Dosunmu throws a bad pass out of bounds! TURNOVER! (dead ball)

[07:59] Team_075 possession (Score: 9-5)
Larry McCollum attempts a 3Pt. Contested by Ja Ball (3.4 feet, MAN). Larry McCollum misses. FOUL! Loose ball foul on Chris Ginobili during the rebound battle. [Team fouls: 3] No free throws, side out. (Chris Ginobili: 1 personal fouls)

[07:41] Team_075 possession (Score: 9-5)
Larry McCollum attempts a 3Pt. Contested by Ja Ball (5.7 feet, MAN). Larry McCollum misses. Rebound secured by Chris Ginobili.

[07:25] Team_077 possession (Score: 9-5)
Dejounte Allen attempts a 3Pt. Contested by Kawhi Ingram (3.3 feet, MAN). DEJOUNTE ALLEN MAKES IT! Assist: Ja Ball
Score: 9-8

[07:09] Team_075 possession (Score: 9-8)
Klay Jokic makes the Layup and draws the foul on Russell Harden! And-1! Klay Jokic to the line for 1. [Team fouls: 4] (Russell Harden: 1 personal fouls)   FT 1/1: GOOD Klay Jokic makes 1/1 from the line.
Score: 12-8

[06:53] Team_077 possession (Score: 12-8)
Chris Ginobili drives and kicks out. Ja Ball attempts a Midrange. Wide open! Derrick Stewart is 7.1 feet away. [ZONE] Ja Ball misses. Rebound secured by Kawhi Ingram.

[06:40] Team_075 possession (Score: 12-8)
FOUL! Reach-in foul on Draymond Dosunmu during the drive. [IN THE BONUS! 5 team fouls] Klay Jokic to the line for 2 free throws. (Draymond Dosunmu: 3 personal fouls)   FT 1/2: GOOD   FT 2/2: GOOD Klay Jokic makes 2/2 from the line.
Score: 14-8

[06:26] Team_077 possession (Score: 14-8)
Dejounte Allen throws a bad pass! Stolen by Kawhi Ingram! TURNOVER! (live ball)

[06:15] Team_075 possession (Score: 14-8)
Klay Jokic attempts a Midrange. Contested by Draymond Dosunmu (3.6 feet, MAN). Klay Jokic misses. Rebound secured by Russell Harden.

[06:04] Team_077 possession (Score: 14-8)
Ja Ball attempts a Midrange. Wide open! Larry McCollum is 6.2 feet away. [MAN] JA BALL MAKES IT!
Score: 14-10

[05:50] Team_075 possession (Score: 14-10)
Derrick Stewart attempts a Layup. BLOCKED BY JA BALL! Ball is loose! Offensive rebound by Derrick Stewart! Derrick Stewart kicks it out.

[05:36] Team_075 possession (Score: 14-10)
Kawhi Ingram attempts a Layup. Heavily contested by Draymond Dosunmu (2.0 feet, ZONE)! Kawhi Ingram misses. Rebound secured by Draymond Dosunmu.

[05:25] Team_077 possession (Score: 14-10)
Draymond Dosunmu drives, picks up Klay Jokic. Help arrives from Larry McCollum! Draymond Dosunmu attempts a Dunk. Contested by Larry McCollum (2.9 feet, MAN). Draymond Dosunmu misses. Rebound secured by Klay Jokic.

[05:12] Team_075 possession (Score: 14-10)
Klay Jokic attempts a Layup. Heavily contested by Draymond Dosunmu (2.0 feet, MAN)! KLAY JOKIC MAKES IT!
Score: 16-10

[05:00] Team_077 possession (Score: 16-10)
Ja Ball attempts a 3Pt. Wide open! Larry McCollum is 6.7 feet away. [MAN] JA BALL MAKES IT! Assist: Russell Harden
Score: 16-13

[04:47] Team_075 possession (Score: 16-13)
Derrick Stewart attempts a Midrange. Contested by Russell Harden (5.8 feet, MAN). DERRICK STEWART MAKES IT!
Score: 18-13

[04:34] Team_077 possession (Score: 18-13)
Dejounte Allen drives, Derrick Stewart stays with him. Dejounte Allen attempts a Layup. Wide open! Derrick Stewart is 6.3 feet away. [ZONE] Dejounte Allen misses. Offensive rebound by Draymond Dosunmu! Draymond Dosunmu kicks it out.

[04:20] Team_077 possession (Score: 18-13)
Ja Ball attempts a Midrange. Contested by Derrick Stewart (4.4 feet, ZONE). JA BALL MAKES IT!
Score: 18-15

[04:07] Team_075 possession (Score: 18-15)
Klay Jokic attempts a Midrange. Wide open! Draymond Dosunmu is 6.6 feet away. [MAN] KLAY JOKIC MAKES IT! Assist: Myles Barrett
Score: 20-15

[03:51] Team_077 possession (Score: 20-15)
Draymond Dosunmu attempts a Midrange. Contested by Klay Jokic (5.2 feet, MAN). DRAYMOND DOSUNMU MAKES IT! Assist: Ja Ball
Score: 20-17

[03:37] Team_075 possession (Score: 20-17)
Derrick Stewart attempts a Layup. Contested by Russell Harden (5.8 feet, MAN). DERRICK STEWART MAKES IT! Assist: Larry McCollum
Score: 22-17

[03:20] Team_077 possession (Score: 22-17)
FOUL! Holding foul on Klay Jokic. [Team fouls: 2] No free throws, side out. (Klay Jokic: 1 personal fouls)

[03:05] Team_077 possession (Score: 22-17)
Draymond Dosunmu drives, picks up Derrick Stewart. Help arrives from Larry McCollum! Draymond Dosunmu attempts a Dunk. Contested by Larry McCollum (4.4 feet, ZONE). DRAYMOND DOSUNMU MAKES IT!
Score: 22-19

[02:49] Team_075 possession (Score: 22-19)
Myles Barrett attempts a 3Pt. Contested by Dejounte Allen (5.8 feet, ZONE). Myles Barrett misses. Rebound secured by Russell Harden.

[02:32] Team_077 possession (Score: 22-19)
Dejounte Allen attempts a 3Pt. Contested by Larry McCollum (3.7 feet, ZONE). DEJOUNTE ALLEN MAKES IT! Assist: Russell Harden
Score: 22-22

[02:21] Team_075 possession (Score: 22-22)
Kawhi Ingram attempts a Midrange. Contested by Chris Ginobili (5.0 feet, ZONE). KAWHI INGRAM MAKES IT! Assist: Klay Jokic
Score: 24-22

[02:02] Team_077 possession (Score: 24-22)
Russell Harden commits a violation (traveling/carry)! TURNOVER! (dead ball)

[02:02] Substitution (Team_075): Larry McCollum OUT → D'Angelo Anunoby IN (stamina_rule2)

[02:02] Substitution (Team_075): Kawhi Ingram OUT → LeBron Ginobili IN (stamina_rule2)

[02:02] Substitution (Team_075): Myles Barrett OUT → Donovan Paul IN (stamina_rule2)

[02:02] Substitution (Team_075): Derrick Stewart OUT → Collin Duncan IN (stamina_rule2)

[02:02] Substitution (Team_075): Klay Jokic OUT → Kevin Towns IN (stamina_rule2)

[02:02] Substitution (Team_077): Dejounte Allen OUT → Dejounte Quickley IN (stamina_rule2)

[02:02] Substitution (Team_077): Chris Ginobili OUT → Tyler Poole IN (stamina_rule2)

[02:02] Substitution (Team_077): Russell Harden OUT → Jordan Simmons IN (stamina_rule2)

[02:02] Substitution (Team_077): Draymond Dosunmu OUT → Ayo Griffin IN (stamina_rule2)

[01:43] Team_075 possession (Score: 24-22)
Collin Duncan drives, Jordan Simmons stays with him. Collin Duncan attempts a Dunk. Heavily contested by Jordan Simmons (1.3 feet, ZONE)! Collin Duncan misses. Rebound secured by Ja Ball.

[01:29] Team_077 possession (Score: 24-22)
Jordan Simmons attempts a Layup. Wide open! Collin Duncan is 6.3 feet away. [MAN] JORDAN SIMMONS MAKES IT!
Score: 24-24

[01:14] Team_075 possession (Score: 24-24)
Kevin Towns attempts a 3Pt. Wide open! Ja Ball is 7.2 feet away. [ZONE] Kevin Towns misses. Rebound secured by Ayo Griffin.

[01:03] Team_077 possession (Score: 24-24)
Jordan Simmons drives, Kevin Towns stays with him. Jordan Simmons attempts a Dunk. Contested by Kevin Towns (5.3 feet, ZONE). JORDAN SIMMONS MAKES IT! Assist: Ja Ball
Score: 24-26

[00:47] Team_075 possession (Score: 24-26)
Donovan Paul attempts a 3Pt. Contested by Tyler Poole (4.6 feet, MAN). Donovan Paul misses. Rebound secured by Ayo Griffin.

[00:33] Team_077 possession (Score: 24-26)
Dejounte Quickley drives, Kevin Towns stays with him. Dejounte Quickley attempts a Dunk. Contested by Kevin Towns (5.0 feet, ZONE). Dejounte Quickley misses. Offensive rebound by Ayo Griffin! Ayo Griffin's putback is no good. Rebound secured by D'Angelo Anunoby.

[00:23] Team_075 possession (Score: 24-26)
LeBron Ginobili attempts a 3Pt. Heavily contested by Dejounte Quickley (0.5 feet, ZONE)! LEBRON GINOBILI MAKES IT! Assist: D'Angelo Anunoby
Score: 27-26

[00:04] Team_077 possession (Score: 27-26)
Ja Ball attempts a 3Pt. Contested by D'Angelo Anunoby (2.8 feet, MAN). Ja Ball misses. Rebound secured by Collin Duncan.

================================================================================
                              1ST QUARTER COMPLETE                              
================================================================================

1ST QUARTER SCORE: Team_075 27, Team_077 26

BOX SCORE:
================================================================================

Team_075
--------------------------------------------------------------------------------
Player                MIN  PTS  REB  AST  TO      FG   FG%      3P   3P%
--------------------------------------------------------------------------------
Klay Jokic             10   12    2    1   0   5/7    71.4     0/0   0.0
Derrick Stewart        10   10    3    0   0   4/5    80.0     0/0   0.0
LeBron Ginobili         2    3    0    0   0   1/1   100.0     0/0   0.0
Kawhi Ingram           10    2    1    0   0   1/2    50.0     0/0   0.0
Larry McCollum         10    0    0    2   0   0/1     0.0     0/0   0.0
Myles Barrett          10    0    0    1   0   0/1     0.0     0/0   0.0
Collin Duncan           2    0    1    0   0   0/1     0.0     0/0   0.0
Kevin Towns             2    0    0    0   0   0/1     0.0     0/0   0.0
Donovan Paul            2    0    0    0   0   0/1     0.0     0/0   0.0
D'Angelo Anunoby        2    0    1    1   0   0/0     0.0     0/0   0.0

TEAM: FG: 11/20 (55.0%), 3PT: 2/7 (28.6%), REB: 7 (2 off, 5 def), AST: 5, TO: 3
TEAM FOULS: 2


Team_077
--------------------------------------------------------------------------------
Player                MIN  PTS  REB  AST  TO      FG   FG%      3P   3P%
--------------------------------------------------------------------------------
Dejounte Allen         10    9    0    0   0   3/3   100.0     0/0   0.0
Ja Ball                12    7    1    4   0   3/4    75.0     0/0   0.0
Draymond Dosunmu       10    4    3    0   0   2/3    66.7     0/0   0.0
Jordan Simmons          2    4    0    0   0   2/2   100.0     0/0   0.0
Russell Harden         10    2    2    2   0   1/3    33.3     0/0   0.0
Chris Ginobili         10    0    2    0   0   0/1     0.0     0/0   0.0
Ayo Griffin             2    0    2    0   0   0/0     0.0     0/0   0.0
Dejounte Quickley       2    0    0    0   0   0/1     0.0     0/0   0.0

TEAM: FG: 11/17 (64.7%), 3PT: 4/5 (80.0%), REB: 11 (3 off, 8 def), AST: 6, TO: 6
TEAM FOULS: 5 [Team_075 in BONUS]

================================================================================

================================================================================
                       2ND QUARTER - Team_075 vs Team_077                       
================================================================================

[12:00] Team_075 possession (Score: 27-26)
Derrick Stewart attempts a Midrange. Contested by Dejounte Allen (3.8 feet, ZONE). Derrick Stewart misses. Rebound secured by Draymond Dosunmu.

[11:48] Team_077 possession (Score: 27-26)
Chris Ginobili attempts a 3Pt. Wide open! Myles Barrett is 6.2 feet away. [MAN] CHRIS GINOBILI MAKES IT! Assist: Ja Ball
Score: 27-29

[11:36] Team_075 possession (Score: 27-29)
Derrick Stewart attempts a Midrange. Contested by Russell Harden (5.7 feet, MAN). Derrick Stewart misses. Rebound secured by Draymond Dosunmu.

[11:20] Team_077 possession (Score: 27-29)
Dejounte Allen drives and kicks out. Russell Harden attempts a Midrange. Contested by Derrick Stewart (5.9 feet, MAN). Russell Harden misses. Offensive rebound by Draymond Dosunmu! Draymond Dosunmu kicks it out.

[11:07] Team_077 possession (Score: 27-29)
Ja Ball attempts a 3Pt. Wide open! Kawhi Ingram is 7.0 feet away. [ZONE] JA BALL MAKES IT! Assist: Dejounte Allen
Score: 27-32

[10:55] Team_075 possession (Score: 27-32)
Derrick Stewart attempts a 3Pt. Contested by Russell Harden (6.0 feet, MAN). Derrick Stewart misses. Rebound secured by Draymond Dosunmu.

[10:37] Team_077 possession (Score: 27-32)
Russell Harden attempts a Layup. Contested by Derrick Stewart (2.3 feet, MAN). RUSSELL HARDEN MAKES IT! Assist: Ja Ball
Score: 27-34

[10:28] Team_075 possession (Score: 27-34)
Kawhi Ingram attempts a Layup. BLOCKED BY DEJOUNTE ALLEN! Ball is loose! Rebound secured by Draymond Dosunmu.

[10:18] Team_077 possession (Score: 27-34)
Ja Ball attempts a 3Pt. Contested by Larry McCollum (3.4 feet, MAN). JA BALL MAKES IT! Assist: Dejounte Allen
Score: 27-37

[10:04] Team_075 possession (Score: 27-37)
Larry McCollum drives, picks up Ja Ball. Help arrives from Chris Ginobili! Larry McCollum attempts a Layup. Contested by Chris Ginobili (2.4 feet, MAN). LARRY MCCOLLUM MAKES IT!
Score: 29-37

[09:48] Team_077 possession (Score: 29-37)
Chris Ginobili drives and kicks out. Dejounte Allen attempts a Midrange. Contested by Kawhi Ingram (5.7 feet, ZONE). DEJOUNTE ALLEN MAKES IT!
Score: 29-39

[09:35] Team_075 possession (Score: 29-39)
FOUL! Reach-in foul on Draymond Dosunmu during the drive. [Team fouls: 1] No free throws, side out. (Draymond Dosunmu: 1 personal fouls)

[09:21] Team_075 possession (Score: 29-39)
Derrick Stewart drives to the basket... FOUL! Offensive foul on Derrick Stewart! Draymond Dosunmu drew the charge! [Team fouls: 1] (Derrick Stewart: 1 personal fouls) TURNOVER! (dead ball)

[09:10] Team_077 possession (Score: 29-39)
Dejounte Allen attempts a 3Pt. Wide open! Kawhi Ingram is 6.1 feet away. [MAN] Dejounte Allen misses. Rebound secured by Derrick Stewart.

[08:57] Team_075 possession (Score: 29-39)
Klay Jokic drives and kicks out. Larry McCollum attempts a Midrange. Contested by Ja Ball (2.8 feet, MAN). LARRY MCCOLLUM MAKES IT!
Score: 31-39

[08:45] Team_077 possession (Score: 31-39)
Chris Ginobili attempts a Midrange. Wide open! Myles Barrett is 6.1 feet away. [ZONE] Chris Ginobili misses. Rebound secured by Klay Jokic.

[08:34] Team_075 possession (Score: 31-39)
FOUL! Shooting foul on Draymond Dosunmu. Derrick Stewart to the line for 2 free throws. [Team fouls: 2] (Draymond Dosunmu: 2 personal fouls)   FT 1/2: MISS   FT 2/2: GOOD Derrick Stewart makes 1/2 from the line.
Score: 32-39

[08:21] Team_077 possession (Score: 32-39)
Draymond Dosunmu drives to the basket... FOUL! Offensive foul on Draymond Dosunmu! Derrick Stewart drew the charge! [Team fouls: 3] (Draymond Dosunmu: 3 personal fouls) TURNOVER! (dead ball)

[08:07] Team_075 possession (Score: 32-39)
Klay Jokic attempts a Midrange. Wide open! Ja Ball is 8.2 feet away. [ZONE] Klay Jokic misses. Rebound secured by Russell Harden.

[07:49] Team_077 possession (Score: 32-39)
Ja Ball attempts a Layup. Contested by Larry McCollum (4.0 feet, MAN). JA BALL MAKES IT! Assist: Chris Ginobili
Score: 32-41

[07:30] Team_075 possession (Score: 32-41)
Derrick Stewart throws a bad pass out of bounds! TURNOVER! (dead ball)

[07:30] Substitution (Team_075): Larry McCollum OUT → D'Angelo Anunoby IN (stamina_rule2)

[07:30] Substitution (Team_075): Kawhi Ingram OUT → LeBron Ginobili IN (stamina_rule2)

[07:30] Substitution (Team_075): Myles Barrett OUT → Donovan Paul IN (stamina_rule2)

[07:30] Substitution (Team_075): Derrick Stewart OUT → Collin Duncan IN (stamina_rule2)

[07:30] Substitution (Team_075): Klay Jokic OUT → Kevin Towns IN (stamina_rule2)

[07:30] Substitution (Team_077): Ja Ball OUT → Bam Bryant IN (stamina_rule2)

[07:30] Substitution (Team_077): Dejounte Allen OUT → Dejounte Quickley IN (stamina_rule2)

[07:30] Substitution (Team_077): Chris Ginobili OUT → Tyler Poole IN (stamina_rule2)

[07:30] Substitution (Team_077): Russell Harden OUT → Jordan Simmons IN (stamina_rule2)

[07:30] Substitution (Team_077): Draymond Dosunmu OUT → Ayo Griffin IN (stamina_rule2)

[07:16] Team_077 possession (Score: 32-41)
Jordan Simmons drives and kicks out. Jordan Simmons attempts a 3Pt. Wide open! Collin Duncan is 8.0 feet away. [MAN] Jordan Simmons misses. Rebound secured by Collin Duncan.

[06:59] Team_075 possession (Score: 32-41)
Donovan Paul attempts a Layup. Contested by Tyler Poole (3.9 feet, MAN). DONOVAN PAUL MAKES IT! Assist: LeBron Ginobili
Score: 34-41

[06:43] Team_077 possession (Score: 34-41)
Ayo Griffin drives to the basket... Ayo Griffin commits a violation (traveling/carry)! TURNOVER! (dead ball)

[06:30] Team_075 possession (Score: 34-41)
Kevin Towns drives, Ayo Griffin stays with him. Kevin Towns attempts a Dunk. Wide open! Ayo Griffin is 7.0 feet away. [MAN] KEVIN TOWNS MAKES IT! Assist: D'Angelo Anunoby
Score: 36-41

[06:14] Team_077 possession (Score: 36-41)
Bam Bryant attempts a 3Pt. Contested by D'Angelo Anunoby (5.9 feet, ZONE). Bam Bryant misses. Rebound secured by Kevin Towns.

[05:58] Team_075 possession (Score: 36-41)
Donovan Paul drives to the basket... Donovan Paul throws a bad pass out of bounds! TURNOVER! (dead ball)

[05:43] Team_077 possession (Score: 36-41)
Dejounte Quickley attempts a 3Pt. Contested by Collin Duncan (5.5 feet, ZONE). Dejounte Quickley misses. Rebound secured by Kevin Towns.

[05:29] Team_075 possession (Score: 36-41)
D'Angelo Anunoby attempts a Layup. Wide open! Bam Bryant is 6.1 feet away. [MAN] D'ANGELO ANUNOBY MAKES IT!
Score: 38-41

[05:15] Team_077 possession (Score: 38-41)
Ayo Griffin attempts a Midrange. Wide open! Kevin Towns is 9.4 feet away. [MAN] Ayo Griffin misses. Rebound secured by D'Angelo Anunoby.

[05:00] Team_075 possession (Score: 38-41)
D'Angelo Anunoby attempts a Midrange. Wide open! Bam Bryant is 9.0 feet away. [MAN] D'Angelo Anunoby misses. Rebound secured by Ayo Griffin.

[04:46] Team_077 possession (Score: 38-41)
Ayo Griffin attempts a Midrange. Contested by Collin Duncan (5.1 feet, ZONE). Ayo Griffin misses. Rebound secured by Kevin Towns.

[04:30] Team_075 possession (Score: 38-41)
Donovan Paul attempts a 3Pt. Contested by Jordan Simmons (2.4 feet, ZONE). Donovan Paul misses. Rebound secured by Tyler Poole.

[04:15] Team_077 possession (Score: 38-41)
Bam Bryant attempts a 3Pt. Contested by D'Angelo Anunoby (2.1 feet, MAN). BAM BRYANT MAKES IT! Assist: Ayo Griffin
Score: 38-44

[03:59] Team_075 possession (Score: 38-44)
Kevin Towns attempts a 3Pt. Contested by Dejounte Quickley (3.2 feet, ZONE). Kevin Towns misses. Rebound secured by Jordan Simmons.

[03:42] Team_077 possession (Score: 38-44)
FOUL! Shooting foul on D'Angelo Anunoby. Tyler Poole to the line for 2 free throws. [Team fouls: 2] (D'Angelo Anunoby: 1 personal fouls)   FT 1/2: GOOD   FT 2/2: GOOD Tyler Poole makes 2/2 from the line.
Score: 38-46

[03:24] Team_075 possession (Score: 38-46)
LeBron Ginobili attempts a Midrange. Contested by Jordan Simmons (5.6 feet, ZONE). LeBron Ginobili misses. Offensive rebound by Kevin Towns! Kevin Towns kicks it out.

[03:14] Team_075 possession (Score: 38-46)
Collin Duncan drives to the basket... Collin Duncan loses the ball! Stripped by Jordan Simmons! TURNOVER! (live ball)

[03:00] Team_077 possession (Score: 38-46)
Ayo Griffin drives to the basket... Ayo Griffin throws a bad pass out of bounds! TURNOVER! (dead ball)

[02:45] Team_075 possession (Score: 38-46)
Kevin Towns attempts a 3Pt. Contested by Ayo Griffin (5.2 feet, MAN). Kevin Towns misses. Offensive rebound by Collin Duncan! Collin Duncan kicks it out.

[02:32] Team_075 possession (Score: 38-46)
D'Angelo Anunoby attempts a 3Pt. Contested by Dejounte Quickley (4.2 feet, ZONE). D'Angelo Anunoby misses. Rebound secured by Jordan Simmons.

[02:20] Team_077 possession (Score: 38-46)
Bam Bryant attempts a 3Pt. Wide open! D'Angelo Anunoby is 7.4 feet away. [MAN] BAM BRYANT MAKES IT! Assist: Dejounte Quickley
Score: 38-49

[02:06] Team_075 possession (Score: 38-49)
Kevin Towns attempts a Layup. Contested by Jordan Simmons (3.9 feet, ZONE). Kevin Towns misses. Rebound secured by Ayo Griffin.

[01:50] Team_077 possession (Score: 38-49)
Ayo Griffin attempts a 3Pt. Wide open! Donovan Paul is 7.7 feet away. [ZONE] Ayo Griffin misses. Offensive rebound by Jordan Simmons! Jordan Simmons kicks it out.

[01:35] Team_077 possession (Score: 38-49)
Ayo Griffin attempts a Layup. Contested by Kevin Towns (2.2 feet, ZONE). Ayo Griffin misses. FOUL! Loose ball foul on D'Angelo Anunoby during the rebound battle. [Team fouls: 3] No free throws, side out. (D'Angelo Anunoby: 2 personal fouls)

[01:25] Team_077 possession (Score: 38-49)
Dejounte Quickley drives to the basket... Dejounte Quickley throws a bad pass! Stolen by Kevin Towns! TURNOVER! (live ball)

[01:13] Team_075 possession (Score: 38-49)
Kevin Towns drives to the basket... Kevin Towns throws a bad pass! Stolen by Ayo Griffin! TURNOVER! (live ball)

[01:01] Team_077 possession (Score: 38-49)
Dejounte Quickley attempts a 3Pt. Wide open! D'Angelo Anunoby is 6.4 feet away. [ZONE] DEJOUNTE QUICKLEY MAKES IT! Assist: Jordan Simmons
Score: 38-52

[00:45] Team_075 possession (Score: 38-52)
Donovan Paul drives and kicks out. LeBron Ginobili attempts a 3Pt. Wide open! Dejounte Quickley is 6.5 feet away. [MAN] LeBron Ginobili misses. Rebound secured by Ayo Griffin.

[00:28] Team_077 possession (Score: 38-52)
Ayo Griffin drives and kicks out. Dejounte Quickley attempts a 3Pt. Wide open! D'Angelo Anunoby is 7.7 feet away. [ZONE] DEJOUNTE QUICKLEY MAKES IT! Assist: Tyler Poole
Score: 38-55

[00:14] Team_075 possession (Score: 38-55)
D'Angelo Anunoby loses the ball! Stripped by Bam Bryant! TURNOVER! (live ball)

================================================================================
                              2ND QUARTER COMPLETE                              
================================================================================

2ND QUARTER SCORE: Team_075 11, Team_077 29

BOX SCORE:
================================================================================

Team_075
--------------------------------------------------------------------------------
Player                MIN  PTS  REB  AST  TO      FG   FG%      3P   3P%
--------------------------------------------------------------------------------
Larry McCollum         15    4    0    0   0   2/2   100.0     0/0   0.0
Donovan Paul            9    2    0    0   0   1/3    33.3     0/0   0.0
Kevin Towns             9    2    4    0   0   1/3    33.3     0/0   0.0
D'Angelo Anunoby        9    2    1    1   0   1/3    33.3     0/0   0.0
Derrick Stewart        15    1    1    0   0   1/4    25.0     0/0   0.0
Kawhi Ingram           15    0    0    0   0   0/1     0.0     0/0   0.0
Klay Jokic             15    0    1    0   0   0/1     0.0     0/0   0.0
Collin Duncan           9    0    2    0   0   0/0     0.0     0/0   0.0
LeBron Ginobili         9    0    0    1   0   0/0     0.0     0/0   0.0

TEAM: FG: 6/17 (35.3%), 3PT: 0/4 (0.0%), REB: 9 (2 off, 7 def), AST: 2, TO: 6
TEAM FOULS: 3


Team_077
--------------------------------------------------------------------------------
Player                MIN  PTS  REB  AST  TO      FG   FG%      3P   3P%
--------------------------------------------------------------------------------
Ja Ball                17    8    0    2   0   3/3   100.0     0/0   0.0
Bam Bryant              7    6    0    0   0   2/3    66.7     0/0   0.0
Dejounte Quickley       9    6    0    1   0   2/3    66.7     0/0   0.0
Chris Ginobili         15    3    0    1   0   1/2    50.0     0/0   0.0
Dejounte Allen         15    2    0    2   0   1/2    50.0     0/0   0.0
Russell Harden         15    2    1    0   0   1/1   100.0     0/0   0.0
Tyler Poole             9    2    1    1   0   1/1   100.0     0/0   0.0
Draymond Dosunmu       15    0    5    0   0   0/0     0.0     0/0   0.0
Jordan Simmons          9    0    4    1   0   0/1     0.0     0/0   0.0
Ayo Griffin             9    0    3    1   0   0/2     0.0     0/0   0.0

TEAM: FG: 11/18 (61.1%), 3PT: 6/9 (66.7%), REB: 14 (3 off, 11 def), AST: 9, TO: 4
TEAM FOULS: 3

================================================================================

================================================================================
                       3RD QUARTER - Team_075 vs Team_077                       
================================================================================

[12:00] Team_075 possession (Score: 38-55)
Derrick Stewart attempts a 3Pt. Contested by Ja Ball (3.2 feet, ZONE). Derrick Stewart misses. Rebound secured by Russell Harden.

[11:48] Team_077 possession (Score: 38-55)
FOUL! Holding foul on Derrick Stewart. [Team fouls: 1] No free throws, side out. (Derrick Stewart: 1 personal fouls)

[11:37] Team_077 possession (Score: 38-55)
Ja Ball attempts a Midrange. Contested by Larry McCollum (4.8 feet, MAN). Ja Ball misses. Rebound secured by Klay Jokic.

[11:19] Team_075 possession (Score: 38-55)
Derrick Stewart attempts a Layup. BLOCKED BY RUSSELL HARDEN! Ball deflects out of bounds off Derrick Stewart.

[11:05] Team_077 possession (Score: 38-55)
Dejounte Allen attempts a Layup. Wide open! Derrick Stewart is 6.2 feet away. [ZONE] DEJOUNTE ALLEN MAKES IT! Assist: Ja Ball
Score: 38-57

[10:52] Team_075 possession (Score: 38-57)
Derrick Stewart attempts a Midrange. Contested by Draymond Dosunmu (4.8 feet, ZONE). Derrick Stewart misses. Rebound secured by Russell Harden.

[10:37] Team_077 possession (Score: 38-57)
Russell Harden loses control! Ball rolls out of bounds! TURNOVER! (dead ball)

[10:26] Team_075 possession (Score: 38-57)
Kawhi Ingram drives to the basket... Kawhi Ingram throws a bad pass out of bounds! TURNOVER! (dead ball)

[10:07] Team_077 possession (Score: 38-57)
Chris Ginobili attempts a 3Pt. Wide open! Myles Barrett is 8.6 feet away. [MAN] Chris Ginobili misses. Rebound secured by Klay Jokic.

[09:54] Team_075 possession (Score: 38-57)
FOUL! Reach-in foul on Draymond Dosunmu during the drive. [Team fouls: 1] No free throws, side out. (Draymond Dosunmu: 1 personal fouls)

[09:40] Team_075 possession (Score: 38-57)
Kawhi Ingram attempts a 3Pt. Contested by Dejounte Allen (4.2 feet, MAN). Kawhi Ingram misses. Rebound secured by Draymond Dosunmu.

[09:29] Team_077 possession (Score: 38-57)
Chris Ginobili attempts a 3Pt. Wide open! Myles Barrett is 8.3 feet away. [MAN] Chris Ginobili misses. Rebound secured by Kawhi Ingram.

[09:19] Team_075 possession (Score: 38-57)
Larry McCollum commits a violation (traveling/carry)! TURNOVER! (dead ball)

[09:05] Team_077 possession (Score: 38-57)
Dejounte Allen attempts a Layup. Contested by Kawhi Ingram (4.3 feet, MAN). Dejounte Allen misses. Rebound secured by Derrick Stewart.

[08:55] Team_075 possession (Score: 38-57)
Kawhi Ingram loses control! Ball rolls out of bounds! TURNOVER! (dead ball)

[08:38] Team_077 possession (Score: 38-57)
Chris Ginobili attempts a 3Pt. Contested by Derrick Stewart (5.4 feet, ZONE). Chris Ginobili misses. Rebound secured by Kawhi Ingram.

[08:24] Team_075 possession (Score: 38-57)
Myles Barrett drives to the basket... Myles Barrett loses the ball! Stripped by Chris Ginobili! TURNOVER! (live ball)

[08:09] Team_077 possession (Score: 38-57)
Draymond Dosunmu attempts a Layup. BLOCKED BY DERRICK STEWART! Ball is loose! Offensive rebound by Russell Harden! Russell Harden kicks it out.

[07:54] Team_077 possession (Score: 38-57)
Dejounte Allen loses the ball! Stripped by Kawhi Ingram! TURNOVER! (live ball)

[07:40] Team_075 possession (Score: 38-57)
Larry McCollum makes the Layup and draws the foul on Draymond Dosunmu! And-1! Larry McCollum to the line for 1. [Team fouls: 2] (Draymond Dosunmu: 2 personal fouls)   FT 1/1: GOOD Larry McCollum makes 1/1 from the line.
Score: 41-57

[07:25] Team_077 possession (Score: 41-57)
FOUL! Shooting foul on Derrick Stewart. Russell Harden to the line for 2 free throws. [Team fouls: 2] (Derrick Stewart: 2 personal fouls)   FT 1/2: MISS   FT 2/2: GOOD Russell Harden makes 1/2 from the line.
Score: 41-58

[07:06] Team_075 possession (Score: 41-58)
Kawhi Ingram makes the Layup and draws the foul on Ja Ball! And-1! Kawhi Ingram to the line for 1. [Team fouls: 3] (Ja Ball: 1 personal fouls)   FT 1/1: GOOD Kawhi Ingram makes 1/1 from the line.
Score: 44-58

[06:51] Team_077 possession (Score: 44-58)
Russell Harden attempts a Layup. BLOCKED BY LARRY MCCOLLUM! Ball is loose! Rebound secured by Kawhi Ingram.

[06:41] Team_075 possession (Score: 44-58)
Derrick Stewart attempts a Layup. Heavily contested by Russell Harden (1.8 feet, MAN)! Derrick Stewart misses. Offensive rebound by Derrick Stewart! Derrick Stewart kicks it out.

[06:29] Team_075 possession (Score: 44-58)
Kawhi Ingram attempts a 3Pt. Contested by Dejounte Allen (3.9 feet, ZONE). Kawhi Ingram misses. Rebound secured by Draymond Dosunmu.

[06:17] Team_077 possession (Score: 44-58)
Chris Ginobili attempts a 3Pt. Contested by Larry McCollum (5.0 feet, ZONE). CHRIS GINOBILI MAKES IT! Assist: Russell Harden
Score: 44-61

[06:03] Team_075 possession (Score: 44-61)
Klay Jokic drives to the basket... FOUL! Offensive foul on Klay Jokic! Draymond Dosunmu drew the charge! [Team fouls: 3] (Klay Jokic: 1 personal fouls) TURNOVER! (dead ball)

[05:47] Team_077 possession (Score: 44-61)
Ja Ball attempts a 3Pt. Wide open! Larry McCollum is 6.1 feet away. [MAN] Ja Ball misses. Offensive rebound by Draymond Dosunmu! Draymond Dosunmu kicks it out.

[05:34] Team_077 possession (Score: 44-61)
Ja Ball attempts a 3Pt. Contested by Larry McCollum (3.5 feet, ZONE). Ja Ball misses. Rebound secured by Klay Jokic.

[05:21] Team_075 possession (Score: 44-61)
Derrick Stewart drives, picks up Russell Harden. Help arrives from Ja Ball! Derrick Stewart attempts a Dunk. Contested by Ja Ball (2.2 feet, MAN). Derrick Stewart misses. Rebound secured by Draymond Dosunmu.

[05:02] Team_077 possession (Score: 44-61)
Ja Ball drives to the basket... Ja Ball commits a violation (traveling/carry)! TURNOVER! (dead ball)

[04:52] Team_075 possession (Score: 44-61)
Derrick Stewart commits a violation (traveling/carry)! TURNOVER! (dead ball)

[04:37] Team_077 possession (Score: 44-61)
FOUL! Offensive foul on Draymond Dosunmu! Klay Jokic drew the charge! [Team fouls: 4] (Draymond Dosunmu: 3 personal fouls) TURNOVER! (dead ball)

[04:21] Team_075 possession (Score: 44-61)
Kawhi Ingram attempts a 3Pt. Contested by Dejounte Allen (5.4 feet, ZONE). Kawhi Ingram misses. FOUL! Loose ball foul on Chris Ginobili during the rebound battle. [IN THE BONUS! 5 team fouls] Derrick Stewart to the line for 2 free throws. (Chris Ginobili: 1 personal fouls)   FT 1/2: GOOD   FT 2/2: GOOD Derrick Stewart makes 2/2 from the line.
Score: 46-61

[04:04] Team_077 possession (Score: 46-61)
Draymond Dosunmu throws a bad pass! Stolen by Klay Jokic! TURNOVER! (live ball)

[03:48] Team_075 possession (Score: 46-61)
Larry McCollum drives, Ja Ball stays with him. Larry McCollum attempts a Dunk. Contested by Ja Ball (5.1 feet, MAN). LARRY MCCOLLUM MAKES IT!
Score: 48-61

[03:34] Team_077 possession (Score: 48-61)
Russell Harden attempts a Layup. Contested by Derrick Stewart (4.7 feet, MAN). RUSSELL HARDEN MAKES IT! Assist: Chris Ginobili
Score: 48-63

[03:18] Team_075 possession (Score: 48-63)
Larry McCollum throws a bad pass! Stolen by Ja Ball! TURNOVER! (live ball)

[03:02] Team_077 possession (Score: 48-63)
Draymond Dosunmu drives and kicks out. Chris Ginobili attempts a Midrange. Contested by Kawhi Ingram (5.4 feet, ZONE). Chris Ginobili misses. Rebound secured by Klay Jokic.

[02:47] Team_075 possession (Score: 48-63)
Klay Jokic attempts a Layup. Contested by Draymond Dosunmu (4.9 feet, ZONE). KLAY JOKIC MAKES IT! Assist: Larry McCollum
Score: 50-63

[02:33] Team_077 possession (Score: 50-63)
Chris Ginobili drives, Myles Barrett stays with him. Chris Ginobili attempts a Layup. Wide open! Myles Barrett is 6.4 feet away. [MAN] Chris Ginobili misses. Rebound secured by Kawhi Ingram.

[02:19] Team_075 possession (Score: 50-63)
Klay Jokic drives to the basket... Klay Jokic throws a bad pass! Stolen by Draymond Dosunmu! TURNOVER! (live ball)

[02:08] Team_077 possession (Score: 50-63)
Ja Ball attempts a 3Pt. Contested by Larry McCollum (2.7 feet, MAN). JA BALL MAKES IT! Assist: Draymond Dosunmu
Score: 50-66

[01:53] Team_075 possession (Score: 50-66)
Klay Jokic drives to the basket... Klay Jokic loses the ball! Stripped by Draymond Dosunmu! TURNOVER! (live ball)

[01:36] Team_077 possession (Score: 50-66)
FOUL! Holding foul on Klay Jokic. [Team fouls: 4] No free throws, side out. (Klay Jokic: 2 personal fouls)

[01:25] Team_077 possession (Score: 50-66)
Russell Harden attempts a Layup. Contested by Derrick Stewart (4.8 feet, MAN). RUSSELL HARDEN MAKES IT! Assist: Ja Ball
Score: 50-68

[01:13] Team_075 possession (Score: 50-68)
Derrick Stewart attempts a Layup. Contested by Draymond Dosunmu (2.3 feet, ZONE). Derrick Stewart misses. FOUL! Loose ball foul on Chris Ginobili during the rebound battle. [IN THE BONUS! 6 team fouls] Derrick Stewart to the line for 2 free throws. (Chris Ginobili: 2 personal fouls)   FT 1/2: GOOD   FT 2/2: GOOD Derrick Stewart makes 2/2 from the line.
Score: 52-68

[00:54] Team_077 possession (Score: 52-68)
Ja Ball attempts a 3Pt. Contested by Larry McCollum (3.4 feet, MAN). JA BALL MAKES IT! Assist: Dejounte Allen
Score: 52-71

[00:42] Team_075 possession (Score: 52-71)
Larry McCollum attempts a Midrange. Contested by Ja Ball (6.0 feet, MAN). LARRY MCCOLLUM MAKES IT! Assist: Kawhi Ingram
Score: 54-71

[00:23] Team_077 possession (Score: 54-71)
Dejounte Allen loses control! Ball rolls out of bounds! TURNOVER! (dead ball)

[00:23] Substitution (Team_075): Larry McCollum OUT → D'Angelo Anunoby IN (stamina_rule2)

[00:23] Substitution (Team_075): Kawhi Ingram OUT → LeBron Ginobili IN (stamina_rule2)

[00:23] Substitution (Team_075): Myles Barrett OUT → Donovan Paul IN (stamina_rule2)

[00:23] Substitution (Team_075): Derrick Stewart OUT → Collin Duncan IN (stamina_rule2)

[00:23] Substitution (Team_075): Klay Jokic OUT → Kevin Towns IN (stamina_rule2)

[00:23] Substitution (Team_077): Ja Ball OUT → Bam Bryant IN (stamina_rule2)

[00:23] Substitution (Team_077): Dejounte Allen OUT → Dejounte Quickley IN (stamina_rule2)

[00:23] Substitution (Team_077): Chris Ginobili OUT → Tyler Poole IN (stamina_rule2)

[00:23] Substitution (Team_077): Russell Harden OUT → Jordan Simmons IN (stamina_rule2)

[00:23] Substitution (Team_077): Draymond Dosunmu OUT → Ayo Griffin IN (stamina_rule2)

[00:08] Team_075 possession (Score: 54-71)
Donovan Paul attempts a 3Pt. Contested by Dejounte Quickley (4.7 feet, ZONE). Donovan Paul misses. Offensive rebound by Kevin Towns! Kevin Towns kicks it out.

================================================================================
                              3RD QUARTER COMPLETE                              
================================================================================

3RD QUARTER SCORE: Team_075 16, Team_077 16

BOX SCORE:
================================================================================

Team_075
--------------------------------------------------------------------------------
Player                MIN  PTS  REB  AST  TO      FG   FG%      3P   3P%
--------------------------------------------------------------------------------
Larry McCollum         27    7    0    1   0   3/3   100.0     0/0   0.0
Derrick Stewart        27    4    2    0   0   2/6    33.3     0/0   0.0
Kawhi Ingram           27    3    4    1   0   1/3    33.3     0/0   0.0
Klay Jokic             27    2    4    0   0   1/1   100.0     0/0   0.0
Kevin Towns             9    0    1    0   0   0/0     0.0     0/0   0.0

TEAM: FG: 7/13 (53.8%), 3PT: 1/4 (25.0%), REB: 11 (2 off, 9 def), AST: 2, TO: 9
TEAM FOULS: 4


Team_077
--------------------------------------------------------------------------------
Player                MIN  PTS  REB  AST  TO      FG   FG%      3P   3P%
--------------------------------------------------------------------------------
Ja Ball                29    6    0    2   0   2/4    50.0     0/0   0.0
Russell Harden         27    5    3    1   0   3/4    75.0     0/0   0.0
Chris Ginobili         27    3    0    1   0   1/5    20.0     0/0   0.0
Dejounte Allen         27    2    0    1   0   1/2    50.0     0/0   0.0
Draymond Dosunmu       27    0    4    1   0   0/1     0.0     0/0   0.0

TEAM: FG: 7/16 (43.8%), 3PT: 3/7 (42.9%), REB: 7 (2 off, 5 def), AST: 6, TO: 6
TEAM FOULS: 6 [Team_075 in BONUS]

================================================================================

================================================================================
                       4TH QUARTER - Team_075 vs Team_077                       
================================================================================

[12:00] Substitution (Team_075): Larry McCollum OUT (stamina: 69) → D'Angelo Anunoby IN (comeback_detected)

[12:00] Substitution (Team_077): Ja Ball OUT (stamina: 72) → Bam Bryant IN (comeback_detected)

[12:00] Team_075 possession (Score: 54-71)
Myles Barrett makes the Layup and draws the foul on Draymond Dosunmu! And-1! Myles Barrett to the line for 1. [Team fouls: 1] (Draymond Dosunmu: 1 personal fouls)   FT 1/1: MISS Myles Barrett makes 0/1 from the line. Rebound secured by Draymond Dosunmu.
Score: 56-71

[11:47] Team_077 possession (Score: 56-71)
Dejounte Allen drives to the basket... Dejounte Allen loses control! Ball rolls out of bounds! TURNOVER! (dead ball)

[11:47] Substitution (Team_075): Kawhi Ingram OUT → LeBron Ginobili IN (stamina_rule2)

[11:47] Substitution (Team_075): Myles Barrett OUT → Donovan Paul IN (stamina_rule2)

[11:47] Substitution (Team_075): Derrick Stewart OUT → Collin Duncan IN (stamina_rule2)

[11:47] Substitution (Team_075): Klay Jokic OUT → Kevin Towns IN (stamina_rule2)

[11:47] Substitution (Team_077): Dejounte Allen OUT → Dejounte Quickley IN (stamina_rule2)

[11:47] Substitution (Team_077): Chris Ginobili OUT → Tyler Poole IN (stamina_rule2)

[11:47] Substitution (Team_077): Russell Harden OUT → Jordan Simmons IN (stamina_rule2)

[11:47] Substitution (Team_077): Draymond Dosunmu OUT → Ayo Griffin IN (stamina_rule2)

[11:32] Team_075 possession (Score: 56-71)
Kevin Towns drives and kicks out. D'Angelo Anunoby attempts a Midrange. Wide open! Bam Bryant is 7.7 feet away. [MAN] D'Angelo Anunoby misses. Rebound secured by Ayo Griffin.

[11:17] Team_077 possession (Score: 56-71)
Tyler Poole attempts a Layup. Contested by Kevin Towns (3.3 feet, ZONE). TYLER POOLE MAKES IT! Assist: Dejounte Quickley
Score: 56-73

[11:02] Team_075 possession (Score: 56-73)
D'Angelo Anunoby makes the Layup and draws the foul on Bam Bryant! And-1! D'Angelo Anunoby to the line for 1. [Team fouls: 2] (Bam Bryant: 1 personal fouls)   FT 1/1: MISS D'Angelo Anunoby makes 0/1 from the line. Rebound secured by Tyler Poole.
Score: 58-73

[10:51] Team_077 possession (Score: 58-73)
Bam Bryant attempts a 3Pt. Wide open! D'Angelo Anunoby is 8.6 feet away. [ZONE] BAM BRYANT MAKES IT! Assist: Jordan Simmons
Score: 58-76

[10:33] Team_075 possession (Score: 58-76)
D'Angelo Anunoby attempts a Midrange. Contested by Dejounte Quickley (5.6 feet, ZONE). D'Angelo Anunoby misses. Rebound secured by Tyler Poole.

[10:16] Team_077 possession (Score: 58-76)
Dejounte Quickley attempts a 3Pt. Wide open! LeBron Ginobili is 6.7 feet away. [MAN] Dejounte Quickley misses. Rebound secured by Kevin Towns.

[10:04] Team_075 possession (Score: 58-76)
LeBron Ginobili attempts a Midrange. Contested by Dejounte Quickley (3.8 feet, MAN). LEBRON GINOBILI MAKES IT!
Score: 60-76

[09:48] Team_077 possession (Score: 60-76)
Tyler Poole attempts a 3Pt. Contested by LeBron Ginobili (5.2 feet, ZONE). TYLER POOLE MAKES IT! Assist: Dejounte Quickley
Score: 60-79

[09:36] Team_075 possession (Score: 60-79)
Kevin Towns attempts a Layup. Contested by Jordan Simmons (5.0 feet, ZONE). KEVIN TOWNS MAKES IT! Assist: Donovan Paul
Score: 62-79

[09:22] Team_077 possession (Score: 62-79)
Jordan Simmons attempts a Midrange. Contested by LeBron Ginobili (5.1 feet, ZONE). JORDAN SIMMONS MAKES IT! Assist: Bam Bryant
Score: 62-81

[09:09] Team_075 possession (Score: 62-81)
FOUL! Shooting foul on Dejounte Quickley. Collin Duncan to the line for 2 free throws. [Team fouls: 3] (Dejounte Quickley: 1 personal fouls)   FT 1/2: GOOD   FT 2/2: GOOD Collin Duncan makes 2/2 from the line.
Score: 64-81

[08:55] Team_077 possession (Score: 64-81)
Ayo Griffin drives and kicks out. Bam Bryant attempts a 3Pt. Wide open! D'Angelo Anunoby is 6.9 feet away. [ZONE] Bam Bryant misses. Offensive rebound by Ayo Griffin! Ayo Griffin puts it back in!
Score: 64-83

[08:42] Team_075 possession (Score: 64-83)
D'Angelo Anunoby attempts a 3Pt. Contested by Bam Bryant (5.8 feet, MAN). D'ANGELO ANUNOBY MAKES IT! Assist: Donovan Paul
Score: 67-83

[08:31] Team_077 possession (Score: 67-83)
Ayo Griffin drives, Kevin Towns stays with him. Ayo Griffin attempts a Dunk. Contested by Kevin Towns (5.1 feet, MAN). Ayo Griffin misses. Rebound secured by Collin Duncan.

[08:13] Team_075 possession (Score: 67-83)
LeBron Ginobili attempts a 3Pt. Wide open! Dejounte Quickley is 8.2 feet away. [MAN] LEBRON GINOBILI MAKES IT! Assist: Kevin Towns
Score: 70-83

[07:56] Team_077 possession (Score: 70-83)
Jordan Simmons attempts a Midrange. Wide open! Collin Duncan is 7.0 feet away. [MAN] Jordan Simmons misses. Rebound secured by Collin Duncan.

[07:41] Team_075 possession (Score: 70-83)
Kevin Towns loses control! Ball rolls out of bounds! TURNOVER! (dead ball)

[07:26] Team_077 possession (Score: 70-83)
Bam Bryant attempts a 3Pt. Contested by D'Angelo Anunoby (2.6 feet, ZONE). Bam Bryant misses. Rebound secured by D'Angelo Anunoby.

[07:08] Team_075 possession (Score: 70-83)
Donovan Paul drives, Tyler Poole stays with him. Donovan Paul attempts a Layup. Contested by Tyler Poole (4.5 feet, MAN). DONOVAN PAUL MAKES IT! Assist: Collin Duncan
Score: 72-83

[06:56] Team_077 possession (Score: 72-83)
FOUL! Shooting foul on D'Angelo Anunoby. Bam Bryant to the line for 2 free throws. [Team fouls: 1] (D'Angelo Anunoby: 1 personal fouls)   FT 1/2: GOOD   FT 2/2: GOOD Bam Bryant makes 2/2 from the line.
Score: 72-85

[06:42] Team_075 possession (Score: 72-85)
LeBron Ginobili attempts a 3Pt. Contested by Dejounte Quickley (3.5 feet, MAN). LeBron Ginobili misses. Rebound secured by Tyler Poole.

[06:28] Team_077 possession (Score: 72-85)
Tyler Poole attempts a 3Pt. Contested by D'Angelo Anunoby (5.7 feet, ZONE). Tyler Poole misses. Rebound secured by Kevin Towns.

[06:13] Team_075 possession (Score: 72-85)
D'Angelo Anunoby attempts a 3Pt. Contested by Bam Bryant (3.8 feet, ZONE). D'ANGELO ANUNOBY MAKES IT! Assist: LeBron Ginobili
Score: 75-85

[05:58] Team_077 possession (Score: 75-85)
Jordan Simmons throws a bad pass out of bounds! TURNOVER! (dead ball)

[05:42] Team_075 possession (Score: 75-85)
Collin Duncan attempts a Midrange. Wide open! Tyler Poole is 6.2 feet away. [ZONE] Collin Duncan misses. Offensive rebound by Collin Duncan! Collin Duncan kicks it out.

[05:28] Team_075 possession (Score: 75-85)
Kevin Towns attempts a 3Pt. Contested by Dejounte Quickley (3.3 feet, ZONE). KEVIN TOWNS MAKES IT! Assist: LeBron Ginobili
Score: 78-85

[05:17] Team_077 possession (Score: 78-85)
Dejounte Quickley attempts a 3Pt. Contested by D'Angelo Anunoby (4.2 feet, ZONE). Dejounte Quickley misses. Rebound secured by Kevin Towns.

[05:02] Team_075 possession (Score: 78-85)
D'Angelo Anunoby drives, Bam Bryant stays with him. D'Angelo Anunoby attempts a Layup. Contested by Bam Bryant (5.2 feet, MAN). D'Angelo Anunoby misses. Rebound secured by Ayo Griffin.

[04:47] Team_077 possession (Score: 78-85)
Dejounte Quickley attempts a 3Pt. Contested by D'Angelo Anunoby (4.2 feet, ZONE). Dejounte Quickley misses. Offensive rebound by Jordan Simmons! Jordan Simmons kicks it out.

[04:29] Team_077 possession (Score: 78-85)
FOUL! Holding foul on LeBron Ginobili. [Team fouls: 2] No free throws, side out. (LeBron Ginobili: 1 personal fouls)

[04:17] Team_077 possession (Score: 78-85)
Jordan Simmons drives and kicks out. Jordan Simmons attempts a Midrange. Wide open! D'Angelo Anunoby is 9.2 feet away. [ZONE] Jordan Simmons misses. Rebound secured by Kevin Towns.

[04:05] Team_075 possession (Score: 78-85)
Collin Duncan drives to the basket... Collin Duncan throws a bad pass! Stolen by Jordan Simmons! TURNOVER! (live ball)

[03:50] Team_077 possession (Score: 78-85)
Ayo Griffin drives, picks up Kevin Towns. Help arrives from D'Angelo Anunoby! Ayo Griffin attempts a Layup. Contested by D'Angelo Anunoby (4.5 feet, ZONE). Ayo Griffin misses. Rebound secured by Collin Duncan.

[03:35] Team_075 possession (Score: 78-85)
D'Angelo Anunoby attempts a Midrange. Wide open! Tyler Poole is 6.2 feet away. [ZONE] D'Angelo Anunoby misses. Rebound secured by Tyler Poole.

[03:18] Team_077 possession (Score: 78-85)
FOUL! Holding foul on LeBron Ginobili. [Team fouls: 3] No free throws, side out. (LeBron Ginobili: 2 personal fouls)

[03:04] Team_077 possession (Score: 78-85)
Tyler Poole drives, picks up Donovan Paul. Help arrives from D'Angelo Anunoby! Tyler Poole attempts a Dunk. Contested by D'Angelo Anunoby (5.8 feet, MAN). TYLER POOLE MAKES IT!
Score: 78-87

[02:48] Team_075 possession (Score: 78-87)
Donovan Paul attempts a 3Pt. Wide open! Tyler Poole is 6.2 feet away. [MAN] DONOVAN PAUL MAKES IT! Assist: Collin Duncan
Score: 81-87

[02:36] Team_077 possession (Score: 81-87)
Dejounte Quickley makes the Dunk and draws the foul on D'Angelo Anunoby! And-1! Dejounte Quickley to the line for 1. [Team fouls: 4] (D'Angelo Anunoby: 2 personal fouls)   FT 1/1: GOOD Dejounte Quickley makes 1/1 from the line.
Score: 81-90

[02:22] Team_075 possession (Score: 81-90)
Donovan Paul throws a bad pass! Stolen by Tyler Poole! TURNOVER! (live ball)

[02:09] Team_077 possession (Score: 81-90)
Jordan Simmons makes the Layup and draws the foul on D'Angelo Anunoby! And-1! Jordan Simmons to the line for 1. [BONUS: 5 team fouls] (D'Angelo Anunoby: 3 personal fouls)   FT 1/1: GOOD Jordan Simmons makes 1/1 from the line.
Score: 81-93

[01:51] Team_075 possession (Score: 81-93)
D'Angelo Anunoby attempts a 3Pt. Contested by Dejounte Quickley (4.5 feet, ZONE). D'Angelo Anunoby misses. Rebound secured by Tyler Poole.

[01:32] Team_077 possession (Score: 81-93)
Dejounte Quickley attempts a Layup. Contested by Kevin Towns (3.4 feet, ZONE). DEJOUNTE QUICKLEY MAKES IT!
Score: 81-95

[01:20] Team_075 possession (Score: 81-95)
Collin Duncan attempts a Layup. Contested by Jordan Simmons (4.5 feet, MAN). COLLIN DUNCAN MAKES IT! Assist: Donovan Paul
Score: 83-95

[01:07] Team_077 possession (Score: 83-95)
Jordan Simmons attempts a Layup. Contested by Kevin Towns (5.2 feet, ZONE). Jordan Simmons misses. Offensive rebound by Ayo Griffin! Ayo Griffin kicks it out.

[00:50] Team_077 possession (Score: 83-95)
Bam Bryant attempts a 3Pt. Contested by D'Angelo Anunoby (4.9 feet, ZONE). BAM BRYANT MAKES IT! Assist: Jordan Simmons
Score: 83-98

[00:32] Team_075 possession (Score: 83-98)
FOUL! Reach-in foul on Tyler Poole during the drive. [Team fouls: 4] No free throws, side out. (Tyler Poole: 1 personal fouls)

[00:18] Team_075 possession (Score: 83-98)
Donovan Paul attempts a 3Pt. Wide open! Dejounte Quickley is 7.3 feet away. [ZONE] DONOVAN PAUL MAKES IT! Assist: Kevin Towns
Score: 86-98

[00:03] Team_077 possession (Score: 86-98)
Dejounte Quickley drives and kicks out. Dejounte Quickley attempts a 3Pt. Wide open! D'Angelo Anunoby is 9.7 feet away. [ZONE] Dejounte Quickley misses. Rebound secured by Collin Duncan.

================================================================================
                              4TH QUARTER COMPLETE                              
================================================================================

4TH QUARTER SCORE: Team_075 32, Team_077 27

BOX SCORE:
================================================================================

Team_075
--------------------------------------------------------------------------------
Player                MIN  PTS  REB  AST  TO      FG   FG%      3P   3P%
--------------------------------------------------------------------------------
Donovan Paul           21    8    0    3   0   3/3   100.0     0/0   0.0
D'Angelo Anunoby       22    6    1    0   0   2/7    28.6     0/0   0.0
Kevin Towns            21    5    4    2   0   2/3    66.7     0/0   0.0
LeBron Ginobili        21    5    0    2   0   2/3    66.7     0/0   0.0
Collin Duncan          21    4    5    2   0   2/2   100.0     0/0   0.0
Myles Barrett          27    0    0    0   0   0/1     0.0     0/0   0.0

TEAM: FG: 11/19 (57.9%), 3PT: 6/8 (75.0%), REB: 10 (1 off, 9 def), AST: 9, TO: 3
TEAM FOULS: 5 [Team_077 in BONUS]


Team_077
--------------------------------------------------------------------------------
Player                MIN  PTS  REB  AST  TO      FG   FG%      3P   3P%
--------------------------------------------------------------------------------
Bam Bryant             20    8    0    1   0   3/4    75.0     0/0   0.0
Tyler Poole            21    7    5    0   0   3/4    75.0     0/0   0.0
Dejounte Quickley      21    5    0    2   0   2/5    40.0     0/0   0.0
Jordan Simmons         21    5    1    2   0   2/4    50.0     0/0   0.0
Ayo Griffin            21    2    4    0   0   1/3    33.3     0/0   0.0
Draymond Dosunmu       27    0    1    0   0   0/0     0.0     0/0   0.0

TEAM: FG: 11/20 (55.0%), 3PT: 3/7 (42.9%), REB: 11 (3 off, 8 def), AST: 5, TO: 2
TEAM FOULS: 4

================================================================================

================================================================================
                               FULL GAME COMPLETE                               
================================================================================

FINAL SCORE: Team_075 86, Team_077 98

SCORING BY QUARTER:
--------------------------------------------------------------------------------
Team                     Q1     Q2     Q3     Q4    FINAL
--------------------------------------------------------------------------------
Team_075                 27     11     16     32       86
Team_077                 26     29     16     27       98
--------------------------------------------------------------------------------

FULL GAME BOX SCORE:
================================================================================

Team_075
--------------------------------------------------------------------------------
Player                MIN  PTS  REB  AST  TO      FG   FG%      3P   3P%      FT STL BLK
--------------------------------------------------------------------------------
Kawhi Ingram           27    5    5    1   2   3/7    42.9   1/3    33.3   1/1     2   0
Myles Barrett          27    0    0    1   1   0/2     0.0   0/1     0.0   0/1     0   0
Derrick Stewart        27   15    6    0   4   6/14   42.9   1/3    33.3   6/7     2   1
Klay Jokic             27   14    7    1   3   7/10   70.0   0/1     0.0   4/4     1   0
Larry McCollum         27   11    0    3   4   4/5    80.0   0/1     0.0   1/1     0   1
D'Angelo Anunoby       22    8    3    2   2   3/10   30.0   2/4    50.0   0/1     0   0
LeBron Ginobili        21    8    0    3   0   3/4    75.0   2/3    66.7   0/0     0   0
Donovan Paul           21   10    0    3   1   4/7    57.1   2/4    50.0   0/0     0   0
Collin Duncan          21    4    8    2   2   2/3    66.7   0/0     0.0   2/2     0   0
Kevin Towns            21    7    9    2   2   3/7    42.9   1/3    33.3   0/0     1   0

TEAM: FG: 35/69 (50.7%), 3PT: 9/23 (39.1%), REB: 37 (7 off, 30 def), AST: 18, TO: 21


Team_077
--------------------------------------------------------------------------------
Player                MIN  PTS  REB  AST  TO      FG   FG%      3P   3P%      FT STL BLK
--------------------------------------------------------------------------------
Ja Ball                29   21    1    8   2   8/11   72.7   5/7    71.4   0/0     1   1
Dejounte Allen         27   13    0    3   4   4/6    66.7   3/4    75.0   0/0     0   1
Chris Ginobili         27    6    2    2   0   3/9    33.3   2/5    40.0   0/0     1   0
Russell Harden         27    9    6    3   3   5/8    62.5   0/0     0.0   1/2     1   2
Draymond Dosunmu       27    4   13    1   5   2/4    50.0   0/0     0.0   0/0     2   0
Dejounte Quickley      21   11    0    3   1   3/8    37.5   1/4    25.0   1/1     0   0
Tyler Poole            21    9    6    1   0   4/5    80.0   1/2    50.0   2/2     1   0
Jordan Simmons         21    9    5    3   1   4/7    57.1   0/0     0.0   1/1     2   0
Ayo Griffin            21    2    9    1   1   2/6    33.3   0/0     0.0   0/0     1   0
Bam Bryant             20   14    0    1   1   5/7    71.4   4/6    66.7   2/2     1   0

TEAM: FG: 40/71 (56.3%), 3PT: 16/28 (57.1%), REB: 43 (11 off, 32 def), AST: 26, TO: 18

================================================================================
