================================================================================
                        FULL GAME - Team_006 vs Team_046                        
================================================================================

================================================================================
                       1ST QUARTER - Team_006 vs Team_046                       
================================================================================

[12:00] Team_006 possession (Score: 0-0)
Franz Wagner attempts a 3Pt. Wide open! Victor Nowitzki is 7.3 feet away. [MAN] FRANZ WAGNER MAKES IT! Assist: Bradley Gobert
Score: 3-0

[11:44] Team_046 possession (Score: 3-0)
Kevin Allen drives to the basket... FOUL! Offensive foul on Kevin Allen! Bradley Gobert drew the charge! [Team fouls: 1] (Kevin Allen: 1 personal fouls) TURNOVER! (dead ball)

[11:31] Team_006 possession (Score: 3-0)
Jayson Young attempts a 3Pt. Contested by Lauri Carter (4.6 feet, MAN). JAYSON YOUNG MAKES IT! Assist: Ja Butler
Score: 6-0

[11:15] Team_046 possession (Score: 6-0)
Cade Wall attempts a 3Pt. Wide open! Shai Westbrook is 6.2 feet away. [ZONE] Cade Wall misses. Rebound secured by Shai Westbrook.

[11:03] Team_006 possession (Score: 6-0)
Franz Wagner drives and kicks out. Jayson Young attempts a 3Pt. Contested by Lauri Carter (4.5 feet, MAN). Jayson Young misses. Rebound secured by Cade Wall.

[10:49] Team_046 possession (Score: 6-0)
Cade Wall attempts a 3Pt. Contested by Ja Butler (2.4 feet, MAN). Cade Wall misses. Rebound secured by Bradley Gobert.

[10:37] Team_006 possession (Score: 6-0)
Jayson Young attempts a 3Pt. Contested by Lauri Carter (4.9 feet, MAN). JAYSON YOUNG MAKES IT! Assist: Bradley Gobert
Score: 9-0

[10:26] Team_046 possession (Score: 9-0)
Lauri Carter drives and kicks out. D'Angelo O'Neal attempts a Midrange. Contested by Shai Westbrook (2.7 feet, MAN). D'Angelo O'Neal misses. Rebound secured by Ja Butler.

[10:11] Team_006 possession (Score: 9-0)
Franz Wagner attempts a Layup. BLOCKED BY VICTOR NOWITZKI! Ball is loose! Rebound secured by Cade Wall.

[09:57] Team_046 possession (Score: 9-0)
Cade Wall attempts a Midrange. Wide open! Jayson Young is 8.0 feet away. [ZONE] Cade Wall misses. Offensive rebound by Cade Wall! Cade Wall kicks it out.

[09:41] Team_046 possession (Score: 9-0)
FOUL! Reach-in foul on Ja Butler during the drive. [Team fouls: 1] No free throws, side out. (Ja Butler: 1 personal fouls)

[09:23] Team_046 possession (Score: 9-0)
Kevin Allen drives, picks up Bradley Gobert. Help arrives from Shai Westbrook! Kevin Allen attempts a Layup. Heavily contested by Shai Westbrook (0.5 feet, ZONE)! Kevin Allen misses. Rebound secured by Bradley Gobert.

[09:08] Team_006 possession (Score: 9-0)
FOUL! Shooting foul on D'Angelo O'Neal. Ja Butler to the line for 2 free throws. [Team fouls: 2] (D'Angelo O'Neal: 1 personal fouls)   FT 1/2: GOOD   FT 2/2: GOOD Ja Butler makes 2/2 from the line.
Score: 11-0

[08:53] Team_046 possession (Score: 11-0)
FOUL! Reach-in foul on Bradley Gobert during the drive. [Team fouls: 2] No free throws, side out. (Bradley Gobert: 1 personal fouls)

[08:40] Team_046 possession (Score: 11-0)
D'Angelo O'Neal drives, Shai Westbrook stays with him. D'Angelo O'Neal attempts a Dunk. Wide open! Shai Westbrook is 7.2 feet away. [MAN] D'ANGELO O'NEAL MAKES IT! Assist: Victor Nowitzki
Score: 11-2

[08:25] Team_006 possession (Score: 11-2)
Shai Westbrook attempts a 3Pt. Contested by D'Angelo O'Neal (5.8 feet, MAN). Shai Westbrook misses. Rebound secured by Cade Wall.

[08:11] Team_046 possession (Score: 11-2)
D'Angelo O'Neal attempts a Midrange. Contested by Ja Butler (5.2 feet, ZONE). D'ANGELO O'NEAL MAKES IT! Assist: Lauri Carter
Score: 11-4

[07:56] Team_006 possession (Score: 11-4)
Franz Wagner attempts a 3Pt. Wide open! Victor Nowitzki is 6.6 feet away. [MAN] FRANZ WAGNER MAKES IT! Assist: Jayson Young
Score: 14-4

[07:39] Team_046 possession (Score: 14-4)
D'Angelo O'Neal drives to the basket... D'Angelo O'Neal throws a bad pass out of bounds! TURNOVER! (dead ball)

[07:26] Team_006 possession (Score: 14-4)
Shai Westbrook attempts a 3Pt. Contested by D'Angelo O'Neal (5.2 feet, MAN). Shai Westbrook misses. Rebound secured by Cade Wall.

[07:12] Team_046 possession (Score: 14-4)
Lauri Carter attempts a Layup. Contested by Jayson Young (3.9 feet, MAN). Lauri Carter misses. Offensive rebound by Kevin Allen! Kevin Allen kicks it out.

[06:58] Team_046 possession (Score: 14-4)
Victor Nowitzki attempts a 3Pt. Contested by Franz Wagner (3.7 feet, MAN). VICTOR NOWITZKI MAKES IT! Assist: D'Angelo O'Neal
Score: 14-7

[06:39] Team_006 possession (Score: 14-7)
Ja Butler makes the Midrange and draws the foul on Victor Nowitzki! And-1! Ja Butler to the line for 1. [Team fouls: 3] (Victor Nowitzki: 1 personal fouls)   FT 1/1: GOOD Ja Butler makes 1/1 from the line.
Score: 17-7

[06:23] Team_046 possession (Score: 17-7)
D'Angelo O'Neal drives, Shai Westbrook stays with him. D'Angelo O'Neal attempts a Dunk. Contested by Shai Westbrook (5.0 feet, MAN). D'ANGELO O'NEAL MAKES IT! Assist: Cade Wall
Score: 17-9

[06:09] Team_006 possession (Score: 17-9)
FOUL! Offensive foul on Ja Butler! Cade Wall drew the charge! [Team fouls: 3] (Ja Butler: 2 personal fouls) TURNOVER! (dead ball)

[05:59] Team_046 possession (Score: 17-9)
Lauri Carter attempts a Layup. Heavily contested by Ja Butler (0.6 feet, ZONE)! LAURI CARTER MAKES IT! Assist: D'Angelo O'Neal
Score: 17-11

[05:45] Team_006 possession (Score: 17-11)
FOUL! Reach-in foul on Kevin Allen during the drive. [Team fouls: 4] No free throws, side out. (Kevin Allen: 2 personal fouls)

[05:29] Team_006 possession (Score: 17-11)
Ja Butler drives and kicks out. Franz Wagner attempts a 3Pt. Wide open! Victor Nowitzki is 8.4 feet away. [MAN] FRANZ WAGNER MAKES IT! Assist: Shai Westbrook
Score: 20-11

[05:17] Team_046 possession (Score: 20-11)
Lauri Carter drives, Jayson Young stays with him. Lauri Carter attempts a Dunk. Contested by Jayson Young (3.9 feet, MAN). LAURI CARTER MAKES IT!
Score: 20-13

[05:02] Team_006 possession (Score: 20-13)
Bradley Gobert makes the Layup and draws the foul on D'Angelo O'Neal! And-1! Bradley Gobert to the line for 1. [BONUS: 5 team fouls] (D'Angelo O'Neal: 2 personal fouls)   FT 1/1: GOOD Bradley Gobert makes 1/1 from the line.
Score: 23-13

[04:48] Team_046 possession (Score: 23-13)
Victor Nowitzki throws a bad pass out of bounds! TURNOVER! (dead ball)

[04:33] Team_006 possession (Score: 23-13)
Ja Butler drives and kicks out. Bradley Gobert attempts a 3Pt. Contested by Lauri Carter (4.9 feet, ZONE). Bradley Gobert misses. FOUL! Loose ball foul on Cade Wall during the rebound battle. [IN THE BONUS! 6 team fouls] Bradley Gobert to the line for 2 free throws. (Cade Wall: 1 personal fouls)   FT 1/2: GOOD   FT 2/2: GOOD Bradley Gobert makes 2/2 from the line.
Score: 25-13

[04:17] Team_046 possession (Score: 25-13)
Cade Wall drives and kicks out. Victor Nowitzki attempts a Midrange. Heavily contested by Ja Butler (1.2 feet, ZONE)! VICTOR NOWITZKI MAKES IT! Assist: Lauri Carter
Score: 25-15

[04:07] Team_006 possession (Score: 25-15)
Jayson Young drives and kicks out. Shai Westbrook attempts a Midrange. Contested by D'Angelo O'Neal (3.7 feet, MAN). Shai Westbrook misses. Rebound secured by Cade Wall.

[03:55] Team_046 possession (Score: 25-15)
Victor Nowitzki makes the Dunk and draws the foul on Bradley Gobert! And-1! Victor Nowitzki to the line for 1. [Team fouls: 4] (Bradley Gobert: 2 personal fouls)   FT 1/1: MISS Victor Nowitzki makes 0/1 from the line. Rebound secured by Shai Westbrook.
Score: 25-17

[03:41] Team_006 possession (Score: 25-17)
Ja Butler attempts a Layup. Heavily contested by Kevin Allen (1.6 feet, ZONE)! JA BUTLER MAKES IT!
Score: 27-17

[03:28] Team_046 possession (Score: 27-17)
D'Angelo O'Neal attempts a 3Pt. Wide open! Ja Butler is 6.4 feet away. [ZONE] D'ANGELO O'NEAL MAKES IT! Assist: Cade Wall
Score: 27-20

[03:14] Team_006 possession (Score: 27-20)
Franz Wagner attempts a 3Pt. Contested by Lauri Carter (2.4 feet, ZONE). FRANZ WAGNER MAKES IT! Assist: Ja Butler
Score: 30-20

[03:00] Team_046 possession (Score: 30-20)
Kevin Allen drives, Bradley Gobert stays with him. Kevin Allen attempts a Dunk. Heavily contested by Bradley Gobert (0.5 feet, ZONE)! KEVIN ALLEN MAKES IT! Assist: Lauri Carter
Score: 30-22

[02:47] Team_006 possession (Score: 30-22)
Shai Westbrook attempts a 3Pt. Heavily contested by Lauri Carter (1.1 feet, ZONE)! Shai Westbrook misses. Rebound secured by Lauri Carter.

[02:37] Team_046 possession (Score: 30-22)
Kevin Allen drives to the basket... FOUL! Offensive foul on Kevin Allen! Bradley Gobert drew the charge! [Team fouls: 7] (Kevin Allen: 3 personal fouls) TURNOVER! (dead ball)

[02:18] Team_006 possession (Score: 30-22)
Bradley Gobert throws a bad pass! Stolen by Kevin Allen! TURNOVER! (live ball)

[02:02] Team_046 possession (Score: 30-22)
Cade Wall attempts a Layup. Contested by Ja Butler (2.6 feet, MAN). CADE WALL MAKES IT! Assist: Kevin Allen
Score: 30-24

[01:52] Team_006 possession (Score: 30-24)
Jayson Young attempts a Layup. Heavily contested by Lauri Carter (0.5 feet, MAN)! JAYSON YOUNG MAKES IT! Assist: Bradley Gobert
Score: 32-24

[01:33] Team_046 possession (Score: 32-24)
Cade Wall throws a bad pass! Stolen by Ja Butler! TURNOVER! (live ball)

[01:20] Team_006 possession (Score: 32-24)
Ja Butler drives, picks up Cade Wall. Help arrives from D'Angelo O'Neal! Ja Butler attempts a Dunk. Contested by D'Angelo O'Neal (4.3 feet, MAN). JA BUTLER MAKES IT! Assist: Franz Wagner
Score: 34-24

[01:09] Team_046 possession (Score: 34-24)
Victor Nowitzki drives to the basket... FOUL! Offensive foul on Victor Nowitzki! Bradley Gobert drew the charge! [Team fouls: 8] (Victor Nowitzki: 2 personal fouls) TURNOVER! (dead ball)

[00:55] Team_006 possession (Score: 34-24)
Jayson Young drives, Lauri Carter stays with him. Jayson Young attempts a Layup. Contested by Lauri Carter (4.9 feet, MAN). Jayson Young misses. Rebound secured by Cade Wall.

[00:44] Team_046 possession (Score: 34-24)
D'Angelo O'Neal attempts a 3Pt. Wide open! Shai Westbrook is 7.6 feet away. [MAN] D'Angelo O'Neal misses. Rebound secured by Shai Westbrook.

[00:32] Team_006 possession (Score: 34-24)
Shai Westbrook attempts a 3Pt. Wide open! D'Angelo O'Neal is 6.4 feet away. [MAN] Shai Westbrook misses. Rebound secured by Cade Wall.

[00:22] Team_046 possession (Score: 34-24)
Victor Nowitzki makes the Layup and draws the foul on Franz Wagner! And-1! Victor Nowitzki to the line for 1. [BONUS: 5 team fouls] (Franz Wagner: 1 personal fouls)   FT 1/1: MISS Victor Nowitzki makes 0/1 from the line. Rebound secured by Shai Westbrook.
Score: 34-26

[00:06] Team_006 possession (Score: 34-26)
Jayson Young attempts a 3Pt. Wide open! Lauri Carter is 6.3 feet away. [MAN] JAYSON YOUNG MAKES IT! Assist: Bradley Gobert
Score: 37-26

================================================================================
                              1ST QUARTER COMPLETE                              
================================================================================

1ST QUARTER SCORE: Team_006 37, Team_046 26

BOX SCORE:
================================================================================

Team_006
--------------------------------------------------------------------------------
Player                MIN  PTS  REB  AST  TO      FG   FG%      3P   3P%
--------------------------------------------------------------------------------
Franz Wagner           12   12    0    1   0   4/6    66.7     0/0   0.0
Jayson Young           12   11    0    1   0   4/6    66.7     0/0   0.0
Ja Butler              12    9    1    2   0   4/4   100.0     0/0   0.0
Bradley Gobert         12    5    2    4   0   2/2   100.0     0/0   0.0
Shai Westbrook         12    0    4    1   0   0/4     0.0     0/0   0.0

TEAM: FG: 14/22 (63.6%), 3PT: 6/10 (60.0%), REB: 7 (0 off, 7 def), AST: 9, TO: 2
TEAM FOULS: 5 [Team_046 in BONUS]


Team_046
--------------------------------------------------------------------------------
Player                MIN  PTS  REB  AST  TO      FG   FG%      3P   3P%
--------------------------------------------------------------------------------
D'Angelo O'Neal        12    9    0    2   0   4/5    80.0     0/0   0.0
Victor Nowitzki        12    5    0    1   0   2/4    50.0     0/0   0.0
Lauri Carter           12    4    1    3   0   2/3    66.7     0/0   0.0
Cade Wall              12    2    8    2   0   1/3    33.3     0/0   0.0
Kevin Allen            12    2    1    1   0   1/2    50.0     0/0   0.0

TEAM: FG: 10/17 (58.8%), 3PT: 2/5 (40.0%), REB: 10 (2 off, 8 def), AST: 9, TO: 6
TEAM FOULS: 8 [Team_006 in BONUS]

================================================================================

================================================================================
                       2ND QUARTER - Team_006 vs Team_046                       
================================================================================

[12:00] Team_006 possession (Score: 37-26)
Jayson Young makes the Layup and draws the foul on Lauri Carter! And-1! Jayson Young to the line for 1. [Team fouls: 1] (Lauri Carter: 1 personal fouls)   FT 1/1: MISS Jayson Young makes 0/1 from the line. Offensive rebound by Ja Butler! Ja Butler puts it back in!
Score: 41-26

[11:42] Team_046 possession (Score: 41-26)
Cade Wall attempts a Midrange. Contested by Ja Butler (2.7 feet, MAN). Cade Wall misses. Rebound secured by Bradley Gobert.

[11:23] Team_006 possession (Score: 41-26)
Franz Wagner attempts a 3Pt. Contested by Lauri Carter (3.6 feet, ZONE). Franz Wagner misses. Rebound secured by Kevin Allen.

[11:06] Team_046 possession (Score: 41-26)
Victor Nowitzki attempts a 3Pt. Contested by Shai Westbrook (2.3 feet, ZONE). VICTOR NOWITZKI MAKES IT!
Score: 41-29

[10:48] Team_006 possession (Score: 41-29)
Shai Westbrook attempts a Midrange. Contested by D'Angelo O'Neal (5.0 feet, MAN). SHAI WESTBROOK MAKES IT!
Score: 43-29

[10:31] Team_046 possession (Score: 43-29)
FOUL! Offensive foul on Kevin Allen! Bradley Gobert drew the charge! [Team fouls: 2] (Kevin Allen: 1 personal fouls) TURNOVER! (dead ball)

[10:18] Team_006 possession (Score: 43-29)
Ja Butler attempts a 3Pt. Wide open! Lauri Carter is 7.0 feet away. [ZONE] JA BUTLER MAKES IT! Assist: Shai Westbrook
Score: 46-29

[10:02] Team_046 possession (Score: 46-29)
Victor Nowitzki attempts a Midrange. Wide open! Franz Wagner is 6.9 feet away. [ZONE] VICTOR NOWITZKI MAKES IT!
Score: 46-31

[09:50] Team_006 possession (Score: 46-31)
FOUL! Shooting foul on Lauri Carter. Franz Wagner to the line for 3 free throws. [Team fouls: 3] (Lauri Carter: 2 personal fouls)   FT 1/3: MISS   FT 2/3: GOOD   FT 3/3: MISS Franz Wagner makes 1/3 from the line. Rebound secured by Lauri Carter.
Score: 47-31

[09:41] Team_046 possession (Score: 47-31)
Kevin Allen attempts a Midrange. Wide open! Bradley Gobert is 6.9 feet away. [MAN] Kevin Allen misses. Rebound secured by Bradley Gobert.

[09:28] Team_006 possession (Score: 47-31)
Shai Westbrook drives, picks up Kevin Allen. Help arrives from D'Angelo O'Neal! Shai Westbrook attempts a Dunk. Wide open! D'Angelo O'Neal is 7.1 feet away. [ZONE] SHAI WESTBROOK MAKES IT! Assist: Ja Butler
Score: 49-31

[09:12] Team_046 possession (Score: 49-31)
D'Angelo O'Neal attempts a 3Pt. Wide open! Shai Westbrook is 6.9 feet away. [MAN] D'Angelo O'Neal misses. Rebound secured by Shai Westbrook.

[08:57] Team_006 possession (Score: 49-31)
Shai Westbrook attempts a Midrange. Contested by Lauri Carter (3.2 feet, ZONE). Shai Westbrook misses. Rebound secured by Lauri Carter.

[08:43] Team_046 possession (Score: 49-31)
FOUL! Shooting foul on Shai Westbrook. Victor Nowitzki to the line for 3 free throws. [Team fouls: 1] (Shai Westbrook: 1 personal fouls)   FT 1/3: GOOD   FT 2/3: GOOD   FT 3/3: GOOD Victor Nowitzki makes 3/3 from the line.
Score: 49-34

[08:25] Team_006 possession (Score: 49-34)
Franz Wagner attempts a Midrange. Contested by Victor Nowitzki (4.1 feet, MAN). FRANZ WAGNER MAKES IT! Assist: Bradley Gobert
Score: 51-34

[08:12] Team_046 possession (Score: 51-34)
Kevin Allen attempts a Layup. Contested by Bradley Gobert (4.5 feet, MAN). KEVIN ALLEN MAKES IT! Assist: D'Angelo O'Neal
Score: 51-36

[07:59] Team_006 possession (Score: 51-36)
Bradley Gobert attempts a Layup. Contested by Cade Wall (5.2 feet, ZONE). Bradley Gobert misses. Rebound secured by Lauri Carter.

[07:42] Team_046 possession (Score: 51-36)
Cade Wall drives, picks up Ja Butler. Help arrives from Shai Westbrook! Cade Wall attempts a Dunk. Heavily contested by Shai Westbrook (1.7 feet, MAN)! Cade Wall misses. Rebound secured by Ja Butler.

[07:28] Team_006 possession (Score: 51-36)
Ja Butler drives to the basket... Ja Butler throws a bad pass out of bounds! TURNOVER! (dead ball)

[07:28] Substitution (Team_006): Shai Westbrook OUT → Miles Harris IN (stamina_rule2)

[07:28] Substitution (Team_006): Franz Wagner OUT → Lamelo Westbrook IN (stamina_rule2)

[07:28] Substitution (Team_006): Jayson Young OUT → Vince Sabonis IN (stamina_rule2)

[07:28] Substitution (Team_006): Ja Butler OUT → Cade Ball IN (stamina_rule2)

[07:28] Substitution (Team_006): Bradley Gobert OUT → Shaquille Sexton IN (stamina_rule2)

[07:28] Substitution (Team_046): D'Angelo O'Neal OUT → Collin Butler IN (stamina_rule2)

[07:28] Substitution (Team_046): Victor Nowitzki OUT → Manu Dosunmu IN (stamina_rule2)

[07:28] Substitution (Team_046): Lauri Carter OUT → Josh Barrett IN (stamina_rule2)

[07:28] Substitution (Team_046): Cade Wall OUT → Chris LaVine IN (stamina_rule2)

[07:28] Substitution (Team_046): Kevin Allen OUT → Paul DeRozan IN (stamina_rule2)

[07:13] Team_046 possession (Score: 51-36)
Chris LaVine drives to the basket... Chris LaVine throws a bad pass! Stolen by Cade Ball! TURNOVER! (live ball)

[07:01] Team_006 possession (Score: 51-36)
Shaquille Sexton attempts a Layup. Contested by Chris LaVine (4.5 feet, ZONE). SHAQUILLE SEXTON MAKES IT!
Score: 53-36

[06:49] Team_046 possession (Score: 53-36)
Chris LaVine attempts a 3Pt. Contested by Lamelo Westbrook (5.8 feet, ZONE). Chris LaVine misses. Offensive rebound by Paul DeRozan! Paul DeRozan's putback is no good. Rebound secured by Cade Ball.

[06:34] Team_006 possession (Score: 53-36)
Miles Harris attempts a 3Pt. Contested by Collin Butler (3.4 feet, ZONE). MILES HARRIS MAKES IT!
Score: 56-36

[06:20] Team_046 possession (Score: 56-36)
Paul DeRozan attempts a Midrange. Contested by Cade Ball (3.9 feet, ZONE). Paul DeRozan misses. FOUL! Loose ball foul on Shaquille Sexton during the rebound battle. [Team fouls: 2] No free throws, side out. (Shaquille Sexton: 1 personal fouls)

[06:09] Team_046 possession (Score: 56-36)
FOUL! Reach-in foul on Lamelo Westbrook during the drive. [Team fouls: 3] No free throws, side out. (Lamelo Westbrook: 1 personal fouls)

[05:53] Team_046 possession (Score: 56-36)
Chris LaVine attempts a Midrange. Wide open! Vince Sabonis is 7.3 feet away. [ZONE] Chris LaVine misses. Rebound secured by Vince Sabonis.

[05:37] Team_006 possession (Score: 56-36)
FOUL! Holding foul on Chris LaVine. [Team fouls: 4] No free throws, side out. (Chris LaVine: 1 personal fouls)

[05:19] Team_006 possession (Score: 56-36)
Lamelo Westbrook attempts a 3Pt. Heavily contested by Collin Butler (1.8 feet, ZONE)! LAMELO WESTBROOK MAKES IT! Assist: Vince Sabonis
Score: 59-36

[05:01] Team_046 possession (Score: 59-36)
Paul DeRozan makes the Layup and draws the foul on Cade Ball! And-1! Paul DeRozan to the line for 1. [Team fouls: 4] (Cade Ball: 1 personal fouls)   FT 1/1: MISS Paul DeRozan makes 0/1 from the line. Rebound secured by Shaquille Sexton.
Score: 59-38

[04:44] Team_006 possession (Score: 59-38)
Vince Sabonis drives, picks up Chris LaVine. Help arrives from Manu Dosunmu! Vince Sabonis attempts a Dunk. Contested by Manu Dosunmu (2.3 feet, ZONE). VINCE SABONIS MAKES IT! Assist: Cade Ball
Score: 61-38

[04:29] Team_046 possession (Score: 61-38)
Manu Dosunmu attempts a 3Pt. Wide open! Lamelo Westbrook is 6.9 feet away. [MAN] Manu Dosunmu misses. Rebound secured by Cade Ball.

[04:11] Team_006 possession (Score: 61-38)
Shaquille Sexton attempts a Midrange. BLOCKED BY CHRIS LAVINE! Ball goes out off Chris LaVine. Shaquille Sexton's ball!

[03:58] Team_006 possession (Score: 61-38)
Miles Harris loses the ball! Stripped by Collin Butler! TURNOVER! (live ball)

[03:44] Team_046 possession (Score: 61-38)
Chris LaVine drives, Cade Ball stays with him. Chris LaVine attempts a Layup. Contested by Cade Ball (3.2 feet, MAN). CHRIS LAVINE MAKES IT! Assist: Josh Barrett
Score: 61-40

[03:31] Team_006 possession (Score: 61-40)
Cade Ball attempts a Layup. Contested by Chris LaVine (4.6 feet, ZONE). CADE BALL MAKES IT! Assist: Miles Harris
Score: 63-40

[03:18] Team_046 possession (Score: 63-40)
Manu Dosunmu attempts a 3Pt. Contested by Lamelo Westbrook (3.4 feet, ZONE). Manu Dosunmu misses. Rebound secured by Cade Ball.

[03:05] Team_006 possession (Score: 63-40)
Lamelo Westbrook drives, Manu Dosunmu stays with him. Lamelo Westbrook attempts a Layup. Heavily contested by Manu Dosunmu (0.5 feet, MAN)! Lamelo Westbrook misses. Rebound secured by Manu Dosunmu.

[02:52] Team_046 possession (Score: 63-40)
FOUL! Shooting foul on Vince Sabonis. Josh Barrett to the line for 3 free throws. [BONUS: 5 team fouls] (Vince Sabonis: 1 personal fouls)   FT 1/3: GOOD   FT 2/3: GOOD   FT 3/3: GOOD Josh Barrett makes 3/3 from the line.
Score: 63-43

[02:37] Team_006 possession (Score: 63-43)
Lamelo Westbrook loses control! Ball rolls out of bounds! TURNOVER! (dead ball)

[02:26] Team_046 possession (Score: 63-43)
Josh Barrett attempts a 3Pt. Contested by Vince Sabonis (3.4 feet, MAN). Josh Barrett misses. Rebound secured by Cade Ball.

[02:09] Team_006 possession (Score: 63-43)
Lamelo Westbrook drives, picks up Manu Dosunmu. Help arrives from Collin Butler! Lamelo Westbrook attempts a Layup. Contested by Collin Butler (3.9 feet, MAN). Lamelo Westbrook misses. Rebound secured by Chris LaVine.

[01:55] Team_046 possession (Score: 63-43)
FOUL! Offensive foul on Chris LaVine! Cade Ball drew the charge! [Team fouls: 5] (Chris LaVine: 2 personal fouls) TURNOVER! (dead ball)

[01:38] Team_006 possession (Score: 63-43)
Vince Sabonis attempts a 3Pt. Contested by Collin Butler (2.3 feet, ZONE). Vince Sabonis misses. Rebound secured by Manu Dosunmu.

[01:27] Team_046 possession (Score: 63-43)
Chris LaVine drives to the basket... FOUL! Offensive foul on Chris LaVine! Cade Ball drew the charge! [Team fouls: 6] (Chris LaVine: 3 personal fouls) TURNOVER! (dead ball)

[01:10] Team_006 possession (Score: 63-43)
Cade Ball attempts a 3Pt. Contested by Collin Butler (3.3 feet, ZONE). Cade Ball misses. Offensive rebound by Shaquille Sexton! Shaquille Sexton kicks it out.

[00:53] Team_006 possession (Score: 63-43)
FOUL! Shooting foul on Collin Butler. Miles Harris to the line for 2 free throws. [BONUS: 7 team fouls] (Collin Butler: 1 personal fouls)   FT 1/2: MISS   FT 2/2: GOOD Miles Harris makes 1/2 from the line.
Score: 64-43

[00:40] Team_046 possession (Score: 64-43)
FOUL! Reach-in foul on Cade Ball during the drive. [IN THE BONUS! 6 team fouls] Chris LaVine to the line for 2 free throws. (Cade Ball: 2 personal fouls)   FT 1/2: GOOD   FT 2/2: GOOD Chris LaVine makes 2/2 from the line.
Score: 64-45

[00:26] Team_006 possession (Score: 64-45)
Miles Harris attempts a 3Pt. Wide open! Collin Butler is 6.2 feet away. [ZONE] Miles Harris misses. Rebound secured by Paul DeRozan.

[00:13] Team_046 possession (Score: 64-45)
Paul DeRozan drives and kicks out. Manu Dosunmu attempts a Midrange. Contested by Vince Sabonis (2.6 feet, ZONE). Manu Dosunmu misses. Rebound secured by Vince Sabonis.

================================================================================
                              2ND QUARTER COMPLETE                              
================================================================================

2ND QUARTER SCORE: Team_006 27, Team_046 19

BOX SCORE:
================================================================================

Team_006
--------------------------------------------------------------------------------
Player                MIN  PTS  REB  AST  TO      FG   FG%      3P   3P%
--------------------------------------------------------------------------------
Ja Butler              17    7    1    1   0   2/2   100.0     0/0   0.0
Shai Westbrook         17    4    1    1   0   2/3    66.7     0/0   0.0
Miles Harris            7    4    0    1   0   2/3    66.7     0/0   0.0
Lamelo Westbrook        7    3    0    0   0   1/3    33.3     0/0   0.0
Franz Wagner           17    2    0    0   0   1/3    33.3     0/0   0.0
Shaquille Sexton        7    2    2    0   0   1/1   100.0     0/0   0.0
Cade Ball               7    2    4    1   0   1/1   100.0     0/0   0.0
Vince Sabonis           7    2    2    1   0   1/2    50.0     0/0   0.0
Bradley Gobert         17    0    2    1   0   0/1     0.0     0/0   0.0

TEAM: FG: 11/19 (57.9%), 3PT: 3/7 (42.9%), REB: 11 (1 off, 10 def), AST: 6, TO: 3
TEAM FOULS: 6 [Team_046 in BONUS]


Team_046
--------------------------------------------------------------------------------
Player                MIN  PTS  REB  AST  TO      FG   FG%      3P   3P%
--------------------------------------------------------------------------------
Victor Nowitzki        17    8    0    0   0   3/3   100.0     0/0   0.0
Chris LaVine            7    4    1    0   0   2/4    50.0     0/0   0.0
Josh Barrett            7    3    0    1   0   1/2    50.0     0/0   0.0
Kevin Allen            17    2    1    0   0   1/2    50.0     0/0   0.0
Cade Wall              17    0    0    0   0   0/2     0.0     0/0   0.0
Lauri Carter           17    0    3    0   0   0/0     0.0     0/0   0.0
D'Angelo O'Neal        17    0    0    1   0   0/1     0.0     0/0   0.0
Paul DeRozan            7    0    2    0   0   0/2     0.0     0/0   0.0
Manu Dosunmu            7    0    2    0   0   0/2     0.0     0/0   0.0

TEAM: FG: 7/18 (38.9%), 3PT: 3/8 (37.5%), REB: 10 (2 off, 8 def), AST: 2, TO: 4
TEAM FOULS: 7 [Team_006 in BONUS]

================================================================================

================================================================================
                       3RD QUARTER - Team_006 vs Team_046                       
================================================================================

[12:00] Team_006 possession (Score: 64-45)
Shai Westbrook attempts a 3Pt. Contested by D'Angelo O'Neal (4.2 feet, MAN). Shai Westbrook misses. Rebound secured by Kevin Allen.

[11:42] Team_046 possession (Score: 64-45)
Victor Nowitzki loses control! Ball rolls out of bounds! TURNOVER! (dead ball)

[11:30] Team_006 possession (Score: 64-45)
Jayson Young attempts a Midrange. Contested by Lauri Carter (4.9 feet, MAN). Jayson Young misses. Rebound secured by Cade Wall.

[11:17] Team_046 possession (Score: 64-45)
Lauri Carter attempts a 3Pt. Contested by Shai Westbrook (4.6 feet, ZONE). Lauri Carter misses. Rebound secured by Ja Butler.

[11:04] Team_006 possession (Score: 64-45)
FOUL! Holding foul on Lauri Carter. [Team fouls: 1] No free throws, side out. (Lauri Carter: 1 personal fouls)

[10:53] Team_006 possession (Score: 64-45)
Ja Butler attempts a 3Pt. Contested by Cade Wall (3.2 feet, MAN). Ja Butler misses. Rebound secured by Cade Wall.

[10:37] Team_046 possession (Score: 64-45)
Lauri Carter attempts a 3Pt. Contested by Shai Westbrook (4.9 feet, ZONE). Lauri Carter misses. Rebound secured by Ja Butler.

[10:27] Team_006 possession (Score: 64-45)
Jayson Young attempts a 3Pt. Heavily contested by Lauri Carter (1.8 feet, MAN)! Jayson Young misses. Offensive rebound by Bradley Gobert! Bradley Gobert kicks it out.

[10:09] Team_006 possession (Score: 64-45)
Jayson Young attempts a 3Pt. Wide open! D'Angelo O'Neal is 7.6 feet away. [ZONE] Jayson Young misses. Rebound secured by Kevin Allen.

[09:53] Team_046 possession (Score: 64-45)
D'Angelo O'Neal drives and kicks out. Cade Wall attempts a Midrange. Contested by Ja Butler (2.5 feet, MAN). Cade Wall misses. Rebound secured by Shai Westbrook.

[09:36] Team_006 possession (Score: 64-45)
Shai Westbrook attempts a 3Pt. Contested by D'Angelo O'Neal (4.3 feet, MAN). Shai Westbrook misses. Rebound secured by Cade Wall.

[09:25] Team_046 possession (Score: 64-45)
Lauri Carter attempts a 3Pt. Wide open! Jayson Young is 6.1 feet away. [MAN] Lauri Carter misses. Rebound secured by Ja Butler.

[09:08] Team_006 possession (Score: 64-45)
Jayson Young attempts a 3Pt. Contested by Lauri Carter (5.7 feet, MAN). Jayson Young misses. Rebound secured by Cade Wall.

[08:53] Team_046 possession (Score: 64-45)
Lauri Carter drives and kicks out. Kevin Allen attempts a 3Pt. Contested by Bradley Gobert (2.2 feet, MAN). Kevin Allen misses. Rebound secured by Bradley Gobert.

[08:39] Team_006 possession (Score: 64-45)
Ja Butler attempts a Layup. Wide open! Cade Wall is 6.2 feet away. [ZONE] JA BUTLER MAKES IT! Assist: Shai Westbrook
Score: 66-45

[08:24] Team_046 possession (Score: 66-45)
Victor Nowitzki attempts a 3Pt. Contested by Shai Westbrook (2.4 feet, ZONE). VICTOR NOWITZKI MAKES IT! Assist: Lauri Carter
Score: 66-48

[08:12] Team_006 possession (Score: 66-48)
Shai Westbrook attempts a 3Pt. Wide open! Lauri Carter is 6.8 feet away. [ZONE] Shai Westbrook misses. Rebound secured by Cade Wall.

[08:00] Team_046 possession (Score: 66-48)
Victor Nowitzki attempts a Layup. Contested by Bradley Gobert (3.1 feet, ZONE). VICTOR NOWITZKI MAKES IT! Assist: Kevin Allen
Score: 66-50

[07:45] Team_006 possession (Score: 66-50)
Bradley Gobert attempts a 3Pt. Contested by Lauri Carter (4.7 feet, ZONE). Bradley Gobert misses. Rebound secured by Lauri Carter.

[07:33] Team_046 possession (Score: 66-50)
Kevin Allen throws a bad pass out of bounds! TURNOVER! (dead ball)

[07:20] Team_006 possession (Score: 66-50)
FOUL! Reach-in foul on Kevin Allen during the drive. [Team fouls: 2] No free throws, side out. (Kevin Allen: 1 personal fouls)

[07:06] Team_006 possession (Score: 66-50)
Ja Butler drives and kicks out. Jayson Young attempts a Midrange. Contested by Victor Nowitzki (4.1 feet, ZONE). JAYSON YOUNG MAKES IT!
Score: 68-50

[06:52] Team_046 possession (Score: 68-50)
Victor Nowitzki drives and kicks out. Cade Wall attempts a 3Pt. Contested by Ja Butler (5.0 feet, MAN). Cade Wall misses. Offensive rebound by Cade Wall! Cade Wall kicks it out.

[06:39] Team_046 possession (Score: 68-50)
FOUL! Reach-in foul on Ja Butler during the drive. [Team fouls: 1] No free throws, side out. (Ja Butler: 1 personal fouls)

[06:24] Team_046 possession (Score: 68-50)
Kevin Allen attempts a Midrange. Contested by Bradley Gobert (6.0 feet, MAN). KEVIN ALLEN MAKES IT!
Score: 68-52

[06:08] Team_006 possession (Score: 68-52)
Franz Wagner attempts a 3Pt. Contested by Victor Nowitzki (3.8 feet, MAN). Franz Wagner misses. Rebound secured by Cade Wall.

[05:48] Team_046 possession (Score: 68-52)
Kevin Allen drives and kicks out. Lauri Carter attempts a Midrange. Contested by Jayson Young (5.5 feet, MAN). LAURI CARTER MAKES IT!
Score: 68-54

[05:33] Team_006 possession (Score: 68-54)
Ja Butler drives, picks up Cade Wall. Help arrives from D'Angelo O'Neal! Ja Butler attempts a Dunk. Contested by D'Angelo O'Neal (3.5 feet, MAN). JA BUTLER MAKES IT!
Score: 70-54

[05:22] Team_046 possession (Score: 70-54)
D'Angelo O'Neal makes the 3Pt and draws the foul on Ja Butler! And-1! D'Angelo O'Neal to the line for 1. [Team fouls: 2] (Ja Butler: 2 personal fouls)   FT 1/1: GOOD D'Angelo O'Neal makes 1/1 from the line.
Score: 70-58

[05:11] Team_006 possession (Score: 70-58)
Shai Westbrook drives and kicks out. Jayson Young attempts a Midrange. Heavily contested by Lauri Carter (0.5 feet, MAN)! Jayson Young misses. Rebound secured by Kevin Allen.

[04:57] Team_046 possession (Score: 70-58)
Kevin Allen drives and kicks out. Victor Nowitzki attempts a Midrange. Wide open! Franz Wagner is 7.0 feet away. [MAN] VICTOR NOWITZKI MAKES IT! Assist: Cade Wall
Score: 70-60

[04:39] Team_006 possession (Score: 70-60)
Bradley Gobert drives to the basket... Bradley Gobert loses control! Ball rolls out of bounds! TURNOVER! (dead ball)

[04:25] Team_046 possession (Score: 70-60)
Lauri Carter attempts a 3Pt. Contested by Shai Westbrook (3.6 feet, ZONE). LAURI CARTER MAKES IT!
Score: 70-63

[04:11] Team_006 possession (Score: 70-63)
Franz Wagner attempts a 3Pt. Contested by Victor Nowitzki (5.9 feet, MAN). FRANZ WAGNER MAKES IT!
Score: 73-63

[03:55] Team_046 possession (Score: 73-63)
FOUL! Offensive foul on D'Angelo O'Neal! Shai Westbrook drew the charge! [Team fouls: 3] (D'Angelo O'Neal: 1 personal fouls) TURNOVER! (dead ball)

[03:36] Team_006 possession (Score: 73-63)
FOUL! Reach-in foul on Cade Wall during the drive. [Team fouls: 4] No free throws, side out. (Cade Wall: 1 personal fouls)

[03:20] Team_006 possession (Score: 73-63)
Ja Butler attempts a Midrange. Contested by Cade Wall (5.3 feet, MAN). Ja Butler misses. Rebound secured by Cade Wall.

[03:10] Team_046 possession (Score: 73-63)
D'Angelo O'Neal loses control! Ball rolls out of bounds! TURNOVER! (dead ball)

[03:10] Substitution (Team_046): Kevin Allen OUT → Paul DeRozan IN (stamina_rule2)

[02:55] Team_006 possession (Score: 73-63)
Ja Butler drives to the basket... Ja Butler throws a bad pass! Stolen by Cade Wall! TURNOVER! (live ball)

[02:41] Team_046 possession (Score: 73-63)
D'Angelo O'Neal makes the Layup and draws the foul on Bradley Gobert! And-1! D'Angelo O'Neal to the line for 1. [Team fouls: 3] (Bradley Gobert: 1 personal fouls)   FT 1/1: GOOD D'Angelo O'Neal makes 1/1 from the line.
Score: 73-66

[02:25] Team_006 possession (Score: 73-66)
Jayson Young makes the Dunk and draws the foul on D'Angelo O'Neal! And-1! Jayson Young to the line for 1. [BONUS: 5 team fouls] (D'Angelo O'Neal: 2 personal fouls)   FT 1/1: GOOD Jayson Young makes 1/1 from the line.
Score: 76-66

[02:09] Team_046 possession (Score: 76-66)
D'Angelo O'Neal attempts a 3Pt. Wide open! Shai Westbrook is 6.9 feet away. [MAN] D'Angelo O'Neal misses. Rebound secured by Ja Butler.

[01:56] Team_006 possession (Score: 76-66)
Jayson Young drives, picks up Lauri Carter. Help arrives from D'Angelo O'Neal! Jayson Young attempts a Layup. Contested by D'Angelo O'Neal (5.9 feet, MAN). Jayson Young misses. Rebound secured by Cade Wall.

[01:44] Team_046 possession (Score: 76-66)
Lauri Carter drives, Bradley Gobert stays with him. Lauri Carter attempts a Layup. Contested by Bradley Gobert (5.8 feet, ZONE). LAURI CARTER MAKES IT!
Score: 76-68

[01:33] Team_006 possession (Score: 76-68)
Jayson Young attempts a 3Pt. Heavily contested by Lauri Carter (0.5 feet, MAN)! JAYSON YOUNG MAKES IT! Assist: Ja Butler
Score: 79-68

[01:22] Team_046 possession (Score: 79-68)
FOUL! Shooting foul on Bradley Gobert. Lauri Carter to the line for 2 free throws. [Team fouls: 4] (Bradley Gobert: 2 personal fouls)   FT 1/2: GOOD   FT 2/2: MISS Lauri Carter makes 1/2 from the line. FOUL! Loose ball foul on Shai Westbrook during the free throw rebound! [IN THE BONUS! 5 team fouls] Paul DeRozan to the line for 2 free throws. (Shai Westbrook: 1 personal fouls)   FT 1/2: GOOD   FT 2/2: MISS Paul DeRozan makes 1/2 from the line. Rebound secured by Shai Westbrook.
Score: 79-70

[01:08] Team_006 possession (Score: 79-70)
Jayson Young attempts a 3Pt. Wide open! Lauri Carter is 7.5 feet away. [ZONE] JAYSON YOUNG MAKES IT! Assist: Bradley Gobert
Score: 82-70

[00:52] Team_046 possession (Score: 82-70)
Lauri Carter makes the Layup and draws the foul on Bradley Gobert! And-1! Lauri Carter to the line for 1. [BONUS: 6 team fouls] (Bradley Gobert: 3 personal fouls)   FT 1/1: GOOD Lauri Carter makes 1/1 from the line.
Score: 82-73

[00:36] Team_006 possession (Score: 82-73)
Franz Wagner drives, picks up Victor Nowitzki. Help arrives from Lauri Carter! Franz Wagner attempts a Dunk. Contested by Lauri Carter (3.6 feet, MAN). FRANZ WAGNER MAKES IT! Assist: Bradley Gobert
Score: 84-73

[00:21] Team_046 possession (Score: 84-73)
Cade Wall drives, picks up Ja Butler. Help arrives from Shai Westbrook! Cade Wall attempts a Dunk. Heavily contested by Shai Westbrook (1.5 feet, MAN)! CADE WALL MAKES IT!
Score: 84-75

[00:09] Team_006 possession (Score: 84-75)
Shai Westbrook drives to the basket... Shai Westbrook throws a bad pass! Stolen by Cade Wall! TURNOVER! (live ball)

================================================================================
                              3RD QUARTER COMPLETE                              
================================================================================

3RD QUARTER SCORE: Team_006 20, Team_046 30

BOX SCORE:
================================================================================

Team_006
--------------------------------------------------------------------------------
Player                MIN  PTS  REB  AST  TO      FG   FG%      3P   3P%
--------------------------------------------------------------------------------
Jayson Young           29   11    0    0   0   4/8    50.0     0/0   0.0
Franz Wagner           29    5    0    0   0   2/3    66.7     0/0   0.0
Ja Butler              29    4    4    1   0   2/4    50.0     0/0   0.0
Shai Westbrook         29    0    2    1   0   0/4     0.0     0/0   0.0
Bradley Gobert         29    0    2    2   0   0/1     0.0     0/0   0.0

TEAM: FG: 8/20 (40.0%), 3PT: 3/11 (27.3%), REB: 8 (1 off, 7 def), AST: 4, TO: 3
TEAM FOULS: 6 [Team_046 in BONUS]


Team_046
--------------------------------------------------------------------------------
Player                MIN  PTS  REB  AST  TO      FG   FG%      3P   3P%
--------------------------------------------------------------------------------
Lauri Carter           29   10    1    1   0   4/9    44.4     0/0   0.0
D'Angelo O'Neal        29    7    0    0   0   2/4    50.0     0/0   0.0
Victor Nowitzki        29    7    0    0   0   3/3   100.0     0/0   0.0
Kevin Allen            26    2    3    1   0   1/1   100.0     0/0   0.0
Cade Wall              29    2    9    1   0   1/1   100.0     0/0   0.0

TEAM: FG: 11/18 (61.1%), 3PT: 3/7 (42.9%), REB: 13 (1 off, 12 def), AST: 3, TO: 4
TEAM FOULS: 5 [Team_006 in BONUS]

================================================================================

================================================================================
                       4TH QUARTER - Team_006 vs Team_046                       
================================================================================

[12:00] Team_006 possession (Score: 84-75)
Franz Wagner attempts a 3Pt. Wide open! Victor Nowitzki is 7.4 feet away. [MAN] FRANZ WAGNER MAKES IT!
Score: 87-75

[11:50] Team_046 possession (Score: 87-75)
Kevin Allen loses control! Ball rolls out of bounds! TURNOVER! (dead ball)

[11:50] Substitution (Team_006): Shai Westbrook OUT → Miles Harris IN (stamina_rule2)

[11:50] Substitution (Team_006): Franz Wagner OUT → Lamelo Westbrook IN (stamina_rule2)

[11:50] Substitution (Team_006): Jayson Young OUT → Vince Sabonis IN (stamina_rule2)

[11:50] Substitution (Team_006): Ja Butler OUT → Cade Ball IN (stamina_rule2)

[11:50] Substitution (Team_006): Bradley Gobert OUT → Shaquille Sexton IN (stamina_rule2)

[11:50] Substitution (Team_046): D'Angelo O'Neal OUT → Collin Butler IN (stamina_rule2)

[11:50] Substitution (Team_046): Victor Nowitzki OUT → Manu Dosunmu IN (stamina_rule2)

[11:50] Substitution (Team_046): Lauri Carter OUT → Josh Barrett IN (stamina_rule2)

[11:50] Substitution (Team_046): Cade Wall OUT → Chris LaVine IN (stamina_rule2)

[11:39] Team_006 possession (Score: 87-75)
Shaquille Sexton makes the Midrange and draws the foul on Chris LaVine! And-1! Shaquille Sexton to the line for 1. [Team fouls: 1] (Chris LaVine: 1 personal fouls)   FT 1/1: MISS Shaquille Sexton makes 0/1 from the line. Offensive rebound by Shaquille Sexton! Shaquille Sexton kicks it out.
Score: 89-75

[11:27] Team_006 possession (Score: 89-75)
Lamelo Westbrook attempts a 3Pt. Wide open! Manu Dosunmu is 7.4 feet away. [MAN] LAMELO WESTBROOK MAKES IT! Assist: Shaquille Sexton
Score: 92-75

[11:14] Team_046 possession (Score: 92-75)
Josh Barrett attempts a 3Pt. Wide open! Lamelo Westbrook is 6.7 feet away. [ZONE] Josh Barrett misses. Rebound secured by Shaquille Sexton.

[11:01] Team_006 possession (Score: 92-75)
Vince Sabonis makes the Layup and draws the foul on Chris LaVine! And-1! Vince Sabonis to the line for 1. [Team fouls: 2] (Chris LaVine: 2 personal fouls)   FT 1/1: GOOD Vince Sabonis makes 1/1 from the line.
Score: 95-75

[10:44] Team_046 possession (Score: 95-75)
Manu Dosunmu attempts a 3Pt. Contested by Lamelo Westbrook (3.0 feet, MAN). Manu Dosunmu misses. Rebound secured by Shaquille Sexton.

[10:30] Team_006 possession (Score: 95-75)
Cade Ball attempts a 3Pt. Contested by Chris LaVine (3.5 feet, MAN). Cade Ball misses. Rebound secured by Kevin Allen.

[10:13] Team_046 possession (Score: 95-75)
Manu Dosunmu attempts a Layup. Heavily contested by Lamelo Westbrook (0.5 feet, MAN)! MANU DOSUNMU MAKES IT!
Score: 95-77

[09:55] Team_006 possession (Score: 95-77)
Cade Ball attempts a 3Pt. Contested by Manu Dosunmu (5.9 feet, ZONE). CADE BALL MAKES IT! Assist: Lamelo Westbrook
Score: 98-77

[09:41] Team_046 possession (Score: 98-77)
Josh Barrett attempts a Midrange. Wide open! Vince Sabonis is 8.6 feet away. [ZONE] JOSH BARRETT MAKES IT!
Score: 98-79

[09:29] Team_006 possession (Score: 98-79)
Lamelo Westbrook drives, Manu Dosunmu stays with him. Lamelo Westbrook attempts a Layup. Contested by Manu Dosunmu (4.8 feet, MAN). LAMELO WESTBROOK MAKES IT!
Score: 100-79

[09:15] Team_046 possession (Score: 100-79)
FOUL! Reach-in foul on Cade Ball during the drive. [Team fouls: 1] No free throws, side out. (Cade Ball: 1 personal fouls)

[09:04] Team_046 possession (Score: 100-79)
FOUL! Holding foul on Shaquille Sexton. [Team fouls: 2] No free throws, side out. (Shaquille Sexton: 1 personal fouls)

[08:55] Team_046 possession (Score: 100-79)
Kevin Allen makes the Layup and draws the foul on Shaquille Sexton! And-1! Kevin Allen to the line for 1. [Team fouls: 3] (Shaquille Sexton: 2 personal fouls)   FT 1/1: GOOD Kevin Allen makes 1/1 from the line.
Score: 100-82

[08:39] Team_006 possession (Score: 100-82)
Shaquille Sexton attempts a Layup. BLOCKED BY MANU DOSUNMU! Ball is loose! Rebound secured by Chris LaVine.

[08:25] Team_046 possession (Score: 100-82)
Manu Dosunmu attempts a Layup. BLOCKED BY LAMELO WESTBROOK! Ball is loose! Rebound secured by Vince Sabonis.

[08:12] Team_006 possession (Score: 100-82)
Vince Sabonis attempts a 3Pt. Contested by Josh Barrett (5.8 feet, MAN). VINCE SABONIS MAKES IT! Assist: Shaquille Sexton
Score: 103-82

[07:59] Team_046 possession (Score: 103-82)
Collin Butler makes the Layup and draws the foul on Cade Ball! And-1! Collin Butler to the line for 1. [Team fouls: 4] (Cade Ball: 2 personal fouls)   FT 1/1: GOOD Collin Butler makes 1/1 from the line.
Score: 103-85

[07:41] Team_006 possession (Score: 103-85)
Lamelo Westbrook drives and kicks out. Miles Harris attempts a 3Pt. Contested by Collin Butler (3.3 feet, ZONE). Miles Harris misses. Rebound secured by Chris LaVine.

[07:30] Team_046 possession (Score: 103-85)
Kevin Allen attempts a Midrange. Wide open! Shaquille Sexton is 8.3 feet away. [MAN] Kevin Allen misses. Rebound secured by Vince Sabonis.

[07:15] Team_006 possession (Score: 103-85)
FOUL! Offensive foul on Lamelo Westbrook! Manu Dosunmu drew the charge! [Team fouls: 5] (Lamelo Westbrook: 1 personal fouls) TURNOVER! (dead ball)

[07:02] Team_046 possession (Score: 103-85)
Kevin Allen attempts a Layup. Contested by Cade Ball (2.2 feet, ZONE). Kevin Allen misses. Offensive rebound by Chris LaVine! Chris LaVine kicks it out.

[06:46] Team_046 possession (Score: 103-85)
Josh Barrett attempts a 3Pt. Contested by Lamelo Westbrook (2.7 feet, ZONE). Josh Barrett misses. Rebound secured by Vince Sabonis.

[06:35] Team_006 possession (Score: 103-85)
Miles Harris attempts a 3Pt. Contested by Collin Butler (2.2 feet, ZONE). Miles Harris misses. Rebound secured by Collin Butler.

[06:20] Team_046 possession (Score: 103-85)
Collin Butler attempts a 3Pt. Wide open! Miles Harris is 7.0 feet away. [MAN] COLLIN BUTLER MAKES IT! Assist: Josh Barrett
Score: 103-88

[06:08] Team_006 possession (Score: 103-88)
Vince Sabonis attempts a 3Pt. Contested by Collin Butler (3.7 feet, ZONE). Vince Sabonis misses. Rebound secured by Chris LaVine.

[05:55] Team_046 possession (Score: 103-88)
Josh Barrett attempts a 3Pt. Contested by Lamelo Westbrook (2.9 feet, ZONE). Josh Barrett misses. Rebound secured by Vince Sabonis.

[05:39] Team_006 possession (Score: 103-88)
Cade Ball attempts a Layup. Contested by Chris LaVine (3.8 feet, ZONE). Cade Ball misses. Rebound secured by Collin Butler.

[05:23] Team_046 possession (Score: 103-88)
Kevin Allen drives and kicks out. Josh Barrett attempts a Midrange. Contested by Vince Sabonis (3.6 feet, ZONE). JOSH BARRETT MAKES IT!
Score: 103-90

[05:08] Team_006 possession (Score: 103-90)
Vince Sabonis drives and kicks out. Shaquille Sexton attempts a 3Pt. Contested by Collin Butler (5.7 feet, ZONE). Shaquille Sexton misses. Rebound secured by Collin Butler.

[04:53] Team_046 possession (Score: 103-90)
Chris LaVine attempts a Layup. BLOCKED BY CADE BALL! Ball is loose! Rebound secured by Vince Sabonis.

[04:40] Team_006 possession (Score: 103-90)
Cade Ball drives and kicks out. Miles Harris attempts a Midrange. Contested by Josh Barrett (5.3 feet, ZONE). MILES HARRIS MAKES IT!
Score: 105-90

[04:26] Team_046 possession (Score: 105-90)
Kevin Allen attempts a Midrange. Contested by Shaquille Sexton (3.9 feet, MAN). Kevin Allen misses. Rebound secured by Shaquille Sexton.

[04:13] Team_006 possession (Score: 105-90)
Lamelo Westbrook attempts a 3Pt. Wide open! Collin Butler is 9.6 feet away. [ZONE] LAMELO WESTBROOK MAKES IT! Assist: Vince Sabonis
Score: 108-90

[03:57] Team_046 possession (Score: 108-90)
Kevin Allen makes the Layup and draws the foul on Cade Ball! And-1! Kevin Allen to the line for 1. [BONUS: 6 team fouls] (Cade Ball: 3 personal fouls)   FT 1/1: GOOD Kevin Allen makes 1/1 from the line.
Score: 108-93

[03:44] Team_006 possession (Score: 108-93)
Miles Harris attempts a 3Pt. Contested by Collin Butler (5.9 feet, MAN). Miles Harris misses. Rebound secured by Manu Dosunmu.

[03:35] Team_046 possession (Score: 108-93)
Chris LaVine attempts a Midrange. Contested by Cade Ball (4.5 feet, MAN). CHRIS LAVINE MAKES IT!
Score: 108-95

[03:17] Team_006 possession (Score: 108-95)
Miles Harris attempts a 3Pt. Contested by Collin Butler (6.0 feet, MAN). MILES HARRIS MAKES IT! Assist: Shaquille Sexton
Score: 111-95

[02:59] Team_046 possession (Score: 111-95)
Chris LaVine drives, Cade Ball stays with him. Chris LaVine attempts a Dunk. Contested by Cade Ball (3.0 feet, ZONE). CHRIS LAVINE MAKES IT! Assist: Kevin Allen
Score: 111-97

[02:46] Team_006 possession (Score: 111-97)
Lamelo Westbrook attempts a 3Pt. Heavily contested by Collin Butler (0.8 feet, ZONE)! Lamelo Westbrook misses. Offensive rebound by Shaquille Sexton! Shaquille Sexton kicks it out.

[02:34] Team_006 possession (Score: 111-97)
Miles Harris attempts a 3Pt. Heavily contested by Collin Butler (1.0 feet, ZONE)! Miles Harris misses. Rebound secured by Manu Dosunmu.

[02:22] Team_046 possession (Score: 111-97)
Kevin Allen drives and kicks out. Josh Barrett attempts a 3Pt. Contested by Vince Sabonis (5.5 feet, MAN). Josh Barrett misses. Rebound secured by Shaquille Sexton.

[02:09] Team_006 possession (Score: 111-97)
Cade Ball throws a bad pass out of bounds! TURNOVER! (dead ball)

[02:09] Substitution (Team_046): Kevin Allen OUT → Paul DeRozan IN (stamina_rule2)

[01:56] Team_046 possession (Score: 111-97)
Chris LaVine drives to the basket... FOUL! Offensive foul on Chris LaVine! Cade Ball drew the charge! [Team fouls: 3] (Chris LaVine: 3 personal fouls) TURNOVER! (dead ball)

[01:42] Team_006 possession (Score: 111-97)
Vince Sabonis attempts a 3Pt. Wide open! Josh Barrett is 7.2 feet away. [MAN] Vince Sabonis misses. Rebound secured by Chris LaVine.

[01:28] Team_046 possession (Score: 111-97)
Paul DeRozan drives, picks up Shaquille Sexton. Help arrives from Lamelo Westbrook! Paul DeRozan attempts a Layup. Contested by Lamelo Westbrook (3.1 feet, MAN). Paul DeRozan misses. Offensive rebound by Paul DeRozan! Paul DeRozan puts it back in!
Score: 111-99

[01:12] Team_006 possession (Score: 111-99)
Shaquille Sexton attempts a 3Pt. Wide open! Collin Butler is 6.7 feet away. [ZONE] Shaquille Sexton misses. Rebound secured by Chris LaVine.

[00:56] Team_046 possession (Score: 111-99)
FOUL! Offensive foul on Collin Butler! Miles Harris drew the charge! [Team fouls: 4] (Collin Butler: 1 personal fouls) TURNOVER! (dead ball)

[00:46] Team_006 possession (Score: 111-99)
Vince Sabonis attempts a 3Pt. Contested by Collin Butler (5.1 feet, ZONE). Vince Sabonis misses. Rebound secured by Chris LaVine.

[00:29] Team_046 possession (Score: 111-99)
Paul DeRozan attempts a Midrange. Wide open! Shaquille Sexton is 9.1 feet away. [MAN] Paul DeRozan misses. Rebound secured by Shaquille Sexton.

[00:16] Team_006 possession (Score: 111-99)
Vince Sabonis attempts a 3Pt. Wide open! Josh Barrett is 6.5 feet away. [MAN] Vince Sabonis misses. Offensive rebound by Shaquille Sexton! Shaquille Sexton kicks it out.

[00:04] Team_006 possession (Score: 111-99)
Shaquille Sexton drives to the basket... Shaquille Sexton commits a violation (traveling/carry)! TURNOVER! (dead ball)

================================================================================
                              4TH QUARTER COMPLETE                              
================================================================================

4TH QUARTER SCORE: Team_006 27, Team_046 24

BOX SCORE:
================================================================================

Team_006
--------------------------------------------------------------------------------
Player                MIN  PTS  REB  AST  TO      FG   FG%      3P   3P%
--------------------------------------------------------------------------------
Lamelo Westbrook       19    8    0    1   0   3/4    75.0     0/0   0.0
Vince Sabonis          19    6    5    1   0   2/6    33.3     0/0   0.0
Miles Harris           19    5    0    0   0   2/5    40.0     0/0   0.0
Franz Wagner           29    3    0    0   0   1/1   100.0     0/0   0.0
Cade Ball              19    3    0    0   0   1/3    33.3     0/0   0.0
Shaquille Sexton       19    0    8    3   0   0/2     0.0     0/0   0.0

TEAM: FG: 9/21 (42.9%), 3PT: 6/14 (42.9%), REB: 13 (3 off, 10 def), AST: 5, TO: 3
TEAM FOULS: 6 [Team_046 in BONUS]


Team_046
--------------------------------------------------------------------------------
Player                MIN  PTS  REB  AST  TO      FG   FG%      3P   3P%
--------------------------------------------------------------------------------
Kevin Allen            36    6    1    1   0   2/5    40.0     0/0   0.0
Collin Butler          19    6    3    0   0   2/2   100.0     0/0   0.0
Josh Barrett           19    4    0    1   0   2/5    40.0     0/0   0.0
Chris LaVine           19    4    7    0   0   2/3    66.7     0/0   0.0
Manu Dosunmu           19    2    2    0   0   1/3    33.3     0/0   0.0
Paul DeRozan           12    2    1    0   0   1/2    50.0     0/0   0.0

TEAM: FG: 10/20 (50.0%), 3PT: 1/5 (20.0%), REB: 14 (2 off, 12 def), AST: 2, TO: 3
TEAM FOULS: 4

================================================================================

================================================================================
                               FULL GAME COMPLETE                               
================================================================================

FINAL SCORE: Team_006 111, Team_046 99

SCORING BY QUARTER:
--------------------------------------------------------------------------------
Team                     Q1     Q2     Q3     Q4    FINAL
--------------------------------------------------------------------------------
Team_006                 37     27     20     27      111
Team_046                 26     19     30     24       99
--------------------------------------------------------------------------------

FULL GAME BOX SCORE:
================================================================================

Team_006
--------------------------------------------------------------------------------
Player                MIN  PTS  REB  AST  TO      FG   FG%      3P   3P%      FT STL BLK
--------------------------------------------------------------------------------
Shai Westbrook         29    4    7    3   1   2/11   18.2   0/7     0.0   0/0     0   0
Franz Wagner           29   22    0    1   0   7/12   58.3   5/8    62.5   1/3     0   0
Jayson Young           29   22    0    1   1   8/14   57.1   5/7    71.4   1/2     0   0
Ja Butler              29   20    7    4   3  10/12   83.3   1/2    50.0   3/3     1   0
Bradley Gobert         29    5    6    7   1   1/3    33.3   0/1     0.0   3/3     0   0
Miles Harris           19    9    0    1   1   3/7    42.9   2/6    33.3   1/2     0   0
Lamelo Westbrook       19   11    0    1   3   4/7    57.1   3/3   100.0   0/0     0   1
Vince Sabonis          19    8    7    2   0   3/8    37.5   1/5    20.0   1/1     0   0
Cade Ball              19    5    4    1   1   3/5    60.0   1/2    50.0   0/0     1   1
Shaquille Sexton       19    2   10    3   0   1/3    33.3   0/1     0.0   0/1     0   0

TEAM: FG: 42/82 (51.2%), 3PT: 18/42 (42.9%), REB: 39 (5 off, 34 def), AST: 24, TO: 11


Team_046
--------------------------------------------------------------------------------
Player                MIN  PTS  REB  AST  TO      FG   FG%      3P   3P%      FT STL BLK
--------------------------------------------------------------------------------
Kevin Allen            36   12    6    3   4   8/13   61.5   0/0     0.0   2/2     1   0
D'Angelo O'Neal        29   16    0    3   3   6/10   60.0   2/5    40.0   2/2     0   0
Victor Nowitzki        29   20    0    1   3   6/8    75.0   4/4   100.0   3/5     0   1
Lauri Carter           29   14    5    4   1   5/11   45.5   1/4    25.0   2/3     0   0
Cade Wall              29    4   17    3   1   3/7    42.9   0/2     0.0   0/0     2   0
Collin Butler          19    6    3    0   3   2/2   100.0   1/1   100.0   1/1     1   0
Manu Dosunmu           19    2    4    0   0   1/5    20.0   0/3     0.0   0/0     0   1
Josh Barrett           19    7    0    2   0   2/6    33.3   1/5    20.0   3/3     0   0
Chris LaVine           19    8    8    0   1   4/7    57.1   0/1     0.0   2/2     0   1
Paul DeRozan           12    2    3    0   1   1/4    25.0   0/0     0.0   0/1     0   0

TEAM: FG: 38/73 (52.1%), 3PT: 9/25 (36.0%), REB: 47 (7 off, 40 def), AST: 16, TO: 17

================================================================================
