================================================================================
                        FULL GAME - Team_079 vs Team_081                        
================================================================================

================================================================================
                       1ST QUARTER - Team_079 vs Team_081                       
================================================================================

[12:00] Team_079 possession (Score: 0-0)
Miles Ming attempts a 3Pt. Contested by Bradley Leonard (3.9 feet, MAN). Miles Ming misses. Offensive rebound by Donovan Randle! Donovan Randle kicks it out.

[11:42] Team_079 possession (Score: 0-0)
Miles Ming throws a bad pass! Stolen by Bradley Leonard! TURNOVER! (live ball)

[11:30] Team_081 possession (Score: 0-0)
Vince Adebayo drives and kicks out. Vince Adebayo attempts a Midrange. Heavily contested by Bam Randle (0.5 feet, MAN)! VINCE ADEBAYO MAKES IT!
Score: 0-2

[11:16] Team_079 possession (Score: 0-2)
Bam Randle attempts a 3Pt. Contested by Vince Adebayo (4.4 feet, ZONE). Bam Randle misses. Rebound secured by Bradley Sabonis.

[10:57] Team_081 possession (Score: 0-2)
Vince Adebayo attempts a Layup. BLOCKED BY TRAE DURANT! Ball is loose! Rebound secured by Trae Durant.

[10:41] Team_079 possession (Score: 0-2)
Miles Ming attempts a 3Pt. Contested by Vince Adebayo (2.4 feet, ZONE). Miles Ming misses. Rebound secured by Bradley Sabonis.

[10:26] Team_081 possession (Score: 0-2)
FOUL! Holding foul on Khris Embiid. [Team fouls: 1] No free throws, side out. (Khris Embiid: 1 personal fouls)

[10:11] Team_081 possession (Score: 0-2)
Vince Adebayo drives, Bam Randle stays with him. Vince Adebayo attempts a Dunk. Contested by Bam Randle (3.0 feet, MAN). VINCE ADEBAYO MAKES IT!
Score: 0-4

[09:51] Team_079 possession (Score: 0-4)
Miles Ming drives, picks up Franz Antetokounmpo. Help arrives from Bradley Leonard! Miles Ming attempts a Layup. Heavily contested by Bradley Leonard (0.5 feet, ZONE)! MILES MING MAKES IT! Assist: Khris Embiid
Score: 2-4

[09:37] Team_081 possession (Score: 2-4)
Bradley Leonard attempts a Layup. Contested by Trae Durant (5.5 feet, ZONE). Bradley Leonard misses. Rebound secured by Trae Durant.

[09:24] Team_079 possession (Score: 2-4)
Trae Durant attempts a 3Pt. Contested by Julius Durant (3.1 feet, ZONE). Trae Durant misses. Rebound secured by Franz Antetokounmpo.

[09:05] Team_081 possession (Score: 2-4)
FOUL! Holding foul on Miles Ming. [Team fouls: 2] No free throws, side out. (Miles Ming: 1 personal fouls)

[08:54] Team_081 possession (Score: 2-4)
Vince Adebayo attempts a Layup. Contested by Bam Randle (2.6 feet, MAN). VINCE ADEBAYO MAKES IT!
Score: 2-6

[08:36] Team_079 possession (Score: 2-6)
Khris Embiid attempts a Midrange. Contested by Bradley Sabonis (4.8 feet, ZONE). Khris Embiid misses. Offensive rebound by Donovan Randle! Donovan Randle kicks it out.

[08:18] Team_079 possession (Score: 2-6)
Miles Ming attempts a 3Pt. Heavily contested by Bradley Leonard (0.5 feet, MAN)! Miles Ming misses. Offensive rebound by Trae Durant! Trae Durant's putback is no good. Rebound secured by Franz Antetokounmpo.

[08:03] Team_081 possession (Score: 2-6)
Vince Adebayo attempts a 3Pt. Contested by Trae Durant (3.6 feet, ZONE). Vince Adebayo misses. Offensive rebound by Franz Antetokounmpo! Franz Antetokounmpo puts it back in!
Score: 2-8

[07:45] Team_079 possession (Score: 2-8)
Khris Embiid attempts a 3Pt. Contested by Julius Durant (3.5 feet, MAN). KHRIS EMBIID MAKES IT! Assist: Miles Ming
Score: 5-8

[07:28] Team_081 possession (Score: 5-8)
Bradley Leonard attempts a 3Pt. Wide open! Trae Durant is 7.5 feet away. [ZONE] BRADLEY LEONARD MAKES IT! Assist: Franz Antetokounmpo
Score: 5-11

[07:13] Team_079 possession (Score: 5-11)
Khris Embiid attempts a 3Pt. Contested by Vince Adebayo (4.8 feet, ZONE). KHRIS EMBIID MAKES IT! Assist: Bam Randle
Score: 8-11

[07:03] Team_081 possession (Score: 8-11)
Bradley Sabonis attempts a 3Pt. Contested by Trae Durant (2.1 feet, MAN). Bradley Sabonis misses. Rebound secured by Bam Randle.

[06:49] Team_079 possession (Score: 8-11)
FOUL! Holding foul on Franz Antetokounmpo. [Team fouls: 1] No free throws, side out. (Franz Antetokounmpo: 1 personal fouls)

[06:36] Team_079 possession (Score: 8-11)
FOUL! Reach-in foul on Franz Antetokounmpo during the drive. [Team fouls: 2] No free throws, side out. (Franz Antetokounmpo: 2 personal fouls)

[06:25] Team_079 possession (Score: 8-11)
Bam Randle drives and kicks out. Khris Embiid attempts a 3Pt. Heavily contested by Julius Durant (0.7 feet, ZONE)! KHRIS EMBIID MAKES IT! Assist: Trae Durant
Score: 11-11

[06:10] Team_081 possession (Score: 11-11)
Bradley Leonard makes the Layup and draws the foul on Trae Durant! And-1! Bradley Leonard to the line for 1. [Team fouls: 3] (Trae Durant: 1 personal fouls)   FT 1/1: GOOD Bradley Leonard makes 1/1 from the line.
Score: 11-14

[05:57] Team_079 possession (Score: 11-14)
FOUL! Offensive foul on Khris Embiid! Julius Durant drew the charge! [Team fouls: 4] (Khris Embiid: 2 personal fouls) TURNOVER! (dead ball)

[05:45] Team_081 possession (Score: 11-14)
Vince Adebayo attempts a 3Pt. Contested by Trae Durant (5.7 feet, ZONE). Vince Adebayo misses. Rebound secured by Donovan Randle.

[05:35] Team_079 possession (Score: 11-14)
Khris Embiid attempts a 3Pt. Heavily contested by Julius Durant (1.0 feet, MAN)! Khris Embiid misses. Rebound secured by Vince Adebayo.

[05:22] Team_081 possession (Score: 11-14)
Bradley Sabonis attempts a 3Pt. Contested by Trae Durant (2.8 feet, ZONE). Bradley Sabonis misses. Rebound secured by Bam Randle.

[05:06] Team_079 possession (Score: 11-14)
Donovan Randle drives to the basket... Donovan Randle loses the ball! Stripped by Franz Antetokounmpo! TURNOVER! (live ball)

[04:55] Team_081 possession (Score: 11-14)
Julius Durant attempts a 3Pt. Contested by Trae Durant (4.2 feet, ZONE). Julius Durant misses. Rebound secured by Trae Durant.

[04:41] Team_079 possession (Score: 11-14)
Bam Randle attempts a Layup. Heavily contested by Vince Adebayo (0.5 feet, MAN)! BAM RANDLE MAKES IT! Assist: Khris Embiid
Score: 13-14

[04:30] Team_081 possession (Score: 13-14)
Julius Durant attempts a 3Pt. Contested by Trae Durant (2.2 feet, ZONE). JULIUS DURANT MAKES IT!
Score: 13-17

[04:15] Team_079 possession (Score: 13-17)
Khris Embiid loses control! Ball rolls out of bounds! TURNOVER! (dead ball)

[03:59] Team_081 possession (Score: 13-17)
Bradley Sabonis attempts a Midrange. Contested by Miles Ming (4.2 feet, ZONE). Bradley Sabonis misses. Rebound secured by Bam Randle.

[03:46] Team_079 possession (Score: 13-17)
Donovan Randle drives to the basket... Donovan Randle throws a bad pass! Stolen by Franz Antetokounmpo! TURNOVER! (live ball)

[03:30] Team_081 possession (Score: 13-17)
Bradley Leonard attempts a Midrange. Contested by Bam Randle (2.5 feet, ZONE). Bradley Leonard misses. Rebound secured by Donovan Randle.

[03:20] Team_079 possession (Score: 13-17)
FOUL! Shooting foul on Bradley Leonard. Khris Embiid to the line for 2 free throws. [Team fouls: 3] (Bradley Leonard: 1 personal fouls)   FT 1/2: GOOD   FT 2/2: GOOD Khris Embiid makes 2/2 from the line.
Score: 15-17

[03:02] Team_081 possession (Score: 15-17)
Bradley Sabonis drives to the basket... Bradley Sabonis loses control! Ball rolls out of bounds! TURNOVER! (dead ball)

[03:02] Substitution (Team_079): Donovan Randle OUT → James LaVine IN (stamina_rule2)

[02:51] Team_079 possession (Score: 15-17)
James LaVine makes the Layup and draws the foul on Franz Antetokounmpo! And-1! James LaVine to the line for 1. [Team fouls: 4] (Franz Antetokounmpo: 3 personal fouls)   FT 1/1: GOOD James LaVine makes 1/1 from the line.
Score: 18-17

[02:36] Team_081 possession (Score: 18-17)
Bradley Sabonis attempts a Layup. Contested by Trae Durant (2.3 feet, ZONE). Bradley Sabonis misses. Rebound secured by Bam Randle.

[02:24] Team_079 possession (Score: 18-17)
James LaVine drives to the basket... James LaVine throws a bad pass out of bounds! TURNOVER! (dead ball)

[02:24] Substitution (Team_079): Miles Ming OUT → Karl Ingram IN (stamina_rule2)

[02:24] Substitution (Team_079): Bam Randle OUT → Anthony Wade IN (stamina_rule2)

[02:24] Substitution (Team_081): Vince Adebayo OUT → Larry Adebayo IN (stamina_rule2)

[02:24] Substitution (Team_081): Franz Antetokounmpo OUT → D'Angelo Markkanen IN (stamina_rule2)

[02:10] Team_081 possession (Score: 18-17)
Bradley Leonard attempts a 3Pt. Wide open! Karl Ingram is 6.4 feet away. [MAN] Bradley Leonard misses. Rebound secured by Anthony Wade.

[01:55] Team_079 possession (Score: 18-17)
James LaVine attempts a 3Pt. Contested by Bradley Leonard (4.0 feet, ZONE). James LaVine misses. Offensive rebound by Trae Durant! Trae Durant kicks it out.

[01:38] Team_079 possession (Score: 18-17)
Trae Durant attempts a Dunk. BLOCKED BY BRADLEY SABONIS! Ball is loose! Rebound secured by Larry Adebayo.

[01:21] Team_081 possession (Score: 18-17)
Larry Adebayo attempts a Midrange. Wide open! James LaVine is 7.3 feet away. [ZONE] Larry Adebayo misses. Offensive rebound by Larry Adebayo! Larry Adebayo kicks it out.

[01:10] Team_081 possession (Score: 18-17)
Bradley Leonard attempts a 3Pt. Heavily contested by Trae Durant (0.5 feet, ZONE)! Bradley Leonard misses. Rebound secured by Anthony Wade.

[00:58] Team_079 possession (Score: 18-17)
FOUL! Holding foul on Bradley Leonard. [IN THE BONUS! 5 team fouls] Karl Ingram to the line for 2 free throws. (Bradley Leonard: 2 personal fouls)   FT 1/2: GOOD   FT 2/2: GOOD Karl Ingram makes 2/2 from the line.
Score: 20-17

[00:39] Team_081 possession (Score: 20-17)
D'Angelo Markkanen drives to the basket... D'Angelo Markkanen throws a bad pass out of bounds! TURNOVER! (dead ball)

[00:39] Substitution (Team_079): Khris Embiid OUT → Evan Mobley IN (stamina_rule2)

[00:39] Substitution (Team_079): Trae Durant OUT → Kobe Curry IN (stamina_rule2)

[00:39] Substitution (Team_081): Julius Durant OUT → Dejounte Bane IN (stamina_rule2)

[00:39] Substitution (Team_081): Bradley Leonard OUT → Lamelo Wade IN (stamina_rule2)

[00:39] Substitution (Team_081): Bradley Sabonis OUT → Chris Holiday IN (stamina_rule2)

[00:29] Team_079 possession (Score: 20-17)
Karl Ingram attempts a 3Pt. Wide open! Lamelo Wade is 6.5 feet away. [MAN] Karl Ingram misses. Rebound secured by Larry Adebayo.

[00:15] Team_081 possession (Score: 20-17)
FOUL! Offensive foul on Dejounte Bane! Evan Mobley drew the charge! [Team fouls: 6] (Dejounte Bane: 1 personal fouls) TURNOVER! (dead ball)

[00:02] Team_079 possession (Score: 20-17)
Evan Mobley attempts a Midrange. Contested by Chris Holiday (2.6 feet, ZONE). EVAN MOBLEY MAKES IT! Assist: Karl Ingram
Score: 22-17

================================================================================
                              1ST QUARTER COMPLETE                              
================================================================================

1ST QUARTER SCORE: Team_079 22, Team_081 17

BOX SCORE:
================================================================================

Team_079
--------------------------------------------------------------------------------
Player                MIN  PTS  REB  AST  TO      FG   FG%      3P   3P%
--------------------------------------------------------------------------------
Khris Embiid           12   11    0    2   0   4/5    80.0     0/0   0.0
James LaVine            3    3    0    0   0   1/1   100.0     0/0   0.0
Bam Randle             10    2    4    1   0   1/2    50.0     0/0   0.0
Miles Ming             10    2    0    1   0   1/3    33.3     0/0   0.0
Karl Ingram             2    2    0    1   0   1/2    50.0     0/0   0.0
Evan Mobley             1    2    0    0   0   1/1   100.0     0/0   0.0
Donovan Randle          9    0    4    0   0   0/0     0.0     0/0   0.0
Trae Durant            12    0    4    1   0   0/2     0.0     0/0   0.0
Anthony Wade            2    0    2    0   0   0/0     0.0     0/0   0.0

TEAM: FG: 9/16 (56.2%), 3PT: 2/8 (25.0%), REB: 15 (4 off, 11 def), AST: 6, TO: 6
TEAM FOULS: 4


Team_081
--------------------------------------------------------------------------------
Player                MIN  PTS  REB  AST  TO      FG   FG%      3P   3P%
--------------------------------------------------------------------------------
Vince Adebayo          10    6    1    0   0   3/5    60.0     0/0   0.0
Bradley Leonard        12    6    0    0   0   2/6    33.3     0/0   0.0
Julius Durant          12    3    0    0   0   1/2    50.0     0/0   0.0
Franz Antetokounmpo    10    2    3    1   0   1/1   100.0     0/0   0.0
Bradley Sabonis        12    0    2    0   0   0/4     0.0     0/0   0.0
Larry Adebayo           2    0    3    0   0   0/0     0.0     0/0   0.0

TEAM: FG: 7/18 (38.9%), 3PT: 3/9 (33.3%), REB: 8 (2 off, 6 def), AST: 1, TO: 3
TEAM FOULS: 6 [Team_079 in BONUS]

================================================================================

================================================================================
                       2ND QUARTER - Team_079 vs Team_081                       
================================================================================

[12:00] Team_079 possession (Score: 22-17)
Khris Embiid attempts a 3Pt. Contested by Vince Adebayo (4.6 feet, ZONE). Khris Embiid misses. Rebound secured by Franz Antetokounmpo.

[11:48] Team_081 possession (Score: 22-17)
Bradley Leonard attempts a 3Pt. BLOCKED BY TRAE DURANT! Ball is loose! Offensive rebound by Franz Antetokounmpo! Franz Antetokounmpo kicks it out.

[11:35] Team_081 possession (Score: 22-17)
Bradley Sabonis attempts a Midrange. Contested by Trae Durant (3.9 feet, ZONE). BRADLEY SABONIS MAKES IT!
Score: 22-19

[11:18] Team_079 possession (Score: 22-19)
FOUL! Holding foul on Vince Adebayo. [Team fouls: 1] No free throws, side out. (Vince Adebayo: 1 personal fouls)

[11:06] Team_079 possession (Score: 22-19)
Khris Embiid makes the Layup and draws the foul on Franz Antetokounmpo! And-1! Khris Embiid to the line for 1. [Team fouls: 2] (Franz Antetokounmpo: 1 personal fouls)   FT 1/1: GOOD Khris Embiid makes 1/1 from the line.
Score: 25-19

[10:53] Team_081 possession (Score: 25-19)
Vince Adebayo attempts a Midrange. Contested by Bam Randle (2.8 feet, MAN). Vince Adebayo misses. Rebound secured by Donovan Randle.

[10:42] Team_079 possession (Score: 25-19)
Donovan Randle attempts a 3Pt. Wide open! Franz Antetokounmpo is 6.9 feet away. [MAN] Donovan Randle misses. Offensive rebound by Donovan Randle! Donovan Randle kicks it out.

[10:27] Team_079 possession (Score: 25-19)
Khris Embiid attempts a 3Pt. Contested by Julius Durant (3.8 feet, MAN). KHRIS EMBIID MAKES IT! Assist: Miles Ming
Score: 28-19

[10:16] Team_081 possession (Score: 28-19)
Vince Adebayo drives to the basket... Vince Adebayo loses control! Ball rolls out of bounds! TURNOVER! (dead ball)

[10:16] Substitution (Team_079): Khris Embiid OUT → Evan Mobley IN (stamina_rule2)

[10:16] Substitution (Team_079): Trae Durant OUT → Kobe Curry IN (stamina_rule2)

[10:16] Substitution (Team_081): Julius Durant OUT → Dejounte Bane IN (stamina_rule2)

[10:16] Substitution (Team_081): Bradley Leonard OUT → Lamelo Wade IN (stamina_rule2)

[10:16] Substitution (Team_081): Bradley Sabonis OUT → Chris Holiday IN (stamina_rule2)

[09:59] Team_079 possession (Score: 28-19)
Evan Mobley drives, Dejounte Bane stays with him. Evan Mobley attempts a Layup. Wide open! Dejounte Bane is 6.7 feet away. [MAN] EVAN MOBLEY MAKES IT!
Score: 30-19

[09:45] Team_081 possession (Score: 30-19)
Dejounte Bane drives, picks up Evan Mobley. Help arrives from Miles Ming! Dejounte Bane attempts a Dunk. Contested by Miles Ming (5.5 feet, MAN). DEJOUNTE BANE MAKES IT! Assist: Lamelo Wade
Score: 30-21

[09:30] Team_079 possession (Score: 30-21)
Donovan Randle attempts a Midrange. Contested by Lamelo Wade (4.0 feet, ZONE). DONOVAN RANDLE MAKES IT! Assist: Kobe Curry
Score: 32-21

[09:17] Team_081 possession (Score: 32-21)
FOUL! Shooting foul on Evan Mobley. Chris Holiday to the line for 2 free throws. [Team fouls: 1] (Evan Mobley: 1 personal fouls)   FT 1/2: GOOD   FT 2/2: GOOD Chris Holiday makes 2/2 from the line.
Score: 32-23

[08:59] Team_079 possession (Score: 32-23)
Donovan Randle attempts a Midrange. Wide open! Franz Antetokounmpo is 8.3 feet away. [MAN] DONOVAN RANDLE MAKES IT! Assist: Bam Randle
Score: 34-23

[08:47] Team_081 possession (Score: 34-23)
Vince Adebayo attempts a 3Pt. Contested by Bam Randle (4.2 feet, MAN). Vince Adebayo misses. Rebound secured by Bam Randle.

[08:34] Team_079 possession (Score: 34-23)
Kobe Curry attempts a Midrange. Wide open! Franz Antetokounmpo is 6.6 feet away. [ZONE] KOBE CURRY MAKES IT!
Score: 36-23

[08:19] Team_081 possession (Score: 36-23)
Franz Antetokounmpo attempts a 3Pt. Contested by Miles Ming (2.8 feet, ZONE). Franz Antetokounmpo misses. Rebound secured by Kobe Curry.

[08:02] Team_079 possession (Score: 36-23)
Miles Ming drives and kicks out. Miles Ming attempts a 3Pt. Contested by Vince Adebayo (4.1 feet, ZONE). MILES MING MAKES IT! Assist: Kobe Curry
Score: 39-23

[07:50] Team_081 possession (Score: 39-23)
Vince Adebayo makes the Dunk and draws the foul on Bam Randle! And-1! Vince Adebayo to the line for 1. [Team fouls: 2] (Bam Randle: 1 personal fouls)   FT 1/1: GOOD Vince Adebayo makes 1/1 from the line.
Score: 39-26

[07:34] Team_079 possession (Score: 39-26)
FOUL! Shooting foul on Lamelo Wade. Kobe Curry to the line for 2 free throws. [Team fouls: 3] (Lamelo Wade: 1 personal fouls)   FT 1/2: GOOD   FT 2/2: GOOD Kobe Curry makes 2/2 from the line.
Score: 41-26

[07:15] Team_081 possession (Score: 41-26)
Lamelo Wade attempts a 3Pt. Heavily contested by Miles Ming (1.8 feet, MAN)! Lamelo Wade misses. Rebound secured by Kobe Curry.

[07:04] Team_079 possession (Score: 41-26)
Evan Mobley attempts a 3Pt. Wide open! Dejounte Bane is 8.0 feet away. [MAN] Evan Mobley misses. Rebound secured by Franz Antetokounmpo.

[06:49] Team_081 possession (Score: 41-26)
Lamelo Wade attempts a 3Pt. Wide open! Miles Ming is 6.7 feet away. [MAN] Lamelo Wade misses. Rebound secured by Bam Randle.

[06:34] Team_079 possession (Score: 41-26)
Evan Mobley attempts a 3Pt. Heavily contested by Chris Holiday (0.5 feet, ZONE)! Evan Mobley misses. Rebound secured by Chris Holiday.

[06:18] Team_081 possession (Score: 41-26)
Vince Adebayo drives and kicks out. Lamelo Wade attempts a Midrange. Wide open! Kobe Curry is 6.2 feet away. [ZONE] LAMELO WADE MAKES IT! Assist: Franz Antetokounmpo
Score: 41-28

[06:01] Team_079 possession (Score: 41-28)
Donovan Randle attempts a 3Pt. Contested by Vince Adebayo (4.0 feet, ZONE). Donovan Randle misses. Rebound secured by Lamelo Wade.

[05:45] Team_081 possession (Score: 41-28)
Vince Adebayo drives and kicks out. Dejounte Bane attempts a Midrange. Heavily contested by Evan Mobley (1.8 feet, MAN)! DEJOUNTE BANE MAKES IT! Assist: Lamelo Wade
Score: 41-30

[05:29] Team_079 possession (Score: 41-30)
Bam Randle drives to the basket... Bam Randle throws a bad pass! Stolen by Franz Antetokounmpo! TURNOVER! (live ball)

[05:12] Team_081 possession (Score: 41-30)
Lamelo Wade attempts a 3Pt. Contested by Miles Ming (4.0 feet, ZONE). Lamelo Wade misses. Rebound secured by Kobe Curry.

[04:58] Team_079 possession (Score: 41-30)
Donovan Randle drives and kicks out. Evan Mobley attempts a 3Pt. Wide open! Dejounte Bane is 7.6 feet away. [ZONE] Evan Mobley misses. Rebound secured by Franz Antetokounmpo.

[04:46] Team_081 possession (Score: 41-30)
Franz Antetokounmpo attempts a Layup. BLOCKED BY DONOVAN RANDLE! Ball is loose! Rebound secured by Kobe Curry.

[04:32] Team_079 possession (Score: 41-30)
Miles Ming attempts a 3Pt. Heavily contested by Lamelo Wade (1.1 feet, MAN)! MILES MING MAKES IT! Assist: Kobe Curry
Score: 44-30

[04:16] Team_081 possession (Score: 44-30)
Dejounte Bane attempts a 3Pt. Wide open! Evan Mobley is 8.1 feet away. [MAN] Dejounte Bane misses. Rebound secured by Kobe Curry.

[04:01] Team_079 possession (Score: 44-30)
Bam Randle attempts a Midrange. Contested by Vince Adebayo (4.9 feet, MAN). Bam Randle misses. Rebound secured by Lamelo Wade.

[03:45] Team_081 possession (Score: 44-30)
Vince Adebayo attempts a 3Pt. Wide open! Evan Mobley is 8.0 feet away. [ZONE] Vince Adebayo misses. FOUL! Loose ball foul on Kobe Curry during the rebound battle. [Team fouls: 3] No free throws, side out. (Kobe Curry: 1 personal fouls)

[03:29] Team_081 possession (Score: 44-30)
Chris Holiday attempts a 3Pt. Contested by Miles Ming (5.8 feet, ZONE). Chris Holiday misses. Rebound secured by Kobe Curry.

[03:14] Team_079 possession (Score: 44-30)
Bam Randle attempts a 3Pt. Wide open! Vince Adebayo is 6.5 feet away. [MAN] Bam Randle misses. FOUL! Loose ball foul on Chris Holiday during the rebound battle. [Team fouls: 4] No free throws, side out. (Chris Holiday: 1 personal fouls)

[03:00] Team_079 possession (Score: 44-30)
Donovan Randle attempts a Layup. Contested by Chris Holiday (2.4 feet, ZONE). Donovan Randle misses. Offensive rebound by Kobe Curry! Kobe Curry kicks it out.

[02:46] Team_079 possession (Score: 44-30)
Kobe Curry drives to the basket... Kobe Curry loses the ball! Stripped by Chris Holiday! TURNOVER! (live ball)

[02:33] Team_081 possession (Score: 44-30)
Dejounte Bane drives, Kobe Curry stays with him. Dejounte Bane attempts a Dunk. Heavily contested by Kobe Curry (0.6 feet, ZONE)! DEJOUNTE BANE MAKES IT!
Score: 44-32

[02:21] Team_079 possession (Score: 44-32)
Bam Randle attempts a Midrange. Contested by Vince Adebayo (2.3 feet, MAN). Bam Randle misses. Rebound secured by Franz Antetokounmpo.

[02:02] Team_081 possession (Score: 44-32)
Lamelo Wade attempts a Layup. Contested by Kobe Curry (3.5 feet, ZONE). Lamelo Wade misses. Rebound secured by Donovan Randle.

[01:47] Team_079 possession (Score: 44-32)
Bam Randle drives, Vince Adebayo stays with him. Bam Randle attempts a Dunk. Contested by Vince Adebayo (4.5 feet, MAN). Bam Randle misses. Rebound secured by Lamelo Wade.

[01:29] Team_081 possession (Score: 44-32)
Chris Holiday makes the Layup and draws the foul on Kobe Curry! And-1! Chris Holiday to the line for 1. [Team fouls: 4] (Kobe Curry: 2 personal fouls)   FT 1/1: MISS Chris Holiday makes 0/1 from the line. Rebound secured by Evan Mobley.
Score: 44-34

[01:16] Team_079 possession (Score: 44-34)
Kobe Curry drives to the basket... FOUL! Offensive foul on Kobe Curry! Chris Holiday drew the charge! [Team fouls: 5] (Kobe Curry: 3 personal fouls) TURNOVER! (dead ball)

[01:02] Team_081 possession (Score: 44-34)
FOUL! Reach-in foul on Bam Randle during the drive. [IN THE BONUS! 6 team fouls] Vince Adebayo to the line for 2 free throws. (Bam Randle: 2 personal fouls)   FT 1/2: GOOD   FT 2/2: GOOD Vince Adebayo makes 2/2 from the line.
Score: 44-36

[00:43] Team_079 possession (Score: 44-36)
Miles Ming attempts a 3Pt. Contested by Vince Adebayo (5.4 feet, ZONE). Miles Ming misses. Rebound secured by Chris Holiday.

[00:29] Team_081 possession (Score: 44-36)
Franz Antetokounmpo drives to the basket... Franz Antetokounmpo throws a bad pass out of bounds! TURNOVER! (dead ball)

[00:29] Substitution (Team_079): Miles Ming OUT → Karl Ingram IN (stamina_rule2)

[00:29] Substitution (Team_079): Bam Randle OUT → Anthony Wade IN (stamina_rule2)

[00:29] Substitution (Team_079): Donovan Randle OUT → James LaVine IN (stamina_rule2)

[00:29] Substitution (Team_081): Vince Adebayo OUT → Larry Adebayo IN (stamina_rule2)

[00:29] Substitution (Team_081): Franz Antetokounmpo OUT → D'Angelo Markkanen IN (stamina_rule2)

[00:14] Team_079 possession (Score: 44-36)
James LaVine attempts a 3Pt. Contested by Chris Holiday (5.5 feet, ZONE). James LaVine misses. Rebound secured by Larry Adebayo.

[00:02] Team_081 possession (Score: 44-36)
FOUL! Shooting foul on James LaVine. D'Angelo Markkanen to the line for 2 free throws. [BONUS: 7 team fouls] (James LaVine: 1 personal fouls)   FT 1/2: GOOD   FT 2/2: GOOD D'Angelo Markkanen makes 2/2 from the line.
Score: 44-38

================================================================================
                              2ND QUARTER COMPLETE                              
================================================================================

2ND QUARTER SCORE: Team_079 22, Team_081 21

BOX SCORE:
================================================================================

Team_079
--------------------------------------------------------------------------------
Player                MIN  PTS  REB  AST  TO      FG   FG%      3P   3P%
--------------------------------------------------------------------------------
Khris Embiid           14    6    0    0   0   2/3    66.7     0/0   0.0
Miles Ming             22    6    0    1   0   2/3    66.7     0/0   0.0
Donovan Randle         21    4    4    0   0   2/4    50.0     0/0   0.0
Kobe Curry             11    4    7    3   0   2/2   100.0     0/0   0.0
Evan Mobley            11    2    1    0   0   1/3    33.3     0/0   0.0
Bam Randle             22    0    2    1   0   0/3     0.0     0/0   0.0
James LaVine            4    0    0    0   0   0/1     0.0     0/0   0.0

TEAM: FG: 9/19 (47.4%), 3PT: 2/8 (25.0%), REB: 14 (3 off, 11 def), AST: 5, TO: 3
TEAM FOULS: 7 [Team_081 in BONUS]


Team_081
--------------------------------------------------------------------------------
Player                MIN  PTS  REB  AST  TO      FG   FG%      3P   3P%
--------------------------------------------------------------------------------
Dejounte Bane          11    6    0    0   0   3/4    75.0     0/0   0.0
Vince Adebayo          22    5    0    0   0   2/4    50.0     0/0   0.0
Bradley Sabonis        14    2    0    0   0   1/1   100.0     0/0   0.0
Lamelo Wade            11    2    3    2   0   1/5    20.0     0/0   0.0
Chris Holiday          11    2    3    0   0   1/3    33.3     0/0   0.0
D'Angelo Markkanen      3    2    0    0   0   1/1   100.0     0/0   0.0
Franz Antetokounmpo    22    0    5    1   0   0/2     0.0     0/0   0.0
Larry Adebayo           3    0    1    0   0   0/0     0.0     0/0   0.0

TEAM: FG: 9/20 (45.0%), 3PT: 0/7 (0.0%), REB: 12 (2 off, 10 def), AST: 3, TO: 2
TEAM FOULS: 4

================================================================================

================================================================================
                       3RD QUARTER - Team_079 vs Team_081                       
================================================================================

[12:00] Team_079 possession (Score: 44-38)
Trae Durant attempts a 3Pt. Contested by Vince Adebayo (3.5 feet, ZONE). Trae Durant misses. Rebound secured by Bradley Sabonis.

[11:50] Team_081 possession (Score: 44-38)
Vince Adebayo attempts a 3Pt. Heavily contested by Trae Durant (1.3 feet, ZONE)! Vince Adebayo misses. Offensive rebound by Bradley Sabonis! Bradley Sabonis kicks it out.

[11:34] Team_081 possession (Score: 44-38)
FOUL! Shooting foul on Trae Durant. Vince Adebayo to the line for 2 free throws. [Team fouls: 1] (Trae Durant: 1 personal fouls)   FT 1/2: GOOD   FT 2/2: MISS Vince Adebayo makes 1/2 from the line. FOUL! Loose ball foul on Donovan Randle during the free throw rebound! [Team fouls: 2] No free throws, side out. (Donovan Randle: 1 personal fouls)
Score: 44-39

[11:22] Team_081 possession (Score: 44-39)
Bradley Leonard attempts a Layup. Contested by Miles Ming (2.3 feet, MAN). BRADLEY LEONARD MAKES IT! Assist: Franz Antetokounmpo
Score: 44-41

[11:08] Team_079 possession (Score: 44-41)
Trae Durant drives, picks up Bradley Sabonis. Help arrives from Bradley Leonard! Trae Durant attempts a Dunk. Heavily contested by Bradley Leonard (1.4 feet, MAN)! TRAE DURANT MAKES IT! Assist: Khris Embiid
Score: 46-41

[10:58] Team_081 possession (Score: 46-41)
Bradley Sabonis drives, Trae Durant stays with him. Bradley Sabonis attempts a Dunk. Heavily contested by Trae Durant (0.5 feet, ZONE)! Bradley Sabonis misses. Rebound secured by Trae Durant.

[10:45] Team_079 possession (Score: 46-41)
Miles Ming attempts a 3Pt. Heavily contested by Vince Adebayo (0.5 feet, ZONE)! Miles Ming misses. Offensive rebound by Trae Durant! Trae Durant puts it back in!
Score: 48-41

[10:29] Team_081 possession (Score: 48-41)
Bradley Leonard attempts a 3Pt. Contested by Miles Ming (3.3 feet, MAN). Bradley Leonard misses. Rebound secured by Bam Randle.

[10:17] Team_079 possession (Score: 48-41)
Trae Durant attempts a Midrange. Contested by Bradley Leonard (4.9 feet, ZONE). TRAE DURANT MAKES IT!
Score: 50-41

[10:00] Team_081 possession (Score: 50-41)
FOUL! Shooting foul on Khris Embiid. Julius Durant to the line for 2 free throws. [Team fouls: 3] (Khris Embiid: 1 personal fouls)   FT 1/2: GOOD   FT 2/2: GOOD Julius Durant makes 2/2 from the line.
Score: 50-43

[09:46] Team_079 possession (Score: 50-43)
Donovan Randle makes the Layup and draws the foul on Bradley Sabonis! And-1! Donovan Randle to the line for 1. [Team fouls: 1] (Bradley Sabonis: 1 personal fouls)   FT 1/1: GOOD Donovan Randle makes 1/1 from the line.
Score: 53-43

[09:28] Team_081 possession (Score: 53-43)
Bradley Sabonis attempts a 3Pt. Contested by Trae Durant (2.1 feet, MAN). Bradley Sabonis misses. Rebound secured by Trae Durant.

[09:13] Team_079 possession (Score: 53-43)
Donovan Randle drives, Franz Antetokounmpo stays with him. Donovan Randle attempts a Dunk. Wide open! Franz Antetokounmpo is 7.0 feet away. [MAN] DONOVAN RANDLE MAKES IT! Assist: Miles Ming
Score: 55-43

[08:57] Team_081 possession (Score: 55-43)
Franz Antetokounmpo throws a bad pass! Stolen by Donovan Randle! TURNOVER! (live ball)

[08:42] Team_079 possession (Score: 55-43)
FOUL! Holding foul on Franz Antetokounmpo. [Team fouls: 2] No free throws, side out. (Franz Antetokounmpo: 1 personal fouls)

[08:29] Team_079 possession (Score: 55-43)
Miles Ming drives and kicks out. Khris Embiid makes the 3Pt and draws the foul on Julius Durant! And-1! Khris Embiid to the line for 1. [Team fouls: 3] (Julius Durant: 1 personal fouls)   FT 1/1: GOOD Khris Embiid makes 1/1 from the line.
Score: 59-43

[08:19] Team_081 possession (Score: 59-43)
Bradley Leonard attempts a Midrange. Contested by Trae Durant (4.8 feet, ZONE). Bradley Leonard misses. Offensive rebound by Franz Antetokounmpo! Franz Antetokounmpo puts it back in!
Score: 59-45

[08:06] Team_079 possession (Score: 59-45)
Khris Embiid attempts a 3Pt. Contested by Julius Durant (5.8 feet, MAN). Khris Embiid misses. Rebound secured by Bradley Sabonis.

[07:48] Team_081 possession (Score: 59-45)
Bradley Sabonis drives, Trae Durant stays with him. Bradley Sabonis attempts a Dunk. Heavily contested by Trae Durant (0.5 feet, MAN)! Bradley Sabonis misses. Rebound secured by Bam Randle.

[07:34] Team_079 possession (Score: 59-45)
Miles Ming attempts a 3Pt. Contested by Vince Adebayo (5.1 feet, ZONE). Miles Ming misses. Rebound secured by Bradley Sabonis.

[07:19] Team_081 possession (Score: 59-45)
FOUL! Shooting foul on Khris Embiid. Julius Durant to the line for 2 free throws. [Team fouls: 4] (Khris Embiid: 2 personal fouls)   FT 1/2: GOOD   FT 2/2: GOOD Julius Durant makes 2/2 from the line.
Score: 59-47

[07:01] Team_079 possession (Score: 59-47)
Trae Durant drives, Bradley Sabonis stays with him. Trae Durant attempts a Dunk. Contested by Bradley Sabonis (3.1 feet, MAN). TRAE DURANT MAKES IT!
Score: 61-47

[06:46] Team_081 possession (Score: 61-47)
Julius Durant attempts a 3Pt. Wide open! Khris Embiid is 7.1 feet away. [ZONE] Julius Durant misses. Rebound secured by Donovan Randle.

[06:35] Team_079 possession (Score: 61-47)
Bam Randle attempts a 3Pt. Heavily contested by Vince Adebayo (1.7 feet, MAN)! Bam Randle misses. Rebound secured by Bradley Sabonis.

[06:18] Team_081 possession (Score: 61-47)
Franz Antetokounmpo attempts a Midrange. Contested by Donovan Randle (2.9 feet, MAN). FRANZ ANTETOKOUNMPO MAKES IT!
Score: 61-49

[06:01] Team_079 possession (Score: 61-49)
Donovan Randle attempts a Layup. Contested by Franz Antetokounmpo (4.8 feet, MAN). DONOVAN RANDLE MAKES IT! Assist: Khris Embiid
Score: 63-49

[05:50] Team_081 possession (Score: 63-49)
Bradley Leonard attempts a 3Pt. Contested by Trae Durant (4.8 feet, ZONE). Bradley Leonard misses. Rebound secured by Trae Durant.

[05:32] Team_079 possession (Score: 63-49)
FOUL! Reach-in foul on Franz Antetokounmpo during the drive. [Team fouls: 4] No free throws, side out. (Franz Antetokounmpo: 2 personal fouls)

[05:17] Team_079 possession (Score: 63-49)
Donovan Randle drives and kicks out. Donovan Randle attempts a 3Pt. Contested by Vince Adebayo (2.9 feet, ZONE). Donovan Randle misses. Rebound secured by Franz Antetokounmpo.

[05:05] Team_081 possession (Score: 63-49)
Vince Adebayo attempts a 3Pt. Contested by Bam Randle (5.3 feet, MAN). Vince Adebayo misses. Rebound secured by Bam Randle.

[04:51] Team_079 possession (Score: 63-49)
Khris Embiid attempts a Layup. BLOCKED BY JULIUS DURANT! Ball is loose! Rebound secured by Franz Antetokounmpo.

[04:36] Team_081 possession (Score: 63-49)
Julius Durant attempts a 3Pt. Contested by Bam Randle (4.4 feet, ZONE). Julius Durant misses. Rebound secured by Bam Randle.

[04:19] Team_079 possession (Score: 63-49)
Donovan Randle attempts a Layup. Contested by Franz Antetokounmpo (3.4 feet, ZONE). DONOVAN RANDLE MAKES IT! Assist: Khris Embiid
Score: 65-49

[04:07] Team_081 possession (Score: 65-49)
Julius Durant attempts a 3Pt. Contested by Khris Embiid (3.4 feet, MAN). Julius Durant misses. Rebound secured by Trae Durant.

[03:55] Team_079 possession (Score: 65-49)
Miles Ming drives and kicks out. Miles Ming attempts a 3Pt. Contested by Bradley Leonard (2.2 feet, ZONE). MILES MING MAKES IT! Assist: Khris Embiid
Score: 68-49

[03:39] Team_081 possession (Score: 68-49)
Franz Antetokounmpo drives to the basket... Franz Antetokounmpo throws a bad pass out of bounds! TURNOVER! (dead ball)

[03:24] Team_079 possession (Score: 68-49)
FOUL! Holding foul on Bradley Sabonis. [IN THE BONUS! 5 team fouls] Trae Durant to the line for 2 free throws. (Bradley Sabonis: 2 personal fouls)   FT 1/2: GOOD   FT 2/2: GOOD Trae Durant makes 2/2 from the line.
Score: 70-49

[03:06] Team_081 possession (Score: 70-49)
Bradley Leonard attempts a 3Pt. Contested by Miles Ming (3.7 feet, MAN). Bradley Leonard misses. Rebound secured by Donovan Randle.

[02:53] Team_079 possession (Score: 70-49)
Trae Durant attempts a 3Pt. Contested by Bradley Sabonis (4.2 feet, MAN). Trae Durant misses. Rebound secured by Franz Antetokounmpo.

[02:38] Team_081 possession (Score: 70-49)
Julius Durant attempts a Midrange. Contested by Bam Randle (4.7 feet, ZONE). Julius Durant misses. FOUL! Loose ball foul on Donovan Randle during the rebound battle. [IN THE BONUS! 5 team fouls] Franz Antetokounmpo to the line for 2 free throws. (Donovan Randle: 2 personal fouls)   FT 1/2: MISS   FT 2/2: GOOD Franz Antetokounmpo makes 1/2 from the line.
Score: 70-50

[02:27] Team_079 possession (Score: 70-50)
Miles Ming throws a bad pass out of bounds! TURNOVER! (dead ball)

[02:27] Substitution (Team_079): Miles Ming OUT → Karl Ingram IN (stamina_rule2)

[02:27] Substitution (Team_079): Bam Randle OUT → Anthony Wade IN (stamina_rule2)

[02:27] Substitution (Team_079): Donovan Randle OUT → James LaVine IN (stamina_rule2)

[02:27] Substitution (Team_081): Vince Adebayo OUT → Larry Adebayo IN (stamina_rule2)

[02:27] Substitution (Team_081): Franz Antetokounmpo OUT → D'Angelo Markkanen IN (stamina_rule2)

[02:14] Team_081 possession (Score: 70-50)
Julius Durant attempts a 3Pt. Contested by Trae Durant (4.6 feet, ZONE). Julius Durant misses. Rebound secured by James LaVine.

[02:03] Team_079 possession (Score: 70-50)
Anthony Wade attempts a 3Pt. Contested by Bradley Leonard (4.3 feet, ZONE). Anthony Wade misses. Offensive rebound by Trae Durant! Trae Durant kicks it out.

[01:50] Team_079 possession (Score: 70-50)
FOUL! Holding foul on Bradley Sabonis. [IN THE BONUS! 6 team fouls] Trae Durant to the line for 2 free throws. (Bradley Sabonis: 3 personal fouls)   FT 1/2: GOOD   FT 2/2: GOOD Trae Durant makes 2/2 from the line.
Score: 72-50

[01:36] Team_081 possession (Score: 72-50)
D'Angelo Markkanen drives, picks up James LaVine. Help arrives from Karl Ingram! D'Angelo Markkanen attempts a Layup. Contested by Karl Ingram (5.3 feet, MAN). D'ANGELO MARKKANEN MAKES IT! Assist: Bradley Leonard
Score: 72-52

[01:22] Team_079 possession (Score: 72-52)
Karl Ingram throws a bad pass! Stolen by Bradley Leonard! TURNOVER! (live ball)

[01:04] Team_081 possession (Score: 72-52)
Julius Durant attempts a 3Pt. Contested by Trae Durant (3.6 feet, ZONE). Julius Durant misses. Rebound secured by Trae Durant.

[00:51] Team_079 possession (Score: 72-52)
Karl Ingram makes the Dunk and draws the foul on Bradley Leonard! And-1! Karl Ingram to the line for 1. [BONUS: 7 team fouls] (Bradley Leonard: 1 personal fouls)   FT 1/1: GOOD Karl Ingram makes 1/1 from the line.
Score: 75-52

[00:36] Team_081 possession (Score: 75-52)
Bradley Sabonis attempts a 3Pt. Contested by Trae Durant (2.8 feet, MAN). Bradley Sabonis misses. Offensive rebound by Larry Adebayo! Larry Adebayo kicks it out.

[00:19] Team_081 possession (Score: 75-52)
Julius Durant attempts a 3Pt. Wide open! Khris Embiid is 6.8 feet away. [MAN] JULIUS DURANT MAKES IT! Assist: Larry Adebayo
Score: 75-55

[00:05] Team_079 possession (Score: 75-55)
Anthony Wade drives, picks up Bradley Sabonis. Help arrives from Bradley Leonard! Anthony Wade attempts a Dunk. Wide open! Bradley Leonard is 6.5 feet away. [ZONE] ANTHONY WADE MAKES IT! Assist: Khris Embiid
Score: 77-55

================================================================================
                              3RD QUARTER COMPLETE                              
================================================================================

3RD QUARTER SCORE: Team_079 33, Team_081 17

BOX SCORE:
================================================================================

Team_079
--------------------------------------------------------------------------------
Player                MIN  PTS  REB  AST  TO      FG   FG%      3P   3P%
--------------------------------------------------------------------------------
Trae Durant            26   12    7    0   0   6/8    75.0     0/0   0.0
Donovan Randle         31    9    2    0   0   4/5    80.0     0/0   0.0
Khris Embiid           26    4    0    5   0   1/3    33.3     0/0   0.0
Miles Ming             31    3    0    1   0   1/2    50.0     0/0   0.0
Karl Ingram             5    3    0    0   0   1/1   100.0     0/0   0.0
Anthony Wade            5    2    0    0   0   1/1   100.0     0/0   0.0
Bam Randle             31    0    4    0   0   0/1     0.0     0/0   0.0
James LaVine            6    0    1    0   0   0/0     0.0     0/0   0.0

TEAM: FG: 14/21 (66.7%), 3PT: 1/6 (16.7%), REB: 14 (2 off, 12 def), AST: 6, TO: 2
TEAM FOULS: 5 [Team_081 in BONUS]


Team_081
--------------------------------------------------------------------------------
Player                MIN  PTS  REB  AST  TO      FG   FG%      3P   3P%
--------------------------------------------------------------------------------
Julius Durant          26    7    0    0   0   3/8    37.5     0/0   0.0
Franz Antetokounmpo    31    5    5    1   0   3/3   100.0     0/0   0.0
Bradley Leonard        26    2    0    1   0   1/4    25.0     0/0   0.0
D'Angelo Markkanen      5    2    0    0   0   1/1   100.0     0/0   0.0
Bradley Sabonis        26    0    5    0   0   0/3     0.0     0/0   0.0
Vince Adebayo          31    0    0    0   0   0/1     0.0     0/0   0.0
Larry Adebayo           5    0    1    1   0   0/0     0.0     0/0   0.0

TEAM: FG: 8/20 (40.0%), 3PT: 1/11 (9.1%), REB: 11 (4 off, 7 def), AST: 3, TO: 2
TEAM FOULS: 7 [Team_079 in BONUS]

================================================================================

================================================================================
                       4TH QUARTER - Team_079 vs Team_081                       
================================================================================

[12:00] Team_079 possession (Score: 77-55)
Trae Durant drives to the basket... FOUL! Offensive foul on Trae Durant! Franz Antetokounmpo drew the charge! [Team fouls: 1] (Trae Durant: 1 personal fouls) TURNOVER! (dead ball)

[11:45] Team_081 possession (Score: 77-55)
Vince Adebayo makes the Layup and draws the foul on Bam Randle! And-1! Vince Adebayo to the line for 1. [Team fouls: 2] (Bam Randle: 1 personal fouls)   FT 1/1: GOOD Vince Adebayo makes 1/1 from the line.
Score: 77-58

[11:31] Team_079 possession (Score: 77-58)
Trae Durant drives, picks up Bradley Sabonis. Help arrives from Bradley Leonard! Trae Durant attempts a Layup. Contested by Bradley Leonard (2.9 feet, MAN). Trae Durant misses. Offensive rebound by Donovan Randle! Donovan Randle kicks it out.

[11:16] Team_079 possession (Score: 77-58)
Trae Durant throws a bad pass! Stolen by Bradley Sabonis! TURNOVER! (live ball)

[11:02] Team_081 possession (Score: 77-58)
Bradley Sabonis attempts a Midrange. Contested by Trae Durant (4.7 feet, MAN). BRADLEY SABONIS MAKES IT!
Score: 77-60

[10:46] Team_079 possession (Score: 77-60)
Donovan Randle attempts a Layup. Contested by Franz Antetokounmpo (5.9 feet, ZONE). DONOVAN RANDLE MAKES IT!
Score: 79-60

[10:29] Team_081 possession (Score: 79-60)
Bradley Leonard drives, Miles Ming stays with him. Bradley Leonard attempts a Dunk. Contested by Miles Ming (2.4 feet, MAN). BRADLEY LEONARD MAKES IT! Assist: Franz Antetokounmpo
Score: 79-62

[10:15] Team_079 possession (Score: 79-62)
Trae Durant drives to the basket... FOUL! Offensive foul on Trae Durant! Franz Antetokounmpo drew the charge! [Team fouls: 3] (Trae Durant: 2 personal fouls) TURNOVER! (dead ball)

[10:05] Team_081 possession (Score: 79-62)
Bradley Leonard drives, Miles Ming stays with him. Bradley Leonard attempts a Layup. Heavily contested by Miles Ming (1.7 feet, MAN)! BRADLEY LEONARD MAKES IT! Assist: Bradley Sabonis
Score: 79-64

[09:56] Team_079 possession (Score: 79-64)
Khris Embiid attempts a 3Pt. Contested by Vince Adebayo (2.5 feet, ZONE). Khris Embiid misses. Rebound secured by Bradley Sabonis.

[09:44] Team_081 possession (Score: 79-64)
Bradley Sabonis attempts a 3Pt. Contested by Trae Durant (2.9 feet, MAN). Bradley Sabonis misses. Rebound secured by Donovan Randle.

[09:32] Team_079 possession (Score: 79-64)
Bam Randle drives, Franz Antetokounmpo stays with him. Bam Randle attempts a Layup. Heavily contested by Franz Antetokounmpo (0.5 feet, ZONE)! BAM RANDLE MAKES IT! Assist: Donovan Randle
Score: 81-64

[09:17] Team_081 possession (Score: 81-64)
Bradley Leonard attempts a Midrange. Heavily contested by Miles Ming (0.9 feet, MAN)! BRADLEY LEONARD MAKES IT! Assist: Vince Adebayo
Score: 81-66

[08:58] Team_079 possession (Score: 81-66)
Khris Embiid makes the Layup and draws the foul on Julius Durant! And-1! Khris Embiid to the line for 1. [Team fouls: 1] (Julius Durant: 1 personal fouls)   FT 1/1: MISS Khris Embiid makes 0/1 from the line. Rebound secured by Bradley Sabonis.
Score: 83-66

[08:46] Team_081 possession (Score: 83-66)
Vince Adebayo attempts a 3Pt. Heavily contested by Bam Randle (1.7 feet, MAN)! VINCE ADEBAYO MAKES IT! Assist: Bradley Leonard
Score: 83-69

[08:34] Team_079 possession (Score: 83-69)
Khris Embiid loses the ball! Stripped by Julius Durant! TURNOVER! (live ball)

[08:22] Team_081 possession (Score: 83-69)
Bradley Leonard attempts a 3Pt. Wide open! Miles Ming is 7.2 feet away. [MAN] Bradley Leonard misses. Rebound secured by Bam Randle.

[08:08] Team_079 possession (Score: 83-69)
Khris Embiid drives to the basket... Khris Embiid throws a bad pass out of bounds! TURNOVER! (dead ball)

[08:08] Substitution (Team_079): Khris Embiid OUT → Evan Mobley IN (stamina_rule2)

[08:08] Substitution (Team_079): Miles Ming OUT → Karl Ingram IN (stamina_rule2)

[08:08] Substitution (Team_079): Bam Randle OUT → Anthony Wade IN (stamina_rule2)

[08:08] Substitution (Team_079): Trae Durant OUT → Kobe Curry IN (stamina_rule2)

[08:08] Substitution (Team_079): Donovan Randle OUT → James LaVine IN (stamina_rule2)

[08:08] Substitution (Team_081): Julius Durant OUT → Dejounte Bane IN (stamina_rule2)

[08:08] Substitution (Team_081): Bradley Leonard OUT → Lamelo Wade IN (stamina_rule2)

[08:08] Substitution (Team_081): Vince Adebayo OUT → Larry Adebayo IN (stamina_rule2)

[08:08] Substitution (Team_081): Bradley Sabonis OUT → Chris Holiday IN (stamina_rule2)

[08:08] Substitution (Team_081): Franz Antetokounmpo OUT → D'Angelo Markkanen IN (stamina_rule2)

[07:53] Team_081 possession (Score: 83-69)
Dejounte Bane attempts a Layup. Heavily contested by James LaVine (1.8 feet, ZONE)! Dejounte Bane misses. FOUL! Loose ball foul on Anthony Wade during the rebound battle. [Team fouls: 4] No free throws, side out. (Anthony Wade: 1 personal fouls)

[07:36] Team_081 possession (Score: 83-69)
D'Angelo Markkanen attempts a Midrange. Wide open! Karl Ingram is 6.7 feet away. [ZONE] D'Angelo Markkanen misses. Rebound secured by Kobe Curry.

[07:20] Team_079 possession (Score: 83-69)
James LaVine attempts a Layup. Contested by Chris Holiday (3.1 feet, MAN). James LaVine misses. Offensive rebound by James LaVine! James LaVine puts it back in!
Score: 85-69

[07:05] Team_081 possession (Score: 85-69)
Lamelo Wade makes the Layup and draws the foul on Karl Ingram! And-1! Lamelo Wade to the line for 1. [BONUS: 5 team fouls] (Karl Ingram: 1 personal fouls)   FT 1/1: GOOD Lamelo Wade makes 1/1 from the line.
Score: 85-72

[06:49] Team_079 possession (Score: 85-72)
Evan Mobley attempts a 3Pt. Contested by Chris Holiday (5.6 feet, ZONE). Evan Mobley misses. Rebound secured by Larry Adebayo.

[06:38] Team_081 possession (Score: 85-72)
Chris Holiday drives and kicks out. FOUL! Shooting foul on Evan Mobley. Larry Adebayo to the line for 3 free throws. [BONUS: 6 team fouls] (Evan Mobley: 1 personal fouls)   FT 1/3: GOOD   FT 2/3: GOOD   FT 3/3: GOOD Larry Adebayo makes 3/3 from the line.
Score: 85-75

[06:24] Team_079 possession (Score: 85-75)
Karl Ingram drives and kicks out. James LaVine attempts a 3Pt. Wide open! Chris Holiday is 6.2 feet away. [ZONE] James LaVine misses. Rebound secured by Chris Holiday.

[06:08] Team_081 possession (Score: 85-75)
Lamelo Wade attempts a Layup. Contested by Karl Ingram (4.8 feet, MAN). LAMELO WADE MAKES IT! Assist: Larry Adebayo
Score: 85-77

[05:51] Team_079 possession (Score: 85-77)
Anthony Wade drives, picks up Chris Holiday. Help arrives from Lamelo Wade! Anthony Wade attempts a Dunk. Contested by Lamelo Wade (3.4 feet, ZONE). ANTHONY WADE MAKES IT!
Score: 87-77

[05:41] Team_081 possession (Score: 87-77)
Lamelo Wade attempts a 3Pt. Contested by Evan Mobley (4.2 feet, ZONE). Lamelo Wade misses. Rebound secured by Anthony Wade.

[05:26] Team_079 possession (Score: 87-77)
Kobe Curry drives, Chris Holiday stays with him. Kobe Curry attempts a Dunk. Contested by Chris Holiday (3.7 feet, MAN). KOBE CURRY MAKES IT!
Score: 89-77

[05:16] Team_081 possession (Score: 89-77)
FOUL! Reach-in foul on James LaVine during the drive. [IN THE BONUS! 7 team fouls] Larry Adebayo to the line for 2 free throws. (James LaVine: 1 personal fouls)   FT 1/2: GOOD   FT 2/2: GOOD Larry Adebayo makes 2/2 from the line.
Score: 89-79

[05:01] Team_079 possession (Score: 89-79)
Kobe Curry attempts a 3Pt. Wide open! Chris Holiday is 6.4 feet away. [ZONE] Kobe Curry misses. Rebound secured by Chris Holiday.

[04:51] Team_081 possession (Score: 89-79)
Larry Adebayo attempts a 3Pt. Contested by Anthony Wade (4.4 feet, MAN). Larry Adebayo misses. Offensive rebound by Chris Holiday! Chris Holiday kicks it out.

[04:40] Team_081 possession (Score: 89-79)
Larry Adebayo attempts a 3Pt. Contested by Evan Mobley (4.3 feet, ZONE). Larry Adebayo misses. Rebound secured by James LaVine.

[04:25] Team_079 possession (Score: 89-79)
FOUL! Shooting foul on Chris Holiday. Anthony Wade to the line for 3 free throws. [Team fouls: 2] (Chris Holiday: 1 personal fouls)   FT 1/3: GOOD   FT 2/3: MISS   FT 3/3: GOOD Anthony Wade makes 2/3 from the line.
Score: 91-79

[04:09] Team_081 possession (Score: 91-79)
Larry Adebayo drives and kicks out. Larry Adebayo attempts a 3Pt. Contested by Evan Mobley (3.5 feet, ZONE). Larry Adebayo misses. Offensive rebound by Lamelo Wade! Lamelo Wade kicks it out.

[03:58] Team_081 possession (Score: 91-79)
Dejounte Bane drives, James LaVine stays with him. Dejounte Bane attempts a Dunk. Heavily contested by James LaVine (0.5 feet, ZONE)! DEJOUNTE BANE MAKES IT!
Score: 91-81

[03:44] Team_079 possession (Score: 91-81)
Karl Ingram attempts a 3Pt. Contested by Lamelo Wade (4.0 feet, MAN). Karl Ingram misses. Rebound secured by Larry Adebayo.

[03:26] Team_081 possession (Score: 91-81)
Larry Adebayo drives and kicks out. Larry Adebayo attempts a 3Pt. Wide open! Anthony Wade is 6.0 feet away. [MAN] Larry Adebayo misses. Rebound secured by James LaVine.

[03:11] Team_079 possession (Score: 91-81)
Anthony Wade attempts a Layup. BLOCKED BY LARRY ADEBAYO! Ball is loose! Rebound secured by Chris Holiday.

[02:56] Team_081 possession (Score: 91-81)
Lamelo Wade attempts a 3Pt. Contested by Evan Mobley (4.9 feet, ZONE). LAMELO WADE MAKES IT! Assist: D'Angelo Markkanen
Score: 91-84

[02:38] Team_079 possession (Score: 91-84)
Kobe Curry drives, Chris Holiday stays with him. Kobe Curry attempts a Dunk. Contested by Chris Holiday (2.5 feet, ZONE). KOBE CURRY MAKES IT! Assist: Evan Mobley
Score: 93-84

[02:25] Team_081 possession (Score: 93-84)
Lamelo Wade attempts a 3Pt. Contested by Evan Mobley (5.3 feet, ZONE). LAMELO WADE MAKES IT! Assist: Larry Adebayo
Score: 93-87

[02:10] Team_079 possession (Score: 93-87)
Evan Mobley attempts a 3Pt. Wide open! Chris Holiday is 10.0 feet away. [ZONE] Evan Mobley misses. FOUL! Loose ball foul on Chris Holiday during the rebound battle. [Team fouls: 3] No free throws, side out. (Chris Holiday: 2 personal fouls)

[01:58] Team_079 possession (Score: 93-87)
Evan Mobley loses the ball! Stripped by Dejounte Bane! TURNOVER! (live ball)

[01:47] Team_081 possession (Score: 93-87)
D'Angelo Markkanen attempts a 3Pt. Contested by Evan Mobley (5.8 feet, ZONE). D'Angelo Markkanen misses. FOUL! Loose ball foul on James LaVine during the rebound battle. [IN THE BONUS! 8 team fouls] Lamelo Wade to the line for 2 free throws. (James LaVine: 2 personal fouls)   FT 1/2: MISS   FT 2/2: GOOD Lamelo Wade makes 1/2 from the line.
Score: 93-88

[01:32] Team_079 possession (Score: 93-88)
James LaVine attempts a Layup. Contested by Chris Holiday (2.3 feet, MAN). JAMES LAVINE MAKES IT!
Score: 95-88

[01:18] Team_081 possession (Score: 95-88)
Larry Adebayo makes the Dunk and draws the foul on Anthony Wade! And-1! Larry Adebayo to the line for 1. [BONUS: 9 team fouls] (Anthony Wade: 2 personal fouls)   FT 1/1: GOOD Larry Adebayo makes 1/1 from the line.
Score: 95-91

[01:03] Team_079 possession (Score: 95-91)
Kobe Curry drives to the basket... Kobe Curry loses control! Ball rolls out of bounds! TURNOVER! (dead ball)

[00:48] Team_081 possession (Score: 95-91)
Lamelo Wade loses control! Ball rolls out of bounds! TURNOVER! (dead ball)

[00:35] Team_079 possession (Score: 95-91)
James LaVine attempts a Midrange. Wide open! Chris Holiday is 6.7 feet away. [MAN] James LaVine misses. Offensive rebound by James LaVine! James LaVine puts it back in!
Score: 97-91

[00:20] Team_081 possession (Score: 97-91)
Larry Adebayo attempts a 3Pt. Contested by Anthony Wade (4.4 feet, MAN). LARRY ADEBAYO MAKES IT! Assist: Chris Holiday
Score: 97-94

[00:08] Team_079 possession (Score: 97-94)
Anthony Wade loses the ball! Stripped by Larry Adebayo! TURNOVER! (live ball)

================================================================================
                              4TH QUARTER COMPLETE                              
================================================================================

4TH QUARTER SCORE: Team_079 20, Team_081 39

BOX SCORE:
================================================================================

Team_079
--------------------------------------------------------------------------------
Player                MIN  PTS  REB  AST  TO      FG   FG%      3P   3P%
--------------------------------------------------------------------------------
James LaVine           14    6    4    0   0   3/3   100.0     0/0   0.0
Kobe Curry             19    4    2    0   0   2/3    66.7     0/0   0.0
Anthony Wade           13    4    1    0   0   2/3    66.7     0/0   0.0
Donovan Randle         35    2    2    1   0   1/1   100.0     0/0   0.0
Bam Randle             35    2    1    0   0   1/1   100.0     0/0   0.0
Khris Embiid           30    0    0    0   0   0/2     0.0     0/0   0.0
Evan Mobley            19    0    0    1   0   0/1     0.0     0/0   0.0
Karl Ingram            13    0    0    0   0   0/2     0.0     0/0   0.0

TEAM: FG: 9/16 (56.2%), 3PT: 1/5 (20.0%), REB: 10 (4 off, 6 def), AST: 2, TO: 8
TEAM FOULS: 9 [Team_081 in BONUS]


Team_081
--------------------------------------------------------------------------------
Player                MIN  PTS  REB  AST  TO      FG   FG%      3P   3P%
--------------------------------------------------------------------------------
Lamelo Wade            19   12    2    0   0   5/6    83.3     0/0   0.0
Larry Adebayo          13   11    2    2   0   4/6    66.7     0/0   0.0
Vince Adebayo          35    6    0    1   0   2/2   100.0     0/0   0.0
Bradley Leonard        30    6    0    1   0   3/4    75.0     0/0   0.0
Bradley Sabonis        30    2    2    1   0   1/2    50.0     0/0   0.0
Dejounte Bane          19    2    0    0   0   1/1   100.0     0/0   0.0
Franz Antetokounmpo    35    0    0    1   0   0/0     0.0     0/0   0.0
D'Angelo Markkanen     13    0    0    1   0   0/1     0.0     0/0   0.0
Chris Holiday          19    0    4    1   0   0/0     0.0     0/0   0.0

TEAM: FG: 16/22 (72.7%), 3PT: 5/9 (55.6%), REB: 10 (3 off, 7 def), AST: 8, TO: 1
TEAM FOULS: 3

================================================================================

================================================================================
                               FULL GAME COMPLETE                               
================================================================================

FINAL SCORE: Team_079 97, Team_081 94

SCORING BY QUARTER:
--------------------------------------------------------------------------------
Team                     Q1     Q2     Q3     Q4    FINAL
--------------------------------------------------------------------------------
Team_079                 22     22     33     20       97
Team_081                 17     21     17     39       94
--------------------------------------------------------------------------------

FULL GAME BOX SCORE:
================================================================================

Team_079
--------------------------------------------------------------------------------
Player                MIN  PTS  REB  AST  TO      FG   FG%      3P   3P%      FT STL BLK
--------------------------------------------------------------------------------
Miles Ming             35   11    0    3   4   6/10   60.0   2/6    33.3   0/0     0   0
Bam Randle             35    4   11    2   2   3/8    37.5   0/2     0.0   0/0     0   0
Donovan Randle         35   15   12    1   2   7/10   70.0   0/1     0.0   1/1     1   1
Khris Embiid           30   21    0    7   4   5/11   45.5   3/7    42.9   4/5     0   0
Trae Durant            30   12   11    1   3   3/7    42.9   0/3     0.0   4/4     0   2
Evan Mobley            19    4    1    1   1   2/5    40.0   0/3     0.0   0/0     0   0
Kobe Curry             19    8    9    3   0   4/5    80.0   0/1     0.0   2/2     0   0
James LaVine           14    9    5    0   0   4/5    80.0   0/1     0.0   1/1     0   0
Karl Ingram            13    5    0    1   2   1/4    25.0   0/2     0.0   3/3     0   0
Anthony Wade           13    6    3    0   1   3/4    75.0   1/1   100.0   2/3     0   0

TEAM: FG: 41/72 (56.9%), 3PT: 6/27 (22.2%), REB: 53 (13 off, 40 def), AST: 19, TO: 19


Team_081
--------------------------------------------------------------------------------
Player                MIN  PTS  REB  AST  TO      FG   FG%      3P   3P%      FT STL BLK
--------------------------------------------------------------------------------
Vince Adebayo          35   17    1    1   0  10/15   66.7   2/5    40.0   5/6     0   0
Franz Antetokounmpo    35    7   13    4   2   1/3    33.3   0/1     0.0   1/2     3   0
Julius Durant          30   10    0    0   0   5/11   45.5   2/8    25.0   4/4     1   1
Bradley Leonard        30   14    0    2   3   7/15   46.7   1/7    14.3   1/1     2   0
Bradley Sabonis        30    4    9    1   0   2/10   20.0   0/4     0.0   0/0     1   1
Dejounte Bane          19    8    0    0   1   3/4    75.0   0/1     0.0   0/0     1   0
Lamelo Wade            19   14    5    2   2   4/9    44.4   2/6    33.3   2/3     0   0
Chris Holiday          19    2    7    1   0   2/4    50.0   0/1     0.0   2/3     1   0
Larry Adebayo          13   11    7    3   0   3/5    60.0   1/2    50.0   6/6     1   1
D'Angelo Markkanen     13    4    0    1   0   3/4    75.0   1/1   100.0   2/2     0   0

TEAM: FG: 40/80 (50.0%), 3PT: 9/36 (25.0%), REB: 41 (11 off, 30 def), AST: 15, TO: 8

================================================================================
