================================================================================
                        FULL GAME - Team_006 vs Team_027                        
================================================================================

================================================================================
                       1ST QUARTER - Team_006 vs Team_027                       
================================================================================

[12:00] Team_006 possession (Score: 0-0)
Ja Butler makes the Dunk and draws the foul on John Russell! And-1! Ja Butler to the line for 1. [Team fouls: 1] (John Russell: 1 personal fouls)   FT 1/1: GOOD Ja Butler makes 1/1 from the line.
Score: 3-0

[11:44] Team_027 possession (Score: 3-0)
Scottie Harden drives and kicks out. Tony Doncic attempts a 3Pt. Wide open! Franz Wagner is 7.4 feet away. [MAN] TONY DONCIC MAKES IT! Assist: Tim Johnson
Score: 3-3

[11:30] Team_006 possession (Score: 3-3)
Franz Wagner attempts a 3Pt. Contested by Tony Doncic (2.9 feet, MAN). Franz Wagner misses. Rebound secured by John Russell.

[11:14] Team_027 possession (Score: 3-3)
Bradley Dosunmu drives and kicks out. Tony Doncic attempts a Midrange. Contested by Franz Wagner (5.3 feet, ZONE). Tony Doncic misses. FOUL! Loose ball foul on Bradley Gobert during the rebound battle. [Team fouls: 1] No free throws, side out. (Bradley Gobert: 1 personal fouls)

[10:56] Team_027 possession (Score: 3-3)
Tim Johnson drives and kicks out. Scottie Harden attempts a 3Pt. Contested by Jayson Young (4.9 feet, MAN). Scottie Harden misses. Offensive rebound by John Russell! John Russell puts it back in!
Score: 3-5

[10:39] Team_006 possession (Score: 3-5)
Franz Wagner drives, picks up John Russell. Help arrives from Tony Doncic! Franz Wagner attempts a Layup. Heavily contested by Tony Doncic (0.5 feet, ZONE)! FRANZ WAGNER MAKES IT!
Score: 5-5

[10:25] Team_027 possession (Score: 5-5)
Scottie Harden attempts a Layup. BLOCKED BY JAYSON YOUNG! Ball goes out off Jayson Young. Scottie Harden's ball!

[10:10] Team_027 possession (Score: 5-5)
Tony Doncic loses control! Ball rolls out of bounds! TURNOVER! (dead ball)

[09:54] Team_006 possession (Score: 5-5)
Shai Westbrook attempts a 3Pt. Contested by Tim Johnson (2.2 feet, MAN). Shai Westbrook misses. Rebound secured by John Russell.

[09:42] Team_027 possession (Score: 5-5)
John Russell attempts a Midrange. Contested by Bradley Gobert (5.6 feet, MAN). John Russell misses. Rebound secured by Shai Westbrook.

[09:29] Team_006 possession (Score: 5-5)
Bradley Gobert drives and kicks out. Jayson Young attempts a Midrange. Contested by Scottie Harden (4.6 feet, MAN). Jayson Young misses. Rebound secured by Bradley Dosunmu.

[09:15] Team_027 possession (Score: 5-5)
Tony Doncic attempts a 3Pt. Heavily contested by Franz Wagner (1.2 feet, MAN)! Tony Doncic misses. Offensive rebound by Bradley Dosunmu! Bradley Dosunmu kicks it out.

[08:57] Team_027 possession (Score: 5-5)
Bradley Dosunmu throws a bad pass out of bounds! TURNOVER! (dead ball)

[08:45] Team_006 possession (Score: 5-5)
FOUL! Holding foul on Tim Johnson. [Team fouls: 2] No free throws, side out. (Tim Johnson: 1 personal fouls)

[08:34] Team_006 possession (Score: 5-5)
Shai Westbrook attempts a Layup. Contested by Tim Johnson (3.4 feet, MAN). SHAI WESTBROOK MAKES IT!
Score: 7-5

[08:21] Team_027 possession (Score: 7-5)
Tim Johnson attempts a Midrange. Contested by Shai Westbrook (4.6 feet, MAN). TIM JOHNSON MAKES IT!
Score: 7-7

[08:08] Team_006 possession (Score: 7-7)
Franz Wagner attempts a Layup. BLOCKED BY TONY DONCIC! Ball is loose! Offensive rebound by Bradley Gobert! Bradley Gobert kicks it out.

[07:53] Team_006 possession (Score: 7-7)
Shai Westbrook makes the Layup and draws the foul on John Russell! And-1! Shai Westbrook to the line for 1. [Team fouls: 3] (John Russell: 2 personal fouls)   FT 1/1: GOOD Shai Westbrook makes 1/1 from the line.
Score: 10-7

[07:42] Team_027 possession (Score: 10-7)
Bradley Dosunmu attempts a Layup. Heavily contested by Ja Butler (1.3 feet, MAN)! Bradley Dosunmu misses. Rebound secured by Shai Westbrook.

[07:28] Team_006 possession (Score: 10-7)
Bradley Gobert drives to the basket... Bradley Gobert loses control! Ball rolls out of bounds! TURNOVER! (dead ball)

[07:11] Team_027 possession (Score: 10-7)
FOUL! Reach-in foul on Bradley Gobert during the drive. [Team fouls: 2] No free throws, side out. (Bradley Gobert: 2 personal fouls)

[07:00] Team_027 possession (Score: 10-7)
John Russell attempts a Layup. Contested by Bradley Gobert (3.4 feet, MAN). JOHN RUSSELL MAKES IT!
Score: 10-9

[06:42] Team_006 possession (Score: 10-9)
Franz Wagner attempts a 3Pt. Contested by Tim Johnson (5.0 feet, ZONE). FRANZ WAGNER MAKES IT! Assist: Ja Butler
Score: 13-9

[06:28] Team_027 possession (Score: 13-9)
John Russell makes the Layup and draws the foul on Bradley Gobert! And-1! John Russell to the line for 1. [Team fouls: 3] (Bradley Gobert: 3 personal fouls)   FT 1/1: GOOD John Russell makes 1/1 from the line.
Score: 13-12

[06:12] Team_006 possession (Score: 13-12)
Ja Butler drives, John Russell stays with him. Ja Butler attempts a Layup. Contested by John Russell (4.9 feet, ZONE). Ja Butler misses. Rebound secured by Bradley Dosunmu.

[05:59] Team_027 possession (Score: 13-12)
John Russell attempts a Layup. Heavily contested by Bradley Gobert (2.0 feet, ZONE)! JOHN RUSSELL MAKES IT! Assist: Tim Johnson
Score: 13-14

[05:44] Team_006 possession (Score: 13-14)
Jayson Young attempts a 3Pt. Contested by Tim Johnson (4.0 feet, ZONE). Jayson Young misses. Rebound secured by Bradley Dosunmu.

[05:26] Team_027 possession (Score: 13-14)
John Russell attempts a Dunk. BLOCKED BY SHAI WESTBROOK! Ball deflects out of bounds off John Russell.

[05:15] Team_006 possession (Score: 13-14)
Franz Wagner attempts a 3Pt. Wide open! Tim Johnson is 6.5 feet away. [ZONE] FRANZ WAGNER MAKES IT! Assist: Shai Westbrook
Score: 16-14

[05:00] Team_027 possession (Score: 16-14)
Bradley Dosunmu attempts a 3Pt. Contested by Shai Westbrook (4.0 feet, ZONE). Bradley Dosunmu misses. Rebound secured by Bradley Gobert.

[04:46] Team_006 possession (Score: 16-14)
Ja Butler drives to the basket... Ja Butler throws a bad pass out of bounds! TURNOVER! (dead ball)

[04:31] Team_027 possession (Score: 16-14)
Scottie Harden attempts a 3Pt. Wide open! Jayson Young is 6.8 feet away. [MAN] Scottie Harden misses. Offensive rebound by John Russell! John Russell's putback is no good. Rebound secured by Ja Butler.

[04:16] Team_006 possession (Score: 16-14)
Ja Butler attempts a Layup. Contested by Bradley Dosunmu (3.5 feet, MAN). JA BUTLER MAKES IT! Assist: Shai Westbrook
Score: 18-14

[03:58] Team_027 possession (Score: 18-14)
Scottie Harden drives, picks up Bradley Gobert. Help arrives from Shai Westbrook! Scottie Harden attempts a Layup. Heavily contested by Shai Westbrook (1.8 feet, ZONE)! Scottie Harden misses. Rebound secured by Bradley Gobert.

[03:40] Team_006 possession (Score: 18-14)
Bradley Gobert commits a violation (traveling/carry)! TURNOVER! (dead ball)

[03:22] Team_027 possession (Score: 18-14)
Bradley Dosunmu attempts a Layup. BLOCKED BY BRADLEY GOBERT! Ball is loose! Rebound secured by Bradley Gobert.

[03:06] Team_006 possession (Score: 18-14)
Bradley Gobert drives to the basket... Bradley Gobert loses the ball! Stripped by John Russell! TURNOVER! (live ball)

[02:53] Team_027 possession (Score: 18-14)
Bradley Dosunmu attempts a 3Pt. Contested by Ja Butler (4.7 feet, MAN). BRADLEY DOSUNMU MAKES IT! Assist: Tim Johnson
Score: 18-17

[02:42] Team_006 possession (Score: 18-17)
Franz Wagner attempts a Midrange. Contested by Tony Doncic (5.5 feet, MAN). FRANZ WAGNER MAKES IT! Assist: Shai Westbrook
Score: 20-17

[02:28] Team_027 possession (Score: 20-17)
Scottie Harden drives, Jayson Young stays with him. Scottie Harden attempts a Layup. Wide open! Jayson Young is 7.4 feet away. [MAN] SCOTTIE HARDEN MAKES IT! Assist: Bradley Dosunmu
Score: 20-19

[02:13] Team_006 possession (Score: 20-19)
Franz Wagner attempts a 3Pt. Contested by Tony Doncic (4.3 feet, MAN). Franz Wagner misses. Rebound secured by John Russell.

[01:54] Team_027 possession (Score: 20-19)
Tim Johnson attempts a 3Pt. Wide open! Shai Westbrook is 6.1 feet away. [ZONE] Tim Johnson misses. Rebound secured by Bradley Gobert.

[01:39] Team_006 possession (Score: 20-19)
Ja Butler makes the Dunk and draws the foul on Tony Doncic! And-1! Ja Butler to the line for 1. [Team fouls: 4] (Tony Doncic: 1 personal fouls)   FT 1/1: GOOD Ja Butler makes 1/1 from the line.
Score: 23-19

[01:27] Team_027 possession (Score: 23-19)
John Russell attempts a Layup. Contested by Ja Butler (2.5 feet, ZONE). JOHN RUSSELL MAKES IT! Assist: Tim Johnson
Score: 23-21

[01:16] Team_006 possession (Score: 23-21)
Shai Westbrook attempts a 3Pt. Contested by Tim Johnson (5.5 feet, MAN). SHAI WESTBROOK MAKES IT! Assist: Franz Wagner
Score: 26-21

[01:00] Team_027 possession (Score: 26-21)
Scottie Harden drives, Bradley Gobert stays with him. Scottie Harden attempts a Dunk. Heavily contested by Bradley Gobert (0.5 feet, ZONE)! SCOTTIE HARDEN MAKES IT! Assist: John Russell
Score: 26-23

[00:46] Team_006 possession (Score: 26-23)
Shai Westbrook throws a bad pass out of bounds! TURNOVER! (dead ball)

[00:46] Substitution (Team_006): Shai Westbrook OUT → Miles Harris IN (stamina_rule2)

[00:46] Substitution (Team_006): Franz Wagner OUT → Lamelo Westbrook IN (stamina_rule2)

[00:46] Substitution (Team_006): Jayson Young OUT → Vince Sabonis IN (stamina_rule2)

[00:46] Substitution (Team_006): Ja Butler OUT → Cade Ball IN (stamina_rule2)

[00:46] Substitution (Team_006): Bradley Gobert OUT → Shaquille Sexton IN (stamina_rule2)

[00:46] Substitution (Team_027): Tim Johnson OUT → CJ Green IN (stamina_rule2)

[00:46] Substitution (Team_027): Tony Doncic OUT → Dirk Lillard IN (stamina_rule2)

[00:46] Substitution (Team_027): Scottie Harden OUT → Rudy Quickley IN (stamina_rule2)

[00:46] Substitution (Team_027): Bradley Dosunmu OUT → LeBron Russell IN (stamina_rule2)

[00:46] Substitution (Team_027): John Russell OUT → Ben Stewart IN (stamina_rule2)

[00:36] Team_027 possession (Score: 26-23)
LeBron Russell throws a bad pass out of bounds! TURNOVER! (dead ball)

[00:24] Team_006 possession (Score: 26-23)
Vince Sabonis attempts a 3Pt. Heavily contested by Rudy Quickley (1.6 feet, MAN)! VINCE SABONIS MAKES IT!
Score: 29-23

[00:10] Team_027 possession (Score: 29-23)
CJ Green attempts a 3Pt. Contested by Lamelo Westbrook (5.6 feet, ZONE). CJ Green misses. Offensive rebound by Ben Stewart! Ben Stewart's putback is no good. Rebound secured by Shaquille Sexton.

================================================================================
                              1ST QUARTER COMPLETE                              
================================================================================

1ST QUARTER SCORE: Team_006 29, Team_027 23

BOX SCORE:
================================================================================

Team_006
--------------------------------------------------------------------------------
Player                MIN  PTS  REB  AST  TO      FG   FG%      3P   3P%
--------------------------------------------------------------------------------
Franz Wagner           11   10    0    1   0   4/6    66.7     0/0   0.0
Ja Butler              11    8    1    1   0   3/4    75.0     0/0   0.0
Shai Westbrook         11    8    2    3   0   3/4    75.0     0/0   0.0
Vince Sabonis           1    3    0    0   0   1/1   100.0     0/0   0.0
Bradley Gobert         11    0    5    0   0   0/1     0.0     0/0   0.0
Jayson Young           11    0    0    0   0   0/1     0.0     0/0   0.0

TEAM: FG: 11/17 (64.7%), 3PT: 4/8 (50.0%), REB: 7 (1 off, 6 def), AST: 5, TO: 5
TEAM FOULS: 3


Team_027
--------------------------------------------------------------------------------
Player                MIN  PTS  REB  AST  TO      FG   FG%      3P   3P%
--------------------------------------------------------------------------------
John Russell           11   11    5    1   0   5/7    71.4     0/0   0.0
Scottie Harden         11    4    0    0   0   2/4    50.0     0/0   0.0
Tony Doncic            11    3    0    0   0   1/1   100.0     0/0   0.0
Bradley Dosunmu        11    3    4    1   0   1/4    25.0     0/0   0.0
Tim Johnson            11    2    0    4   0   1/2    50.0     0/0   0.0
CJ Green                1    0    0    0   0   0/1     0.0     0/0   0.0
Shaquille Sexton        1    0    1    0   0   0/0     0.0     0/0   0.0

TEAM: FG: 10/19 (52.6%), 3PT: 1/5 (20.0%), REB: 11 (5 off, 6 def), AST: 6, TO: 3
TEAM FOULS: 4

================================================================================

================================================================================
                       2ND QUARTER - Team_006 vs Team_027                       
================================================================================

[12:00] Team_006 possession (Score: 29-23)
Franz Wagner attempts a Layup. Heavily contested by John Russell (1.2 feet, ZONE)! Franz Wagner misses. Rebound secured by Tony Doncic.

[11:46] Team_027 possession (Score: 29-23)
John Russell drives, Bradley Gobert stays with him. John Russell attempts a Dunk. Contested by Bradley Gobert (4.3 feet, ZONE). JOHN RUSSELL MAKES IT! Assist: Tony Doncic
Score: 29-25

[11:32] Team_006 possession (Score: 29-25)
Shai Westbrook attempts a Layup. Wide open! Tim Johnson is 6.1 feet away. [MAN] Shai Westbrook misses. Offensive rebound by Ja Butler! Ja Butler puts it back in!
Score: 31-25

[11:19] Team_027 possession (Score: 31-25)
FOUL! Offensive foul on John Russell! Bradley Gobert drew the charge! [Team fouls: 1] (John Russell: 1 personal fouls) TURNOVER! (dead ball)

[11:08] Team_006 possession (Score: 31-25)
Shai Westbrook attempts a 3Pt. Wide open! Tim Johnson is 8.0 feet away. [MAN] Shai Westbrook misses. Rebound secured by Tony Doncic.

[10:49] Team_027 possession (Score: 31-25)
Scottie Harden attempts a 3Pt. Contested by Shai Westbrook (3.0 feet, ZONE). SCOTTIE HARDEN MAKES IT!
Score: 31-28

[10:37] Team_006 possession (Score: 31-28)
Bradley Gobert drives, picks up John Russell. Help arrives from Tony Doncic! Bradley Gobert attempts a Dunk. Contested by Tony Doncic (3.3 feet, ZONE). Bradley Gobert misses. Offensive rebound by Bradley Gobert! Bradley Gobert kicks it out.

[10:21] Team_006 possession (Score: 31-28)
Franz Wagner drives to the basket... Franz Wagner throws a bad pass out of bounds! TURNOVER! (dead ball)

[10:21] Substitution (Team_006): Shai Westbrook OUT → Miles Harris IN (stamina_rule2)

[10:21] Substitution (Team_006): Franz Wagner OUT → Lamelo Westbrook IN (stamina_rule2)

[10:21] Substitution (Team_006): Jayson Young OUT → Vince Sabonis IN (stamina_rule2)

[10:21] Substitution (Team_006): Ja Butler OUT → Cade Ball IN (stamina_rule2)

[10:21] Substitution (Team_006): Bradley Gobert OUT → Shaquille Sexton IN (stamina_rule2)

[10:21] Substitution (Team_027): Tim Johnson OUT → CJ Green IN (stamina_rule2)

[10:21] Substitution (Team_027): Tony Doncic OUT → Dirk Lillard IN (stamina_rule2)

[10:21] Substitution (Team_027): Scottie Harden OUT → Rudy Quickley IN (stamina_rule2)

[10:21] Substitution (Team_027): Bradley Dosunmu OUT → LeBron Russell IN (stamina_rule2)

[10:21] Substitution (Team_027): John Russell OUT → Ben Stewart IN (stamina_rule2)

[10:06] Team_027 possession (Score: 31-28)
FOUL! Offensive foul on Rudy Quickley! Vince Sabonis drew the charge! [Team fouls: 2] (Rudy Quickley: 1 personal fouls) TURNOVER! (dead ball)

[09:53] Team_006 possession (Score: 31-28)
FOUL! Holding foul on LeBron Russell. [Team fouls: 3] No free throws, side out. (LeBron Russell: 1 personal fouls)

[09:41] Team_006 possession (Score: 31-28)
Miles Harris drives to the basket... Miles Harris loses control! Ball rolls out of bounds! TURNOVER! (dead ball)

[09:24] Team_027 possession (Score: 31-28)
FOUL! Reach-in foul on Cade Ball during the drive. [Team fouls: 1] No free throws, side out. (Cade Ball: 1 personal fouls)

[09:10] Team_027 possession (Score: 31-28)
Rudy Quickley attempts a Midrange. Wide open! Lamelo Westbrook is 6.9 feet away. [ZONE] RUDY QUICKLEY MAKES IT!
Score: 31-30

[08:56] Team_006 possession (Score: 31-30)
Miles Harris attempts a 3Pt. Contested by CJ Green (5.6 feet, MAN). Miles Harris misses. Offensive rebound by Shaquille Sexton! Shaquille Sexton kicks it out.

[08:44] Team_006 possession (Score: 31-30)
Vince Sabonis drives, Rudy Quickley stays with him. Vince Sabonis attempts a Layup. Contested by Rudy Quickley (2.5 feet, MAN). Vince Sabonis misses. Rebound secured by Ben Stewart.

[08:28] Team_027 possession (Score: 31-30)
LeBron Russell makes the Layup and draws the foul on Cade Ball! And-1! LeBron Russell to the line for 1. [Team fouls: 2] (Cade Ball: 2 personal fouls)   FT 1/1: MISS LeBron Russell makes 0/1 from the line. Rebound secured by Vince Sabonis.
Score: 31-32

[08:14] Team_006 possession (Score: 31-32)
Miles Harris attempts a 3Pt. Wide open! Rudy Quickley is 7.1 feet away. [ZONE] Miles Harris misses. Rebound secured by LeBron Russell.

[07:59] Team_027 possession (Score: 31-32)
Rudy Quickley drives, picks up Vince Sabonis. Help arrives from Lamelo Westbrook! Rudy Quickley attempts a Dunk. Wide open! Lamelo Westbrook is 8.3 feet away. [MAN] Rudy Quickley misses. Rebound secured by Shaquille Sexton.

[07:40] Team_006 possession (Score: 31-32)
Cade Ball throws a bad pass out of bounds! TURNOVER! (dead ball)

[07:27] Team_027 possession (Score: 31-32)
LeBron Russell throws a bad pass! Stolen by Cade Ball! TURNOVER! (live ball)

[07:17] Team_006 possession (Score: 31-32)
Miles Harris drives, CJ Green stays with him. Miles Harris attempts a Dunk. Heavily contested by CJ Green (1.4 feet, MAN)! Miles Harris misses. Rebound secured by Ben Stewart.

[07:00] Team_027 possession (Score: 31-32)
Ben Stewart attempts a Midrange. Contested by Cade Ball (3.3 feet, ZONE). Ben Stewart misses. FOUL! Loose ball foul on Vince Sabonis during the rebound battle. [Team fouls: 3] No free throws, side out. (Vince Sabonis: 1 personal fouls)

[06:50] Team_027 possession (Score: 31-32)
CJ Green loses the ball! Stripped by Miles Harris! TURNOVER! (live ball)

[06:37] Team_006 possession (Score: 31-32)
Vince Sabonis drives and kicks out. Vince Sabonis attempts a 3Pt. Contested by Rudy Quickley (2.4 feet, MAN). Vince Sabonis misses. Offensive rebound by Shaquille Sexton! Shaquille Sexton kicks it out.

[06:22] Team_006 possession (Score: 31-32)
Shaquille Sexton drives to the basket... Shaquille Sexton throws a bad pass out of bounds! TURNOVER! (dead ball)

[06:06] Team_027 possession (Score: 31-32)
Ben Stewart throws a bad pass out of bounds! TURNOVER! (dead ball)

[05:56] Team_006 possession (Score: 31-32)
Miles Harris attempts a Layup. Contested by CJ Green (3.9 feet, MAN). MILES HARRIS MAKES IT!
Score: 33-32

[05:40] Team_027 possession (Score: 33-32)
Dirk Lillard attempts a 3Pt. Wide open! Lamelo Westbrook is 9.5 feet away. [MAN] DIRK LILLARD MAKES IT! Assist: CJ Green
Score: 33-35

[05:21] Team_006 possession (Score: 33-35)
Lamelo Westbrook throws a bad pass! Stolen by Dirk Lillard! TURNOVER! (live ball)

[05:03] Team_027 possession (Score: 33-35)
Rudy Quickley attempts a 3Pt. Wide open! Vince Sabonis is 9.3 feet away. [MAN] Rudy Quickley misses. Rebound secured by Cade Ball.

[04:49] Team_006 possession (Score: 33-35)
Miles Harris attempts a Midrange. Wide open! Dirk Lillard is 7.1 feet away. [ZONE] MILES HARRIS MAKES IT!
Score: 35-35

[04:35] Team_027 possession (Score: 35-35)
Dirk Lillard makes the Layup and draws the foul on Lamelo Westbrook! And-1! Dirk Lillard to the line for 1. [Team fouls: 4] (Lamelo Westbrook: 1 personal fouls)   FT 1/1: MISS Dirk Lillard makes 0/1 from the line. Rebound secured by Vince Sabonis.
Score: 35-37

[04:25] Team_006 possession (Score: 35-37)
Miles Harris attempts a 3Pt. Contested by Rudy Quickley (3.8 feet, ZONE). Miles Harris misses. Rebound secured by Dirk Lillard.

[04:05] Team_027 possession (Score: 35-37)
CJ Green attempts a 3Pt. Contested by Miles Harris (4.3 feet, MAN). CJ Green misses. Rebound secured by Vince Sabonis.

[03:52] Team_006 possession (Score: 35-37)
Lamelo Westbrook throws a bad pass! Stolen by Dirk Lillard! TURNOVER! (live ball)

[03:37] Team_027 possession (Score: 35-37)
Ben Stewart drives, Cade Ball stays with him. Ben Stewart attempts a Layup. Heavily contested by Cade Ball (0.5 feet, ZONE)! BEN STEWART MAKES IT! Assist: LeBron Russell
Score: 35-39

[03:19] Team_006 possession (Score: 35-39)
Lamelo Westbrook attempts a Layup. Heavily contested by Ben Stewart (1.7 feet, ZONE)! Lamelo Westbrook misses. Rebound secured by LeBron Russell.

[03:09] Team_027 possession (Score: 35-39)
Rudy Quickley makes the Layup and draws the foul on Vince Sabonis! And-1! Rudy Quickley to the line for 1. [BONUS: 5 team fouls] (Vince Sabonis: 2 personal fouls)   FT 1/1: GOOD Rudy Quickley makes 1/1 from the line.
Score: 35-42

[02:57] Team_006 possession (Score: 35-42)
Lamelo Westbrook drives, Dirk Lillard stays with him. Lamelo Westbrook attempts a Layup. Contested by Dirk Lillard (3.5 feet, MAN). LAMELO WESTBROOK MAKES IT! Assist: Miles Harris
Score: 37-42

[02:45] Team_027 possession (Score: 37-42)
CJ Green attempts a 3Pt. Contested by Miles Harris (5.6 feet, MAN). CJ Green misses. Rebound secured by Cade Ball.

[02:31] Team_006 possession (Score: 37-42)
Miles Harris attempts a 3Pt. Contested by Rudy Quickley (4.2 feet, ZONE). Miles Harris misses. Offensive rebound by Shaquille Sexton! Shaquille Sexton kicks it out.

[02:16] Team_006 possession (Score: 37-42)
Lamelo Westbrook attempts a Layup. Heavily contested by Dirk Lillard (1.9 feet, MAN)! Lamelo Westbrook misses. Rebound secured by LeBron Russell.

[01:58] Team_027 possession (Score: 37-42)
Dirk Lillard drives and kicks out. CJ Green attempts a Midrange. Contested by Cade Ball (5.5 feet, ZONE). CJ GREEN MAKES IT! Assist: LeBron Russell
Score: 37-44

[01:44] Team_006 possession (Score: 37-44)
Vince Sabonis attempts a 3Pt. Contested by Rudy Quickley (3.6 feet, MAN). VINCE SABONIS MAKES IT! Assist: Miles Harris
Score: 40-44

[01:29] Team_027 possession (Score: 40-44)
FOUL! Shooting foul on Cade Ball. CJ Green to the line for 2 free throws. [BONUS: 6 team fouls] (Cade Ball: 3 personal fouls)   FT 1/2: MISS   FT 2/2: GOOD CJ Green makes 1/2 from the line.
Score: 40-45

[01:12] Team_006 possession (Score: 40-45)
FOUL! Reach-in foul on Dirk Lillard during the drive. [Team fouls: 4] No free throws, side out. (Dirk Lillard: 1 personal fouls)

[00:57] Team_006 possession (Score: 40-45)
Shaquille Sexton attempts a 3Pt. Contested by Rudy Quickley (2.6 feet, ZONE). SHAQUILLE SEXTON MAKES IT! Assist: Vince Sabonis
Score: 43-45

[00:43] Team_027 possession (Score: 43-45)
LeBron Russell loses the ball! Stripped by Cade Ball! TURNOVER! (live ball)

[00:24] Team_006 possession (Score: 43-45)
Vince Sabonis attempts a 3Pt. Wide open! Rudy Quickley is 6.5 feet away. [ZONE] VINCE SABONIS MAKES IT! Assist: Miles Harris
Score: 46-45

[00:13] Team_027 possession (Score: 46-45)
FOUL! Shooting foul on Vince Sabonis. Rudy Quickley to the line for 3 free throws. [BONUS: 7 team fouls] (Vince Sabonis: 3 personal fouls)   FT 1/3: GOOD   FT 2/3: GOOD   FT 3/3: MISS Rudy Quickley makes 2/3 from the line. Rebound secured by Cade Ball.
Score: 46-47

================================================================================
                              2ND QUARTER COMPLETE                              
================================================================================

2ND QUARTER SCORE: Team_006 17, Team_027 24

BOX SCORE:
================================================================================

Team_006
--------------------------------------------------------------------------------
Player                MIN  PTS  REB  AST  TO      FG   FG%      3P   3P%
--------------------------------------------------------------------------------
Vince Sabonis          11    6    3    1   0   2/3    66.7     0/0   0.0
Miles Harris           11    4    0    3   0   2/5    40.0     0/0   0.0
Shaquille Sexton       11    3    4    0   0   1/1   100.0     0/0   0.0
Ja Butler              13    2    1    0   0   1/1   100.0     0/0   0.0
Lamelo Westbrook       11    2    0    0   0   1/3    33.3     0/0   0.0
Franz Wagner           13    0    0    0   0   0/1     0.0     0/0   0.0
Shai Westbrook         13    0    0    0   0   0/1     0.0     0/0   0.0
Bradley Gobert         13    0    1    0   0   0/0     0.0     0/0   0.0
Cade Ball              11    0    3    0   0   0/0     0.0     0/0   0.0

TEAM: FG: 7/15 (46.7%), 3PT: 3/6 (50.0%), REB: 12 (5 off, 7 def), AST: 4, TO: 6
TEAM FOULS: 7 [Team_027 in BONUS]


Team_027
--------------------------------------------------------------------------------
Player                MIN  PTS  REB  AST  TO      FG   FG%      3P   3P%
--------------------------------------------------------------------------------
Rudy Quickley          11    5    0    0   0   2/5    40.0     0/0   0.0
Scottie Harden         13    3    0    0   0   1/1   100.0     0/0   0.0
Dirk Lillard           11    3    1    0   0   1/2    50.0     0/0   0.0
CJ Green               11    3    0    1   0   2/4    50.0     0/0   0.0
John Russell           13    2    0    0   0   1/1   100.0     0/0   0.0
Ben Stewart            11    2    3    0   0   1/1   100.0     0/0   0.0
Tony Doncic            13    0    2    1   0   0/0     0.0     0/0   0.0
LeBron Russell         11    0    3    2   0   0/1     0.0     0/0   0.0

TEAM: FG: 8/15 (53.3%), 3PT: 2/6 (33.3%), REB: 9 (1 off, 8 def), AST: 4, TO: 6
TEAM FOULS: 4

================================================================================

================================================================================
                       3RD QUARTER - Team_006 vs Team_027                       
================================================================================

[12:00] Team_006 possession (Score: 46-47)
Shai Westbrook attempts a Midrange. Contested by Bradley Dosunmu (3.9 feet, ZONE). Shai Westbrook misses. FOUL! Loose ball foul on John Russell during the rebound battle. [Team fouls: 1] No free throws, side out. (John Russell: 1 personal fouls)

[11:42] Team_006 possession (Score: 46-47)
Shai Westbrook drives and kicks out. Bradley Gobert attempts a 3Pt. Contested by Tim Johnson (3.7 feet, ZONE). Bradley Gobert misses. Rebound secured by John Russell.

[11:27] Team_027 possession (Score: 46-47)
Bradley Dosunmu attempts a 3Pt. Wide open! Ja Butler is 6.6 feet away. [MAN] Bradley Dosunmu misses. Rebound secured by Shai Westbrook.

[11:13] Team_006 possession (Score: 46-47)
Bradley Gobert drives, picks up John Russell. Help arrives from Tony Doncic! Bradley Gobert attempts a Dunk. Contested by Tony Doncic (4.5 feet, ZONE). Bradley Gobert misses. Rebound secured by Tony Doncic.

[11:01] Team_027 possession (Score: 46-47)
John Russell drives to the basket... John Russell commits a violation (traveling/carry)! TURNOVER! (dead ball)

[10:48] Team_006 possession (Score: 46-47)
FOUL! Holding foul on Tim Johnson. [Team fouls: 2] No free throws, side out. (Tim Johnson: 1 personal fouls)

[10:34] Team_006 possession (Score: 46-47)
Ja Butler makes the Layup and draws the foul on Bradley Dosunmu! And-1! Ja Butler to the line for 1. [Team fouls: 3] (Bradley Dosunmu: 1 personal fouls)   FT 1/1: GOOD Ja Butler makes 1/1 from the line.
Score: 49-47

[10:22] Team_027 possession (Score: 49-47)
FOUL! Offensive foul on Scottie Harden! Jayson Young drew the charge! [Team fouls: 4] (Scottie Harden: 1 personal fouls) TURNOVER! (dead ball)

[10:13] Team_006 possession (Score: 49-47)
Ja Butler attempts a Midrange. Contested by Bradley Dosunmu (5.3 feet, MAN). JA BUTLER MAKES IT!
Score: 51-47

[09:59] Team_027 possession (Score: 51-47)
Tim Johnson attempts a 3Pt. Contested by Shai Westbrook (5.0 feet, ZONE). Tim Johnson misses. Rebound secured by Bradley Gobert.

[09:43] Team_006 possession (Score: 51-47)
Franz Wagner drives, Tony Doncic stays with him. Franz Wagner attempts a Layup. Contested by Tony Doncic (2.2 feet, MAN). FRANZ WAGNER MAKES IT!
Score: 53-47

[09:29] Team_027 possession (Score: 53-47)
Bradley Dosunmu attempts a Midrange. Heavily contested by Shai Westbrook (0.9 feet, ZONE)! BRADLEY DOSUNMU MAKES IT! Assist: Scottie Harden
Score: 53-49

[09:10] Team_006 possession (Score: 53-49)
Jayson Young attempts a 3Pt. Wide open! Scottie Harden is 6.2 feet away. [MAN] Jayson Young misses. Offensive rebound by Bradley Gobert! Bradley Gobert kicks it out.

[08:58] Team_006 possession (Score: 53-49)
Franz Wagner attempts a 3Pt. Contested by Tony Doncic (4.9 feet, MAN). FRANZ WAGNER MAKES IT! Assist: Shai Westbrook
Score: 56-49

[08:44] Team_027 possession (Score: 56-49)
Tim Johnson attempts a 3Pt. Contested by Shai Westbrook (4.4 feet, ZONE). Tim Johnson misses. Rebound secured by Bradley Gobert.

[08:32] Team_006 possession (Score: 56-49)
Franz Wagner attempts a 3Pt. Contested by Tim Johnson (5.3 feet, ZONE). Franz Wagner misses. Rebound secured by Bradley Dosunmu.

[08:17] Team_027 possession (Score: 56-49)
Tim Johnson commits a violation (traveling/carry)! TURNOVER! (dead ball)

[08:03] Team_006 possession (Score: 56-49)
Bradley Gobert attempts a Layup. Contested by John Russell (3.9 feet, MAN). BRADLEY GOBERT MAKES IT! Assist: Shai Westbrook
Score: 58-49

[07:43] Team_027 possession (Score: 58-49)
Tim Johnson attempts a 3Pt. Heavily contested by Shai Westbrook (1.8 feet, ZONE)! Tim Johnson misses. Rebound secured by Shai Westbrook.

[07:29] Team_006 possession (Score: 58-49)
Bradley Gobert drives to the basket... Bradley Gobert throws a bad pass out of bounds! TURNOVER! (dead ball)

[07:15] Team_027 possession (Score: 58-49)
Tim Johnson makes the Dunk and draws the foul on Shai Westbrook! And-1! Tim Johnson to the line for 1. [Team fouls: 1] (Shai Westbrook: 1 personal fouls)   FT 1/1: GOOD Tim Johnson makes 1/1 from the line.
Score: 58-52

[07:01] Team_006 possession (Score: 58-52)
Shai Westbrook drives and kicks out. Franz Wagner attempts a Midrange. Contested by Bradley Dosunmu (4.5 feet, ZONE). Franz Wagner misses. Offensive rebound by Bradley Gobert! Bradley Gobert kicks it out.

[06:51] Team_006 possession (Score: 58-52)
Ja Butler loses control! Ball rolls out of bounds! TURNOVER! (dead ball)

[06:35] Team_027 possession (Score: 58-52)
Tony Doncic attempts a 3Pt. Contested by Franz Wagner (4.4 feet, MAN). TONY DONCIC MAKES IT! Assist: Scottie Harden
Score: 58-55

[06:19] Team_006 possession (Score: 58-55)
Jayson Young attempts a 3Pt. Contested by Tim Johnson (4.7 feet, ZONE). Jayson Young misses. Rebound secured by Tony Doncic.

[06:01] Team_027 possession (Score: 58-55)
Bradley Dosunmu throws a bad pass out of bounds! TURNOVER! (dead ball)

[05:51] Team_006 possession (Score: 58-55)
Jayson Young attempts a 3Pt. Contested by Tim Johnson (5.4 feet, ZONE). JAYSON YOUNG MAKES IT! Assist: Franz Wagner
Score: 61-55

[05:36] Team_027 possession (Score: 61-55)
Bradley Dosunmu attempts a Layup. BLOCKED BY BRADLEY GOBERT! Ball is loose! Offensive rebound by John Russell! John Russell kicks it out.

[05:21] Team_027 possession (Score: 61-55)
John Russell drives to the basket... FOUL! Offensive foul on John Russell! Bradley Gobert drew the charge! [Team fouls: 5] (John Russell: 2 personal fouls) TURNOVER! (dead ball)

[05:02] Team_006 possession (Score: 61-55)
Ja Butler attempts a 3Pt. Wide open! Tim Johnson is 7.9 feet away. [ZONE] JA BUTLER MAKES IT! Assist: Jayson Young
Score: 64-55

[04:50] Team_027 possession (Score: 64-55)
John Russell makes the Layup and draws the foul on Bradley Gobert! And-1! John Russell to the line for 1. [Team fouls: 2] (Bradley Gobert: 1 personal fouls)   FT 1/1: GOOD John Russell makes 1/1 from the line.
Score: 64-58

[04:36] Team_006 possession (Score: 64-58)
Ja Butler attempts a Layup. BLOCKED BY JOHN RUSSELL! Ball is loose! Offensive rebound by Bradley Gobert! Bradley Gobert kicks it out.

[04:18] Team_006 possession (Score: 64-58)
Jayson Young makes the 3Pt and draws the foul on Scottie Harden! And-1! Jayson Young to the line for 1. [BONUS: 6 team fouls] (Scottie Harden: 2 personal fouls)   FT 1/1: GOOD Jayson Young makes 1/1 from the line.
Score: 68-58

[04:04] Team_027 possession (Score: 68-58)
Bradley Dosunmu drives and kicks out. Scottie Harden attempts a Midrange. Wide open! Jayson Young is 6.8 feet away. [MAN] Scottie Harden misses. Offensive rebound by Bradley Dosunmu! Bradley Dosunmu kicks it out.

[03:45] Team_027 possession (Score: 68-58)
Tony Doncic loses the ball! Stripped by Franz Wagner! TURNOVER! (live ball)

[03:28] Team_006 possession (Score: 68-58)
Ja Butler attempts a 3Pt. Contested by Bradley Dosunmu (2.7 feet, MAN). Ja Butler misses. FOUL! Loose ball foul on John Russell during the rebound battle. [IN THE BONUS! 7 team fouls] Ja Butler to the line for 2 free throws. (John Russell: 3 personal fouls)   FT 1/2: MISS   FT 2/2: GOOD Ja Butler makes 1/2 from the line.
Score: 69-58

[03:17] Team_027 possession (Score: 69-58)
FOUL! Shooting foul on Jayson Young. Scottie Harden to the line for 3 free throws. [Team fouls: 3] (Jayson Young: 1 personal fouls)   FT 1/3: GOOD   FT 2/3: GOOD   FT 3/3: MISS Scottie Harden makes 2/3 from the line. Offensive rebound by Bradley Dosunmu! Bradley Dosunmu kicks it out.
Score: 69-60

[03:01] Team_027 possession (Score: 69-60)
John Russell drives and kicks out. Tim Johnson attempts a 3Pt. Contested by Shai Westbrook (3.8 feet, ZONE). Tim Johnson misses. Rebound secured by Bradley Gobert.

[02:43] Team_006 possession (Score: 69-60)
FOUL! Reach-in foul on Scottie Harden during the drive. [IN THE BONUS! 8 team fouls] Jayson Young to the line for 2 free throws. (Scottie Harden: 3 personal fouls)   FT 1/2: GOOD   FT 2/2: GOOD Jayson Young makes 2/2 from the line.
Score: 71-60

[02:30] Team_027 possession (Score: 71-60)
Scottie Harden drives, picks up Jayson Young. Help arrives from Shai Westbrook! Scottie Harden attempts a Layup. Wide open! Shai Westbrook is 6.5 feet away. [MAN] Scottie Harden misses. Offensive rebound by John Russell! John Russell puts it back in!
Score: 71-62

[02:15] Team_006 possession (Score: 71-62)
Bradley Gobert drives to the basket... Bradley Gobert loses the ball! Stripped by John Russell! TURNOVER! (live ball)

[02:02] Team_027 possession (Score: 71-62)
John Russell attempts a Layup. Wide open! Bradley Gobert is 6.4 feet away. [MAN] JOHN RUSSELL MAKES IT! Assist: Tony Doncic
Score: 71-64

[01:47] Team_006 possession (Score: 71-64)
Bradley Gobert drives, Bradley Dosunmu stays with him. Bradley Gobert attempts a Dunk. Heavily contested by Bradley Dosunmu (1.6 feet, ZONE)! Bradley Gobert misses. Rebound secured by Bradley Dosunmu.

[01:31] Team_027 possession (Score: 71-64)
Bradley Dosunmu loses the ball! Stripped by Ja Butler! TURNOVER! (live ball)

[01:19] Team_006 possession (Score: 71-64)
Ja Butler attempts a 3Pt. Wide open! Bradley Dosunmu is 7.8 feet away. [MAN] Ja Butler misses. Rebound secured by John Russell.

[01:02] Team_027 possession (Score: 71-64)
Bradley Dosunmu attempts a 3Pt. Contested by Shai Westbrook (4.7 feet, ZONE). Bradley Dosunmu misses. Rebound secured by Ja Butler.

[00:47] Team_006 possession (Score: 71-64)
Jayson Young attempts a 3Pt. Wide open! Tim Johnson is 9.7 feet away. [ZONE] Jayson Young misses. Rebound secured by Tony Doncic.

[00:33] Team_027 possession (Score: 71-64)
Bradley Dosunmu attempts a 3Pt. Contested by Ja Butler (4.5 feet, MAN). Bradley Dosunmu misses. Rebound secured by Ja Butler.

[00:16] Team_006 possession (Score: 71-64)
Shai Westbrook loses control! Ball rolls out of bounds! TURNOVER! (dead ball)

[00:16] Substitution (Team_006): Shai Westbrook OUT → Miles Harris IN (stamina_rule2)

[00:16] Substitution (Team_006): Franz Wagner OUT → Lamelo Westbrook IN (stamina_rule2)

[00:16] Substitution (Team_006): Jayson Young OUT → Vince Sabonis IN (stamina_rule2)

[00:16] Substitution (Team_006): Ja Butler OUT → Cade Ball IN (stamina_rule2)

[00:16] Substitution (Team_006): Bradley Gobert OUT → Shaquille Sexton IN (stamina_rule2)

[00:16] Substitution (Team_027): Tim Johnson OUT → CJ Green IN (stamina_rule2)

[00:16] Substitution (Team_027): Tony Doncic OUT → Dirk Lillard IN (stamina_rule2)

[00:16] Substitution (Team_027): Scottie Harden OUT → Rudy Quickley IN (stamina_rule2)

[00:16] Substitution (Team_027): Bradley Dosunmu OUT → LeBron Russell IN (stamina_rule2)

[00:16] Substitution (Team_027): John Russell OUT → Ben Stewart IN (stamina_rule2)

[00:04] Team_027 possession (Score: 71-64)
Ben Stewart drives, Cade Ball stays with him. Ben Stewart attempts a Layup. Wide open! Cade Ball is 6.2 feet away. [ZONE] BEN STEWART MAKES IT!
Score: 71-66

================================================================================
                              3RD QUARTER COMPLETE                              
================================================================================

3RD QUARTER SCORE: Team_006 25, Team_027 19

BOX SCORE:
================================================================================

Team_006
--------------------------------------------------------------------------------
Player                MIN  PTS  REB  AST  TO      FG   FG%      3P   3P%
--------------------------------------------------------------------------------
Ja Butler              25    9    3    0   0   4/5    80.0     0/0   0.0
Jayson Young           25    9    0    1   0   3/5    60.0     0/0   0.0
Franz Wagner           25    5    0    1   0   2/3    66.7     0/0   0.0
Bradley Gobert         25    2    6    0   0   1/3    33.3     0/0   0.0
Shai Westbrook         25    0    2    2   0   0/1     0.0     0/0   0.0

TEAM: FG: 10/17 (58.8%), 3PT: 5/9 (55.6%), REB: 11 (4 off, 7 def), AST: 4, TO: 4
TEAM FOULS: 3


Team_027
--------------------------------------------------------------------------------
Player                MIN  PTS  REB  AST  TO      FG   FG%      3P   3P%
--------------------------------------------------------------------------------
John Russell           25    7    4    0   0   3/4    75.0     0/0   0.0
Tony Doncic            25    3    3    1   0   1/1   100.0     0/0   0.0
Tim Johnson            25    3    0    0   0   1/4    25.0     0/0   0.0
Bradley Dosunmu        25    2    4    0   0   1/4    25.0     0/0   0.0
Ben Stewart            11    2    0    0   0   1/1   100.0     0/0   0.0
Scottie Harden         25    0    0    2   0   0/0     0.0     0/0   0.0

TEAM: FG: 7/14 (50.0%), 3PT: 1/7 (14.3%), REB: 11 (4 off, 7 def), AST: 3, TO: 7
TEAM FOULS: 8 [Team_006 in BONUS]

================================================================================

================================================================================
                       4TH QUARTER - Team_006 vs Team_027                       
================================================================================

[12:00] Team_006 possession (Score: 71-66)
Jayson Young attempts a 3Pt. Wide open! Tim Johnson is 10.0 feet away. [ZONE] Jayson Young misses. Rebound secured by John Russell.

[11:47] Team_027 possession (Score: 71-66)
Tim Johnson attempts a 3Pt. Contested by Shai Westbrook (2.0 feet, MAN). Tim Johnson misses. Rebound secured by Bradley Gobert.

[11:31] Team_006 possession (Score: 71-66)
Ja Butler attempts a 3Pt. Wide open! Bradley Dosunmu is 6.8 feet away. [MAN] Ja Butler misses. Rebound secured by Bradley Dosunmu.

[11:19] Team_027 possession (Score: 71-66)
Scottie Harden attempts a Midrange. Wide open! Jayson Young is 7.6 feet away. [MAN] SCOTTIE HARDEN MAKES IT! Assist: Tony Doncic
Score: 71-68

[11:03] Team_006 possession (Score: 71-68)
Shai Westbrook attempts a 3Pt. Contested by Tony Doncic (4.4 feet, ZONE). Shai Westbrook misses. Rebound secured by Bradley Dosunmu.

[10:48] Team_027 possession (Score: 71-68)
FOUL! Holding foul on Ja Butler. [Team fouls: 1] No free throws, side out. (Ja Butler: 1 personal fouls)

[10:34] Team_027 possession (Score: 71-68)
FOUL! Offensive foul on Tim Johnson! Shai Westbrook drew the charge! [Team fouls: 1] (Tim Johnson: 1 personal fouls) TURNOVER! (dead ball)

[10:21] Team_006 possession (Score: 71-68)
Bradley Gobert loses control! Ball rolls out of bounds! TURNOVER! (dead ball)

[10:21] Substitution (Team_006): Shai Westbrook OUT → Miles Harris IN (stamina_rule2)

[10:21] Substitution (Team_006): Franz Wagner OUT → Lamelo Westbrook IN (stamina_rule2)

[10:21] Substitution (Team_006): Jayson Young OUT → Vince Sabonis IN (stamina_rule2)

[10:21] Substitution (Team_006): Ja Butler OUT → Cade Ball IN (stamina_rule2)

[10:21] Substitution (Team_006): Bradley Gobert OUT → Shaquille Sexton IN (stamina_rule2)

[10:21] Substitution (Team_027): Tim Johnson OUT → CJ Green IN (stamina_rule2)

[10:21] Substitution (Team_027): Tony Doncic OUT → Dirk Lillard IN (stamina_rule2)

[10:21] Substitution (Team_027): Scottie Harden OUT → Rudy Quickley IN (stamina_rule2)

[10:21] Substitution (Team_027): Bradley Dosunmu OUT → LeBron Russell IN (stamina_rule2)

[10:21] Substitution (Team_027): John Russell OUT → Ben Stewart IN (stamina_rule2)

[10:08] Team_027 possession (Score: 71-68)
Dirk Lillard attempts a 3Pt. Contested by Lamelo Westbrook (4.0 feet, ZONE). Dirk Lillard misses. Rebound secured by Cade Ball.

[09:53] Team_006 possession (Score: 71-68)
Shaquille Sexton makes the Dunk and draws the foul on Dirk Lillard! And-1! Shaquille Sexton to the line for 1. [Team fouls: 2] (Dirk Lillard: 1 personal fouls)   FT 1/1: GOOD Shaquille Sexton makes 1/1 from the line.
Score: 74-68

[09:41] Team_027 possession (Score: 74-68)
Dirk Lillard throws a bad pass out of bounds! TURNOVER! (dead ball)

[09:26] Team_006 possession (Score: 74-68)
Vince Sabonis attempts a 3Pt. Contested by Rudy Quickley (3.0 feet, ZONE). Vince Sabonis misses. Rebound secured by Dirk Lillard.

[09:12] Team_027 possession (Score: 74-68)
Ben Stewart drives to the basket... Ben Stewart throws a bad pass! Stolen by Cade Ball! TURNOVER! (live ball)

[08:52] Team_006 possession (Score: 74-68)
Lamelo Westbrook drives and kicks out. Cade Ball attempts a 3Pt. Contested by Rudy Quickley (3.2 feet, ZONE). Cade Ball misses. Offensive rebound by Cade Ball! Cade Ball kicks it out.

[08:35] Team_006 possession (Score: 74-68)
FOUL! Offensive foul on Shaquille Sexton! Ben Stewart drew the charge! [Team fouls: 2] (Shaquille Sexton: 1 personal fouls) TURNOVER! (dead ball)

[08:17] Team_027 possession (Score: 74-68)
Dirk Lillard loses the ball! Stripped by Lamelo Westbrook! TURNOVER! (live ball)

[08:05] Team_006 possession (Score: 74-68)
Miles Harris attempts a Midrange. Wide open! CJ Green is 6.4 feet away. [MAN] Miles Harris misses. Rebound secured by Dirk Lillard.

[07:52] Team_027 possession (Score: 74-68)
Dirk Lillard attempts a 3Pt. Contested by Lamelo Westbrook (3.8 feet, ZONE). Dirk Lillard misses. Rebound secured by Vince Sabonis.

[07:37] Team_006 possession (Score: 74-68)
Lamelo Westbrook attempts a 3Pt. Contested by Dirk Lillard (5.7 feet, MAN). LAMELO WESTBROOK MAKES IT! Assist: Vince Sabonis
Score: 77-68

[07:23] Team_027 possession (Score: 77-68)
Ben Stewart throws a bad pass out of bounds! TURNOVER! (dead ball)

[07:08] Team_006 possession (Score: 77-68)
Lamelo Westbrook attempts a Layup. Heavily contested by Dirk Lillard (1.6 feet, MAN)! LAMELO WESTBROOK MAKES IT!
Score: 79-68

[06:57] Team_027 possession (Score: 79-68)
Dirk Lillard throws a bad pass! Stolen by Lamelo Westbrook! TURNOVER! (live ball)

[06:39] Team_006 possession (Score: 79-68)
FOUL! Shooting foul on Dirk Lillard. Cade Ball to the line for 2 free throws. [Team fouls: 3] (Dirk Lillard: 2 personal fouls)   FT 1/2: GOOD   FT 2/2: GOOD Cade Ball makes 2/2 from the line.
Score: 81-68

[06:23] Team_027 possession (Score: 81-68)
FOUL! Shooting foul on Lamelo Westbrook. Dirk Lillard to the line for 3 free throws. [Team fouls: 3] (Lamelo Westbrook: 1 personal fouls)   FT 1/3: GOOD   FT 2/3: MISS   FT 3/3: GOOD Dirk Lillard makes 2/3 from the line.
Score: 81-70

[06:05] Team_006 possession (Score: 81-70)
Miles Harris attempts a 3Pt. Contested by CJ Green (3.6 feet, MAN). Miles Harris misses. Offensive rebound by Shaquille Sexton! Shaquille Sexton kicks it out.

[05:52] Team_006 possession (Score: 81-70)
Lamelo Westbrook attempts a 3Pt. Contested by LeBron Russell (5.1 feet, ZONE). Lamelo Westbrook misses. Offensive rebound by Cade Ball! Cade Ball kicks it out.

[05:40] Team_006 possession (Score: 81-70)
Shaquille Sexton attempts a 3Pt. Contested by Ben Stewart (3.8 feet, MAN). SHAQUILLE SEXTON MAKES IT!
Score: 84-70

[05:28] Team_027 possession (Score: 84-70)
Dirk Lillard drives, Lamelo Westbrook stays with him. Dirk Lillard attempts a Dunk. Heavily contested by Lamelo Westbrook (0.5 feet, MAN)! DIRK LILLARD MAKES IT! Assist: CJ Green
Score: 84-72

[05:11] Team_006 possession (Score: 84-72)
Vince Sabonis attempts a 3Pt. Contested by Rudy Quickley (5.2 feet, ZONE). Vince Sabonis misses. Rebound secured by Ben Stewart.

[05:00] Team_027 possession (Score: 84-72)
Ben Stewart attempts a Midrange. Wide open! Vince Sabonis is 6.4 feet away. [ZONE] Ben Stewart misses. Rebound secured by Cade Ball.

[04:44] Team_006 possession (Score: 84-72)
FOUL! Reach-in foul on LeBron Russell during the drive. [Team fouls: 4] No free throws, side out. (LeBron Russell: 1 personal fouls)

[04:27] Team_006 possession (Score: 84-72)
Shaquille Sexton attempts a Layup. Contested by Ben Stewart (5.5 feet, MAN). SHAQUILLE SEXTON MAKES IT!
Score: 86-72

[04:10] Team_027 possession (Score: 86-72)
LeBron Russell attempts a Midrange. Wide open! Vince Sabonis is 6.4 feet away. [ZONE] LeBron Russell misses. Rebound secured by Cade Ball.

[03:53] Team_006 possession (Score: 86-72)
Cade Ball attempts a 3Pt. Wide open! LeBron Russell is 8.9 feet away. [MAN] Cade Ball misses. Rebound secured by LeBron Russell.

[03:38] Team_027 possession (Score: 86-72)
Ben Stewart drives to the basket... Ben Stewart commits a violation (traveling/carry)! TURNOVER! (dead ball)

[03:26] Team_006 possession (Score: 86-72)
Cade Ball drives and kicks out. Cade Ball attempts a Midrange. Wide open! LeBron Russell is 7.3 feet away. [MAN] Cade Ball misses. Rebound secured by LeBron Russell.

[03:14] Team_027 possession (Score: 86-72)
LeBron Russell commits a violation (traveling/carry)! TURNOVER! (dead ball)

[03:01] Team_006 possession (Score: 86-72)
Lamelo Westbrook attempts a 3Pt. Contested by Dirk Lillard (5.5 feet, MAN). Lamelo Westbrook misses. Rebound secured by Ben Stewart.

[02:46] Team_027 possession (Score: 86-72)
CJ Green attempts a 3Pt. Wide open! Miles Harris is 6.7 feet away. [MAN] CJ Green misses. Rebound secured by Vince Sabonis.

[02:35] Team_006 possession (Score: 86-72)
Shaquille Sexton attempts a Midrange. Contested by Ben Stewart (5.9 feet, MAN). Shaquille Sexton misses. Rebound secured by Dirk Lillard.

[02:18] Team_027 possession (Score: 86-72)
FOUL! Holding foul on Vince Sabonis. [Team fouls: 4] No free throws, side out. (Vince Sabonis: 1 personal fouls)

[02:06] Team_027 possession (Score: 86-72)
Dirk Lillard attempts a Layup. Contested by Cade Ball (2.5 feet, ZONE). Dirk Lillard misses. FOUL! Loose ball foul on Cade Ball during the rebound battle. [IN THE BONUS! 5 team fouls] Ben Stewart to the line for 2 free throws. (Cade Ball: 1 personal fouls)   FT 1/2: MISS   FT 2/2: GOOD Ben Stewart makes 1/2 from the line.
Score: 86-73

[01:52] Team_006 possession (Score: 86-73)
Lamelo Westbrook attempts a 3Pt. Contested by Rudy Quickley (5.5 feet, ZONE). Lamelo Westbrook misses. Rebound secured by Dirk Lillard.

[01:43] Team_027 possession (Score: 86-73)
Ben Stewart drives to the basket... Ben Stewart throws a bad pass! Stolen by Cade Ball! TURNOVER! (live ball)

[01:33] Team_006 possession (Score: 86-73)
Shaquille Sexton attempts a Midrange. Contested by Rudy Quickley (3.0 feet, ZONE). SHAQUILLE SEXTON MAKES IT! Assist: Vince Sabonis
Score: 88-73

[01:22] Team_027 possession (Score: 88-73)
LeBron Russell attempts a Layup. Contested by Cade Ball (4.1 feet, ZONE). LEBRON RUSSELL MAKES IT!
Score: 88-75

[01:05] Team_006 possession (Score: 88-75)
Shaquille Sexton drives, picks up Ben Stewart. Help arrives from Dirk Lillard! Shaquille Sexton attempts a Dunk. Wide open! Dirk Lillard is 7.6 feet away. [ZONE] SHAQUILLE SEXTON MAKES IT! Assist: Vince Sabonis
Score: 90-75

[00:45] Team_027 possession (Score: 90-75)
CJ Green drives, Cade Ball stays with him. CJ Green attempts a Layup. Contested by Cade Ball (4.5 feet, ZONE). CJ Green misses. Rebound secured by Shaquille Sexton.

[00:28] Team_006 possession (Score: 90-75)
Lamelo Westbrook attempts a 3Pt. Contested by LeBron Russell (3.8 feet, ZONE). Lamelo Westbrook misses. Rebound secured by Dirk Lillard.

[00:18] Team_027 possession (Score: 90-75)
FOUL! Holding foul on Miles Harris. [IN THE BONUS! 6 team fouls] CJ Green to the line for 2 free throws. (Miles Harris: 1 personal fouls)   FT 1/2: MISS   FT 2/2: GOOD CJ Green makes 1/2 from the line.
Score: 90-76

[00:06] Team_006 possession (Score: 90-76)
Vince Sabonis attempts a Layup. Heavily contested by Ben Stewart (1.3 feet, ZONE)! VINCE SABONIS MAKES IT! Assist: Miles Harris
Score: 92-76

================================================================================
                              4TH QUARTER COMPLETE                              
================================================================================

4TH QUARTER SCORE: Team_006 21, Team_027 10

BOX SCORE:
================================================================================

Team_006
--------------------------------------------------------------------------------
Player                MIN  PTS  REB  AST  TO      FG   FG%      3P   3P%
--------------------------------------------------------------------------------
Shaquille Sexton       21   12    2    0   0   5/6    83.3     0/0   0.0
Lamelo Westbrook       21    5    0    0   0   2/5    40.0     0/0   0.0
Cade Ball              21    2    5    0   0   1/3    33.3     0/0   0.0
Vince Sabonis          21    2    2    3   0   1/3    33.3     0/0   0.0
Jayson Young           27    0    0    0   0   0/1     0.0     0/0   0.0
Bradley Gobert         27    0    1    0   0   0/0     0.0     0/0   0.0
Ja Butler              27    0    0    0   0   0/1     0.0     0/0   0.0
Shai Westbrook         27    0    0    0   0   0/1     0.0     0/0   0.0
Miles Harris           21    0    0    1   0   0/1     0.0     0/0   0.0

TEAM: FG: 9/21 (42.9%), 3PT: 2/11 (18.2%), REB: 10 (3 off, 7 def), AST: 4, TO: 2
TEAM FOULS: 6 [Team_027 in BONUS]


Team_027
--------------------------------------------------------------------------------
Player                MIN  PTS  REB  AST  TO      FG   FG%      3P   3P%
--------------------------------------------------------------------------------
Dirk Lillard           21    4    5    0   0   2/4    50.0     0/0   0.0
Scottie Harden         27    2    0    0   0   1/1   100.0     0/0   0.0
LeBron Russell         21    2    2    0   0   1/2    50.0     0/0   0.0
CJ Green               21    1    0    1   0   1/3    33.3     0/0   0.0
Ben Stewart            21    1    2    0   0   1/2    50.0     0/0   0.0
John Russell           27    0    1    0   0   0/0     0.0     0/0   0.0
Tim Johnson            27    0    0    0   0   0/1     0.0     0/0   0.0
Bradley Dosunmu        27    0    2    0   0   0/0     0.0     0/0   0.0
Tony Doncic            27    0    0    1   0   0/0     0.0     0/0   0.0

TEAM: FG: 6/13 (46.2%), 3PT: 1/5 (20.0%), REB: 12 (0 off, 12 def), AST: 2, TO: 9
TEAM FOULS: 4

================================================================================

================================================================================
                               FULL GAME COMPLETE                               
================================================================================

FINAL SCORE: Team_006 92, Team_027 76

SCORING BY QUARTER:
--------------------------------------------------------------------------------
Team                     Q1     Q2     Q3     Q4    FINAL
--------------------------------------------------------------------------------
Team_006                 29     17     25     21       92
Team_027                 23     24     19     10       76
--------------------------------------------------------------------------------

FULL GAME BOX SCORE:
================================================================================

Team_006
--------------------------------------------------------------------------------
Player                MIN  PTS  REB  AST  TO      FG   FG%      3P   3P%      FT STL BLK
--------------------------------------------------------------------------------
Shai Westbrook         27    8    4    5   3   4/8    50.0   1/4    25.0   1/1     0   1
Franz Wagner           27   15    0    2   1   6/10   60.0   3/6    50.0   0/0     1   0
Jayson Young           27    9    0    1   2   3/7    42.9   2/6    33.3   3/3     0   1
Ja Butler              27   19    5    1   2   7/10   70.0   2/4    50.0   4/5     1   0
Bradley Gobert         27    2   13    0   3   1/4    25.0   0/0     0.0   0/0     0   2
Miles Harris           21    4    0    4   0   2/6    33.3   0/2     0.0   0/0     1   0
Lamelo Westbrook       21    7    0    0   2   3/8    37.5   1/4    25.0   0/0     2   0
Vince Sabonis          21   11    5    4   1   4/7    57.1   3/5    60.0   0/0     0   0
Cade Ball              21    2    8    0   2   1/3    33.3   0/1     0.0   2/2     4   0
Shaquille Sexton       21   15    7    0   1   6/7    85.7   2/2   100.0   1/1     0   0

TEAM: FG: 37/70 (52.9%), 3PT: 14/34 (41.2%), REB: 40 (13 off, 27 def), AST: 17, TO: 17


Team_027
--------------------------------------------------------------------------------
Player                MIN  PTS  REB  AST  TO      FG   FG%      3P   3P%      FT STL BLK
--------------------------------------------------------------------------------
Tim Johnson            27    5    0    4   3   3/8    37.5   0/5     0.0   1/1     0   0
Tony Doncic            27    6    5    3   2   1/1   100.0   1/1   100.0   0/0     0   1
Scottie Harden         27    9    0    2   1   6/8    75.0   1/2    50.0   2/3     0   0
Bradley Dosunmu        27    5   10    1   4   2/8    25.0   1/5    20.0   0/0     0   0
John Russell           27   20   10    1   1   7/10   70.0   0/0     0.0   2/2     2   1
CJ Green               21    4    0    2   2   1/6    16.7   0/4     0.0   2/4     0   0
Dirk Lillard           21    7    6    0   3   5/8    62.5   2/4    50.0   2/4     2   0
Rudy Quickley          21    5    0    0   2   2/5    40.0   0/2     0.0   3/4     0   0
LeBron Russell         21    2    5    2   4   1/3    33.3   0/0     0.0   0/1     0   0
Ben Stewart            21    5    5    0   3   2/3    66.7   0/0     0.0   1/2     0   0

TEAM: FG: 31/61 (50.8%), 3PT: 5/23 (21.7%), REB: 43 (10 off, 33 def), AST: 15, TO: 25

================================================================================
