================================================================================
                        FULL GAME - Team_052 vs Team_049                        
================================================================================

================================================================================
                       1ST QUARTER - Team_052 vs Team_049                       
================================================================================

[12:00] Team_052 possession (Score: 0-0)
FOUL! Shooting foul on De'Aaron Allen. Josh Durant to the line for 2 free throws. [Team fouls: 1] (De'Aaron Allen: 1 personal fouls)   FT 1/2: MISS   FT 2/2: MISS Josh Durant makes 0/2 from the line. Rebound secured by Shai Mobley.

[11:45] Team_049 possession (Score: 0-0)
Shai Bird attempts a Midrange. Contested by Josh Durant (3.1 feet, ZONE). Shai Bird misses. Rebound secured by James Paul.

[11:29] Team_052 possession (Score: 0-0)
Josh Durant attempts a 3Pt. Heavily contested by Ja Oladipo (0.9 feet, MAN)! Josh Durant misses. Rebound secured by Jimmy Griffin.

[11:18] Team_049 possession (Score: 0-0)
Shai Bird attempts a 3Pt. Wide open! Gary Gasol is 6.8 feet away. [MAN] Shai Bird misses. Rebound secured by Carmelo Middleton.

[11:07] Team_052 possession (Score: 0-0)
Gary Gasol attempts a 3Pt. Contested by Ja Oladipo (5.8 feet, ZONE). GARY GASOL MAKES IT!
Score: 3-0

[10:51] Team_049 possession (Score: 3-0)
Ja Oladipo drives and kicks out. Ja Oladipo attempts a 3Pt. Contested by Bones Morant (5.6 feet, ZONE). Ja Oladipo misses. Rebound secured by Carmelo Middleton.

[10:37] Team_052 possession (Score: 3-0)
James Paul makes the Dunk and draws the foul on Ja Oladipo! And-1! James Paul to the line for 1. [Team fouls: 2] (Ja Oladipo: 1 personal fouls)   FT 1/1: MISS James Paul makes 0/1 from the line. Rebound secured by De'Aaron Allen.
Score: 5-0

[10:21] Team_049 possession (Score: 5-0)
Ja Oladipo attempts a Midrange. Wide open! Josh Durant is 8.8 feet away. [MAN] Ja Oladipo misses. Rebound secured by Bones Morant.

[10:05] Team_052 possession (Score: 5-0)
Carmelo Middleton attempts a 3Pt. Contested by Shai Mobley (3.3 feet, MAN). Carmelo Middleton misses. Rebound secured by De'Aaron Allen.

[09:49] Team_049 possession (Score: 5-0)
Jimmy Griffin drives, James Paul stays with him. Jimmy Griffin attempts a Layup. Heavily contested by James Paul (0.5 feet, ZONE)! Jimmy Griffin misses. Rebound secured by James Paul.

[09:36] Team_052 possession (Score: 5-0)
James Paul drives, picks up De'Aaron Allen. Help arrives from Ja Oladipo! James Paul attempts a Layup. Contested by Ja Oladipo (5.7 feet, ZONE). JAMES PAUL MAKES IT! Assist: Carmelo Middleton
Score: 7-0

[09:24] Team_049 possession (Score: 7-0)
Shai Bird attempts a 3Pt. Contested by Gary Gasol (2.9 feet, MAN). Shai Bird misses. Rebound secured by Carmelo Middleton.

[09:07] Team_052 possession (Score: 7-0)
Carmelo Middleton attempts a Layup. Contested by De'Aaron Allen (5.2 feet, ZONE). CARMELO MIDDLETON MAKES IT! Assist: Gary Gasol
Score: 9-0

[08:55] Team_049 possession (Score: 9-0)
Shai Bird throws a bad pass! Stolen by Gary Gasol! TURNOVER! (live ball)

[08:39] Team_052 possession (Score: 9-0)
FOUL! Offensive foul on Josh Durant! Ja Oladipo drew the charge! [Team fouls: 1] (Josh Durant: 1 personal fouls) TURNOVER! (dead ball)

[08:22] Team_049 possession (Score: 9-0)
Shai Mobley throws a bad pass! Stolen by Carmelo Middleton! TURNOVER! (live ball)

[08:04] Team_052 possession (Score: 9-0)
FOUL! Shooting foul on Shai Bird. Gary Gasol to the line for 3 free throws. [Team fouls: 3] (Shai Bird: 1 personal fouls)   FT 1/3: GOOD   FT 2/3: GOOD   FT 3/3: MISS Gary Gasol makes 2/3 from the line. Rebound secured by De'Aaron Allen.
Score: 11-0

[07:51] Team_049 possession (Score: 11-0)
Jimmy Griffin attempts a Midrange. Contested by Bones Morant (2.9 feet, MAN). Jimmy Griffin misses. Rebound secured by Bones Morant.

[07:42] Team_052 possession (Score: 11-0)
James Paul loses the ball! Stripped by De'Aaron Allen! TURNOVER! (live ball)

[07:24] Team_049 possession (Score: 11-0)
Shai Mobley drives, Carmelo Middleton stays with him. Shai Mobley attempts a Dunk. Contested by Carmelo Middleton (4.4 feet, MAN). Shai Mobley misses. Rebound secured by James Paul.

[07:08] Team_052 possession (Score: 11-0)
Bones Morant attempts a 3Pt. Wide open! Jimmy Griffin is 8.6 feet away. [MAN] Bones Morant misses. Rebound secured by Shai Mobley.

[06:50] Team_049 possession (Score: 11-0)
Ja Oladipo attempts a 3Pt. Contested by Josh Durant (3.3 feet, MAN). JA OLADIPO MAKES IT! Assist: Shai Mobley
Score: 11-3

[06:36] Team_052 possession (Score: 11-3)
Gary Gasol attempts a 3Pt. Wide open! Ja Oladipo is 6.4 feet away. [ZONE] Gary Gasol misses. Offensive rebound by Bones Morant! Bones Morant kicks it out.

[06:17] Team_052 possession (Score: 11-3)
Josh Durant attempts a Layup. Contested by De'Aaron Allen (2.6 feet, ZONE). JOSH DURANT MAKES IT! Assist: Bones Morant
Score: 13-3

[06:03] Team_049 possession (Score: 13-3)
De'Aaron Allen attempts a Midrange. Contested by James Paul (4.9 feet, ZONE). De'Aaron Allen misses. Rebound secured by James Paul.

[05:48] Team_052 possession (Score: 13-3)
FOUL! Shooting foul on Shai Bird. Gary Gasol to the line for 3 free throws. [Team fouls: 4] (Shai Bird: 2 personal fouls)   FT 1/3: GOOD   FT 2/3: GOOD   FT 3/3: MISS Gary Gasol makes 2/3 from the line. Rebound secured by De'Aaron Allen.
Score: 15-3

[05:32] Team_049 possession (Score: 15-3)
Ja Oladipo attempts a 3Pt. Contested by Josh Durant (5.2 feet, MAN). JA OLADIPO MAKES IT! Assist: Jimmy Griffin
Score: 15-6

[05:21] Team_052 possession (Score: 15-6)
Bones Morant attempts a 3Pt. Wide open! Jimmy Griffin is 8.6 feet away. [MAN] Bones Morant misses. Rebound secured by Shai Mobley.

[05:09] Team_049 possession (Score: 15-6)
De'Aaron Allen attempts a Layup. BLOCKED BY JAMES PAUL! Ball is loose! Rebound secured by Carmelo Middleton.

[04:53] Team_052 possession (Score: 15-6)
Bones Morant attempts a Layup. Contested by De'Aaron Allen (3.8 feet, ZONE). BONES MORANT MAKES IT! Assist: James Paul
Score: 17-6

[04:40] Team_049 possession (Score: 17-6)
Shai Mobley drives and kicks out. Shai Mobley attempts a Midrange. Heavily contested by James Paul (0.5 feet, ZONE)! SHAI MOBLEY MAKES IT! Assist: Ja Oladipo
Score: 17-8

[04:24] Team_052 possession (Score: 17-8)
Gary Gasol attempts a Midrange. Contested by Jimmy Griffin (5.1 feet, ZONE). Gary Gasol misses. Rebound secured by Jimmy Griffin.

[04:10] Team_049 possession (Score: 17-8)
Shai Bird attempts a 3Pt. Contested by Bones Morant (2.2 feet, ZONE). Shai Bird misses. Rebound secured by Carmelo Middleton.

[03:57] Team_052 possession (Score: 17-8)
Josh Durant attempts a 3Pt. Contested by Ja Oladipo (3.0 feet, MAN). JOSH DURANT MAKES IT! Assist: Carmelo Middleton
Score: 20-8

[03:47] Team_049 possession (Score: 20-8)
Jimmy Griffin attempts a 3Pt. Contested by Bones Morant (5.1 feet, ZONE). Jimmy Griffin misses. FOUL! Loose ball foul on James Paul during the rebound battle. [Team fouls: 2] No free throws, side out. (James Paul: 1 personal fouls)

[03:35] Team_049 possession (Score: 20-8)
De'Aaron Allen attempts a 3Pt. Heavily contested by Bones Morant (0.5 feet, ZONE)! De'Aaron Allen misses. Offensive rebound by Shai Mobley! Shai Mobley's putback is no good. Rebound secured by Bones Morant.

[03:21] Team_052 possession (Score: 20-8)
James Paul attempts a 3Pt. Contested by De'Aaron Allen (3.3 feet, MAN). James Paul misses. Offensive rebound by James Paul! James Paul's putback is no good. Offensive rebound by Bones Morant! Bones Morant kicks it out.

[03:09] Team_052 possession (Score: 20-8)
James Paul attempts a 3Pt. Wide open! De'Aaron Allen is 8.1 feet away. [MAN] JAMES PAUL MAKES IT! Assist: Josh Durant
Score: 23-8

[02:52] Team_049 possession (Score: 23-8)
FOUL! Reach-in foul on James Paul during the drive. [Team fouls: 3] No free throws, side out. (James Paul: 2 personal fouls)

[02:38] Team_049 possession (Score: 23-8)
De'Aaron Allen drives, picks up James Paul. Help arrives from Josh Durant! De'Aaron Allen attempts a Dunk. Contested by Josh Durant (4.4 feet, ZONE). DE'AARON ALLEN MAKES IT! Assist: Ja Oladipo
Score: 23-10

[02:24] Team_052 possession (Score: 23-10)
Carmelo Middleton loses control! Ball rolls out of bounds! TURNOVER! (dead ball)

[02:24] Substitution (Team_052): Gary Gasol OUT → Jimmy Doncic IN (stamina_rule2)

[02:24] Substitution (Team_052): Carmelo Middleton OUT → Carmelo Beal IN (stamina_rule2)

[02:24] Substitution (Team_049): Shai Bird OUT → Shaquille Lillard IN (stamina_rule2)

[02:24] Substitution (Team_049): Ja Oladipo OUT → Shai Jordan IN (stamina_rule2)

[02:24] Substitution (Team_049): Jimmy Griffin OUT → Desmond Towns IN (stamina_rule2)

[02:24] Substitution (Team_049): Shai Mobley OUT → Miles Jackson IN (stamina_rule2)

[02:10] Team_049 possession (Score: 23-10)
Miles Jackson drives and kicks out. De'Aaron Allen attempts a 3Pt. Wide open! James Paul is 8.7 feet away. [MAN] De'Aaron Allen misses. Rebound secured by Carmelo Beal.

[01:55] Team_052 possession (Score: 23-10)
Jimmy Doncic attempts a Midrange. Wide open! Desmond Towns is 6.1 feet away. [ZONE] Jimmy Doncic misses. Rebound secured by Shai Jordan.

[01:43] Team_049 possession (Score: 23-10)
FOUL! Holding foul on Josh Durant. [Team fouls: 4] No free throws, side out. (Josh Durant: 2 personal fouls)

[01:27] Team_049 possession (Score: 23-10)
Miles Jackson attempts a Midrange. Heavily contested by Josh Durant (1.3 feet, ZONE)! MILES JACKSON MAKES IT! Assist: Shaquille Lillard
Score: 23-12

[01:13] Team_052 possession (Score: 23-12)
Carmelo Beal drives and kicks out. Josh Durant attempts a 3Pt. Wide open! Shai Jordan is 9.8 feet away. [MAN] Josh Durant misses. Offensive rebound by Carmelo Beal! Carmelo Beal kicks it out.

[00:55] Team_052 possession (Score: 23-12)
James Paul throws a bad pass! Stolen by De'Aaron Allen! TURNOVER! (live ball)

[00:42] Team_049 possession (Score: 23-12)
De'Aaron Allen attempts a 3Pt. Contested by James Paul (2.5 feet, MAN). De'Aaron Allen misses. Rebound secured by James Paul.

[00:30] Team_052 possession (Score: 23-12)
Carmelo Beal attempts a 3Pt. Wide open! Miles Jackson is 7.4 feet away. [MAN] CARMELO BEAL MAKES IT! Assist: Jimmy Doncic
Score: 26-12

[00:13] Team_049 possession (Score: 26-12)
FOUL! Holding foul on Bones Morant. [IN THE BONUS! 5 team fouls] Desmond Towns to the line for 2 free throws. (Bones Morant: 1 personal fouls)   FT 1/2: GOOD   FT 2/2: GOOD Desmond Towns makes 2/2 from the line.
Score: 26-14

[00:02] Team_052 possession (Score: 26-14)
Josh Durant attempts a 3Pt. Heavily contested by Shaquille Lillard (1.7 feet, ZONE)! Josh Durant misses. Rebound secured by Shai Jordan.

================================================================================
                              1ST QUARTER COMPLETE                              
================================================================================

1ST QUARTER SCORE: Team_052 26, Team_049 14

BOX SCORE:
================================================================================

Team_052
--------------------------------------------------------------------------------
Player                MIN  PTS  REB  AST  TO      FG   FG%      3P   3P%
--------------------------------------------------------------------------------
Josh Durant            12    5    0    1   0   2/5    40.0     0/0   0.0
James Paul             12    5    5    1   0   2/3    66.7     0/0   0.0
Gary Gasol             10    3    0    1   0   1/4    25.0     0/0   0.0
Carmelo Beal            2    3    2    0   0   1/1   100.0     0/0   0.0
Carmelo Middleton      10    2    5    2   0   1/2    50.0     0/0   0.0
Bones Morant           12    2    5    1   0   1/3    33.3     0/0   0.0
Jimmy Doncic            2    0    0    1   0   0/1     0.0     0/0   0.0

TEAM: FG: 8/19 (42.1%), 3PT: 4/11 (36.4%), REB: 16 (3 off, 13 def), AST: 7, TO: 4
TEAM FOULS: 5 [Team_049 in BONUS]


Team_049
--------------------------------------------------------------------------------
Player                MIN  PTS  REB  AST  TO      FG   FG%      3P   3P%
--------------------------------------------------------------------------------
Ja Oladipo             10    6    0    2   0   2/4    50.0     0/0   0.0
Shai Mobley            10    2    4    1   0   1/2    50.0     0/0   0.0
De'Aaron Allen         12    2    4    0   0   1/5    20.0     0/0   0.0
Miles Jackson           2    2    0    0   0   1/2    50.0     0/0   0.0
Desmond Towns           2    2    0    0   0   1/1   100.0     0/0   0.0
Shai Bird              10    0    0    0   0   0/4     0.0     0/0   0.0
Jimmy Griffin          10    0    2    1   0   0/2     0.0     0/0   0.0
Shai Jordan             2    0    2    0   0   0/0     0.0     0/0   0.0
Shaquille Lillard       2    0    0    1   0   0/0     0.0     0/0   0.0

TEAM: FG: 6/20 (30.0%), 3PT: 2/7 (28.6%), REB: 13 (2 off, 11 def), AST: 5, TO: 2
TEAM FOULS: 5 [Team_052 in BONUS]

================================================================================

================================================================================
                       2ND QUARTER - Team_052 vs Team_049                       
================================================================================

[12:00] Team_052 possession (Score: 26-14)
Gary Gasol attempts a Layup. Heavily contested by Shai Bird (1.2 feet, MAN)! GARY GASOL MAKES IT! Assist: Carmelo Middleton
Score: 28-14

[11:49] Team_049 possession (Score: 28-14)
Jimmy Griffin attempts a 3Pt. Contested by Bones Morant (4.3 feet, ZONE). Jimmy Griffin misses. Rebound secured by Carmelo Middleton.

[11:39] Team_052 possession (Score: 28-14)
James Paul makes the Dunk and draws the foul on De'Aaron Allen! And-1! James Paul to the line for 1. [Team fouls: 1] (De'Aaron Allen: 1 personal fouls)   FT 1/1: GOOD James Paul makes 1/1 from the line.
Score: 31-14

[11:27] Team_049 possession (Score: 31-14)
Shai Bird attempts a 3Pt. Wide open! Bones Morant is 7.9 feet away. [ZONE] SHAI BIRD MAKES IT! Assist: De'Aaron Allen
Score: 31-17

[11:11] Team_052 possession (Score: 31-17)
Bones Morant attempts a 3Pt. Contested by Jimmy Griffin (3.4 feet, MAN). Bones Morant misses. Rebound secured by Shai Mobley.

[10:59] Team_049 possession (Score: 31-17)
Shai Bird attempts a Midrange. Contested by Gary Gasol (4.7 feet, MAN). Shai Bird misses. Offensive rebound by Shai Mobley! Shai Mobley's putback is no good. Rebound secured by Carmelo Middleton.

[10:47] Team_052 possession (Score: 31-17)
James Paul attempts a 3Pt. Contested by Ja Oladipo (3.3 feet, ZONE). James Paul misses. Rebound secured by Shai Mobley.

[10:33] Team_049 possession (Score: 31-17)
Shai Bird drives and kicks out. Shai Bird attempts a 3Pt. Contested by Bones Morant (2.9 feet, ZONE). Shai Bird misses. Rebound secured by Carmelo Middleton.

[10:16] Team_052 possession (Score: 31-17)
Bones Morant commits a violation (traveling/carry)! TURNOVER! (dead ball)

[10:16] Substitution (Team_052): Josh Durant OUT → Carmelo Giddey IN (stamina_rule2)

[10:16] Substitution (Team_052): Bones Morant OUT → Donovan Stewart IN (stamina_rule2)

[10:16] Substitution (Team_052): James Paul OUT → Jalen Haliburton IN (stamina_rule2)

[10:16] Substitution (Team_049): De'Aaron Allen OUT → Giannis Anunoby IN (stamina_rule2)

[10:00] Team_049 possession (Score: 31-17)
Jimmy Griffin attempts a 3Pt. Contested by Donovan Stewart (5.8 feet, MAN). Jimmy Griffin misses. Offensive rebound by Jimmy Griffin! Jimmy Griffin kicks it out.

[09:44] Team_049 possession (Score: 31-17)
Shai Bird attempts a 3Pt. Wide open! Gary Gasol is 8.1 feet away. [MAN] SHAI BIRD MAKES IT! Assist: Jimmy Griffin
Score: 31-20

[09:30] Team_052 possession (Score: 31-20)
Donovan Stewart attempts a 3Pt. Contested by Jimmy Griffin (5.8 feet, MAN). Donovan Stewart misses. Rebound secured by Shai Mobley.

[09:16] Team_049 possession (Score: 31-20)
Giannis Anunoby throws a bad pass out of bounds! TURNOVER! (dead ball)

[09:16] Substitution (Team_052): Carmelo Middleton OUT → Carmelo Beal IN (stamina_rule2)

[09:16] Substitution (Team_049): Shai Bird OUT → Shaquille Lillard IN (stamina_rule2)

[09:16] Substitution (Team_049): Ja Oladipo OUT → Shai Jordan IN (stamina_rule2)

[09:16] Substitution (Team_049): Jimmy Griffin OUT → Desmond Towns IN (stamina_rule2)

[09:01] Team_052 possession (Score: 31-20)
Gary Gasol attempts a 3Pt. Wide open! Shaquille Lillard is 6.1 feet away. [ZONE] Gary Gasol misses. Offensive rebound by Carmelo Beal! Carmelo Beal kicks it out.

[08:47] Team_052 possession (Score: 31-20)
FOUL! Holding foul on Shai Mobley. [Team fouls: 2] No free throws, side out. (Shai Mobley: 1 personal fouls)

[08:34] Team_052 possession (Score: 31-20)
Jalen Haliburton attempts a Midrange. Wide open! Shai Jordan is 7.0 feet away. [ZONE] JALEN HALIBURTON MAKES IT!
Score: 33-20

[08:21] Team_049 possession (Score: 33-20)
Shaquille Lillard attempts a 3Pt. Contested by Gary Gasol (4.5 feet, ZONE). SHAQUILLE LILLARD MAKES IT! Assist: Shai Mobley
Score: 33-23

[08:11] Team_052 possession (Score: 33-23)
Donovan Stewart attempts a 3Pt. Contested by Shaquille Lillard (2.1 feet, ZONE). Donovan Stewart misses. Rebound secured by Shai Mobley.

[07:53] Team_049 possession (Score: 33-23)
Shai Jordan attempts a Midrange. Contested by Gary Gasol (5.4 feet, ZONE). Shai Jordan misses. FOUL! Loose ball foul on Jalen Haliburton during the rebound battle. [Team fouls: 1] No free throws, side out. (Jalen Haliburton: 1 personal fouls)

[07:37] Team_049 possession (Score: 33-23)
Giannis Anunoby attempts a Layup. BLOCKED BY JALEN HALIBURTON! Ball is loose! Offensive rebound by Shai Mobley! Shai Mobley kicks it out.

[07:19] Team_049 possession (Score: 33-23)
Desmond Towns drives to the basket... Desmond Towns loses the ball! Stripped by Carmelo Beal! TURNOVER! (live ball)

[07:00] Team_052 possession (Score: 33-23)
Carmelo Giddey makes the Dunk and draws the foul on Shai Mobley! And-1! Carmelo Giddey to the line for 1. [Team fouls: 3] (Shai Mobley: 2 personal fouls)   FT 1/1: MISS Carmelo Giddey makes 0/1 from the line. Rebound secured by Giannis Anunoby.
Score: 35-23

[06:44] Team_049 possession (Score: 35-23)
Giannis Anunoby makes the Layup and draws the foul on Carmelo Giddey! And-1! Giannis Anunoby to the line for 1. [Team fouls: 2] (Carmelo Giddey: 1 personal fouls)   FT 1/1: MISS Giannis Anunoby makes 0/1 from the line. Rebound secured by Jalen Haliburton.
Score: 35-25

[06:32] Team_052 possession (Score: 35-25)
Donovan Stewart attempts a Layup. Contested by Shai Mobley (4.1 feet, ZONE). DONOVAN STEWART MAKES IT! Assist: Gary Gasol
Score: 37-25

[06:16] Team_049 possession (Score: 37-25)
Shai Jordan drives to the basket... Shai Jordan throws a bad pass! Stolen by Carmelo Giddey! TURNOVER! (live ball)

[06:03] Team_052 possession (Score: 37-25)
Carmelo Beal drives, Shai Mobley stays with him. Carmelo Beal attempts a Dunk. Contested by Shai Mobley (3.9 feet, ZONE). Carmelo Beal misses. Rebound secured by Shai Mobley.

[05:52] Team_049 possession (Score: 37-25)
Shai Mobley attempts a Midrange. Wide open! Carmelo Beal is 6.1 feet away. [MAN] Shai Mobley misses. Offensive rebound by Giannis Anunoby! Giannis Anunoby kicks it out.

[05:40] Team_049 possession (Score: 37-25)
Shai Jordan drives, picks up Carmelo Beal. Help arrives from Carmelo Giddey! Shai Jordan attempts a Dunk. Heavily contested by Carmelo Giddey (1.6 feet, ZONE)! SHAI JORDAN MAKES IT! Assist: Shai Mobley
Score: 37-27

[05:28] Team_052 possession (Score: 37-27)
Gary Gasol attempts a Midrange. Contested by Shaquille Lillard (5.7 feet, MAN). Gary Gasol misses. Rebound secured by Giannis Anunoby.

[05:17] Team_049 possession (Score: 37-27)
Shaquille Lillard drives and kicks out. Shai Mobley attempts a 3Pt. Contested by Gary Gasol (5.4 feet, ZONE). Shai Mobley misses. Rebound secured by Jalen Haliburton.

[05:03] Team_052 possession (Score: 37-27)
Gary Gasol attempts a 3Pt. Contested by Shaquille Lillard (4.5 feet, MAN). GARY GASOL MAKES IT! Assist: Carmelo Giddey
Score: 40-27

[04:51] Team_049 possession (Score: 40-27)
Shaquille Lillard throws a bad pass out of bounds! TURNOVER! (dead ball)

[04:51] Substitution (Team_052): Gary Gasol OUT → Jimmy Doncic IN (stamina_rule2)

[04:51] Substitution (Team_049): Shai Mobley OUT → Miles Jackson IN (stamina_rule2)

[04:38] Team_052 possession (Score: 40-27)
Donovan Stewart attempts a Midrange. Wide open! Shaquille Lillard is 6.5 feet away. [ZONE] DONOVAN STEWART MAKES IT!
Score: 42-27

[04:24] Team_049 possession (Score: 42-27)
Miles Jackson attempts a Layup. Contested by Carmelo Beal (5.2 feet, MAN). MILES JACKSON MAKES IT! Assist: Shaquille Lillard
Score: 42-29

[04:08] Team_052 possession (Score: 42-29)
Jimmy Doncic makes the Midrange and draws the foul on Giannis Anunoby! And-1! Jimmy Doncic to the line for 1. [Team fouls: 4] (Giannis Anunoby: 1 personal fouls)   FT 1/1: GOOD Jimmy Doncic makes 1/1 from the line.
Score: 45-29

[03:52] Team_049 possession (Score: 45-29)
FOUL! Reach-in foul on Jalen Haliburton during the drive. [Team fouls: 3] No free throws, side out. (Jalen Haliburton: 2 personal fouls)

[03:37] Team_049 possession (Score: 45-29)
FOUL! Shooting foul on Donovan Stewart. Desmond Towns to the line for 2 free throws. [Team fouls: 4] (Donovan Stewart: 1 personal fouls)   FT 1/2: MISS   FT 2/2: GOOD Desmond Towns makes 1/2 from the line.
Score: 45-30

[03:22] Team_052 possession (Score: 45-30)
Carmelo Giddey drives, Shai Jordan stays with him. Carmelo Giddey attempts a Layup. Wide open! Shai Jordan is 8.2 feet away. [MAN] CARMELO GIDDEY MAKES IT! Assist: Jalen Haliburton
Score: 47-30

[03:10] Team_049 possession (Score: 47-30)
Desmond Towns attempts a Midrange. Contested by Donovan Stewart (5.9 feet, MAN). Desmond Towns misses. Rebound secured by Donovan Stewart.

[02:53] Team_052 possession (Score: 47-30)
Donovan Stewart makes the Layup and draws the foul on Desmond Towns! And-1! Donovan Stewart to the line for 1. [BONUS: 5 team fouls] (Desmond Towns: 1 personal fouls)   FT 1/1: GOOD Donovan Stewart makes 1/1 from the line.
Score: 50-30

[02:36] Team_049 possession (Score: 50-30)
Shaquille Lillard makes the Layup and draws the foul on Carmelo Beal! And-1! Shaquille Lillard to the line for 1. [BONUS: 5 team fouls] (Carmelo Beal: 1 personal fouls)   FT 1/1: GOOD Shaquille Lillard makes 1/1 from the line.
Score: 50-33

[02:25] Team_052 possession (Score: 50-33)
Jalen Haliburton drives, picks up Miles Jackson. Help arrives from Shai Jordan! Jalen Haliburton attempts a Dunk. Contested by Shai Jordan (3.8 feet, MAN). JALEN HALIBURTON MAKES IT! Assist: Donovan Stewart
Score: 52-33

[02:12] Team_049 possession (Score: 52-33)
Giannis Anunoby attempts a Layup. Contested by Jalen Haliburton (2.4 feet, MAN). GIANNIS ANUNOBY MAKES IT! Assist: Desmond Towns
Score: 52-35

[01:56] Team_052 possession (Score: 52-35)
Jalen Haliburton attempts a Midrange. Wide open! Desmond Towns is 8.5 feet away. [ZONE] JALEN HALIBURTON MAKES IT! Assist: Donovan Stewart
Score: 54-35

[01:45] Team_049 possession (Score: 54-35)
Shai Jordan attempts a Midrange. Contested by Carmelo Giddey (5.3 feet, MAN). Shai Jordan misses. Rebound secured by Carmelo Beal.

[01:32] Team_052 possession (Score: 54-35)
Jalen Haliburton attempts a Layup. Heavily contested by Miles Jackson (0.5 feet, MAN)! Jalen Haliburton misses. Rebound secured by Miles Jackson.

[01:21] Team_049 possession (Score: 54-35)
Shaquille Lillard attempts a 3Pt. Contested by Jalen Haliburton (6.0 feet, ZONE). Shaquille Lillard misses. Rebound secured by Carmelo Beal.

[01:04] Team_052 possession (Score: 54-35)
Donovan Stewart attempts a 3Pt. Contested by Shaquille Lillard (4.1 feet, ZONE). DONOVAN STEWART MAKES IT! Assist: Jimmy Doncic
Score: 57-35

[00:53] Team_049 possession (Score: 57-35)
Shai Jordan attempts a 3Pt. Contested by Jalen Haliburton (2.4 feet, ZONE). SHAI JORDAN MAKES IT! Assist: Giannis Anunoby
Score: 57-38

[00:34] Team_052 possession (Score: 57-38)
Jimmy Doncic drives and kicks out. Jimmy Doncic attempts a 3Pt. Contested by Shaquille Lillard (3.1 feet, ZONE). Jimmy Doncic misses. Rebound secured by Giannis Anunoby.

[00:25] Team_049 possession (Score: 57-38)
Miles Jackson attempts a Layup. Contested by Carmelo Beal (3.8 feet, MAN). MILES JACKSON MAKES IT! Assist: Giannis Anunoby
Score: 57-40

[00:10] Team_052 possession (Score: 57-40)
Jalen Haliburton attempts a Midrange. Wide open! Desmond Towns is 6.0 feet away. [ZONE] Jalen Haliburton misses. Rebound secured by Shai Jordan.

================================================================================
                              2ND QUARTER COMPLETE                              
================================================================================

2ND QUARTER SCORE: Team_052 31, Team_049 26

BOX SCORE:
================================================================================

Team_052
--------------------------------------------------------------------------------
Player                MIN  PTS  REB  AST  TO      FG   FG%      3P   3P%
--------------------------------------------------------------------------------
Donovan Stewart        10   10    1    2   0   4/6    66.7     0/0   0.0
Jalen Haliburton       10    6    2    1   0   3/5    60.0     0/0   0.0
Gary Gasol             17    5    0    1   0   2/3    66.7     0/0   0.0
James Paul             14    3    0    0   0   1/2    50.0     0/0   0.0
Jimmy Doncic            7    3    0    1   0   1/2    50.0     0/0   0.0
Carmelo Giddey         10    2    0    1   0   1/2    50.0     0/0   0.0
Carmelo Middleton      13    0    3    1   0   0/0     0.0     0/0   0.0
Bones Morant           14    0    0    0   0   0/1     0.0     0/0   0.0
Carmelo Beal           11    0    3    0   0   0/1     0.0     0/0   0.0

TEAM: FG: 12/22 (54.5%), 3PT: 2/6 (33.3%), REB: 8 (1 off, 7 def), AST: 7, TO: 1
TEAM FOULS: 5 [Team_049 in BONUS]


Team_049
--------------------------------------------------------------------------------
Player                MIN  PTS  REB  AST  TO      FG   FG%      3P   3P%
--------------------------------------------------------------------------------
Shai Bird              13    6    0    0   0   2/4    50.0     0/0   0.0
Shaquille Lillard      11    6    0    1   0   2/4    50.0     0/0   0.0
Shai Jordan            11    5    1    0   0   2/3    66.7     0/0   0.0
Miles Jackson           7    4    1    0   0   2/2   100.0     0/0   0.0
Giannis Anunoby        10    2    4    2   0   1/2    50.0     0/0   0.0
Desmond Towns          11    1    0    1   0   1/2    50.0     0/0   0.0
Jimmy Griffin          13    0    1    1   0   0/1     0.0     0/0   0.0
De'Aaron Allen         14    0    0    1   0   0/0     0.0     0/0   0.0
Shai Mobley            17    0    7    2   0   0/0     0.0     0/0   0.0

TEAM: FG: 10/18 (55.6%), 3PT: 4/6 (66.7%), REB: 15 (5 off, 10 def), AST: 8, TO: 4
TEAM FOULS: 5 [Team_052 in BONUS]

================================================================================

================================================================================
                       3RD QUARTER - Team_052 vs Team_049                       
================================================================================

[12:00] Team_052 possession (Score: 57-40)
Josh Durant attempts a 3Pt. Heavily contested by De'Aaron Allen (1.8 feet, ZONE)! JOSH DURANT MAKES IT! Assist: Gary Gasol
Score: 60-40

[11:49] Team_049 possession (Score: 60-40)
Jimmy Griffin attempts a Midrange. Contested by Bones Morant (3.1 feet, MAN). JIMMY GRIFFIN MAKES IT!
Score: 60-42

[11:36] Team_052 possession (Score: 60-42)
FOUL! Holding foul on Ja Oladipo. [Team fouls: 1] No free throws, side out. (Ja Oladipo: 1 personal fouls)

[11:21] Team_052 possession (Score: 60-42)
Carmelo Middleton attempts a Midrange. Contested by De'Aaron Allen (5.8 feet, ZONE). CARMELO MIDDLETON MAKES IT! Assist: Josh Durant
Score: 62-42

[11:10] Team_049 possession (Score: 62-42)
Shai Mobley drives to the basket... Shai Mobley throws a bad pass! Stolen by James Paul! TURNOVER! (live ball)

[10:58] Team_052 possession (Score: 62-42)
Bones Morant drives, Shai Mobley stays with him. Bones Morant attempts a Layup. Contested by Shai Mobley (2.1 feet, ZONE). BONES MORANT MAKES IT! Assist: James Paul
Score: 64-42

[10:42] Team_049 possession (Score: 64-42)
Shai Bird attempts a 3Pt. Wide open! Gary Gasol is 6.0 feet away. [MAN] Shai Bird misses. Rebound secured by Carmelo Middleton.

[10:28] Team_052 possession (Score: 64-42)
James Paul throws a bad pass! Stolen by De'Aaron Allen! TURNOVER! (live ball)

[10:17] Team_049 possession (Score: 64-42)
Shai Bird attempts a Midrange. Contested by Josh Durant (2.4 feet, ZONE). Shai Bird misses. Offensive rebound by Shai Mobley! Shai Mobley puts it back in!
Score: 64-44

[10:01] Team_052 possession (Score: 64-44)
Bones Morant makes the 3Pt and draws the foul on Ja Oladipo! And-1! Bones Morant to the line for 1. [Team fouls: 2] (Ja Oladipo: 2 personal fouls)   FT 1/1: GOOD Bones Morant makes 1/1 from the line.
Score: 68-44

[09:47] Team_049 possession (Score: 68-44)
De'Aaron Allen loses the ball! Stripped by James Paul! TURNOVER! (live ball)

[09:30] Team_052 possession (Score: 68-44)
Bones Morant attempts a 3Pt. Contested by Jimmy Griffin (6.0 feet, MAN). Bones Morant misses. Rebound secured by Jimmy Griffin.

[09:14] Team_049 possession (Score: 68-44)
Ja Oladipo makes the 3Pt and draws the foul on Josh Durant! And-1! Ja Oladipo to the line for 1. [Team fouls: 1] (Josh Durant: 1 personal fouls)   FT 1/1: GOOD Ja Oladipo makes 1/1 from the line.
Score: 68-48

[09:03] Team_052 possession (Score: 68-48)
Josh Durant drives, picks up De'Aaron Allen. Help arrives from Ja Oladipo! Josh Durant attempts a Dunk. Contested by Ja Oladipo (3.7 feet, ZONE). JOSH DURANT MAKES IT! Assist: James Paul
Score: 70-48

[08:52] Team_049 possession (Score: 70-48)
Shai Mobley drives to the basket... Shai Mobley throws a bad pass! Stolen by Carmelo Middleton! TURNOVER! (live ball)

[08:38] Team_052 possession (Score: 70-48)
Gary Gasol drives and kicks out. James Paul attempts a Midrange. Contested by Ja Oladipo (3.8 feet, ZONE). JAMES PAUL MAKES IT! Assist: Gary Gasol
Score: 72-48

[08:27] Team_049 possession (Score: 72-48)
Jimmy Griffin attempts a Midrange. Contested by Bones Morant (3.7 feet, MAN). JIMMY GRIFFIN MAKES IT! Assist: De'Aaron Allen
Score: 72-50

[08:15] Team_052 possession (Score: 72-50)
FOUL! Holding foul on Ja Oladipo. [Team fouls: 3] No free throws, side out. (Ja Oladipo: 3 personal fouls)

[08:01] Team_052 possession (Score: 72-50)
Bones Morant attempts a 3Pt. Contested by Ja Oladipo (5.0 feet, ZONE). Bones Morant misses. FOUL! Loose ball foul on De'Aaron Allen during the rebound battle. [Team fouls: 4] No free throws, side out. (De'Aaron Allen: 1 personal fouls)

[07:48] Team_052 possession (Score: 72-50)
Josh Durant drives to the basket... Josh Durant throws a bad pass out of bounds! TURNOVER! (dead ball)

[07:34] Team_049 possession (Score: 72-50)
Ja Oladipo attempts a Midrange. Heavily contested by Josh Durant (1.9 feet, MAN)! JA OLADIPO MAKES IT! Assist: De'Aaron Allen
Score: 72-52

[07:19] Team_052 possession (Score: 72-52)
Josh Durant attempts a Midrange. Contested by Ja Oladipo (5.6 feet, MAN). Josh Durant misses. Rebound secured by Jimmy Griffin.

[07:08] Team_049 possession (Score: 72-52)
Jimmy Griffin attempts a 3Pt. Wide open! Bones Morant is 6.8 feet away. [MAN] Jimmy Griffin misses. Rebound secured by Bones Morant.

[06:59] Team_052 possession (Score: 72-52)
James Paul attempts a 3Pt. Wide open! De'Aaron Allen is 6.9 feet away. [MAN] James Paul misses. Rebound secured by Jimmy Griffin.

[06:39] Team_049 possession (Score: 72-52)
Shai Bird attempts a Layup. Contested by Gary Gasol (2.1 feet, MAN). Shai Bird misses. Rebound secured by James Paul.

[06:21] Team_052 possession (Score: 72-52)
Josh Durant attempts a 3Pt. Wide open! Ja Oladipo is 6.2 feet away. [MAN] Josh Durant misses. Rebound secured by Shai Mobley.

[06:01] Team_049 possession (Score: 72-52)
De'Aaron Allen loses the ball! Stripped by James Paul! TURNOVER! (live ball)

[05:50] Team_052 possession (Score: 72-52)
Bones Morant attempts a Layup. Heavily contested by Jimmy Griffin (1.5 feet, MAN)! Bones Morant misses. Rebound secured by De'Aaron Allen.

[05:32] Team_049 possession (Score: 72-52)
Shai Mobley attempts a Midrange. Heavily contested by Carmelo Middleton (1.9 feet, MAN)! Shai Mobley misses. Offensive rebound by De'Aaron Allen! De'Aaron Allen kicks it out.

[05:18] Team_049 possession (Score: 72-52)
Shai Mobley drives, Carmelo Middleton stays with him. Shai Mobley attempts a Layup. Contested by Carmelo Middleton (2.9 feet, MAN). SHAI MOBLEY MAKES IT!
Score: 72-54

[05:05] Team_052 possession (Score: 72-54)
Josh Durant attempts a 3Pt. Wide open! Ja Oladipo is 7.4 feet away. [MAN] Josh Durant misses. Rebound secured by Jimmy Griffin.

[04:49] Team_049 possession (Score: 72-54)
Ja Oladipo makes the Layup and draws the foul on James Paul! And-1! Ja Oladipo to the line for 1. [Team fouls: 2] (James Paul: 1 personal fouls)   FT 1/1: MISS Ja Oladipo makes 0/1 from the line. Offensive rebound by Shai Mobley! Shai Mobley puts it back in!
Score: 72-58

[04:32] Team_052 possession (Score: 72-58)
Carmelo Middleton attempts a Layup. Contested by Shai Mobley (2.2 feet, MAN). CARMELO MIDDLETON MAKES IT! Assist: Josh Durant
Score: 74-58

[04:18] Team_049 possession (Score: 74-58)
Jimmy Griffin makes the Layup and draws the foul on Bones Morant! And-1! Jimmy Griffin to the line for 1. [Team fouls: 3] (Bones Morant: 1 personal fouls)   FT 1/1: GOOD Jimmy Griffin makes 1/1 from the line.
Score: 74-61

[04:02] Team_052 possession (Score: 74-61)
James Paul attempts a Midrange. Contested by De'Aaron Allen (5.0 feet, MAN). James Paul misses. Offensive rebound by Bones Morant! Bones Morant kicks it out.

[03:46] Team_052 possession (Score: 74-61)
Gary Gasol attempts a Midrange. Contested by Shai Bird (2.2 feet, MAN). Gary Gasol misses. Rebound secured by Shai Mobley.

[03:35] Team_049 possession (Score: 74-61)
Shai Bird attempts a Midrange. Wide open! Bones Morant is 7.0 feet away. [ZONE] Shai Bird misses. Offensive rebound by De'Aaron Allen! De'Aaron Allen kicks it out.

[03:17] Team_049 possession (Score: 74-61)
Shai Mobley drives, picks up Carmelo Middleton. Help arrives from Josh Durant! Shai Mobley attempts a Dunk. Contested by Josh Durant (2.9 feet, MAN). Shai Mobley misses. Rebound secured by James Paul.

[03:04] Team_052 possession (Score: 74-61)
FOUL! Shooting foul on De'Aaron Allen. James Paul to the line for 2 free throws. [BONUS: 5 team fouls] (De'Aaron Allen: 2 personal fouls)   FT 1/2: GOOD   FT 2/2: MISS James Paul makes 1/2 from the line. Rebound secured by Jimmy Griffin.
Score: 75-61

[02:50] Team_049 possession (Score: 75-61)
Ja Oladipo drives, Josh Durant stays with him. Ja Oladipo attempts a Layup. Contested by Josh Durant (3.4 feet, MAN). JA OLADIPO MAKES IT!
Score: 75-63

[02:33] Team_052 possession (Score: 75-63)
James Paul drives to the basket... James Paul throws a bad pass! Stolen by Shai Mobley! TURNOVER! (live ball)

[02:15] Team_049 possession (Score: 75-63)
Jimmy Griffin throws a bad pass! Stolen by Bones Morant! TURNOVER! (live ball)

[01:56] Team_052 possession (Score: 75-63)
Josh Durant drives, Ja Oladipo stays with him. Josh Durant attempts a Layup. Contested by Ja Oladipo (2.8 feet, MAN). JOSH DURANT MAKES IT!
Score: 77-63

[01:45] Team_049 possession (Score: 77-63)
De'Aaron Allen drives, picks up James Paul. Help arrives from Josh Durant! De'Aaron Allen attempts a Dunk. Heavily contested by Josh Durant (1.8 feet, ZONE)! De'Aaron Allen misses. FOUL! Loose ball foul on Bones Morant during the rebound battle. [Team fouls: 4] No free throws, side out. (Bones Morant: 2 personal fouls)

[01:27] Team_049 possession (Score: 77-63)
Jimmy Griffin attempts a 3Pt. Contested by Bones Morant (2.4 feet, ZONE). JIMMY GRIFFIN MAKES IT! Assist: Ja Oladipo
Score: 77-66

[01:09] Team_052 possession (Score: 77-66)
FOUL! Shooting foul on Shai Mobley. Gary Gasol to the line for 2 free throws. [BONUS: 6 team fouls] (Shai Mobley: 1 personal fouls)   FT 1/2: GOOD   FT 2/2: GOOD Gary Gasol makes 2/2 from the line.
Score: 79-66

[00:57] Team_049 possession (Score: 79-66)
Shai Bird loses control! Ball rolls out of bounds! TURNOVER! (dead ball)

[00:57] Substitution (Team_052): Gary Gasol OUT → Jimmy Doncic IN (stamina_rule2)

[00:57] Substitution (Team_052): Josh Durant OUT → Carmelo Giddey IN (stamina_rule2)

[00:57] Substitution (Team_052): Bones Morant OUT → Donovan Stewart IN (stamina_rule2)

[00:57] Substitution (Team_052): James Paul OUT → Jalen Haliburton IN (stamina_rule2)

[00:57] Substitution (Team_052): Carmelo Middleton OUT → Carmelo Beal IN (stamina_rule2)

[00:57] Substitution (Team_049): Shai Bird OUT → Shaquille Lillard IN (stamina_rule2)

[00:57] Substitution (Team_049): Ja Oladipo OUT → Shai Jordan IN (stamina_rule2)

[00:57] Substitution (Team_049): Jimmy Griffin OUT → Desmond Towns IN (stamina_rule2)

[00:57] Substitution (Team_049): De'Aaron Allen OUT → Giannis Anunoby IN (stamina_rule2)

[00:57] Substitution (Team_049): Shai Mobley OUT → Miles Jackson IN (stamina_rule2)

[00:44] Team_052 possession (Score: 79-66)
Jimmy Doncic attempts a 3Pt. Contested by Shaquille Lillard (4.6 feet, MAN). Jimmy Doncic misses. Rebound secured by Giannis Anunoby.

[00:31] Team_049 possession (Score: 79-66)
Miles Jackson attempts a Layup. Contested by Carmelo Beal (3.9 feet, ZONE). MILES JACKSON MAKES IT! Assist: Giannis Anunoby
Score: 79-68

[00:16] Team_052 possession (Score: 79-68)
Jimmy Doncic makes the Dunk and draws the foul on Shai Jordan! And-1! Jimmy Doncic to the line for 1. [BONUS: 7 team fouls] (Shai Jordan: 1 personal fouls)   FT 1/1: MISS Jimmy Doncic makes 0/1 from the line. Rebound secured by Giannis Anunoby.
Score: 81-68

================================================================================
                              3RD QUARTER COMPLETE                              
================================================================================

3RD QUARTER SCORE: Team_052 24, Team_049 28

BOX SCORE:
================================================================================

Team_052
--------------------------------------------------------------------------------
Player                MIN  PTS  REB  AST  TO      FG   FG%      3P   3P%
--------------------------------------------------------------------------------
Josh Durant            25    7    0    2   0   3/6    50.0     0/0   0.0
Bones Morant           25    6    2    0   0   2/4    50.0     0/0   0.0
Carmelo Middleton      24    4    1    0   0   2/2   100.0     0/0   0.0
Gary Gasol             28    2    0    2   0   1/2    50.0     0/0   0.0
James Paul             25    2    3    2   0   1/3    33.3     0/0   0.0
Jimmy Doncic            8    0    0    0   0   0/2     0.0     0/0   0.0

TEAM: FG: 9/19 (47.4%), 3PT: 2/7 (28.6%), REB: 6 (2 off, 4 def), AST: 6, TO: 3
TEAM FOULS: 4


Team_049
--------------------------------------------------------------------------------
Player                MIN  PTS  REB  AST  TO      FG   FG%      3P   3P%
--------------------------------------------------------------------------------
Jimmy Griffin          24   10    5    0   0   4/5    80.0     0/0   0.0
Shai Mobley            28    8    3    0   0   3/4    75.0     0/0   0.0
Ja Oladipo             24    8    0    1   0   3/3   100.0     0/0   0.0
Miles Jackson           8    2    0    0   0   1/1   100.0     0/0   0.0
Shai Bird              24    0    0    0   0   0/2     0.0     0/0   0.0
De'Aaron Allen         25    0    4    2   0   0/0     0.0     0/0   0.0
Giannis Anunoby        11    0    2    1   0   0/0     0.0     0/0   0.0

TEAM: FG: 11/15 (73.3%), 3PT: 2/4 (50.0%), REB: 14 (4 off, 10 def), AST: 4, TO: 6
TEAM FOULS: 7 [Team_052 in BONUS]

================================================================================

================================================================================
                       4TH QUARTER - Team_052 vs Team_049                       
================================================================================

[12:00] Team_052 possession (Score: 81-68)
Carmelo Middleton drives, De'Aaron Allen stays with him. Carmelo Middleton attempts a Dunk. Contested by De'Aaron Allen (5.2 feet, ZONE). CARMELO MIDDLETON MAKES IT! Assist: Bones Morant
Score: 83-68

[11:46] Team_049 possession (Score: 83-68)
Shai Bird makes the Midrange and draws the foul on James Paul! And-1! Shai Bird to the line for 1. [Team fouls: 1] (James Paul: 1 personal fouls)   FT 1/1: GOOD Shai Bird makes 1/1 from the line.
Score: 83-71

[11:33] Team_052 possession (Score: 83-71)
Bones Morant drives and kicks out. Bones Morant attempts a 3Pt. Wide open! Jimmy Griffin is 7.5 feet away. [MAN] BONES MORANT MAKES IT! Assist: Gary Gasol
Score: 86-71

[11:16] Team_049 possession (Score: 86-71)
Jimmy Griffin throws a bad pass out of bounds! TURNOVER! (dead ball)

[11:16] Substitution (Team_052): Carmelo Middleton OUT → Carmelo Beal IN (stamina_rule2)

[11:16] Substitution (Team_049): Shai Bird OUT → Shaquille Lillard IN (stamina_rule2)

[11:16] Substitution (Team_049): Ja Oladipo OUT → Shai Jordan IN (stamina_rule2)

[11:16] Substitution (Team_049): Jimmy Griffin OUT → Desmond Towns IN (stamina_rule2)

[11:07] Team_052 possession (Score: 86-71)
FOUL! Shooting foul on Shaquille Lillard. Gary Gasol to the line for 3 free throws. [Team fouls: 1] (Shaquille Lillard: 1 personal fouls)   FT 1/3: GOOD   FT 2/3: GOOD   FT 3/3: MISS Gary Gasol makes 2/3 from the line. Rebound secured by Shai Jordan.
Score: 88-71

[10:55] Team_049 possession (Score: 88-71)
Shai Mobley throws a bad pass out of bounds! TURNOVER! (dead ball)

[10:55] Substitution (Team_052): Gary Gasol OUT → Jimmy Doncic IN (stamina_rule2)

[10:55] Substitution (Team_052): Josh Durant OUT → Carmelo Giddey IN (stamina_rule2)

[10:55] Substitution (Team_052): Bones Morant OUT → Donovan Stewart IN (stamina_rule2)

[10:55] Substitution (Team_052): James Paul OUT → Jalen Haliburton IN (stamina_rule2)

[10:55] Substitution (Team_049): De'Aaron Allen OUT → Giannis Anunoby IN (stamina_rule2)

[10:55] Substitution (Team_049): Shai Mobley OUT → Miles Jackson IN (stamina_rule2)

[10:40] Team_052 possession (Score: 88-71)
FOUL! Holding foul on Giannis Anunoby. [Team fouls: 2] No free throws, side out. (Giannis Anunoby: 1 personal fouls)

[10:22] Team_052 possession (Score: 88-71)
Carmelo Beal drives, picks up Miles Jackson. Help arrives from Shai Jordan! Carmelo Beal attempts a Dunk. Contested by Shai Jordan (2.7 feet, ZONE). Carmelo Beal misses. Offensive rebound by Jalen Haliburton! Jalen Haliburton kicks it out.

[10:05] Team_052 possession (Score: 88-71)
Jalen Haliburton attempts a 3Pt. Wide open! Shaquille Lillard is 6.9 feet away. [ZONE] Jalen Haliburton misses. Offensive rebound by Carmelo Beal! Carmelo Beal kicks it out.

[09:45] Team_052 possession (Score: 88-71)
Carmelo Beal drives, Miles Jackson stays with him. Carmelo Beal attempts a Dunk. Heavily contested by Miles Jackson (1.5 feet, ZONE)! CARMELO BEAL MAKES IT! Assist: Carmelo Giddey
Score: 90-71

[09:31] Team_049 possession (Score: 90-71)
Giannis Anunoby attempts a Midrange. Contested by Jalen Haliburton (3.1 feet, MAN). Giannis Anunoby misses. Rebound secured by Jalen Haliburton.

[09:13] Team_052 possession (Score: 90-71)
Donovan Stewart attempts a Midrange. Contested by Desmond Towns (4.9 feet, MAN). Donovan Stewart misses. Offensive rebound by Carmelo Beal! Carmelo Beal kicks it out.

[09:03] Team_052 possession (Score: 90-71)
Donovan Stewart attempts a Midrange. Contested by Desmond Towns (5.9 feet, MAN). Donovan Stewart misses. Rebound secured by Giannis Anunoby.

[08:50] Team_049 possession (Score: 90-71)
Desmond Towns attempts a 3Pt. Contested by Donovan Stewart (2.5 feet, MAN). DESMOND TOWNS MAKES IT! Assist: Giannis Anunoby
Score: 90-74

[08:34] Team_052 possession (Score: 90-74)
Jalen Haliburton attempts a 3Pt. Contested by Shaquille Lillard (4.2 feet, ZONE). Jalen Haliburton misses. Rebound secured by Shai Jordan.

[08:20] Team_049 possession (Score: 90-74)
Desmond Towns loses control! Ball rolls out of bounds! TURNOVER! (dead ball)

[08:06] Team_052 possession (Score: 90-74)
Jimmy Doncic makes the Midrange and draws the foul on Desmond Towns! And-1! Jimmy Doncic to the line for 1. [Team fouls: 3] (Desmond Towns: 1 personal fouls)   FT 1/1: GOOD Jimmy Doncic makes 1/1 from the line.
Score: 93-74

[07:48] Team_049 possession (Score: 93-74)
FOUL! Offensive foul on Shai Jordan! Carmelo Giddey drew the charge! [Team fouls: 4] (Shai Jordan: 1 personal fouls) TURNOVER! (dead ball)

[07:36] Team_052 possession (Score: 93-74)
Carmelo Giddey drives, Miles Jackson stays with him. Carmelo Giddey attempts a Layup. Contested by Miles Jackson (2.2 feet, ZONE). Carmelo Giddey misses. Rebound secured by Shai Jordan.

[07:21] Team_049 possession (Score: 93-74)
FOUL! Holding foul on Jimmy Doncic. [Team fouls: 2] No free throws, side out. (Jimmy Doncic: 1 personal fouls)

[07:06] Team_049 possession (Score: 93-74)
Miles Jackson drives to the basket... Miles Jackson throws a bad pass! Stolen by Carmelo Beal! TURNOVER! (live ball)

[06:52] Team_052 possession (Score: 93-74)
FOUL! Offensive foul on Jimmy Doncic! Shaquille Lillard drew the charge! [Team fouls: 3] (Jimmy Doncic: 2 personal fouls) TURNOVER! (dead ball)

[06:34] Team_049 possession (Score: 93-74)
Giannis Anunoby attempts a 3Pt. Contested by Jalen Haliburton (4.5 feet, ZONE). Giannis Anunoby misses. Rebound secured by Carmelo Beal.

[06:22] Team_052 possession (Score: 93-74)
Carmelo Giddey makes the Layup and draws the foul on Miles Jackson! And-1! Carmelo Giddey to the line for 1. [BONUS: 5 team fouls] (Miles Jackson: 1 personal fouls)   FT 1/1: GOOD Carmelo Giddey makes 1/1 from the line.
Score: 96-74

[06:08] Team_049 possession (Score: 96-74)
Shaquille Lillard drives to the basket... Shaquille Lillard loses the ball! Stripped by Carmelo Beal! TURNOVER! (live ball)

[05:57] Team_052 possession (Score: 96-74)
Carmelo Beal drives, picks up Miles Jackson. Help arrives from Shai Jordan! Carmelo Beal attempts a Dunk. Contested by Shai Jordan (5.7 feet, MAN). Carmelo Beal misses. Offensive rebound by Jalen Haliburton! Jalen Haliburton kicks it out.

[05:40] Team_052 possession (Score: 96-74)
FOUL! Shooting foul on Miles Jackson. Jimmy Doncic to the line for 2 free throws. [BONUS: 6 team fouls] (Miles Jackson: 2 personal fouls)   FT 1/2: GOOD   FT 2/2: MISS Jimmy Doncic makes 1/2 from the line. Rebound secured by Giannis Anunoby.
Score: 97-74

[05:28] Team_049 possession (Score: 97-74)
Miles Jackson drives and kicks out. Shai Jordan attempts a Midrange. Contested by Carmelo Giddey (2.3 feet, MAN). SHAI JORDAN MAKES IT! Assist: Miles Jackson
Score: 97-76

[05:14] Team_052 possession (Score: 97-76)
Carmelo Beal drives to the basket... Carmelo Beal commits a violation (traveling/carry)! TURNOVER! (dead ball)

[04:58] Team_049 possession (Score: 97-76)
Shaquille Lillard loses the ball! Stripped by Jimmy Doncic! TURNOVER! (live ball)

[04:45] Team_052 possession (Score: 97-76)
Carmelo Beal attempts a Layup. BLOCKED BY MILES JACKSON! Ball is loose! Rebound secured by Giannis Anunoby.

[04:31] Team_049 possession (Score: 97-76)
Miles Jackson attempts a Midrange. Heavily contested by Carmelo Beal (1.8 feet, MAN)! MILES JACKSON MAKES IT!
Score: 97-78

[04:18] Team_052 possession (Score: 97-78)
Carmelo Giddey attempts a Midrange. Contested by Shai Jordan (5.6 feet, ZONE). CARMELO GIDDEY MAKES IT!
Score: 99-78

[04:05] Team_049 possession (Score: 99-78)
Shai Jordan attempts a 3Pt. Contested by Carmelo Giddey (4.8 feet, MAN). SHAI JORDAN MAKES IT!
Score: 99-81

[03:50] Team_052 possession (Score: 99-81)
Jalen Haliburton attempts a Midrange. Wide open! Shai Jordan is 7.4 feet away. [ZONE] JALEN HALIBURTON MAKES IT!
Score: 101-81

[03:36] Team_049 possession (Score: 101-81)
Shai Jordan attempts a 3Pt. Contested by Carmelo Giddey (4.1 feet, MAN). Shai Jordan misses. Rebound secured by Donovan Stewart.

[03:18] Team_052 possession (Score: 101-81)
Jimmy Doncic attempts a 3Pt. Contested by Shaquille Lillard (3.1 feet, MAN). JIMMY DONCIC MAKES IT! Assist: Jalen Haliburton
Score: 104-81

[03:05] Team_049 possession (Score: 104-81)
Desmond Towns attempts a Midrange. Contested by Donovan Stewart (3.1 feet, MAN). Desmond Towns misses. Rebound secured by Carmelo Beal.

[02:51] Team_052 possession (Score: 104-81)
Carmelo Giddey attempts a Midrange. Wide open! Desmond Towns is 8.5 feet away. [ZONE] CARMELO GIDDEY MAKES IT! Assist: Carmelo Beal
Score: 106-81

[02:34] Team_049 possession (Score: 106-81)
Shaquille Lillard attempts a 3Pt. Contested by Jimmy Doncic (3.1 feet, MAN). Shaquille Lillard misses. Rebound secured by Jalen Haliburton.

[02:20] Team_052 possession (Score: 106-81)
Jimmy Doncic attempts a 3Pt. BLOCKED BY SHAQUILLE LILLARD! Ball is loose! Rebound secured by Miles Jackson.

[02:04] Team_049 possession (Score: 106-81)
Shai Jordan makes the Dunk and draws the foul on Donovan Stewart! And-1! Shai Jordan to the line for 1. [Team fouls: 4] (Donovan Stewart: 1 personal fouls)   FT 1/1: GOOD Shai Jordan makes 1/1 from the line.
Score: 106-84

[01:50] Team_052 possession (Score: 106-84)
Jimmy Doncic attempts a 3Pt. Contested by Shaquille Lillard (5.9 feet, ZONE). Jimmy Doncic misses. Offensive rebound by Donovan Stewart! Donovan Stewart kicks it out.

[01:35] Team_052 possession (Score: 106-84)
Donovan Stewart attempts a 3Pt. Contested by Desmond Towns (5.3 feet, MAN). Donovan Stewart misses. Offensive rebound by Donovan Stewart! Donovan Stewart kicks it out.

[01:20] Team_052 possession (Score: 106-84)
Carmelo Giddey drives, picks up Shai Jordan. Help arrives from Desmond Towns! Carmelo Giddey attempts a Dunk. Contested by Desmond Towns (5.1 feet, MAN). CARMELO GIDDEY MAKES IT! Assist: Carmelo Beal
Score: 108-84

[01:08] Team_049 possession (Score: 108-84)
Giannis Anunoby drives to the basket... Giannis Anunoby throws a bad pass! Stolen by Jalen Haliburton! TURNOVER! (live ball)

[00:53] Team_052 possession (Score: 108-84)
Jalen Haliburton attempts a 3Pt. Contested by Giannis Anunoby (4.2 feet, MAN). Jalen Haliburton misses. FOUL! Loose ball foul on Shai Jordan during the rebound battle. [IN THE BONUS! 7 team fouls] Carmelo Beal to the line for 2 free throws. (Shai Jordan: 2 personal fouls)   FT 1/2: GOOD   FT 2/2: GOOD Carmelo Beal makes 2/2 from the line.
Score: 110-84

[00:38] Team_049 possession (Score: 110-84)
Miles Jackson attempts a Layup. Heavily contested by Carmelo Beal (0.5 feet, ZONE)! Miles Jackson misses. Offensive rebound by Miles Jackson! Miles Jackson's putback is no good. Rebound secured by Jalen Haliburton.

[00:21] Team_052 possession (Score: 110-84)
Carmelo Beal attempts a Midrange. Wide open! Giannis Anunoby is 6.4 feet away. [ZONE] Carmelo Beal misses. Rebound secured by Giannis Anunoby.

[00:09] Team_049 possession (Score: 110-84)
FOUL! Shooting foul on Jimmy Doncic. Shaquille Lillard to the line for 2 free throws. [BONUS: 5 team fouls] (Jimmy Doncic: 3 personal fouls)   FT 1/2: GOOD   FT 2/2: GOOD Shaquille Lillard makes 2/2 from the line.
Score: 110-86

================================================================================
                              4TH QUARTER COMPLETE                              
================================================================================

4TH QUARTER SCORE: Team_052 29, Team_049 18

BOX SCORE:
================================================================================

Team_052
--------------------------------------------------------------------------------
Player                MIN  PTS  REB  AST  TO      FG   FG%      3P   3P%
--------------------------------------------------------------------------------
Carmelo Giddey         22    9    0    1   0   4/5    80.0     0/0   0.0
Jimmy Doncic           19    6    0    0   0   2/4    50.0     0/0   0.0
Carmelo Beal           23    4    4    2   0   2/4    50.0     0/0   0.0
Bones Morant           27    3    0    1   0   1/1   100.0     0/0   0.0
Carmelo Middleton      25    2    0    0   0   1/1   100.0     0/0   0.0
Gary Gasol             30    0    0    1   0   0/1     0.0     0/0   0.0
Donovan Stewart        22    0    3    0   0   0/1     0.0     0/0   0.0

TEAM: FG: 11/19 (57.9%), 3PT: 2/5 (40.0%), REB: 11 (6 off, 5 def), AST: 6, TO: 2
TEAM FOULS: 5 [Team_049 in BONUS]


Team_049
--------------------------------------------------------------------------------
Player                MIN  PTS  REB  AST  TO      FG   FG%      3P   3P%
--------------------------------------------------------------------------------
Shai Jordan            23    8    3    0   0   3/4    75.0     0/0   0.0
Shai Bird              25    3    0    0   0   1/1   100.0     0/0   0.0
Desmond Towns          23    3    0    0   0   1/2    50.0     0/0   0.0
Jalen Haliburton       22    2    5    1   0   1/2    50.0     0/0   0.0
Miles Jackson          19    2    1    1   0   1/2    50.0     0/0   0.0
Shaquille Lillard      23    2    0    0   0   1/2    50.0     0/0   0.0
Giannis Anunoby        22    0    4    1   0   0/2     0.0     0/0   0.0

TEAM: FG: 7/13 (53.8%), 3PT: 2/5 (40.0%), REB: 9 (1 off, 8 def), AST: 2, TO: 8
TEAM FOULS: 7 [Team_052 in BONUS]

================================================================================

================================================================================
                               FULL GAME COMPLETE                               
================================================================================

FINAL SCORE: Team_052 110, Team_049 86

SCORING BY QUARTER:
--------------------------------------------------------------------------------
Team                     Q1     Q2     Q3     Q4    FINAL
--------------------------------------------------------------------------------
Team_052                 26     31     24     29      110
Team_049                 14     26     28     18       86
--------------------------------------------------------------------------------

FULL GAME BOX SCORE:
================================================================================

Team_052
--------------------------------------------------------------------------------
Player                MIN  PTS  REB  AST  TO      FG   FG%      3P   3P%      FT STL BLK
--------------------------------------------------------------------------------
Gary Gasol             30   10    0    5   1   5/11   45.5   2/5    40.0   8/11    1   0
Josh Durant            27   12    0    3   1   5/11   45.5   2/6    33.3   0/2     0   0
Bones Morant           27   11    7    2   2   4/9    44.4   1/5    20.0   1/1     1   0
James Paul             27   10    8    3   3   3/7    42.9   1/3    33.3   2/4     3   1
Carmelo Middleton      25    8    9    3   1   4/5    80.0   0/1     0.0   0/0     2   0
Carmelo Beal           23    7    9    2   0   2/5    40.0   1/1   100.0   2/2     3   0
Carmelo Giddey         22   11    0    2   0   5/7    71.4   0/0     0.0   1/2     1   0
Donovan Stewart        22   10    4    2   0   4/7    57.1   1/3    33.3   1/1     0   0
Jalen Haliburton       22    8    7    2   0   5/8    62.5   1/2    50.0   0/0     1   1
Jimmy Doncic           19    9    0    2   2   3/9    33.3   1/3    33.3   3/5     1   0

TEAM: FG: 40/79 (50.6%), 3PT: 10/29 (34.5%), REB: 41 (12 off, 29 def), AST: 26, TO: 10


Team_049
--------------------------------------------------------------------------------
Player                MIN  PTS  REB  AST  TO      FG   FG%      3P   3P%      FT STL BLK
--------------------------------------------------------------------------------
Shai Mobley            30   10   15    3   3   2/4    50.0   0/0     0.0   0/0     1   0
De'Aaron Allen         27    2    8    3   2   1/5    20.0   0/2     0.0   0/0     3   0
Shai Bird              25    9    0    0   2   4/12   33.3   2/6    33.3   1/1     0   0
Ja Oladipo             25   14    0    3   2   6/8    75.0   3/3   100.0   1/2     0   0
Jimmy Griffin          25   10    8    2   2   4/8    50.0   1/3    33.3   1/1     0   0
Shaquille Lillard      23    8    0    2   3   3/6    50.0   1/3    33.3   3/3     0   1
Shai Jordan            23   13    6    0   1   4/6    66.7   2/3    66.7   1/1     0   0
Desmond Towns          23    6    0    1   1   2/4    50.0   1/1   100.0   3/4     0   0
Giannis Anunoby        22    2   10    4   3   1/4    25.0   0/1     0.0   0/1     0   0
Miles Jackson          19   10    2    1   1   6/8    75.0   0/0     0.0   0/0     0   1

TEAM: FG: 34/66 (51.5%), 3PT: 10/22 (45.5%), REB: 51 (12 off, 39 def), AST: 19, TO: 20

================================================================================
