================================================================================
                        FULL GAME - Team_097 vs Team_043                        
================================================================================

================================================================================
                       1ST QUARTER - Team_097 vs Team_043                       
================================================================================

[12:00] Team_097 possession (Score: 0-0)
Evan Brogdon attempts a 3Pt. Heavily contested by Malcolm Murray (1.7 feet, MAN)! Evan Brogdon misses. Rebound secured by Manu Carter.

[11:46] Team_043 possession (Score: 0-0)
D'Angelo Iverson attempts a 3Pt. Contested by Shai Poole (5.8 feet, ZONE). D'ANGELO IVERSON MAKES IT! Assist: Manu Carter
Score: 0-3

[11:37] Team_097 possession (Score: 0-3)
Jrue Haliburton attempts a Midrange. Wide open! Magic Durant is 7.5 feet away. [MAN] Jrue Haliburton misses. FOUL! Loose ball foul on D'Angelo Iverson during the rebound battle. [Team fouls: 1] No free throws, side out. (D'Angelo Iverson: 1 personal fouls)

[11:22] Team_097 possession (Score: 0-3)
Tyrese Stewart attempts a Midrange. Contested by Magic Durant (6.0 feet, ZONE). Tyrese Stewart misses. Rebound secured by D'Angelo Iverson.

[11:10] Team_043 possession (Score: 0-3)
Dwyane Dosunmu drives, picks up Anthony Haliburton. Help arrives from Jrue Haliburton! Dwyane Dosunmu attempts a Layup. Heavily contested by Jrue Haliburton (0.5 feet, ZONE)! DWYANE DOSUNMU MAKES IT! Assist: Manu Carter
Score: 0-5

[10:57] Team_097 possession (Score: 0-5)
Evan Brogdon attempts a Midrange. Contested by Malcolm Murray (3.7 feet, MAN). Evan Brogdon misses. Rebound secured by Manu Carter.

[10:40] Team_043 possession (Score: 0-5)
Malcolm Murray attempts a 3Pt. Contested by Shai Poole (3.1 feet, ZONE). MALCOLM MURRAY MAKES IT!
Score: 0-8

[10:25] Team_097 possession (Score: 0-8)
Evan Brogdon attempts a 3Pt. Contested by Malcolm Murray (5.5 feet, MAN). Evan Brogdon misses. Offensive rebound by Anthony Haliburton! Anthony Haliburton puts it back in!
Score: 2-8

[10:12] Team_043 possession (Score: 2-8)
Dwyane Dosunmu commits a violation (traveling/carry)! TURNOVER! (dead ball)

[09:57] Team_097 possession (Score: 2-8)
Anthony Haliburton throws a bad pass out of bounds! TURNOVER! (dead ball)

[09:45] Team_043 possession (Score: 2-8)
Magic Durant attempts a 3Pt. Wide open! Jrue Haliburton is 6.8 feet away. [MAN] Magic Durant misses. Rebound secured by Tyrese Stewart.

[09:31] Team_097 possession (Score: 2-8)
Evan Brogdon drives to the basket... Evan Brogdon throws a bad pass out of bounds! TURNOVER! (dead ball)

[09:16] Team_043 possession (Score: 2-8)
FOUL! Holding foul on Jrue Haliburton. [Team fouls: 1] No free throws, side out. (Jrue Haliburton: 1 personal fouls)

[08:59] Team_043 possession (Score: 2-8)
Malcolm Murray attempts a Midrange. Contested by Shai Poole (3.8 feet, ZONE). Malcolm Murray misses. Rebound secured by Anthony Haliburton.

[08:44] Team_097 possession (Score: 2-8)
Evan Brogdon attempts a 3Pt. Contested by Malcolm Murray (5.8 feet, MAN). Evan Brogdon misses. Rebound secured by D'Angelo Iverson.

[08:28] Team_043 possession (Score: 2-8)
Magic Durant attempts a 3Pt. Contested by Shai Poole (2.8 feet, ZONE). Magic Durant misses. Rebound secured by Shai Poole.

[08:16] Team_097 possession (Score: 2-8)
Tyrese Stewart drives, picks up Manu Carter. Help arrives from Malcolm Murray! Tyrese Stewart attempts a Layup. Heavily contested by Malcolm Murray (1.4 feet, MAN)! TYRESE STEWART MAKES IT! Assist: Shai Poole
Score: 4-8

[08:02] Team_043 possession (Score: 4-8)
Dwyane Dosunmu drives, Anthony Haliburton stays with him. Dwyane Dosunmu attempts a Dunk. Heavily contested by Anthony Haliburton (0.6 feet, MAN)! Dwyane Dosunmu misses. Rebound secured by Shai Poole.

[07:43] Team_097 possession (Score: 4-8)
Evan Brogdon attempts a 3Pt. Wide open! Magic Durant is 8.7 feet away. [ZONE] EVAN BROGDON MAKES IT! Assist: Anthony Haliburton
Score: 7-8

[07:25] Team_043 possession (Score: 7-8)
D'Angelo Iverson attempts a Layup. BLOCKED BY ANTHONY HALIBURTON! Ball goes out off Anthony Haliburton. D'Angelo Iverson's ball!

[07:12] Team_043 possession (Score: 7-8)
D'Angelo Iverson attempts a Midrange. Contested by Jrue Haliburton (4.4 feet, ZONE). D'ANGELO IVERSON MAKES IT!
Score: 7-10

[06:56] Team_097 possession (Score: 7-10)
Tyrese Stewart attempts a Midrange. Contested by Manu Carter (2.0 feet, MAN). TYRESE STEWART MAKES IT! Assist: Anthony Haliburton
Score: 9-10

[06:43] Team_043 possession (Score: 9-10)
Malcolm Murray attempts a 3Pt. Contested by Evan Brogdon (4.7 feet, MAN). Malcolm Murray misses. Offensive rebound by Manu Carter! Manu Carter kicks it out.

[06:26] Team_043 possession (Score: 9-10)
Malcolm Murray makes the Layup and draws the foul on Evan Brogdon! And-1! Malcolm Murray to the line for 1. [Team fouls: 2] (Evan Brogdon: 1 personal fouls)   FT 1/1: GOOD Malcolm Murray makes 1/1 from the line.
Score: 9-13

[06:12] Team_097 possession (Score: 9-13)
Evan Brogdon drives, Manu Carter stays with him. Evan Brogdon attempts a Layup. Wide open! Manu Carter is 9.0 feet away. [ZONE] Evan Brogdon misses. Rebound secured by D'Angelo Iverson.

[05:58] Team_043 possession (Score: 9-13)
Dwyane Dosunmu attempts a Midrange. Contested by Jrue Haliburton (2.5 feet, ZONE). Dwyane Dosunmu misses. Rebound secured by Anthony Haliburton.

[05:40] Team_097 possession (Score: 9-13)
Shai Poole attempts a 3Pt. Heavily contested by D'Angelo Iverson (2.0 feet, ZONE)! Shai Poole misses. Offensive rebound by Tyrese Stewart! Tyrese Stewart kicks it out.

[05:24] Team_097 possession (Score: 9-13)
Anthony Haliburton attempts a Layup. Heavily contested by Manu Carter (0.5 feet, ZONE)! ANTHONY HALIBURTON MAKES IT!
Score: 11-13

[05:05] Team_043 possession (Score: 11-13)
Dwyane Dosunmu drives, Anthony Haliburton stays with him. Dwyane Dosunmu attempts a Dunk. Contested by Anthony Haliburton (2.2 feet, MAN). DWYANE DOSUNMU MAKES IT!
Score: 11-15

[04:50] Team_097 possession (Score: 11-15)
Evan Brogdon drives and kicks out. Tyrese Stewart attempts a Midrange. Contested by D'Angelo Iverson (3.9 feet, ZONE). Tyrese Stewart misses. Offensive rebound by Tyrese Stewart! Tyrese Stewart kicks it out.

[04:32] Team_097 possession (Score: 11-15)
Evan Brogdon attempts a Layup. BLOCKED BY MANU CARTER! Ball is loose! Rebound secured by D'Angelo Iverson.

[04:19] Team_043 possession (Score: 11-15)
Manu Carter attempts a Midrange. Contested by Shai Poole (3.2 feet, ZONE). MANU CARTER MAKES IT!
Score: 11-17

[04:08] Team_097 possession (Score: 11-17)
Shai Poole attempts a 3Pt. Contested by D'Angelo Iverson (4.9 feet, ZONE). Shai Poole misses. Rebound secured by Dwyane Dosunmu.

[03:52] Team_043 possession (Score: 11-17)
Magic Durant attempts a 3Pt. Contested by Shai Poole (2.2 feet, ZONE). MAGIC DURANT MAKES IT! Assist: Manu Carter
Score: 11-20

[03:34] Team_097 possession (Score: 11-20)
Shai Poole attempts a Midrange. Heavily contested by D'Angelo Iverson (1.7 feet, ZONE)! Shai Poole misses. Rebound secured by Manu Carter.

[03:20] Team_043 possession (Score: 11-20)
Malcolm Murray attempts a 3Pt. Heavily contested by Shai Poole (1.9 feet, ZONE)! Malcolm Murray misses. Rebound secured by Anthony Haliburton.

[03:04] Team_097 possession (Score: 11-20)
Tyrese Stewart attempts a Layup. Contested by Manu Carter (4.5 feet, ZONE). TYRESE STEWART MAKES IT! Assist: Anthony Haliburton
Score: 13-20

[02:49] Team_043 possession (Score: 13-20)
Dwyane Dosunmu attempts a Layup. Contested by Anthony Haliburton (5.4 feet, ZONE). Dwyane Dosunmu misses. Rebound secured by Shai Poole.

[02:36] Team_097 possession (Score: 13-20)
FOUL! Shooting foul on D'Angelo Iverson. Shai Poole to the line for 2 free throws. [Team fouls: 2] (D'Angelo Iverson: 2 personal fouls)   FT 1/2: GOOD   FT 2/2: GOOD Shai Poole makes 2/2 from the line.
Score: 15-20

[02:25] Team_043 possession (Score: 15-20)
FOUL! Reach-in foul on Anthony Haliburton during the drive. [Team fouls: 3] No free throws, side out. (Anthony Haliburton: 1 personal fouls)

[02:13] Team_043 possession (Score: 15-20)
Malcolm Murray attempts a Layup. Contested by Evan Brogdon (5.4 feet, MAN). MALCOLM MURRAY MAKES IT! Assist: Manu Carter
Score: 15-22

[01:55] Team_097 possession (Score: 15-22)
Shai Poole attempts a Midrange. Contested by Manu Carter (5.9 feet, ZONE). Shai Poole misses. Rebound secured by Dwyane Dosunmu.

[01:42] Team_043 possession (Score: 15-22)
Manu Carter attempts a Midrange. Contested by Jrue Haliburton (4.4 feet, ZONE). Manu Carter misses. Rebound secured by Tyrese Stewart.

[01:32] Team_097 possession (Score: 15-22)
FOUL! Shooting foul on D'Angelo Iverson. Evan Brogdon to the line for 3 free throws. [Team fouls: 3] (D'Angelo Iverson: 3 personal fouls)   FT 1/3: MISS   FT 2/3: GOOD   FT 3/3: GOOD Evan Brogdon makes 2/3 from the line.
Score: 17-22

[01:15] Team_043 possession (Score: 17-22)
Magic Durant attempts a 3Pt. Contested by Shai Poole (4.5 feet, ZONE). Magic Durant misses. Rebound secured by Shai Poole.

[00:58] Team_097 possession (Score: 17-22)
Tyrese Stewart attempts a Midrange. Contested by Manu Carter (5.6 feet, MAN). TYRESE STEWART MAKES IT! Assist: Evan Brogdon
Score: 19-22

[00:41] Team_043 possession (Score: 19-22)
Manu Carter makes the Midrange and draws the foul on Anthony Haliburton! And-1! Manu Carter to the line for 1. [Team fouls: 4] (Anthony Haliburton: 2 personal fouls)   FT 1/1: GOOD Manu Carter makes 1/1 from the line.
Score: 19-25

[00:29] Team_097 possession (Score: 19-25)
Tyrese Stewart attempts a Layup. BLOCKED BY MANU CARTER! Ball is loose! Rebound secured by D'Angelo Iverson.

[00:14] Team_043 possession (Score: 19-25)
D'Angelo Iverson attempts a 3Pt. Contested by Shai Poole (4.3 feet, MAN). D'Angelo Iverson misses. Rebound secured by Anthony Haliburton.

[00:02] Team_097 possession (Score: 19-25)
Jrue Haliburton attempts a Layup. BLOCKED BY MANU CARTER! Ball goes out off Manu Carter. Jrue Haliburton's ball!

================================================================================
                              1ST QUARTER COMPLETE                              
================================================================================

1ST QUARTER SCORE: Team_097 19, Team_043 25

BOX SCORE:
================================================================================

Team_097
--------------------------------------------------------------------------------
Player                MIN  PTS  REB  AST  TO      FG   FG%      3P   3P%
--------------------------------------------------------------------------------
Tyrese Stewart         12    8    4    0   0   4/6    66.7     0/0   0.0
Evan Brogdon           12    5    0    1   0   2/7    28.6     0/0   0.0
Anthony Haliburton     12    4    6    3   0   2/2   100.0     0/0   0.0
Shai Poole             12    2    4    1   0   1/4    25.0     0/0   0.0

TEAM: FG: 9/19 (47.4%), 3PT: 3/6 (50.0%), REB: 14 (4 off, 10 def), AST: 5, TO: 2
TEAM FOULS: 4


Team_043
--------------------------------------------------------------------------------
Player                MIN  PTS  REB  AST  TO      FG   FG%      3P   3P%
--------------------------------------------------------------------------------
Malcolm Murray         12    8    0    0   0   3/5    60.0     0/0   0.0
Manu Carter            12    5    4    4   0   2/3    66.7     0/0   0.0
D'Angelo Iverson       12    5    5    0   0   2/3    66.7     0/0   0.0
Dwyane Dosunmu         12    4    2    0   0   2/5    40.0     0/0   0.0
Magic Durant           12    3    0    0   0   1/4    25.0     0/0   0.0

TEAM: FG: 10/20 (50.0%), 3PT: 3/8 (37.5%), REB: 11 (1 off, 10 def), AST: 4, TO: 1
TEAM FOULS: 3

================================================================================

================================================================================
                       2ND QUARTER - Team_097 vs Team_043                       
================================================================================

[12:00] Substitution (Team_097): Evan Brogdon OUT → Gary Carter IN (stamina_rule2)

[12:00] Substitution (Team_097): Shai Poole OUT → Miles Dosunmu IN (stamina_rule2)

[12:00] Substitution (Team_097): Anthony Haliburton OUT → Joel Simons IN (stamina_rule2)

[12:00] Substitution (Team_097): Tyrese Stewart OUT → Miles Banchero IN (stamina_rule2)

[12:00] Substitution (Team_043): Malcolm Murray OUT → Jabari Holiday IN (stamina_rule2)

[12:00] Substitution (Team_043): Magic Durant OUT → Ben LaVine IN (stamina_rule2)

[12:00] Substitution (Team_043): Manu Carter OUT → Joel Murray IN (stamina_rule2)

[12:00] Substitution (Team_043): Dwyane Dosunmu OUT → Terry Randle IN (stamina_rule2)

[12:00] Team_097 possession (Score: 19-25)
Evan Brogdon commits a violation (traveling/carry)! TURNOVER! (dead ball)

[11:45] Team_043 possession (Score: 19-25)
Ben LaVine attempts a 3Pt. Wide open! Jrue Haliburton is 6.9 feet away. [MAN] BEN LAVINE MAKES IT! Assist: Jabari Holiday
Score: 19-28

[11:32] Team_097 possession (Score: 19-28)
Miles Banchero attempts a Midrange. Contested by Terry Randle (4.8 feet, MAN). Miles Banchero misses. Rebound secured by Terry Randle.

[11:22] Team_043 possession (Score: 19-28)
D'Angelo Iverson attempts a 3Pt. Wide open! Joel Simons is 6.3 feet away. [ZONE] D'Angelo Iverson misses. Rebound secured by Miles Dosunmu.

[11:07] Team_097 possession (Score: 19-28)
Jrue Haliburton attempts a 3Pt. Contested by D'Angelo Iverson (6.0 feet, ZONE). JRUE HALIBURTON MAKES IT!
Score: 22-28

[10:53] Team_043 possession (Score: 22-28)
D'Angelo Iverson attempts a 3Pt. Heavily contested by Joel Simons (0.5 feet, ZONE)! D'Angelo Iverson misses. Rebound secured by Miles Dosunmu.

[10:43] Team_097 possession (Score: 22-28)
Miles Dosunmu drives, picks up Terry Randle. Help arrives from Ben LaVine! Miles Dosunmu attempts a Layup. Heavily contested by Ben LaVine (1.0 feet, ZONE)! MILES DOSUNMU MAKES IT!
Score: 24-28

[10:30] Team_043 possession (Score: 24-28)
Ben LaVine drives to the basket... Ben LaVine commits a violation (traveling/carry)! TURNOVER! (dead ball)

[10:30] Substitution (Team_097): Jrue Haliburton OUT → Dwyane Ginobili IN (stamina_rule2)

[10:30] Substitution (Team_043): D'Angelo Iverson OUT → Dirk Herro IN (stamina_rule2)

[10:13] Team_097 possession (Score: 24-28)
Dwyane Ginobili attempts a 3Pt. Wide open! Dirk Herro is 7.3 feet away. [ZONE] Dwyane Ginobili misses. Rebound secured by Dirk Herro.

[09:58] Team_043 possession (Score: 24-28)
Dirk Herro attempts a 3Pt. Contested by Miles Dosunmu (4.0 feet, MAN). Dirk Herro misses. Rebound secured by Miles Banchero.

[09:45] Team_097 possession (Score: 24-28)
Dwyane Ginobili attempts a 3Pt. Contested by Ben LaVine (3.5 feet, MAN). DWYANE GINOBILI MAKES IT! Assist: Gary Carter
Score: 27-28

[09:31] Team_043 possession (Score: 27-28)
Jabari Holiday attempts a Midrange. Contested by Joel Simons (5.0 feet, ZONE). Jabari Holiday misses. Offensive rebound by Terry Randle! Terry Randle kicks it out.

[09:17] Team_043 possession (Score: 27-28)
Terry Randle makes the Layup and draws the foul on Dwyane Ginobili! And-1! Terry Randle to the line for 1. [Team fouls: 1] (Dwyane Ginobili: 1 personal fouls)   FT 1/1: GOOD Terry Randle makes 1/1 from the line.
Score: 27-31

[09:02] Team_097 possession (Score: 27-31)
Miles Dosunmu attempts a 3Pt. Contested by Dirk Herro (5.5 feet, ZONE). Miles Dosunmu misses. Rebound secured by Terry Randle.

[08:48] Team_043 possession (Score: 27-31)
Joel Murray drives to the basket... FOUL! Offensive foul on Joel Murray! Joel Simons drew the charge! [Team fouls: 1] (Joel Murray: 1 personal fouls) TURNOVER! (dead ball)

[08:33] Team_097 possession (Score: 27-31)
Miles Dosunmu attempts a 3Pt. Contested by Dirk Herro (3.4 feet, ZONE). Miles Dosunmu misses. Rebound secured by Dirk Herro.

[08:19] Team_043 possession (Score: 27-31)
Dirk Herro attempts a Midrange. Contested by Dwyane Ginobili (5.0 feet, ZONE). Dirk Herro misses. Rebound secured by Joel Simons.

[08:10] Team_097 possession (Score: 27-31)
Gary Carter attempts a 3Pt. Contested by Jabari Holiday (2.4 feet, MAN). Gary Carter misses. Rebound secured by Ben LaVine.

[07:56] Team_043 possession (Score: 27-31)
Ben LaVine attempts a Layup. Contested by Joel Simons (3.1 feet, ZONE). Ben LaVine misses. Rebound secured by Miles Banchero.

[07:38] Team_097 possession (Score: 27-31)
Miles Banchero drives, picks up Terry Randle. Help arrives from Ben LaVine! Miles Banchero attempts a Layup. Contested by Ben LaVine (2.1 feet, MAN). MILES BANCHERO MAKES IT! Assist: Dwyane Ginobili
Score: 29-31

[07:27] Team_043 possession (Score: 29-31)
Dirk Herro attempts a Midrange. Contested by Miles Dosunmu (2.5 feet, MAN). Dirk Herro misses. Rebound secured by Joel Simons.

[07:16] Team_097 possession (Score: 29-31)
Miles Dosunmu attempts a Midrange. Contested by Dirk Herro (3.9 feet, MAN). MILES DOSUNMU MAKES IT! Assist: Joel Simons
Score: 31-31

[07:00] Team_043 possession (Score: 31-31)
Jabari Holiday attempts a 3Pt. Wide open! Joel Simons is 7.3 feet away. [ZONE] Jabari Holiday misses. Rebound secured by Miles Dosunmu.

[06:49] Team_097 possession (Score: 31-31)
Miles Dosunmu throws a bad pass! Stolen by Dirk Herro! TURNOVER! (live ball)

[06:33] Team_043 possession (Score: 31-31)
Ben LaVine attempts a 3Pt. Contested by Joel Simons (4.2 feet, ZONE). BEN LAVINE MAKES IT! Assist: Joel Murray
Score: 31-34

[06:19] Team_097 possession (Score: 31-34)
Miles Dosunmu makes the Layup and draws the foul on Ben LaVine! And-1! Miles Dosunmu to the line for 1. [Team fouls: 2] (Ben LaVine: 1 personal fouls)   FT 1/1: MISS Miles Dosunmu makes 0/1 from the line. Rebound secured by Ben LaVine.
Score: 33-34

[06:03] Team_043 possession (Score: 33-34)
Jabari Holiday loses the ball! Stripped by Gary Carter! TURNOVER! (live ball)

[05:50] Team_097 possession (Score: 33-34)
Joel Simons drives, Terry Randle stays with him. Joel Simons attempts a Dunk. Contested by Terry Randle (5.7 feet, ZONE). JOEL SIMONS MAKES IT! Assist: Miles Dosunmu
Score: 35-34

[05:41] Team_043 possession (Score: 35-34)
FOUL! Shooting foul on Dwyane Ginobili. Dirk Herro to the line for 2 free throws. [Team fouls: 2] (Dwyane Ginobili: 2 personal fouls)   FT 1/2: GOOD   FT 2/2: MISS Dirk Herro makes 1/2 from the line. Offensive rebound by Terry Randle! Terry Randle kicks it out.
Score: 35-35

[05:28] Team_043 possession (Score: 35-35)
Terry Randle attempts a Layup. Heavily contested by Joel Simons (0.5 feet, ZONE)! TERRY RANDLE MAKES IT!
Score: 35-37

[05:14] Team_097 possession (Score: 35-37)
Miles Banchero attempts a 3Pt. Contested by Jabari Holiday (3.8 feet, ZONE). Miles Banchero misses. Rebound secured by Terry Randle.

[05:00] Team_043 possession (Score: 35-37)
Ben LaVine attempts a Layup. BLOCKED BY MILES BANCHERO! Ball deflects out of bounds off Ben LaVine.

[04:49] Team_097 possession (Score: 35-37)
Dwyane Ginobili attempts a Midrange. Wide open! Ben LaVine is 7.3 feet away. [MAN] Dwyane Ginobili misses. Rebound secured by Dirk Herro.

[04:35] Team_043 possession (Score: 35-37)
Ben LaVine attempts a 3Pt. Contested by Dwyane Ginobili (4.5 feet, MAN). Ben LaVine misses. Rebound secured by Miles Dosunmu.

[04:19] Team_097 possession (Score: 35-37)
Gary Carter attempts a Layup. Contested by Terry Randle (5.5 feet, ZONE). GARY CARTER MAKES IT! Assist: Miles Dosunmu
Score: 37-37

[04:00] Team_043 possession (Score: 37-37)
Terry Randle loses the ball! Stripped by Joel Simons! TURNOVER! (live ball)

[03:46] Team_097 possession (Score: 37-37)
Dwyane Ginobili attempts a 3Pt. Contested by Dirk Herro (4.6 feet, ZONE). Dwyane Ginobili misses. Rebound secured by Ben LaVine.

[03:31] Team_043 possession (Score: 37-37)
Ben LaVine attempts a Midrange. Contested by Dwyane Ginobili (3.4 feet, ZONE). Ben LaVine misses. Rebound secured by Miles Banchero.

[03:17] Team_097 possession (Score: 37-37)
Miles Dosunmu makes the 3Pt and draws the foul on Dirk Herro! And-1! Miles Dosunmu to the line for 1. [Team fouls: 3] (Dirk Herro: 1 personal fouls)   FT 1/1: MISS Miles Dosunmu makes 0/1 from the line. Offensive rebound by Joel Simons! Joel Simons kicks it out.
Score: 40-37

[03:02] Team_097 possession (Score: 40-37)
Miles Dosunmu drives and kicks out. Dwyane Ginobili attempts a Midrange. Wide open! Ben LaVine is 7.3 feet away. [MAN] DWYANE GINOBILI MAKES IT! Assist: Gary Carter
Score: 42-37

[02:48] Team_043 possession (Score: 42-37)
Dirk Herro attempts a Midrange. Contested by Joel Simons (4.0 feet, ZONE). Dirk Herro misses. Rebound secured by Miles Banchero.

[02:32] Team_097 possession (Score: 42-37)
Dwyane Ginobili loses control! Ball rolls out of bounds! TURNOVER! (dead ball)

[02:16] Team_043 possession (Score: 42-37)
Jabari Holiday loses control! Ball rolls out of bounds! TURNOVER! (dead ball)

[02:06] Team_097 possession (Score: 42-37)
Miles Dosunmu attempts a 3Pt. Contested by Joel Murray (5.5 feet, ZONE). MILES DOSUNMU MAKES IT! Assist: Miles Banchero
Score: 45-37

[01:55] Team_043 possession (Score: 45-37)
Dirk Herro attempts a Midrange. Wide open! Joel Simons is 6.2 feet away. [ZONE] Dirk Herro misses. Offensive rebound by Terry Randle! Terry Randle kicks it out.

[01:42] Team_043 possession (Score: 45-37)
Joel Murray attempts a 3Pt. Contested by Joel Simons (6.0 feet, ZONE). Joel Murray misses. Rebound secured by Miles Dosunmu.

[01:23] Team_097 possession (Score: 45-37)
Dwyane Ginobili attempts a 3Pt. Contested by Ben LaVine (3.1 feet, MAN). DWYANE GINOBILI MAKES IT! Assist: Miles Banchero
Score: 48-37

[01:13] Team_043 possession (Score: 48-37)
Terry Randle attempts a Midrange. Wide open! Dwyane Ginobili is 6.1 feet away. [ZONE] Terry Randle misses. Rebound secured by Miles Dosunmu.

[00:57] Team_097 possession (Score: 48-37)
Dwyane Ginobili attempts a Layup. Wide open! Ben LaVine is 6.5 feet away. [MAN] DWYANE GINOBILI MAKES IT!
Score: 50-37

[00:42] Team_043 possession (Score: 50-37)
Jabari Holiday attempts a Layup. Contested by Gary Carter (4.9 feet, MAN). JABARI HOLIDAY MAKES IT! Assist: Ben LaVine
Score: 50-39

[00:31] Team_097 possession (Score: 50-39)
Miles Banchero attempts a Midrange. Contested by Terry Randle (4.2 feet, ZONE). MILES BANCHERO MAKES IT! Assist: Miles Dosunmu
Score: 52-39

[00:15] Team_043 possession (Score: 52-39)
Terry Randle drives, picks up Joel Simons. Help arrives from Dwyane Ginobili! Terry Randle attempts a Layup. Wide open! Dwyane Ginobili is 7.4 feet away. [ZONE] TERRY RANDLE MAKES IT! Assist: Joel Murray
Score: 52-41

[00:02] Team_097 possession (Score: 52-41)
Miles Dosunmu makes the Layup and draws the foul on Dirk Herro! And-1! Miles Dosunmu to the line for 1. [Team fouls: 4] (Dirk Herro: 2 personal fouls)   FT 1/1: GOOD Miles Dosunmu makes 1/1 from the line.
Score: 55-41

================================================================================
                              2ND QUARTER COMPLETE                              
================================================================================

2ND QUARTER SCORE: Team_097 36, Team_043 16

BOX SCORE:
================================================================================

Team_097
--------------------------------------------------------------------------------
Player                MIN  PTS  REB  AST  TO      FG   FG%      3P   3P%
--------------------------------------------------------------------------------
Miles Dosunmu          12   10    6    3   0   4/7    57.1     0/0   0.0
Dwyane Ginobili        10   10    0    1   0   4/7    57.1     0/0   0.0
Miles Banchero         12    4    4    2   0   2/4    50.0     0/0   0.0
Jrue Haliburton        14    3    0    0   0   1/1   100.0     0/0   0.0
Gary Carter            12    2    0    2   0   1/2    50.0     0/0   0.0
Joel Simons            12    2    3    1   0   1/1   100.0     0/0   0.0

TEAM: FG: 13/22 (59.1%), 3PT: 4/10 (40.0%), REB: 13 (1 off, 12 def), AST: 9, TO: 3
TEAM FOULS: 2


Team_043
--------------------------------------------------------------------------------
Player                MIN  PTS  REB  AST  TO      FG   FG%      3P   3P%
--------------------------------------------------------------------------------
Terry Randle           12    7    6    0   0   3/4    75.0     0/0   0.0
Ben LaVine             12    6    3    1   0   2/6    33.3     0/0   0.0
Jabari Holiday         12    2    0    1   0   1/2    50.0     0/0   0.0
D'Angelo Iverson       14    0    0    0   0   0/2     0.0     0/0   0.0
Dirk Herro             10    0    3    0   0   0/4     0.0     0/0   0.0
Joel Murray            12    0    0    2   0   0/1     0.0     0/0   0.0

TEAM: FG: 6/19 (31.6%), 3PT: 2/8 (25.0%), REB: 12 (3 off, 9 def), AST: 4, TO: 5
TEAM FOULS: 4

================================================================================

================================================================================
                       3RD QUARTER - Team_097 vs Team_043                       
================================================================================

[12:00] Team_097 possession (Score: 55-41)
Anthony Haliburton throws a bad pass! Stolen by Manu Carter! TURNOVER! (live ball)

[11:45] Team_043 possession (Score: 55-41)
Magic Durant throws a bad pass out of bounds! TURNOVER! (dead ball)

[11:32] Team_097 possession (Score: 55-41)
FOUL! Shooting foul on Malcolm Murray. Jrue Haliburton to the line for 3 free throws. [Team fouls: 1] (Malcolm Murray: 1 personal fouls)   FT 1/3: GOOD   FT 2/3: GOOD   FT 3/3: GOOD Jrue Haliburton makes 3/3 from the line.
Score: 58-41

[11:18] Team_043 possession (Score: 58-41)
FOUL! Holding foul on Anthony Haliburton. [Team fouls: 1] No free throws, side out. (Anthony Haliburton: 1 personal fouls)

[11:03] Team_043 possession (Score: 58-41)
Dwyane Dosunmu attempts a Layup. Contested by Anthony Haliburton (2.8 feet, ZONE). DWYANE DOSUNMU MAKES IT!
Score: 58-43

[10:47] Team_097 possession (Score: 58-43)
Shai Poole attempts a Midrange. Wide open! D'Angelo Iverson is 7.0 feet away. [MAN] Shai Poole misses. Rebound secured by Manu Carter.

[10:34] Team_043 possession (Score: 58-43)
Manu Carter attempts a 3Pt. Contested by Shai Poole (3.5 feet, ZONE). Manu Carter misses. Rebound secured by Tyrese Stewart.

[10:23] Team_097 possession (Score: 58-43)
Evan Brogdon attempts a Layup. Contested by Manu Carter (3.9 feet, ZONE). Evan Brogdon misses. Offensive rebound by Anthony Haliburton! Anthony Haliburton's putback is no good. Rebound secured by D'Angelo Iverson.

[10:14] Team_043 possession (Score: 58-43)
Malcolm Murray attempts a 3Pt. Contested by Shai Poole (5.1 feet, ZONE). Malcolm Murray misses. Rebound secured by Shai Poole.

[09:59] Team_097 possession (Score: 58-43)
Evan Brogdon attempts a 3Pt. Contested by Malcolm Murray (5.0 feet, MAN). EVAN BROGDON MAKES IT! Assist: Shai Poole
Score: 61-43

[09:48] Team_043 possession (Score: 61-43)
Manu Carter makes the 3Pt and draws the foul on Anthony Haliburton! And-1! Manu Carter to the line for 1. [Team fouls: 2] (Anthony Haliburton: 2 personal fouls)   FT 1/1: GOOD Manu Carter makes 1/1 from the line.
Score: 61-47

[09:35] Team_097 possession (Score: 61-47)
Anthony Haliburton drives, Manu Carter stays with him. Anthony Haliburton attempts a Layup. Contested by Manu Carter (5.5 feet, MAN). ANTHONY HALIBURTON MAKES IT! Assist: Tyrese Stewart
Score: 63-47

[09:17] Team_043 possession (Score: 63-47)
Manu Carter attempts a 3Pt. Contested by Anthony Haliburton (4.6 feet, MAN). Manu Carter misses. Rebound secured by Anthony Haliburton.

[08:58] Team_097 possession (Score: 63-47)
Shai Poole attempts a 3Pt. Contested by D'Angelo Iverson (2.6 feet, ZONE). SHAI POOLE MAKES IT! Assist: Tyrese Stewart
Score: 66-47

[08:43] Team_043 possession (Score: 66-47)
Malcolm Murray attempts a Midrange. Contested by Evan Brogdon (5.2 feet, MAN). MALCOLM MURRAY MAKES IT!
Score: 66-49

[08:31] Team_097 possession (Score: 66-49)
Evan Brogdon drives and kicks out. Shai Poole attempts a 3Pt. Heavily contested by D'Angelo Iverson (1.7 feet, MAN)! Shai Poole misses. Rebound secured by Manu Carter.

[08:18] Team_043 possession (Score: 66-49)
Dwyane Dosunmu commits a violation (traveling/carry)! TURNOVER! (dead ball)

[08:05] Team_097 possession (Score: 66-49)
Anthony Haliburton attempts a 3Pt. Contested by Manu Carter (4.7 feet, ZONE). Anthony Haliburton misses. Rebound secured by Manu Carter.

[07:50] Team_043 possession (Score: 66-49)
Dwyane Dosunmu throws a bad pass! Stolen by Anthony Haliburton! TURNOVER! (live ball)

[07:35] Team_097 possession (Score: 66-49)
Evan Brogdon drives, picks up Malcolm Murray. Help arrives from D'Angelo Iverson! Evan Brogdon attempts a Dunk. Heavily contested by D'Angelo Iverson (0.8 feet, MAN)! Evan Brogdon misses. Rebound secured by Manu Carter.

[07:23] Team_043 possession (Score: 66-49)
Dwyane Dosunmu drives to the basket... Dwyane Dosunmu throws a bad pass! Stolen by Tyrese Stewart! TURNOVER! (live ball)

[07:09] Team_097 possession (Score: 66-49)
Jrue Haliburton attempts a 3Pt. Wide open! Magic Durant is 6.1 feet away. [MAN] JRUE HALIBURTON MAKES IT! Assist: Evan Brogdon
Score: 69-49

[06:53] Team_043 possession (Score: 69-49)
FOUL! Reach-in foul on Anthony Haliburton during the drive. [Team fouls: 3] No free throws, side out. (Anthony Haliburton: 3 personal fouls)

[06:33] Team_043 possession (Score: 69-49)
Magic Durant loses control! Ball rolls out of bounds! TURNOVER! (dead ball)

[06:16] Team_097 possession (Score: 69-49)
Tyrese Stewart drives and kicks out. Shai Poole attempts a 3Pt. Contested by D'Angelo Iverson (3.7 feet, ZONE). Shai Poole misses. Rebound secured by D'Angelo Iverson.

[06:00] Team_043 possession (Score: 69-49)
Magic Durant drives and kicks out. Manu Carter attempts a Midrange. Wide open! Tyrese Stewart is 7.5 feet away. [ZONE] MANU CARTER MAKES IT! Assist: Magic Durant
Score: 69-51

[05:44] Team_097 possession (Score: 69-51)
Shai Poole drives to the basket... FOUL! Offensive foul on Shai Poole! D'Angelo Iverson drew the charge! [Team fouls: 4] (Shai Poole: 1 personal fouls) TURNOVER! (dead ball)

[05:32] Team_043 possession (Score: 69-51)
Magic Durant attempts a Midrange. Contested by Anthony Haliburton (3.6 feet, ZONE). MAGIC DURANT MAKES IT! Assist: Malcolm Murray
Score: 69-53

[05:18] Team_097 possession (Score: 69-53)
Jrue Haliburton makes the Layup and draws the foul on Manu Carter! And-1! Jrue Haliburton to the line for 1. [Team fouls: 2] (Manu Carter: 1 personal fouls)   FT 1/1: GOOD Jrue Haliburton makes 1/1 from the line.
Score: 72-53

[05:03] Team_043 possession (Score: 72-53)
Dwyane Dosunmu drives to the basket... Dwyane Dosunmu throws a bad pass! Stolen by Anthony Haliburton! TURNOVER! (live ball)

[04:49] Team_097 possession (Score: 72-53)
Shai Poole attempts a 3Pt. Wide open! D'Angelo Iverson is 6.9 feet away. [ZONE] Shai Poole misses. Rebound secured by Manu Carter.

[04:37] Team_043 possession (Score: 72-53)
Magic Durant attempts a Layup. Contested by Jrue Haliburton (4.1 feet, MAN). MAGIC DURANT MAKES IT! Assist: Dwyane Dosunmu
Score: 72-55

[04:23] Team_097 possession (Score: 72-55)
Evan Brogdon attempts a 3Pt. Contested by Malcolm Murray (5.2 feet, MAN). Evan Brogdon misses. Rebound secured by Dwyane Dosunmu.

[04:08] Team_043 possession (Score: 72-55)
Dwyane Dosunmu attempts a Layup. Contested by Anthony Haliburton (4.3 feet, MAN). DWYANE DOSUNMU MAKES IT!
Score: 72-57

[03:51] Team_097 possession (Score: 72-57)
Shai Poole attempts a 3Pt. Contested by D'Angelo Iverson (2.7 feet, MAN). Shai Poole misses. Offensive rebound by Anthony Haliburton! Anthony Haliburton's putback is no good. Rebound secured by D'Angelo Iverson.

[03:39] Team_043 possession (Score: 72-57)
Magic Durant attempts a Midrange. Contested by Tyrese Stewart (4.9 feet, ZONE). MAGIC DURANT MAKES IT!
Score: 72-59

[03:29] Team_097 possession (Score: 72-59)
Tyrese Stewart attempts a Midrange. Contested by Manu Carter (4.7 feet, MAN). Tyrese Stewart misses. Rebound secured by D'Angelo Iverson.

[03:13] Team_043 possession (Score: 72-59)
FOUL! Reach-in foul on Anthony Haliburton during the drive. [IN THE BONUS! 5 team fouls] Malcolm Murray to the line for 2 free throws. (Anthony Haliburton: 4 personal fouls)   FT 1/2: GOOD   FT 2/2: GOOD Malcolm Murray makes 2/2 from the line.
Score: 72-61

[02:59] Team_097 possession (Score: 72-61)
Tyrese Stewart attempts a Layup. Heavily contested by Manu Carter (1.6 feet, MAN)! TYRESE STEWART MAKES IT! Assist: Shai Poole
Score: 74-61

[02:45] Team_043 possession (Score: 74-61)
Dwyane Dosunmu throws a bad pass out of bounds! TURNOVER! (dead ball)

[02:45] Substitution (Team_097): Evan Brogdon OUT → Gary Carter IN (stamina_rule2)

[02:45] Substitution (Team_097): Anthony Haliburton OUT → Joel Simons IN (stamina_rule2)

[02:45] Substitution (Team_097): Tyrese Stewart OUT → Miles Banchero IN (stamina_rule2)

[02:45] Substitution (Team_043): Magic Durant OUT → Ben LaVine IN (stamina_rule2)

[02:45] Substitution (Team_043): Manu Carter OUT → Joel Murray IN (stamina_rule2)

[02:45] Substitution (Team_043): Dwyane Dosunmu OUT → Terry Randle IN (stamina_rule2)

[02:27] Team_097 possession (Score: 74-61)
Jrue Haliburton attempts a Midrange. Contested by Ben LaVine (3.5 feet, MAN). JRUE HALIBURTON MAKES IT! Assist: Joel Simons
Score: 76-61

[02:12] Team_043 possession (Score: 76-61)
Malcolm Murray attempts a Midrange. Contested by Shai Poole (3.6 feet, ZONE). Malcolm Murray misses. Rebound secured by Joel Simons.

[01:57] Team_097 possession (Score: 76-61)
FOUL! Reach-in foul on Terry Randle during the drive. [Team fouls: 3] No free throws, side out. (Terry Randle: 1 personal fouls)

[01:42] Team_097 possession (Score: 76-61)
FOUL! Holding foul on D'Angelo Iverson. [Team fouls: 4] No free throws, side out. (D'Angelo Iverson: 1 personal fouls)

[01:28] Team_097 possession (Score: 76-61)
Miles Banchero drives and kicks out. Shai Poole attempts a 3Pt. Contested by D'Angelo Iverson (4.0 feet, ZONE). Shai Poole misses. Rebound secured by Malcolm Murray.

[01:17] Team_043 possession (Score: 76-61)
Terry Randle attempts a Layup. Contested by Joel Simons (5.6 feet, MAN). TERRY RANDLE MAKES IT! Assist: Ben LaVine
Score: 76-63

[01:04] Team_097 possession (Score: 76-63)
Shai Poole attempts a 3Pt. Contested by D'Angelo Iverson (3.9 feet, ZONE). Shai Poole misses. Rebound secured by D'Angelo Iverson.

[00:53] Team_043 possession (Score: 76-63)
D'Angelo Iverson attempts a Midrange. Wide open! Jrue Haliburton is 8.1 feet away. [ZONE] D'Angelo Iverson misses. Offensive rebound by D'Angelo Iverson! D'Angelo Iverson kicks it out.

[00:37] Team_043 possession (Score: 76-63)
D'Angelo Iverson attempts a Layup. Contested by Joel Simons (5.5 feet, ZONE). D'ANGELO IVERSON MAKES IT! Assist: Terry Randle
Score: 76-65

[00:24] Team_097 possession (Score: 76-65)
Shai Poole throws a bad pass! Stolen by D'Angelo Iverson! TURNOVER! (live ball)

[00:09] Team_043 possession (Score: 76-65)
Malcolm Murray attempts a 3Pt. Contested by Joel Simons (3.0 feet, ZONE). Malcolm Murray misses. Rebound secured by Joel Simons.

================================================================================
                              3RD QUARTER COMPLETE                              
================================================================================

3RD QUARTER SCORE: Team_097 21, Team_043 24

BOX SCORE:
================================================================================

Team_097
--------------------------------------------------------------------------------
Player                MIN  PTS  REB  AST  TO      FG   FG%      3P   3P%
--------------------------------------------------------------------------------
Jrue Haliburton        26   11    0    0   0   4/4   100.0     0/0   0.0
Shai Poole             25    3    1    2   0   1/5    20.0     0/0   0.0
Evan Brogdon           22    3    0    1   0   1/5    20.0     0/0   0.0
Tyrese Stewart         22    2    1    2   0   1/3    33.3     0/0   0.0
Anthony Haliburton     22    2    1    0   0   1/2    50.0     0/0   0.0
Joel Simons            15    0    2    1   0   0/0     0.0     0/0   0.0
Miles Banchero         15    0    0    0   0   0/1     0.0     0/0   0.0

TEAM: FG: 8/20 (40.0%), 3PT: 4/9 (44.4%), REB: 7 (2 off, 5 def), AST: 6, TO: 3
TEAM FOULS: 5 [Team_043 in BONUS]


Team_043
--------------------------------------------------------------------------------
Player                MIN  PTS  REB  AST  TO      FG   FG%      3P   3P%
--------------------------------------------------------------------------------
Manu Carter            22    6    5    0   0   2/4    50.0     0/0   0.0
Magic Durant           22    6    0    1   0   3/3   100.0     0/0   0.0
Dwyane Dosunmu         22    4    1    1   0   2/2   100.0     0/0   0.0
Malcolm Murray         25    4    1    1   0   2/5    40.0     0/0   0.0
D'Angelo Iverson       26    2    6    0   0   1/1   100.0     0/0   0.0
Terry Randle           15    2    0    1   0   1/1   100.0     0/0   0.0
Ben LaVine             15    0    0    1   0   0/0     0.0     0/0   0.0

TEAM: FG: 11/16 (68.8%), 3PT: 1/5 (20.0%), REB: 11 (1 off, 10 def), AST: 5, TO: 7
TEAM FOULS: 4

================================================================================

================================================================================
                       4TH QUARTER - Team_097 vs Team_043                       
================================================================================

[12:00] Team_097 possession (Score: 76-65)
Tyrese Stewart drives, picks up Manu Carter. Help arrives from Malcolm Murray! Tyrese Stewart attempts a Layup. Heavily contested by Malcolm Murray (0.5 feet, ZONE)! Tyrese Stewart misses. Rebound secured by Manu Carter.

[11:47] Team_043 possession (Score: 76-65)
Dwyane Dosunmu makes the Layup and draws the foul on Anthony Haliburton! And-1! Dwyane Dosunmu to the line for 1. [Team fouls: 1] (Anthony Haliburton: 1 personal fouls)   FT 1/1: GOOD Dwyane Dosunmu makes 1/1 from the line.
Score: 76-68

[11:34] Team_097 possession (Score: 76-68)
Jrue Haliburton drives to the basket... Jrue Haliburton loses control! Ball rolls out of bounds! TURNOVER! (dead ball)

[11:34] Substitution (Team_097): Jrue Haliburton OUT → Dwyane Ginobili IN (stamina_rule2)

[11:34] Substitution (Team_097): Shai Poole OUT → Miles Dosunmu IN (stamina_rule2)

[11:34] Substitution (Team_043): Malcolm Murray OUT → Jabari Holiday IN (stamina_rule2)

[11:34] Substitution (Team_043): D'Angelo Iverson OUT → Dirk Herro IN (stamina_rule2)

[11:18] Team_043 possession (Score: 76-68)
Jabari Holiday attempts a 3Pt. Contested by Evan Brogdon (3.6 feet, MAN). Jabari Holiday misses. FOUL! Loose ball foul on Tyrese Stewart during the rebound battle. [Team fouls: 2] No free throws, side out. (Tyrese Stewart: 1 personal fouls)

[11:01] Team_043 possession (Score: 76-68)
Magic Durant attempts a 3Pt. Contested by Dwyane Ginobili (5.1 feet, ZONE). Magic Durant misses. FOUL! Loose ball foul on Tyrese Stewart during the rebound battle. [Team fouls: 3] No free throws, side out. (Tyrese Stewart: 2 personal fouls)

[10:48] Team_043 possession (Score: 76-68)
Dwyane Dosunmu makes the Layup and draws the foul on Anthony Haliburton! And-1! Dwyane Dosunmu to the line for 1. [Team fouls: 4] (Anthony Haliburton: 2 personal fouls)   FT 1/1: GOOD Dwyane Dosunmu makes 1/1 from the line.
Score: 76-71

[10:33] Team_097 possession (Score: 76-71)
Anthony Haliburton loses the ball! Stripped by Manu Carter! TURNOVER! (live ball)

[10:22] Team_043 possession (Score: 76-71)
Dirk Herro throws a bad pass out of bounds! TURNOVER! (dead ball)

[10:05] Team_097 possession (Score: 76-71)
Miles Dosunmu attempts a Layup. Contested by Dirk Herro (2.3 feet, MAN). MILES DOSUNMU MAKES IT! Assist: Anthony Haliburton
Score: 78-71

[09:54] Team_043 possession (Score: 78-71)
Magic Durant drives, Tyrese Stewart stays with him. Magic Durant attempts a Dunk. Wide open! Tyrese Stewart is 6.3 feet away. [ZONE] MAGIC DURANT MAKES IT! Assist: Dwyane Dosunmu
Score: 78-73

[09:38] Team_097 possession (Score: 78-73)
Dwyane Ginobili drives and kicks out. Evan Brogdon attempts a 3Pt. Contested by Jabari Holiday (4.8 feet, MAN). Evan Brogdon misses. Rebound secured by Dirk Herro.

[09:21] Team_043 possession (Score: 78-73)
Magic Durant attempts a 3Pt. Heavily contested by Dwyane Ginobili (1.6 feet, MAN)! MAGIC DURANT MAKES IT! Assist: Dirk Herro
Score: 78-76

[09:03] Team_097 possession (Score: 78-76)
Evan Brogdon attempts a Midrange. Wide open! Magic Durant is 10.0 feet away. [ZONE] Evan Brogdon misses. Rebound secured by Dwyane Dosunmu.

[08:45] Team_043 possession (Score: 78-76)
Jabari Holiday drives to the basket... FOUL! Offensive foul on Jabari Holiday! Anthony Haliburton drew the charge! [Team fouls: 1] (Jabari Holiday: 1 personal fouls) TURNOVER! (dead ball)

[08:30] Team_097 possession (Score: 78-76)
Miles Dosunmu drives to the basket... Miles Dosunmu loses the ball! Stripped by Dirk Herro! TURNOVER! (live ball)

[08:19] Team_043 possession (Score: 78-76)
Dirk Herro attempts a 3Pt. Contested by Dwyane Ginobili (4.8 feet, ZONE). DIRK HERRO MAKES IT! Assist: Manu Carter
Score: 78-79

[08:06] Team_097 possession (Score: 78-79)
Dwyane Ginobili attempts a 3Pt. Contested by Jabari Holiday (3.9 feet, ZONE). DWYANE GINOBILI MAKES IT! Assist: Tyrese Stewart
Score: 81-79

[07:51] Team_043 possession (Score: 81-79)
Dwyane Dosunmu attempts a Layup. Contested by Anthony Haliburton (5.3 feet, MAN). Dwyane Dosunmu misses. Rebound secured by Miles Dosunmu.

[07:33] Team_097 possession (Score: 81-79)
Tyrese Stewart drives, picks up Manu Carter. Help arrives from Magic Durant! Tyrese Stewart attempts a Layup. Contested by Magic Durant (3.9 feet, ZONE). Tyrese Stewart misses. Rebound secured by Manu Carter.

[07:15] Team_043 possession (Score: 81-79)
FOUL! Reach-in foul on Evan Brogdon during the drive. [IN THE BONUS! 5 team fouls] Jabari Holiday to the line for 2 free throws. (Evan Brogdon: 1 personal fouls)   FT 1/2: GOOD   FT 2/2: GOOD Jabari Holiday makes 2/2 from the line.
Score: 81-81

[06:59] Team_097 possession (Score: 81-81)
Anthony Haliburton attempts a 3Pt. Wide open! Jabari Holiday is 7.2 feet away. [ZONE] ANTHONY HALIBURTON MAKES IT! Assist: Tyrese Stewart
Score: 84-81

[06:43] Team_043 possession (Score: 84-81)
Magic Durant attempts a Layup. BLOCKED BY ANTHONY HALIBURTON! Ball is loose! Rebound secured by Tyrese Stewart.

[06:29] Team_097 possession (Score: 84-81)
Miles Dosunmu drives to the basket... Miles Dosunmu loses control! Ball rolls out of bounds! TURNOVER! (dead ball)

[06:29] Substitution (Team_097): Evan Brogdon OUT → Gary Carter IN (stamina_rule2)

[06:29] Substitution (Team_097): Anthony Haliburton OUT → Joel Simons IN (stamina_rule2)

[06:29] Substitution (Team_097): Tyrese Stewart OUT → Miles Banchero IN (stamina_rule2)

[06:29] Substitution (Team_043): Magic Durant OUT → Ben LaVine IN (stamina_rule2)

[06:29] Substitution (Team_043): Manu Carter OUT → Joel Murray IN (stamina_rule2)

[06:29] Substitution (Team_043): Dwyane Dosunmu OUT → Terry Randle IN (stamina_rule2)

[06:13] Team_043 possession (Score: 84-81)
Joel Murray drives and kicks out. Joel Murray attempts a Midrange. Wide open! Joel Simons is 6.5 feet away. [MAN] Joel Murray misses. Offensive rebound by Dirk Herro! Dirk Herro puts it back in!
Score: 84-83

[05:55] Team_097 possession (Score: 84-83)
Miles Dosunmu attempts a 3Pt. Wide open! Dirk Herro is 6.4 feet away. [ZONE] MILES DOSUNMU MAKES IT! Assist: Gary Carter
Score: 87-83

[05:36] Team_043 possession (Score: 87-83)
Terry Randle drives, picks up Joel Simons. Help arrives from Dwyane Ginobili! Terry Randle attempts a Dunk. Contested by Dwyane Ginobili (5.3 feet, MAN). Terry Randle misses. Rebound secured by Miles Banchero.

[05:20] Team_097 possession (Score: 87-83)
FOUL! Shooting foul on Terry Randle. Gary Carter to the line for 2 free throws. [Team fouls: 2] (Terry Randle: 1 personal fouls)   FT 1/2: GOOD   FT 2/2: GOOD Gary Carter makes 2/2 from the line.
Score: 89-83

[05:02] Team_043 possession (Score: 89-83)
Jabari Holiday attempts a 3Pt. Wide open! Joel Simons is 8.2 feet away. [ZONE] JABARI HOLIDAY MAKES IT! Assist: Ben LaVine
Score: 89-86

[04:48] Team_097 possession (Score: 89-86)
Miles Dosunmu attempts a 3Pt. Contested by Dirk Herro (5.1 feet, MAN). MILES DOSUNMU MAKES IT! Assist: Joel Simons
Score: 92-86

[04:34] Team_043 possession (Score: 92-86)
Ben LaVine attempts a 3Pt. Contested by Dwyane Ginobili (5.8 feet, MAN). BEN LAVINE MAKES IT! Assist: Joel Murray
Score: 92-89

[04:22] Team_097 possession (Score: 92-89)
Joel Simons attempts a Midrange. Wide open! Jabari Holiday is 8.0 feet away. [ZONE] Joel Simons misses. Offensive rebound by Joel Simons! Joel Simons kicks it out.

[04:08] Team_097 possession (Score: 92-89)
FOUL! Holding foul on Terry Randle. [Team fouls: 3] No free throws, side out. (Terry Randle: 2 personal fouls)

[03:51] Team_097 possession (Score: 92-89)
Gary Carter loses control! Ball rolls out of bounds! TURNOVER! (dead ball)

[03:35] Team_043 possession (Score: 92-89)
Ben LaVine attempts a Layup. Heavily contested by Joel Simons (1.0 feet, ZONE)! Ben LaVine misses. Rebound secured by Miles Dosunmu.

[03:20] Team_097 possession (Score: 92-89)
Miles Dosunmu attempts a 3Pt. Contested by Dirk Herro (4.1 feet, ZONE). Miles Dosunmu misses. Rebound secured by Ben LaVine.

[03:04] Team_043 possession (Score: 92-89)
Jabari Holiday attempts a Midrange. Contested by Gary Carter (4.6 feet, MAN). JABARI HOLIDAY MAKES IT!
Score: 92-91

[02:48] Team_097 possession (Score: 92-91)
FOUL! Shooting foul on Terry Randle. Miles Banchero to the line for 2 free throws. [Team fouls: 4] (Terry Randle: 3 personal fouls)   FT 1/2: MISS   FT 2/2: GOOD Miles Banchero makes 1/2 from the line.
Score: 93-91

[02:33] Team_043 possession (Score: 93-91)
Terry Randle attempts a Layup. Heavily contested by Joel Simons (2.0 feet, MAN)! TERRY RANDLE MAKES IT!
Score: 93-93

[02:18] Team_097 possession (Score: 93-93)
Miles Dosunmu attempts a Layup. Contested by Dirk Herro (3.6 feet, MAN). Miles Dosunmu misses. Offensive rebound by Miles Banchero! Miles Banchero kicks it out.

[02:02] Team_097 possession (Score: 93-93)
Joel Simons attempts a Midrange. Wide open! Ben LaVine is 7.6 feet away. [ZONE] JOEL SIMONS MAKES IT!
Score: 95-93

[01:47] Team_043 possession (Score: 95-93)
Terry Randle attempts a 3Pt. Heavily contested by Joel Simons (1.5 feet, ZONE)! Terry Randle misses. Rebound secured by Miles Banchero.

[01:33] Team_097 possession (Score: 95-93)
Miles Banchero attempts a 3Pt. Contested by Dirk Herro (5.6 feet, ZONE). Miles Banchero misses. Rebound secured by Terry Randle.

[01:17] Team_043 possession (Score: 95-93)
Jabari Holiday attempts a Layup. Contested by Gary Carter (2.7 feet, MAN). JABARI HOLIDAY MAKES IT!
Score: 95-95

[01:05] Team_097 possession (Score: 95-95)
FOUL! Reach-in foul on Terry Randle during the drive. [IN THE BONUS! 5 team fouls] Miles Banchero to the line for 2 free throws. (Terry Randle: 4 personal fouls)   FT 1/2: GOOD   FT 2/2: GOOD Miles Banchero makes 2/2 from the line.
Score: 97-95

[00:49] Team_043 possession (Score: 97-95)
Terry Randle attempts a 3Pt. Contested by Joel Simons (4.6 feet, MAN). Terry Randle misses. Rebound secured by Miles Dosunmu.

[00:36] Team_097 possession (Score: 97-95)
Joel Simons drives to the basket... FOUL! Offensive foul on Joel Simons! Terry Randle drew the charge! [Team fouls: 6] (Joel Simons: 1 personal fouls) TURNOVER! (dead ball)

[00:24] Team_043 possession (Score: 97-95)
Jabari Holiday attempts a 3Pt. Contested by Gary Carter (3.2 feet, MAN). Jabari Holiday misses. Rebound secured by Miles Dosunmu.

[00:10] Team_097 possession (Score: 97-95)
FOUL! Holding foul on Ben LaVine. [IN THE BONUS! 6 team fouls] Dwyane Ginobili to the line for 2 free throws. (Ben LaVine: 1 personal fouls)   FT 1/2: GOOD   FT 2/2: GOOD Dwyane Ginobili makes 2/2 from the line.
Score: 99-95

================================================================================
                              4TH QUARTER COMPLETE                              
================================================================================

4TH QUARTER SCORE: Team_097 23, Team_043 30

BOX SCORE:
================================================================================

Team_097
--------------------------------------------------------------------------------
Player                MIN  PTS  REB  AST  TO      FG   FG%      3P   3P%
--------------------------------------------------------------------------------
Miles Dosunmu          23    8    4    0   0   3/4    75.0     0/0   0.0
Dwyane Ginobili        22    5    0    0   0   2/3    66.7     0/0   0.0
Anthony Haliburton     28    3    0    1   0   1/1   100.0     0/0   0.0
Miles Banchero         21    3    3    0   0   2/3    66.7     0/0   0.0
Gary Carter            21    2    0    1   0   1/1   100.0     0/0   0.0
Joel Simons            21    2    1    1   0   1/1   100.0     0/0   0.0
Tyrese Stewart         28    0    1    2   0   0/2     0.0     0/0   0.0
Evan Brogdon           28    0    0    0   0   0/1     0.0     0/0   0.0

TEAM: FG: 10/16 (62.5%), 3PT: 4/6 (66.7%), REB: 9 (2 off, 7 def), AST: 5, TO: 6
TEAM FOULS: 6 [Team_043 in BONUS]


Team_043
--------------------------------------------------------------------------------
Player                MIN  PTS  REB  AST  TO      FG   FG%      3P   3P%
--------------------------------------------------------------------------------
Jabari Holiday         23    9    0    0   0   4/5    80.0     0/0   0.0
Dwyane Dosunmu         28    6    1    1   0   2/3    66.7     0/0   0.0
Magic Durant           28    5    0    0   0   2/3    66.7     0/0   0.0
Dirk Herro             22    5    2    1   0   2/2   100.0     0/0   0.0
Ben LaVine             21    3    1    1   0   1/2    50.0     0/0   0.0
Terry Randle           21    2    1    0   0   1/4    25.0     0/0   0.0
Manu Carter            28    0    4    1   0   0/0     0.0     0/0   0.0
Joel Murray            21    0    0    1   0   0/0     0.0     0/0   0.0

TEAM: FG: 12/19 (63.2%), 3PT: 4/7 (57.1%), REB: 9 (3 off, 6 def), AST: 5, TO: 2
TEAM FOULS: 6 [Team_097 in BONUS]

================================================================================

================================================================================
                               FULL GAME COMPLETE                               
================================================================================

FINAL SCORE: Team_097 99, Team_043 95

SCORING BY QUARTER:
--------------------------------------------------------------------------------
Team                     Q1     Q2     Q3     Q4    FINAL
--------------------------------------------------------------------------------
Team_097                 19     36     21     23       99
Team_043                 25     16     24     30       95
--------------------------------------------------------------------------------

FULL GAME BOX SCORE:
================================================================================

Team_097
--------------------------------------------------------------------------------
Player                MIN  PTS  REB  AST  TO      FG   FG%      3P   3P%      FT STL BLK
--------------------------------------------------------------------------------
Evan Brogdon           28    8    0    2   1   4/14   28.6   4/7    57.1   2/3     0   0
Anthony Haliburton     28    9    7    4   5   3/4    75.0   1/2    50.0   0/0     2   2
Tyrese Stewart         28   10    6    4   2   5/11   45.5   0/0     0.0   0/0     1   0
Jrue Haliburton        27   14    0    0   0   5/5   100.0   3/3   100.0   4/4     0   0
Shai Poole             25    5    5    3   1   2/9    22.2   1/5    20.0   2/2     0   0
Miles Dosunmu          23   18   10    3   2   8/12   66.7   3/6    50.0   1/3     0   0
Dwyane Ginobili        22   15    0    1   2   4/8    50.0   3/5    60.0   2/2     0   0
Gary Carter            21    4    0    3   1   2/3    66.7   0/1     0.0   2/2     1   0
Joel Simons            21    4    6    3   0   2/2   100.0   0/0     0.0   0/0     1   0
Miles Banchero         21    7    7    2   0   4/8    50.0   0/2     0.0   3/4     0   1

TEAM: FG: 40/77 (51.9%), 3PT: 15/31 (48.4%), REB: 43 (9 off, 34 def), AST: 25, TO: 14


Team_043
--------------------------------------------------------------------------------
Player                MIN  PTS  REB  AST  TO      FG   FG%      3P   3P%      FT STL BLK
--------------------------------------------------------------------------------
Magic Durant           28   14    0    1   2   7/11   63.6   2/5    40.0   0/0     0   0
Manu Carter            28   11   13    5   1   3/6    50.0   1/3    33.3   2/2     2   3
Dwyane Dosunmu         28   14    4    2   4   6/10   60.0   0/0     0.0   2/2     0   0
D'Angelo Iverson       27    7   11    0   0   3/6    50.0   1/4    25.0   0/0     1   0
Malcolm Murray         25   12    1    1   1   5/10   50.0   1/4    25.0   3/3     0   0
Jabari Holiday         23   11    0    1   2   5/7    71.4   1/3    33.3   2/2     0   0
Dirk Herro             22    5    5    1   2   1/5    20.0   1/2    50.0   1/2     2   0
Ben LaVine             21    9    4    3   1   3/8    37.5   3/4    75.0   0/0     0   0
Joel Murray            21    0    0    3   0   1/2    50.0   0/1     0.0   0/0     0   0
Terry Randle           21   11    7    1   2   5/9    55.6   0/2     0.0   1/1     0   0

TEAM: FG: 39/74 (52.7%), 3PT: 10/28 (35.7%), REB: 43 (8 off, 35 def), AST: 18, TO: 15

================================================================================
