================================================================================
                        FULL GAME - Team_011 vs Team_059                        
================================================================================

================================================================================
                       1ST QUARTER - Team_011 vs Team_059                       
================================================================================

[12:00] Team_011 possession (Score: 0-0)
Evan George attempts a Midrange. Contested by Jarrett Smith (5.7 feet, MAN). Evan George misses. Rebound secured by Bam Wade.

[11:49] Team_059 possession (Score: 0-0)
FOUL! Holding foul on Pau Barnes. [Team fouls: 1] No free throws, side out. (Pau Barnes: 1 personal fouls)

[11:31] Team_059 possession (Score: 0-0)
Nikola Jokic drives and kicks out. Blake Tatum attempts a Midrange. Wide open! Trae Tatum is 7.2 feet away. [MAN] BLAKE TATUM MAKES IT! Assist: Nikola Jokic
Score: 0-2

[11:17] Team_011 possession (Score: 0-2)
Michael Carter attempts a Layup. BLOCKED BY NIKOLA JOKIC! Ball goes out off Nikola Jokic. Michael Carter's ball!

[11:02] Team_011 possession (Score: 0-2)
Pau Barnes drives and kicks out. Michael Carter attempts a Midrange. Contested by John Iverson (3.2 feet, ZONE). MICHAEL CARTER MAKES IT!
Score: 2-2

[10:48] Team_059 possession (Score: 2-2)
Nikola Jokic commits a violation (traveling/carry)! TURNOVER! (dead ball)

[10:34] Team_011 possession (Score: 2-2)
Pau Barnes drives and kicks out. Michael Carter attempts a 3Pt. Wide open! John Iverson is 7.7 feet away. [MAN] Michael Carter misses. Rebound secured by Bam Wade.

[10:20] Team_059 possession (Score: 2-2)
Jarrett Smith drives, picks up Pau Barnes. Help arrives from Magic Tatum! Jarrett Smith attempts a Layup. Contested by Magic Tatum (4.0 feet, MAN). JARRETT SMITH MAKES IT! Assist: Bam Wade
Score: 2-4

[10:02] Team_011 possession (Score: 2-4)
FOUL! Shooting foul on Bam Wade. Trae Tatum to the line for 2 free throws. [Team fouls: 1] (Bam Wade: 1 personal fouls)   FT 1/2: GOOD   FT 2/2: GOOD Trae Tatum makes 2/2 from the line.
Score: 4-4

[09:48] Team_059 possession (Score: 4-4)
John Iverson drives and kicks out. Jarrett Smith attempts a Midrange. Wide open! Trae Tatum is 7.3 feet away. [ZONE] JARRETT SMITH MAKES IT! Assist: John Iverson
Score: 4-6

[09:33] Team_011 possession (Score: 4-6)
Pau Barnes attempts a 3Pt. Wide open! Nikola Jokic is 8.3 feet away. [MAN] Pau Barnes misses. FOUL! Loose ball foul on Jarrett Smith during the rebound battle. [Team fouls: 2] No free throws, side out. (Jarrett Smith: 1 personal fouls)

[09:14] Team_011 possession (Score: 4-6)
Magic Tatum attempts a Midrange. Wide open! Bam Wade is 6.9 feet away. [MAN] Magic Tatum misses. Rebound secured by John Iverson.

[09:02] Team_059 possession (Score: 4-6)
John Iverson attempts a 3Pt. Wide open! Michael Carter is 6.5 feet away. [MAN] John Iverson misses. Rebound secured by Pau Barnes.

[08:47] Team_011 possession (Score: 4-6)
FOUL! Holding foul on Bam Wade. [Team fouls: 3] No free throws, side out. (Bam Wade: 2 personal fouls)

[08:28] Team_011 possession (Score: 4-6)
Trae Tatum attempts a Midrange. Contested by Blake Tatum (2.7 feet, MAN). Trae Tatum misses. Rebound secured by John Iverson.

[08:10] Team_059 possession (Score: 4-6)
John Iverson drives, Michael Carter stays with him. John Iverson attempts a Dunk. Contested by Michael Carter (2.6 feet, MAN). JOHN IVERSON MAKES IT!
Score: 4-8

[07:53] Team_011 possession (Score: 4-8)
Pau Barnes attempts a Layup. Contested by Nikola Jokic (4.1 feet, MAN). PAU BARNES MAKES IT!
Score: 6-8

[07:38] Team_059 possession (Score: 6-8)
Nikola Jokic makes the Dunk and draws the foul on Magic Tatum! And-1! Nikola Jokic to the line for 1. [Team fouls: 2] (Magic Tatum: 1 personal fouls)   FT 1/1: GOOD Nikola Jokic makes 1/1 from the line.
Score: 6-11

[07:19] Team_011 possession (Score: 6-11)
Magic Tatum drives to the basket... Magic Tatum throws a bad pass out of bounds! TURNOVER! (dead ball)

[07:07] Team_059 possession (Score: 6-11)
John Iverson drives and kicks out. Bam Wade attempts a Midrange. Contested by Magic Tatum (3.1 feet, MAN). Bam Wade misses. Rebound secured by Evan George.

[06:47] Team_011 possession (Score: 6-11)
FOUL! Shooting foul on Blake Tatum. Trae Tatum to the line for 2 free throws. [Team fouls: 4] (Blake Tatum: 1 personal fouls)   FT 1/2: GOOD   FT 2/2: MISS Trae Tatum makes 1/2 from the line. Rebound secured by Jarrett Smith.
Score: 7-11

[06:35] Team_059 possession (Score: 7-11)
Nikola Jokic attempts a Midrange. Contested by Pau Barnes (4.8 feet, MAN). Nikola Jokic misses. Rebound secured by Pau Barnes.

[06:23] Team_011 possession (Score: 7-11)
Trae Tatum attempts a Midrange. Heavily contested by Blake Tatum (1.8 feet, MAN)! Trae Tatum misses. Rebound secured by Bam Wade.

[06:09] Team_059 possession (Score: 7-11)
John Iverson attempts a 3Pt. Contested by Magic Tatum (2.5 feet, ZONE). JOHN IVERSON MAKES IT! Assist: Bam Wade
Score: 7-14

[05:57] Team_011 possession (Score: 7-14)
Pau Barnes makes the Layup and draws the foul on Nikola Jokic! And-1! Pau Barnes to the line for 1. [BONUS: 5 team fouls] (Nikola Jokic: 1 personal fouls)   FT 1/1: GOOD Pau Barnes makes 1/1 from the line.
Score: 10-14

[05:42] Team_059 possession (Score: 10-14)
Bam Wade drives and kicks out. John Iverson attempts a Midrange. Heavily contested by Michael Carter (1.8 feet, MAN)! JOHN IVERSON MAKES IT! Assist: Bam Wade
Score: 10-16

[05:31] Team_011 possession (Score: 10-16)
FOUL! Shooting foul on Bam Wade. Magic Tatum to the line for 2 free throws. [BONUS: 6 team fouls] (Bam Wade: 3 personal fouls)   FT 1/2: GOOD   FT 2/2: MISS Magic Tatum makes 1/2 from the line. Rebound secured by John Iverson.
Score: 11-16

[05:16] Team_059 possession (Score: 11-16)
Bam Wade attempts a 3Pt. Contested by Magic Tatum (3.4 feet, MAN). Bam Wade misses. Offensive rebound by John Iverson! John Iverson kicks it out.

[05:02] Team_059 possession (Score: 11-16)
Jarrett Smith drives and kicks out. John Iverson attempts a 3Pt. Contested by Magic Tatum (3.5 feet, ZONE). John Iverson misses. Rebound secured by Evan George.

[04:50] Team_011 possession (Score: 11-16)
Evan George attempts a Midrange. Wide open! Jarrett Smith is 6.8 feet away. [MAN] Evan George misses. Rebound secured by John Iverson.

[04:37] Team_059 possession (Score: 11-16)
Blake Tatum drives to the basket... Blake Tatum throws a bad pass out of bounds! TURNOVER! (dead ball)

[04:19] Team_011 possession (Score: 11-16)
Michael Carter attempts a 3Pt. Wide open! John Iverson is 7.6 feet away. [MAN] Michael Carter misses. Rebound secured by Jarrett Smith.

[04:03] Team_059 possession (Score: 11-16)
FOUL! Shooting foul on Pau Barnes. Nikola Jokic to the line for 2 free throws. [Team fouls: 3] (Pau Barnes: 2 personal fouls)   FT 1/2: GOOD   FT 2/2: GOOD Nikola Jokic makes 2/2 from the line.
Score: 11-18

[03:46] Team_011 possession (Score: 11-18)
FOUL! Shooting foul on Bam Wade. Michael Carter to the line for 3 free throws. [BONUS: 7 team fouls] (Bam Wade: 4 personal fouls)   FT 1/3: GOOD   FT 2/3: GOOD   FT 3/3: GOOD Michael Carter makes 3/3 from the line.
Score: 14-18

[03:31] Team_059 possession (Score: 14-18)
Blake Tatum attempts a Midrange. Contested by Trae Tatum (5.1 feet, ZONE). Blake Tatum misses. Rebound secured by Pau Barnes.

[03:20] Team_011 possession (Score: 14-18)
Michael Carter drives and kicks out. Evan George attempts a Midrange. Wide open! Jarrett Smith is 6.7 feet away. [MAN] Evan George misses. Rebound secured by Bam Wade.

[03:01] Team_059 possession (Score: 14-18)
John Iverson attempts a 3Pt. Wide open! Magic Tatum is 7.6 feet away. [ZONE] JOHN IVERSON MAKES IT! Assist: Nikola Jokic
Score: 14-21

[02:43] Team_011 possession (Score: 14-21)
Evan George drives and kicks out. Michael Carter attempts a 3Pt. Contested by John Iverson (4.6 feet, MAN). Michael Carter misses. Rebound secured by John Iverson.

[02:31] Team_059 possession (Score: 14-21)
Nikola Jokic attempts a Layup. Heavily contested by Pau Barnes (1.5 feet, ZONE)! NIKOLA JOKIC MAKES IT! Assist: Bam Wade
Score: 14-23

[02:15] Team_011 possession (Score: 14-23)
Michael Carter makes the Layup and draws the foul on John Iverson! And-1! Michael Carter to the line for 1. [BONUS: 8 team fouls] (John Iverson: 1 personal fouls)   FT 1/1: GOOD Michael Carter makes 1/1 from the line.
Score: 17-23

[01:59] Team_059 possession (Score: 17-23)
FOUL! Shooting foul on Pau Barnes. John Iverson to the line for 2 free throws. [Team fouls: 4] (Pau Barnes: 3 personal fouls)   FT 1/2: GOOD   FT 2/2: GOOD John Iverson makes 2/2 from the line.
Score: 17-25

[01:46] Team_011 possession (Score: 17-25)
Trae Tatum attempts a 3Pt. Contested by Bam Wade (3.4 feet, ZONE). Trae Tatum misses. Rebound secured by Jarrett Smith.

[01:29] Team_059 possession (Score: 17-25)
Jarrett Smith throws a bad pass out of bounds! TURNOVER! (dead ball)

[01:29] Substitution (Team_011): Magic Tatum OUT → Shai Leonard IN (stamina_rule2)

[01:29] Substitution (Team_011): Trae Tatum OUT → De'Aaron George IN (stamina_rule2)

[01:29] Substitution (Team_011): Michael Carter OUT → Tyrese Nowitzki IN (stamina_rule2)

[01:29] Substitution (Team_011): Pau Barnes OUT → Russell Davis IN (stamina_rule2)

[01:29] Substitution (Team_011): Evan George OUT → Pau Towns IN (stamina_rule2)

[01:29] Substitution (Team_059): Bam Wade OUT → Russell Quickley IN (stamina_rule2)

[01:29] Substitution (Team_059): Blake Tatum OUT → Scottie Ginobili IN (stamina_rule2)

[01:29] Substitution (Team_059): John Iverson OUT → Allen Giddey IN (stamina_rule2)

[01:29] Substitution (Team_059): Nikola Jokic OUT → Bones Middleton IN (stamina_rule2)

[01:29] Substitution (Team_059): Jarrett Smith OUT → LeBron Lowry IN (stamina_rule2)

[01:15] Team_011 possession (Score: 17-25)
Shai Leonard attempts a 3Pt. Contested by Russell Quickley (5.3 feet, ZONE). Shai Leonard misses. Rebound secured by Scottie Ginobili.

[01:00] Team_059 possession (Score: 17-25)
LeBron Lowry attempts a 3Pt. Contested by Shai Leonard (3.6 feet, ZONE). LeBron Lowry misses. Rebound secured by Pau Towns.

[00:48] Team_011 possession (Score: 17-25)
Tyrese Nowitzki attempts a Midrange. Wide open! Allen Giddey is 7.3 feet away. [ZONE] TYRESE NOWITZKI MAKES IT! Assist: De'Aaron George
Score: 19-25

[00:33] Team_059 possession (Score: 19-25)
Allen Giddey attempts a 3Pt. Contested by Shai Leonard (4.2 feet, ZONE). Allen Giddey misses. Rebound secured by Tyrese Nowitzki.

[00:13] Team_011 possession (Score: 19-25)
Pau Towns attempts a Midrange. Contested by Scottie Ginobili (5.0 feet, ZONE). Pau Towns misses. Rebound secured by Bones Middleton.

================================================================================
                              1ST QUARTER COMPLETE                              
================================================================================

1ST QUARTER SCORE: Team_011 19, Team_059 25

BOX SCORE:
================================================================================

Team_011
--------------------------------------------------------------------------------
Player                MIN  PTS  REB  AST  TO      FG   FG%      3P   3P%
--------------------------------------------------------------------------------
Michael Carter         11    8    0    0   0   3/5    60.0     0/0   0.0
Pau Barnes             11    5    4    0   0   2/3    66.7     0/0   0.0
Trae Tatum             11    2    0    0   0   1/5    20.0     0/0   0.0
Tyrese Nowitzki         1    2    1    0   0   1/1   100.0     0/0   0.0
Evan George            11    0    2    0   0   0/3     0.0     0/0   0.0
Magic Tatum            11    0    0    0   0   0/2     0.0     0/0   0.0
Shai Leonard            1    0    0    0   0   0/1     0.0     0/0   0.0
Pau Towns               1    0    1    0   0   0/1     0.0     0/0   0.0
De'Aaron George         1    0    0    1   0   0/0     0.0     0/0   0.0

TEAM: FG: 7/21 (33.3%), 3PT: 1/4 (25.0%), REB: 8 (1 off, 7 def), AST: 1, TO: 1
TEAM FOULS: 4


Team_059
--------------------------------------------------------------------------------
Player                MIN  PTS  REB  AST  TO      FG   FG%      3P   3P%
--------------------------------------------------------------------------------
John Iverson           11   12    6    1   0   5/7    71.4     0/0   0.0
Nikola Jokic           11    7    0    2   0   3/4    75.0     0/0   0.0
Jarrett Smith          11    4    3    0   0   2/3    66.7     0/0   0.0
Blake Tatum            11    2    0    0   0   1/2    50.0     0/0   0.0
Bam Wade               11    0    4    4   0   0/0     0.0     0/0   0.0
Scottie Ginobili        1    0    1    0   0   0/0     0.0     0/0   0.0
LeBron Lowry            1    0    0    0   0   0/1     0.0     0/0   0.0
Allen Giddey            1    0    0    0   0   0/1     0.0     0/0   0.0
Bones Middleton         1    0    1    0   0   0/0     0.0     0/0   0.0

TEAM: FG: 11/18 (61.1%), 3PT: 2/5 (40.0%), REB: 15 (1 off, 14 def), AST: 7, TO: 3
TEAM FOULS: 8 [Team_011 in BONUS]

================================================================================

================================================================================
                       2ND QUARTER - Team_011 vs Team_059                       
================================================================================

[12:00] Team_011 possession (Score: 19-25)
Magic Tatum makes the Midrange and draws the foul on Blake Tatum! And-1! Magic Tatum to the line for 1. [Team fouls: 1] (Blake Tatum: 1 personal fouls)   FT 1/1: GOOD Magic Tatum makes 1/1 from the line.
Score: 22-25

[11:43] Team_059 possession (Score: 22-25)
Bam Wade drives, Pau Barnes stays with him. Bam Wade attempts a Layup. Contested by Pau Barnes (2.4 feet, ZONE). BAM WADE MAKES IT! Assist: John Iverson
Score: 22-27

[11:30] Team_011 possession (Score: 22-27)
Magic Tatum attempts a Midrange. Wide open! Blake Tatum is 7.3 feet away. [ZONE] MAGIC TATUM MAKES IT!
Score: 24-27

[11:15] Team_059 possession (Score: 24-27)
John Iverson drives to the basket... John Iverson throws a bad pass! Stolen by Pau Barnes! TURNOVER! (live ball)

[11:01] Team_011 possession (Score: 24-27)
FOUL! Holding foul on Nikola Jokic. [Team fouls: 2] No free throws, side out. (Nikola Jokic: 1 personal fouls)

[10:44] Team_011 possession (Score: 24-27)
Pau Barnes attempts a 3Pt. Wide open! Bam Wade is 7.3 feet away. [ZONE] Pau Barnes misses. Rebound secured by Jarrett Smith.

[10:29] Team_059 possession (Score: 24-27)
Jarrett Smith attempts a Layup. Contested by Pau Barnes (3.6 feet, ZONE). Jarrett Smith misses. Rebound secured by Michael Carter.

[10:17] Team_011 possession (Score: 24-27)
Evan George makes the Layup and draws the foul on Jarrett Smith! And-1! Evan George to the line for 1. [Team fouls: 3] (Jarrett Smith: 1 personal fouls)   FT 1/1: GOOD Evan George makes 1/1 from the line.
Score: 27-27

[09:59] Team_059 possession (Score: 27-27)
Bam Wade throws a bad pass out of bounds! TURNOVER! (dead ball)

[09:59] Substitution (Team_011): Trae Tatum OUT → De'Aaron George IN (stamina_rule2)

[09:59] Substitution (Team_011): Michael Carter OUT → Tyrese Nowitzki IN (stamina_rule2)

[09:59] Substitution (Team_011): Pau Barnes OUT → Russell Davis IN (stamina_rule2)

[09:59] Substitution (Team_011): Evan George OUT → Pau Towns IN (stamina_rule2)

[09:59] Substitution (Team_059): Bam Wade OUT → Russell Quickley IN (stamina_rule2)

[09:59] Substitution (Team_059): Blake Tatum OUT → Scottie Ginobili IN (stamina_rule2)

[09:59] Substitution (Team_059): John Iverson OUT → Allen Giddey IN (stamina_rule2)

[09:47] Team_011 possession (Score: 27-27)
Magic Tatum makes the Dunk and draws the foul on Scottie Ginobili! And-1! Magic Tatum to the line for 1. [Team fouls: 4] (Scottie Ginobili: 1 personal fouls)   FT 1/1: MISS Magic Tatum makes 0/1 from the line. Offensive rebound by Pau Towns! Pau Towns kicks it out.
Score: 29-27

[09:35] Team_011 possession (Score: 29-27)
Pau Towns makes the Dunk and draws the foul on Jarrett Smith! And-1! Pau Towns to the line for 1. [BONUS: 5 team fouls] (Jarrett Smith: 2 personal fouls)   FT 1/1: GOOD Pau Towns makes 1/1 from the line.
Score: 32-27

[09:21] Team_059 possession (Score: 32-27)
FOUL! Shooting foul on Magic Tatum. Allen Giddey to the line for 3 free throws. [Team fouls: 1] (Magic Tatum: 1 personal fouls)   FT 1/3: GOOD   FT 2/3: MISS   FT 3/3: GOOD Allen Giddey makes 2/3 from the line.
Score: 32-29

[09:05] Team_011 possession (Score: 32-29)
Pau Towns attempts a Midrange. Contested by Allen Giddey (3.7 feet, ZONE). PAU TOWNS MAKES IT!
Score: 34-29

[08:50] Team_059 possession (Score: 34-29)
Jarrett Smith attempts a Layup. Wide open! Russell Davis is 6.2 feet away. [ZONE] Jarrett Smith misses. Rebound secured by Pau Towns.

[08:33] Team_011 possession (Score: 34-29)
Magic Tatum attempts a 3Pt. Contested by Russell Quickley (4.6 feet, MAN). Magic Tatum misses. Rebound secured by Jarrett Smith.

[08:18] Team_059 possession (Score: 34-29)
Scottie Ginobili attempts a 3Pt. Heavily contested by Magic Tatum (1.4 feet, ZONE)! Scottie Ginobili misses. Rebound secured by Pau Towns.

[08:06] Team_011 possession (Score: 34-29)
Tyrese Nowitzki attempts a 3Pt. Contested by Scottie Ginobili (3.6 feet, ZONE). Tyrese Nowitzki misses. Rebound secured by Jarrett Smith.

[07:51] Team_059 possession (Score: 34-29)
Scottie Ginobili attempts a Layup. BLOCKED BY RUSSELL DAVIS! Ball is loose! Rebound secured by Tyrese Nowitzki.

[07:35] Team_011 possession (Score: 34-29)
Magic Tatum attempts a 3Pt. Contested by Russell Quickley (5.8 feet, MAN). Magic Tatum misses. Rebound secured by Nikola Jokic.

[07:19] Team_059 possession (Score: 34-29)
Allen Giddey attempts a Layup. Contested by Tyrese Nowitzki (3.1 feet, MAN). Allen Giddey misses. Rebound secured by Pau Towns.

[07:06] Team_011 possession (Score: 34-29)
Tyrese Nowitzki attempts a 3Pt. Contested by Russell Quickley (4.6 feet, ZONE). Tyrese Nowitzki misses. Rebound secured by Jarrett Smith.

[06:55] Team_059 possession (Score: 34-29)
FOUL! Holding foul on De'Aaron George. [Team fouls: 2] No free throws, side out. (De'Aaron George: 1 personal fouls)

[06:41] Team_059 possession (Score: 34-29)
Russell Quickley attempts a 3Pt. Wide open! Magic Tatum is 6.6 feet away. [MAN] Russell Quickley misses. FOUL! Loose ball foul on Tyrese Nowitzki during the rebound battle. [Team fouls: 3] No free throws, side out. (Tyrese Nowitzki: 1 personal fouls)

[06:23] Team_059 possession (Score: 34-29)
FOUL! Shooting foul on Tyrese Nowitzki. Allen Giddey to the line for 3 free throws. [Team fouls: 4] (Tyrese Nowitzki: 2 personal fouls)   FT 1/3: GOOD   FT 2/3: GOOD   FT 3/3: GOOD Allen Giddey makes 3/3 from the line.
Score: 34-32

[06:09] Team_011 possession (Score: 34-32)
Magic Tatum attempts a 3Pt. Wide open! Russell Quickley is 6.2 feet away. [ZONE] Magic Tatum misses. Rebound secured by Nikola Jokic.

[05:52] Team_059 possession (Score: 34-32)
Nikola Jokic attempts a Layup. Contested by Russell Davis (4.2 feet, MAN). Nikola Jokic misses. FOUL! Loose ball foul on Tyrese Nowitzki during the rebound battle. [IN THE BONUS! 5 team fouls] Scottie Ginobili to the line for 2 free throws. (Tyrese Nowitzki: 3 personal fouls)   FT 1/2: GOOD   FT 2/2: GOOD Scottie Ginobili makes 2/2 from the line.
Score: 34-34

[05:37] Team_011 possession (Score: 34-34)
Pau Towns attempts a Midrange. Wide open! Jarrett Smith is 7.2 feet away. [MAN] PAU TOWNS MAKES IT! Assist: Magic Tatum
Score: 36-34

[05:21] Team_059 possession (Score: 36-34)
Allen Giddey attempts a Layup. Heavily contested by Russell Davis (1.8 feet, ZONE)! Allen Giddey misses. Rebound secured by Pau Towns.

[05:08] Team_011 possession (Score: 36-34)
Russell Davis attempts a Midrange. Wide open! Allen Giddey is 9.5 feet away. [ZONE] Russell Davis misses. Rebound secured by Nikola Jokic.

[04:56] Team_059 possession (Score: 36-34)
Scottie Ginobili drives and kicks out. Scottie Ginobili attempts a Midrange. Contested by De'Aaron George (4.7 feet, MAN). Scottie Ginobili misses. Offensive rebound by Scottie Ginobili! Scottie Ginobili kicks it out.

[04:43] Team_059 possession (Score: 36-34)
FOUL! Shooting foul on Russell Davis. Jarrett Smith to the line for 2 free throws. [BONUS: 6 team fouls] (Russell Davis: 1 personal fouls)   FT 1/2: GOOD   FT 2/2: GOOD Jarrett Smith makes 2/2 from the line.
Score: 36-36

[04:28] Team_011 possession (Score: 36-36)
Magic Tatum attempts a 3Pt. Contested by Russell Quickley (3.4 feet, ZONE). Magic Tatum misses. Rebound secured by Scottie Ginobili.

[04:17] Team_059 possession (Score: 36-36)
Scottie Ginobili attempts a 3Pt. Wide open! De'Aaron George is 7.4 feet away. [MAN] Scottie Ginobili misses. Rebound secured by Tyrese Nowitzki.

[04:01] Team_011 possession (Score: 36-36)
Tyrese Nowitzki attempts a Layup. BLOCKED BY JARRETT SMITH! Ball deflects out of bounds off Tyrese Nowitzki.

[03:46] Team_059 possession (Score: 36-36)
Nikola Jokic drives, picks up Russell Davis. Help arrives from Magic Tatum! Nikola Jokic attempts a Dunk. Heavily contested by Magic Tatum (1.7 feet, MAN)! Nikola Jokic misses. Offensive rebound by Scottie Ginobili! Scottie Ginobili kicks it out.

[03:32] Team_059 possession (Score: 36-36)
FOUL! Shooting foul on Magic Tatum. Russell Quickley to the line for 3 free throws. [BONUS: 7 team fouls] (Magic Tatum: 2 personal fouls)   FT 1/3: GOOD   FT 2/3: GOOD   FT 3/3: GOOD Russell Quickley makes 3/3 from the line.
Score: 36-39

[03:20] Team_011 possession (Score: 36-39)
Tyrese Nowitzki drives, picks up Jarrett Smith. Help arrives from Scottie Ginobili! Tyrese Nowitzki attempts a Dunk. Heavily contested by Scottie Ginobili (1.5 feet, ZONE)! Tyrese Nowitzki misses. Offensive rebound by Pau Towns! Pau Towns kicks it out.

[03:06] Team_011 possession (Score: 36-39)
Magic Tatum attempts a 3Pt. Contested by Russell Quickley (4.1 feet, MAN). Magic Tatum misses. Rebound secured by Jarrett Smith.

[02:54] Team_059 possession (Score: 36-39)
Nikola Jokic attempts a 3Pt. Contested by Magic Tatum (5.1 feet, ZONE). NIKOLA JOKIC MAKES IT! Assist: Allen Giddey
Score: 36-42

[02:36] Team_011 possession (Score: 36-42)
Pau Towns attempts a Midrange. Contested by Jarrett Smith (4.1 feet, MAN). PAU TOWNS MAKES IT!
Score: 38-42

[02:19] Team_059 possession (Score: 38-42)
Allen Giddey attempts a 3Pt. Contested by Magic Tatum (5.2 feet, ZONE). Allen Giddey misses. Rebound secured by Russell Davis.

[02:05] Team_011 possession (Score: 38-42)
Magic Tatum drives, Jarrett Smith stays with him. Magic Tatum attempts a Layup. Contested by Jarrett Smith (3.0 feet, ZONE). MAGIC TATUM MAKES IT!
Score: 40-42

[01:48] Team_059 possession (Score: 40-42)
Nikola Jokic attempts a Midrange. Contested by Russell Davis (2.2 feet, MAN). Nikola Jokic misses. Offensive rebound by Jarrett Smith! Jarrett Smith kicks it out.

[01:35] Team_059 possession (Score: 40-42)
Russell Quickley drives, Magic Tatum stays with him. Russell Quickley attempts a Dunk. Wide open! Magic Tatum is 8.5 feet away. [MAN] Russell Quickley misses. Rebound secured by Tyrese Nowitzki.

[01:25] Team_011 possession (Score: 40-42)
Russell Davis attempts a 3Pt. Wide open! Nikola Jokic is 8.4 feet away. [MAN] RUSSELL DAVIS MAKES IT! Assist: Magic Tatum
Score: 43-42

[01:11] Team_059 possession (Score: 43-42)
FOUL! Shooting foul on Russell Davis. Allen Giddey to the line for 2 free throws. [BONUS: 8 team fouls] (Russell Davis: 2 personal fouls)   FT 1/2: GOOD   FT 2/2: GOOD Allen Giddey makes 2/2 from the line.
Score: 43-44

[00:56] Team_011 possession (Score: 43-44)
Russell Davis attempts a 3Pt. Contested by Russell Quickley (3.5 feet, ZONE). RUSSELL DAVIS MAKES IT! Assist: Pau Towns
Score: 46-44

[00:40] Team_059 possession (Score: 46-44)
Allen Giddey commits a violation (traveling/carry)! TURNOVER! (dead ball)

[00:40] Substitution (Team_011): Magic Tatum OUT → Shai Leonard IN (stamina_rule2)

[00:40] Substitution (Team_059): Nikola Jokic OUT → Bones Middleton IN (stamina_rule2)

[00:40] Substitution (Team_059): Jarrett Smith OUT → LeBron Lowry IN (stamina_rule2)

[00:31] Team_011 possession (Score: 46-44)
Tyrese Nowitzki attempts a 3Pt. Wide open! Russell Quickley is 8.3 feet away. [ZONE] TYRESE NOWITZKI MAKES IT! Assist: Shai Leonard
Score: 49-44

[00:13] Team_059 possession (Score: 49-44)
Bones Middleton attempts a Layup. Contested by Russell Davis (4.6 feet, ZONE). BONES MIDDLETON MAKES IT! Assist: Russell Quickley
Score: 49-46

================================================================================
                              2ND QUARTER COMPLETE                              
================================================================================

2ND QUARTER SCORE: Team_011 30, Team_059 21

BOX SCORE:
================================================================================

Team_011
--------------------------------------------------------------------------------
Player                MIN  PTS  REB  AST  TO      FG   FG%      3P   3P%
--------------------------------------------------------------------------------
Pau Towns              11    9    6    1   0   4/4   100.0     0/0   0.0
Magic Tatum            22    7    0    2   0   3/8    37.5     0/0   0.0
Russell Davis          11    6    1    0   0   2/3    66.7     0/0   0.0
Evan George            13    3    0    0   0   1/1   100.0     0/0   0.0
Tyrese Nowitzki        11    3    3    0   0   1/4    25.0     0/0   0.0
Pau Barnes             13    0    0    0   0   0/1     0.0     0/0   0.0
Michael Carter         13    0    1    0   0   0/0     0.0     0/0   0.0
Shai Leonard            2    0    0    1   0   0/0     0.0     0/0   0.0

TEAM: FG: 11/21 (52.4%), 3PT: 3/11 (27.3%), REB: 11 (2 off, 9 def), AST: 4, TO: 0
TEAM FOULS: 8 [Team_059 in BONUS]


Team_059
--------------------------------------------------------------------------------
Player                MIN  PTS  REB  AST  TO      FG   FG%      3P   3P%
--------------------------------------------------------------------------------
Allen Giddey           11    7    0    1   0   3/6    50.0     0/0   0.0
Nikola Jokic           22    3    3    0   0   1/1   100.0     0/0   0.0
Russell Quickley       11    3    0    1   0   1/2    50.0     0/0   0.0
Bam Wade               13    2    0    0   0   1/1   100.0     0/0   0.0
Jarrett Smith          22    2    6    0   0   1/3    33.3     0/0   0.0
Scottie Ginobili       11    2    4    0   0   1/4    25.0     0/0   0.0
Bones Middleton         2    2    0    0   0   1/1   100.0     0/0   0.0
John Iverson           13    0    0    1   0   0/0     0.0     0/0   0.0

TEAM: FG: 9/18 (50.0%), 3PT: 4/7 (57.1%), REB: 13 (4 off, 9 def), AST: 3, TO: 3
TEAM FOULS: 5 [Team_011 in BONUS]

================================================================================

================================================================================
                       3RD QUARTER - Team_011 vs Team_059                       
================================================================================

[12:00] Team_011 possession (Score: 49-46)
Michael Carter attempts a 3Pt. Wide open! John Iverson is 7.2 feet away. [MAN] MICHAEL CARTER MAKES IT! Assist: Trae Tatum
Score: 52-46

[11:47] Team_059 possession (Score: 52-46)
Jarrett Smith drives to the basket... Jarrett Smith throws a bad pass out of bounds! TURNOVER! (dead ball)

[11:33] Team_011 possession (Score: 52-46)
Trae Tatum drives, Blake Tatum stays with him. Trae Tatum attempts a Layup. Contested by Blake Tatum (5.4 feet, MAN). Trae Tatum misses. Rebound secured by John Iverson.

[11:17] Team_059 possession (Score: 52-46)
John Iverson attempts a Layup. Heavily contested by Michael Carter (0.8 feet, MAN)! John Iverson misses. Rebound secured by Michael Carter.

[10:58] Team_011 possession (Score: 52-46)
Magic Tatum attempts a 3Pt. Contested by Bam Wade (5.0 feet, MAN). MAGIC TATUM MAKES IT! Assist: Evan George
Score: 55-46

[10:42] Team_059 possession (Score: 55-46)
Blake Tatum attempts a Midrange. Contested by Magic Tatum (3.8 feet, ZONE). BLAKE TATUM MAKES IT! Assist: John Iverson
Score: 55-48

[10:27] Team_011 possession (Score: 55-48)
FOUL! Shooting foul on Blake Tatum. Trae Tatum to the line for 2 free throws. [Team fouls: 1] (Blake Tatum: 1 personal fouls)   FT 1/2: GOOD   FT 2/2: MISS Trae Tatum makes 1/2 from the line. Rebound secured by John Iverson.
Score: 56-48

[10:15] Team_059 possession (Score: 56-48)
FOUL! Shooting foul on Pau Barnes. Bam Wade to the line for 2 free throws. [Team fouls: 1] (Pau Barnes: 1 personal fouls)   FT 1/2: GOOD   FT 2/2: GOOD Bam Wade makes 2/2 from the line.
Score: 56-50

[10:00] Team_011 possession (Score: 56-50)
Michael Carter throws a bad pass out of bounds! TURNOVER! (dead ball)

[09:46] Team_059 possession (Score: 56-50)
Bam Wade attempts a Midrange. Wide open! Magic Tatum is 7.9 feet away. [MAN] Bam Wade misses. Rebound secured by Pau Barnes.

[09:28] Team_011 possession (Score: 56-50)
Pau Barnes attempts a 3Pt. Contested by Bam Wade (4.5 feet, ZONE). PAU BARNES MAKES IT! Assist: Michael Carter
Score: 59-50

[09:16] Team_059 possession (Score: 59-50)
John Iverson attempts a 3Pt. Heavily contested by Michael Carter (1.8 feet, MAN)! JOHN IVERSON MAKES IT! Assist: Bam Wade
Score: 59-53

[09:00] Team_011 possession (Score: 59-53)
Trae Tatum attempts a Midrange. Contested by Blake Tatum (2.2 feet, MAN). Trae Tatum misses. Rebound secured by John Iverson.

[08:46] Team_059 possession (Score: 59-53)
Nikola Jokic attempts a 3Pt. Heavily contested by Magic Tatum (1.2 feet, ZONE)! Nikola Jokic misses. Rebound secured by Pau Barnes.

[08:30] Team_011 possession (Score: 59-53)
Pau Barnes attempts a Dunk. BLOCKED BY JARRETT SMITH! Ball is loose! Rebound secured by John Iverson.

[08:15] Team_059 possession (Score: 59-53)
Nikola Jokic throws a bad pass! Stolen by Pau Barnes! TURNOVER! (live ball)

[08:00] Team_011 possession (Score: 59-53)
Evan George attempts a Midrange. BLOCKED BY JARRETT SMITH! Ball is loose! Rebound secured by Bam Wade.

[07:50] Team_059 possession (Score: 59-53)
Blake Tatum drives to the basket... Blake Tatum throws a bad pass out of bounds! TURNOVER! (dead ball)

[07:33] Team_011 possession (Score: 59-53)
Trae Tatum drives, picks up Blake Tatum. Help arrives from Bam Wade! Trae Tatum attempts a Dunk. Contested by Bam Wade (2.9 feet, MAN). TRAE TATUM MAKES IT! Assist: Evan George
Score: 61-53

[07:19] Team_059 possession (Score: 61-53)
Blake Tatum drives to the basket... Blake Tatum throws a bad pass! Stolen by Pau Barnes! TURNOVER! (live ball)

[07:03] Team_011 possession (Score: 61-53)
Evan George commits a violation (traveling/carry)! TURNOVER! (dead ball)

[06:51] Team_059 possession (Score: 61-53)
FOUL! Offensive foul on Jarrett Smith! Pau Barnes drew the charge! [Team fouls: 2] (Jarrett Smith: 1 personal fouls) TURNOVER! (dead ball)

[06:38] Team_011 possession (Score: 61-53)
Magic Tatum makes the Layup and draws the foul on Bam Wade! And-1! Magic Tatum to the line for 1. [Team fouls: 3] (Bam Wade: 1 personal fouls)   FT 1/1: GOOD Magic Tatum makes 1/1 from the line.
Score: 64-53

[06:24] Team_059 possession (Score: 64-53)
Bam Wade attempts a 3Pt. Wide open! Michael Carter is 8.8 feet away. [ZONE] Bam Wade misses. Rebound secured by Pau Barnes.

[06:11] Team_011 possession (Score: 64-53)
Trae Tatum attempts a 3Pt. Contested by Blake Tatum (4.6 feet, MAN). Trae Tatum misses. Offensive rebound by Evan George! Evan George puts it back in!
Score: 66-53

[05:59] Team_059 possession (Score: 66-53)
Jarrett Smith attempts a Midrange. Wide open! Michael Carter is 7.3 feet away. [ZONE] JARRETT SMITH MAKES IT!
Score: 66-55

[05:47] Team_011 possession (Score: 66-55)
Pau Barnes attempts a Layup. Contested by Nikola Jokic (4.7 feet, MAN). PAU BARNES MAKES IT!
Score: 68-55

[05:31] Team_059 possession (Score: 68-55)
John Iverson attempts a Midrange. Wide open! Trae Tatum is 6.9 feet away. [ZONE] JOHN IVERSON MAKES IT! Assist: Bam Wade
Score: 68-57

[05:19] Team_011 possession (Score: 68-57)
Evan George attempts a Layup. BLOCKED BY JARRETT SMITH! Ball goes out off Jarrett Smith. Evan George's ball!

[05:03] Team_011 possession (Score: 68-57)
Magic Tatum attempts a Midrange. Contested by Nikola Jokic (5.5 feet, ZONE). Magic Tatum misses. Rebound secured by Jarrett Smith.

[04:51] Team_059 possession (Score: 68-57)
Jarrett Smith drives to the basket... Jarrett Smith throws a bad pass! Stolen by Pau Barnes! TURNOVER! (live ball)

[04:37] Team_011 possession (Score: 68-57)
FOUL! Offensive foul on Michael Carter! John Iverson drew the charge! [Team fouls: 2] (Michael Carter: 1 personal fouls) TURNOVER! (dead ball)

[04:24] Team_059 possession (Score: 68-57)
Jarrett Smith drives to the basket... Jarrett Smith loses the ball! Stripped by Pau Barnes! TURNOVER! (live ball)

[04:12] Team_011 possession (Score: 68-57)
Trae Tatum attempts a 3Pt. Wide open! Bam Wade is 6.5 feet away. [ZONE] TRAE TATUM MAKES IT! Assist: Magic Tatum
Score: 71-57

[04:01] Team_059 possession (Score: 71-57)
Jarrett Smith attempts a Layup. Contested by Pau Barnes (5.5 feet, ZONE). Jarrett Smith misses. Rebound secured by Pau Barnes.

[03:47] Team_011 possession (Score: 71-57)
Michael Carter drives and kicks out. Michael Carter attempts a 3Pt. Heavily contested by Bam Wade (1.1 feet, ZONE)! Michael Carter misses. Rebound secured by John Iverson.

[03:28] Team_059 possession (Score: 71-57)
John Iverson attempts a 3Pt. Contested by Magic Tatum (3.9 feet, ZONE). JOHN IVERSON MAKES IT! Assist: Bam Wade
Score: 71-60

[03:10] Team_011 possession (Score: 71-60)
Evan George loses the ball! Stripped by Jarrett Smith! TURNOVER! (live ball)

[02:58] Team_059 possession (Score: 71-60)
Nikola Jokic attempts a 3Pt. Contested by Michael Carter (5.3 feet, ZONE). Nikola Jokic misses. Rebound secured by Pau Barnes.

[02:41] Team_011 possession (Score: 71-60)
Trae Tatum throws a bad pass out of bounds! TURNOVER! (dead ball)

[02:41] Substitution (Team_011): Trae Tatum OUT → De'Aaron George IN (stamina_rule2)

[02:41] Substitution (Team_011): Michael Carter OUT → Tyrese Nowitzki IN (stamina_rule2)

[02:41] Substitution (Team_011): Pau Barnes OUT → Russell Davis IN (stamina_rule2)

[02:41] Substitution (Team_011): Evan George OUT → Pau Towns IN (stamina_rule2)

[02:41] Substitution (Team_059): John Iverson OUT → Allen Giddey IN (stamina_rule2)

[02:22] Team_059 possession (Score: 71-60)
Jarrett Smith drives, Russell Davis stays with him. Jarrett Smith attempts a Layup. Contested by Russell Davis (2.0 feet, ZONE). Jarrett Smith misses. Rebound secured by Russell Davis.

[02:04] Team_011 possession (Score: 71-60)
FOUL! Reach-in foul on Jarrett Smith during the drive. [Team fouls: 4] No free throws, side out. (Jarrett Smith: 2 personal fouls)

[01:52] Team_011 possession (Score: 71-60)
De'Aaron George attempts a 3Pt. Wide open! Allen Giddey is 6.8 feet away. [ZONE] DE'AARON GEORGE MAKES IT! Assist: Magic Tatum
Score: 74-60

[01:35] Team_059 possession (Score: 74-60)
Nikola Jokic drives and kicks out. Jarrett Smith attempts a Midrange. Heavily contested by Russell Davis (1.3 feet, ZONE)! Jarrett Smith misses. Rebound secured by Tyrese Nowitzki.

[01:21] Team_011 possession (Score: 74-60)
Russell Davis attempts a Layup. Heavily contested by Jarrett Smith (1.8 feet, ZONE)! RUSSELL DAVIS MAKES IT!
Score: 76-60

[01:04] Team_059 possession (Score: 76-60)
FOUL! Reach-in foul on Russell Davis during the drive. [Team fouls: 3] No free throws, side out. (Russell Davis: 1 personal fouls)

[00:46] Team_059 possession (Score: 76-60)
Nikola Jokic attempts a 3Pt. Contested by Russell Davis (2.6 feet, MAN). Nikola Jokic misses. Rebound secured by Pau Towns.

[00:36] Team_011 possession (Score: 76-60)
De'Aaron George attempts a 3Pt. Wide open! Blake Tatum is 6.6 feet away. [MAN] De'Aaron George misses. Rebound secured by Jarrett Smith.

[00:21] Team_059 possession (Score: 76-60)
Jarrett Smith attempts a 3Pt. Contested by Pau Towns (5.5 feet, MAN). Jarrett Smith misses. Rebound secured by Russell Davis.

[00:05] Team_011 possession (Score: 76-60)
FOUL! Shooting foul on Bam Wade. Magic Tatum to the line for 2 free throws. [BONUS: 5 team fouls] (Bam Wade: 2 personal fouls)   FT 1/2: GOOD   FT 2/2: GOOD Magic Tatum makes 2/2 from the line.
Score: 78-60

================================================================================
                              3RD QUARTER COMPLETE                              
================================================================================

3RD QUARTER SCORE: Team_011 29, Team_059 14

BOX SCORE:
================================================================================

Team_011
--------------------------------------------------------------------------------
Player                MIN  PTS  REB  AST  TO      FG   FG%      3P   3P%
--------------------------------------------------------------------------------
Magic Tatum            34    8    0    2   0   3/4    75.0     0/0   0.0
Trae Tatum             23    5    0    1   0   2/5    40.0     0/0   0.0
Pau Barnes             23    5    5    0   0   2/3    66.7     0/0   0.0
Michael Carter         23    3    1    1   0   1/2    50.0     0/0   0.0
De'Aaron George        14    3    0    0   0   1/2    50.0     0/0   0.0
Evan George            23    2    1    2   0   1/2    50.0     0/0   0.0
Russell Davis          14    2    2    0   0   1/1   100.0     0/0   0.0
Tyrese Nowitzki        14    0    1    0   0   0/0     0.0     0/0   0.0
Pau Towns              14    0    1    0   0   0/0     0.0     0/0   0.0

TEAM: FG: 11/19 (57.9%), 3PT: 6/7 (85.7%), REB: 11 (1 off, 10 def), AST: 6, TO: 5
TEAM FOULS: 3


Team_059
--------------------------------------------------------------------------------
Player                MIN  PTS  REB  AST  TO      FG   FG%      3P   3P%
--------------------------------------------------------------------------------
John Iverson           23    8    5    1   0   3/4    75.0     0/0   0.0
Blake Tatum            25    2    0    0   0   1/1   100.0     0/0   0.0
Bam Wade               25    2    1    3   0   1/3    33.3     0/0   0.0
Jarrett Smith          34    2    2    0   0   1/4    25.0     0/0   0.0
Nikola Jokic           34    0    0    0   0   0/4     0.0     0/0   0.0

TEAM: FG: 6/16 (37.5%), 3PT: 2/7 (28.6%), REB: 8 (0 off, 8 def), AST: 4, TO: 7
TEAM FOULS: 5 [Team_011 in BONUS]

================================================================================

================================================================================
                       4TH QUARTER - Team_011 vs Team_059                       
================================================================================

[12:00] Team_011 possession (Score: 78-60)
FOUL! Reach-in foul on Nikola Jokic during the drive. [Team fouls: 1] No free throws, side out. (Nikola Jokic: 1 personal fouls)

[11:48] Team_011 possession (Score: 78-60)
Magic Tatum attempts a 3Pt. Contested by Bam Wade (4.2 feet, ZONE). MAGIC TATUM MAKES IT! Assist: Trae Tatum
Score: 81-60

[11:35] Team_059 possession (Score: 81-60)
Blake Tatum attempts a 3Pt. Wide open! Trae Tatum is 10.0 feet away. [MAN] Blake Tatum misses. FOUL! Loose ball foul on Michael Carter during the rebound battle. [Team fouls: 1] No free throws, side out. (Michael Carter: 1 personal fouls)

[11:18] Team_059 possession (Score: 81-60)
Nikola Jokic attempts a 3Pt. Wide open! Magic Tatum is 7.9 feet away. [ZONE] Nikola Jokic misses. Rebound secured by Evan George.

[11:08] Team_011 possession (Score: 81-60)
Pau Barnes drives and kicks out. Evan George attempts a 3Pt. Wide open! Nikola Jokic is 8.0 feet away. [ZONE] EVAN GEORGE MAKES IT! Assist: Magic Tatum
Score: 84-60

[10:54] Team_059 possession (Score: 84-60)
FOUL! Reach-in foul on Pau Barnes during the drive. [Team fouls: 2] No free throws, side out. (Pau Barnes: 1 personal fouls)

[10:35] Team_059 possession (Score: 84-60)
John Iverson drives to the basket... John Iverson loses control! Ball rolls out of bounds! TURNOVER! (dead ball)

[10:35] Substitution (Team_011): Magic Tatum OUT → Shai Leonard IN (stamina_rule2)

[10:35] Substitution (Team_059): Bam Wade OUT → Russell Quickley IN (stamina_rule2)

[10:35] Substitution (Team_059): Blake Tatum OUT → Scottie Ginobili IN (stamina_rule2)

[10:35] Substitution (Team_059): Nikola Jokic OUT → Bones Middleton IN (stamina_rule2)

[10:35] Substitution (Team_059): Jarrett Smith OUT → LeBron Lowry IN (stamina_rule2)

[10:24] Team_011 possession (Score: 84-60)
Pau Barnes makes the Dunk and draws the foul on Bones Middleton! And-1! Pau Barnes to the line for 1. [Team fouls: 2] (Bones Middleton: 1 personal fouls)   FT 1/1: GOOD Pau Barnes makes 1/1 from the line.
Score: 87-60

[10:08] Team_059 possession (Score: 87-60)
Scottie Ginobili drives, Trae Tatum stays with him. Scottie Ginobili attempts a Layup. Contested by Trae Tatum (5.5 feet, MAN). SCOTTIE GINOBILI MAKES IT!
Score: 87-62

[09:53] Team_011 possession (Score: 87-62)
Shai Leonard attempts a Midrange. Contested by Russell Quickley (3.7 feet, MAN). Shai Leonard misses. Rebound secured by Bones Middleton.

[09:40] Team_059 possession (Score: 87-62)
John Iverson attempts a 3Pt. Contested by Shai Leonard (4.2 feet, ZONE). John Iverson misses. Rebound secured by Michael Carter.

[09:25] Team_011 possession (Score: 87-62)
Shai Leonard makes the Layup and draws the foul on Bones Middleton! And-1! Shai Leonard to the line for 1. [Team fouls: 3] (Bones Middleton: 2 personal fouls)   FT 1/1: GOOD Shai Leonard makes 1/1 from the line.
Score: 90-62

[09:13] Team_059 possession (Score: 90-62)
Scottie Ginobili attempts a Midrange. Heavily contested by Trae Tatum (0.8 feet, MAN)! SCOTTIE GINOBILI MAKES IT!
Score: 90-64

[09:02] Team_011 possession (Score: 90-64)
FOUL! Reach-in foul on Russell Quickley during the drive. [Team fouls: 4] No free throws, side out. (Russell Quickley: 1 personal fouls)

[08:47] Team_011 possession (Score: 90-64)
Trae Tatum attempts a 3Pt. Wide open! Russell Quickley is 6.4 feet away. [ZONE] Trae Tatum misses. Rebound secured by John Iverson.

[08:37] Team_059 possession (Score: 90-64)
Bones Middleton attempts a 3Pt. Contested by Shai Leonard (4.4 feet, ZONE). Bones Middleton misses. Rebound secured by Pau Barnes.

[08:24] Team_011 possession (Score: 90-64)
FOUL! Shooting foul on Bones Middleton. Shai Leonard to the line for 2 free throws. [BONUS: 5 team fouls] (Bones Middleton: 3 personal fouls)   FT 1/2: GOOD   FT 2/2: GOOD Shai Leonard makes 2/2 from the line.
Score: 92-64

[08:11] Team_059 possession (Score: 92-64)
FOUL! Reach-in foul on Pau Barnes during the drive. [Team fouls: 3] No free throws, side out. (Pau Barnes: 2 personal fouls)

[07:56] Team_059 possession (Score: 92-64)
LeBron Lowry attempts a 3Pt. Heavily contested by Pau Barnes (1.2 feet, MAN)! LeBron Lowry misses. Rebound secured by Evan George.

[07:44] Team_011 possession (Score: 92-64)
Pau Barnes attempts a 3Pt. Contested by Bones Middleton (3.6 feet, MAN). Pau Barnes misses. Rebound secured by Scottie Ginobili.

[07:30] Team_059 possession (Score: 92-64)
John Iverson attempts a 3Pt. Contested by Michael Carter (5.1 feet, MAN). John Iverson misses. FOUL! Loose ball foul on Pau Barnes during the rebound battle. [Team fouls: 4] No free throws, side out. (Pau Barnes: 3 personal fouls)

[07:16] Team_059 possession (Score: 92-64)
Bones Middleton attempts a Midrange. Contested by Pau Barnes (2.1 feet, MAN). Bones Middleton misses. Rebound secured by Michael Carter.

[07:03] Team_011 possession (Score: 92-64)
Shai Leonard attempts a 3Pt. Wide open! Russell Quickley is 8.1 feet away. [ZONE] Shai Leonard misses. Rebound secured by Bones Middleton.

[06:46] Team_059 possession (Score: 92-64)
Russell Quickley makes the Midrange and draws the foul on Shai Leonard! And-1! Russell Quickley to the line for 1. [BONUS: 5 team fouls] (Shai Leonard: 1 personal fouls)   FT 1/1: GOOD Russell Quickley makes 1/1 from the line.
Score: 92-67

[06:32] Team_011 possession (Score: 92-67)
Shai Leonard attempts a 3Pt. Contested by Russell Quickley (5.7 feet, MAN). Shai Leonard misses. Rebound secured by Bones Middleton.

[06:16] Team_059 possession (Score: 92-67)
FOUL! Offensive foul on John Iverson! Michael Carter drew the charge! [Team fouls: 6] (John Iverson: 1 personal fouls) TURNOVER! (dead ball)

[06:03] Team_011 possession (Score: 92-67)
Shai Leonard loses control! Ball rolls out of bounds! TURNOVER! (dead ball)

[06:03] Substitution (Team_011): Trae Tatum OUT → De'Aaron George IN (stamina_rule2)

[06:03] Substitution (Team_011): Michael Carter OUT → Tyrese Nowitzki IN (stamina_rule2)

[06:03] Substitution (Team_011): Pau Barnes OUT → Russell Davis IN (stamina_rule2)

[06:03] Substitution (Team_011): Evan George OUT → Pau Towns IN (stamina_rule2)

[06:03] Substitution (Team_059): John Iverson OUT → Allen Giddey IN (stamina_rule2)

[05:44] Team_059 possession (Score: 92-67)
Bones Middleton attempts a Midrange. Wide open! Tyrese Nowitzki is 6.4 feet away. [ZONE] Bones Middleton misses. Rebound secured by Pau Towns.

[05:29] Team_011 possession (Score: 92-67)
Shai Leonard attempts a Midrange. Contested by Russell Quickley (3.8 feet, MAN). SHAI LEONARD MAKES IT!
Score: 94-67

[05:17] Team_059 possession (Score: 94-67)
Bones Middleton loses control! Ball rolls out of bounds! TURNOVER! (dead ball)

[05:04] Team_011 possession (Score: 94-67)
Tyrese Nowitzki attempts a Midrange. Wide open! Scottie Ginobili is 6.4 feet away. [ZONE] Tyrese Nowitzki misses. Rebound secured by Scottie Ginobili.

[04:50] Team_059 possession (Score: 94-67)
Allen Giddey attempts a 3Pt. Contested by Tyrese Nowitzki (3.6 feet, MAN). ALLEN GIDDEY MAKES IT! Assist: Russell Quickley
Score: 94-70

[04:35] Team_011 possession (Score: 94-70)
FOUL! Reach-in foul on Bones Middleton during the drive. [IN THE BONUS! 7 team fouls] Pau Towns to the line for 2 free throws. (Bones Middleton: 4 personal fouls)   FT 1/2: GOOD   FT 2/2: GOOD Pau Towns makes 2/2 from the line.
Score: 96-70

[04:24] Team_059 possession (Score: 96-70)
Scottie Ginobili attempts a 3Pt. Contested by De'Aaron George (5.1 feet, MAN). Scottie Ginobili misses. Rebound secured by Russell Davis.

[04:10] Team_011 possession (Score: 96-70)
Tyrese Nowitzki makes the Layup and draws the foul on Bones Middleton! And-1! Tyrese Nowitzki to the line for 1. [BONUS: 8 team fouls] (Bones Middleton: 5 personal fouls)   FT 1/1: GOOD Tyrese Nowitzki makes 1/1 from the line.
Score: 99-70

[03:56] Team_059 possession (Score: 99-70)
Bones Middleton attempts a Midrange. Contested by Russell Davis (3.6 feet, MAN). Bones Middleton misses. Rebound secured by Pau Towns.

[03:45] Team_011 possession (Score: 99-70)
De'Aaron George attempts a 3Pt. Wide open! Russell Quickley is 7.3 feet away. [ZONE] De'Aaron George misses. Rebound secured by Bones Middleton.

[03:28] Team_059 possession (Score: 99-70)
Bones Middleton drives and kicks out. Allen Giddey attempts a 3Pt. Wide open! Tyrese Nowitzki is 7.3 feet away. [MAN] Allen Giddey misses. Offensive rebound by Bones Middleton! Bones Middleton kicks it out.

[03:14] Team_059 possession (Score: 99-70)
Russell Quickley attempts a 3Pt. Contested by Shai Leonard (3.0 feet, MAN). Russell Quickley misses. Rebound secured by Pau Towns.

[03:00] Team_011 possession (Score: 99-70)
Pau Towns drives to the basket... Pau Towns throws a bad pass out of bounds! TURNOVER! (dead ball)

[02:45] Team_059 possession (Score: 99-70)
Scottie Ginobili attempts a Midrange. Heavily contested by De'Aaron George (0.5 feet, MAN)! Scottie Ginobili misses. Rebound secured by Russell Davis.

[02:27] Team_011 possession (Score: 99-70)
Pau Towns drives to the basket... FOUL! Offensive foul on Pau Towns! LeBron Lowry drew the charge! [Team fouls: 6] (Pau Towns: 1 personal fouls) TURNOVER! (dead ball)

[02:14] Team_059 possession (Score: 99-70)
Russell Quickley drives to the basket... FOUL! Offensive foul on Russell Quickley! Russell Davis drew the charge! [Team fouls: 9] (Russell Quickley: 2 personal fouls) TURNOVER! (dead ball)

[01:57] Team_011 possession (Score: 99-70)
Russell Davis throws a bad pass out of bounds! TURNOVER! (dead ball)

[01:41] Team_059 possession (Score: 99-70)
Scottie Ginobili attempts a 3Pt. Contested by De'Aaron George (4.3 feet, MAN). Scottie Ginobili misses. Rebound secured by Pau Towns.

[01:23] Team_011 possession (Score: 99-70)
Russell Davis attempts a 3Pt. Wide open! Bones Middleton is 7.2 feet away. [MAN] Russell Davis misses. FOUL! Loose ball foul on LeBron Lowry during the rebound battle. [IN THE BONUS! 10 team fouls] Pau Towns to the line for 2 free throws. (LeBron Lowry: 1 personal fouls)   FT 1/2: MISS   FT 2/2: GOOD Pau Towns makes 1/2 from the line.
Score: 100-70

[01:11] Team_059 possession (Score: 100-70)
Russell Quickley attempts a 3Pt. Contested by Shai Leonard (4.0 feet, ZONE). Russell Quickley misses. Rebound secured by Pau Towns.

[00:56] Team_011 possession (Score: 100-70)
Pau Towns drives and kicks out. De'Aaron George attempts a Midrange. Wide open! Scottie Ginobili is 8.7 feet away. [MAN] De'Aaron George misses. Offensive rebound by Tyrese Nowitzki! Tyrese Nowitzki kicks it out.

[00:38] Team_011 possession (Score: 100-70)
Russell Davis attempts a Layup. Contested by Bones Middleton (5.2 feet, MAN). Russell Davis misses. Rebound secured by LeBron Lowry.

[00:24] Team_059 possession (Score: 100-70)
Scottie Ginobili attempts a Midrange. Heavily contested by Russell Davis (0.5 feet, ZONE)! Scottie Ginobili misses. Rebound secured by Pau Towns.

[00:09] Team_011 possession (Score: 100-70)
Tyrese Nowitzki attempts a 3Pt. Wide open! Allen Giddey is 9.1 feet away. [MAN] TYRESE NOWITZKI MAKES IT! Assist: Russell Davis
Score: 103-70

================================================================================
                              4TH QUARTER COMPLETE                              
================================================================================

4TH QUARTER SCORE: Team_011 25, Team_059 10

BOX SCORE:
================================================================================

Team_011
--------------------------------------------------------------------------------
Player                MIN  PTS  REB  AST  TO      FG   FG%      3P   3P%
--------------------------------------------------------------------------------
Shai Leonard           12    7    0    0   0   3/6    50.0     0/0   0.0
Tyrese Nowitzki        20    6    1    0   0   2/3    66.7     0/0   0.0
Magic Tatum            36    3    0    1   0   1/1   100.0     0/0   0.0
Evan George            29    3    2    0   0   1/1   100.0     0/0   0.0
Pau Barnes             29    3    1    0   0   1/2    50.0     0/0   0.0
Pau Towns              20    3    6    0   0   2/2   100.0     0/0   0.0
Trae Tatum             29    0    0    1   0   0/1     0.0     0/0   0.0
Michael Carter         29    0    2    0   0   0/0     0.0     0/0   0.0
Russell Davis          20    0    2    1   0   0/1     0.0     0/0   0.0
De'Aaron George        20    0    0    0   0   0/1     0.0     0/0   0.0

TEAM: FG: 10/18 (55.6%), 3PT: 3/8 (37.5%), REB: 14 (1 off, 13 def), AST: 3, TO: 4
TEAM FOULS: 6 [Team_059 in BONUS]


Team_059
--------------------------------------------------------------------------------
Player                MIN  PTS  REB  AST  TO      FG   FG%      3P   3P%
--------------------------------------------------------------------------------
Scottie Ginobili       22    4    2    0   0   2/6    33.3     0/0   0.0
Russell Quickley       22    3    0    1   0   1/3    33.3     0/0   0.0
Allen Giddey           20    3    0    0   0   1/1   100.0     0/0   0.0
Jarrett Smith          36    0    1    0   0   0/0     0.0     0/0   0.0
Nikola Jokic           36    0    0    0   0   0/1     0.0     0/0   0.0
Bones Middleton        12    0    5    0   0   0/4     0.0     0/0   0.0
John Iverson           29    0    2    0   0   0/1     0.0     0/0   0.0
LeBron Lowry           12    0    1    0   0   0/1     0.0     0/0   0.0

TEAM: FG: 4/17 (23.5%), 3PT: 1/9 (11.1%), REB: 11 (3 off, 8 def), AST: 1, TO: 4
TEAM FOULS: 10 [Team_011 in BONUS]

================================================================================

================================================================================
                               FULL GAME COMPLETE                               
================================================================================

FINAL SCORE: Team_011 103, Team_059 70

SCORING BY QUARTER:
--------------------------------------------------------------------------------
Team                     Q1     Q2     Q3     Q4    FINAL
--------------------------------------------------------------------------------
Team_011                 19     30     29     25      103
Team_059                 25     21     14     10       70
--------------------------------------------------------------------------------

FULL GAME BOX SCORE:
================================================================================

Team_011
--------------------------------------------------------------------------------
Player                MIN  PTS  REB  AST  TO      FG   FG%      3P   3P%      FT STL BLK
--------------------------------------------------------------------------------
Magic Tatum            36   18    0    5   0   7/15   46.7   2/7    28.6   5/7     0   0
Trae Tatum             29    7    0    2   1   4/12   33.3   2/4    50.0   4/6     0   0
Michael Carter         29   11    4    1   2   3/6    50.0   2/3    66.7   4/4     0   0
Pau Barnes             29   13   10    0   1   7/11   63.6   1/3    33.3   2/2     5   0
Evan George            29    8    5    2   2   1/5    20.0   0/0     0.0   1/1     0   0
De'Aaron George        20    3    0    1   1   1/3    33.3   1/3    33.3   0/0     0   0
Tyrese Nowitzki        20   11    6    0   0   4/8    50.0   2/4    50.0   1/1     0   0
Russell Davis          20    8    5    1   2   4/6    66.7   3/3   100.0   0/0     0   1
Pau Towns              20   12   14    1   0   5/6    83.3   0/0     0.0   4/5     0   0
Shai Leonard           12    7    0    1   1   3/7    42.9   0/3     0.0   3/3     0   0

TEAM: FG: 39/79 (49.4%), 3PT: 13/30 (43.3%), REB: 44 (5 off, 39 def), AST: 14, TO: 10


Team_059
--------------------------------------------------------------------------------
Player                MIN  PTS  REB  AST  TO      FG   FG%      3P   3P%      FT STL BLK
--------------------------------------------------------------------------------
Nikola Jokic           36   10    3    2   3   6/12   50.0   1/5    20.0   3/3     0   1
Jarrett Smith          36    8   12    0   3   3/9    33.3   0/1     0.0   2/2     1   4
John Iverson           29   20   13    3   3   8/12   66.7   4/6    66.7   2/2     0   0
Bam Wade               27    4    5    7   3   3/5    60.0   0/1     0.0   2/2     0   0
Blake Tatum            27    4    0    0   2   1/2    50.0   0/0     0.0   0/0     0   0
Russell Quickley       22    6    0    2   1   2/5    40.0   1/3    33.3   4/4     0   0
Scottie Ginobili       22    6    7    0   0   2/9    22.2   0/4     0.0   2/2     0   0
Allen Giddey           20   10    0    1   1   4/8    50.0   3/5    60.0   7/8     0   0
Bones Middleton        12    2    6    0   1   1/5    20.0   0/1     0.0   0/0     0   0
LeBron Lowry           12    0    1    0   0   0/2     0.0   0/2     0.0   0/0     0   0

TEAM: FG: 30/69 (43.5%), 3PT: 9/28 (32.1%), REB: 47 (8 off, 39 def), AST: 15, TO: 17

================================================================================
