================================================================================
                        FULL GAME - Team_023 vs Team_036                        
================================================================================

================================================================================
                       1ST QUARTER - Team_023 vs Team_036                       
================================================================================

[12:00] Team_023 possession (Score: 0-0)
Collin Ginobili attempts a Midrange. Contested by Kobe Simmons (2.5 feet, ZONE). Collin Ginobili misses. Rebound secured by Terry Durant.

[11:43] Team_036 possession (Score: 0-0)
Terry Durant drives and kicks out. Giannis Booker attempts a Midrange. Wide open! Josh Morant is 6.6 feet away. [ZONE] GIANNIS BOOKER MAKES IT!
Score: 0-2

[11:33] Team_023 possession (Score: 0-2)
Josh Morant attempts a 3Pt. Wide open! Michael Westbrook is 6.7 feet away. [ZONE] Josh Morant misses. Rebound secured by Terry Durant.

[11:20] Team_036 possession (Score: 0-2)
Terry Durant attempts a Layup. Heavily contested by Tim Bane (1.1 feet, ZONE)! TERRY DURANT MAKES IT! Assist: Kobe Simmons
Score: 0-4

[11:01] Team_023 possession (Score: 0-4)
Trae Ingram attempts a Layup. Heavily contested by Michael Westbrook (0.8 feet, MAN)! Trae Ingram misses. Rebound secured by Giannis Booker.

[10:50] Team_036 possession (Score: 0-4)
Giannis Booker drives, picks up Collin Ginobili. Help arrives from Kyle Paul! Giannis Booker attempts a Layup. Contested by Kyle Paul (4.8 feet, MAN). Giannis Booker misses. Offensive rebound by Kobe Simmons! Kobe Simmons's putback is no good. Offensive rebound by Kobe Simmons! Kobe Simmons kicks it out.

[10:33] Team_036 possession (Score: 0-4)
Terry Durant attempts a 3Pt. Wide open! Josh Morant is 7.3 feet away. [MAN] Terry Durant misses. Rebound secured by Kyle Paul.

[10:23] Team_023 possession (Score: 0-4)
Trae Ingram attempts a 3Pt. Contested by Michael Westbrook (2.3 feet, MAN). Trae Ingram misses. FOUL! Loose ball foul on Giannis Booker during the rebound battle. [Team fouls: 1] No free throws, side out. (Giannis Booker: 1 personal fouls)

[10:10] Team_023 possession (Score: 0-4)
Trae Ingram drives and kicks out. Tim Bane attempts a 3Pt. Contested by Kobe Simmons (3.2 feet, MAN). TIM BANE MAKES IT! Assist: Collin Ginobili
Score: 3-4

[09:56] Team_036 possession (Score: 3-4)
Michael Westbrook attempts a Layup. Contested by Trae Ingram (4.5 feet, MAN). Michael Westbrook misses. Rebound secured by Tim Bane.

[09:39] Team_023 possession (Score: 3-4)
Collin Ginobili attempts a Midrange. Wide open! Giannis Booker is 6.8 feet away. [MAN] COLLIN GINOBILI MAKES IT!
Score: 5-4

[09:24] Team_036 possession (Score: 5-4)
FOUL! Reach-in foul on Kyle Paul during the drive. [Team fouls: 1] No free throws, side out. (Kyle Paul: 1 personal fouls)

[09:07] Team_036 possession (Score: 5-4)
Kobe Simmons commits a violation (traveling/carry)! TURNOVER! (dead ball)

[08:54] Team_023 possession (Score: 5-4)
Trae Ingram drives, picks up Michael Westbrook. Help arrives from Anthony Poole! Trae Ingram attempts a Dunk. Contested by Anthony Poole (4.4 feet, MAN). Trae Ingram misses. Rebound secured by Terry Durant.

[08:44] Team_036 possession (Score: 5-4)
Giannis Booker makes the 3Pt and draws the foul on Kyle Paul! And-1! Giannis Booker to the line for 1. [Team fouls: 2] (Kyle Paul: 2 personal fouls)   FT 1/1: GOOD Giannis Booker makes 1/1 from the line.
Score: 5-8

[08:31] Team_023 possession (Score: 5-8)
FOUL! Holding foul on Kobe Simmons. [Team fouls: 2] No free throws, side out. (Kobe Simmons: 1 personal fouls)

[08:13] Team_023 possession (Score: 5-8)
Tim Bane makes the Dunk and draws the foul on Giannis Booker! And-1! Tim Bane to the line for 1. [Team fouls: 3] (Giannis Booker: 2 personal fouls)   FT 1/1: GOOD Tim Bane makes 1/1 from the line.
Score: 8-8

[07:55] Team_036 possession (Score: 8-8)
Terry Durant drives and kicks out. Kobe Simmons attempts a 3Pt. Wide open! Tim Bane is 6.2 feet away. [MAN] KOBE SIMMONS MAKES IT! Assist: Michael Westbrook
Score: 8-11

[07:39] Team_023 possession (Score: 8-11)
Collin Ginobili drives and kicks out. Collin Ginobili attempts a 3Pt. Contested by Giannis Booker (5.2 feet, MAN). COLLIN GINOBILI MAKES IT! Assist: Trae Ingram
Score: 11-11

[07:24] Team_036 possession (Score: 11-11)
Anthony Poole throws a bad pass out of bounds! TURNOVER! (dead ball)

[07:08] Team_023 possession (Score: 11-11)
Josh Morant attempts a Midrange. Contested by Terry Durant (2.9 feet, ZONE). Josh Morant misses. Rebound secured by Terry Durant.

[06:56] Team_036 possession (Score: 11-11)
Terry Durant throws a bad pass out of bounds! TURNOVER! (dead ball)

[06:45] Team_023 possession (Score: 11-11)
Josh Morant drives to the basket... Josh Morant loses the ball! Stripped by Terry Durant! TURNOVER! (live ball)

[06:28] Team_036 possession (Score: 11-11)
Anthony Poole throws a bad pass out of bounds! TURNOVER! (dead ball)

[06:14] Team_023 possession (Score: 11-11)
Kyle Paul makes the Layup and draws the foul on Anthony Poole! And-1! Kyle Paul to the line for 1. [Team fouls: 4] (Anthony Poole: 1 personal fouls)   FT 1/1: GOOD Kyle Paul makes 1/1 from the line.
Score: 14-11

[06:04] Team_036 possession (Score: 14-11)
Michael Westbrook attempts a Midrange. Contested by Josh Morant (5.1 feet, ZONE). MICHAEL WESTBROOK MAKES IT! Assist: Anthony Poole
Score: 14-13

[05:52] Team_023 possession (Score: 14-13)
FOUL! Shooting foul on Michael Westbrook. Collin Ginobili to the line for 3 free throws. [BONUS: 5 team fouls] (Michael Westbrook: 1 personal fouls)   FT 1/3: GOOD   FT 2/3: GOOD   FT 3/3: GOOD Collin Ginobili makes 3/3 from the line.
Score: 17-13

[05:41] Team_036 possession (Score: 17-13)
Michael Westbrook throws a bad pass! Stolen by Trae Ingram! TURNOVER! (live ball)

[05:26] Team_023 possession (Score: 17-13)
Trae Ingram attempts a 3Pt. Contested by Michael Westbrook (3.5 feet, MAN). TRAE INGRAM MAKES IT! Assist: Josh Morant
Score: 20-13

[05:08] Team_036 possession (Score: 20-13)
Giannis Booker attempts a 3Pt. Wide open! Collin Ginobili is 7.1 feet away. [MAN] Giannis Booker misses. Rebound secured by Tim Bane.

[04:49] Team_023 possession (Score: 20-13)
Kyle Paul attempts a Midrange. Contested by Terry Durant (4.5 feet, ZONE). Kyle Paul misses. Rebound secured by Kobe Simmons.

[04:31] Team_036 possession (Score: 20-13)
Giannis Booker drives to the basket... FOUL! Offensive foul on Giannis Booker! Collin Ginobili drew the charge! [Team fouls: 6] (Giannis Booker: 3 personal fouls) TURNOVER! (dead ball)

[04:12] Team_023 possession (Score: 20-13)
Tim Bane attempts a Layup. Heavily contested by Kobe Simmons (1.4 feet, MAN)! Tim Bane misses. Rebound secured by Kobe Simmons.

[03:56] Team_036 possession (Score: 20-13)
Anthony Poole attempts a 3Pt. Contested by Kyle Paul (3.1 feet, ZONE). Anthony Poole misses. Rebound secured by Tim Bane.

[03:41] Team_023 possession (Score: 20-13)
Trae Ingram attempts a Layup. Contested by Michael Westbrook (2.6 feet, MAN). Trae Ingram misses. Rebound secured by Terry Durant.

[03:28] Team_036 possession (Score: 20-13)
Michael Westbrook drives, Tim Bane stays with him. Michael Westbrook attempts a Layup. Wide open! Tim Bane is 6.4 feet away. [ZONE] MICHAEL WESTBROOK MAKES IT! Assist: Giannis Booker
Score: 20-15

[03:18] Team_023 possession (Score: 20-15)
Collin Ginobili attempts a 3Pt. Contested by Michael Westbrook (5.6 feet, ZONE). Collin Ginobili misses. Rebound secured by Terry Durant.

[03:08] Team_036 possession (Score: 20-15)
Kobe Simmons makes the Dunk and draws the foul on Tim Bane! And-1! Kobe Simmons to the line for 1. [Team fouls: 3] (Tim Bane: 1 personal fouls)   FT 1/1: GOOD Kobe Simmons makes 1/1 from the line.
Score: 20-18

[02:52] Team_023 possession (Score: 20-18)
Collin Ginobili throws a bad pass out of bounds! TURNOVER! (dead ball)

[02:52] Substitution (Team_023): Tim Bane OUT → Vince Gasol IN (stamina_rule2)

[02:52] Substitution (Team_036): Kobe Simmons OUT → Bradley Murray IN (stamina_rule2)

[02:34] Team_036 possession (Score: 20-18)
Anthony Poole attempts a Layup. BLOCKED BY KYLE PAUL! Ball is loose! Rebound secured by Josh Morant.

[02:18] Team_023 possession (Score: 20-18)
Trae Ingram attempts a Midrange. Wide open! Anthony Poole is 7.7 feet away. [ZONE] Trae Ingram misses. Rebound secured by Terry Durant.

[02:05] Team_036 possession (Score: 20-18)
Terry Durant attempts a 3Pt. Wide open! Kyle Paul is 6.5 feet away. [ZONE] Terry Durant misses. FOUL! Loose ball foul on Vince Gasol during the rebound battle. [Team fouls: 4] No free throws, side out. (Vince Gasol: 1 personal fouls)

[01:52] Team_036 possession (Score: 20-18)
Michael Westbrook attempts a 3Pt. Wide open! Kyle Paul is 7.1 feet away. [ZONE] MICHAEL WESTBROOK MAKES IT! Assist: Terry Durant
Score: 20-21

[01:36] Team_023 possession (Score: 20-21)
Josh Morant attempts a Layup. Wide open! Terry Durant is 6.9 feet away. [MAN] Josh Morant misses. Rebound secured by Giannis Booker.

[01:19] Team_036 possession (Score: 20-21)
Bradley Murray drives, Vince Gasol stays with him. Bradley Murray attempts a Dunk. Contested by Vince Gasol (2.0 feet, MAN). Bradley Murray misses. Rebound secured by Vince Gasol.

[01:09] Team_023 possession (Score: 20-21)
Josh Morant attempts a Midrange. Wide open! Terry Durant is 7.6 feet away. [MAN] Josh Morant misses. Rebound secured by Terry Durant.

[00:54] Team_036 possession (Score: 20-21)
Giannis Booker attempts a 3Pt. Wide open! Collin Ginobili is 9.0 feet away. [MAN] Giannis Booker misses. Rebound secured by Kyle Paul.

[00:44] Team_023 possession (Score: 20-21)
Vince Gasol drives to the basket... FOUL! Offensive foul on Vince Gasol! Bradley Murray drew the charge! [Team fouls: 5] (Vince Gasol: 2 personal fouls) TURNOVER! (dead ball)

[00:34] Team_036 possession (Score: 20-21)
Anthony Poole attempts a 3Pt. Contested by Kyle Paul (4.1 feet, MAN). Anthony Poole misses. Offensive rebound by Terry Durant! Terry Durant kicks it out.

[00:23] Team_036 possession (Score: 20-21)
Giannis Booker attempts a Midrange. Contested by Collin Ginobili (5.1 feet, MAN). GIANNIS BOOKER MAKES IT!
Score: 20-23

[00:13] Team_023 possession (Score: 20-23)
Vince Gasol drives and kicks out. Vince Gasol attempts a Midrange. Wide open! Bradley Murray is 8.6 feet away. [MAN] Vince Gasol misses. Rebound secured by Bradley Murray.

================================================================================
                              1ST QUARTER COMPLETE                              
================================================================================

1ST QUARTER SCORE: Team_023 20, Team_036 23

BOX SCORE:
================================================================================

Team_023
--------------------------------------------------------------------------------
Player                MIN  PTS  REB  AST  TO      FG   FG%      3P   3P%
--------------------------------------------------------------------------------
Collin Ginobili        12    8    0    1   0   3/5    60.0     0/0   0.0
Tim Bane                9    6    4    0   0   2/3    66.7     0/0   0.0
Trae Ingram            12    3    0    1   0   1/5    20.0     0/0   0.0
Kyle Paul              12    3    2    0   0   1/2    50.0     0/0   0.0
Josh Morant            12    0    1    1   0   0/4     0.0     0/0   0.0
Vince Gasol             3    0    1    0   0   0/1     0.0     0/0   0.0

TEAM: FG: 7/20 (35.0%), 3PT: 2/4 (50.0%), REB: 8 (1 off, 7 def), AST: 3, TO: 3
TEAM FOULS: 5 [Team_036 in BONUS]


Team_036
--------------------------------------------------------------------------------
Player                MIN  PTS  REB  AST  TO      FG   FG%      3P   3P%
--------------------------------------------------------------------------------
Giannis Booker         12    8    2    1   0   3/5    60.0     0/0   0.0
Michael Westbrook      12    7    0    1   0   3/4    75.0     0/0   0.0
Kobe Simmons            9    6    3    1   0   2/2   100.0     0/0   0.0
Terry Durant           12    2    9    1   0   1/2    50.0     0/0   0.0
Anthony Poole          12    0    0    1   0   0/2     0.0     0/0   0.0
Bradley Murray          3    0    2    0   0   0/1     0.0     0/0   0.0

TEAM: FG: 9/16 (56.2%), 3PT: 2/6 (33.3%), REB: 16 (3 off, 13 def), AST: 5, TO: 6
TEAM FOULS: 6 [Team_023 in BONUS]

================================================================================

================================================================================
                       2ND QUARTER - Team_023 vs Team_036                       
================================================================================

[12:00] Team_023 possession (Score: 20-23)
Tim Bane attempts a 3Pt. Contested by Kobe Simmons (3.1 feet, MAN). Tim Bane misses. Rebound secured by Terry Durant.

[11:46] Team_036 possession (Score: 20-23)
Kobe Simmons makes the Layup and draws the foul on Tim Bane! And-1! Kobe Simmons to the line for 1. [Team fouls: 1] (Tim Bane: 1 personal fouls)   FT 1/1: GOOD Kobe Simmons makes 1/1 from the line.
Score: 20-26

[11:31] Team_023 possession (Score: 20-26)
Trae Ingram attempts a 3Pt. Contested by Michael Westbrook (5.5 feet, ZONE). TRAE INGRAM MAKES IT! Assist: Kyle Paul
Score: 23-26

[11:13] Team_036 possession (Score: 23-26)
Giannis Booker drives and kicks out. Kobe Simmons attempts a 3Pt. BLOCKED BY TIM BANE! Ball deflects out of bounds off Kobe Simmons.

[10:58] Team_023 possession (Score: 23-26)
Josh Morant attempts a Layup. Wide open! Terry Durant is 6.6 feet away. [MAN] JOSH MORANT MAKES IT! Assist: Tim Bane
Score: 25-26

[10:45] Team_036 possession (Score: 25-26)
Michael Westbrook attempts a 3Pt. Contested by Trae Ingram (2.0 feet, MAN). Michael Westbrook misses. Rebound secured by Kyle Paul.

[10:29] Team_023 possession (Score: 25-26)
Josh Morant attempts a Layup. Wide open! Kobe Simmons is 8.3 feet away. [ZONE] Josh Morant misses. Rebound secured by Kobe Simmons.

[10:13] Team_036 possession (Score: 25-26)
Anthony Poole loses the ball! Stripped by Kyle Paul! TURNOVER! (live ball)

[09:55] Team_023 possession (Score: 25-26)
Collin Ginobili drives and kicks out. Kyle Paul attempts a 3Pt. Contested by Michael Westbrook (3.6 feet, ZONE). Kyle Paul misses. Rebound secured by Terry Durant.

[09:42] Team_036 possession (Score: 25-26)
Terry Durant attempts a Midrange. Wide open! Kyle Paul is 8.4 feet away. [ZONE] Terry Durant misses. Offensive rebound by Terry Durant! Terry Durant kicks it out.

[09:24] Team_036 possession (Score: 25-26)
Giannis Booker attempts a Layup. BLOCKED BY TIM BANE! Ball deflects out of bounds off Giannis Booker.

[09:08] Team_023 possession (Score: 25-26)
Kyle Paul attempts a 3Pt. Contested by Michael Westbrook (4.7 feet, ZONE). Kyle Paul misses. Rebound secured by Terry Durant.

[08:55] Team_036 possession (Score: 25-26)
Terry Durant makes the Layup and draws the foul on Josh Morant! And-1! Terry Durant to the line for 1. [Team fouls: 2] (Josh Morant: 1 personal fouls)   FT 1/1: MISS Terry Durant makes 0/1 from the line. Rebound secured by Josh Morant.
Score: 25-28

[08:40] Team_023 possession (Score: 25-28)
Josh Morant attempts a 3Pt. Wide open! Michael Westbrook is 6.6 feet away. [ZONE] Josh Morant misses. Rebound secured by Giannis Booker.

[08:29] Team_036 possession (Score: 25-28)
Terry Durant drives and kicks out. Anthony Poole attempts a 3Pt. Heavily contested by Kyle Paul (1.5 feet, MAN)! Anthony Poole misses. Rebound secured by Tim Bane.

[08:13] Team_023 possession (Score: 25-28)
FOUL! Shooting foul on Giannis Booker. Kyle Paul to the line for 2 free throws. [Team fouls: 1] (Giannis Booker: 1 personal fouls)   FT 1/2: GOOD   FT 2/2: GOOD Kyle Paul makes 2/2 from the line.
Score: 27-28

[07:55] Team_036 possession (Score: 27-28)
Anthony Poole attempts a 3Pt. Contested by Trae Ingram (4.0 feet, ZONE). Anthony Poole misses. Offensive rebound by Kobe Simmons! Kobe Simmons puts it back in!
Score: 27-30

[07:40] Team_023 possession (Score: 27-30)
FOUL! Shooting foul on Kobe Simmons. Kyle Paul to the line for 2 free throws. [Team fouls: 2] (Kobe Simmons: 1 personal fouls)   FT 1/2: GOOD   FT 2/2: MISS Kyle Paul makes 1/2 from the line. Rebound secured by Kobe Simmons.
Score: 28-30

[07:22] Team_036 possession (Score: 28-30)
Terry Durant attempts a 3Pt. Contested by Josh Morant (3.2 feet, MAN). Terry Durant misses. Rebound secured by Tim Bane.

[07:08] Team_023 possession (Score: 28-30)
Kyle Paul attempts a Midrange. Wide open! Michael Westbrook is 7.1 feet away. [ZONE] Kyle Paul misses. Rebound secured by Kobe Simmons.

[06:50] Team_036 possession (Score: 28-30)
Anthony Poole drives, picks up Tim Bane. Help arrives from Trae Ingram! Anthony Poole attempts a Layup. Contested by Trae Ingram (5.8 feet, ZONE). Anthony Poole misses. Rebound secured by Josh Morant.

[06:35] Team_023 possession (Score: 28-30)
Josh Morant drives and kicks out. Collin Ginobili attempts a Midrange. Contested by Giannis Booker (2.1 feet, ZONE). Collin Ginobili misses. FOUL! Loose ball foul on Terry Durant during the rebound battle. [Team fouls: 3] No free throws, side out. (Terry Durant: 1 personal fouls)

[06:24] Team_023 possession (Score: 28-30)
Trae Ingram loses the ball! Stripped by Michael Westbrook! TURNOVER! (live ball)

[06:09] Team_036 possession (Score: 28-30)
Kobe Simmons drives and kicks out. Michael Westbrook attempts a Midrange. Contested by Trae Ingram (3.7 feet, MAN). Michael Westbrook misses. Rebound secured by Josh Morant.

[05:52] Team_023 possession (Score: 28-30)
Tim Bane drives, picks up Kobe Simmons. Help arrives from Giannis Booker! Tim Bane attempts a Dunk. Heavily contested by Giannis Booker (1.9 feet, ZONE)! TIM BANE MAKES IT!
Score: 30-30

[05:36] Team_036 possession (Score: 30-30)
Kobe Simmons attempts a 3Pt. Heavily contested by Tim Bane (1.9 feet, MAN)! Kobe Simmons misses. Offensive rebound by Kobe Simmons! Kobe Simmons's putback is no good. Rebound secured by Tim Bane.

[05:21] Team_023 possession (Score: 30-30)
Collin Ginobili drives to the basket... Collin Ginobili throws a bad pass out of bounds! TURNOVER! (dead ball)

[05:21] Substitution (Team_023): Trae Ingram OUT → Tracy Anthony IN (stamina_rule2)

[05:21] Substitution (Team_023): Collin Ginobili OUT → Magic Booker IN (stamina_rule2)

[05:21] Substitution (Team_023): Kyle Paul OUT → Gary Westbrook IN (stamina_rule2)

[05:21] Substitution (Team_023): Josh Morant OUT → Evan Parker IN (stamina_rule2)

[05:21] Substitution (Team_023): Tim Bane OUT → Vince Gasol IN (stamina_rule2)

[05:21] Substitution (Team_036): Michael Westbrook OUT → Dirk Anunoby IN (stamina_rule2)

[05:21] Substitution (Team_036): Giannis Booker OUT → Tobias Fox IN (stamina_rule2)

[05:21] Substitution (Team_036): Anthony Poole OUT → Pascal Antetokounmpo IN (stamina_rule2)

[05:21] Substitution (Team_036): Terry Durant OUT → Devin Simmons IN (stamina_rule2)

[05:21] Substitution (Team_036): Kobe Simmons OUT → Bradley Murray IN (stamina_rule2)

[05:05] Team_036 possession (Score: 30-30)
Bradley Murray throws a bad pass! Stolen by Vince Gasol! TURNOVER! (live ball)

[04:45] Team_023 possession (Score: 30-30)
FOUL! Shooting foul on Bradley Murray. Vince Gasol to the line for 2 free throws. [Team fouls: 4] (Bradley Murray: 1 personal fouls)   FT 1/2: GOOD   FT 2/2: GOOD Vince Gasol makes 2/2 from the line.
Score: 32-30

[04:30] Team_036 possession (Score: 32-30)
Pascal Antetokounmpo attempts a Layup. BLOCKED BY GARY WESTBROOK! Ball is loose! Rebound secured by Vince Gasol.

[04:13] Team_023 possession (Score: 32-30)
Evan Parker attempts a 3Pt. Contested by Devin Simmons (2.6 feet, MAN). EVAN PARKER MAKES IT! Assist: Vince Gasol
Score: 35-30

[03:53] Team_036 possession (Score: 35-30)
Devin Simmons drives, Evan Parker stays with him. Devin Simmons attempts a Dunk. Contested by Evan Parker (2.4 feet, MAN). Devin Simmons misses. Rebound secured by Gary Westbrook.

[03:41] Team_023 possession (Score: 35-30)
Vince Gasol makes the Layup and draws the foul on Devin Simmons! And-1! Vince Gasol to the line for 1. [BONUS: 5 team fouls] (Devin Simmons: 1 personal fouls)   FT 1/1: GOOD Vince Gasol makes 1/1 from the line.
Score: 38-30

[03:27] Team_036 possession (Score: 38-30)
Devin Simmons attempts a 3Pt. Wide open! Evan Parker is 7.0 feet away. [MAN] DEVIN SIMMONS MAKES IT! Assist: Bradley Murray
Score: 38-33

[03:12] Team_023 possession (Score: 38-33)
Magic Booker drives to the basket... Magic Booker throws a bad pass! Stolen by Tobias Fox! TURNOVER! (live ball)

[02:56] Team_036 possession (Score: 38-33)
Tobias Fox attempts a 3Pt. Wide open! Tracy Anthony is 10.0 feet away. [ZONE] Tobias Fox misses. Rebound secured by Vince Gasol.

[02:40] Team_023 possession (Score: 38-33)
Gary Westbrook attempts a Midrange. Wide open! Pascal Antetokounmpo is 6.7 feet away. [MAN] Gary Westbrook misses. Rebound secured by Devin Simmons.

[02:29] Team_036 possession (Score: 38-33)
Bradley Murray attempts a Layup. Heavily contested by Vince Gasol (0.5 feet, MAN)! Bradley Murray misses. FOUL! Loose ball foul on Gary Westbrook during the rebound battle. [Team fouls: 3] No free throws, side out. (Gary Westbrook: 1 personal fouls)

[02:16] Team_036 possession (Score: 38-33)
Bradley Murray attempts a 3Pt. Wide open! Tracy Anthony is 6.7 feet away. [ZONE] BRADLEY MURRAY MAKES IT! Assist: Pascal Antetokounmpo
Score: 38-36

[01:57] Team_023 possession (Score: 38-36)
Evan Parker attempts a 3Pt. Contested by Tobias Fox (3.7 feet, ZONE). Evan Parker misses. Rebound secured by Pascal Antetokounmpo.

[01:39] Team_036 possession (Score: 38-36)
Pascal Antetokounmpo makes the Layup and draws the foul on Gary Westbrook! And-1! Pascal Antetokounmpo to the line for 1. [Team fouls: 4] (Gary Westbrook: 2 personal fouls)   FT 1/1: GOOD Pascal Antetokounmpo makes 1/1 from the line.
Score: 38-39

[01:22] Team_023 possession (Score: 38-39)
Magic Booker drives to the basket... Magic Booker throws a bad pass! Stolen by Tobias Fox! TURNOVER! (live ball)

[01:08] Team_036 possession (Score: 38-39)
Pascal Antetokounmpo makes the Layup and draws the foul on Vince Gasol! And-1! Pascal Antetokounmpo to the line for 1. [BONUS: 5 team fouls] (Vince Gasol: 1 personal fouls)   FT 1/1: GOOD Pascal Antetokounmpo makes 1/1 from the line.
Score: 38-42

[00:53] Team_023 possession (Score: 38-42)
Gary Westbrook makes the Midrange and draws the foul on Pascal Antetokounmpo! And-1! Gary Westbrook to the line for 1. [BONUS: 6 team fouls] (Pascal Antetokounmpo: 1 personal fouls)   FT 1/1: GOOD Gary Westbrook makes 1/1 from the line.
Score: 41-42

[00:39] Team_036 possession (Score: 41-42)
Dirk Anunoby attempts a 3Pt. Contested by Tracy Anthony (4.0 feet, ZONE). DIRK ANUNOBY MAKES IT! Assist: Bradley Murray
Score: 41-45

[00:22] Team_023 possession (Score: 41-45)
Vince Gasol makes the Layup and draws the foul on Dirk Anunoby! And-1! Vince Gasol to the line for 1. [BONUS: 7 team fouls] (Dirk Anunoby: 1 personal fouls)   FT 1/1: GOOD Vince Gasol makes 1/1 from the line.
Score: 44-45

[00:11] Team_036 possession (Score: 44-45)
FOUL! Reach-in foul on Vince Gasol during the drive. [IN THE BONUS! 6 team fouls] Tobias Fox to the line for 2 free throws. (Vince Gasol: 2 personal fouls)   FT 1/2: GOOD   FT 2/2: GOOD Tobias Fox makes 2/2 from the line.
Score: 44-47

================================================================================
                              2ND QUARTER COMPLETE                              
================================================================================

2ND QUARTER SCORE: Team_023 24, Team_036 24

BOX SCORE:
================================================================================

Team_023
--------------------------------------------------------------------------------
Player                MIN  PTS  REB  AST  TO      FG   FG%      3P   3P%
--------------------------------------------------------------------------------
Vince Gasol             8    8    2    1   0   3/3   100.0     0/0   0.0
Trae Ingram            19    3    0    0   0   1/1   100.0     0/0   0.0
Evan Parker             5    3    0    0   0   1/2    50.0     0/0   0.0
Gary Westbrook          5    3    1    0   0   1/2    50.0     0/0   0.0
Kyle Paul              19    2    1    1   0   1/4    25.0     0/0   0.0
Josh Morant            19    2    3    0   0   1/3    33.3     0/0   0.0
Collin Ginobili        19    0    0    0   0   0/1     0.0     0/0   0.0

TEAM: FG: 9/18 (50.0%), 3PT: 2/6 (33.3%), REB: 10 (1 off, 9 def), AST: 3, TO: 4
TEAM FOULS: 6 [Team_036 in BONUS]


Team_036
--------------------------------------------------------------------------------
Player                MIN  PTS  REB  AST  TO      FG   FG%      3P   3P%
--------------------------------------------------------------------------------
Pascal Antetokounmpo    5    6    1    1   0   2/3    66.7     0/0   0.0
Kobe Simmons           16    5    4    0   0   2/4    50.0     0/0   0.0
Devin Simmons           5    3    2    0   0   1/2    50.0     0/0   0.0
Bradley Murray          8    3    0    2   0   1/1   100.0     0/0   0.0
Dirk Anunoby            5    3    0    0   0   1/1   100.0     0/0   0.0
Tim Bane               16    2    4    1   0   1/2    50.0     0/0   0.0
Tobias Fox              5    2    0    0   0   1/2    50.0     0/0   0.0
Terry Durant           19    0    4    0   0   0/3     0.0     0/0   0.0
Giannis Booker         19    0    1    0   0   0/2     0.0     0/0   0.0
Michael Westbrook      19    0    0    0   0   0/1     0.0     0/0   0.0
Anthony Poole          19    0    0    0   0   0/1     0.0     0/0   0.0

TEAM: FG: 8/20 (40.0%), 3PT: 4/8 (50.0%), REB: 13 (4 off, 9 def), AST: 3, TO: 2
TEAM FOULS: 7 [Team_023 in BONUS]

================================================================================

================================================================================
                       3RD QUARTER - Team_023 vs Team_036                       
================================================================================

[12:00] Team_023 possession (Score: 44-47)
Josh Morant attempts a 3Pt. Contested by Michael Westbrook (4.7 feet, ZONE). Josh Morant misses. Rebound secured by Terry Durant.

[11:43] Team_036 possession (Score: 44-47)
Terry Durant attempts a Midrange. Contested by Collin Ginobili (4.8 feet, ZONE). TERRY DURANT MAKES IT!
Score: 44-49

[11:25] Team_023 possession (Score: 44-49)
FOUL! Holding foul on Terry Durant. [Team fouls: 1] No free throws, side out. (Terry Durant: 1 personal fouls)

[11:10] Team_023 possession (Score: 44-49)
Collin Ginobili drives and kicks out. Kyle Paul attempts a 3Pt. Wide open! Anthony Poole is 6.7 feet away. [MAN] Kyle Paul misses. Rebound secured by Giannis Booker.

[10:56] Team_036 possession (Score: 44-49)
Anthony Poole attempts a 3Pt. Contested by Kyle Paul (4.1 feet, ZONE). Anthony Poole misses. Rebound secured by Kyle Paul.

[10:42] Team_023 possession (Score: 44-49)
Collin Ginobili drives to the basket... FOUL! Offensive foul on Collin Ginobili! Giannis Booker drew the charge! [Team fouls: 1] (Collin Ginobili: 1 personal fouls) TURNOVER! (dead ball)

[10:28] Team_036 possession (Score: 44-49)
Anthony Poole attempts a Midrange. Heavily contested by Kyle Paul (1.2 feet, MAN)! ANTHONY POOLE MAKES IT!
Score: 44-51

[10:12] Team_023 possession (Score: 44-51)
Kyle Paul attempts a Midrange. Contested by Michael Westbrook (3.4 feet, ZONE). KYLE PAUL MAKES IT! Assist: Josh Morant
Score: 46-51

[10:00] Team_036 possession (Score: 46-51)
Giannis Booker attempts a Midrange. Contested by Josh Morant (4.9 feet, ZONE). GIANNIS BOOKER MAKES IT!
Score: 46-53

[09:45] Team_023 possession (Score: 46-53)
Trae Ingram attempts a 3Pt. Wide open! Giannis Booker is 6.1 feet away. [ZONE] Trae Ingram misses. Rebound secured by Terry Durant.

[09:30] Team_036 possession (Score: 46-53)
Kobe Simmons drives, Tim Bane stays with him. Kobe Simmons attempts a Dunk. Contested by Tim Bane (2.2 feet, MAN). KOBE SIMMONS MAKES IT!
Score: 46-55

[09:16] Team_023 possession (Score: 46-55)
Josh Morant attempts a Layup. Contested by Terry Durant (3.9 feet, MAN). JOSH MORANT MAKES IT!
Score: 48-55

[09:00] Team_036 possession (Score: 48-55)
Giannis Booker drives, picks up Collin Ginobili. Help arrives from Kyle Paul! Giannis Booker attempts a Layup. Contested by Kyle Paul (4.1 feet, MAN). GIANNIS BOOKER MAKES IT! Assist: Michael Westbrook
Score: 48-57

[08:47] Team_023 possession (Score: 48-57)
Josh Morant drives, Terry Durant stays with him. Josh Morant attempts a Dunk. Contested by Terry Durant (3.8 feet, MAN). JOSH MORANT MAKES IT! Assist: Tim Bane
Score: 50-57

[08:29] Team_036 possession (Score: 50-57)
FOUL! Reach-in foul on Kyle Paul during the drive. [Team fouls: 2] No free throws, side out. (Kyle Paul: 1 personal fouls)

[08:19] Team_036 possession (Score: 50-57)
Terry Durant makes the Dunk and draws the foul on Tim Bane! And-1! Terry Durant to the line for 1. [Team fouls: 3] (Tim Bane: 1 personal fouls)   FT 1/1: GOOD Terry Durant makes 1/1 from the line.
Score: 50-60

[08:04] Team_023 possession (Score: 50-60)
Tim Bane loses control! Ball rolls out of bounds! TURNOVER! (dead ball)

[07:51] Team_036 possession (Score: 50-60)
Anthony Poole attempts a 3Pt. Contested by Kyle Paul (2.8 feet, ZONE). Anthony Poole misses. Rebound secured by Kyle Paul.

[07:40] Team_023 possession (Score: 50-60)
FOUL! Reach-in foul on Anthony Poole during the drive. [Team fouls: 2] No free throws, side out. (Anthony Poole: 1 personal fouls)

[07:28] Team_023 possession (Score: 50-60)
Trae Ingram attempts a Midrange. Contested by Michael Westbrook (3.9 feet, MAN). Trae Ingram misses. Rebound secured by Terry Durant.

[07:19] Team_036 possession (Score: 50-60)
Giannis Booker makes the Dunk and draws the foul on Kyle Paul! And-1! Giannis Booker to the line for 1. [Team fouls: 4] (Kyle Paul: 2 personal fouls)   FT 1/1: GOOD Giannis Booker makes 1/1 from the line.
Score: 50-63

[07:08] Team_023 possession (Score: 50-63)
Collin Ginobili attempts a Layup. Wide open! Giannis Booker is 6.6 feet away. [MAN] COLLIN GINOBILI MAKES IT! Assist: Kyle Paul
Score: 52-63

[06:59] Team_036 possession (Score: 52-63)
Kobe Simmons drives, Tim Bane stays with him. Kobe Simmons attempts a Layup. Contested by Tim Bane (2.8 feet, MAN). KOBE SIMMONS MAKES IT! Assist: Anthony Poole
Score: 52-65

[06:45] Team_023 possession (Score: 52-65)
Kyle Paul attempts a 3Pt. Wide open! Anthony Poole is 8.4 feet away. [MAN] KYLE PAUL MAKES IT!
Score: 55-65

[06:34] Team_036 possession (Score: 55-65)
Michael Westbrook attempts a 3Pt. Heavily contested by Kyle Paul (1.8 feet, ZONE)! Michael Westbrook misses. Rebound secured by Tim Bane.

[06:21] Team_023 possession (Score: 55-65)
Tim Bane throws a bad pass out of bounds! TURNOVER! (dead ball)

[06:10] Team_036 possession (Score: 55-65)
Giannis Booker drives, Tim Bane stays with him. Giannis Booker attempts a Layup. Contested by Tim Bane (4.3 feet, ZONE). GIANNIS BOOKER MAKES IT!
Score: 55-67

[05:57] Team_023 possession (Score: 55-67)
Trae Ingram drives and kicks out. Collin Ginobili attempts a 3Pt. Heavily contested by Giannis Booker (0.5 feet, MAN)! COLLIN GINOBILI MAKES IT! Assist: Josh Morant
Score: 58-67

[05:41] Team_036 possession (Score: 58-67)
Giannis Booker attempts a 3Pt. Contested by Collin Ginobili (4.9 feet, MAN). GIANNIS BOOKER MAKES IT! Assist: Anthony Poole
Score: 58-70

[05:27] Team_023 possession (Score: 58-70)
Josh Morant attempts a Layup. Contested by Terry Durant (4.0 feet, MAN). Josh Morant misses. Offensive rebound by Tim Bane! Tim Bane puts it back in!
Score: 60-70

[05:11] Team_036 possession (Score: 60-70)
Michael Westbrook drives, Tim Bane stays with him. Michael Westbrook attempts a Dunk. Wide open! Tim Bane is 6.0 feet away. [ZONE] MICHAEL WESTBROOK MAKES IT! Assist: Anthony Poole
Score: 60-72

[04:57] Team_023 possession (Score: 60-72)
Kyle Paul attempts a Midrange. Wide open! Anthony Poole is 6.6 feet away. [MAN] Kyle Paul misses. Rebound secured by Giannis Booker.

[04:48] Team_036 possession (Score: 60-72)
Kobe Simmons attempts a 3Pt. Contested by Kyle Paul (2.1 feet, ZONE). Kobe Simmons misses. Rebound secured by Kyle Paul.

[04:31] Team_023 possession (Score: 60-72)
Tim Bane drives and kicks out. Collin Ginobili attempts a 3Pt. Contested by Giannis Booker (2.7 feet, MAN). COLLIN GINOBILI MAKES IT! Assist: Josh Morant
Score: 63-72

[04:19] Team_036 possession (Score: 63-72)
Anthony Poole attempts a 3Pt. Contested by Josh Morant (2.8 feet, ZONE). Anthony Poole misses. Rebound secured by Tim Bane.

[04:03] Team_023 possession (Score: 63-72)
Kyle Paul attempts a 3Pt. Wide open! Michael Westbrook is 7.0 feet away. [ZONE] Kyle Paul misses. Offensive rebound by Josh Morant! Josh Morant kicks it out.

[03:46] Team_023 possession (Score: 63-72)
Kyle Paul attempts a 3Pt. Wide open! Giannis Booker is 7.4 feet away. [ZONE] Kyle Paul misses. Rebound secured by Giannis Booker.

[03:32] Team_036 possession (Score: 63-72)
Anthony Poole attempts a Midrange. Contested by Trae Ingram (3.7 feet, ZONE). Anthony Poole misses. Offensive rebound by Terry Durant! Terry Durant puts it back in!
Score: 63-74

[03:20] Team_023 possession (Score: 63-74)
Tim Bane drives, Kobe Simmons stays with him. Tim Bane attempts a Dunk. Contested by Kobe Simmons (2.3 feet, ZONE). TIM BANE MAKES IT! Assist: Kyle Paul
Score: 65-74

[03:03] Team_036 possession (Score: 65-74)
Giannis Booker attempts a 3Pt. Contested by Collin Ginobili (5.9 feet, MAN). GIANNIS BOOKER MAKES IT! Assist: Terry Durant
Score: 65-77

[02:49] Team_023 possession (Score: 65-77)
Josh Morant attempts a Midrange. Contested by Terry Durant (3.3 feet, MAN). Josh Morant misses. Rebound secured by Terry Durant.

[02:33] Team_036 possession (Score: 65-77)
Terry Durant attempts a 3Pt. Contested by Josh Morant (4.2 feet, ZONE). Terry Durant misses. Offensive rebound by Terry Durant! Terry Durant's putback is no good. Offensive rebound by Terry Durant! Terry Durant kicks it out.

[02:17] Team_036 possession (Score: 65-77)
Giannis Booker loses control! Ball rolls out of bounds! TURNOVER! (dead ball)

[02:17] Substitution (Team_023): Trae Ingram OUT → Tracy Anthony IN (stamina_rule2)

[02:17] Substitution (Team_023): Collin Ginobili OUT → Magic Booker IN (stamina_rule2)

[02:17] Substitution (Team_023): Kyle Paul OUT → Gary Westbrook IN (stamina_rule2)

[02:17] Substitution (Team_023): Josh Morant OUT → Evan Parker IN (stamina_rule2)

[02:17] Substitution (Team_023): Tim Bane OUT → Vince Gasol IN (stamina_rule2)

[02:17] Substitution (Team_036): Michael Westbrook OUT → Dirk Anunoby IN (stamina_rule2)

[02:17] Substitution (Team_036): Giannis Booker OUT → Tobias Fox IN (stamina_rule2)

[02:17] Substitution (Team_036): Anthony Poole OUT → Pascal Antetokounmpo IN (stamina_rule2)

[02:17] Substitution (Team_036): Terry Durant OUT → Devin Simmons IN (stamina_rule2)

[02:17] Substitution (Team_036): Kobe Simmons OUT → Bradley Murray IN (stamina_rule2)

[02:05] Team_023 possession (Score: 65-77)
Tracy Anthony throws a bad pass! Stolen by Dirk Anunoby! TURNOVER! (live ball)

[01:52] Team_036 possession (Score: 65-77)
Bradley Murray attempts a Midrange. Contested by Magic Booker (5.7 feet, ZONE). BRADLEY MURRAY MAKES IT! Assist: Devin Simmons
Score: 65-79

[01:39] Team_023 possession (Score: 65-79)
FOUL! Shooting foul on Dirk Anunoby. Vince Gasol to the line for 2 free throws. [Team fouls: 3] (Dirk Anunoby: 1 personal fouls)   FT 1/2: GOOD   FT 2/2: MISS Vince Gasol makes 1/2 from the line. Rebound secured by Bradley Murray.
Score: 66-79

[01:29] Team_036 possession (Score: 66-79)
Pascal Antetokounmpo drives and kicks out. Devin Simmons attempts a 3Pt. Contested by Tracy Anthony (4.5 feet, ZONE). DEVIN SIMMONS MAKES IT! Assist: Bradley Murray
Score: 66-82

[01:18] Team_023 possession (Score: 66-82)
FOUL! Shooting foul on Tobias Fox. Magic Booker to the line for 2 free throws. [Team fouls: 4] (Tobias Fox: 1 personal fouls)   FT 1/2: GOOD   FT 2/2: MISS Magic Booker makes 1/2 from the line. Rebound secured by Pascal Antetokounmpo.
Score: 67-82

[01:04] Team_036 possession (Score: 67-82)
Pascal Antetokounmpo drives to the basket... Pascal Antetokounmpo throws a bad pass out of bounds! TURNOVER! (dead ball)

[00:47] Team_023 possession (Score: 67-82)
Vince Gasol attempts a 3Pt. Contested by Dirk Anunoby (4.5 feet, ZONE). Vince Gasol misses. Offensive rebound by Vince Gasol! Vince Gasol's putback is no good. Rebound secured by Bradley Murray.

[00:29] Team_036 possession (Score: 67-82)
Tobias Fox attempts a Layup. Contested by Magic Booker (4.8 feet, MAN). Tobias Fox misses. Rebound secured by Evan Parker.

[00:15] Team_023 possession (Score: 67-82)
Magic Booker attempts a Layup. Wide open! Tobias Fox is 7.9 feet away. [MAN] MAGIC BOOKER MAKES IT!
Score: 69-82

================================================================================
                              3RD QUARTER COMPLETE                              
================================================================================

3RD QUARTER SCORE: Team_023 25, Team_036 35

BOX SCORE:
================================================================================

Team_023
--------------------------------------------------------------------------------
Player                MIN  PTS  REB  AST  TO      FG   FG%      3P   3P%
--------------------------------------------------------------------------------
Collin Ginobili        29    8    0    0   0   3/4    75.0     0/0   0.0
Kyle Paul              29    5    3    2   0   2/4    50.0     0/0   0.0
Josh Morant            29    4    1    3   0   2/4    50.0     0/0   0.0
Tim Bane               26    4    3    1   0   2/2   100.0     0/0   0.0
Bradley Murray         10    2    2    1   0   1/1   100.0     0/0   0.0
Magic Booker            7    2    0    0   0   1/2    50.0     0/0   0.0
Trae Ingram            29    0    0    0   0   0/2     0.0     0/0   0.0
Vince Gasol            10    0    0    0   0   0/2     0.0     0/0   0.0
Evan Parker             7    0    1    0   0   0/0     0.0     0/0   0.0

TEAM: FG: 10/20 (50.0%), 3PT: 1/5 (20.0%), REB: 9 (3 off, 6 def), AST: 6, TO: 4
TEAM FOULS: 4


Team_036
--------------------------------------------------------------------------------
Player                MIN  PTS  REB  AST  TO      FG   FG%      3P   3P%
--------------------------------------------------------------------------------
Giannis Booker         29   15    3    0   0   6/6   100.0     0/0   0.0
Terry Durant           29    7    6    1   0   3/3   100.0     0/0   0.0
Kobe Simmons           26    4    0    0   0   2/3    66.7     0/0   0.0
Devin Simmons           7    3    0    1   0   1/1   100.0     0/0   0.0
Anthony Poole          29    2    0    3   0   1/4    25.0     0/0   0.0
Michael Westbrook      29    2    0    1   0   1/2    50.0     0/0   0.0
Pascal Antetokounmpo    7    0    1    0   0   0/0     0.0     0/0   0.0
Tobias Fox              7    0    0    0   0   0/1     0.0     0/0   0.0

TEAM: FG: 15/21 (71.4%), 3PT: 2/7 (28.6%), REB: 11 (2 off, 9 def), AST: 7, TO: 2
TEAM FOULS: 4

================================================================================

================================================================================
                       4TH QUARTER - Team_023 vs Team_036                       
================================================================================

[12:00] Substitution (Team_023): Trae Ingram OUT (stamina: 78) → Tracy Anthony IN (comeback_detected)

[12:00] Substitution (Team_036): Michael Westbrook OUT (stamina: 78) → Dirk Anunoby IN (comeback_detected)

[12:00] Team_023 possession (Score: 69-82)
Collin Ginobili loses control! Ball rolls out of bounds! TURNOVER! (dead ball)

[11:44] Team_036 possession (Score: 69-82)
Anthony Poole loses control! Ball rolls out of bounds! TURNOVER! (dead ball)

[11:32] Team_023 possession (Score: 69-82)
Kyle Paul attempts a 3Pt. Wide open! Giannis Booker is 6.4 feet away. [ZONE] Kyle Paul misses. Rebound secured by Giannis Booker.

[11:14] Team_036 possession (Score: 69-82)
Giannis Booker attempts a 3Pt. Contested by Tracy Anthony (2.9 feet, ZONE). GIANNIS BOOKER MAKES IT! Assist: Dirk Anunoby
Score: 69-85

[10:57] Team_023 possession (Score: 69-85)
Josh Morant throws a bad pass out of bounds! TURNOVER! (dead ball)

[10:39] Team_036 possession (Score: 69-85)
Dirk Anunoby attempts a 3Pt. Heavily contested by Tracy Anthony (0.6 feet, MAN)! Dirk Anunoby misses. Rebound secured by Tim Bane.

[10:25] Team_023 possession (Score: 69-85)
Tim Bane makes the Layup and draws the foul on Kobe Simmons! And-1! Tim Bane to the line for 1. [Team fouls: 1] (Kobe Simmons: 1 personal fouls)   FT 1/1: MISS Tim Bane makes 0/1 from the line. Rebound secured by Terry Durant.
Score: 71-85

[10:08] Team_036 possession (Score: 71-85)
Terry Durant drives, picks up Josh Morant. Help arrives from Tracy Anthony! Terry Durant attempts a Dunk. Contested by Tracy Anthony (5.3 feet, MAN). TERRY DURANT MAKES IT!
Score: 71-87

[09:53] Team_023 possession (Score: 71-87)
Collin Ginobili attempts a Midrange. Contested by Giannis Booker (2.3 feet, MAN). COLLIN GINOBILI MAKES IT!
Score: 73-87

[09:35] Team_036 possession (Score: 73-87)
Terry Durant makes the Layup and draws the foul on Josh Morant! And-1! Terry Durant to the line for 1. [Team fouls: 1] (Josh Morant: 1 personal fouls)   FT 1/1: GOOD Terry Durant makes 1/1 from the line.
Score: 73-90

[09:20] Team_023 possession (Score: 73-90)
Collin Ginobili attempts a Midrange. Contested by Dirk Anunoby (5.1 feet, ZONE). Collin Ginobili misses. Rebound secured by Kobe Simmons.

[09:03] Team_036 possession (Score: 73-90)
Anthony Poole drives, Tim Bane stays with him. Anthony Poole attempts a Dunk. Contested by Tim Bane (3.6 feet, ZONE). ANTHONY POOLE MAKES IT! Assist: Dirk Anunoby
Score: 73-92

[08:49] Team_023 possession (Score: 73-92)
Tracy Anthony makes the Layup and draws the foul on Kobe Simmons! And-1! Tracy Anthony to the line for 1. [Team fouls: 2] (Kobe Simmons: 2 personal fouls)   FT 1/1: GOOD Tracy Anthony makes 1/1 from the line.
Score: 76-92

[08:33] Team_036 possession (Score: 76-92)
Anthony Poole attempts a Midrange. Wide open! Collin Ginobili is 9.9 feet away. [ZONE] Anthony Poole misses. Rebound secured by Kyle Paul.

[08:19] Team_023 possession (Score: 76-92)
Tracy Anthony attempts a 3Pt. Wide open! Dirk Anunoby is 6.4 feet away. [MAN] Tracy Anthony misses. Rebound secured by Kobe Simmons.

[08:04] Team_036 possession (Score: 76-92)
Giannis Booker drives to the basket... Giannis Booker throws a bad pass out of bounds! TURNOVER! (dead ball)

[08:04] Substitution (Team_023): Collin Ginobili OUT → Magic Booker IN (stamina_rule2)

[08:04] Substitution (Team_023): Kyle Paul OUT → Gary Westbrook IN (stamina_rule2)

[08:04] Substitution (Team_023): Josh Morant OUT → Evan Parker IN (stamina_rule2)

[08:04] Substitution (Team_023): Tim Bane OUT → Vince Gasol IN (stamina_rule2)

[08:04] Substitution (Team_036): Giannis Booker OUT → Tobias Fox IN (stamina_rule2)

[08:04] Substitution (Team_036): Anthony Poole OUT → Pascal Antetokounmpo IN (stamina_rule2)

[08:04] Substitution (Team_036): Terry Durant OUT → Devin Simmons IN (stamina_rule2)

[08:04] Substitution (Team_036): Kobe Simmons OUT → Bradley Murray IN (stamina_rule2)

[07:47] Team_023 possession (Score: 76-92)
Vince Gasol drives, Devin Simmons stays with him. Vince Gasol attempts a Dunk. Contested by Devin Simmons (3.3 feet, ZONE). VINCE GASOL MAKES IT! Assist: Gary Westbrook
Score: 78-92

[07:30] Team_036 possession (Score: 78-92)
Pascal Antetokounmpo drives and kicks out. FOUL! Shooting foul on Evan Parker. Dirk Anunoby to the line for 2 free throws. [Team fouls: 2] (Evan Parker: 1 personal fouls)   FT 1/2: GOOD   FT 2/2: GOOD Dirk Anunoby makes 2/2 from the line.
Score: 78-94

[07:16] Team_023 possession (Score: 78-94)
Gary Westbrook attempts a 3Pt. Contested by Tobias Fox (5.7 feet, ZONE). Gary Westbrook misses. Rebound secured by Bradley Murray.

[06:59] Team_036 possession (Score: 78-94)
Devin Simmons attempts a 3Pt. Contested by Tracy Anthony (6.0 feet, ZONE). DEVIN SIMMONS MAKES IT! Assist: Dirk Anunoby
Score: 78-97

[06:42] Team_023 possession (Score: 78-97)
Evan Parker drives, picks up Devin Simmons. Help arrives from Dirk Anunoby! Evan Parker attempts a Layup. Heavily contested by Dirk Anunoby (0.5 feet, MAN)! EVAN PARKER MAKES IT!
Score: 80-97

[06:26] Team_036 possession (Score: 80-97)
Bradley Murray drives and kicks out. Tobias Fox attempts a Midrange. Wide open! Magic Booker is 6.1 feet away. [MAN] TOBIAS FOX MAKES IT! Assist: Devin Simmons
Score: 80-99

[06:12] Team_023 possession (Score: 80-99)
Vince Gasol attempts a Midrange. Contested by Bradley Murray (4.0 feet, MAN). Vince Gasol misses. Rebound secured by Bradley Murray.

[05:56] Team_036 possession (Score: 80-99)
FOUL! Reach-in foul on Vince Gasol during the drive. [Team fouls: 3] No free throws, side out. (Vince Gasol: 1 personal fouls)

[05:43] Team_036 possession (Score: 80-99)
Devin Simmons attempts a Midrange. Heavily contested by Evan Parker (0.8 feet, ZONE)! Devin Simmons misses. Rebound secured by Evan Parker.

[05:29] Team_023 possession (Score: 80-99)
Vince Gasol attempts a 3Pt. Contested by Bradley Murray (4.3 feet, MAN). Vince Gasol misses. Rebound secured by Pascal Antetokounmpo.

[05:16] Team_036 possession (Score: 80-99)
Pascal Antetokounmpo drives to the basket... Pascal Antetokounmpo throws a bad pass out of bounds! TURNOVER! (dead ball)

[04:59] Team_023 possession (Score: 80-99)
Tracy Anthony attempts a 3Pt. Wide open! Dirk Anunoby is 10.0 feet away. [MAN] TRACY ANTHONY MAKES IT! Assist: Magic Booker
Score: 83-99

[04:42] Team_036 possession (Score: 83-99)
Dirk Anunoby attempts a Layup. Heavily contested by Vince Gasol (1.5 feet, ZONE)! Dirk Anunoby misses. Offensive rebound by Devin Simmons! Devin Simmons kicks it out.

[04:31] Team_036 possession (Score: 83-99)
FOUL! Shooting foul on Gary Westbrook. Pascal Antetokounmpo to the line for 2 free throws. [Team fouls: 4] (Gary Westbrook: 1 personal fouls)   FT 1/2: GOOD   FT 2/2: MISS Pascal Antetokounmpo makes 1/2 from the line. Rebound secured by Gary Westbrook.
Score: 83-100

[04:16] Team_023 possession (Score: 83-100)
FOUL! Shooting foul on Devin Simmons. Evan Parker to the line for 2 free throws. [Team fouls: 3] (Devin Simmons: 1 personal fouls)   FT 1/2: GOOD   FT 2/2: GOOD Evan Parker makes 2/2 from the line.
Score: 85-100

[04:04] Team_036 possession (Score: 85-100)
Tobias Fox attempts a Midrange. Contested by Magic Booker (4.5 feet, MAN). TOBIAS FOX MAKES IT!
Score: 85-102

[03:44] Team_023 possession (Score: 85-102)
Magic Booker attempts a 3Pt. Wide open! Tobias Fox is 7.7 feet away. [MAN] MAGIC BOOKER MAKES IT! Assist: Vince Gasol
Score: 88-102

[03:27] Team_036 possession (Score: 88-102)
Pascal Antetokounmpo drives, Vince Gasol stays with him. Pascal Antetokounmpo attempts a Layup. Heavily contested by Vince Gasol (0.5 feet, ZONE)! PASCAL ANTETOKOUNMPO MAKES IT! Assist: Dirk Anunoby
Score: 88-104

[03:14] Team_023 possession (Score: 88-104)
Vince Gasol attempts a Midrange. Wide open! Bradley Murray is 6.5 feet away. [MAN] Vince Gasol misses. Rebound secured by Pascal Antetokounmpo.

[02:59] Team_036 possession (Score: 88-104)
Pascal Antetokounmpo drives and kicks out. Dirk Anunoby attempts a 3Pt. Contested by Tracy Anthony (4.6 feet, MAN). Dirk Anunoby misses. Rebound secured by Gary Westbrook.

[02:46] Team_023 possession (Score: 88-104)
Vince Gasol drives to the basket... Vince Gasol throws a bad pass! Stolen by Bradley Murray! TURNOVER! (live ball)

[02:36] Team_036 possession (Score: 88-104)
Pascal Antetokounmpo attempts a 3Pt. Wide open! Gary Westbrook is 7.5 feet away. [MAN] Pascal Antetokounmpo misses. Rebound secured by Vince Gasol.

[02:21] Team_023 possession (Score: 88-104)
Tracy Anthony attempts a Midrange. Wide open! Dirk Anunoby is 7.5 feet away. [MAN] TRACY ANTHONY MAKES IT!
Score: 90-104

[02:08] Team_036 possession (Score: 90-104)
Devin Simmons attempts a Midrange. Heavily contested by Evan Parker (0.8 feet, MAN)! Devin Simmons misses. Rebound secured by Vince Gasol.

[01:51] Team_023 possession (Score: 90-104)
Evan Parker attempts a Layup. Contested by Devin Simmons (2.5 feet, MAN). Evan Parker misses. Offensive rebound by Vince Gasol! Vince Gasol's putback is no good. Rebound secured by Pascal Antetokounmpo.

[01:41] Team_036 possession (Score: 90-104)
Devin Simmons throws a bad pass out of bounds! TURNOVER! (dead ball)

[01:41] Substitution (Team_023): Tracy Anthony OUT → Trae Ingram IN (starter_return_rule1)

[01:41] Substitution (Team_036): Dirk Anunoby OUT → Michael Westbrook IN (starter_return_rule1)

[01:27] Team_023 possession (Score: 90-104)
Vince Gasol drives to the basket... Vince Gasol throws a bad pass! Stolen by Bradley Murray! TURNOVER! (live ball)

[01:12] Team_036 possession (Score: 90-104)
Bradley Murray makes the Layup and draws the foul on Vince Gasol! And-1! Bradley Murray to the line for 1. [BONUS: 5 team fouls] (Vince Gasol: 2 personal fouls)   FT 1/1: GOOD Bradley Murray makes 1/1 from the line.
Score: 90-107

[00:57] Team_023 possession (Score: 90-107)
Magic Booker attempts a 3Pt. Wide open! Tobias Fox is 7.7 feet away. [MAN] Magic Booker misses. Offensive rebound by Vince Gasol! Vince Gasol's putback is no good. Rebound secured by Devin Simmons.

[00:40] Team_036 possession (Score: 90-107)
Tobias Fox drives to the basket... Tobias Fox loses the ball! Stripped by Vince Gasol! TURNOVER! (live ball)

[00:27] Team_023 possession (Score: 90-107)
Gary Westbrook attempts a Midrange. Contested by Pascal Antetokounmpo (4.4 feet, MAN). GARY WESTBROOK MAKES IT! Assist: Magic Booker
Score: 92-107

[00:16] Team_036 possession (Score: 92-107)
Devin Simmons attempts a Layup. Contested by Evan Parker (3.3 feet, MAN). Devin Simmons misses. Offensive rebound by Devin Simmons! Devin Simmons kicks it out.

================================================================================
                              4TH QUARTER COMPLETE                              
================================================================================

4TH QUARTER SCORE: Team_023 23, Team_036 25

BOX SCORE:
================================================================================

Team_023
--------------------------------------------------------------------------------
Player                MIN  PTS  REB  AST  TO      FG   FG%      3P   3P%
--------------------------------------------------------------------------------
Tracy Anthony          18    8    0    0   0   3/4    75.0     0/0   0.0
Evan Parker            15    4    1    0   0   2/3    66.7     0/0   0.0
Magic Booker           15    3    0    2   0   1/2    50.0     0/0   0.0
Collin Ginobili        33    2    0    0   0   1/2    50.0     0/0   0.0
Vince Gasol            18    2    2    1   0   1/4    25.0     0/0   0.0
Gary Westbrook         15    2    2    1   0   1/2    50.0     0/0   0.0
Pascal Antetokounmpo   15    2    3    0   0   1/4    25.0     0/0   0.0
Kyle Paul              33    0    1    0   0   0/1     0.0     0/0   0.0
Tim Bane               30    0    1    0   0   0/1     0.0     0/0   0.0

TEAM: FG: 9/19 (47.4%), 3PT: 2/7 (28.6%), REB: 9 (2 off, 7 def), AST: 4, TO: 4
TEAM FOULS: 5 [Team_036 in BONUS]


Team_036
--------------------------------------------------------------------------------
Player                MIN  PTS  REB  AST  TO      FG   FG%      3P   3P%
--------------------------------------------------------------------------------
Terry Durant           33    5    1    0   0   2/2   100.0     0/0   0.0
Tobias Fox             15    4    0    0   0   2/2   100.0     0/0   0.0
Giannis Booker         33    3    1    0   0   1/1   100.0     0/0   0.0
Bradley Murray         18    3    2    0   0   1/1   100.0     0/0   0.0
Devin Simmons          15    3    3    1   0   1/3    33.3     0/0   0.0
Dirk Anunoby           18    2    0    4   0   1/2    50.0     0/0   0.0
Anthony Poole          33    2    0    0   0   1/2    50.0     0/0   0.0
Kobe Simmons           30    0    2    0   0   0/0     0.0     0/0   0.0

TEAM: FG: 10/17 (58.8%), 3PT: 2/4 (50.0%), REB: 10 (2 off, 8 def), AST: 5, TO: 5
TEAM FOULS: 3

================================================================================

================================================================================
                               FULL GAME COMPLETE                               
================================================================================

FINAL SCORE: Team_023 92, Team_036 107

SCORING BY QUARTER:
--------------------------------------------------------------------------------
Team                     Q1     Q2     Q3     Q4    FINAL
--------------------------------------------------------------------------------
Team_023                 20     24     25     23       92
Team_036                 23     24     35     25      107
--------------------------------------------------------------------------------

FULL GAME BOX SCORE:
================================================================================

Team_023
--------------------------------------------------------------------------------
Player                MIN  PTS  REB  AST  TO      FG   FG%      3P   3P%      FT STL BLK
--------------------------------------------------------------------------------
Collin Ginobili        33   18    0    1   5   5/10   50.0   1/2    50.0   3/3     0   0
Kyle Paul              33   10    7    3   1   4/11   36.4   1/4    25.0   4/5     1   1
Josh Morant            33    6    5    4   1   4/12   33.3   0/3     0.0   0/0     0   0
Tim Bane               30   12   12    2   2   4/7    57.1   0/1     0.0   1/2     0   2
Trae Ingram            30    6    0    1   1   4/10   40.0   2/3    66.7   0/0     1   0
Tracy Anthony          18    8    0    0   1   3/4    75.0   1/2    50.0   1/1     0   0
Vince Gasol            18   10    5    2   0   4/10   40.0   0/2     0.0   5/6     2   0
Magic Booker           15    5    0    2   1   2/4    50.0   1/2    50.0   1/2     0   0
Gary Westbrook         15    5    3    1   1   2/4    50.0   0/1     0.0   1/1     0   1
Evan Parker            15    7    2    0   2   3/5    60.0   1/2    50.0   2/2     0   0

TEAM: FG: 35/77 (45.5%), 3PT: 7/22 (31.8%), REB: 36 (7 off, 29 def), AST: 16, TO: 15


Team_036
--------------------------------------------------------------------------------
Player                MIN  PTS  REB  AST  TO      FG   FG%      3P   3P%      FT STL BLK
--------------------------------------------------------------------------------
Giannis Booker         33   26    7    1   2   9/13   69.2   4/6    66.7   2/2     0   0
Anthony Poole          33    4    0    4   4   4/11   36.4   1/5    20.0   0/0     0   0
Terry Durant           33   14   20    2   1   7/11   63.6   0/2     0.0   2/3     1   0
Kobe Simmons           30   15    9    1   1   4/7    57.1   0/2     0.0   2/2     0   0
Michael Westbrook      30    9    0    2   3   4/7    57.1   1/3    33.3   0/0     1   0
Dirk Anunoby           18    5    0    4   1   1/2    50.0   1/2    50.0   2/2     1   0
Bradley Murray         18    8    6    3   1   4/5    80.0   1/1   100.0   1/1     2   0
Tobias Fox             15    6    0    0   0   2/4    50.0   0/1     0.0   2/2     2   0
Pascal Antetokounmpo   15    8    5    1   1   5/9    55.6   0/1     0.0   3/4     0   0
Devin Simmons          15    9    5    2   1   2/5    40.0   2/2   100.0   0/0     0   0

TEAM: FG: 42/74 (56.8%), 3PT: 10/25 (40.0%), REB: 50 (11 off, 39 def), AST: 20, TO: 15

================================================================================
