================================================================================
                        FULL GAME - Team_057 vs Team_005                        
================================================================================

================================================================================
                       1ST QUARTER - Team_057 vs Team_005                       
================================================================================

[12:00] Team_057 possession (Score: 0-0)
Anfernee Adebayo drives, Derrick Allen stays with him. Anfernee Adebayo attempts a Dunk. Contested by Derrick Allen (4.5 feet, MAN). Anfernee Adebayo misses. Offensive rebound by Ben Adebayo! Ben Adebayo kicks it out.

[11:45] Team_057 possession (Score: 0-0)
Kobe Ming attempts a Layup. BLOCKED BY CADE MARKKANEN! Ball deflects out of bounds off Kobe Ming.

[11:31] Team_005 possession (Score: 0-0)
Cade Markkanen drives and kicks out. Brandon George attempts a Midrange. Contested by Kobe Ming (4.0 feet, MAN). Brandon George misses. Rebound secured by Miles Middleton.

[11:18] Team_057 possession (Score: 0-0)
Kobe Ming attempts a Midrange. Wide open! Brandon George is 6.5 feet away. [MAN] Kobe Ming misses. Rebound secured by Derrick Allen.

[11:05] Team_005 possession (Score: 0-0)
Jalen Rozier throws a bad pass! Stolen by Ben Adebayo! TURNOVER! (live ball)

[10:51] Team_057 possession (Score: 0-0)
Miles Middleton drives, Cade Markkanen stays with him. Miles Middleton attempts a Layup. Contested by Cade Markkanen (2.1 feet, MAN). MILES MIDDLETON MAKES IT!
Score: 2-0

[10:32] Team_005 possession (Score: 2-0)
Cade Markkanen attempts a 3Pt. Contested by Kobe Ming (3.8 feet, ZONE). CADE MARKKANEN MAKES IT! Assist: Jalen Rozier
Score: 2-3

[10:21] Team_057 possession (Score: 2-3)
Kobe Ming attempts a Layup. Contested by Brandon George (3.0 feet, MAN). KOBE MING MAKES IT! Assist: Klay Rozier
Score: 4-3

[10:09] Team_005 possession (Score: 4-3)
Jalen Rozier attempts a Layup. Contested by Ben Adebayo (4.3 feet, ZONE). Jalen Rozier misses. Rebound secured by Ben Adebayo.

[09:56] Team_057 possession (Score: 4-3)
Ben Adebayo drives to the basket... Ben Adebayo commits a violation (traveling/carry)! TURNOVER! (dead ball)

[09:40] Team_005 possession (Score: 4-3)
Jalen Rozier attempts a Midrange. Contested by Ben Adebayo (4.5 feet, MAN). Jalen Rozier misses. Offensive rebound by Jalen Rozier! Jalen Rozier kicks it out.

[09:27] Team_005 possession (Score: 4-3)
Jalen Rozier makes the Dunk and draws the foul on Ben Adebayo! And-1! Jalen Rozier to the line for 1. [Team fouls: 1] (Ben Adebayo: 1 personal fouls)   FT 1/1: GOOD Jalen Rozier makes 1/1 from the line.
Score: 4-6

[09:08] Team_057 possession (Score: 4-6)
Klay Rozier attempts a Midrange. Contested by Anthony Rozier (5.1 feet, MAN). Klay Rozier misses. Rebound secured by Cade Markkanen.

[08:53] Team_005 possession (Score: 4-6)
Brandon George attempts a 3Pt. Contested by Kobe Ming (5.1 feet, ZONE). Brandon George misses. Rebound secured by Miles Middleton.

[08:36] Team_057 possession (Score: 4-6)
Miles Middleton drives, Cade Markkanen stays with him. Miles Middleton attempts a Dunk. Contested by Cade Markkanen (5.5 feet, MAN). MILES MIDDLETON MAKES IT! Assist: Klay Rozier
Score: 6-6

[08:23] Team_005 possession (Score: 6-6)
Jalen Rozier drives, Ben Adebayo stays with him. Jalen Rozier attempts a Dunk. Wide open! Ben Adebayo is 7.9 feet away. [ZONE] JALEN ROZIER MAKES IT!
Score: 6-8

[08:12] Team_057 possession (Score: 6-8)
FOUL! Holding foul on Brandon George. [Team fouls: 1] No free throws, side out. (Brandon George: 1 personal fouls)

[08:01] Team_057 possession (Score: 6-8)
Ben Adebayo attempts a 3Pt. Wide open! Derrick Allen is 8.4 feet away. [ZONE] BEN ADEBAYO MAKES IT! Assist: Anfernee Adebayo
Score: 9-8

[07:49] Team_005 possession (Score: 9-8)
FOUL! Shooting foul on Klay Rozier. Jalen Rozier to the line for 2 free throws. [Team fouls: 2] (Klay Rozier: 1 personal fouls)   FT 1/2: GOOD   FT 2/2: GOOD Jalen Rozier makes 2/2 from the line.
Score: 9-10

[07:33] Team_057 possession (Score: 9-10)
Klay Rozier drives and kicks out. Ben Adebayo attempts a Midrange. Wide open! Anthony Rozier is 6.5 feet away. [ZONE] Ben Adebayo misses. Offensive rebound by Miles Middleton! Miles Middleton kicks it out.

[07:18] Team_057 possession (Score: 9-10)
Anfernee Adebayo drives, Cade Markkanen stays with him. Anfernee Adebayo attempts a Dunk. Wide open! Cade Markkanen is 6.7 feet away. [ZONE] Anfernee Adebayo misses. Rebound secured by Jalen Rozier.

[07:03] Team_005 possession (Score: 9-10)
Brandon George drives and kicks out. Anthony Rozier attempts a Midrange. Contested by Ben Adebayo (2.1 feet, ZONE). ANTHONY ROZIER MAKES IT! Assist: Brandon George
Score: 9-12

[06:51] Team_057 possession (Score: 9-12)
Miles Middleton attempts a Midrange. Contested by Cade Markkanen (2.1 feet, ZONE). Miles Middleton misses. Rebound secured by Cade Markkanen.

[06:40] Team_005 possession (Score: 9-12)
Cade Markkanen attempts a Midrange. Heavily contested by Klay Rozier (1.0 feet, ZONE)! Cade Markkanen misses. Offensive rebound by Jalen Rozier! Jalen Rozier kicks it out.

[06:28] Team_005 possession (Score: 9-12)
Jalen Rozier drives, picks up Ben Adebayo. Help arrives from Klay Rozier! Jalen Rozier attempts a Layup. Contested by Klay Rozier (5.8 feet, MAN). JALEN ROZIER MAKES IT! Assist: Brandon George
Score: 9-14

[06:14] Team_057 possession (Score: 9-14)
FOUL! Holding foul on Derrick Allen. [Team fouls: 2] No free throws, side out. (Derrick Allen: 1 personal fouls)

[06:02] Team_057 possession (Score: 9-14)
Ben Adebayo drives and kicks out. Kobe Ming attempts a 3Pt. Wide open! Derrick Allen is 7.4 feet away. [ZONE] Kobe Ming misses. Rebound secured by Jalen Rozier.

[05:49] Team_005 possession (Score: 9-14)
FOUL! Shooting foul on Klay Rozier. Jalen Rozier to the line for 2 free throws. [Team fouls: 3] (Klay Rozier: 2 personal fouls)   FT 1/2: GOOD   FT 2/2: GOOD Jalen Rozier makes 2/2 from the line.
Score: 9-16

[05:35] Team_057 possession (Score: 9-16)
Ben Adebayo drives, picks up Cade Markkanen. Help arrives from Anthony Rozier! Ben Adebayo attempts a Layup. Heavily contested by Anthony Rozier (1.6 feet, ZONE)! BEN ADEBAYO MAKES IT!
Score: 11-16

[05:21] Team_005 possession (Score: 11-16)
Derrick Allen attempts a Midrange. Wide open! Ben Adebayo is 8.1 feet away. [ZONE] DERRICK ALLEN MAKES IT!
Score: 11-18

[05:05] Team_057 possession (Score: 11-18)
Ben Adebayo attempts a Midrange. Wide open! Cade Markkanen is 6.4 feet away. [MAN] Ben Adebayo misses. Rebound secured by Cade Markkanen.

[04:50] Team_005 possession (Score: 11-18)
Derrick Allen attempts a 3Pt. Contested by Anfernee Adebayo (4.8 feet, MAN). Derrick Allen misses. Rebound secured by Anfernee Adebayo.

[04:35] Team_057 possession (Score: 11-18)
Ben Adebayo attempts a 3Pt. Contested by Derrick Allen (3.4 feet, ZONE). Ben Adebayo misses. Rebound secured by Jalen Rozier.

[04:17] Team_005 possession (Score: 11-18)
Derrick Allen attempts a Midrange. Contested by Anfernee Adebayo (5.5 feet, MAN). DERRICK ALLEN MAKES IT!
Score: 11-20

[04:01] Team_057 possession (Score: 11-20)
Miles Middleton drives, picks up Cade Markkanen. Help arrives from Anthony Rozier! Miles Middleton attempts a Dunk. Heavily contested by Anthony Rozier (1.5 feet, MAN)! Miles Middleton misses. Offensive rebound by Miles Middleton! Miles Middleton kicks it out.

[03:49] Team_057 possession (Score: 11-20)
Anfernee Adebayo drives and kicks out. Ben Adebayo attempts a 3Pt. Contested by Jalen Rozier (4.4 feet, MAN). Ben Adebayo misses. Rebound secured by Cade Markkanen.

[03:36] Team_005 possession (Score: 11-20)
Jalen Rozier drives, Ben Adebayo stays with him. Jalen Rozier attempts a Layup. Contested by Ben Adebayo (5.0 feet, ZONE). JALEN ROZIER MAKES IT!
Score: 11-22

[03:24] Team_057 possession (Score: 11-22)
Kobe Ming attempts a Layup. Contested by Brandon George (5.1 feet, MAN). KOBE MING MAKES IT! Assist: Klay Rozier
Score: 13-22

[03:09] Team_005 possession (Score: 13-22)
FOUL! Shooting foul on Kobe Ming. Cade Markkanen to the line for 2 free throws. [Team fouls: 4] (Kobe Ming: 1 personal fouls)   FT 1/2: GOOD   FT 2/2: GOOD Cade Markkanen makes 2/2 from the line.
Score: 13-24

[02:53] Team_057 possession (Score: 13-24)
Miles Middleton attempts a Midrange. Contested by Derrick Allen (3.5 feet, ZONE). MILES MIDDLETON MAKES IT!
Score: 15-24

[02:40] Team_005 possession (Score: 15-24)
FOUL! Shooting foul on Kobe Ming. Brandon George to the line for 3 free throws. [BONUS: 5 team fouls] (Kobe Ming: 2 personal fouls)   FT 1/3: MISS   FT 2/3: GOOD   FT 3/3: GOOD Brandon George makes 2/3 from the line.
Score: 15-26

[02:25] Team_057 possession (Score: 15-26)
Anfernee Adebayo throws a bad pass! Stolen by Derrick Allen! TURNOVER! (live ball)

[02:11] Team_005 possession (Score: 15-26)
Derrick Allen drives to the basket... Derrick Allen throws a bad pass! Stolen by Anfernee Adebayo! TURNOVER! (live ball)

[01:59] Team_057 possession (Score: 15-26)
Miles Middleton makes the Layup and draws the foul on Cade Markkanen! And-1! Miles Middleton to the line for 1. [Team fouls: 3] (Cade Markkanen: 1 personal fouls)   FT 1/1: GOOD Miles Middleton makes 1/1 from the line.
Score: 18-26

[01:45] Team_005 possession (Score: 18-26)
FOUL! Reach-in foul on Kobe Ming during the drive. [IN THE BONUS! 6 team fouls] Brandon George to the line for 2 free throws. (Kobe Ming: 3 personal fouls)   FT 1/2: GOOD   FT 2/2: GOOD Brandon George makes 2/2 from the line.
Score: 18-28

[01:33] Team_057 possession (Score: 18-28)
Klay Rozier attempts a Midrange. Contested by Brandon George (3.6 feet, ZONE). Klay Rozier misses. Rebound secured by Cade Markkanen.

[01:17] Team_005 possession (Score: 18-28)
FOUL! Shooting foul on Ben Adebayo. Jalen Rozier to the line for 2 free throws. [BONUS: 7 team fouls] (Ben Adebayo: 2 personal fouls)   FT 1/2: MISS   FT 2/2: GOOD Jalen Rozier makes 1/2 from the line.
Score: 18-29

[01:02] Team_057 possession (Score: 18-29)
Ben Adebayo attempts a 3Pt. Wide open! Jalen Rozier is 6.2 feet away. [MAN] Ben Adebayo misses. Rebound secured by Cade Markkanen.

[00:46] Team_005 possession (Score: 18-29)
Cade Markkanen attempts a Midrange. Wide open! Miles Middleton is 7.8 feet away. [MAN] CADE MARKKANEN MAKES IT! Assist: Anthony Rozier
Score: 18-31

[00:34] Team_057 possession (Score: 18-31)
Anfernee Adebayo drives to the basket... Anfernee Adebayo loses control! Ball rolls out of bounds! TURNOVER! (dead ball)

[00:34] Substitution (Team_057): Kobe Ming OUT → Scottie Johnson IN (stamina_rule2)

[00:34] Substitution (Team_057): Klay Rozier OUT → Bradley Ginobili IN (stamina_rule2)

[00:34] Substitution (Team_057): Anfernee Adebayo OUT → Joel Wade IN (stamina_rule2)

[00:34] Substitution (Team_057): Ben Adebayo OUT → Lamelo Irving IN (stamina_rule2)

[00:34] Substitution (Team_057): Miles Middleton OUT → Zion Lillard IN (stamina_rule2)

[00:34] Substitution (Team_005): Brandon George OUT → Blake O'Neal IN (stamina_rule2)

[00:34] Substitution (Team_005): Anthony Rozier OUT → Draymond Smith IN (stamina_rule2)

[00:34] Substitution (Team_005): Derrick Allen OUT → Lauri Wade IN (stamina_rule2)

[00:34] Substitution (Team_005): Jalen Rozier OUT → Isaiah Durant IN (stamina_rule2)

[00:34] Substitution (Team_005): Cade Markkanen OUT → Zion Parker IN (stamina_rule2)

[00:19] Team_005 possession (Score: 18-31)
Isaiah Durant commits a violation (traveling/carry)! TURNOVER! (dead ball)

[00:03] Team_057 possession (Score: 18-31)
Zion Lillard drives, Zion Parker stays with him. Zion Lillard attempts a Dunk. Contested by Zion Parker (3.4 feet, ZONE). ZION LILLARD MAKES IT!
Score: 20-31

================================================================================
                              1ST QUARTER COMPLETE                              
================================================================================

1ST QUARTER SCORE: Team_057 20, Team_005 31

BOX SCORE:
================================================================================

Team_057
--------------------------------------------------------------------------------
Player                MIN  PTS  REB  AST  TO      FG   FG%      3P   3P%
--------------------------------------------------------------------------------
Miles Middleton        12    9    4    0   0   4/5    80.0     0/0   0.0
Ben Adebayo            12    5    2    0   0   2/6    33.3     0/0   0.0
Kobe Ming              12    4    0    0   0   2/4    50.0     0/0   0.0
Zion Lillard            0    2    0    0   0   1/1   100.0     0/0   0.0
Klay Rozier            12    0    0    3   0   0/2     0.0     0/0   0.0
Anfernee Adebayo       12    0    1    1   0   0/2     0.0     0/0   0.0

TEAM: FG: 9/20 (45.0%), 3PT: 1/3 (33.3%), REB: 7 (3 off, 4 def), AST: 4, TO: 3
TEAM FOULS: 7 [Team_005 in BONUS]


Team_005
--------------------------------------------------------------------------------
Player                MIN  PTS  REB  AST  TO      FG   FG%      3P   3P%
--------------------------------------------------------------------------------
Jalen Rozier           12   14    5    1   0   7/8    87.5     0/0   0.0
Cade Markkanen         12    7    6    0   0   3/4    75.0     0/0   0.0
Derrick Allen          12    4    1    0   0   2/3    66.7     0/0   0.0
Brandon George         12    4    0    2   0   2/3    66.7     0/0   0.0
Anthony Rozier         12    2    0    1   0   1/1   100.0     0/0   0.0

TEAM: FG: 15/19 (78.9%), 3PT: 2/4 (50.0%), REB: 12 (2 off, 10 def), AST: 4, TO: 3
TEAM FOULS: 3

================================================================================

================================================================================
                       2ND QUARTER - Team_057 vs Team_005                       
================================================================================

[12:00] Team_057 possession (Score: 20-31)
Klay Rozier makes the Dunk and draws the foul on Anthony Rozier! And-1! Klay Rozier to the line for 1. [Team fouls: 1] (Anthony Rozier: 1 personal fouls)   FT 1/1: GOOD Klay Rozier makes 1/1 from the line.
Score: 23-31

[11:48] Team_005 possession (Score: 23-31)
Cade Markkanen attempts a Layup. Contested by Ben Adebayo (2.2 feet, ZONE). CADE MARKKANEN MAKES IT! Assist: Brandon George
Score: 23-33

[11:31] Team_057 possession (Score: 23-33)
Klay Rozier attempts a Midrange. Wide open! Anthony Rozier is 6.1 feet away. [MAN] Klay Rozier misses. Rebound secured by Derrick Allen.

[11:16] Team_005 possession (Score: 23-33)
Cade Markkanen attempts a 3Pt. Heavily contested by Anfernee Adebayo (1.7 feet, ZONE)! Cade Markkanen misses. Rebound secured by Anfernee Adebayo.

[11:04] Team_057 possession (Score: 23-33)
Klay Rozier drives and kicks out. Miles Middleton attempts a Midrange. Contested by Cade Markkanen (5.3 feet, MAN). MILES MIDDLETON MAKES IT! Assist: Anfernee Adebayo
Score: 25-33

[10:52] Team_005 possession (Score: 25-33)
Derrick Allen makes the Layup and draws the foul on Anfernee Adebayo! And-1! Derrick Allen to the line for 1. [Team fouls: 1] (Anfernee Adebayo: 1 personal fouls)   FT 1/1: GOOD Derrick Allen makes 1/1 from the line.
Score: 25-36

[10:33] Team_057 possession (Score: 25-36)
Anfernee Adebayo attempts a 3Pt. Contested by Derrick Allen (4.9 feet, ZONE). ANFERNEE ADEBAYO MAKES IT! Assist: Miles Middleton
Score: 28-36

[10:17] Team_005 possession (Score: 28-36)
Cade Markkanen attempts a Midrange. Contested by Anfernee Adebayo (6.0 feet, ZONE). CADE MARKKANEN MAKES IT!
Score: 28-38

[09:58] Team_057 possession (Score: 28-38)
Anfernee Adebayo drives, Cade Markkanen stays with him. Anfernee Adebayo attempts a Layup. Contested by Cade Markkanen (2.4 feet, ZONE). ANFERNEE ADEBAYO MAKES IT! Assist: Kobe Ming
Score: 30-38

[09:43] Team_005 possession (Score: 30-38)
Cade Markkanen attempts a Midrange. Contested by Miles Middleton (5.1 feet, MAN). CADE MARKKANEN MAKES IT! Assist: Brandon George
Score: 30-40

[09:30] Team_057 possession (Score: 30-40)
Klay Rozier attempts a 3Pt. Wide open! Derrick Allen is 6.3 feet away. [ZONE] Klay Rozier misses. Rebound secured by Cade Markkanen.

[09:13] Team_005 possession (Score: 30-40)
FOUL! Holding foul on Miles Middleton. [Team fouls: 2] No free throws, side out. (Miles Middleton: 1 personal fouls)

[08:57] Team_005 possession (Score: 30-40)
Jalen Rozier attempts a Midrange. Wide open! Anfernee Adebayo is 6.4 feet away. [ZONE] JALEN ROZIER MAKES IT!
Score: 30-42

[08:42] Team_057 possession (Score: 30-42)
FOUL! Reach-in foul on Cade Markkanen during the drive. [Team fouls: 2] No free throws, side out. (Cade Markkanen: 1 personal fouls)

[08:28] Team_057 possession (Score: 30-42)
Klay Rozier attempts a 3Pt. Wide open! Anthony Rozier is 6.6 feet away. [MAN] Klay Rozier misses. FOUL! Loose ball foul on Derrick Allen during the rebound battle. [Team fouls: 3] No free throws, side out. (Derrick Allen: 1 personal fouls)

[08:18] Team_057 possession (Score: 30-42)
Klay Rozier attempts a 3Pt. Contested by Derrick Allen (4.7 feet, ZONE). Klay Rozier misses. Offensive rebound by Ben Adebayo! Ben Adebayo kicks it out.

[08:02] Team_057 possession (Score: 30-42)
Anfernee Adebayo attempts a Midrange. Contested by Anthony Rozier (4.8 feet, ZONE). Anfernee Adebayo misses. Rebound secured by Derrick Allen.

[07:44] Team_005 possession (Score: 30-42)
Brandon George loses the ball! Stripped by Kobe Ming! TURNOVER! (live ball)

[07:26] Team_057 possession (Score: 30-42)
Ben Adebayo attempts a Layup. Contested by Cade Markkanen (3.6 feet, ZONE). Ben Adebayo misses. Rebound secured by Cade Markkanen.

[07:09] Team_005 possession (Score: 30-42)
Cade Markkanen drives to the basket... Cade Markkanen loses the ball! Stripped by Ben Adebayo! TURNOVER! (live ball)

[06:54] Team_057 possession (Score: 30-42)
Ben Adebayo drives, Cade Markkanen stays with him. Ben Adebayo attempts a Dunk. Contested by Cade Markkanen (5.1 feet, ZONE). BEN ADEBAYO MAKES IT! Assist: Miles Middleton
Score: 32-42

[06:40] Team_005 possession (Score: 32-42)
Brandon George loses control! Ball rolls out of bounds! TURNOVER! (dead ball)

[06:40] Substitution (Team_057): Kobe Ming OUT → Scottie Johnson IN (stamina_rule2)

[06:40] Substitution (Team_057): Klay Rozier OUT → Bradley Ginobili IN (stamina_rule2)

[06:40] Substitution (Team_057): Anfernee Adebayo OUT → Joel Wade IN (stamina_rule2)

[06:40] Substitution (Team_057): Ben Adebayo OUT → Lamelo Irving IN (stamina_rule2)

[06:40] Substitution (Team_057): Miles Middleton OUT → Zion Lillard IN (stamina_rule2)

[06:40] Substitution (Team_005): Brandon George OUT → Blake O'Neal IN (stamina_rule2)

[06:40] Substitution (Team_005): Anthony Rozier OUT → Draymond Smith IN (stamina_rule2)

[06:40] Substitution (Team_005): Derrick Allen OUT → Lauri Wade IN (stamina_rule2)

[06:40] Substitution (Team_005): Jalen Rozier OUT → Isaiah Durant IN (stamina_rule2)

[06:40] Substitution (Team_005): Cade Markkanen OUT → Zion Parker IN (stamina_rule2)

[06:24] Team_057 possession (Score: 32-42)
Scottie Johnson attempts a Midrange. Contested by Lauri Wade (5.1 feet, ZONE). SCOTTIE JOHNSON MAKES IT!
Score: 34-42

[06:11] Team_005 possession (Score: 34-42)
Draymond Smith attempts a 3Pt. Wide open! Bradley Ginobili is 6.5 feet away. [MAN] DRAYMOND SMITH MAKES IT! Assist: Zion Parker
Score: 34-45

[05:59] Team_057 possession (Score: 34-45)
Bradley Ginobili drives to the basket... Bradley Ginobili throws a bad pass! Stolen by Draymond Smith! TURNOVER! (live ball)

[05:41] Team_005 possession (Score: 34-45)
Zion Parker drives and kicks out. Isaiah Durant attempts a 3Pt. Wide open! Lamelo Irving is 6.6 feet away. [MAN] Isaiah Durant misses. Offensive rebound by Draymond Smith! Draymond Smith kicks it out.

[05:28] Team_005 possession (Score: 34-45)
Blake O'Neal drives and kicks out. Zion Parker attempts a 3Pt. Contested by Scottie Johnson (4.7 feet, ZONE). Zion Parker misses. Rebound secured by Zion Lillard.

[05:13] Team_057 possession (Score: 34-45)
Lamelo Irving attempts a Midrange. Contested by Zion Parker (4.8 feet, ZONE). Lamelo Irving misses. Rebound secured by Lauri Wade.

[04:57] Team_005 possession (Score: 34-45)
Lauri Wade attempts a 3Pt. Contested by Joel Wade (3.8 feet, MAN). Lauri Wade misses. Offensive rebound by Draymond Smith! Draymond Smith kicks it out.

[04:41] Team_005 possession (Score: 34-45)
FOUL! Offensive foul on Draymond Smith! Bradley Ginobili drew the charge! [Team fouls: 4] (Draymond Smith: 1 personal fouls) TURNOVER! (dead ball)

[04:22] Team_057 possession (Score: 34-45)
Lamelo Irving attempts a 3Pt. Contested by Blake O'Neal (4.5 feet, ZONE). Lamelo Irving misses. Rebound secured by Draymond Smith.

[04:08] Team_005 possession (Score: 34-45)
Lauri Wade attempts a 3Pt. Wide open! Joel Wade is 7.9 feet away. [MAN] Lauri Wade misses. Rebound secured by Zion Lillard.

[03:49] Team_057 possession (Score: 34-45)
Lamelo Irving attempts a 3Pt. Heavily contested by Blake O'Neal (1.5 feet, ZONE)! Lamelo Irving misses. Rebound secured by Draymond Smith.

[03:33] Team_005 possession (Score: 34-45)
Blake O'Neal attempts a 3Pt. Contested by Scottie Johnson (5.3 feet, ZONE). Blake O'Neal misses. Rebound secured by Zion Lillard.

[03:14] Team_057 possession (Score: 34-45)
Zion Lillard drives to the basket... FOUL! Offensive foul on Zion Lillard! Zion Parker drew the charge! [Team fouls: 3] (Zion Lillard: 1 personal fouls) TURNOVER! (dead ball)

[03:00] Team_005 possession (Score: 34-45)
Blake O'Neal makes the Layup and draws the foul on Scottie Johnson! And-1! Blake O'Neal to the line for 1. [Team fouls: 4] (Scottie Johnson: 1 personal fouls)   FT 1/1: GOOD Blake O'Neal makes 1/1 from the line.
Score: 34-48

[02:48] Team_057 possession (Score: 34-48)
Joel Wade attempts a 3Pt. Contested by Blake O'Neal (4.6 feet, ZONE). Joel Wade misses. Rebound secured by Lauri Wade.

[02:35] Team_005 possession (Score: 34-48)
FOUL! Offensive foul on Zion Parker! Zion Lillard drew the charge! [Team fouls: 5] (Zion Parker: 1 personal fouls) TURNOVER! (dead ball)

[02:22] Team_057 possession (Score: 34-48)
Zion Lillard drives to the basket... Zion Lillard throws a bad pass! Stolen by Zion Parker! TURNOVER! (live ball)

[02:09] Team_005 possession (Score: 34-48)
FOUL! Reach-in foul on Zion Lillard during the drive. [IN THE BONUS! 5 team fouls] Zion Parker to the line for 2 free throws. (Zion Lillard: 2 personal fouls)   FT 1/2: GOOD   FT 2/2: GOOD Zion Parker makes 2/2 from the line.
Score: 34-50

[01:50] Team_057 possession (Score: 34-50)
Joel Wade attempts a Midrange. Contested by Isaiah Durant (5.8 feet, ZONE). JOEL WADE MAKES IT! Assist: Lamelo Irving
Score: 36-50

[01:35] Team_005 possession (Score: 36-50)
Blake O'Neal drives, picks up Lamelo Irving. Help arrives from Bradley Ginobili! Blake O'Neal attempts a Layup. Contested by Bradley Ginobili (5.3 feet, ZONE). BLAKE O'NEAL MAKES IT!
Score: 36-52

[01:16] Team_057 possession (Score: 36-52)
FOUL! Holding foul on Blake O'Neal. [IN THE BONUS! 6 team fouls] Scottie Johnson to the line for 2 free throws. (Blake O'Neal: 1 personal fouls)   FT 1/2: GOOD   FT 2/2: GOOD Scottie Johnson makes 2/2 from the line.
Score: 38-52

[01:01] Team_005 possession (Score: 38-52)
Draymond Smith makes the Dunk and draws the foul on Bradley Ginobili! And-1! Draymond Smith to the line for 1. [BONUS: 6 team fouls] (Bradley Ginobili: 1 personal fouls)   FT 1/1: GOOD Draymond Smith makes 1/1 from the line.
Score: 38-55

[00:45] Team_057 possession (Score: 38-55)
Bradley Ginobili attempts a Layup. Contested by Draymond Smith (3.5 feet, MAN). BRADLEY GINOBILI MAKES IT! Assist: Lamelo Irving
Score: 40-55

[00:27] Team_005 possession (Score: 40-55)
Blake O'Neal attempts a 3Pt. Contested by Scottie Johnson (5.9 feet, MAN). Blake O'Neal misses. Offensive rebound by Zion Parker! Zion Parker puts it back in!
Score: 40-57

[00:13] Team_057 possession (Score: 40-57)
FOUL! Shooting foul on Lauri Wade. Joel Wade to the line for 2 free throws. [BONUS: 7 team fouls] (Lauri Wade: 1 personal fouls)   FT 1/2: GOOD   FT 2/2: GOOD Joel Wade makes 2/2 from the line.
Score: 42-57

================================================================================
                              2ND QUARTER COMPLETE                              
================================================================================

2ND QUARTER SCORE: Team_057 22, Team_005 26

BOX SCORE:
================================================================================

Team_057
--------------------------------------------------------------------------------
Player                MIN  PTS  REB  AST  TO      FG   FG%      3P   3P%
--------------------------------------------------------------------------------
Anfernee Adebayo       17    5    1    1   0   2/3    66.7     0/0   0.0
Scottie Johnson         7    4    0    0   0   2/2   100.0     0/0   0.0
Joel Wade               7    4    0    0   0   2/3    66.7     0/0   0.0
Klay Rozier            17    3    0    0   0   1/3    33.3     0/0   0.0
Miles Middleton        17    2    1    2   0   1/1   100.0     0/0   0.0
Ben Adebayo            17    2    1    0   0   1/2    50.0     0/0   0.0
Bradley Ginobili        7    2    0    0   0   1/1   100.0     0/0   0.0
Kobe Ming              17    0    0    1   0   0/0     0.0     0/0   0.0
Zion Lillard            7    0    3    0   0   0/0     0.0     0/0   0.0
Lamelo Irving           7    0    0    2   0   0/3     0.0     0/0   0.0

TEAM: FG: 10/18 (55.6%), 3PT: 1/5 (20.0%), REB: 6 (2 off, 4 def), AST: 6, TO: 3
TEAM FOULS: 6 [Team_005 in BONUS]


Team_005
--------------------------------------------------------------------------------
Player                MIN  PTS  REB  AST  TO      FG   FG%      3P   3P%
--------------------------------------------------------------------------------
Cade Markkanen         17    6    2    0   0   3/4    75.0     0/0   0.0
Draymond Smith          7    6    4    0   0   2/2   100.0     0/0   0.0
Blake O'Neal            7    5    0    0   0   2/4    50.0     0/0   0.0
Zion Parker             7    4    1    1   0   2/2   100.0     0/0   0.0
Derrick Allen          17    3    2    0   0   1/1   100.0     0/0   0.0
Jalen Rozier           17    2    0    0   0   1/1   100.0     0/0   0.0
Brandon George         17    0    0    2   0   0/0     0.0     0/0   0.0
Lauri Wade              7    0    2    0   0   0/1     0.0     0/0   0.0

TEAM: FG: 11/15 (73.3%), 3PT: 2/5 (40.0%), REB: 11 (3 off, 8 def), AST: 3, TO: 5
TEAM FOULS: 7 [Team_057 in BONUS]

================================================================================

================================================================================
                       3RD QUARTER - Team_057 vs Team_005                       
================================================================================

[12:00] Team_057 possession (Score: 42-57)
Klay Rozier loses the ball! Stripped by Anthony Rozier! TURNOVER! (live ball)

[11:41] Team_005 possession (Score: 42-57)
Brandon George attempts a 3Pt. Wide open! Anfernee Adebayo is 6.8 feet away. [ZONE] Brandon George misses. Rebound secured by Miles Middleton.

[11:28] Team_057 possession (Score: 42-57)
Miles Middleton drives, Cade Markkanen stays with him. Miles Middleton attempts a Dunk. Contested by Cade Markkanen (2.1 feet, ZONE). MILES MIDDLETON MAKES IT!
Score: 44-57

[11:17] Team_005 possession (Score: 44-57)
Anthony Rozier attempts a 3Pt. Wide open! Ben Adebayo is 6.3 feet away. [ZONE] ANTHONY ROZIER MAKES IT! Assist: Jalen Rozier
Score: 44-60

[11:04] Team_057 possession (Score: 44-60)
Ben Adebayo drives, picks up Cade Markkanen. Help arrives from Anthony Rozier! Ben Adebayo attempts a Dunk. Contested by Anthony Rozier (2.2 feet, MAN). Ben Adebayo misses. Rebound secured by Cade Markkanen.

[10:48] Team_005 possession (Score: 44-60)
FOUL! Shooting foul on Kobe Ming. Brandon George to the line for 2 free throws. [Team fouls: 1] (Kobe Ming: 1 personal fouls)   FT 1/2: GOOD   FT 2/2: GOOD Brandon George makes 2/2 from the line.
Score: 44-62

[10:35] Team_057 possession (Score: 44-62)
Klay Rozier drives and kicks out. Kobe Ming makes the Midrange and draws the foul on Anthony Rozier! And-1! Kobe Ming to the line for 1. [Team fouls: 1] (Anthony Rozier: 1 personal fouls)   FT 1/1: GOOD Kobe Ming makes 1/1 from the line.
Score: 47-62

[10:19] Team_005 possession (Score: 47-62)
Derrick Allen commits a violation (traveling/carry)! TURNOVER! (dead ball)

[10:04] Team_057 possession (Score: 47-62)
Ben Adebayo attempts a Layup. Heavily contested by Cade Markkanen (1.7 feet, ZONE)! BEN ADEBAYO MAKES IT! Assist: Klay Rozier
Score: 49-62

[09:54] Team_005 possession (Score: 49-62)
Derrick Allen loses control! Ball rolls out of bounds! TURNOVER! (dead ball)

[09:36] Team_057 possession (Score: 49-62)
Ben Adebayo drives and kicks out. Anfernee Adebayo attempts a 3Pt. Wide open! Derrick Allen is 6.4 feet away. [MAN] Anfernee Adebayo misses. Rebound secured by Jalen Rozier.

[09:20] Team_005 possession (Score: 49-62)
Brandon George attempts a Layup. BLOCKED BY KLAY ROZIER! Ball is loose! Rebound secured by Miles Middleton.

[09:02] Team_057 possession (Score: 49-62)
Kobe Ming attempts a Midrange. Contested by Brandon George (5.5 feet, MAN). Kobe Ming misses. Rebound secured by Jalen Rozier.

[08:49] Team_005 possession (Score: 49-62)
Cade Markkanen makes the Layup and draws the foul on Miles Middleton! And-1! Cade Markkanen to the line for 1. [Team fouls: 2] (Miles Middleton: 1 personal fouls)   FT 1/1: GOOD Cade Markkanen makes 1/1 from the line.
Score: 49-65

[08:36] Team_057 possession (Score: 49-65)
Klay Rozier attempts a 3Pt. Wide open! Derrick Allen is 6.2 feet away. [ZONE] Klay Rozier misses. Offensive rebound by Ben Adebayo! Ben Adebayo kicks it out.

[08:22] Team_057 possession (Score: 49-65)
Ben Adebayo attempts a Layup. Wide open! Jalen Rozier is 6.6 feet away. [ZONE] BEN ADEBAYO MAKES IT! Assist: Anfernee Adebayo
Score: 51-65

[08:09] Team_005 possession (Score: 51-65)
Jalen Rozier drives and kicks out. Derrick Allen attempts a 3Pt. Wide open! Kobe Ming is 7.3 feet away. [ZONE] Derrick Allen misses. Rebound secured by Ben Adebayo.

[07:51] Team_057 possession (Score: 51-65)
Anfernee Adebayo attempts a Layup. Contested by Derrick Allen (3.9 feet, MAN). Anfernee Adebayo misses. Rebound secured by Cade Markkanen.

[07:34] Team_005 possession (Score: 51-65)
Jalen Rozier attempts a 3Pt. Contested by Ben Adebayo (5.2 feet, MAN). Jalen Rozier misses. Rebound secured by Anfernee Adebayo.

[07:23] Team_057 possession (Score: 51-65)
Ben Adebayo throws a bad pass! Stolen by Cade Markkanen! TURNOVER! (live ball)

[07:05] Team_005 possession (Score: 51-65)
Anthony Rozier throws a bad pass out of bounds! TURNOVER! (dead ball)

[06:49] Team_057 possession (Score: 51-65)
Kobe Ming drives and kicks out. FOUL! Shooting foul on Cade Markkanen. Miles Middleton to the line for 2 free throws. [Team fouls: 2] (Cade Markkanen: 1 personal fouls)   FT 1/2: GOOD   FT 2/2: MISS Miles Middleton makes 1/2 from the line. Rebound secured by Derrick Allen.
Score: 52-65

[06:35] Team_005 possession (Score: 52-65)
Jalen Rozier drives, Ben Adebayo stays with him. Jalen Rozier attempts a Dunk. Contested by Ben Adebayo (3.3 feet, MAN). JALEN ROZIER MAKES IT! Assist: Derrick Allen
Score: 52-67

[06:20] Team_057 possession (Score: 52-67)
FOUL! Shooting foul on Anthony Rozier. Klay Rozier to the line for 2 free throws. [Team fouls: 3] (Anthony Rozier: 2 personal fouls)   FT 1/2: MISS   FT 2/2: GOOD Klay Rozier makes 1/2 from the line.
Score: 53-67

[06:05] Team_005 possession (Score: 53-67)
Brandon George attempts a Midrange. Contested by Klay Rozier (4.0 feet, ZONE). Brandon George misses. Rebound secured by Miles Middleton.

[05:49] Team_057 possession (Score: 53-67)
Klay Rozier attempts a Midrange. Contested by Derrick Allen (3.1 feet, ZONE). Klay Rozier misses. Rebound secured by Cade Markkanen.

[05:32] Team_005 possession (Score: 53-67)
Jalen Rozier throws a bad pass out of bounds! TURNOVER! (dead ball)

[05:15] Team_057 possession (Score: 53-67)
Ben Adebayo drives, picks up Cade Markkanen. Help arrives from Anthony Rozier! Ben Adebayo attempts a Dunk. Contested by Anthony Rozier (3.2 feet, ZONE). BEN ADEBAYO MAKES IT! Assist: Anfernee Adebayo
Score: 55-67

[04:57] Team_005 possession (Score: 55-67)
Brandon George attempts a Midrange. Wide open! Klay Rozier is 6.2 feet away. [ZONE] BRANDON GEORGE MAKES IT! Assist: Jalen Rozier
Score: 55-69

[04:40] Team_057 possession (Score: 55-69)
Kobe Ming attempts a Layup. BLOCKED BY BRANDON GEORGE! Ball is loose! Rebound secured by Derrick Allen.

[04:28] Team_005 possession (Score: 55-69)
Brandon George attempts a 3Pt. Contested by Kobe Ming (4.1 feet, ZONE). Brandon George misses. Rebound secured by Anfernee Adebayo.

[04:14] Team_057 possession (Score: 55-69)
Kobe Ming attempts a 3Pt. Contested by Brandon George (5.3 feet, MAN). KOBE MING MAKES IT! Assist: Anfernee Adebayo
Score: 58-69

[04:01] Team_005 possession (Score: 58-69)
Anthony Rozier makes the Dunk and draws the foul on Klay Rozier! And-1! Anthony Rozier to the line for 1. [Team fouls: 3] (Klay Rozier: 1 personal fouls)   FT 1/1: GOOD Anthony Rozier makes 1/1 from the line.
Score: 58-72

[03:47] Team_057 possession (Score: 58-72)
FOUL! Reach-in foul on Derrick Allen during the drive. [Team fouls: 4] No free throws, side out. (Derrick Allen: 1 personal fouls)

[03:30] Team_057 possession (Score: 58-72)
Anfernee Adebayo drives to the basket... Anfernee Adebayo throws a bad pass! Stolen by Cade Markkanen! TURNOVER! (live ball)

[03:16] Team_005 possession (Score: 58-72)
Brandon George makes the Dunk and draws the foul on Kobe Ming! And-1! Brandon George to the line for 1. [Team fouls: 4] (Kobe Ming: 2 personal fouls)   FT 1/1: GOOD Brandon George makes 1/1 from the line.
Score: 58-75

[03:02] Team_057 possession (Score: 58-75)
FOUL! Offensive foul on Kobe Ming! Brandon George drew the charge! [Team fouls: 5] (Kobe Ming: 3 personal fouls) TURNOVER! (dead ball)

[02:47] Team_005 possession (Score: 58-75)
Cade Markkanen makes the Dunk and draws the foul on Klay Rozier! And-1! Cade Markkanen to the line for 1. [BONUS: 6 team fouls] (Klay Rozier: 2 personal fouls)   FT 1/1: GOOD Cade Markkanen makes 1/1 from the line.
Score: 58-78

[02:33] Team_057 possession (Score: 58-78)
Anfernee Adebayo attempts a Layup. Contested by Derrick Allen (3.7 feet, MAN). Anfernee Adebayo misses. Offensive rebound by Miles Middleton! Miles Middleton kicks it out.

[02:16] Team_057 possession (Score: 58-78)
Miles Middleton attempts a 3Pt. Contested by Cade Markkanen (3.4 feet, MAN). Miles Middleton misses. Rebound secured by Cade Markkanen.

[01:59] Team_005 possession (Score: 58-78)
Anthony Rozier attempts a 3Pt. Wide open! Kobe Ming is 8.9 feet away. [ZONE] ANTHONY ROZIER MAKES IT!
Score: 58-81

[01:47] Team_057 possession (Score: 58-81)
Ben Adebayo attempts a Layup. Contested by Cade Markkanen (2.3 feet, ZONE). Ben Adebayo misses. Offensive rebound by Ben Adebayo! Ben Adebayo kicks it out.

[01:38] Team_057 possession (Score: 58-81)
FOUL! Reach-in foul on Jalen Rozier during the drive. [IN THE BONUS! 5 team fouls] Kobe Ming to the line for 2 free throws. (Jalen Rozier: 1 personal fouls)   FT 1/2: GOOD   FT 2/2: GOOD Kobe Ming makes 2/2 from the line.
Score: 60-81

[01:27] Team_005 possession (Score: 60-81)
Derrick Allen attempts a Midrange. Contested by Ben Adebayo (5.7 feet, ZONE). Derrick Allen misses. Rebound secured by Anfernee Adebayo.

[01:08] Team_057 possession (Score: 60-81)
Klay Rozier drives, picks up Cade Markkanen. Help arrives from Anthony Rozier! Klay Rozier attempts a Dunk. Heavily contested by Anthony Rozier (0.5 feet, ZONE)! KLAY ROZIER MAKES IT! Assist: Miles Middleton
Score: 62-81

[00:57] Team_005 possession (Score: 62-81)
Cade Markkanen makes the Layup and draws the foul on Ben Adebayo! And-1! Cade Markkanen to the line for 1. [BONUS: 7 team fouls] (Ben Adebayo: 1 personal fouls)   FT 1/1: GOOD Cade Markkanen makes 1/1 from the line.
Score: 62-84

[00:47] Team_057 possession (Score: 62-84)
FOUL! Holding foul on Jalen Rozier. [IN THE BONUS! 6 team fouls] Ben Adebayo to the line for 2 free throws. (Jalen Rozier: 2 personal fouls)   FT 1/2: GOOD   FT 2/2: GOOD Ben Adebayo makes 2/2 from the line.
Score: 64-84

[00:31] Team_005 possession (Score: 64-84)
Derrick Allen attempts a 3Pt. Contested by Kobe Ming (5.5 feet, ZONE). Derrick Allen misses. Rebound secured by Anfernee Adebayo.

[00:17] Team_057 possession (Score: 64-84)
Kobe Ming throws a bad pass out of bounds! TURNOVER! (dead ball)

[00:17] Substitution (Team_057): Kobe Ming OUT → Scottie Johnson IN (stamina_rule2)

[00:17] Substitution (Team_057): Klay Rozier OUT → Bradley Ginobili IN (stamina_rule2)

[00:17] Substitution (Team_057): Anfernee Adebayo OUT → Joel Wade IN (stamina_rule2)

[00:17] Substitution (Team_057): Ben Adebayo OUT → Lamelo Irving IN (stamina_rule2)

[00:17] Substitution (Team_057): Miles Middleton OUT → Zion Lillard IN (stamina_rule2)

[00:17] Substitution (Team_005): Brandon George OUT → Blake O'Neal IN (stamina_rule2)

[00:17] Substitution (Team_005): Anthony Rozier OUT → Draymond Smith IN (stamina_rule2)

[00:17] Substitution (Team_005): Derrick Allen OUT → Lauri Wade IN (stamina_rule2)

[00:17] Substitution (Team_005): Jalen Rozier OUT → Isaiah Durant IN (stamina_rule2)

[00:17] Substitution (Team_005): Cade Markkanen OUT → Zion Parker IN (stamina_rule2)

[00:06] Team_005 possession (Score: 64-84)
Lauri Wade attempts a Midrange. Contested by Bradley Ginobili (5.4 feet, ZONE). LAURI WADE MAKES IT! Assist: Draymond Smith
Score: 64-86

================================================================================
                              3RD QUARTER COMPLETE                              
================================================================================

3RD QUARTER SCORE: Team_057 22, Team_005 29

BOX SCORE:
================================================================================

Team_057
--------------------------------------------------------------------------------
Player                MIN  PTS  REB  AST  TO      FG   FG%      3P   3P%
--------------------------------------------------------------------------------
Ben Adebayo            29    8    3    0   0   4/6    66.7     0/0   0.0
Kobe Ming              29    8    0    0   0   3/6    50.0     0/0   0.0
Klay Rozier            29    3    0    1   0   2/3    66.7     0/0   0.0
Miles Middleton        29    2    4    1   0   1/2    50.0     0/0   0.0
Anfernee Adebayo       29    0    4    3   0   0/1     0.0     0/0   0.0

TEAM: FG: 10/18 (55.6%), 3PT: 1/2 (50.0%), REB: 11 (3 off, 8 def), AST: 5, TO: 5
TEAM FOULS: 7 [Team_005 in BONUS]


Team_005
--------------------------------------------------------------------------------
Player                MIN  PTS  REB  AST  TO      FG   FG%      3P   3P%
--------------------------------------------------------------------------------
Anthony Rozier         29    9    0    0   0   3/3   100.0     0/0   0.0
Cade Markkanen         29    9    4    0   0   3/3   100.0     0/0   0.0
Brandon George         29    7    0    0   0   3/7    42.9     0/0   0.0
Jalen Rozier           29    2    2    2   0   1/3    33.3     0/0   0.0
Lauri Wade              7    2    0    0   0   1/1   100.0     0/0   0.0
Derrick Allen          29    0    2    1   0   0/2     0.0     0/0   0.0
Draymond Smith          7    0    0    1   0   0/0     0.0     0/0   0.0

TEAM: FG: 11/19 (57.9%), 3PT: 2/6 (33.3%), REB: 8 (0 off, 8 def), AST: 4, TO: 4
TEAM FOULS: 6 [Team_057 in BONUS]

================================================================================

================================================================================
                       4TH QUARTER - Team_057 vs Team_005                       
================================================================================

[12:00] Substitution (Team_057): Kobe Ming OUT (stamina: 70) → Scottie Johnson IN (comeback_detected)

[12:00] Substitution (Team_005): Brandon George OUT (stamina: 67) → Blake O'Neal IN (comeback_detected)

[12:00] Team_057 possession (Score: 64-86)
Klay Rozier attempts a Midrange. Wide open! Anthony Rozier is 6.6 feet away. [MAN] Klay Rozier misses. Rebound secured by Cade Markkanen.

[11:46] Team_005 possession (Score: 64-86)
Derrick Allen attempts a Layup. BLOCKED BY ANFERNEE ADEBAYO! Ball is loose! Rebound secured by Miles Middleton.

[11:32] Team_057 possession (Score: 64-86)
Ben Adebayo drives to the basket... FOUL! Offensive foul on Ben Adebayo! Cade Markkanen drew the charge! [Team fouls: 1] (Ben Adebayo: 1 personal fouls) TURNOVER! (dead ball)

[11:17] Team_005 possession (Score: 64-86)
Jalen Rozier drives and kicks out. Anthony Rozier attempts a Midrange. Contested by Ben Adebayo (4.8 feet, ZONE). Anthony Rozier misses. Rebound secured by Ben Adebayo.

[10:59] Team_057 possession (Score: 64-86)
Ben Adebayo attempts a Midrange. Wide open! Derrick Allen is 6.9 feet away. [ZONE] Ben Adebayo misses. Rebound secured by Derrick Allen.

[10:47] Team_005 possession (Score: 64-86)
Cade Markkanen attempts a 3Pt. Contested by Scottie Johnson (4.8 feet, ZONE). Cade Markkanen misses. Rebound secured by Anfernee Adebayo.

[10:37] Team_057 possession (Score: 64-86)
Klay Rozier attempts a 3Pt. Contested by Blake O'Neal (4.2 feet, ZONE). Klay Rozier misses. Rebound secured by Derrick Allen.

[10:20] Team_005 possession (Score: 64-86)
Blake O'Neal throws a bad pass! Stolen by Scottie Johnson! TURNOVER! (live ball)

[10:07] Team_057 possession (Score: 64-86)
Anfernee Adebayo attempts a Midrange. Wide open! Derrick Allen is 6.7 feet away. [MAN] ANFERNEE ADEBAYO MAKES IT!
Score: 66-86

[09:55] Team_005 possession (Score: 66-86)
FOUL! Offensive foul on Derrick Allen! Anfernee Adebayo drew the charge! [Team fouls: 1] (Derrick Allen: 1 personal fouls) TURNOVER! (dead ball)

[09:38] Team_057 possession (Score: 66-86)
Ben Adebayo attempts a Midrange. Contested by Jalen Rozier (5.1 feet, ZONE). Ben Adebayo misses. Rebound secured by Cade Markkanen.

[09:23] Team_005 possession (Score: 66-86)
Jalen Rozier attempts a Midrange. Contested by Klay Rozier (3.6 feet, ZONE). Jalen Rozier misses. Rebound secured by Ben Adebayo.

[09:05] Team_057 possession (Score: 66-86)
FOUL! Shooting foul on Cade Markkanen. Miles Middleton to the line for 2 free throws. [Team fouls: 2] (Cade Markkanen: 1 personal fouls)   FT 1/2: GOOD   FT 2/2: MISS Miles Middleton makes 1/2 from the line. Rebound secured by Cade Markkanen.
Score: 67-86

[08:48] Team_005 possession (Score: 67-86)
FOUL! Reach-in foul on Ben Adebayo during the drive. [Team fouls: 2] No free throws, side out. (Ben Adebayo: 2 personal fouls)

[08:30] Team_005 possession (Score: 67-86)
Anthony Rozier attempts a 3Pt. Wide open! Klay Rozier is 6.9 feet away. [MAN] Anthony Rozier misses. Offensive rebound by Cade Markkanen! Cade Markkanen kicks it out.

[08:15] Team_005 possession (Score: 67-86)
Derrick Allen attempts a Midrange. Wide open! Anfernee Adebayo is 8.4 feet away. [MAN] DERRICK ALLEN MAKES IT! Assist: Cade Markkanen
Score: 67-88

[07:55] Team_057 possession (Score: 67-88)
Anfernee Adebayo drives and kicks out. Anfernee Adebayo attempts a 3Pt. Contested by Blake O'Neal (2.6 feet, ZONE). Anfernee Adebayo misses. Rebound secured by Blake O'Neal.

[07:41] Team_005 possession (Score: 67-88)
Jalen Rozier attempts a Midrange. Contested by Anfernee Adebayo (4.3 feet, ZONE). JALEN ROZIER MAKES IT!
Score: 67-90

[07:24] Team_057 possession (Score: 67-90)
FOUL! Holding foul on Anthony Rozier. [Team fouls: 3] No free throws, side out. (Anthony Rozier: 1 personal fouls)

[07:11] Team_057 possession (Score: 67-90)
Anfernee Adebayo attempts a 3Pt. Contested by Derrick Allen (4.1 feet, MAN). Anfernee Adebayo misses. Rebound secured by Derrick Allen.

[06:59] Team_005 possession (Score: 67-90)
FOUL! Reach-in foul on Ben Adebayo during the drive. [Team fouls: 3] No free throws, side out. (Ben Adebayo: 3 personal fouls)

[06:49] Team_005 possession (Score: 67-90)
FOUL! Reach-in foul on Ben Adebayo during the drive. [Team fouls: 4] No free throws, side out. (Ben Adebayo: 4 personal fouls)

[06:39] Team_005 possession (Score: 67-90)
Anthony Rozier attempts a 3Pt. Contested by Klay Rozier (6.0 feet, MAN). ANTHONY ROZIER MAKES IT! Assist: Blake O'Neal
Score: 67-93

[06:23] Team_057 possession (Score: 67-93)
Miles Middleton drives to the basket... Miles Middleton throws a bad pass out of bounds! TURNOVER! (dead ball)

[06:23] Substitution (Team_057): Klay Rozier OUT → Bradley Ginobili IN (stamina_rule2)

[06:23] Substitution (Team_057): Anfernee Adebayo OUT → Joel Wade IN (stamina_rule2)

[06:23] Substitution (Team_057): Ben Adebayo OUT → Lamelo Irving IN (stamina_rule2)

[06:23] Substitution (Team_057): Miles Middleton OUT → Zion Lillard IN (stamina_rule2)

[06:23] Substitution (Team_005): Anthony Rozier OUT → Draymond Smith IN (stamina_rule2)

[06:23] Substitution (Team_005): Derrick Allen OUT → Lauri Wade IN (stamina_rule2)

[06:23] Substitution (Team_005): Jalen Rozier OUT → Isaiah Durant IN (stamina_rule2)

[06:23] Substitution (Team_005): Cade Markkanen OUT → Zion Parker IN (stamina_rule2)

[06:08] Team_005 possession (Score: 67-93)
Blake O'Neal drives, Lamelo Irving stays with him. Blake O'Neal attempts a Layup. Contested by Lamelo Irving (4.6 feet, ZONE). BLAKE O'NEAL MAKES IT! Assist: Zion Parker
Score: 67-95

[05:52] Team_057 possession (Score: 67-95)
Joel Wade attempts a Midrange. Wide open! Lauri Wade is 8.3 feet away. [MAN] JOEL WADE MAKES IT!
Score: 69-95

[05:37] Team_005 possession (Score: 69-95)
Isaiah Durant drives and kicks out. Lauri Wade attempts a 3Pt. Wide open! Joel Wade is 7.2 feet away. [MAN] Lauri Wade misses. Rebound secured by Lamelo Irving.

[05:20] Team_057 possession (Score: 69-95)
Lamelo Irving attempts a 3Pt. Wide open! Lauri Wade is 10.0 feet away. [ZONE] Lamelo Irving misses. Rebound secured by Zion Parker.

[05:03] Team_005 possession (Score: 69-95)
FOUL! Reach-in foul on Bradley Ginobili during the drive. [IN THE BONUS! 5 team fouls] Draymond Smith to the line for 2 free throws. (Bradley Ginobili: 1 personal fouls)   FT 1/2: GOOD   FT 2/2: GOOD Draymond Smith makes 2/2 from the line.
Score: 69-97

[04:51] Team_057 possession (Score: 69-97)
Bradley Ginobili attempts a 3Pt. Contested by Draymond Smith (2.0 feet, MAN). Bradley Ginobili misses. Offensive rebound by Zion Lillard! Zion Lillard puts it back in!
Score: 71-97

[04:34] Team_005 possession (Score: 71-97)
Blake O'Neal attempts a Midrange. Contested by Scottie Johnson (5.2 feet, MAN). BLAKE O'NEAL MAKES IT!
Score: 71-99

[04:18] Team_057 possession (Score: 71-99)
Lamelo Irving loses control! Ball rolls out of bounds! TURNOVER! (dead ball)

[04:03] Team_005 possession (Score: 71-99)
Zion Parker drives, picks up Zion Lillard. Help arrives from Bradley Ginobili! Zion Parker attempts a Layup. Contested by Bradley Ginobili (2.5 feet, MAN). ZION PARKER MAKES IT! Assist: Lauri Wade
Score: 71-101

[03:49] Team_057 possession (Score: 71-101)
Bradley Ginobili attempts a Layup. Contested by Draymond Smith (5.0 feet, MAN). BRADLEY GINOBILI MAKES IT!
Score: 73-101

[03:31] Team_005 possession (Score: 73-101)
Lauri Wade attempts a 3Pt. Wide open! Scottie Johnson is 6.1 feet away. [ZONE] Lauri Wade misses. Rebound secured by Zion Lillard.

[03:21] Team_057 possession (Score: 73-101)
Scottie Johnson attempts a 3Pt. Heavily contested by Blake O'Neal (1.9 feet, MAN)! Scottie Johnson misses. Rebound secured by Draymond Smith.

[03:07] Team_005 possession (Score: 73-101)
Isaiah Durant drives and kicks out. Zion Parker attempts a Midrange. Heavily contested by Zion Lillard (1.1 feet, MAN)! ZION PARKER MAKES IT! Assist: Isaiah Durant
Score: 73-103

[02:48] Team_057 possession (Score: 73-103)
Zion Lillard attempts a Midrange. Contested by Zion Parker (3.5 feet, MAN). Zion Lillard misses. Rebound secured by Draymond Smith.

[02:31] Team_005 possession (Score: 73-103)
Blake O'Neal attempts a Layup. Heavily contested by Scottie Johnson (1.4 feet, MAN)! BLAKE O'NEAL MAKES IT!
Score: 73-105

[02:20] Team_057 possession (Score: 73-105)
Joel Wade attempts a 3Pt. Wide open! Lauri Wade is 8.1 feet away. [MAN] Joel Wade misses. Rebound secured by Draymond Smith.

[02:08] Team_005 possession (Score: 73-105)
Draymond Smith attempts a 3Pt. Contested by Bradley Ginobili (5.8 feet, MAN). DRAYMOND SMITH MAKES IT! Assist: Blake O'Neal
Score: 73-108

[01:55] Team_057 possession (Score: 73-108)
Joel Wade attempts a 3Pt. Contested by Blake O'Neal (2.5 feet, ZONE). Joel Wade misses. Rebound secured by Draymond Smith.

[01:41] Team_005 possession (Score: 73-108)
Lauri Wade attempts a 3Pt. Wide open! Joel Wade is 6.2 feet away. [MAN] LAURI WADE MAKES IT! Assist: Isaiah Durant
Score: 73-111

[01:26] Team_057 possession (Score: 73-111)
Scottie Johnson drives, picks up Blake O'Neal. Help arrives from Draymond Smith! Scottie Johnson attempts a Dunk. Contested by Draymond Smith (4.1 feet, MAN). Scottie Johnson misses. Rebound secured by Zion Parker.

[01:09] Team_005 possession (Score: 73-111)
FOUL! Holding foul on Lamelo Irving. [IN THE BONUS! 6 team fouls] Isaiah Durant to the line for 2 free throws. (Lamelo Irving: 1 personal fouls)   FT 1/2: GOOD   FT 2/2: MISS Isaiah Durant makes 1/2 from the line. Offensive rebound by Draymond Smith! Draymond Smith kicks it out.
Score: 73-112

[00:50] Team_005 possession (Score: 73-112)
Blake O'Neal drives, picks up Scottie Johnson. Help arrives from Bradley Ginobili! Blake O'Neal attempts a Dunk. Contested by Bradley Ginobili (5.4 feet, MAN). BLAKE O'NEAL MAKES IT! Assist: Isaiah Durant
Score: 73-114

[00:36] Team_057 possession (Score: 73-114)
FOUL! Shooting foul on Zion Parker. Bradley Ginobili to the line for 2 free throws. [Team fouls: 4] (Zion Parker: 1 personal fouls)   FT 1/2: GOOD   FT 2/2: MISS Bradley Ginobili makes 1/2 from the line. Rebound secured by Draymond Smith.
Score: 74-114

[00:17] Team_005 possession (Score: 74-114)
FOUL! Reach-in foul on Joel Wade during the drive. [IN THE BONUS! 7 team fouls] Lauri Wade to the line for 2 free throws. (Joel Wade: 1 personal fouls)   FT 1/2: MISS   FT 2/2: GOOD Lauri Wade makes 1/2 from the line.
Score: 74-115

[00:04] Team_057 possession (Score: 74-115)
Zion Lillard drives to the basket... Zion Lillard loses control! Ball rolls out of bounds! TURNOVER! (dead ball)

================================================================================
                              4TH QUARTER COMPLETE                              
================================================================================

4TH QUARTER SCORE: Team_057 10, Team_005 29

BOX SCORE:
================================================================================

Team_057
--------------------------------------------------------------------------------
Player                MIN  PTS  REB  AST  TO      FG   FG%      3P   3P%
--------------------------------------------------------------------------------
Anfernee Adebayo       35    2    1    0   0   1/3    33.3     0/0   0.0
Joel Wade              13    2    0    0   0   1/3    33.3     0/0   0.0
Zion Lillard           13    2    2    0   0   1/2    50.0     0/0   0.0
Bradley Ginobili       13    2    0    0   0   1/2    50.0     0/0   0.0
Klay Rozier            35    0    0    0   0   0/2     0.0     0/0   0.0
Miles Middleton        35    0    1    0   0   0/1     0.0     0/0   0.0
Ben Adebayo            35    0    2    0   0   0/2     0.0     0/0   0.0
Lamelo Irving          13    0    1    0   0   0/1     0.0     0/0   0.0
Scottie Johnson        19    0    0    0   0   0/2     0.0     0/0   0.0

TEAM: FG: 4/18 (22.2%), 3PT: 1/7 (14.3%), REB: 7 (1 off, 6 def), AST: 0, TO: 4
TEAM FOULS: 7 [Team_005 in BONUS]


Team_005
--------------------------------------------------------------------------------
Player                MIN  PTS  REB  AST  TO      FG   FG%      3P   3P%
--------------------------------------------------------------------------------
Blake O'Neal           19    8    1    2   0   4/4   100.0     0/0   0.0
Draymond Smith         13    5    6    0   0   2/2   100.0     0/0   0.0
Zion Parker            13    4    2    1   0   2/2   100.0     0/0   0.0
Lauri Wade             13    4    0    1   0   2/3    66.7     0/0   0.0
Anthony Rozier         35    3    0    0   0   1/1   100.0     0/0   0.0
Derrick Allen          35    2    3    0   0   1/2    50.0     0/0   0.0
Jalen Rozier           35    2    0    0   0   1/3    33.3     0/0   0.0
Cade Markkanen         35    0    4    1   0   0/1     0.0     0/0   0.0
Isaiah Durant          13    0    0    3   0   0/1     0.0     0/0   0.0

TEAM: FG: 13/19 (68.4%), 3PT: 3/5 (60.0%), REB: 16 (2 off, 14 def), AST: 8, TO: 2
TEAM FOULS: 4

================================================================================

================================================================================
                               FULL GAME COMPLETE                               
================================================================================

FINAL SCORE: Team_057 74, Team_005 115

SCORING BY QUARTER:
--------------------------------------------------------------------------------
Team                     Q1     Q2     Q3     Q4    FINAL
--------------------------------------------------------------------------------
Team_057                 20     22     22     10       74
Team_005                 31     26     29     29      115
--------------------------------------------------------------------------------

FULL GAME BOX SCORE:
================================================================================

Team_057
--------------------------------------------------------------------------------
Player                MIN  PTS  REB  AST  TO      FG   FG%      3P   3P%      FT STL BLK
--------------------------------------------------------------------------------
Klay Rozier            35    6    0    4   2   5/12   41.7   0/2     0.0   2/3     0   1
Anfernee Adebayo       35    7    7    5   1   3/9    33.3   1/2    50.0   0/0     1   1
Ben Adebayo            35   15    8    0   1   6/15   40.0   1/3    33.3   2/2     2   0
Miles Middleton        35   13   10    3   2   5/8    62.5   0/1     0.0   3/5     0   0
Kobe Ming              29   12    0    1   4   4/9    44.4   1/1   100.0   3/3     1   0
Scottie Johnson        19    4    0    0   1   1/3    33.3   0/1     0.0   2/2     1   0
Bradley Ginobili       13    4    0    0   1   3/4    75.0   1/1   100.0   1/2     0   0
Joel Wade              13    6    0    0   1   3/6    50.0   0/3     0.0   2/2     0   0
Lamelo Irving          13    0    1    2   1   0/4     0.0   0/3     0.0   0/0     0   0
Zion Lillard           13    4    5    0   1   1/2    50.0   0/0     0.0   0/0     0   0

TEAM: FG: 33/74 (44.6%), 3PT: 4/17 (23.5%), REB: 31 (9 off, 22 def), AST: 15, TO: 15


Team_005
--------------------------------------------------------------------------------
Player                MIN  PTS  REB  AST  TO      FG   FG%      3P   3P%      FT STL BLK
--------------------------------------------------------------------------------
Anthony Rozier         35   14    0    1   1   4/4   100.0   3/3   100.0   1/1     1   0
Derrick Allen          35    9    8    1   3   4/8    50.0   0/2     0.0   1/1     1   0
Jalen Rozier           35   20    7    3   2  10/15   66.7   0/1     0.0   6/7     0   0
Cade Markkanen         35   22   16    1   2   9/12   75.0   1/3    33.3   5/5     2   1
Brandon George         29   11    0    4   2   6/11   54.5   1/4    25.0   7/8     0   1
Blake O'Neal           19   13    1    2   1   7/9    77.8   1/2    50.0   1/1     0   0
Draymond Smith         13   11   10    1   1   4/4   100.0   2/2   100.0   3/3     1   0
Lauri Wade             13    6    2    1   0   3/5    60.0   1/3    33.3   1/2     0   0
Isaiah Durant          13    0    0    3   1   1/2    50.0   0/0     0.0   1/2     0   0
Zion Parker            13    8    3    2   1   2/2   100.0   0/0     0.0   2/2     1   0

TEAM: FG: 50/72 (69.4%), 3PT: 9/20 (45.0%), REB: 47 (7 off, 40 def), AST: 19, TO: 14

================================================================================
