================================================================================
                        FULL GAME - Team_077 vs Team_046                        
================================================================================

================================================================================
                       1ST QUARTER - Team_077 vs Team_046                       
================================================================================

[12:00] Team_077 possession (Score: 0-0)
Chris Ginobili attempts a 3Pt. Contested by Lauri Carter (3.4 feet, ZONE). Chris Ginobili misses. Rebound secured by Cade Wall.

[11:45] Team_046 possession (Score: 0-0)
D'Angelo O'Neal attempts a 3Pt. Contested by Ja Ball (5.3 feet, MAN). D'Angelo O'Neal misses. Rebound secured by Russell Harden.

[11:30] Team_077 possession (Score: 0-0)
Dejounte Allen attempts a 3Pt. Wide open! Victor Nowitzki is 6.6 feet away. [ZONE] DEJOUNTE ALLEN MAKES IT! Assist: Ja Ball
Score: 3-0

[11:10] Team_046 possession (Score: 3-0)
FOUL! Holding foul on Russell Harden. [Team fouls: 1] No free throws, side out. (Russell Harden: 1 personal fouls)

[10:54] Team_046 possession (Score: 3-0)
D'Angelo O'Neal attempts a 3Pt. Contested by Ja Ball (2.9 feet, MAN). D'Angelo O'Neal misses. Offensive rebound by Cade Wall! Cade Wall kicks it out.

[10:43] Team_046 possession (Score: 3-0)
D'Angelo O'Neal attempts a 3Pt. Contested by Ja Ball (5.5 feet, MAN). D'Angelo O'Neal misses. Rebound secured by Chris Ginobili.

[10:26] Team_077 possession (Score: 3-0)
Draymond Dosunmu drives, Kevin Allen stays with him. Draymond Dosunmu attempts a Layup. Contested by Kevin Allen (3.6 feet, MAN). Draymond Dosunmu misses. Rebound secured by Kevin Allen.

[10:13] Team_046 possession (Score: 3-0)
Kevin Allen makes the Dunk and draws the foul on Ja Ball! And-1! Kevin Allen to the line for 1. [Team fouls: 2] (Ja Ball: 1 personal fouls)   FT 1/1: GOOD Kevin Allen makes 1/1 from the line.
Score: 3-3

[10:03] Team_077 possession (Score: 3-3)
FOUL! Shooting foul on Lauri Carter. Dejounte Allen to the line for 2 free throws. [Team fouls: 1] (Lauri Carter: 1 personal fouls)   FT 1/2: GOOD   FT 2/2: GOOD Dejounte Allen makes 2/2 from the line.
Score: 5-3

[09:51] Team_046 possession (Score: 5-3)
FOUL! Holding foul on Draymond Dosunmu. [Team fouls: 3] No free throws, side out. (Draymond Dosunmu: 1 personal fouls)

[09:38] Team_046 possession (Score: 5-3)
D'Angelo O'Neal drives, Ja Ball stays with him. D'Angelo O'Neal attempts a Layup. Contested by Ja Ball (3.7 feet, MAN). D'ANGELO O'NEAL MAKES IT! Assist: Cade Wall
Score: 5-5

[09:24] Team_077 possession (Score: 5-5)
Russell Harden attempts a 3Pt. Contested by Cade Wall (4.0 feet, MAN). Russell Harden misses. Rebound secured by Lauri Carter.

[09:10] Team_046 possession (Score: 5-5)
Lauri Carter attempts a 3Pt. Contested by Chris Ginobili (3.5 feet, MAN). LAURI CARTER MAKES IT! Assist: Victor Nowitzki
Score: 5-8

[08:50] Team_077 possession (Score: 5-8)
Ja Ball attempts a Layup. BLOCKED BY D'ANGELO O'NEAL! Ball is loose! Offensive rebound by Russell Harden! Russell Harden kicks it out.

[08:33] Team_077 possession (Score: 5-8)
Russell Harden drives, Cade Wall stays with him. Russell Harden attempts a Layup. Heavily contested by Cade Wall (0.9 feet, MAN)! Russell Harden misses. Offensive rebound by Draymond Dosunmu! Draymond Dosunmu kicks it out.

[08:18] Team_077 possession (Score: 5-8)
Russell Harden attempts a Midrange. Contested by Cade Wall (3.7 feet, MAN). Russell Harden misses. Rebound secured by Lauri Carter.

[08:07] Team_046 possession (Score: 5-8)
Cade Wall throws a bad pass out of bounds! TURNOVER! (dead ball)

[07:54] Team_077 possession (Score: 5-8)
Chris Ginobili drives and kicks out. Russell Harden attempts a 3Pt. Contested by Cade Wall (2.8 feet, MAN). Russell Harden misses. Offensive rebound by Draymond Dosunmu! Draymond Dosunmu kicks it out.

[07:41] Team_077 possession (Score: 5-8)
Chris Ginobili attempts a 3Pt. Contested by Lauri Carter (3.6 feet, MAN). CHRIS GINOBILI MAKES IT! Assist: Russell Harden
Score: 8-8

[07:28] Team_046 possession (Score: 8-8)
Kevin Allen attempts a Layup. Wide open! Draymond Dosunmu is 6.1 feet away. [ZONE] KEVIN ALLEN MAKES IT! Assist: Cade Wall
Score: 8-10

[07:17] Team_077 possession (Score: 8-10)
Draymond Dosunmu drives, Kevin Allen stays with him. Draymond Dosunmu attempts a Layup. Wide open! Kevin Allen is 7.9 feet away. [MAN] DRAYMOND DOSUNMU MAKES IT! Assist: Chris Ginobili
Score: 10-10

[07:03] Team_046 possession (Score: 10-10)
Cade Wall drives and kicks out. Cade Wall attempts a 3Pt. Contested by Dejounte Allen (4.8 feet, ZONE). Cade Wall misses. FOUL! Loose ball foul on Draymond Dosunmu during the rebound battle. [Team fouls: 4] No free throws, side out. (Draymond Dosunmu: 2 personal fouls)

[06:49] Team_046 possession (Score: 10-10)
Kevin Allen drives and kicks out. Victor Nowitzki attempts a Midrange. Contested by Chris Ginobili (3.1 feet, ZONE). VICTOR NOWITZKI MAKES IT! Assist: Cade Wall
Score: 10-12

[06:35] Team_077 possession (Score: 10-12)
Dejounte Allen attempts a Layup. Contested by Kevin Allen (4.5 feet, ZONE). DEJOUNTE ALLEN MAKES IT! Assist: Chris Ginobili
Score: 12-12

[06:23] Team_046 possession (Score: 12-12)
Kevin Allen makes the Layup and draws the foul on Draymond Dosunmu! And-1! Kevin Allen to the line for 1. [BONUS: 5 team fouls] (Draymond Dosunmu: 3 personal fouls)   FT 1/1: GOOD Kevin Allen makes 1/1 from the line.
Score: 12-15

[06:12] Team_077 possession (Score: 12-15)
Russell Harden attempts a Layup. Heavily contested by Cade Wall (1.6 feet, MAN)! RUSSELL HARDEN MAKES IT! Assist: Draymond Dosunmu
Score: 14-15

[05:59] Team_046 possession (Score: 14-15)
Kevin Allen drives and kicks out. Victor Nowitzki attempts a Midrange. Wide open! Draymond Dosunmu is 7.3 feet away. [ZONE] VICTOR NOWITZKI MAKES IT!
Score: 14-17

[05:47] Team_077 possession (Score: 14-17)
Russell Harden attempts a 3Pt. Contested by Cade Wall (5.4 feet, MAN). Russell Harden misses. Rebound secured by Lauri Carter.

[05:29] Team_046 possession (Score: 14-17)
Lauri Carter loses the ball! Stripped by Chris Ginobili! TURNOVER! (live ball)

[05:14] Team_077 possession (Score: 14-17)
Chris Ginobili attempts a 3Pt. Contested by Lauri Carter (4.5 feet, MAN). CHRIS GINOBILI MAKES IT! Assist: Dejounte Allen
Score: 17-17

[05:01] Team_046 possession (Score: 17-17)
Lauri Carter attempts a 3Pt. Contested by Chris Ginobili (3.4 feet, MAN). LAURI CARTER MAKES IT! Assist: Kevin Allen
Score: 17-20

[04:50] Team_077 possession (Score: 17-20)
FOUL! Shooting foul on Cade Wall. Russell Harden to the line for 2 free throws. [Team fouls: 2] (Cade Wall: 1 personal fouls)   FT 1/2: GOOD   FT 2/2: GOOD Russell Harden makes 2/2 from the line.
Score: 19-20

[04:35] Team_046 possession (Score: 19-20)
Cade Wall attempts a Midrange. Wide open! Russell Harden is 6.4 feet away. [ZONE] CADE WALL MAKES IT!
Score: 19-22

[04:16] Team_077 possession (Score: 19-22)
Russell Harden makes the Layup and draws the foul on Kevin Allen! And-1! Russell Harden to the line for 1. [Team fouls: 3] (Kevin Allen: 1 personal fouls)   FT 1/1: GOOD Russell Harden makes 1/1 from the line.
Score: 22-22

[04:00] Team_046 possession (Score: 22-22)
Kevin Allen attempts a Layup. Contested by Draymond Dosunmu (2.3 feet, ZONE). Kevin Allen misses. Rebound secured by Draymond Dosunmu.

[03:45] Team_077 possession (Score: 22-22)
FOUL! Holding foul on Cade Wall. [Team fouls: 4] No free throws, side out. (Cade Wall: 2 personal fouls)

[03:29] Team_077 possession (Score: 22-22)
Chris Ginobili attempts a Layup. Heavily contested by Lauri Carter (0.5 feet, MAN)! CHRIS GINOBILI MAKES IT! Assist: Dejounte Allen
Score: 24-22

[03:16] Team_046 possession (Score: 24-22)
D'Angelo O'Neal throws a bad pass! Stolen by Ja Ball! TURNOVER! (live ball)

[03:05] Team_077 possession (Score: 24-22)
Chris Ginobili attempts a 3Pt. Contested by Lauri Carter (3.3 feet, ZONE). Chris Ginobili misses. Offensive rebound by Russell Harden! Russell Harden kicks it out.

[02:48] Team_077 possession (Score: 24-22)
Chris Ginobili attempts a 3Pt. Contested by Lauri Carter (4.1 feet, MAN). Chris Ginobili misses. Rebound secured by Kevin Allen.

[02:33] Team_046 possession (Score: 24-22)
Cade Wall drives, picks up Russell Harden. Help arrives from Ja Ball! Cade Wall attempts a Layup. Contested by Ja Ball (2.7 feet, MAN). Cade Wall misses. Offensive rebound by Cade Wall! Cade Wall kicks it out.

[02:17] Team_046 possession (Score: 24-22)
Victor Nowitzki drives to the basket... Victor Nowitzki throws a bad pass out of bounds! TURNOVER! (dead ball)

[02:17] Substitution (Team_077): Dejounte Allen OUT → Dejounte Quickley IN (stamina_rule2)

[02:17] Substitution (Team_077): Chris Ginobili OUT → Tyler Poole IN (stamina_rule2)

[02:17] Substitution (Team_077): Russell Harden OUT → Jordan Simmons IN (stamina_rule2)

[02:17] Substitution (Team_077): Draymond Dosunmu OUT → Ayo Griffin IN (stamina_rule2)

[02:17] Substitution (Team_046): D'Angelo O'Neal OUT → Collin Butler IN (stamina_rule2)

[02:17] Substitution (Team_046): Victor Nowitzki OUT → Manu Dosunmu IN (stamina_rule2)

[02:17] Substitution (Team_046): Lauri Carter OUT → Josh Barrett IN (stamina_rule2)

[02:17] Substitution (Team_046): Cade Wall OUT → Chris LaVine IN (stamina_rule2)

[02:17] Substitution (Team_046): Kevin Allen OUT → Paul DeRozan IN (stamina_rule2)

[02:00] Team_077 possession (Score: 24-22)
Tyler Poole attempts a Midrange. Contested by Chris LaVine (4.8 feet, ZONE). TYLER POOLE MAKES IT!
Score: 26-22

[01:45] Team_046 possession (Score: 26-22)
Manu Dosunmu attempts a 3Pt. Contested by Ja Ball (5.4 feet, ZONE). Manu Dosunmu misses. Rebound secured by Jordan Simmons.

[01:31] Team_077 possession (Score: 26-22)
Ayo Griffin drives, Chris LaVine stays with him. Ayo Griffin attempts a Dunk. Contested by Chris LaVine (3.0 feet, MAN). Ayo Griffin misses. Offensive rebound by Jordan Simmons! Jordan Simmons kicks it out.

[01:16] Team_077 possession (Score: 26-22)
Ja Ball attempts a 3Pt. Contested by Collin Butler (3.9 feet, MAN). Ja Ball misses. Rebound secured by Manu Dosunmu.

[01:04] Team_046 possession (Score: 26-22)
Manu Dosunmu attempts a 3Pt. Contested by Ja Ball (4.0 feet, ZONE). Manu Dosunmu misses. Rebound secured by Ja Ball.

[00:51] Team_077 possession (Score: 26-22)
Jordan Simmons attempts a Midrange. Wide open! Chris LaVine is 7.4 feet away. [MAN] JORDAN SIMMONS MAKES IT!
Score: 28-22

[00:38] Team_046 possession (Score: 28-22)
Paul DeRozan makes the Layup and draws the foul on Ayo Griffin! And-1! Paul DeRozan to the line for 1. [BONUS: 6 team fouls] (Ayo Griffin: 1 personal fouls)   FT 1/1: MISS Paul DeRozan makes 0/1 from the line. Rebound secured by Ayo Griffin.
Score: 28-24

[00:24] Team_077 possession (Score: 28-24)
Dejounte Quickley drives to the basket... Dejounte Quickley throws a bad pass! Stolen by Paul DeRozan! TURNOVER! (live ball)

[00:10] Team_046 possession (Score: 28-24)
FOUL! Holding foul on Jordan Simmons. [IN THE BONUS! 7 team fouls] Chris LaVine to the line for 2 free throws. (Jordan Simmons: 1 personal fouls)   FT 1/2: GOOD   FT 2/2: GOOD Chris LaVine makes 2/2 from the line.
Score: 28-26

================================================================================
                              1ST QUARTER COMPLETE                              
================================================================================

1ST QUARTER SCORE: Team_077 28, Team_046 26

BOX SCORE:
================================================================================

Team_077
--------------------------------------------------------------------------------
Player                MIN  PTS  REB  AST  TO      FG   FG%      3P   3P%
--------------------------------------------------------------------------------
Chris Ginobili         10    8    1    2   0   3/5    60.0     0/0   0.0
Russell Harden         10    7    3    1   0   3/6    50.0     0/0   0.0
Dejounte Allen         10    7    0    2   0   3/3   100.0     0/0   0.0
Draymond Dosunmu       10    2    3    1   0   1/2    50.0     0/0   0.0
Tyler Poole             2    2    0    0   0   1/1   100.0     0/0   0.0
Jordan Simmons          2    2    2    0   0   1/1   100.0     0/0   0.0
Ja Ball                12    0    1    1   0   0/1     0.0     0/0   0.0
Ayo Griffin             2    0    1    0   0   0/0     0.0     0/0   0.0

TEAM: FG: 12/19 (63.2%), 3PT: 3/8 (37.5%), REB: 11 (5 off, 6 def), AST: 7, TO: 1
TEAM FOULS: 7 [Team_046 in BONUS]


Team_046
--------------------------------------------------------------------------------
Player                MIN  PTS  REB  AST  TO      FG   FG%      3P   3P%
--------------------------------------------------------------------------------
Kevin Allen            10    8    2    1   0   3/4    75.0     0/0   0.0
Lauri Carter           10    6    3    0   0   2/2   100.0     0/0   0.0
Victor Nowitzki        10    4    0    1   0   2/2   100.0     0/0   0.0
Cade Wall              10    2    4    3   0   1/1   100.0     0/0   0.0
D'Angelo O'Neal        10    2    0    0   0   1/3    33.3     0/0   0.0
Chris LaVine            2    2    0    0   0   1/1   100.0     0/0   0.0
Manu Dosunmu            2    0    1    0   0   0/2     0.0     0/0   0.0
Paul DeRozan            2    0    0    0   0   0/1     0.0     0/0   0.0

TEAM: FG: 10/16 (62.5%), 3PT: 2/6 (33.3%), REB: 10 (3 off, 7 def), AST: 5, TO: 4
TEAM FOULS: 4

================================================================================

================================================================================
                       2ND QUARTER - Team_077 vs Team_046                       
================================================================================

[12:00] Team_077 possession (Score: 28-26)
Ja Ball attempts a 3Pt. Wide open! Lauri Carter is 7.2 feet away. [ZONE] JA BALL MAKES IT! Assist: Draymond Dosunmu
Score: 31-26

[11:44] Team_046 possession (Score: 31-26)
D'Angelo O'Neal attempts a 3Pt. Contested by Ja Ball (5.0 feet, MAN). D'ANGELO O'NEAL MAKES IT! Assist: Cade Wall
Score: 31-29

[11:27] Team_077 possession (Score: 31-29)
Draymond Dosunmu attempts a Layup. BLOCKED BY KEVIN ALLEN! Ball is loose! Offensive rebound by Draymond Dosunmu! Draymond Dosunmu kicks it out.

[11:14] Team_077 possession (Score: 31-29)
Chris Ginobili attempts a 3Pt. Contested by Lauri Carter (2.6 feet, ZONE). Chris Ginobili misses. Rebound secured by Cade Wall.

[10:58] Team_046 possession (Score: 31-29)
Victor Nowitzki attempts a 3Pt. Contested by Dejounte Allen (3.9 feet, MAN). Victor Nowitzki misses. Offensive rebound by Kevin Allen! Kevin Allen kicks it out.

[10:40] Team_046 possession (Score: 31-29)
Kevin Allen throws a bad pass out of bounds! TURNOVER! (dead ball)

[10:40] Substitution (Team_077): Ja Ball OUT → Bam Bryant IN (stamina_rule2)

[10:27] Team_077 possession (Score: 31-29)
Dejounte Allen attempts a 3Pt. Contested by Lauri Carter (3.9 feet, ZONE). Dejounte Allen misses. Rebound secured by Lauri Carter.

[10:11] Team_046 possession (Score: 31-29)
Kevin Allen attempts a Midrange. Contested by Draymond Dosunmu (3.3 feet, ZONE). KEVIN ALLEN MAKES IT!
Score: 31-31

[09:57] Team_077 possession (Score: 31-31)
Bam Bryant attempts a 3Pt. Contested by Lauri Carter (5.5 feet, ZONE). Bam Bryant misses. Rebound secured by Cade Wall.

[09:42] Team_046 possession (Score: 31-31)
Kevin Allen attempts a 3Pt. Contested by Draymond Dosunmu (4.1 feet, MAN). Kevin Allen misses. Rebound secured by Draymond Dosunmu.

[09:23] Team_077 possession (Score: 31-31)
Dejounte Allen makes the Dunk and draws the foul on D'Angelo O'Neal! And-1! Dejounte Allen to the line for 1. [Team fouls: 2] (D'Angelo O'Neal: 1 personal fouls)   FT 1/1: GOOD Dejounte Allen makes 1/1 from the line.
Score: 34-31

[09:06] Team_046 possession (Score: 34-31)
Cade Wall makes the Midrange and draws the foul on Dejounte Allen! And-1! Cade Wall to the line for 1. [Team fouls: 1] (Dejounte Allen: 1 personal fouls)   FT 1/1: GOOD Cade Wall makes 1/1 from the line.
Score: 34-34

[08:50] Team_077 possession (Score: 34-34)
Dejounte Allen attempts a Midrange. Contested by Victor Nowitzki (5.8 feet, MAN). Dejounte Allen misses. Rebound secured by Lauri Carter.

[08:38] Team_046 possession (Score: 34-34)
Lauri Carter attempts a 3Pt. Heavily contested by Dejounte Allen (1.7 feet, ZONE)! Lauri Carter misses. Rebound secured by Russell Harden.

[08:22] Team_077 possession (Score: 34-34)
Russell Harden attempts a 3Pt. Wide open! Cade Wall is 7.8 feet away. [ZONE] Russell Harden misses. Offensive rebound by Draymond Dosunmu! Draymond Dosunmu kicks it out.

[08:09] Team_077 possession (Score: 34-34)
Russell Harden attempts a 3Pt. Wide open! Cade Wall is 7.0 feet away. [MAN] RUSSELL HARDEN MAKES IT! Assist: Dejounte Allen
Score: 37-34

[07:50] Team_046 possession (Score: 37-34)
Kevin Allen drives, Draymond Dosunmu stays with him. Kevin Allen attempts a Layup. Contested by Draymond Dosunmu (3.8 feet, ZONE). Kevin Allen misses. Rebound secured by Draymond Dosunmu.

[07:38] Team_077 possession (Score: 37-34)
FOUL! Offensive foul on Bam Bryant! D'Angelo O'Neal drew the charge! [Team fouls: 2] (Bam Bryant: 1 personal fouls) TURNOVER! (dead ball)

[07:25] Team_046 possession (Score: 37-34)
FOUL! Shooting foul on Draymond Dosunmu. Kevin Allen to the line for 2 free throws. [Team fouls: 3] (Draymond Dosunmu: 1 personal fouls)   FT 1/2: GOOD   FT 2/2: MISS Kevin Allen makes 1/2 from the line. Rebound secured by Draymond Dosunmu.
Score: 37-35

[07:08] Team_077 possession (Score: 37-35)
Russell Harden drives, picks up Cade Wall. Help arrives from D'Angelo O'Neal! Russell Harden attempts a Dunk. Contested by D'Angelo O'Neal (2.0 feet, MAN). RUSSELL HARDEN MAKES IT! Assist: Chris Ginobili
Score: 39-35

[06:56] Team_046 possession (Score: 39-35)
Victor Nowitzki attempts a Layup. Contested by Dejounte Allen (3.9 feet, MAN). VICTOR NOWITZKI MAKES IT!
Score: 39-37

[06:36] Team_077 possession (Score: 39-37)
Draymond Dosunmu drives, Kevin Allen stays with him. Draymond Dosunmu attempts a Dunk. Contested by Kevin Allen (2.8 feet, ZONE). DRAYMOND DOSUNMU MAKES IT! Assist: Dejounte Allen
Score: 41-37

[06:21] Team_046 possession (Score: 41-37)
Victor Nowitzki attempts a 3Pt. Wide open! Dejounte Allen is 6.4 feet away. [ZONE] Victor Nowitzki misses. Rebound secured by Russell Harden.

[06:10] Team_077 possession (Score: 41-37)
Russell Harden attempts a 3Pt. Contested by Cade Wall (5.5 feet, MAN). RUSSELL HARDEN MAKES IT! Assist: Draymond Dosunmu
Score: 44-37

[05:53] Team_046 possession (Score: 44-37)
Victor Nowitzki throws a bad pass! Stolen by Dejounte Allen! TURNOVER! (live ball)

[05:42] Team_077 possession (Score: 44-37)
Chris Ginobili attempts a 3Pt. Contested by Lauri Carter (4.8 feet, ZONE). Chris Ginobili misses. Rebound secured by Cade Wall.

[05:32] Team_046 possession (Score: 44-37)
Lauri Carter attempts a Layup. Heavily contested by Chris Ginobili (0.9 feet, MAN)! LAURI CARTER MAKES IT! Assist: Kevin Allen
Score: 44-39

[05:13] Team_077 possession (Score: 44-39)
Draymond Dosunmu drives, Kevin Allen stays with him. Draymond Dosunmu attempts a Layup. Contested by Kevin Allen (4.0 feet, ZONE). Draymond Dosunmu misses. Offensive rebound by Draymond Dosunmu! Draymond Dosunmu kicks it out.

[04:59] Team_077 possession (Score: 44-39)
Russell Harden drives and kicks out. Dejounte Allen attempts a 3Pt. Contested by Lauri Carter (3.5 feet, ZONE). Dejounte Allen misses. Rebound secured by Kevin Allen.

[04:44] Team_046 possession (Score: 44-39)
Victor Nowitzki attempts a Layup. Wide open! Dejounte Allen is 6.2 feet away. [MAN] Victor Nowitzki misses. Rebound secured by Chris Ginobili.

[04:34] Team_077 possession (Score: 44-39)
FOUL! Shooting foul on D'Angelo O'Neal. Chris Ginobili to the line for 2 free throws. [Team fouls: 3] (D'Angelo O'Neal: 2 personal fouls)   FT 1/2: GOOD   FT 2/2: GOOD Chris Ginobili makes 2/2 from the line.
Score: 46-39

[04:22] Team_046 possession (Score: 46-39)
D'Angelo O'Neal attempts a 3Pt. Contested by Dejounte Allen (5.3 feet, ZONE). D'Angelo O'Neal misses. Rebound secured by Draymond Dosunmu.

[04:10] Team_077 possession (Score: 46-39)
FOUL! Reach-in foul on Cade Wall during the drive. [Team fouls: 4] No free throws, side out. (Cade Wall: 2 personal fouls)

[03:53] Team_077 possession (Score: 46-39)
Dejounte Allen drives to the basket... Dejounte Allen throws a bad pass out of bounds! TURNOVER! (dead ball)

[03:53] Substitution (Team_077): Dejounte Allen OUT → Dejounte Quickley IN (stamina_rule2)

[03:53] Substitution (Team_077): Chris Ginobili OUT → Tyler Poole IN (stamina_rule2)

[03:53] Substitution (Team_077): Russell Harden OUT → Jordan Simmons IN (stamina_rule2)

[03:53] Substitution (Team_077): Draymond Dosunmu OUT → Ayo Griffin IN (stamina_rule2)

[03:53] Substitution (Team_046): D'Angelo O'Neal OUT → Collin Butler IN (stamina_rule2)

[03:53] Substitution (Team_046): Victor Nowitzki OUT → Manu Dosunmu IN (stamina_rule2)

[03:53] Substitution (Team_046): Lauri Carter OUT → Josh Barrett IN (stamina_rule2)

[03:53] Substitution (Team_046): Cade Wall OUT → Chris LaVine IN (stamina_rule2)

[03:53] Substitution (Team_046): Kevin Allen OUT → Paul DeRozan IN (stamina_rule2)

[03:38] Team_046 possession (Score: 46-39)
Collin Butler attempts a 3Pt. Contested by Dejounte Quickley (2.7 feet, ZONE). COLLIN BUTLER MAKES IT!
Score: 46-42

[03:23] Team_077 possession (Score: 46-42)
Dejounte Quickley makes the 3Pt and draws the foul on Manu Dosunmu! And-1! Dejounte Quickley to the line for 1. [BONUS: 5 team fouls] (Manu Dosunmu: 1 personal fouls)   FT 1/1: GOOD Dejounte Quickley makes 1/1 from the line.
Score: 50-42

[03:11] Team_046 possession (Score: 50-42)
Collin Butler attempts a Layup. BLOCKED BY BAM BRYANT! Ball is loose! Rebound secured by Tyler Poole.

[02:57] Team_077 possession (Score: 50-42)
Tyler Poole attempts a 3Pt. Wide open! Josh Barrett is 8.9 feet away. [MAN] Tyler Poole misses. Rebound secured by Paul DeRozan.

[02:38] Team_046 possession (Score: 50-42)
FOUL! Shooting foul on Ayo Griffin. Paul DeRozan to the line for 2 free throws. [Team fouls: 4] (Ayo Griffin: 1 personal fouls)   FT 1/2: GOOD   FT 2/2: GOOD Paul DeRozan makes 2/2 from the line.
Score: 50-44

[02:28] Team_077 possession (Score: 50-44)
Tyler Poole attempts a 3Pt. Contested by Collin Butler (4.3 feet, ZONE). Tyler Poole misses. Rebound secured by Chris LaVine.

[02:14] Team_046 possession (Score: 50-44)
Paul DeRozan attempts a 3Pt. Contested by Ayo Griffin (2.1 feet, MAN). Paul DeRozan misses. Rebound secured by Ayo Griffin.

[02:00] Team_077 possession (Score: 50-44)
Tyler Poole attempts a 3Pt. Wide open! Josh Barrett is 10.0 feet away. [MAN] TYLER POOLE MAKES IT! Assist: Dejounte Quickley
Score: 53-44

[01:47] Team_046 possession (Score: 53-44)
Chris LaVine attempts a Layup. BLOCKED BY JORDAN SIMMONS! Ball goes out off Jordan Simmons. Chris LaVine's ball!

[01:34] Team_046 possession (Score: 53-44)
FOUL! Shooting foul on Dejounte Quickley. Paul DeRozan to the line for 2 free throws. [BONUS: 5 team fouls] (Dejounte Quickley: 1 personal fouls)   FT 1/2: MISS   FT 2/2: MISS Paul DeRozan makes 0/2 from the line. Rebound secured by Jordan Simmons.

[01:16] Team_077 possession (Score: 53-44)
Jordan Simmons attempts a Midrange. Heavily contested by Chris LaVine (0.5 feet, MAN)! JORDAN SIMMONS MAKES IT! Assist: Tyler Poole
Score: 55-44

[00:59] Team_046 possession (Score: 55-44)
Chris LaVine attempts a Layup. BLOCKED BY JORDAN SIMMONS! Ball deflects out of bounds off Chris LaVine.

[00:45] Team_077 possession (Score: 55-44)
FOUL! Shooting foul on Manu Dosunmu. Jordan Simmons to the line for 2 free throws. [BONUS: 6 team fouls] (Manu Dosunmu: 2 personal fouls)   FT 1/2: GOOD   FT 2/2: GOOD Jordan Simmons makes 2/2 from the line.
Score: 57-44

[00:34] Team_046 possession (Score: 57-44)
Paul DeRozan attempts a Midrange. Contested by Tyler Poole (4.5 feet, ZONE). Paul DeRozan misses. Rebound secured by Tyler Poole.

[00:21] Team_077 possession (Score: 57-44)
Ayo Griffin attempts a Layup. Contested by Chris LaVine (5.4 feet, ZONE). Ayo Griffin misses. Rebound secured by Paul DeRozan.

[00:08] Team_046 possession (Score: 57-44)
Manu Dosunmu attempts a Midrange. Wide open! Dejounte Quickley is 6.5 feet away. [MAN] MANU DOSUNMU MAKES IT! Assist: Paul DeRozan
Score: 57-46

================================================================================
                              2ND QUARTER COMPLETE                              
================================================================================

2ND QUARTER SCORE: Team_077 29, Team_046 20

BOX SCORE:
================================================================================

Team_077
--------------------------------------------------------------------------------
Player                MIN  PTS  REB  AST  TO      FG   FG%      3P   3P%
--------------------------------------------------------------------------------
Russell Harden         18    8    2    0   0   3/4    75.0     0/0   0.0
Dejounte Quickley       6    4    0    1   0   1/1   100.0     0/0   0.0
Jordan Simmons          6    4    1    0   0   2/2   100.0     0/0   0.0
Ja Ball                14    3    0    0   0   1/1   100.0     0/0   0.0
Dejounte Allen         18    3    0    2   0   1/3    33.3     0/0   0.0
Tyler Poole             6    3    2    1   0   1/3    33.3     0/0   0.0
Draymond Dosunmu       18    2    7    2   0   1/1   100.0     0/0   0.0
Chris Ginobili         18    2    1    1   0   1/3    33.3     0/0   0.0
Bam Bryant             11    0    0    0   0   0/1     0.0     0/0   0.0
Ayo Griffin             6    0    1    0   0   0/1     0.0     0/0   0.0

TEAM: FG: 11/20 (55.0%), 3PT: 5/11 (45.5%), REB: 14 (3 off, 11 def), AST: 7, TO: 2
TEAM FOULS: 5 [Team_046 in BONUS]


Team_046
--------------------------------------------------------------------------------
Player                MIN  PTS  REB  AST  TO      FG   FG%      3P   3P%
--------------------------------------------------------------------------------
D'Angelo O'Neal        18    3    0    0   0   1/2    50.0     0/0   0.0
Cade Wall              18    3    3    1   0   1/1   100.0     0/0   0.0
Collin Butler           6    3    0    0   0   1/2    50.0     0/0   0.0
Kevin Allen            18    2    2    1   0   1/4    25.0     0/0   0.0
Lauri Carter           18    2    2    0   0   1/2    50.0     0/0   0.0
Victor Nowitzki        18    2    0    0   0   1/3    33.3     0/0   0.0
Paul DeRozan            6    2    2    1   0   1/4    25.0     0/0   0.0
Manu Dosunmu            6    2    0    0   0   1/1   100.0     0/0   0.0
Chris LaVine            6    0    1    0   0   0/1     0.0     0/0   0.0

TEAM: FG: 8/20 (40.0%), 3PT: 2/7 (28.6%), REB: 10 (1 off, 9 def), AST: 3, TO: 2
TEAM FOULS: 6 [Team_077 in BONUS]

================================================================================

================================================================================
                       3RD QUARTER - Team_077 vs Team_046                       
================================================================================

[12:00] Team_077 possession (Score: 57-46)
Draymond Dosunmu drives, picks up Kevin Allen. Help arrives from D'Angelo O'Neal! Draymond Dosunmu attempts a Dunk. Wide open! D'Angelo O'Neal is 8.0 feet away. [ZONE] DRAYMOND DOSUNMU MAKES IT!
Score: 59-46

[11:45] Team_046 possession (Score: 59-46)
Lauri Carter drives and kicks out. Lauri Carter attempts a 3Pt. Contested by Chris Ginobili (5.8 feet, MAN). Lauri Carter misses. Offensive rebound by Kevin Allen! Kevin Allen kicks it out.

[11:29] Team_046 possession (Score: 59-46)
Kevin Allen drives, Draymond Dosunmu stays with him. Kevin Allen attempts a Dunk. Contested by Draymond Dosunmu (4.8 feet, ZONE). Kevin Allen misses. Rebound secured by Chris Ginobili.

[11:16] Team_077 possession (Score: 59-46)
Dejounte Allen attempts a 3Pt. Contested by Lauri Carter (4.7 feet, ZONE). Dejounte Allen misses. Rebound secured by Cade Wall.

[11:01] Team_046 possession (Score: 59-46)
D'Angelo O'Neal drives to the basket... FOUL! Offensive foul on D'Angelo O'Neal! Draymond Dosunmu drew the charge! [Team fouls: 1] (D'Angelo O'Neal: 1 personal fouls) TURNOVER! (dead ball)

[10:47] Team_077 possession (Score: 59-46)
Ja Ball attempts a 3Pt. Contested by D'Angelo O'Neal (4.6 feet, MAN). Ja Ball misses. Rebound secured by Lauri Carter.

[10:30] Team_046 possession (Score: 59-46)
Kevin Allen attempts a Midrange. Contested by Draymond Dosunmu (4.1 feet, MAN). Kevin Allen misses. Rebound secured by Russell Harden.

[10:16] Team_077 possession (Score: 59-46)
FOUL! Shooting foul on Kevin Allen. Chris Ginobili to the line for 2 free throws. [Team fouls: 2] (Kevin Allen: 1 personal fouls)   FT 1/2: GOOD   FT 2/2: GOOD Chris Ginobili makes 2/2 from the line.
Score: 61-46

[10:02] Team_046 possession (Score: 61-46)
Victor Nowitzki drives, Russell Harden stays with him. Victor Nowitzki attempts a Dunk. Contested by Russell Harden (4.2 feet, ZONE). VICTOR NOWITZKI MAKES IT!
Score: 61-48

[09:46] Team_077 possession (Score: 61-48)
Dejounte Allen attempts a Midrange. Contested by Victor Nowitzki (5.3 feet, ZONE). DEJOUNTE ALLEN MAKES IT!
Score: 63-48

[09:32] Team_046 possession (Score: 63-48)
D'Angelo O'Neal drives to the basket... FOUL! Offensive foul on D'Angelo O'Neal! Russell Harden drew the charge! [Team fouls: 3] (D'Angelo O'Neal: 2 personal fouls) TURNOVER! (dead ball)

[09:16] Team_077 possession (Score: 63-48)
Draymond Dosunmu drives, Kevin Allen stays with him. Draymond Dosunmu attempts a Dunk. Contested by Kevin Allen (2.7 feet, ZONE). Draymond Dosunmu misses. Rebound secured by Lauri Carter.

[08:59] Team_046 possession (Score: 63-48)
Cade Wall makes the Layup and draws the foul on Russell Harden! And-1! Cade Wall to the line for 1. [Team fouls: 1] (Russell Harden: 1 personal fouls)   FT 1/1: GOOD Cade Wall makes 1/1 from the line.
Score: 63-51

[08:40] Team_077 possession (Score: 63-51)
Draymond Dosunmu attempts a Midrange. Contested by Cade Wall (2.6 feet, ZONE). DRAYMOND DOSUNMU MAKES IT!
Score: 65-51

[08:28] Team_046 possession (Score: 65-51)
D'Angelo O'Neal drives to the basket... FOUL! Offensive foul on D'Angelo O'Neal! Ja Ball drew the charge! [Team fouls: 4] (D'Angelo O'Neal: 3 personal fouls) TURNOVER! (dead ball)

[08:14] Team_077 possession (Score: 65-51)
Chris Ginobili attempts a 3Pt. Wide open! Lauri Carter is 6.4 feet away. [MAN] Chris Ginobili misses. Rebound secured by Cade Wall.

[08:04] Team_046 possession (Score: 65-51)
FOUL! Shooting foul on Ja Ball. D'Angelo O'Neal to the line for 3 free throws. [Team fouls: 2] (Ja Ball: 1 personal fouls)   FT 1/3: GOOD   FT 2/3: GOOD   FT 3/3: MISS D'Angelo O'Neal makes 2/3 from the line. Rebound secured by Draymond Dosunmu.
Score: 65-53

[07:54] Team_077 possession (Score: 65-53)
Russell Harden makes the Dunk and draws the foul on D'Angelo O'Neal! And-1! Russell Harden to the line for 1. [BONUS: 5 team fouls] (D'Angelo O'Neal: 4 personal fouls)   FT 1/1: GOOD Russell Harden makes 1/1 from the line.
Score: 68-53

[07:43] Team_046 possession (Score: 68-53)
Cade Wall makes the Midrange and draws the foul on Russell Harden! And-1! Cade Wall to the line for 1. [Team fouls: 3] (Russell Harden: 2 personal fouls)   FT 1/1: GOOD Cade Wall makes 1/1 from the line.
Score: 68-56

[07:28] Team_077 possession (Score: 68-56)
Ja Ball attempts a 3Pt. Heavily contested by D'Angelo O'Neal (1.4 feet, MAN)! Ja Ball misses. Offensive rebound by Russell Harden! Russell Harden kicks it out.

[07:14] Team_077 possession (Score: 68-56)
Chris Ginobili drives, picks up Kevin Allen. Help arrives from D'Angelo O'Neal! Chris Ginobili attempts a Dunk. Contested by D'Angelo O'Neal (5.9 feet, ZONE). CHRIS GINOBILI MAKES IT! Assist: Draymond Dosunmu
Score: 70-56

[07:01] Team_046 possession (Score: 70-56)
Kevin Allen drives, picks up Draymond Dosunmu. Help arrives from Ja Ball! Kevin Allen attempts a Dunk. Contested by Ja Ball (4.4 feet, MAN). KEVIN ALLEN MAKES IT!
Score: 70-58

[06:48] Team_077 possession (Score: 70-58)
Chris Ginobili drives, picks up Kevin Allen. Help arrives from D'Angelo O'Neal! Chris Ginobili attempts a Layup. Contested by D'Angelo O'Neal (4.6 feet, ZONE). CHRIS GINOBILI MAKES IT! Assist: Ja Ball
Score: 72-58

[06:37] Team_046 possession (Score: 72-58)
Lauri Carter attempts a Midrange. BLOCKED BY CHRIS GINOBILI! Ball deflects out of bounds off Lauri Carter.

[06:21] Team_077 possession (Score: 72-58)
Chris Ginobili drives, Kevin Allen stays with him. Chris Ginobili attempts a Layup. Contested by Kevin Allen (2.4 feet, ZONE). CHRIS GINOBILI MAKES IT! Assist: Draymond Dosunmu
Score: 74-58

[06:08] Team_046 possession (Score: 74-58)
Cade Wall attempts a 3Pt. Contested by Russell Harden (3.8 feet, ZONE). CADE WALL MAKES IT! Assist: Kevin Allen
Score: 74-61

[05:59] Team_077 possession (Score: 74-61)
Ja Ball drives, D'Angelo O'Neal stays with him. Ja Ball attempts a Dunk. Contested by D'Angelo O'Neal (2.1 feet, MAN). JA BALL MAKES IT! Assist: Draymond Dosunmu
Score: 76-61

[05:45] Team_046 possession (Score: 76-61)
Cade Wall drives, Russell Harden stays with him. Cade Wall attempts a Dunk. Contested by Russell Harden (5.9 feet, MAN). CADE WALL MAKES IT!
Score: 76-63

[05:30] Team_077 possession (Score: 76-63)
Chris Ginobili commits a violation (traveling/carry)! TURNOVER! (dead ball)

[05:14] Team_046 possession (Score: 76-63)
FOUL! Reach-in foul on Draymond Dosunmu during the drive. [Team fouls: 4] No free throws, side out. (Draymond Dosunmu: 1 personal fouls)

[05:02] Team_046 possession (Score: 76-63)
Lauri Carter drives, picks up Draymond Dosunmu. Help arrives from Ja Ball! Lauri Carter attempts a Layup. Contested by Ja Ball (2.1 feet, ZONE). Lauri Carter misses. Offensive rebound by Cade Wall! Cade Wall kicks it out.

[04:53] Team_046 possession (Score: 76-63)
Victor Nowitzki attempts a 3Pt. Contested by Dejounte Allen (3.7 feet, ZONE). Victor Nowitzki misses. Rebound secured by Draymond Dosunmu.

[04:40] Team_077 possession (Score: 76-63)
Dejounte Allen attempts a 3Pt. Heavily contested by Lauri Carter (1.3 feet, ZONE)! Dejounte Allen misses. Rebound secured by Cade Wall.

[04:26] Team_046 possession (Score: 76-63)
Cade Wall attempts a 3Pt. Contested by Russell Harden (3.1 feet, MAN). CADE WALL MAKES IT! Assist: Lauri Carter
Score: 76-66

[04:14] Team_077 possession (Score: 76-66)
Draymond Dosunmu attempts a Midrange. Heavily contested by Kevin Allen (1.9 feet, MAN)! Draymond Dosunmu misses. Offensive rebound by Draymond Dosunmu! Draymond Dosunmu kicks it out.

[03:59] Team_077 possession (Score: 76-66)
Dejounte Allen attempts a 3Pt. Contested by Victor Nowitzki (3.8 feet, MAN). Dejounte Allen misses. Rebound secured by Kevin Allen.

[03:40] Team_046 possession (Score: 76-66)
D'Angelo O'Neal attempts a Midrange. Wide open! Russell Harden is 7.4 feet away. [ZONE] D'ANGELO O'NEAL MAKES IT!
Score: 76-68

[03:28] Team_077 possession (Score: 76-68)
Russell Harden drives, Kevin Allen stays with him. Russell Harden attempts a Layup. Contested by Kevin Allen (2.5 feet, ZONE). RUSSELL HARDEN MAKES IT!
Score: 78-68

[03:15] Team_046 possession (Score: 78-68)
Victor Nowitzki attempts a 3Pt. Wide open! Dejounte Allen is 6.3 feet away. [MAN] Victor Nowitzki misses. Rebound secured by Chris Ginobili.

[03:04] Team_077 possession (Score: 78-68)
FOUL! Offensive foul on Dejounte Allen! Victor Nowitzki drew the charge! [Team fouls: 5] (Dejounte Allen: 1 personal fouls) TURNOVER! (dead ball)

[02:51] Team_046 possession (Score: 78-68)
FOUL! Holding foul on Draymond Dosunmu. [IN THE BONUS! 6 team fouls] Kevin Allen to the line for 2 free throws. (Draymond Dosunmu: 2 personal fouls)   FT 1/2: GOOD   FT 2/2: GOOD Kevin Allen makes 2/2 from the line.
Score: 78-70

[02:34] Team_077 possession (Score: 78-70)
Chris Ginobili attempts a Midrange. Contested by Lauri Carter (5.9 feet, MAN). Chris Ginobili misses. Rebound secured by Cade Wall.

[02:19] Team_046 possession (Score: 78-70)
Cade Wall attempts a Layup. Contested by Russell Harden (2.6 feet, MAN). CADE WALL MAKES IT! Assist: Victor Nowitzki
Score: 78-72

[02:01] Team_077 possession (Score: 78-72)
Russell Harden attempts a Midrange. Contested by Cade Wall (2.9 feet, ZONE). Russell Harden misses. Rebound secured by Lauri Carter.

[01:47] Team_046 possession (Score: 78-72)
Victor Nowitzki attempts a Layup. BLOCKED BY DEJOUNTE ALLEN! Ball is loose! Offensive rebound by Cade Wall! Cade Wall kicks it out.

[01:38] Team_046 possession (Score: 78-72)
D'Angelo O'Neal throws a bad pass out of bounds! TURNOVER! (dead ball)

[01:38] Substitution (Team_077): Ja Ball OUT → Bam Bryant IN (stamina_rule2)

[01:38] Substitution (Team_077): Dejounte Allen OUT → Dejounte Quickley IN (stamina_rule2)

[01:38] Substitution (Team_077): Chris Ginobili OUT → Tyler Poole IN (stamina_rule2)

[01:38] Substitution (Team_077): Russell Harden OUT → Jordan Simmons IN (stamina_rule2)

[01:38] Substitution (Team_077): Draymond Dosunmu OUT → Ayo Griffin IN (stamina_rule2)

[01:38] Substitution (Team_046): D'Angelo O'Neal OUT → Collin Butler IN (stamina_rule2)

[01:38] Substitution (Team_046): Victor Nowitzki OUT → Manu Dosunmu IN (stamina_rule2)

[01:38] Substitution (Team_046): Lauri Carter OUT → Josh Barrett IN (stamina_rule2)

[01:38] Substitution (Team_046): Cade Wall OUT → Chris LaVine IN (stamina_rule2)

[01:38] Substitution (Team_046): Kevin Allen OUT → Paul DeRozan IN (stamina_rule2)

[01:23] Team_077 possession (Score: 78-72)
Jordan Simmons drives to the basket... Jordan Simmons throws a bad pass! Stolen by Chris LaVine! TURNOVER! (live ball)

[01:06] Team_046 possession (Score: 78-72)
Chris LaVine makes the Layup and draws the foul on Jordan Simmons! And-1! Chris LaVine to the line for 1. [BONUS: 7 team fouls] (Jordan Simmons: 1 personal fouls)   FT 1/1: MISS Chris LaVine makes 0/1 from the line. FOUL! Loose ball foul on Ayo Griffin during the free throw rebound! [IN THE BONUS! 8 team fouls] Paul DeRozan to the line for 2 free throws. (Ayo Griffin: 1 personal fouls)   FT 1/2: MISS   FT 2/2: GOOD Paul DeRozan makes 1/2 from the line.
Score: 78-75

[00:53] Team_077 possession (Score: 78-75)
Dejounte Quickley drives and kicks out. Bam Bryant attempts a Midrange. Contested by Collin Butler (4.7 feet, MAN). Bam Bryant misses. Offensive rebound by Ayo Griffin! Ayo Griffin puts it back in!
Score: 80-75

[00:37] Team_046 possession (Score: 80-75)
Chris LaVine attempts a 3Pt. Contested by Jordan Simmons (2.2 feet, MAN). CHRIS LAVINE MAKES IT!
Score: 80-78

[00:26] Team_077 possession (Score: 80-78)
Jordan Simmons throws a bad pass! Stolen by Chris LaVine! TURNOVER! (live ball)

[00:15] Team_046 possession (Score: 80-78)
Collin Butler attempts a Midrange. Contested by Dejounte Quickley (3.3 feet, ZONE). Collin Butler misses. Rebound secured by Jordan Simmons.

================================================================================
                              3RD QUARTER COMPLETE                              
================================================================================

3RD QUARTER SCORE: Team_077 23, Team_046 32

BOX SCORE:
================================================================================

Team_077
--------------------------------------------------------------------------------
Player                MIN  PTS  REB  AST  TO      FG   FG%      3P   3P%
--------------------------------------------------------------------------------
Chris Ginobili         29    8    2    0   0   4/6    66.7     0/0   0.0
Russell Harden         29    5    2    0   0   2/3    66.7     0/0   0.0
Draymond Dosunmu       29    4    3    3   0   2/3    66.7     0/0   0.0
Dejounte Allen         29    2    0    0   0   1/4    25.0     0/0   0.0
Ja Ball                24    2    0    1   0   1/2    50.0     0/0   0.0
Ayo Griffin             7    2    1    0   0   1/1   100.0     0/0   0.0
Jordan Simmons          7    0    1    0   0   0/0     0.0     0/0   0.0

TEAM: FG: 11/19 (57.9%), 3PT: 0/5 (0.0%), REB: 9 (3 off, 6 def), AST: 4, TO: 4
TEAM FOULS: 8 [Team_046 in BONUS]


Team_046
--------------------------------------------------------------------------------
Player                MIN  PTS  REB  AST  TO      FG   FG%      3P   3P%
--------------------------------------------------------------------------------
Cade Wall              29   16    6    0   0   6/6   100.0     0/0   0.0
Kevin Allen            29    4    2    1   0   2/4    50.0     0/0   0.0
Paul DeRozan            7    3    0    0   0   1/1   100.0     0/0   0.0
Chris LaVine            7    3    0    0   0   1/1   100.0     0/0   0.0
Victor Nowitzki        29    2    0    1   0   1/3    33.3     0/0   0.0
D'Angelo O'Neal        29    2    0    0   0   1/2    50.0     0/0   0.0
Lauri Carter           29    0    3    1   0   0/1     0.0     0/0   0.0
Collin Butler           7    0    0    0   0   0/1     0.0     0/0   0.0

TEAM: FG: 12/19 (63.2%), 3PT: 3/6 (50.0%), REB: 11 (3 off, 8 def), AST: 3, TO: 4
TEAM FOULS: 5 [Team_077 in BONUS]

================================================================================

================================================================================
                       4TH QUARTER - Team_077 vs Team_046                       
================================================================================

[12:00] Team_077 possession (Score: 80-78)
Ja Ball attempts a 3Pt. Heavily contested by Lauri Carter (1.8 feet, ZONE)! Ja Ball misses. Offensive rebound by Draymond Dosunmu! Draymond Dosunmu kicks it out.

[11:44] Team_077 possession (Score: 80-78)
Chris Ginobili attempts a 3Pt. Contested by Lauri Carter (3.2 feet, MAN). Chris Ginobili misses. Rebound secured by Kevin Allen.

[11:32] Team_046 possession (Score: 80-78)
Kevin Allen attempts a 3Pt. Wide open! Dejounte Allen is 8.0 feet away. [ZONE] Kevin Allen misses. Rebound secured by Chris Ginobili.

[11:19] Team_077 possession (Score: 80-78)
Ja Ball attempts a 3Pt. Contested by Lauri Carter (5.5 feet, ZONE). Ja Ball misses. Rebound secured by Lauri Carter.

[11:05] Team_046 possession (Score: 80-78)
Lauri Carter attempts a 3Pt. Contested by Dejounte Allen (5.1 feet, ZONE). Lauri Carter misses. Rebound secured by Chris Ginobili.

[10:53] Team_077 possession (Score: 80-78)
Dejounte Allen drives and kicks out. Chris Ginobili attempts a 3Pt. Contested by Lauri Carter (4.1 feet, MAN). Chris Ginobili misses. Rebound secured by Cade Wall.

[10:39] Team_046 possession (Score: 80-78)
D'Angelo O'Neal attempts a Layup. Contested by Draymond Dosunmu (4.4 feet, ZONE). D'ANGELO O'NEAL MAKES IT! Assist: Victor Nowitzki
Score: 80-80

[10:23] Team_077 possession (Score: 80-80)
Russell Harden attempts a 3Pt. Wide open! Lauri Carter is 7.4 feet away. [ZONE] RUSSELL HARDEN MAKES IT! Assist: Draymond Dosunmu
Score: 83-80

[10:08] Team_046 possession (Score: 83-80)
D'Angelo O'Neal attempts a 3Pt. Contested by Ja Ball (4.6 feet, MAN). D'Angelo O'Neal misses. Rebound secured by Russell Harden.

[09:50] Team_077 possession (Score: 83-80)
Dejounte Allen attempts a 3Pt. Contested by Victor Nowitzki (5.8 feet, MAN). Dejounte Allen misses. Rebound secured by Cade Wall.

[09:38] Team_046 possession (Score: 83-80)
D'Angelo O'Neal throws a bad pass! Stolen by Ja Ball! TURNOVER! (live ball)

[09:27] Team_077 possession (Score: 83-80)
FOUL! Holding foul on Cade Wall. [Team fouls: 1] No free throws, side out. (Cade Wall: 1 personal fouls)

[09:08] Team_077 possession (Score: 83-80)
Draymond Dosunmu attempts a Layup. BLOCKED BY KEVIN ALLEN! Ball is loose! Rebound secured by Lauri Carter.

[08:52] Team_046 possession (Score: 83-80)
Kevin Allen attempts a Midrange. Wide open! Draymond Dosunmu is 6.9 feet away. [MAN] Kevin Allen misses. Offensive rebound by Lauri Carter! Lauri Carter kicks it out.

[08:38] Team_046 possession (Score: 83-80)
Cade Wall drives and kicks out. Kevin Allen attempts a Midrange. Heavily contested by Dejounte Allen (0.8 feet, ZONE)! Kevin Allen misses. Rebound secured by Russell Harden.

[08:23] Team_077 possession (Score: 83-80)
Dejounte Allen attempts a 3Pt. Contested by Lauri Carter (3.3 feet, ZONE). DEJOUNTE ALLEN MAKES IT! Assist: Ja Ball
Score: 86-80

[08:10] Team_046 possession (Score: 86-80)
FOUL! Shooting foul on Dejounte Allen. Victor Nowitzki to the line for 3 free throws. [Team fouls: 1] (Dejounte Allen: 1 personal fouls)   FT 1/3: GOOD   FT 2/3: GOOD   FT 3/3: GOOD Victor Nowitzki makes 3/3 from the line.
Score: 86-83

[07:58] Team_077 possession (Score: 86-83)
Russell Harden throws a bad pass out of bounds! TURNOVER! (dead ball)

[07:58] Substitution (Team_077): Ja Ball OUT → Bam Bryant IN (stamina_rule2)

[07:58] Substitution (Team_077): Dejounte Allen OUT → Dejounte Quickley IN (stamina_rule2)

[07:58] Substitution (Team_077): Chris Ginobili OUT → Tyler Poole IN (stamina_rule2)

[07:58] Substitution (Team_077): Russell Harden OUT → Jordan Simmons IN (stamina_rule2)

[07:58] Substitution (Team_077): Draymond Dosunmu OUT → Ayo Griffin IN (stamina_rule2)

[07:58] Substitution (Team_046): D'Angelo O'Neal OUT → Collin Butler IN (stamina_rule2)

[07:58] Substitution (Team_046): Victor Nowitzki OUT → Manu Dosunmu IN (stamina_rule2)

[07:58] Substitution (Team_046): Lauri Carter OUT → Josh Barrett IN (stamina_rule2)

[07:58] Substitution (Team_046): Cade Wall OUT → Chris LaVine IN (stamina_rule2)

[07:58] Substitution (Team_046): Kevin Allen OUT → Paul DeRozan IN (stamina_rule2)

[07:40] Team_046 possession (Score: 86-83)
Manu Dosunmu attempts a 3Pt. Contested by Dejounte Quickley (2.1 feet, ZONE). Manu Dosunmu misses. Rebound secured by Ayo Griffin.

[07:26] Team_077 possession (Score: 86-83)
Tyler Poole attempts a Midrange. Wide open! Manu Dosunmu is 10.0 feet away. [ZONE] TYLER POOLE MAKES IT!
Score: 88-83

[07:11] Team_046 possession (Score: 88-83)
Josh Barrett attempts a 3Pt. Contested by Tyler Poole (4.3 feet, MAN). JOSH BARRETT MAKES IT!
Score: 88-86

[06:56] Team_077 possession (Score: 88-86)
Bam Bryant attempts a 3Pt. Contested by Collin Butler (2.7 feet, ZONE). BAM BRYANT MAKES IT!
Score: 91-86

[06:40] Team_046 possession (Score: 91-86)
Collin Butler attempts a 3Pt. Wide open! Bam Bryant is 6.7 feet away. [MAN] Collin Butler misses. Rebound secured by Ayo Griffin.

[06:25] Team_077 possession (Score: 91-86)
Dejounte Quickley attempts a Layup. Heavily contested by Chris LaVine (1.0 feet, ZONE)! DEJOUNTE QUICKLEY MAKES IT!
Score: 93-86

[06:09] Team_046 possession (Score: 93-86)
Chris LaVine drives, Jordan Simmons stays with him. Chris LaVine attempts a Dunk. Contested by Jordan Simmons (2.8 feet, MAN). Chris LaVine misses. Offensive rebound by Chris LaVine! Chris LaVine kicks it out.

[05:54] Team_046 possession (Score: 93-86)
Josh Barrett attempts a 3Pt. Wide open! Jordan Simmons is 8.8 feet away. [ZONE] Josh Barrett misses. Offensive rebound by Paul DeRozan! Paul DeRozan puts it back in!
Score: 93-88

[05:39] Team_077 possession (Score: 93-88)
Bam Bryant attempts a 3Pt. Heavily contested by Manu Dosunmu (1.6 feet, ZONE)! Bam Bryant misses. Rebound secured by Chris LaVine.

[05:27] Team_046 possession (Score: 93-88)
Josh Barrett attempts a Midrange. Heavily contested by Tyler Poole (1.7 feet, MAN)! Josh Barrett misses. Offensive rebound by Paul DeRozan! Paul DeRozan puts it back in!
Score: 93-90

[05:14] Team_077 possession (Score: 93-90)
Dejounte Quickley attempts a 3Pt. Wide open! Manu Dosunmu is 8.9 feet away. [ZONE] Dejounte Quickley misses. Rebound secured by Paul DeRozan.

[04:59] Team_046 possession (Score: 93-90)
Josh Barrett drives, Tyler Poole stays with him. Josh Barrett attempts a Dunk. Contested by Tyler Poole (4.0 feet, MAN). JOSH BARRETT MAKES IT! Assist: Paul DeRozan
Score: 93-92

[04:46] Team_077 possession (Score: 93-92)
Dejounte Quickley attempts a 3Pt. Wide open! Collin Butler is 7.5 feet away. [ZONE] Dejounte Quickley misses. Rebound secured by Chris LaVine.

[04:36] Team_046 possession (Score: 93-92)
Collin Butler attempts a 3Pt. Contested by Dejounte Quickley (5.3 feet, ZONE). Collin Butler misses. Offensive rebound by Chris LaVine! Chris LaVine kicks it out.

[04:22] Team_046 possession (Score: 93-92)
Josh Barrett attempts a 3Pt. Wide open! Jordan Simmons is 6.8 feet away. [ZONE] JOSH BARRETT MAKES IT! Assist: Chris LaVine
Score: 93-95

[04:12] Team_077 possession (Score: 93-95)
Dejounte Quickley attempts a 3Pt. Contested by Collin Butler (5.9 feet, ZONE). Dejounte Quickley misses. Rebound secured by Paul DeRozan.

[03:55] Team_046 possession (Score: 93-95)
Paul DeRozan attempts a 3Pt. Wide open! Ayo Griffin is 6.4 feet away. [MAN] Paul DeRozan misses. Rebound secured by Tyler Poole.

[03:41] Team_077 possession (Score: 93-95)
Tyler Poole attempts a 3Pt. Wide open! Collin Butler is 6.5 feet away. [ZONE] TYLER POOLE MAKES IT! Assist: Dejounte Quickley
Score: 96-95

[03:29] Team_046 possession (Score: 96-95)
Josh Barrett attempts a Midrange. Wide open! Tyler Poole is 6.2 feet away. [MAN] Josh Barrett misses. Rebound secured by Ayo Griffin.

[03:11] Team_077 possession (Score: 96-95)
Ayo Griffin attempts a Layup. Contested by Chris LaVine (3.6 feet, MAN). AYO GRIFFIN MAKES IT! Assist: Bam Bryant
Score: 98-95

[02:55] Team_046 possession (Score: 98-95)
Collin Butler attempts a 3Pt. Wide open! Bam Bryant is 6.8 feet away. [MAN] COLLIN BUTLER MAKES IT! Assist: Josh Barrett
Score: 98-98

[02:41] Team_077 possession (Score: 98-98)
Jordan Simmons attempts a 3Pt. Contested by Collin Butler (4.7 feet, ZONE). JORDAN SIMMONS MAKES IT! Assist: Tyler Poole
Score: 101-98

[02:23] Team_046 possession (Score: 101-98)
Collin Butler attempts a 3Pt. Contested by Dejounte Quickley (5.4 feet, ZONE). Collin Butler misses. Rebound secured by Tyler Poole.

[02:08] Team_077 possession (Score: 101-98)
Ayo Griffin attempts a Layup. Contested by Chris LaVine (3.1 feet, MAN). AYO GRIFFIN MAKES IT! Assist: Dejounte Quickley
Score: 103-98

[01:49] Team_046 possession (Score: 103-98)
Josh Barrett attempts a 3Pt. Contested by Dejounte Quickley (2.3 feet, ZONE). Josh Barrett misses. Rebound secured by Ayo Griffin.

[01:37] Team_077 possession (Score: 103-98)
Dejounte Quickley attempts a 3Pt. Contested by Chris LaVine (3.8 feet, ZONE). Dejounte Quickley misses. FOUL! Loose ball foul on Manu Dosunmu during the rebound battle. [Team fouls: 2] No free throws, side out. (Manu Dosunmu: 1 personal fouls)

[01:20] Team_077 possession (Score: 103-98)
Jordan Simmons attempts a Layup. Contested by Chris LaVine (4.8 feet, MAN). JORDAN SIMMONS MAKES IT!
Score: 105-98

[01:04] Team_046 possession (Score: 105-98)
Josh Barrett attempts a 3Pt. Contested by Tyler Poole (5.6 feet, MAN). Josh Barrett misses. Offensive rebound by Chris LaVine! Chris LaVine kicks it out.

[00:49] Team_046 possession (Score: 105-98)
Collin Butler attempts a 3Pt. Contested by Bam Bryant (4.2 feet, MAN). COLLIN BUTLER MAKES IT! Assist: Manu Dosunmu
Score: 105-101

[00:38] Team_077 possession (Score: 105-101)
FOUL! Reach-in foul on Chris LaVine during the drive. [Team fouls: 3] No free throws, side out. (Chris LaVine: 1 personal fouls)

[00:22] Team_077 possession (Score: 105-101)
Dejounte Quickley attempts a Midrange. Heavily contested by Chris LaVine (1.9 feet, ZONE)! DEJOUNTE QUICKLEY MAKES IT!
Score: 107-101

[00:08] Team_046 possession (Score: 107-101)
Josh Barrett attempts a 3Pt. Wide open! Tyler Poole is 6.2 feet away. [MAN] JOSH BARRETT MAKES IT! Assist: Chris LaVine
Score: 107-104

================================================================================
                              4TH QUARTER COMPLETE                              
================================================================================

4TH QUARTER SCORE: Team_077 27, Team_046 26

BOX SCORE:
================================================================================

Team_077
--------------------------------------------------------------------------------
Player                MIN  PTS  REB  AST  TO      FG   FG%      3P   3P%
--------------------------------------------------------------------------------
Tyler Poole            15    5    2    1   0   2/2   100.0     0/0   0.0
Jordan Simmons         15    5    1    0   0   2/2   100.0     0/0   0.0
Ayo Griffin            15    4    4    0   0   2/2   100.0     0/0   0.0
Dejounte Quickley      15    4    0    2   0   2/5    40.0     0/0   0.0
Dejounte Allen         33    3    0    0   0   1/3    33.3     0/0   0.0
Russell Harden         33    3    2    0   0   1/1   100.0     0/0   0.0
Bam Bryant             20    3    0    1   0   1/2    50.0     0/0   0.0
Draymond Dosunmu       33    0    1    1   0   0/1     0.0     0/0   0.0
Chris Ginobili         33    0    2    0   0   0/1     0.0     0/0   0.0
Ja Ball                29    0    0    1   0   0/1     0.0     0/0   0.0

TEAM: FG: 11/20 (55.0%), 3PT: 5/12 (41.7%), REB: 12 (2 off, 10 def), AST: 6, TO: 1
TEAM FOULS: 1


Team_046
--------------------------------------------------------------------------------
Player                MIN  PTS  REB  AST  TO      FG   FG%      3P   3P%
--------------------------------------------------------------------------------
Josh Barrett           15   11    0    1   0   4/6    66.7     0/0   0.0
Collin Butler          15    6    0    0   0   2/4    50.0     0/0   0.0
Paul DeRozan           15    4    4    1   0   2/3    66.7     0/0   0.0
Victor Nowitzki        33    3    0    1   0   1/1   100.0     0/0   0.0
D'Angelo O'Neal        33    2    0    0   0   1/2    50.0     0/0   0.0
Kevin Allen            33    0    1    0   0   0/1     0.0     0/0   0.0
Lauri Carter           33    0    3    0   0   0/1     0.0     0/0   0.0
Cade Wall              33    0    2    0   0   0/1     0.0     0/0   0.0
Manu Dosunmu           15    0    0    1   0   0/1     0.0     0/0   0.0
Chris LaVine           15    0    5    2   0   0/0     0.0     0/0   0.0

TEAM: FG: 10/20 (50.0%), 3PT: 7/15 (46.7%), REB: 15 (6 off, 9 def), AST: 6, TO: 1
TEAM FOULS: 3

================================================================================

================================================================================
                               FULL GAME COMPLETE                               
================================================================================

FINAL SCORE: Team_077 107, Team_046 104

SCORING BY QUARTER:
--------------------------------------------------------------------------------
Team                     Q1     Q2     Q3     Q4    FINAL
--------------------------------------------------------------------------------
Team_077                 28     29     23     27      107
Team_046                 26     20     32     26      104
--------------------------------------------------------------------------------

FULL GAME BOX SCORE:
================================================================================

Team_077
--------------------------------------------------------------------------------
Player                MIN  PTS  REB  AST  TO      FG   FG%      3P   3P%      FT STL BLK
--------------------------------------------------------------------------------
Dejounte Allen         33   15    0    4   1   6/13   46.2   2/7    28.6   3/3     1   1
Chris Ginobili         33   18    6    3   1   8/15   53.3   2/8    25.0   4/4     1   1
Russell Harden         33   23    9    1   1   9/14   64.3   3/5    60.0   4/4     0   0
Draymond Dosunmu       33    8   14    7   0   4/7    57.1   0/0     0.0   0/0     0   0
Ja Ball                29    5    1    3   1   2/5    40.0   1/4    25.0   0/0     2   0
Bam Bryant             20    3    0    1   2   1/3    33.3   1/3    33.3   0/0     0   1
Dejounte Quickley      15    8    0    3   0   4/7    57.1   1/4    25.0   1/1     0   0
Tyler Poole            15   10    4    2   0   4/6    66.7   2/4    50.0   0/0     0   0
Jordan Simmons         15   11    5    0   1   5/5   100.0   1/1   100.0   2/2     0   2
Ayo Griffin            15    6    7    0   1   2/3    66.7   0/0     0.0   0/0     0   0

TEAM: FG: 45/78 (57.7%), 3PT: 13/36 (36.1%), REB: 46 (13 off, 33 def), AST: 24, TO: 8


Team_046
--------------------------------------------------------------------------------
Player                MIN  PTS  REB  AST  TO      FG   FG%      3P   3P%      FT STL BLK
--------------------------------------------------------------------------------
D'Angelo O'Neal        33    9    0    0   5   4/9    44.4   1/6    16.7   2/3     0   1
Victor Nowitzki        33   11    0    3   2   3/7    42.9   1/4    25.0   3/3     0   0
Lauri Carter           33    8   11    1   1   3/6    50.0   2/4    50.0   0/0     0   0
Cade Wall              33   21   15    4   2   8/9    88.9   2/2   100.0   3/3     0   0
Kevin Allen            33   14    7    3   1   7/14   50.0   0/2     0.0   5/6     0   2
Collin Butler          15    9    0    0   0   3/7    42.9   3/5    60.0   0/0     0   0
Manu Dosunmu           15    2    1    1   0   1/4    25.0   0/3     0.0   0/0     0   0
Josh Barrett           15   11    0    1   0   6/8    75.0   4/5    80.0   0/0     0   0
Chris LaVine           15    5    6    2   0   2/3    66.7   1/1   100.0   2/3     2   0
Paul DeRozan           15    9    6    2   0   1/6    16.7   0/2     0.0   2/5     1   0

TEAM: FG: 40/75 (53.3%), 3PT: 14/34 (41.2%), REB: 46 (13 off, 33 def), AST: 17, TO: 11

================================================================================
