================================================================================
                        FULL GAME - Team_077 vs Team_060                        
================================================================================

================================================================================
                       1ST QUARTER - Team_077 vs Team_060                       
================================================================================

[12:00] Team_077 possession (Score: 0-0)
Draymond Dosunmu attempts a Layup. Contested by Jaren George (5.1 feet, ZONE). DRAYMOND DOSUNMU MAKES IT!
Score: 2-0

[11:47] Team_060 possession (Score: 2-0)
Joel Morant makes the Midrange and draws the foul on Russell Harden! And-1! Joel Morant to the line for 1. [Team fouls: 1] (Russell Harden: 1 personal fouls)   FT 1/1: GOOD Joel Morant makes 1/1 from the line.
Score: 2-3

[11:31] Team_077 possession (Score: 2-3)
Ja Ball attempts a 3Pt. Contested by Julius Green (5.3 feet, ZONE). Ja Ball misses. Rebound secured by Larry Westbrook.

[11:17] Team_060 possession (Score: 2-3)
Jaren George drives and kicks out. Joel Morant attempts a Midrange. Contested by Chris Ginobili (5.6 feet, ZONE). Joel Morant misses. Offensive rebound by Immanuel Ming! Immanuel Ming kicks it out.

[11:03] Team_060 possession (Score: 2-3)
Immanuel Ming drives to the basket... Immanuel Ming loses the ball! Stripped by Draymond Dosunmu! TURNOVER! (live ball)

[10:43] Team_077 possession (Score: 2-3)
Draymond Dosunmu drives, Jaren George stays with him. Draymond Dosunmu attempts a Layup. Wide open! Jaren George is 6.2 feet away. [MAN] DRAYMOND DOSUNMU MAKES IT! Assist: Ja Ball
Score: 4-3

[10:29] Team_060 possession (Score: 4-3)
Larry Westbrook drives, picks up Draymond Dosunmu. Help arrives from Ja Ball! Larry Westbrook attempts a Dunk. Contested by Ja Ball (2.1 feet, ZONE). LARRY WESTBROOK MAKES IT!
Score: 4-5

[10:17] Team_077 possession (Score: 4-5)
Draymond Dosunmu drives to the basket... Draymond Dosunmu throws a bad pass out of bounds! TURNOVER! (dead ball)

[10:01] Team_060 possession (Score: 4-5)
Jaren George drives, picks up Draymond Dosunmu. Help arrives from Ja Ball! Jaren George attempts a Dunk. Heavily contested by Ja Ball (1.9 feet, ZONE)! Jaren George misses. Rebound secured by Russell Harden.

[09:44] Team_077 possession (Score: 4-5)
Chris Ginobili throws a bad pass out of bounds! TURNOVER! (dead ball)

[09:31] Team_060 possession (Score: 4-5)
Immanuel Ming drives, picks up Draymond Dosunmu. Help arrives from Ja Ball! Immanuel Ming attempts a Layup. Heavily contested by Ja Ball (1.5 feet, ZONE)! Immanuel Ming misses. Rebound secured by Russell Harden.

[09:19] Team_077 possession (Score: 4-5)
Russell Harden attempts a Layup. Contested by Jaren George (5.7 feet, ZONE). RUSSELL HARDEN MAKES IT! Assist: Draymond Dosunmu
Score: 6-5

[09:04] Team_060 possession (Score: 6-5)
Jaren George drives to the basket... Jaren George commits a violation (traveling/carry)! TURNOVER! (dead ball)

[08:46] Team_077 possession (Score: 6-5)
Russell Harden attempts a 3Pt. Contested by Larry Westbrook (4.4 feet, MAN). RUSSELL HARDEN MAKES IT! Assist: Ja Ball
Score: 9-5

[08:30] Team_060 possession (Score: 9-5)
Joel Morant attempts a Layup. BLOCKED BY JA BALL! Ball is loose! Offensive rebound by Jaren George! Jaren George kicks it out.

[08:12] Team_060 possession (Score: 9-5)
Jaren George drives and kicks out. Larry Westbrook attempts a 3Pt. Contested by Chris Ginobili (2.6 feet, ZONE). LARRY WESTBROOK MAKES IT! Assist: Joel Morant
Score: 9-8

[07:58] Team_077 possession (Score: 9-8)
FOUL! Offensive foul on Russell Harden! Larry Westbrook drew the charge! [Team fouls: 2] (Russell Harden: 2 personal fouls) TURNOVER! (dead ball)

[07:45] Team_060 possession (Score: 9-8)
Larry Westbrook attempts a Layup. Contested by Russell Harden (4.4 feet, MAN). LARRY WESTBROOK MAKES IT! Assist: Joel Morant
Score: 9-10

[07:31] Team_077 possession (Score: 9-10)
Dejounte Allen attempts a Layup. Contested by Jaren George (2.1 feet, ZONE). Dejounte Allen misses. FOUL! Loose ball foul on Jaren George during the rebound battle. [Team fouls: 1] No free throws, side out. (Jaren George: 1 personal fouls)

[07:15] Team_077 possession (Score: 9-10)
FOUL! Shooting foul on Jaren George. Draymond Dosunmu to the line for 2 free throws. [Team fouls: 2] (Jaren George: 2 personal fouls)   FT 1/2: GOOD   FT 2/2: GOOD Draymond Dosunmu makes 2/2 from the line.
Score: 11-10

[07:02] Team_060 possession (Score: 11-10)
FOUL! Holding foul on Chris Ginobili. [Team fouls: 3] No free throws, side out. (Chris Ginobili: 1 personal fouls)

[06:46] Team_060 possession (Score: 11-10)
Larry Westbrook drives, Russell Harden stays with him. Larry Westbrook attempts a Layup. Contested by Russell Harden (4.6 feet, ZONE). LARRY WESTBROOK MAKES IT! Assist: Jaren George
Score: 11-12

[06:28] Team_077 possession (Score: 11-12)
Chris Ginobili makes the Layup and draws the foul on Immanuel Ming! And-1! Chris Ginobili to the line for 1. [Team fouls: 3] (Immanuel Ming: 1 personal fouls)   FT 1/1: GOOD Chris Ginobili makes 1/1 from the line.
Score: 14-12

[06:16] Team_060 possession (Score: 14-12)
FOUL! Shooting foul on Draymond Dosunmu. Jaren George to the line for 2 free throws. [Team fouls: 4] (Draymond Dosunmu: 1 personal fouls)   FT 1/2: GOOD   FT 2/2: GOOD Jaren George makes 2/2 from the line.
Score: 14-14

[06:03] Team_077 possession (Score: 14-14)
Draymond Dosunmu drives and kicks out. Chris Ginobili attempts a Midrange. Contested by Immanuel Ming (3.9 feet, MAN). CHRIS GINOBILI MAKES IT!
Score: 16-14

[05:46] Team_060 possession (Score: 16-14)
Immanuel Ming attempts a 3Pt. Contested by Dejounte Allen (3.1 feet, ZONE). Immanuel Ming misses. Offensive rebound by Immanuel Ming! Immanuel Ming kicks it out.

[05:29] Team_060 possession (Score: 16-14)
Joel Morant makes the Midrange and draws the foul on Chris Ginobili! And-1! Joel Morant to the line for 1. [BONUS: 5 team fouls] (Chris Ginobili: 2 personal fouls)   FT 1/1: GOOD Joel Morant makes 1/1 from the line.
Score: 16-17

[05:16] Team_077 possession (Score: 16-17)
Russell Harden attempts a Midrange. Contested by Larry Westbrook (3.9 feet, ZONE). Russell Harden misses. Rebound secured by Jaren George.

[05:01] Team_060 possession (Score: 16-17)
FOUL! Holding foul on Draymond Dosunmu. [IN THE BONUS! 6 team fouls] Jaren George to the line for 2 free throws. (Draymond Dosunmu: 2 personal fouls)   FT 1/2: GOOD   FT 2/2: GOOD Jaren George makes 2/2 from the line.
Score: 16-19

[04:45] Team_077 possession (Score: 16-19)
Chris Ginobili attempts a 3Pt. Contested by Julius Green (4.8 feet, ZONE). Chris Ginobili misses. Rebound secured by Jaren George.

[04:29] Team_060 possession (Score: 16-19)
FOUL! Shooting foul on Draymond Dosunmu. Julius Green to the line for 2 free throws. [BONUS: 7 team fouls] (Draymond Dosunmu: 3 personal fouls)   FT 1/2: GOOD   FT 2/2: GOOD Julius Green makes 2/2 from the line.
Score: 16-21

[04:19] Team_077 possession (Score: 16-21)
Draymond Dosunmu attempts a Layup. Contested by Jaren George (3.0 feet, ZONE). DRAYMOND DOSUNMU MAKES IT! Assist: Russell Harden
Score: 18-21

[04:01] Team_060 possession (Score: 18-21)
Julius Green drives and kicks out. Jaren George attempts a 3Pt. Heavily contested by Dejounte Allen (1.5 feet, ZONE)! Jaren George misses. Rebound secured by Draymond Dosunmu.

[03:44] Team_077 possession (Score: 18-21)
Draymond Dosunmu attempts a Midrange. Contested by Jaren George (4.1 feet, MAN). Draymond Dosunmu misses. Rebound secured by Immanuel Ming.

[03:32] Team_060 possession (Score: 18-21)
Julius Green attempts a 3Pt. Contested by Dejounte Allen (4.6 feet, MAN). JULIUS GREEN MAKES IT! Assist: Jaren George
Score: 18-24

[03:19] Team_077 possession (Score: 18-24)
Ja Ball attempts a 3Pt. Contested by Julius Green (4.2 feet, ZONE). Ja Ball misses. Offensive rebound by Draymond Dosunmu! Draymond Dosunmu kicks it out.

[03:04] Team_077 possession (Score: 18-24)
Russell Harden makes the Dunk and draws the foul on Jaren George! And-1! Russell Harden to the line for 1. [Team fouls: 4] (Jaren George: 3 personal fouls)   FT 1/1: GOOD Russell Harden makes 1/1 from the line.
Score: 21-24

[02:49] Team_060 possession (Score: 21-24)
Immanuel Ming drives and kicks out. Joel Morant attempts a 3Pt. Contested by Dejounte Allen (2.9 feet, ZONE). Joel Morant misses. Rebound secured by Draymond Dosunmu.

[02:33] Team_077 possession (Score: 21-24)
Chris Ginobili makes the Layup and draws the foul on Jaren George! And-1! Chris Ginobili to the line for 1. [BONUS: 5 team fouls] (Jaren George: 4 personal fouls)   FT 1/1: GOOD Chris Ginobili makes 1/1 from the line.
Score: 24-24

[02:20] Team_060 possession (Score: 24-24)
Larry Westbrook attempts a Layup. Wide open! Draymond Dosunmu is 6.2 feet away. [ZONE] Larry Westbrook misses. Rebound secured by Chris Ginobili.

[02:04] Team_077 possession (Score: 24-24)
Dejounte Allen drives, Jaren George stays with him. Dejounte Allen attempts a Dunk. Contested by Jaren George (5.5 feet, ZONE). DEJOUNTE ALLEN MAKES IT! Assist: Chris Ginobili
Score: 26-24

[01:48] Team_060 possession (Score: 26-24)
Julius Green attempts a 3Pt. Contested by Dejounte Allen (4.6 feet, ZONE). Julius Green misses. Rebound secured by Draymond Dosunmu.

[01:31] Team_077 possession (Score: 26-24)
Chris Ginobili attempts a 3Pt. Contested by Immanuel Ming (4.7 feet, MAN). Chris Ginobili misses. Rebound secured by Larry Westbrook.

[01:16] Team_060 possession (Score: 26-24)
Immanuel Ming drives and kicks out. Larry Westbrook attempts a 3Pt. Contested by Dejounte Allen (2.7 feet, ZONE). LARRY WESTBROOK MAKES IT! Assist: Immanuel Ming
Score: 26-27

[01:02] Team_077 possession (Score: 26-27)
Dejounte Allen attempts a 3Pt. Contested by Julius Green (4.6 feet, ZONE). Dejounte Allen misses. Rebound secured by Immanuel Ming.

[00:49] Team_060 possession (Score: 26-27)
FOUL! Shooting foul on Draymond Dosunmu. Jaren George to the line for 2 free throws. [BONUS: 8 team fouls] (Draymond Dosunmu: 4 personal fouls)   FT 1/2: GOOD   FT 2/2: GOOD Jaren George makes 2/2 from the line.
Score: 26-29

[00:34] Team_077 possession (Score: 26-29)
Dejounte Allen attempts a 3Pt. Contested by Julius Green (5.6 feet, ZONE). DEJOUNTE ALLEN MAKES IT! Assist: Ja Ball
Score: 29-29

[00:23] Team_060 possession (Score: 29-29)
Immanuel Ming attempts a Layup. BLOCKED BY CHRIS GINOBILI! Ball goes out off Chris Ginobili. Immanuel Ming's ball!

[00:08] Team_060 possession (Score: 29-29)
Joel Morant attempts a 3Pt. Contested by Ja Ball (4.8 feet, MAN). Joel Morant misses. Rebound secured by Russell Harden.

================================================================================
                              1ST QUARTER COMPLETE                              
================================================================================

1ST QUARTER SCORE: Team_077 29, Team_060 29

BOX SCORE:
================================================================================

Team_077
--------------------------------------------------------------------------------
Player                MIN  PTS  REB  AST  TO      FG   FG%      3P   3P%
--------------------------------------------------------------------------------
Draymond Dosunmu       12    8    4    1   0   4/5    80.0     0/0   0.0
Russell Harden         12    8    4    1   0   3/4    75.0     0/0   0.0
Chris Ginobili         12    8    1    1   0   3/5    60.0     0/0   0.0
Dejounte Allen         12    5    0    0   0   2/3    66.7     0/0   0.0
Ja Ball                12    0    0    3   0   0/1     0.0     0/0   0.0

TEAM: FG: 12/18 (66.7%), 3PT: 2/6 (33.3%), REB: 9 (2 off, 7 def), AST: 6, TO: 3
TEAM FOULS: 8 [Team_060 in BONUS]


Team_060
--------------------------------------------------------------------------------
Player                MIN  PTS  REB  AST  TO      FG   FG%      3P   3P%
--------------------------------------------------------------------------------
Larry Westbrook        12   12    2    0   0   5/6    83.3     0/0   0.0
Joel Morant            12    6    0    2   0   2/3    66.7     0/0   0.0
Jaren George           12    6    3    2   0   3/4    75.0     0/0   0.0
Julius Green           12    5    0    0   0   2/4    50.0     0/0   0.0
Immanuel Ming          12    0    4    1   0   0/2     0.0     0/0   0.0

TEAM: FG: 12/19 (63.2%), 3PT: 1/3 (33.3%), REB: 9 (3 off, 6 def), AST: 5, TO: 2
TEAM FOULS: 5 [Team_077 in BONUS]

================================================================================

================================================================================
                       2ND QUARTER - Team_077 vs Team_060                       
================================================================================

[12:00] Substitution (Team_077): Chris Ginobili OUT → Tyler Poole IN (stamina_rule2)

[12:00] Substitution (Team_077): Russell Harden OUT → Jordan Simmons IN (stamina_rule2)

[12:00] Substitution (Team_060): Joel Morant OUT → Domantas Barnes IN (stamina_rule2)

[12:00] Substitution (Team_060): Julius Green OUT → Rudy Ginobili IN (stamina_rule2)

[12:00] Substitution (Team_060): Larry Westbrook OUT → Yao Tatum IN (stamina_rule2)

[12:00] Substitution (Team_060): Jaren George OUT → Klay Haliburton IN (stamina_rule2)

[12:00] Team_077 possession (Score: 29-29)
Dejounte Allen throws a bad pass out of bounds! TURNOVER! (dead ball)

[11:43] Team_060 possession (Score: 29-29)
Domantas Barnes drives, Draymond Dosunmu stays with him. Domantas Barnes attempts a Dunk. Wide open! Draymond Dosunmu is 6.0 feet away. [ZONE] DOMANTAS BARNES MAKES IT! Assist: Yao Tatum
Score: 29-31

[11:29] Team_077 possession (Score: 29-31)
Tyler Poole drives and kicks out. Jordan Simmons attempts a 3Pt. Wide open! Yao Tatum is 7.8 feet away. [MAN] Jordan Simmons misses. Rebound secured by Immanuel Ming.

[11:17] Team_060 possession (Score: 29-31)
Immanuel Ming attempts a Midrange. Wide open! Tyler Poole is 6.4 feet away. [MAN] IMMANUEL MING MAKES IT!
Score: 29-33

[11:08] Team_077 possession (Score: 29-33)
Tyler Poole attempts a 3Pt. Contested by Immanuel Ming (3.3 feet, MAN). Tyler Poole misses. Rebound secured by Immanuel Ming.

[10:57] Team_060 possession (Score: 29-33)
Yao Tatum attempts a Layup. Contested by Jordan Simmons (4.0 feet, MAN). Yao Tatum misses. FOUL! Loose ball foul on Jordan Simmons during the rebound battle. [Team fouls: 1] No free throws, side out. (Jordan Simmons: 1 personal fouls)

[10:42] Team_060 possession (Score: 29-33)
Immanuel Ming attempts a 3Pt. Heavily contested by Tyler Poole (1.0 feet, MAN)! Immanuel Ming misses. Rebound secured by Jordan Simmons.

[10:27] Team_077 possession (Score: 29-33)
Draymond Dosunmu drives to the basket... Draymond Dosunmu commits a violation (traveling/carry)! TURNOVER! (dead ball)

[10:27] Substitution (Team_077): Ja Ball OUT → Bam Bryant IN (stamina_rule2)

[10:27] Substitution (Team_077): Dejounte Allen OUT → Dejounte Quickley IN (stamina_rule2)

[10:27] Substitution (Team_077): Draymond Dosunmu OUT → Ayo Griffin IN (stamina_rule2)

[10:27] Substitution (Team_060): Immanuel Ming OUT → Jarrett Wagner IN (stamina_rule2)

[10:11] Team_060 possession (Score: 29-33)
Jarrett Wagner attempts a 3Pt. Contested by Tyler Poole (5.2 feet, MAN). Jarrett Wagner misses. Rebound secured by Jordan Simmons.

[09:57] Team_077 possession (Score: 29-33)
Bam Bryant attempts a Midrange. Wide open! Rudy Ginobili is 6.4 feet away. [ZONE] Bam Bryant misses. Rebound secured by Rudy Ginobili.

[09:44] Team_060 possession (Score: 29-33)
Jarrett Wagner drives to the basket... Jarrett Wagner loses control! Ball rolls out of bounds! TURNOVER! (dead ball)

[09:30] Team_077 possession (Score: 29-33)
Bam Bryant attempts a Midrange. BLOCKED BY RUDY GINOBILI! Ball is loose! Rebound secured by Rudy Ginobili.

[09:13] Team_060 possession (Score: 29-33)
Rudy Ginobili attempts a Layup. Contested by Dejounte Quickley (2.5 feet, MAN). RUDY GINOBILI MAKES IT! Assist: Klay Haliburton
Score: 29-35

[08:56] Team_077 possession (Score: 29-35)
Bam Bryant attempts a 3Pt. Contested by Domantas Barnes (5.3 feet, ZONE). Bam Bryant misses. Rebound secured by Klay Haliburton.

[08:40] Team_060 possession (Score: 29-35)
FOUL! Holding foul on Dejounte Quickley. [Team fouls: 2] No free throws, side out. (Dejounte Quickley: 1 personal fouls)

[08:28] Team_060 possession (Score: 29-35)
Yao Tatum attempts a Layup. Heavily contested by Jordan Simmons (0.5 feet, ZONE)! YAO TATUM MAKES IT! Assist: Klay Haliburton
Score: 29-37

[08:14] Team_077 possession (Score: 29-37)
Jordan Simmons attempts a Midrange. Contested by Yao Tatum (4.5 feet, MAN). JORDAN SIMMONS MAKES IT!
Score: 31-37

[07:59] Team_060 possession (Score: 31-37)
Rudy Ginobili attempts a Midrange. Wide open! Dejounte Quickley is 7.0 feet away. [ZONE] RUDY GINOBILI MAKES IT! Assist: Klay Haliburton
Score: 31-39

[07:44] Team_077 possession (Score: 31-39)
Ayo Griffin throws a bad pass! Stolen by Klay Haliburton! TURNOVER! (live ball)

[07:30] Team_060 possession (Score: 31-39)
Klay Haliburton attempts a Layup. Wide open! Ayo Griffin is 6.5 feet away. [MAN] KLAY HALIBURTON MAKES IT! Assist: Jarrett Wagner
Score: 31-41

[07:14] Team_077 possession (Score: 31-41)
FOUL! Shooting foul on Domantas Barnes. Ayo Griffin to the line for 2 free throws. [Team fouls: 1] (Domantas Barnes: 1 personal fouls)   FT 1/2: GOOD   FT 2/2: GOOD Ayo Griffin makes 2/2 from the line.
Score: 33-41

[07:00] Team_060 possession (Score: 33-41)
Rudy Ginobili drives, Dejounte Quickley stays with him. Rudy Ginobili attempts a Dunk. Contested by Dejounte Quickley (2.6 feet, MAN). Rudy Ginobili misses. Rebound secured by Ayo Griffin.

[06:47] Team_077 possession (Score: 33-41)
FOUL! Offensive foul on Ayo Griffin! Klay Haliburton drew the charge! [Team fouls: 3] (Ayo Griffin: 1 personal fouls) TURNOVER! (dead ball)

[06:31] Team_060 possession (Score: 33-41)
Domantas Barnes makes the Dunk and draws the foul on Tyler Poole! And-1! Domantas Barnes to the line for 1. [Team fouls: 4] (Tyler Poole: 1 personal fouls)   FT 1/1: GOOD Domantas Barnes makes 1/1 from the line.
Score: 33-44

[06:19] Team_077 possession (Score: 33-44)
Tyler Poole attempts a Layup. BLOCKED BY DOMANTAS BARNES! Ball is loose! Rebound secured by Klay Haliburton.

[06:06] Team_060 possession (Score: 33-44)
Klay Haliburton attempts a Layup. Contested by Ayo Griffin (4.7 feet, MAN). Klay Haliburton misses. Rebound secured by Tyler Poole.

[05:49] Team_077 possession (Score: 33-44)
Tyler Poole attempts a 3Pt. Contested by Domantas Barnes (5.1 feet, ZONE). Tyler Poole misses. Offensive rebound by Ayo Griffin! Ayo Griffin puts it back in!
Score: 35-44

[05:32] Team_060 possession (Score: 35-44)
Domantas Barnes commits a violation (traveling/carry)! TURNOVER! (dead ball)

[05:15] Team_077 possession (Score: 35-44)
Ayo Griffin drives to the basket... Ayo Griffin throws a bad pass! Stolen by Klay Haliburton! TURNOVER! (live ball)

[04:56] Team_060 possession (Score: 35-44)
Rudy Ginobili attempts a 3Pt. BLOCKED BY DEJOUNTE QUICKLEY! Ball deflects out of bounds off Rudy Ginobili.

[04:39] Team_077 possession (Score: 35-44)
Tyler Poole drives and kicks out. Bam Bryant attempts a 3Pt. Contested by Domantas Barnes (4.0 feet, MAN). BAM BRYANT MAKES IT! Assist: Tyler Poole
Score: 38-44

[04:28] Team_060 possession (Score: 38-44)
Jarrett Wagner attempts a 3Pt. Contested by Tyler Poole (2.8 feet, MAN). Jarrett Wagner misses. Rebound secured by Ayo Griffin.

[04:09] Team_077 possession (Score: 38-44)
Ayo Griffin loses the ball! Stripped by Klay Haliburton! TURNOVER! (live ball)

[03:53] Team_060 possession (Score: 38-44)
Rudy Ginobili attempts a Midrange. Contested by Tyler Poole (4.8 feet, ZONE). Rudy Ginobili misses. Rebound secured by Tyler Poole.

[03:35] Team_077 possession (Score: 38-44)
Dejounte Quickley attempts a 3Pt. Contested by Rudy Ginobili (4.4 feet, MAN). DEJOUNTE QUICKLEY MAKES IT! Assist: Bam Bryant
Score: 41-44

[03:24] Team_060 possession (Score: 41-44)
Rudy Ginobili drives to the basket... Rudy Ginobili commits a violation (traveling/carry)! TURNOVER! (dead ball)

[03:10] Team_077 possession (Score: 41-44)
Bam Bryant drives and kicks out. Tyler Poole attempts a 3Pt. Contested by Jarrett Wagner (4.8 feet, MAN). Tyler Poole misses. Rebound secured by Rudy Ginobili.

[02:54] Team_060 possession (Score: 41-44)
Yao Tatum attempts a 3Pt. Heavily contested by Jordan Simmons (0.6 feet, MAN)! Yao Tatum misses. Rebound secured by Tyler Poole.

[02:38] Team_077 possession (Score: 41-44)
Jordan Simmons attempts a Midrange. Wide open! Yao Tatum is 6.6 feet away. [ZONE] JORDAN SIMMONS MAKES IT!
Score: 43-44

[02:23] Team_060 possession (Score: 43-44)
FOUL! Shooting foul on Jordan Simmons. Yao Tatum to the line for 2 free throws. [BONUS: 5 team fouls] (Jordan Simmons: 2 personal fouls)   FT 1/2: MISS   FT 2/2: GOOD Yao Tatum makes 1/2 from the line.
Score: 43-45

[02:11] Team_077 possession (Score: 43-45)
Dejounte Quickley throws a bad pass out of bounds! TURNOVER! (dead ball)

[01:58] Team_060 possession (Score: 43-45)
Yao Tatum attempts a Midrange. Contested by Jordan Simmons (3.4 feet, ZONE). Yao Tatum misses. FOUL! Loose ball foul on Jordan Simmons during the rebound battle. [IN THE BONUS! 6 team fouls] Klay Haliburton to the line for 2 free throws. (Jordan Simmons: 3 personal fouls)   FT 1/2: MISS   FT 2/2: GOOD Klay Haliburton makes 1/2 from the line.
Score: 43-46

[01:47] Team_077 possession (Score: 43-46)
Ayo Griffin drives, Klay Haliburton stays with him. Ayo Griffin attempts a Layup. Heavily contested by Klay Haliburton (1.9 feet, ZONE)! AYO GRIFFIN MAKES IT!
Score: 45-46

[01:33] Team_060 possession (Score: 45-46)
Klay Haliburton drives, Ayo Griffin stays with him. Klay Haliburton attempts a Layup. Contested by Ayo Griffin (3.0 feet, MAN). Klay Haliburton misses. Rebound secured by Jordan Simmons.

[01:16] Team_077 possession (Score: 45-46)
Tyler Poole attempts a 3Pt. Wide open! Domantas Barnes is 8.0 feet away. [ZONE] Tyler Poole misses. Offensive rebound by Jordan Simmons! Jordan Simmons kicks it out.

[01:02] Team_077 possession (Score: 45-46)
Tyler Poole attempts a 3Pt. Contested by Jarrett Wagner (4.0 feet, MAN). Tyler Poole misses. Rebound secured by Klay Haliburton.

[00:48] Team_060 possession (Score: 45-46)
Jarrett Wagner attempts a Midrange. Wide open! Dejounte Quickley is 9.1 feet away. [ZONE] Jarrett Wagner misses. Rebound secured by Tyler Poole.

[00:35] Team_077 possession (Score: 45-46)
Bam Bryant attempts a 3Pt. Heavily contested by Domantas Barnes (1.7 feet, ZONE)! Bam Bryant misses. Offensive rebound by Jordan Simmons! Jordan Simmons kicks it out.

[00:22] Team_077 possession (Score: 45-46)
Jordan Simmons attempts a Layup. Contested by Klay Haliburton (4.1 feet, ZONE). JORDAN SIMMONS MAKES IT!
Score: 47-46

[00:09] Team_060 possession (Score: 47-46)
Klay Haliburton drives, Ayo Griffin stays with him. Klay Haliburton attempts a Layup. Contested by Ayo Griffin (5.6 feet, MAN). Klay Haliburton misses. Offensive rebound by Klay Haliburton! Klay Haliburton puts it back in!
Score: 47-48

================================================================================
                              2ND QUARTER COMPLETE                              
================================================================================

2ND QUARTER SCORE: Team_077 18, Team_060 19

BOX SCORE:
================================================================================

Team_077
--------------------------------------------------------------------------------
Player                MIN  PTS  REB  AST  TO      FG   FG%      3P   3P%
--------------------------------------------------------------------------------
Jordan Simmons         12    6    5    0   0   3/3   100.0     0/0   0.0
Ayo Griffin            10    6    3    0   0   3/3   100.0     0/0   0.0
Bam Bryant             10    3    0    1   0   1/5    20.0     0/0   0.0
Dejounte Quickley      10    3    0    0   0   1/1   100.0     0/0   0.0
Tyler Poole            12    0    4    1   0   0/4     0.0     0/0   0.0

TEAM: FG: 8/16 (50.0%), 3PT: 2/5 (40.0%), REB: 12 (3 off, 9 def), AST: 2, TO: 7
TEAM FOULS: 6 [Team_060 in BONUS]


Team_060
--------------------------------------------------------------------------------
Player                MIN  PTS  REB  AST  TO      FG   FG%      3P   3P%
--------------------------------------------------------------------------------
Domantas Barnes        12    5    0    0   0   2/2   100.0     0/0   0.0
Klay Haliburton        12    5    5    3   0   3/5    60.0     0/0   0.0
Rudy Ginobili          12    4    3    0   0   2/5    40.0     0/0   0.0
Yao Tatum              12    3    0    1   0   2/3    66.7     0/0   0.0
Immanuel Ming          14    2    2    0   0   1/2    50.0     0/0   0.0
Jarrett Wagner         10    0    0    1   0   0/3     0.0     0/0   0.0

TEAM: FG: 10/20 (50.0%), 3PT: 0/5 (0.0%), REB: 10 (2 off, 8 def), AST: 5, TO: 3
TEAM FOULS: 1

================================================================================

================================================================================
                       3RD QUARTER - Team_077 vs Team_060                       
================================================================================

[12:00] Team_077 possession (Score: 47-48)
Russell Harden drives to the basket... Russell Harden throws a bad pass! Stolen by Larry Westbrook! TURNOVER! (live ball)

[11:44] Team_060 possession (Score: 47-48)
Julius Green makes the Dunk and draws the foul on Ja Ball! And-1! Julius Green to the line for 1. [Team fouls: 1] (Ja Ball: 1 personal fouls)   FT 1/1: GOOD Julius Green makes 1/1 from the line.
Score: 47-51

[11:26] Team_077 possession (Score: 47-51)
Russell Harden attempts a Layup. Contested by Larry Westbrook (5.3 feet, MAN). RUSSELL HARDEN MAKES IT! Assist: Dejounte Allen
Score: 49-51

[11:10] Team_060 possession (Score: 49-51)
FOUL! Reach-in foul on Draymond Dosunmu during the drive. [Team fouls: 2] No free throws, side out. (Draymond Dosunmu: 1 personal fouls)

[10:55] Team_060 possession (Score: 49-51)
Larry Westbrook drives, Draymond Dosunmu stays with him. Larry Westbrook attempts a Dunk. Heavily contested by Draymond Dosunmu (2.0 feet, ZONE)! Larry Westbrook misses. Rebound secured by Chris Ginobili.

[10:43] Team_077 possession (Score: 49-51)
Draymond Dosunmu attempts a 3Pt. Wide open! Jaren George is 6.2 feet away. [MAN] Draymond Dosunmu misses. FOUL! Loose ball foul on Larry Westbrook during the rebound battle. [Team fouls: 1] No free throws, side out. (Larry Westbrook: 1 personal fouls)

[10:26] Team_077 possession (Score: 49-51)
Chris Ginobili drives, Jaren George stays with him. Chris Ginobili attempts a Layup. Contested by Jaren George (5.5 feet, ZONE). CHRIS GINOBILI MAKES IT!
Score: 51-51

[10:13] Team_060 possession (Score: 51-51)
Joel Morant attempts a Midrange. Contested by Chris Ginobili (2.0 feet, ZONE). Joel Morant misses. Offensive rebound by Immanuel Ming! Immanuel Ming kicks it out.

[09:58] Team_060 possession (Score: 51-51)
Jaren George drives and kicks out. Immanuel Ming attempts a 3Pt. Wide open! Chris Ginobili is 6.3 feet away. [MAN] IMMANUEL MING MAKES IT! Assist: Jaren George
Score: 51-54

[09:46] Team_077 possession (Score: 51-54)
FOUL! Shooting foul on Julius Green. Dejounte Allen to the line for 3 free throws. [Team fouls: 2] (Julius Green: 1 personal fouls)   FT 1/3: MISS   FT 2/3: GOOD   FT 3/3: GOOD Dejounte Allen makes 2/3 from the line.
Score: 53-54

[09:27] Team_060 possession (Score: 53-54)
Larry Westbrook attempts a Midrange. Wide open! Russell Harden is 7.7 feet away. [ZONE] Larry Westbrook misses. Rebound secured by Russell Harden.

[09:15] Team_077 possession (Score: 53-54)
Ja Ball attempts a 3Pt. Contested by Joel Morant (3.7 feet, MAN). Ja Ball misses. Rebound secured by Jaren George.

[08:59] Team_060 possession (Score: 53-54)
FOUL! Holding foul on Dejounte Allen. [Team fouls: 3] No free throws, side out. (Dejounte Allen: 1 personal fouls)

[08:47] Team_060 possession (Score: 53-54)
Julius Green drives, picks up Dejounte Allen. Help arrives from Chris Ginobili! Julius Green attempts a Dunk. Heavily contested by Chris Ginobili (0.5 feet, MAN)! JULIUS GREEN MAKES IT! Assist: Jaren George
Score: 53-56

[08:34] Team_077 possession (Score: 53-56)
Dejounte Allen attempts a Layup. Contested by Julius Green (3.2 feet, MAN). DEJOUNTE ALLEN MAKES IT! Assist: Chris Ginobili
Score: 55-56

[08:25] Team_060 possession (Score: 55-56)
Julius Green attempts a 3Pt. Contested by Dejounte Allen (5.7 feet, MAN). JULIUS GREEN MAKES IT! Assist: Jaren George
Score: 55-59

[08:07] Team_077 possession (Score: 55-59)
Russell Harden attempts a Midrange. Contested by Immanuel Ming (3.6 feet, ZONE). Russell Harden misses. FOUL! Loose ball foul on Larry Westbrook during the rebound battle. [Team fouls: 3] No free throws, side out. (Larry Westbrook: 2 personal fouls)

[07:52] Team_077 possession (Score: 55-59)
Russell Harden makes the Layup and draws the foul on Jaren George! And-1! Russell Harden to the line for 1. [Team fouls: 4] (Jaren George: 1 personal fouls)   FT 1/1: GOOD Russell Harden makes 1/1 from the line.
Score: 58-59

[07:35] Team_060 possession (Score: 58-59)
Immanuel Ming makes the Layup and draws the foul on Chris Ginobili! And-1! Immanuel Ming to the line for 1. [Team fouls: 4] (Chris Ginobili: 1 personal fouls)   FT 1/1: GOOD Immanuel Ming makes 1/1 from the line.
Score: 58-62

[07:19] Team_077 possession (Score: 58-62)
Ja Ball attempts a 3Pt. Wide open! Julius Green is 7.3 feet away. [ZONE] Ja Ball misses. Offensive rebound by Russell Harden! Russell Harden kicks it out.

[07:00] Team_077 possession (Score: 58-62)
Draymond Dosunmu attempts a Layup. Wide open! Jaren George is 6.3 feet away. [MAN] DRAYMOND DOSUNMU MAKES IT! Assist: Russell Harden
Score: 60-62

[06:46] Team_060 possession (Score: 60-62)
Immanuel Ming attempts a 3Pt. Wide open! Dejounte Allen is 6.3 feet away. [ZONE] Immanuel Ming misses. Rebound secured by Draymond Dosunmu.

[06:28] Team_077 possession (Score: 60-62)
Draymond Dosunmu attempts a Layup. Heavily contested by Larry Westbrook (1.8 feet, ZONE)! Draymond Dosunmu misses. Rebound secured by Larry Westbrook.

[06:12] Team_060 possession (Score: 60-62)
Julius Green drives, picks up Dejounte Allen. Help arrives from Chris Ginobili! Julius Green attempts a Layup. Contested by Chris Ginobili (3.1 feet, MAN). JULIUS GREEN MAKES IT! Assist: Immanuel Ming
Score: 60-64

[06:01] Team_077 possession (Score: 60-64)
Russell Harden attempts a Midrange. Wide open! Larry Westbrook is 6.2 feet away. [MAN] RUSSELL HARDEN MAKES IT! Assist: Ja Ball
Score: 62-64

[05:51] Team_060 possession (Score: 62-64)
Immanuel Ming attempts a 3Pt. Contested by Dejounte Allen (2.3 feet, ZONE). Immanuel Ming misses. FOUL! Loose ball foul on Chris Ginobili during the rebound battle. [IN THE BONUS! 5 team fouls] Jaren George to the line for 2 free throws. (Chris Ginobili: 2 personal fouls)   FT 1/2: MISS   FT 2/2: MISS Jaren George makes 0/2 from the line. Rebound secured by Russell Harden.

[05:38] Team_077 possession (Score: 62-64)
Chris Ginobili drives, picks up Immanuel Ming. Help arrives from Julius Green! Chris Ginobili attempts a Layup. Contested by Julius Green (3.7 feet, MAN). CHRIS GINOBILI MAKES IT!
Score: 64-64

[05:26] Team_060 possession (Score: 64-64)
Immanuel Ming drives, picks up Chris Ginobili. Help arrives from Ja Ball! Immanuel Ming attempts a Dunk. Heavily contested by Ja Ball (0.6 feet, MAN)! Immanuel Ming misses. FOUL! Loose ball foul on Draymond Dosunmu during the rebound battle. [IN THE BONUS! 6 team fouls] Jaren George to the line for 2 free throws. (Draymond Dosunmu: 2 personal fouls)   FT 1/2: GOOD   FT 2/2: MISS Jaren George makes 1/2 from the line. Rebound secured by Russell Harden.
Score: 64-65

[05:17] Team_077 possession (Score: 64-65)
Chris Ginobili attempts a 3Pt. Contested by Immanuel Ming (3.0 feet, MAN). Chris Ginobili misses. Rebound secured by Immanuel Ming.

[05:02] Team_060 possession (Score: 64-65)
Joel Morant attempts a 3Pt. Contested by Dejounte Allen (3.3 feet, ZONE). Joel Morant misses. Rebound secured by Chris Ginobili.

[04:46] Team_077 possession (Score: 64-65)
Draymond Dosunmu attempts a 3Pt. Contested by Julius Green (5.7 feet, ZONE). Draymond Dosunmu misses. Rebound secured by Larry Westbrook.

[04:33] Team_060 possession (Score: 64-65)
Jaren George drives and kicks out. Joel Morant attempts a 3Pt. Contested by Ja Ball (3.1 feet, MAN). Joel Morant misses. Rebound secured by Russell Harden.

[04:17] Team_077 possession (Score: 64-65)
Ja Ball makes the Midrange and draws the foul on Joel Morant! And-1! Ja Ball to the line for 1. [BONUS: 5 team fouls] (Joel Morant: 1 personal fouls)   FT 1/1: MISS Ja Ball makes 0/1 from the line. Rebound secured by Larry Westbrook.
Score: 66-65

[04:06] Team_060 possession (Score: 66-65)
Larry Westbrook attempts a 3Pt. Contested by Dejounte Allen (4.2 feet, ZONE). Larry Westbrook misses. Rebound secured by Russell Harden.

[03:50] Team_077 possession (Score: 66-65)
Russell Harden makes the Layup and draws the foul on Larry Westbrook! And-1! Russell Harden to the line for 1. [BONUS: 6 team fouls] (Larry Westbrook: 3 personal fouls)   FT 1/1: GOOD Russell Harden makes 1/1 from the line.
Score: 69-65

[03:34] Team_060 possession (Score: 69-65)
Larry Westbrook attempts a 3Pt. Wide open! Russell Harden is 7.8 feet away. [MAN] LARRY WESTBROOK MAKES IT! Assist: Jaren George
Score: 69-68

[03:22] Team_077 possession (Score: 69-68)
Dejounte Allen drives to the basket... Dejounte Allen throws a bad pass! Stolen by Julius Green! TURNOVER! (live ball)

[03:03] Team_060 possession (Score: 69-68)
Immanuel Ming attempts a 3Pt. Wide open! Chris Ginobili is 6.8 feet away. [MAN] IMMANUEL MING MAKES IT! Assist: Julius Green
Score: 69-71

[02:45] Team_077 possession (Score: 69-71)
Draymond Dosunmu drives, Jaren George stays with him. Draymond Dosunmu attempts a Dunk. Contested by Jaren George (5.5 feet, MAN). DRAYMOND DOSUNMU MAKES IT!
Score: 71-71

[02:30] Team_060 possession (Score: 71-71)
Larry Westbrook throws a bad pass out of bounds! TURNOVER! (dead ball)

[02:30] Substitution (Team_077): Chris Ginobili OUT → Tyler Poole IN (stamina_rule2)

[02:30] Substitution (Team_077): Russell Harden OUT → Jordan Simmons IN (stamina_rule2)

[02:30] Substitution (Team_060): Joel Morant OUT → Domantas Barnes IN (stamina_rule2)

[02:30] Substitution (Team_060): Larry Westbrook OUT → Yao Tatum IN (stamina_rule2)

[02:30] Substitution (Team_060): Jaren George OUT → Klay Haliburton IN (stamina_rule2)

[02:17] Team_077 possession (Score: 71-71)
FOUL! Holding foul on Domantas Barnes. [IN THE BONUS! 7 team fouls] Ja Ball to the line for 2 free throws. (Domantas Barnes: 1 personal fouls)   FT 1/2: MISS   FT 2/2: MISS Ja Ball makes 0/2 from the line. Rebound secured by Domantas Barnes.

[02:04] Team_060 possession (Score: 71-71)
Julius Green attempts a 3Pt. Heavily contested by Dejounte Allen (1.8 feet, MAN)! JULIUS GREEN MAKES IT! Assist: Domantas Barnes
Score: 71-74

[01:52] Team_077 possession (Score: 71-74)
FOUL! Shooting foul on Immanuel Ming. Tyler Poole to the line for 2 free throws. [BONUS: 8 team fouls] (Immanuel Ming: 1 personal fouls)   FT 1/2: GOOD   FT 2/2: GOOD Tyler Poole makes 2/2 from the line.
Score: 73-74

[01:38] Team_060 possession (Score: 73-74)
Yao Tatum drives, picks up Jordan Simmons. Help arrives from Ja Ball! Yao Tatum attempts a Layup. Heavily contested by Ja Ball (0.5 feet, MAN)! YAO TATUM MAKES IT! Assist: Julius Green
Score: 73-76

[01:21] Team_077 possession (Score: 73-76)
Draymond Dosunmu drives, picks up Klay Haliburton. Help arrives from Julius Green! Draymond Dosunmu attempts a Dunk. Wide open! Julius Green is 7.1 feet away. [MAN] DRAYMOND DOSUNMU MAKES IT! Assist: Ja Ball
Score: 75-76

[01:09] Team_060 possession (Score: 75-76)
Domantas Barnes drives and kicks out. Immanuel Ming attempts a Midrange. Wide open! Dejounte Allen is 6.4 feet away. [ZONE] IMMANUEL MING MAKES IT! Assist: Yao Tatum
Score: 75-78

[00:53] Team_077 possession (Score: 75-78)
Tyler Poole drives and kicks out. Tyler Poole attempts a 3Pt. Heavily contested by Immanuel Ming (1.3 feet, MAN)! Tyler Poole misses. Offensive rebound by Jordan Simmons! Jordan Simmons kicks it out.

[00:41] Team_077 possession (Score: 75-78)
Ja Ball throws a bad pass out of bounds! TURNOVER! (dead ball)

[00:41] Substitution (Team_077): Ja Ball OUT → Bam Bryant IN (stamina_rule2)

[00:41] Substitution (Team_077): Dejounte Allen OUT → Dejounte Quickley IN (stamina_rule2)

[00:41] Substitution (Team_077): Draymond Dosunmu OUT → Ayo Griffin IN (stamina_rule2)

[00:41] Substitution (Team_060): Julius Green OUT → Rudy Ginobili IN (stamina_rule2)

[00:41] Substitution (Team_060): Immanuel Ming OUT → Jarrett Wagner IN (stamina_rule2)

[00:27] Team_060 possession (Score: 75-78)
Rudy Ginobili attempts a 3Pt. Wide open! Dejounte Quickley is 6.2 feet away. [MAN] Rudy Ginobili misses. Rebound secured by Tyler Poole.

[00:11] Team_077 possession (Score: 75-78)
Bam Bryant attempts a Midrange. Wide open! Jarrett Wagner is 6.4 feet away. [ZONE] Bam Bryant misses. Offensive rebound by Jordan Simmons! Jordan Simmons kicks it out.

================================================================================
                              3RD QUARTER COMPLETE                              
================================================================================

3RD QUARTER SCORE: Team_077 28, Team_060 30

BOX SCORE:
================================================================================

Team_077
--------------------------------------------------------------------------------
Player                MIN  PTS  REB  AST  TO      FG   FG%      3P   3P%
--------------------------------------------------------------------------------
Russell Harden         22   10    8    1   0   4/4   100.0     0/0   0.0
Draymond Dosunmu       26    6    1    0   0   3/5    60.0     0/0   0.0
Dejounte Allen         26    4    0    1   0   2/2   100.0     0/0   0.0
Chris Ginobili         22    4    2    1   0   2/3    66.7     0/0   0.0
Tyler Poole            14    2    1    0   0   1/1   100.0     0/0   0.0
Ja Ball                26    0    0    2   0   0/2     0.0     0/0   0.0
Jordan Simmons         14    0    2    0   0   0/0     0.0     0/0   0.0

TEAM: FG: 12/18 (66.7%), 3PT: 1/4 (25.0%), REB: 12 (5 off, 7 def), AST: 5, TO: 3
TEAM FOULS: 6 [Team_060 in BONUS]


Team_060
--------------------------------------------------------------------------------
Player                MIN  PTS  REB  AST  TO      FG   FG%      3P   3P%
--------------------------------------------------------------------------------
Julius Green           24   13    0    2   0   5/5   100.0     0/0   0.0
Immanuel Ming          26   11    2    1   0   4/7    57.1     0/0   0.0
Larry Westbrook        22    3    3    0   0   1/4    25.0     0/0   0.0
Yao Tatum              14    2    0    1   0   1/1   100.0     0/0   0.0
Jaren George           22    0    1    4   0   0/1     0.0     0/0   0.0
Joel Morant            22    0    0    0   0   0/1     0.0     0/0   0.0
Domantas Barnes        14    0    1    1   0   0/0     0.0     0/0   0.0
Rudy Ginobili          12    0    0    0   0   0/1     0.0     0/0   0.0

TEAM: FG: 11/20 (55.0%), 3PT: 4/9 (44.4%), REB: 9 (3 off, 6 def), AST: 9, TO: 1
TEAM FOULS: 8 [Team_077 in BONUS]

================================================================================

================================================================================
                       4TH QUARTER - Team_077 vs Team_060                       
================================================================================

[12:00] Team_077 possession (Score: 75-78)
Chris Ginobili attempts a Midrange. Heavily contested by Immanuel Ming (1.9 feet, ZONE)! Chris Ginobili misses. Rebound secured by Immanuel Ming.

[11:47] Team_060 possession (Score: 75-78)
Joel Morant attempts a 3Pt. Contested by Dejounte Allen (3.8 feet, ZONE). Joel Morant misses. Rebound secured by Draymond Dosunmu.

[11:34] Team_077 possession (Score: 75-78)
Ja Ball throws a bad pass! Stolen by Joel Morant! TURNOVER! (live ball)

[11:20] Team_060 possession (Score: 75-78)
FOUL! Reach-in foul on Draymond Dosunmu during the drive. [Team fouls: 1] No free throws, side out. (Draymond Dosunmu: 1 personal fouls)

[11:06] Team_060 possession (Score: 75-78)
Larry Westbrook commits a violation (traveling/carry)! TURNOVER! (dead ball)

[11:06] Substitution (Team_077): Dejounte Allen OUT → Dejounte Quickley IN (stamina_rule2)

[11:06] Substitution (Team_077): Draymond Dosunmu OUT → Ayo Griffin IN (stamina_rule2)

[11:06] Substitution (Team_060): Julius Green OUT → Rudy Ginobili IN (stamina_rule2)

[10:50] Team_077 possession (Score: 75-78)
Ayo Griffin drives, Jaren George stays with him. Ayo Griffin attempts a Layup. Wide open! Jaren George is 6.8 feet away. [ZONE] Ayo Griffin misses. Rebound secured by Jaren George.

[10:34] Team_060 possession (Score: 75-78)
Larry Westbrook attempts a Midrange. Contested by Russell Harden (3.4 feet, ZONE). Larry Westbrook misses. Rebound secured by Ayo Griffin.

[10:21] Team_077 possession (Score: 75-78)
Ja Ball attempts a 3Pt. Wide open! Immanuel Ming is 7.0 feet away. [ZONE] JA BALL MAKES IT! Assist: Dejounte Quickley
Score: 78-78

[10:06] Team_060 possession (Score: 78-78)
Jaren George attempts a Layup. Contested by Ayo Griffin (5.1 feet, MAN). Jaren George misses. Rebound secured by Ayo Griffin.

[09:56] Team_077 possession (Score: 78-78)
Dejounte Quickley attempts a 3Pt. Contested by Rudy Ginobili (4.9 feet, MAN). DEJOUNTE QUICKLEY MAKES IT! Assist: Russell Harden
Score: 81-78

[09:41] Team_060 possession (Score: 81-78)
Joel Morant attempts a Layup. Heavily contested by Ja Ball (1.8 feet, MAN)! Joel Morant misses. Offensive rebound by Immanuel Ming! Immanuel Ming kicks it out.

[09:26] Team_060 possession (Score: 81-78)
Jaren George drives and kicks out. Joel Morant attempts a Midrange. Contested by Russell Harden (3.3 feet, ZONE). JOEL MORANT MAKES IT!
Score: 81-80

[09:12] Team_077 possession (Score: 81-80)
Dejounte Quickley attempts a 3Pt. Contested by Rudy Ginobili (2.7 feet, MAN). DEJOUNTE QUICKLEY MAKES IT!
Score: 84-80

[08:58] Team_060 possession (Score: 84-80)
Jaren George drives, Russell Harden stays with him. Jaren George attempts a Dunk. Contested by Russell Harden (2.3 feet, ZONE). JAREN GEORGE MAKES IT! Assist: Larry Westbrook
Score: 84-82

[08:44] Team_077 possession (Score: 84-82)
Russell Harden attempts a Midrange. Wide open! Larry Westbrook is 6.7 feet away. [ZONE] RUSSELL HARDEN MAKES IT! Assist: Chris Ginobili
Score: 86-82

[08:24] Team_060 possession (Score: 86-82)
Joel Morant loses the ball! Stripped by Ja Ball! TURNOVER! (live ball)

[08:05] Team_077 possession (Score: 86-82)
Dejounte Quickley drives, Rudy Ginobili stays with him. Dejounte Quickley attempts a Layup. Contested by Rudy Ginobili (3.2 feet, MAN). Dejounte Quickley misses. Rebound secured by Jaren George.

[07:51] Team_060 possession (Score: 86-82)
Jaren George attempts a Layup. Contested by Ayo Griffin (2.2 feet, MAN). JAREN GEORGE MAKES IT! Assist: Immanuel Ming
Score: 86-84

[07:36] Team_077 possession (Score: 86-84)
FOUL! Reach-in foul on Jaren George during the drive. [Team fouls: 1] No free throws, side out. (Jaren George: 1 personal fouls)

[07:19] Team_077 possession (Score: 86-84)
Ayo Griffin drives, Jaren George stays with him. Ayo Griffin attempts a Dunk. Contested by Jaren George (4.1 feet, MAN). Ayo Griffin misses. Rebound secured by Immanuel Ming.

[07:03] Team_060 possession (Score: 86-84)
Jaren George attempts a Midrange. Wide open! Ayo Griffin is 6.8 feet away. [MAN] Jaren George misses. Offensive rebound by Jaren George! Jaren George's putback is no good. Offensive rebound by Immanuel Ming! Immanuel Ming kicks it out.

[06:50] Team_060 possession (Score: 86-84)
Larry Westbrook attempts a Midrange. Contested by Russell Harden (3.6 feet, ZONE). Larry Westbrook misses. Rebound secured by Chris Ginobili.

[06:34] Team_077 possession (Score: 86-84)
Dejounte Quickley attempts a Layup. Contested by Jaren George (3.4 feet, ZONE). Dejounte Quickley misses. Rebound secured by Rudy Ginobili.

[06:22] Team_060 possession (Score: 86-84)
Immanuel Ming attempts a Layup. Contested by Ayo Griffin (3.6 feet, ZONE). Immanuel Ming misses. Rebound secured by Ayo Griffin.

[06:10] Team_077 possession (Score: 86-84)
Russell Harden attempts a 3Pt. Contested by Rudy Ginobili (3.3 feet, ZONE). Russell Harden misses. Rebound secured by Immanuel Ming.

[05:53] Team_060 possession (Score: 86-84)
Joel Morant drives to the basket... Joel Morant throws a bad pass! Stolen by Ja Ball! TURNOVER! (live ball)

[05:37] Team_077 possession (Score: 86-84)
Ayo Griffin drives and kicks out. Dejounte Quickley attempts a Midrange. Contested by Rudy Ginobili (4.4 feet, MAN). DEJOUNTE QUICKLEY MAKES IT! Assist: Ja Ball
Score: 88-84

[05:20] Team_060 possession (Score: 88-84)
Joel Morant drives to the basket... Joel Morant throws a bad pass out of bounds! TURNOVER! (dead ball)

[05:20] Substitution (Team_077): Ja Ball OUT → Bam Bryant IN (stamina_rule2)

[05:20] Substitution (Team_077): Chris Ginobili OUT → Tyler Poole IN (stamina_rule2)

[05:20] Substitution (Team_077): Russell Harden OUT → Jordan Simmons IN (stamina_rule2)

[05:20] Substitution (Team_060): Joel Morant OUT → Domantas Barnes IN (stamina_rule2)

[05:20] Substitution (Team_060): Immanuel Ming OUT → Jarrett Wagner IN (stamina_rule2)

[05:20] Substitution (Team_060): Larry Westbrook OUT → Yao Tatum IN (stamina_rule2)

[05:20] Substitution (Team_060): Jaren George OUT → Klay Haliburton IN (stamina_rule2)

[05:08] Team_077 possession (Score: 88-84)
Dejounte Quickley attempts a 3Pt. Contested by Rudy Ginobili (5.7 feet, MAN). Dejounte Quickley misses. Offensive rebound by Jordan Simmons! Jordan Simmons kicks it out.

[04:54] Team_077 possession (Score: 88-84)
Bam Bryant attempts a 3Pt. Contested by Domantas Barnes (4.1 feet, ZONE). Bam Bryant misses. Rebound secured by Domantas Barnes.

[04:39] Team_060 possession (Score: 88-84)
Rudy Ginobili makes the Layup and draws the foul on Jordan Simmons! And-1! Rudy Ginobili to the line for 1. [Team fouls: 2] (Jordan Simmons: 1 personal fouls)   FT 1/1: GOOD Rudy Ginobili makes 1/1 from the line.
Score: 88-87

[04:26] Team_077 possession (Score: 88-87)
Tyler Poole throws a bad pass out of bounds! TURNOVER! (dead ball)

[04:13] Team_060 possession (Score: 88-87)
Jarrett Wagner attempts a 3Pt. Contested by Tyler Poole (5.2 feet, MAN). Jarrett Wagner misses. Rebound secured by Tyler Poole.

[03:56] Team_077 possession (Score: 88-87)
Tyler Poole attempts a 3Pt. Wide open! Jarrett Wagner is 7.6 feet away. [MAN] TYLER POOLE MAKES IT! Assist: Bam Bryant
Score: 91-87

[03:40] Team_060 possession (Score: 91-87)
Klay Haliburton attempts a Layup. Contested by Ayo Griffin (5.2 feet, MAN). Klay Haliburton misses. Rebound secured by Jordan Simmons.

[03:26] Team_077 possession (Score: 91-87)
Jordan Simmons makes the Dunk and draws the foul on Klay Haliburton! And-1! Jordan Simmons to the line for 1. [Team fouls: 2] (Klay Haliburton: 1 personal fouls)   FT 1/1: MISS Jordan Simmons makes 0/1 from the line. Rebound secured by Klay Haliburton.
Score: 93-87

[03:10] Team_060 possession (Score: 93-87)
Yao Tatum makes the Midrange and draws the foul on Jordan Simmons! And-1! Yao Tatum to the line for 1. [Team fouls: 3] (Jordan Simmons: 2 personal fouls)   FT 1/1: GOOD Yao Tatum makes 1/1 from the line.
Score: 93-90

[02:55] Team_077 possession (Score: 93-90)
Tyler Poole attempts a 3Pt. Wide open! Jarrett Wagner is 8.1 feet away. [MAN] TYLER POOLE MAKES IT! Assist: Bam Bryant
Score: 96-90

[02:39] Team_060 possession (Score: 96-90)
Jarrett Wagner drives, picks up Tyler Poole. Help arrives from Dejounte Quickley! Jarrett Wagner attempts a Layup. Contested by Dejounte Quickley (2.7 feet, MAN). Jarrett Wagner misses. Rebound secured by Tyler Poole.

[02:25] Team_077 possession (Score: 96-90)
Bam Bryant attempts a 3Pt. Contested by Domantas Barnes (4.6 feet, ZONE). Bam Bryant misses. Rebound secured by Klay Haliburton.

[02:06] Team_060 possession (Score: 96-90)
FOUL! Shooting foul on Dejounte Quickley. Rudy Ginobili to the line for 3 free throws. [Team fouls: 4] (Dejounte Quickley: 1 personal fouls)   FT 1/3: MISS   FT 2/3: MISS   FT 3/3: GOOD Rudy Ginobili makes 1/3 from the line.
Score: 96-91

[01:54] Team_077 possession (Score: 96-91)
Dejounte Quickley attempts a Midrange. Contested by Rudy Ginobili (5.0 feet, MAN). DEJOUNTE QUICKLEY MAKES IT! Assist: Bam Bryant
Score: 98-91

[01:44] Team_060 possession (Score: 98-91)
Domantas Barnes attempts a Midrange. Wide open! Bam Bryant is 10.0 feet away. [MAN] Domantas Barnes misses. Rebound secured by Jordan Simmons.

[01:33] Team_077 possession (Score: 98-91)
FOUL! Shooting foul on Klay Haliburton. Tyler Poole to the line for 2 free throws. [Team fouls: 3] (Klay Haliburton: 2 personal fouls)   FT 1/2: GOOD   FT 2/2: GOOD Tyler Poole makes 2/2 from the line.
Score: 100-91

[01:19] Team_060 possession (Score: 100-91)
Rudy Ginobili makes the Layup and draws the foul on Dejounte Quickley! And-1! Rudy Ginobili to the line for 1. [BONUS: 5 team fouls] (Dejounte Quickley: 2 personal fouls)   FT 1/1: GOOD Rudy Ginobili makes 1/1 from the line.
Score: 100-94

[01:07] Team_077 possession (Score: 100-94)
Dejounte Quickley throws a bad pass out of bounds! TURNOVER! (dead ball)

[00:53] Team_060 possession (Score: 100-94)
Klay Haliburton drives, Ayo Griffin stays with him. Klay Haliburton attempts a Dunk. Contested by Ayo Griffin (4.5 feet, MAN). Klay Haliburton misses. Rebound secured by Ayo Griffin.

[00:39] Team_077 possession (Score: 100-94)
Jordan Simmons attempts a Layup. Wide open! Yao Tatum is 6.5 feet away. [MAN] JORDAN SIMMONS MAKES IT!
Score: 102-94

[00:28] Team_060 possession (Score: 102-94)
Klay Haliburton attempts a 3Pt. Wide open! Ayo Griffin is 6.3 feet away. [MAN] Klay Haliburton misses. Rebound secured by Tyler Poole.

[00:15] Team_077 possession (Score: 102-94)
Dejounte Quickley attempts a 3Pt. Contested by Domantas Barnes (3.5 feet, ZONE). Dejounte Quickley misses. Rebound secured by Rudy Ginobili.

[00:02] Team_060 possession (Score: 102-94)
Domantas Barnes attempts a 3Pt. Contested by Bam Bryant (5.2 feet, MAN). DOMANTAS BARNES MAKES IT! Assist: Jarrett Wagner
Score: 102-97

================================================================================
                              4TH QUARTER COMPLETE                              
================================================================================

4TH QUARTER SCORE: Team_077 27, Team_060 19

BOX SCORE:
================================================================================

Team_077
--------------------------------------------------------------------------------
Player                MIN  PTS  REB  AST  TO      FG   FG%      3P   3P%
--------------------------------------------------------------------------------
Dejounte Quickley      22   10    0    1   0   4/7    57.1     0/0   0.0
Tyler Poole            19    8    3    0   0   3/3   100.0     0/0   0.0
Ja Ball                32    3    0    1   0   1/1   100.0     0/0   0.0
Russell Harden         29    2    0    1   0   1/2    50.0     0/0   0.0
Jordan Simmons         19    2    3    0   0   1/2    50.0     0/0   0.0
Chris Ginobili         29    0    1    1   0   0/1     0.0     0/0   0.0
Draymond Dosunmu       27    0    1    0   0   0/0     0.0     0/0   0.0
Ayo Griffin            22    0    4    0   0   0/2     0.0     0/0   0.0
Bam Bryant             16    0    0    3   0   0/2     0.0     0/0   0.0

TEAM: FG: 10/20 (50.0%), 3PT: 5/9 (55.6%), REB: 12 (1 off, 11 def), AST: 7, TO: 3
TEAM FOULS: 5 [Team_060 in BONUS]


Team_060
--------------------------------------------------------------------------------
Player                MIN  PTS  REB  AST  TO      FG   FG%      3P   3P%
--------------------------------------------------------------------------------
Rudy Ginobili          23    7    2    0   0   3/3   100.0     0/0   0.0
Jaren George           29    4    2    0   0   2/3    66.7     0/0   0.0
Domantas Barnes        19    3    1    0   0   1/2    50.0     0/0   0.0
Yao Tatum              19    3    0    0   0   1/1   100.0     0/0   0.0
Joel Morant            29    2    0    0   0   1/2    50.0     0/0   0.0
Immanuel Ming          32    0    5    1   0   0/1     0.0     0/0   0.0
Larry Westbrook        29    0    0    1   0   0/2     0.0     0/0   0.0
Jarrett Wagner         16    0    0    1   0   0/2     0.0     0/0   0.0
Klay Haliburton        19    0    2    0   0   0/3     0.0     0/0   0.0

TEAM: FG: 8/19 (42.1%), 3PT: 2/5 (40.0%), REB: 12 (2 off, 10 def), AST: 3, TO: 4
TEAM FOULS: 3

================================================================================

================================================================================
                               FULL GAME COMPLETE                               
================================================================================

FINAL SCORE: Team_077 102, Team_060 97

SCORING BY QUARTER:
--------------------------------------------------------------------------------
Team                     Q1     Q2     Q3     Q4    FINAL
--------------------------------------------------------------------------------
Team_077                 29     18     28     27      102
Team_060                 29     19     30     19       97
--------------------------------------------------------------------------------

FULL GAME BOX SCORE:
================================================================================

Team_077
--------------------------------------------------------------------------------
Player                MIN  PTS  REB  AST  TO      FG   FG%      3P   3P%      FT STL BLK
--------------------------------------------------------------------------------
Ja Ball                32    3    0    6   2   1/4    25.0   1/3    33.3   0/3     2   1
Chris Ginobili         29   12    4    3   2   4/8    50.0   0/3     0.0   2/2     0   1
Russell Harden         29   20   12    3   2   8/10   80.0   1/2    50.0   3/3     0   0
Dejounte Allen         27    9    0    1   1   4/5    80.0   2/3    66.7   2/3     0   0
Draymond Dosunmu       27   14    6    1   1   8/11   72.7   0/1     0.0   2/2     1   0
Dejounte Quickley      22   13    0    1   3   4/7    57.1   3/4    75.0   0/0     0   1
Ayo Griffin            22    6    7    0   3   3/5    60.0   0/0     0.0   2/2     0   0
Tyler Poole            19   10    8    1   1   6/10   60.0   3/5    60.0   4/4     0   0
Jordan Simmons         19    8   10    0   1   4/5    80.0   0/0     0.0   0/1     0   0
Bam Bryant             16    3    0    4   0   0/6     0.0   0/3     0.0   0/0     0   0

TEAM: FG: 42/72 (58.3%), 3PT: 10/24 (41.7%), REB: 45 (11 off, 34 def), AST: 20, TO: 16


Team_060
--------------------------------------------------------------------------------
Player                MIN  PTS  REB  AST  TO      FG   FG%      3P   3P%      FT STL BLK
--------------------------------------------------------------------------------
Immanuel Ming          32   13   13    3   1   4/11   36.4   1/4    25.0   1/1     0   0
Joel Morant            29    8    0    2   1   2/5    40.0   0/3     0.0   2/2     1   0
Larry Westbrook        29   15    5    1   4   4/10   40.0   1/2    50.0   0/0     1   0
Jaren George           29   10    6    6   0   7/10   70.0   0/0     0.0   7/10    0   0
Julius Green           25   18    0    2   0   7/9    77.8   3/4    75.0   3/3     1   0
Rudy Ginobili          23   11    5    0   1   5/9    55.6   1/3    33.3   3/5     0   1
Domantas Barnes        19    8    2    1   1   4/5    80.0   1/1   100.0   1/1     0   1
Yao Tatum              19    8    0    2   0   5/6    83.3   0/1     0.0   2/3     0   0
Klay Haliburton        19    5    7    3   2   2/7    28.6   0/1     0.0   1/2     3   0
Jarrett Wagner         16    0    0    2   0   0/5     0.0   0/3     0.0   0/0     0   0

TEAM: FG: 41/78 (52.6%), 3PT: 7/22 (31.8%), REB: 40 (10 off, 30 def), AST: 22, TO: 10

================================================================================
