================================================================================
                        FULL GAME - Team_045 vs Team_015                        
================================================================================

================================================================================
                       1ST QUARTER - Team_045 vs Team_015                       
================================================================================

[12:00] Team_045 possession (Score: 0-0)
Zion Butler attempts a Dunk. BLOCKED BY TRAE TURNER! Ball is loose! Rebound secured by Trae Turner.

[11:45] Team_015 possession (Score: 0-0)
FOUL! Shooting foul on Rudy Antetokounmpo. Manu Anthony to the line for 2 free throws. [Team fouls: 1] (Rudy Antetokounmpo: 1 personal fouls)   FT 1/2: GOOD   FT 2/2: GOOD Manu Anthony makes 2/2 from the line.
Score: 0-2

[11:30] Team_045 possession (Score: 0-2)
Zion Butler attempts a Layup. Contested by Trae Turner (3.4 feet, ZONE). Zion Butler misses. Rebound secured by Trae Turner.

[11:13] Team_015 possession (Score: 0-2)
CJ Banchero attempts a 3Pt. Contested by Cole Simons (3.0 feet, MAN). CJ BANCHERO MAKES IT! Assist: Scottie Gasol
Score: 0-5

[11:00] Team_045 possession (Score: 0-5)
Cole Simons attempts a 3Pt. Contested by Manu Anthony (5.4 feet, ZONE). Cole Simons misses. Rebound secured by CJ Banchero.

[10:45] Team_015 possession (Score: 0-5)
Trae Turner attempts a Midrange. Wide open! Cole Simons is 6.7 feet away. [ZONE] Trae Turner misses. Rebound secured by Zion Butler.

[10:28] Team_045 possession (Score: 0-5)
Rudy Antetokounmpo attempts a Midrange. Contested by Michael Simmons (5.1 feet, ZONE). RUDY ANTETOKOUNMPO MAKES IT! Assist: Zion Butler
Score: 2-5

[10:10] Team_015 possession (Score: 2-5)
CJ Banchero attempts a 3Pt. Heavily contested by Cole Simons (1.9 feet, ZONE)! CJ Banchero misses. Rebound secured by Cole Simons.

[09:51] Team_045 possession (Score: 2-5)
FOUL! Shooting foul on Michael Simmons. Trae Russell to the line for 2 free throws. [Team fouls: 1] (Michael Simmons: 1 personal fouls)   FT 1/2: GOOD   FT 2/2: GOOD Trae Russell makes 2/2 from the line.
Score: 4-5

[09:35] Team_015 possession (Score: 4-5)
Manu Anthony throws a bad pass! Stolen by Rudy Antetokounmpo! TURNOVER! (live ball)

[09:21] Team_045 possession (Score: 4-5)
Cole Simons drives and kicks out. Trae Russell attempts a Midrange. Contested by Scottie Gasol (2.9 feet, ZONE). Trae Russell misses. Offensive rebound by DeMar Turner! DeMar Turner kicks it out.

[09:10] Team_045 possession (Score: 4-5)
FOUL! Reach-in foul on Trae Turner during the drive. [Team fouls: 2] No free throws, side out. (Trae Turner: 1 personal fouls)

[08:54] Team_045 possession (Score: 4-5)
Rudy Antetokounmpo attempts a 3Pt. Contested by Manu Anthony (4.7 feet, ZONE). Rudy Antetokounmpo misses. Rebound secured by Trae Turner.

[08:41] Team_015 possession (Score: 4-5)
Scottie Gasol drives, picks up Zion Butler. Help arrives from Rudy Antetokounmpo! Scottie Gasol attempts a Layup. Contested by Rudy Antetokounmpo (4.5 feet, ZONE). Scottie Gasol misses. Rebound secured by Zion Butler.

[08:25] Team_045 possession (Score: 4-5)
Trae Russell commits a violation (traveling/carry)! TURNOVER! (dead ball)

[08:09] Team_015 possession (Score: 4-5)
Michael Simmons attempts a Layup. Heavily contested by Cole Simons (0.9 feet, MAN)! Michael Simmons misses. Rebound secured by DeMar Turner.

[07:54] Team_045 possession (Score: 4-5)
Trae Russell attempts a Midrange. Wide open! Michael Simmons is 8.3 feet away. [MAN] Trae Russell misses. Rebound secured by CJ Banchero.

[07:39] Team_015 possession (Score: 4-5)
Trae Turner attempts a Layup. Contested by Zion Butler (4.4 feet, MAN). Trae Turner misses. Offensive rebound by CJ Banchero! CJ Banchero's putback is no good. Rebound secured by Zion Butler.

[07:27] Team_045 possession (Score: 4-5)
FOUL! Reach-in foul on Scottie Gasol during the drive. [Team fouls: 3] No free throws, side out. (Scottie Gasol: 1 personal fouls)

[07:12] Team_045 possession (Score: 4-5)
Rudy Antetokounmpo attempts a 3Pt. Contested by Manu Anthony (4.7 feet, MAN). Rudy Antetokounmpo misses. Rebound secured by CJ Banchero.

[07:02] Team_015 possession (Score: 4-5)
CJ Banchero drives and kicks out. Trae Turner attempts a 3Pt. Contested by Zion Butler (4.7 feet, MAN). Trae Turner misses. Rebound secured by Cole Simons.

[06:47] Team_045 possession (Score: 4-5)
Cole Simons drives, Scottie Gasol stays with him. Cole Simons attempts a Dunk. Contested by Scottie Gasol (2.5 feet, ZONE). Cole Simons misses. Rebound secured by CJ Banchero.

[06:31] Team_015 possession (Score: 4-5)
Manu Anthony throws a bad pass! Stolen by Rudy Antetokounmpo! TURNOVER! (live ball)

[06:16] Team_045 possession (Score: 4-5)
Zion Butler drives to the basket... Zion Butler throws a bad pass out of bounds! TURNOVER! (dead ball)

[06:01] Team_015 possession (Score: 4-5)
Scottie Gasol drives to the basket... Scottie Gasol commits a violation (traveling/carry)! TURNOVER! (dead ball)

[05:49] Team_045 possession (Score: 4-5)
Cole Simons attempts a 3Pt. Contested by CJ Banchero (2.8 feet, MAN). Cole Simons misses. Rebound secured by Trae Turner.

[05:33] Team_015 possession (Score: 4-5)
Scottie Gasol drives, picks up Zion Butler. Help arrives from Rudy Antetokounmpo! Scottie Gasol attempts a Dunk. Contested by Rudy Antetokounmpo (4.2 feet, ZONE). SCOTTIE GASOL MAKES IT! Assist: Manu Anthony
Score: 4-7

[05:20] Team_045 possession (Score: 4-7)
Cole Simons attempts a 3Pt. Wide open! Manu Anthony is 6.4 feet away. [ZONE] Cole Simons misses. Offensive rebound by Zion Butler! Zion Butler puts it back in!
Score: 6-7

[05:03] Team_015 possession (Score: 6-7)
Trae Turner drives to the basket... FOUL! Offensive foul on Trae Turner! Zion Butler drew the charge! [Team fouls: 4] (Trae Turner: 2 personal fouls) TURNOVER! (dead ball)

[04:47] Team_045 possession (Score: 6-7)
Cole Simons drives to the basket... Cole Simons loses the ball! Stripped by CJ Banchero! TURNOVER! (live ball)

[04:34] Team_015 possession (Score: 6-7)
CJ Banchero attempts a 3Pt. Contested by Cole Simons (3.2 feet, MAN). CJ BANCHERO MAKES IT! Assist: Michael Simmons
Score: 6-10

[04:20] Team_045 possession (Score: 6-10)
DeMar Turner attempts a Midrange. Contested by Michael Simmons (3.8 feet, ZONE). DeMar Turner misses. FOUL! Loose ball foul on Trae Turner during the rebound battle. [IN THE BONUS! 5 team fouls] DeMar Turner to the line for 2 free throws. (Trae Turner: 3 personal fouls)   FT 1/2: MISS   FT 2/2: GOOD DeMar Turner makes 1/2 from the line.
Score: 7-10

[04:03] Team_015 possession (Score: 7-10)
Trae Turner attempts a Midrange. Contested by Zion Butler (3.6 feet, MAN). Trae Turner misses. Rebound secured by DeMar Turner.

[03:53] Team_045 possession (Score: 7-10)
FOUL! Shooting foul on Scottie Gasol. DeMar Turner to the line for 2 free throws. [BONUS: 6 team fouls] (Scottie Gasol: 2 personal fouls)   FT 1/2: GOOD   FT 2/2: GOOD DeMar Turner makes 2/2 from the line.
Score: 9-10

[03:40] Team_015 possession (Score: 9-10)
Scottie Gasol drives, picks up DeMar Turner. Help arrives from Rudy Antetokounmpo! Scottie Gasol attempts a Layup. Wide open! Rudy Antetokounmpo is 6.1 feet away. [MAN] SCOTTIE GASOL MAKES IT!
Score: 9-12

[03:26] Team_045 possession (Score: 9-12)
FOUL! Reach-in foul on Scottie Gasol during the drive. [IN THE BONUS! 7 team fouls] DeMar Turner to the line for 2 free throws. (Scottie Gasol: 3 personal fouls)   FT 1/2: GOOD   FT 2/2: GOOD DeMar Turner makes 2/2 from the line.
Score: 11-12

[03:12] Team_015 possession (Score: 11-12)
Scottie Gasol attempts a 3Pt. Contested by Cole Simons (5.3 feet, ZONE). Scottie Gasol misses. Rebound secured by DeMar Turner.

[02:54] Team_045 possession (Score: 11-12)
Zion Butler drives, Trae Turner stays with him. Zion Butler attempts a Dunk. Contested by Trae Turner (4.0 feet, MAN). ZION BUTLER MAKES IT! Assist: Rudy Antetokounmpo
Score: 13-12

[02:41] Team_015 possession (Score: 13-12)
CJ Banchero commits a violation (traveling/carry)! TURNOVER! (dead ball)

[02:41] Substitution (Team_045): Cole Simons OUT → Gary Towns IN (stamina_rule2)

[02:41] Substitution (Team_045): Zion Butler OUT → Stephen Paul IN (stamina_rule2)

[02:41] Substitution (Team_015): Trae Turner OUT → Allen Curry IN (stamina_rule2)

[02:31] Team_045 possession (Score: 13-12)
DeMar Turner attempts a 3Pt. Wide open! Manu Anthony is 6.6 feet away. [ZONE] DeMar Turner misses. Rebound secured by CJ Banchero.

[02:17] Team_015 possession (Score: 13-12)
Scottie Gasol attempts a Layup. Contested by DeMar Turner (3.8 feet, MAN). Scottie Gasol misses. Rebound secured by Stephen Paul.

[02:07] Team_045 possession (Score: 13-12)
Gary Towns attempts a 3Pt. Wide open! Manu Anthony is 6.1 feet away. [ZONE] Gary Towns misses. Rebound secured by Michael Simmons.

[01:54] Team_015 possession (Score: 13-12)
CJ Banchero attempts a 3Pt. Contested by Gary Towns (4.4 feet, MAN). CJ BANCHERO MAKES IT! Assist: Allen Curry
Score: 13-15

[01:36] Team_045 possession (Score: 13-15)
Rudy Antetokounmpo loses the ball! Stripped by Manu Anthony! TURNOVER! (live ball)

[01:22] Team_015 possession (Score: 13-15)
Manu Anthony attempts a 3Pt. Contested by Rudy Antetokounmpo (4.7 feet, ZONE). Manu Anthony misses. Offensive rebound by Allen Curry! Allen Curry's putback is no good. Rebound secured by DeMar Turner.

[01:07] Team_045 possession (Score: 13-15)
Trae Russell drives and kicks out. Gary Towns attempts a 3Pt. Contested by CJ Banchero (3.8 feet, MAN). GARY TOWNS MAKES IT! Assist: Stephen Paul
Score: 16-15

[00:48] Team_015 possession (Score: 16-15)
Scottie Gasol attempts a Layup. Contested by Stephen Paul (4.7 feet, ZONE). Scottie Gasol misses. Offensive rebound by Allen Curry! Allen Curry puts it back in!
Score: 16-17

[00:35] Team_045 possession (Score: 16-17)
FOUL! Reach-in foul on CJ Banchero during the drive. [IN THE BONUS! 8 team fouls] Gary Towns to the line for 2 free throws. (CJ Banchero: 1 personal fouls)   FT 1/2: GOOD   FT 2/2: GOOD Gary Towns makes 2/2 from the line.
Score: 18-17

[00:19] Team_015 possession (Score: 18-17)
FOUL! Offensive foul on Michael Simmons! Trae Russell drew the charge! [Team fouls: 9] (Michael Simmons: 2 personal fouls) TURNOVER! (dead ball)

[00:06] Team_045 possession (Score: 18-17)
DeMar Turner attempts a 3Pt. Contested by Manu Anthony (5.0 feet, ZONE). DeMar Turner misses. Rebound secured by Allen Curry.

================================================================================
                              1ST QUARTER COMPLETE                              
================================================================================

1ST QUARTER SCORE: Team_045 18, Team_015 17

BOX SCORE:
================================================================================

Team_045
--------------------------------------------------------------------------------
Player                MIN  PTS  REB  AST  TO      FG   FG%      3P   3P%
--------------------------------------------------------------------------------
DeMar Turner           12    5    5    0   0   3/5    60.0     0/0   0.0
Gary Towns              3    5    0    0   0   2/3    66.7     0/0   0.0
Zion Butler             9    4    4    1   0   2/4    50.0     0/0   0.0
Rudy Antetokounmpo     12    2    0    1   0   1/3    33.3     0/0   0.0
Trae Russell           12    2    0    0   0   1/2    50.0     0/0   0.0
Cole Simons             9    0    2    0   0   0/3     0.0     0/0   0.0
Stephen Paul            3    0    1    1   0   0/0     0.0     0/0   0.0

TEAM: FG: 9/20 (45.0%), 3PT: 1/8 (12.5%), REB: 10 (2 off, 8 def), AST: 3, TO: 4
TEAM FOULS: 1


Team_015
--------------------------------------------------------------------------------
Player                MIN  PTS  REB  AST  TO      FG   FG%      3P   3P%
--------------------------------------------------------------------------------
CJ Banchero            12    9    5    0   0   3/5    60.0     0/0   0.0
Scottie Gasol          12    4    0    1   0   2/5    40.0     0/0   0.0
Manu Anthony           12    2    0    1   0   1/2    50.0     0/0   0.0
Allen Curry             3    2    2    1   0   1/1   100.0     0/0   0.0
Trae Turner             9    0    4    0   0   0/3     0.0     0/0   0.0
Michael Simmons        12    0    1    1   0   0/1     0.0     0/0   0.0

TEAM: FG: 7/17 (41.2%), 3PT: 3/6 (50.0%), REB: 14 (3 off, 11 def), AST: 4, TO: 6
TEAM FOULS: 9 [Team_045 in BONUS]

================================================================================

================================================================================
                       2ND QUARTER - Team_045 vs Team_015                       
================================================================================

[12:00] Team_045 possession (Score: 18-17)
Cole Simons drives and kicks out. Trae Russell attempts a 3Pt. Heavily contested by Scottie Gasol (1.3 feet, ZONE)! Trae Russell misses. Rebound secured by Trae Turner.

[11:47] Team_015 possession (Score: 18-17)
CJ Banchero drives, Cole Simons stays with him. CJ Banchero attempts a Layup. Contested by Cole Simons (4.3 feet, MAN). CJ Banchero misses. Rebound secured by Zion Butler.

[11:33] Team_045 possession (Score: 18-17)
Trae Russell drives, picks up Michael Simmons. Help arrives from CJ Banchero! Trae Russell attempts a Layup. Heavily contested by CJ Banchero (0.5 feet, MAN)! TRAE RUSSELL MAKES IT!
Score: 20-17

[11:21] Team_015 possession (Score: 20-17)
CJ Banchero attempts a 3Pt. Heavily contested by Cole Simons (0.5 feet, ZONE)! CJ Banchero misses. Rebound secured by Cole Simons.

[11:07] Team_045 possession (Score: 20-17)
Cole Simons drives, CJ Banchero stays with him. Cole Simons attempts a Layup. Contested by CJ Banchero (4.2 feet, MAN). Cole Simons misses. Rebound secured by Michael Simmons.

[10:57] Team_015 possession (Score: 20-17)
Trae Turner attempts a Midrange. Contested by Cole Simons (5.2 feet, ZONE). Trae Turner misses. Offensive rebound by CJ Banchero! CJ Banchero kicks it out.

[10:40] Team_015 possession (Score: 20-17)
CJ Banchero attempts a Layup. BLOCKED BY RUDY ANTETOKOUNMPO! Ball deflects out of bounds off CJ Banchero.

[10:25] Team_045 possession (Score: 20-17)
Cole Simons attempts a Layup. Wide open! Trae Turner is 9.3 feet away. [ZONE] COLE SIMONS MAKES IT! Assist: Rudy Antetokounmpo
Score: 22-17

[10:08] Team_015 possession (Score: 22-17)
Manu Anthony attempts a 3Pt. Heavily contested by Cole Simons (1.2 feet, ZONE)! Manu Anthony misses. Rebound secured by Zion Butler.

[09:52] Team_045 possession (Score: 22-17)
FOUL! Reach-in foul on Trae Turner during the drive. [Team fouls: 1] No free throws, side out. (Trae Turner: 1 personal fouls)

[09:40] Team_045 possession (Score: 22-17)
Cole Simons attempts a 3Pt. Contested by Manu Anthony (5.9 feet, ZONE). Cole Simons misses. Rebound secured by CJ Banchero.

[09:23] Team_015 possession (Score: 22-17)
Scottie Gasol drives and kicks out. Trae Turner attempts a 3Pt. Wide open! Zion Butler is 7.0 feet away. [MAN] Trae Turner misses. Rebound secured by Cole Simons.

[09:09] Team_045 possession (Score: 22-17)
FOUL! Reach-in foul on Trae Turner during the drive. [Team fouls: 2] No free throws, side out. (Trae Turner: 2 personal fouls)

[08:55] Team_045 possession (Score: 22-17)
Zion Butler attempts a Layup. Contested by Trae Turner (5.9 feet, ZONE). ZION BUTLER MAKES IT! Assist: Rudy Antetokounmpo
Score: 24-17

[08:39] Team_015 possession (Score: 24-17)
CJ Banchero attempts a 3Pt. Heavily contested by Cole Simons (0.5 feet, MAN)! CJ BANCHERO MAKES IT! Assist: Trae Turner
Score: 24-20

[08:22] Team_045 possession (Score: 24-20)
FOUL! Reach-in foul on Manu Anthony during the drive. [Team fouls: 3] No free throws, side out. (Manu Anthony: 1 personal fouls)

[08:04] Team_045 possession (Score: 24-20)
Rudy Antetokounmpo attempts a Midrange. Contested by Manu Anthony (4.5 feet, MAN). RUDY ANTETOKOUNMPO MAKES IT!
Score: 26-20

[07:51] Team_015 possession (Score: 26-20)
Manu Anthony attempts a 3Pt. Wide open! Rudy Antetokounmpo is 7.8 feet away. [MAN] MANU ANTHONY MAKES IT!
Score: 26-23

[07:37] Team_045 possession (Score: 26-23)
Trae Russell attempts a 3Pt. Contested by Manu Anthony (3.6 feet, ZONE). TRAE RUSSELL MAKES IT! Assist: Rudy Antetokounmpo
Score: 29-23

[07:24] Team_015 possession (Score: 29-23)
CJ Banchero loses the ball! Stripped by Cole Simons! TURNOVER! (live ball)

[07:10] Team_045 possession (Score: 29-23)
Rudy Antetokounmpo attempts a 3Pt. Contested by Manu Anthony (4.4 feet, ZONE). RUDY ANTETOKOUNMPO MAKES IT! Assist: Zion Butler
Score: 32-23

[06:53] Team_015 possession (Score: 32-23)
Trae Turner attempts a Midrange. Contested by Zion Butler (4.1 feet, MAN). Trae Turner misses. Rebound secured by Cole Simons.

[06:39] Team_045 possession (Score: 32-23)
Rudy Antetokounmpo drives, Trae Turner stays with him. Rudy Antetokounmpo attempts a Layup. Contested by Trae Turner (3.3 feet, ZONE). Rudy Antetokounmpo misses. Offensive rebound by Zion Butler! Zion Butler puts it back in!
Score: 34-23

[06:24] Team_015 possession (Score: 34-23)
Trae Turner attempts a Midrange. Wide open! DeMar Turner is 8.0 feet away. [ZONE] TRAE TURNER MAKES IT! Assist: Scottie Gasol
Score: 34-25

[06:06] Team_045 possession (Score: 34-25)
Trae Russell drives and kicks out. Zion Butler attempts a Midrange. Contested by Trae Turner (4.9 feet, MAN). ZION BUTLER MAKES IT!
Score: 36-25

[05:52] Team_015 possession (Score: 36-25)
Trae Turner commits a violation (traveling/carry)! TURNOVER! (dead ball)

[05:52] Substitution (Team_045): Rudy Antetokounmpo OUT → John Wagner IN (stamina_rule2)

[05:52] Substitution (Team_045): Trae Russell OUT → Julius James IN (stamina_rule2)

[05:52] Substitution (Team_045): Cole Simons OUT → Gary Towns IN (stamina_rule2)

[05:52] Substitution (Team_045): DeMar Turner OUT → Tim Sexton IN (stamina_rule2)

[05:52] Substitution (Team_045): Zion Butler OUT → Stephen Paul IN (stamina_rule2)

[05:52] Substitution (Team_015): Manu Anthony OUT → Dwyane Sabonis IN (stamina_rule2)

[05:52] Substitution (Team_015): Michael Simmons OUT → Paolo Jokic IN (stamina_rule2)

[05:52] Substitution (Team_015): CJ Banchero OUT → Magic Wagner IN (stamina_rule2)

[05:52] Substitution (Team_015): Scottie Gasol OUT → Rudy Paul IN (stamina_rule2)

[05:52] Substitution (Team_015): Trae Turner OUT → Allen Curry IN (stamina_rule2)

[05:38] Team_045 possession (Score: 36-25)
Tim Sexton drives and kicks out. John Wagner attempts a Midrange. Wide open! Dwyane Sabonis is 6.3 feet away. [MAN] JOHN WAGNER MAKES IT!
Score: 38-25

[05:23] Team_015 possession (Score: 38-25)
Rudy Paul attempts a 3Pt. Contested by Tim Sexton (4.3 feet, MAN). Rudy Paul misses. Offensive rebound by Allen Curry! Allen Curry's putback is no good. Offensive rebound by Allen Curry! Allen Curry kicks it out.

[05:08] Team_015 possession (Score: 38-25)
Magic Wagner attempts a 3Pt. Contested by John Wagner (5.3 feet, ZONE). Magic Wagner misses. Rebound secured by Tim Sexton.

[04:50] Team_045 possession (Score: 38-25)
Stephen Paul drives, picks up Rudy Paul. Help arrives from Dwyane Sabonis! Stephen Paul attempts a Dunk. Heavily contested by Dwyane Sabonis (0.7 feet, MAN)! STEPHEN PAUL MAKES IT!
Score: 40-25

[04:30] Team_015 possession (Score: 40-25)
Magic Wagner attempts a Layup. Contested by Stephen Paul (2.2 feet, ZONE). Magic Wagner misses. Rebound secured by Stephen Paul.

[04:12] Team_045 possession (Score: 40-25)
Stephen Paul attempts a Layup. Heavily contested by Rudy Paul (1.6 feet, ZONE)! Stephen Paul misses. Rebound secured by Allen Curry.

[03:57] Team_015 possession (Score: 40-25)
FOUL! Reach-in foul on Gary Towns during the drive. [Team fouls: 1] No free throws, side out. (Gary Towns: 1 personal fouls)

[03:43] Team_015 possession (Score: 40-25)
Rudy Paul attempts a Midrange. Contested by Gary Towns (5.8 feet, ZONE). Rudy Paul misses. Offensive rebound by Allen Curry! Allen Curry puts it back in!
Score: 40-27

[03:32] Team_045 possession (Score: 40-27)
Stephen Paul commits a violation (traveling/carry)! TURNOVER! (dead ball)

[03:19] Team_015 possession (Score: 40-27)
Magic Wagner attempts a 3Pt. Contested by Gary Towns (2.3 feet, MAN). MAGIC WAGNER MAKES IT!
Score: 40-30

[03:05] Team_045 possession (Score: 40-30)
FOUL! Reach-in foul on Magic Wagner during the drive. [Team fouls: 4] No free throws, side out. (Magic Wagner: 1 personal fouls)

[02:49] Team_045 possession (Score: 40-30)
Julius James attempts a 3Pt. Contested by Paolo Jokic (4.9 feet, MAN). Julius James misses. Rebound secured by Rudy Paul.

[02:35] Team_015 possession (Score: 40-30)
Allen Curry drives, Stephen Paul stays with him. Allen Curry attempts a Dunk. Contested by Stephen Paul (5.9 feet, ZONE). Allen Curry misses. Rebound secured by Stephen Paul.

[02:24] Team_045 possession (Score: 40-30)
Julius James attempts a 3Pt. Contested by Paolo Jokic (3.1 feet, MAN). Julius James misses. Rebound secured by Rudy Paul.

[02:08] Team_015 possession (Score: 40-30)
Dwyane Sabonis attempts a Layup. BLOCKED BY JOHN WAGNER! Ball is loose! Rebound secured by Tim Sexton.

[01:52] Team_045 possession (Score: 40-30)
John Wagner makes the 3Pt and draws the foul on Dwyane Sabonis! And-1! John Wagner to the line for 1. [BONUS: 5 team fouls] (Dwyane Sabonis: 1 personal fouls)   FT 1/1: GOOD John Wagner makes 1/1 from the line.
Score: 44-30

[01:39] Team_015 possession (Score: 44-30)
Paolo Jokic attempts a Midrange. Contested by Julius James (4.0 feet, MAN). Paolo Jokic misses. Rebound secured by Stephen Paul.

[01:25] Team_045 possession (Score: 44-30)
John Wagner attempts a Midrange. Contested by Dwyane Sabonis (4.2 feet, MAN). John Wagner misses. Rebound secured by Allen Curry.

[01:10] Team_015 possession (Score: 44-30)
Paolo Jokic drives and kicks out. Allen Curry attempts a Midrange. Contested by Stephen Paul (3.2 feet, MAN). ALLEN CURRY MAKES IT! Assist: Dwyane Sabonis
Score: 44-32

[00:56] Team_045 possession (Score: 44-32)
Stephen Paul drives to the basket... FOUL! Offensive foul on Stephen Paul! Rudy Paul drew the charge! [Team fouls: 2] (Stephen Paul: 1 personal fouls) TURNOVER! (dead ball)

[00:44] Team_015 possession (Score: 44-32)
Magic Wagner attempts a 3Pt. Contested by John Wagner (6.0 feet, ZONE). Magic Wagner misses. Rebound secured by Tim Sexton.

[00:30] Team_045 possession (Score: 44-32)
Julius James attempts a 3Pt. Wide open! Paolo Jokic is 7.1 feet away. [MAN] JULIUS JAMES MAKES IT! Assist: Stephen Paul
Score: 47-32

[00:11] Team_015 possession (Score: 47-32)
Dwyane Sabonis attempts a 3Pt. Contested by John Wagner (2.2 feet, MAN). DWYANE SABONIS MAKES IT! Assist: Paolo Jokic
Score: 47-35

================================================================================
                              2ND QUARTER COMPLETE                              
================================================================================

2ND QUARTER SCORE: Team_045 29, Team_015 18

BOX SCORE:
================================================================================

Team_045
--------------------------------------------------------------------------------
Player                MIN  PTS  REB  AST  TO      FG   FG%      3P   3P%
--------------------------------------------------------------------------------
Zion Butler            16    6    3    1   0   3/3   100.0     0/0   0.0
John Wagner             6    6    0    0   0   2/3    66.7     0/0   0.0
Trae Russell           19    5    0    0   0   2/2   100.0     0/0   0.0
Rudy Antetokounmpo     19    5    0    3   0   2/2   100.0     0/0   0.0
Julius James            6    3    0    0   0   1/3    33.3     0/0   0.0
Cole Simons            16    2    3    0   0   1/4    25.0     0/0   0.0
Stephen Paul            8    2    3    1   0   1/2    50.0     0/0   0.0
Tim Sexton              6    0    3    0   0   0/0     0.0     0/0   0.0

TEAM: FG: 12/19 (63.2%), 3PT: 4/7 (57.1%), REB: 12 (1 off, 11 def), AST: 5, TO: 2
TEAM FOULS: 2


Team_015
--------------------------------------------------------------------------------
Player                MIN  PTS  REB  AST  TO      FG   FG%      3P   3P%
--------------------------------------------------------------------------------
Allen Curry             8    4    4    0   0   2/3    66.7     0/0   0.0
CJ Banchero            19    3    2    0   0   1/4    25.0     0/0   0.0
Manu Anthony           19    3    0    0   0   1/2    50.0     0/0   0.0
Magic Wagner            6    3    0    0   0   1/4    25.0     0/0   0.0
Dwyane Sabonis          6    3    0    1   0   1/2    50.0     0/0   0.0
Trae Turner            16    2    1    1   0   1/2    50.0     0/0   0.0
Michael Simmons        19    0    1    0   0   0/0     0.0     0/0   0.0
Scottie Gasol          19    0    0    1   0   0/1     0.0     0/0   0.0
Rudy Paul               6    0    2    0   0   0/0     0.0     0/0   0.0
Paolo Jokic             6    0    0    1   0   0/1     0.0     0/0   0.0

TEAM: FG: 7/19 (36.8%), 3PT: 4/8 (50.0%), REB: 10 (3 off, 7 def), AST: 4, TO: 2
TEAM FOULS: 5 [Team_045 in BONUS]

================================================================================

================================================================================
                       3RD QUARTER - Team_045 vs Team_015                       
================================================================================

[12:00] Team_045 possession (Score: 47-35)
FOUL! Reach-in foul on Scottie Gasol during the drive. [Team fouls: 1] No free throws, side out. (Scottie Gasol: 1 personal fouls)

[11:45] Team_045 possession (Score: 47-35)
Cole Simons drives and kicks out. Trae Russell makes the Midrange and draws the foul on Michael Simmons! And-1! Trae Russell to the line for 1. [Team fouls: 2] (Michael Simmons: 1 personal fouls)   FT 1/1: GOOD Trae Russell makes 1/1 from the line.
Score: 50-35

[11:31] Team_015 possession (Score: 50-35)
FOUL! Reach-in foul on Zion Butler during the drive. [Team fouls: 1] No free throws, side out. (Zion Butler: 1 personal fouls)

[11:16] Team_015 possession (Score: 50-35)
Michael Simmons makes the 3Pt and draws the foul on DeMar Turner! And-1! Michael Simmons to the line for 1. [Team fouls: 2] (DeMar Turner: 1 personal fouls)   FT 1/1: GOOD Michael Simmons makes 1/1 from the line.
Score: 50-39

[11:00] Team_045 possession (Score: 50-39)
Trae Russell attempts a 3Pt. Contested by Manu Anthony (4.0 feet, ZONE). Trae Russell misses. Offensive rebound by DeMar Turner! DeMar Turner kicks it out.

[10:46] Team_045 possession (Score: 50-39)
Trae Russell drives, Scottie Gasol stays with him. Trae Russell attempts a Dunk. Contested by Scottie Gasol (5.5 feet, ZONE). Trae Russell misses. Rebound secured by Michael Simmons.

[10:31] Team_015 possession (Score: 50-39)
Manu Anthony drives, Zion Butler stays with him. Manu Anthony attempts a Dunk. Contested by Zion Butler (4.0 feet, ZONE). MANU ANTHONY MAKES IT!
Score: 50-41

[10:22] Team_045 possession (Score: 50-41)
DeMar Turner attempts a Midrange. Contested by Scottie Gasol (5.6 feet, MAN). DeMar Turner misses. Rebound secured by Michael Simmons.

[10:07] Team_015 possession (Score: 50-41)
Manu Anthony attempts a Layup. Heavily contested by DeMar Turner (0.5 feet, ZONE)! MANU ANTHONY MAKES IT!
Score: 50-43

[09:54] Team_045 possession (Score: 50-43)
DeMar Turner loses control! Ball rolls out of bounds! TURNOVER! (dead ball)

[09:39] Team_015 possession (Score: 50-43)
CJ Banchero drives and kicks out. Trae Turner attempts a Midrange. Contested by DeMar Turner (3.4 feet, ZONE). Trae Turner misses. Offensive rebound by Trae Turner! Trae Turner puts it back in!
Score: 50-45

[09:28] Team_045 possession (Score: 50-45)
DeMar Turner attempts a 3Pt. Contested by Scottie Gasol (4.8 feet, MAN). DeMar Turner misses. Rebound secured by Michael Simmons.

[09:12] Team_015 possession (Score: 50-45)
Scottie Gasol attempts a Layup. Contested by Zion Butler (2.4 feet, MAN). Scottie Gasol misses. Rebound secured by Cole Simons.

[08:58] Team_045 possession (Score: 50-45)
Rudy Antetokounmpo attempts a 3Pt. Contested by Manu Anthony (3.0 feet, MAN). Rudy Antetokounmpo misses. Rebound secured by CJ Banchero.

[08:46] Team_015 possession (Score: 50-45)
Michael Simmons attempts a 3Pt. Contested by Trae Russell (4.6 feet, ZONE). Michael Simmons misses. FOUL! Loose ball foul on Zion Butler during the rebound battle. [Team fouls: 3] No free throws, side out. (Zion Butler: 2 personal fouls)

[08:29] Team_015 possession (Score: 50-45)
FOUL! Holding foul on Cole Simons. [Team fouls: 4] No free throws, side out. (Cole Simons: 1 personal fouls)

[08:16] Team_015 possession (Score: 50-45)
CJ Banchero drives and kicks out. Trae Turner attempts a Midrange. Heavily contested by Cole Simons (1.3 feet, ZONE)! TRAE TURNER MAKES IT!
Score: 50-47

[08:02] Team_045 possession (Score: 50-47)
Rudy Antetokounmpo drives and kicks out. DeMar Turner attempts a 3Pt. Wide open! Manu Anthony is 7.5 feet away. [ZONE] DeMar Turner misses. FOUL! Loose ball foul on CJ Banchero during the rebound battle. [Team fouls: 3] No free throws, side out. (CJ Banchero: 1 personal fouls)

[07:48] Team_045 possession (Score: 50-47)
DeMar Turner drives, picks up Scottie Gasol. Help arrives from Michael Simmons! DeMar Turner attempts a Layup. Wide open! Michael Simmons is 6.4 feet away. [ZONE] DEMAR TURNER MAKES IT!
Score: 52-47

[07:33] Team_015 possession (Score: 52-47)
Scottie Gasol attempts a 3Pt. Heavily contested by Cole Simons (0.5 feet, ZONE)! Scottie Gasol misses. Rebound secured by Zion Butler.

[07:20] Team_045 possession (Score: 52-47)
Trae Russell attempts a 3Pt. Contested by Michael Simmons (2.6 feet, MAN). Trae Russell misses. Rebound secured by CJ Banchero.

[07:07] Team_015 possession (Score: 52-47)
Scottie Gasol makes the Layup and draws the foul on Zion Butler! And-1! Scottie Gasol to the line for 1. [BONUS: 5 team fouls] (Zion Butler: 3 personal fouls)   FT 1/1: GOOD Scottie Gasol makes 1/1 from the line.
Score: 52-50

[06:55] Team_045 possession (Score: 52-50)
Rudy Antetokounmpo attempts a 3Pt. Contested by Michael Simmons (4.7 feet, ZONE). Rudy Antetokounmpo misses. Rebound secured by Trae Turner.

[06:40] Team_015 possession (Score: 52-50)
Michael Simmons loses the ball! Stripped by Cole Simons! TURNOVER! (live ball)

[06:26] Team_045 possession (Score: 52-50)
FOUL! Holding foul on Trae Turner. [Team fouls: 4] No free throws, side out. (Trae Turner: 1 personal fouls)

[06:14] Team_045 possession (Score: 52-50)
Rudy Antetokounmpo makes the Layup and draws the foul on Michael Simmons! And-1! Rudy Antetokounmpo to the line for 1. [BONUS: 5 team fouls] (Michael Simmons: 2 personal fouls)   FT 1/1: GOOD Rudy Antetokounmpo makes 1/1 from the line.
Score: 55-50

[05:58] Team_015 possession (Score: 55-50)
CJ Banchero attempts a 3Pt. Heavily contested by Cole Simons (1.3 feet, ZONE)! CJ Banchero misses. Rebound secured by Cole Simons.

[05:46] Team_045 possession (Score: 55-50)
DeMar Turner drives to the basket... DeMar Turner loses the ball! Stripped by Scottie Gasol! TURNOVER! (live ball)

[05:33] Team_015 possession (Score: 55-50)
Scottie Gasol attempts a 3Pt. Contested by DeMar Turner (5.6 feet, MAN). SCOTTIE GASOL MAKES IT!
Score: 55-53

[05:13] Team_045 possession (Score: 55-53)
DeMar Turner drives and kicks out. Rudy Antetokounmpo attempts a 3Pt. Wide open! Manu Anthony is 7.6 feet away. [MAN] Rudy Antetokounmpo misses. Rebound secured by Michael Simmons.

[04:59] Team_015 possession (Score: 55-53)
Trae Turner drives and kicks out. Michael Simmons attempts a 3Pt. Contested by Cole Simons (2.8 feet, ZONE). Michael Simmons misses. Rebound secured by Zion Butler.

[04:48] Team_045 possession (Score: 55-53)
Trae Russell drives to the basket... Trae Russell commits a violation (traveling/carry)! TURNOVER! (dead ball)

[04:31] Team_015 possession (Score: 55-53)
Manu Anthony attempts a 3Pt. Contested by Cole Simons (2.0 feet, ZONE). MANU ANTHONY MAKES IT! Assist: Trae Turner
Score: 55-56

[04:15] Team_045 possession (Score: 55-56)
Cole Simons attempts a 3Pt. Contested by Manu Anthony (5.3 feet, ZONE). Cole Simons misses. Rebound secured by CJ Banchero.

[04:03] Team_015 possession (Score: 55-56)
CJ Banchero attempts a 3Pt. Contested by Cole Simons (3.5 feet, MAN). CJ Banchero misses. Offensive rebound by CJ Banchero! CJ Banchero kicks it out.

[03:49] Team_015 possession (Score: 55-56)
CJ Banchero attempts a 3Pt. Contested by Cole Simons (3.5 feet, ZONE). CJ BANCHERO MAKES IT! Assist: Manu Anthony
Score: 55-59

[03:32] Team_045 possession (Score: 55-59)
Trae Russell attempts a Midrange. Contested by Michael Simmons (2.1 feet, MAN). TRAE RUSSELL MAKES IT!
Score: 57-59

[03:15] Team_015 possession (Score: 57-59)
CJ Banchero attempts a Layup. BLOCKED BY COLE SIMONS! Ball is loose! Rebound secured by DeMar Turner.

[02:58] Team_045 possession (Score: 57-59)
Trae Russell attempts a 3Pt. Contested by Manu Anthony (4.2 feet, ZONE). Trae Russell misses. Rebound secured by CJ Banchero.

[02:46] Team_015 possession (Score: 57-59)
Manu Anthony attempts a 3Pt. Contested by Trae Russell (3.9 feet, ZONE). MANU ANTHONY MAKES IT! Assist: Trae Turner
Score: 57-62

[02:32] Team_045 possession (Score: 57-62)
Zion Butler attempts a Layup. Contested by Trae Turner (3.9 feet, MAN). ZION BUTLER MAKES IT!
Score: 59-62

[02:18] Team_015 possession (Score: 59-62)
Scottie Gasol drives and kicks out. Scottie Gasol attempts a 3Pt. Contested by DeMar Turner (5.6 feet, MAN). Scottie Gasol misses. Offensive rebound by CJ Banchero! CJ Banchero kicks it out.

[02:02] Team_015 possession (Score: 59-62)
Manu Anthony attempts a 3Pt. Contested by Cole Simons (3.9 feet, ZONE). MANU ANTHONY MAKES IT! Assist: CJ Banchero
Score: 59-65

[01:45] Team_045 possession (Score: 59-65)
Rudy Antetokounmpo attempts a 3Pt. Heavily contested by Scottie Gasol (1.1 feet, ZONE)! Rudy Antetokounmpo misses. FOUL! Loose ball foul on CJ Banchero during the rebound battle. [IN THE BONUS! 6 team fouls] Zion Butler to the line for 2 free throws. (CJ Banchero: 2 personal fouls)   FT 1/2: GOOD   FT 2/2: GOOD Zion Butler makes 2/2 from the line.
Score: 61-65

[01:33] Team_015 possession (Score: 61-65)
Scottie Gasol makes the Dunk and draws the foul on DeMar Turner! And-1! Scottie Gasol to the line for 1. [BONUS: 6 team fouls] (DeMar Turner: 2 personal fouls)   FT 1/1: GOOD Scottie Gasol makes 1/1 from the line.
Score: 61-68

[01:23] Team_045 possession (Score: 61-68)
Trae Russell attempts a 3Pt. Heavily contested by Manu Anthony (1.5 feet, ZONE)! Trae Russell misses. Rebound secured by Michael Simmons.

[01:10] Team_015 possession (Score: 61-68)
FOUL! Shooting foul on Zion Butler. Trae Turner to the line for 2 free throws. [BONUS: 7 team fouls] (Zion Butler: 4 personal fouls)   FT 1/2: GOOD   FT 2/2: GOOD Trae Turner makes 2/2 from the line.
Score: 61-70

[00:55] Team_045 possession (Score: 61-70)
Trae Russell attempts a Layup. BLOCKED BY SCOTTIE GASOL! Ball is loose! Rebound secured by CJ Banchero.

[00:40] Team_015 possession (Score: 61-70)
Manu Anthony throws a bad pass! Stolen by Rudy Antetokounmpo! TURNOVER! (live ball)

[00:26] Team_045 possession (Score: 61-70)
Trae Russell attempts a 3Pt. Contested by Manu Anthony (6.0 feet, ZONE). Trae Russell misses. Rebound secured by Trae Turner.

[00:09] Team_015 possession (Score: 61-70)
Trae Turner makes the Layup and draws the foul on Zion Butler! And-1! Trae Turner to the line for 1. [BONUS: 8 team fouls] (Zion Butler: 5 personal fouls)   FT 1/1: GOOD Trae Turner makes 1/1 from the line.
Score: 61-73

================================================================================
                              3RD QUARTER COMPLETE                              
================================================================================

3RD QUARTER SCORE: Team_045 14, Team_015 38

BOX SCORE:
================================================================================

Team_045
--------------------------------------------------------------------------------
Player                MIN  PTS  REB  AST  TO      FG   FG%      3P   3P%
--------------------------------------------------------------------------------
Trae Russell           31    5    0    0   0   2/8    25.0     0/0   0.0
Zion Butler            28    4    3    0   0   2/2   100.0     0/0   0.0
Rudy Antetokounmpo     31    3    0    0   0   1/3    33.3     0/0   0.0
DeMar Turner           31    2    2    0   0   1/4    25.0     0/0   0.0
Cole Simons            28    0    2    0   0   0/1     0.0     0/0   0.0

TEAM: FG: 6/18 (33.3%), 3PT: 1/9 (11.1%), REB: 7 (2 off, 5 def), AST: 0, TO: 3
TEAM FOULS: 8 [Team_015 in BONUS]


Team_015
--------------------------------------------------------------------------------
Player                MIN  PTS  REB  AST  TO      FG   FG%      3P   3P%
--------------------------------------------------------------------------------
Manu Anthony           31   13    0    1   0   5/5   100.0     0/0   0.0
Trae Turner            28    9    4    2   0   4/5    80.0     0/0   0.0
Scottie Gasol          31    9    0    0   0   3/5    60.0     0/0   0.0
Michael Simmons        31    4    5    0   0   1/1   100.0     0/0   0.0
CJ Banchero            31    3    7    1   0   1/3    33.3     0/0   0.0

TEAM: FG: 14/19 (73.7%), 3PT: 6/8 (75.0%), REB: 16 (4 off, 12 def), AST: 4, TO: 2
TEAM FOULS: 6 [Team_045 in BONUS]

================================================================================

================================================================================
                       4TH QUARTER - Team_045 vs Team_015                       
================================================================================

[12:00] Substitution (Team_045): Rudy Antetokounmpo OUT (stamina: 70) → John Wagner IN (comeback_detected)

[12:00] Substitution (Team_015): Manu Anthony OUT (stamina: 70) → Dwyane Sabonis IN (comeback_detected)

[12:00] Team_045 possession (Score: 61-73)
John Wagner attempts a 3Pt. Contested by CJ Banchero (3.2 feet, ZONE). JOHN WAGNER MAKES IT! Assist: DeMar Turner
Score: 64-73

[11:44] Team_015 possession (Score: 64-73)
CJ Banchero attempts a 3Pt. Contested by Cole Simons (5.5 feet, ZONE). CJ BANCHERO MAKES IT! Assist: Scottie Gasol
Score: 64-76

[11:33] Team_045 possession (Score: 64-76)
John Wagner drives to the basket... FOUL! Offensive foul on John Wagner! Dwyane Sabonis drew the charge! [Team fouls: 1] (John Wagner: 1 personal fouls) TURNOVER! (dead ball)

[11:22] Team_015 possession (Score: 64-76)
Trae Turner attempts a Midrange. Wide open! DeMar Turner is 6.2 feet away. [ZONE] Trae Turner misses. Rebound secured by Zion Butler.

[11:07] Team_045 possession (Score: 64-76)
Trae Russell attempts a Midrange. Contested by Michael Simmons (3.2 feet, MAN). Trae Russell misses. Rebound secured by Trae Turner.

[10:53] Team_015 possession (Score: 64-76)
Michael Simmons attempts a Layup. BLOCKED BY ZION BUTLER! Ball deflects out of bounds off Michael Simmons.

[10:36] Team_045 possession (Score: 64-76)
Zion Butler makes the Dunk and draws the foul on Trae Turner! And-1! Zion Butler to the line for 1. [Team fouls: 1] (Trae Turner: 1 personal fouls)   FT 1/1: GOOD Zion Butler makes 1/1 from the line.
Score: 67-76

[10:18] Team_015 possession (Score: 67-76)
Trae Turner drives to the basket... Trae Turner throws a bad pass! Stolen by Zion Butler! TURNOVER! (live ball)

[10:09] Team_045 possession (Score: 67-76)
Cole Simons attempts a Layup. Heavily contested by Scottie Gasol (1.0 feet, ZONE)! Cole Simons misses. Rebound secured by CJ Banchero.

[09:56] Team_015 possession (Score: 67-76)
Scottie Gasol attempts a 3Pt. Contested by DeMar Turner (3.0 feet, MAN). Scottie Gasol misses. Rebound secured by DeMar Turner.

[09:44] Team_045 possession (Score: 67-76)
Trae Russell attempts a Layup. Heavily contested by Michael Simmons (0.5 feet, MAN)! TRAE RUSSELL MAKES IT!
Score: 69-76

[09:32] Team_015 possession (Score: 69-76)
Trae Turner attempts a Midrange. Contested by Zion Butler (3.2 feet, MAN). TRAE TURNER MAKES IT! Assist: Scottie Gasol
Score: 69-78

[09:17] Team_045 possession (Score: 69-78)
Cole Simons throws a bad pass! Stolen by CJ Banchero! TURNOVER! (live ball)

[08:59] Team_015 possession (Score: 69-78)
Scottie Gasol attempts a 3Pt. Heavily contested by DeMar Turner (1.9 feet, MAN)! Scottie Gasol misses. Rebound secured by Cole Simons.

[08:43] Team_045 possession (Score: 69-78)
Zion Butler drives to the basket... Zion Butler throws a bad pass! Stolen by Scottie Gasol! TURNOVER! (live ball)

[08:29] Team_015 possession (Score: 69-78)
Trae Turner throws a bad pass out of bounds! TURNOVER! (dead ball)

[08:29] Substitution (Team_045): Trae Russell OUT → Julius James IN (stamina_rule2)

[08:29] Substitution (Team_045): Cole Simons OUT → Gary Towns IN (stamina_rule2)

[08:29] Substitution (Team_045): DeMar Turner OUT → Tim Sexton IN (stamina_rule2)

[08:29] Substitution (Team_045): Zion Butler OUT → Stephen Paul IN (stamina_rule2)

[08:29] Substitution (Team_015): Michael Simmons OUT → Paolo Jokic IN (stamina_rule2)

[08:29] Substitution (Team_015): CJ Banchero OUT → Magic Wagner IN (stamina_rule2)

[08:29] Substitution (Team_015): Scottie Gasol OUT → Rudy Paul IN (stamina_rule2)

[08:29] Substitution (Team_015): Trae Turner OUT → Allen Curry IN (stamina_rule2)

[08:14] Team_045 possession (Score: 69-78)
Tim Sexton drives and kicks out. John Wagner attempts a 3Pt. Contested by Dwyane Sabonis (5.5 feet, MAN). John Wagner misses. FOUL! Loose ball foul on Rudy Paul during the rebound battle. [Team fouls: 2] No free throws, side out. (Rudy Paul: 1 personal fouls)

[08:02] Team_045 possession (Score: 69-78)
Stephen Paul attempts a 3Pt. Contested by Rudy Paul (4.3 feet, ZONE). Stephen Paul misses. FOUL! Loose ball foul on Rudy Paul during the rebound battle. [Team fouls: 3] No free throws, side out. (Rudy Paul: 2 personal fouls)

[07:48] Team_045 possession (Score: 69-78)
FOUL! Shooting foul on Dwyane Sabonis. John Wagner to the line for 2 free throws. [Team fouls: 4] (Dwyane Sabonis: 1 personal fouls)   FT 1/2: GOOD   FT 2/2: GOOD John Wagner makes 2/2 from the line.
Score: 71-78

[07:33] Team_015 possession (Score: 71-78)
FOUL! Offensive foul on Rudy Paul! Tim Sexton drew the charge! [Team fouls: 5] (Rudy Paul: 3 personal fouls) TURNOVER! (dead ball)

[07:16] Team_045 possession (Score: 71-78)
FOUL! Reach-in foul on Rudy Paul during the drive. [IN THE BONUS! 6 team fouls] Stephen Paul to the line for 2 free throws. (Rudy Paul: 4 personal fouls)   FT 1/2: GOOD   FT 2/2: MISS Stephen Paul makes 1/2 from the line. Offensive rebound by Tim Sexton! Tim Sexton kicks it out.
Score: 72-78

[06:59] Team_045 possession (Score: 72-78)
Stephen Paul attempts a Midrange. Contested by Paolo Jokic (2.6 feet, ZONE). Stephen Paul misses. Offensive rebound by Julius James! Julius James kicks it out.

[06:43] Team_045 possession (Score: 72-78)
FOUL! Shooting foul on Rudy Paul. Stephen Paul to the line for 2 free throws. [BONUS: 7 team fouls] (Rudy Paul: 5 personal fouls)   FT 1/2: GOOD   FT 2/2: MISS Stephen Paul makes 1/2 from the line. Rebound secured by Rudy Paul.
Score: 73-78

[06:33] Team_015 possession (Score: 73-78)
FOUL! Reach-in foul on John Wagner during the drive. [Team fouls: 2] No free throws, side out. (John Wagner: 2 personal fouls)

[06:17] Team_015 possession (Score: 73-78)
Allen Curry makes the Layup and draws the foul on Stephen Paul! And-1! Allen Curry to the line for 1. [Team fouls: 3] (Stephen Paul: 1 personal fouls)   FT 1/1: GOOD Allen Curry makes 1/1 from the line.
Score: 73-81

[06:06] Team_045 possession (Score: 73-81)
FOUL! Reach-in foul on Rudy Paul during the drive. [IN THE BONUS! 8 team fouls] Stephen Paul to the line for 2 free throws. (Rudy Paul: 6 personal fouls) Rudy Paul FOULS OUT!   FT 1/2: GOOD   FT 2/2: GOOD Stephen Paul makes 2/2 from the line.
Score: 75-81

[06:06] Substitution (Team_015): Rudy Paul OUT (stamina: 93) → Manu Anthony IN (foul_out)

[05:51] Team_015 possession (Score: 75-81)
Magic Wagner attempts a 3Pt. Contested by John Wagner (4.0 feet, ZONE). Magic Wagner misses. Offensive rebound by Allen Curry! Allen Curry's putback is no good. Rebound secured by Julius James.

[05:36] Team_045 possession (Score: 75-81)
Julius James attempts a 3Pt. Wide open! Manu Anthony is 6.3 feet away. [ZONE] JULIUS JAMES MAKES IT! Assist: Tim Sexton
Score: 78-81

[05:22] Team_015 possession (Score: 78-81)
Manu Anthony drives, John Wagner stays with him. Manu Anthony attempts a Layup. Contested by John Wagner (4.0 feet, MAN). MANU ANTHONY MAKES IT!
Score: 78-83

[05:11] Team_045 possession (Score: 78-83)
Gary Towns drives, picks up Allen Curry. Help arrives from Dwyane Sabonis! Gary Towns attempts a Dunk. Contested by Dwyane Sabonis (2.9 feet, ZONE). Gary Towns misses. Offensive rebound by Julius James! Julius James kicks it out.

[04:55] Team_045 possession (Score: 78-83)
John Wagner drives, picks up Allen Curry. Help arrives from Dwyane Sabonis! John Wagner attempts a Layup. Contested by Dwyane Sabonis (5.9 feet, ZONE). JOHN WAGNER MAKES IT! Assist: Julius James
Score: 80-83

[04:39] Team_015 possession (Score: 80-83)
Magic Wagner attempts a 3Pt. Contested by John Wagner (5.6 feet, ZONE). Magic Wagner misses. Rebound secured by Tim Sexton.

[04:26] Team_045 possession (Score: 80-83)
Julius James attempts a 3Pt. Contested by Manu Anthony (2.6 feet, ZONE). Julius James misses. Rebound secured by Dwyane Sabonis.

[04:12] Team_015 possession (Score: 80-83)
Allen Curry makes the Layup and draws the foul on Stephen Paul! And-1! Allen Curry to the line for 1. [Team fouls: 4] (Stephen Paul: 2 personal fouls)   FT 1/1: GOOD Allen Curry makes 1/1 from the line.
Score: 80-86

[04:01] Team_045 possession (Score: 80-86)
Julius James attempts a 3Pt. Wide open! Paolo Jokic is 7.6 feet away. [MAN] Julius James misses. Offensive rebound by Julius James! Julius James kicks it out.

[03:47] Team_045 possession (Score: 80-86)
Gary Towns makes the Dunk and draws the foul on Allen Curry! And-1! Gary Towns to the line for 1. [BONUS: 9 team fouls] (Allen Curry: 1 personal fouls)   FT 1/1: GOOD Gary Towns makes 1/1 from the line.
Score: 83-86

[03:32] Team_015 possession (Score: 83-86)
Manu Anthony commits a violation (traveling/carry)! TURNOVER! (dead ball)

[03:15] Team_045 possession (Score: 83-86)
Gary Towns attempts a 3Pt. Contested by Manu Anthony (4.7 feet, ZONE). Gary Towns misses. Rebound secured by Dwyane Sabonis.

[02:57] Team_015 possession (Score: 83-86)
Dwyane Sabonis throws a bad pass! Stolen by John Wagner! TURNOVER! (live ball)

[02:45] Team_045 possession (Score: 83-86)
Tim Sexton attempts a Midrange. Contested by Paolo Jokic (4.9 feet, ZONE). TIM SEXTON MAKES IT!
Score: 85-86

[02:30] Team_015 possession (Score: 85-86)
Manu Anthony attempts a 3Pt. Contested by John Wagner (4.4 feet, MAN). MANU ANTHONY MAKES IT! Assist: Paolo Jokic
Score: 85-89

[02:16] Team_045 possession (Score: 85-89)
Gary Towns attempts a 3Pt. Contested by Magic Wagner (3.7 feet, MAN). GARY TOWNS MAKES IT! Assist: John Wagner
Score: 88-89

[02:04] Team_015 possession (Score: 88-89)
Paolo Jokic attempts a Midrange. Contested by Julius James (2.8 feet, MAN). PAOLO JOKIC MAKES IT!
Score: 88-91

[01:53] Team_045 possession (Score: 88-91)
Julius James attempts a 3Pt. Contested by Paolo Jokic (4.6 feet, MAN). JULIUS JAMES MAKES IT! Assist: Tim Sexton
Score: 91-91

[01:40] Team_015 possession (Score: 91-91)
Allen Curry drives and kicks out. Allen Curry attempts a 3Pt. Contested by Stephen Paul (3.4 feet, MAN). Allen Curry misses. Offensive rebound by Allen Curry! Allen Curry puts it back in!
Score: 91-93

[01:23] Team_045 possession (Score: 91-93)
John Wagner makes the Layup and draws the foul on Allen Curry! And-1! John Wagner to the line for 1. [BONUS: 10 team fouls] (Allen Curry: 2 personal fouls)   FT 1/1: GOOD John Wagner makes 1/1 from the line.
Score: 94-93

[01:08] Team_015 possession (Score: 94-93)
Allen Curry attempts a Layup. Wide open! Stephen Paul is 7.1 feet away. [MAN] ALLEN CURRY MAKES IT!
Score: 94-95

[00:55] Team_045 possession (Score: 94-95)
Tim Sexton drives to the basket... FOUL! Offensive foul on Tim Sexton! Allen Curry drew the charge! [Team fouls: 5] (Tim Sexton: 1 personal fouls) TURNOVER! (dead ball)

[00:41] Team_015 possession (Score: 94-95)
FOUL! Shooting foul on Stephen Paul. Allen Curry to the line for 2 free throws. [BONUS: 6 team fouls] (Stephen Paul: 3 personal fouls)   FT 1/2: GOOD   FT 2/2: GOOD Allen Curry makes 2/2 from the line.
Score: 94-97

[00:29] Team_045 possession (Score: 94-97)
Julius James attempts a Layup. BLOCKED BY PAOLO JOKIC! Ball is loose! Rebound secured by Paolo Jokic.

[00:15] Team_015 possession (Score: 94-97)
Magic Wagner attempts a 3Pt. Contested by Tim Sexton (5.7 feet, ZONE). Magic Wagner misses. Rebound secured by Julius James.

[00:02] Team_045 possession (Score: 94-97)
Julius James attempts a Layup. Contested by Paolo Jokic (5.5 feet, MAN). JULIUS JAMES MAKES IT! Assist: John Wagner
Score: 96-97

================================================================================
                              4TH QUARTER COMPLETE                              
================================================================================

4TH QUARTER SCORE: Team_045 35, Team_015 24

BOX SCORE:
================================================================================

Team_045
--------------------------------------------------------------------------------
Player                MIN  PTS  REB  AST  TO      FG   FG%      3P   3P%
--------------------------------------------------------------------------------
John Wagner            18   10    0    2   0   4/4   100.0     0/0   0.0
Julius James           14    8    5    1   0   3/5    60.0     0/0   0.0
Gary Towns             17    6    0    0   0   2/3    66.7     0/0   0.0
Zion Butler            32    3    1    0   0   1/1   100.0     0/0   0.0
Trae Russell           34    2    0    0   0   1/2    50.0     0/0   0.0
Tim Sexton             14    2    4    2   0   1/1   100.0     0/0   0.0
Stephen Paul           17    2    0    0   0   1/2    50.0     0/0   0.0
DeMar Turner           34    0    1    1   0   0/0     0.0     0/0   0.0
Cole Simons            32    0    1    0   0   0/1     0.0     0/0   0.0

TEAM: FG: 13/19 (68.4%), 3PT: 4/6 (66.7%), REB: 11 (6 off, 5 def), AST: 6, TO: 4
TEAM FOULS: 6 [Team_015 in BONUS]


Team_015
--------------------------------------------------------------------------------
Player                MIN  PTS  REB  AST  TO      FG   FG%      3P   3P%
--------------------------------------------------------------------------------
Allen Curry            17   12    1    0   0   5/5   100.0     0/0   0.0
Manu Anthony           37    5    0    0   0   2/2   100.0     0/0   0.0
CJ Banchero            34    3    1    0   0   1/1   100.0     0/0   0.0
Trae Turner            32    2    1    0   0   1/2    50.0     0/0   0.0
Paolo Jokic            14    2    1    1   0   1/1   100.0     0/0   0.0
Scottie Gasol          34    0    0    2   0   0/2     0.0     0/0   0.0
Michael Simmons        34    0    0    0   0   0/1     0.0     0/0   0.0
Rudy Paul               8    0    1    0   0   0/0     0.0     0/0   0.0
Magic Wagner           14    0    0    0   0   0/3     0.0     0/0   0.0
Dwyane Sabonis         18    0    2    0   0   0/0     0.0     0/0   0.0

TEAM: FG: 10/17 (58.8%), 3PT: 2/7 (28.6%), REB: 8 (2 off, 6 def), AST: 3, TO: 5
TEAM FOULS: 10 [Team_045 in BONUS]

================================================================================

================================================================================
                               FULL GAME COMPLETE                               
================================================================================

FINAL SCORE: Team_045 96, Team_015 97

SCORING BY QUARTER:
--------------------------------------------------------------------------------
Team                     Q1     Q2     Q3     Q4    FINAL
--------------------------------------------------------------------------------
Team_045                 18     29     14     35       96
Team_015                 17     18     38     24       97
--------------------------------------------------------------------------------

FULL GAME BOX SCORE:
================================================================================

Team_045
--------------------------------------------------------------------------------
Player                MIN  PTS  REB  AST  TO      FG   FG%      3P   3P%      FT STL BLK
--------------------------------------------------------------------------------
Trae Russell           34   14    0    0   3   7/15   46.7   1/5    20.0   3/3     0   0
DeMar Turner           34    7    8    1   3   4/9    44.4   0/3     0.0   5/6     0   0
Cole Simons            32    2    8    0   1   3/11   27.3   1/5    20.0   0/0     2   1
Zion Butler            32   17   11    2   2   4/6    66.7   0/0     0.0   3/3     1   1
Rudy Antetokounmpo     31   10    0    4   1   6/10   60.0   2/6    33.3   1/1     3   1
John Wagner            18   16    0    2   0   5/6    83.3   2/2   100.0   4/4     1   1
Gary Towns             17   11    0    0   0   3/5    60.0   1/3    33.3   3/3     0   0
Stephen Paul           17    4    4    2   1   2/4    50.0   0/0     0.0   4/6     0   0
Julius James           14   11    5    1   2   4/8    50.0   3/6    50.0   0/0     0   0
Tim Sexton             14    2    7    2   0   2/2   100.0   0/0     0.0   0/0     0   0

TEAM: FG: 40/76 (52.6%), 3PT: 10/30 (33.3%), REB: 40 (11 off, 29 def), AST: 14, TO: 13


Team_015
--------------------------------------------------------------------------------
Player                MIN  PTS  REB  AST  TO      FG   FG%      3P   3P%      FT STL BLK
--------------------------------------------------------------------------------
Manu Anthony           37   23    0    2   4   9/11   81.8   5/7    71.4   2/2     1   0
Michael Simmons        34    4    7    1   2   1/3    33.3   1/1   100.0   1/1     0   0
CJ Banchero            34   18   15    1   2   8/15   53.3   6/9    66.7   0/0     2   0
Scottie Gasol          34   13    0    4   0   6/14   42.9   1/5    20.0   2/2     2   1
Trae Turner            32   13   10    3   5   4/10   40.0   0/0     0.0   3/3     0   1
Dwyane Sabonis         18    3    2    1   1   1/2    50.0   1/1   100.0   0/0     0   0
Allen Curry            17   18    7    1   0   5/6    83.3   0/0     0.0   4/4     0   0
Paolo Jokic            14    2    1    2   0   2/3    66.7   0/0     0.0   0/0     0   1
Magic Wagner           14    3    0    0   0   1/7    14.3   1/6    16.7   0/0     0   0
Rudy Paul               8    0    3    0   1   1/1   100.0   0/0     0.0   0/0     0   0

TEAM: FG: 38/72 (52.8%), 3PT: 15/29 (51.7%), REB: 48 (12 off, 36 def), AST: 15, TO: 15

================================================================================
