================================================================================
                        FULL GAME - Team_049 vs Team_021                        
================================================================================

================================================================================
                       1ST QUARTER - Team_049 vs Team_021                       
================================================================================

[12:00] Team_049 possession (Score: 0-0)
Shai Bird attempts a 3Pt. Contested by Kyrie Wagner (4.4 feet, ZONE). Shai Bird misses. Rebound secured by Zach Carter.

[11:45] Team_021 possession (Score: 0-0)
Kyrie Wagner attempts a Layup. Contested by De'Aaron Allen (4.3 feet, MAN). KYRIE WAGNER MAKES IT!
Score: 0-2

[11:28] Team_049 possession (Score: 0-2)
De'Aaron Allen attempts a 3Pt. Contested by Kyrie Wagner (3.8 feet, ZONE). De'Aaron Allen misses. Rebound secured by Kyrie Leonard.

[11:16] Team_021 possession (Score: 0-2)
Kyrie Leonard attempts a 3Pt. Contested by Shai Bird (3.7 feet, MAN). KYRIE LEONARD MAKES IT! Assist: Anthony Oladipo
Score: 0-5

[10:59] Team_049 possession (Score: 0-5)
Jimmy Griffin attempts a 3Pt. Contested by Karl Bridges (5.6 feet, MAN). Jimmy Griffin misses. FOUL! Loose ball foul on Kyrie Leonard during the rebound battle. [Team fouls: 1] No free throws, side out. (Kyrie Leonard: 1 personal fouls)

[10:45] Team_049 possession (Score: 0-5)
Shai Bird attempts a Midrange. Contested by Anthony Oladipo (5.1 feet, ZONE). Shai Bird misses. Rebound secured by Zach Carter.

[10:33] Team_021 possession (Score: 0-5)
Kyrie Leonard attempts a 3Pt. Contested by Shai Bird (3.7 feet, ZONE). Kyrie Leonard misses. Rebound secured by Jimmy Griffin.

[10:18] Team_049 possession (Score: 0-5)
FOUL! Offensive foul on Shai Bird! Kyrie Leonard drew the charge! [Team fouls: 1] (Shai Bird: 1 personal fouls) TURNOVER! (dead ball)

[10:02] Team_021 possession (Score: 0-5)
Karl Bridges attempts a 3Pt. Contested by Jimmy Griffin (4.6 feet, MAN). Karl Bridges misses. Rebound secured by De'Aaron Allen.

[09:50] Team_049 possession (Score: 0-5)
Ja Oladipo attempts a 3Pt. Contested by Anthony Oladipo (4.8 feet, MAN). JA OLADIPO MAKES IT! Assist: Shai Mobley
Score: 3-5

[09:35] Team_021 possession (Score: 3-5)
Kyrie Wagner drives and kicks out. Zach Carter attempts a 3Pt. Contested by Shai Mobley (4.2 feet, MAN). ZACH CARTER MAKES IT! Assist: Kyrie Leonard
Score: 3-8

[09:24] Team_049 possession (Score: 3-8)
De'Aaron Allen attempts a 3Pt. Contested by Kyrie Wagner (3.8 feet, ZONE). De'Aaron Allen misses. Offensive rebound by Shai Mobley! Shai Mobley puts it back in!
Score: 5-8

[09:10] Team_021 possession (Score: 5-8)
Kyrie Wagner drives, picks up De'Aaron Allen. Help arrives from Ja Oladipo! Kyrie Wagner attempts a Dunk. Contested by Ja Oladipo (4.3 feet, ZONE). KYRIE WAGNER MAKES IT!
Score: 5-10

[08:56] Team_049 possession (Score: 5-10)
Ja Oladipo attempts a Midrange. Contested by Anthony Oladipo (4.8 feet, MAN). JA OLADIPO MAKES IT! Assist: De'Aaron Allen
Score: 7-10

[08:45] Team_021 possession (Score: 7-10)
Zach Carter attempts a Midrange. Contested by Ja Oladipo (4.7 feet, ZONE). Zach Carter misses. Rebound secured by Shai Mobley.

[08:30] Team_049 possession (Score: 7-10)
Shai Mobley attempts a Midrange. Contested by Zach Carter (4.3 feet, MAN). Shai Mobley misses. Rebound secured by Anthony Oladipo.

[08:15] Team_021 possession (Score: 7-10)
Kyrie Leonard drives, Shai Bird stays with him. Kyrie Leonard attempts a Dunk. Contested by Shai Bird (3.7 feet, MAN). KYRIE LEONARD MAKES IT!
Score: 7-12

[08:02] Team_049 possession (Score: 7-12)
Jimmy Griffin attempts a 3Pt. Contested by Karl Bridges (5.6 feet, MAN). Jimmy Griffin misses. Rebound secured by Zach Carter.

[07:47] Team_021 possession (Score: 7-12)
Kyrie Wagner makes the Dunk and draws the foul on Ja Oladipo! And-1! Kyrie Wagner to the line for 1. [Team fouls: 2] (Ja Oladipo: 1 personal fouls)   FT 1/1: GOOD Kyrie Wagner makes 1/1 from the line.
Score: 7-15

[07:36] Team_049 possession (Score: 7-15)
Jimmy Griffin attempts a 3Pt. Contested by Karl Bridges (5.6 feet, ZONE). Jimmy Griffin misses. Rebound secured by Zach Carter.

[07:21] Team_021 possession (Score: 7-15)
Anthony Oladipo attempts a 3Pt. Contested by Ja Oladipo (4.2 feet, ZONE). Anthony Oladipo misses. Rebound secured by Jimmy Griffin.

[07:04] Team_049 possession (Score: 7-15)
Shai Bird attempts a 3Pt. Contested by Kyrie Leonard (5.0 feet, ZONE). SHAI BIRD MAKES IT! Assist: Ja Oladipo
Score: 10-15

[06:49] Team_021 possession (Score: 10-15)
Karl Bridges attempts a 3Pt. Contested by Ja Oladipo (4.1 feet, ZONE). Karl Bridges misses. Rebound secured by Jimmy Griffin.

[06:35] Team_049 possession (Score: 10-15)
Shai Mobley drives, picks up Zach Carter. Help arrives from Kyrie Leonard! Shai Mobley attempts a Dunk. Contested by Kyrie Leonard (4.3 feet, ZONE). Shai Mobley misses. Rebound secured by Anthony Oladipo.

[06:17] Team_021 possession (Score: 10-15)
FOUL! Shooting foul on De'Aaron Allen. Kyrie Wagner to the line for 2 free throws. [Team fouls: 3] (De'Aaron Allen: 1 personal fouls)   FT 1/2: GOOD   FT 2/2: GOOD Kyrie Wagner makes 2/2 from the line.
Score: 10-17

[06:00] Team_049 possession (Score: 10-17)
FOUL! Shooting foul on Kyrie Wagner. Ja Oladipo to the line for 2 free throws. [Team fouls: 2] (Kyrie Wagner: 1 personal fouls)   FT 1/2: GOOD   FT 2/2: GOOD Ja Oladipo makes 2/2 from the line.
Score: 12-17

[05:45] Team_021 possession (Score: 12-17)
FOUL! Reach-in foul on De'Aaron Allen during the drive. [Team fouls: 4] No free throws, side out. (De'Aaron Allen: 2 personal fouls)

[05:31] Team_021 possession (Score: 12-17)
Zach Carter attempts a Midrange. Contested by Ja Oladipo (4.7 feet, ZONE). ZACH CARTER MAKES IT!
Score: 12-19

[05:18] Team_049 possession (Score: 12-19)
Shai Bird drives to the basket... Shai Bird throws a bad pass! Stolen by Kyrie Leonard! TURNOVER! (live ball)

[05:02] Team_021 possession (Score: 12-19)
Anthony Oladipo attempts a Layup. BLOCKED BY JA OLADIPO! Ball is loose! Rebound secured by Jimmy Griffin.

[04:52] Team_049 possession (Score: 12-19)
Shai Mobley makes the Dunk and draws the foul on Zach Carter! And-1! Shai Mobley to the line for 1. [Team fouls: 3] (Zach Carter: 1 personal fouls)   FT 1/1: GOOD Shai Mobley makes 1/1 from the line.
Score: 15-19

[04:36] Team_021 possession (Score: 15-19)
Karl Bridges attempts a 3Pt. Contested by Ja Oladipo (4.2 feet, ZONE). Karl Bridges misses. Rebound secured by Jimmy Griffin.

[04:19] Team_049 possession (Score: 15-19)
Ja Oladipo attempts a 3Pt. Contested by Kyrie Leonard (4.9 feet, ZONE). JA OLADIPO MAKES IT!
Score: 18-19

[04:05] Team_021 possession (Score: 18-19)
FOUL! Shooting foul on Ja Oladipo. Kyrie Leonard to the line for 3 free throws. [BONUS: 5 team fouls] (Ja Oladipo: 2 personal fouls)   FT 1/3: GOOD   FT 2/3: GOOD   FT 3/3: GOOD Kyrie Leonard makes 3/3 from the line.
Score: 18-22

[03:53] Team_049 possession (Score: 18-22)
FOUL! Shooting foul on Zach Carter. Shai Mobley to the line for 2 free throws. [Team fouls: 4] (Zach Carter: 2 personal fouls)   FT 1/2: GOOD   FT 2/2: GOOD Shai Mobley makes 2/2 from the line.
Score: 20-22

[03:38] Team_021 possession (Score: 20-22)
Kyrie Leonard drives, Shai Bird stays with him. Kyrie Leonard attempts a Layup. Contested by Shai Bird (3.9 feet, MAN). KYRIE LEONARD MAKES IT! Assist: Karl Bridges
Score: 20-24

[03:22] Team_049 possession (Score: 20-24)
Ja Oladipo attempts a Midrange. Contested by Anthony Oladipo (5.0 feet, MAN). JA OLADIPO MAKES IT! Assist: Jimmy Griffin
Score: 22-24

[03:02] Team_021 possession (Score: 22-24)
Kyrie Leonard drives and kicks out. Kyrie Leonard attempts a 3Pt. Contested by Shai Bird (4.2 feet, ZONE). KYRIE LEONARD MAKES IT! Assist: Kyrie Wagner
Score: 22-27

[02:45] Team_049 possession (Score: 22-27)
Ja Oladipo attempts a Midrange. BLOCKED BY KARL BRIDGES! Ball is loose! Offensive rebound by Shai Mobley! Shai Mobley kicks it out.

[02:31] Team_049 possession (Score: 22-27)
Ja Oladipo attempts a 3Pt. Contested by Kyrie Wagner (4.4 feet, ZONE). Ja Oladipo misses. FOUL! Loose ball foul on Anthony Oladipo during the rebound battle. [IN THE BONUS! 5 team fouls] Shai Mobley to the line for 2 free throws. (Anthony Oladipo: 1 personal fouls)   FT 1/2: GOOD   FT 2/2: GOOD Shai Mobley makes 2/2 from the line.
Score: 24-27

[02:21] Team_021 possession (Score: 24-27)
Kyrie Wagner drives and kicks out. FOUL! Shooting foul on Ja Oladipo. Anthony Oladipo to the line for 2 free throws. [BONUS: 6 team fouls] (Ja Oladipo: 3 personal fouls)   FT 1/2: GOOD   FT 2/2: GOOD Anthony Oladipo makes 2/2 from the line.
Score: 24-29

[02:06] Team_049 possession (Score: 24-29)
Ja Oladipo drives to the basket... Ja Oladipo throws a bad pass out of bounds! TURNOVER! (dead ball)

[02:06] Substitution (Team_049): Shai Bird OUT → Shaquille Lillard IN (stamina_rule2)

[02:06] Substitution (Team_049): Ja Oladipo OUT → Shai Jordan IN (stamina_rule2)

[02:06] Substitution (Team_049): Jimmy Griffin OUT → Desmond Towns IN (stamina_rule2)

[02:06] Substitution (Team_049): De'Aaron Allen OUT → Giannis Anunoby IN (stamina_rule2)

[02:06] Substitution (Team_049): Shai Mobley OUT → Miles Jackson IN (stamina_rule2)

[02:06] Substitution (Team_021): Kyrie Leonard OUT → Joel LaVine IN (stamina_rule2)

[02:06] Substitution (Team_021): Anthony Oladipo OUT → Victor Mitchell IN (stamina_rule2)

[02:06] Substitution (Team_021): Karl Bridges OUT → Paul Allen IN (stamina_rule2)

[02:06] Substitution (Team_021): Kyrie Wagner OUT → Vince George IN (stamina_rule2)

[02:06] Substitution (Team_021): Zach Carter OUT → Magic Ingram IN (stamina_rule2)

[01:55] Team_021 possession (Score: 24-29)
Magic Ingram makes the Layup and draws the foul on Miles Jackson! And-1! Magic Ingram to the line for 1. [BONUS: 7 team fouls] (Miles Jackson: 1 personal fouls)   FT 1/1: GOOD Magic Ingram makes 1/1 from the line.
Score: 24-32

[01:45] Team_049 possession (Score: 24-32)
Giannis Anunoby attempts a 3Pt. Contested by Victor Mitchell (4.2 feet, ZONE). Giannis Anunoby misses. Rebound secured by Victor Mitchell.

[01:33] Team_021 possession (Score: 24-32)
Paul Allen attempts a 3Pt. Contested by Shaquille Lillard (4.7 feet, ZONE). Paul Allen misses. Rebound secured by Shai Jordan.

[01:14] Team_049 possession (Score: 24-32)
Miles Jackson attempts a Layup. Contested by Magic Ingram (5.1 feet, ZONE). MILES JACKSON MAKES IT!
Score: 26-32

[00:57] Team_021 possession (Score: 26-32)
Magic Ingram attempts a Layup. Contested by Miles Jackson (3.6 feet, MAN). MAGIC INGRAM MAKES IT! Assist: Victor Mitchell
Score: 26-34

[00:48] Team_049 possession (Score: 26-34)
Desmond Towns attempts a Midrange. Contested by Vince George (5.1 feet, ZONE). Desmond Towns misses. Offensive rebound by Giannis Anunoby! Giannis Anunoby kicks it out.

[00:33] Team_049 possession (Score: 26-34)
Giannis Anunoby drives to the basket... FOUL! Offensive foul on Giannis Anunoby! Vince George drew the charge! [Team fouls: 8] (Giannis Anunoby: 1 personal fouls) TURNOVER! (dead ball)

[00:21] Team_021 possession (Score: 26-34)
Magic Ingram attempts a Layup. Contested by Miles Jackson (3.6 feet, ZONE). MAGIC INGRAM MAKES IT! Assist: Vince George
Score: 26-36

[00:05] Team_049 possession (Score: 26-36)
Desmond Towns drives and kicks out. Giannis Anunoby attempts a Midrange. Contested by Paul Allen (5.8 feet, ZONE). Giannis Anunoby misses. Rebound secured by Vince George.

================================================================================
                              1ST QUARTER COMPLETE                              
================================================================================

1ST QUARTER SCORE: Team_049 26, Team_021 36

BOX SCORE:
================================================================================

Team_049
--------------------------------------------------------------------------------
Player                MIN  PTS  REB  AST  TO      FG   FG%      3P   3P%
--------------------------------------------------------------------------------
Ja Oladipo             10   12    0    1   0   5/5   100.0     0/0   0.0
Shai Mobley            10    9    3    1   0   4/6    66.7     0/0   0.0
Shai Bird              10    3    0    0   0   1/3    33.3     0/0   0.0
Miles Jackson           2    2    0    0   0   1/1   100.0     0/0   0.0
De'Aaron Allen         10    0    1    1   0   0/1     0.0     0/0   0.0
Jimmy Griffin          10    0    6    1   0   0/2     0.0     0/0   0.0
Giannis Anunoby         2    0    1    0   0   0/1     0.0     0/0   0.0
Shai Jordan             2    0    1    0   0   0/0     0.0     0/0   0.0
Desmond Towns           2    0    0    0   0   0/1     0.0     0/0   0.0

TEAM: FG: 11/20 (55.0%), 3PT: 5/10 (50.0%), REB: 12 (4 off, 8 def), AST: 4, TO: 4
TEAM FOULS: 8 [Team_021 in BONUS]


Team_021
--------------------------------------------------------------------------------
Player                MIN  PTS  REB  AST  TO      FG   FG%      3P   3P%
--------------------------------------------------------------------------------
Kyrie Leonard          10   13    1    1   0   5/6    83.3     0/0   0.0
Kyrie Wagner           10    9    0    1   0   4/4   100.0     0/0   0.0
Magic Ingram            2    7    0    0   0   3/3   100.0     0/0   0.0
Zach Carter            10    5    4    0   0   2/3    66.7     0/0   0.0
Anthony Oladipo        10    2    2    1   0   1/3    33.3     0/0   0.0
Karl Bridges           10    0    0    1   0   0/3     0.0     0/0   0.0
Victor Mitchell         2    0    1    1   0   0/0     0.0     0/0   0.0
Paul Allen              2    0    0    0   0   0/1     0.0     0/0   0.0
Vince George            2    0    1    1   0   0/0     0.0     0/0   0.0

TEAM: FG: 15/23 (65.2%), 3PT: 2/8 (25.0%), REB: 9 (0 off, 9 def), AST: 6, TO: 0
TEAM FOULS: 5 [Team_049 in BONUS]

================================================================================

================================================================================
                       2ND QUARTER - Team_049 vs Team_021                       
================================================================================

[12:00] Team_049 possession (Score: 26-36)
Ja Oladipo drives and kicks out. De'Aaron Allen attempts a 3Pt. Contested by Karl Bridges (5.6 feet, ZONE). De'Aaron Allen misses. Rebound secured by Anthony Oladipo.

[11:44] Team_021 possession (Score: 26-36)
Zach Carter attempts a Layup. Contested by Shai Mobley (4.7 feet, MAN). ZACH CARTER MAKES IT! Assist: Anthony Oladipo
Score: 26-38

[11:29] Team_049 possession (Score: 26-38)
De'Aaron Allen attempts a 3Pt. Contested by Kyrie Wagner (3.9 feet, ZONE). De'Aaron Allen misses. Rebound secured by Zach Carter.

[11:20] Team_021 possession (Score: 26-38)
Kyrie Wagner attempts a Midrange. Contested by Ja Oladipo (4.4 feet, ZONE). Kyrie Wagner misses. Rebound secured by Jimmy Griffin.

[11:08] Team_049 possession (Score: 26-38)
De'Aaron Allen attempts a Layup. Contested by Kyrie Wagner (3.9 feet, MAN). DE'AARON ALLEN MAKES IT! Assist: Shai Mobley
Score: 28-38

[10:55] Team_021 possession (Score: 28-38)
Karl Bridges drives to the basket... Karl Bridges commits a violation (traveling/carry)! TURNOVER! (dead ball)

[10:43] Team_049 possession (Score: 28-38)
Ja Oladipo drives, Zach Carter stays with him. Ja Oladipo attempts a Layup. Contested by Zach Carter (4.4 feet, ZONE). Ja Oladipo misses. Rebound secured by Anthony Oladipo.

[10:33] Team_021 possession (Score: 28-38)
Zach Carter drives, De'Aaron Allen stays with him. Zach Carter attempts a Dunk. Contested by De'Aaron Allen (4.8 feet, ZONE). ZACH CARTER MAKES IT!
Score: 28-40

[10:19] Team_049 possession (Score: 28-40)
Ja Oladipo attempts a 3Pt. Contested by Anthony Oladipo (5.0 feet, MAN). Ja Oladipo misses. Rebound secured by Zach Carter.

[10:02] Team_021 possession (Score: 28-40)
Kyrie Leonard attempts a 3Pt. Contested by Shai Bird (4.0 feet, MAN). Kyrie Leonard misses. Rebound secured by De'Aaron Allen.

[09:50] Team_049 possession (Score: 28-40)
FOUL! Shooting foul on Kyrie Wagner. Shai Bird to the line for 3 free throws. [Team fouls: 1] (Kyrie Wagner: 1 personal fouls)   FT 1/3: MISS   FT 2/3: GOOD   FT 3/3: GOOD Shai Bird makes 2/3 from the line.
Score: 30-40

[09:38] Team_021 possession (Score: 30-40)
Kyrie Leonard attempts a 3Pt. Contested by Ja Oladipo (4.4 feet, ZONE). Kyrie Leonard misses. Rebound secured by De'Aaron Allen.

[09:24] Team_049 possession (Score: 30-40)
FOUL! Holding foul on Kyrie Wagner. [Team fouls: 2] No free throws, side out. (Kyrie Wagner: 2 personal fouls)

[09:11] Team_049 possession (Score: 30-40)
Shai Mobley attempts a 3Pt. Contested by Kyrie Wagner (4.6 feet, ZONE). Shai Mobley misses. Rebound secured by Kyrie Leonard.

[08:55] Team_021 possession (Score: 30-40)
Karl Bridges attempts a 3Pt. Contested by Ja Oladipo (4.5 feet, ZONE). Karl Bridges misses. Rebound secured by De'Aaron Allen.

[08:37] Team_049 possession (Score: 30-40)
Shai Mobley drives and kicks out. Shai Mobley attempts a Midrange. Contested by Zach Carter (4.4 feet, MAN). Shai Mobley misses. Rebound secured by Kyrie Leonard.

[08:22] Team_021 possession (Score: 30-40)
Kyrie Wagner throws a bad pass out of bounds! TURNOVER! (dead ball)

[08:22] Substitution (Team_049): Shai Bird OUT → Shaquille Lillard IN (stamina_rule2)

[08:22] Substitution (Team_049): Ja Oladipo OUT → Shai Jordan IN (stamina_rule2)

[08:22] Substitution (Team_049): Jimmy Griffin OUT → Desmond Towns IN (stamina_rule2)

[08:22] Substitution (Team_049): De'Aaron Allen OUT → Giannis Anunoby IN (stamina_rule2)

[08:22] Substitution (Team_049): Shai Mobley OUT → Miles Jackson IN (stamina_rule2)

[08:22] Substitution (Team_021): Kyrie Leonard OUT → Joel LaVine IN (stamina_rule2)

[08:22] Substitution (Team_021): Anthony Oladipo OUT → Victor Mitchell IN (stamina_rule2)

[08:22] Substitution (Team_021): Karl Bridges OUT → Paul Allen IN (stamina_rule2)

[08:22] Substitution (Team_021): Kyrie Wagner OUT → Vince George IN (stamina_rule2)

[08:22] Substitution (Team_021): Zach Carter OUT → Magic Ingram IN (stamina_rule2)

[08:08] Team_049 possession (Score: 30-40)
Desmond Towns commits a violation (traveling/carry)! TURNOVER! (dead ball)

[07:54] Team_021 possession (Score: 30-40)
FOUL! Shooting foul on Shaquille Lillard. Joel LaVine to the line for 2 free throws. [Team fouls: 1] (Shaquille Lillard: 1 personal fouls)   FT 1/2: GOOD   FT 2/2: GOOD Joel LaVine makes 2/2 from the line.
Score: 30-42

[07:41] Team_049 possession (Score: 30-42)
Giannis Anunoby attempts a Midrange. Contested by Victor Mitchell (4.2 feet, ZONE). Giannis Anunoby misses. Rebound secured by Magic Ingram.

[07:26] Team_021 possession (Score: 30-42)
FOUL! Shooting foul on Giannis Anunoby. Vince George to the line for 2 free throws. [Team fouls: 2] (Giannis Anunoby: 1 personal fouls)   FT 1/2: GOOD   FT 2/2: GOOD Vince George makes 2/2 from the line.
Score: 30-44

[07:11] Team_049 possession (Score: 30-44)
Giannis Anunoby makes the Layup and draws the foul on Magic Ingram! And-1! Giannis Anunoby to the line for 1. [Team fouls: 3] (Magic Ingram: 1 personal fouls)   FT 1/1: GOOD Giannis Anunoby makes 1/1 from the line.
Score: 33-44

[06:58] Team_021 possession (Score: 33-44)
Paul Allen makes the Midrange and draws the foul on Desmond Towns! And-1! Paul Allen to the line for 1. [Team fouls: 3] (Desmond Towns: 1 personal fouls)   FT 1/1: MISS Paul Allen makes 0/1 from the line. Offensive rebound by Vince George! Vince George kicks it out.
Score: 33-46

[06:42] Team_021 possession (Score: 33-46)
FOUL! Shooting foul on Shaquille Lillard. Paul Allen to the line for 3 free throws. [Team fouls: 4] (Shaquille Lillard: 2 personal fouls)   FT 1/3: GOOD   FT 2/3: MISS   FT 3/3: GOOD Paul Allen makes 2/3 from the line.
Score: 33-48

[06:27] Team_049 possession (Score: 33-48)
Giannis Anunoby drives, picks up Magic Ingram. Help arrives from Victor Mitchell! Giannis Anunoby attempts a Layup. Contested by Victor Mitchell (5.0 feet, ZONE). GIANNIS ANUNOBY MAKES IT!
Score: 35-48

[06:11] Team_021 possession (Score: 35-48)
FOUL! Reach-in foul on Shai Jordan during the drive. [IN THE BONUS! 5 team fouls] Victor Mitchell to the line for 2 free throws. (Shai Jordan: 1 personal fouls)   FT 1/2: GOOD   FT 2/2: MISS Victor Mitchell makes 1/2 from the line. Rebound secured by Shai Jordan.
Score: 35-49

[05:55] Team_049 possession (Score: 35-49)
Giannis Anunoby drives and kicks out. Shai Jordan attempts a Midrange. Contested by Victor Mitchell (4.2 feet, MAN). SHAI JORDAN MAKES IT! Assist: Giannis Anunoby
Score: 37-49

[05:38] Team_021 possession (Score: 37-49)
Paul Allen attempts a 3Pt. Contested by Desmond Towns (4.7 feet, MAN). Paul Allen misses. Offensive rebound by Vince George! Vince George kicks it out.

[05:25] Team_021 possession (Score: 37-49)
Victor Mitchell attempts a 3Pt. Wide open! Shai Jordan is 6.0 feet away. [MAN] Victor Mitchell misses. Offensive rebound by Magic Ingram! Magic Ingram kicks it out.

[05:08] Team_021 possession (Score: 37-49)
Vince George attempts a Layup. BLOCKED BY MILES JACKSON! Ball is loose! Rebound secured by Miles Jackson.

[04:53] Team_049 possession (Score: 37-49)
Miles Jackson attempts a 3Pt. Contested by Victor Mitchell (4.2 feet, ZONE). MILES JACKSON MAKES IT!
Score: 40-49

[04:38] Team_021 possession (Score: 40-49)
Paul Allen drives, Giannis Anunoby stays with him. Paul Allen attempts a Dunk. Contested by Giannis Anunoby (4.8 feet, ZONE). PAUL ALLEN MAKES IT! Assist: Joel LaVine
Score: 40-51

[04:29] Team_049 possession (Score: 40-51)
Miles Jackson makes the Layup and draws the foul on Victor Mitchell! And-1! Miles Jackson to the line for 1. [Team fouls: 4] (Victor Mitchell: 1 personal fouls)   FT 1/1: GOOD Miles Jackson makes 1/1 from the line.
Score: 43-51

[04:15] Team_021 possession (Score: 43-51)
Paul Allen attempts a Midrange. Contested by Desmond Towns (4.7 feet, ZONE). Paul Allen misses. FOUL! Loose ball foul on Giannis Anunoby during the rebound battle. [IN THE BONUS! 6 team fouls] Vince George to the line for 2 free throws. (Giannis Anunoby: 2 personal fouls)   FT 1/2: MISS   FT 2/2: MISS Vince George makes 0/2 from the line. Rebound secured by Shai Jordan.

[03:59] Team_049 possession (Score: 43-51)
Miles Jackson makes the Layup and draws the foul on Magic Ingram! And-1! Miles Jackson to the line for 1. [BONUS: 5 team fouls] (Magic Ingram: 2 personal fouls)   FT 1/1: GOOD Miles Jackson makes 1/1 from the line.
Score: 46-51

[03:46] Team_021 possession (Score: 46-51)
Magic Ingram attempts a Layup. Contested by Miles Jackson (3.6 feet, ZONE). Magic Ingram misses. Offensive rebound by Vince George! Vince George kicks it out.

[03:33] Team_021 possession (Score: 46-51)
Joel LaVine drives, Miles Jackson stays with him. Joel LaVine attempts a Layup. Contested by Miles Jackson (3.3 feet, ZONE). Joel LaVine misses. Offensive rebound by Vince George! Vince George kicks it out.

[03:19] Team_021 possession (Score: 46-51)
Vince George attempts a 3Pt. Contested by Shaquille Lillard (4.4 feet, ZONE). Vince George misses. Rebound secured by Miles Jackson.

[03:02] Team_049 possession (Score: 46-51)
Desmond Towns makes the Dunk and draws the foul on Paul Allen! And-1! Desmond Towns to the line for 1. [BONUS: 6 team fouls] (Paul Allen: 1 personal fouls)   FT 1/1: GOOD Desmond Towns makes 1/1 from the line.
Score: 49-51

[02:46] Team_021 possession (Score: 49-51)
Victor Mitchell attempts a Midrange. Wide open! Shai Jordan is 6.0 feet away. [MAN] VICTOR MITCHELL MAKES IT!
Score: 49-53

[02:26] Team_049 possession (Score: 49-53)
Shai Jordan attempts a Layup. Contested by Victor Mitchell (4.3 feet, MAN). SHAI JORDAN MAKES IT! Assist: Giannis Anunoby
Score: 51-53

[02:09] Team_021 possession (Score: 51-53)
FOUL! Holding foul on Shai Jordan. [IN THE BONUS! 7 team fouls] Victor Mitchell to the line for 2 free throws. (Shai Jordan: 2 personal fouls)   FT 1/2: MISS   FT 2/2: MISS Victor Mitchell makes 0/2 from the line. Offensive rebound by Vince George! Vince George kicks it out.

[01:55] Team_021 possession (Score: 51-53)
Vince George attempts a Layup. Contested by Giannis Anunoby (4.5 feet, MAN). Vince George misses. Offensive rebound by Magic Ingram! Magic Ingram kicks it out.

[01:46] Team_021 possession (Score: 51-53)
Magic Ingram attempts a Layup. Contested by Miles Jackson (3.7 feet, MAN). MAGIC INGRAM MAKES IT! Assist: Vince George
Score: 51-55

[01:34] Team_049 possession (Score: 51-55)
Miles Jackson throws a bad pass out of bounds! TURNOVER! (dead ball)

[01:18] Team_021 possession (Score: 51-55)
FOUL! Shooting foul on Shaquille Lillard. Vince George to the line for 3 free throws. [BONUS: 8 team fouls] (Shaquille Lillard: 3 personal fouls)   FT 1/3: MISS   FT 2/3: GOOD   FT 3/3: GOOD Vince George makes 2/3 from the line.
Score: 51-57

[01:05] Team_049 possession (Score: 51-57)
Giannis Anunoby attempts a Layup. Contested by Vince George (5.1 feet, MAN). GIANNIS ANUNOBY MAKES IT! Assist: Miles Jackson
Score: 53-57

[00:54] Team_021 possession (Score: 53-57)
Paul Allen attempts a Midrange. Contested by Desmond Towns (4.8 feet, ZONE). PAUL ALLEN MAKES IT!
Score: 53-59

[00:38] Team_049 possession (Score: 53-59)
Shaquille Lillard drives, Joel LaVine stays with him. Shaquille Lillard attempts a Layup. Wide open! Joel LaVine is 6.2 feet away. [MAN] SHAQUILLE LILLARD MAKES IT! Assist: Shai Jordan
Score: 55-59

[00:22] Team_021 possession (Score: 55-59)
Joel LaVine attempts a 3Pt. Contested by Shaquille Lillard (4.6 feet, ZONE). Joel LaVine misses. Offensive rebound by Vince George! Vince George kicks it out.

[00:08] Team_021 possession (Score: 55-59)
Victor Mitchell attempts a Midrange. Contested by Desmond Towns (4.6 feet, ZONE). Victor Mitchell misses. Offensive rebound by Vince George! Vince George kicks it out.

================================================================================
                              2ND QUARTER COMPLETE                              
================================================================================

2ND QUARTER SCORE: Team_049 29, Team_021 23

BOX SCORE:
================================================================================

Team_049
--------------------------------------------------------------------------------
Player                MIN  PTS  REB  AST  TO      FG   FG%      3P   3P%
--------------------------------------------------------------------------------
Miles Jackson          10    9    2    1   0   3/3   100.0     0/0   0.0
Giannis Anunoby        10    7    0    2   0   3/4    75.0     0/0   0.0
Shai Jordan            10    4    2    1   0   2/2   100.0     0/0   0.0
Desmond Towns          10    3    0    0   0   1/1   100.0     0/0   0.0
De'Aaron Allen         14    2    3    0   0   1/2    50.0     0/0   0.0
Shai Bird              14    2    0    0   0   1/1   100.0     0/0   0.0
Shaquille Lillard      10    2    0    0   0   1/1   100.0     0/0   0.0
Ja Oladipo             14    0    0    0   0   0/3     0.0     0/0   0.0
Jimmy Griffin          14    0    1    0   0   0/0     0.0     0/0   0.0
Shai Mobley            14    0    0    1   0   0/2     0.0     0/0   0.0

TEAM: FG: 12/19 (63.2%), 3PT: 2/5 (40.0%), REB: 7 (0 off, 7 def), AST: 5, TO: 2
TEAM FOULS: 8 [Team_021 in BONUS]


Team_021
--------------------------------------------------------------------------------
Player                MIN  PTS  REB  AST  TO      FG   FG%      3P   3P%
--------------------------------------------------------------------------------
Paul Allen             10    6    0    0   0   3/4    75.0     0/0   0.0
Zach Carter            14    4    2    0   0   2/2   100.0     0/0   0.0
Vince George           10    4    7    1   0   2/4    50.0     0/0   0.0
Joel LaVine            10    2    0    1   0   1/1   100.0     0/0   0.0
Magic Ingram           10    2    3    0   0   1/1   100.0     0/0   0.0
Victor Mitchell        10    2    0    0   0   1/2    50.0     0/0   0.0
Anthony Oladipo        14    0    2    1   0   0/0     0.0     0/0   0.0
Kyrie Wagner           14    0    0    0   0   0/1     0.0     0/0   0.0
Kyrie Leonard          14    0    2    0   0   0/2     0.0     0/0   0.0
Karl Bridges           14    0    0    0   0   0/1     0.0     0/0   0.0

TEAM: FG: 10/18 (55.6%), 3PT: 2/6 (33.3%), REB: 17 (10 off, 7 def), AST: 3, TO: 2
TEAM FOULS: 6 [Team_049 in BONUS]

================================================================================

================================================================================
                       3RD QUARTER - Team_049 vs Team_021                       
================================================================================

[12:00] Team_049 possession (Score: 55-59)
Jimmy Griffin attempts a 3Pt. Contested by Kyrie Wagner (4.0 feet, ZONE). Jimmy Griffin misses. Rebound secured by Zach Carter.

[11:42] Team_021 possession (Score: 55-59)
Anthony Oladipo drives, De'Aaron Allen stays with him. Anthony Oladipo attempts a Layup. Contested by De'Aaron Allen (4.2 feet, ZONE). ANTHONY OLADIPO MAKES IT!
Score: 55-61

[11:25] Team_049 possession (Score: 55-61)
Shai Bird attempts a Layup. Contested by Kyrie Leonard (5.0 feet, MAN). Shai Bird misses. Rebound secured by Kyrie Leonard.

[11:08] Team_021 possession (Score: 55-61)
Anthony Oladipo attempts a 3Pt. Contested by Ja Oladipo (4.2 feet, MAN). ANTHONY OLADIPO MAKES IT! Assist: Kyrie Wagner
Score: 55-64

[10:52] Team_049 possession (Score: 55-64)
FOUL! Holding foul on Zach Carter. [Team fouls: 1] No free throws, side out. (Zach Carter: 1 personal fouls)

[10:36] Team_049 possession (Score: 55-64)
Shai Mobley attempts a Midrange. Contested by Anthony Oladipo (4.9 feet, ZONE). SHAI MOBLEY MAKES IT!
Score: 57-64

[10:16] Team_021 possession (Score: 57-64)
FOUL! Reach-in foul on De'Aaron Allen during the drive. [Team fouls: 1] No free throws, side out. (De'Aaron Allen: 1 personal fouls)

[10:00] Team_021 possession (Score: 57-64)
Kyrie Leonard attempts a Layup. Contested by De'Aaron Allen (4.1 feet, ZONE). Kyrie Leonard misses. Rebound secured by De'Aaron Allen.

[09:49] Team_049 possession (Score: 57-64)
Ja Oladipo drives and kicks out. De'Aaron Allen attempts a 3Pt. Contested by Kyrie Wagner (4.0 feet, ZONE). DE'AARON ALLEN MAKES IT! Assist: Shai Bird
Score: 60-64

[09:33] Team_021 possession (Score: 60-64)
Karl Bridges drives to the basket... Karl Bridges loses the ball! Stripped by Jimmy Griffin! TURNOVER! (live ball)

[09:18] Team_049 possession (Score: 60-64)
Ja Oladipo attempts a Midrange. Contested by Anthony Oladipo (4.8 feet, MAN). Ja Oladipo misses. Rebound secured by Kyrie Leonard.

[08:59] Team_021 possession (Score: 60-64)
FOUL! Reach-in foul on Jimmy Griffin during the drive. [Team fouls: 2] No free throws, side out. (Jimmy Griffin: 1 personal fouls)

[08:46] Team_021 possession (Score: 60-64)
Zach Carter attempts a Midrange. Contested by Shai Mobley (4.7 feet, MAN). Zach Carter misses. Rebound secured by Shai Mobley.

[08:33] Team_049 possession (Score: 60-64)
De'Aaron Allen attempts a Layup. BLOCKED BY ZACH CARTER! Ball goes out off Zach Carter. De'Aaron Allen's ball!

[08:19] Team_049 possession (Score: 60-64)
FOUL! Reach-in foul on Zach Carter during the drive. [Team fouls: 2] No free throws, side out. (Zach Carter: 2 personal fouls)

[08:05] Team_049 possession (Score: 60-64)
FOUL! Holding foul on Kyrie Wagner. [Team fouls: 3] No free throws, side out. (Kyrie Wagner: 1 personal fouls)

[07:53] Team_049 possession (Score: 60-64)
De'Aaron Allen drives and kicks out. Jimmy Griffin attempts a Midrange. Contested by Karl Bridges (5.5 feet, MAN). Jimmy Griffin misses. Offensive rebound by Shai Mobley! Shai Mobley puts it back in!
Score: 62-64

[07:39] Team_021 possession (Score: 62-64)
Kyrie Wagner drives, De'Aaron Allen stays with him. Kyrie Wagner attempts a Dunk. Contested by De'Aaron Allen (4.3 feet, MAN). Kyrie Wagner misses. Rebound secured by Jimmy Griffin.

[07:27] Team_049 possession (Score: 62-64)
Shai Mobley attempts a Layup. Contested by Zach Carter (4.3 feet, ZONE). SHAI MOBLEY MAKES IT! Assist: Jimmy Griffin
Score: 64-64

[07:12] Team_021 possession (Score: 64-64)
Zach Carter drives to the basket... FOUL! Offensive foul on Zach Carter! Shai Mobley drew the charge! [Team fouls: 4] (Zach Carter: 3 personal fouls) TURNOVER! (dead ball)

[06:59] Team_049 possession (Score: 64-64)
Jimmy Griffin attempts a 3Pt. Contested by Kyrie Wagner (4.0 feet, ZONE). Jimmy Griffin misses. Rebound secured by Kyrie Leonard.

[06:42] Team_021 possession (Score: 64-64)
Zach Carter loses the ball! Stripped by Shai Mobley! TURNOVER! (live ball)

[06:27] Team_049 possession (Score: 64-64)
De'Aaron Allen attempts a 3Pt. Contested by Kyrie Wagner (3.8 feet, MAN). DE'AARON ALLEN MAKES IT! Assist: Ja Oladipo
Score: 67-64

[06:10] Team_021 possession (Score: 67-64)
Kyrie Leonard attempts a 3Pt. Contested by Ja Oladipo (4.1 feet, ZONE). Kyrie Leonard misses. Offensive rebound by Kyrie Leonard! Kyrie Leonard kicks it out.

[05:59] Team_021 possession (Score: 67-64)
Karl Bridges throws a bad pass! Stolen by Jimmy Griffin! TURNOVER! (live ball)

[05:44] Team_049 possession (Score: 67-64)
Ja Oladipo attempts a Layup. Contested by Anthony Oladipo (4.8 feet, MAN). Ja Oladipo misses. Rebound secured by Anthony Oladipo.

[05:27] Team_021 possession (Score: 67-64)
Zach Carter drives, picks up Shai Mobley. Help arrives from Ja Oladipo! Zach Carter attempts a Layup. Contested by Ja Oladipo (4.7 feet, MAN). ZACH CARTER MAKES IT! Assist: Kyrie Leonard
Score: 67-66

[05:13] Team_049 possession (Score: 67-66)
Ja Oladipo attempts a 3Pt. Contested by Kyrie Wagner (4.2 feet, ZONE). Ja Oladipo misses. Offensive rebound by Jimmy Griffin! Jimmy Griffin kicks it out.

[05:02] Team_049 possession (Score: 67-66)
Shai Bird attempts a 3Pt. Contested by Kyrie Leonard (5.0 feet, MAN). Shai Bird misses. Rebound secured by Anthony Oladipo.

[04:46] Team_021 possession (Score: 67-66)
Kyrie Wagner attempts a Layup. BLOCKED BY DE'AARON ALLEN! Ball is loose! Rebound secured by Shai Mobley.

[04:30] Team_049 possession (Score: 67-66)
Ja Oladipo attempts a Layup. Contested by Zach Carter (4.3 feet, ZONE). JA OLADIPO MAKES IT!
Score: 69-66

[04:13] Team_021 possession (Score: 69-66)
Zach Carter drives, De'Aaron Allen stays with him. Zach Carter attempts a Dunk. Contested by De'Aaron Allen (4.7 feet, ZONE). Zach Carter misses. Rebound secured by De'Aaron Allen.

[03:56] Team_049 possession (Score: 69-66)
Shai Mobley drives, Zach Carter stays with him. Shai Mobley attempts a Layup. Contested by Zach Carter (4.4 feet, MAN). Shai Mobley misses. Rebound secured by Kyrie Leonard.

[03:39] Team_021 possession (Score: 69-66)
Kyrie Wagner drives and kicks out. Zach Carter attempts a 3Pt. Contested by Shai Mobley (4.3 feet, MAN). Zach Carter misses. Rebound secured by Shai Mobley.

[03:24] Team_049 possession (Score: 69-66)
Shai Bird attempts a 3Pt. Contested by Kyrie Wagner (4.5 feet, ZONE). Shai Bird misses. Rebound secured by Kyrie Leonard.

[03:08] Team_021 possession (Score: 69-66)
FOUL! Reach-in foul on De'Aaron Allen during the drive. [Team fouls: 3] No free throws, side out. (De'Aaron Allen: 2 personal fouls)

[02:52] Team_021 possession (Score: 69-66)
Anthony Oladipo attempts a Midrange. Contested by Ja Oladipo (4.4 feet, MAN). ANTHONY OLADIPO MAKES IT!
Score: 69-68

[02:41] Team_049 possession (Score: 69-68)
Shai Mobley attempts a Midrange. Contested by Zach Carter (4.5 feet, ZONE). Shai Mobley misses. Rebound secured by Anthony Oladipo.

[02:25] Team_021 possession (Score: 69-68)
Anthony Oladipo attempts a 3Pt. Contested by Ja Oladipo (4.4 feet, ZONE). Anthony Oladipo misses. Rebound secured by De'Aaron Allen.

[02:10] Team_049 possession (Score: 69-68)
Ja Oladipo drives and kicks out. De'Aaron Allen attempts a 3Pt. Contested by Kyrie Wagner (4.3 feet, MAN). De'Aaron Allen misses. FOUL! Loose ball foul on Anthony Oladipo during the rebound battle. [IN THE BONUS! 5 team fouls] Shai Mobley to the line for 2 free throws. (Anthony Oladipo: 1 personal fouls)   FT 1/2: GOOD   FT 2/2: GOOD Shai Mobley makes 2/2 from the line.
Score: 71-68

[01:54] Team_021 possession (Score: 71-68)
Kyrie Wagner drives to the basket... FOUL! Offensive foul on Kyrie Wagner! De'Aaron Allen drew the charge! [Team fouls: 6] (Kyrie Wagner: 2 personal fouls) TURNOVER! (dead ball)

[01:40] Team_049 possession (Score: 71-68)
De'Aaron Allen attempts a 3Pt. Contested by Kyrie Wagner (4.1 feet, MAN). DE'AARON ALLEN MAKES IT! Assist: Jimmy Griffin
Score: 74-68

[01:24] Team_021 possession (Score: 74-68)
Kyrie Wagner makes the Midrange and draws the foul on Jimmy Griffin! And-1! Kyrie Wagner to the line for 1. [Team fouls: 4] (Jimmy Griffin: 2 personal fouls)   FT 1/1: GOOD Kyrie Wagner makes 1/1 from the line.
Score: 74-71

[01:11] Team_049 possession (Score: 74-71)
Jimmy Griffin attempts a Midrange. BLOCKED BY KARL BRIDGES! Ball goes out off Karl Bridges. Jimmy Griffin's ball!

[01:01] Team_049 possession (Score: 74-71)
Shai Bird attempts a Layup. BLOCKED BY KYRIE LEONARD! Ball is loose! Rebound secured by Anthony Oladipo.

[00:43] Team_021 possession (Score: 74-71)
Karl Bridges attempts a Layup. Contested by De'Aaron Allen (4.5 feet, ZONE). KARL BRIDGES MAKES IT! Assist: Kyrie Leonard
Score: 74-73

[00:29] Team_049 possession (Score: 74-73)
De'Aaron Allen attempts a Layup. Contested by Kyrie Wagner (4.3 feet, ZONE). DE'AARON ALLEN MAKES IT!
Score: 76-73

[00:14] Team_021 possession (Score: 76-73)
Kyrie Leonard drives, De'Aaron Allen stays with him. Kyrie Leonard attempts a Layup. Contested by De'Aaron Allen (4.5 feet, ZONE). Kyrie Leonard misses. Offensive rebound by Kyrie Leonard! Kyrie Leonard kicks it out.

================================================================================
                              3RD QUARTER COMPLETE                              
================================================================================

3RD QUARTER SCORE: Team_049 21, Team_021 14

BOX SCORE:
================================================================================

Team_049
--------------------------------------------------------------------------------
Player                MIN  PTS  REB  AST  TO      FG   FG%      3P   3P%
--------------------------------------------------------------------------------
De'Aaron Allen         26   11    3    0   0   4/4   100.0     0/0   0.0
Shai Mobley            26    8    4    0   0   4/6    66.7     0/0   0.0
Ja Oladipo             26    2    0    1   0   1/3    33.3     0/0   0.0
Jimmy Griffin          26    0    2    2   0   0/2     0.0     0/0   0.0
Shai Bird              26    0    0    1   0   0/4     0.0     0/0   0.0

TEAM: FG: 9/19 (47.4%), 3PT: 2/6 (33.3%), REB: 9 (2 off, 7 def), AST: 4, TO: 0
TEAM FOULS: 4


Team_021
--------------------------------------------------------------------------------
Player                MIN  PTS  REB  AST  TO      FG   FG%      3P   3P%
--------------------------------------------------------------------------------
Anthony Oladipo        26    7    4    0   0   3/4    75.0     0/0   0.0
Kyrie Wagner           26    3    0    1   0   1/4    25.0     0/0   0.0
Zach Carter            26    2    1    0   0   1/3    33.3     0/0   0.0
Karl Bridges           26    2    0    0   0   1/1   100.0     0/0   0.0
Kyrie Leonard          26    0    7    2   0   0/1     0.0     0/0   0.0

TEAM: FG: 6/13 (46.2%), 3PT: 1/2 (50.0%), REB: 12 (2 off, 10 def), AST: 3, TO: 5
TEAM FOULS: 6 [Team_049 in BONUS]

================================================================================

================================================================================
                       4TH QUARTER - Team_049 vs Team_021                       
================================================================================

[12:00] Team_049 possession (Score: 76-73)
Jimmy Griffin attempts a Midrange. Contested by Karl Bridges (5.8 feet, MAN). JIMMY GRIFFIN MAKES IT! Assist: Shai Bird
Score: 78-73

[11:47] Team_021 possession (Score: 78-73)
Anthony Oladipo attempts a 3Pt. Contested by Ja Oladipo (4.5 feet, MAN). ANTHONY OLADIPO MAKES IT! Assist: Kyrie Wagner
Score: 78-76

[11:29] Team_049 possession (Score: 78-76)
De'Aaron Allen drives and kicks out. Ja Oladipo attempts a 3Pt. Contested by Kyrie Wagner (4.3 feet, ZONE). Ja Oladipo misses. Rebound secured by Zach Carter.

[11:14] Team_021 possession (Score: 78-76)
Kyrie Wagner drives to the basket... Kyrie Wagner loses the ball! Stripped by De'Aaron Allen! TURNOVER! (live ball)

[11:02] Team_049 possession (Score: 78-76)
Shai Bird attempts a Midrange. Contested by Kyrie Wagner (4.8 feet, ZONE). Shai Bird misses. Offensive rebound by Shai Mobley! Shai Mobley's putback is no good. Rebound secured by Anthony Oladipo.

[10:46] Team_021 possession (Score: 78-76)
FOUL! Holding foul on De'Aaron Allen. [Team fouls: 1] No free throws, side out. (De'Aaron Allen: 1 personal fouls)

[10:32] Team_021 possession (Score: 78-76)
Karl Bridges attempts a Midrange. Contested by Jimmy Griffin (5.0 feet, MAN). Karl Bridges misses. Rebound secured by De'Aaron Allen.

[10:16] Team_049 possession (Score: 78-76)
Shai Mobley drives and kicks out. Jimmy Griffin attempts a Midrange. Contested by Karl Bridges (5.9 feet, MAN). JIMMY GRIFFIN MAKES IT! Assist: Ja Oladipo
Score: 80-76

[10:01] Team_021 possession (Score: 80-76)
FOUL! Shooting foul on Ja Oladipo. Anthony Oladipo to the line for 2 free throws. [Team fouls: 2] (Ja Oladipo: 1 personal fouls)   FT 1/2: GOOD   FT 2/2: MISS Anthony Oladipo makes 1/2 from the line. Rebound secured by Jimmy Griffin.
Score: 80-77

[09:48] Team_049 possession (Score: 80-77)
FOUL! Shooting foul on Zach Carter. Shai Mobley to the line for 2 free throws. [Team fouls: 1] (Zach Carter: 1 personal fouls)   FT 1/2: GOOD   FT 2/2: GOOD Shai Mobley makes 2/2 from the line.
Score: 82-77

[09:33] Team_021 possession (Score: 82-77)
Anthony Oladipo loses control! Ball rolls out of bounds! TURNOVER! (dead ball)

[09:33] Substitution (Team_049): Shai Bird OUT → Shaquille Lillard IN (stamina_rule2)

[09:33] Substitution (Team_049): Ja Oladipo OUT → Shai Jordan IN (stamina_rule2)

[09:33] Substitution (Team_049): Jimmy Griffin OUT → Desmond Towns IN (stamina_rule2)

[09:33] Substitution (Team_049): De'Aaron Allen OUT → Giannis Anunoby IN (stamina_rule2)

[09:33] Substitution (Team_049): Shai Mobley OUT → Miles Jackson IN (stamina_rule2)

[09:33] Substitution (Team_021): Kyrie Leonard OUT → Joel LaVine IN (stamina_rule2)

[09:33] Substitution (Team_021): Anthony Oladipo OUT → Victor Mitchell IN (stamina_rule2)

[09:33] Substitution (Team_021): Karl Bridges OUT → Paul Allen IN (stamina_rule2)

[09:33] Substitution (Team_021): Kyrie Wagner OUT → Vince George IN (stamina_rule2)

[09:33] Substitution (Team_021): Zach Carter OUT → Magic Ingram IN (stamina_rule2)

[09:19] Team_049 possession (Score: 82-77)
Giannis Anunoby drives and kicks out. Shai Jordan attempts a 3Pt. Contested by Victor Mitchell (4.2 feet, MAN). Shai Jordan misses. Rebound secured by Vince George.

[09:01] Team_021 possession (Score: 82-77)
Vince George throws a bad pass! Stolen by Giannis Anunoby! TURNOVER! (live ball)

[08:48] Team_049 possession (Score: 82-77)
Giannis Anunoby drives to the basket... FOUL! Offensive foul on Giannis Anunoby! Vince George drew the charge! [Team fouls: 3] (Giannis Anunoby: 1 personal fouls) TURNOVER! (dead ball)

[08:32] Team_021 possession (Score: 82-77)
Victor Mitchell attempts a 3Pt. Wide open! Shai Jordan is 6.0 feet away. [ZONE] Victor Mitchell misses. Rebound secured by Shai Jordan.

[08:18] Team_049 possession (Score: 82-77)
Desmond Towns attempts a 3Pt. Contested by Victor Mitchell (4.3 feet, ZONE). Desmond Towns misses. Offensive rebound by Giannis Anunoby! Giannis Anunoby kicks it out.

[08:03] Team_049 possession (Score: 82-77)
Desmond Towns attempts a 3Pt. Contested by Victor Mitchell (4.3 feet, ZONE). Desmond Towns misses. Rebound secured by Vince George.

[07:50] Team_021 possession (Score: 82-77)
Magic Ingram attempts a Midrange. Contested by Miles Jackson (3.6 feet, MAN). Magic Ingram misses. Rebound secured by Miles Jackson.

[07:33] Team_049 possession (Score: 82-77)
Shai Jordan attempts a 3Pt. Contested by Victor Mitchell (4.2 feet, MAN). Shai Jordan misses. Rebound secured by Vince George.

[07:20] Team_021 possession (Score: 82-77)
Vince George attempts a Midrange. Wide open! Shai Jordan is 6.0 feet away. [ZONE] VINCE GEORGE MAKES IT! Assist: Joel LaVine
Score: 82-79

[07:03] Team_049 possession (Score: 82-79)
Shaquille Lillard throws a bad pass! Stolen by Joel LaVine! TURNOVER! (live ball)

[06:49] Team_021 possession (Score: 82-79)
Vince George attempts a 3Pt. Contested by Shaquille Lillard (4.4 feet, ZONE). VINCE GEORGE MAKES IT! Assist: Victor Mitchell
Score: 82-82

[06:32] Team_049 possession (Score: 82-82)
FOUL! Reach-in foul on Magic Ingram during the drive. [Team fouls: 2] No free throws, side out. (Magic Ingram: 1 personal fouls)

[06:18] Team_049 possession (Score: 82-82)
FOUL! Holding foul on Vince George. [Team fouls: 3] No free throws, side out. (Vince George: 1 personal fouls)

[06:09] Team_049 possession (Score: 82-82)
Miles Jackson drives and kicks out. Miles Jackson attempts a 3Pt. Contested by Magic Ingram (5.0 feet, MAN). MILES JACKSON MAKES IT! Assist: Desmond Towns
Score: 85-82

[05:57] Team_021 possession (Score: 85-82)
Joel LaVine attempts a Layup. Contested by Shaquille Lillard (4.4 feet, MAN). JOEL LAVINE MAKES IT! Assist: Magic Ingram
Score: 85-84

[05:46] Team_049 possession (Score: 85-84)
Desmond Towns attempts a Midrange. Contested by Victor Mitchell (4.3 feet, ZONE). DESMOND TOWNS MAKES IT!
Score: 87-84

[05:34] Team_021 possession (Score: 87-84)
Victor Mitchell attempts a 3Pt. Contested by Shaquille Lillard (4.5 feet, ZONE). VICTOR MITCHELL MAKES IT! Assist: Joel LaVine
Score: 87-87

[05:23] Team_049 possession (Score: 87-87)
Miles Jackson drives, picks up Magic Ingram. Help arrives from Victor Mitchell! Miles Jackson attempts a Dunk. Contested by Victor Mitchell (5.1 feet, MAN). Miles Jackson misses. Rebound secured by Vince George.

[05:07] Team_021 possession (Score: 87-87)
Vince George makes the Layup and draws the foul on Shai Jordan! And-1! Vince George to the line for 1. [Team fouls: 4] (Shai Jordan: 1 personal fouls)   FT 1/1: GOOD Vince George makes 1/1 from the line.
Score: 87-90

[04:56] Team_049 possession (Score: 87-90)
Giannis Anunoby attempts a Layup. Contested by Vince George (5.0 feet, MAN). GIANNIS ANUNOBY MAKES IT!
Score: 89-90

[04:39] Team_021 possession (Score: 89-90)
Joel LaVine attempts a Layup. Contested by Shaquille Lillard (4.4 feet, MAN). JOEL LAVINE MAKES IT! Assist: Magic Ingram
Score: 89-92

[04:30] Team_049 possession (Score: 89-92)
Desmond Towns attempts a 3Pt. Contested by Paul Allen (6.0 feet, MAN). Desmond Towns misses. Rebound secured by Magic Ingram.

[04:18] Team_021 possession (Score: 89-92)
Magic Ingram loses control! Ball rolls out of bounds! TURNOVER! (dead ball)

[04:03] Team_049 possession (Score: 89-92)
FOUL! Shooting foul on Victor Mitchell. Shai Jordan to the line for 3 free throws. [Team fouls: 4] (Victor Mitchell: 1 personal fouls)   FT 1/3: MISS   FT 2/3: GOOD   FT 3/3: GOOD Shai Jordan makes 2/3 from the line.
Score: 91-92

[03:49] Team_021 possession (Score: 91-92)
Joel LaVine drives and kicks out. Magic Ingram attempts a 3Pt. Contested by Miles Jackson (3.4 feet, MAN). Magic Ingram misses. Rebound secured by Miles Jackson.

[03:32] Team_049 possession (Score: 91-92)
Desmond Towns attempts a 3Pt. Contested by Paul Allen (6.0 feet, MAN). Desmond Towns misses. Rebound secured by Victor Mitchell.

[03:15] Team_021 possession (Score: 91-92)
Victor Mitchell drives to the basket... Victor Mitchell throws a bad pass out of bounds! TURNOVER! (dead ball)

[02:58] Team_049 possession (Score: 91-92)
Miles Jackson makes the Midrange and draws the foul on Vince George! And-1! Miles Jackson to the line for 1. [BONUS: 5 team fouls] (Vince George: 2 personal fouls)   FT 1/1: GOOD Miles Jackson makes 1/1 from the line.
Score: 94-92

[02:44] Team_021 possession (Score: 94-92)
Joel LaVine attempts a 3Pt. Contested by Shaquille Lillard (4.4 feet, ZONE). JOEL LAVINE MAKES IT! Assist: Paul Allen
Score: 94-95

[02:31] Team_049 possession (Score: 94-95)
Giannis Anunoby attempts a Midrange. Contested by Vince George (5.0 feet, MAN). Giannis Anunoby misses. Rebound secured by Magic Ingram.

[02:14] Team_021 possession (Score: 94-95)
Joel LaVine attempts a 3Pt. Contested by Shaquille Lillard (4.4 feet, MAN). JOEL LAVINE MAKES IT!
Score: 94-98

[01:57] Team_049 possession (Score: 94-98)
Miles Jackson drives to the basket... Miles Jackson throws a bad pass out of bounds! TURNOVER! (dead ball)

[01:41] Team_021 possession (Score: 94-98)
Victor Mitchell drives and kicks out. Paul Allen attempts a Midrange. Contested by Giannis Anunoby (4.7 feet, ZONE). PAUL ALLEN MAKES IT! Assist: Vince George
Score: 94-100

[01:29] Team_049 possession (Score: 94-100)
Desmond Towns attempts a 3Pt. Wide open! Paul Allen is 6.0 feet away. [MAN] DESMOND TOWNS MAKES IT! Assist: Giannis Anunoby
Score: 97-100

[01:15] Team_021 possession (Score: 97-100)
FOUL! Shooting foul on Miles Jackson. Magic Ingram to the line for 2 free throws. [BONUS: 5 team fouls] (Miles Jackson: 1 personal fouls)   FT 1/2: GOOD   FT 2/2: MISS Magic Ingram makes 1/2 from the line. Offensive rebound by Vince George! Vince George kicks it out.
Score: 97-101

[01:01] Team_021 possession (Score: 97-101)
FOUL! Offensive foul on Vince George! Giannis Anunoby drew the charge! [Team fouls: 6] (Vince George: 3 personal fouls) TURNOVER! (dead ball)

[00:45] Team_049 possession (Score: 97-101)
Shaquille Lillard attempts a Layup. Contested by Magic Ingram (5.4 feet, ZONE). Shaquille Lillard misses. Rebound secured by Vince George.

[00:34] Team_021 possession (Score: 97-101)
Victor Mitchell attempts a Layup. Wide open! Shai Jordan is 6.2 feet away. [MAN] Victor Mitchell misses. Rebound secured by Shai Jordan.

[00:18] Team_049 possession (Score: 97-101)
Giannis Anunoby drives, Magic Ingram stays with him. Giannis Anunoby attempts a Dunk. Contested by Magic Ingram (5.3 feet, ZONE). GIANNIS ANUNOBY MAKES IT!
Score: 99-101

================================================================================
                              4TH QUARTER COMPLETE                              
================================================================================

4TH QUARTER SCORE: Team_049 23, Team_021 28

BOX SCORE:
================================================================================

Team_049
--------------------------------------------------------------------------------
Player                MIN  PTS  REB  AST  TO      FG   FG%      3P   3P%
--------------------------------------------------------------------------------
Miles Jackson          20    6    2    0   0   2/3    66.7     0/0   0.0
Desmond Towns          20    5    0    1   0   2/5    40.0     0/0   0.0
Jimmy Griffin          29    4    1    0   0   2/2   100.0     0/0   0.0
Giannis Anunoby        20    4    1    1   0   2/4    50.0     0/0   0.0
Shai Mobley            29    2    0    0   0   1/1   100.0     0/0   0.0
Shai Jordan            20    2    2    0   0   1/2    50.0     0/0   0.0
Shai Bird              29    0    0    1   0   0/1     0.0     0/0   0.0
De'Aaron Allen         29    0    1    0   0   0/1     0.0     0/0   0.0
Ja Oladipo             29    0    0    1   0   0/0     0.0     0/0   0.0
Shaquille Lillard      20    0    0    0   0   0/1     0.0     0/0   0.0

TEAM: FG: 10/20 (50.0%), 3PT: 2/6 (33.3%), REB: 8 (2 off, 6 def), AST: 4, TO: 3
TEAM FOULS: 5 [Team_021 in BONUS]


Team_021
--------------------------------------------------------------------------------
Player                MIN  PTS  REB  AST  TO      FG   FG%      3P   3P%
--------------------------------------------------------------------------------
Joel LaVine            20   10    0    2   0   4/5    80.0     0/0   0.0
Vince George           20    8    6    1   0   3/3   100.0     0/0   0.0
Anthony Oladipo        29    3    1    0   0   1/2    50.0     0/0   0.0
Victor Mitchell        20    3    1    1   0   1/3    33.3     0/0   0.0
Paul Allen             20    2    0    1   0   1/1   100.0     0/0   0.0
Kyrie Wagner           29    0    0    1   0   0/0     0.0     0/0   0.0
Zach Carter            29    0    1    0   0   0/0     0.0     0/0   0.0
Karl Bridges           29    0    0    0   0   0/1     0.0     0/0   0.0
Magic Ingram           20    0    2    2   0   0/1     0.0     0/0   0.0

TEAM: FG: 10/16 (62.5%), 3PT: 5/6 (83.3%), REB: 10 (1 off, 9 def), AST: 8, TO: 6
TEAM FOULS: 6 [Team_049 in BONUS]

================================================================================

================================================================================
                               FULL GAME COMPLETE                               
================================================================================

FINAL SCORE: Team_049 99, Team_021 101

SCORING BY QUARTER:
--------------------------------------------------------------------------------
Team                     Q1     Q2     Q3     Q4    FINAL
--------------------------------------------------------------------------------
Team_049                 26     29     21     23       99
Team_021                 36     23     14     28      101
--------------------------------------------------------------------------------

FULL GAME BOX SCORE:
================================================================================

Team_049
--------------------------------------------------------------------------------
Player                MIN  PTS  REB  AST  TO      FG   FG%      3P   3P%      FT STL BLK
--------------------------------------------------------------------------------
Shai Bird              29    5    0    2   1   2/9    22.2   2/5    40.0   2/3     0   0
Ja Oladipo             29   14    0    3   1   9/14   64.3   3/4    75.0   2/2     0   1
Jimmy Griffin          29    4   10    3   0   1/5    20.0   0/4     0.0   0/0     2   0
De'Aaron Allen         29   13    8    1   0   6/9    66.7   3/5    60.0   0/0     1   1
Shai Mobley            29   19    7    2   1   6/12   50.0   0/1     0.0   9/9     1   0
Shaquille Lillard      20    2    0    0   1   1/2    50.0   0/0     0.0   0/0     0   0
Shai Jordan            20    6    5    1   0   2/3    66.7   1/2    50.0   2/3     0   0
Desmond Towns          20    8    0    1   2   3/7    42.9   1/4    25.0   1/1     0   0
Giannis Anunoby        20   11    2    3   1   6/10   60.0   0/1     0.0   1/1     1   0
Miles Jackson          20   17    4    1   2   6/7    85.7   1/1   100.0   3/3     0   1

TEAM: FG: 42/78 (53.8%), 3PT: 11/27 (40.7%), REB: 36 (8 off, 28 def), AST: 17, TO: 9


Team_021
--------------------------------------------------------------------------------
Player                MIN  PTS  REB  AST  TO      FG   FG%      3P   3P%      FT STL BLK
--------------------------------------------------------------------------------
Kyrie Leonard          29   13   10    3   2   5/9    55.6   2/5    40.0   3/3     1   1
Anthony Oladipo        29   12    9    2   2   4/8    50.0   2/4    50.0   3/4     0   0
Karl Bridges           29    2    0    1   3   1/6    16.7   0/4     0.0   0/0     0   2
Kyrie Wagner           29   12    0    3   1   7/11   63.6   0/0     0.0   4/4     0   0
Zach Carter            29   11    8    0   1   4/7    57.1   0/0     0.0   0/0     0   1
Joel LaVine            20   12    0    3   0   5/6    83.3   2/2   100.0   2/2     1   0
Victor Mitchell        20    5    2    2   0   3/6    50.0   1/2    50.0   1/4     0   0
Paul Allen             20    8    0    1   1   3/5    60.0   1/2    50.0   2/4     0   0
Vince George           20   12   14    3   2   5/7    71.4   2/3    66.7   5/8     0   0
Magic Ingram           20    9    5    2   1   4/5    80.0   0/0     0.0   2/3     0   0

TEAM: FG: 41/70 (58.6%), 3PT: 10/22 (45.5%), REB: 48 (13 off, 35 def), AST: 20, TO: 13

================================================================================
