================================================================================
                        FULL GAME - Team_015 vs Team_065                        
================================================================================

================================================================================
                       1ST QUARTER - Team_015 vs Team_065                       
================================================================================

[12:00] Team_015 possession (Score: 0-0)
Trae Turner makes the Dunk and draws the foul on Russell Wade! And-1! Trae Turner to the line for 1. [Team fouls: 1] (Russell Wade: 1 personal fouls)   FT 1/1: GOOD Trae Turner makes 1/1 from the line.
Score: 3-0

[11:50] Team_065 possession (Score: 3-0)
FOUL! Reach-in foul on CJ Banchero during the drive. [Team fouls: 1] No free throws, side out. (CJ Banchero: 1 personal fouls)

[11:34] Team_065 possession (Score: 3-0)
Paul Williamson attempts a 3Pt. Contested by Manu Anthony (3.8 feet, ZONE). PAUL WILLIAMSON MAKES IT! Assist: Russell Wade
Score: 3-3

[11:24] Team_015 possession (Score: 3-3)
FOUL! Shooting foul on Paul Williamson. Manu Anthony to the line for 2 free throws. [Team fouls: 2] (Paul Williamson: 1 personal fouls)   FT 1/2: MISS   FT 2/2: MISS Manu Anthony makes 0/2 from the line. Rebound secured by Manu McGrady.

[11:09] Team_065 possession (Score: 3-3)
Manu McGrady attempts a 3Pt. Contested by CJ Banchero (4.2 feet, MAN). Manu McGrady misses. Rebound secured by CJ Banchero.

[10:56] Team_015 possession (Score: 3-3)
Trae Turner attempts a Layup. Contested by Russell Wade (3.2 feet, ZONE). Trae Turner misses. Rebound secured by RJ Harden.

[10:42] Team_065 possession (Score: 3-3)
Paul Williamson attempts a Layup. Contested by Scottie Gasol (3.6 feet, ZONE). Paul Williamson misses. Rebound secured by Michael Simmons.

[10:31] Team_015 possession (Score: 3-3)
CJ Banchero attempts a Midrange. Contested by Paul Williamson (3.2 feet, ZONE). CJ BANCHERO MAKES IT! Assist: Manu Anthony
Score: 5-3

[10:16] Team_065 possession (Score: 5-3)
Russell Wade drives and kicks out. Manu McGrady attempts a 3Pt. Contested by Manu Anthony (3.6 feet, ZONE). MANU MCGRADY MAKES IT! Assist: Russell Wade
Score: 5-6

[10:01] Team_015 possession (Score: 5-6)
FOUL! Reach-in foul on Manu McGrady during the drive. [Team fouls: 3] No free throws, side out. (Manu McGrady: 1 personal fouls)

[09:45] Team_015 possession (Score: 5-6)
Trae Turner attempts a 3Pt. Contested by Russell Wade (3.2 feet, MAN). Trae Turner misses. Rebound secured by Russell Wade.

[09:31] Team_065 possession (Score: 5-6)
FOUL! Holding foul on Michael Simmons. [Team fouls: 2] No free throws, side out. (Michael Simmons: 1 personal fouls)

[09:16] Team_065 possession (Score: 5-6)
Karl Booker drives to the basket... FOUL! Offensive foul on Karl Booker! Scottie Gasol drew the charge! [Team fouls: 4] (Karl Booker: 1 personal fouls) TURNOVER! (dead ball)

[08:57] Team_015 possession (Score: 5-6)
FOUL! Shooting foul on RJ Harden. Manu Anthony to the line for 3 free throws. [BONUS: 5 team fouls] (RJ Harden: 1 personal fouls)   FT 1/3: GOOD   FT 2/3: GOOD   FT 3/3: MISS Manu Anthony makes 2/3 from the line. Offensive rebound by CJ Banchero! CJ Banchero's putback is no good.
Score: 7-6

[08:47] Team_065 possession (Score: 7-6)
Manu McGrady attempts a Midrange. Contested by Michael Simmons (3.3 feet, ZONE). Manu McGrady misses. Rebound secured by Trae Turner.

[08:31] Team_015 possession (Score: 7-6)
CJ Banchero attempts a 3Pt. Contested by Manu McGrady (4.4 feet, MAN). CJ Banchero misses. Rebound secured by Russell Wade.

[08:16] Team_065 possession (Score: 7-6)
Karl Booker drives, Trae Turner stays with him. Karl Booker attempts a Layup. Contested by Trae Turner (3.6 feet, MAN). KARL BOOKER MAKES IT! Assist: RJ Harden
Score: 7-8

[08:02] Team_015 possession (Score: 7-8)
Michael Simmons attempts a Layup. Contested by Paul Williamson (3.4 feet, MAN). Michael Simmons misses. Rebound secured by RJ Harden.

[07:49] Team_065 possession (Score: 7-8)
RJ Harden attempts a Midrange. Contested by Manu Anthony (4.1 feet, MAN). RJ HARDEN MAKES IT!
Score: 7-10

[07:37] Team_015 possession (Score: 7-10)
CJ Banchero attempts a 3Pt. Contested by Manu McGrady (4.4 feet, MAN). CJ Banchero misses. Rebound secured by Russell Wade.

[07:23] Team_065 possession (Score: 7-10)
Manu McGrady attempts a Midrange. Contested by Scottie Gasol (3.4 feet, ZONE). Manu McGrady misses. Rebound secured by CJ Banchero.

[07:08] Team_015 possession (Score: 7-10)
Michael Simmons attempts a 3Pt. Contested by RJ Harden (3.9 feet, ZONE). Michael Simmons misses. Rebound secured by RJ Harden.

[06:55] Team_065 possession (Score: 7-10)
Manu McGrady attempts a Layup. Contested by Scottie Gasol (3.4 feet, ZONE). Manu McGrady misses. Rebound secured by CJ Banchero.

[06:38] Team_015 possession (Score: 7-10)
Trae Turner drives, picks up Russell Wade. Help arrives from Paul Williamson! Trae Turner attempts a Dunk. Contested by Paul Williamson (3.2 feet, MAN). TRAE TURNER MAKES IT! Assist: Scottie Gasol
Score: 9-10

[06:24] Team_065 possession (Score: 9-10)
Paul Williamson attempts a Layup. Contested by Scottie Gasol (3.6 feet, ZONE). Paul Williamson misses. Rebound secured by CJ Banchero.

[06:12] Team_015 possession (Score: 9-10)
Michael Simmons attempts a 3Pt. Contested by Paul Williamson (3.4 feet, MAN). Michael Simmons misses. Offensive rebound by Trae Turner! Trae Turner puts it back in!
Score: 11-10

[05:58] Team_065 possession (Score: 11-10)
Russell Wade drives, picks up Scottie Gasol. Help arrives from Michael Simmons! Russell Wade attempts a Dunk. Contested by Michael Simmons (3.5 feet, MAN). RUSSELL WADE MAKES IT! Assist: RJ Harden
Score: 11-12

[05:41] Team_015 possession (Score: 11-12)
Michael Simmons attempts a 3Pt. Contested by Paul Williamson (3.4 feet, MAN). Michael Simmons misses. Rebound secured by RJ Harden.

[05:25] Team_065 possession (Score: 11-12)
RJ Harden attempts a Midrange. Contested by Manu Anthony (4.1 feet, MAN). RJ HARDEN MAKES IT! Assist: Russell Wade
Score: 11-14

[05:10] Team_015 possession (Score: 11-14)
Trae Turner attempts a Midrange. Contested by Russell Wade (3.2 feet, MAN). TRAE TURNER MAKES IT! Assist: Manu Anthony
Score: 13-14

[04:59] Team_065 possession (Score: 13-14)
Russell Wade attempts a Midrange. Contested by Scottie Gasol (3.5 feet, ZONE). Russell Wade misses. Rebound secured by CJ Banchero.

[04:43] Team_015 possession (Score: 13-14)
CJ Banchero makes the Layup and draws the foul on Manu McGrady! And-1! CJ Banchero to the line for 1. [BONUS: 6 team fouls] (Manu McGrady: 2 personal fouls)   FT 1/1: GOOD CJ Banchero makes 1/1 from the line.
Score: 16-14

[04:33] Team_065 possession (Score: 16-14)
FOUL! Reach-in foul on Michael Simmons during the drive. [Team fouls: 3] No free throws, side out. (Michael Simmons: 2 personal fouls)

[04:19] Team_065 possession (Score: 16-14)
FOUL! Shooting foul on Scottie Gasol. Russell Wade to the line for 2 free throws. [Team fouls: 4] (Scottie Gasol: 1 personal fouls)   FT 1/2: GOOD   FT 2/2: GOOD Russell Wade makes 2/2 from the line.
Score: 16-16

[04:07] Team_015 possession (Score: 16-16)
Manu Anthony drives to the basket... Manu Anthony loses control! Ball rolls out of bounds! TURNOVER! (dead ball)

[03:48] Team_065 possession (Score: 16-16)
Karl Booker attempts a 3Pt. Contested by Trae Turner (3.8 feet, MAN). Karl Booker misses. Offensive rebound by Russell Wade! Russell Wade's putback is no good. Rebound secured by Michael Simmons.

[03:35] Team_015 possession (Score: 16-16)
Manu Anthony attempts a 3Pt. Contested by Russell Wade (3.5 feet, ZONE). Manu Anthony misses. Rebound secured by Manu McGrady.

[03:19] Team_065 possession (Score: 16-16)
Manu McGrady attempts a Layup. Contested by CJ Banchero (4.4 feet, MAN). Manu McGrady misses. Rebound secured by Trae Turner.

[03:03] Team_015 possession (Score: 16-16)
Michael Simmons attempts a Layup. Contested by Paul Williamson (3.6 feet, MAN). MICHAEL SIMMONS MAKES IT! Assist: Scottie Gasol
Score: 18-16

[02:45] Team_065 possession (Score: 18-16)
Manu McGrady attempts a Layup. Contested by Scottie Gasol (3.7 feet, ZONE). Manu McGrady misses. Offensive rebound by Russell Wade! Russell Wade's putback is no good. Offensive rebound by Russell Wade! Russell Wade kicks it out.

[02:34] Team_065 possession (Score: 18-16)
FOUL! Shooting foul on Scottie Gasol. Russell Wade to the line for 2 free throws. [BONUS: 5 team fouls] (Scottie Gasol: 2 personal fouls)   FT 1/2: MISS   FT 2/2: MISS Russell Wade makes 0/2 from the line. Rebound secured by CJ Banchero.

[02:19] Team_015 possession (Score: 18-16)
FOUL! Reach-in foul on Russell Wade during the drive. [IN THE BONUS! 7 team fouls] Trae Turner to the line for 2 free throws. (Russell Wade: 2 personal fouls)   FT 1/2: GOOD   FT 2/2: GOOD Trae Turner makes 2/2 from the line.
Score: 20-16

[02:03] Team_065 possession (Score: 20-16)
RJ Harden attempts a 3Pt. Contested by Manu Anthony (4.3 feet, MAN). RJ Harden misses. Offensive rebound by Manu McGrady! Manu McGrady kicks it out.

[01:50] Team_065 possession (Score: 20-16)
Karl Booker drives, Trae Turner stays with him. Karl Booker attempts a Layup. Contested by Trae Turner (4.0 feet, MAN). KARL BOOKER MAKES IT! Assist: Manu McGrady
Score: 20-18

[01:37] Team_015 possession (Score: 20-18)
Michael Simmons attempts a 3Pt. BLOCKED BY RUSSELL WADE! Ball is loose! Offensive rebound by CJ Banchero! CJ Banchero kicks it out.

[01:23] Team_015 possession (Score: 20-18)
FOUL! Offensive foul on CJ Banchero! Manu McGrady drew the charge! [Team fouls: 6] (CJ Banchero: 2 personal fouls) TURNOVER! (dead ball)

[01:11] Team_065 possession (Score: 20-18)
Karl Booker drives, Trae Turner stays with him. Karl Booker attempts a Dunk. Contested by Trae Turner (4.1 feet, MAN). Karl Booker misses. FOUL! Loose ball foul on Trae Turner during the rebound battle. [IN THE BONUS! 7 team fouls] Russell Wade to the line for 2 free throws. (Trae Turner: 1 personal fouls)   FT 1/2: MISS   FT 2/2: GOOD Russell Wade makes 1/2 from the line.
Score: 20-19

[00:57] Team_015 possession (Score: 20-19)
Trae Turner attempts a 3Pt. Contested by Russell Wade (3.6 feet, MAN). Trae Turner misses. Rebound secured by Manu McGrady.

[00:43] Team_065 possession (Score: 20-19)
Karl Booker attempts a Midrange. Contested by Michael Simmons (3.8 feet, ZONE). Karl Booker misses. Rebound secured by Trae Turner.

[00:31] Team_015 possession (Score: 20-19)
Trae Turner drives to the basket... Trae Turner throws a bad pass out of bounds! TURNOVER! (dead ball)

[00:31] Substitution (Team_015): Manu Anthony OUT → Dwyane Sabonis IN (stamina_rule2)

[00:31] Substitution (Team_015): Michael Simmons OUT → Paolo Jokic IN (stamina_rule2)

[00:31] Substitution (Team_015): CJ Banchero OUT → Magic Wagner IN (stamina_rule2)

[00:31] Substitution (Team_015): Scottie Gasol OUT → Rudy Paul IN (stamina_rule2)

[00:31] Substitution (Team_015): Trae Turner OUT → Allen Curry IN (stamina_rule2)

[00:31] Substitution (Team_065): RJ Harden OUT → Paul Curry IN (stamina_rule2)

[00:31] Substitution (Team_065): Paul Williamson OUT → Derrick Poole IN (stamina_rule2)

[00:31] Substitution (Team_065): Manu McGrady OUT → D'Angelo Porzingis IN (stamina_rule2)

[00:31] Substitution (Team_065): Russell Wade OUT → Karl Leonard IN (stamina_rule2)

[00:31] Substitution (Team_065): Karl Booker OUT → Vince Mobley IN (stamina_rule2)

[00:18] Team_065 possession (Score: 20-19)
FOUL! Shooting foul on Dwyane Sabonis. Karl Leonard to the line for 3 free throws. [BONUS: 8 team fouls] (Dwyane Sabonis: 1 personal fouls)   FT 1/3: GOOD   FT 2/3: GOOD   FT 3/3: MISS Karl Leonard makes 2/3 from the line. Offensive rebound by Vince Mobley! Vince Mobley puts it back in!
Score: 20-23

[00:07] Team_015 possession (Score: 20-23)
Allen Curry drives to the basket... FOUL! Offensive foul on Allen Curry! Vince Mobley drew the charge! [Team fouls: 9] (Allen Curry: 1 personal fouls) TURNOVER! (dead ball)

================================================================================
                              1ST QUARTER COMPLETE                              
================================================================================

1ST QUARTER SCORE: Team_015 20, Team_065 23

BOX SCORE:
================================================================================

Team_015
--------------------------------------------------------------------------------
Player                MIN  PTS  REB  AST  TO      FG   FG%      3P   3P%
--------------------------------------------------------------------------------
Trae Turner            12   11    4    0   0   5/8    62.5     0/0   0.0
CJ Banchero            12    5    8    0   0   2/4    50.0     0/0   0.0
Michael Simmons        12    2    2    0   0   1/4    25.0     0/0   0.0
Manu Anthony           12    0    0    2   0   0/3     0.0     0/0   0.0
Scottie Gasol          12    0    0    2   0   0/0     0.0     0/0   0.0

TEAM: FG: 8/19 (42.1%), 3PT: 1/9 (11.1%), REB: 12 (2 off, 10 def), AST: 4, TO: 4
TEAM FOULS: 9 [Team_065 in BONUS]


Team_065
--------------------------------------------------------------------------------
Player                MIN  PTS  REB  AST  TO      FG   FG%      3P   3P%
--------------------------------------------------------------------------------
Russell Wade           12    5    4    3   0   3/5    60.0     0/0   0.0
RJ Harden              12    4    4    2   0   2/2   100.0     0/0   0.0
Karl Booker            12    4    0    0   0   2/4    50.0     0/0   0.0
Vince Mobley            0    4    0    0   0   1/1   100.0     0/0   0.0
Paul Williamson        12    3    0    0   0   1/3    33.3     0/0   0.0
Manu McGrady           12    3    4    1   0   1/6    16.7     0/0   0.0

TEAM: FG: 10/21 (47.6%), 3PT: 2/4 (50.0%), REB: 14 (3 off, 11 def), AST: 6, TO: 1
TEAM FOULS: 8 [Team_015 in BONUS]

================================================================================

================================================================================
                       2ND QUARTER - Team_015 vs Team_065                       
================================================================================

[12:00] Team_015 possession (Score: 20-23)
Manu Anthony drives and kicks out. Scottie Gasol attempts a 3Pt. Contested by RJ Harden (4.1 feet, ZONE). Scottie Gasol misses. Rebound secured by Manu McGrady.

[11:45] Team_065 possession (Score: 20-23)
Karl Booker drives to the basket... FOUL! Offensive foul on Karl Booker! Scottie Gasol drew the charge! [Team fouls: 1] (Karl Booker: 1 personal fouls) TURNOVER! (dead ball)

[11:31] Team_015 possession (Score: 20-23)
CJ Banchero attempts a Midrange. Contested by Manu McGrady (4.6 feet, ZONE). CJ BANCHERO MAKES IT! Assist: Trae Turner
Score: 22-23

[11:20] Team_065 possession (Score: 22-23)
Russell Wade attempts a Midrange. Contested by CJ Banchero (4.6 feet, ZONE). Russell Wade misses. Rebound secured by Trae Turner.

[11:03] Team_015 possession (Score: 22-23)
Scottie Gasol drives to the basket... Scottie Gasol loses the ball! Stripped by Russell Wade! TURNOVER! (live ball)

[10:51] Team_065 possession (Score: 22-23)
Paul Williamson attempts a Midrange. Contested by Michael Simmons (3.9 feet, MAN). PAUL WILLIAMSON MAKES IT!
Score: 22-25

[10:35] Team_015 possession (Score: 22-25)
Michael Simmons attempts a Midrange. Contested by Paul Williamson (3.8 feet, MAN). Michael Simmons misses. Offensive rebound by CJ Banchero! CJ Banchero kicks it out.

[10:19] Team_015 possession (Score: 22-25)
Michael Simmons drives, picks up Paul Williamson. Help arrives from Manu McGrady! Michael Simmons attempts a Dunk. Contested by Manu McGrady (3.8 feet, MAN). Michael Simmons misses. Rebound secured by Russell Wade.

[10:04] Team_065 possession (Score: 22-25)
RJ Harden attempts a Midrange. Contested by Manu Anthony (4.5 feet, MAN). RJ HARDEN MAKES IT!
Score: 22-27

[09:48] Team_015 possession (Score: 22-27)
Trae Turner attempts a 3Pt. Contested by Russell Wade (3.6 feet, MAN). TRAE TURNER MAKES IT! Assist: Scottie Gasol
Score: 25-27

[09:34] Team_065 possession (Score: 25-27)
Russell Wade attempts a Layup. Contested by Scottie Gasol (4.1 feet, MAN). RUSSELL WADE MAKES IT! Assist: Karl Booker
Score: 25-29

[09:19] Team_015 possession (Score: 25-29)
FOUL! Shooting foul on Russell Wade. Trae Turner to the line for 2 free throws. [Team fouls: 2] (Russell Wade: 1 personal fouls)   FT 1/2: GOOD   FT 2/2: GOOD Trae Turner makes 2/2 from the line.
Score: 27-29

[09:08] Team_065 possession (Score: 27-29)
Karl Booker attempts a Midrange. Contested by Scottie Gasol (4.1 feet, ZONE). Karl Booker misses. Rebound secured by Trae Turner.

[08:49] Team_015 possession (Score: 27-29)
Michael Simmons drives, picks up Paul Williamson. Help arrives from Manu McGrady! Michael Simmons attempts a Dunk. Contested by Manu McGrady (4.0 feet, MAN). Michael Simmons misses. Rebound secured by Russell Wade.

[08:34] Team_065 possession (Score: 27-29)
Karl Booker attempts a Midrange. Contested by CJ Banchero (4.8 feet, ZONE). Karl Booker misses. FOUL! Loose ball foul on Trae Turner during the rebound battle. [Team fouls: 1] No free throws, side out. (Trae Turner: 1 personal fouls)

[08:23] Team_065 possession (Score: 27-29)
Russell Wade drives and kicks out. Paul Williamson attempts a 3Pt. Contested by Michael Simmons (4.2 feet, MAN). Paul Williamson misses. Offensive rebound by Manu McGrady! Manu McGrady kicks it out.

[08:05] Team_065 possession (Score: 27-29)
Karl Booker attempts a 3Pt. Contested by Manu Anthony (4.3 feet, ZONE). Karl Booker misses. Rebound secured by Michael Simmons.

[07:52] Team_015 possession (Score: 27-29)
FOUL! Shooting foul on Manu McGrady. Michael Simmons to the line for 2 free throws. [Team fouls: 3] (Manu McGrady: 1 personal fouls)   FT 1/2: GOOD   FT 2/2: GOOD Michael Simmons makes 2/2 from the line.
Score: 29-29

[07:32] Team_065 possession (Score: 29-29)
Manu McGrady drives, picks up CJ Banchero. Help arrives from Michael Simmons! Manu McGrady attempts a Layup. Contested by Michael Simmons (4.9 feet, MAN). MANU MCGRADY MAKES IT! Assist: RJ Harden
Score: 29-31

[07:14] Team_015 possession (Score: 29-31)
Trae Turner attempts a Midrange. Contested by Karl Booker (5.5 feet, ZONE). Trae Turner misses. Offensive rebound by Michael Simmons! Michael Simmons kicks it out.

[07:00] Team_015 possession (Score: 29-31)
Michael Simmons attempts a Layup. Contested by Paul Williamson (4.3 feet, MAN). MICHAEL SIMMONS MAKES IT!
Score: 31-31

[06:41] Team_065 possession (Score: 31-31)
Paul Williamson attempts a Midrange. Contested by Michael Simmons (4.4 feet, MAN). Paul Williamson misses. Rebound secured by Michael Simmons.

[06:22] Team_015 possession (Score: 31-31)
Michael Simmons drives, picks up Russell Wade. Help arrives from Paul Williamson! Michael Simmons attempts a Layup. Contested by Paul Williamson (3.9 feet, ZONE). MICHAEL SIMMONS MAKES IT!
Score: 33-31

[06:05] Team_065 possession (Score: 33-31)
FOUL! Reach-in foul on Manu Anthony during the drive. [Team fouls: 2] No free throws, side out. (Manu Anthony: 1 personal fouls)

[05:51] Team_065 possession (Score: 33-31)
Manu McGrady attempts a Midrange. Contested by CJ Banchero (5.1 feet, MAN). MANU MCGRADY MAKES IT!
Score: 33-33

[05:32] Team_015 possession (Score: 33-33)
Trae Turner attempts a Midrange. Contested by Russell Wade (4.1 feet, MAN). TRAE TURNER MAKES IT! Assist: Michael Simmons
Score: 35-33

[05:20] Team_065 possession (Score: 35-33)
RJ Harden attempts a 3Pt. Contested by Manu Anthony (5.0 feet, ZONE). RJ Harden misses. Rebound secured by CJ Banchero.

[05:10] Team_015 possession (Score: 35-33)
Michael Simmons attempts a 3Pt. Contested by RJ Harden (4.9 feet, ZONE). Michael Simmons misses. Rebound secured by Russell Wade.

[04:52] Team_065 possession (Score: 35-33)
RJ Harden attempts a 3Pt. Contested by Manu Anthony (5.1 feet, MAN). RJ Harden misses. Rebound secured by Scottie Gasol.

[04:39] Team_015 possession (Score: 35-33)
Trae Turner attempts a 3Pt. Contested by RJ Harden (5.0 feet, ZONE). TRAE TURNER MAKES IT! Assist: Michael Simmons
Score: 38-33

[04:26] Team_065 possession (Score: 38-33)
Manu McGrady attempts a Layup. Contested by CJ Banchero (5.3 feet, MAN). Manu McGrady misses. Rebound secured by Michael Simmons.

[04:11] Team_015 possession (Score: 38-33)
CJ Banchero drives to the basket... FOUL! Offensive foul on CJ Banchero! Manu McGrady drew the charge! [Team fouls: 3] (CJ Banchero: 1 personal fouls) TURNOVER! (dead ball)

[03:57] Team_065 possession (Score: 38-33)
Russell Wade attempts a 3Pt. Contested by Manu Anthony (4.9 feet, ZONE). Russell Wade misses. Rebound secured by CJ Banchero.

[03:43] Team_015 possession (Score: 38-33)
Manu Anthony attempts a Midrange. Contested by Russell Wade (4.5 feet, ZONE). Manu Anthony misses. Offensive rebound by CJ Banchero! CJ Banchero kicks it out.

[03:30] Team_015 possession (Score: 38-33)
Scottie Gasol drives and kicks out. CJ Banchero attempts a Midrange. Contested by Manu McGrady (5.9 feet, MAN). CJ Banchero misses. Rebound secured by RJ Harden.

[03:17] Team_065 possession (Score: 38-33)
FOUL! Holding foul on Scottie Gasol. [Team fouls: 4] No free throws, side out. (Scottie Gasol: 1 personal fouls)

[02:59] Team_065 possession (Score: 38-33)
FOUL! Reach-in foul on Trae Turner during the drive. [IN THE BONUS! 5 team fouls] Karl Booker to the line for 2 free throws. (Trae Turner: 2 personal fouls)   FT 1/2: GOOD   FT 2/2: GOOD Karl Booker makes 2/2 from the line.
Score: 38-35

[02:45] Team_015 possession (Score: 38-35)
Trae Turner drives, Russell Wade stays with him. Trae Turner attempts a Dunk. Contested by Russell Wade (4.5 feet, ZONE). TRAE TURNER MAKES IT!
Score: 40-35

[02:32] Team_065 possession (Score: 40-35)
RJ Harden attempts a 3Pt. Contested by Manu Anthony (5.5 feet, ZONE). RJ Harden misses. Rebound secured by Scottie Gasol.

[02:20] Team_015 possession (Score: 40-35)
Manu Anthony drives and kicks out. Trae Turner attempts a Midrange. Contested by Paul Williamson (5.2 feet, ZONE). TRAE TURNER MAKES IT!
Score: 42-35

[02:05] Team_065 possession (Score: 42-35)
RJ Harden attempts a 3Pt. Contested by Manu Anthony (5.5 feet, MAN). RJ HARDEN MAKES IT!
Score: 42-38

[01:47] Team_015 possession (Score: 42-38)
Trae Turner attempts a 3Pt. Contested by Russell Wade (4.7 feet, MAN). Trae Turner misses. Rebound secured by RJ Harden.

[01:31] Team_065 possession (Score: 42-38)
FOUL! Shooting foul on Scottie Gasol. Russell Wade to the line for 2 free throws. [BONUS: 6 team fouls] (Scottie Gasol: 2 personal fouls)   FT 1/2: MISS   FT 2/2: GOOD Russell Wade makes 1/2 from the line.
Score: 42-39

[01:15] Team_015 possession (Score: 42-39)
Michael Simmons attempts a Midrange. Wide open! Manu McGrady is 6.0 feet away. [ZONE] MICHAEL SIMMONS MAKES IT!
Score: 44-39

[00:58] Team_065 possession (Score: 44-39)
Manu McGrady attempts a Layup. Contested by CJ Banchero (5.8 feet, MAN). MANU MCGRADY MAKES IT!
Score: 44-41

[00:45] Team_015 possession (Score: 44-41)
FOUL! Shooting foul on Paul Williamson. Scottie Gasol to the line for 2 free throws. [Team fouls: 4] (Paul Williamson: 1 personal fouls)   FT 1/2: GOOD   FT 2/2: GOOD Scottie Gasol makes 2/2 from the line.
Score: 46-41

[00:30] Team_065 possession (Score: 46-41)
Manu McGrady attempts a 3Pt. Contested by Manu Anthony (5.4 feet, ZONE). Manu McGrady misses. Offensive rebound by Russell Wade! Russell Wade kicks it out.

[00:19] Team_065 possession (Score: 46-41)
Manu McGrady attempts a 3Pt. Contested by Manu Anthony (5.4 feet, ZONE). Manu McGrady misses. Rebound secured by Michael Simmons.

[00:05] Team_015 possession (Score: 46-41)
Manu Anthony throws a bad pass! Stolen by RJ Harden! TURNOVER! (live ball)

================================================================================
                              2ND QUARTER COMPLETE                              
================================================================================

2ND QUARTER SCORE: Team_015 26, Team_065 18

BOX SCORE:
================================================================================

Team_015
--------------------------------------------------------------------------------
Player                MIN  PTS  REB  AST  TO      FG   FG%      3P   3P%
--------------------------------------------------------------------------------
Trae Turner            24   14    2    1   0   6/7    85.7     0/0   0.0
Michael Simmons        24    8    5    2   0   4/7    57.1     0/0   0.0
CJ Banchero            24    2    4    0   0   1/1   100.0     0/0   0.0
Scottie Gasol          24    2    2    1   0   1/2    50.0     0/0   0.0
Manu Anthony           24    0    0    0   0   0/1     0.0     0/0   0.0

TEAM: FG: 12/18 (66.7%), 3PT: 2/4 (50.0%), REB: 13 (3 off, 10 def), AST: 4, TO: 3
TEAM FOULS: 6 [Team_065 in BONUS]


Team_065
--------------------------------------------------------------------------------
Player                MIN  PTS  REB  AST  TO      FG   FG%      3P   3P%
--------------------------------------------------------------------------------
Manu McGrady           24    6    3    0   0   3/5    60.0     0/0   0.0
RJ Harden              24    5    2    1   0   2/5    40.0     0/0   0.0
Russell Wade           24    3    4    0   0   2/4    50.0     0/0   0.0
Paul Williamson        24    2    0    0   0   1/2    50.0     0/0   0.0
Karl Booker            24    2    0    1   0   1/3    33.3     0/0   0.0

TEAM: FG: 9/19 (47.4%), 3PT: 1/7 (14.3%), REB: 9 (3 off, 6 def), AST: 2, TO: 1
TEAM FOULS: 4

================================================================================

================================================================================
                       3RD QUARTER - Team_015 vs Team_065                       
================================================================================

[12:00] Team_015 possession (Score: 46-41)
Scottie Gasol drives to the basket... Scottie Gasol commits a violation (traveling/carry)! TURNOVER! (dead ball)

[11:45] Team_065 possession (Score: 46-41)
Karl Booker makes the Layup and draws the foul on Trae Turner! And-1! Karl Booker to the line for 1. [Team fouls: 1] (Trae Turner: 1 personal fouls)   FT 1/1: GOOD Karl Booker makes 1/1 from the line.
Score: 46-44

[11:30] Team_015 possession (Score: 46-44)
Scottie Gasol drives, picks up Russell Wade. Help arrives from Paul Williamson! Scottie Gasol attempts a Layup. Contested by Paul Williamson (3.1 feet, ZONE). SCOTTIE GASOL MAKES IT! Assist: Trae Turner
Score: 48-44

[11:16] Team_065 possession (Score: 48-44)
FOUL! Holding foul on Trae Turner. [Team fouls: 2] No free throws, side out. (Trae Turner: 2 personal fouls)

[11:03] Team_065 possession (Score: 48-44)
Paul Williamson attempts a 3Pt. Contested by Michael Simmons (3.5 feet, ZONE). PAUL WILLIAMSON MAKES IT! Assist: Karl Booker
Score: 48-47

[10:49] Team_015 possession (Score: 48-47)
Scottie Gasol attempts a Layup. Contested by Russell Wade (3.1 feet, MAN). SCOTTIE GASOL MAKES IT! Assist: Trae Turner
Score: 50-47

[10:36] Team_065 possession (Score: 50-47)
Paul Williamson attempts a Layup. BLOCKED BY MICHAEL SIMMONS! Ball is loose! Rebound secured by Trae Turner.

[10:23] Team_015 possession (Score: 50-47)
CJ Banchero drives and kicks out. CJ Banchero attempts a Midrange. Contested by Manu McGrady (4.6 feet, MAN). CJ Banchero misses. Offensive rebound by Trae Turner! Trae Turner's putback is no good. Rebound secured by Manu McGrady.

[10:10] Team_065 possession (Score: 50-47)
Paul Williamson attempts a 3Pt. Contested by Michael Simmons (3.5 feet, MAN). PAUL WILLIAMSON MAKES IT! Assist: RJ Harden
Score: 50-50

[09:53] Team_015 possession (Score: 50-50)
Trae Turner attempts a 3Pt. Contested by Manu McGrady (4.7 feet, ZONE). Trae Turner misses. Rebound secured by Russell Wade.

[09:39] Team_065 possession (Score: 50-50)
Paul Williamson drives and kicks out. RJ Harden attempts a 3Pt. Contested by Manu Anthony (3.6 feet, ZONE). RJ Harden misses. Rebound secured by CJ Banchero.

[09:25] Team_015 possession (Score: 50-50)
Trae Turner attempts a 3Pt. Contested by Russell Wade (3.2 feet, ZONE). Trae Turner misses. Rebound secured by Russell Wade.

[09:11] Team_065 possession (Score: 50-50)
Manu McGrady attempts a 3Pt. Contested by CJ Banchero (4.2 feet, MAN). Manu McGrady misses. Rebound secured by Michael Simmons.

[08:56] Team_015 possession (Score: 50-50)
Scottie Gasol drives, picks up Russell Wade. Help arrives from Paul Williamson! Scottie Gasol attempts a Dunk. Contested by Paul Williamson (3.1 feet, MAN). Scottie Gasol misses. Rebound secured by Manu McGrady.

[08:40] Team_065 possession (Score: 50-50)
RJ Harden drives and kicks out. Paul Williamson attempts a 3Pt. Contested by Michael Simmons (3.3 feet, MAN). Paul Williamson misses. Offensive rebound by Manu McGrady! Manu McGrady kicks it out.

[08:25] Team_065 possession (Score: 50-50)
RJ Harden attempts a 3Pt. Contested by Manu Anthony (4.1 feet, MAN). RJ Harden misses. Rebound secured by Trae Turner.

[08:14] Team_015 possession (Score: 50-50)
Trae Turner attempts a Midrange. Contested by Karl Booker (4.9 feet, ZONE). TRAE TURNER MAKES IT!
Score: 52-50

[07:56] Team_065 possession (Score: 52-50)
Paul Williamson drives to the basket... Paul Williamson loses the ball! Stripped by Scottie Gasol! TURNOVER! (live ball)

[07:41] Team_015 possession (Score: 52-50)
Manu Anthony attempts a Midrange. Contested by Karl Booker (5.0 feet, ZONE). MANU ANTHONY MAKES IT!
Score: 54-50

[07:28] Team_065 possession (Score: 54-50)
Karl Booker drives, Scottie Gasol stays with him. Karl Booker attempts a Dunk. Contested by Scottie Gasol (3.4 feet, ZONE). Karl Booker misses. Rebound secured by Trae Turner.

[07:13] Team_015 possession (Score: 54-50)
Scottie Gasol attempts a Midrange. Contested by Manu McGrady (4.6 feet, ZONE). SCOTTIE GASOL MAKES IT! Assist: Trae Turner
Score: 56-50

[06:55] Team_065 possession (Score: 56-50)
FOUL! Shooting foul on Scottie Gasol. Russell Wade to the line for 2 free throws. [Team fouls: 3] (Scottie Gasol: 1 personal fouls)   FT 1/2: GOOD   FT 2/2: GOOD Russell Wade makes 2/2 from the line.
Score: 56-52

[06:39] Team_015 possession (Score: 56-52)
Trae Turner attempts a 3Pt. Contested by RJ Harden (4.0 feet, ZONE). TRAE TURNER MAKES IT! Assist: Scottie Gasol
Score: 59-52

[06:22] Team_065 possession (Score: 59-52)
Paul Williamson attempts a 3Pt. Contested by Manu Anthony (3.8 feet, ZONE). PAUL WILLIAMSON MAKES IT! Assist: RJ Harden
Score: 59-55

[06:11] Team_015 possession (Score: 59-55)
CJ Banchero drives and kicks out. CJ Banchero attempts a 3Pt. Contested by RJ Harden (3.9 feet, ZONE). CJ Banchero misses. Rebound secured by RJ Harden.

[05:58] Team_065 possession (Score: 59-55)
Karl Booker attempts a Layup. Contested by Trae Turner (3.6 feet, MAN). Karl Booker misses. Rebound secured by Trae Turner.

[05:41] Team_015 possession (Score: 59-55)
Manu Anthony drives, RJ Harden stays with him. Manu Anthony attempts a Dunk. Contested by RJ Harden (4.2 feet, MAN). Manu Anthony misses. Rebound secured by Russell Wade.

[05:29] Team_065 possession (Score: 59-55)
Karl Booker attempts a 3Pt. Contested by Trae Turner (3.6 feet, MAN). KARL BOOKER MAKES IT! Assist: Russell Wade
Score: 59-58

[05:16] Team_015 possession (Score: 59-58)
Scottie Gasol makes the Layup and draws the foul on Russell Wade! And-1! Scottie Gasol to the line for 1. [Team fouls: 1] (Russell Wade: 1 personal fouls)   FT 1/1: GOOD Scottie Gasol makes 1/1 from the line.
Score: 62-58

[05:01] Team_065 possession (Score: 62-58)
Russell Wade attempts a Midrange. Contested by Scottie Gasol (3.5 feet, MAN). Russell Wade misses. Rebound secured by Michael Simmons.

[04:41] Team_015 possession (Score: 62-58)
Manu Anthony attempts a Midrange. Contested by RJ Harden (4.2 feet, MAN). MANU ANTHONY MAKES IT!
Score: 64-58

[04:26] Team_065 possession (Score: 64-58)
Karl Booker drives to the basket... FOUL! Offensive foul on Karl Booker! Scottie Gasol drew the charge! [Team fouls: 2] (Karl Booker: 1 personal fouls) TURNOVER! (dead ball)

[04:15] Team_015 possession (Score: 64-58)
Trae Turner attempts a Midrange. Contested by Paul Williamson (3.6 feet, ZONE). TRAE TURNER MAKES IT! Assist: Michael Simmons
Score: 66-58

[03:57] Team_065 possession (Score: 66-58)
RJ Harden drives, picks up Scottie Gasol. Help arrives from Michael Simmons! RJ Harden attempts a Layup. Contested by Michael Simmons (4.0 feet, ZONE). RJ HARDEN MAKES IT! Assist: Manu McGrady
Score: 66-60

[03:39] Team_015 possession (Score: 66-60)
FOUL! Shooting foul on Russell Wade. Trae Turner to the line for 2 free throws. [Team fouls: 3] (Russell Wade: 2 personal fouls)   FT 1/2: GOOD   FT 2/2: GOOD Trae Turner makes 2/2 from the line.
Score: 68-60

[03:20] Team_065 possession (Score: 68-60)
Russell Wade drives, Scottie Gasol stays with him. Russell Wade attempts a Layup. Contested by Scottie Gasol (3.7 feet, ZONE). RUSSELL WADE MAKES IT!
Score: 68-62

[03:04] Team_015 possession (Score: 68-62)
Manu Anthony attempts a Midrange. Contested by Paul Williamson (3.8 feet, ZONE). Manu Anthony misses. Rebound secured by Manu McGrady.

[02:48] Team_065 possession (Score: 68-62)
RJ Harden attempts a Layup. Contested by Scottie Gasol (4.1 feet, ZONE). RJ Harden misses. Rebound secured by Michael Simmons.

[02:33] Team_015 possession (Score: 68-62)
CJ Banchero attempts a 3Pt. Contested by RJ Harden (3.9 feet, ZONE). CJ Banchero misses. Rebound secured by Manu McGrady.

[02:17] Team_065 possession (Score: 68-62)
FOUL! Shooting foul on Michael Simmons. Paul Williamson to the line for 2 free throws. [Team fouls: 4] (Michael Simmons: 1 personal fouls)   FT 1/2: GOOD   FT 2/2: MISS Paul Williamson makes 1/2 from the line. Rebound secured by CJ Banchero.
Score: 68-63

[02:05] Team_015 possession (Score: 68-63)
FOUL! Shooting foul on RJ Harden. Scottie Gasol to the line for 3 free throws. [Team fouls: 4] (RJ Harden: 1 personal fouls)   FT 1/3: GOOD   FT 2/3: GOOD   FT 3/3: MISS Scottie Gasol makes 2/3 from the line. Rebound secured by Russell Wade.
Score: 70-63

[01:54] Team_065 possession (Score: 70-63)
Manu McGrady attempts a Midrange. Contested by CJ Banchero (4.5 feet, ZONE). Manu McGrady misses. Rebound secured by Michael Simmons.

[01:37] Team_015 possession (Score: 70-63)
CJ Banchero attempts a 3Pt. Contested by RJ Harden (4.0 feet, ZONE). CJ BANCHERO MAKES IT! Assist: Manu Anthony
Score: 73-63

[01:27] Team_065 possession (Score: 73-63)
RJ Harden attempts a Layup. Contested by Scottie Gasol (4.2 feet, ZONE). RJ HARDEN MAKES IT! Assist: Karl Booker
Score: 73-65

[01:15] Team_015 possession (Score: 73-65)
CJ Banchero attempts a 3Pt. Contested by Manu McGrady (4.7 feet, MAN). CJ BANCHERO MAKES IT! Assist: Trae Turner
Score: 76-65

[01:01] Team_065 possession (Score: 76-65)
RJ Harden drives and kicks out. Manu McGrady attempts a 3Pt. Contested by CJ Banchero (4.7 feet, MAN). Manu McGrady misses. Rebound secured by Michael Simmons.

[00:47] Team_015 possession (Score: 76-65)
Manu Anthony attempts a 3Pt. Contested by RJ Harden (4.5 feet, ZONE). MANU ANTHONY MAKES IT!
Score: 79-65

[00:34] Team_065 possession (Score: 79-65)
Karl Booker attempts a 3Pt. Contested by CJ Banchero (4.7 feet, ZONE). Karl Booker misses. Rebound secured by Michael Simmons.

[00:19] Team_015 possession (Score: 79-65)
Scottie Gasol attempts a Midrange. Contested by Russell Wade (3.5 feet, MAN). Scottie Gasol misses. Rebound secured by RJ Harden.

[00:08] Team_065 possession (Score: 79-65)
Karl Booker attempts a Midrange. Contested by Michael Simmons (3.9 feet, ZONE). KARL BOOKER MAKES IT! Assist: Russell Wade
Score: 79-67

================================================================================
                              3RD QUARTER COMPLETE                              
================================================================================

3RD QUARTER SCORE: Team_015 33, Team_065 26

BOX SCORE:
================================================================================

Team_015
--------------------------------------------------------------------------------
Player                MIN  PTS  REB  AST  TO      FG   FG%      3P   3P%
--------------------------------------------------------------------------------
Scottie Gasol          36    9    0    1   0   4/7    57.1     0/0   0.0
Trae Turner            36    9    4    4   0   4/6    66.7     0/0   0.0
Manu Anthony           36    7    0    1   0   3/5    60.0     0/0   0.0
CJ Banchero            36    6    2    0   0   2/5    40.0     0/0   0.0
Michael Simmons        36    0    6    1   0   0/0     0.0     0/0   0.0

TEAM: FG: 13/23 (56.5%), 3PT: 4/8 (50.0%), REB: 13 (1 off, 12 def), AST: 7, TO: 1
TEAM FOULS: 4


Team_065
--------------------------------------------------------------------------------
Player                MIN  PTS  REB  AST  TO      FG   FG%      3P   3P%
--------------------------------------------------------------------------------
Paul Williamson        36    9    0    0   0   3/6    50.0     0/0   0.0
Karl Booker            36    8    0    2   0   3/6    50.0     0/0   0.0
RJ Harden              36    4    2    2   0   2/5    40.0     0/0   0.0
Russell Wade           36    4    4    2   0   2/3    66.7     0/0   0.0
Manu McGrady           36    0    5    1   0   0/2     0.0     0/0   0.0

TEAM: FG: 10/22 (45.5%), 3PT: 4/7 (57.1%), REB: 10 (1 off, 9 def), AST: 7, TO: 2
TEAM FOULS: 4

================================================================================

================================================================================
                       4TH QUARTER - Team_015 vs Team_065                       
================================================================================

[12:00] Team_015 possession (Score: 79-67)
CJ Banchero attempts a 3Pt. Contested by RJ Harden (3.9 feet, ZONE). CJ Banchero misses. Rebound secured by Russell Wade.

[11:48] Team_065 possession (Score: 79-67)
Russell Wade attempts a 3Pt. Contested by Manu Anthony (4.0 feet, ZONE). RUSSELL WADE MAKES IT! Assist: Manu McGrady
Score: 79-70

[11:31] Team_015 possession (Score: 79-70)
Scottie Gasol drives to the basket... Scottie Gasol loses control! Ball rolls out of bounds! TURNOVER! (dead ball)

[11:31] Substitution (Team_015): Manu Anthony OUT → Dwyane Sabonis IN (stamina_rule2)

[11:31] Substitution (Team_015): Michael Simmons OUT → Paolo Jokic IN (stamina_rule2)

[11:31] Substitution (Team_015): CJ Banchero OUT → Magic Wagner IN (stamina_rule2)

[11:31] Substitution (Team_015): Scottie Gasol OUT → Rudy Paul IN (stamina_rule2)

[11:31] Substitution (Team_015): Trae Turner OUT → Allen Curry IN (stamina_rule2)

[11:31] Substitution (Team_065): RJ Harden OUT → Paul Curry IN (stamina_rule2)

[11:31] Substitution (Team_065): Paul Williamson OUT → Derrick Poole IN (stamina_rule2)

[11:31] Substitution (Team_065): Manu McGrady OUT → D'Angelo Porzingis IN (stamina_rule2)

[11:31] Substitution (Team_065): Russell Wade OUT → Karl Leonard IN (stamina_rule2)

[11:31] Substitution (Team_065): Karl Booker OUT → Vince Mobley IN (stamina_rule2)

[11:16] Team_065 possession (Score: 79-70)
Karl Leonard attempts a Layup. BLOCKED BY RUDY PAUL! Ball is loose! Rebound secured by Rudy Paul.

[10:59] Team_015 possession (Score: 79-70)
Magic Wagner attempts a 3Pt. Contested by Paul Curry (4.8 feet, ZONE). MAGIC WAGNER MAKES IT! Assist: Rudy Paul
Score: 82-70

[10:41] Team_065 possession (Score: 82-70)
FOUL! Holding foul on Rudy Paul. [Team fouls: 1] No free throws, side out. (Rudy Paul: 1 personal fouls)

[10:23] Team_065 possession (Score: 82-70)
FOUL! Reach-in foul on Paolo Jokic during the drive. [Team fouls: 2] No free throws, side out. (Paolo Jokic: 1 personal fouls)

[10:11] Team_065 possession (Score: 82-70)
Karl Leonard attempts a 3Pt. Contested by Rudy Paul (3.6 feet, MAN). Karl Leonard misses. Rebound secured by Allen Curry.

[09:55] Team_015 possession (Score: 82-70)
Rudy Paul loses the ball! Stripped by Karl Leonard! TURNOVER! (live ball)

[09:40] Team_065 possession (Score: 82-70)
Karl Leonard attempts a Midrange. Contested by Rudy Paul (3.6 feet, MAN). Karl Leonard misses. Offensive rebound by Vince Mobley! Vince Mobley puts it back in!
Score: 82-72

[09:24] Team_015 possession (Score: 82-72)
Magic Wagner attempts a Layup. BLOCKED BY DERRICK POOLE! Ball is loose! Rebound secured by D'Angelo Porzingis.

[09:10] Team_065 possession (Score: 82-72)
D'Angelo Porzingis drives and kicks out. D'Angelo Porzingis attempts a 3Pt. Contested by Magic Wagner (5.3 feet, MAN). D'Angelo Porzingis misses. Rebound secured by Allen Curry.

[09:00] Team_015 possession (Score: 82-72)
Paolo Jokic drives, picks up Derrick Poole. Help arrives from D'Angelo Porzingis! Paolo Jokic attempts a Layup. Contested by D'Angelo Porzingis (5.6 feet, MAN). Paolo Jokic misses. Offensive rebound by Rudy Paul! Rudy Paul puts it back in!
Score: 84-72

[08:44] Team_065 possession (Score: 84-72)
Karl Leonard drives, Rudy Paul stays with him. Karl Leonard attempts a Dunk. Contested by Rudy Paul (3.6 feet, ZONE). Karl Leonard misses. Rebound secured by Allen Curry.

[08:33] Team_015 possession (Score: 84-72)
Paolo Jokic attempts a 3Pt. Contested by Paul Curry (5.4 feet, ZONE). Paolo Jokic misses. Rebound secured by Karl Leonard.

[08:15] Team_065 possession (Score: 84-72)
FOUL! Shooting foul on Dwyane Sabonis. Paul Curry to the line for 2 free throws. [Team fouls: 3] (Dwyane Sabonis: 1 personal fouls)   FT 1/2: GOOD   FT 2/2: GOOD Paul Curry makes 2/2 from the line.
Score: 84-74

[08:02] Team_015 possession (Score: 84-74)
Paolo Jokic attempts a Midrange. Contested by Karl Leonard (5.0 feet, ZONE). Paolo Jokic misses. FOUL! Loose ball foul on Vince Mobley during the rebound battle. [Team fouls: 1] No free throws, side out. (Vince Mobley: 1 personal fouls)

[07:47] Team_015 possession (Score: 84-74)
Rudy Paul attempts a Midrange. Contested by Derrick Poole (5.5 feet, ZONE). Rudy Paul misses. Rebound secured by Karl Leonard.

[07:31] Team_065 possession (Score: 84-74)
Vince Mobley attempts a Midrange. Contested by Magic Wagner (5.3 feet, ZONE). VINCE MOBLEY MAKES IT! Assist: D'Angelo Porzingis
Score: 84-76

[07:17] Team_015 possession (Score: 84-76)
Dwyane Sabonis attempts a 3Pt. Contested by Paul Curry (5.1 feet, ZONE). Dwyane Sabonis misses. Rebound secured by Vince Mobley.

[07:01] Team_065 possession (Score: 84-76)
D'Angelo Porzingis attempts a 3Pt. Contested by Magic Wagner (5.5 feet, MAN). D'Angelo Porzingis misses. Offensive rebound by D'Angelo Porzingis! D'Angelo Porzingis kicks it out.

[06:45] Team_065 possession (Score: 84-76)
FOUL! Shooting foul on Paolo Jokic. D'Angelo Porzingis to the line for 2 free throws. [Team fouls: 4] (Paolo Jokic: 2 personal fouls)   FT 1/2: GOOD   FT 2/2: GOOD D'Angelo Porzingis makes 2/2 from the line.
Score: 84-78

[06:30] Team_015 possession (Score: 84-78)
FOUL! Shooting foul on Paul Curry. Rudy Paul to the line for 3 free throws. [Team fouls: 2] (Paul Curry: 1 personal fouls)   FT 1/3: GOOD   FT 2/3: GOOD   FT 3/3: MISS Rudy Paul makes 2/3 from the line. Offensive rebound by Allen Curry! Allen Curry puts it back in!
Score: 88-78

[06:18] Team_065 possession (Score: 88-78)
Karl Leonard drives and kicks out. Paul Curry attempts a 3Pt. Contested by Rudy Paul (3.2 feet, ZONE). Paul Curry misses. Rebound secured by Rudy Paul.

[06:06] Team_015 possession (Score: 88-78)
Dwyane Sabonis drives and kicks out. Dwyane Sabonis attempts a Midrange. Contested by Paul Curry (4.9 feet, MAN). DWYANE SABONIS MAKES IT! Assist: Allen Curry
Score: 90-78

[05:47] Team_065 possession (Score: 90-78)
FOUL! Reach-in foul on Rudy Paul during the drive. [IN THE BONUS! 5 team fouls] Paul Curry to the line for 2 free throws. (Rudy Paul: 2 personal fouls)   FT 1/2: GOOD   FT 2/2: GOOD Paul Curry makes 2/2 from the line.
Score: 90-80

[05:32] Team_015 possession (Score: 90-80)
Rudy Paul drives to the basket... Rudy Paul throws a bad pass out of bounds! TURNOVER! (dead ball)

[05:17] Team_065 possession (Score: 90-80)
FOUL! Shooting foul on Magic Wagner. D'Angelo Porzingis to the line for 2 free throws. [BONUS: 6 team fouls] (Magic Wagner: 1 personal fouls)   FT 1/2: GOOD   FT 2/2: GOOD D'Angelo Porzingis makes 2/2 from the line.
Score: 90-82

[05:01] Team_015 possession (Score: 90-82)
Magic Wagner attempts a Midrange. Contested by D'Angelo Porzingis (4.3 feet, MAN). Magic Wagner misses. Offensive rebound by Allen Curry! Allen Curry puts it back in!
Score: 92-82

[04:48] Team_065 possession (Score: 92-82)
D'Angelo Porzingis attempts a Layup. Contested by Magic Wagner (5.5 feet, MAN). D'Angelo Porzingis misses. Rebound secured by Rudy Paul.

[04:32] Team_015 possession (Score: 92-82)
Allen Curry attempts a Layup. Contested by Vince Mobley (4.6 feet, MAN). Allen Curry misses. Rebound secured by Vince Mobley.

[04:17] Team_065 possession (Score: 92-82)
Derrick Poole makes the Layup and draws the foul on Paolo Jokic! And-1! Derrick Poole to the line for 1. [BONUS: 7 team fouls] (Paolo Jokic: 3 personal fouls)   FT 1/1: MISS Derrick Poole makes 0/1 from the line. Rebound secured by Rudy Paul.
Score: 92-84

[04:04] Team_015 possession (Score: 92-84)
Dwyane Sabonis attempts a 3Pt. Contested by D'Angelo Porzingis (4.5 feet, ZONE). Dwyane Sabonis misses. Rebound secured by Karl Leonard.

[03:53] Team_065 possession (Score: 92-84)
Karl Leonard attempts a Midrange. Contested by Rudy Paul (3.6 feet, MAN). Karl Leonard misses. Rebound secured by Allen Curry.

[03:34] Team_015 possession (Score: 92-84)
Paolo Jokic attempts a Midrange. Contested by Karl Leonard (5.1 feet, ZONE). PAOLO JOKIC MAKES IT! Assist: Allen Curry
Score: 94-84

[03:19] Team_065 possession (Score: 94-84)
Vince Mobley attempts a Midrange. Contested by Rudy Paul (3.3 feet, MAN). Vince Mobley misses. Offensive rebound by Vince Mobley! Vince Mobley puts it back in!
Score: 94-86

[03:07] Team_015 possession (Score: 94-86)
Rudy Paul loses control! Ball rolls out of bounds! TURNOVER! (dead ball)

[02:52] Team_065 possession (Score: 94-86)
Karl Leonard drives, picks up Rudy Paul. Help arrives from Dwyane Sabonis! Karl Leonard attempts a Dunk. Contested by Dwyane Sabonis (3.7 feet, ZONE). KARL LEONARD MAKES IT!
Score: 94-88

[02:36] Team_015 possession (Score: 94-88)
FOUL! Reach-in foul on Vince Mobley during the drive. [Team fouls: 3] No free throws, side out. (Vince Mobley: 2 personal fouls)

[02:21] Team_015 possession (Score: 94-88)
FOUL! Reach-in foul on Derrick Poole during the drive. [Team fouls: 4] No free throws, side out. (Derrick Poole: 1 personal fouls)

[02:10] Team_015 possession (Score: 94-88)
Rudy Paul attempts a Layup. Contested by Vince Mobley (4.9 feet, ZONE). RUDY PAUL MAKES IT!
Score: 96-88

[01:58] Team_065 possession (Score: 96-88)
Karl Leonard attempts a 3Pt. Contested by Rudy Paul (3.8 feet, MAN). Karl Leonard misses. FOUL! Loose ball foul on Allen Curry during the rebound battle. [IN THE BONUS! 8 team fouls] D'Angelo Porzingis to the line for 2 free throws. (Allen Curry: 1 personal fouls)   FT 1/2: GOOD   FT 2/2: GOOD D'Angelo Porzingis makes 2/2 from the line.
Score: 96-90

[01:44] Team_015 possession (Score: 96-90)
Dwyane Sabonis attempts a Midrange. Contested by Derrick Poole (5.5 feet, ZONE). DWYANE SABONIS MAKES IT! Assist: Rudy Paul
Score: 98-90

[01:27] Team_065 possession (Score: 98-90)
Karl Leonard attempts a Midrange. Contested by Rudy Paul (3.9 feet, MAN). Karl Leonard misses. Rebound secured by Rudy Paul.

[01:15] Team_015 possession (Score: 98-90)
Paolo Jokic drives and kicks out. Dwyane Sabonis attempts a Midrange. Contested by Paul Curry (5.1 feet, MAN). DWYANE SABONIS MAKES IT! Assist: Allen Curry
Score: 100-90

[00:59] Team_065 possession (Score: 100-90)
Vince Mobley attempts a 3Pt. Contested by Rudy Paul (3.6 feet, MAN). VINCE MOBLEY MAKES IT! Assist: Karl Leonard
Score: 100-93

[00:48] Team_015 possession (Score: 100-93)
Allen Curry attempts a Layup. Contested by Vince Mobley (5.0 feet, ZONE). ALLEN CURRY MAKES IT! Assist: Rudy Paul
Score: 102-93

[00:37] Team_065 possession (Score: 102-93)
Derrick Poole attempts a Midrange. Contested by Rudy Paul (3.7 feet, ZONE). Derrick Poole misses. Rebound secured by Allen Curry.

[00:27] Team_015 possession (Score: 102-93)
Rudy Paul attempts a 3Pt. Contested by Karl Leonard (5.3 feet, MAN). RUDY PAUL MAKES IT! Assist: Allen Curry
Score: 105-93

[00:12] Team_065 possession (Score: 105-93)
FOUL! Holding foul on Rudy Paul. [IN THE BONUS! 9 team fouls] Vince Mobley to the line for 2 free throws. (Rudy Paul: 3 personal fouls)   FT 1/2: MISS   FT 2/2: GOOD Vince Mobley makes 1/2 from the line.
Score: 105-94

================================================================================
                              4TH QUARTER COMPLETE                              
================================================================================

4TH QUARTER SCORE: Team_015 26, Team_065 27

BOX SCORE:
================================================================================

Team_015
--------------------------------------------------------------------------------
Player                MIN  PTS  REB  AST  TO      FG   FG%      3P   3P%
--------------------------------------------------------------------------------
Allen Curry            12    8    6    4   0   3/4    75.0     0/0   0.0
Rudy Paul              12    7    7    3   0   3/4    75.0     0/0   0.0
Dwyane Sabonis         12    6    0    0   0   3/5    60.0     0/0   0.0
Magic Wagner           12    3    0    0   0   1/2    50.0     0/0   0.0
Paolo Jokic            12    2    0    0   0   1/2    50.0     0/0   0.0
CJ Banchero            37    0    0    0   0   0/1     0.0     0/0   0.0

TEAM: FG: 11/18 (61.1%), 3PT: 3/7 (42.9%), REB: 13 (3 off, 10 def), AST: 7, TO: 4
TEAM FOULS: 9 [Team_065 in BONUS]


Team_065
--------------------------------------------------------------------------------
Player                MIN  PTS  REB  AST  TO      FG   FG%      3P   3P%
--------------------------------------------------------------------------------
Vince Mobley           12   10    4    0   0   5/5   100.0     0/0   0.0
D'Angelo Porzingis     12    6    2    1   0   3/5    60.0     0/0   0.0
Paul Curry             12    4    0    0   0   2/2   100.0     0/0   0.0
Russell Wade           37    3    1    0   0   1/1   100.0     0/0   0.0
Karl Leonard           12    2    3    1   0   1/7    14.3     0/0   0.0
Manu McGrady           37    0    0    1   0   0/0     0.0     0/0   0.0
Derrick Poole          12    0    0    0   0   0/2     0.0     0/0   0.0

TEAM: FG: 12/22 (54.5%), 3PT: 3/4 (75.0%), REB: 10 (3 off, 7 def), AST: 3, TO: 0
TEAM FOULS: 4

================================================================================

================================================================================
                               FULL GAME COMPLETE                               
================================================================================

FINAL SCORE: Team_015 105, Team_065 94

SCORING BY QUARTER:
--------------------------------------------------------------------------------
Team                     Q1     Q2     Q3     Q4    FINAL
--------------------------------------------------------------------------------
Team_015                 20     26     33     26      105
Team_065                 23     18     26     27       94
--------------------------------------------------------------------------------

FULL GAME BOX SCORE:
================================================================================

Team_015
--------------------------------------------------------------------------------
Player                MIN  PTS  REB  AST  TO      FG   FG%      3P   3P%      FT STL BLK
--------------------------------------------------------------------------------
Manu Anthony           37    7    0    3   2   4/10   40.0   1/3    33.3   2/5     0   0
Michael Simmons        37   10   13    3   1   6/12   50.0   1/4    25.0   2/2     0   1
CJ Banchero            37   13   14    0   3   5/11   45.5   2/6    33.3   1/1     0   0
Scottie Gasol          37   11    2    4   1   5/9    55.6   0/1     0.0   5/6     1   0
Trae Turner            37   34   10    5   1  13/19   68.4   3/8    37.5   7/7     0   0
Dwyane Sabonis         12    6    0    0   1   2/4    50.0   0/2     0.0   0/0     0   0
Paolo Jokic            12    2    0    0   0   3/4    75.0   0/1     0.0   0/0     0   0
Magic Wagner           12    3    0    0   1   2/3    66.7   1/1   100.0   0/0     0   0
Rudy Paul              12    7    7    3   2   3/4    75.0   2/2   100.0   2/3     0   1
Allen Curry            12    8    7    4   0   1/2    50.0   0/0     0.0   0/0     0   0

TEAM: FG: 44/78 (56.4%), 3PT: 10/28 (35.7%), REB: 51 (9 off, 42 def), AST: 22, TO: 12


Team_065
--------------------------------------------------------------------------------
Player                MIN  PTS  REB  AST  TO      FG   FG%      3P   3P%      FT STL BLK
--------------------------------------------------------------------------------
RJ Harden              37   13    8    5   1   6/12   50.0   1/5    20.0   0/0     1   0
Paul Williamson        37   14    0    0   0   5/11   45.5   4/4   100.0   1/2     0   0
Manu McGrady           37    9   12    3   2   3/12   25.0   0/3     0.0   0/0     0   0
Russell Wade           37   15   13    5   1   8/13   61.5   1/2    50.0   6/10    1   1
Karl Booker            37   14    0    3   0   7/14   50.0   1/4    25.0   3/3     0   0
Paul Curry             12    4    0    0   0   2/2   100.0   0/0     0.0   4/4     0   0
Derrick Poole          12    0    0    0   0   0/2     0.0   0/0     0.0   0/1     0   1
D'Angelo Porzingis     12    6    2    1   0   2/4    50.0   0/0     0.0   6/6     0   0
Karl Leonard           12    2    3    1   0   4/10   40.0   2/3    66.7   2/3     1   0
Vince Mobley           12   14    5    0   0   3/3   100.0   1/1   100.0   1/2     0   0

TEAM: FG: 41/84 (48.8%), 3PT: 10/22 (45.5%), REB: 43 (10 off, 33 def), AST: 18, TO: 4

================================================================================
