================================================================================
                        FULL GAME - Team_058 vs Team_045                        
================================================================================

================================================================================
                       1ST QUARTER - Team_058 vs Team_045                       
================================================================================

[12:00] Team_058 possession (Score: 0-0)
Tyrese Doncic attempts a Midrange. Contested by Cole Simons (3.3 feet, ZONE). Tyrese Doncic misses. Offensive rebound by Stephen Haliburton! Stephen Haliburton's putback is no good. Rebound secured by Cole Simons.

[11:45] Team_045 possession (Score: 0-0)
Cole Simons attempts a Layup. Contested by Vince Hyland (5.1 feet, MAN). Cole Simons misses. Rebound secured by Bradley Sexton.

[11:31] Team_058 possession (Score: 0-0)
Tyrese Doncic attempts a Layup. BLOCKED BY ZION BUTLER! Ball is loose! Rebound secured by Zion Butler.

[11:15] Team_045 possession (Score: 0-0)
Zion Butler drives and kicks out. Zion Butler attempts a Midrange. Contested by Tyrese Doncic (4.4 feet, MAN). Zion Butler misses. Offensive rebound by Zion Butler! Zion Butler puts it back in!
Score: 0-2

[10:59] Team_058 possession (Score: 0-2)
Vince Hyland attempts a 3Pt. Contested by Cole Simons (3.6 feet, MAN). Vince Hyland misses. Rebound secured by DeMar Turner.

[10:43] Team_045 possession (Score: 0-2)
Cole Simons attempts a 3Pt. Contested by Bradley Sexton (3.6 feet, ZONE). Cole Simons misses. Rebound secured by Stephen Haliburton.

[10:28] Team_058 possession (Score: 0-2)
Tyrese Doncic drives and kicks out. Vince Hyland attempts a 3Pt. Contested by Cole Simons (3.3 feet, MAN). Vince Hyland misses. Offensive rebound by Stephen Haliburton! Stephen Haliburton's putback is no good. Offensive rebound by Tyrese Doncic! Tyrese Doncic kicks it out.

[10:15] Team_058 possession (Score: 0-2)
Bradley Sexton attempts a 3Pt. Contested by Rudy Antetokounmpo (4.8 feet, MAN). Bradley Sexton misses. Rebound secured by Zion Butler.

[10:01] Team_045 possession (Score: 0-2)
Trae Russell attempts a Midrange. Contested by Kyle Westbrook (4.5 feet, MAN). TRAE RUSSELL MAKES IT!
Score: 0-4

[09:49] Team_058 possession (Score: 0-4)
Stephen Haliburton attempts a Layup. Contested by Zion Butler (3.4 feet, MAN). Stephen Haliburton misses. Rebound secured by DeMar Turner.

[09:36] Team_045 possession (Score: 0-4)
FOUL! Reach-in foul on Stephen Haliburton during the drive. [Team fouls: 1] No free throws, side out. (Stephen Haliburton: 1 personal fouls)

[09:23] Team_045 possession (Score: 0-4)
Trae Russell drives, picks up Tyrese Doncic. Help arrives from Bradley Sexton! Trae Russell attempts a Layup. Contested by Bradley Sexton (4.9 feet, ZONE). TRAE RUSSELL MAKES IT!
Score: 0-6

[09:03] Team_058 possession (Score: 0-6)
FOUL! Shooting foul on Rudy Antetokounmpo. Kyle Westbrook to the line for 2 free throws. [Team fouls: 1] (Rudy Antetokounmpo: 1 personal fouls)   FT 1/2: GOOD   FT 2/2: GOOD Kyle Westbrook makes 2/2 from the line.
Score: 2-6

[08:46] Team_045 possession (Score: 2-6)
Zion Butler attempts a Midrange. Contested by Tyrese Doncic (4.7 feet, ZONE). Zion Butler misses. Rebound secured by Bradley Sexton.

[08:31] Team_058 possession (Score: 2-6)
Bradley Sexton attempts a Midrange. Contested by Rudy Antetokounmpo (4.8 feet, MAN). BRADLEY SEXTON MAKES IT!
Score: 4-6

[08:14] Team_045 possession (Score: 4-6)
Zion Butler attempts a 3Pt. Contested by Bradley Sexton (3.3 feet, ZONE). Zion Butler misses. Rebound secured by Tyrese Doncic.

[08:01] Team_058 possession (Score: 4-6)
Kyle Westbrook drives to the basket... Kyle Westbrook commits a violation (traveling/carry)! TURNOVER! (dead ball)

[07:46] Team_045 possession (Score: 4-6)
Trae Russell attempts a 3Pt. Contested by Kyle Westbrook (4.5 feet, MAN). Trae Russell misses. Rebound secured by Tyrese Doncic.

[07:31] Team_058 possession (Score: 4-6)
FOUL! Shooting foul on Rudy Antetokounmpo. Bradley Sexton to the line for 2 free throws. [Team fouls: 2] (Rudy Antetokounmpo: 2 personal fouls)   FT 1/2: GOOD   FT 2/2: GOOD Bradley Sexton makes 2/2 from the line.
Score: 6-6

[07:19] Team_045 possession (Score: 6-6)
FOUL! Holding foul on Kyle Westbrook. [Team fouls: 2] No free throws, side out. (Kyle Westbrook: 1 personal fouls)

[07:10] Team_045 possession (Score: 6-6)
Cole Simons makes the 3Pt and draws the foul on Vince Hyland! And-1! Cole Simons to the line for 1. [Team fouls: 3] (Vince Hyland: 1 personal fouls)   FT 1/1: GOOD Cole Simons makes 1/1 from the line.
Score: 6-10

[06:59] Team_058 possession (Score: 6-10)
Vince Hyland attempts a Midrange. Contested by Cole Simons (3.6 feet, MAN). VINCE HYLAND MAKES IT!
Score: 8-10

[06:48] Team_045 possession (Score: 8-10)
Zion Butler attempts a Midrange. Contested by Vince Hyland (4.8 feet, ZONE). ZION BUTLER MAKES IT!
Score: 8-12

[06:38] Team_058 possession (Score: 8-12)
Stephen Haliburton drives and kicks out. Vince Hyland attempts a 3Pt. Contested by Cole Simons (3.3 feet, MAN). Vince Hyland misses. Rebound secured by Cole Simons.

[06:24] Team_045 possession (Score: 8-12)
Rudy Antetokounmpo attempts a 3Pt. Contested by Bradley Sexton (3.4 feet, MAN). Rudy Antetokounmpo misses. Rebound secured by Tyrese Doncic.

[06:10] Team_058 possession (Score: 8-12)
FOUL! Reach-in foul on Zion Butler during the drive. [Team fouls: 3] No free throws, side out. (Zion Butler: 1 personal fouls)

[05:56] Team_058 possession (Score: 8-12)
Kyle Westbrook attempts a 3Pt. Contested by Cole Simons (3.4 feet, ZONE). Kyle Westbrook misses. Rebound secured by DeMar Turner.

[05:38] Team_045 possession (Score: 8-12)
Cole Simons drives and kicks out. Cole Simons attempts a 3Pt. Contested by Vince Hyland (4.5 feet, MAN). Cole Simons misses. Rebound secured by Bradley Sexton.

[05:27] Team_058 possession (Score: 8-12)
FOUL! Shooting foul on Cole Simons. Stephen Haliburton to the line for 2 free throws. [Team fouls: 4] (Cole Simons: 1 personal fouls)   FT 1/2: GOOD   FT 2/2: GOOD Stephen Haliburton makes 2/2 from the line.
Score: 10-12

[05:09] Team_045 possession (Score: 10-12)
FOUL! Reach-in foul on Stephen Haliburton during the drive. [Team fouls: 4] No free throws, side out. (Stephen Haliburton: 2 personal fouls)

[04:50] Team_045 possession (Score: 10-12)
Cole Simons drives and kicks out. Zion Butler attempts a 3Pt. Contested by Tyrese Doncic (4.4 feet, MAN). Zion Butler misses. Rebound secured by Stephen Haliburton.

[04:38] Team_058 possession (Score: 10-12)
FOUL! Offensive foul on Vince Hyland! Cole Simons drew the charge! [Team fouls: 5] (Vince Hyland: 2 personal fouls) TURNOVER! (dead ball)

[04:22] Team_045 possession (Score: 10-12)
Cole Simons attempts a 3Pt. Contested by Vince Hyland (5.2 feet, MAN). Cole Simons misses. Offensive rebound by DeMar Turner! DeMar Turner kicks it out.

[04:04] Team_045 possession (Score: 10-12)
Zion Butler drives and kicks out. Zion Butler attempts a 3Pt. Contested by Tyrese Doncic (4.5 feet, MAN). ZION BUTLER MAKES IT! Assist: Rudy Antetokounmpo
Score: 10-15

[03:49] Team_058 possession (Score: 10-15)
Vince Hyland attempts a 3Pt. Contested by Cole Simons (3.7 feet, ZONE). Vince Hyland misses. Offensive rebound by Tyrese Doncic! Tyrese Doncic kicks it out.

[03:30] Team_058 possession (Score: 10-15)
Vince Hyland makes the Layup and draws the foul on Rudy Antetokounmpo! And-1! Vince Hyland to the line for 1. [BONUS: 5 team fouls] (Rudy Antetokounmpo: 3 personal fouls)   FT 1/1: MISS Vince Hyland makes 0/1 from the line. Rebound secured by DeMar Turner.
Score: 12-15

[03:14] Team_045 possession (Score: 12-15)
Trae Russell attempts a Midrange. Contested by Vince Hyland (5.1 feet, ZONE). TRAE RUSSELL MAKES IT! Assist: DeMar Turner
Score: 12-17

[02:58] Team_058 possession (Score: 12-17)
Bradley Sexton attempts a 3Pt. Contested by Rudy Antetokounmpo (4.9 feet, MAN). Bradley Sexton misses. Rebound secured by DeMar Turner.

[02:43] Team_045 possession (Score: 12-17)
Zion Butler drives, Stephen Haliburton stays with him. Zion Butler attempts a Layup. Contested by Stephen Haliburton (4.0 feet, ZONE). ZION BUTLER MAKES IT! Assist: Cole Simons
Score: 12-19

[02:31] Team_058 possession (Score: 12-19)
Stephen Haliburton attempts a Layup. BLOCKED BY DEMAR TURNER! Ball goes out off DeMar Turner. Stephen Haliburton's ball!

[02:20] Team_058 possession (Score: 12-19)
Tyrese Doncic drives and kicks out. Bradley Sexton attempts a 3Pt. Contested by Cole Simons (3.6 feet, ZONE). Bradley Sexton misses. Rebound secured by Cole Simons.

[02:07] Team_045 possession (Score: 12-19)
Trae Russell attempts a 3Pt. Contested by Kyle Westbrook (4.9 feet, MAN). Trae Russell misses. Offensive rebound by DeMar Turner! DeMar Turner kicks it out.

[01:54] Team_045 possession (Score: 12-19)
Trae Russell drives, picks up Kyle Westbrook. Help arrives from Bradley Sexton! Trae Russell attempts a Dunk. Contested by Bradley Sexton (4.9 feet, MAN). TRAE RUSSELL MAKES IT!
Score: 12-21

[01:38] Team_058 possession (Score: 12-21)
Tyrese Doncic attempts a Midrange. Contested by Trae Russell (5.7 feet, ZONE). Tyrese Doncic misses. Rebound secured by Zion Butler.

[01:25] Team_045 possession (Score: 12-21)
DeMar Turner drives to the basket... DeMar Turner commits a violation (traveling/carry)! TURNOVER! (dead ball)

[01:25] Substitution (Team_058): Bradley Sexton OUT → Draymond Williamson IN (stamina_rule2)

[01:25] Substitution (Team_058): Kyle Westbrook OUT → Jordan Ingram IN (stamina_rule2)

[01:25] Substitution (Team_058): Vince Hyland OUT → Pascal Holiday IN (stamina_rule2)

[01:25] Substitution (Team_058): Stephen Haliburton OUT → Shai Lowry IN (stamina_rule2)

[01:25] Substitution (Team_058): Tyrese Doncic OUT → Jarrett Gilgeous-Alexander IN (stamina_rule2)

[01:25] Substitution (Team_045): Rudy Antetokounmpo OUT → John Wagner IN (stamina_rule2)

[01:25] Substitution (Team_045): Trae Russell OUT → Julius James IN (stamina_rule2)

[01:25] Substitution (Team_045): Cole Simons OUT → Gary Towns IN (stamina_rule2)

[01:25] Substitution (Team_045): DeMar Turner OUT → Tim Sexton IN (stamina_rule2)

[01:25] Substitution (Team_045): Zion Butler OUT → Stephen Paul IN (stamina_rule2)

[01:10] Team_058 possession (Score: 12-21)
FOUL! Offensive foul on Shai Lowry! Tim Sexton drew the charge! [Team fouls: 6] (Shai Lowry: 1 personal fouls) TURNOVER! (dead ball)

[00:56] Team_045 possession (Score: 12-21)
Julius James attempts a Layup. Wide open! Jordan Ingram is 6.1 feet away. [MAN] JULIUS JAMES MAKES IT! Assist: John Wagner
Score: 12-23

[00:40] Team_058 possession (Score: 12-23)
Draymond Williamson attempts a Midrange. Contested by John Wagner (4.5 feet, MAN). Draymond Williamson misses. Rebound secured by Tim Sexton.

[00:22] Team_045 possession (Score: 12-23)
Gary Towns drives and kicks out. Julius James attempts a 3Pt. Contested by Jordan Ingram (5.9 feet, MAN). JULIUS JAMES MAKES IT! Assist: Stephen Paul
Score: 12-26

[00:07] Team_058 possession (Score: 12-26)
Jarrett Gilgeous-Alexander drives to the basket... Jarrett Gilgeous-Alexander loses control! Ball rolls out of bounds! TURNOVER! (dead ball)

================================================================================
                              1ST QUARTER COMPLETE                              
================================================================================

1ST QUARTER SCORE: Team_058 12, Team_045 26

BOX SCORE:
================================================================================

Team_058
--------------------------------------------------------------------------------
Player                MIN  PTS  REB  AST  TO      FG   FG%      3P   3P%
--------------------------------------------------------------------------------
Bradley Sexton         11    4    3    0   0   2/4    50.0     0/0   0.0
Vince Hyland           11    2    0    0   0   1/3    33.3     0/0   0.0
Stephen Haliburton     11    2    2    0   0   1/3    33.3     0/0   0.0
Kyle Westbrook         11    2    0    0   0   1/2    50.0     0/0   0.0
Tyrese Doncic          11    0    5    0   0   0/4     0.0     0/0   0.0
Draymond Williamson     1    0    0    0   0   0/1     0.0     0/0   0.0

TEAM: FG: 5/17 (29.4%), 3PT: 0/4 (0.0%), REB: 11 (3 off, 8 def), AST: 0, TO: 4
TEAM FOULS: 6 [Team_045 in BONUS]


Team_045
--------------------------------------------------------------------------------
Player                MIN  PTS  REB  AST  TO      FG   FG%      3P   3P%
--------------------------------------------------------------------------------
Zion Butler            11    9    4    0   0   4/6    66.7     0/0   0.0
Trae Russell           11    8    0    0   0   4/5    80.0     0/0   0.0
Julius James            1    5    0    0   0   2/2   100.0     0/0   0.0
Cole Simons            11    4    3    1   0   1/5    20.0     0/0   0.0
DeMar Turner           11    0    7    1   0   0/0     0.0     0/0   0.0
Rudy Antetokounmpo     11    0    0    1   0   0/1     0.0     0/0   0.0
John Wagner             1    0    0    1   0   0/0     0.0     0/0   0.0
Tim Sexton              1    0    1    0   0   0/0     0.0     0/0   0.0
Stephen Paul            1    0    0    1   0   0/0     0.0     0/0   0.0

TEAM: FG: 11/19 (57.9%), 3PT: 1/5 (20.0%), REB: 14 (3 off, 11 def), AST: 5, TO: 1
TEAM FOULS: 5 [Team_058 in BONUS]

================================================================================

================================================================================
                       2ND QUARTER - Team_058 vs Team_045                       
================================================================================

[12:00] Team_058 possession (Score: 12-26)
FOUL! Reach-in foul on Cole Simons during the drive. [Team fouls: 1] No free throws, side out. (Cole Simons: 1 personal fouls)

[11:47] Team_058 possession (Score: 12-26)
Bradley Sexton makes the Layup and draws the foul on Zion Butler! And-1! Bradley Sexton to the line for 1. [Team fouls: 2] (Zion Butler: 1 personal fouls)   FT 1/1: GOOD Bradley Sexton makes 1/1 from the line.
Score: 15-26

[11:31] Team_045 possession (Score: 15-26)
Rudy Antetokounmpo attempts a 3Pt. Contested by Bradley Sexton (3.5 feet, MAN). Rudy Antetokounmpo misses. Rebound secured by Bradley Sexton.

[11:13] Team_058 possession (Score: 15-26)
Tyrese Doncic drives, picks up Zion Butler. Help arrives from Rudy Antetokounmpo! Tyrese Doncic attempts a Layup. Contested by Rudy Antetokounmpo (3.6 feet, MAN). TYRESE DONCIC MAKES IT! Assist: Vince Hyland
Score: 17-26

[11:00] Team_045 possession (Score: 17-26)
Rudy Antetokounmpo drives, Tyrese Doncic stays with him. Rudy Antetokounmpo attempts a Layup. Contested by Tyrese Doncic (4.9 feet, ZONE). RUDY ANTETOKOUNMPO MAKES IT! Assist: Cole Simons
Score: 17-28

[10:44] Team_058 possession (Score: 17-28)
Tyrese Doncic drives and kicks out. Tyrese Doncic attempts a Midrange. Contested by Cole Simons (3.6 feet, ZONE). Tyrese Doncic misses. FOUL! Loose ball foul on Cole Simons during the rebound battle. [Team fouls: 3] No free throws, side out. (Cole Simons: 2 personal fouls)

[10:32] Team_058 possession (Score: 17-28)
Tyrese Doncic drives and kicks out. Stephen Haliburton attempts a Midrange. Contested by DeMar Turner (5.1 feet, MAN). STEPHEN HALIBURTON MAKES IT!
Score: 19-28

[10:20] Team_045 possession (Score: 19-28)
Rudy Antetokounmpo attempts a 3Pt. Contested by Bradley Sexton (3.6 feet, ZONE). Rudy Antetokounmpo misses. Rebound secured by Stephen Haliburton.

[10:06] Team_058 possession (Score: 19-28)
Tyrese Doncic attempts a Layup. Contested by Zion Butler (3.8 feet, MAN). Tyrese Doncic misses. Rebound secured by Zion Butler.

[09:47] Team_045 possession (Score: 19-28)
Rudy Antetokounmpo loses the ball! Stripped by Bradley Sexton! TURNOVER! (live ball)

[09:33] Team_058 possession (Score: 19-28)
Tyrese Doncic drives and kicks out. Tyrese Doncic attempts a 3Pt. Contested by Cole Simons (3.7 feet, ZONE). Tyrese Doncic misses. Rebound secured by DeMar Turner.

[09:20] Team_045 possession (Score: 19-28)
FOUL! Shooting foul on Vince Hyland. Cole Simons to the line for 3 free throws. [Team fouls: 1] (Vince Hyland: 1 personal fouls)   FT 1/3: GOOD   FT 2/3: GOOD   FT 3/3: GOOD Cole Simons makes 3/3 from the line.
Score: 19-31

[09:07] Team_058 possession (Score: 19-31)
FOUL! Shooting foul on DeMar Turner. Stephen Haliburton to the line for 2 free throws. [Team fouls: 4] (DeMar Turner: 1 personal fouls)   FT 1/2: MISS   FT 2/2: GOOD Stephen Haliburton makes 1/2 from the line.
Score: 20-31

[08:54] Team_045 possession (Score: 20-31)
FOUL! Holding foul on Vince Hyland. [Team fouls: 2] No free throws, side out. (Vince Hyland: 2 personal fouls)

[08:41] Team_045 possession (Score: 20-31)
Zion Butler throws a bad pass! Stolen by Tyrese Doncic! TURNOVER! (live ball)

[08:32] Team_058 possession (Score: 20-31)
Stephen Haliburton attempts a 3Pt. Contested by Cole Simons (4.0 feet, ZONE). Stephen Haliburton misses. Rebound secured by Zion Butler.

[08:19] Team_045 possession (Score: 20-31)
Cole Simons drives and kicks out. Trae Russell attempts a Midrange. Contested by Kyle Westbrook (4.7 feet, MAN). Trae Russell misses. Rebound secured by Stephen Haliburton.

[08:05] Team_058 possession (Score: 20-31)
Kyle Westbrook attempts a Layup. Contested by Zion Butler (4.2 feet, ZONE). Kyle Westbrook misses. Rebound secured by Zion Butler.

[07:54] Team_045 possession (Score: 20-31)
Cole Simons throws a bad pass! Stolen by Vince Hyland! TURNOVER! (live ball)

[07:39] Team_058 possession (Score: 20-31)
Bradley Sexton attempts a Midrange. Contested by Rudy Antetokounmpo (5.2 feet, MAN). Bradley Sexton misses. Rebound secured by Zion Butler.

[07:24] Team_045 possession (Score: 20-31)
Zion Butler drives and kicks out. Rudy Antetokounmpo attempts a 3Pt. Contested by Bradley Sexton (3.8 feet, MAN). RUDY ANTETOKOUNMPO MAKES IT! Assist: DeMar Turner
Score: 20-34

[07:09] Team_058 possession (Score: 20-34)
Stephen Haliburton drives, Zion Butler stays with him. Stephen Haliburton attempts a Layup. Contested by Zion Butler (4.4 feet, ZONE). Stephen Haliburton misses. Rebound secured by Zion Butler.

[06:59] Team_045 possession (Score: 20-34)
Cole Simons drives and kicks out. Zion Butler attempts a 3Pt. Contested by Tyrese Doncic (5.1 feet, MAN). Zion Butler misses. Offensive rebound by DeMar Turner! DeMar Turner kicks it out.

[06:42] Team_045 possession (Score: 20-34)
Trae Russell attempts a 3Pt. Contested by Kyle Westbrook (5.4 feet, MAN). Trae Russell misses. Rebound secured by Vince Hyland.

[06:23] Team_058 possession (Score: 20-34)
Kyle Westbrook makes the Layup and draws the foul on Zion Butler! And-1! Kyle Westbrook to the line for 1. [BONUS: 5 team fouls] (Zion Butler: 2 personal fouls)   FT 1/1: MISS Kyle Westbrook makes 0/1 from the line. Rebound secured by Cole Simons.
Score: 22-34

[06:09] Team_045 possession (Score: 22-34)
Rudy Antetokounmpo attempts a 3Pt. Contested by Bradley Sexton (4.2 feet, MAN). Rudy Antetokounmpo misses. Rebound secured by Stephen Haliburton.

[05:59] Team_058 possession (Score: 22-34)
Bradley Sexton drives and kicks out. Kyle Westbrook attempts a 3Pt. Wide open! Trae Russell is 6.2 feet away. [MAN] Kyle Westbrook misses. Rebound secured by DeMar Turner.

[05:48] Team_045 possession (Score: 22-34)
FOUL! Reach-in foul on Stephen Haliburton during the drive. [Team fouls: 3] No free throws, side out. (Stephen Haliburton: 1 personal fouls)

[05:35] Team_045 possession (Score: 22-34)
Rudy Antetokounmpo drives and kicks out. Rudy Antetokounmpo attempts a Midrange. Contested by Bradley Sexton (4.1 feet, MAN). Rudy Antetokounmpo misses. Rebound secured by Stephen Haliburton.

[05:24] Team_058 possession (Score: 22-34)
Vince Hyland attempts a Midrange. Contested by Cole Simons (4.7 feet, MAN). VINCE HYLAND MAKES IT!
Score: 24-34

[05:09] Team_045 possession (Score: 24-34)
Trae Russell attempts a 3Pt. Contested by Bradley Sexton (4.5 feet, ZONE). Trae Russell misses. Rebound secured by Stephen Haliburton.

[04:54] Team_058 possession (Score: 24-34)
Vince Hyland attempts a 3Pt. Contested by Cole Simons (4.8 feet, ZONE). VINCE HYLAND MAKES IT! Assist: Kyle Westbrook
Score: 27-34

[04:42] Team_045 possession (Score: 27-34)
Zion Butler loses the ball! Stripped by Tyrese Doncic! TURNOVER! (live ball)

[04:29] Team_058 possession (Score: 27-34)
Vince Hyland drives to the basket... FOUL! Offensive foul on Vince Hyland! Cole Simons drew the charge! [Team fouls: 4] (Vince Hyland: 3 personal fouls) TURNOVER! (dead ball)

[04:10] Team_045 possession (Score: 27-34)
DeMar Turner attempts a 3Pt. Contested by Bradley Sexton (4.5 feet, ZONE). DeMar Turner misses. Rebound secured by Stephen Haliburton.

[03:57] Team_058 possession (Score: 27-34)
Vince Hyland drives and kicks out. Bradley Sexton attempts a 3Pt. Contested by Rudy Antetokounmpo (5.6 feet, MAN). Bradley Sexton misses. Offensive rebound by Tyrese Doncic! Tyrese Doncic kicks it out.

[03:45] Team_058 possession (Score: 27-34)
Vince Hyland drives and kicks out. Kyle Westbrook attempts a Midrange. Wide open! Trae Russell is 6.5 feet away. [MAN] KYLE WESTBROOK MAKES IT! Assist: Tyrese Doncic
Score: 29-34

[03:30] Team_045 possession (Score: 29-34)
FOUL! Reach-in foul on Stephen Haliburton during the drive. [IN THE BONUS! 5 team fouls] DeMar Turner to the line for 2 free throws. (Stephen Haliburton: 2 personal fouls)   FT 1/2: GOOD   FT 2/2: GOOD DeMar Turner makes 2/2 from the line.
Score: 29-36

[03:18] Team_058 possession (Score: 29-36)
Kyle Westbrook attempts a 3Pt. Contested by Cole Simons (4.9 feet, ZONE). Kyle Westbrook misses. FOUL! Loose ball foul on Cole Simons during the rebound battle. [IN THE BONUS! 6 team fouls] Tyrese Doncic to the line for 2 free throws. (Cole Simons: 3 personal fouls)   FT 1/2: MISS   FT 2/2: GOOD Tyrese Doncic makes 1/2 from the line.
Score: 30-36

[03:05] Team_045 possession (Score: 30-36)
FOUL! Holding foul on Stephen Haliburton. [IN THE BONUS! 6 team fouls] DeMar Turner to the line for 2 free throws. (Stephen Haliburton: 3 personal fouls)   FT 1/2: GOOD   FT 2/2: GOOD DeMar Turner makes 2/2 from the line.
Score: 30-38

[02:50] Team_058 possession (Score: 30-38)
Tyrese Doncic attempts a 3Pt. Contested by Zion Butler (5.2 feet, MAN). TYRESE DONCIC MAKES IT! Assist: Kyle Westbrook
Score: 33-38

[02:31] Team_045 possession (Score: 33-38)
Zion Butler drives, Tyrese Doncic stays with him. Zion Butler attempts a Dunk. Contested by Tyrese Doncic (5.8 feet, MAN). Zion Butler misses. Rebound secured by Vince Hyland.

[02:19] Team_058 possession (Score: 33-38)
FOUL! Shooting foul on Rudy Antetokounmpo. Bradley Sexton to the line for 2 free throws. [BONUS: 7 team fouls] (Rudy Antetokounmpo: 1 personal fouls)   FT 1/2: GOOD   FT 2/2: GOOD Bradley Sexton makes 2/2 from the line.
Score: 35-38

[02:08] Team_045 possession (Score: 35-38)
FOUL! Reach-in foul on Stephen Haliburton during the drive. [IN THE BONUS! 7 team fouls] Zion Butler to the line for 2 free throws. (Stephen Haliburton: 4 personal fouls)   FT 1/2: MISS   FT 2/2: GOOD Zion Butler makes 1/2 from the line.
Score: 35-39

[01:52] Team_058 possession (Score: 35-39)
Tyrese Doncic makes the Layup and draws the foul on Zion Butler! And-1! Tyrese Doncic to the line for 1. [BONUS: 8 team fouls] (Zion Butler: 3 personal fouls)   FT 1/1: GOOD Tyrese Doncic makes 1/1 from the line.
Score: 38-39

[01:38] Team_045 possession (Score: 38-39)
Cole Simons attempts a 3Pt. Wide open! Vince Hyland is 6.2 feet away. [MAN] COLE SIMONS MAKES IT! Assist: DeMar Turner
Score: 38-42

[01:21] Team_058 possession (Score: 38-42)
Stephen Haliburton drives and kicks out. Bradley Sexton attempts a Midrange. Contested by Cole Simons (5.4 feet, ZONE). Bradley Sexton misses. Rebound secured by DeMar Turner.

[01:06] Team_045 possession (Score: 38-42)
DeMar Turner throws a bad pass! Stolen by Stephen Haliburton! TURNOVER! (live ball)

[00:52] Team_058 possession (Score: 38-42)
Bradley Sexton drives, Zion Butler stays with him. Bradley Sexton attempts a Layup. Contested by Zion Butler (5.8 feet, ZONE). BRADLEY SEXTON MAKES IT!
Score: 40-42

[00:38] Team_045 possession (Score: 40-42)
Zion Butler attempts a Midrange. Wide open! Kyle Westbrook is 6.1 feet away. [ZONE] Zion Butler misses. Rebound secured by Tyrese Doncic.

[00:28] Team_058 possession (Score: 40-42)
Bradley Sexton attempts a 3Pt. Contested by Cole Simons (5.5 feet, ZONE). Bradley Sexton misses. Rebound secured by DeMar Turner.

[00:10] Team_045 possession (Score: 40-42)
Trae Russell attempts a 3Pt. Wide open! Kyle Westbrook is 6.4 feet away. [MAN] Trae Russell misses. Offensive rebound by DeMar Turner! DeMar Turner kicks it out.

================================================================================
                              2ND QUARTER COMPLETE                              
================================================================================

2ND QUARTER SCORE: Team_058 28, Team_045 16

BOX SCORE:
================================================================================

Team_058
--------------------------------------------------------------------------------
Player                MIN  PTS  REB  AST  TO      FG   FG%      3P   3P%
--------------------------------------------------------------------------------
Tyrese Doncic          23    9    3    1   0   4/6    66.7     0/0   0.0
Bradley Sexton         23    7    1    0   0   3/6    50.0     0/0   0.0
Vince Hyland           23    5    2    1   0   2/2   100.0     0/0   0.0
Stephen Haliburton     23    3    6    0   0   2/5    40.0     0/0   0.0
Kyle Westbrook         23    2    0    2   0   1/3    33.3     0/0   0.0

TEAM: FG: 12/22 (54.5%), 3PT: 3/5 (60.0%), REB: 12 (2 off, 10 def), AST: 4, TO: 1
TEAM FOULS: 7 [Team_045 in BONUS]


Team_045
--------------------------------------------------------------------------------
Player                MIN  PTS  REB  AST  TO      FG   FG%      3P   3P%
--------------------------------------------------------------------------------
Cole Simons            23    6    1    1   0   2/3    66.7     0/0   0.0
Rudy Antetokounmpo     23    5    0    0   0   2/6    33.3     0/0   0.0
DeMar Turner           23    4    6    2   0   2/3    66.7     0/0   0.0
Zion Butler            23    1    5    0   0   1/3    33.3     0/0   0.0
Trae Russell           23    0    0    0   0   0/2     0.0     0/0   0.0

TEAM: FG: 7/17 (41.2%), 3PT: 2/8 (25.0%), REB: 12 (2 off, 10 def), AST: 3, TO: 5
TEAM FOULS: 8 [Team_058 in BONUS]

================================================================================

================================================================================
                       3RD QUARTER - Team_058 vs Team_045                       
================================================================================

[12:00] Team_058 possession (Score: 40-42)
Vince Hyland attempts a 3Pt. Contested by Cole Simons (3.6 feet, ZONE). VINCE HYLAND MAKES IT! Assist: Kyle Westbrook
Score: 43-42

[11:46] Team_045 possession (Score: 43-42)
DeMar Turner attempts a Midrange. Contested by Stephen Haliburton (3.7 feet, ZONE). DeMar Turner misses. Offensive rebound by Zion Butler! Zion Butler puts it back in!
Score: 43-44

[11:35] Team_058 possession (Score: 43-44)
Tyrese Doncic drives, picks up Zion Butler. Help arrives from Rudy Antetokounmpo! Tyrese Doncic attempts a Dunk. Contested by Rudy Antetokounmpo (3.3 feet, MAN). Tyrese Doncic misses. Rebound secured by Cole Simons.

[11:20] Team_045 possession (Score: 43-44)
DeMar Turner drives to the basket... DeMar Turner loses the ball! Stripped by Stephen Haliburton! TURNOVER! (live ball)

[11:08] Team_058 possession (Score: 43-44)
Tyrese Doncic attempts a 3Pt. Contested by Zion Butler (3.3 feet, MAN). TYRESE DONCIC MAKES IT! Assist: Bradley Sexton
Score: 46-44

[10:55] Team_045 possession (Score: 46-44)
Trae Russell throws a bad pass! Stolen by Kyle Westbrook! TURNOVER! (live ball)

[10:43] Team_058 possession (Score: 46-44)
Stephen Haliburton attempts a Layup. Contested by Zion Butler (3.4 feet, MAN). STEPHEN HALIBURTON MAKES IT! Assist: Bradley Sexton
Score: 48-44

[10:31] Team_045 possession (Score: 48-44)
Trae Russell drives, Kyle Westbrook stays with him. Trae Russell attempts a Layup. Contested by Kyle Westbrook (4.5 feet, MAN). Trae Russell misses. Rebound secured by Stephen Haliburton.

[10:18] Team_058 possession (Score: 48-44)
Stephen Haliburton attempts a Midrange. Contested by Zion Butler (3.4 feet, MAN). Stephen Haliburton misses. Rebound secured by DeMar Turner.

[10:06] Team_045 possession (Score: 48-44)
DeMar Turner attempts a 3Pt. Contested by Bradley Sexton (3.3 feet, ZONE). DeMar Turner misses. FOUL! Loose ball foul on Tyrese Doncic during the rebound battle. [Team fouls: 1] No free throws, side out. (Tyrese Doncic: 1 personal fouls)

[09:53] Team_045 possession (Score: 48-44)
Cole Simons attempts a Layup. Contested by Vince Hyland (5.1 feet, MAN). COLE SIMONS MAKES IT!
Score: 48-46

[09:35] Team_058 possession (Score: 48-46)
Kyle Westbrook drives, Zion Butler stays with him. Kyle Westbrook attempts a Dunk. Contested by Zion Butler (3.4 feet, ZONE). KYLE WESTBROOK MAKES IT! Assist: Bradley Sexton
Score: 50-46

[09:22] Team_045 possession (Score: 50-46)
DeMar Turner attempts a Midrange. Contested by Stephen Haliburton (3.7 feet, MAN). DEMAR TURNER MAKES IT! Assist: Zion Butler
Score: 50-48

[09:04] Team_058 possession (Score: 50-48)
Bradley Sexton attempts a 3Pt. Contested by Rudy Antetokounmpo (4.8 feet, MAN). Bradley Sexton misses. Rebound secured by DeMar Turner.

[08:52] Team_045 possession (Score: 50-48)
Trae Russell drives, Stephen Haliburton stays with him. Trae Russell attempts a Layup. Contested by Stephen Haliburton (4.0 feet, ZONE). Trae Russell misses. Offensive rebound by DeMar Turner! DeMar Turner kicks it out.

[08:39] Team_045 possession (Score: 50-48)
Trae Russell attempts a 3Pt. Contested by Kyle Westbrook (4.5 feet, MAN). Trae Russell misses. Rebound secured by Tyrese Doncic.

[08:27] Team_058 possession (Score: 50-48)
Kyle Westbrook drives, Zion Butler stays with him. Kyle Westbrook attempts a Layup. Contested by Zion Butler (3.4 feet, ZONE). Kyle Westbrook misses. Rebound secured by Cole Simons.

[08:10] Team_045 possession (Score: 50-48)
DeMar Turner makes the Layup and draws the foul on Bradley Sexton! And-1! DeMar Turner to the line for 1. [Team fouls: 2] (Bradley Sexton: 1 personal fouls)   FT 1/1: GOOD DeMar Turner makes 1/1 from the line.
Score: 50-51

[07:53] Team_058 possession (Score: 50-51)
Tyrese Doncic attempts a 3Pt. Contested by Cole Simons (3.3 feet, ZONE). TYRESE DONCIC MAKES IT! Assist: Bradley Sexton
Score: 53-51

[07:42] Team_045 possession (Score: 53-51)
Rudy Antetokounmpo loses the ball! Stripped by Bradley Sexton! TURNOVER! (live ball)

[07:29] Team_058 possession (Score: 53-51)
Stephen Haliburton drives and kicks out. Stephen Haliburton attempts a Midrange. Contested by Zion Butler (3.2 feet, MAN). Stephen Haliburton misses. Rebound secured by DeMar Turner.

[07:16] Team_045 possession (Score: 53-51)
DeMar Turner attempts a 3Pt. Contested by Stephen Haliburton (3.7 feet, MAN). DEMAR TURNER MAKES IT! Assist: Trae Russell
Score: 53-54

[07:01] Team_058 possession (Score: 53-54)
Stephen Haliburton attempts a Layup. Contested by Zion Butler (3.4 feet, ZONE). Stephen Haliburton misses. Rebound secured by Zion Butler.

[06:46] Team_045 possession (Score: 53-54)
Trae Russell drives to the basket... Trae Russell throws a bad pass out of bounds! TURNOVER! (dead ball)

[06:35] Team_058 possession (Score: 53-54)
FOUL! Reach-in foul on Zion Butler during the drive. [Team fouls: 1] No free throws, side out. (Zion Butler: 1 personal fouls)

[06:19] Team_058 possession (Score: 53-54)
Stephen Haliburton attempts a Layup. BLOCKED BY ZION BUTLER! Ball deflects out of bounds off Stephen Haliburton.

[06:04] Team_045 possession (Score: 53-54)
Zion Butler drives, Tyrese Doncic stays with him. Zion Butler attempts a Dunk. Contested by Tyrese Doncic (4.7 feet, MAN). ZION BUTLER MAKES IT!
Score: 53-56

[05:50] Team_058 possession (Score: 53-56)
Kyle Westbrook attempts a 3Pt. Contested by Cole Simons (3.4 feet, ZONE). Kyle Westbrook misses. Offensive rebound by Tyrese Doncic! Tyrese Doncic kicks it out.

[05:39] Team_058 possession (Score: 53-56)
FOUL! Holding foul on Cole Simons. [Team fouls: 2] No free throws, side out. (Cole Simons: 1 personal fouls)

[05:26] Team_058 possession (Score: 53-56)
Kyle Westbrook attempts a 3Pt. Contested by Cole Simons (3.5 feet, MAN). Kyle Westbrook misses. Rebound secured by Zion Butler.

[05:12] Team_045 possession (Score: 53-56)
FOUL! Shooting foul on Bradley Sexton. Rudy Antetokounmpo to the line for 2 free throws. [Team fouls: 3] (Bradley Sexton: 2 personal fouls)   FT 1/2: MISS   FT 2/2: GOOD Rudy Antetokounmpo makes 1/2 from the line.
Score: 53-57

[04:53] Team_058 possession (Score: 53-57)
Tyrese Doncic attempts a 3Pt. Contested by Zion Butler (3.4 feet, MAN). Tyrese Doncic misses. Offensive rebound by Stephen Haliburton! Stephen Haliburton's putback is no good. Rebound secured by Cole Simons.

[04:41] Team_045 possession (Score: 53-57)
Rudy Antetokounmpo attempts a 3Pt. Contested by Bradley Sexton (3.4 feet, ZONE). Rudy Antetokounmpo misses. Rebound secured by Bradley Sexton.

[04:25] Team_058 possession (Score: 53-57)
Bradley Sexton drives and kicks out. Kyle Westbrook attempts a 3Pt. Contested by Cole Simons (3.4 feet, MAN). Kyle Westbrook misses. Rebound secured by Zion Butler.

[04:13] Team_045 possession (Score: 53-57)
FOUL! Reach-in foul on Bradley Sexton during the drive. [Team fouls: 4] No free throws, side out. (Bradley Sexton: 3 personal fouls)

[04:02] Team_045 possession (Score: 53-57)
Zion Butler makes the Layup and draws the foul on Bradley Sexton! And-1! Zion Butler to the line for 1. [BONUS: 5 team fouls] (Bradley Sexton: 4 personal fouls)   FT 1/1: GOOD Zion Butler makes 1/1 from the line.
Score: 53-60

[03:43] Team_058 possession (Score: 53-60)
Stephen Haliburton attempts a 3Pt. Contested by Cole Simons (3.6 feet, ZONE). STEPHEN HALIBURTON MAKES IT! Assist: Kyle Westbrook
Score: 56-60

[03:26] Team_045 possession (Score: 56-60)
Rudy Antetokounmpo attempts a Midrange. Contested by Vince Hyland (5.0 feet, ZONE). RUDY ANTETOKOUNMPO MAKES IT!
Score: 56-62

[03:14] Team_058 possession (Score: 56-62)
Bradley Sexton attempts a Midrange. Contested by Rudy Antetokounmpo (4.9 feet, MAN). BRADLEY SEXTON MAKES IT! Assist: Vince Hyland
Score: 58-62

[02:56] Team_045 possession (Score: 58-62)
Rudy Antetokounmpo drives and kicks out. Trae Russell attempts a Midrange. Contested by Kyle Westbrook (4.4 feet, MAN). Trae Russell misses. Rebound secured by Stephen Haliburton.

[02:43] Team_058 possession (Score: 58-62)
Kyle Westbrook attempts a 3Pt. Contested by Cole Simons (3.8 feet, ZONE). Kyle Westbrook misses. Rebound secured by DeMar Turner.

[02:33] Team_045 possession (Score: 58-62)
DeMar Turner commits a violation (traveling/carry)! TURNOVER! (dead ball)

[02:33] Substitution (Team_058): Bradley Sexton OUT → Draymond Williamson IN (stamina_rule2)

[02:33] Substitution (Team_058): Kyle Westbrook OUT → Jordan Ingram IN (stamina_rule2)

[02:33] Substitution (Team_058): Vince Hyland OUT → Pascal Holiday IN (stamina_rule2)

[02:33] Substitution (Team_058): Stephen Haliburton OUT → Shai Lowry IN (stamina_rule2)

[02:33] Substitution (Team_058): Tyrese Doncic OUT → Jarrett Gilgeous-Alexander IN (stamina_rule2)

[02:33] Substitution (Team_045): Rudy Antetokounmpo OUT → John Wagner IN (stamina_rule2)

[02:33] Substitution (Team_045): Trae Russell OUT → Julius James IN (stamina_rule2)

[02:33] Substitution (Team_045): Cole Simons OUT → Gary Towns IN (stamina_rule2)

[02:33] Substitution (Team_045): DeMar Turner OUT → Tim Sexton IN (stamina_rule2)

[02:33] Substitution (Team_045): Zion Butler OUT → Stephen Paul IN (stamina_rule2)

[02:15] Team_058 possession (Score: 58-62)
Jordan Ingram attempts a 3Pt. Contested by Julius James (4.0 feet, MAN). Jordan Ingram misses. Offensive rebound by Shai Lowry! Shai Lowry kicks it out.

[01:58] Team_058 possession (Score: 58-62)
Draymond Williamson attempts a 3Pt. Contested by John Wagner (4.5 feet, MAN). Draymond Williamson misses. Rebound secured by Stephen Paul.

[01:41] Team_045 possession (Score: 58-62)
FOUL! Shooting foul on Shai Lowry. Stephen Paul to the line for 2 free throws. [BONUS: 6 team fouls] (Shai Lowry: 1 personal fouls)   FT 1/2: MISS   FT 2/2: MISS Stephen Paul makes 0/2 from the line. Rebound secured by Pascal Holiday.

[01:24] Team_058 possession (Score: 58-62)
FOUL! Reach-in foul on Stephen Paul during the drive. [Team fouls: 3] No free throws, side out. (Stephen Paul: 1 personal fouls)

[01:06] Team_058 possession (Score: 58-62)
FOUL! Shooting foul on John Wagner. Draymond Williamson to the line for 2 free throws. [Team fouls: 4] (John Wagner: 1 personal fouls)   FT 1/2: GOOD   FT 2/2: GOOD Draymond Williamson makes 2/2 from the line.
Score: 60-62

[00:55] Team_045 possession (Score: 60-62)
Stephen Paul drives, Jarrett Gilgeous-Alexander stays with him. Stephen Paul attempts a Dunk. Contested by Jarrett Gilgeous-Alexander (5.2 feet, MAN). STEPHEN PAUL MAKES IT!
Score: 60-64

[00:40] Team_058 possession (Score: 60-64)
FOUL! Offensive foul on Jordan Ingram! Julius James drew the charge! [Team fouls: 7] (Jordan Ingram: 1 personal fouls) TURNOVER! (dead ball)

[00:28] Team_045 possession (Score: 60-64)
Tim Sexton attempts a Midrange. Contested by Shai Lowry (4.4 feet, MAN). Tim Sexton misses. Rebound secured by Pascal Holiday.

[00:10] Team_058 possession (Score: 60-64)
FOUL! Reach-in foul on Stephen Paul during the drive. [IN THE BONUS! 5 team fouls] Pascal Holiday to the line for 2 free throws. (Stephen Paul: 2 personal fouls)   FT 1/2: GOOD   FT 2/2: GOOD Pascal Holiday makes 2/2 from the line.
Score: 62-64

================================================================================
                              3RD QUARTER COMPLETE                              
================================================================================

3RD QUARTER SCORE: Team_058 22, Team_045 22

BOX SCORE:
================================================================================

Team_058
--------------------------------------------------------------------------------
Player                MIN  PTS  REB  AST  TO      FG   FG%      3P   3P%
--------------------------------------------------------------------------------
Tyrese Doncic          33    6    2    0   0   2/4    50.0     0/0   0.0
Stephen Haliburton     33    5    2    0   0   2/6    33.3     0/0   0.0
Vince Hyland           33    3    0    1   0   1/1   100.0     0/0   0.0
Kyle Westbrook         33    2    0    2   0   1/4    25.0     0/0   0.0
Cole Simons            33    2    3    0   0   1/1   100.0     0/0   0.0
Bradley Sexton         33    2    1    4   0   1/3    33.3     0/0   0.0
Draymond Williamson     4    2    0    0   0   1/2    50.0     0/0   0.0
Pascal Holiday          4    2    2    0   0   1/1   100.0     0/0   0.0
Shai Lowry              4    0    1    0   0   0/0     0.0     0/0   0.0

TEAM: FG: 9/21 (42.9%), 3PT: 4/9 (44.4%), REB: 9 (3 off, 6 def), AST: 7, TO: 1
TEAM FOULS: 7 [Team_045 in BONUS]


Team_045
--------------------------------------------------------------------------------
Player                MIN  PTS  REB  AST  TO      FG   FG%      3P   3P%
--------------------------------------------------------------------------------
DeMar Turner           33    8    6    0   0   3/3   100.0     0/0   0.0
Zion Butler            33    7    4    1   0   3/3   100.0     0/0   0.0
Rudy Antetokounmpo     33    3    0    0   0   2/4    50.0     0/0   0.0
Stephen Paul            4    2    1    0   0   1/2    50.0     0/0   0.0
Trae Russell           33    0    0    1   0   0/2     0.0     0/0   0.0
Tim Sexton              4    0    0    0   0   0/1     0.0     0/0   0.0

TEAM: FG: 10/16 (62.5%), 3PT: 1/3 (33.3%), REB: 13 (3 off, 10 def), AST: 2, TO: 5
TEAM FOULS: 5 [Team_058 in BONUS]

================================================================================

================================================================================
                       4TH QUARTER - Team_058 vs Team_045                       
================================================================================

[12:00] Team_058 possession (Score: 62-64)
Vince Hyland attempts a 3Pt. Contested by DeMar Turner (5.2 feet, ZONE). Vince Hyland misses. Rebound secured by Cole Simons.

[11:41] Team_045 possession (Score: 62-64)
Cole Simons attempts a Layup. Contested by Vince Hyland (5.1 feet, MAN). COLE SIMONS MAKES IT! Assist: Rudy Antetokounmpo
Score: 62-66

[11:23] Team_058 possession (Score: 62-66)
Kyle Westbrook drives, Zion Butler stays with him. Kyle Westbrook attempts a Layup. Contested by Zion Butler (3.6 feet, ZONE). Kyle Westbrook misses. Rebound secured by DeMar Turner.

[11:07] Team_045 possession (Score: 62-66)
Trae Russell throws a bad pass! Stolen by Kyle Westbrook! TURNOVER! (live ball)

[10:50] Team_058 possession (Score: 62-66)
Stephen Haliburton drives and kicks out. Tyrese Doncic attempts a 3Pt. Contested by Cole Simons (3.4 feet, ZONE). Tyrese Doncic misses. Offensive rebound by Tyrese Doncic! Tyrese Doncic kicks it out.

[10:30] Team_058 possession (Score: 62-66)
FOUL! Reach-in foul on Zion Butler during the drive. [Team fouls: 1] No free throws, side out. (Zion Butler: 1 personal fouls)

[10:19] Team_058 possession (Score: 62-66)
Vince Hyland drives to the basket... FOUL! Offensive foul on Vince Hyland! Cole Simons drew the charge! [Team fouls: 1] (Vince Hyland: 1 personal fouls) TURNOVER! (dead ball)

[10:02] Team_045 possession (Score: 62-66)
FOUL! Holding foul on Bradley Sexton. [Team fouls: 2] No free throws, side out. (Bradley Sexton: 1 personal fouls)

[09:49] Team_045 possession (Score: 62-66)
DeMar Turner makes the Midrange and draws the foul on Stephen Haliburton! And-1! DeMar Turner to the line for 1. [Team fouls: 3] (Stephen Haliburton: 1 personal fouls)   FT 1/1: GOOD DeMar Turner makes 1/1 from the line.
Score: 62-69

[09:36] Team_058 possession (Score: 62-69)
Bradley Sexton attempts a 3Pt. Contested by Cole Simons (3.8 feet, ZONE). BRADLEY SEXTON MAKES IT!
Score: 65-69

[09:21] Team_045 possession (Score: 65-69)
Cole Simons makes the Layup and draws the foul on Vince Hyland! And-1! Cole Simons to the line for 1. [Team fouls: 4] (Vince Hyland: 2 personal fouls)   FT 1/1: MISS Cole Simons makes 0/1 from the line. Rebound secured by Bradley Sexton.
Score: 65-71

[09:07] Team_058 possession (Score: 65-71)
Kyle Westbrook attempts a 3Pt. Contested by Cole Simons (3.7 feet, ZONE). Kyle Westbrook misses. Rebound secured by DeMar Turner.

[08:56] Team_045 possession (Score: 65-71)
Zion Butler attempts a Midrange. Contested by Vince Hyland (5.0 feet, ZONE). Zion Butler misses. Rebound secured by Tyrese Doncic.

[08:41] Team_058 possession (Score: 65-71)
Stephen Haliburton attempts a Layup. Contested by Zion Butler (3.9 feet, ZONE). STEPHEN HALIBURTON MAKES IT! Assist: Bradley Sexton
Score: 67-71

[08:24] Team_045 possession (Score: 67-71)
Trae Russell attempts a 3Pt. Contested by Kyle Westbrook (4.9 feet, MAN). Trae Russell misses. Rebound secured by Stephen Haliburton.

[08:09] Team_058 possession (Score: 67-71)
FOUL! Shooting foul on Cole Simons. Kyle Westbrook to the line for 3 free throws. [Team fouls: 2] (Cole Simons: 1 personal fouls)   FT 1/3: GOOD   FT 2/3: MISS   FT 3/3: GOOD Kyle Westbrook makes 2/3 from the line.
Score: 69-71

[07:58] Team_045 possession (Score: 69-71)
Rudy Antetokounmpo attempts a 3Pt. Contested by Bradley Sexton (3.8 feet, MAN). Rudy Antetokounmpo misses. Rebound secured by Stephen Haliburton.

[07:45] Team_058 possession (Score: 69-71)
Vince Hyland attempts a Midrange. Contested by Cole Simons (4.1 feet, ZONE). Vince Hyland misses. Rebound secured by Zion Butler.

[07:31] Team_045 possession (Score: 69-71)
Rudy Antetokounmpo attempts a Layup. Contested by Bradley Sexton (3.8 feet, MAN). RUDY ANTETOKOUNMPO MAKES IT! Assist: DeMar Turner
Score: 69-73

[07:18] Team_058 possession (Score: 69-73)
FOUL! Reach-in foul on Rudy Antetokounmpo during the drive. [Team fouls: 3] No free throws, side out. (Rudy Antetokounmpo: 1 personal fouls)

[07:05] Team_058 possession (Score: 69-73)
Vince Hyland attempts a Layup. Contested by DeMar Turner (5.6 feet, ZONE). Vince Hyland misses. Offensive rebound by Tyrese Doncic! Tyrese Doncic kicks it out.

[06:50] Team_058 possession (Score: 69-73)
Stephen Haliburton drives and kicks out. Tyrese Doncic attempts a Midrange. Contested by DeMar Turner (5.4 feet, ZONE). Tyrese Doncic misses. Rebound secured by DeMar Turner.

[06:34] Team_045 possession (Score: 69-73)
Rudy Antetokounmpo attempts a 3Pt. Contested by Bradley Sexton (4.0 feet, MAN). Rudy Antetokounmpo misses. Rebound secured by Bradley Sexton.

[06:23] Team_058 possession (Score: 69-73)
Tyrese Doncic attempts a Layup. BLOCKED BY RUDY ANTETOKOUNMPO! Ball deflects out of bounds off Tyrese Doncic.

[06:11] Team_045 possession (Score: 69-73)
Rudy Antetokounmpo drives and kicks out. Rudy Antetokounmpo attempts a 3Pt. Contested by Kyle Westbrook (4.9 feet, ZONE). Rudy Antetokounmpo misses. Rebound secured by Tyrese Doncic.

[05:57] Team_058 possession (Score: 69-73)
FOUL! Shooting foul on Cole Simons. Kyle Westbrook to the line for 2 free throws. [Team fouls: 4] (Cole Simons: 2 personal fouls)   FT 1/2: MISS   FT 2/2: GOOD Kyle Westbrook makes 1/2 from the line.
Score: 70-73

[05:40] Team_045 possession (Score: 70-73)
Cole Simons attempts a 3Pt. Contested by Bradley Sexton (4.3 feet, ZONE). Cole Simons misses. Rebound secured by Tyrese Doncic.

[05:27] Team_058 possession (Score: 70-73)
Stephen Haliburton drives, Zion Butler stays with him. Stephen Haliburton attempts a Layup. Contested by Zion Butler (4.4 feet, ZONE). Stephen Haliburton misses. Rebound secured by Cole Simons.

[05:10] Team_045 possession (Score: 70-73)
Trae Russell attempts a Midrange. Contested by Kyle Westbrook (5.4 feet, ZONE). Trae Russell misses. Rebound secured by Tyrese Doncic.

[04:55] Team_058 possession (Score: 70-73)
Stephen Haliburton attempts a 3Pt. Contested by DeMar Turner (5.6 feet, MAN). STEPHEN HALIBURTON MAKES IT! Assist: Bradley Sexton
Score: 73-73

[04:44] Team_045 possession (Score: 73-73)
Zion Butler attempts a Midrange. Contested by Bradley Sexton (4.1 feet, ZONE). Zion Butler misses. FOUL! Loose ball foul on Tyrese Doncic during the rebound battle. [IN THE BONUS! 5 team fouls] Zion Butler to the line for 2 free throws. (Tyrese Doncic: 1 personal fouls)   FT 1/2: MISS   FT 2/2: GOOD Zion Butler makes 1/2 from the line.
Score: 73-74

[04:28] Team_058 possession (Score: 73-74)
Bradley Sexton attempts a 3Pt. Contested by Rudy Antetokounmpo (5.4 feet, MAN). BRADLEY SEXTON MAKES IT! Assist: Vince Hyland
Score: 76-74

[04:12] Team_045 possession (Score: 76-74)
FOUL! Shooting foul on Kyle Westbrook. Rudy Antetokounmpo to the line for 2 free throws. [BONUS: 6 team fouls] (Kyle Westbrook: 1 personal fouls)   FT 1/2: GOOD   FT 2/2: GOOD Rudy Antetokounmpo makes 2/2 from the line.
Score: 76-76

[03:56] Team_058 possession (Score: 76-76)
Kyle Westbrook attempts a Layup. BLOCKED BY ZION BUTLER! Ball deflects out of bounds off Kyle Westbrook.

[03:45] Team_045 possession (Score: 76-76)
Rudy Antetokounmpo attempts a Midrange. Contested by Vince Hyland (5.6 feet, ZONE). Rudy Antetokounmpo misses. Rebound secured by Vince Hyland.

[03:28] Team_058 possession (Score: 76-76)
Tyrese Doncic drives to the basket... FOUL! Offensive foul on Tyrese Doncic! Zion Butler drew the charge! [Team fouls: 7] (Tyrese Doncic: 2 personal fouls) TURNOVER! (dead ball)

[03:15] Team_045 possession (Score: 76-76)
Trae Russell attempts a 3Pt. Contested by Bradley Sexton (4.6 feet, ZONE). TRAE RUSSELL MAKES IT! Assist: DeMar Turner
Score: 76-79

[02:58] Team_058 possession (Score: 76-79)
Bradley Sexton attempts a 3Pt. Contested by Cole Simons (4.8 feet, ZONE). Bradley Sexton misses. Rebound secured by DeMar Turner.

[02:45] Team_045 possession (Score: 76-79)
Trae Russell attempts a 3Pt. Contested by Bradley Sexton (4.6 feet, ZONE). Trae Russell misses. FOUL! Loose ball foul on Tyrese Doncic during the rebound battle. [IN THE BONUS! 8 team fouls] DeMar Turner to the line for 2 free throws. (Tyrese Doncic: 3 personal fouls)   FT 1/2: GOOD   FT 2/2: GOOD DeMar Turner makes 2/2 from the line.
Score: 76-81

[02:29] Team_058 possession (Score: 76-81)
FOUL! Shooting foul on Rudy Antetokounmpo. Bradley Sexton to the line for 2 free throws. [BONUS: 5 team fouls] (Rudy Antetokounmpo: 2 personal fouls)   FT 1/2: GOOD   FT 2/2: GOOD Bradley Sexton makes 2/2 from the line.
Score: 78-81

[02:16] Team_045 possession (Score: 78-81)
Rudy Antetokounmpo attempts a 3Pt. Contested by Bradley Sexton (4.6 feet, ZONE). RUDY ANTETOKOUNMPO MAKES IT!
Score: 78-84

[02:00] Team_058 possession (Score: 78-84)
Stephen Haliburton makes the Midrange and draws the foul on DeMar Turner! And-1! Stephen Haliburton to the line for 1. [BONUS: 6 team fouls] (DeMar Turner: 1 personal fouls)   FT 1/1: GOOD Stephen Haliburton makes 1/1 from the line.
Score: 81-84

[01:44] Team_045 possession (Score: 81-84)
Zion Butler drives to the basket... Zion Butler throws a bad pass out of bounds! TURNOVER! (dead ball)

[01:44] Substitution (Team_058): Bradley Sexton OUT → Draymond Williamson IN (stamina_rule2)

[01:44] Substitution (Team_058): Kyle Westbrook OUT → Jordan Ingram IN (stamina_rule2)

[01:44] Substitution (Team_058): Vince Hyland OUT → Pascal Holiday IN (stamina_rule2)

[01:44] Substitution (Team_058): Stephen Haliburton OUT → Shai Lowry IN (stamina_rule2)

[01:44] Substitution (Team_058): Tyrese Doncic OUT → Jarrett Gilgeous-Alexander IN (stamina_rule2)

[01:44] Substitution (Team_045): Rudy Antetokounmpo OUT → John Wagner IN (stamina_rule2)

[01:44] Substitution (Team_045): Trae Russell OUT → Julius James IN (stamina_rule2)

[01:44] Substitution (Team_045): Cole Simons OUT → Gary Towns IN (stamina_rule2)

[01:44] Substitution (Team_045): DeMar Turner OUT → Tim Sexton IN (stamina_rule2)

[01:44] Substitution (Team_045): Zion Butler OUT → Stephen Paul IN (stamina_rule2)

[01:28] Team_058 possession (Score: 81-84)
Jarrett Gilgeous-Alexander attempts a 3Pt. Contested by Stephen Paul (4.5 feet, MAN). JARRETT GILGEOUS-ALEXANDER MAKES IT! Assist: Jordan Ingram
Score: 84-84

[01:10] Team_045 possession (Score: 84-84)
Julius James attempts a Midrange. Wide open! Jordan Ingram is 6.1 feet away. [MAN] JULIUS JAMES MAKES IT!
Score: 84-86

[00:57] Team_058 possession (Score: 84-86)
Shai Lowry makes the Dunk and draws the foul on Julius James! And-1! Shai Lowry to the line for 1. [BONUS: 7 team fouls] (Julius James: 1 personal fouls)   FT 1/1: GOOD Shai Lowry makes 1/1 from the line.
Score: 87-86

[00:43] Team_045 possession (Score: 87-86)
Julius James attempts a Midrange. Contested by Pascal Holiday (4.7 feet, ZONE). Julius James misses. Rebound secured by Pascal Holiday.

[00:28] Team_058 possession (Score: 87-86)
Jarrett Gilgeous-Alexander loses control! Ball rolls out of bounds! TURNOVER! (dead ball)

[00:15] Team_045 possession (Score: 87-86)
John Wagner attempts a Midrange. Wide open! Jordan Ingram is 6.1 feet away. [ZONE] JOHN WAGNER MAKES IT!
Score: 87-88

[00:02] Team_058 possession (Score: 87-88)
Jarrett Gilgeous-Alexander attempts a Layup. BLOCKED BY TIM SEXTON! Ball is loose! Rebound secured by Stephen Paul.

================================================================================
                              4TH QUARTER COMPLETE                              
================================================================================

4TH QUARTER SCORE: Team_058 25, Team_045 24

BOX SCORE:
================================================================================

Team_058
--------------------------------------------------------------------------------
Player                MIN  PTS  REB  AST  TO      FG   FG%      3P   3P%
--------------------------------------------------------------------------------
Bradley Sexton         43    8    2    2   0   3/4    75.0     0/0   0.0
Stephen Haliburton     43    8    2    0   0   3/5    60.0     0/0   0.0
Kyle Westbrook         43    3    0    0   0   2/5    40.0     0/0   0.0
Jarrett Gilgeous-Alexander    5    3    0    0   0   1/2    50.0     0/0   0.0
Shai Lowry              5    3    0    0   0   1/1   100.0     0/0   0.0
Vince Hyland           43    0    1    1   0   0/2     0.0     0/0   0.0
Tyrese Doncic          43    0    6    0   0   0/1     0.0     0/0   0.0
Jordan Ingram           5    0    0    1   0   0/0     0.0     0/0   0.0
Pascal Holiday          5    0    1    0   0   0/0     0.0     0/0   0.0

TEAM: FG: 10/20 (50.0%), 3PT: 5/8 (62.5%), REB: 12 (2 off, 10 def), AST: 4, TO: 3
TEAM FOULS: 8 [Team_045 in BONUS]


Team_045
--------------------------------------------------------------------------------
Player                MIN  PTS  REB  AST  TO      FG   FG%      3P   3P%
--------------------------------------------------------------------------------
Rudy Antetokounmpo     43    7    0    1   0   3/7    42.9     0/0   0.0
DeMar Turner           43    5    4    2   0   2/2   100.0     0/0   0.0
Trae Russell           43    3    0    0   0   1/3    33.3     0/0   0.0
Cole Simons            43    2    2    0   0   1/3    33.3     0/0   0.0
Julius James            5    2    0    0   0   1/2    50.0     0/0   0.0
John Wagner             5    2    0    0   0   1/1   100.0     0/0   0.0
Zion Butler            43    1    1    0   0   1/2    50.0     0/0   0.0
Stephen Paul            5    0    1    0   0   0/0     0.0     0/0   0.0

TEAM: FG: 10/20 (50.0%), 3PT: 3/7 (42.9%), REB: 8 (0 off, 8 def), AST: 3, TO: 2
TEAM FOULS: 7 [Team_058 in BONUS]

================================================================================

================================================================================
                               FULL GAME COMPLETE                               
================================================================================

FINAL SCORE: Team_058 87, Team_045 88

SCORING BY QUARTER:
--------------------------------------------------------------------------------
Team                     Q1     Q2     Q3     Q4    FINAL
--------------------------------------------------------------------------------
Team_058                 12     28     22     25       87
Team_045                 26     16     22     24       88
--------------------------------------------------------------------------------

FULL GAME BOX SCORE:
================================================================================

Team_058
--------------------------------------------------------------------------------
Player                MIN  PTS  REB  AST  TO      FG   FG%      3P   3P%      FT STL BLK
--------------------------------------------------------------------------------
Bradley Sexton         43   21    7    6   1   9/17   52.9   2/7    28.6   7/7     2   0
Kyle Westbrook         43    9    0    4   1   5/14   35.7   2/6    33.3   5/8     2   0
Vince Hyland           43   10    3    3   3   5/9    55.6   2/4    50.0   0/1     1   0
Stephen Haliburton     43   18   12    0   0   7/18   38.9   2/3    66.7   4/5     2   0
Tyrese Doncic          43   15   16    1   0   6/15   40.0   3/4    75.0   2/3     2   0
Draymond Williamson     5    2    0    0   0   1/3    33.3   0/1     0.0   2/2     0   0
Jordan Ingram           5    0    0    1   1   0/0     0.0   0/0     0.0   0/0     0   0
Pascal Holiday          5    2    3    0   1   1/1   100.0   0/0     0.0   2/2     0   0
Shai Lowry              5    3    1    0   1   1/1   100.0   0/0     0.0   1/1     0   0
Jarrett Gilgeous-Alexander    5    3    0    0   1   1/2    50.0   1/1   100.0   0/0     0   0

TEAM: FG: 36/80 (45.0%), 3PT: 12/26 (46.2%), REB: 44 (10 off, 34 def), AST: 15, TO: 9


Team_045
--------------------------------------------------------------------------------
Player                MIN  PTS  REB  AST  TO      FG   FG%      3P   3P%      FT STL BLK
--------------------------------------------------------------------------------
Rudy Antetokounmpo     43   15    0    2   4   6/17   35.3   1/8    12.5   3/4     0   1
Trae Russell           43   11    0    1   2   6/13   46.2   2/7    28.6   0/0     0   0
Cole Simons            43   14    9    2   1   5/12   41.7   3/5    60.0   4/5     0   0
DeMar Turner           43   17   23    5   3   6/7    85.7   1/2    50.0   8/8     0   1
Zion Butler            43   18   14    1   3   9/14   64.3   0/1     0.0   3/5     0   3
John Wagner             5    2    0    1   0   1/1   100.0   0/0     0.0   0/0     0   0
Julius James            5    7    0    0   0   2/3    66.7   0/0     0.0   0/0     0   0
Gary Towns              5    0    0    0   0   1/1   100.0   0/0     0.0   0/0     0   0
Tim Sexton              5    0    1    0   0   0/1     0.0   0/0     0.0   0/0     0   1
Stephen Paul            5    2    2    1   0   1/2    50.0   0/0     0.0   0/2     0   0

TEAM: FG: 38/72 (52.8%), 3PT: 7/23 (30.4%), REB: 47 (8 off, 39 def), AST: 13, TO: 13

================================================================================
