================================================================================
                        FULL GAME - Team_061 vs Team_090                        
================================================================================

================================================================================
                       1ST QUARTER - Team_061 vs Team_090                       
================================================================================

[12:00] Team_061 possession (Score: 0-0)
Bam Sexton attempts a Midrange. Contested by Gary Brogdon (4.1 feet, MAN). BAM SEXTON MAKES IT! Assist: Brandon Russell
Score: 2-0

[11:49] Team_090 possession (Score: 2-0)
Gary Brogdon makes the Midrange and draws the foul on Michael Russell! And-1! Gary Brogdon to the line for 1. [Team fouls: 1] (Michael Russell: 1 personal fouls)   FT 1/1: GOOD Gary Brogdon makes 1/1 from the line.
Score: 2-3

[11:34] Team_061 possession (Score: 2-3)
Draymond Banchero drives, picks up Tracy Adebayo. Help arrives from Larry Bridges! Draymond Banchero attempts a Dunk. Contested by Larry Bridges (5.4 feet, MAN). Draymond Banchero misses. Rebound secured by Zach Wall.

[11:17] Team_090 possession (Score: 2-3)
Tracy Adebayo attempts a Midrange. Contested by Michael Russell (3.5 feet, ZONE). Tracy Adebayo misses. Rebound secured by Bam Sexton.

[11:06] Team_061 possession (Score: 2-3)
FOUL! Shooting foul on Larry Bridges. Michael Russell to the line for 2 free throws. [Team fouls: 1] (Larry Bridges: 1 personal fouls)   FT 1/2: GOOD   FT 2/2: GOOD Michael Russell makes 2/2 from the line.
Score: 4-3

[10:53] Team_090 possession (Score: 4-3)
Zach Wall drives, Michael Russell stays with him. Zach Wall attempts a Layup. Contested by Michael Russell (4.0 feet, MAN). ZACH WALL MAKES IT!
Score: 4-5

[10:39] Team_061 possession (Score: 4-5)
Brandon Russell makes the Layup and draws the foul on Derrick Mitchell! And-1! Brandon Russell to the line for 1. [Team fouls: 2] (Derrick Mitchell: 1 personal fouls)   FT 1/1: GOOD Brandon Russell makes 1/1 from the line.
Score: 7-5

[10:27] Team_090 possession (Score: 7-5)
Zach Wall drives and kicks out. Derrick Mitchell attempts a 3Pt. BLOCKED BY BRANDON RUSSELL! Ball is loose! Rebound secured by Michael Russell.

[10:13] Team_061 possession (Score: 7-5)
Bam Sexton drives, picks up Gary Brogdon. Help arrives from Larry Bridges! Bam Sexton attempts a Layup. Contested by Larry Bridges (4.1 feet, MAN). BAM SEXTON MAKES IT!
Score: 9-5

[09:58] Team_090 possession (Score: 9-5)
Gary Brogdon attempts a Midrange. Contested by Jayson Holiday (4.2 feet, ZONE). Gary Brogdon misses. FOUL! Loose ball foul on Michael Russell during the rebound battle. [Team fouls: 2] No free throws, side out. (Michael Russell: 2 personal fouls)

[09:43] Team_090 possession (Score: 9-5)
Zach Wall attempts a Layup. Contested by Draymond Banchero (2.9 feet, ZONE). Zach Wall misses. Rebound secured by Bam Sexton.

[09:31] Team_061 possession (Score: 9-5)
Draymond Banchero attempts a Layup. Contested by Tracy Adebayo (5.4 feet, MAN). Draymond Banchero misses. Offensive rebound by Michael Russell! Michael Russell's putback is no good. Rebound secured by Zach Wall.

[09:15] Team_090 possession (Score: 9-5)
Zach Wall attempts a Layup. Contested by Draymond Banchero (2.9 feet, ZONE). Zach Wall misses. Rebound secured by Michael Russell.

[09:05] Team_061 possession (Score: 9-5)
Jayson Holiday attempts a 3Pt. Contested by Larry Bridges (5.2 feet, MAN). Jayson Holiday misses. Offensive rebound by Michael Russell! Michael Russell puts it back in!
Score: 11-5

[08:50] Team_090 possession (Score: 11-5)
Derrick Mitchell attempts a 3Pt. Contested by Brandon Russell (4.2 feet, MAN). Derrick Mitchell misses. Offensive rebound by Gary Brogdon! Gary Brogdon kicks it out.

[08:33] Team_090 possession (Score: 11-5)
Zach Wall attempts a Layup. Contested by Michael Russell (4.0 feet, MAN). ZACH WALL MAKES IT! Assist: Derrick Mitchell
Score: 11-7

[08:19] Team_061 possession (Score: 11-7)
FOUL! Shooting foul on Derrick Mitchell. Jayson Holiday to the line for 3 free throws. [Team fouls: 3] (Derrick Mitchell: 2 personal fouls)   FT 1/3: GOOD   FT 2/3: GOOD   FT 3/3: GOOD Jayson Holiday makes 3/3 from the line.
Score: 14-7

[08:03] Team_090 possession (Score: 14-7)
Zach Wall attempts a Midrange. Contested by Jayson Holiday (4.2 feet, ZONE). ZACH WALL MAKES IT!
Score: 14-9

[07:49] Team_061 possession (Score: 14-9)
Jayson Holiday attempts a Layup. Contested by Larry Bridges (5.2 feet, MAN). Jayson Holiday misses. Rebound secured by Zach Wall.

[07:39] Team_090 possession (Score: 14-9)
FOUL! Reach-in foul on Jayson Holiday during the drive. [Team fouls: 3] No free throws, side out. (Jayson Holiday: 1 personal fouls)

[07:28] Team_090 possession (Score: 14-9)
Gary Brogdon attempts a 3Pt. Contested by Bam Sexton (5.1 feet, MAN). GARY BROGDON MAKES IT! Assist: Zach Wall
Score: 14-12

[07:14] Team_061 possession (Score: 14-12)
Brandon Russell attempts a 3Pt. Contested by Derrick Mitchell (3.4 feet, ZONE). Brandon Russell misses. Rebound secured by Tracy Adebayo.

[07:00] Team_090 possession (Score: 14-12)
Derrick Mitchell drives and kicks out. Gary Brogdon attempts a 3Pt. Contested by Bam Sexton (4.9 feet, ZONE). Gary Brogdon misses. Offensive rebound by Gary Brogdon! Gary Brogdon kicks it out.

[06:47] Team_090 possession (Score: 14-12)
FOUL! Reach-in foul on Brandon Russell during the drive. [Team fouls: 4] No free throws, side out. (Brandon Russell: 1 personal fouls)

[06:32] Team_090 possession (Score: 14-12)
Gary Brogdon attempts a 3Pt. Contested by Bam Sexton (5.1 feet, MAN). GARY BROGDON MAKES IT! Assist: Derrick Mitchell
Score: 14-15

[06:21] Team_061 possession (Score: 14-15)
Michael Russell drives, picks up Zach Wall. Help arrives from Larry Bridges! Michael Russell attempts a Dunk. Contested by Larry Bridges (5.3 feet, MAN). MICHAEL RUSSELL MAKES IT! Assist: Jayson Holiday
Score: 16-15

[06:10] Team_090 possession (Score: 16-15)
Derrick Mitchell attempts a Midrange. Contested by Bam Sexton (5.2 feet, ZONE). Derrick Mitchell misses. Rebound secured by Draymond Banchero.

[05:56] Team_061 possession (Score: 16-15)
Brandon Russell attempts a 3Pt. Contested by Derrick Mitchell (3.4 feet, MAN). BRANDON RUSSELL MAKES IT! Assist: Draymond Banchero
Score: 19-15

[05:38] Team_090 possession (Score: 19-15)
Larry Bridges attempts a 3Pt. Contested by Jayson Holiday (4.0 feet, MAN). Larry Bridges misses. Offensive rebound by Gary Brogdon! Gary Brogdon kicks it out.

[05:21] Team_090 possession (Score: 19-15)
Derrick Mitchell throws a bad pass out of bounds! TURNOVER! (dead ball)

[05:05] Team_061 possession (Score: 19-15)
Draymond Banchero attempts a Midrange. Contested by Zach Wall (5.6 feet, ZONE). DRAYMOND BANCHERO MAKES IT!
Score: 21-15

[04:50] Team_090 possession (Score: 21-15)
Gary Brogdon loses control! Ball rolls out of bounds! TURNOVER! (dead ball)

[04:35] Team_061 possession (Score: 21-15)
Jayson Holiday attempts a Layup. BLOCKED BY LARRY BRIDGES! Ball is loose! Rebound secured by Gary Brogdon.

[04:22] Team_090 possession (Score: 21-15)
FOUL! Holding foul on Bam Sexton. [IN THE BONUS! 5 team fouls] Gary Brogdon to the line for 2 free throws. (Bam Sexton: 1 personal fouls)   FT 1/2: GOOD   FT 2/2: GOOD Gary Brogdon makes 2/2 from the line.
Score: 21-17

[04:09] Team_061 possession (Score: 21-17)
Michael Russell attempts a 3Pt. Contested by Derrick Mitchell (3.6 feet, ZONE). Michael Russell misses. Rebound secured by Zach Wall.

[03:57] Team_090 possession (Score: 21-17)
Zach Wall attempts a Midrange. Contested by Michael Russell (4.2 feet, MAN). Zach Wall misses. Rebound secured by Michael Russell.

[03:43] Team_061 possession (Score: 21-17)
Bam Sexton drives and kicks out. Brandon Russell attempts a 3Pt. Contested by Derrick Mitchell (3.3 feet, ZONE). Brandon Russell misses. Rebound secured by Zach Wall.

[03:33] Team_090 possession (Score: 21-17)
Gary Brogdon attempts a Layup. Contested by Bam Sexton (5.1 feet, MAN). GARY BROGDON MAKES IT! Assist: Zach Wall
Score: 21-19

[03:20] Team_061 possession (Score: 21-19)
Bam Sexton drives, picks up Gary Brogdon. Help arrives from Larry Bridges! Bam Sexton attempts a Layup. Contested by Larry Bridges (4.4 feet, MAN). Bam Sexton misses. Offensive rebound by Michael Russell! Michael Russell puts it back in!
Score: 23-19

[03:03] Team_090 possession (Score: 23-19)
Zach Wall attempts a Midrange. Contested by Bam Sexton (5.3 feet, ZONE). Zach Wall misses. Rebound secured by Michael Russell.

[02:47] Team_061 possession (Score: 23-19)
Bam Sexton drives and kicks out. Bam Sexton attempts a Midrange. Contested by Zach Wall (5.1 feet, ZONE). BAM SEXTON MAKES IT! Assist: Brandon Russell
Score: 25-19

[02:35] Team_090 possession (Score: 25-19)
Zach Wall makes the Layup and draws the foul on Draymond Banchero! And-1! Zach Wall to the line for 1. [BONUS: 6 team fouls] (Draymond Banchero: 1 personal fouls)   FT 1/1: GOOD Zach Wall makes 1/1 from the line.
Score: 25-22

[02:22] Team_061 possession (Score: 25-22)
Brandon Russell attempts a 3Pt. BLOCKED BY DERRICK MITCHELL! Ball is loose! Rebound secured by Zach Wall.

[02:10] Team_090 possession (Score: 25-22)
Zach Wall makes the Dunk and draws the foul on Michael Russell! And-1! Zach Wall to the line for 1. [BONUS: 7 team fouls] (Michael Russell: 3 personal fouls)   FT 1/1: GOOD Zach Wall makes 1/1 from the line.
Score: 25-25

[01:56] Team_061 possession (Score: 25-25)
Bam Sexton attempts a 3Pt. Contested by Derrick Mitchell (4.0 feet, ZONE). Bam Sexton misses. Rebound secured by Zach Wall.

[01:43] Team_090 possession (Score: 25-25)
Zach Wall attempts a 3Pt. Contested by Michael Russell (4.4 feet, MAN). ZACH WALL MAKES IT! Assist: Tracy Adebayo
Score: 25-28

[01:30] Team_061 possession (Score: 25-28)
Brandon Russell drives and kicks out. Draymond Banchero attempts a 3Pt. Contested by Derrick Mitchell (3.6 feet, ZONE). DRAYMOND BANCHERO MAKES IT!
Score: 28-28

[01:14] Team_090 possession (Score: 28-28)
Gary Brogdon loses the ball! Stripped by Bam Sexton! TURNOVER! (live ball)

[00:55] Team_061 possession (Score: 28-28)
Jayson Holiday attempts a 3Pt. Contested by Larry Bridges (5.5 feet, MAN). Jayson Holiday misses. Rebound secured by Gary Brogdon.

[00:41] Team_090 possession (Score: 28-28)
Larry Bridges attempts a 3Pt. Contested by Jayson Holiday (4.6 feet, MAN). LARRY BRIDGES MAKES IT! Assist: Tracy Adebayo
Score: 28-31

[00:28] Team_061 possession (Score: 28-31)
Michael Russell attempts a Midrange. Contested by Gary Brogdon (4.7 feet, ZONE). Michael Russell misses. Rebound secured by Gary Brogdon.

[00:14] Team_090 possession (Score: 28-31)
Zach Wall attempts a 3Pt. Contested by Brandon Russell (4.6 feet, ZONE). ZACH WALL MAKES IT! Assist: Derrick Mitchell
Score: 28-34

[00:01] Team_061 possession (Score: 28-34)
Michael Russell drives and kicks out. Bam Sexton attempts a 3Pt. Contested by Derrick Mitchell (3.8 feet, ZONE). Bam Sexton misses. Rebound secured by Tracy Adebayo.

================================================================================
                              1ST QUARTER COMPLETE                              
================================================================================

1ST QUARTER SCORE: Team_061 28, Team_090 34

BOX SCORE:
================================================================================

Team_061
--------------------------------------------------------------------------------
Player                MIN  PTS  REB  AST  TO      FG   FG%      3P   3P%
--------------------------------------------------------------------------------
Michael Russell        12    8    6    0   0   4/7    57.1     0/0   0.0
Bam Sexton             12    6    2    0   0   3/5    60.0     0/0   0.0
Brandon Russell        12    6    0    2   0   2/4    50.0     0/0   0.0
Draymond Banchero      12    5    1    1   0   2/4    50.0     0/0   0.0
Jayson Holiday         12    3    0    1   0   1/4    25.0     0/0   0.0

TEAM: FG: 12/24 (50.0%), 3PT: 3/8 (37.5%), REB: 10 (3 off, 7 def), AST: 4, TO: 0
TEAM FOULS: 7 [Team_090 in BONUS]


Team_090
--------------------------------------------------------------------------------
Player                MIN  PTS  REB  AST  TO      FG   FG%      3P   3P%
--------------------------------------------------------------------------------
Zach Wall              12   18    7    2   0   7/12   58.3     0/0   0.0
Gary Brogdon           12   13    6    0   0   5/5   100.0     0/0   0.0
Larry Bridges          12    3    0    0   0   1/1   100.0     0/0   0.0
Tracy Adebayo          12    0    3    2   0   0/1     0.0     0/0   0.0
Derrick Mitchell       12    0    0    3   0   0/1     0.0     0/0   0.0

TEAM: FG: 13/20 (65.0%), 3PT: 5/5 (100.0%), REB: 15 (4 off, 11 def), AST: 7, TO: 3
TEAM FOULS: 3

================================================================================

================================================================================
                       2ND QUARTER - Team_061 vs Team_090                       
================================================================================

[12:00] Team_061 possession (Score: 28-34)
Michael Russell drives, picks up Gary Brogdon. Help arrives from Larry Bridges! Michael Russell attempts a Layup. Contested by Larry Bridges (4.4 feet, ZONE). MICHAEL RUSSELL MAKES IT!
Score: 30-34

[11:46] Team_090 possession (Score: 30-34)
FOUL! Offensive foul on Zach Wall! Michael Russell drew the charge! [Team fouls: 1] (Zach Wall: 1 personal fouls) TURNOVER! (dead ball)

[11:31] Team_061 possession (Score: 30-34)
FOUL! Reach-in foul on Derrick Mitchell during the drive. [Team fouls: 2] No free throws, side out. (Derrick Mitchell: 1 personal fouls)

[11:17] Team_061 possession (Score: 30-34)
Draymond Banchero makes the Midrange and draws the foul on Zach Wall! And-1! Draymond Banchero to the line for 1. [Team fouls: 3] (Zach Wall: 2 personal fouls)   FT 1/1: MISS Draymond Banchero makes 0/1 from the line. Rebound secured by Zach Wall.
Score: 32-34

[11:05] Team_090 possession (Score: 32-34)
Tracy Adebayo drives to the basket... Tracy Adebayo loses the ball! Stripped by Draymond Banchero! TURNOVER! (live ball)

[10:52] Team_061 possession (Score: 32-34)
FOUL! Holding foul on Zach Wall. [Team fouls: 4] No free throws, side out. (Zach Wall: 3 personal fouls)

[10:37] Team_061 possession (Score: 32-34)
Michael Russell attempts a Layup. Contested by Gary Brogdon (4.7 feet, ZONE). Michael Russell misses. Offensive rebound by Michael Russell! Michael Russell kicks it out.

[10:22] Team_061 possession (Score: 32-34)
Bam Sexton makes the Layup and draws the foul on Larry Bridges! And-1! Bam Sexton to the line for 1. [BONUS: 5 team fouls] (Larry Bridges: 1 personal fouls)   FT 1/1: GOOD Bam Sexton makes 1/1 from the line.
Score: 35-34

[10:06] Team_090 possession (Score: 35-34)
Zach Wall commits a violation (traveling/carry)! TURNOVER! (dead ball)

[10:06] Substitution (Team_061): Brandon Russell OUT → Evan Rose IN (stamina_rule2)

[10:06] Substitution (Team_061): Jayson Holiday OUT → Gary Fox IN (stamina_rule2)

[10:06] Substitution (Team_061): Michael Russell OUT → Desmond Morant IN (stamina_rule2)

[10:06] Substitution (Team_061): Bam Sexton OUT → Stephen Towns IN (stamina_rule2)

[10:06] Substitution (Team_061): Draymond Banchero OUT → Tim Durant IN (stamina_rule2)

[10:06] Substitution (Team_090): Derrick Mitchell OUT → OG Anunoby IN (stamina_rule2)

[10:06] Substitution (Team_090): Larry Bridges OUT → Josh Wall IN (stamina_rule2)

[10:06] Substitution (Team_090): Zach Wall OUT → Russell Smith IN (stamina_rule2)

[10:06] Substitution (Team_090): Gary Brogdon OUT → Derrick Nowitzki IN (stamina_rule2)

[10:06] Substitution (Team_090): Tracy Adebayo OUT → Tobias Tatum IN (stamina_rule2)

[09:53] Team_061 possession (Score: 35-34)
FOUL! Holding foul on OG Anunoby. [IN THE BONUS! 6 team fouls] Evan Rose to the line for 2 free throws. (OG Anunoby: 1 personal fouls)   FT 1/2: GOOD   FT 2/2: GOOD Evan Rose makes 2/2 from the line.
Score: 37-34

[09:37] Team_090 possession (Score: 37-34)
Derrick Nowitzki attempts a 3Pt. Contested by Desmond Morant (4.1 feet, ZONE). DERRICK NOWITZKI MAKES IT! Assist: Josh Wall
Score: 37-37

[09:27] Team_061 possession (Score: 37-37)
Tim Durant attempts a Midrange. Contested by Tobias Tatum (5.2 feet, MAN). TIM DURANT MAKES IT!
Score: 39-37

[09:09] Team_090 possession (Score: 39-37)
Russell Smith attempts a 3Pt. Contested by Desmond Morant (4.7 feet, MAN). Russell Smith misses. FOUL! Loose ball foul on Stephen Towns during the rebound battle. [Team fouls: 1] No free throws, side out. (Stephen Towns: 1 personal fouls)

[08:53] Team_090 possession (Score: 39-37)
Derrick Nowitzki attempts a Layup. Contested by Tim Durant (3.7 feet, ZONE). Derrick Nowitzki misses. Rebound secured by Tim Durant.

[08:38] Team_061 possession (Score: 39-37)
Gary Fox drives and kicks out. Gary Fox attempts a 3Pt. Contested by Russell Smith (4.3 feet, ZONE). Gary Fox misses. Rebound secured by Derrick Nowitzki.

[08:23] Team_090 possession (Score: 39-37)
Russell Smith attempts a Midrange. Contested by Tim Durant (4.4 feet, ZONE). Russell Smith misses. Rebound secured by Desmond Morant.

[08:11] Team_061 possession (Score: 39-37)
Gary Fox attempts a 3Pt. Contested by Josh Wall (4.2 feet, MAN). Gary Fox misses. Offensive rebound by Tim Durant! Tim Durant puts it back in!
Score: 41-37

[07:57] Team_090 possession (Score: 41-37)
OG Anunoby drives and kicks out. Russell Smith attempts a Midrange. Contested by Desmond Morant (4.5 feet, MAN). Russell Smith misses. FOUL! Loose ball foul on Desmond Morant during the rebound battle. [Team fouls: 2] No free throws, side out. (Desmond Morant: 1 personal fouls)

[07:46] Team_090 possession (Score: 41-37)
Russell Smith attempts a 3Pt. Contested by Desmond Morant (4.7 feet, MAN). Russell Smith misses. Rebound secured by Stephen Towns.

[07:32] Team_061 possession (Score: 41-37)
Desmond Morant attempts a 3Pt. Contested by Russell Smith (4.7 feet, MAN). Desmond Morant misses. Rebound secured by Tobias Tatum.

[07:15] Team_090 possession (Score: 41-37)
Derrick Nowitzki attempts a Midrange. BLOCKED BY DESMOND MORANT! Ball is loose! Rebound secured by Desmond Morant.

[07:06] Team_061 possession (Score: 41-37)
FOUL! Shooting foul on Derrick Nowitzki. Tim Durant to the line for 2 free throws. [BONUS: 7 team fouls] (Derrick Nowitzki: 1 personal fouls)   FT 1/2: GOOD   FT 2/2: GOOD Tim Durant makes 2/2 from the line.
Score: 43-37

[06:54] Team_090 possession (Score: 43-37)
FOUL! Reach-in foul on Tim Durant during the drive. [Team fouls: 3] No free throws, side out. (Tim Durant: 1 personal fouls)

[06:37] Team_090 possession (Score: 43-37)
Russell Smith drives and kicks out. Tobias Tatum attempts a Midrange. Contested by Tim Durant (4.1 feet, MAN). Tobias Tatum misses. Rebound secured by Tim Durant.

[06:21] Team_061 possession (Score: 43-37)
Desmond Morant drives, Russell Smith stays with him. Desmond Morant attempts a Layup. Contested by Russell Smith (4.7 feet, MAN). DESMOND MORANT MAKES IT!
Score: 45-37

[06:05] Team_090 possession (Score: 45-37)
Tobias Tatum drives and kicks out. Russell Smith attempts a 3Pt. Contested by Desmond Morant (4.5 feet, ZONE). Russell Smith misses. Rebound secured by Desmond Morant.

[05:51] Team_061 possession (Score: 45-37)
Stephen Towns drives to the basket... FOUL! Offensive foul on Stephen Towns! Derrick Nowitzki drew the charge! [Team fouls: 4] (Stephen Towns: 2 personal fouls) TURNOVER! (dead ball)

[05:34] Team_090 possession (Score: 45-37)
OG Anunoby throws a bad pass! Stolen by Evan Rose! TURNOVER! (live ball)

[05:19] Team_061 possession (Score: 45-37)
Evan Rose attempts a Midrange. Contested by Josh Wall (4.4 feet, ZONE). Evan Rose misses. Rebound secured by Russell Smith.

[05:02] Team_090 possession (Score: 45-37)
FOUL! Holding foul on Stephen Towns. [IN THE BONUS! 5 team fouls] Derrick Nowitzki to the line for 2 free throws. (Stephen Towns: 3 personal fouls)   FT 1/2: GOOD   FT 2/2: GOOD Derrick Nowitzki makes 2/2 from the line.
Score: 45-39

[04:43] Team_061 possession (Score: 45-39)
Desmond Morant attempts a Midrange. Contested by OG Anunoby (5.3 feet, ZONE). Desmond Morant misses. Offensive rebound by Tim Durant! Tim Durant puts it back in!
Score: 47-39

[04:26] Team_090 possession (Score: 47-39)
Derrick Nowitzki loses the ball! Stripped by Stephen Towns! TURNOVER! (live ball)

[04:08] Team_061 possession (Score: 47-39)
Stephen Towns attempts a 3Pt. Contested by Russell Smith (4.6 feet, ZONE). Stephen Towns misses. Rebound secured by Tobias Tatum.

[03:51] Team_090 possession (Score: 47-39)
Tobias Tatum attempts a Layup. Contested by Tim Durant (4.9 feet, ZONE). TOBIAS TATUM MAKES IT! Assist: Josh Wall
Score: 47-41

[03:34] Team_061 possession (Score: 47-41)
FOUL! Shooting foul on Russell Smith. Desmond Morant to the line for 2 free throws. [BONUS: 8 team fouls] (Russell Smith: 1 personal fouls)   FT 1/2: GOOD   FT 2/2: GOOD Desmond Morant makes 2/2 from the line.
Score: 49-41

[03:19] Team_090 possession (Score: 49-41)
Russell Smith attempts a Midrange. Contested by Stephen Towns (5.1 feet, ZONE). Russell Smith misses. Rebound secured by Desmond Morant.

[03:07] Team_061 possession (Score: 49-41)
Desmond Morant attempts a Layup. Contested by Derrick Nowitzki (4.7 feet, ZONE). Desmond Morant misses. Rebound secured by Derrick Nowitzki.

[02:52] Team_090 possession (Score: 49-41)
Tobias Tatum attempts a 3Pt. Contested by Tim Durant (4.9 feet, MAN). Tobias Tatum misses. Rebound secured by Stephen Towns.

[02:39] Team_061 possession (Score: 49-41)
Desmond Morant attempts a 3Pt. Contested by Derrick Nowitzki (4.7 feet, ZONE). DESMOND MORANT MAKES IT! Assist: Stephen Towns
Score: 52-41

[02:25] Team_090 possession (Score: 52-41)
Tobias Tatum attempts a 3Pt. Contested by Desmond Morant (5.3 feet, ZONE). TOBIAS TATUM MAKES IT! Assist: Derrick Nowitzki
Score: 52-44

[02:10] Team_061 possession (Score: 52-44)
Evan Rose attempts a Midrange. Contested by OG Anunoby (5.4 feet, MAN). Evan Rose misses. Offensive rebound by Tim Durant! Tim Durant's putback is no good. Rebound secured by Derrick Nowitzki.

[01:51] Team_090 possession (Score: 52-44)
FOUL! Holding foul on Evan Rose. [IN THE BONUS! 6 team fouls] OG Anunoby to the line for 2 free throws. (Evan Rose: 1 personal fouls)   FT 1/2: GOOD   FT 2/2: GOOD OG Anunoby makes 2/2 from the line.
Score: 52-46

[01:37] Team_061 possession (Score: 52-46)
Evan Rose drives and kicks out. Gary Fox makes the 3Pt and draws the foul on Josh Wall! And-1! Gary Fox to the line for 1. [BONUS: 9 team fouls] (Josh Wall: 1 personal fouls)   FT 1/1: GOOD Gary Fox makes 1/1 from the line.
Score: 56-46

[01:24] Team_090 possession (Score: 56-46)
Derrick Nowitzki drives and kicks out. Josh Wall attempts a 3Pt. Contested by Desmond Morant (4.6 feet, ZONE). Josh Wall misses. Rebound secured by Tim Durant.

[01:07] Team_061 possession (Score: 56-46)
Desmond Morant drives and kicks out. Stephen Towns attempts a Midrange. Contested by Russell Smith (4.5 feet, ZONE). Stephen Towns misses. Rebound secured by Derrick Nowitzki.

[00:54] Team_090 possession (Score: 56-46)
Derrick Nowitzki attempts a 3Pt. Contested by Desmond Morant (4.2 feet, ZONE). Derrick Nowitzki misses. Rebound secured by Desmond Morant.

[00:41] Team_061 possession (Score: 56-46)
FOUL! Holding foul on Russell Smith. [IN THE BONUS! 10 team fouls] Desmond Morant to the line for 2 free throws. (Russell Smith: 2 personal fouls)   FT 1/2: GOOD   FT 2/2: GOOD Desmond Morant makes 2/2 from the line.
Score: 58-46

[00:31] Team_090 possession (Score: 58-46)
Derrick Nowitzki drives, picks up Tim Durant. Help arrives from Evan Rose! Derrick Nowitzki attempts a Layup. Contested by Evan Rose (4.0 feet, ZONE). Derrick Nowitzki misses. Rebound secured by Tim Durant.

[00:15] Team_061 possession (Score: 58-46)
Evan Rose drives and kicks out. Gary Fox attempts a 3Pt. Contested by Josh Wall (4.5 feet, MAN). Gary Fox misses. Offensive rebound by Tim Durant! Tim Durant's putback is no good. Offensive rebound by Stephen Towns! Stephen Towns kicks it out.

================================================================================
                              2ND QUARTER COMPLETE                              
================================================================================

2ND QUARTER SCORE: Team_061 30, Team_090 12

BOX SCORE:
================================================================================

Team_061
--------------------------------------------------------------------------------
Player                MIN  PTS  REB  AST  TO      FG   FG%      3P   3P%
--------------------------------------------------------------------------------
Desmond Morant         10    9    5    0   0   4/7    57.1     0/0   0.0
Tim Durant             10    8    6    0   0   4/4   100.0     0/0   0.0
Gary Fox               10    4    0    0   0   1/2    50.0     0/0   0.0
Bam Sexton             14    3    0    0   0   1/1   100.0     0/0   0.0
Michael Russell        14    2    1    0   0   1/1   100.0     0/0   0.0
Evan Rose              10    2    0    0   0   1/3    33.3     0/0   0.0
Draymond Banchero      14    0    0    0   0   0/1     0.0     0/0   0.0
Stephen Towns          10    0    3    1   0   0/1     0.0     0/0   0.0

TEAM: FG: 12/20 (60.0%), 3PT: 2/4 (50.0%), REB: 16 (5 off, 11 def), AST: 1, TO: 1
TEAM FOULS: 6 [Team_090 in BONUS]


Team_090
--------------------------------------------------------------------------------
Player                MIN  PTS  REB  AST  TO      FG   FG%      3P   3P%
--------------------------------------------------------------------------------
Derrick Nowitzki       10    5    4    1   0   2/7    28.6     0/0   0.0
Tobias Tatum           10    5    4    0   0   2/4    50.0     0/0   0.0
OG Anunoby             10    2    0    0   0   1/1   100.0     0/0   0.0
Zach Wall              14    0    1    0   0   0/0     0.0     0/0   0.0
Josh Wall              10    0    0    2   0   0/0     0.0     0/0   0.0
Russell Smith          10    0    1    0   0   0/4     0.0     0/0   0.0

TEAM: FG: 5/16 (31.2%), 3PT: 2/5 (40.0%), REB: 9 (2 off, 7 def), AST: 3, TO: 5
TEAM FOULS: 10 [Team_061 in BONUS]

================================================================================

================================================================================
                       3RD QUARTER - Team_061 vs Team_090                       
================================================================================

[12:00] Team_061 possession (Score: 58-46)
FOUL! Holding foul on Tracy Adebayo. [Team fouls: 1] No free throws, side out. (Tracy Adebayo: 1 personal fouls)

[11:46] Team_061 possession (Score: 58-46)
Bam Sexton attempts a 3Pt. Contested by Larry Bridges (5.2 feet, ZONE). Bam Sexton misses. Offensive rebound by Michael Russell! Michael Russell puts it back in!
Score: 60-46

[11:36] Team_090 possession (Score: 60-46)
Tracy Adebayo attempts a Layup. BLOCKED BY DRAYMOND BANCHERO! Ball is loose! Rebound secured by Draymond Banchero.

[11:21] Team_061 possession (Score: 60-46)
FOUL! Shooting foul on Gary Brogdon. Brandon Russell to the line for 3 free throws. [Team fouls: 2] (Gary Brogdon: 1 personal fouls)   FT 1/3: GOOD   FT 2/3: GOOD   FT 3/3: GOOD Brandon Russell makes 3/3 from the line.
Score: 63-46

[11:05] Team_090 possession (Score: 63-46)
Tracy Adebayo attempts a 3Pt. Contested by Bam Sexton (4.7 feet, ZONE). Tracy Adebayo misses. Offensive rebound by Gary Brogdon! Gary Brogdon kicks it out.

[10:51] Team_090 possession (Score: 63-46)
Derrick Mitchell makes the Layup and draws the foul on Draymond Banchero! And-1! Derrick Mitchell to the line for 1. [Team fouls: 1] (Draymond Banchero: 1 personal fouls)   FT 1/1: GOOD Derrick Mitchell makes 1/1 from the line.
Score: 63-49

[10:38] Team_061 possession (Score: 63-49)
Brandon Russell attempts a Midrange. Contested by Derrick Mitchell (3.4 feet, MAN). Brandon Russell misses. Rebound secured by Tracy Adebayo.

[10:21] Team_090 possession (Score: 63-49)
Larry Bridges drives and kicks out. Zach Wall attempts a 3Pt. Contested by Michael Russell (3.7 feet, MAN). Zach Wall misses. Rebound secured by Bam Sexton.

[10:05] Team_061 possession (Score: 63-49)
Draymond Banchero drives, Gary Brogdon stays with him. Draymond Banchero attempts a Dunk. Contested by Gary Brogdon (4.3 feet, ZONE). DRAYMOND BANCHERO MAKES IT! Assist: Michael Russell
Score: 65-49

[09:47] Team_090 possession (Score: 65-49)
Derrick Mitchell attempts a 3Pt. Contested by Brandon Russell (4.2 feet, MAN). DERRICK MITCHELL MAKES IT! Assist: Gary Brogdon
Score: 65-52

[09:37] Team_061 possession (Score: 65-52)
Jayson Holiday makes the Layup and draws the foul on Larry Bridges! And-1! Jayson Holiday to the line for 1. [Team fouls: 3] (Larry Bridges: 1 personal fouls)   FT 1/1: MISS Jayson Holiday makes 0/1 from the line. Rebound secured by Gary Brogdon.
Score: 67-52

[09:25] Team_090 possession (Score: 67-52)
Tracy Adebayo attempts a 3Pt. Contested by Brandon Russell (3.7 feet, ZONE). Tracy Adebayo misses. Rebound secured by Michael Russell.

[09:11] Team_061 possession (Score: 67-52)
Jayson Holiday attempts a Midrange. Contested by Gary Brogdon (4.0 feet, ZONE). Jayson Holiday misses. Rebound secured by Gary Brogdon.

[08:54] Team_090 possession (Score: 67-52)
FOUL! Shooting foul on Draymond Banchero. Larry Bridges to the line for 2 free throws. [Team fouls: 2] (Draymond Banchero: 2 personal fouls)   FT 1/2: MISS   FT 2/2: GOOD Larry Bridges makes 1/2 from the line.
Score: 67-53

[08:41] Team_061 possession (Score: 67-53)
Jayson Holiday drives and kicks out. Bam Sexton attempts a 3Pt. Contested by Derrick Mitchell (3.2 feet, ZONE). BAM SEXTON MAKES IT! Assist: Jayson Holiday
Score: 70-53

[08:26] Team_090 possession (Score: 70-53)
Gary Brogdon drives, picks up Draymond Banchero. Help arrives from Jayson Holiday! Gary Brogdon attempts a Dunk. Contested by Jayson Holiday (2.8 feet, ZONE). Gary Brogdon misses. Rebound secured by Michael Russell.

[08:12] Team_061 possession (Score: 70-53)
Brandon Russell attempts a 3Pt. Contested by Derrick Mitchell (3.4 feet, MAN). Brandon Russell misses. Rebound secured by Gary Brogdon.

[07:59] Team_090 possession (Score: 70-53)
Larry Bridges attempts a Midrange. Contested by Brandon Russell (3.9 feet, ZONE). Larry Bridges misses. Rebound secured by Draymond Banchero.

[07:44] Team_061 possession (Score: 70-53)
Brandon Russell attempts a 3Pt. Contested by Derrick Mitchell (3.4 feet, MAN). Brandon Russell misses. Rebound secured by Tracy Adebayo.

[07:30] Team_090 possession (Score: 70-53)
Tracy Adebayo attempts a Layup. Contested by Draymond Banchero (2.4 feet, ZONE). TRACY ADEBAYO MAKES IT! Assist: Zach Wall
Score: 70-55

[07:12] Team_061 possession (Score: 70-55)
Michael Russell makes the Dunk and draws the foul on Zach Wall! And-1! Michael Russell to the line for 1. [Team fouls: 4] (Zach Wall: 1 personal fouls)   FT 1/1: GOOD Michael Russell makes 1/1 from the line.
Score: 73-55

[06:58] Team_090 possession (Score: 73-55)
Zach Wall drives, Draymond Banchero stays with him. Zach Wall attempts a Dunk. Contested by Draymond Banchero (2.9 feet, ZONE). Zach Wall misses. Offensive rebound by Tracy Adebayo! Tracy Adebayo kicks it out.

[06:44] Team_090 possession (Score: 73-55)
Larry Bridges drives, Bam Sexton stays with him. Larry Bridges attempts a Layup. Contested by Bam Sexton (4.9 feet, ZONE). Larry Bridges misses. Offensive rebound by Gary Brogdon! Gary Brogdon kicks it out.

[06:30] Team_090 possession (Score: 73-55)
Zach Wall drives and kicks out. Derrick Mitchell attempts a 3Pt. Contested by Brandon Russell (3.9 feet, ZONE). Derrick Mitchell misses. Rebound secured by Draymond Banchero.

[06:20] Team_061 possession (Score: 73-55)
Bam Sexton attempts a Layup. Contested by Gary Brogdon (4.1 feet, MAN). BAM SEXTON MAKES IT! Assist: Draymond Banchero
Score: 75-55

[06:06] Team_090 possession (Score: 75-55)
FOUL! Reach-in foul on Michael Russell during the drive. [Team fouls: 3] No free throws, side out. (Michael Russell: 1 personal fouls)

[05:50] Team_090 possession (Score: 75-55)
Gary Brogdon attempts a 3Pt. Contested by Brandon Russell (4.1 feet, ZONE). GARY BROGDON MAKES IT! Assist: Derrick Mitchell
Score: 75-58

[05:33] Team_061 possession (Score: 75-58)
FOUL! Shooting foul on Larry Bridges. Jayson Holiday to the line for 2 free throws. [BONUS: 5 team fouls] (Larry Bridges: 2 personal fouls)   FT 1/2: GOOD   FT 2/2: GOOD Jayson Holiday makes 2/2 from the line.
Score: 77-58

[05:17] Team_090 possession (Score: 77-58)
Derrick Mitchell drives to the basket... Derrick Mitchell throws a bad pass out of bounds! TURNOVER! (dead ball)

[05:01] Team_061 possession (Score: 77-58)
Brandon Russell attempts a 3Pt. Contested by Derrick Mitchell (3.4 feet, ZONE). BRANDON RUSSELL MAKES IT! Assist: Bam Sexton
Score: 80-58

[04:46] Team_090 possession (Score: 80-58)
Derrick Mitchell attempts a Layup. Contested by Brandon Russell (4.2 feet, MAN). Derrick Mitchell misses. FOUL! Loose ball foul on Michael Russell during the rebound battle. [Team fouls: 4] No free throws, side out. (Michael Russell: 2 personal fouls)

[04:35] Team_090 possession (Score: 80-58)
Tracy Adebayo attempts a 3Pt. Contested by Draymond Banchero (2.5 feet, MAN). Tracy Adebayo misses. Rebound secured by Draymond Banchero.

[04:20] Team_061 possession (Score: 80-58)
Michael Russell makes the Midrange and draws the foul on Gary Brogdon! And-1! Michael Russell to the line for 1. [BONUS: 6 team fouls] (Gary Brogdon: 2 personal fouls)   FT 1/1: MISS Michael Russell makes 0/1 from the line. Rebound secured by Zach Wall.
Score: 82-58

[04:03] Team_090 possession (Score: 82-58)
FOUL! Shooting foul on Bam Sexton. Gary Brogdon to the line for 2 free throws. [BONUS: 5 team fouls] (Bam Sexton: 1 personal fouls)   FT 1/2: MISS   FT 2/2: GOOD Gary Brogdon makes 1/2 from the line.
Score: 82-59

[03:50] Team_061 possession (Score: 82-59)
Brandon Russell attempts a Layup. Contested by Derrick Mitchell (3.5 feet, MAN). BRANDON RUSSELL MAKES IT! Assist: Draymond Banchero
Score: 84-59

[03:37] Team_090 possession (Score: 84-59)
Tracy Adebayo attempts a Layup. BLOCKED BY DRAYMOND BANCHERO! Ball is loose! Rebound secured by Michael Russell.

[03:20] Team_061 possession (Score: 84-59)
FOUL! Offensive foul on Draymond Banchero! Tracy Adebayo drew the charge! [Team fouls: 6] (Draymond Banchero: 3 personal fouls) TURNOVER! (dead ball)

[03:02] Team_090 possession (Score: 84-59)
FOUL! Shooting foul on Bam Sexton. Larry Bridges to the line for 2 free throws. [BONUS: 7 team fouls] (Bam Sexton: 2 personal fouls)   FT 1/2: GOOD   FT 2/2: GOOD Larry Bridges makes 2/2 from the line.
Score: 84-61

[02:47] Team_061 possession (Score: 84-61)
Bam Sexton drives and kicks out. Bam Sexton attempts a 3Pt. Contested by Gary Brogdon (4.0 feet, MAN). Bam Sexton misses. Offensive rebound by Draymond Banchero! Draymond Banchero's putback is no good. Rebound secured by Tracy Adebayo.

[02:36] Team_090 possession (Score: 84-61)
Gary Brogdon attempts a 3Pt. Contested by Bam Sexton (5.2 feet, MAN). Gary Brogdon misses. Offensive rebound by Zach Wall! Zach Wall kicks it out.

[02:25] Team_090 possession (Score: 84-61)
Gary Brogdon attempts a Layup. Contested by Bam Sexton (5.2 feet, MAN). Gary Brogdon misses. Offensive rebound by Tracy Adebayo! Tracy Adebayo kicks it out.

[02:13] Team_090 possession (Score: 84-61)
Derrick Mitchell attempts a 3Pt. Contested by Brandon Russell (4.4 feet, ZONE). Derrick Mitchell misses. FOUL! Loose ball foul on Draymond Banchero during the rebound battle. [IN THE BONUS! 8 team fouls] Tracy Adebayo to the line for 2 free throws. (Draymond Banchero: 4 personal fouls)   FT 1/2: MISS   FT 2/2: GOOD Tracy Adebayo makes 1/2 from the line.
Score: 84-62

[01:58] Team_061 possession (Score: 84-62)
Michael Russell attempts a Midrange. Contested by Zach Wall (5.4 feet, MAN). Michael Russell misses. Rebound secured by Tracy Adebayo.

[01:40] Team_090 possession (Score: 84-62)
Gary Brogdon drives to the basket... Gary Brogdon loses the ball! Stripped by Draymond Banchero! TURNOVER! (live ball)

[01:28] Team_061 possession (Score: 84-62)
FOUL! Reach-in foul on Tracy Adebayo during the drive. [IN THE BONUS! 7 team fouls] Draymond Banchero to the line for 2 free throws. (Tracy Adebayo: 2 personal fouls)   FT 1/2: GOOD   FT 2/2: MISS Draymond Banchero makes 1/2 from the line. Offensive rebound by Draymond Banchero! Draymond Banchero's putback is no good.
Score: 85-62

[01:09] Team_090 possession (Score: 85-62)
Gary Brogdon drives, Bam Sexton stays with him. Gary Brogdon attempts a Dunk. Contested by Bam Sexton (5.3 feet, ZONE). GARY BROGDON MAKES IT! Assist: Zach Wall
Score: 85-64

[00:53] Team_061 possession (Score: 85-64)
Draymond Banchero drives, picks up Gary Brogdon. Help arrives from Larry Bridges! Draymond Banchero attempts a Layup. Contested by Larry Bridges (4.9 feet, ZONE). Draymond Banchero misses. Rebound secured by Tracy Adebayo.

[00:39] Team_090 possession (Score: 85-64)
Zach Wall attempts a 3Pt. Contested by Brandon Russell (4.5 feet, ZONE). Zach Wall misses. Rebound secured by Bam Sexton.

[00:24] Team_061 possession (Score: 85-64)
Jayson Holiday loses the ball! Stripped by Larry Bridges! TURNOVER! (live ball)

[00:10] Team_090 possession (Score: 85-64)
Zach Wall drives, Michael Russell stays with him. Zach Wall attempts a Layup. Contested by Michael Russell (4.6 feet, MAN). ZACH WALL MAKES IT! Assist: Gary Brogdon
Score: 85-66

================================================================================
                              3RD QUARTER COMPLETE                              
================================================================================

3RD QUARTER SCORE: Team_061 27, Team_090 20

BOX SCORE:
================================================================================

Team_061
--------------------------------------------------------------------------------
Player                MIN  PTS  REB  AST  TO      FG   FG%      3P   3P%
--------------------------------------------------------------------------------
Brandon Russell        26    8    0    0   0   3/6    50.0     0/0   0.0
Michael Russell        26    5    4    1   0   2/4    50.0     0/0   0.0
Bam Sexton             26    5    2    1   0   2/3    66.7     0/0   0.0
Draymond Banchero      26    2    5    2   0   1/3    33.3     0/0   0.0
Jayson Holiday         26    2    0    1   0   1/3    33.3     0/0   0.0

TEAM: FG: 9/19 (47.4%), 3PT: 3/5 (60.0%), REB: 11 (2 off, 9 def), AST: 5, TO: 2
TEAM FOULS: 8 [Team_090 in BONUS]


Team_090
--------------------------------------------------------------------------------
Player                MIN  PTS  REB  AST  TO      FG   FG%      3P   3P%
--------------------------------------------------------------------------------
Gary Brogdon           26    6    5    2   0   3/4    75.0     0/0   0.0
Derrick Mitchell       26    6    0    1   0   2/2   100.0     0/0   0.0
Tracy Adebayo          26    3    8    0   0   2/6    33.3     0/0   0.0
Larry Bridges          26    3    0    0   0   2/4    50.0     0/0   0.0
Zach Wall              26    2    2    2   0   1/3    33.3     0/0   0.0

TEAM: FG: 10/19 (52.6%), 3PT: 3/6 (50.0%), REB: 15 (6 off, 9 def), AST: 5, TO: 2
TEAM FOULS: 7 [Team_061 in BONUS]

================================================================================

================================================================================
                       4TH QUARTER - Team_061 vs Team_090                       
================================================================================

[12:00] Team_061 possession (Score: 85-66)
Brandon Russell attempts a Layup. Contested by Gary Brogdon (4.3 feet, ZONE). BRANDON RUSSELL MAKES IT! Assist: Bam Sexton
Score: 87-66

[11:41] Team_090 possession (Score: 87-66)
Zach Wall attempts a 3Pt. Contested by Brandon Russell (4.4 feet, ZONE). ZACH WALL MAKES IT! Assist: Tracy Adebayo
Score: 87-69

[11:31] Team_061 possession (Score: 87-69)
Bam Sexton drives, Gary Brogdon stays with him. Bam Sexton attempts a Layup. Contested by Gary Brogdon (4.6 feet, MAN). Bam Sexton misses. FOUL! Loose ball foul on Tracy Adebayo during the rebound battle. [Team fouls: 1] No free throws, side out. (Tracy Adebayo: 1 personal fouls)

[11:16] Team_061 possession (Score: 87-69)
Brandon Russell attempts a 3Pt. Contested by Derrick Mitchell (3.7 feet, ZONE). Brandon Russell misses. Rebound secured by Tracy Adebayo.

[10:59] Team_090 possession (Score: 87-69)
Tracy Adebayo makes the Dunk and draws the foul on Draymond Banchero! And-1! Tracy Adebayo to the line for 1. [Team fouls: 1] (Draymond Banchero: 1 personal fouls)   FT 1/1: GOOD Tracy Adebayo makes 1/1 from the line.
Score: 87-72

[10:48] Team_061 possession (Score: 87-72)
Brandon Russell attempts a 3Pt. Contested by Derrick Mitchell (3.8 feet, MAN). BRANDON RUSSELL MAKES IT! Assist: Jayson Holiday
Score: 90-72

[10:33] Team_090 possession (Score: 90-72)
Derrick Mitchell attempts a 3Pt. Contested by Brandon Russell (4.5 feet, MAN). Derrick Mitchell misses. Rebound secured by Michael Russell.

[10:19] Team_061 possession (Score: 90-72)
Draymond Banchero attempts a Midrange. Contested by Tracy Adebayo (6.0 feet, MAN). Draymond Banchero misses. Rebound secured by Tracy Adebayo.

[10:03] Team_090 possession (Score: 90-72)
FOUL! Shooting foul on Michael Russell. Zach Wall to the line for 2 free throws. [Team fouls: 2] (Michael Russell: 1 personal fouls)   FT 1/2: GOOD   FT 2/2: GOOD Zach Wall makes 2/2 from the line.
Score: 90-74

[09:47] Team_061 possession (Score: 90-74)
Draymond Banchero attempts a Layup. Contested by Gary Brogdon (5.1 feet, ZONE). Draymond Banchero misses. Rebound secured by Zach Wall.

[09:32] Team_090 possession (Score: 90-74)
FOUL! Shooting foul on Jayson Holiday. Larry Bridges to the line for 2 free throws. [Team fouls: 3] (Jayson Holiday: 1 personal fouls)   FT 1/2: GOOD   FT 2/2: GOOD Larry Bridges makes 2/2 from the line.
Score: 90-76

[09:17] Team_061 possession (Score: 90-76)
Jayson Holiday drives and kicks out. Brandon Russell attempts a 3Pt. Contested by Derrick Mitchell (3.8 feet, ZONE). Brandon Russell misses. Rebound secured by Tracy Adebayo.

[09:06] Team_090 possession (Score: 90-76)
Zach Wall attempts a 3Pt. Contested by Michael Russell (4.7 feet, MAN). Zach Wall misses. Offensive rebound by Tracy Adebayo! Tracy Adebayo kicks it out.

[08:52] Team_090 possession (Score: 90-76)
Gary Brogdon attempts a Midrange. Contested by Bam Sexton (5.4 feet, ZONE). Gary Brogdon misses. Rebound secured by Draymond Banchero.

[08:41] Team_061 possession (Score: 90-76)
Jayson Holiday attempts a 3Pt. Contested by Larry Bridges (5.7 feet, MAN). Jayson Holiday misses. Rebound secured by Zach Wall.

[08:27] Team_090 possession (Score: 90-76)
Tracy Adebayo attempts a 3Pt. Contested by Draymond Banchero (3.1 feet, MAN). TRACY ADEBAYO MAKES IT! Assist: Gary Brogdon
Score: 90-79

[08:12] Team_061 possession (Score: 90-79)
Jayson Holiday attempts a 3Pt. Contested by Derrick Mitchell (4.2 feet, ZONE). Jayson Holiday misses. Rebound secured by Tracy Adebayo.

[07:58] Team_090 possession (Score: 90-79)
Larry Bridges attempts a 3Pt. Contested by Jayson Holiday (4.9 feet, MAN). LARRY BRIDGES MAKES IT! Assist: Tracy Adebayo
Score: 90-82

[07:47] Team_061 possession (Score: 90-82)
Bam Sexton attempts a Layup. Contested by Gary Brogdon (5.2 feet, ZONE). BAM SEXTON MAKES IT! Assist: Jayson Holiday
Score: 92-82

[07:31] Team_090 possession (Score: 92-82)
Larry Bridges drives, Draymond Banchero stays with him. Larry Bridges attempts a Layup. Contested by Draymond Banchero (3.5 feet, ZONE). Larry Bridges misses. Rebound secured by Draymond Banchero.

[07:15] Team_061 possession (Score: 92-82)
Jayson Holiday attempts a 3Pt. Contested by Larry Bridges (5.8 feet, ZONE). Jayson Holiday misses. Offensive rebound by Bam Sexton! Bam Sexton kicks it out.

[07:01] Team_061 possession (Score: 92-82)
Draymond Banchero attempts a Layup. Contested by Gary Brogdon (5.5 feet, ZONE). DRAYMOND BANCHERO MAKES IT! Assist: Michael Russell
Score: 94-82

[06:44] Team_090 possession (Score: 94-82)
Tracy Adebayo drives to the basket... Tracy Adebayo loses control! Ball rolls out of bounds! TURNOVER! (dead ball)

[06:44] Substitution (Team_061): Brandon Russell OUT → Evan Rose IN (stamina_rule2)

[06:44] Substitution (Team_061): Jayson Holiday OUT → Gary Fox IN (stamina_rule2)

[06:44] Substitution (Team_061): Michael Russell OUT → Desmond Morant IN (stamina_rule2)

[06:44] Substitution (Team_061): Bam Sexton OUT → Stephen Towns IN (stamina_rule2)

[06:44] Substitution (Team_061): Draymond Banchero OUT → Tim Durant IN (stamina_rule2)

[06:44] Substitution (Team_090): Derrick Mitchell OUT → OG Anunoby IN (stamina_rule2)

[06:44] Substitution (Team_090): Larry Bridges OUT → Josh Wall IN (stamina_rule2)

[06:44] Substitution (Team_090): Zach Wall OUT → Russell Smith IN (stamina_rule2)

[06:44] Substitution (Team_090): Gary Brogdon OUT → Derrick Nowitzki IN (stamina_rule2)

[06:44] Substitution (Team_090): Tracy Adebayo OUT → Tobias Tatum IN (stamina_rule2)

[06:26] Team_061 possession (Score: 94-82)
Gary Fox drives, Josh Wall stays with him. Gary Fox attempts a Dunk. Contested by Josh Wall (4.2 feet, MAN). Gary Fox misses. Rebound secured by Derrick Nowitzki.

[06:15] Team_090 possession (Score: 94-82)
OG Anunoby attempts a Midrange. Contested by Desmond Morant (4.5 feet, ZONE). OG Anunoby misses. Rebound secured by Tim Durant.

[05:56] Team_061 possession (Score: 94-82)
Gary Fox drives, picks up Josh Wall. Help arrives from Russell Smith! Gary Fox attempts a Dunk. Contested by Russell Smith (4.2 feet, MAN). GARY FOX MAKES IT!
Score: 96-82

[05:41] Team_090 possession (Score: 96-82)
Tobias Tatum drives to the basket... FOUL! Offensive foul on Tobias Tatum! Tim Durant drew the charge! [Team fouls: 2] (Tobias Tatum: 1 personal fouls) TURNOVER! (dead ball)

[05:24] Team_061 possession (Score: 96-82)
FOUL! Shooting foul on Josh Wall. Stephen Towns to the line for 2 free throws. [Team fouls: 3] (Josh Wall: 1 personal fouls)   FT 1/2: GOOD   FT 2/2: GOOD Stephen Towns makes 2/2 from the line.
Score: 98-82

[05:12] Team_090 possession (Score: 98-82)
Derrick Nowitzki drives and kicks out. Josh Wall attempts a Midrange. Contested by Gary Fox (5.9 feet, MAN). JOSH WALL MAKES IT!
Score: 98-84

[04:54] Team_061 possession (Score: 98-84)
FOUL! Shooting foul on Derrick Nowitzki. Stephen Towns to the line for 2 free throws. [Team fouls: 4] (Derrick Nowitzki: 1 personal fouls)   FT 1/2: GOOD   FT 2/2: GOOD Stephen Towns makes 2/2 from the line.
Score: 100-84

[04:36] Team_090 possession (Score: 100-84)
Tobias Tatum attempts a Midrange. Contested by Stephen Towns (5.6 feet, ZONE). Tobias Tatum misses. Rebound secured by Tim Durant.

[04:23] Team_061 possession (Score: 100-84)
Desmond Morant attempts a 3Pt. Contested by Russell Smith (4.7 feet, MAN). Desmond Morant misses. Rebound secured by Russell Smith.

[04:08] Team_090 possession (Score: 100-84)
FOUL! Shooting foul on Stephen Towns. Derrick Nowitzki to the line for 2 free throws. [Team fouls: 4] (Stephen Towns: 1 personal fouls)   FT 1/2: GOOD   FT 2/2: GOOD Derrick Nowitzki makes 2/2 from the line.
Score: 100-86

[03:54] Team_061 possession (Score: 100-86)
Gary Fox attempts a 3Pt. Contested by Derrick Nowitzki (4.4 feet, ZONE). Gary Fox misses. Rebound secured by Derrick Nowitzki.

[03:40] Team_090 possession (Score: 100-86)
Russell Smith makes the Dunk and draws the foul on Evan Rose! And-1! Russell Smith to the line for 1. [BONUS: 5 team fouls] (Evan Rose: 1 personal fouls)   FT 1/1: GOOD Russell Smith makes 1/1 from the line.
Score: 100-89

[03:26] Team_061 possession (Score: 100-89)
Evan Rose attempts a 3Pt. Contested by OG Anunoby (5.3 feet, MAN). Evan Rose misses. Rebound secured by Russell Smith.

[03:10] Team_090 possession (Score: 100-89)
Josh Wall attempts a 3Pt. Wide open! Gary Fox is 6.3 feet away. [MAN] JOSH WALL MAKES IT!
Score: 100-92

[02:59] Team_061 possession (Score: 100-92)
Stephen Towns attempts a 3Pt. Contested by Russell Smith (4.6 feet, ZONE). Stephen Towns misses. Rebound secured by Derrick Nowitzki.

[02:46] Team_090 possession (Score: 100-92)
Josh Wall attempts a 3Pt. Wide open! Gary Fox is 6.3 feet away. [MAN] JOSH WALL MAKES IT! Assist: Russell Smith
Score: 100-95

[02:32] Team_061 possession (Score: 100-95)
Stephen Towns attempts a Layup. Contested by Derrick Nowitzki (4.6 feet, MAN). STEPHEN TOWNS MAKES IT! Assist: Gary Fox
Score: 102-95

[02:18] Team_090 possession (Score: 102-95)
OG Anunoby drives to the basket... OG Anunoby loses control! Ball rolls out of bounds! TURNOVER! (dead ball)

[02:00] Team_061 possession (Score: 102-95)
Tim Durant attempts a Midrange. Contested by Tobias Tatum (5.2 feet, MAN). TIM DURANT MAKES IT!
Score: 104-95

[01:45] Team_090 possession (Score: 104-95)
Derrick Nowitzki drives and kicks out. OG Anunoby attempts a Midrange. Contested by Evan Rose (5.0 feet, MAN). OG ANUNOBY MAKES IT!
Score: 104-97

[01:32] Team_061 possession (Score: 104-97)
FOUL! Reach-in foul on Tobias Tatum during the drive. [IN THE BONUS! 5 team fouls] Tim Durant to the line for 2 free throws. (Tobias Tatum: 2 personal fouls)   FT 1/2: GOOD   FT 2/2: GOOD Tim Durant makes 2/2 from the line.
Score: 106-97

[01:22] Team_090 possession (Score: 106-97)
Derrick Nowitzki drives and kicks out. Derrick Nowitzki attempts a Midrange. Contested by Desmond Morant (4.5 feet, ZONE). Derrick Nowitzki misses. Offensive rebound by Russell Smith! Russell Smith kicks it out.

[01:09] Team_090 possession (Score: 106-97)
OG Anunoby attempts a Midrange. Contested by Evan Rose (5.1 feet, MAN). OG Anunoby misses. Offensive rebound by Russell Smith! Russell Smith kicks it out.

[00:52] Team_090 possession (Score: 106-97)
Russell Smith attempts a Midrange. Contested by Stephen Towns (5.1 feet, ZONE). Russell Smith misses. Rebound secured by Stephen Towns.

[00:38] Team_061 possession (Score: 106-97)
FOUL! Reach-in foul on Derrick Nowitzki during the drive. [IN THE BONUS! 6 team fouls] Desmond Morant to the line for 2 free throws. (Derrick Nowitzki: 2 personal fouls)   FT 1/2: GOOD   FT 2/2: GOOD Desmond Morant makes 2/2 from the line.
Score: 108-97

[00:26] Team_090 possession (Score: 108-97)
OG Anunoby attempts a 3Pt. Contested by Desmond Morant (4.5 feet, ZONE). OG Anunoby misses. Rebound secured by Stephen Towns.

[00:15] Team_061 possession (Score: 108-97)
Tim Durant drives, picks up Derrick Nowitzki. Help arrives from Josh Wall! Tim Durant attempts a Layup. Contested by Josh Wall (4.9 feet, ZONE). Tim Durant misses. Rebound secured by Russell Smith.

================================================================================
                              4TH QUARTER COMPLETE                              
================================================================================

4TH QUARTER SCORE: Team_061 23, Team_090 31

BOX SCORE:
================================================================================

Team_061
--------------------------------------------------------------------------------
Player                MIN  PTS  REB  AST  TO      FG   FG%      3P   3P%
--------------------------------------------------------------------------------
Stephen Towns          16    6    2    0   0   3/4    75.0     0/0   0.0
Brandon Russell        32    5    0    0   0   2/3    66.7     0/0   0.0
Tim Durant             16    4    2    0   0   2/3    66.7     0/0   0.0
Bam Sexton             32    2    1    1   0   1/1   100.0     0/0   0.0
Draymond Banchero      32    2    2    0   0   1/3    33.3     0/0   0.0
Gary Fox               16    2    0    1   0   1/3    33.3     0/0   0.0
Desmond Morant         16    2    0    0   0   1/2    50.0     0/0   0.0
Michael Russell        32    0    2    1   0   0/0     0.0     0/0   0.0
Jayson Holiday         32    0    0    2   0   0/3     0.0     0/0   0.0
Evan Rose              16    0    0    0   0   0/1     0.0     0/0   0.0

TEAM: FG: 11/23 (47.8%), 3PT: 1/8 (12.5%), REB: 9 (2 off, 7 def), AST: 5, TO: 0
TEAM FOULS: 5 [Team_090 in BONUS]


Team_090
--------------------------------------------------------------------------------
Player                MIN  PTS  REB  AST  TO      FG   FG%      3P   3P%
--------------------------------------------------------------------------------
Josh Wall              16    8    0    0   0   3/3   100.0     0/0   0.0
Tracy Adebayo          32    6    5    2   0   2/2   100.0     0/0   0.0
Zach Wall              32    5    2    0   0   2/2   100.0     0/0   0.0
Larry Bridges          32    5    0    0   0   2/3    66.7     0/0   0.0
Russell Smith          16    3    5    1   0   1/2    50.0     0/0   0.0
Derrick Nowitzki       16    2    3    0   0   1/1   100.0     0/0   0.0
OG Anunoby             16    2    0    0   0   1/3    33.3     0/0   0.0
Derrick Mitchell       32    0    0    0   0   0/1     0.0     0/0   0.0
Gary Brogdon           32    0    0    1   0   0/1     0.0     0/0   0.0
Tobias Tatum           16    0    0    0   0   0/1     0.0     0/0   0.0

TEAM: FG: 12/19 (63.2%), 3PT: 5/7 (71.4%), REB: 15 (3 off, 12 def), AST: 4, TO: 3
TEAM FOULS: 6 [Team_061 in BONUS]

================================================================================

================================================================================
                               FULL GAME COMPLETE                               
================================================================================

FINAL SCORE: Team_061 108, Team_090 97

SCORING BY QUARTER:
--------------------------------------------------------------------------------
Team                     Q1     Q2     Q3     Q4    FINAL
--------------------------------------------------------------------------------
Team_061                 28     30     27     23      108
Team_090                 34     12     20     31       97
--------------------------------------------------------------------------------

FULL GAME BOX SCORE:
================================================================================

Team_061
--------------------------------------------------------------------------------
Player                MIN  PTS  REB  AST  TO      FG   FG%      3P   3P%      FT STL BLK
--------------------------------------------------------------------------------
Brandon Russell        32   19    0    2   0   8/14   57.1   4/9    44.4   4/4     0   1
Jayson Holiday         32    5    0    4   1   4/12   33.3   2/5    40.0   5/6     0   0
Michael Russell        32   15   13    2   0   4/9    44.4   0/1     0.0   3/4     0   0
Bam Sexton             32   16    5    2   0   8/11   72.7   1/2    50.0   1/1     1   0
Draymond Banchero      32    9    8    3   1   3/10   30.0   0/0     0.0   1/3     2   2
Evan Rose              16    2    0    0   1   1/4    25.0   0/1     0.0   2/2     1   0
Gary Fox               16    6    0    1   0   2/5    40.0   1/2    50.0   1/1     0   0
Desmond Morant         16   11    5    0   0   5/9    55.6   1/3    33.3   6/6     0   1
Stephen Towns          16    6    5    1   0   3/5    60.0   0/2     0.0   4/4     1   0
Tim Durant             16   12    8    0   0   4/5    80.0   0/0     0.0   4/4     0   0

TEAM: FG: 44/86 (51.2%), 3PT: 9/25 (36.0%), REB: 46 (12 off, 34 def), AST: 15, TO: 3


Team_090
--------------------------------------------------------------------------------
Player                MIN  PTS  REB  AST  TO      FG   FG%      3P   3P%      FT STL BLK
--------------------------------------------------------------------------------
Derrick Mitchell       32    6    0    4   2   3/5    60.0   2/3    66.7   1/1     0   1
Larry Bridges          32   11    0    0   0   5/8    62.5   2/2   100.0   5/6     1   1
Zach Wall              32   25   12    4   2  10/17   58.8   3/4    75.0   4/4     0   0
Gary Brogdon           32   19   11    3   3   7/9    77.8   3/3   100.0   4/5     0   0
Tracy Adebayo          32    9   16    4   2   3/8    37.5   1/3    33.3   2/3     0   0
OG Anunoby             16    4    0    0   1   0/2     0.0   0/1     0.0   2/2     0   0
Josh Wall              16    8    0    2   1   2/2   100.0   2/2   100.0   0/0     0   0
Russell Smith          16    3    6    1   0   1/6    16.7   0/1     0.0   1/1     0   0
Derrick Nowitzki       16    7    7    1   1   4/9    44.4   1/2    50.0   4/4     0   0
Tobias Tatum           16    5    4    0   1   2/5    40.0   1/2    50.0   0/0     0   0

TEAM: FG: 40/74 (54.1%), 3PT: 15/23 (65.2%), REB: 54 (15 off, 39 def), AST: 19, TO: 13

================================================================================
