================================================================================
                        FULL GAME - Team_058 vs Team_045                        
================================================================================

================================================================================
                       1ST QUARTER - Team_058 vs Team_045                       
================================================================================

[12:00] Team_058 possession (Score: 0-0)
FOUL! Shooting foul on Zion Butler. Tyrese Doncic to the line for 2 free throws. [Team fouls: 1] (Zion Butler: 1 personal fouls)   FT 1/2: GOOD   FT 2/2: GOOD Tyrese Doncic makes 2/2 from the line.
Score: 2-0

[11:46] Team_045 possession (Score: 2-0)
DeMar Turner attempts a 3Pt. Contested by Bradley Sexton (3.3 feet, ZONE). DEMAR TURNER MAKES IT! Assist: Trae Russell
Score: 2-3

[11:31] Team_058 possession (Score: 2-3)
Tyrese Doncic attempts a Layup. Contested by Zion Butler (3.3 feet, MAN). Tyrese Doncic misses. FOUL! Loose ball foul on Cole Simons during the rebound battle. [Team fouls: 2] No free throws, side out. (Cole Simons: 1 personal fouls)

[11:17] Team_058 possession (Score: 2-3)
Kyle Westbrook attempts a 3Pt. Contested by Cole Simons (3.4 feet, ZONE). KYLE WESTBROOK MAKES IT! Assist: Stephen Haliburton
Score: 5-3

[11:01] Team_045 possession (Score: 5-3)
Trae Russell drives and kicks out. Trae Russell attempts a Midrange. Contested by Kyle Westbrook (4.0 feet, MAN). TRAE RUSSELL MAKES IT!
Score: 5-5

[10:49] Team_058 possession (Score: 5-5)
Vince Hyland drives and kicks out. Kyle Westbrook attempts a Midrange. Contested by Trae Russell (5.4 feet, ZONE). KYLE WESTBROOK MAKES IT!
Score: 7-5

[10:33] Team_045 possession (Score: 7-5)
Rudy Antetokounmpo attempts a 3Pt. Contested by Bradley Sexton (3.4 feet, MAN). Rudy Antetokounmpo misses. Rebound secured by Stephen Haliburton.

[10:19] Team_058 possession (Score: 7-5)
Tyrese Doncic drives, picks up Zion Butler. Help arrives from Rudy Antetokounmpo! Tyrese Doncic attempts a Dunk. Contested by Rudy Antetokounmpo (3.3 feet, MAN). Tyrese Doncic misses. Rebound secured by DeMar Turner.

[10:08] Team_045 possession (Score: 7-5)
Zion Butler attempts a 3Pt. Contested by Bradley Sexton (3.3 feet, ZONE). Zion Butler misses. Rebound secured by Stephen Haliburton.

[09:55] Team_058 possession (Score: 7-5)
Tyrese Doncic attempts a Layup. Contested by Zion Butler (3.3 feet, ZONE). Tyrese Doncic misses. Offensive rebound by Tyrese Doncic! Tyrese Doncic kicks it out.

[09:40] Team_058 possession (Score: 7-5)
Vince Hyland throws a bad pass! Stolen by Cole Simons! TURNOVER! (live ball)

[09:21] Team_045 possession (Score: 7-5)
Rudy Antetokounmpo attempts a 3Pt. Contested by Kyle Westbrook (4.4 feet, ZONE). Rudy Antetokounmpo misses. Offensive rebound by Zion Butler! Zion Butler puts it back in!
Score: 7-7

[09:09] Team_058 possession (Score: 7-7)
FOUL! Offensive foul on Kyle Westbrook! Cole Simons drew the charge! [Team fouls: 1] (Kyle Westbrook: 1 personal fouls) TURNOVER! (dead ball)

[08:54] Team_045 possession (Score: 7-7)
Trae Russell attempts a 3Pt. Contested by Kyle Westbrook (4.5 feet, MAN). Trae Russell misses. Rebound secured by Bradley Sexton.

[08:42] Team_058 possession (Score: 7-7)
Stephen Haliburton attempts a 3Pt. Contested by Cole Simons (3.4 feet, ZONE). Stephen Haliburton misses. Offensive rebound by Stephen Haliburton! Stephen Haliburton puts it back in!
Score: 9-7

[08:30] Team_045 possession (Score: 9-7)
Rudy Antetokounmpo makes the Dunk and draws the foul on Stephen Haliburton! And-1! Rudy Antetokounmpo to the line for 1. [Team fouls: 2] (Stephen Haliburton: 1 personal fouls)   FT 1/1: MISS Rudy Antetokounmpo makes 0/1 from the line. Offensive rebound by Zion Butler! Zion Butler puts it back in!
Score: 9-11

[08:13] Team_058 possession (Score: 9-11)
FOUL! Shooting foul on Cole Simons. Kyle Westbrook to the line for 3 free throws. [Team fouls: 3] (Cole Simons: 2 personal fouls)   FT 1/3: GOOD   FT 2/3: GOOD   FT 3/3: GOOD Kyle Westbrook makes 3/3 from the line.
Score: 12-11

[07:58] Team_045 possession (Score: 12-11)
Rudy Antetokounmpo attempts a 3Pt. Contested by Bradley Sexton (3.4 feet, ZONE). RUDY ANTETOKOUNMPO MAKES IT! Assist: DeMar Turner
Score: 12-14

[07:44] Team_058 possession (Score: 12-14)
Bradley Sexton attempts a 3Pt. Contested by Rudy Antetokounmpo (4.8 feet, MAN). Bradley Sexton misses. Rebound secured by Zion Butler.

[07:33] Team_045 possession (Score: 12-14)
Zion Butler throws a bad pass! Stolen by Tyrese Doncic! TURNOVER! (live ball)

[07:19] Team_058 possession (Score: 12-14)
FOUL! Holding foul on Cole Simons. [Team fouls: 4] No free throws, side out. (Cole Simons: 3 personal fouls)

[06:59] Team_058 possession (Score: 12-14)
Kyle Westbrook attempts a 3Pt. Contested by Cole Simons (3.4 feet, ZONE). Kyle Westbrook misses. Rebound secured by Zion Butler.

[06:44] Team_045 possession (Score: 12-14)
Rudy Antetokounmpo drives and kicks out. Zion Butler attempts a 3Pt. Contested by Tyrese Doncic (4.4 feet, MAN). Zion Butler misses. Rebound secured by Stephen Haliburton.

[06:29] Team_058 possession (Score: 12-14)
Kyle Westbrook drives, Zion Butler stays with him. Kyle Westbrook attempts a Layup. Contested by Zion Butler (3.4 feet, ZONE). KYLE WESTBROOK MAKES IT! Assist: Vince Hyland
Score: 14-14

[06:16] Team_045 possession (Score: 14-14)
Cole Simons attempts a 3Pt. Contested by Bradley Sexton (3.6 feet, ZONE). Cole Simons misses. Rebound secured by Tyrese Doncic.

[06:04] Team_058 possession (Score: 14-14)
Bradley Sexton attempts a 3Pt. Contested by Cole Simons (3.6 feet, ZONE). Bradley Sexton misses. Rebound secured by DeMar Turner.

[05:46] Team_045 possession (Score: 14-14)
Rudy Antetokounmpo attempts a 3Pt. Contested by Bradley Sexton (3.4 feet, MAN). Rudy Antetokounmpo misses. Offensive rebound by Zion Butler! Zion Butler puts it back in!
Score: 14-16

[05:28] Team_058 possession (Score: 14-16)
FOUL! Reach-in foul on Cole Simons during the drive. [IN THE BONUS! 5 team fouls] Vince Hyland to the line for 2 free throws. (Cole Simons: 4 personal fouls)   FT 1/2: GOOD   FT 2/2: GOOD Vince Hyland makes 2/2 from the line.
Score: 16-16

[05:15] Team_045 possession (Score: 16-16)
DeMar Turner makes the 3Pt and draws the foul on Stephen Haliburton! And-1! DeMar Turner to the line for 1. [Team fouls: 3] (Stephen Haliburton: 2 personal fouls)   FT 1/1: GOOD DeMar Turner makes 1/1 from the line.
Score: 16-20

[04:59] Team_058 possession (Score: 16-20)
Vince Hyland attempts a 3Pt. Contested by Cole Simons (3.6 feet, MAN). Vince Hyland misses. FOUL! Loose ball foul on DeMar Turner during the rebound battle. [IN THE BONUS! 6 team fouls] Tyrese Doncic to the line for 2 free throws. (DeMar Turner: 1 personal fouls)   FT 1/2: GOOD   FT 2/2: GOOD Tyrese Doncic makes 2/2 from the line.
Score: 18-20

[04:42] Team_045 possession (Score: 18-20)
FOUL! Reach-in foul on Stephen Haliburton during the drive. [Team fouls: 4] No free throws, side out. (Stephen Haliburton: 3 personal fouls)

[04:31] Team_045 possession (Score: 18-20)
DeMar Turner drives and kicks out. DeMar Turner attempts a Midrange. Contested by Kyle Westbrook (4.1 feet, ZONE). DeMar Turner misses. Offensive rebound by DeMar Turner! DeMar Turner kicks it out.

[04:17] Team_045 possession (Score: 18-20)
Rudy Antetokounmpo drives, Stephen Haliburton stays with him. Rudy Antetokounmpo attempts a Layup. Contested by Stephen Haliburton (3.9 feet, ZONE). Rudy Antetokounmpo misses. Rebound secured by Bradley Sexton.

[04:06] Team_058 possession (Score: 18-20)
Tyrese Doncic drives, Zion Butler stays with him. Tyrese Doncic attempts a Dunk. Contested by Zion Butler (3.5 feet, ZONE). TYRESE DONCIC MAKES IT! Assist: Kyle Westbrook
Score: 20-20

[03:56] Team_045 possession (Score: 20-20)
DeMar Turner attempts a 3Pt. Contested by Bradley Sexton (3.4 feet, ZONE). DeMar Turner misses. Rebound secured by Bradley Sexton.

[03:42] Team_058 possession (Score: 20-20)
Kyle Westbrook attempts a Midrange. Contested by Cole Simons (3.6 feet, MAN). KYLE WESTBROOK MAKES IT!
Score: 22-20

[03:27] Team_045 possession (Score: 22-20)
Cole Simons attempts a 3Pt. Contested by Bradley Sexton (3.8 feet, ZONE). Cole Simons misses. Rebound secured by Bradley Sexton.

[03:12] Team_058 possession (Score: 22-20)
Tyrese Doncic throws a bad pass out of bounds! TURNOVER! (dead ball)

[03:12] Substitution (Team_058): Kyle Westbrook OUT → Jordan Ingram IN (stamina_rule2)

[03:12] Substitution (Team_045): Zion Butler OUT → Stephen Paul IN (stamina_rule2)

[02:58] Team_045 possession (Score: 22-20)
Cole Simons commits a violation (traveling/carry)! TURNOVER! (dead ball)

[02:58] Substitution (Team_058): Stephen Haliburton OUT → Shai Lowry IN (stamina_rule2)

[02:58] Substitution (Team_045): Cole Simons OUT → Gary Towns IN (stamina_rule2)

[02:43] Team_058 possession (Score: 22-20)
Tyrese Doncic attempts a Midrange. Contested by Stephen Paul (4.5 feet, MAN). TYRESE DONCIC MAKES IT! Assist: Jordan Ingram
Score: 24-20

[02:26] Team_045 possession (Score: 24-20)
Rudy Antetokounmpo attempts a 3Pt. Contested by Bradley Sexton (3.6 feet, ZONE). Rudy Antetokounmpo misses. Rebound secured by Tyrese Doncic.

[02:13] Team_058 possession (Score: 24-20)
Jordan Ingram attempts a 3Pt. Contested by Rudy Antetokounmpo (4.8 feet, ZONE). Jordan Ingram misses. Rebound secured by Stephen Paul.

[01:59] Team_045 possession (Score: 24-20)
DeMar Turner drives, Shai Lowry stays with him. DeMar Turner attempts a Layup. Contested by Shai Lowry (4.3 feet, MAN). DEMAR TURNER MAKES IT!
Score: 24-22

[01:50] Team_058 possession (Score: 24-22)
Shai Lowry attempts a 3Pt. Contested by Rudy Antetokounmpo (4.7 feet, ZONE). Shai Lowry misses. FOUL! Loose ball foul on Gary Towns during the rebound battle. [IN THE BONUS! 7 team fouls] Tyrese Doncic to the line for 2 free throws. (Gary Towns: 1 personal fouls)   FT 1/2: GOOD   FT 2/2: GOOD Tyrese Doncic makes 2/2 from the line.
Score: 26-22

[01:35] Team_045 possession (Score: 26-22)
Stephen Paul attempts a Layup. Contested by Tyrese Doncic (4.7 feet, MAN). STEPHEN PAUL MAKES IT! Assist: Rudy Antetokounmpo
Score: 26-24

[01:24] Team_058 possession (Score: 26-24)
Vince Hyland drives, Gary Towns stays with him. Vince Hyland attempts a Layup. Contested by Gary Towns (5.3 feet, MAN). VINCE HYLAND MAKES IT!
Score: 28-24

[01:08] Team_045 possession (Score: 28-24)
Trae Russell attempts a 3Pt. Contested by Bradley Sexton (4.0 feet, ZONE). TRAE RUSSELL MAKES IT! Assist: Rudy Antetokounmpo
Score: 28-27

[00:55] Team_058 possession (Score: 28-27)
Shai Lowry makes the Layup and draws the foul on DeMar Turner! And-1! Shai Lowry to the line for 1. [BONUS: 8 team fouls] (DeMar Turner: 2 personal fouls)   FT 1/1: GOOD Shai Lowry makes 1/1 from the line.
Score: 31-27

[00:38] Team_045 possession (Score: 31-27)
Rudy Antetokounmpo attempts a 3Pt. Contested by Bradley Sexton (3.9 feet, MAN). RUDY ANTETOKOUNMPO MAKES IT! Assist: Gary Towns
Score: 31-30

[00:25] Team_058 possession (Score: 31-30)
Vince Hyland attempts a 3Pt. Contested by Rudy Antetokounmpo (5.2 feet, ZONE). Vince Hyland misses. Rebound secured by Gary Towns.

[00:12] Team_045 possession (Score: 31-30)
Trae Russell drives, picks up Jordan Ingram. Help arrives from Bradley Sexton! Trae Russell attempts a Dunk. Wide open! Bradley Sexton is 6.4 feet away. [MAN] TRAE RUSSELL MAKES IT! Assist: Gary Towns
Score: 31-32

================================================================================
                              1ST QUARTER COMPLETE                              
================================================================================

1ST QUARTER SCORE: Team_058 31, Team_045 32

BOX SCORE:
================================================================================

Team_058
--------------------------------------------------------------------------------
Player                MIN  PTS  REB  AST  TO      FG   FG%      3P   3P%
--------------------------------------------------------------------------------
Kyle Westbrook          9   12    0    1   0   5/6    83.3     0/0   0.0
Tyrese Doncic          12   10    4    0   0   5/6    83.3     0/0   0.0
Vince Hyland           12    4    0    1   0   2/3    66.7     0/0   0.0
Shai Lowry              3    3    0    0   0   1/1   100.0     0/0   0.0
Stephen Haliburton      9    2    4    1   0   1/1   100.0     0/0   0.0
Bradley Sexton         12    0    4    0   0   0/2     0.0     0/0   0.0
Jordan Ingram           3    0    0    1   0   0/1     0.0     0/0   0.0

TEAM: FG: 14/20 (70.0%), 3PT: 5/10 (50.0%), REB: 12 (3 off, 9 def), AST: 4, TO: 3
TEAM FOULS: 4


Team_045
--------------------------------------------------------------------------------
Player                MIN  PTS  REB  AST  TO      FG   FG%      3P   3P%
--------------------------------------------------------------------------------
DeMar Turner           12    9    3    1   0   3/4    75.0     0/0   0.0
Zion Butler             9    8    4    0   0   3/4    75.0     0/0   0.0
Trae Russell           12    7    0    1   0   3/4    75.0     0/0   0.0
Rudy Antetokounmpo     12    6    0    2   0   2/6    33.3     0/0   0.0
Stephen Paul            3    2    1    0   0   1/1   100.0     0/0   0.0
Cole Simons             9    0    0    0   0   0/2     0.0     0/0   0.0
Gary Towns              3    0    1    2   0   0/0     0.0     0/0   0.0

TEAM: FG: 12/21 (57.1%), 3PT: 7/14 (50.0%), REB: 9 (3 off, 6 def), AST: 6, TO: 2
TEAM FOULS: 8 [Team_058 in BONUS]

================================================================================

================================================================================
                       2ND QUARTER - Team_058 vs Team_045                       
================================================================================

[12:00] Team_058 possession (Score: 31-32)
Vince Hyland attempts a 3Pt. Contested by Cole Simons (3.5 feet, MAN). Vince Hyland misses. Offensive rebound by Tyrese Doncic! Tyrese Doncic kicks it out.

[11:47] Team_058 possession (Score: 31-32)
Vince Hyland throws a bad pass! Stolen by Cole Simons! TURNOVER! (live ball)

[11:31] Team_045 possession (Score: 31-32)
DeMar Turner drives, Stephen Haliburton stays with him. DeMar Turner attempts a Layup. Contested by Stephen Haliburton (3.7 feet, MAN). DeMar Turner misses. Rebound secured by Stephen Haliburton.

[11:16] Team_058 possession (Score: 31-32)
Tyrese Doncic drives and kicks out. Kyle Westbrook attempts a Midrange. Contested by Cole Simons (3.3 feet, MAN). Kyle Westbrook misses. Offensive rebound by Tyrese Doncic! Tyrese Doncic kicks it out.

[11:02] Team_058 possession (Score: 31-32)
Bradley Sexton attempts a 3Pt. Contested by Rudy Antetokounmpo (5.1 feet, MAN). BRADLEY SEXTON MAKES IT! Assist: Tyrese Doncic
Score: 34-32

[10:45] Team_045 possession (Score: 34-32)
DeMar Turner attempts a 3Pt. Contested by Stephen Haliburton (3.7 feet, MAN). DeMar Turner misses. Rebound secured by Bradley Sexton.

[10:30] Team_058 possession (Score: 34-32)
Stephen Haliburton drives and kicks out. Stephen Haliburton attempts a 3Pt. Contested by Cole Simons (3.4 feet, ZONE). STEPHEN HALIBURTON MAKES IT! Assist: Bradley Sexton
Score: 37-32

[10:17] Team_045 possession (Score: 37-32)
Cole Simons drives and kicks out. Trae Russell attempts a 3Pt. Contested by Bradley Sexton (3.6 feet, ZONE). Trae Russell misses. Offensive rebound by Cole Simons! Cole Simons kicks it out.

[10:00] Team_045 possession (Score: 37-32)
Rudy Antetokounmpo drives and kicks out. DeMar Turner attempts a 3Pt. Contested by Bradley Sexton (3.7 feet, ZONE). DeMar Turner misses. Rebound secured by Stephen Haliburton.

[09:46] Team_058 possession (Score: 37-32)
Stephen Haliburton attempts a Layup. Contested by Zion Butler (3.6 feet, ZONE). STEPHEN HALIBURTON MAKES IT! Assist: Kyle Westbrook
Score: 39-32

[09:31] Team_045 possession (Score: 39-32)
Rudy Antetokounmpo makes the Dunk and draws the foul on Stephen Haliburton! And-1! Rudy Antetokounmpo to the line for 1. [Team fouls: 1] (Stephen Haliburton: 1 personal fouls)   FT 1/1: GOOD Rudy Antetokounmpo makes 1/1 from the line.
Score: 39-35

[09:17] Team_058 possession (Score: 39-35)
Stephen Haliburton drives and kicks out. Kyle Westbrook attempts a 3Pt. Contested by Cole Simons (3.5 feet, ZONE). Kyle Westbrook misses. Rebound secured by Zion Butler.

[09:06] Team_045 possession (Score: 39-35)
DeMar Turner attempts a Midrange. Contested by Kyle Westbrook (4.5 feet, ZONE). DeMar Turner misses. Rebound secured by Tyrese Doncic.

[08:52] Team_058 possession (Score: 39-35)
Stephen Haliburton makes the Layup and draws the foul on Zion Butler! And-1! Stephen Haliburton to the line for 1. [Team fouls: 1] (Zion Butler: 1 personal fouls)   FT 1/1: GOOD Stephen Haliburton makes 1/1 from the line.
Score: 42-35

[08:40] Team_045 possession (Score: 42-35)
Rudy Antetokounmpo makes the Dunk and draws the foul on Kyle Westbrook! And-1! Rudy Antetokounmpo to the line for 1. [Team fouls: 2] (Kyle Westbrook: 1 personal fouls)   FT 1/1: GOOD Rudy Antetokounmpo makes 1/1 from the line.
Score: 42-38

[08:23] Team_058 possession (Score: 42-38)
Kyle Westbrook attempts a 3Pt. Contested by Cole Simons (3.8 feet, ZONE). KYLE WESTBROOK MAKES IT! Assist: Bradley Sexton
Score: 45-38

[08:11] Team_045 possession (Score: 45-38)
Trae Russell drives and kicks out. Rudy Antetokounmpo attempts a 3Pt. Contested by Bradley Sexton (4.0 feet, MAN). Rudy Antetokounmpo misses. Offensive rebound by Zion Butler! Zion Butler puts it back in!
Score: 45-40

[07:53] Team_058 possession (Score: 45-40)
Vince Hyland attempts a 3Pt. Contested by Cole Simons (3.9 feet, MAN). Vince Hyland misses. Rebound secured by Cole Simons.

[07:39] Team_045 possession (Score: 45-40)
FOUL! Shooting foul on Stephen Haliburton. DeMar Turner to the line for 2 free throws. [Team fouls: 3] (Stephen Haliburton: 2 personal fouls)   FT 1/2: GOOD   FT 2/2: GOOD DeMar Turner makes 2/2 from the line.
Score: 45-42

[07:20] Team_058 possession (Score: 45-42)
Stephen Haliburton attempts a Layup. Contested by Zion Butler (4.0 feet, MAN). STEPHEN HALIBURTON MAKES IT!
Score: 47-42

[07:05] Team_045 possession (Score: 47-42)
Rudy Antetokounmpo attempts a Midrange. Contested by Stephen Haliburton (4.2 feet, ZONE). Rudy Antetokounmpo misses. Offensive rebound by Zion Butler! Zion Butler puts it back in!
Score: 47-44

[06:52] Team_058 possession (Score: 47-44)
Vince Hyland drives, picks up Zion Butler. Help arrives from Rudy Antetokounmpo! Vince Hyland attempts a Dunk. Contested by Rudy Antetokounmpo (4.1 feet, ZONE). Vince Hyland misses. Rebound secured by Zion Butler.

[06:35] Team_045 possession (Score: 47-44)
DeMar Turner throws a bad pass out of bounds! TURNOVER! (dead ball)

[06:35] Substitution (Team_058): Bradley Sexton OUT → Draymond Williamson IN (stamina_rule2)

[06:35] Substitution (Team_058): Kyle Westbrook OUT → Jordan Ingram IN (stamina_rule2)

[06:35] Substitution (Team_058): Vince Hyland OUT → Pascal Holiday IN (stamina_rule2)

[06:35] Substitution (Team_058): Stephen Haliburton OUT → Shai Lowry IN (stamina_rule2)

[06:35] Substitution (Team_058): Tyrese Doncic OUT → Jarrett Gilgeous-Alexander IN (stamina_rule2)

[06:35] Substitution (Team_045): Rudy Antetokounmpo OUT → John Wagner IN (stamina_rule2)

[06:35] Substitution (Team_045): Trae Russell OUT → Julius James IN (stamina_rule2)

[06:35] Substitution (Team_045): Cole Simons OUT → Gary Towns IN (stamina_rule2)

[06:35] Substitution (Team_045): DeMar Turner OUT → Tim Sexton IN (stamina_rule2)

[06:35] Substitution (Team_045): Zion Butler OUT → Stephen Paul IN (stamina_rule2)

[06:22] Team_058 possession (Score: 47-44)
FOUL! Reach-in foul on Julius James during the drive. [Team fouls: 2] No free throws, side out. (Julius James: 1 personal fouls)

[06:11] Team_058 possession (Score: 47-44)
Pascal Holiday drives, Gary Towns stays with him. Pascal Holiday attempts a Layup. Contested by Gary Towns (5.0 feet, MAN). PASCAL HOLIDAY MAKES IT! Assist: Jarrett Gilgeous-Alexander
Score: 49-44

[05:58] Team_045 possession (Score: 49-44)
FOUL! Holding foul on Jarrett Gilgeous-Alexander. [Team fouls: 4] No free throws, side out. (Jarrett Gilgeous-Alexander: 1 personal fouls)

[05:41] Team_045 possession (Score: 49-44)
Stephen Paul attempts a 3Pt. Contested by Draymond Williamson (5.1 feet, ZONE). STEPHEN PAUL MAKES IT! Assist: Tim Sexton
Score: 49-47

[05:29] Team_058 possession (Score: 49-47)
Jarrett Gilgeous-Alexander makes the Layup and draws the foul on Julius James! And-1! Jarrett Gilgeous-Alexander to the line for 1. [Team fouls: 3] (Julius James: 2 personal fouls)   FT 1/1: GOOD Jarrett Gilgeous-Alexander makes 1/1 from the line.
Score: 52-47

[05:11] Team_045 possession (Score: 52-47)
Julius James drives and kicks out. Tim Sexton attempts a Midrange. Contested by Shai Lowry (4.0 feet, MAN). Tim Sexton misses. Rebound secured by Pascal Holiday.

[04:57] Team_058 possession (Score: 52-47)
FOUL! Shooting foul on Julius James. Pascal Holiday to the line for 2 free throws. [Team fouls: 4] (Julius James: 3 personal fouls)   FT 1/2: GOOD   FT 2/2: GOOD Pascal Holiday makes 2/2 from the line.
Score: 54-47

[04:43] Team_045 possession (Score: 54-47)
Gary Towns makes the Layup and draws the foul on Shai Lowry! And-1! Gary Towns to the line for 1. [BONUS: 5 team fouls] (Shai Lowry: 1 personal fouls)   FT 1/1: GOOD Gary Towns makes 1/1 from the line.
Score: 54-50

[04:29] Team_058 possession (Score: 54-50)
Shai Lowry attempts a Midrange. Contested by Tim Sexton (4.5 feet, MAN). SHAI LOWRY MAKES IT! Assist: Pascal Holiday
Score: 56-50

[04:19] Team_045 possession (Score: 56-50)
Stephen Paul throws a bad pass! Stolen by Jarrett Gilgeous-Alexander! TURNOVER! (live ball)

[04:03] Team_058 possession (Score: 56-50)
Jordan Ingram drives to the basket... FOUL! Offensive foul on Jordan Ingram! Julius James drew the charge! [Team fouls: 6] (Jordan Ingram: 1 personal fouls) TURNOVER! (dead ball)

[03:46] Team_045 possession (Score: 56-50)
John Wagner drives and kicks out. Tim Sexton attempts a Midrange. Contested by Shai Lowry (4.0 feet, MAN). TIM SEXTON MAKES IT! Assist: John Wagner
Score: 56-52

[03:26] Team_058 possession (Score: 56-52)
Jarrett Gilgeous-Alexander drives and kicks out. Pascal Holiday attempts a 3Pt. Contested by John Wagner (4.1 feet, ZONE). PASCAL HOLIDAY MAKES IT! Assist: Jarrett Gilgeous-Alexander
Score: 59-52

[03:15] Team_045 possession (Score: 59-52)
Stephen Paul attempts a Midrange. Contested by Pascal Holiday (4.5 feet, ZONE). STEPHEN PAUL MAKES IT! Assist: Tim Sexton
Score: 59-54

[03:02] Team_058 possession (Score: 59-54)
Pascal Holiday attempts a 3Pt. Contested by John Wagner (4.1 feet, ZONE). Pascal Holiday misses. Rebound secured by Stephen Paul.

[02:50] Team_045 possession (Score: 59-54)
FOUL! Shooting foul on Shai Lowry. John Wagner to the line for 2 free throws. [BONUS: 7 team fouls] (Shai Lowry: 2 personal fouls)   FT 1/2: GOOD   FT 2/2: GOOD John Wagner makes 2/2 from the line.
Score: 59-56

[02:36] Team_058 possession (Score: 59-56)
Pascal Holiday attempts a 3Pt. Contested by John Wagner (4.1 feet, ZONE). Pascal Holiday misses. Rebound secured by Stephen Paul.

[02:27] Team_045 possession (Score: 59-56)
Tim Sexton drives, picks up Shai Lowry. Help arrives from Jordan Ingram! Tim Sexton attempts a Dunk. Contested by Jordan Ingram (4.4 feet, MAN). TIM SEXTON MAKES IT! Assist: John Wagner
Score: 59-58

[02:10] Team_058 possession (Score: 59-58)
Jarrett Gilgeous-Alexander makes the Layup and draws the foul on Stephen Paul! And-1! Jarrett Gilgeous-Alexander to the line for 1. [BONUS: 5 team fouls] (Stephen Paul: 1 personal fouls)   FT 1/1: MISS Jarrett Gilgeous-Alexander makes 0/1 from the line. Rebound secured by Julius James.
Score: 61-58

[01:56] Team_045 possession (Score: 61-58)
Tim Sexton attempts a Midrange. Contested by Shai Lowry (4.5 feet, MAN). TIM SEXTON MAKES IT! Assist: John Wagner
Score: 61-60

[01:43] Team_058 possession (Score: 61-60)
Shai Lowry attempts a Layup. Contested by Tim Sexton (4.5 feet, MAN). SHAI LOWRY MAKES IT!
Score: 63-60

[01:26] Team_045 possession (Score: 63-60)
FOUL! Reach-in foul on Jordan Ingram during the drive. [IN THE BONUS! 8 team fouls] Julius James to the line for 2 free throws. (Jordan Ingram: 2 personal fouls)   FT 1/2: GOOD   FT 2/2: GOOD Julius James makes 2/2 from the line.
Score: 63-62

[01:13] Team_058 possession (Score: 63-62)
Draymond Williamson drives, Tim Sexton stays with him. Draymond Williamson attempts a Dunk. Contested by Tim Sexton (5.0 feet, ZONE). DRAYMOND WILLIAMSON MAKES IT! Assist: Jordan Ingram
Score: 65-62

[00:58] Team_045 possession (Score: 65-62)
FOUL! Shooting foul on Pascal Holiday. Tim Sexton to the line for 2 free throws. [BONUS: 9 team fouls] (Pascal Holiday: 1 personal fouls)   FT 1/2: GOOD   FT 2/2: GOOD Tim Sexton makes 2/2 from the line.
Score: 65-64

[00:43] Team_058 possession (Score: 65-64)
Shai Lowry attempts a 3Pt. Contested by Tim Sexton (4.5 feet, MAN). Shai Lowry misses. Offensive rebound by Shai Lowry! Shai Lowry kicks it out.

[00:26] Team_058 possession (Score: 65-64)
Draymond Williamson attempts a 3Pt. Contested by John Wagner (4.5 feet, ZONE). Draymond Williamson misses. Rebound secured by Julius James.

[00:12] Team_045 possession (Score: 65-64)
Gary Towns attempts a Midrange. Contested by Pascal Holiday (4.4 feet, ZONE). Gary Towns misses. Rebound secured by Jarrett Gilgeous-Alexander.

================================================================================
                              2ND QUARTER COMPLETE                              
================================================================================

2ND QUARTER SCORE: Team_058 34, Team_045 32

BOX SCORE:
================================================================================

Team_058
--------------------------------------------------------------------------------
Player                MIN  PTS  REB  AST  TO      FG   FG%      3P   3P%
--------------------------------------------------------------------------------
Stephen Haliburton     15   10    2    0   0   4/5    80.0     0/0   0.0
Pascal Holiday          6    7    1    1   0   3/5    60.0     0/0   0.0
Shai Lowry              9    4    1    0   0   2/2   100.0     0/0   0.0
Bradley Sexton         18    3    1    2   0   1/1   100.0     0/0   0.0
Kyle Westbrook         15    3    0    1   0   1/1   100.0     0/0   0.0
Jarrett Gilgeous-Alexander    6    3    1    2   0   1/2    50.0     0/0   0.0
Draymond Williamson     6    2    0    0   0   1/2    50.0     0/0   0.0
Tyrese Doncic          18    0    3    1   0   0/0     0.0     0/0   0.0
Vince Hyland           18    0    0    0   0   0/2     0.0     0/0   0.0
Jordan Ingram           9    0    0    1   0   0/0     0.0     0/0   0.0

TEAM: FG: 13/20 (65.0%), 3PT: 2/6 (33.3%), REB: 9 (3 off, 6 def), AST: 8, TO: 2
TEAM FOULS: 9 [Team_045 in BONUS]


Team_045
--------------------------------------------------------------------------------
Player                MIN  PTS  REB  AST  TO      FG   FG%      3P   3P%
--------------------------------------------------------------------------------
Tim Sexton              6    8    0    2   0   4/4   100.0     0/0   0.0
Rudy Antetokounmpo     18    6    0    0   0   2/3    66.7     0/0   0.0
Stephen Paul            9    5    2    0   0   2/2   100.0     0/0   0.0
Zion Butler            15    4    4    0   0   2/2   100.0     0/0   0.0
Gary Towns              9    3    0    0   0   1/2    50.0     0/0   0.0
DeMar Turner           18    2    0    0   0   1/4    25.0     0/0   0.0
Julius James            6    2    2    0   0   1/2    50.0     0/0   0.0
John Wagner             6    2    0    3   0   1/1   100.0     0/0   0.0
Cole Simons            15    0    2    0   0   0/0     0.0     0/0   0.0

TEAM: FG: 14/20 (70.0%), 3PT: 1/2 (50.0%), REB: 10 (3 off, 7 def), AST: 5, TO: 2
TEAM FOULS: 5 [Team_058 in BONUS]

================================================================================

================================================================================
                       3RD QUARTER - Team_058 vs Team_045                       
================================================================================

[12:00] Team_058 possession (Score: 65-64)
Vince Hyland attempts a 3Pt. Contested by Cole Simons (3.6 feet, ZONE). Vince Hyland misses. Rebound secured by Zion Butler.

[11:46] Team_045 possession (Score: 65-64)
Zion Butler drives and kicks out. Zion Butler attempts a Midrange. Contested by Tyrese Doncic (4.4 feet, MAN). Zion Butler misses. Rebound secured by Bradley Sexton.

[11:32] Team_058 possession (Score: 65-64)
Bradley Sexton attempts a 3Pt. Contested by Cole Simons (3.6 feet, ZONE). Bradley Sexton misses. Rebound secured by Cole Simons.

[11:17] Team_045 possession (Score: 65-64)
Cole Simons attempts a Midrange. Contested by Stephen Haliburton (4.1 feet, ZONE). Cole Simons misses. Rebound secured by Bradley Sexton.

[11:06] Team_058 possession (Score: 65-64)
Kyle Westbrook attempts a 3Pt. Contested by Cole Simons (3.4 feet, ZONE). Kyle Westbrook misses. Offensive rebound by Tyrese Doncic! Tyrese Doncic kicks it out.

[10:50] Team_058 possession (Score: 65-64)
Stephen Haliburton drives to the basket... Stephen Haliburton throws a bad pass out of bounds! TURNOVER! (dead ball)

[10:31] Team_045 possession (Score: 65-64)
Trae Russell attempts a 3Pt. Contested by Kyle Westbrook (4.5 feet, MAN). TRAE RUSSELL MAKES IT! Assist: DeMar Turner
Score: 65-67

[10:15] Team_058 possession (Score: 65-67)
FOUL! Shooting foul on Cole Simons. Kyle Westbrook to the line for 3 free throws. [Team fouls: 1] (Cole Simons: 1 personal fouls)   FT 1/3: GOOD   FT 2/3: GOOD   FT 3/3: GOOD Kyle Westbrook makes 3/3 from the line.
Score: 68-67

[09:59] Team_045 possession (Score: 68-67)
Zion Butler loses the ball! Stripped by Tyrese Doncic! TURNOVER! (live ball)

[09:41] Team_058 possession (Score: 68-67)
FOUL! Holding foul on Zion Butler. [Team fouls: 2] No free throws, side out. (Zion Butler: 1 personal fouls)

[09:30] Team_058 possession (Score: 68-67)
Bradley Sexton drives, picks up Rudy Antetokounmpo. Help arrives from Cole Simons! Bradley Sexton attempts a Layup. Contested by Cole Simons (4.8 feet, MAN). BRADLEY SEXTON MAKES IT! Assist: Tyrese Doncic
Score: 70-67

[09:15] Team_045 possession (Score: 70-67)
Cole Simons attempts a 3Pt. Contested by Bradley Sexton (3.6 feet, ZONE). Cole Simons misses. Rebound secured by Tyrese Doncic.

[08:59] Team_058 possession (Score: 70-67)
Bradley Sexton drives and kicks out. Bradley Sexton attempts a Midrange. Contested by Rudy Antetokounmpo (4.4 feet, MAN). Bradley Sexton misses. Rebound secured by Cole Simons.

[08:43] Team_045 possession (Score: 70-67)
Zion Butler attempts a 3Pt. Contested by Bradley Sexton (3.3 feet, ZONE). Zion Butler misses. Rebound secured by Stephen Haliburton.

[08:32] Team_058 possession (Score: 70-67)
Tyrese Doncic attempts a Layup. BLOCKED BY ZION BUTLER! Ball is loose! Rebound secured by DeMar Turner.

[08:16] Team_045 possession (Score: 70-67)
FOUL! Holding foul on Vince Hyland. [Team fouls: 1] No free throws, side out. (Vince Hyland: 1 personal fouls)

[08:04] Team_045 possession (Score: 70-67)
FOUL! Shooting foul on Stephen Haliburton. Rudy Antetokounmpo to the line for 2 free throws. [Team fouls: 2] (Stephen Haliburton: 1 personal fouls)   FT 1/2: GOOD   FT 2/2: GOOD Rudy Antetokounmpo makes 2/2 from the line.
Score: 70-69

[07:49] Team_058 possession (Score: 70-69)
Tyrese Doncic drives, Zion Butler stays with him. Tyrese Doncic attempts a Dunk. Contested by Zion Butler (3.3 feet, ZONE). TYRESE DONCIC MAKES IT!
Score: 72-69

[07:35] Team_045 possession (Score: 72-69)
FOUL! Shooting foul on Stephen Haliburton. DeMar Turner to the line for 2 free throws. [Team fouls: 3] (Stephen Haliburton: 2 personal fouls)   FT 1/2: MISS   FT 2/2: GOOD DeMar Turner makes 1/2 from the line.
Score: 72-70

[07:22] Team_058 possession (Score: 72-70)
Kyle Westbrook attempts a Layup. Contested by Cole Simons (3.4 feet, MAN). Kyle Westbrook misses. Rebound secured by Cole Simons.

[07:13] Team_045 possession (Score: 72-70)
Zion Butler drives and kicks out. DeMar Turner attempts a 3Pt. Contested by Vince Hyland (4.5 feet, ZONE). DeMar Turner misses. Rebound secured by Bradley Sexton.

[06:55] Team_058 possession (Score: 72-70)
Vince Hyland attempts a Midrange. Contested by Rudy Antetokounmpo (4.8 feet, ZONE). Vince Hyland misses. FOUL! Loose ball foul on Zion Butler during the rebound battle. [Team fouls: 3] No free throws, side out. (Zion Butler: 2 personal fouls)

[06:39] Team_058 possession (Score: 72-70)
FOUL! Shooting foul on Trae Russell. Kyle Westbrook to the line for 3 free throws. [Team fouls: 4] (Trae Russell: 1 personal fouls)   FT 1/3: MISS   FT 2/3: GOOD   FT 3/3: GOOD Kyle Westbrook makes 2/3 from the line.
Score: 74-70

[06:24] Team_045 possession (Score: 74-70)
Cole Simons attempts a 3Pt. Contested by Bradley Sexton (3.6 feet, ZONE). Cole Simons misses. Rebound secured by Tyrese Doncic.

[06:12] Team_058 possession (Score: 74-70)
FOUL! Offensive foul on Bradley Sexton! Rudy Antetokounmpo drew the charge! [Team fouls: 4] (Bradley Sexton: 1 personal fouls) TURNOVER! (dead ball)

[05:57] Team_045 possession (Score: 74-70)
DeMar Turner attempts a Layup. Contested by Stephen Haliburton (3.7 feet, MAN). DeMar Turner misses. Rebound secured by Bradley Sexton.

[05:46] Team_058 possession (Score: 74-70)
Tyrese Doncic drives, Zion Butler stays with him. Tyrese Doncic attempts a Layup. Contested by Zion Butler (3.3 feet, ZONE). TYRESE DONCIC MAKES IT!
Score: 76-70

[05:27] Team_045 possession (Score: 76-70)
Cole Simons makes the Layup and draws the foul on Stephen Haliburton! And-1! Cole Simons to the line for 1. [BONUS: 5 team fouls] (Stephen Haliburton: 3 personal fouls)   FT 1/1: GOOD Cole Simons makes 1/1 from the line.
Score: 76-73

[05:10] Team_058 possession (Score: 76-73)
Stephen Haliburton attempts a 3Pt. Contested by Cole Simons (3.4 feet, ZONE). Stephen Haliburton misses. Rebound secured by Cole Simons.

[04:58] Team_045 possession (Score: 76-73)
Cole Simons attempts a 3Pt. Contested by Bradley Sexton (3.6 feet, ZONE). Cole Simons misses. Rebound secured by Stephen Haliburton.

[04:44] Team_058 possession (Score: 76-73)
Stephen Haliburton attempts a Midrange. Contested by Trae Russell (5.6 feet, ZONE). STEPHEN HALIBURTON MAKES IT!
Score: 78-73

[04:28] Team_045 possession (Score: 78-73)
Cole Simons attempts a Layup. BLOCKED BY STEPHEN HALIBURTON! Ball is loose! Rebound secured by Tyrese Doncic.

[04:12] Team_058 possession (Score: 78-73)
Bradley Sexton attempts a 3Pt. Contested by Rudy Antetokounmpo (4.8 feet, ZONE). Bradley Sexton misses. Rebound secured by Cole Simons.

[03:56] Team_045 possession (Score: 78-73)
Zion Butler attempts a Midrange. Contested by Tyrese Doncic (4.8 feet, MAN). Zion Butler misses. Rebound secured by Bradley Sexton.

[03:40] Team_058 possession (Score: 78-73)
Kyle Westbrook makes the Midrange and draws the foul on Cole Simons! And-1! Kyle Westbrook to the line for 1. [BONUS: 5 team fouls] (Cole Simons: 2 personal fouls)   FT 1/1: GOOD Kyle Westbrook makes 1/1 from the line.
Score: 81-73

[03:25] Team_045 possession (Score: 81-73)
FOUL! Holding foul on Stephen Haliburton. [IN THE BONUS! 6 team fouls] DeMar Turner to the line for 2 free throws. (Stephen Haliburton: 4 personal fouls)   FT 1/2: GOOD   FT 2/2: GOOD DeMar Turner makes 2/2 from the line.
Score: 81-75

[03:12] Team_058 possession (Score: 81-75)
Vince Hyland drives, Zion Butler stays with him. Vince Hyland attempts a Dunk. Contested by Zion Butler (3.9 feet, ZONE). VINCE HYLAND MAKES IT! Assist: Kyle Westbrook
Score: 83-75

[02:59] Team_045 possession (Score: 83-75)
Cole Simons attempts a Midrange. Contested by Stephen Haliburton (4.3 feet, ZONE). COLE SIMONS MAKES IT!
Score: 83-77

[02:47] Team_058 possession (Score: 83-77)
Stephen Haliburton makes the Layup and draws the foul on DeMar Turner! And-1! Stephen Haliburton to the line for 1. [BONUS: 6 team fouls] (DeMar Turner: 1 personal fouls)   FT 1/1: GOOD Stephen Haliburton makes 1/1 from the line.
Score: 86-77

[02:31] Team_045 possession (Score: 86-77)
Trae Russell attempts a 3Pt. Contested by Bradley Sexton (3.8 feet, ZONE). TRAE RUSSELL MAKES IT! Assist: Rudy Antetokounmpo
Score: 86-80

[02:16] Team_058 possession (Score: 86-80)
Tyrese Doncic attempts a 3Pt. Contested by Cole Simons (3.6 feet, ZONE). Tyrese Doncic misses. Rebound secured by Cole Simons.

[01:59] Team_045 possession (Score: 86-80)
Trae Russell drives, Kyle Westbrook stays with him. Trae Russell attempts a Dunk. Contested by Kyle Westbrook (4.9 feet, MAN). Trae Russell misses. Rebound secured by Stephen Haliburton.

[01:42] Team_058 possession (Score: 86-80)
Vince Hyland attempts a 3Pt. Contested by Cole Simons (4.0 feet, ZONE). Vince Hyland misses. Offensive rebound by Tyrese Doncic! Tyrese Doncic kicks it out.

[01:32] Team_058 possession (Score: 86-80)
Stephen Haliburton attempts a 3Pt. Contested by DeMar Turner (5.3 feet, MAN). Stephen Haliburton misses. Rebound secured by Zion Butler.

[01:15] Team_045 possession (Score: 86-80)
Cole Simons attempts a 3Pt. Contested by Vince Hyland (5.4 feet, ZONE). Cole Simons misses. Rebound secured by Bradley Sexton.

[01:04] Team_058 possession (Score: 86-80)
Vince Hyland loses the ball! Stripped by Cole Simons! TURNOVER! (live ball)

[00:50] Team_045 possession (Score: 86-80)
Cole Simons attempts a 3Pt. Contested by Bradley Sexton (4.0 feet, ZONE). COLE SIMONS MAKES IT!
Score: 86-83

[00:39] Team_058 possession (Score: 86-83)
Tyrese Doncic attempts a 3Pt. Contested by Cole Simons (3.9 feet, ZONE). TYRESE DONCIC MAKES IT!
Score: 89-83

[00:25] Team_045 possession (Score: 89-83)
FOUL! Shooting foul on Tyrese Doncic. Zion Butler to the line for 2 free throws. [BONUS: 7 team fouls] (Tyrese Doncic: 1 personal fouls)   FT 1/2: GOOD   FT 2/2: GOOD Zion Butler makes 2/2 from the line.
Score: 89-85

[00:12] Team_058 possession (Score: 89-85)
Stephen Haliburton attempts a 3Pt. Contested by Cole Simons (4.0 feet, ZONE). Stephen Haliburton misses. Rebound secured by Cole Simons.

================================================================================
                              3RD QUARTER COMPLETE                              
================================================================================

3RD QUARTER SCORE: Team_058 24, Team_045 21

BOX SCORE:
================================================================================

Team_058
--------------------------------------------------------------------------------
Player                MIN  PTS  REB  AST  TO      FG   FG%      3P   3P%
--------------------------------------------------------------------------------
Kyle Westbrook         27    8    0    1   0   3/4    75.0     0/0   0.0
Tyrese Doncic          30    7    6    1   0   3/5    60.0     0/0   0.0
Stephen Haliburton     27    5    3    0   0   2/5    40.0     0/0   0.0
Vince Hyland           30    2    0    0   0   1/2    50.0     0/0   0.0
Bradley Sexton         30    2    6    0   0   1/4    25.0     0/0   0.0

TEAM: FG: 10/20 (50.0%), 3PT: 3/10 (30.0%), REB: 15 (3 off, 12 def), AST: 2, TO: 3
TEAM FOULS: 7 [Team_045 in BONUS]


Team_045
--------------------------------------------------------------------------------
Player                MIN  PTS  REB  AST  TO      FG   FG%      3P   3P%
--------------------------------------------------------------------------------
Cole Simons            27    8    7    0   0   3/9    33.3     0/0   0.0
Trae Russell           30    6    0    0   0   2/3    66.7     0/0   0.0
DeMar Turner           30    3    1    1   0   2/3    66.7     0/0   0.0
Zion Butler            27    2    2    0   0   1/5    20.0     0/0   0.0
Rudy Antetokounmpo     30    2    0    1   0   1/1   100.0     0/0   0.0

TEAM: FG: 9/21 (42.9%), 3PT: 3/8 (37.5%), REB: 10 (0 off, 10 def), AST: 2, TO: 1
TEAM FOULS: 6 [Team_058 in BONUS]

================================================================================

================================================================================
                       4TH QUARTER - Team_058 vs Team_045                       
================================================================================

[12:00] Team_058 possession (Score: 89-85)
Vince Hyland attempts a 3Pt. BLOCKED BY COLE SIMONS! Ball deflects out of bounds off Vince Hyland.

[11:47] Team_045 possession (Score: 89-85)
Rudy Antetokounmpo attempts a Midrange. Contested by Stephen Haliburton (4.2 feet, ZONE). Rudy Antetokounmpo misses. Offensive rebound by DeMar Turner! DeMar Turner kicks it out.

[11:35] Team_045 possession (Score: 89-85)
DeMar Turner drives, Stephen Haliburton stays with him. DeMar Turner attempts a Layup. Contested by Stephen Haliburton (4.2 feet, ZONE). DeMar Turner misses. Offensive rebound by DeMar Turner! DeMar Turner kicks it out.

[11:21] Team_045 possession (Score: 89-85)
Cole Simons attempts a 3Pt. Contested by Vince Hyland (5.4 feet, MAN). Cole Simons misses. Rebound secured by Tyrese Doncic.

[11:06] Team_058 possession (Score: 89-85)
Kyle Westbrook throws a bad pass out of bounds! TURNOVER! (dead ball)

[11:06] Substitution (Team_058): Bradley Sexton OUT → Draymond Williamson IN (stamina_rule2)

[11:06] Substitution (Team_058): Kyle Westbrook OUT → Jordan Ingram IN (stamina_rule2)

[11:06] Substitution (Team_058): Vince Hyland OUT → Pascal Holiday IN (stamina_rule2)

[11:06] Substitution (Team_058): Stephen Haliburton OUT → Shai Lowry IN (stamina_rule2)

[11:06] Substitution (Team_058): Tyrese Doncic OUT → Jarrett Gilgeous-Alexander IN (stamina_rule2)

[11:06] Substitution (Team_045): Rudy Antetokounmpo OUT → John Wagner IN (stamina_rule2)

[11:06] Substitution (Team_045): Trae Russell OUT → Julius James IN (stamina_rule2)

[11:06] Substitution (Team_045): Cole Simons OUT → Gary Towns IN (stamina_rule2)

[11:06] Substitution (Team_045): DeMar Turner OUT → Tim Sexton IN (stamina_rule2)

[11:06] Substitution (Team_045): Zion Butler OUT → Stephen Paul IN (stamina_rule2)

[10:49] Team_045 possession (Score: 89-85)
John Wagner attempts a 3Pt. Contested by Draymond Williamson (5.4 feet, MAN). John Wagner misses. Rebound secured by Jarrett Gilgeous-Alexander.

[10:33] Team_058 possession (Score: 89-85)
Pascal Holiday drives to the basket... FOUL! Offensive foul on Pascal Holiday! Stephen Paul drew the charge! [Team fouls: 1] (Pascal Holiday: 1 personal fouls) TURNOVER! (dead ball)

[10:14] Team_045 possession (Score: 89-85)
FOUL! Reach-in foul on Shai Lowry during the drive. [Team fouls: 2] No free throws, side out. (Shai Lowry: 1 personal fouls)

[10:01] Team_045 possession (Score: 89-85)
Stephen Paul attempts a Midrange. Contested by Pascal Holiday (4.5 feet, ZONE). Stephen Paul misses. Offensive rebound by Tim Sexton! Tim Sexton kicks it out.

[09:45] Team_045 possession (Score: 89-85)
Stephen Paul attempts a Layup. Contested by Jarrett Gilgeous-Alexander (5.2 feet, MAN). STEPHEN PAUL MAKES IT!
Score: 89-87

[09:28] Team_058 possession (Score: 89-87)
Draymond Williamson drives and kicks out. Jarrett Gilgeous-Alexander attempts a Midrange. Contested by Stephen Paul (4.5 feet, MAN). JARRETT GILGEOUS-ALEXANDER MAKES IT! Assist: Draymond Williamson
Score: 91-87

[09:13] Team_045 possession (Score: 91-87)
Stephen Paul drives to the basket... FOUL! Offensive foul on Stephen Paul! Shai Lowry drew the charge! [Team fouls: 1] (Stephen Paul: 1 personal fouls) TURNOVER! (dead ball)

[09:00] Team_058 possession (Score: 91-87)
Jordan Ingram drives and kicks out. Shai Lowry attempts a 3Pt. Contested by John Wagner (4.1 feet, ZONE). Shai Lowry misses. Rebound secured by Julius James.

[08:45] Team_045 possession (Score: 91-87)
Gary Towns attempts a 3Pt. Contested by Pascal Holiday (4.4 feet, MAN). Gary Towns misses. Rebound secured by Pascal Holiday.

[08:27] Team_058 possession (Score: 91-87)
Jordan Ingram attempts a 3Pt. Contested by Julius James (4.0 feet, MAN). Jordan Ingram misses. Rebound secured by Stephen Paul.

[08:08] Team_045 possession (Score: 91-87)
FOUL! Holding foul on Jordan Ingram. [Team fouls: 3] No free throws, side out. (Jordan Ingram: 1 personal fouls)

[07:52] Team_045 possession (Score: 91-87)
Julius James drives to the basket... FOUL! Offensive foul on Julius James! Shai Lowry drew the charge! [Team fouls: 2] (Julius James: 1 personal fouls) TURNOVER! (dead ball)

[07:39] Team_058 possession (Score: 91-87)
Draymond Williamson attempts a 3Pt. Contested by John Wagner (4.5 feet, MAN). Draymond Williamson misses. Rebound secured by Stephen Paul.

[07:29] Team_045 possession (Score: 91-87)
Tim Sexton drives to the basket... Tim Sexton throws a bad pass! Stolen by Shai Lowry! TURNOVER! (live ball)

[07:12] Team_058 possession (Score: 91-87)
Jordan Ingram attempts a 3Pt. Contested by John Wagner (4.1 feet, ZONE). Jordan Ingram misses. Offensive rebound by Pascal Holiday! Pascal Holiday puts it back in!
Score: 93-87

[06:55] Team_045 possession (Score: 93-87)
John Wagner throws a bad pass out of bounds! TURNOVER! (dead ball)

[06:37] Team_058 possession (Score: 93-87)
FOUL! Offensive foul on Shai Lowry! Tim Sexton drew the charge! [Team fouls: 4] (Shai Lowry: 2 personal fouls) TURNOVER! (dead ball)

[06:20] Team_045 possession (Score: 93-87)
Gary Towns attempts a Midrange. Contested by Pascal Holiday (4.4 feet, MAN). Gary Towns misses. Rebound secured by Shai Lowry.

[06:06] Team_058 possession (Score: 93-87)
Jarrett Gilgeous-Alexander drives, Stephen Paul stays with him. Jarrett Gilgeous-Alexander attempts a Dunk. Contested by Stephen Paul (4.5 feet, MAN). Jarrett Gilgeous-Alexander misses. Rebound secured by Tim Sexton.

[05:48] Team_045 possession (Score: 93-87)
John Wagner attempts a 3Pt. Contested by Draymond Williamson (5.4 feet, MAN). JOHN WAGNER MAKES IT! Assist: Julius James
Score: 93-90

[05:34] Team_058 possession (Score: 93-90)
Pascal Holiday attempts a Layup. Contested by Stephen Paul (4.5 feet, ZONE). PASCAL HOLIDAY MAKES IT!
Score: 95-90

[05:21] Team_045 possession (Score: 95-90)
Julius James attempts a 3Pt. Contested by Draymond Williamson (5.4 feet, ZONE). JULIUS JAMES MAKES IT! Assist: Gary Towns
Score: 95-93

[05:08] Team_058 possession (Score: 95-93)
Jordan Ingram attempts a Layup. Contested by Tim Sexton (4.6 feet, ZONE). JORDAN INGRAM MAKES IT!
Score: 97-93

[04:53] Team_045 possession (Score: 97-93)
Gary Towns attempts a 3Pt. Contested by Draymond Williamson (5.1 feet, ZONE). GARY TOWNS MAKES IT! Assist: Julius James
Score: 97-96

[04:37] Team_058 possession (Score: 97-96)
Pascal Holiday attempts a 3Pt. Contested by Julius James (4.0 feet, ZONE). Pascal Holiday misses. Rebound secured by Stephen Paul.

[04:25] Team_045 possession (Score: 97-96)
Julius James drives and kicks out. Julius James attempts a Midrange. Contested by Jordan Ingram (5.9 feet, MAN). JULIUS JAMES MAKES IT!
Score: 97-98

[04:11] Team_058 possession (Score: 97-98)
Draymond Williamson makes the Midrange and draws the foul on Julius James! And-1! Draymond Williamson to the line for 1. [Team fouls: 3] (Julius James: 2 personal fouls)   FT 1/1: MISS Draymond Williamson makes 0/1 from the line. Rebound secured by Stephen Paul.
Score: 99-98

[03:55] Team_045 possession (Score: 99-98)
Julius James attempts a 3Pt. Contested by Draymond Williamson (5.4 feet, ZONE). Julius James misses. Rebound secured by Pascal Holiday.

[03:38] Team_058 possession (Score: 99-98)
Pascal Holiday drives to the basket... Pascal Holiday loses control! Ball rolls out of bounds! TURNOVER! (dead ball)

[03:22] Team_045 possession (Score: 99-98)
Stephen Paul attempts a Layup. BLOCKED BY JARRETT GILGEOUS-ALEXANDER! Ball is loose! Rebound secured by Jarrett Gilgeous-Alexander.

[03:06] Team_058 possession (Score: 99-98)
Jordan Ingram attempts a 3Pt. Contested by John Wagner (4.2 feet, ZONE). Jordan Ingram misses. Offensive rebound by Shai Lowry! Shai Lowry kicks it out.

[02:50] Team_058 possession (Score: 99-98)
Jordan Ingram attempts a 3Pt. Contested by John Wagner (4.2 feet, ZONE). Jordan Ingram misses. FOUL! Loose ball foul on Julius James during the rebound battle. [Team fouls: 4] No free throws, side out. (Julius James: 3 personal fouls)

[02:37] Team_058 possession (Score: 99-98)
Shai Lowry drives, Tim Sexton stays with him. Shai Lowry attempts a Layup. Contested by Tim Sexton (4.5 feet, MAN). SHAI LOWRY MAKES IT! Assist: Jarrett Gilgeous-Alexander
Score: 101-98

[02:22] Team_045 possession (Score: 101-98)
FOUL! Holding foul on Jordan Ingram. [IN THE BONUS! 5 team fouls] Julius James to the line for 2 free throws. (Jordan Ingram: 2 personal fouls)   FT 1/2: GOOD   FT 2/2: GOOD Julius James makes 2/2 from the line.
Score: 101-100

[02:05] Team_058 possession (Score: 101-100)
FOUL! Holding foul on Julius James. [IN THE BONUS! 5 team fouls] Jordan Ingram to the line for 2 free throws. (Julius James: 4 personal fouls)   FT 1/2: MISS   FT 2/2: MISS Jordan Ingram makes 0/2 from the line. Offensive rebound by Shai Lowry! Shai Lowry kicks it out.

[01:50] Team_058 possession (Score: 101-100)
Jarrett Gilgeous-Alexander attempts a Midrange. Contested by Stephen Paul (4.6 feet, MAN). Jarrett Gilgeous-Alexander misses. Offensive rebound by Shai Lowry! Shai Lowry kicks it out.

[01:36] Team_058 possession (Score: 101-100)
Pascal Holiday drives and kicks out. Shai Lowry attempts a 3Pt. Contested by John Wagner (4.3 feet, ZONE). Shai Lowry misses. Rebound secured by Julius James.

[01:26] Team_045 possession (Score: 101-100)
John Wagner attempts a 3Pt. Contested by Draymond Williamson (5.6 feet, MAN). John Wagner misses. Rebound secured by Jarrett Gilgeous-Alexander.

[01:12] Team_058 possession (Score: 101-100)
Shai Lowry attempts a Layup. Contested by Stephen Paul (4.7 feet, ZONE). SHAI LOWRY MAKES IT! Assist: Jordan Ingram
Score: 103-100

[01:00] Team_045 possession (Score: 103-100)
Gary Towns attempts a 3Pt. Contested by Pascal Holiday (4.6 feet, MAN). GARY TOWNS MAKES IT! Assist: Stephen Paul
Score: 103-103

[00:50] Team_058 possession (Score: 103-103)
Pascal Holiday attempts a Midrange. Contested by Julius James (4.3 feet, ZONE). Pascal Holiday misses. Rebound secured by Stephen Paul.

[00:35] Team_045 possession (Score: 103-103)
Julius James drives and kicks out. Julius James attempts a 3Pt. Wide open! Jordan Ingram is 6.2 feet away. [MAN] JULIUS JAMES MAKES IT!
Score: 103-106

[00:21] Team_058 possession (Score: 103-106)
Jordan Ingram drives and kicks out. Jarrett Gilgeous-Alexander makes the Midrange and draws the foul on Julius James! And-1! Jarrett Gilgeous-Alexander to the line for 1. [BONUS: 6 team fouls] (Julius James: 5 personal fouls)   FT 1/1: GOOD Jarrett Gilgeous-Alexander makes 1/1 from the line.
Score: 106-106

[00:03] Team_045 possession (Score: 106-106)
John Wagner attempts a 3Pt. Contested by Draymond Williamson (5.7 feet, ZONE). JOHN WAGNER MAKES IT! Assist: Tim Sexton
Score: 106-109

================================================================================
                              4TH QUARTER COMPLETE                              
================================================================================

4TH QUARTER SCORE: Team_058 17, Team_045 24

BOX SCORE:
================================================================================

Team_058
--------------------------------------------------------------------------------
Player                MIN  PTS  REB  AST  TO      FG   FG%      3P   3P%
--------------------------------------------------------------------------------
Jarrett Gilgeous-Alexander   17    5    3    1   0   2/3    66.7     0/0   0.0
Pascal Holiday         17    4    3    0   0   2/5    40.0     0/0   0.0
Shai Lowry             20    4    5    0   0   2/2   100.0     0/0   0.0
Jordan Ingram          20    2    0    1   0   1/3    33.3     0/0   0.0
Vince Hyland           31    0    0    0   0   0/1     0.0     0/0   0.0
Tyrese Doncic          31    0    1    0   0   0/0     0.0     0/0   0.0
Draymond Williamson    17    0    0    1   0   0/2     0.0     0/0   0.0

TEAM: FG: 7/16 (43.8%), 3PT: 1/5 (20.0%), REB: 12 (5 off, 7 def), AST: 3, TO: 4
TEAM FOULS: 5 [Team_045 in BONUS]


Team_045
--------------------------------------------------------------------------------
Player                MIN  PTS  REB  AST  TO      FG   FG%      3P   3P%
--------------------------------------------------------------------------------
Julius James           17   10    2    2   0   4/5    80.0     0/0   0.0
John Wagner            17    6    0    0   0   2/4    50.0     0/0   0.0
Gary Towns             20    6    0    1   0   2/4    50.0     0/0   0.0
Stephen Paul           20    2    5    1   0   1/2    50.0     0/0   0.0
DeMar Turner           31    0    2    0   0   0/0     0.0     0/0   0.0
Cole Simons            28    0    0    0   0   0/1     0.0     0/0   0.0
Tim Sexton             17    0    2    1   0   0/0     0.0     0/0   0.0

TEAM: FG: 9/16 (56.2%), 3PT: 5/10 (50.0%), REB: 11 (3 off, 8 def), AST: 5, TO: 4
TEAM FOULS: 6 [Team_058 in BONUS]

================================================================================

================================================================================
                               FULL GAME COMPLETE                               
================================================================================

FINAL SCORE: Team_058 106, Team_045 109

SCORING BY QUARTER:
--------------------------------------------------------------------------------
Team                     Q1     Q2     Q3     Q4    FINAL
--------------------------------------------------------------------------------
Team_058                 31     34     24     17      106
Team_045                 32     32     21     24      109
--------------------------------------------------------------------------------

FULL GAME BOX SCORE:
================================================================================

Team_058
--------------------------------------------------------------------------------
Player                MIN  PTS  REB  AST  TO      FG   FG%      3P   3P%      FT STL BLK
--------------------------------------------------------------------------------
Bradley Sexton         31    5   11    2   1   2/7    28.6   1/5    20.0   0/0     0   0
Vince Hyland           31    6    0    1   3   5/10   50.0   1/5    20.0   2/2     0   0
Tyrese Doncic          31   17   14    2   2   6/9    66.7   1/2    50.0   6/6     2   0
Stephen Haliburton     28   17    9    1   0   7/11   63.6   1/4    25.0   2/2     0   1
Kyle Westbrook         28   23    0    3   2   8/10   80.0   5/6    83.3   9/10    0   0
Jordan Ingram          20    2    0    3   0   3/6    50.0   1/3    33.3   0/2     0   0
Shai Lowry             20   11    6    0   2   6/6   100.0   1/1   100.0   1/1     1   0
Draymond Williamson    17    2    0    1   2   2/5    40.0   0/2     0.0   0/1     0   0
Pascal Holiday         17   11    4    1   0   3/8    37.5   0/3     0.0   2/2     0   0
Jarrett Gilgeous-Alexander   17    8    4    3   0   2/4    50.0   0/0     0.0   2/3     1   1

TEAM: FG: 44/76 (57.9%), 3PT: 11/31 (35.5%), REB: 48 (14 off, 34 def), AST: 17, TO: 12


Team_045
--------------------------------------------------------------------------------
Player                MIN  PTS  REB  AST  TO      FG   FG%      3P   3P%      FT STL BLK
--------------------------------------------------------------------------------
Rudy Antetokounmpo     31   14    0    3   0   9/14   64.3   4/6    66.7   4/5     0   0
Trae Russell           31   13    0    1   0   6/8    75.0   3/4    75.0   0/0     0   0
DeMar Turner           31   14    6    2   1   5/10   50.0   2/4    50.0   6/7     0   0
Cole Simons            28    8    9    0   1   3/12   25.0   1/8    12.5   1/1     3   1
Zion Butler            28   14   11    0   2   1/6    16.7   0/2     0.0   2/2     0   1
Stephen Paul           20    9    8    1   1   4/5    80.0   1/1   100.0   0/0     0   0
Gary Towns             20    9    1    3   0   3/6    50.0   2/3    66.7   1/1     0   0
John Wagner            17    8    0    3   3   4/6    66.7   2/4    50.0   2/2     0   0
Julius James           17   12    4    2   1   4/6    66.7   1/2    50.0   4/4     0   0
Tim Sexton             17    8    2    3   0   3/3   100.0   0/0     0.0   2/2     0   0

TEAM: FG: 44/78 (56.4%), 3PT: 16/34 (47.1%), REB: 40 (9 off, 31 def), AST: 18, TO: 9

================================================================================
