================================================================================
                        FULL GAME - Team_040 vs Team_097                        
================================================================================

================================================================================
                       1ST QUARTER - Team_040 vs Team_097                       
================================================================================

[12:00] Team_040 possession (Score: 0-0)
Carmelo Murray attempts a 3Pt. Contested by Shai Poole (3.7 feet, MAN). Carmelo Murray misses. Rebound secured by Shai Poole.

[11:47] Team_097 possession (Score: 0-0)
Anthony Haliburton drives to the basket... Anthony Haliburton throws a bad pass! Stolen by Dirk Johnson! TURNOVER! (live ball)

[11:34] Team_040 possession (Score: 0-0)
Dirk Johnson drives, Anthony Haliburton stays with him. Dirk Johnson attempts a Layup. Contested by Anthony Haliburton (3.5 feet, MAN). DIRK JOHNSON MAKES IT! Assist: Shaquille Bane
Score: 2-0

[11:17] Team_097 possession (Score: 2-0)
Anthony Haliburton attempts a Layup. Wide open! Dirk Johnson is 6.3 feet away. [MAN] ANTHONY HALIBURTON MAKES IT!
Score: 2-2

[11:06] Team_040 possession (Score: 2-2)
FOUL! Holding foul on Shai Poole. [Team fouls: 1] No free throws, side out. (Shai Poole: 1 personal fouls)

[10:55] Team_040 possession (Score: 2-2)
Bam Gobert attempts a Midrange. Contested by Anthony Haliburton (3.6 feet, MAN). Bam Gobert misses. Rebound secured by Anthony Haliburton.

[10:41] Team_097 possession (Score: 2-2)
Tyrese Stewart drives to the basket... FOUL! Offensive foul on Tyrese Stewart! Bam Gobert drew the charge! [Team fouls: 2] (Tyrese Stewart: 1 personal fouls) TURNOVER! (dead ball)

[10:28] Team_040 possession (Score: 2-2)
FOUL! Reach-in foul on Evan Brogdon during the drive. [Team fouls: 3] No free throws, side out. (Evan Brogdon: 1 personal fouls)

[10:19] Team_040 possession (Score: 2-2)
Bam Gobert attempts a 3Pt. Contested by Shai Poole (3.7 feet, ZONE). Bam Gobert misses. Rebound secured by Shai Poole.

[10:01] Team_097 possession (Score: 2-2)
Tyrese Stewart drives to the basket... Tyrese Stewart throws a bad pass! Stolen by Bam Gobert! TURNOVER! (live ball)

[09:43] Team_040 possession (Score: 2-2)
Shaquille Bane attempts a Layup. Contested by Jrue Haliburton (5.7 feet, MAN). Shaquille Bane misses. Rebound secured by Anthony Haliburton.

[09:28] Team_097 possession (Score: 2-2)
Jrue Haliburton attempts a 3Pt. Contested by Ayo Rose (5.0 feet, ZONE). JRUE HALIBURTON MAKES IT! Assist: Tyrese Stewart
Score: 2-5

[09:15] Team_040 possession (Score: 2-5)
Bam Gobert drives and kicks out. Shaquille Bane attempts a 3Pt. Contested by Jrue Haliburton (5.2 feet, MAN). Shaquille Bane misses. Rebound secured by Shai Poole.

[09:01] Team_097 possession (Score: 2-5)
Tyrese Stewart makes the Layup and draws the foul on Bam Gobert! And-1! Tyrese Stewart to the line for 1. [Team fouls: 1] (Bam Gobert: 1 personal fouls)   FT 1/1: GOOD Tyrese Stewart makes 1/1 from the line.
Score: 2-8

[08:48] Team_040 possession (Score: 2-8)
Shaquille Bane drives to the basket... Shaquille Bane loses the ball! Stripped by Anthony Haliburton! TURNOVER! (live ball)

[08:33] Team_097 possession (Score: 2-8)
Anthony Haliburton drives, Bam Gobert stays with him. Anthony Haliburton attempts a Layup. Contested by Bam Gobert (4.3 feet, ZONE). ANTHONY HALIBURTON MAKES IT! Assist: Tyrese Stewart
Score: 2-10

[08:23] Team_040 possession (Score: 2-10)
Dirk Johnson makes the Layup and draws the foul on Anthony Haliburton! And-1! Dirk Johnson to the line for 1. [Team fouls: 4] (Anthony Haliburton: 1 personal fouls)   FT 1/1: MISS Dirk Johnson makes 0/1 from the line. Offensive rebound by Bam Gobert! Bam Gobert kicks it out.
Score: 4-10

[08:10] Team_040 possession (Score: 4-10)
Bam Gobert attempts a Dunk. BLOCKED BY ANTHONY HALIBURTON! Ball is loose! Rebound secured by Shai Poole.

[07:56] Team_097 possession (Score: 4-10)
Evan Brogdon drives to the basket... Evan Brogdon loses the ball! Stripped by Bam Gobert! TURNOVER! (live ball)

[07:44] Team_040 possession (Score: 4-10)
Ayo Rose attempts a 3Pt. Contested by Shai Poole (4.0 feet, ZONE). Ayo Rose misses. Rebound secured by Tyrese Stewart.

[07:28] Team_097 possession (Score: 4-10)
Shai Poole drives, picks up Bam Gobert. Help arrives from Shaquille Bane! Shai Poole attempts a Dunk. Contested by Shaquille Bane (4.5 feet, ZONE). SHAI POOLE MAKES IT! Assist: Tyrese Stewart
Score: 4-12

[07:13] Team_040 possession (Score: 4-12)
Bam Gobert drives and kicks out. Bam Gobert attempts a 3Pt. Contested by Anthony Haliburton (3.3 feet, MAN). Bam Gobert misses. Rebound secured by Anthony Haliburton.

[06:58] Team_097 possession (Score: 4-12)
Jrue Haliburton drives, picks up Dirk Johnson. Help arrives from Shaquille Bane! Jrue Haliburton attempts a Layup. Wide open! Shaquille Bane is 6.3 feet away. [ZONE] JRUE HALIBURTON MAKES IT! Assist: Anthony Haliburton
Score: 4-14

[06:42] Team_040 possession (Score: 4-14)
Shaquille Bane makes the Midrange and draws the foul on Jrue Haliburton! And-1! Shaquille Bane to the line for 1. [BONUS: 5 team fouls] (Jrue Haliburton: 1 personal fouls)   FT 1/1: GOOD Shaquille Bane makes 1/1 from the line.
Score: 7-14

[06:29] Team_097 possession (Score: 7-14)
Tyrese Stewart drives to the basket... Tyrese Stewart throws a bad pass out of bounds! TURNOVER! (dead ball)

[06:12] Team_040 possession (Score: 7-14)
Ayo Rose attempts a 3Pt. Contested by Evan Brogdon (5.3 feet, MAN). Ayo Rose misses. FOUL! Loose ball foul on Shai Poole during the rebound battle. [IN THE BONUS! 6 team fouls] Bam Gobert to the line for 2 free throws. (Shai Poole: 2 personal fouls)   FT 1/2: GOOD   FT 2/2: MISS Bam Gobert makes 1/2 from the line. Rebound secured by Tyrese Stewart.
Score: 8-14

[05:58] Team_097 possession (Score: 8-14)
Anthony Haliburton makes the Layup and draws the foul on Dirk Johnson! And-1! Anthony Haliburton to the line for 1. [Team fouls: 2] (Dirk Johnson: 1 personal fouls)   FT 1/1: GOOD Anthony Haliburton makes 1/1 from the line.
Score: 8-17

[05:38] Team_040 possession (Score: 8-17)
Bam Gobert drives and kicks out. Shaquille Bane attempts a Midrange. Contested by Shai Poole (3.4 feet, ZONE). Shaquille Bane misses. Rebound secured by Tyrese Stewart.

[05:23] Team_097 possession (Score: 8-17)
Anthony Haliburton drives and kicks out. Tyrese Stewart attempts a 3Pt. Contested by Ayo Rose (4.6 feet, ZONE). Tyrese Stewart misses. Rebound secured by Dirk Johnson.

[05:05] Team_040 possession (Score: 8-17)
Carmelo Murray attempts a Layup. Contested by Shai Poole (3.7 feet, MAN). CARMELO MURRAY MAKES IT!
Score: 10-17

[04:47] Team_097 possession (Score: 10-17)
Shai Poole drives, picks up Carmelo Murray. Help arrives from Shaquille Bane! Shai Poole attempts a Layup. Contested by Shaquille Bane (5.1 feet, MAN). SHAI POOLE MAKES IT! Assist: Tyrese Stewart
Score: 10-19

[04:31] Team_040 possession (Score: 10-19)
Ayo Rose attempts a Midrange. Contested by Jrue Haliburton (5.9 feet, ZONE). Ayo Rose misses. Offensive rebound by Dirk Johnson! Dirk Johnson kicks it out.

[04:13] Team_040 possession (Score: 10-19)
FOUL! Offensive foul on Carmelo Murray! Shai Poole drew the charge! [Team fouls: 3] (Carmelo Murray: 1 personal fouls) TURNOVER! (dead ball)

[03:57] Team_097 possession (Score: 10-19)
Anthony Haliburton attempts a Midrange. Wide open! Dirk Johnson is 6.4 feet away. [MAN] ANTHONY HALIBURTON MAKES IT!
Score: 10-21

[03:41] Team_040 possession (Score: 10-21)
Carmelo Murray attempts a Midrange. Contested by Shai Poole (3.8 feet, MAN). Carmelo Murray misses. Offensive rebound by Dirk Johnson! Dirk Johnson kicks it out.

[03:29] Team_040 possession (Score: 10-21)
Bam Gobert drives, Anthony Haliburton stays with him. Bam Gobert attempts a Dunk. Contested by Anthony Haliburton (3.7 feet, MAN). BAM GOBERT MAKES IT! Assist: Carmelo Murray
Score: 12-21

[03:10] Team_097 possession (Score: 12-21)
Jrue Haliburton drives, Shaquille Bane stays with him. Jrue Haliburton attempts a Dunk. Contested by Shaquille Bane (5.2 feet, MAN). JRUE HALIBURTON MAKES IT! Assist: Shai Poole
Score: 12-23

[02:54] Team_040 possession (Score: 12-23)
Dirk Johnson attempts a 3Pt. Contested by Anthony Haliburton (3.7 feet, MAN). Dirk Johnson misses. Offensive rebound by Dirk Johnson! Dirk Johnson kicks it out.

[02:44] Team_040 possession (Score: 12-23)
Ayo Rose attempts a Midrange. Contested by Evan Brogdon (5.5 feet, MAN). AYO ROSE MAKES IT!
Score: 14-23

[02:34] Team_097 possession (Score: 14-23)
Jrue Haliburton attempts a 3Pt. Contested by Shaquille Bane (5.3 feet, MAN). Jrue Haliburton misses. Rebound secured by Bam Gobert.

[02:18] Team_040 possession (Score: 14-23)
Ayo Rose drives and kicks out. Carmelo Murray attempts a Midrange. Contested by Shai Poole (3.7 feet, MAN). Carmelo Murray misses. Offensive rebound by Dirk Johnson! Dirk Johnson kicks it out.

[02:06] Team_040 possession (Score: 14-23)
FOUL! Holding foul on Jrue Haliburton. [IN THE BONUS! 7 team fouls] Shaquille Bane to the line for 2 free throws. (Jrue Haliburton: 2 personal fouls)   FT 1/2: GOOD   FT 2/2: MISS Shaquille Bane makes 1/2 from the line. Rebound secured by Tyrese Stewart.
Score: 15-23

[01:54] Team_097 possession (Score: 15-23)
Evan Brogdon makes the 3Pt and draws the foul on Ayo Rose! And-1! Evan Brogdon to the line for 1. [Team fouls: 4] (Ayo Rose: 1 personal fouls)   FT 1/1: GOOD Evan Brogdon makes 1/1 from the line.
Score: 15-27

[01:44] Team_040 possession (Score: 15-27)
FOUL! Holding foul on Jrue Haliburton. [IN THE BONUS! 8 team fouls] Shaquille Bane to the line for 2 free throws. (Jrue Haliburton: 3 personal fouls)   FT 1/2: GOOD   FT 2/2: MISS Shaquille Bane makes 1/2 from the line. Rebound secured by Anthony Haliburton.
Score: 16-27

[01:34] Team_097 possession (Score: 16-27)
Shai Poole drives and kicks out. Shai Poole attempts a Midrange. Contested by Carmelo Murray (4.8 feet, MAN). Shai Poole misses. Rebound secured by Shaquille Bane.

[01:19] Team_040 possession (Score: 16-27)
Bam Gobert attempts a Layup. Contested by Anthony Haliburton (4.0 feet, MAN). Bam Gobert misses. Rebound secured by Anthony Haliburton.

[01:05] Team_097 possession (Score: 16-27)
Anthony Haliburton attempts a 3Pt. Contested by Ayo Rose (5.4 feet, ZONE). ANTHONY HALIBURTON MAKES IT! Assist: Shai Poole
Score: 16-30

[00:53] Team_040 possession (Score: 16-30)
Bam Gobert attempts a Layup. BLOCKED BY ANTHONY HALIBURTON! Ball deflects out of bounds off Bam Gobert.

[00:38] Team_097 possession (Score: 16-30)
Shai Poole attempts a 3Pt. Contested by Ayo Rose (5.6 feet, ZONE). Shai Poole misses. Rebound secured by Shaquille Bane.

[00:23] Team_040 possession (Score: 16-30)
Carmelo Murray drives, Shai Poole stays with him. Carmelo Murray attempts a Dunk. Contested by Shai Poole (4.2 feet, MAN). CARMELO MURRAY MAKES IT! Assist: Bam Gobert
Score: 18-30

[00:11] Team_097 possession (Score: 18-30)
FOUL! Shooting foul on Bam Gobert. Jrue Haliburton to the line for 2 free throws. [BONUS: 5 team fouls] (Bam Gobert: 2 personal fouls)   FT 1/2: GOOD   FT 2/2: GOOD Jrue Haliburton makes 2/2 from the line.
Score: 18-32

================================================================================
                              1ST QUARTER COMPLETE                              
================================================================================

1ST QUARTER SCORE: Team_040 18, Team_097 32

BOX SCORE:
================================================================================

Team_040
--------------------------------------------------------------------------------
Player                MIN  PTS  REB  AST  TO      FG   FG%      3P   3P%
--------------------------------------------------------------------------------
Carmelo Murray         12    4    0    1   0   2/3    66.7     0/0   0.0
Shaquille Bane         12    3    2    1   0   1/2    50.0     0/0   0.0
Dirk Johnson           12    2    5    0   0   1/1   100.0     0/0   0.0
Bam Gobert             12    2    2    1   0   1/9    11.1     0/0   0.0
Ayo Rose               12    2    0    0   0   1/3    33.3     0/0   0.0

TEAM: FG: 6/20 (30.0%), 3PT: 0/4 (0.0%), REB: 10 (6 off, 4 def), AST: 3, TO: 2
TEAM FOULS: 5 [Team_097 in BONUS]


Team_097
--------------------------------------------------------------------------------
Player                MIN  PTS  REB  AST  TO      FG   FG%      3P   3P%
--------------------------------------------------------------------------------
Anthony Haliburton     12   12    5    1   0   5/6    83.3     0/0   0.0
Jrue Haliburton        12    9    0    0   0   4/5    80.0     0/0   0.0
Shai Poole             12    4    4    2   0   2/4    50.0     0/0   0.0
Evan Brogdon           12    4    0    0   0   1/1   100.0     0/0   0.0
Tyrese Stewart         12    3    4    4   0   1/1   100.0     0/0   0.0

TEAM: FG: 13/17 (76.5%), 3PT: 3/5 (60.0%), REB: 12 (0 off, 12 def), AST: 7, TO: 5
TEAM FOULS: 8 [Team_040 in BONUS]

================================================================================

================================================================================
                       2ND QUARTER - Team_040 vs Team_097                       
================================================================================

[12:00] Team_040 possession (Score: 18-32)
Carmelo Murray drives, Shai Poole stays with him. Carmelo Murray attempts a Dunk. Contested by Shai Poole (4.0 feet, MAN). CARMELO MURRAY MAKES IT! Assist: Ayo Rose
Score: 20-32

[11:48] Team_097 possession (Score: 20-32)
Anthony Haliburton makes the Layup and draws the foul on Shaquille Bane! And-1! Anthony Haliburton to the line for 1. [Team fouls: 1] (Shaquille Bane: 1 personal fouls)   FT 1/1: GOOD Anthony Haliburton makes 1/1 from the line.
Score: 20-35

[11:33] Team_040 possession (Score: 20-35)
Ayo Rose attempts a Midrange. Contested by Evan Brogdon (5.6 feet, MAN). AYO ROSE MAKES IT! Assist: Dirk Johnson
Score: 22-35

[11:18] Team_097 possession (Score: 22-35)
Evan Brogdon attempts a 3Pt. Contested by Ayo Rose (5.7 feet, MAN). Evan Brogdon misses. Rebound secured by Shaquille Bane.

[11:07] Team_040 possession (Score: 22-35)
Carmelo Murray attempts a Layup. Contested by Shai Poole (4.1 feet, MAN). Carmelo Murray misses. FOUL! Loose ball foul on Tyrese Stewart during the rebound battle. [Team fouls: 1] No free throws, side out. (Tyrese Stewart: 1 personal fouls)

[10:52] Team_040 possession (Score: 22-35)
Carmelo Murray throws a bad pass! Stolen by Shai Poole! TURNOVER! (live ball)

[10:39] Team_097 possession (Score: 22-35)
Jrue Haliburton attempts a Midrange. Wide open! Dirk Johnson is 6.6 feet away. [ZONE] Jrue Haliburton misses. Offensive rebound by Anthony Haliburton! Anthony Haliburton kicks it out.

[10:25] Team_097 possession (Score: 22-35)
Anthony Haliburton attempts a Midrange. Contested by Shaquille Bane (5.5 feet, ZONE). Anthony Haliburton misses. FOUL! Loose ball foul on Shaquille Bane during the rebound battle. [Team fouls: 2] No free throws, side out. (Shaquille Bane: 2 personal fouls)

[10:09] Team_097 possession (Score: 22-35)
Jrue Haliburton makes the Layup and draws the foul on Shaquille Bane! And-1! Jrue Haliburton to the line for 1. [Team fouls: 3] (Shaquille Bane: 3 personal fouls)   FT 1/1: GOOD Jrue Haliburton makes 1/1 from the line.
Score: 22-38

[09:59] Team_040 possession (Score: 22-38)
Dirk Johnson drives and kicks out. Dirk Johnson attempts a 3Pt. Contested by Anthony Haliburton (4.0 feet, MAN). Dirk Johnson misses. FOUL! Loose ball foul on Tyrese Stewart during the rebound battle. [Team fouls: 2] No free throws, side out. (Tyrese Stewart: 2 personal fouls)

[09:40] Team_040 possession (Score: 22-38)
Carmelo Murray makes the Layup and draws the foul on Anthony Haliburton! And-1! Carmelo Murray to the line for 1. [Team fouls: 3] (Anthony Haliburton: 1 personal fouls)   FT 1/1: MISS Carmelo Murray makes 0/1 from the line. Rebound secured by Tyrese Stewart.
Score: 24-38

[09:27] Team_097 possession (Score: 24-38)
Anthony Haliburton attempts a 3Pt. Wide open! Dirk Johnson is 6.7 feet away. [MAN] Anthony Haliburton misses. Rebound secured by Dirk Johnson.

[09:16] Team_040 possession (Score: 24-38)
Ayo Rose attempts a 3Pt. Contested by Shai Poole (4.6 feet, ZONE). AYO ROSE MAKES IT! Assist: Dirk Johnson
Score: 27-38

[09:00] Team_097 possession (Score: 27-38)
Jrue Haliburton attempts a 3Pt. Contested by Shaquille Bane (5.7 feet, MAN). JRUE HALIBURTON MAKES IT! Assist: Evan Brogdon
Score: 27-41

[08:48] Team_040 possession (Score: 27-41)
Carmelo Murray attempts a Layup. Contested by Shai Poole (4.4 feet, MAN). Carmelo Murray misses. Rebound secured by Anthony Haliburton.

[08:37] Team_097 possession (Score: 27-41)
Evan Brogdon attempts a 3Pt. Contested by Ayo Rose (6.0 feet, MAN). Evan Brogdon misses. Rebound secured by Bam Gobert.

[08:24] Team_040 possession (Score: 27-41)
Bam Gobert attempts a Midrange. Wide open! Tyrese Stewart is 6.2 feet away. [MAN] BAM GOBERT MAKES IT!
Score: 29-41

[08:07] Team_097 possession (Score: 29-41)
Jrue Haliburton attempts a Midrange. Contested by Shaquille Bane (5.8 feet, MAN). JRUE HALIBURTON MAKES IT! Assist: Shai Poole
Score: 29-43

[07:55] Team_040 possession (Score: 29-43)
Ayo Rose drives and kicks out. Bam Gobert attempts a Midrange. Wide open! Tyrese Stewart is 6.1 feet away. [MAN] Bam Gobert misses. Rebound secured by Anthony Haliburton.

[07:41] Team_097 possession (Score: 29-43)
Jrue Haliburton attempts a 3Pt. Contested by Ayo Rose (5.9 feet, ZONE). JRUE HALIBURTON MAKES IT! Assist: Anthony Haliburton
Score: 29-46

[07:29] Team_040 possession (Score: 29-46)
Carmelo Murray makes the Layup and draws the foul on Jrue Haliburton! And-1! Carmelo Murray to the line for 1. [Team fouls: 4] (Jrue Haliburton: 1 personal fouls)   FT 1/1: GOOD Carmelo Murray makes 1/1 from the line.
Score: 32-46

[07:17] Team_097 possession (Score: 32-46)
Anthony Haliburton drives, picks up Dirk Johnson. Help arrives from Shaquille Bane! Anthony Haliburton attempts a Dunk. Wide open! Shaquille Bane is 6.9 feet away. [MAN] ANTHONY HALIBURTON MAKES IT!
Score: 32-48

[07:03] Team_040 possession (Score: 32-48)
Ayo Rose attempts a 3Pt. Wide open! Evan Brogdon is 6.1 feet away. [MAN] Ayo Rose misses. Rebound secured by Tyrese Stewart.

[06:50] Team_097 possession (Score: 32-48)
Shai Poole attempts a 3Pt. Wide open! Ayo Rose is 6.1 feet away. [ZONE] SHAI POOLE MAKES IT!
Score: 32-51

[06:39] Team_040 possession (Score: 32-51)
Shaquille Bane throws a bad pass! Stolen by Jrue Haliburton! TURNOVER! (live ball)

[06:27] Team_097 possession (Score: 32-51)
Anthony Haliburton drives to the basket... FOUL! Offensive foul on Anthony Haliburton! Dirk Johnson drew the charge! [Team fouls: 5] (Anthony Haliburton: 2 personal fouls) TURNOVER! (dead ball)

[06:11] Team_040 possession (Score: 32-51)
FOUL! Holding foul on Jrue Haliburton. [IN THE BONUS! 6 team fouls] Shaquille Bane to the line for 2 free throws. (Jrue Haliburton: 2 personal fouls)   FT 1/2: GOOD   FT 2/2: MISS Shaquille Bane makes 1/2 from the line. Offensive rebound by Bam Gobert! Bam Gobert kicks it out.
Score: 33-51

[06:00] Team_040 possession (Score: 33-51)
Carmelo Murray drives and kicks out. Carmelo Murray attempts a 3Pt. Contested by Shai Poole (4.8 feet, ZONE). Carmelo Murray misses. Rebound secured by Tyrese Stewart.

[05:46] Team_097 possession (Score: 33-51)
Evan Brogdon drives and kicks out. Evan Brogdon attempts a 3Pt. Contested by Ayo Rose (6.0 feet, MAN). Evan Brogdon misses. Rebound secured by Bam Gobert.

[05:27] Team_040 possession (Score: 33-51)
Dirk Johnson makes the Dunk and draws the foul on Anthony Haliburton! And-1! Dirk Johnson to the line for 1. [BONUS: 7 team fouls] (Anthony Haliburton: 3 personal fouls)   FT 1/1: GOOD Dirk Johnson makes 1/1 from the line.
Score: 36-51

[05:16] Team_097 possession (Score: 36-51)
Tyrese Stewart attempts a Layup. Contested by Bam Gobert (5.9 feet, MAN). TYRESE STEWART MAKES IT!
Score: 36-53

[05:02] Team_040 possession (Score: 36-53)
FOUL! Holding foul on Anthony Haliburton. [IN THE BONUS! 8 team fouls] Dirk Johnson to the line for 2 free throws. (Anthony Haliburton: 4 personal fouls)   FT 1/2: GOOD   FT 2/2: GOOD Dirk Johnson makes 2/2 from the line.
Score: 38-53

[04:52] Team_097 possession (Score: 38-53)
Jrue Haliburton attempts a Midrange. Wide open! Carmelo Murray is 6.1 feet away. [ZONE] Jrue Haliburton misses. Rebound secured by Dirk Johnson.

[04:40] Team_040 possession (Score: 38-53)
Dirk Johnson attempts a 3Pt. Contested by Shai Poole (5.0 feet, ZONE). Dirk Johnson misses. Rebound secured by Shai Poole.

[04:24] Team_097 possession (Score: 38-53)
Evan Brogdon attempts a 3Pt. Wide open! Ayo Rose is 6.6 feet away. [ZONE] Evan Brogdon misses. Offensive rebound by Anthony Haliburton! Anthony Haliburton kicks it out.

[04:10] Team_097 possession (Score: 38-53)
Evan Brogdon attempts a 3Pt. Wide open! Ayo Rose is 6.6 feet away. [MAN] Evan Brogdon misses. Rebound secured by Bam Gobert.

[03:53] Team_040 possession (Score: 38-53)
Ayo Rose drives, Evan Brogdon stays with him. Ayo Rose attempts a Layup. Wide open! Evan Brogdon is 6.5 feet away. [MAN] AYO ROSE MAKES IT! Assist: Dirk Johnson
Score: 40-53

[03:37] Team_097 possession (Score: 40-53)
Anthony Haliburton attempts a Layup. Wide open! Dirk Johnson is 7.3 feet away. [MAN] Anthony Haliburton misses. Rebound secured by Bam Gobert.

[03:27] Team_040 possession (Score: 40-53)
Carmelo Murray drives, Anthony Haliburton stays with him. Carmelo Murray attempts a Dunk. Contested by Anthony Haliburton (5.3 feet, ZONE). CARMELO MURRAY MAKES IT! Assist: Bam Gobert
Score: 42-53

[03:17] Team_097 possession (Score: 42-53)
Tyrese Stewart attempts a 3Pt. Wide open! Ayo Rose is 6.9 feet away. [ZONE] Tyrese Stewart misses. FOUL! Loose ball foul on Dirk Johnson during the rebound battle. [Team fouls: 4] No free throws, side out. (Dirk Johnson: 1 personal fouls)

[02:58] Team_097 possession (Score: 42-53)
Evan Brogdon attempts a 3Pt. Wide open! Ayo Rose is 6.8 feet away. [MAN] Evan Brogdon misses. Rebound secured by Dirk Johnson.

[02:43] Team_040 possession (Score: 42-53)
Carmelo Murray attempts a 3Pt. Contested by Shai Poole (5.4 feet, MAN). Carmelo Murray misses. Rebound secured by Tyrese Stewart.

[02:29] Team_097 possession (Score: 42-53)
Anthony Haliburton drives to the basket... Anthony Haliburton throws a bad pass out of bounds! TURNOVER! (dead ball)

[02:29] Substitution (Team_040): Ayo Rose OUT → Cole O'Neal IN (stamina_rule2)

[02:29] Substitution (Team_040): Shaquille Bane OUT → Tracy Middleton IN (stamina_rule2)

[02:29] Substitution (Team_040): Carmelo Murray OUT → Klay Leonard IN (stamina_rule2)

[02:29] Substitution (Team_040): Dirk Johnson OUT → RJ Curry IN (stamina_rule2)

[02:29] Substitution (Team_040): Bam Gobert OUT → Josh Banchero IN (stamina_rule2)

[02:29] Substitution (Team_097): Evan Brogdon OUT → Gary Carter IN (stamina_rule2)

[02:29] Substitution (Team_097): Jrue Haliburton OUT → Dwyane Ginobili IN (stamina_rule2)

[02:29] Substitution (Team_097): Shai Poole OUT → Miles Dosunmu IN (stamina_rule2)

[02:29] Substitution (Team_097): Anthony Haliburton OUT → Joel Simons IN (stamina_rule2)

[02:29] Substitution (Team_097): Tyrese Stewart OUT → Miles Banchero IN (stamina_rule2)

[02:15] Team_040 possession (Score: 42-53)
Cole O'Neal attempts a 3Pt. Contested by Gary Carter (4.7 feet, MAN). COLE O'NEAL MAKES IT! Assist: Klay Leonard
Score: 45-53

[02:03] Team_097 possession (Score: 45-53)
Joel Simons attempts a 3Pt. Contested by RJ Curry (5.1 feet, ZONE). Joel Simons misses. Rebound secured by Klay Leonard.

[01:53] Team_040 possession (Score: 45-53)
Klay Leonard attempts a 3Pt. Contested by Joel Simons (3.4 feet, ZONE). Klay Leonard misses. Rebound secured by Miles Banchero.

[01:40] Team_097 possession (Score: 45-53)
FOUL! Shooting foul on Tracy Middleton. Miles Banchero to the line for 2 free throws. [BONUS: 5 team fouls] (Tracy Middleton: 1 personal fouls)   FT 1/2: GOOD   FT 2/2: MISS Miles Banchero makes 1/2 from the line. Rebound secured by RJ Curry.
Score: 45-54

[01:23] Team_040 possession (Score: 45-54)
Klay Leonard attempts a 3Pt. Contested by Miles Dosunmu (3.6 feet, MAN). Klay Leonard misses. Rebound secured by Miles Banchero.

[01:07] Team_097 possession (Score: 45-54)
Dwyane Ginobili attempts a Midrange. Contested by Tracy Middleton (5.7 feet, MAN). DWYANE GINOBILI MAKES IT! Assist: Gary Carter
Score: 45-56

[00:57] Team_040 possession (Score: 45-56)
Tracy Middleton attempts a 3Pt. Contested by Dwyane Ginobili (4.8 feet, MAN). Tracy Middleton misses. Rebound secured by Joel Simons.

[00:43] Team_097 possession (Score: 45-56)
Joel Simons loses the ball! Stripped by RJ Curry! TURNOVER! (live ball)

[00:25] Team_040 possession (Score: 45-56)
RJ Curry drives, Joel Simons stays with him. RJ Curry attempts a Layup. Contested by Joel Simons (3.3 feet, ZONE). RJ CURRY MAKES IT! Assist: Cole O'Neal
Score: 47-56

[00:11] Team_097 possession (Score: 47-56)
FOUL! Shooting foul on Tracy Middleton. Dwyane Ginobili to the line for 2 free throws. [BONUS: 6 team fouls] (Tracy Middleton: 2 personal fouls)   FT 1/2: MISS   FT 2/2: GOOD Dwyane Ginobili makes 1/2 from the line.
Score: 47-57

================================================================================
                              2ND QUARTER COMPLETE                              
================================================================================

2ND QUARTER SCORE: Team_040 29, Team_097 25

BOX SCORE:
================================================================================

Team_040
--------------------------------------------------------------------------------
Player                MIN  PTS  REB  AST  TO      FG   FG%      3P   3P%
--------------------------------------------------------------------------------
Carmelo Murray         22    7    0    0   0   3/7    42.9     0/0   0.0
Ayo Rose               22    7    0    1   0   3/5    60.0     0/0   0.0
Dirk Johnson           22    5    4    3   0   2/3    66.7     0/0   0.0
Cole O'Neal             2    3    0    1   0   1/1   100.0     0/0   0.0
Bam Gobert             22    2    6    1   0   1/1   100.0     0/0   0.0
RJ Curry                2    2    1    0   0   1/1   100.0     0/0   0.0
Shaquille Bane         22    0    1    0   0   0/0     0.0     0/0   0.0
Klay Leonard            2    0    1    1   0   0/2     0.0     0/0   0.0
Tracy Middleton         2    0    0    0   0   0/1     0.0     0/0   0.0

TEAM: FG: 11/21 (52.4%), 3PT: 2/8 (25.0%), REB: 13 (3 off, 10 def), AST: 7, TO: 2
TEAM FOULS: 6 [Team_097 in BONUS]


Team_097
--------------------------------------------------------------------------------
Player                MIN  PTS  REB  AST  TO      FG   FG%      3P   3P%
--------------------------------------------------------------------------------
Jrue Haliburton        22   11    0    0   0   4/5    80.0     0/0   0.0
Anthony Haliburton     22    5    5    1   0   2/4    50.0     0/0   0.0
Shai Poole             22    3    1    1   0   1/1   100.0     0/0   0.0
Dwyane Ginobili         2    3    0    0   0   2/2   100.0     0/0   0.0
Tyrese Stewart         22    2    5    0   0   1/1   100.0     0/0   0.0
Evan Brogdon           22    0    0    1   0   0/5     0.0     0/0   0.0
Joel Simons             2    0    1    0   0   0/1     0.0     0/0   0.0
Miles Banchero          2    0    2    0   0   0/1     0.0     0/0   0.0
Gary Carter             2    0    0    1   0   0/0     0.0     0/0   0.0

TEAM: FG: 10/20 (50.0%), 3PT: 3/9 (33.3%), REB: 14 (4 off, 10 def), AST: 4, TO: 3
TEAM FOULS: 8 [Team_040 in BONUS]

================================================================================

================================================================================
                       3RD QUARTER - Team_040 vs Team_097                       
================================================================================

[12:00] Team_040 possession (Score: 47-57)
Dirk Johnson attempts a 3Pt. Contested by Anthony Haliburton (3.5 feet, MAN). DIRK JOHNSON MAKES IT!
Score: 50-57

[11:44] Team_097 possession (Score: 50-57)
FOUL! Shooting foul on Bam Gobert. Jrue Haliburton to the line for 2 free throws. [Team fouls: 1] (Bam Gobert: 1 personal fouls)   FT 1/2: GOOD   FT 2/2: GOOD Jrue Haliburton makes 2/2 from the line.
Score: 50-59

[11:32] Team_040 possession (Score: 50-59)
Dirk Johnson attempts a 3Pt. Contested by Anthony Haliburton (3.5 feet, ZONE). Dirk Johnson misses. Offensive rebound by Bam Gobert! Bam Gobert kicks it out.

[11:21] Team_040 possession (Score: 50-59)
Ayo Rose attempts a 3Pt. Contested by Evan Brogdon (5.3 feet, MAN). Ayo Rose misses. Rebound secured by Tyrese Stewart.

[11:08] Team_097 possession (Score: 50-59)
Shai Poole attempts a Layup. Contested by Carmelo Murray (5.0 feet, MAN). SHAI POOLE MAKES IT! Assist: Anthony Haliburton
Score: 50-61

[10:54] Team_040 possession (Score: 50-61)
FOUL! Holding foul on Evan Brogdon. [Team fouls: 1] No free throws, side out. (Evan Brogdon: 1 personal fouls)

[10:41] Team_040 possession (Score: 50-61)
Carmelo Murray attempts a 3Pt. Contested by Shai Poole (3.7 feet, MAN). Carmelo Murray misses. Rebound secured by Tyrese Stewart.

[10:29] Team_097 possession (Score: 50-61)
Tyrese Stewart attempts a Midrange. Contested by Bam Gobert (4.8 feet, MAN). Tyrese Stewart misses. Rebound secured by Dirk Johnson.

[10:12] Team_040 possession (Score: 50-61)
FOUL! Shooting foul on Anthony Haliburton. Bam Gobert to the line for 2 free throws. [Team fouls: 2] (Anthony Haliburton: 1 personal fouls)   FT 1/2: GOOD   FT 2/2: GOOD Bam Gobert makes 2/2 from the line.
Score: 52-61

[09:59] Team_097 possession (Score: 52-61)
Jrue Haliburton attempts a Midrange. Contested by Carmelo Murray (4.9 feet, ZONE). JRUE HALIBURTON MAKES IT!
Score: 52-63

[09:40] Team_040 possession (Score: 52-63)
Dirk Johnson drives, Anthony Haliburton stays with him. Dirk Johnson attempts a Layup. Contested by Anthony Haliburton (3.5 feet, MAN). DIRK JOHNSON MAKES IT! Assist: Shaquille Bane
Score: 54-63

[09:27] Team_097 possession (Score: 54-63)
FOUL! Holding foul on Ayo Rose. [Team fouls: 2] No free throws, side out. (Ayo Rose: 1 personal fouls)

[09:14] Team_097 possession (Score: 54-63)
Anthony Haliburton attempts a Layup. Wide open! Dirk Johnson is 6.3 feet away. [MAN] ANTHONY HALIBURTON MAKES IT! Assist: Jrue Haliburton
Score: 54-65

[09:02] Team_040 possession (Score: 54-65)
Dirk Johnson attempts a 3Pt. Contested by Anthony Haliburton (3.5 feet, MAN). Dirk Johnson misses. Rebound secured by Anthony Haliburton.

[08:50] Team_097 possession (Score: 54-65)
Evan Brogdon attempts a 3Pt. Contested by Ayo Rose (5.3 feet, MAN). EVAN BROGDON MAKES IT! Assist: Tyrese Stewart
Score: 54-68

[08:35] Team_040 possession (Score: 54-68)
Dirk Johnson attempts a Layup. Contested by Anthony Haliburton (3.5 feet, ZONE). Dirk Johnson misses. Rebound secured by Shai Poole.

[08:24] Team_097 possession (Score: 54-68)
Shai Poole attempts a 3Pt. Contested by Shaquille Bane (5.2 feet, ZONE). Shai Poole misses. Rebound secured by Shaquille Bane.

[08:10] Team_040 possession (Score: 54-68)
Bam Gobert drives, Anthony Haliburton stays with him. Bam Gobert attempts a Layup. Contested by Anthony Haliburton (3.6 feet, MAN). BAM GOBERT MAKES IT! Assist: Ayo Rose
Score: 56-68

[07:58] Team_097 possession (Score: 56-68)
Evan Brogdon throws a bad pass out of bounds! TURNOVER! (dead ball)

[07:42] Team_040 possession (Score: 56-68)
Ayo Rose attempts a 3Pt. Contested by Shai Poole (4.0 feet, ZONE). Ayo Rose misses. Rebound secured by Shai Poole.

[07:30] Team_097 possession (Score: 56-68)
Anthony Haliburton drives to the basket... Anthony Haliburton throws a bad pass out of bounds! TURNOVER! (dead ball)

[07:15] Team_040 possession (Score: 56-68)
Bam Gobert attempts a 3Pt. Contested by Shai Poole (3.7 feet, ZONE). Bam Gobert misses. Rebound secured by Tyrese Stewart.

[06:59] Team_097 possession (Score: 56-68)
Jrue Haliburton attempts a 3Pt. Contested by Shaquille Bane (5.1 feet, MAN). Jrue Haliburton misses. Offensive rebound by Anthony Haliburton! Anthony Haliburton's putback is no good. Rebound secured by Shaquille Bane.

[06:45] Team_040 possession (Score: 56-68)
Carmelo Murray attempts a Midrange. Contested by Shai Poole (3.7 feet, MAN). Carmelo Murray misses. Offensive rebound by Bam Gobert! Bam Gobert kicks it out.

[06:33] Team_040 possession (Score: 56-68)
Carmelo Murray drives, Shai Poole stays with him. Carmelo Murray attempts a Layup. Contested by Shai Poole (3.7 feet, MAN). CARMELO MURRAY MAKES IT!
Score: 58-68

[06:20] Team_097 possession (Score: 58-68)
Shai Poole attempts a 3Pt. Contested by Ayo Rose (5.2 feet, ZONE). SHAI POOLE MAKES IT! Assist: Evan Brogdon
Score: 58-71

[06:06] Team_040 possession (Score: 58-71)
Shaquille Bane attempts a 3Pt. Contested by Anthony Haliburton (3.8 feet, ZONE). Shaquille Bane misses. Rebound secured by Anthony Haliburton.

[05:49] Team_097 possession (Score: 58-71)
FOUL! Holding foul on Bam Gobert. [Team fouls: 3] No free throws, side out. (Bam Gobert: 2 personal fouls)

[05:31] Team_097 possession (Score: 58-71)
Anthony Haliburton attempts a 3Pt. Contested by Ayo Rose (5.1 feet, ZONE). Anthony Haliburton misses. Rebound secured by Dirk Johnson.

[05:17] Team_040 possession (Score: 58-71)
Ayo Rose attempts a 3Pt. Contested by Shai Poole (4.0 feet, ZONE). AYO ROSE MAKES IT! Assist: Dirk Johnson
Score: 61-71

[05:07] Team_097 possession (Score: 61-71)
Shai Poole throws a bad pass out of bounds! TURNOVER! (dead ball)

[04:47] Team_040 possession (Score: 61-71)
Bam Gobert drives, picks up Anthony Haliburton. Help arrives from Jrue Haliburton! Bam Gobert attempts a Dunk. Contested by Jrue Haliburton (3.6 feet, MAN). BAM GOBERT MAKES IT! Assist: Ayo Rose
Score: 63-71

[04:30] Team_097 possession (Score: 63-71)
Tyrese Stewart throws a bad pass! Stolen by Bam Gobert! TURNOVER! (live ball)

[04:19] Team_040 possession (Score: 63-71)
Bam Gobert attempts a 3Pt. Contested by Shai Poole (3.7 feet, ZONE). Bam Gobert misses. FOUL! Loose ball foul on Anthony Haliburton during the rebound battle. [Team fouls: 3] No free throws, side out. (Anthony Haliburton: 2 personal fouls)

[04:02] Team_040 possession (Score: 63-71)
Bam Gobert drives to the basket... Bam Gobert throws a bad pass! Stolen by Anthony Haliburton! TURNOVER! (live ball)

[03:46] Team_097 possession (Score: 63-71)
FOUL! Shooting foul on Bam Gobert. Tyrese Stewart to the line for 2 free throws. [Team fouls: 4] (Bam Gobert: 3 personal fouls)   FT 1/2: GOOD   FT 2/2: GOOD Tyrese Stewart makes 2/2 from the line.
Score: 63-73

[03:33] Team_040 possession (Score: 63-73)
Bam Gobert attempts a Layup. Contested by Anthony Haliburton (3.7 feet, ZONE). BAM GOBERT MAKES IT!
Score: 65-73

[03:19] Team_097 possession (Score: 65-73)
Jrue Haliburton attempts a 3Pt. Contested by Shaquille Bane (5.3 feet, MAN). JRUE HALIBURTON MAKES IT! Assist: Anthony Haliburton
Score: 65-76

[03:02] Team_040 possession (Score: 65-76)
Shaquille Bane drives to the basket... Shaquille Bane loses the ball! Stripped by Jrue Haliburton! TURNOVER! (live ball)

[02:53] Team_097 possession (Score: 65-76)
Anthony Haliburton attempts a Midrange. Wide open! Dirk Johnson is 6.5 feet away. [MAN] ANTHONY HALIBURTON MAKES IT!
Score: 65-78

[02:38] Team_040 possession (Score: 65-78)
Ayo Rose throws a bad pass out of bounds! TURNOVER! (dead ball)

[02:38] Substitution (Team_040): Ayo Rose OUT → Cole O'Neal IN (stamina_rule2)

[02:38] Substitution (Team_040): Shaquille Bane OUT → Tracy Middleton IN (stamina_rule2)

[02:38] Substitution (Team_040): Carmelo Murray OUT → Klay Leonard IN (stamina_rule2)

[02:38] Substitution (Team_040): Dirk Johnson OUT → RJ Curry IN (stamina_rule2)

[02:38] Substitution (Team_040): Bam Gobert OUT → Josh Banchero IN (stamina_rule2)

[02:38] Substitution (Team_097): Evan Brogdon OUT → Gary Carter IN (stamina_rule2)

[02:38] Substitution (Team_097): Shai Poole OUT → Miles Dosunmu IN (stamina_rule2)

[02:38] Substitution (Team_097): Anthony Haliburton OUT → Joel Simons IN (stamina_rule2)

[02:38] Substitution (Team_097): Tyrese Stewart OUT → Miles Banchero IN (stamina_rule2)

[02:21] Team_097 possession (Score: 65-78)
Jrue Haliburton attempts a 3Pt. Contested by RJ Curry (5.3 feet, ZONE). Jrue Haliburton misses. Rebound secured by Klay Leonard.

[02:06] Team_040 possession (Score: 65-78)
FOUL! Reach-in foul on Joel Simons during the drive. [Team fouls: 4] No free throws, side out. (Joel Simons: 1 personal fouls)

[01:54] Team_040 possession (Score: 65-78)
Josh Banchero throws a bad pass! Stolen by Joel Simons! TURNOVER! (live ball)

[01:40] Team_097 possession (Score: 65-78)
FOUL! Shooting foul on Klay Leonard. Miles Dosunmu to the line for 2 free throws. [BONUS: 5 team fouls] (Klay Leonard: 1 personal fouls)   FT 1/2: GOOD   FT 2/2: GOOD Miles Dosunmu makes 2/2 from the line.
Score: 65-80

[01:24] Team_040 possession (Score: 65-80)
Klay Leonard drives, picks up Miles Dosunmu. Help arrives from Gary Carter! Klay Leonard attempts a Layup. Contested by Gary Carter (3.6 feet, MAN). Klay Leonard misses. Rebound secured by Miles Banchero.

[01:08] Team_097 possession (Score: 65-80)
Gary Carter attempts a 3Pt. Contested by RJ Curry (4.7 feet, ZONE). Gary Carter misses. Rebound secured by Josh Banchero.

[00:57] Team_040 possession (Score: 65-80)
Klay Leonard drives and kicks out. Cole O'Neal attempts a Midrange. Contested by Gary Carter (4.7 feet, MAN). Cole O'Neal misses. Rebound secured by Miles Banchero.

[00:45] Team_097 possession (Score: 65-80)
Miles Banchero attempts a Layup. Contested by Josh Banchero (6.0 feet, MAN). MILES BANCHERO MAKES IT!
Score: 65-82

[00:32] Team_040 possession (Score: 65-82)
Cole O'Neal attempts a 3Pt. Contested by Gary Carter (4.7 feet, MAN). Cole O'Neal misses. Rebound secured by Miles Dosunmu.

[00:21] Team_097 possession (Score: 65-82)
Joel Simons attempts a Midrange. Contested by RJ Curry (5.1 feet, MAN). Joel Simons misses. Rebound secured by RJ Curry.

[00:10] Team_040 possession (Score: 65-82)
Klay Leonard commits a violation (traveling/carry)! TURNOVER! (dead ball)

[00:10] Substitution (Team_097): Jrue Haliburton OUT → Dwyane Ginobili IN (stamina_rule2)

================================================================================
                              3RD QUARTER COMPLETE                              
================================================================================

3RD QUARTER SCORE: Team_040 18, Team_097 25

BOX SCORE:
================================================================================

Team_040
--------------------------------------------------------------------------------
Player                MIN  PTS  REB  AST  TO      FG   FG%      3P   3P%
--------------------------------------------------------------------------------
Bam Gobert             31    8    3    0   0   4/5    80.0     0/0   0.0
Dirk Johnson           31    5    2    1   0   2/4    50.0     0/0   0.0
Ayo Rose               31    3    0    2   0   1/3    33.3     0/0   0.0
Carmelo Murray         31    2    0    0   0   1/2    50.0     0/0   0.0
Shaquille Bane         31    0    2    1   0   0/1     0.0     0/0   0.0
Klay Leonard            5    0    1    0   0   0/2     0.0     0/0   0.0
Josh Banchero           5    0    1    0   0   0/0     0.0     0/0   0.0
Cole O'Neal             5    0    0    0   0   0/1     0.0     0/0   0.0
RJ Curry                5    0    1    0   0   0/0     0.0     0/0   0.0

TEAM: FG: 8/18 (44.4%), 3PT: 2/9 (22.2%), REB: 9 (3 off, 6 def), AST: 4, TO: 5
TEAM FOULS: 5 [Team_097 in BONUS]


Team_097
--------------------------------------------------------------------------------
Player                MIN  PTS  REB  AST  TO      FG   FG%      3P   3P%
--------------------------------------------------------------------------------
Jrue Haliburton        34    7    0    1   0   3/5    60.0     0/0   0.0
Shai Poole             31    5    2    0   0   2/3    66.7     0/0   0.0
Anthony Haliburton     31    4    2    2   0   2/3    66.7     0/0   0.0
Evan Brogdon           31    3    0    1   0   1/1   100.0     0/0   0.0
Tyrese Stewart         31    2    3    1   0   1/2    50.0     0/0   0.0
Miles Dosunmu           5    2    1    0   0   1/1   100.0     0/0   0.0
Miles Banchero          5    2    2    0   0   1/1   100.0     0/0   0.0
Gary Carter             5    0    0    0   0   0/1     0.0     0/0   0.0
Joel Simons             5    0    0    0   0   0/1     0.0     0/0   0.0

TEAM: FG: 11/18 (61.1%), 3PT: 3/8 (37.5%), REB: 11 (1 off, 10 def), AST: 5, TO: 4
TEAM FOULS: 4

================================================================================

================================================================================
                       4TH QUARTER - Team_040 vs Team_097                       
================================================================================

[12:00] Substitution (Team_040): Ayo Rose OUT (stamina: 78) → Cole O'Neal IN (comeback_detected)

[12:00] Substitution (Team_097): Evan Brogdon OUT (stamina: 79) → Gary Carter IN (comeback_detected)

[12:00] Team_040 possession (Score: 65-82)
Bam Gobert attempts a Layup. Contested by Anthony Haliburton (3.6 feet, ZONE). BAM GOBERT MAKES IT! Assist: Cole O'Neal
Score: 67-82

[11:49] Team_097 possession (Score: 67-82)
Jrue Haliburton attempts a 3Pt. Wide open! Dirk Johnson is 6.3 feet away. [ZONE] Jrue Haliburton misses. Rebound secured by Bam Gobert.

[11:39] Team_040 possession (Score: 67-82)
FOUL! Holding foul on Gary Carter. [Team fouls: 1] No free throws, side out. (Gary Carter: 1 personal fouls)

[11:26] Team_040 possession (Score: 67-82)
Bam Gobert attempts a Layup. Contested by Anthony Haliburton (3.6 feet, MAN). BAM GOBERT MAKES IT!
Score: 69-82

[11:11] Team_097 possession (Score: 69-82)
FOUL! Reach-in foul on Bam Gobert during the drive. [Team fouls: 1] No free throws, side out. (Bam Gobert: 1 personal fouls)

[10:54] Team_097 possession (Score: 69-82)
Jrue Haliburton attempts a Midrange. Contested by Carmelo Murray (4.9 feet, ZONE). Jrue Haliburton misses. Rebound secured by Dirk Johnson.

[10:42] Team_040 possession (Score: 69-82)
Cole O'Neal drives and kicks out. Cole O'Neal attempts a Midrange. Contested by Anthony Haliburton (3.4 feet, ZONE). COLE O'NEAL MAKES IT!
Score: 71-82

[10:25] Team_097 possession (Score: 71-82)
Gary Carter attempts a Layup. Wide open! Cole O'Neal is 6.3 feet away. [MAN] GARY CARTER MAKES IT! Assist: Jrue Haliburton
Score: 71-84

[10:10] Team_040 possession (Score: 71-84)
Dirk Johnson attempts a 3Pt. Contested by Shai Poole (3.7 feet, ZONE). Dirk Johnson misses. Rebound secured by Tyrese Stewart.

[09:59] Team_097 possession (Score: 71-84)
Anthony Haliburton throws a bad pass out of bounds! TURNOVER! (dead ball)

[09:59] Substitution (Team_097): Jrue Haliburton OUT → Dwyane Ginobili IN (stamina_rule2)

[09:48] Team_040 possession (Score: 71-84)
Bam Gobert makes the Layup and draws the foul on Dwyane Ginobili! And-1! Bam Gobert to the line for 1. [Team fouls: 2] (Dwyane Ginobili: 1 personal fouls)   FT 1/1: MISS Bam Gobert makes 0/1 from the line. Rebound secured by Dwyane Ginobili.
Score: 73-84

[09:32] Team_097 possession (Score: 73-84)
Dwyane Ginobili attempts a 3Pt. Contested by Shaquille Bane (4.7 feet, ZONE). Dwyane Ginobili misses. FOUL! Loose ball foul on Dirk Johnson during the rebound battle. [Team fouls: 2] No free throws, side out. (Dirk Johnson: 1 personal fouls)

[09:19] Team_097 possession (Score: 73-84)
Shai Poole drives to the basket... FOUL! Offensive foul on Shai Poole! Bam Gobert drew the charge! [Team fouls: 3] (Shai Poole: 1 personal fouls) TURNOVER! (dead ball)

[09:01] Team_040 possession (Score: 73-84)
Shaquille Bane attempts a 3Pt. Contested by Gary Carter (5.1 feet, ZONE). SHAQUILLE BANE MAKES IT! Assist: Bam Gobert
Score: 76-84

[08:43] Team_097 possession (Score: 76-84)
Tyrese Stewart drives to the basket... Tyrese Stewart throws a bad pass! Stolen by Dirk Johnson! TURNOVER! (live ball)

[08:29] Team_040 possession (Score: 76-84)
FOUL! Holding foul on Gary Carter. [Team fouls: 4] No free throws, side out. (Gary Carter: 2 personal fouls)

[08:14] Team_040 possession (Score: 76-84)
FOUL! Shooting foul on Tyrese Stewart. Carmelo Murray to the line for 2 free throws. [BONUS: 5 team fouls] (Tyrese Stewart: 1 personal fouls)   FT 1/2: GOOD   FT 2/2: GOOD Carmelo Murray makes 2/2 from the line.
Score: 78-84

[08:02] Team_097 possession (Score: 78-84)
Gary Carter attempts a Layup. Wide open! Cole O'Neal is 6.3 feet away. [MAN] GARY CARTER MAKES IT! Assist: Tyrese Stewart
Score: 78-86

[07:52] Team_040 possession (Score: 78-86)
Cole O'Neal attempts a 3Pt. Contested by Dwyane Ginobili (4.6 feet, ZONE). COLE O'NEAL MAKES IT! Assist: Shaquille Bane
Score: 81-86

[07:36] Team_097 possession (Score: 81-86)
Dwyane Ginobili attempts a 3Pt. Wide open! Dirk Johnson is 6.1 feet away. [ZONE] DWYANE GINOBILI MAKES IT! Assist: Shai Poole
Score: 81-89

[07:26] Team_040 possession (Score: 81-89)
Bam Gobert makes the Layup and draws the foul on Anthony Haliburton! And-1! Bam Gobert to the line for 1. [BONUS: 6 team fouls] (Anthony Haliburton: 1 personal fouls)   FT 1/1: GOOD Bam Gobert makes 1/1 from the line.
Score: 84-89

[07:12] Team_097 possession (Score: 84-89)
Shai Poole attempts a Midrange. Contested by Carmelo Murray (5.4 feet, MAN). SHAI POOLE MAKES IT!
Score: 84-91

[06:58] Team_040 possession (Score: 84-91)
Dirk Johnson drives and kicks out. FOUL! Shooting foul on Dwyane Ginobili. Dirk Johnson to the line for 3 free throws. [BONUS: 7 team fouls] (Dwyane Ginobili: 2 personal fouls)   FT 1/3: GOOD   FT 2/3: GOOD   FT 3/3: MISS Dirk Johnson makes 2/3 from the line. Offensive rebound by Bam Gobert! Bam Gobert kicks it out.
Score: 86-91

[06:44] Team_040 possession (Score: 86-91)
Cole O'Neal drives, Anthony Haliburton stays with him. Cole O'Neal attempts a Layup. Contested by Anthony Haliburton (4.0 feet, ZONE). Cole O'Neal misses. Rebound secured by Anthony Haliburton.

[06:30] Team_097 possession (Score: 86-91)
Tyrese Stewart drives to the basket... Tyrese Stewart throws a bad pass! Stolen by Bam Gobert! TURNOVER! (live ball)

[06:17] Team_040 possession (Score: 86-91)
Bam Gobert attempts a Midrange. Contested by Shai Poole (4.3 feet, ZONE). Bam Gobert misses. Rebound secured by Dwyane Ginobili.

[06:04] Team_097 possession (Score: 86-91)
Shai Poole attempts a Midrange. Contested by Carmelo Murray (5.6 feet, ZONE). SHAI POOLE MAKES IT!
Score: 86-93

[05:50] Team_040 possession (Score: 86-93)
FOUL! Shooting foul on Anthony Haliburton. Cole O'Neal to the line for 2 free throws. [BONUS: 8 team fouls] (Anthony Haliburton: 2 personal fouls)   FT 1/2: MISS   FT 2/2: GOOD Cole O'Neal makes 1/2 from the line.
Score: 87-93

[05:37] Team_097 possession (Score: 87-93)
Dwyane Ginobili attempts a Midrange. Wide open! Dirk Johnson is 6.4 feet away. [ZONE] DWYANE GINOBILI MAKES IT!
Score: 87-95

[05:18] Team_040 possession (Score: 87-95)
FOUL! Offensive foul on Bam Gobert! Tyrese Stewart drew the charge! [Team fouls: 3] (Bam Gobert: 2 personal fouls) TURNOVER! (dead ball)

[05:03] Team_097 possession (Score: 87-95)
FOUL! Shooting foul on Shaquille Bane. Dwyane Ginobili to the line for 2 free throws. [Team fouls: 4] (Shaquille Bane: 1 personal fouls)   FT 1/2: GOOD   FT 2/2: GOOD Dwyane Ginobili makes 2/2 from the line.
Score: 87-97

[04:48] Team_040 possession (Score: 87-97)
Bam Gobert attempts a Midrange. Contested by Anthony Haliburton (4.5 feet, ZONE). Bam Gobert misses. Rebound secured by Tyrese Stewart.

[04:37] Team_097 possession (Score: 87-97)
Tyrese Stewart drives, picks up Bam Gobert. Help arrives from Shaquille Bane! Tyrese Stewart attempts a Dunk. Contested by Shaquille Bane (5.5 feet, MAN). TYRESE STEWART MAKES IT!
Score: 87-99

[04:18] Team_040 possession (Score: 87-99)
Cole O'Neal attempts a 3Pt. Contested by Gary Carter (4.9 feet, MAN). Cole O'Neal misses. Rebound secured by Dwyane Ginobili.

[04:03] Team_097 possession (Score: 87-99)
Dwyane Ginobili attempts a Midrange. Contested by Shaquille Bane (5.5 feet, MAN). Dwyane Ginobili misses. Rebound secured by Shaquille Bane.

[03:46] Team_040 possession (Score: 87-99)
Bam Gobert attempts a Layup. Wide open! Tyrese Stewart is 6.3 feet away. [MAN] BAM GOBERT MAKES IT! Assist: Cole O'Neal
Score: 89-99

[03:33] Team_097 possession (Score: 89-99)
Tyrese Stewart attempts a 3Pt. Contested by Bam Gobert (5.6 feet, MAN). Tyrese Stewart misses. Offensive rebound by Tyrese Stewart! Tyrese Stewart kicks it out.

[03:18] Team_097 possession (Score: 89-99)
Gary Carter attempts a Layup. BLOCKED BY BAM GOBERT! Ball goes out off Bam Gobert. Gary Carter's ball!

[02:59] Team_097 possession (Score: 89-99)
Tyrese Stewart drives to the basket... Tyrese Stewart throws a bad pass out of bounds! TURNOVER! (dead ball)

[02:59] Substitution (Team_040): Shaquille Bane OUT → Tracy Middleton IN (stamina_rule2)

[02:59] Substitution (Team_040): Carmelo Murray OUT → Klay Leonard IN (stamina_rule2)

[02:59] Substitution (Team_040): Dirk Johnson OUT → RJ Curry IN (stamina_rule2)

[02:59] Substitution (Team_040): Bam Gobert OUT → Josh Banchero IN (stamina_rule2)

[02:59] Substitution (Team_097): Shai Poole OUT → Miles Dosunmu IN (stamina_rule2)

[02:59] Substitution (Team_097): Anthony Haliburton OUT → Joel Simons IN (stamina_rule2)

[02:59] Substitution (Team_097): Tyrese Stewart OUT → Miles Banchero IN (stamina_rule2)

[02:59] Substitution (Team_097): Gary Carter OUT → Evan Brogdon IN (starter_return_rule1)

[02:45] Team_040 possession (Score: 89-99)
Cole O'Neal attempts a 3Pt. Contested by Evan Brogdon (4.6 feet, MAN). Cole O'Neal misses. FOUL! Loose ball foul on Miles Dosunmu during the rebound battle. [IN THE BONUS! 9 team fouls] RJ Curry to the line for 2 free throws. (Miles Dosunmu: 1 personal fouls)   FT 1/2: GOOD   FT 2/2: GOOD RJ Curry makes 2/2 from the line.
Score: 91-99

[02:30] Team_097 possession (Score: 91-99)
Miles Banchero drives to the basket... Miles Banchero loses the ball! Stripped by Josh Banchero! TURNOVER! (live ball)

[02:19] Team_040 possession (Score: 91-99)
FOUL! Reach-in foul on Joel Simons during the drive. [IN THE BONUS! 10 team fouls] Klay Leonard to the line for 2 free throws. (Joel Simons: 1 personal fouls)   FT 1/2: GOOD   FT 2/2: GOOD Klay Leonard makes 2/2 from the line.
Score: 93-99

[02:00] Team_097 possession (Score: 93-99)
Dwyane Ginobili attempts a 3Pt. Contested by RJ Curry (4.7 feet, ZONE). Dwyane Ginobili misses. Rebound secured by Klay Leonard.

[01:44] Team_040 possession (Score: 93-99)
RJ Curry attempts a Layup. Contested by Joel Simons (3.3 feet, ZONE). RJ Curry misses. Offensive rebound by Josh Banchero! Josh Banchero kicks it out.

[01:30] Team_040 possession (Score: 93-99)
RJ Curry throws a bad pass! Stolen by Joel Simons! TURNOVER! (live ball)

[01:19] Team_097 possession (Score: 93-99)
FOUL! Holding foul on Tracy Middleton. [IN THE BONUS! 5 team fouls] Dwyane Ginobili to the line for 2 free throws. (Tracy Middleton: 1 personal fouls)   FT 1/2: GOOD   FT 2/2: GOOD Dwyane Ginobili makes 2/2 from the line.
Score: 93-101

[01:08] Team_040 possession (Score: 93-101)
FOUL! Holding foul on Joel Simons. [IN THE BONUS! 11 team fouls] RJ Curry to the line for 2 free throws. (Joel Simons: 2 personal fouls)   FT 1/2: GOOD   FT 2/2: GOOD RJ Curry makes 2/2 from the line.
Score: 95-101

[00:55] Team_097 possession (Score: 95-101)
Dwyane Ginobili attempts a 3Pt. Contested by Tracy Middleton (5.7 feet, MAN). Dwyane Ginobili misses. Offensive rebound by Joel Simons! Joel Simons kicks it out.

[00:39] Team_097 possession (Score: 95-101)
Joel Simons attempts a Midrange. Contested by RJ Curry (5.1 feet, ZONE). JOEL SIMONS MAKES IT!
Score: 95-103

[00:24] Team_040 possession (Score: 95-103)
FOUL! Shooting foul on Joel Simons. Josh Banchero to the line for 2 free throws. [BONUS: 12 team fouls] (Joel Simons: 3 personal fouls)   FT 1/2: GOOD   FT 2/2: GOOD Josh Banchero makes 2/2 from the line.
Score: 97-103

[00:06] Team_097 possession (Score: 97-103)
Dwyane Ginobili loses control! Ball rolls out of bounds! TURNOVER! (dead ball)

[00:06] Substitution (Team_040): Cole O'Neal OUT → Ayo Rose IN (starter_return_rule1)

================================================================================
                              4TH QUARTER COMPLETE                              
================================================================================

4TH QUARTER SCORE: Team_040 32, Team_097 21

BOX SCORE:
================================================================================

Team_040
--------------------------------------------------------------------------------
Player                MIN  PTS  REB  AST  TO      FG   FG%      3P   3P%
--------------------------------------------------------------------------------
Bam Gobert             41    9    2    1   0   4/7    57.1     0/0   0.0
Cole O'Neal            17    6    0    2   0   3/5    60.0     0/0   0.0
RJ Curry                8    4    0    0   0   2/2   100.0     0/0   0.0
Shaquille Bane         41    3    1    1   0   1/1   100.0     0/0   0.0
Carmelo Murray         41    2    0    0   0   1/1   100.0     0/0   0.0
Klay Leonard            8    2    1    0   0   1/1   100.0     0/0   0.0
Josh Banchero           8    2    1    0   0   1/1   100.0     0/0   0.0
Dirk Johnson           41    0    1    0   0   0/1     0.0     0/0   0.0

TEAM: FG: 13/19 (68.4%), 3PT: 3/5 (60.0%), REB: 6 (2 off, 4 def), AST: 4, TO: 2
TEAM FOULS: 5 [Team_097 in BONUS]


Team_097
--------------------------------------------------------------------------------
Player                MIN  PTS  REB  AST  TO      FG   FG%      3P   3P%
--------------------------------------------------------------------------------
Dwyane Ginobili        12    9    3    0   0   4/6    66.7     0/0   0.0
Gary Carter            14    4    0    0   0   2/2   100.0     0/0   0.0
Shai Poole             41    4    0    1   0   2/2   100.0     0/0   0.0
Tyrese Stewart         41    2    4    1   0   1/1   100.0     0/0   0.0
Joel Simons             8    2    1    0   0   1/1   100.0     0/0   0.0
Jrue Haliburton        36    0    0    1   0   0/2     0.0     0/0   0.0
Anthony Haliburton     41    0    1    0   0   0/0     0.0     0/0   0.0

TEAM: FG: 10/14 (71.4%), 3PT: 1/3 (33.3%), REB: 9 (3 off, 6 def), AST: 3, TO: 7
TEAM FOULS: 12 [Team_040 in BONUS]

================================================================================

================================================================================
                               FULL GAME COMPLETE                               
================================================================================

FINAL SCORE: Team_040 97, Team_097 103

SCORING BY QUARTER:
--------------------------------------------------------------------------------
Team                     Q1     Q2     Q3     Q4    FINAL
--------------------------------------------------------------------------------
Team_040                 18     29     18     32       97
Team_097                 32     25     25     21      103
--------------------------------------------------------------------------------

FULL GAME BOX SCORE:
================================================================================

Team_040
--------------------------------------------------------------------------------
Player                MIN  PTS  REB  AST  TO      FG   FG%      3P   3P%      FT STL BLK
--------------------------------------------------------------------------------
Shaquille Bane         41    6    6    3   2   2/4    50.0   1/2    50.0   4/7     0   0
Carmelo Murray         41   15    0    1   2   7/13   53.8   0/3     0.0   3/4     0   0
Dirk Johnson           41   12   12    4   0   4/8    50.0   1/4    25.0   5/7     2   0
Bam Gobert             41   21   13    3   2  10/22   45.5   0/2     0.0   4/6     4   1
Ayo Rose               31   12    0    3   2   5/11   45.5   2/7    28.6   0/0     0   0
Cole O'Neal            17    9    0    3   0   5/8    62.5   3/5    60.0   1/2     0   0
Tracy Middleton         8    0    0    0   0   0/1     0.0   0/1     0.0   0/0     0   0
Klay Leonard            8    2    3    1   1   1/5    20.0   0/2     0.0   2/2     0   0
RJ Curry                8    6    2    0   1   1/1   100.0   0/0     0.0   4/4     1   0
Josh Banchero           8    2    2    0   1   1/1   100.0   0/0     0.0   2/2     1   0

TEAM: FG: 38/78 (48.7%), 3PT: 7/26 (26.9%), REB: 38 (14 off, 24 def), AST: 18, TO: 11


Team_097
--------------------------------------------------------------------------------
Player                MIN  PTS  REB  AST  TO      FG   FG%      3P   3P%      FT STL BLK
--------------------------------------------------------------------------------
Shai Poole             41   16    7    4   5   7/10   70.0   2/4    50.0   0/0     1   0
Anthony Haliburton     41   21   13    4   1   9/13   69.2   1/3    33.3   2/2     2   2
Tyrese Stewart         41    9   16    6   5   4/5    80.0   0/0     0.0   3/3     0   0
Jrue Haliburton        36   27    0    2   1  11/17   64.7   4/8    50.0   5/5     2   0
Evan Brogdon           34    7    0    2   2   2/7    28.6   2/6    33.3   1/1     0   0
Gary Carter            14    4    0    1   1   2/3    66.7   0/1     0.0   0/0     0   0
Dwyane Ginobili        12   12    3    0   2   5/7    71.4   1/2    50.0   5/6     0   0
Miles Dosunmu           8    2    1    0   0   1/1   100.0   0/0     0.0   2/2     0   0
Joel Simons             8    2    2    0   2   1/3    33.3   0/1     0.0   0/0     2   0
Miles Banchero          8    2    4    0   0   1/2    50.0   0/0     0.0   1/2     0   0

TEAM: FG: 44/69 (63.8%), 3PT: 10/25 (40.0%), REB: 46 (8 off, 38 def), AST: 19, TO: 19

================================================================================
