================================================================================
                        FULL GAME - Team_003 vs Team_023                        
================================================================================

================================================================================
                       1ST QUARTER - Team_003 vs Team_023                       
================================================================================

[12:00] Team_003 possession (Score: 0-0)
Giannis Turner drives to the basket... Giannis Turner loses control! Ball rolls out of bounds! TURNOVER! (dead ball)

[11:49] Team_023 possession (Score: 0-0)
Trae Ingram drives and kicks out. Collin Ginobili makes the Midrange and draws the foul on Ayo Jackson! And-1! Collin Ginobili to the line for 1. [Team fouls: 1] (Ayo Jackson: 1 personal fouls)   FT 1/1: GOOD Collin Ginobili makes 1/1 from the line.
Score: 0-3

[11:33] Team_003 possession (Score: 0-3)
Rudy Haliburton attempts a Midrange. Contested by Kyle Paul (2.9 feet, MAN). RUDY HALIBURTON MAKES IT! Assist: Ayo Jackson
Score: 2-3

[11:16] Team_023 possession (Score: 2-3)
Kyle Paul attempts a 3Pt. Contested by Giannis Turner (3.1 feet, ZONE). Kyle Paul misses. FOUL! Loose ball foul on Rudy Haliburton during the rebound battle. [Team fouls: 2] No free throws, side out. (Rudy Haliburton: 1 personal fouls)

[11:05] Team_023 possession (Score: 2-3)
Tim Bane attempts a Midrange. Contested by Giannis Turner (3.2 feet, MAN). Tim Bane misses. Rebound secured by Giannis Turner.

[10:55] Team_003 possession (Score: 2-3)
Ayo Jackson commits a violation (traveling/carry)! TURNOVER! (dead ball)

[10:43] Team_023 possession (Score: 2-3)
Trae Ingram attempts a 3Pt. Contested by Giannis Turner (2.7 feet, ZONE). Trae Ingram misses. Offensive rebound by Tim Bane! Tim Bane's putback is no good. Rebound secured by Victor O'Neal.

[10:26] Team_003 possession (Score: 2-3)
Rudy Haliburton makes the Layup and draws the foul on Tim Bane! And-1! Rudy Haliburton to the line for 1. [Team fouls: 1] (Tim Bane: 1 personal fouls)   FT 1/1: GOOD Rudy Haliburton makes 1/1 from the line.
Score: 5-3

[10:11] Team_023 possession (Score: 5-3)
Trae Ingram attempts a Layup. Contested by Ayo Jackson (5.2 feet, MAN). Trae Ingram misses. Offensive rebound by Tim Bane! Tim Bane's putback is no good. Rebound secured by Rudy Haliburton.

[09:57] Team_003 possession (Score: 5-3)
Rudy Haliburton attempts a 3Pt. Contested by Kyle Paul (2.9 feet, ZONE). Rudy Haliburton misses. Rebound secured by Josh Morant.

[09:43] Team_023 possession (Score: 5-3)
Josh Morant makes the Midrange and draws the foul on Rudy Haliburton! And-1! Josh Morant to the line for 1. [Team fouls: 3] (Rudy Haliburton: 2 personal fouls)   FT 1/1: GOOD Josh Morant makes 1/1 from the line.
Score: 5-6

[09:28] Team_003 possession (Score: 5-6)
Rudy Haliburton drives, picks up Tim Bane. Help arrives from Trae Ingram! Rudy Haliburton attempts a Dunk. Contested by Trae Ingram (3.9 feet, ZONE). Rudy Haliburton misses. Rebound secured by Kyle Paul.

[09:14] Team_023 possession (Score: 5-6)
Josh Morant attempts a Midrange. Contested by Giannis Turner (3.0 feet, MAN). Josh Morant misses. Rebound secured by Victor O'Neal.

[08:58] Team_003 possession (Score: 5-6)
Victor O'Neal attempts a 3Pt. Contested by Tim Bane (3.8 feet, MAN). Victor O'Neal misses. Rebound secured by Tim Bane.

[08:39] Team_023 possession (Score: 5-6)
Kyle Paul attempts a 3Pt. Contested by Rudy Haliburton (3.6 feet, MAN). Kyle Paul misses. Rebound secured by Giannis Turner.

[08:24] Team_003 possession (Score: 5-6)
Victor O'Neal attempts a Layup. Contested by Tim Bane (3.8 feet, ZONE). VICTOR O'NEAL MAKES IT! Assist: Rudy Haliburton
Score: 7-6

[08:13] Team_023 possession (Score: 7-6)
Tim Bane attempts a 3Pt. Contested by Giannis Turner (3.2 feet, MAN). Tim Bane misses. Rebound secured by Rudy Haliburton.

[07:58] Team_003 possession (Score: 7-6)
Victor O'Neal attempts a Midrange. Contested by Tim Bane (3.8 feet, MAN). VICTOR O'NEAL MAKES IT! Assist: Giannis Turner
Score: 9-6

[07:44] Team_023 possession (Score: 9-6)
Josh Morant drives and kicks out. Tim Bane attempts a 3Pt. Contested by Giannis Turner (2.8 feet, ZONE). TIM BANE MAKES IT! Assist: Trae Ingram
Score: 9-9

[07:27] Team_003 possession (Score: 9-9)
Giannis Turner drives, picks up Josh Morant. Help arrives from Trae Ingram! Giannis Turner attempts a Dunk. Contested by Trae Ingram (4.4 feet, MAN). Giannis Turner misses. Rebound secured by Josh Morant.

[07:13] Team_023 possession (Score: 9-9)
Josh Morant attempts a Midrange. Contested by Rudy Haliburton (3.4 feet, ZONE). Josh Morant misses. Offensive rebound by Josh Morant! Josh Morant kicks it out.

[06:59] Team_023 possession (Score: 9-9)
Josh Morant attempts a Midrange. Contested by Nikola Bryant (4.2 feet, ZONE). Josh Morant misses. Rebound secured by Giannis Turner.

[06:45] Team_003 possession (Score: 9-9)
Ayo Jackson drives, Tim Bane stays with him. Ayo Jackson attempts a Layup. Contested by Tim Bane (4.1 feet, ZONE). Ayo Jackson misses. Offensive rebound by Rudy Haliburton! Rudy Haliburton puts it back in!
Score: 11-9

[06:25] Team_023 possession (Score: 11-9)
Tim Bane attempts a 3Pt. Contested by Giannis Turner (3.2 feet, ZONE). Tim Bane misses. Rebound secured by Rudy Haliburton.

[06:12] Team_003 possession (Score: 11-9)
Victor O'Neal attempts a Midrange. Contested by Tim Bane (3.8 feet, MAN). Victor O'Neal misses. Rebound secured by Kyle Paul.

[05:57] Team_023 possession (Score: 11-9)
Trae Ingram attempts a 3Pt. Contested by Ayo Jackson (5.2 feet, MAN). Trae Ingram misses. Rebound secured by Victor O'Neal.

[05:41] Team_003 possession (Score: 11-9)
Giannis Turner drives and kicks out. Ayo Jackson attempts a 3Pt. Contested by Trae Ingram (3.4 feet, MAN). Ayo Jackson misses. Rebound secured by Josh Morant.

[05:31] Team_023 possession (Score: 11-9)
Trae Ingram drives to the basket... FOUL! Offensive foul on Trae Ingram! Ayo Jackson drew the charge! [Team fouls: 2] (Trae Ingram: 1 personal fouls) TURNOVER! (dead ball)

[05:20] Team_003 possession (Score: 11-9)
Ayo Jackson attempts a Layup. Contested by Trae Ingram (3.7 feet, MAN). AYO JACKSON MAKES IT!
Score: 13-9

[05:06] Team_023 possession (Score: 13-9)
Kyle Paul attempts a 3Pt. Contested by Giannis Turner (3.2 feet, ZONE). Kyle Paul misses. Rebound secured by Giannis Turner.

[04:52] Team_003 possession (Score: 13-9)
Giannis Turner attempts a 3Pt. Contested by Kyle Paul (3.2 feet, ZONE). Giannis Turner misses. Rebound secured by Kyle Paul.

[04:35] Team_023 possession (Score: 13-9)
Trae Ingram attempts a Layup. Contested by Ayo Jackson (5.2 feet, MAN). TRAE INGRAM MAKES IT!
Score: 13-11

[04:19] Team_003 possession (Score: 13-11)
Rudy Haliburton drives and kicks out. Ayo Jackson attempts a 3Pt. Contested by Trae Ingram (3.5 feet, MAN). Ayo Jackson misses. Rebound secured by Tim Bane.

[04:04] Team_023 possession (Score: 13-11)
Collin Ginobili attempts a 3Pt. Contested by Nikola Bryant (4.6 feet, ZONE). Collin Ginobili misses. Offensive rebound by Tim Bane! Tim Bane puts it back in!
Score: 13-13

[03:48] Team_003 possession (Score: 13-13)
FOUL! Holding foul on Trae Ingram. [Team fouls: 3] No free throws, side out. (Trae Ingram: 2 personal fouls)

[03:38] Team_003 possession (Score: 13-13)
Rudy Haliburton drives and kicks out. Rudy Haliburton attempts a 3Pt. Contested by Kyle Paul (3.0 feet, ZONE). Rudy Haliburton misses. Rebound secured by Tim Bane.

[03:23] Team_023 possession (Score: 13-13)
Tim Bane attempts a Layup. Contested by Victor O'Neal (4.7 feet, ZONE). TIM BANE MAKES IT!
Score: 13-15

[03:07] Team_003 possession (Score: 13-15)
Giannis Turner attempts a Midrange. Contested by Josh Morant (4.5 feet, MAN). GIANNIS TURNER MAKES IT! Assist: Ayo Jackson
Score: 15-15

[02:49] Team_023 possession (Score: 15-15)
FOUL! Shooting foul on Nikola Bryant. Tim Bane to the line for 2 free throws. [Team fouls: 4] (Nikola Bryant: 1 personal fouls)   FT 1/2: MISS   FT 2/2: GOOD Tim Bane makes 1/2 from the line.
Score: 15-16

[02:36] Team_003 possession (Score: 15-16)
Giannis Turner attempts a 3Pt. Contested by Kyle Paul (3.4 feet, ZONE). Giannis Turner misses. Rebound secured by Kyle Paul.

[02:23] Team_023 possession (Score: 15-16)
Kyle Paul throws a bad pass out of bounds! TURNOVER! (dead ball)

[02:23] Substitution (Team_003): Ayo Jackson OUT → Miles Towns IN (stamina_rule2)

[02:23] Substitution (Team_003): Nikola Bryant OUT → Pau Williamson IN (stamina_rule2)

[02:23] Substitution (Team_003): Giannis Turner OUT → Anfernee Jordan IN (stamina_rule2)

[02:23] Substitution (Team_003): Victor O'Neal OUT → Bam Gilgeous-Alexander IN (stamina_rule2)

[02:23] Substitution (Team_023): Trae Ingram OUT → Tracy Anthony IN (stamina_rule2)

[02:23] Substitution (Team_023): Collin Ginobili OUT → Magic Booker IN (stamina_rule2)

[02:23] Substitution (Team_023): Kyle Paul OUT → Gary Westbrook IN (stamina_rule2)

[02:23] Substitution (Team_023): Josh Morant OUT → Evan Parker IN (stamina_rule2)

[02:23] Substitution (Team_023): Tim Bane OUT → Vince Gasol IN (stamina_rule2)

[02:05] Team_003 possession (Score: 15-16)
Anfernee Jordan drives, Vince Gasol stays with him. Anfernee Jordan attempts a Layup. Contested by Vince Gasol (3.4 feet, ZONE). Anfernee Jordan misses. Rebound secured by Vince Gasol.

[01:50] Team_023 possession (Score: 15-16)
Magic Booker attempts a Midrange. Contested by Pau Williamson (4.8 feet, MAN). MAGIC BOOKER MAKES IT! Assist: Vince Gasol
Score: 15-18

[01:38] Team_003 possession (Score: 15-18)
Anfernee Jordan attempts a 3Pt. Contested by Tracy Anthony (3.5 feet, ZONE). ANFERNEE JORDAN MAKES IT! Assist: Rudy Haliburton
Score: 18-18

[01:25] Team_023 possession (Score: 18-18)
Magic Booker attempts a 3Pt. BLOCKED BY PAU WILLIAMSON! Ball is loose! Rebound secured by Anfernee Jordan.

[01:11] Team_003 possession (Score: 18-18)
Bam Gilgeous-Alexander attempts a Layup. Contested by Vince Gasol (4.3 feet, MAN). BAM GILGEOUS-ALEXANDER MAKES IT! Assist: Anfernee Jordan
Score: 20-18

[00:57] Team_023 possession (Score: 20-18)
FOUL! Holding foul on Bam Gilgeous-Alexander. [IN THE BONUS! 5 team fouls] Vince Gasol to the line for 2 free throws. (Bam Gilgeous-Alexander: 1 personal fouls)   FT 1/2: MISS   FT 2/2: GOOD Vince Gasol makes 1/2 from the line.
Score: 20-19

[00:41] Team_003 possession (Score: 20-19)
Miles Towns attempts a Layup. Contested by Vince Gasol (3.5 feet, ZONE). MILES TOWNS MAKES IT! Assist: Rudy Haliburton
Score: 22-19

[00:22] Team_023 possession (Score: 22-19)
Vince Gasol attempts a Midrange. Contested by Bam Gilgeous-Alexander (3.1 feet, MAN). Vince Gasol misses. FOUL! Loose ball foul on Anfernee Jordan during the rebound battle. [IN THE BONUS! 6 team fouls] Vince Gasol to the line for 2 free throws. (Anfernee Jordan: 1 personal fouls)   FT 1/2: GOOD   FT 2/2: GOOD Vince Gasol makes 2/2 from the line.
Score: 22-21

[00:08] Team_003 possession (Score: 22-21)
Bam Gilgeous-Alexander attempts a 3Pt. Contested by Vince Gasol (4.3 feet, MAN). Bam Gilgeous-Alexander misses. Rebound secured by Evan Parker.

================================================================================
                              1ST QUARTER COMPLETE                              
================================================================================

1ST QUARTER SCORE: Team_003 22, Team_023 21

BOX SCORE:
================================================================================

Team_003
--------------------------------------------------------------------------------
Player                MIN  PTS  REB  AST  TO      FG   FG%      3P   3P%
--------------------------------------------------------------------------------
Rudy Haliburton        12    7    4    3   0   3/7    42.9     0/0   0.0
Victor O'Neal          10    4    3    0   0   2/4    50.0     0/0   0.0
Anfernee Jordan         2    3    1    1   0   1/2    50.0     0/0   0.0
Ayo Jackson            10    2    0    2   0   1/1   100.0     0/0   0.0
Giannis Turner         10    2    4    1   0   1/5    20.0     0/0   0.0
Bam Gilgeous-Alexander    2    2    0    0   0   1/2    50.0     0/0   0.0
Miles Towns             2    2    0    0   0   1/1   100.0     0/0   0.0

TEAM: FG: 10/22 (45.5%), 3PT: 1/6 (16.7%), REB: 10 (1 off, 9 def), AST: 7, TO: 2
TEAM FOULS: 6 [Team_023 in BONUS]


Team_023
--------------------------------------------------------------------------------
Player                MIN  PTS  REB  AST  TO      FG   FG%      3P   3P%
--------------------------------------------------------------------------------
Tim Bane               10    8    4    0   0   4/7    57.1     0/0   0.0
Collin Ginobili        10    3    0    0   0   1/1   100.0     0/0   0.0
Josh Morant            10    3    5    0   0   1/3    33.3     0/0   0.0
Vince Gasol             2    3    1    1   0   2/2   100.0     0/0   0.0
Trae Ingram            10    2    0    1   0   1/4    25.0     0/0   0.0
Magic Booker            2    2    0    0   0   1/2    50.0     0/0   0.0
Kyle Paul              10    0    4    0   0   0/2     0.0     0/0   0.0
Evan Parker             2    0    1    0   0   0/0     0.0     0/0   0.0

TEAM: FG: 10/21 (47.6%), 3PT: 1/8 (12.5%), REB: 17 (5 off, 12 def), AST: 2, TO: 2
TEAM FOULS: 3

================================================================================

================================================================================
                       2ND QUARTER - Team_003 vs Team_023                       
================================================================================

[12:00] Team_003 possession (Score: 22-21)
Giannis Turner loses control! Ball rolls out of bounds! TURNOVER! (dead ball)

[11:44] Team_023 possession (Score: 22-21)
Trae Ingram attempts a 3Pt. Contested by Giannis Turner (2.7 feet, ZONE). Trae Ingram misses. Rebound secured by Victor O'Neal.

[11:28] Team_003 possession (Score: 22-21)
Rudy Haliburton attempts a Layup. Contested by Kyle Paul (2.9 feet, MAN). RUDY HALIBURTON MAKES IT! Assist: Ayo Jackson
Score: 24-21

[11:14] Team_023 possession (Score: 24-21)
Tim Bane drives, Giannis Turner stays with him. Tim Bane attempts a Dunk. Contested by Giannis Turner (3.2 feet, MAN). TIM BANE MAKES IT! Assist: Collin Ginobili
Score: 24-23

[11:05] Team_003 possession (Score: 24-23)
Rudy Haliburton drives to the basket... Rudy Haliburton throws a bad pass! Stolen by Tim Bane! TURNOVER! (live ball)

[10:47] Team_023 possession (Score: 24-23)
Collin Ginobili attempts a 3Pt. Contested by Giannis Turner (3.4 feet, ZONE). COLLIN GINOBILI MAKES IT! Assist: Trae Ingram
Score: 24-26

[10:32] Team_003 possession (Score: 24-26)
Giannis Turner attempts a 3Pt. Contested by Kyle Paul (3.3 feet, ZONE). Giannis Turner misses. Rebound secured by Tim Bane.

[10:19] Team_023 possession (Score: 24-26)
FOUL! Holding foul on Nikola Bryant. [Team fouls: 1] No free throws, side out. (Nikola Bryant: 1 personal fouls)

[10:03] Team_023 possession (Score: 24-26)
Tim Bane attempts a 3Pt. Contested by Giannis Turner (3.4 feet, MAN). Tim Bane misses. Rebound secured by Rudy Haliburton.

[09:50] Team_003 possession (Score: 24-26)
FOUL! Reach-in foul on Collin Ginobili during the drive. [Team fouls: 1] No free throws, side out. (Collin Ginobili: 1 personal fouls)

[09:41] Team_003 possession (Score: 24-26)
Ayo Jackson attempts a 3Pt. Contested by Kyle Paul (3.4 feet, ZONE). AYO JACKSON MAKES IT! Assist: Nikola Bryant
Score: 27-26

[09:25] Team_023 possession (Score: 27-26)
Collin Ginobili attempts a Midrange. Contested by Nikola Bryant (4.7 feet, MAN). COLLIN GINOBILI MAKES IT!
Score: 27-28

[09:13] Team_003 possession (Score: 27-28)
Giannis Turner attempts a 3Pt. Contested by Kyle Paul (3.4 feet, ZONE). Giannis Turner misses. Rebound secured by Kyle Paul.

[09:02] Team_023 possession (Score: 27-28)
Collin Ginobili loses control! Ball rolls out of bounds! TURNOVER! (dead ball)

[09:02] Substitution (Team_003): Ayo Jackson OUT → Miles Towns IN (stamina_rule2)

[09:02] Substitution (Team_003): Nikola Bryant OUT → Pau Williamson IN (stamina_rule2)

[09:02] Substitution (Team_003): Rudy Haliburton OUT → Collin Mitchell IN (stamina_rule2)

[09:02] Substitution (Team_003): Giannis Turner OUT → Anfernee Jordan IN (stamina_rule2)

[09:02] Substitution (Team_003): Victor O'Neal OUT → Bam Gilgeous-Alexander IN (stamina_rule2)

[09:02] Substitution (Team_023): Trae Ingram OUT → Tracy Anthony IN (stamina_rule2)

[09:02] Substitution (Team_023): Collin Ginobili OUT → Magic Booker IN (stamina_rule2)

[09:02] Substitution (Team_023): Kyle Paul OUT → Gary Westbrook IN (stamina_rule2)

[09:02] Substitution (Team_023): Josh Morant OUT → Evan Parker IN (stamina_rule2)

[09:02] Substitution (Team_023): Tim Bane OUT → Vince Gasol IN (stamina_rule2)

[08:49] Team_003 possession (Score: 27-28)
Collin Mitchell attempts a 3Pt. Contested by Gary Westbrook (4.1 feet, MAN). Collin Mitchell misses. Rebound secured by Evan Parker.

[08:32] Team_023 possession (Score: 27-28)
Magic Booker drives to the basket... Magic Booker throws a bad pass out of bounds! TURNOVER! (dead ball)

[08:20] Team_003 possession (Score: 27-28)
Pau Williamson attempts a 3Pt. Contested by Tracy Anthony (3.5 feet, ZONE). Pau Williamson misses. Rebound secured by Gary Westbrook.

[08:06] Team_023 possession (Score: 27-28)
Tracy Anthony attempts a Layup. Contested by Bam Gilgeous-Alexander (3.0 feet, ZONE). Tracy Anthony misses. Rebound secured by Bam Gilgeous-Alexander.

[07:53] Team_003 possession (Score: 27-28)
FOUL! Shooting foul on Gary Westbrook. Collin Mitchell to the line for 2 free throws. [Team fouls: 2] (Gary Westbrook: 1 personal fouls)   FT 1/2: GOOD   FT 2/2: MISS Collin Mitchell makes 1/2 from the line. Rebound secured by Vince Gasol.
Score: 28-28

[07:34] Team_023 possession (Score: 28-28)
Vince Gasol attempts a Midrange. Contested by Miles Towns (5.4 feet, ZONE). Vince Gasol misses. FOUL! Loose ball foul on Bam Gilgeous-Alexander during the rebound battle. [Team fouls: 2] No free throws, side out. (Bam Gilgeous-Alexander: 1 personal fouls)

[07:19] Team_023 possession (Score: 28-28)
Vince Gasol drives to the basket... FOUL! Offensive foul on Vince Gasol! Bam Gilgeous-Alexander drew the charge! [Team fouls: 3] (Vince Gasol: 1 personal fouls) TURNOVER! (dead ball)

[07:01] Team_003 possession (Score: 28-28)
Bam Gilgeous-Alexander throws a bad pass out of bounds! TURNOVER! (dead ball)

[06:47] Team_023 possession (Score: 28-28)
Evan Parker attempts a Midrange. Contested by Bam Gilgeous-Alexander (3.1 feet, MAN). Evan Parker misses. Rebound secured by Collin Mitchell.

[06:29] Team_003 possession (Score: 28-28)
Bam Gilgeous-Alexander attempts a Layup. Contested by Vince Gasol (4.3 feet, MAN). BAM GILGEOUS-ALEXANDER MAKES IT! Assist: Miles Towns
Score: 30-28

[06:13] Team_023 possession (Score: 30-28)
Gary Westbrook attempts a 3Pt. Contested by Miles Towns (5.6 feet, ZONE). Gary Westbrook misses. Rebound secured by Anfernee Jordan.

[05:58] Team_003 possession (Score: 30-28)
Bam Gilgeous-Alexander drives and kicks out. Pau Williamson attempts a 3Pt. Contested by Magic Booker (4.3 feet, MAN). Pau Williamson misses. Rebound secured by Gary Westbrook.

[05:44] Team_023 possession (Score: 30-28)
Magic Booker commits a violation (traveling/carry)! TURNOVER! (dead ball)

[05:33] Team_003 possession (Score: 30-28)
Anfernee Jordan attempts a 3Pt. Contested by Magic Booker (4.1 feet, ZONE). Anfernee Jordan misses. Rebound secured by Gary Westbrook.

[05:14] Team_023 possession (Score: 30-28)
Tracy Anthony attempts a 3Pt. Contested by Miles Towns (5.3 feet, ZONE). Tracy Anthony misses. Offensive rebound by Evan Parker! Evan Parker puts it back in!
Score: 30-30

[04:55] Team_003 possession (Score: 30-30)
Miles Towns attempts a 3Pt. Contested by Tracy Anthony (3.5 feet, ZONE). Miles Towns misses. Offensive rebound by Bam Gilgeous-Alexander! Bam Gilgeous-Alexander puts it back in!
Score: 32-30

[04:41] Team_023 possession (Score: 32-30)
Evan Parker attempts a Midrange. Contested by Pau Williamson (5.2 feet, ZONE). Evan Parker misses. Rebound secured by Anfernee Jordan.

[04:22] Team_003 possession (Score: 32-30)
Pau Williamson attempts a Midrange. Contested by Gary Westbrook (3.8 feet, ZONE). PAU WILLIAMSON MAKES IT!
Score: 34-30

[04:06] Team_023 possession (Score: 34-30)
Tracy Anthony attempts a 3Pt. Contested by Miles Towns (5.3 feet, ZONE). Tracy Anthony misses. Rebound secured by Anfernee Jordan.

[03:53] Team_003 possession (Score: 34-30)
Anfernee Jordan drives, picks up Vince Gasol. Help arrives from Magic Booker! Anfernee Jordan attempts a Layup. Contested by Magic Booker (3.4 feet, ZONE). ANFERNEE JORDAN MAKES IT! Assist: Miles Towns
Score: 36-30

[03:38] Team_023 possession (Score: 36-30)
Gary Westbrook drives and kicks out. Magic Booker attempts a Midrange. Contested by Pau Williamson (5.1 feet, MAN). Magic Booker misses. Rebound secured by Anfernee Jordan.

[03:26] Team_003 possession (Score: 36-30)
Collin Mitchell attempts a Midrange. Contested by Gary Westbrook (4.1 feet, MAN). Collin Mitchell misses. Rebound secured by Vince Gasol.

[03:12] Team_023 possession (Score: 36-30)
Tracy Anthony attempts a 3Pt. Contested by Miles Towns (5.3 feet, MAN). TRACY ANTHONY MAKES IT! Assist: Magic Booker
Score: 36-33

[02:57] Team_003 possession (Score: 36-33)
Bam Gilgeous-Alexander loses the ball! Stripped by Vince Gasol! TURNOVER! (live ball)

[02:45] Team_023 possession (Score: 36-33)
Gary Westbrook makes the Midrange and draws the foul on Pau Williamson! And-1! Gary Westbrook to the line for 1. [Team fouls: 3] (Pau Williamson: 1 personal fouls)   FT 1/1: MISS Gary Westbrook makes 0/1 from the line. Rebound secured by Bam Gilgeous-Alexander.
Score: 36-35

[02:33] Team_003 possession (Score: 36-35)
Pau Williamson attempts a 3Pt. Contested by Magic Booker (4.2 feet, MAN). PAU WILLIAMSON MAKES IT! Assist: Anfernee Jordan
Score: 39-35

[02:19] Team_023 possession (Score: 39-35)
Evan Parker makes the Layup and draws the foul on Bam Gilgeous-Alexander! And-1! Evan Parker to the line for 1. [Team fouls: 4] (Bam Gilgeous-Alexander: 2 personal fouls)   FT 1/1: GOOD Evan Parker makes 1/1 from the line.
Score: 39-38

[02:08] Team_003 possession (Score: 39-38)
Anfernee Jordan drives to the basket... Anfernee Jordan commits a violation (traveling/carry)! TURNOVER! (dead ball)

[01:55] Team_023 possession (Score: 39-38)
FOUL! Reach-in foul on Bam Gilgeous-Alexander during the drive. [IN THE BONUS! 5 team fouls] Tracy Anthony to the line for 2 free throws. (Bam Gilgeous-Alexander: 3 personal fouls)   FT 1/2: GOOD   FT 2/2: GOOD Tracy Anthony makes 2/2 from the line.
Score: 39-40

[01:37] Team_003 possession (Score: 39-40)
Pau Williamson drives and kicks out. Miles Towns attempts a Midrange. Contested by Tracy Anthony (3.9 feet, MAN). Miles Towns misses. Offensive rebound by Bam Gilgeous-Alexander! Bam Gilgeous-Alexander puts it back in!
Score: 41-40

[01:20] Team_023 possession (Score: 41-40)
Gary Westbrook makes the Layup and draws the foul on Collin Mitchell! And-1! Gary Westbrook to the line for 1. [BONUS: 6 team fouls] (Collin Mitchell: 1 personal fouls)   FT 1/1: GOOD Gary Westbrook makes 1/1 from the line.
Score: 41-43

[01:05] Team_003 possession (Score: 41-43)
Collin Mitchell drives and kicks out. Anfernee Jordan attempts a 3Pt. Contested by Evan Parker (3.3 feet, MAN). Anfernee Jordan misses. Rebound secured by Gary Westbrook.

[00:47] Team_023 possession (Score: 41-43)
Evan Parker drives, Bam Gilgeous-Alexander stays with him. Evan Parker attempts a Dunk. Contested by Bam Gilgeous-Alexander (3.4 feet, MAN). EVAN PARKER MAKES IT! Assist: Tracy Anthony
Score: 41-45

[00:35] Team_003 possession (Score: 41-45)
Collin Mitchell attempts a Layup. Contested by Gary Westbrook (4.4 feet, MAN). COLLIN MITCHELL MAKES IT!
Score: 43-45

[00:22] Team_023 possession (Score: 43-45)
Gary Westbrook attempts a 3Pt. Contested by Miles Towns (5.7 feet, ZONE). Gary Westbrook misses. Rebound secured by Anfernee Jordan.

[00:08] Team_003 possession (Score: 43-45)
Miles Towns attempts a 3Pt. Contested by Tracy Anthony (3.9 feet, MAN). Miles Towns misses. FOUL! Loose ball foul on Gary Westbrook during the rebound battle. [Team fouls: 4] No free throws, side out. (Gary Westbrook: 2 personal fouls)

================================================================================
                              2ND QUARTER COMPLETE                              
================================================================================

2ND QUARTER SCORE: Team_003 21, Team_023 24

BOX SCORE:
================================================================================

Team_003
--------------------------------------------------------------------------------
Player                MIN  PTS  REB  AST  TO      FG   FG%      3P   3P%
--------------------------------------------------------------------------------
Bam Gilgeous-Alexander   11    6    5    0   0   3/4    75.0     0/0   0.0
Pau Williamson         11    5    0    0   0   2/3    66.7     0/0   0.0
Ayo Jackson            13    3    0    1   0   1/1   100.0     0/0   0.0
Rudy Haliburton        15    2    1    0   0   1/1   100.0     0/0   0.0
Collin Mitchell         9    2    1    0   0   1/5    20.0     0/0   0.0
Anfernee Jordan        11    2    5    1   0   1/2    50.0     0/0   0.0
Victor O'Neal          13    0    1    0   0   0/0     0.0     0/0   0.0
Giannis Turner         13    0    0    0   0   0/2     0.0     0/0   0.0
Nikola Bryant          13    0    0    1   0   0/0     0.0     0/0   0.0
Miles Towns            11    0    0    2   0   0/0     0.0     0/0   0.0

TEAM: FG: 9/18 (50.0%), 3PT: 3/8 (37.5%), REB: 13 (3 off, 10 def), AST: 5, TO: 5
TEAM FOULS: 6 [Team_023 in BONUS]


Team_023
--------------------------------------------------------------------------------
Player                MIN  PTS  REB  AST  TO      FG   FG%      3P   3P%
--------------------------------------------------------------------------------
Evan Parker            11    7    2    0   0   3/5    60.0     0/0   0.0
Collin Ginobili        13    5    0    1   0   2/2   100.0     0/0   0.0
Tracy Anthony          11    5    0    1   0   2/4    50.0     0/0   0.0
Gary Westbrook         11    3    4    0   0   1/5    20.0     0/0   0.0
Tim Bane               13    2    1    0   0   1/2    50.0     0/0   0.0
Trae Ingram            13    0    0    1   0   0/1     0.0     0/0   0.0
Kyle Paul              13    0    1    0   0   0/0     0.0     0/0   0.0
Vince Gasol            11    0    3    0   0   0/0     0.0     0/0   0.0
Magic Booker           11    0    0    1   0   0/0     0.0     0/0   0.0

TEAM: FG: 9/19 (47.4%), 3PT: 3/8 (37.5%), REB: 11 (2 off, 9 def), AST: 4, TO: 4
TEAM FOULS: 4

================================================================================

================================================================================
                       3RD QUARTER - Team_003 vs Team_023                       
================================================================================

[12:00] Team_003 possession (Score: 43-45)
Rudy Haliburton attempts a 3Pt. Contested by Kyle Paul (2.9 feet, MAN). Rudy Haliburton misses. Rebound secured by Tim Bane.

[11:47] Team_023 possession (Score: 43-45)
Tim Bane attempts a Layup. Contested by Giannis Turner (3.2 feet, MAN). TIM BANE MAKES IT! Assist: Kyle Paul
Score: 43-47

[11:30] Team_003 possession (Score: 43-47)
Nikola Bryant drives to the basket... Nikola Bryant throws a bad pass out of bounds! TURNOVER! (dead ball)

[11:16] Team_023 possession (Score: 43-47)
Josh Morant attempts a 3Pt. Contested by Giannis Turner (3.0 feet, MAN). JOSH MORANT MAKES IT! Assist: Collin Ginobili
Score: 43-50

[11:05] Team_003 possession (Score: 43-50)
FOUL! Reach-in foul on Tim Bane during the drive. [Team fouls: 1] No free throws, side out. (Tim Bane: 1 personal fouls)

[10:51] Team_003 possession (Score: 43-50)
Nikola Bryant attempts a Layup. Contested by Collin Ginobili (5.2 feet, MAN). Nikola Bryant misses. Rebound secured by Tim Bane.

[10:34] Team_023 possession (Score: 43-50)
Collin Ginobili attempts a 3Pt. Contested by Giannis Turner (3.3 feet, ZONE). Collin Ginobili misses. Rebound secured by Giannis Turner.

[10:20] Team_003 possession (Score: 43-50)
Ayo Jackson attempts a 3Pt. Contested by Trae Ingram (3.7 feet, MAN). Ayo Jackson misses. Rebound secured by Josh Morant.

[10:09] Team_023 possession (Score: 43-50)
Collin Ginobili attempts a 3Pt. Contested by Giannis Turner (3.3 feet, ZONE). Collin Ginobili misses. Rebound secured by Victor O'Neal.

[09:50] Team_003 possession (Score: 43-50)
Ayo Jackson attempts a 3Pt. Contested by Kyle Paul (3.1 feet, ZONE). Ayo Jackson misses. Rebound secured by Josh Morant.

[09:34] Team_023 possession (Score: 43-50)
FOUL! Reach-in foul on Giannis Turner during the drive. [Team fouls: 1] No free throws, side out. (Giannis Turner: 1 personal fouls)

[09:24] Team_023 possession (Score: 43-50)
Tim Bane makes the Midrange and draws the foul on Giannis Turner! And-1! Tim Bane to the line for 1. [Team fouls: 2] (Giannis Turner: 2 personal fouls)   FT 1/1: GOOD Tim Bane makes 1/1 from the line.
Score: 43-53

[09:12] Team_003 possession (Score: 43-53)
Rudy Haliburton attempts a 3Pt. Contested by Trae Ingram (3.4 feet, ZONE). Rudy Haliburton misses. Rebound secured by Kyle Paul.

[08:52] Team_023 possession (Score: 43-53)
Tim Bane drives, Giannis Turner stays with him. Tim Bane attempts a Layup. Contested by Giannis Turner (3.2 feet, ZONE). TIM BANE MAKES IT!
Score: 43-55

[08:38] Team_003 possession (Score: 43-55)
Victor O'Neal makes the Layup and draws the foul on Tim Bane! And-1! Victor O'Neal to the line for 1. [Team fouls: 2] (Tim Bane: 2 personal fouls)   FT 1/1: GOOD Victor O'Neal makes 1/1 from the line.
Score: 46-55

[08:20] Team_023 possession (Score: 46-55)
FOUL! Shooting foul on Giannis Turner. Collin Ginobili to the line for 2 free throws. [Team fouls: 3] (Giannis Turner: 3 personal fouls)   FT 1/2: GOOD   FT 2/2: MISS Collin Ginobili makes 1/2 from the line. Offensive rebound by Josh Morant! Josh Morant kicks it out.
Score: 46-56

[08:07] Team_023 possession (Score: 46-56)
FOUL! Reach-in foul on Giannis Turner during the drive. [Team fouls: 4] No free throws, side out. (Giannis Turner: 4 personal fouls)

[07:57] Team_023 possession (Score: 46-56)
FOUL! Reach-in foul on Giannis Turner during the drive. [IN THE BONUS! 5 team fouls] Josh Morant to the line for 2 free throws. (Giannis Turner: 5 personal fouls)   FT 1/2: GOOD   FT 2/2: GOOD Josh Morant makes 2/2 from the line.
Score: 46-58

[07:43] Team_003 possession (Score: 46-58)
Rudy Haliburton attempts a 3Pt. Contested by Kyle Paul (2.9 feet, ZONE). Rudy Haliburton misses. Rebound secured by Tim Bane.

[07:26] Team_023 possession (Score: 46-58)
Tim Bane makes the Layup and draws the foul on Giannis Turner! And-1! Tim Bane to the line for 1. [BONUS: 6 team fouls] (Giannis Turner: 6 personal fouls) Giannis Turner FOULS OUT!   FT 1/1: MISS Tim Bane makes 0/1 from the line. Rebound secured by Giannis Turner.
Score: 46-60

[07:26] Substitution (Team_003): Giannis Turner OUT (stamina: 86) → Miles Towns IN (foul_out)

[07:13] Team_003 possession (Score: 46-60)
Rudy Haliburton attempts a 3Pt. Contested by Kyle Paul (2.9 feet, MAN). RUDY HALIBURTON MAKES IT! Assist: Miles Towns
Score: 49-60

[07:02] Team_023 possession (Score: 49-60)
Collin Ginobili attempts a 3Pt. Contested by Nikola Bryant (4.5 feet, MAN). Collin Ginobili misses. Offensive rebound by Josh Morant! Josh Morant kicks it out.

[06:52] Team_023 possession (Score: 49-60)
Josh Morant attempts a Midrange. Contested by Victor O'Neal (4.3 feet, ZONE). Josh Morant misses. Offensive rebound by Josh Morant! Josh Morant kicks it out.

[06:33] Team_023 possession (Score: 49-60)
Trae Ingram drives, Victor O'Neal stays with him. Trae Ingram attempts a Layup. Contested by Victor O'Neal (4.1 feet, ZONE). Trae Ingram misses. Rebound secured by Miles Towns.

[06:17] Team_003 possession (Score: 49-60)
Nikola Bryant attempts a 3Pt. Contested by Kyle Paul (3.1 feet, ZONE). Nikola Bryant misses. FOUL! Loose ball foul on Josh Morant during the rebound battle. [Team fouls: 3] No free throws, side out. (Josh Morant: 1 personal fouls)

[06:01] Team_003 possession (Score: 49-60)
Nikola Bryant attempts a 3Pt. Contested by Collin Ginobili (5.2 feet, MAN). NIKOLA BRYANT MAKES IT! Assist: Ayo Jackson
Score: 52-60

[05:45] Team_023 possession (Score: 52-60)
Kyle Paul attempts a 3Pt. Contested by Rudy Haliburton (3.6 feet, MAN). Kyle Paul misses. Rebound secured by Miles Towns.

[05:30] Team_003 possession (Score: 52-60)
Victor O'Neal drives, Tim Bane stays with him. Victor O'Neal attempts a Layup. Contested by Tim Bane (3.8 feet, ZONE). Victor O'Neal misses. Offensive rebound by Victor O'Neal! Victor O'Neal kicks it out.

[05:19] Team_003 possession (Score: 52-60)
Rudy Haliburton attempts a 3Pt. Contested by Kyle Paul (2.9 feet, MAN). Rudy Haliburton misses. Rebound secured by Kyle Paul.

[05:06] Team_023 possession (Score: 52-60)
FOUL! Reach-in foul on Victor O'Neal during the drive. [IN THE BONUS! 7 team fouls] Collin Ginobili to the line for 2 free throws. (Victor O'Neal: 1 personal fouls)   FT 1/2: GOOD   FT 2/2: GOOD Collin Ginobili makes 2/2 from the line.
Score: 52-62

[04:49] Team_003 possession (Score: 52-62)
Rudy Haliburton attempts a 3Pt. Contested by Kyle Paul (2.9 feet, ZONE). RUDY HALIBURTON MAKES IT! Assist: Miles Towns
Score: 55-62

[04:33] Team_023 possession (Score: 55-62)
Collin Ginobili attempts a 3Pt. Contested by Nikola Bryant (4.6 feet, ZONE). Collin Ginobili misses. Rebound secured by Miles Towns.

[04:20] Team_003 possession (Score: 55-62)
Victor O'Neal attempts a Midrange. Contested by Tim Bane (3.9 feet, MAN). Victor O'Neal misses. Rebound secured by Josh Morant.

[04:05] Team_023 possession (Score: 55-62)
Kyle Paul attempts a 3Pt. Contested by Nikola Bryant (4.4 feet, ZONE). Kyle Paul misses. Offensive rebound by Josh Morant! Josh Morant kicks it out.

[03:47] Team_023 possession (Score: 55-62)
Trae Ingram loses the ball! Stripped by Miles Towns! TURNOVER! (live ball)

[03:34] Team_003 possession (Score: 55-62)
Ayo Jackson drives and kicks out. Miles Towns attempts a 3Pt. Contested by Trae Ingram (3.6 feet, MAN). MILES TOWNS MAKES IT! Assist: Rudy Haliburton
Score: 58-62

[03:17] Team_023 possession (Score: 58-62)
Tim Bane attempts a Layup. Contested by Victor O'Neal (4.7 feet, ZONE). TIM BANE MAKES IT!
Score: 58-64

[03:00] Team_003 possession (Score: 58-64)
Nikola Bryant attempts a Layup. BLOCKED BY TIM BANE! Ball deflects out of bounds off Nikola Bryant.

[02:47] Team_023 possession (Score: 58-64)
Kyle Paul drives and kicks out. Kyle Paul attempts a 3Pt. Contested by Rudy Haliburton (3.5 feet, MAN). Kyle Paul misses. Offensive rebound by Tim Bane! Tim Bane puts it back in!
Score: 58-66

[02:28] Team_003 possession (Score: 58-66)
Nikola Bryant drives, picks up Josh Morant. Help arrives from Trae Ingram! Nikola Bryant attempts a Layup. Contested by Trae Ingram (4.5 feet, ZONE). Nikola Bryant misses. Rebound secured by Josh Morant.

[02:14] Team_023 possession (Score: 58-66)
Josh Morant attempts a Midrange. Contested by Victor O'Neal (4.6 feet, MAN). Josh Morant misses. Offensive rebound by Tim Bane! Tim Bane puts it back in!
Score: 58-68

[01:56] Team_003 possession (Score: 58-68)
Nikola Bryant drives and kicks out. Rudy Haliburton attempts a 3Pt. Contested by Collin Ginobili (5.2 feet, ZONE). Rudy Haliburton misses. Rebound secured by Tim Bane.

[01:42] Team_023 possession (Score: 58-68)
FOUL! Holding foul on Nikola Bryant. [IN THE BONUS! 8 team fouls] Collin Ginobili to the line for 2 free throws. (Nikola Bryant: 1 personal fouls)   FT 1/2: GOOD   FT 2/2: GOOD Collin Ginobili makes 2/2 from the line.
Score: 58-70

[01:24] Team_003 possession (Score: 58-70)
Rudy Haliburton attempts a 3Pt. Contested by Kyle Paul (3.3 feet, ZONE). Rudy Haliburton misses. Rebound secured by Josh Morant.

[01:12] Team_023 possession (Score: 58-70)
Trae Ingram attempts a Midrange. Contested by Miles Towns (5.1 feet, MAN). Trae Ingram misses. Offensive rebound by Josh Morant! Josh Morant kicks it out.

[01:02] Team_023 possession (Score: 58-70)
Kyle Paul attempts a Midrange. Contested by Rudy Haliburton (3.9 feet, MAN). Kyle Paul misses. FOUL! Loose ball foul on Victor O'Neal during the rebound battle. [IN THE BONUS! 9 team fouls] Josh Morant to the line for 2 free throws. (Victor O'Neal: 2 personal fouls)   FT 1/2: GOOD   FT 2/2: GOOD Josh Morant makes 2/2 from the line.
Score: 58-72

[00:47] Team_003 possession (Score: 58-72)
Ayo Jackson attempts a Midrange. Contested by Collin Ginobili (5.5 feet, ZONE). AYO JACKSON MAKES IT! Assist: Miles Towns
Score: 60-72

[00:31] Team_023 possession (Score: 60-72)
FOUL! Holding foul on Rudy Haliburton. [IN THE BONUS! 10 team fouls] Kyle Paul to the line for 2 free throws. (Rudy Haliburton: 1 personal fouls)   FT 1/2: GOOD   FT 2/2: GOOD Kyle Paul makes 2/2 from the line.
Score: 60-74

[00:14] Team_003 possession (Score: 60-74)
Nikola Bryant drives and kicks out. Nikola Bryant attempts a Midrange. Contested by Collin Ginobili (5.3 feet, MAN). NIKOLA BRYANT MAKES IT!
Score: 62-74

================================================================================
                              3RD QUARTER COMPLETE                              
================================================================================

3RD QUARTER SCORE: Team_003 19, Team_023 29

BOX SCORE:
================================================================================

Team_003
--------------------------------------------------------------------------------
Player                MIN  PTS  REB  AST  TO      FG   FG%      3P   3P%
--------------------------------------------------------------------------------
Rudy Haliburton        27    6    0    1   0   2/7    28.6     0/0   0.0
Nikola Bryant          25    5    0    0   0   2/6    33.3     0/0   0.0
Victor O'Neal          25    3    3    0   0   1/2    50.0     0/0   0.0
Miles Towns            18    3    3    3   0   1/1   100.0     0/0   0.0
Ayo Jackson            25    2    0    1   0   1/3    33.3     0/0   0.0
Giannis Turner         18    0    2    0   0   0/0     0.0     0/0   0.0

TEAM: FG: 7/19 (36.8%), 3PT: 3/10 (30.0%), REB: 8 (2 off, 6 def), AST: 5, TO: 1
TEAM FOULS: 10 [Team_023 in BONUS]


Team_023
--------------------------------------------------------------------------------
Player                MIN  PTS  REB  AST  TO      FG   FG%      3P   3P%
--------------------------------------------------------------------------------
Tim Bane               25   13    6    0   0   6/7    85.7     0/0   0.0
Josh Morant            25    7   10    0   0   3/3   100.0     0/0   0.0
Collin Ginobili        25    4    0    1   0   2/5    40.0     0/0   0.0
Kyle Paul              25    2    2    1   0   1/2    50.0     0/0   0.0
Trae Ingram            25    0    0    0   0   0/1     0.0     0/0   0.0

TEAM: FG: 12/18 (66.7%), 3PT: 1/5 (20.0%), REB: 18 (7 off, 11 def), AST: 2, TO: 1
TEAM FOULS: 3

================================================================================

================================================================================
                       4TH QUARTER - Team_003 vs Team_023                       
================================================================================

[12:00] Substitution (Team_003): Ayo Jackson OUT (stamina: 69) → Miles Towns IN (comeback_detected)

[12:00] Substitution (Team_023): Trae Ingram OUT (stamina: 70) → Tracy Anthony IN (comeback_detected)

[12:00] Team_003 possession (Score: 62-74)
Giannis Turner attempts a 3Pt. Contested by Josh Morant (4.6 feet, MAN). GIANNIS TURNER MAKES IT! Assist: Nikola Bryant
Score: 65-74

[11:46] Team_023 possession (Score: 65-74)
Collin Ginobili attempts a Layup. Contested by Giannis Turner (3.2 feet, ZONE). COLLIN GINOBILI MAKES IT! Assist: Kyle Paul
Score: 65-76

[11:31] Team_003 possession (Score: 65-76)
Miles Towns drives, Tracy Anthony stays with him. Miles Towns attempts a Dunk. Contested by Tracy Anthony (3.5 feet, MAN). Miles Towns misses. Rebound secured by Tim Bane.

[11:18] Team_023 possession (Score: 65-76)
Josh Morant attempts a Layup. Contested by Giannis Turner (2.9 feet, MAN). JOSH MORANT MAKES IT! Assist: Tracy Anthony
Score: 65-78

[11:07] Team_003 possession (Score: 65-78)
Victor O'Neal attempts a 3Pt. Contested by Tracy Anthony (3.5 feet, ZONE). Victor O'Neal misses. Rebound secured by Josh Morant.

[10:53] Team_023 possession (Score: 65-78)
Tim Bane drives, picks up Giannis Turner. Help arrives from Nikola Bryant! Tim Bane attempts a Dunk. Contested by Nikola Bryant (3.1 feet, ZONE). TIM BANE MAKES IT! Assist: Kyle Paul
Score: 65-80

[10:34] Team_003 possession (Score: 65-80)
Nikola Bryant attempts a 3Pt. Contested by Collin Ginobili (5.5 feet, MAN). Nikola Bryant misses. Rebound secured by Kyle Paul.

[10:22] Team_023 possession (Score: 65-80)
Tracy Anthony attempts a Layup. BLOCKED BY GIANNIS TURNER! Ball is loose! Offensive rebound by Tim Bane! Tim Bane kicks it out.

[10:09] Team_023 possession (Score: 65-80)
FOUL! Reach-in foul on Nikola Bryant during the drive. [Team fouls: 1] No free throws, side out. (Nikola Bryant: 1 personal fouls)

[09:51] Team_023 possession (Score: 65-80)
FOUL! Shooting foul on Giannis Turner. Collin Ginobili to the line for 2 free throws. [Team fouls: 2] (Giannis Turner: 1 personal fouls)   FT 1/2: GOOD   FT 2/2: GOOD Collin Ginobili makes 2/2 from the line.
Score: 65-82

[09:39] Team_003 possession (Score: 65-82)
Miles Towns attempts a 3Pt. BLOCKED BY TRACY ANTHONY! Ball is loose! Offensive rebound by Rudy Haliburton! Rudy Haliburton kicks it out.

[09:26] Team_003 possession (Score: 65-82)
Rudy Haliburton attempts a 3Pt. Contested by Tracy Anthony (3.6 feet, ZONE). Rudy Haliburton misses. Rebound secured by Tim Bane.

[09:12] Team_023 possession (Score: 65-82)
Josh Morant drives and kicks out. FOUL! Shooting foul on Miles Towns. Tracy Anthony to the line for 2 free throws. [Team fouls: 3] (Miles Towns: 1 personal fouls)   FT 1/2: GOOD   FT 2/2: GOOD Tracy Anthony makes 2/2 from the line.
Score: 65-84

[08:58] Team_003 possession (Score: 65-84)
FOUL! Shooting foul on Tim Bane. Rudy Haliburton to the line for 2 free throws. [Team fouls: 1] (Tim Bane: 1 personal fouls)   FT 1/2: GOOD   FT 2/2: GOOD Rudy Haliburton makes 2/2 from the line.
Score: 67-84

[08:46] Team_023 possession (Score: 67-84)
Kyle Paul attempts a 3Pt. Contested by Giannis Turner (3.0 feet, ZONE). KYLE PAUL MAKES IT! Assist: Tracy Anthony
Score: 67-87

[08:28] Team_003 possession (Score: 67-87)
Victor O'Neal drives, Tim Bane stays with him. Victor O'Neal attempts a Layup. Contested by Tim Bane (4.6 feet, ZONE). VICTOR O'NEAL MAKES IT!
Score: 69-87

[08:18] Team_023 possession (Score: 69-87)
Tracy Anthony attempts a Midrange. Contested by Giannis Turner (2.8 feet, ZONE). Tracy Anthony misses. Rebound secured by Giannis Turner.

[08:03] Team_003 possession (Score: 69-87)
Nikola Bryant attempts a Layup. Contested by Collin Ginobili (5.8 feet, MAN). NIKOLA BRYANT MAKES IT! Assist: Rudy Haliburton
Score: 71-87

[07:47] Team_023 possession (Score: 71-87)
Josh Morant attempts a 3Pt. Contested by Giannis Turner (2.8 feet, MAN). Josh Morant misses. FOUL! Loose ball foul on Rudy Haliburton during the rebound battle. [Team fouls: 4] No free throws, side out. (Rudy Haliburton: 1 personal fouls)

[07:33] Team_023 possession (Score: 71-87)
Josh Morant attempts a Midrange. Contested by Giannis Turner (2.8 feet, MAN). Josh Morant misses. FOUL! Loose ball foul on Rudy Haliburton during the rebound battle. [IN THE BONUS! 5 team fouls] Tim Bane to the line for 2 free throws. (Rudy Haliburton: 2 personal fouls)   FT 1/2: GOOD   FT 2/2: GOOD Tim Bane makes 2/2 from the line.
Score: 71-89

[07:21] Team_003 possession (Score: 71-89)
FOUL! Reach-in foul on Tim Bane during the drive. [Team fouls: 2] No free throws, side out. (Tim Bane: 2 personal fouls)

[07:08] Team_003 possession (Score: 71-89)
Victor O'Neal attempts a Midrange. Contested by Kyle Paul (3.9 feet, ZONE). Victor O'Neal misses. Rebound secured by Tim Bane.

[06:51] Team_023 possession (Score: 71-89)
FOUL! Offensive foul on Tracy Anthony! Miles Towns drew the charge! [Team fouls: 3] (Tracy Anthony: 1 personal fouls) TURNOVER! (dead ball)

[06:41] Team_003 possession (Score: 71-89)
Giannis Turner attempts a 3Pt. Contested by Tracy Anthony (3.9 feet, ZONE). Giannis Turner misses. Rebound secured by Kyle Paul.

[06:26] Team_023 possession (Score: 71-89)
FOUL! Reach-in foul on Giannis Turner during the drive. [IN THE BONUS! 6 team fouls] Tracy Anthony to the line for 2 free throws. (Giannis Turner: 2 personal fouls)   FT 1/2: GOOD   FT 2/2: GOOD Tracy Anthony makes 2/2 from the line.
Score: 71-91

[06:13] Team_003 possession (Score: 71-91)
Rudy Haliburton attempts a 3Pt. Contested by Kyle Paul (4.2 feet, MAN). Rudy Haliburton misses. Rebound secured by Kyle Paul.

[05:58] Team_023 possession (Score: 71-91)
Tracy Anthony attempts a Midrange. Contested by Miles Towns (5.8 feet, MAN). TRACY ANTHONY MAKES IT! Assist: Kyle Paul
Score: 71-93

[05:45] Team_003 possession (Score: 71-93)
Giannis Turner makes the Layup and draws the foul on Tracy Anthony! And-1! Giannis Turner to the line for 1. [Team fouls: 4] (Tracy Anthony: 2 personal fouls)   FT 1/1: MISS Giannis Turner makes 0/1 from the line. Rebound secured by Josh Morant.
Score: 73-93

[05:30] Team_023 possession (Score: 73-93)
Tim Bane drives, Giannis Turner stays with him. Tim Bane attempts a Layup. Contested by Giannis Turner (3.1 feet, MAN). Tim Bane misses. Rebound secured by Rudy Haliburton.

[05:21] Team_003 possession (Score: 73-93)
Giannis Turner loses the ball! Stripped by Josh Morant! TURNOVER! (live ball)

[05:04] Team_023 possession (Score: 73-93)
Tracy Anthony attempts a Layup. Contested by Giannis Turner (3.1 feet, ZONE). Tracy Anthony misses. Rebound secured by Victor O'Neal.

[04:50] Team_003 possession (Score: 73-93)
FOUL! Reach-in foul on Tim Bane during the drive. [IN THE BONUS! 5 team fouls] Giannis Turner to the line for 2 free throws. (Tim Bane: 3 personal fouls)   FT 1/2: GOOD   FT 2/2: GOOD Giannis Turner makes 2/2 from the line.
Score: 75-93

[04:33] Team_023 possession (Score: 75-93)
Collin Ginobili attempts a 3Pt. Contested by Giannis Turner (3.4 feet, ZONE). COLLIN GINOBILI MAKES IT! Assist: Josh Morant
Score: 75-96

[04:22] Team_003 possession (Score: 75-96)
Giannis Turner loses control! Ball rolls out of bounds! TURNOVER! (dead ball)

[04:22] Substitution (Team_003): Nikola Bryant OUT → Pau Williamson IN (stamina_rule2)

[04:22] Substitution (Team_003): Rudy Haliburton OUT → Collin Mitchell IN (stamina_rule2)

[04:22] Substitution (Team_003): Giannis Turner OUT → Anfernee Jordan IN (stamina_rule2)

[04:22] Substitution (Team_003): Victor O'Neal OUT → Bam Gilgeous-Alexander IN (stamina_rule2)

[04:22] Substitution (Team_023): Collin Ginobili OUT → Magic Booker IN (stamina_rule2)

[04:22] Substitution (Team_023): Kyle Paul OUT → Gary Westbrook IN (stamina_rule2)

[04:22] Substitution (Team_023): Josh Morant OUT → Evan Parker IN (stamina_rule2)

[04:22] Substitution (Team_023): Tim Bane OUT → Vince Gasol IN (stamina_rule2)

[04:08] Team_023 possession (Score: 75-96)
Evan Parker attempts a 3Pt. Contested by Collin Mitchell (4.2 feet, ZONE). Evan Parker misses. Rebound secured by Anfernee Jordan.

[03:52] Team_003 possession (Score: 75-96)
FOUL! Shooting foul on Evan Parker. Anfernee Jordan to the line for 2 free throws. [BONUS: 6 team fouls] (Evan Parker: 1 personal fouls)   FT 1/2: GOOD   FT 2/2: MISS Anfernee Jordan makes 1/2 from the line. Offensive rebound by Bam Gilgeous-Alexander! Bam Gilgeous-Alexander puts it back in!
Score: 78-96

[03:36] Team_023 possession (Score: 78-96)
Vince Gasol throws a bad pass! Stolen by Bam Gilgeous-Alexander! TURNOVER! (live ball)

[03:23] Team_003 possession (Score: 78-96)
Pau Williamson drives and kicks out. Bam Gilgeous-Alexander attempts a 3Pt. Contested by Magic Booker (4.3 feet, ZONE). BAM GILGEOUS-ALEXANDER MAKES IT! Assist: Miles Towns
Score: 81-96

[03:08] Team_023 possession (Score: 81-96)
Gary Westbrook attempts a Midrange. Contested by Pau Williamson (5.4 feet, ZONE). Gary Westbrook misses. Rebound secured by Bam Gilgeous-Alexander.

[02:52] Team_003 possession (Score: 81-96)
Bam Gilgeous-Alexander drives and kicks out. Pau Williamson attempts a 3Pt. Contested by Magic Booker (4.3 feet, ZONE). Pau Williamson misses. Offensive rebound by Collin Mitchell! Collin Mitchell kicks it out.

[02:34] Team_003 possession (Score: 81-96)
Miles Towns attempts a Midrange. Contested by Tracy Anthony (3.8 feet, MAN). Miles Towns misses. Rebound secured by Gary Westbrook.

[02:22] Team_023 possession (Score: 81-96)
Gary Westbrook attempts a Layup. BLOCKED BY BAM GILGEOUS-ALEXANDER! Ball goes out off Bam Gilgeous-Alexander. Gary Westbrook's ball!

[02:12] Team_023 possession (Score: 81-96)
Magic Booker attempts a Midrange. Contested by Pau Williamson (4.8 feet, MAN). MAGIC BOOKER MAKES IT!
Score: 81-98

[01:53] Team_003 possession (Score: 81-98)
Pau Williamson attempts a 3Pt. Contested by Magic Booker (4.2 feet, MAN). Pau Williamson misses. Rebound secured by Evan Parker.

[01:35] Team_023 possession (Score: 81-98)
Vince Gasol attempts a Layup. Contested by Bam Gilgeous-Alexander (3.1 feet, MAN). Vince Gasol misses. Rebound secured by Anfernee Jordan.

[01:21] Team_003 possession (Score: 81-98)
Collin Mitchell drives, Vince Gasol stays with him. Collin Mitchell attempts a Dunk. Contested by Vince Gasol (3.8 feet, ZONE). COLLIN MITCHELL MAKES IT!
Score: 83-98

[01:07] Team_023 possession (Score: 83-98)
Tracy Anthony drives, picks up Bam Gilgeous-Alexander. Help arrives from Pau Williamson! Tracy Anthony attempts a Layup. Contested by Pau Williamson (2.9 feet, ZONE). Tracy Anthony misses. Rebound secured by Anfernee Jordan.

[00:52] Team_003 possession (Score: 83-98)
Bam Gilgeous-Alexander drives, Vince Gasol stays with him. Bam Gilgeous-Alexander attempts a Layup. Contested by Vince Gasol (4.3 feet, MAN). BAM GILGEOUS-ALEXANDER MAKES IT!
Score: 85-98

[00:37] Team_023 possession (Score: 85-98)
Gary Westbrook attempts a 3Pt. Contested by Collin Mitchell (4.4 feet, ZONE). GARY WESTBROOK MAKES IT! Assist: Evan Parker
Score: 85-101

[00:21] Team_003 possession (Score: 85-101)
Collin Mitchell attempts a 3Pt. Contested by Gary Westbrook (4.1 feet, MAN). COLLIN MITCHELL MAKES IT! Assist: Anfernee Jordan
Score: 88-101

[00:07] Team_023 possession (Score: 88-101)
Evan Parker attempts a Midrange. Contested by Anfernee Jordan (4.5 feet, ZONE). EVAN PARKER MAKES IT!
Score: 88-103

================================================================================
                              4TH QUARTER COMPLETE                              
================================================================================

4TH QUARTER SCORE: Team_003 26, Team_023 29

BOX SCORE:
================================================================================

Team_003
--------------------------------------------------------------------------------
Player                MIN  PTS  REB  AST  TO      FG   FG%      3P   3P%
--------------------------------------------------------------------------------
Bam Gilgeous-Alexander   15    8    1    0   0   3/3   100.0     0/0   0.0
Giannis Turner         26    5    1    0   0   2/4    50.0     0/0   0.0
Collin Mitchell        13    5    1    0   0   2/2   100.0     0/0   0.0
Nikola Bryant          33    2    0    1   0   1/2    50.0     0/0   0.0
Victor O'Neal          33    2    1    0   0   1/3    33.3     0/0   0.0
Rudy Haliburton        35    2    2    1   0   1/3    33.3     0/0   0.0
Miles Towns            30    0    0    1   0   0/2     0.0     0/0   0.0
Anfernee Jordan        15    0    3    1   0   0/0     0.0     0/0   0.0
Pau Williamson         15    0    0    0   0   0/1     0.0     0/0   0.0

TEAM: FG: 10/20 (50.0%), 3PT: 2/8 (25.0%), REB: 9 (2 off, 7 def), AST: 4, TO: 2
TEAM FOULS: 6 [Team_023 in BONUS]


Team_023
--------------------------------------------------------------------------------
Player                MIN  PTS  REB  AST  TO      FG   FG%      3P   3P%
--------------------------------------------------------------------------------
Collin Ginobili        33    7    0    0   0   3/3   100.0     0/0   0.0
Tracy Anthony          23    6    0    2   0   3/6    50.0     0/0   0.0
Tim Bane               33    4    4    0   0   2/3    66.7     0/0   0.0
Kyle Paul              33    3    3    3   0   1/1   100.0     0/0   0.0
Gary Westbrook         15    3    1    0   0   1/2    50.0     0/0   0.0
Josh Morant            33    2    3    1   0   1/1   100.0     0/0   0.0
Evan Parker            15    2    1    1   0   1/2    50.0     0/0   0.0
Magic Booker           15    2    0    0   0   1/1   100.0     0/0   0.0
Vince Gasol            15    0    0    0   0   0/1     0.0     0/0   0.0

TEAM: FG: 13/20 (65.0%), 3PT: 3/4 (75.0%), REB: 12 (2 off, 10 def), AST: 7, TO: 2
TEAM FOULS: 6 [Team_003 in BONUS]

================================================================================

================================================================================
                               FULL GAME COMPLETE                               
================================================================================

FINAL SCORE: Team_003 88, Team_023 103

SCORING BY QUARTER:
--------------------------------------------------------------------------------
Team                     Q1     Q2     Q3     Q4    FINAL
--------------------------------------------------------------------------------
Team_003                 22     21     19     26       88
Team_023                 21     24     29     29      103
--------------------------------------------------------------------------------

FULL GAME BOX SCORE:
================================================================================

Team_003
--------------------------------------------------------------------------------
Player                MIN  PTS  REB  AST  TO      FG   FG%      3P   3P%      FT STL BLK
--------------------------------------------------------------------------------
Rudy Haliburton        35   17    7    5   1   6/17   35.3   2/10   20.0   3/3     0   0
Nikola Bryant          33    7    0    2   0   3/8    37.5   1/2    50.0   0/0     0   0
Victor O'Neal          33    9    8    0   0   4/9    44.4   0/2     0.0   1/1     0   0
Miles Towns            30    5    3    6   1   2/4    50.0   1/1   100.0   0/0     1   0
Giannis Turner         26    7    7    1   4   3/11   27.3   1/6    16.7   2/3     0   1
Ayo Jackson            25    7    0    4   2   5/7    71.4   1/3    33.3   0/0     0   0
Pau Williamson         15    5    0    0   0   4/6    66.7   1/3    33.3   0/0     0   1
Anfernee Jordan        15    5    9    3   0   3/5    60.0   1/2    50.0   1/2     0   0
Bam Gilgeous-Alexander   15   16    7    0   2   3/5    60.0   0/1     0.0   0/0     1   1
Collin Mitchell        13    7    2    0   0   3/7    42.9   1/2    50.0   1/2     0   0

TEAM: FG: 36/79 (45.6%), 3PT: 9/32 (28.1%), REB: 40 (8 off, 32 def), AST: 21, TO: 10


Team_023
--------------------------------------------------------------------------------
Player                MIN  PTS  REB  AST  TO      FG   FG%      3P   3P%      FT STL BLK
--------------------------------------------------------------------------------
Collin Ginobili        33   19    0    2   2   7/10   70.0   3/6    50.0   8/9     0   0
Kyle Paul              33    5   10    4   1   3/6    50.0   1/4    25.0   2/2     0   0
Josh Morant            33   12   18    1   0   8/10   80.0   1/1   100.0   5/5     1   0
Tim Bane               33   27   15    0   0   8/14   57.1   0/3     0.0   4/6     1   1
Trae Ingram            25    2    0    2   1   2/7    28.6   0/3     0.0   0/0     0   0
Tracy Anthony          23   11    0    3   1   5/10   50.0   2/3    66.7   6/6     0   1
Magic Booker           15    4    0    1   2   2/3    66.7   0/1     0.0   0/0     0   0
Gary Westbrook         15    6    5    0   0   2/7    28.6   1/3    33.3   1/2     0   0
Evan Parker            15    9    4    1   1   3/6    50.0   0/1     0.0   1/1     0   0
Vince Gasol            15    3    4    1   1   1/2    50.0   0/0     0.0   3/4     1   0

TEAM: FG: 44/78 (56.4%), 3PT: 8/25 (32.0%), REB: 58 (16 off, 42 def), AST: 15, TO: 9

================================================================================
