================================================================================
                        FULL GAME - Team_045 vs Team_095                        
================================================================================

================================================================================
                       1ST QUARTER - Team_045 vs Team_095                       
================================================================================

[12:00] Team_045 possession (Score: 0-0)
Rudy Antetokounmpo attempts a Layup. Contested by Immanuel Middleton (5.2 feet, ZONE). RUDY ANTETOKOUNMPO MAKES IT! Assist: DeMar Turner
Score: 2-0

[11:47] Team_095 possession (Score: 2-0)
Dejounte Hyland attempts a Midrange. Contested by Rudy Antetokounmpo (4.4 feet, MAN). Dejounte Hyland misses. Rebound secured by DeMar Turner.

[11:32] Team_045 possession (Score: 2-0)
FOUL! Shooting foul on Evan Carter. Cole Simons to the line for 3 free throws. [Team fouls: 1] (Evan Carter: 1 personal fouls)   FT 1/3: GOOD   FT 2/3: GOOD   FT 3/3: GOOD Cole Simons makes 3/3 from the line.
Score: 5-0

[11:16] Team_095 possession (Score: 5-0)
Kyrie Ming attempts a Midrange. Contested by Cole Simons (3.5 feet, ZONE). Kyrie Ming misses. Rebound secured by DeMar Turner.

[10:59] Team_045 possession (Score: 5-0)
Trae Russell attempts a 3Pt. Contested by Shaquille Ball (4.9 feet, MAN). Trae Russell misses. Rebound secured by Dejounte Hyland.

[10:46] Team_095 possession (Score: 5-0)
Dejounte Hyland attempts a 3Pt. Contested by Rudy Antetokounmpo (4.4 feet, MAN). DEJOUNTE HYLAND MAKES IT! Assist: Shaquille Ball
Score: 5-3

[10:31] Team_045 possession (Score: 5-3)
DeMar Turner attempts a 3Pt. Contested by Immanuel Middleton (5.2 feet, MAN). DEMAR TURNER MAKES IT! Assist: Trae Russell
Score: 8-3

[10:14] Team_095 possession (Score: 8-3)
Dejounte Hyland makes the Layup and draws the foul on Cole Simons! And-1! Dejounte Hyland to the line for 1. [Team fouls: 1] (Cole Simons: 1 personal fouls)   FT 1/1: GOOD Dejounte Hyland makes 1/1 from the line.
Score: 8-6

[10:01] Team_045 possession (Score: 8-6)
Cole Simons attempts a Layup. Contested by Immanuel Middleton (5.5 feet, ZONE). Cole Simons misses. Rebound secured by Shaquille Ball.

[09:47] Team_095 possession (Score: 8-6)
Dejounte Hyland attempts a 3Pt. Contested by Cole Simons (3.3 feet, ZONE). Dejounte Hyland misses. Rebound secured by Zion Butler.

[09:31] Team_045 possession (Score: 8-6)
Rudy Antetokounmpo attempts a 3Pt. Contested by Evan Carter (4.2 feet, ZONE). Rudy Antetokounmpo misses. Offensive rebound by Zion Butler! Zion Butler puts it back in!
Score: 10-6

[09:17] Team_095 possession (Score: 10-6)
Kyrie Ming attempts a Layup. Contested by Zion Butler (3.5 feet, ZONE). KYRIE MING MAKES IT! Assist: Immanuel Middleton
Score: 10-8

[08:58] Team_045 possession (Score: 10-8)
Trae Russell attempts a Layup. Contested by Immanuel Middleton (5.4 feet, ZONE). TRAE RUSSELL MAKES IT!
Score: 12-8

[08:49] Team_095 possession (Score: 12-8)
Kyrie Ming drives to the basket... Kyrie Ming throws a bad pass! Stolen by Zion Butler! TURNOVER! (live ball)

[08:34] Team_045 possession (Score: 12-8)
Rudy Antetokounmpo drives and kicks out. Zion Butler attempts a 3Pt. Contested by Evan Carter (3.8 feet, ZONE). ZION BUTLER MAKES IT! Assist: Trae Russell
Score: 15-8

[08:21] Team_095 possession (Score: 15-8)
FOUL! Holding foul on Cole Simons. [Team fouls: 2] No free throws, side out. (Cole Simons: 2 personal fouls)

[08:03] Team_095 possession (Score: 15-8)
Kyrie Ming attempts a Midrange. Contested by DeMar Turner (5.1 feet, ZONE). KYRIE MING MAKES IT!
Score: 15-10

[07:46] Team_045 possession (Score: 15-10)
DeMar Turner attempts a 3Pt. Contested by Evan Carter (4.2 feet, ZONE). DeMar Turner misses. Rebound secured by Shaquille Ball.

[07:28] Team_095 possession (Score: 15-10)
Dejounte Hyland attempts a 3Pt. Contested by Rudy Antetokounmpo (4.4 feet, MAN). Dejounte Hyland misses. Rebound secured by DeMar Turner.

[07:14] Team_045 possession (Score: 15-10)
DeMar Turner drives and kicks out. Zion Butler attempts a 3Pt. Contested by Kyrie Ming (5.1 feet, MAN). Zion Butler misses. Rebound secured by Evan Carter.

[06:57] Team_095 possession (Score: 15-10)
Immanuel Middleton attempts a 3Pt. Contested by Zion Butler (3.2 feet, MAN). Immanuel Middleton misses. Rebound secured by Zion Butler.

[06:47] Team_045 possession (Score: 15-10)
FOUL! Shooting foul on Immanuel Middleton. Rudy Antetokounmpo to the line for 2 free throws. [Team fouls: 2] (Immanuel Middleton: 1 personal fouls)   FT 1/2: GOOD   FT 2/2: MISS Rudy Antetokounmpo makes 1/2 from the line. Rebound secured by Shaquille Ball.
Score: 16-10

[06:34] Team_095 possession (Score: 16-10)
Dejounte Hyland attempts a 3Pt. Contested by Cole Simons (3.3 feet, ZONE). Dejounte Hyland misses. Rebound secured by Cole Simons.

[06:17] Team_045 possession (Score: 16-10)
DeMar Turner attempts a Layup. Contested by Immanuel Middleton (5.2 feet, ZONE). DEMAR TURNER MAKES IT!
Score: 18-10

[06:02] Team_095 possession (Score: 18-10)
Dejounte Hyland attempts a 3Pt. Contested by Rudy Antetokounmpo (4.4 feet, MAN). DEJOUNTE HYLAND MAKES IT! Assist: Evan Carter
Score: 18-13

[05:49] Team_045 possession (Score: 18-13)
Trae Russell drives and kicks out. Rudy Antetokounmpo attempts a 3Pt. Contested by Dejounte Hyland (4.9 feet, MAN). RUDY ANTETOKOUNMPO MAKES IT!
Score: 21-13

[05:32] Team_095 possession (Score: 21-13)
FOUL! Holding foul on Cole Simons. [Team fouls: 3] No free throws, side out. (Cole Simons: 3 personal fouls)

[05:17] Team_095 possession (Score: 21-13)
Kyrie Ming attempts a Midrange. Contested by DeMar Turner (5.1 feet, ZONE). KYRIE MING MAKES IT! Assist: Dejounte Hyland
Score: 21-15

[05:00] Team_045 possession (Score: 21-15)
Zion Butler attempts a Dunk. BLOCKED BY KYRIE MING! Ball is loose! Rebound secured by Evan Carter.

[04:44] Team_095 possession (Score: 21-15)
Evan Carter attempts a 3Pt. Contested by Cole Simons (3.5 feet, MAN). Evan Carter misses. Rebound secured by DeMar Turner.

[04:27] Team_045 possession (Score: 21-15)
Zion Butler drives, picks up Immanuel Middleton. Help arrives from Dejounte Hyland! Zion Butler attempts a Dunk. Contested by Dejounte Hyland (5.2 feet, ZONE). ZION BUTLER MAKES IT! Assist: Rudy Antetokounmpo
Score: 23-15

[04:14] Team_095 possession (Score: 23-15)
Dejounte Hyland attempts a Midrange. Contested by Cole Simons (3.3 feet, ZONE). DEJOUNTE HYLAND MAKES IT! Assist: Shaquille Ball
Score: 23-17

[04:03] Team_045 possession (Score: 23-17)
Zion Butler makes the Layup and draws the foul on Kyrie Ming! And-1! Zion Butler to the line for 1. [Team fouls: 3] (Kyrie Ming: 1 personal fouls)   FT 1/1: GOOD Zion Butler makes 1/1 from the line.
Score: 26-17

[03:50] Team_095 possession (Score: 26-17)
Evan Carter attempts a Midrange. Contested by Cole Simons (3.6 feet, MAN). EVAN CARTER MAKES IT!
Score: 26-19

[03:33] Team_045 possession (Score: 26-19)
Cole Simons attempts a Layup. Contested by Evan Carter (4.6 feet, MAN). COLE SIMONS MAKES IT! Assist: Zion Butler
Score: 28-19

[03:14] Team_095 possession (Score: 28-19)
Dejounte Hyland attempts a Midrange. Contested by Rudy Antetokounmpo (4.5 feet, MAN). DEJOUNTE HYLAND MAKES IT!
Score: 28-21

[03:00] Team_045 possession (Score: 28-21)
Cole Simons attempts a 3Pt. Contested by Evan Carter (4.6 feet, ZONE). COLE SIMONS MAKES IT! Assist: DeMar Turner
Score: 31-21

[02:46] Team_095 possession (Score: 31-21)
Shaquille Ball makes the Midrange and draws the foul on DeMar Turner! And-1! Shaquille Ball to the line for 1. [Team fouls: 4] (DeMar Turner: 1 personal fouls)   FT 1/1: MISS Shaquille Ball makes 0/1 from the line. Rebound secured by Cole Simons.
Score: 31-23

[02:30] Team_045 possession (Score: 31-23)
Trae Russell attempts a 3Pt. Contested by Shaquille Ball (5.0 feet, MAN). Trae Russell misses. Rebound secured by Dejounte Hyland.

[02:17] Team_095 possession (Score: 31-23)
Kyrie Ming attempts a Layup. Contested by Zion Butler (3.8 feet, MAN). Kyrie Ming misses. Rebound secured by Zion Butler.

[02:00] Team_045 possession (Score: 31-23)
DeMar Turner drives to the basket... DeMar Turner loses control! Ball rolls out of bounds! TURNOVER! (dead ball)

[02:00] Substitution (Team_045): Trae Russell OUT → Julius James IN (stamina_rule2)

[02:00] Substitution (Team_045): Cole Simons OUT → Gary Towns IN (stamina_rule2)

[02:00] Substitution (Team_045): Zion Butler OUT → Stephen Paul IN (stamina_rule2)

[02:00] Substitution (Team_095): Dejounte Hyland OUT → Kyle Poole IN (stamina_rule2)

[02:00] Substitution (Team_095): Evan Carter OUT → Tobias Wagner IN (stamina_rule2)

[02:00] Substitution (Team_095): Immanuel Middleton OUT → Gary Davis IN (stamina_rule2)

[02:00] Substitution (Team_095): Kyrie Ming OUT → DeMar McCollum IN (stamina_rule2)

[01:47] Team_095 possession (Score: 31-23)
Tobias Wagner attempts a 3Pt. Contested by Gary Towns (5.4 feet, MAN). Tobias Wagner misses. Rebound secured by Julius James.

[01:31] Team_045 possession (Score: 31-23)
Julius James attempts a 3Pt. Contested by Kyle Poole (4.9 feet, ZONE). JULIUS JAMES MAKES IT! Assist: Rudy Antetokounmpo
Score: 34-23

[01:19] Team_095 possession (Score: 34-23)
FOUL! Holding foul on Stephen Paul. [IN THE BONUS! 5 team fouls] DeMar McCollum to the line for 2 free throws. (Stephen Paul: 1 personal fouls)   FT 1/2: GOOD   FT 2/2: GOOD DeMar McCollum makes 2/2 from the line.
Score: 34-25

[01:01] Team_045 possession (Score: 34-25)
DeMar Turner drives and kicks out. Julius James attempts a 3Pt. Contested by Kyle Poole (4.7 feet, ZONE). Julius James misses. Rebound secured by DeMar McCollum.

[00:42] Team_095 possession (Score: 34-25)
Kyle Poole attempts a 3Pt. Contested by Rudy Antetokounmpo (5.2 feet, ZONE). Kyle Poole misses. Rebound secured by Stephen Paul.

[00:29] Team_045 possession (Score: 34-25)
Stephen Paul attempts a 3Pt. Contested by Tobias Wagner (3.7 feet, ZONE). Stephen Paul misses. Rebound secured by DeMar McCollum.

[00:15] Team_095 possession (Score: 34-25)
Shaquille Ball drives to the basket... Shaquille Ball loses the ball! Stripped by Julius James! TURNOVER! (live ball)

[00:01] Team_045 possession (Score: 34-25)
Gary Towns attempts a 3Pt. BLOCKED BY TOBIAS WAGNER! Ball is loose! Offensive rebound by Julius James! Julius James kicks it out.

================================================================================
                              1ST QUARTER COMPLETE                              
================================================================================

1ST QUARTER SCORE: Team_045 34, Team_095 25

BOX SCORE:
================================================================================

Team_045
--------------------------------------------------------------------------------
Player                MIN  PTS  REB  AST  TO      FG   FG%      3P   3P%
--------------------------------------------------------------------------------
Zion Butler            10   10    4    1   0   4/5    80.0     0/0   0.0
Cole Simons            10    8    2    0   0   3/4    75.0     0/0   0.0
Rudy Antetokounmpo     12    5    0    2   0   2/3    66.7     0/0   0.0
DeMar Turner           12    5    4    2   0   2/5    40.0     0/0   0.0
Julius James            2    3    2    0   0   1/1   100.0     0/0   0.0
Trae Russell           10    2    0    2   0   1/3    33.3     0/0   0.0
Stephen Paul            2    0    1    0   0   0/1     0.0     0/0   0.0

TEAM: FG: 13/22 (59.1%), 3PT: 5/9 (55.6%), REB: 13 (2 off, 11 def), AST: 7, TO: 1
TEAM FOULS: 5 [Team_095 in BONUS]


Team_095
--------------------------------------------------------------------------------
Player                MIN  PTS  REB  AST  TO      FG   FG%      3P   3P%
--------------------------------------------------------------------------------
Dejounte Hyland        10   13    2    1   0   5/9    55.6     0/0   0.0
Kyrie Ming             10    6    0    0   0   3/5    60.0     0/0   0.0
Evan Carter            10    2    2    1   0   1/2    50.0     0/0   0.0
DeMar McCollum          2    2    2    0   0   1/1   100.0     0/0   0.0
Shaquille Ball         12    0    3    2   0   0/1     0.0     0/0   0.0
Immanuel Middleton     10    0    0    1   0   0/1     0.0     0/0   0.0
Tobias Wagner           2    0    0    0   0   0/1     0.0     0/0   0.0
Kyle Poole              2    0    0    0   0   0/1     0.0     0/0   0.0

TEAM: FG: 10/21 (47.6%), 3PT: 2/9 (22.2%), REB: 9 (0 off, 9 def), AST: 5, TO: 2
TEAM FOULS: 3

================================================================================

================================================================================
                       2ND QUARTER - Team_045 vs Team_095                       
================================================================================

[12:00] Team_045 possession (Score: 34-25)
Trae Russell attempts a 3Pt. Contested by Shaquille Ball (5.1 feet, MAN). Trae Russell misses. Rebound secured by Kyrie Ming.

[11:42] Team_095 possession (Score: 34-25)
Shaquille Ball attempts a 3Pt. Contested by Cole Simons (3.3 feet, MAN). Shaquille Ball misses. Rebound secured by Zion Butler.

[11:31] Team_045 possession (Score: 34-25)
Rudy Antetokounmpo attempts a 3Pt. Contested by Dejounte Hyland (5.2 feet, ZONE). RUDY ANTETOKOUNMPO MAKES IT! Assist: Trae Russell
Score: 37-25

[11:18] Team_095 possession (Score: 37-25)
Evan Carter drives to the basket... Evan Carter loses the ball! Stripped by Cole Simons! TURNOVER! (live ball)

[11:02] Team_045 possession (Score: 37-25)
Cole Simons attempts a Midrange. Contested by Dejounte Hyland (5.6 feet, ZONE). COLE SIMONS MAKES IT! Assist: Trae Russell
Score: 39-25

[10:44] Team_095 possession (Score: 39-25)
Immanuel Middleton attempts a 3Pt. Contested by Cole Simons (3.4 feet, ZONE). IMMANUEL MIDDLETON MAKES IT! Assist: Shaquille Ball
Score: 39-28

[10:34] Team_045 possession (Score: 39-28)
Trae Russell drives and kicks out. Zion Butler attempts a 3Pt. Contested by Kyrie Ming (5.3 feet, MAN). Zion Butler misses. Rebound secured by Dejounte Hyland.

[10:19] Team_095 possession (Score: 39-28)
FOUL! Shooting foul on Zion Butler. Kyrie Ming to the line for 2 free throws. [Team fouls: 1] (Zion Butler: 1 personal fouls)   FT 1/2: GOOD   FT 2/2: GOOD Kyrie Ming makes 2/2 from the line.
Score: 39-30

[10:05] Team_045 possession (Score: 39-30)
Zion Butler attempts a 3Pt. Contested by Evan Carter (4.3 feet, ZONE). Zion Butler misses. Rebound secured by Dejounte Hyland.

[09:49] Team_095 possession (Score: 39-30)
FOUL! Shooting foul on Rudy Antetokounmpo. Dejounte Hyland to the line for 3 free throws. [Team fouls: 2] (Rudy Antetokounmpo: 1 personal fouls)   FT 1/3: GOOD   FT 2/3: GOOD   FT 3/3: GOOD Dejounte Hyland makes 3/3 from the line.
Score: 39-33

[09:31] Team_045 possession (Score: 39-33)
DeMar Turner drives, picks up Immanuel Middleton. Help arrives from Dejounte Hyland! DeMar Turner attempts a Layup. Contested by Dejounte Hyland (5.4 feet, MAN). DEMAR TURNER MAKES IT!
Score: 41-33

[09:19] Team_095 possession (Score: 41-33)
Immanuel Middleton attempts a Layup. Contested by Zion Butler (3.7 feet, MAN). IMMANUEL MIDDLETON MAKES IT!
Score: 41-35

[09:04] Team_045 possession (Score: 41-35)
Cole Simons attempts a 3Pt. Contested by Evan Carter (4.7 feet, MAN). Cole Simons misses. Rebound secured by Evan Carter.

[08:49] Team_095 possession (Score: 41-35)
Evan Carter attempts a 3Pt. Contested by Rudy Antetokounmpo (5.2 feet, ZONE). Evan Carter misses. Rebound secured by Zion Butler.

[08:31] Team_045 possession (Score: 41-35)
Trae Russell drives, Immanuel Middleton stays with him. Trae Russell attempts a Layup. Contested by Immanuel Middleton (5.7 feet, ZONE). Trae Russell misses. Rebound secured by Evan Carter.

[08:13] Team_095 possession (Score: 41-35)
Shaquille Ball loses the ball! Stripped by Cole Simons! TURNOVER! (live ball)

[07:59] Team_045 possession (Score: 41-35)
Zion Butler attempts a Layup. Contested by Kyrie Ming (5.8 feet, MAN). ZION BUTLER MAKES IT! Assist: DeMar Turner
Score: 43-35

[07:49] Team_095 possession (Score: 43-35)
Dejounte Hyland attempts a 3Pt. Contested by Cole Simons (3.8 feet, ZONE). Dejounte Hyland misses. Rebound secured by Cole Simons.

[07:36] Team_045 possession (Score: 43-35)
Zion Butler drives, picks up Kyrie Ming. Help arrives from Dejounte Hyland! Zion Butler attempts a Layup. Contested by Dejounte Hyland (5.8 feet, MAN). ZION BUTLER MAKES IT!
Score: 45-35

[07:22] Team_095 possession (Score: 45-35)
Kyrie Ming makes the Dunk and draws the foul on Zion Butler! And-1! Kyrie Ming to the line for 1. [Team fouls: 3] (Zion Butler: 2 personal fouls)   FT 1/1: GOOD Kyrie Ming makes 1/1 from the line.
Score: 45-38

[07:09] Team_045 possession (Score: 45-38)
Cole Simons drives, Immanuel Middleton stays with him. Cole Simons attempts a Dunk. Contested by Immanuel Middleton (6.0 feet, ZONE). Cole Simons misses. Rebound secured by Evan Carter.

[06:56] Team_095 possession (Score: 45-38)
FOUL! Reach-in foul on Rudy Antetokounmpo during the drive. [Team fouls: 4] No free throws, side out. (Rudy Antetokounmpo: 2 personal fouls)

[06:40] Team_095 possession (Score: 45-38)
Evan Carter attempts a 3Pt. Contested by Cole Simons (4.2 feet, MAN). EVAN CARTER MAKES IT!
Score: 45-41

[06:26] Team_045 possession (Score: 45-41)
Rudy Antetokounmpo attempts a 3Pt. Contested by Evan Carter (4.7 feet, ZONE). Rudy Antetokounmpo misses. Rebound secured by Kyrie Ming.

[06:14] Team_095 possession (Score: 45-41)
Dejounte Hyland drives and kicks out. Kyrie Ming attempts a Midrange. Contested by Trae Russell (6.0 feet, ZONE). Kyrie Ming misses. Rebound secured by Zion Butler.

[05:59] Team_045 possession (Score: 45-41)
Zion Butler attempts a Layup. Contested by Immanuel Middleton (5.8 feet, ZONE). Zion Butler misses. Rebound secured by Kyrie Ming.

[05:45] Team_095 possession (Score: 45-41)
Shaquille Ball attempts a Layup. BLOCKED BY ZION BUTLER! Ball is loose! Rebound secured by DeMar Turner.

[05:33] Team_045 possession (Score: 45-41)
Trae Russell attempts a 3Pt. Contested by Evan Carter (5.0 feet, ZONE). Trae Russell misses. Rebound secured by Evan Carter.

[05:19] Team_095 possession (Score: 45-41)
Dejounte Hyland attempts a 3Pt. Contested by Cole Simons (4.2 feet, ZONE). Dejounte Hyland misses. Rebound secured by Cole Simons.

[05:08] Team_045 possession (Score: 45-41)
FOUL! Shooting foul on Evan Carter. Trae Russell to the line for 3 free throws. [Team fouls: 1] (Evan Carter: 1 personal fouls)   FT 1/3: GOOD   FT 2/3: GOOD   FT 3/3: GOOD Trae Russell makes 3/3 from the line.
Score: 48-41

[04:49] Team_095 possession (Score: 48-41)
Dejounte Hyland attempts a 3Pt. Contested by Rudy Antetokounmpo (5.5 feet, MAN). DEJOUNTE HYLAND MAKES IT! Assist: Kyrie Ming
Score: 48-44

[04:30] Team_045 possession (Score: 48-44)
DeMar Turner attempts a Midrange. Contested by Immanuel Middleton (6.0 feet, MAN). DEMAR TURNER MAKES IT!
Score: 50-44

[04:15] Team_095 possession (Score: 50-44)
Kyrie Ming attempts a Layup. Contested by Zion Butler (4.7 feet, MAN). Kyrie Ming misses. Rebound secured by Zion Butler.

[04:03] Team_045 possession (Score: 50-44)
DeMar Turner attempts a Midrange. Contested by Dejounte Hyland (5.9 feet, ZONE). DeMar Turner misses. Rebound secured by Evan Carter.

[03:49] Team_095 possession (Score: 50-44)
Shaquille Ball attempts a Midrange. Contested by Zion Butler (4.6 feet, ZONE). Shaquille Ball misses. Offensive rebound by Evan Carter! Evan Carter kicks it out.

[03:32] Team_095 possession (Score: 50-44)
Evan Carter drives to the basket... FOUL! Offensive foul on Evan Carter! Cole Simons drew the charge! [Team fouls: 2] (Evan Carter: 2 personal fouls) TURNOVER! (dead ball)

[03:14] Team_045 possession (Score: 50-44)
DeMar Turner attempts a Layup. Wide open! Immanuel Middleton is 6.1 feet away. [ZONE] DeMar Turner misses. Offensive rebound by Zion Butler! Zion Butler puts it back in!
Score: 52-44

[02:56] Team_095 possession (Score: 52-44)
Kyrie Ming attempts a Layup. BLOCKED BY ZION BUTLER! Ball deflects out of bounds off Kyrie Ming.

[02:40] Team_045 possession (Score: 52-44)
FOUL! Shooting foul on Evan Carter. Cole Simons to the line for 2 free throws. [Team fouls: 3] (Evan Carter: 3 personal fouls)   FT 1/2: MISS   FT 2/2: GOOD Cole Simons makes 1/2 from the line.
Score: 53-44

[02:30] Team_095 possession (Score: 53-44)
Kyrie Ming attempts a Midrange. Wide open! DeMar Turner is 6.4 feet away. [ZONE] Kyrie Ming misses. Rebound secured by Cole Simons.

[02:18] Team_045 possession (Score: 53-44)
FOUL! Holding foul on Kyrie Ming. [Team fouls: 4] No free throws, side out. (Kyrie Ming: 1 personal fouls)

[02:03] Team_045 possession (Score: 53-44)
Trae Russell loses control! Ball rolls out of bounds! TURNOVER! (dead ball)

[02:03] Substitution (Team_045): Rudy Antetokounmpo OUT → John Wagner IN (stamina_rule2)

[02:03] Substitution (Team_045): Trae Russell OUT → Julius James IN (stamina_rule2)

[02:03] Substitution (Team_045): Cole Simons OUT → Gary Towns IN (stamina_rule2)

[02:03] Substitution (Team_045): DeMar Turner OUT → Tim Sexton IN (stamina_rule2)

[02:03] Substitution (Team_045): Zion Butler OUT → Stephen Paul IN (stamina_rule2)

[02:03] Substitution (Team_095): Dejounte Hyland OUT → Kyle Poole IN (stamina_rule2)

[02:03] Substitution (Team_095): Shaquille Ball OUT → Cade Beal IN (stamina_rule2)

[02:03] Substitution (Team_095): Evan Carter OUT → Tobias Wagner IN (stamina_rule2)

[02:03] Substitution (Team_095): Immanuel Middleton OUT → Gary Davis IN (stamina_rule2)

[02:03] Substitution (Team_095): Kyrie Ming OUT → DeMar McCollum IN (stamina_rule2)

[01:46] Team_095 possession (Score: 53-44)
DeMar McCollum attempts a Layup. Contested by Stephen Paul (5.1 feet, MAN). DEMAR MCCOLLUM MAKES IT!
Score: 53-46

[01:32] Team_045 possession (Score: 53-46)
FOUL! Holding foul on Gary Davis. [IN THE BONUS! 5 team fouls] Tim Sexton to the line for 2 free throws. (Gary Davis: 1 personal fouls)   FT 1/2: GOOD   FT 2/2: GOOD Tim Sexton makes 2/2 from the line.
Score: 55-46

[01:18] Team_095 possession (Score: 55-46)
FOUL! Holding foul on Tim Sexton. [IN THE BONUS! 5 team fouls] Gary Davis to the line for 2 free throws. (Tim Sexton: 1 personal fouls)   FT 1/2: GOOD   FT 2/2: GOOD Gary Davis makes 2/2 from the line.
Score: 55-48

[01:02] Team_045 possession (Score: 55-48)
Tim Sexton attempts a Layup. Contested by DeMar McCollum (5.3 feet, ZONE). TIM SEXTON MAKES IT! Assist: John Wagner
Score: 57-48

[00:45] Team_095 possession (Score: 57-48)
FOUL! Holding foul on John Wagner. [IN THE BONUS! 6 team fouls] Kyle Poole to the line for 2 free throws. (John Wagner: 1 personal fouls)   FT 1/2: GOOD   FT 2/2: GOOD Kyle Poole makes 2/2 from the line.
Score: 57-50

[00:32] Team_045 possession (Score: 57-50)
Tim Sexton attempts a Midrange. Contested by Tobias Wagner (4.2 feet, ZONE). Tim Sexton misses. Rebound secured by Gary Davis.

[00:20] Team_095 possession (Score: 57-50)
Kyle Poole attempts a 3Pt. Contested by Tim Sexton (4.9 feet, ZONE). KYLE POOLE MAKES IT! Assist: Tobias Wagner
Score: 57-53

[00:02] Team_045 possession (Score: 57-53)
Stephen Paul drives, picks up DeMar McCollum. Help arrives from Kyle Poole! Stephen Paul attempts a Dunk. Contested by Kyle Poole (4.8 feet, ZONE). STEPHEN PAUL MAKES IT! Assist: Gary Towns
Score: 59-53

================================================================================
                              2ND QUARTER COMPLETE                              
================================================================================

2ND QUARTER SCORE: Team_045 25, Team_095 28

BOX SCORE:
================================================================================

Team_045
--------------------------------------------------------------------------------
Player                MIN  PTS  REB  AST  TO      FG   FG%      3P   3P%
--------------------------------------------------------------------------------
Zion Butler            20    6    5    0   0   3/5    60.0     0/0   0.0
DeMar Turner           22    4    1    1   0   2/3    66.7     0/0   0.0
Tim Sexton              2    4    0    0   0   2/3    66.7     0/0   0.0
Trae Russell           20    3    0    2   0   1/5    20.0     0/0   0.0
Rudy Antetokounmpo     22    3    0    0   0   1/2    50.0     0/0   0.0
Cole Simons            20    3    3    0   0   2/4    50.0     0/0   0.0
Stephen Paul            4    2    0    0   0   1/1   100.0     0/0   0.0
John Wagner             2    0    0    1   0   0/0     0.0     0/0   0.0
Gary Towns              4    0    0    1   0   0/0     0.0     0/0   0.0

TEAM: FG: 12/23 (52.2%), 3PT: 2/7 (28.6%), REB: 9 (1 off, 8 def), AST: 5, TO: 1
TEAM FOULS: 6 [Team_095 in BONUS]


Team_095
--------------------------------------------------------------------------------
Player                MIN  PTS  REB  AST  TO      FG   FG%      3P   3P%
--------------------------------------------------------------------------------
Dejounte Hyland        20    6    2    0   0   2/5    40.0     0/0   0.0
Kyrie Ming             20    5    3    1   0   2/5    40.0     0/0   0.0
Immanuel Middleton     20    5    0    0   0   2/2   100.0     0/0   0.0
Kyle Poole              4    5    0    0   0   2/2   100.0     0/0   0.0
Evan Carter            20    3    6    0   0   1/2    50.0     0/0   0.0
DeMar McCollum          4    2    0    0   0   1/1   100.0     0/0   0.0
Gary Davis              4    2    1    0   0   1/1   100.0     0/0   0.0
Shaquille Ball         22    0    0    1   0   0/2     0.0     0/0   0.0
Tobias Wagner           4    0    0    1   0   0/0     0.0     0/0   0.0

TEAM: FG: 11/20 (55.0%), 3PT: 5/9 (55.6%), REB: 12 (1 off, 11 def), AST: 3, TO: 3
TEAM FOULS: 5 [Team_045 in BONUS]

================================================================================

================================================================================
                       3RD QUARTER - Team_045 vs Team_095                       
================================================================================

[12:00] Team_045 possession (Score: 59-53)
DeMar Turner drives, Immanuel Middleton stays with him. DeMar Turner attempts a Layup. Contested by Immanuel Middleton (5.2 feet, MAN). DEMAR TURNER MAKES IT! Assist: Trae Russell
Score: 61-53

[11:43] Team_095 possession (Score: 61-53)
FOUL! Shooting foul on Zion Butler. Kyrie Ming to the line for 2 free throws. [Team fouls: 1] (Zion Butler: 1 personal fouls)   FT 1/2: GOOD   FT 2/2: GOOD Kyrie Ming makes 2/2 from the line.
Score: 61-55

[11:26] Team_045 possession (Score: 61-55)
Cole Simons attempts a 3Pt. Contested by Evan Carter (4.5 feet, ZONE). Cole Simons misses. Rebound secured by Evan Carter.

[11:10] Team_095 possession (Score: 61-55)
FOUL! Holding foul on Cole Simons. [Team fouls: 2] No free throws, side out. (Cole Simons: 1 personal fouls)

[10:53] Team_095 possession (Score: 61-55)
Kyrie Ming drives to the basket... Kyrie Ming throws a bad pass out of bounds! TURNOVER! (dead ball)

[10:38] Team_045 possession (Score: 61-55)
FOUL! Reach-in foul on Kyrie Ming during the drive. [Team fouls: 1] No free throws, side out. (Kyrie Ming: 1 personal fouls)

[10:20] Team_045 possession (Score: 61-55)
Rudy Antetokounmpo makes the Layup and draws the foul on Immanuel Middleton! And-1! Rudy Antetokounmpo to the line for 1. [Team fouls: 2] (Immanuel Middleton: 1 personal fouls)   FT 1/1: GOOD Rudy Antetokounmpo makes 1/1 from the line.
Score: 64-55

[10:09] Team_095 possession (Score: 64-55)
Evan Carter loses the ball! Stripped by Cole Simons! TURNOVER! (live ball)

[09:57] Team_045 possession (Score: 64-55)
Zion Butler throws a bad pass out of bounds! TURNOVER! (dead ball)

[09:42] Team_095 possession (Score: 64-55)
Shaquille Ball attempts a 3Pt. Contested by Cole Simons (3.3 feet, ZONE). Shaquille Ball misses. Rebound secured by DeMar Turner.

[09:26] Team_045 possession (Score: 64-55)
DeMar Turner attempts a Midrange. Contested by Immanuel Middleton (5.2 feet, ZONE). DeMar Turner misses. Rebound secured by Shaquille Ball.

[09:09] Team_095 possession (Score: 64-55)
Evan Carter attempts a 3Pt. Contested by Cole Simons (3.5 feet, MAN). Evan Carter misses. Offensive rebound by Evan Carter! Evan Carter puts it back in!
Score: 64-57

[08:51] Team_045 possession (Score: 64-57)
DeMar Turner attempts a 3Pt. Contested by Immanuel Middleton (5.2 feet, MAN). DEMAR TURNER MAKES IT! Assist: Zion Butler
Score: 67-57

[08:34] Team_095 possession (Score: 67-57)
FOUL! Shooting foul on Rudy Antetokounmpo. Dejounte Hyland to the line for 3 free throws. [Team fouls: 3] (Rudy Antetokounmpo: 1 personal fouls)   FT 1/3: MISS   FT 2/3: GOOD   FT 3/3: GOOD Dejounte Hyland makes 2/3 from the line.
Score: 67-59

[08:21] Team_045 possession (Score: 67-59)
Rudy Antetokounmpo attempts a 3Pt. Contested by Evan Carter (4.2 feet, ZONE). Rudy Antetokounmpo misses. Rebound secured by Shaquille Ball.

[08:03] Team_095 possession (Score: 67-59)
Immanuel Middleton drives, Zion Butler stays with him. Immanuel Middleton attempts a Layup. Contested by Zion Butler (3.2 feet, ZONE). Immanuel Middleton misses. Offensive rebound by Evan Carter! Evan Carter's putback is no good. Rebound secured by DeMar Turner.

[07:46] Team_045 possession (Score: 67-59)
FOUL! Holding foul on Kyrie Ming. [Team fouls: 3] No free throws, side out. (Kyrie Ming: 2 personal fouls)

[07:32] Team_045 possession (Score: 67-59)
DeMar Turner drives and kicks out. Zion Butler attempts a Midrange. Contested by Kyrie Ming (5.1 feet, MAN). Zion Butler misses. Rebound secured by Shaquille Ball.

[07:19] Team_095 possession (Score: 67-59)
Dejounte Hyland attempts a 3Pt. Contested by Rudy Antetokounmpo (4.4 feet, MAN). DEJOUNTE HYLAND MAKES IT! Assist: Immanuel Middleton
Score: 67-62

[07:06] Team_045 possession (Score: 67-62)
FOUL! Holding foul on Dejounte Hyland. [Team fouls: 4] No free throws, side out. (Dejounte Hyland: 1 personal fouls)

[06:50] Team_045 possession (Score: 67-62)
FOUL! Shooting foul on Immanuel Middleton. DeMar Turner to the line for 2 free throws. [BONUS: 5 team fouls] (Immanuel Middleton: 2 personal fouls)   FT 1/2: GOOD   FT 2/2: GOOD DeMar Turner makes 2/2 from the line.
Score: 69-62

[06:38] Team_095 possession (Score: 69-62)
Evan Carter attempts a Layup. Contested by Zion Butler (3.5 feet, ZONE). EVAN CARTER MAKES IT! Assist: Immanuel Middleton
Score: 69-64

[06:20] Team_045 possession (Score: 69-64)
Zion Butler makes the Dunk and draws the foul on Dejounte Hyland! And-1! Zion Butler to the line for 1. [BONUS: 6 team fouls] (Dejounte Hyland: 2 personal fouls)   FT 1/1: GOOD Zion Butler makes 1/1 from the line.
Score: 72-64

[06:01] Team_095 possession (Score: 72-64)
Immanuel Middleton drives, Zion Butler stays with him. Immanuel Middleton attempts a Layup. Contested by Zion Butler (3.2 feet, MAN). IMMANUEL MIDDLETON MAKES IT! Assist: Shaquille Ball
Score: 72-66

[05:52] Team_045 possession (Score: 72-66)
Trae Russell drives and kicks out. FOUL! Shooting foul on Evan Carter. Zion Butler to the line for 2 free throws. [BONUS: 7 team fouls] (Evan Carter: 1 personal fouls)   FT 1/2: GOOD   FT 2/2: GOOD Zion Butler makes 2/2 from the line.
Score: 74-66

[05:41] Team_095 possession (Score: 74-66)
FOUL! Reach-in foul on Zion Butler during the drive. [Team fouls: 4] No free throws, side out. (Zion Butler: 2 personal fouls)

[05:22] Team_095 possession (Score: 74-66)
FOUL! Reach-in foul on Zion Butler during the drive. [IN THE BONUS! 5 team fouls] Evan Carter to the line for 2 free throws. (Zion Butler: 3 personal fouls)   FT 1/2: GOOD   FT 2/2: GOOD Evan Carter makes 2/2 from the line.
Score: 74-68

[05:03] Team_045 possession (Score: 74-68)
FOUL! Reach-in foul on Immanuel Middleton during the drive. [IN THE BONUS! 8 team fouls] Trae Russell to the line for 2 free throws. (Immanuel Middleton: 3 personal fouls)   FT 1/2: GOOD   FT 2/2: GOOD Trae Russell makes 2/2 from the line.
Score: 76-68

[04:48] Team_095 possession (Score: 76-68)
Kyrie Ming drives and kicks out. Kyrie Ming attempts a 3Pt. Contested by Cole Simons (3.3 feet, ZONE). Kyrie Ming misses. Offensive rebound by Evan Carter! Evan Carter's putback is no good. Offensive rebound by Dejounte Hyland! Dejounte Hyland kicks it out.

[04:30] Team_095 possession (Score: 76-68)
Evan Carter drives, picks up Cole Simons. Help arrives from Rudy Antetokounmpo! Evan Carter attempts a Dunk. Contested by Rudy Antetokounmpo (3.5 feet, MAN). Evan Carter misses. Rebound secured by Zion Butler.

[04:12] Team_045 possession (Score: 76-68)
Trae Russell attempts a Midrange. Contested by Immanuel Middleton (5.5 feet, ZONE). Trae Russell misses. FOUL! Loose ball foul on Dejounte Hyland during the rebound battle. [IN THE BONUS! 9 team fouls] Zion Butler to the line for 2 free throws. (Dejounte Hyland: 3 personal fouls)   FT 1/2: MISS   FT 2/2: GOOD Zion Butler makes 1/2 from the line.
Score: 77-68

[03:58] Team_095 possession (Score: 77-68)
Immanuel Middleton throws a bad pass out of bounds! TURNOVER! (dead ball)

[03:42] Team_045 possession (Score: 77-68)
Cole Simons makes the Layup and draws the foul on Evan Carter! And-1! Cole Simons to the line for 1. [BONUS: 10 team fouls] (Evan Carter: 2 personal fouls)   FT 1/1: GOOD Cole Simons makes 1/1 from the line.
Score: 80-68

[03:25] Team_095 possession (Score: 80-68)
Immanuel Middleton attempts a Midrange. Contested by Zion Butler (3.4 feet, ZONE). IMMANUEL MIDDLETON MAKES IT!
Score: 80-70

[03:10] Team_045 possession (Score: 80-70)
Rudy Antetokounmpo makes the Layup and draws the foul on Dejounte Hyland! And-1! Rudy Antetokounmpo to the line for 1. [BONUS: 11 team fouls] (Dejounte Hyland: 4 personal fouls)   FT 1/1: GOOD Rudy Antetokounmpo makes 1/1 from the line.
Score: 83-70

[02:53] Team_095 possession (Score: 83-70)
FOUL! Holding foul on Cole Simons. [IN THE BONUS! 6 team fouls] Evan Carter to the line for 2 free throws. (Cole Simons: 2 personal fouls)   FT 1/2: MISS   FT 2/2: MISS Evan Carter makes 0/2 from the line. Rebound secured by Zion Butler.

[02:43] Team_045 possession (Score: 83-70)
Trae Russell makes the Layup and draws the foul on Shaquille Ball! And-1! Trae Russell to the line for 1. [BONUS: 12 team fouls] (Shaquille Ball: 1 personal fouls)   FT 1/1: GOOD Trae Russell makes 1/1 from the line.
Score: 86-70

[02:27] Team_095 possession (Score: 86-70)
Kyrie Ming makes the Layup and draws the foul on Zion Butler! And-1! Kyrie Ming to the line for 1. [BONUS: 7 team fouls] (Zion Butler: 4 personal fouls)   FT 1/1: GOOD Kyrie Ming makes 1/1 from the line.
Score: 86-73

[02:10] Team_045 possession (Score: 86-73)
DeMar Turner attempts a Midrange. Contested by Immanuel Middleton (5.4 feet, ZONE). DEMAR TURNER MAKES IT! Assist: Cole Simons
Score: 88-73

[01:53] Team_095 possession (Score: 88-73)
FOUL! Reach-in foul on Zion Butler during the drive. [IN THE BONUS! 8 team fouls] Kyrie Ming to the line for 2 free throws. (Zion Butler: 5 personal fouls)   FT 1/2: GOOD   FT 2/2: GOOD Kyrie Ming makes 2/2 from the line.
Score: 88-75

[01:41] Team_045 possession (Score: 88-75)
Rudy Antetokounmpo attempts a 3Pt. Contested by Evan Carter (4.4 feet, ZONE). RUDY ANTETOKOUNMPO MAKES IT! Assist: Trae Russell
Score: 91-75

[01:28] Team_095 possession (Score: 91-75)
Immanuel Middleton attempts a Midrange. Contested by DeMar Turner (5.1 feet, MAN). IMMANUEL MIDDLETON MAKES IT! Assist: Evan Carter
Score: 91-77

[01:14] Team_045 possession (Score: 91-77)
Rudy Antetokounmpo attempts a Midrange. Contested by Evan Carter (4.5 feet, ZONE). Rudy Antetokounmpo misses. Rebound secured by Evan Carter.

[00:59] Team_095 possession (Score: 91-77)
Immanuel Middleton attempts a 3Pt. Contested by Cole Simons (3.7 feet, ZONE). Immanuel Middleton misses. Rebound secured by Zion Butler.

[00:44] Team_045 possession (Score: 91-77)
Cole Simons attempts a Layup. BLOCKED BY IMMANUEL MIDDLETON! Ball deflects out of bounds off Cole Simons.

[00:28] Team_095 possession (Score: 91-77)
Kyrie Ming attempts a Midrange. Contested by Zion Butler (4.1 feet, MAN). Kyrie Ming misses. Rebound secured by Cole Simons.

[00:15] Team_045 possession (Score: 91-77)
Rudy Antetokounmpo drives to the basket... Rudy Antetokounmpo loses the ball! Stripped by Immanuel Middleton! TURNOVER! (live ball)

[00:05] Team_095 possession (Score: 91-77)
Shaquille Ball attempts a 3Pt. Contested by Cole Simons (3.8 feet, ZONE). Shaquille Ball misses. Rebound secured by DeMar Turner.

================================================================================
                              3RD QUARTER COMPLETE                              
================================================================================

3RD QUARTER SCORE: Team_045 32, Team_095 24

BOX SCORE:
================================================================================

Team_045
--------------------------------------------------------------------------------
Player                MIN  PTS  REB  AST  TO      FG   FG%      3P   3P%
--------------------------------------------------------------------------------
DeMar Turner           35    9    3    0   0   4/6    66.7     0/0   0.0
Rudy Antetokounmpo     35    9    0    0   0   3/5    60.0     0/0   0.0
Zion Butler            33    6    3    1   0   3/3   100.0     0/0   0.0
Trae Russell           33    5    0    2   0   2/2   100.0     0/0   0.0
Cole Simons            33    3    1    1   0   1/3    33.3     0/0   0.0

TEAM: FG: 13/19 (68.4%), 3PT: 2/4 (50.0%), REB: 6 (0 off, 6 def), AST: 4, TO: 2
TEAM FOULS: 8 [Team_095 in BONUS]


Team_095
--------------------------------------------------------------------------------
Player                MIN  PTS  REB  AST  TO      FG   FG%      3P   3P%
--------------------------------------------------------------------------------
Kyrie Ming             33    7    0    0   0   3/4    75.0     0/0   0.0
Evan Carter            33    6    3    1   0   3/4    75.0     0/0   0.0
Immanuel Middleton     33    6    0    2   0   3/5    60.0     0/0   0.0
Dejounte Hyland        33    5    1    0   0   2/2   100.0     0/0   0.0
Shaquille Ball         35    0    3    1   0   0/2     0.0     0/0   0.0

TEAM: FG: 11/18 (61.1%), 3PT: 3/6 (50.0%), REB: 8 (3 off, 5 def), AST: 4, TO: 3
TEAM FOULS: 12 [Team_045 in BONUS]

================================================================================

================================================================================
                       4TH QUARTER - Team_045 vs Team_095                       
================================================================================

[12:00] Team_045 possession (Score: 91-77)
Cole Simons attempts a 3Pt. Contested by Evan Carter (4.7 feet, ZONE). COLE SIMONS MAKES IT! Assist: Rudy Antetokounmpo
Score: 94-77

[11:47] Team_095 possession (Score: 94-77)
Immanuel Middleton drives and kicks out. Evan Carter attempts a Midrange. Contested by DeMar Turner (5.2 feet, ZONE). EVAN CARTER MAKES IT! Assist: Shaquille Ball
Score: 94-79

[11:36] Team_045 possession (Score: 94-79)
Trae Russell attempts a Midrange. Contested by Shaquille Ball (5.1 feet, MAN). TRAE RUSSELL MAKES IT!
Score: 96-79

[11:24] Team_095 possession (Score: 96-79)
Evan Carter attempts a Midrange. Contested by Cole Simons (3.9 feet, MAN). EVAN CARTER MAKES IT! Assist: Dejounte Hyland
Score: 96-81

[11:08] Team_045 possession (Score: 96-81)
FOUL! Shooting foul on Dejounte Hyland. Cole Simons to the line for 2 free throws. [Team fouls: 1] (Dejounte Hyland: 1 personal fouls)   FT 1/2: GOOD   FT 2/2: MISS Cole Simons makes 1/2 from the line. Rebound secured by Dejounte Hyland.
Score: 97-81

[10:52] Team_095 possession (Score: 97-81)
FOUL! Holding foul on Rudy Antetokounmpo. [Team fouls: 1] No free throws, side out. (Rudy Antetokounmpo: 1 personal fouls)

[10:34] Team_095 possession (Score: 97-81)
Shaquille Ball attempts a 3Pt. Contested by Cole Simons (3.8 feet, ZONE). Shaquille Ball misses. Rebound secured by Cole Simons.

[10:22] Team_045 possession (Score: 97-81)
Rudy Antetokounmpo attempts a 3Pt. Contested by Dejounte Hyland (5.6 feet, MAN). RUDY ANTETOKOUNMPO MAKES IT! Assist: Trae Russell
Score: 100-81

[10:08] Team_095 possession (Score: 100-81)
Shaquille Ball drives, Cole Simons stays with him. Shaquille Ball attempts a Dunk. Contested by Cole Simons (3.8 feet, MAN). Shaquille Ball misses. Offensive rebound by Dejounte Hyland! Dejounte Hyland kicks it out.

[09:56] Team_095 possession (Score: 100-81)
Kyrie Ming attempts a Midrange. Contested by Zion Butler (4.2 feet, MAN). Kyrie Ming misses. Rebound secured by Zion Butler.

[09:43] Team_045 possession (Score: 100-81)
Trae Russell makes the 3Pt and draws the foul on Shaquille Ball! And-1! Trae Russell to the line for 1. [Team fouls: 2] (Shaquille Ball: 1 personal fouls)   FT 1/1: GOOD Trae Russell makes 1/1 from the line.
Score: 104-81

[09:27] Team_095 possession (Score: 104-81)
Immanuel Middleton drives, DeMar Turner stays with him. Immanuel Middleton attempts a Dunk. Contested by DeMar Turner (5.3 feet, MAN). IMMANUEL MIDDLETON MAKES IT! Assist: Evan Carter
Score: 104-83

[09:09] Team_045 possession (Score: 104-83)
Cole Simons drives, Evan Carter stays with him. Cole Simons attempts a Layup. Contested by Evan Carter (5.0 feet, MAN). COLE SIMONS MAKES IT! Assist: DeMar Turner
Score: 106-83

[08:54] Team_095 possession (Score: 106-83)
Kyrie Ming attempts a Midrange. Contested by DeMar Turner (5.6 feet, ZONE). Kyrie Ming misses. Offensive rebound by Evan Carter! Evan Carter's putback is no good. Rebound secured by Zion Butler.

[08:40] Team_045 possession (Score: 106-83)
FOUL! Reach-in foul on Immanuel Middleton during the drive. [Team fouls: 3] No free throws, side out. (Immanuel Middleton: 1 personal fouls)

[08:28] Team_045 possession (Score: 106-83)
Cole Simons attempts a 3Pt. Contested by Evan Carter (5.0 feet, MAN). COLE SIMONS MAKES IT!
Score: 109-83

[08:14] Team_095 possession (Score: 109-83)
Kyrie Ming attempts a Midrange. Contested by Cole Simons (4.3 feet, ZONE). Kyrie Ming misses. Rebound secured by Zion Butler.

[07:59] Team_045 possession (Score: 109-83)
Rudy Antetokounmpo attempts a 3Pt. Contested by Evan Carter (4.9 feet, ZONE). Rudy Antetokounmpo misses. Rebound secured by Evan Carter.

[07:45] Team_095 possession (Score: 109-83)
Shaquille Ball makes the Layup and draws the foul on Zion Butler! And-1! Shaquille Ball to the line for 1. [Team fouls: 2] (Zion Butler: 1 personal fouls)   FT 1/1: GOOD Shaquille Ball makes 1/1 from the line.
Score: 109-86

[07:32] Team_045 possession (Score: 109-86)
Zion Butler attempts a 3Pt. Wide open! Kyrie Ming is 6.1 feet away. [MAN] Zion Butler misses. Rebound secured by Dejounte Hyland.

[07:20] Team_095 possession (Score: 109-86)
FOUL! Holding foul on Rudy Antetokounmpo. [Team fouls: 3] No free throws, side out. (Rudy Antetokounmpo: 2 personal fouls)

[07:03] Team_095 possession (Score: 109-86)
Evan Carter drives, Zion Butler stays with him. Evan Carter attempts a Dunk. Contested by Zion Butler (4.7 feet, ZONE). EVAN CARTER MAKES IT!
Score: 109-88

[06:43] Team_045 possession (Score: 109-88)
DeMar Turner drives, picks up Immanuel Middleton. Help arrives from Dejounte Hyland! DeMar Turner attempts a Dunk. Wide open! Dejounte Hyland is 6.1 feet away. [ZONE] DEMAR TURNER MAKES IT! Assist: Rudy Antetokounmpo
Score: 111-88

[06:28] Team_095 possession (Score: 111-88)
Kyrie Ming drives and kicks out. Shaquille Ball attempts a 3Pt. Wide open! Trae Russell is 6.3 feet away. [MAN] Shaquille Ball misses. Rebound secured by Cole Simons.

[06:11] Team_045 possession (Score: 111-88)
Rudy Antetokounmpo drives to the basket... FOUL! Offensive foul on Rudy Antetokounmpo! Dejounte Hyland drew the charge! [Team fouls: 4] (Rudy Antetokounmpo: 3 personal fouls) TURNOVER! (dead ball)

[05:55] Team_095 possession (Score: 111-88)
FOUL! Shooting foul on DeMar Turner. Evan Carter to the line for 2 free throws. [BONUS: 5 team fouls] (DeMar Turner: 1 personal fouls)   FT 1/2: GOOD   FT 2/2: MISS Evan Carter makes 1/2 from the line. Offensive rebound by Evan Carter! Evan Carter kicks it out.
Score: 111-89

[05:36] Team_095 possession (Score: 111-89)
Evan Carter drives to the basket... Evan Carter loses the ball! Stripped by Cole Simons! TURNOVER! (live ball)

[05:20] Team_045 possession (Score: 111-89)
DeMar Turner drives, Immanuel Middleton stays with him. DeMar Turner attempts a Dunk. Wide open! Immanuel Middleton is 6.3 feet away. [MAN] DEMAR TURNER MAKES IT! Assist: Cole Simons
Score: 113-89

[05:03] Team_095 possession (Score: 113-89)
Kyrie Ming drives to the basket... Kyrie Ming loses control! Ball rolls out of bounds! TURNOVER! (dead ball)

[05:03] Substitution (Team_045): Rudy Antetokounmpo OUT → John Wagner IN (stamina_rule2)

[05:03] Substitution (Team_045): Trae Russell OUT → Julius James IN (stamina_rule2)

[05:03] Substitution (Team_045): Cole Simons OUT → Gary Towns IN (stamina_rule2)

[05:03] Substitution (Team_045): DeMar Turner OUT → Tim Sexton IN (stamina_rule2)

[05:03] Substitution (Team_045): Zion Butler OUT → Stephen Paul IN (stamina_rule2)

[05:03] Substitution (Team_095): Dejounte Hyland OUT → Kyle Poole IN (stamina_rule2)

[05:03] Substitution (Team_095): Shaquille Ball OUT → Cade Beal IN (stamina_rule2)

[05:03] Substitution (Team_095): Evan Carter OUT → Tobias Wagner IN (stamina_rule2)

[05:03] Substitution (Team_095): Immanuel Middleton OUT → Gary Davis IN (stamina_rule2)

[05:03] Substitution (Team_095): Kyrie Ming OUT → DeMar McCollum IN (stamina_rule2)

[04:48] Team_045 possession (Score: 113-89)
Stephen Paul drives to the basket... Stephen Paul loses control! Ball rolls out of bounds! TURNOVER! (dead ball)

[04:34] Team_095 possession (Score: 113-89)
Kyle Poole attempts a Midrange. Contested by Tim Sexton (4.9 feet, ZONE). Kyle Poole misses. Rebound secured by Tim Sexton.

[04:16] Team_045 possession (Score: 113-89)
Stephen Paul attempts a Layup. Contested by DeMar McCollum (4.8 feet, MAN). STEPHEN PAUL MAKES IT! Assist: Tim Sexton
Score: 115-89

[04:02] Team_095 possession (Score: 115-89)
Gary Davis drives, picks up Tim Sexton. Help arrives from Julius James! Gary Davis attempts a Dunk. Contested by Julius James (4.4 feet, MAN). Gary Davis misses. Rebound secured by Julius James.

[03:51] Team_045 possession (Score: 115-89)
Gary Towns attempts a 3Pt. Contested by Tobias Wagner (3.6 feet, MAN). Gary Towns misses. Rebound secured by DeMar McCollum.

[03:37] Team_095 possession (Score: 115-89)
FOUL! Shooting foul on John Wagner. Kyle Poole to the line for 3 free throws. [BONUS: 6 team fouls] (John Wagner: 1 personal fouls)   FT 1/3: GOOD   FT 2/3: MISS   FT 3/3: GOOD Kyle Poole makes 2/3 from the line.
Score: 115-91

[03:23] Team_045 possession (Score: 115-91)
FOUL! Holding foul on DeMar McCollum. [Team fouls: 4] No free throws, side out. (DeMar McCollum: 1 personal fouls)

[03:09] Team_045 possession (Score: 115-91)
Gary Towns drives to the basket... FOUL! Offensive foul on Gary Towns! DeMar McCollum drew the charge! [Team fouls: 7] (Gary Towns: 1 personal fouls) TURNOVER! (dead ball)

[03:00] Team_095 possession (Score: 115-91)
Tobias Wagner attempts a 3Pt. Contested by John Wagner (4.5 feet, ZONE). Tobias Wagner misses. Rebound secured by Julius James.

[02:43] Team_045 possession (Score: 115-91)
Tim Sexton throws a bad pass! Stolen by Gary Davis! TURNOVER! (live ball)

[02:27] Team_095 possession (Score: 115-91)
Tobias Wagner attempts a Midrange. Contested by Gary Towns (5.4 feet, MAN). TOBIAS WAGNER MAKES IT! Assist: Kyle Poole
Score: 115-93

[02:08] Team_045 possession (Score: 115-93)
Julius James attempts a Midrange. Contested by Tobias Wagner (3.9 feet, ZONE). Julius James misses. Offensive rebound by Tim Sexton! Tim Sexton kicks it out.

[01:53] Team_045 possession (Score: 115-93)
FOUL! Holding foul on Cade Beal. [IN THE BONUS! 5 team fouls] Julius James to the line for 2 free throws. (Cade Beal: 1 personal fouls)   FT 1/2: GOOD   FT 2/2: MISS Julius James makes 1/2 from the line. Rebound secured by DeMar McCollum.
Score: 116-93

[01:39] Team_095 possession (Score: 116-93)
FOUL! Reach-in foul on Tim Sexton during the drive. [IN THE BONUS! 8 team fouls] Gary Davis to the line for 2 free throws. (Tim Sexton: 1 personal fouls)   FT 1/2: GOOD   FT 2/2: GOOD Gary Davis makes 2/2 from the line.
Score: 116-95

[01:26] Team_045 possession (Score: 116-95)
Tim Sexton attempts a Midrange. Contested by Cade Beal (4.8 feet, ZONE). Tim Sexton misses. FOUL! Loose ball foul on Tobias Wagner during the rebound battle. [IN THE BONUS! 6 team fouls] Julius James to the line for 2 free throws. (Tobias Wagner: 1 personal fouls)   FT 1/2: GOOD   FT 2/2: GOOD Julius James makes 2/2 from the line.
Score: 118-95

[01:11] Team_095 possession (Score: 118-95)
Gary Davis attempts a Layup. Contested by Stephen Paul (4.3 feet, ZONE). GARY DAVIS MAKES IT! Assist: Kyle Poole
Score: 118-97

[00:56] Team_045 possession (Score: 118-97)
Stephen Paul attempts a Midrange. Contested by Tobias Wagner (3.7 feet, ZONE). Stephen Paul misses. Rebound secured by DeMar McCollum.

[00:40] Team_095 possession (Score: 118-97)
Kyle Poole attempts a 3Pt. Contested by John Wagner (4.5 feet, ZONE). Kyle Poole misses. Rebound secured by Tim Sexton.

[00:30] Team_045 possession (Score: 118-97)
FOUL! Holding foul on DeMar McCollum. [IN THE BONUS! 7 team fouls] Stephen Paul to the line for 2 free throws. (DeMar McCollum: 2 personal fouls)   FT 1/2: GOOD   FT 2/2: MISS Stephen Paul makes 1/2 from the line. Rebound secured by DeMar McCollum.
Score: 119-97

[00:16] Team_095 possession (Score: 119-97)
DeMar McCollum makes the Layup and draws the foul on Stephen Paul! And-1! DeMar McCollum to the line for 1. [BONUS: 9 team fouls] (Stephen Paul: 1 personal fouls)   FT 1/1: GOOD DeMar McCollum makes 1/1 from the line.
Score: 119-100

[00:01] Team_045 possession (Score: 119-100)
John Wagner makes the Layup and draws the foul on Tobias Wagner! And-1! John Wagner to the line for 1. [BONUS: 8 team fouls] (Tobias Wagner: 2 personal fouls)   FT 1/1: GOOD John Wagner makes 1/1 from the line.
Score: 122-100

================================================================================
                              4TH QUARTER COMPLETE                              
================================================================================

4TH QUARTER SCORE: Team_045 31, Team_095 23

BOX SCORE:
================================================================================

Team_045
--------------------------------------------------------------------------------
Player                MIN  PTS  REB  AST  TO      FG   FG%      3P   3P%
--------------------------------------------------------------------------------
Cole Simons            40    8    2    1   0   3/4    75.0     0/0   0.0
Trae Russell           40    6    0    1   0   2/2   100.0     0/0   0.0
DeMar Turner           42    4    0    1   0   2/2   100.0     0/0   0.0
Rudy Antetokounmpo     42    3    0    2   0   1/2    50.0     0/0   0.0
John Wagner             7    3    0    0   0   1/1   100.0     0/0   0.0
Stephen Paul            9    2    0    0   0   1/2    50.0     0/0   0.0
Julius James            9    2    2    0   0   1/1   100.0     0/0   0.0
Zion Butler            40    0    3    0   0   0/1     0.0     0/0   0.0
Tim Sexton              7    0    3    1   0   0/0     0.0     0/0   0.0
Gary Towns              9    0    0    0   0   0/1     0.0     0/0   0.0

TEAM: FG: 11/18 (61.1%), 3PT: 4/7 (57.1%), REB: 9 (1 off, 8 def), AST: 6, TO: 4
TEAM FOULS: 9 [Team_095 in BONUS]


Team_095
--------------------------------------------------------------------------------
Player                MIN  PTS  REB  AST  TO      FG   FG%      3P   3P%
--------------------------------------------------------------------------------
Evan Carter            40    6    2    1   0   3/3   100.0     0/0   0.0
Gary Davis              9    4    0    0   0   2/3    66.7     0/0   0.0
Shaquille Ball         42    3    0    1   0   1/2    50.0     0/0   0.0
DeMar McCollum          9    3    4    0   0   1/1   100.0     0/0   0.0
Immanuel Middleton     40    2    0    0   0   1/1   100.0     0/0   0.0
Kyle Poole              9    2    0    2   0   1/3    33.3     0/0   0.0
Tobias Wagner           9    2    0    0   0   1/2    50.0     0/0   0.0
Dejounte Hyland        40    0    3    1   0   0/0     0.0     0/0   0.0
Kyrie Ming             40    0    0    0   0   0/4     0.0     0/0   0.0

TEAM: FG: 10/19 (52.6%), 3PT: 1/4 (25.0%), REB: 10 (3 off, 7 def), AST: 5, TO: 2
TEAM FOULS: 8 [Team_045 in BONUS]

================================================================================

================================================================================
                               FULL GAME COMPLETE                               
================================================================================

FINAL SCORE: Team_045 122, Team_095 100

SCORING BY QUARTER:
--------------------------------------------------------------------------------
Team                     Q1     Q2     Q3     Q4    FINAL
--------------------------------------------------------------------------------
Team_045                 34     25     32     31      122
Team_095                 25     28     24     23      100
--------------------------------------------------------------------------------

FULL GAME BOX SCORE:
================================================================================

Team_045
--------------------------------------------------------------------------------
Player                MIN  PTS  REB  AST  TO      FG   FG%      3P   3P%      FT STL BLK
--------------------------------------------------------------------------------
Rudy Antetokounmpo     42   20    0    4   1   8/13   61.5   4/7    57.1   3/4     0   0
DeMar Turner           42   22    8    4   1  11/17   64.7   2/3    66.7   2/2     0   0
Trae Russell           40   16    0    7   1   9/15   60.0   2/6    33.3   7/7     0   0
Cole Simons            40   22    8    2   1   9/15   60.0   4/6    66.7   6/8     4   0
Zion Butler            40   22   15    2   1   5/9    55.6   0/2     0.0   5/6     1   2
Julius James            9    5    4    0   0   1/1   100.0   1/1   100.0   3/4     1   0
Gary Towns              9    0    0    1   2   0/1     0.0   0/1     0.0   0/0     0   0
Stephen Paul            9    4    1    0   0   2/4    50.0   0/1     0.0   1/2     0   0
John Wagner             7    3    0    1   0   1/1   100.0   0/0     0.0   1/1     0   0
Tim Sexton              7    4    3    1   1   2/3    66.7   0/0     0.0   2/2     0   0

TEAM: FG: 49/82 (59.8%), 3PT: 13/27 (48.1%), REB: 37 (4 off, 33 def), AST: 22, TO: 8


Team_095
--------------------------------------------------------------------------------
Player                MIN  PTS  REB  AST  TO      FG   FG%      3P   3P%      FT STL BLK
--------------------------------------------------------------------------------
Shaquille Ball         42    3    6    5   4   1/7    14.3   0/4     0.0   1/2     0   0
Dejounte Hyland        40   24    8    2   1   9/16   56.2   6/11   54.5   6/7     0   0
Evan Carter            40   17   13    3   2   7/10   70.0   2/4    50.0   3/6     0   0
Immanuel Middleton     40   13    0    3   2   7/10   70.0   1/3    33.3   0/0     1   1
Kyrie Ming             40   18    3    1   0   8/18   44.4   0/0     0.0   8/8     0   1
Kyle Poole              9    7    0    2   0   2/5    40.0   2/4    50.0   4/5     0   0
Tobias Wagner           9    2    0    1   1   1/3    33.3   0/2     0.0   0/0     0   1
Gary Davis              9    6    1    0   0   2/3    66.7   0/0     0.0   4/4     1   0
DeMar McCollum          9    7    6    0   0   2/2   100.0   0/0     0.0   3/3     0   0
Cade Beal               7    0    0    0   0   0/0     0.0   0/0     0.0   0/0     0   0

TEAM: FG: 42/78 (53.8%), 3PT: 11/28 (39.3%), REB: 39 (7 off, 32 def), AST: 17, TO: 10

================================================================================
