================================================================================
                        FULL GAME - Team_089 vs Team_075                        
================================================================================

================================================================================
                       1ST QUARTER - Team_089 vs Team_075                       
================================================================================

[12:00] Team_089 possession (Score: 0-0)
FOUL! Reach-in foul on Derrick Stewart during the drive. [Team fouls: 1] No free throws, side out. (Derrick Stewart: 1 personal fouls)

[11:44] Team_089 possession (Score: 0-0)
Allen Mobley loses control! Ball rolls out of bounds! TURNOVER! (dead ball)

[11:26] Team_075 possession (Score: 0-0)
Myles Barrett attempts a 3Pt. Contested by Jordan Brogdon (3.4 feet, ZONE). Myles Barrett misses. Rebound secured by Jalen Jackson.

[11:12] Team_089 possession (Score: 0-0)
Terry Simmons drives, picks up Derrick Stewart. Help arrives from Larry McCollum! Terry Simmons attempts a Dunk. Contested by Larry McCollum (5.1 feet, ZONE). Terry Simmons misses. Rebound secured by Derrick Stewart.

[11:01] Team_075 possession (Score: 0-0)
Kawhi Ingram drives to the basket... Kawhi Ingram throws a bad pass! Stolen by Jalen Jackson! TURNOVER! (live ball)

[10:50] Team_089 possession (Score: 0-0)
Allen Mobley attempts a 3Pt. Contested by Myles Barrett (5.9 feet, MAN). ALLEN MOBLEY MAKES IT! Assist: Jalen Jackson
Score: 3-0

[10:34] Team_075 possession (Score: 3-0)
Larry McCollum drives, Terry Simmons stays with him. Larry McCollum attempts a Layup. Contested by Terry Simmons (3.6 feet, ZONE). Larry McCollum misses. Rebound secured by Rudy Smith.

[10:20] Team_089 possession (Score: 3-0)
FOUL! Holding foul on Derrick Stewart. [Team fouls: 2] No free throws, side out. (Derrick Stewart: 2 personal fouls)

[10:11] Team_089 possession (Score: 3-0)
Allen Mobley attempts a 3Pt. Contested by Myles Barrett (5.9 feet, MAN). ALLEN MOBLEY MAKES IT! Assist: Terry Simmons
Score: 6-0

[09:54] Team_075 possession (Score: 6-0)
FOUL! Holding foul on Allen Mobley. [Team fouls: 1] No free throws, side out. (Allen Mobley: 1 personal fouls)

[09:35] Team_075 possession (Score: 6-0)
FOUL! Offensive foul on Larry McCollum! Jordan Brogdon drew the charge! [Team fouls: 3] (Larry McCollum: 1 personal fouls) TURNOVER! (dead ball)

[09:21] Team_089 possession (Score: 6-0)
FOUL! Shooting foul on Derrick Stewart. Rudy Smith to the line for 2 free throws. [Team fouls: 4] (Derrick Stewart: 3 personal fouls)   FT 1/2: GOOD   FT 2/2: GOOD Rudy Smith makes 2/2 from the line.
Score: 8-0

[09:07] Team_075 possession (Score: 8-0)
Kawhi Ingram drives, Jalen Jackson stays with him. Kawhi Ingram attempts a Dunk. Contested by Jalen Jackson (4.5 feet, MAN). Kawhi Ingram misses. Rebound secured by Rudy Smith.

[08:48] Team_089 possession (Score: 8-0)
Jordan Brogdon drives, Derrick Stewart stays with him. Jordan Brogdon attempts a Layup. Contested by Derrick Stewart (4.5 feet, ZONE). Jordan Brogdon misses. Rebound secured by Klay Jokic.

[08:31] Team_075 possession (Score: 8-0)
Kawhi Ingram attempts a 3Pt. Contested by Jordan Brogdon (3.0 feet, ZONE). KAWHI INGRAM MAKES IT! Assist: Myles Barrett
Score: 8-3

[08:13] Team_089 possession (Score: 8-3)
Jalen Jackson attempts a 3Pt. Contested by Kawhi Ingram (4.3 feet, MAN). Jalen Jackson misses. Rebound secured by Kawhi Ingram.

[07:54] Team_075 possession (Score: 8-3)
Derrick Stewart attempts a 3Pt. Contested by Rudy Smith (4.6 feet, MAN). Derrick Stewart misses. Offensive rebound by Derrick Stewart! Derrick Stewart kicks it out.

[07:35] Team_075 possession (Score: 8-3)
Myles Barrett attempts a 3Pt. Contested by Allen Mobley (4.4 feet, MAN). MYLES BARRETT MAKES IT! Assist: Larry McCollum
Score: 8-6

[07:20] Team_089 possession (Score: 8-6)
Rudy Smith drives to the basket... FOUL! Offensive foul on Rudy Smith! Derrick Stewart drew the charge! [Team fouls: 2] (Rudy Smith: 1 personal fouls) TURNOVER! (dead ball)

[07:01] Team_075 possession (Score: 8-6)
Derrick Stewart drives, Rudy Smith stays with him. Derrick Stewart attempts a Dunk. Contested by Rudy Smith (4.6 feet, MAN). Derrick Stewart misses. Rebound secured by Rudy Smith.

[06:47] Team_089 possession (Score: 8-6)
Jordan Brogdon attempts a 3Pt. Contested by Larry McCollum (4.3 feet, MAN). Jordan Brogdon misses. Rebound secured by Kawhi Ingram.

[06:32] Team_075 possession (Score: 8-6)
FOUL! Shooting foul on Rudy Smith. Derrick Stewart to the line for 2 free throws. [Team fouls: 3] (Rudy Smith: 2 personal fouls)   FT 1/2: GOOD   FT 2/2: GOOD Derrick Stewart makes 2/2 from the line.
Score: 8-8

[06:18] Team_089 possession (Score: 8-8)
Terry Simmons makes the Layup and draws the foul on Derrick Stewart! And-1! Terry Simmons to the line for 1. [BONUS: 5 team fouls] (Derrick Stewart: 4 personal fouls)   FT 1/1: GOOD Terry Simmons makes 1/1 from the line.
Score: 11-8

[06:03] Team_075 possession (Score: 11-8)
Myles Barrett attempts a 3Pt. Contested by Allen Mobley (4.4 feet, MAN). Myles Barrett misses. Rebound secured by Terry Simmons.

[05:52] Team_089 possession (Score: 11-8)
Allen Mobley throws a bad pass out of bounds! TURNOVER! (dead ball)

[05:36] Team_075 possession (Score: 11-8)
Myles Barrett attempts a 3Pt. Contested by Allen Mobley (4.4 feet, MAN). Myles Barrett misses. Rebound secured by Jalen Jackson.

[05:25] Team_089 possession (Score: 11-8)
Terry Simmons attempts a Midrange. Contested by Kawhi Ingram (4.6 feet, ZONE). Terry Simmons misses. Offensive rebound by Terry Simmons! Terry Simmons's putback is no good. Offensive rebound by Terry Simmons! Terry Simmons kicks it out.

[05:07] Team_089 possession (Score: 11-8)
Jalen Jackson drives, Derrick Stewart stays with him. Jalen Jackson attempts a Layup. Contested by Derrick Stewart (4.8 feet, ZONE). Jalen Jackson misses. Rebound secured by Kawhi Ingram.

[04:57] Team_075 possession (Score: 11-8)
FOUL! Shooting foul on Jordan Brogdon. Larry McCollum to the line for 3 free throws. [Team fouls: 4] (Jordan Brogdon: 1 personal fouls)   FT 1/3: GOOD   FT 2/3: GOOD   FT 3/3: MISS Larry McCollum makes 2/3 from the line. Rebound secured by Jalen Jackson.
Score: 11-10

[04:40] Team_089 possession (Score: 11-10)
Jordan Brogdon drives and kicks out. Jordan Brogdon attempts a Midrange. Contested by Larry McCollum (4.3 feet, MAN). Jordan Brogdon misses. Rebound secured by Kawhi Ingram.

[04:22] Team_075 possession (Score: 11-10)
Kawhi Ingram attempts a 3Pt. Contested by Jordan Brogdon (3.1 feet, ZONE). Kawhi Ingram misses. Rebound secured by Terry Simmons.

[04:06] Team_089 possession (Score: 11-10)
Terry Simmons throws a bad pass out of bounds! TURNOVER! (dead ball)

[03:50] Team_075 possession (Score: 11-10)
Derrick Stewart drives, picks up Rudy Smith. Help arrives from Jalen Jackson! Derrick Stewart attempts a Layup. Contested by Jalen Jackson (4.7 feet, MAN). DERRICK STEWART MAKES IT!
Score: 11-12

[03:39] Team_089 possession (Score: 11-12)
Jalen Jackson attempts a 3Pt. Contested by Larry McCollum (4.6 feet, ZONE). Jalen Jackson misses. Rebound secured by Derrick Stewart.

[03:27] Team_075 possession (Score: 11-12)
Myles Barrett drives, Terry Simmons stays with him. Myles Barrett attempts a Layup. Contested by Terry Simmons (3.9 feet, ZONE). Myles Barrett misses. Offensive rebound by Kawhi Ingram! Kawhi Ingram kicks it out.

[03:10] Team_075 possession (Score: 11-12)
Larry McCollum drives to the basket... Larry McCollum commits a violation (traveling/carry)! TURNOVER! (dead ball)

[02:53] Team_089 possession (Score: 11-12)
FOUL! Shooting foul on Larry McCollum. Jalen Jackson to the line for 3 free throws. [BONUS: 6 team fouls] (Larry McCollum: 2 personal fouls)   FT 1/3: GOOD   FT 2/3: GOOD   FT 3/3: MISS Jalen Jackson makes 2/3 from the line. Rebound secured by Derrick Stewart.
Score: 13-12

[02:41] Team_075 possession (Score: 13-12)
Larry McCollum attempts a 3Pt. Contested by Jordan Brogdon (3.6 feet, ZONE). LARRY MCCOLLUM MAKES IT! Assist: Kawhi Ingram
Score: 13-15

[02:25] Team_089 possession (Score: 13-15)
Jordan Brogdon attempts a 3Pt. Contested by Larry McCollum (4.5 feet, ZONE). Jordan Brogdon misses. Rebound secured by Derrick Stewart.

[02:14] Team_075 possession (Score: 13-15)
Larry McCollum attempts a 3Pt. Contested by Jordan Brogdon (3.6 feet, MAN). LARRY MCCOLLUM MAKES IT! Assist: Myles Barrett
Score: 13-18

[02:00] Team_089 possession (Score: 13-18)
FOUL! Shooting foul on Larry McCollum. Jordan Brogdon to the line for 3 free throws. [BONUS: 7 team fouls] (Larry McCollum: 3 personal fouls)   FT 1/3: GOOD   FT 2/3: GOOD   FT 3/3: GOOD Jordan Brogdon makes 3/3 from the line.
Score: 16-18

[01:45] Team_075 possession (Score: 16-18)
Myles Barrett attempts a 3Pt. Contested by Jordan Brogdon (3.8 feet, ZONE). Myles Barrett misses. Rebound secured by Rudy Smith.

[01:28] Team_089 possession (Score: 16-18)
Allen Mobley attempts a Layup. Wide open! Myles Barrett is 6.2 feet away. [MAN] Allen Mobley misses. Rebound secured by Kawhi Ingram.

[01:10] Team_075 possession (Score: 16-18)
Klay Jokic drives, picks up Terry Simmons. Help arrives from Jalen Jackson! Klay Jokic attempts a Layup. Contested by Jalen Jackson (4.3 feet, MAN). Klay Jokic misses. Rebound secured by Terry Simmons.

[00:57] Team_089 possession (Score: 16-18)
Allen Mobley attempts a Layup. Wide open! Myles Barrett is 6.3 feet away. [MAN] ALLEN MOBLEY MAKES IT! Assist: Terry Simmons
Score: 18-18

[00:40] Team_075 possession (Score: 18-18)
Klay Jokic attempts a Midrange. Contested by Terry Simmons (4.4 feet, MAN). Klay Jokic misses. FOUL! Loose ball foul on Rudy Smith during the rebound battle. [IN THE BONUS! 5 team fouls] Kawhi Ingram to the line for 2 free throws. (Rudy Smith: 3 personal fouls)   FT 1/2: GOOD   FT 2/2: MISS Kawhi Ingram makes 1/2 from the line. Rebound secured by Rudy Smith.
Score: 18-19

[00:29] Team_089 possession (Score: 18-19)
Rudy Smith attempts a Midrange. Contested by Derrick Stewart (5.4 feet, MAN). RUDY SMITH MAKES IT!
Score: 20-19

[00:12] Team_075 possession (Score: 20-19)
FOUL! Holding foul on Jordan Brogdon. [IN THE BONUS! 6 team fouls] Larry McCollum to the line for 2 free throws. (Jordan Brogdon: 2 personal fouls)   FT 1/2: GOOD   FT 2/2: MISS Larry McCollum makes 1/2 from the line. FOUL! Loose ball foul on Terry Simmons during the free throw rebound! [IN THE BONUS! 7 team fouls] Derrick Stewart to the line for 2 free throws. (Terry Simmons: 1 personal fouls)   FT 1/2: GOOD   FT 2/2: GOOD Derrick Stewart makes 2/2 from the line.
Score: 20-22

================================================================================
                              1ST QUARTER COMPLETE                              
================================================================================

1ST QUARTER SCORE: Team_089 20, Team_075 22

BOX SCORE:
================================================================================

Team_089
--------------------------------------------------------------------------------
Player                MIN  PTS  REB  AST  TO      FG   FG%      3P   3P%
--------------------------------------------------------------------------------
Allen Mobley           12    8    0    0   0   3/4    75.0     0/0   0.0
Rudy Smith             12    4    5    0   0   2/2   100.0     0/0   0.0
Terry Simmons          12    3    4    2   0   1/2    50.0     0/0   0.0
Jordan Brogdon         12    3    0    0   0   1/5    20.0     0/0   0.0
Jalen Jackson          12    0    3    1   0   0/4     0.0     0/0   0.0

TEAM: FG: 7/17 (41.2%), 3PT: 3/8 (37.5%), REB: 11 (1 off, 10 def), AST: 3, TO: 4
TEAM FOULS: 7 [Team_075 in BONUS]


Team_075
--------------------------------------------------------------------------------
Player                MIN  PTS  REB  AST  TO      FG   FG%      3P   3P%
--------------------------------------------------------------------------------
Derrick Stewart        12    7    5    0   0   3/4    75.0     0/0   0.0
Larry McCollum         12    6    0    1   0   2/4    50.0     0/0   0.0
Myles Barrett          12    3    0    2   0   1/5    20.0     0/0   0.0
Kawhi Ingram           12    3    6    1   0   1/3    33.3     0/0   0.0
Klay Jokic             12    0    1    0   0   0/2     0.0     0/0   0.0

TEAM: FG: 7/18 (38.9%), 3PT: 4/10 (40.0%), REB: 13 (3 off, 10 def), AST: 4, TO: 3
TEAM FOULS: 7 [Team_089 in BONUS]

================================================================================

================================================================================
                       2ND QUARTER - Team_089 vs Team_075                       
================================================================================

[12:00] Team_089 possession (Score: 20-22)
Allen Mobley makes the Dunk and draws the foul on Derrick Stewart! And-1! Allen Mobley to the line for 1. [Team fouls: 1] (Derrick Stewart: 1 personal fouls)   FT 1/1: GOOD Allen Mobley makes 1/1 from the line.
Score: 23-22

[11:44] Team_075 possession (Score: 23-22)
Kawhi Ingram attempts a Midrange. Contested by Jalen Jackson (4.8 feet, MAN). KAWHI INGRAM MAKES IT! Assist: Derrick Stewart
Score: 23-24

[11:32] Team_089 possession (Score: 23-24)
Jordan Brogdon attempts a 3Pt. Contested by Derrick Stewart (4.8 feet, ZONE). Jordan Brogdon misses. FOUL! Loose ball foul on Derrick Stewart during the rebound battle. [Team fouls: 2] No free throws, side out. (Derrick Stewart: 2 personal fouls)

[11:14] Team_089 possession (Score: 23-24)
Rudy Smith makes the Layup and draws the foul on Derrick Stewart! And-1! Rudy Smith to the line for 1. [Team fouls: 3] (Derrick Stewart: 3 personal fouls)   FT 1/1: GOOD Rudy Smith makes 1/1 from the line.
Score: 26-24

[11:03] Team_075 possession (Score: 26-24)
FOUL! Holding foul on Jordan Brogdon. [Team fouls: 1] No free throws, side out. (Jordan Brogdon: 1 personal fouls)

[10:47] Team_075 possession (Score: 26-24)
Klay Jokic attempts a 3Pt. Contested by Jordan Brogdon (4.1 feet, ZONE). KLAY JOKIC MAKES IT! Assist: Kawhi Ingram
Score: 26-27

[10:31] Team_089 possession (Score: 26-27)
Rudy Smith drives, Klay Jokic stays with him. Rudy Smith attempts a Dunk. Wide open! Klay Jokic is 6.2 feet away. [ZONE] RUDY SMITH MAKES IT! Assist: Jordan Brogdon
Score: 28-27

[10:15] Team_075 possession (Score: 28-27)
Klay Jokic attempts a Midrange. Contested by Rudy Smith (5.5 feet, ZONE). Klay Jokic misses. Rebound secured by Jalen Jackson.

[09:58] Team_089 possession (Score: 28-27)
Jalen Jackson attempts a 3Pt. Contested by Kawhi Ingram (4.8 feet, ZONE). Jalen Jackson misses. Rebound secured by Klay Jokic.

[09:42] Team_075 possession (Score: 28-27)
FOUL! Offensive foul on Klay Jokic! Terry Simmons drew the charge! [Team fouls: 4] (Klay Jokic: 1 personal fouls) TURNOVER! (dead ball)

[09:26] Team_089 possession (Score: 28-27)
Allen Mobley attempts a 3Pt. Contested by Larry McCollum (4.9 feet, ZONE). Allen Mobley misses. Rebound secured by Derrick Stewart.

[09:11] Team_075 possession (Score: 28-27)
Myles Barrett attempts a 3Pt. Contested by Allen Mobley (4.7 feet, MAN). Myles Barrett misses. Offensive rebound by Derrick Stewart! Derrick Stewart kicks it out.

[08:59] Team_075 possession (Score: 28-27)
Larry McCollum throws a bad pass! Stolen by Jordan Brogdon! TURNOVER! (live ball)

[08:47] Team_089 possession (Score: 28-27)
Terry Simmons makes the Layup and draws the foul on Derrick Stewart! And-1! Terry Simmons to the line for 1. [BONUS: 5 team fouls] (Derrick Stewart: 4 personal fouls)   FT 1/1: GOOD Terry Simmons makes 1/1 from the line.
Score: 31-27

[08:32] Team_075 possession (Score: 31-27)
FOUL! Shooting foul on Terry Simmons. Larry McCollum to the line for 2 free throws. [Team fouls: 2] (Terry Simmons: 1 personal fouls)   FT 1/2: MISS   FT 2/2: GOOD Larry McCollum makes 1/2 from the line.
Score: 31-28

[08:17] Team_089 possession (Score: 31-28)
FOUL! Shooting foul on Derrick Stewart. Jordan Brogdon to the line for 2 free throws. [BONUS: 6 team fouls] (Derrick Stewart: 5 personal fouls)   FT 1/2: GOOD   FT 2/2: GOOD Jordan Brogdon makes 2/2 from the line.
Score: 33-28

[08:03] Team_075 possession (Score: 33-28)
Myles Barrett attempts a Midrange. Contested by Jalen Jackson (5.5 feet, ZONE). MYLES BARRETT MAKES IT!
Score: 33-30

[07:49] Team_089 possession (Score: 33-30)
Jordan Brogdon drives, Larry McCollum stays with him. Jordan Brogdon attempts a Dunk. Contested by Larry McCollum (5.0 feet, MAN). JORDAN BROGDON MAKES IT!
Score: 35-30

[07:37] Team_075 possession (Score: 35-30)
FOUL! Shooting foul on Terry Simmons. Klay Jokic to the line for 2 free throws. [Team fouls: 3] (Terry Simmons: 2 personal fouls)   FT 1/2: GOOD   FT 2/2: MISS Klay Jokic makes 1/2 from the line. Rebound secured by Jalen Jackson.
Score: 35-31

[07:20] Team_089 possession (Score: 35-31)
Jordan Brogdon attempts a Midrange. Contested by Larry McCollum (5.1 feet, MAN). Jordan Brogdon misses. Rebound secured by Kawhi Ingram.

[07:03] Team_075 possession (Score: 35-31)
Larry McCollum attempts a Midrange. Contested by Jordan Brogdon (4.3 feet, MAN). Larry McCollum misses. Rebound secured by Terry Simmons.

[06:53] Team_089 possession (Score: 35-31)
Allen Mobley attempts a Midrange. Contested by Derrick Stewart (5.5 feet, ZONE). ALLEN MOBLEY MAKES IT!
Score: 37-31

[06:39] Team_075 possession (Score: 37-31)
Klay Jokic attempts a Midrange. Contested by Terry Simmons (4.9 feet, MAN). Klay Jokic misses. Rebound secured by Terry Simmons.

[06:25] Team_089 possession (Score: 37-31)
Allen Mobley attempts a Layup. Wide open! Myles Barrett is 6.7 feet away. [MAN] ALLEN MOBLEY MAKES IT! Assist: Terry Simmons
Score: 39-31

[06:12] Team_075 possession (Score: 39-31)
Klay Jokic attempts a Midrange. Contested by Terry Simmons (5.0 feet, MAN). Klay Jokic misses. Rebound secured by Rudy Smith.

[05:55] Team_089 possession (Score: 39-31)
Jordan Brogdon attempts a Layup. Contested by Derrick Stewart (5.5 feet, ZONE). Jordan Brogdon misses. Rebound secured by Derrick Stewart.

[05:40] Team_075 possession (Score: 39-31)
Larry McCollum drives, Jordan Brogdon stays with him. Larry McCollum attempts a Layup. Contested by Jordan Brogdon (4.5 feet, MAN). Larry McCollum misses. Rebound secured by Allen Mobley.

[05:22] Team_089 possession (Score: 39-31)
Jalen Jackson makes the 3Pt and draws the foul on Kawhi Ingram! And-1! Jalen Jackson to the line for 1. [BONUS: 7 team fouls] (Kawhi Ingram: 1 personal fouls)   FT 1/1: GOOD Jalen Jackson makes 1/1 from the line.
Score: 43-31

[05:04] Team_075 possession (Score: 43-31)
Larry McCollum makes the Midrange and draws the foul on Rudy Smith! And-1! Larry McCollum to the line for 1. [Team fouls: 4] (Rudy Smith: 1 personal fouls)   FT 1/1: GOOD Larry McCollum makes 1/1 from the line.
Score: 43-34

[04:52] Team_089 possession (Score: 43-34)
FOUL! Shooting foul on Larry McCollum. Jordan Brogdon to the line for 2 free throws. [BONUS: 8 team fouls] (Larry McCollum: 1 personal fouls)   FT 1/2: GOOD   FT 2/2: GOOD Jordan Brogdon makes 2/2 from the line.
Score: 45-34

[04:40] Team_075 possession (Score: 45-34)
Myles Barrett drives, picks up Terry Simmons. Help arrives from Jalen Jackson! Myles Barrett attempts a Dunk. Contested by Jalen Jackson (5.0 feet, ZONE). Myles Barrett misses. Rebound secured by Jalen Jackson.

[04:22] Team_089 possession (Score: 45-34)
Allen Mobley drives, picks up Myles Barrett. Help arrives from Larry McCollum! Allen Mobley attempts a Dunk. Wide open! Larry McCollum is 7.0 feet away. [MAN] Allen Mobley misses. Rebound secured by Kawhi Ingram.

[04:07] Team_075 possession (Score: 45-34)
Larry McCollum attempts a 3Pt. Contested by Jordan Brogdon (4.8 feet, ZONE). Larry McCollum misses. Rebound secured by Terry Simmons.

[03:52] Team_089 possession (Score: 45-34)
Terry Simmons drives to the basket... Terry Simmons loses the ball! Stripped by Klay Jokic! TURNOVER! (live ball)

[03:38] Team_075 possession (Score: 45-34)
Larry McCollum attempts a 3Pt. Contested by Jordan Brogdon (4.8 feet, ZONE). Larry McCollum misses. Rebound secured by Terry Simmons.

[03:25] Team_089 possession (Score: 45-34)
Jordan Brogdon attempts a Midrange. Contested by Kawhi Ingram (5.6 feet, ZONE). Jordan Brogdon misses. Rebound secured by Klay Jokic.

[03:14] Team_075 possession (Score: 45-34)
Larry McCollum drives, Jordan Brogdon stays with him. Larry McCollum attempts a Dunk. Contested by Jordan Brogdon (4.9 feet, MAN). LARRY MCCOLLUM MAKES IT! Assist: Derrick Stewart
Score: 45-36

[02:59] Team_089 possession (Score: 45-36)
Allen Mobley attempts a 3Pt. Wide open! Myles Barrett is 7.1 feet away. [MAN] ALLEN MOBLEY MAKES IT!
Score: 48-36

[02:47] Team_075 possession (Score: 48-36)
Derrick Stewart drives and kicks out. Derrick Stewart attempts a 3Pt. Contested by Jordan Brogdon (5.1 feet, ZONE). Derrick Stewart misses. Rebound secured by Allen Mobley.

[02:33] Team_089 possession (Score: 48-36)
Jordan Brogdon attempts a Midrange. Contested by Larry McCollum (5.8 feet, MAN). Jordan Brogdon misses. Rebound secured by Klay Jokic.

[02:19] Team_075 possession (Score: 48-36)
Kawhi Ingram attempts a 3Pt. Contested by Jordan Brogdon (4.9 feet, ZONE). KAWHI INGRAM MAKES IT! Assist: Larry McCollum
Score: 48-39

[02:06] Team_089 possession (Score: 48-39)
Rudy Smith drives, Derrick Stewart stays with him. Rudy Smith attempts a Layup. Wide open! Derrick Stewart is 6.4 feet away. [ZONE] Rudy Smith misses. Rebound secured by Klay Jokic.

[01:55] Team_075 possession (Score: 48-39)
Kawhi Ingram attempts a 3Pt. Contested by Jalen Jackson (6.0 feet, MAN). KAWHI INGRAM MAKES IT! Assist: Klay Jokic
Score: 48-42

[01:44] Team_089 possession (Score: 48-42)
Jalen Jackson drives, Kawhi Ingram stays with him. Jalen Jackson attempts a Dunk. Wide open! Kawhi Ingram is 6.1 feet away. [MAN] JALEN JACKSON MAKES IT! Assist: Terry Simmons
Score: 50-42

[01:30] Team_075 possession (Score: 50-42)
Larry McCollum attempts a 3Pt. Contested by Jordan Brogdon (5.3 feet, MAN). Larry McCollum misses. Rebound secured by Terry Simmons.

[01:13] Team_089 possession (Score: 50-42)
Terry Simmons attempts a Midrange. Wide open! Myles Barrett is 7.7 feet away. [ZONE] TERRY SIMMONS MAKES IT! Assist: Jordan Brogdon
Score: 52-42

[00:59] Team_075 possession (Score: 52-42)
Kawhi Ingram attempts a 3Pt. Wide open! Jalen Jackson is 6.1 feet away. [MAN] Kawhi Ingram misses. Rebound secured by Allen Mobley.

[00:45] Team_089 possession (Score: 52-42)
Rudy Smith attempts a 3Pt. Wide open! Larry McCollum is 6.4 feet away. [ZONE] RUDY SMITH MAKES IT! Assist: Terry Simmons
Score: 55-42

[00:29] Team_075 possession (Score: 55-42)
Derrick Stewart attempts a Midrange. Wide open! Rudy Smith is 6.3 feet away. [MAN] Derrick Stewart misses. Rebound secured by Allen Mobley.

[00:13] Team_089 possession (Score: 55-42)
Allen Mobley drives, Myles Barrett stays with him. Allen Mobley attempts a Dunk. Wide open! Myles Barrett is 7.5 feet away. [MAN] ALLEN MOBLEY MAKES IT! Assist: Jalen Jackson
Score: 57-42

================================================================================
                              2ND QUARTER COMPLETE                              
================================================================================

2ND QUARTER SCORE: Team_089 37, Team_075 20

BOX SCORE:
================================================================================

Team_089
--------------------------------------------------------------------------------
Player                MIN  PTS  REB  AST  TO      FG   FG%      3P   3P%
--------------------------------------------------------------------------------
Allen Mobley           24   12    4    0   0   5/7    71.4     0/0   0.0
Rudy Smith             24    8    1    0   0   3/4    75.0     0/0   0.0
Jordan Brogdon         24    6    0    2   0   3/7    42.9     0/0   0.0
Jalen Jackson          24    6    3    1   0   2/3    66.7     0/0   0.0
Terry Simmons          24    5    6    3   0   2/2   100.0     0/0   0.0

TEAM: FG: 15/23 (65.2%), 3PT: 3/5 (60.0%), REB: 14 (1 off, 13 def), AST: 6, TO: 1
TEAM FOULS: 4


Team_075
--------------------------------------------------------------------------------
Player                MIN  PTS  REB  AST  TO      FG   FG%      3P   3P%
--------------------------------------------------------------------------------
Kawhi Ingram           24    8    2    1   0   3/4    75.0     0/0   0.0
Larry McCollum         24    6    0    1   0   3/8    37.5     0/0   0.0
Klay Jokic             24    3    4    1   0   1/5    20.0     0/0   0.0
Myles Barrett          24    2    0    0   0   1/2    50.0     0/0   0.0
Derrick Stewart        24    0    3    2   0   0/2     0.0     0/0   0.0

TEAM: FG: 8/21 (38.1%), 3PT: 3/7 (42.9%), REB: 9 (1 off, 8 def), AST: 5, TO: 2
TEAM FOULS: 8 [Team_089 in BONUS]

================================================================================

================================================================================
                       3RD QUARTER - Team_089 vs Team_075                       
================================================================================

[12:00] Team_089 possession (Score: 57-42)
Rudy Smith drives and kicks out. Jalen Jackson attempts a Midrange. Contested by Kawhi Ingram (4.0 feet, MAN). JALEN JACKSON MAKES IT!
Score: 59-42

[11:44] Team_075 possession (Score: 59-42)
Derrick Stewart attempts a 3Pt. Contested by Allen Mobley (4.1 feet, ZONE). Derrick Stewart misses. Rebound secured by Rudy Smith.

[11:32] Team_089 possession (Score: 59-42)
Allen Mobley attempts a 3Pt. Contested by Myles Barrett (5.9 feet, MAN). Allen Mobley misses. Rebound secured by Klay Jokic.

[11:16] Team_075 possession (Score: 59-42)
Kawhi Ingram attempts a 3Pt. Contested by Jalen Jackson (4.5 feet, MAN). Kawhi Ingram misses. Rebound secured by Terry Simmons.

[11:01] Team_089 possession (Score: 59-42)
Rudy Smith attempts a Midrange. Contested by Kawhi Ingram (4.5 feet, ZONE). RUDY SMITH MAKES IT! Assist: Jordan Brogdon
Score: 61-42

[10:48] Team_075 possession (Score: 61-42)
Myles Barrett attempts a Layup. Contested by Allen Mobley (4.4 feet, MAN). MYLES BARRETT MAKES IT!
Score: 61-44

[10:30] Team_089 possession (Score: 61-44)
Terry Simmons drives, Derrick Stewart stays with him. Terry Simmons attempts a Layup. Contested by Derrick Stewart (5.1 feet, ZONE). TERRY SIMMONS MAKES IT! Assist: Jalen Jackson
Score: 63-44

[10:14] Team_075 possession (Score: 63-44)
Klay Jokic drives, picks up Terry Simmons. Help arrives from Jalen Jackson! Klay Jokic attempts a Layup. Contested by Jalen Jackson (4.0 feet, MAN). Klay Jokic misses. Rebound secured by Jalen Jackson.

[09:59] Team_089 possession (Score: 63-44)
Rudy Smith drives, Derrick Stewart stays with him. Rudy Smith attempts a Layup. Contested by Derrick Stewart (5.0 feet, MAN). Rudy Smith misses. Rebound secured by Derrick Stewart.

[09:43] Team_075 possession (Score: 63-44)
Myles Barrett drives, Allen Mobley stays with him. Myles Barrett attempts a Dunk. Contested by Allen Mobley (4.4 feet, MAN). MYLES BARRETT MAKES IT!
Score: 63-46

[09:25] Team_089 possession (Score: 63-46)
FOUL! Holding foul on Klay Jokic. [Team fouls: 1] No free throws, side out. (Klay Jokic: 1 personal fouls)

[09:10] Team_089 possession (Score: 63-46)
FOUL! Reach-in foul on Klay Jokic during the drive. [Team fouls: 2] No free throws, side out. (Klay Jokic: 2 personal fouls)

[08:59] Team_089 possession (Score: 63-46)
Allen Mobley attempts a Layup. Contested by Derrick Stewart (4.6 feet, ZONE). Allen Mobley misses. Offensive rebound by Terry Simmons! Terry Simmons puts it back in!
Score: 65-46

[08:46] Team_075 possession (Score: 65-46)
Myles Barrett attempts a 3Pt. Contested by Jordan Brogdon (3.4 feet, ZONE). Myles Barrett misses. Rebound secured by Terry Simmons.

[08:34] Team_089 possession (Score: 65-46)
Terry Simmons drives, Klay Jokic stays with him. Terry Simmons attempts a Dunk. Contested by Klay Jokic (6.0 feet, ZONE). TERRY SIMMONS MAKES IT! Assist: Allen Mobley
Score: 67-46

[08:22] Team_075 possession (Score: 67-46)
Derrick Stewart attempts a 3Pt. Contested by Jordan Brogdon (3.1 feet, ZONE). Derrick Stewart misses. Rebound secured by Rudy Smith.

[08:11] Team_089 possession (Score: 67-46)
FOUL! Shooting foul on Larry McCollum. Allen Mobley to the line for 3 free throws. [Team fouls: 3] (Larry McCollum: 1 personal fouls)   FT 1/3: MISS   FT 2/3: GOOD   FT 3/3: GOOD Allen Mobley makes 2/3 from the line.
Score: 69-46

[07:58] Team_075 possession (Score: 69-46)
Klay Jokic drives and kicks out. Kawhi Ingram attempts a Midrange. Contested by Jordan Brogdon (3.2 feet, ZONE). Kawhi Ingram misses. Rebound secured by Rudy Smith.

[07:38] Team_089 possession (Score: 69-46)
Jordan Brogdon attempts a Midrange. Contested by Larry McCollum (4.3 feet, MAN). JORDAN BROGDON MAKES IT! Assist: Allen Mobley
Score: 71-46

[07:20] Team_075 possession (Score: 71-46)
FOUL! Offensive foul on Klay Jokic! Terry Simmons drew the charge! [Team fouls: 4] (Klay Jokic: 3 personal fouls) TURNOVER! (dead ball)

[07:04] Team_089 possession (Score: 71-46)
Rudy Smith attempts a Midrange. Contested by Derrick Stewart (5.0 feet, MAN). Rudy Smith misses. Rebound secured by Klay Jokic.

[06:50] Team_075 possession (Score: 71-46)
Derrick Stewart drives and kicks out. Larry McCollum attempts a Midrange. Contested by Rudy Smith (4.7 feet, ZONE). LARRY MCCOLLUM MAKES IT! Assist: Derrick Stewart
Score: 71-48

[06:36] Team_089 possession (Score: 71-48)
Jordan Brogdon attempts a Midrange. Contested by Myles Barrett (5.9 feet, ZONE). JORDAN BROGDON MAKES IT! Assist: Jalen Jackson
Score: 73-48

[06:20] Team_075 possession (Score: 73-48)
Kawhi Ingram drives and kicks out. Larry McCollum attempts a 3Pt. Contested by Jordan Brogdon (3.2 feet, MAN). Larry McCollum misses. Offensive rebound by Derrick Stewart! Derrick Stewart kicks it out.

[06:07] Team_075 possession (Score: 73-48)
Klay Jokic attempts a Layup. Contested by Terry Simmons (4.0 feet, MAN). KLAY JOKIC MAKES IT!
Score: 73-50

[05:57] Team_089 possession (Score: 73-50)
Terry Simmons drives and kicks out. FOUL! Shooting foul on Larry McCollum. Jordan Brogdon to the line for 3 free throws. [BONUS: 5 team fouls] (Larry McCollum: 2 personal fouls)   FT 1/3: GOOD   FT 2/3: MISS   FT 3/3: GOOD Jordan Brogdon makes 2/3 from the line.
Score: 75-50

[05:41] Team_075 possession (Score: 75-50)
Kawhi Ingram attempts a Layup. Contested by Jalen Jackson (4.5 feet, MAN). Kawhi Ingram misses. Rebound secured by Terry Simmons.

[05:28] Team_089 possession (Score: 75-50)
Terry Simmons drives to the basket... Terry Simmons throws a bad pass out of bounds! TURNOVER! (dead ball)

[05:13] Team_075 possession (Score: 75-50)
Klay Jokic drives to the basket... Klay Jokic commits a violation (traveling/carry)! TURNOVER! (dead ball)

[05:00] Team_089 possession (Score: 75-50)
Allen Mobley attempts a 3Pt. Contested by Myles Barrett (6.0 feet, MAN). ALLEN MOBLEY MAKES IT!
Score: 78-50

[04:45] Team_075 possession (Score: 78-50)
Larry McCollum attempts a Midrange. Contested by Jordan Brogdon (3.4 feet, MAN). Larry McCollum misses. Rebound secured by Rudy Smith.

[04:31] Team_089 possession (Score: 78-50)
Allen Mobley attempts a Layup. Contested by Derrick Stewart (4.6 feet, ZONE). ALLEN MOBLEY MAKES IT! Assist: Jordan Brogdon
Score: 80-50

[04:16] Team_075 possession (Score: 80-50)
Kawhi Ingram attempts a 3Pt. Contested by Jalen Jackson (4.6 feet, MAN). Kawhi Ingram misses. Rebound secured by Rudy Smith.

[04:05] Team_089 possession (Score: 80-50)
Terry Simmons attempts a Layup. Wide open! Klay Jokic is 6.1 feet away. [MAN] TERRY SIMMONS MAKES IT! Assist: Rudy Smith
Score: 82-50

[03:52] Team_075 possession (Score: 82-50)
Derrick Stewart attempts a Layup. Contested by Terry Simmons (3.6 feet, ZONE). DERRICK STEWART MAKES IT! Assist: Kawhi Ingram
Score: 82-52

[03:40] Team_089 possession (Score: 82-52)
Jordan Brogdon attempts a 3Pt. Contested by Larry McCollum (4.4 feet, ZONE). JORDAN BROGDON MAKES IT!
Score: 85-52

[03:25] Team_075 possession (Score: 85-52)
Kawhi Ingram attempts a 3Pt. Contested by Jalen Jackson (4.7 feet, MAN). KAWHI INGRAM MAKES IT! Assist: Larry McCollum
Score: 85-55

[03:09] Team_089 possession (Score: 85-55)
Terry Simmons drives, Derrick Stewart stays with him. Terry Simmons attempts a Dunk. Contested by Derrick Stewart (5.3 feet, ZONE). TERRY SIMMONS MAKES IT! Assist: Rudy Smith
Score: 87-55

[02:58] Team_075 possession (Score: 87-55)
Derrick Stewart drives, picks up Rudy Smith. Help arrives from Jalen Jackson! Derrick Stewart attempts a Dunk. Contested by Jalen Jackson (4.8 feet, MAN). DERRICK STEWART MAKES IT!
Score: 87-57

[02:48] Team_089 possession (Score: 87-57)
Jordan Brogdon attempts a Layup. Contested by Derrick Stewart (4.8 feet, ZONE). JORDAN BROGDON MAKES IT! Assist: Terry Simmons
Score: 89-57

[02:35] Team_075 possession (Score: 89-57)
Larry McCollum makes the 3Pt and draws the foul on Jordan Brogdon! And-1! Larry McCollum to the line for 1. [Team fouls: 1] (Jordan Brogdon: 1 personal fouls)   FT 1/1: GOOD Larry McCollum makes 1/1 from the line.
Score: 89-61

[02:23] Team_089 possession (Score: 89-61)
Rudy Smith drives, picks up Derrick Stewart. Help arrives from Larry McCollum! Rudy Smith attempts a Layup. Contested by Larry McCollum (5.3 feet, ZONE). RUDY SMITH MAKES IT! Assist: Jalen Jackson
Score: 91-61

[02:06] Team_075 possession (Score: 91-61)
Larry McCollum attempts a 3Pt. Contested by Jordan Brogdon (3.7 feet, ZONE). Larry McCollum misses. Rebound secured by Jalen Jackson.

[01:54] Team_089 possession (Score: 91-61)
Terry Simmons drives to the basket... Terry Simmons throws a bad pass out of bounds! TURNOVER! (dead ball)

[01:54] Substitution (Team_089): Jordan Brogdon OUT → Tony Parker IN (stamina_rule2)

[01:54] Substitution (Team_089): Jalen Jackson OUT → Joel Barnes IN (stamina_rule2)

[01:54] Substitution (Team_089): Rudy Smith OUT → Devin Haliburton IN (stamina_rule2)

[01:54] Substitution (Team_089): Terry Simmons OUT → Evan Gasol IN (stamina_rule2)

[01:54] Substitution (Team_075): Larry McCollum OUT → D'Angelo Anunoby IN (stamina_rule2)

[01:54] Substitution (Team_075): Kawhi Ingram OUT → LeBron Ginobili IN (stamina_rule2)

[01:54] Substitution (Team_075): Myles Barrett OUT → Donovan Paul IN (stamina_rule2)

[01:54] Substitution (Team_075): Derrick Stewart OUT → Collin Duncan IN (stamina_rule2)

[01:54] Substitution (Team_075): Klay Jokic OUT → Kevin Towns IN (stamina_rule2)

[01:42] Team_075 possession (Score: 91-61)
LeBron Ginobili attempts a Layup. Contested by Devin Haliburton (5.0 feet, ZONE). LEBRON GINOBILI MAKES IT! Assist: Kevin Towns
Score: 91-63

[01:25] Team_089 possession (Score: 91-63)
Devin Haliburton drives and kicks out. Devin Haliburton attempts a Midrange. Contested by Collin Duncan (5.6 feet, ZONE). DEVIN HALIBURTON MAKES IT!
Score: 93-63

[01:14] Team_075 possession (Score: 93-63)
FOUL! Reach-in foul on Devin Haliburton during the drive. [Team fouls: 2] No free throws, side out. (Devin Haliburton: 1 personal fouls)

[01:04] Team_075 possession (Score: 93-63)
Collin Duncan makes the Layup and draws the foul on Evan Gasol! And-1! Collin Duncan to the line for 1. [Team fouls: 3] (Evan Gasol: 1 personal fouls)   FT 1/1: MISS Collin Duncan makes 0/1 from the line. Offensive rebound by Kevin Towns! Kevin Towns kicks it out.
Score: 93-65

[00:52] Team_075 possession (Score: 93-65)
LeBron Ginobili attempts a 3Pt. Contested by Devin Haliburton (5.0 feet, ZONE). LeBron Ginobili misses. Rebound secured by Devin Haliburton.

[00:36] Team_089 possession (Score: 93-65)
Devin Haliburton attempts a 3Pt. Wide open! Collin Duncan is 6.1 feet away. [MAN] Devin Haliburton misses. FOUL! Loose ball foul on D'Angelo Anunoby during the rebound battle. [IN THE BONUS! 6 team fouls] Evan Gasol to the line for 2 free throws. (D'Angelo Anunoby: 1 personal fouls)   FT 1/2: GOOD   FT 2/2: MISS Evan Gasol makes 1/2 from the line. Rebound secured by Kevin Towns.
Score: 94-65

[00:24] Team_075 possession (Score: 94-65)
FOUL! Shooting foul on Evan Gasol. Kevin Towns to the line for 2 free throws. [Team fouls: 4] (Evan Gasol: 2 personal fouls)   FT 1/2: MISS   FT 2/2: GOOD Kevin Towns makes 1/2 from the line.
Score: 94-66

[00:05] Team_089 possession (Score: 94-66)
Allen Mobley drives and kicks out. Evan Gasol attempts a 3Pt. Contested by D'Angelo Anunoby (5.3 feet, ZONE). Evan Gasol misses. Rebound secured by Collin Duncan.

================================================================================
                              3RD QUARTER COMPLETE                              
================================================================================

3RD QUARTER SCORE: Team_089 37, Team_075 24

BOX SCORE:
================================================================================

Team_089
--------------------------------------------------------------------------------
Player                MIN  PTS  REB  AST  TO      FG   FG%      3P   3P%
--------------------------------------------------------------------------------
Jordan Brogdon         34   11    0    2   0   5/5   100.0     0/0   0.0
Terry Simmons          34   10    4    1   0   5/5   100.0     0/0   0.0
Allen Mobley           36    7    0    2   0   3/5    60.0     0/0   0.0
Rudy Smith             34    4    5    2   0   2/4    50.0     0/0   0.0
Jalen Jackson          34    2    2    3   0   1/1   100.0     0/0   0.0
Devin Haliburton        2    2    1    0   0   1/2    50.0     0/0   0.0

TEAM: FG: 17/22 (77.3%), 3PT: 3/5 (60.0%), REB: 13 (2 off, 11 def), AST: 10, TO: 2
TEAM FOULS: 4


Team_075
--------------------------------------------------------------------------------
Player                MIN  PTS  REB  AST  TO      FG   FG%      3P   3P%
--------------------------------------------------------------------------------
Larry McCollum         34    6    0    1   0   2/4    50.0     0/0   0.0
Derrick Stewart        34    4    2    1   0   2/4    50.0     0/0   0.0
Myles Barrett          34    4    0    0   0   2/3    66.7     0/0   0.0
Kawhi Ingram           34    3    0    1   0   1/4    25.0     0/0   0.0
Klay Jokic             34    2    2    0   0   1/3    33.3     0/0   0.0
LeBron Ginobili         2    2    0    0   0   1/2    50.0     0/0   0.0
Kevin Towns             2    1    2    1   0   1/1   100.0     0/0   0.0
Collin Duncan           2    0    1    0   0   0/0     0.0     0/0   0.0

TEAM: FG: 10/21 (47.6%), 3PT: 2/9 (22.2%), REB: 6 (2 off, 4 def), AST: 4, TO: 2
TEAM FOULS: 6 [Team_089 in BONUS]

================================================================================

================================================================================
                       4TH QUARTER - Team_089 vs Team_075                       
================================================================================

[12:00] Team_089 possession (Score: 94-66)
Allen Mobley attempts a 3Pt. Contested by Larry McCollum (4.4 feet, ZONE). Allen Mobley misses. Rebound secured by Derrick Stewart.

[11:51] Team_075 possession (Score: 94-66)
Myles Barrett drives, Terry Simmons stays with him. Myles Barrett attempts a Layup. Contested by Terry Simmons (3.8 feet, ZONE). MYLES BARRETT MAKES IT! Assist: Klay Jokic
Score: 94-68

[11:33] Team_089 possession (Score: 94-68)
Terry Simmons attempts a Layup. Wide open! Klay Jokic is 6.1 feet away. [MAN] TERRY SIMMONS MAKES IT! Assist: Rudy Smith
Score: 96-68

[11:17] Team_075 possession (Score: 96-68)
Kawhi Ingram attempts a Layup. Contested by Jalen Jackson (4.6 feet, MAN). KAWHI INGRAM MAKES IT! Assist: Myles Barrett
Score: 96-70

[11:02] Team_089 possession (Score: 96-70)
FOUL! Holding foul on Derrick Stewart. [Team fouls: 1] No free throws, side out. (Derrick Stewart: 1 personal fouls)

[10:50] Team_089 possession (Score: 96-70)
Terry Simmons drives, picks up Klay Jokic. Help arrives from Larry McCollum! Terry Simmons attempts a Layup. Wide open! Larry McCollum is 6.1 feet away. [MAN] TERRY SIMMONS MAKES IT! Assist: Allen Mobley
Score: 98-70

[10:32] Team_075 possession (Score: 98-70)
Larry McCollum attempts a 3Pt. Contested by Jordan Brogdon (3.6 feet, MAN). Larry McCollum misses. Rebound secured by Terry Simmons.

[10:18] Team_089 possession (Score: 98-70)
Allen Mobley attempts a 3Pt. Wide open! Myles Barrett is 6.1 feet away. [MAN] Allen Mobley misses. FOUL! Loose ball foul on Derrick Stewart during the rebound battle. [Team fouls: 2] No free throws, side out. (Derrick Stewart: 2 personal fouls)

[10:00] Team_089 possession (Score: 98-70)
Rudy Smith attempts a 3Pt. Contested by Larry McCollum (5.0 feet, ZONE). Rudy Smith misses. Rebound secured by Derrick Stewart.

[09:46] Team_075 possession (Score: 98-70)
Myles Barrett attempts a Midrange. Contested by Allen Mobley (4.8 feet, MAN). Myles Barrett misses. Rebound secured by Rudy Smith.

[09:35] Team_089 possession (Score: 98-70)
Terry Simmons drives, Derrick Stewart stays with him. Terry Simmons attempts a Layup. Contested by Derrick Stewart (5.4 feet, ZONE). TERRY SIMMONS MAKES IT! Assist: Rudy Smith
Score: 100-70

[09:22] Team_075 possession (Score: 100-70)
Derrick Stewart drives and kicks out. FOUL! Shooting foul on Jordan Brogdon. Derrick Stewart to the line for 3 free throws. [Team fouls: 1] (Jordan Brogdon: 1 personal fouls)   FT 1/3: GOOD   FT 2/3: GOOD   FT 3/3: GOOD Derrick Stewart makes 3/3 from the line.
Score: 100-73

[09:07] Team_089 possession (Score: 100-73)
Jordan Brogdon attempts a 3Pt. Contested by Larry McCollum (4.6 feet, MAN). Jordan Brogdon misses. Rebound secured by Klay Jokic.

[08:55] Team_075 possession (Score: 100-73)
Larry McCollum drives and kicks out. Larry McCollum attempts a 3Pt. Contested by Jordan Brogdon (3.7 feet, MAN). Larry McCollum misses. Offensive rebound by Kawhi Ingram! Kawhi Ingram kicks it out.

[08:44] Team_075 possession (Score: 100-73)
Klay Jokic drives, picks up Terry Simmons. Help arrives from Jalen Jackson! Klay Jokic attempts a Layup. Contested by Jalen Jackson (4.4 feet, ZONE). KLAY JOKIC MAKES IT! Assist: Larry McCollum
Score: 100-75

[08:32] Team_089 possession (Score: 100-75)
Allen Mobley attempts a 3Pt. Contested by Larry McCollum (4.7 feet, ZONE). Allen Mobley misses. Rebound secured by Kawhi Ingram.

[08:17] Team_075 possession (Score: 100-75)
Derrick Stewart attempts a Midrange. Contested by Rudy Smith (5.0 feet, MAN). DERRICK STEWART MAKES IT! Assist: Klay Jokic
Score: 100-77

[08:04] Team_089 possession (Score: 100-77)
Jordan Brogdon commits a violation (traveling/carry)! TURNOVER! (dead ball)

[08:04] Substitution (Team_089): Jordan Brogdon OUT → Tony Parker IN (stamina_rule2)

[08:04] Substitution (Team_089): Jalen Jackson OUT → Joel Barnes IN (stamina_rule2)

[08:04] Substitution (Team_089): Allen Mobley OUT → Pascal Durant IN (stamina_rule2)

[08:04] Substitution (Team_089): Rudy Smith OUT → Devin Haliburton IN (stamina_rule2)

[08:04] Substitution (Team_089): Terry Simmons OUT → Evan Gasol IN (stamina_rule2)

[08:04] Substitution (Team_075): Larry McCollum OUT → D'Angelo Anunoby IN (stamina_rule2)

[08:04] Substitution (Team_075): Kawhi Ingram OUT → LeBron Ginobili IN (stamina_rule2)

[08:04] Substitution (Team_075): Myles Barrett OUT → Donovan Paul IN (stamina_rule2)

[08:04] Substitution (Team_075): Derrick Stewart OUT → Collin Duncan IN (stamina_rule2)

[08:04] Substitution (Team_075): Klay Jokic OUT → Kevin Towns IN (stamina_rule2)

[07:48] Team_075 possession (Score: 100-77)
Kevin Towns throws a bad pass! Stolen by Evan Gasol! TURNOVER! (live ball)

[07:31] Team_089 possession (Score: 100-77)
Joel Barnes drives, Kevin Towns stays with him. Joel Barnes attempts a Layup. Contested by Kevin Towns (5.6 feet, ZONE). JOEL BARNES MAKES IT!
Score: 102-77

[07:21] Team_075 possession (Score: 102-77)
Collin Duncan attempts a 3Pt. Contested by Pascal Durant (3.8 feet, ZONE). COLLIN DUNCAN MAKES IT! Assist: LeBron Ginobili
Score: 102-80

[07:10] Team_089 possession (Score: 102-80)
Devin Haliburton drives, picks up Kevin Towns. Help arrives from D'Angelo Anunoby! Devin Haliburton attempts a Dunk. Contested by D'Angelo Anunoby (5.9 feet, ZONE). Devin Haliburton misses. Rebound secured by Kevin Towns.

[06:58] Team_075 possession (Score: 102-80)
Kevin Towns loses control! Ball rolls out of bounds! TURNOVER! (dead ball)

[06:41] Team_089 possession (Score: 102-80)
Devin Haliburton attempts a 3Pt. Contested by LeBron Ginobili (5.3 feet, ZONE). Devin Haliburton misses. Rebound secured by Collin Duncan.

[06:26] Team_075 possession (Score: 102-80)
D'Angelo Anunoby attempts a 3Pt. Contested by Tony Parker (5.3 feet, MAN). D'Angelo Anunoby misses. Rebound secured by Pascal Durant.

[06:13] Team_089 possession (Score: 102-80)
Pascal Durant attempts a 3Pt. Wide open! Donovan Paul is 6.7 feet away. [MAN] Pascal Durant misses. Rebound secured by Collin Duncan.

[05:58] Team_075 possession (Score: 102-80)
Collin Duncan drives, Devin Haliburton stays with him. Collin Duncan attempts a Layup. Contested by Devin Haliburton (5.0 feet, ZONE). COLLIN DUNCAN MAKES IT! Assist: Donovan Paul
Score: 102-82

[05:47] Team_089 possession (Score: 102-82)
Devin Haliburton drives, Collin Duncan stays with him. Devin Haliburton attempts a Layup. Wide open! Collin Duncan is 6.1 feet away. [MAN] DEVIN HALIBURTON MAKES IT! Assist: Joel Barnes
Score: 104-82

[05:30] Team_075 possession (Score: 104-82)
Collin Duncan attempts a 3Pt. Contested by Devin Haliburton (5.0 feet, MAN). Collin Duncan misses. Offensive rebound by Kevin Towns! Kevin Towns kicks it out.

[05:11] Team_075 possession (Score: 104-82)
D'Angelo Anunoby attempts a Midrange. Contested by Tony Parker (5.3 feet, MAN). D'ANGELO ANUNOBY MAKES IT! Assist: LeBron Ginobili
Score: 104-84

[04:57] Team_089 possession (Score: 104-84)
Pascal Durant attempts a 3Pt. Wide open! Donovan Paul is 6.7 feet away. [MAN] Pascal Durant misses. Offensive rebound by Evan Gasol! Evan Gasol kicks it out.

[04:40] Team_089 possession (Score: 104-84)
Tony Parker attempts a 3Pt. Contested by D'Angelo Anunoby (5.5 feet, ZONE). Tony Parker misses. Rebound secured by Collin Duncan.

[04:25] Team_075 possession (Score: 104-84)
Donovan Paul attempts a 3Pt. Contested by Pascal Durant (4.3 feet, ZONE). Donovan Paul misses. Rebound secured by Evan Gasol.

[04:12] Team_089 possession (Score: 104-84)
Evan Gasol drives, Kevin Towns stays with him. Evan Gasol attempts a Layup. Contested by Kevin Towns (5.5 feet, ZONE). Evan Gasol misses. Offensive rebound by Evan Gasol! Evan Gasol kicks it out.

[03:59] Team_089 possession (Score: 104-84)
Devin Haliburton attempts a Midrange. Wide open! Collin Duncan is 6.1 feet away. [MAN] DEVIN HALIBURTON MAKES IT! Assist: Pascal Durant
Score: 106-84

[03:49] Team_075 possession (Score: 106-84)
Donovan Paul drives, Devin Haliburton stays with him. Donovan Paul attempts a Dunk. Contested by Devin Haliburton (5.4 feet, ZONE). DONOVAN PAUL MAKES IT! Assist: Collin Duncan
Score: 106-86

[03:31] Team_089 possession (Score: 106-86)
Pascal Durant attempts a Layup. Wide open! Kevin Towns is 6.3 feet away. [ZONE] Pascal Durant misses. Offensive rebound by Evan Gasol! Evan Gasol kicks it out.

[03:18] Team_089 possession (Score: 106-86)
Pascal Durant attempts a Midrange. Wide open! Donovan Paul is 6.7 feet away. [MAN] Pascal Durant misses. Rebound secured by Collin Duncan.

[03:02] Team_075 possession (Score: 106-86)
D'Angelo Anunoby attempts a 3Pt. Contested by Pascal Durant (3.8 feet, ZONE). D'Angelo Anunoby misses. Rebound secured by Devin Haliburton.

[02:45] Team_089 possession (Score: 106-86)
Tony Parker attempts a 3Pt. Contested by D'Angelo Anunoby (5.5 feet, ZONE). TONY PARKER MAKES IT!
Score: 109-86

[02:34] Team_075 possession (Score: 109-86)
Donovan Paul makes the Layup and draws the foul on Pascal Durant! And-1! Donovan Paul to the line for 1. [Team fouls: 2] (Pascal Durant: 1 personal fouls)   FT 1/1: GOOD Donovan Paul makes 1/1 from the line.
Score: 109-89

[02:17] Team_089 possession (Score: 109-89)
Devin Haliburton attempts a 3Pt. Wide open! Collin Duncan is 6.1 feet away. [MAN] Devin Haliburton misses. Rebound secured by D'Angelo Anunoby.

[02:07] Team_075 possession (Score: 109-89)
Collin Duncan makes the Layup and draws the foul on Devin Haliburton! And-1! Collin Duncan to the line for 1. [Team fouls: 3] (Devin Haliburton: 1 personal fouls)   FT 1/1: GOOD Collin Duncan makes 1/1 from the line.
Score: 109-92

[01:53] Team_089 possession (Score: 109-92)
Pascal Durant attempts a Layup. Wide open! Donovan Paul is 6.8 feet away. [MAN] PASCAL DURANT MAKES IT! Assist: Joel Barnes
Score: 111-92

[01:38] Team_075 possession (Score: 111-92)
FOUL! Reach-in foul on Evan Gasol during the drive. [Team fouls: 4] No free throws, side out. (Evan Gasol: 1 personal fouls)

[01:24] Team_075 possession (Score: 111-92)
FOUL! Holding foul on Tony Parker. [IN THE BONUS! 5 team fouls] D'Angelo Anunoby to the line for 2 free throws. (Tony Parker: 1 personal fouls)   FT 1/2: GOOD   FT 2/2: MISS D'Angelo Anunoby makes 1/2 from the line. Rebound secured by Pascal Durant.
Score: 111-93

[01:15] Team_089 possession (Score: 111-93)
Pascal Durant attempts a 3Pt. Wide open! D'Angelo Anunoby is 6.3 feet away. [ZONE] PASCAL DURANT MAKES IT! Assist: Devin Haliburton
Score: 114-93

[01:00] Team_075 possession (Score: 114-93)
Collin Duncan attempts a 3Pt. Contested by Devin Haliburton (5.1 feet, MAN). Collin Duncan misses. Rebound secured by Devin Haliburton.

[00:50] Team_089 possession (Score: 114-93)
Tony Parker attempts a 3Pt. Contested by D'Angelo Anunoby (5.7 feet, MAN). TONY PARKER MAKES IT! Assist: Pascal Durant
Score: 117-93

[00:34] Team_075 possession (Score: 117-93)
LeBron Ginobili attempts a Layup. Contested by Devin Haliburton (5.2 feet, ZONE). LEBRON GINOBILI MAKES IT! Assist: Donovan Paul
Score: 117-95

[00:22] Team_089 possession (Score: 117-95)
Evan Gasol attempts a Layup. Contested by Kevin Towns (5.8 feet, ZONE). EVAN GASOL MAKES IT!
Score: 119-95

[00:07] Team_075 possession (Score: 119-95)
LeBron Ginobili drives, Joel Barnes stays with him. LeBron Ginobili attempts a Dunk. Contested by Joel Barnes (5.8 feet, MAN). LEBRON GINOBILI MAKES IT!
Score: 119-97

================================================================================
                              4TH QUARTER COMPLETE                              
================================================================================

4TH QUARTER SCORE: Team_089 25, Team_075 31

BOX SCORE:
================================================================================

Team_089
--------------------------------------------------------------------------------
Player                MIN  PTS  REB  AST  TO      FG   FG%      3P   3P%
--------------------------------------------------------------------------------
Terry Simmons          39    6    1    0   0   3/3   100.0     0/0   0.0
Tony Parker            10    6    0    0   0   2/3    66.7     0/0   0.0
Pascal Durant           8    5    2    2   0   2/4    50.0     0/0   0.0
Devin Haliburton       10    4    2    1   0   2/5    40.0     0/0   0.0
Joel Barnes            10    2    0    2   0   1/1   100.0     0/0   0.0
Evan Gasol             10    2    4    0   0   1/1   100.0     0/0   0.0
Allen Mobley           41    0    0    1   0   0/2     0.0     0/0   0.0
Rudy Smith             39    0    1    2   0   0/1     0.0     0/0   0.0
Jalen Jackson          39    0    1    0   0   0/0     0.0     0/0   0.0
Jordan Brogdon         39    0    0    0   0   0/1     0.0     0/0   0.0

TEAM: FG: 11/21 (52.4%), 3PT: 3/11 (27.3%), REB: 11 (4 off, 7 def), AST: 8, TO: 1
TEAM FOULS: 5 [Team_075 in BONUS]


Team_075
--------------------------------------------------------------------------------
Player                MIN  PTS  REB  AST  TO      FG   FG%      3P   3P%
--------------------------------------------------------------------------------
Collin Duncan          10    8    4    1   0   3/4    75.0     0/0   0.0
Derrick Stewart        39    5    2    0   0   2/2   100.0     0/0   0.0
Donovan Paul           10    5    0    2   0   2/3    66.7     0/0   0.0
LeBron Ginobili        10    4    0    2   0   2/2   100.0     0/0   0.0
Myles Barrett          39    2    0    1   0   1/2    50.0     0/0   0.0
Klay Jokic             39    2    1    2   0   1/1   100.0     0/0   0.0
Kawhi Ingram           39    2    2    0   0   1/1   100.0     0/0   0.0
D'Angelo Anunoby       10    2    1    0   0   1/3    33.3     0/0   0.0
Larry McCollum         39    0    0    1   0   0/1     0.0     0/0   0.0
Kevin Towns            10    0    2    0   0   0/0     0.0     0/0   0.0

TEAM: FG: 13/20 (65.0%), 3PT: 1/6 (16.7%), REB: 12 (2 off, 10 def), AST: 9, TO: 2
TEAM FOULS: 2

================================================================================

================================================================================
                               FULL GAME COMPLETE                               
================================================================================

FINAL SCORE: Team_089 119, Team_075 97

SCORING BY QUARTER:
--------------------------------------------------------------------------------
Team                     Q1     Q2     Q3     Q4    FINAL
--------------------------------------------------------------------------------
Team_089                 20     37     37     25      119
Team_075                 22     20     24     31       97
--------------------------------------------------------------------------------

FULL GAME BOX SCORE:
================================================================================

Team_089
--------------------------------------------------------------------------------
Player                MIN  PTS  REB  AST  TO      FG   FG%      3P   3P%      FT STL BLK
--------------------------------------------------------------------------------
Allen Mobley           41   27    4    3   3  12/19   63.2   5/9    55.6   3/4     0   0
Jordan Brogdon         39   20    0    4   2   8/17   47.1   2/5    40.0   9/10    1   0
Jalen Jackson          39    8    9    5   1   2/7    28.6   1/5    20.0   3/4     1   0
Rudy Smith             39   16   12    4   0   8/12   66.7   1/2    50.0   3/3     0   0
Terry Simmons          39   24   15    6   2  11/12   91.7   0/0     0.0   2/2     0   0
Tony Parker            10    6    0    0   0   2/3    66.7   2/3    66.7   0/0     0   0
Joel Barnes            10    2    0    2   0   1/1   100.0   0/0     0.0   0/0     0   0
Devin Haliburton       10    6    3    1   0   3/7    42.9   0/3     0.0   0/0     0   0
Evan Gasol             10    2    4    0   0   1/1   100.0   0/0     0.0   1/2     1   0
Pascal Durant           8    5    2    2   0   2/4    50.0   1/2    50.0   0/0     0   0

TEAM: FG: 50/83 (60.2%), 3PT: 12/29 (41.4%), REB: 49 (8 off, 41 def), AST: 27, TO: 8


Team_075
--------------------------------------------------------------------------------
Player                MIN  PTS  REB  AST  TO      FG   FG%      3P   3P%      FT STL BLK
--------------------------------------------------------------------------------
Larry McCollum         39   18    0    4   2   6/16   37.5   3/9    33.3   6/9     0   0
Kawhi Ingram           39   16   10    3   0   6/12   50.0   4/8    50.0   1/2     0   0
Myles Barrett          39   11    0    3   1   5/12   41.7   1/6    16.7   0/0     0   0
Derrick Stewart        39   16   12    3   2   7/12   58.3   0/2     0.0   5/5     0   0
Klay Jokic             39    7    8    3   2   3/11   27.3   1/1   100.0   1/2     1   0
D'Angelo Anunoby       10    2    1    0   0   1/3    33.3   0/2     0.0   1/2     0   0
LeBron Ginobili        10    6    0    2   0   3/4    75.0   0/1     0.0   0/0     0   0
Donovan Paul           10    5    0    2   0   2/3    66.7   0/1     0.0   1/1     0   0
Collin Duncan          10    8    5    1   0   3/4    75.0   1/2    50.0   1/2     0   0
Kevin Towns            10    1    4    1   2   1/1   100.0   0/0     0.0   1/2     0   0

TEAM: FG: 38/80 (47.5%), 3PT: 10/32 (31.2%), REB: 40 (8 off, 32 def), AST: 22, TO: 9

================================================================================
