================================================================================
                        FULL GAME - Team_034 vs Team_039                        
================================================================================

================================================================================
                       1ST QUARTER - Team_034 vs Team_039                       
================================================================================

[12:00] Team_034 possession (Score: 0-0)
Devin Poole attempts a Midrange. Contested by Donovan Markkanen (3.6 feet, ZONE). DEVIN POOLE MAKES IT!
Score: 2-0

[11:49] Team_039 possession (Score: 2-0)
Jrue Bridges drives to the basket... Jrue Bridges throws a bad pass! Stolen by Devin Poole! TURNOVER! (live ball)

[11:31] Team_034 possession (Score: 2-0)
Ben Hyland drives, Donovan Markkanen stays with him. Ben Hyland attempts a Dunk. Contested by Donovan Markkanen (3.8 feet, MAN). Ben Hyland misses. Rebound secured by Klay Wade.

[11:21] Team_039 possession (Score: 2-0)
Donovan Markkanen attempts a 3Pt. Contested by Devin Poole (4.2 feet, ZONE). Donovan Markkanen misses. Rebound secured by Anthony Bane.

[11:05] Team_034 possession (Score: 2-0)
Terry Doncic attempts a 3Pt. Contested by Jrue Bridges (3.2 feet, ZONE). Terry Doncic misses. Rebound secured by Klay Wade.

[10:52] Team_039 possession (Score: 2-0)
Jrue Bridges drives to the basket... FOUL! Offensive foul on Jrue Bridges! Terry Doncic drew the charge! [Team fouls: 1] (Jrue Bridges: 1 personal fouls) TURNOVER! (dead ball)

[10:37] Team_034 possession (Score: 2-0)
Anthony Bane attempts a Layup. Contested by Klay Wade (4.1 feet, ZONE). Anthony Bane misses. Offensive rebound by Anthony Bane! Anthony Bane kicks it out.

[10:23] Team_034 possession (Score: 2-0)
Devin Poole attempts a 3Pt. Contested by Jrue Bridges (3.0 feet, ZONE). Devin Poole misses. Rebound secured by Donovan Markkanen.

[10:13] Team_039 possession (Score: 2-0)
Jrue Bridges attempts a Midrange. Contested by Devin Poole (4.1 feet, MAN). JRUE BRIDGES MAKES IT!
Score: 2-2

[10:02] Team_034 possession (Score: 2-2)
Terry Doncic attempts a 3Pt. Contested by Jrue Bridges (3.2 feet, ZONE). Terry Doncic misses. Rebound secured by Klay Wade.

[09:44] Team_039 possession (Score: 2-2)
Klay Wade drives and kicks out. Jrue Bridges attempts a Midrange. Contested by Devin Poole (3.9 feet, MAN). Jrue Bridges misses. Rebound secured by Terry Doncic.

[09:28] Team_034 possession (Score: 2-2)
Terry Doncic attempts a 3Pt. Contested by Klay Wade (4.1 feet, MAN). Terry Doncic misses. Rebound secured by Klay Wade.

[09:13] Team_039 possession (Score: 2-2)
Anfernee Carter attempts a 3Pt. Contested by Terry Doncic (4.3 feet, MAN). Anfernee Carter misses. Rebound secured by Terry Doncic.

[08:58] Team_034 possession (Score: 2-2)
Devin Poole drives and kicks out. Devin Poole attempts a Midrange. Wide open! Anfernee Carter is 6.6 feet away. [ZONE] DEVIN POOLE MAKES IT! Assist: Cole Antetokounmpo
Score: 4-2

[08:45] Team_039 possession (Score: 4-2)
Austin O'Neal makes the Layup and draws the foul on Terry Doncic! And-1! Austin O'Neal to the line for 1. [Team fouls: 1] (Terry Doncic: 1 personal fouls)   FT 1/1: MISS Austin O'Neal makes 0/1 from the line. Offensive rebound by Austin O'Neal! Austin O'Neal kicks it out.
Score: 4-4

[08:31] Team_039 possession (Score: 4-4)
Austin O'Neal attempts a 3Pt. Contested by Devin Poole (4.0 feet, ZONE). AUSTIN O'NEAL MAKES IT! Assist: Klay Wade
Score: 4-7

[08:15] Team_034 possession (Score: 4-7)
Anthony Bane attempts a Midrange. Contested by Austin O'Neal (4.0 feet, ZONE). Anthony Bane misses. Offensive rebound by Terry Doncic! Terry Doncic puts it back in!
Score: 6-7

[07:59] Team_039 possession (Score: 6-7)
Jrue Bridges attempts a Layup. Contested by Terry Doncic (4.3 feet, ZONE). Jrue Bridges misses. Offensive rebound by Austin O'Neal! Austin O'Neal kicks it out.

[07:42] Team_039 possession (Score: 6-7)
Jrue Bridges drives to the basket... Jrue Bridges loses control! Ball rolls out of bounds! TURNOVER! (dead ball)

[07:30] Team_034 possession (Score: 6-7)
Devin Poole throws a bad pass! Stolen by Jrue Bridges! TURNOVER! (live ball)

[07:15] Team_039 possession (Score: 6-7)
Donovan Markkanen attempts a Layup. Contested by Ben Hyland (3.8 feet, MAN). Donovan Markkanen misses. Rebound secured by Cole Antetokounmpo.

[06:57] Team_034 possession (Score: 6-7)
Ben Hyland drives to the basket... Ben Hyland commits a violation (traveling/carry)! TURNOVER! (dead ball)

[06:41] Team_039 possession (Score: 6-7)
Klay Wade attempts a Layup. Contested by Terry Doncic (4.6 feet, ZONE). KLAY WADE MAKES IT! Assist: Jrue Bridges
Score: 6-9

[06:28] Team_034 possession (Score: 6-9)
Terry Doncic attempts a Dunk. BLOCKED BY KLAY WADE! Ball goes out off Klay Wade. Terry Doncic's ball!

[06:16] Team_034 possession (Score: 6-9)
FOUL! Shooting foul on Donovan Markkanen. Ben Hyland to the line for 3 free throws. [Team fouls: 2] (Donovan Markkanen: 1 personal fouls)   FT 1/3: GOOD   FT 2/3: GOOD   FT 3/3: MISS Ben Hyland makes 2/3 from the line. FOUL! Loose ball foul on Austin O'Neal during the free throw rebound! [Team fouls: 3] No free throws, side out. (Austin O'Neal: 1 personal fouls)
Score: 8-9

[05:57] Team_034 possession (Score: 8-9)
Ben Hyland attempts a 3Pt. Contested by Jrue Bridges (3.1 feet, ZONE). Ben Hyland misses. Rebound secured by Klay Wade.

[05:43] Team_039 possession (Score: 8-9)
Anfernee Carter attempts a 3Pt. Contested by Terry Doncic (4.3 feet, MAN). Anfernee Carter misses. Offensive rebound by Klay Wade! Klay Wade kicks it out.

[05:30] Team_039 possession (Score: 8-9)
Donovan Markkanen attempts a 3Pt. Contested by Ben Hyland (3.8 feet, MAN). Donovan Markkanen misses. Rebound secured by Terry Doncic.

[05:15] Team_034 possession (Score: 8-9)
Devin Poole attempts a 3Pt. Contested by Jrue Bridges (3.0 feet, ZONE). Devin Poole misses. Rebound secured by Klay Wade.

[04:58] Team_039 possession (Score: 8-9)
Klay Wade attempts a 3Pt. Contested by Ben Hyland (4.2 feet, ZONE). Klay Wade misses. Rebound secured by Terry Doncic.

[04:43] Team_034 possession (Score: 8-9)
FOUL! Shooting foul on Klay Wade. Anthony Bane to the line for 2 free throws. [Team fouls: 4] (Klay Wade: 1 personal fouls)   FT 1/2: GOOD   FT 2/2: MISS Anthony Bane makes 1/2 from the line. Offensive rebound by Terry Doncic! Terry Doncic's putback is no good.
Score: 9-9

[04:27] Team_039 possession (Score: 9-9)
Anfernee Carter attempts a Midrange. Contested by Cole Antetokounmpo (4.8 feet, ZONE). ANFERNEE CARTER MAKES IT! Assist: Donovan Markkanen
Score: 9-11

[04:15] Team_034 possession (Score: 9-11)
Cole Antetokounmpo attempts a 3Pt. Contested by Jrue Bridges (3.6 feet, ZONE). Cole Antetokounmpo misses. Rebound secured by Austin O'Neal.

[04:01] Team_039 possession (Score: 9-11)
Donovan Markkanen drives, picks up Ben Hyland. Help arrives from Cole Antetokounmpo! Donovan Markkanen attempts a Layup. Contested by Cole Antetokounmpo (3.9 feet, MAN). DONOVAN MARKKANEN MAKES IT!
Score: 9-13

[03:44] Team_034 possession (Score: 9-13)
Cole Antetokounmpo loses the ball! Stripped by Austin O'Neal! TURNOVER! (live ball)

[03:34] Team_039 possession (Score: 9-13)
Donovan Markkanen attempts a 3Pt. Contested by Ben Hyland (4.0 feet, ZONE). DONOVAN MARKKANEN MAKES IT! Assist: Klay Wade
Score: 9-16

[03:21] Team_034 possession (Score: 9-16)
Anthony Bane attempts a Layup. Contested by Klay Wade (4.2 feet, ZONE). ANTHONY BANE MAKES IT! Assist: Terry Doncic
Score: 11-16

[03:03] Team_039 possession (Score: 11-16)
FOUL! Offensive foul on Jrue Bridges! Devin Poole drew the charge! [Team fouls: 5] (Jrue Bridges: 2 personal fouls) TURNOVER! (dead ball)

[02:51] Team_034 possession (Score: 11-16)
Ben Hyland attempts a 3Pt. Contested by Jrue Bridges (3.4 feet, ZONE). Ben Hyland misses. Rebound secured by Donovan Markkanen.

[02:38] Team_039 possession (Score: 11-16)
Jrue Bridges attempts a Layup. BLOCKED BY BEN HYLAND! Ball deflects out of bounds off Jrue Bridges.

[02:27] Team_034 possession (Score: 11-16)
Ben Hyland attempts a 3Pt. Contested by Jrue Bridges (3.5 feet, ZONE). Ben Hyland misses. Rebound secured by Austin O'Neal.

[02:11] Team_039 possession (Score: 11-16)
Austin O'Neal makes the Midrange and draws the foul on Cole Antetokounmpo! And-1! Austin O'Neal to the line for 1. [Team fouls: 2] (Cole Antetokounmpo: 1 personal fouls)   FT 1/1: GOOD Austin O'Neal makes 1/1 from the line.
Score: 11-19

[01:55] Team_034 possession (Score: 11-19)
FOUL! Shooting foul on Donovan Markkanen. Ben Hyland to the line for 2 free throws. [BONUS: 6 team fouls] (Donovan Markkanen: 2 personal fouls)   FT 1/2: GOOD   FT 2/2: GOOD Ben Hyland makes 2/2 from the line.
Score: 13-19

[01:38] Team_039 possession (Score: 13-19)
FOUL! Reach-in foul on Terry Doncic during the drive. [Team fouls: 3] No free throws, side out. (Terry Doncic: 2 personal fouls)

[01:23] Team_039 possession (Score: 13-19)
Austin O'Neal attempts a 3Pt. Contested by Devin Poole (4.5 feet, ZONE). Austin O'Neal misses. Offensive rebound by Austin O'Neal! Austin O'Neal kicks it out.

[01:07] Team_039 possession (Score: 13-19)
Donovan Markkanen attempts a Layup. Contested by Terry Doncic (4.7 feet, ZONE). Donovan Markkanen misses. Offensive rebound by Austin O'Neal! Austin O'Neal kicks it out.

[00:49] Team_039 possession (Score: 13-19)
Donovan Markkanen attempts a 3Pt. Contested by Devin Poole (4.7 feet, ZONE). DONOVAN MARKKANEN MAKES IT! Assist: Jrue Bridges
Score: 13-22

[00:33] Team_034 possession (Score: 13-22)
Ben Hyland loses the ball! Stripped by Donovan Markkanen! TURNOVER! (live ball)

[00:20] Team_039 possession (Score: 13-22)
Jrue Bridges attempts a 3Pt. Contested by Devin Poole (4.7 feet, ZONE). Jrue Bridges misses. Rebound secured by Terry Doncic.

[00:04] Team_034 possession (Score: 13-22)
Devin Poole attempts a 3Pt. Contested by Jrue Bridges (3.6 feet, ZONE). DEVIN POOLE MAKES IT! Assist: Ben Hyland
Score: 16-22

================================================================================
                              1ST QUARTER COMPLETE                              
================================================================================

1ST QUARTER SCORE: Team_034 16, Team_039 22

BOX SCORE:
================================================================================

Team_034
--------------------------------------------------------------------------------
Player                MIN  PTS  REB  AST  TO      FG   FG%      3P   3P%
--------------------------------------------------------------------------------
Devin Poole            12    7    0    0   0   3/5    60.0     0/0   0.0
Ben Hyland             12    2    0    1   0   1/5    20.0     0/0   0.0
Anthony Bane           12    2    3    0   0   1/2    50.0     0/0   0.0
Terry Doncic           12    2    7    1   0   1/4    25.0     0/0   0.0
Cole Antetokounmpo     12    0    1    1   0   0/1     0.0     0/0   0.0

TEAM: FG: 6/17 (35.3%), 3PT: 1/10 (10.0%), REB: 10 (3 off, 7 def), AST: 3, TO: 4
TEAM FOULS: 3


Team_039
--------------------------------------------------------------------------------
Player                MIN  PTS  REB  AST  TO      FG   FG%      3P   3P%
--------------------------------------------------------------------------------
Donovan Markkanen      12    8    2    1   0   3/6    50.0     0/0   0.0
Austin O'Neal          12    6    6    0   0   2/2   100.0     0/0   0.0
Klay Wade              12    2    7    2   0   1/3    33.3     0/0   0.0
Jrue Bridges           12    2    0    2   0   1/3    33.3     0/0   0.0
Anfernee Carter        12    2    0    0   0   1/2    50.0     0/0   0.0

TEAM: FG: 8/16 (50.0%), 3PT: 3/8 (37.5%), REB: 16 (5 off, 11 def), AST: 5, TO: 4
TEAM FOULS: 6 [Team_034 in BONUS]

================================================================================

================================================================================
                       2ND QUARTER - Team_034 vs Team_039                       
================================================================================

[12:00] Team_034 possession (Score: 16-22)
Devin Poole makes the Layup and draws the foul on Klay Wade! And-1! Devin Poole to the line for 1. [Team fouls: 1] (Klay Wade: 1 personal fouls)   FT 1/1: GOOD Devin Poole makes 1/1 from the line.
Score: 19-22

[11:49] Team_039 possession (Score: 19-22)
Anfernee Carter throws a bad pass out of bounds! TURNOVER! (dead ball)

[11:49] Substitution (Team_034): Devin Poole OUT → Manu Jokic IN (stamina_rule2)

[11:49] Substitution (Team_034): Ben Hyland OUT → Damian Turner IN (stamina_rule2)

[11:49] Substitution (Team_034): Cole Antetokounmpo OUT → Vince Paul IN (stamina_rule2)

[11:49] Substitution (Team_034): Terry Doncic OUT → Nikola Wagner IN (stamina_rule2)

[11:49] Substitution (Team_034): Anthony Bane OUT → Carmelo Anunoby IN (stamina_rule2)

[11:49] Substitution (Team_039): Jrue Bridges OUT → Tracy Mitchell IN (stamina_rule2)

[11:49] Substitution (Team_039): Donovan Markkanen OUT → Jayson Cunningham IN (stamina_rule2)

[11:49] Substitution (Team_039): Austin O'Neal OUT → Yao Carter IN (stamina_rule2)

[11:49] Substitution (Team_039): Anfernee Carter OUT → Victor Gasol IN (stamina_rule2)

[11:49] Substitution (Team_039): Klay Wade OUT → Bam Booker IN (stamina_rule2)

[11:32] Team_034 possession (Score: 19-22)
Damian Turner attempts a Midrange. Wide open! Jayson Cunningham is 6.0 feet away. [MAN] Damian Turner misses. Rebound secured by Victor Gasol.

[11:16] Team_039 possession (Score: 19-22)
Bam Booker attempts a Midrange. Wide open! Nikola Wagner is 6.3 feet away. [ZONE] BAM BOOKER MAKES IT!
Score: 19-24

[11:01] Team_034 possession (Score: 19-24)
Nikola Wagner attempts a Midrange. Contested by Victor Gasol (3.4 feet, MAN). NIKOLA WAGNER MAKES IT! Assist: Manu Jokic
Score: 21-24

[10:47] Team_039 possession (Score: 21-24)
Victor Gasol attempts a Midrange. Contested by Vince Paul (4.4 feet, ZONE). VICTOR GASOL MAKES IT! Assist: Tracy Mitchell
Score: 21-26

[10:37] Team_034 possession (Score: 21-26)
Vince Paul attempts a 3Pt. Contested by Yao Carter (4.5 feet, MAN). Vince Paul misses. Rebound secured by Yao Carter.

[10:19] Team_039 possession (Score: 21-26)
Bam Booker attempts a 3Pt. Contested by Carmelo Anunoby (5.7 feet, MAN). Bam Booker misses. Rebound secured by Carmelo Anunoby.

[10:07] Team_034 possession (Score: 21-26)
Damian Turner attempts a 3Pt. Wide open! Jayson Cunningham is 6.0 feet away. [MAN] Damian Turner misses. Rebound secured by Bam Booker.

[09:53] Team_039 possession (Score: 21-26)
Jayson Cunningham attempts a 3Pt. Contested by Damian Turner (5.6 feet, MAN). Jayson Cunningham misses. Rebound secured by Vince Paul.

[09:38] Team_034 possession (Score: 21-26)
Damian Turner drives and kicks out. Carmelo Anunoby attempts a 3Pt. Contested by Tracy Mitchell (5.6 feet, ZONE). Carmelo Anunoby misses. Rebound secured by Victor Gasol.

[09:25] Team_039 possession (Score: 21-26)
Bam Booker drives, Carmelo Anunoby stays with him. Bam Booker attempts a Layup. Contested by Carmelo Anunoby (5.7 feet, MAN). BAM BOOKER MAKES IT! Assist: Tracy Mitchell
Score: 21-28

[09:14] Team_034 possession (Score: 21-28)
Damian Turner attempts a Midrange. Wide open! Jayson Cunningham is 6.0 feet away. [MAN] DAMIAN TURNER MAKES IT! Assist: Nikola Wagner
Score: 23-28

[08:56] Team_039 possession (Score: 23-28)
Tracy Mitchell attempts a 3Pt. Contested by Vince Paul (4.7 feet, ZONE). TRACY MITCHELL MAKES IT! Assist: Jayson Cunningham
Score: 23-31

[08:40] Team_034 possession (Score: 23-31)
FOUL! Offensive foul on Nikola Wagner! Victor Gasol drew the charge! [Team fouls: 1] (Nikola Wagner: 1 personal fouls) TURNOVER! (dead ball)

[08:28] Team_039 possession (Score: 23-31)
Victor Gasol drives and kicks out. Jayson Cunningham attempts a 3Pt. Contested by Vince Paul (4.2 feet, ZONE). Jayson Cunningham misses. Offensive rebound by Victor Gasol! Victor Gasol kicks it out.

[08:13] Team_039 possession (Score: 23-31)
Victor Gasol makes the Layup and draws the foul on Carmelo Anunoby! And-1! Victor Gasol to the line for 1. [Team fouls: 2] (Carmelo Anunoby: 1 personal fouls)   FT 1/1: GOOD Victor Gasol makes 1/1 from the line.
Score: 23-34

[07:59] Team_034 possession (Score: 23-34)
Carmelo Anunoby attempts a Midrange. Contested by Yao Carter (4.2 feet, ZONE). Carmelo Anunoby misses. Rebound secured by Yao Carter.

[07:47] Team_039 possession (Score: 23-34)
FOUL! Offensive foul on Bam Booker! Carmelo Anunoby drew the charge! [Team fouls: 2] (Bam Booker: 1 personal fouls) TURNOVER! (dead ball)

[07:34] Team_034 possession (Score: 23-34)
Vince Paul attempts a Midrange. Contested by Victor Gasol (3.7 feet, ZONE). Vince Paul misses. Offensive rebound by Vince Paul! Vince Paul puts it back in!
Score: 25-34

[07:19] Team_039 possession (Score: 25-34)
Yao Carter drives to the basket... Yao Carter loses control! Ball rolls out of bounds! TURNOVER! (dead ball)

[07:05] Team_034 possession (Score: 25-34)
Carmelo Anunoby drives, Bam Booker stays with him. Carmelo Anunoby attempts a Dunk. Contested by Bam Booker (4.8 feet, MAN). CARMELO ANUNOBY MAKES IT!
Score: 27-34

[06:50] Team_039 possession (Score: 27-34)
Victor Gasol drives and kicks out. Victor Gasol attempts a Midrange. Wide open! Nikola Wagner is 6.0 feet away. [MAN] Victor Gasol misses. Rebound secured by Carmelo Anunoby.

[06:36] Team_034 possession (Score: 27-34)
FOUL! Shooting foul on Jayson Cunningham. Manu Jokic to the line for 2 free throws. [Team fouls: 3] (Jayson Cunningham: 1 personal fouls)   FT 1/2: GOOD   FT 2/2: MISS Manu Jokic makes 1/2 from the line. Rebound secured by Bam Booker.
Score: 28-34

[06:22] Team_039 possession (Score: 28-34)
Bam Booker drives, Carmelo Anunoby stays with him. Bam Booker attempts a Dunk. Contested by Carmelo Anunoby (5.7 feet, ZONE). BAM BOOKER MAKES IT! Assist: Yao Carter
Score: 28-36

[06:08] Team_034 possession (Score: 28-36)
Manu Jokic attempts a Midrange. Contested by Yao Carter (4.2 feet, ZONE). Manu Jokic misses. Rebound secured by Yao Carter.

[05:53] Team_039 possession (Score: 28-36)
Bam Booker attempts a Layup. BLOCKED BY CARMELO ANUNOBY! Ball is loose! Offensive rebound by Victor Gasol! Victor Gasol kicks it out.

[05:35] Team_039 possession (Score: 28-36)
Victor Gasol attempts a 3Pt. Wide open! Nikola Wagner is 6.2 feet away. [MAN] VICTOR GASOL MAKES IT! Assist: Bam Booker
Score: 28-39

[05:20] Team_034 possession (Score: 28-39)
Damian Turner attempts a 3Pt. Wide open! Tracy Mitchell is 6.0 feet away. [ZONE] DAMIAN TURNER MAKES IT! Assist: Vince Paul
Score: 31-39

[05:05] Team_039 possession (Score: 31-39)
Yao Carter attempts a 3Pt. Contested by Vince Paul (4.3 feet, MAN). YAO CARTER MAKES IT! Assist: Victor Gasol
Score: 31-42

[04:50] Team_034 possession (Score: 31-42)
Nikola Wagner attempts a 3Pt. Contested by Tracy Mitchell (5.8 feet, ZONE). Nikola Wagner misses. Rebound secured by Victor Gasol.

[04:37] Team_039 possession (Score: 31-42)
Yao Carter attempts a 3Pt. Contested by Vince Paul (4.4 feet, ZONE). YAO CARTER MAKES IT! Assist: Tracy Mitchell
Score: 31-45

[04:22] Team_034 possession (Score: 31-45)
FOUL! Reach-in foul on Tracy Mitchell during the drive. [Team fouls: 4] No free throws, side out. (Tracy Mitchell: 1 personal fouls)

[04:13] Team_034 possession (Score: 31-45)
Damian Turner attempts a 3Pt. Wide open! Tracy Mitchell is 6.1 feet away. [ZONE] Damian Turner misses. Rebound secured by Victor Gasol.

[04:03] Team_039 possession (Score: 31-45)
Yao Carter attempts a 3Pt. Contested by Vince Paul (4.4 feet, MAN). Yao Carter misses. Offensive rebound by Victor Gasol! Victor Gasol kicks it out.

[03:44] Team_039 possession (Score: 31-45)
Tracy Mitchell makes the Midrange and draws the foul on Manu Jokic! And-1! Tracy Mitchell to the line for 1. [Team fouls: 3] (Manu Jokic: 1 personal fouls)   FT 1/1: GOOD Tracy Mitchell makes 1/1 from the line.
Score: 31-48

[03:27] Team_034 possession (Score: 31-48)
Nikola Wagner attempts a 3Pt. Contested by Victor Gasol (3.5 feet, MAN). Nikola Wagner misses. Rebound secured by Yao Carter.

[03:12] Team_039 possession (Score: 31-48)
Tracy Mitchell attempts a Layup. Wide open! Carmelo Anunoby is 6.2 feet away. [ZONE] Tracy Mitchell misses. Rebound secured by Vince Paul.

[02:59] Team_034 possession (Score: 31-48)
Damian Turner drives and kicks out. Nikola Wagner makes the Midrange and draws the foul on Victor Gasol! And-1! Nikola Wagner to the line for 1. [BONUS: 5 team fouls] (Victor Gasol: 1 personal fouls)   FT 1/1: GOOD Nikola Wagner makes 1/1 from the line.
Score: 34-48

[02:48] Team_039 possession (Score: 34-48)
Yao Carter attempts a 3Pt. Contested by Vince Paul (4.5 feet, MAN). Yao Carter misses. Rebound secured by Vince Paul.

[02:32] Team_034 possession (Score: 34-48)
Nikola Wagner attempts a 3Pt. Contested by Tracy Mitchell (5.9 feet, ZONE). NIKOLA WAGNER MAKES IT! Assist: Damian Turner
Score: 37-48

[02:15] Team_039 possession (Score: 37-48)
Tracy Mitchell drives and kicks out. Tracy Mitchell attempts a Midrange. Wide open! Nikola Wagner is 6.3 feet away. [ZONE] Tracy Mitchell misses. Rebound secured by Nikola Wagner.

[02:00] Team_034 possession (Score: 37-48)
Manu Jokic attempts a 3Pt. Contested by Tracy Mitchell (5.9 feet, MAN). Manu Jokic misses. Rebound secured by Yao Carter.

[01:46] Team_039 possession (Score: 37-48)
Jayson Cunningham attempts a Midrange. Contested by Damian Turner (6.0 feet, MAN). JAYSON CUNNINGHAM MAKES IT! Assist: Tracy Mitchell
Score: 37-50

[01:34] Team_034 possession (Score: 37-50)
Carmelo Anunoby drives and kicks out. Vince Paul attempts a 3Pt. Contested by Tracy Mitchell (5.9 feet, ZONE). Vince Paul misses. Rebound secured by Bam Booker.

[01:21] Team_039 possession (Score: 37-50)
Bam Booker drives and kicks out. Bam Booker attempts a 3Pt. Contested by Vince Paul (4.6 feet, ZONE). Bam Booker misses. Rebound secured by Carmelo Anunoby.

[01:04] Team_034 possession (Score: 37-50)
Carmelo Anunoby drives and kicks out. Nikola Wagner attempts a 3Pt. Contested by Victor Gasol (3.7 feet, MAN). Nikola Wagner misses. Rebound secured by Yao Carter.

[00:55] Team_039 possession (Score: 37-50)
Jayson Cunningham attempts a 3Pt. Wide open! Damian Turner is 6.1 feet away. [MAN] JAYSON CUNNINGHAM MAKES IT! Assist: Bam Booker
Score: 37-53

[00:43] Team_034 possession (Score: 37-53)
Carmelo Anunoby drives to the basket... Carmelo Anunoby throws a bad pass! Stolen by Victor Gasol! TURNOVER! (live ball)

[00:29] Team_039 possession (Score: 37-53)
Yao Carter makes the Midrange and draws the foul on Vince Paul! And-1! Yao Carter to the line for 1. [Team fouls: 4] (Vince Paul: 1 personal fouls)   FT 1/1: MISS Yao Carter makes 0/1 from the line. Rebound secured by Carmelo Anunoby.
Score: 37-55

[00:16] Team_034 possession (Score: 37-55)
Nikola Wagner attempts a Midrange. Wide open! Tracy Mitchell is 6.1 feet away. [ZONE] Nikola Wagner misses. Offensive rebound by Vince Paul! Vince Paul kicks it out.

[00:03] Team_034 possession (Score: 37-55)
Carmelo Anunoby makes the Layup and draws the foul on Bam Booker! And-1! Carmelo Anunoby to the line for 1. [BONUS: 6 team fouls] (Bam Booker: 2 personal fouls)   FT 1/1: MISS Carmelo Anunoby makes 0/1 from the line. Offensive rebound by Vince Paul! Vince Paul kicks it out.
Score: 39-55

================================================================================
                              2ND QUARTER COMPLETE                              
================================================================================

2ND QUARTER SCORE: Team_034 23, Team_039 33

BOX SCORE:
================================================================================

Team_034
--------------------------------------------------------------------------------
Player                MIN  PTS  REB  AST  TO      FG   FG%      3P   3P%
--------------------------------------------------------------------------------
Nikola Wagner          12    8    1    1   0   3/5    60.0     0/0   0.0
Damian Turner          12    5    0    1   0   2/6    33.3     0/0   0.0
Devin Poole            13    3    0    0   0   1/1   100.0     0/0   0.0
Vince Paul             12    2    6    1   0   1/2    50.0     0/0   0.0
Carmelo Anunoby        12    2    4    0   0   1/4    25.0     0/0   0.0
Manu Jokic             12    0    0    1   0   0/3     0.0     0/0   0.0

TEAM: FG: 8/21 (38.1%), 3PT: 2/8 (25.0%), REB: 11 (3 off, 8 def), AST: 4, TO: 2
TEAM FOULS: 4


Team_039
--------------------------------------------------------------------------------
Player                MIN  PTS  REB  AST  TO      FG   FG%      3P   3P%
--------------------------------------------------------------------------------
Victor Gasol           12    8    7    1   0   3/4    75.0     0/0   0.0
Bam Booker             12    6    3    2   0   3/5    60.0     0/0   0.0
Tracy Mitchell         12    6    0    4   0   2/4    50.0     0/0   0.0
Yao Carter             12    6    6    1   0   2/4    50.0     0/0   0.0
Jayson Cunningham      12    5    0    1   0   2/3    66.7     0/0   0.0

TEAM: FG: 12/20 (60.0%), 3PT: 5/8 (62.5%), REB: 16 (3 off, 13 def), AST: 9, TO: 3
TEAM FOULS: 6 [Team_034 in BONUS]

================================================================================

================================================================================
                       3RD QUARTER - Team_034 vs Team_039                       
================================================================================

[12:00] Team_034 possession (Score: 39-55)
Anthony Bane attempts a Midrange. Contested by Klay Wade (4.1 feet, MAN). Anthony Bane misses. Rebound secured by Donovan Markkanen.

[11:48] Team_039 possession (Score: 39-55)
Klay Wade drives, picks up Terry Doncic. Help arrives from Ben Hyland! Klay Wade attempts a Dunk. Contested by Ben Hyland (4.6 feet, ZONE). KLAY WADE MAKES IT! Assist: Anfernee Carter
Score: 39-57

[11:34] Team_034 possession (Score: 39-57)
Cole Antetokounmpo throws a bad pass out of bounds! TURNOVER! (dead ball)

[11:22] Team_039 possession (Score: 39-57)
FOUL! Reach-in foul on Cole Antetokounmpo during the drive. [Team fouls: 1] No free throws, side out. (Cole Antetokounmpo: 1 personal fouls)

[11:07] Team_039 possession (Score: 39-57)
Anfernee Carter drives, picks up Terry Doncic. Help arrives from Ben Hyland! Anfernee Carter attempts a Layup. Contested by Ben Hyland (4.3 feet, ZONE). Anfernee Carter misses. Offensive rebound by Klay Wade! Klay Wade kicks it out.

[10:48] Team_039 possession (Score: 39-57)
Anfernee Carter drives, Terry Doncic stays with him. Anfernee Carter attempts a Dunk. Contested by Terry Doncic (4.3 feet, MAN). Anfernee Carter misses. Offensive rebound by Austin O'Neal! Austin O'Neal kicks it out.

[10:36] Team_039 possession (Score: 39-57)
FOUL! Holding foul on Cole Antetokounmpo. [Team fouls: 2] No free throws, side out. (Cole Antetokounmpo: 2 personal fouls)

[10:20] Team_039 possession (Score: 39-57)
Anfernee Carter attempts a 3Pt. Contested by Terry Doncic (4.3 feet, MAN). Anfernee Carter misses. Offensive rebound by Klay Wade! Klay Wade kicks it out.

[10:09] Team_039 possession (Score: 39-57)
Klay Wade attempts a Layup. Contested by Terry Doncic (4.6 feet, ZONE). KLAY WADE MAKES IT! Assist: Austin O'Neal
Score: 39-59

[09:55] Team_034 possession (Score: 39-59)
Ben Hyland attempts a 3Pt. Contested by Donovan Markkanen (3.8 feet, MAN). Ben Hyland misses. Rebound secured by Klay Wade.

[09:44] Team_039 possession (Score: 39-59)
Jrue Bridges attempts a 3Pt. Contested by Devin Poole (4.1 feet, MAN). JRUE BRIDGES MAKES IT! Assist: Austin O'Neal
Score: 39-62

[09:30] Team_034 possession (Score: 39-62)
Terry Doncic attempts a Layup. Contested by Klay Wade (4.1 feet, MAN). TERRY DONCIC MAKES IT!
Score: 41-62

[09:17] Team_039 possession (Score: 41-62)
Klay Wade makes the Layup and draws the foul on Anthony Bane! And-1! Klay Wade to the line for 1. [Team fouls: 3] (Anthony Bane: 1 personal fouls)   FT 1/1: GOOD Klay Wade makes 1/1 from the line.
Score: 41-65

[09:01] Team_034 possession (Score: 41-65)
Ben Hyland drives, picks up Klay Wade. Help arrives from Donovan Markkanen! Ben Hyland attempts a Dunk. Contested by Donovan Markkanen (4.0 feet, ZONE). BEN HYLAND MAKES IT! Assist: Terry Doncic
Score: 43-65

[08:44] Team_039 possession (Score: 43-65)
Donovan Markkanen makes the Layup and draws the foul on Terry Doncic! And-1! Donovan Markkanen to the line for 1. [Team fouls: 4] (Terry Doncic: 1 personal fouls)   FT 1/1: GOOD Donovan Markkanen makes 1/1 from the line.
Score: 43-68

[08:32] Team_034 possession (Score: 43-68)
Terry Doncic makes the Dunk and draws the foul on Donovan Markkanen! And-1! Terry Doncic to the line for 1. [Team fouls: 1] (Donovan Markkanen: 1 personal fouls)   FT 1/1: MISS Terry Doncic makes 0/1 from the line. Rebound secured by Donovan Markkanen.
Score: 45-68

[08:20] Team_039 possession (Score: 45-68)
Anfernee Carter makes the Dunk and draws the foul on Terry Doncic! And-1! Anfernee Carter to the line for 1. [BONUS: 5 team fouls] (Terry Doncic: 2 personal fouls)   FT 1/1: GOOD Anfernee Carter makes 1/1 from the line.
Score: 45-71

[08:11] Team_034 possession (Score: 45-71)
Devin Poole drives to the basket... Devin Poole throws a bad pass! Stolen by Jrue Bridges! TURNOVER! (live ball)

[07:57] Team_039 possession (Score: 45-71)
Anfernee Carter attempts a Midrange. Contested by Ben Hyland (3.8 feet, ZONE). Anfernee Carter misses. FOUL! Loose ball foul on Cole Antetokounmpo during the rebound battle. [IN THE BONUS! 6 team fouls] Austin O'Neal to the line for 2 free throws. (Cole Antetokounmpo: 3 personal fouls)   FT 1/2: GOOD   FT 2/2: GOOD Austin O'Neal makes 2/2 from the line.
Score: 45-73

[07:40] Team_034 possession (Score: 45-73)
Terry Doncic attempts a Layup. Contested by Klay Wade (4.1 feet, ZONE). Terry Doncic misses. Offensive rebound by Terry Doncic! Terry Doncic's putback is no good. Rebound secured by Donovan Markkanen.

[07:28] Team_039 possession (Score: 45-73)
Austin O'Neal throws a bad pass out of bounds! TURNOVER! (dead ball)

[07:13] Team_034 possession (Score: 45-73)
Anthony Bane attempts a Midrange. Wide open! Anfernee Carter is 6.7 feet away. [ZONE] Anthony Bane misses. Rebound secured by Austin O'Neal.

[06:59] Team_039 possession (Score: 45-73)
Donovan Markkanen drives and kicks out. Klay Wade attempts a Midrange. Contested by Anthony Bane (5.2 feet, MAN). Klay Wade misses. Rebound secured by Anthony Bane.

[06:48] Team_034 possession (Score: 45-73)
FOUL! Shooting foul on Klay Wade. Anthony Bane to the line for 2 free throws. [Team fouls: 2] (Klay Wade: 1 personal fouls)   FT 1/2: GOOD   FT 2/2: GOOD Anthony Bane makes 2/2 from the line.
Score: 47-73

[06:36] Team_039 possession (Score: 47-73)
Klay Wade makes the Midrange and draws the foul on Terry Doncic! And-1! Klay Wade to the line for 1. [BONUS: 7 team fouls] (Terry Doncic: 3 personal fouls)   FT 1/1: GOOD Klay Wade makes 1/1 from the line.
Score: 47-76

[06:20] Team_034 possession (Score: 47-76)
FOUL! Shooting foul on Jrue Bridges. Devin Poole to the line for 2 free throws. [Team fouls: 3] (Jrue Bridges: 1 personal fouls)   FT 1/2: MISS   FT 2/2: GOOD Devin Poole makes 1/2 from the line.
Score: 48-76

[06:01] Team_039 possession (Score: 48-76)
Donovan Markkanen makes the Dunk and draws the foul on Ben Hyland! And-1! Donovan Markkanen to the line for 1. [BONUS: 8 team fouls] (Ben Hyland: 1 personal fouls)   FT 1/1: GOOD Donovan Markkanen makes 1/1 from the line.
Score: 48-79

[05:42] Team_034 possession (Score: 48-79)
Ben Hyland attempts a 3Pt. Contested by Jrue Bridges (3.2 feet, ZONE). Ben Hyland misses. Rebound secured by Klay Wade.

[05:29] Team_039 possession (Score: 48-79)
Klay Wade attempts a Layup. Contested by Terry Doncic (4.6 feet, ZONE). KLAY WADE MAKES IT!
Score: 48-81

[05:10] Team_034 possession (Score: 48-81)
Terry Doncic drives and kicks out. Devin Poole attempts a Midrange. Contested by Jrue Bridges (3.1 feet, MAN). Devin Poole misses. Rebound secured by Klay Wade.

[04:56] Team_039 possession (Score: 48-81)
Austin O'Neal attempts a 3Pt. Contested by Devin Poole (4.1 feet, ZONE). AUSTIN O'NEAL MAKES IT! Assist: Klay Wade
Score: 48-84

[04:45] Team_034 possession (Score: 48-84)
Anthony Bane attempts a Layup. Contested by Klay Wade (4.1 feet, ZONE). ANTHONY BANE MAKES IT!
Score: 50-84

[04:34] Team_039 possession (Score: 50-84)
Austin O'Neal attempts a 3Pt. Contested by Devin Poole (4.1 feet, ZONE). AUSTIN O'NEAL MAKES IT! Assist: Klay Wade
Score: 50-87

[04:18] Team_034 possession (Score: 50-87)
Devin Poole attempts a 3Pt. Contested by Jrue Bridges (3.1 feet, MAN). Devin Poole misses. Rebound secured by Austin O'Neal.

[04:02] Team_039 possession (Score: 50-87)
Donovan Markkanen attempts a 3Pt. Contested by Ben Hyland (3.9 feet, MAN). DONOVAN MARKKANEN MAKES IT! Assist: Austin O'Neal
Score: 50-90

[03:48] Team_034 possession (Score: 50-90)
Anthony Bane makes the Dunk and draws the foul on Donovan Markkanen! And-1! Anthony Bane to the line for 1. [Team fouls: 4] (Donovan Markkanen: 2 personal fouls)   FT 1/1: GOOD Anthony Bane makes 1/1 from the line.
Score: 53-90

[03:34] Team_039 possession (Score: 53-90)
Austin O'Neal attempts a Midrange. Contested by Cole Antetokounmpo (4.8 feet, ZONE). Austin O'Neal misses. Rebound secured by Terry Doncic.

[03:20] Team_034 possession (Score: 53-90)
Ben Hyland attempts a 3Pt. Contested by Donovan Markkanen (4.0 feet, MAN). Ben Hyland misses. Rebound secured by Austin O'Neal.

[03:03] Team_039 possession (Score: 53-90)
Anfernee Carter drives, Terry Doncic stays with him. Anfernee Carter attempts a Dunk. Contested by Terry Doncic (4.5 feet, MAN). ANFERNEE CARTER MAKES IT! Assist: Klay Wade
Score: 53-92

[02:46] Team_034 possession (Score: 53-92)
Ben Hyland drives and kicks out. Ben Hyland attempts a 3Pt. Wide open! Anfernee Carter is 6.9 feet away. [ZONE] BEN HYLAND MAKES IT! Assist: Cole Antetokounmpo
Score: 56-92

[02:32] Team_039 possession (Score: 56-92)
Klay Wade drives and kicks out. Donovan Markkanen attempts a 3Pt. Contested by Ben Hyland (3.9 feet, MAN). Donovan Markkanen misses. Rebound secured by Anthony Bane.

[02:18] Team_034 possession (Score: 56-92)
Cole Antetokounmpo attempts a 3Pt. Contested by Austin O'Neal (4.7 feet, MAN). Cole Antetokounmpo misses. Offensive rebound by Anthony Bane! Anthony Bane kicks it out.

[02:01] Team_034 possession (Score: 56-92)
Cole Antetokounmpo attempts a 3Pt. Contested by Jrue Bridges (3.9 feet, ZONE). Cole Antetokounmpo misses. Rebound secured by Donovan Markkanen.

[01:44] Team_039 possession (Score: 56-92)
FOUL! Holding foul on Terry Doncic. [IN THE BONUS! 9 team fouls] Anfernee Carter to the line for 2 free throws. (Terry Doncic: 4 personal fouls)   FT 1/2: GOOD   FT 2/2: GOOD Anfernee Carter makes 2/2 from the line.
Score: 56-94

[01:31] Team_034 possession (Score: 56-94)
Cole Antetokounmpo attempts a Layup. Contested by Austin O'Neal (4.8 feet, MAN). Cole Antetokounmpo misses. FOUL! Loose ball foul on Klay Wade during the rebound battle. [IN THE BONUS! 5 team fouls] Anthony Bane to the line for 2 free throws. (Klay Wade: 2 personal fouls)   FT 1/2: GOOD   FT 2/2: GOOD Anthony Bane makes 2/2 from the line.
Score: 58-94

[01:17] Team_039 possession (Score: 58-94)
Jrue Bridges attempts a 3Pt. Contested by Devin Poole (4.6 feet, MAN). JRUE BRIDGES MAKES IT! Assist: Klay Wade
Score: 58-97

[01:00] Team_034 possession (Score: 58-97)
FOUL! Reach-in foul on Klay Wade during the drive. [IN THE BONUS! 6 team fouls] Ben Hyland to the line for 2 free throws. (Klay Wade: 3 personal fouls)   FT 1/2: MISS   FT 2/2: GOOD Ben Hyland makes 1/2 from the line.
Score: 59-97

[00:47] Team_039 possession (Score: 59-97)
Klay Wade attempts a Midrange. Wide open! Anthony Bane is 6.0 feet away. [MAN] Klay Wade misses. Rebound secured by Cole Antetokounmpo.

[00:31] Team_034 possession (Score: 59-97)
Devin Poole attempts a 3Pt. Contested by Jrue Bridges (3.6 feet, MAN). Devin Poole misses. Offensive rebound by Anthony Bane! Anthony Bane kicks it out.

[00:17] Team_034 possession (Score: 59-97)
Devin Poole attempts a 3Pt. Contested by Jrue Bridges (3.6 feet, ZONE). Devin Poole misses. Rebound secured by Klay Wade.

[00:02] Team_039 possession (Score: 59-97)
Donovan Markkanen attempts a 3Pt. Contested by Devin Poole (4.8 feet, ZONE). Donovan Markkanen misses. Rebound secured by Anthony Bane.

================================================================================
                              3RD QUARTER COMPLETE                              
================================================================================

3RD QUARTER SCORE: Team_034 20, Team_039 42

BOX SCORE:
================================================================================

Team_034
--------------------------------------------------------------------------------
Player                MIN  PTS  REB  AST  TO      FG   FG%      3P   3P%
--------------------------------------------------------------------------------
Anthony Bane           25    9    5    0   0   4/6    66.7     0/0   0.0
Ben Hyland             25    6    0    0   0   3/6    50.0     0/0   0.0
Terry Doncic           25    2    1    1   0   1/4    25.0     0/0   0.0
Devin Poole            25    1    0    0   0   1/3    33.3     0/0   0.0
Cole Antetokounmpo     25    0    1    1   0   0/1     0.0     0/0   0.0

TEAM: FG: 9/20 (45.0%), 3PT: 0/6 (0.0%), REB: 8 (3 off, 5 def), AST: 2, TO: 2
TEAM FOULS: 9 [Team_039 in BONUS]


Team_039
--------------------------------------------------------------------------------
Player                MIN  PTS  REB  AST  TO      FG   FG%      3P   3P%
--------------------------------------------------------------------------------
Klay Wade              25   12    6    4   0   5/7    71.4     0/0   0.0
Donovan Markkanen      25    9    4    0   0   3/5    60.0     0/0   0.0
Austin O'Neal          25    8    4    3   0   3/4    75.0     0/0   0.0
Anfernee Carter        25    7    0    1   0   3/3   100.0     0/0   0.0
Jrue Bridges           25    6    0    0   0   2/2   100.0     0/0   0.0

TEAM: FG: 16/21 (76.2%), 3PT: 5/6 (83.3%), REB: 13 (3 off, 10 def), AST: 8, TO: 1
TEAM FOULS: 6 [Team_034 in BONUS]

================================================================================

================================================================================
                       4TH QUARTER - Team_034 vs Team_039                       
================================================================================

[12:00] Substitution (Team_034): Devin Poole OUT (stamina: 66) → Manu Jokic IN (comeback_detected)

[12:00] Substitution (Team_039): Jrue Bridges OUT (stamina: 68) → Tracy Mitchell IN (comeback_detected)

[12:00] Team_034 possession (Score: 59-97)
Cole Antetokounmpo attempts a Midrange. Contested by Austin O'Neal (4.8 feet, MAN). Cole Antetokounmpo misses. Rebound secured by Austin O'Neal.

[11:44] Team_039 possession (Score: 59-97)
Donovan Markkanen drives and kicks out. Austin O'Neal attempts a 3Pt. Contested by Ben Hyland (3.9 feet, ZONE). Austin O'Neal misses. Rebound secured by Cole Antetokounmpo.

[11:29] Team_034 possession (Score: 59-97)
Ben Hyland attempts a 3Pt. Contested by Donovan Markkanen (4.1 feet, MAN). Ben Hyland misses. Rebound secured by Austin O'Neal.

[11:12] Team_039 possession (Score: 59-97)
FOUL! Reach-in foul on Terry Doncic during the drive. [Team fouls: 1] No free throws, side out. (Terry Doncic: 1 personal fouls)

[10:59] Team_039 possession (Score: 59-97)
Anfernee Carter attempts a Layup. Contested by Terry Doncic (4.7 feet, MAN). ANFERNEE CARTER MAKES IT!
Score: 59-99

[10:47] Team_034 possession (Score: 59-99)
Anthony Bane attempts a Midrange. Contested by Klay Wade (4.5 feet, MAN). ANTHONY BANE MAKES IT!
Score: 61-99

[10:33] Team_039 possession (Score: 61-99)
Donovan Markkanen attempts a Midrange. Contested by Ben Hyland (4.3 feet, MAN). DONOVAN MARKKANEN MAKES IT! Assist: Tracy Mitchell
Score: 61-101

[10:19] Team_034 possession (Score: 61-101)
Anthony Bane drives, Klay Wade stays with him. Anthony Bane attempts a Layup. Contested by Klay Wade (4.5 feet, ZONE). ANTHONY BANE MAKES IT! Assist: Manu Jokic
Score: 63-101

[10:08] Team_039 possession (Score: 63-101)
Austin O'Neal attempts a 3Pt. Contested by Cole Antetokounmpo (5.1 feet, MAN). Austin O'Neal misses. FOUL! Loose ball foul on Terry Doncic during the rebound battle. [Team fouls: 2] No free throws, side out. (Terry Doncic: 2 personal fouls)

[09:56] Team_039 possession (Score: 63-101)
Tracy Mitchell attempts a 3Pt. Contested by Ben Hyland (4.7 feet, ZONE). Tracy Mitchell misses. Rebound secured by Anthony Bane.

[09:40] Team_034 possession (Score: 63-101)
Terry Doncic drives to the basket... Terry Doncic loses the ball! Stripped by Klay Wade! TURNOVER! (live ball)

[09:25] Team_039 possession (Score: 63-101)
Anfernee Carter attempts a 3Pt. Contested by Terry Doncic (4.9 feet, MAN). ANFERNEE CARTER MAKES IT! Assist: Klay Wade
Score: 63-104

[09:10] Team_034 possession (Score: 63-104)
Ben Hyland drives and kicks out. Terry Doncic makes the 3Pt and draws the foul on Tracy Mitchell! And-1! Terry Doncic to the line for 1. [Team fouls: 1] (Tracy Mitchell: 1 personal fouls)   FT 1/1: GOOD Terry Doncic makes 1/1 from the line.
Score: 67-104

[08:53] Team_039 possession (Score: 67-104)
Tracy Mitchell drives, picks up Manu Jokic. Help arrives from Ben Hyland! Tracy Mitchell attempts a Dunk. Contested by Ben Hyland (5.2 feet, MAN). Tracy Mitchell misses. Offensive rebound by Klay Wade! Klay Wade kicks it out.

[08:40] Team_039 possession (Score: 67-104)
Anfernee Carter attempts a 3Pt. Contested by Ben Hyland (4.5 feet, ZONE). Anfernee Carter misses. Rebound secured by Anthony Bane.

[08:30] Team_034 possession (Score: 67-104)
Cole Antetokounmpo attempts a 3Pt. Contested by Austin O'Neal (5.2 feet, MAN). COLE ANTETOKOUNMPO MAKES IT! Assist: Anthony Bane
Score: 70-104

[08:17] Team_039 possession (Score: 70-104)
Anfernee Carter drives, Terry Doncic stays with him. Anfernee Carter attempts a Dunk. Contested by Terry Doncic (5.0 feet, ZONE). ANFERNEE CARTER MAKES IT! Assist: Tracy Mitchell
Score: 70-106

[08:02] Team_034 possession (Score: 70-106)
Anthony Bane loses control! Ball rolls out of bounds! TURNOVER! (dead ball)

[08:02] Substitution (Team_034): Ben Hyland OUT → Damian Turner IN (stamina_rule2)

[08:02] Substitution (Team_034): Cole Antetokounmpo OUT → Vince Paul IN (stamina_rule2)

[08:02] Substitution (Team_034): Terry Doncic OUT → Nikola Wagner IN (stamina_rule2)

[08:02] Substitution (Team_034): Anthony Bane OUT → Carmelo Anunoby IN (stamina_rule2)

[08:02] Substitution (Team_039): Donovan Markkanen OUT → Jayson Cunningham IN (stamina_rule2)

[08:02] Substitution (Team_039): Austin O'Neal OUT → Yao Carter IN (stamina_rule2)

[08:02] Substitution (Team_039): Anfernee Carter OUT → Victor Gasol IN (stamina_rule2)

[08:02] Substitution (Team_039): Klay Wade OUT → Bam Booker IN (stamina_rule2)

[07:51] Team_039 possession (Score: 70-106)
Victor Gasol attempts a Midrange. Contested by Damian Turner (5.6 feet, ZONE). VICTOR GASOL MAKES IT!
Score: 70-108

[07:35] Team_034 possession (Score: 70-108)
Nikola Wagner drives to the basket... Nikola Wagner loses the ball! Stripped by Victor Gasol! TURNOVER! (live ball)

[07:21] Team_039 possession (Score: 70-108)
Yao Carter makes the Layup and draws the foul on Vince Paul! And-1! Yao Carter to the line for 1. [Team fouls: 3] (Vince Paul: 1 personal fouls)   FT 1/1: GOOD Yao Carter makes 1/1 from the line.
Score: 70-111

[07:09] Team_034 possession (Score: 70-111)
Nikola Wagner drives, Victor Gasol stays with him. Nikola Wagner attempts a Dunk. Contested by Victor Gasol (3.4 feet, ZONE). NIKOLA WAGNER MAKES IT!
Score: 72-111

[06:59] Team_039 possession (Score: 72-111)
Tracy Mitchell attempts a Midrange. Contested by Manu Jokic (5.2 feet, MAN). TRACY MITCHELL MAKES IT! Assist: Jayson Cunningham
Score: 72-113

[06:44] Team_034 possession (Score: 72-113)
Manu Jokic drives and kicks out. Nikola Wagner attempts a Midrange. Contested by Victor Gasol (3.3 feet, MAN). Nikola Wagner misses. Rebound secured by Bam Booker.

[06:30] Team_039 possession (Score: 72-113)
FOUL! Shooting foul on Carmelo Anunoby. Tracy Mitchell to the line for 2 free throws. [Team fouls: 4] (Carmelo Anunoby: 1 personal fouls)   FT 1/2: GOOD   FT 2/2: GOOD Tracy Mitchell makes 2/2 from the line.
Score: 72-115

[06:16] Team_034 possession (Score: 72-115)
Nikola Wagner attempts a 3Pt. Contested by Victor Gasol (3.4 feet, MAN). Nikola Wagner misses. Rebound secured by Bam Booker.

[05:58] Team_039 possession (Score: 72-115)
Jayson Cunningham attempts a Midrange. Contested by Damian Turner (5.6 feet, MAN). JAYSON CUNNINGHAM MAKES IT! Assist: Yao Carter
Score: 72-117

[05:42] Team_034 possession (Score: 72-117)
Damian Turner attempts a 3Pt. Wide open! Tracy Mitchell is 6.0 feet away. [ZONE] DAMIAN TURNER MAKES IT! Assist: Nikola Wagner
Score: 75-117

[05:27] Team_039 possession (Score: 75-117)
Tracy Mitchell attempts a 3Pt. Contested by Vince Paul (4.7 feet, ZONE). TRACY MITCHELL MAKES IT! Assist: Bam Booker
Score: 75-120

[05:09] Team_034 possession (Score: 75-120)
Manu Jokic attempts a Midrange. Contested by Tracy Mitchell (5.7 feet, MAN). Manu Jokic misses. Rebound secured by Bam Booker.

[04:56] Team_039 possession (Score: 75-120)
Jayson Cunningham attempts a 3Pt. Contested by Damian Turner (5.6 feet, MAN). Jayson Cunningham misses. Rebound secured by Carmelo Anunoby.

[04:42] Team_034 possession (Score: 75-120)
Damian Turner drives, Victor Gasol stays with him. Damian Turner attempts a Layup. Contested by Victor Gasol (3.7 feet, ZONE). DAMIAN TURNER MAKES IT! Assist: Nikola Wagner
Score: 77-120

[04:29] Team_039 possession (Score: 77-120)
Jayson Cunningham attempts a Layup. Contested by Carmelo Anunoby (5.6 feet, ZONE). Jayson Cunningham misses. Rebound secured by Vince Paul.

[04:17] Team_034 possession (Score: 77-120)
Nikola Wagner attempts a Midrange. Contested by Tracy Mitchell (5.9 feet, ZONE). Nikola Wagner misses. Rebound secured by Bam Booker.

[03:59] Team_039 possession (Score: 77-120)
Yao Carter drives and kicks out. Jayson Cunningham attempts a Midrange. Contested by Vince Paul (4.2 feet, ZONE). Jayson Cunningham misses. Offensive rebound by Victor Gasol! Victor Gasol kicks it out.

[03:45] Team_039 possession (Score: 77-120)
Tracy Mitchell attempts a Midrange. Contested by Manu Jokic (5.3 feet, MAN). TRACY MITCHELL MAKES IT!
Score: 77-122

[03:34] Team_034 possession (Score: 77-122)
Manu Jokic attempts a Midrange. Contested by Tracy Mitchell (5.8 feet, MAN). Manu Jokic misses. Rebound secured by Bam Booker.

[03:15] Team_039 possession (Score: 77-122)
Tracy Mitchell makes the Midrange and draws the foul on Damian Turner! And-1! Tracy Mitchell to the line for 1. [BONUS: 5 team fouls] (Damian Turner: 1 personal fouls)   FT 1/1: GOOD Tracy Mitchell makes 1/1 from the line.
Score: 77-125

[02:56] Team_034 possession (Score: 77-125)
Carmelo Anunoby attempts a 3Pt. Contested by Tracy Mitchell (6.0 feet, ZONE). CARMELO ANUNOBY MAKES IT! Assist: Damian Turner
Score: 80-125

[02:44] Team_039 possession (Score: 80-125)
FOUL! Shooting foul on Damian Turner. Yao Carter to the line for 2 free throws. [BONUS: 6 team fouls] (Damian Turner: 2 personal fouls)   FT 1/2: GOOD   FT 2/2: MISS Yao Carter makes 1/2 from the line. Rebound secured by Vince Paul.
Score: 80-126

[02:28] Team_034 possession (Score: 80-126)
Carmelo Anunoby attempts a 3Pt. Contested by Bam Booker (4.8 feet, MAN). Carmelo Anunoby misses. Rebound secured by Victor Gasol.

[02:13] Team_039 possession (Score: 80-126)
Bam Booker drives and kicks out. Jayson Cunningham attempts a 3Pt. Contested by Damian Turner (5.4 feet, MAN). Jayson Cunningham misses. Rebound secured by Carmelo Anunoby.

[01:59] Team_034 possession (Score: 80-126)
Carmelo Anunoby drives, Victor Gasol stays with him. Carmelo Anunoby attempts a Dunk. Contested by Victor Gasol (3.4 feet, ZONE). CARMELO ANUNOBY MAKES IT!
Score: 82-126

[01:48] Team_039 possession (Score: 82-126)
Victor Gasol attempts a Midrange. Contested by Vince Paul (4.4 feet, ZONE). Victor Gasol misses. Offensive rebound by Victor Gasol! Victor Gasol kicks it out.

[01:37] Team_039 possession (Score: 82-126)
Victor Gasol attempts a Layup. Contested by Carmelo Anunoby (5.6 feet, ZONE). VICTOR GASOL MAKES IT!
Score: 82-128

[01:27] Team_034 possession (Score: 82-128)
Carmelo Anunoby drives and kicks out. Vince Paul makes the Midrange and draws the foul on Jayson Cunningham! And-1! Vince Paul to the line for 1. [Team fouls: 2] (Jayson Cunningham: 1 personal fouls)   FT 1/1: GOOD Vince Paul makes 1/1 from the line.
Score: 85-128

[01:15] Team_039 possession (Score: 85-128)
Victor Gasol attempts a 3Pt. Wide open! Nikola Wagner is 6.2 feet away. [MAN] VICTOR GASOL MAKES IT! Assist: Yao Carter
Score: 85-131

[00:56] Team_034 possession (Score: 85-131)
Vince Paul makes the Dunk and draws the foul on Tracy Mitchell! And-1! Vince Paul to the line for 1. [Team fouls: 3] (Tracy Mitchell: 2 personal fouls)   FT 1/1: GOOD Vince Paul makes 1/1 from the line.
Score: 88-131

[00:46] Team_039 possession (Score: 88-131)
Tracy Mitchell drives and kicks out. Yao Carter attempts a 3Pt. Contested by Vince Paul (4.3 feet, ZONE). Yao Carter misses. Rebound secured by Carmelo Anunoby.

[00:36] Team_034 possession (Score: 88-131)
FOUL! Holding foul on Tracy Mitchell. [Team fouls: 4] No free throws, side out. (Tracy Mitchell: 3 personal fouls)

[00:26] Team_034 possession (Score: 88-131)
Carmelo Anunoby attempts a 3Pt. Wide open! Tracy Mitchell is 6.2 feet away. [ZONE] Carmelo Anunoby misses. FOUL! Loose ball foul on Bam Booker during the rebound battle. [IN THE BONUS! 5 team fouls] Carmelo Anunoby to the line for 2 free throws. (Bam Booker: 1 personal fouls)   FT 1/2: GOOD   FT 2/2: MISS Carmelo Anunoby makes 1/2 from the line. Rebound secured by Yao Carter.
Score: 89-131

[00:13] Team_039 possession (Score: 89-131)
FOUL! Reach-in foul on Carmelo Anunoby during the drive. [IN THE BONUS! 7 team fouls] Bam Booker to the line for 2 free throws. (Carmelo Anunoby: 2 personal fouls)   FT 1/2: GOOD   FT 2/2: GOOD Bam Booker makes 2/2 from the line.
Score: 89-133

[00:01] Team_034 possession (Score: 89-133)
Vince Paul attempts a 3Pt. Wide open! Tracy Mitchell is 6.6 feet away. [ZONE] Vince Paul misses. Rebound secured by Victor Gasol.

================================================================================
                              4TH QUARTER COMPLETE                              
================================================================================

4TH QUARTER SCORE: Team_034 30, Team_039 36

BOX SCORE:
================================================================================

Team_034
--------------------------------------------------------------------------------
Player                MIN  PTS  REB  AST  TO      FG   FG%      3P   3P%
--------------------------------------------------------------------------------
Vince Paul             20    6    2    0   0   2/3    66.7     0/0   0.0
Damian Turner          20    5    0    1   0   2/2   100.0     0/0   0.0
Carmelo Anunoby        20    5    3    0   0   2/4    50.0     0/0   0.0
Anthony Bane           29    4    2    1   0   2/2   100.0     0/0   0.0
Terry Doncic           29    4    0    0   0   1/1   100.0     0/0   0.0
Cole Antetokounmpo     29    3    1    0   0   1/2    50.0     0/0   0.0
Yao Carter             20    3    1    2   0   1/2    50.0     0/0   0.0
Nikola Wagner          20    2    0    2   0   1/3    33.3     0/0   0.0
Ben Hyland             29    0    0    0   0   0/1     0.0     0/0   0.0
Manu Jokic             24    0    0    1   0   0/3     0.0     0/0   0.0

TEAM: FG: 11/21 (52.4%), 3PT: 3/8 (37.5%), REB: 9 (1 off, 8 def), AST: 5, TO: 3
TEAM FOULS: 7 [Team_039 in BONUS]


Team_039
--------------------------------------------------------------------------------
Player                MIN  PTS  REB  AST  TO      FG   FG%      3P   3P%
--------------------------------------------------------------------------------
Tracy Mitchell         24   12    0    2   0   5/7    71.4     0/0   0.0
Anfernee Carter        29    7    0    0   0   3/4    75.0     0/0   0.0
Victor Gasol           20    7    4    0   0   3/3   100.0     0/0   0.0
Donovan Markkanen      29    2    0    0   0   1/2    50.0     0/0   0.0
Jayson Cunningham      20    2    0    1   0   1/3    33.3     0/0   0.0
Bam Booker             20    2    5    1   0   1/2    50.0     0/0   0.0
Austin O'Neal          29    0    3    0   0   0/0     0.0     0/0   0.0
Klay Wade              29    0    1    1   0   0/0     0.0     0/0   0.0

TEAM: FG: 15/23 (65.2%), 3PT: 3/6 (50.0%), REB: 13 (4 off, 9 def), AST: 7, TO: 0
TEAM FOULS: 5 [Team_034 in BONUS]

================================================================================

================================================================================
                               FULL GAME COMPLETE                               
================================================================================

FINAL SCORE: Team_034 89, Team_039 133

SCORING BY QUARTER:
--------------------------------------------------------------------------------
Team                     Q1     Q2     Q3     Q4    FINAL
--------------------------------------------------------------------------------
Team_034                 16     23     20     30       89
Team_039                 22     33     42     36      133
--------------------------------------------------------------------------------

FULL GAME BOX SCORE:
================================================================================

Team_034
--------------------------------------------------------------------------------
Player                MIN  PTS  REB  AST  TO      FG   FG%      3P   3P%      FT STL BLK
--------------------------------------------------------------------------------
Ben Hyland             29    8    0    1   1   5/13   38.5   0/7     0.0   5/7     0   1
Cole Antetokounmpo     29    3    3    2   2   2/5    40.0   1/3    33.3   0/0     0   0
Terry Doncic           29    8    8    2   1   1/7    14.3   0/3     0.0   1/2     0   0
Anthony Bane           29   15   10    1   2   7/10   70.0   0/0     0.0   6/7     0   0
Devin Poole            25   11    0    0   2   5/9    55.6   1/5    20.0   2/3     1   0
Manu Jokic             24    0    0    2   0   0/6     0.0   0/1     0.0   1/2     0   0
Damian Turner          20   10    0    2   1   5/9    55.6   2/4    50.0   0/0     0   0
Vince Paul             20    8    8    1   0   2/4    50.0   0/2     0.0   2/2     0   0
Nikola Wagner          20   10    1    3   2   3/7    42.9   1/4    25.0   1/1     0   0
Carmelo Anunoby        20    7    7    0   0   4/9    44.4   1/3    33.3   1/3     0   1

TEAM: FG: 34/79 (43.0%), 3PT: 6/32 (18.8%), REB: 38 (10 off, 28 def), AST: 14, TO: 11


Team_039
--------------------------------------------------------------------------------
Player                MIN  PTS  REB  AST  TO      FG   FG%      3P   3P%      FT STL BLK
--------------------------------------------------------------------------------
Donovan Markkanen      29   19    6    1   2   7/13   53.8   3/6    50.0   2/2     1   0
Austin O'Neal          29   14   13    3   1   4/5    80.0   3/3   100.0   3/4     1   0
Anfernee Carter        29   16    0    1   1   7/9    77.8   1/3    33.3   3/3     0   0
Klay Wade              29   14   14    7   1   6/10   60.0   0/1     0.0   2/2     1   1
Jrue Bridges           25    8    0    2   1   3/5    60.0   2/3    66.7   0/0     2   0
Tracy Mitchell         24   18    0    6   0   7/11   63.6   2/3    66.7   4/4     0   0
Jayson Cunningham      20    7    0    2   0   3/6    50.0   1/3    33.3   0/0     0   0
Yao Carter             20    9    7    3   1   3/6    50.0   2/3    66.7   2/4     0   0
Victor Gasol           20   15   11    1   0   6/7    85.7   2/2   100.0   1/1     2   0
Bam Booker             20    8    8    3   1   4/7    57.1   0/1     0.0   2/2     0   0

TEAM: FG: 51/80 (63.7%), 3PT: 16/28 (57.1%), REB: 58 (15 off, 43 def), AST: 29, TO: 8

================================================================================
