================================================================================
                        FULL GAME - Team_011 vs Team_056                        
================================================================================

================================================================================
                       1ST QUARTER - Team_011 vs Team_056                       
================================================================================

[12:00] Team_011 possession (Score: 0-0)
Trae Tatum attempts a Midrange. Contested by Magic Russell (5.4 feet, MAN). TRAE TATUM MAKES IT! Assist: Michael Carter
Score: 2-0

[11:44] Team_056 possession (Score: 2-0)
Jrue Lillard drives to the basket... Jrue Lillard loses the ball! Stripped by Pau Barnes! TURNOVER! (live ball)

[11:25] Team_011 possession (Score: 2-0)
Magic Tatum attempts a 3Pt. Contested by Giannis Jokic (4.5 feet, MAN). Magic Tatum misses. Rebound secured by Jrue Lillard.

[11:11] Team_056 possession (Score: 2-0)
Tony Carter attempts a 3Pt. Contested by Michael Carter (4.8 feet, MAN). TONY CARTER MAKES IT! Assist: Giannis Jokic
Score: 2-3

[10:55] Team_011 possession (Score: 2-3)
Magic Tatum attempts a 3Pt. Contested by Giannis Jokic (4.5 feet, MAN). Magic Tatum misses. FOUL! Loose ball foul on Jrue Lillard during the rebound battle. [Team fouls: 1] No free throws, side out. (Jrue Lillard: 1 personal fouls)

[10:39] Team_011 possession (Score: 2-3)
Trae Tatum makes the Layup and draws the foul on Yao Poole! And-1! Trae Tatum to the line for 1. [Team fouls: 2] (Yao Poole: 1 personal fouls)   FT 1/1: GOOD Trae Tatum makes 1/1 from the line.
Score: 5-3

[10:27] Team_056 possession (Score: 5-3)
Giannis Jokic attempts a 3Pt. Contested by Trae Tatum (5.0 feet, ZONE). GIANNIS JOKIC MAKES IT! Assist: Tony Carter
Score: 5-6

[10:14] Team_011 possession (Score: 5-6)
Trae Tatum throws a bad pass! Stolen by Magic Russell! TURNOVER! (live ball)

[09:58] Team_056 possession (Score: 5-6)
FOUL! Shooting foul on Pau Barnes. Yao Poole to the line for 2 free throws. [Team fouls: 1] (Pau Barnes: 1 personal fouls)   FT 1/2: GOOD   FT 2/2: GOOD Yao Poole makes 2/2 from the line.
Score: 5-8

[09:43] Team_011 possession (Score: 5-8)
Magic Tatum attempts a Midrange. Contested by Giannis Jokic (4.5 feet, MAN). Magic Tatum misses. Rebound secured by Tony Carter.

[09:31] Team_056 possession (Score: 5-8)
Jrue Lillard attempts a 3Pt. Contested by Pau Barnes (3.6 feet, MAN). Jrue Lillard misses. Rebound secured by Pau Barnes.

[09:14] Team_011 possession (Score: 5-8)
Pau Barnes drives, Jrue Lillard stays with him. Pau Barnes attempts a Layup. Contested by Jrue Lillard (4.5 feet, ZONE). PAU BARNES MAKES IT! Assist: Michael Carter
Score: 7-8

[08:57] Team_056 possession (Score: 7-8)
Magic Russell throws a bad pass out of bounds! TURNOVER! (dead ball)

[08:42] Team_011 possession (Score: 7-8)
Pau Barnes makes the Dunk and draws the foul on Jrue Lillard! And-1! Pau Barnes to the line for 1. [Team fouls: 3] (Jrue Lillard: 2 personal fouls)   FT 1/1: GOOD Pau Barnes makes 1/1 from the line.
Score: 10-8

[08:30] Team_056 possession (Score: 10-8)
FOUL! Reach-in foul on Evan George during the drive. [Team fouls: 2] No free throws, side out. (Evan George: 1 personal fouls)

[08:18] Team_056 possession (Score: 10-8)
Yao Poole attempts a Midrange. Contested by Pau Barnes (2.7 feet, MAN). Yao Poole misses. Rebound secured by Michael Carter.

[08:03] Team_011 possession (Score: 10-8)
FOUL! Shooting foul on Giannis Jokic. Magic Tatum to the line for 2 free throws. [Team fouls: 4] (Giannis Jokic: 1 personal fouls)   FT 1/2: GOOD   FT 2/2: GOOD Magic Tatum makes 2/2 from the line.
Score: 12-8

[07:45] Team_056 possession (Score: 12-8)
Jrue Lillard attempts a Midrange. Contested by Magic Tatum (4.1 feet, ZONE). Jrue Lillard misses. Rebound secured by Pau Barnes.

[07:26] Team_011 possession (Score: 12-8)
Trae Tatum attempts a Midrange. Contested by Magic Russell (5.4 feet, MAN). TRAE TATUM MAKES IT! Assist: Michael Carter
Score: 14-8

[07:11] Team_056 possession (Score: 14-8)
Jrue Lillard attempts a 3Pt. Contested by Magic Tatum (4.1 feet, ZONE). Jrue Lillard misses. Rebound secured by Evan George.

[06:57] Team_011 possession (Score: 14-8)
Evan George attempts a Layup. Contested by Yao Poole (4.3 feet, ZONE). EVAN GEORGE MAKES IT! Assist: Pau Barnes
Score: 16-8

[06:44] Team_056 possession (Score: 16-8)
Giannis Jokic attempts a 3Pt. Contested by Magic Tatum (3.8 feet, MAN). Giannis Jokic misses. Rebound secured by Michael Carter.

[06:29] Team_011 possession (Score: 16-8)
Trae Tatum attempts a 3Pt. Contested by Giannis Jokic (4.2 feet, ZONE). Trae Tatum misses. Rebound secured by Jrue Lillard.

[06:16] Team_056 possession (Score: 16-8)
Giannis Jokic attempts a 3Pt. Contested by Magic Tatum (3.8 feet, MAN). GIANNIS JOKIC MAKES IT! Assist: Tony Carter
Score: 16-11

[06:01] Team_011 possession (Score: 16-11)
FOUL! Reach-in foul on Jrue Lillard during the drive. [IN THE BONUS! 5 team fouls] Michael Carter to the line for 2 free throws. (Jrue Lillard: 3 personal fouls)   FT 1/2: MISS   FT 2/2: MISS Michael Carter makes 0/2 from the line. Rebound secured by Yao Poole.

[05:47] Team_056 possession (Score: 16-11)
Jrue Lillard attempts a Midrange. Contested by Trae Tatum (5.2 feet, ZONE). Jrue Lillard misses. Rebound secured by Evan George.

[05:31] Team_011 possession (Score: 16-11)
Magic Tatum attempts a Layup. BLOCKED BY JRUE LILLARD! Ball deflects out of bounds off Magic Tatum.

[05:21] Team_056 possession (Score: 16-11)
Tony Carter attempts a 3Pt. Contested by Magic Tatum (4.1 feet, ZONE). Tony Carter misses. Rebound secured by Evan George.

[05:08] Team_011 possession (Score: 16-11)
Evan George drives and kicks out. Magic Tatum attempts a Midrange. Contested by Giannis Jokic (4.3 feet, MAN). Magic Tatum misses. Rebound secured by Yao Poole.

[04:54] Team_056 possession (Score: 16-11)
Yao Poole attempts a 3Pt. BLOCKED BY MAGIC TATUM! Ball is loose! Rebound secured by Evan George.

[04:38] Team_011 possession (Score: 16-11)
Evan George drives and kicks out. Evan George attempts a 3Pt. Contested by Yao Poole (4.2 feet, MAN). Evan George misses. Rebound secured by Jrue Lillard.

[04:19] Team_056 possession (Score: 16-11)
Tony Carter attempts a Layup. Contested by Michael Carter (4.9 feet, MAN). TONY CARTER MAKES IT! Assist: Magic Russell
Score: 16-13

[04:00] Team_011 possession (Score: 16-13)
Michael Carter attempts a 3Pt. Contested by Giannis Jokic (4.3 feet, ZONE). Michael Carter misses. Offensive rebound by Pau Barnes! Pau Barnes puts it back in!
Score: 18-13

[03:49] Team_056 possession (Score: 18-13)
FOUL! Reach-in foul on Pau Barnes during the drive. [Team fouls: 3] No free throws, side out. (Pau Barnes: 2 personal fouls)

[03:37] Team_056 possession (Score: 18-13)
Tony Carter attempts a 3Pt. Contested by Magic Tatum (4.2 feet, ZONE). Tony Carter misses. Rebound secured by Evan George.

[03:25] Team_011 possession (Score: 18-13)
Michael Carter makes the Layup and draws the foul on Giannis Jokic! And-1! Michael Carter to the line for 1. [BONUS: 6 team fouls] (Giannis Jokic: 2 personal fouls)   FT 1/1: GOOD Michael Carter makes 1/1 from the line.
Score: 21-13

[03:11] Team_056 possession (Score: 21-13)
Jrue Lillard attempts a Midrange. Contested by Trae Tatum (5.4 feet, ZONE). JRUE LILLARD MAKES IT!
Score: 21-15

[03:00] Team_011 possession (Score: 21-15)
Michael Carter attempts a 3Pt. Contested by Giannis Jokic (4.4 feet, ZONE). Michael Carter misses. Rebound secured by Tony Carter.

[02:43] Team_056 possession (Score: 21-15)
Giannis Jokic drives and kicks out. Tony Carter attempts a Midrange. Contested by Michael Carter (4.4 feet, MAN). Tony Carter misses. Offensive rebound by Jrue Lillard! Jrue Lillard puts it back in!
Score: 21-17

[02:26] Team_011 possession (Score: 21-17)
FOUL! Shooting foul on Yao Poole. Evan George to the line for 2 free throws. [BONUS: 7 team fouls] (Yao Poole: 2 personal fouls)   FT 1/2: GOOD   FT 2/2: GOOD Evan George makes 2/2 from the line.
Score: 23-17

[02:10] Team_056 possession (Score: 23-17)
FOUL! Shooting foul on Pau Barnes. Yao Poole to the line for 2 free throws. [Team fouls: 4] (Pau Barnes: 3 personal fouls)   FT 1/2: MISS   FT 2/2: GOOD Yao Poole makes 1/2 from the line.
Score: 23-18

[01:55] Team_011 possession (Score: 23-18)
Evan George attempts a Layup. BLOCKED BY YAO POOLE! Ball is loose! Offensive rebound by Pau Barnes! Pau Barnes kicks it out.

[01:45] Team_011 possession (Score: 23-18)
FOUL! Holding foul on Tony Carter. [IN THE BONUS! 8 team fouls] Michael Carter to the line for 2 free throws. (Tony Carter: 1 personal fouls)   FT 1/2: GOOD   FT 2/2: GOOD Michael Carter makes 2/2 from the line.
Score: 25-18

[01:32] Team_056 possession (Score: 25-18)
Jrue Lillard drives and kicks out. Magic Russell attempts a 3Pt. Contested by Trae Tatum (5.0 feet, MAN). Magic Russell misses. Rebound secured by Michael Carter.

[01:20] Team_011 possession (Score: 25-18)
Magic Tatum attempts a Midrange. Contested by Giannis Jokic (4.9 feet, MAN). MAGIC TATUM MAKES IT!
Score: 27-18

[01:08] Team_056 possession (Score: 27-18)
Magic Russell attempts a 3Pt. Contested by Trae Tatum (5.3 feet, MAN). Magic Russell misses. Rebound secured by Michael Carter.

[00:53] Team_011 possession (Score: 27-18)
FOUL! Reach-in foul on Giannis Jokic during the drive. [IN THE BONUS! 9 team fouls] Magic Tatum to the line for 2 free throws. (Giannis Jokic: 3 personal fouls)   FT 1/2: GOOD   FT 2/2: GOOD Magic Tatum makes 2/2 from the line.
Score: 29-18

[00:37] Team_056 possession (Score: 29-18)
Tony Carter attempts a Midrange. Contested by Michael Carter (5.2 feet, MAN). Tony Carter misses. Offensive rebound by Jrue Lillard! Jrue Lillard puts it back in!
Score: 29-20

[00:25] Team_011 possession (Score: 29-20)
Michael Carter drives, picks up Jrue Lillard. Help arrives from Giannis Jokic! Michael Carter attempts a Dunk. Contested by Giannis Jokic (4.2 feet, ZONE). Michael Carter misses. Rebound secured by Tony Carter.

[00:11] Team_056 possession (Score: 29-20)
Tony Carter attempts a 3Pt. Contested by Michael Carter (5.3 feet, MAN). Tony Carter misses. Rebound secured by Michael Carter.

================================================================================
                              1ST QUARTER COMPLETE                              
================================================================================

1ST QUARTER SCORE: Team_011 29, Team_056 20

BOX SCORE:
================================================================================

Team_011
--------------------------------------------------------------------------------
Player                MIN  PTS  REB  AST  TO      FG   FG%      3P   3P%
--------------------------------------------------------------------------------
Trae Tatum             12    7    0    0   0   3/4    75.0     0/0   0.0
Pau Barnes             12    7    4    1   0   3/3   100.0     0/0   0.0
Magic Tatum            12    6    0    0   0   3/6    50.0     0/0   0.0
Michael Carter         12    5    5    3   0   2/5    40.0     0/0   0.0
Evan George            12    4    6    0   0   2/4    50.0     0/0   0.0

TEAM: FG: 13/22 (59.1%), 3PT: 1/4 (25.0%), REB: 15 (3 off, 12 def), AST: 4, TO: 1
TEAM FOULS: 4


Team_056
--------------------------------------------------------------------------------
Player                MIN  PTS  REB  AST  TO      FG   FG%      3P   3P%
--------------------------------------------------------------------------------
Jrue Lillard           12    6    5    0   0   3/8    37.5     0/0   0.0
Giannis Jokic          12    6    0    1   0   2/3    66.7     0/0   0.0
Tony Carter            12    5    3    2   0   2/5    40.0     0/0   0.0
Yao Poole              12    3    2    0   0   2/4    50.0     0/0   0.0
Magic Russell          12    0    0    1   0   0/1     0.0     0/0   0.0

TEAM: FG: 9/21 (42.9%), 3PT: 3/11 (27.3%), REB: 10 (2 off, 8 def), AST: 4, TO: 2
TEAM FOULS: 9 [Team_011 in BONUS]

================================================================================

================================================================================
                       2ND QUARTER - Team_011 vs Team_056                       
================================================================================

[12:00] Team_011 possession (Score: 29-20)
Pau Barnes drives to the basket... Pau Barnes throws a bad pass! Stolen by Jrue Lillard! TURNOVER! (live ball)

[11:41] Team_056 possession (Score: 29-20)
Tony Carter attempts a 3Pt. Contested by Magic Tatum (4.4 feet, ZONE). Tony Carter misses. Rebound secured by Evan George.

[11:28] Team_011 possession (Score: 29-20)
FOUL! Shooting foul on Tony Carter. Michael Carter to the line for 3 free throws. [Team fouls: 1] (Tony Carter: 1 personal fouls)   FT 1/3: GOOD   FT 2/3: GOOD   FT 3/3: GOOD Michael Carter makes 3/3 from the line.
Score: 32-20

[11:14] Team_056 possession (Score: 32-20)
Giannis Jokic attempts a Midrange. BLOCKED BY MAGIC TATUM! Ball is loose! Offensive rebound by Yao Poole! Yao Poole kicks it out.

[10:58] Team_056 possession (Score: 32-20)
Yao Poole attempts a 3Pt. Contested by Pau Barnes (3.2 feet, MAN). YAO POOLE MAKES IT! Assist: Magic Russell
Score: 32-23

[10:45] Team_011 possession (Score: 32-23)
Pau Barnes throws a bad pass! Stolen by Jrue Lillard! TURNOVER! (live ball)

[10:29] Team_056 possession (Score: 32-23)
Jrue Lillard attempts a 3Pt. Contested by Pau Barnes (4.2 feet, MAN). Jrue Lillard misses. Rebound secured by Pau Barnes.

[10:16] Team_011 possession (Score: 32-23)
Pau Barnes attempts a 3Pt. Contested by Giannis Jokic (5.4 feet, ZONE). PAU BARNES MAKES IT! Assist: Trae Tatum
Score: 35-23

[09:59] Team_056 possession (Score: 35-23)
Jrue Lillard attempts a 3Pt. Contested by Magic Tatum (4.5 feet, ZONE). Jrue Lillard misses. Offensive rebound by Jrue Lillard! Jrue Lillard's putback is no good. Rebound secured by Michael Carter.

[09:45] Team_011 possession (Score: 35-23)
Michael Carter attempts a Midrange. Contested by Magic Russell (5.9 feet, ZONE). MICHAEL CARTER MAKES IT! Assist: Magic Tatum
Score: 37-23

[09:32] Team_056 possession (Score: 37-23)
FOUL! Holding foul on Magic Tatum. [Team fouls: 1] No free throws, side out. (Magic Tatum: 1 personal fouls)

[09:21] Team_056 possession (Score: 37-23)
Jrue Lillard drives to the basket... Jrue Lillard throws a bad pass out of bounds! TURNOVER! (dead ball)

[09:21] Substitution (Team_011): Magic Tatum OUT → Shai Leonard IN (stamina_rule2)

[09:21] Substitution (Team_011): Trae Tatum OUT → De'Aaron George IN (stamina_rule2)

[09:21] Substitution (Team_011): Michael Carter OUT → Tyrese Nowitzki IN (stamina_rule2)

[09:21] Substitution (Team_011): Pau Barnes OUT → Russell Davis IN (stamina_rule2)

[09:21] Substitution (Team_011): Evan George OUT → Pau Towns IN (stamina_rule2)

[09:21] Substitution (Team_056): Giannis Jokic OUT → De'Aaron Murray IN (stamina_rule2)

[09:21] Substitution (Team_056): Magic Russell OUT → Damian Barrett IN (stamina_rule2)

[09:21] Substitution (Team_056): Tony Carter OUT → CJ Anthony IN (stamina_rule2)

[09:21] Substitution (Team_056): Jrue Lillard OUT → RJ Johnson IN (stamina_rule2)

[09:21] Substitution (Team_056): Yao Poole OUT → Derrick Bane IN (stamina_rule2)

[09:04] Team_011 possession (Score: 37-23)
FOUL! Reach-in foul on Damian Barrett during the drive. [Team fouls: 2] No free throws, side out. (Damian Barrett: 1 personal fouls)

[08:53] Team_011 possession (Score: 37-23)
De'Aaron George throws a bad pass out of bounds! TURNOVER! (dead ball)

[08:40] Team_056 possession (Score: 37-23)
CJ Anthony attempts a 3Pt. Contested by Shai Leonard (4.2 feet, ZONE). CJ Anthony misses. Rebound secured by Tyrese Nowitzki.

[08:29] Team_011 possession (Score: 37-23)
Pau Towns attempts a Midrange. Contested by Derrick Bane (5.4 feet, ZONE). Pau Towns misses. Rebound secured by Derrick Bane.

[08:17] Team_056 possession (Score: 37-23)
De'Aaron Murray attempts a Layup. Contested by Shai Leonard (4.4 feet, MAN). DE'AARON MURRAY MAKES IT! Assist: RJ Johnson
Score: 37-25

[08:03] Team_011 possession (Score: 37-25)
FOUL! Shooting foul on RJ Johnson. Russell Davis to the line for 2 free throws. [Team fouls: 3] (RJ Johnson: 1 personal fouls)   FT 1/2: GOOD   FT 2/2: GOOD Russell Davis makes 2/2 from the line.
Score: 39-25

[07:49] Team_056 possession (Score: 39-25)
CJ Anthony attempts a 3Pt. Contested by Shai Leonard (4.2 feet, ZONE). CJ Anthony misses. Rebound secured by Tyrese Nowitzki.

[07:34] Team_011 possession (Score: 39-25)
Russell Davis drives to the basket... Russell Davis loses control! Ball rolls out of bounds! TURNOVER! (dead ball)

[07:15] Team_056 possession (Score: 39-25)
Damian Barrett attempts a 3Pt. Contested by Shai Leonard (4.5 feet, ZONE). Damian Barrett misses. Rebound secured by Tyrese Nowitzki.

[06:58] Team_011 possession (Score: 39-25)
Shai Leonard attempts a 3Pt. Contested by De'Aaron Murray (5.9 feet, MAN). Shai Leonard misses. Rebound secured by CJ Anthony.

[06:40] Team_056 possession (Score: 39-25)
Derrick Bane attempts a Layup. BLOCKED BY RUSSELL DAVIS! Ball is loose! Rebound secured by Russell Davis.

[06:30] Team_011 possession (Score: 39-25)
De'Aaron George attempts a Layup. Contested by Damian Barrett (5.8 feet, MAN). DE'AARON GEORGE MAKES IT!
Score: 41-25

[06:13] Team_056 possession (Score: 41-25)
FOUL! Holding foul on De'Aaron George. [Team fouls: 2] No free throws, side out. (De'Aaron George: 1 personal fouls)

[06:02] Team_056 possession (Score: 41-25)
CJ Anthony drives to the basket... FOUL! Offensive foul on CJ Anthony! Tyrese Nowitzki drew the charge! [Team fouls: 4] (CJ Anthony: 1 personal fouls) TURNOVER! (dead ball)

[05:46] Team_011 possession (Score: 41-25)
Pau Towns drives, picks up Derrick Bane. Help arrives from Damian Barrett! Pau Towns attempts a Dunk. Contested by Damian Barrett (5.4 feet, MAN). PAU TOWNS MAKES IT! Assist: Tyrese Nowitzki
Score: 43-25

[05:34] Team_056 possession (Score: 43-25)
RJ Johnson makes the Layup and draws the foul on Russell Davis! And-1! RJ Johnson to the line for 1. [Team fouls: 3] (Russell Davis: 1 personal fouls)   FT 1/1: GOOD RJ Johnson makes 1/1 from the line.
Score: 43-28

[05:16] Team_011 possession (Score: 43-28)
Tyrese Nowitzki loses the ball! Stripped by CJ Anthony! TURNOVER! (live ball)

[04:59] Team_056 possession (Score: 43-28)
De'Aaron Murray drives and kicks out. RJ Johnson attempts a 3Pt. Contested by Shai Leonard (4.3 feet, ZONE). RJ JOHNSON MAKES IT! Assist: De'Aaron Murray
Score: 43-31

[04:44] Team_011 possession (Score: 43-31)
De'Aaron George attempts a 3Pt. Contested by Damian Barrett (5.8 feet, MAN). De'Aaron George misses. Rebound secured by Derrick Bane.

[04:30] Team_056 possession (Score: 43-31)
De'Aaron Murray attempts a 3Pt. Contested by Shai Leonard (4.4 feet, ZONE). DE'AARON MURRAY MAKES IT! Assist: Damian Barrett
Score: 43-34

[04:19] Team_011 possession (Score: 43-34)
De'Aaron George attempts a 3Pt. Wide open! De'Aaron Murray is 6.2 feet away. [ZONE] De'Aaron George misses. Rebound secured by RJ Johnson.

[04:03] Team_056 possession (Score: 43-34)
FOUL! Reach-in foul on Pau Towns during the drive. [Team fouls: 4] No free throws, side out. (Pau Towns: 1 personal fouls)

[03:45] Team_056 possession (Score: 43-34)
CJ Anthony attempts a 3Pt. Contested by Shai Leonard (4.2 feet, ZONE). CJ ANTHONY MAKES IT! Assist: RJ Johnson
Score: 43-37

[03:31] Team_011 possession (Score: 43-37)
Pau Towns attempts a Midrange. Contested by Derrick Bane (5.4 feet, MAN). Pau Towns misses. Rebound secured by CJ Anthony.

[03:17] Team_056 possession (Score: 43-37)
CJ Anthony attempts a 3Pt. Contested by Shai Leonard (4.2 feet, ZONE). CJ Anthony misses. Rebound secured by Russell Davis.

[03:02] Team_011 possession (Score: 43-37)
De'Aaron George attempts a Midrange. Contested by Damian Barrett (5.8 feet, MAN). De'Aaron George misses. Rebound secured by CJ Anthony.

[02:47] Team_056 possession (Score: 43-37)
Damian Barrett drives and kicks out. Damian Barrett attempts a 3Pt. Contested by De'Aaron George (4.7 feet, MAN). Damian Barrett misses. Offensive rebound by RJ Johnson! RJ Johnson kicks it out.

[02:31] Team_056 possession (Score: 43-37)
FOUL! Shooting foul on Russell Davis. CJ Anthony to the line for 2 free throws. [BONUS: 5 team fouls] (Russell Davis: 2 personal fouls)   FT 1/2: GOOD   FT 2/2: GOOD CJ Anthony makes 2/2 from the line.
Score: 43-39

[02:20] Team_011 possession (Score: 43-39)
Russell Davis makes the Layup and draws the foul on RJ Johnson! And-1! Russell Davis to the line for 1. [BONUS: 5 team fouls] (RJ Johnson: 2 personal fouls)   FT 1/1: GOOD Russell Davis makes 1/1 from the line.
Score: 46-39

[02:08] Team_056 possession (Score: 46-39)
Derrick Bane drives to the basket... FOUL! Offensive foul on Derrick Bane! Russell Davis drew the charge! [Team fouls: 6] (Derrick Bane: 1 personal fouls) TURNOVER! (dead ball)

[01:53] Team_011 possession (Score: 46-39)
Russell Davis attempts a Midrange. Contested by CJ Anthony (3.9 feet, ZONE). Russell Davis misses. Rebound secured by Derrick Bane.

[01:39] Team_056 possession (Score: 46-39)
CJ Anthony attempts a 3Pt. Contested by Shai Leonard (4.3 feet, ZONE). CJ Anthony misses. Rebound secured by Russell Davis.

[01:21] Team_011 possession (Score: 46-39)
Russell Davis attempts a Midrange. Contested by CJ Anthony (3.9 feet, ZONE). RUSSELL DAVIS MAKES IT! Assist: Shai Leonard
Score: 48-39

[01:02] Team_056 possession (Score: 48-39)
FOUL! Reach-in foul on Tyrese Nowitzki during the drive. [IN THE BONUS! 6 team fouls] CJ Anthony to the line for 2 free throws. (Tyrese Nowitzki: 1 personal fouls)   FT 1/2: GOOD   FT 2/2: GOOD CJ Anthony makes 2/2 from the line.
Score: 48-41

[00:52] Team_011 possession (Score: 48-41)
Shai Leonard drives, picks up De'Aaron Murray. Help arrives from CJ Anthony! Shai Leonard attempts a Dunk. Wide open! CJ Anthony is 6.1 feet away. [MAN] Shai Leonard misses. Offensive rebound by Russell Davis! Russell Davis kicks it out.

[00:42] Team_011 possession (Score: 48-41)
Tyrese Nowitzki attempts a 3Pt. Contested by De'Aaron Murray (6.0 feet, ZONE). TYRESE NOWITZKI MAKES IT! Assist: Shai Leonard
Score: 51-41

[00:29] Team_056 possession (Score: 51-41)
CJ Anthony attempts a Midrange. Contested by Tyrese Nowitzki (4.7 feet, MAN). CJ Anthony misses. Rebound secured by Tyrese Nowitzki.

[00:09] Team_011 possession (Score: 51-41)
Shai Leonard attempts a 3Pt. Wide open! De'Aaron Murray is 6.1 feet away. [MAN] SHAI LEONARD MAKES IT! Assist: De'Aaron George
Score: 54-41

================================================================================
                              2ND QUARTER COMPLETE                              
================================================================================

2ND QUARTER SCORE: Team_011 25, Team_056 21

BOX SCORE:
================================================================================

Team_011
--------------------------------------------------------------------------------
Player                MIN  PTS  REB  AST  TO      FG   FG%      3P   3P%
--------------------------------------------------------------------------------
Russell Davis           9    7    4    0   0   3/4    75.0     0/0   0.0
Michael Carter         15    5    1    0   0   2/2   100.0     0/0   0.0
Pau Barnes             15    3    1    0   0   1/1   100.0     0/0   0.0
Tyrese Nowitzki         9    3    4    1   0   1/1   100.0     0/0   0.0
Shai Leonard            9    3    0    2   0   1/2    50.0     0/0   0.0
Pau Towns               9    2    0    0   0   1/3    33.3     0/0   0.0
De'Aaron George         9    2    0    1   0   1/4    25.0     0/0   0.0
Evan George            15    0    1    0   0   0/0     0.0     0/0   0.0
Trae Tatum             15    0    0    1   0   0/0     0.0     0/0   0.0
Magic Tatum            15    0    0    1   0   0/0     0.0     0/0   0.0

TEAM: FG: 10/17 (58.8%), 3PT: 4/7 (57.1%), REB: 10 (1 off, 9 def), AST: 6, TO: 5
TEAM FOULS: 6 [Team_056 in BONUS]


Team_056
--------------------------------------------------------------------------------
Player                MIN  PTS  REB  AST  TO      FG   FG%      3P   3P%
--------------------------------------------------------------------------------
CJ Anthony              9    7    3    0   0   3/8    37.5     0/0   0.0
RJ Johnson              9    6    2    2   0   2/2   100.0     0/0   0.0
De'Aaron Murray         9    5    0    1   0   2/2   100.0     0/0   0.0
Yao Poole              15    3    1    0   0   1/1   100.0     0/0   0.0
Tony Carter            15    0    0    0   0   0/1     0.0     0/0   0.0
Magic Russell          15    0    0    1   0   0/0     0.0     0/0   0.0
Jrue Lillard           15    0    0    0   0   0/2     0.0     0/0   0.0
Derrick Bane            9    0    3    0   0   0/1     0.0     0/0   0.0
Damian Barrett          9    0    0    1   0   0/1     0.0     0/0   0.0

TEAM: FG: 8/18 (44.4%), 3PT: 3/11 (27.3%), REB: 10 (3 off, 7 def), AST: 5, TO: 3
TEAM FOULS: 6 [Team_011 in BONUS]

================================================================================

================================================================================
                       3RD QUARTER - Team_011 vs Team_056                       
================================================================================

[12:00] Team_011 possession (Score: 54-41)
Michael Carter attempts a 3Pt. Contested by Jrue Lillard (3.7 feet, ZONE). Michael Carter misses. Rebound secured by Tony Carter.

[11:41] Team_056 possession (Score: 54-41)
Tony Carter attempts a Midrange. Contested by Michael Carter (4.8 feet, MAN). Tony Carter misses. Rebound secured by Pau Barnes.

[11:28] Team_011 possession (Score: 54-41)
Evan George drives, Jrue Lillard stays with him. Evan George attempts a Layup. Contested by Jrue Lillard (4.1 feet, ZONE). Evan George misses. Offensive rebound by Evan George! Evan George's putback is no good. Rebound secured by Jrue Lillard.

[11:14] Team_056 possession (Score: 54-41)
FOUL! Shooting foul on Magic Tatum. Tony Carter to the line for 3 free throws. [Team fouls: 1] (Magic Tatum: 1 personal fouls)   FT 1/3: GOOD   FT 2/3: GOOD   FT 3/3: MISS Tony Carter makes 2/3 from the line. Rebound secured by Evan George.
Score: 54-43

[11:00] Team_011 possession (Score: 54-43)
Michael Carter attempts a 3Pt. Contested by Giannis Jokic (4.2 feet, ZONE). Michael Carter misses. Rebound secured by Yao Poole.

[10:51] Team_056 possession (Score: 54-43)
Yao Poole attempts a Layup. BLOCKED BY PAU BARNES! Ball is loose! Rebound secured by Evan George.

[10:34] Team_011 possession (Score: 54-43)
Evan George attempts a Midrange. Contested by Yao Poole (4.3 feet, MAN). EVAN GEORGE MAKES IT! Assist: Magic Tatum
Score: 56-43

[10:23] Team_056 possession (Score: 56-43)
Giannis Jokic attempts a 3Pt. Contested by Magic Tatum (3.8 feet, ZONE). Giannis Jokic misses. Rebound secured by Pau Barnes.

[10:04] Team_011 possession (Score: 56-43)
Michael Carter attempts a 3Pt. Contested by Tony Carter (4.0 feet, MAN). Michael Carter misses. FOUL! Loose ball foul on Jrue Lillard during the rebound battle. [Team fouls: 1] No free throws, side out. (Jrue Lillard: 1 personal fouls)

[09:48] Team_011 possession (Score: 56-43)
Magic Tatum attempts a Layup. BLOCKED BY GIANNIS JOKIC! Ball is loose! Rebound secured by Jrue Lillard.

[09:34] Team_056 possession (Score: 56-43)
Jrue Lillard makes the Midrange and draws the foul on Michael Carter! And-1! Jrue Lillard to the line for 1. [Team fouls: 2] (Michael Carter: 1 personal fouls)   FT 1/1: GOOD Jrue Lillard makes 1/1 from the line.
Score: 56-46

[09:20] Team_011 possession (Score: 56-46)
FOUL! Holding foul on Yao Poole. [Team fouls: 2] No free throws, side out. (Yao Poole: 1 personal fouls)

[09:05] Team_011 possession (Score: 56-46)
FOUL! Holding foul on Giannis Jokic. [Team fouls: 3] No free throws, side out. (Giannis Jokic: 1 personal fouls)

[08:51] Team_011 possession (Score: 56-46)
Magic Tatum attempts a Midrange. Contested by Giannis Jokic (4.5 feet, MAN). MAGIC TATUM MAKES IT!
Score: 58-46

[08:40] Team_056 possession (Score: 58-46)
Jrue Lillard attempts a 3Pt. Contested by Pau Barnes (3.6 feet, MAN). Jrue Lillard misses. FOUL! Loose ball foul on Michael Carter during the rebound battle. [Team fouls: 3] No free throws, side out. (Michael Carter: 2 personal fouls)

[08:28] Team_056 possession (Score: 58-46)
Yao Poole attempts a 3Pt. Contested by Magic Tatum (3.2 feet, ZONE). Yao Poole misses. Rebound secured by Pau Barnes.

[08:14] Team_011 possession (Score: 58-46)
Evan George attempts a Layup. Contested by Jrue Lillard (4.1 feet, ZONE). Evan George misses. Rebound secured by Jrue Lillard.

[07:58] Team_056 possession (Score: 58-46)
Tony Carter attempts a 3Pt. Contested by Michael Carter (4.8 feet, MAN). TONY CARTER MAKES IT! Assist: Magic Russell
Score: 58-49

[07:45] Team_011 possession (Score: 58-49)
Pau Barnes drives, Jrue Lillard stays with him. Pau Barnes attempts a Dunk. Contested by Jrue Lillard (4.5 feet, MAN). PAU BARNES MAKES IT! Assist: Magic Tatum
Score: 60-49

[07:31] Team_056 possession (Score: 60-49)
Yao Poole drives, Pau Barnes stays with him. Yao Poole attempts a Dunk. Contested by Pau Barnes (2.7 feet, MAN). YAO POOLE MAKES IT!
Score: 60-51

[07:15] Team_011 possession (Score: 60-51)
FOUL! Shooting foul on Yao Poole. Evan George to the line for 2 free throws. [Team fouls: 4] (Yao Poole: 2 personal fouls)   FT 1/2: GOOD   FT 2/2: GOOD Evan George makes 2/2 from the line.
Score: 62-51

[07:00] Team_056 possession (Score: 62-51)
FOUL! Shooting foul on Pau Barnes. Tony Carter to the line for 2 free throws. [Team fouls: 4] (Pau Barnes: 1 personal fouls)   FT 1/2: GOOD   FT 2/2: GOOD Tony Carter makes 2/2 from the line.
Score: 62-53

[06:43] Team_011 possession (Score: 62-53)
Trae Tatum attempts a Midrange. Contested by Magic Russell (5.4 feet, MAN). Trae Tatum misses. Rebound secured by Yao Poole.

[06:27] Team_056 possession (Score: 62-53)
Yao Poole attempts a 3Pt. Contested by Pau Barnes (2.7 feet, MAN). Yao Poole misses. Rebound secured by Pau Barnes.

[06:13] Team_011 possession (Score: 62-53)
FOUL! Holding foul on Jrue Lillard. [IN THE BONUS! 5 team fouls] Pau Barnes to the line for 2 free throws. (Jrue Lillard: 2 personal fouls)   FT 1/2: GOOD   FT 2/2: GOOD Pau Barnes makes 2/2 from the line.
Score: 64-53

[06:00] Team_056 possession (Score: 64-53)
Yao Poole drives and kicks out. FOUL! Shooting foul on Pau Barnes. Jrue Lillard to the line for 3 free throws. [BONUS: 5 team fouls] (Pau Barnes: 2 personal fouls)   FT 1/3: GOOD   FT 2/3: GOOD   FT 3/3: GOOD Jrue Lillard makes 3/3 from the line.
Score: 64-56

[05:43] Team_011 possession (Score: 64-56)
Michael Carter drives, Tony Carter stays with him. Michael Carter attempts a Dunk. Contested by Tony Carter (4.0 feet, MAN). Michael Carter misses. FOUL! Loose ball foul on Yao Poole during the rebound battle. [IN THE BONUS! 6 team fouls] Evan George to the line for 2 free throws. (Yao Poole: 3 personal fouls)   FT 1/2: MISS   FT 2/2: GOOD Evan George makes 1/2 from the line.
Score: 65-56

[05:29] Team_056 possession (Score: 65-56)
Yao Poole drives, Pau Barnes stays with him. Yao Poole attempts a Dunk. Contested by Pau Barnes (2.7 feet, ZONE). Yao Poole misses. Rebound secured by Pau Barnes.

[05:13] Team_011 possession (Score: 65-56)
Evan George attempts a Midrange. Contested by Tony Carter (4.4 feet, ZONE). EVAN GEORGE MAKES IT! Assist: Magic Tatum
Score: 67-56

[04:54] Team_056 possession (Score: 67-56)
Tony Carter drives, picks up Michael Carter. Help arrives from Magic Tatum! Tony Carter attempts a Layup. Contested by Magic Tatum (4.9 feet, MAN). TONY CARTER MAKES IT! Assist: Giannis Jokic
Score: 67-58

[04:38] Team_011 possession (Score: 67-58)
Michael Carter attempts a Layup. Contested by Jrue Lillard (3.8 feet, ZONE). Michael Carter misses. Rebound secured by Tony Carter.

[04:20] Team_056 possession (Score: 67-58)
Magic Russell attempts a Layup. Contested by Pau Barnes (3.4 feet, ZONE). MAGIC RUSSELL MAKES IT! Assist: Tony Carter
Score: 67-60

[04:03] Team_011 possession (Score: 67-60)
FOUL! Shooting foul on Jrue Lillard. Evan George to the line for 2 free throws. [BONUS: 7 team fouls] (Jrue Lillard: 3 personal fouls)   FT 1/2: GOOD   FT 2/2: GOOD Evan George makes 2/2 from the line.
Score: 69-60

[03:45] Team_056 possession (Score: 69-60)
Yao Poole attempts a Layup. BLOCKED BY PAU BARNES! Ball is loose! Offensive rebound by Yao Poole! Yao Poole kicks it out.

[03:32] Team_056 possession (Score: 69-60)
FOUL! Holding foul on Magic Tatum. [IN THE BONUS! 6 team fouls] Giannis Jokic to the line for 2 free throws. (Magic Tatum: 2 personal fouls)   FT 1/2: GOOD   FT 2/2: MISS Giannis Jokic makes 1/2 from the line. Rebound secured by Michael Carter.
Score: 69-61

[03:17] Team_011 possession (Score: 69-61)
Evan George drives, Yao Poole stays with him. Evan George attempts a Dunk. Contested by Yao Poole (4.6 feet, MAN). Evan George misses. Rebound secured by Jrue Lillard.

[03:06] Team_056 possession (Score: 69-61)
Giannis Jokic attempts a Layup. BLOCKED BY PAU BARNES! Ball is loose! Rebound secured by Pau Barnes.

[02:50] Team_011 possession (Score: 69-61)
Trae Tatum makes the Midrange and draws the foul on Magic Russell! And-1! Trae Tatum to the line for 1. [BONUS: 8 team fouls] (Magic Russell: 1 personal fouls)   FT 1/1: GOOD Trae Tatum makes 1/1 from the line.
Score: 72-61

[02:32] Team_056 possession (Score: 72-61)
Tony Carter attempts a Midrange. Contested by Michael Carter (5.0 feet, ZONE). Tony Carter misses. Rebound secured by Michael Carter.

[02:19] Team_011 possession (Score: 72-61)
Pau Barnes attempts a Midrange. Contested by Tony Carter (5.0 feet, ZONE). Pau Barnes misses. Rebound secured by Yao Poole.

[02:04] Team_056 possession (Score: 72-61)
Giannis Jokic attempts a 3Pt. Contested by Magic Tatum (4.0 feet, MAN). Giannis Jokic misses. Rebound secured by Pau Barnes.

[01:48] Team_011 possession (Score: 72-61)
Michael Carter attempts a 3Pt. Contested by Giannis Jokic (4.5 feet, ZONE). Michael Carter misses. Offensive rebound by Evan George! Evan George puts it back in!
Score: 74-61

[01:33] Team_056 possession (Score: 74-61)
Magic Russell attempts a 3Pt. Contested by Magic Tatum (4.1 feet, ZONE). Magic Russell misses. Offensive rebound by Jrue Lillard! Jrue Lillard's putback is no good. Rebound secured by Pau Barnes.

[01:21] Team_011 possession (Score: 74-61)
Pau Barnes attempts a 3Pt. Contested by Jrue Lillard (4.8 feet, MAN). Pau Barnes misses. Rebound secured by Yao Poole.

[01:07] Team_056 possession (Score: 74-61)
Yao Poole attempts a Layup. Contested by Pau Barnes (3.2 feet, MAN). Yao Poole misses. Offensive rebound by Jrue Lillard! Jrue Lillard puts it back in!
Score: 74-63

[00:54] Team_011 possession (Score: 74-63)
Pau Barnes attempts a Midrange. Contested by Jrue Lillard (4.8 feet, MAN). Pau Barnes misses. Rebound secured by Yao Poole.

[00:42] Team_056 possession (Score: 74-63)
Magic Russell attempts a 3Pt. Contested by Magic Tatum (4.2 feet, ZONE). Magic Russell misses. FOUL! Loose ball foul on Pau Barnes during the rebound battle. [IN THE BONUS! 7 team fouls] Jrue Lillard to the line for 2 free throws. (Pau Barnes: 3 personal fouls)   FT 1/2: GOOD   FT 2/2: GOOD Jrue Lillard makes 2/2 from the line.
Score: 74-65

[00:27] Team_011 possession (Score: 74-65)
Michael Carter drives and kicks out. Pau Barnes attempts a Midrange. Contested by Jrue Lillard (4.4 feet, ZONE). PAU BARNES MAKES IT! Assist: Evan George
Score: 76-65

[00:08] Team_056 possession (Score: 76-65)
Yao Poole drives, picks up Pau Barnes. Help arrives from Magic Tatum! Yao Poole attempts a Layup. Contested by Magic Tatum (3.3 feet, MAN). Yao Poole misses. Rebound secured by Michael Carter.

================================================================================
                              3RD QUARTER COMPLETE                              
================================================================================

3RD QUARTER SCORE: Team_011 22, Team_056 24

BOX SCORE:
================================================================================

Team_011
--------------------------------------------------------------------------------
Player                MIN  PTS  REB  AST  TO      FG   FG%      3P   3P%
--------------------------------------------------------------------------------
Evan George            27   11    3    1   0   6/9    66.7     0/0   0.0
Pau Barnes             27    6    9    0   0   3/6    50.0     0/0   0.0
Trae Tatum             27    3    0    0   0   1/2    50.0     0/0   0.0
Magic Tatum            27    2    0    3   0   1/2    50.0     0/0   0.0
Michael Carter         27    0    3    0   0   0/3     0.0     0/0   0.0

TEAM: FG: 11/22 (50.0%), 3PT: 1/4 (25.0%), REB: 15 (3 off, 12 def), AST: 4, TO: 0
TEAM FOULS: 7 [Team_056 in BONUS]


Team_056
--------------------------------------------------------------------------------
Player                MIN  PTS  REB  AST  TO      FG   FG%      3P   3P%
--------------------------------------------------------------------------------
Jrue Lillard           27   10    6    0   0   4/4   100.0     0/0   0.0
Tony Carter            27    7    2    1   0   3/6    50.0     0/0   0.0
Yao Poole              27    2    6    0   0   1/6    16.7     0/0   0.0
Magic Russell          27    2    0    1   0   1/2    50.0     0/0   0.0
Giannis Jokic          27    0    0    1   0   0/3     0.0     0/0   0.0

TEAM: FG: 9/22 (40.9%), 3PT: 2/8 (25.0%), REB: 14 (4 off, 10 def), AST: 3, TO: 0
TEAM FOULS: 8 [Team_011 in BONUS]

================================================================================

================================================================================
                       4TH QUARTER - Team_011 vs Team_056                       
================================================================================

[12:00] Team_011 possession (Score: 76-65)
Michael Carter attempts a 3Pt. Contested by Tony Carter (4.3 feet, MAN). Michael Carter misses. Rebound secured by Jrue Lillard.

[11:45] Team_056 possession (Score: 76-65)
Tony Carter attempts a 3Pt. Contested by Michael Carter (5.1 feet, MAN). Tony Carter misses. Rebound secured by Evan George.

[11:35] Team_011 possession (Score: 76-65)
Evan George drives, Jrue Lillard stays with him. Evan George attempts a Dunk. Contested by Jrue Lillard (4.4 feet, ZONE). Evan George misses. Rebound secured by Tony Carter.

[11:23] Team_056 possession (Score: 76-65)
Magic Russell attempts a Midrange. Contested by Trae Tatum (5.3 feet, MAN). Magic Russell misses. Rebound secured by Evan George.

[11:11] Team_011 possession (Score: 76-65)
Trae Tatum drives, picks up Magic Russell. Help arrives from Tony Carter! Trae Tatum attempts a Layup. Contested by Tony Carter (5.8 feet, MAN). TRAE TATUM MAKES IT! Assist: Pau Barnes
Score: 78-65

[10:58] Team_056 possession (Score: 78-65)
Giannis Jokic attempts a 3Pt. Contested by Magic Tatum (4.2 feet, ZONE). GIANNIS JOKIC MAKES IT! Assist: Magic Russell
Score: 78-68

[10:42] Team_011 possession (Score: 78-68)
Evan George attempts a Layup. Contested by Jrue Lillard (4.5 feet, ZONE). EVAN GEORGE MAKES IT!
Score: 80-68

[10:26] Team_056 possession (Score: 80-68)
Giannis Jokic attempts a 3Pt. Contested by Magic Tatum (4.2 feet, ZONE). Giannis Jokic misses. Rebound secured by Pau Barnes.

[10:15] Team_011 possession (Score: 80-68)
Trae Tatum attempts a Midrange. Contested by Tony Carter (4.5 feet, ZONE). TRAE TATUM MAKES IT! Assist: Evan George
Score: 82-68

[09:59] Team_056 possession (Score: 82-68)
Magic Russell makes the Layup and draws the foul on Pau Barnes! And-1! Magic Russell to the line for 1. [Team fouls: 1] (Pau Barnes: 1 personal fouls)   FT 1/1: GOOD Magic Russell makes 1/1 from the line.
Score: 82-71

[09:45] Team_011 possession (Score: 82-71)
FOUL! Reach-in foul on Jrue Lillard during the drive. [Team fouls: 1] No free throws, side out. (Jrue Lillard: 1 personal fouls)

[09:28] Team_011 possession (Score: 82-71)
Trae Tatum makes the Dunk and draws the foul on Tony Carter! And-1! Trae Tatum to the line for 1. [Team fouls: 2] (Tony Carter: 1 personal fouls)   FT 1/1: GOOD Trae Tatum makes 1/1 from the line.
Score: 85-71

[09:15] Team_056 possession (Score: 85-71)
Giannis Jokic drives, Magic Tatum stays with him. Giannis Jokic attempts a Dunk. Contested by Magic Tatum (4.3 feet, MAN). GIANNIS JOKIC MAKES IT!
Score: 85-73

[09:03] Team_011 possession (Score: 85-73)
Trae Tatum attempts a 3Pt. Contested by Giannis Jokic (4.9 feet, ZONE). TRAE TATUM MAKES IT! Assist: Evan George
Score: 88-73

[08:49] Team_056 possession (Score: 88-73)
Tony Carter drives, Michael Carter stays with him. Tony Carter attempts a Dunk. Contested by Michael Carter (5.4 feet, MAN). TONY CARTER MAKES IT! Assist: Giannis Jokic
Score: 88-75

[08:34] Team_011 possession (Score: 88-75)
Magic Tatum attempts a 3Pt. Wide open! Magic Russell is 6.3 feet away. [ZONE] Magic Tatum misses. Rebound secured by Jrue Lillard.

[08:16] Team_056 possession (Score: 88-75)
Magic Russell attempts a 3Pt. Contested by Trae Tatum (5.6 feet, MAN). Magic Russell misses. Rebound secured by Michael Carter.

[08:01] Team_011 possession (Score: 88-75)
Pau Barnes attempts a Midrange. Contested by Jrue Lillard (5.2 feet, MAN). Pau Barnes misses. Offensive rebound by Pau Barnes! Pau Barnes kicks it out.

[07:47] Team_011 possession (Score: 88-75)
Michael Carter attempts a 3Pt. Contested by Tony Carter (4.8 feet, MAN). Michael Carter misses. Rebound secured by Tony Carter.

[07:32] Team_056 possession (Score: 88-75)
Yao Poole attempts a Midrange. Contested by Pau Barnes (3.8 feet, MAN). YAO POOLE MAKES IT! Assist: Magic Russell
Score: 88-77

[07:16] Team_011 possession (Score: 88-77)
Magic Tatum attempts a Midrange. Contested by Tony Carter (5.2 feet, ZONE). Magic Tatum misses. Offensive rebound by Evan George! Evan George puts it back in!
Score: 90-77

[07:02] Team_056 possession (Score: 90-77)
Tony Carter drives and kicks out. Giannis Jokic attempts a Midrange. Contested by Magic Tatum (4.4 feet, MAN). Giannis Jokic misses. Rebound secured by Michael Carter.

[06:47] Team_011 possession (Score: 90-77)
Pau Barnes drives and kicks out. Pau Barnes attempts a Midrange. Wide open! Magic Russell is 6.5 feet away. [ZONE] PAU BARNES MAKES IT! Assist: Trae Tatum
Score: 92-77

[06:35] Team_056 possession (Score: 92-77)
FOUL! Shooting foul on Pau Barnes. Giannis Jokic to the line for 2 free throws. [Team fouls: 2] (Pau Barnes: 2 personal fouls)   FT 1/2: GOOD   FT 2/2: GOOD Giannis Jokic makes 2/2 from the line.
Score: 92-79

[06:21] Team_011 possession (Score: 92-79)
Michael Carter attempts a 3Pt. Contested by Tony Carter (5.0 feet, MAN). Michael Carter misses. Rebound secured by Tony Carter.

[06:07] Team_056 possession (Score: 92-79)
FOUL! Reach-in foul on Pau Barnes during the drive. [Team fouls: 3] No free throws, side out. (Pau Barnes: 3 personal fouls)

[05:52] Team_056 possession (Score: 92-79)
Magic Russell makes the Layup and draws the foul on Pau Barnes! And-1! Magic Russell to the line for 1. [Team fouls: 4] (Pau Barnes: 4 personal fouls)   FT 1/1: GOOD Magic Russell makes 1/1 from the line.
Score: 92-82

[05:36] Team_011 possession (Score: 92-82)
Pau Barnes makes the Dunk and draws the foul on Giannis Jokic! And-1! Pau Barnes to the line for 1. [Team fouls: 3] (Giannis Jokic: 1 personal fouls)   FT 1/1: GOOD Pau Barnes makes 1/1 from the line.
Score: 95-82

[05:23] Team_056 possession (Score: 95-82)
Giannis Jokic attempts a 3Pt. Contested by Magic Tatum (4.8 feet, MAN). Giannis Jokic misses. Rebound secured by Michael Carter.

[05:09] Team_011 possession (Score: 95-82)
Trae Tatum attempts a 3Pt. Contested by Tony Carter (5.2 feet, ZONE). Trae Tatum misses. Rebound secured by Yao Poole.

[04:55] Team_056 possession (Score: 95-82)
Giannis Jokic attempts a Layup. Contested by Pau Barnes (4.8 feet, ZONE). GIANNIS JOKIC MAKES IT! Assist: Magic Russell
Score: 95-84

[04:43] Team_011 possession (Score: 95-84)
Michael Carter attempts a 3Pt. Contested by Jrue Lillard (5.1 feet, ZONE). Michael Carter misses. Rebound secured by Jrue Lillard.

[04:28] Team_056 possession (Score: 95-84)
Tony Carter attempts a Midrange. Wide open! Trae Tatum is 6.4 feet away. [ZONE] Tony Carter misses. Rebound secured by Michael Carter.

[04:13] Team_011 possession (Score: 95-84)
FOUL! Shooting foul on Yao Poole. Evan George to the line for 3 free throws. [Team fouls: 4] (Yao Poole: 1 personal fouls)   FT 1/3: GOOD   FT 2/3: GOOD   FT 3/3: GOOD Evan George makes 3/3 from the line.
Score: 98-84

[03:54] Team_056 possession (Score: 98-84)
Yao Poole makes the Dunk and draws the foul on Pau Barnes! And-1! Yao Poole to the line for 1. [BONUS: 5 team fouls] (Pau Barnes: 5 personal fouls)   FT 1/1: GOOD Yao Poole makes 1/1 from the line.
Score: 98-87

[03:39] Team_011 possession (Score: 98-87)
Magic Tatum attempts a 3Pt. Contested by Giannis Jokic (5.9 feet, MAN). Magic Tatum misses. Offensive rebound by Pau Barnes! Pau Barnes kicks it out.

[03:25] Team_011 possession (Score: 98-87)
Magic Tatum attempts a Layup. Contested by Jrue Lillard (5.5 feet, ZONE). MAGIC TATUM MAKES IT!
Score: 100-87

[03:14] Team_056 possession (Score: 100-87)
Magic Russell throws a bad pass! Stolen by Trae Tatum! TURNOVER! (live ball)

[02:57] Team_011 possession (Score: 100-87)
Pau Barnes drives and kicks out. Trae Tatum attempts a Midrange. Wide open! Magic Russell is 7.1 feet away. [MAN] Trae Tatum misses. Rebound secured by Yao Poole.

[02:45] Team_056 possession (Score: 100-87)
Giannis Jokic drives and kicks out. Yao Poole attempts a Midrange. Wide open! Evan George is 6.8 feet away. [ZONE] YAO POOLE MAKES IT!
Score: 100-89

[02:30] Team_011 possession (Score: 100-89)
Michael Carter attempts a 3Pt. Contested by Tony Carter (5.6 feet, ZONE). MICHAEL CARTER MAKES IT! Assist: Magic Tatum
Score: 103-89

[02:15] Team_056 possession (Score: 103-89)
Magic Russell attempts a 3Pt. Wide open! Trae Tatum is 6.4 feet away. [MAN] Magic Russell misses. Offensive rebound by Yao Poole! Yao Poole kicks it out.

[01:59] Team_056 possession (Score: 103-89)
Yao Poole attempts a Midrange. Contested by Michael Carter (5.6 feet, ZONE). YAO POOLE MAKES IT!
Score: 103-91

[01:49] Team_011 possession (Score: 103-91)
Evan George drives to the basket... Evan George throws a bad pass! Stolen by Jrue Lillard! TURNOVER! (live ball)

[01:36] Team_056 possession (Score: 103-91)
Jrue Lillard drives and kicks out. Magic Russell attempts a Midrange. Contested by Pau Barnes (5.5 feet, ZONE). Magic Russell misses. Rebound secured by Pau Barnes.

[01:22] Team_011 possession (Score: 103-91)
Trae Tatum attempts a 3Pt. Wide open! Magic Russell is 7.0 feet away. [MAN] Trae Tatum misses. Offensive rebound by Evan George! Evan George kicks it out.

[01:08] Team_011 possession (Score: 103-91)
Pau Barnes attempts a 3Pt. Wide open! Jrue Lillard is 6.2 feet away. [MAN] Pau Barnes misses. FOUL! Loose ball foul on Tony Carter during the rebound battle. [IN THE BONUS! 5 team fouls] Pau Barnes to the line for 2 free throws. (Tony Carter: 2 personal fouls)   FT 1/2: MISS   FT 2/2: GOOD Pau Barnes makes 1/2 from the line.
Score: 104-91

[00:56] Team_056 possession (Score: 104-91)
Giannis Jokic makes the Layup and draws the foul on Magic Tatum! And-1! Giannis Jokic to the line for 1. [BONUS: 6 team fouls] (Magic Tatum: 1 personal fouls)   FT 1/1: MISS Giannis Jokic makes 0/1 from the line. Rebound secured by Evan George.
Score: 104-93

[00:44] Team_011 possession (Score: 104-93)
Magic Tatum attempts a 3Pt. Wide open! Giannis Jokic is 6.4 feet away. [MAN] Magic Tatum misses. Offensive rebound by Evan George! Evan George kicks it out.

[00:33] Team_011 possession (Score: 104-93)
Pau Barnes attempts a Layup. Wide open! Jrue Lillard is 6.3 feet away. [MAN] PAU BARNES MAKES IT!
Score: 106-93

[00:18] Team_056 possession (Score: 106-93)
FOUL! Shooting foul on Pau Barnes. Yao Poole to the line for 2 free throws. [BONUS: 7 team fouls] (Pau Barnes: 6 personal fouls) Pau Barnes FOULS OUT!   FT 1/2: MISS   FT 2/2: GOOD Yao Poole makes 1/2 from the line.
Score: 106-94

[00:18] Substitution (Team_011): Pau Barnes OUT (stamina: 28) → Shai Leonard IN (foul_out)

================================================================================
                              4TH QUARTER COMPLETE                              
================================================================================

4TH QUARTER SCORE: Team_011 30, Team_056 29

BOX SCORE:
================================================================================

Team_011
--------------------------------------------------------------------------------
Player                MIN  PTS  REB  AST  TO      FG   FG%      3P   3P%
--------------------------------------------------------------------------------
Trae Tatum             39   10    0    1   0   4/5    80.0     0/0   0.0
Pau Barnes             39    8    4    1   0   4/5    80.0     0/0   0.0
Evan George            39    7    6    2   0   3/4    75.0     0/0   0.0
Michael Carter         39    3    4    0   0   1/5    20.0     0/0   0.0
Magic Tatum            39    2    0    1   0   1/2    50.0     0/0   0.0

TEAM: FG: 13/21 (61.9%), 3PT: 4/10 (40.0%), REB: 14 (5 off, 9 def), AST: 5, TO: 1
TEAM FOULS: 7 [Team_056 in BONUS]


Team_056
--------------------------------------------------------------------------------
Player                MIN  PTS  REB  AST  TO      FG   FG%      3P   3P%
--------------------------------------------------------------------------------
Yao Poole              39   10    3    0   0   5/5   100.0     0/0   0.0
Giannis Jokic          39    9    0    1   0   4/7    57.1     0/0   0.0
Magic Russell          39    6    0    3   0   2/4    50.0     0/0   0.0
Tony Carter            39    2    3    0   0   1/4    25.0     0/0   0.0
Jrue Lillard           39    0    3    0   0   0/1     0.0     0/0   0.0

TEAM: FG: 12/21 (57.1%), 3PT: 1/5 (20.0%), REB: 9 (1 off, 8 def), AST: 4, TO: 1
TEAM FOULS: 5 [Team_011 in BONUS]

================================================================================

================================================================================
                               FULL GAME COMPLETE                               
================================================================================

FINAL SCORE: Team_011 106, Team_056 94

SCORING BY QUARTER:
--------------------------------------------------------------------------------
Team                     Q1     Q2     Q3     Q4    FINAL
--------------------------------------------------------------------------------
Team_011                 29     25     22     30      106
Team_056                 20     21     24     29       94
--------------------------------------------------------------------------------

FULL GAME BOX SCORE:
================================================================================

Team_011
--------------------------------------------------------------------------------
Player                MIN  PTS  REB  AST  TO      FG   FG%      3P   3P%      FT STL BLK
--------------------------------------------------------------------------------
Magic Tatum            39   10    0    5   0   6/11   54.5   0/2     0.0   4/4     0   2
Trae Tatum             39   20    0    2   2   8/11   72.7   1/3    33.3   3/3     1   0
Michael Carter         39   13   13    3   1   8/18   44.4   4/11   36.4   6/8     0   0
Pau Barnes             39   24   18    2   1   8/12   66.7   2/3    66.7   5/6     1   3
Evan George            39   22   16    3   0   8/14   57.1   1/1   100.0  10/11    0   0
Shai Leonard            9    3    0    2   0   1/2    50.0   1/2    50.0   0/0     0   0
De'Aaron George         9    2    0    1   1   1/4    25.0   0/2     0.0   0/0     0   0
Tyrese Nowitzki         9    3    4    1   1   1/1   100.0   1/1   100.0   0/0     0   0
Russell Davis           9    7    4    0   0   3/4    75.0   0/0     0.0   3/3     0   1
Pau Towns               9    2    0    0   1   1/3    33.3   0/0     0.0   0/0     0   0

TEAM: FG: 47/82 (57.3%), 3PT: 10/25 (40.0%), REB: 54 (12 off, 42 def), AST: 19, TO: 7


Team_056
--------------------------------------------------------------------------------
Player                MIN  PTS  REB  AST  TO      FG   FG%      3P   3P%      FT STL BLK
--------------------------------------------------------------------------------
Giannis Jokic          39   15    0    3   1   8/15   53.3   3/8    37.5   3/5     0   1
Magic Russell          39    8    0    6   2   4/8    50.0   1/4    25.0   2/2     1   0
Tony Carter            39   14    8    3   0   7/17   41.2   2/8    25.0   4/5     0   0
Jrue Lillard           39   16   14    0   0   2/10   20.0   0/4     0.0   6/6     3   1
Yao Poole              39   18   12    0   1  10/17   58.8   1/4    25.0   5/7     0   1
De'Aaron Murray         9    5    0    1   0   3/3   100.0   1/1   100.0   0/0     0   0
Damian Barrett          9    0    0    1   1   0/1     0.0   0/1     0.0   0/0     0   0
CJ Anthony              9    7    3    0   1   3/8    37.5   1/5    20.0   4/4     1   0
RJ Johnson              9    6    2    2   0   1/1   100.0   0/0     0.0   1/1     0   0
Derrick Bane            9    0    3    0   0   0/1     0.0   0/0     0.0   0/0     0   0

TEAM: FG: 38/82 (46.3%), 3PT: 9/35 (25.7%), REB: 43 (10 off, 33 def), AST: 16, TO: 6

================================================================================
