================================================================================
                        FULL GAME - Team_084 vs Team_091                        
================================================================================

================================================================================
                       1ST QUARTER - Team_084 vs Team_091                       
================================================================================

[12:00] Team_084 possession (Score: 0-0)
Dejounte Ginobili drives and kicks out. Dejounte Ginobili attempts a 3Pt. Contested by Kyrie Rozier (4.1 feet, ZONE). Dejounte Ginobili misses. Rebound secured by Kyrie Rozier.

[11:47] Team_091 possession (Score: 0-0)
Kyrie Rozier attempts a Midrange. Contested by Luka Sexton (3.8 feet, MAN). KYRIE ROZIER MAKES IT!
Score: 0-2

[11:33] Team_084 possession (Score: 0-2)
Klay Thompson attempts a Layup. Contested by Kevin Simons (4.0 feet, ZONE). Klay Thompson misses. FOUL! Loose ball foul on Rudy Bridges during the rebound battle. [Team fouls: 1] No free throws, side out. (Rudy Bridges: 1 personal fouls)

[11:16] Team_084 possession (Score: 0-2)
Klay Thompson makes the Layup and draws the foul on Rudy Bridges! And-1! Klay Thompson to the line for 1. [Team fouls: 2] (Rudy Bridges: 2 personal fouls)   FT 1/1: GOOD Klay Thompson makes 1/1 from the line.
Score: 3-2

[11:01] Team_091 possession (Score: 3-2)
Kevin Simons makes the Midrange and draws the foul on Giannis Quickley! And-1! Kevin Simons to the line for 1. [Team fouls: 1] (Giannis Quickley: 1 personal fouls)   FT 1/1: MISS Kevin Simons makes 0/1 from the line. Offensive rebound by Rudy Bridges! Rudy Bridges kicks it out.
Score: 3-4

[10:46] Team_091 possession (Score: 3-4)
Kevin Simons commits a violation (traveling/carry)! TURNOVER! (dead ball)

[10:31] Team_084 possession (Score: 3-4)
Giannis Quickley throws a bad pass! Stolen by Kevin Simons! TURNOVER! (live ball)

[10:14] Team_091 possession (Score: 3-4)
Kevin Simons makes the Layup and draws the foul on Giannis Quickley! And-1! Kevin Simons to the line for 1. [Team fouls: 2] (Giannis Quickley: 2 personal fouls)   FT 1/1: GOOD Kevin Simons makes 1/1 from the line.
Score: 3-7

[10:01] Team_084 possession (Score: 3-7)
Jarrett Booker attempts a Midrange. Contested by D'Angelo Ingram (4.9 feet, MAN). JARRETT BOOKER MAKES IT! Assist: Klay Thompson
Score: 5-7

[09:42] Team_091 possession (Score: 5-7)
Kevin Simons attempts a 3Pt. Contested by Giannis Quickley (4.8 feet, MAN). Kevin Simons misses. Offensive rebound by Rudy Bridges! Rudy Bridges kicks it out.

[09:31] Team_091 possession (Score: 5-7)
Rudy Bridges makes the Dunk and draws the foul on Klay Thompson! And-1! Rudy Bridges to the line for 1. [Team fouls: 3] (Klay Thompson: 1 personal fouls)   FT 1/1: GOOD Rudy Bridges makes 1/1 from the line.
Score: 5-10

[09:17] Team_084 possession (Score: 5-10)
Giannis Quickley attempts a 3Pt. Contested by Kyrie Rozier (4.3 feet, ZONE). GIANNIS QUICKLEY MAKES IT! Assist: Klay Thompson
Score: 8-10

[09:01] Team_091 possession (Score: 8-10)
Isaiah Siakam attempts a 3Pt. Contested by Luka Sexton (4.0 feet, ZONE). Isaiah Siakam misses. Rebound secured by Klay Thompson.

[08:50] Team_084 possession (Score: 8-10)
Jarrett Booker attempts a Layup. Contested by D'Angelo Ingram (4.9 feet, MAN). JARRETT BOOKER MAKES IT!
Score: 10-10

[08:31] Team_091 possession (Score: 10-10)
Isaiah Siakam makes the Dunk and draws the foul on Dejounte Ginobili! And-1! Isaiah Siakam to the line for 1. [Team fouls: 4] (Dejounte Ginobili: 1 personal fouls)   FT 1/1: GOOD Isaiah Siakam makes 1/1 from the line.
Score: 10-13

[08:16] Team_084 possession (Score: 10-13)
Dejounte Ginobili drives, Kevin Simons stays with him. Dejounte Ginobili attempts a Layup. Contested by Kevin Simons (3.8 feet, ZONE). Dejounte Ginobili misses. Rebound secured by Rudy Bridges.

[08:01] Team_091 possession (Score: 10-13)
Kyrie Rozier attempts a 3Pt. Contested by Luka Sexton (3.8 feet, MAN). KYRIE ROZIER MAKES IT! Assist: Rudy Bridges
Score: 10-16

[07:45] Team_084 possession (Score: 10-16)
FOUL! Shooting foul on Kyrie Rozier. Luka Sexton to the line for 2 free throws. [Team fouls: 3] (Kyrie Rozier: 1 personal fouls)   FT 1/2: GOOD   FT 2/2: MISS Luka Sexton makes 1/2 from the line. Rebound secured by Kevin Simons.
Score: 11-16

[07:33] Team_091 possession (Score: 11-16)
FOUL! Shooting foul on Luka Sexton. D'Angelo Ingram to the line for 3 free throws. [BONUS: 5 team fouls] (Luka Sexton: 1 personal fouls)   FT 1/3: GOOD   FT 2/3: GOOD   FT 3/3: MISS D'Angelo Ingram makes 2/3 from the line. Offensive rebound by Rudy Bridges! Rudy Bridges kicks it out.
Score: 11-18

[07:20] Team_091 possession (Score: 11-18)
FOUL! Shooting foul on Giannis Quickley. Kevin Simons to the line for 2 free throws. [BONUS: 6 team fouls] (Giannis Quickley: 3 personal fouls)   FT 1/2: GOOD   FT 2/2: MISS Kevin Simons makes 1/2 from the line. Rebound secured by Dejounte Ginobili.
Score: 11-19

[07:08] Team_084 possession (Score: 11-19)
Dejounte Ginobili drives, Kevin Simons stays with him. Dejounte Ginobili attempts a Dunk. Contested by Kevin Simons (3.8 feet, ZONE). DEJOUNTE GINOBILI MAKES IT! Assist: Jarrett Booker
Score: 13-19

[06:53] Team_091 possession (Score: 13-19)
Kyrie Rozier attempts a Layup. BLOCKED BY LUKA SEXTON! Ball is loose! Rebound secured by Giannis Quickley.

[06:42] Team_084 possession (Score: 13-19)
Giannis Quickley attempts a Layup. Contested by Kevin Simons (3.8 feet, MAN). GIANNIS QUICKLEY MAKES IT!
Score: 15-19

[06:31] Team_091 possession (Score: 15-19)
Kevin Simons attempts a Midrange. Contested by Giannis Quickley (4.8 feet, MAN). KEVIN SIMONS MAKES IT! Assist: Rudy Bridges
Score: 15-21

[06:16] Team_084 possession (Score: 15-21)
Klay Thompson attempts a Midrange. Contested by Rudy Bridges (4.8 feet, MAN). Klay Thompson misses. Rebound secured by Kyrie Rozier.

[05:58] Team_091 possession (Score: 15-21)
Isaiah Siakam attempts a Midrange. Contested by Dejounte Ginobili (4.9 feet, ZONE). Isaiah Siakam misses. FOUL! Loose ball foul on Dejounte Ginobili during the rebound battle. [IN THE BONUS! 7 team fouls] Rudy Bridges to the line for 2 free throws. (Dejounte Ginobili: 2 personal fouls)   FT 1/2: GOOD   FT 2/2: GOOD Rudy Bridges makes 2/2 from the line.
Score: 15-23

[05:41] Team_084 possession (Score: 15-23)
Luka Sexton attempts a Midrange. Contested by Kyrie Rozier (4.4 feet, MAN). LUKA SEXTON MAKES IT!
Score: 17-23

[05:26] Team_091 possession (Score: 17-23)
Kyrie Rozier attempts a Midrange. Contested by Dejounte Ginobili (4.7 feet, ZONE). Kyrie Rozier misses. Rebound secured by Giannis Quickley.

[05:09] Team_084 possession (Score: 17-23)
Klay Thompson attempts a Midrange. Contested by D'Angelo Ingram (5.2 feet, ZONE). Klay Thompson misses. Rebound secured by Kyrie Rozier.

[04:56] Team_091 possession (Score: 17-23)
FOUL! Holding foul on Klay Thompson. [IN THE BONUS! 8 team fouls] Rudy Bridges to the line for 2 free throws. (Klay Thompson: 2 personal fouls)   FT 1/2: GOOD   FT 2/2: GOOD Rudy Bridges makes 2/2 from the line.
Score: 17-25

[04:39] Team_084 possession (Score: 17-25)
Klay Thompson drives, Kevin Simons stays with him. Klay Thompson attempts a Dunk. Contested by Kevin Simons (4.1 feet, ZONE). KLAY THOMPSON MAKES IT!
Score: 19-25

[04:22] Team_091 possession (Score: 19-25)
Kevin Simons attempts a Layup. Contested by Giannis Quickley (4.9 feet, ZONE). KEVIN SIMONS MAKES IT! Assist: Rudy Bridges
Score: 19-27

[04:08] Team_084 possession (Score: 19-27)
Giannis Quickley makes the Layup and draws the foul on Kevin Simons! And-1! Giannis Quickley to the line for 1. [Team fouls: 4] (Kevin Simons: 1 personal fouls)   FT 1/1: GOOD Giannis Quickley makes 1/1 from the line.
Score: 22-27

[03:54] Team_091 possession (Score: 22-27)
Kyrie Rozier attempts a Midrange. Contested by Luka Sexton (3.9 feet, ZONE). Kyrie Rozier misses. Rebound secured by Dejounte Ginobili.

[03:38] Team_084 possession (Score: 22-27)
Dejounte Ginobili attempts a Layup. Contested by Kevin Simons (3.9 feet, ZONE). DEJOUNTE GINOBILI MAKES IT! Assist: Jarrett Booker
Score: 24-27

[03:21] Team_091 possession (Score: 24-27)
Kyrie Rozier drives and kicks out. Kevin Simons attempts a Midrange. Contested by Giannis Quickley (4.6 feet, MAN). Kevin Simons misses. Rebound secured by Giannis Quickley.

[03:06] Team_084 possession (Score: 24-27)
Jarrett Booker drives to the basket... Jarrett Booker loses control! Ball rolls out of bounds! TURNOVER! (dead ball)

[02:51] Team_091 possession (Score: 24-27)
D'Angelo Ingram drives, Giannis Quickley stays with him. D'Angelo Ingram attempts a Dunk. Contested by Giannis Quickley (5.5 feet, ZONE). D'ANGELO INGRAM MAKES IT! Assist: Rudy Bridges
Score: 24-29

[02:33] Team_084 possession (Score: 24-29)
Dejounte Ginobili attempts a Layup. Wide open! Isaiah Siakam is 6.1 feet away. [MAN] DEJOUNTE GINOBILI MAKES IT!
Score: 26-29

[02:18] Team_091 possession (Score: 26-29)
Rudy Bridges attempts a Midrange. Contested by Dejounte Ginobili (4.9 feet, ZONE). Rudy Bridges misses. Rebound secured by Giannis Quickley.

[01:59] Team_084 possession (Score: 26-29)
Luka Sexton attempts a Layup. BLOCKED BY KYRIE ROZIER! Ball deflects out of bounds off Luka Sexton.

[01:42] Team_091 possession (Score: 26-29)
Kyrie Rozier attempts a 3Pt. Contested by Luka Sexton (4.0 feet, ZONE). Kyrie Rozier misses. Offensive rebound by Rudy Bridges! Rudy Bridges kicks it out.

[01:29] Team_091 possession (Score: 26-29)
Kyrie Rozier attempts a Layup. Contested by Luka Sexton (4.1 feet, MAN). KYRIE ROZIER MAKES IT! Assist: Rudy Bridges
Score: 26-31

[01:13] Team_084 possession (Score: 26-31)
Klay Thompson attempts a Midrange. Contested by Rudy Bridges (5.0 feet, MAN). Klay Thompson misses. Rebound secured by Kevin Simons.

[01:03] Team_091 possession (Score: 26-31)
Kevin Simons makes the Layup and draws the foul on Dejounte Ginobili! And-1! Kevin Simons to the line for 1. [BONUS: 9 team fouls] (Dejounte Ginobili: 3 personal fouls)   FT 1/1: GOOD Kevin Simons makes 1/1 from the line.
Score: 26-34

[00:51] Team_084 possession (Score: 26-34)
FOUL! Shooting foul on D'Angelo Ingram. Giannis Quickley to the line for 2 free throws. [BONUS: 5 team fouls] (D'Angelo Ingram: 1 personal fouls)   FT 1/2: MISS   FT 2/2: MISS Giannis Quickley makes 0/2 from the line. Rebound secured by Rudy Bridges.

[00:38] Team_091 possession (Score: 26-34)
FOUL! Reach-in foul on Giannis Quickley during the drive. [IN THE BONUS! 10 team fouls] Kevin Simons to the line for 2 free throws. (Giannis Quickley: 4 personal fouls)   FT 1/2: MISS   FT 2/2: MISS Kevin Simons makes 0/2 from the line. Rebound secured by Klay Thompson.

[00:25] Team_084 possession (Score: 26-34)
Dejounte Ginobili attempts a Layup. Contested by Kevin Simons (4.3 feet, ZONE). DEJOUNTE GINOBILI MAKES IT! Assist: Jarrett Booker
Score: 28-34

[00:05] Team_091 possession (Score: 28-34)
Isaiah Siakam attempts a 3Pt. Contested by Luka Sexton (4.4 feet, ZONE). Isaiah Siakam misses. Rebound secured by Dejounte Ginobili.

================================================================================
                              1ST QUARTER COMPLETE                              
================================================================================

1ST QUARTER SCORE: Team_084 28, Team_091 34

BOX SCORE:
================================================================================

Team_084
--------------------------------------------------------------------------------
Player                MIN  PTS  REB  AST  TO      FG   FG%      3P   3P%
--------------------------------------------------------------------------------
Dejounte Ginobili      12    8    3    0   0   4/6    66.7     0/0   0.0
Giannis Quickley       12    8    5    0   0   3/4    75.0     0/0   0.0
Klay Thompson          12    5    2    2   0   2/5    40.0     0/0   0.0
Jarrett Booker         12    4    0    3   0   2/2   100.0     0/0   0.0
Luka Sexton            12    2    0    0   0   1/3    33.3     0/0   0.0

TEAM: FG: 12/20 (60.0%), 3PT: 1/1 (100.0%), REB: 10 (1 off, 9 def), AST: 5, TO: 2
TEAM FOULS: 10 [Team_091 in BONUS]


Team_091
--------------------------------------------------------------------------------
Player                MIN  PTS  REB  AST  TO      FG   FG%      3P   3P%
--------------------------------------------------------------------------------
Kevin Simons           12   10    2    0   0   4/6    66.7     0/0   0.0
Kyrie Rozier           12    7    3    0   0   3/7    42.9     0/0   0.0
Rudy Bridges           12    7    6    5   0   3/4    75.0     0/0   0.0
Isaiah Siakam          12    3    0    0   0   1/3    33.3     0/0   0.0
D'Angelo Ingram        12    2    0    0   0   1/1   100.0     0/0   0.0

TEAM: FG: 12/21 (57.1%), 3PT: 1/3 (33.3%), REB: 11 (4 off, 7 def), AST: 5, TO: 1
TEAM FOULS: 5 [Team_084 in BONUS]

================================================================================

================================================================================
                       2ND QUARTER - Team_084 vs Team_091                       
================================================================================

[12:00] Team_084 possession (Score: 28-34)
Jarrett Booker attempts a Midrange. Contested by D'Angelo Ingram (5.1 feet, MAN). JARRETT BOOKER MAKES IT! Assist: Klay Thompson
Score: 30-34

[11:51] Team_091 possession (Score: 30-34)
Kyrie Rozier attempts a 3Pt. Contested by Dejounte Ginobili (5.0 feet, ZONE). Kyrie Rozier misses. FOUL! Loose ball foul on Dejounte Ginobili during the rebound battle. [Team fouls: 1] No free throws, side out. (Dejounte Ginobili: 1 personal fouls)

[11:37] Team_091 possession (Score: 30-34)
Kyrie Rozier attempts a Layup. Contested by Luka Sexton (4.1 feet, MAN). KYRIE ROZIER MAKES IT! Assist: Isaiah Siakam
Score: 30-36

[11:27] Team_084 possession (Score: 30-36)
Luka Sexton attempts a 3Pt. Contested by Kyrie Rozier (4.6 feet, ZONE). Luka Sexton misses. Rebound secured by Rudy Bridges.

[11:13] Team_091 possession (Score: 30-36)
Isaiah Siakam drives and kicks out. Kyrie Rozier attempts a 3Pt. Contested by Dejounte Ginobili (4.9 feet, ZONE). KYRIE ROZIER MAKES IT! Assist: D'Angelo Ingram
Score: 30-39

[11:00] Team_084 possession (Score: 30-39)
Jarrett Booker attempts a Layup. BLOCKED BY D'ANGELO INGRAM! Ball is loose! Rebound secured by Rudy Bridges.

[10:42] Team_091 possession (Score: 30-39)
Rudy Bridges attempts a 3Pt. Contested by Klay Thompson (5.3 feet, MAN). Rudy Bridges misses. Rebound secured by Klay Thompson.

[10:30] Team_084 possession (Score: 30-39)
Jarrett Booker attempts a 3Pt. Contested by D'Angelo Ingram (5.3 feet, MAN). Jarrett Booker misses. Rebound secured by Kevin Simons.

[10:18] Team_091 possession (Score: 30-39)
Isaiah Siakam attempts a 3Pt. Contested by Luka Sexton (4.4 feet, ZONE). ISAIAH SIAKAM MAKES IT! Assist: Kyrie Rozier
Score: 30-42

[10:00] Team_084 possession (Score: 30-42)
Jarrett Booker attempts a Layup. BLOCKED BY KEVIN SIMONS! Ball deflects out of bounds off Jarrett Booker.

[09:41] Team_091 possession (Score: 30-42)
Isaiah Siakam attempts a 3Pt. Contested by Luka Sexton (4.4 feet, ZONE). Isaiah Siakam misses. Offensive rebound by Rudy Bridges! Rudy Bridges kicks it out.

[09:24] Team_091 possession (Score: 30-42)
Rudy Bridges attempts a 3Pt. Contested by Klay Thompson (5.5 feet, MAN). RUDY BRIDGES MAKES IT! Assist: D'Angelo Ingram
Score: 30-45

[09:10] Team_084 possession (Score: 30-45)
Klay Thompson attempts a Midrange. Contested by Rudy Bridges (5.2 feet, MAN). Klay Thompson misses. Rebound secured by Rudy Bridges.

[08:53] Team_091 possession (Score: 30-45)
Rudy Bridges drives, picks up Klay Thompson. Help arrives from Dejounte Ginobili! Rudy Bridges attempts a Dunk. Contested by Dejounte Ginobili (5.5 feet, MAN). Rudy Bridges misses. Offensive rebound by Kevin Simons! Kevin Simons kicks it out.

[08:41] Team_091 possession (Score: 30-45)
Kyrie Rozier makes the Dunk and draws the foul on Dejounte Ginobili! And-1! Kyrie Rozier to the line for 1. [Team fouls: 2] (Dejounte Ginobili: 2 personal fouls)   FT 1/1: MISS Kyrie Rozier makes 0/1 from the line. Rebound secured by Klay Thompson.
Score: 30-47

[08:22] Team_084 possession (Score: 30-47)
Dejounte Ginobili attempts a Layup. Contested by Kevin Simons (4.6 feet, ZONE). Dejounte Ginobili misses. Offensive rebound by Dejounte Ginobili! Dejounte Ginobili kicks it out.

[08:05] Team_084 possession (Score: 30-47)
Giannis Quickley attempts a Layup. Contested by Kevin Simons (4.6 feet, MAN). Giannis Quickley misses. Rebound secured by Rudy Bridges.

[07:50] Team_091 possession (Score: 30-47)
D'Angelo Ingram attempts a 3Pt. Wide open! Jarrett Booker is 6.2 feet away. [MAN] D'ANGELO INGRAM MAKES IT! Assist: Rudy Bridges
Score: 30-50

[07:32] Team_084 possession (Score: 30-50)
Klay Thompson attempts a Midrange. Contested by Rudy Bridges (5.4 feet, MAN). Klay Thompson misses. Rebound secured by Kevin Simons.

[07:17] Team_091 possession (Score: 30-50)
D'Angelo Ingram attempts a Midrange. Wide open! Dejounte Ginobili is 6.1 feet away. [ZONE] D'Angelo Ingram misses. Offensive rebound by Kevin Simons! Kevin Simons kicks it out.

[07:05] Team_091 possession (Score: 30-50)
FOUL! Holding foul on Klay Thompson. [Team fouls: 3] No free throws, side out. (Klay Thompson: 1 personal fouls)

[06:49] Team_091 possession (Score: 30-50)
Rudy Bridges attempts a 3Pt. Contested by Luka Sexton (4.6 feet, ZONE). Rudy Bridges misses. Rebound secured by Klay Thompson.

[06:36] Team_084 possession (Score: 30-50)
Jarrett Booker attempts a 3Pt. Contested by D'Angelo Ingram (5.7 feet, MAN). Jarrett Booker misses. Rebound secured by Rudy Bridges.

[06:23] Team_091 possession (Score: 30-50)
D'Angelo Ingram drives, Giannis Quickley stays with him. D'Angelo Ingram attempts a Layup. Wide open! Giannis Quickley is 6.2 feet away. [ZONE] D'ANGELO INGRAM MAKES IT! Assist: Kevin Simons
Score: 30-52

[06:08] Team_084 possession (Score: 30-52)
Giannis Quickley makes the Midrange and draws the foul on Kevin Simons! And-1! Giannis Quickley to the line for 1. [Team fouls: 1] (Kevin Simons: 1 personal fouls)   FT 1/1: MISS Giannis Quickley makes 0/1 from the line. Offensive rebound by Dejounte Ginobili! Dejounte Ginobili kicks it out.
Score: 32-52

[05:55] Team_084 possession (Score: 32-52)
Luka Sexton drives, Kyrie Rozier stays with him. Luka Sexton attempts a Layup. Contested by Kyrie Rozier (5.2 feet, MAN). LUKA SEXTON MAKES IT! Assist: Giannis Quickley
Score: 34-52

[05:39] Team_091 possession (Score: 34-52)
Isaiah Siakam attempts a 3Pt. Contested by Luka Sexton (4.9 feet, ZONE). Isaiah Siakam misses. Offensive rebound by Rudy Bridges! Rudy Bridges kicks it out.

[05:21] Team_091 possession (Score: 34-52)
Isaiah Siakam attempts a Layup. BLOCKED BY DEJOUNTE GINOBILI! Ball is loose! Rebound secured by Dejounte Ginobili.

[05:05] Team_084 possession (Score: 34-52)
Luka Sexton attempts a 3Pt. Contested by Kyrie Rozier (5.3 feet, MAN). Luka Sexton misses. Offensive rebound by Dejounte Ginobili! Dejounte Ginobili kicks it out.

[04:49] Team_084 possession (Score: 34-52)
Dejounte Ginobili attempts a 3Pt. Wide open! Isaiah Siakam is 6.9 feet away. [MAN] Dejounte Ginobili misses. Rebound secured by Rudy Bridges.

[04:33] Team_091 possession (Score: 34-52)
Kyrie Rozier attempts a 3Pt. Contested by Luka Sexton (4.9 feet, ZONE). KYRIE ROZIER MAKES IT! Assist: Isaiah Siakam
Score: 34-55

[04:20] Team_084 possession (Score: 34-55)
Luka Sexton attempts a 3Pt. Wide open! D'Angelo Ingram is 6.0 feet away. [ZONE] Luka Sexton misses. Rebound secured by Kevin Simons.

[04:07] Team_091 possession (Score: 34-55)
Kyrie Rozier attempts a 3Pt. Contested by Luka Sexton (5.0 feet, ZONE). Kyrie Rozier misses. Rebound secured by Dejounte Ginobili.

[03:57] Team_084 possession (Score: 34-55)
Klay Thompson attempts a 3Pt. Contested by Rudy Bridges (5.8 feet, MAN). Klay Thompson misses. Rebound secured by Kyrie Rozier.

[03:44] Team_091 possession (Score: 34-55)
D'Angelo Ingram makes the Midrange and draws the foul on Luka Sexton! And-1! D'Angelo Ingram to the line for 1. [Team fouls: 4] (Luka Sexton: 1 personal fouls)   FT 1/1: GOOD D'Angelo Ingram makes 1/1 from the line.
Score: 34-58

[03:31] Team_084 possession (Score: 34-58)
Giannis Quickley attempts a Midrange. Contested by Kevin Simons (5.3 feet, MAN). Giannis Quickley misses. Rebound secured by Kyrie Rozier.

[03:18] Team_091 possession (Score: 34-58)
Kyrie Rozier drives to the basket... FOUL! Offensive foul on Kyrie Rozier! Luka Sexton drew the charge! [Team fouls: 2] (Kyrie Rozier: 1 personal fouls) TURNOVER! (dead ball)

[03:08] Team_084 possession (Score: 34-58)
Giannis Quickley attempts a 3Pt. Contested by Kyrie Rozier (5.5 feet, ZONE). Giannis Quickley misses. Rebound secured by Kyrie Rozier.

[02:55] Team_091 possession (Score: 34-58)
Rudy Bridges attempts a 3Pt. Contested by Luka Sexton (5.1 feet, ZONE). Rudy Bridges misses. Rebound secured by Klay Thompson.

[02:39] Team_084 possession (Score: 34-58)
Dejounte Ginobili attempts a 3Pt. Contested by Rudy Bridges (5.8 feet, ZONE). Dejounte Ginobili misses. Rebound secured by Rudy Bridges.

[02:23] Team_091 possession (Score: 34-58)
Rudy Bridges drives to the basket... Rudy Bridges throws a bad pass out of bounds! TURNOVER! (dead ball)

[02:23] Substitution (Team_084): Luka Sexton OUT → Magic Bryant IN (stamina_rule2)

[02:23] Substitution (Team_084): Dejounte Ginobili OUT → Chris Parker IN (stamina_rule2)

[02:23] Substitution (Team_084): Klay Thompson OUT → Evan Quickley IN (stamina_rule2)

[02:23] Substitution (Team_084): Jarrett Booker OUT → Pascal Jackson IN (stamina_rule2)

[02:23] Substitution (Team_084): Giannis Quickley OUT → Dejounte Porzingis IN (stamina_rule2)

[02:23] Substitution (Team_091): Kyrie Rozier OUT → Karl Morant IN (stamina_rule2)

[02:23] Substitution (Team_091): Isaiah Siakam OUT → Julius Barnes IN (stamina_rule2)

[02:23] Substitution (Team_091): Rudy Bridges OUT → Tim Antetokounmpo IN (stamina_rule2)

[02:23] Substitution (Team_091): D'Angelo Ingram OUT → Zion Mitchell IN (stamina_rule2)

[02:23] Substitution (Team_091): Kevin Simons OUT → Ja George IN (stamina_rule2)

[02:10] Team_084 possession (Score: 34-58)
Chris Parker drives, Julius Barnes stays with him. Chris Parker attempts a Layup. Contested by Julius Barnes (5.1 feet, MAN). Chris Parker misses. Rebound secured by Ja George.

[01:58] Team_091 possession (Score: 34-58)
FOUL! Reach-in foul on Dejounte Porzingis during the drive. [IN THE BONUS! 5 team fouls] Ja George to the line for 2 free throws. (Dejounte Porzingis: 1 personal fouls)   FT 1/2: GOOD   FT 2/2: MISS Ja George makes 1/2 from the line. FOUL! Loose ball foul on Dejounte Porzingis during the free throw rebound! [IN THE BONUS! 6 team fouls] Ja George to the line for 2 free throws. (Dejounte Porzingis: 2 personal fouls)   FT 1/2: GOOD   FT 2/2: GOOD Ja George makes 2/2 from the line.
Score: 34-61

[01:46] Team_084 possession (Score: 34-61)
Magic Bryant attempts a Midrange. Contested by Karl Morant (4.9 feet, MAN). MAGIC BRYANT MAKES IT! Assist: Evan Quickley
Score: 36-61

[01:31] Team_091 possession (Score: 36-61)
Tim Antetokounmpo drives to the basket... Tim Antetokounmpo throws a bad pass! Stolen by Evan Quickley! TURNOVER! (live ball)

[01:17] Team_084 possession (Score: 36-61)
Evan Quickley drives and kicks out. Pascal Jackson attempts a 3Pt. Contested by Zion Mitchell (4.9 feet, ZONE). PASCAL JACKSON MAKES IT! Assist: Magic Bryant
Score: 39-61

[01:05] Team_091 possession (Score: 39-61)
Zion Mitchell drives and kicks out. Karl Morant attempts a Midrange. Contested by Pascal Jackson (4.7 feet, ZONE). Karl Morant misses. Rebound secured by Evan Quickley.

[00:49] Team_084 possession (Score: 39-61)
Dejounte Porzingis drives and kicks out. Magic Bryant attempts a 3Pt. Contested by Karl Morant (4.9 feet, ZONE). Magic Bryant misses. Rebound secured by Tim Antetokounmpo.

[00:36] Team_091 possession (Score: 39-61)
Julius Barnes attempts a Layup. Contested by Pascal Jackson (4.7 feet, ZONE). JULIUS BARNES MAKES IT! Assist: Karl Morant
Score: 39-63

[00:24] Team_084 possession (Score: 39-63)
Evan Quickley attempts a Layup. Contested by Tim Antetokounmpo (5.3 feet, MAN). Evan Quickley misses. Rebound secured by Zion Mitchell.

[00:07] Team_091 possession (Score: 39-63)
Ja George attempts a Midrange. Contested by Dejounte Porzingis (5.1 feet, MAN). Ja George misses. Rebound secured by Dejounte Porzingis.

================================================================================
                              2ND QUARTER COMPLETE                              
================================================================================

2ND QUARTER SCORE: Team_084 11, Team_091 29

BOX SCORE:
================================================================================

Team_084
--------------------------------------------------------------------------------
Player                MIN  PTS  REB  AST  TO      FG   FG%      3P   3P%
--------------------------------------------------------------------------------
Pascal Jackson          2    3    0    0   0   1/1   100.0     0/0   0.0
Jarrett Booker         22    2    0    0   0   1/5    20.0     0/0   0.0
Luka Sexton            22    2    0    0   0   1/3    33.3     0/0   0.0
Magic Bryant            2    2    0    1   0   1/1   100.0     0/0   0.0
Klay Thompson          22    0    4    1   0   0/3     0.0     0/0   0.0
Dejounte Ginobili      22    0    5    0   0   0/2     0.0     0/0   0.0
Giannis Quickley       22    0    0    1   0   0/3     0.0     0/0   0.0
Chris Parker            2    0    0    0   0   0/1     0.0     0/0   0.0
Evan Quickley           2    0    1    1   0   0/1     0.0     0/0   0.0
Dejounte Porzingis      2    0    1    0   0   0/1     0.0     0/0   0.0

TEAM: FG: 4/21 (19.0%), 3PT: 0/8 (0.0%), REB: 11 (3 off, 8 def), AST: 4, TO: 0
TEAM FOULS: 6 [Team_091 in BONUS]


Team_091
--------------------------------------------------------------------------------
Player                MIN  PTS  REB  AST  TO      FG   FG%      3P   3P%
--------------------------------------------------------------------------------
Kyrie Rozier           22    8    3    1   0   3/5    60.0     0/0   0.0
D'Angelo Ingram        22    8    0    2   0   3/3   100.0     0/0   0.0
Rudy Bridges           22    3   10    1   0   1/4    25.0     0/0   0.0
Isaiah Siakam          22    3    0    2   0   1/2    50.0     0/0   0.0
Ja George               2    3    1    0   0   1/2    50.0     0/0   0.0
Julius Barnes           2    2    0    0   0   1/1   100.0     0/0   0.0
Kevin Simons           22    0    5    1   0   0/0     0.0     0/0   0.0
Zion Mitchell           2    0    1    0   0   0/1     0.0     0/0   0.0
Tim Antetokounmpo       2    0    1    0   0   0/0     0.0     0/0   0.0
Karl Morant             2    0    0    1   0   0/0     0.0     0/0   0.0

TEAM: FG: 10/18 (55.6%), 3PT: 4/8 (50.0%), REB: 21 (5 off, 16 def), AST: 8, TO: 3
TEAM FOULS: 2

================================================================================

================================================================================
                       3RD QUARTER - Team_084 vs Team_091                       
================================================================================

[12:00] Team_084 possession (Score: 39-63)
Luka Sexton attempts a 3Pt. Contested by Kyrie Rozier (4.4 feet, MAN). Luka Sexton misses. Offensive rebound by Giannis Quickley! Giannis Quickley's putback is no good. Rebound secured by Rudy Bridges.

[11:46] Team_091 possession (Score: 39-63)
D'Angelo Ingram attempts a Layup. Contested by Jarrett Booker (5.5 feet, MAN). D'ANGELO INGRAM MAKES IT! Assist: Kevin Simons
Score: 39-65

[11:32] Team_084 possession (Score: 39-65)
Jarrett Booker attempts a 3Pt. Contested by Kyrie Rozier (4.3 feet, ZONE). Jarrett Booker misses. Offensive rebound by Giannis Quickley! Giannis Quickley's putback is no good. Rebound secured by Rudy Bridges.

[11:15] Team_091 possession (Score: 39-65)
Isaiah Siakam attempts a Midrange. Contested by Dejounte Ginobili (4.9 feet, MAN). Isaiah Siakam misses. Rebound secured by Klay Thompson.

[10:59] Team_084 possession (Score: 39-65)
FOUL! Holding foul on Kevin Simons. [Team fouls: 1] No free throws, side out. (Kevin Simons: 1 personal fouls)

[10:45] Team_084 possession (Score: 39-65)
Klay Thompson attempts a 3Pt. Contested by Kyrie Rozier (4.6 feet, ZONE). Klay Thompson misses. Rebound secured by Kevin Simons.

[10:33] Team_091 possession (Score: 39-65)
Kevin Simons attempts a Layup. Contested by Giannis Quickley (4.8 feet, MAN). KEVIN SIMONS MAKES IT! Assist: D'Angelo Ingram
Score: 39-67

[10:19] Team_084 possession (Score: 39-67)
Giannis Quickley makes the Layup and draws the foul on Kevin Simons! And-1! Giannis Quickley to the line for 1. [Team fouls: 2] (Kevin Simons: 2 personal fouls)   FT 1/1: GOOD Giannis Quickley makes 1/1 from the line.
Score: 42-67

[10:05] Team_091 possession (Score: 42-67)
Rudy Bridges drives and kicks out. FOUL! Shooting foul on Dejounte Ginobili. Isaiah Siakam to the line for 2 free throws. [Team fouls: 1] (Dejounte Ginobili: 1 personal fouls)   FT 1/2: GOOD   FT 2/2: GOOD Isaiah Siakam makes 2/2 from the line.
Score: 42-69

[09:50] Team_084 possession (Score: 42-69)
Giannis Quickley drives, picks up Kevin Simons. Help arrives from Kyrie Rozier! Giannis Quickley attempts a Dunk. Contested by Kyrie Rozier (3.8 feet, MAN). GIANNIS QUICKLEY MAKES IT! Assist: Klay Thompson
Score: 44-69

[09:34] Team_091 possession (Score: 44-69)
Isaiah Siakam attempts a 3Pt. Contested by Klay Thompson (5.1 feet, ZONE). Isaiah Siakam misses. Rebound secured by Dejounte Ginobili.

[09:17] Team_084 possession (Score: 44-69)
Giannis Quickley attempts a Layup. Contested by Kevin Simons (3.8 feet, ZONE). GIANNIS QUICKLEY MAKES IT! Assist: Klay Thompson
Score: 46-69

[09:03] Team_091 possession (Score: 46-69)
Kyrie Rozier attempts a 3Pt. Contested by Luka Sexton (3.8 feet, MAN). KYRIE ROZIER MAKES IT! Assist: D'Angelo Ingram
Score: 46-72

[08:46] Team_084 possession (Score: 46-72)
Luka Sexton attempts a 3Pt. Contested by Kyrie Rozier (4.4 feet, MAN). LUKA SEXTON MAKES IT! Assist: Klay Thompson
Score: 49-72

[08:30] Team_091 possession (Score: 49-72)
Kyrie Rozier attempts a 3Pt. Contested by Luka Sexton (3.8 feet, MAN). Kyrie Rozier misses. Rebound secured by Giannis Quickley.

[08:15] Team_084 possession (Score: 49-72)
Dejounte Ginobili drives to the basket... FOUL! Offensive foul on Dejounte Ginobili! Isaiah Siakam drew the charge! [Team fouls: 2] (Dejounte Ginobili: 2 personal fouls) TURNOVER! (dead ball)

[08:01] Team_091 possession (Score: 49-72)
Isaiah Siakam attempts a 3Pt. Contested by Jarrett Booker (4.9 feet, ZONE). Isaiah Siakam misses. Rebound secured by Dejounte Ginobili.

[07:45] Team_084 possession (Score: 49-72)
Giannis Quickley attempts a Dunk. BLOCKED BY KEVIN SIMONS! Ball deflects out of bounds off Giannis Quickley.

[07:29] Team_091 possession (Score: 49-72)
Isaiah Siakam attempts a Layup. Contested by Giannis Quickley (4.7 feet, ZONE). ISAIAH SIAKAM MAKES IT! Assist: Kyrie Rozier
Score: 49-74

[07:12] Team_084 possession (Score: 49-74)
Klay Thompson attempts a Layup. BLOCKED BY KEVIN SIMONS! Ball is loose! Rebound secured by Kyrie Rozier.

[07:00] Team_091 possession (Score: 49-74)
Kyrie Rozier attempts a 3Pt. Contested by Luka Sexton (3.8 feet, ZONE). Kyrie Rozier misses. Rebound secured by Klay Thompson.

[06:46] Team_084 possession (Score: 49-74)
FOUL! Shooting foul on Kyrie Rozier. Giannis Quickley to the line for 2 free throws. [Team fouls: 3] (Kyrie Rozier: 1 personal fouls)   FT 1/2: GOOD   FT 2/2: GOOD Giannis Quickley makes 2/2 from the line.
Score: 51-74

[06:32] Team_091 possession (Score: 51-74)
Isaiah Siakam drives and kicks out. Rudy Bridges attempts a 3Pt. Contested by Luka Sexton (3.6 feet, ZONE). Rudy Bridges misses. Offensive rebound by Rudy Bridges! Rudy Bridges kicks it out.

[06:17] Team_091 possession (Score: 51-74)
D'Angelo Ingram makes the Layup and draws the foul on Giannis Quickley! And-1! D'Angelo Ingram to the line for 1. [Team fouls: 3] (Giannis Quickley: 1 personal fouls)   FT 1/1: GOOD D'Angelo Ingram makes 1/1 from the line.
Score: 51-77

[06:06] Team_084 possession (Score: 51-77)
Dejounte Ginobili attempts a Layup. Contested by Isaiah Siakam (5.9 feet, MAN). DEJOUNTE GINOBILI MAKES IT! Assist: Jarrett Booker
Score: 53-77

[05:53] Team_091 possession (Score: 53-77)
Kyrie Rozier throws a bad pass out of bounds! TURNOVER! (dead ball)

[05:44] Team_084 possession (Score: 53-77)
Jarrett Booker attempts a Midrange. Contested by Isaiah Siakam (5.9 feet, ZONE). JARRETT BOOKER MAKES IT! Assist: Giannis Quickley
Score: 55-77

[05:31] Team_091 possession (Score: 55-77)
Kyrie Rozier drives and kicks out. D'Angelo Ingram attempts a 3Pt. Contested by Jarrett Booker (4.6 feet, MAN). D'Angelo Ingram misses. Rebound secured by Giannis Quickley.

[05:13] Team_084 possession (Score: 55-77)
FOUL! Shooting foul on Kevin Simons. Giannis Quickley to the line for 2 free throws. [Team fouls: 4] (Kevin Simons: 3 personal fouls)   FT 1/2: MISS   FT 2/2: GOOD Giannis Quickley makes 1/2 from the line.
Score: 56-77

[04:58] Team_091 possession (Score: 56-77)
Rudy Bridges attempts a 3Pt. Contested by Klay Thompson (4.9 feet, MAN). RUDY BRIDGES MAKES IT! Assist: Kyrie Rozier
Score: 56-80

[04:44] Team_084 possession (Score: 56-80)
Giannis Quickley attempts a Layup. Contested by Kevin Simons (3.9 feet, MAN). GIANNIS QUICKLEY MAKES IT!
Score: 58-80

[04:31] Team_091 possession (Score: 58-80)
FOUL! Reach-in foul on Giannis Quickley during the drive. [Team fouls: 4] No free throws, side out. (Giannis Quickley: 2 personal fouls)

[04:15] Team_091 possession (Score: 58-80)
Kyrie Rozier attempts a Midrange. Contested by Luka Sexton (3.8 feet, MAN). Kyrie Rozier misses. Rebound secured by Giannis Quickley.

[04:00] Team_084 possession (Score: 58-80)
Klay Thompson drives, picks up Kevin Simons. Help arrives from Kyrie Rozier! Klay Thompson attempts a Dunk. Contested by Kyrie Rozier (4.2 feet, ZONE). KLAY THOMPSON MAKES IT! Assist: Dejounte Ginobili
Score: 60-80

[03:41] Team_091 possession (Score: 60-80)
Isaiah Siakam attempts a 3Pt. Contested by Dejounte Ginobili (5.0 feet, MAN). Isaiah Siakam misses. Rebound secured by Dejounte Ginobili.

[03:31] Team_084 possession (Score: 60-80)
Giannis Quickley attempts a Midrange. Contested by Kevin Simons (4.0 feet, MAN). GIANNIS QUICKLEY MAKES IT!
Score: 62-80

[03:18] Team_091 possession (Score: 62-80)
Kyrie Rozier attempts a Midrange. Contested by Luka Sexton (3.9 feet, MAN). Kyrie Rozier misses. Offensive rebound by Rudy Bridges! Rudy Bridges kicks it out.

[03:04] Team_091 possession (Score: 62-80)
Kevin Simons drives and kicks out. Kyrie Rozier attempts a Midrange. Contested by Jarrett Booker (4.8 feet, ZONE). KYRIE ROZIER MAKES IT! Assist: Isaiah Siakam
Score: 62-82

[02:54] Team_084 possession (Score: 62-82)
Dejounte Ginobili attempts a 3Pt. Wide open! Isaiah Siakam is 6.1 feet away. [MAN] Dejounte Ginobili misses. Rebound secured by Kyrie Rozier.

[02:41] Team_091 possession (Score: 62-82)
Rudy Bridges attempts a 3Pt. Contested by Klay Thompson (5.1 feet, MAN). RUDY BRIDGES MAKES IT! Assist: D'Angelo Ingram
Score: 62-85

[02:31] Team_084 possession (Score: 62-85)
Giannis Quickley drives, picks up Kevin Simons. Help arrives from Kyrie Rozier! Giannis Quickley attempts a Layup. Contested by Kyrie Rozier (4.1 feet, ZONE). GIANNIS QUICKLEY MAKES IT! Assist: Klay Thompson
Score: 64-85

[02:16] Team_091 possession (Score: 64-85)
Rudy Bridges attempts a 3Pt. Contested by Luka Sexton (4.0 feet, ZONE). Rudy Bridges misses. Offensive rebound by Kevin Simons! Kevin Simons puts it back in!
Score: 64-87

[02:00] Team_084 possession (Score: 64-87)
Luka Sexton attempts a Layup. Contested by Kevin Simons (4.2 feet, ZONE). Luka Sexton misses. Rebound secured by Kyrie Rozier.

[01:45] Team_091 possession (Score: 64-87)
Rudy Bridges commits a violation (traveling/carry)! TURNOVER! (dead ball)

[01:45] Substitution (Team_084): Luka Sexton OUT → Magic Bryant IN (stamina_rule2)

[01:45] Substitution (Team_084): Dejounte Ginobili OUT → Chris Parker IN (stamina_rule2)

[01:45] Substitution (Team_084): Klay Thompson OUT → Evan Quickley IN (stamina_rule2)

[01:45] Substitution (Team_084): Jarrett Booker OUT → Pascal Jackson IN (stamina_rule2)

[01:45] Substitution (Team_084): Giannis Quickley OUT → Dejounte Porzingis IN (stamina_rule2)

[01:45] Substitution (Team_091): Kyrie Rozier OUT → Karl Morant IN (stamina_rule2)

[01:45] Substitution (Team_091): Isaiah Siakam OUT → Julius Barnes IN (stamina_rule2)

[01:45] Substitution (Team_091): Rudy Bridges OUT → Tim Antetokounmpo IN (stamina_rule2)

[01:45] Substitution (Team_091): D'Angelo Ingram OUT → Zion Mitchell IN (stamina_rule2)

[01:45] Substitution (Team_091): Kevin Simons OUT → Ja George IN (stamina_rule2)

[01:35] Team_084 possession (Score: 64-87)
Dejounte Porzingis attempts a Layup. Contested by Zion Mitchell (5.0 feet, ZONE). DEJOUNTE PORZINGIS MAKES IT! Assist: Magic Bryant
Score: 66-87

[01:19] Team_091 possession (Score: 66-87)
Ja George attempts a Midrange. Contested by Dejounte Porzingis (5.1 feet, MAN). Ja George misses. Rebound secured by Pascal Jackson.

[01:05] Team_084 possession (Score: 66-87)
Chris Parker attempts a 3Pt. Contested by Julius Barnes (5.1 feet, MAN). CHRIS PARKER MAKES IT! Assist: Evan Quickley
Score: 69-87

[00:51] Team_091 possession (Score: 69-87)
Ja George attempts a 3Pt. Contested by Dejounte Porzingis (5.1 feet, MAN). Ja George misses. Rebound secured by Dejounte Porzingis.

[00:37] Team_084 possession (Score: 69-87)
Dejounte Porzingis attempts a Midrange. Contested by Zion Mitchell (5.0 feet, ZONE). Dejounte Porzingis misses. Rebound secured by Zion Mitchell.

[00:23] Team_091 possession (Score: 69-87)
Karl Morant drives, Magic Bryant stays with him. Karl Morant attempts a Dunk. Contested by Magic Bryant (4.0 feet, MAN). KARL MORANT MAKES IT! Assist: Ja George
Score: 69-89

[00:07] Team_084 possession (Score: 69-89)
Dejounte Porzingis attempts a Midrange. Contested by Ja George (4.8 feet, MAN). Dejounte Porzingis misses. Rebound secured by Ja George.

================================================================================
                              3RD QUARTER COMPLETE                              
================================================================================

3RD QUARTER SCORE: Team_084 30, Team_091 26

BOX SCORE:
================================================================================

Team_084
--------------------------------------------------------------------------------
Player                MIN  PTS  REB  AST  TO      FG   FG%      3P   3P%
--------------------------------------------------------------------------------
Giannis Quickley       32   16    3    1   0   8/9    88.9     0/0   0.0
Luka Sexton            32    3    0    0   0   1/3    33.3     0/0   0.0
Chris Parker            4    3    0    0   0   1/1   100.0     0/0   0.0
Jarrett Booker         32    2    0    1   0   1/2    50.0     0/0   0.0
Klay Thompson          32    2    2    4   0   1/3    33.3     0/0   0.0
Dejounte Ginobili      32    2    3    1   0   1/2    50.0     0/0   0.0
Dejounte Porzingis      4    2    1    0   0   1/3    33.3     0/0   0.0
Magic Bryant            4    0    0    1   0   0/0     0.0     0/0   0.0
Pascal Jackson          4    0    1    0   0   0/0     0.0     0/0   0.0
Evan Quickley           4    0    0    1   0   0/0     0.0     0/0   0.0

TEAM: FG: 14/23 (60.9%), 3PT: 2/6 (33.3%), REB: 12 (2 off, 10 def), AST: 9, TO: 1
TEAM FOULS: 4


Team_091
--------------------------------------------------------------------------------
Player                MIN  PTS  REB  AST  TO      FG   FG%      3P   3P%
--------------------------------------------------------------------------------
Rudy Bridges           32    6    4    0   0   2/2   100.0     0/0   0.0
D'Angelo Ingram        32    5    0    3   0   2/2   100.0     0/0   0.0
Kyrie Rozier           32    5    3    2   0   2/6    33.3     0/0   0.0
Kevin Simons           32    4    2    1   0   2/2   100.0     0/0   0.0
Isaiah Siakam          32    4    0    1   0   2/6    33.3     0/0   0.0
Karl Morant             4    2    0    0   0   1/1   100.0     0/0   0.0
Ja George               4    0    1    1   0   0/2     0.0     0/0   0.0
Zion Mitchell           4    0    1    0   0   0/0     0.0     0/0   0.0

TEAM: FG: 11/21 (52.4%), 3PT: 4/10 (40.0%), REB: 9 (3 off, 6 def), AST: 8, TO: 2
TEAM FOULS: 4

================================================================================

================================================================================
                       4TH QUARTER - Team_084 vs Team_091                       
================================================================================

[12:00] Substitution (Team_084): Luka Sexton OUT (stamina: 78) → Magic Bryant IN (comeback_detected)

[12:00] Substitution (Team_091): Kyrie Rozier OUT (stamina: 78) → Karl Morant IN (comeback_detected)

[12:00] Team_084 possession (Score: 69-89)
Jarrett Booker drives and kicks out. Magic Bryant attempts a 3Pt. Contested by Karl Morant (4.9 feet, MAN). Magic Bryant misses. Rebound secured by Rudy Bridges.

[11:44] Team_091 possession (Score: 69-89)
Rudy Bridges attempts a Layup. Contested by Giannis Quickley (4.6 feet, ZONE). RUDY BRIDGES MAKES IT! Assist: D'Angelo Ingram
Score: 69-91

[11:29] Team_084 possession (Score: 69-91)
Magic Bryant attempts a Midrange. Contested by Rudy Bridges (4.4 feet, ZONE). Magic Bryant misses. Rebound secured by Kevin Simons.

[11:13] Team_091 possession (Score: 69-91)
Kevin Simons attempts a Midrange. Contested by Giannis Quickley (5.0 feet, MAN). Kevin Simons misses. Rebound secured by Dejounte Ginobili.

[10:57] Team_084 possession (Score: 69-91)
Giannis Quickley drives to the basket... FOUL! Offensive foul on Giannis Quickley! Kevin Simons drew the charge! [Team fouls: 1] (Giannis Quickley: 1 personal fouls) TURNOVER! (dead ball)

[10:44] Team_091 possession (Score: 69-91)
Karl Morant attempts a Midrange. Contested by Magic Bryant (4.0 feet, MAN). Karl Morant misses. Offensive rebound by Kevin Simons! Kevin Simons puts it back in!
Score: 69-93

[10:28] Team_084 possession (Score: 69-93)
Magic Bryant attempts a Midrange. Contested by Karl Morant (4.9 feet, MAN). Magic Bryant misses. Rebound secured by D'Angelo Ingram.

[10:13] Team_091 possession (Score: 69-93)
Rudy Bridges attempts a 3Pt. Contested by Magic Bryant (3.7 feet, ZONE). Rudy Bridges misses. Rebound secured by Giannis Quickley.

[09:59] Team_084 possession (Score: 69-93)
FOUL! Shooting foul on Kevin Simons. Jarrett Booker to the line for 2 free throws. [Team fouls: 1] (Kevin Simons: 1 personal fouls)   FT 1/2: GOOD   FT 2/2: GOOD Jarrett Booker makes 2/2 from the line.
Score: 71-93

[09:43] Team_091 possession (Score: 71-93)
D'Angelo Ingram attempts a Midrange. Wide open! Klay Thompson is 6.0 feet away. [ZONE] D'Angelo Ingram misses. Rebound secured by Giannis Quickley.

[09:28] Team_084 possession (Score: 71-93)
Klay Thompson attempts a 3Pt. Contested by Karl Morant (5.3 feet, ZONE). KLAY THOMPSON MAKES IT! Assist: Jarrett Booker
Score: 74-93

[09:17] Team_091 possession (Score: 74-93)
Rudy Bridges attempts a 3Pt. Contested by Klay Thompson (5.2 feet, MAN). Rudy Bridges misses. Rebound secured by Giannis Quickley.

[09:03] Team_084 possession (Score: 74-93)
Giannis Quickley makes the Layup and draws the foul on Kevin Simons! And-1! Giannis Quickley to the line for 1. [Team fouls: 2] (Kevin Simons: 2 personal fouls)   FT 1/1: MISS Giannis Quickley makes 0/1 from the line. FOUL! Loose ball foul on Kevin Simons during the free throw rebound! [Team fouls: 3] No free throws, side out. (Kevin Simons: 3 personal fouls)
Score: 76-93

[08:50] Team_084 possession (Score: 76-93)
Dejounte Ginobili attempts a Midrange. Wide open! Isaiah Siakam is 6.2 feet away. [ZONE] Dejounte Ginobili misses. Offensive rebound by Giannis Quickley! Giannis Quickley puts it back in!
Score: 78-93

[08:35] Team_091 possession (Score: 78-93)
Karl Morant attempts a Midrange. Contested by Magic Bryant (4.0 feet, MAN). Karl Morant misses. FOUL! Loose ball foul on Dejounte Ginobili during the rebound battle. [Team fouls: 2] No free throws, side out. (Dejounte Ginobili: 1 personal fouls)

[08:18] Team_091 possession (Score: 78-93)
Isaiah Siakam drives, Dejounte Ginobili stays with him. Isaiah Siakam attempts a Layup. Contested by Dejounte Ginobili (5.2 feet, MAN). Isaiah Siakam misses. Rebound secured by Giannis Quickley.

[08:04] Team_084 possession (Score: 78-93)
Giannis Quickley attempts a Layup. Contested by Kevin Simons (4.3 feet, MAN). GIANNIS QUICKLEY MAKES IT! Assist: Magic Bryant
Score: 80-93

[07:44] Team_091 possession (Score: 80-93)
Kevin Simons attempts a Midrange. Contested by Giannis Quickley (5.3 feet, MAN). Kevin Simons misses. Rebound secured by Dejounte Ginobili.

[07:30] Team_084 possession (Score: 80-93)
Klay Thompson attempts a 3Pt. Contested by Rudy Bridges (5.2 feet, MAN). Klay Thompson misses. Rebound secured by D'Angelo Ingram.

[07:20] Team_091 possession (Score: 80-93)
Karl Morant attempts a Midrange. BLOCKED BY MAGIC BRYANT! Ball is loose! Rebound secured by Dejounte Ginobili.

[07:05] Team_084 possession (Score: 80-93)
Magic Bryant attempts a 3Pt. Wide open! Isaiah Siakam is 6.3 feet away. [ZONE] Magic Bryant misses. Rebound secured by D'Angelo Ingram.

[06:51] Team_091 possession (Score: 80-93)
D'Angelo Ingram attempts a Midrange. Wide open! Jarrett Booker is 6.0 feet away. [MAN] D'ANGELO INGRAM MAKES IT!
Score: 80-95

[06:41] Team_084 possession (Score: 80-95)
Giannis Quickley drives, picks up Kevin Simons. Help arrives from Karl Morant! Giannis Quickley attempts a Layup. Contested by Karl Morant (4.5 feet, ZONE). GIANNIS QUICKLEY MAKES IT! Assist: Magic Bryant
Score: 82-95

[06:31] Team_091 possession (Score: 82-95)
FOUL! Shooting foul on Giannis Quickley. Kevin Simons to the line for 2 free throws. [Team fouls: 3] (Giannis Quickley: 2 personal fouls)   FT 1/2: GOOD   FT 2/2: GOOD Kevin Simons makes 2/2 from the line.
Score: 82-97

[06:19] Team_084 possession (Score: 82-97)
Magic Bryant attempts a 3Pt. Contested by Karl Morant (4.9 feet, MAN). Magic Bryant misses. Rebound secured by Kevin Simons.

[06:05] Team_091 possession (Score: 82-97)
Rudy Bridges attempts a 3Pt. Contested by Klay Thompson (5.6 feet, MAN). RUDY BRIDGES MAKES IT! Assist: Kevin Simons
Score: 82-100

[05:51] Team_084 possession (Score: 82-100)
Magic Bryant attempts a 3Pt. Contested by Karl Morant (4.9 feet, ZONE). Magic Bryant misses. FOUL! Loose ball foul on Rudy Bridges during the rebound battle. [Team fouls: 4] No free throws, side out. (Rudy Bridges: 1 personal fouls)

[05:37] Team_084 possession (Score: 82-100)
FOUL! Holding foul on D'Angelo Ingram. [IN THE BONUS! 5 team fouls] Jarrett Booker to the line for 2 free throws. (D'Angelo Ingram: 1 personal fouls)   FT 1/2: GOOD   FT 2/2: GOOD Jarrett Booker makes 2/2 from the line.
Score: 84-100

[05:23] Team_091 possession (Score: 84-100)
Rudy Bridges loses the ball! Stripped by Klay Thompson! TURNOVER! (live ball)

[05:09] Team_084 possession (Score: 84-100)
Magic Bryant makes the Midrange and draws the foul on Rudy Bridges! And-1! Magic Bryant to the line for 1. [BONUS: 6 team fouls] (Rudy Bridges: 2 personal fouls)   FT 1/1: GOOD Magic Bryant makes 1/1 from the line.
Score: 87-100

[04:59] Team_091 possession (Score: 87-100)
Kevin Simons drives, picks up Giannis Quickley. Help arrives from Dejounte Ginobili! Kevin Simons attempts a Dunk. Contested by Dejounte Ginobili (5.7 feet, ZONE). KEVIN SIMONS MAKES IT! Assist: D'Angelo Ingram
Score: 87-102

[04:45] Team_084 possession (Score: 87-102)
Magic Bryant attempts a Midrange. Contested by D'Angelo Ingram (5.6 feet, ZONE). Magic Bryant misses. Rebound secured by Rudy Bridges.

[04:32] Team_091 possession (Score: 87-102)
Karl Morant attempts a 3Pt. Contested by Magic Bryant (4.3 feet, ZONE). Karl Morant misses. Rebound secured by Dejounte Ginobili.

[04:20] Team_084 possession (Score: 87-102)
Giannis Quickley attempts a Midrange. Contested by Rudy Bridges (5.3 feet, ZONE). GIANNIS QUICKLEY MAKES IT! Assist: Magic Bryant
Score: 89-102

[04:04] Team_091 possession (Score: 89-102)
Karl Morant attempts a 3Pt. Contested by Magic Bryant (4.3 feet, MAN). KARL MORANT MAKES IT! Assist: Kevin Simons
Score: 89-105

[03:51] Team_084 possession (Score: 89-105)
Magic Bryant attempts a 3Pt. Contested by Karl Morant (5.1 feet, ZONE). Magic Bryant misses. Offensive rebound by Giannis Quickley! Giannis Quickley puts it back in!
Score: 91-105

[03:36] Team_091 possession (Score: 91-105)
FOUL! Shooting foul on Giannis Quickley. Kevin Simons to the line for 2 free throws. [Team fouls: 4] (Giannis Quickley: 3 personal fouls)   FT 1/2: GOOD   FT 2/2: GOOD Kevin Simons makes 2/2 from the line.
Score: 91-107

[03:18] Team_084 possession (Score: 91-107)
Giannis Quickley attempts a Midrange. Contested by Kevin Simons (5.1 feet, MAN). Giannis Quickley misses. Offensive rebound by Giannis Quickley! Giannis Quickley puts it back in!
Score: 93-107

[03:03] Team_091 possession (Score: 93-107)
Rudy Bridges drives, Klay Thompson stays with him. Rudy Bridges attempts a Dunk. Wide open! Klay Thompson is 6.1 feet away. [MAN] Rudy Bridges misses. Rebound secured by Dejounte Ginobili.

[02:48] Team_084 possession (Score: 93-107)
Giannis Quickley attempts a 3Pt. Contested by Kevin Simons (5.2 feet, MAN). Giannis Quickley misses. Offensive rebound by Dejounte Ginobili! Dejounte Ginobili kicks it out.

[02:32] Team_084 possession (Score: 93-107)
Giannis Quickley attempts a Layup. Contested by Kevin Simons (5.2 feet, ZONE). Giannis Quickley misses. Offensive rebound by Dejounte Ginobili! Dejounte Ginobili kicks it out.

[02:19] Team_084 possession (Score: 93-107)
FOUL! Shooting foul on Kevin Simons. Giannis Quickley to the line for 2 free throws. [BONUS: 7 team fouls] (Kevin Simons: 4 personal fouls)   FT 1/2: GOOD   FT 2/2: GOOD Giannis Quickley makes 2/2 from the line.
Score: 95-107

[02:08] Team_091 possession (Score: 95-107)
D'Angelo Ingram drives and kicks out. D'Angelo Ingram attempts a 3Pt. Wide open! Jarrett Booker is 6.1 feet away. [MAN] D'Angelo Ingram misses. Rebound secured by Klay Thompson.

[01:51] Team_084 possession (Score: 95-107)
Dejounte Ginobili attempts a 3Pt. Wide open! Isaiah Siakam is 7.0 feet away. [MAN] Dejounte Ginobili misses. Rebound secured by Rudy Bridges.

[01:39] Team_091 possession (Score: 95-107)
Karl Morant attempts a Layup. Wide open! Giannis Quickley is 6.2 feet away. [ZONE] KARL MORANT MAKES IT! Assist: Rudy Bridges
Score: 95-109

[01:22] Team_084 possession (Score: 95-109)
Dejounte Ginobili attempts a 3Pt. Contested by Rudy Bridges (5.7 feet, ZONE). Dejounte Ginobili misses. Rebound secured by Rudy Bridges.

[01:09] Team_091 possession (Score: 95-109)
Rudy Bridges attempts a 3Pt. Contested by Magic Bryant (4.4 feet, ZONE). Rudy Bridges misses. Offensive rebound by Kevin Simons! Kevin Simons kicks it out.

[00:51] Team_091 possession (Score: 95-109)
D'Angelo Ingram makes the Layup and draws the foul on Jarrett Booker! And-1! D'Angelo Ingram to the line for 1. [BONUS: 5 team fouls] (Jarrett Booker: 1 personal fouls)   FT 1/1: GOOD D'Angelo Ingram makes 1/1 from the line.
Score: 95-112

[00:37] Team_084 possession (Score: 95-112)
Jarrett Booker attempts a Midrange. Wide open! Isaiah Siakam is 7.2 feet away. [ZONE] JARRETT BOOKER MAKES IT! Assist: Magic Bryant
Score: 97-112

[00:23] Team_091 possession (Score: 97-112)
D'Angelo Ingram attempts a 3Pt. Contested by Magic Bryant (5.2 feet, ZONE). D'Angelo Ingram misses. Rebound secured by Klay Thompson.

[00:11] Team_084 possession (Score: 97-112)
Giannis Quickley attempts a Midrange. Contested by Kevin Simons (5.6 feet, MAN). Giannis Quickley misses. Offensive rebound by Giannis Quickley! Giannis Quickley kicks it out.

================================================================================
                              4TH QUARTER COMPLETE                              
================================================================================

4TH QUARTER SCORE: Team_084 28, Team_091 23

BOX SCORE:
================================================================================

Team_084
--------------------------------------------------------------------------------
Player                MIN  PTS  REB  AST  TO      FG   FG%      3P   3P%
--------------------------------------------------------------------------------
Giannis Quickley       44   14    8    0   0   7/7   100.0     0/0   0.0
Jarrett Booker         44    6    0    1   0   3/4    75.0     0/0   0.0
Magic Bryant           16    3    0    4   0   1/6    16.7     0/0   0.0
Klay Thompson          44    3    2    0   0   1/2    50.0     0/0   0.0
Dejounte Ginobili      44    0    9    0   0   0/2     0.0     0/0   0.0

TEAM: FG: 12/21 (57.1%), 3PT: 2/7 (28.6%), REB: 19 (8 off, 11 def), AST: 5, TO: 1
TEAM FOULS: 5 [Team_091 in BONUS]


Team_091
--------------------------------------------------------------------------------
Player                MIN  PTS  REB  AST  TO      FG   FG%      3P   3P%
--------------------------------------------------------------------------------
Kevin Simons           44    8    4    2   0   4/6    66.7     0/0   0.0
Rudy Bridges           44    5    5    1   0   2/5    40.0     0/0   0.0
D'Angelo Ingram        44    5    3    2   0   2/5    40.0     0/0   0.0
Karl Morant            16    5    0    0   0   2/4    50.0     0/0   0.0
Isaiah Siakam          44    0    0    0   0   0/1     0.0     0/0   0.0

TEAM: FG: 10/21 (47.6%), 3PT: 2/6 (33.3%), REB: 12 (3 off, 9 def), AST: 5, TO: 1
TEAM FOULS: 7 [Team_084 in BONUS]

================================================================================

================================================================================
                               FULL GAME COMPLETE                               
================================================================================

FINAL SCORE: Team_084 97, Team_091 112

SCORING BY QUARTER:
--------------------------------------------------------------------------------
Team                     Q1     Q2     Q3     Q4    FINAL
--------------------------------------------------------------------------------
Team_084                 28     11     30     28       97
Team_091                 34     29     26     23      112
--------------------------------------------------------------------------------

FULL GAME BOX SCORE:
================================================================================

Team_084
--------------------------------------------------------------------------------
Player                MIN  PTS  REB  AST  TO      FG   FG%      3P   3P%      FT STL BLK
--------------------------------------------------------------------------------
Dejounte Ginobili      44   10   20    1   1   6/13   46.2   0/5     0.0   0/0     0   1
Klay Thompson          44   10   10    7   1   4/13   30.8   1/4    25.0   1/1     1   0
Jarrett Booker         44   14    0    5   0   6/12   50.0   0/3     0.0   4/4     0   0
Giannis Quickley       44   38   16    2   1  16/21   76.2   1/2    50.0   7/12    0   0
Luka Sexton            32    7    0    0   1   3/9    33.3   1/4    25.0   1/2     0   1
Magic Bryant           16    5    0    6   0   3/8    37.5   1/3    33.3   1/1     0   1
Chris Parker            4    3    0    0   0   1/2    50.0   1/1   100.0   0/0     0   0
Evan Quickley           4    0    1    2   0   1/2    50.0   0/0     0.0   0/0     1   0
Pascal Jackson          4    3    1    0   0   0/0     0.0   0/0     0.0   0/0     0   0
Dejounte Porzingis      4    2    2    0   0   1/4    25.0   0/0     0.0   0/0     0   0

TEAM: FG: 42/85 (49.4%), 3PT: 5/22 (22.7%), REB: 52 (14 off, 38 def), AST: 23, TO: 4


Team_091
--------------------------------------------------------------------------------
Player                MIN  PTS  REB  AST  TO      FG   FG%      3P   3P%      FT STL BLK
--------------------------------------------------------------------------------
Isaiah Siakam          44   10    0    3   0   5/13   38.5   1/6    16.7   3/3     0   0
Rudy Bridges           44   21   25    7   2   8/15   53.3   5/10   50.0   5/5     0   0
D'Angelo Ingram        44   20    3    7   0   8/11   72.7   1/2    50.0   5/6     0   1
Kevin Simons           44   22   13    4   3   9/13   69.2   0/0     0.0   7/11    1   3
Kyrie Rozier           32   20    9    3   1   6/16   37.5   3/6    50.0   0/1     0   1
Karl Morant            16    7    0    1   0   4/6    66.7   1/2    50.0   0/0     0   0
Julius Barnes           4    2    0    0   1   1/1   100.0   0/0     0.0   0/0     0   0
Tim Antetokounmpo       4    0    1    0   0   0/0     0.0   0/0     0.0   0/0     0   0
Zion Mitchell           4    0    2    0   0   0/1     0.0   0/0     0.0   0/0     0   0
Ja George               4    3    2    1   0   1/4    25.0   0/1     0.0   1/2     0   0

TEAM: FG: 43/81 (53.1%), 3PT: 11/27 (40.7%), REB: 53 (15 off, 38 def), AST: 26, TO: 7

================================================================================
