================================================================================
                        FULL GAME - Team_040 vs Team_050                        
================================================================================

================================================================================
                       1ST QUARTER - Team_040 vs Team_050                       
================================================================================

[12:00] Team_040 possession (Score: 0-0)
Carmelo Murray attempts a Midrange. Contested by Collin Bane (4.4 feet, ZONE). Carmelo Murray misses. Rebound secured by Joel Banchero.

[11:50] Team_050 possession (Score: 0-0)
Giannis LaVine attempts a 3Pt. Contested by Ayo Rose (5.0 feet, MAN). GIANNIS LAVINE MAKES IT! Assist: Joel Banchero
Score: 0-3

[11:31] Team_040 possession (Score: 0-3)
Shaquille Bane drives, Donovan Trent stays with him. Shaquille Bane attempts a Dunk. Contested by Donovan Trent (5.3 feet, ZONE). Shaquille Bane misses. Rebound secured by LeBron Bridges.

[11:13] Team_050 possession (Score: 0-3)
Giannis LaVine attempts a Midrange. Contested by Ayo Rose (5.0 feet, MAN). Giannis LaVine misses. Rebound secured by Shaquille Bane.

[10:57] Team_040 possession (Score: 0-3)
Bam Gobert commits a violation (traveling/carry)! TURNOVER! (dead ball)

[10:41] Team_050 possession (Score: 0-3)
Joel Banchero drives and kicks out. Donovan Trent attempts a Midrange. Contested by Shaquille Bane (4.6 feet, ZONE). DONOVAN TRENT MAKES IT!
Score: 0-5

[10:24] Team_040 possession (Score: 0-5)
Bam Gobert attempts a Midrange. Contested by Collin Bane (4.4 feet, ZONE). BAM GOBERT MAKES IT!
Score: 2-5

[10:09] Team_050 possession (Score: 2-5)
Donovan Trent attempts a 3Pt. Contested by Ayo Rose (4.4 feet, ZONE). Donovan Trent misses. Rebound secured by Dirk Johnson.

[09:56] Team_040 possession (Score: 2-5)
FOUL! Holding foul on Giannis LaVine. [Team fouls: 1] No free throws, side out. (Giannis LaVine: 1 personal fouls)

[09:39] Team_040 possession (Score: 2-5)
Bam Gobert makes the Dunk and draws the foul on Donovan Trent! And-1! Bam Gobert to the line for 1. [Team fouls: 2] (Donovan Trent: 1 personal fouls)   FT 1/1: GOOD Bam Gobert makes 1/1 from the line.
Score: 5-5

[09:27] Team_050 possession (Score: 5-5)
Donovan Trent attempts a 3Pt. Contested by Ayo Rose (4.4 feet, ZONE). Donovan Trent misses. Rebound secured by Shaquille Bane.

[09:09] Team_040 possession (Score: 5-5)
Shaquille Bane loses control! Ball rolls out of bounds! TURNOVER! (dead ball)

[08:54] Team_050 possession (Score: 5-5)
LeBron Bridges attempts a Midrange. Wide open! Dirk Johnson is 6.0 feet away. [MAN] LeBron Bridges misses. FOUL! Loose ball foul on Bam Gobert during the rebound battle. [Team fouls: 1] No free throws, side out. (Bam Gobert: 1 personal fouls)

[08:37] Team_050 possession (Score: 5-5)
Donovan Trent drives, Bam Gobert stays with him. Donovan Trent attempts a Layup. Contested by Bam Gobert (3.7 feet, MAN). DONOVAN TRENT MAKES IT!
Score: 5-7

[08:23] Team_040 possession (Score: 5-7)
FOUL! Reach-in foul on Donovan Trent during the drive. [Team fouls: 3] No free throws, side out. (Donovan Trent: 2 personal fouls)

[08:08] Team_040 possession (Score: 5-7)
Carmelo Murray attempts a 3Pt. Contested by Giannis LaVine (4.2 feet, ZONE). Carmelo Murray misses. Rebound secured by LeBron Bridges.

[07:50] Team_050 possession (Score: 5-7)
Collin Bane attempts a 3Pt. Contested by Carmelo Murray (4.6 feet, MAN). COLLIN BANE MAKES IT! Assist: Joel Banchero
Score: 5-10

[07:39] Team_040 possession (Score: 5-10)
Bam Gobert attempts a Midrange. Contested by Joel Banchero (4.6 feet, ZONE). Bam Gobert misses. Rebound secured by Collin Bane.

[07:26] Team_050 possession (Score: 5-10)
FOUL! Offensive foul on Giannis LaVine! Ayo Rose drew the charge! [Team fouls: 4] (Giannis LaVine: 2 personal fouls) TURNOVER! (dead ball)

[07:13] Team_040 possession (Score: 5-10)
Dirk Johnson attempts a Midrange. Contested by Joel Banchero (4.5 feet, ZONE). Dirk Johnson misses. Rebound secured by LeBron Bridges.

[07:02] Team_050 possession (Score: 5-10)
Donovan Trent makes the Layup and draws the foul on Bam Gobert! And-1! Donovan Trent to the line for 1. [Team fouls: 2] (Bam Gobert: 2 personal fouls)   FT 1/1: GOOD Donovan Trent makes 1/1 from the line.
Score: 5-13

[06:51] Team_040 possession (Score: 5-13)
Carmelo Murray attempts a Midrange. Contested by Collin Bane (4.4 feet, MAN). Carmelo Murray misses. Rebound secured by Collin Bane.

[06:35] Team_050 possession (Score: 5-13)
Giannis LaVine attempts a 3Pt. Wide open! Dirk Johnson is 6.3 feet away. [ZONE] Giannis LaVine misses. Rebound secured by Shaquille Bane.

[06:18] Team_040 possession (Score: 5-13)
Dirk Johnson loses the ball! Stripped by LeBron Bridges! TURNOVER! (live ball)

[06:03] Team_050 possession (Score: 5-13)
FOUL! Offensive foul on Joel Banchero! Shaquille Bane drew the charge! [Team fouls: 5] (Joel Banchero: 1 personal fouls) TURNOVER! (dead ball)

[05:48] Team_040 possession (Score: 5-13)
Bam Gobert attempts a 3Pt. Contested by Giannis LaVine (4.1 feet, ZONE). BAM GOBERT MAKES IT! Assist: Dirk Johnson
Score: 8-13

[05:35] Team_050 possession (Score: 8-13)
Collin Bane drives and kicks out. Collin Bane attempts a 3Pt. Contested by Ayo Rose (4.6 feet, ZONE). Collin Bane misses. Rebound secured by Dirk Johnson.

[05:21] Team_040 possession (Score: 8-13)
Shaquille Bane attempts a Layup. Contested by Donovan Trent (5.3 feet, ZONE). SHAQUILLE BANE MAKES IT!
Score: 10-13

[05:08] Team_050 possession (Score: 10-13)
Giannis LaVine attempts a 3Pt. Contested by Ayo Rose (5.0 feet, ZONE). Giannis LaVine misses. Rebound secured by Dirk Johnson.

[04:53] Team_040 possession (Score: 10-13)
Ayo Rose drives, picks up Donovan Trent. Help arrives from Joel Banchero! Ayo Rose attempts a Layup. Contested by Joel Banchero (5.5 feet, ZONE). AYO ROSE MAKES IT! Assist: Bam Gobert
Score: 12-13

[04:38] Team_050 possession (Score: 12-13)
Giannis LaVine attempts a 3Pt. Contested by Ayo Rose (5.1 feet, ZONE). Giannis LaVine misses. Rebound secured by Bam Gobert.

[04:23] Team_040 possession (Score: 12-13)
Bam Gobert attempts a Layup. Contested by Donovan Trent (5.2 feet, MAN). Bam Gobert misses. Offensive rebound by Bam Gobert! Bam Gobert kicks it out.

[04:11] Team_040 possession (Score: 12-13)
Carmelo Murray attempts a Midrange. Contested by Joel Banchero (4.6 feet, ZONE). Carmelo Murray misses. Rebound secured by LeBron Bridges.

[03:56] Team_050 possession (Score: 12-13)
LeBron Bridges drives to the basket... FOUL! Offensive foul on LeBron Bridges! Dirk Johnson drew the charge! [Team fouls: 6] (LeBron Bridges: 1 personal fouls) TURNOVER! (dead ball)

[03:44] Team_040 possession (Score: 12-13)
Ayo Rose drives and kicks out. Ayo Rose attempts a 3Pt. Contested by Giannis LaVine (4.0 feet, ZONE). Ayo Rose misses. Rebound secured by LeBron Bridges.

[03:31] Team_050 possession (Score: 12-13)
Joel Banchero attempts a 3Pt. Contested by Ayo Rose (4.6 feet, ZONE). Joel Banchero misses. Rebound secured by Bam Gobert.

[03:18] Team_040 possession (Score: 12-13)
Dirk Johnson drives to the basket... Dirk Johnson loses control! Ball rolls out of bounds! TURNOVER! (dead ball)

[03:18] Substitution (Team_050): LeBron Bridges OUT → Luka Gasol IN (stamina_rule2)

[03:03] Team_050 possession (Score: 12-13)
Luka Gasol attempts a 3Pt. Contested by Ayo Rose (4.8 feet, ZONE). Luka Gasol misses. Offensive rebound by Collin Bane! Collin Bane kicks it out.

[02:51] Team_050 possession (Score: 12-13)
Giannis LaVine attempts a Midrange. Contested by Ayo Rose (5.2 feet, MAN). Giannis LaVine misses. Rebound secured by Bam Gobert.

[02:36] Team_040 possession (Score: 12-13)
Bam Gobert attempts a Midrange. Contested by Donovan Trent (5.4 feet, MAN). Bam Gobert misses. Rebound secured by Donovan Trent.

[02:23] Team_050 possession (Score: 12-13)
Collin Bane drives and kicks out. Luka Gasol attempts a 3Pt. Wide open! Dirk Johnson is 6.1 feet away. [ZONE] LUKA GASOL MAKES IT! Assist: Collin Bane
Score: 12-16

[02:03] Team_040 possession (Score: 12-16)
Shaquille Bane attempts a Midrange. Contested by Joel Banchero (5.0 feet, MAN). Shaquille Bane misses. Rebound secured by Joel Banchero.

[01:49] Team_050 possession (Score: 12-16)
Collin Bane attempts a 3Pt. Wide open! Dirk Johnson is 6.2 feet away. [ZONE] Collin Bane misses. Rebound secured by Dirk Johnson.

[01:34] Team_040 possession (Score: 12-16)
Dirk Johnson attempts a 3Pt. Contested by Giannis LaVine (4.4 feet, ZONE). DIRK JOHNSON MAKES IT! Assist: Bam Gobert
Score: 15-16

[01:18] Team_050 possession (Score: 15-16)
Collin Bane attempts a 3Pt. Contested by Carmelo Murray (5.0 feet, MAN). Collin Bane misses. Rebound secured by Shaquille Bane.

[01:04] Team_040 possession (Score: 15-16)
Ayo Rose attempts a 3Pt. Contested by Giannis LaVine (4.9 feet, MAN). AYO ROSE MAKES IT! Assist: Carmelo Murray
Score: 18-16

[00:51] Team_050 possession (Score: 18-16)
Luka Gasol attempts a 3Pt. Contested by Shaquille Bane (5.1 feet, ZONE). Luka Gasol misses. Offensive rebound by Joel Banchero! Joel Banchero kicks it out.

[00:37] Team_050 possession (Score: 18-16)
Collin Bane makes the Layup and draws the foul on Carmelo Murray! And-1! Collin Bane to the line for 1. [Team fouls: 3] (Carmelo Murray: 1 personal fouls)   FT 1/1: GOOD Collin Bane makes 1/1 from the line.
Score: 18-19

[00:19] Team_040 possession (Score: 18-19)
Dirk Johnson attempts a 3Pt. Contested by Luka Gasol (5.1 feet, ZONE). Dirk Johnson misses. Rebound secured by Collin Bane.

[00:06] Team_050 possession (Score: 18-19)
Giannis LaVine makes the Layup and draws the foul on Bam Gobert! And-1! Giannis LaVine to the line for 1. [Team fouls: 4] (Bam Gobert: 3 personal fouls)   FT 1/1: GOOD Giannis LaVine makes 1/1 from the line.
Score: 18-22

================================================================================
                              1ST QUARTER COMPLETE                              
================================================================================

1ST QUARTER SCORE: Team_040 18, Team_050 22

BOX SCORE:
================================================================================

Team_040
--------------------------------------------------------------------------------
Player                MIN  PTS  REB  AST  TO      FG   FG%      3P   3P%
--------------------------------------------------------------------------------
Bam Gobert             12    8    4    2   0   3/5    60.0     0/0   0.0
Ayo Rose               12    5    0    0   0   2/3    66.7     0/0   0.0
Dirk Johnson           12    3    4    1   0   1/3    33.3     0/0   0.0
Shaquille Bane         12    2    4    0   0   1/3    33.3     0/0   0.0
Carmelo Murray         12    0    0    1   0   0/4     0.0     0/0   0.0

TEAM: FG: 7/18 (38.9%), 3PT: 3/5 (60.0%), REB: 12 (1 off, 11 def), AST: 4, TO: 4
TEAM FOULS: 4


Team_050
--------------------------------------------------------------------------------
Player                MIN  PTS  REB  AST  TO      FG   FG%      3P   3P%
--------------------------------------------------------------------------------
Donovan Trent          12    7    1    0   0   3/5    60.0     0/0   0.0
Giannis LaVine         12    6    0    0   0   2/7    28.6     0/0   0.0
Collin Bane            12    6    5    1   0   2/5    40.0     0/0   0.0
Luka Gasol              3    3    0    0   0   1/1   100.0     0/0   0.0
Joel Banchero          12    0    3    2   0   0/1     0.0     0/0   0.0
LeBron Bridges          9    0    5    0   0   0/0     0.0     0/0   0.0

TEAM: FG: 8/19 (42.1%), 3PT: 2/10 (20.0%), REB: 14 (3 off, 11 def), AST: 3, TO: 3
TEAM FOULS: 6 [Team_040 in BONUS]

================================================================================

================================================================================
                       2ND QUARTER - Team_040 vs Team_050                       
================================================================================

[12:00] Team_040 possession (Score: 18-22)
Carmelo Murray attempts a Midrange. Contested by Collin Bane (4.6 feet, ZONE). CARMELO MURRAY MAKES IT! Assist: Ayo Rose
Score: 20-22

[11:43] Team_050 possession (Score: 20-22)
Joel Banchero attempts a 3Pt. Contested by Shaquille Bane (4.8 feet, MAN). Joel Banchero misses. Rebound secured by Bam Gobert.

[11:27] Team_040 possession (Score: 20-22)
Shaquille Bane makes the Layup and draws the foul on Collin Bane! And-1! Shaquille Bane to the line for 1. [Team fouls: 1] (Collin Bane: 1 personal fouls)   FT 1/1: GOOD Shaquille Bane makes 1/1 from the line.
Score: 23-22

[11:10] Team_050 possession (Score: 23-22)
Giannis LaVine attempts a Layup. Contested by Ayo Rose (5.4 feet, MAN). GIANNIS LAVINE MAKES IT! Assist: Joel Banchero
Score: 23-24

[10:59] Team_040 possession (Score: 23-24)
Shaquille Bane attempts a 3Pt. Contested by LeBron Bridges (4.6 feet, ZONE). Shaquille Bane misses. Offensive rebound by Dirk Johnson! Dirk Johnson kicks it out.

[10:47] Team_040 possession (Score: 23-24)
Dirk Johnson attempts a 3Pt. Contested by LeBron Bridges (4.4 feet, MAN). Dirk Johnson misses. Rebound secured by LeBron Bridges.

[10:33] Team_050 possession (Score: 23-24)
Donovan Trent loses the ball! Stripped by Bam Gobert! TURNOVER! (live ball)

[10:16] Team_040 possession (Score: 23-24)
Dirk Johnson attempts a 3Pt. Contested by Giannis LaVine (4.6 feet, ZONE). Dirk Johnson misses. Rebound secured by Joel Banchero.

[10:03] Team_050 possession (Score: 23-24)
Joel Banchero attempts a Midrange. Contested by Shaquille Bane (4.9 feet, ZONE). Joel Banchero misses. Rebound secured by Shaquille Bane.

[09:48] Team_040 possession (Score: 23-24)
Dirk Johnson attempts a Midrange. Contested by LeBron Bridges (4.5 feet, MAN). Dirk Johnson misses. Rebound secured by Collin Bane.

[09:35] Team_050 possession (Score: 23-24)
Collin Bane makes the Layup and draws the foul on Carmelo Murray! And-1! Collin Bane to the line for 1. [Team fouls: 1] (Carmelo Murray: 1 personal fouls)   FT 1/1: GOOD Collin Bane makes 1/1 from the line.
Score: 23-27

[09:25] Team_040 possession (Score: 23-27)
Ayo Rose attempts a Midrange. Contested by LeBron Bridges (4.9 feet, ZONE). Ayo Rose misses. Rebound secured by LeBron Bridges.

[09:08] Team_050 possession (Score: 23-27)
Joel Banchero throws a bad pass out of bounds! TURNOVER! (dead ball)

[09:08] Substitution (Team_040): Ayo Rose OUT → Cole O'Neal IN (stamina_rule2)

[09:08] Substitution (Team_040): Shaquille Bane OUT → Tracy Middleton IN (stamina_rule2)

[09:08] Substitution (Team_040): Carmelo Murray OUT → Klay Leonard IN (stamina_rule2)

[09:08] Substitution (Team_040): Dirk Johnson OUT → RJ Curry IN (stamina_rule2)

[09:08] Substitution (Team_040): Bam Gobert OUT → Josh Banchero IN (stamina_rule2)

[09:08] Substitution (Team_050): Giannis LaVine OUT → Damian O'Neal IN (stamina_rule2)

[09:08] Substitution (Team_050): Joel Banchero OUT → Dwyane Towns IN (stamina_rule2)

[09:08] Substitution (Team_050): Collin Bane OUT → Larry Curry IN (stamina_rule2)

[09:08] Substitution (Team_050): LeBron Bridges OUT → Luka Gasol IN (stamina_rule2)

[09:08] Substitution (Team_050): Donovan Trent OUT → Tyler Smith IN (stamina_rule2)

[08:52] Team_040 possession (Score: 23-27)
Klay Leonard drives and kicks out. RJ Curry attempts a Midrange. Contested by Dwyane Towns (4.3 feet, ZONE). RJ Curry misses. Rebound secured by Dwyane Towns.

[08:35] Team_050 possession (Score: 23-27)
Larry Curry attempts a 3Pt. Contested by RJ Curry (5.0 feet, ZONE). Larry Curry misses. Rebound secured by Klay Leonard.

[08:24] Team_040 possession (Score: 23-27)
FOUL! Shooting foul on Tyler Smith. Josh Banchero to the line for 2 free throws. [Team fouls: 2] (Tyler Smith: 1 personal fouls)   FT 1/2: MISS   FT 2/2: MISS Josh Banchero makes 0/2 from the line. Rebound secured by Tyler Smith.

[08:10] Team_050 possession (Score: 23-27)
Tyler Smith makes the Layup and draws the foul on Josh Banchero! And-1! Tyler Smith to the line for 1. [Team fouls: 2] (Josh Banchero: 1 personal fouls)   FT 1/1: GOOD Tyler Smith makes 1/1 from the line.
Score: 23-30

[07:58] Team_040 possession (Score: 23-30)
Tracy Middleton attempts a 3Pt. Contested by Luka Gasol (5.1 feet, ZONE). Tracy Middleton misses. Offensive rebound by Josh Banchero! Josh Banchero kicks it out.

[07:45] Team_040 possession (Score: 23-30)
RJ Curry attempts a 3Pt. Contested by Luka Gasol (4.7 feet, MAN). RJ Curry misses. Offensive rebound by RJ Curry! RJ Curry kicks it out.

[07:28] Team_040 possession (Score: 23-30)
Tracy Middleton attempts a 3Pt. Contested by Luka Gasol (5.1 feet, ZONE). Tracy Middleton misses. Offensive rebound by RJ Curry! RJ Curry kicks it out.

[07:12] Team_040 possession (Score: 23-30)
Cole O'Neal makes the Layup and draws the foul on Tyler Smith! And-1! Cole O'Neal to the line for 1. [Team fouls: 3] (Tyler Smith: 2 personal fouls)   FT 1/1: MISS Cole O'Neal makes 0/1 from the line. Rebound secured by Tyler Smith.
Score: 25-30

[06:55] Team_050 possession (Score: 25-30)
Larry Curry attempts a 3Pt. Contested by RJ Curry (5.0 feet, ZONE). Larry Curry misses. Rebound secured by Klay Leonard.

[06:44] Team_040 possession (Score: 25-30)
RJ Curry attempts a Layup. Contested by Tyler Smith (5.0 feet, ZONE). RJ Curry misses. Rebound secured by Larry Curry.

[06:27] Team_050 possession (Score: 25-30)
Dwyane Towns attempts a 3Pt. Wide open! Tracy Middleton is 6.1 feet away. [MAN] DWYANE TOWNS MAKES IT! Assist: Luka Gasol
Score: 25-33

[06:13] Team_040 possession (Score: 25-33)
RJ Curry attempts a 3Pt. Contested by Luka Gasol (4.7 feet, ZONE). RJ Curry misses. FOUL! Loose ball foul on Dwyane Towns during the rebound battle. [Team fouls: 4] No free throws, side out. (Dwyane Towns: 1 personal fouls)

[05:58] Team_040 possession (Score: 25-33)
FOUL! Reach-in foul on Tyler Smith during the drive. [IN THE BONUS! 5 team fouls] Klay Leonard to the line for 2 free throws. (Tyler Smith: 3 personal fouls)   FT 1/2: GOOD   FT 2/2: GOOD Klay Leonard makes 2/2 from the line.
Score: 27-33

[05:42] Team_050 possession (Score: 27-33)
Luka Gasol throws a bad pass! Stolen by RJ Curry! TURNOVER! (live ball)

[05:23] Team_040 possession (Score: 27-33)
Cole O'Neal attempts a Midrange. Wide open! Damian O'Neal is 6.3 feet away. [MAN] Cole O'Neal misses. Rebound secured by Larry Curry.

[05:07] Team_050 possession (Score: 27-33)
Tyler Smith drives to the basket... Tyler Smith commits a violation (traveling/carry)! TURNOVER! (dead ball)

[04:50] Team_040 possession (Score: 27-33)
FOUL! Shooting foul on Tyler Smith. Josh Banchero to the line for 2 free throws. [BONUS: 6 team fouls] (Tyler Smith: 4 personal fouls)   FT 1/2: GOOD   FT 2/2: MISS Josh Banchero makes 1/2 from the line. Rebound secured by Larry Curry.
Score: 28-33

[04:38] Team_050 possession (Score: 28-33)
FOUL! Holding foul on Josh Banchero. [Team fouls: 3] No free throws, side out. (Josh Banchero: 2 personal fouls)

[04:21] Team_050 possession (Score: 28-33)
Larry Curry attempts a 3Pt. Contested by RJ Curry (5.0 feet, ZONE). Larry Curry misses. Rebound secured by Josh Banchero.

[04:07] Team_040 possession (Score: 28-33)
RJ Curry attempts a 3Pt. Contested by Luka Gasol (4.7 feet, MAN). RJ CURRY MAKES IT! Assist: Tracy Middleton
Score: 31-33

[03:52] Team_050 possession (Score: 31-33)
Damian O'Neal attempts a 3Pt. Contested by Tracy Middleton (5.9 feet, ZONE). Damian O'Neal misses. Rebound secured by RJ Curry.

[03:35] Team_040 possession (Score: 31-33)
Cole O'Neal makes the Layup and draws the foul on Tyler Smith! And-1! Cole O'Neal to the line for 1. [BONUS: 7 team fouls] (Tyler Smith: 5 personal fouls)   FT 1/1: MISS Cole O'Neal makes 0/1 from the line. Rebound secured by Tyler Smith.
Score: 33-33

[03:23] Team_050 possession (Score: 33-33)
Dwyane Towns drives, Tracy Middleton stays with him. Dwyane Towns attempts a Layup. Wide open! Tracy Middleton is 6.1 feet away. [MAN] DWYANE TOWNS MAKES IT! Assist: Damian O'Neal
Score: 33-35

[03:13] Team_040 possession (Score: 33-35)
Josh Banchero drives to the basket... FOUL! Offensive foul on Josh Banchero! Tyler Smith drew the charge! [Team fouls: 4] (Josh Banchero: 3 personal fouls) TURNOVER! (dead ball)

[03:04] Team_050 possession (Score: 33-35)
Damian O'Neal attempts a 3Pt. Wide open! Cole O'Neal is 6.6 feet away. [MAN] DAMIAN O'NEAL MAKES IT! Assist: Dwyane Towns
Score: 33-38

[02:48] Team_040 possession (Score: 33-38)
Cole O'Neal attempts a 3Pt. Wide open! Damian O'Neal is 6.3 feet away. [MAN] Cole O'Neal misses. Rebound secured by Tyler Smith.

[02:31] Team_050 possession (Score: 33-38)
Damian O'Neal attempts a 3Pt. Contested by RJ Curry (5.0 feet, ZONE). Damian O'Neal misses. Offensive rebound by Tyler Smith! Tyler Smith kicks it out.

[02:19] Team_050 possession (Score: 33-38)
Larry Curry attempts a 3Pt. Contested by Klay Leonard (5.0 feet, MAN). LARRY CURRY MAKES IT! Assist: Dwyane Towns
Score: 33-41

[02:02] Team_040 possession (Score: 33-41)
Klay Leonard drives to the basket... Klay Leonard throws a bad pass out of bounds! TURNOVER! (dead ball)

[01:49] Team_050 possession (Score: 33-41)
Luka Gasol drives and kicks out. Tyler Smith attempts a 3Pt. Contested by Josh Banchero (5.9 feet, MAN). Tyler Smith misses. Offensive rebound by Tyler Smith! Tyler Smith kicks it out.

[01:36] Team_050 possession (Score: 33-41)
Tyler Smith attempts a 3Pt. Contested by RJ Curry (5.3 feet, ZONE). Tyler Smith misses. Rebound secured by Josh Banchero.

[01:22] Team_040 possession (Score: 33-41)
Josh Banchero attempts a Midrange. Contested by Larry Curry (5.4 feet, ZONE). JOSH BANCHERO MAKES IT! Assist: Cole O'Neal
Score: 35-41

[01:12] Team_050 possession (Score: 35-41)
Tyler Smith drives and kicks out. Tyler Smith attempts a 3Pt. Contested by RJ Curry (5.0 feet, ZONE). Tyler Smith misses. Offensive rebound by Tyler Smith! Tyler Smith kicks it out.

[00:58] Team_050 possession (Score: 35-41)
Larry Curry attempts a Layup. Wide open! Josh Banchero is 6.1 feet away. [ZONE] Larry Curry misses. Offensive rebound by Tyler Smith! Tyler Smith kicks it out.

[00:41] Team_050 possession (Score: 35-41)
Larry Curry attempts a Layup. Wide open! Josh Banchero is 6.1 feet away. [ZONE] LARRY CURRY MAKES IT! Assist: Tyler Smith
Score: 35-43

[00:24] Team_040 possession (Score: 35-43)
Tracy Middleton attempts a 3Pt. Contested by Dwyane Towns (4.6 feet, MAN). Tracy Middleton misses. Rebound secured by Larry Curry.

[00:13] Team_050 possession (Score: 35-43)
Dwyane Towns attempts a Midrange. Wide open! Cole O'Neal is 6.8 feet away. [ZONE] Dwyane Towns misses. Rebound secured by RJ Curry.

[00:02] Team_040 possession (Score: 35-43)
RJ Curry attempts a 3Pt. Contested by Luka Gasol (5.1 feet, MAN). RJ Curry misses. Rebound secured by Larry Curry.

================================================================================
                              2ND QUARTER COMPLETE                              
================================================================================

2ND QUARTER SCORE: Team_040 17, Team_050 21

BOX SCORE:
================================================================================

Team_040
--------------------------------------------------------------------------------
Player                MIN  PTS  REB  AST  TO      FG   FG%      3P   3P%
--------------------------------------------------------------------------------
Shaquille Bane         15    3    1    0   0   1/1   100.0     0/0   0.0
RJ Curry                9    3    5    0   0   1/3    33.3     0/0   0.0
Carmelo Murray         15    2    0    0   0   1/1   100.0     0/0   0.0
Klay Leonard            9    2    2    0   0   1/2    50.0     0/0   0.0
Josh Banchero           9    2    3    0   0   1/3    33.3     0/0   0.0
Ayo Rose               15    0    0    1   0   0/1     0.0     0/0   0.0
Bam Gobert             15    0    1    0   0   0/0     0.0     0/0   0.0
Dirk Johnson           15    0    1    0   0   0/3     0.0     0/0   0.0
Cole O'Neal             9    0    0    1   0   0/4     0.0     0/0   0.0
Tracy Middleton         9    0    0    1   0   0/1     0.0     0/0   0.0

TEAM: FG: 5/19 (26.3%), 3PT: 1/6 (16.7%), REB: 13 (5 off, 8 def), AST: 3, TO: 2
TEAM FOULS: 4


Team_050
--------------------------------------------------------------------------------
Player                MIN  PTS  REB  AST  TO      FG   FG%      3P   3P%
--------------------------------------------------------------------------------
Dwyane Towns            9    5    1    2   0   2/3    66.7     0/0   0.0
Larry Curry             9    5    5    0   0   2/5    40.0     0/0   0.0
Collin Bane            15    3    1    0   0   1/1   100.0     0/0   0.0
Tyler Smith             9    3    8    1   0   1/2    50.0     0/0   0.0
Damian O'Neal           9    3    0    1   0   1/2    50.0     0/0   0.0
Giannis LaVine         15    2    0    0   0   1/1   100.0     0/0   0.0
Joel Banchero          15    0    1    1   0   0/2     0.0     0/0   0.0
LeBron Bridges         12    0    2    0   0   0/0     0.0     0/0   0.0
Luka Gasol             12    0    0    1   0   0/0     0.0     0/0   0.0

TEAM: FG: 8/16 (50.0%), 3PT: 3/9 (33.3%), REB: 18 (4 off, 14 def), AST: 6, TO: 4
TEAM FOULS: 7 [Team_040 in BONUS]

================================================================================

================================================================================
                       3RD QUARTER - Team_040 vs Team_050                       
================================================================================

[12:00] Team_040 possession (Score: 35-43)
Bam Gobert drives to the basket... Bam Gobert commits a violation (traveling/carry)! TURNOVER! (dead ball)

[11:43] Team_050 possession (Score: 35-43)
LeBron Bridges attempts a 3Pt. Wide open! Dirk Johnson is 6.0 feet away. [MAN] LeBron Bridges misses. Rebound secured by Dirk Johnson.

[11:32] Team_040 possession (Score: 35-43)
Carmelo Murray attempts a Midrange. Contested by Collin Bane (4.4 feet, MAN). Carmelo Murray misses. Rebound secured by LeBron Bridges.

[11:16] Team_050 possession (Score: 35-43)
LeBron Bridges attempts a 3Pt. Contested by Ayo Rose (4.8 feet, ZONE). LeBron Bridges misses. Rebound secured by Dirk Johnson.

[11:01] Team_040 possession (Score: 35-43)
Carmelo Murray attempts a Midrange. Contested by Collin Bane (4.4 feet, ZONE). Carmelo Murray misses. Rebound secured by LeBron Bridges.

[10:45] Team_050 possession (Score: 35-43)
Joel Banchero attempts a 3Pt. Contested by Shaquille Bane (4.5 feet, MAN). JOEL BANCHERO MAKES IT! Assist: Collin Bane
Score: 35-46

[10:33] Team_040 possession (Score: 35-46)
Bam Gobert attempts a 3Pt. Contested by Giannis LaVine (4.1 feet, ZONE). Bam Gobert misses. Rebound secured by LeBron Bridges.

[10:18] Team_050 possession (Score: 35-46)
Donovan Trent attempts a Midrange. Contested by Bam Gobert (3.7 feet, MAN). Donovan Trent misses. Rebound secured by Dirk Johnson.

[10:07] Team_040 possession (Score: 35-46)
Shaquille Bane attempts a 3Pt. Contested by Joel Banchero (4.8 feet, ZONE). Shaquille Bane misses. Rebound secured by Collin Bane.

[09:50] Team_050 possession (Score: 35-46)
Collin Bane drives, Bam Gobert stays with him. Collin Bane attempts a Dunk. Contested by Bam Gobert (4.1 feet, ZONE). Collin Bane misses. Rebound secured by Dirk Johnson.

[09:33] Team_040 possession (Score: 35-46)
Dirk Johnson drives, LeBron Bridges stays with him. Dirk Johnson attempts a Dunk. Contested by LeBron Bridges (4.4 feet, MAN). DIRK JOHNSON MAKES IT!
Score: 37-46

[09:21] Team_050 possession (Score: 37-46)
Collin Bane attempts a Layup. BLOCKED BY BAM GOBERT! Ball is loose! Rebound secured by Bam Gobert.

[09:07] Team_040 possession (Score: 37-46)
Ayo Rose drives, Giannis LaVine stays with him. Ayo Rose attempts a Layup. Contested by Giannis LaVine (4.5 feet, MAN). Ayo Rose misses. Rebound secured by LeBron Bridges.

[08:55] Team_050 possession (Score: 37-46)
LeBron Bridges attempts a 3Pt. Wide open! Dirk Johnson is 6.0 feet away. [MAN] LeBron Bridges misses. Rebound secured by Bam Gobert.

[08:40] Team_040 possession (Score: 37-46)
Dirk Johnson attempts a Layup. Contested by Donovan Trent (5.0 feet, ZONE). DIRK JOHNSON MAKES IT! Assist: Bam Gobert
Score: 39-46

[08:26] Team_050 possession (Score: 39-46)
Donovan Trent attempts a Layup. BLOCKED BY BAM GOBERT! Ball is loose! Rebound secured by Dirk Johnson.

[08:14] Team_040 possession (Score: 39-46)
Bam Gobert drives, Donovan Trent stays with him. Bam Gobert attempts a Layup. Contested by Donovan Trent (5.1 feet, MAN). BAM GOBERT MAKES IT! Assist: Dirk Johnson
Score: 41-46

[07:59] Team_050 possession (Score: 41-46)
Giannis LaVine attempts a 3Pt. Contested by Ayo Rose (5.0 feet, MAN). GIANNIS LAVINE MAKES IT! Assist: Collin Bane
Score: 41-49

[07:42] Team_040 possession (Score: 41-49)
Carmelo Murray attempts a Layup. BLOCKED BY COLLIN BANE! Ball is loose! Rebound secured by Joel Banchero.

[07:30] Team_050 possession (Score: 41-49)
FOUL! Reach-in foul on Bam Gobert during the drive. [Team fouls: 1] No free throws, side out. (Bam Gobert: 1 personal fouls)

[07:16] Team_050 possession (Score: 41-49)
Donovan Trent attempts a Layup. Contested by Bam Gobert (3.7 feet, MAN). DONOVAN TRENT MAKES IT!
Score: 41-51

[07:01] Team_040 possession (Score: 41-51)
Carmelo Murray attempts a Midrange. Contested by LeBron Bridges (4.5 feet, ZONE). CARMELO MURRAY MAKES IT!
Score: 43-51

[06:47] Team_050 possession (Score: 43-51)
Giannis LaVine attempts a 3Pt. Contested by Ayo Rose (5.0 feet, MAN). GIANNIS LAVINE MAKES IT! Assist: LeBron Bridges
Score: 43-54

[06:33] Team_040 possession (Score: 43-54)
Dirk Johnson drives to the basket... Dirk Johnson commits a violation (traveling/carry)! TURNOVER! (dead ball)

[06:17] Team_050 possession (Score: 43-54)
FOUL! Holding foul on Bam Gobert. [Team fouls: 2] No free throws, side out. (Bam Gobert: 2 personal fouls)

[06:01] Team_050 possession (Score: 43-54)
LeBron Bridges attempts a 3Pt. Wide open! Dirk Johnson is 6.0 feet away. [MAN] LeBron Bridges misses. Rebound secured by Dirk Johnson.

[05:45] Team_040 possession (Score: 43-54)
Ayo Rose drives and kicks out. Ayo Rose attempts a Midrange. Contested by LeBron Bridges (4.2 feet, ZONE). Ayo Rose misses. Rebound secured by Collin Bane.

[05:32] Team_050 possession (Score: 43-54)
FOUL! Holding foul on Ayo Rose. [Team fouls: 3] No free throws, side out. (Ayo Rose: 1 personal fouls)

[05:17] Team_050 possession (Score: 43-54)
Joel Banchero attempts a Midrange. Contested by Shaquille Bane (4.5 feet, MAN). Joel Banchero misses. Offensive rebound by LeBron Bridges! LeBron Bridges kicks it out.

[05:00] Team_050 possession (Score: 43-54)
Donovan Trent attempts a Layup. Contested by Bam Gobert (3.7 feet, ZONE). Donovan Trent misses. Rebound secured by Dirk Johnson.

[04:42] Team_040 possession (Score: 43-54)
Bam Gobert drives to the basket... Bam Gobert loses the ball! Stripped by Donovan Trent! TURNOVER! (live ball)

[04:30] Team_050 possession (Score: 43-54)
Collin Bane attempts a Midrange. Contested by Carmelo Murray (4.7 feet, ZONE). Collin Bane misses. FOUL! Loose ball foul on Dirk Johnson during the rebound battle. [Team fouls: 4] No free throws, side out. (Dirk Johnson: 1 personal fouls)

[04:15] Team_050 possession (Score: 43-54)
LeBron Bridges drives and kicks out. Giannis LaVine attempts a Midrange. Contested by Ayo Rose (4.7 feet, MAN). GIANNIS LAVINE MAKES IT! Assist: LeBron Bridges
Score: 43-56

[04:04] Team_040 possession (Score: 43-56)
Dirk Johnson makes the Layup and draws the foul on LeBron Bridges! And-1! Dirk Johnson to the line for 1. [Team fouls: 1] (LeBron Bridges: 1 personal fouls)   FT 1/1: GOOD Dirk Johnson makes 1/1 from the line.
Score: 46-56

[03:48] Team_050 possession (Score: 46-56)
Donovan Trent drives, Bam Gobert stays with him. Donovan Trent attempts a Layup. Contested by Bam Gobert (3.8 feet, MAN). Donovan Trent misses. Rebound secured by Dirk Johnson.

[03:32] Team_040 possession (Score: 46-56)
Dirk Johnson makes the Layup and draws the foul on Joel Banchero! And-1! Dirk Johnson to the line for 1. [Team fouls: 2] (Joel Banchero: 1 personal fouls)   FT 1/1: GOOD Dirk Johnson makes 1/1 from the line.
Score: 49-56

[03:17] Team_050 possession (Score: 49-56)
LeBron Bridges attempts a 3Pt. Contested by Ayo Rose (4.9 feet, ZONE). LeBron Bridges misses. Rebound secured by Shaquille Bane.

[02:57] Team_040 possession (Score: 49-56)
Bam Gobert drives to the basket... Bam Gobert throws a bad pass! Stolen by Donovan Trent! TURNOVER! (live ball)

[02:44] Team_050 possession (Score: 49-56)
LeBron Bridges attempts a Midrange. Contested by Ayo Rose (5.0 feet, ZONE). LEBRON BRIDGES MAKES IT! Assist: Giannis LaVine
Score: 49-58

[02:30] Team_040 possession (Score: 49-58)
Ayo Rose attempts a 3Pt. Contested by Giannis LaVine (4.7 feet, MAN). Ayo Rose misses. Rebound secured by Collin Bane.

[02:16] Team_050 possession (Score: 49-58)
FOUL! Shooting foul on Bam Gobert. Donovan Trent to the line for 3 free throws. [BONUS: 5 team fouls] (Bam Gobert: 3 personal fouls)   FT 1/3: GOOD   FT 2/3: GOOD   FT 3/3: GOOD Donovan Trent makes 3/3 from the line.
Score: 49-61

[02:02] Team_040 possession (Score: 49-61)
Shaquille Bane attempts a 3Pt. Contested by Joel Banchero (5.0 feet, MAN). Shaquille Bane misses. Rebound secured by LeBron Bridges.

[01:51] Team_050 possession (Score: 49-61)
Donovan Trent drives, Bam Gobert stays with him. Donovan Trent attempts a Dunk. Contested by Bam Gobert (4.0 feet, MAN). Donovan Trent misses. Rebound secured by Dirk Johnson.

[01:35] Team_040 possession (Score: 49-61)
Ayo Rose attempts a 3Pt. Contested by Giannis LaVine (4.8 feet, MAN). Ayo Rose misses. Rebound secured by Joel Banchero.

[01:20] Team_050 possession (Score: 49-61)
Donovan Trent attempts a Midrange. Contested by Dirk Johnson (5.9 feet, ZONE). Donovan Trent misses. Rebound secured by Dirk Johnson.

[01:07] Team_040 possession (Score: 49-61)
FOUL! Shooting foul on Joel Banchero. Shaquille Bane to the line for 2 free throws. [Team fouls: 3] (Joel Banchero: 2 personal fouls)   FT 1/2: GOOD   FT 2/2: GOOD Shaquille Bane makes 2/2 from the line.
Score: 51-61

[00:50] Team_050 possession (Score: 51-61)
Collin Bane attempts a Midrange. Contested by Carmelo Murray (5.0 feet, MAN). Collin Bane misses. FOUL! Loose ball foul on Dirk Johnson during the rebound battle. [IN THE BONUS! 6 team fouls] LeBron Bridges to the line for 2 free throws. (Dirk Johnson: 2 personal fouls)   FT 1/2: MISS   FT 2/2: GOOD LeBron Bridges makes 1/2 from the line.
Score: 51-62

[00:35] Team_040 possession (Score: 51-62)
Shaquille Bane attempts a Midrange. Contested by Joel Banchero (5.1 feet, MAN). SHAQUILLE BANE MAKES IT! Assist: Carmelo Murray
Score: 53-62

[00:25] Team_050 possession (Score: 53-62)
Donovan Trent attempts a Layup. Contested by Bam Gobert (4.2 feet, MAN). Donovan Trent misses. Offensive rebound by Collin Bane! Collin Bane kicks it out.

[00:15] Team_050 possession (Score: 53-62)
FOUL! Shooting foul on Carmelo Murray. Collin Bane to the line for 2 free throws. [BONUS: 7 team fouls] (Carmelo Murray: 1 personal fouls)   FT 1/2: GOOD   FT 2/2: GOOD Collin Bane makes 2/2 from the line.
Score: 53-64

================================================================================
                              3RD QUARTER COMPLETE                              
================================================================================

3RD QUARTER SCORE: Team_040 18, Team_050 21

BOX SCORE:
================================================================================

Team_040
--------------------------------------------------------------------------------
Player                MIN  PTS  REB  AST  TO      FG   FG%      3P   3P%
--------------------------------------------------------------------------------
Dirk Johnson           27   10   10    1   0   4/4   100.0     0/0   0.0
Shaquille Bane         27    4    1    0   0   2/4    50.0     0/0   0.0
Carmelo Murray         27    2    0    1   0   1/4    25.0     0/0   0.0
Bam Gobert             27    2    2    1   0   1/2    50.0     0/0   0.0
Ayo Rose               27    0    0    0   0   0/4     0.0     0/0   0.0

TEAM: FG: 8/18 (44.4%), 3PT: 0/5 (0.0%), REB: 13 (0 off, 13 def), AST: 3, TO: 4
TEAM FOULS: 7 [Team_050 in BONUS]


Team_050
--------------------------------------------------------------------------------
Player                MIN  PTS  REB  AST  TO      FG   FG%      3P   3P%
--------------------------------------------------------------------------------
Giannis LaVine         27    8    0    1   0   3/3   100.0     0/0   0.0
Donovan Trent          27    5    0    0   0   2/8    25.0     0/0   0.0
LeBron Bridges         24    3    6    2   0   2/7    28.6     0/0   0.0
Joel Banchero          27    3    2    0   0   1/1   100.0     0/0   0.0
Collin Bane            27    2    5    2   0   1/3    33.3     0/0   0.0

TEAM: FG: 9/22 (40.9%), 3PT: 4/9 (44.4%), REB: 13 (3 off, 10 def), AST: 5, TO: 0
TEAM FOULS: 3

================================================================================

================================================================================
                       4TH QUARTER - Team_040 vs Team_050                       
================================================================================

[12:00] Substitution (Team_040): Ayo Rose OUT (stamina: 68) → Cole O'Neal IN (comeback_detected)

[12:00] Substitution (Team_050): Giannis LaVine OUT (stamina: 69) → Damian O'Neal IN (comeback_detected)

[12:00] Team_040 possession (Score: 53-64)
Cole O'Neal attempts a 3Pt. Contested by Joel Banchero (4.5 feet, ZONE). COLE O'NEAL MAKES IT! Assist: Dirk Johnson
Score: 56-64

[11:47] Team_050 possession (Score: 56-64)
Joel Banchero attempts a 3Pt. Contested by Shaquille Bane (4.8 feet, MAN). Joel Banchero misses. Rebound secured by Bam Gobert.

[11:31] Team_040 possession (Score: 56-64)
Bam Gobert attempts a Layup. Contested by Donovan Trent (5.5 feet, ZONE). BAM GOBERT MAKES IT! Assist: Shaquille Bane
Score: 58-64

[11:16] Team_050 possession (Score: 58-64)
Damian O'Neal attempts a 3Pt. Wide open! Cole O'Neal is 6.6 feet away. [MAN] Damian O'Neal misses. Offensive rebound by LeBron Bridges! LeBron Bridges kicks it out.

[11:04] Team_050 possession (Score: 58-64)
Collin Bane attempts a Midrange. Wide open! Dirk Johnson is 6.3 feet away. [ZONE] COLLIN BANE MAKES IT! Assist: Damian O'Neal
Score: 58-66

[10:52] Team_040 possession (Score: 58-66)
Carmelo Murray attempts a Layup. Contested by Donovan Trent (5.6 feet, ZONE). CARMELO MURRAY MAKES IT! Assist: Cole O'Neal
Score: 60-66

[10:36] Team_050 possession (Score: 60-66)
Donovan Trent makes the Layup and draws the foul on Bam Gobert! And-1! Donovan Trent to the line for 1. [Team fouls: 1] (Bam Gobert: 1 personal fouls)   FT 1/1: GOOD Donovan Trent makes 1/1 from the line.
Score: 60-69

[10:19] Team_040 possession (Score: 60-69)
Carmelo Murray attempts a 3Pt. Contested by Collin Bane (4.8 feet, MAN). CARMELO MURRAY MAKES IT! Assist: Bam Gobert
Score: 63-69

[10:03] Team_050 possession (Score: 63-69)
Joel Banchero drives, Shaquille Bane stays with him. Joel Banchero attempts a Dunk. Contested by Shaquille Bane (4.9 feet, MAN). JOEL BANCHERO MAKES IT! Assist: Donovan Trent
Score: 63-71

[09:45] Team_040 possession (Score: 63-71)
FOUL! Holding foul on Damian O'Neal. [Team fouls: 1] No free throws, side out. (Damian O'Neal: 1 personal fouls)

[09:30] Team_040 possession (Score: 63-71)
Bam Gobert attempts a Midrange. Contested by Donovan Trent (5.7 feet, MAN). Bam Gobert misses. Offensive rebound by Dirk Johnson! Dirk Johnson kicks it out.

[09:15] Team_040 possession (Score: 63-71)
Carmelo Murray attempts a Layup. Contested by Donovan Trent (5.7 feet, ZONE). Carmelo Murray misses. Rebound secured by Joel Banchero.

[09:00] Team_050 possession (Score: 63-71)
LeBron Bridges attempts a Midrange. Wide open! Dirk Johnson is 6.4 feet away. [ZONE] LeBron Bridges misses. Rebound secured by Shaquille Bane.

[08:43] Team_040 possession (Score: 63-71)
Dirk Johnson makes the Midrange and draws the foul on Donovan Trent! And-1! Dirk Johnson to the line for 1. [Team fouls: 2] (Donovan Trent: 1 personal fouls)   FT 1/1: GOOD Dirk Johnson makes 1/1 from the line.
Score: 66-71

[08:29] Team_050 possession (Score: 66-71)
Joel Banchero attempts a 3Pt. Wide open! Cole O'Neal is 6.2 feet away. [ZONE] JOEL BANCHERO MAKES IT! Assist: Damian O'Neal
Score: 66-74

[08:15] Team_040 possession (Score: 66-74)
Bam Gobert attempts a Layup. Contested by Donovan Trent (5.8 feet, MAN). Bam Gobert misses. Offensive rebound by Bam Gobert! Bam Gobert kicks it out.

[07:58] Team_040 possession (Score: 66-74)
Shaquille Bane drives and kicks out. Dirk Johnson attempts a 3Pt. Contested by Joel Banchero (5.0 feet, ZONE). Dirk Johnson misses. Rebound secured by LeBron Bridges.

[07:40] Team_050 possession (Score: 66-74)
LeBron Bridges drives to the basket... LeBron Bridges throws a bad pass! Stolen by Bam Gobert! TURNOVER! (live ball)

[07:25] Team_040 possession (Score: 66-74)
Carmelo Murray attempts a 3Pt. Contested by Joel Banchero (5.2 feet, ZONE). Carmelo Murray misses. Offensive rebound by Bam Gobert! Bam Gobert kicks it out.

[07:08] Team_040 possession (Score: 66-74)
Cole O'Neal drives, picks up Damian O'Neal. Help arrives from Collin Bane! Cole O'Neal attempts a Dunk. Wide open! Collin Bane is 6.3 feet away. [MAN] COLE O'NEAL MAKES IT!
Score: 68-74

[06:57] Team_050 possession (Score: 68-74)
FOUL! Holding foul on Bam Gobert. [Team fouls: 2] No free throws, side out. (Bam Gobert: 2 personal fouls)

[06:46] Team_050 possession (Score: 68-74)
LeBron Bridges attempts a Midrange. Wide open! Dirk Johnson is 6.6 feet away. [MAN] LEBRON BRIDGES MAKES IT! Assist: Donovan Trent
Score: 68-76

[06:33] Team_040 possession (Score: 68-76)
Cole O'Neal attempts a 3Pt. Contested by Joel Banchero (5.2 feet, ZONE). COLE O'NEAL MAKES IT! Assist: Bam Gobert
Score: 71-76

[06:19] Team_050 possession (Score: 71-76)
Damian O'Neal attempts a 3Pt. Wide open! Cole O'Neal is 6.6 feet away. [ZONE] Damian O'Neal misses. Rebound secured by Bam Gobert.

[06:08] Team_040 possession (Score: 71-76)
Carmelo Murray attempts a 3Pt. Contested by Joel Banchero (5.4 feet, ZONE). Carmelo Murray misses. Rebound secured by LeBron Bridges.

[05:58] Team_050 possession (Score: 71-76)
Joel Banchero attempts a 3Pt. Contested by Shaquille Bane (5.5 feet, MAN). Joel Banchero misses. Rebound secured by Shaquille Bane.

[05:42] Team_040 possession (Score: 71-76)
Cole O'Neal attempts a Layup. Wide open! Donovan Trent is 6.1 feet away. [ZONE] Cole O'Neal misses. Rebound secured by LeBron Bridges.

[05:29] Team_050 possession (Score: 71-76)
Joel Banchero drives, Shaquille Bane stays with him. Joel Banchero attempts a Dunk. Contested by Shaquille Bane (5.5 feet, MAN). JOEL BANCHERO MAKES IT! Assist: LeBron Bridges
Score: 71-78

[05:15] Team_040 possession (Score: 71-78)
Bam Gobert attempts a Midrange. Contested by Joel Banchero (5.5 feet, ZONE). BAM GOBERT MAKES IT! Assist: Shaquille Bane
Score: 73-78

[05:01] Team_050 possession (Score: 73-78)
LeBron Bridges loses control! Ball rolls out of bounds! TURNOVER! (dead ball)

[05:01] Substitution (Team_040): Shaquille Bane OUT → Tracy Middleton IN (stamina_rule2)

[05:01] Substitution (Team_040): Carmelo Murray OUT → Klay Leonard IN (stamina_rule2)

[05:01] Substitution (Team_040): Dirk Johnson OUT → RJ Curry IN (stamina_rule2)

[05:01] Substitution (Team_040): Bam Gobert OUT → Josh Banchero IN (stamina_rule2)

[05:01] Substitution (Team_050): Joel Banchero OUT → Dwyane Towns IN (stamina_rule2)

[05:01] Substitution (Team_050): Collin Bane OUT → Larry Curry IN (stamina_rule2)

[05:01] Substitution (Team_050): LeBron Bridges OUT → Luka Gasol IN (stamina_rule2)

[05:01] Substitution (Team_050): Donovan Trent OUT → Tyler Smith IN (stamina_rule2)

[04:47] Team_040 possession (Score: 73-78)
Cole O'Neal attempts a Layup. Wide open! Damian O'Neal is 6.4 feet away. [MAN] COLE O'NEAL MAKES IT!
Score: 75-78

[04:31] Team_050 possession (Score: 75-78)
Tyler Smith drives and kicks out. Luka Gasol attempts a 3Pt. Contested by RJ Curry (4.9 feet, MAN). Luka Gasol misses. Rebound secured by Klay Leonard.

[04:21] Team_040 possession (Score: 75-78)
FOUL! Shooting foul on Luka Gasol. RJ Curry to the line for 2 free throws. [Team fouls: 3] (Luka Gasol: 1 personal fouls)   FT 1/2: GOOD   FT 2/2: GOOD RJ Curry makes 2/2 from the line.
Score: 77-78

[04:07] Team_050 possession (Score: 77-78)
Damian O'Neal drives to the basket... Damian O'Neal loses the ball! Stripped by Cole O'Neal! TURNOVER! (live ball)

[03:53] Team_040 possession (Score: 77-78)
Cole O'Neal makes the Layup and draws the foul on Tyler Smith! And-1! Cole O'Neal to the line for 1. [Team fouls: 4] (Tyler Smith: 1 personal fouls)   FT 1/1: GOOD Cole O'Neal makes 1/1 from the line.
Score: 80-78

[03:41] Team_050 possession (Score: 80-78)
FOUL! Holding foul on Cole O'Neal. [Team fouls: 3] No free throws, side out. (Cole O'Neal: 1 personal fouls)

[03:29] Team_050 possession (Score: 80-78)
Larry Curry drives to the basket... Larry Curry loses the ball! Stripped by Klay Leonard! TURNOVER! (live ball)

[03:14] Team_040 possession (Score: 80-78)
FOUL! Shooting foul on Tyler Smith. Klay Leonard to the line for 2 free throws. [BONUS: 5 team fouls] (Tyler Smith: 2 personal fouls)   FT 1/2: GOOD   FT 2/2: GOOD Klay Leonard makes 2/2 from the line.
Score: 82-78

[03:03] Team_050 possession (Score: 82-78)
Luka Gasol attempts a 3Pt. Contested by RJ Curry (4.9 feet, ZONE). Luka Gasol misses. Offensive rebound by Tyler Smith! Tyler Smith kicks it out.

[02:46] Team_050 possession (Score: 82-78)
Tyler Smith drives, picks up Josh Banchero. Help arrives from Tracy Middleton! Tyler Smith attempts a Layup. Wide open! Tracy Middleton is 6.2 feet away. [ZONE] TYLER SMITH MAKES IT! Assist: Dwyane Towns
Score: 82-80

[02:36] Team_040 possession (Score: 82-80)
Josh Banchero throws a bad pass out of bounds! TURNOVER! (dead ball)

[02:27] Team_050 possession (Score: 82-80)
Larry Curry makes the Layup and draws the foul on Josh Banchero! And-1! Larry Curry to the line for 1. [Team fouls: 4] (Josh Banchero: 1 personal fouls)   FT 1/1: GOOD Larry Curry makes 1/1 from the line.
Score: 82-83

[02:14] Team_040 possession (Score: 82-83)
Josh Banchero attempts a Layup. Contested by Tyler Smith (5.6 feet, ZONE). Josh Banchero misses. Rebound secured by Tyler Smith.

[01:58] Team_050 possession (Score: 82-83)
Damian O'Neal attempts a Layup. Wide open! Cole O'Neal is 6.7 feet away. [MAN] DAMIAN O'NEAL MAKES IT!
Score: 82-85

[01:42] Team_040 possession (Score: 82-85)
Josh Banchero drives to the basket... Josh Banchero throws a bad pass out of bounds! TURNOVER! (dead ball)

[01:27] Team_050 possession (Score: 82-85)
Dwyane Towns attempts a 3Pt. Wide open! Tracy Middleton is 6.1 feet away. [MAN] Dwyane Towns misses. Rebound secured by RJ Curry.

[01:12] Team_040 possession (Score: 82-85)
RJ Curry attempts a Midrange. Contested by Luka Gasol (4.7 feet, MAN). RJ Curry misses. Rebound secured by Larry Curry.

[00:57] Team_050 possession (Score: 82-85)
Tyler Smith attempts a Midrange. Wide open! Josh Banchero is 6.2 feet away. [MAN] Tyler Smith misses. Rebound secured by Klay Leonard.

[00:39] Team_040 possession (Score: 82-85)
Klay Leonard attempts a Midrange. Contested by Dwyane Towns (4.1 feet, ZONE). Klay Leonard misses. Rebound secured by Tyler Smith.

[00:24] Team_050 possession (Score: 82-85)
Damian O'Neal throws a bad pass! Stolen by Cole O'Neal! TURNOVER! (live ball)

[00:09] Team_040 possession (Score: 82-85)
FOUL! Shooting foul on Luka Gasol. RJ Curry to the line for 2 free throws. [BONUS: 6 team fouls] (Luka Gasol: 2 personal fouls)   FT 1/2: MISS   FT 2/2: GOOD RJ Curry makes 1/2 from the line.
Score: 83-85

================================================================================
                              4TH QUARTER COMPLETE                              
================================================================================

4TH QUARTER SCORE: Team_040 30, Team_050 21

BOX SCORE:
================================================================================

Team_040
--------------------------------------------------------------------------------
Player                MIN  PTS  REB  AST  TO      FG   FG%      3P   3P%
--------------------------------------------------------------------------------
Cole O'Neal            21   13    0    1   0   5/6    83.3     0/0   0.0
Carmelo Murray         35    5    0    0   0   2/4    50.0     0/0   0.0
Bam Gobert             35    4    4    2   0   2/2   100.0     0/0   0.0
Dirk Johnson           35    3    1    1   0   1/1   100.0     0/0   0.0
RJ Curry               14    3    1    0   0   2/3    66.7     0/0   0.0
Klay Leonard           14    2    2    0   0   1/2    50.0     0/0   0.0
Shaquille Bane         35    0    2    2   0   0/1     0.0     0/0   0.0
Josh Banchero          14    0    0    0   0   0/1     0.0     0/0   0.0

TEAM: FG: 13/20 (65.0%), 3PT: 3/4 (75.0%), REB: 10 (3 off, 7 def), AST: 6, TO: 2
TEAM FOULS: 4


Team_050
--------------------------------------------------------------------------------
Player                MIN  PTS  REB  AST  TO      FG   FG%      3P   3P%
--------------------------------------------------------------------------------
Joel Banchero          35    7    1    0   0   3/5    60.0     0/0   0.0
Donovan Trent          35    3    0    2   0   1/1   100.0     0/0   0.0
Larry Curry            14    3    1    0   0   1/1   100.0     0/0   0.0
LeBron Bridges         31    2    4    1   0   1/2    50.0     0/0   0.0
Collin Bane            35    2    0    0   0   1/1   100.0     0/0   0.0
Damian O'Neal          21    2    0    2   0   1/2    50.0     0/0   0.0
Tyler Smith            14    2    3    0   0   1/3    33.3     0/0   0.0
Dwyane Towns           14    0    0    1   0   0/1     0.0     0/0   0.0

TEAM: FG: 9/16 (56.2%), 3PT: 1/5 (20.0%), REB: 9 (2 off, 7 def), AST: 6, TO: 5
TEAM FOULS: 6 [Team_040 in BONUS]

================================================================================

================================================================================
                               FULL GAME COMPLETE                               
================================================================================

FINAL SCORE: Team_040 83, Team_050 85

SCORING BY QUARTER:
--------------------------------------------------------------------------------
Team                     Q1     Q2     Q3     Q4    FINAL
--------------------------------------------------------------------------------
Team_040                 18     17     18     30       83
Team_050                 22     21     21     21       85
--------------------------------------------------------------------------------

FULL GAME BOX SCORE:
================================================================================

Team_040
--------------------------------------------------------------------------------
Player                MIN  PTS  REB  AST  TO      FG   FG%      3P   3P%      FT STL BLK
--------------------------------------------------------------------------------
Shaquille Bane         35    9    8    2   1   4/9    44.4   0/2     0.0   3/3     0   0
Carmelo Murray         35    9    0    2   1   4/13   30.8   1/3    33.3   0/0     0   0
Dirk Johnson           35   16   16    3   3   6/11   54.5   1/4    25.0   3/3     0   0
Bam Gobert             35   14   11    5   3   6/9    66.7   1/2    50.0   1/1     2   2
Ayo Rose               27    5    0    1   0   2/8    25.0   1/3    33.3   0/0     0   0
Cole O'Neal            21   13    0    2   0   5/10   50.0   2/3    66.7   1/3     2   0
Tracy Middleton        14    0    0    1   0   0/1     0.0   0/1     0.0   0/0     0   0
Klay Leonard           14    4    4    0   2   2/4    50.0   0/0     0.0   4/4     1   0
RJ Curry               14    6    6    0   1   3/6    50.0   1/2    50.0   3/4     1   0
Josh Banchero          14    2    3    0   1   1/4    25.0   0/0     0.0   1/4     0   0

TEAM: FG: 33/75 (44.0%), 3PT: 7/20 (35.0%), REB: 48 (9 off, 39 def), AST: 16, TO: 12


Team_050
--------------------------------------------------------------------------------
Player                MIN  PTS  REB  AST  TO      FG   FG%      3P   3P%      FT STL BLK
--------------------------------------------------------------------------------
Joel Banchero          35   10    7    3   3   5/10   50.0   2/6    33.3   0/0     0   0
Collin Bane            35   13   11    3   0   7/12   58.3   1/3    33.3   4/4     0   1
Donovan Trent          35   15    1    2   1   5/13   38.5   1/3    33.3   5/5     2   0
LeBron Bridges         31    5   17    3   1   3/9    33.3   0/5     0.0   1/2     1   0
Giannis LaVine         27   16    0    1   2   5/10   50.0   3/6    50.0   1/1     0   0
Damian O'Neal          21    5    0    3   1   2/4    50.0   1/3    33.3   0/0     0   0
Luka Gasol             17    3    0    1   2   0/0     0.0   0/0     0.0   0/0     0   0
Dwyane Towns           14    5    1    3   1   2/4    50.0   1/2    50.0   0/0     0   0
Larry Curry            14    8    6    0   1   3/6    50.0   1/4    25.0   1/1     0   0
Tyler Smith            14    5   11    1   0   2/5    40.0   0/1     0.0   1/1     0   0

TEAM: FG: 34/73 (46.6%), 3PT: 10/33 (30.3%), REB: 54 (12 off, 42 def), AST: 20, TO: 12

================================================================================
