================================================================================
                        FULL GAME - Team_040 vs Team_085                        
================================================================================

================================================================================
                       1ST QUARTER - Team_040 vs Team_085                       
================================================================================

[12:00] Team_040 possession (Score: 0-0)
Bam Gobert commits a violation (traveling/carry)! TURNOVER! (dead ball)

[11:49] Team_085 possession (Score: 0-0)
Paul Wagner drives, picks up Bam Gobert. Help arrives from Shaquille Bane! Paul Wagner attempts a Layup. Contested by Shaquille Bane (4.2 feet, ZONE). PAUL WAGNER MAKES IT! Assist: Larry Duncan
Score: 0-2

[11:34] Team_040 possession (Score: 0-2)
FOUL! Shooting foul on Paul Wagner. Dirk Johnson to the line for 2 free throws. [Team fouls: 1] (Paul Wagner: 1 personal fouls)   FT 1/2: MISS   FT 2/2: MISS Dirk Johnson makes 0/2 from the line. Rebound secured by Paul Wagner.

[11:16] Team_085 possession (Score: 0-2)
FOUL! Reach-in foul on Dirk Johnson during the drive. [Team fouls: 1] No free throws, side out. (Dirk Johnson: 1 personal fouls)

[11:01] Team_085 possession (Score: 0-2)
Collin Mobley attempts a 3Pt. Contested by Ayo Rose (4.5 feet, ZONE). Collin Mobley misses. Rebound secured by Bam Gobert.

[10:43] Team_040 possession (Score: 0-2)
Ayo Rose drives to the basket... FOUL! Offensive foul on Ayo Rose! Magic Beal drew the charge! [Team fouls: 2] (Ayo Rose: 1 personal fouls) TURNOVER! (dead ball)

[10:30] Team_085 possession (Score: 0-2)
Larry Duncan makes the 3Pt and draws the foul on Carmelo Murray! And-1! Larry Duncan to the line for 1. [Team fouls: 3] (Carmelo Murray: 1 personal fouls)   FT 1/1: GOOD Larry Duncan makes 1/1 from the line.
Score: 0-6

[10:16] Team_040 possession (Score: 0-6)
Dirk Johnson attempts a Midrange. Contested by Paul Wagner (3.7 feet, MAN). DIRK JOHNSON MAKES IT! Assist: Ayo Rose
Score: 2-6

[09:57] Team_085 possession (Score: 2-6)
FOUL! Shooting foul on Ayo Rose. Paul Wagner to the line for 3 free throws. [Team fouls: 4] (Ayo Rose: 2 personal fouls)   FT 1/3: GOOD   FT 2/3: MISS   FT 3/3: GOOD Paul Wagner makes 2/3 from the line.
Score: 2-8

[09:46] Team_040 possession (Score: 2-8)
Carmelo Murray attempts a Layup. BLOCKED BY LARRY DUNCAN! Ball deflects out of bounds off Carmelo Murray.

[09:31] Team_085 possession (Score: 2-8)
Magic Beal attempts a 3Pt. Contested by Ayo Rose (5.0 feet, MAN). Magic Beal misses. Rebound secured by Dirk Johnson.

[09:19] Team_040 possession (Score: 2-8)
Ayo Rose attempts a 3Pt. Contested by Magic Beal (4.6 feet, ZONE). Ayo Rose misses. Rebound secured by Collin Mobley.

[09:03] Team_085 possession (Score: 2-8)
Magic Beal makes the 3Pt and draws the foul on Ayo Rose! And-1! Magic Beal to the line for 1. [BONUS: 5 team fouls] (Ayo Rose: 3 personal fouls)   FT 1/1: GOOD Magic Beal makes 1/1 from the line.
Score: 2-12

[08:48] Team_040 possession (Score: 2-12)
Shaquille Bane attempts a Midrange. Contested by Paul Wagner (4.0 feet, ZONE). Shaquille Bane misses. Rebound secured by Larry Duncan.

[08:34] Team_085 possession (Score: 2-12)
Magic Beal drives and kicks out. Stephen Bird attempts a Midrange. Contested by Dirk Johnson (5.8 feet, ZONE). Stephen Bird misses. Rebound secured by Bam Gobert.

[08:20] Team_040 possession (Score: 2-12)
FOUL! Reach-in foul on Paul Wagner during the drive. [Team fouls: 2] No free throws, side out. (Paul Wagner: 2 personal fouls)

[08:07] Team_040 possession (Score: 2-12)
Ayo Rose attempts a Midrange. Contested by Magic Beal (4.6 feet, MAN). Ayo Rose misses. Rebound secured by Paul Wagner.

[07:51] Team_085 possession (Score: 2-12)
Larry Duncan attempts a 3Pt. Contested by Ayo Rose (5.0 feet, ZONE). LARRY DUNCAN MAKES IT! Assist: Magic Beal
Score: 2-15

[07:40] Team_040 possession (Score: 2-15)
Dirk Johnson drives and kicks out. Bam Gobert attempts a Midrange. Contested by Larry Duncan (3.0 feet, ZONE). Bam Gobert misses. Offensive rebound by Dirk Johnson! Dirk Johnson kicks it out.

[07:24] Team_040 possession (Score: 2-15)
Carmelo Murray attempts a 3Pt. Contested by Magic Beal (4.3 feet, ZONE). Carmelo Murray misses. Rebound secured by Larry Duncan.

[07:05] Team_085 possession (Score: 2-15)
Collin Mobley attempts a Midrange. Contested by Carmelo Murray (4.4 feet, ZONE). Collin Mobley misses. Rebound secured by Bam Gobert.

[06:46] Team_040 possession (Score: 2-15)
FOUL! Holding foul on Larry Duncan. [Team fouls: 3] No free throws, side out. (Larry Duncan: 1 personal fouls)

[06:34] Team_040 possession (Score: 2-15)
Bam Gobert attempts a Midrange. Contested by Collin Mobley (4.2 feet, MAN). Bam Gobert misses. Rebound secured by Collin Mobley.

[06:18] Team_085 possession (Score: 2-15)
Paul Wagner drives, Dirk Johnson stays with him. Paul Wagner attempts a Layup. Wide open! Dirk Johnson is 6.1 feet away. [MAN] PAUL WAGNER MAKES IT! Assist: Magic Beal
Score: 2-17

[06:08] Team_040 possession (Score: 2-17)
Carmelo Murray drives and kicks out. FOUL! Shooting foul on Magic Beal. Carmelo Murray to the line for 3 free throws. [Team fouls: 4] (Magic Beal: 1 personal fouls)   FT 1/3: MISS   FT 2/3: GOOD   FT 3/3: GOOD Carmelo Murray makes 2/3 from the line.
Score: 4-17

[05:54] Team_085 possession (Score: 4-17)
Paul Wagner drives, Dirk Johnson stays with him. Paul Wagner attempts a Layup. Wide open! Dirk Johnson is 6.1 feet away. [MAN] PAUL WAGNER MAKES IT!
Score: 4-19

[05:36] Team_040 possession (Score: 4-19)
Carmelo Murray attempts a 3Pt. Contested by Magic Beal (4.3 feet, ZONE). CARMELO MURRAY MAKES IT! Assist: Shaquille Bane
Score: 7-19

[05:20] Team_085 possession (Score: 7-19)
FOUL! Shooting foul on Shaquille Bane. Collin Mobley to the line for 2 free throws. [BONUS: 6 team fouls] (Shaquille Bane: 1 personal fouls)   FT 1/2: MISS   FT 2/2: GOOD Collin Mobley makes 1/2 from the line.
Score: 7-20

[05:09] Team_040 possession (Score: 7-20)
Shaquille Bane attempts a Midrange. Contested by Stephen Bird (3.9 feet, MAN). Shaquille Bane misses. Rebound secured by Paul Wagner.

[04:54] Team_085 possession (Score: 7-20)
FOUL! Reach-in foul on Bam Gobert during the drive. [IN THE BONUS! 7 team fouls] Collin Mobley to the line for 2 free throws. (Bam Gobert: 1 personal fouls)   FT 1/2: GOOD   FT 2/2: GOOD Collin Mobley makes 2/2 from the line.
Score: 7-22

[04:42] Team_040 possession (Score: 7-22)
FOUL! Shooting foul on Magic Beal. Shaquille Bane to the line for 3 free throws. [BONUS: 5 team fouls] (Magic Beal: 2 personal fouls)   FT 1/3: GOOD   FT 2/3: MISS   FT 3/3: GOOD Shaquille Bane makes 2/3 from the line.
Score: 9-22

[04:26] Team_085 possession (Score: 9-22)
Larry Duncan attempts a 3Pt. Contested by Carmelo Murray (4.9 feet, MAN). LARRY DUNCAN MAKES IT! Assist: Collin Mobley
Score: 9-25

[04:17] Team_040 possession (Score: 9-25)
Bam Gobert attempts a Layup. Contested by Paul Wagner (3.8 feet, ZONE). Bam Gobert misses. Rebound secured by Collin Mobley.

[04:00] Team_085 possession (Score: 9-25)
FOUL! Shooting foul on Shaquille Bane. Collin Mobley to the line for 2 free throws. [BONUS: 8 team fouls] (Shaquille Bane: 2 personal fouls)   FT 1/2: GOOD   FT 2/2: GOOD Collin Mobley makes 2/2 from the line.
Score: 9-27

[03:44] Team_040 possession (Score: 9-27)
FOUL! Shooting foul on Magic Beal. Shaquille Bane to the line for 3 free throws. [BONUS: 6 team fouls] (Magic Beal: 3 personal fouls)   FT 1/3: GOOD   FT 2/3: MISS   FT 3/3: GOOD Shaquille Bane makes 2/3 from the line.
Score: 11-27

[03:29] Team_085 possession (Score: 11-27)
Stephen Bird drives, picks up Bam Gobert. Help arrives from Shaquille Bane! Stephen Bird attempts a Dunk. Contested by Shaquille Bane (4.3 feet, ZONE). STEPHEN BIRD MAKES IT! Assist: Paul Wagner
Score: 11-29

[03:17] Team_040 possession (Score: 11-29)
Ayo Rose attempts a 3Pt. Contested by Magic Beal (4.8 feet, ZONE). Ayo Rose misses. Rebound secured by Paul Wagner.

[03:02] Team_085 possession (Score: 11-29)
Paul Wagner attempts a 3Pt. Contested by Ayo Rose (5.1 feet, ZONE). Paul Wagner misses. Offensive rebound by Paul Wagner! Paul Wagner kicks it out.

[02:51] Team_085 possession (Score: 11-29)
Magic Beal attempts a 3Pt. Contested by Ayo Rose (5.2 feet, ZONE). Magic Beal misses. Rebound secured by Dirk Johnson.

[02:37] Team_040 possession (Score: 11-29)
Ayo Rose drives to the basket... Ayo Rose loses control! Ball rolls out of bounds! TURNOVER! (dead ball)

[02:37] Substitution (Team_040): Ayo Rose OUT → Cole O'Neal IN (stamina_rule2)

[02:37] Substitution (Team_040): Shaquille Bane OUT → Tracy Middleton IN (stamina_rule2)

[02:37] Substitution (Team_040): Carmelo Murray OUT → Klay Leonard IN (stamina_rule2)

[02:37] Substitution (Team_040): Dirk Johnson OUT → RJ Curry IN (stamina_rule2)

[02:37] Substitution (Team_040): Bam Gobert OUT → Josh Banchero IN (stamina_rule2)

[02:37] Substitution (Team_085): Stephen Bird OUT → Jordan Morant IN (stamina_rule2)

[02:37] Substitution (Team_085): Collin Mobley OUT → Malcolm Beal IN (stamina_rule2)

[02:21] Team_085 possession (Score: 11-29)
Magic Beal attempts a Layup. Wide open! Cole O'Neal is 6.9 feet away. [MAN] MAGIC BEAL MAKES IT!
Score: 11-31

[02:07] Team_040 possession (Score: 11-31)
Josh Banchero attempts a Midrange. Contested by Paul Wagner (4.2 feet, MAN). JOSH BANCHERO MAKES IT!
Score: 13-31

[01:54] Team_085 possession (Score: 13-31)
Magic Beal attempts a 3Pt. Wide open! Cole O'Neal is 6.9 feet away. [MAN] Magic Beal misses. Rebound secured by RJ Curry.

[01:36] Team_040 possession (Score: 13-31)
FOUL! Reach-in foul on Magic Beal during the drive. [IN THE BONUS! 7 team fouls] Cole O'Neal to the line for 2 free throws. (Magic Beal: 4 personal fouls)   FT 1/2: MISS   FT 2/2: GOOD Cole O'Neal makes 1/2 from the line.
Score: 14-31

[01:19] Team_085 possession (Score: 14-31)
Malcolm Beal attempts a Layup. Contested by Josh Banchero (5.4 feet, ZONE). MALCOLM BEAL MAKES IT! Assist: Larry Duncan
Score: 14-33

[01:05] Team_040 possession (Score: 14-33)
Cole O'Neal drives and kicks out. Tracy Middleton attempts a Midrange. Contested by Jordan Morant (3.5 feet, MAN). Tracy Middleton misses. Rebound secured by Paul Wagner.

[00:54] Team_085 possession (Score: 14-33)
Jordan Morant attempts a 3Pt. Contested by RJ Curry (5.1 feet, ZONE). JORDAN MORANT MAKES IT! Assist: Magic Beal
Score: 14-36

[00:41] Team_040 possession (Score: 14-36)
Cole O'Neal attempts a Layup. BLOCKED BY MAGIC BEAL! Ball is loose! Rebound secured by Malcolm Beal.

[00:27] Team_085 possession (Score: 14-36)
Paul Wagner attempts a Layup. Contested by RJ Curry (5.1 feet, MAN). PAUL WAGNER MAKES IT!
Score: 14-38

[00:17] Team_040 possession (Score: 14-38)
Klay Leonard throws a bad pass! Stolen by Larry Duncan! TURNOVER! (live ball)

================================================================================
                              1ST QUARTER COMPLETE                              
================================================================================

1ST QUARTER SCORE: Team_040 14, Team_085 38

BOX SCORE:
================================================================================

Team_040
--------------------------------------------------------------------------------
Player                MIN  PTS  REB  AST  TO      FG   FG%      3P   3P%
--------------------------------------------------------------------------------
Carmelo Murray         10    5    0    0   0   2/4    50.0     0/0   0.0
Shaquille Bane         10    4    0    1   0   2/4    50.0     0/0   0.0
Dirk Johnson           10    2    3    0   0   1/2    50.0     0/0   0.0
Josh Banchero           2    2    0    0   0   1/1   100.0     0/0   0.0
Cole O'Neal             2    1    0    0   0   1/3    33.3     0/0   0.0
Bam Gobert             10    0    3    0   0   0/2     0.0     0/0   0.0
Ayo Rose               10    0    0    1   0   0/3     0.0     0/0   0.0
RJ Curry                2    0    1    0   0   0/0     0.0     0/0   0.0

TEAM: FG: 7/19 (36.8%), 3PT: 3/6 (50.0%), REB: 7 (1 off, 6 def), AST: 2, TO: 4
TEAM FOULS: 8 [Team_085 in BONUS]


Team_085
--------------------------------------------------------------------------------
Player                MIN  PTS  REB  AST  TO      FG   FG%      3P   3P%
--------------------------------------------------------------------------------
Paul Wagner            12   10    6    1   0   5/5   100.0     0/0   0.0
Larry Duncan           12   10    2    2   0   3/3   100.0     0/0   0.0
Magic Beal             12    6    0    3   0   2/6    33.3     0/0   0.0
Collin Mobley          10    5    3    1   0   3/5    60.0     0/0   0.0
Jordan Morant           2    3    0    0   0   1/1   100.0     0/0   0.0
Stephen Bird           10    2    0    0   0   1/1   100.0     0/0   0.0
Malcolm Beal            2    2    1    0   0   1/1   100.0     0/0   0.0

TEAM: FG: 16/22 (72.7%), 3PT: 6/10 (60.0%), REB: 12 (1 off, 11 def), AST: 7, TO: 0
TEAM FOULS: 7 [Team_040 in BONUS]

================================================================================

================================================================================
                       2ND QUARTER - Team_040 vs Team_085                       
================================================================================

[12:00] Team_040 possession (Score: 14-38)
Carmelo Murray loses the ball! Stripped by Larry Duncan! TURNOVER! (live ball)

[11:48] Team_085 possession (Score: 14-38)
Larry Duncan attempts a 3Pt. Contested by Ayo Rose (4.9 feet, ZONE). LARRY DUNCAN MAKES IT!
Score: 14-41

[11:36] Team_040 possession (Score: 14-41)
FOUL! Shooting foul on Paul Wagner. Dirk Johnson to the line for 2 free throws. [Team fouls: 1] (Paul Wagner: 1 personal fouls)   FT 1/2: GOOD   FT 2/2: GOOD Dirk Johnson makes 2/2 from the line.
Score: 16-41

[11:24] Team_085 possession (Score: 16-41)
Collin Mobley attempts a Layup. Contested by Bam Gobert (3.8 feet, MAN). Collin Mobley misses. Rebound secured by Bam Gobert.

[11:14] Team_040 possession (Score: 16-41)
Bam Gobert makes the Midrange and draws the foul on Paul Wagner! And-1! Bam Gobert to the line for 1. [Team fouls: 2] (Paul Wagner: 2 personal fouls)   FT 1/1: GOOD Bam Gobert makes 1/1 from the line.
Score: 19-41

[11:00] Team_085 possession (Score: 19-41)
Larry Duncan attempts a Layup. Contested by Carmelo Murray (4.8 feet, MAN). LARRY DUNCAN MAKES IT! Assist: Magic Beal
Score: 19-43

[10:47] Team_040 possession (Score: 19-43)
Ayo Rose drives, Magic Beal stays with him. Ayo Rose attempts a Layup. Contested by Magic Beal (5.1 feet, MAN). AYO ROSE MAKES IT!
Score: 21-43

[10:38] Team_085 possession (Score: 21-43)
Paul Wagner drives, picks up Bam Gobert. Help arrives from Shaquille Bane! Paul Wagner attempts a Layup. Contested by Shaquille Bane (4.2 feet, ZONE). Paul Wagner misses. Rebound secured by Shaquille Bane.

[10:26] Team_040 possession (Score: 21-43)
Ayo Rose attempts a Midrange. Contested by Paul Wagner (4.6 feet, ZONE). Ayo Rose misses. Offensive rebound by Dirk Johnson! Dirk Johnson kicks it out.

[10:10] Team_040 possession (Score: 21-43)
Bam Gobert makes the Layup and draws the foul on Collin Mobley! And-1! Bam Gobert to the line for 1. [Team fouls: 3] (Collin Mobley: 1 personal fouls)   FT 1/1: GOOD Bam Gobert makes 1/1 from the line.
Score: 24-43

[09:54] Team_085 possession (Score: 24-43)
Collin Mobley drives, picks up Bam Gobert. Help arrives from Shaquille Bane! Collin Mobley attempts a Layup. Contested by Shaquille Bane (4.0 feet, MAN). COLLIN MOBLEY MAKES IT! Assist: Stephen Bird
Score: 24-45

[09:38] Team_040 possession (Score: 24-45)
Carmelo Murray attempts a 3Pt. Contested by Magic Beal (4.9 feet, ZONE). CARMELO MURRAY MAKES IT!
Score: 27-45

[09:24] Team_085 possession (Score: 27-45)
FOUL! Reach-in foul on Bam Gobert during the drive. [Team fouls: 1] No free throws, side out. (Bam Gobert: 1 personal fouls)

[09:07] Team_085 possession (Score: 27-45)
Paul Wagner drives, picks up Dirk Johnson. Help arrives from Shaquille Bane! Paul Wagner attempts a Dunk. Wide open! Shaquille Bane is 6.3 feet away. [MAN] PAUL WAGNER MAKES IT! Assist: Collin Mobley
Score: 27-47

[08:57] Team_040 possession (Score: 27-47)
Dirk Johnson drives to the basket... Dirk Johnson throws a bad pass out of bounds! TURNOVER! (dead ball)

[08:57] Substitution (Team_040): Ayo Rose OUT → Cole O'Neal IN (stamina_rule2)

[08:57] Substitution (Team_040): Shaquille Bane OUT → Tracy Middleton IN (stamina_rule2)

[08:57] Substitution (Team_040): Carmelo Murray OUT → Klay Leonard IN (stamina_rule2)

[08:57] Substitution (Team_040): Dirk Johnson OUT → RJ Curry IN (stamina_rule2)

[08:57] Substitution (Team_040): Bam Gobert OUT → Josh Banchero IN (stamina_rule2)

[08:57] Substitution (Team_085): Magic Beal OUT → Khris Brogdon IN (stamina_rule2)

[08:57] Substitution (Team_085): Stephen Bird OUT → Jordan Morant IN (stamina_rule2)

[08:57] Substitution (Team_085): Larry Duncan OUT → Giannis Johnson IN (stamina_rule2)

[08:57] Substitution (Team_085): Paul Wagner OUT → Jalen Leonard IN (stamina_rule2)

[08:57] Substitution (Team_085): Collin Mobley OUT → Malcolm Beal IN (stamina_rule2)

[08:42] Team_085 possession (Score: 27-47)
Khris Brogdon attempts a 3Pt. Wide open! Cole O'Neal is 6.3 feet away. [MAN] KHRIS BROGDON MAKES IT! Assist: Malcolm Beal
Score: 27-50

[08:29] Team_040 possession (Score: 27-50)
Cole O'Neal attempts a Layup. BLOCKED BY JALEN LEONARD! Ball is loose! Rebound secured by Giannis Johnson.

[08:16] Team_085 possession (Score: 27-50)
Jalen Leonard attempts a Layup. Contested by RJ Curry (5.2 feet, MAN). Jalen Leonard misses. Rebound secured by Josh Banchero.

[08:03] Team_040 possession (Score: 27-50)
FOUL! Shooting foul on Jordan Morant. Tracy Middleton to the line for 2 free throws. [Team fouls: 4] (Jordan Morant: 1 personal fouls)   FT 1/2: GOOD   FT 2/2: MISS Tracy Middleton makes 1/2 from the line. Offensive rebound by RJ Curry! RJ Curry kicks it out.
Score: 28-50

[07:49] Team_040 possession (Score: 28-50)
Tracy Middleton attempts a Layup. Contested by Malcolm Beal (4.5 feet, ZONE). TRACY MIDDLETON MAKES IT! Assist: RJ Curry
Score: 30-50

[07:36] Team_085 possession (Score: 30-50)
FOUL! Holding foul on Klay Leonard. [Team fouls: 2] No free throws, side out. (Klay Leonard: 1 personal fouls)

[07:25] Team_085 possession (Score: 30-50)
Malcolm Beal attempts a 3Pt. Contested by Josh Banchero (5.4 feet, MAN). Malcolm Beal misses. Rebound secured by Klay Leonard.

[07:09] Team_040 possession (Score: 30-50)
Tracy Middleton attempts a 3Pt. Contested by Jordan Morant (3.7 feet, MAN). TRACY MIDDLETON MAKES IT! Assist: Cole O'Neal
Score: 33-50

[06:54] Team_085 possession (Score: 33-50)
Khris Brogdon attempts a Midrange. Wide open! Cole O'Neal is 6.3 feet away. [MAN] Khris Brogdon misses. Rebound secured by Josh Banchero.

[06:40] Team_040 possession (Score: 33-50)
Josh Banchero drives, Malcolm Beal stays with him. Josh Banchero attempts a Layup. Contested by Malcolm Beal (4.8 feet, MAN). Josh Banchero misses. Rebound secured by Jalen Leonard.

[06:22] Team_085 possession (Score: 33-50)
Jalen Leonard attempts a Midrange. Contested by RJ Curry (5.2 feet, ZONE). Jalen Leonard misses. FOUL! Loose ball foul on Klay Leonard during the rebound battle. [Team fouls: 3] No free throws, side out. (Klay Leonard: 2 personal fouls)

[06:11] Team_085 possession (Score: 33-50)
Giannis Johnson drives and kicks out. Malcolm Beal attempts a 3Pt. Contested by RJ Curry (4.9 feet, ZONE). Malcolm Beal misses. Rebound secured by RJ Curry.

[05:56] Team_040 possession (Score: 33-50)
Tracy Middleton attempts a Midrange. Contested by Jordan Morant (3.7 feet, MAN). Tracy Middleton misses. FOUL! Loose ball foul on Malcolm Beal during the rebound battle. [IN THE BONUS! 5 team fouls] RJ Curry to the line for 2 free throws. (Malcolm Beal: 1 personal fouls)   FT 1/2: GOOD   FT 2/2: GOOD RJ Curry makes 2/2 from the line.
Score: 35-50

[05:43] Team_085 possession (Score: 35-50)
Malcolm Beal attempts a 3Pt. Contested by RJ Curry (4.4 feet, ZONE). Malcolm Beal misses. Offensive rebound by Malcolm Beal! Malcolm Beal kicks it out.

[05:30] Team_085 possession (Score: 35-50)
Giannis Johnson attempts a 3Pt. Contested by Klay Leonard (4.9 feet, MAN). Giannis Johnson misses. Rebound secured by Klay Leonard.

[05:11] Team_040 possession (Score: 35-50)
FOUL! Shooting foul on Jalen Leonard. RJ Curry to the line for 2 free throws. [BONUS: 6 team fouls] (Jalen Leonard: 1 personal fouls)   FT 1/2: GOOD   FT 2/2: GOOD RJ Curry makes 2/2 from the line.
Score: 37-50

[04:59] Team_085 possession (Score: 37-50)
Jalen Leonard attempts a Midrange. Contested by RJ Curry (5.2 feet, MAN). Jalen Leonard misses. Offensive rebound by Malcolm Beal! Malcolm Beal kicks it out.

[04:44] Team_085 possession (Score: 37-50)
Jordan Morant attempts a 3Pt. Wide open! Tracy Middleton is 6.0 feet away. [MAN] JORDAN MORANT MAKES IT! Assist: Jalen Leonard
Score: 37-53

[04:29] Team_040 possession (Score: 37-53)
Tracy Middleton attempts a Midrange. Contested by Khris Brogdon (5.7 feet, ZONE). Tracy Middleton misses. Rebound secured by Jalen Leonard.

[04:20] Team_085 possession (Score: 37-53)
Malcolm Beal attempts a Midrange. Contested by Josh Banchero (5.4 feet, MAN). Malcolm Beal misses. FOUL! Loose ball foul on Josh Banchero during the rebound battle. [Team fouls: 4] No free throws, side out. (Josh Banchero: 1 personal fouls)

[04:07] Team_085 possession (Score: 37-53)
Jalen Leonard attempts a Layup. Contested by RJ Curry (5.2 feet, MAN). JALEN LEONARD MAKES IT!
Score: 37-55

[03:49] Team_040 possession (Score: 37-55)
Cole O'Neal attempts a 3Pt. Contested by Khris Brogdon (5.5 feet, MAN). Cole O'Neal misses. Rebound secured by Giannis Johnson.

[03:38] Team_085 possession (Score: 37-55)
Khris Brogdon attempts a 3Pt. Contested by RJ Curry (4.7 feet, ZONE). Khris Brogdon misses. Offensive rebound by Malcolm Beal! Malcolm Beal kicks it out.

[03:24] Team_085 possession (Score: 37-55)
Malcolm Beal makes the Dunk and draws the foul on Josh Banchero! And-1! Malcolm Beal to the line for 1. [BONUS: 5 team fouls] (Josh Banchero: 2 personal fouls)   FT 1/1: GOOD Malcolm Beal makes 1/1 from the line.
Score: 37-58

[03:07] Team_040 possession (Score: 37-58)
Tracy Middleton attempts a 3Pt. Wide open! Giannis Johnson is 6.1 feet away. [ZONE] TRACY MIDDLETON MAKES IT! Assist: RJ Curry
Score: 40-58

[02:56] Team_085 possession (Score: 40-58)
Giannis Johnson drives and kicks out. Giannis Johnson attempts a 3Pt. Contested by RJ Curry (5.0 feet, ZONE). GIANNIS JOHNSON MAKES IT! Assist: Malcolm Beal
Score: 40-61

[02:45] Team_040 possession (Score: 40-61)
Cole O'Neal attempts a Midrange. Contested by Jordan Morant (3.6 feet, ZONE). Cole O'Neal misses. Rebound secured by Malcolm Beal.

[02:33] Team_085 possession (Score: 40-61)
Jordan Morant attempts a 3Pt. Wide open! Cole O'Neal is 6.7 feet away. [ZONE] Jordan Morant misses. Rebound secured by Klay Leonard.

[02:19] Team_040 possession (Score: 40-61)
RJ Curry makes the Layup and draws the foul on Khris Brogdon! And-1! RJ Curry to the line for 1. [BONUS: 7 team fouls] (Khris Brogdon: 1 personal fouls)   FT 1/1: GOOD RJ Curry makes 1/1 from the line.
Score: 43-61

[02:00] Team_085 possession (Score: 43-61)
Khris Brogdon drives, picks up Josh Banchero. Help arrives from Tracy Middleton! Khris Brogdon attempts a Layup. Contested by Tracy Middleton (5.9 feet, ZONE). KHRIS BROGDON MAKES IT! Assist: Jalen Leonard
Score: 43-63

[01:45] Team_040 possession (Score: 43-63)
Josh Banchero drives and kicks out. RJ Curry attempts a 3Pt. Contested by Jordan Morant (3.7 feet, ZONE). RJ Curry misses. Rebound secured by Malcolm Beal.

[01:29] Team_085 possession (Score: 43-63)
Malcolm Beal attempts a Midrange. Contested by Klay Leonard (4.6 feet, ZONE). Malcolm Beal misses. Rebound secured by RJ Curry.

[01:17] Team_040 possession (Score: 43-63)
Cole O'Neal loses control! Ball rolls out of bounds! TURNOVER! (dead ball)

[01:00] Team_085 possession (Score: 43-63)
Malcolm Beal makes the Layup and draws the foul on Josh Banchero! And-1! Malcolm Beal to the line for 1. [BONUS: 6 team fouls] (Josh Banchero: 3 personal fouls)   FT 1/1: GOOD Malcolm Beal makes 1/1 from the line.
Score: 43-66

[00:40] Team_040 possession (Score: 43-66)
Tracy Middleton attempts a 3Pt. Contested by Jordan Morant (4.0 feet, ZONE). Tracy Middleton misses. Rebound secured by Jalen Leonard.

[00:30] Team_085 possession (Score: 43-66)
Khris Brogdon attempts a 3Pt. Wide open! Cole O'Neal is 6.5 feet away. [MAN] Khris Brogdon misses. Rebound secured by RJ Curry.

[00:14] Team_040 possession (Score: 43-66)
FOUL! Reach-in foul on Malcolm Beal during the drive. [IN THE BONUS! 8 team fouls] Josh Banchero to the line for 2 free throws. (Malcolm Beal: 2 personal fouls)   FT 1/2: GOOD   FT 2/2: GOOD Josh Banchero makes 2/2 from the line.
Score: 45-66

[00:01] Team_085 possession (Score: 45-66)
Jalen Leonard drives and kicks out. Khris Brogdon attempts a Midrange. Contested by Klay Leonard (5.3 feet, ZONE). KHRIS BROGDON MAKES IT!
Score: 45-68

================================================================================
                              2ND QUARTER COMPLETE                              
================================================================================

2ND QUARTER SCORE: Team_040 31, Team_085 30

BOX SCORE:
================================================================================

Team_040
--------------------------------------------------------------------------------
Player                MIN  PTS  REB  AST  TO      FG   FG%      3P   3P%
--------------------------------------------------------------------------------
Tracy Middleton        11    8    0    0   0   3/5    60.0     0/0   0.0
RJ Curry               11    7    4    2   0   3/3   100.0     0/0   0.0
Bam Gobert             13    6    1    0   0   2/2   100.0     0/0   0.0
Carmelo Murray         13    3    0    0   0   1/1   100.0     0/0   0.0
Dirk Johnson           13    2    1    0   0   1/1   100.0     0/0   0.0
Ayo Rose               13    2    0    0   0   1/1   100.0     0/0   0.0
Josh Banchero          11    2    2    0   0   1/3    33.3     0/0   0.0
Shaquille Bane         13    0    1    0   0   0/0     0.0     0/0   0.0
Cole O'Neal            11    0    0    1   0   0/3     0.0     0/0   0.0
Klay Leonard           11    0    3    0   0   0/0     0.0     0/0   0.0

TEAM: FG: 12/19 (63.2%), 3PT: 3/5 (60.0%), REB: 12 (2 off, 10 def), AST: 3, TO: 3
TEAM FOULS: 6 [Team_085 in BONUS]


Team_085
--------------------------------------------------------------------------------
Player                MIN  PTS  REB  AST  TO      FG   FG%      3P   3P%
--------------------------------------------------------------------------------
Khris Brogdon           9    7    0    0   0   3/5    60.0     0/0   0.0
Malcolm Beal           11    6    7    2   0   2/4    50.0     0/0   0.0
Larry Duncan           15    5    0    0   0   2/2   100.0     0/0   0.0
Giannis Johnson         9    3    2    0   0   1/3    33.3     0/0   0.0
Jordan Morant          11    3    0    0   0   1/2    50.0     0/0   0.0
Collin Mobley          13    2    0    1   0   1/2    50.0     0/0   0.0
Paul Wagner            15    2    0    0   0   1/2    50.0     0/0   0.0
Jalen Leonard           9    2    3    2   0   1/2    50.0     0/0   0.0
Magic Beal             15    0    0    1   0   0/0     0.0     0/0   0.0
Stephen Bird           13    0    0    1   0   0/0     0.0     0/0   0.0

TEAM: FG: 12/22 (54.5%), 3PT: 3/7 (42.9%), REB: 12 (5 off, 7 def), AST: 7, TO: 0
TEAM FOULS: 8 [Team_040 in BONUS]

================================================================================

================================================================================
                       3RD QUARTER - Team_040 vs Team_085                       
================================================================================

[12:00] Team_040 possession (Score: 45-68)
Carmelo Murray attempts a Midrange. Contested by Larry Duncan (3.3 feet, MAN). Carmelo Murray misses. Rebound secured by Larry Duncan.

[11:44] Team_085 possession (Score: 45-68)
Larry Duncan attempts a Dunk. BLOCKED BY SHAQUILLE BANE! Ball is loose! Rebound secured by Dirk Johnson.

[11:35] Team_040 possession (Score: 45-68)
FOUL! Shooting foul on Paul Wagner. Dirk Johnson to the line for 3 free throws. [Team fouls: 1] (Paul Wagner: 1 personal fouls)   FT 1/3: MISS   FT 2/3: MISS   FT 3/3: GOOD Dirk Johnson makes 1/3 from the line.
Score: 46-68

[11:19] Team_085 possession (Score: 46-68)
Collin Mobley attempts a Midrange. Contested by Bam Gobert (3.8 feet, MAN). Collin Mobley misses. Rebound secured by Shaquille Bane.

[11:02] Team_040 possession (Score: 46-68)
Carmelo Murray attempts a 3Pt. Contested by Larry Duncan (3.3 feet, MAN). Carmelo Murray misses. Rebound secured by Larry Duncan.

[10:47] Team_085 possession (Score: 46-68)
Stephen Bird drives, Shaquille Bane stays with him. Stephen Bird attempts a Layup. Contested by Shaquille Bane (4.9 feet, MAN). STEPHEN BIRD MAKES IT!
Score: 46-70

[10:32] Team_040 possession (Score: 46-70)
Shaquille Bane makes the Layup and draws the foul on Stephen Bird! And-1! Shaquille Bane to the line for 1. [Team fouls: 2] (Stephen Bird: 1 personal fouls)   FT 1/1: GOOD Shaquille Bane makes 1/1 from the line.
Score: 49-70

[10:20] Team_085 possession (Score: 49-70)
Magic Beal attempts a 3Pt. Contested by Ayo Rose (5.0 feet, ZONE). Magic Beal misses. Offensive rebound by Larry Duncan! Larry Duncan kicks it out.

[10:10] Team_085 possession (Score: 49-70)
Larry Duncan makes the Dunk and draws the foul on Shaquille Bane! And-1! Larry Duncan to the line for 1. [Team fouls: 1] (Shaquille Bane: 1 personal fouls)   FT 1/1: GOOD Larry Duncan makes 1/1 from the line.
Score: 49-73

[09:55] Team_040 possession (Score: 49-73)
Shaquille Bane attempts a 3Pt. Contested by Magic Beal (4.5 feet, ZONE). Shaquille Bane misses. Rebound secured by Paul Wagner.

[09:43] Team_085 possession (Score: 49-73)
FOUL! Offensive foul on Magic Beal! Ayo Rose drew the charge! [Team fouls: 3] (Magic Beal: 1 personal fouls) TURNOVER! (dead ball)

[09:29] Team_040 possession (Score: 49-73)
Bam Gobert drives, Collin Mobley stays with him. Bam Gobert attempts a Layup. Contested by Collin Mobley (4.2 feet, MAN). BAM GOBERT MAKES IT!
Score: 51-73

[09:15] Team_085 possession (Score: 51-73)
Magic Beal attempts a 3Pt. Contested by Ayo Rose (5.0 feet, MAN). MAGIC BEAL MAKES IT!
Score: 51-76

[09:02] Team_040 possession (Score: 51-76)
Shaquille Bane attempts a 3Pt. Contested by Stephen Bird (3.8 feet, MAN). Shaquille Bane misses. Rebound secured by Paul Wagner.

[08:48] Team_085 possession (Score: 51-76)
FOUL! Shooting foul on Dirk Johnson. Collin Mobley to the line for 2 free throws. [Team fouls: 2] (Dirk Johnson: 1 personal fouls)   FT 1/2: GOOD   FT 2/2: GOOD Collin Mobley makes 2/2 from the line.
Score: 51-78

[08:30] Team_040 possession (Score: 51-78)
Dirk Johnson drives, picks up Paul Wagner. Help arrives from Magic Beal! Dirk Johnson attempts a Layup. Contested by Magic Beal (3.7 feet, MAN). DIRK JOHNSON MAKES IT! Assist: Ayo Rose
Score: 53-78

[08:15] Team_085 possession (Score: 53-78)
Paul Wagner drives, Bam Gobert stays with him. Paul Wagner attempts a Layup. Contested by Bam Gobert (4.2 feet, ZONE). PAUL WAGNER MAKES IT!
Score: 53-80

[08:00] Team_040 possession (Score: 53-80)
Dirk Johnson attempts a Midrange. Contested by Paul Wagner (3.7 feet, MAN). Dirk Johnson misses. Rebound secured by Larry Duncan.

[07:41] Team_085 possession (Score: 53-80)
Stephen Bird attempts a 3Pt. Contested by Ayo Rose (4.9 feet, ZONE). Stephen Bird misses. Rebound secured by Dirk Johnson.

[07:29] Team_040 possession (Score: 53-80)
Carmelo Murray commits a violation (traveling/carry)! TURNOVER! (dead ball)

[07:13] Team_085 possession (Score: 53-80)
Stephen Bird drives and kicks out. Paul Wagner attempts a 3Pt. Contested by Dirk Johnson (5.8 feet, MAN). Paul Wagner misses. Rebound secured by Shaquille Bane.

[06:58] Team_040 possession (Score: 53-80)
Carmelo Murray attempts a 3Pt. Contested by Magic Beal (4.3 feet, ZONE). Carmelo Murray misses. Rebound secured by Paul Wagner.

[06:39] Team_085 possession (Score: 53-80)
Stephen Bird attempts a 3Pt. Contested by Ayo Rose (4.9 feet, ZONE). Stephen Bird misses. Rebound secured by Bam Gobert.

[06:24] Team_040 possession (Score: 53-80)
Ayo Rose attempts a 3Pt. Contested by Magic Beal (4.6 feet, ZONE). Ayo Rose misses. FOUL! Loose ball foul on Collin Mobley during the rebound battle. [Team fouls: 4] No free throws, side out. (Collin Mobley: 1 personal fouls)

[06:11] Team_040 possession (Score: 53-80)
Shaquille Bane attempts a 3Pt. Contested by Magic Beal (4.5 feet, ZONE). Shaquille Bane misses. Rebound secured by Paul Wagner.

[05:55] Team_085 possession (Score: 53-80)
Stephen Bird attempts a Layup. Wide open! Dirk Johnson is 6.1 feet away. [ZONE] STEPHEN BIRD MAKES IT! Assist: Collin Mobley
Score: 53-82

[05:37] Team_040 possession (Score: 53-82)
Ayo Rose attempts a 3Pt. Contested by Magic Beal (4.6 feet, MAN). AYO ROSE MAKES IT! Assist: Dirk Johnson
Score: 56-82

[05:22] Team_085 possession (Score: 56-82)
Paul Wagner makes the Layup and draws the foul on Bam Gobert! And-1! Paul Wagner to the line for 1. [Team fouls: 3] (Bam Gobert: 1 personal fouls)   FT 1/1: GOOD Paul Wagner makes 1/1 from the line.
Score: 56-85

[05:05] Team_040 possession (Score: 56-85)
Carmelo Murray loses the ball! Stripped by Larry Duncan! TURNOVER! (live ball)

[04:50] Team_085 possession (Score: 56-85)
Collin Mobley drives and kicks out. Larry Duncan attempts a 3Pt. Contested by Carmelo Murray (4.5 feet, MAN). LARRY DUNCAN MAKES IT! Assist: Collin Mobley
Score: 56-88

[04:39] Team_040 possession (Score: 56-88)
Carmelo Murray attempts a Layup. Contested by Larry Duncan (3.4 feet, MAN). CARMELO MURRAY MAKES IT!
Score: 58-88

[04:24] Team_085 possession (Score: 58-88)
Larry Duncan drives and kicks out. Stephen Bird attempts a 3Pt. Contested by Shaquille Bane (4.7 feet, MAN). STEPHEN BIRD MAKES IT! Assist: Larry Duncan
Score: 58-91

[04:09] Team_040 possession (Score: 58-91)
Dirk Johnson drives to the basket... Dirk Johnson throws a bad pass! Stolen by Paul Wagner! TURNOVER! (live ball)

[03:54] Team_085 possession (Score: 58-91)
Stephen Bird attempts a Midrange. Contested by Carmelo Murray (4.8 feet, ZONE). Stephen Bird misses. Rebound secured by Shaquille Bane.

[03:38] Team_040 possession (Score: 58-91)
Shaquille Bane attempts a 3Pt. Contested by Stephen Bird (4.0 feet, MAN). Shaquille Bane misses. Rebound secured by Paul Wagner.

[03:22] Team_085 possession (Score: 58-91)
Magic Beal attempts a Midrange. Contested by Carmelo Murray (5.0 feet, ZONE). MAGIC BEAL MAKES IT! Assist: Larry Duncan
Score: 58-93

[03:09] Team_040 possession (Score: 58-93)
Shaquille Bane drives to the basket... Shaquille Bane loses control! Ball rolls out of bounds! TURNOVER! (dead ball)

[02:52] Team_085 possession (Score: 58-93)
Paul Wagner attempts a 3Pt. Contested by Ayo Rose (5.1 feet, ZONE). Paul Wagner misses. Rebound secured by Shaquille Bane.

[02:41] Team_040 possession (Score: 58-93)
FOUL! Holding foul on Stephen Bird. [IN THE BONUS! 5 team fouls] Shaquille Bane to the line for 2 free throws. (Stephen Bird: 2 personal fouls)   FT 1/2: MISS   FT 2/2: GOOD Shaquille Bane makes 1/2 from the line.
Score: 59-93

[02:24] Team_085 possession (Score: 59-93)
Stephen Bird attempts a 3Pt. Contested by Ayo Rose (5.1 feet, ZONE). Stephen Bird misses. Rebound secured by Shaquille Bane.

[02:10] Team_040 possession (Score: 59-93)
FOUL! Holding foul on Collin Mobley. [IN THE BONUS! 6 team fouls] Bam Gobert to the line for 2 free throws. (Collin Mobley: 2 personal fouls)   FT 1/2: GOOD   FT 2/2: GOOD Bam Gobert makes 2/2 from the line.
Score: 61-93

[01:57] Team_085 possession (Score: 61-93)
Paul Wagner drives, picks up Dirk Johnson. Help arrives from Shaquille Bane! Paul Wagner attempts a Layup. Wide open! Shaquille Bane is 6.4 feet away. [MAN] PAUL WAGNER MAKES IT!
Score: 61-95

[01:41] Team_040 possession (Score: 61-95)
Carmelo Murray attempts a Midrange. Contested by Larry Duncan (3.6 feet, MAN). Carmelo Murray misses. Offensive rebound by Bam Gobert! Bam Gobert kicks it out.

[01:26] Team_040 possession (Score: 61-95)
Carmelo Murray attempts a 3Pt. Contested by Larry Duncan (3.6 feet, MAN). Carmelo Murray misses. Rebound secured by Larry Duncan.

[01:12] Team_085 possession (Score: 61-95)
Magic Beal attempts a 3Pt. Contested by Ayo Rose (5.4 feet, MAN). MAGIC BEAL MAKES IT! Assist: Stephen Bird
Score: 61-98

[01:03] Team_040 possession (Score: 61-98)
Carmelo Murray attempts a Layup. Contested by Larry Duncan (3.7 feet, MAN). Carmelo Murray misses. Rebound secured by Larry Duncan.

[00:53] Team_085 possession (Score: 61-98)
Stephen Bird attempts a Midrange. Contested by Shaquille Bane (5.3 feet, MAN). STEPHEN BIRD MAKES IT!
Score: 61-100

[00:43] Team_040 possession (Score: 61-100)
Shaquille Bane makes the Layup and draws the foul on Paul Wagner! And-1! Shaquille Bane to the line for 1. [BONUS: 7 team fouls] (Paul Wagner: 2 personal fouls)   FT 1/1: MISS Shaquille Bane makes 0/1 from the line. Offensive rebound by Dirk Johnson! Dirk Johnson kicks it out.
Score: 63-100

[00:26] Team_040 possession (Score: 63-100)
Bam Gobert attempts a Midrange. Contested by Collin Mobley (4.7 feet, MAN). Bam Gobert misses. Rebound secured by Paul Wagner.

[00:15] Team_085 possession (Score: 63-100)
Paul Wagner drives, picks up Dirk Johnson. Help arrives from Shaquille Bane! Paul Wagner attempts a Layup. Wide open! Shaquille Bane is 6.5 feet away. [MAN] PAUL WAGNER MAKES IT!
Score: 63-102

================================================================================
                              3RD QUARTER COMPLETE                              
================================================================================

3RD QUARTER SCORE: Team_040 18, Team_085 34

BOX SCORE:
================================================================================

Team_040
--------------------------------------------------------------------------------
Player                MIN  PTS  REB  AST  TO      FG   FG%      3P   3P%
--------------------------------------------------------------------------------
Shaquille Bane         25    4    5    0   0   2/6    33.3     0/0   0.0
Bam Gobert             25    4    2    0   0   2/3    66.7     0/0   0.0
Dirk Johnson           25    3    4    1   0   2/3    66.7     0/0   0.0
Ayo Rose               25    3    0    1   0   1/1   100.0     0/0   0.0
Carmelo Murray         25    2    0    0   0   1/6    16.7     0/0   0.0

TEAM: FG: 8/19 (42.1%), 3PT: 2/9 (22.2%), REB: 11 (3 off, 8 def), AST: 2, TO: 4
TEAM FOULS: 3


Team_085
--------------------------------------------------------------------------------
Player                MIN  PTS  REB  AST  TO      FG   FG%      3P   3P%
--------------------------------------------------------------------------------
Stephen Bird           25    9    0    1   0   4/9    44.4     0/0   0.0
Paul Wagner            27    9    6    0   0   4/5    80.0     0/0   0.0
Magic Beal             27    8    0    0   0   3/3   100.0     0/0   0.0
Larry Duncan           27    6    6    2   0   2/3    66.7     0/0   0.0
Collin Mobley          25    2    0    2   0   1/2    50.0     0/0   0.0

TEAM: FG: 14/22 (63.6%), 3PT: 2/6 (33.3%), REB: 12 (1 off, 11 def), AST: 5, TO: 1
TEAM FOULS: 7 [Team_040 in BONUS]

================================================================================

================================================================================
                       4TH QUARTER - Team_040 vs Team_085                       
================================================================================

[12:00] Substitution (Team_040): Ayo Rose OUT (stamina: 68) → Cole O'Neal IN (comeback_detected)

[12:00] Substitution (Team_085): Magic Beal OUT (stamina: 70) → Khris Brogdon IN (comeback_detected)

[12:00] Team_040 possession (Score: 63-102)
Dirk Johnson drives, Paul Wagner stays with him. Dirk Johnson attempts a Layup. Contested by Paul Wagner (3.9 feet, ZONE). DIRK JOHNSON MAKES IT!
Score: 65-102

[11:47] Team_085 possession (Score: 65-102)
Collin Mobley attempts a Layup. Contested by Bam Gobert (4.1 feet, MAN). COLLIN MOBLEY MAKES IT! Assist: Larry Duncan
Score: 65-104

[11:32] Team_040 possession (Score: 65-104)
FOUL! Holding foul on Collin Mobley. [Team fouls: 1] No free throws, side out. (Collin Mobley: 1 personal fouls)

[11:14] Team_040 possession (Score: 65-104)
Shaquille Bane drives, Paul Wagner stays with him. Shaquille Bane attempts a Layup. Contested by Paul Wagner (4.2 feet, ZONE). SHAQUILLE BANE MAKES IT! Assist: Dirk Johnson
Score: 67-104

[11:00] Team_085 possession (Score: 67-104)
Paul Wagner drives, Dirk Johnson stays with him. Paul Wagner attempts a Dunk. Wide open! Dirk Johnson is 6.4 feet away. [ZONE] PAUL WAGNER MAKES IT! Assist: Larry Duncan
Score: 67-106

[10:47] Team_040 possession (Score: 67-106)
Carmelo Murray attempts a Midrange. Contested by Larry Duncan (3.7 feet, MAN). Carmelo Murray misses. Rebound secured by Collin Mobley.

[10:32] Team_085 possession (Score: 67-106)
Larry Duncan attempts a 3Pt. Contested by Carmelo Murray (5.2 feet, MAN). Larry Duncan misses. Offensive rebound by Larry Duncan! Larry Duncan kicks it out.

[10:17] Team_085 possession (Score: 67-106)
Collin Mobley drives, picks up Bam Gobert. Help arrives from Shaquille Bane! Collin Mobley attempts a Layup. Contested by Shaquille Bane (4.3 feet, MAN). COLLIN MOBLEY MAKES IT!
Score: 67-108

[10:08] Team_040 possession (Score: 67-108)
Cole O'Neal attempts a Layup. Contested by Khris Brogdon (5.5 feet, MAN). COLE O'NEAL MAKES IT! Assist: Carmelo Murray
Score: 69-108

[09:53] Team_085 possession (Score: 69-108)
Larry Duncan attempts a Midrange. Contested by Carmelo Murray (5.3 feet, MAN). Larry Duncan misses. FOUL! Loose ball foul on Bam Gobert during the rebound battle. [Team fouls: 1] No free throws, side out. (Bam Gobert: 1 personal fouls)

[09:38] Team_085 possession (Score: 69-108)
Larry Duncan attempts a 3Pt. Contested by Shaquille Bane (5.5 feet, ZONE). Larry Duncan misses. Rebound secured by Dirk Johnson.

[09:22] Team_040 possession (Score: 69-108)
FOUL! Shooting foul on Collin Mobley. Bam Gobert to the line for 2 free throws. [Team fouls: 2] (Collin Mobley: 2 personal fouls)   FT 1/2: GOOD   FT 2/2: GOOD Bam Gobert makes 2/2 from the line.
Score: 71-108

[09:08] Team_085 possession (Score: 71-108)
Paul Wagner attempts a Midrange. Wide open! Dirk Johnson is 6.6 feet away. [ZONE] PAUL WAGNER MAKES IT! Assist: Khris Brogdon
Score: 71-110

[08:50] Team_040 possession (Score: 71-110)
Carmelo Murray attempts a Layup. BLOCKED BY PAUL WAGNER! Ball deflects out of bounds off Carmelo Murray.

[08:36] Team_085 possession (Score: 71-110)
FOUL! Shooting foul on Shaquille Bane. Stephen Bird to the line for 2 free throws. [Team fouls: 2] (Shaquille Bane: 1 personal fouls)   FT 1/2: GOOD   FT 2/2: GOOD Stephen Bird makes 2/2 from the line.
Score: 71-112

[08:20] Team_040 possession (Score: 71-112)
Carmelo Murray attempts a 3Pt. Contested by Larry Duncan (4.0 feet, MAN). Carmelo Murray misses. Rebound secured by Paul Wagner.

[08:04] Team_085 possession (Score: 71-112)
Paul Wagner attempts a Midrange. Contested by Shaquille Bane (5.6 feet, ZONE). PAUL WAGNER MAKES IT!
Score: 71-114

[07:49] Team_040 possession (Score: 71-114)
Bam Gobert drives to the basket... Bam Gobert loses the ball! Stripped by Collin Mobley! TURNOVER! (live ball)

[07:32] Team_085 possession (Score: 71-114)
Khris Brogdon attempts a 3Pt. Wide open! Cole O'Neal is 6.3 feet away. [MAN] Khris Brogdon misses. Rebound secured by Bam Gobert.

[07:22] Team_040 possession (Score: 71-114)
Cole O'Neal drives and kicks out. Shaquille Bane attempts a 3Pt. Contested by Stephen Bird (4.6 feet, MAN). SHAQUILLE BANE MAKES IT! Assist: Carmelo Murray
Score: 74-114

[07:08] Team_085 possession (Score: 74-114)
Khris Brogdon drives, Cole O'Neal stays with him. Khris Brogdon attempts a Dunk. Wide open! Cole O'Neal is 6.3 feet away. [MAN] KHRIS BROGDON MAKES IT!
Score: 74-116

[06:55] Team_040 possession (Score: 74-116)
Carmelo Murray attempts a 3Pt. Contested by Paul Wagner (4.5 feet, ZONE). Carmelo Murray misses. Rebound secured by Collin Mobley.

[06:40] Team_085 possession (Score: 74-116)
Khris Brogdon drives and kicks out. Paul Wagner attempts a Midrange. Wide open! Dirk Johnson is 6.7 feet away. [ZONE] PAUL WAGNER MAKES IT!
Score: 74-118

[06:26] Team_040 possession (Score: 74-118)
Dirk Johnson attempts a 3Pt. Contested by Paul Wagner (4.5 feet, MAN). DIRK JOHNSON MAKES IT! Assist: Cole O'Neal
Score: 77-118

[06:06] Team_085 possession (Score: 77-118)
Collin Mobley attempts a Midrange. Contested by Bam Gobert (4.9 feet, MAN). COLLIN MOBLEY MAKES IT! Assist: Khris Brogdon
Score: 77-120

[05:54] Team_040 possession (Score: 77-120)
Bam Gobert attempts a Layup. Contested by Paul Wagner (4.6 feet, ZONE). Bam Gobert misses. Offensive rebound by Bam Gobert! Bam Gobert kicks it out.

[05:43] Team_040 possession (Score: 77-120)
FOUL! Shooting foul on Paul Wagner. Cole O'Neal to the line for 2 free throws. [Team fouls: 3] (Paul Wagner: 1 personal fouls)   FT 1/2: GOOD   FT 2/2: MISS Cole O'Neal makes 1/2 from the line. Rebound secured by Paul Wagner.
Score: 78-120

[05:24] Team_085 possession (Score: 78-120)
Stephen Bird attempts a 3Pt. Wide open! Dirk Johnson is 6.9 feet away. [ZONE] Stephen Bird misses. Rebound secured by Bam Gobert.

[05:09] Team_040 possession (Score: 78-120)
Cole O'Neal attempts a Layup. Contested by Paul Wagner (4.7 feet, ZONE). Cole O'Neal misses. Rebound secured by Paul Wagner.

[04:56] Team_085 possession (Score: 78-120)
Khris Brogdon drives, picks up Cole O'Neal. Help arrives from Shaquille Bane! Khris Brogdon attempts a Dunk. Wide open! Shaquille Bane is 6.3 feet away. [MAN] Khris Brogdon misses. Rebound secured by Dirk Johnson.

[04:42] Team_040 possession (Score: 78-120)
Shaquille Bane attempts a 3Pt. Contested by Stephen Bird (5.3 feet, MAN). Shaquille Bane misses. Rebound secured by Larry Duncan.

[04:27] Team_085 possession (Score: 78-120)
Collin Mobley attempts a Layup. Contested by Bam Gobert (5.1 feet, MAN). COLLIN MOBLEY MAKES IT!
Score: 78-122

[04:17] Team_040 possession (Score: 78-122)
Carmelo Murray drives and kicks out. FOUL! Shooting foul on Paul Wagner. Cole O'Neal to the line for 2 free throws. [Team fouls: 4] (Paul Wagner: 2 personal fouls)   FT 1/2: MISS   FT 2/2: GOOD Cole O'Neal makes 1/2 from the line.
Score: 79-122

[04:06] Team_085 possession (Score: 79-122)
Stephen Bird attempts a Midrange. Wide open! Shaquille Bane is 6.0 feet away. [MAN] Stephen Bird misses. Rebound secured by Cole O'Neal.

[03:49] Team_040 possession (Score: 79-122)
Carmelo Murray attempts a 3Pt. Contested by Larry Duncan (4.7 feet, MAN). Carmelo Murray misses. Rebound secured by Larry Duncan.

[03:35] Team_085 possession (Score: 79-122)
Collin Mobley makes the Layup and draws the foul on Bam Gobert! And-1! Collin Mobley to the line for 1. [Team fouls: 3] (Bam Gobert: 2 personal fouls)   FT 1/1: GOOD Collin Mobley makes 1/1 from the line.
Score: 79-125

[03:20] Team_040 possession (Score: 79-125)
Shaquille Bane attempts a Midrange. Contested by Stephen Bird (5.6 feet, ZONE). Shaquille Bane misses. Rebound secured by Paul Wagner.

[03:06] Team_085 possession (Score: 79-125)
Larry Duncan attempts a 3Pt. Wide open! Carmelo Murray is 6.2 feet away. [MAN] LARRY DUNCAN MAKES IT! Assist: Stephen Bird
Score: 79-128

[02:55] Team_040 possession (Score: 79-128)
Shaquille Bane makes the Layup and draws the foul on Paul Wagner! And-1! Shaquille Bane to the line for 1. [BONUS: 5 team fouls] (Paul Wagner: 3 personal fouls)   FT 1/1: GOOD Shaquille Bane makes 1/1 from the line.
Score: 82-128

[02:43] Team_085 possession (Score: 82-128)
FOUL! Reach-in foul on Cole O'Neal during the drive. [Team fouls: 4] No free throws, side out. (Cole O'Neal: 1 personal fouls)

[02:28] Team_085 possession (Score: 82-128)
Stephen Bird attempts a Midrange. Wide open! Shaquille Bane is 6.3 feet away. [ZONE] Stephen Bird misses. Offensive rebound by Larry Duncan! Larry Duncan kicks it out.

[02:12] Team_085 possession (Score: 82-128)
Khris Brogdon attempts a 3Pt. Wide open! Cole O'Neal is 6.5 feet away. [MAN] Khris Brogdon misses. Offensive rebound by Larry Duncan! Larry Duncan kicks it out.

[01:58] Team_085 possession (Score: 82-128)
Paul Wagner drives, picks up Bam Gobert. Help arrives from Shaquille Bane! Paul Wagner attempts a Dunk. Contested by Shaquille Bane (5.9 feet, ZONE). Paul Wagner misses. FOUL! Loose ball foul on Cole O'Neal during the rebound battle. [IN THE BONUS! 5 team fouls] Paul Wagner to the line for 2 free throws. (Cole O'Neal: 2 personal fouls)   FT 1/2: MISS   FT 2/2: MISS Paul Wagner makes 0/2 from the line. Rebound secured by Bam Gobert.

[01:45] Team_040 possession (Score: 82-128)
Dirk Johnson attempts a Layup. Contested by Paul Wagner (5.2 feet, ZONE). DIRK JOHNSON MAKES IT! Assist: Cole O'Neal
Score: 84-128

[01:32] Team_085 possession (Score: 84-128)
Khris Brogdon attempts a Layup. Contested by Bam Gobert (5.8 feet, ZONE). KHRIS BROGDON MAKES IT!
Score: 84-130

[01:21] Team_040 possession (Score: 84-130)
Dirk Johnson attempts a Midrange. Contested by Stephen Bird (5.8 feet, ZONE). Dirk Johnson misses. Offensive rebound by Bam Gobert! Bam Gobert kicks it out.

[01:08] Team_040 possession (Score: 84-130)
Bam Gobert attempts a 3Pt. Wide open! Collin Mobley is 6.1 feet away. [MAN] BAM GOBERT MAKES IT!
Score: 87-130

[00:50] Team_085 possession (Score: 87-130)
FOUL! Reach-in foul on Bam Gobert during the drive. [IN THE BONUS! 6 team fouls] Collin Mobley to the line for 2 free throws. (Bam Gobert: 3 personal fouls)   FT 1/2: MISS   FT 2/2: MISS Collin Mobley makes 0/2 from the line. Rebound secured by Dirk Johnson.

[00:35] Team_040 possession (Score: 87-130)
FOUL! Reach-in foul on Paul Wagner during the drive. [IN THE BONUS! 6 team fouls] Dirk Johnson to the line for 2 free throws. (Paul Wagner: 4 personal fouls)   FT 1/2: GOOD   FT 2/2: GOOD Dirk Johnson makes 2/2 from the line.
Score: 89-130

[00:18] Team_085 possession (Score: 89-130)
Khris Brogdon drives to the basket... FOUL! Offensive foul on Khris Brogdon! Cole O'Neal drew the charge! [Team fouls: 7] (Khris Brogdon: 1 personal fouls) TURNOVER! (dead ball)

[00:03] Team_040 possession (Score: 89-130)
Carmelo Murray attempts a 3Pt. Contested by Larry Duncan (5.4 feet, MAN). Carmelo Murray misses. Rebound secured by Khris Brogdon.

================================================================================
                              4TH QUARTER COMPLETE                              
================================================================================

4TH QUARTER SCORE: Team_040 26, Team_085 28

BOX SCORE:
================================================================================

Team_040
--------------------------------------------------------------------------------
Player                MIN  PTS  REB  AST  TO      FG   FG%      3P   3P%
--------------------------------------------------------------------------------
Dirk Johnson           37    9    3    1   0   4/4   100.0     0/0   0.0
Shaquille Bane         37    8    0    0   0   3/5    60.0     0/0   0.0
Bam Gobert             37    5    5    0   0   2/2   100.0     0/0   0.0
Cole O'Neal            24    3    1    2   0   2/4    50.0     0/0   0.0
Carmelo Murray         37    0    0    2   0   0/6     0.0     0/0   0.0

TEAM: FG: 11/21 (52.4%), 3PT: 2/7 (28.6%), REB: 8 (2 off, 6 def), AST: 5, TO: 1
TEAM FOULS: 6 [Team_085 in BONUS]


Team_085
--------------------------------------------------------------------------------
Player                MIN  PTS  REB  AST  TO      FG   FG%      3P   3P%
--------------------------------------------------------------------------------
Collin Mobley          37   11    2    0   0   5/6    83.3     0/0   0.0
Paul Wagner            40    8    5    0   0   4/5    80.0     0/0   0.0
Khris Brogdon          21    4    1    2   0   2/4    50.0     0/0   0.0
Larry Duncan           40    3    5    2   0   1/2    50.0     0/0   0.0
Stephen Bird           37    2    0    1   0   1/3    33.3     0/0   0.0

TEAM: FG: 13/20 (65.0%), 3PT: 1/4 (25.0%), REB: 14 (5 off, 9 def), AST: 5, TO: 1
TEAM FOULS: 7 [Team_040 in BONUS]

================================================================================

================================================================================
                               FULL GAME COMPLETE                               
================================================================================

FINAL SCORE: Team_040 89, Team_085 130

SCORING BY QUARTER:
--------------------------------------------------------------------------------
Team                     Q1     Q2     Q3     Q4    FINAL
--------------------------------------------------------------------------------
Team_040                 14     31     18     26       89
Team_085                 38     30     34     28      130
--------------------------------------------------------------------------------

FULL GAME BOX SCORE:
================================================================================

Team_040
--------------------------------------------------------------------------------
Player                MIN  PTS  REB  AST  TO      FG   FG%      3P   3P%      FT STL BLK
--------------------------------------------------------------------------------
Shaquille Bane         37   16    6    1   1   5/13   38.5   2/7    28.6   7/11    0   1
Carmelo Murray         37   10    0    2   3   5/18   27.8   2/10   20.0   2/3     0   0
Dirk Johnson           37   16   11    2   2   8/10   80.0   2/2   100.0   5/9     0   0
Bam Gobert             37   15   11    0   2   5/8    62.5   1/1   100.0   6/6     0   0
Ayo Rose               25    5    0    2   2   2/5    40.0   1/3    33.3   0/0     0   0
Cole O'Neal            24    4    1    3   1   3/10   30.0   0/1     0.0   3/6     0   0
Tracy Middleton        11    8    0    0   0   4/6    66.7   2/3    66.7   1/2     0   0
Klay Leonard           11    0    3    0   1   0/0     0.0   0/0     0.0   0/0     0   0
RJ Curry               11    7    5    2   0   2/2   100.0   0/0     0.0   5/5     0   0
Josh Banchero          11    4    2    0   0   2/4    50.0   0/0     0.0   2/2     0   0

TEAM: FG: 38/78 (48.7%), 3PT: 10/27 (37.0%), REB: 38 (8 off, 30 def), AST: 12, TO: 12


Team_085
--------------------------------------------------------------------------------
Player                MIN  PTS  REB  AST  TO      FG   FG%      3P   3P%      FT STL BLK
--------------------------------------------------------------------------------
Larry Duncan           40   24   13    6   0   8/10   80.0   5/6    83.3   2/2     3   1
Paul Wagner            40   29   17    1   0  13/16   81.2   1/2    50.0   3/6     1   1
Stephen Bird           37   13    0    3   0   5/12   41.7   0/4     0.0   2/2     0   0
Collin Mobley          37   20    5    4   0  11/16   68.8   0/1     0.0   8/11    1   0
Magic Beal             27   14    0    4   1   5/9    55.6   3/6    50.0   1/1     0   1
Khris Brogdon          21   11    1    2   1   5/9    55.6   1/3    33.3   0/0     0   0
Jordan Morant          11    6    0    0   0   2/3    66.7   2/3    66.7   0/0     0   0
Malcolm Beal           11    8    8    2   0   3/5    60.0   0/1     0.0   2/2     0   0
Giannis Johnson         9    3    2    0   0   1/3    33.3   0/1     0.0   0/0     0   0
Jalen Leonard           9    2    3    2   0   2/3    66.7   0/0     0.0   0/0     0   1

TEAM: FG: 55/86 (64.0%), 3PT: 12/27 (44.4%), REB: 50 (12 off, 38 def), AST: 24, TO: 2

================================================================================
