================================================================================
                        FULL GAME - Team_019 vs Team_043                        
================================================================================

================================================================================
                       1ST QUARTER - Team_019 vs Team_043                       
================================================================================

[12:00] Team_019 possession (Score: 0-0)
Tobias Hyland attempts a 3Pt. Contested by Manu Carter (4.2 feet, MAN). Tobias Hyland misses. Rebound secured by Dwyane Dosunmu.

[11:44] Team_043 possession (Score: 0-0)
Manu Carter attempts a Layup. Wide open! Tobias Hyland is 6.1 feet away. [MAN] MANU CARTER MAKES IT!
Score: 0-2

[11:26] Team_019 possession (Score: 0-2)
D'Angelo Randle drives, picks up D'Angelo Iverson. Help arrives from Malcolm Murray! D'Angelo Randle attempts a Layup. Contested by Malcolm Murray (3.1 feet, MAN). D'ANGELO RANDLE MAKES IT!
Score: 2-2

[11:07] Team_043 possession (Score: 2-2)
D'Angelo Iverson attempts a Midrange. Contested by D'Angelo Randle (3.7 feet, ZONE). D'Angelo Iverson misses. Rebound secured by DeMar James.

[10:51] Team_019 possession (Score: 2-2)
Tobias Hyland attempts a Midrange. Contested by D'Angelo Iverson (2.9 feet, ZONE). Tobias Hyland misses. Rebound secured by D'Angelo Iverson.

[10:34] Team_043 possession (Score: 2-2)
Manu Carter attempts a Midrange. Wide open! Tobias Hyland is 6.1 feet away. [MAN] Manu Carter misses. Offensive rebound by Manu Carter! Manu Carter kicks it out.

[10:20] Team_043 possession (Score: 2-2)
Magic Durant attempts a Midrange. Contested by Brandon James (5.1 feet, MAN). MAGIC DURANT MAKES IT! Assist: Manu Carter
Score: 2-4

[10:09] Team_019 possession (Score: 2-4)
Brandon James attempts a Midrange. Contested by Magic Durant (5.1 feet, MAN). Brandon James misses. Rebound secured by D'Angelo Iverson.

[09:53] Team_043 possession (Score: 2-4)
Manu Carter attempts a 3Pt. Contested by D'Angelo Randle (4.1 feet, ZONE). Manu Carter misses. Rebound secured by D'Angelo Randle.

[09:42] Team_019 possession (Score: 2-4)
D'Angelo Randle attempts a Midrange. Contested by D'Angelo Iverson (3.1 feet, ZONE). D'Angelo Randle misses. Rebound secured by Manu Carter.

[09:31] Team_043 possession (Score: 2-4)
FOUL! Shooting foul on D'Angelo Randle. D'Angelo Iverson to the line for 2 free throws. [Team fouls: 1] (D'Angelo Randle: 1 personal fouls)   FT 1/2: MISS   FT 2/2: GOOD D'Angelo Iverson makes 1/2 from the line.
Score: 2-5

[09:17] Team_019 possession (Score: 2-5)
Rudy Giddey attempts a 3Pt. Contested by D'Angelo Iverson (3.1 feet, ZONE). Rudy Giddey misses. Offensive rebound by D'Angelo Randle! D'Angelo Randle puts it back in!
Score: 4-5

[09:05] Team_043 possession (Score: 4-5)
Malcolm Murray attempts a 3Pt. Contested by Rudy Giddey (5.4 feet, MAN). Malcolm Murray misses. Rebound secured by D'Angelo Randle.

[08:54] Team_019 possession (Score: 4-5)
D'Angelo Randle makes the Dunk and draws the foul on Manu Carter! And-1! D'Angelo Randle to the line for 1. [Team fouls: 1] (Manu Carter: 1 personal fouls)   FT 1/1: GOOD D'Angelo Randle makes 1/1 from the line.
Score: 7-5

[08:39] Team_043 possession (Score: 7-5)
Magic Durant drives, picks up Brandon James. Help arrives from D'Angelo Randle! Magic Durant attempts a Layup. Contested by D'Angelo Randle (5.1 feet, MAN). MAGIC DURANT MAKES IT!
Score: 7-7

[08:24] Team_019 possession (Score: 7-7)
DeMar James drives and kicks out. DeMar James attempts a Midrange. Contested by Magic Durant (5.1 feet, ZONE). DEMAR JAMES MAKES IT! Assist: Rudy Giddey
Score: 9-7

[08:06] Team_043 possession (Score: 9-7)
Magic Durant attempts a Layup. Contested by Brandon James (5.1 feet, MAN). MAGIC DURANT MAKES IT!
Score: 9-9

[07:55] Team_019 possession (Score: 9-9)
D'Angelo Randle throws a bad pass! Stolen by D'Angelo Iverson! TURNOVER! (live ball)

[07:37] Team_043 possession (Score: 9-9)
D'Angelo Iverson drives, DeMar James stays with him. D'Angelo Iverson attempts a Dunk. Contested by DeMar James (4.3 feet, ZONE). D'Angelo Iverson misses. Rebound secured by Tobias Hyland.

[07:19] Team_019 possession (Score: 9-9)
Rudy Giddey attempts a Midrange. Contested by Malcolm Murray (3.9 feet, MAN). Rudy Giddey misses. Rebound secured by Dwyane Dosunmu.

[07:09] Team_043 possession (Score: 9-9)
Magic Durant attempts a Layup. Contested by Brandon James (5.1 feet, MAN). Magic Durant misses. Rebound secured by Tobias Hyland.

[06:54] Team_019 possession (Score: 9-9)
DeMar James drives and kicks out. Tobias Hyland attempts a 3Pt. Contested by Manu Carter (4.2 feet, MAN). Tobias Hyland misses. Offensive rebound by DeMar James! DeMar James's putback is no good. Rebound secured by Manu Carter.

[06:43] Team_043 possession (Score: 9-9)
Magic Durant attempts a 3Pt. Contested by Rudy Giddey (5.3 feet, ZONE). Magic Durant misses. Offensive rebound by Manu Carter! Manu Carter kicks it out.

[06:28] Team_043 possession (Score: 9-9)
Malcolm Murray attempts a 3Pt. Contested by Rudy Giddey (5.4 feet, MAN). Malcolm Murray misses. Offensive rebound by Manu Carter! Manu Carter kicks it out.

[06:15] Team_043 possession (Score: 9-9)
D'Angelo Iverson makes the Layup and draws the foul on D'Angelo Randle! And-1! D'Angelo Iverson to the line for 1. [Team fouls: 2] (D'Angelo Randle: 2 personal fouls)   FT 1/1: MISS D'Angelo Iverson makes 0/1 from the line. Rebound secured by DeMar James.
Score: 9-11

[06:03] Team_019 possession (Score: 9-11)
D'Angelo Randle throws a bad pass! Stolen by D'Angelo Iverson! TURNOVER! (live ball)

[05:53] Team_043 possession (Score: 9-11)
Malcolm Murray attempts a 3Pt. Contested by Rudy Giddey (5.4 feet, MAN). Malcolm Murray misses. Rebound secured by Tobias Hyland.

[05:41] Team_019 possession (Score: 9-11)
Tobias Hyland attempts a Midrange. Contested by Manu Carter (4.2 feet, MAN). Tobias Hyland misses. Rebound secured by Dwyane Dosunmu.

[05:26] Team_043 possession (Score: 9-11)
Dwyane Dosunmu drives to the basket... Dwyane Dosunmu throws a bad pass out of bounds! TURNOVER! (dead ball)

[05:13] Team_019 possession (Score: 9-11)
DeMar James drives to the basket... DeMar James loses the ball! Stripped by Manu Carter! TURNOVER! (live ball)

[05:02] Team_043 possession (Score: 9-11)
Dwyane Dosunmu makes the Layup and draws the foul on DeMar James! And-1! Dwyane Dosunmu to the line for 1. [Team fouls: 3] (DeMar James: 1 personal fouls)   FT 1/1: GOOD Dwyane Dosunmu makes 1/1 from the line.
Score: 9-14

[04:52] Team_019 possession (Score: 9-14)
Rudy Giddey attempts a 3Pt. Contested by D'Angelo Iverson (3.2 feet, ZONE). Rudy Giddey misses. Rebound secured by D'Angelo Iverson.

[04:35] Team_043 possession (Score: 9-14)
Malcolm Murray attempts a 3Pt. Contested by D'Angelo Randle (3.8 feet, ZONE). Malcolm Murray misses. Rebound secured by D'Angelo Randle.

[04:24] Team_019 possession (Score: 9-14)
D'Angelo Randle attempts a 3Pt. Contested by D'Angelo Iverson (3.2 feet, MAN). D'Angelo Randle misses. Rebound secured by Dwyane Dosunmu.

[04:11] Team_043 possession (Score: 9-14)
D'Angelo Iverson makes the Layup and draws the foul on Brandon James! And-1! D'Angelo Iverson to the line for 1. [Team fouls: 4] (Brandon James: 1 personal fouls)   FT 1/1: GOOD D'Angelo Iverson makes 1/1 from the line.
Score: 9-17

[03:56] Team_019 possession (Score: 9-17)
Rudy Giddey attempts a 3Pt. Contested by D'Angelo Iverson (3.2 feet, ZONE). Rudy Giddey misses. Rebound secured by D'Angelo Iverson.

[03:43] Team_043 possession (Score: 9-17)
Dwyane Dosunmu attempts a Layup. Contested by DeMar James (4.5 feet, ZONE). Dwyane Dosunmu misses. Rebound secured by Tobias Hyland.

[03:27] Team_019 possession (Score: 9-17)
Rudy Giddey attempts a 3Pt. Contested by D'Angelo Iverson (3.3 feet, ZONE). Rudy Giddey misses. Rebound secured by Manu Carter.

[03:10] Team_043 possession (Score: 9-17)
Manu Carter attempts a 3Pt. Wide open! Tobias Hyland is 6.3 feet away. [MAN] Manu Carter misses. Rebound secured by DeMar James.

[02:58] Team_019 possession (Score: 9-17)
Rudy Giddey attempts a 3Pt. Contested by D'Angelo Iverson (3.3 feet, ZONE). Rudy Giddey misses. Rebound secured by D'Angelo Iverson.

[02:40] Team_043 possession (Score: 9-17)
Malcolm Murray makes the Layup and draws the foul on DeMar James! And-1! Malcolm Murray to the line for 1. [BONUS: 5 team fouls] (DeMar James: 2 personal fouls)   FT 1/1: GOOD Malcolm Murray makes 1/1 from the line.
Score: 9-20

[02:27] Team_019 possession (Score: 9-20)
FOUL! Holding foul on Magic Durant. [Team fouls: 2] No free throws, side out. (Magic Durant: 1 personal fouls)

[02:10] Team_019 possession (Score: 9-20)
DeMar James attempts a 3Pt. Contested by D'Angelo Iverson (3.5 feet, ZONE). DeMar James misses. Rebound secured by Dwyane Dosunmu.

[01:53] Team_043 possession (Score: 9-20)
Manu Carter attempts a 3Pt. Wide open! Tobias Hyland is 6.4 feet away. [MAN] MANU CARTER MAKES IT! Assist: Malcolm Murray
Score: 9-23

[01:38] Team_019 possession (Score: 9-23)
Rudy Giddey drives and kicks out. Rudy Giddey attempts a 3Pt. Contested by D'Angelo Iverson (3.3 feet, ZONE). Rudy Giddey misses. Rebound secured by Manu Carter.

[01:25] Team_043 possession (Score: 9-23)
Malcolm Murray drives and kicks out. Malcolm Murray attempts a Midrange. Contested by Rudy Giddey (5.7 feet, MAN). MALCOLM MURRAY MAKES IT!
Score: 9-25

[01:10] Team_019 possession (Score: 9-25)
Tobias Hyland attempts a Layup. Contested by Manu Carter (4.6 feet, ZONE). Tobias Hyland misses. Rebound secured by Dwyane Dosunmu.

[00:57] Team_043 possession (Score: 9-25)
Manu Carter attempts a Midrange. Wide open! Tobias Hyland is 6.5 feet away. [MAN] MANU CARTER MAKES IT!
Score: 9-27

[00:44] Team_019 possession (Score: 9-27)
Rudy Giddey attempts a 3Pt. Contested by D'Angelo Iverson (3.6 feet, ZONE). Rudy Giddey misses. Rebound secured by D'Angelo Iverson.

[00:32] Team_043 possession (Score: 9-27)
D'Angelo Iverson attempts a 3Pt. Contested by D'Angelo Randle (4.3 feet, ZONE). D'Angelo Iverson misses. Rebound secured by DeMar James.

[00:16] Team_019 possession (Score: 9-27)
D'Angelo Randle attempts a Layup. Contested by D'Angelo Iverson (3.6 feet, MAN). D'ANGELO RANDLE MAKES IT! Assist: Tobias Hyland
Score: 11-27

================================================================================
                              1ST QUARTER COMPLETE                              
================================================================================

1ST QUARTER SCORE: Team_019 11, Team_043 27

BOX SCORE:
================================================================================

Team_019
--------------------------------------------------------------------------------
Player                MIN  PTS  REB  AST  TO      FG   FG%      3P   3P%
--------------------------------------------------------------------------------
D'Angelo Randle        12    9    4    0   0   4/6    66.7     0/0   0.0
DeMar James            12    2    4    0   0   1/3    33.3     0/0   0.0
Tobias Hyland          12    0    4    1   0   0/4     0.0     0/0   0.0
Brandon James          12    0    0    0   0   0/1     0.0     0/0   0.0
Rudy Giddey            12    0    0    1   0   0/7     0.0     0/0   0.0

TEAM: FG: 5/21 (23.8%), 3PT: 1/9 (11.1%), REB: 13 (2 off, 11 def), AST: 2, TO: 3
TEAM FOULS: 5 [Team_043 in BONUS]


Team_043
--------------------------------------------------------------------------------
Player                MIN  PTS  REB  AST  TO      FG   FG%      3P   3P%
--------------------------------------------------------------------------------
Manu Carter            12    7    7    1   0   3/5    60.0     0/0   0.0
Magic Durant           12    6    0    0   0   3/4    75.0     0/0   0.0
Malcolm Murray         12    5    0    1   0   2/5    40.0     0/0   0.0
D'Angelo Iverson       12    4    6    0   0   2/6    33.3     0/0   0.0
Dwyane Dosunmu         12    3    6    0   0   1/2    50.0     0/0   0.0

TEAM: FG: 11/22 (50.0%), 3PT: 1/7 (14.3%), REB: 18 (3 off, 15 def), AST: 2, TO: 1
TEAM FOULS: 2

================================================================================

================================================================================
                       2ND QUARTER - Team_019 vs Team_043                       
================================================================================

[12:00] Team_019 possession (Score: 11-27)
Rudy Giddey attempts a Midrange. Contested by D'Angelo Iverson (3.4 feet, ZONE). RUDY GIDDEY MAKES IT!
Score: 13-27

[11:46] Team_043 possession (Score: 13-27)
Dwyane Dosunmu attempts a Layup. Contested by DeMar James (4.7 feet, ZONE). Dwyane Dosunmu misses. Offensive rebound by Manu Carter! Manu Carter kicks it out.

[11:33] Team_043 possession (Score: 13-27)
Dwyane Dosunmu commits a violation (traveling/carry)! TURNOVER! (dead ball)

[11:33] Substitution (Team_019): Rudy Giddey OUT → Gary Ginobili IN (stamina_rule2)

[11:33] Substitution (Team_019): Brandon James OUT → Jalen Turner IN (stamina_rule2)

[11:33] Substitution (Team_019): D'Angelo Randle OUT → Blake LaVine IN (stamina_rule2)

[11:33] Substitution (Team_019): Tobias Hyland OUT → Shai Ingram IN (stamina_rule2)

[11:33] Substitution (Team_019): DeMar James OUT → Tim Jordan IN (stamina_rule2)

[11:33] Substitution (Team_043): Malcolm Murray OUT → Jabari Holiday IN (stamina_rule2)

[11:33] Substitution (Team_043): Magic Durant OUT → Ben LaVine IN (stamina_rule2)

[11:33] Substitution (Team_043): D'Angelo Iverson OUT → Dirk Herro IN (stamina_rule2)

[11:33] Substitution (Team_043): Manu Carter OUT → Joel Murray IN (stamina_rule2)

[11:33] Substitution (Team_043): Dwyane Dosunmu OUT → Terry Randle IN (stamina_rule2)

[11:23] Team_019 possession (Score: 13-27)
Gary Ginobili drives to the basket... FOUL! Offensive foul on Gary Ginobili! Jabari Holiday drew the charge! [Team fouls: 1] (Gary Ginobili: 1 personal fouls) TURNOVER! (dead ball)

[11:07] Team_043 possession (Score: 13-27)
Dirk Herro drives to the basket... Dirk Herro throws a bad pass out of bounds! TURNOVER! (dead ball)

[10:48] Team_019 possession (Score: 13-27)
Shai Ingram attempts a Layup. BLOCKED BY BEN LAVINE! Ball is loose! Rebound secured by Terry Randle.

[10:33] Team_043 possession (Score: 13-27)
Dirk Herro drives, picks up Shai Ingram. Help arrives from Jalen Turner! Dirk Herro attempts a Dunk. Contested by Jalen Turner (4.8 feet, ZONE). DIRK HERRO MAKES IT! Assist: Jabari Holiday
Score: 13-29

[10:17] Team_019 possession (Score: 13-29)
Shai Ingram attempts a Layup. Contested by Joel Murray (5.7 feet, MAN). Shai Ingram misses. Rebound secured by Terry Randle.

[10:03] Team_043 possession (Score: 13-29)
Dirk Herro attempts a Layup. BLOCKED BY SHAI INGRAM! Ball deflects out of bounds off Dirk Herro.

[09:45] Team_019 possession (Score: 13-29)
Gary Ginobili attempts a 3Pt. Contested by Dirk Herro (4.5 feet, ZONE). Gary Ginobili misses. Rebound secured by Ben LaVine.

[09:31] Team_043 possession (Score: 13-29)
Jabari Holiday loses the ball! Stripped by Gary Ginobili! TURNOVER! (live ball)

[09:11] Team_019 possession (Score: 13-29)
Gary Ginobili attempts a 3Pt. Contested by Jabari Holiday (5.0 feet, MAN). Gary Ginobili misses. Rebound secured by Dirk Herro.

[09:02] Team_043 possession (Score: 13-29)
Ben LaVine attempts a 3Pt. Wide open! Gary Ginobili is 6.2 feet away. [ZONE] BEN LAVINE MAKES IT! Assist: Joel Murray
Score: 13-32

[08:46] Team_019 possession (Score: 13-32)
Gary Ginobili attempts a Layup. Contested by Jabari Holiday (5.0 feet, MAN). GARY GINOBILI MAKES IT! Assist: Shai Ingram
Score: 15-32

[08:33] Team_043 possession (Score: 15-32)
Ben LaVine attempts a Layup. Contested by Jalen Turner (4.3 feet, MAN). BEN LAVINE MAKES IT! Assist: Joel Murray
Score: 15-34

[08:19] Team_019 possession (Score: 15-34)
Shai Ingram attempts a 3Pt. Contested by Joel Murray (5.7 feet, MAN). Shai Ingram misses. Rebound secured by Terry Randle.

[08:07] Team_043 possession (Score: 15-34)
Jabari Holiday attempts a 3Pt. Contested by Blake LaVine (5.2 feet, ZONE). Jabari Holiday misses. Rebound secured by Blake LaVine.

[07:55] Team_019 possession (Score: 15-34)
FOUL! Shooting foul on Joel Murray. Shai Ingram to the line for 2 free throws. [Team fouls: 1] (Joel Murray: 1 personal fouls)   FT 1/2: GOOD   FT 2/2: GOOD Shai Ingram makes 2/2 from the line.
Score: 17-34

[07:41] Team_043 possession (Score: 17-34)
Dirk Herro drives and kicks out. Dirk Herro attempts a 3Pt. Contested by Blake LaVine (4.7 feet, ZONE). Dirk Herro misses. Rebound secured by Shai Ingram.

[07:23] Team_019 possession (Score: 17-34)
Blake LaVine attempts a 3Pt. Contested by Dirk Herro (4.1 feet, ZONE). Blake LaVine misses. Rebound secured by Ben LaVine.

[07:12] Team_043 possession (Score: 17-34)
Jabari Holiday attempts a Midrange. Contested by Shai Ingram (5.0 feet, ZONE). Jabari Holiday misses. Rebound secured by Blake LaVine.

[06:57] Team_019 possession (Score: 17-34)
Blake LaVine attempts a 3Pt. Contested by Dirk Herro (4.1 feet, ZONE). Blake LaVine misses. Rebound secured by Ben LaVine.

[06:38] Team_043 possession (Score: 17-34)
Ben LaVine attempts a Layup. Contested by Shai Ingram (4.9 feet, ZONE). Ben LaVine misses. Rebound secured by Blake LaVine.

[06:26] Team_019 possession (Score: 17-34)
FOUL! Holding foul on Dirk Herro. [Team fouls: 2] No free throws, side out. (Dirk Herro: 1 personal fouls)

[06:13] Team_019 possession (Score: 17-34)
Gary Ginobili attempts a Midrange. Contested by Jabari Holiday (5.0 feet, MAN). Gary Ginobili misses. Rebound secured by Dirk Herro.

[05:57] Team_043 possession (Score: 17-34)
Jabari Holiday attempts a 3Pt. Wide open! Gary Ginobili is 6.3 feet away. [MAN] Jabari Holiday misses. Rebound secured by Shai Ingram.

[05:45] Team_019 possession (Score: 17-34)
Tim Jordan attempts a 3Pt. Contested by Terry Randle (4.3 feet, MAN). TIM JORDAN MAKES IT! Assist: Gary Ginobili
Score: 20-34

[05:30] Team_043 possession (Score: 20-34)
Terry Randle makes the Layup and draws the foul on Shai Ingram! And-1! Terry Randle to the line for 1. [Team fouls: 2] (Shai Ingram: 1 personal fouls)   FT 1/1: GOOD Terry Randle makes 1/1 from the line.
Score: 20-37

[05:14] Team_019 possession (Score: 20-37)
FOUL! Reach-in foul on Terry Randle during the drive. [Team fouls: 3] No free throws, side out. (Terry Randle: 1 personal fouls)

[04:59] Team_019 possession (Score: 20-37)
Jalen Turner attempts a 3Pt. Contested by Ben LaVine (5.3 feet, MAN). JALEN TURNER MAKES IT! Assist: Blake LaVine
Score: 23-37

[04:42] Team_043 possession (Score: 23-37)
Dirk Herro makes the Layup and draws the foul on Blake LaVine! And-1! Dirk Herro to the line for 1. [Team fouls: 3] (Blake LaVine: 1 personal fouls)   FT 1/1: GOOD Dirk Herro makes 1/1 from the line.
Score: 23-40

[04:23] Team_019 possession (Score: 23-40)
Jalen Turner makes the Layup and draws the foul on Ben LaVine! And-1! Jalen Turner to the line for 1. [Team fouls: 4] (Ben LaVine: 1 personal fouls)   FT 1/1: GOOD Jalen Turner makes 1/1 from the line.
Score: 26-40

[04:06] Team_043 possession (Score: 26-40)
Jabari Holiday makes the Dunk and draws the foul on Shai Ingram! And-1! Jabari Holiday to the line for 1. [Team fouls: 4] (Shai Ingram: 2 personal fouls)   FT 1/1: GOOD Jabari Holiday makes 1/1 from the line.
Score: 26-43

[03:55] Team_019 possession (Score: 26-43)
Gary Ginobili drives and kicks out. Tim Jordan attempts a Midrange. Contested by Terry Randle (4.4 feet, MAN). TIM JORDAN MAKES IT! Assist: Shai Ingram
Score: 28-43

[03:40] Team_043 possession (Score: 28-43)
Jabari Holiday drives, Shai Ingram stays with him. Jabari Holiday attempts a Layup. Contested by Shai Ingram (5.1 feet, ZONE). JABARI HOLIDAY MAKES IT!
Score: 28-45

[03:25] Team_019 possession (Score: 28-45)
Gary Ginobili attempts a Layup. BLOCKED BY TERRY RANDLE! Ball is loose! Rebound secured by Dirk Herro.

[03:12] Team_043 possession (Score: 28-45)
FOUL! Reach-in foul on Shai Ingram during the drive. [IN THE BONUS! 5 team fouls] Terry Randle to the line for 2 free throws. (Shai Ingram: 3 personal fouls)   FT 1/2: GOOD   FT 2/2: GOOD Terry Randle makes 2/2 from the line.
Score: 28-47

[02:58] Team_019 possession (Score: 28-47)
Blake LaVine attempts a 3Pt. BLOCKED BY DIRK HERRO! Ball is loose! Rebound secured by Ben LaVine.

[02:45] Team_043 possession (Score: 28-47)
FOUL! Reach-in foul on Shai Ingram during the drive. [IN THE BONUS! 6 team fouls] Terry Randle to the line for 2 free throws. (Shai Ingram: 4 personal fouls)   FT 1/2: GOOD   FT 2/2: GOOD Terry Randle makes 2/2 from the line.
Score: 28-49

[02:35] Team_019 possession (Score: 28-49)
Jalen Turner drives, picks up Terry Randle. Help arrives from Ben LaVine! Jalen Turner attempts a Dunk. Contested by Ben LaVine (4.7 feet, ZONE). JALEN TURNER MAKES IT!
Score: 30-49

[02:22] Team_043 possession (Score: 30-49)
Jabari Holiday drives, picks up Gary Ginobili. Help arrives from Jalen Turner! Jabari Holiday attempts a Layup. Wide open! Jalen Turner is 6.5 feet away. [MAN] JABARI HOLIDAY MAKES IT!
Score: 30-51

[02:12] Team_019 possession (Score: 30-51)
Gary Ginobili attempts a Midrange. Contested by Jabari Holiday (5.3 feet, MAN). GARY GINOBILI MAKES IT!
Score: 32-51

[01:56] Team_043 possession (Score: 32-51)
Jabari Holiday drives, Shai Ingram stays with him. Jabari Holiday attempts a Dunk. Contested by Shai Ingram (5.3 feet, ZONE). JABARI HOLIDAY MAKES IT! Assist: Ben LaVine
Score: 32-53

[01:40] Team_019 possession (Score: 32-53)
Gary Ginobili drives and kicks out. Gary Ginobili attempts a 3Pt. Contested by Jabari Holiday (4.9 feet, MAN). Gary Ginobili misses. FOUL! Loose ball foul on Ben LaVine during the rebound battle. [IN THE BONUS! 5 team fouls] Tim Jordan to the line for 2 free throws. (Ben LaVine: 2 personal fouls)   FT 1/2: GOOD   FT 2/2: GOOD Tim Jordan makes 2/2 from the line.
Score: 34-53

[01:24] Team_043 possession (Score: 34-53)
Dirk Herro attempts a 3Pt. Contested by Blake LaVine (5.3 feet, MAN). Dirk Herro misses. Rebound secured by Blake LaVine.

[01:14] Team_019 possession (Score: 34-53)
Tim Jordan attempts a Midrange. Contested by Dirk Herro (4.2 feet, ZONE). Tim Jordan misses. Rebound secured by Ben LaVine.

[01:00] Team_043 possession (Score: 34-53)
Jabari Holiday drives, picks up Gary Ginobili. Help arrives from Jalen Turner! Jabari Holiday attempts a Layup. Wide open! Jalen Turner is 6.6 feet away. [MAN] Jabari Holiday misses. Offensive rebound by Dirk Herro! Dirk Herro puts it back in!
Score: 34-55

[00:46] Team_019 possession (Score: 34-55)
Tim Jordan drives to the basket... Tim Jordan loses the ball! Stripped by Terry Randle! TURNOVER! (live ball)

[00:27] Team_043 possession (Score: 34-55)
Ben LaVine drives and kicks out. Terry Randle attempts a Midrange. Contested by Shai Ingram (5.0 feet, MAN). Terry Randle misses. FOUL! Loose ball foul on Tim Jordan during the rebound battle. [IN THE BONUS! 7 team fouls] Terry Randle to the line for 2 free throws. (Tim Jordan: 1 personal fouls)   FT 1/2: GOOD   FT 2/2: GOOD Terry Randle makes 2/2 from the line.
Score: 34-57

[00:13] Team_019 possession (Score: 34-57)
Shai Ingram makes the Dunk and draws the foul on Ben LaVine! And-1! Shai Ingram to the line for 1. [BONUS: 6 team fouls] (Ben LaVine: 3 personal fouls)   FT 1/1: GOOD Shai Ingram makes 1/1 from the line.
Score: 37-57

================================================================================
                              2ND QUARTER COMPLETE                              
================================================================================

2ND QUARTER SCORE: Team_019 26, Team_043 30

BOX SCORE:
================================================================================

Team_019
--------------------------------------------------------------------------------
Player                MIN  PTS  REB  AST  TO      FG   FG%      3P   3P%
--------------------------------------------------------------------------------
Jalen Turner           11    8    0    0   0   3/3   100.0     0/0   0.0
Tim Jordan             11    7    0    0   0   3/4    75.0     0/0   0.0
Shai Ingram            11    5    2    2   0   2/5    40.0     0/0   0.0
Gary Ginobili          11    4    0    1   0   2/6    33.3     0/0   0.0
Rudy Giddey            13    2    0    0   0   1/1   100.0     0/0   0.0
Blake LaVine           11    0    4    1   0   0/3     0.0     0/0   0.0

TEAM: FG: 11/22 (50.0%), 3PT: 2/8 (25.0%), REB: 6 (0 off, 6 def), AST: 4, TO: 2
TEAM FOULS: 7 [Team_043 in BONUS]


Team_043
--------------------------------------------------------------------------------
Player                MIN  PTS  REB  AST  TO      FG   FG%      3P   3P%
--------------------------------------------------------------------------------
Terry Randle           11    9    3    0   0   4/4   100.0     0/0   0.0
Jabari Holiday         11    9    0    1   0   4/7    57.1     0/0   0.0
Dirk Herro             11    7    4    0   0   3/6    50.0     0/0   0.0
Ben LaVine             11    5    5    1   0   2/3    66.7     0/0   0.0
Manu Carter            13    0    1    0   0   0/0     0.0     0/0   0.0
Joel Murray            11    0    0    2   0   0/0     0.0     0/0   0.0

TEAM: FG: 13/20 (65.0%), 3PT: 1/4 (25.0%), REB: 13 (2 off, 11 def), AST: 4, TO: 3
TEAM FOULS: 6 [Team_019 in BONUS]

================================================================================

================================================================================
                       3RD QUARTER - Team_019 vs Team_043                       
================================================================================

[12:00] Team_019 possession (Score: 37-57)
Rudy Giddey attempts a 3Pt. Contested by Malcolm Murray (3.9 feet, MAN). Rudy Giddey misses. Rebound secured by Manu Carter.

[11:43] Team_043 possession (Score: 37-57)
Manu Carter attempts a 3Pt. Wide open! Tobias Hyland is 6.1 feet away. [MAN] MANU CARTER MAKES IT! Assist: Magic Durant
Score: 37-60

[11:28] Team_019 possession (Score: 37-60)
D'Angelo Randle drives, D'Angelo Iverson stays with him. D'Angelo Randle attempts a Layup. Contested by D'Angelo Iverson (3.1 feet, MAN). D'ANGELO RANDLE MAKES IT! Assist: Rudy Giddey
Score: 39-60

[11:14] Team_043 possession (Score: 39-60)
Dwyane Dosunmu drives, DeMar James stays with him. Dwyane Dosunmu attempts a Dunk. Contested by DeMar James (4.3 feet, MAN). Dwyane Dosunmu misses. Rebound secured by DeMar James.

[10:57] Team_019 possession (Score: 39-60)
Brandon James attempts a Layup. Contested by Magic Durant (5.1 feet, MAN). Brandon James misses. Rebound secured by Manu Carter.

[10:43] Team_043 possession (Score: 39-60)
D'Angelo Iverson drives, picks up DeMar James. Help arrives from Brandon James! D'Angelo Iverson attempts a Layup. Contested by Brandon James (4.3 feet, ZONE). D'ANGELO IVERSON MAKES IT!
Score: 39-62

[10:28] Team_019 possession (Score: 39-62)
FOUL! Reach-in foul on Magic Durant during the drive. [Team fouls: 1] No free throws, side out. (Magic Durant: 1 personal fouls)

[10:15] Team_019 possession (Score: 39-62)
FOUL! Reach-in foul on Malcolm Murray during the drive. [Team fouls: 2] No free throws, side out. (Malcolm Murray: 1 personal fouls)

[10:00] Team_019 possession (Score: 39-62)
DeMar James drives, Manu Carter stays with him. DeMar James attempts a Layup. Contested by Manu Carter (4.5 feet, ZONE). DeMar James misses. Rebound secured by Manu Carter.

[09:48] Team_043 possession (Score: 39-62)
Dwyane Dosunmu attempts a Midrange. Contested by DeMar James (4.3 feet, MAN). Dwyane Dosunmu misses. Rebound secured by Tobias Hyland.

[09:35] Team_019 possession (Score: 39-62)
D'Angelo Randle drives, picks up Manu Carter. Help arrives from Malcolm Murray! D'Angelo Randle attempts a Layup. Contested by Malcolm Murray (4.4 feet, ZONE). D'ANGELO RANDLE MAKES IT! Assist: Tobias Hyland
Score: 41-62

[09:25] Team_043 possession (Score: 41-62)
Dwyane Dosunmu attempts a 3Pt. Contested by DeMar James (4.3 feet, MAN). Dwyane Dosunmu misses. Offensive rebound by Manu Carter! Manu Carter kicks it out.

[09:10] Team_043 possession (Score: 41-62)
Malcolm Murray drives and kicks out. Manu Carter attempts a 3Pt. Contested by D'Angelo Randle (3.6 feet, ZONE). Manu Carter misses. Rebound secured by DeMar James.

[08:56] Team_019 possession (Score: 41-62)
DeMar James drives, Manu Carter stays with him. DeMar James attempts a Dunk. Contested by Manu Carter (4.5 feet, MAN). DeMar James misses. Rebound secured by D'Angelo Iverson.

[08:39] Team_043 possession (Score: 41-62)
D'Angelo Iverson attempts a Layup. Contested by D'Angelo Randle (3.7 feet, MAN). D'Angelo Iverson misses. Rebound secured by Tobias Hyland.

[08:24] Team_019 possession (Score: 41-62)
DeMar James drives to the basket... DeMar James loses the ball! Stripped by Manu Carter! TURNOVER! (live ball)

[08:10] Team_043 possession (Score: 41-62)
Manu Carter attempts a Layup. Contested by DeMar James (4.7 feet, ZONE). MANU CARTER MAKES IT! Assist: Dwyane Dosunmu
Score: 41-64

[07:59] Team_019 possession (Score: 41-64)
Tobias Hyland attempts a 3Pt. Contested by Manu Carter (4.2 feet, MAN). Tobias Hyland misses. Rebound secured by Dwyane Dosunmu.

[07:46] Team_043 possession (Score: 41-64)
D'Angelo Iverson attempts a 3Pt. Contested by D'Angelo Randle (3.7 feet, ZONE). D'Angelo Iverson misses. Rebound secured by Tobias Hyland.

[07:31] Team_019 possession (Score: 41-64)
Brandon James drives to the basket... Brandon James throws a bad pass! Stolen by Magic Durant! TURNOVER! (live ball)

[07:18] Team_043 possession (Score: 41-64)
Magic Durant drives and kicks out. Magic Durant attempts a 3Pt. Contested by Brandon James (5.1 feet, MAN). Magic Durant misses. Offensive rebound by Manu Carter! Manu Carter kicks it out.

[07:05] Team_043 possession (Score: 41-64)
FOUL! Shooting foul on DeMar James. Dwyane Dosunmu to the line for 2 free throws. [Team fouls: 1] (DeMar James: 1 personal fouls)   FT 1/2: GOOD   FT 2/2: MISS Dwyane Dosunmu makes 1/2 from the line. Rebound secured by DeMar James.
Score: 41-65

[06:49] Team_019 possession (Score: 41-65)
DeMar James attempts a Layup. Contested by Manu Carter (4.5 feet, MAN). DEMAR JAMES MAKES IT!
Score: 43-65

[06:31] Team_043 possession (Score: 43-65)
Malcolm Murray makes the Layup and draws the foul on DeMar James! And-1! Malcolm Murray to the line for 1. [Team fouls: 2] (DeMar James: 2 personal fouls)   FT 1/1: GOOD Malcolm Murray makes 1/1 from the line.
Score: 43-68

[06:16] Team_019 possession (Score: 43-68)
Tobias Hyland attempts a Midrange. Contested by Magic Durant (5.1 feet, ZONE). TOBIAS HYLAND MAKES IT!
Score: 45-68

[05:57] Team_043 possession (Score: 45-68)
Malcolm Murray attempts a 3Pt. Contested by D'Angelo Randle (3.7 feet, ZONE). Malcolm Murray misses. Rebound secured by Tobias Hyland.

[05:45] Team_019 possession (Score: 45-68)
FOUL! Shooting foul on Magic Durant. Brandon James to the line for 2 free throws. [Team fouls: 3] (Magic Durant: 2 personal fouls)   FT 1/2: GOOD   FT 2/2: MISS Brandon James makes 1/2 from the line. Rebound secured by D'Angelo Iverson.
Score: 46-68

[05:28] Team_043 possession (Score: 46-68)
Malcolm Murray drives and kicks out. Magic Durant attempts a Midrange. Contested by Brandon James (5.1 feet, MAN). MAGIC DURANT MAKES IT!
Score: 46-70

[05:17] Team_019 possession (Score: 46-70)
DeMar James drives to the basket... DeMar James loses the ball! Stripped by Manu Carter! TURNOVER! (live ball)

[05:03] Team_043 possession (Score: 46-70)
Malcolm Murray attempts a 3Pt. Contested by Brandon James (5.2 feet, ZONE). Malcolm Murray misses. Rebound secured by D'Angelo Randle.

[04:50] Team_019 possession (Score: 46-70)
Brandon James makes the 3Pt and draws the foul on Malcolm Murray! And-1! Brandon James to the line for 1. [Team fouls: 4] (Malcolm Murray: 2 personal fouls)   FT 1/1: GOOD Brandon James makes 1/1 from the line.
Score: 50-70

[04:33] Team_043 possession (Score: 50-70)
Manu Carter attempts a Layup. Wide open! Tobias Hyland is 6.2 feet away. [ZONE] MANU CARTER MAKES IT! Assist: Malcolm Murray
Score: 50-72

[04:18] Team_019 possession (Score: 50-72)
Tobias Hyland attempts a 3Pt. Contested by Manu Carter (4.3 feet, MAN). Tobias Hyland misses. Rebound secured by Manu Carter.

[04:00] Team_043 possession (Score: 50-72)
Malcolm Murray attempts a 3Pt. Contested by Rudy Giddey (5.5 feet, MAN). Malcolm Murray misses. Offensive rebound by D'Angelo Iverson! D'Angelo Iverson kicks it out.

[03:46] Team_043 possession (Score: 50-72)
Magic Durant attempts a Midrange. Contested by Tobias Hyland (5.8 feet, ZONE). MAGIC DURANT MAKES IT!
Score: 50-74

[03:29] Team_019 possession (Score: 50-74)
D'Angelo Randle attempts a 3Pt. Contested by D'Angelo Iverson (3.3 feet, ZONE). D'Angelo Randle misses. Rebound secured by D'Angelo Iverson.

[03:11] Team_043 possession (Score: 50-74)
Manu Carter attempts a 3Pt. Wide open! Tobias Hyland is 6.3 feet away. [MAN] Manu Carter misses. Rebound secured by D'Angelo Randle.

[02:55] Team_019 possession (Score: 50-74)
D'Angelo Randle attempts a 3Pt. Contested by D'Angelo Iverson (3.3 feet, MAN). D'Angelo Randle misses. Offensive rebound by D'Angelo Randle! D'Angelo Randle kicks it out.

[02:38] Team_019 possession (Score: 50-74)
D'Angelo Randle drives to the basket... D'Angelo Randle loses the ball! Stripped by D'Angelo Iverson! TURNOVER! (live ball)

[02:26] Team_043 possession (Score: 50-74)
Magic Durant attempts a 3Pt. Contested by Brandon James (5.3 feet, MAN). Magic Durant misses. Rebound secured by Tobias Hyland.

[02:12] Team_019 possession (Score: 50-74)
Brandon James attempts a 3Pt. Contested by D'Angelo Iverson (3.2 feet, ZONE). Brandon James misses. Rebound secured by Dwyane Dosunmu.

[01:55] Team_043 possession (Score: 50-74)
D'Angelo Iverson makes the Layup and draws the foul on D'Angelo Randle! And-1! D'Angelo Iverson to the line for 1. [Team fouls: 3] (D'Angelo Randle: 1 personal fouls)   FT 1/1: GOOD D'Angelo Iverson makes 1/1 from the line.
Score: 50-77

[01:45] Team_019 possession (Score: 50-77)
Rudy Giddey attempts a Midrange. Contested by Magic Durant (5.6 feet, ZONE). Rudy Giddey misses. Rebound secured by Dwyane Dosunmu.

[01:34] Team_043 possession (Score: 50-77)
Malcolm Murray attempts a Midrange. Contested by Brandon James (5.5 feet, ZONE). MALCOLM MURRAY MAKES IT!
Score: 50-79

[01:22] Team_019 possession (Score: 50-79)
DeMar James makes the Layup and draws the foul on Manu Carter! And-1! DeMar James to the line for 1. [BONUS: 5 team fouls] (Manu Carter: 1 personal fouls)   FT 1/1: GOOD DeMar James makes 1/1 from the line.
Score: 53-79

[01:07] Team_043 possession (Score: 53-79)
Malcolm Murray drives and kicks out. Malcolm Murray attempts a 3Pt. Contested by Rudy Giddey (5.7 feet, MAN). Malcolm Murray misses. Rebound secured by DeMar James.

[00:56] Team_019 possession (Score: 53-79)
Rudy Giddey attempts a 3Pt. Contested by Malcolm Murray (4.3 feet, MAN). Rudy Giddey misses. FOUL! Loose ball foul on D'Angelo Iverson during the rebound battle. [IN THE BONUS! 6 team fouls] DeMar James to the line for 2 free throws. (D'Angelo Iverson: 1 personal fouls)   FT 1/2: GOOD   FT 2/2: GOOD DeMar James makes 2/2 from the line.
Score: 55-79

[00:40] Team_043 possession (Score: 55-79)
Dwyane Dosunmu makes the Layup and draws the foul on DeMar James! And-1! Dwyane Dosunmu to the line for 1. [Team fouls: 4] (DeMar James: 3 personal fouls)   FT 1/1: GOOD Dwyane Dosunmu makes 1/1 from the line.
Score: 55-82

[00:31] Team_019 possession (Score: 55-82)
Brandon James attempts a 3Pt. Contested by Magic Durant (5.6 feet, MAN). Brandon James misses. Rebound secured by Dwyane Dosunmu.

[00:18] Team_043 possession (Score: 55-82)
Magic Durant drives, Brandon James stays with him. Magic Durant attempts a Dunk. Contested by Brandon James (5.5 feet, MAN). Magic Durant misses. Rebound secured by D'Angelo Randle.

[00:02] Team_019 possession (Score: 55-82)
Rudy Giddey attempts a 3Pt. Contested by Malcolm Murray (4.4 feet, MAN). Rudy Giddey misses. Rebound secured by Manu Carter.

================================================================================
                              3RD QUARTER COMPLETE                              
================================================================================

3RD QUARTER SCORE: Team_019 18, Team_043 25

BOX SCORE:
================================================================================

Team_019
--------------------------------------------------------------------------------
Player                MIN  PTS  REB  AST  TO      FG   FG%      3P   3P%
--------------------------------------------------------------------------------
DeMar James            25    7    4    0   0   3/5    60.0     0/0   0.0
D'Angelo Randle        25    4    4    0   0   2/3    66.7     0/0   0.0
Brandon James          25    4    0    0   0   1/5    20.0     0/0   0.0
Tobias Hyland          25    2    5    1   0   1/3    33.3     0/0   0.0
Rudy Giddey            25    0    0    1   0   0/3     0.0     0/0   0.0

TEAM: FG: 7/19 (36.8%), 3PT: 2/9 (22.2%), REB: 13 (1 off, 12 def), AST: 2, TO: 4
TEAM FOULS: 4


Team_043
--------------------------------------------------------------------------------
Player                MIN  PTS  REB  AST  TO      FG   FG%      3P   3P%
--------------------------------------------------------------------------------
Manu Carter            25    7    7    0   0   3/4    75.0     0/0   0.0
D'Angelo Iverson       25    5    4    0   0   2/4    50.0     0/0   0.0
Malcolm Murray         25    5    0    1   0   2/6    33.3     0/0   0.0
Magic Durant           25    4    0    1   0   2/4    50.0     0/0   0.0
Dwyane Dosunmu         25    3    4    1   0   1/4    25.0     0/0   0.0

TEAM: FG: 10/22 (45.5%), 3PT: 1/6 (16.7%), REB: 15 (3 off, 12 def), AST: 3, TO: 0
TEAM FOULS: 6 [Team_019 in BONUS]

================================================================================

================================================================================
                       4TH QUARTER - Team_019 vs Team_043                       
================================================================================

[12:00] Substitution (Team_019): Rudy Giddey OUT (stamina: 69) → Gary Ginobili IN (comeback_detected)

[12:00] Substitution (Team_043): Malcolm Murray OUT (stamina: 69) → Jabari Holiday IN (comeback_detected)

[12:00] Team_019 possession (Score: 55-82)
Tobias Hyland attempts a Midrange. Contested by Manu Carter (4.5 feet, MAN). Tobias Hyland misses. Offensive rebound by DeMar James! DeMar James's putback is no good. Rebound secured by Manu Carter.

[11:47] Team_043 possession (Score: 55-82)
Jabari Holiday attempts a Midrange. Contested by D'Angelo Randle (4.5 feet, ZONE). Jabari Holiday misses. FOUL! Loose ball foul on Tobias Hyland during the rebound battle. [Team fouls: 1] No free throws, side out. (Tobias Hyland: 1 personal fouls)

[11:32] Team_043 possession (Score: 55-82)
Manu Carter attempts a 3Pt. Wide open! Tobias Hyland is 6.5 feet away. [MAN] Manu Carter misses. Rebound secured by D'Angelo Randle.

[11:20] Team_019 possession (Score: 55-82)
D'Angelo Randle attempts a 3Pt. Contested by D'Angelo Iverson (3.5 feet, MAN). D'ANGELO RANDLE MAKES IT! Assist: DeMar James
Score: 58-82

[11:02] Team_043 possession (Score: 58-82)
Magic Durant throws a bad pass out of bounds! TURNOVER! (dead ball)

[11:02] Substitution (Team_019): Brandon James OUT → Jalen Turner IN (stamina_rule2)

[11:02] Substitution (Team_019): D'Angelo Randle OUT → Blake LaVine IN (stamina_rule2)

[11:02] Substitution (Team_019): Tobias Hyland OUT → Shai Ingram IN (stamina_rule2)

[11:02] Substitution (Team_019): DeMar James OUT → Tim Jordan IN (stamina_rule2)

[11:02] Substitution (Team_043): Magic Durant OUT → Ben LaVine IN (stamina_rule2)

[11:02] Substitution (Team_043): D'Angelo Iverson OUT → Dirk Herro IN (stamina_rule2)

[11:02] Substitution (Team_043): Manu Carter OUT → Joel Murray IN (stamina_rule2)

[11:02] Substitution (Team_043): Dwyane Dosunmu OUT → Terry Randle IN (stamina_rule2)

[10:48] Team_019 possession (Score: 58-82)
Blake LaVine attempts a 3Pt. Contested by Dirk Herro (4.1 feet, MAN). Blake LaVine misses. Offensive rebound by Tim Jordan! Tim Jordan kicks it out.

[10:29] Team_019 possession (Score: 58-82)
Gary Ginobili makes the Layup and draws the foul on Jabari Holiday! And-1! Gary Ginobili to the line for 1. [Team fouls: 1] (Jabari Holiday: 1 personal fouls)   FT 1/1: GOOD Gary Ginobili makes 1/1 from the line.
Score: 61-82

[10:16] Team_043 possession (Score: 61-82)
Jabari Holiday attempts a 3Pt. Wide open! Gary Ginobili is 6.3 feet away. [MAN] JABARI HOLIDAY MAKES IT! Assist: Ben LaVine
Score: 61-85

[10:01] Team_019 possession (Score: 61-85)
Tim Jordan attempts a Midrange. Contested by Terry Randle (4.3 feet, MAN). Tim Jordan misses. Rebound secured by Ben LaVine.

[09:45] Team_043 possession (Score: 61-85)
FOUL! Holding foul on Jalen Turner. [Team fouls: 2] No free throws, side out. (Jalen Turner: 1 personal fouls)

[09:33] Team_043 possession (Score: 61-85)
Joel Murray attempts a 3Pt. Contested by Shai Ingram (4.9 feet, MAN). Joel Murray misses. Rebound secured by Blake LaVine.

[09:19] Team_019 possession (Score: 61-85)
Gary Ginobili drives and kicks out. Jalen Turner attempts a Midrange. Contested by Ben LaVine (5.1 feet, MAN). JALEN TURNER MAKES IT! Assist: Shai Ingram
Score: 63-85

[09:02] Team_043 possession (Score: 63-85)
Joel Murray drives, picks up Shai Ingram. Help arrives from Jalen Turner! Joel Murray attempts a Layup. Contested by Jalen Turner (4.9 feet, MAN). JOEL MURRAY MAKES IT!
Score: 63-87

[08:44] Team_019 possession (Score: 63-87)
Tim Jordan attempts a Layup. Contested by Terry Randle (4.3 feet, MAN). Tim Jordan misses. Rebound secured by Terry Randle.

[08:34] Team_043 possession (Score: 63-87)
FOUL! Reach-in foul on Blake LaVine during the drive. [Team fouls: 3] No free throws, side out. (Blake LaVine: 1 personal fouls)

[08:21] Team_043 possession (Score: 63-87)
Joel Murray attempts a 3Pt. Contested by Shai Ingram (4.9 feet, MAN). Joel Murray misses. Offensive rebound by Dirk Herro! Dirk Herro's putback is no good. Rebound secured by Blake LaVine.

[08:07] Team_019 possession (Score: 63-87)
Blake LaVine attempts a Layup. Contested by Terry Randle (4.5 feet, ZONE). BLAKE LAVINE MAKES IT!
Score: 65-87

[07:53] Team_043 possession (Score: 65-87)
Jabari Holiday attempts a 3Pt. Wide open! Gary Ginobili is 6.3 feet away. [MAN] JABARI HOLIDAY MAKES IT! Assist: Dirk Herro
Score: 65-90

[07:36] Team_019 possession (Score: 65-90)
Jalen Turner attempts a Layup. Contested by Ben LaVine (5.3 feet, MAN). JALEN TURNER MAKES IT!
Score: 67-90

[07:21] Team_043 possession (Score: 67-90)
Terry Randle drives and kicks out. FOUL! Shooting foul on Shai Ingram. Joel Murray to the line for 2 free throws. [Team fouls: 4] (Shai Ingram: 1 personal fouls)   FT 1/2: GOOD   FT 2/2: GOOD Joel Murray makes 2/2 from the line.
Score: 67-92

[07:10] Team_019 possession (Score: 67-92)
Blake LaVine drives, Dirk Herro stays with him. Blake LaVine attempts a Layup. Contested by Dirk Herro (4.1 feet, MAN). Blake LaVine misses. Rebound secured by Ben LaVine.

[06:54] Team_043 possession (Score: 67-92)
Terry Randle drives to the basket... Terry Randle throws a bad pass out of bounds! TURNOVER! (dead ball)

[06:42] Team_019 possession (Score: 67-92)
Blake LaVine attempts a Midrange. Contested by Ben LaVine (5.2 feet, ZONE). Blake LaVine misses. Rebound secured by Ben LaVine.

[06:29] Team_043 possession (Score: 67-92)
Ben LaVine attempts a Midrange. Contested by Jalen Turner (4.3 feet, MAN). BEN LAVINE MAKES IT! Assist: Dirk Herro
Score: 67-94

[06:16] Team_019 possession (Score: 67-94)
Gary Ginobili drives and kicks out. FOUL! Shooting foul on Terry Randle. Tim Jordan to the line for 2 free throws. [Team fouls: 2] (Terry Randle: 1 personal fouls)   FT 1/2: MISS   FT 2/2: GOOD Tim Jordan makes 1/2 from the line.
Score: 68-94

[06:00] Team_043 possession (Score: 68-94)
FOUL! Shooting foul on Gary Ginobili. Jabari Holiday to the line for 3 free throws. [BONUS: 5 team fouls] (Gary Ginobili: 1 personal fouls)   FT 1/3: GOOD   FT 2/3: GOOD   FT 3/3: GOOD Jabari Holiday makes 3/3 from the line.
Score: 68-97

[05:43] Team_019 possession (Score: 68-97)
Tim Jordan attempts a Layup. Contested by Joel Murray (5.7 feet, ZONE). TIM JORDAN MAKES IT! Assist: Shai Ingram
Score: 70-97

[05:31] Team_043 possession (Score: 70-97)
Ben LaVine attempts a 3Pt. Contested by Jalen Turner (4.3 feet, MAN). Ben LaVine misses. Rebound secured by Shai Ingram.

[05:17] Team_019 possession (Score: 70-97)
Jalen Turner attempts a Midrange. Contested by Ben LaVine (5.3 feet, MAN). Jalen Turner misses. Rebound secured by Ben LaVine.

[05:02] Team_043 possession (Score: 70-97)
Ben LaVine drives, picks up Shai Ingram. Help arrives from Jalen Turner! Ben LaVine attempts a Dunk. Contested by Jalen Turner (4.9 feet, ZONE). BEN LAVINE MAKES IT!
Score: 70-99

[04:51] Team_019 possession (Score: 70-99)
Jalen Turner attempts a 3Pt. Contested by Ben LaVine (5.3 feet, MAN). JALEN TURNER MAKES IT!
Score: 73-99

[04:39] Team_043 possession (Score: 73-99)
Jabari Holiday attempts a 3Pt. Contested by Blake LaVine (5.2 feet, ZONE). Jabari Holiday misses. Rebound secured by Blake LaVine.

[04:25] Team_019 possession (Score: 73-99)
Tim Jordan makes the Layup and draws the foul on Ben LaVine! And-1! Tim Jordan to the line for 1. [Team fouls: 3] (Ben LaVine: 1 personal fouls)   FT 1/1: MISS Tim Jordan makes 0/1 from the line. Rebound secured by Terry Randle.
Score: 75-99

[04:09] Team_043 possession (Score: 75-99)
Terry Randle attempts a Midrange. Contested by Shai Ingram (5.0 feet, MAN). Terry Randle misses. Rebound secured by Blake LaVine.

[03:51] Team_019 possession (Score: 75-99)
Blake LaVine drives and kicks out. Jalen Turner attempts a 3Pt. Contested by Ben LaVine (5.1 feet, MAN). JALEN TURNER MAKES IT! Assist: Gary Ginobili
Score: 78-99

[03:35] Team_043 possession (Score: 78-99)
Jabari Holiday attempts a Midrange. Wide open! Gary Ginobili is 6.4 feet away. [MAN] Jabari Holiday misses. Rebound secured by Blake LaVine.

[03:23] Team_019 possession (Score: 78-99)
Shai Ingram loses the ball! Stripped by Joel Murray! TURNOVER! (live ball)

[03:05] Team_043 possession (Score: 78-99)
Jabari Holiday drives to the basket... FOUL! Offensive foul on Jabari Holiday! Gary Ginobili drew the charge! [Team fouls: 4] (Jabari Holiday: 2 personal fouls) TURNOVER! (dead ball)

[02:49] Team_019 possession (Score: 78-99)
Gary Ginobili drives to the basket... Gary Ginobili throws a bad pass out of bounds! TURNOVER! (dead ball)

[02:32] Team_043 possession (Score: 78-99)
Joel Murray attempts a Midrange. Contested by Shai Ingram (5.0 feet, MAN). JOEL MURRAY MAKES IT! Assist: Terry Randle
Score: 78-101

[02:17] Team_019 possession (Score: 78-101)
Shai Ingram attempts a Midrange. Contested by Joel Murray (5.8 feet, ZONE). Shai Ingram misses. Rebound secured by Dirk Herro.

[02:02] Team_043 possession (Score: 78-101)
Ben LaVine attempts a 3Pt. Contested by Blake LaVine (5.2 feet, ZONE). Ben LaVine misses. Rebound secured by Blake LaVine.

[01:43] Team_019 possession (Score: 78-101)
Jalen Turner attempts a Layup. Contested by Ben LaVine (5.5 feet, MAN). JALEN TURNER MAKES IT! Assist: Shai Ingram
Score: 80-101

[01:26] Team_043 possession (Score: 80-101)
Joel Murray attempts a Midrange. Contested by Shai Ingram (5.1 feet, MAN). Joel Murray misses. Offensive rebound by Dirk Herro! Dirk Herro puts it back in!
Score: 80-103

[01:08] Team_019 possession (Score: 80-103)
Tim Jordan drives to the basket... Tim Jordan throws a bad pass out of bounds! TURNOVER! (dead ball)

[00:57] Team_043 possession (Score: 80-103)
Ben LaVine attempts a 3Pt. Contested by Jalen Turner (4.5 feet, MAN). Ben LaVine misses. Offensive rebound by Terry Randle! Terry Randle kicks it out.

[00:43] Team_043 possession (Score: 80-103)
FOUL! Offensive foul on Joel Murray! Shai Ingram drew the charge! [Team fouls: 5] (Joel Murray: 1 personal fouls) TURNOVER! (dead ball)

[00:27] Team_019 possession (Score: 80-103)
Blake LaVine drives, Terry Randle stays with him. Blake LaVine attempts a Layup. Contested by Terry Randle (4.8 feet, ZONE). Blake LaVine misses. Offensive rebound by Shai Ingram! Shai Ingram kicks it out.

[00:16] Team_019 possession (Score: 80-103)
Shai Ingram attempts a 3Pt. Contested by Joel Murray (6.0 feet, MAN). SHAI INGRAM MAKES IT!
Score: 83-103

[00:05] Team_043 possession (Score: 83-103)
Jabari Holiday attempts a Layup. Contested by Shai Ingram (5.4 feet, ZONE). JABARI HOLIDAY MAKES IT! Assist: Terry Randle
Score: 83-105

================================================================================
                              4TH QUARTER COMPLETE                              
================================================================================

4TH QUARTER SCORE: Team_019 28, Team_043 23

BOX SCORE:
================================================================================

Team_019
--------------------------------------------------------------------------------
Player                MIN  PTS  REB  AST  TO      FG   FG%      3P   3P%
--------------------------------------------------------------------------------
Jalen Turner           22   12    0    0   0   5/6    83.3     0/0   0.0
D'Angelo Randle        26    3    1    0   0   1/1   100.0     0/0   0.0
Tim Jordan             22    3    1    0   0   2/5    40.0     0/0   0.0
Gary Ginobili          24    3    0    1   0   1/1   100.0     0/0   0.0
Shai Ingram            22    3    2    3   0   1/2    50.0     0/0   0.0
Blake LaVine           22    2    6    0   0   1/3    33.3     0/0   0.0
Tobias Hyland          26    0    0    0   0   0/1     0.0     0/0   0.0
DeMar James            26    0    0    1   0   0/0     0.0     0/0   0.0

TEAM: FG: 11/19 (57.9%), 3PT: 3/3 (100.0%), REB: 10 (3 off, 7 def), AST: 5, TO: 3
TEAM FOULS: 5 [Team_043 in BONUS]


Team_043
--------------------------------------------------------------------------------
Player                MIN  PTS  REB  AST  TO      FG   FG%      3P   3P%
--------------------------------------------------------------------------------
Jabari Holiday         24   11    0    0   0   4/6    66.7     0/0   0.0
Joel Murray            22    6    0    0   0   3/5    60.0     0/0   0.0
Ben LaVine             22    4    4    1   0   2/4    50.0     0/0   0.0
Dirk Herro             22    2    2    2   0   1/1   100.0     0/0   0.0
Manu Carter            26    0    2    0   0   0/1     0.0     0/0   0.0
Terry Randle           22    0    3    2   0   0/1     0.0     0/0   0.0

TEAM: FG: 10/18 (55.6%), 3PT: 3/9 (33.3%), REB: 11 (4 off, 7 def), AST: 5, TO: 4
TEAM FOULS: 5 [Team_019 in BONUS]

================================================================================

================================================================================
                               FULL GAME COMPLETE                               
================================================================================

FINAL SCORE: Team_019 83, Team_043 105

SCORING BY QUARTER:
--------------------------------------------------------------------------------
Team                     Q1     Q2     Q3     Q4    FINAL
--------------------------------------------------------------------------------
Team_019                 11     26     18     28       83
Team_043                 27     30     25     23      105
--------------------------------------------------------------------------------

FULL GAME BOX SCORE:
================================================================================

Team_019
--------------------------------------------------------------------------------
Player                MIN  PTS  REB  AST  TO      FG   FG%      3P   3P%      FT STL BLK
--------------------------------------------------------------------------------
Brandon James          26    4    0    0   2   1/6    16.7   1/3    33.3   2/3     0   0
D'Angelo Randle        26   16    9    0   2   6/9    66.7   1/3    33.3   1/1     0   0
Tobias Hyland          26    2    9    2   2   1/8    12.5   0/3     0.0   0/0     0   0
DeMar James            26    9    8    1   1   3/7    42.9   0/1     0.0   3/3     0   0
Rudy Giddey            25    2    0    2   0   3/13   23.1   2/9    22.2   0/0     0   0
Gary Ginobili          24    7    0    2   1   7/11   63.6   0/2     0.0   1/1     1   0
Jalen Turner           22   20    0    0   0   6/7    85.7   2/2   100.0   1/1     0   0
Blake LaVine           22    2   10    1   1   2/7    28.6   0/3     0.0   0/0     0   0
Shai Ingram            22    8    4    5   2   3/7    42.9   1/2    50.0   3/3     0   1
Tim Jordan             22   10    1    0   1   2/6    33.3   1/1   100.0   3/5     0   0

TEAM: FG: 34/81 (42.0%), 3PT: 8/29 (27.6%), REB: 42 (6 off, 36 def), AST: 13, TO: 12


Team_043
--------------------------------------------------------------------------------
Player                MIN  PTS  REB  AST  TO      FG   FG%      3P   3P%      FT STL BLK
--------------------------------------------------------------------------------
Magic Durant           26   10    0    1   1   4/7    57.1   0/1     0.0   0/0     1   0
D'Angelo Iverson       26    9   10    0   1   4/10   40.0   0/2     0.0   3/5     3   0
Manu Carter            26   14   17    1   0   6/10   60.0   2/6    33.3   0/0     3   0
Dwyane Dosunmu         26    6   10    1   1   2/6    33.3   0/0     0.0   3/4     0   0
Malcolm Murray         25   10    0    2   0   5/12   41.7   0/5     0.0   2/2     0   0
Jabari Holiday         24   20    0    1   2   9/14   64.3   3/6    50.0   4/4     0   0
Ben LaVine             22    9    9    2   0   5/8    62.5   1/3    33.3   0/0     0   1
Dirk Herro             22    9    6    2   0   2/5    40.0   0/1     0.0   1/1     0   1
Joel Murray            22    6    0    2   2   3/5    60.0   0/2     0.0   2/2     1   0
Terry Randle           22    9    6    2   1   4/5    80.0   0/0     0.0   7/7     1   1

TEAM: FG: 44/82 (53.7%), 3PT: 6/26 (23.1%), REB: 57 (12 off, 45 def), AST: 14, TO: 8

================================================================================
