================================================================================
                        FULL GAME - Team_015 vs Team_060                        
================================================================================

================================================================================
                       1ST QUARTER - Team_015 vs Team_060                       
================================================================================

[12:00] Team_015 possession (Score: 0-0)
Trae Turner drives to the basket... Trae Turner commits a violation (traveling/carry)! TURNOVER! (dead ball)

[11:45] Team_060 possession (Score: 0-0)
FOUL! Shooting foul on Scottie Gasol. Larry Westbrook to the line for 2 free throws. [Team fouls: 1] (Scottie Gasol: 1 personal fouls)   FT 1/2: GOOD   FT 2/2: GOOD Larry Westbrook makes 2/2 from the line.
Score: 0-2

[11:34] Team_015 possession (Score: 0-2)
FOUL! Shooting foul on Immanuel Ming. CJ Banchero to the line for 2 free throws. [Team fouls: 1] (Immanuel Ming: 1 personal fouls)   FT 1/2: GOOD   FT 2/2: GOOD CJ Banchero makes 2/2 from the line.
Score: 2-2

[11:20] Team_060 possession (Score: 2-2)
Larry Westbrook drives, Scottie Gasol stays with him. Larry Westbrook attempts a Layup. Contested by Scottie Gasol (3.9 feet, ZONE). Larry Westbrook misses. Rebound secured by Michael Simmons.

[11:06] Team_015 possession (Score: 2-2)
CJ Banchero attempts a 3Pt. Contested by Immanuel Ming (3.5 feet, MAN). CJ Banchero misses. Rebound secured by Immanuel Ming.

[10:51] Team_060 possession (Score: 2-2)
Immanuel Ming drives to the basket... Immanuel Ming throws a bad pass! Stolen by Scottie Gasol! TURNOVER! (live ball)

[10:38] Team_015 possession (Score: 2-2)
Trae Turner attempts a Layup. BLOCKED BY JAREN GEORGE! Ball is loose! Rebound secured by Larry Westbrook.

[10:26] Team_060 possession (Score: 2-2)
Jaren George drives and kicks out. Immanuel Ming attempts a 3Pt. Contested by Manu Anthony (3.6 feet, ZONE). Immanuel Ming misses. Rebound secured by Michael Simmons.

[10:15] Team_015 possession (Score: 2-2)
Trae Turner attempts a Midrange. Contested by Jaren George (5.3 feet, MAN). TRAE TURNER MAKES IT! Assist: CJ Banchero
Score: 4-2

[10:02] Team_060 possession (Score: 4-2)
Immanuel Ming attempts a 3Pt. Contested by Manu Anthony (3.6 feet, ZONE). Immanuel Ming misses. Rebound secured by Trae Turner.

[09:46] Team_015 possession (Score: 4-2)
Trae Turner attempts a Layup. Contested by Jaren George (5.3 feet, ZONE). Trae Turner misses. Rebound secured by Larry Westbrook.

[09:31] Team_060 possession (Score: 4-2)
Immanuel Ming attempts a Layup. BLOCKED BY TRAE TURNER! Ball goes out off Trae Turner. Immanuel Ming's ball!

[09:20] Team_060 possession (Score: 4-2)
FOUL! Shooting foul on Manu Anthony. Larry Westbrook to the line for 3 free throws. [Team fouls: 2] (Manu Anthony: 1 personal fouls)   FT 1/3: GOOD   FT 2/3: MISS   FT 3/3: GOOD Larry Westbrook makes 2/3 from the line.
Score: 4-4

[09:09] Team_015 possession (Score: 4-4)
Michael Simmons attempts a Midrange. Contested by Julius Green (3.8 feet, ZONE). Michael Simmons misses. Rebound secured by Larry Westbrook.

[08:59] Team_060 possession (Score: 4-4)
Immanuel Ming attempts a 3Pt. Contested by Manu Anthony (3.6 feet, ZONE). Immanuel Ming misses. Rebound secured by CJ Banchero.

[08:47] Team_015 possession (Score: 4-4)
CJ Banchero drives to the basket... CJ Banchero throws a bad pass out of bounds! TURNOVER! (dead ball)

[08:29] Team_060 possession (Score: 4-4)
Julius Green attempts a 3Pt. Contested by Manu Anthony (3.5 feet, ZONE). Julius Green misses. Offensive rebound by Jaren George! Jaren George's putback is no good. Rebound secured by Michael Simmons.

[08:19] Team_015 possession (Score: 4-4)
Scottie Gasol attempts a 3Pt. Contested by Larry Westbrook (4.6 feet, MAN). Scottie Gasol misses. Rebound secured by Immanuel Ming.

[08:03] Team_060 possession (Score: 4-4)
Larry Westbrook attempts a Layup. BLOCKED BY SCOTTIE GASOL! Ball is loose! Rebound secured by CJ Banchero.

[07:46] Team_015 possession (Score: 4-4)
CJ Banchero throws a bad pass! Stolen by Immanuel Ming! TURNOVER! (live ball)

[07:29] Team_060 possession (Score: 4-4)
Joel Morant attempts a 3Pt. Contested by Manu Anthony (3.3 feet, ZONE). Joel Morant misses. Rebound secured by CJ Banchero.

[07:10] Team_015 possession (Score: 4-4)
Manu Anthony attempts a 3Pt. Contested by Joel Morant (5.5 feet, MAN). Manu Anthony misses. Rebound secured by Immanuel Ming.

[06:59] Team_060 possession (Score: 4-4)
Julius Green drives, Michael Simmons stays with him. Julius Green attempts a Layup. Contested by Michael Simmons (3.1 feet, MAN). Julius Green misses. Rebound secured by Michael Simmons.

[06:43] Team_015 possession (Score: 4-4)
CJ Banchero attempts a Midrange. Contested by Larry Westbrook (4.4 feet, ZONE). CJ Banchero misses. Rebound secured by Larry Westbrook.

[06:24] Team_060 possession (Score: 4-4)
Jaren George attempts a 3Pt. Contested by Trae Turner (3.7 feet, MAN). Jaren George misses. FOUL! Loose ball foul on CJ Banchero during the rebound battle. [Team fouls: 3] No free throws, side out. (CJ Banchero: 1 personal fouls)

[06:12] Team_060 possession (Score: 4-4)
Joel Morant attempts a 3Pt. Contested by Manu Anthony (3.3 feet, MAN). Joel Morant misses. Rebound secured by Michael Simmons.

[06:01] Team_015 possession (Score: 4-4)
Trae Turner makes the Layup and draws the foul on Jaren George! And-1! Trae Turner to the line for 1. [Team fouls: 2] (Jaren George: 1 personal fouls)   FT 1/1: GOOD Trae Turner makes 1/1 from the line.
Score: 7-4

[05:47] Team_060 possession (Score: 7-4)
Larry Westbrook attempts a 3Pt. Contested by Manu Anthony (4.1 feet, ZONE). Larry Westbrook misses. Rebound secured by CJ Banchero.

[05:35] Team_015 possession (Score: 7-4)
Manu Anthony attempts a 3Pt. Contested by Joel Morant (5.6 feet, MAN). Manu Anthony misses. Rebound secured by Immanuel Ming.

[05:18] Team_060 possession (Score: 7-4)
Jaren George attempts a 3Pt. Contested by Manu Anthony (3.8 feet, ZONE). JAREN GEORGE MAKES IT! Assist: Immanuel Ming
Score: 7-7

[05:03] Team_015 possession (Score: 7-7)
FOUL! Reach-in foul on Immanuel Ming during the drive. [Team fouls: 3] No free throws, side out. (Immanuel Ming: 2 personal fouls)

[04:49] Team_015 possession (Score: 7-7)
Scottie Gasol drives to the basket... FOUL! Offensive foul on Scottie Gasol! Larry Westbrook drew the charge! [Team fouls: 4] (Scottie Gasol: 2 personal fouls) TURNOVER! (dead ball)

[04:37] Team_060 possession (Score: 7-7)
Larry Westbrook attempts a 3Pt. Contested by Scottie Gasol (4.0 feet, MAN). Larry Westbrook misses. Offensive rebound by Jaren George! Jaren George puts it back in!
Score: 7-9

[04:23] Team_015 possession (Score: 7-9)
Trae Turner commits a violation (traveling/carry)! TURNOVER! (dead ball)

[04:06] Team_060 possession (Score: 7-9)
Immanuel Ming attempts a Midrange. Contested by CJ Banchero (4.3 feet, ZONE). IMMANUEL MING MAKES IT! Assist: Larry Westbrook
Score: 7-11

[03:50] Team_015 possession (Score: 7-11)
FOUL! Holding foul on Julius Green. [Team fouls: 4] No free throws, side out. (Julius Green: 1 personal fouls)

[03:34] Team_015 possession (Score: 7-11)
FOUL! Shooting foul on Joel Morant. Manu Anthony to the line for 3 free throws. [BONUS: 5 team fouls] (Joel Morant: 1 personal fouls)   FT 1/3: GOOD   FT 2/3: GOOD   FT 3/3: GOOD Manu Anthony makes 3/3 from the line.
Score: 10-11

[03:17] Team_060 possession (Score: 10-11)
FOUL! Shooting foul on Manu Anthony. Joel Morant to the line for 2 free throws. [BONUS: 5 team fouls] (Manu Anthony: 2 personal fouls)   FT 1/2: GOOD   FT 2/2: MISS Joel Morant makes 1/2 from the line. Rebound secured by CJ Banchero.
Score: 10-12

[03:04] Team_015 possession (Score: 10-12)
Manu Anthony drives, picks up Jaren George. Help arrives from Julius Green! Manu Anthony attempts a Dunk. Contested by Julius Green (5.7 feet, ZONE). Manu Anthony misses. FOUL! Loose ball foul on Immanuel Ming during the rebound battle. [IN THE BONUS! 6 team fouls] Trae Turner to the line for 2 free throws. (Immanuel Ming: 3 personal fouls)   FT 1/2: GOOD   FT 2/2: MISS Trae Turner makes 1/2 from the line. Rebound secured by Jaren George.
Score: 11-12

[02:48] Team_060 possession (Score: 11-12)
Jaren George drives, Trae Turner stays with him. Jaren George attempts a Layup. Contested by Trae Turner (4.0 feet, MAN). JAREN GEORGE MAKES IT! Assist: Larry Westbrook
Score: 11-14

[02:32] Team_015 possession (Score: 11-14)
Michael Simmons attempts a Midrange. Contested by Julius Green (4.0 feet, ZONE). Michael Simmons misses. Rebound secured by Jaren George.

[02:18] Team_060 possession (Score: 11-14)
Larry Westbrook attempts a Layup. Contested by Scottie Gasol (4.2 feet, MAN). LARRY WESTBROOK MAKES IT!
Score: 11-16

[02:04] Team_015 possession (Score: 11-16)
CJ Banchero attempts a Midrange. Contested by Immanuel Ming (3.7 feet, MAN). CJ Banchero misses. Rebound secured by Immanuel Ming.

[01:50] Team_060 possession (Score: 11-16)
Immanuel Ming attempts a Layup. BLOCKED BY MICHAEL SIMMONS! Ball is loose! Rebound secured by Trae Turner.

[01:36] Team_015 possession (Score: 11-16)
Manu Anthony attempts a Midrange. Contested by Joel Morant (5.9 feet, MAN). MANU ANTHONY MAKES IT!
Score: 13-16

[01:23] Team_060 possession (Score: 13-16)
Larry Westbrook attempts a 3Pt. Contested by Manu Anthony (4.4 feet, ZONE). Larry Westbrook misses. Rebound secured by Michael Simmons.

[01:10] Team_015 possession (Score: 13-16)
CJ Banchero attempts a 3Pt. Contested by Immanuel Ming (3.8 feet, MAN). CJ Banchero misses. Rebound secured by Immanuel Ming.

[01:00] Team_060 possession (Score: 13-16)
Jaren George drives and kicks out. Julius Green attempts a 3Pt. Contested by Michael Simmons (3.9 feet, MAN). JULIUS GREEN MAKES IT! Assist: Immanuel Ming
Score: 13-19

[00:43] Team_015 possession (Score: 13-19)
FOUL! Shooting foul on Julius Green. Manu Anthony to the line for 3 free throws. [BONUS: 7 team fouls] (Julius Green: 2 personal fouls)   FT 1/3: MISS   FT 2/3: GOOD   FT 3/3: GOOD Manu Anthony makes 2/3 from the line.
Score: 15-19

[00:28] Team_060 possession (Score: 15-19)
Immanuel Ming drives, Scottie Gasol stays with him. Immanuel Ming attempts a Dunk. Contested by Scottie Gasol (4.0 feet, ZONE). Immanuel Ming misses. Rebound secured by CJ Banchero.

[00:14] Team_015 possession (Score: 15-19)
FOUL! Reach-in foul on Joel Morant during the drive. [IN THE BONUS! 8 team fouls] Manu Anthony to the line for 2 free throws. (Joel Morant: 2 personal fouls)   FT 1/2: GOOD   FT 2/2: GOOD Manu Anthony makes 2/2 from the line.
Score: 17-19

================================================================================
                              1ST QUARTER COMPLETE                              
================================================================================

1ST QUARTER SCORE: Team_015 17, Team_060 19

BOX SCORE:
================================================================================

Team_015
--------------------------------------------------------------------------------
Player                MIN  PTS  REB  AST  TO      FG   FG%      3P   3P%
--------------------------------------------------------------------------------
Manu Anthony           12    9    0    0   0   4/7    57.1     0/0   0.0
Trae Turner            12    5    2    0   0   2/4    50.0     0/0   0.0
CJ Banchero            12    2    6    1   0   1/5    20.0     0/0   0.0
Michael Simmons        12    0    6    0   0   0/2     0.0     0/0   0.0
Scottie Gasol          12    0    0    0   0   0/1     0.0     0/0   0.0

TEAM: FG: 7/19 (36.8%), 3PT: 2/7 (28.6%), REB: 14 (1 off, 13 def), AST: 1, TO: 5
TEAM FOULS: 5 [Team_060 in BONUS]


Team_060
--------------------------------------------------------------------------------
Player                MIN  PTS  REB  AST  TO      FG   FG%      3P   3P%
--------------------------------------------------------------------------------
Jaren George           12    7    3    0   0   3/4    75.0     0/0   0.0
Larry Westbrook        12    6    4    2   0   3/7    42.9     0/0   0.0
Julius Green           12    3    0    0   0   1/3    33.3     0/0   0.0
Immanuel Ming          12    2    7    2   0   1/5    20.0     0/0   0.0
Joel Morant            12    0    0    0   0   0/3     0.0     0/0   0.0

TEAM: FG: 8/22 (36.4%), 3PT: 3/10 (30.0%), REB: 14 (3 off, 11 def), AST: 4, TO: 1
TEAM FOULS: 8 [Team_015 in BONUS]

================================================================================

================================================================================
                       2ND QUARTER - Team_015 vs Team_060                       
================================================================================

[12:00] Team_015 possession (Score: 17-19)
CJ Banchero attempts a 3Pt. Contested by Julius Green (3.9 feet, ZONE). CJ Banchero misses. Rebound secured by Jaren George.

[11:45] Team_060 possession (Score: 17-19)
Larry Westbrook drives to the basket... Larry Westbrook loses the ball! Stripped by Scottie Gasol! TURNOVER! (live ball)

[11:31] Team_015 possession (Score: 17-19)
Scottie Gasol makes the Midrange and draws the foul on Larry Westbrook! And-1! Scottie Gasol to the line for 1. [Team fouls: 1] (Larry Westbrook: 1 personal fouls)   FT 1/1: GOOD Scottie Gasol makes 1/1 from the line.
Score: 20-19

[11:16] Team_060 possession (Score: 20-19)
Joel Morant attempts a 3Pt. Contested by CJ Banchero (4.3 feet, ZONE). Joel Morant misses. Rebound secured by Michael Simmons.

[11:01] Team_015 possession (Score: 20-19)
Trae Turner attempts a Layup. Contested by Jaren George (5.8 feet, MAN). Trae Turner misses. Rebound secured by Jaren George.

[10:48] Team_060 possession (Score: 20-19)
Joel Morant attempts a Midrange. Contested by Scottie Gasol (3.6 feet, ZONE). Joel Morant misses. Rebound secured by Michael Simmons.

[10:35] Team_015 possession (Score: 20-19)
Michael Simmons attempts a Midrange. Contested by Julius Green (4.3 feet, MAN). Michael Simmons misses. Rebound secured by Larry Westbrook.

[10:20] Team_060 possession (Score: 20-19)
Immanuel Ming attempts a 3Pt. Contested by Manu Anthony (4.1 feet, ZONE). Immanuel Ming misses. Rebound secured by Michael Simmons.

[10:05] Team_015 possession (Score: 20-19)
Michael Simmons attempts a 3Pt. Contested by Julius Green (4.3 feet, ZONE). MICHAEL SIMMONS MAKES IT! Assist: Trae Turner
Score: 23-19

[09:51] Team_060 possession (Score: 23-19)
Immanuel Ming attempts a 3Pt. Contested by Manu Anthony (4.2 feet, ZONE). Immanuel Ming misses. Rebound secured by Trae Turner.

[09:38] Team_015 possession (Score: 23-19)
Michael Simmons drives, Julius Green stays with him. Michael Simmons attempts a Dunk. Contested by Julius Green (4.4 feet, MAN). MICHAEL SIMMONS MAKES IT!
Score: 25-19

[09:20] Team_060 possession (Score: 25-19)
Julius Green attempts a Layup. Contested by Michael Simmons (3.8 feet, MAN). Julius Green misses. Offensive rebound by Jaren George! Jaren George kicks it out.

[09:06] Team_060 possession (Score: 25-19)
Jaren George makes the Dunk and draws the foul on Trae Turner! And-1! Jaren George to the line for 1. [Team fouls: 1] (Trae Turner: 1 personal fouls)   FT 1/1: GOOD Jaren George makes 1/1 from the line.
Score: 25-22

[08:52] Team_015 possession (Score: 25-22)
Trae Turner attempts a 3Pt. Wide open! Jaren George is 6.0 feet away. [MAN] Trae Turner misses. Rebound secured by Jaren George.

[08:37] Team_060 possession (Score: 25-22)
Larry Westbrook attempts a Midrange. Contested by Michael Simmons (4.5 feet, ZONE). Larry Westbrook misses. Rebound secured by CJ Banchero.

[08:24] Team_015 possession (Score: 25-22)
FOUL! Reach-in foul on Joel Morant during the drive. [Team fouls: 2] No free throws, side out. (Joel Morant: 1 personal fouls)

[08:09] Team_015 possession (Score: 25-22)
Michael Simmons drives, Jaren George stays with him. Michael Simmons attempts a Layup. Wide open! Jaren George is 6.1 feet away. [ZONE] MICHAEL SIMMONS MAKES IT! Assist: Trae Turner
Score: 27-22

[07:58] Team_060 possession (Score: 27-22)
Jaren George attempts a 3Pt. Contested by Michael Simmons (4.3 feet, ZONE). JAREN GEORGE MAKES IT! Assist: Larry Westbrook
Score: 27-25

[07:44] Team_015 possession (Score: 27-25)
Michael Simmons throws a bad pass! Stolen by Julius Green! TURNOVER! (live ball)

[07:31] Team_060 possession (Score: 27-25)
Immanuel Ming attempts a 3Pt. Contested by Manu Anthony (4.5 feet, ZONE). IMMANUEL MING MAKES IT! Assist: Larry Westbrook
Score: 27-28

[07:15] Team_015 possession (Score: 27-28)
CJ Banchero makes the 3Pt and draws the foul on Immanuel Ming! And-1! CJ Banchero to the line for 1. [Team fouls: 3] (Immanuel Ming: 1 personal fouls)   FT 1/1: GOOD CJ Banchero makes 1/1 from the line.
Score: 31-28

[07:01] Team_060 possession (Score: 31-28)
Julius Green attempts a 3Pt. Contested by Manu Anthony (4.4 feet, ZONE). JULIUS GREEN MAKES IT! Assist: Joel Morant
Score: 31-31

[06:46] Team_015 possession (Score: 31-31)
FOUL! Shooting foul on Julius Green. Michael Simmons to the line for 3 free throws. [Team fouls: 4] (Julius Green: 1 personal fouls)   FT 1/3: GOOD   FT 2/3: GOOD   FT 3/3: GOOD Michael Simmons makes 3/3 from the line.
Score: 34-31

[06:29] Team_060 possession (Score: 34-31)
Immanuel Ming attempts a 3Pt. Contested by Manu Anthony (4.6 feet, ZONE). Immanuel Ming misses. Rebound secured by Scottie Gasol.

[06:13] Team_015 possession (Score: 34-31)
Scottie Gasol makes the Layup and draws the foul on Larry Westbrook! And-1! Scottie Gasol to the line for 1. [BONUS: 5 team fouls] (Larry Westbrook: 2 personal fouls)   FT 1/1: GOOD Scottie Gasol makes 1/1 from the line.
Score: 37-31

[06:01] Team_060 possession (Score: 37-31)
Joel Morant drives and kicks out. Joel Morant attempts a Midrange. BLOCKED BY MANU ANTHONY! Ball deflects out of bounds off Joel Morant.

[05:44] Team_015 possession (Score: 37-31)
Michael Simmons attempts a Layup. Contested by Julius Green (4.9 feet, MAN). MICHAEL SIMMONS MAKES IT! Assist: Trae Turner
Score: 39-31

[05:28] Team_060 possession (Score: 39-31)
Jaren George attempts a Midrange. Contested by Trae Turner (5.1 feet, MAN). JAREN GEORGE MAKES IT!
Score: 39-33

[05:14] Team_015 possession (Score: 39-33)
Scottie Gasol throws a bad pass out of bounds! TURNOVER! (dead ball)

[05:14] Substitution (Team_015): Manu Anthony OUT → Dwyane Sabonis IN (stamina_rule2)

[05:14] Substitution (Team_015): Michael Simmons OUT → Paolo Jokic IN (stamina_rule2)

[05:14] Substitution (Team_015): CJ Banchero OUT → Magic Wagner IN (stamina_rule2)

[05:14] Substitution (Team_015): Scottie Gasol OUT → Rudy Paul IN (stamina_rule2)

[05:14] Substitution (Team_015): Trae Turner OUT → Allen Curry IN (stamina_rule2)

[05:14] Substitution (Team_060): Joel Morant OUT → Domantas Barnes IN (stamina_rule2)

[05:14] Substitution (Team_060): Julius Green OUT → Rudy Ginobili IN (stamina_rule2)

[05:14] Substitution (Team_060): Immanuel Ming OUT → Jarrett Wagner IN (stamina_rule2)

[05:14] Substitution (Team_060): Larry Westbrook OUT → Yao Tatum IN (stamina_rule2)

[05:14] Substitution (Team_060): Jaren George OUT → Klay Haliburton IN (stamina_rule2)

[05:01] Team_060 possession (Score: 39-33)
FOUL! Shooting foul on Magic Wagner. Jarrett Wagner to the line for 2 free throws. [Team fouls: 2] (Magic Wagner: 1 personal fouls)   FT 1/2: GOOD   FT 2/2: GOOD Jarrett Wagner makes 2/2 from the line.
Score: 39-35

[04:46] Team_015 possession (Score: 39-35)
FOUL! Offensive foul on Dwyane Sabonis! Domantas Barnes drew the charge! [Team fouls: 3] (Dwyane Sabonis: 1 personal fouls) TURNOVER! (dead ball)

[04:27] Team_060 possession (Score: 39-35)
FOUL! Reach-in foul on Rudy Paul during the drive. [Team fouls: 4] No free throws, side out. (Rudy Paul: 1 personal fouls)

[04:13] Team_060 possession (Score: 39-35)
FOUL! Shooting foul on Magic Wagner. Jarrett Wagner to the line for 2 free throws. [BONUS: 5 team fouls] (Magic Wagner: 2 personal fouls)   FT 1/2: GOOD   FT 2/2: GOOD Jarrett Wagner makes 2/2 from the line.
Score: 39-37

[04:01] Team_015 possession (Score: 39-37)
Rudy Paul attempts a Midrange. BLOCKED BY KLAY HALIBURTON! Ball goes out off Klay Haliburton. Rudy Paul's ball!

[03:49] Team_015 possession (Score: 39-37)
Rudy Paul attempts a Midrange. Contested by Yao Tatum (5.7 feet, MAN). RUDY PAUL MAKES IT!
Score: 41-37

[03:30] Team_060 possession (Score: 41-37)
Yao Tatum attempts a 3Pt. Contested by Rudy Paul (3.3 feet, MAN). Yao Tatum misses. Offensive rebound by Domantas Barnes! Domantas Barnes kicks it out.

[03:19] Team_060 possession (Score: 41-37)
Rudy Ginobili attempts a 3Pt. Contested by Rudy Paul (3.5 feet, ZONE). RUDY GINOBILI MAKES IT! Assist: Domantas Barnes
Score: 41-40

[03:03] Team_015 possession (Score: 41-40)
FOUL! Offensive foul on Magic Wagner! Jarrett Wagner drew the charge! [Team fouls: 6] (Magic Wagner: 3 personal fouls) TURNOVER! (dead ball)

[02:49] Team_060 possession (Score: 41-40)
Domantas Barnes attempts a 3Pt. Contested by Rudy Paul (3.2 feet, ZONE). Domantas Barnes misses. Rebound secured by Allen Curry.

[02:30] Team_015 possession (Score: 41-40)
Rudy Paul attempts a 3Pt. Contested by Domantas Barnes (5.1 feet, ZONE). Rudy Paul misses. Rebound secured by Rudy Ginobili.

[02:18] Team_060 possession (Score: 41-40)
Yao Tatum drives, Allen Curry stays with him. Yao Tatum attempts a Dunk. Contested by Allen Curry (4.5 feet, ZONE). YAO TATUM MAKES IT! Assist: Jarrett Wagner
Score: 41-42

[02:03] Team_015 possession (Score: 41-42)
Paolo Jokic makes the Layup and draws the foul on Rudy Ginobili! And-1! Paolo Jokic to the line for 1. [BONUS: 6 team fouls] (Rudy Ginobili: 1 personal fouls)   FT 1/1: GOOD Paolo Jokic makes 1/1 from the line.
Score: 44-42

[01:51] Team_060 possession (Score: 44-42)
Rudy Ginobili attempts a Midrange. Contested by Paolo Jokic (5.9 feet, MAN). RUDY GINOBILI MAKES IT!
Score: 44-44

[01:34] Team_015 possession (Score: 44-44)
Paolo Jokic attempts a Midrange. Contested by Rudy Ginobili (4.9 feet, MAN). Paolo Jokic misses. Rebound secured by Domantas Barnes.

[01:17] Team_060 possession (Score: 44-44)
Klay Haliburton attempts a Layup. Contested by Rudy Paul (3.5 feet, ZONE). KLAY HALIBURTON MAKES IT! Assist: Rudy Ginobili
Score: 44-46

[01:03] Team_015 possession (Score: 44-46)
Dwyane Sabonis drives and kicks out. Magic Wagner attempts a Midrange. Contested by Rudy Ginobili (4.4 feet, ZONE). MAGIC WAGNER MAKES IT! Assist: Rudy Paul
Score: 46-46

[00:50] Team_060 possession (Score: 46-46)
Domantas Barnes attempts a 3Pt. Contested by Rudy Paul (3.2 feet, ZONE). Domantas Barnes misses. Rebound secured by Allen Curry.

[00:36] Team_015 possession (Score: 46-46)
Allen Curry drives and kicks out. Paolo Jokic attempts a 3Pt. Contested by Domantas Barnes (4.6 feet, ZONE). Paolo Jokic misses. Rebound secured by Rudy Ginobili.

[00:20] Team_060 possession (Score: 46-46)
Jarrett Wagner makes the 3Pt and draws the foul on Rudy Paul! And-1! Jarrett Wagner to the line for 1. [BONUS: 7 team fouls] (Rudy Paul: 2 personal fouls)   FT 1/1: MISS Jarrett Wagner makes 0/1 from the line. Offensive rebound by Domantas Barnes! Domantas Barnes kicks it out.
Score: 46-49

[00:07] Team_060 possession (Score: 46-49)
FOUL! Reach-in foul on Rudy Paul during the drive. [IN THE BONUS! 8 team fouls] Klay Haliburton to the line for 2 free throws. (Rudy Paul: 3 personal fouls)   FT 1/2: GOOD   FT 2/2: GOOD Klay Haliburton makes 2/2 from the line.
Score: 46-51

================================================================================
                              2ND QUARTER COMPLETE                              
================================================================================

2ND QUARTER SCORE: Team_015 29, Team_060 32

BOX SCORE:
================================================================================

Team_015
--------------------------------------------------------------------------------
Player                MIN  PTS  REB  AST  TO      FG   FG%      3P   3P%
--------------------------------------------------------------------------------
Michael Simmons        19   12    3    0   0   5/6    83.3     0/0   0.0
Scottie Gasol          19    6    1    0   0   2/2   100.0     0/0   0.0
CJ Banchero            19    4    1    0   0   1/2    50.0     0/0   0.0
Paolo Jokic             5    3    0    0   0   1/2    50.0     0/0   0.0
Rudy Paul               5    2    0    1   0   1/2    50.0     0/0   0.0
Magic Wagner            5    2    0    0   0   1/1   100.0     0/0   0.0
Trae Turner            19    0    1    3   0   0/2     0.0     0/0   0.0
Allen Curry             5    0    2    0   0   0/1     0.0     0/0   0.0

TEAM: FG: 11/18 (61.1%), 3PT: 3/6 (50.0%), REB: 8 (0 off, 8 def), AST: 4, TO: 4
TEAM FOULS: 8 [Team_060 in BONUS]


Team_060
--------------------------------------------------------------------------------
Player                MIN  PTS  REB  AST  TO      FG   FG%      3P   3P%
--------------------------------------------------------------------------------
Jaren George           19    8    4    0   0   3/3   100.0     0/0   0.0
Rudy Ginobili           5    5    2    1   0   2/2   100.0     0/0   0.0
Jarrett Wagner          5    4    0    1   0   2/2   100.0     0/0   0.0
Klay Haliburton         5    4    0    0   0   2/2   100.0     0/0   0.0
Immanuel Ming          19    3    0    0   0   1/4    25.0     0/0   0.0
Julius Green           19    3    0    0   0   1/1   100.0     0/0   0.0
Yao Tatum               5    2    0    0   0   1/1   100.0     0/0   0.0
Joel Morant            19    0    0    1   0   0/3     0.0     0/0   0.0
Larry Westbrook        19    0    1    2   0   0/1     0.0     0/0   0.0
Domantas Barnes         5    0    3    1   0   0/2     0.0     0/0   0.0

TEAM: FG: 12/21 (57.1%), 3PT: 4/10 (40.0%), REB: 10 (3 off, 7 def), AST: 6, TO: 1
TEAM FOULS: 6 [Team_015 in BONUS]

================================================================================

================================================================================
                       3RD QUARTER - Team_015 vs Team_060                       
================================================================================

[12:00] Team_015 possession (Score: 46-51)
Michael Simmons attempts a Layup. Contested by Julius Green (3.8 feet, MAN). MICHAEL SIMMONS MAKES IT! Assist: Scottie Gasol
Score: 48-51

[11:42] Team_060 possession (Score: 48-51)
Julius Green makes the Dunk and draws the foul on Scottie Gasol! And-1! Julius Green to the line for 1. [Team fouls: 1] (Scottie Gasol: 1 personal fouls)   FT 1/1: MISS Julius Green makes 0/1 from the line. Rebound secured by Michael Simmons.
Score: 48-53

[11:24] Team_015 possession (Score: 48-53)
Scottie Gasol drives to the basket... Scottie Gasol loses the ball! Stripped by Larry Westbrook! TURNOVER! (live ball)

[11:13] Team_060 possession (Score: 48-53)
Joel Morant attempts a Midrange. Contested by Manu Anthony (3.3 feet, MAN). Joel Morant misses. Offensive rebound by Immanuel Ming! Immanuel Ming kicks it out.

[10:56] Team_060 possession (Score: 48-53)
Julius Green drives, Michael Simmons stays with him. Julius Green attempts a Layup. Contested by Michael Simmons (3.1 feet, MAN). JULIUS GREEN MAKES IT!
Score: 48-55

[10:45] Team_015 possession (Score: 48-55)
Scottie Gasol attempts a 3Pt. Contested by Julius Green (3.8 feet, ZONE). SCOTTIE GASOL MAKES IT! Assist: Trae Turner
Score: 51-55

[10:30] Team_060 possession (Score: 51-55)
FOUL! Shooting foul on Manu Anthony. Joel Morant to the line for 2 free throws. [Team fouls: 2] (Manu Anthony: 1 personal fouls)   FT 1/2: MISS   FT 2/2: GOOD Joel Morant makes 1/2 from the line.
Score: 51-56

[10:18] Team_015 possession (Score: 51-56)
CJ Banchero attempts a 3Pt. Contested by Immanuel Ming (3.5 feet, MAN). CJ BANCHERO MAKES IT! Assist: Scottie Gasol
Score: 54-56

[10:01] Team_060 possession (Score: 54-56)
Larry Westbrook attempts a Midrange. Contested by Scottie Gasol (3.9 feet, MAN). Larry Westbrook misses. Rebound secured by Trae Turner.

[09:43] Team_015 possession (Score: 54-56)
Manu Anthony attempts a 3Pt. Contested by Julius Green (4.1 feet, ZONE). Manu Anthony misses. Rebound secured by Jaren George.

[09:25] Team_060 possession (Score: 54-56)
Immanuel Ming drives, picks up Trae Turner. Help arrives from Michael Simmons! Immanuel Ming attempts a Dunk. Contested by Michael Simmons (3.6 feet, ZONE). IMMANUEL MING MAKES IT! Assist: Larry Westbrook
Score: 54-58

[09:10] Team_015 possession (Score: 54-58)
Manu Anthony attempts a Midrange. Contested by Immanuel Ming (4.0 feet, ZONE). Manu Anthony misses. Rebound secured by Jaren George.

[08:57] Team_060 possession (Score: 54-58)
Jaren George drives, picks up Scottie Gasol. Help arrives from Michael Simmons! Jaren George attempts a Layup. Contested by Michael Simmons (3.6 feet, ZONE). Jaren George misses. Rebound secured by Trae Turner.

[08:40] Team_015 possession (Score: 54-58)
Trae Turner attempts a Midrange. Contested by Jaren George (5.3 feet, MAN). TRAE TURNER MAKES IT!
Score: 56-58

[08:23] Team_060 possession (Score: 56-58)
Jaren George drives, Scottie Gasol stays with him. Jaren George attempts a Layup. Contested by Scottie Gasol (3.6 feet, ZONE). Jaren George misses. FOUL! Loose ball foul on CJ Banchero during the rebound battle. [Team fouls: 3] No free throws, side out. (CJ Banchero: 1 personal fouls)

[08:05] Team_060 possession (Score: 56-58)
Larry Westbrook attempts a 3Pt. Contested by Manu Anthony (4.1 feet, ZONE). LARRY WESTBROOK MAKES IT! Assist: Immanuel Ming
Score: 56-61

[07:52] Team_015 possession (Score: 56-61)
Scottie Gasol attempts a Midrange. Contested by Immanuel Ming (3.7 feet, ZONE). Scottie Gasol misses. Rebound secured by Jaren George.

[07:41] Team_060 possession (Score: 56-61)
Jaren George attempts a Midrange. Contested by Trae Turner (3.7 feet, MAN). Jaren George misses. Rebound secured by Trae Turner.

[07:29] Team_015 possession (Score: 56-61)
Trae Turner attempts a Layup. BLOCKED BY JAREN GEORGE! Ball deflects out of bounds off Trae Turner.

[07:13] Team_060 possession (Score: 56-61)
Immanuel Ming attempts a 3Pt. Contested by Manu Anthony (3.6 feet, ZONE). Immanuel Ming misses. Rebound secured by Trae Turner.

[06:56] Team_015 possession (Score: 56-61)
FOUL! Shooting foul on Larry Westbrook. CJ Banchero to the line for 2 free throws. [Team fouls: 1] (Larry Westbrook: 1 personal fouls)   FT 1/2: GOOD   FT 2/2: GOOD CJ Banchero makes 2/2 from the line.
Score: 58-61

[06:43] Team_060 possession (Score: 58-61)
Larry Westbrook attempts a Midrange. Contested by Scottie Gasol (3.9 feet, ZONE). Larry Westbrook misses. Rebound secured by Trae Turner.

[06:24] Team_015 possession (Score: 58-61)
Manu Anthony makes the Midrange and draws the foul on Larry Westbrook! And-1! Manu Anthony to the line for 1. [Team fouls: 2] (Larry Westbrook: 2 personal fouls)   FT 1/1: GOOD Manu Anthony makes 1/1 from the line.
Score: 61-61

[06:11] Team_060 possession (Score: 61-61)
Julius Green attempts a 3Pt. Contested by Manu Anthony (3.5 feet, ZONE). Julius Green misses. Offensive rebound by Jaren George! Jaren George puts it back in!
Score: 61-63

[05:59] Team_015 possession (Score: 61-63)
CJ Banchero makes the Dunk and draws the foul on Immanuel Ming! And-1! CJ Banchero to the line for 1. [Team fouls: 3] (Immanuel Ming: 1 personal fouls)   FT 1/1: GOOD CJ Banchero makes 1/1 from the line.
Score: 64-63

[05:43] Team_060 possession (Score: 64-63)
Jaren George drives, picks up Scottie Gasol. Help arrives from Michael Simmons! Jaren George attempts a Dunk. Contested by Michael Simmons (3.6 feet, ZONE). Jaren George misses. Offensive rebound by Immanuel Ming! Immanuel Ming kicks it out.

[05:25] Team_060 possession (Score: 64-63)
Larry Westbrook drives, Scottie Gasol stays with him. Larry Westbrook attempts a Layup. Contested by Scottie Gasol (3.9 feet, MAN). Larry Westbrook misses. Rebound secured by CJ Banchero.

[05:10] Team_015 possession (Score: 64-63)
FOUL! Reach-in foul on Jaren George during the drive. [Team fouls: 4] No free throws, side out. (Jaren George: 1 personal fouls)

[04:54] Team_015 possession (Score: 64-63)
FOUL! Shooting foul on Larry Westbrook. Scottie Gasol to the line for 2 free throws. [BONUS: 5 team fouls] (Larry Westbrook: 3 personal fouls)   FT 1/2: GOOD   FT 2/2: GOOD Scottie Gasol makes 2/2 from the line.
Score: 66-63

[04:38] Team_060 possession (Score: 66-63)
Larry Westbrook drives, picks up Scottie Gasol. Help arrives from Michael Simmons! Larry Westbrook attempts a Dunk. Contested by Michael Simmons (3.9 feet, ZONE). Larry Westbrook misses. Offensive rebound by Jaren George! Jaren George puts it back in!
Score: 66-65

[04:25] Team_015 possession (Score: 66-65)
Manu Anthony drives to the basket... Manu Anthony throws a bad pass! Stolen by Larry Westbrook! TURNOVER! (live ball)

[04:09] Team_060 possession (Score: 66-65)
Larry Westbrook loses control! Ball rolls out of bounds! TURNOVER! (dead ball)

[03:57] Team_015 possession (Score: 66-65)
Trae Turner makes the Layup and draws the foul on Jaren George! And-1! Trae Turner to the line for 1. [BONUS: 6 team fouls] (Jaren George: 2 personal fouls)   FT 1/1: GOOD Trae Turner makes 1/1 from the line.
Score: 69-65

[03:45] Team_060 possession (Score: 69-65)
Immanuel Ming makes the Dunk and draws the foul on Michael Simmons! And-1! Immanuel Ming to the line for 1. [Team fouls: 4] (Michael Simmons: 1 personal fouls)   FT 1/1: GOOD Immanuel Ming makes 1/1 from the line.
Score: 69-68

[03:33] Team_015 possession (Score: 69-68)
Manu Anthony attempts a Midrange. Contested by Joel Morant (5.7 feet, MAN). MANU ANTHONY MAKES IT! Assist: Trae Turner
Score: 71-68

[03:21] Team_060 possession (Score: 71-68)
Joel Morant throws a bad pass out of bounds! TURNOVER! (dead ball)

[03:06] Team_015 possession (Score: 71-68)
Trae Turner attempts a Layup. Contested by Jaren George (5.5 feet, ZONE). TRAE TURNER MAKES IT! Assist: CJ Banchero
Score: 73-68

[02:55] Team_060 possession (Score: 73-68)
Larry Westbrook attempts a 3Pt. Contested by Manu Anthony (4.3 feet, ZONE). Larry Westbrook misses. Rebound secured by Michael Simmons.

[02:38] Team_015 possession (Score: 73-68)
Scottie Gasol throws a bad pass! Stolen by Larry Westbrook! TURNOVER! (live ball)

[02:24] Team_060 possession (Score: 73-68)
Jaren George attempts a Layup. Contested by Trae Turner (4.0 feet, MAN). JAREN GEORGE MAKES IT! Assist: Larry Westbrook
Score: 73-70

[02:13] Team_015 possession (Score: 73-70)
CJ Banchero attempts a 3Pt. Contested by Julius Green (3.9 feet, ZONE). CJ Banchero misses. Rebound secured by Immanuel Ming.

[01:58] Team_060 possession (Score: 73-70)
Joel Morant attempts a Midrange. Contested by Manu Anthony (3.6 feet, MAN). Joel Morant misses. FOUL! Loose ball foul on Trae Turner during the rebound battle. [IN THE BONUS! 5 team fouls] Immanuel Ming to the line for 2 free throws. (Trae Turner: 1 personal fouls)   FT 1/2: GOOD   FT 2/2: GOOD Immanuel Ming makes 2/2 from the line.
Score: 73-72

[01:44] Team_015 possession (Score: 73-72)
Trae Turner attempts a 3Pt. Contested by Jaren George (5.7 feet, MAN). Trae Turner misses. Offensive rebound by Trae Turner! Trae Turner kicks it out.

[01:26] Team_015 possession (Score: 73-72)
Trae Turner drives, picks up Jaren George. Help arrives from Julius Green! Trae Turner attempts a Dunk. Contested by Julius Green (5.7 feet, ZONE). TRAE TURNER MAKES IT! Assist: Michael Simmons
Score: 75-72

[01:10] Team_060 possession (Score: 75-72)
Julius Green attempts a 3Pt. Contested by Michael Simmons (3.5 feet, MAN). Julius Green misses. Offensive rebound by Jaren George! Jaren George puts it back in!
Score: 75-74

[00:53] Team_015 possession (Score: 75-74)
Manu Anthony drives and kicks out. Manu Anthony attempts a Midrange. Contested by Jaren George (5.7 feet, ZONE). MANU ANTHONY MAKES IT!
Score: 77-74

[00:38] Team_060 possession (Score: 77-74)
Larry Westbrook attempts a 3Pt. Contested by Manu Anthony (4.5 feet, ZONE). LARRY WESTBROOK MAKES IT! Assist: Joel Morant
Score: 77-77

[00:23] Team_015 possession (Score: 77-77)
Michael Simmons attempts a 3Pt. Contested by Joel Morant (5.8 feet, ZONE). Michael Simmons misses. Rebound secured by Jaren George.

[00:09] Team_060 possession (Score: 77-77)
Immanuel Ming attempts a 3Pt. Contested by Manu Anthony (4.1 feet, ZONE). IMMANUEL MING MAKES IT! Assist: Jaren George
Score: 77-80

================================================================================
                              3RD QUARTER COMPLETE                              
================================================================================

3RD QUARTER SCORE: Team_015 31, Team_060 29

BOX SCORE:
================================================================================

Team_015
--------------------------------------------------------------------------------
Player                MIN  PTS  REB  AST  TO      FG   FG%      3P   3P%
--------------------------------------------------------------------------------
Trae Turner            31    9    6    2   0   4/5    80.0     0/0   0.0
CJ Banchero            31    8    1    1   0   3/4    75.0     0/0   0.0
Manu Anthony           31    7    0    0   0   3/5    60.0     0/0   0.0
Scottie Gasol          31    5    0    2   0   2/3    66.7     0/0   0.0
Michael Simmons        31    2    2    1   0   1/2    50.0     0/0   0.0

TEAM: FG: 13/19 (68.4%), 3PT: 2/5 (40.0%), REB: 9 (1 off, 8 def), AST: 6, TO: 3
TEAM FOULS: 5 [Team_060 in BONUS]


Team_060
--------------------------------------------------------------------------------
Player                MIN  PTS  REB  AST  TO      FG   FG%      3P   3P%
--------------------------------------------------------------------------------
Immanuel Ming          31   10    3    1   0   4/5    80.0     0/0   0.0
Jaren George           31    8    8    1   0   4/6    66.7     0/0   0.0
Larry Westbrook        31    6    0    2   0   2/6    33.3     0/0   0.0
Julius Green           31    2    0    0   0   1/2    50.0     0/0   0.0
Joel Morant            31    1    0    1   0   1/1   100.0     0/0   0.0

TEAM: FG: 12/20 (60.0%), 3PT: 5/7 (71.4%), REB: 11 (6 off, 5 def), AST: 5, TO: 2
TEAM FOULS: 6 [Team_015 in BONUS]

================================================================================

================================================================================
                       4TH QUARTER - Team_015 vs Team_060                       
================================================================================

[12:00] Team_015 possession (Score: 77-80)
FOUL! Reach-in foul on Larry Westbrook during the drive. [Team fouls: 1] No free throws, side out. (Larry Westbrook: 1 personal fouls)

[11:45] Team_015 possession (Score: 77-80)
FOUL! Shooting foul on Larry Westbrook. Scottie Gasol to the line for 3 free throws. [Team fouls: 2] (Larry Westbrook: 2 personal fouls)   FT 1/3: GOOD   FT 2/3: GOOD   FT 3/3: MISS Scottie Gasol makes 2/3 from the line. Rebound secured by Immanuel Ming.
Score: 79-80

[11:26] Team_060 possession (Score: 79-80)
Immanuel Ming attempts a Midrange. Contested by Scottie Gasol (3.8 feet, ZONE). Immanuel Ming misses. Rebound secured by CJ Banchero.

[11:13] Team_015 possession (Score: 79-80)
CJ Banchero attempts a 3Pt. Contested by Julius Green (3.9 feet, ZONE). CJ BANCHERO MAKES IT! Assist: Trae Turner
Score: 82-80

[11:00] Team_060 possession (Score: 82-80)
Immanuel Ming attempts a Midrange. Contested by Michael Simmons (3.7 feet, ZONE). Immanuel Ming misses. Rebound secured by Trae Turner.

[10:45] Team_015 possession (Score: 82-80)
FOUL! Reach-in foul on Jaren George during the drive. [Team fouls: 3] No free throws, side out. (Jaren George: 1 personal fouls)

[10:31] Team_015 possession (Score: 82-80)
FOUL! Shooting foul on Larry Westbrook. Scottie Gasol to the line for 2 free throws. [Team fouls: 4] (Larry Westbrook: 3 personal fouls)   FT 1/2: MISS   FT 2/2: GOOD Scottie Gasol makes 1/2 from the line.
Score: 83-80

[10:16] Team_060 possession (Score: 83-80)
Immanuel Ming attempts a Layup. Contested by CJ Banchero (4.7 feet, MAN). IMMANUEL MING MAKES IT! Assist: Julius Green
Score: 83-82

[10:00] Team_015 possession (Score: 83-82)
Manu Anthony drives and kicks out. Michael Simmons attempts a 3Pt. Contested by Julius Green (4.3 feet, MAN). Michael Simmons misses. Rebound secured by Larry Westbrook.

[09:47] Team_060 possession (Score: 83-82)
Jaren George drives to the basket... Jaren George throws a bad pass out of bounds! TURNOVER! (dead ball)

[09:47] Substitution (Team_015): Manu Anthony OUT → Dwyane Sabonis IN (stamina_rule2)

[09:47] Substitution (Team_015): Michael Simmons OUT → Paolo Jokic IN (stamina_rule2)

[09:47] Substitution (Team_015): CJ Banchero OUT → Magic Wagner IN (stamina_rule2)

[09:47] Substitution (Team_015): Scottie Gasol OUT → Rudy Paul IN (stamina_rule2)

[09:47] Substitution (Team_015): Trae Turner OUT → Allen Curry IN (stamina_rule2)

[09:47] Substitution (Team_060): Joel Morant OUT → Domantas Barnes IN (stamina_rule2)

[09:47] Substitution (Team_060): Julius Green OUT → Rudy Ginobili IN (stamina_rule2)

[09:47] Substitution (Team_060): Immanuel Ming OUT → Jarrett Wagner IN (stamina_rule2)

[09:47] Substitution (Team_060): Larry Westbrook OUT → Yao Tatum IN (stamina_rule2)

[09:47] Substitution (Team_060): Jaren George OUT → Klay Haliburton IN (stamina_rule2)

[09:34] Team_015 possession (Score: 83-82)
Paolo Jokic attempts a Midrange. Contested by Rudy Ginobili (4.9 feet, MAN). PAOLO JOKIC MAKES IT! Assist: Magic Wagner
Score: 85-82

[09:17] Team_060 possession (Score: 85-82)
FOUL! Shooting foul on Magic Wagner. Jarrett Wagner to the line for 3 free throws. [Team fouls: 1] (Magic Wagner: 1 personal fouls)   FT 1/3: GOOD   FT 2/3: GOOD   FT 3/3: GOOD Jarrett Wagner makes 3/3 from the line.
Score: 85-85

[09:04] Team_015 possession (Score: 85-85)
Magic Wagner attempts a Midrange. Contested by Rudy Ginobili (4.3 feet, ZONE). Magic Wagner misses. Rebound secured by Domantas Barnes.

[08:53] Team_060 possession (Score: 85-85)
Rudy Ginobili drives, picks up Rudy Paul. Help arrives from Dwyane Sabonis! Rudy Ginobili attempts a Dunk. Contested by Dwyane Sabonis (3.5 feet, ZONE). Rudy Ginobili misses. Offensive rebound by Klay Haliburton! Klay Haliburton's putback is no good. Offensive rebound by Klay Haliburton! Klay Haliburton kicks it out.

[08:42] Team_060 possession (Score: 85-85)
Rudy Ginobili attempts a 3Pt. Contested by Rudy Paul (3.5 feet, ZONE). Rudy Ginobili misses. Rebound secured by Magic Wagner.

[08:31] Team_015 possession (Score: 85-85)
Rudy Paul attempts a 3Pt. Contested by Domantas Barnes (5.1 feet, ZONE). Rudy Paul misses. Rebound secured by Klay Haliburton.

[08:14] Team_060 possession (Score: 85-85)
Klay Haliburton throws a bad pass out of bounds! TURNOVER! (dead ball)

[07:59] Team_015 possession (Score: 85-85)
Magic Wagner drives, Jarrett Wagner stays with him. Magic Wagner attempts a Dunk. Contested by Jarrett Wagner (4.8 feet, MAN). MAGIC WAGNER MAKES IT!
Score: 87-85

[07:43] Team_060 possession (Score: 87-85)
Yao Tatum attempts a Layup. Contested by Rudy Paul (3.3 feet, MAN). Yao Tatum misses. Rebound secured by Magic Wagner.

[07:26] Team_015 possession (Score: 87-85)
Rudy Paul attempts a Midrange. Contested by Jarrett Wagner (5.3 feet, ZONE). RUDY PAUL MAKES IT! Assist: Paolo Jokic
Score: 89-85

[07:11] Team_060 possession (Score: 89-85)
Klay Haliburton drives and kicks out. Klay Haliburton attempts a Midrange. Contested by Paolo Jokic (5.6 feet, ZONE). KLAY HALIBURTON MAKES IT! Assist: Domantas Barnes
Score: 89-87

[06:55] Team_015 possession (Score: 89-87)
Dwyane Sabonis attempts a Midrange. Contested by Domantas Barnes (4.8 feet, MAN). Dwyane Sabonis misses. Offensive rebound by Rudy Paul! Rudy Paul puts it back in!
Score: 91-87

[06:46] Team_060 possession (Score: 91-87)
Rudy Ginobili attempts a 3Pt. Contested by Paolo Jokic (5.9 feet, MAN). Rudy Ginobili misses. Rebound secured by Magic Wagner.

[06:35] Team_015 possession (Score: 91-87)
Rudy Paul loses control! Ball rolls out of bounds! TURNOVER! (dead ball)

[06:20] Team_060 possession (Score: 91-87)
FOUL! Reach-in foul on Allen Curry during the drive. [Team fouls: 2] No free throws, side out. (Allen Curry: 1 personal fouls)

[06:03] Team_060 possession (Score: 91-87)
Yao Tatum drives and kicks out. Rudy Ginobili attempts a 3Pt. Contested by Paolo Jokic (5.6 feet, MAN). Rudy Ginobili misses. Rebound secured by Magic Wagner.

[05:47] Team_015 possession (Score: 91-87)
Magic Wagner makes the Midrange and draws the foul on Jarrett Wagner! And-1! Magic Wagner to the line for 1. [BONUS: 5 team fouls] (Jarrett Wagner: 1 personal fouls)   FT 1/1: GOOD Magic Wagner makes 1/1 from the line.
Score: 94-87

[05:32] Team_060 possession (Score: 94-87)
Klay Haliburton attempts a Midrange. Contested by Allen Curry (4.7 feet, ZONE). Klay Haliburton misses. Rebound secured by Allen Curry.

[05:16] Team_015 possession (Score: 94-87)
Dwyane Sabonis drives, picks up Klay Haliburton. Help arrives from Domantas Barnes! Dwyane Sabonis attempts a Layup. Contested by Domantas Barnes (4.5 feet, ZONE). DWYANE SABONIS MAKES IT! Assist: Magic Wagner
Score: 96-87

[05:03] Team_060 possession (Score: 96-87)
Domantas Barnes attempts a 3Pt. Contested by Rudy Paul (3.2 feet, ZONE). Domantas Barnes misses. Rebound secured by Magic Wagner.

[04:52] Team_015 possession (Score: 96-87)
Dwyane Sabonis attempts a 3Pt. Contested by Domantas Barnes (4.8 feet, ZONE). Dwyane Sabonis misses. Offensive rebound by Rudy Paul! Rudy Paul puts it back in!
Score: 98-87

[04:35] Team_060 possession (Score: 98-87)
Rudy Ginobili attempts a Midrange. Contested by Paolo Jokic (5.9 feet, MAN). Rudy Ginobili misses. Rebound secured by Magic Wagner.

[04:25] Team_015 possession (Score: 98-87)
Magic Wagner attempts a 3Pt. Contested by Rudy Ginobili (4.3 feet, ZONE). MAGIC WAGNER MAKES IT!
Score: 101-87

[04:12] Team_060 possession (Score: 101-87)
Rudy Ginobili attempts a 3Pt. Contested by Rudy Paul (3.5 feet, ZONE). Rudy Ginobili misses. Rebound secured by Allen Curry.

[03:57] Team_015 possession (Score: 101-87)
Rudy Paul drives to the basket... Rudy Paul throws a bad pass out of bounds! TURNOVER! (dead ball)

[03:44] Team_060 possession (Score: 101-87)
Klay Haliburton attempts a Midrange. Contested by Rudy Paul (3.5 feet, MAN). Klay Haliburton misses. Rebound secured by Allen Curry.

[03:26] Team_015 possession (Score: 101-87)
Magic Wagner attempts a Layup. Contested by Jarrett Wagner (4.8 feet, MAN). Magic Wagner misses. Rebound secured by Domantas Barnes.

[03:10] Team_060 possession (Score: 101-87)
FOUL! Reach-in foul on Rudy Paul during the drive. [Team fouls: 3] No free throws, side out. (Rudy Paul: 1 personal fouls)

[02:53] Team_060 possession (Score: 101-87)
Rudy Ginobili attempts a 3Pt. Contested by Rudy Paul (3.5 feet, ZONE). Rudy Ginobili misses. Offensive rebound by Domantas Barnes! Domantas Barnes kicks it out.

[02:36] Team_060 possession (Score: 101-87)
FOUL! Holding foul on Magic Wagner. [Team fouls: 4] No free throws, side out. (Magic Wagner: 2 personal fouls)

[02:24] Team_060 possession (Score: 101-87)
Yao Tatum drives to the basket... FOUL! Offensive foul on Yao Tatum! Rudy Paul drew the charge! [Team fouls: 6] (Yao Tatum: 1 personal fouls) TURNOVER! (dead ball)

[02:10] Team_015 possession (Score: 101-87)
Allen Curry drives to the basket... Allen Curry throws a bad pass! Stolen by Klay Haliburton! TURNOVER! (live ball)

[01:58] Team_060 possession (Score: 101-87)
Jarrett Wagner drives and kicks out. Klay Haliburton attempts a 3Pt. Contested by Rudy Paul (3.4 feet, ZONE). Klay Haliburton misses. Rebound secured by Allen Curry.

[01:44] Team_015 possession (Score: 101-87)
Paolo Jokic attempts a Midrange. Contested by Jarrett Wagner (5.5 feet, ZONE). Paolo Jokic misses. Rebound secured by Rudy Ginobili.

[01:31] Team_060 possession (Score: 101-87)
Domantas Barnes drives, Dwyane Sabonis stays with him. Domantas Barnes attempts a Dunk. Contested by Dwyane Sabonis (4.9 feet, MAN). DOMANTAS BARNES MAKES IT! Assist: Jarrett Wagner
Score: 101-89

[01:16] Team_015 possession (Score: 101-89)
Allen Curry attempts a 3Pt. Contested by Klay Haliburton (4.8 feet, MAN). Allen Curry misses. Rebound secured by Rudy Ginobili.

[01:05] Team_060 possession (Score: 101-89)
Jarrett Wagner attempts a 3Pt. Contested by Rudy Paul (3.6 feet, ZONE). JARRETT WAGNER MAKES IT! Assist: Yao Tatum
Score: 101-92

[00:53] Team_015 possession (Score: 101-92)
Paolo Jokic attempts a Layup. Contested by Yao Tatum (5.9 feet, ZONE). PAOLO JOKIC MAKES IT! Assist: Magic Wagner
Score: 103-92

[00:34] Team_060 possession (Score: 103-92)
Rudy Ginobili attempts a Midrange. Wide open! Paolo Jokic is 6.0 feet away. [MAN] RUDY GINOBILI MAKES IT!
Score: 103-94

[00:20] Team_015 possession (Score: 103-94)
FOUL! Reach-in foul on Yao Tatum during the drive. [IN THE BONUS! 7 team fouls] Rudy Paul to the line for 2 free throws. (Yao Tatum: 2 personal fouls)   FT 1/2: GOOD   FT 2/2: GOOD Rudy Paul makes 2/2 from the line.
Score: 105-94

[00:02] Team_060 possession (Score: 105-94)
FOUL! Shooting foul on Rudy Paul. Klay Haliburton to the line for 2 free throws. [BONUS: 5 team fouls] (Rudy Paul: 2 personal fouls)   FT 1/2: GOOD   FT 2/2: GOOD Klay Haliburton makes 2/2 from the line.
Score: 105-96

================================================================================
                              4TH QUARTER COMPLETE                              
================================================================================

4TH QUARTER SCORE: Team_015 28, Team_060 16

BOX SCORE:
================================================================================

Team_015
--------------------------------------------------------------------------------
Player                MIN  PTS  REB  AST  TO      FG   FG%      3P   3P%
--------------------------------------------------------------------------------
Magic Wagner           15    8    6    3   0   3/5    60.0     0/0   0.0
Rudy Paul              15    8    2    0   0   4/5    80.0     0/0   0.0
Paolo Jokic            15    4    0    1   0   2/3    66.7     0/0   0.0
CJ Banchero            33    3    1    0   0   1/1   100.0     0/0   0.0
Dwyane Sabonis         15    2    0    0   0   1/1   100.0     0/0   0.0
Scottie Gasol          33    1    0    0   0   1/2    50.0     0/0   0.0
Trae Turner            33    0    1    1   0   0/0     0.0     0/0   0.0
Manu Anthony           33    0    0    0   0   0/1     0.0     0/0   0.0
Allen Curry            15    0    4    0   0   0/1     0.0     0/0   0.0

TEAM: FG: 12/19 (63.2%), 3PT: 3/6 (50.0%), REB: 14 (2 off, 12 def), AST: 5, TO: 3
TEAM FOULS: 5 [Team_060 in BONUS]


Team_060
--------------------------------------------------------------------------------
Player                MIN  PTS  REB  AST  TO      FG   FG%      3P   3P%
--------------------------------------------------------------------------------
Jarrett Wagner         15    6    0    1   0   2/3    66.7     0/0   0.0
Klay Haliburton        15    4    2    0   0   2/4    50.0     0/0   0.0
Immanuel Ming          33    2    1    0   0   1/3    33.3     0/0   0.0
Domantas Barnes        15    2    3    1   0   1/2    50.0     0/0   0.0
Rudy Ginobili          15    2    2    0   0   1/5    20.0     0/0   0.0
Julius Green           33    0    0    1   0   0/0     0.0     0/0   0.0
Larry Westbrook        33    0    1    0   0   0/0     0.0     0/0   0.0
Yao Tatum              15    0    0    1   0   0/2     0.0     0/0   0.0

TEAM: FG: 7/19 (36.8%), 3PT: 2/6 (33.3%), REB: 9 (2 off, 7 def), AST: 4, TO: 3
TEAM FOULS: 7 [Team_015 in BONUS]

================================================================================

================================================================================
                               FULL GAME COMPLETE                               
================================================================================

FINAL SCORE: Team_015 105, Team_060 96

SCORING BY QUARTER:
--------------------------------------------------------------------------------
Team                     Q1     Q2     Q3     Q4    FINAL
--------------------------------------------------------------------------------
Team_015                 17     29     31     28      105
Team_060                 19     32     29     16       96
--------------------------------------------------------------------------------

FULL GAME BOX SCORE:
================================================================================

Team_015
--------------------------------------------------------------------------------
Player                MIN  PTS  REB  AST  TO      FG   FG%      3P   3P%      FT STL BLK
--------------------------------------------------------------------------------
Manu Anthony           33   16    0    0   0   7/13   53.8   2/5    40.0   8/9     0   1
Michael Simmons        33   14   11    1   4   6/10   60.0   2/3    66.7   3/3     0   1
CJ Banchero            33   17    9    2   1   6/12   50.0   3/7    42.9   6/6     0   0
Scottie Gasol          33   12    1    2   2   5/8    62.5   1/3    33.3   7/9     2   1
Trae Turner            33   14   10    6   3   6/11   54.5   0/1     0.0   3/4     0   1
Dwyane Sabonis         15    2    0    0   2   4/4   100.0   1/1   100.0   0/0     0   0
Paolo Jokic            15    7    0    1   0   3/5    60.0   0/0     0.0   1/1     0   0
Magic Wagner           15   10    6    3   2   3/5    60.0   1/1   100.0   1/1     0   0
Rudy Paul              15   10    2    1   1   3/5    60.0   0/2     0.0   2/2     0   0
Allen Curry            15    0    6    0   0   0/2     0.0   0/1     0.0   0/0     0   0

TEAM: FG: 43/75 (57.3%), 3PT: 10/24 (41.7%), REB: 45 (4 off, 41 def), AST: 16, TO: 15


Team_060
--------------------------------------------------------------------------------
Player                MIN  PTS  REB  AST  TO      FG   FG%      3P   3P%      FT STL BLK
--------------------------------------------------------------------------------
Joel Morant            33    1    0    2   2   2/8    25.0   0/3     0.0   2/4     0   0
Julius Green           33    8    0    1   0   4/7    57.1   3/4    75.0   0/1     1   0
Immanuel Ming          33   17   11    3   1   6/16   37.5   2/8    25.0   3/3     1   0
Larry Westbrook        33   12    6    6   1   7/16   43.8   4/7    57.1   4/5     3   0
Jaren George           33   23   15    1   1   7/10   70.0   2/2   100.0   1/1     0   2
Domantas Barnes        15    2    6    2   0   1/4    25.0   0/3     0.0   0/0     0   0
Rudy Ginobili          15    7    4    1   0   3/7    42.9   1/4    25.0   0/0     0   0
Jarrett Wagner         15   10    0    2   0   4/5    80.0   2/2   100.0   7/8     0   0
Yao Tatum              15    2    0    1   1   1/3    33.3   0/0     0.0   0/0     0   0
Klay Haliburton        15    8    2    0   1   4/6    66.7   0/0     0.0   4/4     1   1

TEAM: FG: 39/82 (47.6%), 3PT: 14/33 (42.4%), REB: 44 (14 off, 30 def), AST: 19, TO: 7

================================================================================
