================================================================================
                        FULL GAME - Team_008 vs Team_017                        
================================================================================

================================================================================
                       1ST QUARTER - Team_008 vs Team_017                       
================================================================================

[12:00] Team_008 possession (Score: 0-0)
FOUL! Reach-in foul on Desmond Reaves during the drive. [Team fouls: 1] No free throws, side out. (Desmond Reaves: 1 personal fouls)

[11:45] Team_008 possession (Score: 0-0)
Khris Hyland drives, Bam Williamson stays with him. Khris Hyland attempts a Dunk. Contested by Bam Williamson (4.1 feet, ZONE). KHRIS HYLAND MAKES IT!
Score: 2-0

[11:34] Team_017 possession (Score: 2-0)
Bam Williamson drives to the basket... FOUL! Offensive foul on Bam Williamson! Magic Young drew the charge! [Team fouls: 2] (Bam Williamson: 1 personal fouls) TURNOVER! (dead ball)

[11:21] Team_008 possession (Score: 2-0)
FOUL! Shooting foul on Vince Banchero. Victor Leonard to the line for 2 free throws. [Team fouls: 3] (Vince Banchero: 1 personal fouls)   FT 1/2: GOOD   FT 2/2: MISS Victor Leonard makes 1/2 from the line. Rebound secured by Tony Smith.
Score: 3-0

[11:06] Team_017 possession (Score: 3-0)
FOUL! Shooting foul on Khris Hyland. Tony Smith to the line for 2 free throws. [Team fouls: 1] (Khris Hyland: 1 personal fouls)   FT 1/2: GOOD   FT 2/2: GOOD Tony Smith makes 2/2 from the line.
Score: 3-2

[10:51] Team_008 possession (Score: 3-2)
Magic Young attempts a Midrange. Contested by Bam Williamson (4.4 feet, MAN). MAGIC YOUNG MAKES IT!
Score: 5-2

[10:31] Team_017 possession (Score: 5-2)
FOUL! Holding foul on Tyrese Thompson. [Team fouls: 2] No free throws, side out. (Tyrese Thompson: 1 personal fouls)

[10:16] Team_017 possession (Score: 5-2)
Tony Smith drives, Tyrese Thompson stays with him. Tony Smith attempts a Layup. Contested by Tyrese Thompson (4.9 feet, ZONE). TONY SMITH MAKES IT! Assist: Vince Banchero
Score: 5-4

[10:02] Team_008 possession (Score: 5-4)
Jrue Harris attempts a Layup. Contested by Vince Banchero (4.1 feet, MAN). JRUE HARRIS MAKES IT! Assist: Tyrese Thompson
Score: 7-4

[09:45] Team_017 possession (Score: 7-4)
Kyrie Middleton makes the 3Pt and draws the foul on Tyrese Thompson! And-1! Kyrie Middleton to the line for 1. [Team fouls: 3] (Tyrese Thompson: 2 personal fouls)   FT 1/1: GOOD Kyrie Middleton makes 1/1 from the line.
Score: 7-8

[09:27] Team_008 possession (Score: 7-8)
FOUL! Shooting foul on Desmond Reaves. Khris Hyland to the line for 3 free throws. [Team fouls: 4] (Desmond Reaves: 2 personal fouls)   FT 1/3: MISS   FT 2/3: GOOD   FT 3/3: GOOD Khris Hyland makes 2/3 from the line.
Score: 9-8

[09:11] Team_017 possession (Score: 9-8)
Kyrie Middleton attempts a Midrange. Contested by Tyrese Thompson (4.7 feet, ZONE). Kyrie Middleton misses. Rebound secured by Magic Young.

[09:00] Team_008 possession (Score: 9-8)
Tyrese Thompson drives, picks up Bam Williamson. Help arrives from Vince Banchero! Tyrese Thompson attempts a Dunk. Contested by Vince Banchero (4.2 feet, ZONE). Tyrese Thompson misses. Rebound secured by Tony Smith.

[08:44] Team_017 possession (Score: 9-8)
Desmond Reaves attempts a Midrange. Contested by Victor Leonard (5.4 feet, MAN). Desmond Reaves misses. Rebound secured by Tyrese Thompson.

[08:31] Team_008 possession (Score: 9-8)
FOUL! Shooting foul on Bam Williamson. Magic Young to the line for 2 free throws. [BONUS: 5 team fouls] (Bam Williamson: 2 personal fouls)   FT 1/2: GOOD   FT 2/2: GOOD Magic Young makes 2/2 from the line.
Score: 11-8

[08:15] Team_017 possession (Score: 11-8)
Vince Banchero drives to the basket... Vince Banchero loses the ball! Stripped by Jrue Harris! TURNOVER! (live ball)

[08:02] Team_008 possession (Score: 11-8)
Tyrese Thompson attempts a 3Pt. Contested by Desmond Reaves (4.2 feet, ZONE). Tyrese Thompson misses. Offensive rebound by Magic Young! Magic Young's putback is no good. Rebound secured by Tony Smith.

[07:45] Team_017 possession (Score: 11-8)
Kyrie Middleton drives and kicks out. Kyrie Middleton attempts a 3Pt. Contested by Victor Leonard (5.0 feet, ZONE). Kyrie Middleton misses. Rebound secured by Magic Young.

[07:29] Team_008 possession (Score: 11-8)
Tyrese Thompson makes the Midrange and draws the foul on Kyrie Middleton! And-1! Tyrese Thompson to the line for 1. [BONUS: 6 team fouls] (Kyrie Middleton: 1 personal fouls)   FT 1/1: GOOD Tyrese Thompson makes 1/1 from the line.
Score: 14-8

[07:11] Team_017 possession (Score: 14-8)
FOUL! Holding foul on Tyrese Thompson. [Team fouls: 4] No free throws, side out. (Tyrese Thompson: 3 personal fouls)

[06:58] Team_017 possession (Score: 14-8)
FOUL! Holding foul on Tyrese Thompson. [IN THE BONUS! 5 team fouls] Kyrie Middleton to the line for 2 free throws. (Tyrese Thompson: 4 personal fouls)   FT 1/2: GOOD   FT 2/2: GOOD Kyrie Middleton makes 2/2 from the line.
Score: 14-10

[06:44] Team_008 possession (Score: 14-10)
Jrue Harris attempts a Midrange. Contested by Vince Banchero (4.1 feet, ZONE). Jrue Harris misses. Rebound secured by Tony Smith.

[06:32] Team_017 possession (Score: 14-10)
Desmond Reaves attempts a 3Pt. Contested by Victor Leonard (5.4 feet, MAN). Desmond Reaves misses. Rebound secured by Magic Young.

[06:18] Team_008 possession (Score: 14-10)
Jrue Harris attempts a Layup. Contested by Vince Banchero (4.1 feet, MAN). Jrue Harris misses. Rebound secured by Kyrie Middleton.

[06:03] Team_017 possession (Score: 14-10)
Bam Williamson drives to the basket... Bam Williamson throws a bad pass out of bounds! TURNOVER! (dead ball)

[05:51] Team_008 possession (Score: 14-10)
Jrue Harris attempts a 3Pt. Contested by Desmond Reaves (4.1 feet, ZONE). Jrue Harris misses. Rebound secured by Tony Smith.

[05:33] Team_017 possession (Score: 14-10)
Vince Banchero attempts a 3Pt. Contested by Jrue Harris (4.2 feet, MAN). Vince Banchero misses. Rebound secured by Khris Hyland.

[05:16] Team_008 possession (Score: 14-10)
Tyrese Thompson drives and kicks out. Khris Hyland attempts a 3Pt. Contested by Tony Smith (2.7 feet, MAN). Khris Hyland misses. Rebound secured by Kyrie Middleton.

[05:02] Team_017 possession (Score: 14-10)
Vince Banchero drives, picks up Jrue Harris. Help arrives from Khris Hyland! Vince Banchero attempts a Layup. Contested by Khris Hyland (4.3 feet, MAN). Vince Banchero misses. Rebound secured by Magic Young.

[04:50] Team_008 possession (Score: 14-10)
Khris Hyland attempts a Layup. BLOCKED BY TONY SMITH! Ball is loose! Rebound secured by Kyrie Middleton.

[04:34] Team_017 possession (Score: 14-10)
Tony Smith attempts a 3Pt. Contested by Victor Leonard (5.6 feet, ZONE). Tony Smith misses. Offensive rebound by Kyrie Middleton! Kyrie Middleton kicks it out.

[04:19] Team_017 possession (Score: 14-10)
Bam Williamson attempts a 3Pt. Contested by Victor Leonard (5.8 feet, ZONE). Bam Williamson misses. Rebound secured by Magic Young.

[04:01] Team_008 possession (Score: 14-10)
Tyrese Thompson attempts a 3Pt. Contested by Kyrie Middleton (5.2 feet, MAN). Tyrese Thompson misses. Rebound secured by Bam Williamson.

[03:46] Team_017 possession (Score: 14-10)
FOUL! Shooting foul on Jrue Harris. Tony Smith to the line for 2 free throws. [BONUS: 6 team fouls] (Jrue Harris: 1 personal fouls)   FT 1/2: GOOD   FT 2/2: GOOD Tony Smith makes 2/2 from the line.
Score: 14-12

[03:31] Team_008 possession (Score: 14-12)
Victor Leonard drives, Bam Williamson stays with him. Victor Leonard attempts a Layup. Contested by Bam Williamson (4.5 feet, ZONE). VICTOR LEONARD MAKES IT! Assist: Magic Young
Score: 16-12

[03:14] Team_017 possession (Score: 16-12)
Kyrie Middleton drives, picks up Tyrese Thompson. Help arrives from Jrue Harris! Kyrie Middleton attempts a Layup. Contested by Jrue Harris (4.9 feet, MAN). KYRIE MIDDLETON MAKES IT!
Score: 16-14

[03:01] Team_008 possession (Score: 16-14)
Magic Young attempts a 3Pt. Contested by Tony Smith (3.3 feet, ZONE). Magic Young misses. Rebound secured by Kyrie Middleton.

[02:51] Team_017 possession (Score: 16-14)
Desmond Reaves attempts a 3Pt. Contested by Victor Leonard (5.6 feet, ZONE). DESMOND REAVES MAKES IT! Assist: Kyrie Middleton
Score: 16-17

[02:39] Team_008 possession (Score: 16-17)
Magic Young attempts a Layup. BLOCKED BY BAM WILLIAMSON! Ball is loose! Offensive rebound by Magic Young! Magic Young kicks it out.

[02:24] Team_008 possession (Score: 16-17)
Tyrese Thompson attempts a 3Pt. Contested by Kyrie Middleton (5.4 feet, MAN). Tyrese Thompson misses. Offensive rebound by Tyrese Thompson! Tyrese Thompson kicks it out.

[02:12] Team_008 possession (Score: 16-17)
FOUL! Shooting foul on Bam Williamson. Magic Young to the line for 2 free throws. [BONUS: 7 team fouls] (Bam Williamson: 3 personal fouls)   FT 1/2: MISS   FT 2/2: GOOD Magic Young makes 1/2 from the line.
Score: 17-17

[01:58] Team_017 possession (Score: 17-17)
Bam Williamson drives, picks up Magic Young. Help arrives from Jrue Harris! Bam Williamson attempts a Layup. Contested by Jrue Harris (5.9 feet, MAN). BAM WILLIAMSON MAKES IT! Assist: Tony Smith
Score: 17-19

[01:43] Team_008 possession (Score: 17-19)
Victor Leonard attempts a Midrange. Contested by Desmond Reaves (4.7 feet, MAN). VICTOR LEONARD MAKES IT!
Score: 19-19

[01:25] Team_017 possession (Score: 19-19)
Tony Smith makes the Dunk and draws the foul on Tyrese Thompson! And-1! Tony Smith to the line for 1. [BONUS: 7 team fouls] (Tyrese Thompson: 5 personal fouls)   FT 1/1: GOOD Tony Smith makes 1/1 from the line.
Score: 19-22

[01:10] Team_008 possession (Score: 19-22)
Tyrese Thompson attempts a Layup. Contested by Kyrie Middleton (5.4 feet, MAN). TYRESE THOMPSON MAKES IT! Assist: Victor Leonard
Score: 21-22

[00:59] Team_017 possession (Score: 21-22)
Kyrie Middleton drives, Tyrese Thompson stays with him. Kyrie Middleton attempts a Layup. Contested by Tyrese Thompson (5.2 feet, MAN). Kyrie Middleton misses. Rebound secured by Magic Young.

[00:44] Team_008 possession (Score: 21-22)
Jrue Harris drives, picks up Bam Williamson. Help arrives from Vince Banchero! Jrue Harris attempts a Layup. Contested by Vince Banchero (4.6 feet, ZONE). JRUE HARRIS MAKES IT!
Score: 23-22

[00:30] Team_017 possession (Score: 23-22)
FOUL! Holding foul on Tyrese Thompson. [IN THE BONUS! 8 team fouls] Kyrie Middleton to the line for 2 free throws. (Tyrese Thompson: 6 personal fouls) Tyrese Thompson FOULS OUT!   FT 1/2: GOOD   FT 2/2: GOOD Kyrie Middleton makes 2/2 from the line.
Score: 23-24

[00:30] Substitution (Team_008): Tyrese Thompson OUT (stamina: 61) → Blake Holiday IN (foul_out)

[00:17] Team_008 possession (Score: 23-24)
Jrue Harris attempts a Midrange. Contested by Vince Banchero (4.6 feet, MAN). Jrue Harris misses. Rebound secured by Kyrie Middleton.

[00:01] Team_017 possession (Score: 23-24)
Kyrie Middleton attempts a Midrange. Contested by Magic Young (5.8 feet, MAN). Kyrie Middleton misses. Rebound secured by Khris Hyland.

================================================================================
                              1ST QUARTER COMPLETE                              
================================================================================

1ST QUARTER SCORE: Team_008 23, Team_017 24

BOX SCORE:
================================================================================

Team_008
--------------------------------------------------------------------------------
Player                MIN  PTS  REB  AST  TO      FG   FG%      3P   3P%
--------------------------------------------------------------------------------
Magic Young            12    5    7    1   0   3/4    75.0     0/0   0.0
Tyrese Thompson        12    5    2    1   0   2/6    33.3     0/0   0.0
Khris Hyland           12    4    2    0   0   2/3    66.7     0/0   0.0
Victor Leonard         12    4    0    1   0   2/3    66.7     0/0   0.0
Jrue Harris            12    4    0    0   0   2/6    33.3     0/0   0.0

TEAM: FG: 11/22 (50.0%), 3PT: 1/5 (20.0%), REB: 12 (3 off, 9 def), AST: 3, TO: 0
TEAM FOULS: 8 [Team_017 in BONUS]


Team_017
--------------------------------------------------------------------------------
Player                MIN  PTS  REB  AST  TO      FG   FG%      3P   3P%
--------------------------------------------------------------------------------
Kyrie Middleton        12   10    6    1   0   4/8    50.0     0/0   0.0
Tony Smith             12    9    5    1   0   4/4   100.0     0/0   0.0
Desmond Reaves         12    3    0    0   0   1/3    33.3     0/0   0.0
Bam Williamson         12    2    1    0   0   1/2    50.0     0/0   0.0
Vince Banchero         12    0    0    1   0   0/2     0.0     0/0   0.0

TEAM: FG: 10/19 (52.6%), 3PT: 2/5 (40.0%), REB: 11 (1 off, 10 def), AST: 3, TO: 3
TEAM FOULS: 7 [Team_008 in BONUS]

================================================================================

================================================================================
                       2ND QUARTER - Team_008 vs Team_017                       
================================================================================

[12:00] Team_008 possession (Score: 23-24)
FOUL! Reach-in foul on Bam Williamson during the drive. [Team fouls: 1] No free throws, side out. (Bam Williamson: 1 personal fouls)

[11:46] Team_008 possession (Score: 23-24)
Jrue Harris makes the Midrange and draws the foul on Vince Banchero! And-1! Jrue Harris to the line for 1. [Team fouls: 2] (Vince Banchero: 1 personal fouls)   FT 1/1: GOOD Jrue Harris makes 1/1 from the line.
Score: 26-24

[11:29] Team_017 possession (Score: 26-24)
Vince Banchero attempts a 3Pt. Contested by Jrue Harris (4.6 feet, MAN). Vince Banchero misses. Rebound secured by Khris Hyland.

[11:13] Team_008 possession (Score: 26-24)
FOUL! Reach-in foul on Bam Williamson during the drive. [Team fouls: 3] No free throws, side out. (Bam Williamson: 2 personal fouls)

[11:00] Team_008 possession (Score: 26-24)
Khris Hyland drives and kicks out. Magic Young attempts a Midrange. Contested by Tony Smith (3.2 feet, ZONE). MAGIC YOUNG MAKES IT! Assist: Tyrese Thompson
Score: 28-24

[10:50] Team_017 possession (Score: 28-24)
Bam Williamson makes the Layup and draws the foul on Tyrese Thompson! And-1! Bam Williamson to the line for 1. [Team fouls: 1] (Tyrese Thompson: 1 personal fouls)   FT 1/1: GOOD Bam Williamson makes 1/1 from the line.
Score: 28-27

[10:39] Team_008 possession (Score: 28-27)
Jrue Harris attempts a Midrange. Contested by Kyrie Middleton (5.5 feet, ZONE). JRUE HARRIS MAKES IT! Assist: Khris Hyland
Score: 30-27

[10:25] Team_017 possession (Score: 30-27)
FOUL! Shooting foul on Victor Leonard. Desmond Reaves to the line for 2 free throws. [Team fouls: 2] (Victor Leonard: 1 personal fouls)   FT 1/2: GOOD   FT 2/2: MISS Desmond Reaves makes 1/2 from the line. Rebound secured by Tyrese Thompson.
Score: 30-28

[10:12] Team_008 possession (Score: 30-28)
Khris Hyland attempts a 3Pt. Contested by Tony Smith (3.4 feet, ZONE). Khris Hyland misses. Rebound secured by Bam Williamson.

[09:58] Team_017 possession (Score: 30-28)
Tony Smith attempts a Layup. Contested by Khris Hyland (5.1 feet, MAN). Tony Smith misses. Rebound secured by Magic Young.

[09:44] Team_008 possession (Score: 30-28)
Victor Leonard drives to the basket... Victor Leonard loses control! Ball rolls out of bounds! TURNOVER! (dead ball)

[09:44] Substitution (Team_008): Victor Leonard OUT → Blake Holiday IN (stamina_rule2)

[09:44] Substitution (Team_008): Jrue Harris OUT → Chris Griffin IN (stamina_rule2)

[09:44] Substitution (Team_008): Khris Hyland OUT → Immanuel Young IN (stamina_rule2)

[09:44] Substitution (Team_008): Tyrese Thompson OUT → Khris Giddey IN (stamina_rule2)

[09:44] Substitution (Team_008): Magic Young OUT → Lamelo Middleton IN (stamina_rule2)

[09:44] Substitution (Team_017): Desmond Reaves OUT → Blake Reaves IN (stamina_rule2)

[09:44] Substitution (Team_017): Vince Banchero OUT → Tobias Bridges IN (stamina_rule2)

[09:44] Substitution (Team_017): Tony Smith OUT → Shaquille Stewart IN (stamina_rule2)

[09:44] Substitution (Team_017): Kyrie Middleton OUT → Ja Stewart IN (stamina_rule2)

[09:44] Substitution (Team_017): Bam Williamson OUT → Klay Holiday IN (stamina_rule2)

[09:32] Team_017 possession (Score: 30-28)
FOUL! Shooting foul on Immanuel Young. Shaquille Stewart to the line for 3 free throws. [Team fouls: 3] (Immanuel Young: 1 personal fouls)   FT 1/3: MISS   FT 2/3: GOOD   FT 3/3: GOOD Shaquille Stewart makes 2/3 from the line.
Score: 30-30

[09:13] Team_008 possession (Score: 30-30)
Immanuel Young attempts a Layup. Contested by Ja Stewart (5.2 feet, ZONE). IMMANUEL YOUNG MAKES IT!
Score: 32-30

[08:58] Team_017 possession (Score: 32-30)
Tobias Bridges attempts a 3Pt. Contested by Chris Griffin (5.4 feet, MAN). Tobias Bridges misses. Rebound secured by Khris Giddey.

[08:44] Team_008 possession (Score: 32-30)
Lamelo Middleton drives and kicks out. Lamelo Middleton attempts a 3Pt. Contested by Klay Holiday (5.1 feet, MAN). Lamelo Middleton misses. Rebound secured by Klay Holiday.

[08:34] Team_017 possession (Score: 32-30)
Blake Reaves attempts a 3Pt. Contested by Blake Holiday (5.3 feet, MAN). Blake Reaves misses. Rebound secured by Lamelo Middleton.

[08:19] Team_008 possession (Score: 32-30)
FOUL! Holding foul on Ja Stewart. [Team fouls: 4] No free throws, side out. (Ja Stewart: 1 personal fouls)

[08:06] Team_008 possession (Score: 32-30)
Chris Griffin attempts a 3Pt. Contested by Tobias Bridges (4.3 feet, MAN). Chris Griffin misses. Rebound secured by Klay Holiday.

[07:52] Team_017 possession (Score: 32-30)
FOUL! Shooting foul on Immanuel Young. Tobias Bridges to the line for 3 free throws. [Team fouls: 4] (Immanuel Young: 2 personal fouls)   FT 1/3: MISS   FT 2/3: GOOD   FT 3/3: GOOD Tobias Bridges makes 2/3 from the line.
Score: 32-32

[07:39] Team_008 possession (Score: 32-32)
Immanuel Young attempts a Midrange. Contested by Shaquille Stewart (4.8 feet, MAN). IMMANUEL YOUNG MAKES IT!
Score: 34-32

[07:25] Team_017 possession (Score: 34-32)
FOUL! Offensive foul on Tobias Bridges! Chris Griffin drew the charge! [Team fouls: 5] (Tobias Bridges: 1 personal fouls) TURNOVER! (dead ball)

[07:11] Team_008 possession (Score: 34-32)
Blake Holiday attempts a 3Pt. Contested by Tobias Bridges (4.2 feet, ZONE). Blake Holiday misses. Rebound secured by Shaquille Stewart.

[06:58] Team_017 possession (Score: 34-32)
Ja Stewart attempts a Midrange. Contested by Chris Griffin (4.9 feet, ZONE). Ja Stewart misses. Rebound secured by Chris Griffin.

[06:45] Team_008 possession (Score: 34-32)
Chris Griffin drives, Tobias Bridges stays with him. Chris Griffin attempts a Layup. Contested by Tobias Bridges (4.3 feet, MAN). CHRIS GRIFFIN MAKES IT! Assist: Lamelo Middleton
Score: 36-32

[06:28] Team_017 possession (Score: 36-32)
Klay Holiday makes the Layup and draws the foul on Chris Griffin! And-1! Klay Holiday to the line for 1. [BONUS: 5 team fouls] (Chris Griffin: 1 personal fouls)   FT 1/1: GOOD Klay Holiday makes 1/1 from the line.
Score: 36-35

[06:15] Team_008 possession (Score: 36-35)
Lamelo Middleton attempts a Layup. Contested by Klay Holiday (5.4 feet, MAN). LAMELO MIDDLETON MAKES IT!
Score: 38-35

[06:03] Team_017 possession (Score: 38-35)
Blake Reaves makes the Layup and draws the foul on Chris Griffin! And-1! Blake Reaves to the line for 1. [BONUS: 6 team fouls] (Chris Griffin: 2 personal fouls)   FT 1/1: GOOD Blake Reaves makes 1/1 from the line.
Score: 38-38

[05:45] Team_008 possession (Score: 38-38)
Khris Giddey drives to the basket... Khris Giddey loses control! Ball rolls out of bounds! TURNOVER! (dead ball)

[05:29] Team_017 possession (Score: 38-38)
Blake Reaves attempts a 3Pt. Contested by Khris Giddey (4.2 feet, ZONE). Blake Reaves misses. Rebound secured by Lamelo Middleton.

[05:13] Team_008 possession (Score: 38-38)
Immanuel Young makes the Dunk and draws the foul on Tobias Bridges! And-1! Immanuel Young to the line for 1. [BONUS: 6 team fouls] (Tobias Bridges: 2 personal fouls)   FT 1/1: GOOD Immanuel Young makes 1/1 from the line.
Score: 41-38

[05:00] Team_017 possession (Score: 41-38)
Klay Holiday attempts a Midrange. Contested by Lamelo Middleton (4.5 feet, MAN). Klay Holiday misses. Rebound secured by Chris Griffin.

[04:48] Team_008 possession (Score: 41-38)
Blake Holiday throws a bad pass out of bounds! TURNOVER! (dead ball)

[04:34] Team_017 possession (Score: 41-38)
FOUL! Shooting foul on Immanuel Young. Klay Holiday to the line for 2 free throws. [BONUS: 7 team fouls] (Immanuel Young: 3 personal fouls)   FT 1/2: GOOD   FT 2/2: GOOD Klay Holiday makes 2/2 from the line.
Score: 41-40

[04:25] Team_008 possession (Score: 41-40)
Lamelo Middleton drives and kicks out. Chris Griffin attempts a Midrange. Contested by Shaquille Stewart (4.4 feet, ZONE). Chris Griffin misses. Offensive rebound by Lamelo Middleton! Lamelo Middleton's putback is no good. Rebound secured by Shaquille Stewart.

[04:15] Team_017 possession (Score: 41-40)
FOUL! Holding foul on Blake Holiday. [IN THE BONUS! 8 team fouls] Blake Reaves to the line for 2 free throws. (Blake Holiday: 1 personal fouls)   FT 1/2: GOOD   FT 2/2: MISS Blake Reaves makes 1/2 from the line. Rebound secured by Khris Giddey.
Score: 41-41

[04:01] Team_008 possession (Score: 41-41)
Khris Giddey drives to the basket... FOUL! Offensive foul on Khris Giddey! Ja Stewart drew the charge! [Team fouls: 9] (Khris Giddey: 1 personal fouls) TURNOVER! (dead ball)

[03:47] Team_017 possession (Score: 41-41)
Ja Stewart attempts a 3Pt. Contested by Khris Giddey (3.9 feet, ZONE). Ja Stewart misses. Rebound secured by Khris Giddey.

[03:30] Team_008 possession (Score: 41-41)
Blake Holiday attempts a Layup. Contested by Ja Stewart (4.9 feet, ZONE). BLAKE HOLIDAY MAKES IT! Assist: Immanuel Young
Score: 43-41

[03:11] Team_017 possession (Score: 43-41)
Shaquille Stewart makes the 3Pt and draws the foul on Khris Giddey! And-1! Shaquille Stewart to the line for 1. [BONUS: 10 team fouls] (Khris Giddey: 2 personal fouls)   FT 1/1: GOOD Shaquille Stewart makes 1/1 from the line.
Score: 43-45

[03:02] Team_008 possession (Score: 43-45)
Khris Giddey loses control! Ball rolls out of bounds! TURNOVER! (dead ball)

[02:48] Team_017 possession (Score: 43-45)
Ja Stewart attempts a 3Pt. Contested by Khris Giddey (3.9 feet, ZONE). Ja Stewart misses. Rebound secured by Khris Giddey.

[02:34] Team_008 possession (Score: 43-45)
FOUL! Shooting foul on Ja Stewart. Khris Giddey to the line for 2 free throws. [BONUS: 7 team fouls] (Ja Stewart: 2 personal fouls)   FT 1/2: GOOD   FT 2/2: GOOD Khris Giddey makes 2/2 from the line.
Score: 45-45

[02:20] Team_017 possession (Score: 45-45)
Tobias Bridges drives, Chris Griffin stays with him. Tobias Bridges attempts a Dunk. Contested by Chris Griffin (5.4 feet, MAN). Tobias Bridges misses. Rebound secured by Khris Giddey.

[02:07] Team_008 possession (Score: 45-45)
Chris Griffin attempts a Midrange. Contested by Blake Reaves (5.6 feet, ZONE). Chris Griffin misses. Rebound secured by Shaquille Stewart.

[01:56] Team_017 possession (Score: 45-45)
Shaquille Stewart attempts a Layup. Contested by Khris Giddey (4.7 feet, ZONE). SHAQUILLE STEWART MAKES IT!
Score: 45-47

[01:41] Team_008 possession (Score: 45-47)
Lamelo Middleton attempts a Midrange. Contested by Shaquille Stewart (4.7 feet, ZONE). LAMELO MIDDLETON MAKES IT!
Score: 47-47

[01:26] Team_017 possession (Score: 47-47)
Shaquille Stewart attempts a 3Pt. Contested by Khris Giddey (4.7 feet, ZONE). Shaquille Stewart misses. Rebound secured by Lamelo Middleton.

[01:11] Team_008 possession (Score: 47-47)
Chris Griffin drives, Ja Stewart stays with him. Chris Griffin attempts a Layup. Contested by Ja Stewart (5.2 feet, ZONE). CHRIS GRIFFIN MAKES IT! Assist: Lamelo Middleton
Score: 49-47

[00:57] Team_017 possession (Score: 49-47)
Blake Reaves attempts a Midrange. Contested by Khris Giddey (4.4 feet, ZONE). BLAKE REAVES MAKES IT! Assist: Shaquille Stewart
Score: 49-49

[00:40] Team_008 possession (Score: 49-49)
Immanuel Young drives and kicks out. Lamelo Middleton attempts a 3Pt. Contested by Shaquille Stewart (4.6 feet, ZONE). Lamelo Middleton misses. Rebound secured by Shaquille Stewart.

[00:28] Team_017 possession (Score: 49-49)
Blake Reaves attempts a 3Pt. Contested by Blake Holiday (5.6 feet, MAN). BLAKE REAVES MAKES IT! Assist: Shaquille Stewart
Score: 49-52

[00:12] Team_008 possession (Score: 49-52)
Blake Holiday attempts a Layup. Contested by Blake Reaves (5.6 feet, MAN). BLAKE HOLIDAY MAKES IT!
Score: 51-52

================================================================================
                              2ND QUARTER COMPLETE                              
================================================================================

2ND QUARTER SCORE: Team_008 28, Team_017 28

BOX SCORE:
================================================================================

Team_008
--------------------------------------------------------------------------------
Player                MIN  PTS  REB  AST  TO      FG   FG%      3P   3P%
--------------------------------------------------------------------------------
Immanuel Young         10    7    0    1   0   3/4    75.0     0/0   0.0
Jrue Harris            15    5    0    0   0   2/2   100.0     0/0   0.0
Lamelo Middleton       10    4    3    2   0   2/4    50.0     0/0   0.0
Chris Griffin          10    4    2    0   0   2/4    50.0     0/0   0.0
Blake Holiday          10    4    0    0   0   2/3    66.7     0/0   0.0
Magic Young            15    2    1    0   0   1/1   100.0     0/0   0.0
Khris Giddey           10    2    5    0   0   1/1   100.0     0/0   0.0
Khris Hyland           15    0    1    1   0   0/1     0.0     0/0   0.0
Tyrese Thompson        14    0    1    1   0   0/0     0.0     0/0   0.0

TEAM: FG: 13/20 (65.0%), 3PT: 0/3 (0.0%), REB: 14 (1 off, 13 def), AST: 5, TO: 5
TEAM FOULS: 10 [Team_017 in BONUS]


Team_017
--------------------------------------------------------------------------------
Player                MIN  PTS  REB  AST  TO      FG   FG%      3P   3P%
--------------------------------------------------------------------------------
Shaquille Stewart      10    8    4    2   0   3/4    75.0     0/0   0.0
Blake Reaves           10    8    0    0   0   3/5    60.0     0/0   0.0
Klay Holiday           10    5    2    0   0   2/3    66.7     0/0   0.0
Bam Williamson         15    3    1    0   0   1/1   100.0     0/0   0.0
Tobias Bridges         10    2    0    0   0   1/3    33.3     0/0   0.0
Vince Banchero         15    0    0    0   0   0/1     0.0     0/0   0.0
Desmond Reaves         15    0    0    0   0   0/1     0.0     0/0   0.0
Tony Smith             15    0    0    0   0   0/1     0.0     0/0   0.0
Ja Stewart             10    0    0    0   0   0/3     0.0     0/0   0.0

TEAM: FG: 10/23 (43.5%), 3PT: 4/11 (36.4%), REB: 6 (0 off, 6 def), AST: 2, TO: 1
TEAM FOULS: 7 [Team_008 in BONUS]

================================================================================

================================================================================
                       3RD QUARTER - Team_008 vs Team_017                       
================================================================================

[12:00] Team_008 possession (Score: 51-52)
Khris Hyland attempts a Midrange. Contested by Tony Smith (2.8 feet, MAN). Khris Hyland misses. Rebound secured by Kyrie Middleton.

[11:48] Team_017 possession (Score: 51-52)
Desmond Reaves drives, Victor Leonard stays with him. Desmond Reaves attempts a Layup. Contested by Victor Leonard (5.4 feet, MAN). Desmond Reaves misses. Rebound secured by Tyrese Thompson.

[11:36] Team_008 possession (Score: 51-52)
Victor Leonard attempts a Midrange. Contested by Desmond Reaves (4.4 feet, MAN). Victor Leonard misses. Rebound secured by Tony Smith.

[11:23] Team_017 possession (Score: 51-52)
Tony Smith attempts a Midrange. Contested by Jrue Harris (4.8 feet, ZONE). Tony Smith misses. Offensive rebound by Kyrie Middleton! Kyrie Middleton kicks it out.

[11:08] Team_017 possession (Score: 51-52)
FOUL! Shooting foul on Jrue Harris. Desmond Reaves to the line for 2 free throws. [Team fouls: 1] (Jrue Harris: 1 personal fouls)   FT 1/2: GOOD   FT 2/2: GOOD Desmond Reaves makes 2/2 from the line.
Score: 51-54

[10:53] Team_008 possession (Score: 51-54)
Victor Leonard attempts a Midrange. Contested by Desmond Reaves (4.4 feet, MAN). Victor Leonard misses. Offensive rebound by Magic Young! Magic Young puts it back in!
Score: 53-54

[10:42] Team_017 possession (Score: 53-54)
Tony Smith drives and kicks out. Kyrie Middleton attempts a Midrange. Contested by Khris Hyland (4.0 feet, ZONE). Kyrie Middleton misses. Offensive rebound by Bam Williamson! Bam Williamson puts it back in!
Score: 53-56

[10:29] Team_008 possession (Score: 53-56)
Victor Leonard attempts a Midrange. Contested by Desmond Reaves (4.4 feet, MAN). VICTOR LEONARD MAKES IT! Assist: Khris Hyland
Score: 55-56

[10:11] Team_017 possession (Score: 55-56)
Kyrie Middleton makes the Layup and draws the foul on Tyrese Thompson! And-1! Kyrie Middleton to the line for 1. [Team fouls: 2] (Tyrese Thompson: 1 personal fouls)   FT 1/1: GOOD Kyrie Middleton makes 1/1 from the line.
Score: 55-59

[09:58] Team_008 possession (Score: 55-59)
Magic Young drives, Bam Williamson stays with him. Magic Young attempts a Dunk. Contested by Bam Williamson (4.4 feet, ZONE). MAGIC YOUNG MAKES IT!
Score: 57-59

[09:44] Team_017 possession (Score: 57-59)
Bam Williamson drives, picks up Magic Young. Help arrives from Jrue Harris! Bam Williamson attempts a Layup. Contested by Jrue Harris (5.7 feet, MAN). Bam Williamson misses. Rebound secured by Tyrese Thompson.

[09:31] Team_008 possession (Score: 57-59)
Victor Leonard attempts a Midrange. Contested by Vince Banchero (4.4 feet, ZONE). Victor Leonard misses. Rebound secured by Tony Smith.

[09:12] Team_017 possession (Score: 57-59)
Kyrie Middleton drives, picks up Tyrese Thompson. Help arrives from Jrue Harris! Kyrie Middleton attempts a Layup. Contested by Jrue Harris (4.7 feet, ZONE). Kyrie Middleton misses. Rebound secured by Tyrese Thompson.

[08:58] Team_008 possession (Score: 57-59)
Magic Young attempts a 3Pt. Contested by Bam Williamson (4.4 feet, MAN). MAGIC YOUNG MAKES IT!
Score: 60-59

[08:45] Team_017 possession (Score: 60-59)
Bam Williamson attempts a Midrange. Contested by Khris Hyland (4.8 feet, ZONE). BAM WILLIAMSON MAKES IT! Assist: Kyrie Middleton
Score: 60-61

[08:31] Team_008 possession (Score: 60-61)
Tyrese Thompson attempts a Midrange. Contested by Kyrie Middleton (5.2 feet, MAN). Tyrese Thompson misses. Offensive rebound by Magic Young! Magic Young's putback is no good. Rebound secured by Bam Williamson.

[08:13] Team_017 possession (Score: 60-61)
Vince Banchero makes the Layup and draws the foul on Tyrese Thompson! And-1! Vince Banchero to the line for 1. [Team fouls: 3] (Tyrese Thompson: 2 personal fouls)   FT 1/1: GOOD Vince Banchero makes 1/1 from the line.
Score: 60-64

[08:02] Team_008 possession (Score: 60-64)
Khris Hyland attempts a 3Pt. Contested by Tony Smith (2.8 feet, MAN). Khris Hyland misses. Rebound secured by Tony Smith.

[07:45] Team_017 possession (Score: 60-64)
Desmond Reaves loses control! Ball rolls out of bounds! TURNOVER! (dead ball)

[07:32] Team_008 possession (Score: 60-64)
Jrue Harris drives and kicks out. Victor Leonard attempts a 3Pt. Contested by Desmond Reaves (4.0 feet, ZONE). VICTOR LEONARD MAKES IT! Assist: Khris Hyland
Score: 63-64

[07:19] Team_017 possession (Score: 63-64)
Desmond Reaves attempts a 3Pt. BLOCKED BY VICTOR LEONARD! Ball is loose! Offensive rebound by Kyrie Middleton! Kyrie Middleton kicks it out.

[07:05] Team_017 possession (Score: 63-64)
Desmond Reaves attempts a Midrange. Contested by Jrue Harris (4.7 feet, ZONE). DESMOND REAVES MAKES IT! Assist: Tony Smith
Score: 63-66

[06:50] Team_008 possession (Score: 63-66)
Tyrese Thompson attempts a Layup. BLOCKED BY KYRIE MIDDLETON! Ball deflects out of bounds off Tyrese Thompson.

[06:37] Team_017 possession (Score: 63-66)
Desmond Reaves attempts a 3Pt. Contested by Victor Leonard (5.4 feet, ZONE). Desmond Reaves misses. Rebound secured by Khris Hyland.

[06:25] Team_008 possession (Score: 63-66)
FOUL! Reach-in foul on Vince Banchero during the drive. [Team fouls: 1] No free throws, side out. (Vince Banchero: 1 personal fouls)

[06:13] Team_008 possession (Score: 63-66)
FOUL! Holding foul on Bam Williamson. [Team fouls: 2] No free throws, side out. (Bam Williamson: 1 personal fouls)

[05:56] Team_008 possession (Score: 63-66)
Tyrese Thompson attempts a 3Pt. Contested by Desmond Reaves (4.2 feet, ZONE). Tyrese Thompson misses. Rebound secured by Bam Williamson.

[05:39] Team_017 possession (Score: 63-66)
Desmond Reaves makes the Layup and draws the foul on Jrue Harris! And-1! Desmond Reaves to the line for 1. [Team fouls: 4] (Jrue Harris: 2 personal fouls)   FT 1/1: GOOD Desmond Reaves makes 1/1 from the line.
Score: 63-69

[05:23] Team_008 possession (Score: 63-69)
Magic Young attempts a Layup. Contested by Bam Williamson (4.5 feet, ZONE). MAGIC YOUNG MAKES IT!
Score: 65-69

[05:06] Team_017 possession (Score: 65-69)
Bam Williamson attempts a Layup. Contested by Magic Young (5.7 feet, MAN). BAM WILLIAMSON MAKES IT! Assist: Kyrie Middleton
Score: 65-71

[04:54] Team_008 possession (Score: 65-71)
FOUL! Holding foul on Tony Smith. [Team fouls: 3] No free throws, side out. (Tony Smith: 1 personal fouls)

[04:40] Team_008 possession (Score: 65-71)
FOUL! Shooting foul on Desmond Reaves. Victor Leonard to the line for 2 free throws. [Team fouls: 4] (Desmond Reaves: 1 personal fouls)   FT 1/2: GOOD   FT 2/2: GOOD Victor Leonard makes 2/2 from the line.
Score: 67-71

[04:24] Team_017 possession (Score: 67-71)
Tony Smith attempts a 3Pt. Contested by Khris Hyland (4.7 feet, MAN). Tony Smith misses. Offensive rebound by Kyrie Middleton! Kyrie Middleton kicks it out.

[04:08] Team_017 possession (Score: 67-71)
Desmond Reaves attempts a Midrange. Contested by Victor Leonard (5.5 feet, MAN). DESMOND REAVES MAKES IT! Assist: Vince Banchero
Score: 67-73

[03:53] Team_008 possession (Score: 67-73)
Jrue Harris attempts a 3Pt. Contested by Tony Smith (3.0 feet, ZONE). Jrue Harris misses. Rebound secured by Bam Williamson.

[03:37] Team_017 possession (Score: 67-73)
Vince Banchero attempts a Midrange. Contested by Jrue Harris (4.4 feet, MAN). Vince Banchero misses. Rebound secured by Tyrese Thompson.

[03:24] Team_008 possession (Score: 67-73)
FOUL! Reach-in foul on Bam Williamson during the drive. [IN THE BONUS! 5 team fouls] Victor Leonard to the line for 2 free throws. (Bam Williamson: 2 personal fouls)   FT 1/2: GOOD   FT 2/2: GOOD Victor Leonard makes 2/2 from the line.
Score: 69-73

[03:12] Team_017 possession (Score: 69-73)
Vince Banchero attempts a 3Pt. Contested by Khris Hyland (4.2 feet, ZONE). VINCE BANCHERO MAKES IT!
Score: 69-76

[02:54] Team_008 possession (Score: 69-76)
Jrue Harris attempts a Midrange. Contested by Kyrie Middleton (5.3 feet, ZONE). Jrue Harris misses. Rebound secured by Kyrie Middleton.

[02:41] Team_017 possession (Score: 69-76)
Kyrie Middleton attempts a Layup. Contested by Tyrese Thompson (5.0 feet, MAN). KYRIE MIDDLETON MAKES IT! Assist: Bam Williamson
Score: 69-78

[02:28] Team_008 possession (Score: 69-78)
Tyrese Thompson attempts a 3Pt. Contested by Kyrie Middleton (5.4 feet, MAN). Tyrese Thompson misses. Rebound secured by Kyrie Middleton.

[02:12] Team_017 possession (Score: 69-78)
FOUL! Offensive foul on Tony Smith! Khris Hyland drew the charge! [Team fouls: 6] (Tony Smith: 2 personal fouls) TURNOVER! (dead ball)

[01:59] Team_008 possession (Score: 69-78)
Khris Hyland attempts a Midrange. Contested by Tony Smith (3.2 feet, MAN). KHRIS HYLAND MAKES IT! Assist: Victor Leonard
Score: 71-78

[01:45] Team_017 possession (Score: 71-78)
Bam Williamson attempts a Midrange. Contested by Tyrese Thompson (5.5 feet, ZONE). Bam Williamson misses. Rebound secured by Tyrese Thompson.

[01:31] Team_008 possession (Score: 71-78)
Victor Leonard attempts a Midrange. Contested by Desmond Reaves (4.7 feet, MAN). Victor Leonard misses. FOUL! Loose ball foul on Bam Williamson during the rebound battle. [IN THE BONUS! 7 team fouls] Tyrese Thompson to the line for 2 free throws. (Bam Williamson: 3 personal fouls)   FT 1/2: MISS   FT 2/2: GOOD Tyrese Thompson makes 1/2 from the line.
Score: 72-78

[01:15] Team_017 possession (Score: 72-78)
Tony Smith drives, Khris Hyland stays with him. Tony Smith attempts a Layup. Contested by Khris Hyland (5.0 feet, MAN). TONY SMITH MAKES IT! Assist: Kyrie Middleton
Score: 72-80

[01:01] Team_008 possession (Score: 72-80)
Victor Leonard attempts a 3Pt. Contested by Desmond Reaves (4.8 feet, MAN). Victor Leonard misses. Rebound secured by Bam Williamson.

[00:50] Team_017 possession (Score: 72-80)
Bam Williamson attempts a Midrange. Wide open! Magic Young is 6.1 feet away. [MAN] Bam Williamson misses. Rebound secured by Khris Hyland.

[00:31] Team_008 possession (Score: 72-80)
Victor Leonard attempts a 3Pt. Contested by Tony Smith (3.6 feet, ZONE). Victor Leonard misses. Rebound secured by Kyrie Middleton.

[00:21] Team_017 possession (Score: 72-80)
Desmond Reaves attempts a 3Pt. Contested by Victor Leonard (5.9 feet, MAN). DESMOND REAVES MAKES IT! Assist: Vince Banchero
Score: 72-83

[00:05] Team_008 possession (Score: 72-83)
Victor Leonard attempts a 3Pt. Contested by Desmond Reaves (4.9 feet, MAN). VICTOR LEONARD MAKES IT! Assist: Magic Young
Score: 75-83

================================================================================
                              3RD QUARTER COMPLETE                              
================================================================================

3RD QUARTER SCORE: Team_008 24, Team_017 31

BOX SCORE:
================================================================================

Team_008
--------------------------------------------------------------------------------
Player                MIN  PTS  REB  AST  TO      FG   FG%      3P   3P%
--------------------------------------------------------------------------------
Victor Leonard         27   12    0    1   0   5/9    55.6     0/0   0.0
Magic Young            27    9    1    1   0   4/4   100.0     0/0   0.0
Khris Hyland           27    2    2    2   0   1/3    33.3     0/0   0.0
Tyrese Thompson        26    1    5    0   0   1/5    20.0     0/0   0.0
Jrue Harris            27    0    0    0   0   0/2     0.0     0/0   0.0

TEAM: FG: 11/23 (47.8%), 3PT: 2/8 (25.0%), REB: 9 (2 off, 7 def), AST: 4, TO: 0
TEAM FOULS: 4


Team_017
--------------------------------------------------------------------------------
Player                MIN  PTS  REB  AST  TO      FG   FG%      3P   3P%
--------------------------------------------------------------------------------
Desmond Reaves         27   12    0    0   0   5/7    71.4     0/0   0.0
Bam Williamson         27    6    5    1   0   3/6    50.0     0/0   0.0
Vince Banchero         27    6    0    2   0   2/3    66.7     0/0   0.0
Kyrie Middleton        27    5    7    3   0   2/3    66.7     0/0   0.0
Tony Smith             27    2    3    1   0   1/1   100.0     0/0   0.0

TEAM: FG: 13/20 (65.0%), 3PT: 2/3 (66.7%), REB: 14 (4 off, 10 def), AST: 7, TO: 2
TEAM FOULS: 7 [Team_008 in BONUS]

================================================================================

================================================================================
                       4TH QUARTER - Team_008 vs Team_017                       
================================================================================

[12:00] Team_008 possession (Score: 75-83)
FOUL! Shooting foul on Bam Williamson. Magic Young to the line for 2 free throws. [Team fouls: 1] (Bam Williamson: 1 personal fouls)   FT 1/2: GOOD   FT 2/2: GOOD Magic Young makes 2/2 from the line.
Score: 77-83

[11:45] Team_017 possession (Score: 77-83)
Desmond Reaves attempts a 3Pt. Contested by Victor Leonard (5.7 feet, MAN). Desmond Reaves misses. Rebound secured by Khris Hyland.

[11:31] Team_008 possession (Score: 77-83)
Tyrese Thompson makes the 3Pt and draws the foul on Tony Smith! And-1! Tyrese Thompson to the line for 1. [Team fouls: 2] (Tony Smith: 1 personal fouls)   FT 1/1: GOOD Tyrese Thompson makes 1/1 from the line.
Score: 81-83

[11:16] Team_017 possession (Score: 81-83)
Kyrie Middleton attempts a 3Pt. BLOCKED BY VICTOR LEONARD! Ball is loose! Rebound secured by Magic Young.

[11:00] Team_008 possession (Score: 81-83)
Victor Leonard attempts a 3Pt. Contested by Kyrie Middleton (5.6 feet, ZONE). Victor Leonard misses. Rebound secured by Bam Williamson.

[10:47] Team_017 possession (Score: 81-83)
FOUL! Holding foul on Khris Hyland. [Team fouls: 1] No free throws, side out. (Khris Hyland: 1 personal fouls)

[10:33] Team_017 possession (Score: 81-83)
FOUL! Shooting foul on Khris Hyland. Tony Smith to the line for 3 free throws. [Team fouls: 2] (Khris Hyland: 2 personal fouls)   FT 1/3: GOOD   FT 2/3: GOOD   FT 3/3: MISS Tony Smith makes 2/3 from the line. Rebound secured by Khris Hyland.
Score: 81-85

[10:23] Team_008 possession (Score: 81-85)
Tyrese Thompson drives, picks up Kyrie Middleton. Help arrives from Vince Banchero! Tyrese Thompson attempts a Dunk. Contested by Vince Banchero (5.5 feet, MAN). TYRESE THOMPSON MAKES IT!
Score: 83-85

[10:11] Team_017 possession (Score: 83-85)
Bam Williamson attempts a Midrange. Wide open! Magic Young is 6.2 feet away. [MAN] Bam Williamson misses. Rebound secured by Khris Hyland.

[09:59] Team_008 possession (Score: 83-85)
Jrue Harris makes the Layup and draws the foul on Bam Williamson! And-1! Jrue Harris to the line for 1. [Team fouls: 3] (Bam Williamson: 2 personal fouls)   FT 1/1: GOOD Jrue Harris makes 1/1 from the line.
Score: 86-85

[09:44] Team_017 possession (Score: 86-85)
Bam Williamson drives, Magic Young stays with him. Bam Williamson attempts a Dunk. Wide open! Magic Young is 6.2 feet away. [MAN] BAM WILLIAMSON MAKES IT! Assist: Vince Banchero
Score: 86-87

[09:30] Team_008 possession (Score: 86-87)
Magic Young attempts a Layup. Contested by Bam Williamson (5.1 feet, MAN). Magic Young misses. Rebound secured by Bam Williamson.

[09:15] Team_017 possession (Score: 86-87)
Tony Smith drives, Tyrese Thompson stays with him. Tony Smith attempts a Layup. Contested by Tyrese Thompson (5.7 feet, ZONE). TONY SMITH MAKES IT! Assist: Bam Williamson
Score: 86-89

[09:01] Team_008 possession (Score: 86-89)
Victor Leonard attempts a Midrange. Contested by Desmond Reaves (5.0 feet, ZONE). VICTOR LEONARD MAKES IT!
Score: 88-89

[08:47] Team_017 possession (Score: 88-89)
FOUL! Shooting foul on Jrue Harris. Vince Banchero to the line for 2 free throws. [Team fouls: 3] (Jrue Harris: 1 personal fouls)   FT 1/2: GOOD   FT 2/2: GOOD Vince Banchero makes 2/2 from the line.
Score: 88-91

[08:34] Team_008 possession (Score: 88-91)
Victor Leonard drives, Bam Williamson stays with him. Victor Leonard attempts a Dunk. Contested by Bam Williamson (5.2 feet, ZONE). Victor Leonard misses. Rebound secured by Kyrie Middleton.

[08:20] Team_017 possession (Score: 88-91)
Vince Banchero makes the Layup and draws the foul on Tyrese Thompson! And-1! Vince Banchero to the line for 1. [Team fouls: 4] (Tyrese Thompson: 1 personal fouls)   FT 1/1: GOOD Vince Banchero makes 1/1 from the line.
Score: 88-94

[08:10] Team_008 possession (Score: 88-94)
Victor Leonard drives, Bam Williamson stays with him. Victor Leonard attempts a Layup. Contested by Bam Williamson (5.2 feet, ZONE). VICTOR LEONARD MAKES IT! Assist: Khris Hyland
Score: 90-94

[07:55] Team_017 possession (Score: 90-94)
Kyrie Middleton loses control! Ball rolls out of bounds! TURNOVER! (dead ball)

[07:55] Substitution (Team_008): Victor Leonard OUT → Blake Holiday IN (stamina_rule2)

[07:55] Substitution (Team_008): Jrue Harris OUT → Chris Griffin IN (stamina_rule2)

[07:55] Substitution (Team_008): Khris Hyland OUT → Immanuel Young IN (stamina_rule2)

[07:55] Substitution (Team_008): Tyrese Thompson OUT → Khris Giddey IN (stamina_rule2)

[07:55] Substitution (Team_008): Magic Young OUT → Lamelo Middleton IN (stamina_rule2)

[07:55] Substitution (Team_017): Desmond Reaves OUT → Blake Reaves IN (stamina_rule2)

[07:55] Substitution (Team_017): Vince Banchero OUT → Tobias Bridges IN (stamina_rule2)

[07:55] Substitution (Team_017): Tony Smith OUT → Shaquille Stewart IN (stamina_rule2)

[07:55] Substitution (Team_017): Kyrie Middleton OUT → Ja Stewart IN (stamina_rule2)

[07:55] Substitution (Team_017): Bam Williamson OUT → Klay Holiday IN (stamina_rule2)

[07:43] Team_008 possession (Score: 90-94)
Khris Giddey attempts a Midrange. Contested by Ja Stewart (4.6 feet, MAN). Khris Giddey misses. Rebound secured by Klay Holiday.

[07:29] Team_017 possession (Score: 90-94)
Shaquille Stewart drives to the basket... Shaquille Stewart throws a bad pass! Stolen by Lamelo Middleton! TURNOVER! (live ball)

[07:17] Team_008 possession (Score: 90-94)
Immanuel Young drives, Ja Stewart stays with him. Immanuel Young attempts a Dunk. Contested by Ja Stewart (5.2 feet, ZONE). IMMANUEL YOUNG MAKES IT! Assist: Khris Giddey
Score: 92-94

[07:05] Team_017 possession (Score: 92-94)
Tobias Bridges attempts a Layup. Contested by Lamelo Middleton (4.4 feet, ZONE). Tobias Bridges misses. Rebound secured by Chris Griffin.

[06:45] Team_008 possession (Score: 92-94)
Lamelo Middleton attempts a Midrange. Contested by Ja Stewart (5.0 feet, ZONE). Lamelo Middleton misses. Rebound secured by Shaquille Stewart.

[06:30] Team_017 possession (Score: 92-94)
Klay Holiday attempts a Midrange. Contested by Lamelo Middleton (4.5 feet, MAN). Klay Holiday misses. Rebound secured by Chris Griffin.

[06:16] Team_008 possession (Score: 92-94)
Immanuel Young attempts a 3Pt. Contested by Shaquille Stewart (4.8 feet, MAN). Immanuel Young misses. Rebound secured by Klay Holiday.

[06:04] Team_017 possession (Score: 92-94)
Blake Reaves drives to the basket... FOUL! Offensive foul on Blake Reaves! Lamelo Middleton drew the charge! [Team fouls: 4] (Blake Reaves: 1 personal fouls) TURNOVER! (dead ball)

[05:45] Team_008 possession (Score: 92-94)
Lamelo Middleton attempts a Midrange. Contested by Klay Holiday (5.4 feet, ZONE). Lamelo Middleton misses. Rebound secured by Klay Holiday.

[05:31] Team_017 possession (Score: 92-94)
FOUL! Shooting foul on Chris Griffin. Tobias Bridges to the line for 2 free throws. [BONUS: 5 team fouls] (Chris Griffin: 1 personal fouls)   FT 1/2: GOOD   FT 2/2: GOOD Tobias Bridges makes 2/2 from the line.
Score: 92-96

[05:18] Team_008 possession (Score: 92-96)
Blake Holiday attempts a 3Pt. Contested by Tobias Bridges (4.2 feet, ZONE). Blake Holiday misses. Rebound secured by Ja Stewart.

[05:02] Team_017 possession (Score: 92-96)
Klay Holiday attempts a Layup. Contested by Lamelo Middleton (4.5 feet, ZONE). Klay Holiday misses. Offensive rebound by Shaquille Stewart! Shaquille Stewart kicks it out.

[04:46] Team_017 possession (Score: 92-96)
Blake Reaves drives, Blake Holiday stays with him. Blake Reaves attempts a Dunk. Contested by Blake Holiday (5.3 feet, MAN). Blake Reaves misses. Rebound secured by Chris Griffin.

[04:36] Team_008 possession (Score: 92-96)
Chris Griffin drives, Tobias Bridges stays with him. Chris Griffin attempts a Layup. Contested by Tobias Bridges (4.3 feet, MAN). CHRIS GRIFFIN MAKES IT! Assist: Khris Giddey
Score: 94-96

[04:23] Team_017 possession (Score: 94-96)
Blake Reaves drives, Blake Holiday stays with him. Blake Reaves attempts a Dunk. Contested by Blake Holiday (5.3 feet, MAN). BLAKE REAVES MAKES IT!
Score: 94-98

[04:11] Team_008 possession (Score: 94-98)
FOUL! Shooting foul on Klay Holiday. Lamelo Middleton to the line for 2 free throws. [BONUS: 5 team fouls] (Klay Holiday: 1 personal fouls)   FT 1/2: MISS   FT 2/2: MISS Lamelo Middleton makes 0/2 from the line. Rebound secured by Shaquille Stewart.

[03:55] Team_017 possession (Score: 94-98)
Shaquille Stewart attempts a 3Pt. Contested by Immanuel Young (4.7 feet, MAN). SHAQUILLE STEWART MAKES IT! Assist: Blake Reaves
Score: 94-101

[03:41] Team_008 possession (Score: 94-101)
Lamelo Middleton attempts a Layup. Contested by Ja Stewart (5.0 feet, ZONE). LAMELO MIDDLETON MAKES IT! Assist: Blake Holiday
Score: 96-101

[03:28] Team_017 possession (Score: 96-101)
Tobias Bridges throws a bad pass out of bounds! TURNOVER! (dead ball)

[03:13] Team_008 possession (Score: 96-101)
Immanuel Young drives, Ja Stewart stays with him. Immanuel Young attempts a Dunk. Contested by Ja Stewart (5.2 feet, ZONE). IMMANUEL YOUNG MAKES IT!
Score: 98-101

[03:01] Team_017 possession (Score: 98-101)
Ja Stewart attempts a Layup. Contested by Khris Giddey (3.9 feet, MAN). JA STEWART MAKES IT! Assist: Klay Holiday
Score: 98-103

[02:47] Team_008 possession (Score: 98-103)
Chris Griffin attempts a 3Pt. Contested by Tobias Bridges (4.3 feet, MAN). Chris Griffin misses. Rebound secured by Klay Holiday.

[02:30] Team_017 possession (Score: 98-103)
Blake Reaves attempts a 3Pt. Contested by Blake Holiday (5.3 feet, MAN). BLAKE REAVES MAKES IT!
Score: 98-106

[02:11] Team_008 possession (Score: 98-106)
Khris Giddey drives to the basket... Khris Giddey loses the ball! Stripped by Ja Stewart! TURNOVER! (live ball)

[01:53] Team_017 possession (Score: 98-106)
Blake Reaves attempts a Midrange. Contested by Blake Holiday (5.3 feet, MAN). Blake Reaves misses. Rebound secured by Khris Giddey.

[01:42] Team_008 possession (Score: 98-106)
Immanuel Young attempts a Layup. BLOCKED BY SHAQUILLE STEWART! Ball is loose! Rebound secured by Klay Holiday.

[01:26] Team_017 possession (Score: 98-106)
Klay Holiday attempts a Layup. BLOCKED BY LAMELO MIDDLETON! Ball is loose! Offensive rebound by Ja Stewart! Ja Stewart kicks it out.

[01:08] Team_017 possession (Score: 98-106)
Klay Holiday drives, Lamelo Middleton stays with him. Klay Holiday attempts a Dunk. Contested by Lamelo Middleton (4.5 feet, ZONE). Klay Holiday misses. Offensive rebound by Shaquille Stewart! Shaquille Stewart kicks it out.

[00:53] Team_017 possession (Score: 98-106)
Ja Stewart attempts a 3Pt. Contested by Khris Giddey (3.9 feet, MAN). Ja Stewart misses. Rebound secured by Khris Giddey.

[00:40] Team_008 possession (Score: 98-106)
FOUL! Shooting foul on Ja Stewart. Khris Giddey to the line for 2 free throws. [BONUS: 6 team fouls] (Ja Stewart: 1 personal fouls)   FT 1/2: GOOD   FT 2/2: MISS Khris Giddey makes 1/2 from the line. Rebound secured by Ja Stewart.
Score: 99-106

[00:23] Team_017 possession (Score: 99-106)
Ja Stewart attempts a 3Pt. Contested by Khris Giddey (3.9 feet, MAN). JA STEWART MAKES IT! Assist: Shaquille Stewart
Score: 99-109

[00:07] Team_008 possession (Score: 99-109)
FOUL! Holding foul on Blake Reaves. [IN THE BONUS! 7 team fouls] Blake Holiday to the line for 2 free throws. (Blake Reaves: 2 personal fouls)   FT 1/2: GOOD   FT 2/2: GOOD Blake Holiday makes 2/2 from the line.
Score: 101-109

================================================================================
                              4TH QUARTER COMPLETE                              
================================================================================

4TH QUARTER SCORE: Team_008 26, Team_017 26

BOX SCORE:
================================================================================

Team_008
--------------------------------------------------------------------------------
Player                MIN  PTS  REB  AST  TO      FG   FG%      3P   3P%
--------------------------------------------------------------------------------
Tyrese Thompson        31    6    0    0   0   2/2   100.0     0/0   0.0
Victor Leonard         31    4    0    0   0   2/4    50.0     0/0   0.0
Immanuel Young         17    4    0    0   0   2/4    50.0     0/0   0.0
Jrue Harris            31    3    0    0   0   1/1   100.0     0/0   0.0
Magic Young            31    2    1    0   0   1/2    50.0     0/0   0.0
Chris Griffin          17    2    3    0   0   1/2    50.0     0/0   0.0
Lamelo Middleton       17    2    0    0   0   1/4    25.0     0/0   0.0
Blake Holiday          18    2    0    1   0   1/2    50.0     0/0   0.0
Khris Hyland           31    0    3    1   0   0/0     0.0     0/0   0.0
Khris Giddey           17    0    2    2   0   0/2     0.0     0/0   0.0

TEAM: FG: 11/23 (47.8%), 3PT: 1/5 (20.0%), REB: 9 (0 off, 9 def), AST: 4, TO: 1
TEAM FOULS: 5 [Team_017 in BONUS]


Team_017
--------------------------------------------------------------------------------
Player                MIN  PTS  REB  AST  TO      FG   FG%      3P   3P%
--------------------------------------------------------------------------------
Vince Banchero         31    5    0    1   0   2/2   100.0     0/0   0.0
Ja Stewart             17    5    3    0   0   2/3    66.7     0/0   0.0
Blake Reaves           17    5    0    1   0   2/4    50.0     0/0   0.0
Shaquille Stewart      17    3    4    1   0   1/1   100.0     0/0   0.0
Bam Williamson         31    2    2    1   0   1/2    50.0     0/0   0.0
Tony Smith             31    2    0    0   0   1/2    50.0     0/0   0.0
Tobias Bridges         17    2    0    0   0   1/2    50.0     0/0   0.0
Desmond Reaves         31    0    0    0   0   0/1     0.0     0/0   0.0
Kyrie Middleton        31    0    1    0   0   0/1     0.0     0/0   0.0
Klay Holiday           17    0    5    1   0   0/1     0.0     0/0   0.0

TEAM: FG: 10/19 (52.6%), 3PT: 3/7 (42.9%), REB: 15 (3 off, 12 def), AST: 5, TO: 4
TEAM FOULS: 7 [Team_008 in BONUS]

================================================================================

================================================================================
                               FULL GAME COMPLETE                               
================================================================================

FINAL SCORE: Team_008 101, Team_017 109

SCORING BY QUARTER:
--------------------------------------------------------------------------------
Team                     Q1     Q2     Q3     Q4    FINAL
--------------------------------------------------------------------------------
Team_008                 23     28     24     26      101
Team_017                 24     28     31     26      109
--------------------------------------------------------------------------------

FULL GAME BOX SCORE:
================================================================================

Team_008
--------------------------------------------------------------------------------
Player                MIN  PTS  REB  AST  TO      FG   FG%      3P   3P%      FT STL BLK
--------------------------------------------------------------------------------
Victor Leonard         31   20    0    2   0  10/17   58.8   1/4    25.0   5/6     0   2
Jrue Harris            31   12    0    0   0   6/12   50.0   0/2     0.0   2/2     1   0
Khris Hyland           31    6    8    4   0   4/8    50.0   1/3    33.3   2/3     0   0
Magic Young            31   18   10    2   0   7/9    77.8   1/2    50.0   5/6     0   0
Tyrese Thompson        31   12    8    2   1   4/12   33.3   1/5    20.0   3/4     0   0
Blake Holiday          18    6    0    1   2   2/4    50.0   0/2     0.0   2/2     0   0
Chris Griffin          17    6    5    0   0   3/6    50.0   0/2     0.0   0/0     0   0
Immanuel Young         17   11    0    1   1   5/8    62.5   0/1     0.0   1/1     0   0
Khris Giddey           17    2    7    2   1   1/3    33.3   0/0     0.0   3/4     0   0
Lamelo Middleton       17    6    3    2   1   3/8    37.5   0/0     0.0   0/2     1   1

TEAM: FG: 46/88 (52.3%), 3PT: 4/21 (19.0%), REB: 44 (6 off, 38 def), AST: 16, TO: 6


Team_017
--------------------------------------------------------------------------------
Player                MIN  PTS  REB  AST  TO      FG   FG%      3P   3P%      FT STL BLK
--------------------------------------------------------------------------------
Desmond Reaves         31   15    0    0   2   6/12   50.0   2/5    40.0   4/5     0   0
Vince Banchero         31   11    0    4   0   4/8    50.0   1/3    33.3   4/4     0   0
Tony Smith             31   13    8    2   1   7/9    77.8   0/1     0.0   7/8     0   1
Kyrie Middleton        31   15   14    4   1   4/10   40.0   1/2    50.0   6/6     0   1
Bam Williamson         31   13    9    2   2   5/10   50.0   0/1     0.0   1/1     0   1
Blake Reaves           17   13    0    1   0   5/9    55.6   2/4    50.0   2/3     0   0
Tobias Bridges         17    4    0    0   3   2/5    40.0   1/2    50.0   4/5     0   0
Shaquille Stewart      17   11    8    3   0   4/5    80.0   3/4    75.0   3/4     0   1
Ja Stewart             17    5    3    0   1   2/6    33.3   1/4    25.0   0/0     1   0
Klay Holiday           17    5    7    1   0   2/4    50.0   0/0     0.0   3/3     0   0

TEAM: FG: 43/81 (53.1%), 3PT: 11/26 (42.3%), REB: 46 (8 off, 38 def), AST: 17, TO: 10

================================================================================
