================================================================================
                        FULL GAME - Team_005 vs Team_068                        
================================================================================

================================================================================
                       1ST QUARTER - Team_005 vs Team_068                       
================================================================================

[12:00] Team_005 possession (Score: 0-0)
Jalen Rozier attempts a 3Pt. Contested by Zion Anunoby (4.7 feet, ZONE). Jalen Rozier misses. Rebound secured by Gary Simons.

[11:44] Team_068 possession (Score: 0-0)
FOUL! Offensive foul on Malcolm Herro! Anthony Rozier drew the charge! [Team fouls: 1] (Malcolm Herro: 1 personal fouls) TURNOVER! (dead ball)

[11:27] Team_005 possession (Score: 0-0)
Brandon George attempts a 3Pt. Contested by Zion Anunoby (4.6 feet, MAN). Brandon George misses. Offensive rebound by Jalen Rozier! Jalen Rozier kicks it out.

[11:09] Team_005 possession (Score: 0-0)
Derrick Allen attempts a 3Pt. Contested by Zion Anunoby (4.8 feet, ZONE). Derrick Allen misses. FOUL! Loose ball foul on Jaren Johnson during the rebound battle. [Team fouls: 2] No free throws, side out. (Jaren Johnson: 1 personal fouls)

[10:55] Team_005 possession (Score: 0-0)
Brandon George drives, picks up Zion Anunoby. Help arrives from Jaren Johnson! Brandon George attempts a Layup. Contested by Jaren Johnson (4.6 feet, MAN). Brandon George misses. Rebound secured by Jaren Johnson.

[10:37] Team_068 possession (Score: 0-0)
Gary Simons attempts a Midrange. Contested by Anthony Rozier (5.4 feet, ZONE). Gary Simons misses. Offensive rebound by Jaren Johnson! Jaren Johnson kicks it out.

[10:26] Team_068 possession (Score: 0-0)
Nikola Ginobili attempts a Midrange. Contested by Cade Markkanen (3.3 feet, MAN). Nikola Ginobili misses. Rebound secured by Jalen Rozier.

[10:11] Team_005 possession (Score: 0-0)
Cade Markkanen drives, Nikola Ginobili stays with him. Cade Markkanen attempts a Layup. Contested by Nikola Ginobili (3.8 feet, ZONE). CADE MARKKANEN MAKES IT! Assist: Derrick Allen
Score: 2-0

[09:53] Team_068 possession (Score: 2-0)
Gary Simons drives and kicks out. Nikola Ginobili attempts a 3Pt. Contested by Derrick Allen (4.2 feet, ZONE). NIKOLA GINOBILI MAKES IT! Assist: Malcolm Herro
Score: 2-3

[09:38] Team_005 possession (Score: 2-3)
Anthony Rozier attempts a 3Pt. Contested by Malcolm Herro (4.3 feet, MAN). Anthony Rozier misses. Rebound secured by Nikola Ginobili.

[09:24] Team_068 possession (Score: 2-3)
Malcolm Herro drives, picks up Jalen Rozier. Help arrives from Anthony Rozier! Malcolm Herro attempts a Dunk. Contested by Anthony Rozier (4.9 feet, ZONE). MALCOLM HERRO MAKES IT! Assist: Nikola Ginobili
Score: 2-5

[09:08] Team_005 possession (Score: 2-5)
Derrick Allen attempts a Midrange. Contested by Gary Simons (3.6 feet, ZONE). Derrick Allen misses. Rebound secured by Jaren Johnson.

[08:52] Team_068 possession (Score: 2-5)
Gary Simons drives and kicks out. Jaren Johnson attempts a Midrange. Contested by Derrick Allen (4.2 feet, MAN). Jaren Johnson misses. Rebound secured by Jalen Rozier.

[08:38] Team_005 possession (Score: 2-5)
Brandon George attempts a Layup. Contested by Zion Anunoby (4.6 feet, MAN). BRANDON GEORGE MAKES IT! Assist: Cade Markkanen
Score: 4-5

[08:23] Team_068 possession (Score: 4-5)
Nikola Ginobili makes the Layup and draws the foul on Anthony Rozier! And-1! Nikola Ginobili to the line for 1. [Team fouls: 1] (Anthony Rozier: 1 personal fouls)   FT 1/1: GOOD Nikola Ginobili makes 1/1 from the line.
Score: 4-8

[08:06] Team_005 possession (Score: 4-8)
Anthony Rozier drives, Malcolm Herro stays with him. Anthony Rozier attempts a Layup. Contested by Malcolm Herro (4.3 feet, MAN). Anthony Rozier misses. Rebound secured by Gary Simons.

[07:56] Team_068 possession (Score: 4-8)
Zion Anunoby attempts a 3Pt. Contested by Anthony Rozier (5.0 feet, ZONE). Zion Anunoby misses. Rebound secured by Derrick Allen.

[07:36] Team_005 possession (Score: 4-8)
Jalen Rozier makes the Midrange and draws the foul on Gary Simons! And-1! Jalen Rozier to the line for 1. [Team fouls: 3] (Gary Simons: 1 personal fouls)   FT 1/1: MISS Jalen Rozier makes 0/1 from the line. FOUL! Loose ball foul on Gary Simons during the free throw rebound! [Team fouls: 4] No free throws, side out. (Gary Simons: 2 personal fouls)
Score: 6-8

[07:24] Team_005 possession (Score: 6-8)
Anthony Rozier drives to the basket... Anthony Rozier throws a bad pass! Stolen by Malcolm Herro! TURNOVER! (live ball)

[07:13] Team_068 possession (Score: 6-8)
Jaren Johnson attempts a 3Pt. Contested by Derrick Allen (4.7 feet, MAN). Jaren Johnson misses. FOUL! Loose ball foul on Derrick Allen during the rebound battle. [Team fouls: 2] No free throws, side out. (Derrick Allen: 1 personal fouls)

[06:58] Team_068 possession (Score: 6-8)
FOUL! Holding foul on Cade Markkanen. [Team fouls: 3] No free throws, side out. (Cade Markkanen: 1 personal fouls)

[06:48] Team_068 possession (Score: 6-8)
Nikola Ginobili throws a bad pass out of bounds! TURNOVER! (dead ball)

[06:35] Team_005 possession (Score: 6-8)
Derrick Allen attempts a Midrange. Contested by Jaren Johnson (4.0 feet, MAN). Derrick Allen misses. Rebound secured by Nikola Ginobili.

[06:23] Team_068 possession (Score: 6-8)
Jaren Johnson throws a bad pass out of bounds! TURNOVER! (dead ball)

[06:08] Team_005 possession (Score: 6-8)
Jalen Rozier drives and kicks out. Derrick Allen attempts a 3Pt. Contested by Jaren Johnson (3.6 feet, MAN). Derrick Allen misses. Rebound secured by Gary Simons.

[05:51] Team_068 possession (Score: 6-8)
Zion Anunoby makes the Layup and draws the foul on Anthony Rozier! And-1! Zion Anunoby to the line for 1. [Team fouls: 4] (Anthony Rozier: 2 personal fouls)   FT 1/1: GOOD Zion Anunoby makes 1/1 from the line.
Score: 6-11

[05:40] Team_005 possession (Score: 6-11)
Cade Markkanen drives and kicks out. FOUL! Shooting foul on Zion Anunoby. Anthony Rozier to the line for 3 free throws. [BONUS: 5 team fouls] (Zion Anunoby: 1 personal fouls)   FT 1/3: GOOD   FT 2/3: MISS   FT 3/3: GOOD Anthony Rozier makes 2/3 from the line.
Score: 8-11

[05:22] Team_068 possession (Score: 8-11)
Zion Anunoby attempts a 3Pt. Contested by Derrick Allen (4.6 feet, ZONE). Zion Anunoby misses. Rebound secured by Derrick Allen.

[05:10] Team_005 possession (Score: 8-11)
FOUL! Shooting foul on Zion Anunoby. Anthony Rozier to the line for 2 free throws. [BONUS: 6 team fouls] (Zion Anunoby: 2 personal fouls)   FT 1/2: MISS   FT 2/2: MISS Anthony Rozier makes 0/2 from the line. Rebound secured by Gary Simons.

[04:57] Team_068 possession (Score: 8-11)
Jaren Johnson attempts a Midrange. Contested by Derrick Allen (4.7 feet, MAN). Jaren Johnson misses. Offensive rebound by Nikola Ginobili! Nikola Ginobili's putback is no good. Offensive rebound by Nikola Ginobili! Nikola Ginobili kicks it out.

[04:44] Team_068 possession (Score: 8-11)
Zion Anunoby attempts a Layup. Contested by Brandon George (5.6 feet, MAN). Zion Anunoby misses. Rebound secured by Cade Markkanen.

[04:29] Team_005 possession (Score: 8-11)
FOUL! Shooting foul on Nikola Ginobili. Cade Markkanen to the line for 2 free throws. [BONUS: 7 team fouls] (Nikola Ginobili: 1 personal fouls)   FT 1/2: GOOD   FT 2/2: GOOD Cade Markkanen makes 2/2 from the line.
Score: 10-11

[04:16] Team_068 possession (Score: 10-11)
FOUL! Shooting foul on Anthony Rozier. Nikola Ginobili to the line for 2 free throws. [BONUS: 5 team fouls] (Anthony Rozier: 3 personal fouls)   FT 1/2: MISS   FT 2/2: GOOD Nikola Ginobili makes 1/2 from the line.
Score: 10-12

[04:03] Team_005 possession (Score: 10-12)
Brandon George attempts a 3Pt. Contested by Zion Anunoby (4.6 feet, ZONE). Brandon George misses. Rebound secured by Nikola Ginobili.

[03:47] Team_068 possession (Score: 10-12)
Nikola Ginobili attempts a Midrange. Contested by Cade Markkanen (3.5 feet, MAN). Nikola Ginobili misses. FOUL! Loose ball foul on Jalen Rozier during the rebound battle. [IN THE BONUS! 6 team fouls] Jaren Johnson to the line for 2 free throws. (Jalen Rozier: 1 personal fouls)   FT 1/2: GOOD   FT 2/2: GOOD Jaren Johnson makes 2/2 from the line.
Score: 10-14

[03:31] Team_005 possession (Score: 10-14)
Cade Markkanen makes the Layup and draws the foul on Nikola Ginobili! And-1! Cade Markkanen to the line for 1. [BONUS: 8 team fouls] (Nikola Ginobili: 2 personal fouls)   FT 1/1: GOOD Cade Markkanen makes 1/1 from the line.
Score: 13-14

[03:18] Team_068 possession (Score: 13-14)
FOUL! Shooting foul on Derrick Allen. Jaren Johnson to the line for 2 free throws. [BONUS: 7 team fouls] (Derrick Allen: 2 personal fouls)   FT 1/2: MISS   FT 2/2: GOOD Jaren Johnson makes 1/2 from the line.
Score: 13-15

[03:01] Team_005 possession (Score: 13-15)
Cade Markkanen drives and kicks out. Anthony Rozier attempts a Midrange. Contested by Malcolm Herro (4.4 feet, MAN). Anthony Rozier misses. Rebound secured by Jaren Johnson.

[02:44] Team_068 possession (Score: 13-15)
Malcolm Herro attempts a 3Pt. Contested by Jalen Rozier (5.1 feet, ZONE). MALCOLM HERRO MAKES IT! Assist: Gary Simons
Score: 13-18

[02:28] Team_005 possession (Score: 13-18)
Derrick Allen drives and kicks out. Jalen Rozier attempts a 3Pt. Contested by Gary Simons (3.5 feet, MAN). Jalen Rozier misses. Rebound secured by Jaren Johnson.

[02:13] Team_068 possession (Score: 13-18)
Malcolm Herro attempts a 3Pt. Contested by Anthony Rozier (4.9 feet, MAN). Malcolm Herro misses. Rebound secured by Jalen Rozier.

[01:57] Team_005 possession (Score: 13-18)
Jalen Rozier drives, Gary Simons stays with him. Jalen Rozier attempts a Dunk. Contested by Gary Simons (3.9 feet, MAN). Jalen Rozier misses. Rebound secured by Gary Simons.

[01:43] Team_068 possession (Score: 13-18)
Jaren Johnson throws a bad pass! Stolen by Derrick Allen! TURNOVER! (live ball)

[01:32] Team_005 possession (Score: 13-18)
Anthony Rozier makes the Layup and draws the foul on Malcolm Herro! And-1! Anthony Rozier to the line for 1. [BONUS: 9 team fouls] (Malcolm Herro: 2 personal fouls)   FT 1/1: GOOD Anthony Rozier makes 1/1 from the line.
Score: 16-18

[01:14] Team_068 possession (Score: 16-18)
Nikola Ginobili drives and kicks out. Gary Simons attempts a 3Pt. Contested by Jalen Rozier (5.3 feet, MAN). GARY SIMONS MAKES IT! Assist: Malcolm Herro
Score: 16-21

[00:59] Team_005 possession (Score: 16-21)
Anthony Rozier makes the 3Pt and draws the foul on Malcolm Herro! And-1! Anthony Rozier to the line for 1. [BONUS: 10 team fouls] (Malcolm Herro: 3 personal fouls)   FT 1/1: GOOD Anthony Rozier makes 1/1 from the line.
Score: 20-21

[00:44] Team_068 possession (Score: 20-21)
Gary Simons drives and kicks out. Jaren Johnson attempts a Midrange. Contested by Derrick Allen (4.6 feet, MAN). JAREN JOHNSON MAKES IT! Assist: Nikola Ginobili
Score: 20-23

[00:33] Team_005 possession (Score: 20-23)
FOUL! Holding foul on Nikola Ginobili. [IN THE BONUS! 11 team fouls] Cade Markkanen to the line for 2 free throws. (Nikola Ginobili: 3 personal fouls)   FT 1/2: GOOD   FT 2/2: MISS Cade Markkanen makes 1/2 from the line. Rebound secured by Nikola Ginobili.
Score: 21-23

[00:17] Team_068 possession (Score: 21-23)
Zion Anunoby drives and kicks out. Nikola Ginobili attempts a Midrange. Contested by Derrick Allen (4.7 feet, ZONE). Nikola Ginobili misses. Rebound secured by Jalen Rozier.

[00:03] Team_005 possession (Score: 21-23)
FOUL! Reach-in foul on Gary Simons during the drive. [IN THE BONUS! 12 team fouls] Derrick Allen to the line for 2 free throws. (Gary Simons: 3 personal fouls)   FT 1/2: GOOD   FT 2/2: GOOD Derrick Allen makes 2/2 from the line.
Score: 23-23

================================================================================
                              1ST QUARTER COMPLETE                              
================================================================================

1ST QUARTER SCORE: Team_005 23, Team_068 23

BOX SCORE:
================================================================================

Team_005
--------------------------------------------------------------------------------
Player                MIN  PTS  REB  AST  TO      FG   FG%      3P   3P%
--------------------------------------------------------------------------------
Anthony Rozier         12    9    0    0   0   3/6    50.0     0/0   0.0
Cade Markkanen         12    7    2    1   0   3/4    75.0     0/0   0.0
Brandon George         12    2    0    0   0   1/3    33.3     0/0   0.0
Derrick Allen          12    2    2    1   0   1/4    25.0     0/0   0.0
Jalen Rozier           12    0    6    0   0   0/3     0.0     0/0   0.0

TEAM: FG: 8/21 (38.1%), 3PT: 1/4 (25.0%), REB: 10 (3 off, 7 def), AST: 2, TO: 1
TEAM FOULS: 7 [Team_068 in BONUS]


Team_068
--------------------------------------------------------------------------------
Player                MIN  PTS  REB  AST  TO      FG   FG%      3P   3P%
--------------------------------------------------------------------------------
Nikola Ginobili        12    7    6    2   0   3/4    75.0     0/0   0.0
Jaren Johnson          12    5    5    0   0   3/3   100.0     0/0   0.0
Malcolm Herro          12    5    0    2   0   2/3    66.7     0/0   0.0
Gary Simons            12    3    5    1   0   1/2    50.0     0/0   0.0
Zion Anunoby           12    3    0    0   0   1/5    20.0     0/0   0.0

TEAM: FG: 10/17 (58.8%), 3PT: 1/4 (25.0%), REB: 16 (3 off, 13 def), AST: 5, TO: 4
TEAM FOULS: 12 [Team_005 in BONUS]

================================================================================

================================================================================
                       2ND QUARTER - Team_005 vs Team_068                       
================================================================================

[12:00] Team_005 possession (Score: 23-23)
Brandon George drives and kicks out. Cade Markkanen attempts a Midrange. Contested by Malcolm Herro (4.5 feet, ZONE). CADE MARKKANEN MAKES IT! Assist: Anthony Rozier
Score: 25-23

[11:47] Team_068 possession (Score: 25-23)
Gary Simons drives and kicks out. Malcolm Herro attempts a 3Pt. Contested by Anthony Rozier (5.0 feet, MAN). Malcolm Herro misses. Rebound secured by Derrick Allen.

[11:33] Team_005 possession (Score: 25-23)
FOUL! Reach-in foul on Gary Simons during the drive. [Team fouls: 1] No free throws, side out. (Gary Simons: 1 personal fouls)

[11:22] Team_005 possession (Score: 25-23)
Derrick Allen attempts a Layup. Contested by Jaren Johnson (4.3 feet, MAN). Derrick Allen misses. Rebound secured by Nikola Ginobili.

[11:10] Team_068 possession (Score: 25-23)
Malcolm Herro attempts a 3Pt. Contested by Brandon George (5.6 feet, ZONE). Malcolm Herro misses. Rebound secured by Derrick Allen.

[10:59] Team_005 possession (Score: 25-23)
Jalen Rozier drives, Gary Simons stays with him. Jalen Rozier attempts a Dunk. Contested by Gary Simons (4.0 feet, MAN). Jalen Rozier misses. Rebound secured by Jaren Johnson.

[10:40] Team_068 possession (Score: 25-23)
Malcolm Herro attempts a 3Pt. Contested by Derrick Allen (4.6 feet, ZONE). Malcolm Herro misses. Rebound secured by Cade Markkanen.

[10:29] Team_005 possession (Score: 25-23)
Cade Markkanen attempts a Midrange. Contested by Zion Anunoby (4.6 feet, ZONE). Cade Markkanen misses. Offensive rebound by Derrick Allen! Derrick Allen kicks it out.

[10:20] Team_005 possession (Score: 25-23)
Cade Markkanen makes the Layup and draws the foul on Malcolm Herro! And-1! Cade Markkanen to the line for 1. [Team fouls: 2] (Malcolm Herro: 1 personal fouls)   FT 1/1: GOOD Cade Markkanen makes 1/1 from the line.
Score: 28-23

[10:07] Team_068 possession (Score: 28-23)
Malcolm Herro attempts a Layup. Contested by Anthony Rozier (5.2 feet, MAN). MALCOLM HERRO MAKES IT!
Score: 28-25

[09:53] Team_005 possession (Score: 28-25)
Cade Markkanen drives, Gary Simons stays with him. Cade Markkanen attempts a Layup. Contested by Gary Simons (3.7 feet, ZONE). CADE MARKKANEN MAKES IT! Assist: Jalen Rozier
Score: 30-25

[09:38] Team_068 possession (Score: 30-25)
Nikola Ginobili drives, Cade Markkanen stays with him. Nikola Ginobili attempts a Layup. Contested by Cade Markkanen (4.1 feet, MAN). Nikola Ginobili misses. Rebound secured by Cade Markkanen.

[09:19] Team_005 possession (Score: 30-25)
Cade Markkanen drives and kicks out. Anthony Rozier attempts a 3Pt. Contested by Malcolm Herro (4.9 feet, MAN). Anthony Rozier misses. Rebound secured by Nikola Ginobili.

[09:07] Team_068 possession (Score: 30-25)
Jaren Johnson attempts a 3Pt. Contested by Derrick Allen (5.2 feet, MAN). Jaren Johnson misses. Rebound secured by Cade Markkanen.

[08:48] Team_005 possession (Score: 30-25)
Cade Markkanen attempts a Midrange. Contested by Nikola Ginobili (4.8 feet, MAN). Cade Markkanen misses. Rebound secured by Nikola Ginobili.

[08:30] Team_068 possession (Score: 30-25)
Jaren Johnson attempts a 3Pt. Contested by Derrick Allen (5.3 feet, ZONE). Jaren Johnson misses. Rebound secured by Cade Markkanen.

[08:13] Team_005 possession (Score: 30-25)
Derrick Allen attempts a Midrange. Contested by Jaren Johnson (4.7 feet, MAN). Derrick Allen misses. Rebound secured by Jaren Johnson.

[08:00] Team_068 possession (Score: 30-25)
Zion Anunoby drives to the basket... FOUL! Offensive foul on Zion Anunoby! Cade Markkanen drew the charge! [Team fouls: 3] (Zion Anunoby: 1 personal fouls) TURNOVER! (dead ball)

[07:48] Team_005 possession (Score: 30-25)
Cade Markkanen attempts a Midrange. Contested by Nikola Ginobili (4.9 feet, MAN). Cade Markkanen misses. Rebound secured by Nikola Ginobili.

[07:33] Team_068 possession (Score: 30-25)
Gary Simons drives and kicks out. Gary Simons attempts a Midrange. Contested by Jalen Rozier (5.8 feet, MAN). Gary Simons misses. Rebound secured by Jalen Rozier.

[07:20] Team_005 possession (Score: 30-25)
Derrick Allen loses control! Ball rolls out of bounds! TURNOVER! (dead ball)

[07:20] Substitution (Team_005): Brandon George OUT → Blake O'Neal IN (stamina_rule2)

[07:20] Substitution (Team_005): Anthony Rozier OUT → Draymond Smith IN (stamina_rule2)

[07:20] Substitution (Team_005): Derrick Allen OUT → Lauri Wade IN (stamina_rule2)

[07:20] Substitution (Team_005): Jalen Rozier OUT → Isaiah Durant IN (stamina_rule2)

[07:20] Substitution (Team_005): Cade Markkanen OUT → Zion Parker IN (stamina_rule2)

[07:20] Substitution (Team_068): Zion Anunoby OUT → Cole Anthony IN (stamina_rule2)

[07:20] Substitution (Team_068): Malcolm Herro OUT → Ja Banchero IN (stamina_rule2)

[07:20] Substitution (Team_068): Jaren Johnson OUT → Miles Murray IN (stamina_rule2)

[07:20] Substitution (Team_068): Gary Simons OUT → Jarrett Oladipo IN (stamina_rule2)

[07:20] Substitution (Team_068): Nikola Ginobili OUT → Franz Curry IN (stamina_rule2)

[07:03] Team_068 possession (Score: 30-25)
Jarrett Oladipo drives and kicks out. Miles Murray attempts a 3Pt. Contested by Blake O'Neal (4.1 feet, ZONE). Miles Murray misses. Rebound secured by Zion Parker.

[06:50] Team_005 possession (Score: 30-25)
Blake O'Neal attempts a Midrange. Contested by Miles Murray (4.3 feet, ZONE). Blake O'Neal misses. Rebound secured by Franz Curry.

[06:36] Team_068 possession (Score: 30-25)
Cole Anthony attempts a 3Pt. Contested by Blake O'Neal (4.0 feet, ZONE). Cole Anthony misses. Rebound secured by Zion Parker.

[06:22] Team_005 possession (Score: 30-25)
Isaiah Durant drives to the basket... FOUL! Offensive foul on Isaiah Durant! Jarrett Oladipo drew the charge! [Team fouls: 1] (Isaiah Durant: 1 personal fouls) TURNOVER! (dead ball)

[06:08] Team_068 possession (Score: 30-25)
FOUL! Shooting foul on Zion Parker. Franz Curry to the line for 2 free throws. [Team fouls: 2] (Zion Parker: 1 personal fouls)   FT 1/2: GOOD   FT 2/2: GOOD Franz Curry makes 2/2 from the line.
Score: 30-27

[05:58] Team_005 possession (Score: 30-27)
Draymond Smith attempts a 3Pt. Contested by Ja Banchero (4.9 feet, MAN). DRAYMOND SMITH MAKES IT!
Score: 33-27

[05:43] Team_068 possession (Score: 33-27)
FOUL! Shooting foul on Blake O'Neal. Franz Curry to the line for 2 free throws. [Team fouls: 3] (Blake O'Neal: 1 personal fouls)   FT 1/2: GOOD   FT 2/2: GOOD Franz Curry makes 2/2 from the line.
Score: 33-29

[05:29] Team_005 possession (Score: 33-29)
Blake O'Neal attempts a 3Pt. Contested by Cole Anthony (5.1 feet, MAN). Blake O'Neal misses. Rebound secured by Jarrett Oladipo.

[05:15] Team_068 possession (Score: 33-29)
Jarrett Oladipo attempts a 3Pt. Contested by Blake O'Neal (4.4 feet, ZONE). Jarrett Oladipo misses. Rebound secured by Zion Parker.

[04:56] Team_005 possession (Score: 33-29)
Zion Parker drives, picks up Franz Curry. Help arrives from Ja Banchero! Zion Parker attempts a Layup. Contested by Ja Banchero (4.4 feet, ZONE). ZION PARKER MAKES IT! Assist: Draymond Smith
Score: 35-29

[04:39] Team_068 possession (Score: 35-29)
Jarrett Oladipo throws a bad pass! Stolen by Isaiah Durant! TURNOVER! (live ball)

[04:25] Team_005 possession (Score: 35-29)
Blake O'Neal attempts a 3Pt. Contested by Cole Anthony (5.1 feet, MAN). Blake O'Neal misses. Offensive rebound by Zion Parker! Zion Parker puts it back in!
Score: 37-29

[04:09] Team_068 possession (Score: 37-29)
Ja Banchero drives and kicks out. Cole Anthony attempts a Midrange. Contested by Lauri Wade (5.0 feet, ZONE). COLE ANTHONY MAKES IT!
Score: 37-31

[03:58] Team_005 possession (Score: 37-31)
Blake O'Neal attempts a 3Pt. Contested by Ja Banchero (5.5 feet, ZONE). BLAKE O'NEAL MAKES IT!
Score: 40-31

[03:39] Team_068 possession (Score: 40-31)
Ja Banchero attempts a 3Pt. Contested by Draymond Smith (4.4 feet, MAN). Ja Banchero misses. Rebound secured by Zion Parker.

[03:26] Team_005 possession (Score: 40-31)
Isaiah Durant attempts a 3Pt. Contested by Ja Banchero (5.4 feet, ZONE). ISAIAH DURANT MAKES IT!
Score: 43-31

[03:11] Team_068 possession (Score: 43-31)
Cole Anthony attempts a 3Pt. Contested by Blake O'Neal (4.0 feet, ZONE). Cole Anthony misses. Rebound secured by Draymond Smith.

[02:56] Team_005 possession (Score: 43-31)
Isaiah Durant drives and kicks out. Zion Parker attempts a Midrange. Contested by Franz Curry (4.3 feet, MAN). Zion Parker misses. Rebound secured by Jarrett Oladipo.

[02:40] Team_068 possession (Score: 43-31)
Ja Banchero makes the Layup and draws the foul on Zion Parker! And-1! Ja Banchero to the line for 1. [Team fouls: 4] (Zion Parker: 2 personal fouls)   FT 1/1: GOOD Ja Banchero makes 1/1 from the line.
Score: 43-34

[02:24] Team_005 possession (Score: 43-34)
FOUL! Reach-in foul on Ja Banchero during the drive. [Team fouls: 4] No free throws, side out. (Ja Banchero: 1 personal fouls)

[02:06] Team_005 possession (Score: 43-34)
Zion Parker makes the Midrange and draws the foul on Ja Banchero! And-1! Zion Parker to the line for 1. [BONUS: 5 team fouls] (Ja Banchero: 2 personal fouls)   FT 1/1: GOOD Zion Parker makes 1/1 from the line.
Score: 46-34

[01:52] Team_068 possession (Score: 46-34)
Cole Anthony drives, Blake O'Neal stays with him. Cole Anthony attempts a Layup. Contested by Blake O'Neal (4.0 feet, MAN). COLE ANTHONY MAKES IT!
Score: 46-36

[01:32] Team_005 possession (Score: 46-36)
FOUL! Shooting foul on Franz Curry. Zion Parker to the line for 2 free throws. [BONUS: 6 team fouls] (Franz Curry: 1 personal fouls)   FT 1/2: MISS   FT 2/2: MISS Zion Parker makes 0/2 from the line. Rebound secured by Ja Banchero.

[01:13] Team_068 possession (Score: 46-36)
Ja Banchero drives, Zion Parker stays with him. Ja Banchero attempts a Dunk. Contested by Zion Parker (4.2 feet, ZONE). JA BANCHERO MAKES IT!
Score: 46-38

[00:54] Team_005 possession (Score: 46-38)
Blake O'Neal drives to the basket... Blake O'Neal throws a bad pass! Stolen by Franz Curry! TURNOVER! (live ball)

[00:41] Team_068 possession (Score: 46-38)
Franz Curry attempts a Layup. Contested by Zion Parker (4.5 feet, ZONE). FRANZ CURRY MAKES IT!
Score: 46-40

[00:28] Team_005 possession (Score: 46-40)
Zion Parker attempts a Midrange. Contested by Franz Curry (4.4 feet, MAN). Zion Parker misses. Rebound secured by Ja Banchero.

[00:12] Team_068 possession (Score: 46-40)
Cole Anthony drives to the basket... FOUL! Offensive foul on Cole Anthony! Blake O'Neal drew the charge! [Team fouls: 7] (Cole Anthony: 1 personal fouls) TURNOVER! (dead ball)

================================================================================
                              2ND QUARTER COMPLETE                              
================================================================================

2ND QUARTER SCORE: Team_005 23, Team_068 17

BOX SCORE:
================================================================================

Team_005
--------------------------------------------------------------------------------
Player                MIN  PTS  REB  AST  TO      FG   FG%      3P   3P%
--------------------------------------------------------------------------------
Cade Markkanen         17    7    4    0   0   3/6    50.0     0/0   0.0
Zion Parker             7    7    5    0   0   3/5    60.0     0/0   0.0
Blake O'Neal            7    3    0    0   0   1/3    33.3     0/0   0.0
Draymond Smith          7    3    1    1   0   1/1   100.0     0/0   0.0
Isaiah Durant           7    3    0    0   0   1/2    50.0     0/0   0.0
Anthony Rozier         17    0    0    1   0   0/0     0.0     0/0   0.0
Derrick Allen          17    0    3    0   0   0/2     0.0     0/0   0.0
Jalen Rozier           17    0    1    1   0   0/1     0.0     0/0   0.0

TEAM: FG: 9/20 (45.0%), 3PT: 4/5 (80.0%), REB: 14 (2 off, 12 def), AST: 3, TO: 3
TEAM FOULS: 4


Team_068
--------------------------------------------------------------------------------
Player                MIN  PTS  REB  AST  TO      FG   FG%      3P   3P%
--------------------------------------------------------------------------------
Franz Curry             7    6    1    0   0   3/3   100.0     0/0   0.0
Ja Banchero             7    5    2    0   0   2/3    66.7     0/0   0.0
Cole Anthony            7    4    0    0   0   2/4    50.0     0/0   0.0
Malcolm Herro          17    2    0    0   0   1/3    33.3     0/0   0.0
Gary Simons            17    0    0    0   0   0/2     0.0     0/0   0.0
Nikola Ginobili        17    0    4    0   0   0/1     0.0     0/0   0.0
Jaren Johnson          17    0    2    0   0   0/2     0.0     0/0   0.0
Jarrett Oladipo         7    0    2    0   0   0/2     0.0     0/0   0.0

TEAM: FG: 8/20 (40.0%), 3PT: 0/8 (0.0%), REB: 11 (0 off, 11 def), AST: 0, TO: 3
TEAM FOULS: 7 [Team_005 in BONUS]

================================================================================

================================================================================
                       3RD QUARTER - Team_005 vs Team_068                       
================================================================================

[12:00] Team_005 possession (Score: 46-40)
Brandon George attempts a 3Pt. Contested by Zion Anunoby (4.6 feet, ZONE). Brandon George misses. Rebound secured by Jaren Johnson.

[11:44] Team_068 possession (Score: 46-40)
Zion Anunoby attempts a 3Pt. Contested by Brandon George (5.5 feet, MAN). Zion Anunoby misses. Rebound secured by Cade Markkanen.

[11:29] Team_005 possession (Score: 46-40)
Jalen Rozier attempts a Layup. Contested by Gary Simons (3.5 feet, MAN). JALEN ROZIER MAKES IT!
Score: 48-40

[11:19] Team_068 possession (Score: 48-40)
FOUL! Shooting foul on Cade Markkanen. Zion Anunoby to the line for 2 free throws. [Team fouls: 1] (Cade Markkanen: 1 personal fouls)   FT 1/2: MISS   FT 2/2: GOOD Zion Anunoby makes 1/2 from the line.
Score: 48-41

[11:05] Team_005 possession (Score: 48-41)
Jalen Rozier drives, picks up Gary Simons. Help arrives from Malcolm Herro! Jalen Rozier attempts a Dunk. Contested by Malcolm Herro (3.5 feet, ZONE). JALEN ROZIER MAKES IT! Assist: Derrick Allen
Score: 50-41

[10:54] Team_068 possession (Score: 50-41)
FOUL! Holding foul on Cade Markkanen. [Team fouls: 2] No free throws, side out. (Cade Markkanen: 2 personal fouls)

[10:40] Team_068 possession (Score: 50-41)
Jaren Johnson makes the Midrange and draws the foul on Derrick Allen! And-1! Jaren Johnson to the line for 1. [Team fouls: 3] (Derrick Allen: 1 personal fouls)   FT 1/1: GOOD Jaren Johnson makes 1/1 from the line.
Score: 50-44

[10:28] Team_005 possession (Score: 50-44)
Jalen Rozier loses the ball! Stripped by Gary Simons! TURNOVER! (live ball)

[10:16] Team_068 possession (Score: 50-44)
Nikola Ginobili attempts a Layup. Contested by Cade Markkanen (3.3 feet, MAN). NIKOLA GINOBILI MAKES IT! Assist: Gary Simons
Score: 50-46

[10:03] Team_005 possession (Score: 50-46)
Anthony Rozier attempts a Layup. BLOCKED BY GARY SIMONS! Ball is loose! Rebound secured by Nikola Ginobili.

[09:51] Team_068 possession (Score: 50-46)
Nikola Ginobili attempts a 3Pt. Contested by Derrick Allen (4.3 feet, ZONE). Nikola Ginobili misses. Rebound secured by Derrick Allen.

[09:33] Team_005 possession (Score: 50-46)
Cade Markkanen drives to the basket... Cade Markkanen loses the ball! Stripped by Nikola Ginobili! TURNOVER! (live ball)

[09:16] Team_068 possession (Score: 50-46)
Malcolm Herro drives to the basket... FOUL! Offensive foul on Malcolm Herro! Anthony Rozier drew the charge! [Team fouls: 1] (Malcolm Herro: 1 personal fouls) TURNOVER! (dead ball)

[09:01] Team_005 possession (Score: 50-46)
Cade Markkanen drives, Nikola Ginobili stays with him. Cade Markkanen attempts a Layup. Contested by Nikola Ginobili (3.8 feet, MAN). Cade Markkanen misses. Rebound secured by Jaren Johnson.

[08:48] Team_068 possession (Score: 50-46)
Jaren Johnson makes the Midrange and draws the foul on Anthony Rozier! And-1! Jaren Johnson to the line for 1. [Team fouls: 4] (Anthony Rozier: 1 personal fouls)   FT 1/1: GOOD Jaren Johnson makes 1/1 from the line.
Score: 50-49

[08:36] Team_005 possession (Score: 50-49)
FOUL! Reach-in foul on Gary Simons during the drive. [Team fouls: 2] No free throws, side out. (Gary Simons: 1 personal fouls)

[08:23] Team_005 possession (Score: 50-49)
Cade Markkanen throws a bad pass out of bounds! TURNOVER! (dead ball)

[08:08] Team_068 possession (Score: 50-49)
Zion Anunoby drives, picks up Brandon George. Help arrives from Anthony Rozier! Zion Anunoby attempts a Layup. Contested by Anthony Rozier (5.5 feet, MAN). Zion Anunoby misses. Rebound secured by Jalen Rozier.

[07:50] Team_005 possession (Score: 50-49)
Brandon George attempts a 3Pt. Contested by Zion Anunoby (4.6 feet, ZONE). BRANDON GEORGE MAKES IT! Assist: Anthony Rozier
Score: 53-49

[07:37] Team_068 possession (Score: 53-49)
Nikola Ginobili drives, Cade Markkanen stays with him. Nikola Ginobili attempts a Dunk. Contested by Cade Markkanen (3.3 feet, ZONE). NIKOLA GINOBILI MAKES IT! Assist: Malcolm Herro
Score: 53-51

[07:25] Team_005 possession (Score: 53-51)
Derrick Allen attempts a 3Pt. Contested by Jaren Johnson (4.0 feet, MAN). DERRICK ALLEN MAKES IT!
Score: 56-51

[07:16] Team_068 possession (Score: 56-51)
Malcolm Herro attempts a Midrange. Contested by Anthony Rozier (4.6 feet, MAN). MALCOLM HERRO MAKES IT!
Score: 56-53

[07:00] Team_005 possession (Score: 56-53)
Derrick Allen drives and kicks out. Brandon George attempts a 3Pt. Contested by Zion Anunoby (4.4 feet, MAN). Brandon George misses. Rebound secured by Gary Simons.

[06:43] Team_068 possession (Score: 56-53)
Malcolm Herro drives and kicks out. Nikola Ginobili attempts a 3Pt. Contested by Derrick Allen (4.2 feet, ZONE). NIKOLA GINOBILI MAKES IT!
Score: 56-56

[06:24] Team_005 possession (Score: 56-56)
Jalen Rozier attempts a Midrange. Contested by Gary Simons (3.5 feet, MAN). Jalen Rozier misses. Rebound secured by Jaren Johnson.

[06:10] Team_068 possession (Score: 56-56)
Zion Anunoby attempts a 3Pt. Contested by Anthony Rozier (5.0 feet, ZONE). Zion Anunoby misses. Offensive rebound by Nikola Ginobili! Nikola Ginobili's putback is no good. Offensive rebound by Nikola Ginobili! Nikola Ginobili kicks it out.

[05:54] Team_068 possession (Score: 56-56)
Malcolm Herro attempts a 3Pt. Contested by Anthony Rozier (4.6 feet, MAN). MALCOLM HERRO MAKES IT! Assist: Gary Simons
Score: 56-59

[05:39] Team_005 possession (Score: 56-59)
Derrick Allen attempts a Midrange. Contested by Nikola Ginobili (4.5 feet, ZONE). Derrick Allen misses. Offensive rebound by Cade Markkanen! Cade Markkanen puts it back in!
Score: 58-59

[05:24] Team_068 possession (Score: 58-59)
FOUL! Holding foul on Cade Markkanen. [IN THE BONUS! 6 team fouls] Nikola Ginobili to the line for 2 free throws. (Cade Markkanen: 3 personal fouls)   FT 1/2: GOOD   FT 2/2: MISS Nikola Ginobili makes 1/2 from the line. Rebound secured by Derrick Allen.
Score: 58-60

[05:08] Team_005 possession (Score: 58-60)
Brandon George attempts a 3Pt. Contested by Zion Anunoby (4.6 feet, MAN). Brandon George misses. Rebound secured by Nikola Ginobili.

[04:51] Team_068 possession (Score: 58-60)
Jaren Johnson drives, picks up Derrick Allen. Help arrives from Anthony Rozier! Jaren Johnson attempts a Dunk. Contested by Anthony Rozier (4.7 feet, MAN). JAREN JOHNSON MAKES IT! Assist: Zion Anunoby
Score: 58-62

[04:36] Team_005 possession (Score: 58-62)
Anthony Rozier drives and kicks out. Cade Markkanen attempts a Midrange. Contested by Gary Simons (3.3 feet, ZONE). CADE MARKKANEN MAKES IT!
Score: 60-62

[04:18] Team_068 possession (Score: 60-62)
Jaren Johnson attempts a 3Pt. Contested by Derrick Allen (4.8 feet, ZONE). JAREN JOHNSON MAKES IT! Assist: Gary Simons
Score: 60-65

[04:03] Team_005 possession (Score: 60-65)
FOUL! Offensive foul on Anthony Rozier! Malcolm Herro drew the charge! [Team fouls: 7] (Anthony Rozier: 2 personal fouls) TURNOVER! (dead ball)

[03:49] Team_068 possession (Score: 60-65)
FOUL! Shooting foul on Derrick Allen. Jaren Johnson to the line for 3 free throws. [BONUS: 8 team fouls] (Derrick Allen: 2 personal fouls)   FT 1/3: GOOD   FT 2/3: GOOD   FT 3/3: GOOD Jaren Johnson makes 3/3 from the line.
Score: 60-68

[03:36] Team_005 possession (Score: 60-68)
Brandon George attempts a Midrange. Contested by Malcolm Herro (4.5 feet, ZONE). Brandon George misses. Rebound secured by Nikola Ginobili.

[03:19] Team_068 possession (Score: 60-68)
Malcolm Herro throws a bad pass out of bounds! TURNOVER! (dead ball)

[03:19] Substitution (Team_005): Brandon George OUT → Blake O'Neal IN (stamina_rule2)

[03:19] Substitution (Team_005): Anthony Rozier OUT → Draymond Smith IN (stamina_rule2)

[03:19] Substitution (Team_005): Cade Markkanen OUT → Zion Parker IN (stamina_rule2)

[03:19] Substitution (Team_068): Nikola Ginobili OUT → Franz Curry IN (stamina_rule2)

[03:04] Team_005 possession (Score: 60-68)
Derrick Allen attempts a 3Pt. Contested by Zion Anunoby (4.9 feet, ZONE). Derrick Allen misses. Rebound secured by Gary Simons.

[02:49] Team_068 possession (Score: 60-68)
Gary Simons drives and kicks out. Jaren Johnson attempts a 3Pt. Contested by Blake O'Neal (4.1 feet, ZONE). Jaren Johnson misses. Rebound secured by Zion Parker.

[02:35] Team_005 possession (Score: 60-68)
Derrick Allen drives to the basket... Derrick Allen loses the ball! Stripped by Franz Curry! TURNOVER! (live ball)

[02:20] Team_068 possession (Score: 60-68)
Malcolm Herro attempts a Midrange. Contested by Draymond Smith (4.2 feet, MAN). Malcolm Herro misses. Rebound secured by Zion Parker.

[02:06] Team_005 possession (Score: 60-68)
Zion Parker attempts a Layup. BLOCKED BY FRANZ CURRY! Ball goes out off Franz Curry. Zion Parker's ball!

[01:55] Team_005 possession (Score: 60-68)
Draymond Smith attempts a 3Pt. Contested by Zion Anunoby (4.4 feet, ZONE). DRAYMOND SMITH MAKES IT! Assist: Zion Parker
Score: 63-68

[01:43] Team_068 possession (Score: 63-68)
Franz Curry attempts a 3Pt. Contested by Blake O'Neal (4.6 feet, ZONE). Franz Curry misses. Rebound secured by Zion Parker.

[01:29] Team_005 possession (Score: 63-68)
Zion Parker attempts a Layup. BLOCKED BY FRANZ CURRY! Ball is loose! Rebound secured by Franz Curry.

[01:14] Team_068 possession (Score: 63-68)
Zion Anunoby attempts a Layup. Contested by Blake O'Neal (4.4 feet, MAN). ZION ANUNOBY MAKES IT! Assist: Gary Simons
Score: 63-70

[01:01] Team_005 possession (Score: 63-70)
FOUL! Shooting foul on Zion Anunoby. Blake O'Neal to the line for 2 free throws. [Team fouls: 3] (Zion Anunoby: 1 personal fouls)   FT 1/2: GOOD   FT 2/2: GOOD Blake O'Neal makes 2/2 from the line.
Score: 65-70

[00:44] Team_068 possession (Score: 65-70)
Franz Curry drives, picks up Zion Parker. Help arrives from Blake O'Neal! Franz Curry attempts a Dunk. Contested by Blake O'Neal (4.5 feet, MAN). FRANZ CURRY MAKES IT!
Score: 65-72

[00:28] Team_005 possession (Score: 65-72)
Zion Parker attempts a Midrange. Contested by Gary Simons (3.9 feet, ZONE). Zion Parker misses. Rebound secured by Gary Simons.

[00:16] Team_068 possession (Score: 65-72)
Jaren Johnson drives to the basket... Jaren Johnson loses the ball! Stripped by Zion Parker! TURNOVER! (live ball)

[00:01] Team_005 possession (Score: 65-72)
Jalen Rozier attempts a Midrange. Contested by Jaren Johnson (4.4 feet, ZONE). Jalen Rozier misses. Rebound secured by Jaren Johnson.

================================================================================
                              3RD QUARTER COMPLETE                              
================================================================================

3RD QUARTER SCORE: Team_005 19, Team_068 32

BOX SCORE:
================================================================================

Team_005
--------------------------------------------------------------------------------
Player                MIN  PTS  REB  AST  TO      FG   FG%      3P   3P%
--------------------------------------------------------------------------------
Cade Markkanen         26    4    2    0   0   2/3    66.7     0/0   0.0
Jalen Rozier           29    4    1    0   0   2/4    50.0     0/0   0.0
Brandon George         26    3    0    0   0   1/4    25.0     0/0   0.0
Derrick Allen          29    3    2    1   0   1/3    33.3     0/0   0.0
Draymond Smith         10    3    0    0   0   1/1   100.0     0/0   0.0
Blake O'Neal           10    2    0    0   0   1/1   100.0     0/0   0.0
Anthony Rozier         26    0    0    1   0   0/1     0.0     0/0   0.0
Zion Parker            10    0    3    1   0   0/2     0.0     0/0   0.0

TEAM: FG: 8/19 (42.1%), 3PT: 3/6 (50.0%), REB: 8 (1 off, 7 def), AST: 3, TO: 5
TEAM FOULS: 8 [Team_068 in BONUS]


Team_068
--------------------------------------------------------------------------------
Player                MIN  PTS  REB  AST  TO      FG   FG%      3P   3P%
--------------------------------------------------------------------------------
Jaren Johnson          29   14    4    0   0   5/5   100.0     0/0   0.0
Nikola Ginobili        26    7    4    0   0   3/4    75.0     0/0   0.0
Malcolm Herro          29    5    0    1   0   2/3    66.7     0/0   0.0
Zion Anunoby           29    3    0    1   0   2/4    50.0     0/0   0.0
Franz Curry            10    2    1    0   0   1/2    50.0     0/0   0.0
Gary Simons            29    0    3    4   0   0/1     0.0     0/0   0.0

TEAM: FG: 13/20 (65.0%), 3PT: 3/6 (50.0%), REB: 12 (1 off, 11 def), AST: 6, TO: 3
TEAM FOULS: 3

================================================================================

================================================================================
                       4TH QUARTER - Team_005 vs Team_068                       
================================================================================

[12:00] Team_005 possession (Score: 65-72)
Jalen Rozier attempts a 3Pt. Contested by Gary Simons (3.9 feet, MAN). Jalen Rozier misses. Rebound secured by Jaren Johnson.

[11:51] Team_068 possession (Score: 65-72)
Nikola Ginobili makes the Layup and draws the foul on Cade Markkanen! And-1! Nikola Ginobili to the line for 1. [Team fouls: 1] (Cade Markkanen: 1 personal fouls)   FT 1/1: GOOD Nikola Ginobili makes 1/1 from the line.
Score: 65-75

[11:34] Team_005 possession (Score: 65-75)
FOUL! Holding foul on Gary Simons. [Team fouls: 1] No free throws, side out. (Gary Simons: 1 personal fouls)

[11:17] Team_005 possession (Score: 65-75)
Anthony Rozier drives to the basket... FOUL! Offensive foul on Anthony Rozier! Malcolm Herro drew the charge! [Team fouls: 2] (Anthony Rozier: 1 personal fouls) TURNOVER! (dead ball)

[11:02] Team_068 possession (Score: 65-75)
Zion Anunoby drives, Cade Markkanen stays with him. Zion Anunoby attempts a Dunk. Contested by Cade Markkanen (3.6 feet, ZONE). ZION ANUNOBY MAKES IT! Assist: Gary Simons
Score: 65-77

[10:46] Team_005 possession (Score: 65-77)
Jalen Rozier throws a bad pass out of bounds! TURNOVER! (dead ball)

[10:46] Substitution (Team_005): Derrick Allen OUT → Lauri Wade IN (stamina_rule2)

[10:46] Substitution (Team_005): Jalen Rozier OUT → Isaiah Durant IN (stamina_rule2)

[10:46] Substitution (Team_068): Zion Anunoby OUT → Cole Anthony IN (stamina_rule2)

[10:46] Substitution (Team_068): Malcolm Herro OUT → Ja Banchero IN (stamina_rule2)

[10:46] Substitution (Team_068): Jaren Johnson OUT → Miles Murray IN (stamina_rule2)

[10:46] Substitution (Team_068): Gary Simons OUT → Jarrett Oladipo IN (stamina_rule2)

[10:36] Team_068 possession (Score: 65-77)
Nikola Ginobili drives, Isaiah Durant stays with him. Nikola Ginobili attempts a Dunk. Contested by Isaiah Durant (4.4 feet, ZONE). NIKOLA GINOBILI MAKES IT! Assist: Miles Murray
Score: 65-79

[10:20] Team_005 possession (Score: 65-79)
Anthony Rozier drives and kicks out. Brandon George attempts a 3Pt. Contested by Ja Banchero (5.1 feet, ZONE). BRANDON GEORGE MAKES IT! Assist: Lauri Wade
Score: 68-79

[10:08] Team_068 possession (Score: 68-79)
Cole Anthony drives to the basket... Cole Anthony throws a bad pass! Stolen by Cade Markkanen! TURNOVER! (live ball)

[09:56] Team_005 possession (Score: 68-79)
Cade Markkanen drives, Nikola Ginobili stays with him. Cade Markkanen attempts a Dunk. Contested by Nikola Ginobili (4.0 feet, ZONE). CADE MARKKANEN MAKES IT! Assist: Isaiah Durant
Score: 70-79

[09:43] Team_068 possession (Score: 70-79)
Ja Banchero attempts a Layup. Contested by Cade Markkanen (3.6 feet, ZONE). JA BANCHERO MAKES IT! Assist: Jarrett Oladipo
Score: 70-81

[09:28] Team_005 possession (Score: 70-81)
Brandon George attempts a 3Pt. Contested by Cole Anthony (4.9 feet, MAN). BRANDON GEORGE MAKES IT! Assist: Cade Markkanen
Score: 73-81

[09:12] Team_068 possession (Score: 73-81)
FOUL! Holding foul on Brandon George. [Team fouls: 3] No free throws, side out. (Brandon George: 1 personal fouls)

[08:54] Team_068 possession (Score: 73-81)
Miles Murray attempts a Layup. Contested by Lauri Wade (5.2 feet, MAN). Miles Murray misses. Rebound secured by Lauri Wade.

[08:38] Team_005 possession (Score: 73-81)
FOUL! Shooting foul on Nikola Ginobili. Anthony Rozier to the line for 2 free throws. [Team fouls: 2] (Nikola Ginobili: 1 personal fouls)   FT 1/2: GOOD   FT 2/2: GOOD Anthony Rozier makes 2/2 from the line.
Score: 75-81

[08:22] Team_068 possession (Score: 75-81)
Jarrett Oladipo attempts a Midrange. Contested by Isaiah Durant (4.7 feet, ZONE). Jarrett Oladipo misses. Offensive rebound by Nikola Ginobili! Nikola Ginobili's putback is no good. Offensive rebound by Jarrett Oladipo! Jarrett Oladipo kicks it out.

[08:11] Team_068 possession (Score: 75-81)
Jarrett Oladipo drives, Isaiah Durant stays with him. Jarrett Oladipo attempts a Layup. Contested by Isaiah Durant (4.7 feet, MAN). JARRETT OLADIPO MAKES IT! Assist: Ja Banchero
Score: 75-83

[07:53] Team_005 possession (Score: 75-83)
Cade Markkanen drives, picks up Nikola Ginobili. Help arrives from Ja Banchero! Cade Markkanen attempts a Dunk. Contested by Ja Banchero (4.3 feet, MAN). CADE MARKKANEN MAKES IT! Assist: Lauri Wade
Score: 77-83

[07:39] Team_068 possession (Score: 77-83)
Miles Murray attempts a 3Pt. Contested by Lauri Wade (5.2 feet, MAN). Miles Murray misses. Rebound secured by Cade Markkanen.

[07:29] Team_005 possession (Score: 77-83)
Cade Markkanen attempts a Layup. Contested by Nikola Ginobili (4.3 feet, MAN). CADE MARKKANEN MAKES IT!
Score: 79-83

[07:12] Team_068 possession (Score: 79-83)
FOUL! Shooting foul on Isaiah Durant. Nikola Ginobili to the line for 3 free throws. [Team fouls: 4] (Isaiah Durant: 1 personal fouls)   FT 1/3: GOOD   FT 2/3: MISS   FT 3/3: GOOD Nikola Ginobili makes 2/3 from the line.
Score: 79-85

[06:54] Team_005 possession (Score: 79-85)
Cade Markkanen drives to the basket... Cade Markkanen loses the ball! Stripped by Jarrett Oladipo! TURNOVER! (live ball)

[06:43] Team_068 possession (Score: 79-85)
FOUL! Shooting foul on Lauri Wade. Miles Murray to the line for 3 free throws. [BONUS: 5 team fouls] (Lauri Wade: 1 personal fouls)   FT 1/3: GOOD   FT 2/3: GOOD   FT 3/3: MISS Miles Murray makes 2/3 from the line. Rebound secured by Lauri Wade.
Score: 79-87

[06:33] Team_005 possession (Score: 79-87)
Lauri Wade attempts a Midrange. Contested by Miles Murray (4.0 feet, ZONE). Lauri Wade misses. Rebound secured by Nikola Ginobili.

[06:19] Team_068 possession (Score: 79-87)
Miles Murray attempts a Layup. Contested by Cade Markkanen (4.1 feet, ZONE). MILES MURRAY MAKES IT!
Score: 79-89

[06:02] Team_005 possession (Score: 79-89)
Anthony Rozier attempts a Midrange. Contested by Cole Anthony (4.7 feet, ZONE). ANTHONY ROZIER MAKES IT!
Score: 81-89

[05:49] Team_068 possession (Score: 81-89)
Miles Murray attempts a Midrange. Contested by Lauri Wade (5.2 feet, MAN). MILES MURRAY MAKES IT! Assist: Cole Anthony
Score: 81-91

[05:31] Team_005 possession (Score: 81-91)
Cade Markkanen drives and kicks out. Anthony Rozier attempts a 3Pt. Contested by Ja Banchero (5.1 feet, ZONE). ANTHONY ROZIER MAKES IT! Assist: Isaiah Durant
Score: 84-91

[05:20] Team_068 possession (Score: 84-91)
FOUL! Shooting foul on Isaiah Durant. Jarrett Oladipo to the line for 2 free throws. [BONUS: 6 team fouls] (Isaiah Durant: 2 personal fouls)   FT 1/2: GOOD   FT 2/2: GOOD Jarrett Oladipo makes 2/2 from the line.
Score: 84-93

[05:03] Team_005 possession (Score: 84-93)
FOUL! Reach-in foul on Nikola Ginobili during the drive. [Team fouls: 3] No free throws, side out. (Nikola Ginobili: 2 personal fouls)

[04:45] Team_005 possession (Score: 84-93)
FOUL! Reach-in foul on Cole Anthony during the drive. [Team fouls: 4] No free throws, side out. (Cole Anthony: 1 personal fouls)

[04:28] Team_005 possession (Score: 84-93)
FOUL! Holding foul on Miles Murray. [IN THE BONUS! 5 team fouls] Lauri Wade to the line for 2 free throws. (Miles Murray: 1 personal fouls)   FT 1/2: GOOD   FT 2/2: GOOD Lauri Wade makes 2/2 from the line.
Score: 86-93

[04:08] Team_068 possession (Score: 86-93)
Jarrett Oladipo drives, picks up Isaiah Durant. Help arrives from Anthony Rozier! Jarrett Oladipo attempts a Dunk. Contested by Anthony Rozier (4.7 feet, MAN). Jarrett Oladipo misses. Offensive rebound by Jarrett Oladipo! Jarrett Oladipo kicks it out.

[03:52] Team_068 possession (Score: 86-93)
Nikola Ginobili drives to the basket... Nikola Ginobili commits a violation (traveling/carry)! TURNOVER! (dead ball)

[03:52] Substitution (Team_005): Brandon George OUT → Blake O'Neal IN (stamina_rule2)

[03:52] Substitution (Team_005): Anthony Rozier OUT → Draymond Smith IN (stamina_rule2)

[03:52] Substitution (Team_005): Cade Markkanen OUT → Zion Parker IN (stamina_rule2)

[03:52] Substitution (Team_068): Nikola Ginobili OUT → Franz Curry IN (stamina_rule2)

[03:40] Team_005 possession (Score: 86-93)
Zion Parker attempts a Midrange. Contested by Franz Curry (4.4 feet, MAN). ZION PARKER MAKES IT! Assist: Lauri Wade
Score: 88-93

[03:29] Team_068 possession (Score: 88-93)
Jarrett Oladipo makes the Dunk and draws the foul on Zion Parker! And-1! Jarrett Oladipo to the line for 1. [BONUS: 7 team fouls] (Zion Parker: 1 personal fouls)   FT 1/1: GOOD Jarrett Oladipo makes 1/1 from the line.
Score: 88-96

[03:15] Team_005 possession (Score: 88-96)
Isaiah Durant drives, Franz Curry stays with him. Isaiah Durant attempts a Dunk. Contested by Franz Curry (4.6 feet, ZONE). Isaiah Durant misses. Rebound secured by Ja Banchero.

[03:03] Team_068 possession (Score: 88-96)
Jarrett Oladipo makes the Layup and draws the foul on Zion Parker! And-1! Jarrett Oladipo to the line for 1. [BONUS: 8 team fouls] (Zion Parker: 2 personal fouls)   FT 1/1: GOOD Jarrett Oladipo makes 1/1 from the line.
Score: 88-99

[02:50] Team_005 possession (Score: 88-99)
Isaiah Durant attempts a 3Pt. Contested by Jarrett Oladipo (4.2 feet, MAN). Isaiah Durant misses. Rebound secured by Jarrett Oladipo.

[02:34] Team_068 possession (Score: 88-99)
Jarrett Oladipo attempts a Layup. BLOCKED BY BLAKE O'NEAL! Ball is loose! Rebound secured by Zion Parker.

[02:22] Team_005 possession (Score: 88-99)
Blake O'Neal attempts a 3Pt. Contested by Jarrett Oladipo (4.4 feet, ZONE). BLAKE O'NEAL MAKES IT! Assist: Zion Parker
Score: 91-99

[02:09] Team_068 possession (Score: 91-99)
Miles Murray drives, Zion Parker stays with him. Miles Murray attempts a Layup. Contested by Zion Parker (4.1 feet, ZONE). MILES MURRAY MAKES IT!
Score: 91-101

[01:56] Team_005 possession (Score: 91-101)
Blake O'Neal attempts a 3Pt. Contested by Cole Anthony (5.3 feet, MAN). Blake O'Neal misses. Rebound secured by Franz Curry.

[01:44] Team_068 possession (Score: 91-101)
Cole Anthony attempts a 3Pt. Contested by Blake O'Neal (4.0 feet, MAN). COLE ANTHONY MAKES IT! Assist: Miles Murray
Score: 91-104

[01:31] Team_005 possession (Score: 91-104)
Isaiah Durant attempts a Midrange. Contested by Ja Banchero (5.5 feet, ZONE). Isaiah Durant misses. Rebound secured by Franz Curry.

[01:21] Team_068 possession (Score: 91-104)
Cole Anthony attempts a 3Pt. Contested by Blake O'Neal (3.9 feet, MAN). Cole Anthony misses. Offensive rebound by Jarrett Oladipo! Jarrett Oladipo kicks it out.

[01:05] Team_068 possession (Score: 91-104)
Jarrett Oladipo drives and kicks out. Jarrett Oladipo attempts a 3Pt. Contested by Isaiah Durant (4.7 feet, MAN). Jarrett Oladipo misses. Rebound secured by Draymond Smith.

[00:51] Team_005 possession (Score: 91-104)
Zion Parker drives to the basket... Zion Parker throws a bad pass! Stolen by Franz Curry! TURNOVER! (live ball)

[00:32] Team_068 possession (Score: 91-104)
Ja Banchero drives, picks up Draymond Smith. Help arrives from Blake O'Neal! Ja Banchero attempts a Dunk. Contested by Blake O'Neal (4.4 feet, MAN). Ja Banchero misses. Rebound secured by Blake O'Neal.

[00:20] Team_005 possession (Score: 91-104)
Draymond Smith attempts a Midrange. Contested by Ja Banchero (5.2 feet, MAN). Draymond Smith misses. Rebound secured by Franz Curry.

[00:09] Team_068 possession (Score: 91-104)
Miles Murray makes the Midrange and draws the foul on Lauri Wade! And-1! Miles Murray to the line for 1. [BONUS: 9 team fouls] (Lauri Wade: 2 personal fouls)   FT 1/1: GOOD Miles Murray makes 1/1 from the line.
Score: 91-107

================================================================================
                              4TH QUARTER COMPLETE                              
================================================================================

4TH QUARTER SCORE: Team_005 26, Team_068 35

BOX SCORE:
================================================================================

Team_005
--------------------------------------------------------------------------------
Player                MIN  PTS  REB  AST  TO      FG   FG%      3P   3P%
--------------------------------------------------------------------------------
Anthony Rozier         34    7    0    0   0   3/3   100.0     0/0   0.0
Brandon George         34    6    0    0   0   2/2   100.0     0/0   0.0
Cade Markkanen         34    6    1    1   0   3/3   100.0     0/0   0.0
Blake O'Neal           14    3    1    0   0   1/2    50.0     0/0   0.0
Lauri Wade             18    2    2    3   0   1/2    50.0     0/0   0.0
Zion Parker            14    2    1    1   0   1/1   100.0     0/0   0.0
Jalen Rozier           31    0    0    0   0   0/1     0.0     0/0   0.0
Isaiah Durant          18    0    0    2   0   0/3     0.0     0/0   0.0
Draymond Smith         14    0    1    0   0   0/1     0.0     0/0   0.0

TEAM: FG: 11/18 (61.1%), 3PT: 2/5 (40.0%), REB: 6 (0 off, 6 def), AST: 7, TO: 4
TEAM FOULS: 9 [Team_068 in BONUS]


Team_068
--------------------------------------------------------------------------------
Player                MIN  PTS  REB  AST  TO      FG   FG%      3P   3P%
--------------------------------------------------------------------------------
Jarrett Oladipo        18   10    4    1   0   4/6    66.7     0/0   0.0
Miles Murray           18    9    0    2   0   4/7    57.1     0/0   0.0
Nikola Ginobili        34    7    1    0   0   3/3   100.0     0/0   0.0
Cole Anthony           18    3    0    1   0   1/1   100.0     0/0   0.0
Zion Anunoby           31    2    0    0   0   1/1   100.0     0/0   0.0
Ja Banchero            18    2    1    1   0   1/2    50.0     0/0   0.0
Jaren Johnson          31    0    1    0   0   0/0     0.0     0/0   0.0
Gary Simons            31    0    0    1   0   0/0     0.0     0/0   0.0
Franz Curry            14    0    3    0   0   0/0     0.0     0/0   0.0

TEAM: FG: 14/20 (70.0%), 3PT: 2/4 (50.0%), REB: 10 (3 off, 7 def), AST: 6, TO: 2
TEAM FOULS: 5 [Team_005 in BONUS]

================================================================================

================================================================================
                               FULL GAME COMPLETE                               
================================================================================

FINAL SCORE: Team_005 91, Team_068 107

SCORING BY QUARTER:
--------------------------------------------------------------------------------
Team                     Q1     Q2     Q3     Q4    FINAL
--------------------------------------------------------------------------------
Team_005                 23     23     19     26       91
Team_068                 23     17     32     35      107
--------------------------------------------------------------------------------

FULL GAME BOX SCORE:
================================================================================

Team_005
--------------------------------------------------------------------------------
Player                MIN  PTS  REB  AST  TO      FG   FG%      3P   3P%      FT STL BLK
--------------------------------------------------------------------------------
Brandon George         34   11    0    0   0   4/9    44.4   2/5    40.0   0/0     0   0
Anthony Rozier         34   16    0    2   2   6/10   60.0   1/2    50.0   6/9     0   0
Cade Markkanen         34   24    9    2   2  10/15   66.7   0/0     0.0   5/6     1   0
Derrick Allen          31    5    7    2   2   3/10   30.0   1/2    50.0   2/2     1   0
Jalen Rozier           31    4    8    1   4   2/9    22.2   0/2     0.0   0/1     0   0
Lauri Wade             18    2    2    3   0   0/1     0.0   0/0     0.0   2/2     0   0
Isaiah Durant          18    3    0    2   2   1/5    20.0   1/2    50.0   0/0     1   0
Blake O'Neal           14    8    1    0   0   4/7    57.1   3/5    60.0   2/2     0   1
Draymond Smith         14    6    2    1   1   2/3    66.7   2/2   100.0   0/0     0   0
Zion Parker            14    9    9    2   0   3/7    42.9   0/0     0.0   1/3     1   0

TEAM: FG: 36/78 (46.2%), 3PT: 10/20 (50.0%), REB: 38 (6 off, 32 def), AST: 15, TO: 13


Team_068
--------------------------------------------------------------------------------
Player                MIN  PTS  REB  AST  TO      FG   FG%      3P   3P%      FT STL BLK
--------------------------------------------------------------------------------
Nikola Ginobili        34   21   15    2   3   9/12   75.0   1/2    50.0   6/9     1   0
Zion Anunoby           31    8    0    1   0   4/10   40.0   0/3     0.0   2/3     0   0
Malcolm Herro          31   12    0    3   2   6/10   60.0   2/5    40.0   0/0     1   0
Jaren Johnson          31   19   12    0   2   6/8    75.0   2/4    50.0   8/9     0   0
Gary Simons            31    3    8    6   1   2/6    33.3   0/0     0.0   0/0     1   1
Cole Anthony           18    7    0    1   0   2/4    50.0   1/3    33.3   0/0     0   0
Ja Banchero            18    7    3    1   1   4/6    66.7   0/1     0.0   1/1     0   0
Miles Murray           18    9    0    2   1   4/7    57.1   0/2     0.0   3/4     0   0
Jarrett Oladipo        18   10    6    1   2   4/8    50.0   0/1     0.0   4/4     1   0
Franz Curry            14    8    5    0   0   4/5    80.0   0/1     0.0   4/4     3   2

TEAM: FG: 45/77 (58.4%), 3PT: 6/22 (27.3%), REB: 49 (7 off, 42 def), AST: 17, TO: 12

================================================================================
