================================================================================
                        FULL GAME - Team_044 vs Team_043                        
================================================================================

================================================================================
                       1ST QUARTER - Team_044 vs Team_043                       
================================================================================

[12:00] Team_044 possession (Score: 0-0)
Victor Westbrook attempts a 3Pt. Contested by D'Angelo Iverson (3.0 feet, MAN). Victor Westbrook misses. Rebound secured by D'Angelo Iverson.

[11:43] Team_043 possession (Score: 0-0)
FOUL! Holding foul on Zach McGrady. [Team fouls: 1] No free throws, side out. (Zach McGrady: 1 personal fouls)

[11:33] Team_043 possession (Score: 0-0)
Manu Carter drives, Karl Fox stays with him. Manu Carter attempts a Layup. Contested by Karl Fox (4.4 feet, MAN). MANU CARTER MAKES IT! Assist: Malcolm Murray
Score: 0-2

[11:24] Team_044 possession (Score: 0-2)
Isaiah Murray attempts a Midrange. Contested by Magic Durant (5.5 feet, MAN). ISAIAH MURRAY MAKES IT!
Score: 2-2

[11:08] Team_043 possession (Score: 2-2)
Manu Carter attempts a Dunk. BLOCKED BY KARL FOX! Ball is loose! Rebound secured by Karl Fox.

[10:53] Team_044 possession (Score: 2-2)
Karl Fox attempts a Midrange. Contested by D'Angelo Iverson (3.0 feet, ZONE). KARL FOX MAKES IT!
Score: 4-2

[10:42] Team_043 possession (Score: 4-2)
Manu Carter attempts a 3Pt. Contested by Karl Fox (4.4 feet, MAN). Manu Carter misses. Offensive rebound by Manu Carter! Manu Carter kicks it out.

[10:26] Team_043 possession (Score: 4-2)
Malcolm Murray drives and kicks out. Magic Durant attempts a Midrange. Contested by Isaiah Murray (4.7 feet, ZONE). MAGIC DURANT MAKES IT! Assist: D'Angelo Iverson
Score: 4-4

[10:13] Team_044 possession (Score: 4-4)
Isaiah Murray attempts a Layup. Contested by Manu Carter (4.5 feet, ZONE). Isaiah Murray misses. Rebound secured by Dwyane Dosunmu.

[09:58] Team_043 possession (Score: 4-4)
FOUL! Shooting foul on Ayo McCollum. Dwyane Dosunmu to the line for 2 free throws. [Team fouls: 2] (Ayo McCollum: 1 personal fouls)   FT 1/2: GOOD   FT 2/2: GOOD Dwyane Dosunmu makes 2/2 from the line.
Score: 4-6

[09:42] Team_044 possession (Score: 4-6)
Victor Westbrook attempts a Layup. Contested by D'Angelo Iverson (3.0 feet, MAN). VICTOR WESTBROOK MAKES IT! Assist: Ayo McCollum
Score: 6-6

[09:23] Team_043 possession (Score: 6-6)
Magic Durant attempts a 3Pt. Contested by Isaiah Murray (4.7 feet, MAN). MAGIC DURANT MAKES IT! Assist: Manu Carter
Score: 6-9

[09:13] Team_044 possession (Score: 6-9)
Zach McGrady attempts a 3Pt. Contested by Malcolm Murray (3.9 feet, MAN). Zach McGrady misses. Rebound secured by D'Angelo Iverson.

[08:58] Team_043 possession (Score: 6-9)
Malcolm Murray attempts a 3Pt. Contested by Zach McGrady (4.2 feet, MAN). MALCOLM MURRAY MAKES IT! Assist: Manu Carter
Score: 6-12

[08:45] Team_044 possession (Score: 6-12)
Isaiah Murray attempts a 3Pt. Contested by D'Angelo Iverson (3.3 feet, ZONE). Isaiah Murray misses. Rebound secured by Manu Carter.

[08:29] Team_043 possession (Score: 6-12)
Malcolm Murray attempts a 3Pt. Contested by Zach McGrady (4.2 feet, MAN). Malcolm Murray misses. Rebound secured by Victor Westbrook.

[08:13] Team_044 possession (Score: 6-12)
FOUL! Shooting foul on Malcolm Murray. Karl Fox to the line for 2 free throws. [Team fouls: 1] (Malcolm Murray: 1 personal fouls)   FT 1/2: GOOD   FT 2/2: GOOD Karl Fox makes 2/2 from the line.
Score: 8-12

[07:56] Team_043 possession (Score: 8-12)
FOUL! Shooting foul on Ayo McCollum. Magic Durant to the line for 2 free throws. [Team fouls: 3] (Ayo McCollum: 2 personal fouls)   FT 1/2: MISS   FT 2/2: GOOD Magic Durant makes 1/2 from the line.
Score: 8-13

[07:38] Team_044 possession (Score: 8-13)
FOUL! Holding foul on Manu Carter. [Team fouls: 2] No free throws, side out. (Manu Carter: 1 personal fouls)

[07:22] Team_044 possession (Score: 8-13)
FOUL! Shooting foul on D'Angelo Iverson. Victor Westbrook to the line for 3 free throws. [Team fouls: 3] (D'Angelo Iverson: 1 personal fouls)   FT 1/3: MISS   FT 2/3: GOOD   FT 3/3: MISS Victor Westbrook makes 1/3 from the line. Rebound secured by Manu Carter.
Score: 9-13

[07:06] Team_043 possession (Score: 9-13)
Manu Carter drives, Ayo McCollum stays with him. Manu Carter attempts a Dunk. Contested by Ayo McCollum (5.1 feet, ZONE). MANU CARTER MAKES IT! Assist: Malcolm Murray
Score: 9-15

[06:49] Team_044 possession (Score: 9-15)
Zach McGrady drives and kicks out. FOUL! Shooting foul on Manu Carter. Victor Westbrook to the line for 2 free throws. [Team fouls: 4] (Manu Carter: 2 personal fouls)   FT 1/2: MISS   FT 2/2: GOOD Victor Westbrook makes 1/2 from the line.
Score: 10-15

[06:35] Team_043 possession (Score: 10-15)
Dwyane Dosunmu drives and kicks out. Dwyane Dosunmu attempts a 3Pt. Contested by Ayo McCollum (4.6 feet, MAN). Dwyane Dosunmu misses. Rebound secured by Karl Fox.

[06:20] Team_044 possession (Score: 10-15)
Ayo McCollum attempts a Layup. Contested by Manu Carter (4.1 feet, ZONE). AYO MCCOLLUM MAKES IT! Assist: Karl Fox
Score: 12-15

[06:05] Team_043 possession (Score: 12-15)
D'Angelo Iverson attempts a 3Pt. Contested by Victor Westbrook (5.2 feet, MAN). D'Angelo Iverson misses. Rebound secured by Ayo McCollum.

[05:51] Team_044 possession (Score: 12-15)
FOUL! Holding foul on Manu Carter. [IN THE BONUS! 5 team fouls] Ayo McCollum to the line for 2 free throws. (Manu Carter: 3 personal fouls)   FT 1/2: GOOD   FT 2/2: GOOD Ayo McCollum makes 2/2 from the line.
Score: 14-15

[05:37] Team_043 possession (Score: 14-15)
Manu Carter attempts a Midrange. Contested by Karl Fox (4.4 feet, MAN). Manu Carter misses. Rebound secured by Victor Westbrook.

[05:26] Team_044 possession (Score: 14-15)
Isaiah Murray attempts a Midrange. Contested by Magic Durant (5.5 feet, MAN). Isaiah Murray misses. Rebound secured by D'Angelo Iverson.

[05:09] Team_043 possession (Score: 14-15)
Dwyane Dosunmu drives, Ayo McCollum stays with him. Dwyane Dosunmu attempts a Layup. Contested by Ayo McCollum (4.7 feet, ZONE). Dwyane Dosunmu misses. Rebound secured by Karl Fox.

[04:51] Team_044 possession (Score: 14-15)
Isaiah Murray attempts a 3Pt. Contested by D'Angelo Iverson (3.3 feet, ZONE). Isaiah Murray misses. FOUL! Loose ball foul on Dwyane Dosunmu during the rebound battle. [IN THE BONUS! 6 team fouls] Victor Westbrook to the line for 2 free throws. (Dwyane Dosunmu: 1 personal fouls)   FT 1/2: GOOD   FT 2/2: GOOD Victor Westbrook makes 2/2 from the line.
Score: 16-15

[04:39] Team_043 possession (Score: 16-15)
Dwyane Dosunmu drives and kicks out. D'Angelo Iverson attempts a Midrange. Contested by Karl Fox (3.9 feet, ZONE). D'ANGELO IVERSON MAKES IT! Assist: Dwyane Dosunmu
Score: 16-17

[04:26] Team_044 possession (Score: 16-17)
Karl Fox attempts a Layup. Contested by Manu Carter (4.4 feet, ZONE). Karl Fox misses. Rebound secured by Manu Carter.

[04:09] Team_043 possession (Score: 16-17)
Malcolm Murray drives, picks up Karl Fox. Help arrives from Zach McGrady! Malcolm Murray attempts a Layup. Contested by Zach McGrady (4.1 feet, ZONE). Malcolm Murray misses. Rebound secured by Victor Westbrook.

[03:52] Team_044 possession (Score: 16-17)
Zach McGrady attempts a 3Pt. Contested by D'Angelo Iverson (3.2 feet, ZONE). Zach McGrady misses. Rebound secured by D'Angelo Iverson.

[03:39] Team_043 possession (Score: 16-17)
FOUL! Holding foul on Zach McGrady. [Team fouls: 4] No free throws, side out. (Zach McGrady: 2 personal fouls)

[03:21] Team_043 possession (Score: 16-17)
Malcolm Murray attempts a 3Pt. Contested by Isaiah Murray (4.9 feet, ZONE). Malcolm Murray misses. Rebound secured by Victor Westbrook.

[03:07] Team_044 possession (Score: 16-17)
Karl Fox makes the Layup and draws the foul on Manu Carter! And-1! Karl Fox to the line for 1. [BONUS: 7 team fouls] (Manu Carter: 4 personal fouls)   FT 1/1: MISS Karl Fox makes 0/1 from the line. Rebound secured by D'Angelo Iverson.
Score: 18-17

[02:52] Team_043 possession (Score: 18-17)
Magic Durant attempts a 3Pt. Contested by Isaiah Murray (4.8 feet, MAN). Magic Durant misses. Rebound secured by Victor Westbrook.

[02:39] Team_044 possession (Score: 18-17)
FOUL! Shooting foul on Manu Carter. Zach McGrady to the line for 2 free throws. [BONUS: 8 team fouls] (Manu Carter: 5 personal fouls)   FT 1/2: GOOD   FT 2/2: GOOD Zach McGrady makes 2/2 from the line.
Score: 20-17

[02:25] Team_043 possession (Score: 20-17)
FOUL! Offensive foul on D'Angelo Iverson! Victor Westbrook drew the charge! [Team fouls: 9] (D'Angelo Iverson: 2 personal fouls) TURNOVER! (dead ball)

[02:10] Team_044 possession (Score: 20-17)
Isaiah Murray attempts a Midrange. Contested by Magic Durant (5.7 feet, MAN). Isaiah Murray misses. Rebound secured by Dwyane Dosunmu.

[01:54] Team_043 possession (Score: 20-17)
FOUL! Reach-in foul on Ayo McCollum during the drive. [IN THE BONUS! 5 team fouls] Dwyane Dosunmu to the line for 2 free throws. (Ayo McCollum: 3 personal fouls)   FT 1/2: MISS   FT 2/2: MISS Dwyane Dosunmu makes 0/2 from the line. Rebound secured by Karl Fox.

[01:36] Team_044 possession (Score: 20-17)
Victor Westbrook drives, picks up Manu Carter. Help arrives from Malcolm Murray! Victor Westbrook attempts a Layup. Contested by Malcolm Murray (4.6 feet, ZONE). VICTOR WESTBROOK MAKES IT! Assist: Isaiah Murray
Score: 22-17

[01:21] Team_043 possession (Score: 22-17)
Manu Carter attempts a Midrange. Wide open! Victor Westbrook is 6.0 feet away. [ZONE] MANU CARTER MAKES IT! Assist: Dwyane Dosunmu
Score: 22-19

[01:07] Team_044 possession (Score: 22-19)
FOUL! Reach-in foul on D'Angelo Iverson during the drive. [IN THE BONUS! 10 team fouls] Victor Westbrook to the line for 2 free throws. (D'Angelo Iverson: 3 personal fouls)   FT 1/2: MISS   FT 2/2: GOOD Victor Westbrook makes 1/2 from the line.
Score: 23-19

[00:53] Team_043 possession (Score: 23-19)
Manu Carter attempts a 3Pt. Contested by Isaiah Murray (5.5 feet, ZONE). Manu Carter misses. Rebound secured by Ayo McCollum.

[00:44] Team_044 possession (Score: 23-19)
Zach McGrady attempts a 3Pt. Contested by Malcolm Murray (4.3 feet, ZONE). Zach McGrady misses. Rebound secured by D'Angelo Iverson.

[00:33] Team_043 possession (Score: 23-19)
Dwyane Dosunmu attempts a Layup. Contested by Ayo McCollum (5.2 feet, ZONE). DWYANE DOSUNMU MAKES IT! Assist: D'Angelo Iverson
Score: 23-21

[00:17] Team_044 possession (Score: 23-21)
Isaiah Murray attempts a Midrange. Contested by Magic Durant (5.9 feet, MAN). Isaiah Murray misses. Rebound secured by Dwyane Dosunmu.

[00:06] Team_043 possession (Score: 23-21)
D'Angelo Iverson drives, Ayo McCollum stays with him. D'Angelo Iverson attempts a Layup. Contested by Ayo McCollum (5.3 feet, ZONE). D'ANGELO IVERSON MAKES IT! Assist: Dwyane Dosunmu
Score: 23-23

================================================================================
                              1ST QUARTER COMPLETE                              
================================================================================

1ST QUARTER SCORE: Team_044 23, Team_043 23

BOX SCORE:
================================================================================

Team_044
--------------------------------------------------------------------------------
Player                MIN  PTS  REB  AST  TO      FG   FG%      3P   3P%
--------------------------------------------------------------------------------
Victor Westbrook       12    8    5    0   0   5/7    71.4     0/0   0.0
Karl Fox               12    4    4    1   0   2/4    50.0     0/0   0.0
Ayo McCollum           12    4    2    1   0   2/2   100.0     0/0   0.0
Isaiah Murray          12    2    0    1   0   1/6    16.7     0/0   0.0
Zach McGrady           12    2    0    0   0   1/4    25.0     0/0   0.0

TEAM: FG: 11/23 (47.8%), 3PT: 1/7 (14.3%), REB: 11 (0 off, 11 def), AST: 3, TO: 0
TEAM FOULS: 5 [Team_043 in BONUS]


Team_043
--------------------------------------------------------------------------------
Player                MIN  PTS  REB  AST  TO      FG   FG%      3P   3P%
--------------------------------------------------------------------------------
Manu Carter            12    6    4    2   0   3/6    50.0     0/0   0.0
Magic Durant           12    6    0    0   0   3/4    75.0     0/0   0.0
D'Angelo Iverson       12    4    6    2   0   2/3    66.7     0/0   0.0
Dwyane Dosunmu         12    4    3    3   0   2/5    40.0     0/0   0.0
Malcolm Murray         12    3    0    2   0   1/4    25.0     0/0   0.0

TEAM: FG: 11/22 (50.0%), 3PT: 2/7 (28.6%), REB: 13 (1 off, 12 def), AST: 9, TO: 1
TEAM FOULS: 10 [Team_044 in BONUS]

================================================================================

================================================================================
                       2ND QUARTER - Team_044 vs Team_043                       
================================================================================

[12:00] Team_044 possession (Score: 23-23)
Zach McGrady drives, picks up Manu Carter. Help arrives from Malcolm Murray! Zach McGrady attempts a Layup. Contested by Malcolm Murray (4.7 feet, ZONE). Zach McGrady misses. Offensive rebound by Victor Westbrook! Victor Westbrook kicks it out.

[11:48] Team_044 possession (Score: 23-23)
Isaiah Murray drives, Manu Carter stays with him. Isaiah Murray attempts a Dunk. Contested by Manu Carter (4.9 feet, ZONE). Isaiah Murray misses. Offensive rebound by Ayo McCollum! Ayo McCollum kicks it out.

[11:32] Team_044 possession (Score: 23-23)
Isaiah Murray drives, Magic Durant stays with him. Isaiah Murray attempts a Layup. Contested by Magic Durant (5.8 feet, MAN). Isaiah Murray misses. Rebound secured by Manu Carter.

[11:17] Team_043 possession (Score: 23-23)
Malcolm Murray attempts a 3Pt. Contested by Isaiah Murray (5.1 feet, ZONE). MALCOLM MURRAY MAKES IT! Assist: D'Angelo Iverson
Score: 23-26

[11:05] Team_044 possession (Score: 23-26)
Zach McGrady loses the ball! Stripped by Malcolm Murray! TURNOVER! (live ball)

[10:52] Team_043 possession (Score: 23-26)
FOUL! Holding foul on Isaiah Murray. [Team fouls: 1] No free throws, side out. (Isaiah Murray: 1 personal fouls)

[10:37] Team_043 possession (Score: 23-26)
Magic Durant attempts a 3Pt. Contested by Isaiah Murray (5.0 feet, ZONE). MAGIC DURANT MAKES IT! Assist: Dwyane Dosunmu
Score: 23-29

[10:22] Team_044 possession (Score: 23-29)
Zach McGrady attempts a Midrange. Contested by D'Angelo Iverson (3.6 feet, ZONE). Zach McGrady misses. Offensive rebound by Ayo McCollum! Ayo McCollum kicks it out.

[10:02] Team_044 possession (Score: 23-29)
Karl Fox attempts a Midrange. Contested by Manu Carter (4.8 feet, ZONE). KARL FOX MAKES IT!
Score: 25-29

[09:47] Team_043 possession (Score: 25-29)
Magic Durant makes the Dunk and draws the foul on Karl Fox! And-1! Magic Durant to the line for 1. [Team fouls: 2] (Karl Fox: 1 personal fouls)   FT 1/1: GOOD Magic Durant makes 1/1 from the line.
Score: 25-32

[09:35] Team_044 possession (Score: 25-32)
Karl Fox throws a bad pass! Stolen by Manu Carter! TURNOVER! (live ball)

[09:21] Team_043 possession (Score: 25-32)
D'Angelo Iverson drives, picks up Victor Westbrook. Help arrives from Zach McGrady! D'Angelo Iverson attempts a Layup. Contested by Zach McGrady (5.9 feet, MAN). D'ANGELO IVERSON MAKES IT! Assist: Manu Carter
Score: 25-34

[09:08] Team_044 possession (Score: 25-34)
Zach McGrady attempts a Layup. BLOCKED BY MANU CARTER! Ball is loose! Offensive rebound by Victor Westbrook! Victor Westbrook kicks it out.

[08:49] Team_044 possession (Score: 25-34)
Ayo McCollum attempts a Layup. Contested by Manu Carter (4.8 feet, ZONE). AYO MCCOLLUM MAKES IT!
Score: 27-34

[08:34] Team_043 possession (Score: 27-34)
D'Angelo Iverson attempts a 3Pt. Wide open! Victor Westbrook is 6.0 feet away. [MAN] D'Angelo Iverson misses. Rebound secured by Ayo McCollum.

[08:22] Team_044 possession (Score: 27-34)
Zach McGrady drives, Manu Carter stays with him. Zach McGrady attempts a Layup. Contested by Manu Carter (5.2 feet, ZONE). ZACH MCGRADY MAKES IT! Assist: Victor Westbrook
Score: 29-34

[08:06] Team_043 possession (Score: 29-34)
D'Angelo Iverson attempts a 3Pt. Contested by Isaiah Murray (5.4 feet, ZONE). D'Angelo Iverson misses. Rebound secured by Ayo McCollum.

[07:49] Team_044 possession (Score: 29-34)
Isaiah Murray attempts a 3Pt. Wide open! Magic Durant is 6.2 feet away. [MAN] Isaiah Murray misses. Rebound secured by Manu Carter.

[07:36] Team_043 possession (Score: 29-34)
Malcolm Murray attempts a 3Pt. Contested by Isaiah Murray (5.5 feet, ZONE). Malcolm Murray misses. Rebound secured by Karl Fox.

[07:23] Team_044 possession (Score: 29-34)
Zach McGrady drives and kicks out. Isaiah Murray attempts a 3Pt. Wide open! Magic Durant is 6.1 feet away. [MAN] ISAIAH MURRAY MAKES IT! Assist: Victor Westbrook
Score: 32-34

[07:11] Team_043 possession (Score: 32-34)
Malcolm Murray attempts a 3Pt. Contested by Zach McGrady (5.0 feet, MAN). Malcolm Murray misses. Rebound secured by Victor Westbrook.

[06:58] Team_044 possession (Score: 32-34)
Isaiah Murray attempts a Midrange. Wide open! Magic Durant is 6.3 feet away. [MAN] Isaiah Murray misses. Offensive rebound by Ayo McCollum! Ayo McCollum kicks it out.

[06:43] Team_044 possession (Score: 32-34)
Karl Fox drives, Manu Carter stays with him. Karl Fox attempts a Dunk. Contested by Manu Carter (5.3 feet, MAN). KARL FOX MAKES IT! Assist: Ayo McCollum
Score: 34-34

[06:32] Team_043 possession (Score: 34-34)
Dwyane Dosunmu drives, picks up Ayo McCollum. Help arrives from Zach McGrady! Dwyane Dosunmu attempts a Layup. Contested by Zach McGrady (5.8 feet, MAN). Dwyane Dosunmu misses. Offensive rebound by Manu Carter! Manu Carter kicks it out.

[06:23] Team_043 possession (Score: 34-34)
Magic Durant attempts a 3Pt. Contested by Isaiah Murray (5.5 feet, MAN). MAGIC DURANT MAKES IT! Assist: Manu Carter
Score: 34-37

[06:09] Team_044 possession (Score: 34-37)
Zach McGrady attempts a 3Pt. Wide open! Magic Durant is 6.4 feet away. [ZONE] ZACH MCGRADY MAKES IT! Assist: Isaiah Murray
Score: 37-37

[05:56] Team_043 possession (Score: 37-37)
Dwyane Dosunmu throws a bad pass out of bounds! TURNOVER! (dead ball)

[05:56] Substitution (Team_044): Zach McGrady OUT → Kyrie Poole IN (stamina_rule2)

[05:56] Substitution (Team_044): Isaiah Murray OUT → Tim Towns IN (stamina_rule2)

[05:56] Substitution (Team_044): Victor Westbrook OUT → Tim Siakam IN (stamina_rule2)

[05:56] Substitution (Team_044): Karl Fox OUT → Pau Quickley IN (stamina_rule2)

[05:56] Substitution (Team_044): Ayo McCollum OUT → Victor Anthony IN (stamina_rule2)

[05:56] Substitution (Team_043): Malcolm Murray OUT → Jabari Holiday IN (stamina_rule2)

[05:56] Substitution (Team_043): Magic Durant OUT → Ben LaVine IN (stamina_rule2)

[05:56] Substitution (Team_043): D'Angelo Iverson OUT → Dirk Herro IN (stamina_rule2)

[05:56] Substitution (Team_043): Manu Carter OUT → Joel Murray IN (stamina_rule2)

[05:56] Substitution (Team_043): Dwyane Dosunmu OUT → Terry Randle IN (stamina_rule2)

[05:43] Team_044 possession (Score: 37-37)
FOUL! Shooting foul on Ben LaVine. Victor Anthony to the line for 2 free throws. [Team fouls: 2] (Ben LaVine: 1 personal fouls)   FT 1/2: GOOD   FT 2/2: GOOD Victor Anthony makes 2/2 from the line.
Score: 39-37

[05:32] Team_043 possession (Score: 39-37)
Terry Randle makes the Layup and draws the foul on Victor Anthony! And-1! Terry Randle to the line for 1. [Team fouls: 3] (Victor Anthony: 1 personal fouls)   FT 1/1: GOOD Terry Randle makes 1/1 from the line.
Score: 39-40

[05:18] Team_044 possession (Score: 39-40)
Pau Quickley attempts a Midrange. Contested by Joel Murray (6.0 feet, MAN). Pau Quickley misses. Rebound secured by Terry Randle.

[05:03] Team_043 possession (Score: 39-40)
Joel Murray attempts a Layup. Contested by Pau Quickley (3.7 feet, MAN). Joel Murray misses. Rebound secured by Tim Siakam.

[04:48] Team_044 possession (Score: 39-40)
Tim Siakam attempts a 3Pt. Contested by Dirk Herro (4.1 feet, MAN). TIM SIAKAM MAKES IT!
Score: 42-40

[04:29] Team_043 possession (Score: 42-40)
Joel Murray makes the Layup and draws the foul on Pau Quickley! And-1! Joel Murray to the line for 1. [Team fouls: 4] (Pau Quickley: 1 personal fouls)   FT 1/1: GOOD Joel Murray makes 1/1 from the line.
Score: 42-43

[04:16] Team_044 possession (Score: 42-43)
FOUL! Shooting foul on Dirk Herro. Kyrie Poole to the line for 3 free throws. [Team fouls: 3] (Dirk Herro: 1 personal fouls)   FT 1/3: GOOD   FT 2/3: MISS   FT 3/3: GOOD Kyrie Poole makes 2/3 from the line.
Score: 44-43

[03:58] Team_043 possession (Score: 44-43)
Terry Randle drives to the basket... Terry Randle commits a violation (traveling/carry)! TURNOVER! (dead ball)

[03:43] Team_044 possession (Score: 44-43)
Kyrie Poole attempts a 3Pt. Contested by Dirk Herro (3.9 feet, ZONE). KYRIE POOLE MAKES IT! Assist: Victor Anthony
Score: 47-43

[03:29] Team_043 possession (Score: 47-43)
Terry Randle drives, picks up Pau Quickley. Help arrives from Tim Towns! Terry Randle attempts a Dunk. Contested by Tim Towns (3.8 feet, ZONE). TERRY RANDLE MAKES IT!
Score: 47-45

[03:12] Team_044 possession (Score: 47-45)
Kyrie Poole attempts a 3Pt. Contested by Joel Murray (5.6 feet, ZONE). Kyrie Poole misses. Rebound secured by Ben LaVine.

[02:58] Team_043 possession (Score: 47-45)
FOUL! Reach-in foul on Tim Siakam during the drive. [IN THE BONUS! 5 team fouls] Dirk Herro to the line for 2 free throws. (Tim Siakam: 1 personal fouls)   FT 1/2: GOOD   FT 2/2: GOOD Dirk Herro makes 2/2 from the line.
Score: 47-47

[02:44] Team_044 possession (Score: 47-47)
Kyrie Poole drives, Terry Randle stays with him. Kyrie Poole attempts a Layup. Contested by Terry Randle (4.3 feet, ZONE). Kyrie Poole misses. Offensive rebound by Tim Siakam! Tim Siakam kicks it out.

[02:32] Team_044 possession (Score: 47-47)
Kyrie Poole attempts a 3Pt. Contested by Dirk Herro (3.9 feet, ZONE). Kyrie Poole misses. Rebound secured by Terry Randle.

[02:20] Team_043 possession (Score: 47-47)
Terry Randle makes the Layup and draws the foul on Pau Quickley! And-1! Terry Randle to the line for 1. [BONUS: 6 team fouls] (Pau Quickley: 2 personal fouls)   FT 1/1: GOOD Terry Randle makes 1/1 from the line.
Score: 47-50

[02:06] Team_044 possession (Score: 47-50)
Pau Quickley attempts a 3Pt. Contested by Dirk Herro (4.3 feet, ZONE). PAU QUICKLEY MAKES IT! Assist: Victor Anthony
Score: 50-50

[01:48] Team_043 possession (Score: 50-50)
Ben LaVine attempts a Midrange. Contested by Tim Towns (5.7 feet, MAN). BEN LAVINE MAKES IT!
Score: 50-52

[01:35] Team_044 possession (Score: 50-52)
Victor Anthony drives, picks up Terry Randle. Help arrives from Ben LaVine! Victor Anthony attempts a Dunk. Contested by Ben LaVine (5.0 feet, ZONE). VICTOR ANTHONY MAKES IT! Assist: Tim Siakam
Score: 52-52

[01:21] Team_043 possession (Score: 52-52)
Terry Randle attempts a Midrange. Contested by Victor Anthony (4.8 feet, MAN). Terry Randle misses. FOUL! Loose ball foul on Tim Siakam during the rebound battle. [IN THE BONUS! 7 team fouls] Terry Randle to the line for 2 free throws. (Tim Siakam: 2 personal fouls)   FT 1/2: GOOD   FT 2/2: GOOD Terry Randle makes 2/2 from the line.
Score: 52-54

[01:06] Team_044 possession (Score: 52-54)
Pau Quickley attempts a 3Pt. Contested by Ben LaVine (5.4 feet, ZONE). Pau Quickley misses. Rebound secured by Dirk Herro.

[00:51] Team_043 possession (Score: 52-54)
FOUL! Holding foul on Tim Siakam. [IN THE BONUS! 8 team fouls] Dirk Herro to the line for 2 free throws. (Tim Siakam: 3 personal fouls)   FT 1/2: MISS   FT 2/2: GOOD Dirk Herro makes 1/2 from the line.
Score: 52-55

[00:41] Team_044 possession (Score: 52-55)
Victor Anthony attempts a 3Pt. Contested by Dirk Herro (4.7 feet, ZONE). Victor Anthony misses. Rebound secured by Terry Randle.

[00:26] Team_043 possession (Score: 52-55)
Dirk Herro attempts a 3Pt. Contested by Tim Siakam (4.0 feet, ZONE). Dirk Herro misses. Rebound secured by Pau Quickley.

[00:09] Team_044 possession (Score: 52-55)
Tim Towns attempts a Midrange. Contested by Ben LaVine (5.3 feet, MAN). Tim Towns misses. Offensive rebound by Tim Siakam! Tim Siakam kicks it out.

================================================================================
                              2ND QUARTER COMPLETE                              
================================================================================

2ND QUARTER SCORE: Team_044 29, Team_043 32

BOX SCORE:
================================================================================

Team_044
--------------------------------------------------------------------------------
Player                MIN  PTS  REB  AST  TO      FG   FG%      3P   3P%
--------------------------------------------------------------------------------
Zach McGrady           18    5    0    0   0   2/2   100.0     0/0   0.0
Kyrie Poole             6    5    0    0   0   2/4    50.0     0/0   0.0
Karl Fox               18    4    1    0   0   2/2   100.0     0/0   0.0
Victor Anthony          6    4    0    2   0   2/3    66.7     0/0   0.0
Isaiah Murray          18    3    0    1   0   1/3    33.3     0/0   0.0
Pau Quickley            6    3    1    0   0   1/3    33.3     0/0   0.0
Tim Siakam              6    3    3    1   0   1/1   100.0     0/0   0.0
Ayo McCollum           18    2    5    1   0   1/1   100.0     0/0   0.0
Victor Westbrook       18    0    3    2   0   0/0     0.0     0/0   0.0

TEAM: FG: 12/19 (63.2%), 3PT: 5/10 (50.0%), REB: 13 (7 off, 6 def), AST: 7, TO: 2
TEAM FOULS: 8 [Team_043 in BONUS]


Team_043
--------------------------------------------------------------------------------
Player                MIN  PTS  REB  AST  TO      FG   FG%      3P   3P%
--------------------------------------------------------------------------------
Terry Randle            6   10    3    0   0   4/4   100.0     0/0   0.0
Magic Durant           18    9    0    0   0   3/3   100.0     0/0   0.0
Malcolm Murray         18    3    0    0   0   1/3    33.3     0/0   0.0
Joel Murray             6    3    0    0   0   1/2    50.0     0/0   0.0
Dirk Herro              6    3    1    0   0   2/3    66.7     0/0   0.0
D'Angelo Iverson       18    2    0    1   0   1/3    33.3     0/0   0.0
Ben LaVine              6    2    1    0   0   1/1   100.0     0/0   0.0
Manu Carter            18    0    3    2   0   0/0     0.0     0/0   0.0
Dwyane Dosunmu         18    0    0    1   0   0/0     0.0     0/0   0.0

TEAM: FG: 13/19 (68.4%), 3PT: 3/8 (37.5%), REB: 8 (1 off, 7 def), AST: 4, TO: 2
TEAM FOULS: 3

================================================================================

================================================================================
                       3RD QUARTER - Team_044 vs Team_043                       
================================================================================

[12:00] Team_044 possession (Score: 52-55)
Victor Westbrook drives, D'Angelo Iverson stays with him. Victor Westbrook attempts a Dunk. Contested by D'Angelo Iverson (3.0 feet, MAN). VICTOR WESTBROOK MAKES IT! Assist: Karl Fox
Score: 54-55

[11:50] Team_043 possession (Score: 54-55)
Malcolm Murray attempts a 3Pt. Contested by Isaiah Murray (4.8 feet, ZONE). Malcolm Murray misses. Rebound secured by Ayo McCollum.

[11:31] Team_044 possession (Score: 54-55)
Isaiah Murray attempts a 3Pt. Contested by D'Angelo Iverson (3.3 feet, ZONE). Isaiah Murray misses. Rebound secured by D'Angelo Iverson.

[11:15] Team_043 possession (Score: 54-55)
Malcolm Murray throws a bad pass out of bounds! TURNOVER! (dead ball)

[10:58] Team_044 possession (Score: 54-55)
Victor Westbrook drives, Manu Carter stays with him. Victor Westbrook attempts a Layup. Contested by Manu Carter (4.2 feet, ZONE). VICTOR WESTBROOK MAKES IT! Assist: Ayo McCollum
Score: 56-55

[10:47] Team_043 possession (Score: 56-55)
D'Angelo Iverson attempts a Midrange. Contested by Isaiah Murray (4.7 feet, ZONE). D'Angelo Iverson misses. Rebound secured by Ayo McCollum.

[10:35] Team_044 possession (Score: 56-55)
Victor Westbrook loses control! Ball rolls out of bounds! TURNOVER! (dead ball)

[10:17] Team_043 possession (Score: 56-55)
FOUL! Shooting foul on Isaiah Murray. Magic Durant to the line for 2 free throws. [Team fouls: 1] (Isaiah Murray: 1 personal fouls)   FT 1/2: GOOD   FT 2/2: GOOD Magic Durant makes 2/2 from the line.
Score: 56-57

[10:06] Team_044 possession (Score: 56-57)
FOUL! Shooting foul on Magic Durant. Victor Westbrook to the line for 2 free throws. [Team fouls: 1] (Magic Durant: 1 personal fouls)   FT 1/2: GOOD   FT 2/2: GOOD Victor Westbrook makes 2/2 from the line.
Score: 58-57

[09:54] Team_043 possession (Score: 58-57)
Malcolm Murray makes the Midrange and draws the foul on Zach McGrady! And-1! Malcolm Murray to the line for 1. [Team fouls: 2] (Zach McGrady: 1 personal fouls)   FT 1/1: MISS Malcolm Murray makes 0/1 from the line. Rebound secured by Ayo McCollum.
Score: 58-59

[09:40] Team_044 possession (Score: 58-59)
Karl Fox attempts a 3Pt. Contested by Manu Carter (4.3 feet, MAN). KARL FOX MAKES IT! Assist: Isaiah Murray
Score: 61-59

[09:27] Team_043 possession (Score: 61-59)
D'Angelo Iverson attempts a 3Pt. Contested by Isaiah Murray (4.7 feet, ZONE). D'ANGELO IVERSON MAKES IT! Assist: Magic Durant
Score: 61-62

[09:15] Team_044 possession (Score: 61-62)
FOUL! Shooting foul on D'Angelo Iverson. Victor Westbrook to the line for 3 free throws. [Team fouls: 2] (D'Angelo Iverson: 1 personal fouls)   FT 1/3: GOOD   FT 2/3: MISS   FT 3/3: GOOD Victor Westbrook makes 2/3 from the line.
Score: 63-62

[09:00] Team_043 possession (Score: 63-62)
Dwyane Dosunmu attempts a Midrange. BLOCKED BY AYO MCCOLLUM! Ball deflects out of bounds off Dwyane Dosunmu.

[08:43] Team_044 possession (Score: 63-62)
Zach McGrady drives and kicks out. Zach McGrady attempts a Midrange. Contested by Malcolm Murray (3.7 feet, MAN). Zach McGrady misses. Rebound secured by Dwyane Dosunmu.

[08:29] Team_043 possession (Score: 63-62)
Magic Durant attempts a Layup. Contested by Ayo McCollum (4.6 feet, ZONE). MAGIC DURANT MAKES IT! Assist: Manu Carter
Score: 63-64

[08:14] Team_044 possession (Score: 63-64)
Victor Westbrook makes the Layup and draws the foul on D'Angelo Iverson! And-1! Victor Westbrook to the line for 1. [Team fouls: 3] (D'Angelo Iverson: 2 personal fouls)   FT 1/1: GOOD Victor Westbrook makes 1/1 from the line.
Score: 66-64

[07:59] Team_043 possession (Score: 66-64)
FOUL! Reach-in foul on Victor Westbrook during the drive. [Team fouls: 3] No free throws, side out. (Victor Westbrook: 1 personal fouls)

[07:45] Team_043 possession (Score: 66-64)
D'Angelo Iverson drives to the basket... D'Angelo Iverson throws a bad pass out of bounds! TURNOVER! (dead ball)

[07:33] Team_044 possession (Score: 66-64)
Karl Fox drives, Manu Carter stays with him. Karl Fox attempts a Dunk. Contested by Manu Carter (4.3 feet, MAN). Karl Fox misses. Rebound secured by Dwyane Dosunmu.

[07:20] Team_043 possession (Score: 66-64)
D'Angelo Iverson attempts a Layup. Contested by Victor Westbrook (5.2 feet, MAN). D'Angelo Iverson misses. Rebound secured by Karl Fox.

[07:02] Team_044 possession (Score: 66-64)
Karl Fox attempts a Layup. Contested by Manu Carter (4.3 feet, MAN). Karl Fox misses. Offensive rebound by Victor Westbrook! Victor Westbrook kicks it out.

[06:49] Team_044 possession (Score: 66-64)
Karl Fox attempts a 3Pt. Contested by Manu Carter (4.3 feet, MAN). Karl Fox misses. Offensive rebound by Victor Westbrook! Victor Westbrook kicks it out.

[06:31] Team_044 possession (Score: 66-64)
Isaiah Murray attempts a 3Pt. Contested by D'Angelo Iverson (3.3 feet, ZONE). Isaiah Murray misses. Offensive rebound by Ayo McCollum! Ayo McCollum puts it back in!
Score: 68-64

[06:18] Team_043 possession (Score: 68-64)
D'Angelo Iverson attempts a 3Pt. Contested by Isaiah Murray (4.7 feet, ZONE). D'Angelo Iverson misses. Offensive rebound by D'Angelo Iverson! D'Angelo Iverson kicks it out.

[06:04] Team_043 possession (Score: 68-64)
Dwyane Dosunmu drives, Ayo McCollum stays with him. Dwyane Dosunmu attempts a Dunk. Contested by Ayo McCollum (4.7 feet, ZONE). DWYANE DOSUNMU MAKES IT! Assist: D'Angelo Iverson
Score: 68-66

[05:52] Team_044 possession (Score: 68-66)
Victor Westbrook attempts a 3Pt. Contested by Manu Carter (4.2 feet, ZONE). Victor Westbrook misses. Rebound secured by Manu Carter.

[05:37] Team_043 possession (Score: 68-66)
Magic Durant attempts a Layup. BLOCKED BY ISAIAH MURRAY! Ball deflects out of bounds off Magic Durant.

[05:21] Team_044 possession (Score: 68-66)
Ayo McCollum attempts a Layup. Contested by Manu Carter (4.1 feet, MAN). Ayo McCollum misses. Rebound secured by D'Angelo Iverson.

[05:04] Team_043 possession (Score: 68-66)
Dwyane Dosunmu drives, Ayo McCollum stays with him. Dwyane Dosunmu attempts a Layup. Contested by Ayo McCollum (4.7 feet, MAN). Dwyane Dosunmu misses. Rebound secured by Karl Fox.

[04:50] Team_044 possession (Score: 68-66)
Victor Westbrook drives and kicks out. Ayo McCollum attempts a Midrange. Contested by Manu Carter (4.2 feet, MAN). Ayo McCollum misses. Rebound secured by Manu Carter.

[04:37] Team_043 possession (Score: 68-66)
Malcolm Murray drives, Ayo McCollum stays with him. Malcolm Murray attempts a Layup. Contested by Ayo McCollum (4.8 feet, ZONE). MALCOLM MURRAY MAKES IT! Assist: Dwyane Dosunmu
Score: 68-68

[04:27] Team_044 possession (Score: 68-68)
FOUL! Holding foul on Manu Carter. [Team fouls: 4] No free throws, side out. (Manu Carter: 1 personal fouls)

[04:09] Team_044 possession (Score: 68-68)
Isaiah Murray drives and kicks out. Ayo McCollum attempts a Midrange. Contested by Manu Carter (4.3 feet, MAN). AYO MCCOLLUM MAKES IT! Assist: Zach McGrady
Score: 70-68

[03:55] Team_043 possession (Score: 70-68)
D'Angelo Iverson drives, picks up Victor Westbrook. Help arrives from Zach McGrady! D'Angelo Iverson attempts a Layup. Contested by Zach McGrady (5.4 feet, MAN). D'ANGELO IVERSON MAKES IT! Assist: Manu Carter
Score: 70-70

[03:41] Team_044 possession (Score: 70-70)
Victor Westbrook attempts a Layup. Contested by D'Angelo Iverson (3.1 feet, MAN). Victor Westbrook misses. Rebound secured by Dwyane Dosunmu.

[03:25] Team_043 possession (Score: 70-70)
Dwyane Dosunmu attempts a 3Pt. Contested by Isaiah Murray (4.8 feet, ZONE). Dwyane Dosunmu misses. Rebound secured by Karl Fox.

[03:10] Team_044 possession (Score: 70-70)
Zach McGrady drives, Malcolm Murray stays with him. Zach McGrady attempts a Dunk. Contested by Malcolm Murray (4.1 feet, MAN). Zach McGrady misses. Rebound secured by Manu Carter.

[02:54] Team_043 possession (Score: 70-70)
D'Angelo Iverson drives, picks up Victor Westbrook. Help arrives from Zach McGrady! D'Angelo Iverson attempts a Dunk. Contested by Zach McGrady (5.5 feet, MAN). D'ANGELO IVERSON MAKES IT! Assist: Malcolm Murray
Score: 70-72

[02:40] Team_044 possession (Score: 70-72)
Ayo McCollum attempts a 3Pt. Contested by Manu Carter (4.4 feet, MAN). Ayo McCollum misses. Rebound secured by Dwyane Dosunmu.

[02:24] Team_043 possession (Score: 70-72)
Magic Durant attempts a Midrange. Contested by Isaiah Murray (4.9 feet, MAN). MAGIC DURANT MAKES IT! Assist: Manu Carter
Score: 70-74

[02:13] Team_044 possession (Score: 70-74)
Karl Fox drives and kicks out. Karl Fox attempts a Midrange. Contested by Manu Carter (4.5 feet, MAN). Karl Fox misses. Rebound secured by Dwyane Dosunmu.

[02:04] Team_043 possession (Score: 70-74)
FOUL! Offensive foul on Manu Carter! Karl Fox drew the charge! [Team fouls: 5] (Manu Carter: 2 personal fouls) TURNOVER! (dead ball)

[01:55] Team_044 possession (Score: 70-74)
FOUL! Holding foul on D'Angelo Iverson. [IN THE BONUS! 6 team fouls] Victor Westbrook to the line for 2 free throws. (D'Angelo Iverson: 3 personal fouls)   FT 1/2: GOOD   FT 2/2: GOOD Victor Westbrook makes 2/2 from the line.
Score: 72-74

[01:41] Team_043 possession (Score: 72-74)
Manu Carter makes the Layup and draws the foul on Ayo McCollum! And-1! Manu Carter to the line for 1. [Team fouls: 4] (Ayo McCollum: 1 personal fouls)   FT 1/1: GOOD Manu Carter makes 1/1 from the line.
Score: 72-77

[01:28] Team_044 possession (Score: 72-77)
FOUL! Shooting foul on Manu Carter. Ayo McCollum to the line for 2 free throws. [BONUS: 7 team fouls] (Manu Carter: 3 personal fouls)   FT 1/2: GOOD   FT 2/2: GOOD Ayo McCollum makes 2/2 from the line.
Score: 74-77

[01:18] Team_043 possession (Score: 74-77)
Manu Carter attempts a 3Pt. Contested by Isaiah Murray (5.5 feet, ZONE). Manu Carter misses. Rebound secured by Victor Westbrook.

[01:06] Team_044 possession (Score: 74-77)
Zach McGrady attempts a Midrange. Contested by Magic Durant (5.8 feet, ZONE). ZACH MCGRADY MAKES IT! Assist: Isaiah Murray
Score: 76-77

[00:50] Team_043 possession (Score: 76-77)
D'Angelo Iverson attempts a 3Pt. Contested by Isaiah Murray (5.2 feet, ZONE). D'ANGELO IVERSON MAKES IT! Assist: Manu Carter
Score: 76-80

[00:33] Team_044 possession (Score: 76-80)
Ayo McCollum attempts a Midrange. Contested by Magic Durant (5.5 feet, ZONE). AYO MCCOLLUM MAKES IT!
Score: 78-80

[00:19] Team_043 possession (Score: 78-80)
Malcolm Murray makes the 3Pt and draws the foul on Isaiah Murray! And-1! Malcolm Murray to the line for 1. [BONUS: 5 team fouls] (Isaiah Murray: 2 personal fouls)   FT 1/1: GOOD Malcolm Murray makes 1/1 from the line.
Score: 78-84

[00:04] Team_044 possession (Score: 78-84)
Isaiah Murray attempts a 3Pt. Contested by D'Angelo Iverson (3.8 feet, ZONE). ISAIAH MURRAY MAKES IT! Assist: Zach McGrady
Score: 81-84

================================================================================
                              3RD QUARTER COMPLETE                              
================================================================================

3RD QUARTER SCORE: Team_044 29, Team_043 29

BOX SCORE:
================================================================================

Team_044
--------------------------------------------------------------------------------
Player                MIN  PTS  REB  AST  TO      FG   FG%      3P   3P%
--------------------------------------------------------------------------------
Victor Westbrook       30   13    3    0   0   6/9    66.7     0/0   0.0
Ayo McCollum           30    8    4    1   0   4/6    66.7     0/0   0.0
Karl Fox               30    3    3    1   0   1/3    33.3     0/0   0.0
Isaiah Murray          30    3    0    2   0   1/2    50.0     0/0   0.0
Zach McGrady           30    2    0    2   0   1/3    33.3     0/0   0.0

TEAM: FG: 13/23 (56.5%), 3PT: 4/7 (57.1%), REB: 10 (3 off, 7 def), AST: 6, TO: 1
TEAM FOULS: 5 [Team_043 in BONUS]


Team_043
--------------------------------------------------------------------------------
Player                MIN  PTS  REB  AST  TO      FG   FG%      3P   3P%
--------------------------------------------------------------------------------
D'Angelo Iverson       30   10    3    1   0   4/6    66.7     0/0   0.0
Malcolm Murray         30    6    0    1   0   2/4    50.0     0/0   0.0
Magic Durant           30    6    0    1   0   3/4    75.0     0/0   0.0
Manu Carter            30    3    3    4   0   1/2    50.0     0/0   0.0
Dwyane Dosunmu         30    2    5    1   0   1/4    25.0     0/0   0.0

TEAM: FG: 11/20 (55.0%), 3PT: 3/6 (50.0%), REB: 11 (1 off, 10 def), AST: 8, TO: 3
TEAM FOULS: 7 [Team_044 in BONUS]

================================================================================

================================================================================
                       4TH QUARTER - Team_044 vs Team_043                       
================================================================================

[12:00] Team_044 possession (Score: 81-84)
Isaiah Murray attempts a Midrange. Contested by Magic Durant (5.8 feet, ZONE). ISAIAH MURRAY MAKES IT! Assist: Karl Fox
Score: 83-84

[11:48] Team_043 possession (Score: 83-84)
Dwyane Dosunmu drives to the basket... Dwyane Dosunmu loses the ball! Stripped by Ayo McCollum! TURNOVER! (live ball)

[11:35] Team_044 possession (Score: 83-84)
Isaiah Murray drives, picks up Manu Carter. Help arrives from Malcolm Murray! Isaiah Murray attempts a Layup. Contested by Malcolm Murray (5.0 feet, ZONE). Isaiah Murray misses. FOUL! Loose ball foul on D'Angelo Iverson during the rebound battle. [Team fouls: 1] No free throws, side out. (D'Angelo Iverson: 1 personal fouls)

[11:20] Team_044 possession (Score: 83-84)
Karl Fox attempts a 3Pt. Contested by D'Angelo Iverson (3.4 feet, ZONE). KARL FOX MAKES IT! Assist: Zach McGrady
Score: 86-84

[11:03] Team_043 possession (Score: 86-84)
D'Angelo Iverson attempts a Midrange. Contested by Karl Fox (4.4 feet, ZONE). D'Angelo Iverson misses. Offensive rebound by Manu Carter! Manu Carter kicks it out.

[10:53] Team_043 possession (Score: 86-84)
FOUL! Shooting foul on Isaiah Murray. Manu Carter to the line for 2 free throws. [Team fouls: 1] (Isaiah Murray: 1 personal fouls)   FT 1/2: GOOD   FT 2/2: GOOD Manu Carter makes 2/2 from the line.
Score: 86-86

[10:39] Team_044 possession (Score: 86-86)
Isaiah Murray drives, picks up Magic Durant. Help arrives from D'Angelo Iverson! Isaiah Murray attempts a Dunk. Contested by D'Angelo Iverson (6.0 feet, MAN). Isaiah Murray misses. Rebound secured by D'Angelo Iverson.

[10:28] Team_043 possession (Score: 86-86)
Malcolm Murray makes the Midrange and draws the foul on Isaiah Murray! And-1! Malcolm Murray to the line for 1. [Team fouls: 2] (Isaiah Murray: 2 personal fouls)   FT 1/1: GOOD Malcolm Murray makes 1/1 from the line.
Score: 86-89

[10:19] Team_044 possession (Score: 86-89)
Zach McGrady attempts a 3Pt. Contested by Malcolm Murray (4.5 feet, MAN). ZACH MCGRADY MAKES IT!
Score: 89-89

[10:04] Team_043 possession (Score: 89-89)
Magic Durant drives and kicks out. D'Angelo Iverson attempts a Midrange. Contested by Victor Westbrook (5.9 feet, MAN). D'ANGELO IVERSON MAKES IT!
Score: 89-91

[09:54] Team_044 possession (Score: 89-91)
Karl Fox attempts a 3Pt. Contested by Manu Carter (5.0 feet, MAN). Karl Fox misses. Rebound secured by Manu Carter.

[09:38] Team_043 possession (Score: 89-91)
Manu Carter attempts a Layup. Contested by Karl Fox (4.9 feet, MAN). Manu Carter misses. Rebound secured by Karl Fox.

[09:27] Team_044 possession (Score: 89-91)
Ayo McCollum attempts a 3Pt. Contested by Manu Carter (4.8 feet, MAN). Ayo McCollum misses. Offensive rebound by Victor Westbrook! Victor Westbrook kicks it out.

[09:10] Team_044 possession (Score: 89-91)
FOUL! Reach-in foul on Manu Carter during the drive. [Team fouls: 2] No free throws, side out. (Manu Carter: 1 personal fouls)

[09:00] Team_044 possession (Score: 89-91)
Isaiah Murray attempts a 3Pt. Contested by Manu Carter (5.3 feet, ZONE). Isaiah Murray misses. Rebound secured by Manu Carter.

[08:47] Team_043 possession (Score: 89-91)
FOUL! Reach-in foul on Ayo McCollum during the drive. [Team fouls: 3] No free throws, side out. (Ayo McCollum: 1 personal fouls)

[08:34] Team_043 possession (Score: 89-91)
Magic Durant attempts a 3Pt. Contested by Isaiah Murray (5.3 feet, ZONE). Magic Durant misses. Rebound secured by Karl Fox.

[08:21] Team_044 possession (Score: 89-91)
FOUL! Reach-in foul on Magic Durant during the drive. [Team fouls: 3] No free throws, side out. (Magic Durant: 1 personal fouls)

[08:08] Team_044 possession (Score: 89-91)
Isaiah Murray attempts a Midrange. Wide open! Magic Durant is 6.3 feet away. [ZONE] ISAIAH MURRAY MAKES IT! Assist: Victor Westbrook
Score: 91-91

[07:53] Team_043 possession (Score: 91-91)
Dwyane Dosunmu drives and kicks out. Malcolm Murray attempts a 3Pt. Contested by Isaiah Murray (5.6 feet, ZONE). MALCOLM MURRAY MAKES IT! Assist: Magic Durant
Score: 91-94

[07:41] Team_044 possession (Score: 91-94)
FOUL! Shooting foul on D'Angelo Iverson. Victor Westbrook to the line for 3 free throws. [Team fouls: 4] (D'Angelo Iverson: 2 personal fouls)   FT 1/3: GOOD   FT 2/3: GOOD   FT 3/3: GOOD Victor Westbrook makes 3/3 from the line.
Score: 94-94

[07:26] Team_043 possession (Score: 94-94)
Magic Durant attempts a 3Pt. Contested by Isaiah Murray (5.5 feet, MAN). MAGIC DURANT MAKES IT! Assist: Manu Carter
Score: 94-97

[07:11] Team_044 possession (Score: 94-97)
Ayo McCollum attempts a Midrange. Contested by D'Angelo Iverson (3.9 feet, ZONE). Ayo McCollum misses. Rebound secured by Manu Carter.

[06:58] Team_043 possession (Score: 94-97)
Manu Carter attempts a 3Pt. Contested by Isaiah Murray (6.0 feet, ZONE). Manu Carter misses. Offensive rebound by Manu Carter! Manu Carter kicks it out.

[06:43] Team_043 possession (Score: 94-97)
Manu Carter drives, picks up Karl Fox. Help arrives from Zach McGrady! Manu Carter attempts a Layup. Contested by Zach McGrady (5.3 feet, MAN). Manu Carter misses. Offensive rebound by Manu Carter! Manu Carter kicks it out.

[06:30] Team_043 possession (Score: 94-97)
D'Angelo Iverson attempts a Midrange. Wide open! Victor Westbrook is 6.4 feet away. [MAN] D'ANGELO IVERSON MAKES IT!
Score: 94-99

[06:20] Team_044 possession (Score: 94-99)
Ayo McCollum attempts a Midrange. Wide open! Dwyane Dosunmu is 6.0 feet away. [MAN] AYO MCCOLLUM MAKES IT! Assist: Zach McGrady
Score: 96-99

[06:06] Team_043 possession (Score: 96-99)
Magic Durant attempts a 3Pt. Contested by Isaiah Murray (5.7 feet, ZONE). Magic Durant misses. Rebound secured by Victor Westbrook.

[05:56] Team_044 possession (Score: 96-99)
Victor Westbrook makes the Layup and draws the foul on D'Angelo Iverson! And-1! Victor Westbrook to the line for 1. [BONUS: 5 team fouls] (D'Angelo Iverson: 3 personal fouls)   FT 1/1: GOOD Victor Westbrook makes 1/1 from the line.
Score: 99-99

[05:47] Team_043 possession (Score: 99-99)
D'Angelo Iverson attempts a 3Pt. Wide open! Victor Westbrook is 6.6 feet away. [MAN] D'Angelo Iverson misses. Rebound secured by Ayo McCollum.

[05:34] Team_044 possession (Score: 99-99)
Ayo McCollum attempts a Midrange. Wide open! Dwyane Dosunmu is 6.2 feet away. [MAN] AYO MCCOLLUM MAKES IT! Assist: Isaiah Murray
Score: 101-99

[05:20] Team_043 possession (Score: 101-99)
Manu Carter attempts a 3Pt. Wide open! Isaiah Murray is 6.2 feet away. [ZONE] Manu Carter misses. Rebound secured by Victor Westbrook.

[05:06] Team_044 possession (Score: 101-99)
Zach McGrady drives, Malcolm Murray stays with him. Zach McGrady attempts a Dunk. Contested by Malcolm Murray (5.3 feet, MAN). Zach McGrady misses. Rebound secured by Dwyane Dosunmu.

[04:52] Team_043 possession (Score: 101-99)
Dwyane Dosunmu attempts a Midrange. Wide open! Ayo McCollum is 6.3 feet away. [MAN] DWYANE DOSUNMU MAKES IT! Assist: Magic Durant
Score: 101-101

[04:38] Team_044 possession (Score: 101-101)
FOUL! Shooting foul on D'Angelo Iverson. Victor Westbrook to the line for 2 free throws. [BONUS: 6 team fouls] (D'Angelo Iverson: 4 personal fouls)   FT 1/2: GOOD   FT 2/2: GOOD Victor Westbrook makes 2/2 from the line.
Score: 103-101

[04:27] Team_043 possession (Score: 103-101)
Magic Durant attempts a Layup. Contested by Karl Fox (5.3 feet, ZONE). Magic Durant misses. Rebound secured by Victor Westbrook.

[04:13] Team_044 possession (Score: 103-101)
Ayo McCollum drives and kicks out. Zach McGrady attempts a 3Pt. Contested by Malcolm Murray (5.4 feet, ZONE). ZACH MCGRADY MAKES IT!
Score: 106-101

[03:58] Team_043 possession (Score: 106-101)
Magic Durant attempts a 3Pt. Contested by Isaiah Murray (6.0 feet, MAN). Magic Durant misses. Rebound secured by Karl Fox.

[03:46] Team_044 possession (Score: 106-101)
Karl Fox drives, Manu Carter stays with him. Karl Fox attempts a Dunk. Contested by Manu Carter (6.0 feet, MAN). KARL FOX MAKES IT! Assist: Victor Westbrook
Score: 108-101

[03:32] Team_043 possession (Score: 108-101)
Magic Durant attempts a Layup. Contested by Karl Fox (5.4 feet, ZONE). MAGIC DURANT MAKES IT! Assist: Manu Carter
Score: 108-103

[03:21] Team_044 possession (Score: 108-103)
Victor Westbrook drives and kicks out. Victor Westbrook attempts a Midrange. Contested by D'Angelo Iverson (4.9 feet, MAN). Victor Westbrook misses. Rebound secured by D'Angelo Iverson.

[03:05] Team_043 possession (Score: 108-103)
D'Angelo Iverson attempts a Midrange. Wide open! Victor Westbrook is 7.0 feet away. [MAN] D'ANGELO IVERSON MAKES IT!
Score: 108-105

[02:52] Team_044 possession (Score: 108-105)
Victor Westbrook attempts a 3Pt. Contested by D'Angelo Iverson (4.7 feet, ZONE). Victor Westbrook misses. FOUL! Loose ball foul on D'Angelo Iverson during the rebound battle. [IN THE BONUS! 7 team fouls] Ayo McCollum to the line for 2 free throws. (D'Angelo Iverson: 5 personal fouls)   FT 1/2: GOOD   FT 2/2: MISS Ayo McCollum makes 1/2 from the line. Rebound secured by Manu Carter.
Score: 109-105

[02:37] Team_043 possession (Score: 109-105)
Malcolm Murray attempts a 3Pt. Contested by Zach McGrady (5.9 feet, MAN). Malcolm Murray misses. Rebound secured by Karl Fox.

[02:20] Team_044 possession (Score: 109-105)
Zach McGrady attempts a Layup. Contested by Malcolm Murray (5.7 feet, MAN). ZACH MCGRADY MAKES IT! Assist: Isaiah Murray
Score: 111-105

[02:09] Team_043 possession (Score: 111-105)
Malcolm Murray attempts a 3Pt. Wide open! Isaiah Murray is 6.4 feet away. [ZONE] Malcolm Murray misses. Rebound secured by Karl Fox.

[01:54] Team_044 possession (Score: 111-105)
Isaiah Murray attempts a 3Pt. Wide open! Magic Durant is 7.2 feet away. [MAN] ISAIAH MURRAY MAKES IT! Assist: Karl Fox
Score: 114-105

[01:38] Team_043 possession (Score: 114-105)
Manu Carter attempts a Layup. Wide open! Karl Fox is 6.1 feet away. [MAN] MANU CARTER MAKES IT!
Score: 114-107

[01:19] Team_044 possession (Score: 114-107)
Victor Westbrook drives, picks up D'Angelo Iverson. Help arrives from Malcolm Murray! Victor Westbrook attempts a Layup. Contested by Malcolm Murray (5.0 feet, MAN). VICTOR WESTBROOK MAKES IT!
Score: 116-107

[01:05] Team_043 possession (Score: 116-107)
FOUL! Reach-in foul on Ayo McCollum during the drive. [Team fouls: 4] No free throws, side out. (Ayo McCollum: 2 personal fouls)

[00:50] Team_043 possession (Score: 116-107)
Magic Durant drives, Karl Fox stays with him. Magic Durant attempts a Dunk. Contested by Karl Fox (5.8 feet, ZONE). MAGIC DURANT MAKES IT! Assist: Dwyane Dosunmu
Score: 116-109

[00:37] Team_044 possession (Score: 116-109)
Isaiah Murray attempts a Midrange. Contested by D'Angelo Iverson (5.4 feet, ZONE). Isaiah Murray misses. Rebound secured by Manu Carter.

[00:27] Team_043 possession (Score: 116-109)
Dwyane Dosunmu attempts a 3Pt. Wide open! Ayo McCollum is 7.0 feet away. [MAN] Dwyane Dosunmu misses. FOUL! Loose ball foul on Ayo McCollum during the rebound battle. [IN THE BONUS! 5 team fouls] Manu Carter to the line for 2 free throws. (Ayo McCollum: 3 personal fouls)   FT 1/2: GOOD   FT 2/2: MISS Manu Carter makes 1/2 from the line. Offensive rebound by D'Angelo Iverson! D'Angelo Iverson kicks it out.
Score: 116-110

[00:15] Team_043 possession (Score: 116-110)
Malcolm Murray attempts a 3Pt. Wide open! Zach McGrady is 6.2 feet away. [MAN] Malcolm Murray misses. Rebound secured by Ayo McCollum.

[00:03] Team_044 possession (Score: 116-110)
Ayo McCollum drives, picks up Dwyane Dosunmu. Help arrives from Malcolm Murray! Ayo McCollum attempts a Dunk. Wide open! Malcolm Murray is 7.1 feet away. [MAN] AYO MCCOLLUM MAKES IT!
Score: 118-110

================================================================================
                              4TH QUARTER COMPLETE                              
================================================================================

4TH QUARTER SCORE: Team_044 37, Team_043 26

BOX SCORE:
================================================================================

Team_044
--------------------------------------------------------------------------------
Player                MIN  PTS  REB  AST  TO      FG   FG%      3P   3P%
--------------------------------------------------------------------------------
Victor Westbrook       43   10    5    2   0   4/6    66.7     0/0   0.0
Zach McGrady           43    8    0    2   0   3/4    75.0     0/0   0.0
Isaiah Murray          43    7    0    2   0   3/6    50.0     0/0   0.0
Ayo McCollum           43    6    2    0   0   3/4    75.0     0/0   0.0
Karl Fox               43    5    5    2   0   2/3    66.7     0/0   0.0

TEAM: FG: 15/23 (65.2%), 3PT: 4/7 (57.1%), REB: 13 (3 off, 10 def), AST: 8, TO: 0
TEAM FOULS: 5 [Team_043 in BONUS]


Team_043
--------------------------------------------------------------------------------
Player                MIN  PTS  REB  AST  TO      FG   FG%      3P   3P%
--------------------------------------------------------------------------------
Magic Durant           43    7    0    2   0   3/7    42.9     0/0   0.0
D'Angelo Iverson       43    6    3    0   0   3/4    75.0     0/0   0.0
Malcolm Murray         43    6    0    0   0   2/5    40.0     0/0   0.0
Manu Carter            43    4    8    2   0   2/4    50.0     0/0   0.0
Dwyane Dosunmu         43    2    1    1   0   1/1   100.0     0/0   0.0

TEAM: FG: 11/21 (52.4%), 3PT: 1/9 (11.1%), REB: 11 (4 off, 7 def), AST: 5, TO: 1
TEAM FOULS: 7 [Team_044 in BONUS]

================================================================================

================================================================================
                               FULL GAME COMPLETE                               
================================================================================

FINAL SCORE: Team_044 118, Team_043 110

SCORING BY QUARTER:
--------------------------------------------------------------------------------
Team                     Q1     Q2     Q3     Q4    FINAL
--------------------------------------------------------------------------------
Team_044                 23     29     29     37      118
Team_043                 23     32     29     26      110
--------------------------------------------------------------------------------

FULL GAME BOX SCORE:
================================================================================

Team_044
--------------------------------------------------------------------------------
Player                MIN  PTS  REB  AST  TO      FG   FG%      3P   3P%      FT STL BLK
--------------------------------------------------------------------------------
Zach McGrady           43   17    0    4   1   8/14   57.1   2/5    40.0   2/2     0   0
Isaiah Murray          43   15    0    6   0   8/19   42.1   4/8    50.0   0/0     0   1
Victor Westbrook       43   31   16    4   1  12/19   63.2   2/6    33.3  18/23    0   0
Karl Fox               43   16   13    4   1   7/12   58.3   2/3    66.7   2/3     0   1
Ayo McCollum           43   20   13    3   0   8/11   72.7   0/1     0.0   5/6     1   1
Kyrie Poole             6    5    0    0   0   2/4    50.0   2/4    50.0   2/3     0   0
Tim Towns               6    0    0    0   0   0/0     0.0   0/0     0.0   0/0     0   0
Tim Siakam              6    3    3    1   0   1/1   100.0   1/1   100.0   0/0     0   0
Pau Quickley            6    3    1    0   0   1/3    33.3   1/2    50.0   0/0     0   0
Victor Anthony          6    4    0    2   0   2/3    66.7   0/1     0.0   2/2     0   0

TEAM: FG: 51/88 (58.0%), 3PT: 14/31 (45.2%), REB: 47 (13 off, 34 def), AST: 24, TO: 3


Team_043
--------------------------------------------------------------------------------
Player                MIN  PTS  REB  AST  TO      FG   FG%      3P   3P%      FT STL BLK
--------------------------------------------------------------------------------
Malcolm Murray         43   18    0    3   2   6/16   37.5   3/11   27.3   2/3     1   0
Magic Durant           43   28    0    3   0  12/18   66.7   4/8    50.0   4/5     0   0
D'Angelo Iverson       43   22   12    4   1   8/14   57.1   2/6    33.3   0/0     0   0
Manu Carter            43   13   18   10   2   6/12   50.0   0/3     0.0   4/5     1   1
Dwyane Dosunmu         43    8    9    6   1   6/12   50.0   0/1     0.0   2/4     0   0
Jabari Holiday          6    0    0    0   0   0/0     0.0   0/0     0.0   0/0     0   0
Ben LaVine              6    2    1    0   0   1/1   100.0   0/0     0.0   0/0     0   0
Dirk Herro              6    3    1    0   0   1/2    50.0   0/1     0.0   3/4     0   0
Joel Murray             6    3    0    0   1   1/2    50.0   0/0     0.0   1/1     0   0
Terry Randle            6   10    3    0   0   4/4   100.0   0/0     0.0   4/4     0   0

TEAM: FG: 46/82 (56.1%), 3PT: 9/30 (30.0%), REB: 43 (7 off, 36 def), AST: 26, TO: 7

================================================================================
