================================================================================
                        FULL GAME - Team_017 vs Team_015                        
================================================================================

================================================================================
                       1ST QUARTER - Team_017 vs Team_015                       
================================================================================

[12:00] Team_017 possession (Score: 0-0)
Bam Williamson attempts a Midrange. Contested by Trae Turner (4.3 feet, MAN). BAM WILLIAMSON MAKES IT! Assist: Desmond Reaves
Score: 2-0

[11:48] Team_015 possession (Score: 2-0)
Michael Simmons attempts a 3Pt. Contested by Desmond Reaves (4.1 feet, ZONE). Michael Simmons misses. Rebound secured by Kyrie Middleton.

[11:32] Team_017 possession (Score: 2-0)
FOUL! Holding foul on CJ Banchero. [Team fouls: 1] No free throws, side out. (CJ Banchero: 1 personal fouls)

[11:18] Team_017 possession (Score: 2-0)
Tony Smith commits a violation (traveling/carry)! TURNOVER! (dead ball)

[11:04] Team_015 possession (Score: 2-0)
Trae Turner drives to the basket... FOUL! Offensive foul on Trae Turner! Bam Williamson drew the charge! [Team fouls: 2] (Trae Turner: 1 personal fouls) TURNOVER! (dead ball)

[10:50] Team_017 possession (Score: 2-0)
Desmond Reaves makes the 3Pt and draws the foul on Manu Anthony! And-1! Desmond Reaves to the line for 1. [Team fouls: 3] (Manu Anthony: 1 personal fouls)   FT 1/1: GOOD Desmond Reaves makes 1/1 from the line.
Score: 6-0

[10:35] Team_015 possession (Score: 6-0)
CJ Banchero drives, picks up Bam Williamson. Help arrives from Vince Banchero! CJ Banchero attempts a Dunk. Contested by Vince Banchero (3.9 feet, ZONE). CJ BANCHERO MAKES IT!
Score: 6-2

[10:22] Team_017 possession (Score: 6-2)
Bam Williamson makes the Dunk and draws the foul on Michael Simmons! And-1! Bam Williamson to the line for 1. [Team fouls: 4] (Michael Simmons: 1 personal fouls)   FT 1/1: GOOD Bam Williamson makes 1/1 from the line.
Score: 9-2

[10:07] Team_015 possession (Score: 9-2)
Manu Anthony attempts a 3Pt. Contested by Desmond Reaves (4.3 feet, ZONE). Manu Anthony misses. Rebound secured by Bam Williamson.

[09:52] Team_017 possession (Score: 9-2)
Desmond Reaves makes the Layup and draws the foul on Manu Anthony! And-1! Desmond Reaves to the line for 1. [BONUS: 5 team fouls] (Manu Anthony: 2 personal fouls)   FT 1/1: GOOD Desmond Reaves makes 1/1 from the line.
Score: 12-2

[09:40] Team_015 possession (Score: 12-2)
Michael Simmons attempts a Layup. Contested by Bam Williamson (4.1 feet, ZONE). MICHAEL SIMMONS MAKES IT!
Score: 12-4

[09:28] Team_017 possession (Score: 12-4)
Bam Williamson attempts a 3Pt. Contested by Manu Anthony (4.4 feet, ZONE). Bam Williamson misses. Rebound secured by Michael Simmons.

[09:14] Team_015 possession (Score: 12-4)
Trae Turner attempts a Layup. Contested by Bam Williamson (4.2 feet, ZONE). Trae Turner misses. Rebound secured by Tony Smith.

[08:59] Team_017 possession (Score: 12-4)
Bam Williamson makes the Dunk and draws the foul on Scottie Gasol! And-1! Bam Williamson to the line for 1. [BONUS: 6 team fouls] (Scottie Gasol: 1 personal fouls)   FT 1/1: GOOD Bam Williamson makes 1/1 from the line.
Score: 15-4

[08:47] Team_015 possession (Score: 15-4)
CJ Banchero attempts a Layup. Contested by Tony Smith (2.6 feet, MAN). CJ BANCHERO MAKES IT!
Score: 15-6

[08:33] Team_017 possession (Score: 15-6)
Desmond Reaves attempts a 3Pt. Contested by Manu Anthony (4.1 feet, ZONE). Desmond Reaves misses. Rebound secured by CJ Banchero.

[08:16] Team_015 possession (Score: 15-6)
Scottie Gasol attempts a Dunk. BLOCKED BY KYRIE MIDDLETON! Ball deflects out of bounds off Scottie Gasol.

[08:03] Team_017 possession (Score: 15-6)
Bam Williamson drives and kicks out. Desmond Reaves attempts a Midrange. Contested by CJ Banchero (4.2 feet, ZONE). DESMOND REAVES MAKES IT! Assist: Bam Williamson
Score: 17-6

[07:46] Team_015 possession (Score: 17-6)
Scottie Gasol attempts a Midrange. Contested by Kyrie Middleton (5.0 feet, MAN). Scottie Gasol misses. Rebound secured by Tony Smith.

[07:29] Team_017 possession (Score: 17-6)
Tony Smith attempts a 3Pt. Contested by CJ Banchero (4.8 feet, MAN). Tony Smith misses. Rebound secured by CJ Banchero.

[07:16] Team_015 possession (Score: 17-6)
Trae Turner drives, Bam Williamson stays with him. Trae Turner attempts a Dunk. Contested by Bam Williamson (4.2 feet, ZONE). TRAE TURNER MAKES IT! Assist: Michael Simmons
Score: 17-8

[07:02] Team_017 possession (Score: 17-8)
Tony Smith attempts a Midrange. Contested by CJ Banchero (4.8 feet, MAN). Tony Smith misses. Rebound secured by Trae Turner.

[06:51] Team_015 possession (Score: 17-8)
CJ Banchero attempts a Midrange. Contested by Tony Smith (2.6 feet, MAN). CJ Banchero misses. Rebound secured by Bam Williamson.

[06:34] Team_017 possession (Score: 17-8)
Vince Banchero attempts a 3Pt. Contested by Michael Simmons (3.3 feet, MAN). Vince Banchero misses. Rebound secured by Trae Turner.

[06:19] Team_015 possession (Score: 17-8)
Manu Anthony attempts a 3Pt. Contested by Desmond Reaves (4.3 feet, ZONE). Manu Anthony misses. Rebound secured by Bam Williamson.

[06:07] Team_017 possession (Score: 17-8)
Tony Smith drives, CJ Banchero stays with him. Tony Smith attempts a Layup. Contested by CJ Banchero (4.8 feet, MAN). TONY SMITH MAKES IT! Assist: Vince Banchero
Score: 19-8

[05:52] Team_015 possession (Score: 19-8)
Scottie Gasol makes the Dunk and draws the foul on Kyrie Middleton! And-1! Scottie Gasol to the line for 1. [Team fouls: 1] (Kyrie Middleton: 1 personal fouls)   FT 1/1: GOOD Scottie Gasol makes 1/1 from the line.
Score: 19-11

[05:38] Team_017 possession (Score: 19-11)
Bam Williamson drives, picks up Trae Turner. Help arrives from Michael Simmons! Bam Williamson attempts a Layup. Contested by Michael Simmons (4.3 feet, MAN). Bam Williamson misses. Offensive rebound by Bam Williamson! Bam Williamson puts it back in!
Score: 21-11

[05:28] Team_015 possession (Score: 21-11)
CJ Banchero makes the Dunk and draws the foul on Vince Banchero! And-1! CJ Banchero to the line for 1. [Team fouls: 2] (Vince Banchero: 1 personal fouls)   FT 1/1: GOOD CJ Banchero makes 1/1 from the line.
Score: 21-14

[05:15] Team_017 possession (Score: 21-14)
Tony Smith drives, CJ Banchero stays with him. Tony Smith attempts a Layup. Contested by CJ Banchero (4.8 feet, MAN). TONY SMITH MAKES IT! Assist: Bam Williamson
Score: 23-14

[05:01] Team_015 possession (Score: 23-14)
Trae Turner drives to the basket... Trae Turner loses control! Ball rolls out of bounds! TURNOVER! (dead ball)

[04:42] Team_017 possession (Score: 23-14)
Vince Banchero attempts a Midrange. Contested by Michael Simmons (3.4 feet, MAN). VINCE BANCHERO MAKES IT!
Score: 25-14

[04:24] Team_015 possession (Score: 25-14)
Trae Turner drives to the basket... Trae Turner throws a bad pass! Stolen by Bam Williamson! TURNOVER! (live ball)

[04:11] Team_017 possession (Score: 25-14)
Bam Williamson makes the Dunk and draws the foul on Michael Simmons! And-1! Bam Williamson to the line for 1. [BONUS: 7 team fouls] (Michael Simmons: 2 personal fouls)   FT 1/1: GOOD Bam Williamson makes 1/1 from the line.
Score: 28-14

[04:01] Team_015 possession (Score: 28-14)
Manu Anthony commits a violation (traveling/carry)! TURNOVER! (dead ball)

[03:44] Team_017 possession (Score: 28-14)
Kyrie Middleton attempts a 3Pt. Contested by Manu Anthony (4.1 feet, ZONE). Kyrie Middleton misses. Rebound secured by Michael Simmons.

[03:30] Team_015 possession (Score: 28-14)
Trae Turner attempts a Midrange. Contested by Vince Banchero (4.3 feet, ZONE). Trae Turner misses. Rebound secured by Kyrie Middleton.

[03:17] Team_017 possession (Score: 28-14)
Vince Banchero attempts a Layup. Contested by Scottie Gasol (3.6 feet, ZONE). VINCE BANCHERO MAKES IT! Assist: Tony Smith
Score: 30-14

[02:59] Team_015 possession (Score: 30-14)
Michael Simmons makes the Dunk and draws the foul on Bam Williamson! And-1! Michael Simmons to the line for 1. [Team fouls: 3] (Bam Williamson: 1 personal fouls)   FT 1/1: GOOD Michael Simmons makes 1/1 from the line.
Score: 30-17

[02:49] Team_017 possession (Score: 30-17)
Tony Smith commits a violation (traveling/carry)! TURNOVER! (dead ball)

[02:49] Substitution (Team_017): Desmond Reaves OUT → Blake Reaves IN (stamina_rule2)

[02:49] Substitution (Team_017): Bam Williamson OUT → Klay Holiday IN (stamina_rule2)

[02:49] Substitution (Team_015): Scottie Gasol OUT → Rudy Paul IN (stamina_rule2)

[02:49] Substitution (Team_015): Trae Turner OUT → Allen Curry IN (stamina_rule2)

[02:39] Team_015 possession (Score: 30-17)
Rudy Paul attempts a Layup. Contested by Kyrie Middleton (5.8 feet, ZONE). RUDY PAUL MAKES IT! Assist: Manu Anthony
Score: 30-19

[02:25] Team_017 possession (Score: 30-19)
Vince Banchero attempts a Midrange. Contested by CJ Banchero (4.5 feet, ZONE). Vince Banchero misses. Rebound secured by Allen Curry.

[02:15] Team_015 possession (Score: 30-19)
CJ Banchero attempts a 3Pt. Contested by Tony Smith (2.9 feet, ZONE). CJ Banchero misses. Offensive rebound by Allen Curry! Allen Curry's putback is no good. Rebound secured by Kyrie Middleton.

[01:57] Team_017 possession (Score: 30-19)
Blake Reaves attempts a 3Pt. Contested by Manu Anthony (3.9 feet, MAN). Blake Reaves misses. Rebound secured by Rudy Paul.

[01:44] Team_015 possession (Score: 30-19)
Allen Curry drives, Kyrie Middleton stays with him. Allen Curry attempts a Layup. Contested by Kyrie Middleton (5.7 feet, ZONE). ALLEN CURRY MAKES IT!
Score: 30-21

[01:27] Team_017 possession (Score: 30-21)
Vince Banchero makes the Layup and draws the foul on Rudy Paul! And-1! Vince Banchero to the line for 1. [BONUS: 8 team fouls] (Rudy Paul: 1 personal fouls)   FT 1/1: GOOD Vince Banchero makes 1/1 from the line.
Score: 33-21

[01:16] Team_015 possession (Score: 33-21)
Michael Simmons attempts a 3Pt. Contested by Vince Banchero (4.4 feet, MAN). MICHAEL SIMMONS MAKES IT! Assist: Rudy Paul
Score: 33-24

[01:04] Team_017 possession (Score: 33-24)
Klay Holiday drives to the basket... FOUL! Offensive foul on Klay Holiday! Rudy Paul drew the charge! [Team fouls: 4] (Klay Holiday: 1 personal fouls) TURNOVER! (dead ball)

[00:45] Team_015 possession (Score: 33-24)
FOUL! Holding foul on Tony Smith. [IN THE BONUS! 5 team fouls] CJ Banchero to the line for 2 free throws. (Tony Smith: 1 personal fouls)   FT 1/2: GOOD   FT 2/2: GOOD CJ Banchero makes 2/2 from the line.
Score: 33-26

[00:30] Team_017 possession (Score: 33-26)
Blake Reaves attempts a Midrange. Contested by Rudy Paul (3.2 feet, ZONE). Blake Reaves misses. Offensive rebound by Kyrie Middleton! Kyrie Middleton kicks it out.

[00:15] Team_017 possession (Score: 33-26)
Kyrie Middleton attempts a Layup. Contested by Rudy Paul (3.5 feet, ZONE). KYRIE MIDDLETON MAKES IT! Assist: Tony Smith
Score: 35-26

[00:02] Team_015 possession (Score: 35-26)
FOUL! Holding foul on Klay Holiday. [IN THE BONUS! 6 team fouls] Allen Curry to the line for 2 free throws. (Klay Holiday: 2 personal fouls)   FT 1/2: GOOD   FT 2/2: GOOD Allen Curry makes 2/2 from the line.
Score: 35-28

================================================================================
                              1ST QUARTER COMPLETE                              
================================================================================

1ST QUARTER SCORE: Team_017 35, Team_015 28

BOX SCORE:
================================================================================

Team_017
--------------------------------------------------------------------------------
Player                MIN  PTS  REB  AST  TO      FG   FG%      3P   3P%
--------------------------------------------------------------------------------
Bam Williamson          9   13    4    2   0   5/6    83.3     0/0   0.0
Desmond Reaves          9    9    0    1   0   3/4    75.0     0/0   0.0
Vince Banchero         12    7    0    1   0   3/5    60.0     0/0   0.0
Tony Smith             12    4    2    2   0   2/4    50.0     0/0   0.0
Kyrie Middleton        12    2    4    0   0   1/2    50.0     0/0   0.0
Blake Reaves            3    0    0    0   0   0/1     0.0     0/0   0.0

TEAM: FG: 14/22 (63.6%), 3PT: 1/7 (14.3%), REB: 9 (2 off, 7 def), AST: 6, TO: 3
TEAM FOULS: 6 [Team_015 in BONUS]


Team_015
--------------------------------------------------------------------------------
Player                MIN  PTS  REB  AST  TO      FG   FG%      3P   3P%
--------------------------------------------------------------------------------
CJ Banchero            12    9    2    0   0   4/6    66.7     0/0   0.0
Michael Simmons        12    8    2    1   0   3/4    75.0     0/0   0.0
Allen Curry             3    4    1    0   0   2/2   100.0     0/0   0.0
Scottie Gasol           9    3    0    0   0   1/3    33.3     0/0   0.0
Trae Turner             9    2    2    0   0   1/3    33.3     0/0   0.0
Rudy Paul               3    2    1    1   0   1/1   100.0     0/0   0.0
Manu Anthony           12    0    0    1   0   0/2     0.0     0/0   0.0

TEAM: FG: 12/21 (57.1%), 3PT: 1/5 (20.0%), REB: 9 (1 off, 8 def), AST: 3, TO: 4
TEAM FOULS: 8 [Team_017 in BONUS]

================================================================================

================================================================================
                       2ND QUARTER - Team_017 vs Team_015                       
================================================================================

[12:00] Team_017 possession (Score: 35-28)
Vince Banchero attempts a 3Pt. Contested by Manu Anthony (3.9 feet, ZONE). Vince Banchero misses. Rebound secured by Scottie Gasol.

[11:45] Team_015 possession (Score: 35-28)
Michael Simmons drives and kicks out. Michael Simmons attempts a Midrange. Contested by Vince Banchero (4.4 feet, MAN). Michael Simmons misses. Rebound secured by Kyrie Middleton.

[11:30] Team_017 possession (Score: 35-28)
Tony Smith attempts a 3Pt. Contested by Manu Anthony (4.5 feet, ZONE). Tony Smith misses. Rebound secured by Scottie Gasol.

[11:13] Team_015 possession (Score: 35-28)
Trae Turner attempts a Midrange. Contested by Bam Williamson (4.2 feet, MAN). TRAE TURNER MAKES IT! Assist: Scottie Gasol
Score: 35-30

[10:57] Team_017 possession (Score: 35-30)
Bam Williamson drives to the basket... FOUL! Offensive foul on Bam Williamson! Trae Turner drew the charge! [Team fouls: 1] (Bam Williamson: 1 personal fouls) TURNOVER! (dead ball)

[10:44] Team_015 possession (Score: 35-30)
Michael Simmons attempts a Layup. Contested by Vince Banchero (4.5 feet, MAN). MICHAEL SIMMONS MAKES IT!
Score: 35-32

[10:33] Team_017 possession (Score: 35-32)
Tony Smith attempts a 3Pt. Contested by Manu Anthony (4.6 feet, ZONE). Tony Smith misses. Offensive rebound by Bam Williamson! Bam Williamson puts it back in!
Score: 37-32

[10:20] Team_015 possession (Score: 37-32)
CJ Banchero attempts a 3Pt. Contested by Desmond Reaves (3.9 feet, ZONE). CJ BANCHERO MAKES IT! Assist: Scottie Gasol
Score: 37-35

[10:05] Team_017 possession (Score: 37-35)
Vince Banchero attempts a 3Pt. Contested by Michael Simmons (3.9 feet, MAN). Vince Banchero misses. Rebound secured by Scottie Gasol.

[09:47] Team_015 possession (Score: 37-35)
CJ Banchero drives, Bam Williamson stays with him. CJ Banchero attempts a Dunk. Contested by Bam Williamson (4.0 feet, ZONE). CJ BANCHERO MAKES IT!
Score: 37-37

[09:33] Team_017 possession (Score: 37-37)
Bam Williamson attempts a Dunk. BLOCKED BY SCOTTIE GASOL! Ball deflects out of bounds off Bam Williamson.

[09:19] Team_015 possession (Score: 37-37)
Michael Simmons attempts a 3Pt. Contested by Vince Banchero (4.7 feet, ZONE). MICHAEL SIMMONS MAKES IT! Assist: Trae Turner
Score: 37-40

[09:05] Team_017 possession (Score: 37-40)
FOUL! Holding foul on Michael Simmons. [Team fouls: 1] No free throws, side out. (Michael Simmons: 1 personal fouls)

[08:49] Team_017 possession (Score: 37-40)
Vince Banchero attempts a Layup. Contested by Michael Simmons (4.1 feet, MAN). VINCE BANCHERO MAKES IT! Assist: Tony Smith
Score: 39-40

[08:34] Team_015 possession (Score: 39-40)
Michael Simmons attempts a 3Pt. Contested by Desmond Reaves (4.3 feet, ZONE). Michael Simmons misses. Offensive rebound by Trae Turner! Trae Turner kicks it out.

[08:22] Team_015 possession (Score: 39-40)
CJ Banchero attempts a 3Pt. Contested by Desmond Reaves (4.1 feet, ZONE). CJ Banchero misses. Rebound secured by Kyrie Middleton.

[08:13] Team_017 possession (Score: 39-40)
Desmond Reaves attempts a 3Pt. Contested by Michael Simmons (4.7 feet, ZONE). Desmond Reaves misses. Rebound secured by Trae Turner.

[07:56] Team_015 possession (Score: 39-40)
Trae Turner attempts a Midrange. Contested by Kyrie Middleton (5.9 feet, ZONE). Trae Turner misses. Offensive rebound by Trae Turner! Trae Turner kicks it out.

[07:41] Team_015 possession (Score: 39-40)
FOUL! Offensive foul on Michael Simmons! Vince Banchero drew the charge! [Team fouls: 2] (Michael Simmons: 2 personal fouls) TURNOVER! (dead ball)

[07:28] Team_017 possession (Score: 39-40)
Desmond Reaves attempts a 3Pt. Contested by Manu Anthony (5.0 feet, MAN). Desmond Reaves misses. Rebound secured by Trae Turner.

[07:15] Team_015 possession (Score: 39-40)
Manu Anthony drives, Kyrie Middleton stays with him. Manu Anthony attempts a Dunk. Wide open! Kyrie Middleton is 6.0 feet away. [ZONE] MANU ANTHONY MAKES IT! Assist: Trae Turner
Score: 39-42

[06:59] Team_017 possession (Score: 39-42)
Desmond Reaves drives to the basket... FOUL! Offensive foul on Desmond Reaves! Scottie Gasol drew the charge! [Team fouls: 2] (Desmond Reaves: 1 personal fouls) TURNOVER! (dead ball)

[06:43] Team_015 possession (Score: 39-42)
CJ Banchero makes the Dunk and draws the foul on Tony Smith! And-1! CJ Banchero to the line for 1. [Team fouls: 3] (Tony Smith: 1 personal fouls)   FT 1/1: MISS CJ Banchero makes 0/1 from the line. Rebound secured by Kyrie Middleton.
Score: 39-44

[06:27] Team_017 possession (Score: 39-44)
Vince Banchero drives and kicks out. Kyrie Middleton attempts a 3Pt. Contested by Scottie Gasol (4.1 feet, MAN). Kyrie Middleton misses. Rebound secured by Trae Turner.

[06:10] Team_015 possession (Score: 39-44)
Manu Anthony attempts a 3Pt. Contested by Desmond Reaves (4.8 feet, MAN). Manu Anthony misses. Rebound secured by Kyrie Middleton.

[05:58] Team_017 possession (Score: 39-44)
Kyrie Middleton drives, picks up Scottie Gasol. Help arrives from Michael Simmons! Kyrie Middleton attempts a Dunk. Contested by Michael Simmons (4.3 feet, ZONE). Kyrie Middleton misses. Offensive rebound by Kyrie Middleton! Kyrie Middleton kicks it out.

[05:41] Team_017 possession (Score: 39-44)
Kyrie Middleton drives and kicks out. Kyrie Middleton attempts a 3Pt. Contested by Scottie Gasol (4.2 feet, ZONE). Kyrie Middleton misses. Rebound secured by Trae Turner.

[05:26] Team_015 possession (Score: 39-44)
CJ Banchero makes the Layup and draws the foul on Tony Smith! And-1! CJ Banchero to the line for 1. [Team fouls: 4] (Tony Smith: 2 personal fouls)   FT 1/1: GOOD CJ Banchero makes 1/1 from the line.
Score: 39-47

[05:16] Team_017 possession (Score: 39-47)
Bam Williamson makes the Layup and draws the foul on Michael Simmons! And-1! Bam Williamson to the line for 1. [Team fouls: 3] (Michael Simmons: 3 personal fouls)   FT 1/1: GOOD Bam Williamson makes 1/1 from the line.
Score: 42-47

[05:02] Team_015 possession (Score: 42-47)
CJ Banchero attempts a Midrange. Contested by Tony Smith (4.0 feet, MAN). CJ Banchero misses. Rebound secured by Tony Smith.

[04:47] Team_017 possession (Score: 42-47)
Vince Banchero attempts a 3Pt. Contested by Michael Simmons (4.7 feet, MAN). VINCE BANCHERO MAKES IT! Assist: Bam Williamson
Score: 45-47

[04:32] Team_015 possession (Score: 45-47)
Michael Simmons attempts a Midrange. Wide open! Kyrie Middleton is 6.1 feet away. [ZONE] MICHAEL SIMMONS MAKES IT!
Score: 45-49

[04:20] Team_017 possession (Score: 45-49)
Vince Banchero attempts a 3Pt. Contested by Michael Simmons (4.8 feet, MAN). Vince Banchero misses. Rebound secured by Scottie Gasol.

[04:08] Team_015 possession (Score: 45-49)
Manu Anthony attempts a Midrange. Contested by Desmond Reaves (5.0 feet, MAN). MANU ANTHONY MAKES IT! Assist: Scottie Gasol
Score: 45-51

[03:56] Team_017 possession (Score: 45-51)
Vince Banchero attempts a Layup. Contested by Michael Simmons (4.9 feet, MAN). Vince Banchero misses. Rebound secured by Trae Turner.

[03:41] Team_015 possession (Score: 45-51)
Trae Turner drives, picks up Bam Williamson. Help arrives from Desmond Reaves! Trae Turner attempts a Dunk. Contested by Desmond Reaves (5.1 feet, MAN). Trae Turner misses. Offensive rebound by Trae Turner! Trae Turner kicks it out.

[03:27] Team_015 possession (Score: 45-51)
Michael Simmons attempts a 3Pt. Contested by Tony Smith (4.5 feet, ZONE). Michael Simmons misses. Rebound secured by Kyrie Middleton.

[03:14] Team_017 possession (Score: 45-51)
Vince Banchero drives, picks up Michael Simmons. Help arrives from CJ Banchero! Vince Banchero attempts a Dunk. Contested by CJ Banchero (5.0 feet, MAN). VINCE BANCHERO MAKES IT! Assist: Bam Williamson
Score: 47-51

[03:02] Team_015 possession (Score: 47-51)
Trae Turner attempts a Layup. Contested by Bam Williamson (5.2 feet, ZONE). TRAE TURNER MAKES IT! Assist: Manu Anthony
Score: 47-53

[02:48] Team_017 possession (Score: 47-53)
FOUL! Shooting foul on Manu Anthony. Desmond Reaves to the line for 3 free throws. [Team fouls: 4] (Manu Anthony: 1 personal fouls)   FT 1/3: MISS   FT 2/3: MISS   FT 3/3: GOOD Desmond Reaves makes 1/3 from the line.
Score: 48-53

[02:36] Team_015 possession (Score: 48-53)
FOUL! Shooting foul on Bam Williamson. Trae Turner to the line for 2 free throws. [BONUS: 5 team fouls] (Bam Williamson: 2 personal fouls)   FT 1/2: GOOD   FT 2/2: GOOD Trae Turner makes 2/2 from the line.
Score: 48-55

[02:23] Team_017 possession (Score: 48-55)
Bam Williamson attempts a Midrange. Contested by Trae Turner (5.5 feet, MAN). BAM WILLIAMSON MAKES IT!
Score: 50-55

[02:08] Team_015 possession (Score: 50-55)
Manu Anthony attempts a 3Pt. Contested by Desmond Reaves (5.3 feet, ZONE). MANU ANTHONY MAKES IT! Assist: Scottie Gasol
Score: 50-58

[01:54] Team_017 possession (Score: 50-58)
Kyrie Middleton attempts a 3Pt. Contested by Manu Anthony (5.7 feet, ZONE). KYRIE MIDDLETON MAKES IT! Assist: Vince Banchero
Score: 53-58

[01:37] Team_015 possession (Score: 53-58)
Trae Turner drives and kicks out. Scottie Gasol attempts a 3Pt. Contested by Desmond Reaves (5.5 feet, ZONE). Scottie Gasol misses. Offensive rebound by Trae Turner! Trae Turner kicks it out.

[01:25] Team_015 possession (Score: 53-58)
Scottie Gasol attempts a 3Pt. Wide open! Kyrie Middleton is 6.7 feet away. [MAN] Scottie Gasol misses. Rebound secured by Tony Smith.

[01:11] Team_017 possession (Score: 53-58)
Desmond Reaves loses the ball! Stripped by Manu Anthony! TURNOVER! (live ball)

[00:56] Team_015 possession (Score: 53-58)
FOUL! Reach-in foul on Bam Williamson during the drive. [IN THE BONUS! 6 team fouls] Trae Turner to the line for 2 free throws. (Bam Williamson: 3 personal fouls)   FT 1/2: GOOD   FT 2/2: GOOD Trae Turner makes 2/2 from the line.
Score: 53-60

[00:43] Team_017 possession (Score: 53-60)
Tony Smith drives to the basket... Tony Smith commits a violation (traveling/carry)! TURNOVER! (dead ball)

[00:43] Substitution (Team_017): Desmond Reaves OUT → Blake Reaves IN (stamina_rule2)

[00:43] Substitution (Team_017): Vince Banchero OUT → Tobias Bridges IN (stamina_rule2)

[00:43] Substitution (Team_017): Tony Smith OUT → Shaquille Stewart IN (stamina_rule2)

[00:43] Substitution (Team_017): Kyrie Middleton OUT → Ja Stewart IN (stamina_rule2)

[00:43] Substitution (Team_017): Bam Williamson OUT → Klay Holiday IN (stamina_rule2)

[00:43] Substitution (Team_015): Manu Anthony OUT → Dwyane Sabonis IN (stamina_rule2)

[00:43] Substitution (Team_015): Michael Simmons OUT → Paolo Jokic IN (stamina_rule2)

[00:43] Substitution (Team_015): CJ Banchero OUT → Magic Wagner IN (stamina_rule2)

[00:43] Substitution (Team_015): Scottie Gasol OUT → Rudy Paul IN (stamina_rule2)

[00:43] Substitution (Team_015): Trae Turner OUT → Allen Curry IN (stamina_rule2)

[00:31] Team_015 possession (Score: 53-60)
Dwyane Sabonis attempts a 3Pt. Contested by Tobias Bridges (4.2 feet, ZONE). Dwyane Sabonis misses. Rebound secured by Shaquille Stewart.

[00:15] Team_017 possession (Score: 53-60)
Tobias Bridges drives and kicks out. Blake Reaves attempts a 3Pt. Contested by Rudy Paul (3.2 feet, ZONE). Blake Reaves misses. Rebound secured by Rudy Paul.

================================================================================
                              2ND QUARTER COMPLETE                              
================================================================================

2ND QUARTER SCORE: Team_017 18, Team_015 32

BOX SCORE:
================================================================================

Team_017
--------------------------------------------------------------------------------
Player                MIN  PTS  REB  AST  TO      FG   FG%      3P   3P%
--------------------------------------------------------------------------------
Vince Banchero         24    7    0    1   0   3/8    37.5     0/0   0.0
Bam Williamson         21    7    1    2   0   3/4    75.0     0/0   0.0
Kyrie Middleton        24    3    6    0   0   1/2    50.0     0/0   0.0
Desmond Reaves         21    1    0    0   0   1/3    33.3     0/0   0.0
Tony Smith             24    0    2    1   0   0/1     0.0     0/0   0.0
Shaquille Stewart       1    0    1    0   0   0/0     0.0     0/0   0.0
Tobias Bridges          1    0    0    0   0   0/1     0.0     0/0   0.0

TEAM: FG: 8/19 (42.1%), 3PT: 4/10 (40.0%), REB: 10 (2 off, 8 def), AST: 4, TO: 4
TEAM FOULS: 6 [Team_015 in BONUS]


Team_015
--------------------------------------------------------------------------------
Player                MIN  PTS  REB  AST  TO      FG   FG%      3P   3P%
--------------------------------------------------------------------------------
Trae Turner            21    8    9    2   0   4/4   100.0     0/0   0.0
CJ Banchero            24    8    0    0   0   3/6    50.0     0/0   0.0
Michael Simmons        24    7    0    0   0   3/5    60.0     0/0   0.0
Manu Anthony           24    7    0    1   0   3/4    75.0     0/0   0.0
Scottie Gasol          21    0    4    4   0   0/1     0.0     0/0   0.0
Dwyane Sabonis          1    0    0    0   0   0/1     0.0     0/0   0.0
Rudy Paul               3    0    1    0   0   0/0     0.0     0/0   0.0

TEAM: FG: 13/21 (61.9%), 3PT: 3/8 (37.5%), REB: 14 (4 off, 10 def), AST: 7, TO: 1
TEAM FOULS: 4

================================================================================

================================================================================
                       3RD QUARTER - Team_017 vs Team_015                       
================================================================================

[12:00] Team_017 possession (Score: 53-60)
Tony Smith attempts a Midrange. Contested by CJ Banchero (4.8 feet, MAN). Tony Smith misses. Offensive rebound by Bam Williamson! Bam Williamson puts it back in!
Score: 55-60

[11:44] Team_015 possession (Score: 55-60)
FOUL! Offensive foul on Trae Turner! Bam Williamson drew the charge! [Team fouls: 1] (Trae Turner: 1 personal fouls) TURNOVER! (dead ball)

[11:27] Team_017 possession (Score: 55-60)
Bam Williamson attempts a Midrange. Contested by Trae Turner (4.3 feet, MAN). BAM WILLIAMSON MAKES IT! Assist: Desmond Reaves
Score: 57-60

[11:11] Team_015 possession (Score: 57-60)
Trae Turner attempts a Layup. Contested by Bam Williamson (4.2 feet, MAN). Trae Turner misses. Offensive rebound by CJ Banchero! CJ Banchero's putback is no good. Rebound secured by Kyrie Middleton.

[11:01] Team_017 possession (Score: 57-60)
Vince Banchero attempts a Layup. Contested by Michael Simmons (3.3 feet, MAN). Vince Banchero misses. Offensive rebound by Kyrie Middleton! Kyrie Middleton kicks it out.

[10:49] Team_017 possession (Score: 57-60)
Vince Banchero drives and kicks out. Tony Smith attempts a Midrange. Contested by CJ Banchero (4.2 feet, ZONE). Tony Smith misses. Rebound secured by Trae Turner.

[10:38] Team_015 possession (Score: 57-60)
Scottie Gasol attempts a 3Pt. Contested by Desmond Reaves (4.1 feet, ZONE). SCOTTIE GASOL MAKES IT! Assist: Manu Anthony
Score: 57-63

[10:21] Team_017 possession (Score: 57-63)
Desmond Reaves attempts a Midrange. Contested by Manu Anthony (4.1 feet, MAN). Desmond Reaves misses. Offensive rebound by Bam Williamson! Bam Williamson's putback is no good. Rebound secured by Michael Simmons.

[10:12] Team_015 possession (Score: 57-63)
Trae Turner attempts a Midrange. Contested by Bam Williamson (4.2 feet, MAN). Trae Turner misses. Rebound secured by Tony Smith.

[09:56] Team_017 possession (Score: 57-63)
Bam Williamson attempts a Layup. Contested by Trae Turner (4.3 feet, MAN). BAM WILLIAMSON MAKES IT! Assist: Vince Banchero
Score: 59-63

[09:40] Team_015 possession (Score: 59-63)
CJ Banchero attempts a 3Pt. Contested by Tony Smith (2.6 feet, MAN). CJ Banchero misses. Rebound secured by Tony Smith.

[09:27] Team_017 possession (Score: 59-63)
Vince Banchero drives to the basket... FOUL! Offensive foul on Vince Banchero! Michael Simmons drew the charge! [Team fouls: 1] (Vince Banchero: 1 personal fouls) TURNOVER! (dead ball)

[09:11] Team_015 possession (Score: 59-63)
Michael Simmons makes the 3Pt and draws the foul on Desmond Reaves! And-1! Michael Simmons to the line for 1. [Team fouls: 2] (Desmond Reaves: 1 personal fouls)   FT 1/1: GOOD Michael Simmons makes 1/1 from the line.
Score: 59-67

[09:00] Team_017 possession (Score: 59-67)
Tony Smith attempts a Midrange. Contested by CJ Banchero (4.8 feet, MAN). Tony Smith misses. Offensive rebound by Bam Williamson! Bam Williamson puts it back in!
Score: 61-67

[08:47] Team_015 possession (Score: 61-67)
CJ Banchero makes the 3Pt and draws the foul on Desmond Reaves! And-1! CJ Banchero to the line for 1. [Team fouls: 3] (Desmond Reaves: 2 personal fouls)   FT 1/1: GOOD CJ Banchero makes 1/1 from the line.
Score: 61-71

[08:34] Team_017 possession (Score: 61-71)
Tony Smith drives and kicks out. Tony Smith attempts a 3Pt. Contested by CJ Banchero (4.2 feet, MAN). Tony Smith misses. Rebound secured by Michael Simmons.

[08:17] Team_015 possession (Score: 61-71)
CJ Banchero attempts a Midrange. Contested by Tony Smith (2.6 feet, MAN). CJ BANCHERO MAKES IT!
Score: 61-73

[08:05] Team_017 possession (Score: 61-73)
Kyrie Middleton drives, picks up Scottie Gasol. Help arrives from Michael Simmons! Kyrie Middleton attempts a Dunk. Contested by Michael Simmons (3.8 feet, MAN). KYRIE MIDDLETON MAKES IT!
Score: 63-73

[07:48] Team_015 possession (Score: 63-73)
CJ Banchero drives and kicks out. CJ Banchero attempts a 3Pt. Contested by Tony Smith (2.7 feet, MAN). CJ Banchero misses. Rebound secured by Bam Williamson.

[07:33] Team_017 possession (Score: 63-73)
Desmond Reaves attempts a Layup. Contested by Manu Anthony (4.1 feet, MAN). DESMOND REAVES MAKES IT!
Score: 65-73

[07:20] Team_015 possession (Score: 65-73)
Manu Anthony attempts a Layup. BLOCKED BY BAM WILLIAMSON! Ball is loose! Rebound secured by Tony Smith.

[07:06] Team_017 possession (Score: 65-73)
Bam Williamson drives, Trae Turner stays with him. Bam Williamson attempts a Layup. Contested by Trae Turner (4.3 feet, MAN). Bam Williamson misses. Rebound secured by Michael Simmons.

[06:47] Team_015 possession (Score: 65-73)
FOUL! Holding foul on Kyrie Middleton. [Team fouls: 4] No free throws, side out. (Kyrie Middleton: 1 personal fouls)

[06:37] Team_015 possession (Score: 65-73)
FOUL! Holding foul on Kyrie Middleton. [IN THE BONUS! 5 team fouls] Scottie Gasol to the line for 2 free throws. (Kyrie Middleton: 2 personal fouls)   FT 1/2: GOOD   FT 2/2: GOOD Scottie Gasol makes 2/2 from the line.
Score: 65-75

[06:18] Team_017 possession (Score: 65-75)
Kyrie Middleton drives, Scottie Gasol stays with him. Kyrie Middleton attempts a Dunk. Contested by Scottie Gasol (3.8 feet, MAN). KYRIE MIDDLETON MAKES IT! Assist: Vince Banchero
Score: 67-75

[06:00] Team_015 possession (Score: 67-75)
FOUL! Reach-in foul on Bam Williamson during the drive. [IN THE BONUS! 6 team fouls] CJ Banchero to the line for 2 free throws. (Bam Williamson: 1 personal fouls)   FT 1/2: MISS   FT 2/2: GOOD CJ Banchero makes 1/2 from the line.
Score: 67-76

[05:50] Team_017 possession (Score: 67-76)
Vince Banchero drives and kicks out. Kyrie Middleton attempts a 3Pt. Contested by Manu Anthony (3.6 feet, ZONE). Kyrie Middleton misses. Offensive rebound by Bam Williamson! Bam Williamson puts it back in!
Score: 69-76

[05:39] Team_015 possession (Score: 69-76)
Manu Anthony attempts a 3Pt. Contested by Desmond Reaves (4.3 feet, MAN). MANU ANTHONY MAKES IT! Assist: Trae Turner
Score: 69-79

[05:23] Team_017 possession (Score: 69-79)
Desmond Reaves attempts a 3Pt. Contested by Manu Anthony (4.1 feet, MAN). Desmond Reaves misses. Offensive rebound by Kyrie Middleton! Kyrie Middleton kicks it out.

[05:09] Team_017 possession (Score: 69-79)
Bam Williamson drives to the basket... FOUL! Offensive foul on Bam Williamson! Scottie Gasol drew the charge! [Team fouls: 7] (Bam Williamson: 2 personal fouls) TURNOVER! (dead ball)

[04:53] Team_015 possession (Score: 69-79)
Michael Simmons attempts a 3Pt. Contested by Tony Smith (2.8 feet, ZONE). Michael Simmons misses. Offensive rebound by Trae Turner! Trae Turner puts it back in!
Score: 69-81

[04:38] Team_017 possession (Score: 69-81)
Vince Banchero attempts a 3Pt. Contested by Scottie Gasol (3.5 feet, ZONE). Vince Banchero misses. Offensive rebound by Kyrie Middleton! Kyrie Middleton kicks it out.

[04:27] Team_017 possession (Score: 69-81)
Kyrie Middleton attempts a Midrange. Contested by Scottie Gasol (3.9 feet, ZONE). Kyrie Middleton misses. Rebound secured by CJ Banchero.

[04:15] Team_015 possession (Score: 69-81)
Trae Turner makes the Layup and draws the foul on Kyrie Middleton! And-1! Trae Turner to the line for 1. [BONUS: 8 team fouls] (Kyrie Middleton: 3 personal fouls)   FT 1/1: GOOD Trae Turner makes 1/1 from the line.
Score: 69-84

[04:03] Team_017 possession (Score: 69-84)
Desmond Reaves attempts a 3Pt. Contested by Manu Anthony (4.2 feet, MAN). Desmond Reaves misses. Rebound secured by Michael Simmons.

[03:46] Team_015 possession (Score: 69-84)
CJ Banchero attempts a 3Pt. Contested by Kyrie Middleton (5.0 feet, ZONE). CJ BANCHERO MAKES IT! Assist: Manu Anthony
Score: 69-87

[03:37] Team_017 possession (Score: 69-87)
Desmond Reaves drives and kicks out. Tony Smith attempts a 3Pt. Contested by CJ Banchero (4.4 feet, MAN). Tony Smith misses. Rebound secured by Trae Turner.

[03:27] Team_015 possession (Score: 69-87)
Michael Simmons attempts a 3Pt. Contested by Tony Smith (3.0 feet, ZONE). Michael Simmons misses. Rebound secured by Tony Smith.

[03:13] Team_017 possession (Score: 69-87)
Kyrie Middleton attempts a Layup. BLOCKED BY MICHAEL SIMMONS! Ball deflects out of bounds off Kyrie Middleton.

[02:57] Team_015 possession (Score: 69-87)
Trae Turner attempts a Midrange. Contested by Bam Williamson (4.5 feet, MAN). Trae Turner misses. Rebound secured by Bam Williamson.

[02:43] Team_017 possession (Score: 69-87)
Kyrie Middleton attempts a Midrange. Contested by Scottie Gasol (4.1 feet, MAN). Kyrie Middleton misses. Offensive rebound by Kyrie Middleton! Kyrie Middleton kicks it out.

[02:31] Team_017 possession (Score: 69-87)
Bam Williamson attempts a Midrange. Contested by Trae Turner (4.7 feet, MAN). Bam Williamson misses. Offensive rebound by Kyrie Middleton! Kyrie Middleton kicks it out.

[02:18] Team_017 possession (Score: 69-87)
Desmond Reaves attempts a 3Pt. Contested by Manu Anthony (4.4 feet, MAN). Desmond Reaves misses. Rebound secured by CJ Banchero.

[02:04] Team_015 possession (Score: 69-87)
Trae Turner attempts a Layup. Contested by Bam Williamson (4.6 feet, MAN). TRAE TURNER MAKES IT! Assist: Manu Anthony
Score: 69-89

[01:52] Team_017 possession (Score: 69-89)
Tony Smith drives and kicks out. Kyrie Middleton attempts a 3Pt. Contested by Manu Anthony (4.0 feet, ZONE). KYRIE MIDDLETON MAKES IT! Assist: Tony Smith
Score: 72-89

[01:41] Team_015 possession (Score: 72-89)
Trae Turner attempts a Layup. Contested by Bam Williamson (4.6 feet, MAN). TRAE TURNER MAKES IT! Assist: Scottie Gasol
Score: 72-91

[01:27] Team_017 possession (Score: 72-91)
Desmond Reaves attempts a Midrange. Contested by Scottie Gasol (4.3 feet, ZONE). Desmond Reaves misses. Rebound secured by Trae Turner.

[01:08] Team_015 possession (Score: 72-91)
Trae Turner drives, Bam Williamson stays with him. Trae Turner attempts a Layup. Contested by Bam Williamson (4.7 feet, ZONE). TRAE TURNER MAKES IT! Assist: CJ Banchero
Score: 72-93

[00:54] Team_017 possession (Score: 72-93)
Kyrie Middleton attempts a Layup. Contested by Scottie Gasol (4.3 feet, MAN). KYRIE MIDDLETON MAKES IT!
Score: 74-93

[00:39] Team_015 possession (Score: 74-93)
Trae Turner drives, Bam Williamson stays with him. Trae Turner attempts a Layup. Contested by Bam Williamson (4.7 feet, ZONE). TRAE TURNER MAKES IT! Assist: CJ Banchero
Score: 74-95

[00:23] Team_017 possession (Score: 74-95)
Desmond Reaves drives to the basket... Desmond Reaves throws a bad pass out of bounds! TURNOVER! (dead ball)

[00:23] Substitution (Team_017): Desmond Reaves OUT → Blake Reaves IN (stamina_rule2)

[00:23] Substitution (Team_017): Vince Banchero OUT → Tobias Bridges IN (stamina_rule2)

[00:23] Substitution (Team_017): Tony Smith OUT → Shaquille Stewart IN (stamina_rule2)

[00:23] Substitution (Team_017): Kyrie Middleton OUT → Ja Stewart IN (stamina_rule2)

[00:23] Substitution (Team_017): Bam Williamson OUT → Klay Holiday IN (stamina_rule2)

[00:23] Substitution (Team_015): Manu Anthony OUT → Dwyane Sabonis IN (stamina_rule2)

[00:23] Substitution (Team_015): Michael Simmons OUT → Paolo Jokic IN (stamina_rule2)

[00:23] Substitution (Team_015): CJ Banchero OUT → Magic Wagner IN (stamina_rule2)

[00:23] Substitution (Team_015): Scottie Gasol OUT → Rudy Paul IN (stamina_rule2)

[00:23] Substitution (Team_015): Trae Turner OUT → Allen Curry IN (stamina_rule2)

[00:09] Team_015 possession (Score: 74-95)
FOUL! Shooting foul on Klay Holiday. Allen Curry to the line for 3 free throws. [BONUS: 9 team fouls] (Klay Holiday: 1 personal fouls)   FT 1/3: MISS   FT 2/3: GOOD   FT 3/3: GOOD Allen Curry makes 2/3 from the line.
Score: 74-97

================================================================================
                              3RD QUARTER COMPLETE                              
================================================================================

3RD QUARTER SCORE: Team_017 21, Team_015 37

BOX SCORE:
================================================================================

Team_017
--------------------------------------------------------------------------------
Player                MIN  PTS  REB  AST  TO      FG   FG%      3P   3P%
--------------------------------------------------------------------------------
Bam Williamson         33   10    5    0   0   5/6    83.3     0/0   0.0
Kyrie Middleton        36    9    6    0   0   4/6    66.7     0/0   0.0
Desmond Reaves         33    2    0    1   0   1/6    16.7     0/0   0.0
Vince Banchero         36    0    0    2   0   0/1     0.0     0/0   0.0
Tony Smith             36    0    4    1   0   0/1     0.0     0/0   0.0

TEAM: FG: 10/20 (50.0%), 3PT: 0/2 (0.0%), REB: 15 (9 off, 6 def), AST: 4, TO: 3
TEAM FOULS: 9 [Team_015 in BONUS]


Team_015
--------------------------------------------------------------------------------
Player                MIN  PTS  REB  AST  TO      FG   FG%      3P   3P%
--------------------------------------------------------------------------------
Trae Turner            33   13    4    1   0   6/9    66.7     0/0   0.0
CJ Banchero            36   10    2    2   0   4/6    66.7     0/0   0.0
Scottie Gasol          33    5    0    1   0   2/2   100.0     0/0   0.0
Michael Simmons        36    4    4    0   0   1/2    50.0     0/0   0.0
Manu Anthony           36    3    0    3   0   1/2    50.0     0/0   0.0
Allen Curry             4    2    0    0   0   1/1   100.0     0/0   0.0

TEAM: FG: 15/22 (68.2%), 3PT: 7/9 (77.8%), REB: 10 (2 off, 8 def), AST: 7, TO: 1
TEAM FOULS: 1

================================================================================

================================================================================
                       4TH QUARTER - Team_017 vs Team_015                       
================================================================================

[12:00] Substitution (Team_017): Desmond Reaves OUT (stamina: 68) → Blake Reaves IN (comeback_detected)

[12:00] Substitution (Team_015): Manu Anthony OUT (stamina: 70) → Dwyane Sabonis IN (comeback_detected)

[12:00] Substitution (Team_017): Vince Banchero OUT → Tobias Bridges IN (stamina_rule2)

[12:00] Substitution (Team_017): Tony Smith OUT → Shaquille Stewart IN (stamina_rule2)

[12:00] Substitution (Team_017): Kyrie Middleton OUT → Ja Stewart IN (stamina_rule2)

[12:00] Substitution (Team_017): Bam Williamson OUT → Klay Holiday IN (stamina_rule2)

[12:00] Substitution (Team_015): Michael Simmons OUT → Paolo Jokic IN (stamina_rule2)

[12:00] Substitution (Team_015): CJ Banchero OUT → Magic Wagner IN (stamina_rule2)

[12:00] Substitution (Team_015): Scottie Gasol OUT → Rudy Paul IN (stamina_rule2)

[12:00] Substitution (Team_015): Trae Turner OUT → Allen Curry IN (stamina_rule2)

[12:00] Team_017 possession (Score: 74-97)
Vince Banchero drives to the basket... Vince Banchero loses control! Ball rolls out of bounds! TURNOVER! (dead ball)

[11:42] Team_015 possession (Score: 74-97)
Paolo Jokic makes the Layup and draws the foul on Tobias Bridges! And-1! Paolo Jokic to the line for 1. [Team fouls: 1] (Tobias Bridges: 1 personal fouls)   FT 1/1: MISS Paolo Jokic makes 0/1 from the line. Rebound secured by Shaquille Stewart.
Score: 74-99

[11:27] Team_017 possession (Score: 74-99)
Klay Holiday makes the Layup and draws the foul on Rudy Paul! And-1! Klay Holiday to the line for 1. [Team fouls: 1] (Rudy Paul: 1 personal fouls)   FT 1/1: GOOD Klay Holiday makes 1/1 from the line.
Score: 77-99

[11:12] Team_015 possession (Score: 77-99)
FOUL! Shooting foul on Shaquille Stewart. Magic Wagner to the line for 2 free throws. [Team fouls: 2] (Shaquille Stewart: 1 personal fouls)   FT 1/2: GOOD   FT 2/2: GOOD Magic Wagner makes 2/2 from the line.
Score: 77-101

[10:56] Team_017 possession (Score: 77-101)
FOUL! Reach-in foul on Rudy Paul during the drive. [Team fouls: 2] No free throws, side out. (Rudy Paul: 2 personal fouls)

[10:42] Team_017 possession (Score: 77-101)
Shaquille Stewart attempts a 3Pt. Contested by Rudy Paul (3.6 feet, ZONE). Shaquille Stewart misses. Offensive rebound by Ja Stewart! Ja Stewart kicks it out.

[10:30] Team_017 possession (Score: 77-101)
Klay Holiday attempts a Layup. Contested by Rudy Paul (3.5 feet, MAN). KLAY HOLIDAY MAKES IT! Assist: Tobias Bridges
Score: 79-101

[10:15] Team_015 possession (Score: 79-101)
Rudy Paul attempts a Midrange. Contested by Ja Stewart (5.2 feet, ZONE). Rudy Paul misses. Rebound secured by Klay Holiday.

[10:03] Team_017 possession (Score: 79-101)
Ja Stewart attempts a Midrange. Contested by Rudy Paul (2.9 feet, MAN). Ja Stewart misses. Rebound secured by Magic Wagner.

[09:53] Team_015 possession (Score: 79-101)
Dwyane Sabonis attempts a 3Pt. Contested by Tobias Bridges (4.2 feet, ZONE). DWYANE SABONIS MAKES IT! Assist: Allen Curry
Score: 79-104

[09:38] Team_017 possession (Score: 79-104)
Ja Stewart attempts a Layup. Contested by Rudy Paul (2.9 feet, MAN). Ja Stewart misses. Rebound secured by Magic Wagner.

[09:21] Team_015 possession (Score: 79-104)
Magic Wagner attempts a 3Pt. Contested by Tobias Bridges (4.0 feet, ZONE). MAGIC WAGNER MAKES IT! Assist: Rudy Paul
Score: 79-107

[09:08] Team_017 possession (Score: 79-107)
Tobias Bridges drives, picks up Paolo Jokic. Help arrives from Dwyane Sabonis! Tobias Bridges attempts a Dunk. Contested by Dwyane Sabonis (5.7 feet, MAN). TOBIAS BRIDGES MAKES IT!
Score: 81-107

[08:57] Team_015 possession (Score: 81-107)
Allen Curry attempts a Layup. Contested by Ja Stewart (5.1 feet, ZONE). Allen Curry misses. Rebound secured by Klay Holiday.

[08:44] Team_017 possession (Score: 81-107)
Shaquille Stewart attempts a Midrange. Wide open! Paolo Jokic is 6.0 feet away. [ZONE] Shaquille Stewart misses. Rebound secured by Magic Wagner.

[08:26] Team_015 possession (Score: 81-107)
Magic Wagner attempts a 3Pt. Contested by Blake Reaves (5.2 feet, ZONE). Magic Wagner misses. Rebound secured by Shaquille Stewart.

[08:13] Team_017 possession (Score: 81-107)
Shaquille Stewart attempts a 3Pt. Contested by Rudy Paul (3.6 feet, ZONE). Shaquille Stewart misses. Offensive rebound by Ja Stewart! Ja Stewart kicks it out.

[07:59] Team_017 possession (Score: 81-107)
Ja Stewart drives, Rudy Paul stays with him. Ja Stewart attempts a Dunk. Contested by Rudy Paul (2.9 feet, MAN). Ja Stewart misses. Rebound secured by Rudy Paul.

[07:46] Team_015 possession (Score: 81-107)
Paolo Jokic attempts a 3Pt. Contested by Tobias Bridges (4.6 feet, MAN). Paolo Jokic misses. Rebound secured by Ja Stewart.

[07:33] Team_017 possession (Score: 81-107)
Blake Reaves attempts a 3Pt. Contested by Rudy Paul (3.2 feet, ZONE). Blake Reaves misses. Rebound secured by Magic Wagner.

[07:16] Team_015 possession (Score: 81-107)
Paolo Jokic attempts a Midrange. Contested by Tobias Bridges (4.6 feet, MAN). PAOLO JOKIC MAKES IT!
Score: 81-109

[07:01] Team_017 possession (Score: 81-109)
Blake Reaves attempts a Midrange. Contested by Magic Wagner (5.3 feet, ZONE). BLAKE REAVES MAKES IT!
Score: 83-109

[06:50] Team_015 possession (Score: 83-109)
Paolo Jokic attempts a Midrange. Contested by Tobias Bridges (4.6 feet, MAN). Paolo Jokic misses. Rebound secured by Ja Stewart.

[06:39] Team_017 possession (Score: 83-109)
Klay Holiday attempts a 3Pt. Contested by Dwyane Sabonis (5.1 feet, ZONE). Klay Holiday misses. Offensive rebound by Ja Stewart! Ja Stewart kicks it out.

[06:22] Team_017 possession (Score: 83-109)
Shaquille Stewart attempts a 3Pt. Contested by Magic Wagner (5.7 feet, MAN). Shaquille Stewart misses. Rebound secured by Allen Curry.

[06:05] Team_015 possession (Score: 83-109)
Allen Curry throws a bad pass! Stolen by Klay Holiday! TURNOVER! (live ball)

[05:49] Team_017 possession (Score: 83-109)
Ja Stewart attempts a Midrange. Contested by Rudy Paul (2.9 feet, MAN). Ja Stewart misses. Rebound secured by Allen Curry.

[05:34] Team_015 possession (Score: 83-109)
FOUL! Shooting foul on Shaquille Stewart. Magic Wagner to the line for 3 free throws. [Team fouls: 3] (Shaquille Stewart: 2 personal fouls)   FT 1/3: GOOD   FT 2/3: GOOD   FT 3/3: GOOD Magic Wagner makes 3/3 from the line.
Score: 83-112

[05:19] Team_017 possession (Score: 83-112)
FOUL! Reach-in foul on Dwyane Sabonis during the drive. [Team fouls: 3] No free throws, side out. (Dwyane Sabonis: 1 personal fouls)

[05:04] Team_017 possession (Score: 83-112)
Ja Stewart attempts a Layup. Contested by Rudy Paul (2.9 feet, ZONE). Ja Stewart misses. Rebound secured by Allen Curry.

[04:50] Team_015 possession (Score: 83-112)
Dwyane Sabonis makes the Dunk and draws the foul on Tobias Bridges! And-1! Dwyane Sabonis to the line for 1. [Team fouls: 4] (Tobias Bridges: 2 personal fouls)   FT 1/1: GOOD Dwyane Sabonis makes 1/1 from the line.
Score: 83-115

[04:38] Team_017 possession (Score: 83-115)
Klay Holiday drives to the basket... Klay Holiday loses control! Ball rolls out of bounds! TURNOVER! (dead ball)

[04:24] Team_015 possession (Score: 83-115)
Magic Wagner drives, Shaquille Stewart stays with him. Magic Wagner attempts a Dunk. Contested by Shaquille Stewart (4.4 feet, MAN). MAGIC WAGNER MAKES IT! Assist: Rudy Paul
Score: 83-117

[04:08] Team_017 possession (Score: 83-117)
Ja Stewart attempts a 3Pt. Contested by Rudy Paul (3.0 feet, MAN). JA STEWART MAKES IT! Assist: Klay Holiday
Score: 86-117

[03:52] Team_015 possession (Score: 86-117)
FOUL! Holding foul on Tobias Bridges. [IN THE BONUS! 5 team fouls] Paolo Jokic to the line for 2 free throws. (Tobias Bridges: 3 personal fouls)   FT 1/2: GOOD   FT 2/2: MISS Paolo Jokic makes 1/2 from the line. Rebound secured by Shaquille Stewart.
Score: 86-118

[03:36] Team_017 possession (Score: 86-118)
Klay Holiday drives to the basket... Klay Holiday commits a violation (traveling/carry)! TURNOVER! (dead ball)

[03:22] Team_015 possession (Score: 86-118)
FOUL! Reach-in foul on Klay Holiday during the drive. [IN THE BONUS! 6 team fouls] Allen Curry to the line for 2 free throws. (Klay Holiday: 1 personal fouls)   FT 1/2: GOOD   FT 2/2: GOOD Allen Curry makes 2/2 from the line.
Score: 86-120

[03:12] Team_017 possession (Score: 86-120)
Blake Reaves attempts a Midrange. Contested by Rudy Paul (3.4 feet, ZONE). Blake Reaves misses. Rebound secured by Rudy Paul.

[02:59] Team_015 possession (Score: 86-120)
Rudy Paul attempts a Layup. Contested by Ja Stewart (5.4 feet, ZONE). RUDY PAUL MAKES IT!
Score: 86-122

[02:43] Team_017 possession (Score: 86-122)
Blake Reaves attempts a Layup. Contested by Rudy Paul (3.5 feet, ZONE). Blake Reaves misses. Rebound secured by Magic Wagner.

[02:33] Team_015 possession (Score: 86-122)
Magic Wagner attempts a 3Pt. Contested by Shaquille Stewart (4.6 feet, MAN). Magic Wagner misses. Rebound secured by Shaquille Stewart.

[02:16] Team_017 possession (Score: 86-122)
Tobias Bridges drives, Paolo Jokic stays with him. Tobias Bridges attempts a Layup. Contested by Paolo Jokic (5.9 feet, MAN). Tobias Bridges misses. Offensive rebound by Shaquille Stewart! Shaquille Stewart kicks it out.

[02:02] Team_017 possession (Score: 86-122)
Ja Stewart attempts a 3Pt. Contested by Rudy Paul (3.3 feet, MAN). Ja Stewart misses. Rebound secured by Allen Curry.

[01:44] Team_015 possession (Score: 86-122)
Magic Wagner attempts a Midrange. Contested by Shaquille Stewart (4.6 feet, ZONE). Magic Wagner misses. Rebound secured by Ja Stewart.

[01:34] Team_017 possession (Score: 86-122)
Tobias Bridges drives and kicks out. Ja Stewart attempts a 3Pt. Contested by Rudy Paul (3.7 feet, ZONE). Ja Stewart misses. Rebound secured by Allen Curry.

[01:21] Team_015 possession (Score: 86-122)
Rudy Paul attempts a 3Pt. Contested by Tobias Bridges (4.9 feet, ZONE). RUDY PAUL MAKES IT!
Score: 86-125

[01:05] Team_017 possession (Score: 86-125)
Klay Holiday drives and kicks out. Ja Stewart attempts a 3Pt. Contested by Rudy Paul (3.8 feet, MAN). Ja Stewart misses. Offensive rebound by Ja Stewart! Ja Stewart kicks it out.

[00:54] Team_017 possession (Score: 86-125)
Tobias Bridges drives to the basket... Tobias Bridges commits a violation (traveling/carry)! TURNOVER! (dead ball)

[00:41] Team_015 possession (Score: 86-125)
FOUL! Shooting foul on Klay Holiday. Allen Curry to the line for 2 free throws. [BONUS: 7 team fouls] (Klay Holiday: 2 personal fouls)   FT 1/2: GOOD   FT 2/2: GOOD Allen Curry makes 2/2 from the line.
Score: 86-127

[00:25] Team_017 possession (Score: 86-127)
Ja Stewart attempts a 3Pt. Contested by Rudy Paul (3.5 feet, ZONE). Ja Stewart misses. Rebound secured by Rudy Paul.

[00:06] Team_015 possession (Score: 86-127)
Rudy Paul attempts a 3Pt. Contested by Tobias Bridges (5.0 feet, ZONE). RUDY PAUL MAKES IT! Assist: Dwyane Sabonis
Score: 86-130

================================================================================
                              4TH QUARTER COMPLETE                              
================================================================================

4TH QUARTER SCORE: Team_017 12, Team_015 33

BOX SCORE:
================================================================================

Team_017
--------------------------------------------------------------------------------
Player                MIN  PTS  REB  AST  TO      FG   FG%      3P   3P%
--------------------------------------------------------------------------------
Klay Holiday           15    5    2    1   0   2/2   100.0     0/0   0.0
Ja Stewart             13    3    7    0   0   1/8    12.5     0/0   0.0
Tobias Bridges         13    2    0    1   0   1/2    50.0     0/0   0.0
Blake Reaves           16    2    0    0   0   1/4    25.0     0/0   0.0
Shaquille Stewart      13    0    5    0   0   0/2     0.0     0/0   0.0

TEAM: FG: 5/18 (27.8%), 3PT: 1/5 (20.0%), REB: 14 (5 off, 9 def), AST: 2, TO: 4
TEAM FOULS: 7 [Team_015 in BONUS]


Team_015
--------------------------------------------------------------------------------
Player                MIN  PTS  REB  AST  TO      FG   FG%      3P   3P%
--------------------------------------------------------------------------------
Magic Wagner           13   10    5    0   0   4/7    57.1     0/0   0.0
Rudy Paul              15    8    3    2   0   3/4    75.0     0/0   0.0
Dwyane Sabonis         13    6    0    1   0   2/2   100.0     0/0   0.0
Allen Curry            15    4    5    1   0   2/3    66.7     0/0   0.0
Paolo Jokic            13    2    0    0   0   1/4    25.0     0/0   0.0

TEAM: FG: 12/21 (57.1%), 3PT: 5/8 (62.5%), REB: 13 (0 off, 13 def), AST: 4, TO: 1
TEAM FOULS: 3

================================================================================

================================================================================
                               FULL GAME COMPLETE                               
================================================================================

FINAL SCORE: Team_017 86, Team_015 130

SCORING BY QUARTER:
--------------------------------------------------------------------------------
Team                     Q1     Q2     Q3     Q4    FINAL
--------------------------------------------------------------------------------
Team_017                 35     18     21     12       86
Team_015                 28     32     37     33      130
--------------------------------------------------------------------------------

FULL GAME BOX SCORE:
================================================================================

Team_017
--------------------------------------------------------------------------------
Player                MIN  PTS  REB  AST  TO      FG   FG%      3P   3P%      FT STL BLK
--------------------------------------------------------------------------------
Vince Banchero         36   14    0    4   1   7/15   46.7   1/5    20.0   1/1     0   0
Tony Smith             36    4    8    4   5   6/10   60.0   1/3    33.3   0/0     0   0
Kyrie Middleton        36   14   16    0   0   5/9    55.6   1/2    50.0   0/0     0   1
Bam Williamson         33   30   10    4   2  10/13   76.9   0/1     0.0   4/4     1   1
Desmond Reaves         33   12    0    2   3   4/12   33.3   2/7    28.6   3/5     0   0
Blake Reaves           16    2    0    0   2   1/5    20.0   0/2     0.0   0/0     0   0
Klay Holiday           15    5    2    1   1   2/2   100.0   0/0     0.0   1/1     1   0
Tobias Bridges         13    2    0    1   0   1/3    33.3   0/0     0.0   0/0     0   0
Shaquille Stewart      13    0    6    0   0   0/2     0.0   0/1     0.0   0/0     0   0
Ja Stewart             13    3    7    0   0   1/8    12.5   1/3    33.3   0/0     0   0

TEAM: FG: 37/79 (46.8%), 3PT: 6/24 (25.0%), REB: 48 (18 off, 30 def), AST: 16, TO: 14


Team_015
--------------------------------------------------------------------------------
Player                MIN  PTS  REB  AST  TO      FG   FG%      3P   3P%      FT STL BLK
--------------------------------------------------------------------------------
Michael Simmons        36   19    6    1   1   8/12   66.7   4/7    57.1   2/2     0   1
CJ Banchero            36   27    4    2   0  10/17   58.8   3/6    50.0   6/8     0   0
Manu Anthony           36   10    0    5   1   4/8    50.0   2/5    40.0   0/0     1   0
Scottie Gasol          33    8    4    5   3   2/5    40.0   1/2    50.0   3/3     0   1
Trae Turner            33   23   15    3   1  10/15   66.7   0/0     0.0   5/5     0   0
Rudy Paul              15   10    5    3   0   4/5    80.0   2/2   100.0   0/0     0   0
Allen Curry            15   10    6    1   1   4/5    80.0   1/1   100.0   8/9     0   0
Dwyane Sabonis         13    6    0    1   0   2/3    66.7   1/2    50.0   1/1     0   0
Paolo Jokic            13    2    0    0   0   1/4    25.0   0/1     0.0   1/3     0   0
Magic Wagner           13   10    5    0   0   4/7    57.1   2/4    50.0   5/5     0   0

TEAM: FG: 52/85 (61.2%), 3PT: 16/30 (53.3%), REB: 46 (7 off, 39 def), AST: 21, TO: 7

================================================================================
