================================================================================
                        FULL GAME - Team_068 vs Team_098                        
================================================================================

================================================================================
                       1ST QUARTER - Team_068 vs Team_098                       
================================================================================

[12:00] Team_068 possession (Score: 0-0)
Gary Simons drives, Pascal Lillard stays with him. Gary Simons attempts a Layup. Contested by Pascal Lillard (4.9 feet, ZONE). Gary Simons misses. Offensive rebound by Jaren Johnson! Jaren Johnson kicks it out.

[11:46] Team_068 possession (Score: 0-0)
FOUL! Shooting foul on Malcolm Tatum. Zion Anunoby to the line for 2 free throws. [Team fouls: 1] (Malcolm Tatum: 1 personal fouls)   FT 1/2: GOOD   FT 2/2: GOOD Zion Anunoby makes 2/2 from the line.
Score: 2-0

[11:29] Team_098 possession (Score: 2-0)
Malcolm Tatum drives and kicks out. Derrick Durant attempts a 3Pt. Contested by Nikola Ginobili (4.0 feet, MAN). Derrick Durant misses. Rebound secured by Jaren Johnson.

[11:12] Team_068 possession (Score: 2-0)
Malcolm Herro drives and kicks out. Malcolm Herro attempts a 3Pt. BLOCKED BY NIKOLA ROSE! Ball is loose! Rebound secured by Nikola Rose.

[10:59] Team_098 possession (Score: 2-0)
Blake Murray drives and kicks out. Derrick Durant attempts a Midrange. Contested by Nikola Ginobili (4.0 feet, MAN). DERRICK DURANT MAKES IT! Assist: Pascal Lillard
Score: 2-2

[10:47] Team_068 possession (Score: 2-2)
Zion Anunoby drives and kicks out. Nikola Ginobili attempts a 3Pt. Contested by Derrick Durant (4.3 feet, MAN). NIKOLA GINOBILI MAKES IT! Assist: Malcolm Herro
Score: 5-2

[10:35] Team_098 possession (Score: 5-2)
Nikola Rose attempts a Layup. BLOCKED BY GARY SIMONS! Ball deflects out of bounds off Nikola Rose.

[10:20] Team_068 possession (Score: 5-2)
Zion Anunoby attempts a 3Pt. Contested by Nikola Rose (3.6 feet, ZONE). Zion Anunoby misses. Rebound secured by Derrick Durant.

[10:06] Team_098 possession (Score: 5-2)
Malcolm Tatum attempts a 3Pt. Contested by Zion Anunoby (4.6 feet, MAN). MALCOLM TATUM MAKES IT! Assist: Derrick Durant
Score: 5-5

[09:54] Team_068 possession (Score: 5-5)
FOUL! Shooting foul on Nikola Rose. Malcolm Herro to the line for 3 free throws. [Team fouls: 2] (Nikola Rose: 1 personal fouls)   FT 1/3: GOOD   FT 2/3: MISS   FT 3/3: MISS Malcolm Herro makes 1/3 from the line. Rebound secured by Nikola Rose.
Score: 6-5

[09:36] Team_098 possession (Score: 6-5)
Pascal Lillard attempts a 3Pt. Contested by Zion Anunoby (5.0 feet, ZONE). PASCAL LILLARD MAKES IT! Assist: Malcolm Tatum
Score: 6-8

[09:23] Team_068 possession (Score: 6-8)
Nikola Ginobili attempts a Layup. Contested by Derrick Durant (4.4 feet, MAN). NIKOLA GINOBILI MAKES IT! Assist: Gary Simons
Score: 8-8

[09:06] Team_098 possession (Score: 8-8)
Malcolm Tatum attempts a Layup. Contested by Gary Simons (3.4 feet, ZONE). MALCOLM TATUM MAKES IT! Assist: Blake Murray
Score: 8-10

[08:52] Team_068 possession (Score: 8-10)
Zion Anunoby attempts a 3Pt. Contested by Malcolm Tatum (4.3 feet, MAN). Zion Anunoby misses. Rebound secured by Pascal Lillard.

[08:35] Team_098 possession (Score: 8-10)
Malcolm Tatum drives and kicks out. Blake Murray attempts a 3Pt. Contested by Jaren Johnson (3.6 feet, MAN). BLAKE MURRAY MAKES IT! Assist: Derrick Durant
Score: 8-13

[08:19] Team_068 possession (Score: 8-13)
FOUL! Shooting foul on Nikola Rose. Malcolm Herro to the line for 2 free throws. [Team fouls: 3] (Nikola Rose: 2 personal fouls)   FT 1/2: GOOD   FT 2/2: GOOD Malcolm Herro makes 2/2 from the line.
Score: 10-13

[08:03] Team_098 possession (Score: 10-13)
Derrick Durant makes the Midrange and draws the foul on Malcolm Herro! And-1! Derrick Durant to the line for 1. [Team fouls: 1] (Malcolm Herro: 1 personal fouls)   FT 1/1: GOOD Derrick Durant makes 1/1 from the line.
Score: 10-16

[07:45] Team_068 possession (Score: 10-16)
Malcolm Herro makes the Dunk and draws the foul on Blake Murray! And-1! Malcolm Herro to the line for 1. [Team fouls: 4] (Blake Murray: 1 personal fouls)   FT 1/1: GOOD Malcolm Herro makes 1/1 from the line.
Score: 13-16

[07:32] Team_098 possession (Score: 13-16)
Nikola Rose attempts a 3Pt. Contested by Zion Anunoby (4.7 feet, ZONE). NIKOLA ROSE MAKES IT! Assist: Pascal Lillard
Score: 13-19

[07:20] Team_068 possession (Score: 13-19)
Gary Simons attempts a 3Pt. Contested by Nikola Rose (4.0 feet, ZONE). Gary Simons misses. Rebound secured by Derrick Durant.

[07:02] Team_098 possession (Score: 13-19)
Pascal Lillard attempts a 3Pt. Contested by Zion Anunoby (5.0 feet, ZONE). PASCAL LILLARD MAKES IT! Assist: Derrick Durant
Score: 13-22

[06:51] Team_068 possession (Score: 13-22)
Malcolm Herro attempts a 3Pt. Contested by Nikola Rose (3.2 feet, ZONE). Malcolm Herro misses. Rebound secured by Derrick Durant.

[06:40] Team_098 possession (Score: 13-22)
FOUL! Shooting foul on Jaren Johnson. Derrick Durant to the line for 2 free throws. [Team fouls: 2] (Jaren Johnson: 1 personal fouls)   FT 1/2: GOOD   FT 2/2: MISS Derrick Durant makes 1/2 from the line. Rebound secured by Nikola Ginobili.
Score: 13-23

[06:24] Team_068 possession (Score: 13-23)
Zion Anunoby attempts a 3Pt. Contested by Malcolm Tatum (4.3 feet, MAN). ZION ANUNOBY MAKES IT! Assist: Malcolm Herro
Score: 16-23

[06:11] Team_098 possession (Score: 16-23)
Pascal Lillard attempts a Midrange. Contested by Gary Simons (3.7 feet, ZONE). PASCAL LILLARD MAKES IT! Assist: Nikola Rose
Score: 16-25

[05:56] Team_068 possession (Score: 16-25)
Malcolm Herro drives and kicks out. Malcolm Herro attempts a Midrange. Contested by Blake Murray (4.4 feet, ZONE). Malcolm Herro misses. Rebound secured by Nikola Rose.

[05:38] Team_098 possession (Score: 16-25)
Pascal Lillard makes the 3Pt and draws the foul on Zion Anunoby! And-1! Pascal Lillard to the line for 1. [Team fouls: 3] (Zion Anunoby: 1 personal fouls)   FT 1/1: GOOD Pascal Lillard makes 1/1 from the line.
Score: 16-29

[05:20] Team_068 possession (Score: 16-29)
FOUL! Reach-in foul on Blake Murray during the drive. [IN THE BONUS! 5 team fouls] Jaren Johnson to the line for 2 free throws. (Blake Murray: 2 personal fouls)   FT 1/2: MISS   FT 2/2: MISS Jaren Johnson makes 0/2 from the line. Offensive rebound by Jaren Johnson! Jaren Johnson kicks it out.

[05:03] Team_068 possession (Score: 16-29)
Zion Anunoby attempts a 3Pt. Contested by Malcolm Tatum (4.4 feet, MAN). Zion Anunoby misses. Rebound secured by Derrick Durant.

[04:48] Team_098 possession (Score: 16-29)
Pascal Lillard attempts a 3Pt. Contested by Zion Anunoby (5.0 feet, ZONE). Pascal Lillard misses. Rebound secured by Jaren Johnson.

[04:34] Team_068 possession (Score: 16-29)
Zion Anunoby drives, picks up Malcolm Tatum. Help arrives from Nikola Rose! Zion Anunoby attempts a Layup. Contested by Nikola Rose (4.4 feet, MAN). Zion Anunoby misses. Rebound secured by Nikola Rose.

[04:18] Team_098 possession (Score: 16-29)
Malcolm Tatum attempts a 3Pt. Contested by Zion Anunoby (4.6 feet, ZONE). Malcolm Tatum misses. Rebound secured by Gary Simons.

[04:02] Team_068 possession (Score: 16-29)
Nikola Ginobili drives, Derrick Durant stays with him. Nikola Ginobili attempts a Dunk. Contested by Derrick Durant (4.5 feet, MAN). NIKOLA GINOBILI MAKES IT!
Score: 18-29

[03:45] Team_098 possession (Score: 18-29)
Pascal Lillard attempts a 3Pt. Contested by Zion Anunoby (5.0 feet, ZONE). Pascal Lillard misses. Rebound secured by Gary Simons.

[03:26] Team_068 possession (Score: 18-29)
Jaren Johnson attempts a Midrange. Contested by Blake Murray (5.1 feet, MAN). Jaren Johnson misses. Offensive rebound by Nikola Ginobili! Nikola Ginobili puts it back in!
Score: 20-29

[03:11] Team_098 possession (Score: 20-29)
Nikola Rose drives, Malcolm Herro stays with him. Nikola Rose attempts a Dunk. Contested by Malcolm Herro (4.7 feet, MAN). NIKOLA ROSE MAKES IT! Assist: Derrick Durant
Score: 20-31

[02:53] Team_068 possession (Score: 20-31)
Gary Simons makes the 3Pt and draws the foul on Nikola Rose! And-1! Gary Simons to the line for 1. [BONUS: 6 team fouls] (Nikola Rose: 3 personal fouls)   FT 1/1: GOOD Gary Simons makes 1/1 from the line.
Score: 24-31

[02:38] Team_098 possession (Score: 24-31)
Derrick Durant attempts a Midrange. Contested by Gary Simons (3.6 feet, ZONE). Derrick Durant misses. FOUL! Loose ball foul on Nikola Ginobili during the rebound battle. [Team fouls: 4] No free throws, side out. (Nikola Ginobili: 1 personal fouls)

[02:21] Team_098 possession (Score: 24-31)
Derrick Durant attempts a Layup. Contested by Gary Simons (3.7 feet, ZONE). DERRICK DURANT MAKES IT! Assist: Nikola Rose
Score: 24-33

[02:07] Team_068 possession (Score: 24-33)
FOUL! Shooting foul on Pascal Lillard. Zion Anunoby to the line for 2 free throws. [BONUS: 7 team fouls] (Pascal Lillard: 1 personal fouls)   FT 1/2: GOOD   FT 2/2: MISS Zion Anunoby makes 1/2 from the line. Rebound secured by Derrick Durant.
Score: 25-33

[01:54] Team_098 possession (Score: 25-33)
Malcolm Tatum drives and kicks out. Derrick Durant attempts a Midrange. Contested by Malcolm Herro (4.5 feet, ZONE). DERRICK DURANT MAKES IT!
Score: 25-35

[01:44] Team_068 possession (Score: 25-35)
Jaren Johnson attempts a Layup. Contested by Blake Murray (5.2 feet, MAN). JAREN JOHNSON MAKES IT! Assist: Gary Simons
Score: 27-35

[01:28] Team_098 possession (Score: 27-35)
Pascal Lillard makes the Layup and draws the foul on Gary Simons! And-1! Pascal Lillard to the line for 1. [BONUS: 5 team fouls] (Gary Simons: 1 personal fouls)   FT 1/1: GOOD Pascal Lillard makes 1/1 from the line.
Score: 27-38

[01:13] Team_068 possession (Score: 27-38)
FOUL! Shooting foul on Nikola Rose. Jaren Johnson to the line for 3 free throws. [BONUS: 8 team fouls] (Nikola Rose: 4 personal fouls)   FT 1/3: GOOD   FT 2/3: GOOD   FT 3/3: GOOD Jaren Johnson makes 3/3 from the line.
Score: 30-38

[01:00] Team_098 possession (Score: 30-38)
Derrick Durant drives, Nikola Ginobili stays with him. Derrick Durant attempts a Layup. Contested by Nikola Ginobili (4.7 feet, MAN). Derrick Durant misses. Rebound secured by Gary Simons.

[00:45] Team_068 possession (Score: 30-38)
Malcolm Herro attempts a 3Pt. Contested by Nikola Rose (3.5 feet, ZONE). Malcolm Herro misses. Rebound secured by Pascal Lillard.

[00:30] Team_098 possession (Score: 30-38)
Pascal Lillard attempts a 3Pt. Contested by Zion Anunoby (5.3 feet, ZONE). Pascal Lillard misses. Rebound secured by Nikola Ginobili.

[00:15] Team_068 possession (Score: 30-38)
Malcolm Herro attempts a 3Pt. Contested by Nikola Rose (3.6 feet, ZONE). Malcolm Herro misses. Rebound secured by Derrick Durant.

================================================================================
                              1ST QUARTER COMPLETE                              
================================================================================

1ST QUARTER SCORE: Team_068 30, Team_098 38

BOX SCORE:
================================================================================

Team_068
--------------------------------------------------------------------------------
Player                MIN  PTS  REB  AST  TO      FG   FG%      3P   3P%
--------------------------------------------------------------------------------
Nikola Ginobili        12    9    3    0   0   4/4   100.0     0/0   0.0
Jaren Johnson          12    5    4    0   0   2/2   100.0     0/0   0.0
Zion Anunoby           12    5    0    0   0   2/7    28.6     0/0   0.0
Malcolm Herro          12    5    0    2   0   2/8    25.0     0/0   0.0
Gary Simons            12    4    3    2   0   1/2    50.0     0/0   0.0

TEAM: FG: 11/23 (47.8%), 3PT: 3/11 (27.3%), REB: 10 (3 off, 7 def), AST: 4, TO: 0
TEAM FOULS: 5 [Team_098 in BONUS]


Team_098
--------------------------------------------------------------------------------
Player                MIN  PTS  REB  AST  TO      FG   FG%      3P   3P%
--------------------------------------------------------------------------------
Pascal Lillard         12   15    2    2   0   5/8    62.5     0/0   0.0
Derrick Durant         12    9    7    4   0   4/6    66.7     0/0   0.0
Malcolm Tatum          12    5    0    1   0   2/4    50.0     0/0   0.0
Nikola Rose            12    5    4    2   0   2/3    66.7     0/0   0.0
Blake Murray           12    3    0    1   0   1/1   100.0     0/0   0.0

TEAM: FG: 14/22 (63.6%), 3PT: 5/9 (55.6%), REB: 13 (1 off, 12 def), AST: 10, TO: 0
TEAM FOULS: 8 [Team_068 in BONUS]

================================================================================

================================================================================
                       2ND QUARTER - Team_068 vs Team_098                       
================================================================================

[12:00] Team_068 possession (Score: 30-38)
Malcolm Herro attempts a 3Pt. Contested by Blake Murray (4.7 feet, ZONE). MALCOLM HERRO MAKES IT! Assist: Jaren Johnson
Score: 33-38

[11:50] Team_098 possession (Score: 33-38)
Blake Murray drives, Jaren Johnson stays with him. Blake Murray attempts a Dunk. Contested by Jaren Johnson (4.0 feet, MAN). Blake Murray misses. Rebound secured by Nikola Ginobili.

[11:35] Team_068 possession (Score: 33-38)
Jaren Johnson attempts a 3Pt. Contested by Blake Murray (5.3 feet, MAN). Jaren Johnson misses. Offensive rebound by Nikola Ginobili! Nikola Ginobili puts it back in!
Score: 35-38

[11:24] Team_098 possession (Score: 35-38)
Pascal Lillard drives to the basket... Pascal Lillard throws a bad pass out of bounds! TURNOVER! (dead ball)

[11:24] Substitution (Team_068): Zion Anunoby OUT → Cole Anthony IN (stamina_rule2)

[11:24] Substitution (Team_068): Malcolm Herro OUT → Ja Banchero IN (stamina_rule2)

[11:24] Substitution (Team_068): Jaren Johnson OUT → Miles Murray IN (stamina_rule2)

[11:24] Substitution (Team_068): Gary Simons OUT → Jarrett Oladipo IN (stamina_rule2)

[11:24] Substitution (Team_068): Nikola Ginobili OUT → Franz Curry IN (stamina_rule2)

[11:24] Substitution (Team_098): Malcolm Tatum OUT → Tracy Rose IN (stamina_rule2)

[11:24] Substitution (Team_098): Nikola Rose OUT → Dirk McCollum IN (stamina_rule2)

[11:24] Substitution (Team_098): Blake Murray OUT → Kristaps Iverson IN (stamina_rule2)

[11:24] Substitution (Team_098): Pascal Lillard OUT → Manu Jordan IN (stamina_rule2)

[11:24] Substitution (Team_098): Derrick Durant OUT → Russell McGrady IN (stamina_rule2)

[11:07] Team_068 possession (Score: 35-38)
Cole Anthony attempts a 3Pt. Contested by Tracy Rose (3.1 feet, MAN). COLE ANTHONY MAKES IT! Assist: Ja Banchero
Score: 38-38

[10:53] Team_098 possession (Score: 38-38)
Kristaps Iverson attempts a Layup. Contested by Franz Curry (4.5 feet, ZONE). KRISTAPS IVERSON MAKES IT! Assist: Russell McGrady
Score: 38-40

[10:43] Team_068 possession (Score: 38-40)
Ja Banchero attempts a 3Pt. Contested by Dirk McCollum (4.3 feet, MAN). JA BANCHERO MAKES IT! Assist: Jarrett Oladipo
Score: 41-40

[10:30] Team_098 possession (Score: 41-40)
Tracy Rose drives to the basket... Tracy Rose loses control! Ball rolls out of bounds! TURNOVER! (dead ball)

[10:20] Team_068 possession (Score: 41-40)
Ja Banchero attempts a 3Pt. Contested by Dirk McCollum (4.3 feet, MAN). JA BANCHERO MAKES IT! Assist: Franz Curry
Score: 44-40

[10:06] Team_098 possession (Score: 44-40)
Manu Jordan attempts a Midrange. Contested by Miles Murray (4.2 feet, ZONE). Manu Jordan misses. Rebound secured by Franz Curry.

[09:56] Team_068 possession (Score: 44-40)
Ja Banchero attempts a Midrange. Contested by Dirk McCollum (4.3 feet, MAN). JA BANCHERO MAKES IT!
Score: 46-40

[09:43] Team_098 possession (Score: 46-40)
Dirk McCollum attempts a 3Pt. Contested by Cole Anthony (4.9 feet, ZONE). DIRK MCCOLLUM MAKES IT!
Score: 46-43

[09:31] Team_068 possession (Score: 46-43)
FOUL! Holding foul on Kristaps Iverson. [Team fouls: 1] No free throws, side out. (Kristaps Iverson: 1 personal fouls)

[09:16] Team_068 possession (Score: 46-43)
Jarrett Oladipo attempts a 3Pt. Contested by Dirk McCollum (4.5 feet, ZONE). Jarrett Oladipo misses. Offensive rebound by Franz Curry! Franz Curry's putback is no good. Rebound secured by Russell McGrady.

[09:01] Team_098 possession (Score: 46-43)
Kristaps Iverson attempts a 3Pt. Contested by Ja Banchero (5.3 feet, ZONE). KRISTAPS IVERSON MAKES IT! Assist: Dirk McCollum
Score: 46-46

[08:49] Team_068 possession (Score: 46-46)
Ja Banchero attempts a 3Pt. Contested by Dirk McCollum (4.3 feet, ZONE). Ja Banchero misses. Rebound secured by Kristaps Iverson.

[08:34] Team_098 possession (Score: 46-46)
FOUL! Holding foul on Cole Anthony. [Team fouls: 1] No free throws, side out. (Cole Anthony: 1 personal fouls)

[08:20] Team_098 possession (Score: 46-46)
Russell McGrady attempts a Midrange. Contested by Franz Curry (4.2 feet, MAN). Russell McGrady misses. Rebound secured by Jarrett Oladipo.

[08:03] Team_068 possession (Score: 46-46)
Miles Murray throws a bad pass out of bounds! TURNOVER! (dead ball)

[07:47] Team_098 possession (Score: 46-46)
Kristaps Iverson drives, picks up Franz Curry. Help arrives from Ja Banchero! Kristaps Iverson attempts a Layup. Contested by Ja Banchero (4.5 feet, ZONE). Kristaps Iverson misses. Offensive rebound by Kristaps Iverson! Kristaps Iverson kicks it out.

[07:32] Team_098 possession (Score: 46-46)
Kristaps Iverson attempts a Layup. Contested by Miles Murray (4.0 feet, MAN). Kristaps Iverson misses. Rebound secured by Jarrett Oladipo.

[07:22] Team_068 possession (Score: 46-46)
Jarrett Oladipo attempts a Midrange. Contested by Manu Jordan (5.0 feet, ZONE). JARRETT OLADIPO MAKES IT!
Score: 48-46

[07:05] Team_098 possession (Score: 48-46)
Tracy Rose attempts a Midrange. Contested by Cole Anthony (4.8 feet, MAN). TRACY ROSE MAKES IT!
Score: 48-48

[06:46] Team_068 possession (Score: 48-48)
Jarrett Oladipo attempts a Layup. Contested by Manu Jordan (5.0 feet, MAN). Jarrett Oladipo misses. Rebound secured by Kristaps Iverson.

[06:31] Team_098 possession (Score: 48-48)
Manu Jordan attempts a 3Pt. Contested by Ja Banchero (5.4 feet, ZONE). MANU JORDAN MAKES IT! Assist: Dirk McCollum
Score: 48-51

[06:16] Team_068 possession (Score: 48-51)
Ja Banchero commits a violation (traveling/carry)! TURNOVER! (dead ball)

[06:00] Team_098 possession (Score: 48-51)
Dirk McCollum attempts a 3Pt. Contested by Ja Banchero (5.3 feet, MAN). DIRK MCCOLLUM MAKES IT! Assist: Russell McGrady
Score: 48-54

[05:43] Team_068 possession (Score: 48-54)
Cole Anthony attempts a 3Pt. Contested by Dirk McCollum (4.1 feet, ZONE). Cole Anthony misses. Offensive rebound by Franz Curry! Franz Curry puts it back in!
Score: 50-54

[05:31] Team_098 possession (Score: 50-54)
Russell McGrady drives and kicks out. Tracy Rose attempts a Midrange. Contested by Jarrett Oladipo (3.8 feet, ZONE). TRACY ROSE MAKES IT! Assist: Russell McGrady
Score: 50-56

[05:15] Team_068 possession (Score: 50-56)
Jarrett Oladipo drives to the basket... Jarrett Oladipo commits a violation (traveling/carry)! TURNOVER! (dead ball)

[04:59] Team_098 possession (Score: 50-56)
Manu Jordan drives and kicks out. Kristaps Iverson attempts a Midrange. Contested by Miles Murray (3.9 feet, MAN). Kristaps Iverson misses. Rebound secured by Franz Curry.

[04:41] Team_068 possession (Score: 50-56)
FOUL! Reach-in foul on Russell McGrady during the drive. [Team fouls: 2] No free throws, side out. (Russell McGrady: 1 personal fouls)

[04:27] Team_068 possession (Score: 50-56)
Ja Banchero attempts a 3Pt. Contested by Kristaps Iverson (4.1 feet, ZONE). Ja Banchero misses. Rebound secured by Russell McGrady.

[04:13] Team_098 possession (Score: 50-56)
FOUL! Shooting foul on Franz Curry. Russell McGrady to the line for 2 free throws. [Team fouls: 2] (Franz Curry: 1 personal fouls)   FT 1/2: MISS   FT 2/2: GOOD Russell McGrady makes 1/2 from the line.
Score: 50-57

[03:58] Team_068 possession (Score: 50-57)
Franz Curry attempts a Midrange. Contested by Manu Jordan (5.2 feet, ZONE). FRANZ CURRY MAKES IT!
Score: 52-57

[03:39] Team_098 possession (Score: 52-57)
Tracy Rose attempts a Midrange. Contested by Cole Anthony (4.8 feet, MAN). Tracy Rose misses. Rebound secured by Ja Banchero.

[03:25] Team_068 possession (Score: 52-57)
Miles Murray attempts a Midrange. Contested by Kristaps Iverson (4.2 feet, MAN). Miles Murray misses. Offensive rebound by Jarrett Oladipo! Jarrett Oladipo kicks it out.

[03:13] Team_068 possession (Score: 52-57)
FOUL! Shooting foul on Manu Jordan. Jarrett Oladipo to the line for 2 free throws. [Team fouls: 3] (Manu Jordan: 1 personal fouls)   FT 1/2: GOOD   FT 2/2: GOOD Jarrett Oladipo makes 2/2 from the line.
Score: 54-57

[02:56] Team_098 possession (Score: 54-57)
Tracy Rose makes the Midrange and draws the foul on Cole Anthony! And-1! Tracy Rose to the line for 1. [Team fouls: 3] (Cole Anthony: 2 personal fouls)   FT 1/1: GOOD Tracy Rose makes 1/1 from the line.
Score: 54-60

[02:38] Team_068 possession (Score: 54-60)
FOUL! Shooting foul on Manu Jordan. Jarrett Oladipo to the line for 2 free throws. [Team fouls: 4] (Manu Jordan: 2 personal fouls)   FT 1/2: GOOD   FT 2/2: GOOD Jarrett Oladipo makes 2/2 from the line.
Score: 56-60

[02:24] Team_098 possession (Score: 56-60)
Dirk McCollum attempts a 3Pt. Contested by Ja Banchero (5.4 feet, ZONE). Dirk McCollum misses. Rebound secured by Jarrett Oladipo.

[02:13] Team_068 possession (Score: 56-60)
Ja Banchero loses control! Ball rolls out of bounds! TURNOVER! (dead ball)

[01:59] Team_098 possession (Score: 56-60)
Tracy Rose attempts a 3Pt. Contested by Cole Anthony (5.0 feet, MAN). TRACY ROSE MAKES IT! Assist: Russell McGrady
Score: 56-63

[01:43] Team_068 possession (Score: 56-63)
Ja Banchero attempts a Layup. Contested by Manu Jordan (5.0 feet, ZONE). JA BANCHERO MAKES IT!
Score: 58-63

[01:27] Team_098 possession (Score: 58-63)
Kristaps Iverson attempts a 3Pt. Contested by Ja Banchero (5.5 feet, ZONE). Kristaps Iverson misses. Rebound secured by Jarrett Oladipo.

[01:16] Team_068 possession (Score: 58-63)
Cole Anthony attempts a 3Pt. Contested by Tracy Rose (3.5 feet, MAN). COLE ANTHONY MAKES IT! Assist: Franz Curry
Score: 61-63

[01:02] Team_098 possession (Score: 61-63)
Manu Jordan attempts a 3Pt. Contested by Ja Banchero (5.6 feet, ZONE). MANU JORDAN MAKES IT! Assist: Dirk McCollum
Score: 61-66

[00:52] Team_068 possession (Score: 61-66)
Cole Anthony attempts a 3Pt. Contested by Dirk McCollum (4.3 feet, ZONE). Cole Anthony misses. Offensive rebound by Jarrett Oladipo! Jarrett Oladipo kicks it out.

[00:36] Team_068 possession (Score: 61-66)
Miles Murray attempts a 3Pt. Contested by Kristaps Iverson (4.6 feet, MAN). Miles Murray misses. Rebound secured by Russell McGrady.

[00:24] Team_098 possession (Score: 61-66)
Dirk McCollum attempts a Midrange. Contested by Ja Banchero (5.6 feet, MAN). DIRK MCCOLLUM MAKES IT!
Score: 61-68

[00:14] Team_068 possession (Score: 61-68)
Franz Curry attempts a 3Pt. Contested by Russell McGrady (4.7 feet, MAN). Franz Curry misses. Rebound secured by Kristaps Iverson.

================================================================================
                              2ND QUARTER COMPLETE                              
================================================================================

2ND QUARTER SCORE: Team_068 31, Team_098 30

BOX SCORE:
================================================================================

Team_068
--------------------------------------------------------------------------------
Player                MIN  PTS  REB  AST  TO      FG   FG%      3P   3P%
--------------------------------------------------------------------------------
Ja Banchero            11   10    1    1   0   4/6    66.7     0/0   0.0
Cole Anthony           11    6    0    0   0   2/2   100.0     0/0   0.0
Jarrett Oladipo        11    6    6    1   0   3/5    60.0     0/0   0.0
Franz Curry            11    4    3    2   0   2/3    66.7     0/0   0.0
Malcolm Herro          13    3    0    0   0   1/1   100.0     0/0   0.0
Nikola Ginobili        13    2    2    0   0   1/1   100.0     0/0   0.0
Jaren Johnson          13    0    0    1   0   0/0     0.0     0/0   0.0
Miles Murray           11    0    0    0   0   0/1     0.0     0/0   0.0

TEAM: FG: 13/19 (68.4%), 3PT: 7/12 (58.3%), REB: 13 (5 off, 8 def), AST: 5, TO: 4
TEAM FOULS: 3


Team_098
--------------------------------------------------------------------------------
Player                MIN  PTS  REB  AST  TO      FG   FG%      3P   3P%
--------------------------------------------------------------------------------
Tracy Rose             11   10    0    0   0   4/5    80.0     0/0   0.0
Dirk McCollum          11    8    0    3   0   3/4    75.0     0/0   0.0
Manu Jordan            11    6    0    0   0   2/4    50.0     0/0   0.0
Kristaps Iverson       11    5    4    0   0   2/4    50.0     0/0   0.0
Russell McGrady        11    1    3    4   0   1/2    50.0     0/0   0.0
Blake Murray           13    0    0    0   0   0/1     0.0     0/0   0.0

TEAM: FG: 12/20 (60.0%), 3PT: 6/8 (75.0%), REB: 6 (1 off, 5 def), AST: 7, TO: 2
TEAM FOULS: 4

================================================================================

================================================================================
                       3RD QUARTER - Team_068 vs Team_098                       
================================================================================

[12:00] Team_068 possession (Score: 61-68)
Zion Anunoby drives to the basket... Zion Anunoby throws a bad pass! Stolen by Pascal Lillard! TURNOVER! (live ball)

[11:44] Team_098 possession (Score: 61-68)
FOUL! Reach-in foul on Nikola Ginobili during the drive. [Team fouls: 1] No free throws, side out. (Nikola Ginobili: 1 personal fouls)

[11:30] Team_098 possession (Score: 61-68)
Blake Murray drives, Jaren Johnson stays with him. Blake Murray attempts a Dunk. Contested by Jaren Johnson (3.8 feet, MAN). BLAKE MURRAY MAKES IT! Assist: Nikola Rose
Score: 61-70

[11:15] Team_068 possession (Score: 61-70)
Gary Simons attempts a Midrange. Contested by Pascal Lillard (4.9 feet, ZONE). Gary Simons misses. Rebound secured by Derrick Durant.

[11:00] Team_098 possession (Score: 61-70)
Pascal Lillard attempts a 3Pt. Contested by Zion Anunoby (5.0 feet, ZONE). Pascal Lillard misses. Offensive rebound by Derrick Durant! Derrick Durant's putback is no good. Rebound secured by Jaren Johnson.

[10:44] Team_068 possession (Score: 61-70)
Gary Simons attempts a 3Pt. Contested by Pascal Lillard (4.9 feet, MAN). Gary Simons misses. Rebound secured by Nikola Rose.

[10:32] Team_098 possession (Score: 61-70)
Blake Murray drives and kicks out. Blake Murray attempts a 3Pt. Contested by Zion Anunoby (4.4 feet, ZONE). Blake Murray misses. FOUL! Loose ball foul on Nikola Ginobili during the rebound battle. [Team fouls: 2] No free throws, side out. (Nikola Ginobili: 2 personal fouls)

[10:16] Team_098 possession (Score: 61-70)
FOUL! Shooting foul on Gary Simons. Pascal Lillard to the line for 2 free throws. [Team fouls: 3] (Gary Simons: 1 personal fouls)   FT 1/2: MISS   FT 2/2: GOOD Pascal Lillard makes 1/2 from the line.
Score: 61-71

[09:58] Team_068 possession (Score: 61-71)
Gary Simons drives to the basket... FOUL! Offensive foul on Gary Simons! Pascal Lillard drew the charge! [Team fouls: 4] (Gary Simons: 2 personal fouls) TURNOVER! (dead ball)

[09:47] Team_098 possession (Score: 61-71)
Nikola Rose makes the Dunk and draws the foul on Malcolm Herro! And-1! Nikola Rose to the line for 1. [BONUS: 5 team fouls] (Malcolm Herro: 1 personal fouls)   FT 1/1: GOOD Nikola Rose makes 1/1 from the line.
Score: 61-74

[09:29] Team_068 possession (Score: 61-74)
Zion Anunoby drives and kicks out. Malcolm Herro attempts a 3Pt. Contested by Nikola Rose (3.2 feet, MAN). Malcolm Herro misses. Offensive rebound by Jaren Johnson! Jaren Johnson kicks it out.

[09:17] Team_068 possession (Score: 61-74)
Zion Anunoby attempts a Layup. Contested by Pascal Lillard (4.4 feet, ZONE). Zion Anunoby misses. Rebound secured by Pascal Lillard.

[08:58] Team_098 possession (Score: 61-74)
Malcolm Tatum attempts a 3Pt. Contested by Zion Anunoby (4.6 feet, ZONE). Malcolm Tatum misses. Rebound secured by Nikola Ginobili.

[08:45] Team_068 possession (Score: 61-74)
Zion Anunoby drives, Malcolm Tatum stays with him. Zion Anunoby attempts a Dunk. Contested by Malcolm Tatum (4.3 feet, MAN). ZION ANUNOBY MAKES IT! Assist: Nikola Ginobili
Score: 63-74

[08:30] Team_098 possession (Score: 63-74)
Derrick Durant commits a violation (traveling/carry)! TURNOVER! (dead ball)

[08:14] Team_068 possession (Score: 63-74)
Nikola Ginobili attempts a 3Pt. Contested by Derrick Durant (4.4 feet, MAN). Nikola Ginobili misses. Offensive rebound by Nikola Ginobili! Nikola Ginobili's putback is no good. Offensive rebound by Nikola Ginobili! Nikola Ginobili kicks it out.

[08:02] Team_068 possession (Score: 63-74)
FOUL! Shooting foul on Nikola Rose. Malcolm Herro to the line for 2 free throws. [Team fouls: 2] (Nikola Rose: 2 personal fouls)   FT 1/2: GOOD   FT 2/2: GOOD Malcolm Herro makes 2/2 from the line.
Score: 65-74

[07:45] Team_098 possession (Score: 65-74)
Malcolm Tatum drives to the basket... FOUL! Offensive foul on Malcolm Tatum! Gary Simons drew the charge! [Team fouls: 3] (Malcolm Tatum: 1 personal fouls) TURNOVER! (dead ball)

[07:28] Team_068 possession (Score: 65-74)
FOUL! Reach-in foul on Pascal Lillard during the drive. [Team fouls: 4] No free throws, side out. (Pascal Lillard: 1 personal fouls)

[07:13] Team_068 possession (Score: 65-74)
Nikola Ginobili makes the Layup and draws the foul on Pascal Lillard! And-1! Nikola Ginobili to the line for 1. [BONUS: 5 team fouls] (Pascal Lillard: 2 personal fouls)   FT 1/1: GOOD Nikola Ginobili makes 1/1 from the line.
Score: 68-74

[06:56] Team_098 possession (Score: 68-74)
Malcolm Tatum attempts a 3Pt. Contested by Zion Anunoby (4.6 feet, MAN). MALCOLM TATUM MAKES IT! Assist: Pascal Lillard
Score: 68-77

[06:41] Team_068 possession (Score: 68-77)
Jaren Johnson drives to the basket... Jaren Johnson throws a bad pass! Stolen by Pascal Lillard! TURNOVER! (live ball)

[06:22] Team_098 possession (Score: 68-77)
Derrick Durant makes the Layup and draws the foul on Gary Simons! And-1! Derrick Durant to the line for 1. [BONUS: 6 team fouls] (Gary Simons: 3 personal fouls)   FT 1/1: GOOD Derrick Durant makes 1/1 from the line.
Score: 68-80

[06:13] Team_068 possession (Score: 68-80)
Nikola Ginobili makes the Layup and draws the foul on Derrick Durant! And-1! Nikola Ginobili to the line for 1. [BONUS: 6 team fouls] (Derrick Durant: 1 personal fouls)   FT 1/1: GOOD Nikola Ginobili makes 1/1 from the line.
Score: 71-80

[05:56] Team_098 possession (Score: 71-80)
Nikola Rose attempts a 3Pt. Contested by Gary Simons (3.5 feet, ZONE). Nikola Rose misses. Rebound secured by Gary Simons.

[05:43] Team_068 possession (Score: 71-80)
Gary Simons makes the Dunk and draws the foul on Pascal Lillard! And-1! Gary Simons to the line for 1. [BONUS: 7 team fouls] (Pascal Lillard: 3 personal fouls)   FT 1/1: GOOD Gary Simons makes 1/1 from the line.
Score: 74-80

[05:31] Team_098 possession (Score: 74-80)
Malcolm Tatum attempts a 3Pt. Contested by Gary Simons (3.4 feet, ZONE). Malcolm Tatum misses. Rebound secured by Jaren Johnson.

[05:17] Team_068 possession (Score: 74-80)
Gary Simons drives, Pascal Lillard stays with him. Gary Simons attempts a Layup. Contested by Pascal Lillard (4.8 feet, ZONE). GARY SIMONS MAKES IT!
Score: 76-80

[05:03] Team_098 possession (Score: 76-80)
Malcolm Tatum attempts a Layup. Contested by Gary Simons (3.4 feet, ZONE). MALCOLM TATUM MAKES IT!
Score: 76-82

[04:50] Team_068 possession (Score: 76-82)
FOUL! Shooting foul on Blake Murray. Jaren Johnson to the line for 2 free throws. [BONUS: 8 team fouls] (Blake Murray: 1 personal fouls)   FT 1/2: GOOD   FT 2/2: GOOD Jaren Johnson makes 2/2 from the line.
Score: 78-82

[04:32] Team_098 possession (Score: 78-82)
Pascal Lillard drives, Gary Simons stays with him. Pascal Lillard attempts a Layup. Contested by Gary Simons (3.8 feet, MAN). PASCAL LILLARD MAKES IT! Assist: Blake Murray
Score: 78-84

[04:16] Team_068 possession (Score: 78-84)
Malcolm Herro drives to the basket... Malcolm Herro loses control! Ball rolls out of bounds! TURNOVER! (dead ball)

[04:05] Team_098 possession (Score: 78-84)
FOUL! Holding foul on Jaren Johnson. [IN THE BONUS! 7 team fouls] Blake Murray to the line for 2 free throws. (Jaren Johnson: 1 personal fouls)   FT 1/2: GOOD   FT 2/2: GOOD Blake Murray makes 2/2 from the line.
Score: 78-86

[03:48] Team_068 possession (Score: 78-86)
Zion Anunoby attempts a Layup. BLOCKED BY MALCOLM TATUM! Ball is loose! Rebound secured by Pascal Lillard.

[03:31] Team_098 possession (Score: 78-86)
FOUL! Shooting foul on Jaren Johnson. Blake Murray to the line for 2 free throws. [BONUS: 8 team fouls] (Jaren Johnson: 2 personal fouls)   FT 1/2: MISS   FT 2/2: GOOD Blake Murray makes 1/2 from the line.
Score: 78-87

[03:14] Team_068 possession (Score: 78-87)
Malcolm Herro attempts a 3Pt. Contested by Nikola Rose (3.3 feet, MAN). Malcolm Herro misses. Rebound secured by Pascal Lillard.

[02:59] Team_098 possession (Score: 78-87)
Pascal Lillard attempts a Midrange. Contested by Gary Simons (4.0 feet, MAN). Pascal Lillard misses. Rebound secured by Gary Simons.

[02:44] Team_068 possession (Score: 78-87)
Zion Anunoby attempts a 3Pt. Contested by Nikola Rose (3.7 feet, ZONE). ZION ANUNOBY MAKES IT! Assist: Gary Simons
Score: 81-87

[02:29] Team_098 possession (Score: 81-87)
Nikola Rose attempts a 3Pt. BLOCKED BY ZION ANUNOBY! Ball is loose! Rebound secured by Jaren Johnson.

[02:12] Team_068 possession (Score: 81-87)
Malcolm Herro attempts a 3Pt. Contested by Nikola Rose (3.4 feet, ZONE). MALCOLM HERRO MAKES IT! Assist: Zion Anunoby
Score: 84-87

[01:56] Team_098 possession (Score: 84-87)
Malcolm Tatum attempts a 3Pt. Contested by Zion Anunoby (4.8 feet, MAN). Malcolm Tatum misses. Rebound secured by Jaren Johnson.

[01:44] Team_068 possession (Score: 84-87)
Malcolm Herro attempts a Layup. Contested by Pascal Lillard (4.3 feet, ZONE). MALCOLM HERRO MAKES IT! Assist: Zion Anunoby
Score: 86-87

[01:28] Team_098 possession (Score: 86-87)
FOUL! Reach-in foul on Gary Simons during the drive. [IN THE BONUS! 9 team fouls] Malcolm Tatum to the line for 2 free throws. (Gary Simons: 4 personal fouls)   FT 1/2: GOOD   FT 2/2: GOOD Malcolm Tatum makes 2/2 from the line.
Score: 86-89

[01:12] Team_068 possession (Score: 86-89)
Jaren Johnson attempts a 3Pt. Contested by Blake Murray (5.3 feet, MAN). JAREN JOHNSON MAKES IT! Assist: Zion Anunoby
Score: 89-89

[01:00] Team_098 possession (Score: 89-89)
FOUL! Reach-in foul on Malcolm Herro during the drive. [IN THE BONUS! 10 team fouls] Nikola Rose to the line for 2 free throws. (Malcolm Herro: 2 personal fouls)   FT 1/2: GOOD   FT 2/2: GOOD Nikola Rose makes 2/2 from the line.
Score: 89-91

[00:46] Team_068 possession (Score: 89-91)
Zion Anunoby attempts a Layup. Contested by Malcolm Tatum (4.7 feet, MAN). ZION ANUNOBY MAKES IT! Assist: Malcolm Herro
Score: 91-91

[00:31] Team_098 possession (Score: 91-91)
Derrick Durant attempts a Midrange. Contested by Jaren Johnson (4.2 feet, ZONE). Derrick Durant misses. Rebound secured by Jaren Johnson.

[00:16] Team_068 possession (Score: 91-91)
Jaren Johnson attempts a 3Pt. Contested by Nikola Rose (4.0 feet, ZONE). Jaren Johnson misses. Offensive rebound by Nikola Ginobili! Nikola Ginobili puts it back in!
Score: 93-91

[00:03] Team_098 possession (Score: 93-91)
Nikola Rose attempts a 3Pt. Contested by Zion Anunoby (5.1 feet, ZONE). Nikola Rose misses. Rebound secured by Jaren Johnson.

================================================================================
                              3RD QUARTER COMPLETE                              
================================================================================

3RD QUARTER SCORE: Team_068 32, Team_098 23

BOX SCORE:
================================================================================

Team_068
--------------------------------------------------------------------------------
Player                MIN  PTS  REB  AST  TO      FG   FG%      3P   3P%
--------------------------------------------------------------------------------
Nikola Ginobili        25    8    3    1   0   3/3   100.0     0/0   0.0
Zion Anunoby           25    7    0    3   0   3/5    60.0     0/0   0.0
Malcolm Herro          25    7    0    1   0   3/4    75.0     0/0   0.0
Gary Simons            25    5    2    1   0   2/4    50.0     0/0   0.0
Jaren Johnson          25    5    7    0   0   2/2   100.0     0/0   0.0

TEAM: FG: 13/18 (72.2%), 3PT: 4/6 (66.7%), REB: 11 (3 off, 8 def), AST: 6, TO: 4
TEAM FOULS: 10 [Team_098 in BONUS]


Team_098
--------------------------------------------------------------------------------
Player                MIN  PTS  REB  AST  TO      FG   FG%      3P   3P%
--------------------------------------------------------------------------------
Malcolm Tatum          25    7    0    0   0   3/6    50.0     0/0   0.0
Blake Murray           25    5    0    1   0   3/3   100.0     0/0   0.0
Nikola Rose            25    5    1    1   0   2/5    40.0     0/0   0.0
Derrick Durant         25    3    2    0   0   1/2    50.0     0/0   0.0
Pascal Lillard         25    3    3    1   0   2/4    50.0     0/0   0.0

TEAM: FG: 11/20 (55.0%), 3PT: 1/8 (12.5%), REB: 7 (2 off, 5 def), AST: 3, TO: 2
TEAM FOULS: 8 [Team_068 in BONUS]

================================================================================

================================================================================
                       4TH QUARTER - Team_068 vs Team_098                       
================================================================================

[12:00] Team_068 possession (Score: 93-91)
Malcolm Herro attempts a 3Pt. Contested by Nikola Rose (3.4 feet, ZONE). Malcolm Herro misses. Rebound secured by Nikola Rose.

[11:45] Team_098 possession (Score: 93-91)
Derrick Durant attempts a 3Pt. Contested by Malcolm Herro (4.7 feet, ZONE). Derrick Durant misses. Offensive rebound by Pascal Lillard! Pascal Lillard kicks it out.

[11:26] Team_098 possession (Score: 93-91)
Malcolm Tatum drives, picks up Nikola Ginobili. Help arrives from Malcolm Herro! Malcolm Tatum attempts a Dunk. Contested by Malcolm Herro (4.7 feet, ZONE). MALCOLM TATUM MAKES IT! Assist: Blake Murray
Score: 93-93

[11:13] Team_068 possession (Score: 93-93)
Nikola Ginobili drives to the basket... Nikola Ginobili commits a violation (traveling/carry)! TURNOVER! (dead ball)

[11:13] Substitution (Team_068): Zion Anunoby OUT → Cole Anthony IN (stamina_rule2)

[11:13] Substitution (Team_068): Malcolm Herro OUT → Ja Banchero IN (stamina_rule2)

[11:13] Substitution (Team_068): Jaren Johnson OUT → Miles Murray IN (stamina_rule2)

[11:13] Substitution (Team_068): Gary Simons OUT → Jarrett Oladipo IN (stamina_rule2)

[11:13] Substitution (Team_068): Nikola Ginobili OUT → Franz Curry IN (stamina_rule2)

[11:13] Substitution (Team_098): Malcolm Tatum OUT → Tracy Rose IN (stamina_rule2)

[11:13] Substitution (Team_098): Nikola Rose OUT → Dirk McCollum IN (stamina_rule2)

[11:13] Substitution (Team_098): Blake Murray OUT → Kristaps Iverson IN (stamina_rule2)

[11:13] Substitution (Team_098): Pascal Lillard OUT → Manu Jordan IN (stamina_rule2)

[11:13] Substitution (Team_098): Derrick Durant OUT → Russell McGrady IN (stamina_rule2)

[11:01] Team_098 possession (Score: 93-93)
Manu Jordan attempts a Midrange. Contested by Jarrett Oladipo (4.1 feet, MAN). Manu Jordan misses. Rebound secured by Franz Curry.

[10:47] Team_068 possession (Score: 93-93)
Miles Murray drives and kicks out. Miles Murray attempts a Midrange. Contested by Kristaps Iverson (3.9 feet, MAN). Miles Murray misses. Rebound secured by Manu Jordan.

[10:28] Team_098 possession (Score: 93-93)
Manu Jordan attempts a Layup. Contested by Jarrett Oladipo (4.1 feet, MAN). MANU JORDAN MAKES IT! Assist: Russell McGrady
Score: 93-95

[10:15] Team_068 possession (Score: 93-95)
Miles Murray throws a bad pass out of bounds! TURNOVER! (dead ball)

[10:04] Team_098 possession (Score: 93-95)
Tracy Rose attempts a 3Pt. Contested by Cole Anthony (4.8 feet, MAN). Tracy Rose misses. Rebound secured by Ja Banchero.

[09:52] Team_068 possession (Score: 93-95)
Franz Curry attempts a Layup. Contested by Russell McGrady (4.3 feet, MAN). FRANZ CURRY MAKES IT!
Score: 95-95

[09:37] Team_098 possession (Score: 95-95)
Manu Jordan drives, Franz Curry stays with him. Manu Jordan attempts a Dunk. Contested by Franz Curry (4.6 feet, ZONE). MANU JORDAN MAKES IT! Assist: Tracy Rose
Score: 95-97

[09:22] Team_068 possession (Score: 95-97)
Jarrett Oladipo attempts a 3Pt. Contested by Manu Jordan (5.0 feet, MAN). JARRETT OLADIPO MAKES IT! Assist: Miles Murray
Score: 98-97

[09:04] Team_098 possession (Score: 98-97)
FOUL! Shooting foul on Franz Curry. Manu Jordan to the line for 2 free throws. [Team fouls: 1] (Franz Curry: 1 personal fouls)   FT 1/2: GOOD   FT 2/2: GOOD Manu Jordan makes 2/2 from the line.
Score: 98-99

[08:48] Team_068 possession (Score: 98-99)
Miles Murray attempts a 3Pt. Contested by Dirk McCollum (4.3 feet, ZONE). Miles Murray misses. Rebound secured by Russell McGrady.

[08:30] Team_098 possession (Score: 98-99)
Tracy Rose attempts a 3Pt. Contested by Cole Anthony (4.8 feet, MAN). TRACY ROSE MAKES IT! Assist: Dirk McCollum
Score: 98-102

[08:16] Team_068 possession (Score: 98-102)
Jarrett Oladipo attempts a Midrange. Contested by Manu Jordan (5.0 feet, MAN). Jarrett Oladipo misses. Rebound secured by Manu Jordan.

[07:59] Team_098 possession (Score: 98-102)
Tracy Rose loses control! Ball rolls out of bounds! TURNOVER! (dead ball)

[07:44] Team_068 possession (Score: 98-102)
Miles Murray attempts a 3Pt. Contested by Kristaps Iverson (4.1 feet, ZONE). Miles Murray misses. Rebound secured by Kristaps Iverson.

[07:28] Team_098 possession (Score: 98-102)
Tracy Rose attempts a 3Pt. Contested by Cole Anthony (4.8 feet, MAN). Tracy Rose misses. Offensive rebound by Russell McGrady! Russell McGrady puts it back in!
Score: 98-104

[07:12] Team_068 possession (Score: 98-104)
Miles Murray attempts a Layup. Contested by Kristaps Iverson (4.1 feet, MAN). MILES MURRAY MAKES IT! Assist: Cole Anthony
Score: 100-104

[06:58] Team_098 possession (Score: 100-104)
Russell McGrady attempts a Layup. Contested by Franz Curry (4.2 feet, MAN). RUSSELL MCGRADY MAKES IT!
Score: 100-106

[06:42] Team_068 possession (Score: 100-106)
FOUL! Reach-in foul on Manu Jordan during the drive. [Team fouls: 1] No free throws, side out. (Manu Jordan: 1 personal fouls)

[06:28] Team_068 possession (Score: 100-106)
Cole Anthony makes the Layup and draws the foul on Kristaps Iverson! And-1! Cole Anthony to the line for 1. [Team fouls: 2] (Kristaps Iverson: 1 personal fouls)   FT 1/1: GOOD Cole Anthony makes 1/1 from the line.
Score: 103-106

[06:11] Team_098 possession (Score: 103-106)
Dirk McCollum attempts a 3Pt. Contested by Ja Banchero (5.3 feet, ZONE). Dirk McCollum misses. Offensive rebound by Kristaps Iverson! Kristaps Iverson kicks it out.

[05:56] Team_098 possession (Score: 103-106)
Russell McGrady makes the Midrange and draws the foul on Franz Curry! And-1! Russell McGrady to the line for 1. [Team fouls: 2] (Franz Curry: 2 personal fouls)   FT 1/1: MISS Russell McGrady makes 0/1 from the line. Rebound secured by Franz Curry.
Score: 103-108

[05:40] Team_068 possession (Score: 103-108)
FOUL! Offensive foul on Jarrett Oladipo! Manu Jordan drew the charge! [Team fouls: 3] (Jarrett Oladipo: 1 personal fouls) TURNOVER! (dead ball)

[05:25] Team_098 possession (Score: 103-108)
Russell McGrady drives and kicks out. Russell McGrady attempts a Midrange. Contested by Franz Curry (4.3 feet, MAN). Russell McGrady misses. Rebound secured by Jarrett Oladipo.

[05:10] Team_068 possession (Score: 103-108)
Jarrett Oladipo makes the Dunk and draws the foul on Dirk McCollum! And-1! Jarrett Oladipo to the line for 1. [Team fouls: 3] (Dirk McCollum: 1 personal fouls)   FT 1/1: GOOD Jarrett Oladipo makes 1/1 from the line.
Score: 106-108

[04:55] Team_098 possession (Score: 106-108)
Russell McGrady drives to the basket... FOUL! Offensive foul on Russell McGrady! Jarrett Oladipo drew the charge! [Team fouls: 4] (Russell McGrady: 1 personal fouls) TURNOVER! (dead ball)

[04:43] Team_068 possession (Score: 106-108)
Franz Curry drives to the basket... FOUL! Offensive foul on Franz Curry! Russell McGrady drew the charge! [Team fouls: 4] (Franz Curry: 3 personal fouls) TURNOVER! (dead ball)

[04:34] Team_098 possession (Score: 106-108)
Manu Jordan attempts a Layup. Contested by Jarrett Oladipo (4.1 feet, MAN). MANU JORDAN MAKES IT! Assist: Kristaps Iverson
Score: 106-110

[04:17] Team_068 possession (Score: 106-110)
Jarrett Oladipo attempts a Midrange. Contested by Manu Jordan (5.0 feet, MAN). JARRETT OLADIPO MAKES IT!
Score: 108-110

[04:04] Team_098 possession (Score: 108-110)
Dirk McCollum attempts a Midrange. Contested by Ja Banchero (5.3 feet, MAN). DIRK MCCOLLUM MAKES IT!
Score: 108-112

[03:52] Team_068 possession (Score: 108-112)
Ja Banchero drives and kicks out. Franz Curry makes the 3Pt and draws the foul on Dirk McCollum! And-1! Franz Curry to the line for 1. [BONUS: 5 team fouls] (Dirk McCollum: 2 personal fouls)   FT 1/1: GOOD Franz Curry makes 1/1 from the line.
Score: 112-112

[03:38] Team_098 possession (Score: 112-112)
Manu Jordan makes the Layup and draws the foul on Jarrett Oladipo! And-1! Manu Jordan to the line for 1. [BONUS: 5 team fouls] (Jarrett Oladipo: 2 personal fouls)   FT 1/1: GOOD Manu Jordan makes 1/1 from the line.
Score: 112-115

[03:24] Team_068 possession (Score: 112-115)
Franz Curry drives to the basket... Franz Curry throws a bad pass out of bounds! TURNOVER! (dead ball)

[03:13] Team_098 possession (Score: 112-115)
Tracy Rose attempts a 3Pt. Contested by Ja Banchero (5.3 feet, ZONE). Tracy Rose misses. Rebound secured by Jarrett Oladipo.

[02:58] Team_068 possession (Score: 112-115)
Ja Banchero attempts a Midrange. Contested by Dirk McCollum (4.4 feet, MAN). Ja Banchero misses. Rebound secured by Manu Jordan.

[02:46] Team_098 possession (Score: 112-115)
Russell McGrady attempts a 3Pt. Contested by Franz Curry (4.3 feet, MAN). Russell McGrady misses. Rebound secured by Franz Curry.

[02:32] Team_068 possession (Score: 112-115)
Cole Anthony drives, Tracy Rose stays with him. Cole Anthony attempts a Layup. Contested by Tracy Rose (3.3 feet, MAN). Cole Anthony misses. Rebound secured by Manu Jordan.

[02:20] Team_098 possession (Score: 112-115)
Dirk McCollum attempts a 3Pt. Contested by Jarrett Oladipo (4.2 feet, ZONE). Dirk McCollum misses. Rebound secured by Jarrett Oladipo.

[02:04] Team_068 possession (Score: 112-115)
Ja Banchero drives, Dirk McCollum stays with him. Ja Banchero attempts a Layup. Contested by Dirk McCollum (4.4 feet, MAN). JA BANCHERO MAKES IT! Assist: Miles Murray
Score: 114-115

[01:49] Team_098 possession (Score: 114-115)
Russell McGrady attempts a 3Pt. Contested by Ja Banchero (5.2 feet, ZONE). RUSSELL MCGRADY MAKES IT! Assist: Kristaps Iverson
Score: 114-118

[01:37] Team_068 possession (Score: 114-118)
Franz Curry drives to the basket... FOUL! Offensive foul on Franz Curry! Russell McGrady drew the charge! [Team fouls: 6] (Franz Curry: 4 personal fouls) TURNOVER! (dead ball)

[01:21] Team_098 possession (Score: 114-118)
Dirk McCollum attempts a Midrange. Contested by Ja Banchero (5.5 feet, MAN). Dirk McCollum misses. Rebound secured by Franz Curry.

[01:06] Team_068 possession (Score: 114-118)
Miles Murray attempts a 3Pt. Contested by Dirk McCollum (4.5 feet, ZONE). Miles Murray misses. Rebound secured by Kristaps Iverson.

[00:53] Team_098 possession (Score: 114-118)
Manu Jordan attempts a 3Pt. Contested by Ja Banchero (5.6 feet, ZONE). Manu Jordan misses. Offensive rebound by Russell McGrady! Russell McGrady's putback is no good. Rebound secured by Franz Curry.

[00:38] Team_068 possession (Score: 114-118)
Jarrett Oladipo drives to the basket... Jarrett Oladipo loses the ball! Stripped by Russell McGrady! TURNOVER! (live ball)

[00:23] Team_098 possession (Score: 114-118)
Tracy Rose attempts a Midrange. Contested by Cole Anthony (5.1 feet, MAN). Tracy Rose misses. Rebound secured by Franz Curry.

[00:10] Team_068 possession (Score: 114-118)
Cole Anthony attempts a 3Pt. Contested by Dirk McCollum (4.4 feet, ZONE). COLE ANTHONY MAKES IT! Assist: Miles Murray
Score: 117-118

================================================================================
                              4TH QUARTER COMPLETE                              
================================================================================

4TH QUARTER SCORE: Team_068 24, Team_098 27

BOX SCORE:
================================================================================

Team_068
--------------------------------------------------------------------------------
Player                MIN  PTS  REB  AST  TO      FG   FG%      3P   3P%
--------------------------------------------------------------------------------
Jarrett Oladipo        22    8    3    0   0   3/4    75.0     0/0   0.0
Franz Curry            22    6    6    0   0   2/2   100.0     0/0   0.0
Cole Anthony           22    6    0    1   0   2/3    66.7     0/0   0.0
Miles Murray           22    2    0    3   0   1/5    20.0     0/0   0.0
Ja Banchero            22    2    1    0   0   1/2    50.0     0/0   0.0
Malcolm Herro          26    0    0    0   0   0/1     0.0     0/0   0.0

TEAM: FG: 9/17 (52.9%), 3PT: 2/6 (33.3%), REB: 9 (0 off, 9 def), AST: 4, TO: 7
TEAM FOULS: 6 [Team_098 in BONUS]


Team_098
--------------------------------------------------------------------------------
Player                MIN  PTS  REB  AST  TO      FG   FG%      3P   3P%
--------------------------------------------------------------------------------
Manu Jordan            22   11    4    0   0   5/7    71.4     0/0   0.0
Russell McGrady        22    7    2    1   0   3/6    50.0     0/0   0.0
Tracy Rose             22    3    0    1   0   1/4    25.0     0/0   0.0
Malcolm Tatum          26    2    0    0   0   1/1   100.0     0/0   0.0
Dirk McCollum          22    2    0    1   0   1/3    33.3     0/0   0.0
Nikola Rose            26    0    1    0   0   0/0     0.0     0/0   0.0
Pascal Lillard         26    0    1    0   0   0/0     0.0     0/0   0.0
Blake Murray           26    0    0    1   0   0/0     0.0     0/0   0.0
Kristaps Iverson       22    0    3    2   0   0/0     0.0     0/0   0.0

TEAM: FG: 11/21 (52.4%), 3PT: 3/8 (37.5%), REB: 12 (4 off, 8 def), AST: 6, TO: 2
TEAM FOULS: 5 [Team_068 in BONUS]

================================================================================

================================================================================
                               FULL GAME COMPLETE                               
================================================================================

FINAL SCORE: Team_068 117, Team_098 118

SCORING BY QUARTER:
--------------------------------------------------------------------------------
Team                     Q1     Q2     Q3     Q4    FINAL
--------------------------------------------------------------------------------
Team_068                 30     31     32     24      117
Team_098                 38     30     23     27      118
--------------------------------------------------------------------------------

FULL GAME BOX SCORE:
================================================================================

Team_068
--------------------------------------------------------------------------------
Player                MIN  PTS  REB  AST  TO      FG   FG%      3P   3P%      FT STL BLK
--------------------------------------------------------------------------------
Zion Anunoby           26   12    0    3   0   6/13   46.2   2/5    40.0   3/4     0   1
Malcolm Herro          26   15    0    3   0   6/14   42.9   2/8    25.0   6/8     0   0
Jaren Johnson          26   10   11    1   2   7/7   100.0   4/4   100.0   5/7     0   0
Gary Simons            26    9    5    3   2   3/6    50.0   1/3    33.3   2/2     0   1
Nikola Ginobili        26   19    8    1   1   4/4   100.0   0/0     0.0   2/2     0   0
Cole Anthony           22   12    0    1   1   5/6    83.3   4/4   100.0   1/1     0   0
Ja Banchero            22   12    2    1   6   6/9    66.7   2/4    50.0   0/0     0   0
Miles Murray           22    2    0    3   2   1/6    16.7   0/4     0.0   0/0     0   0
Jarrett Oladipo        22   14    9    1   1   6/9    66.7   1/2    50.0   5/5     0   0
Franz Curry            22   10    9    2   0   2/3    66.7   0/1     0.0   1/1     0   0

TEAM: FG: 46/77 (59.7%), 3PT: 16/35 (45.7%), REB: 43 (11 off, 32 def), AST: 19, TO: 15


Team_098
--------------------------------------------------------------------------------
Player                MIN  PTS  REB  AST  TO      FG   FG%      3P   3P%      FT STL BLK
--------------------------------------------------------------------------------
Malcolm Tatum          26   14    0    1   0   8/13   61.5   2/6    33.3   2/2     0   1
Nikola Rose            26   10    6    3   0   4/8    50.0   1/4    25.0   3/3     0   1
Blake Murray           26    8    0    3   1   3/4    75.0   0/0     0.0   3/4     0   0
Pascal Lillard         26   18    6    3   0   7/12   58.3   3/7    42.9   3/4     2   0
Derrick Durant         26   12    9    4   2   3/6    50.0   0/0     0.0   3/4     0   0
Tracy Rose             22   13    0    1   2   5/9    55.6   3/5    60.0   1/1     0   0
Dirk McCollum          22   10    0    4   0   4/7    57.1   2/4    50.0   0/0     0   0
Kristaps Iverson       22    5    7    2   0   2/4    50.0   1/2    50.0   0/0     0   0
Manu Jordan            22   17    4    0   1   7/11   63.6   2/3    66.7   3/3     0   0
Russell McGrady        22    8    5    5   0   4/8    50.0   1/2    50.0   1/3     1   0

TEAM: FG: 48/83 (57.8%), 3PT: 15/33 (45.5%), REB: 38 (8 off, 30 def), AST: 26, TO: 6

================================================================================
