================================================================================
                        FULL GAME - Team_062 vs Team_040                        
================================================================================

================================================================================
                       1ST QUARTER - Team_062 vs Team_040                       
================================================================================

[12:00] Team_062 possession (Score: 0-0)
Kawhi Thompson drives, Dirk Johnson stays with him. Kawhi Thompson attempts a Layup. Contested by Dirk Johnson (5.8 feet, MAN). KAWHI THOMPSON MAKES IT!
Score: 2-0

[11:45] Team_040 possession (Score: 2-0)
Bam Gobert drives and kicks out. Bam Gobert attempts a 3Pt. Contested by Jalen Reaves (4.9 feet, MAN). Bam Gobert misses. FOUL! Loose ball foul on Kawhi Thompson during the rebound battle. [Team fouls: 1] No free throws, side out. (Kawhi Thompson: 1 personal fouls)

[11:32] Team_040 possession (Score: 2-0)
Carmelo Murray attempts a 3Pt. Contested by RJ Williamson (4.7 feet, ZONE). CARMELO MURRAY MAKES IT! Assist: Dirk Johnson
Score: 2-3

[11:17] Team_062 possession (Score: 2-3)
Kawhi Thompson attempts a Layup. Contested by Bam Gobert (3.9 feet, ZONE). KAWHI THOMPSON MAKES IT! Assist: RJ Williamson
Score: 4-3

[11:03] Team_040 possession (Score: 4-3)
Carmelo Murray drives, picks up Jalen Reaves. Help arrives from Chris Bird! Carmelo Murray attempts a Layup. Contested by Chris Bird (5.2 feet, ZONE). Carmelo Murray misses. Rebound secured by Jalen Reaves.

[10:46] Team_062 possession (Score: 4-3)
Kawhi Thompson throws a bad pass! Stolen by Dirk Johnson! TURNOVER! (live ball)

[10:32] Team_040 possession (Score: 4-3)
Carmelo Murray drives, picks up Jalen Reaves. Help arrives from Chris Bird! Carmelo Murray attempts a Dunk. Contested by Chris Bird (5.2 feet, ZONE). CARMELO MURRAY MAKES IT! Assist: Shaquille Bane
Score: 4-5

[10:19] Team_062 possession (Score: 4-5)
Chris Bird attempts a Midrange. Contested by Shaquille Bane (4.8 feet, ZONE). Chris Bird misses. Rebound secured by Bam Gobert.

[10:07] Team_040 possession (Score: 4-5)
Carmelo Murray attempts a Midrange. Contested by Kawhi Thompson (5.1 feet, ZONE). CARMELO MURRAY MAKES IT! Assist: Ayo Rose
Score: 4-7

[09:54] Team_062 possession (Score: 4-7)
Michael Hyland drives, Bam Gobert stays with him. Michael Hyland attempts a Dunk. Contested by Bam Gobert (3.8 feet, ZONE). MICHAEL HYLAND MAKES IT! Assist: Kawhi Thompson
Score: 6-7

[09:39] Team_040 possession (Score: 6-7)
FOUL! Shooting foul on Kawhi Thompson. Dirk Johnson to the line for 3 free throws. [Team fouls: 2] (Kawhi Thompson: 2 personal fouls)   FT 1/3: GOOD   FT 2/3: GOOD   FT 3/3: GOOD Dirk Johnson makes 3/3 from the line.
Score: 6-10

[09:28] Team_062 possession (Score: 6-10)
Chris Bird attempts a 3Pt. Contested by Shaquille Bane (4.8 feet, ZONE). Chris Bird misses. Offensive rebound by Jalen Reaves! Jalen Reaves's putback is no good. Rebound secured by Shaquille Bane.

[09:12] Team_040 possession (Score: 6-10)
Dirk Johnson drives, picks up Jalen Reaves. Help arrives from Chris Bird! Dirk Johnson attempts a Layup. Contested by Chris Bird (5.1 feet, ZONE). Dirk Johnson misses. Offensive rebound by Bam Gobert! Bam Gobert kicks it out.

[08:52] Team_040 possession (Score: 6-10)
Ayo Rose loses control! Ball rolls out of bounds! TURNOVER! (dead ball)

[08:38] Team_062 possession (Score: 6-10)
Chris Bird attempts a 3Pt. Contested by Ayo Rose (4.8 feet, MAN). Chris Bird misses. Rebound secured by Shaquille Bane.

[08:25] Team_040 possession (Score: 6-10)
Dirk Johnson drives, Kawhi Thompson stays with him. Dirk Johnson attempts a Dunk. Contested by Kawhi Thompson (5.1 feet, MAN). DIRK JOHNSON MAKES IT!
Score: 6-12

[08:12] Team_062 possession (Score: 6-12)
Chris Bird loses control! Ball rolls out of bounds! TURNOVER! (dead ball)

[07:59] Team_040 possession (Score: 6-12)
Ayo Rose throws a bad pass! Stolen by Chris Bird! TURNOVER! (live ball)

[07:43] Team_062 possession (Score: 6-12)
Chris Bird attempts a 3Pt. Contested by Ayo Rose (4.8 feet, MAN). Chris Bird misses. Offensive rebound by Jalen Reaves! Jalen Reaves's putback is no good. Rebound secured by Dirk Johnson.

[07:31] Team_040 possession (Score: 6-12)
Shaquille Bane drives to the basket... Shaquille Bane throws a bad pass out of bounds! TURNOVER! (dead ball)

[07:22] Team_062 possession (Score: 6-12)
Jalen Reaves drives to the basket... Jalen Reaves throws a bad pass! Stolen by Bam Gobert! TURNOVER! (live ball)

[07:07] Team_040 possession (Score: 6-12)
Carmelo Murray attempts a Midrange. Contested by Michael Hyland (4.9 feet, MAN). Carmelo Murray misses. Offensive rebound by Bam Gobert! Bam Gobert kicks it out.

[06:56] Team_040 possession (Score: 6-12)
Bam Gobert drives, Jalen Reaves stays with him. Bam Gobert attempts a Layup. Contested by Jalen Reaves (5.2 feet, MAN). BAM GOBERT MAKES IT! Assist: Ayo Rose
Score: 6-14

[06:44] Team_062 possession (Score: 6-14)
Kawhi Thompson drives, Bam Gobert stays with him. Kawhi Thompson attempts a Dunk. Contested by Bam Gobert (3.9 feet, ZONE). Kawhi Thompson misses. Rebound secured by Bam Gobert.

[06:31] Team_040 possession (Score: 6-14)
Ayo Rose attempts a 3Pt. Contested by RJ Williamson (5.0 feet, ZONE). Ayo Rose misses. Rebound secured by Kawhi Thompson.

[06:14] Team_062 possession (Score: 6-14)
Chris Bird attempts a Midrange. Contested by Ayo Rose (4.8 feet, MAN). CHRIS BIRD MAKES IT! Assist: Michael Hyland
Score: 8-14

[06:02] Team_040 possession (Score: 8-14)
Dirk Johnson attempts a Layup. Contested by Kawhi Thompson (5.1 feet, MAN). Dirk Johnson misses. Rebound secured by Jalen Reaves.

[05:48] Team_062 possession (Score: 8-14)
Kawhi Thompson attempts a Midrange. Contested by Dirk Johnson (5.9 feet, MAN). Kawhi Thompson misses. Rebound secured by Bam Gobert.

[05:31] Team_040 possession (Score: 8-14)
Carmelo Murray drives, Jalen Reaves stays with him. Carmelo Murray attempts a Dunk. Contested by Jalen Reaves (5.3 feet, ZONE). Carmelo Murray misses. Rebound secured by Jalen Reaves.

[05:13] Team_062 possession (Score: 8-14)
Chris Bird attempts a Layup. Contested by Ayo Rose (4.8 feet, MAN). CHRIS BIRD MAKES IT! Assist: RJ Williamson
Score: 10-14

[05:00] Team_040 possession (Score: 10-14)
Bam Gobert makes the Dunk and draws the foul on Jalen Reaves! And-1! Bam Gobert to the line for 1. [Team fouls: 3] (Jalen Reaves: 1 personal fouls)   FT 1/1: GOOD Bam Gobert makes 1/1 from the line.
Score: 10-17

[04:42] Team_062 possession (Score: 10-17)
FOUL! Shooting foul on Ayo Rose. Chris Bird to the line for 2 free throws. [Team fouls: 1] (Ayo Rose: 1 personal fouls)   FT 1/2: GOOD   FT 2/2: MISS Chris Bird makes 1/2 from the line. Rebound secured by Bam Gobert.
Score: 11-17

[04:31] Team_040 possession (Score: 11-17)
Ayo Rose attempts a Midrange. Contested by Michael Hyland (5.4 feet, ZONE). AYO ROSE MAKES IT!
Score: 11-19

[04:17] Team_062 possession (Score: 11-19)
Jalen Reaves attempts a Midrange. Contested by Bam Gobert (4.2 feet, MAN). JALEN REAVES MAKES IT! Assist: Chris Bird
Score: 13-19

[04:02] Team_040 possession (Score: 13-19)
Ayo Rose loses the ball! Stripped by Chris Bird! TURNOVER! (live ball)

[03:48] Team_062 possession (Score: 13-19)
Jalen Reaves commits a violation (traveling/carry)! TURNOVER! (dead ball)

[03:31] Team_040 possession (Score: 13-19)
Bam Gobert attempts a Midrange. Contested by Jalen Reaves (5.4 feet, MAN). BAM GOBERT MAKES IT!
Score: 13-21

[03:17] Team_062 possession (Score: 13-21)
Chris Bird attempts a Midrange. Contested by Ayo Rose (5.0 feet, MAN). Chris Bird misses. Rebound secured by Bam Gobert.

[03:04] Team_040 possession (Score: 13-21)
Shaquille Bane attempts a Midrange. Contested by RJ Williamson (5.0 feet, MAN). Shaquille Bane misses. Rebound secured by Kawhi Thompson.

[02:50] Team_062 possession (Score: 13-21)
Michael Hyland attempts a 3Pt. Contested by Ayo Rose (4.8 feet, ZONE). Michael Hyland misses. Rebound secured by Dirk Johnson.

[02:37] Team_040 possession (Score: 13-21)
Ayo Rose loses control! Ball rolls out of bounds! TURNOVER! (dead ball)

[02:37] Substitution (Team_062): Chris Bird OUT → Paolo McCollum IN (stamina_rule2)

[02:37] Substitution (Team_062): RJ Williamson OUT → Tony LaVine IN (stamina_rule2)

[02:37] Substitution (Team_062): Michael Hyland OUT → Paul Poole IN (stamina_rule2)

[02:37] Substitution (Team_062): Kawhi Thompson OUT → RJ Wall IN (stamina_rule2)

[02:37] Substitution (Team_062): Jalen Reaves OUT → Devin Young IN (stamina_rule2)

[02:37] Substitution (Team_040): Ayo Rose OUT → Cole O'Neal IN (stamina_rule2)

[02:37] Substitution (Team_040): Shaquille Bane OUT → Tracy Middleton IN (stamina_rule2)

[02:37] Substitution (Team_040): Carmelo Murray OUT → Klay Leonard IN (stamina_rule2)

[02:37] Substitution (Team_040): Dirk Johnson OUT → RJ Curry IN (stamina_rule2)

[02:37] Substitution (Team_040): Bam Gobert OUT → Josh Banchero IN (stamina_rule2)

[02:18] Team_062 possession (Score: 13-21)
Devin Young attempts a Layup. Wide open! Josh Banchero is 6.3 feet away. [ZONE] DEVIN YOUNG MAKES IT! Assist: RJ Wall
Score: 15-21

[02:01] Team_040 possession (Score: 15-21)
Klay Leonard attempts a 3Pt. Contested by Paolo McCollum (5.4 feet, ZONE). Klay Leonard misses. Rebound secured by Paul Poole.

[01:48] Team_062 possession (Score: 15-21)
Devin Young drives, picks up Josh Banchero. Help arrives from Tracy Middleton! Devin Young attempts a Layup. Wide open! Tracy Middleton is 6.3 feet away. [MAN] DEVIN YOUNG MAKES IT! Assist: Paul Poole
Score: 17-21

[01:33] Team_040 possession (Score: 17-21)
Cole O'Neal drives and kicks out. Klay Leonard attempts a Midrange. Wide open! Paul Poole is 6.3 feet away. [ZONE] Klay Leonard misses. Rebound secured by Paul Poole.

[01:22] Team_062 possession (Score: 17-21)
Paolo McCollum drives and kicks out. Devin Young attempts a Midrange. BLOCKED BY JOSH BANCHERO! Ball goes out off Josh Banchero. Devin Young's ball!

[01:06] Team_062 possession (Score: 17-21)
Paul Poole attempts a Midrange. Contested by Klay Leonard (5.0 feet, MAN). Paul Poole misses. Offensive rebound by RJ Wall! RJ Wall kicks it out.

[00:55] Team_062 possession (Score: 17-21)
Tony LaVine drives and kicks out. RJ Wall attempts a Midrange. Contested by RJ Curry (4.9 feet, MAN). RJ Wall misses. Rebound secured by RJ Curry.

[00:35] Team_040 possession (Score: 17-21)
Josh Banchero makes the Midrange and draws the foul on Devin Young! And-1! Josh Banchero to the line for 1. [Team fouls: 4] (Devin Young: 1 personal fouls)   FT 1/1: GOOD Josh Banchero makes 1/1 from the line.
Score: 17-24

[00:22] Team_062 possession (Score: 17-24)
RJ Wall attempts a Midrange. Contested by RJ Curry (4.8 feet, MAN). RJ WALL MAKES IT! Assist: Paul Poole
Score: 19-24

[00:13] Team_040 possession (Score: 19-24)
RJ Curry loses control! Ball rolls out of bounds! TURNOVER! (dead ball)

================================================================================
                              1ST QUARTER COMPLETE                              
================================================================================

1ST QUARTER SCORE: Team_062 19, Team_040 24

BOX SCORE:
================================================================================

Team_062
--------------------------------------------------------------------------------
Player                MIN  PTS  REB  AST  TO      FG   FG%      3P   3P%
--------------------------------------------------------------------------------
Kawhi Thompson         10    4    2    1   0   2/4    50.0     0/0   0.0
Chris Bird             10    4    0    1   0   2/8    25.0     0/0   0.0
Devin Young             2    4    0    0   0   2/2   100.0     0/0   0.0
Jalen Reaves           10    2    3    0   0   1/1   100.0     0/0   0.0
Michael Hyland         10    2    0    1   0   1/2    50.0     0/0   0.0
RJ Wall                 2    2    1    1   0   1/1   100.0     0/0   0.0
RJ Williamson          10    0    0    2   0   0/0     0.0     0/0   0.0
Paul Poole              2    0    2    2   0   0/0     0.0     0/0   0.0
Tony LaVine             2    0    0    0   0   0/1     0.0     0/0   0.0

TEAM: FG: 9/19 (47.4%), 3PT: 0/4 (0.0%), REB: 10 (3 off, 7 def), AST: 8, TO: 4
TEAM FOULS: 4


Team_040
--------------------------------------------------------------------------------
Player                MIN  PTS  REB  AST  TO      FG   FG%      3P   3P%
--------------------------------------------------------------------------------
Carmelo Murray         10    7    0    0   0   3/5    60.0     0/0   0.0
Bam Gobert             10    7    7    0   0   3/3   100.0     0/0   0.0
Dirk Johnson           10    5    3    1   0   2/3    66.7     0/0   0.0
Josh Banchero           2    3    0    0   0   1/1   100.0     0/0   0.0
Ayo Rose               10    2    0    2   0   1/2    50.0     0/0   0.0
Shaquille Bane         10    0    2    1   0   0/1     0.0     0/0   0.0
Klay Leonard            2    0    0    0   0   0/1     0.0     0/0   0.0
Cole O'Neal             2    0    0    0   0   0/1     0.0     0/0   0.0
RJ Curry                2    0    1    0   0   0/0     0.0     0/0   0.0

TEAM: FG: 10/17 (58.8%), 3PT: 2/4 (50.0%), REB: 11 (3 off, 8 def), AST: 4, TO: 6
TEAM FOULS: 1

================================================================================

================================================================================
                       2ND QUARTER - Team_062 vs Team_040                       
================================================================================

[12:00] Team_062 possession (Score: 19-24)
FOUL! Shooting foul on Bam Gobert. Jalen Reaves to the line for 2 free throws. [Team fouls: 1] (Bam Gobert: 1 personal fouls)   FT 1/2: GOOD   FT 2/2: GOOD Jalen Reaves makes 2/2 from the line.
Score: 21-24

[11:48] Team_040 possession (Score: 21-24)
Dirk Johnson drives to the basket... Dirk Johnson loses control! Ball rolls out of bounds! TURNOVER! (dead ball)

[11:31] Team_062 possession (Score: 21-24)
FOUL! Holding foul on Carmelo Murray. [Team fouls: 2] No free throws, side out. (Carmelo Murray: 1 personal fouls)

[11:17] Team_062 possession (Score: 21-24)
Michael Hyland attempts a 3Pt. Contested by Ayo Rose (4.6 feet, ZONE). Michael Hyland misses. Rebound secured by Dirk Johnson.

[11:07] Team_040 possession (Score: 21-24)
Carmelo Murray attempts a Midrange. Contested by Michael Hyland (5.0 feet, MAN). Carmelo Murray misses. Rebound secured by Kawhi Thompson.

[10:52] Team_062 possession (Score: 21-24)
RJ Williamson attempts a 3Pt. Contested by Ayo Rose (4.4 feet, ZONE). RJ Williamson misses. Rebound secured by Dirk Johnson.

[10:42] Team_040 possession (Score: 21-24)
Dirk Johnson attempts a Midrange. Contested by RJ Williamson (4.7 feet, ZONE). Dirk Johnson misses. Rebound secured by Jalen Reaves.

[10:29] Team_062 possession (Score: 21-24)
RJ Williamson attempts a Layup. BLOCKED BY BAM GOBERT! Ball is loose! Offensive rebound by Jalen Reaves! Jalen Reaves kicks it out.

[10:12] Team_062 possession (Score: 21-24)
Kawhi Thompson attempts a Layup. Contested by Dirk Johnson (6.0 feet, MAN). KAWHI THOMPSON MAKES IT!
Score: 23-24

[10:01] Team_040 possession (Score: 23-24)
Ayo Rose attempts a 3Pt. Contested by Chris Bird (5.0 feet, MAN). Ayo Rose misses. Offensive rebound by Dirk Johnson! Dirk Johnson kicks it out.

[09:46] Team_040 possession (Score: 23-24)
Ayo Rose attempts a Midrange. Contested by Chris Bird (5.0 feet, MAN). Ayo Rose misses. Rebound secured by Jalen Reaves.

[09:29] Team_062 possession (Score: 23-24)
Jalen Reaves attempts a Midrange. Contested by Bam Gobert (4.3 feet, MAN). Jalen Reaves misses. Rebound secured by Dirk Johnson.

[09:11] Team_040 possession (Score: 23-24)
Dirk Johnson drives to the basket... Dirk Johnson throws a bad pass! Stolen by Jalen Reaves! TURNOVER! (live ball)

[09:00] Team_062 possession (Score: 23-24)
FOUL! Holding foul on Carmelo Murray. [Team fouls: 3] No free throws, side out. (Carmelo Murray: 2 personal fouls)

[08:43] Team_062 possession (Score: 23-24)
FOUL! Shooting foul on Bam Gobert. Michael Hyland to the line for 2 free throws. [Team fouls: 4] (Bam Gobert: 2 personal fouls)   FT 1/2: MISS   FT 2/2: MISS Michael Hyland makes 0/2 from the line. Offensive rebound by Jalen Reaves! Jalen Reaves kicks it out.

[08:33] Team_062 possession (Score: 23-24)
Michael Hyland attempts a 3Pt. Contested by Ayo Rose (4.9 feet, ZONE). Michael Hyland misses. FOUL! Loose ball foul on Shaquille Bane during the rebound battle. [IN THE BONUS! 5 team fouls] Kawhi Thompson to the line for 2 free throws. (Shaquille Bane: 1 personal fouls)   FT 1/2: GOOD   FT 2/2: GOOD Kawhi Thompson makes 2/2 from the line.
Score: 25-24

[08:19] Team_040 possession (Score: 25-24)
FOUL! Holding foul on Michael Hyland. [Team fouls: 1] No free throws, side out. (Michael Hyland: 1 personal fouls)

[08:03] Team_040 possession (Score: 25-24)
Shaquille Bane loses control! Ball rolls out of bounds! TURNOVER! (dead ball)

[08:03] Substitution (Team_062): Chris Bird OUT → Paolo McCollum IN (stamina_rule2)

[08:03] Substitution (Team_062): RJ Williamson OUT → Tony LaVine IN (stamina_rule2)

[08:03] Substitution (Team_062): Michael Hyland OUT → Paul Poole IN (stamina_rule2)

[08:03] Substitution (Team_062): Kawhi Thompson OUT → RJ Wall IN (stamina_rule2)

[08:03] Substitution (Team_062): Jalen Reaves OUT → Devin Young IN (stamina_rule2)

[08:03] Substitution (Team_040): Ayo Rose OUT → Cole O'Neal IN (stamina_rule2)

[08:03] Substitution (Team_040): Shaquille Bane OUT → Tracy Middleton IN (stamina_rule2)

[08:03] Substitution (Team_040): Carmelo Murray OUT → Klay Leonard IN (stamina_rule2)

[08:03] Substitution (Team_040): Dirk Johnson OUT → RJ Curry IN (stamina_rule2)

[08:03] Substitution (Team_040): Bam Gobert OUT → Josh Banchero IN (stamina_rule2)

[07:49] Team_062 possession (Score: 25-24)
Paul Poole attempts a Layup. Contested by Klay Leonard (5.0 feet, MAN). Paul Poole misses. FOUL! Loose ball foul on RJ Curry during the rebound battle. [IN THE BONUS! 6 team fouls] Devin Young to the line for 2 free throws. (RJ Curry: 1 personal fouls)   FT 1/2: GOOD   FT 2/2: GOOD Devin Young makes 2/2 from the line.
Score: 27-24

[07:31] Team_040 possession (Score: 27-24)
Klay Leonard attempts a Layup. Wide open! Paul Poole is 6.1 feet away. [MAN] KLAY LEONARD MAKES IT! Assist: Cole O'Neal
Score: 27-26

[07:15] Team_062 possession (Score: 27-26)
Tony LaVine drives and kicks out. RJ Wall attempts a 3Pt. Contested by RJ Curry (4.9 feet, ZONE). RJ Wall misses. Rebound secured by Klay Leonard.

[06:59] Team_040 possession (Score: 27-26)
Josh Banchero makes the Dunk and draws the foul on RJ Wall! And-1! Josh Banchero to the line for 1. [Team fouls: 2] (RJ Wall: 1 personal fouls)   FT 1/1: GOOD Josh Banchero makes 1/1 from the line.
Score: 27-29

[06:44] Team_062 possession (Score: 27-29)
Tony LaVine drives, Tracy Middleton stays with him. Tony LaVine attempts a Layup. Wide open! Tracy Middleton is 6.2 feet away. [MAN] TONY LAVINE MAKES IT! Assist: Devin Young
Score: 29-29

[06:26] Team_040 possession (Score: 29-29)
FOUL! Reach-in foul on RJ Wall during the drive. [Team fouls: 3] No free throws, side out. (RJ Wall: 2 personal fouls)

[06:12] Team_040 possession (Score: 29-29)
Cole O'Neal attempts a 3Pt. Contested by Paolo McCollum (5.6 feet, ZONE). Cole O'Neal misses. Offensive rebound by RJ Curry! RJ Curry kicks it out.

[06:01] Team_040 possession (Score: 29-29)
Cole O'Neal makes the Layup and draws the foul on RJ Wall! And-1! Cole O'Neal to the line for 1. [Team fouls: 4] (RJ Wall: 3 personal fouls)   FT 1/1: GOOD Cole O'Neal makes 1/1 from the line.
Score: 29-32

[05:47] Team_062 possession (Score: 29-32)
Devin Young drives, Josh Banchero stays with him. Devin Young attempts a Layup. Wide open! Josh Banchero is 6.3 feet away. [ZONE] Devin Young misses. Offensive rebound by Devin Young! Devin Young kicks it out.

[05:35] Team_062 possession (Score: 29-32)
Paolo McCollum attempts a 3Pt. Wide open! Cole O'Neal is 6.7 feet away. [MAN] Paolo McCollum misses. Rebound secured by Klay Leonard.

[05:21] Team_040 possession (Score: 29-32)
Cole O'Neal attempts a Midrange. Contested by Paolo McCollum (5.6 feet, MAN). Cole O'Neal misses. Offensive rebound by RJ Curry! RJ Curry kicks it out.

[05:10] Team_040 possession (Score: 29-32)
RJ Curry attempts a Midrange. Contested by RJ Wall (5.0 feet, ZONE). RJ Curry misses. Offensive rebound by RJ Curry! RJ Curry kicks it out.

[04:56] Team_040 possession (Score: 29-32)
Cole O'Neal attempts a Midrange. Contested by Paolo McCollum (5.6 feet, ZONE). COLE O'NEAL MAKES IT!
Score: 29-34

[04:42] Team_062 possession (Score: 29-34)
Paolo McCollum attempts a 3Pt. Contested by RJ Curry (5.1 feet, ZONE). Paolo McCollum misses. Rebound secured by Klay Leonard.

[04:28] Team_040 possession (Score: 29-34)
Klay Leonard attempts a 3Pt. Wide open! Paul Poole is 6.1 feet away. [MAN] KLAY LEONARD MAKES IT! Assist: RJ Curry
Score: 29-37

[04:13] Team_062 possession (Score: 29-37)
Paul Poole attempts a Midrange. Contested by Klay Leonard (5.0 feet, ZONE). PAUL POOLE MAKES IT! Assist: RJ Wall
Score: 31-37

[04:00] Team_040 possession (Score: 31-37)
RJ Curry attempts a Layup. Contested by RJ Wall (5.0 feet, MAN). RJ CURRY MAKES IT! Assist: Cole O'Neal
Score: 31-39

[03:42] Team_062 possession (Score: 31-39)
Devin Young attempts a Layup. Wide open! Josh Banchero is 6.3 feet away. [ZONE] DEVIN YOUNG MAKES IT! Assist: RJ Wall
Score: 33-39

[03:30] Team_040 possession (Score: 33-39)
Josh Banchero attempts a Layup. Wide open! Devin Young is 6.4 feet away. [MAN] JOSH BANCHERO MAKES IT! Assist: Cole O'Neal
Score: 33-41

[03:15] Team_062 possession (Score: 33-41)
Paolo McCollum attempts a 3Pt. Contested by RJ Curry (5.1 feet, ZONE). Paolo McCollum misses. Rebound secured by Klay Leonard.

[03:04] Team_040 possession (Score: 33-41)
Tracy Middleton attempts a Layup. Contested by RJ Wall (5.4 feet, ZONE). TRACY MIDDLETON MAKES IT!
Score: 33-43

[02:48] Team_062 possession (Score: 33-43)
Tony LaVine attempts a 3Pt. Contested by RJ Curry (5.2 feet, ZONE). Tony LaVine misses. Rebound secured by Josh Banchero.

[02:34] Team_040 possession (Score: 33-43)
Tracy Middleton drives, Tony LaVine stays with him. Tracy Middleton attempts a Dunk. Wide open! Tony LaVine is 6.1 feet away. [MAN] Tracy Middleton misses. Offensive rebound by Josh Banchero! Josh Banchero kicks it out.

[02:19] Team_040 possession (Score: 33-43)
Cole O'Neal attempts a 3Pt. Contested by Paolo McCollum (5.6 feet, MAN). Cole O'Neal misses. Rebound secured by RJ Wall.

[02:08] Team_062 possession (Score: 33-43)
Paul Poole attempts a 3Pt. Contested by Klay Leonard (5.0 feet, MAN). Paul Poole misses. Offensive rebound by Devin Young! Devin Young kicks it out.

[01:53] Team_062 possession (Score: 33-43)
Paul Poole drives to the basket... Paul Poole commits a violation (traveling/carry)! TURNOVER! (dead ball)

[01:38] Team_040 possession (Score: 33-43)
Cole O'Neal drives, Paolo McCollum stays with him. Cole O'Neal attempts a Dunk. Contested by Paolo McCollum (5.7 feet, MAN). COLE O'NEAL MAKES IT! Assist: Klay Leonard
Score: 33-45

[01:26] Team_062 possession (Score: 33-45)
FOUL! Holding foul on Cole O'Neal. [IN THE BONUS! 7 team fouls] Paolo McCollum to the line for 2 free throws. (Cole O'Neal: 1 personal fouls)   FT 1/2: GOOD   FT 2/2: GOOD Paolo McCollum makes 2/2 from the line.
Score: 35-45

[01:10] Team_040 possession (Score: 35-45)
Josh Banchero drives, Devin Young stays with him. Josh Banchero attempts a Layup. Wide open! Devin Young is 6.6 feet away. [MAN] Josh Banchero misses. Rebound secured by Devin Young.

[00:56] Team_062 possession (Score: 35-45)
Paolo McCollum attempts a Midrange. Wide open! Cole O'Neal is 6.8 feet away. [MAN] PAOLO MCCOLLUM MAKES IT!
Score: 37-45

[00:42] Team_040 possession (Score: 37-45)
Josh Banchero throws a bad pass out of bounds! TURNOVER! (dead ball)

[00:30] Team_062 possession (Score: 37-45)
RJ Wall makes the Layup and draws the foul on Josh Banchero! And-1! RJ Wall to the line for 1. [BONUS: 8 team fouls] (Josh Banchero: 1 personal fouls)   FT 1/1: MISS RJ Wall makes 0/1 from the line. Rebound secured by RJ Curry.
Score: 39-45

[00:12] Team_040 possession (Score: 39-45)
FOUL! Holding foul on RJ Wall. [IN THE BONUS! 5 team fouls] RJ Curry to the line for 2 free throws. (RJ Wall: 4 personal fouls)   FT 1/2: GOOD   FT 2/2: MISS RJ Curry makes 1/2 from the line. Rebound secured by RJ Wall.
Score: 39-46

================================================================================
                              2ND QUARTER COMPLETE                              
================================================================================

2ND QUARTER SCORE: Team_062 20, Team_040 22

BOX SCORE:
================================================================================

Team_062
--------------------------------------------------------------------------------
Player                MIN  PTS  REB  AST  TO      FG   FG%      3P   3P%
--------------------------------------------------------------------------------
Kawhi Thompson         14    4    1    0   0   2/2   100.0     0/0   0.0
Devin Young            10    4    3    1   0   2/2   100.0     0/0   0.0
Paolo McCollum         10    4    0    0   0   2/5    40.0     0/0   0.0
Jalen Reaves           14    2    4    0   0   1/2    50.0     0/0   0.0
Tony LaVine            10    2    0    0   0   1/3    33.3     0/0   0.0
Paul Poole             10    2    0    0   0   1/1   100.0     0/0   0.0
Michael Hyland         14    0    0    0   0   0/1     0.0     0/0   0.0
RJ Williamson          14    0    0    0   0   0/1     0.0     0/0   0.0
RJ Wall                10    0    2    2   0   0/1     0.0     0/0   0.0

TEAM: FG: 9/18 (50.0%), 3PT: 1/7 (14.3%), REB: 10 (4 off, 6 def), AST: 3, TO: 1
TEAM FOULS: 5 [Team_040 in BONUS]


Team_040
--------------------------------------------------------------------------------
Player                MIN  PTS  REB  AST  TO      FG   FG%      3P   3P%
--------------------------------------------------------------------------------
Cole O'Neal            10    7    0    3   0   3/4    75.0     0/0   0.0
Klay Leonard           10    5    4    1   0   2/2   100.0     0/0   0.0
Josh Banchero          10    5    2    0   0   2/3    66.7     0/0   0.0
RJ Curry               10    2    4    1   0   1/1   100.0     0/0   0.0
Tracy Middleton        10    2    0    0   0   1/1   100.0     0/0   0.0
Dirk Johnson           14    0    4    0   0   0/1     0.0     0/0   0.0
Carmelo Murray         14    0    0    0   0   0/1     0.0     0/0   0.0
Ayo Rose               14    0    0    0   0   0/1     0.0     0/0   0.0

TEAM: FG: 9/15 (60.0%), 3PT: 1/2 (50.0%), REB: 14 (5 off, 9 def), AST: 5, TO: 4
TEAM FOULS: 8 [Team_062 in BONUS]

================================================================================

================================================================================
                       3RD QUARTER - Team_062 vs Team_040                       
================================================================================

[12:00] Team_062 possession (Score: 39-46)
RJ Williamson drives and kicks out. Kawhi Thompson attempts a 3Pt. Contested by Dirk Johnson (5.8 feet, MAN). Kawhi Thompson misses. Rebound secured by Dirk Johnson.

[11:45] Team_040 possession (Score: 39-46)
Carmelo Murray makes the Layup and draws the foul on Jalen Reaves! And-1! Carmelo Murray to the line for 1. [Team fouls: 1] (Jalen Reaves: 1 personal fouls)   FT 1/1: GOOD Carmelo Murray makes 1/1 from the line.
Score: 39-49

[11:32] Team_062 possession (Score: 39-49)
FOUL! Holding foul on Bam Gobert. [Team fouls: 1] No free throws, side out. (Bam Gobert: 1 personal fouls)

[11:19] Team_062 possession (Score: 39-49)
Kawhi Thompson attempts a 3Pt. Contested by Carmelo Murray (4.5 feet, ZONE). Kawhi Thompson misses. Rebound secured by Bam Gobert.

[11:06] Team_040 possession (Score: 39-49)
Bam Gobert attempts a Layup. Contested by Jalen Reaves (5.2 feet, ZONE). Bam Gobert misses. Offensive rebound by Bam Gobert! Bam Gobert kicks it out.

[10:52] Team_040 possession (Score: 39-49)
FOUL! Offensive foul on Ayo Rose! Chris Bird drew the charge! [Team fouls: 2] (Ayo Rose: 1 personal fouls) TURNOVER! (dead ball)

[10:39] Team_062 possession (Score: 39-49)
Jalen Reaves drives, Bam Gobert stays with him. Jalen Reaves attempts a Layup. Contested by Bam Gobert (4.1 feet, ZONE). JALEN REAVES MAKES IT! Assist: Michael Hyland
Score: 41-49

[10:20] Team_040 possession (Score: 41-49)
Shaquille Bane makes the Layup and draws the foul on Jalen Reaves! And-1! Shaquille Bane to the line for 1. [Team fouls: 2] (Jalen Reaves: 2 personal fouls)   FT 1/1: MISS Shaquille Bane makes 0/1 from the line. Rebound secured by Michael Hyland.
Score: 41-51

[10:03] Team_062 possession (Score: 41-51)
Kawhi Thompson attempts a Midrange. Contested by Dirk Johnson (5.8 feet, ZONE). Kawhi Thompson misses. Rebound secured by Shaquille Bane.

[09:46] Team_040 possession (Score: 41-51)
Carmelo Murray attempts a Midrange. Contested by Kawhi Thompson (5.1 feet, ZONE). CARMELO MURRAY MAKES IT!
Score: 41-53

[09:34] Team_062 possession (Score: 41-53)
Chris Bird drives and kicks out. FOUL! Shooting foul on Bam Gobert. Jalen Reaves to the line for 2 free throws. [Team fouls: 3] (Bam Gobert: 2 personal fouls)   FT 1/2: GOOD   FT 2/2: GOOD Jalen Reaves makes 2/2 from the line.
Score: 43-53

[09:19] Team_040 possession (Score: 43-53)
FOUL! Shooting foul on Jalen Reaves. Dirk Johnson to the line for 2 free throws. [Team fouls: 3] (Jalen Reaves: 3 personal fouls)   FT 1/2: GOOD   FT 2/2: GOOD Dirk Johnson makes 2/2 from the line.
Score: 43-55

[08:59] Team_062 possession (Score: 43-55)
FOUL! Holding foul on Dirk Johnson. [Team fouls: 4] No free throws, side out. (Dirk Johnson: 1 personal fouls)

[08:42] Team_062 possession (Score: 43-55)
RJ Williamson attempts a Midrange. Contested by Dirk Johnson (5.5 feet, ZONE). RJ WILLIAMSON MAKES IT!
Score: 45-55

[08:26] Team_040 possession (Score: 45-55)
Carmelo Murray attempts a 3Pt. Contested by RJ Williamson (4.7 feet, ZONE). Carmelo Murray misses. Rebound secured by Jalen Reaves.

[08:12] Team_062 possession (Score: 45-55)
Chris Bird drives and kicks out. Chris Bird attempts a Midrange. Contested by Ayo Rose (4.6 feet, MAN). Chris Bird misses. Rebound secured by Shaquille Bane.

[07:57] Team_040 possession (Score: 45-55)
Dirk Johnson attempts a Midrange. Contested by Kawhi Thompson (5.1 feet, ZONE). Dirk Johnson misses. FOUL! Loose ball foul on Kawhi Thompson during the rebound battle. [Team fouls: 4] No free throws, side out. (Kawhi Thompson: 1 personal fouls)

[07:44] Team_040 possession (Score: 45-55)
Bam Gobert makes the Layup and draws the foul on Chris Bird! And-1! Bam Gobert to the line for 1. [BONUS: 5 team fouls] (Chris Bird: 1 personal fouls)   FT 1/1: GOOD Bam Gobert makes 1/1 from the line.
Score: 45-58

[07:29] Team_062 possession (Score: 45-58)
FOUL! Offensive foul on Kawhi Thompson! Dirk Johnson drew the charge! [Team fouls: 6] (Kawhi Thompson: 2 personal fouls) TURNOVER! (dead ball)

[07:16] Team_040 possession (Score: 45-58)
FOUL! Reach-in foul on Jalen Reaves during the drive. [IN THE BONUS! 7 team fouls] Bam Gobert to the line for 2 free throws. (Jalen Reaves: 4 personal fouls)   FT 1/2: MISS   FT 2/2: MISS Bam Gobert makes 0/2 from the line. Rebound secured by Michael Hyland.

[07:00] Team_062 possession (Score: 45-58)
Jalen Reaves drives, picks up Bam Gobert. Help arrives from Shaquille Bane! Jalen Reaves attempts a Dunk. Contested by Shaquille Bane (4.1 feet, MAN). JALEN REAVES MAKES IT! Assist: Michael Hyland
Score: 47-58

[06:43] Team_040 possession (Score: 47-58)
Carmelo Murray attempts a 3Pt. Contested by Chris Bird (4.5 feet, ZONE). Carmelo Murray misses. Offensive rebound by Bam Gobert! Bam Gobert kicks it out.

[06:24] Team_040 possession (Score: 47-58)
Dirk Johnson attempts a 3Pt. Contested by RJ Williamson (4.6 feet, ZONE). Dirk Johnson misses. Rebound secured by Michael Hyland.

[06:13] Team_062 possession (Score: 47-58)
Jalen Reaves attempts a Layup. Contested by Bam Gobert (4.1 feet, MAN). Jalen Reaves misses. Rebound secured by Dirk Johnson.

[05:59] Team_040 possession (Score: 47-58)
Dirk Johnson drives to the basket... Dirk Johnson throws a bad pass! Stolen by Jalen Reaves! TURNOVER! (live ball)

[05:45] Team_062 possession (Score: 47-58)
Kawhi Thompson makes the Layup and draws the foul on Dirk Johnson! And-1! Kawhi Thompson to the line for 1. [BONUS: 5 team fouls] (Dirk Johnson: 2 personal fouls)   FT 1/1: GOOD Kawhi Thompson makes 1/1 from the line.
Score: 50-58

[05:31] Team_040 possession (Score: 50-58)
Bam Gobert drives and kicks out. Shaquille Bane attempts a 3Pt. Contested by RJ Williamson (4.4 feet, MAN). SHAQUILLE BANE MAKES IT!
Score: 50-61

[05:16] Team_062 possession (Score: 50-61)
Jalen Reaves attempts a Midrange. Contested by Bam Gobert (4.1 feet, MAN). JALEN REAVES MAKES IT! Assist: Chris Bird
Score: 52-61

[04:59] Team_040 possession (Score: 52-61)
Ayo Rose attempts a 3Pt. Contested by Chris Bird (4.8 feet, MAN). Ayo Rose misses. Rebound secured by Kawhi Thompson.

[04:46] Team_062 possession (Score: 52-61)
Kawhi Thompson drives, picks up Dirk Johnson. Help arrives from Shaquille Bane! Kawhi Thompson attempts a Layup. Contested by Shaquille Bane (5.9 feet, MAN). KAWHI THOMPSON MAKES IT! Assist: Jalen Reaves
Score: 54-61

[04:35] Team_040 possession (Score: 54-61)
Ayo Rose attempts a 3Pt. Contested by Chris Bird (4.9 feet, MAN). Ayo Rose misses. Offensive rebound by Bam Gobert! Bam Gobert kicks it out.

[04:19] Team_040 possession (Score: 54-61)
Shaquille Bane attempts a Midrange. Contested by Kawhi Thompson (5.4 feet, ZONE). Shaquille Bane misses. Rebound secured by Kawhi Thompson.

[04:04] Team_062 possession (Score: 54-61)
Michael Hyland makes the Layup and draws the foul on Bam Gobert! And-1! Michael Hyland to the line for 1. [BONUS: 6 team fouls] (Bam Gobert: 3 personal fouls)   FT 1/1: GOOD Michael Hyland makes 1/1 from the line.
Score: 57-61

[03:51] Team_040 possession (Score: 57-61)
Dirk Johnson attempts a 3Pt. Contested by Kawhi Thompson (5.1 feet, MAN). Dirk Johnson misses. FOUL! Loose ball foul on Michael Hyland during the rebound battle. [IN THE BONUS! 8 team fouls] Dirk Johnson to the line for 2 free throws. (Michael Hyland: 1 personal fouls)   FT 1/2: GOOD   FT 2/2: GOOD Dirk Johnson makes 2/2 from the line.
Score: 57-63

[03:36] Team_062 possession (Score: 57-63)
Michael Hyland makes the Midrange and draws the foul on Carmelo Murray! And-1! Michael Hyland to the line for 1. [BONUS: 7 team fouls] (Carmelo Murray: 1 personal fouls)   FT 1/1: GOOD Michael Hyland makes 1/1 from the line.
Score: 60-63

[03:24] Team_040 possession (Score: 60-63)
Dirk Johnson attempts a Midrange. Contested by Jalen Reaves (5.3 feet, ZONE). Dirk Johnson misses. Rebound secured by Kawhi Thompson.

[03:10] Team_062 possession (Score: 60-63)
Chris Bird attempts a 3Pt. Contested by Ayo Rose (4.9 feet, MAN). CHRIS BIRD MAKES IT! Assist: RJ Williamson
Score: 63-63

[02:55] Team_040 possession (Score: 63-63)
Carmelo Murray drives and kicks out. Bam Gobert attempts a 3Pt. Contested by Jalen Reaves (5.2 feet, MAN). Bam Gobert misses. FOUL! Loose ball foul on Michael Hyland during the rebound battle. [IN THE BONUS! 9 team fouls] Bam Gobert to the line for 2 free throws. (Michael Hyland: 2 personal fouls)   FT 1/2: GOOD   FT 2/2: GOOD Bam Gobert makes 2/2 from the line.
Score: 63-65

[02:40] Team_062 possession (Score: 63-65)
FOUL! Holding foul on Shaquille Bane. [IN THE BONUS! 8 team fouls] RJ Williamson to the line for 2 free throws. (Shaquille Bane: 1 personal fouls)   FT 1/2: GOOD   FT 2/2: GOOD RJ Williamson makes 2/2 from the line.
Score: 65-65

[02:21] Team_040 possession (Score: 65-65)
Dirk Johnson drives to the basket... Dirk Johnson commits a violation (traveling/carry)! TURNOVER! (dead ball)

[02:21] Substitution (Team_062): RJ Williamson OUT → Tony LaVine IN (stamina_rule2)

[02:21] Substitution (Team_062): Michael Hyland OUT → Paul Poole IN (stamina_rule2)

[02:21] Substitution (Team_062): Kawhi Thompson OUT → RJ Wall IN (stamina_rule2)

[02:21] Substitution (Team_062): Jalen Reaves OUT → Devin Young IN (stamina_rule2)

[02:21] Substitution (Team_040): Ayo Rose OUT → Cole O'Neal IN (stamina_rule2)

[02:21] Substitution (Team_040): Shaquille Bane OUT → Tracy Middleton IN (stamina_rule2)

[02:21] Substitution (Team_040): Carmelo Murray OUT → Klay Leonard IN (stamina_rule2)

[02:21] Substitution (Team_040): Dirk Johnson OUT → RJ Curry IN (stamina_rule2)

[02:21] Substitution (Team_040): Bam Gobert OUT → Josh Banchero IN (stamina_rule2)

[02:09] Team_062 possession (Score: 65-65)
Tony LaVine attempts a Layup. Wide open! Tracy Middleton is 6.2 feet away. [MAN] TONY LAVINE MAKES IT! Assist: Chris Bird
Score: 67-65

[01:57] Team_040 possession (Score: 67-65)
Klay Leonard attempts a 3Pt. Contested by Tony LaVine (5.7 feet, ZONE). KLAY LEONARD MAKES IT! Assist: Cole O'Neal
Score: 67-68

[01:44] Team_062 possession (Score: 67-68)
Devin Young attempts a Layup. Wide open! Josh Banchero is 6.3 feet away. [MAN] Devin Young misses. Rebound secured by Josh Banchero.

[01:29] Team_040 possession (Score: 67-68)
Cole O'Neal attempts a Layup. Contested by Chris Bird (4.5 feet, MAN). Cole O'Neal misses. Rebound secured by RJ Wall.

[01:15] Team_062 possession (Score: 67-68)
Devin Young attempts a Layup. Wide open! Josh Banchero is 6.3 feet away. [ZONE] DEVIN YOUNG MAKES IT!
Score: 69-68

[01:01] Team_040 possession (Score: 69-68)
Cole O'Neal attempts a 3Pt. Contested by Chris Bird (4.6 feet, MAN). Cole O'Neal misses. Rebound secured by Paul Poole.

[00:47] Team_062 possession (Score: 69-68)
Paul Poole drives, picks up Klay Leonard. Help arrives from Tracy Middleton! Paul Poole attempts a Layup. Contested by Tracy Middleton (5.0 feet, MAN). Paul Poole misses. Rebound secured by Josh Banchero.

[00:30] Team_040 possession (Score: 69-68)
Tracy Middleton drives and kicks out. Tracy Middleton attempts a 3Pt. Contested by Tony LaVine (5.9 feet, MAN). TRACY MIDDLETON MAKES IT! Assist: RJ Curry
Score: 69-71

[00:16] Team_062 possession (Score: 69-71)
Paul Poole attempts a 3Pt. Contested by Klay Leonard (5.0 feet, MAN). PAUL POOLE MAKES IT! Assist: Tony LaVine
Score: 72-71

[00:02] Team_040 possession (Score: 72-71)
Josh Banchero makes the Layup and draws the foul on RJ Wall! And-1! Josh Banchero to the line for 1. [BONUS: 10 team fouls] (RJ Wall: 1 personal fouls)   FT 1/1: MISS Josh Banchero makes 0/1 from the line. Rebound secured by Devin Young.
Score: 72-73

================================================================================
                              3RD QUARTER COMPLETE                              
================================================================================

3RD QUARTER SCORE: Team_062 33, Team_040 27

BOX SCORE:
================================================================================

Team_062
--------------------------------------------------------------------------------
Player                MIN  PTS  REB  AST  TO      FG   FG%      3P   3P%
--------------------------------------------------------------------------------
Jalen Reaves           24    8    1    1   0   4/5    80.0     0/0   0.0
Michael Hyland         24    6    3    2   0   2/2   100.0     0/0   0.0
Kawhi Thompson         24    5    3    0   0   2/4    50.0     0/0   0.0
RJ Williamson          24    4    0    1   0   2/3    66.7     0/0   0.0
Chris Bird             26    3    0    2   0   1/2    50.0     0/0   0.0
Paul Poole             12    3    1    0   0   1/2    50.0     0/0   0.0
Tony LaVine            12    2    0    1   0   1/1   100.0     0/0   0.0
Devin Young            12    2    1    0   0   1/2    50.0     0/0   0.0
RJ Wall                12    0    1    0   0   0/0     0.0     0/0   0.0

TEAM: FG: 14/21 (66.7%), 3PT: 2/3 (66.7%), REB: 10 (0 off, 10 def), AST: 7, TO: 1
TEAM FOULS: 10 [Team_040 in BONUS]


Team_040
--------------------------------------------------------------------------------
Player                MIN  PTS  REB  AST  TO      FG   FG%      3P   3P%
--------------------------------------------------------------------------------
Carmelo Murray         24    5    0    0   0   2/3    66.7     0/0   0.0
Bam Gobert             24    5    5    0   0   2/3    66.7     0/0   0.0
Dirk Johnson           24    4    2    0   0   2/4    50.0     0/0   0.0
Shaquille Bane         24    3    2    0   0   1/3    33.3     0/0   0.0
Klay Leonard           12    3    0    0   0   1/1   100.0     0/0   0.0
Tracy Middleton        12    3    0    0   0   1/1   100.0     0/0   0.0
Ayo Rose               24    0    0    0   0   0/1     0.0     0/0   0.0
Cole O'Neal            12    0    0    1   0   0/2     0.0     0/0   0.0
Josh Banchero          12    0    2    0   0   0/1     0.0     0/0   0.0
RJ Curry               12    0    0    1   0   0/0     0.0     0/0   0.0

TEAM: FG: 9/19 (47.4%), 3PT: 2/6 (33.3%), REB: 11 (4 off, 7 def), AST: 2, TO: 3
TEAM FOULS: 8 [Team_062 in BONUS]

================================================================================

================================================================================
                       4TH QUARTER - Team_062 vs Team_040                       
================================================================================

[12:00] Team_062 possession (Score: 72-73)
Kawhi Thompson attempts a 3Pt. Contested by Dirk Johnson (5.9 feet, MAN). Kawhi Thompson misses. Rebound secured by Dirk Johnson.

[11:45] Team_040 possession (Score: 72-73)
Bam Gobert attempts a Midrange. Contested by RJ Williamson (4.7 feet, ZONE). Bam Gobert misses. Rebound secured by Kawhi Thompson.

[11:33] Team_062 possession (Score: 72-73)
Chris Bird attempts a 3Pt. Contested by Ayo Rose (4.8 feet, ZONE). Chris Bird misses. Offensive rebound by Kawhi Thompson! Kawhi Thompson kicks it out.

[11:23] Team_062 possession (Score: 72-73)
RJ Williamson attempts a 3Pt. Contested by Ayo Rose (4.4 feet, ZONE). RJ Williamson misses. Rebound secured by Bam Gobert.

[11:09] Team_040 possession (Score: 72-73)
FOUL! Reach-in foul on Chris Bird during the drive. [Team fouls: 1] No free throws, side out. (Chris Bird: 1 personal fouls)

[10:57] Team_040 possession (Score: 72-73)
Ayo Rose drives, Chris Bird stays with him. Ayo Rose attempts a Layup. Contested by Chris Bird (5.3 feet, MAN). Ayo Rose misses. Rebound secured by Michael Hyland.

[10:47] Team_062 possession (Score: 72-73)
FOUL! Shooting foul on Bam Gobert. Jalen Reaves to the line for 2 free throws. [Team fouls: 1] (Bam Gobert: 1 personal fouls)   FT 1/2: GOOD   FT 2/2: GOOD Jalen Reaves makes 2/2 from the line.
Score: 74-73

[10:30] Team_040 possession (Score: 74-73)
Shaquille Bane attempts a Midrange. Contested by RJ Williamson (5.0 feet, ZONE). SHAQUILLE BANE MAKES IT!
Score: 74-75

[10:13] Team_062 possession (Score: 74-75)
Jalen Reaves attempts a Midrange. Contested by Carmelo Murray (4.8 feet, ZONE). JALEN REAVES MAKES IT!
Score: 76-75

[09:55] Team_040 possession (Score: 76-75)
Bam Gobert drives, Jalen Reaves stays with him. Bam Gobert attempts a Dunk. Contested by Jalen Reaves (5.4 feet, ZONE). BAM GOBERT MAKES IT! Assist: Carmelo Murray
Score: 76-77

[09:42] Team_062 possession (Score: 76-77)
FOUL! Shooting foul on Carmelo Murray. Michael Hyland to the line for 2 free throws. [Team fouls: 2] (Carmelo Murray: 1 personal fouls)   FT 1/2: GOOD   FT 2/2: GOOD Michael Hyland makes 2/2 from the line.
Score: 78-77

[09:26] Team_040 possession (Score: 78-77)
Dirk Johnson loses control! Ball rolls out of bounds! TURNOVER! (dead ball)

[09:26] Substitution (Team_062): Chris Bird OUT → Paolo McCollum IN (stamina_rule2)

[09:26] Substitution (Team_062): Jalen Reaves OUT → Devin Young IN (stamina_rule2)

[09:26] Substitution (Team_040): Ayo Rose OUT → Cole O'Neal IN (stamina_rule2)

[09:09] Team_062 possession (Score: 78-77)
Paolo McCollum attempts a 3Pt. Wide open! Dirk Johnson is 6.3 feet away. [ZONE] Paolo McCollum misses. Rebound secured by Bam Gobert.

[08:55] Team_040 possession (Score: 78-77)
Cole O'Neal drives, picks up Paolo McCollum. Help arrives from Michael Hyland! Cole O'Neal attempts a Layup. Contested by Michael Hyland (5.6 feet, MAN). COLE O'NEAL MAKES IT! Assist: Bam Gobert
Score: 78-79

[08:40] Team_062 possession (Score: 78-79)
Michael Hyland attempts a 3Pt. Contested by Carmelo Murray (4.7 feet, MAN). Michael Hyland misses. Offensive rebound by Kawhi Thompson! Kawhi Thompson kicks it out.

[08:26] Team_062 possession (Score: 78-79)
FOUL! Reach-in foul on Dirk Johnson during the drive. [Team fouls: 3] No free throws, side out. (Dirk Johnson: 1 personal fouls)

[08:11] Team_062 possession (Score: 78-79)
Paolo McCollum attempts a Layup. Wide open! Cole O'Neal is 6.7 feet away. [MAN] PAOLO MCCOLLUM MAKES IT!
Score: 80-79

[07:56] Team_040 possession (Score: 80-79)
Carmelo Murray attempts a Midrange. Contested by Michael Hyland (5.3 feet, MAN). Carmelo Murray misses. Rebound secured by Kawhi Thompson.

[07:45] Team_062 possession (Score: 80-79)
RJ Williamson makes the Midrange and draws the foul on Shaquille Bane! And-1! RJ Williamson to the line for 1. [Team fouls: 4] (Shaquille Bane: 1 personal fouls)   FT 1/1: MISS RJ Williamson makes 0/1 from the line. Offensive rebound by Devin Young! Devin Young kicks it out.
Score: 82-79

[07:34] Team_062 possession (Score: 82-79)
FOUL! Shooting foul on Bam Gobert. Devin Young to the line for 2 free throws. [BONUS: 5 team fouls] (Bam Gobert: 2 personal fouls)   FT 1/2: GOOD   FT 2/2: GOOD Devin Young makes 2/2 from the line.
Score: 84-79

[07:24] Team_040 possession (Score: 84-79)
Dirk Johnson attempts a Midrange. Contested by Kawhi Thompson (5.4 feet, MAN). DIRK JOHNSON MAKES IT!
Score: 84-81

[07:11] Team_062 possession (Score: 84-81)
Devin Young drives, Bam Gobert stays with him. Devin Young attempts a Layup. Contested by Bam Gobert (4.9 feet, ZONE). Devin Young misses. Rebound secured by Shaquille Bane.

[06:57] Team_040 possession (Score: 84-81)
Dirk Johnson makes the Layup and draws the foul on Paolo McCollum! And-1! Dirk Johnson to the line for 1. [Team fouls: 2] (Paolo McCollum: 1 personal fouls)   FT 1/1: GOOD Dirk Johnson makes 1/1 from the line.
Score: 84-84

[06:45] Team_062 possession (Score: 84-84)
RJ Williamson drives, picks up Bam Gobert. Help arrives from Shaquille Bane! RJ Williamson attempts a Layup. Contested by Shaquille Bane (4.2 feet, ZONE). RJ Williamson misses. Rebound secured by Bam Gobert.

[06:30] Team_040 possession (Score: 84-84)
FOUL! Shooting foul on Paolo McCollum. Cole O'Neal to the line for 2 free throws. [Team fouls: 3] (Paolo McCollum: 2 personal fouls)   FT 1/2: GOOD   FT 2/2: GOOD Cole O'Neal makes 2/2 from the line.
Score: 84-86

[06:18] Team_062 possession (Score: 84-86)
Devin Young drives to the basket... Devin Young throws a bad pass out of bounds! TURNOVER! (dead ball)

[06:18] Substitution (Team_062): RJ Williamson OUT → Tony LaVine IN (stamina_rule2)

[06:18] Substitution (Team_062): Michael Hyland OUT → Paul Poole IN (stamina_rule2)

[06:18] Substitution (Team_062): Kawhi Thompson OUT → RJ Wall IN (stamina_rule2)

[06:18] Substitution (Team_040): Shaquille Bane OUT → Tracy Middleton IN (stamina_rule2)

[06:18] Substitution (Team_040): Carmelo Murray OUT → Klay Leonard IN (stamina_rule2)

[06:18] Substitution (Team_040): Dirk Johnson OUT → RJ Curry IN (stamina_rule2)

[06:18] Substitution (Team_040): Bam Gobert OUT → Josh Banchero IN (stamina_rule2)

[06:05] Team_040 possession (Score: 84-86)
RJ Curry attempts a Layup. Contested by RJ Wall (5.0 feet, MAN). RJ CURRY MAKES IT!
Score: 84-88

[05:50] Team_062 possession (Score: 84-88)
Paolo McCollum drives to the basket... Paolo McCollum loses the ball! Stripped by Cole O'Neal! TURNOVER! (live ball)

[05:36] Team_040 possession (Score: 84-88)
FOUL! Holding foul on Tony LaVine. [Team fouls: 4] No free throws, side out. (Tony LaVine: 1 personal fouls)

[05:21] Team_040 possession (Score: 84-88)
FOUL! Reach-in foul on RJ Wall during the drive. [IN THE BONUS! 5 team fouls] Josh Banchero to the line for 2 free throws. (RJ Wall: 1 personal fouls)   FT 1/2: GOOD   FT 2/2: GOOD Josh Banchero makes 2/2 from the line.
Score: 84-90

[05:08] Team_062 possession (Score: 84-90)
Tony LaVine attempts a 3Pt. Wide open! Tracy Middleton is 6.2 feet away. [MAN] Tony LaVine misses. Rebound secured by Klay Leonard.

[04:51] Team_040 possession (Score: 84-90)
Tracy Middleton drives to the basket... FOUL! Offensive foul on Tracy Middleton! Devin Young drew the charge! [Team fouls: 6] (Tracy Middleton: 1 personal fouls) TURNOVER! (dead ball)

[04:38] Team_062 possession (Score: 84-90)
Tony LaVine attempts a 3Pt. Wide open! Tracy Middleton is 6.2 feet away. [MAN] TONY LAVINE MAKES IT! Assist: Paul Poole
Score: 87-90

[04:25] Team_040 possession (Score: 87-90)
Klay Leonard attempts a 3Pt. Wide open! Paul Poole is 6.1 feet away. [ZONE] Klay Leonard misses. Rebound secured by RJ Wall.

[04:14] Team_062 possession (Score: 87-90)
Paul Poole attempts a Midrange. Contested by Tracy Middleton (5.9 feet, ZONE). Paul Poole misses. Rebound secured by Josh Banchero.

[04:02] Team_040 possession (Score: 87-90)
RJ Curry attempts a 3Pt. Contested by RJ Wall (5.0 feet, MAN). RJ CURRY MAKES IT! Assist: Cole O'Neal
Score: 87-93

[03:49] Team_062 possession (Score: 87-93)
Tony LaVine attempts a Midrange. Wide open! Tracy Middleton is 6.2 feet away. [MAN] Tony LaVine misses. Rebound secured by Josh Banchero.

[03:35] Team_040 possession (Score: 87-93)
Cole O'Neal attempts a 3Pt. Contested by Paolo McCollum (5.5 feet, MAN). COLE O'NEAL MAKES IT! Assist: RJ Curry
Score: 87-96

[03:22] Team_062 possession (Score: 87-96)
Tony LaVine drives and kicks out. Paolo McCollum makes the Midrange and draws the foul on Cole O'Neal! And-1! Paolo McCollum to the line for 1. [BONUS: 7 team fouls] (Cole O'Neal: 1 personal fouls)   FT 1/1: GOOD Paolo McCollum makes 1/1 from the line.
Score: 90-96

[03:05] Team_040 possession (Score: 90-96)
FOUL! Shooting foul on RJ Wall. Josh Banchero to the line for 2 free throws. [BONUS: 6 team fouls] (RJ Wall: 2 personal fouls)   FT 1/2: GOOD   FT 2/2: GOOD Josh Banchero makes 2/2 from the line.
Score: 90-98

[02:53] Team_062 possession (Score: 90-98)
Paolo McCollum drives to the basket... Paolo McCollum commits a violation (traveling/carry)! TURNOVER! (dead ball)

[02:35] Team_040 possession (Score: 90-98)
Klay Leonard attempts a 3Pt. Contested by RJ Wall (5.0 feet, ZONE). KLAY LEONARD MAKES IT! Assist: Tracy Middleton
Score: 90-101

[02:18] Team_062 possession (Score: 90-101)
FOUL! Reach-in foul on Klay Leonard during the drive. [IN THE BONUS! 8 team fouls] Paul Poole to the line for 2 free throws. (Klay Leonard: 1 personal fouls)   FT 1/2: GOOD   FT 2/2: GOOD Paul Poole makes 2/2 from the line.
Score: 92-101

[02:03] Team_040 possession (Score: 92-101)
RJ Curry attempts a Midrange. Wide open! Paul Poole is 6.1 feet away. [ZONE] RJ Curry misses. Rebound secured by Devin Young.

[01:50] Team_062 possession (Score: 92-101)
Tony LaVine attempts a Midrange. Wide open! Tracy Middleton is 6.2 feet away. [ZONE] TONY LAVINE MAKES IT!
Score: 94-101

[01:32] Team_040 possession (Score: 94-101)
Klay Leonard attempts a 3Pt. Wide open! Paul Poole is 6.1 feet away. [MAN] Klay Leonard misses. Rebound secured by RJ Wall.

[01:20] Team_062 possession (Score: 94-101)
Paolo McCollum loses the ball! Stripped by Cole O'Neal! TURNOVER! (live ball)

[01:10] Team_040 possession (Score: 94-101)
Tracy Middleton attempts a 3Pt. Wide open! Tony LaVine is 6.1 feet away. [ZONE] Tracy Middleton misses. Rebound secured by RJ Wall.

[00:58] Team_062 possession (Score: 94-101)
FOUL! Offensive foul on RJ Wall! RJ Curry drew the charge! [Team fouls: 7] (RJ Wall: 3 personal fouls) TURNOVER! (dead ball)

[00:43] Team_040 possession (Score: 94-101)
Josh Banchero drives and kicks out. RJ Curry attempts a 3Pt. Contested by Paolo McCollum (5.8 feet, ZONE). RJ Curry misses. Rebound secured by Devin Young.

[00:27] Team_062 possession (Score: 94-101)
Paolo McCollum attempts a Midrange. Wide open! Cole O'Neal is 6.9 feet away. [MAN] PAOLO MCCOLLUM MAKES IT! Assist: Paul Poole
Score: 96-101

[00:12] Team_040 possession (Score: 96-101)
Tracy Middleton attempts a Layup. Wide open! Tony LaVine is 6.2 feet away. [MAN] Tracy Middleton misses. Rebound secured by Paul Poole.

================================================================================
                              4TH QUARTER COMPLETE                              
================================================================================

4TH QUARTER SCORE: Team_062 24, Team_040 28

BOX SCORE:
================================================================================

Team_062
--------------------------------------------------------------------------------
Player                MIN  PTS  REB  AST  TO      FG   FG%      3P   3P%
--------------------------------------------------------------------------------
Paolo McCollum         19    7    0    0   0   3/4    75.0     0/0   0.0
Tony LaVine            19    5    0    0   0   2/4    50.0     0/0   0.0
Jalen Reaves           27    4    0    0   0   2/2   100.0     0/0   0.0
Michael Hyland         30    2    1    0   0   1/1   100.0     0/0   0.0
Devin Young            22    2    3    0   0   1/2    50.0     0/0   0.0
Paul Poole             19    2    1    2   0   1/2    50.0     0/0   0.0
Kawhi Thompson         30    0    4    0   0   0/1     0.0     0/0   0.0
RJ Williamson          30    0    0    0   0   0/2     0.0     0/0   0.0
RJ Wall                19    0    3    0   0   0/0     0.0     0/0   0.0

TEAM: FG: 10/18 (55.6%), 3PT: 1/5 (20.0%), REB: 12 (3 off, 9 def), AST: 2, TO: 5
TEAM FOULS: 7 [Team_040 in BONUS]


Team_040
--------------------------------------------------------------------------------
Player                MIN  PTS  REB  AST  TO      FG   FG%      3P   3P%
--------------------------------------------------------------------------------
Cole O'Neal            22    7    0    1   0   3/3   100.0     0/0   0.0
Dirk Johnson           30    5    1    0   0   2/2   100.0     0/0   0.0
RJ Curry               19    5    0    1   0   2/3    66.7     0/0   0.0
Josh Banchero          19    4    2    0   0   2/3    66.7     0/0   0.0
Klay Leonard           19    3    1    0   0   1/3    33.3     0/0   0.0
Bam Gobert             30    2    3    1   0   1/2    50.0     0/0   0.0
Shaquille Bane         30    2    1    0   0   1/1   100.0     0/0   0.0
Ayo Rose               27    0    0    0   0   0/1     0.0     0/0   0.0
Carmelo Murray         30    0    0    1   0   0/1     0.0     0/0   0.0
Tracy Middleton        19    0    0    1   0   0/2     0.0     0/0   0.0

TEAM: FG: 12/21 (57.1%), 3PT: 3/6 (50.0%), REB: 8 (0 off, 8 def), AST: 5, TO: 2
TEAM FOULS: 8 [Team_062 in BONUS]

================================================================================

================================================================================
                               FULL GAME COMPLETE                               
================================================================================

FINAL SCORE: Team_062 96, Team_040 101

SCORING BY QUARTER:
--------------------------------------------------------------------------------
Team                     Q1     Q2     Q3     Q4    FINAL
--------------------------------------------------------------------------------
Team_062                 19     20     33     24       96
Team_040                 24     22     27     28      101
--------------------------------------------------------------------------------

FULL GAME BOX SCORE:
================================================================================

Team_062
--------------------------------------------------------------------------------
Player                MIN  PTS  REB  AST  TO      FG   FG%      3P   3P%      FT STL BLK
--------------------------------------------------------------------------------
RJ Williamson          30    4    0    3   0   1/5    20.0   0/2     0.0   2/3     0   0
Michael Hyland         30   10    4    3   0   5/7    71.4   1/3    33.3   4/6     0   0
Kawhi Thompson         30   13   10    1   2   5/10   50.0   0/2     0.0   3/3     0   0
Chris Bird             29    7    0    3   1   4/11   36.4   1/4    25.0   1/2     2   0
Jalen Reaves           27   16    8    1   2   7/9    77.8   0/0     0.0   6/6     2   0
Devin Young            22   12    7    1   1   5/7    71.4   0/0     0.0   4/4     0   0
Paolo McCollum         19   11    0    0   3   3/7    42.9   0/4     0.0   3/3     0   0
Tony LaVine            19    9    0    1   0   5/10   50.0   1/3    33.3   0/0     0   0
Paul Poole             19    7    4    4   1   4/6    66.7   1/1   100.0   2/2     0   0
RJ Wall                19    2    7    3   1   1/2    50.0   0/0     0.0   0/1     0   0

TEAM: FG: 42/76 (55.3%), 3PT: 4/19 (21.1%), REB: 42 (10 off, 32 def), AST: 20, TO: 11


Team_040
--------------------------------------------------------------------------------
Player                MIN  PTS  REB  AST  TO      FG   FG%      3P   3P%      FT STL BLK
--------------------------------------------------------------------------------
Shaquille Bane         30    5    5    1   1   1/4    25.0   0/0     0.0   0/1     0   0
Carmelo Murray         30   12    0    1   2   6/11   54.5   1/2    50.0   1/1     0   0
Dirk Johnson           30   14   10    1   2   6/10   60.0   2/3    66.7   8/8     1   0
Bam Gobert             30   14   15    1   0   6/8    75.0   0/0     0.0   4/6     1   1
Ayo Rose               27    2    0    2   7   1/5    20.0   0/2     0.0   0/0     0   0
Cole O'Neal            22   14    0    5   0   6/10   60.0   1/3    33.3   3/3     2   0
Tracy Middleton        19    5    0    1   1   2/4    50.0   0/1     0.0   0/0     0   0
Klay Leonard           19   11    5    1   0   4/7    57.1   3/6    50.0   0/0     0   0
RJ Curry               19    7    5    3   1   3/4    75.0   1/1   100.0   1/2     0   0
Josh Banchero          19   12    6    0   1   5/8    62.5   0/0     0.0   6/7     0   1

TEAM: FG: 40/72 (55.6%), 3PT: 8/18 (44.4%), REB: 44 (12 off, 32 def), AST: 16, TO: 15

================================================================================
