================================================================================
                        FULL GAME - Team_090 vs Team_054                        
================================================================================

================================================================================
                       1ST QUARTER - Team_090 vs Team_054                       
================================================================================

[12:00] Team_090 possession (Score: 0-0)
Gary Brogdon attempts a 3Pt. Contested by Luka Brogdon (4.2 feet, MAN). Gary Brogdon misses. Rebound secured by Lauri Irving.

[11:43] Team_054 possession (Score: 0-0)
Malcolm Harden attempts a Midrange. Contested by Derrick Mitchell (3.5 feet, MAN). MALCOLM HARDEN MAKES IT! Assist: Blake Russell
Score: 0-2

[11:29] Team_090 possession (Score: 0-2)
Larry Bridges drives and kicks out. Larry Bridges attempts a Midrange. Contested by Blake Russell (3.0 feet, ZONE). LARRY BRIDGES MAKES IT! Assist: Tracy Adebayo
Score: 2-2

[11:13] Team_054 possession (Score: 2-2)
Vince Ball drives, Gary Brogdon stays with him. Vince Ball attempts a Dunk. Contested by Gary Brogdon (3.7 feet, ZONE). Vince Ball misses. Rebound secured by Zach Wall.

[10:57] Team_090 possession (Score: 2-2)
FOUL! Holding foul on Malcolm Harden. [Team fouls: 1] No free throws, side out. (Malcolm Harden: 1 personal fouls)

[10:41] Team_090 possession (Score: 2-2)
Gary Brogdon drives and kicks out. Larry Bridges attempts a 3Pt. Contested by Lauri Irving (3.4 feet, ZONE). Larry Bridges misses. Offensive rebound by Gary Brogdon! Gary Brogdon kicks it out.

[10:23] Team_090 possession (Score: 2-2)
Tracy Adebayo drives and kicks out. Gary Brogdon attempts a Midrange. Contested by Luka Brogdon (4.0 feet, ZONE). Gary Brogdon misses. Rebound secured by Luka Brogdon.

[10:08] Team_054 possession (Score: 2-2)
Lauri Irving attempts a 3Pt. Contested by Derrick Mitchell (3.8 feet, ZONE). Lauri Irving misses. Rebound secured by Tracy Adebayo.

[09:54] Team_090 possession (Score: 2-2)
Gary Brogdon drives to the basket... Gary Brogdon throws a bad pass! Stolen by Blake Russell! TURNOVER! (live ball)

[09:38] Team_054 possession (Score: 2-2)
Lauri Irving attempts a 3Pt. Contested by Derrick Mitchell (3.8 feet, ZONE). Lauri Irving misses. Rebound secured by Zach Wall.

[09:24] Team_090 possession (Score: 2-2)
Tracy Adebayo throws a bad pass! Stolen by Blake Russell! TURNOVER! (live ball)

[09:12] Team_054 possession (Score: 2-2)
FOUL! Holding foul on Larry Bridges. [Team fouls: 1] No free throws, side out. (Larry Bridges: 1 personal fouls)

[08:59] Team_054 possession (Score: 2-2)
Blake Russell makes the Dunk and draws the foul on Larry Bridges! And-1! Blake Russell to the line for 1. [Team fouls: 2] (Larry Bridges: 2 personal fouls)   FT 1/1: MISS Blake Russell makes 0/1 from the line. FOUL! Loose ball foul on Zach Wall during the free throw rebound! [Team fouls: 3] No free throws, side out. (Zach Wall: 1 personal fouls)
Score: 2-4

[08:44] Team_054 possession (Score: 2-4)
Luka Brogdon attempts a 3Pt. Contested by Derrick Mitchell (3.6 feet, ZONE). Luka Brogdon misses. FOUL! Loose ball foul on Gary Brogdon during the rebound battle. [Team fouls: 4] No free throws, side out. (Gary Brogdon: 1 personal fouls)

[08:28] Team_054 possession (Score: 2-4)
FOUL! Reach-in foul on Gary Brogdon during the drive. [IN THE BONUS! 5 team fouls] Blake Russell to the line for 2 free throws. (Gary Brogdon: 2 personal fouls)   FT 1/2: MISS   FT 2/2: MISS Blake Russell makes 0/2 from the line. Offensive rebound by Blake Russell! Blake Russell puts it back in!
Score: 2-6

[08:19] Team_090 possession (Score: 2-6)
Gary Brogdon attempts a Layup. Contested by Blake Russell (3.2 feet, ZONE). GARY BROGDON MAKES IT! Assist: Larry Bridges
Score: 4-6

[08:05] Team_054 possession (Score: 4-6)
Vince Ball attempts a 3Pt. Contested by Derrick Mitchell (3.4 feet, ZONE). Vince Ball misses. Rebound secured by Tracy Adebayo.

[07:51] Team_090 possession (Score: 4-6)
Zach Wall attempts a Layup. Contested by Vince Ball (4.4 feet, MAN). ZACH WALL MAKES IT! Assist: Larry Bridges
Score: 6-6

[07:38] Team_054 possession (Score: 6-6)
Luka Brogdon attempts a Midrange. Contested by Gary Brogdon (4.0 feet, MAN). LUKA BROGDON MAKES IT! Assist: Malcolm Harden
Score: 6-8

[07:19] Team_090 possession (Score: 6-8)
Gary Brogdon attempts a Midrange. Contested by Luka Brogdon (4.2 feet, ZONE). Gary Brogdon misses. Rebound secured by Lauri Irving.

[07:08] Team_054 possession (Score: 6-8)
Luka Brogdon drives and kicks out. Malcolm Harden attempts a 3Pt. Contested by Derrick Mitchell (3.2 feet, ZONE). Malcolm Harden misses. Rebound secured by Tracy Adebayo.

[06:50] Team_090 possession (Score: 6-8)
Larry Bridges attempts a Midrange. Contested by Lauri Irving (3.5 feet, MAN). LARRY BRIDGES MAKES IT!
Score: 8-8

[06:34] Team_054 possession (Score: 8-8)
Lauri Irving attempts a 3Pt. Contested by Derrick Mitchell (3.8 feet, ZONE). Lauri Irving misses. Offensive rebound by Luka Brogdon! Luka Brogdon kicks it out.

[06:15] Team_054 possession (Score: 8-8)
Lauri Irving drives, picks up Larry Bridges. Help arrives from Zach Wall! Lauri Irving attempts a Layup. Contested by Zach Wall (5.3 feet, MAN). LAURI IRVING MAKES IT!
Score: 8-10

[06:02] Team_090 possession (Score: 8-10)
Derrick Mitchell throws a bad pass out of bounds! TURNOVER! (dead ball)

[05:49] Team_054 possession (Score: 8-10)
Vince Ball attempts a 3Pt. Contested by Zach Wall (5.1 feet, MAN). Vince Ball misses. Rebound secured by Zach Wall.

[05:35] Team_090 possession (Score: 8-10)
FOUL! Reach-in foul on Blake Russell during the drive. [Team fouls: 2] No free throws, side out. (Blake Russell: 1 personal fouls)

[05:21] Team_090 possession (Score: 8-10)
Tracy Adebayo attempts a Layup. Contested by Luka Brogdon (3.8 feet, ZONE). TRACY ADEBAYO MAKES IT! Assist: Larry Bridges
Score: 10-10

[05:08] Team_054 possession (Score: 10-10)
Malcolm Harden attempts a 3Pt. Contested by Derrick Mitchell (3.5 feet, ZONE). Malcolm Harden misses. Rebound secured by Tracy Adebayo.

[04:50] Team_090 possession (Score: 10-10)
Zach Wall attempts a 3Pt. Contested by Lauri Irving (3.7 feet, ZONE). Zach Wall misses. Offensive rebound by Tracy Adebayo! Tracy Adebayo kicks it out.

[04:38] Team_090 possession (Score: 10-10)
Zach Wall drives and kicks out. Zach Wall attempts a 3Pt. Contested by Vince Ball (4.1 feet, MAN). Zach Wall misses. Rebound secured by Luka Brogdon.

[04:22] Team_054 possession (Score: 10-10)
Vince Ball attempts a 3Pt. Contested by Derrick Mitchell (3.4 feet, ZONE). VINCE BALL MAKES IT! Assist: Lauri Irving
Score: 10-13

[04:10] Team_090 possession (Score: 10-13)
FOUL! Reach-in foul on Lauri Irving during the drive. [Team fouls: 3] No free throws, side out. (Lauri Irving: 1 personal fouls)

[04:00] Team_090 possession (Score: 10-13)
Gary Brogdon makes the Dunk and draws the foul on Luka Brogdon! And-1! Gary Brogdon to the line for 1. [Team fouls: 4] (Luka Brogdon: 1 personal fouls)   FT 1/1: GOOD Gary Brogdon makes 1/1 from the line.
Score: 13-13

[03:50] Team_054 possession (Score: 13-13)
Luka Brogdon attempts a 3Pt. Contested by Larry Bridges (5.2 feet, ZONE). LUKA BROGDON MAKES IT! Assist: Blake Russell
Score: 13-16

[03:33] Team_090 possession (Score: 13-16)
Zach Wall drives and kicks out. Zach Wall attempts a 3Pt. Contested by Lauri Irving (3.6 feet, ZONE). ZACH WALL MAKES IT! Assist: Gary Brogdon
Score: 16-16

[03:16] Team_054 possession (Score: 16-16)
Vince Ball attempts a 3Pt. Contested by Zach Wall (5.2 feet, MAN). Vince Ball misses. Rebound secured by Gary Brogdon.

[03:04] Team_090 possession (Score: 16-16)
Larry Bridges attempts a Layup. Contested by Lauri Irving (3.7 feet, MAN). LARRY BRIDGES MAKES IT! Assist: Tracy Adebayo
Score: 18-16

[02:51] Team_054 possession (Score: 18-16)
Luka Brogdon drives, picks up Gary Brogdon. Help arrives from Larry Bridges! Luka Brogdon attempts a Dunk. Contested by Larry Bridges (4.3 feet, ZONE). LUKA BROGDON MAKES IT!
Score: 18-18

[02:37] Team_090 possession (Score: 18-18)
Derrick Mitchell drives, picks up Malcolm Harden. Help arrives from Lauri Irving! Derrick Mitchell attempts a Layup. Contested by Lauri Irving (4.7 feet, MAN). DERRICK MITCHELL MAKES IT! Assist: Gary Brogdon
Score: 20-18

[02:20] Team_054 possession (Score: 20-18)
FOUL! Shooting foul on Tracy Adebayo. Blake Russell to the line for 2 free throws. [BONUS: 6 team fouls] (Tracy Adebayo: 1 personal fouls)   FT 1/2: GOOD   FT 2/2: GOOD Blake Russell makes 2/2 from the line.
Score: 20-20

[02:06] Team_090 possession (Score: 20-20)
FOUL! Shooting foul on Vince Ball. Zach Wall to the line for 2 free throws. [BONUS: 5 team fouls] (Vince Ball: 1 personal fouls)   FT 1/2: GOOD   FT 2/2: GOOD Zach Wall makes 2/2 from the line.
Score: 22-20

[01:53] Team_054 possession (Score: 22-20)
Vince Ball attempts a 3Pt. Contested by Derrick Mitchell (3.6 feet, ZONE). VINCE BALL MAKES IT! Assist: Lauri Irving
Score: 22-23

[01:38] Team_090 possession (Score: 22-23)
Larry Bridges attempts a 3Pt. Contested by Lauri Irving (3.8 feet, MAN). LARRY BRIDGES MAKES IT!
Score: 25-23

[01:28] Team_054 possession (Score: 25-23)
Luka Brogdon makes the Dunk and draws the foul on Larry Bridges! And-1! Luka Brogdon to the line for 1. [BONUS: 7 team fouls] (Larry Bridges: 3 personal fouls)   FT 1/1: GOOD Luka Brogdon makes 1/1 from the line.
Score: 25-26

[01:11] Team_090 possession (Score: 25-26)
Gary Brogdon attempts a Midrange. Contested by Luka Brogdon (4.5 feet, ZONE). Gary Brogdon misses. Offensive rebound by Zach Wall! Zach Wall kicks it out.

[00:56] Team_090 possession (Score: 25-26)
Larry Bridges attempts a Midrange. Contested by Luka Brogdon (4.4 feet, ZONE). Larry Bridges misses. Rebound secured by Blake Russell.

[00:40] Team_054 possession (Score: 25-26)
Luka Brogdon attempts a Midrange. Contested by Larry Bridges (5.4 feet, ZONE). Luka Brogdon misses. Rebound secured by Zach Wall.

[00:28] Team_090 possession (Score: 25-26)
Larry Bridges drives and kicks out. Larry Bridges attempts a 3Pt. Contested by Lauri Irving (4.0 feet, MAN). Larry Bridges misses. Offensive rebound by Tracy Adebayo! Tracy Adebayo kicks it out.

[00:12] Team_090 possession (Score: 25-26)
Gary Brogdon attempts a Midrange. Contested by Vince Ball (4.6 feet, ZONE). Gary Brogdon misses. Offensive rebound by Tracy Adebayo! Tracy Adebayo kicks it out.

================================================================================
                              1ST QUARTER COMPLETE                              
================================================================================

1ST QUARTER SCORE: Team_090 25, Team_054 26

BOX SCORE:
================================================================================

Team_090
--------------------------------------------------------------------------------
Player                MIN  PTS  REB  AST  TO      FG   FG%      3P   3P%
--------------------------------------------------------------------------------
Larry Bridges          12    9    0    3   0   4/5    80.0     0/0   0.0
Zach Wall              12    7    5    0   0   3/4    75.0     0/0   0.0
Gary Brogdon           12    5    2    2   0   2/4    50.0     0/0   0.0
Tracy Adebayo          12    2    7    2   0   1/2    50.0     0/0   0.0
Derrick Mitchell       12    2    0    0   0   1/1   100.0     0/0   0.0

TEAM: FG: 11/16 (68.8%), 3PT: 1/2 (50.0%), REB: 14 (5 off, 9 def), AST: 7, TO: 3
TEAM FOULS: 7 [Team_054 in BONUS]


Team_054
--------------------------------------------------------------------------------
Player                MIN  PTS  REB  AST  TO      FG   FG%      3P   3P%
--------------------------------------------------------------------------------
Luka Brogdon           12   10    4    0   0   4/6    66.7     0/0   0.0
Vince Ball             12    6    0    0   0   2/6    33.3     0/0   0.0
Blake Russell          12    4    2    2   0   2/2   100.0     0/0   0.0
Lauri Irving           12    2    2    2   0   1/3    33.3     0/0   0.0
Malcolm Harden         12    2    0    1   0   1/2    50.0     0/0   0.0

TEAM: FG: 10/19 (52.6%), 3PT: 3/9 (33.3%), REB: 8 (3 off, 5 def), AST: 5, TO: 0
TEAM FOULS: 5 [Team_090 in BONUS]

================================================================================

================================================================================
                       2ND QUARTER - Team_090 vs Team_054                       
================================================================================

[12:00] Team_090 possession (Score: 25-26)
Tracy Adebayo drives and kicks out. Gary Brogdon attempts a 3Pt. Contested by Lauri Irving (3.7 feet, ZONE). Gary Brogdon misses. Rebound secured by Vince Ball.

[11:40] Team_054 possession (Score: 25-26)
Blake Russell attempts a Midrange. Contested by Tracy Adebayo (5.6 feet, MAN). Blake Russell misses. Rebound secured by Tracy Adebayo.

[11:26] Team_090 possession (Score: 25-26)
Zach Wall attempts a Midrange. Contested by Malcolm Harden (4.7 feet, ZONE). ZACH WALL MAKES IT!
Score: 27-26

[11:12] Team_054 possession (Score: 27-26)
Malcolm Harden attempts a Midrange. Contested by Zach Wall (5.5 feet, ZONE). MALCOLM HARDEN MAKES IT! Assist: Vince Ball
Score: 27-28

[11:00] Team_090 possession (Score: 27-28)
Larry Bridges attempts a Layup. Contested by Blake Russell (3.6 feet, ZONE). LARRY BRIDGES MAKES IT!
Score: 29-28

[10:43] Team_054 possession (Score: 29-28)
Blake Russell drives, Gary Brogdon stays with him. Blake Russell attempts a Dunk. Contested by Gary Brogdon (4.7 feet, ZONE). BLAKE RUSSELL MAKES IT! Assist: Malcolm Harden
Score: 29-30

[10:29] Team_090 possession (Score: 29-30)
Derrick Mitchell makes the Dunk and draws the foul on Lauri Irving! And-1! Derrick Mitchell to the line for 1. [Team fouls: 1] (Lauri Irving: 1 personal fouls)   FT 1/1: MISS Derrick Mitchell makes 0/1 from the line. Rebound secured by Blake Russell.
Score: 31-30

[10:14] Team_054 possession (Score: 31-30)
Lauri Irving drives and kicks out. Lauri Irving attempts a Midrange. Contested by Larry Bridges (5.2 feet, MAN). LAURI IRVING MAKES IT! Assist: Malcolm Harden
Score: 31-32

[09:57] Team_090 possession (Score: 31-32)
Tracy Adebayo drives and kicks out. Larry Bridges attempts a Midrange. Contested by Lauri Irving (4.0 feet, MAN). Larry Bridges misses. Rebound secured by Blake Russell.

[09:45] Team_054 possession (Score: 31-32)
Vince Ball attempts a 3Pt. Contested by Derrick Mitchell (3.8 feet, ZONE). Vince Ball misses. Rebound secured by Zach Wall.

[09:32] Team_090 possession (Score: 31-32)
Gary Brogdon drives and kicks out. Derrick Mitchell attempts a Midrange. Contested by Malcolm Harden (4.8 feet, MAN). DERRICK MITCHELL MAKES IT! Assist: Gary Brogdon
Score: 33-32

[09:16] Team_054 possession (Score: 33-32)
FOUL! Offensive foul on Blake Russell! Tracy Adebayo drew the charge! [Team fouls: 2] (Blake Russell: 1 personal fouls) TURNOVER! (dead ball)

[09:00] Team_090 possession (Score: 33-32)
Gary Brogdon attempts a Midrange. Contested by Luka Brogdon (4.6 feet, ZONE). Gary Brogdon misses. Rebound secured by Vince Ball.

[08:44] Team_054 possession (Score: 33-32)
Blake Russell attempts a 3Pt. Contested by Derrick Mitchell (4.1 feet, ZONE). Blake Russell misses. Offensive rebound by Blake Russell! Blake Russell's putback is no good. Rebound secured by Gary Brogdon.

[08:30] Team_090 possession (Score: 33-32)
Larry Bridges drives and kicks out. Derrick Mitchell attempts a Midrange. Contested by Malcolm Harden (4.9 feet, MAN). Derrick Mitchell misses. Rebound secured by Vince Ball.

[08:20] Team_054 possession (Score: 33-32)
Lauri Irving commits a violation (traveling/carry)! TURNOVER! (dead ball)

[08:20] Substitution (Team_090): Derrick Mitchell OUT → OG Anunoby IN (stamina_rule2)

[08:20] Substitution (Team_090): Larry Bridges OUT → Josh Wall IN (stamina_rule2)

[08:20] Substitution (Team_090): Zach Wall OUT → Russell Smith IN (stamina_rule2)

[08:20] Substitution (Team_090): Gary Brogdon OUT → Derrick Nowitzki IN (stamina_rule2)

[08:20] Substitution (Team_090): Tracy Adebayo OUT → Tobias Tatum IN (stamina_rule2)

[08:20] Substitution (Team_054): Malcolm Harden OUT → Shaquille Irving IN (stamina_rule2)

[08:20] Substitution (Team_054): Lauri Irving OUT → Bradley Quickley IN (stamina_rule2)

[08:20] Substitution (Team_054): Vince Ball OUT → Vince James IN (stamina_rule2)

[08:20] Substitution (Team_054): Luka Brogdon OUT → Tobias Nowitzki IN (stamina_rule2)

[08:20] Substitution (Team_054): Blake Russell OUT → Devin Jackson IN (stamina_rule2)

[08:05] Team_090 possession (Score: 33-32)
Derrick Nowitzki throws a bad pass! Stolen by Tobias Nowitzki! TURNOVER! (live ball)

[07:50] Team_054 possession (Score: 33-32)
Vince James throws a bad pass out of bounds! TURNOVER! (dead ball)

[07:35] Team_090 possession (Score: 33-32)
Tobias Tatum drives, Devin Jackson stays with him. Tobias Tatum attempts a Layup. Wide open! Devin Jackson is 6.0 feet away. [MAN] TOBIAS TATUM MAKES IT! Assist: Derrick Nowitzki
Score: 35-32

[07:19] Team_054 possession (Score: 35-32)
Tobias Nowitzki attempts a 3Pt. Contested by Derrick Nowitzki (4.3 feet, MAN). TOBIAS NOWITZKI MAKES IT! Assist: Devin Jackson
Score: 35-35

[07:08] Team_090 possession (Score: 35-35)
Russell Smith drives, Vince James stays with him. Russell Smith attempts a Dunk. Contested by Vince James (5.2 feet, MAN). Russell Smith misses. Offensive rebound by Russell Smith! Russell Smith kicks it out.

[06:55] Team_090 possession (Score: 35-35)
Josh Wall attempts a 3Pt. Contested by Shaquille Irving (5.0 feet, ZONE). Josh Wall misses. Rebound secured by Tobias Nowitzki.

[06:38] Team_054 possession (Score: 35-35)
Bradley Quickley attempts a 3Pt. Contested by Russell Smith (4.0 feet, ZONE). BRADLEY QUICKLEY MAKES IT! Assist: Shaquille Irving
Score: 35-38

[06:27] Team_090 possession (Score: 35-38)
FOUL! Shooting foul on Vince James. Russell Smith to the line for 3 free throws. [Team fouls: 3] (Vince James: 1 personal fouls)   FT 1/3: GOOD   FT 2/3: MISS   FT 3/3: GOOD Russell Smith makes 2/3 from the line.
Score: 37-38

[06:16] Team_054 possession (Score: 37-38)
Shaquille Irving attempts a 3Pt. Contested by OG Anunoby (5.5 feet, MAN). SHAQUILLE IRVING MAKES IT! Assist: Tobias Nowitzki
Score: 37-41

[05:59] Team_090 possession (Score: 37-41)
Tobias Tatum drives and kicks out. OG Anunoby attempts a 3Pt. Contested by Shaquille Irving (4.6 feet, MAN). OG Anunoby misses. Rebound secured by Tobias Nowitzki.

[05:47] Team_054 possession (Score: 37-41)
Bradley Quickley throws a bad pass! Stolen by Josh Wall! TURNOVER! (live ball)

[05:32] Team_090 possession (Score: 37-41)
Josh Wall makes the Midrange and draws the foul on Bradley Quickley! And-1! Josh Wall to the line for 1. [Team fouls: 4] (Bradley Quickley: 1 personal fouls)   FT 1/1: GOOD Josh Wall makes 1/1 from the line.
Score: 40-41

[05:17] Team_054 possession (Score: 40-41)
Bradley Quickley drives to the basket... Bradley Quickley loses control! Ball rolls out of bounds! TURNOVER! (dead ball)

[05:03] Team_090 possession (Score: 40-41)
FOUL! Shooting foul on Shaquille Irving. OG Anunoby to the line for 2 free throws. [BONUS: 5 team fouls] (Shaquille Irving: 1 personal fouls)   FT 1/2: MISS   FT 2/2: GOOD OG Anunoby makes 1/2 from the line.
Score: 41-41

[04:50] Team_054 possession (Score: 41-41)
Tobias Nowitzki drives and kicks out. Vince James makes the Midrange and draws the foul on Russell Smith! And-1! Vince James to the line for 1. [Team fouls: 1] (Russell Smith: 1 personal fouls)   FT 1/1: GOOD Vince James makes 1/1 from the line.
Score: 41-44

[04:37] Team_090 possession (Score: 41-44)
OG Anunoby attempts a 3Pt. Contested by Shaquille Irving (4.7 feet, MAN). OG Anunoby misses. FOUL! Loose ball foul on Vince James during the rebound battle. [IN THE BONUS! 6 team fouls] Russell Smith to the line for 2 free throws. (Vince James: 2 personal fouls)   FT 1/2: GOOD   FT 2/2: MISS Russell Smith makes 1/2 from the line. Rebound secured by Tobias Nowitzki.
Score: 42-44

[04:19] Team_054 possession (Score: 42-44)
Tobias Nowitzki attempts a Midrange. Contested by Derrick Nowitzki (4.3 feet, ZONE). TOBIAS NOWITZKI MAKES IT! Assist: Devin Jackson
Score: 42-46

[04:05] Team_090 possession (Score: 42-46)
Russell Smith attempts a Midrange. Contested by Vince James (5.2 feet, MAN). Russell Smith misses. Rebound secured by Vince James.

[03:48] Team_054 possession (Score: 42-46)
Devin Jackson attempts a Layup. Contested by Derrick Nowitzki (4.5 feet, ZONE). DEVIN JACKSON MAKES IT!
Score: 42-48

[03:32] Team_090 possession (Score: 42-48)
Russell Smith attempts a Layup. Contested by Vince James (5.2 feet, MAN). RUSSELL SMITH MAKES IT!
Score: 44-48

[03:18] Team_054 possession (Score: 44-48)
Bradley Quickley attempts a Midrange. Contested by Josh Wall (3.8 feet, MAN). Bradley Quickley misses. Rebound secured by Tobias Tatum.

[03:03] Team_090 possession (Score: 44-48)
Russell Smith attempts a 3Pt. Contested by Shaquille Irving (4.9 feet, ZONE). Russell Smith misses. FOUL! Loose ball foul on Vince James during the rebound battle. [IN THE BONUS! 7 team fouls] Russell Smith to the line for 2 free throws. (Vince James: 3 personal fouls)   FT 1/2: MISS   FT 2/2: GOOD Russell Smith makes 1/2 from the line.
Score: 45-48

[02:48] Team_054 possession (Score: 45-48)
Tobias Nowitzki attempts a 3Pt. Contested by Russell Smith (4.3 feet, ZONE). Tobias Nowitzki misses. Offensive rebound by Vince James! Vince James kicks it out.

[02:32] Team_054 possession (Score: 45-48)
Tobias Nowitzki attempts a Layup. Contested by Derrick Nowitzki (4.3 feet, MAN). TOBIAS NOWITZKI MAKES IT! Assist: Vince James
Score: 45-50

[02:15] Team_090 possession (Score: 45-50)
Russell Smith makes the Midrange and draws the foul on Vince James! And-1! Russell Smith to the line for 1. [BONUS: 8 team fouls] (Vince James: 4 personal fouls)   FT 1/1: GOOD Russell Smith makes 1/1 from the line.
Score: 48-50

[02:01] Team_054 possession (Score: 48-50)
Devin Jackson drives and kicks out. Bradley Quickley attempts a 3Pt. Contested by Russell Smith (4.3 feet, ZONE). Bradley Quickley misses. Rebound secured by Russell Smith.

[01:42] Team_090 possession (Score: 48-50)
OG Anunoby makes the Layup and draws the foul on Shaquille Irving! And-1! OG Anunoby to the line for 1. [BONUS: 9 team fouls] (Shaquille Irving: 2 personal fouls)   FT 1/1: GOOD OG Anunoby makes 1/1 from the line.
Score: 51-50

[01:27] Team_054 possession (Score: 51-50)
Bradley Quickley attempts a 3Pt. Contested by Josh Wall (3.8 feet, MAN). BRADLEY QUICKLEY MAKES IT! Assist: Tobias Nowitzki
Score: 51-53

[01:15] Team_090 possession (Score: 51-53)
Derrick Nowitzki makes the Layup and draws the foul on Devin Jackson! And-1! Derrick Nowitzki to the line for 1. [BONUS: 10 team fouls] (Devin Jackson: 1 personal fouls)   FT 1/1: MISS Derrick Nowitzki makes 0/1 from the line. Rebound secured by Tobias Nowitzki.
Score: 53-53

[01:01] Team_054 possession (Score: 53-53)
FOUL! Holding foul on Russell Smith. [Team fouls: 2] No free throws, side out. (Russell Smith: 2 personal fouls)

[00:50] Team_054 possession (Score: 53-53)
Devin Jackson drives, Tobias Tatum stays with him. Devin Jackson attempts a Layup. Contested by Tobias Tatum (4.8 feet, MAN). Devin Jackson misses. Rebound secured by Russell Smith.

[00:33] Team_090 possession (Score: 53-53)
Derrick Nowitzki drives and kicks out. OG Anunoby attempts a 3Pt. Contested by Shaquille Irving (4.7 feet, ZONE). OG ANUNOBY MAKES IT! Assist: Tobias Tatum
Score: 56-53

[00:19] Team_054 possession (Score: 56-53)
Vince James attempts a 3Pt. Contested by Russell Smith (5.2 feet, ZONE). VINCE JAMES MAKES IT! Assist: Tobias Nowitzki
Score: 56-56

[00:06] Team_090 possession (Score: 56-56)
Russell Smith throws a bad pass! Stolen by Vince James! TURNOVER! (live ball)

================================================================================
                              2ND QUARTER COMPLETE                              
================================================================================

2ND QUARTER SCORE: Team_090 31, Team_054 30

BOX SCORE:
================================================================================

Team_090
--------------------------------------------------------------------------------
Player                MIN  PTS  REB  AST  TO      FG   FG%      3P   3P%
--------------------------------------------------------------------------------
Russell Smith           8    8    3    0   0   4/5    80.0     0/0   0.0
OG Anunoby              8    7    0    0   0   3/4    75.0     0/0   0.0
Josh Wall               8    3    0    0   0   1/2    50.0     0/0   0.0
Zach Wall              16    2    1    0   0   1/1   100.0     0/0   0.0
Larry Bridges          16    2    0    0   0   1/2    50.0     0/0   0.0
Derrick Mitchell       16    2    0    0   0   1/2    50.0     0/0   0.0
Tobias Tatum            8    2    1    1   0   1/2    50.0     0/0   0.0
Tracy Adebayo          16    0    1    0   0   0/2     0.0     0/0   0.0
Derrick Nowitzki        8    0    0    1   0   0/1     0.0     0/0   0.0

TEAM: FG: 12/22 (54.5%), 3PT: 2/4 (50.0%), REB: 7 (2 off, 5 def), AST: 3, TO: 2
TEAM FOULS: 2


Team_054
--------------------------------------------------------------------------------
Player                MIN  PTS  REB  AST  TO      FG   FG%      3P   3P%
--------------------------------------------------------------------------------
Tobias Nowitzki         8    7    4    3   0   3/3   100.0     0/0   0.0
Bradley Quickley        8    6    0    0   0   2/3    66.7     0/0   0.0
Vince James             8    6    2    1   0   2/2   100.0     0/0   0.0
Shaquille Irving        8    3    0    1   0   1/1   100.0     0/0   0.0
Blake Russell          16    2    2    0   0   1/3    33.3     0/0   0.0
Malcolm Harden         16    2    0    2   0   1/1   100.0     0/0   0.0
Lauri Irving           16    2    0    0   0   1/1   100.0     0/0   0.0
Devin Jackson           8    2    0    2   0   1/3    33.3     0/0   0.0
Vince Ball             16    0    3    1   0   0/1     0.0     0/0   0.0
Gary Brogdon           16    0    1    1   0   0/1     0.0     0/0   0.0

TEAM: FG: 12/18 (66.7%), 3PT: 5/7 (71.4%), REB: 11 (2 off, 9 def), AST: 10, TO: 5
TEAM FOULS: 10 [Team_090 in BONUS]

================================================================================

================================================================================
                       3RD QUARTER - Team_090 vs Team_054                       
================================================================================

[12:00] Team_090 possession (Score: 56-56)
Tracy Adebayo drives and kicks out. Gary Brogdon attempts a Midrange. Contested by Luka Brogdon (4.0 feet, MAN). GARY BROGDON MAKES IT!
Score: 58-56

[11:46] Team_054 possession (Score: 58-56)
FOUL! Reach-in foul on Tracy Adebayo during the drive. [Team fouls: 1] No free throws, side out. (Tracy Adebayo: 1 personal fouls)

[11:33] Team_054 possession (Score: 58-56)
Lauri Irving attempts a 3Pt. Contested by Derrick Mitchell (3.8 feet, ZONE). Lauri Irving misses. Rebound secured by Gary Brogdon.

[11:18] Team_090 possession (Score: 58-56)
Larry Bridges attempts a 3Pt. Contested by Lauri Irving (3.5 feet, ZONE). Larry Bridges misses. Rebound secured by Luka Brogdon.

[11:01] Team_054 possession (Score: 58-56)
Malcolm Harden attempts a Midrange. Contested by Derrick Mitchell (3.5 feet, MAN). Malcolm Harden misses. Offensive rebound by Blake Russell! Blake Russell's putback is no good. Offensive rebound by Luka Brogdon! Luka Brogdon kicks it out.

[10:42] Team_054 possession (Score: 58-56)
Luka Brogdon drives, picks up Gary Brogdon. Help arrives from Larry Bridges! Luka Brogdon attempts a Layup. Contested by Larry Bridges (4.0 feet, ZONE). LUKA BROGDON MAKES IT!
Score: 58-58

[10:27] Team_090 possession (Score: 58-58)
Larry Bridges drives to the basket... Larry Bridges throws a bad pass out of bounds! TURNOVER! (dead ball)

[10:15] Team_054 possession (Score: 58-58)
Lauri Irving attempts a 3Pt. Contested by Larry Bridges (5.3 feet, MAN). LAURI IRVING MAKES IT! Assist: Malcolm Harden
Score: 58-61

[10:03] Team_090 possession (Score: 58-61)
Larry Bridges attempts a 3Pt. Contested by Lauri Irving (3.5 feet, ZONE). Larry Bridges misses. Rebound secured by Luka Brogdon.

[09:48] Team_054 possession (Score: 58-61)
FOUL! Shooting foul on Tracy Adebayo. Blake Russell to the line for 2 free throws. [Team fouls: 2] (Tracy Adebayo: 2 personal fouls)   FT 1/2: MISS   FT 2/2: GOOD Blake Russell makes 1/2 from the line.
Score: 58-62

[09:35] Team_090 possession (Score: 58-62)
Larry Bridges attempts a Midrange. Contested by Lauri Irving (3.5 feet, MAN). Larry Bridges misses. Rebound secured by Blake Russell.

[09:23] Team_054 possession (Score: 58-62)
FOUL! Reach-in foul on Tracy Adebayo during the drive. [Team fouls: 3] No free throws, side out. (Tracy Adebayo: 3 personal fouls)

[09:11] Team_054 possession (Score: 58-62)
Vince Ball throws a bad pass! Stolen by Zach Wall! TURNOVER! (live ball)

[08:56] Team_090 possession (Score: 58-62)
Gary Brogdon attempts a Midrange. Contested by Luka Brogdon (4.2 feet, MAN). Gary Brogdon misses. Rebound secured by Blake Russell.

[08:43] Team_054 possession (Score: 58-62)
FOUL! Holding foul on Larry Bridges. [Team fouls: 4] No free throws, side out. (Larry Bridges: 1 personal fouls)

[08:31] Team_054 possession (Score: 58-62)
Blake Russell attempts a 3Pt. Contested by Derrick Mitchell (3.7 feet, ZONE). Blake Russell misses. Offensive rebound by Blake Russell! Blake Russell's putback is no good. Offensive rebound by Luka Brogdon! Luka Brogdon kicks it out.

[08:17] Team_054 possession (Score: 58-62)
Lauri Irving attempts a Midrange. Contested by Gary Brogdon (4.1 feet, ZONE). Lauri Irving misses. Rebound secured by Zach Wall.

[08:02] Team_090 possession (Score: 58-62)
Tracy Adebayo attempts a Layup. BLOCKED BY LAURI IRVING! Ball is loose! Rebound secured by Lauri Irving.

[07:47] Team_054 possession (Score: 58-62)
Lauri Irving attempts a 3Pt. Contested by Derrick Mitchell (3.8 feet, ZONE). Lauri Irving misses. Rebound secured by Gary Brogdon.

[07:35] Team_090 possession (Score: 58-62)
FOUL! Shooting foul on Lauri Irving. Gary Brogdon to the line for 3 free throws. [Team fouls: 1] (Lauri Irving: 1 personal fouls)   FT 1/3: GOOD   FT 2/3: GOOD   FT 3/3: MISS Gary Brogdon makes 2/3 from the line. Rebound secured by Luka Brogdon.
Score: 60-62

[07:22] Team_054 possession (Score: 60-62)
Vince Ball attempts a 3Pt. Contested by Derrick Mitchell (3.4 feet, ZONE). VINCE BALL MAKES IT! Assist: Lauri Irving
Score: 60-65

[07:06] Team_090 possession (Score: 60-65)
Gary Brogdon attempts a 3Pt. Contested by Luka Brogdon (4.2 feet, MAN). Gary Brogdon misses. Rebound secured by Lauri Irving.

[06:54] Team_054 possession (Score: 60-65)
Malcolm Harden attempts a 3Pt. Contested by Derrick Mitchell (3.5 feet, ZONE). MALCOLM HARDEN MAKES IT! Assist: Vince Ball
Score: 60-68

[06:39] Team_090 possession (Score: 60-68)
Gary Brogdon makes the Layup and draws the foul on Luka Brogdon! And-1! Gary Brogdon to the line for 1. [Team fouls: 2] (Luka Brogdon: 1 personal fouls)   FT 1/1: GOOD Gary Brogdon makes 1/1 from the line.
Score: 63-68

[06:22] Team_054 possession (Score: 63-68)
Vince Ball attempts a 3Pt. Contested by Zach Wall (5.1 feet, MAN). Vince Ball misses. Rebound secured by Tracy Adebayo.

[06:04] Team_090 possession (Score: 63-68)
Gary Brogdon throws a bad pass! Stolen by Luka Brogdon! TURNOVER! (live ball)

[05:50] Team_054 possession (Score: 63-68)
Blake Russell attempts a 3Pt. Contested by Derrick Mitchell (3.7 feet, ZONE). Blake Russell misses. Rebound secured by Tracy Adebayo.

[05:36] Team_090 possession (Score: 63-68)
Tracy Adebayo makes the Layup and draws the foul on Blake Russell! And-1! Tracy Adebayo to the line for 1. [Team fouls: 3] (Blake Russell: 1 personal fouls)   FT 1/1: GOOD Tracy Adebayo makes 1/1 from the line.
Score: 66-68

[05:18] Team_054 possession (Score: 66-68)
Lauri Irving attempts a 3Pt. Contested by Derrick Mitchell (3.8 feet, ZONE). Lauri Irving misses. Rebound secured by Zach Wall.

[04:58] Team_090 possession (Score: 66-68)
Zach Wall attempts a Midrange. Contested by Vince Ball (4.4 feet, ZONE). ZACH WALL MAKES IT! Assist: Gary Brogdon
Score: 68-68

[04:40] Team_054 possession (Score: 68-68)
FOUL! Holding foul on Gary Brogdon. [IN THE BONUS! 6 team fouls] Luka Brogdon to the line for 2 free throws. (Gary Brogdon: 2 personal fouls)   FT 1/2: GOOD   FT 2/2: GOOD Luka Brogdon makes 2/2 from the line.
Score: 68-70

[04:26] Team_090 possession (Score: 68-70)
Zach Wall makes the Layup and draws the foul on Vince Ball! And-1! Zach Wall to the line for 1. [Team fouls: 4] (Vince Ball: 1 personal fouls)   FT 1/1: GOOD Zach Wall makes 1/1 from the line.
Score: 71-70

[04:08] Team_054 possession (Score: 71-70)
Malcolm Harden attempts a Midrange. Contested by Derrick Mitchell (3.5 feet, MAN). Malcolm Harden misses. Rebound secured by Gary Brogdon.

[03:51] Team_090 possession (Score: 71-70)
Zach Wall attempts a 3Pt. Contested by Lauri Irving (3.8 feet, ZONE). Zach Wall misses. Rebound secured by Vince Ball.

[03:39] Team_054 possession (Score: 71-70)
FOUL! Shooting foul on Gary Brogdon. Luka Brogdon to the line for 2 free throws. [BONUS: 7 team fouls] (Gary Brogdon: 3 personal fouls)   FT 1/2: MISS   FT 2/2: GOOD Luka Brogdon makes 1/2 from the line.
Score: 71-71

[03:25] Team_090 possession (Score: 71-71)
Zach Wall attempts a 3Pt. Contested by Lauri Irving (3.8 feet, ZONE). Zach Wall misses. Rebound secured by Vince Ball.

[03:14] Team_054 possession (Score: 71-71)
Malcolm Harden attempts a 3Pt. Contested by Derrick Mitchell (3.6 feet, ZONE). Malcolm Harden misses. Offensive rebound by Blake Russell! Blake Russell puts it back in!
Score: 71-73

[02:59] Team_090 possession (Score: 71-73)
Larry Bridges drives to the basket... FOUL! Offensive foul on Larry Bridges! Blake Russell drew the charge! [Team fouls: 8] (Larry Bridges: 2 personal fouls) TURNOVER! (dead ball)

[02:42] Team_054 possession (Score: 71-73)
Malcolm Harden attempts a 3Pt. Contested by Derrick Mitchell (3.6 feet, ZONE). MALCOLM HARDEN MAKES IT! Assist: Lauri Irving
Score: 71-76

[02:27] Team_090 possession (Score: 71-76)
Tracy Adebayo attempts a Midrange. Contested by Blake Russell (3.2 feet, MAN). TRACY ADEBAYO MAKES IT! Assist: Gary Brogdon
Score: 73-76

[02:12] Team_054 possession (Score: 73-76)
Lauri Irving attempts a 3Pt. Contested by Larry Bridges (5.5 feet, MAN). LAURI IRVING MAKES IT! Assist: Blake Russell
Score: 73-79

[01:54] Team_090 possession (Score: 73-79)
Larry Bridges attempts a 3Pt. Contested by Lauri Irving (3.8 feet, ZONE). Larry Bridges misses. Rebound secured by Blake Russell.

[01:40] Team_054 possession (Score: 73-79)
FOUL! Offensive foul on Malcolm Harden! Derrick Mitchell drew the charge! [Team fouls: 5] (Malcolm Harden: 1 personal fouls) TURNOVER! (dead ball)

[01:28] Team_090 possession (Score: 73-79)
Gary Brogdon attempts a 3Pt. Contested by Lauri Irving (3.9 feet, ZONE). GARY BROGDON MAKES IT! Assist: Derrick Mitchell
Score: 76-79

[01:14] Team_054 possession (Score: 76-79)
Luka Brogdon drives and kicks out. Malcolm Harden attempts a 3Pt. Contested by Derrick Mitchell (3.6 feet, MAN). Malcolm Harden misses. Rebound secured by Gary Brogdon.

[01:01] Team_090 possession (Score: 76-79)
Tracy Adebayo attempts a Midrange. Contested by Luka Brogdon (4.1 feet, ZONE). Tracy Adebayo misses. Offensive rebound by Tracy Adebayo! Tracy Adebayo kicks it out.

[00:42] Team_090 possession (Score: 76-79)
Zach Wall attempts a Midrange. Contested by Vince Ball (4.6 feet, ZONE). ZACH WALL MAKES IT! Assist: Derrick Mitchell
Score: 78-79

[00:24] Team_054 possession (Score: 78-79)
Luka Brogdon drives, Gary Brogdon stays with him. Luka Brogdon attempts a Dunk. Contested by Gary Brogdon (4.6 feet, ZONE). LUKA BROGDON MAKES IT! Assist: Blake Russell
Score: 78-81

[00:07] Team_090 possession (Score: 78-81)
Larry Bridges attempts a Midrange. Contested by Lauri Irving (4.0 feet, ZONE). Larry Bridges misses. Rebound secured by Vince Ball.

================================================================================
                              3RD QUARTER COMPLETE                              
================================================================================

3RD QUARTER SCORE: Team_090 22, Team_054 25

BOX SCORE:
================================================================================

Team_090
--------------------------------------------------------------------------------
Player                MIN  PTS  REB  AST  TO      FG   FG%      3P   3P%
--------------------------------------------------------------------------------
Gary Brogdon           28    8    4    2   0   3/6    50.0     0/0   0.0
Zach Wall              28    7    2    0   0   3/5    60.0     0/0   0.0
Tracy Adebayo          28    5    3    0   0   2/3    66.7     0/0   0.0
Larry Bridges          28    0    0    0   0   0/5     0.0     0/0   0.0
Derrick Mitchell       28    0    0    2   0   0/0     0.0     0/0   0.0

TEAM: FG: 8/19 (42.1%), 3PT: 1/8 (12.5%), REB: 9 (1 off, 8 def), AST: 4, TO: 3
TEAM FOULS: 8 [Team_054 in BONUS]


Team_054
--------------------------------------------------------------------------------
Player                MIN  PTS  REB  AST  TO      FG   FG%      3P   3P%
--------------------------------------------------------------------------------
Luka Brogdon           28    7    5    0   0   4/5    80.0     0/0   0.0
Lauri Irving           28    6    2    2   0   2/6    33.3     0/0   0.0
Malcolm Harden         28    6    0    1   0   2/3    66.7     0/0   0.0
Blake Russell          28    3    4    2   0   2/3    66.7     0/0   0.0
Vince Ball             28    3    3    1   0   1/2    50.0     0/0   0.0

TEAM: FG: 11/19 (57.9%), 3PT: 6/11 (54.5%), REB: 14 (3 off, 11 def), AST: 6, TO: 2
TEAM FOULS: 5 [Team_090 in BONUS]

================================================================================

================================================================================
                       4TH QUARTER - Team_090 vs Team_054                       
================================================================================

[12:00] Team_090 possession (Score: 78-81)
Larry Bridges attempts a 3Pt. Contested by Lauri Irving (3.7 feet, ZONE). Larry Bridges misses. FOUL! Loose ball foul on Vince Ball during the rebound battle. [Team fouls: 1] No free throws, side out. (Vince Ball: 1 personal fouls)

[11:45] Team_090 possession (Score: 78-81)
Zach Wall attempts a 3Pt. Contested by Vince Ball (4.5 feet, MAN). Zach Wall misses. Rebound secured by Vince Ball.

[11:31] Team_054 possession (Score: 78-81)
Lauri Irving attempts a 3Pt. Contested by Larry Bridges (5.5 feet, MAN). Lauri Irving misses. Rebound secured by Gary Brogdon.

[11:17] Team_090 possession (Score: 78-81)
Tracy Adebayo drives, picks up Blake Russell. Help arrives from Lauri Irving! Tracy Adebayo attempts a Layup. Contested by Lauri Irving (3.3 feet, MAN). TRACY ADEBAYO MAKES IT! Assist: Derrick Mitchell
Score: 80-81

[11:07] Team_054 possession (Score: 80-81)
Malcolm Harden drives to the basket... Malcolm Harden throws a bad pass! Stolen by Derrick Mitchell! TURNOVER! (live ball)

[10:57] Team_090 possession (Score: 80-81)
Larry Bridges attempts a 3Pt. Contested by Lauri Irving (3.9 feet, MAN). Larry Bridges misses. Offensive rebound by Tracy Adebayo! Tracy Adebayo kicks it out.

[10:46] Team_090 possession (Score: 80-81)
Zach Wall attempts a 3Pt. Contested by Vince Ball (4.6 feet, MAN). Zach Wall misses. Offensive rebound by Zach Wall! Zach Wall kicks it out.

[10:32] Team_090 possession (Score: 80-81)
Zach Wall drives and kicks out. Gary Brogdon attempts a 3Pt. Contested by Vince Ball (4.4 feet, ZONE). GARY BROGDON MAKES IT! Assist: Zach Wall
Score: 83-81

[10:15] Team_054 possession (Score: 83-81)
FOUL! Reach-in foul on Gary Brogdon during the drive. [Team fouls: 1] No free throws, side out. (Gary Brogdon: 1 personal fouls)

[10:04] Team_054 possession (Score: 83-81)
FOUL! Reach-in foul on Gary Brogdon during the drive. [Team fouls: 2] No free throws, side out. (Gary Brogdon: 2 personal fouls)

[09:50] Team_054 possession (Score: 83-81)
Malcolm Harden attempts a Midrange. Contested by Larry Bridges (5.4 feet, ZONE). Malcolm Harden misses. Rebound secured by Gary Brogdon.

[09:35] Team_090 possession (Score: 83-81)
Tracy Adebayo attempts a Midrange. Contested by Blake Russell (3.6 feet, MAN). TRACY ADEBAYO MAKES IT!
Score: 85-81

[09:23] Team_054 possession (Score: 85-81)
Luka Brogdon attempts a 3Pt. Contested by Derrick Mitchell (4.1 feet, ZONE). Luka Brogdon misses. FOUL! Loose ball foul on Gary Brogdon during the rebound battle. [Team fouls: 3] No free throws, side out. (Gary Brogdon: 3 personal fouls)

[09:10] Team_054 possession (Score: 85-81)
Malcolm Harden attempts a 3Pt. Contested by Derrick Mitchell (4.0 feet, MAN). MALCOLM HARDEN MAKES IT! Assist: Blake Russell
Score: 85-84

[08:58] Team_090 possession (Score: 85-84)
Gary Brogdon drives, Luka Brogdon stays with him. Gary Brogdon attempts a Layup. Contested by Luka Brogdon (4.7 feet, MAN). GARY BROGDON MAKES IT!
Score: 87-84

[08:38] Team_054 possession (Score: 87-84)
Luka Brogdon drives to the basket... Luka Brogdon loses the ball! Stripped by Gary Brogdon! TURNOVER! (live ball)

[08:24] Team_090 possession (Score: 87-84)
Larry Bridges makes the Layup and draws the foul on Blake Russell! And-1! Larry Bridges to the line for 1. [Team fouls: 2] (Blake Russell: 1 personal fouls)   FT 1/1: GOOD Larry Bridges makes 1/1 from the line.
Score: 90-84

[08:10] Team_054 possession (Score: 90-84)
Luka Brogdon attempts a 3Pt. Contested by Derrick Mitchell (4.2 feet, ZONE). Luka Brogdon misses. Rebound secured by Zach Wall.

[07:57] Team_090 possession (Score: 90-84)
FOUL! Shooting foul on Blake Russell. Tracy Adebayo to the line for 2 free throws. [Team fouls: 3] (Blake Russell: 2 personal fouls)   FT 1/2: GOOD   FT 2/2: GOOD Tracy Adebayo makes 2/2 from the line.
Score: 92-84

[07:39] Team_054 possession (Score: 92-84)
Lauri Irving drives to the basket... Lauri Irving commits a violation (traveling/carry)! TURNOVER! (dead ball)

[07:39] Substitution (Team_090): Derrick Mitchell OUT → OG Anunoby IN (stamina_rule2)

[07:39] Substitution (Team_090): Larry Bridges OUT → Josh Wall IN (stamina_rule2)

[07:39] Substitution (Team_090): Zach Wall OUT → Russell Smith IN (stamina_rule2)

[07:39] Substitution (Team_090): Gary Brogdon OUT → Derrick Nowitzki IN (stamina_rule2)

[07:39] Substitution (Team_090): Tracy Adebayo OUT → Tobias Tatum IN (stamina_rule2)

[07:39] Substitution (Team_054): Malcolm Harden OUT → Shaquille Irving IN (stamina_rule2)

[07:39] Substitution (Team_054): Lauri Irving OUT → Bradley Quickley IN (stamina_rule2)

[07:39] Substitution (Team_054): Vince Ball OUT → Vince James IN (stamina_rule2)

[07:39] Substitution (Team_054): Luka Brogdon OUT → Tobias Nowitzki IN (stamina_rule2)

[07:39] Substitution (Team_054): Blake Russell OUT → Devin Jackson IN (stamina_rule2)

[07:24] Team_090 possession (Score: 92-84)
Tobias Tatum attempts a Midrange. Contested by Shaquille Irving (5.4 feet, ZONE). TOBIAS TATUM MAKES IT! Assist: Russell Smith
Score: 94-84

[07:10] Team_054 possession (Score: 94-84)
Devin Jackson attempts a Midrange. Contested by OG Anunoby (5.2 feet, ZONE). Devin Jackson misses. FOUL! Loose ball foul on Derrick Nowitzki during the rebound battle. [Team fouls: 4] No free throws, side out. (Derrick Nowitzki: 1 personal fouls)

[06:57] Team_054 possession (Score: 94-84)
Tobias Nowitzki drives and kicks out. Shaquille Irving attempts a Midrange. Contested by Derrick Nowitzki (4.3 feet, ZONE). Shaquille Irving misses. Offensive rebound by Tobias Nowitzki! Tobias Nowitzki kicks it out.

[06:42] Team_054 possession (Score: 94-84)
Bradley Quickley makes the Layup and draws the foul on Josh Wall! And-1! Bradley Quickley to the line for 1. [BONUS: 5 team fouls] (Josh Wall: 1 personal fouls)   FT 1/1: MISS Bradley Quickley makes 0/1 from the line. FOUL! Loose ball foul on Russell Smith during the free throw rebound! [IN THE BONUS! 6 team fouls] Tobias Nowitzki to the line for 2 free throws. (Russell Smith: 1 personal fouls)   FT 1/2: GOOD   FT 2/2: MISS Tobias Nowitzki makes 1/2 from the line. FOUL! Loose ball foul on Tobias Tatum during the free throw rebound! [IN THE BONUS! 7 team fouls] Tobias Nowitzki to the line for 2 free throws. (Tobias Tatum: 1 personal fouls)   FT 1/2: GOOD   FT 2/2: MISS Tobias Nowitzki makes 1/2 from the line. Rebound secured by Russell Smith.
Score: 94-88

[06:31] Team_090 possession (Score: 94-88)
Derrick Nowitzki attempts a Midrange. Contested by Vince James (4.5 feet, ZONE). Derrick Nowitzki misses. Offensive rebound by Russell Smith! Russell Smith kicks it out.

[06:21] Team_090 possession (Score: 94-88)
Tobias Tatum attempts a Layup. Wide open! Devin Jackson is 6.0 feet away. [MAN] TOBIAS TATUM MAKES IT!
Score: 96-88

[06:08] Team_054 possession (Score: 96-88)
Devin Jackson attempts a Layup. Contested by Tobias Tatum (4.8 feet, ZONE). DEVIN JACKSON MAKES IT!
Score: 96-90

[05:51] Team_090 possession (Score: 96-90)
Tobias Tatum attempts a 3Pt. Contested by Shaquille Irving (5.4 feet, ZONE). Tobias Tatum misses. Rebound secured by Vince James.

[05:34] Team_054 possession (Score: 96-90)
Devin Jackson makes the Layup and draws the foul on Derrick Nowitzki! And-1! Devin Jackson to the line for 1. [BONUS: 8 team fouls] (Derrick Nowitzki: 2 personal fouls)   FT 1/1: GOOD Devin Jackson makes 1/1 from the line.
Score: 96-93

[05:20] Team_090 possession (Score: 96-93)
Russell Smith attempts a Midrange. Contested by Vince James (5.2 feet, ZONE). RUSSELL SMITH MAKES IT! Assist: OG Anunoby
Score: 98-93

[05:06] Team_054 possession (Score: 98-93)
Shaquille Irving attempts a Layup. Contested by OG Anunoby (5.5 feet, MAN). SHAQUILLE IRVING MAKES IT!
Score: 98-95

[04:48] Team_090 possession (Score: 98-95)
Tobias Tatum attempts a Layup. Wide open! Devin Jackson is 6.0 feet away. [MAN] Tobias Tatum misses. Rebound secured by Tobias Nowitzki.

[04:32] Team_054 possession (Score: 98-95)
Bradley Quickley attempts a Midrange. Contested by Russell Smith (4.0 feet, ZONE). Bradley Quickley misses. Rebound secured by Tobias Tatum.

[04:18] Team_090 possession (Score: 98-95)
Derrick Nowitzki makes the Layup and draws the foul on Devin Jackson! And-1! Derrick Nowitzki to the line for 1. [Team fouls: 4] (Devin Jackson: 1 personal fouls)   FT 1/1: GOOD Derrick Nowitzki makes 1/1 from the line.
Score: 101-95

[04:03] Team_054 possession (Score: 101-95)
Bradley Quickley attempts a 3Pt. Contested by Russell Smith (4.0 feet, ZONE). Bradley Quickley misses. Offensive rebound by Tobias Nowitzki! Tobias Nowitzki kicks it out.

[03:49] Team_054 possession (Score: 101-95)
Bradley Quickley attempts a 3Pt. Contested by Russell Smith (4.0 feet, ZONE). Bradley Quickley misses. Rebound secured by Russell Smith.

[03:34] Team_090 possession (Score: 101-95)
Josh Wall attempts a Layup. Contested by Devin Jackson (5.7 feet, ZONE). JOSH WALL MAKES IT! Assist: Tobias Tatum
Score: 103-95

[03:19] Team_054 possession (Score: 103-95)
Vince James attempts a Midrange. Contested by Russell Smith (5.1 feet, MAN). Vince James misses. Rebound secured by Russell Smith.

[03:07] Team_090 possession (Score: 103-95)
FOUL! Shooting foul on Vince James. Russell Smith to the line for 3 free throws. [BONUS: 5 team fouls] (Vince James: 1 personal fouls)   FT 1/3: MISS   FT 2/3: GOOD   FT 3/3: GOOD Russell Smith makes 2/3 from the line.
Score: 105-95

[02:55] Team_054 possession (Score: 105-95)
Devin Jackson attempts a Midrange. Contested by Tobias Tatum (4.8 feet, MAN). Devin Jackson misses. Rebound secured by Tobias Tatum.

[02:41] Team_090 possession (Score: 105-95)
Derrick Nowitzki attempts a Layup. BLOCKED BY TOBIAS NOWITZKI! Ball deflects out of bounds off Derrick Nowitzki.

[02:27] Team_054 possession (Score: 105-95)
Vince James attempts a Layup. Contested by Russell Smith (5.1 feet, MAN). Vince James misses. Rebound secured by Tobias Tatum.

[02:11] Team_090 possession (Score: 105-95)
OG Anunoby drives and kicks out. Josh Wall attempts a Midrange. Contested by Bradley Quickley (4.2 feet, MAN). JOSH WALL MAKES IT! Assist: Derrick Nowitzki
Score: 107-95

[01:58] Team_054 possession (Score: 107-95)
Shaquille Irving attempts a Midrange. Contested by OG Anunoby (5.5 feet, ZONE). SHAQUILLE IRVING MAKES IT! Assist: Bradley Quickley
Score: 107-97

[01:42] Team_090 possession (Score: 107-97)
Russell Smith drives, Vince James stays with him. Russell Smith attempts a Layup. Contested by Vince James (5.2 feet, MAN). Russell Smith misses. Rebound secured by Tobias Nowitzki.

[01:31] Team_054 possession (Score: 107-97)
FOUL! Holding foul on Russell Smith. [IN THE BONUS! 9 team fouls] Vince James to the line for 2 free throws. (Russell Smith: 2 personal fouls)   FT 1/2: MISS   FT 2/2: GOOD Vince James makes 1/2 from the line.
Score: 107-98

[01:16] Team_090 possession (Score: 107-98)
Russell Smith attempts a 3Pt. Contested by Vince James (5.2 feet, MAN). Russell Smith misses. Offensive rebound by Russell Smith! Russell Smith kicks it out.

[01:04] Team_090 possession (Score: 107-98)
Josh Wall drives to the basket... Josh Wall loses control! Ball rolls out of bounds! TURNOVER! (dead ball)

[00:52] Team_054 possession (Score: 107-98)
FOUL! Holding foul on Derrick Nowitzki. [IN THE BONUS! 10 team fouls] Tobias Nowitzki to the line for 2 free throws. (Derrick Nowitzki: 3 personal fouls)   FT 1/2: GOOD   FT 2/2: GOOD Tobias Nowitzki makes 2/2 from the line.
Score: 107-100

[00:37] Team_090 possession (Score: 107-100)
Josh Wall attempts a Midrange. Contested by Bradley Quickley (4.6 feet, MAN). Josh Wall misses. Rebound secured by Tobias Nowitzki.

[00:26] Team_054 possession (Score: 107-100)
Tobias Nowitzki attempts a 3Pt. Contested by Derrick Nowitzki (4.4 feet, MAN). Tobias Nowitzki misses. Rebound secured by Derrick Nowitzki.

[00:16] Team_090 possession (Score: 107-100)
Josh Wall attempts a 3Pt. Contested by Shaquille Irving (5.0 feet, ZONE). Josh Wall misses. FOUL! Loose ball foul on Devin Jackson during the rebound battle. [IN THE BONUS! 6 team fouls] Russell Smith to the line for 2 free throws. (Devin Jackson: 2 personal fouls)   FT 1/2: GOOD   FT 2/2: GOOD Russell Smith makes 2/2 from the line.
Score: 109-100

[00:02] Team_054 possession (Score: 109-100)
Bradley Quickley makes the Layup and draws the foul on Josh Wall! And-1! Bradley Quickley to the line for 1. [BONUS: 11 team fouls] (Josh Wall: 2 personal fouls)   FT 1/1: GOOD Bradley Quickley makes 1/1 from the line.
Score: 109-103

================================================================================
                              4TH QUARTER COMPLETE                              
================================================================================

4TH QUARTER SCORE: Team_090 31, Team_054 22

BOX SCORE:
================================================================================

Team_090
--------------------------------------------------------------------------------
Player                MIN  PTS  REB  AST  TO      FG   FG%      3P   3P%
--------------------------------------------------------------------------------
Tracy Adebayo          33    6    1    0   0   3/3   100.0     0/0   0.0
Russell Smith          16    6    5    1   0   3/4    75.0     0/0   0.0
Gary Brogdon           33    5    2    0   0   2/2   100.0     0/0   0.0
Tobias Tatum           16    4    3    1   0   2/4    50.0     0/0   0.0
Josh Wall              16    4    0    0   0   2/3    66.7     0/0   0.0
Larry Bridges          33    3    0    0   0   1/1   100.0     0/0   0.0
Derrick Nowitzki       16    3    1    1   0   1/2    50.0     0/0   0.0
Zach Wall              33    0    3    1   0   0/1     0.0     0/0   0.0
Derrick Mitchell       33    0    0    1   0   0/0     0.0     0/0   0.0
OG Anunoby             16    0    0    1   0   0/0     0.0     0/0   0.0

TEAM: FG: 14/20 (70.0%), 3PT: 2/4 (50.0%), REB: 15 (5 off, 10 def), AST: 6, TO: 1
TEAM FOULS: 11 [Team_054 in BONUS]


Team_054
--------------------------------------------------------------------------------
Player                MIN  PTS  REB  AST  TO      FG   FG%      3P   3P%
--------------------------------------------------------------------------------
Devin Jackson          16    5    0    0   0   2/3    66.7     0/0   0.0
Shaquille Irving       16    4    0    0   0   2/2   100.0     0/0   0.0
Malcolm Harden         33    3    0    0   0   1/2    50.0     0/0   0.0
Bradley Quickley       16    3    0    1   0   1/4    25.0     0/0   0.0
Tobias Nowitzki        16    2    6    0   0   1/2    50.0     0/0   0.0
Vince James            16    1    1    0   0   1/3    33.3     0/0   0.0
Vince Ball             33    0    1    0   0   0/0     0.0     0/0   0.0
Lauri Irving           33    0    0    0   0   0/1     0.0     0/0   0.0
Luka Brogdon           33    0    1    0   0   0/1     0.0     0/0   0.0
Blake Russell          33    0    0    1   0   0/0     0.0     0/0   0.0

TEAM: FG: 8/18 (44.4%), 3PT: 1/5 (20.0%), REB: 9 (4 off, 5 def), AST: 2, TO: 3
TEAM FOULS: 6 [Team_090 in BONUS]

================================================================================

================================================================================
                               FULL GAME COMPLETE                               
================================================================================

FINAL SCORE: Team_090 109, Team_054 103

SCORING BY QUARTER:
--------------------------------------------------------------------------------
Team                     Q1     Q2     Q3     Q4    FINAL
--------------------------------------------------------------------------------
Team_090                 25     31     22     31      109
Team_054                 26     30     25     22      103
--------------------------------------------------------------------------------

FULL GAME BOX SCORE:
================================================================================

Team_090
--------------------------------------------------------------------------------
Player                MIN  PTS  REB  AST  TO      FG   FG%      3P   3P%      FT STL BLK
--------------------------------------------------------------------------------
Derrick Mitchell       33    4    0    3   1   1/2    50.0   0/0     0.0   0/1     1   0
Larry Bridges          33   14    0    3   0   6/13   46.2   1/4    25.0   1/1     0   0
Zach Wall              33   16   11    1   1   8/12   66.7   0/3     0.0   3/3     1   0
Gary Brogdon           33   18    9    5   2   6/12   50.0   1/4    25.0   4/5     1   0
Tracy Adebayo          33   13   12    2   2   7/11   63.6   0/0     0.0   3/3     0   0
OG Anunoby             16    7    0    1   0   3/4    75.0   0/1     0.0   2/3     0   0
Josh Wall              16    7    0    0   0   3/5    60.0   1/2    50.0   1/1     1   0
Russell Smith          16   14    8    1   1   6/8    75.0   3/3   100.0   9/13    0   0
Derrick Nowitzki       16    3    1    2   1   2/4    50.0   0/0     0.0   1/2     0   0
Tobias Tatum           16    6    4    2   1   3/6    50.0   0/1     0.0   0/0     0   0

TEAM: FG: 45/77 (58.4%), 3PT: 6/18 (33.3%), REB: 45 (13 off, 32 def), AST: 20, TO: 9


Team_054
--------------------------------------------------------------------------------
Player                MIN  PTS  REB  AST  TO      FG   FG%      3P   3P%      FT STL BLK
--------------------------------------------------------------------------------
Malcolm Harden         33   13    0    4   3   6/9    66.7   4/5    80.0   0/0     0   0
Lauri Irving           33   10    4    4   1   4/11   36.4   2/8    25.0   0/0     0   1
Vince Ball             33    9    7    2   1   3/9    33.3   3/8    37.5   0/0     0   0
Luka Brogdon           33   17   10    0   0   7/11   63.6   1/2    50.0   4/5     1   0
Blake Russell          33    9    9    5   2   4/7    57.1   0/2     0.0   3/7     2   0
Shaquille Irving       16    7    0    1   0   3/3   100.0   1/1   100.0   0/0     0   0
Bradley Quickley       16    9    0    1   1   3/7    42.9   2/3    66.7   1/2     0   0
Vince James            16    7    3    1   2   1/3    33.3   1/1   100.0   2/3     1   0
Tobias Nowitzki        16    9   10    3   0   4/5    80.0   1/2    50.0   2/2     1   1
Devin Jackson          16    7    0    2   0   3/6    50.0   0/0     0.0   1/1     0   0

TEAM: FG: 41/74 (55.4%), 3PT: 15/32 (46.9%), REB: 42 (12 off, 30 def), AST: 23, TO: 10

================================================================================
