================================================================================
                        FULL GAME - Team_042 vs Team_041                        
================================================================================

================================================================================
                       1ST QUARTER - Team_042 vs Team_041                       
================================================================================

[12:00] Team_042 possession (Score: 0-0)
Kristaps Parker drives to the basket... Kristaps Parker throws a bad pass! Stolen by Terry Barrett! TURNOVER! (live ball)

[11:48] Team_041 possession (Score: 0-0)
FOUL! Reach-in foul on Kristaps Parker during the drive. [Team fouls: 1] No free throws, side out. (Kristaps Parker: 1 personal fouls)

[11:28] Team_041 possession (Score: 0-0)
Dejounte Griffin attempts a 3Pt. Contested by Jarrett Sabonis (3.9 feet, MAN). Dejounte Griffin misses. Rebound secured by Cade Dosunmu.

[11:10] Team_042 possession (Score: 0-0)
Jarrett Sabonis attempts a 3Pt. Contested by Scottie Turner (4.5 feet, ZONE). Jarrett Sabonis misses. Rebound secured by Dejounte Griffin.

[10:52] Team_041 possession (Score: 0-0)
Jarrett Anunoby attempts a 3Pt. Contested by Tyler Barrett (3.9 feet, ZONE). Jarrett Anunoby misses. Rebound secured by Cade Dosunmu.

[10:38] Team_042 possession (Score: 0-0)
Dejounte Butler attempts a Layup. BLOCKED BY TERRY BARRETT! Ball is loose! Offensive rebound by Dejounte Butler! Dejounte Butler kicks it out.

[10:25] Team_042 possession (Score: 0-0)
Cade Dosunmu attempts a Midrange. Contested by Terry Barrett (3.5 feet, MAN). Cade Dosunmu misses. Rebound secured by Dejounte Griffin.

[10:11] Team_041 possession (Score: 0-0)
Stephen Ingram drives, Dejounte Butler stays with him. Stephen Ingram attempts a Dunk. Contested by Dejounte Butler (3.7 feet, MAN). STEPHEN INGRAM MAKES IT! Assist: Terry Barrett
Score: 0-2

[09:55] Team_042 possession (Score: 0-2)
Dejounte Butler attempts a 3Pt. Contested by Stephen Ingram (4.5 feet, MAN). Dejounte Butler misses. Rebound secured by Dejounte Griffin.

[09:38] Team_041 possession (Score: 0-2)
Terry Barrett makes the Layup and draws the foul on Cade Dosunmu! And-1! Terry Barrett to the line for 1. [Team fouls: 2] (Cade Dosunmu: 1 personal fouls)   FT 1/1: GOOD Terry Barrett makes 1/1 from the line.
Score: 0-5

[09:22] Team_042 possession (Score: 0-5)
Kristaps Parker attempts a 3Pt. Contested by Jarrett Anunoby (4.2 feet, MAN). Kristaps Parker misses. Offensive rebound by Cade Dosunmu! Cade Dosunmu's putback is no good. Offensive rebound by Cade Dosunmu! Cade Dosunmu kicks it out.

[09:12] Team_042 possession (Score: 0-5)
Jarrett Sabonis attempts a Layup. BLOCKED BY JARRETT ANUNOBY! Ball is loose! Rebound secured by Terry Barrett.

[08:54] Team_041 possession (Score: 0-5)
Scottie Turner attempts a Layup. Contested by Tyler Barrett (3.2 feet, MAN). Scottie Turner misses. Offensive rebound by Terry Barrett! Terry Barrett puts it back in!
Score: 0-7

[08:39] Team_042 possession (Score: 0-7)
Kristaps Parker drives and kicks out. Kristaps Parker attempts a Midrange. Contested by Dejounte Griffin (3.9 feet, ZONE). KRISTAPS PARKER MAKES IT!
Score: 2-7

[08:25] Team_041 possession (Score: 2-7)
Terry Barrett attempts a Layup. Contested by Cade Dosunmu (4.1 feet, ZONE). TERRY BARRETT MAKES IT! Assist: Stephen Ingram
Score: 2-9

[08:12] Team_042 possession (Score: 2-9)
Kristaps Parker attempts a Midrange. Contested by Stephen Ingram (4.1 feet, ZONE). Kristaps Parker misses. Rebound secured by Dejounte Griffin.

[07:57] Team_041 possession (Score: 2-9)
FOUL! Holding foul on Jarrett Sabonis. [Team fouls: 3] No free throws, side out. (Jarrett Sabonis: 1 personal fouls)

[07:43] Team_041 possession (Score: 2-9)
Dejounte Griffin makes the Layup and draws the foul on Cade Dosunmu! And-1! Dejounte Griffin to the line for 1. [Team fouls: 4] (Cade Dosunmu: 2 personal fouls)   FT 1/1: MISS Dejounte Griffin makes 0/1 from the line. Rebound secured by Cade Dosunmu.
Score: 2-11

[07:27] Team_042 possession (Score: 2-11)
FOUL! Reach-in foul on Terry Barrett during the drive. [Team fouls: 1] No free throws, side out. (Terry Barrett: 1 personal fouls)

[07:17] Team_042 possession (Score: 2-11)
Jarrett Sabonis makes the 3Pt and draws the foul on Dejounte Griffin! And-1! Jarrett Sabonis to the line for 1. [Team fouls: 2] (Dejounte Griffin: 1 personal fouls)   FT 1/1: GOOD Jarrett Sabonis makes 1/1 from the line.
Score: 6-11

[07:04] Team_041 possession (Score: 6-11)
Dejounte Griffin attempts a 3Pt. Contested by Tyler Barrett (3.4 feet, ZONE). DEJOUNTE GRIFFIN MAKES IT! Assist: Jarrett Anunoby
Score: 6-14

[06:52] Team_042 possession (Score: 6-14)
Cade Dosunmu drives, Terry Barrett stays with him. Cade Dosunmu attempts a Dunk. Contested by Terry Barrett (3.5 feet, ZONE). CADE DOSUNMU MAKES IT! Assist: Dejounte Butler
Score: 8-14

[06:40] Team_041 possession (Score: 8-14)
Dejounte Griffin attempts a 3Pt. Contested by Tyler Barrett (3.4 feet, ZONE). Dejounte Griffin misses. Offensive rebound by Stephen Ingram! Stephen Ingram kicks it out.

[06:26] Team_041 possession (Score: 8-14)
Dejounte Griffin attempts a Layup. Contested by Cade Dosunmu (4.0 feet, ZONE). DEJOUNTE GRIFFIN MAKES IT! Assist: Terry Barrett
Score: 8-16

[06:12] Team_042 possession (Score: 8-16)
FOUL! Shooting foul on Scottie Turner. Cade Dosunmu to the line for 3 free throws. [Team fouls: 3] (Scottie Turner: 1 personal fouls)   FT 1/3: GOOD   FT 2/3: GOOD   FT 3/3: GOOD Cade Dosunmu makes 3/3 from the line.
Score: 11-16

[05:58] Team_041 possession (Score: 11-16)
Stephen Ingram attempts a Midrange. Contested by Dejounte Butler (3.7 feet, MAN). STEPHEN INGRAM MAKES IT!
Score: 11-18

[05:47] Team_042 possession (Score: 11-18)
FOUL! Reach-in foul on Dejounte Griffin during the drive. [Team fouls: 4] No free throws, side out. (Dejounte Griffin: 2 personal fouls)

[05:33] Team_042 possession (Score: 11-18)
Tyler Barrett attempts a 3Pt. Contested by Scottie Turner (4.6 feet, MAN). Tyler Barrett misses. Rebound secured by Dejounte Griffin.

[05:20] Team_041 possession (Score: 11-18)
Jarrett Anunoby attempts a 3Pt. Contested by Tyler Barrett (3.9 feet, ZONE). Jarrett Anunoby misses. Rebound secured by Tyler Barrett.

[05:06] Team_042 possession (Score: 11-18)
Cade Dosunmu drives, Terry Barrett stays with him. Cade Dosunmu attempts a Layup. Contested by Terry Barrett (3.5 feet, MAN). CADE DOSUNMU MAKES IT! Assist: Kristaps Parker
Score: 13-18

[04:54] Team_041 possession (Score: 13-18)
Scottie Turner attempts a 3Pt. Contested by Tyler Barrett (3.3 feet, ZONE). Scottie Turner misses. Rebound secured by Cade Dosunmu.

[04:38] Team_042 possession (Score: 13-18)
Dejounte Butler drives to the basket... Dejounte Butler loses control! Ball rolls out of bounds! TURNOVER! (dead ball)

[04:25] Team_041 possession (Score: 13-18)
Dejounte Griffin attempts a Layup. Contested by Cade Dosunmu (4.1 feet, ZONE). Dejounte Griffin misses. Offensive rebound by Terry Barrett! Terry Barrett puts it back in!
Score: 13-20

[04:13] Team_042 possession (Score: 13-20)
Kristaps Parker attempts a 3Pt. Contested by Scottie Turner (4.1 feet, ZONE). Kristaps Parker misses. Rebound secured by Stephen Ingram.

[04:02] Team_041 possession (Score: 13-20)
Stephen Ingram attempts a 3Pt. Contested by Tyler Barrett (3.6 feet, ZONE). Stephen Ingram misses. Rebound secured by Tyler Barrett.

[03:46] Team_042 possession (Score: 13-20)
Jarrett Sabonis attempts a Midrange. Contested by Dejounte Griffin (4.5 feet, MAN). Jarrett Sabonis misses. Rebound secured by Stephen Ingram.

[03:26] Team_041 possession (Score: 13-20)
Scottie Turner attempts a 3Pt. Contested by Dejounte Butler (3.6 feet, ZONE). SCOTTIE TURNER MAKES IT! Assist: Stephen Ingram
Score: 13-23

[03:11] Team_042 possession (Score: 13-23)
Tyler Barrett attempts a 3Pt. Contested by Scottie Turner (4.7 feet, ZONE). Tyler Barrett misses. FOUL! Loose ball foul on Stephen Ingram during the rebound battle. [IN THE BONUS! 5 team fouls] Cade Dosunmu to the line for 2 free throws. (Stephen Ingram: 1 personal fouls)   FT 1/2: GOOD   FT 2/2: GOOD Cade Dosunmu makes 2/2 from the line.
Score: 15-23

[02:53] Team_041 possession (Score: 15-23)
Terry Barrett attempts a Layup. Contested by Cade Dosunmu (4.4 feet, ZONE). TERRY BARRETT MAKES IT!
Score: 15-25

[02:39] Team_042 possession (Score: 15-25)
FOUL! Reach-in foul on Jarrett Anunoby during the drive. [IN THE BONUS! 6 team fouls] Kristaps Parker to the line for 2 free throws. (Jarrett Anunoby: 1 personal fouls)   FT 1/2: GOOD   FT 2/2: GOOD Kristaps Parker makes 2/2 from the line.
Score: 17-25

[02:25] Team_041 possession (Score: 17-25)
Stephen Ingram attempts a 3Pt. Contested by Kristaps Parker (5.3 feet, ZONE). Stephen Ingram misses. Rebound secured by Cade Dosunmu.

[02:07] Team_042 possession (Score: 17-25)
Cade Dosunmu drives to the basket... Cade Dosunmu throws a bad pass! Stolen by Terry Barrett! TURNOVER! (live ball)

[01:54] Team_041 possession (Score: 17-25)
Jarrett Anunoby drives and kicks out. Terry Barrett attempts a 3Pt. Contested by Cade Dosunmu (4.4 feet, MAN). Terry Barrett misses. Rebound secured by Dejounte Butler.

[01:45] Team_042 possession (Score: 17-25)
Cade Dosunmu drives and kicks out. Jarrett Sabonis makes the Midrange and draws the foul on Dejounte Griffin! And-1! Jarrett Sabonis to the line for 1. [BONUS: 7 team fouls] (Dejounte Griffin: 3 personal fouls)   FT 1/1: MISS Jarrett Sabonis makes 0/1 from the line. FOUL! Loose ball foul on Terry Barrett during the free throw rebound! [IN THE BONUS! 8 team fouls] Dejounte Butler to the line for 2 free throws. (Terry Barrett: 2 personal fouls)   FT 1/2: GOOD   FT 2/2: GOOD Dejounte Butler makes 2/2 from the line.
Score: 21-25

[01:29] Team_041 possession (Score: 21-25)
Stephen Ingram drives, Cade Dosunmu stays with him. Stephen Ingram attempts a Layup. Contested by Cade Dosunmu (4.5 feet, ZONE). STEPHEN INGRAM MAKES IT! Assist: Jarrett Anunoby
Score: 21-27

[01:17] Team_042 possession (Score: 21-27)
Jarrett Sabonis drives, picks up Terry Barrett. Help arrives from Jarrett Anunoby! Jarrett Sabonis attempts a Dunk. Contested by Jarrett Anunoby (4.1 feet, ZONE). JARRETT SABONIS MAKES IT!
Score: 23-27

[01:02] Team_041 possession (Score: 23-27)
Jarrett Anunoby attempts a Midrange. Contested by Kristaps Parker (5.8 feet, MAN). Jarrett Anunoby misses. Rebound secured by Tyler Barrett.

[00:47] Team_042 possession (Score: 23-27)
Tyler Barrett drives and kicks out. Tyler Barrett attempts a Midrange. Contested by Stephen Ingram (4.6 feet, ZONE). Tyler Barrett misses. Rebound secured by Dejounte Griffin.

[00:36] Team_041 possession (Score: 23-27)
Dejounte Griffin attempts a 3Pt. Contested by Jarrett Sabonis (4.4 feet, MAN). Dejounte Griffin misses. Offensive rebound by Terry Barrett! Terry Barrett puts it back in!
Score: 23-29

[00:24] Team_042 possession (Score: 23-29)
FOUL! Holding foul on Terry Barrett. [IN THE BONUS! 9 team fouls] Cade Dosunmu to the line for 2 free throws. (Terry Barrett: 3 personal fouls)   FT 1/2: MISS   FT 2/2: GOOD Cade Dosunmu makes 1/2 from the line.
Score: 24-29

[00:07] Team_041 possession (Score: 24-29)
Jarrett Anunoby attempts a Midrange. Contested by Dejounte Butler (4.7 feet, ZONE). Jarrett Anunoby misses. Rebound secured by Cade Dosunmu.

================================================================================
                              1ST QUARTER COMPLETE                              
================================================================================

1ST QUARTER SCORE: Team_042 24, Team_041 29

BOX SCORE:
================================================================================

Team_042
--------------------------------------------------------------------------------
Player                MIN  PTS  REB  AST  TO      FG   FG%      3P   3P%
--------------------------------------------------------------------------------
Cade Dosunmu           12   10    7    0   0   5/6    83.3     0/0   0.0
Jarrett Sabonis        12    6    0    0   0   2/5    40.0     0/0   0.0
Dejounte Butler        12    4    2    1   0   1/2    50.0     0/0   0.0
Kristaps Parker        12    4    0    1   0   2/4    50.0     0/0   0.0
Tyler Barrett          12    0    3    0   0   0/2     0.0     0/0   0.0

TEAM: FG: 10/19 (52.6%), 3PT: 3/7 (42.9%), REB: 12 (2 off, 10 def), AST: 2, TO: 3
TEAM FOULS: 4


Team_041
--------------------------------------------------------------------------------
Player                MIN  PTS  REB  AST  TO      FG   FG%      3P   3P%
--------------------------------------------------------------------------------
Terry Barrett          12   13    4    2   0   6/6   100.0     0/0   0.0
Stephen Ingram         12    6    3    2   0   3/5    60.0     0/0   0.0
Dejounte Griffin       12    5    6    0   0   2/4    50.0     0/0   0.0
Scottie Turner         12    3    0    0   0   1/2    50.0     0/0   0.0
Jarrett Anunoby        12    0    0    2   0   0/5     0.0     0/0   0.0

TEAM: FG: 12/22 (54.5%), 3PT: 3/9 (33.3%), REB: 13 (4 off, 9 def), AST: 6, TO: 0
TEAM FOULS: 9 [Team_042 in BONUS]

================================================================================

================================================================================
                       2ND QUARTER - Team_042 vs Team_041                       
================================================================================

[12:00] Team_042 possession (Score: 24-29)
Dejounte Butler makes the Layup and draws the foul on Stephen Ingram! And-1! Dejounte Butler to the line for 1. [Team fouls: 1] (Stephen Ingram: 1 personal fouls)   FT 1/1: MISS Dejounte Butler makes 0/1 from the line. Rebound secured by Stephen Ingram.
Score: 26-29

[11:40] Team_041 possession (Score: 26-29)
Stephen Ingram attempts a Midrange. Contested by Dejounte Butler (4.1 feet, MAN). Stephen Ingram misses. Offensive rebound by Terry Barrett! Terry Barrett puts it back in!
Score: 26-31

[11:26] Team_042 possession (Score: 26-31)
Kristaps Parker drives, Jarrett Anunoby stays with him. Kristaps Parker attempts a Layup. Contested by Jarrett Anunoby (4.5 feet, MAN). KRISTAPS PARKER MAKES IT! Assist: Jarrett Sabonis
Score: 28-31

[11:16] Team_041 possession (Score: 28-31)
Terry Barrett drives, Cade Dosunmu stays with him. Terry Barrett attempts a Dunk. Contested by Cade Dosunmu (4.6 feet, MAN). TERRY BARRETT MAKES IT! Assist: Scottie Turner
Score: 28-33

[11:02] Team_042 possession (Score: 28-33)
Jarrett Sabonis attempts a Midrange. Contested by Dejounte Griffin (4.9 feet, MAN). Jarrett Sabonis misses. Rebound secured by Stephen Ingram.

[10:47] Team_041 possession (Score: 28-33)
Stephen Ingram drives, picks up Cade Dosunmu. Help arrives from Tyler Barrett! Stephen Ingram attempts a Layup. Contested by Tyler Barrett (4.6 feet, ZONE). Stephen Ingram misses. Rebound secured by Dejounte Butler.

[10:35] Team_042 possession (Score: 28-33)
Kristaps Parker attempts a 3Pt. Contested by Scottie Turner (4.4 feet, ZONE). KRISTAPS PARKER MAKES IT!
Score: 31-33

[10:19] Team_041 possession (Score: 31-33)
FOUL! Shooting foul on Tyler Barrett. Scottie Turner to the line for 3 free throws. [Team fouls: 1] (Tyler Barrett: 1 personal fouls)   FT 1/3: GOOD   FT 2/3: GOOD   FT 3/3: MISS Scottie Turner makes 2/3 from the line. Rebound secured by Tyler Barrett.
Score: 31-35

[10:05] Team_042 possession (Score: 31-35)
Dejounte Butler attempts a 3Pt. Contested by Scottie Turner (4.8 feet, ZONE). Dejounte Butler misses. Rebound secured by Stephen Ingram.

[09:52] Team_041 possession (Score: 31-35)
Jarrett Anunoby attempts a Layup. BLOCKED BY CADE DOSUNMU! Ball is loose! Rebound secured by Dejounte Butler.

[09:38] Team_042 possession (Score: 31-35)
Cade Dosunmu attempts a Midrange. Contested by Terry Barrett (4.1 feet, MAN). Cade Dosunmu misses. Rebound secured by Terry Barrett.

[09:26] Team_041 possession (Score: 31-35)
Dejounte Griffin attempts a Midrange. Contested by Jarrett Sabonis (4.5 feet, MAN). DEJOUNTE GRIFFIN MAKES IT!
Score: 31-37

[09:11] Team_042 possession (Score: 31-37)
Jarrett Sabonis attempts a 3Pt. Contested by Scottie Turner (5.1 feet, ZONE). Jarrett Sabonis misses. FOUL! Loose ball foul on Stephen Ingram during the rebound battle. [Team fouls: 2] No free throws, side out. (Stephen Ingram: 2 personal fouls)

[08:58] Team_042 possession (Score: 31-37)
FOUL! Shooting foul on Terry Barrett. Cade Dosunmu to the line for 2 free throws. [Team fouls: 3] (Terry Barrett: 1 personal fouls)   FT 1/2: GOOD   FT 2/2: GOOD Cade Dosunmu makes 2/2 from the line.
Score: 33-37

[08:45] Team_041 possession (Score: 33-37)
FOUL! Holding foul on Dejounte Butler. [Team fouls: 2] No free throws, side out. (Dejounte Butler: 1 personal fouls)

[08:32] Team_041 possession (Score: 33-37)
Stephen Ingram loses the ball! Stripped by Dejounte Butler! TURNOVER! (live ball)

[08:15] Team_042 possession (Score: 33-37)
FOUL! Shooting foul on Jarrett Anunoby. Dejounte Butler to the line for 2 free throws. [Team fouls: 4] (Jarrett Anunoby: 1 personal fouls)   FT 1/2: MISS   FT 2/2: GOOD Dejounte Butler makes 1/2 from the line.
Score: 34-37

[08:02] Team_041 possession (Score: 34-37)
Scottie Turner drives and kicks out. Scottie Turner attempts a 3Pt. Contested by Tyler Barrett (4.4 feet, ZONE). SCOTTIE TURNER MAKES IT!
Score: 34-40

[07:50] Team_042 possession (Score: 34-40)
Jarrett Sabonis attempts a 3Pt. Contested by Dejounte Griffin (5.3 feet, MAN). Jarrett Sabonis misses. Offensive rebound by Dejounte Butler! Dejounte Butler puts it back in!
Score: 36-40

[07:35] Team_041 possession (Score: 36-40)
Scottie Turner attempts a 3Pt. Contested by Tyler Barrett (4.2 feet, ZONE). Scottie Turner misses. Offensive rebound by Terry Barrett! Terry Barrett kicks it out.

[07:23] Team_041 possession (Score: 36-40)
Scottie Turner attempts a 3Pt. Contested by Tyler Barrett (4.2 feet, MAN). SCOTTIE TURNER MAKES IT! Assist: Stephen Ingram
Score: 36-43

[07:11] Team_042 possession (Score: 36-43)
Kristaps Parker makes the Layup and draws the foul on Stephen Ingram! And-1! Kristaps Parker to the line for 1. [BONUS: 5 team fouls] (Stephen Ingram: 3 personal fouls)   FT 1/1: GOOD Kristaps Parker makes 1/1 from the line.
Score: 39-43

[06:59] Team_041 possession (Score: 39-43)
FOUL! Reach-in foul on Dejounte Butler during the drive. [Team fouls: 3] No free throws, side out. (Dejounte Butler: 2 personal fouls)

[06:44] Team_041 possession (Score: 39-43)
Terry Barrett loses the ball! Stripped by Cade Dosunmu! TURNOVER! (live ball)

[06:34] Team_042 possession (Score: 39-43)
FOUL! Reach-in foul on Terry Barrett during the drive. [IN THE BONUS! 6 team fouls] Tyler Barrett to the line for 2 free throws. (Terry Barrett: 2 personal fouls)   FT 1/2: GOOD   FT 2/2: GOOD Tyler Barrett makes 2/2 from the line.
Score: 41-43

[06:21] Team_041 possession (Score: 41-43)
Jarrett Anunoby attempts a 3Pt. Wide open! Kristaps Parker is 6.4 feet away. [MAN] Jarrett Anunoby misses. Rebound secured by Dejounte Butler.

[06:06] Team_042 possession (Score: 41-43)
FOUL! Shooting foul on Jarrett Anunoby. Kristaps Parker to the line for 2 free throws. [BONUS: 7 team fouls] (Jarrett Anunoby: 2 personal fouls)   FT 1/2: MISS   FT 2/2: GOOD Kristaps Parker makes 1/2 from the line.
Score: 42-43

[05:54] Team_041 possession (Score: 42-43)
Stephen Ingram attempts a 3Pt. Contested by Dejounte Butler (5.0 feet, MAN). STEPHEN INGRAM MAKES IT! Assist: Terry Barrett
Score: 42-46

[05:41] Team_042 possession (Score: 42-46)
Kristaps Parker attempts a 3Pt. Contested by Jarrett Anunoby (5.4 feet, MAN). Kristaps Parker misses. Rebound secured by Stephen Ingram.

[05:26] Team_041 possession (Score: 42-46)
Scottie Turner attempts a Midrange. Contested by Dejounte Butler (4.8 feet, ZONE). Scottie Turner misses. Offensive rebound by Stephen Ingram! Stephen Ingram kicks it out.

[05:12] Team_041 possession (Score: 42-46)
Jarrett Anunoby drives, Cade Dosunmu stays with him. Jarrett Anunoby attempts a Layup. Contested by Cade Dosunmu (5.8 feet, ZONE). JARRETT ANUNOBY MAKES IT!
Score: 42-48

[05:02] Team_042 possession (Score: 42-48)
FOUL! Reach-in foul on Scottie Turner during the drive. [IN THE BONUS! 8 team fouls] Tyler Barrett to the line for 2 free throws. (Scottie Turner: 1 personal fouls)   FT 1/2: GOOD   FT 2/2: GOOD Tyler Barrett makes 2/2 from the line.
Score: 44-48

[04:47] Team_041 possession (Score: 44-48)
Dejounte Griffin attempts a 3Pt. Contested by Tyler Barrett (4.8 feet, ZONE). DEJOUNTE GRIFFIN MAKES IT! Assist: Stephen Ingram
Score: 44-51

[04:30] Team_042 possession (Score: 44-51)
Tyler Barrett drives to the basket... Tyler Barrett loses the ball! Stripped by Scottie Turner! TURNOVER! (live ball)

[04:16] Team_041 possession (Score: 44-51)
Scottie Turner attempts a Midrange. Contested by Tyler Barrett (4.8 feet, MAN). Scottie Turner misses. Rebound secured by Cade Dosunmu.

[03:56] Team_042 possession (Score: 44-51)
Dejounte Butler attempts a 3Pt. Contested by Scottie Turner (5.6 feet, ZONE). Dejounte Butler misses. Offensive rebound by Dejounte Butler! Dejounte Butler kicks it out.

[03:39] Team_042 possession (Score: 44-51)
Cade Dosunmu drives, Terry Barrett stays with him. Cade Dosunmu attempts a Dunk. Contested by Terry Barrett (5.1 feet, MAN). CADE DOSUNMU MAKES IT!
Score: 46-51

[03:25] Team_041 possession (Score: 46-51)
Jarrett Anunoby attempts a Midrange. Wide open! Kristaps Parker is 6.7 feet away. [MAN] Jarrett Anunoby misses. Rebound secured by Tyler Barrett.

[03:09] Team_042 possession (Score: 46-51)
Jarrett Sabonis drives, Dejounte Griffin stays with him. Jarrett Sabonis attempts a Dunk. Wide open! Dejounte Griffin is 6.1 feet away. [MAN] Jarrett Sabonis misses. Offensive rebound by Dejounte Butler! Dejounte Butler kicks it out.

[02:51] Team_042 possession (Score: 46-51)
Kristaps Parker attempts a Midrange. Contested by Jarrett Anunoby (5.8 feet, MAN). KRISTAPS PARKER MAKES IT!
Score: 48-51

[02:38] Team_041 possession (Score: 48-51)
Scottie Turner attempts a 3Pt. Contested by Dejounte Butler (5.3 feet, ZONE). Scottie Turner misses. Rebound secured by Cade Dosunmu.

[02:24] Team_042 possession (Score: 48-51)
Dejounte Butler attempts a 3Pt. Contested by Scottie Turner (5.8 feet, ZONE). Dejounte Butler misses. Rebound secured by Stephen Ingram.

[02:09] Team_041 possession (Score: 48-51)
Stephen Ingram drives, picks up Dejounte Butler. Help arrives from Tyler Barrett! Stephen Ingram attempts a Layup. Contested by Tyler Barrett (5.6 feet, MAN). STEPHEN INGRAM MAKES IT! Assist: Terry Barrett
Score: 48-53

[01:57] Team_042 possession (Score: 48-53)
Kristaps Parker attempts a 3Pt. Contested by Scottie Turner (5.6 feet, ZONE). KRISTAPS PARKER MAKES IT! Assist: Cade Dosunmu
Score: 51-53

[01:40] Team_041 possession (Score: 51-53)
Dejounte Griffin attempts a 3Pt. Contested by Jarrett Sabonis (5.7 feet, MAN). Dejounte Griffin misses. Rebound secured by Tyler Barrett.

[01:26] Team_042 possession (Score: 51-53)
Cade Dosunmu attempts a Midrange. Contested by Stephen Ingram (5.9 feet, ZONE). Cade Dosunmu misses. Rebound secured by Stephen Ingram.

[01:07] Team_041 possession (Score: 51-53)
Terry Barrett attempts a Midrange. Wide open! Cade Dosunmu is 6.2 feet away. [MAN] Terry Barrett misses. Rebound secured by Tyler Barrett.

[00:56] Team_042 possession (Score: 51-53)
Cade Dosunmu drives, picks up Terry Barrett. Help arrives from Jarrett Anunoby! Cade Dosunmu attempts a Layup. Contested by Jarrett Anunoby (5.5 feet, ZONE). CADE DOSUNMU MAKES IT! Assist: Tyler Barrett
Score: 53-53

[00:41] Team_041 possession (Score: 53-53)
Terry Barrett attempts a Midrange. Contested by Jarrett Sabonis (6.0 feet, ZONE). Terry Barrett misses. FOUL! Loose ball foul on Tyler Barrett during the rebound battle. [Team fouls: 4] No free throws, side out. (Tyler Barrett: 2 personal fouls)

[00:28] Team_041 possession (Score: 53-53)
Terry Barrett attempts a Midrange. Wide open! Kristaps Parker is 6.8 feet away. [ZONE] TERRY BARRETT MAKES IT!
Score: 53-55

[00:15] Team_042 possession (Score: 53-55)
Tyler Barrett attempts a Midrange. Wide open! Scottie Turner is 6.3 feet away. [MAN] Tyler Barrett misses. Offensive rebound by Cade Dosunmu! Cade Dosunmu kicks it out.

[00:03] Team_042 possession (Score: 53-55)
Kristaps Parker attempts a 3Pt. Contested by Scottie Turner (5.9 feet, ZONE). Kristaps Parker misses. Rebound secured by Jarrett Anunoby.

================================================================================
                              2ND QUARTER COMPLETE                              
================================================================================

2ND QUARTER SCORE: Team_042 29, Team_041 26

BOX SCORE:
================================================================================

Team_042
--------------------------------------------------------------------------------
Player                MIN  PTS  REB  AST  TO      FG   FG%      3P   3P%
--------------------------------------------------------------------------------
Kristaps Parker        24   14    0    0   0   6/8    75.0     0/0   0.0
Cade Dosunmu           24    6    4    1   0   3/5    60.0     0/0   0.0
Tyler Barrett          24    4    4    1   0   2/2   100.0     0/0   0.0
Dejounte Butler        24    3    6    0   0   2/5    40.0     0/0   0.0
Jarrett Sabonis        24    0    0    1   0   0/1     0.0     0/0   0.0

TEAM: FG: 13/21 (61.9%), 3PT: 3/7 (42.9%), REB: 14 (5 off, 9 def), AST: 3, TO: 1
TEAM FOULS: 4


Team_041
--------------------------------------------------------------------------------
Player                MIN  PTS  REB  AST  TO      FG   FG%      3P   3P%
--------------------------------------------------------------------------------
Terry Barrett          24    6    3    2   0   3/4    75.0     0/0   0.0
Scottie Turner         24    6    0    1   0   2/5    40.0     0/0   0.0
Stephen Ingram         24    5    8    2   0   2/3    66.7     0/0   0.0
Dejounte Griffin       24    5    0    0   0   2/3    66.7     0/0   0.0
Jarrett Anunoby        24    2    1    0   0   1/4    25.0     0/0   0.0

TEAM: FG: 10/19 (52.6%), 3PT: 3/7 (42.9%), REB: 12 (4 off, 8 def), AST: 5, TO: 2
TEAM FOULS: 8 [Team_042 in BONUS]

================================================================================

================================================================================
                       3RD QUARTER - Team_042 vs Team_041                       
================================================================================

[12:00] Team_042 possession (Score: 53-55)
Cade Dosunmu attempts a Midrange. Contested by Terry Barrett (3.5 feet, MAN). Cade Dosunmu misses. Rebound secured by Terry Barrett.

[11:45] Team_041 possession (Score: 53-55)
FOUL! Shooting foul on Cade Dosunmu. Terry Barrett to the line for 2 free throws. [Team fouls: 1] (Cade Dosunmu: 1 personal fouls)   FT 1/2: GOOD   FT 2/2: MISS Terry Barrett makes 1/2 from the line. Rebound secured by Tyler Barrett.
Score: 53-56

[11:34] Team_042 possession (Score: 53-56)
FOUL! Shooting foul on Terry Barrett. Cade Dosunmu to the line for 2 free throws. [Team fouls: 1] (Terry Barrett: 1 personal fouls)   FT 1/2: MISS   FT 2/2: GOOD Cade Dosunmu makes 1/2 from the line.
Score: 54-56

[11:23] Team_041 possession (Score: 54-56)
Dejounte Griffin attempts a Midrange. Contested by Jarrett Sabonis (3.9 feet, ZONE). Dejounte Griffin misses. Rebound secured by Dejounte Butler.

[11:09] Team_042 possession (Score: 54-56)
FOUL! Shooting foul on Scottie Turner. Tyler Barrett to the line for 3 free throws. [Team fouls: 2] (Scottie Turner: 1 personal fouls)   FT 1/3: GOOD   FT 2/3: GOOD   FT 3/3: GOOD Tyler Barrett makes 3/3 from the line.
Score: 57-56

[10:55] Team_041 possession (Score: 57-56)
FOUL! Shooting foul on Dejounte Butler. Stephen Ingram to the line for 2 free throws. [Team fouls: 2] (Dejounte Butler: 1 personal fouls)   FT 1/2: GOOD   FT 2/2: GOOD Stephen Ingram makes 2/2 from the line.
Score: 57-58

[10:38] Team_042 possession (Score: 57-58)
Dejounte Butler attempts a 3Pt. Contested by Stephen Ingram (4.5 feet, MAN). Dejounte Butler misses. Rebound secured by Stephen Ingram.

[10:25] Team_041 possession (Score: 57-58)
Jarrett Anunoby attempts a 3Pt. Contested by Tyler Barrett (3.9 feet, ZONE). Jarrett Anunoby misses. Rebound secured by Cade Dosunmu.

[10:11] Team_042 possession (Score: 57-58)
FOUL! Shooting foul on Stephen Ingram. Jarrett Sabonis to the line for 3 free throws. [Team fouls: 3] (Stephen Ingram: 1 personal fouls)   FT 1/3: MISS   FT 2/3: MISS   FT 3/3: GOOD Jarrett Sabonis makes 1/3 from the line.
Score: 58-58

[09:57] Team_041 possession (Score: 58-58)
Scottie Turner attempts a 3Pt. Contested by Tyler Barrett (3.2 feet, MAN). Scottie Turner misses. Offensive rebound by Stephen Ingram! Stephen Ingram kicks it out.

[09:46] Team_041 possession (Score: 58-58)
Dejounte Griffin attempts a Layup. Contested by Cade Dosunmu (4.0 feet, ZONE). Dejounte Griffin misses. Rebound secured by Tyler Barrett.

[09:32] Team_042 possession (Score: 58-58)
Tyler Barrett attempts a 3Pt. Contested by Scottie Turner (4.6 feet, ZONE). Tyler Barrett misses. Rebound secured by Dejounte Griffin.

[09:19] Team_041 possession (Score: 58-58)
Stephen Ingram attempts a 3Pt. Contested by Tyler Barrett (3.5 feet, ZONE). Stephen Ingram misses. FOUL! Loose ball foul on Tyler Barrett during the rebound battle. [Team fouls: 3] No free throws, side out. (Tyler Barrett: 1 personal fouls)

[09:04] Team_041 possession (Score: 58-58)
Scottie Turner attempts a Layup. BLOCKED BY TYLER BARRETT! Ball goes out off Tyler Barrett. Scottie Turner's ball!

[08:51] Team_041 possession (Score: 58-58)
Dejounte Griffin attempts a 3Pt. Contested by Tyler Barrett (3.4 feet, ZONE). Dejounte Griffin misses. Rebound secured by Dejounte Butler.

[08:32] Team_042 possession (Score: 58-58)
Tyler Barrett attempts a Midrange. Contested by Scottie Turner (4.6 feet, MAN). Tyler Barrett misses. Rebound secured by Terry Barrett.

[08:15] Team_041 possession (Score: 58-58)
Jarrett Anunoby attempts a Midrange. Contested by Kristaps Parker (5.5 feet, MAN). JARRETT ANUNOBY MAKES IT! Assist: Terry Barrett
Score: 58-60

[07:59] Team_042 possession (Score: 58-60)
Cade Dosunmu makes the 3Pt and draws the foul on Scottie Turner! And-1! Cade Dosunmu to the line for 1. [Team fouls: 4] (Scottie Turner: 2 personal fouls)   FT 1/1: GOOD Cade Dosunmu makes 1/1 from the line.
Score: 62-60

[07:42] Team_041 possession (Score: 62-60)
Jarrett Anunoby attempts a 3Pt. Contested by Tyler Barrett (3.9 feet, ZONE). Jarrett Anunoby misses. Rebound secured by Tyler Barrett.

[07:26] Team_042 possession (Score: 62-60)
FOUL! Holding foul on Jarrett Anunoby. [IN THE BONUS! 5 team fouls] Kristaps Parker to the line for 2 free throws. (Jarrett Anunoby: 1 personal fouls)   FT 1/2: GOOD   FT 2/2: MISS Kristaps Parker makes 1/2 from the line. Offensive rebound by Cade Dosunmu! Cade Dosunmu puts it back in!
Score: 65-60

[07:14] Team_041 possession (Score: 65-60)
Dejounte Griffin attempts a Midrange. Contested by Jarrett Sabonis (3.9 feet, MAN). DEJOUNTE GRIFFIN MAKES IT! Assist: Terry Barrett
Score: 65-62

[06:58] Team_042 possession (Score: 65-62)
Kristaps Parker attempts a Midrange. Contested by Jarrett Anunoby (4.2 feet, MAN). KRISTAPS PARKER MAKES IT!
Score: 67-62

[06:43] Team_041 possession (Score: 67-62)
Terry Barrett throws a bad pass out of bounds! TURNOVER! (dead ball)

[06:24] Team_042 possession (Score: 67-62)
Cade Dosunmu attempts a Midrange. Contested by Jarrett Anunoby (4.5 feet, ZONE). CADE DOSUNMU MAKES IT!
Score: 69-62

[06:07] Team_041 possession (Score: 69-62)
Scottie Turner drives, Tyler Barrett stays with him. Scottie Turner attempts a Layup. Contested by Tyler Barrett (3.2 feet, MAN). SCOTTIE TURNER MAKES IT! Assist: Terry Barrett
Score: 69-64

[05:49] Team_042 possession (Score: 69-64)
Dejounte Butler throws a bad pass out of bounds! TURNOVER! (dead ball)

[05:37] Team_041 possession (Score: 69-64)
FOUL! Reach-in foul on Kristaps Parker during the drive. [Team fouls: 4] No free throws, side out. (Kristaps Parker: 1 personal fouls)

[05:26] Team_041 possession (Score: 69-64)
FOUL! Reach-in foul on Cade Dosunmu during the drive. [IN THE BONUS! 5 team fouls] Scottie Turner to the line for 2 free throws. (Cade Dosunmu: 2 personal fouls)   FT 1/2: MISS   FT 2/2: GOOD Scottie Turner makes 1/2 from the line.
Score: 69-65

[05:14] Team_042 possession (Score: 69-65)
Kristaps Parker attempts a 3Pt. BLOCKED BY JARRETT ANUNOBY! Ball goes out off Jarrett Anunoby. Kristaps Parker's ball!

[05:02] Team_042 possession (Score: 69-65)
FOUL! Holding foul on Jarrett Anunoby. [IN THE BONUS! 6 team fouls] Kristaps Parker to the line for 2 free throws. (Jarrett Anunoby: 2 personal fouls)   FT 1/2: MISS   FT 2/2: MISS Kristaps Parker makes 0/2 from the line. Rebound secured by Dejounte Griffin.

[04:46] Team_041 possession (Score: 69-65)
Terry Barrett attempts a 3Pt. Contested by Cade Dosunmu (4.2 feet, MAN). Terry Barrett misses. Rebound secured by Cade Dosunmu.

[04:34] Team_042 possession (Score: 69-65)
Cade Dosunmu drives, Terry Barrett stays with him. Cade Dosunmu attempts a Layup. Contested by Terry Barrett (3.6 feet, ZONE). CADE DOSUNMU MAKES IT! Assist: Dejounte Butler
Score: 71-65

[04:23] Team_041 possession (Score: 71-65)
Scottie Turner attempts a 3Pt. Contested by Tyler Barrett (3.3 feet, ZONE). Scottie Turner misses. Rebound secured by Dejounte Butler.

[04:07] Team_042 possession (Score: 71-65)
Dejounte Butler attempts a 3Pt. Contested by Stephen Ingram (4.5 feet, MAN). Dejounte Butler misses. Rebound secured by Stephen Ingram.

[03:52] Team_041 possession (Score: 71-65)
Terry Barrett drives, Cade Dosunmu stays with him. Terry Barrett attempts a Layup. Contested by Cade Dosunmu (4.3 feet, ZONE). TERRY BARRETT MAKES IT!
Score: 71-67

[03:42] Team_042 possession (Score: 71-67)
Tyler Barrett attempts a Midrange. Contested by Scottie Turner (4.7 feet, MAN). TYLER BARRETT MAKES IT! Assist: Dejounte Butler
Score: 73-67

[03:23] Team_041 possession (Score: 73-67)
FOUL! Reach-in foul on Cade Dosunmu during the drive. [IN THE BONUS! 6 team fouls] Terry Barrett to the line for 2 free throws. (Cade Dosunmu: 3 personal fouls)   FT 1/2: GOOD   FT 2/2: GOOD Terry Barrett makes 2/2 from the line.
Score: 73-69

[03:10] Team_042 possession (Score: 73-69)
FOUL! Holding foul on Jarrett Anunoby. [IN THE BONUS! 7 team fouls] Kristaps Parker to the line for 2 free throws. (Jarrett Anunoby: 3 personal fouls)   FT 1/2: GOOD   FT 2/2: GOOD Kristaps Parker makes 2/2 from the line.
Score: 75-69

[02:57] Team_041 possession (Score: 75-69)
Terry Barrett attempts a Layup. Contested by Cade Dosunmu (4.4 feet, MAN). TERRY BARRETT MAKES IT!
Score: 75-71

[02:44] Team_042 possession (Score: 75-71)
Kristaps Parker attempts a 3Pt. Contested by Scottie Turner (4.2 feet, ZONE). Kristaps Parker misses. Rebound secured by Terry Barrett.

[02:30] Team_041 possession (Score: 75-71)
Stephen Ingram attempts a Layup. Contested by Dejounte Butler (4.0 feet, MAN). STEPHEN INGRAM MAKES IT! Assist: Jarrett Anunoby
Score: 75-73

[02:20] Team_042 possession (Score: 75-73)
FOUL! Shooting foul on Scottie Turner. Tyler Barrett to the line for 3 free throws. [BONUS: 8 team fouls] (Scottie Turner: 3 personal fouls)   FT 1/3: MISS   FT 2/3: MISS   FT 3/3: GOOD Tyler Barrett makes 1/3 from the line.
Score: 76-73

[02:05] Team_041 possession (Score: 76-73)
Scottie Turner drives, Cade Dosunmu stays with him. Scottie Turner attempts a Dunk. Contested by Cade Dosunmu (4.2 feet, ZONE). SCOTTIE TURNER MAKES IT!
Score: 76-75

[01:50] Team_042 possession (Score: 76-75)
Dejounte Butler drives and kicks out. Cade Dosunmu attempts a 3Pt. Contested by Terry Barrett (3.7 feet, MAN). Cade Dosunmu misses. Offensive rebound by Dejounte Butler! Dejounte Butler puts it back in!
Score: 78-75

[01:33] Team_041 possession (Score: 78-75)
Dejounte Griffin attempts a Layup. Contested by Jarrett Sabonis (4.3 feet, MAN). DEJOUNTE GRIFFIN MAKES IT!
Score: 78-77

[01:22] Team_042 possession (Score: 78-77)
Cade Dosunmu attempts a 3Pt. Contested by Stephen Ingram (4.7 feet, ZONE). Cade Dosunmu misses. Rebound secured by Terry Barrett.

[01:08] Team_041 possession (Score: 78-77)
Scottie Turner attempts a Layup. Contested by Cade Dosunmu (4.3 feet, ZONE). SCOTTIE TURNER MAKES IT!
Score: 78-79

[00:54] Team_042 possession (Score: 78-79)
Tyler Barrett drives to the basket... Tyler Barrett loses control! Ball rolls out of bounds! TURNOVER! (dead ball)

[00:54] Substitution (Team_042): Tyler Barrett OUT → Khris George IN (stamina_rule2)

[00:54] Substitution (Team_042): Kristaps Parker OUT → Isaiah Randle IN (stamina_rule2)

[00:54] Substitution (Team_042): Jarrett Sabonis OUT → Gary Jackson IN (stamina_rule2)

[00:54] Substitution (Team_042): Dejounte Butler OUT → Allen Towns IN (stamina_rule2)

[00:54] Substitution (Team_042): Cade Dosunmu OUT → Lamelo Stewart IN (stamina_rule2)

[00:54] Substitution (Team_041): Scottie Turner OUT → Franz Rose IN (stamina_rule2)

[00:54] Substitution (Team_041): Jarrett Anunoby OUT → Kyrie Booker IN (stamina_rule2)

[00:54] Substitution (Team_041): Dejounte Griffin OUT → Bam McCollum IN (stamina_rule2)

[00:54] Substitution (Team_041): Stephen Ingram OUT → Tobias McCollum IN (stamina_rule2)

[00:54] Substitution (Team_041): Terry Barrett OUT → De'Aaron Poole IN (stamina_rule2)

[00:41] Team_041 possession (Score: 78-79)
Kyrie Booker drives and kicks out. Bam McCollum attempts a 3Pt. Contested by Khris George (4.0 feet, ZONE). Bam McCollum misses. Rebound secured by Gary Jackson.

[00:26] Team_042 possession (Score: 78-79)
Allen Towns makes the Midrange and draws the foul on Tobias McCollum! And-1! Allen Towns to the line for 1. [BONUS: 9 team fouls] (Tobias McCollum: 1 personal fouls)   FT 1/1: MISS Allen Towns makes 0/1 from the line. Rebound secured by Kyrie Booker.
Score: 80-79

[00:11] Team_041 possession (Score: 80-79)
Kyrie Booker attempts a 3Pt. Contested by Isaiah Randle (5.1 feet, MAN). Kyrie Booker misses. Offensive rebound by De'Aaron Poole! De'Aaron Poole puts it back in!
Score: 80-81

================================================================================
                              3RD QUARTER COMPLETE                              
================================================================================

3RD QUARTER SCORE: Team_042 27, Team_041 26

BOX SCORE:
================================================================================

Team_042
--------------------------------------------------------------------------------
Player                MIN  PTS  REB  AST  TO      FG   FG%      3P   3P%
--------------------------------------------------------------------------------
Cade Dosunmu           36   12    2    0   0   5/7    71.4     0/0   0.0
Tyler Barrett          36    6    3    0   0   3/5    60.0     0/0   0.0
Kristaps Parker        36    4    0    0   0   2/3    66.7     0/0   0.0
Dejounte Butler        36    2    4    2   0   1/3    33.3     0/0   0.0
Jarrett Sabonis        36    1    0    0   0   1/1   100.0     0/0   0.0
Gary Jackson            1    0    1    0   0   0/0     0.0     0/0   0.0
Allen Towns             1    0    0    0   0   0/1     0.0     0/0   0.0

TEAM: FG: 12/21 (57.1%), 3PT: 4/9 (44.4%), REB: 10 (1 off, 9 def), AST: 2, TO: 2
TEAM FOULS: 6 [Team_041 in BONUS]


Team_041
--------------------------------------------------------------------------------
Player                MIN  PTS  REB  AST  TO      FG   FG%      3P   3P%
--------------------------------------------------------------------------------
Scottie Turner         36    7    0    0   0   4/5    80.0     0/0   0.0
Terry Barrett          36    6    5    3   0   3/5    60.0     0/0   0.0
Dejounte Griffin       36    4    2    0   0   2/5    40.0     0/0   0.0
Stephen Ingram         36    4    3    0   0   2/2   100.0     0/0   0.0
Jarrett Anunoby        36    2    0    1   0   1/3    33.3     0/0   0.0
De'Aaron Poole          1    2    1    0   0   1/1   100.0     0/0   0.0
Kyrie Booker            1    0    1    0   0   0/1     0.0     0/0   0.0

TEAM: FG: 13/22 (59.1%), 3PT: 1/6 (16.7%), REB: 12 (3 off, 9 def), AST: 4, TO: 1
TEAM FOULS: 9 [Team_042 in BONUS]

================================================================================

================================================================================
                       4TH QUARTER - Team_042 vs Team_041                       
================================================================================

[12:00] Team_042 possession (Score: 80-81)
Kristaps Parker drives, Stephen Ingram stays with him. Kristaps Parker attempts a Dunk. Contested by Stephen Ingram (4.2 feet, ZONE). KRISTAPS PARKER MAKES IT! Assist: Tyler Barrett
Score: 82-81

[11:45] Team_041 possession (Score: 82-81)
FOUL! Shooting foul on Tyler Barrett. Jarrett Anunoby to the line for 3 free throws. [Team fouls: 1] (Tyler Barrett: 1 personal fouls)   FT 1/3: GOOD   FT 2/3: GOOD   FT 3/3: MISS Jarrett Anunoby makes 2/3 from the line. Offensive rebound by Stephen Ingram! Stephen Ingram kicks it out.
Score: 82-83

[11:27] Team_041 possession (Score: 82-83)
Dejounte Griffin drives and kicks out. Terry Barrett attempts a Midrange. Contested by Dejounte Butler (3.9 feet, ZONE). TERRY BARRETT MAKES IT!
Score: 82-85

[11:09] Team_042 possession (Score: 82-85)
Kristaps Parker attempts a Layup. Contested by Terry Barrett (3.4 feet, ZONE). KRISTAPS PARKER MAKES IT! Assist: Jarrett Sabonis
Score: 84-85

[10:53] Team_041 possession (Score: 84-85)
Stephen Ingram attempts a Midrange. Contested by Dejounte Butler (4.0 feet, ZONE). Stephen Ingram misses. Rebound secured by Cade Dosunmu.

[10:38] Team_042 possession (Score: 84-85)
FOUL! Shooting foul on Stephen Ingram. Dejounte Butler to the line for 2 free throws. [Team fouls: 1] (Stephen Ingram: 1 personal fouls)   FT 1/2: GOOD   FT 2/2: GOOD Dejounte Butler makes 2/2 from the line.
Score: 86-85

[10:22] Team_041 possession (Score: 86-85)
Stephen Ingram attempts a Midrange. Contested by Dejounte Butler (4.1 feet, MAN). Stephen Ingram misses. Rebound secured by Cade Dosunmu.

[10:11] Team_042 possession (Score: 86-85)
Dejounte Butler attempts a Midrange. Contested by Jarrett Anunoby (4.9 feet, ZONE). Dejounte Butler misses. Rebound secured by Dejounte Griffin.

[09:58] Team_041 possession (Score: 86-85)
Scottie Turner drives, picks up Cade Dosunmu. Help arrives from Tyler Barrett! Scottie Turner attempts a Dunk. Contested by Tyler Barrett (4.3 feet, ZONE). Scottie Turner misses. Rebound secured by Tyler Barrett.

[09:42] Team_042 possession (Score: 86-85)
Dejounte Butler attempts a Midrange. Contested by Jarrett Anunoby (4.9 feet, ZONE). Dejounte Butler misses. Rebound secured by Stephen Ingram.

[09:26] Team_041 possession (Score: 86-85)
Jarrett Anunoby attempts a 3Pt. Contested by Jarrett Sabonis (4.8 feet, ZONE). Jarrett Anunoby misses. Rebound secured by Cade Dosunmu.

[09:10] Team_042 possession (Score: 86-85)
FOUL! Shooting foul on Terry Barrett. Cade Dosunmu to the line for 2 free throws. [Team fouls: 2] (Terry Barrett: 1 personal fouls)   FT 1/2: GOOD   FT 2/2: GOOD Cade Dosunmu makes 2/2 from the line.
Score: 88-85

[08:52] Team_041 possession (Score: 88-85)
Stephen Ingram drives to the basket... Stephen Ingram commits a violation (traveling/carry)! TURNOVER! (dead ball)

[08:52] Substitution (Team_042): Tyler Barrett OUT → Khris George IN (stamina_rule2)

[08:52] Substitution (Team_042): Kristaps Parker OUT → Isaiah Randle IN (stamina_rule2)

[08:52] Substitution (Team_042): Jarrett Sabonis OUT → Gary Jackson IN (stamina_rule2)

[08:52] Substitution (Team_042): Dejounte Butler OUT → Allen Towns IN (stamina_rule2)

[08:52] Substitution (Team_042): Cade Dosunmu OUT → Lamelo Stewart IN (stamina_rule2)

[08:52] Substitution (Team_041): Scottie Turner OUT → Franz Rose IN (stamina_rule2)

[08:52] Substitution (Team_041): Jarrett Anunoby OUT → Kyrie Booker IN (stamina_rule2)

[08:52] Substitution (Team_041): Dejounte Griffin OUT → Bam McCollum IN (stamina_rule2)

[08:52] Substitution (Team_041): Stephen Ingram OUT → Tobias McCollum IN (stamina_rule2)

[08:52] Substitution (Team_041): Terry Barrett OUT → De'Aaron Poole IN (stamina_rule2)

[08:37] Team_042 possession (Score: 88-85)
Allen Towns drives, Tobias McCollum stays with him. Allen Towns attempts a Dunk. Contested by Tobias McCollum (5.7 feet, ZONE). ALLEN TOWNS MAKES IT! Assist: Khris George
Score: 90-85

[08:23] Team_041 possession (Score: 90-85)
Franz Rose drives and kicks out. Tobias McCollum attempts a 3Pt. Contested by Allen Towns (4.3 feet, MAN). TOBIAS MCCOLLUM MAKES IT! Assist: De'Aaron Poole
Score: 90-88

[08:08] Team_042 possession (Score: 90-88)
Allen Towns drives, Tobias McCollum stays with him. Allen Towns attempts a Layup. Contested by Tobias McCollum (5.7 feet, MAN). ALLEN TOWNS MAKES IT!
Score: 92-88

[07:50] Team_041 possession (Score: 92-88)
Tobias McCollum attempts a Midrange. Contested by Khris George (4.2 feet, ZONE). Tobias McCollum misses. Rebound secured by Lamelo Stewart.

[07:40] Team_042 possession (Score: 92-88)
FOUL! Shooting foul on Bam McCollum. Gary Jackson to the line for 2 free throws. [Team fouls: 3] (Bam McCollum: 1 personal fouls)   FT 1/2: GOOD   FT 2/2: GOOD Gary Jackson makes 2/2 from the line.
Score: 94-88

[07:30] Team_041 possession (Score: 94-88)
Franz Rose drives and kicks out. Bam McCollum attempts a Midrange. Contested by Isaiah Randle (5.1 feet, ZONE). BAM MCCOLLUM MAKES IT! Assist: Tobias McCollum
Score: 94-90

[07:16] Team_042 possession (Score: 94-90)
Lamelo Stewart throws a bad pass! Stolen by De'Aaron Poole! TURNOVER! (live ball)

[07:04] Team_041 possession (Score: 94-90)
Bam McCollum attempts a 3Pt. Contested by Gary Jackson (4.3 feet, MAN). Bam McCollum misses. Rebound secured by Lamelo Stewart.

[06:50] Team_042 possession (Score: 94-90)
Gary Jackson attempts a 3Pt. Contested by Bam McCollum (5.9 feet, MAN). Gary Jackson misses. Offensive rebound by Lamelo Stewart! Lamelo Stewart kicks it out.

[06:37] Team_042 possession (Score: 94-90)
Isaiah Randle attempts a Layup. Contested by Tobias McCollum (5.3 feet, ZONE). Isaiah Randle misses. Rebound secured by De'Aaron Poole.

[06:25] Team_041 possession (Score: 94-90)
Bam McCollum attempts a 3Pt. Contested by Khris George (3.7 feet, ZONE). Bam McCollum misses. Rebound secured by Lamelo Stewart.

[06:12] Team_042 possession (Score: 94-90)
Lamelo Stewart drives to the basket... Lamelo Stewart throws a bad pass! Stolen by Tobias McCollum! TURNOVER! (live ball)

[05:56] Team_041 possession (Score: 94-90)
Kyrie Booker attempts a Layup. Contested by Allen Towns (4.3 feet, ZONE). Kyrie Booker misses. FOUL! Loose ball foul on Lamelo Stewart during the rebound battle. [Team fouls: 2] No free throws, side out. (Lamelo Stewart: 1 personal fouls)

[05:42] Team_041 possession (Score: 94-90)
De'Aaron Poole attempts a Midrange. Contested by Lamelo Stewart (4.1 feet, MAN). De'Aaron Poole misses. Rebound secured by Lamelo Stewart.

[05:31] Team_042 possession (Score: 94-90)
Lamelo Stewart makes the Layup and draws the foul on Kyrie Booker! And-1! Lamelo Stewart to the line for 1. [Team fouls: 4] (Kyrie Booker: 1 personal fouls)   FT 1/1: GOOD Lamelo Stewart makes 1/1 from the line.
Score: 97-90

[05:16] Team_041 possession (Score: 97-90)
Kyrie Booker attempts a 3Pt. Contested by Isaiah Randle (5.1 feet, MAN). KYRIE BOOKER MAKES IT! Assist: De'Aaron Poole
Score: 97-93

[05:02] Team_042 possession (Score: 97-93)
Lamelo Stewart commits a violation (traveling/carry)! TURNOVER! (dead ball)

[04:49] Team_041 possession (Score: 97-93)
FOUL! Holding foul on Allen Towns. [Team fouls: 3] No free throws, side out. (Allen Towns: 1 personal fouls)

[04:39] Team_041 possession (Score: 97-93)
Tobias McCollum attempts a 3Pt. Contested by Allen Towns (4.5 feet, MAN). Tobias McCollum misses. Offensive rebound by Tobias McCollum! Tobias McCollum kicks it out.

[04:20] Team_041 possession (Score: 97-93)
Franz Rose attempts a 3Pt. Contested by Khris George (4.0 feet, ZONE). Franz Rose misses. Rebound secured by Gary Jackson.

[04:05] Team_042 possession (Score: 97-93)
Gary Jackson attempts a 3Pt. Contested by Bam McCollum (5.9 feet, MAN). Gary Jackson misses. Rebound secured by Kyrie Booker.

[03:50] Team_041 possession (Score: 97-93)
Tobias McCollum attempts a Midrange. Contested by Allen Towns (4.5 feet, ZONE). Tobias McCollum misses. Rebound secured by Allen Towns.

[03:35] Team_042 possession (Score: 97-93)
Gary Jackson attempts a 3Pt. Contested by Kyrie Booker (4.4 feet, ZONE). GARY JACKSON MAKES IT! Assist: Khris George
Score: 100-93

[03:20] Team_041 possession (Score: 100-93)
Bam McCollum attempts a 3Pt. Contested by Khris George (3.7 feet, ZONE). Bam McCollum misses. Rebound secured by Lamelo Stewart.

[03:06] Team_042 possession (Score: 100-93)
Allen Towns attempts a Midrange. Contested by Kyrie Booker (4.9 feet, ZONE). Allen Towns misses. Rebound secured by Kyrie Booker.

[02:51] Team_041 possession (Score: 100-93)
De'Aaron Poole drives to the basket... De'Aaron Poole throws a bad pass! Stolen by Lamelo Stewart! TURNOVER! (live ball)

[02:33] Team_042 possession (Score: 100-93)
Khris George drives, Franz Rose stays with him. Khris George attempts a Layup. Wide open! Franz Rose is 6.1 feet away. [MAN] KHRIS GEORGE MAKES IT! Assist: Gary Jackson
Score: 102-93

[02:17] Team_041 possession (Score: 102-93)
Kyrie Booker attempts a 3Pt. Contested by Isaiah Randle (5.1 feet, MAN). Kyrie Booker misses. Offensive rebound by Tobias McCollum! Tobias McCollum kicks it out.

[02:03] Team_041 possession (Score: 102-93)
Franz Rose attempts a 3Pt. Contested by Khris George (4.1 feet, MAN). Franz Rose misses. Rebound secured by Allen Towns.

[01:50] Team_042 possession (Score: 102-93)
Gary Jackson attempts a 3Pt. Contested by Kyrie Booker (4.5 feet, ZONE). Gary Jackson misses. Rebound secured by Kyrie Booker.

[01:33] Team_041 possession (Score: 102-93)
Franz Rose attempts a 3Pt. Contested by Khris George (4.1 feet, MAN). Franz Rose misses. Rebound secured by Lamelo Stewart.

[01:15] Team_042 possession (Score: 102-93)
Lamelo Stewart attempts a Midrange. Contested by De'Aaron Poole (5.1 feet, MAN). Lamelo Stewart misses. Offensive rebound by Allen Towns! Allen Towns kicks it out.

[01:03] Team_042 possession (Score: 102-93)
Allen Towns attempts a 3Pt. Contested by Kyrie Booker (5.1 feet, ZONE). ALLEN TOWNS MAKES IT!
Score: 105-93

[00:49] Team_041 possession (Score: 105-93)
Bam McCollum attempts a Layup. Contested by Gary Jackson (4.5 feet, MAN). BAM MCCOLLUM MAKES IT!
Score: 105-95

[00:37] Team_042 possession (Score: 105-95)
Isaiah Randle drives to the basket... Isaiah Randle throws a bad pass! Stolen by Tobias McCollum! TURNOVER! (live ball)

[00:18] Team_041 possession (Score: 105-95)
Tobias McCollum attempts a Layup. BLOCKED BY ALLEN TOWNS! Ball deflects out of bounds off Tobias McCollum.

[00:03] Team_042 possession (Score: 105-95)
Allen Towns makes the Midrange and draws the foul on Tobias McCollum! And-1! Allen Towns to the line for 1. [BONUS: 5 team fouls] (Tobias McCollum: 1 personal fouls)   FT 1/1: MISS Allen Towns makes 0/1 from the line. Rebound secured by Tobias McCollum.
Score: 107-95

================================================================================
                              4TH QUARTER COMPLETE                              
================================================================================

4TH QUARTER SCORE: Team_042 27, Team_041 14

BOX SCORE:
================================================================================

Team_042
--------------------------------------------------------------------------------
Player                MIN  PTS  REB  AST  TO      FG   FG%      3P   3P%
--------------------------------------------------------------------------------
Allen Towns            10    7    3    0   0   3/5    60.0     0/0   0.0
Gary Jackson           10    5    1    1   0   2/4    50.0     0/0   0.0
Kristaps Parker        39    4    0    0   0   2/2   100.0     0/0   0.0
Lamelo Stewart         10    3    7    0   0   1/1   100.0     0/0   0.0
Cade Dosunmu           39    2    3    0   0   1/1   100.0     0/0   0.0
Dejounte Butler        39    2    0    0   0   1/3    33.3     0/0   0.0
Khris George           10    2    0    2   0   1/1   100.0     0/0   0.0
Tyler Barrett          39    0    1    1   0   0/0     0.0     0/0   0.0
Jarrett Sabonis        39    0    0    1   0   0/0     0.0     0/0   0.0
Isaiah Randle          10    0    0    0   0   0/1     0.0     0/0   0.0

TEAM: FG: 11/18 (61.1%), 3PT: 2/4 (50.0%), REB: 15 (2 off, 13 def), AST: 5, TO: 4
TEAM FOULS: 3


Team_041
--------------------------------------------------------------------------------
Player                MIN  PTS  REB  AST  TO      FG   FG%      3P   3P%
--------------------------------------------------------------------------------
Bam McCollum           10    4    0    0   0   2/5    40.0     0/0   0.0
Tobias McCollum        10    3    4    1   0   1/4    25.0     0/0   0.0
Kyrie Booker           10    3    3    0   0   1/1   100.0     0/0   0.0
Terry Barrett          39    2    0    0   0   1/1   100.0     0/0   0.0
Stephen Ingram         39    0    2    0   0   0/2     0.0     0/0   0.0
Dejounte Griffin       39    0    1    0   0   0/0     0.0     0/0   0.0
Scottie Turner         39    0    0    0   0   0/1     0.0     0/0   0.0
Jarrett Anunoby        39    0    0    0   0   0/1     0.0     0/0   0.0
De'Aaron Poole         10    0    1    2   0   0/1     0.0     0/0   0.0
Franz Rose             10    0    0    0   0   0/3     0.0     0/0   0.0

TEAM: FG: 5/19 (26.3%), 3PT: 1/8 (12.5%), REB: 11 (4 off, 7 def), AST: 3, TO: 2
TEAM FOULS: 5 [Team_042 in BONUS]

================================================================================

================================================================================
                               FULL GAME COMPLETE                               
================================================================================

FINAL SCORE: Team_042 107, Team_041 95

SCORING BY QUARTER:
--------------------------------------------------------------------------------
Team                     Q1     Q2     Q3     Q4    FINAL
--------------------------------------------------------------------------------
Team_042                 24     29     27     27      107
Team_041                 29     26     26     14       95
--------------------------------------------------------------------------------

FULL GAME BOX SCORE:
================================================================================

Team_042
--------------------------------------------------------------------------------
Player                MIN  PTS  REB  AST  TO      FG   FG%      3P   3P%      FT STL BLK
--------------------------------------------------------------------------------
Tyler Barrett          39   10   11    2   0   6/10   60.0   3/5    60.0   8/10    0   1
Kristaps Parker        39   26    0    1   0  11/16   68.8   2/6    33.3   7/11    0   0
Jarrett Sabonis        39    7    0    2   0   4/8    50.0   3/4    75.0   2/5     0   0
Dejounte Butler        39   11   12    3   6   3/11   27.3   0/5     0.0   3/5     1   0
Cade Dosunmu           39   30   17    1   0  12/17   70.6   2/3    66.7  12/14    1   1
Khris George           10    2    0    2   1   1/1   100.0   0/0     0.0   0/0     0   0
Isaiah Randle          10    0    0    0   0   0/1     0.0   0/0     0.0   0/0     0   0
Gary Jackson           10    5    2    1   0   2/4    50.0   1/3    33.3   2/2     0   0
Allen Towns            10    7    3    0   0   3/6    50.0   1/1   100.0   0/2     0   1
Lamelo Stewart         10    3    7    0   3   1/1   100.0   0/0     0.0   1/1     1   0

TEAM: FG: 46/79 (58.2%), 3PT: 12/27 (44.4%), REB: 51 (10 off, 41 def), AST: 12, TO: 10


Team_041
--------------------------------------------------------------------------------
Player                MIN  PTS  REB  AST  TO      FG   FG%      3P   3P%      FT STL BLK
--------------------------------------------------------------------------------
Scottie Turner         39   16    0    1   0   8/14   57.1   2/6    33.3   3/5     1   0
Jarrett Anunoby        39    4    1    3   0   2/13   15.4   0/6     0.0   2/3     0   2
Dejounte Griffin       39   14    9    0   0   9/15   60.0   3/6    50.0   0/1     0   0
Stephen Ingram         39   15   16    4   2   8/13   61.5   1/3    33.3   2/2     0   0
Terry Barrett          39   27   12    7   2   8/11   72.7   0/1     0.0   4/5     2   1
Franz Rose             10    0    0    0   0   2/5    40.0   0/3     0.0   0/0     0   0
Kyrie Booker           10    3    4    0   0   2/3    66.7   2/2   100.0   0/0     0   0
Bam McCollum           10    4    0    0   0   1/4    25.0   0/3     0.0   0/0     0   0
Tobias McCollum        10    3    4    1   1   0/3     0.0   0/0     0.0   0/0     2   0
De'Aaron Poole         10    2    2    2   0   0/1     0.0   0/0     0.0   0/0     1   0

TEAM: FG: 40/82 (48.8%), 3PT: 8/30 (26.7%), REB: 48 (15 off, 33 def), AST: 18, TO: 5

================================================================================
