================================================================================
                        FULL GAME - Team_024 vs Team_082                        
================================================================================

================================================================================
                       1ST QUARTER - Team_024 vs Team_082                       
================================================================================

[12:00] Team_024 possession (Score: 0-0)
Ja Reaves drives to the basket... Ja Reaves throws a bad pass! Stolen by Jrue Green! TURNOVER! (live ball)

[11:46] Team_082 possession (Score: 0-0)
Julius Anthony attempts a 3Pt. Contested by Zach Fox (3.9 feet, ZONE). Julius Anthony misses. Rebound secured by Anfernee Williamson.

[11:28] Team_024 possession (Score: 0-0)
Ja Reaves attempts a 3Pt. Contested by Julius Anthony (4.6 feet, MAN). Ja Reaves misses. Rebound secured by Jrue Green.

[11:14] Team_082 possession (Score: 0-0)
Kristaps Fox attempts a 3Pt. Contested by Bradley Allen (4.0 feet, MAN). Kristaps Fox misses. Rebound secured by Anfernee Williamson.

[11:02] Team_024 possession (Score: 0-0)
Bradley Allen attempts a 3Pt. Contested by Dwyane O'Neal (3.3 feet, ZONE). BRADLEY ALLEN MAKES IT! Assist: Draymond Towns
Score: 3-0

[10:46] Team_082 possession (Score: 3-0)
FOUL! Reach-in foul on Anfernee Williamson during the drive. [Team fouls: 1] No free throws, side out. (Anfernee Williamson: 1 personal fouls)

[10:36] Team_082 possession (Score: 3-0)
Kristaps Fox makes the Dunk and draws the foul on Zach Fox! And-1! Kristaps Fox to the line for 1. [Team fouls: 2] (Zach Fox: 1 personal fouls)   FT 1/1: GOOD Kristaps Fox makes 1/1 from the line.
Score: 3-3

[10:24] Team_024 possession (Score: 3-3)
FOUL! Reach-in foul on Julius Anthony during the drive. [Team fouls: 1] No free throws, side out. (Julius Anthony: 1 personal fouls)

[10:08] Team_024 possession (Score: 3-3)
Draymond Towns drives to the basket... Draymond Towns throws a bad pass out of bounds! TURNOVER! (dead ball)

[09:53] Team_082 possession (Score: 3-3)
Dwyane O'Neal attempts a 3Pt. Contested by Zach Fox (3.5 feet, ZONE). Dwyane O'Neal misses. Offensive rebound by Julius Carter! Julius Carter kicks it out.

[09:36] Team_082 possession (Score: 3-3)
FOUL! Reach-in foul on Anfernee Williamson during the drive. [Team fouls: 3] No free throws, side out. (Anfernee Williamson: 2 personal fouls)

[09:24] Team_082 possession (Score: 3-3)
Kristaps Fox attempts a 3Pt. Contested by Zach Fox (3.6 feet, ZONE). Kristaps Fox misses. Rebound secured by Draymond Towns.

[09:12] Team_024 possession (Score: 3-3)
FOUL! Reach-in foul on Julius Carter during the drive. [Team fouls: 2] No free throws, side out. (Julius Carter: 1 personal fouls)

[08:57] Team_024 possession (Score: 3-3)
Bradley Allen attempts a Midrange. BLOCKED BY KRISTAPS FOX! Ball is loose! Rebound secured by Jrue Green.

[08:41] Team_082 possession (Score: 3-3)
Dwyane O'Neal makes the Layup and draws the foul on Zach Fox! And-1! Dwyane O'Neal to the line for 1. [Team fouls: 4] (Zach Fox: 2 personal fouls)   FT 1/1: GOOD Dwyane O'Neal makes 1/1 from the line.
Score: 3-6

[08:24] Team_024 possession (Score: 3-6)
Draymond Towns drives, picks up Jrue Green. Help arrives from Dwyane O'Neal! Draymond Towns attempts a Layup. Contested by Dwyane O'Neal (4.6 feet, ZONE). Draymond Towns misses. Offensive rebound by Zach Fox! Zach Fox kicks it out.

[08:08] Team_024 possession (Score: 3-6)
Anfernee Williamson attempts a Layup. Contested by Jrue Green (4.9 feet, MAN). Anfernee Williamson misses. Offensive rebound by Draymond Towns! Draymond Towns puts it back in!
Score: 5-6

[07:52] Team_082 possession (Score: 5-6)
Jrue Green attempts a Midrange. Contested by Anfernee Williamson (3.9 feet, MAN). JRUE GREEN MAKES IT! Assist: Dwyane O'Neal
Score: 5-8

[07:38] Team_024 possession (Score: 5-8)
Zach Fox attempts a 3Pt. Contested by Dwyane O'Neal (3.6 feet, ZONE). Zach Fox misses. Rebound secured by Dwyane O'Neal.

[07:21] Team_082 possession (Score: 5-8)
Dwyane O'Neal attempts a Layup. BLOCKED BY ZACH FOX! Ball is loose! Offensive rebound by Jrue Green! Jrue Green kicks it out.

[07:07] Team_082 possession (Score: 5-8)
Jrue Green attempts a 3Pt. Contested by Zach Fox (3.8 feet, ZONE). Jrue Green misses. Rebound secured by Draymond Towns.

[06:53] Team_024 possession (Score: 5-8)
FOUL! Reach-in foul on Julius Carter during the drive. [Team fouls: 3] No free throws, side out. (Julius Carter: 2 personal fouls)

[06:39] Team_024 possession (Score: 5-8)
Bradley Allen attempts a 3Pt. Contested by Dwyane O'Neal (3.3 feet, ZONE). Bradley Allen misses. Offensive rebound by Draymond Towns! Draymond Towns puts it back in!
Score: 7-8

[06:27] Team_082 possession (Score: 7-8)
Dwyane O'Neal loses the ball! Stripped by Zach Fox! TURNOVER! (live ball)

[06:14] Team_024 possession (Score: 7-8)
Draymond Towns attempts a 3Pt. Contested by Julius Carter (5.3 feet, MAN). Draymond Towns misses. Rebound secured by Julius Carter.

[06:01] Team_082 possession (Score: 7-8)
Julius Anthony attempts a Midrange. Contested by Ja Reaves (4.8 feet, MAN). Julius Anthony misses. Rebound secured by Zach Fox.

[05:44] Team_024 possession (Score: 7-8)
Draymond Towns drives and kicks out. Draymond Towns attempts a 3Pt. Contested by Dwyane O'Neal (3.3 feet, ZONE). Draymond Towns misses. FOUL! Loose ball foul on Dwyane O'Neal during the rebound battle. [Team fouls: 4] No free throws, side out. (Dwyane O'Neal: 1 personal fouls)

[05:31] Team_024 possession (Score: 7-8)
Draymond Towns attempts a Midrange. BLOCKED BY JULIUS CARTER! Ball deflects out of bounds off Draymond Towns.

[05:13] Team_082 possession (Score: 7-8)
Julius Anthony attempts a 3Pt. Contested by Ja Reaves (4.9 feet, MAN). Julius Anthony misses. Rebound secured by Draymond Towns.

[05:04] Team_024 possession (Score: 7-8)
Ja Reaves attempts a Midrange. Contested by Julius Anthony (4.6 feet, MAN). Ja Reaves misses. Rebound secured by Dwyane O'Neal.

[04:52] Team_082 possession (Score: 7-8)
Julius Carter drives and kicks out. Julius Carter attempts a 3Pt. Contested by Anfernee Williamson (3.7 feet, MAN). JULIUS CARTER MAKES IT! Assist: Dwyane O'Neal
Score: 7-11

[04:39] Team_024 possession (Score: 7-11)
Bradley Allen makes the Midrange and draws the foul on Kristaps Fox! And-1! Bradley Allen to the line for 1. [BONUS: 5 team fouls] (Kristaps Fox: 1 personal fouls)   FT 1/1: GOOD Bradley Allen makes 1/1 from the line.
Score: 10-11

[04:19] Team_082 possession (Score: 10-11)
Jrue Green attempts a 3Pt. Contested by Zach Fox (3.9 feet, ZONE). Jrue Green misses. Rebound secured by Zach Fox.

[04:05] Team_024 possession (Score: 10-11)
Zach Fox attempts a 3Pt. Contested by Dwyane O'Neal (3.7 feet, ZONE). ZACH FOX MAKES IT! Assist: Bradley Allen
Score: 13-11

[03:49] Team_082 possession (Score: 13-11)
Dwyane O'Neal attempts a 3Pt. Contested by Zach Fox (3.6 feet, MAN). DWYANE O'NEAL MAKES IT! Assist: Julius Anthony
Score: 13-14

[03:35] Team_024 possession (Score: 13-14)
Bradley Allen attempts a Midrange. Contested by Kristaps Fox (4.4 feet, MAN). Bradley Allen misses. Rebound secured by Dwyane O'Neal.

[03:20] Team_082 possession (Score: 13-14)
FOUL! Reach-in foul on Anfernee Williamson during the drive. [IN THE BONUS! 5 team fouls] Julius Carter to the line for 2 free throws. (Anfernee Williamson: 3 personal fouls)   FT 1/2: GOOD   FT 2/2: GOOD Julius Carter makes 2/2 from the line.
Score: 13-16

[03:07] Team_024 possession (Score: 13-16)
Draymond Towns attempts a Layup. BLOCKED BY JULIUS CARTER! Ball deflects out of bounds off Draymond Towns.

[02:51] Team_082 possession (Score: 13-16)
Dwyane O'Neal drives, picks up Zach Fox. Help arrives from Bradley Allen! Dwyane O'Neal attempts a Layup. Contested by Bradley Allen (3.7 feet, MAN). DWYANE O'NEAL MAKES IT!
Score: 13-18

[02:34] Team_024 possession (Score: 13-18)
Draymond Towns commits a violation (traveling/carry)! TURNOVER! (dead ball)

[02:34] Substitution (Team_024): Anfernee Williamson OUT → Julius Harris IN (stamina_rule2)

[02:34] Substitution (Team_024): Draymond Towns OUT → Terry Rozier IN (stamina_rule2)

[02:34] Substitution (Team_082): Julius Anthony OUT → Jordan Rozier IN (stamina_rule2)

[02:34] Substitution (Team_082): Kristaps Fox OUT → Shaquille Griffin IN (stamina_rule2)

[02:34] Substitution (Team_082): Jrue Green OUT → Tony Jokic IN (stamina_rule2)

[02:34] Substitution (Team_082): Julius Carter OUT → D'Angelo Parker IN (stamina_rule2)

[02:21] Team_082 possession (Score: 13-18)
Jordan Rozier attempts a 3Pt. Contested by Zach Fox (3.9 feet, ZONE). Jordan Rozier misses. Rebound secured by Terry Rozier.

[02:08] Team_024 possession (Score: 13-18)
Terry Rozier makes the Dunk and draws the foul on Dwyane O'Neal! And-1! Terry Rozier to the line for 1. [BONUS: 6 team fouls] (Dwyane O'Neal: 2 personal fouls)   FT 1/1: GOOD Terry Rozier makes 1/1 from the line.
Score: 16-18

[01:51] Team_082 possession (Score: 16-18)
Shaquille Griffin attempts a 3Pt. Contested by Bradley Allen (4.1 feet, MAN). Shaquille Griffin misses. Rebound secured by Zach Fox.

[01:37] Team_024 possession (Score: 16-18)
Bradley Allen attempts a Midrange. Contested by Tony Jokic (5.0 feet, ZONE). Bradley Allen misses. Rebound secured by Shaquille Griffin.

[01:27] Team_082 possession (Score: 16-18)
Shaquille Griffin drives to the basket... Shaquille Griffin loses the ball! Stripped by Bradley Allen! TURNOVER! (live ball)

[01:10] Team_024 possession (Score: 16-18)
Terry Rozier drives and kicks out. Bradley Allen attempts a Midrange. Contested by Dwyane O'Neal (3.7 feet, ZONE). Bradley Allen misses. Rebound secured by Dwyane O'Neal.

[00:55] Team_082 possession (Score: 16-18)
Tony Jokic drives, Julius Harris stays with him. Tony Jokic attempts a Dunk. Contested by Julius Harris (4.7 feet, MAN). Tony Jokic misses. Rebound secured by Terry Rozier.

[00:37] Team_024 possession (Score: 16-18)
Zach Fox drives and kicks out. Terry Rozier attempts a 3Pt. Contested by Tony Jokic (5.1 feet, ZONE). TERRY ROZIER MAKES IT! Assist: Julius Harris
Score: 19-18

[00:27] Team_082 possession (Score: 19-18)
D'Angelo Parker drives, Terry Rozier stays with him. D'Angelo Parker attempts a Layup. Contested by Terry Rozier (4.4 feet, MAN). D'Angelo Parker misses. Rebound secured by Zach Fox.

[00:11] Team_024 possession (Score: 19-18)
Zach Fox attempts a 3Pt. Contested by Dwyane O'Neal (4.2 feet, ZONE). ZACH FOX MAKES IT! Assist: Terry Rozier
Score: 22-18

================================================================================
                              1ST QUARTER COMPLETE                              
================================================================================

1ST QUARTER SCORE: Team_024 22, Team_082 18

BOX SCORE:
================================================================================

Team_024
--------------------------------------------------------------------------------
Player                MIN  PTS  REB  AST  TO      FG   FG%      3P   3P%
--------------------------------------------------------------------------------
Bradley Allen          12    6    0    1   0   2/5    40.0     0/0   0.0
Zach Fox               12    6    5    0   0   2/3    66.7     0/0   0.0
Terry Rozier            2    6    2    1   0   2/3    66.7     0/0   0.0
Draymond Towns         10    4    6    1   0   2/5    40.0     0/0   0.0
Anfernee Williamson    10    0    2    0   0   0/0     0.0     0/0   0.0
Ja Reaves              12    0    0    0   0   0/2     0.0     0/0   0.0
Julius Harris           2    0    0    1   0   0/0     0.0     0/0   0.0

TEAM: FG: 8/18 (44.4%), 3PT: 4/7 (57.1%), REB: 15 (4 off, 11 def), AST: 4, TO: 3
TEAM FOULS: 5 [Team_082 in BONUS]


Team_082
--------------------------------------------------------------------------------
Player                MIN  PTS  REB  AST  TO      FG   FG%      3P   3P%
--------------------------------------------------------------------------------
Dwyane O'Neal          12    8    4    2   0   3/3   100.0     0/0   0.0
Julius Carter          10    5    2    0   0   2/2   100.0     0/0   0.0
Kristaps Fox           10    3    0    0   0   1/3    33.3     0/0   0.0
Jrue Green             10    2    3    0   0   1/3    33.3     0/0   0.0
Julius Anthony         10    0    0    1   0   0/3     0.0     0/0   0.0
Jordan Rozier           2    0    0    0   0   0/1     0.0     0/0   0.0
Shaquille Griffin       2    0    1    0   0   0/1     0.0     0/0   0.0
Tony Jokic              2    0    0    0   0   0/1     0.0     0/0   0.0
D'Angelo Parker         2    0    0    0   0   0/1     0.0     0/0   0.0

TEAM: FG: 7/18 (38.9%), 3PT: 1/9 (11.1%), REB: 10 (2 off, 8 def), AST: 3, TO: 2
TEAM FOULS: 6 [Team_024 in BONUS]

================================================================================

================================================================================
                       2ND QUARTER - Team_024 vs Team_082                       
================================================================================

[12:00] Team_024 possession (Score: 22-18)
Anfernee Williamson attempts a Layup. Contested by Jrue Green (4.9 feet, MAN). ANFERNEE WILLIAMSON MAKES IT! Assist: Bradley Allen
Score: 24-18

[11:47] Team_082 possession (Score: 24-18)
Jrue Green attempts a Layup. BLOCKED BY ANFERNEE WILLIAMSON! Ball is loose! Offensive rebound by Julius Carter! Julius Carter kicks it out.

[11:32] Team_082 possession (Score: 24-18)
Julius Carter attempts a Midrange. Contested by Anfernee Williamson (4.1 feet, ZONE). Julius Carter misses. Rebound secured by Zach Fox.

[11:21] Team_024 possession (Score: 24-18)
Ja Reaves attempts a 3Pt. Contested by Julius Anthony (4.6 feet, MAN). Ja Reaves misses. Offensive rebound by Draymond Towns! Draymond Towns puts it back in!
Score: 26-18

[11:06] Team_082 possession (Score: 26-18)
Julius Carter attempts a Midrange. Contested by Zach Fox (4.3 feet, ZONE). JULIUS CARTER MAKES IT! Assist: Kristaps Fox
Score: 26-20

[10:51] Team_024 possession (Score: 26-20)
Draymond Towns drives, Jrue Green stays with him. Draymond Towns attempts a Dunk. Contested by Jrue Green (4.7 feet, ZONE). Draymond Towns misses. Offensive rebound by Draymond Towns! Draymond Towns's putback is no good. Offensive rebound by Anfernee Williamson! Anfernee Williamson kicks it out.

[10:39] Team_024 possession (Score: 26-20)
Anfernee Williamson throws a bad pass! Stolen by Jrue Green! TURNOVER! (live ball)

[10:25] Team_082 possession (Score: 26-20)
Kristaps Fox attempts a 3Pt. Contested by Bradley Allen (4.5 feet, MAN). KRISTAPS FOX MAKES IT! Assist: Julius Anthony
Score: 26-23

[10:12] Team_024 possession (Score: 26-23)
Zach Fox drives, picks up Dwyane O'Neal. Help arrives from Kristaps Fox! Zach Fox attempts a Layup. Contested by Kristaps Fox (4.2 feet, MAN). ZACH FOX MAKES IT! Assist: Draymond Towns
Score: 28-23

[09:55] Team_082 possession (Score: 28-23)
Jrue Green loses the ball! Stripped by Anfernee Williamson! TURNOVER! (live ball)

[09:42] Team_024 possession (Score: 28-23)
FOUL! Holding foul on Jrue Green. [Team fouls: 2] No free throws, side out. (Jrue Green: 1 personal fouls)

[09:27] Team_024 possession (Score: 28-23)
Draymond Towns attempts a Midrange. Contested by Jrue Green (4.9 feet, ZONE). Draymond Towns misses. FOUL! Loose ball foul on Kristaps Fox during the rebound battle. [Team fouls: 3] No free throws, side out. (Kristaps Fox: 2 personal fouls)

[09:18] Team_024 possession (Score: 28-23)
Anfernee Williamson attempts a 3Pt. Contested by Dwyane O'Neal (3.9 feet, ZONE). ANFERNEE WILLIAMSON MAKES IT! Assist: Ja Reaves
Score: 31-23

[09:03] Team_082 possession (Score: 31-23)
Dwyane O'Neal drives and kicks out. Julius Anthony attempts a Midrange. Contested by Anfernee Williamson (4.0 feet, ZONE). JULIUS ANTHONY MAKES IT! Assist: Dwyane O'Neal
Score: 31-25

[08:48] Team_024 possession (Score: 31-25)
Zach Fox attempts a Midrange. Contested by Dwyane O'Neal (4.3 feet, ZONE). Zach Fox misses. Rebound secured by Julius Carter.

[08:36] Team_082 possession (Score: 31-25)
Julius Carter attempts a Layup. Contested by Anfernee Williamson (4.4 feet, ZONE). Julius Carter misses. Rebound secured by Zach Fox.

[08:23] Team_024 possession (Score: 31-25)
Ja Reaves drives and kicks out. Ja Reaves attempts a 3Pt. Contested by Dwyane O'Neal (4.2 feet, ZONE). Ja Reaves misses. Rebound secured by Kristaps Fox.

[08:09] Team_082 possession (Score: 31-25)
Jrue Green attempts a Midrange. Contested by Anfernee Williamson (4.3 feet, MAN). Jrue Green misses. Rebound secured by Draymond Towns.

[07:59] Team_024 possession (Score: 31-25)
Draymond Towns attempts a 3Pt. Contested by Dwyane O'Neal (3.8 feet, ZONE). Draymond Towns misses. Rebound secured by Jrue Green.

[07:44] Team_082 possession (Score: 31-25)
Julius Carter attempts a Midrange. Contested by Bradley Allen (5.1 feet, ZONE). Julius Carter misses. Rebound secured by Draymond Towns.

[07:31] Team_024 possession (Score: 31-25)
Zach Fox makes the Midrange and draws the foul on Dwyane O'Neal! And-1! Zach Fox to the line for 1. [Team fouls: 4] (Dwyane O'Neal: 1 personal fouls)   FT 1/1: MISS Zach Fox makes 0/1 from the line. Rebound secured by Julius Carter.
Score: 33-25

[07:15] Team_082 possession (Score: 33-25)
Julius Anthony attempts a Layup. Contested by Anfernee Williamson (4.5 feet, ZONE). JULIUS ANTHONY MAKES IT! Assist: Dwyane O'Neal
Score: 33-27

[07:00] Team_024 possession (Score: 33-27)
Anfernee Williamson attempts a Midrange. Contested by Jrue Green (5.4 feet, MAN). ANFERNEE WILLIAMSON MAKES IT! Assist: Draymond Towns
Score: 35-27

[06:46] Team_082 possession (Score: 35-27)
Julius Anthony drives and kicks out. Julius Carter attempts a 3Pt. Contested by Zach Fox (4.6 feet, ZONE). Julius Carter misses. Rebound secured by Draymond Towns.

[06:32] Team_024 possession (Score: 35-27)
FOUL! Holding foul on Julius Carter. [IN THE BONUS! 5 team fouls] Draymond Towns to the line for 2 free throws. (Julius Carter: 1 personal fouls)   FT 1/2: MISS   FT 2/2: GOOD Draymond Towns makes 1/2 from the line.
Score: 36-27

[06:19] Team_082 possession (Score: 36-27)
Julius Carter drives, Anfernee Williamson stays with him. Julius Carter attempts a Dunk. Contested by Anfernee Williamson (4.7 feet, ZONE). JULIUS CARTER MAKES IT! Assist: Julius Anthony
Score: 36-29

[06:04] Team_024 possession (Score: 36-29)
FOUL! Offensive foul on Zach Fox! Dwyane O'Neal drew the charge! [Team fouls: 2] (Zach Fox: 1 personal fouls) TURNOVER! (dead ball)

[05:52] Team_082 possession (Score: 36-29)
Jrue Green attempts a Midrange. Contested by Bradley Allen (5.3 feet, ZONE). JRUE GREEN MAKES IT! Assist: Julius Anthony
Score: 36-31

[05:37] Team_024 possession (Score: 36-31)
Anfernee Williamson drives, Jrue Green stays with him. Anfernee Williamson attempts a Dunk. Contested by Jrue Green (5.6 feet, MAN). ANFERNEE WILLIAMSON MAKES IT!
Score: 38-31

[05:20] Team_082 possession (Score: 38-31)
Julius Carter attempts a 3Pt. Contested by Zach Fox (5.1 feet, ZONE). Julius Carter misses. Rebound secured by Zach Fox.

[05:05] Team_024 possession (Score: 38-31)
Ja Reaves drives to the basket... Ja Reaves throws a bad pass! Stolen by Jrue Green! TURNOVER! (live ball)

[04:52] Team_082 possession (Score: 38-31)
Julius Anthony drives and kicks out. Julius Carter attempts a 3Pt. Contested by Zach Fox (4.9 feet, ZONE). Julius Carter misses. Rebound secured by Draymond Towns.

[04:38] Team_024 possession (Score: 38-31)
Bradley Allen drives and kicks out. Ja Reaves attempts a Midrange. Contested by Kristaps Fox (5.2 feet, ZONE). Ja Reaves misses. Rebound secured by Julius Carter.

[04:24] Team_082 possession (Score: 38-31)
Kristaps Fox attempts a Midrange. Contested by Bradley Allen (5.3 feet, MAN). Kristaps Fox misses. Rebound secured by Draymond Towns.

[04:08] Team_024 possession (Score: 38-31)
Ja Reaves makes the Layup and draws the foul on Julius Anthony! And-1! Ja Reaves to the line for 1. [BONUS: 6 team fouls] (Julius Anthony: 1 personal fouls)   FT 1/1: GOOD Ja Reaves makes 1/1 from the line.
Score: 41-31

[03:52] Team_082 possession (Score: 41-31)
FOUL! Shooting foul on Zach Fox. Julius Carter to the line for 2 free throws. [Team fouls: 3] (Zach Fox: 2 personal fouls)   FT 1/2: MISS   FT 2/2: MISS Julius Carter makes 0/2 from the line. Rebound secured by Draymond Towns.

[03:40] Team_024 possession (Score: 41-31)
Draymond Towns attempts a Layup. Wide open! Julius Carter is 6.1 feet away. [MAN] Draymond Towns misses. Rebound secured by Jrue Green.

[03:23] Team_082 possession (Score: 41-31)
Julius Anthony attempts a 3Pt. Contested by Zach Fox (5.4 feet, ZONE). Julius Anthony misses. Rebound secured by Anfernee Williamson.

[03:07] Team_024 possession (Score: 41-31)
Zach Fox attempts a Layup. Wide open! Jrue Green is 6.3 feet away. [ZONE] Zach Fox misses. Rebound secured by Kristaps Fox.

[02:56] Team_082 possession (Score: 41-31)
FOUL! Holding foul on Draymond Towns. [Team fouls: 4] No free throws, side out. (Draymond Towns: 1 personal fouls)

[02:38] Team_082 possession (Score: 41-31)
Dwyane O'Neal attempts a 3Pt. Contested by Zach Fox (5.1 feet, MAN). Dwyane O'Neal misses. Offensive rebound by Jrue Green! Jrue Green kicks it out.

[02:24] Team_082 possession (Score: 41-31)
Julius Anthony drives to the basket... Julius Anthony throws a bad pass! Stolen by Ja Reaves! TURNOVER! (live ball)

[02:09] Team_024 possession (Score: 41-31)
Draymond Towns drives to the basket... Draymond Towns loses control! Ball rolls out of bounds! TURNOVER! (dead ball)

[02:09] Substitution (Team_024): Ja Reaves OUT → Victor Simons IN (stamina_rule2)

[02:09] Substitution (Team_024): Zach Fox OUT → Vince Irving IN (stamina_rule2)

[02:09] Substitution (Team_024): Bradley Allen OUT → Zach Durant IN (stamina_rule2)

[02:09] Substitution (Team_024): Anfernee Williamson OUT → Julius Harris IN (stamina_rule2)

[02:09] Substitution (Team_024): Draymond Towns OUT → Terry Rozier IN (stamina_rule2)

[02:09] Substitution (Team_082): Julius Anthony OUT → Jordan Rozier IN (stamina_rule2)

[02:09] Substitution (Team_082): Dwyane O'Neal OUT → Kawhi Poole IN (stamina_rule2)

[02:09] Substitution (Team_082): Kristaps Fox OUT → Shaquille Griffin IN (stamina_rule2)

[02:09] Substitution (Team_082): Jrue Green OUT → Tony Jokic IN (stamina_rule2)

[02:09] Substitution (Team_082): Julius Carter OUT → D'Angelo Parker IN (stamina_rule2)

[01:51] Team_082 possession (Score: 41-31)
FOUL! Reach-in foul on Terry Rozier during the drive. [IN THE BONUS! 5 team fouls] D'Angelo Parker to the line for 2 free throws. (Terry Rozier: 1 personal fouls)   FT 1/2: GOOD   FT 2/2: GOOD D'Angelo Parker makes 2/2 from the line.
Score: 41-33

[01:39] Team_024 possession (Score: 41-33)
Zach Durant attempts a Midrange. Contested by Shaquille Griffin (4.9 feet, MAN). ZACH DURANT MAKES IT! Assist: Terry Rozier
Score: 43-33

[01:27] Team_082 possession (Score: 43-33)
FOUL! Holding foul on Vince Irving. [IN THE BONUS! 6 team fouls] Kawhi Poole to the line for 2 free throws. (Vince Irving: 1 personal fouls)   FT 1/2: GOOD   FT 2/2: GOOD Kawhi Poole makes 2/2 from the line.
Score: 43-35

[01:13] Team_024 possession (Score: 43-35)
Zach Durant attempts a 3Pt. Contested by Kawhi Poole (5.6 feet, ZONE). ZACH DURANT MAKES IT! Assist: Julius Harris
Score: 46-35

[00:58] Team_082 possession (Score: 46-35)
Kawhi Poole loses the ball! Stripped by Vince Irving! TURNOVER! (live ball)

[00:45] Team_024 possession (Score: 46-35)
Zach Durant attempts a 3Pt. Contested by Shaquille Griffin (4.9 feet, MAN). Zach Durant misses. Offensive rebound by Terry Rozier! Terry Rozier puts it back in!
Score: 48-35

[00:33] Team_082 possession (Score: 48-35)
Tony Jokic attempts a 3Pt. Contested by Julius Harris (4.7 feet, MAN). Tony Jokic misses. Offensive rebound by Tony Jokic! Tony Jokic kicks it out.

[00:16] Team_082 possession (Score: 48-35)
D'Angelo Parker drives and kicks out. FOUL! Shooting foul on Zach Durant. D'Angelo Parker to the line for 2 free throws. [BONUS: 7 team fouls] (Zach Durant: 1 personal fouls)   FT 1/2: GOOD   FT 2/2: GOOD D'Angelo Parker makes 2/2 from the line.
Score: 48-37

[00:03] Team_024 possession (Score: 48-37)
Terry Rozier attempts a Layup. Contested by D'Angelo Parker (5.3 feet, ZONE). TERRY ROZIER MAKES IT!
Score: 50-37

================================================================================
                              2ND QUARTER COMPLETE                              
================================================================================

2ND QUARTER SCORE: Team_024 28, Team_082 19

BOX SCORE:
================================================================================

Team_024
--------------------------------------------------------------------------------
Player                MIN  PTS  REB  AST  TO      FG   FG%      3P   3P%
--------------------------------------------------------------------------------
Anfernee Williamson    20    9    2    0   0   4/4   100.0     0/0   0.0
Zach Durant             2    5    0    0   0   2/2   100.0     0/0   0.0
Terry Rozier            4    4    1    1   0   2/2   100.0     0/0   0.0
Draymond Towns         20    3    8    2   0   2/4    50.0     0/0   0.0
Ja Reaves              22    3    0    1   0   1/2    50.0     0/0   0.0
Zach Fox               22    2    3    0   0   1/4    25.0     0/0   0.0
Bradley Allen          22    0    0    1   0   0/1     0.0     0/0   0.0
Julius Harris           4    0    0    1   0   0/0     0.0     0/0   0.0

TEAM: FG: 12/19 (63.2%), 3PT: 4/5 (80.0%), REB: 14 (4 off, 10 def), AST: 6, TO: 4
TEAM FOULS: 7 [Team_082 in BONUS]


Team_082
--------------------------------------------------------------------------------
Player                MIN  PTS  REB  AST  TO      FG   FG%      3P   3P%
--------------------------------------------------------------------------------
Julius Carter          20    4    4    0   0   2/7    28.6     0/0   0.0
Julius Anthony         20    4    0    3   0   2/5    40.0     0/0   0.0
D'Angelo Parker         4    4    0    0   0   2/2   100.0     0/0   0.0
Kristaps Fox           20    3    2    1   0   1/2    50.0     0/0   0.0
Jrue Green             20    2    3    0   0   1/2    50.0     0/0   0.0
Kawhi Poole             2    2    0    0   0   1/1   100.0     0/0   0.0
Dwyane O'Neal          22    0    0    2   0   0/0     0.0     0/0   0.0
Tony Jokic              4    0    1    0   0   0/0     0.0     0/0   0.0

TEAM: FG: 9/19 (47.4%), 3PT: 1/3 (33.3%), REB: 10 (3 off, 7 def), AST: 6, TO: 3
TEAM FOULS: 6 [Team_024 in BONUS]

================================================================================

================================================================================
                       3RD QUARTER - Team_024 vs Team_082                       
================================================================================

[12:00] Team_024 possession (Score: 50-37)
Bradley Allen makes the Dunk and draws the foul on Jrue Green! And-1! Bradley Allen to the line for 1. [Team fouls: 1] (Jrue Green: 1 personal fouls)   FT 1/1: GOOD Bradley Allen makes 1/1 from the line.
Score: 53-37

[11:42] Team_082 possession (Score: 53-37)
Jrue Green drives and kicks out. Julius Anthony attempts a Midrange. Contested by Ja Reaves (4.5 feet, MAN). Julius Anthony misses. Rebound secured by Zach Fox.

[11:27] Team_024 possession (Score: 53-37)
Draymond Towns attempts a Midrange. Contested by Julius Carter (5.3 feet, MAN). Draymond Towns misses. Offensive rebound by Draymond Towns! Draymond Towns puts it back in!
Score: 55-37

[11:14] Team_082 possession (Score: 55-37)
Julius Anthony attempts a 3Pt. Contested by Ja Reaves (4.8 feet, MAN). Julius Anthony misses. Offensive rebound by Jrue Green! Jrue Green kicks it out.

[10:59] Team_082 possession (Score: 55-37)
Julius Carter attempts a Layup. Contested by Anfernee Williamson (4.0 feet, MAN). Julius Carter misses. Rebound secured by Draymond Towns.

[10:47] Team_024 possession (Score: 55-37)
Anfernee Williamson makes the Dunk and draws the foul on Dwyane O'Neal! And-1! Anfernee Williamson to the line for 1. [Team fouls: 2] (Dwyane O'Neal: 1 personal fouls)   FT 1/1: GOOD Anfernee Williamson makes 1/1 from the line.
Score: 58-37

[10:28] Team_082 possession (Score: 58-37)
Julius Carter drives to the basket... Julius Carter loses the ball! Stripped by Anfernee Williamson! TURNOVER! (live ball)

[10:16] Team_024 possession (Score: 58-37)
FOUL! Holding foul on Julius Anthony. [Team fouls: 3] No free throws, side out. (Julius Anthony: 1 personal fouls)

[09:58] Team_024 possession (Score: 58-37)
Draymond Towns attempts a Midrange. Contested by Julius Carter (5.3 feet, MAN). Draymond Towns misses. Rebound secured by Julius Carter.

[09:45] Team_082 possession (Score: 58-37)
Julius Anthony drives and kicks out. Julius Carter makes the Midrange and draws the foul on Anfernee Williamson! And-1! Julius Carter to the line for 1. [Team fouls: 1] (Anfernee Williamson: 1 personal fouls)   FT 1/1: GOOD Julius Carter makes 1/1 from the line.
Score: 58-40

[09:32] Team_024 possession (Score: 58-40)
Anfernee Williamson drives and kicks out. Bradley Allen attempts a 3Pt. Contested by Kristaps Fox (4.2 feet, MAN). BRADLEY ALLEN MAKES IT! Assist: Zach Fox
Score: 61-40

[09:15] Team_082 possession (Score: 61-40)
Julius Carter attempts a 3Pt. Contested by Anfernee Williamson (4.0 feet, MAN). Julius Carter misses. Offensive rebound by Julius Carter! Julius Carter kicks it out.

[08:58] Team_082 possession (Score: 61-40)
Jrue Green attempts a Layup. Contested by Anfernee Williamson (3.9 feet, ZONE). Jrue Green misses. Rebound secured by Draymond Towns.

[08:45] Team_024 possession (Score: 61-40)
FOUL! Holding foul on Jrue Green. [Team fouls: 4] No free throws, side out. (Jrue Green: 2 personal fouls)

[08:30] Team_024 possession (Score: 61-40)
Ja Reaves attempts a Midrange. Contested by Jrue Green (5.2 feet, ZONE). Ja Reaves misses. Rebound secured by Julius Carter.

[08:12] Team_082 possession (Score: 61-40)
Julius Carter attempts a Layup. Contested by Anfernee Williamson (4.0 feet, ZONE). JULIUS CARTER MAKES IT! Assist: Jrue Green
Score: 61-42

[08:00] Team_024 possession (Score: 61-42)
Bradley Allen attempts a Midrange. Contested by Kristaps Fox (4.2 feet, MAN). Bradley Allen misses. Rebound secured by Julius Carter.

[07:45] Team_082 possession (Score: 61-42)
Julius Anthony attempts a Midrange. Contested by Zach Fox (3.9 feet, ZONE). Julius Anthony misses. Rebound secured by Zach Fox.

[07:27] Team_024 possession (Score: 61-42)
Ja Reaves attempts a Layup. Contested by Julius Anthony (4.6 feet, MAN). Ja Reaves misses. Rebound secured by Jrue Green.

[07:13] Team_082 possession (Score: 61-42)
Jrue Green makes the Layup and draws the foul on Anfernee Williamson! And-1! Jrue Green to the line for 1. [Team fouls: 2] (Anfernee Williamson: 2 personal fouls)   FT 1/1: MISS Jrue Green makes 0/1 from the line. Rebound secured by Draymond Towns.
Score: 61-44

[06:58] Team_024 possession (Score: 61-44)
FOUL! Shooting foul on Dwyane O'Neal. Ja Reaves to the line for 2 free throws. [BONUS: 5 team fouls] (Dwyane O'Neal: 2 personal fouls)   FT 1/2: MISS   FT 2/2: GOOD Ja Reaves makes 1/2 from the line.
Score: 62-44

[06:42] Team_082 possession (Score: 62-44)
Dwyane O'Neal attempts a 3Pt. Contested by Zach Fox (3.5 feet, ZONE). Dwyane O'Neal misses. Rebound secured by Anfernee Williamson.

[06:24] Team_024 possession (Score: 62-44)
Zach Fox makes the Dunk and draws the foul on Kristaps Fox! And-1! Zach Fox to the line for 1. [BONUS: 6 team fouls] (Kristaps Fox: 1 personal fouls)   FT 1/1: GOOD Zach Fox makes 1/1 from the line.
Score: 65-44

[06:11] Team_082 possession (Score: 65-44)
Jrue Green attempts a 3Pt. Contested by Bradley Allen (4.2 feet, ZONE). Jrue Green misses. Rebound secured by Anfernee Williamson.

[05:56] Team_024 possession (Score: 65-44)
Ja Reaves attempts a 3Pt. Contested by Julius Anthony (4.6 feet, ZONE). Ja Reaves misses. Rebound secured by Jrue Green.

[05:39] Team_082 possession (Score: 65-44)
Julius Anthony loses control! Ball rolls out of bounds! TURNOVER! (dead ball)

[05:21] Team_024 possession (Score: 65-44)
FOUL! Shooting foul on Kristaps Fox. Bradley Allen to the line for 2 free throws. [BONUS: 7 team fouls] (Kristaps Fox: 2 personal fouls)   FT 1/2: MISS   FT 2/2: GOOD Bradley Allen makes 1/2 from the line.
Score: 66-44

[05:06] Team_082 possession (Score: 66-44)
Jrue Green attempts a 3Pt. Contested by Anfernee Williamson (3.9 feet, MAN). Jrue Green misses. Rebound secured by Draymond Towns.

[04:56] Team_024 possession (Score: 66-44)
FOUL! Offensive foul on Zach Fox! Dwyane O'Neal drew the charge! [Team fouls: 3] (Zach Fox: 1 personal fouls) TURNOVER! (dead ball)

[04:37] Team_082 possession (Score: 66-44)
Julius Anthony makes the Layup and draws the foul on Anfernee Williamson! And-1! Julius Anthony to the line for 1. [Team fouls: 4] (Anfernee Williamson: 3 personal fouls)   FT 1/1: GOOD Julius Anthony makes 1/1 from the line.
Score: 66-47

[04:23] Team_024 possession (Score: 66-47)
FOUL! Holding foul on Jrue Green. [IN THE BONUS! 8 team fouls] Anfernee Williamson to the line for 2 free throws. (Jrue Green: 3 personal fouls)   FT 1/2: MISS   FT 2/2: GOOD Anfernee Williamson makes 1/2 from the line.
Score: 67-47

[04:09] Team_082 possession (Score: 67-47)
Julius Carter drives and kicks out. Jrue Green attempts a 3Pt. Contested by Zach Fox (3.5 feet, ZONE). Jrue Green misses. FOUL! Loose ball foul on Zach Fox during the rebound battle. [IN THE BONUS! 5 team fouls] Jrue Green to the line for 2 free throws. (Zach Fox: 2 personal fouls)   FT 1/2: GOOD   FT 2/2: GOOD Jrue Green makes 2/2 from the line.
Score: 67-49

[03:56] Team_024 possession (Score: 67-49)
Zach Fox attempts a Midrange. Contested by Dwyane O'Neal (3.7 feet, MAN). Zach Fox misses. Rebound secured by Dwyane O'Neal.

[03:38] Team_082 possession (Score: 67-49)
Kristaps Fox attempts a Midrange. Contested by Bradley Allen (4.0 feet, MAN). Kristaps Fox misses. Rebound secured by Draymond Towns.

[03:27] Team_024 possession (Score: 67-49)
Anfernee Williamson attempts a Midrange. Contested by Kristaps Fox (4.2 feet, ZONE). ANFERNEE WILLIAMSON MAKES IT!
Score: 69-49

[03:12] Team_082 possession (Score: 69-49)
Julius Anthony attempts a Layup. BLOCKED BY JA REAVES! Ball deflects out of bounds off Julius Anthony.

[03:03] Team_024 possession (Score: 69-49)
Ja Reaves attempts a 3Pt. Contested by Julius Anthony (4.8 feet, MAN). Ja Reaves misses. Rebound secured by Dwyane O'Neal.

[02:48] Team_082 possession (Score: 69-49)
Julius Carter drives and kicks out. Julius Carter attempts a 3Pt. Contested by Draymond Towns (4.0 feet, MAN). Julius Carter misses. Rebound secured by Draymond Towns.

[02:36] Team_024 possession (Score: 69-49)
Ja Reaves attempts a Layup. BLOCKED BY JULIUS ANTHONY! Ball is loose! Offensive rebound by Zach Fox! Zach Fox kicks it out.

[02:24] Team_024 possession (Score: 69-49)
FOUL! Reach-in foul on Kristaps Fox during the drive. [IN THE BONUS! 9 team fouls] Bradley Allen to the line for 2 free throws. (Kristaps Fox: 3 personal fouls)   FT 1/2: GOOD   FT 2/2: GOOD Bradley Allen makes 2/2 from the line.
Score: 71-49

[02:09] Team_082 possession (Score: 71-49)
Jrue Green attempts a 3Pt. Contested by Anfernee Williamson (4.2 feet, MAN). Jrue Green misses. Offensive rebound by Julius Carter! Julius Carter kicks it out.

[01:55] Team_082 possession (Score: 71-49)
Julius Anthony attempts a 3Pt. Contested by Ja Reaves (5.1 feet, MAN). JULIUS ANTHONY MAKES IT! Assist: Kristaps Fox
Score: 71-52

[01:45] Team_024 possession (Score: 71-52)
Ja Reaves attempts a Layup. BLOCKED BY JRUE GREEN! Ball is loose! Offensive rebound by Draymond Towns! Draymond Towns kicks it out.

[01:30] Team_024 possession (Score: 71-52)
Draymond Towns makes the Layup and draws the foul on Jrue Green! And-1! Draymond Towns to the line for 1. [BONUS: 10 team fouls] (Jrue Green: 4 personal fouls)   FT 1/1: GOOD Draymond Towns makes 1/1 from the line.
Score: 74-52

[01:16] Team_082 possession (Score: 74-52)
FOUL! Reach-in foul on Bradley Allen during the drive. [IN THE BONUS! 6 team fouls] Kristaps Fox to the line for 2 free throws. (Bradley Allen: 1 personal fouls)   FT 1/2: GOOD   FT 2/2: GOOD Kristaps Fox makes 2/2 from the line.
Score: 74-54

[01:04] Team_024 possession (Score: 74-54)
Ja Reaves attempts a Layup. Contested by Jrue Green (5.6 feet, ZONE). JA REAVES MAKES IT! Assist: Bradley Allen
Score: 76-54

[00:46] Team_082 possession (Score: 76-54)
Julius Anthony drives, Ja Reaves stays with him. Julius Anthony attempts a Layup. Contested by Ja Reaves (5.2 feet, MAN). Julius Anthony misses. Rebound secured by Draymond Towns.

[00:36] Team_024 possession (Score: 76-54)
Ja Reaves attempts a 3Pt. Contested by Julius Anthony (5.0 feet, MAN). Ja Reaves misses. Offensive rebound by Draymond Towns! Draymond Towns's putback is no good. Rebound secured by Dwyane O'Neal.

[00:24] Team_082 possession (Score: 76-54)
FOUL! Shooting foul on Anfernee Williamson. Jrue Green to the line for 2 free throws. [BONUS: 7 team fouls] (Anfernee Williamson: 4 personal fouls)   FT 1/2: GOOD   FT 2/2: GOOD Jrue Green makes 2/2 from the line.
Score: 76-56

[00:09] Team_024 possession (Score: 76-56)
FOUL! Shooting foul on Jrue Green. Bradley Allen to the line for 2 free throws. [BONUS: 11 team fouls] (Jrue Green: 5 personal fouls)   FT 1/2: GOOD   FT 2/2: MISS Bradley Allen makes 1/2 from the line. Rebound secured by Jrue Green.
Score: 77-56

================================================================================
                              3RD QUARTER COMPLETE                              
================================================================================

3RD QUARTER SCORE: Team_024 27, Team_082 19

BOX SCORE:
================================================================================

Team_024
--------------------------------------------------------------------------------
Player                MIN  PTS  REB  AST  TO      FG   FG%      3P   3P%
--------------------------------------------------------------------------------
Bradley Allen          34    9    0    1   0   4/6    66.7     0/0   0.0
Anfernee Williamson    32    6    2    0   0   3/3   100.0     0/0   0.0
Draymond Towns         32    5    9    0   0   2/3    66.7     0/0   0.0
Zach Fox               34    3    3    1   0   1/2    50.0     0/0   0.0
Ja Reaves              34    3    0    0   0   2/7    28.6     0/0   0.0
Dwyane O'Neal          34    0    3    0   0   0/1     0.0     0/0   0.0

TEAM: FG: 12/21 (57.1%), 3PT: 0/3 (0.0%), REB: 15 (4 off, 11 def), AST: 2, TO: 1
TEAM FOULS: 7 [Team_082 in BONUS]


Team_082
--------------------------------------------------------------------------------
Player                MIN  PTS  REB  AST  TO      FG   FG%      3P   3P%
--------------------------------------------------------------------------------
Julius Anthony         32    6    0    0   0   2/5    40.0     0/0   0.0
Julius Carter          32    5    5    0   0   2/4    50.0     0/0   0.0
Jrue Green             32    4    4    1   0   2/7    28.6     0/0   0.0
Kristaps Fox           32    2    0    1   0   1/2    50.0     0/0   0.0

TEAM: FG: 7/19 (36.8%), 3PT: 1/4 (25.0%), REB: 11 (3 off, 8 def), AST: 2, TO: 2
TEAM FOULS: 11 [Team_024 in BONUS]

================================================================================

================================================================================
                       4TH QUARTER - Team_024 vs Team_082                       
================================================================================

[12:00] Team_024 possession (Score: 77-56)
FOUL! Reach-in foul on Jrue Green during the drive. [Team fouls: 1] No free throws, side out. (Jrue Green: 1 personal fouls)

[11:45] Team_024 possession (Score: 77-56)
Draymond Towns attempts a 3Pt. Contested by Dwyane O'Neal (3.2 feet, ZONE). Draymond Towns misses. Offensive rebound by Draymond Towns! Draymond Towns puts it back in!
Score: 79-56

[11:33] Team_082 possession (Score: 79-56)
Julius Anthony attempts a Midrange. Contested by Ja Reaves (5.1 feet, MAN). Julius Anthony misses. Rebound secured by Zach Fox.

[11:21] Team_024 possession (Score: 79-56)
Anfernee Williamson attempts a Midrange. Contested by Jrue Green (5.3 feet, MAN). Anfernee Williamson misses. Offensive rebound by Zach Fox! Zach Fox kicks it out.

[11:09] Team_024 possession (Score: 79-56)
Zach Fox attempts a Layup. Contested by Dwyane O'Neal (4.0 feet, MAN). Zach Fox misses. Offensive rebound by Draymond Towns! Draymond Towns puts it back in!
Score: 81-56

[10:56] Team_082 possession (Score: 81-56)
Dwyane O'Neal attempts a 3Pt. Contested by Zach Fox (3.9 feet, MAN). Dwyane O'Neal misses. Rebound secured by Draymond Towns.

[10:38] Team_024 possession (Score: 81-56)
Anfernee Williamson drives, Jrue Green stays with him. Anfernee Williamson attempts a Layup. Contested by Jrue Green (5.4 feet, MAN). ANFERNEE WILLIAMSON MAKES IT! Assist: Draymond Towns
Score: 83-56

[10:24] Team_082 possession (Score: 83-56)
Kristaps Fox attempts a Midrange. Contested by Bradley Allen (4.4 feet, MAN). Kristaps Fox misses. FOUL! Loose ball foul on Anfernee Williamson during the rebound battle. [Team fouls: 1] No free throws, side out. (Anfernee Williamson: 1 personal fouls)

[10:09] Team_082 possession (Score: 83-56)
Jrue Green attempts a Layup. Contested by Anfernee Williamson (4.5 feet, MAN). JRUE GREEN MAKES IT! Assist: Julius Anthony
Score: 83-58

[09:51] Team_024 possession (Score: 83-58)
Anfernee Williamson attempts a 3Pt. Contested by Dwyane O'Neal (3.7 feet, ZONE). Anfernee Williamson misses. Rebound secured by Julius Carter.

[09:38] Team_082 possession (Score: 83-58)
Jrue Green commits a violation (traveling/carry)! TURNOVER! (dead ball)

[09:38] Substitution (Team_024): Ja Reaves OUT → Victor Simons IN (stamina_rule2)

[09:38] Substitution (Team_024): Zach Fox OUT → Vince Irving IN (stamina_rule2)

[09:38] Substitution (Team_024): Bradley Allen OUT → Zach Durant IN (stamina_rule2)

[09:38] Substitution (Team_024): Anfernee Williamson OUT → Julius Harris IN (stamina_rule2)

[09:38] Substitution (Team_024): Draymond Towns OUT → Terry Rozier IN (stamina_rule2)

[09:38] Substitution (Team_082): Julius Anthony OUT → Jordan Rozier IN (stamina_rule2)

[09:38] Substitution (Team_082): Dwyane O'Neal OUT → Kawhi Poole IN (stamina_rule2)

[09:38] Substitution (Team_082): Kristaps Fox OUT → Shaquille Griffin IN (stamina_rule2)

[09:38] Substitution (Team_082): Jrue Green OUT → Tony Jokic IN (stamina_rule2)

[09:38] Substitution (Team_082): Julius Carter OUT → D'Angelo Parker IN (stamina_rule2)

[09:22] Team_024 possession (Score: 83-58)
Vince Irving drives, picks up Tony Jokic. Help arrives from Kawhi Poole! Vince Irving attempts a Dunk. Contested by Kawhi Poole (5.1 feet, ZONE). VINCE IRVING MAKES IT!
Score: 85-58

[09:04] Team_082 possession (Score: 85-58)
D'Angelo Parker attempts a Midrange. Contested by Zach Durant (3.7 feet, ZONE). D'Angelo Parker misses. Rebound secured by Julius Harris.

[08:50] Team_024 possession (Score: 85-58)
Julius Harris commits a violation (traveling/carry)! TURNOVER! (dead ball)

[08:38] Team_082 possession (Score: 85-58)
Shaquille Griffin drives, picks up Zach Durant. Help arrives from Vince Irving! Shaquille Griffin attempts a Layup. Contested by Vince Irving (3.2 feet, MAN). SHAQUILLE GRIFFIN MAKES IT! Assist: Jordan Rozier
Score: 85-60

[08:24] Team_024 possession (Score: 85-60)
Zach Durant attempts a Midrange. Contested by Shaquille Griffin (4.9 feet, ZONE). Zach Durant misses. Rebound secured by Tony Jokic.

[08:08] Team_082 possession (Score: 85-60)
D'Angelo Parker attempts a 3Pt. Contested by Victor Simons (4.4 feet, ZONE). D'Angelo Parker misses. FOUL! Loose ball foul on Zach Durant during the rebound battle. [Team fouls: 2] No free throws, side out. (Zach Durant: 1 personal fouls)

[07:56] Team_082 possession (Score: 85-60)
Shaquille Griffin attempts a 3Pt. Contested by Victor Simons (3.9 feet, ZONE). Shaquille Griffin misses. Rebound secured by Terry Rozier.

[07:41] Team_024 possession (Score: 85-60)
Vince Irving attempts a 3Pt. Contested by Shaquille Griffin (4.7 feet, ZONE). Vince Irving misses. Offensive rebound by Julius Harris! Julius Harris kicks it out.

[07:25] Team_024 possession (Score: 85-60)
Zach Durant attempts a 3Pt. Contested by Shaquille Griffin (4.9 feet, MAN). ZACH DURANT MAKES IT! Assist: Victor Simons
Score: 88-60

[07:11] Team_082 possession (Score: 88-60)
Kawhi Poole attempts a 3Pt. Contested by Vince Irving (5.5 feet, MAN). Kawhi Poole misses. Rebound secured by Zach Durant.

[06:59] Team_024 possession (Score: 88-60)
Victor Simons attempts a 3Pt. Wide open! Jordan Rozier is 6.1 feet away. [MAN] VICTOR SIMONS MAKES IT! Assist: Julius Harris
Score: 91-60

[06:45] Team_082 possession (Score: 91-60)
Jordan Rozier attempts a 3Pt. Contested by Victor Simons (4.1 feet, MAN). JORDAN ROZIER MAKES IT! Assist: Kawhi Poole
Score: 91-63

[06:30] Team_024 possession (Score: 91-63)
Vince Irving drives and kicks out. Terry Rozier attempts a 3Pt. Contested by Kawhi Poole (5.4 feet, ZONE). Terry Rozier misses. Rebound secured by Tony Jokic.

[06:13] Team_082 possession (Score: 91-63)
Shaquille Griffin attempts a Midrange. Contested by Zach Durant (3.2 feet, ZONE). Shaquille Griffin misses. Rebound secured by Terry Rozier.

[06:03] Team_024 possession (Score: 91-63)
Victor Simons drives, picks up Jordan Rozier. Help arrives from Shaquille Griffin! Victor Simons attempts a Dunk. Wide open! Shaquille Griffin is 6.1 feet away. [MAN] Victor Simons misses. Offensive rebound by Terry Rozier! Terry Rozier puts it back in!
Score: 93-63

[05:46] Team_082 possession (Score: 93-63)
Jordan Rozier attempts a 3Pt. Contested by Victor Simons (4.1 feet, MAN). Jordan Rozier misses. Rebound secured by Julius Harris.

[05:28] Team_024 possession (Score: 93-63)
Julius Harris drives to the basket... FOUL! Offensive foul on Julius Harris! D'Angelo Parker drew the charge! [Team fouls: 3] (Julius Harris: 1 personal fouls) TURNOVER! (dead ball)

[05:14] Team_082 possession (Score: 93-63)
Tony Jokic commits a violation (traveling/carry)! TURNOVER! (dead ball)

[04:57] Team_024 possession (Score: 93-63)
Vince Irving commits a violation (traveling/carry)! TURNOVER! (dead ball)

[04:42] Team_082 possession (Score: 93-63)
FOUL! Shooting foul on Vince Irving. Kawhi Poole to the line for 2 free throws. [Team fouls: 4] (Vince Irving: 1 personal fouls)   FT 1/2: MISS   FT 2/2: GOOD Kawhi Poole makes 1/2 from the line.
Score: 93-64

[04:29] Team_024 possession (Score: 93-64)
Zach Durant drives, D'Angelo Parker stays with him. Zach Durant attempts a Layup. Contested by D'Angelo Parker (5.2 feet, ZONE). ZACH DURANT MAKES IT!
Score: 95-64

[04:16] Team_082 possession (Score: 95-64)
Kawhi Poole attempts a 3Pt. Contested by Victor Simons (4.5 feet, ZONE). KAWHI POOLE MAKES IT! Assist: Tony Jokic
Score: 95-67

[03:57] Team_024 possession (Score: 95-67)
Vince Irving drives to the basket... FOUL! Offensive foul on Vince Irving! D'Angelo Parker drew the charge! [Team fouls: 5] (Vince Irving: 2 personal fouls) TURNOVER! (dead ball)

[03:41] Team_082 possession (Score: 95-67)
FOUL! Offensive foul on Jordan Rozier! Victor Simons drew the charge! [Team fouls: 2] (Jordan Rozier: 1 personal fouls) TURNOVER! (dead ball)

[03:24] Team_024 possession (Score: 95-67)
Julius Harris makes the Midrange and draws the foul on Tony Jokic! And-1! Julius Harris to the line for 1. [Team fouls: 3] (Tony Jokic: 1 personal fouls)   FT 1/1: GOOD Julius Harris makes 1/1 from the line.
Score: 98-67

[03:10] Team_082 possession (Score: 98-67)
Shaquille Griffin makes the Layup and draws the foul on Terry Rozier! And-1! Shaquille Griffin to the line for 1. [BONUS: 6 team fouls] (Terry Rozier: 1 personal fouls)   FT 1/1: GOOD Shaquille Griffin makes 1/1 from the line.
Score: 98-70

[02:56] Team_024 possession (Score: 98-70)
Victor Simons attempts a 3Pt. Wide open! Jordan Rozier is 6.1 feet away. [MAN] Victor Simons misses. Rebound secured by D'Angelo Parker.

[02:37] Team_082 possession (Score: 98-70)
Shaquille Griffin attempts a 3Pt. Contested by Zach Durant (3.2 feet, MAN). Shaquille Griffin misses. Offensive rebound by Shaquille Griffin! Shaquille Griffin kicks it out.

[02:21] Team_082 possession (Score: 98-70)
Kawhi Poole attempts a 3Pt. Contested by Victor Simons (4.5 feet, ZONE). Kawhi Poole misses. Rebound secured by Zach Durant.

[02:02] Team_024 possession (Score: 98-70)
Zach Durant makes the Layup and draws the foul on Shaquille Griffin! And-1! Zach Durant to the line for 1. [Team fouls: 4] (Shaquille Griffin: 1 personal fouls)   FT 1/1: GOOD Zach Durant makes 1/1 from the line.
Score: 101-70

[01:44] Team_082 possession (Score: 101-70)
Tony Jokic attempts a 3Pt. Contested by Victor Simons (3.7 feet, ZONE). Tony Jokic misses. Offensive rebound by Tony Jokic! Tony Jokic kicks it out.

[01:28] Team_082 possession (Score: 101-70)
Shaquille Griffin attempts a 3Pt. Contested by Victor Simons (4.0 feet, ZONE). Shaquille Griffin misses. Rebound secured by Julius Harris.

[01:15] Team_024 possession (Score: 101-70)
Zach Durant attempts a 3Pt. Contested by Kawhi Poole (5.7 feet, ZONE). Zach Durant misses. Offensive rebound by Julius Harris! Julius Harris kicks it out.

[00:59] Team_024 possession (Score: 101-70)
Terry Rozier attempts a Midrange. Contested by Kawhi Poole (5.8 feet, ZONE). Terry Rozier misses. Offensive rebound by Terry Rozier! Terry Rozier puts it back in!
Score: 103-70

[00:46] Team_082 possession (Score: 103-70)
D'Angelo Parker attempts a Layup. Contested by Terry Rozier (4.6 feet, ZONE). D'Angelo Parker misses. Rebound secured by Julius Harris.

[00:29] Team_024 possession (Score: 103-70)
Vince Irving attempts a Layup. BLOCKED BY D'ANGELO PARKER! Ball is loose! Rebound secured by Tony Jokic.

[00:17] Team_082 possession (Score: 103-70)
Jordan Rozier attempts a Midrange. Contested by Victor Simons (4.2 feet, MAN). JORDAN ROZIER MAKES IT! Assist: D'Angelo Parker
Score: 103-72

[00:07] Team_024 possession (Score: 103-72)
Zach Durant attempts a 3Pt. Contested by Shaquille Griffin (5.0 feet, MAN). ZACH DURANT MAKES IT! Assist: Julius Harris
Score: 106-72

================================================================================
                              4TH QUARTER COMPLETE                              
================================================================================

4TH QUARTER SCORE: Team_024 29, Team_082 16

BOX SCORE:
================================================================================

Team_024
--------------------------------------------------------------------------------
Player                MIN  PTS  REB  AST  TO      FG   FG%      3P   3P%
--------------------------------------------------------------------------------
Zach Durant            11   11    2    0   0   4/5    80.0     0/0   0.0
Draymond Towns         35    4    3    1   0   2/2   100.0     0/0   0.0
Terry Rozier           14    4    4    0   0   2/2   100.0     0/0   0.0
Julius Harris          14    3    6    2   0   1/1   100.0     0/0   0.0
Victor Simons          11    3    0    1   0   1/2    50.0     0/0   0.0
Anfernee Williamson    35    2    0    0   0   1/2    50.0     0/0   0.0
Vince Irving           11    2    0    0   0   1/3    33.3     0/0   0.0
Zach Fox               37    0    2    0   0   0/0     0.0     0/0   0.0

TEAM: FG: 12/17 (70.6%), 3PT: 4/6 (66.7%), REB: 17 (7 off, 10 def), AST: 4, TO: 4
TEAM FOULS: 6 [Team_082 in BONUS]


Team_082
--------------------------------------------------------------------------------
Player                MIN  PTS  REB  AST  TO      FG   FG%      3P   3P%
--------------------------------------------------------------------------------
Shaquille Griffin      14    5    2    0   0   2/5    40.0     0/0   0.0
Jordan Rozier          14    5    0    1   0   2/3    66.7     0/0   0.0
Kawhi Poole            11    4    0    1   0   2/4    50.0     0/0   0.0
Jrue Green             35    2    1    0   0   1/1   100.0     0/0   0.0
Julius Anthony         35    0    0    1   0   0/1     0.0     0/0   0.0
Dwyane O'Neal          37    0    0    0   0   0/1     0.0     0/0   0.0
Julius Carter          35    0    1    0   0   0/0     0.0     0/0   0.0
D'Angelo Parker        14    0    1    1   0   0/2     0.0     0/0   0.0
Tony Jokic             14    0    4    1   0   0/0     0.0     0/0   0.0

TEAM: FG: 7/17 (41.2%), 3PT: 2/8 (25.0%), REB: 9 (4 off, 5 def), AST: 5, TO: 3
TEAM FOULS: 4

================================================================================

================================================================================
                               FULL GAME COMPLETE                               
================================================================================

FINAL SCORE: Team_024 106, Team_082 72

SCORING BY QUARTER:
--------------------------------------------------------------------------------
Team                     Q1     Q2     Q3     Q4    FINAL
--------------------------------------------------------------------------------
Team_024                 22     28     27     29      106
Team_082                 18     19     19     16       72
--------------------------------------------------------------------------------

FULL GAME BOX SCORE:
================================================================================

Team_024
--------------------------------------------------------------------------------
Player                MIN  PTS  REB  AST  TO      FG   FG%      3P   3P%      FT STL BLK
--------------------------------------------------------------------------------
Ja Reaves              37    6    0    1   2   4/12   33.3   1/5    20.0   2/3     1   1
Zach Fox               37   11   13    1   3   6/11   54.5   2/3    66.7   1/2     1   1
Bradley Allen          37   15    0    3   0   6/12   50.0   2/2   100.0   6/8     1   0
Anfernee Williamson    35   17    6    0   2   9/10   90.0   1/2    50.0   2/3     2   1
Draymond Towns         35   16   26    4   1   3/9    33.3   1/3    33.3   2/3     0   0
Julius Harris          14    3    6    4   2   1/1   100.0   0/0     0.0   1/1     0   0
Terry Rozier           14   14    7    2   0   3/4    75.0   0/0     0.0   1/1     0   0
Victor Simons          11    3    0    1   0   2/3    66.7   1/2    50.0   0/0     0   0
Vince Irving           11    2    0    0   2   1/3    33.3   0/0     0.0   0/0     1   0
Zach Durant            11   16    2    0   0   7/8    87.5   4/4   100.0   1/1     0   0

TEAM: FG: 44/75 (58.7%), 3PT: 12/21 (57.1%), REB: 61 (19 off, 42 def), AST: 16, TO: 12


Team_082
--------------------------------------------------------------------------------
Player                MIN  PTS  REB  AST  TO      FG   FG%      3P   3P%      FT STL BLK
--------------------------------------------------------------------------------
Dwyane O'Neal          37    8    7    4   1   4/6    66.7   1/3    33.3   1/1     0   0
Julius Anthony         35   10    0    5   1   4/14   28.6   1/4    25.0   1/1     0   1
Kristaps Fox           35    8    2    2   0   3/7    42.9   1/3    33.3   3/3     0   1
Jrue Green             35   10   11    1   3   4/12   33.3   0/4     0.0   4/5     3   1
Julius Carter          35   14   12    0   1   6/13   46.2   0/1     0.0   3/5     0   2
Jordan Rozier          14    5    0    1   2   2/4    50.0   1/3    33.3   0/0     0   0
Shaquille Griffin      14    5    3    0   0   2/6    33.3   0/3     0.0   1/1     0   0
Tony Jokic             14    0    5    1   1   0/1     0.0   0/0     0.0   0/0     0   0
D'Angelo Parker        14    4    1    1   0   2/5    40.0   0/0     0.0   4/4     0   1
Kawhi Poole            11    6    0    1   1   2/4    50.0   1/3    33.3   3/4     0   0

TEAM: FG: 30/73 (41.1%), 3PT: 5/24 (20.8%), REB: 40 (12 off, 28 def), AST: 16, TO: 10

================================================================================
