================================================================================
                        FULL GAME - Team_008 vs Team_028                        
================================================================================

================================================================================
                       1ST QUARTER - Team_008 vs Team_028                       
================================================================================

[12:00] Team_008 possession (Score: 0-0)
Khris Hyland attempts a Midrange. Contested by Myles Haliburton (3.7 feet, MAN). Khris Hyland misses. Rebound secured by Carmelo Carter.

[11:43] Team_028 possession (Score: 0-0)
FOUL! Reach-in foul on Magic Young during the drive. [Team fouls: 1] No free throws, side out. (Magic Young: 1 personal fouls)

[11:32] Team_028 possession (Score: 0-0)
FOUL! Holding foul on Victor Leonard. [Team fouls: 2] No free throws, side out. (Victor Leonard: 1 personal fouls)

[11:20] Team_028 possession (Score: 0-0)
Myles Haliburton attempts a Midrange. Contested by Khris Hyland (4.1 feet, MAN). MYLES HALIBURTON MAKES IT! Assist: Carmelo Carter
Score: 0-2

[11:03] Team_008 possession (Score: 0-2)
Jrue Harris makes the 3Pt and draws the foul on Carmelo Carter! And-1! Jrue Harris to the line for 1. [Team fouls: 1] (Carmelo Carter: 1 personal fouls)   FT 1/1: GOOD Jrue Harris makes 1/1 from the line.
Score: 4-2

[10:47] Team_028 possession (Score: 4-2)
Carmelo Carter drives, Tyrese Thompson stays with him. Carmelo Carter attempts a Layup. Contested by Tyrese Thompson (4.7 feet, ZONE). CARMELO CARTER MAKES IT!
Score: 4-4

[10:37] Team_008 possession (Score: 4-4)
Jrue Harris attempts a Layup. Contested by Carmelo Carter (4.5 feet, MAN). JRUE HARRIS MAKES IT! Assist: Tyrese Thompson
Score: 6-4

[10:24] Team_028 possession (Score: 6-4)
Austin Russell drives, Victor Leonard stays with him. Austin Russell attempts a Dunk. Contested by Victor Leonard (4.9 feet, MAN). AUSTIN RUSSELL MAKES IT! Assist: Myles Haliburton
Score: 6-6

[10:07] Team_008 possession (Score: 6-6)
Khris Hyland drives and kicks out. Khris Hyland attempts a 3Pt. Contested by Myles Haliburton (3.6 feet, MAN). Khris Hyland misses. Offensive rebound by Tyrese Thompson! Tyrese Thompson kicks it out.

[09:50] Team_008 possession (Score: 6-6)
Jrue Harris attempts a Midrange. Contested by Carmelo Carter (4.5 feet, MAN). Jrue Harris misses. Rebound secured by Kawhi Ball.

[09:31] Team_028 possession (Score: 6-6)
Jimmy Brogdon drives to the basket... Jimmy Brogdon commits a violation (traveling/carry)! TURNOVER! (dead ball)

[09:18] Team_008 possession (Score: 6-6)
Tyrese Thompson attempts a 3Pt. Contested by Austin Russell (4.6 feet, ZONE). TYRESE THOMPSON MAKES IT!
Score: 9-6

[09:01] Team_028 possession (Score: 9-6)
Myles Haliburton attempts a Midrange. Contested by Khris Hyland (4.1 feet, ZONE). MYLES HALIBURTON MAKES IT!
Score: 9-8

[08:46] Team_008 possession (Score: 9-8)
Victor Leonard attempts a 3Pt. Contested by Austin Russell (4.8 feet, MAN). VICTOR LEONARD MAKES IT! Assist: Khris Hyland
Score: 12-8

[08:30] Team_028 possession (Score: 12-8)
FOUL! Holding foul on Jrue Harris. [Team fouls: 3] No free throws, side out. (Jrue Harris: 1 personal fouls)

[08:12] Team_028 possession (Score: 12-8)
Myles Haliburton attempts a Midrange. Contested by Khris Hyland (4.1 feet, MAN). MYLES HALIBURTON MAKES IT! Assist: Jimmy Brogdon
Score: 12-10

[07:53] Team_008 possession (Score: 12-10)
Victor Leonard attempts a 3Pt. Contested by Austin Russell (4.8 feet, MAN). VICTOR LEONARD MAKES IT! Assist: Magic Young
Score: 15-10

[07:40] Team_028 possession (Score: 15-10)
Myles Haliburton attempts a 3Pt. Contested by Khris Hyland (4.1 feet, MAN). Myles Haliburton misses. Offensive rebound by Kawhi Ball! Kawhi Ball kicks it out.

[07:27] Team_028 possession (Score: 15-10)
Myles Haliburton attempts a Midrange. Contested by Khris Hyland (4.1 feet, MAN). Myles Haliburton misses. Offensive rebound by Jimmy Brogdon! Jimmy Brogdon kicks it out.

[07:16] Team_028 possession (Score: 15-10)
Kawhi Ball drives and kicks out. Jimmy Brogdon attempts a 3Pt. Contested by Victor Leonard (5.0 feet, ZONE). Jimmy Brogdon misses. Rebound secured by Khris Hyland.

[07:03] Team_008 possession (Score: 15-10)
Victor Leonard attempts a Layup. BLOCKED BY AUSTIN RUSSELL! Ball is loose! Offensive rebound by Tyrese Thompson! Tyrese Thompson kicks it out.

[06:49] Team_008 possession (Score: 15-10)
Khris Hyland drives and kicks out. Khris Hyland attempts a 3Pt. Contested by Austin Russell (4.4 feet, ZONE). Khris Hyland misses. Rebound secured by Jimmy Brogdon.

[06:34] Team_028 possession (Score: 15-10)
Kawhi Ball attempts a Layup. Contested by Tyrese Thompson (4.6 feet, ZONE). KAWHI BALL MAKES IT!
Score: 15-12

[06:19] Team_008 possession (Score: 15-12)
Magic Young attempts a 3Pt. Contested by Austin Russell (4.8 feet, ZONE). Magic Young misses. Rebound secured by Jimmy Brogdon.

[06:01] Team_028 possession (Score: 15-12)
Kawhi Ball attempts a 3Pt. Contested by Tyrese Thompson (4.6 feet, MAN). Kawhi Ball misses. Rebound secured by Khris Hyland.

[05:45] Team_008 possession (Score: 15-12)
FOUL! Reach-in foul on Carmelo Carter during the drive. [Team fouls: 2] No free throws, side out. (Carmelo Carter: 2 personal fouls)

[05:30] Team_008 possession (Score: 15-12)
Khris Hyland attempts a Midrange. Contested by Myles Haliburton (3.7 feet, MAN). KHRIS HYLAND MAKES IT! Assist: Magic Young
Score: 17-12

[05:13] Team_028 possession (Score: 17-12)
FOUL! Reach-in foul on Jrue Harris during the drive. [Team fouls: 4] No free throws, side out. (Jrue Harris: 2 personal fouls)

[05:02] Team_028 possession (Score: 17-12)
Jimmy Brogdon attempts a Midrange. Contested by Tyrese Thompson (4.9 feet, ZONE). Jimmy Brogdon misses. Rebound secured by Magic Young.

[04:49] Team_008 possession (Score: 17-12)
Victor Leonard attempts a 3Pt. Contested by Austin Russell (4.8 feet, MAN). Victor Leonard misses. Rebound secured by Kawhi Ball.

[04:32] Team_028 possession (Score: 17-12)
Austin Russell drives, Victor Leonard stays with him. Austin Russell attempts a Dunk. Contested by Victor Leonard (4.9 feet, MAN). Austin Russell misses. Rebound secured by Magic Young.

[04:21] Team_008 possession (Score: 17-12)
Magic Young attempts a 3Pt. Contested by Jimmy Brogdon (4.7 feet, MAN). Magic Young misses. Rebound secured by Kawhi Ball.

[04:05] Team_028 possession (Score: 17-12)
Myles Haliburton drives and kicks out. Austin Russell attempts a 3Pt. Contested by Victor Leonard (5.1 feet, MAN). Austin Russell misses. Offensive rebound by Jimmy Brogdon! Jimmy Brogdon kicks it out.

[03:52] Team_028 possession (Score: 17-12)
Jimmy Brogdon drives, Tyrese Thompson stays with him. Jimmy Brogdon attempts a Layup. Contested by Tyrese Thompson (5.0 feet, ZONE). Jimmy Brogdon misses. Rebound secured by Magic Young.

[03:34] Team_008 possession (Score: 17-12)
FOUL! Shooting foul on Kawhi Ball. Tyrese Thompson to the line for 2 free throws. [Team fouls: 3] (Kawhi Ball: 1 personal fouls)   FT 1/2: GOOD   FT 2/2: GOOD Tyrese Thompson makes 2/2 from the line.
Score: 19-12

[03:19] Team_028 possession (Score: 19-12)
Kawhi Ball attempts a Layup. Contested by Tyrese Thompson (4.8 feet, MAN). KAWHI BALL MAKES IT!
Score: 19-14

[03:00] Team_008 possession (Score: 19-14)
Tyrese Thompson attempts a Midrange. Contested by Myles Haliburton (3.9 feet, ZONE). Tyrese Thompson misses. Rebound secured by Carmelo Carter.

[02:46] Team_028 possession (Score: 19-14)
Jimmy Brogdon makes the Layup and draws the foul on Jrue Harris! And-1! Jimmy Brogdon to the line for 1. [BONUS: 5 team fouls] (Jrue Harris: 3 personal fouls)   FT 1/1: GOOD Jimmy Brogdon makes 1/1 from the line.
Score: 19-17

[02:33] Team_008 possession (Score: 19-17)
Tyrese Thompson attempts a 3Pt. Contested by Kawhi Ball (4.6 feet, MAN). TYRESE THOMPSON MAKES IT! Assist: Victor Leonard
Score: 22-17

[02:18] Team_028 possession (Score: 22-17)
FOUL! Shooting foul on Khris Hyland. Austin Russell to the line for 2 free throws. [BONUS: 6 team fouls] (Khris Hyland: 1 personal fouls)   FT 1/2: GOOD   FT 2/2: MISS Austin Russell makes 1/2 from the line. Rebound secured by Khris Hyland.
Score: 22-18

[02:03] Team_008 possession (Score: 22-18)
FOUL! Holding foul on Myles Haliburton. [Team fouls: 4] No free throws, side out. (Myles Haliburton: 1 personal fouls)

[01:48] Team_008 possession (Score: 22-18)
Jrue Harris attempts a 3Pt. Contested by Carmelo Carter (4.8 feet, MAN). JRUE HARRIS MAKES IT! Assist: Victor Leonard
Score: 25-18

[01:34] Team_028 possession (Score: 25-18)
Jimmy Brogdon attempts a 3Pt. Contested by Victor Leonard (5.8 feet, ZONE). JIMMY BROGDON MAKES IT! Assist: Kawhi Ball
Score: 25-21

[01:18] Team_008 possession (Score: 25-21)
Tyrese Thompson attempts a 3Pt. Contested by Austin Russell (4.9 feet, ZONE). Tyrese Thompson misses. Rebound secured by Jimmy Brogdon.

[01:02] Team_028 possession (Score: 25-21)
Kawhi Ball attempts a Layup. Contested by Tyrese Thompson (5.0 feet, ZONE). KAWHI BALL MAKES IT!
Score: 25-23

[00:48] Team_008 possession (Score: 25-23)
Jrue Harris attempts a 3Pt. Contested by Carmelo Carter (4.9 feet, MAN). Jrue Harris misses. Rebound secured by Carmelo Carter.

[00:29] Team_028 possession (Score: 25-23)
Carmelo Carter loses the ball! Stripped by Jrue Harris! TURNOVER! (live ball)

[00:15] Team_008 possession (Score: 25-23)
Magic Young commits a violation (traveling/carry)! TURNOVER! (dead ball)

[00:15] Substitution (Team_008): Victor Leonard OUT → Blake Holiday IN (stamina_rule2)

[00:15] Substitution (Team_008): Jrue Harris OUT → Chris Griffin IN (stamina_rule2)

[00:15] Substitution (Team_008): Khris Hyland OUT → Immanuel Young IN (stamina_rule2)

[00:15] Substitution (Team_008): Tyrese Thompson OUT → Khris Giddey IN (stamina_rule2)

[00:15] Substitution (Team_008): Magic Young OUT → Lamelo Middleton IN (stamina_rule2)

[00:15] Substitution (Team_028): Austin Russell OUT → Scottie Ingram IN (stamina_rule2)

[00:15] Substitution (Team_028): Carmelo Carter OUT → Tyrese Quickley IN (stamina_rule2)

[00:15] Substitution (Team_028): Myles Haliburton OUT → Miles Booker IN (stamina_rule2)

[00:15] Substitution (Team_028): Kawhi Ball OUT → Bam Towns IN (stamina_rule2)

[00:15] Substitution (Team_028): Jimmy Brogdon OUT → Collin Bridges IN (stamina_rule2)

[00:01] Team_028 possession (Score: 25-23)
Bam Towns attempts a 3Pt. Contested by Khris Giddey (4.3 feet, ZONE). Bam Towns misses. Rebound secured by Chris Griffin.

================================================================================
                              1ST QUARTER COMPLETE                              
================================================================================

1ST QUARTER SCORE: Team_008 25, Team_028 23

BOX SCORE:
================================================================================

Team_008
--------------------------------------------------------------------------------
Player                MIN  PTS  REB  AST  TO      FG   FG%      3P   3P%
--------------------------------------------------------------------------------
Jrue Harris            12    9    0    0   0   3/5    60.0     0/0   0.0
Tyrese Thompson        12    8    2    1   0   3/5    60.0     0/0   0.0
Victor Leonard         12    6    0    2   0   2/3    66.7     0/0   0.0
Khris Hyland           12    2    3    1   0   1/3    33.3     0/0   0.0
Magic Young            12    0    3    2   0   0/2     0.0     0/0   0.0
Chris Griffin           0    0    1    0   0   0/0     0.0     0/0   0.0

TEAM: FG: 9/18 (50.0%), 3PT: 6/11 (54.5%), REB: 9 (2 off, 7 def), AST: 6, TO: 1
TEAM FOULS: 6 [Team_028 in BONUS]


Team_028
--------------------------------------------------------------------------------
Player                MIN  PTS  REB  AST  TO      FG   FG%      3P   3P%
--------------------------------------------------------------------------------
Myles Haliburton       12    6    0    1   0   3/3   100.0     0/0   0.0
Kawhi Ball             12    6    4    1   0   3/5    60.0     0/0   0.0
Jimmy Brogdon          12    6    5    1   0   2/4    50.0     0/0   0.0
Carmelo Carter         12    2    3    1   0   1/1   100.0     0/0   0.0
Austin Russell         12    2    0    0   0   1/3    33.3     0/0   0.0
Bam Towns               0    0    0    0   0   0/1     0.0     0/0   0.0

TEAM: FG: 10/17 (58.8%), 3PT: 1/3 (33.3%), REB: 12 (3 off, 9 def), AST: 4, TO: 2
TEAM FOULS: 4

================================================================================

================================================================================
                       2ND QUARTER - Team_008 vs Team_028                       
================================================================================

[12:00] Team_008 possession (Score: 25-23)
Tyrese Thompson drives to the basket... Tyrese Thompson throws a bad pass! Stolen by Kawhi Ball! TURNOVER! (live ball)

[11:43] Team_028 possession (Score: 25-23)
Carmelo Carter attempts a 3Pt. Contested by Jrue Harris (4.8 feet, MAN). CARMELO CARTER MAKES IT! Assist: Myles Haliburton
Score: 25-26

[11:29] Team_008 possession (Score: 25-26)
Jrue Harris makes the Midrange and draws the foul on Kawhi Ball! And-1! Jrue Harris to the line for 1. [Team fouls: 1] (Kawhi Ball: 1 personal fouls)   FT 1/1: MISS Jrue Harris makes 0/1 from the line. Rebound secured by Jimmy Brogdon.
Score: 27-26

[11:17] Team_028 possession (Score: 27-26)
Austin Russell attempts a 3Pt. Contested by Victor Leonard (5.2 feet, ZONE). Austin Russell misses. Rebound secured by Magic Young.

[11:00] Team_008 possession (Score: 27-26)
FOUL! Reach-in foul on Jimmy Brogdon during the drive. [Team fouls: 2] No free throws, side out. (Jimmy Brogdon: 1 personal fouls)

[10:50] Team_008 possession (Score: 27-26)
Jrue Harris attempts a Midrange. Contested by Carmelo Carter (4.9 feet, MAN). Jrue Harris misses. Offensive rebound by Magic Young! Magic Young kicks it out.

[10:35] Team_008 possession (Score: 27-26)
Tyrese Thompson attempts a Midrange. Contested by Kawhi Ball (4.8 feet, MAN). TYRESE THOMPSON MAKES IT!
Score: 29-26

[10:19] Team_028 possession (Score: 29-26)
Austin Russell drives and kicks out. Jimmy Brogdon attempts a Midrange. Contested by Khris Hyland (4.5 feet, ZONE). Jimmy Brogdon misses. Rebound secured by Khris Hyland.

[10:02] Team_008 possession (Score: 29-26)
Jrue Harris attempts a Layup. Contested by Carmelo Carter (4.9 feet, MAN). JRUE HARRIS MAKES IT!
Score: 31-26

[09:51] Team_028 possession (Score: 31-26)
Kawhi Ball attempts a 3Pt. Contested by Victor Leonard (5.6 feet, ZONE). Kawhi Ball misses. Rebound secured by Khris Hyland.

[09:36] Team_008 possession (Score: 31-26)
FOUL! Shooting foul on Kawhi Ball. Tyrese Thompson to the line for 2 free throws. [Team fouls: 3] (Kawhi Ball: 2 personal fouls)   FT 1/2: GOOD   FT 2/2: GOOD Tyrese Thompson makes 2/2 from the line.
Score: 33-26

[09:19] Team_028 possession (Score: 33-26)
FOUL! Holding foul on Victor Leonard. [Team fouls: 1] No free throws, side out. (Victor Leonard: 1 personal fouls)

[09:04] Team_028 possession (Score: 33-26)
Kawhi Ball drives and kicks out. Carmelo Carter attempts a 3Pt. Contested by Jrue Harris (4.9 feet, MAN). CARMELO CARTER MAKES IT! Assist: Austin Russell
Score: 33-29

[08:54] Team_008 possession (Score: 33-29)
Tyrese Thompson attempts a 3Pt. Contested by Kawhi Ball (5.0 feet, ZONE). TYRESE THOMPSON MAKES IT! Assist: Jrue Harris
Score: 36-29

[08:43] Team_028 possession (Score: 36-29)
Carmelo Carter drives to the basket... Carmelo Carter throws a bad pass! Stolen by Jrue Harris! TURNOVER! (live ball)

[08:32] Team_008 possession (Score: 36-29)
Tyrese Thompson attempts a 3Pt. Contested by Austin Russell (5.1 feet, ZONE). Tyrese Thompson misses. Rebound secured by Jimmy Brogdon.

[08:19] Team_028 possession (Score: 36-29)
Carmelo Carter attempts a 3Pt. Contested by Victor Leonard (5.9 feet, ZONE). CARMELO CARTER MAKES IT! Assist: Kawhi Ball
Score: 36-32

[08:03] Team_008 possession (Score: 36-32)
FOUL! Shooting foul on Carmelo Carter. Magic Young to the line for 2 free throws. [Team fouls: 4] (Carmelo Carter: 1 personal fouls)   FT 1/2: GOOD   FT 2/2: MISS Magic Young makes 1/2 from the line. Offensive rebound by Magic Young! Magic Young kicks it out.
Score: 37-32

[07:48] Team_008 possession (Score: 37-32)
Khris Hyland attempts a 3Pt. Contested by Austin Russell (5.2 feet, ZONE). Khris Hyland misses. Rebound secured by Carmelo Carter.

[07:37] Team_028 possession (Score: 37-32)
Austin Russell attempts a 3Pt. Contested by Victor Leonard (5.6 feet, MAN). Austin Russell misses. Rebound secured by Tyrese Thompson.

[07:21] Team_008 possession (Score: 37-32)
Magic Young makes the Midrange and draws the foul on Carmelo Carter! And-1! Magic Young to the line for 1. [BONUS: 5 team fouls] (Carmelo Carter: 2 personal fouls)   FT 1/1: GOOD Magic Young makes 1/1 from the line.
Score: 40-32

[07:08] Team_028 possession (Score: 40-32)
Kawhi Ball throws a bad pass! Stolen by Tyrese Thompson! TURNOVER! (live ball)

[06:53] Team_008 possession (Score: 40-32)
Tyrese Thompson drives, Kawhi Ball stays with him. Tyrese Thompson attempts a Layup. Contested by Kawhi Ball (5.4 feet, MAN). Tyrese Thompson misses. Rebound secured by Carmelo Carter.

[06:35] Team_028 possession (Score: 40-32)
FOUL! Shooting foul on Tyrese Thompson. Kawhi Ball to the line for 2 free throws. [Team fouls: 2] (Tyrese Thompson: 1 personal fouls)   FT 1/2: GOOD   FT 2/2: MISS Kawhi Ball makes 1/2 from the line. FOUL! Loose ball foul on Khris Hyland during the free throw rebound! [Team fouls: 3] No free throws, side out. (Khris Hyland: 1 personal fouls)
Score: 40-33

[06:21] Team_028 possession (Score: 40-33)
Kawhi Ball attempts a Layup. Contested by Tyrese Thompson (5.7 feet, ZONE). KAWHI BALL MAKES IT! Assist: Carmelo Carter
Score: 40-35

[06:07] Team_008 possession (Score: 40-35)
Jrue Harris attempts a 3Pt. Contested by Carmelo Carter (5.4 feet, MAN). JRUE HARRIS MAKES IT! Assist: Magic Young
Score: 43-35

[05:56] Team_028 possession (Score: 43-35)
Kawhi Ball drives to the basket... FOUL! Offensive foul on Kawhi Ball! Tyrese Thompson drew the charge! [Team fouls: 6] (Kawhi Ball: 3 personal fouls) TURNOVER! (dead ball)

[05:45] Team_008 possession (Score: 43-35)
Khris Hyland drives and kicks out. Jrue Harris attempts a 3Pt. Contested by Austin Russell (5.5 feet, ZONE). Jrue Harris misses. FOUL! Loose ball foul on Jimmy Brogdon during the rebound battle. [IN THE BONUS! 7 team fouls] Khris Hyland to the line for 2 free throws. (Jimmy Brogdon: 2 personal fouls)   FT 1/2: GOOD   FT 2/2: GOOD Khris Hyland makes 2/2 from the line.
Score: 45-35

[05:34] Team_028 possession (Score: 45-35)
Myles Haliburton attempts a 3Pt. Wide open! Victor Leonard is 6.1 feet away. [ZONE] MYLES HALIBURTON MAKES IT! Assist: Austin Russell
Score: 45-38

[05:24] Team_008 possession (Score: 45-38)
Khris Hyland drives to the basket... Khris Hyland throws a bad pass out of bounds! TURNOVER! (dead ball)

[05:24] Substitution (Team_008): Victor Leonard OUT → Blake Holiday IN (stamina_rule2)

[05:24] Substitution (Team_008): Jrue Harris OUT → Chris Griffin IN (stamina_rule2)

[05:24] Substitution (Team_008): Khris Hyland OUT → Immanuel Young IN (stamina_rule2)

[05:24] Substitution (Team_008): Tyrese Thompson OUT → Khris Giddey IN (stamina_rule2)

[05:24] Substitution (Team_008): Magic Young OUT → Lamelo Middleton IN (stamina_rule2)

[05:24] Substitution (Team_028): Austin Russell OUT → Scottie Ingram IN (stamina_rule2)

[05:24] Substitution (Team_028): Carmelo Carter OUT → Tyrese Quickley IN (stamina_rule2)

[05:24] Substitution (Team_028): Myles Haliburton OUT → Miles Booker IN (stamina_rule2)

[05:24] Substitution (Team_028): Kawhi Ball OUT → Bam Towns IN (stamina_rule2)

[05:24] Substitution (Team_028): Jimmy Brogdon OUT → Collin Bridges IN (stamina_rule2)

[05:08] Team_028 possession (Score: 45-38)
Collin Bridges attempts a 3Pt. Contested by Khris Giddey (4.5 feet, ZONE). COLLIN BRIDGES MAKES IT! Assist: Scottie Ingram
Score: 45-41

[04:52] Team_008 possession (Score: 45-41)
Blake Holiday drives, Collin Bridges stays with him. Blake Holiday attempts a Dunk. Contested by Collin Bridges (3.9 feet, ZONE). Blake Holiday misses. Rebound secured by Collin Bridges.

[04:37] Team_028 possession (Score: 45-41)
Miles Booker attempts a Midrange. Contested by Immanuel Young (4.3 feet, MAN). MILES BOOKER MAKES IT!
Score: 45-43

[04:26] Team_008 possession (Score: 45-43)
Lamelo Middleton makes the Layup and draws the foul on Collin Bridges! And-1! Lamelo Middleton to the line for 1. [BONUS: 8 team fouls] (Collin Bridges: 1 personal fouls)   FT 1/1: GOOD Lamelo Middleton makes 1/1 from the line.
Score: 48-43

[04:07] Team_028 possession (Score: 48-43)
Bam Towns attempts a Midrange. Contested by Immanuel Young (4.4 feet, ZONE). Bam Towns misses. Rebound secured by Khris Giddey.

[03:53] Team_008 possession (Score: 48-43)
FOUL! Reach-in foul on Collin Bridges during the drive. [IN THE BONUS! 9 team fouls] Khris Giddey to the line for 2 free throws. (Collin Bridges: 2 personal fouls)   FT 1/2: GOOD   FT 2/2: GOOD Khris Giddey makes 2/2 from the line.
Score: 50-43

[03:39] Team_028 possession (Score: 50-43)
Bam Towns makes the Layup and draws the foul on Chris Griffin! And-1! Bam Towns to the line for 1. [Team fouls: 4] (Chris Griffin: 1 personal fouls)   FT 1/1: GOOD Bam Towns makes 1/1 from the line.
Score: 50-46

[03:20] Team_008 possession (Score: 50-46)
Immanuel Young attempts a Midrange. Wide open! Miles Booker is 6.4 feet away. [MAN] Immanuel Young misses. FOUL! Loose ball foul on Bam Towns during the rebound battle. [IN THE BONUS! 10 team fouls] Khris Giddey to the line for 2 free throws. (Bam Towns: 1 personal fouls)   FT 1/2: GOOD   FT 2/2: GOOD Khris Giddey makes 2/2 from the line.
Score: 52-46

[03:04] Team_028 possession (Score: 52-46)
Scottie Ingram attempts a Layup. Contested by Lamelo Middleton (4.3 feet, ZONE). SCOTTIE INGRAM MAKES IT!
Score: 52-48

[02:51] Team_008 possession (Score: 52-48)
Khris Giddey attempts a 3Pt. Contested by Collin Bridges (3.6 feet, MAN). Khris Giddey misses. FOUL! Loose ball foul on Collin Bridges during the rebound battle. [IN THE BONUS! 11 team fouls] Lamelo Middleton to the line for 2 free throws. (Collin Bridges: 3 personal fouls)   FT 1/2: MISS   FT 2/2: GOOD Lamelo Middleton makes 1/2 from the line.
Score: 53-48

[02:40] Team_028 possession (Score: 53-48)
Bam Towns drives and kicks out. Tyrese Quickley attempts a Midrange. Contested by Immanuel Young (4.3 feet, ZONE). Tyrese Quickley misses. Rebound secured by Chris Griffin.

[02:27] Team_008 possession (Score: 53-48)
Chris Griffin attempts a 3Pt. Contested by Tyrese Quickley (4.7 feet, MAN). CHRIS GRIFFIN MAKES IT! Assist: Lamelo Middleton
Score: 56-48

[02:10] Team_028 possession (Score: 56-48)
Miles Booker attempts a 3Pt. Contested by Khris Giddey (4.2 feet, ZONE). Miles Booker misses. Offensive rebound by Collin Bridges! Collin Bridges kicks it out.

[01:53] Team_028 possession (Score: 56-48)
Collin Bridges attempts a Layup. Contested by Lamelo Middleton (4.5 feet, ZONE). COLLIN BRIDGES MAKES IT! Assist: Miles Booker
Score: 56-50

[01:42] Team_008 possession (Score: 56-50)
Khris Giddey attempts a 3Pt. Contested by Collin Bridges (3.6 feet, MAN). Khris Giddey misses. Rebound secured by Tyrese Quickley.

[01:29] Team_028 possession (Score: 56-50)
Scottie Ingram attempts a Layup. Contested by Lamelo Middleton (4.3 feet, ZONE). Scottie Ingram misses. Rebound secured by Chris Griffin.

[01:18] Team_008 possession (Score: 56-50)
Blake Holiday attempts a 3Pt. Contested by Scottie Ingram (5.7 feet, MAN). BLAKE HOLIDAY MAKES IT! Assist: Khris Giddey
Score: 59-50

[01:05] Team_028 possession (Score: 59-50)
Scottie Ingram attempts a Layup. Contested by Lamelo Middleton (4.3 feet, ZONE). SCOTTIE INGRAM MAKES IT!
Score: 59-52

[00:47] Team_008 possession (Score: 59-52)
Khris Giddey throws a bad pass! Stolen by Collin Bridges! TURNOVER! (live ball)

[00:31] Team_028 possession (Score: 59-52)
Collin Bridges drives, Lamelo Middleton stays with him. Collin Bridges attempts a Layup. Contested by Lamelo Middleton (4.5 feet, ZONE). COLLIN BRIDGES MAKES IT! Assist: Tyrese Quickley
Score: 59-54

[00:18] Team_008 possession (Score: 59-54)
Lamelo Middleton drives, picks up Collin Bridges. Help arrives from Tyrese Quickley! Lamelo Middleton attempts a Dunk. Contested by Tyrese Quickley (4.0 feet, MAN). LAMELO MIDDLETON MAKES IT! Assist: Immanuel Young
Score: 61-54

================================================================================
                              2ND QUARTER COMPLETE                              
================================================================================

2ND QUARTER SCORE: Team_008 36, Team_028 31

BOX SCORE:
================================================================================

Team_008
--------------------------------------------------------------------------------
Player                MIN  PTS  REB  AST  TO      FG   FG%      3P   3P%
--------------------------------------------------------------------------------
Tyrese Thompson        19    7    1    0   0   3/5    60.0     0/0   0.0
Lamelo Middleton        5    6    0    1   0   3/3   100.0     0/0   0.0
Jrue Harris            19    5    0    1   0   2/3    66.7     0/0   0.0
Khris Giddey            5    4    1    1   0   2/3    66.7     0/0   0.0
Magic Young            19    3    3    1   0   1/1   100.0     0/0   0.0
Blake Holiday           5    3    0    0   0   1/2    50.0     0/0   0.0
Chris Griffin           5    3    2    0   0   1/1   100.0     0/0   0.0
Khris Hyland           19    2    2    0   0   1/2    50.0     0/0   0.0
Immanuel Young          5    0    0    1   0   0/0     0.0     0/0   0.0

TEAM: FG: 14/20 (70.0%), 3PT: 5/8 (62.5%), REB: 9 (2 off, 7 def), AST: 5, TO: 3
TEAM FOULS: 4


Team_028
--------------------------------------------------------------------------------
Player                MIN  PTS  REB  AST  TO      FG   FG%      3P   3P%
--------------------------------------------------------------------------------
Carmelo Carter         19    9    2    1   0   3/3   100.0     0/0   0.0
Collin Bridges          5    7    2    0   0   3/3   100.0     0/0   0.0
Scottie Ingram          5    4    0    1   0   2/3    66.7     0/0   0.0
Myles Haliburton       19    3    0    1   0   1/1   100.0     0/0   0.0
Bam Towns               5    3    0    0   0   1/3    33.3     0/0   0.0
Kawhi Ball             19    2    1    1   0   1/2    50.0     0/0   0.0
Miles Booker            5    2    0    1   0   1/1   100.0     0/0   0.0
Jimmy Brogdon          19    0    2    0   0   0/0     0.0     0/0   0.0
Austin Russell         19    0    0    2   0   0/3     0.0     0/0   0.0
Tyrese Quickley         5    0    1    1   0   0/0     0.0     0/0   0.0

TEAM: FG: 12/19 (63.2%), 3PT: 4/7 (57.1%), REB: 8 (2 off, 6 def), AST: 8, TO: 3
TEAM FOULS: 11 [Team_008 in BONUS]

================================================================================

================================================================================
                       3RD QUARTER - Team_008 vs Team_028                       
================================================================================

[12:00] Team_008 possession (Score: 61-54)
Magic Young attempts a 3Pt. Contested by Austin Russell (4.8 feet, ZONE). Magic Young misses. Rebound secured by Kawhi Ball.

[11:46] Team_028 possession (Score: 61-54)
Myles Haliburton drives, picks up Tyrese Thompson. Help arrives from Jrue Harris! Myles Haliburton attempts a Layup. Contested by Jrue Harris (4.5 feet, ZONE). MYLES HALIBURTON MAKES IT!
Score: 61-56

[11:29] Team_008 possession (Score: 61-56)
Jrue Harris makes the Layup and draws the foul on Carmelo Carter! And-1! Jrue Harris to the line for 1. [Team fouls: 1] (Carmelo Carter: 1 personal fouls)   FT 1/1: GOOD Jrue Harris makes 1/1 from the line.
Score: 64-56

[11:16] Team_028 possession (Score: 64-56)
Jimmy Brogdon drives to the basket... Jimmy Brogdon throws a bad pass! Stolen by Magic Young! TURNOVER! (live ball)

[11:03] Team_008 possession (Score: 64-56)
Magic Young drives, Kawhi Ball stays with him. Magic Young attempts a Dunk. Contested by Kawhi Ball (4.6 feet, ZONE). MAGIC YOUNG MAKES IT! Assist: Tyrese Thompson
Score: 66-56

[10:49] Team_028 possession (Score: 66-56)
Jimmy Brogdon drives to the basket... FOUL! Offensive foul on Jimmy Brogdon! Tyrese Thompson drew the charge! [Team fouls: 2] (Jimmy Brogdon: 1 personal fouls) TURNOVER! (dead ball)

[10:35] Team_008 possession (Score: 66-56)
Khris Hyland makes the 3Pt and draws the foul on Austin Russell! And-1! Khris Hyland to the line for 1. [Team fouls: 3] (Austin Russell: 1 personal fouls)   FT 1/1: MISS Khris Hyland makes 0/1 from the line. Rebound secured by Jimmy Brogdon.
Score: 69-56

[10:21] Team_028 possession (Score: 69-56)
Carmelo Carter drives to the basket... Carmelo Carter loses control! Ball rolls out of bounds! TURNOVER! (dead ball)

[10:07] Team_008 possession (Score: 69-56)
Khris Hyland drives and kicks out. Khris Hyland attempts a 3Pt. Contested by Austin Russell (4.4 feet, ZONE). Khris Hyland misses. Rebound secured by Kawhi Ball.

[09:55] Team_028 possession (Score: 69-56)
Carmelo Carter attempts a 3Pt. Contested by Jrue Harris (4.6 feet, MAN). Carmelo Carter misses. Rebound secured by Tyrese Thompson.

[09:38] Team_008 possession (Score: 69-56)
Khris Hyland attempts a 3Pt. Contested by Myles Haliburton (3.7 feet, ZONE). Khris Hyland misses. Offensive rebound by Tyrese Thompson! Tyrese Thompson kicks it out.

[09:22] Team_008 possession (Score: 69-56)
Tyrese Thompson drives, Kawhi Ball stays with him. Tyrese Thompson attempts a Layup. Contested by Kawhi Ball (4.4 feet, ZONE). TYRESE THOMPSON MAKES IT! Assist: Victor Leonard
Score: 71-56

[09:08] Team_028 possession (Score: 71-56)
Kawhi Ball attempts a Dunk. BLOCKED BY TYRESE THOMPSON! Ball is loose! Rebound secured by Magic Young.

[08:53] Team_008 possession (Score: 71-56)
FOUL! Shooting foul on Carmelo Carter. Jrue Harris to the line for 2 free throws. [Team fouls: 4] (Carmelo Carter: 2 personal fouls)   FT 1/2: GOOD   FT 2/2: MISS Jrue Harris makes 1/2 from the line. Rebound secured by Carmelo Carter.
Score: 72-56

[08:38] Team_028 possession (Score: 72-56)
Myles Haliburton drives, Khris Hyland stays with him. Myles Haliburton attempts a Dunk. Contested by Khris Hyland (4.1 feet, MAN). MYLES HALIBURTON MAKES IT! Assist: Austin Russell
Score: 72-58

[08:21] Team_008 possession (Score: 72-58)
Khris Hyland makes the Layup and draws the foul on Myles Haliburton! And-1! Khris Hyland to the line for 1. [BONUS: 5 team fouls] (Myles Haliburton: 1 personal fouls)   FT 1/1: GOOD Khris Hyland makes 1/1 from the line.
Score: 75-58

[08:05] Team_028 possession (Score: 75-58)
Austin Russell attempts a Midrange. Contested by Magic Young (4.8 feet, ZONE). AUSTIN RUSSELL MAKES IT!
Score: 75-60

[07:50] Team_008 possession (Score: 75-60)
Jrue Harris attempts a Midrange. Contested by Carmelo Carter (4.5 feet, MAN). JRUE HARRIS MAKES IT!
Score: 77-60

[07:36] Team_028 possession (Score: 77-60)
Myles Haliburton attempts a 3Pt. Contested by Victor Leonard (5.1 feet, ZONE). Myles Haliburton misses. Offensive rebound by Kawhi Ball! Kawhi Ball kicks it out.

[07:19] Team_028 possession (Score: 77-60)
Carmelo Carter attempts a 3Pt. Contested by Victor Leonard (5.3 feet, ZONE). Carmelo Carter misses. Rebound secured by Magic Young.

[07:06] Team_008 possession (Score: 77-60)
FOUL! Shooting foul on Kawhi Ball. Tyrese Thompson to the line for 2 free throws. [BONUS: 6 team fouls] (Kawhi Ball: 1 personal fouls)   FT 1/2: GOOD   FT 2/2: MISS Tyrese Thompson makes 1/2 from the line. Rebound secured by Kawhi Ball.
Score: 78-60

[06:51] Team_028 possession (Score: 78-60)
FOUL! Reach-in foul on Magic Young during the drive. [Team fouls: 1] No free throws, side out. (Magic Young: 1 personal fouls)

[06:32] Team_028 possession (Score: 78-60)
Austin Russell attempts a Midrange. Contested by Victor Leonard (4.9 feet, MAN). AUSTIN RUSSELL MAKES IT! Assist: Jimmy Brogdon
Score: 78-62

[06:17] Team_008 possession (Score: 78-62)
Magic Young attempts a Layup. Contested by Kawhi Ball (4.6 feet, ZONE). Magic Young misses. Rebound secured by Kawhi Ball.

[06:02] Team_028 possession (Score: 78-62)
Kawhi Ball drives to the basket... Kawhi Ball throws a bad pass! Stolen by Tyrese Thompson! TURNOVER! (live ball)

[05:45] Team_008 possession (Score: 78-62)
Khris Hyland attempts a Layup. Contested by Myles Haliburton (3.7 feet, MAN). Khris Hyland misses. Offensive rebound by Magic Young! Magic Young's putback is no good. Rebound secured by Jimmy Brogdon.

[05:34] Team_028 possession (Score: 78-62)
Jimmy Brogdon drives to the basket... Jimmy Brogdon throws a bad pass! Stolen by Tyrese Thompson! TURNOVER! (live ball)

[05:22] Team_008 possession (Score: 78-62)
Tyrese Thompson drives to the basket... Tyrese Thompson loses the ball! Stripped by Kawhi Ball! TURNOVER! (live ball)

[05:07] Team_028 possession (Score: 78-62)
Carmelo Carter attempts a Midrange. Contested by Jrue Harris (4.6 feet, MAN). Carmelo Carter misses. Rebound secured by Tyrese Thompson.

[04:50] Team_008 possession (Score: 78-62)
Jrue Harris attempts a 3Pt. Contested by Austin Russell (4.6 feet, ZONE). JRUE HARRIS MAKES IT! Assist: Victor Leonard
Score: 81-62

[04:35] Team_028 possession (Score: 81-62)
Carmelo Carter attempts a 3Pt. Contested by Jrue Harris (4.6 feet, ZONE). Carmelo Carter misses. Offensive rebound by Jimmy Brogdon! Jimmy Brogdon kicks it out.

[04:22] Team_028 possession (Score: 81-62)
Kawhi Ball attempts a Layup. Contested by Tyrese Thompson (4.7 feet, ZONE). KAWHI BALL MAKES IT! Assist: Carmelo Carter
Score: 81-64

[04:07] Team_008 possession (Score: 81-64)
Khris Hyland attempts a 3Pt. Contested by Myles Haliburton (3.8 feet, MAN). Khris Hyland misses. Offensive rebound by Magic Young! Magic Young's putback is no good. Rebound secured by Kawhi Ball.

[03:54] Team_028 possession (Score: 81-64)
Jimmy Brogdon drives, Magic Young stays with him. Jimmy Brogdon attempts a Dunk. Contested by Magic Young (5.6 feet, MAN). Jimmy Brogdon misses. Rebound secured by Magic Young.

[03:37] Team_008 possession (Score: 81-64)
Magic Young attempts a Layup. Contested by Kawhi Ball (4.8 feet, ZONE). Magic Young misses. Offensive rebound by Tyrese Thompson! Tyrese Thompson kicks it out.

[03:28] Team_008 possession (Score: 81-64)
Tyrese Thompson attempts a 3Pt. Contested by Austin Russell (4.7 feet, ZONE). Tyrese Thompson misses. FOUL! Loose ball foul on Jimmy Brogdon during the rebound battle. [IN THE BONUS! 7 team fouls] Magic Young to the line for 2 free throws. (Jimmy Brogdon: 2 personal fouls)   FT 1/2: MISS   FT 2/2: MISS Magic Young makes 0/2 from the line. Rebound secured by Carmelo Carter.

[03:14] Team_028 possession (Score: 81-64)
Kawhi Ball attempts a 3Pt. Contested by Victor Leonard (5.3 feet, ZONE). Kawhi Ball misses. Rebound secured by Khris Hyland.

[02:58] Team_008 possession (Score: 81-64)
Victor Leonard attempts a 3Pt. Contested by Austin Russell (4.9 feet, MAN). VICTOR LEONARD MAKES IT! Assist: Khris Hyland
Score: 84-64

[02:45] Team_028 possession (Score: 84-64)
Kawhi Ball attempts a Layup. Contested by Tyrese Thompson (4.8 feet, ZONE). Kawhi Ball misses. Rebound secured by Tyrese Thompson.

[02:34] Team_008 possession (Score: 84-64)
Victor Leonard attempts a 3Pt. Contested by Austin Russell (5.0 feet, ZONE). VICTOR LEONARD MAKES IT! Assist: Magic Young
Score: 87-64

[02:20] Team_028 possession (Score: 87-64)
Austin Russell drives and kicks out. Jimmy Brogdon attempts a 3Pt. Contested by Magic Young (5.3 feet, MAN). Jimmy Brogdon misses. Rebound secured by Tyrese Thompson.

[02:08] Team_008 possession (Score: 87-64)
Jrue Harris attempts a Midrange. Contested by Kawhi Ball (4.7 feet, ZONE). JRUE HARRIS MAKES IT! Assist: Magic Young
Score: 89-64

[01:54] Team_028 possession (Score: 89-64)
Jimmy Brogdon attempts a Midrange. Contested by Jrue Harris (5.0 feet, ZONE). Jimmy Brogdon misses. Offensive rebound by Kawhi Ball! Kawhi Ball kicks it out.

[01:36] Team_028 possession (Score: 89-64)
Kawhi Ball attempts a Layup. BLOCKED BY TYRESE THOMPSON! Ball is loose! Rebound secured by Khris Hyland.

[01:17] Team_008 possession (Score: 89-64)
Tyrese Thompson attempts a Midrange. Contested by Myles Haliburton (4.1 feet, ZONE). Tyrese Thompson misses. Rebound secured by Jimmy Brogdon.

[01:06] Team_028 possession (Score: 89-64)
Carmelo Carter attempts a Layup. Contested by Jrue Harris (4.9 feet, MAN). CARMELO CARTER MAKES IT! Assist: Jimmy Brogdon
Score: 89-66

[00:52] Team_008 possession (Score: 89-66)
FOUL! Shooting foul on Myles Haliburton. Khris Hyland to the line for 3 free throws. [BONUS: 8 team fouls] (Myles Haliburton: 2 personal fouls)   FT 1/3: MISS   FT 2/3: GOOD   FT 3/3: GOOD Khris Hyland makes 2/3 from the line.
Score: 91-66

[00:39] Team_028 possession (Score: 91-66)
Myles Haliburton attempts a 3Pt. Contested by Victor Leonard (5.5 feet, ZONE). MYLES HALIBURTON MAKES IT! Assist: Jimmy Brogdon
Score: 91-69

[00:27] Team_008 possession (Score: 91-69)
Magic Young attempts a 3Pt. Contested by Jimmy Brogdon (5.2 feet, MAN). MAGIC YOUNG MAKES IT!
Score: 94-69

[00:11] Team_028 possession (Score: 94-69)
FOUL! Shooting foul on Jrue Harris. Carmelo Carter to the line for 3 free throws. [Team fouls: 2] (Jrue Harris: 1 personal fouls)   FT 1/3: GOOD   FT 2/3: GOOD   FT 3/3: GOOD Carmelo Carter makes 3/3 from the line.
Score: 94-72

================================================================================
                              3RD QUARTER COMPLETE                              
================================================================================

3RD QUARTER SCORE: Team_008 33, Team_028 18

BOX SCORE:
================================================================================

Team_008
--------------------------------------------------------------------------------
Player                MIN  PTS  REB  AST  TO      FG   FG%      3P   3P%
--------------------------------------------------------------------------------
Jrue Harris            31   10    0    0   0   4/5    80.0     0/0   0.0
Victor Leonard         31    6    0    2   0   2/2   100.0     0/0   0.0
Magic Young            31    5    3    2   0   2/4    50.0     0/0   0.0
Khris Hyland           31    5    2    1   0   2/6    33.3     0/0   0.0
Tyrese Thompson        31    2    6    1   0   1/4    25.0     0/0   0.0

TEAM: FG: 11/21 (52.4%), 3PT: 5/9 (55.6%), REB: 14 (5 off, 9 def), AST: 6, TO: 1
TEAM FOULS: 2


Team_028
--------------------------------------------------------------------------------
Player                MIN  PTS  REB  AST  TO      FG   FG%      3P   3P%
--------------------------------------------------------------------------------
Myles Haliburton       31    7    0    0   0   3/3   100.0     0/0   0.0
Carmelo Carter         31    5    2    1   0   2/5    40.0     0/0   0.0
Austin Russell         31    4    0    1   0   2/3    66.7     0/0   0.0
Kawhi Ball             31    2    7    0   0   1/5    20.0     0/0   0.0
Jimmy Brogdon          31    0    4    3   0   0/1     0.0     0/0   0.0

TEAM: FG: 8/17 (47.1%), 3PT: 2/5 (40.0%), REB: 10 (3 off, 7 def), AST: 5, TO: 5
TEAM FOULS: 8 [Team_008 in BONUS]

================================================================================

================================================================================
                       4TH QUARTER - Team_008 vs Team_028                       
================================================================================

[12:00] Team_008 possession (Score: 94-72)
Jrue Harris drives to the basket... Jrue Harris throws a bad pass! Stolen by Kawhi Ball! TURNOVER! (live ball)

[11:44] Team_028 possession (Score: 94-72)
Kawhi Ball drives and kicks out. Austin Russell attempts a 3Pt. Contested by Victor Leonard (5.3 feet, ZONE). AUSTIN RUSSELL MAKES IT! Assist: Myles Haliburton
Score: 94-75

[11:29] Team_008 possession (Score: 94-75)
Khris Hyland drives, Kawhi Ball stays with him. Khris Hyland attempts a Dunk. Contested by Kawhi Ball (4.7 feet, ZONE). Khris Hyland misses. Offensive rebound by Magic Young! Magic Young kicks it out.

[11:15] Team_008 possession (Score: 94-75)
FOUL! Reach-in foul on Kawhi Ball during the drive. [Team fouls: 1] No free throws, side out. (Kawhi Ball: 1 personal fouls)

[11:00] Team_008 possession (Score: 94-75)
Victor Leonard attempts a Layup. BLOCKED BY KAWHI BALL! Ball is loose! Rebound secured by Carmelo Carter.

[10:42] Team_028 possession (Score: 94-75)
FOUL! Shooting foul on Jrue Harris. Jimmy Brogdon to the line for 2 free throws. [Team fouls: 1] (Jrue Harris: 1 personal fouls)   FT 1/2: GOOD   FT 2/2: MISS Jimmy Brogdon makes 1/2 from the line. Offensive rebound by Kawhi Ball! Kawhi Ball kicks it out.
Score: 94-76

[10:26] Team_028 possession (Score: 94-76)
Kawhi Ball drives, picks up Tyrese Thompson. Help arrives from Jrue Harris! Kawhi Ball attempts a Dunk. Contested by Jrue Harris (5.1 feet, MAN). KAWHI BALL MAKES IT! Assist: Austin Russell
Score: 94-78

[10:13] Team_008 possession (Score: 94-78)
Khris Hyland drives, Kawhi Ball stays with him. Khris Hyland attempts a Layup. Contested by Kawhi Ball (4.9 feet, ZONE). KHRIS HYLAND MAKES IT! Assist: Victor Leonard
Score: 96-78

[10:01] Team_028 possession (Score: 96-78)
Austin Russell attempts a Midrange. Contested by Victor Leonard (5.4 feet, MAN). Austin Russell misses. Rebound secured by Magic Young.

[09:46] Team_008 possession (Score: 96-78)
Victor Leonard attempts a Midrange. Contested by Carmelo Carter (5.2 feet, ZONE). VICTOR LEONARD MAKES IT! Assist: Khris Hyland
Score: 98-78

[09:31] Team_028 possession (Score: 98-78)
Myles Haliburton makes the Layup and draws the foul on Tyrese Thompson! And-1! Myles Haliburton to the line for 1. [Team fouls: 2] (Tyrese Thompson: 1 personal fouls)   FT 1/1: GOOD Myles Haliburton makes 1/1 from the line.
Score: 98-81

[09:14] Team_008 possession (Score: 98-81)
Tyrese Thompson attempts a Layup. Contested by Kawhi Ball (5.1 feet, MAN). Tyrese Thompson misses. Offensive rebound by Tyrese Thompson! Tyrese Thompson kicks it out.

[08:59] Team_008 possession (Score: 98-81)
Jrue Harris makes the Layup and draws the foul on Carmelo Carter! And-1! Jrue Harris to the line for 1. [Team fouls: 2] (Carmelo Carter: 1 personal fouls)   FT 1/1: GOOD Jrue Harris makes 1/1 from the line.
Score: 101-81

[08:49] Team_028 possession (Score: 101-81)
Carmelo Carter loses the ball! Stripped by Jrue Harris! TURNOVER! (live ball)

[08:39] Team_008 possession (Score: 101-81)
Tyrese Thompson drives and kicks out. Magic Young attempts a 3Pt. Contested by Jimmy Brogdon (5.2 feet, MAN). Magic Young misses. Rebound secured by Jimmy Brogdon.

[08:23] Team_028 possession (Score: 101-81)
Austin Russell attempts a 3Pt. Contested by Victor Leonard (5.6 feet, ZONE). Austin Russell misses. Rebound secured by Magic Young.

[08:06] Team_008 possession (Score: 101-81)
Tyrese Thompson attempts a 3Pt. Contested by Kawhi Ball (5.2 feet, MAN). Tyrese Thompson misses. Rebound secured by Jimmy Brogdon.

[07:54] Team_028 possession (Score: 101-81)
Myles Haliburton attempts a 3Pt. Contested by Victor Leonard (5.8 feet, ZONE). Myles Haliburton misses. Rebound secured by Tyrese Thompson.

[07:38] Team_008 possession (Score: 101-81)
Khris Hyland attempts a 3Pt. Contested by Myles Haliburton (4.5 feet, MAN). KHRIS HYLAND MAKES IT! Assist: Tyrese Thompson
Score: 104-81

[07:24] Team_028 possession (Score: 104-81)
Carmelo Carter makes the Layup and draws the foul on Jrue Harris! And-1! Carmelo Carter to the line for 1. [Team fouls: 3] (Jrue Harris: 2 personal fouls)   FT 1/1: GOOD Carmelo Carter makes 1/1 from the line.
Score: 104-84

[07:11] Team_008 possession (Score: 104-84)
Khris Hyland makes the Dunk and draws the foul on Carmelo Carter! And-1! Khris Hyland to the line for 1. [Team fouls: 3] (Carmelo Carter: 2 personal fouls)   FT 1/1: GOOD Khris Hyland makes 1/1 from the line.
Score: 107-84

[06:54] Team_028 possession (Score: 107-84)
Jimmy Brogdon drives, picks up Magic Young. Help arrives from Jrue Harris! Jimmy Brogdon attempts a Dunk. Wide open! Jrue Harris is 6.3 feet away. [MAN] Jimmy Brogdon misses. Rebound secured by Khris Hyland.

[06:40] Team_008 possession (Score: 107-84)
Jrue Harris attempts a Midrange. Contested by Carmelo Carter (5.4 feet, MAN). Jrue Harris misses. Rebound secured by Jimmy Brogdon.

[06:23] Team_028 possession (Score: 107-84)
Carmelo Carter attempts a Midrange. Contested by Jrue Harris (5.5 feet, MAN). CARMELO CARTER MAKES IT! Assist: Jimmy Brogdon
Score: 107-86

[06:07] Team_008 possession (Score: 107-86)
Jrue Harris attempts a Layup. Contested by Carmelo Carter (5.5 feet, MAN). JRUE HARRIS MAKES IT!
Score: 109-86

[05:47] Team_028 possession (Score: 109-86)
Jimmy Brogdon drives, Magic Young stays with him. Jimmy Brogdon attempts a Layup. Wide open! Magic Young is 6.4 feet away. [ZONE] JIMMY BROGDON MAKES IT!
Score: 109-88

[05:36] Team_008 possession (Score: 109-88)
Jrue Harris attempts a 3Pt. Contested by Carmelo Carter (5.6 feet, MAN). Jrue Harris misses. Rebound secured by Jimmy Brogdon.

[05:24] Team_028 possession (Score: 109-88)
Carmelo Carter attempts a Layup. Wide open! Tyrese Thompson is 6.0 feet away. [ZONE] CARMELO CARTER MAKES IT! Assist: Austin Russell
Score: 109-90

[05:10] Team_008 possession (Score: 109-90)
Victor Leonard loses control! Ball rolls out of bounds! TURNOVER! (dead ball)

[05:10] Substitution (Team_008): Victor Leonard OUT → Blake Holiday IN (stamina_rule2)

[05:10] Substitution (Team_008): Jrue Harris OUT → Chris Griffin IN (stamina_rule2)

[05:10] Substitution (Team_008): Khris Hyland OUT → Immanuel Young IN (stamina_rule2)

[05:10] Substitution (Team_008): Tyrese Thompson OUT → Khris Giddey IN (stamina_rule2)

[05:10] Substitution (Team_008): Magic Young OUT → Lamelo Middleton IN (stamina_rule2)

[05:10] Substitution (Team_028): Austin Russell OUT → Scottie Ingram IN (stamina_rule2)

[05:10] Substitution (Team_028): Carmelo Carter OUT → Tyrese Quickley IN (stamina_rule2)

[05:10] Substitution (Team_028): Myles Haliburton OUT → Miles Booker IN (stamina_rule2)

[05:10] Substitution (Team_028): Kawhi Ball OUT → Bam Towns IN (stamina_rule2)

[05:10] Substitution (Team_028): Jimmy Brogdon OUT → Collin Bridges IN (stamina_rule2)

[04:56] Team_028 possession (Score: 109-90)
Scottie Ingram makes the Layup and draws the foul on Blake Holiday! And-1! Scottie Ingram to the line for 1. [Team fouls: 4] (Blake Holiday: 1 personal fouls)   FT 1/1: GOOD Scottie Ingram makes 1/1 from the line.
Score: 109-93

[04:39] Team_008 possession (Score: 109-93)
Blake Holiday drives and kicks out. Khris Giddey attempts a 3Pt. Contested by Scottie Ingram (5.5 feet, ZONE). Khris Giddey misses. Rebound secured by Bam Towns.

[04:24] Team_028 possession (Score: 109-93)
Bam Towns loses control! Ball rolls out of bounds! TURNOVER! (dead ball)

[04:09] Team_008 possession (Score: 109-93)
Khris Giddey attempts a 3Pt. Contested by Scottie Ingram (5.4 feet, ZONE). KHRIS GIDDEY MAKES IT! Assist: Immanuel Young
Score: 112-93

[03:55] Team_028 possession (Score: 112-93)
Collin Bridges drives, Khris Giddey stays with him. Collin Bridges attempts a Dunk. Contested by Khris Giddey (4.5 feet, ZONE). COLLIN BRIDGES MAKES IT! Assist: Miles Booker
Score: 112-95

[03:38] Team_008 possession (Score: 112-95)
Chris Griffin drives to the basket... FOUL! Offensive foul on Chris Griffin! Collin Bridges drew the charge! [Team fouls: 5] (Chris Griffin: 1 personal fouls) TURNOVER! (dead ball)

[03:28] Team_028 possession (Score: 112-95)
Tyrese Quickley drives to the basket... FOUL! Offensive foul on Tyrese Quickley! Lamelo Middleton drew the charge! [Team fouls: 4] (Tyrese Quickley: 1 personal fouls) TURNOVER! (dead ball)

[03:11] Team_008 possession (Score: 112-95)
Blake Holiday drives, Scottie Ingram stays with him. Blake Holiday attempts a Layup. Contested by Scottie Ingram (5.7 feet, MAN). Blake Holiday misses. Rebound secured by Collin Bridges.

[02:55] Team_028 possession (Score: 112-95)
Tyrese Quickley makes the Layup and draws the foul on Chris Griffin! And-1! Tyrese Quickley to the line for 1. [BONUS: 6 team fouls] (Chris Griffin: 2 personal fouls)   FT 1/1: GOOD Tyrese Quickley makes 1/1 from the line.
Score: 112-98

[02:38] Team_008 possession (Score: 112-98)
FOUL! Holding foul on Collin Bridges. [IN THE BONUS! 5 team fouls] Khris Giddey to the line for 2 free throws. (Collin Bridges: 1 personal fouls)   FT 1/2: GOOD   FT 2/2: GOOD Khris Giddey makes 2/2 from the line.
Score: 114-98

[02:28] Team_028 possession (Score: 114-98)
Tyrese Quickley attempts a Layup. BLOCKED BY CHRIS GRIFFIN! Ball is loose! Offensive rebound by Bam Towns! Bam Towns kicks it out.

[02:13] Team_028 possession (Score: 114-98)
Collin Bridges attempts a 3Pt. Contested by Khris Giddey (4.5 feet, ZONE). COLLIN BRIDGES MAKES IT! Assist: Scottie Ingram
Score: 114-101

[01:59] Team_008 possession (Score: 114-101)
Chris Griffin attempts a Layup. BLOCKED BY COLLIN BRIDGES! Ball goes out off Collin Bridges. Chris Griffin's ball!

[01:42] Team_008 possession (Score: 114-101)
Chris Griffin drives to the basket... Chris Griffin loses the ball! Stripped by Collin Bridges! TURNOVER! (live ball)

[01:28] Team_028 possession (Score: 114-101)
Collin Bridges attempts a Layup. Contested by Lamelo Middleton (4.5 feet, ZONE). COLLIN BRIDGES MAKES IT!
Score: 114-103

[01:15] Team_008 possession (Score: 114-103)
Khris Giddey attempts a Midrange. Contested by Collin Bridges (3.6 feet, MAN). Khris Giddey misses. Rebound secured by Bam Towns.

[01:00] Team_028 possession (Score: 114-103)
Bam Towns throws a bad pass out of bounds! TURNOVER! (dead ball)

[00:48] Team_008 possession (Score: 114-103)
Lamelo Middleton drives, picks up Collin Bridges. Help arrives from Tyrese Quickley! Lamelo Middleton attempts a Dunk. Contested by Tyrese Quickley (4.0 feet, MAN). Lamelo Middleton misses. Rebound secured by Tyrese Quickley.

[00:33] Team_028 possession (Score: 114-103)
Scottie Ingram drives, Blake Holiday stays with him. Scottie Ingram attempts a Layup. Contested by Blake Holiday (5.4 feet, MAN). SCOTTIE INGRAM MAKES IT!
Score: 114-105

[00:22] Team_008 possession (Score: 114-105)
Chris Griffin attempts a 3Pt. Contested by Tyrese Quickley (4.7 feet, MAN). Chris Griffin misses. Offensive rebound by Lamelo Middleton! Lamelo Middleton puts it back in!
Score: 116-105

[00:10] Team_028 possession (Score: 116-105)
Collin Bridges attempts a Layup. Contested by Lamelo Middleton (4.5 feet, ZONE). COLLIN BRIDGES MAKES IT! Assist: Miles Booker
Score: 116-107

================================================================================
                              4TH QUARTER COMPLETE                              
================================================================================

4TH QUARTER SCORE: Team_008 22, Team_028 35

BOX SCORE:
================================================================================

Team_008
--------------------------------------------------------------------------------
Player                MIN  PTS  REB  AST  TO      FG   FG%      3P   3P%
--------------------------------------------------------------------------------
Khris Hyland           38    8    1    1   0   3/3   100.0     0/0   0.0
Jrue Harris            38    5    0    0   0   2/4    50.0     0/0   0.0
Khris Giddey           10    5    0    0   0   2/3    66.7     0/0   0.0
Victor Leonard         38    2    0    1   0   1/2    50.0     0/0   0.0
Lamelo Middleton       10    2    1    0   0   1/2    50.0     0/0   0.0
Magic Young            38    0    3    0   0   0/0     0.0     0/0   0.0
Tyrese Thompson        38    0    2    1   0   0/2     0.0     0/0   0.0
Blake Holiday          10    0    0    0   0   0/2     0.0     0/0   0.0
Immanuel Young         10    0    0    1   0   0/0     0.0     0/0   0.0

TEAM: FG: 9/18 (50.0%), 3PT: 3/5 (60.0%), REB: 7 (3 off, 4 def), AST: 4, TO: 4
TEAM FOULS: 6 [Team_028 in BONUS]


Team_028
--------------------------------------------------------------------------------
Player                MIN  PTS  REB  AST  TO      FG   FG%      3P   3P%
--------------------------------------------------------------------------------
Collin Bridges         10    9    1    0   0   4/4   100.0     0/0   0.0
Carmelo Carter         38    7    1    0   0   3/3   100.0     0/0   0.0
Scottie Ingram         10    5    0    1   0   2/2   100.0     0/0   0.0
Austin Russell         38    3    0    2   0   1/3    33.3     0/0   0.0
Myles Haliburton       38    3    0    1   0   1/2    50.0     0/0   0.0
Tyrese Quickley        10    3    1    0   0   1/1   100.0     0/0   0.0
Kawhi Ball             38    2    1    0   0   1/1   100.0     0/0   0.0
Jimmy Brogdon          38    2    4    1   0   1/2    50.0     0/0   0.0
Bam Towns              10    0    3    0   0   0/0     0.0     0/0   0.0
Miles Booker           10    0    0    2   0   0/0     0.0     0/0   0.0

TEAM: FG: 14/18 (77.8%), 3PT: 1/3 (33.3%), REB: 11 (2 off, 9 def), AST: 7, TO: 4
TEAM FOULS: 5 [Team_008 in BONUS]

================================================================================

================================================================================
                               FULL GAME COMPLETE                               
================================================================================

FINAL SCORE: Team_008 116, Team_028 107

SCORING BY QUARTER:
--------------------------------------------------------------------------------
Team                     Q1     Q2     Q3     Q4    FINAL
--------------------------------------------------------------------------------
Team_008                 25     36     33     22      116
Team_028                 23     31     18     35      107
--------------------------------------------------------------------------------

FULL GAME BOX SCORE:
================================================================================

Team_008
--------------------------------------------------------------------------------
Player                MIN  PTS  REB  AST  TO      FG   FG%      3P   3P%      FT STL BLK
--------------------------------------------------------------------------------
Victor Leonard         38   14    0    5   1   5/7    71.4   4/5    80.0   0/0     0   0
Jrue Harris            38   29    0    1   0  11/17   64.7   4/6    66.7   4/6     3   0
Khris Hyland           38   17    8    3   0   7/14   50.0   2/5    40.0   6/8     0   0
Tyrese Thompson        38   17   11    3   2   7/16   43.8   3/7    42.9   5/6     3   2
Magic Young            38    8   12    5   3   3/7    42.9   1/4    25.0   2/5     1   0
Blake Holiday          10    3    0    0   0   1/4    25.0   1/1   100.0   0/0     0   0
Chris Griffin          10    3    3    0   0   2/2   100.0   2/2   100.0   0/0     0   1
Immanuel Young         10    0    0    2   0   1/1   100.0   0/0     0.0   0/0     0   0
Khris Giddey           10    9    1    1   1   3/5    60.0   2/3    66.7   6/6     0   0
Lamelo Middleton       10    8    1    1   2   2/3    66.7   0/0     0.0   2/3     0   0

TEAM: FG: 43/77 (55.8%), 3PT: 19/33 (57.6%), REB: 39 (12 off, 27 def), AST: 21, TO: 9


Team_028
--------------------------------------------------------------------------------
Player                MIN  PTS  REB  AST  TO      FG   FG%      3P   3P%      FT STL BLK
--------------------------------------------------------------------------------
Austin Russell         38    9    0    5   2   3/11   27.3   0/3     0.0   1/2     0   1
Carmelo Carter         38   23    8    3   2   8/11   72.7   3/5    60.0   4/4     0   0
Myles Haliburton       38   19    0    3   1   8/9    88.9   2/3    66.7   1/1     0   0
Kawhi Ball             38   12   13    2   3   8/15   53.3   0/3     0.0   1/2     3   1
Jimmy Brogdon          38    8   15    5   3   3/7    42.9   1/1   100.0   2/3     0   0
Scottie Ingram         10    9    0    2   0   4/5    80.0   0/0     0.0   1/1     0   0
Tyrese Quickley        10    3    2    1   0   1/1   100.0   0/0     0.0   1/1     0   0
Miles Booker           10    2    0    3   0   1/1   100.0   0/0     0.0   0/0     0   0
Bam Towns              10    3    3    0   2   1/4    25.0   0/1     0.0   1/1     0   0
Collin Bridges         10   16    3    0   1   7/7   100.0   2/2   100.0   0/0     2   1

TEAM: FG: 44/71 (62.0%), 3PT: 8/18 (44.4%), REB: 41 (10 off, 31 def), AST: 24, TO: 14

================================================================================
