================================================================================
                        FULL GAME - Team_031 vs Team_066                        
================================================================================

================================================================================
                       1ST QUARTER - Team_031 vs Team_066                       
================================================================================

[12:00] Team_031 possession (Score: 0-0)
Luka Sabonis attempts a Midrange. Contested by Kyle Wagner (4.5 feet, MAN). LUKA SABONIS MAKES IT!
Score: 2-0

[11:45] Team_066 possession (Score: 2-0)
Yao Brogdon attempts a Layup. Contested by Immanuel James (3.5 feet, ZONE). Yao Brogdon misses. Rebound secured by Gary Morant.

[11:31] Team_031 possession (Score: 2-0)
Gary Morant attempts a Layup. BLOCKED BY YAO BROGDON! Ball is loose! Rebound secured by Kyle Wagner.

[11:17] Team_066 possession (Score: 2-0)
Kyle Wagner drives and kicks out. Brandon Reaves attempts a Midrange. Contested by Pau Irving (3.6 feet, MAN). Brandon Reaves misses. FOUL! Loose ball foul on Gary Morant during the rebound battle. [Team fouls: 1] No free throws, side out. (Gary Morant: 1 personal fouls)

[11:04] Team_066 possession (Score: 2-0)
Pau Curry makes the Midrange and draws the foul on Gary Morant! And-1! Pau Curry to the line for 1. [Team fouls: 2] (Gary Morant: 2 personal fouls)   FT 1/1: GOOD Pau Curry makes 1/1 from the line.
Score: 2-3

[10:48] Team_031 possession (Score: 2-3)
Shai Durant makes the 3Pt and draws the foul on Pau Curry! And-1! Shai Durant to the line for 1. [Team fouls: 1] (Pau Curry: 1 personal fouls)   FT 1/1: GOOD Shai Durant makes 1/1 from the line.
Score: 6-3

[10:31] Team_066 possession (Score: 6-3)
Pau Curry attempts a Midrange. Contested by Gary Morant (4.0 feet, MAN). PAU CURRY MAKES IT!
Score: 6-5

[10:17] Team_031 possession (Score: 6-5)
FOUL! Offensive foul on Pau Irving! Brandon Reaves drew the charge! [Team fouls: 3] (Pau Irving: 1 personal fouls) TURNOVER! (dead ball)

[10:00] Team_066 possession (Score: 6-5)
Pau Curry drives and kicks out. Kyle Wagner attempts a 3Pt. Contested by Pau Irving (3.6 feet, ZONE). Kyle Wagner misses. Offensive rebound by Kyle Wagner! Kyle Wagner kicks it out.

[09:45] Team_066 possession (Score: 6-5)
Kyle Wagner drives, picks up Luka Sabonis. Help arrives from Shai Durant! Kyle Wagner attempts a Layup. Contested by Shai Durant (3.1 feet, MAN). Kyle Wagner misses. Offensive rebound by Kyle Wagner! Kyle Wagner kicks it out.

[09:30] Team_066 possession (Score: 6-5)
Brandon Reaves attempts a Midrange. Contested by Pau Irving (4.1 feet, MAN). Brandon Reaves misses. Offensive rebound by Kyle Wagner! Kyle Wagner kicks it out.

[09:14] Team_066 possession (Score: 6-5)
Pau Curry drives and kicks out. Brandon Reaves attempts a Midrange. Contested by Pau Irving (3.6 feet, MAN). Brandon Reaves misses. Rebound secured by Luka Sabonis.

[09:01] Team_031 possession (Score: 6-5)
Gary Morant attempts a 3Pt. Wide open! Pau Curry is 6.1 feet away. [MAN] Gary Morant misses. Rebound secured by Kyle Wagner.

[08:44] Team_066 possession (Score: 6-5)
Pau Curry throws a bad pass out of bounds! TURNOVER! (dead ball)

[08:28] Team_031 possession (Score: 6-5)
Shai Durant attempts a 3Pt. Contested by Pau Curry (5.6 feet, ZONE). Shai Durant misses. Rebound secured by Kyle Wagner.

[08:14] Team_066 possession (Score: 6-5)
Brandon Reaves attempts a 3Pt. Contested by Pau Irving (4.1 feet, ZONE). Brandon Reaves misses. Rebound secured by Gary Morant.

[07:55] Team_031 possession (Score: 6-5)
Gary Morant attempts a 3Pt. Wide open! Pau Curry is 6.1 feet away. [ZONE] GARY MORANT MAKES IT! Assist: Shai Durant
Score: 9-5

[07:41] Team_066 possession (Score: 9-5)
Jimmy Davis attempts a 3Pt. Contested by Shai Durant (4.3 feet, MAN). Jimmy Davis misses. Rebound secured by Luka Sabonis.

[07:24] Team_031 possession (Score: 9-5)
FOUL! Reach-in foul on Jimmy Davis during the drive. [Team fouls: 2] No free throws, side out. (Jimmy Davis: 1 personal fouls)

[07:11] Team_031 possession (Score: 9-5)
FOUL! Shooting foul on Brandon Reaves. Shai Durant to the line for 2 free throws. [Team fouls: 3] (Brandon Reaves: 1 personal fouls)   FT 1/2: MISS   FT 2/2: GOOD Shai Durant makes 1/2 from the line.
Score: 10-5

[06:57] Team_066 possession (Score: 10-5)
Kyle Wagner attempts a Midrange. Contested by Immanuel James (2.9 feet, ZONE). Kyle Wagner misses. Rebound secured by Immanuel James.

[06:44] Team_031 possession (Score: 10-5)
Immanuel James attempts a 3Pt. Contested by Pau Curry (5.9 feet, ZONE). Immanuel James misses. Rebound secured by Kyle Wagner.

[06:32] Team_066 possession (Score: 10-5)
Jimmy Davis attempts a Midrange. Contested by Gary Morant (4.2 feet, ZONE). Jimmy Davis misses. Rebound secured by Luka Sabonis.

[06:17] Team_031 possession (Score: 10-5)
Gary Morant attempts a Midrange. BLOCKED BY BRANDON REAVES! Ball is loose! Offensive rebound by Immanuel James! Immanuel James kicks it out.

[06:02] Team_031 possession (Score: 10-5)
Pau Irving attempts a Layup. Contested by Brandon Reaves (5.2 feet, MAN). PAU IRVING MAKES IT!
Score: 12-5

[05:50] Team_066 possession (Score: 12-5)
Pau Curry drives, picks up Gary Morant. Help arrives from Pau Irving! Pau Curry attempts a Layup. Contested by Pau Irving (4.0 feet, MAN). PAU CURRY MAKES IT! Assist: Brandon Reaves
Score: 12-7

[05:35] Team_031 possession (Score: 12-7)
Shai Durant makes the Dunk and draws the foul on Jimmy Davis! And-1! Shai Durant to the line for 1. [Team fouls: 4] (Jimmy Davis: 2 personal fouls)   FT 1/1: GOOD Shai Durant makes 1/1 from the line.
Score: 15-7

[05:19] Team_066 possession (Score: 15-7)
Jimmy Davis attempts a 3Pt. Contested by Pau Irving (4.0 feet, ZONE). JIMMY DAVIS MAKES IT!
Score: 15-10

[05:04] Team_031 possession (Score: 15-10)
Pau Irving drives and kicks out. Immanuel James attempts a 3Pt. Contested by Pau Curry (5.5 feet, ZONE). Immanuel James misses. Rebound secured by Yao Brogdon.

[04:51] Team_066 possession (Score: 15-10)
Yao Brogdon attempts a 3Pt. Contested by Pau Irving (4.1 feet, ZONE). Yao Brogdon misses. Rebound secured by Luka Sabonis.

[04:41] Team_031 possession (Score: 15-10)
Luka Sabonis makes the Layup and draws the foul on Kyle Wagner! And-1! Luka Sabonis to the line for 1. [BONUS: 5 team fouls] (Kyle Wagner: 1 personal fouls)   FT 1/1: MISS Luka Sabonis makes 0/1 from the line. Rebound secured by Kyle Wagner.
Score: 17-10

[04:30] Team_066 possession (Score: 17-10)
Pau Curry attempts a 3Pt. Contested by Gary Morant (4.1 feet, MAN). Pau Curry misses. Offensive rebound by Yao Brogdon! Yao Brogdon kicks it out.

[04:17] Team_066 possession (Score: 17-10)
Brandon Reaves attempts a Layup. Contested by Pau Irving (4.2 feet, MAN). Brandon Reaves misses. Rebound secured by Immanuel James.

[04:03] Team_031 possession (Score: 17-10)
Shai Durant attempts a Midrange. Contested by Jimmy Davis (4.2 feet, MAN). SHAI DURANT MAKES IT!
Score: 19-10

[03:54] Team_066 possession (Score: 19-10)
Jimmy Davis attempts a 3Pt. Contested by Pau Irving (4.2 feet, ZONE). Jimmy Davis misses. Rebound secured by Gary Morant.

[03:38] Team_031 possession (Score: 19-10)
FOUL! Shooting foul on Pau Curry. Pau Irving to the line for 3 free throws. [BONUS: 6 team fouls] (Pau Curry: 2 personal fouls)   FT 1/3: MISS   FT 2/3: GOOD   FT 3/3: GOOD Pau Irving makes 2/3 from the line.
Score: 21-10

[03:25] Team_066 possession (Score: 21-10)
Yao Brogdon attempts a 3Pt. Contested by Immanuel James (3.7 feet, MAN). Yao Brogdon misses. Rebound secured by Luka Sabonis.

[03:10] Team_031 possession (Score: 21-10)
Luka Sabonis drives, Kyle Wagner stays with him. Luka Sabonis attempts a Dunk. Contested by Kyle Wagner (4.6 feet, MAN). LUKA SABONIS MAKES IT! Assist: Immanuel James
Score: 23-10

[02:56] Team_066 possession (Score: 23-10)
Brandon Reaves attempts a 3Pt. Contested by Pau Irving (4.3 feet, MAN). BRANDON REAVES MAKES IT! Assist: Yao Brogdon
Score: 23-13

[02:37] Team_031 possession (Score: 23-13)
Shai Durant makes the Dunk and draws the foul on Jimmy Davis! And-1! Shai Durant to the line for 1. [BONUS: 7 team fouls] (Jimmy Davis: 3 personal fouls)   FT 1/1: GOOD Shai Durant makes 1/1 from the line.
Score: 26-13

[02:26] Team_066 possession (Score: 26-13)
Brandon Reaves attempts a 3Pt. Contested by Pau Irving (4.3 feet, ZONE). BRANDON REAVES MAKES IT! Assist: Kyle Wagner
Score: 26-16

[02:12] Team_031 possession (Score: 26-16)
FOUL! Shooting foul on Yao Brogdon. Immanuel James to the line for 2 free throws. [BONUS: 8 team fouls] (Yao Brogdon: 1 personal fouls)   FT 1/2: GOOD   FT 2/2: GOOD Immanuel James makes 2/2 from the line.
Score: 28-16

[01:57] Team_066 possession (Score: 28-16)
Brandon Reaves attempts a Midrange. Contested by Pau Irving (4.4 feet, ZONE). Brandon Reaves misses. Rebound secured by Luka Sabonis.

[01:40] Team_031 possession (Score: 28-16)
Gary Morant attempts a 3Pt. Wide open! Pau Curry is 6.3 feet away. [ZONE] Gary Morant misses. Offensive rebound by Immanuel James! Immanuel James's putback is no good. Rebound secured by Brandon Reaves.

[01:22] Team_066 possession (Score: 28-16)
Brandon Reaves drives and kicks out. Pau Curry attempts a Midrange. Contested by Luka Sabonis (3.7 feet, ZONE). Pau Curry misses. Rebound secured by Luka Sabonis.

[01:11] Team_031 possession (Score: 28-16)
Luka Sabonis attempts a Midrange. Wide open! Yao Brogdon is 6.1 feet away. [ZONE] Luka Sabonis misses. Rebound secured by Kyle Wagner.

[00:56] Team_066 possession (Score: 28-16)
Brandon Reaves attempts a 3Pt. Contested by Pau Irving (4.5 feet, ZONE). Brandon Reaves misses. Rebound secured by Gary Morant.

[00:38] Team_031 possession (Score: 28-16)
Luka Sabonis throws a bad pass out of bounds! TURNOVER! (dead ball)

[00:38] Substitution (Team_031): Shai Durant OUT → Kevin Morant IN (stamina_rule2)

[00:38] Substitution (Team_031): Gary Morant OUT → Isaiah Ingram IN (stamina_rule2)

[00:38] Substitution (Team_031): Pau Irving OUT → Miles Stewart IN (stamina_rule2)

[00:38] Substitution (Team_031): Immanuel James OUT → Kobe Randle IN (stamina_rule2)

[00:38] Substitution (Team_031): Luka Sabonis OUT → Jimmy Poole IN (stamina_rule2)

[00:38] Substitution (Team_066): Jimmy Davis OUT → Pascal Carter IN (stamina_rule2)

[00:38] Substitution (Team_066): Pau Curry OUT → Lauri LaVine IN (stamina_rule2)

[00:38] Substitution (Team_066): Brandon Reaves OUT → Brandon Middleton IN (stamina_rule2)

[00:38] Substitution (Team_066): Yao Brogdon OUT → Cole Morant IN (stamina_rule2)

[00:38] Substitution (Team_066): Kyle Wagner OUT → Donovan Simmons IN (stamina_rule2)

[00:22] Team_066 possession (Score: 28-16)
Pascal Carter attempts a 3Pt. Contested by Kevin Morant (5.0 feet, MAN). PASCAL CARTER MAKES IT! Assist: Brandon Middleton
Score: 28-19

[00:04] Team_031 possession (Score: 28-19)
Miles Stewart attempts a 3Pt. Contested by Cole Morant (5.5 feet, ZONE). Miles Stewart misses. Rebound secured by Brandon Middleton.

================================================================================
                              1ST QUARTER COMPLETE                              
================================================================================

1ST QUARTER SCORE: Team_031 28, Team_066 19

BOX SCORE:
================================================================================

Team_031
--------------------------------------------------------------------------------
Player                MIN  PTS  REB  AST  TO      FG   FG%      3P   3P%
--------------------------------------------------------------------------------
Shai Durant            12   13    0    1   0   5/6    83.3     0/0   0.0
Luka Sabonis           12    4    7    0   0   2/4    50.0     0/0   0.0
Pau Irving             12    4    0    0   0   2/3    66.7     0/0   0.0
Gary Morant            12    3    4    0   0   1/4    25.0     0/0   0.0
Immanuel James         12    2    3    1   0   1/2    50.0     0/0   0.0
Miles Stewart           1    0    0    0   0   0/1     0.0     0/0   0.0

TEAM: FG: 11/20 (55.0%), 3PT: 3/8 (37.5%), REB: 15 (2 off, 13 def), AST: 2, TO: 2
TEAM FOULS: 3


Team_066
--------------------------------------------------------------------------------
Player                MIN  PTS  REB  AST  TO      FG   FG%      3P   3P%
--------------------------------------------------------------------------------
Pau Curry              12    7    0    0   0   3/4    75.0     0/0   0.0
Brandon Reaves         12    6    1    1   0   2/7    28.6     0/0   0.0
Jimmy Davis            12    3    0    0   0   1/4    25.0     0/0   0.0
Pascal Carter           1    3    0    0   0   1/1   100.0     0/0   0.0
Yao Brogdon            12    0    3    1   0   0/3     0.0     0/0   0.0
Kyle Wagner            12    0    9    1   0   0/1     0.0     0/0   0.0
Brandon Middleton       1    0    1    1   0   0/0     0.0     0/0   0.0

TEAM: FG: 7/20 (35.0%), 3PT: 4/10 (40.0%), REB: 13 (5 off, 8 def), AST: 4, TO: 1
TEAM FOULS: 8 [Team_031 in BONUS]

================================================================================

================================================================================
                       2ND QUARTER - Team_031 vs Team_066                       
================================================================================

[12:00] Team_031 possession (Score: 28-19)
Gary Morant attempts a 3Pt. Wide open! Pau Curry is 6.2 feet away. [ZONE] GARY MORANT MAKES IT! Assist: Luka Sabonis
Score: 31-19

[11:48] Team_066 possession (Score: 31-19)
Yao Brogdon makes the Midrange and draws the foul on Immanuel James! And-1! Yao Brogdon to the line for 1. [Team fouls: 1] (Immanuel James: 1 personal fouls)   FT 1/1: GOOD Yao Brogdon makes 1/1 from the line.
Score: 31-22

[11:32] Team_031 possession (Score: 31-22)
Luka Sabonis drives, Kyle Wagner stays with him. Luka Sabonis attempts a Dunk. Contested by Kyle Wagner (4.7 feet, MAN). LUKA SABONIS MAKES IT! Assist: Immanuel James
Score: 33-22

[11:16] Team_066 possession (Score: 33-22)
Jimmy Davis attempts a 3Pt. Contested by Pau Irving (4.3 feet, ZONE). Jimmy Davis misses. Offensive rebound by Yao Brogdon! Yao Brogdon kicks it out.

[11:01] Team_066 possession (Score: 33-22)
Kyle Wagner loses control! Ball rolls out of bounds! TURNOVER! (dead ball)

[11:01] Substitution (Team_031): Shai Durant OUT → Kevin Morant IN (stamina_rule2)

[11:01] Substitution (Team_031): Gary Morant OUT → Isaiah Ingram IN (stamina_rule2)

[11:01] Substitution (Team_031): Pau Irving OUT → Miles Stewart IN (stamina_rule2)

[11:01] Substitution (Team_031): Immanuel James OUT → Kobe Randle IN (stamina_rule2)

[11:01] Substitution (Team_031): Luka Sabonis OUT → Jimmy Poole IN (stamina_rule2)

[11:01] Substitution (Team_066): Jimmy Davis OUT → Pascal Carter IN (stamina_rule2)

[11:01] Substitution (Team_066): Pau Curry OUT → Lauri LaVine IN (stamina_rule2)

[11:01] Substitution (Team_066): Brandon Reaves OUT → Brandon Middleton IN (stamina_rule2)

[11:01] Substitution (Team_066): Yao Brogdon OUT → Cole Morant IN (stamina_rule2)

[11:01] Substitution (Team_066): Kyle Wagner OUT → Donovan Simmons IN (stamina_rule2)

[10:44] Team_031 possession (Score: 33-22)
FOUL! Shooting foul on Cole Morant. Kevin Morant to the line for 2 free throws. [Team fouls: 1] (Cole Morant: 1 personal fouls)   FT 1/2: MISS   FT 2/2: MISS Kevin Morant makes 0/2 from the line. Rebound secured by Brandon Middleton.

[10:32] Team_066 possession (Score: 33-22)
Brandon Middleton attempts a 3Pt. Contested by Miles Stewart (5.1 feet, MAN). Brandon Middleton misses. Rebound secured by Isaiah Ingram.

[10:15] Team_031 possession (Score: 33-22)
Jimmy Poole drives, Donovan Simmons stays with him. Jimmy Poole attempts a Layup. Contested by Donovan Simmons (4.8 feet, MAN). JIMMY POOLE MAKES IT! Assist: Kobe Randle
Score: 35-22

[10:01] Team_066 possession (Score: 35-22)
FOUL! Shooting foul on Kobe Randle. Donovan Simmons to the line for 2 free throws. [Team fouls: 2] (Kobe Randle: 1 personal fouls)   FT 1/2: GOOD   FT 2/2: GOOD Donovan Simmons makes 2/2 from the line.
Score: 35-24

[09:47] Team_031 possession (Score: 35-24)
Kevin Morant attempts a 3Pt. Wide open! Pascal Carter is 6.8 feet away. [MAN] Kevin Morant misses. Rebound secured by Brandon Middleton.

[09:34] Team_066 possession (Score: 35-24)
Brandon Middleton attempts a 3Pt. Contested by Miles Stewart (5.1 feet, ZONE). BRANDON MIDDLETON MAKES IT! Assist: Lauri LaVine
Score: 35-27

[09:19] Team_031 possession (Score: 35-27)
Jimmy Poole attempts a Midrange. Contested by Cole Morant (5.4 feet, ZONE). Jimmy Poole misses. FOUL! Loose ball foul on Brandon Middleton during the rebound battle. [Team fouls: 2] No free throws, side out. (Brandon Middleton: 1 personal fouls)

[09:03] Team_031 possession (Score: 35-27)
Miles Stewart attempts a 3Pt. Contested by Lauri LaVine (3.9 feet, ZONE). Miles Stewart misses. Rebound secured by Brandon Middleton.

[08:51] Team_066 possession (Score: 35-27)
Cole Morant attempts a 3Pt. Contested by Kevin Morant (5.4 feet, ZONE). Cole Morant misses. Offensive rebound by Donovan Simmons! Donovan Simmons kicks it out.

[08:38] Team_066 possession (Score: 35-27)
Lauri LaVine attempts a Midrange. Contested by Isaiah Ingram (4.4 feet, ZONE). Lauri LaVine misses. Rebound secured by Jimmy Poole.

[08:25] Team_031 possession (Score: 35-27)
Kevin Morant attempts a 3Pt. Wide open! Pascal Carter is 6.8 feet away. [MAN] KEVIN MORANT MAKES IT! Assist: Jimmy Poole
Score: 38-27

[08:11] Team_066 possession (Score: 38-27)
Pascal Carter drives and kicks out. Donovan Simmons attempts a 3Pt. Contested by Miles Stewart (5.3 feet, ZONE). Donovan Simmons misses. Rebound secured by Kobe Randle.

[07:57] Team_031 possession (Score: 38-27)
Kevin Morant attempts a 3Pt. Wide open! Pascal Carter is 6.8 feet away. [MAN] KEVIN MORANT MAKES IT! Assist: Jimmy Poole
Score: 41-27

[07:45] Team_066 possession (Score: 41-27)
Lauri LaVine drives and kicks out. Donovan Simmons attempts a 3Pt. Contested by Miles Stewart (5.3 feet, ZONE). Donovan Simmons misses. Rebound secured by Jimmy Poole.

[07:31] Team_031 possession (Score: 41-27)
Isaiah Ingram attempts a 3Pt. Contested by Lauri LaVine (4.4 feet, MAN). Isaiah Ingram misses. Rebound secured by Brandon Middleton.

[07:18] Team_066 possession (Score: 41-27)
FOUL! Reach-in foul on Kobe Randle during the drive. [Team fouls: 3] No free throws, side out. (Kobe Randle: 2 personal fouls)

[06:59] Team_066 possession (Score: 41-27)
FOUL! Shooting foul on Kobe Randle. Cole Morant to the line for 2 free throws. [Team fouls: 4] (Kobe Randle: 3 personal fouls)   FT 1/2: MISS   FT 2/2: GOOD Cole Morant makes 1/2 from the line.
Score: 41-28

[06:41] Team_031 possession (Score: 41-28)
Kobe Randle drives and kicks out. Kevin Morant attempts a 3Pt. Contested by Lauri LaVine (3.9 feet, ZONE). Kevin Morant misses. Rebound secured by Brandon Middleton.

[06:29] Team_066 possession (Score: 41-28)
Lauri LaVine drives, Kobe Randle stays with him. Lauri LaVine attempts a Layup. Contested by Kobe Randle (4.5 feet, ZONE). LAURI LAVINE MAKES IT! Assist: Brandon Middleton
Score: 41-30

[06:15] Team_031 possession (Score: 41-30)
Kevin Morant attempts a Midrange. Wide open! Pascal Carter is 6.8 feet away. [MAN] KEVIN MORANT MAKES IT! Assist: Isaiah Ingram
Score: 43-30

[06:00] Team_066 possession (Score: 43-30)
Cole Morant drives to the basket... Cole Morant loses control! Ball rolls out of bounds! TURNOVER! (dead ball)

[05:42] Team_031 possession (Score: 43-30)
Kobe Randle attempts a 3Pt. Wide open! Cole Morant is 6.2 feet away. [MAN] KOBE RANDLE MAKES IT! Assist: Jimmy Poole
Score: 46-30

[05:24] Team_066 possession (Score: 46-30)
Brandon Middleton attempts a 3Pt. Contested by Miles Stewart (5.1 feet, MAN). BRANDON MIDDLETON MAKES IT! Assist: Donovan Simmons
Score: 46-33

[05:13] Team_031 possession (Score: 46-33)
Isaiah Ingram attempts a Layup. Contested by Lauri LaVine (4.4 feet, MAN). Isaiah Ingram misses. Rebound secured by Lauri LaVine.

[04:58] Team_066 possession (Score: 46-33)
Donovan Simmons drives and kicks out. Pascal Carter attempts a 3Pt. Contested by Kevin Morant (4.9 feet, MAN). Pascal Carter misses. Rebound secured by Isaiah Ingram.

[04:43] Team_031 possession (Score: 46-33)
Isaiah Ingram makes the Dunk and draws the foul on Donovan Simmons! And-1! Isaiah Ingram to the line for 1. [Team fouls: 3] (Donovan Simmons: 1 personal fouls)   FT 1/1: GOOD Isaiah Ingram makes 1/1 from the line.
Score: 49-33

[04:28] Team_066 possession (Score: 49-33)
Cole Morant attempts a 3Pt. Contested by Miles Stewart (5.9 feet, ZONE). Cole Morant misses. Rebound secured by Kobe Randle.

[04:10] Team_031 possession (Score: 49-33)
Jimmy Poole attempts a Midrange. Contested by Donovan Simmons (4.9 feet, MAN). Jimmy Poole misses. FOUL! Loose ball foul on Donovan Simmons during the rebound battle. [Team fouls: 4] No free throws, side out. (Donovan Simmons: 2 personal fouls)

[03:54] Team_031 possession (Score: 49-33)
Miles Stewart attempts a 3Pt. Contested by Lauri LaVine (4.0 feet, ZONE). Miles Stewart misses. Rebound secured by Brandon Middleton.

[03:40] Team_066 possession (Score: 49-33)
Lauri LaVine drives, picks up Kobe Randle. Help arrives from Isaiah Ingram! Lauri LaVine attempts a Layup. Contested by Isaiah Ingram (4.6 feet, ZONE). LAURI LAVINE MAKES IT! Assist: Donovan Simmons
Score: 49-35

[03:25] Team_031 possession (Score: 49-35)
Jimmy Poole makes the Layup and draws the foul on Donovan Simmons! And-1! Jimmy Poole to the line for 1. [BONUS: 5 team fouls] (Donovan Simmons: 3 personal fouls)   FT 1/1: MISS Jimmy Poole makes 0/1 from the line. Offensive rebound by Isaiah Ingram! Isaiah Ingram kicks it out.
Score: 51-35

[03:11] Team_031 possession (Score: 51-35)
Kobe Randle drives, picks up Cole Morant. Help arrives from Lauri LaVine! Kobe Randle attempts a Layup. Wide open! Lauri LaVine is 6.2 feet away. [MAN] KOBE RANDLE MAKES IT!
Score: 53-35

[02:57] Team_066 possession (Score: 53-35)
Cole Morant drives, Kobe Randle stays with him. Cole Morant attempts a Layup. Contested by Kobe Randle (5.1 feet, ZONE). COLE MORANT MAKES IT! Assist: Brandon Middleton
Score: 53-37

[02:45] Team_031 possession (Score: 53-37)
Miles Stewart attempts a Midrange. Contested by Brandon Middleton (5.2 feet, MAN). Miles Stewart misses. Rebound secured by Lauri LaVine.

[02:26] Team_066 possession (Score: 53-37)
Lauri LaVine attempts a Midrange. Contested by Isaiah Ingram (4.7 feet, MAN). LAURI LAVINE MAKES IT!
Score: 53-39

[02:11] Team_031 possession (Score: 53-39)
Kobe Randle drives to the basket... FOUL! Offensive foul on Kobe Randle! Donovan Simmons drew the charge! [Team fouls: 5] (Kobe Randle: 4 personal fouls) TURNOVER! (dead ball)

[01:54] Team_066 possession (Score: 53-39)
Pascal Carter attempts a 3Pt. Contested by Miles Stewart (5.7 feet, ZONE). Pascal Carter misses. Rebound secured by Jimmy Poole.

[01:41] Team_031 possession (Score: 53-39)
FOUL! Reach-in foul on Donovan Simmons during the drive. [IN THE BONUS! 6 team fouls] Miles Stewart to the line for 2 free throws. (Donovan Simmons: 4 personal fouls)   FT 1/2: GOOD   FT 2/2: GOOD Miles Stewart makes 2/2 from the line.
Score: 55-39

[01:26] Team_066 possession (Score: 55-39)
Lauri LaVine attempts a 3Pt. Contested by Isaiah Ingram (4.8 feet, MAN). Lauri LaVine misses. Offensive rebound by Donovan Simmons! Donovan Simmons kicks it out.

[01:11] Team_066 possession (Score: 55-39)
Brandon Middleton attempts a Layup. Contested by Miles Stewart (5.4 feet, MAN). BRANDON MIDDLETON MAKES IT! Assist: Lauri LaVine
Score: 55-41

[01:02] Team_031 possession (Score: 55-41)
Miles Stewart attempts a Midrange. Contested by Brandon Middleton (5.3 feet, MAN). Miles Stewart misses. Rebound secured by Brandon Middleton.

[00:44] Team_066 possession (Score: 55-41)
Pascal Carter drives, picks up Kobe Randle. Help arrives from Isaiah Ingram! Pascal Carter attempts a Dunk. Contested by Isaiah Ingram (5.0 feet, ZONE). PASCAL CARTER MAKES IT! Assist: Cole Morant
Score: 55-43

[00:31] Team_031 possession (Score: 55-43)
Isaiah Ingram attempts a 3Pt. Contested by Lauri LaVine (4.7 feet, MAN). ISAIAH INGRAM MAKES IT! Assist: Kevin Morant
Score: 58-43

[00:16] Team_066 possession (Score: 58-43)
Donovan Simmons attempts a Midrange. Contested by Kobe Randle (4.9 feet, ZONE). Donovan Simmons misses. Rebound secured by Isaiah Ingram.

================================================================================
                              2ND QUARTER COMPLETE                              
================================================================================

2ND QUARTER SCORE: Team_031 30, Team_066 24

BOX SCORE:
================================================================================

Team_031
--------------------------------------------------------------------------------
Player                MIN  PTS  REB  AST  TO      FG   FG%      3P   3P%
--------------------------------------------------------------------------------
Kevin Morant           11    8    0    1   0   3/5    60.0     0/0   0.0
Isaiah Ingram          11    6    4    1   0   2/4    50.0     0/0   0.0
Kobe Randle            11    5    2    1   0   2/3    66.7     0/0   0.0
Gary Morant            13    3    0    0   0   1/1   100.0     0/0   0.0
Luka Sabonis           13    2    0    1   0   1/1   100.0     0/0   0.0
Jimmy Poole            11    2    5    3   0   1/1   100.0     0/0   0.0
Miles Stewart          11    2    0    0   0   1/5    20.0     0/0   0.0
Immanuel James         13    0    0    1   0   0/0     0.0     0/0   0.0

TEAM: FG: 11/20 (55.0%), 3PT: 5/9 (55.6%), REB: 11 (3 off, 8 def), AST: 8, TO: 1
TEAM FOULS: 5 [Team_066 in BONUS]


Team_066
--------------------------------------------------------------------------------
Player                MIN  PTS  REB  AST  TO      FG   FG%      3P   3P%
--------------------------------------------------------------------------------
Brandon Middleton      11    8    7    2   0   3/4    75.0     0/0   0.0
Lauri LaVine           11    6    2    2   0   3/5    60.0     0/0   0.0
Yao Brogdon            13    3    1    0   0   1/1   100.0     0/0   0.0
Cole Morant            11    3    0    1   0   2/3    66.7     0/0   0.0
Donovan Simmons        11    2    2    2   0   1/3    33.3     0/0   0.0
Pascal Carter          11    2    0    0   0   1/3    33.3     0/0   0.0

TEAM: FG: 11/19 (57.9%), 3PT: 2/5 (40.0%), REB: 12 (3 off, 9 def), AST: 7, TO: 2
TEAM FOULS: 6 [Team_031 in BONUS]

================================================================================

================================================================================
                       3RD QUARTER - Team_031 vs Team_066                       
================================================================================

[12:00] Team_031 possession (Score: 58-43)
Shai Durant drives, picks up Kyle Wagner. Help arrives from Jimmy Davis! Shai Durant attempts a Layup. Contested by Jimmy Davis (4.0 feet, ZONE). Shai Durant misses. Offensive rebound by Luka Sabonis! Luka Sabonis puts it back in!
Score: 60-43

[11:44] Team_066 possession (Score: 60-43)
Jimmy Davis attempts a 3Pt. Contested by Pau Irving (4.0 feet, ZONE). Jimmy Davis misses. Offensive rebound by Kyle Wagner! Kyle Wagner kicks it out.

[11:29] Team_066 possession (Score: 60-43)
Kyle Wagner makes the Dunk and draws the foul on Luka Sabonis! And-1! Kyle Wagner to the line for 1. [Team fouls: 1] (Luka Sabonis: 1 personal fouls)   FT 1/1: MISS Kyle Wagner makes 0/1 from the line. Offensive rebound by Kyle Wagner! Kyle Wagner kicks it out.
Score: 60-45

[11:14] Team_066 possession (Score: 60-45)
Yao Brogdon attempts a Midrange. BLOCKED BY IMMANUEL JAMES! Ball is loose! Rebound secured by Immanuel James.

[10:57] Team_031 possession (Score: 60-45)
Immanuel James attempts a Midrange. Contested by Yao Brogdon (5.5 feet, MAN). IMMANUEL JAMES MAKES IT!
Score: 62-45

[10:41] Team_066 possession (Score: 62-45)
Kyle Wagner attempts a Midrange. Contested by Pau Irving (3.5 feet, ZONE). Kyle Wagner misses. Rebound secured by Luka Sabonis.

[10:25] Team_031 possession (Score: 62-45)
Shai Durant makes the 3Pt and draws the foul on Jimmy Davis! And-1! Shai Durant to the line for 1. [Team fouls: 1] (Jimmy Davis: 1 personal fouls)   FT 1/1: GOOD Shai Durant makes 1/1 from the line.
Score: 66-45

[10:11] Team_066 possession (Score: 66-45)
FOUL! Shooting foul on Immanuel James. Kyle Wagner to the line for 2 free throws. [Team fouls: 2] (Immanuel James: 1 personal fouls)   FT 1/2: GOOD   FT 2/2: GOOD Kyle Wagner makes 2/2 from the line.
Score: 66-47

[09:55] Team_031 possession (Score: 66-47)
Shai Durant attempts a 3Pt. Contested by Pau Curry (5.6 feet, ZONE). SHAI DURANT MAKES IT! Assist: Pau Irving
Score: 69-47

[09:42] Team_066 possession (Score: 69-47)
FOUL! Holding foul on Shai Durant. [Team fouls: 3] No free throws, side out. (Shai Durant: 1 personal fouls)

[09:30] Team_066 possession (Score: 69-47)
Kyle Wagner attempts a Layup. Contested by Luka Sabonis (3.1 feet, MAN). KYLE WAGNER MAKES IT! Assist: Pau Curry
Score: 69-49

[09:14] Team_031 possession (Score: 69-49)
FOUL! Reach-in foul on Kyle Wagner during the drive. [Team fouls: 2] No free throws, side out. (Kyle Wagner: 1 personal fouls)

[09:00] Team_031 possession (Score: 69-49)
Immanuel James drives and kicks out. Pau Irving attempts a Midrange. Contested by Yao Brogdon (5.1 feet, ZONE). PAU IRVING MAKES IT! Assist: Luka Sabonis
Score: 71-49

[08:50] Team_066 possession (Score: 71-49)
Brandon Reaves drives, picks up Luka Sabonis. Help arrives from Shai Durant! Brandon Reaves attempts a Layup. Contested by Shai Durant (3.7 feet, ZONE). Brandon Reaves misses. Rebound secured by Immanuel James.

[08:37] Team_031 possession (Score: 71-49)
FOUL! Holding foul on Pau Curry. [Team fouls: 3] No free throws, side out. (Pau Curry: 1 personal fouls)

[08:18] Team_031 possession (Score: 71-49)
Pau Irving attempts a Midrange. Contested by Brandon Reaves (5.2 feet, ZONE). Pau Irving misses. Rebound secured by Yao Brogdon.

[08:02] Team_066 possession (Score: 71-49)
Kyle Wagner drives and kicks out. Yao Brogdon attempts a Midrange. Contested by Immanuel James (3.0 feet, MAN). Yao Brogdon misses. Offensive rebound by Kyle Wagner! Kyle Wagner kicks it out.

[07:45] Team_066 possession (Score: 71-49)
Jimmy Davis attempts a Layup. Contested by Shai Durant (4.3 feet, MAN). Jimmy Davis misses. Offensive rebound by Kyle Wagner! Kyle Wagner kicks it out.

[07:28] Team_066 possession (Score: 71-49)
Pau Curry attempts a 3Pt. Contested by Gary Morant (4.0 feet, MAN). Pau Curry misses. Offensive rebound by Yao Brogdon! Yao Brogdon kicks it out.

[07:13] Team_066 possession (Score: 71-49)
Kyle Wagner attempts a Midrange. Contested by Luka Sabonis (3.1 feet, MAN). KYLE WAGNER MAKES IT! Assist: Jimmy Davis
Score: 71-51

[07:01] Team_031 possession (Score: 71-51)
Pau Irving attempts a Midrange. Contested by Brandon Reaves (5.2 feet, ZONE). PAU IRVING MAKES IT! Assist: Luka Sabonis
Score: 73-51

[06:48] Team_066 possession (Score: 73-51)
Kyle Wagner attempts a Midrange. Contested by Gary Morant (3.6 feet, ZONE). KYLE WAGNER MAKES IT!
Score: 73-53

[06:33] Team_031 possession (Score: 73-53)
Pau Irving attempts a 3Pt. Contested by Pau Curry (5.6 feet, ZONE). PAU IRVING MAKES IT! Assist: Luka Sabonis
Score: 76-53

[06:17] Team_066 possession (Score: 76-53)
Yao Brogdon attempts a 3Pt. Contested by Immanuel James (3.5 feet, MAN). Yao Brogdon misses. Rebound secured by Gary Morant.

[06:06] Team_031 possession (Score: 76-53)
Shai Durant attempts a 3Pt. Contested by Jimmy Davis (4.1 feet, MAN). Shai Durant misses. Rebound secured by Brandon Reaves.

[05:55] Team_066 possession (Score: 76-53)
Yao Brogdon attempts a Midrange. Contested by Immanuel James (3.5 feet, MAN). Yao Brogdon misses. Rebound secured by Luka Sabonis.

[05:40] Team_031 possession (Score: 76-53)
Gary Morant attempts a 3Pt. Wide open! Pau Curry is 6.1 feet away. [MAN] GARY MORANT MAKES IT! Assist: Luka Sabonis
Score: 79-53

[05:24] Team_066 possession (Score: 79-53)
Jimmy Davis attempts a Midrange. Contested by Pau Irving (4.0 feet, ZONE). Jimmy Davis misses. Offensive rebound by Kyle Wagner! Kyle Wagner kicks it out.

[05:11] Team_066 possession (Score: 79-53)
FOUL! Shooting foul on Shai Durant. Jimmy Davis to the line for 3 free throws. [Team fouls: 4] (Shai Durant: 2 personal fouls)   FT 1/3: GOOD   FT 2/3: GOOD   FT 3/3: GOOD Jimmy Davis makes 3/3 from the line.
Score: 79-56

[04:55] Team_031 possession (Score: 79-56)
FOUL! Holding foul on Jimmy Davis. [Team fouls: 4] No free throws, side out. (Jimmy Davis: 2 personal fouls)

[04:40] Team_031 possession (Score: 79-56)
Gary Morant attempts a 3Pt. Wide open! Pau Curry is 6.1 feet away. [MAN] GARY MORANT MAKES IT! Assist: Pau Irving
Score: 82-56

[04:29] Team_066 possession (Score: 82-56)
Kyle Wagner makes the Layup and draws the foul on Immanuel James! And-1! Kyle Wagner to the line for 1. [BONUS: 5 team fouls] (Immanuel James: 2 personal fouls)   FT 1/1: GOOD Kyle Wagner makes 1/1 from the line.
Score: 82-59

[04:13] Team_031 possession (Score: 82-59)
Gary Morant attempts a Layup. BLOCKED BY KYLE WAGNER! Ball deflects out of bounds off Gary Morant.

[04:01] Team_066 possession (Score: 82-59)
Yao Brogdon attempts a Midrange. Contested by Immanuel James (3.7 feet, MAN). Yao Brogdon misses. Rebound secured by Immanuel James.

[03:45] Team_031 possession (Score: 82-59)
Shai Durant attempts a Midrange. Contested by Brandon Reaves (5.3 feet, ZONE). Shai Durant misses. Rebound secured by Brandon Reaves.

[03:32] Team_066 possession (Score: 82-59)
Kyle Wagner attempts a Midrange. Contested by Luka Sabonis (3.3 feet, MAN). Kyle Wagner misses. FOUL! Loose ball foul on Luka Sabonis during the rebound battle. [IN THE BONUS! 6 team fouls] Yao Brogdon to the line for 2 free throws. (Luka Sabonis: 2 personal fouls)   FT 1/2: GOOD   FT 2/2: MISS Yao Brogdon makes 1/2 from the line. Rebound secured by Immanuel James.
Score: 82-60

[03:18] Team_031 possession (Score: 82-60)
Gary Morant attempts a Midrange. Contested by Brandon Reaves (5.8 feet, ZONE). GARY MORANT MAKES IT!
Score: 84-60

[03:07] Team_066 possession (Score: 84-60)
Kyle Wagner makes the Dunk and draws the foul on Shai Durant! And-1! Kyle Wagner to the line for 1. [BONUS: 7 team fouls] (Shai Durant: 3 personal fouls)   FT 1/1: GOOD Kyle Wagner makes 1/1 from the line.
Score: 84-63

[02:54] Team_031 possession (Score: 84-63)
Immanuel James attempts a 3Pt. Wide open! Pau Curry is 6.1 feet away. [ZONE] IMMANUEL JAMES MAKES IT! Assist: Shai Durant
Score: 87-63

[02:38] Team_066 possession (Score: 87-63)
Yao Brogdon attempts a 3Pt. Contested by Immanuel James (3.8 feet, MAN). Yao Brogdon misses. Rebound secured by Luka Sabonis.

[02:24] Team_031 possession (Score: 87-63)
Luka Sabonis makes the Layup and draws the foul on Kyle Wagner! And-1! Luka Sabonis to the line for 1. [BONUS: 5 team fouls] (Kyle Wagner: 2 personal fouls)   FT 1/1: GOOD Luka Sabonis makes 1/1 from the line.
Score: 90-63

[02:10] Team_066 possession (Score: 90-63)
Brandon Reaves attempts a 3Pt. Contested by Pau Irving (4.4 feet, ZONE). Brandon Reaves misses. Rebound secured by Luka Sabonis.

[01:52] Team_031 possession (Score: 90-63)
FOUL! Holding foul on Yao Brogdon. [IN THE BONUS! 6 team fouls] Immanuel James to the line for 2 free throws. (Yao Brogdon: 1 personal fouls)   FT 1/2: GOOD   FT 2/2: GOOD Immanuel James makes 2/2 from the line.
Score: 92-63

[01:41] Team_066 possession (Score: 92-63)
Brandon Reaves attempts a Midrange. Contested by Gary Morant (4.6 feet, ZONE). Brandon Reaves misses. Rebound secured by Immanuel James.

[01:28] Team_031 possession (Score: 92-63)
FOUL! Holding foul on Pau Curry. [IN THE BONUS! 7 team fouls] Gary Morant to the line for 2 free throws. (Pau Curry: 2 personal fouls)   FT 1/2: GOOD   FT 2/2: GOOD Gary Morant makes 2/2 from the line.
Score: 94-63

[01:17] Team_066 possession (Score: 94-63)
FOUL! Reach-in foul on Luka Sabonis during the drive. [IN THE BONUS! 8 team fouls] Kyle Wagner to the line for 2 free throws. (Luka Sabonis: 3 personal fouls)   FT 1/2: GOOD   FT 2/2: GOOD Kyle Wagner makes 2/2 from the line.
Score: 94-65

[01:03] Team_031 possession (Score: 94-65)
Pau Irving drives, Brandon Reaves stays with him. Pau Irving attempts a Dunk. Contested by Brandon Reaves (5.5 feet, MAN). PAU IRVING MAKES IT! Assist: Immanuel James
Score: 96-65

[00:47] Team_066 possession (Score: 96-65)
Yao Brogdon drives and kicks out. Jimmy Davis attempts a Midrange. Contested by Shai Durant (4.4 feet, MAN). JIMMY DAVIS MAKES IT!
Score: 96-67

[00:34] Team_031 possession (Score: 96-67)
FOUL! Holding foul on Brandon Reaves. [IN THE BONUS! 8 team fouls] Pau Irving to the line for 2 free throws. (Brandon Reaves: 1 personal fouls)   FT 1/2: GOOD   FT 2/2: GOOD Pau Irving makes 2/2 from the line.
Score: 98-67

[00:18] Team_066 possession (Score: 98-67)
Pau Curry drives and kicks out. Jimmy Davis attempts a 3Pt. Contested by Shai Durant (4.4 feet, MAN). Jimmy Davis misses. Rebound secured by Immanuel James.

[00:02] Team_031 possession (Score: 98-67)
Gary Morant drives, picks up Pau Curry. Help arrives from Jimmy Davis! Gary Morant attempts a Layup. Wide open! Jimmy Davis is 6.5 feet away. [MAN] Gary Morant misses. Offensive rebound by Luka Sabonis! Luka Sabonis's putback is no good. Rebound secured by Yao Brogdon.

================================================================================
                              3RD QUARTER COMPLETE                              
================================================================================

3RD QUARTER SCORE: Team_031 40, Team_066 24

BOX SCORE:
================================================================================

Team_031
--------------------------------------------------------------------------------
Player                MIN  PTS  REB  AST  TO      FG   FG%      3P   3P%
--------------------------------------------------------------------------------
Pau Irving             25   11    0    2   0   5/6    83.3     0/0   0.0
Gary Morant            25   10    1    0   0   4/6    66.7     0/0   0.0
Immanuel James         25    7    6    1   0   3/3   100.0     0/0   0.0
Shai Durant            25    7    0    1   0   2/4    50.0     0/0   0.0
Luka Sabonis           25    5    5    4   0   2/2   100.0     0/0   0.0
Yao Brogdon            25    0    3    0   0   0/5     0.0     0/0   0.0

TEAM: FG: 16/21 (76.2%), 3PT: 6/7 (85.7%), REB: 12 (2 off, 10 def), AST: 8, TO: 0
TEAM FOULS: 8 [Team_066 in BONUS]


Team_066
--------------------------------------------------------------------------------
Player                MIN  PTS  REB  AST  TO      FG   FG%      3P   3P%
--------------------------------------------------------------------------------
Kyle Wagner            25   16    5    0   0   7/9    77.8     0/0   0.0
Jimmy Davis            25    5    0    1   0   2/2   100.0     0/0   0.0
Pau Curry              25    0    0    1   0   0/1     0.0     0/0   0.0
Brandon Reaves         25    0    2    0   0   0/3     0.0     0/0   0.0

TEAM: FG: 9/20 (45.0%), 3PT: 1/4 (25.0%), REB: 10 (7 off, 3 def), AST: 2, TO: 0
TEAM FOULS: 8 [Team_031 in BONUS]

================================================================================

================================================================================
                       4TH QUARTER - Team_031 vs Team_066                       
================================================================================

[12:00] Team_031 possession (Score: 98-67)
Shai Durant attempts a Midrange. Contested by Pau Curry (5.9 feet, ZONE). Shai Durant misses. Rebound secured by Kyle Wagner.

[11:44] Team_066 possession (Score: 98-67)
Pau Curry attempts a 3Pt. Contested by Gary Morant (4.4 feet, MAN). Pau Curry misses. Offensive rebound by Kyle Wagner! Kyle Wagner kicks it out.

[11:26] Team_066 possession (Score: 98-67)
Kyle Wagner attempts a Midrange. Contested by Luka Sabonis (3.6 feet, MAN). Kyle Wagner misses. Rebound secured by Gary Morant.

[11:10] Team_031 possession (Score: 98-67)
Pau Irving attempts a Layup. Contested by Yao Brogdon (5.6 feet, ZONE). PAU IRVING MAKES IT! Assist: Shai Durant
Score: 100-67

[10:58] Team_066 possession (Score: 100-67)
FOUL! Shooting foul on Immanuel James. Yao Brogdon to the line for 2 free throws. [Team fouls: 1] (Immanuel James: 1 personal fouls)   FT 1/2: GOOD   FT 2/2: MISS Yao Brogdon makes 1/2 from the line. Offensive rebound by Kyle Wagner! Kyle Wagner kicks it out.
Score: 100-68

[10:43] Team_066 possession (Score: 100-68)
Yao Brogdon loses the ball! Stripped by Immanuel James! TURNOVER! (live ball)

[10:25] Team_031 possession (Score: 100-68)
FOUL! Reach-in foul on Jimmy Davis during the drive. [Team fouls: 1] No free throws, side out. (Jimmy Davis: 1 personal fouls)

[10:12] Team_031 possession (Score: 100-68)
Gary Morant attempts a 3Pt. Wide open! Pau Curry is 6.5 feet away. [MAN] GARY MORANT MAKES IT! Assist: Shai Durant
Score: 103-68

[10:01] Team_066 possession (Score: 103-68)
Brandon Reaves attempts a Layup. Contested by Immanuel James (4.3 feet, ZONE). BRANDON REAVES MAKES IT! Assist: Kyle Wagner
Score: 103-70

[09:48] Team_031 possession (Score: 103-70)
Luka Sabonis drives to the basket... Luka Sabonis throws a bad pass out of bounds! TURNOVER! (dead ball)

[09:48] Substitution (Team_031): Shai Durant OUT → Kevin Morant IN (stamina_rule2)

[09:48] Substitution (Team_031): Gary Morant OUT → Isaiah Ingram IN (stamina_rule2)

[09:48] Substitution (Team_031): Pau Irving OUT → Miles Stewart IN (stamina_rule2)

[09:48] Substitution (Team_031): Immanuel James OUT → Kobe Randle IN (stamina_rule2)

[09:48] Substitution (Team_031): Luka Sabonis OUT → Jimmy Poole IN (stamina_rule2)

[09:48] Substitution (Team_066): Jimmy Davis OUT → Pascal Carter IN (stamina_rule2)

[09:48] Substitution (Team_066): Pau Curry OUT → Lauri LaVine IN (stamina_rule2)

[09:48] Substitution (Team_066): Brandon Reaves OUT → Brandon Middleton IN (stamina_rule2)

[09:48] Substitution (Team_066): Yao Brogdon OUT → Cole Morant IN (stamina_rule2)

[09:48] Substitution (Team_066): Kyle Wagner OUT → Donovan Simmons IN (stamina_rule2)

[09:35] Team_066 possession (Score: 103-70)
Pascal Carter attempts a 3Pt. Contested by Isaiah Ingram (4.4 feet, ZONE). PASCAL CARTER MAKES IT! Assist: Lauri LaVine
Score: 103-73

[09:18] Team_031 possession (Score: 103-73)
Miles Stewart drives, Brandon Middleton stays with him. Miles Stewart attempts a Dunk. Contested by Brandon Middleton (5.1 feet, MAN). MILES STEWART MAKES IT!
Score: 105-73

[09:03] Team_066 possession (Score: 105-73)
Cole Morant drives, picks up Kobe Randle. Help arrives from Isaiah Ingram! Cole Morant attempts a Dunk. Contested by Isaiah Ingram (4.9 feet, MAN). COLE MORANT MAKES IT!
Score: 105-75

[08:46] Team_031 possession (Score: 105-75)
Isaiah Ingram attempts a Layup. Contested by Lauri LaVine (4.4 feet, MAN). ISAIAH INGRAM MAKES IT! Assist: Kobe Randle
Score: 107-75

[08:27] Team_066 possession (Score: 107-75)
Brandon Middleton attempts a 3Pt. Contested by Miles Stewart (5.1 feet, ZONE). Brandon Middleton misses. Rebound secured by Isaiah Ingram.

[08:10] Team_031 possession (Score: 107-75)
Miles Stewart attempts a 3Pt. Contested by Brandon Middleton (5.1 feet, MAN). Miles Stewart misses. Rebound secured by Brandon Middleton.

[07:58] Team_066 possession (Score: 107-75)
FOUL! Reach-in foul on Kobe Randle during the drive. [Team fouls: 2] No free throws, side out. (Kobe Randle: 1 personal fouls)

[07:45] Team_066 possession (Score: 107-75)
FOUL! Reach-in foul on Isaiah Ingram during the drive. [Team fouls: 3] No free throws, side out. (Isaiah Ingram: 1 personal fouls)

[07:33] Team_066 possession (Score: 107-75)
Cole Morant attempts a 3Pt. Contested by Miles Stewart (5.9 feet, ZONE). COLE MORANT MAKES IT! Assist: Pascal Carter
Score: 107-78

[07:16] Team_031 possession (Score: 107-78)
Kobe Randle attempts a Midrange. Wide open! Cole Morant is 6.2 feet away. [MAN] KOBE RANDLE MAKES IT!
Score: 109-78

[07:02] Team_066 possession (Score: 109-78)
FOUL! Shooting foul on Isaiah Ingram. Lauri LaVine to the line for 2 free throws. [Team fouls: 4] (Isaiah Ingram: 2 personal fouls)   FT 1/2: GOOD   FT 2/2: GOOD Lauri LaVine makes 2/2 from the line.
Score: 109-80

[06:49] Team_031 possession (Score: 109-80)
FOUL! Shooting foul on Pascal Carter. Kevin Morant to the line for 2 free throws. [Team fouls: 2] (Pascal Carter: 1 personal fouls)   FT 1/2: GOOD   FT 2/2: MISS Kevin Morant makes 1/2 from the line. Rebound secured by Donovan Simmons.
Score: 110-80

[06:40] Team_066 possession (Score: 110-80)
Donovan Simmons drives, Kobe Randle stays with him. Donovan Simmons attempts a Layup. Contested by Kobe Randle (4.4 feet, ZONE). Donovan Simmons misses. Offensive rebound by Lauri LaVine! Lauri LaVine kicks it out.

[06:23] Team_066 possession (Score: 110-80)
Cole Morant loses the ball! Stripped by Kobe Randle! TURNOVER! (live ball)

[06:09] Team_031 possession (Score: 110-80)
Kevin Morant drives, Donovan Simmons stays with him. Kevin Morant attempts a Layup. Contested by Donovan Simmons (5.0 feet, ZONE). Kevin Morant misses. Rebound secured by Donovan Simmons.

[05:54] Team_066 possession (Score: 110-80)
Donovan Simmons attempts a Layup. Contested by Jimmy Poole (5.7 feet, MAN). Donovan Simmons misses. Offensive rebound by Lauri LaVine! Lauri LaVine kicks it out.

[05:37] Team_066 possession (Score: 110-80)
Pascal Carter attempts a 3Pt. Contested by Kevin Morant (5.0 feet, MAN). PASCAL CARTER MAKES IT! Assist: Donovan Simmons
Score: 110-83

[05:21] Team_031 possession (Score: 110-83)
Isaiah Ingram attempts a 3Pt. Contested by Lauri LaVine (4.4 feet, MAN). Isaiah Ingram misses. Offensive rebound by Jimmy Poole! Jimmy Poole kicks it out.

[05:08] Team_031 possession (Score: 110-83)
Kevin Morant drives, picks up Donovan Simmons. Help arrives from Lauri LaVine! Kevin Morant attempts a Layup. Contested by Lauri LaVine (5.0 feet, ZONE). Kevin Morant misses. Rebound secured by Brandon Middleton.

[04:54] Team_066 possession (Score: 110-83)
Donovan Simmons attempts a Midrange. Contested by Isaiah Ingram (4.3 feet, ZONE). Donovan Simmons misses. Offensive rebound by Lauri LaVine! Lauri LaVine kicks it out.

[04:41] Team_066 possession (Score: 110-83)
Donovan Simmons attempts a 3Pt. Contested by Jimmy Poole (5.7 feet, MAN). DONOVAN SIMMONS MAKES IT! Assist: Brandon Middleton
Score: 110-86

[04:26] Team_031 possession (Score: 110-86)
Kevin Morant drives, picks up Pascal Carter. Help arrives from Lauri LaVine! Kevin Morant attempts a Layup. Wide open! Lauri LaVine is 6.8 feet away. [MAN] KEVIN MORANT MAKES IT! Assist: Miles Stewart
Score: 112-86

[04:14] Team_066 possession (Score: 112-86)
Donovan Simmons drives, picks up Jimmy Poole. Help arrives from Isaiah Ingram! Donovan Simmons attempts a Dunk. Contested by Isaiah Ingram (5.7 feet, MAN). DONOVAN SIMMONS MAKES IT!
Score: 112-88

[04:00] Team_031 possession (Score: 112-88)
Jimmy Poole drives and kicks out. Jimmy Poole attempts a Midrange. Contested by Cole Morant (5.5 feet, ZONE). Jimmy Poole misses. Rebound secured by Lauri LaVine.

[03:46] Team_066 possession (Score: 112-88)
Donovan Simmons drives, Jimmy Poole stays with him. Donovan Simmons attempts a Dunk. Contested by Jimmy Poole (5.7 feet, MAN). Donovan Simmons misses. Rebound secured by Jimmy Poole.

[03:29] Team_031 possession (Score: 112-88)
Miles Stewart drives and kicks out. Kevin Morant attempts a 3Pt. Wide open! Pascal Carter is 6.7 feet away. [MAN] KEVIN MORANT MAKES IT! Assist: Jimmy Poole
Score: 115-88

[03:14] Team_066 possession (Score: 115-88)
Pascal Carter attempts a 3Pt. Contested by Miles Stewart (5.5 feet, ZONE). Pascal Carter misses. Rebound secured by Isaiah Ingram.

[02:58] Team_031 possession (Score: 115-88)
Kevin Morant attempts a 3Pt. Contested by Lauri LaVine (4.0 feet, ZONE). KEVIN MORANT MAKES IT! Assist: Isaiah Ingram
Score: 118-88

[02:43] Team_066 possession (Score: 118-88)
Pascal Carter attempts a 3Pt. Contested by Miles Stewart (5.5 feet, ZONE). Pascal Carter misses. Rebound secured by Kobe Randle.

[02:28] Team_031 possession (Score: 118-88)
FOUL! Shooting foul on Lauri LaVine. Kobe Randle to the line for 3 free throws. [Team fouls: 3] (Lauri LaVine: 1 personal fouls)   FT 1/3: GOOD   FT 2/3: GOOD   FT 3/3: GOOD Kobe Randle makes 3/3 from the line.
Score: 121-88

[02:13] Team_066 possession (Score: 121-88)
Donovan Simmons makes the Dunk and draws the foul on Kobe Randle! And-1! Donovan Simmons to the line for 1. [BONUS: 5 team fouls] (Kobe Randle: 2 personal fouls)   FT 1/1: GOOD Donovan Simmons makes 1/1 from the line.
Score: 121-91

[02:02] Team_031 possession (Score: 121-91)
Isaiah Ingram attempts a Midrange. Contested by Lauri LaVine (4.4 feet, ZONE). ISAIAH INGRAM MAKES IT! Assist: Jimmy Poole
Score: 123-91

[01:50] Team_066 possession (Score: 123-91)
Lauri LaVine attempts a 3Pt. Contested by Isaiah Ingram (4.6 feet, MAN). LAURI LAVINE MAKES IT! Assist: Brandon Middleton
Score: 123-94

[01:36] Team_031 possession (Score: 123-94)
Isaiah Ingram attempts a Layup. Contested by Lauri LaVine (4.4 feet, MAN). Isaiah Ingram misses. Rebound secured by Lauri LaVine.

[01:21] Team_066 possession (Score: 123-94)
Lauri LaVine attempts a Midrange. Contested by Isaiah Ingram (4.6 feet, MAN). LAURI LAVINE MAKES IT!
Score: 123-96

[01:10] Team_031 possession (Score: 123-96)
Miles Stewart drives, picks up Brandon Middleton. Help arrives from Lauri LaVine! Miles Stewart attempts a Dunk. Contested by Lauri LaVine (5.2 feet, MAN). MILES STEWART MAKES IT!
Score: 125-96

[00:57] Team_066 possession (Score: 125-96)
Lauri LaVine attempts a Midrange. Contested by Isaiah Ingram (4.7 feet, MAN). LAURI LAVINE MAKES IT!
Score: 125-98

[00:42] Team_031 possession (Score: 125-98)
Isaiah Ingram attempts a 3Pt. Wide open! Cole Morant is 6.1 feet away. [ZONE] Isaiah Ingram misses. Rebound secured by Lauri LaVine.

[00:26] Team_066 possession (Score: 125-98)
Cole Morant attempts a Midrange. Contested by Kobe Randle (5.2 feet, ZONE). Cole Morant misses. Rebound secured by Kobe Randle.

[00:14] Team_031 possession (Score: 125-98)
Kobe Randle attempts a Layup. Contested by Donovan Simmons (5.8 feet, ZONE). KOBE RANDLE MAKES IT! Assist: Miles Stewart
Score: 127-98

================================================================================
                              4TH QUARTER COMPLETE                              
================================================================================

4TH QUARTER SCORE: Team_031 29, Team_066 31

BOX SCORE:
================================================================================

Team_031
--------------------------------------------------------------------------------
Player                MIN  PTS  REB  AST  TO      FG   FG%      3P   3P%
--------------------------------------------------------------------------------
Kevin Morant           21    8    0    0   0   3/6    50.0     0/0   0.0
Kobe Randle            21    7    2    1   0   3/3   100.0     0/0   0.0
Miles Stewart          21    4    0    2   0   2/3    66.7     0/0   0.0
Isaiah Ingram          21    4    2    1   0   2/4    50.0     0/0   0.0
Gary Morant            27    3    1    0   0   1/1   100.0     0/0   0.0
Pau Irving             27    2    0    0   0   1/1   100.0     0/0   0.0
Shai Durant            27    0    0    2   0   0/1     0.0     0/0   0.0
Jimmy Poole            21    0    2    2   0   0/1     0.0     0/0   0.0

TEAM: FG: 12/20 (60.0%), 3PT: 3/5 (60.0%), REB: 7 (1 off, 6 def), AST: 8, TO: 1
TEAM FOULS: 5 [Team_066 in BONUS]


Team_066
--------------------------------------------------------------------------------
Player                MIN  PTS  REB  AST  TO      FG   FG%      3P   3P%
--------------------------------------------------------------------------------
Lauri LaVine           21    9    6    1   0   4/4   100.0     0/0   0.0
Donovan Simmons        21    8    2    1   0   3/4    75.0     0/0   0.0
Pascal Carter          21    6    0    1   0   2/4    50.0     0/0   0.0
Cole Morant            21    5    0    0   0   2/3    66.7     0/0   0.0
Brandon Reaves         27    2    0    0   0   1/1   100.0     0/0   0.0
Kyle Wagner            27    0    3    1   0   0/1     0.0     0/0   0.0
Brandon Middleton      21    0    2    2   0   0/1     0.0     0/0   0.0

TEAM: FG: 12/18 (66.7%), 3PT: 5/8 (62.5%), REB: 13 (5 off, 8 def), AST: 6, TO: 2
TEAM FOULS: 3

================================================================================

================================================================================
                               FULL GAME COMPLETE                               
================================================================================

FINAL SCORE: Team_031 127, Team_066 98

SCORING BY QUARTER:
--------------------------------------------------------------------------------
Team                     Q1     Q2     Q3     Q4    FINAL
--------------------------------------------------------------------------------
Team_031                 28     30     40     29      127
Team_066                 19     24     24     31       98
--------------------------------------------------------------------------------

FULL GAME BOX SCORE:
================================================================================

Team_031
--------------------------------------------------------------------------------
Player                MIN  PTS  REB  AST  TO      FG   FG%      3P   3P%      FT STL BLK
--------------------------------------------------------------------------------
Shai Durant            27   20    0    4   0   8/12   66.7   3/5    60.0   5/6     0   0
Gary Morant            27   19    6    0   0   6/11   54.5   5/7    71.4   2/2     0   0
Pau Irving             27   17    0    2   1   6/8    75.0   2/2   100.0   4/5     0   0
Immanuel James         27    9    9    3   1   4/5    80.0   1/2    50.0   4/4     1   1
Luka Sabonis           27   11   12    5   1   4/6    66.7   0/0     0.0   1/2     0   0
Kevin Morant           21   16    0    1   0   5/10   50.0   3/4    75.0   1/4     0   0
Isaiah Ingram          21   10    6    2   1   4/8    50.0   1/3    33.3   1/1     0   0
Miles Stewart          21    6    0    2   0   4/10   40.0   0/4     0.0   2/2     0   0
Kobe Randle            21   12    4    2   0   5/6    83.3   2/2   100.0   3/3     1   0
Jimmy Poole            21    2    7    5   0   1/2    50.0   0/0     0.0   0/1     0   0

TEAM: FG: 50/81 (61.7%), 3PT: 17/29 (58.6%), REB: 45 (8 off, 37 def), AST: 26, TO: 4


Team_066
--------------------------------------------------------------------------------
Player                MIN  PTS  REB  AST  TO      FG   FG%      3P   3P%      FT STL BLK
--------------------------------------------------------------------------------
Jimmy Davis            27    8    0    1   0   2/5    40.0   2/4    50.0   3/3     0   0
Pau Curry              27    7    0    1   1   3/5    60.0   0/0     0.0   1/1     0   0
Brandon Reaves         27    8    3    1   0   3/11   27.3   2/5    40.0   0/0     0   1
Yao Brogdon            27    3    7    1   1   2/10   20.0   0/4     0.0   3/5     0   1
Kyle Wagner            27   16   17    2   1   7/11   63.6   0/0     0.0   6/7     0   1
Pascal Carter          21   11    0    1   0   4/8    50.0   3/6    50.0   0/0     0   0
Lauri LaVine           21   15    8    3   0   7/9    77.8   1/1   100.0   2/2     0   0
Brandon Middleton      21    8   10    5   1   3/5    60.0   2/4    50.0   0/0     0   0
Cole Morant            21    8    0    1   1   4/6    66.7   1/2    50.0   1/2     0   0
Donovan Simmons        21   10    4    3   0   4/7    57.1   1/1   100.0   3/3     0   0

TEAM: FG: 39/77 (50.6%), 3PT: 12/27 (44.4%), REB: 48 (20 off, 28 def), AST: 19, TO: 5

================================================================================
