================================================================================
                        FULL GAME - Team_050 vs Team_044                        
================================================================================

================================================================================
                       1ST QUARTER - Team_050 vs Team_044                       
================================================================================

[12:00] Team_050 possession (Score: 0-0)
Collin Bane drives, picks up Ayo McCollum. Help arrives from Zach McGrady! Collin Bane attempts a Layup. Contested by Zach McGrady (4.8 feet, ZONE). COLLIN BANE MAKES IT! Assist: Donovan Trent
Score: 2-0

[11:46] Team_044 possession (Score: 2-0)
Isaiah Murray attempts a 3Pt. Contested by Joel Banchero (4.7 feet, MAN). ISAIAH MURRAY MAKES IT!
Score: 2-3

[11:32] Team_050 possession (Score: 2-3)
Donovan Trent attempts a Layup. BLOCKED BY AYO MCCOLLUM! Ball is loose! Rebound secured by Ayo McCollum.

[11:13] Team_044 possession (Score: 2-3)
Karl Fox attempts a 3Pt. Contested by Giannis LaVine (4.0 feet, ZONE). Karl Fox misses. Rebound secured by LeBron Bridges.

[11:00] Team_050 possession (Score: 2-3)
Donovan Trent attempts a Layup. Contested by Ayo McCollum (4.4 feet, ZONE). DONOVAN TRENT MAKES IT! Assist: Collin Bane
Score: 4-3

[10:47] Team_044 possession (Score: 4-3)
Isaiah Murray attempts a 3Pt. Contested by Collin Bane (4.5 feet, ZONE). ISAIAH MURRAY MAKES IT! Assist: Ayo McCollum
Score: 4-6

[10:31] Team_050 possession (Score: 4-6)
Giannis LaVine attempts a Midrange. Contested by Isaiah Murray (5.1 feet, ZONE). Giannis LaVine misses. Offensive rebound by Collin Bane! Collin Bane kicks it out.

[10:20] Team_050 possession (Score: 4-6)
Collin Bane makes the Layup and draws the foul on Ayo McCollum! And-1! Collin Bane to the line for 1. [Team fouls: 1] (Ayo McCollum: 1 personal fouls)   FT 1/1: GOOD Collin Bane makes 1/1 from the line.
Score: 7-6

[10:02] Team_044 possession (Score: 7-6)
Isaiah Murray loses control! Ball rolls out of bounds! TURNOVER! (dead ball)

[09:49] Team_050 possession (Score: 7-6)
Giannis LaVine makes the Midrange and draws the foul on Zach McGrady! And-1! Giannis LaVine to the line for 1. [Team fouls: 2] (Zach McGrady: 1 personal fouls)   FT 1/1: GOOD Giannis LaVine makes 1/1 from the line.
Score: 10-6

[09:35] Team_044 possession (Score: 10-6)
Isaiah Murray attempts a Layup. Contested by Joel Banchero (4.7 feet, MAN). ISAIAH MURRAY MAKES IT!
Score: 10-8

[09:25] Team_050 possession (Score: 10-8)
Giannis LaVine attempts a 3Pt. Contested by Zach McGrady (4.6 feet, MAN). Giannis LaVine misses. Rebound secured by Karl Fox.

[09:10] Team_044 possession (Score: 10-8)
Victor Westbrook attempts a Midrange. Contested by Collin Bane (4.2 feet, MAN). Victor Westbrook misses. Rebound secured by Collin Bane.

[08:54] Team_050 possession (Score: 10-8)
LeBron Bridges drives, picks up Karl Fox. Help arrives from Zach McGrady! LeBron Bridges attempts a Dunk. Contested by Zach McGrady (4.1 feet, MAN). LeBron Bridges misses. Offensive rebound by LeBron Bridges! LeBron Bridges kicks it out.

[08:43] Team_050 possession (Score: 10-8)
Donovan Trent attempts a Layup. Contested by Ayo McCollum (4.4 feet, ZONE). Donovan Trent misses. Offensive rebound by Collin Bane! Collin Bane kicks it out.

[08:31] Team_050 possession (Score: 10-8)
FOUL! Reach-in foul on Zach McGrady during the drive. [Team fouls: 3] No free throws, side out. (Zach McGrady: 2 personal fouls)

[08:19] Team_050 possession (Score: 10-8)
Joel Banchero attempts a 3Pt. Contested by Isaiah Murray (4.5 feet, ZONE). JOEL BANCHERO MAKES IT! Assist: Collin Bane
Score: 13-8

[08:06] Team_044 possession (Score: 13-8)
Ayo McCollum attempts a 3Pt. Contested by Giannis LaVine (3.8 feet, ZONE). Ayo McCollum misses. Offensive rebound by Victor Westbrook! Victor Westbrook kicks it out.

[07:50] Team_044 possession (Score: 13-8)
Isaiah Murray attempts a 3Pt. Contested by Giannis LaVine (4.2 feet, ZONE). Isaiah Murray misses. Rebound secured by LeBron Bridges.

[07:33] Team_050 possession (Score: 13-8)
Collin Bane attempts a 3Pt. Contested by Victor Westbrook (5.3 feet, MAN). Collin Bane misses. Rebound secured by Ayo McCollum.

[07:17] Team_044 possession (Score: 13-8)
Victor Westbrook attempts a Midrange. Contested by Collin Bane (4.2 feet, MAN). Victor Westbrook misses. Rebound secured by LeBron Bridges.

[07:00] Team_050 possession (Score: 13-8)
LeBron Bridges attempts a 3Pt. Contested by Karl Fox (4.1 feet, MAN). LeBron Bridges misses. Rebound secured by Victor Westbrook.

[06:47] Team_044 possession (Score: 13-8)
Victor Westbrook drives to the basket... Victor Westbrook loses control! Ball rolls out of bounds! TURNOVER! (dead ball)

[06:36] Team_050 possession (Score: 13-8)
FOUL! Shooting foul on Victor Westbrook. Donovan Trent to the line for 2 free throws. [Team fouls: 4] (Victor Westbrook: 1 personal fouls)   FT 1/2: GOOD   FT 2/2: GOOD Donovan Trent makes 2/2 from the line.
Score: 15-8

[06:18] Team_044 possession (Score: 15-8)
Karl Fox throws a bad pass out of bounds! TURNOVER! (dead ball)

[05:59] Team_050 possession (Score: 15-8)
LeBron Bridges attempts a Midrange. Contested by Isaiah Murray (4.8 feet, ZONE). LeBron Bridges misses. Rebound secured by Ayo McCollum.

[05:45] Team_044 possession (Score: 15-8)
Victor Westbrook attempts a 3Pt. Contested by Giannis LaVine (3.9 feet, ZONE). Victor Westbrook misses. Rebound secured by LeBron Bridges.

[05:30] Team_050 possession (Score: 15-8)
FOUL! Shooting foul on Ayo McCollum. Donovan Trent to the line for 2 free throws. [BONUS: 5 team fouls] (Ayo McCollum: 2 personal fouls)   FT 1/2: GOOD   FT 2/2: MISS Donovan Trent makes 1/2 from the line. Rebound secured by Karl Fox.
Score: 16-8

[05:18] Team_044 possession (Score: 16-8)
Isaiah Murray attempts a Midrange. Contested by Joel Banchero (4.7 feet, ZONE). Isaiah Murray misses. Rebound secured by Collin Bane.

[05:01] Team_050 possession (Score: 16-8)
Collin Bane attempts a Midrange. Contested by Victor Westbrook (5.4 feet, MAN). COLLIN BANE MAKES IT!
Score: 18-8

[04:45] Team_044 possession (Score: 18-8)
Karl Fox attempts a Midrange. Contested by Collin Bane (4.2 feet, ZONE). KARL FOX MAKES IT!
Score: 18-10

[04:29] Team_050 possession (Score: 18-10)
Joel Banchero attempts a 3Pt. Contested by Isaiah Murray (4.5 feet, MAN). JOEL BANCHERO MAKES IT!
Score: 21-10

[04:17] Team_044 possession (Score: 21-10)
Isaiah Murray attempts a Midrange. Contested by Joel Banchero (4.7 feet, MAN). Isaiah Murray misses. Rebound secured by Collin Bane.

[04:03] Team_050 possession (Score: 21-10)
Joel Banchero attempts a Layup. Contested by Ayo McCollum (4.6 feet, ZONE). Joel Banchero misses. Offensive rebound by LeBron Bridges! LeBron Bridges kicks it out.

[03:51] Team_050 possession (Score: 21-10)
Joel Banchero attempts a Layup. Contested by Ayo McCollum (4.6 feet, ZONE). Joel Banchero misses. Rebound secured by Karl Fox.

[03:37] Team_044 possession (Score: 21-10)
Zach McGrady attempts a 3Pt. Contested by Giannis LaVine (4.3 feet, MAN). ZACH MCGRADY MAKES IT! Assist: Karl Fox
Score: 21-13

[03:24] Team_050 possession (Score: 21-13)
Collin Bane drives and kicks out. Joel Banchero makes the Midrange and draws the foul on Victor Westbrook! And-1! Joel Banchero to the line for 1. [BONUS: 6 team fouls] (Victor Westbrook: 2 personal fouls)   FT 1/1: GOOD Joel Banchero makes 1/1 from the line.
Score: 24-13

[03:08] Team_044 possession (Score: 24-13)
Karl Fox attempts a 3Pt. Contested by Joel Banchero (4.5 feet, ZONE). Karl Fox misses. Rebound secured by Collin Bane.

[02:55] Team_050 possession (Score: 24-13)
Giannis LaVine drives to the basket... FOUL! Offensive foul on Giannis LaVine! Ayo McCollum drew the charge! [Team fouls: 1] (Giannis LaVine: 1 personal fouls) TURNOVER! (dead ball)

[02:39] Team_044 possession (Score: 24-13)
Zach McGrady attempts a Midrange. Contested by Giannis LaVine (4.3 feet, MAN). ZACH MCGRADY MAKES IT!
Score: 24-15

[02:25] Team_050 possession (Score: 24-15)
FOUL! Shooting foul on Zach McGrady. LeBron Bridges to the line for 2 free throws. [BONUS: 7 team fouls] (Zach McGrady: 3 personal fouls)   FT 1/2: GOOD   FT 2/2: GOOD LeBron Bridges makes 2/2 from the line.
Score: 26-15

[02:11] Team_044 possession (Score: 26-15)
Karl Fox attempts a 3Pt. Contested by Giannis LaVine (4.3 feet, ZONE). Karl Fox misses. Rebound secured by Collin Bane.

[01:53] Team_050 possession (Score: 26-15)
Giannis LaVine attempts a 3Pt. Contested by Isaiah Murray (5.3 feet, ZONE). Giannis LaVine misses. FOUL! Loose ball foul on Ayo McCollum during the rebound battle. [IN THE BONUS! 8 team fouls] LeBron Bridges to the line for 2 free throws. (Ayo McCollum: 3 personal fouls)   FT 1/2: GOOD   FT 2/2: GOOD LeBron Bridges makes 2/2 from the line.
Score: 28-15

[01:43] Team_044 possession (Score: 28-15)
Victor Westbrook attempts a 3Pt. Contested by Collin Bane (4.4 feet, MAN). VICTOR WESTBROOK MAKES IT! Assist: Karl Fox
Score: 28-18

[01:26] Team_050 possession (Score: 28-18)
Donovan Trent makes the Layup and draws the foul on Ayo McCollum! And-1! Donovan Trent to the line for 1. [BONUS: 9 team fouls] (Ayo McCollum: 4 personal fouls)   FT 1/1: GOOD Donovan Trent makes 1/1 from the line.
Score: 31-18

[01:13] Team_044 possession (Score: 31-18)
Victor Westbrook makes the Layup and draws the foul on Donovan Trent! And-1! Victor Westbrook to the line for 1. [Team fouls: 2] (Donovan Trent: 1 personal fouls)   FT 1/1: GOOD Victor Westbrook makes 1/1 from the line.
Score: 31-21

[00:55] Team_050 possession (Score: 31-21)
Giannis LaVine attempts a 3Pt. Contested by Isaiah Murray (5.4 feet, ZONE). GIANNIS LAVINE MAKES IT! Assist: Joel Banchero
Score: 34-21

[00:37] Team_044 possession (Score: 34-21)
FOUL! Reach-in foul on Donovan Trent during the drive. [Team fouls: 3] No free throws, side out. (Donovan Trent: 2 personal fouls)

[00:22] Team_044 possession (Score: 34-21)
Victor Westbrook drives and kicks out. Ayo McCollum attempts a 3Pt. Contested by Donovan Trent (5.4 feet, MAN). Ayo McCollum misses. Rebound secured by Collin Bane.

[00:06] Team_050 possession (Score: 34-21)
LeBron Bridges drives and kicks out. Giannis LaVine makes the Midrange and draws the foul on Karl Fox! And-1! Giannis LaVine to the line for 1. [BONUS: 10 team fouls] (Karl Fox: 1 personal fouls)   FT 1/1: GOOD Giannis LaVine makes 1/1 from the line.
Score: 37-21

================================================================================
                              1ST QUARTER COMPLETE                              
================================================================================

1ST QUARTER SCORE: Team_050 37, Team_044 21

BOX SCORE:
================================================================================

Team_050
--------------------------------------------------------------------------------
Player                MIN  PTS  REB  AST  TO      FG   FG%      3P   3P%
--------------------------------------------------------------------------------
Giannis LaVine         12    9    0    0   0   3/4    75.0     0/0   0.0
Joel Banchero          12    9    0    1   0   3/4    75.0     0/0   0.0
Collin Bane            12    7    8    2   0   3/4    75.0     0/0   0.0
Donovan Trent          12    7    0    1   0   3/5    60.0     0/0   0.0
LeBron Bridges         12    4    6    0   0   2/4    50.0     0/0   0.0

TEAM: FG: 14/21 (66.7%), 3PT: 4/7 (57.1%), REB: 14 (4 off, 10 def), AST: 4, TO: 1
TEAM FOULS: 3


Team_044
--------------------------------------------------------------------------------
Player                MIN  PTS  REB  AST  TO      FG   FG%      3P   3P%
--------------------------------------------------------------------------------
Isaiah Murray          12    8    0    0   0   3/6    50.0     0/0   0.0
Victor Westbrook       12    6    2    0   0   2/6    33.3     0/0   0.0
Zach McGrady           12    5    0    0   0   2/2   100.0     0/0   0.0
Karl Fox               12    2    3    2   0   1/4    25.0     0/0   0.0
Ayo McCollum           12    0    3    1   0   0/0     0.0     0/0   0.0

TEAM: FG: 8/18 (44.4%), 3PT: 4/9 (44.4%), REB: 8 (1 off, 7 def), AST: 3, TO: 3
TEAM FOULS: 10 [Team_050 in BONUS]

================================================================================

================================================================================
                       2ND QUARTER - Team_050 vs Team_044                       
================================================================================

[12:00] Team_050 possession (Score: 37-21)
Joel Banchero makes the Layup and draws the foul on Ayo McCollum! And-1! Joel Banchero to the line for 1. [Team fouls: 1] (Ayo McCollum: 1 personal fouls)   FT 1/1: GOOD Joel Banchero makes 1/1 from the line.
Score: 40-21

[11:49] Team_044 possession (Score: 40-21)
Zach McGrady drives and kicks out. Ayo McCollum attempts a 3Pt. Contested by Giannis LaVine (4.2 feet, ZONE). Ayo McCollum misses. Rebound secured by LeBron Bridges.

[11:36] Team_050 possession (Score: 40-21)
FOUL! Holding foul on Victor Westbrook. [Team fouls: 2] No free throws, side out. (Victor Westbrook: 1 personal fouls)

[11:24] Team_050 possession (Score: 40-21)
Giannis LaVine throws a bad pass out of bounds! TURNOVER! (dead ball)

[11:24] Substitution (Team_050): Giannis LaVine OUT → Damian O'Neal IN (stamina_rule2)

[11:24] Substitution (Team_050): Joel Banchero OUT → Dwyane Towns IN (stamina_rule2)

[11:24] Substitution (Team_050): Collin Bane OUT → Larry Curry IN (stamina_rule2)

[11:24] Substitution (Team_050): LeBron Bridges OUT → Luka Gasol IN (stamina_rule2)

[11:24] Substitution (Team_050): Donovan Trent OUT → Tyler Smith IN (stamina_rule2)

[11:24] Substitution (Team_044): Zach McGrady OUT → Kyrie Poole IN (stamina_rule2)

[11:24] Substitution (Team_044): Isaiah Murray OUT → Tim Towns IN (stamina_rule2)

[11:24] Substitution (Team_044): Victor Westbrook OUT → Tim Siakam IN (stamina_rule2)

[11:24] Substitution (Team_044): Karl Fox OUT → Pau Quickley IN (stamina_rule2)

[11:24] Substitution (Team_044): Ayo McCollum OUT → Victor Anthony IN (stamina_rule2)

[11:05] Team_044 possession (Score: 40-21)
Tim Siakam attempts a Layup. Contested by Tyler Smith (5.3 feet, ZONE). TIM SIAKAM MAKES IT! Assist: Kyrie Poole
Score: 40-23

[10:53] Team_050 possession (Score: 40-23)
Damian O'Neal attempts a 3Pt. Contested by Kyrie Poole (4.7 feet, MAN). DAMIAN O'NEAL MAKES IT!
Score: 43-23

[10:38] Team_044 possession (Score: 43-23)
Victor Anthony attempts a 3Pt. Contested by Luka Gasol (5.6 feet, ZONE). VICTOR ANTHONY MAKES IT! Assist: Tim Siakam
Score: 43-26

[10:22] Team_050 possession (Score: 43-26)
Luka Gasol attempts a Midrange. Contested by Pau Quickley (3.4 feet, ZONE). Luka Gasol misses. Rebound secured by Victor Anthony.

[10:09] Team_044 possession (Score: 43-26)
Victor Anthony attempts a Layup. Contested by Tyler Smith (5.9 feet, MAN). Victor Anthony misses. Offensive rebound by Victor Anthony! Victor Anthony kicks it out.

[09:52] Team_044 possession (Score: 43-26)
Pau Quickley drives to the basket... Pau Quickley throws a bad pass out of bounds! TURNOVER! (dead ball)

[09:39] Team_050 possession (Score: 43-26)
Dwyane Towns drives, Tim Towns stays with him. Dwyane Towns attempts a Dunk. Contested by Tim Towns (5.5 feet, MAN). Dwyane Towns misses. Rebound secured by Tim Siakam.

[09:29] Team_044 possession (Score: 43-26)
FOUL! Holding foul on Larry Curry. [Team fouls: 1] No free throws, side out. (Larry Curry: 1 personal fouls)

[09:12] Team_044 possession (Score: 43-26)
Victor Anthony drives, Tyler Smith stays with him. Victor Anthony attempts a Dunk. Contested by Tyler Smith (5.9 feet, MAN). Victor Anthony misses. FOUL! Loose ball foul on Tyler Smith during the rebound battle. [Team fouls: 2] No free throws, side out. (Tyler Smith: 1 personal fouls)

[08:56] Team_044 possession (Score: 43-26)
FOUL! Offensive foul on Victor Anthony! Tyler Smith drew the charge! [Team fouls: 3] (Victor Anthony: 1 personal fouls) TURNOVER! (dead ball)

[08:38] Team_050 possession (Score: 43-26)
Damian O'Neal makes the Midrange and draws the foul on Kyrie Poole! And-1! Damian O'Neal to the line for 1. [Team fouls: 4] (Kyrie Poole: 1 personal fouls)   FT 1/1: GOOD Damian O'Neal makes 1/1 from the line.
Score: 46-26

[08:24] Team_044 possession (Score: 46-26)
Victor Anthony drives to the basket... FOUL! Offensive foul on Victor Anthony! Tyler Smith drew the charge! [Team fouls: 5] (Victor Anthony: 2 personal fouls) TURNOVER! (dead ball)

[08:05] Team_050 possession (Score: 46-26)
Luka Gasol attempts a 3Pt. Contested by Tim Siakam (3.7 feet, ZONE). Luka Gasol misses. Rebound secured by Victor Anthony.

[07:48] Team_044 possession (Score: 46-26)
Tim Siakam makes the Layup and draws the foul on Larry Curry! And-1! Tim Siakam to the line for 1. [Team fouls: 3] (Larry Curry: 2 personal fouls)   FT 1/1: GOOD Tim Siakam makes 1/1 from the line.
Score: 46-29

[07:35] Team_050 possession (Score: 46-29)
Luka Gasol attempts a Midrange. Contested by Pau Quickley (3.4 feet, MAN). LUKA GASOL MAKES IT! Assist: Larry Curry
Score: 48-29

[07:20] Team_044 possession (Score: 48-29)
Kyrie Poole attempts a 3Pt. Contested by Luka Gasol (4.8 feet, ZONE). Kyrie Poole misses. Rebound secured by Tyler Smith.

[07:09] Team_050 possession (Score: 48-29)
Larry Curry attempts a 3Pt. Contested by Tim Siakam (3.8 feet, ZONE). Larry Curry misses. Rebound secured by Tim Siakam.

[06:55] Team_044 possession (Score: 48-29)
Tim Siakam attempts a 3Pt. Contested by Larry Curry (5.0 feet, MAN). TIM SIAKAM MAKES IT! Assist: Tim Towns
Score: 48-32

[06:42] Team_050 possession (Score: 48-32)
Larry Curry attempts a Midrange. Contested by Pau Quickley (3.5 feet, ZONE). Larry Curry misses. Offensive rebound by Larry Curry! Larry Curry kicks it out.

[06:28] Team_050 possession (Score: 48-32)
Larry Curry attempts a 3Pt. Contested by Tim Siakam (3.8 feet, MAN). Larry Curry misses. Offensive rebound by Tyler Smith! Tyler Smith kicks it out.

[06:15] Team_050 possession (Score: 48-32)
Dwyane Towns attempts a 3Pt. Contested by Tim Towns (5.5 feet, MAN). Dwyane Towns misses. Rebound secured by Pau Quickley.

[06:01] Team_044 possession (Score: 48-32)
FOUL! Shooting foul on Luka Gasol. Pau Quickley to the line for 2 free throws. [Team fouls: 4] (Luka Gasol: 1 personal fouls)   FT 1/2: GOOD   FT 2/2: GOOD Pau Quickley makes 2/2 from the line.
Score: 48-34

[05:46] Team_050 possession (Score: 48-34)
Dwyane Towns attempts a Midrange. Contested by Tim Towns (5.5 feet, MAN). Dwyane Towns misses. Rebound secured by Tim Siakam.

[05:37] Team_044 possession (Score: 48-34)
FOUL! Holding foul on Tyler Smith. [IN THE BONUS! 5 team fouls] Victor Anthony to the line for 2 free throws. (Tyler Smith: 2 personal fouls)   FT 1/2: GOOD   FT 2/2: GOOD Victor Anthony makes 2/2 from the line.
Score: 48-36

[05:19] Team_050 possession (Score: 48-36)
Larry Curry drives to the basket... Larry Curry throws a bad pass out of bounds! TURNOVER! (dead ball)

[05:06] Team_044 possession (Score: 48-36)
Tim Siakam attempts a 3Pt. Contested by Larry Curry (5.0 feet, MAN). Tim Siakam misses. Rebound secured by Larry Curry.

[04:52] Team_050 possession (Score: 48-36)
Luka Gasol attempts a 3Pt. Contested by Pau Quickley (3.4 feet, MAN). LUKA GASOL MAKES IT!
Score: 51-36

[04:40] Team_044 possession (Score: 51-36)
Tim Siakam attempts a 3Pt. Contested by Larry Curry (5.0 feet, MAN). Tim Siakam misses. Rebound secured by Tyler Smith.

[04:23] Team_050 possession (Score: 51-36)
FOUL! Shooting foul on Tim Towns. Dwyane Towns to the line for 3 free throws. [BONUS: 6 team fouls] (Tim Towns: 1 personal fouls)   FT 1/3: GOOD   FT 2/3: GOOD   FT 3/3: MISS Dwyane Towns makes 2/3 from the line. Rebound secured by Victor Anthony.
Score: 53-36

[04:04] Team_044 possession (Score: 53-36)
Pau Quickley attempts a 3Pt. Contested by Luka Gasol (5.2 feet, MAN). Pau Quickley misses. Rebound secured by Dwyane Towns.

[03:48] Team_050 possession (Score: 53-36)
Damian O'Neal attempts a 3Pt. Contested by Tim Towns (5.4 feet, ZONE). Damian O'Neal misses. Rebound secured by Tim Siakam.

[03:30] Team_044 possession (Score: 53-36)
Tim Siakam attempts a 3Pt. Contested by Luka Gasol (5.1 feet, ZONE). Tim Siakam misses. Rebound secured by Larry Curry.

[03:15] Team_050 possession (Score: 53-36)
FOUL! Holding foul on Kyrie Poole. [IN THE BONUS! 7 team fouls] Damian O'Neal to the line for 2 free throws. (Kyrie Poole: 2 personal fouls)   FT 1/2: GOOD   FT 2/2: GOOD Damian O'Neal makes 2/2 from the line.
Score: 55-36

[02:59] Team_044 possession (Score: 55-36)
Tim Towns drives and kicks out. Tim Towns attempts a 3Pt. Contested by Dwyane Towns (4.4 feet, MAN). Tim Towns misses. Rebound secured by Tyler Smith.

[02:48] Team_050 possession (Score: 55-36)
FOUL! Offensive foul on Tyler Smith! Victor Anthony drew the charge! [Team fouls: 6] (Tyler Smith: 3 personal fouls) TURNOVER! (dead ball)

[02:31] Team_044 possession (Score: 55-36)
Pau Quickley drives, picks up Luka Gasol. Help arrives from Dwyane Towns! Pau Quickley attempts a Dunk. Contested by Dwyane Towns (5.4 feet, ZONE). PAU QUICKLEY MAKES IT!
Score: 55-38

[02:13] Team_050 possession (Score: 55-38)
Dwyane Towns attempts a 3Pt. Contested by Tim Towns (5.7 feet, MAN). DWYANE TOWNS MAKES IT! Assist: Damian O'Neal
Score: 58-38

[02:02] Team_044 possession (Score: 58-38)
Victor Anthony attempts a Midrange. Contested by Luka Gasol (5.8 feet, ZONE). Victor Anthony misses. Offensive rebound by Tim Siakam! Tim Siakam kicks it out.

[01:47] Team_044 possession (Score: 58-38)
Tim Siakam attempts a 3Pt. Contested by Larry Curry (5.2 feet, MAN). Tim Siakam misses. Rebound secured by Larry Curry.

[01:31] Team_050 possession (Score: 58-38)
Larry Curry drives and kicks out. Tyler Smith attempts a 3Pt. Contested by Victor Anthony (4.6 feet, MAN). Tyler Smith misses. Rebound secured by Victor Anthony.

[01:20] Team_044 possession (Score: 58-38)
FOUL! Holding foul on Dwyane Towns. [IN THE BONUS! 7 team fouls] Tim Towns to the line for 2 free throws. (Dwyane Towns: 1 personal fouls)   FT 1/2: MISS   FT 2/2: GOOD Tim Towns makes 1/2 from the line.
Score: 58-39

[01:04] Team_050 possession (Score: 58-39)
Dwyane Towns attempts a 3Pt. Contested by Tim Siakam (4.1 feet, ZONE). Dwyane Towns misses. Rebound secured by Pau Quickley.

[00:45] Team_044 possession (Score: 58-39)
FOUL! Offensive foul on Victor Anthony! Tyler Smith drew the charge! [Team fouls: 8] (Victor Anthony: 3 personal fouls) TURNOVER! (dead ball)

[00:29] Team_050 possession (Score: 58-39)
FOUL! Reach-in foul on Victor Anthony during the drive. [IN THE BONUS! 9 team fouls] Tyler Smith to the line for 2 free throws. (Victor Anthony: 4 personal fouls)   FT 1/2: GOOD   FT 2/2: GOOD Tyler Smith makes 2/2 from the line.
Score: 60-39

[00:11] Team_044 possession (Score: 60-39)
Pau Quickley attempts a 3Pt. Contested by Luka Gasol (5.6 feet, ZONE). Pau Quickley misses. Rebound secured by Dwyane Towns.

================================================================================
                              2ND QUARTER COMPLETE                              
================================================================================

2ND QUARTER SCORE: Team_050 23, Team_044 18

BOX SCORE:
================================================================================

Team_050
--------------------------------------------------------------------------------
Player                MIN  PTS  REB  AST  TO      FG   FG%      3P   3P%
--------------------------------------------------------------------------------
Damian O'Neal          11    8    0    1   0   3/4    75.0     0/0   0.0
Luka Gasol             11    5    0    0   0   2/4    50.0     0/0   0.0
Joel Banchero          13    3    0    0   0   1/1   100.0     0/0   0.0
Dwyane Towns           11    3    2    0   0   1/6    16.7     0/0   0.0
Tyler Smith            11    2    4    0   0   1/1   100.0     0/0   0.0
LeBron Bridges         13    0    1    0   0   0/0     0.0     0/0   0.0
Larry Curry            11    0    4    1   0   0/2     0.0     0/0   0.0

TEAM: FG: 8/18 (44.4%), 3PT: 3/9 (33.3%), REB: 11 (2 off, 9 def), AST: 2, TO: 3
TEAM FOULS: 7 [Team_044 in BONUS]


Team_044
--------------------------------------------------------------------------------
Player                MIN  PTS  REB  AST  TO      FG   FG%      3P   3P%
--------------------------------------------------------------------------------
Tim Siakam             11    8    6    1   0   3/7    42.9     0/0   0.0
Victor Anthony         11    5    5    0   0   2/2   100.0     0/0   0.0
Pau Quickley           11    4    2    0   0   2/4    50.0     0/0   0.0
Tim Towns              11    1    0    1   0   1/2    50.0     0/0   0.0
Zach McGrady           13    0    0    0   0   0/1     0.0     0/0   0.0
Kyrie Poole            11    0    0    1   0   0/1     0.0     0/0   0.0

TEAM: FG: 8/17 (47.1%), 3PT: 2/9 (22.2%), REB: 13 (3 off, 10 def), AST: 3, TO: 4
TEAM FOULS: 9 [Team_050 in BONUS]

================================================================================

================================================================================
                       3RD QUARTER - Team_050 vs Team_044                       
================================================================================

[12:00] Team_050 possession (Score: 60-39)
Collin Bane attempts a 3Pt. Contested by Isaiah Murray (4.8 feet, ZONE). Collin Bane misses. Rebound secured by Karl Fox.

[11:43] Team_044 possession (Score: 60-39)
Karl Fox drives, LeBron Bridges stays with him. Karl Fox attempts a Layup. Contested by LeBron Bridges (4.3 feet, MAN). KARL FOX MAKES IT! Assist: Victor Westbrook
Score: 60-41

[11:24] Team_050 possession (Score: 60-41)
Donovan Trent attempts a 3Pt. Contested by Isaiah Murray (4.5 feet, ZONE). Donovan Trent misses. Rebound secured by Ayo McCollum.

[11:14] Team_044 possession (Score: 60-41)
Ayo McCollum drives and kicks out. Zach McGrady attempts a 3Pt. Contested by Giannis LaVine (3.9 feet, ZONE). Zach McGrady misses. Rebound secured by Joel Banchero.

[11:00] Team_050 possession (Score: 60-41)
LeBron Bridges throws a bad pass! Stolen by Karl Fox! TURNOVER! (live ball)

[10:48] Team_044 possession (Score: 60-41)
Karl Fox attempts a Midrange. Contested by Joel Banchero (4.4 feet, ZONE). Karl Fox misses. Offensive rebound by Victor Westbrook! Victor Westbrook kicks it out.

[10:37] Team_044 possession (Score: 60-41)
Zach McGrady attempts a Midrange. Contested by LeBron Bridges (4.4 feet, ZONE). Zach McGrady misses. Rebound secured by Joel Banchero.

[10:27] Team_050 possession (Score: 60-41)
FOUL! Shooting foul on Karl Fox. LeBron Bridges to the line for 2 free throws. [Team fouls: 1] (Karl Fox: 1 personal fouls)   FT 1/2: MISS   FT 2/2: GOOD LeBron Bridges makes 1/2 from the line.
Score: 61-41

[10:13] Team_044 possession (Score: 61-41)
Ayo McCollum attempts a Dunk. BLOCKED BY DONOVAN TRENT! Ball is loose! Rebound secured by LeBron Bridges.

[10:03] Team_050 possession (Score: 61-41)
Donovan Trent attempts a 3Pt. Contested by Ayo McCollum (4.4 feet, MAN). Donovan Trent misses. Rebound secured by Victor Westbrook.

[09:47] Team_044 possession (Score: 61-41)
Zach McGrady attempts a Layup. Contested by Giannis LaVine (4.1 feet, MAN). ZACH MCGRADY MAKES IT! Assist: Victor Westbrook
Score: 61-43

[09:32] Team_050 possession (Score: 61-43)
Donovan Trent attempts a Layup. BLOCKED BY AYO MCCOLLUM! Ball goes out off Ayo McCollum. Donovan Trent's ball!

[09:23] Team_050 possession (Score: 61-43)
Giannis LaVine attempts a Layup. BLOCKED BY ZACH MCGRADY! Ball is loose! Rebound secured by Ayo McCollum.

[09:08] Team_044 possession (Score: 61-43)
FOUL! Shooting foul on LeBron Bridges. Karl Fox to the line for 2 free throws. [Team fouls: 1] (LeBron Bridges: 1 personal fouls)   FT 1/2: GOOD   FT 2/2: GOOD Karl Fox makes 2/2 from the line.
Score: 61-45

[08:53] Team_050 possession (Score: 61-45)
Giannis LaVine drives to the basket... Giannis LaVine commits a violation (traveling/carry)! TURNOVER! (dead ball)

[08:42] Team_044 possession (Score: 61-45)
Ayo McCollum attempts a 3Pt. Contested by Donovan Trent (4.8 feet, MAN). Ayo McCollum misses. Rebound secured by LeBron Bridges.

[08:24] Team_050 possession (Score: 61-45)
Donovan Trent drives and kicks out. Collin Bane attempts a 3Pt. Contested by Isaiah Murray (4.7 feet, ZONE). COLLIN BANE MAKES IT! Assist: Giannis LaVine
Score: 64-45

[08:10] Team_044 possession (Score: 64-45)
Karl Fox attempts a Layup. Contested by LeBron Bridges (4.3 feet, MAN). KARL FOX MAKES IT! Assist: Zach McGrady
Score: 64-47

[07:54] Team_050 possession (Score: 64-47)
Collin Bane attempts a Midrange. Contested by Victor Westbrook (5.3 feet, MAN). Collin Bane misses. Rebound secured by Karl Fox.

[07:39] Team_044 possession (Score: 64-47)
Karl Fox makes the Dunk and draws the foul on LeBron Bridges! And-1! Karl Fox to the line for 1. [Team fouls: 2] (LeBron Bridges: 2 personal fouls)   FT 1/1: GOOD Karl Fox makes 1/1 from the line.
Score: 64-50

[07:28] Team_050 possession (Score: 64-50)
Donovan Trent attempts a Midrange. Contested by Victor Westbrook (4.9 feet, ZONE). DONOVAN TRENT MAKES IT!
Score: 66-50

[07:16] Team_044 possession (Score: 66-50)
Victor Westbrook attempts a 3Pt. Contested by Collin Bane (4.2 feet, MAN). Victor Westbrook misses. Rebound secured by Collin Bane.

[07:03] Team_050 possession (Score: 66-50)
Joel Banchero drives, picks up Isaiah Murray. Help arrives from Victor Westbrook! Joel Banchero attempts a Layup. Contested by Victor Westbrook (4.5 feet, MAN). Joel Banchero misses. Rebound secured by Victor Westbrook.

[06:48] Team_044 possession (Score: 66-50)
Karl Fox attempts a Midrange. Contested by LeBron Bridges (4.3 feet, MAN). KARL FOX MAKES IT!
Score: 66-52

[06:38] Team_050 possession (Score: 66-52)
Collin Bane attempts a 3Pt. Contested by Victor Westbrook (5.3 feet, MAN). Collin Bane misses. Rebound secured by Ayo McCollum.

[06:24] Team_044 possession (Score: 66-52)
Victor Westbrook drives to the basket... Victor Westbrook loses control! Ball rolls out of bounds! TURNOVER! (dead ball)

[06:08] Team_050 possession (Score: 66-52)
LeBron Bridges attempts a Midrange. Contested by Isaiah Murray (4.8 feet, ZONE). LeBron Bridges misses. Rebound secured by Ayo McCollum.

[05:58] Team_044 possession (Score: 66-52)
Ayo McCollum attempts a Layup. Contested by Donovan Trent (4.8 feet, MAN). AYO MCCOLLUM MAKES IT!
Score: 66-54

[05:42] Team_050 possession (Score: 66-54)
LeBron Bridges attempts a 3Pt. Contested by Karl Fox (4.1 feet, MAN). LeBron Bridges misses. Rebound secured by Victor Westbrook.

[05:28] Team_044 possession (Score: 66-54)
Zach McGrady drives, Giannis LaVine stays with him. Zach McGrady attempts a Dunk. Contested by Giannis LaVine (4.1 feet, MAN). ZACH MCGRADY MAKES IT! Assist: Ayo McCollum
Score: 66-56

[05:11] Team_050 possession (Score: 66-56)
FOUL! Shooting foul on Isaiah Murray. Joel Banchero to the line for 3 free throws. [Team fouls: 2] (Isaiah Murray: 1 personal fouls)   FT 1/3: GOOD   FT 2/3: MISS   FT 3/3: GOOD Joel Banchero makes 2/3 from the line.
Score: 68-56

[04:54] Team_044 possession (Score: 68-56)
Victor Westbrook attempts a Midrange. Contested by Joel Banchero (4.4 feet, ZONE). VICTOR WESTBROOK MAKES IT!
Score: 68-58

[04:43] Team_050 possession (Score: 68-58)
Collin Bane attempts a Midrange. Contested by Isaiah Murray (4.9 feet, ZONE). Collin Bane misses. Rebound secured by Ayo McCollum.

[04:29] Team_044 possession (Score: 68-58)
Ayo McCollum attempts a Midrange. Contested by LeBron Bridges (4.3 feet, ZONE). Ayo McCollum misses. Rebound secured by Joel Banchero.

[04:09] Team_050 possession (Score: 68-58)
Donovan Trent attempts a Layup. BLOCKED BY AYO MCCOLLUM! Ball is loose! Rebound secured by Victor Westbrook.

[03:56] Team_044 possession (Score: 68-58)
Karl Fox drives and kicks out. Zach McGrady attempts a 3Pt. Contested by Giannis LaVine (4.0 feet, MAN). Zach McGrady misses. Rebound secured by Joel Banchero.

[03:42] Team_050 possession (Score: 68-58)
Collin Bane attempts a 3Pt. Contested by Victor Westbrook (5.6 feet, MAN). Collin Bane misses. Rebound secured by Karl Fox.

[03:28] Team_044 possession (Score: 68-58)
Karl Fox attempts a Layup. Contested by LeBron Bridges (4.6 feet, MAN). KARL FOX MAKES IT! Assist: Zach McGrady
Score: 68-60

[03:13] Team_050 possession (Score: 68-60)
Giannis LaVine attempts a 3Pt. Contested by Zach McGrady (4.7 feet, MAN). Giannis LaVine misses. Rebound secured by Ayo McCollum.

[03:00] Team_044 possession (Score: 68-60)
Karl Fox attempts a Midrange. Contested by LeBron Bridges (4.6 feet, MAN). KARL FOX MAKES IT! Assist: Victor Westbrook
Score: 68-62

[02:43] Team_050 possession (Score: 68-62)
Giannis LaVine attempts a 3Pt. Contested by Zach McGrady (4.8 feet, MAN). Giannis LaVine misses. Rebound secured by Ayo McCollum.

[02:29] Team_044 possession (Score: 68-62)
Ayo McCollum attempts a Layup. Contested by Donovan Trent (5.1 feet, ZONE). AYO MCCOLLUM MAKES IT!
Score: 68-64

[02:17] Team_050 possession (Score: 68-64)
Giannis LaVine throws a bad pass! Stolen by Zach McGrady! TURNOVER! (live ball)

[02:06] Team_044 possession (Score: 68-64)
Zach McGrady attempts a 3Pt. Contested by Giannis LaVine (4.4 feet, MAN). ZACH MCGRADY MAKES IT! Assist: Isaiah Murray
Score: 68-67

[01:49] Team_050 possession (Score: 68-67)
Joel Banchero drives and kicks out. FOUL! Shooting foul on Isaiah Murray. Giannis LaVine to the line for 2 free throws. [Team fouls: 3] (Isaiah Murray: 2 personal fouls)   FT 1/2: MISS   FT 2/2: GOOD Giannis LaVine makes 1/2 from the line.
Score: 69-67

[01:38] Team_044 possession (Score: 69-67)
Zach McGrady attempts a 3Pt. Contested by Giannis LaVine (4.5 feet, ZONE). Zach McGrady misses. Rebound secured by Joel Banchero.

[01:20] Team_050 possession (Score: 69-67)
Collin Bane attempts a Layup. Contested by Ayo McCollum (5.3 feet, ZONE). COLLIN BANE MAKES IT! Assist: Donovan Trent
Score: 71-67

[01:06] Team_044 possession (Score: 71-67)
Isaiah Murray loses control! Ball rolls out of bounds! TURNOVER! (dead ball)

[01:06] Substitution (Team_050): Giannis LaVine OUT → Damian O'Neal IN (stamina_rule2)

[01:06] Substitution (Team_050): Joel Banchero OUT → Dwyane Towns IN (stamina_rule2)

[01:06] Substitution (Team_050): Collin Bane OUT → Larry Curry IN (stamina_rule2)

[01:06] Substitution (Team_050): LeBron Bridges OUT → Luka Gasol IN (stamina_rule2)

[01:06] Substitution (Team_050): Donovan Trent OUT → Tyler Smith IN (stamina_rule2)

[01:06] Substitution (Team_044): Zach McGrady OUT → Kyrie Poole IN (stamina_rule2)

[01:06] Substitution (Team_044): Isaiah Murray OUT → Tim Towns IN (stamina_rule2)

[01:06] Substitution (Team_044): Victor Westbrook OUT → Tim Siakam IN (stamina_rule2)

[01:06] Substitution (Team_044): Karl Fox OUT → Pau Quickley IN (stamina_rule2)

[01:06] Substitution (Team_044): Ayo McCollum OUT → Victor Anthony IN (stamina_rule2)

[00:50] Team_050 possession (Score: 71-67)
Luka Gasol commits a violation (traveling/carry)! TURNOVER! (dead ball)

[00:39] Team_044 possession (Score: 71-67)
Tim Siakam makes the Layup and draws the foul on Tyler Smith! And-1! Tim Siakam to the line for 1. [Team fouls: 3] (Tyler Smith: 1 personal fouls)   FT 1/1: GOOD Tim Siakam makes 1/1 from the line.
Score: 71-70

[00:22] Team_050 possession (Score: 71-70)
Luka Gasol attempts a Layup. BLOCKED BY PAU QUICKLEY! Ball is loose! Offensive rebound by Tyler Smith! Tyler Smith kicks it out.

[00:12] Team_050 possession (Score: 71-70)
Tyler Smith drives and kicks out. Tyler Smith makes the Midrange and draws the foul on Tim Siakam! And-1! Tyler Smith to the line for 1. [Team fouls: 4] (Tim Siakam: 1 personal fouls)   FT 1/1: MISS Tyler Smith makes 0/1 from the line. Rebound secured by Victor Anthony.
Score: 73-70

[00:02] Team_044 possession (Score: 73-70)
Tim Towns attempts a Layup. Contested by Dwyane Towns (4.5 feet, MAN). TIM TOWNS MAKES IT! Assist: Victor Anthony
Score: 73-72

================================================================================
                              3RD QUARTER COMPLETE                              
================================================================================

3RD QUARTER SCORE: Team_050 13, Team_044 33

BOX SCORE:
================================================================================

Team_050
--------------------------------------------------------------------------------
Player                MIN  PTS  REB  AST  TO      FG   FG%      3P   3P%
--------------------------------------------------------------------------------
Collin Bane            24    5    1    0   0   2/7    28.6     0/0   0.0
Donovan Trent          24    2    0    1   0   1/4    25.0     0/0   0.0
Joel Banchero          24    2    5    0   0   1/2    50.0     0/0   0.0
LeBron Bridges         24    1    2    0   0   1/3    33.3     0/0   0.0
Giannis LaVine         24    1    0    1   0   1/4    25.0     0/0   0.0
Tyler Smith            12    0    1    0   0   0/1     0.0     0/0   0.0

TEAM: FG: 6/21 (28.6%), 3PT: 1/9 (11.1%), REB: 9 (1 off, 8 def), AST: 2, TO: 4
TEAM FOULS: 3


Team_044
--------------------------------------------------------------------------------
Player                MIN  PTS  REB  AST  TO      FG   FG%      3P   3P%
--------------------------------------------------------------------------------
Karl Fox               24   15    3    0   0   7/8    87.5     0/0   0.0
Zach McGrady           24    7    0    2   0   3/5    60.0     0/0   0.0
Ayo McCollum           24    4    7    1   0   2/6    33.3     0/0   0.0
Tim Siakam             12    3    0    0   0   1/1   100.0     0/0   0.0
Victor Westbrook       24    2    5    3   0   1/2    50.0     0/0   0.0
Tim Towns              12    2    0    0   0   1/1   100.0     0/0   0.0
Isaiah Murray          24    0    0    1   0   0/0     0.0     0/0   0.0
Victor Anthony         12    0    1    1   0   0/0     0.0     0/0   0.0

TEAM: FG: 15/23 (65.2%), 3PT: 1/4 (25.0%), REB: 16 (1 off, 15 def), AST: 8, TO: 2
TEAM FOULS: 4

================================================================================

================================================================================
                       4TH QUARTER - Team_050 vs Team_044                       
================================================================================

[12:00] Team_050 possession (Score: 73-72)
Giannis LaVine attempts a 3Pt. Contested by Zach McGrady (4.7 feet, MAN). Giannis LaVine misses. Rebound secured by Karl Fox.

[11:50] Team_044 possession (Score: 73-72)
Victor Westbrook drives and kicks out. Zach McGrady attempts a 3Pt. Contested by Giannis LaVine (4.1 feet, ZONE). Zach McGrady misses. Rebound secured by Joel Banchero.

[11:37] Team_050 possession (Score: 73-72)
Collin Bane attempts a 3Pt. Contested by Victor Westbrook (5.6 feet, MAN). Collin Bane misses. Rebound secured by Karl Fox.

[11:26] Team_044 possession (Score: 73-72)
Victor Westbrook drives, Collin Bane stays with him. Victor Westbrook attempts a Layup. Contested by Collin Bane (4.3 feet, MAN). VICTOR WESTBROOK MAKES IT!
Score: 73-74

[11:10] Team_050 possession (Score: 73-74)
LeBron Bridges attempts a Layup. BLOCKED BY KARL FOX! Ball is loose! Offensive rebound by Collin Bane! Collin Bane kicks it out.

[10:54] Team_050 possession (Score: 73-74)
FOUL! Reach-in foul on Ayo McCollum during the drive. [Team fouls: 2] No free throws, side out. (Ayo McCollum: 1 personal fouls)

[10:39] Team_050 possession (Score: 73-74)
LeBron Bridges attempts a 3Pt. Contested by Karl Fox (4.3 feet, MAN). LeBron Bridges misses. Rebound secured by Ayo McCollum.

[10:20] Team_044 possession (Score: 73-74)
Zach McGrady attempts a 3Pt. Contested by Giannis LaVine (4.5 feet, ZONE). ZACH MCGRADY MAKES IT! Assist: Isaiah Murray
Score: 73-77

[10:10] Team_050 possession (Score: 73-77)
Giannis LaVine attempts a 3Pt. Contested by Zach McGrady (4.9 feet, MAN). Giannis LaVine misses. Rebound secured by Karl Fox.

[09:52] Team_044 possession (Score: 73-77)
Karl Fox attempts a 3Pt. Contested by Giannis LaVine (4.4 feet, ZONE). Karl Fox misses. Rebound secured by Joel Banchero.

[09:35] Team_050 possession (Score: 73-77)
Giannis LaVine drives to the basket... Giannis LaVine loses the ball! Stripped by Zach McGrady! TURNOVER! (live ball)

[09:16] Team_044 possession (Score: 73-77)
Isaiah Murray attempts a 3Pt. Contested by Giannis LaVine (4.7 feet, ZONE). Isaiah Murray misses. Rebound secured by Joel Banchero.

[09:05] Team_050 possession (Score: 73-77)
Donovan Trent attempts a Midrange. Contested by Ayo McCollum (5.0 feet, MAN). Donovan Trent misses. FOUL! Loose ball foul on Victor Westbrook during the rebound battle. [Team fouls: 3] No free throws, side out. (Victor Westbrook: 2 personal fouls)

[08:53] Team_050 possession (Score: 73-77)
Joel Banchero attempts a 3Pt. Contested by Isaiah Murray (5.0 feet, ZONE). JOEL BANCHERO MAKES IT! Assist: Giannis LaVine
Score: 76-77

[08:39] Team_044 possession (Score: 76-77)
Victor Westbrook drives, Collin Bane stays with him. Victor Westbrook attempts a Dunk. Contested by Collin Bane (4.6 feet, MAN). VICTOR WESTBROOK MAKES IT! Assist: Karl Fox
Score: 76-79

[08:27] Team_050 possession (Score: 76-79)
LeBron Bridges attempts a 3Pt. Contested by Isaiah Murray (5.3 feet, ZONE). LeBron Bridges misses. Rebound secured by Ayo McCollum.

[08:15] Team_044 possession (Score: 76-79)
Ayo McCollum drives, picks up Donovan Trent. Help arrives from Joel Banchero! Ayo McCollum attempts a Dunk. Contested by Joel Banchero (5.4 feet, ZONE). AYO MCCOLLUM MAKES IT!
Score: 76-81

[08:01] Team_050 possession (Score: 76-81)
LeBron Bridges drives to the basket... LeBron Bridges loses the ball! Stripped by Karl Fox! TURNOVER! (live ball)

[07:44] Team_044 possession (Score: 76-81)
Karl Fox attempts a Layup. Contested by Donovan Trent (5.6 feet, ZONE). Karl Fox misses. Offensive rebound by Ayo McCollum! Ayo McCollum kicks it out.

[07:27] Team_044 possession (Score: 76-81)
Ayo McCollum attempts a Midrange. Contested by LeBron Bridges (5.0 feet, ZONE). AYO MCCOLLUM MAKES IT! Assist: Karl Fox
Score: 76-83

[07:13] Team_050 possession (Score: 76-83)
Joel Banchero attempts a 3Pt. Contested by Isaiah Murray (5.2 feet, ZONE). Joel Banchero misses. FOUL! Loose ball foul on Victor Westbrook during the rebound battle. [Team fouls: 4] No free throws, side out. (Victor Westbrook: 3 personal fouls)

[06:58] Team_050 possession (Score: 76-83)
Collin Bane attempts a Midrange. Contested by Karl Fox (4.8 feet, ZONE). Collin Bane misses. Offensive rebound by Collin Bane! Collin Bane kicks it out.

[06:41] Team_050 possession (Score: 76-83)
Collin Bane attempts a 3Pt. Contested by Zach McGrady (5.0 feet, ZONE). Collin Bane misses. Rebound secured by Ayo McCollum.

[06:24] Team_044 possession (Score: 76-83)
Ayo McCollum attempts a Midrange. Contested by Donovan Trent (5.6 feet, MAN). Ayo McCollum misses. Rebound secured by Joel Banchero.

[06:07] Team_050 possession (Score: 76-83)
Joel Banchero attempts a 3Pt. Contested by Zach McGrady (4.8 feet, ZONE). JOEL BANCHERO MAKES IT! Assist: Donovan Trent
Score: 79-83

[05:51] Team_044 possession (Score: 79-83)
Isaiah Murray attempts a 3Pt. Contested by Giannis LaVine (5.1 feet, ZONE). Isaiah Murray misses. Rebound secured by LeBron Bridges.

[05:36] Team_050 possession (Score: 79-83)
Giannis LaVine drives to the basket... Giannis LaVine throws a bad pass! Stolen by Zach McGrady! TURNOVER! (live ball)

[05:21] Team_044 possession (Score: 79-83)
Ayo McCollum drives, Donovan Trent stays with him. Ayo McCollum attempts a Dunk. Contested by Donovan Trent (5.7 feet, MAN). AYO MCCOLLUM MAKES IT! Assist: Karl Fox
Score: 79-85

[05:06] Team_050 possession (Score: 79-85)
Joel Banchero drives to the basket... Joel Banchero commits a violation (traveling/carry)! TURNOVER! (dead ball)

[05:06] Substitution (Team_050): Giannis LaVine OUT → Damian O'Neal IN (stamina_rule2)

[05:06] Substitution (Team_050): Joel Banchero OUT → Dwyane Towns IN (stamina_rule2)

[05:06] Substitution (Team_050): Collin Bane OUT → Larry Curry IN (stamina_rule2)

[05:06] Substitution (Team_050): LeBron Bridges OUT → Luka Gasol IN (stamina_rule2)

[05:06] Substitution (Team_050): Donovan Trent OUT → Tyler Smith IN (stamina_rule2)

[05:06] Substitution (Team_044): Zach McGrady OUT → Kyrie Poole IN (stamina_rule2)

[05:06] Substitution (Team_044): Isaiah Murray OUT → Tim Towns IN (stamina_rule2)

[05:06] Substitution (Team_044): Victor Westbrook OUT → Tim Siakam IN (stamina_rule2)

[05:06] Substitution (Team_044): Karl Fox OUT → Pau Quickley IN (stamina_rule2)

[05:06] Substitution (Team_044): Ayo McCollum OUT → Victor Anthony IN (stamina_rule2)

[04:49] Team_044 possession (Score: 79-85)
FOUL! Holding foul on Damian O'Neal. [Team fouls: 1] No free throws, side out. (Damian O'Neal: 1 personal fouls)

[04:35] Team_044 possession (Score: 79-85)
Tim Siakam attempts a Midrange. Contested by Luka Gasol (5.0 feet, ZONE). Tim Siakam misses. Rebound secured by Dwyane Towns.

[04:15] Team_050 possession (Score: 79-85)
Luka Gasol loses control! Ball rolls out of bounds! TURNOVER! (dead ball)

[03:58] Team_044 possession (Score: 79-85)
Victor Anthony attempts a 3Pt. Contested by Dwyane Towns (5.0 feet, ZONE). Victor Anthony misses. Offensive rebound by Victor Anthony! Victor Anthony kicks it out.

[03:46] Team_044 possession (Score: 79-85)
Tim Siakam throws a bad pass! Stolen by Larry Curry! TURNOVER! (live ball)

[03:29] Team_050 possession (Score: 79-85)
Damian O'Neal attempts a Midrange. Contested by Tim Siakam (3.8 feet, ZONE). Damian O'Neal misses. Rebound secured by Tim Siakam.

[03:13] Team_044 possession (Score: 79-85)
Tim Towns drives to the basket... Tim Towns loses the ball! Stripped by Dwyane Towns! TURNOVER! (live ball)

[03:00] Team_050 possession (Score: 79-85)
FOUL! Shooting foul on Pau Quickley. Dwyane Towns to the line for 2 free throws. [BONUS: 5 team fouls] (Pau Quickley: 1 personal fouls)   FT 1/2: GOOD   FT 2/2: GOOD Dwyane Towns makes 2/2 from the line.
Score: 81-85

[02:46] Team_044 possession (Score: 81-85)
Victor Anthony drives, Tyler Smith stays with him. Victor Anthony attempts a Dunk. Contested by Tyler Smith (5.9 feet, MAN). Victor Anthony misses. Rebound secured by Dwyane Towns.

[02:33] Team_050 possession (Score: 81-85)
Tyler Smith makes the Layup and draws the foul on Pau Quickley! And-1! Tyler Smith to the line for 1. [BONUS: 6 team fouls] (Pau Quickley: 2 personal fouls)   FT 1/1: GOOD Tyler Smith makes 1/1 from the line.
Score: 84-85

[02:24] Team_044 possession (Score: 84-85)
Tim Towns loses the ball! Stripped by Dwyane Towns! TURNOVER! (live ball)

[02:13] Team_050 possession (Score: 84-85)
Damian O'Neal attempts a Midrange. Contested by Kyrie Poole (4.7 feet, MAN). DAMIAN O'NEAL MAKES IT! Assist: Larry Curry
Score: 86-85

[01:59] Team_044 possession (Score: 86-85)
Victor Anthony drives and kicks out. FOUL! Shooting foul on Luka Gasol. Pau Quickley to the line for 3 free throws. [Team fouls: 2] (Luka Gasol: 1 personal fouls)   FT 1/3: GOOD   FT 2/3: GOOD   FT 3/3: GOOD Pau Quickley makes 3/3 from the line.
Score: 86-88

[01:44] Team_050 possession (Score: 86-88)
Tyler Smith attempts a Layup. Contested by Victor Anthony (4.7 feet, MAN). Tyler Smith misses. Rebound secured by Victor Anthony.

[01:32] Team_044 possession (Score: 86-88)
Victor Anthony attempts a Midrange. Wide open! Damian O'Neal is 7.0 feet away. [ZONE] Victor Anthony misses. Rebound secured by Dwyane Towns.

[01:17] Team_050 possession (Score: 86-88)
Tyler Smith attempts a Midrange. Contested by Victor Anthony (4.7 feet, MAN). TYLER SMITH MAKES IT!
Score: 88-88

[01:04] Team_044 possession (Score: 88-88)
Tim Towns attempts a 3Pt. Contested by Dwyane Towns (4.5 feet, MAN). Tim Towns misses. Offensive rebound by Tim Siakam! Tim Siakam kicks it out.

[00:52] Team_044 possession (Score: 88-88)
Pau Quickley attempts a Midrange. Contested by Tyler Smith (5.5 feet, ZONE). Pau Quickley misses. Offensive rebound by Victor Anthony! Victor Anthony kicks it out.

[00:35] Team_044 possession (Score: 88-88)
Tim Towns drives, Dwyane Towns stays with him. Tim Towns attempts a Layup. Contested by Dwyane Towns (4.5 feet, MAN). TIM TOWNS MAKES IT! Assist: Pau Quickley
Score: 88-90

[00:26] Team_050 possession (Score: 88-90)
Tyler Smith attempts a Layup. Contested by Victor Anthony (4.7 feet, ZONE). TYLER SMITH MAKES IT!
Score: 90-90

[00:10] Team_044 possession (Score: 90-90)
Tim Towns attempts a Layup. BLOCKED BY DWYANE TOWNS! Ball is loose! Rebound secured by Dwyane Towns.

================================================================================
                              4TH QUARTER COMPLETE                              
================================================================================

4TH QUARTER SCORE: Team_050 17, Team_044 18

BOX SCORE:
================================================================================

Team_050
--------------------------------------------------------------------------------
Player                MIN  PTS  REB  AST  TO      FG   FG%      3P   3P%
--------------------------------------------------------------------------------
Tyler Smith            17    7    0    0   0   3/4    75.0     0/0   0.0
Joel Banchero          31    6    4    0   0   2/2   100.0     0/0   0.0
Dwyane Towns           17    2    4    0   0   1/1   100.0     0/0   0.0
Damian O'Neal          17    2    0    0   0   1/2    50.0     0/0   0.0
Giannis LaVine         31    0    0    1   0   0/2     0.0     0/0   0.0
Collin Bane            31    0    4    0   0   0/2     0.0     0/0   0.0
LeBron Bridges         31    0    1    0   0   0/2     0.0     0/0   0.0
Donovan Trent          31    0    0    1   0   0/0     0.0     0/0   0.0
Larry Curry            17    0    0    1   0   0/0     0.0     0/0   0.0

TEAM: FG: 7/15 (46.7%), 3PT: 2/8 (25.0%), REB: 13 (4 off, 9 def), AST: 3, TO: 5
TEAM FOULS: 2


Team_044
--------------------------------------------------------------------------------
Player                MIN  PTS  REB  AST  TO      FG   FG%      3P   3P%
--------------------------------------------------------------------------------
Ayo McCollum           31    6    4    0   0   3/4    75.0     0/0   0.0
Victor Westbrook       31    4    0    0   0   2/3    66.7     0/0   0.0
Zach McGrady           31    3    0    0   0   1/1   100.0     0/0   0.0
Pau Quickley           17    3    0    1   0   1/1   100.0     0/0   0.0
Tim Towns              17    2    0    0   0   1/2    50.0     0/0   0.0
Karl Fox               31    0    3    3   0   0/1     0.0     0/0   0.0
Isaiah Murray          31    0    0    1   0   0/2     0.0     0/0   0.0
Tim Siakam             17    0    2    0   0   0/1     0.0     0/0   0.0
Victor Anthony         17    0    3    0   0   0/2     0.0     0/0   0.0

TEAM: FG: 8/17 (47.1%), 3PT: 1/4 (25.0%), REB: 12 (4 off, 8 def), AST: 5, TO: 3
TEAM FOULS: 6 [Team_050 in BONUS]

================================================================================

================================================================================
                               FULL GAME COMPLETE                               
================================================================================

FINAL SCORE: Team_050 90, Team_044 90

SCORING BY QUARTER:
--------------------------------------------------------------------------------
Team                     Q1     Q2     Q3     Q4    FINAL
--------------------------------------------------------------------------------
Team_050                 37     23     13     17       90
Team_044                 21     18     33     18       90
--------------------------------------------------------------------------------

FULL GAME BOX SCORE:
================================================================================

Team_050
--------------------------------------------------------------------------------
Player                MIN  PTS  REB  AST  TO      FG   FG%      3P   3P%      FT STL BLK
--------------------------------------------------------------------------------
Giannis LaVine         31   10    0    2   2   3/9    33.3   2/7    28.6   3/4     0   0
Joel Banchero          31   20    9    1   1   7/9    77.8   5/5   100.0   4/5     0   0
Collin Bane            31   12   13    2   1   5/13   38.5   0/6     0.0   1/1     0   0
LeBron Bridges         31    5   10    0   4   3/9    33.3   0/4     0.0   5/6     0   0
Donovan Trent          31    9    0    3   1   5/10   50.0   0/2     0.0   4/5     0   1
Damian O'Neal          17   10    0    1   0   3/5    60.0   1/2    50.0   3/3     0   0
Dwyane Towns           17    5    6    0   1   2/7    28.6   1/4    25.0   4/5     2   1
Larry Curry            17    0    4    2   0   0/2     0.0   0/1     0.0   0/0     1   0
Luka Gasol             17    5    0    0   2   2/4    50.0   1/2    50.0   0/0     0   0
Tyler Smith            17    9    5    0   1   4/6    66.7   0/0     0.0   3/4     0   0

TEAM: FG: 35/75 (46.7%), 3PT: 10/33 (30.3%), REB: 47 (11 off, 36 def), AST: 11, TO: 13


Team_044
--------------------------------------------------------------------------------
Player                MIN  PTS  REB  AST  TO      FG   FG%      3P   3P%      FT STL BLK
--------------------------------------------------------------------------------
Zach McGrady           31   15    0    2   0   6/9    66.7   3/4    75.0   0/0     3   1
Isaiah Murray          31    8    0    2   3   3/8    37.5   2/5    40.0   0/0     0   0
Victor Westbrook       31   12    7    3   1   5/11   45.5   1/3    33.3   1/1     0   0
Karl Fox               31   17    9    5   1   8/13   61.5   0/4     0.0   3/3     2   1
Ayo McCollum           31   10   14    2   0   5/10   50.0   0/1     0.0   0/0     0   3
Kyrie Poole            17    0    0    1   0   0/1     0.0   0/1     0.0   0/0     0   0
Tim Towns              17    5    0    1   2   2/4    50.0   0/0     0.0   1/2     0   0
Tim Siakam             17   11    8    1   2   4/9    44.4   1/5    20.0   2/2     0   0
Pau Quickley           17    7    2    1   0   2/4    50.0   0/2     0.0   5/5     0   1
Victor Anthony         17    5    9    1   3   2/4    50.0   1/1   100.0   2/2     0   0

TEAM: FG: 39/75 (52.0%), 3PT: 8/26 (30.8%), REB: 49 (9 off, 40 def), AST: 19, TO: 12

================================================================================
