================================================================================
                        FULL GAME - Team_015 vs Team_029                        
================================================================================

================================================================================
                       1ST QUARTER - Team_015 vs Team_029                       
================================================================================

[12:00] Team_015 possession (Score: 0-0)
Scottie Gasol drives to the basket... Scottie Gasol loses the ball! Stripped by James Wall! TURNOVER! (live ball)

[11:48] Team_029 possession (Score: 0-0)
Giannis Banchero attempts a 3Pt. Contested by CJ Banchero (4.8 feet, MAN). Giannis Banchero misses. Offensive rebound by James Wall! James Wall's putback is no good. Rebound secured by CJ Banchero.

[11:37] Team_015 possession (Score: 0-0)
Michael Simmons attempts a 3Pt. Contested by Scottie Bird (3.1 feet, MAN). Michael Simmons misses. Rebound secured by Devin Butler.

[11:20] Team_029 possession (Score: 0-0)
Devin Butler attempts a Midrange. Contested by Scottie Gasol (3.9 feet, ZONE). Devin Butler misses. Rebound secured by Michael Simmons.

[11:06] Team_015 possession (Score: 0-0)
Scottie Gasol attempts a Midrange. Contested by James Wall (2.7 feet, MAN). SCOTTIE GASOL MAKES IT! Assist: Manu Anthony
Score: 2-0

[10:52] Team_029 possession (Score: 2-0)
Giannis Banchero attempts a 3Pt. Contested by CJ Banchero (4.8 feet, MAN). Giannis Banchero misses. Rebound secured by CJ Banchero.

[10:37] Team_015 possession (Score: 2-0)
Michael Simmons drives to the basket... Michael Simmons throws a bad pass! Stolen by Scottie Bird! TURNOVER! (live ball)

[10:23] Team_029 possession (Score: 2-0)
Devin Butler attempts a Layup. Contested by Scottie Gasol (3.9 feet, ZONE). DEVIN BUTLER MAKES IT!
Score: 2-2

[10:08] Team_015 possession (Score: 2-2)
Scottie Gasol attempts a Dunk. BLOCKED BY JAMES WALL! Ball is loose! Rebound secured by Devin Butler.

[09:53] Team_029 possession (Score: 2-2)
Paul Iverson attempts a 3Pt. Contested by CJ Banchero (4.4 feet, ZONE). Paul Iverson misses. Rebound secured by Michael Simmons.

[09:41] Team_015 possession (Score: 2-2)
Michael Simmons makes the Dunk and draws the foul on Giannis Banchero! And-1! Michael Simmons to the line for 1. [Team fouls: 1] (Giannis Banchero: 1 personal fouls)   FT 1/1: MISS Michael Simmons makes 0/1 from the line. Rebound secured by Devin Butler.
Score: 4-2

[09:25] Team_029 possession (Score: 4-2)
James Wall attempts a 3Pt. Contested by Manu Anthony (4.2 feet, ZONE). James Wall misses. Rebound secured by Michael Simmons.

[09:11] Team_015 possession (Score: 4-2)
Michael Simmons drives to the basket... Michael Simmons throws a bad pass out of bounds! TURNOVER! (dead ball)

[08:57] Team_029 possession (Score: 4-2)
Devin Butler attempts a Layup. BLOCKED BY SCOTTIE GASOL! Ball is loose! Rebound secured by CJ Banchero.

[08:41] Team_015 possession (Score: 4-2)
Michael Simmons drives to the basket... Michael Simmons loses the ball! Stripped by James Wall! TURNOVER! (live ball)

[08:25] Team_029 possession (Score: 4-2)
Giannis Banchero attempts a 3Pt. Contested by CJ Banchero (4.8 feet, MAN). GIANNIS BANCHERO MAKES IT! Assist: Paul Iverson
Score: 4-5

[08:14] Team_015 possession (Score: 4-5)
FOUL! Reach-in foul on Devin Butler during the drive. [Team fouls: 2] No free throws, side out. (Devin Butler: 1 personal fouls)

[08:00] Team_015 possession (Score: 4-5)
CJ Banchero attempts a Midrange. Contested by Scottie Bird (2.9 feet, ZONE). CJ BANCHERO MAKES IT! Assist: Michael Simmons
Score: 6-5

[07:49] Team_029 possession (Score: 6-5)
Giannis Banchero drives and kicks out. James Wall attempts a Midrange. Contested by Scottie Gasol (3.4 feet, MAN). James Wall misses. Offensive rebound by Devin Butler! Devin Butler kicks it out.

[07:40] Team_029 possession (Score: 6-5)
Giannis Banchero attempts a Midrange. Contested by Manu Anthony (4.2 feet, ZONE). GIANNIS BANCHERO MAKES IT! Assist: Scottie Bird
Score: 6-7

[07:24] Team_015 possession (Score: 6-7)
Manu Anthony makes the Dunk and draws the foul on James Wall! And-1! Manu Anthony to the line for 1. [Team fouls: 3] (James Wall: 1 personal fouls)   FT 1/1: GOOD Manu Anthony makes 1/1 from the line.
Score: 9-7

[07:05] Team_029 possession (Score: 9-7)
FOUL! Holding foul on CJ Banchero. [Team fouls: 1] No free throws, side out. (CJ Banchero: 1 personal fouls)

[06:50] Team_029 possession (Score: 9-7)
James Wall attempts a 3Pt. Contested by Scottie Gasol (4.0 feet, MAN). James Wall misses. Rebound secured by CJ Banchero.

[06:34] Team_015 possession (Score: 9-7)
Manu Anthony attempts a 3Pt. Contested by Giannis Banchero (3.8 feet, ZONE). Manu Anthony misses. FOUL! Loose ball foul on Giannis Banchero during the rebound battle. [Team fouls: 4] No free throws, side out. (Giannis Banchero: 2 personal fouls)

[06:19] Team_015 possession (Score: 9-7)
Manu Anthony attempts a Layup. Contested by Paul Iverson (4.6 feet, MAN). MANU ANTHONY MAKES IT! Assist: Trae Turner
Score: 11-7

[06:04] Team_029 possession (Score: 11-7)
Paul Iverson attempts a 3Pt. Contested by Manu Anthony (3.9 feet, ZONE). Paul Iverson misses. Rebound secured by Trae Turner.

[05:46] Team_015 possession (Score: 11-7)
Trae Turner makes the Midrange and draws the foul on Devin Butler! And-1! Trae Turner to the line for 1. [BONUS: 5 team fouls] (Devin Butler: 2 personal fouls)   FT 1/1: MISS Trae Turner makes 0/1 from the line. Rebound secured by Giannis Banchero.
Score: 13-7

[05:35] Team_029 possession (Score: 13-7)
James Wall attempts a Layup. BLOCKED BY SCOTTIE GASOL! Ball deflects out of bounds off James Wall.

[05:20] Team_015 possession (Score: 13-7)
FOUL! Holding foul on Giannis Banchero. [IN THE BONUS! 6 team fouls] CJ Banchero to the line for 2 free throws. (Giannis Banchero: 3 personal fouls)   FT 1/2: GOOD   FT 2/2: GOOD CJ Banchero makes 2/2 from the line.
Score: 15-7

[05:03] Team_029 possession (Score: 15-7)
Devin Butler attempts a Midrange. Contested by Trae Turner (4.1 feet, MAN). Devin Butler misses. Rebound secured by Trae Turner.

[04:50] Team_015 possession (Score: 15-7)
Michael Simmons drives, Scottie Bird stays with him. Michael Simmons attempts a Dunk. Contested by Scottie Bird (3.2 feet, MAN). MICHAEL SIMMONS MAKES IT! Assist: Trae Turner
Score: 17-7

[04:41] Team_029 possession (Score: 17-7)
Devin Butler attempts a Midrange. Contested by Trae Turner (4.2 feet, MAN). Devin Butler misses. Rebound secured by Michael Simmons.

[04:29] Team_015 possession (Score: 17-7)
Trae Turner attempts a Layup. Contested by James Wall (2.8 feet, ZONE). Trae Turner misses. Offensive rebound by Trae Turner! Trae Turner kicks it out.

[04:17] Team_015 possession (Score: 17-7)
CJ Banchero drives and kicks out. Trae Turner attempts a 3Pt. Contested by Giannis Banchero (3.7 feet, ZONE). Trae Turner misses. Offensive rebound by Trae Turner! Trae Turner kicks it out.

[04:03] Team_015 possession (Score: 17-7)
FOUL! Reach-in foul on James Wall during the drive. [IN THE BONUS! 7 team fouls] Scottie Gasol to the line for 2 free throws. (James Wall: 2 personal fouls)   FT 1/2: GOOD   FT 2/2: GOOD Scottie Gasol makes 2/2 from the line.
Score: 19-7

[03:49] Team_029 possession (Score: 19-7)
Scottie Bird drives to the basket... Scottie Bird throws a bad pass! Stolen by Michael Simmons! TURNOVER! (live ball)

[03:37] Team_015 possession (Score: 19-7)
Trae Turner drives, picks up Devin Butler. Help arrives from Scottie Bird! Trae Turner attempts a Layup. Contested by Scottie Bird (4.4 feet, MAN). TRAE TURNER MAKES IT! Assist: Manu Anthony
Score: 21-7

[03:19] Team_029 possession (Score: 21-7)
Scottie Bird attempts a Midrange. Contested by Michael Simmons (3.8 feet, ZONE). Scottie Bird misses. Rebound secured by Michael Simmons.

[03:04] Team_015 possession (Score: 21-7)
Michael Simmons attempts a 3Pt. Contested by Scottie Bird (3.4 feet, MAN). Michael Simmons misses. Rebound secured by Devin Butler.

[02:50] Team_029 possession (Score: 21-7)
Paul Iverson attempts a Layup. Contested by Scottie Gasol (3.9 feet, ZONE). Paul Iverson misses. Offensive rebound by Devin Butler! Devin Butler kicks it out.

[02:37] Team_029 possession (Score: 21-7)
Giannis Banchero attempts a 3Pt. Contested by CJ Banchero (5.0 feet, MAN). Giannis Banchero misses. Rebound secured by Trae Turner.

[02:25] Team_015 possession (Score: 21-7)
Scottie Gasol drives, James Wall stays with him. Scottie Gasol attempts a Layup. Contested by James Wall (2.9 feet, MAN). SCOTTIE GASOL MAKES IT! Assist: CJ Banchero
Score: 23-7

[02:12] Team_029 possession (Score: 23-7)
Giannis Banchero attempts a 3Pt. Contested by CJ Banchero (5.1 feet, MAN). Giannis Banchero misses. Offensive rebound by Devin Butler! Devin Butler kicks it out.

[02:01] Team_029 possession (Score: 23-7)
Giannis Banchero loses control! Ball rolls out of bounds! TURNOVER! (dead ball)

[02:01] Substitution (Team_015): Manu Anthony OUT → Dwyane Sabonis IN (stamina_rule2)

[02:01] Substitution (Team_015): Michael Simmons OUT → Paolo Jokic IN (stamina_rule2)

[02:01] Substitution (Team_015): CJ Banchero OUT → Magic Wagner IN (stamina_rule2)

[02:01] Substitution (Team_015): Scottie Gasol OUT → Rudy Paul IN (stamina_rule2)

[02:01] Substitution (Team_015): Trae Turner OUT → Allen Curry IN (stamina_rule2)

[02:01] Substitution (Team_029): Paul Iverson OUT → Immanuel Irving IN (stamina_rule2)

[02:01] Substitution (Team_029): Scottie Bird OUT → Bones Carter IN (stamina_rule2)

[02:01] Substitution (Team_029): Giannis Banchero OUT → Pau Anthony IN (stamina_rule2)

[02:01] Substitution (Team_029): James Wall OUT → Derrick Rozier IN (stamina_rule2)

[02:01] Substitution (Team_029): Devin Butler OUT → Shai Ball IN (stamina_rule2)

[01:48] Team_015 possession (Score: 23-7)
Rudy Paul attempts a 3Pt. Contested by Derrick Rozier (4.4 feet, MAN). Rudy Paul misses. Rebound secured by Derrick Rozier.

[01:33] Team_029 possession (Score: 23-7)
Derrick Rozier attempts a Midrange. Contested by Paolo Jokic (5.9 feet, ZONE). Derrick Rozier misses. Rebound secured by Magic Wagner.

[01:15] Team_015 possession (Score: 23-7)
FOUL! Reach-in foul on Derrick Rozier during the drive. [IN THE BONUS! 8 team fouls] Rudy Paul to the line for 2 free throws. (Derrick Rozier: 1 personal fouls)   FT 1/2: GOOD   FT 2/2: GOOD Rudy Paul makes 2/2 from the line.
Score: 25-7

[01:05] Team_029 possession (Score: 25-7)
Pau Anthony attempts a 3Pt. Contested by Magic Wagner (5.7 feet, MAN). PAU ANTHONY MAKES IT! Assist: Derrick Rozier
Score: 25-10

[00:53] Team_015 possession (Score: 25-10)
Rudy Paul attempts a Midrange. Contested by Bones Carter (6.0 feet, ZONE). Rudy Paul misses. Rebound secured by Derrick Rozier.

[00:36] Team_029 possession (Score: 25-10)
Derrick Rozier throws a bad pass out of bounds! TURNOVER! (dead ball)

[00:22] Team_015 possession (Score: 25-10)
Rudy Paul attempts a 3Pt. Contested by Pau Anthony (4.2 feet, ZONE). RUDY PAUL MAKES IT! Assist: Magic Wagner
Score: 28-10

[00:10] Team_029 possession (Score: 28-10)
Shai Ball attempts a 3Pt. Contested by Rudy Paul (3.6 feet, ZONE). SHAI BALL MAKES IT! Assist: Immanuel Irving
Score: 28-13

================================================================================
                              1ST QUARTER COMPLETE                              
================================================================================

1ST QUARTER SCORE: Team_015 28, Team_029 13

BOX SCORE:
================================================================================

Team_015
--------------------------------------------------------------------------------
Player                MIN  PTS  REB  AST  TO      FG   FG%      3P   3P%
--------------------------------------------------------------------------------
Scottie Gasol          10    6    0    0   0   3/4    75.0     0/0   0.0
Manu Anthony           10    5    0    2   0   2/2   100.0     0/0   0.0
Rudy Paul               2    5    0    0   0   2/4    50.0     0/0   0.0
CJ Banchero            10    4    5    1   0   2/2   100.0     0/0   0.0
Michael Simmons        10    2    5    1   0   1/4    25.0     0/0   0.0
Trae Turner            10    2    5    2   0   1/2    50.0     0/0   0.0
Magic Wagner            2    0    1    1   0   0/0     0.0     0/0   0.0

TEAM: FG: 11/18 (61.1%), 3PT: 1/4 (25.0%), REB: 15 (3 off, 12 def), AST: 7, TO: 4
TEAM FOULS: 1


Team_029
--------------------------------------------------------------------------------
Player                MIN  PTS  REB  AST  TO      FG   FG%      3P   3P%
--------------------------------------------------------------------------------
Giannis Banchero       10    5    1    0   0   2/5    40.0     0/0   0.0
Pau Anthony             2    3    0    0   0   1/1   100.0     0/0   0.0
Shai Ball               2    3    0    0   0   1/1   100.0     0/0   0.0
Devin Butler           10    2    7    0   0   1/5    20.0     0/0   0.0
Paul Iverson           10    0    0    1   0   0/2     0.0     0/0   0.0
James Wall             10    0    0    0   0   0/3     0.0     0/0   0.0
Scottie Bird           10    0    0    1   0   0/1     0.0     0/0   0.0
Derrick Rozier          2    0    2    1   0   0/1     0.0     0/0   0.0
Immanuel Irving         2    0    0    1   0   0/0     0.0     0/0   0.0

TEAM: FG: 5/19 (26.3%), 3PT: 3/10 (30.0%), REB: 11 (4 off, 7 def), AST: 4, TO: 3
TEAM FOULS: 8 [Team_015 in BONUS]

================================================================================

================================================================================
                       2ND QUARTER - Team_015 vs Team_029                       
================================================================================

[12:00] Team_015 possession (Score: 28-13)
Manu Anthony throws a bad pass! Stolen by Paul Iverson! TURNOVER! (live ball)

[11:44] Team_029 possession (Score: 28-13)
James Wall attempts a Midrange. Contested by Scottie Gasol (4.1 feet, MAN). JAMES WALL MAKES IT!
Score: 28-15

[11:25] Team_015 possession (Score: 28-15)
CJ Banchero attempts a Midrange. Contested by Giannis Banchero (3.5 feet, ZONE). CJ Banchero misses. Rebound secured by Giannis Banchero.

[11:13] Team_029 possession (Score: 28-15)
Scottie Bird drives and kicks out. James Wall attempts a 3Pt. Contested by Manu Anthony (3.7 feet, ZONE). JAMES WALL MAKES IT! Assist: Paul Iverson
Score: 28-18

[11:02] Team_015 possession (Score: 28-18)
Manu Anthony attempts a 3Pt. Contested by Giannis Banchero (4.0 feet, ZONE). Manu Anthony misses. FOUL! Loose ball foul on James Wall during the rebound battle. [Team fouls: 1] No free throws, side out. (James Wall: 1 personal fouls)

[10:51] Team_015 possession (Score: 28-18)
Scottie Gasol attempts a 3Pt. Contested by Giannis Banchero (3.8 feet, ZONE). Scottie Gasol misses. FOUL! Loose ball foul on Giannis Banchero during the rebound battle. [Team fouls: 2] No free throws, side out. (Giannis Banchero: 1 personal fouls)

[10:36] Team_015 possession (Score: 28-18)
Scottie Gasol drives, picks up James Wall. Help arrives from Scottie Bird! Scottie Gasol attempts a Layup. Contested by Scottie Bird (2.8 feet, ZONE). SCOTTIE GASOL MAKES IT! Assist: Michael Simmons
Score: 30-18

[10:22] Team_029 possession (Score: 30-18)
Scottie Bird drives, picks up Scottie Gasol. Help arrives from Michael Simmons! Scottie Bird attempts a Dunk. Contested by Michael Simmons (4.0 feet, ZONE). SCOTTIE BIRD MAKES IT! Assist: James Wall
Score: 30-20

[10:06] Team_015 possession (Score: 30-20)
Trae Turner drives, Devin Butler stays with him. Trae Turner attempts a Layup. Contested by Devin Butler (4.5 feet, MAN). Trae Turner misses. Rebound secured by Devin Butler.

[09:53] Team_029 possession (Score: 30-20)
Scottie Bird attempts a Midrange. Contested by Michael Simmons (3.9 feet, MAN). Scottie Bird misses. Rebound secured by CJ Banchero.

[09:42] Team_015 possession (Score: 30-20)
Scottie Gasol attempts a Midrange. Contested by Scottie Bird (3.5 feet, ZONE). Scottie Gasol misses. Offensive rebound by CJ Banchero! CJ Banchero kicks it out.

[09:29] Team_015 possession (Score: 30-20)
Michael Simmons attempts a 3Pt. Contested by Paul Iverson (4.6 feet, ZONE). MICHAEL SIMMONS MAKES IT! Assist: Scottie Gasol
Score: 33-20

[09:12] Team_029 possession (Score: 33-20)
Devin Butler attempts a Layup. Contested by Trae Turner (4.5 feet, MAN). Devin Butler misses. Rebound secured by CJ Banchero.

[08:59] Team_015 possession (Score: 33-20)
FOUL! Shooting foul on Devin Butler. Trae Turner to the line for 2 free throws. [Team fouls: 3] (Devin Butler: 1 personal fouls)   FT 1/2: GOOD   FT 2/2: GOOD Trae Turner makes 2/2 from the line.
Score: 35-20

[08:47] Team_029 possession (Score: 35-20)
Giannis Banchero attempts a 3Pt. Contested by Manu Anthony (4.5 feet, ZONE). Giannis Banchero misses. Rebound secured by Michael Simmons.

[08:33] Team_015 possession (Score: 35-20)
Manu Anthony attempts a 3Pt. Contested by Paul Iverson (4.9 feet, MAN). Manu Anthony misses. FOUL! Loose ball foul on James Wall during the rebound battle. [Team fouls: 4] No free throws, side out. (James Wall: 2 personal fouls)

[08:14] Team_015 possession (Score: 35-20)
Trae Turner attempts a Layup. Contested by Devin Butler (4.7 feet, MAN). TRAE TURNER MAKES IT!
Score: 37-20

[08:02] Team_029 possession (Score: 37-20)
James Wall attempts a 3Pt. Contested by Manu Anthony (4.6 feet, ZONE). James Wall misses. Rebound secured by Trae Turner.

[07:47] Team_015 possession (Score: 37-20)
Trae Turner attempts a 3Pt. Contested by Giannis Banchero (4.3 feet, ZONE). Trae Turner misses. Rebound secured by Giannis Banchero.

[07:30] Team_029 possession (Score: 37-20)
James Wall attempts a 3Pt. Contested by Scottie Gasol (4.6 feet, MAN). JAMES WALL MAKES IT!
Score: 37-23

[07:16] Team_015 possession (Score: 37-23)
Michael Simmons attempts a 3Pt. Contested by Scottie Bird (3.8 feet, MAN). Michael Simmons misses. Offensive rebound by CJ Banchero! CJ Banchero kicks it out.

[07:01] Team_015 possession (Score: 37-23)
Manu Anthony attempts a 3Pt. Contested by Paul Iverson (5.1 feet, MAN). Manu Anthony misses. FOUL! Loose ball foul on Giannis Banchero during the rebound battle. [IN THE BONUS! 5 team fouls] Michael Simmons to the line for 2 free throws. (Giannis Banchero: 2 personal fouls)   FT 1/2: MISS   FT 2/2: GOOD Michael Simmons makes 1/2 from the line.
Score: 38-23

[06:45] Team_029 possession (Score: 38-23)
Paul Iverson attempts a 3Pt. Contested by Manu Anthony (4.4 feet, ZONE). PAUL IVERSON MAKES IT! Assist: Scottie Bird
Score: 38-26

[06:26] Team_015 possession (Score: 38-26)
Michael Simmons attempts a Midrange. Contested by Devin Butler (4.8 feet, ZONE). MICHAEL SIMMONS MAKES IT!
Score: 40-26

[06:13] Team_029 possession (Score: 40-26)
FOUL! Reach-in foul on Trae Turner during the drive. [Team fouls: 1] No free throws, side out. (Trae Turner: 1 personal fouls)

[05:58] Team_029 possession (Score: 40-26)
Scottie Bird attempts a Midrange. Contested by Michael Simmons (4.4 feet, MAN). Scottie Bird misses. Rebound secured by Scottie Gasol.

[05:41] Team_015 possession (Score: 40-26)
Scottie Gasol attempts a Midrange. Contested by James Wall (3.4 feet, MAN). SCOTTIE GASOL MAKES IT! Assist: CJ Banchero
Score: 42-26

[05:28] Team_029 possession (Score: 42-26)
Giannis Banchero makes the Midrange and draws the foul on CJ Banchero! And-1! Giannis Banchero to the line for 1. [Team fouls: 2] (CJ Banchero: 1 personal fouls)   FT 1/1: GOOD Giannis Banchero makes 1/1 from the line.
Score: 42-29

[05:14] Team_015 possession (Score: 42-29)
Michael Simmons makes the Dunk and draws the foul on Scottie Bird! And-1! Michael Simmons to the line for 1. [BONUS: 6 team fouls] (Scottie Bird: 1 personal fouls)   FT 1/1: GOOD Michael Simmons makes 1/1 from the line.
Score: 45-29

[04:58] Team_029 possession (Score: 45-29)
Paul Iverson throws a bad pass out of bounds! TURNOVER! (dead ball)

[04:58] Substitution (Team_015): Manu Anthony OUT → Dwyane Sabonis IN (stamina_rule2)

[04:58] Substitution (Team_015): Michael Simmons OUT → Paolo Jokic IN (stamina_rule2)

[04:58] Substitution (Team_015): CJ Banchero OUT → Magic Wagner IN (stamina_rule2)

[04:58] Substitution (Team_015): Scottie Gasol OUT → Rudy Paul IN (stamina_rule2)

[04:58] Substitution (Team_015): Trae Turner OUT → Allen Curry IN (stamina_rule2)

[04:58] Substitution (Team_029): Paul Iverson OUT → Immanuel Irving IN (stamina_rule2)

[04:58] Substitution (Team_029): Scottie Bird OUT → Bones Carter IN (stamina_rule2)

[04:58] Substitution (Team_029): Giannis Banchero OUT → Pau Anthony IN (stamina_rule2)

[04:58] Substitution (Team_029): James Wall OUT → Derrick Rozier IN (stamina_rule2)

[04:58] Substitution (Team_029): Devin Butler OUT → Shai Ball IN (stamina_rule2)

[04:48] Team_015 possession (Score: 45-29)
Paolo Jokic attempts a 3Pt. Contested by Pau Anthony (4.2 feet, ZONE). Paolo Jokic misses. Rebound secured by Pau Anthony.

[04:33] Team_029 possession (Score: 45-29)
Derrick Rozier attempts a Midrange. Contested by Rudy Paul (3.5 feet, ZONE). DERRICK ROZIER MAKES IT! Assist: Immanuel Irving
Score: 45-31

[04:20] Team_015 possession (Score: 45-31)
Magic Wagner attempts a Midrange. Contested by Pau Anthony (3.7 feet, MAN). Magic Wagner misses. Offensive rebound by Rudy Paul! Rudy Paul puts it back in!
Score: 47-31

[04:09] Team_029 possession (Score: 47-31)
Derrick Rozier attempts a Layup. BLOCKED BY RUDY PAUL! Ball is loose! Offensive rebound by Pau Anthony! Pau Anthony kicks it out.

[03:57] Team_029 possession (Score: 47-31)
Shai Ball attempts a Layup. Contested by Rudy Paul (3.6 feet, MAN). Shai Ball misses. Rebound secured by Allen Curry.

[03:41] Team_015 possession (Score: 47-31)
Dwyane Sabonis drives and kicks out. Magic Wagner makes the Midrange and draws the foul on Pau Anthony! And-1! Magic Wagner to the line for 1. [BONUS: 7 team fouls] (Pau Anthony: 1 personal fouls)   FT 1/1: GOOD Magic Wagner makes 1/1 from the line.
Score: 50-31

[03:31] Team_029 possession (Score: 50-31)
Bones Carter makes the Layup and draws the foul on Paolo Jokic! And-1! Bones Carter to the line for 1. [Team fouls: 3] (Paolo Jokic: 1 personal fouls)   FT 1/1: MISS Bones Carter makes 0/1 from the line. Rebound secured by Rudy Paul.
Score: 50-33

[03:17] Team_015 possession (Score: 50-33)
Paolo Jokic attempts a 3Pt. Contested by Pau Anthony (4.2 feet, ZONE). PAOLO JOKIC MAKES IT! Assist: Allen Curry
Score: 53-33

[03:03] Team_029 possession (Score: 53-33)
Immanuel Irving attempts a 3Pt. Contested by Rudy Paul (3.8 feet, ZONE). IMMANUEL IRVING MAKES IT!
Score: 53-36

[02:48] Team_015 possession (Score: 53-36)
Magic Wagner attempts a Layup. Contested by Pau Anthony (3.7 feet, MAN). Magic Wagner misses. Rebound secured by Shai Ball.

[02:31] Team_029 possession (Score: 53-36)
Immanuel Irving attempts a Midrange. Contested by Dwyane Sabonis (5.4 feet, MAN). IMMANUEL IRVING MAKES IT! Assist: Derrick Rozier
Score: 53-38

[02:15] Team_015 possession (Score: 53-38)
Rudy Paul attempts a 3Pt. Contested by Derrick Rozier (4.4 feet, MAN). Rudy Paul misses. Offensive rebound by Allen Curry! Allen Curry puts it back in!
Score: 55-38

[02:02] Team_029 possession (Score: 55-38)
Immanuel Irving drives and kicks out. Pau Anthony attempts a 3Pt. Contested by Rudy Paul (3.2 feet, ZONE). Pau Anthony misses. Offensive rebound by Derrick Rozier! Derrick Rozier kicks it out.

[01:44] Team_029 possession (Score: 55-38)
Derrick Rozier attempts a 3Pt. Contested by Rudy Paul (3.5 feet, ZONE). Derrick Rozier misses. Rebound secured by Rudy Paul.

[01:24] Team_015 possession (Score: 55-38)
Dwyane Sabonis attempts a 3Pt. Contested by Immanuel Irving (5.3 feet, MAN). Dwyane Sabonis misses. Rebound secured by Derrick Rozier.

[01:05] Team_029 possession (Score: 55-38)
Derrick Rozier attempts a Layup. Contested by Rudy Paul (3.5 feet, MAN). Derrick Rozier misses. Offensive rebound by Pau Anthony! Pau Anthony kicks it out.

[00:50] Team_029 possession (Score: 55-38)
Shai Ball attempts a Layup. Contested by Rudy Paul (3.6 feet, MAN). SHAI BALL MAKES IT! Assist: Bones Carter
Score: 55-40

[00:35] Team_015 possession (Score: 55-40)
Rudy Paul attempts a 3Pt. BLOCKED BY DERRICK ROZIER! Ball deflects out of bounds off Rudy Paul.

[00:21] Team_029 possession (Score: 55-40)
Immanuel Irving drives, Dwyane Sabonis stays with him. Immanuel Irving attempts a Layup. Contested by Dwyane Sabonis (5.4 feet, MAN). IMMANUEL IRVING MAKES IT! Assist: Pau Anthony
Score: 55-42

[00:10] Team_015 possession (Score: 55-42)
Paolo Jokic attempts a 3Pt. Wide open! Bones Carter is 6.0 feet away. [MAN] PAOLO JOKIC MAKES IT! Assist: Rudy Paul
Score: 58-42

================================================================================
                              2ND QUARTER COMPLETE                              
================================================================================

2ND QUARTER SCORE: Team_015 30, Team_029 29

BOX SCORE:
================================================================================

Team_015
--------------------------------------------------------------------------------
Player                MIN  PTS  REB  AST  TO      FG   FG%      3P   3P%
--------------------------------------------------------------------------------
Michael Simmons        17    9    2    1   0   4/4   100.0     0/0   0.0
Paolo Jokic             7    6    0    0   0   2/3    66.7     0/0   0.0
Trae Turner            17    4    2    0   0   2/4    50.0     0/0   0.0
Scottie Gasol          17    4    1    1   0   2/2   100.0     0/0   0.0
Magic Wagner            7    3    0    0   0   1/2    50.0     0/0   0.0
Rudy Paul               7    2    3    1   0   1/2    50.0     0/0   0.0
Allen Curry             7    2    2    1   0   1/1   100.0     0/0   0.0
CJ Banchero            17    0    5    1   0   0/1     0.0     0/0   0.0
Dwyane Sabonis          7    0    0    0   0   0/1     0.0     0/0   0.0

TEAM: FG: 13/20 (65.0%), 3PT: 5/9 (55.6%), REB: 15 (7 off, 8 def), AST: 5, TO: 1
TEAM FOULS: 3


Team_029
--------------------------------------------------------------------------------
Player                MIN  PTS  REB  AST  TO      FG   FG%      3P   3P%
--------------------------------------------------------------------------------
James Wall             17    8    0    1   0   3/4    75.0     0/0   0.0
Immanuel Irving         7    7    0    1   0   3/3   100.0     0/0   0.0
Giannis Banchero       17    3    2    0   0   1/2    50.0     0/0   0.0
Paul Iverson           17    3    0    1   0   1/1   100.0     0/0   0.0
Scottie Bird           17    2    0    1   0   1/3    33.3     0/0   0.0
Derrick Rozier          7    2    2    1   0   1/2    50.0     0/0   0.0
Shai Ball               7    2    1    0   0   1/2    50.0     0/0   0.0
Devin Butler           17    0    1    0   0   0/1     0.0     0/0   0.0
Pau Anthony             7    0    3    1   0   0/0     0.0     0/0   0.0
Bones Carter            7    0    0    1   0   0/1     0.0     0/0   0.0

TEAM: FG: 11/19 (57.9%), 3PT: 3/6 (50.0%), REB: 9 (3 off, 6 def), AST: 7, TO: 1
TEAM FOULS: 7 [Team_015 in BONUS]

================================================================================

================================================================================
                       3RD QUARTER - Team_015 vs Team_029                       
================================================================================

[12:00] Team_015 possession (Score: 58-42)
FOUL! Holding foul on James Wall. [Team fouls: 1] No free throws, side out. (James Wall: 1 personal fouls)

[11:44] Team_015 possession (Score: 58-42)
Manu Anthony attempts a Layup. Contested by James Wall (2.9 feet, ZONE). Manu Anthony misses. Rebound secured by Devin Butler.

[11:33] Team_029 possession (Score: 58-42)
James Wall throws a bad pass! Stolen by Scottie Gasol! TURNOVER! (live ball)

[11:18] Team_015 possession (Score: 58-42)
Manu Anthony attempts a 3Pt. BLOCKED BY JAMES WALL! Ball is loose! Offensive rebound by Trae Turner! Trae Turner kicks it out.

[11:03] Team_015 possession (Score: 58-42)
FOUL! Holding foul on Devin Butler. [Team fouls: 3] No free throws, side out. (Devin Butler: 2 personal fouls)

[10:50] Team_015 possession (Score: 58-42)
FOUL! Reach-in foul on Devin Butler during the drive. [Team fouls: 4] No free throws, side out. (Devin Butler: 3 personal fouls)

[10:37] Team_015 possession (Score: 58-42)
Manu Anthony drives, picks up James Wall. Help arrives from Scottie Bird! Manu Anthony attempts a Layup. Contested by Scottie Bird (2.9 feet, ZONE). Manu Anthony misses. Offensive rebound by Trae Turner! Trae Turner puts it back in!
Score: 60-42

[10:26] Team_029 possession (Score: 60-42)
Giannis Banchero attempts a Layup. BLOCKED BY SCOTTIE GASOL! Ball deflects out of bounds off Giannis Banchero.

[10:12] Team_015 possession (Score: 60-42)
CJ Banchero makes the Layup and draws the foul on Scottie Bird! And-1! CJ Banchero to the line for 1. [BONUS: 5 team fouls] (Scottie Bird: 1 personal fouls)   FT 1/1: GOOD CJ Banchero makes 1/1 from the line.
Score: 63-42

[09:57] Team_029 possession (Score: 63-42)
Giannis Banchero attempts a Layup. Contested by Scottie Gasol (4.0 feet, ZONE). GIANNIS BANCHERO MAKES IT! Assist: Paul Iverson
Score: 63-44

[09:40] Team_015 possession (Score: 63-44)
Manu Anthony attempts a Layup. BLOCKED BY PAUL IVERSON! Ball is loose! Offensive rebound by CJ Banchero! CJ Banchero kicks it out.

[09:26] Team_015 possession (Score: 63-44)
Trae Turner throws a bad pass out of bounds! TURNOVER! (dead ball)

[09:11] Team_029 possession (Score: 63-44)
FOUL! Shooting foul on Michael Simmons. Paul Iverson to the line for 2 free throws. [Team fouls: 1] (Michael Simmons: 1 personal fouls)   FT 1/2: GOOD   FT 2/2: GOOD Paul Iverson makes 2/2 from the line.
Score: 63-46

[08:58] Team_015 possession (Score: 63-46)
Michael Simmons attempts a 3Pt. Contested by Paul Iverson (4.3 feet, ZONE). MICHAEL SIMMONS MAKES IT! Assist: CJ Banchero
Score: 66-46

[08:40] Team_029 possession (Score: 66-46)
FOUL! Holding foul on Trae Turner. [Team fouls: 2] No free throws, side out. (Trae Turner: 1 personal fouls)

[08:22] Team_029 possession (Score: 66-46)
Giannis Banchero attempts a Midrange. Contested by CJ Banchero (4.8 feet, ZONE). Giannis Banchero misses. Rebound secured by Trae Turner.

[08:08] Team_015 possession (Score: 66-46)
CJ Banchero attempts a Layup. Contested by Giannis Banchero (3.4 feet, MAN). CJ BANCHERO MAKES IT! Assist: Trae Turner
Score: 68-46

[07:53] Team_029 possession (Score: 68-46)
James Wall drives and kicks out. Paul Iverson attempts a Midrange. Contested by Manu Anthony (3.6 feet, MAN). Paul Iverson misses. Rebound secured by Michael Simmons.

[07:41] Team_015 possession (Score: 68-46)
FOUL! Reach-in foul on Paul Iverson during the drive. [IN THE BONUS! 7 team fouls] Manu Anthony to the line for 2 free throws. (Paul Iverson: 1 personal fouls)   FT 1/2: GOOD   FT 2/2: GOOD Manu Anthony makes 2/2 from the line.
Score: 70-46

[07:24] Team_029 possession (Score: 70-46)
Paul Iverson attempts a 3Pt. Contested by Manu Anthony (3.9 feet, MAN). Paul Iverson misses. Rebound secured by Trae Turner.

[07:10] Team_015 possession (Score: 70-46)
Michael Simmons attempts a Midrange. Contested by Scottie Bird (3.1 feet, MAN). MICHAEL SIMMONS MAKES IT! Assist: Scottie Gasol
Score: 72-46

[06:55] Team_029 possession (Score: 72-46)
Scottie Bird drives, Michael Simmons stays with him. Scottie Bird attempts a Layup. Contested by Michael Simmons (3.6 feet, MAN). Scottie Bird misses. Rebound secured by Michael Simmons.

[06:42] Team_015 possession (Score: 72-46)
Manu Anthony attempts a 3Pt. Contested by Giannis Banchero (3.8 feet, ZONE). Manu Anthony misses. Rebound secured by Giannis Banchero.

[06:28] Team_029 possession (Score: 72-46)
Devin Butler attempts a 3Pt. Contested by Trae Turner (4.1 feet, MAN). Devin Butler misses. Rebound secured by CJ Banchero.

[06:10] Team_015 possession (Score: 72-46)
Trae Turner attempts a Layup. Contested by Devin Butler (4.2 feet, MAN). Trae Turner misses. Offensive rebound by CJ Banchero! CJ Banchero puts it back in!
Score: 74-46

[05:59] Team_029 possession (Score: 74-46)
James Wall drives and kicks out. Scottie Bird attempts a 3Pt. Contested by Manu Anthony (3.6 feet, ZONE). Scottie Bird misses. Rebound secured by Michael Simmons.

[05:48] Team_015 possession (Score: 74-46)
Manu Anthony attempts a Layup. BLOCKED BY JAMES WALL! Ball deflects out of bounds off Manu Anthony.

[05:29] Team_029 possession (Score: 74-46)
Devin Butler attempts a Midrange. Contested by Trae Turner (4.1 feet, MAN). Devin Butler misses. Offensive rebound by James Wall! James Wall puts it back in!
Score: 74-48

[05:19] Team_015 possession (Score: 74-48)
Michael Simmons attempts a 3Pt. Contested by Scottie Bird (3.1 feet, MAN). Michael Simmons misses. Rebound secured by Giannis Banchero.

[05:04] Team_029 possession (Score: 74-48)
James Wall attempts a 3Pt. Contested by Scottie Gasol (4.0 feet, MAN). JAMES WALL MAKES IT! Assist: Scottie Bird
Score: 74-51

[04:44] Team_015 possession (Score: 74-51)
Trae Turner drives to the basket... Trae Turner commits a violation (traveling/carry)! TURNOVER! (dead ball)

[04:29] Team_029 possession (Score: 74-51)
Giannis Banchero commits a violation (traveling/carry)! TURNOVER! (dead ball)

[04:14] Team_015 possession (Score: 74-51)
Manu Anthony attempts a Layup. Contested by Paul Iverson (4.6 feet, MAN). MANU ANTHONY MAKES IT! Assist: CJ Banchero
Score: 76-51

[04:00] Team_029 possession (Score: 76-51)
Paul Iverson attempts a Layup. Contested by Scottie Gasol (3.8 feet, ZONE). PAUL IVERSON MAKES IT!
Score: 76-53

[03:45] Team_015 possession (Score: 76-53)
CJ Banchero makes the 3Pt and draws the foul on Giannis Banchero! And-1! CJ Banchero to the line for 1. [BONUS: 8 team fouls] (Giannis Banchero: 1 personal fouls)   FT 1/1: GOOD CJ Banchero makes 1/1 from the line.
Score: 80-53

[03:28] Team_029 possession (Score: 80-53)
Devin Butler attempts a Midrange. Contested by Trae Turner (4.3 feet, MAN). Devin Butler misses. Offensive rebound by Devin Butler! Devin Butler kicks it out.

[03:16] Team_029 possession (Score: 80-53)
Devin Butler attempts a Layup. BLOCKED BY TRAE TURNER! Ball is loose! Rebound secured by Trae Turner.

[03:02] Team_015 possession (Score: 80-53)
Manu Anthony attempts a 3Pt. Contested by Scottie Bird (3.6 feet, ZONE). Manu Anthony misses. Rebound secured by James Wall.

[02:46] Team_029 possession (Score: 80-53)
Paul Iverson attempts a 3Pt. Contested by Manu Anthony (4.0 feet, ZONE). Paul Iverson misses. Rebound secured by Trae Turner.

[02:34] Team_015 possession (Score: 80-53)
Scottie Gasol attempts a Dunk. BLOCKED BY JAMES WALL! Ball is loose! Offensive rebound by CJ Banchero! CJ Banchero kicks it out.

[02:20] Team_015 possession (Score: 80-53)
Manu Anthony drives, Paul Iverson stays with him. Manu Anthony attempts a Layup. Contested by Paul Iverson (4.8 feet, MAN). Manu Anthony misses. Rebound secured by Giannis Banchero.

[02:06] Team_029 possession (Score: 80-53)
Devin Butler drives and kicks out. James Wall attempts a 3Pt. Contested by Manu Anthony (3.9 feet, ZONE). James Wall misses. Rebound secured by Trae Turner.

[01:47] Team_015 possession (Score: 80-53)
Michael Simmons attempts a 3Pt. Contested by Scottie Bird (3.5 feet, MAN). Michael Simmons misses. Rebound secured by Giannis Banchero.

[01:32] Team_029 possession (Score: 80-53)
FOUL! Holding foul on Manu Anthony. [Team fouls: 3] No free throws, side out. (Manu Anthony: 1 personal fouls)

[01:16] Team_029 possession (Score: 80-53)
Giannis Banchero drives and kicks out. James Wall attempts a 3Pt. Contested by Manu Anthony (4.0 feet, ZONE). James Wall misses. Offensive rebound by James Wall! James Wall's putback is no good. Offensive rebound by Devin Butler! Devin Butler kicks it out.

[01:04] Team_029 possession (Score: 80-53)
Giannis Banchero attempts a 3Pt. Contested by Manu Anthony (4.5 feet, ZONE). Giannis Banchero misses. Rebound secured by CJ Banchero.

[00:51] Team_015 possession (Score: 80-53)
Manu Anthony makes the Dunk and draws the foul on James Wall! And-1! Manu Anthony to the line for 1. [BONUS: 10 team fouls] (James Wall: 3 personal fouls)   FT 1/1: GOOD Manu Anthony makes 1/1 from the line.
Score: 83-53

[00:34] Team_029 possession (Score: 83-53)
Giannis Banchero drives, picks up Scottie Gasol. Help arrives from Michael Simmons! Giannis Banchero attempts a Layup. Contested by Michael Simmons (4.5 feet, ZONE). GIANNIS BANCHERO MAKES IT!
Score: 83-55

[00:19] Team_015 possession (Score: 83-55)
Scottie Gasol attempts a 3Pt. Contested by Giannis Banchero (4.2 feet, ZONE). Scottie Gasol misses. Rebound secured by James Wall.

[00:04] Team_029 possession (Score: 83-55)
Paul Iverson makes the Layup and draws the foul on Manu Anthony! And-1! Paul Iverson to the line for 1. [Team fouls: 4] (Manu Anthony: 2 personal fouls)   FT 1/1: GOOD Paul Iverson makes 1/1 from the line.
Score: 83-58

================================================================================
                              3RD QUARTER COMPLETE                              
================================================================================

3RD QUARTER SCORE: Team_015 25, Team_029 16

BOX SCORE:
================================================================================

Team_015
--------------------------------------------------------------------------------
Player                MIN  PTS  REB  AST  TO      FG   FG%      3P   3P%
--------------------------------------------------------------------------------
CJ Banchero            30   11    5    2   0   4/4   100.0     0/0   0.0
Manu Anthony           30    7    0    0   0   3/8    37.5     0/0   0.0
Michael Simmons        30    5    3    0   0   2/4    50.0     0/0   0.0
Trae Turner            30    2    7    1   0   1/1   100.0     0/0   0.0
Scottie Gasol          30    0    0    1   0   0/1     0.0     0/0   0.0

TEAM: FG: 10/18 (55.6%), 3PT: 2/7 (28.6%), REB: 15 (5 off, 10 def), AST: 4, TO: 2
TEAM FOULS: 4


Team_029
--------------------------------------------------------------------------------
Player                MIN  PTS  REB  AST  TO      FG   FG%      3P   3P%
--------------------------------------------------------------------------------
Paul Iverson           30    7    0    1   0   3/5    60.0     0/0   0.0
James Wall             30    5    3    0   0   2/4    50.0     0/0   0.0
Giannis Banchero       30    4    4    0   0   2/5    40.0     0/0   0.0
Devin Butler           30    0    3    0   0   0/3     0.0     0/0   0.0
Scottie Bird           30    0    0    1   0   0/1     0.0     0/0   0.0

TEAM: FG: 7/18 (38.9%), 3PT: 1/5 (20.0%), REB: 10 (3 off, 7 def), AST: 2, TO: 2
TEAM FOULS: 10 [Team_015 in BONUS]

================================================================================

================================================================================
                       4TH QUARTER - Team_015 vs Team_029                       
================================================================================

[12:00] Team_015 possession (Score: 83-58)
CJ Banchero attempts a 3Pt. Contested by Paul Iverson (4.3 feet, ZONE). CJ BANCHERO MAKES IT! Assist: Michael Simmons
Score: 86-58

[11:43] Team_029 possession (Score: 86-58)
Scottie Bird attempts a 3Pt. Contested by Manu Anthony (4.2 feet, ZONE). Scottie Bird misses. Offensive rebound by Devin Butler! Devin Butler kicks it out.

[11:31] Team_029 possession (Score: 86-58)
Giannis Banchero makes the Dunk and draws the foul on Scottie Gasol! And-1! Giannis Banchero to the line for 1. [Team fouls: 1] (Scottie Gasol: 1 personal fouls)   FT 1/1: GOOD Giannis Banchero makes 1/1 from the line.
Score: 86-61

[11:15] Team_015 possession (Score: 86-61)
Scottie Gasol attempts a Midrange. Contested by James Wall (3.0 feet, ZONE). SCOTTIE GASOL MAKES IT!
Score: 88-61

[11:04] Team_029 possession (Score: 88-61)
Devin Butler makes the Layup and draws the foul on Trae Turner! And-1! Devin Butler to the line for 1. [Team fouls: 2] (Trae Turner: 1 personal fouls)   FT 1/1: GOOD Devin Butler makes 1/1 from the line.
Score: 88-64

[10:51] Team_015 possession (Score: 88-64)
CJ Banchero attempts a Layup. BLOCKED BY JAMES WALL! Ball goes out off James Wall. CJ Banchero's ball!

[10:32] Team_015 possession (Score: 88-64)
Trae Turner attempts a Layup. Contested by James Wall (3.2 feet, ZONE). TRAE TURNER MAKES IT! Assist: Michael Simmons
Score: 90-64

[10:18] Team_029 possession (Score: 90-64)
FOUL! Reach-in foul on Trae Turner during the drive. [Team fouls: 3] No free throws, side out. (Trae Turner: 2 personal fouls)

[10:00] Team_029 possession (Score: 90-64)
James Wall attempts a 3Pt. Contested by Manu Anthony (4.7 feet, ZONE). JAMES WALL MAKES IT! Assist: Devin Butler
Score: 90-67

[09:45] Team_015 possession (Score: 90-67)
Trae Turner drives and kicks out. Manu Anthony attempts a 3Pt. Contested by Giannis Banchero (4.3 feet, ZONE). Manu Anthony misses. Rebound secured by Devin Butler.

[09:36] Team_029 possession (Score: 90-67)
Giannis Banchero attempts a Midrange. Contested by CJ Banchero (5.3 feet, MAN). GIANNIS BANCHERO MAKES IT! Assist: Paul Iverson
Score: 90-69

[09:24] Team_015 possession (Score: 90-69)
Michael Simmons commits a violation (traveling/carry)! TURNOVER! (dead ball)

[09:24] Substitution (Team_015): Manu Anthony OUT → Dwyane Sabonis IN (stamina_rule2)

[09:24] Substitution (Team_015): Michael Simmons OUT → Paolo Jokic IN (stamina_rule2)

[09:24] Substitution (Team_015): CJ Banchero OUT → Magic Wagner IN (stamina_rule2)

[09:24] Substitution (Team_015): Scottie Gasol OUT → Rudy Paul IN (stamina_rule2)

[09:24] Substitution (Team_015): Trae Turner OUT → Allen Curry IN (stamina_rule2)

[09:24] Substitution (Team_029): Paul Iverson OUT → Immanuel Irving IN (stamina_rule2)

[09:24] Substitution (Team_029): Scottie Bird OUT → Bones Carter IN (stamina_rule2)

[09:24] Substitution (Team_029): Giannis Banchero OUT → Pau Anthony IN (stamina_rule2)

[09:24] Substitution (Team_029): James Wall OUT → Derrick Rozier IN (stamina_rule2)

[09:24] Substitution (Team_029): Devin Butler OUT → Shai Ball IN (stamina_rule2)

[09:06] Team_029 possession (Score: 90-69)
Pau Anthony attempts a Layup. BLOCKED BY RUDY PAUL! Ball goes out off Rudy Paul. Pau Anthony's ball!

[08:49] Team_029 possession (Score: 90-69)
FOUL! Shooting foul on Rudy Paul. Derrick Rozier to the line for 2 free throws. [Team fouls: 4] (Rudy Paul: 1 personal fouls)   FT 1/2: GOOD   FT 2/2: MISS Derrick Rozier makes 1/2 from the line. Rebound secured by Rudy Paul.
Score: 90-70

[08:34] Team_015 possession (Score: 90-70)
Magic Wagner drives, Pau Anthony stays with him. Magic Wagner attempts a Dunk. Contested by Pau Anthony (3.7 feet, MAN). Magic Wagner misses. Offensive rebound by Rudy Paul! Rudy Paul puts it back in!
Score: 92-70

[08:22] Team_029 possession (Score: 92-70)
Shai Ball attempts a Layup. Contested by Rudy Paul (3.6 feet, MAN). SHAI BALL MAKES IT!
Score: 92-72

[08:06] Team_015 possession (Score: 92-72)
Paolo Jokic attempts a 3Pt. Contested by Pau Anthony (4.2 feet, ZONE). PAOLO JOKIC MAKES IT! Assist: Magic Wagner
Score: 95-72

[07:49] Team_029 possession (Score: 95-72)
Pau Anthony attempts a Midrange. Contested by Magic Wagner (5.7 feet, ZONE). Pau Anthony misses. Rebound secured by Allen Curry.

[07:29] Team_015 possession (Score: 95-72)
Magic Wagner attempts a 3Pt. Contested by Pau Anthony (3.7 feet, ZONE). MAGIC WAGNER MAKES IT!
Score: 98-72

[07:14] Team_029 possession (Score: 98-72)
Immanuel Irving drives to the basket... Immanuel Irving loses the ball! Stripped by Rudy Paul! TURNOVER! (live ball)

[06:59] Team_015 possession (Score: 98-72)
Allen Curry makes the Layup and draws the foul on Derrick Rozier! And-1! Allen Curry to the line for 1. [Team fouls: 1] (Derrick Rozier: 1 personal fouls)   FT 1/1: GOOD Allen Curry makes 1/1 from the line.
Score: 101-72

[06:42] Team_029 possession (Score: 101-72)
Shai Ball drives and kicks out. Pau Anthony attempts a Midrange. Contested by Magic Wagner (5.3 feet, ZONE). PAU ANTHONY MAKES IT!
Score: 101-74

[06:29] Team_015 possession (Score: 101-74)
Allen Curry attempts a 3Pt. Contested by Shai Ball (4.1 feet, MAN). Allen Curry misses. Rebound secured by Shai Ball.

[06:12] Team_029 possession (Score: 101-74)
Derrick Rozier attempts a 3Pt. Contested by Rudy Paul (3.5 feet, MAN). Derrick Rozier misses. Rebound secured by Rudy Paul.

[05:55] Team_015 possession (Score: 101-74)
Rudy Paul attempts a 3Pt. Contested by Pau Anthony (4.2 feet, ZONE). Rudy Paul misses. FOUL! Loose ball foul on Pau Anthony during the rebound battle. [Team fouls: 2] No free throws, side out. (Pau Anthony: 1 personal fouls)

[05:42] Team_015 possession (Score: 101-74)
Paolo Jokic attempts a 3Pt. Wide open! Bones Carter is 6.0 feet away. [MAN] Paolo Jokic misses. Rebound secured by Pau Anthony.

[05:28] Team_029 possession (Score: 101-74)
FOUL! Reach-in foul on Dwyane Sabonis during the drive. [IN THE BONUS! 5 team fouls] Immanuel Irving to the line for 2 free throws. (Dwyane Sabonis: 1 personal fouls)   FT 1/2: MISS   FT 2/2: GOOD Immanuel Irving makes 1/2 from the line.
Score: 101-75

[05:13] Team_015 possession (Score: 101-75)
Rudy Paul makes the Layup and draws the foul on Derrick Rozier! And-1! Rudy Paul to the line for 1. [Team fouls: 3] (Derrick Rozier: 2 personal fouls)   FT 1/1: GOOD Rudy Paul makes 1/1 from the line.
Score: 104-75

[04:59] Team_029 possession (Score: 104-75)
Bones Carter attempts a 3Pt. Contested by Rudy Paul (3.4 feet, ZONE). BONES CARTER MAKES IT! Assist: Derrick Rozier
Score: 104-78

[04:45] Team_015 possession (Score: 104-78)
Paolo Jokic attempts a 3Pt. Contested by Pau Anthony (4.2 feet, ZONE). PAOLO JOKIC MAKES IT! Assist: Magic Wagner
Score: 107-78

[04:27] Team_029 possession (Score: 107-78)
Pau Anthony makes the Midrange and draws the foul on Dwyane Sabonis! And-1! Pau Anthony to the line for 1. [BONUS: 6 team fouls] (Dwyane Sabonis: 2 personal fouls)   FT 1/1: GOOD Pau Anthony makes 1/1 from the line.
Score: 107-81

[04:11] Team_015 possession (Score: 107-81)
FOUL! Reach-in foul on Shai Ball during the drive. [Team fouls: 4] No free throws, side out. (Shai Ball: 1 personal fouls)

[03:58] Team_015 possession (Score: 107-81)
FOUL! Shooting foul on Derrick Rozier. Rudy Paul to the line for 2 free throws. [BONUS: 5 team fouls] (Derrick Rozier: 3 personal fouls)   FT 1/2: GOOD   FT 2/2: GOOD Rudy Paul makes 2/2 from the line.
Score: 109-81

[03:45] Team_029 possession (Score: 109-81)
Pau Anthony attempts a 3Pt. Contested by Rudy Paul (3.6 feet, ZONE). PAU ANTHONY MAKES IT! Assist: Immanuel Irving
Score: 109-84

[03:30] Team_015 possession (Score: 109-84)
FOUL! Holding foul on Bones Carter. [IN THE BONUS! 6 team fouls] Paolo Jokic to the line for 2 free throws. (Bones Carter: 1 personal fouls)   FT 1/2: GOOD   FT 2/2: GOOD Paolo Jokic makes 2/2 from the line.
Score: 111-84

[03:15] Team_029 possession (Score: 111-84)
Derrick Rozier attempts a 3Pt. Contested by Rudy Paul (3.5 feet, ZONE). Derrick Rozier misses. Offensive rebound by Derrick Rozier! Derrick Rozier kicks it out.

[03:01] Team_029 possession (Score: 111-84)
Shai Ball attempts a Layup. Contested by Rudy Paul (3.6 feet, MAN). SHAI BALL MAKES IT! Assist: Bones Carter
Score: 111-86

[02:48] Team_015 possession (Score: 111-86)
Paolo Jokic attempts a Midrange. Wide open! Bones Carter is 6.0 feet away. [ZONE] PAOLO JOKIC MAKES IT!
Score: 113-86

[02:34] Team_029 possession (Score: 113-86)
Derrick Rozier attempts a Layup. Contested by Rudy Paul (3.5 feet, ZONE). Derrick Rozier misses. Rebound secured by Allen Curry.

[02:24] Team_015 possession (Score: 113-86)
Paolo Jokic attempts a 3Pt. Wide open! Bones Carter is 6.0 feet away. [MAN] Paolo Jokic misses. Rebound secured by Pau Anthony.

[02:07] Team_029 possession (Score: 113-86)
Shai Ball drives and kicks out. Bones Carter attempts a 3Pt. Contested by Rudy Paul (3.3 feet, ZONE). Bones Carter misses. Offensive rebound by Derrick Rozier! Derrick Rozier kicks it out.

[01:57] Team_029 possession (Score: 113-86)
Immanuel Irving attempts a 3Pt. Contested by Rudy Paul (3.8 feet, ZONE). Immanuel Irving misses. FOUL! Loose ball foul on Allen Curry during the rebound battle. [IN THE BONUS! 7 team fouls] Derrick Rozier to the line for 2 free throws. (Allen Curry: 1 personal fouls)   FT 1/2: MISS   FT 2/2: GOOD Derrick Rozier makes 1/2 from the line.
Score: 113-87

[01:42] Team_015 possession (Score: 113-87)
Paolo Jokic attempts a 3Pt. Contested by Pau Anthony (4.3 feet, ZONE). Paolo Jokic misses. Rebound secured by Derrick Rozier.

[01:30] Team_029 possession (Score: 113-87)
Derrick Rozier drives to the basket... Derrick Rozier throws a bad pass! Stolen by Rudy Paul! TURNOVER! (live ball)

[01:12] Team_015 possession (Score: 113-87)
FOUL! Holding foul on Shai Ball. [IN THE BONUS! 7 team fouls] Allen Curry to the line for 2 free throws. (Shai Ball: 2 personal fouls)   FT 1/2: GOOD   FT 2/2: MISS Allen Curry makes 1/2 from the line. Rebound secured by Derrick Rozier.
Score: 114-87

[00:54] Team_029 possession (Score: 114-87)
Derrick Rozier attempts a Midrange. Contested by Rudy Paul (3.6 feet, MAN). DERRICK ROZIER MAKES IT! Assist: Shai Ball
Score: 114-89

[00:43] Team_015 possession (Score: 114-89)
Allen Curry attempts a 3Pt. Contested by Pau Anthony (4.2 feet, ZONE). Allen Curry misses. Rebound secured by Derrick Rozier.

[00:30] Team_029 possession (Score: 114-89)
Pau Anthony attempts a 3Pt. Contested by Magic Wagner (5.9 feet, MAN). Pau Anthony misses. Rebound secured by Rudy Paul.

[00:18] Team_015 possession (Score: 114-89)
Rudy Paul attempts a Layup. Contested by Derrick Rozier (4.6 feet, ZONE). RUDY PAUL MAKES IT! Assist: Paolo Jokic
Score: 116-89

[00:03] Team_029 possession (Score: 116-89)
Shai Ball attempts a Midrange. Contested by Rudy Paul (3.8 feet, MAN). Shai Ball misses. Rebound secured by Magic Wagner.

================================================================================
                              4TH QUARTER COMPLETE                              
================================================================================

4TH QUARTER SCORE: Team_015 33, Team_029 31

BOX SCORE:
================================================================================

Team_015
--------------------------------------------------------------------------------
Player                MIN  PTS  REB  AST  TO      FG   FG%      3P   3P%
--------------------------------------------------------------------------------
Paolo Jokic            16   10    0    1   0   4/7    57.1     0/0   0.0
Rudy Paul              16    9    5    0   0   4/4   100.0     0/0   0.0
CJ Banchero            32    3    0    0   0   1/1   100.0     0/0   0.0
Magic Wagner           16    3    1    2   0   1/1   100.0     0/0   0.0
Allen Curry            16    3    2    0   0   1/3    33.3     0/0   0.0
Scottie Gasol          32    2    0    0   0   1/1   100.0     0/0   0.0
Trae Turner            32    2    0    0   0   1/2    50.0     0/0   0.0
Michael Simmons        32    0    0    2   0   0/0     0.0     0/0   0.0

TEAM: FG: 13/20 (65.0%), 3PT: 4/9 (44.4%), REB: 8 (2 off, 6 def), AST: 5, TO: 1
TEAM FOULS: 7 [Team_029 in BONUS]


Team_029
--------------------------------------------------------------------------------
Player                MIN  PTS  REB  AST  TO      FG   FG%      3P   3P%
--------------------------------------------------------------------------------
Pau Anthony            16    8    2    0   0   3/5    60.0     0/0   0.0
Giannis Banchero       32    5    0    0   0   2/2   100.0     0/0   0.0
Shai Ball              16    4    1    1   0   2/3    66.7     0/0   0.0
Devin Butler           32    3    2    1   0   1/1   100.0     0/0   0.0
James Wall             32    3    0    0   0   1/1   100.0     0/0   0.0
Derrick Rozier         16    3    5    1   0   2/5    40.0     0/0   0.0
Bones Carter           16    3    0    1   0   1/1   100.0     0/0   0.0
Immanuel Irving        16    1    0    1   0   1/1   100.0     0/0   0.0
Paul Iverson           32    0    0    1   0   0/0     0.0     0/0   0.0

TEAM: FG: 13/19 (68.4%), 3PT: 4/6 (66.7%), REB: 10 (3 off, 7 def), AST: 6, TO: 2
TEAM FOULS: 7 [Team_015 in BONUS]

================================================================================

================================================================================
                               FULL GAME COMPLETE                               
================================================================================

FINAL SCORE: Team_015 116, Team_029 89

SCORING BY QUARTER:
--------------------------------------------------------------------------------
Team                     Q1     Q2     Q3     Q4    FINAL
--------------------------------------------------------------------------------
Team_015                 28     30     25     33      116
Team_029                 13     29     16     31       89
--------------------------------------------------------------------------------

FULL GAME BOX SCORE:
================================================================================

Team_015
--------------------------------------------------------------------------------
Player                MIN  PTS  REB  AST  TO      FG   FG%      3P   3P%      FT STL BLK
--------------------------------------------------------------------------------
Manu Anthony           32   12    0    2   3   7/12   58.3   1/3    33.3   4/4     0   0
Michael Simmons        32   16   10    4   1   6/11   54.5   2/6    33.3   2/4     1   0
CJ Banchero            32   18   15    4   0   5/6    83.3   2/2   100.0   4/4     0   0
Scottie Gasol          32   12    1    2   2   6/8    75.0   0/1     0.0   2/2     1   3
Trae Turner            32   10   14    3   2   5/9    55.6   0/1     0.0   2/3     0   1
Dwyane Sabonis         16    0    0    0   0   1/2    50.0   0/1     0.0   0/0     0   0
Paolo Jokic            16   16    0    1   0   5/9    55.6   4/8    50.0   2/2     0   0
Magic Wagner           16    6    2    3   0   3/4    75.0   1/1   100.0   1/1     0   0
Rudy Paul              16   16    8    1   0   6/9    66.7   2/4    50.0   5/5     2   2
Allen Curry            16    5    4    1   0   1/3    33.3   0/2     0.0   2/3     0   0

TEAM: FG: 47/76 (61.8%), 3PT: 12/29 (41.4%), REB: 53 (17 off, 36 def), AST: 21, TO: 8


Team_029
--------------------------------------------------------------------------------
Player                MIN  PTS  REB  AST  TO      FG   FG%      3P   3P%      FT STL BLK
--------------------------------------------------------------------------------
Paul Iverson           32   10    0    4   2   4/8    50.0   1/5    20.0   3/3     1   1
Scottie Bird           32    2    0    3   0   2/6    33.3   0/0     0.0   0/0     1   0
Giannis Banchero       32   17    7    0   2   7/14   50.0   1/6    16.7   2/2     0   0
James Wall             32   16    3    1   1   4/10   40.0   3/6    50.0   0/0     2   5
Devin Butler           32    5   13    1   0   3/11   27.3   0/1     0.0   1/1     0   0
Immanuel Irving        16    8    0    3   0   5/5   100.0   2/2   100.0   1/2     0   0
Bones Carter           16    3    0    2   2   1/2    50.0   1/1   100.0   0/1     0   0
Pau Anthony            16   11    5    1   0   3/5    60.0   2/3    66.7   1/1     0   0
Derrick Rozier         16    5    9    3   1   2/7    28.6   0/2     0.0   2/4     0   1
Shai Ball              16    9    2    1   0   5/7    71.4   1/1   100.0   0/0     0   0

TEAM: FG: 36/75 (48.0%), 3PT: 11/27 (40.7%), REB: 40 (13 off, 27 def), AST: 19, TO: 8

================================================================================
