================================================================================
                        FULL GAME - Team_022 vs Team_066                        
================================================================================

================================================================================
                       1ST QUARTER - Team_022 vs Team_066                       
================================================================================

[12:00] Team_022 possession (Score: 0-0)
Michael Ginobili attempts a 3Pt. Contested by Pau Curry (5.6 feet, MAN). MICHAEL GINOBILI MAKES IT! Assist: Malcolm Allen
Score: 3-0

[11:43] Team_066 possession (Score: 3-0)
FOUL! Holding foul on Malcolm Allen. [Team fouls: 1] No free throws, side out. (Malcolm Allen: 1 personal fouls)

[11:24] Team_066 possession (Score: 3-0)
Pau Curry attempts a Midrange. Contested by Michael Ginobili (3.8 feet, ZONE). Pau Curry misses. Rebound secured by Michael Ginobili.

[11:07] Team_022 possession (Score: 3-0)
FOUL! Shooting foul on Kyle Wagner. Lamelo Dosunmu to the line for 2 free throws. [Team fouls: 1] (Kyle Wagner: 1 personal fouls)   FT 1/2: GOOD   FT 2/2: GOOD Lamelo Dosunmu makes 2/2 from the line.
Score: 5-0

[10:51] Team_066 possession (Score: 5-0)
FOUL! Shooting foul on Michael Ginobili. Pau Curry to the line for 2 free throws. [Team fouls: 2] (Michael Ginobili: 1 personal fouls)   FT 1/2: GOOD   FT 2/2: GOOD Pau Curry makes 2/2 from the line.
Score: 5-2

[10:35] Team_022 possession (Score: 5-2)
Malcolm Allen drives, Kyle Wagner stays with him. Malcolm Allen attempts a Dunk. Contested by Kyle Wagner (4.6 feet, ZONE). Malcolm Allen misses. Rebound secured by Brandon Reaves.

[10:25] Team_066 possession (Score: 5-2)
Pau Curry attempts a Layup. Contested by Dirk Markkanen (4.9 feet, ZONE). PAU CURRY MAKES IT! Assist: Jimmy Davis
Score: 5-4

[10:11] Team_022 possession (Score: 5-4)
Michael Ginobili attempts a 3Pt. Contested by Pau Curry (5.6 feet, ZONE). Michael Ginobili misses. Rebound secured by Yao Brogdon.

[09:59] Team_066 possession (Score: 5-4)
FOUL! Reach-in foul on Myles Anthony during the drive. [Team fouls: 3] No free throws, side out. (Myles Anthony: 1 personal fouls)

[09:46] Team_066 possession (Score: 5-4)
Kyle Wagner attempts a 3Pt. Contested by Michael Ginobili (3.4 feet, ZONE). Kyle Wagner misses. Rebound secured by Myles Anthony.

[09:32] Team_022 possession (Score: 5-4)
Myles Anthony attempts a 3Pt. Contested by Brandon Reaves (5.3 feet, MAN). Myles Anthony misses. Rebound secured by Kyle Wagner.

[09:18] Team_066 possession (Score: 5-4)
Kyle Wagner makes the Layup and draws the foul on Dirk Markkanen! And-1! Kyle Wagner to the line for 1. [Team fouls: 4] (Dirk Markkanen: 1 personal fouls)   FT 1/1: GOOD Kyle Wagner makes 1/1 from the line.
Score: 5-7

[09:03] Team_022 possession (Score: 5-7)
FOUL! Reach-in foul on Jimmy Davis during the drive. [Team fouls: 2] No free throws, side out. (Jimmy Davis: 1 personal fouls)

[08:48] Team_022 possession (Score: 5-7)
FOUL! Shooting foul on Jimmy Davis. Malcolm Allen to the line for 2 free throws. [Team fouls: 3] (Jimmy Davis: 2 personal fouls)   FT 1/2: GOOD   FT 2/2: GOOD Malcolm Allen makes 2/2 from the line.
Score: 7-7

[08:37] Team_066 possession (Score: 7-7)
FOUL! Reach-in foul on Dirk Markkanen during the drive. [IN THE BONUS! 5 team fouls] Yao Brogdon to the line for 2 free throws. (Dirk Markkanen: 2 personal fouls)   FT 1/2: GOOD   FT 2/2: MISS Yao Brogdon makes 1/2 from the line. Offensive rebound by Yao Brogdon! Yao Brogdon kicks it out.
Score: 7-8

[08:23] Team_066 possession (Score: 7-8)
Jimmy Davis drives, Malcolm Allen stays with him. Jimmy Davis attempts a Dunk. Contested by Malcolm Allen (4.9 feet, MAN). Jimmy Davis misses. Rebound secured by Dirk Markkanen.

[08:09] Team_022 possession (Score: 7-8)
Myles Anthony drives to the basket... FOUL! Offensive foul on Myles Anthony! Brandon Reaves drew the charge! [Team fouls: 6] (Myles Anthony: 2 personal fouls) TURNOVER! (dead ball)

[07:51] Team_066 possession (Score: 7-8)
FOUL! Holding foul on Michael Ginobili. [IN THE BONUS! 7 team fouls] Pau Curry to the line for 2 free throws. (Michael Ginobili: 2 personal fouls)   FT 1/2: MISS   FT 2/2: GOOD Pau Curry makes 1/2 from the line.
Score: 7-9

[07:33] Team_022 possession (Score: 7-9)
Lamelo Dosunmu attempts a Layup. Contested by Yao Brogdon (5.5 feet, MAN). LAMELO DOSUNMU MAKES IT! Assist: Michael Ginobili
Score: 9-9

[07:15] Team_066 possession (Score: 9-9)
FOUL! Shooting foul on Dirk Markkanen. Kyle Wagner to the line for 2 free throws. [BONUS: 8 team fouls] (Dirk Markkanen: 3 personal fouls)   FT 1/2: GOOD   FT 2/2: GOOD Kyle Wagner makes 2/2 from the line.
Score: 9-11

[07:04] Team_022 possession (Score: 9-11)
Lamelo Dosunmu makes the Layup and draws the foul on Yao Brogdon! And-1! Lamelo Dosunmu to the line for 1. [Team fouls: 4] (Yao Brogdon: 1 personal fouls)   FT 1/1: GOOD Lamelo Dosunmu makes 1/1 from the line.
Score: 12-11

[06:48] Team_066 possession (Score: 12-11)
Yao Brogdon attempts a 3Pt. Contested by Lamelo Dosunmu (5.1 feet, ZONE). Yao Brogdon misses. Rebound secured by Myles Anthony.

[06:36] Team_022 possession (Score: 12-11)
Malcolm Allen attempts a Layup. Contested by Jimmy Davis (4.6 feet, MAN). MALCOLM ALLEN MAKES IT! Assist: Michael Ginobili
Score: 14-11

[06:23] Team_066 possession (Score: 14-11)
FOUL! Holding foul on Malcolm Allen. [IN THE BONUS! 9 team fouls] Jimmy Davis to the line for 2 free throws. (Malcolm Allen: 2 personal fouls)   FT 1/2: GOOD   FT 2/2: GOOD Jimmy Davis makes 2/2 from the line.
Score: 14-13

[06:08] Team_022 possession (Score: 14-13)
FOUL! Shooting foul on Kyle Wagner. Dirk Markkanen to the line for 2 free throws. [BONUS: 5 team fouls] (Kyle Wagner: 2 personal fouls)   FT 1/2: GOOD   FT 2/2: GOOD Dirk Markkanen makes 2/2 from the line.
Score: 16-13

[05:52] Team_066 possession (Score: 16-13)
Kyle Wagner attempts a 3Pt. Contested by Dirk Markkanen (4.5 feet, MAN). KYLE WAGNER MAKES IT! Assist: Jimmy Davis
Score: 16-16

[05:35] Team_022 possession (Score: 16-16)
Dirk Markkanen drives, Kyle Wagner stays with him. Dirk Markkanen attempts a Dunk. Contested by Kyle Wagner (4.4 feet, ZONE). DIRK MARKKANEN MAKES IT!
Score: 18-16

[05:20] Team_066 possession (Score: 18-16)
Pau Curry attempts a 3Pt. Contested by Lamelo Dosunmu (4.9 feet, ZONE). Pau Curry misses. Offensive rebound by Kyle Wagner! Kyle Wagner kicks it out.

[05:07] Team_066 possession (Score: 18-16)
Pau Curry drives to the basket... Pau Curry loses control! Ball rolls out of bounds! TURNOVER! (dead ball)

[04:52] Team_022 possession (Score: 18-16)
FOUL! Holding foul on Pau Curry. [IN THE BONUS! 6 team fouls] Michael Ginobili to the line for 2 free throws. (Pau Curry: 1 personal fouls)   FT 1/2: GOOD   FT 2/2: GOOD Michael Ginobili makes 2/2 from the line.
Score: 20-16

[04:35] Team_066 possession (Score: 20-16)
Jimmy Davis attempts a Midrange. Contested by Malcolm Allen (4.9 feet, MAN). JIMMY DAVIS MAKES IT!
Score: 20-18

[04:18] Team_022 possession (Score: 20-18)
Lamelo Dosunmu drives to the basket... Lamelo Dosunmu loses control! Ball rolls out of bounds! TURNOVER! (dead ball)

[04:04] Team_066 possession (Score: 20-18)
Kyle Wagner attempts a Midrange. Contested by Dirk Markkanen (4.6 feet, MAN). KYLE WAGNER MAKES IT!
Score: 20-20

[03:50] Team_022 possession (Score: 20-20)
Dirk Markkanen attempts a Midrange. Contested by Brandon Reaves (5.6 feet, ZONE). DIRK MARKKANEN MAKES IT!
Score: 22-20

[03:35] Team_066 possession (Score: 22-20)
Brandon Reaves throws a bad pass out of bounds! TURNOVER! (dead ball)

[03:20] Team_022 possession (Score: 22-20)
Dirk Markkanen drives, Kyle Wagner stays with him. Dirk Markkanen attempts a Dunk. Contested by Kyle Wagner (4.5 feet, MAN). DIRK MARKKANEN MAKES IT! Assist: Michael Ginobili
Score: 24-20

[03:06] Team_066 possession (Score: 24-20)
Kyle Wagner attempts a Layup. Contested by Dirk Markkanen (4.7 feet, MAN). KYLE WAGNER MAKES IT!
Score: 24-22

[02:49] Team_022 possession (Score: 24-22)
Myles Anthony drives and kicks out. Myles Anthony attempts a 3Pt. Contested by Pau Curry (5.7 feet, ZONE). Myles Anthony misses. Offensive rebound by Michael Ginobili! Michael Ginobili kicks it out.

[02:34] Team_022 possession (Score: 24-22)
Malcolm Allen drives, Jimmy Davis stays with him. Malcolm Allen attempts a Dunk. Contested by Jimmy Davis (4.9 feet, MAN). Malcolm Allen misses. FOUL! Loose ball foul on Kyle Wagner during the rebound battle. [IN THE BONUS! 7 team fouls] Michael Ginobili to the line for 2 free throws. (Kyle Wagner: 3 personal fouls)   FT 1/2: MISS   FT 2/2: GOOD Michael Ginobili makes 1/2 from the line.
Score: 25-22

[02:19] Team_066 possession (Score: 25-22)
Pau Curry attempts a 3Pt. Contested by Michael Ginobili (4.0 feet, MAN). Pau Curry misses. Rebound secured by Myles Anthony.

[02:03] Team_022 possession (Score: 25-22)
Michael Ginobili attempts a 3Pt. Contested by Pau Curry (5.8 feet, MAN). MICHAEL GINOBILI MAKES IT! Assist: Lamelo Dosunmu
Score: 28-22

[01:49] Team_066 possession (Score: 28-22)
Kyle Wagner makes the Midrange and draws the foul on Dirk Markkanen! And-1! Kyle Wagner to the line for 1. [BONUS: 10 team fouls] (Dirk Markkanen: 4 personal fouls)   FT 1/1: GOOD Kyle Wagner makes 1/1 from the line.
Score: 28-25

[01:33] Team_022 possession (Score: 28-25)
Malcolm Allen loses control! Ball rolls out of bounds! TURNOVER! (dead ball)

[01:33] Substitution (Team_022): Malcolm Allen OUT → DeMar Harden IN (stamina_rule2)

[01:33] Substitution (Team_022): Michael Ginobili OUT → Lauri Gobert IN (stamina_rule2)

[01:33] Substitution (Team_022): Myles Anthony OUT → Dejounte Towns IN (stamina_rule2)

[01:33] Substitution (Team_022): Lamelo Dosunmu OUT → Kawhi Russell IN (stamina_rule2)

[01:33] Substitution (Team_022): Dirk Markkanen OUT → Cole Iverson IN (stamina_rule2)

[01:33] Substitution (Team_066): Jimmy Davis OUT → Pascal Carter IN (stamina_rule2)

[01:33] Substitution (Team_066): Pau Curry OUT → Lauri LaVine IN (stamina_rule2)

[01:33] Substitution (Team_066): Brandon Reaves OUT → Brandon Middleton IN (stamina_rule2)

[01:33] Substitution (Team_066): Yao Brogdon OUT → Cole Morant IN (stamina_rule2)

[01:33] Substitution (Team_066): Kyle Wagner OUT → Donovan Simmons IN (stamina_rule2)

[01:15] Team_066 possession (Score: 28-25)
Pascal Carter commits a violation (traveling/carry)! TURNOVER! (dead ball)

[00:58] Team_022 possession (Score: 28-25)
DeMar Harden attempts a 3Pt. Wide open! Pascal Carter is 6.7 feet away. [MAN] DeMar Harden misses. Offensive rebound by Dejounte Towns! Dejounte Towns kicks it out.

[00:42] Team_022 possession (Score: 28-25)
FOUL! Holding foul on Pascal Carter. [IN THE BONUS! 8 team fouls] DeMar Harden to the line for 2 free throws. (Pascal Carter: 1 personal fouls)   FT 1/2: MISS   FT 2/2: GOOD DeMar Harden makes 1/2 from the line.
Score: 29-25

[00:28] Team_066 possession (Score: 29-25)
Cole Morant drives to the basket... FOUL! Offensive foul on Cole Morant! Kawhi Russell drew the charge! [Team fouls: 9] (Cole Morant: 1 personal fouls) TURNOVER! (dead ball)

[00:15] Team_022 possession (Score: 29-25)
FOUL! Shooting foul on Cole Morant. Kawhi Russell to the line for 2 free throws. [BONUS: 10 team fouls] (Cole Morant: 2 personal fouls)   FT 1/2: MISS   FT 2/2: GOOD Kawhi Russell makes 1/2 from the line.
Score: 30-25

[00:02] Team_066 possession (Score: 30-25)
Brandon Middleton attempts a Midrange. Contested by Dejounte Towns (4.2 feet, MAN). Brandon Middleton misses. Rebound secured by Kawhi Russell.

================================================================================
                              1ST QUARTER COMPLETE                              
================================================================================

1ST QUARTER SCORE: Team_022 30, Team_066 25

BOX SCORE:
================================================================================

Team_022
--------------------------------------------------------------------------------
Player                MIN  PTS  REB  AST  TO      FG   FG%      3P   3P%
--------------------------------------------------------------------------------
Michael Ginobili       11    9    2    3   0   4/5    80.0     0/0   0.0
Dirk Markkanen         11    8    1    0   0   4/4   100.0     0/0   0.0
Lamelo Dosunmu         11    7    0    1   0   3/3   100.0     0/0   0.0
Malcolm Allen          11    4    0    1   0   2/3    66.7     0/0   0.0
DeMar Harden            1    1    0    0   0   1/1   100.0     0/0   0.0
Kawhi Russell           1    1    1    0   0   1/1   100.0     0/0   0.0
Myles Anthony          11    0    3    0   0   0/1     0.0     0/0   0.0
Dejounte Towns          1    0    1    0   0   0/0     0.0     0/0   0.0

TEAM: FG: 15/18 (83.3%), 3PT: 2/4 (50.0%), REB: 8 (2 off, 6 def), AST: 5, TO: 3
TEAM FOULS: 10 [Team_066 in BONUS]


Team_066
--------------------------------------------------------------------------------
Player                MIN  PTS  REB  AST  TO      FG   FG%      3P   3P%
--------------------------------------------------------------------------------
Kyle Wagner            11   15    2    0   0   6/7    85.7     0/0   0.0
Pau Curry              11    5    0    0   0   3/5    60.0     0/0   0.0
Jimmy Davis            11    4    0    2   0   2/3    66.7     0/0   0.0
Brandon Reaves         11    0    1    0   0   0/0     0.0     0/0   0.0
Yao Brogdon            11    0    2    0   0   0/1     0.0     0/0   0.0
Brandon Middleton       1    0    0    0   0   0/1     0.0     0/0   0.0

TEAM: FG: 11/17 (64.7%), 3PT: 1/4 (25.0%), REB: 5 (2 off, 3 def), AST: 2, TO: 4
TEAM FOULS: 10 [Team_022 in BONUS]

================================================================================

================================================================================
                       2ND QUARTER - Team_022 vs Team_066                       
================================================================================

[12:00] Team_022 possession (Score: 30-25)
Dirk Markkanen attempts a 3Pt. Contested by Kyle Wagner (4.4 feet, MAN). DIRK MARKKANEN MAKES IT! Assist: Michael Ginobili
Score: 33-25

[11:46] Team_066 possession (Score: 33-25)
Jimmy Davis attempts a Midrange. Contested by Malcolm Allen (5.0 feet, MAN). Jimmy Davis misses. Rebound secured by Michael Ginobili.

[11:33] Team_022 possession (Score: 33-25)
Michael Ginobili attempts a 3Pt. Contested by Pau Curry (5.7 feet, MAN). MICHAEL GINOBILI MAKES IT! Assist: Myles Anthony
Score: 36-25

[11:19] Team_066 possession (Score: 36-25)
FOUL! Reach-in foul on Dirk Markkanen during the drive. [Team fouls: 1] No free throws, side out. (Dirk Markkanen: 1 personal fouls)

[11:06] Team_066 possession (Score: 36-25)
FOUL! Offensive foul on Jimmy Davis! Malcolm Allen drew the charge! [Team fouls: 1] (Jimmy Davis: 1 personal fouls) TURNOVER! (dead ball)

[10:50] Team_022 possession (Score: 36-25)
Malcolm Allen attempts a 3Pt. Wide open! Pau Curry is 6.3 feet away. [ZONE] Malcolm Allen misses. Rebound secured by Kyle Wagner.

[10:34] Team_066 possession (Score: 36-25)
Yao Brogdon attempts a 3Pt. Contested by Michael Ginobili (4.1 feet, ZONE). Yao Brogdon misses. Offensive rebound by Yao Brogdon! Yao Brogdon kicks it out.

[10:16] Team_066 possession (Score: 36-25)
Jimmy Davis makes the Layup and draws the foul on Dirk Markkanen! And-1! Jimmy Davis to the line for 1. [Team fouls: 2] (Dirk Markkanen: 2 personal fouls)   FT 1/1: GOOD Jimmy Davis makes 1/1 from the line.
Score: 36-28

[10:04] Team_022 possession (Score: 36-28)
Dirk Markkanen attempts a Midrange. Contested by Kyle Wagner (4.6 feet, MAN). Dirk Markkanen misses. Rebound secured by Yao Brogdon.

[09:49] Team_066 possession (Score: 36-28)
Yao Brogdon attempts a 3Pt. Contested by Lamelo Dosunmu (5.4 feet, MAN). Yao Brogdon misses. Offensive rebound by Yao Brogdon! Yao Brogdon kicks it out.

[09:38] Team_066 possession (Score: 36-28)
Brandon Reaves attempts a 3Pt. Contested by Myles Anthony (5.2 feet, MAN). BRANDON REAVES MAKES IT! Assist: Kyle Wagner
Score: 36-31

[09:26] Team_022 possession (Score: 36-31)
Dirk Markkanen attempts a Midrange. Contested by Kyle Wagner (4.6 feet, MAN). Dirk Markkanen misses. Rebound secured by Yao Brogdon.

[09:09] Team_066 possession (Score: 36-31)
Pau Curry drives and kicks out. Pau Curry attempts a 3Pt. Contested by Michael Ginobili (3.9 feet, ZONE). Pau Curry misses. Rebound secured by Dirk Markkanen.

[08:58] Team_022 possession (Score: 36-31)
Malcolm Allen attempts a Layup. Contested by Kyle Wagner (4.9 feet, ZONE). MALCOLM ALLEN MAKES IT! Assist: Michael Ginobili
Score: 38-31

[08:41] Team_066 possession (Score: 38-31)
Yao Brogdon throws a bad pass! Stolen by Lamelo Dosunmu! TURNOVER! (live ball)

[08:27] Team_022 possession (Score: 38-31)
Lamelo Dosunmu attempts a Midrange. Contested by Yao Brogdon (5.9 feet, MAN). Lamelo Dosunmu misses. Rebound secured by Kyle Wagner.

[08:11] Team_066 possession (Score: 38-31)
Pau Curry attempts a Midrange. Contested by Michael Ginobili (4.2 feet, MAN). PAU CURRY MAKES IT! Assist: Yao Brogdon
Score: 38-33

[07:58] Team_022 possession (Score: 38-33)
Michael Ginobili attempts a 3Pt. Contested by Pau Curry (6.0 feet, MAN). Michael Ginobili misses. Rebound secured by Brandon Reaves.

[07:44] Team_066 possession (Score: 38-33)
Pau Curry attempts a 3Pt. Contested by Michael Ginobili (4.3 feet, MAN). Pau Curry misses. Rebound secured by Dirk Markkanen.

[07:28] Team_022 possession (Score: 38-33)
Malcolm Allen attempts a Layup. BLOCKED BY KYLE WAGNER! Ball is loose! Offensive rebound by Dirk Markkanen! Dirk Markkanen kicks it out.

[07:14] Team_022 possession (Score: 38-33)
Lamelo Dosunmu attempts a 3Pt. Wide open! Yao Brogdon is 6.0 feet away. [MAN] Lamelo Dosunmu misses. Rebound secured by Brandon Reaves.

[07:03] Team_066 possession (Score: 38-33)
Brandon Reaves attempts a 3Pt. Contested by Myles Anthony (5.5 feet, MAN). BRANDON REAVES MAKES IT!
Score: 38-36

[06:49] Team_022 possession (Score: 38-36)
Michael Ginobili attempts a 3Pt. Wide open! Pau Curry is 6.1 feet away. [MAN] Michael Ginobili misses. Rebound secured by Yao Brogdon.

[06:33] Team_066 possession (Score: 38-36)
FOUL! Shooting foul on Malcolm Allen. Jimmy Davis to the line for 2 free throws. [Team fouls: 3] (Malcolm Allen: 1 personal fouls)   FT 1/2: MISS   FT 2/2: GOOD Jimmy Davis makes 1/2 from the line.
Score: 38-37

[06:17] Team_022 possession (Score: 38-37)
FOUL! Shooting foul on Jimmy Davis. Michael Ginobili to the line for 2 free throws. [Team fouls: 2] (Jimmy Davis: 2 personal fouls)   FT 1/2: GOOD   FT 2/2: GOOD Michael Ginobili makes 2/2 from the line.
Score: 40-37

[05:58] Team_066 possession (Score: 40-37)
FOUL! Shooting foul on Lamelo Dosunmu. Jimmy Davis to the line for 2 free throws. [Team fouls: 4] (Lamelo Dosunmu: 1 personal fouls)   FT 1/2: GOOD   FT 2/2: GOOD Jimmy Davis makes 2/2 from the line.
Score: 40-39

[05:41] Team_022 possession (Score: 40-39)
Malcolm Allen attempts a 3Pt. Wide open! Pau Curry is 6.7 feet away. [ZONE] Malcolm Allen misses. FOUL! Loose ball foul on Kyle Wagner during the rebound battle. [Team fouls: 3] No free throws, side out. (Kyle Wagner: 1 personal fouls)

[05:24] Team_022 possession (Score: 40-39)
Michael Ginobili attempts a Layup. Wide open! Pau Curry is 6.2 feet away. [MAN] Michael Ginobili misses. Rebound secured by Brandon Reaves.

[05:09] Team_066 possession (Score: 40-39)
Pau Curry attempts a 3Pt. Contested by Michael Ginobili (4.6 feet, MAN). Pau Curry misses. Rebound secured by Michael Ginobili.

[04:50] Team_022 possession (Score: 40-39)
Myles Anthony drives to the basket... Myles Anthony throws a bad pass! Stolen by Brandon Reaves! TURNOVER! (live ball)

[04:38] Team_066 possession (Score: 40-39)
Yao Brogdon attempts a 3Pt. Contested by Michael Ginobili (4.8 feet, ZONE). Yao Brogdon misses. Offensive rebound by Kyle Wagner! Kyle Wagner kicks it out.

[04:26] Team_066 possession (Score: 40-39)
Pau Curry drives and kicks out. Pau Curry attempts a Midrange. Contested by Myles Anthony (5.5 feet, ZONE). PAU CURRY MAKES IT! Assist: Kyle Wagner
Score: 40-41

[04:10] Team_022 possession (Score: 40-41)
Malcolm Allen attempts a 3Pt. Wide open! Pau Curry is 6.9 feet away. [ZONE] Malcolm Allen misses. Rebound secured by Yao Brogdon.

[03:53] Team_066 possession (Score: 40-41)
Kyle Wagner attempts a Midrange. Contested by Dirk Markkanen (5.5 feet, MAN). KYLE WAGNER MAKES IT!
Score: 40-43

[03:38] Team_022 possession (Score: 40-43)
Michael Ginobili drives, Pau Curry stays with him. Michael Ginobili attempts a Dunk. Wide open! Pau Curry is 6.4 feet away. [MAN] MICHAEL GINOBILI MAKES IT! Assist: Myles Anthony
Score: 42-43

[03:22] Team_066 possession (Score: 42-43)
Brandon Reaves attempts a 3Pt. Contested by Michael Ginobili (5.1 feet, ZONE). Brandon Reaves misses. Rebound secured by Myles Anthony.

[03:08] Team_022 possession (Score: 42-43)
Myles Anthony attempts a Layup. Contested by Kyle Wagner (5.1 feet, ZONE). Myles Anthony misses. Offensive rebound by Michael Ginobili! Michael Ginobili kicks it out.

[02:54] Team_022 possession (Score: 42-43)
Michael Ginobili attempts a 3Pt. Wide open! Pau Curry is 6.5 feet away. [ZONE] MICHAEL GINOBILI MAKES IT! Assist: Dirk Markkanen
Score: 45-43

[02:40] Team_066 possession (Score: 45-43)
Yao Brogdon attempts a Midrange. Wide open! Lamelo Dosunmu is 6.3 feet away. [MAN] YAO BROGDON MAKES IT! Assist: Brandon Reaves
Score: 45-45

[02:26] Team_022 possession (Score: 45-45)
Myles Anthony attempts a Layup. Wide open! Brandon Reaves is 6.2 feet away. [MAN] Myles Anthony misses. Rebound secured by Kyle Wagner.

[02:12] Team_066 possession (Score: 45-45)
Pau Curry attempts a 3Pt. Contested by Michael Ginobili (5.0 feet, MAN). Pau Curry misses. Rebound secured by Michael Ginobili.

[02:00] Team_022 possession (Score: 45-45)
Michael Ginobili attempts a 3Pt. Wide open! Pau Curry is 6.6 feet away. [ZONE] Michael Ginobili misses. Rebound secured by Yao Brogdon.

[01:45] Team_066 possession (Score: 45-45)
Jimmy Davis attempts a 3Pt. Contested by Michael Ginobili (5.2 feet, ZONE). Jimmy Davis misses. Rebound secured by Myles Anthony.

[01:31] Team_022 possession (Score: 45-45)
Myles Anthony attempts a 3Pt. Wide open! Pau Curry is 6.8 feet away. [ZONE] Myles Anthony misses. Rebound secured by Yao Brogdon.

[01:11] Team_066 possession (Score: 45-45)
Pau Curry attempts a Midrange. Wide open! Lamelo Dosunmu is 6.4 feet away. [ZONE] PAU CURRY MAKES IT! Assist: Jimmy Davis
Score: 45-47

[00:55] Team_022 possession (Score: 45-47)
Myles Anthony drives, Brandon Reaves stays with him. Myles Anthony attempts a Layup. Wide open! Brandon Reaves is 6.4 feet away. [MAN] MYLES ANTHONY MAKES IT!
Score: 47-47

[00:44] Team_066 possession (Score: 47-47)
Pau Curry attempts a 3Pt. Contested by Michael Ginobili (5.3 feet, ZONE). PAU CURRY MAKES IT! Assist: Brandon Reaves
Score: 47-50

[00:31] Team_022 possession (Score: 47-50)
Myles Anthony attempts a Layup. Wide open! Brandon Reaves is 6.4 feet away. [MAN] MYLES ANTHONY MAKES IT! Assist: Dirk Markkanen
Score: 49-50

[00:19] Team_066 possession (Score: 49-50)
Brandon Reaves attempts a Layup. Wide open! Myles Anthony is 6.4 feet away. [MAN] BRANDON REAVES MAKES IT! Assist: Jimmy Davis
Score: 49-52

[00:04] Team_022 possession (Score: 49-52)
FOUL! Offensive foul on Michael Ginobili! Pau Curry drew the charge! [Team fouls: 5] (Michael Ginobili: 1 personal fouls) TURNOVER! (dead ball)

================================================================================
                              2ND QUARTER COMPLETE                              
================================================================================

2ND QUARTER SCORE: Team_022 19, Team_066 27

BOX SCORE:
================================================================================

Team_022
--------------------------------------------------------------------------------
Player                MIN  PTS  REB  AST  TO      FG   FG%      3P   3P%
--------------------------------------------------------------------------------
Michael Ginobili       23   10    5    2   0   4/8    50.0     0/0   0.0
Myles Anthony          23    4    2    2   0   2/4    50.0     0/0   0.0
Dirk Markkanen         23    3    3    2   0   1/3    33.3     0/0   0.0
Malcolm Allen          23    2    0    0   0   1/3    33.3     0/0   0.0
Lamelo Dosunmu         23    0    0    0   0   0/2     0.0     0/0   0.0

TEAM: FG: 8/20 (40.0%), 3PT: 3/10 (30.0%), REB: 10 (3 off, 7 def), AST: 6, TO: 2
TEAM FOULS: 5 [Team_066 in BONUS]


Team_066
--------------------------------------------------------------------------------
Player                MIN  PTS  REB  AST  TO      FG   FG%      3P   3P%
--------------------------------------------------------------------------------
Pau Curry              23    9    0    0   0   4/8    50.0     0/0   0.0
Brandon Reaves         23    8    3    2   0   3/4    75.0     0/0   0.0
Jimmy Davis            23    6    0    2   0   3/5    60.0     0/0   0.0
Kyle Wagner            23    2    4    2   0   1/1   100.0     0/0   0.0
Yao Brogdon            23    2    8    1   0   1/1   100.0     0/0   0.0

TEAM: FG: 12/19 (63.2%), 3PT: 3/8 (37.5%), REB: 15 (3 off, 12 def), AST: 7, TO: 2
TEAM FOULS: 3

================================================================================

================================================================================
                       3RD QUARTER - Team_022 vs Team_066                       
================================================================================

[12:00] Team_022 possession (Score: 49-52)
Malcolm Allen attempts a 3Pt. Contested by Jimmy Davis (4.6 feet, MAN). Malcolm Allen misses. Offensive rebound by Michael Ginobili! Michael Ginobili kicks it out.

[11:44] Team_022 possession (Score: 49-52)
FOUL! Reach-in foul on Kyle Wagner during the drive. [Team fouls: 1] No free throws, side out. (Kyle Wagner: 1 personal fouls)

[11:32] Team_022 possession (Score: 49-52)
FOUL! Reach-in foul on Brandon Reaves during the drive. [Team fouls: 2] No free throws, side out. (Brandon Reaves: 1 personal fouls)

[11:15] Team_022 possession (Score: 49-52)
Lamelo Dosunmu drives, picks up Kyle Wagner. Help arrives from Jimmy Davis! Lamelo Dosunmu attempts a Layup. Contested by Jimmy Davis (4.3 feet, ZONE). LAMELO DOSUNMU MAKES IT! Assist: Myles Anthony
Score: 51-52

[10:57] Team_066 possession (Score: 51-52)
Jimmy Davis drives and kicks out. Brandon Reaves attempts a Midrange. Contested by Myles Anthony (4.4 feet, ZONE). BRANDON REAVES MAKES IT! Assist: Jimmy Davis
Score: 51-54

[10:47] Team_022 possession (Score: 51-54)
Dirk Markkanen attempts a 3Pt. Contested by Brandon Reaves (5.6 feet, ZONE). DIRK MARKKANEN MAKES IT! Assist: Michael Ginobili
Score: 54-54

[10:34] Team_066 possession (Score: 54-54)
Yao Brogdon attempts a Midrange. Contested by Lamelo Dosunmu (5.1 feet, MAN). Yao Brogdon misses. Rebound secured by Myles Anthony.

[10:23] Team_022 possession (Score: 54-54)
Dirk Markkanen attempts a Midrange. Contested by Kyle Wagner (4.4 feet, MAN). Dirk Markkanen misses. Rebound secured by Brandon Reaves.

[10:08] Team_066 possession (Score: 54-54)
Brandon Reaves loses the ball! Stripped by Myles Anthony! TURNOVER! (live ball)

[09:53] Team_022 possession (Score: 54-54)
Lamelo Dosunmu drives and kicks out. Myles Anthony attempts a 3Pt. Contested by Pau Curry (5.5 feet, ZONE). Myles Anthony misses. Rebound secured by Yao Brogdon.

[09:40] Team_066 possession (Score: 54-54)
Brandon Reaves attempts a 3Pt. Contested by Michael Ginobili (4.0 feet, ZONE). BRANDON REAVES MAKES IT! Assist: Pau Curry
Score: 54-57

[09:25] Team_022 possession (Score: 54-57)
Malcolm Allen attempts a Midrange. Wide open! Pau Curry is 6.2 feet away. [ZONE] MALCOLM ALLEN MAKES IT!
Score: 56-57

[09:11] Team_066 possession (Score: 56-57)
Yao Brogdon attempts a 3Pt. Contested by Lamelo Dosunmu (5.1 feet, MAN). Yao Brogdon misses. Offensive rebound by Yao Brogdon! Yao Brogdon kicks it out.

[08:58] Team_066 possession (Score: 56-57)
Kyle Wagner attempts a Layup. Contested by Dirk Markkanen (4.5 feet, MAN). KYLE WAGNER MAKES IT!
Score: 56-59

[08:41] Team_022 possession (Score: 56-59)
Myles Anthony attempts a 3Pt. Contested by Pau Curry (5.7 feet, ZONE). Myles Anthony misses. FOUL! Loose ball foul on Kyle Wagner during the rebound battle. [Team fouls: 3] No free throws, side out. (Kyle Wagner: 2 personal fouls)

[08:29] Team_022 possession (Score: 56-59)
Myles Anthony attempts a Midrange. Contested by Brandon Reaves (5.3 feet, MAN). MYLES ANTHONY MAKES IT! Assist: Michael Ginobili
Score: 58-59

[08:14] Team_066 possession (Score: 58-59)
Jimmy Davis attempts a 3Pt. Contested by Michael Ginobili (4.0 feet, ZONE). Jimmy Davis misses. Rebound secured by Michael Ginobili.

[08:04] Team_022 possession (Score: 58-59)
Dirk Markkanen attempts a 3Pt. Contested by Kyle Wagner (4.4 feet, MAN). Dirk Markkanen misses. Offensive rebound by Dirk Markkanen! Dirk Markkanen puts it back in!
Score: 60-59

[07:53] Team_066 possession (Score: 60-59)
Yao Brogdon drives to the basket... Yao Brogdon throws a bad pass! Stolen by Lamelo Dosunmu! TURNOVER! (live ball)

[07:37] Team_022 possession (Score: 60-59)
Malcolm Allen attempts a 3Pt. Contested by Jimmy Davis (4.6 feet, MAN). Malcolm Allen misses. Rebound secured by Kyle Wagner.

[07:24] Team_066 possession (Score: 60-59)
Yao Brogdon attempts a Layup. Contested by Lamelo Dosunmu (5.1 feet, MAN). YAO BROGDON MAKES IT! Assist: Kyle Wagner
Score: 60-61

[07:13] Team_022 possession (Score: 60-61)
Michael Ginobili attempts a 3Pt. Contested by Pau Curry (5.6 feet, MAN). Michael Ginobili misses. Rebound secured by Yao Brogdon.

[06:57] Team_066 possession (Score: 60-61)
Brandon Reaves attempts a 3Pt. Contested by Michael Ginobili (4.0 feet, ZONE). BRANDON REAVES MAKES IT! Assist: Pau Curry
Score: 60-64

[06:47] Team_022 possession (Score: 60-64)
Lamelo Dosunmu drives to the basket... Lamelo Dosunmu throws a bad pass! Stolen by Yao Brogdon! TURNOVER! (live ball)

[06:34] Team_066 possession (Score: 60-64)
Yao Brogdon attempts a Midrange. Contested by Lamelo Dosunmu (5.1 feet, MAN). Yao Brogdon misses. Rebound secured by Myles Anthony.

[06:23] Team_022 possession (Score: 60-64)
Dirk Markkanen makes the Layup and draws the foul on Kyle Wagner! And-1! Dirk Markkanen to the line for 1. [Team fouls: 4] (Kyle Wagner: 3 personal fouls)   FT 1/1: GOOD Dirk Markkanen makes 1/1 from the line.
Score: 63-64

[06:13] Team_066 possession (Score: 63-64)
Pau Curry drives and kicks out. Kyle Wagner attempts a 3Pt. Contested by Michael Ginobili (3.5 feet, ZONE). Kyle Wagner misses. Rebound secured by Dirk Markkanen.

[06:00] Team_022 possession (Score: 63-64)
Lamelo Dosunmu attempts a Midrange. Contested by Pau Curry (5.9 feet, ZONE). Lamelo Dosunmu misses. Rebound secured by Yao Brogdon.

[05:42] Team_066 possession (Score: 63-64)
Jimmy Davis attempts a 3Pt. Contested by Michael Ginobili (4.0 feet, ZONE). Jimmy Davis misses. Rebound secured by Michael Ginobili.

[05:31] Team_022 possession (Score: 63-64)
Dirk Markkanen drives, picks up Yao Brogdon. Help arrives from Jimmy Davis! Dirk Markkanen attempts a Layup. Contested by Jimmy Davis (5.6 feet, ZONE). DIRK MARKKANEN MAKES IT!
Score: 65-64

[05:19] Team_066 possession (Score: 65-64)
Pau Curry attempts a 3Pt. Contested by Michael Ginobili (3.8 feet, MAN). Pau Curry misses. Rebound secured by Dirk Markkanen.

[05:04] Team_022 possession (Score: 65-64)
Malcolm Allen attempts a 3Pt. Contested by Jimmy Davis (4.7 feet, MAN). MALCOLM ALLEN MAKES IT! Assist: Michael Ginobili
Score: 68-64

[04:54] Team_066 possession (Score: 68-64)
Yao Brogdon attempts a 3Pt. Contested by Michael Ginobili (4.0 feet, ZONE). Yao Brogdon misses. Offensive rebound by Yao Brogdon! Yao Brogdon kicks it out.

[04:40] Team_066 possession (Score: 68-64)
Yao Brogdon attempts a 3Pt. Contested by Lamelo Dosunmu (5.2 feet, MAN). YAO BROGDON MAKES IT! Assist: Kyle Wagner
Score: 68-67

[04:27] Team_022 possession (Score: 68-67)
Malcolm Allen attempts a Midrange. Wide open! Pau Curry is 6.3 feet away. [ZONE] MALCOLM ALLEN MAKES IT! Assist: Myles Anthony
Score: 70-67

[04:12] Team_066 possession (Score: 70-67)
Kyle Wagner drives to the basket... Kyle Wagner throws a bad pass out of bounds! TURNOVER! (dead ball)

[03:58] Team_022 possession (Score: 70-67)
Lamelo Dosunmu attempts a 3Pt. Wide open! Pau Curry is 6.0 feet away. [ZONE] Lamelo Dosunmu misses. Rebound secured by Brandon Reaves.

[03:41] Team_066 possession (Score: 70-67)
Jimmy Davis attempts a 3Pt. Contested by Malcolm Allen (5.0 feet, MAN). Jimmy Davis misses. Offensive rebound by Kyle Wagner! Kyle Wagner kicks it out.

[03:26] Team_066 possession (Score: 70-67)
Jimmy Davis attempts a Layup. Contested by Malcolm Allen (5.1 feet, MAN). Jimmy Davis misses. Rebound secured by Dirk Markkanen.

[03:13] Team_022 possession (Score: 70-67)
Malcolm Allen drives, Kyle Wagner stays with him. Malcolm Allen attempts a Layup. Contested by Kyle Wagner (4.8 feet, ZONE). MALCOLM ALLEN MAKES IT! Assist: Michael Ginobili
Score: 72-67

[02:59] Team_066 possession (Score: 72-67)
Yao Brogdon drives, picks up Lamelo Dosunmu. Help arrives from Michael Ginobili! Yao Brogdon attempts a Layup. Contested by Michael Ginobili (5.4 feet, MAN). YAO BROGDON MAKES IT!
Score: 72-69

[02:47] Team_022 possession (Score: 72-69)
Michael Ginobili attempts a Midrange. Contested by Kyle Wagner (4.2 feet, ZONE). MICHAEL GINOBILI MAKES IT!
Score: 74-69

[02:37] Team_066 possession (Score: 74-69)
Kyle Wagner attempts a Midrange. Contested by Lamelo Dosunmu (4.9 feet, ZONE). KYLE WAGNER MAKES IT! Assist: Brandon Reaves
Score: 74-71

[02:24] Team_022 possession (Score: 74-71)
Malcolm Allen attempts a 3Pt. Contested by Jimmy Davis (5.0 feet, MAN). Malcolm Allen misses. Rebound secured by Brandon Reaves.

[02:10] Team_066 possession (Score: 74-71)
Brandon Reaves loses the ball! Stripped by Myles Anthony! TURNOVER! (live ball)

[01:56] Team_022 possession (Score: 74-71)
Dirk Markkanen attempts a 3Pt. Contested by Kyle Wagner (4.7 feet, MAN). Dirk Markkanen misses. Rebound secured by Kyle Wagner.

[01:40] Team_066 possession (Score: 74-71)
Kyle Wagner attempts a Midrange. Contested by Dirk Markkanen (4.9 feet, MAN). KYLE WAGNER MAKES IT! Assist: Brandon Reaves
Score: 74-73

[01:27] Team_022 possession (Score: 74-73)
Lamelo Dosunmu drives and kicks out. Lamelo Dosunmu attempts a 3Pt. Contested by Yao Brogdon (5.6 feet, MAN). LAMELO DOSUNMU MAKES IT! Assist: Michael Ginobili
Score: 77-73

[01:13] Team_066 possession (Score: 77-73)
Kyle Wagner drives, picks up Dirk Markkanen. Help arrives from Michael Ginobili! Kyle Wagner attempts a Layup. Contested by Michael Ginobili (5.0 feet, ZONE). Kyle Wagner misses. Rebound secured by Michael Ginobili.

[01:01] Team_022 possession (Score: 77-73)
Lamelo Dosunmu attempts a 3Pt. Wide open! Pau Curry is 6.3 feet away. [ZONE] Lamelo Dosunmu misses. Rebound secured by Brandon Reaves.

[00:49] Team_066 possession (Score: 77-73)
Yao Brogdon drives, Dirk Markkanen stays with him. Yao Brogdon attempts a Dunk. Contested by Dirk Markkanen (5.5 feet, ZONE). YAO BROGDON MAKES IT! Assist: Pau Curry
Score: 77-75

[00:36] Team_022 possession (Score: 77-75)
Myles Anthony attempts a 3Pt. Wide open! Pau Curry is 6.1 feet away. [ZONE] MYLES ANTHONY MAKES IT! Assist: Lamelo Dosunmu
Score: 80-75

[00:23] Team_066 possession (Score: 80-75)
Jimmy Davis attempts a Midrange. Contested by Lamelo Dosunmu (5.7 feet, ZONE). Jimmy Davis misses. Rebound secured by Dirk Markkanen.

[00:08] Team_022 possession (Score: 80-75)
FOUL! Holding foul on Brandon Reaves. [IN THE BONUS! 5 team fouls] Myles Anthony to the line for 2 free throws. (Brandon Reaves: 2 personal fouls)   FT 1/2: GOOD   FT 2/2: MISS Myles Anthony makes 1/2 from the line. Rebound secured by Yao Brogdon.
Score: 81-75

================================================================================
                              3RD QUARTER COMPLETE                              
================================================================================

3RD QUARTER SCORE: Team_022 32, Team_066 23

BOX SCORE:
================================================================================

Team_022
--------------------------------------------------------------------------------
Player                MIN  PTS  REB  AST  TO      FG   FG%      3P   3P%
--------------------------------------------------------------------------------
Dirk Markkanen         35   10    5    0   0   4/6    66.7     0/0   0.0
Malcolm Allen          35    9    0    0   0   4/6    66.7     0/0   0.0
Lamelo Dosunmu         35    5    0    1   0   2/6    33.3     0/0   0.0
Myles Anthony          35    5    2    2   0   2/2   100.0     0/0   0.0
Michael Ginobili       35    2    5    5   0   1/2    50.0     0/0   0.0

TEAM: FG: 13/23 (56.5%), 3PT: 4/10 (40.0%), REB: 12 (3 off, 9 def), AST: 8, TO: 1
TEAM FOULS: 0


Team_066
--------------------------------------------------------------------------------
Player                MIN  PTS  REB  AST  TO      FG   FG%      3P   3P%
--------------------------------------------------------------------------------
Yao Brogdon            35    9    6    0   0   4/6    66.7     0/0   0.0
Brandon Reaves         35    8    4    2   0   3/3   100.0     0/0   0.0
Kyle Wagner            35    6    3    2   0   3/4    75.0     0/0   0.0
Jimmy Davis            35    0    0    1   0   0/4     0.0     0/0   0.0
Pau Curry              35    0    0    3   0   0/2     0.0     0/0   0.0

TEAM: FG: 10/19 (52.6%), 3PT: 3/6 (50.0%), REB: 13 (3 off, 10 def), AST: 8, TO: 4
TEAM FOULS: 5 [Team_022 in BONUS]

================================================================================

================================================================================
                       4TH QUARTER - Team_022 vs Team_066                       
================================================================================

[12:00] Team_022 possession (Score: 81-75)
Michael Ginobili drives, Kyle Wagner stays with him. Michael Ginobili attempts a Layup. Contested by Kyle Wagner (4.3 feet, ZONE). MICHAEL GINOBILI MAKES IT! Assist: Lamelo Dosunmu
Score: 83-75

[11:43] Team_066 possession (Score: 83-75)
Pau Curry attempts a 3Pt. Contested by Michael Ginobili (4.2 feet, ZONE). Pau Curry misses. Rebound secured by Michael Ginobili.

[11:30] Team_022 possession (Score: 83-75)
Malcolm Allen makes the Layup and draws the foul on Jimmy Davis! And-1! Malcolm Allen to the line for 1. [Team fouls: 1] (Jimmy Davis: 1 personal fouls)   FT 1/1: GOOD Malcolm Allen makes 1/1 from the line.
Score: 86-75

[11:18] Team_066 possession (Score: 86-75)
Jimmy Davis attempts a 3Pt. Contested by Malcolm Allen (5.3 feet, MAN). Jimmy Davis misses. Rebound secured by Dirk Markkanen.

[11:06] Team_022 possession (Score: 86-75)
Dirk Markkanen attempts a Midrange. Wide open! Pau Curry is 6.3 feet away. [ZONE] Dirk Markkanen misses. Rebound secured by Yao Brogdon.

[10:51] Team_066 possession (Score: 86-75)
Yao Brogdon drives, picks up Lamelo Dosunmu. Help arrives from Michael Ginobili! Yao Brogdon attempts a Layup. Contested by Michael Ginobili (5.7 feet, MAN). YAO BROGDON MAKES IT! Assist: Jimmy Davis
Score: 86-77

[10:35] Team_022 possession (Score: 86-77)
Lamelo Dosunmu attempts a Layup. Contested by Yao Brogdon (6.0 feet, MAN). LAMELO DOSUNMU MAKES IT! Assist: Dirk Markkanen
Score: 88-77

[10:18] Team_066 possession (Score: 88-77)
Jimmy Davis attempts a 3Pt. Contested by Malcolm Allen (5.4 feet, MAN). Jimmy Davis misses. Rebound secured by Myles Anthony.

[10:05] Team_022 possession (Score: 88-77)
Dirk Markkanen attempts a Layup. Contested by Kyle Wagner (4.9 feet, MAN). Dirk Markkanen misses. Rebound secured by Yao Brogdon.

[09:49] Team_066 possession (Score: 88-77)
Pau Curry attempts a Midrange. Contested by Lamelo Dosunmu (5.6 feet, ZONE). PAU CURRY MAKES IT! Assist: Brandon Reaves
Score: 88-79

[09:37] Team_022 possession (Score: 88-79)
Lamelo Dosunmu attempts a 3Pt. Wide open! Yao Brogdon is 6.1 feet away. [MAN] Lamelo Dosunmu misses. Rebound secured by Kyle Wagner.

[09:23] Team_066 possession (Score: 88-79)
Kyle Wagner attempts a Midrange. Contested by Lamelo Dosunmu (5.3 feet, ZONE). Kyle Wagner misses. Rebound secured by Michael Ginobili.

[09:12] Team_022 possession (Score: 88-79)
Dirk Markkanen drives to the basket... Dirk Markkanen throws a bad pass! Stolen by Kyle Wagner! TURNOVER! (live ball)

[08:54] Team_066 possession (Score: 88-79)
Yao Brogdon attempts a Layup. Contested by Dirk Markkanen (5.8 feet, ZONE). YAO BROGDON MAKES IT!
Score: 88-81

[08:39] Team_022 possession (Score: 88-81)
Myles Anthony loses the ball! Stripped by Brandon Reaves! TURNOVER! (live ball)

[08:26] Team_066 possession (Score: 88-81)
Brandon Reaves attempts a Midrange. Contested by Myles Anthony (5.7 feet, MAN). Brandon Reaves misses. Rebound secured by Dirk Markkanen.

[08:08] Team_022 possession (Score: 88-81)
Lamelo Dosunmu drives, picks up Yao Brogdon. Help arrives from Jimmy Davis! Lamelo Dosunmu attempts a Layup. Wide open! Jimmy Davis is 6.2 feet away. [MAN] LAMELO DOSUNMU MAKES IT!
Score: 90-81

[07:51] Team_066 possession (Score: 90-81)
Brandon Reaves drives, picks up Myles Anthony. Help arrives from Michael Ginobili! Brandon Reaves attempts a Layup. Contested by Michael Ginobili (5.8 feet, MAN). BRANDON REAVES MAKES IT! Assist: Kyle Wagner
Score: 90-83

[07:33] Team_022 possession (Score: 90-83)
Myles Anthony attempts a 3Pt. Contested by Brandon Reaves (6.0 feet, ZONE). Myles Anthony misses. Rebound secured by Yao Brogdon.

[07:20] Team_066 possession (Score: 90-83)
Yao Brogdon attempts a Midrange. Contested by Michael Ginobili (4.9 feet, ZONE). Yao Brogdon misses. Rebound secured by Dirk Markkanen.

[07:03] Team_022 possession (Score: 90-83)
Myles Anthony makes the Midrange and draws the foul on Pau Curry! And-1! Myles Anthony to the line for 1. [Team fouls: 2] (Pau Curry: 1 personal fouls)   FT 1/1: GOOD Myles Anthony makes 1/1 from the line.
Score: 93-83

[06:49] Team_066 possession (Score: 93-83)
Yao Brogdon attempts a Layup. Contested by Dirk Markkanen (6.0 feet, ZONE). YAO BROGDON MAKES IT! Assist: Pau Curry
Score: 93-85

[06:35] Team_022 possession (Score: 93-85)
Dirk Markkanen drives, picks up Kyle Wagner. Help arrives from Jimmy Davis! Dirk Markkanen attempts a Layup. Contested by Jimmy Davis (5.3 feet, MAN). Dirk Markkanen misses. Rebound secured by Yao Brogdon.

[06:20] Team_066 possession (Score: 93-85)
Jimmy Davis attempts a 3Pt. Contested by Myles Anthony (5.9 feet, ZONE). Jimmy Davis misses. Rebound secured by Myles Anthony.

[06:05] Team_022 possession (Score: 93-85)
Dirk Markkanen attempts a Midrange. Wide open! Pau Curry is 6.8 feet away. [ZONE] Dirk Markkanen misses. Rebound secured by Yao Brogdon.

[05:47] Team_066 possession (Score: 93-85)
Yao Brogdon drives, Lamelo Dosunmu stays with him. Yao Brogdon attempts a Layup. Wide open! Lamelo Dosunmu is 6.3 feet away. [MAN] Yao Brogdon misses. Rebound secured by Dirk Markkanen.

[05:30] Team_022 possession (Score: 93-85)
Malcolm Allen drives to the basket... Malcolm Allen loses control! Ball rolls out of bounds! TURNOVER! (dead ball)

[05:30] Substitution (Team_022): Malcolm Allen OUT → DeMar Harden IN (stamina_rule2)

[05:30] Substitution (Team_022): Michael Ginobili OUT → Lauri Gobert IN (stamina_rule2)

[05:30] Substitution (Team_022): Myles Anthony OUT → Dejounte Towns IN (stamina_rule2)

[05:30] Substitution (Team_022): Lamelo Dosunmu OUT → Kawhi Russell IN (stamina_rule2)

[05:30] Substitution (Team_022): Dirk Markkanen OUT → Cole Iverson IN (stamina_rule2)

[05:30] Substitution (Team_066): Jimmy Davis OUT → Pascal Carter IN (stamina_rule2)

[05:30] Substitution (Team_066): Pau Curry OUT → Lauri LaVine IN (stamina_rule2)

[05:30] Substitution (Team_066): Brandon Reaves OUT → Brandon Middleton IN (stamina_rule2)

[05:30] Substitution (Team_066): Yao Brogdon OUT → Cole Morant IN (stamina_rule2)

[05:30] Substitution (Team_066): Kyle Wagner OUT → Donovan Simmons IN (stamina_rule2)

[05:11] Team_066 possession (Score: 93-85)
Cole Morant drives, Kawhi Russell stays with him. Cole Morant attempts a Dunk. Contested by Kawhi Russell (4.6 feet, ZONE). Cole Morant misses. Rebound secured by Lauri Gobert.

[04:55] Team_022 possession (Score: 93-85)
Lauri Gobert attempts a 3Pt. Contested by Lauri LaVine (3.9 feet, ZONE). LAURI GOBERT MAKES IT! Assist: DeMar Harden
Score: 96-85

[04:41] Team_066 possession (Score: 96-85)
Cole Morant attempts a 3Pt. Contested by Kawhi Russell (4.6 feet, ZONE). Cole Morant misses. Rebound secured by Dejounte Towns.

[04:24] Team_022 possession (Score: 96-85)
DeMar Harden attempts a 3Pt. Contested by Lauri LaVine (3.9 feet, ZONE). DeMar Harden misses. FOUL! Loose ball foul on Lauri LaVine during the rebound battle. [Team fouls: 3] No free throws, side out. (Lauri LaVine: 1 personal fouls)

[04:13] Team_022 possession (Score: 96-85)
Lauri Gobert attempts a 3Pt. Contested by Lauri LaVine (3.9 feet, ZONE). Lauri Gobert misses. Rebound secured by Donovan Simmons.

[04:03] Team_066 possession (Score: 96-85)
Brandon Middleton attempts a Midrange. Contested by Dejounte Towns (4.2 feet, MAN). BRANDON MIDDLETON MAKES IT! Assist: Pascal Carter
Score: 96-87

[03:47] Team_022 possession (Score: 96-87)
Kawhi Russell attempts a 3Pt. Contested by Lauri LaVine (4.2 feet, ZONE). Kawhi Russell misses. Rebound secured by Donovan Simmons.

[03:31] Team_066 possession (Score: 96-87)
Donovan Simmons makes the Layup and draws the foul on Kawhi Russell! And-1! Donovan Simmons to the line for 1. [Team fouls: 1] (Kawhi Russell: 1 personal fouls)   FT 1/1: GOOD Donovan Simmons makes 1/1 from the line.
Score: 96-90

[03:14] Team_022 possession (Score: 96-90)
Lauri Gobert attempts a 3Pt. Contested by Lauri LaVine (3.9 feet, ZONE). Lauri Gobert misses. Rebound secured by Lauri LaVine.

[02:59] Team_066 possession (Score: 96-90)
Brandon Middleton attempts a 3Pt. Contested by Dejounte Towns (4.2 feet, MAN). Brandon Middleton misses. Rebound secured by Dejounte Towns.

[02:40] Team_022 possession (Score: 96-90)
Dejounte Towns makes the Layup and draws the foul on Brandon Middleton! And-1! Dejounte Towns to the line for 1. [Team fouls: 4] (Brandon Middleton: 1 personal fouls)   FT 1/1: MISS Dejounte Towns makes 0/1 from the line. Rebound secured by Donovan Simmons.
Score: 98-90

[02:28] Team_066 possession (Score: 98-90)
Brandon Middleton attempts a Layup. BLOCKED BY DEJOUNTE TOWNS! Ball is loose! Rebound secured by Lauri Gobert.

[02:19] Team_022 possession (Score: 98-90)
Lauri Gobert attempts a Midrange. Contested by Cole Morant (5.5 feet, ZONE). Lauri Gobert misses. FOUL! Loose ball foul on Brandon Middleton during the rebound battle. [IN THE BONUS! 5 team fouls] Dejounte Towns to the line for 2 free throws. (Brandon Middleton: 2 personal fouls)   FT 1/2: GOOD   FT 2/2: GOOD Dejounte Towns makes 2/2 from the line.
Score: 100-90

[02:01] Team_066 possession (Score: 100-90)
FOUL! Reach-in foul on Kawhi Russell during the drive. [Team fouls: 2] No free throws, side out. (Kawhi Russell: 2 personal fouls)

[01:47] Team_066 possession (Score: 100-90)
FOUL! Shooting foul on Kawhi Russell. Pascal Carter to the line for 2 free throws. [Team fouls: 3] (Kawhi Russell: 3 personal fouls)   FT 1/2: MISS   FT 2/2: GOOD Pascal Carter makes 1/2 from the line.
Score: 100-91

[01:30] Team_022 possession (Score: 100-91)
FOUL! Holding foul on Cole Morant. [IN THE BONUS! 6 team fouls] Kawhi Russell to the line for 2 free throws. (Cole Morant: 1 personal fouls)   FT 1/2: MISS   FT 2/2: MISS Kawhi Russell makes 0/2 from the line. Offensive rebound by Lauri Gobert! Lauri Gobert kicks it out.

[01:17] Team_022 possession (Score: 100-91)
Lauri Gobert attempts a 3Pt. Contested by Lauri LaVine (3.9 feet, ZONE). Lauri Gobert misses. FOUL! Loose ball foul on Brandon Middleton during the rebound battle. [IN THE BONUS! 7 team fouls] Dejounte Towns to the line for 2 free throws. (Brandon Middleton: 3 personal fouls)   FT 1/2: GOOD   FT 2/2: GOOD Dejounte Towns makes 2/2 from the line.
Score: 102-91

[01:06] Team_066 possession (Score: 102-91)
Cole Morant attempts a Midrange. Contested by Kawhi Russell (4.6 feet, MAN). Cole Morant misses. Offensive rebound by Donovan Simmons! Donovan Simmons kicks it out.

[00:52] Team_066 possession (Score: 102-91)
Pascal Carter makes the Dunk and draws the foul on Lauri Gobert! And-1! Pascal Carter to the line for 1. [Team fouls: 4] (Lauri Gobert: 1 personal fouls)   FT 1/1: MISS Pascal Carter makes 0/1 from the line. Rebound secured by Lauri Gobert.
Score: 102-93

[00:36] Team_022 possession (Score: 102-93)
DeMar Harden drives to the basket... DeMar Harden loses the ball! Stripped by Donovan Simmons! TURNOVER! (live ball)

[00:20] Team_066 possession (Score: 102-93)
Lauri LaVine attempts a Midrange. Contested by Dejounte Towns (4.6 feet, ZONE). Lauri LaVine misses. Offensive rebound by Lauri LaVine! Lauri LaVine kicks it out.

[00:06] Team_066 possession (Score: 102-93)
Donovan Simmons attempts a Layup. Contested by Cole Iverson (5.1 feet, MAN). DONOVAN SIMMONS MAKES IT! Assist: Lauri LaVine
Score: 102-95

================================================================================
                              4TH QUARTER COMPLETE                              
================================================================================

4TH QUARTER SCORE: Team_022 21, Team_066 20

BOX SCORE:
================================================================================

Team_022
--------------------------------------------------------------------------------
Player                MIN  PTS  REB  AST  TO      FG   FG%      3P   3P%
--------------------------------------------------------------------------------
Lamelo Dosunmu         42    4    0    1   0   2/3    66.7     0/0   0.0
Dejounte Towns          7    4    2    0   0   2/3    66.7     0/0   0.0
Malcolm Allen          42    3    0    0   0   1/1   100.0     0/0   0.0
Myles Anthony          42    3    2    0   0   1/2    50.0     0/0   0.0
Lauri Gobert            7    3    5    0   0   1/3    33.3     0/0   0.0
Michael Ginobili       42    2    2    0   0   1/1   100.0     0/0   0.0
Dirk Markkanen         42    0    4    1   0   0/4     0.0     0/0   0.0
DeMar Harden            7    0    0    1   0   0/0     0.0     0/0   0.0
Kawhi Russell           7    0    0    0   0   0/1     0.0     0/0   0.0

TEAM: FG: 8/18 (44.4%), 3PT: 2/7 (28.6%), REB: 15 (2 off, 13 def), AST: 3, TO: 4
TEAM FOULS: 4


Team_066
--------------------------------------------------------------------------------
Player                MIN  PTS  REB  AST  TO      FG   FG%      3P   3P%
--------------------------------------------------------------------------------
Yao Brogdon            42    6    5    0   0   3/5    60.0     0/0   0.0
Donovan Simmons         7    5    4    0   0   2/2   100.0     0/0   0.0
Pau Curry              42    2    0    1   0   1/2    50.0     0/0   0.0
Brandon Reaves         42    2    0    1   0   1/2    50.0     0/0   0.0
Brandon Middleton       7    2    0    0   0   1/3    33.3     0/0   0.0
Pascal Carter           7    1    0    1   0   1/2    50.0     0/0   0.0
Jimmy Davis            42    0    0    1   0   0/3     0.0     0/0   0.0
Kyle Wagner            42    0    1    1   0   0/1     0.0     0/0   0.0
Cole Morant             7    0    0    0   0   0/2     0.0     0/0   0.0
Lauri LaVine            7    0    2    1   0   0/0     0.0     0/0   0.0

TEAM: FG: 9/22 (40.9%), 3PT: 0/6 (0.0%), REB: 12 (2 off, 10 def), AST: 6, TO: 0
TEAM FOULS: 7 [Team_022 in BONUS]

================================================================================

================================================================================
                               FULL GAME COMPLETE                               
================================================================================

FINAL SCORE: Team_022 102, Team_066 95

SCORING BY QUARTER:
--------------------------------------------------------------------------------
Team                     Q1     Q2     Q3     Q4    FINAL
--------------------------------------------------------------------------------
Team_022                 30     19     32     21      102
Team_066                 25     27     23     20       95
--------------------------------------------------------------------------------

FULL GAME BOX SCORE:
================================================================================

Team_022
--------------------------------------------------------------------------------
Player                MIN  PTS  REB  AST  TO      FG   FG%      3P   3P%      FT STL BLK
--------------------------------------------------------------------------------
Malcolm Allen          42   18    0    1   2   9/14   64.3   1/5    20.0   3/3     0   0
Michael Ginobili       42   23   14   10   2   8/14   57.1   4/9    44.4   5/6     0   0
Myles Anthony          42   12    9    4   4   5/9    55.6   1/4    25.0   2/3     2   0
Lamelo Dosunmu         42   16    0    3   1   7/14   50.0   0/4     0.0   3/3     2   0
Dirk Markkanen         42   21   13    3   0   9/17   52.9   3/4    75.0   3/3     0   0
DeMar Harden            7    1    0    1   0   0/0     0.0   0/0     0.0   1/2     0   0
Lauri Gobert            7    3    5    0   0   3/5    60.0   2/4    50.0   0/0     0   0
Dejounte Towns          7    4    3    0   0   0/1     0.0   0/0     0.0   4/5     0   1
Kawhi Russell           7    1    1    0   1   1/2    50.0   0/1     0.0   1/4     0   0
Cole Iverson            7    0    0    0   0   0/0     0.0   0/0     0.0   0/0     0   0

TEAM: FG: 44/79 (55.7%), 3PT: 11/31 (35.5%), REB: 45 (10 off, 35 def), AST: 22, TO: 10


Team_066
--------------------------------------------------------------------------------
Player                MIN  PTS  REB  AST  TO      FG   FG%      3P   3P%      FT STL BLK
--------------------------------------------------------------------------------
Jimmy Davis            42   10    0    6   1   5/15   33.3   0/6     0.0   6/7     0   0
Pau Curry              42   16    0    4   1   7/16   43.8   1/7    14.3   3/4     0   0
Brandon Reaves         42   18    8    5   3   6/8    75.0   4/5    80.0   0/0     2   0
Yao Brogdon            42   17   21    1   3   8/13   61.5   1/2    50.0   1/2     1   0
Kyle Wagner            42   23   10    5   0  10/13   76.9   1/2    50.0   4/4     1   1
Pascal Carter           7    1    0    1   1   1/2    50.0   0/0     0.0   1/3     0   0
Lauri LaVine            7    0    2    1   1   0/0     0.0   0/0     0.0   0/0     0   0
Brandon Middleton       7    2    0    0   0   1/4    25.0   0/1     0.0   0/0     0   0
Cole Morant             7    0    0    0   0   0/2     0.0   0/1     0.0   0/0     0   0
Donovan Simmons         7    5    4    0   0   2/2   100.0   0/0     0.0   1/1     1   0

TEAM: FG: 42/77 (54.5%), 3PT: 7/24 (29.2%), REB: 45 (10 off, 35 def), AST: 23, TO: 10

================================================================================
