================================================================================
                        FULL GAME - Team_025 vs Team_086                        
================================================================================

================================================================================
                       1ST QUARTER - Team_025 vs Team_086                       
================================================================================

[12:00] Team_025 possession (Score: 0-0)
Paolo Lowry attempts a 3Pt. Contested by Lauri Johnson (4.8 feet, MAN). PAOLO LOWRY MAKES IT! Assist: Allen Embiid
Score: 3-0

[11:46] Team_086 possession (Score: 3-0)
Bones Ginobili drives, picks up Cade Anthony. Help arrives from Ben Giddey! Bones Ginobili attempts a Dunk. Contested by Ben Giddey (4.6 feet, MAN). Bones Ginobili misses. Rebound secured by Cade Anthony.

[11:31] Team_025 possession (Score: 3-0)
Ben Giddey attempts a Midrange. Contested by Anfernee Harris (4.7 feet, MAN). Ben Giddey misses. Rebound secured by Miles Gobert.

[11:16] Team_086 possession (Score: 3-0)
FOUL! Shooting foul on Desmond Jordan. Miles Gobert to the line for 3 free throws. [Team fouls: 1] (Desmond Jordan: 1 personal fouls)   FT 1/3: GOOD   FT 2/3: GOOD   FT 3/3: MISS Miles Gobert makes 2/3 from the line. Rebound secured by Desmond Jordan.
Score: 3-2

[11:01] Team_025 possession (Score: 3-2)
Cade Anthony attempts a Midrange. Contested by Miles Gobert (4.2 feet, ZONE). Cade Anthony misses. Rebound secured by Miles Gobert.

[10:48] Team_086 possession (Score: 3-2)
Bones Ginobili loses the ball! Stripped by Cade Anthony! TURNOVER! (live ball)

[10:33] Team_025 possession (Score: 3-2)
Ben Giddey drives and kicks out. Cade Anthony attempts a Midrange. Contested by Miles Gobert (3.5 feet, ZONE). Cade Anthony misses. Offensive rebound by Desmond Jordan! Desmond Jordan's putback is no good. Offensive rebound by Allen Embiid! Allen Embiid kicks it out.

[10:19] Team_025 possession (Score: 3-2)
Paolo Lowry attempts a 3Pt. Contested by Bones Ginobili (5.2 feet, ZONE). PAOLO LOWRY MAKES IT! Assist: Allen Embiid
Score: 6-2

[10:05] Team_086 possession (Score: 6-2)
Miles Gobert attempts a 3Pt. Contested by Paolo Lowry (5.1 feet, ZONE). Miles Gobert misses. Rebound secured by Allen Embiid.

[09:49] Team_025 possession (Score: 6-2)
Paolo Lowry attempts a 3Pt. Contested by Lauri Johnson (4.8 feet, MAN). PAOLO LOWRY MAKES IT! Assist: Allen Embiid
Score: 9-2

[09:33] Team_086 possession (Score: 9-2)
Lauri Johnson attempts a Midrange. Contested by Paolo Lowry (5.1 feet, MAN). LAURI JOHNSON MAKES IT!
Score: 9-4

[09:18] Team_025 possession (Score: 9-4)
Ben Giddey throws a bad pass out of bounds! TURNOVER! (dead ball)

[09:07] Team_086 possession (Score: 9-4)
Miles Gobert attempts a Dunk. BLOCKED BY ALLEN EMBIID! Ball is loose! Rebound secured by Cade Anthony.

[08:53] Team_025 possession (Score: 9-4)
FOUL! Reach-in foul on Rudy Rose during the drive. [Team fouls: 1] No free throws, side out. (Rudy Rose: 1 personal fouls)

[08:37] Team_025 possession (Score: 9-4)
Ben Giddey drives and kicks out. Cade Anthony attempts a 3Pt. Contested by Lauri Johnson (4.4 feet, ZONE). CADE ANTHONY MAKES IT! Assist: Allen Embiid
Score: 12-4

[08:18] Team_086 possession (Score: 12-4)
Rudy Rose drives, Allen Embiid stays with him. Rudy Rose attempts a Dunk. Contested by Allen Embiid (3.1 feet, ZONE). Rudy Rose misses. Rebound secured by Allen Embiid.

[08:00] Team_025 possession (Score: 12-4)
FOUL! Holding foul on Bones Ginobili. [Team fouls: 2] No free throws, side out. (Bones Ginobili: 1 personal fouls)

[07:44] Team_025 possession (Score: 12-4)
Desmond Jordan attempts a Midrange. Contested by Miles Gobert (3.7 feet, ZONE). Desmond Jordan misses. Rebound secured by Bones Ginobili.

[07:28] Team_086 possession (Score: 12-4)
Bones Ginobili attempts a 3Pt. Contested by Cade Anthony (4.6 feet, MAN). Bones Ginobili misses. Rebound secured by Allen Embiid.

[07:12] Team_025 possession (Score: 12-4)
Ben Giddey attempts a 3Pt. Contested by Anfernee Harris (4.7 feet, MAN). Ben Giddey misses. Rebound secured by Bones Ginobili.

[06:57] Team_086 possession (Score: 12-4)
Bones Ginobili attempts a Midrange. Contested by Paolo Lowry (5.3 feet, ZONE). Bones Ginobili misses. Rebound secured by Allen Embiid.

[06:43] Team_025 possession (Score: 12-4)
Allen Embiid drives and kicks out. Ben Giddey attempts a Midrange. Contested by Rudy Rose (3.7 feet, ZONE). BEN GIDDEY MAKES IT! Assist: Paolo Lowry
Score: 14-4

[06:31] Team_086 possession (Score: 14-4)
Rudy Rose attempts a 3Pt. Contested by Ben Giddey (3.9 feet, ZONE). Rudy Rose misses. Rebound secured by Allen Embiid.

[06:17] Team_025 possession (Score: 14-4)
Allen Embiid attempts a 3Pt. Contested by Lauri Johnson (4.5 feet, ZONE). Allen Embiid misses. Offensive rebound by Allen Embiid! Allen Embiid's putback is no good. Rebound secured by Bones Ginobili.

[06:02] Team_086 possession (Score: 14-4)
Anfernee Harris attempts a Layup. BLOCKED BY BEN GIDDEY! Ball is loose! Rebound secured by Cade Anthony.

[05:49] Team_025 possession (Score: 14-4)
Ben Giddey attempts a Layup. Contested by Anfernee Harris (4.7 feet, MAN). BEN GIDDEY MAKES IT!
Score: 16-4

[05:37] Team_086 possession (Score: 16-4)
FOUL! Holding foul on Ben Giddey. [Team fouls: 2] No free throws, side out. (Ben Giddey: 1 personal fouls)

[05:28] Team_086 possession (Score: 16-4)
Rudy Rose attempts a Layup. Contested by Allen Embiid (3.2 feet, ZONE). RUDY ROSE MAKES IT! Assist: Miles Gobert
Score: 16-6

[05:16] Team_025 possession (Score: 16-6)
Ben Giddey attempts a 3Pt. Contested by Lauri Johnson (4.9 feet, ZONE). Ben Giddey misses. Rebound secured by Miles Gobert.

[05:06] Team_086 possession (Score: 16-6)
Anfernee Harris attempts a 3Pt. Contested by Ben Giddey (4.2 feet, MAN). Anfernee Harris misses. Rebound secured by Cade Anthony.

[04:53] Team_025 possession (Score: 16-6)
Cade Anthony attempts a 3Pt. Contested by Lauri Johnson (5.1 feet, ZONE). Cade Anthony misses. FOUL! Loose ball foul on Miles Gobert during the rebound battle. [Team fouls: 3] No free throws, side out. (Miles Gobert: 1 personal fouls)

[04:37] Team_025 possession (Score: 16-6)
Desmond Jordan attempts a 3Pt. Contested by Miles Gobert (3.7 feet, MAN). Desmond Jordan misses. Rebound secured by Rudy Rose.

[04:24] Team_086 possession (Score: 16-6)
Bones Ginobili attempts a Midrange. Contested by Cade Anthony (4.7 feet, MAN). Bones Ginobili misses. Rebound secured by Cade Anthony.

[04:10] Team_025 possession (Score: 16-6)
Paolo Lowry attempts a Midrange. Contested by Lauri Johnson (4.8 feet, MAN). Paolo Lowry misses. Rebound secured by Rudy Rose.

[03:57] Team_086 possession (Score: 16-6)
Lauri Johnson attempts a Midrange. Contested by Paolo Lowry (5.2 feet, MAN). Lauri Johnson misses. Rebound secured by Allen Embiid.

[03:40] Team_025 possession (Score: 16-6)
FOUL! Holding foul on Rudy Rose. [Team fouls: 4] No free throws, side out. (Rudy Rose: 2 personal fouls)

[03:30] Team_025 possession (Score: 16-6)
Cade Anthony attempts a Layup. Contested by Rudy Rose (4.5 feet, ZONE). Cade Anthony misses. Offensive rebound by Desmond Jordan! Desmond Jordan puts it back in!
Score: 18-6

[03:19] Team_086 possession (Score: 18-6)
Miles Gobert attempts a Midrange. Contested by Desmond Jordan (3.8 feet, MAN). Miles Gobert misses. Rebound secured by Desmond Jordan.

[03:05] Team_025 possession (Score: 18-6)
Ben Giddey drives, Rudy Rose stays with him. Ben Giddey attempts a Dunk. Contested by Rudy Rose (4.3 feet, ZONE). BEN GIDDEY MAKES IT!
Score: 20-6

[02:53] Team_086 possession (Score: 20-6)
Rudy Rose attempts a 3Pt. Contested by Ben Giddey (4.1 feet, ZONE). Rudy Rose misses. Rebound secured by Desmond Jordan.

[02:39] Team_025 possession (Score: 20-6)
Allen Embiid drives and kicks out. Ben Giddey attempts a 3Pt. Contested by Lauri Johnson (4.6 feet, ZONE). Ben Giddey misses. Offensive rebound by Desmond Jordan! Desmond Jordan puts it back in!
Score: 22-6

[02:26] Team_086 possession (Score: 22-6)
Miles Gobert drives to the basket... Miles Gobert loses control! Ball rolls out of bounds! TURNOVER! (dead ball)

[02:26] Substitution (Team_025): Paolo Lowry OUT → LeBron Griffin IN (stamina_rule2)

[02:26] Substitution (Team_025): Ben Giddey OUT → Dirk Gilgeous-Alexander IN (stamina_rule2)

[02:26] Substitution (Team_025): Desmond Jordan OUT → Immanuel LaVine IN (stamina_rule2)

[02:26] Substitution (Team_025): Allen Embiid OUT → Nikola Lillard IN (stamina_rule2)

[02:26] Substitution (Team_086): Lauri Johnson OUT → Anfernee Green IN (stamina_rule2)

[02:26] Substitution (Team_086): Anfernee Harris OUT → Anthony James IN (stamina_rule2)

[02:26] Substitution (Team_086): Bones Ginobili OUT → Kyle McCollum IN (stamina_rule2)

[02:26] Substitution (Team_086): Rudy Rose OUT → Lamelo Towns IN (stamina_rule2)

[02:09] Team_025 possession (Score: 22-6)
FOUL! Shooting foul on Anfernee Green. Nikola Lillard to the line for 2 free throws. [BONUS: 5 team fouls] (Anfernee Green: 1 personal fouls)   FT 1/2: GOOD   FT 2/2: GOOD Nikola Lillard makes 2/2 from the line.
Score: 24-6

[01:56] Team_086 possession (Score: 24-6)
Anthony James attempts a Layup. Wide open! Dirk Gilgeous-Alexander is 6.3 feet away. [MAN] ANTHONY JAMES MAKES IT! Assist: Lamelo Towns
Score: 24-8

[01:43] Team_025 possession (Score: 24-8)
Cade Anthony drives, Kyle McCollum stays with him. Cade Anthony attempts a Layup. Contested by Kyle McCollum (5.9 feet, MAN). CADE ANTHONY MAKES IT!
Score: 26-8

[01:29] Team_086 possession (Score: 26-8)
Kyle McCollum attempts a 3Pt. Contested by Cade Anthony (4.6 feet, ZONE). Kyle McCollum misses. Rebound secured by Nikola Lillard.

[01:14] Team_025 possession (Score: 26-8)
Dirk Gilgeous-Alexander makes the Midrange and draws the foul on Kyle McCollum! And-1! Dirk Gilgeous-Alexander to the line for 1. [BONUS: 6 team fouls] (Kyle McCollum: 1 personal fouls)   FT 1/1: MISS Dirk Gilgeous-Alexander makes 0/1 from the line. Rebound secured by Miles Gobert.
Score: 28-8

[01:01] Team_086 possession (Score: 28-8)
Miles Gobert attempts a Layup. Contested by Cade Anthony (4.8 feet, ZONE). Miles Gobert misses. Rebound secured by Cade Anthony.

[00:50] Team_025 possession (Score: 28-8)
Nikola Lillard attempts a Midrange. Contested by Kyle McCollum (5.4 feet, ZONE). NIKOLA LILLARD MAKES IT! Assist: LeBron Griffin
Score: 30-8

[00:41] Team_086 possession (Score: 30-8)
Lamelo Towns drives and kicks out. Anfernee Green attempts a Midrange. Contested by LeBron Griffin (4.7 feet, MAN). ANFERNEE GREEN MAKES IT! Assist: Kyle McCollum
Score: 30-10

[00:23] Team_025 possession (Score: 30-10)
Immanuel LaVine attempts a Midrange. Contested by Anfernee Green (4.2 feet, ZONE). Immanuel LaVine misses. Rebound secured by Anfernee Green.

[00:11] Team_086 possession (Score: 30-10)
FOUL! Reach-in foul on Immanuel LaVine during the drive. [Team fouls: 3] No free throws, side out. (Immanuel LaVine: 1 personal fouls)

================================================================================
                              1ST QUARTER COMPLETE                              
================================================================================

1ST QUARTER SCORE: Team_025 30, Team_086 10

BOX SCORE:
================================================================================

Team_025
--------------------------------------------------------------------------------
Player                MIN  PTS  REB  AST  TO      FG   FG%      3P   3P%
--------------------------------------------------------------------------------
Paolo Lowry            10    9    0    1   0   3/4    75.0     0/0   0.0
Ben Giddey             10    6    0    0   0   3/6    50.0     0/0   0.0
Cade Anthony           12    5    6    0   0   2/3    66.7     0/0   0.0
Desmond Jordan         10    4    5    0   0   2/4    50.0     0/0   0.0
Nikola Lillard          2    4    1    0   0   2/2   100.0     0/0   0.0
Allen Embiid           10    0    8    4   0   0/1     0.0     0/0   0.0
Dirk Gilgeous-Alexander    2    0    0    0   0   0/1     0.0     0/0   0.0
LeBron Griffin          2    0    0    1   0   0/0     0.0     0/0   0.0
Immanuel LaVine         2    0    0    0   0   0/1     0.0     0/0   0.0

TEAM: FG: 12/22 (54.5%), 3PT: 3/7 (42.9%), REB: 21 (5 off, 16 def), AST: 6, TO: 1
TEAM FOULS: 3


Team_086
--------------------------------------------------------------------------------
Player                MIN  PTS  REB  AST  TO      FG   FG%      3P   3P%
--------------------------------------------------------------------------------
Lauri Johnson          10    2    0    0   0   1/2    50.0     0/0   0.0
Rudy Rose              10    2    2    0   0   1/4    25.0     0/0   0.0
Anthony James           2    2    0    0   0   1/1   100.0     0/0   0.0
Anfernee Green          2    2    1    0   0   1/1   100.0     0/0   0.0
Bones Ginobili         10    0    3    0   0   0/4     0.0     0/0   0.0
Miles Gobert           12    0    4    1   0   0/5     0.0     0/0   0.0
Anfernee Harris        10    0    0    0   0   0/2     0.0     0/0   0.0
Lamelo Towns            2    0    0    1   0   0/0     0.0     0/0   0.0
Kyle McCollum           2    0    0    1   0   0/1     0.0     0/0   0.0

TEAM: FG: 4/20 (20.0%), 3PT: 0/7 (0.0%), REB: 9 (0 off, 9 def), AST: 3, TO: 2
TEAM FOULS: 6 [Team_025 in BONUS]

================================================================================

================================================================================
                       2ND QUARTER - Team_025 vs Team_086                       
================================================================================

[12:00] Team_025 possession (Score: 30-10)
Paolo Lowry drives, picks up Lauri Johnson. Help arrives from Miles Gobert! Paolo Lowry attempts a Dunk. Contested by Miles Gobert (4.8 feet, MAN). PAOLO LOWRY MAKES IT!
Score: 32-10

[11:46] Team_086 possession (Score: 32-10)
Bones Ginobili makes the Layup and draws the foul on Ben Giddey! And-1! Bones Ginobili to the line for 1. [Team fouls: 1] (Ben Giddey: 1 personal fouls)   FT 1/1: GOOD Bones Ginobili makes 1/1 from the line.
Score: 32-13

[11:30] Team_025 possession (Score: 32-13)
Paolo Lowry attempts a Midrange. Contested by Lauri Johnson (4.8 feet, MAN). Paolo Lowry misses. Rebound secured by Bones Ginobili.

[11:20] Team_086 possession (Score: 32-13)
FOUL! Reach-in foul on Cade Anthony during the drive. [Team fouls: 2] No free throws, side out. (Cade Anthony: 1 personal fouls)

[11:05] Team_086 possession (Score: 32-13)
Anfernee Harris drives, Allen Embiid stays with him. Anfernee Harris attempts a Layup. Contested by Allen Embiid (3.6 feet, ZONE). ANFERNEE HARRIS MAKES IT! Assist: Rudy Rose
Score: 32-15

[10:52] Team_025 possession (Score: 32-15)
Cade Anthony attempts a Midrange. Contested by Anfernee Harris (5.0 feet, ZONE). Cade Anthony misses. Offensive rebound by Desmond Jordan! Desmond Jordan's putback is no good. Offensive rebound by Allen Embiid! Allen Embiid kicks it out.

[10:37] Team_025 possession (Score: 32-15)
Allen Embiid throws a bad pass! Stolen by Rudy Rose! TURNOVER! (live ball)

[10:20] Team_086 possession (Score: 32-15)
FOUL! Shooting foul on Allen Embiid. Miles Gobert to the line for 2 free throws. [Team fouls: 3] (Allen Embiid: 1 personal fouls)   FT 1/2: GOOD   FT 2/2: GOOD Miles Gobert makes 2/2 from the line.
Score: 32-17

[10:06] Team_025 possession (Score: 32-17)
Paolo Lowry drives and kicks out. Paolo Lowry attempts a Midrange. Contested by Anfernee Harris (4.4 feet, ZONE). PAOLO LOWRY MAKES IT! Assist: Desmond Jordan
Score: 34-17

[09:49] Team_086 possession (Score: 34-17)
FOUL! Shooting foul on Allen Embiid. Rudy Rose to the line for 2 free throws. [Team fouls: 4] (Allen Embiid: 2 personal fouls)   FT 1/2: GOOD   FT 2/2: GOOD Rudy Rose makes 2/2 from the line.
Score: 34-19

[09:36] Team_025 possession (Score: 34-19)
FOUL! Shooting foul on Bones Ginobili. Cade Anthony to the line for 2 free throws. [Team fouls: 1] (Bones Ginobili: 1 personal fouls)   FT 1/2: MISS   FT 2/2: GOOD Cade Anthony makes 1/2 from the line.
Score: 35-19

[09:21] Team_086 possession (Score: 35-19)
Lauri Johnson attempts a Midrange. Contested by Paolo Lowry (5.3 feet, MAN). LAURI JOHNSON MAKES IT! Assist: Bones Ginobili
Score: 35-21

[09:05] Team_025 possession (Score: 35-21)
Allen Embiid attempts a Layup. Contested by Rudy Rose (4.1 feet, MAN). ALLEN EMBIID MAKES IT!
Score: 37-21

[08:48] Team_086 possession (Score: 37-21)
Miles Gobert throws a bad pass! Stolen by Desmond Jordan! TURNOVER! (live ball)

[08:29] Team_025 possession (Score: 37-21)
FOUL! Shooting foul on Lauri Johnson. Paolo Lowry to the line for 2 free throws. [Team fouls: 2] (Lauri Johnson: 1 personal fouls)   FT 1/2: GOOD   FT 2/2: GOOD Paolo Lowry makes 2/2 from the line.
Score: 39-21

[08:11] Team_086 possession (Score: 39-21)
Lauri Johnson loses the ball! Stripped by Paolo Lowry! TURNOVER! (live ball)

[07:57] Team_025 possession (Score: 39-21)
Desmond Jordan drives, picks up Rudy Rose. Help arrives from Anfernee Harris! Desmond Jordan attempts a Dunk. Contested by Anfernee Harris (4.2 feet, ZONE). DESMOND JORDAN MAKES IT! Assist: Cade Anthony
Score: 41-21

[07:42] Team_086 possession (Score: 41-21)
Lauri Johnson makes the Layup and draws the foul on Paolo Lowry! And-1! Lauri Johnson to the line for 1. [BONUS: 5 team fouls] (Paolo Lowry: 1 personal fouls)   FT 1/1: GOOD Lauri Johnson makes 1/1 from the line.
Score: 41-24

[07:26] Team_025 possession (Score: 41-24)
Paolo Lowry attempts a Midrange. Contested by Lauri Johnson (5.1 feet, MAN). Paolo Lowry misses. Rebound secured by Miles Gobert.

[07:13] Team_086 possession (Score: 41-24)
Lauri Johnson attempts a 3Pt. Contested by Paolo Lowry (5.5 feet, MAN). LAURI JOHNSON MAKES IT! Assist: Bones Ginobili
Score: 41-27

[06:58] Team_025 possession (Score: 41-27)
Ben Giddey attempts a 3Pt. Contested by Anfernee Harris (5.2 feet, MAN). Ben Giddey misses. Rebound secured by Miles Gobert.

[06:45] Team_086 possession (Score: 41-27)
Miles Gobert attempts a 3Pt. Contested by Ben Giddey (4.3 feet, ZONE). Miles Gobert misses. Rebound secured by Allen Embiid.

[06:28] Team_025 possession (Score: 41-27)
Allen Embiid attempts a 3Pt. Contested by Rudy Rose (4.3 feet, MAN). Allen Embiid misses. Rebound secured by Miles Gobert.

[06:13] Team_086 possession (Score: 41-27)
Lauri Johnson attempts a Midrange. Contested by Paolo Lowry (5.6 feet, MAN). Lauri Johnson misses. Rebound secured by Allen Embiid.

[05:53] Team_025 possession (Score: 41-27)
FOUL! Shooting foul on Rudy Rose. Paolo Lowry to the line for 2 free throws. [Team fouls: 3] (Rudy Rose: 1 personal fouls)   FT 1/2: MISS   FT 2/2: MISS Paolo Lowry makes 0/2 from the line. Rebound secured by Miles Gobert.

[05:38] Team_086 possession (Score: 41-27)
FOUL! Shooting foul on Desmond Jordan. Miles Gobert to the line for 3 free throws. [BONUS: 6 team fouls] (Desmond Jordan: 1 personal fouls)   FT 1/3: GOOD   FT 2/3: GOOD   FT 3/3: MISS Miles Gobert makes 2/3 from the line. Rebound secured by Desmond Jordan.
Score: 41-29

[05:22] Team_025 possession (Score: 41-29)
Allen Embiid attempts a Midrange. Contested by Lauri Johnson (5.1 feet, ZONE). Allen Embiid misses. Offensive rebound by Allen Embiid! Allen Embiid's putback is no good. Offensive rebound by Allen Embiid! Allen Embiid kicks it out.

[05:12] Team_025 possession (Score: 41-29)
Paolo Lowry attempts a 3Pt. Contested by Lauri Johnson (5.3 feet, ZONE). PAOLO LOWRY MAKES IT! Assist: Allen Embiid
Score: 44-29

[04:56] Team_086 possession (Score: 44-29)
Anfernee Harris attempts a Midrange. Contested by Ben Giddey (4.9 feet, MAN). Anfernee Harris misses. Rebound secured by Ben Giddey.

[04:43] Team_025 possession (Score: 44-29)
Paolo Lowry makes the Layup and draws the foul on Rudy Rose! And-1! Paolo Lowry to the line for 1. [Team fouls: 4] (Rudy Rose: 2 personal fouls)   FT 1/1: GOOD Paolo Lowry makes 1/1 from the line.
Score: 47-29

[04:29] Team_086 possession (Score: 47-29)
Miles Gobert attempts a Layup. Contested by Desmond Jordan (4.3 feet, MAN). Miles Gobert misses. Offensive rebound by Miles Gobert! Miles Gobert kicks it out.

[04:15] Team_086 possession (Score: 47-29)
FOUL! Shooting foul on Allen Embiid. Rudy Rose to the line for 2 free throws. [BONUS: 7 team fouls] (Allen Embiid: 3 personal fouls)   FT 1/2: GOOD   FT 2/2: GOOD Rudy Rose makes 2/2 from the line.
Score: 47-31

[03:56] Team_025 possession (Score: 47-31)
Desmond Jordan makes the Dunk and draws the foul on Miles Gobert! And-1! Desmond Jordan to the line for 1. [BONUS: 5 team fouls] (Miles Gobert: 1 personal fouls)   FT 1/1: GOOD Desmond Jordan makes 1/1 from the line.
Score: 50-31

[03:44] Team_086 possession (Score: 50-31)
Anfernee Harris attempts a 3Pt. Contested by Ben Giddey (5.0 feet, MAN). Anfernee Harris misses. Rebound secured by Allen Embiid.

[03:30] Team_025 possession (Score: 50-31)
Allen Embiid drives, Rudy Rose stays with him. Allen Embiid attempts a Layup. Contested by Rudy Rose (4.7 feet, MAN). ALLEN EMBIID MAKES IT! Assist: Ben Giddey
Score: 52-31

[03:17] Team_086 possession (Score: 52-31)
Miles Gobert drives, Allen Embiid stays with him. Miles Gobert attempts a Dunk. Contested by Allen Embiid (4.3 feet, ZONE). Miles Gobert misses. FOUL! Loose ball foul on Desmond Jordan during the rebound battle. [IN THE BONUS! 8 team fouls] Rudy Rose to the line for 2 free throws. (Desmond Jordan: 2 personal fouls)   FT 1/2: GOOD   FT 2/2: GOOD Rudy Rose makes 2/2 from the line.
Score: 52-33

[03:06] Team_025 possession (Score: 52-33)
Paolo Lowry attempts a 3Pt. Contested by Lauri Johnson (5.6 feet, MAN). Paolo Lowry misses. Rebound secured by Bones Ginobili.

[02:53] Team_086 possession (Score: 52-33)
Miles Gobert drives, picks up Desmond Jordan. Help arrives from Ben Giddey! Miles Gobert attempts a Dunk. Contested by Ben Giddey (4.6 feet, MAN). MILES GOBERT MAKES IT! Assist: Bones Ginobili
Score: 52-35

[02:34] Team_025 possession (Score: 52-35)
Paolo Lowry attempts a Midrange. BLOCKED BY MILES GOBERT! Ball is loose! Rebound secured by Bones Ginobili.

[02:16] Team_086 possession (Score: 52-35)
Rudy Rose drives and kicks out. FOUL! Shooting foul on Ben Giddey. Anfernee Harris to the line for 3 free throws. [BONUS: 9 team fouls] (Ben Giddey: 2 personal fouls)   FT 1/3: MISS   FT 2/3: GOOD   FT 3/3: GOOD Anfernee Harris makes 2/3 from the line.
Score: 52-37

[02:07] Team_025 possession (Score: 52-37)
Allen Embiid attempts a Layup. BLOCKED BY ANFERNEE HARRIS! Ball is loose! Offensive rebound by Desmond Jordan! Desmond Jordan kicks it out.

[01:52] Team_025 possession (Score: 52-37)
Allen Embiid makes the Layup and draws the foul on Rudy Rose! And-1! Allen Embiid to the line for 1. [BONUS: 6 team fouls] (Rudy Rose: 3 personal fouls)   FT 1/1: GOOD Allen Embiid makes 1/1 from the line.
Score: 55-37

[01:33] Team_086 possession (Score: 55-37)
Lauri Johnson attempts a 3Pt. Wide open! Paolo Lowry is 6.1 feet away. [MAN] Lauri Johnson misses. Rebound secured by Ben Giddey.

[01:18] Team_025 possession (Score: 55-37)
Cade Anthony attempts a 3Pt. Contested by Lauri Johnson (5.9 feet, ZONE). Cade Anthony misses. Rebound secured by Rudy Rose.

[01:04] Team_086 possession (Score: 55-37)
Miles Gobert attempts a 3Pt. Contested by Desmond Jordan (4.8 feet, MAN). Miles Gobert misses. Rebound secured by Desmond Jordan.

[00:53] Team_025 possession (Score: 55-37)
Paolo Lowry attempts a 3Pt. Contested by Lauri Johnson (5.8 feet, ZONE). Paolo Lowry misses. Rebound secured by Miles Gobert.

[00:38] Team_086 possession (Score: 55-37)
Bones Ginobili drives, picks up Allen Embiid. Help arrives from Ben Giddey! Bones Ginobili attempts a Layup. Contested by Ben Giddey (5.0 feet, ZONE). BONES GINOBILI MAKES IT! Assist: Miles Gobert
Score: 55-39

[00:29] Team_025 possession (Score: 55-39)
Allen Embiid attempts a 3Pt. Contested by Rudy Rose (5.1 feet, MAN). Allen Embiid misses. Rebound secured by Miles Gobert.

[00:17] Team_086 possession (Score: 55-39)
Bones Ginobili attempts a Layup. Wide open! Cade Anthony is 6.3 feet away. [MAN] Bones Ginobili misses. Rebound secured by Ben Giddey.

[00:07] Team_025 possession (Score: 55-39)
Paolo Lowry attempts a Midrange. Contested by Lauri Johnson (6.0 feet, ZONE). PAOLO LOWRY MAKES IT!
Score: 57-39

================================================================================
                              2ND QUARTER COMPLETE                              
================================================================================

2ND QUARTER SCORE: Team_025 27, Team_086 29

BOX SCORE:
================================================================================

Team_025
--------------------------------------------------------------------------------
Player                MIN  PTS  REB  AST  TO      FG   FG%      3P   3P%
--------------------------------------------------------------------------------
Paolo Lowry            22   14    0    0   0   6/12   50.0     0/0   0.0
Allen Embiid           22    7    5    1   0   3/5    60.0     0/0   0.0
Desmond Jordan         22    5    3    1   0   2/2   100.0     0/0   0.0
Cade Anthony           24    1    0    1   0   1/2    50.0     0/0   0.0
Ben Giddey             22    0    3    1   0   0/1     0.0     0/0   0.0

TEAM: FG: 12/22 (54.5%), 3PT: 1/7 (14.3%), REB: 11 (3 off, 8 def), AST: 4, TO: 1
TEAM FOULS: 9 [Team_086 in BONUS]


Team_086
--------------------------------------------------------------------------------
Player                MIN  PTS  REB  AST  TO      FG   FG%      3P   3P%
--------------------------------------------------------------------------------
Lauri Johnson          22    8    0    0   0   3/5    60.0     0/0   0.0
Rudy Rose              22    6    1    1   0   3/3   100.0     0/0   0.0
Bones Ginobili         22    5    3    3   0   2/3    66.7     0/0   0.0
Anfernee Harris        22    4    0    0   0   2/4    50.0     0/0   0.0
Miles Gobert           24    4    7    1   0   2/5    40.0     0/0   0.0

TEAM: FG: 12/20 (60.0%), 3PT: 1/6 (16.7%), REB: 11 (1 off, 10 def), AST: 5, TO: 2
TEAM FOULS: 6 [Team_025 in BONUS]

================================================================================

================================================================================
                       3RD QUARTER - Team_025 vs Team_086                       
================================================================================

[12:00] Team_025 possession (Score: 57-39)
Ben Giddey attempts a Layup. Contested by Rudy Rose (4.2 feet, ZONE). BEN GIDDEY MAKES IT! Assist: Cade Anthony
Score: 59-39

[11:48] Team_086 possession (Score: 59-39)
Anfernee Harris drives and kicks out. Miles Gobert attempts a 3Pt. Contested by Desmond Jordan (3.3 feet, MAN). Miles Gobert misses. Rebound secured by Cade Anthony.

[11:33] Team_025 possession (Score: 59-39)
Ben Giddey attempts a 3Pt. Contested by Lauri Johnson (4.9 feet, ZONE). Ben Giddey misses. Rebound secured by Rudy Rose.

[11:23] Team_086 possession (Score: 59-39)
Anfernee Harris drives, picks up Allen Embiid. Help arrives from Ben Giddey! Anfernee Harris attempts a Layup. Contested by Ben Giddey (3.4 feet, ZONE). ANFERNEE HARRIS MAKES IT! Assist: Miles Gobert
Score: 59-41

[11:07] Team_025 possession (Score: 59-41)
Ben Giddey attempts a Layup. BLOCKED BY MILES GOBERT! Ball deflects out of bounds off Ben Giddey.

[10:49] Team_086 possession (Score: 59-41)
Bones Ginobili attempts a 3Pt. Contested by Ben Giddey (4.0 feet, ZONE). Bones Ginobili misses. FOUL! Loose ball foul on Allen Embiid during the rebound battle. [Team fouls: 1] No free throws, side out. (Allen Embiid: 1 personal fouls)

[10:37] Team_086 possession (Score: 59-41)
Lauri Johnson attempts a Midrange. Contested by Paolo Lowry (5.1 feet, MAN). Lauri Johnson misses. Rebound secured by Allen Embiid.

[10:27] Team_025 possession (Score: 59-41)
Desmond Jordan attempts a 3Pt. Contested by Lauri Johnson (4.6 feet, ZONE). DESMOND JORDAN MAKES IT! Assist: Paolo Lowry
Score: 62-41

[10:18] Team_086 possession (Score: 62-41)
Anfernee Harris attempts a Midrange. Contested by Ben Giddey (4.2 feet, MAN). Anfernee Harris misses. Rebound secured by Allen Embiid.

[10:04] Team_025 possession (Score: 62-41)
FOUL! Shooting foul on Rudy Rose. Allen Embiid to the line for 2 free throws. [Team fouls: 1] (Rudy Rose: 1 personal fouls)   FT 1/2: GOOD   FT 2/2: GOOD Allen Embiid makes 2/2 from the line.
Score: 64-41

[09:46] Team_086 possession (Score: 64-41)
FOUL! Offensive foul on Miles Gobert! Desmond Jordan drew the charge! [Team fouls: 2] (Miles Gobert: 1 personal fouls) TURNOVER! (dead ball)

[09:28] Team_025 possession (Score: 64-41)
Allen Embiid attempts a Layup. Contested by Rudy Rose (3.9 feet, MAN). Allen Embiid misses. Rebound secured by Bones Ginobili.

[09:17] Team_086 possession (Score: 64-41)
Rudy Rose attempts a 3Pt. Contested by Desmond Jordan (3.6 feet, ZONE). Rudy Rose misses. Rebound secured by Allen Embiid.

[09:06] Team_025 possession (Score: 64-41)
Desmond Jordan attempts a 3Pt. Contested by Lauri Johnson (4.6 feet, ZONE). DESMOND JORDAN MAKES IT! Assist: Paolo Lowry
Score: 67-41

[08:56] Team_086 possession (Score: 67-41)
Bones Ginobili attempts a Layup. Contested by Allen Embiid (3.3 feet, ZONE). Bones Ginobili misses. Rebound secured by Cade Anthony.

[08:37] Team_025 possession (Score: 67-41)
Cade Anthony attempts a Layup. Contested by Rudy Rose (4.4 feet, ZONE). Cade Anthony misses. Rebound secured by Miles Gobert.

[08:24] Team_086 possession (Score: 67-41)
Miles Gobert drives, picks up Desmond Jordan. Help arrives from Ben Giddey! Miles Gobert attempts a Dunk. Contested by Ben Giddey (3.6 feet, MAN). MILES GOBERT MAKES IT! Assist: Bones Ginobili
Score: 67-43

[08:08] Team_025 possession (Score: 67-43)
Ben Giddey attempts a Midrange. Contested by Miles Gobert (4.0 feet, ZONE). BEN GIDDEY MAKES IT! Assist: Allen Embiid
Score: 69-43

[07:53] Team_086 possession (Score: 69-43)
Rudy Rose drives, Allen Embiid stays with him. Rudy Rose attempts a Layup. Contested by Allen Embiid (3.1 feet, MAN). RUDY ROSE MAKES IT!
Score: 69-45

[07:37] Team_025 possession (Score: 69-45)
Ben Giddey attempts a 3Pt. Contested by Anfernee Harris (4.7 feet, MAN). Ben Giddey misses. Rebound secured by Bones Ginobili.

[07:27] Team_086 possession (Score: 69-45)
Miles Gobert attempts a Layup. Contested by Allen Embiid (3.1 feet, ZONE). MILES GOBERT MAKES IT!
Score: 69-47

[07:16] Team_025 possession (Score: 69-47)
Ben Giddey attempts a 3Pt. Contested by Lauri Johnson (4.9 feet, ZONE). Ben Giddey misses. Rebound secured by Miles Gobert.

[07:00] Team_086 possession (Score: 69-47)
Lauri Johnson attempts a 3Pt. Contested by Ben Giddey (3.8 feet, ZONE). LAURI JOHNSON MAKES IT! Assist: Miles Gobert
Score: 69-50

[06:46] Team_025 possession (Score: 69-50)
Desmond Jordan attempts a Layup. Contested by Rudy Rose (3.9 feet, ZONE). Desmond Jordan misses. Rebound secured by Bones Ginobili.

[06:32] Team_086 possession (Score: 69-50)
Rudy Rose makes the Midrange and draws the foul on Cade Anthony! And-1! Rudy Rose to the line for 1. [Team fouls: 2] (Cade Anthony: 1 personal fouls)   FT 1/1: GOOD Rudy Rose makes 1/1 from the line.
Score: 69-53

[06:15] Team_025 possession (Score: 69-53)
Desmond Jordan attempts a 3Pt. Contested by Lauri Johnson (4.6 feet, ZONE). Desmond Jordan misses. Rebound secured by Rudy Rose.

[05:57] Team_086 possession (Score: 69-53)
Bones Ginobili attempts a Layup. Contested by Allen Embiid (3.3 feet, ZONE). BONES GINOBILI MAKES IT!
Score: 69-55

[05:47] Team_025 possession (Score: 69-55)
Desmond Jordan attempts a 3Pt. Contested by Anfernee Harris (4.4 feet, ZONE). Desmond Jordan misses. Rebound secured by Miles Gobert.

[05:37] Team_086 possession (Score: 69-55)
Miles Gobert attempts a 3Pt. Contested by Desmond Jordan (3.6 feet, MAN). Miles Gobert misses. Offensive rebound by Miles Gobert! Miles Gobert kicks it out.

[05:21] Team_086 possession (Score: 69-55)
Rudy Rose attempts a Dunk. BLOCKED BY BEN GIDDEY! Ball is loose! Rebound secured by Desmond Jordan.

[05:11] Team_025 possession (Score: 69-55)
Paolo Lowry attempts a Layup. Contested by Rudy Rose (4.1 feet, ZONE). PAOLO LOWRY MAKES IT! Assist: Ben Giddey
Score: 71-55

[04:54] Team_086 possession (Score: 71-55)
FOUL! Holding foul on Paolo Lowry. [Team fouls: 3] No free throws, side out. (Paolo Lowry: 1 personal fouls)

[04:43] Team_086 possession (Score: 71-55)
Anfernee Harris attempts a 3Pt. Contested by Ben Giddey (4.2 feet, ZONE). Anfernee Harris misses. Rebound secured by Allen Embiid.

[04:32] Team_025 possession (Score: 71-55)
Paolo Lowry attempts a 3Pt. Contested by Lauri Johnson (4.8 feet, MAN). Paolo Lowry misses. Rebound secured by Bones Ginobili.

[04:15] Team_086 possession (Score: 71-55)
Miles Gobert attempts a Midrange. Contested by Ben Giddey (4.0 feet, ZONE). Miles Gobert misses. Rebound secured by Cade Anthony.

[03:58] Team_025 possession (Score: 71-55)
Cade Anthony attempts a 3Pt. Contested by Lauri Johnson (5.2 feet, ZONE). Cade Anthony misses. Rebound secured by Miles Gobert.

[03:40] Team_086 possession (Score: 71-55)
Lauri Johnson attempts a 3Pt. Contested by Paolo Lowry (5.3 feet, MAN). Lauri Johnson misses. Rebound secured by Allen Embiid.

[03:29] Team_025 possession (Score: 71-55)
Paolo Lowry attempts a 3Pt. Contested by Lauri Johnson (4.9 feet, MAN). Paolo Lowry misses. Offensive rebound by Allen Embiid! Allen Embiid puts it back in!
Score: 73-55

[03:14] Team_086 possession (Score: 73-55)
Miles Gobert drives to the basket... Miles Gobert loses the ball! Stripped by Desmond Jordan! TURNOVER! (live ball)

[03:00] Team_025 possession (Score: 73-55)
Ben Giddey attempts a 3Pt. Contested by Anfernee Harris (4.9 feet, MAN). Ben Giddey misses. Rebound secured by Miles Gobert.

[02:46] Team_086 possession (Score: 73-55)
Rudy Rose attempts a Midrange. Contested by Allen Embiid (3.5 feet, MAN). RUDY ROSE MAKES IT!
Score: 73-57

[02:31] Team_025 possession (Score: 73-57)
Ben Giddey drives, Rudy Rose stays with him. Ben Giddey attempts a Layup. Contested by Rudy Rose (4.4 feet, ZONE). BEN GIDDEY MAKES IT!
Score: 75-57

[02:13] Team_086 possession (Score: 75-57)
Bones Ginobili attempts a 3Pt. Contested by Ben Giddey (4.3 feet, ZONE). Bones Ginobili misses. Rebound secured by Allen Embiid.

[02:00] Team_025 possession (Score: 75-57)
Ben Giddey drives and kicks out. Desmond Jordan attempts a Midrange. Contested by Miles Gobert (3.8 feet, MAN). DESMOND JORDAN MAKES IT! Assist: Allen Embiid
Score: 77-57

[01:48] Team_086 possession (Score: 77-57)
FOUL! Shooting foul on Paolo Lowry. Lauri Johnson to the line for 2 free throws. [Team fouls: 4] (Paolo Lowry: 2 personal fouls)   FT 1/2: GOOD   FT 2/2: GOOD Lauri Johnson makes 2/2 from the line.
Score: 77-59

[01:31] Team_025 possession (Score: 77-59)
Desmond Jordan attempts a 3Pt. Contested by Miles Gobert (4.0 feet, MAN). Desmond Jordan misses. Offensive rebound by Allen Embiid! Allen Embiid puts it back in!
Score: 79-59

[01:16] Team_086 possession (Score: 79-59)
Miles Gobert drives, picks up Allen Embiid. Help arrives from Ben Giddey! Miles Gobert attempts a Layup. Contested by Ben Giddey (3.7 feet, ZONE). MILES GOBERT MAKES IT! Assist: Bones Ginobili
Score: 79-61

[01:01] Team_025 possession (Score: 79-61)
Allen Embiid attempts a 3Pt. Contested by Lauri Johnson (4.9 feet, ZONE). Allen Embiid misses. Rebound secured by Rudy Rose.

[00:47] Team_086 possession (Score: 79-61)
Bones Ginobili drives, Allen Embiid stays with him. Bones Ginobili attempts a Dunk. Contested by Allen Embiid (3.9 feet, ZONE). BONES GINOBILI MAKES IT!
Score: 79-63

[00:34] Team_025 possession (Score: 79-63)
Allen Embiid attempts a Midrange. Contested by Bones Ginobili (5.4 feet, ZONE). Allen Embiid misses. Rebound secured by Miles Gobert.

[00:17] Team_086 possession (Score: 79-63)
FOUL! Holding foul on Paolo Lowry. [IN THE BONUS! 5 team fouls] Lauri Johnson to the line for 2 free throws. (Paolo Lowry: 3 personal fouls)   FT 1/2: GOOD   FT 2/2: MISS Lauri Johnson makes 1/2 from the line. Rebound secured by Cade Anthony.
Score: 79-64

[00:03] Team_025 possession (Score: 79-64)
Cade Anthony attempts a 3Pt. Contested by Bones Ginobili (6.0 feet, MAN). Cade Anthony misses. Rebound secured by Miles Gobert.

================================================================================
                              3RD QUARTER COMPLETE                              
================================================================================

3RD QUARTER SCORE: Team_025 22, Team_086 25

BOX SCORE:
================================================================================

Team_025
--------------------------------------------------------------------------------
Player                MIN  PTS  REB  AST  TO      FG   FG%      3P   3P%
--------------------------------------------------------------------------------
Desmond Jordan         34    8    1    0   0   3/6    50.0     0/0   0.0
Ben Giddey             34    6    0    1   0   3/8    37.5     0/0   0.0
Allen Embiid           34    6    8    2   0   3/6    50.0     0/0   0.0
Paolo Lowry            34    2    0    2   0   1/2    50.0     0/0   0.0
Cade Anthony           36    0    4    1   0   0/3     0.0     0/0   0.0

TEAM: FG: 10/25 (40.0%), 3PT: 4/14 (28.6%), REB: 13 (2 off, 11 def), AST: 6, TO: 0
TEAM FOULS: 5 [Team_086 in BONUS]


Team_086
--------------------------------------------------------------------------------
Player                MIN  PTS  REB  AST  TO      FG   FG%      3P   3P%
--------------------------------------------------------------------------------
Rudy Rose              34    7    3    0   0   3/5    60.0     0/0   0.0
Miles Gobert           36    6    9    2   0   3/4    75.0     0/0   0.0
Lauri Johnson          34    5    0    0   0   2/4    50.0     0/0   0.0
Bones Ginobili         34    4    4    2   0   2/4    50.0     0/0   0.0
Anfernee Harris        34    2    0    0   0   1/4    25.0     0/0   0.0

TEAM: FG: 11/22 (50.0%), 3PT: 1/5 (20.0%), REB: 16 (2 off, 14 def), AST: 4, TO: 2
TEAM FOULS: 2

================================================================================

================================================================================
                       4TH QUARTER - Team_025 vs Team_086                       
================================================================================

[12:00] Team_025 possession (Score: 79-64)
Cade Anthony attempts a 3Pt. Contested by Bones Ginobili (5.8 feet, MAN). CADE ANTHONY MAKES IT! Assist: Ben Giddey
Score: 82-64

[11:47] Team_086 possession (Score: 82-64)
Anfernee Harris attempts a 3Pt. Contested by Ben Giddey (4.5 feet, ZONE). Anfernee Harris misses. Offensive rebound by Rudy Rose! Rudy Rose puts it back in!
Score: 82-66

[11:34] Team_025 possession (Score: 82-66)
Desmond Jordan attempts a Layup. BLOCKED BY MILES GOBERT! Ball is loose! Rebound secured by Miles Gobert.

[11:15] Team_086 possession (Score: 82-66)
Miles Gobert attempts a 3Pt. Contested by Ben Giddey (4.3 feet, ZONE). MILES GOBERT MAKES IT! Assist: Lauri Johnson
Score: 82-69

[11:02] Team_025 possession (Score: 82-69)
Desmond Jordan attempts a Layup. Contested by Rudy Rose (4.3 feet, ZONE). Desmond Jordan misses. Rebound secured by Miles Gobert.

[10:48] Team_086 possession (Score: 82-69)
Rudy Rose makes the Layup and draws the foul on Allen Embiid! And-1! Rudy Rose to the line for 1. [Team fouls: 1] (Allen Embiid: 1 personal fouls)   FT 1/1: GOOD Rudy Rose makes 1/1 from the line.
Score: 82-72

[10:31] Team_025 possession (Score: 82-72)
FOUL! Holding foul on Lauri Johnson. [Team fouls: 1] No free throws, side out. (Lauri Johnson: 1 personal fouls)

[10:22] Team_025 possession (Score: 82-72)
Paolo Lowry attempts a 3Pt. Contested by Lauri Johnson (5.2 feet, ZONE). Paolo Lowry misses. Rebound secured by Miles Gobert.

[10:11] Team_086 possession (Score: 82-72)
Bones Ginobili attempts a Midrange. Contested by Cade Anthony (5.0 feet, MAN). Bones Ginobili misses. Rebound secured by Desmond Jordan.

[09:57] Team_025 possession (Score: 82-72)
Desmond Jordan attempts a 3Pt. Contested by Lauri Johnson (5.0 feet, ZONE). Desmond Jordan misses. Rebound secured by Rudy Rose.

[09:42] Team_086 possession (Score: 82-72)
Rudy Rose attempts a Layup. Contested by Allen Embiid (4.0 feet, MAN). RUDY ROSE MAKES IT! Assist: Bones Ginobili
Score: 82-74

[09:29] Team_025 possession (Score: 82-74)
Ben Giddey attempts a Layup. Contested by Anfernee Harris (5.3 feet, MAN). BEN GIDDEY MAKES IT! Assist: Desmond Jordan
Score: 84-74

[09:11] Team_086 possession (Score: 84-74)
Anfernee Harris attempts a Midrange. Contested by Cade Anthony (5.3 feet, ZONE). Anfernee Harris misses. Rebound secured by Cade Anthony.

[09:01] Team_025 possession (Score: 84-74)
Desmond Jordan drives and kicks out. Allen Embiid attempts a Midrange. Contested by Rudy Rose (4.5 feet, MAN). Allen Embiid misses. Rebound secured by Bones Ginobili.

[08:45] Team_086 possession (Score: 84-74)
Anfernee Harris attempts a Layup. Contested by Allen Embiid (4.4 feet, ZONE). Anfernee Harris misses. Offensive rebound by Rudy Rose! Rudy Rose puts it back in!
Score: 84-76

[08:34] Team_025 possession (Score: 84-76)
Allen Embiid attempts a Dunk. BLOCKED BY ANFERNEE HARRIS! Ball deflects out of bounds off Allen Embiid.

[08:18] Team_086 possession (Score: 84-76)
Rudy Rose attempts a Layup. BLOCKED BY ALLEN EMBIID! Ball is loose! Offensive rebound by Rudy Rose! Rudy Rose kicks it out.

[08:01] Team_086 possession (Score: 84-76)
Miles Gobert attempts a 3Pt. Contested by Cade Anthony (5.1 feet, ZONE). Miles Gobert misses. Rebound secured by Desmond Jordan.

[07:45] Team_025 possession (Score: 84-76)
Paolo Lowry drives, picks up Rudy Rose. Help arrives from Anfernee Harris! Paolo Lowry attempts a Dunk. Contested by Anfernee Harris (4.9 feet, ZONE). Paolo Lowry misses. Rebound secured by Bones Ginobili.

[07:28] Team_086 possession (Score: 84-76)
Lauri Johnson loses the ball! Stripped by Paolo Lowry! TURNOVER! (live ball)

[07:14] Team_025 possession (Score: 84-76)
Ben Giddey loses control! Ball rolls out of bounds! TURNOVER! (dead ball)

[07:14] Substitution (Team_025): Paolo Lowry OUT → LeBron Griffin IN (stamina_rule2)

[07:14] Substitution (Team_025): Ben Giddey OUT → Dirk Gilgeous-Alexander IN (stamina_rule2)

[07:14] Substitution (Team_025): Desmond Jordan OUT → Immanuel LaVine IN (stamina_rule2)

[07:14] Substitution (Team_025): Cade Anthony OUT → Damian Adebayo IN (stamina_rule2)

[07:14] Substitution (Team_025): Allen Embiid OUT → Nikola Lillard IN (stamina_rule2)

[07:14] Substitution (Team_086): Lauri Johnson OUT → Anfernee Green IN (stamina_rule2)

[07:14] Substitution (Team_086): Anfernee Harris OUT → Anthony James IN (stamina_rule2)

[07:14] Substitution (Team_086): Miles Gobert OUT → Franz McGrady IN (stamina_rule2)

[07:14] Substitution (Team_086): Bones Ginobili OUT → Kyle McCollum IN (stamina_rule2)

[07:14] Substitution (Team_086): Rudy Rose OUT → Lamelo Towns IN (stamina_rule2)

[06:57] Team_086 possession (Score: 84-76)
Kyle McCollum attempts a Layup. Contested by Nikola Lillard (4.4 feet, ZONE). KYLE MCCOLLUM MAKES IT! Assist: Anthony James
Score: 84-78

[06:43] Team_025 possession (Score: 84-78)
FOUL! Shooting foul on Lamelo Towns. LeBron Griffin to the line for 2 free throws. [Team fouls: 2] (Lamelo Towns: 1 personal fouls)   FT 1/2: MISS   FT 2/2: MISS LeBron Griffin makes 0/2 from the line. Rebound secured by Kyle McCollum.

[06:33] Team_086 possession (Score: 84-78)
Lamelo Towns attempts a Layup. Contested by Nikola Lillard (4.2 feet, MAN). Lamelo Towns misses. Rebound secured by Immanuel LaVine.

[06:19] Team_025 possession (Score: 84-78)
Nikola Lillard attempts a Midrange. Contested by Lamelo Towns (5.5 feet, MAN). Nikola Lillard misses. Rebound secured by Anfernee Green.

[06:04] Team_086 possession (Score: 84-78)
Anfernee Green drives, Nikola Lillard stays with him. Anfernee Green attempts a Dunk. Contested by Nikola Lillard (4.7 feet, ZONE). Anfernee Green misses. Offensive rebound by Lamelo Towns! Lamelo Towns kicks it out.

[05:50] Team_086 possession (Score: 84-78)
Anfernee Green attempts a Layup. BLOCKED BY LEBRON GRIFFIN! Ball is loose! Rebound secured by Immanuel LaVine.

[05:32] Team_025 possession (Score: 84-78)
Immanuel LaVine attempts a 3Pt. Contested by Franz McGrady (5.0 feet, MAN). IMMANUEL LAVINE MAKES IT! Assist: Nikola Lillard
Score: 87-78

[05:18] Team_086 possession (Score: 87-78)
Anfernee Green attempts a 3Pt. Contested by LeBron Griffin (4.9 feet, ZONE). Anfernee Green misses. Rebound secured by Dirk Gilgeous-Alexander.

[05:01] Team_025 possession (Score: 87-78)
Damian Adebayo attempts a Midrange. Contested by Kyle McCollum (5.2 feet, ZONE). Damian Adebayo misses. Rebound secured by Kyle McCollum.

[04:52] Team_086 possession (Score: 87-78)
FOUL! Reach-in foul on Nikola Lillard during the drive. [Team fouls: 2] No free throws, side out. (Nikola Lillard: 1 personal fouls)

[04:39] Team_086 possession (Score: 87-78)
FOUL! Holding foul on Dirk Gilgeous-Alexander. [Team fouls: 3] No free throws, side out. (Dirk Gilgeous-Alexander: 1 personal fouls)

[04:26] Team_086 possession (Score: 87-78)
Anfernee Green drives and kicks out. Kyle McCollum attempts a 3Pt. Contested by Damian Adebayo (4.9 feet, MAN). KYLE MCCOLLUM MAKES IT! Assist: Lamelo Towns
Score: 87-81

[04:14] Team_025 possession (Score: 87-81)
Immanuel LaVine attempts a Midrange. Contested by Franz McGrady (5.0 feet, MAN). Immanuel LaVine misses. Rebound secured by Anfernee Green.

[04:04] Team_086 possession (Score: 87-81)
Franz McGrady makes the 3Pt and draws the foul on Immanuel LaVine! And-1! Franz McGrady to the line for 1. [Team fouls: 4] (Immanuel LaVine: 1 personal fouls)   FT 1/1: GOOD Franz McGrady makes 1/1 from the line.
Score: 87-85

[03:51] Team_025 possession (Score: 87-85)
Damian Adebayo drives, Lamelo Towns stays with him. Damian Adebayo attempts a Dunk. Contested by Lamelo Towns (5.3 feet, ZONE). Damian Adebayo misses. Rebound secured by Kyle McCollum.

[03:35] Team_086 possession (Score: 87-85)
Franz McGrady attempts a 3Pt. Contested by LeBron Griffin (4.8 feet, ZONE). FRANZ MCGRADY MAKES IT! Assist: Anthony James
Score: 87-88

[03:18] Team_025 possession (Score: 87-88)
Dirk Gilgeous-Alexander drives and kicks out. Immanuel LaVine attempts a Midrange. Contested by Franz McGrady (4.9 feet, ZONE). Immanuel LaVine misses. Offensive rebound by Nikola Lillard! Nikola Lillard kicks it out.

[03:07] Team_025 possession (Score: 87-88)
Dirk Gilgeous-Alexander attempts a Midrange. Contested by Kyle McCollum (5.4 feet, ZONE). DIRK GILGEOUS-ALEXANDER MAKES IT!
Score: 89-88

[02:57] Team_086 possession (Score: 89-88)
FOUL! Reach-in foul on Nikola Lillard during the drive. [IN THE BONUS! 5 team fouls] Lamelo Towns to the line for 2 free throws. (Nikola Lillard: 2 personal fouls)   FT 1/2: GOOD   FT 2/2: GOOD Lamelo Towns makes 2/2 from the line.
Score: 89-90

[02:42] Team_025 possession (Score: 89-90)
Nikola Lillard makes the Layup and draws the foul on Lamelo Towns! And-1! Nikola Lillard to the line for 1. [Team fouls: 3] (Lamelo Towns: 2 personal fouls)   FT 1/1: GOOD Nikola Lillard makes 1/1 from the line.
Score: 92-90

[02:23] Team_086 possession (Score: 92-90)
Franz McGrady attempts a 3Pt. Contested by LeBron Griffin (4.8 feet, ZONE). Franz McGrady misses. Rebound secured by Dirk Gilgeous-Alexander.

[02:08] Team_025 possession (Score: 92-90)
Dirk Gilgeous-Alexander drives and kicks out. Dirk Gilgeous-Alexander attempts a 3Pt. Contested by Anthony James (4.1 feet, MAN). DIRK GILGEOUS-ALEXANDER MAKES IT! Assist: LeBron Griffin
Score: 95-90

[01:54] Team_086 possession (Score: 95-90)
Lamelo Towns attempts a Midrange. Contested by Nikola Lillard (4.2 feet, MAN). LAMELO TOWNS MAKES IT!
Score: 95-92

[01:41] Team_025 possession (Score: 95-92)
Immanuel LaVine drives, picks up Lamelo Towns. Help arrives from Anfernee Green! Immanuel LaVine attempts a Layup. Contested by Anfernee Green (5.4 feet, ZONE). Immanuel LaVine misses. Rebound secured by Anfernee Green.

[01:27] Team_086 possession (Score: 95-92)
Lamelo Towns attempts a 3Pt. Contested by Nikola Lillard (4.2 feet, MAN). Lamelo Towns misses. Rebound secured by Dirk Gilgeous-Alexander.

[01:12] Team_025 possession (Score: 95-92)
Dirk Gilgeous-Alexander drives, picks up Anthony James. Help arrives from Anfernee Green! Dirk Gilgeous-Alexander attempts a Layup. Contested by Anfernee Green (4.2 feet, MAN). DIRK GILGEOUS-ALEXANDER MAKES IT! Assist: LeBron Griffin
Score: 97-92

[01:02] Team_086 possession (Score: 97-92)
Lamelo Towns makes the Dunk and draws the foul on LeBron Griffin! And-1! Lamelo Towns to the line for 1. [BONUS: 6 team fouls] (LeBron Griffin: 1 personal fouls)   FT 1/1: GOOD Lamelo Towns makes 1/1 from the line.
Score: 97-95

[00:48] Team_025 possession (Score: 97-95)
Nikola Lillard drives, Lamelo Towns stays with him. Nikola Lillard attempts a Layup. Contested by Lamelo Towns (5.5 feet, ZONE). Nikola Lillard misses. Rebound secured by Kyle McCollum.

[00:32] Team_086 possession (Score: 97-95)
Anthony James attempts a 3Pt. Contested by LeBron Griffin (5.4 feet, ZONE). Anthony James misses. Rebound secured by Immanuel LaVine.

[00:16] Team_025 possession (Score: 97-95)
LeBron Griffin attempts a 3Pt. Contested by Anfernee Green (4.0 feet, MAN). LeBron Griffin misses. Rebound secured by Anfernee Green.

================================================================================
                              4TH QUARTER COMPLETE                              
================================================================================

4TH QUARTER SCORE: Team_025 18, Team_086 31

BOX SCORE:
================================================================================

Team_025
--------------------------------------------------------------------------------
Player                MIN  PTS  REB  AST  TO      FG   FG%      3P   3P%
--------------------------------------------------------------------------------
Dirk Gilgeous-Alexander    9    7    3    0   0   3/3   100.0     0/0   0.0
Cade Anthony           41    3    1    0   0   1/1   100.0     0/0   0.0
Immanuel LaVine         9    3    3    0   0   1/3    33.3     0/0   0.0
Nikola Lillard          9    3    1    1   0   1/3    33.3     0/0   0.0
Ben Giddey             39    2    0    1   0   1/1   100.0     0/0   0.0
Desmond Jordan         39    0    2    1   0   0/4     0.0     0/0   0.0
Paolo Lowry            39    0    0    0   0   0/2     0.0     0/0   0.0
Allen Embiid           39    0    0    0   0   0/1     0.0     0/0   0.0
LeBron Griffin          9    0    0    2   0   0/2     0.0     0/0   0.0
Damian Adebayo          7    0    0    0   0   0/2     0.0     0/0   0.0

TEAM: FG: 7/22 (31.8%), 3PT: 2/5 (40.0%), REB: 10 (1 off, 9 def), AST: 5, TO: 1
TEAM FOULS: 6 [Team_086 in BONUS]


Team_086
--------------------------------------------------------------------------------
Player                MIN  PTS  REB  AST  TO      FG   FG%      3P   3P%
--------------------------------------------------------------------------------
Rudy Rose              39    9    4    0   0   4/4   100.0     0/0   0.0
Lamelo Towns            9    7    1    1   0   3/5    60.0     0/0   0.0
Franz McGrady           7    7    0    0   0   2/3    66.7     0/0   0.0
Kyle McCollum           9    5    4    0   0   2/2   100.0     0/0   0.0
Miles Gobert           41    3    3    0   0   1/2    50.0     0/0   0.0
Lauri Johnson          39    0    0    1   0   0/0     0.0     0/0   0.0
Bones Ginobili         39    0    2    1   0   0/1     0.0     0/0   0.0
Anfernee Harris        39    0    0    0   0   0/1     0.0     0/0   0.0
Anthony James           9    0    0    2   0   0/1     0.0     0/0   0.0
Anfernee Green          9    0    4    0   0   0/2     0.0     0/0   0.0

TEAM: FG: 12/21 (57.1%), 3PT: 4/9 (44.4%), REB: 18 (4 off, 14 def), AST: 5, TO: 1
TEAM FOULS: 3

================================================================================

================================================================================
                               FULL GAME COMPLETE                               
================================================================================

FINAL SCORE: Team_025 97, Team_086 95

SCORING BY QUARTER:
--------------------------------------------------------------------------------
Team                     Q1     Q2     Q3     Q4    FINAL
--------------------------------------------------------------------------------
Team_025                 30     27     22     18       97
Team_086                 10     29     25     31       95
--------------------------------------------------------------------------------

FULL GAME BOX SCORE:
================================================================================

Team_025
--------------------------------------------------------------------------------
Player                MIN  PTS  REB  AST  TO      FG   FG%      3P   3P%      FT STL BLK
--------------------------------------------------------------------------------
Cade Anthony           41    9   11    2   0   4/9    44.4   1/4    25.0   1/2     1   0
Paolo Lowry            39   25    0    3   0  11/21   52.4   5/9    55.6   3/5     2   0
Ben Giddey             39   14    3    3   2   8/17   47.1   0/7     0.0   0/0     0   2
Desmond Jordan         39   17   11    2   0   5/14   35.7   3/7    42.9   1/1     2   0
Allen Embiid           39   13   21    7   1   6/13   46.2   0/4     0.0   3/3     0   2
LeBron Griffin          9    0    0    3   0   0/2     0.0   0/1     0.0   0/2     0   1
Dirk Gilgeous-Alexander    9    7    3    0   0   3/4    75.0   0/0     0.0   0/1     0   0
Immanuel LaVine         9    3    3    0   0   1/4    25.0   1/1   100.0   0/0     0   0
Nikola Lillard          9    7    2    1   0   3/5    60.0   0/0     0.0   3/3     0   0
Damian Adebayo          7    0    0    0   0   0/2     0.0   0/0     0.0   0/0     0   0

TEAM: FG: 41/91 (45.1%), 3PT: 10/33 (30.3%), REB: 55 (11 off, 44 def), AST: 21, TO: 3


Team_086
--------------------------------------------------------------------------------
Player                MIN  PTS  REB  AST  TO      FG   FG%      3P   3P%      FT STL BLK
--------------------------------------------------------------------------------
Miles Gobert           41   13   23    4   3   7/17   41.2   1/7    14.3   6/8     0   3
Lauri Johnson          39   15    0    1   3   6/11   54.5   2/4    50.0   4/5     0   0
Anfernee Harris        39    6    0    0   0   4/12   33.3   1/4    25.0   2/3     0   2
Bones Ginobili         39    9   12    6   1   4/12   33.3   0/2     0.0   1/1     0   0
Rudy Rose              39   24   10    1   0   9/14   64.3   0/3     0.0   8/8     1   0
Anfernee Green          9    2    5    0   0   1/3    33.3   0/1     0.0   0/0     0   0
Anthony James           9    2    0    2   0   1/2    50.0   0/1     0.0   0/0     0   0
Kyle McCollum           9    5    4    1   0   1/2    50.0   0/1     0.0   0/0     0   0
Lamelo Towns            9    7    1    2   0   4/6    66.7   0/1     0.0   3/3     0   0
Franz McGrady           7    7    0    0   0   2/3    66.7   2/3    66.7   1/1     0   0

TEAM: FG: 39/83 (47.0%), 3PT: 6/27 (22.2%), REB: 54 (7 off, 47 def), AST: 17, TO: 7

================================================================================
