================================================================================
                        FULL GAME - Team_044 vs Team_016                        
================================================================================

================================================================================
                       1ST QUARTER - Team_044 vs Team_016                       
================================================================================

[12:00] Team_044 possession (Score: 0-0)
Ayo McCollum drives, Vince Duncan stays with him. Ayo McCollum attempts a Layup. Contested by Vince Duncan (3.1 feet, ZONE). AYO MCCOLLUM MAKES IT!
Score: 2-0

[11:47] Team_016 possession (Score: 2-0)
Vince Quickley drives and kicks out. Collin Barnes attempts a Midrange. Contested by Zach McGrady (4.1 feet, MAN). Collin Barnes misses. Rebound secured by Karl Fox.

[11:33] Team_044 possession (Score: 2-0)
Zach McGrady drives to the basket... Zach McGrady throws a bad pass out of bounds! TURNOVER! (dead ball)

[11:17] Team_016 possession (Score: 2-0)
Collin Barnes attempts a 3Pt. Contested by Isaiah Murray (4.7 feet, ZONE). COLLIN BARNES MAKES IT!
Score: 2-3

[11:02] Team_044 possession (Score: 2-3)
Victor Westbrook attempts a 3Pt. Contested by Vince Quickley (4.3 feet, MAN). Victor Westbrook misses. Rebound secured by Ben Barrett.

[10:48] Team_016 possession (Score: 2-3)
Collin Barnes makes the Layup and draws the foul on Zach McGrady! And-1! Collin Barnes to the line for 1. [Team fouls: 1] (Zach McGrady: 1 personal fouls)   FT 1/1: MISS Collin Barnes makes 0/1 from the line. Rebound secured by Karl Fox.
Score: 2-5

[10:33] Team_044 possession (Score: 2-5)
FOUL! Shooting foul on Vince Duncan. Karl Fox to the line for 2 free throws. [Team fouls: 1] (Vince Duncan: 1 personal fouls)   FT 1/2: MISS   FT 2/2: GOOD Karl Fox makes 1/2 from the line.
Score: 3-5

[10:19] Team_016 possession (Score: 3-5)
Collin Barnes attempts a 3Pt. Contested by Isaiah Murray (4.7 feet, ZONE). Collin Barnes misses. Rebound secured by Ayo McCollum.

[10:07] Team_044 possession (Score: 3-5)
Isaiah Murray throws a bad pass out of bounds! TURNOVER! (dead ball)

[09:51] Team_016 possession (Score: 3-5)
Vince Duncan attempts a Layup. Contested by Ayo McCollum (5.0 feet, ZONE). VINCE DUNCAN MAKES IT!
Score: 3-7

[09:36] Team_044 possession (Score: 3-7)
Zach McGrady drives, Collin Barnes stays with him. Zach McGrady attempts a Layup. Contested by Collin Barnes (4.2 feet, MAN). Zach McGrady misses. Rebound secured by Vince Duncan.

[09:24] Team_016 possession (Score: 3-7)
FOUL! Holding foul on Isaiah Murray. [Team fouls: 2] No free throws, side out. (Isaiah Murray: 1 personal fouls)

[09:08] Team_016 possession (Score: 3-7)
Vince Quickley attempts a Midrange. Contested by Victor Westbrook (4.7 feet, MAN). VINCE QUICKLEY MAKES IT!
Score: 3-9

[08:52] Team_044 possession (Score: 3-9)
Karl Fox attempts a Layup. Contested by Vince Duncan (3.3 feet, ZONE). Karl Fox misses. Rebound secured by Vince Quickley.

[08:36] Team_016 possession (Score: 3-9)
Ben Barrett attempts a Midrange. Contested by Isaiah Murray (5.2 feet, ZONE). BEN BARRETT MAKES IT!
Score: 3-11

[08:22] Team_044 possession (Score: 3-11)
Ayo McCollum drives to the basket... Ayo McCollum throws a bad pass! Stolen by Vince Duncan! TURNOVER! (live ball)

[08:08] Team_016 possession (Score: 3-11)
Giannis Ginobili drives, Isaiah Murray stays with him. Giannis Ginobili attempts a Layup. Contested by Isaiah Murray (4.8 feet, MAN). Giannis Ginobili misses. Rebound secured by Victor Westbrook.

[07:57] Team_044 possession (Score: 3-11)
Ayo McCollum attempts a Midrange. Contested by Vince Duncan (3.1 feet, MAN). AYO MCCOLLUM MAKES IT!
Score: 5-11

[07:41] Team_016 possession (Score: 5-11)
Ben Barrett drives, Ayo McCollum stays with him. Ben Barrett attempts a Layup. Contested by Ayo McCollum (5.2 feet, ZONE). BEN BARRETT MAKES IT! Assist: Vince Duncan
Score: 5-13

[07:30] Team_044 possession (Score: 5-13)
Victor Westbrook drives, picks up Vince Duncan. Help arrives from Collin Barnes! Victor Westbrook attempts a Dunk. Contested by Collin Barnes (3.2 feet, ZONE). VICTOR WESTBROOK MAKES IT! Assist: Karl Fox
Score: 7-13

[07:13] Team_016 possession (Score: 7-13)
Giannis Ginobili attempts a Layup. Contested by Ayo McCollum (4.7 feet, ZONE). Giannis Ginobili misses. FOUL! Loose ball foul on Victor Westbrook during the rebound battle. [Team fouls: 3] No free throws, side out. (Victor Westbrook: 1 personal fouls)

[07:01] Team_016 possession (Score: 7-13)
Giannis Ginobili attempts a Midrange. Contested by Isaiah Murray (4.8 feet, MAN). Giannis Ginobili misses. Rebound secured by Victor Westbrook.

[06:46] Team_044 possession (Score: 7-13)
Karl Fox attempts a 3Pt. Contested by Vince Quickley (4.4 feet, ZONE). Karl Fox misses. FOUL! Loose ball foul on Ben Barrett during the rebound battle. [Team fouls: 2] No free throws, side out. (Ben Barrett: 1 personal fouls)

[06:28] Team_044 possession (Score: 7-13)
Zach McGrady attempts a Midrange. Contested by Collin Barnes (4.2 feet, MAN). Zach McGrady misses. Offensive rebound by Ayo McCollum! Ayo McCollum puts it back in!
Score: 9-13

[06:15] Team_016 possession (Score: 9-13)
Collin Barnes drives and kicks out. Vince Duncan attempts a 3Pt. Contested by Ayo McCollum (4.6 feet, MAN). Vince Duncan misses. Rebound secured by Victor Westbrook.

[05:58] Team_044 possession (Score: 9-13)
Isaiah Murray attempts a Layup. BLOCKED BY VINCE QUICKLEY! Ball is loose! Offensive rebound by Victor Westbrook! Victor Westbrook kicks it out.

[05:45] Team_044 possession (Score: 9-13)
Karl Fox attempts a Midrange. Contested by Ben Barrett (3.7 feet, MAN). Karl Fox misses. Rebound secured by Ben Barrett.

[05:31] Team_016 possession (Score: 9-13)
Collin Barnes drives and kicks out. Giannis Ginobili attempts a 3Pt. Contested by Victor Westbrook (5.2 feet, ZONE). Giannis Ginobili misses. Rebound secured by Victor Westbrook.

[05:14] Team_044 possession (Score: 9-13)
Zach McGrady attempts a Midrange. Contested by Collin Barnes (4.3 feet, MAN). Zach McGrady misses. Rebound secured by Vince Duncan.

[05:03] Team_016 possession (Score: 9-13)
Ben Barrett attempts a Layup. Contested by Karl Fox (4.5 feet, MAN). Ben Barrett misses. Offensive rebound by Vince Duncan! Vince Duncan puts it back in!
Score: 9-15

[04:49] Team_044 possession (Score: 9-15)
Zach McGrady attempts a 3Pt. Contested by Collin Barnes (4.3 feet, ZONE). Zach McGrady misses. Rebound secured by Vince Quickley.

[04:34] Team_016 possession (Score: 9-15)
Collin Barnes attempts a Midrange. Contested by Zach McGrady (4.2 feet, MAN). Collin Barnes misses. Offensive rebound by Ben Barrett! Ben Barrett puts it back in!
Score: 9-17

[04:18] Team_044 possession (Score: 9-17)
Isaiah Murray attempts a Layup. Contested by Vince Duncan (3.6 feet, ZONE). ISAIAH MURRAY MAKES IT! Assist: Ayo McCollum
Score: 11-17

[04:01] Team_016 possession (Score: 11-17)
Vince Quickley attempts a 3Pt. Contested by Isaiah Murray (4.3 feet, ZONE). Vince Quickley misses. Offensive rebound by Vince Duncan! Vince Duncan puts it back in!
Score: 11-19

[03:46] Team_044 possession (Score: 11-19)
Isaiah Murray drives and kicks out. FOUL! Shooting foul on Vince Quickley. Karl Fox to the line for 2 free throws. [Team fouls: 3] (Vince Quickley: 1 personal fouls)   FT 1/2: GOOD   FT 2/2: GOOD Karl Fox makes 2/2 from the line.
Score: 13-19

[03:31] Team_016 possession (Score: 13-19)
FOUL! Shooting foul on Karl Fox. Ben Barrett to the line for 3 free throws. [Team fouls: 4] (Karl Fox: 1 personal fouls)   FT 1/3: GOOD   FT 2/3: MISS   FT 3/3: GOOD Ben Barrett makes 2/3 from the line.
Score: 13-21

[03:13] Team_044 possession (Score: 13-21)
Karl Fox attempts a Midrange. Contested by Ben Barrett (3.9 feet, MAN). Karl Fox misses. Rebound secured by Ben Barrett.

[02:55] Team_016 possession (Score: 13-21)
FOUL! Reach-in foul on Ayo McCollum during the drive. [IN THE BONUS! 5 team fouls] Vince Duncan to the line for 2 free throws. (Ayo McCollum: 1 personal fouls)   FT 1/2: GOOD   FT 2/2: GOOD Vince Duncan makes 2/2 from the line.
Score: 13-23

[02:40] Team_044 possession (Score: 13-23)
Victor Westbrook attempts a Midrange. Contested by Vince Quickley (4.4 feet, MAN). Victor Westbrook misses. Rebound secured by Ben Barrett.

[02:26] Team_016 possession (Score: 13-23)
Giannis Ginobili attempts a 3Pt. Contested by Isaiah Murray (5.0 feet, MAN). GIANNIS GINOBILI MAKES IT! Assist: Collin Barnes
Score: 13-26

[02:09] Team_044 possession (Score: 13-26)
Victor Westbrook attempts a 3Pt. Contested by Collin Barnes (4.4 feet, ZONE). Victor Westbrook misses. Rebound secured by Ben Barrett.

[01:57] Team_016 possession (Score: 13-26)
FOUL! Reach-in foul on Ayo McCollum during the drive. [IN THE BONUS! 6 team fouls] Vince Duncan to the line for 2 free throws. (Ayo McCollum: 2 personal fouls)   FT 1/2: GOOD   FT 2/2: GOOD Vince Duncan makes 2/2 from the line.
Score: 13-28

[01:42] Team_044 possession (Score: 13-28)
Karl Fox attempts a 3Pt. Contested by Ben Barrett (4.1 feet, MAN). Karl Fox misses. Rebound secured by Vince Quickley.

[01:31] Team_016 possession (Score: 13-28)
Vince Duncan makes the Layup and draws the foul on Ayo McCollum! And-1! Vince Duncan to the line for 1. [BONUS: 7 team fouls] (Ayo McCollum: 3 personal fouls)   FT 1/1: GOOD Vince Duncan makes 1/1 from the line.
Score: 13-31

[01:15] Team_044 possession (Score: 13-31)
Karl Fox attempts a 3Pt. Contested by Ben Barrett (4.1 feet, MAN). Karl Fox misses. Rebound secured by Vince Duncan.

[01:06] Team_016 possession (Score: 13-31)
Ben Barrett attempts a 3Pt. Contested by Isaiah Murray (5.5 feet, ZONE). BEN BARRETT MAKES IT! Assist: Vince Quickley
Score: 13-34

[00:48] Team_044 possession (Score: 13-34)
Victor Westbrook drives and kicks out. Isaiah Murray attempts a Midrange. Contested by Giannis Ginobili (5.9 feet, MAN). Isaiah Murray misses. Rebound secured by Vince Duncan.

[00:36] Team_016 possession (Score: 13-34)
Giannis Ginobili attempts a 3Pt. Contested by Isaiah Murray (5.1 feet, MAN). Giannis Ginobili misses. Rebound secured by Victor Westbrook.

[00:17] Team_044 possession (Score: 13-34)
FOUL! Holding foul on Collin Barnes. [Team fouls: 4] No free throws, side out. (Collin Barnes: 1 personal fouls)

[00:01] Team_044 possession (Score: 13-34)
Zach McGrady attempts a Midrange. Contested by Collin Barnes (4.8 feet, MAN). Zach McGrady misses. Rebound secured by Vince Duncan.

================================================================================
                              1ST QUARTER COMPLETE                              
================================================================================

1ST QUARTER SCORE: Team_044 13, Team_016 34

BOX SCORE:
================================================================================

Team_044
--------------------------------------------------------------------------------
Player                MIN  PTS  REB  AST  TO      FG   FG%      3P   3P%
--------------------------------------------------------------------------------
Ayo McCollum           12    6    3    1   0   3/3   100.0     0/0   0.0
Karl Fox               12    3    2    1   0   2/7    28.6     0/0   0.0
Victor Westbrook       12    2    6    0   0   1/5    20.0     0/0   0.0
Isaiah Murray          12    2    0    0   0   1/1   100.0     0/0   0.0
Zach McGrady           12    0    0    0   0   0/4     0.0     0/0   0.0

TEAM: FG: 7/20 (35.0%), 3PT: 0/5 (0.0%), REB: 11 (3 off, 8 def), AST: 2, TO: 3
TEAM FOULS: 7 [Team_016 in BONUS]


Team_016
--------------------------------------------------------------------------------
Player                MIN  PTS  REB  AST  TO      FG   FG%      3P   3P%
--------------------------------------------------------------------------------
Vince Duncan           12   13    7    1   0   6/6   100.0     0/0   0.0
Ben Barrett            12   11    7    0   0   5/5   100.0     0/0   0.0
Collin Barnes          12    3    0    1   0   1/5    20.0     0/0   0.0
Giannis Ginobili       12    3    0    0   0   1/4    25.0     0/0   0.0
Vince Quickley         12    2    3    1   0   1/2    50.0     0/0   0.0

TEAM: FG: 14/22 (63.6%), 3PT: 5/7 (71.4%), REB: 17 (4 off, 13 def), AST: 3, TO: 0
TEAM FOULS: 4

================================================================================

================================================================================
                       2ND QUARTER - Team_044 vs Team_016                       
================================================================================

[12:00] Team_044 possession (Score: 13-34)
Ayo McCollum drives and kicks out. Zach McGrady makes the 3Pt and draws the foul on Collin Barnes! And-1! Zach McGrady to the line for 1. [Team fouls: 1] (Collin Barnes: 1 personal fouls)   FT 1/1: GOOD Zach McGrady makes 1/1 from the line.
Score: 17-34

[11:49] Team_016 possession (Score: 17-34)
Vince Duncan drives and kicks out. Vince Duncan attempts a 3Pt. Contested by Isaiah Murray (5.0 feet, ZONE). Vince Duncan misses. Rebound secured by Ayo McCollum.

[11:33] Team_044 possession (Score: 17-34)
FOUL! Shooting foul on Vince Duncan. Ayo McCollum to the line for 2 free throws. [Team fouls: 2] (Vince Duncan: 1 personal fouls)   FT 1/2: MISS   FT 2/2: MISS Ayo McCollum makes 0/2 from the line. Rebound secured by Vince Quickley.

[11:18] Team_016 possession (Score: 17-34)
Giannis Ginobili makes the Layup and draws the foul on Ayo McCollum! And-1! Giannis Ginobili to the line for 1. [Team fouls: 1] (Ayo McCollum: 1 personal fouls)   FT 1/1: GOOD Giannis Ginobili makes 1/1 from the line.
Score: 17-37

[11:02] Team_044 possession (Score: 17-37)
Karl Fox attempts a Layup. Contested by Ben Barrett (4.1 feet, ZONE). Karl Fox misses. Rebound secured by Vince Quickley.

[10:48] Team_016 possession (Score: 17-37)
Ben Barrett attempts a Layup. BLOCKED BY AYO MCCOLLUM! Ball deflects out of bounds off Ben Barrett.

[10:35] Team_044 possession (Score: 17-37)
Zach McGrady attempts a 3Pt. Contested by Collin Barnes (4.8 feet, ZONE). Zach McGrady misses. Offensive rebound by Victor Westbrook! Victor Westbrook kicks it out.

[10:24] Team_044 possession (Score: 17-37)
Ayo McCollum drives, Vince Duncan stays with him. Ayo McCollum attempts a Dunk. Contested by Vince Duncan (3.7 feet, ZONE). Ayo McCollum misses. Offensive rebound by Ayo McCollum! Ayo McCollum kicks it out.

[10:08] Team_044 possession (Score: 17-37)
Zach McGrady attempts a Midrange. Contested by Collin Barnes (4.8 feet, MAN). Zach McGrady misses. Offensive rebound by Ayo McCollum! Ayo McCollum kicks it out.

[09:54] Team_044 possession (Score: 17-37)
Ayo McCollum drives, Vince Duncan stays with him. Ayo McCollum attempts a Layup. Contested by Vince Duncan (3.7 feet, MAN). Ayo McCollum misses. Rebound secured by Ben Barrett.

[09:41] Team_016 possession (Score: 17-37)
Ben Barrett attempts a 3Pt. Contested by Karl Fox (4.9 feet, MAN). BEN BARRETT MAKES IT! Assist: Vince Duncan
Score: 17-40

[09:24] Team_044 possession (Score: 17-40)
Karl Fox attempts a 3Pt. Contested by Ben Barrett (4.4 feet, MAN). Karl Fox misses. Rebound secured by Vince Quickley.

[09:09] Team_016 possession (Score: 17-40)
Vince Duncan drives and kicks out. Collin Barnes attempts a 3Pt. Contested by Isaiah Murray (5.3 feet, ZONE). COLLIN BARNES MAKES IT! Assist: Giannis Ginobili
Score: 17-43

[08:53] Team_044 possession (Score: 17-43)
Victor Westbrook attempts a 3Pt. Contested by Collin Barnes (4.8 feet, ZONE). Victor Westbrook misses. Offensive rebound by Ayo McCollum! Ayo McCollum kicks it out.

[08:36] Team_044 possession (Score: 17-43)
Isaiah Murray attempts a Midrange. Wide open! Giannis Ginobili is 6.4 feet away. [MAN] ISAIAH MURRAY MAKES IT! Assist: Karl Fox
Score: 19-43

[08:20] Team_016 possession (Score: 19-43)
Vince Duncan makes the Midrange and draws the foul on Ayo McCollum! And-1! Vince Duncan to the line for 1. [Team fouls: 2] (Ayo McCollum: 2 personal fouls)   FT 1/1: GOOD Vince Duncan makes 1/1 from the line.
Score: 19-46

[08:06] Team_044 possession (Score: 19-46)
Ayo McCollum drives, picks up Vince Duncan. Help arrives from Giannis Ginobili! Ayo McCollum attempts a Layup. Contested by Giannis Ginobili (4.0 feet, ZONE). AYO MCCOLLUM MAKES IT!
Score: 21-46

[07:54] Team_016 possession (Score: 21-46)
Collin Barnes attempts a Midrange. Contested by Karl Fox (4.7 feet, ZONE). Collin Barnes misses. Rebound secured by Victor Westbrook.

[07:43] Team_044 possession (Score: 21-46)
Zach McGrady drives, Vince Duncan stays with him. Zach McGrady attempts a Dunk. Contested by Vince Duncan (4.3 feet, ZONE). Zach McGrady misses. Rebound secured by Ben Barrett.

[07:29] Team_016 possession (Score: 21-46)
Vince Quickley attempts a Midrange. Contested by Victor Westbrook (5.7 feet, MAN). VINCE QUICKLEY MAKES IT! Assist: Giannis Ginobili
Score: 21-48

[07:14] Team_044 possession (Score: 21-48)
Karl Fox attempts a Midrange. Contested by Ben Barrett (4.7 feet, MAN). Karl Fox misses. FOUL! Loose ball foul on Ben Barrett during the rebound battle. [Team fouls: 3] No free throws, side out. (Ben Barrett: 1 personal fouls)

[06:56] Team_044 possession (Score: 21-48)
Isaiah Murray attempts a 3Pt. Wide open! Giannis Ginobili is 6.5 feet away. [MAN] Isaiah Murray misses. Rebound secured by Ben Barrett.

[06:40] Team_016 possession (Score: 21-48)
Vince Quickley drives and kicks out. Collin Barnes makes the Midrange and draws the foul on Zach McGrady! And-1! Collin Barnes to the line for 1. [Team fouls: 3] (Zach McGrady: 1 personal fouls)   FT 1/1: MISS Collin Barnes makes 0/1 from the line. Offensive rebound by Ben Barrett! Ben Barrett puts it back in!
Score: 21-52

[06:24] Team_044 possession (Score: 21-52)
Zach McGrady drives to the basket... Zach McGrady throws a bad pass! Stolen by Collin Barnes! TURNOVER! (live ball)

[06:09] Team_016 possession (Score: 21-52)
FOUL! Shooting foul on Victor Westbrook. Vince Quickley to the line for 3 free throws. [Team fouls: 4] (Victor Westbrook: 1 personal fouls)   FT 1/3: MISS   FT 2/3: GOOD   FT 3/3: GOOD Vince Quickley makes 2/3 from the line.
Score: 21-54

[05:52] Team_044 possession (Score: 21-54)
Zach McGrady attempts a Midrange. Contested by Collin Barnes (5.4 feet, MAN). Zach McGrady misses. Rebound secured by Vince Duncan.

[05:38] Team_016 possession (Score: 21-54)
Ben Barrett makes the Layup and draws the foul on Karl Fox! And-1! Ben Barrett to the line for 1. [BONUS: 5 team fouls] (Karl Fox: 1 personal fouls)   FT 1/1: GOOD Ben Barrett makes 1/1 from the line.
Score: 21-57

[05:24] Team_044 possession (Score: 21-57)
Zach McGrady drives, Collin Barnes stays with him. Zach McGrady attempts a Dunk. Contested by Collin Barnes (5.5 feet, MAN). ZACH MCGRADY MAKES IT! Assist: Victor Westbrook
Score: 23-57

[05:14] Team_016 possession (Score: 23-57)
FOUL! Shooting foul on Ayo McCollum. Vince Duncan to the line for 2 free throws. [BONUS: 6 team fouls] (Ayo McCollum: 3 personal fouls)   FT 1/2: GOOD   FT 2/2: GOOD Vince Duncan makes 2/2 from the line.
Score: 23-59

[04:57] Team_044 possession (Score: 23-59)
Isaiah Murray loses control! Ball rolls out of bounds! TURNOVER! (dead ball)

[04:57] Substitution (Team_044): Zach McGrady OUT → Kyrie Poole IN (stamina_rule2)

[04:57] Substitution (Team_044): Isaiah Murray OUT → Tim Towns IN (stamina_rule2)

[04:57] Substitution (Team_044): Victor Westbrook OUT → Tim Siakam IN (stamina_rule2)

[04:57] Substitution (Team_044): Karl Fox OUT → Pau Quickley IN (stamina_rule2)

[04:57] Substitution (Team_044): Ayo McCollum OUT → Victor Anthony IN (stamina_rule2)

[04:57] Substitution (Team_016): Collin Barnes OUT → Lamelo Herro IN (stamina_rule2)

[04:57] Substitution (Team_016): Giannis Ginobili OUT → Immanuel Nowitzki IN (stamina_rule2)

[04:57] Substitution (Team_016): Vince Quickley OUT → Kevin Butler IN (stamina_rule2)

[04:57] Substitution (Team_016): Ben Barrett OUT → Giannis Doncic IN (stamina_rule2)

[04:57] Substitution (Team_016): Vince Duncan OUT → Trae Barnes IN (stamina_rule2)

[04:43] Team_016 possession (Score: 23-59)
Giannis Doncic attempts a Midrange. Contested by Victor Anthony (4.3 feet, ZONE). GIANNIS DONCIC MAKES IT!
Score: 23-61

[04:29] Team_044 possession (Score: 23-61)
Kyrie Poole drives and kicks out. Kyrie Poole attempts a Midrange. Contested by Immanuel Nowitzki (4.6 feet, ZONE). KYRIE POOLE MAKES IT!
Score: 25-61

[04:16] Team_016 possession (Score: 25-61)
Immanuel Nowitzki attempts a 3Pt. Contested by Tim Siakam (3.8 feet, ZONE). Immanuel Nowitzki misses. Rebound secured by Victor Anthony.

[03:58] Team_044 possession (Score: 25-61)
FOUL! Holding foul on Immanuel Nowitzki. [Team fouls: 4] No free throws, side out. (Immanuel Nowitzki: 1 personal fouls)

[03:49] Team_044 possession (Score: 25-61)
Tim Siakam attempts a Midrange. Contested by Kevin Butler (4.5 feet, MAN). TIM SIAKAM MAKES IT!
Score: 27-61

[03:36] Team_016 possession (Score: 27-61)
Trae Barnes drives to the basket... Trae Barnes throws a bad pass out of bounds! TURNOVER! (dead ball)

[03:26] Team_044 possession (Score: 27-61)
Tim Siakam attempts a 3Pt. Contested by Kevin Butler (4.5 feet, MAN). Tim Siakam misses. Rebound secured by Trae Barnes.

[03:14] Team_016 possession (Score: 27-61)
Kevin Butler drives, Pau Quickley stays with him. Kevin Butler attempts a Layup. Contested by Pau Quickley (3.1 feet, ZONE). Kevin Butler misses. Rebound secured by Victor Anthony.

[02:59] Team_044 possession (Score: 27-61)
Kyrie Poole throws a bad pass out of bounds! TURNOVER! (dead ball)

[02:45] Team_016 possession (Score: 27-61)
Immanuel Nowitzki attempts a Layup. Contested by Tim Towns (5.4 feet, MAN). Immanuel Nowitzki misses. Rebound secured by Tim Siakam.

[02:33] Team_044 possession (Score: 27-61)
Tim Towns attempts a 3Pt. Contested by Immanuel Nowitzki (4.8 feet, MAN). TIM TOWNS MAKES IT! Assist: Victor Anthony
Score: 30-61

[02:23] Team_016 possession (Score: 30-61)
Giannis Doncic makes the Dunk and draws the foul on Pau Quickley! And-1! Giannis Doncic to the line for 1. [BONUS: 7 team fouls] (Pau Quickley: 1 personal fouls)   FT 1/1: GOOD Giannis Doncic makes 1/1 from the line.
Score: 30-64

[02:12] Team_044 possession (Score: 30-64)
Pau Quickley attempts a Layup. Contested by Giannis Doncic (4.0 feet, MAN). Pau Quickley misses. FOUL! Loose ball foul on Trae Barnes during the rebound battle. [IN THE BONUS! 5 team fouls] Tim Siakam to the line for 2 free throws. (Trae Barnes: 1 personal fouls)   FT 1/2: GOOD   FT 2/2: MISS Tim Siakam makes 1/2 from the line. Rebound secured by Trae Barnes.
Score: 31-64

[01:58] Team_016 possession (Score: 31-64)
Giannis Doncic makes the Layup and draws the foul on Pau Quickley! And-1! Giannis Doncic to the line for 1. [BONUS: 8 team fouls] (Pau Quickley: 2 personal fouls)   FT 1/1: GOOD Giannis Doncic makes 1/1 from the line.
Score: 31-67

[01:43] Team_044 possession (Score: 31-67)
Victor Anthony drives to the basket... Victor Anthony throws a bad pass! Stolen by Trae Barnes! TURNOVER! (live ball)

[01:32] Team_016 possession (Score: 31-67)
Immanuel Nowitzki drives and kicks out. Giannis Doncic attempts a 3Pt. Contested by Pau Quickley (3.4 feet, MAN). Giannis Doncic misses. Offensive rebound by Trae Barnes! Trae Barnes kicks it out.

[01:18] Team_016 possession (Score: 31-67)
Kevin Butler throws a bad pass! Stolen by Tim Siakam! TURNOVER! (live ball)

[01:04] Team_044 possession (Score: 31-67)
Victor Anthony drives, Trae Barnes stays with him. Victor Anthony attempts a Layup. Wide open! Trae Barnes is 6.3 feet away. [MAN] VICTOR ANTHONY MAKES IT!
Score: 33-67

[00:49] Team_016 possession (Score: 33-67)
Lamelo Herro attempts a 3Pt. Contested by Pau Quickley (3.3 feet, ZONE). LAMELO HERRO MAKES IT! Assist: Immanuel Nowitzki
Score: 33-70

[00:37] Team_044 possession (Score: 33-70)
Victor Anthony attempts a Layup. Wide open! Trae Barnes is 6.3 feet away. [MAN] VICTOR ANTHONY MAKES IT!
Score: 35-70

[00:24] Team_016 possession (Score: 35-70)
Lamelo Herro attempts a Midrange. Contested by Kyrie Poole (4.5 feet, MAN). Lamelo Herro misses. Rebound secured by Victor Anthony.

[00:12] Team_044 possession (Score: 35-70)
Kyrie Poole attempts a 3Pt. Contested by Lamelo Herro (3.7 feet, MAN). KYRIE POOLE MAKES IT! Assist: Tim Towns
Score: 38-70

================================================================================
                              2ND QUARTER COMPLETE                              
================================================================================

2ND QUARTER SCORE: Team_044 25, Team_016 36

BOX SCORE:
================================================================================

Team_044
--------------------------------------------------------------------------------
Player                MIN  PTS  REB  AST  TO      FG   FG%      3P   3P%
--------------------------------------------------------------------------------
Zach McGrady           20    6    0    0   0   2/4    50.0     0/0   0.0
Kyrie Poole             5    5    0    0   0   2/2   100.0     0/0   0.0
Victor Anthony          5    4    3    1   0   2/2   100.0     0/0   0.0
Tim Towns               5    3    0    1   0   1/1   100.0     0/0   0.0
Ayo McCollum           20    2    4    0   0   1/3    33.3     0/0   0.0
Isaiah Murray          20    2    0    0   0   1/2    50.0     0/0   0.0
Tim Siakam              5    2    1    0   0   1/2    50.0     0/0   0.0
Karl Fox               20    0    0    1   0   0/2     0.0     0/0   0.0
Victor Westbrook       20    0    3    1   0   0/0     0.0     0/0   0.0
Pau Quickley            5    0    0    0   0   0/1     0.0     0/0   0.0

TEAM: FG: 10/19 (52.6%), 3PT: 2/5 (40.0%), REB: 12 (6 off, 6 def), AST: 4, TO: 4
TEAM FOULS: 8 [Team_016 in BONUS]


Team_016
--------------------------------------------------------------------------------
Player                MIN  PTS  REB  AST  TO      FG   FG%      3P   3P%
--------------------------------------------------------------------------------
Ben Barrett            20   10    3    0   0   3/4    75.0     0/0   0.0
Giannis Doncic          5    8    0    0   0   3/3   100.0     0/0   0.0
Vince Duncan           20    5    1    1   0   2/3    66.7     0/0   0.0
Vince Quickley         20    4    3    0   0   2/2   100.0     0/0   0.0
Giannis Ginobili       20    3    0    2   0   1/1   100.0     0/0   0.0
Collin Barnes          20    3    0    0   0   1/2    50.0     0/0   0.0
Lamelo Herro            5    3    0    0   0   1/2    50.0     0/0   0.0
Immanuel Nowitzki       5    0    0    1   0   0/2     0.0     0/0   0.0
Trae Barnes             5    0    3    0   0   0/0     0.0     0/0   0.0
Kevin Butler            5    0    0    0   0   0/1     0.0     0/0   0.0

TEAM: FG: 13/20 (65.0%), 3PT: 3/4 (75.0%), REB: 9 (1 off, 8 def), AST: 4, TO: 2
TEAM FOULS: 5 [Team_044 in BONUS]

================================================================================

================================================================================
                       3RD QUARTER - Team_044 vs Team_016                       
================================================================================

[12:00] Team_044 possession (Score: 38-70)
Ayo McCollum drives to the basket... Ayo McCollum throws a bad pass! Stolen by Vince Duncan! TURNOVER! (live ball)

[11:45] Team_016 possession (Score: 38-70)
Vince Duncan drives and kicks out. Collin Barnes attempts a Midrange. Contested by Victor Westbrook (5.1 feet, ZONE). Collin Barnes misses. FOUL! Loose ball foul on Karl Fox during the rebound battle. [Team fouls: 1] No free throws, side out. (Karl Fox: 1 personal fouls)

[11:30] Team_016 possession (Score: 38-70)
Giannis Ginobili attempts a Midrange. Contested by Isaiah Murray (4.8 feet, MAN). Giannis Ginobili misses. FOUL! Loose ball foul on Karl Fox during the rebound battle. [Team fouls: 2] No free throws, side out. (Karl Fox: 2 personal fouls)

[11:15] Team_016 possession (Score: 38-70)
Collin Barnes attempts a Midrange. Contested by Zach McGrady (4.2 feet, MAN). Collin Barnes misses. Rebound secured by Victor Westbrook.

[11:00] Team_044 possession (Score: 38-70)
Isaiah Murray attempts a Midrange. Contested by Giannis Ginobili (6.0 feet, MAN). ISAIAH MURRAY MAKES IT! Assist: Zach McGrady
Score: 40-70

[10:42] Team_016 possession (Score: 40-70)
Vince Duncan drives, Karl Fox stays with him. Vince Duncan attempts a Layup. Contested by Karl Fox (4.3 feet, ZONE). VINCE DUNCAN MAKES IT!
Score: 40-72

[10:23] Team_044 possession (Score: 40-72)
Victor Westbrook attempts a 3Pt. Contested by Vince Quickley (4.3 feet, MAN). Victor Westbrook misses. Rebound secured by Ben Barrett.

[10:09] Team_016 possession (Score: 40-72)
Vince Quickley attempts a 3Pt. Contested by Isaiah Murray (4.2 feet, ZONE). Vince Quickley misses. Rebound secured by Karl Fox.

[09:53] Team_044 possession (Score: 40-72)
Karl Fox attempts a Layup. Contested by Ben Barrett (3.7 feet, MAN). KARL FOX MAKES IT!
Score: 42-72

[09:38] Team_016 possession (Score: 42-72)
Ben Barrett attempts a Layup. Contested by Ayo McCollum (5.2 feet, ZONE). BEN BARRETT MAKES IT! Assist: Vince Duncan
Score: 42-74

[09:21] Team_044 possession (Score: 42-74)
FOUL! Holding foul on Vince Quickley. [Team fouls: 1] No free throws, side out. (Vince Quickley: 1 personal fouls)

[09:06] Team_044 possession (Score: 42-74)
Victor Westbrook loses the ball! Stripped by Vince Quickley! TURNOVER! (live ball)

[08:50] Team_016 possession (Score: 42-74)
Ben Barrett drives to the basket... FOUL! Offensive foul on Ben Barrett! Karl Fox drew the charge! [Team fouls: 2] (Ben Barrett: 1 personal fouls) TURNOVER! (dead ball)

[08:37] Team_044 possession (Score: 42-74)
Isaiah Murray attempts a 3Pt. Contested by Collin Barnes (4.4 feet, ZONE). Isaiah Murray misses. Rebound secured by Ben Barrett.

[08:23] Team_016 possession (Score: 42-74)
Collin Barnes attempts a 3Pt. Contested by Karl Fox (4.0 feet, ZONE). Collin Barnes misses. Rebound secured by Ayo McCollum.

[08:12] Team_044 possession (Score: 42-74)
Isaiah Murray attempts a 3Pt. Contested by Ben Barrett (4.0 feet, ZONE). Isaiah Murray misses. Rebound secured by Vince Quickley.

[07:55] Team_016 possession (Score: 42-74)
FOUL! Holding foul on Zach McGrady. [Team fouls: 3] No free throws, side out. (Zach McGrady: 1 personal fouls)

[07:39] Team_016 possession (Score: 42-74)
Collin Barnes attempts a 3Pt. Contested by Isaiah Murray (4.7 feet, ZONE). Collin Barnes misses. Rebound secured by Victor Westbrook.

[07:25] Team_044 possession (Score: 42-74)
Zach McGrady attempts a Midrange. Contested by Vince Duncan (3.4 feet, ZONE). ZACH MCGRADY MAKES IT!
Score: 44-74

[07:09] Team_016 possession (Score: 44-74)
Ben Barrett attempts a Layup. Contested by Karl Fox (4.5 feet, MAN). BEN BARRETT MAKES IT!
Score: 44-76

[06:55] Team_044 possession (Score: 44-76)
Karl Fox drives, picks up Vince Duncan. Help arrives from Collin Barnes! Karl Fox attempts a Layup. Contested by Collin Barnes (3.3 feet, ZONE). KARL FOX MAKES IT! Assist: Isaiah Murray
Score: 46-76

[06:43] Team_016 possession (Score: 46-76)
Vince Quickley attempts a Layup. Contested by Victor Westbrook (4.7 feet, MAN). Vince Quickley misses. Rebound secured by Karl Fox.

[06:26] Team_044 possession (Score: 46-76)
Ayo McCollum drives, picks up Vince Duncan. Help arrives from Collin Barnes! Ayo McCollum attempts a Layup. Contested by Collin Barnes (3.1 feet, MAN). AYO MCCOLLUM MAKES IT!
Score: 48-76

[06:12] Team_016 possession (Score: 48-76)
Vince Quickley attempts a Midrange. Contested by Ayo McCollum (4.2 feet, ZONE). VINCE QUICKLEY MAKES IT! Assist: Ben Barrett
Score: 48-78

[06:02] Team_044 possession (Score: 48-78)
Karl Fox attempts a 3Pt. Contested by Ben Barrett (3.7 feet, MAN). Karl Fox misses. Rebound secured by Vince Quickley.

[05:49] Team_016 possession (Score: 48-78)
Vince Quickley drives and kicks out. Collin Barnes attempts a Midrange. Contested by Zach McGrady (4.1 feet, MAN). COLLIN BARNES MAKES IT!
Score: 48-80

[05:33] Team_044 possession (Score: 48-80)
Ayo McCollum attempts a Midrange. Contested by Vince Duncan (3.1 feet, MAN). AYO MCCOLLUM MAKES IT!
Score: 50-80

[05:16] Team_016 possession (Score: 50-80)
Vince Duncan attempts a Midrange. Contested by Victor Westbrook (5.6 feet, ZONE). Vince Duncan misses. Rebound secured by Victor Westbrook.

[05:03] Team_044 possession (Score: 50-80)
Karl Fox attempts a Midrange. Contested by Ben Barrett (3.8 feet, MAN). KARL FOX MAKES IT!
Score: 52-80

[04:54] Team_016 possession (Score: 52-80)
Ben Barrett attempts a Dunk. BLOCKED BY KARL FOX! Ball is loose! Offensive rebound by Ben Barrett! Ben Barrett kicks it out.

[04:41] Team_016 possession (Score: 52-80)
Ben Barrett drives to the basket... FOUL! Offensive foul on Ben Barrett! Ayo McCollum drew the charge! [Team fouls: 3] (Ben Barrett: 2 personal fouls) TURNOVER! (dead ball)

[04:23] Team_044 possession (Score: 52-80)
Ayo McCollum attempts a Midrange. Contested by Vince Duncan (3.2 feet, MAN). Ayo McCollum misses. Rebound secured by Vince Duncan.

[04:08] Team_016 possession (Score: 52-80)
FOUL! Reach-in foul on Karl Fox during the drive. [IN THE BONUS! 5 team fouls] Vince Duncan to the line for 2 free throws. (Karl Fox: 4 personal fouls)   FT 1/2: GOOD   FT 2/2: GOOD Vince Duncan makes 2/2 from the line.
Score: 52-82

[03:52] Team_044 possession (Score: 52-82)
Ayo McCollum attempts a Layup. Contested by Vince Duncan (3.2 feet, ZONE). AYO MCCOLLUM MAKES IT! Assist: Victor Westbrook
Score: 54-82

[03:40] Team_016 possession (Score: 54-82)
Giannis Ginobili throws a bad pass! Stolen by Isaiah Murray! TURNOVER! (live ball)

[03:29] Team_044 possession (Score: 54-82)
Victor Westbrook attempts a Midrange. Contested by Giannis Ginobili (5.7 feet, ZONE). Victor Westbrook misses. FOUL! Loose ball foul on Vince Quickley during the rebound battle. [Team fouls: 4] No free throws, side out. (Vince Quickley: 2 personal fouls)

[03:13] Team_044 possession (Score: 54-82)
Karl Fox drives and kicks out. Karl Fox attempts a 3Pt. Contested by Ben Barrett (3.8 feet, MAN). Karl Fox misses. Rebound secured by Ben Barrett.

[03:00] Team_016 possession (Score: 54-82)
FOUL! Shooting foul on Ayo McCollum. Vince Duncan to the line for 2 free throws. [BONUS: 6 team fouls] (Ayo McCollum: 1 personal fouls)   FT 1/2: MISS   FT 2/2: MISS Vince Duncan makes 0/2 from the line. Rebound secured by Karl Fox.

[02:43] Team_044 possession (Score: 54-82)
Isaiah Murray attempts a Midrange. Wide open! Giannis Ginobili is 6.1 feet away. [MAN] Isaiah Murray misses. Rebound secured by Vince Duncan.

[02:27] Team_016 possession (Score: 54-82)
FOUL! Holding foul on Ayo McCollum. [IN THE BONUS! 7 team fouls] Vince Duncan to the line for 2 free throws. (Ayo McCollum: 2 personal fouls)   FT 1/2: GOOD   FT 2/2: GOOD Vince Duncan makes 2/2 from the line.
Score: 54-84

[02:15] Team_044 possession (Score: 54-84)
Zach McGrady attempts a 3Pt. Contested by Collin Barnes (4.6 feet, ZONE). Zach McGrady misses. Offensive rebound by Victor Westbrook! Victor Westbrook kicks it out.

[01:59] Team_044 possession (Score: 54-84)
Karl Fox drives and kicks out. Zach McGrady attempts a Midrange. Contested by Collin Barnes (4.4 feet, ZONE). ZACH MCGRADY MAKES IT! Assist: Ayo McCollum
Score: 56-84

[01:42] Team_016 possession (Score: 56-84)
FOUL! Reach-in foul on Ayo McCollum during the drive. [IN THE BONUS! 8 team fouls] Vince Quickley to the line for 2 free throws. (Ayo McCollum: 3 personal fouls)   FT 1/2: GOOD   FT 2/2: GOOD Vince Quickley makes 2/2 from the line.
Score: 56-86

[01:30] Team_044 possession (Score: 56-86)
FOUL! Shooting foul on Vince Duncan. Isaiah Murray to the line for 2 free throws. [BONUS: 5 team fouls] (Vince Duncan: 1 personal fouls)   FT 1/2: GOOD   FT 2/2: GOOD Isaiah Murray makes 2/2 from the line.
Score: 58-86

[01:19] Team_016 possession (Score: 58-86)
Giannis Ginobili attempts a Midrange. Contested by Isaiah Murray (5.1 feet, MAN). GIANNIS GINOBILI MAKES IT! Assist: Vince Duncan
Score: 58-88

[01:04] Team_044 possession (Score: 58-88)
Isaiah Murray attempts a 3Pt. Wide open! Giannis Ginobili is 6.2 feet away. [MAN] Isaiah Murray misses. Offensive rebound by Ayo McCollum! Ayo McCollum kicks it out.

[00:44] Team_044 possession (Score: 58-88)
Victor Westbrook attempts a Layup. Contested by Vince Quickley (4.6 feet, MAN). Victor Westbrook misses. Rebound secured by Ben Barrett.

[00:32] Team_016 possession (Score: 58-88)
Ben Barrett attempts a Midrange. Contested by Karl Fox (4.8 feet, MAN). BEN BARRETT MAKES IT!
Score: 58-90

[00:20] Team_044 possession (Score: 58-90)
Karl Fox drives and kicks out. Isaiah Murray attempts a Midrange. Contested by Vince Quickley (4.6 feet, ZONE). ISAIAH MURRAY MAKES IT!
Score: 60-90

[00:04] Team_016 possession (Score: 60-90)
Vince Duncan drives and kicks out. Collin Barnes attempts a Midrange. Contested by Zach McGrady (4.7 feet, MAN). Collin Barnes misses. Rebound secured by Ayo McCollum.

================================================================================
                              3RD QUARTER COMPLETE                              
================================================================================

3RD QUARTER SCORE: Team_044 22, Team_016 20

BOX SCORE:
================================================================================

Team_044
--------------------------------------------------------------------------------
Player                MIN  PTS  REB  AST  TO      FG   FG%      3P   3P%
--------------------------------------------------------------------------------
Isaiah Murray          32    6    0    1   0   3/6    50.0     0/0   0.0
Karl Fox               32    6    3    0   0   3/5    60.0     0/0   0.0
Ayo McCollum           32    6    4    1   0   3/4    75.0     0/0   0.0
Zach McGrady           32    4    0    1   0   2/2   100.0     0/0   0.0
Victor Westbrook       32    0    4    1   0   0/2     0.0     0/0   0.0

TEAM: FG: 11/19 (57.9%), 3PT: 0/4 (0.0%), REB: 11 (3 off, 8 def), AST: 4, TO: 2
TEAM FOULS: 8 [Team_016 in BONUS]


Team_016
--------------------------------------------------------------------------------
Player                MIN  PTS  REB  AST  TO      FG   FG%      3P   3P%
--------------------------------------------------------------------------------
Ben Barrett            32    6    6    1   0   3/3   100.0     0/0   0.0
Vince Duncan           32    6    3    2   0   3/6    50.0     0/0   0.0
Vince Quickley         32    4    2    0   0   2/4    50.0     0/0   0.0
Collin Barnes          32    2    0    0   0   1/4    25.0     0/0   0.0
Giannis Ginobili       32    2    0    0   0   1/1   100.0     0/0   0.0

TEAM: FG: 10/18 (55.6%), 3PT: 0/3 (0.0%), REB: 11 (3 off, 8 def), AST: 3, TO: 3
TEAM FOULS: 5 [Team_044 in BONUS]

================================================================================

================================================================================
                       4TH QUARTER - Team_044 vs Team_016                       
================================================================================

[12:00] Substitution (Team_044): Zach McGrady OUT (stamina: 70) → Kyrie Poole IN (comeback_detected)

[12:00] Substitution (Team_016): Collin Barnes OUT (stamina: 68) → Lamelo Herro IN (comeback_detected)

[12:00] Team_044 possession (Score: 60-90)
Isaiah Murray attempts a 3Pt. Contested by Lamelo Herro (4.1 feet, ZONE). Isaiah Murray misses. Rebound secured by Ben Barrett.

[11:45] Team_016 possession (Score: 60-90)
Ben Barrett attempts a 3Pt. Contested by Kyrie Poole (5.1 feet, ZONE). BEN BARRETT MAKES IT! Assist: Vince Quickley
Score: 60-93

[11:29] Team_044 possession (Score: 60-93)
Karl Fox attempts a Midrange. Contested by Ben Barrett (4.1 feet, MAN). Karl Fox misses. Rebound secured by Vince Duncan.

[11:11] Team_016 possession (Score: 60-93)
Vince Quickley attempts a Midrange. Contested by Victor Westbrook (5.2 feet, MAN). VINCE QUICKLEY MAKES IT! Assist: Lamelo Herro
Score: 60-95

[10:55] Team_044 possession (Score: 60-95)
Isaiah Murray attempts a 3Pt. Contested by Lamelo Herro (4.1 feet, ZONE). Isaiah Murray misses. Offensive rebound by Victor Westbrook! Victor Westbrook kicks it out.

[10:44] Team_044 possession (Score: 60-95)
Kyrie Poole attempts a Midrange. Contested by Lamelo Herro (3.7 feet, MAN). Kyrie Poole misses. Rebound secured by Ben Barrett.

[10:28] Team_016 possession (Score: 60-95)
Giannis Ginobili attempts a Midrange. BLOCKED BY VICTOR WESTBROOK! Ball is loose! Rebound secured by Victor Westbrook.

[10:15] Team_044 possession (Score: 60-95)
Karl Fox attempts a Midrange. Contested by Giannis Ginobili (6.0 feet, ZONE). KARL FOX MAKES IT! Assist: Victor Westbrook
Score: 62-95

[09:59] Team_016 possession (Score: 62-95)
Ben Barrett attempts a 3Pt. Contested by Karl Fox (4.9 feet, MAN). BEN BARRETT MAKES IT!
Score: 62-98

[09:46] Team_044 possession (Score: 62-98)
Kyrie Poole drives, picks up Lamelo Herro. Help arrives from Vince Quickley! Kyrie Poole attempts a Dunk. Contested by Vince Quickley (3.7 feet, MAN). KYRIE POOLE MAKES IT! Assist: Isaiah Murray
Score: 64-98

[09:29] Team_016 possession (Score: 64-98)
Lamelo Herro drives to the basket... Lamelo Herro loses control! Ball rolls out of bounds! TURNOVER! (dead ball)

[09:29] Substitution (Team_044): Isaiah Murray OUT → Tim Towns IN (stamina_rule2)

[09:29] Substitution (Team_044): Victor Westbrook OUT → Tim Siakam IN (stamina_rule2)

[09:29] Substitution (Team_044): Karl Fox OUT → Pau Quickley IN (stamina_rule2)

[09:29] Substitution (Team_044): Ayo McCollum OUT → Victor Anthony IN (stamina_rule2)

[09:29] Substitution (Team_016): Giannis Ginobili OUT → Immanuel Nowitzki IN (stamina_rule2)

[09:29] Substitution (Team_016): Vince Quickley OUT → Kevin Butler IN (stamina_rule2)

[09:29] Substitution (Team_016): Ben Barrett OUT → Giannis Doncic IN (stamina_rule2)

[09:29] Substitution (Team_016): Vince Duncan OUT → Trae Barnes IN (stamina_rule2)

[09:17] Team_044 possession (Score: 64-98)
Kyrie Poole drives and kicks out. Tim Siakam attempts a 3Pt. Contested by Kevin Butler (4.4 feet, MAN). Tim Siakam misses. Rebound secured by Trae Barnes.

[09:06] Team_016 possession (Score: 64-98)
Giannis Doncic attempts a Layup. BLOCKED BY PAU QUICKLEY! Ball is loose! Rebound secured by Tim Siakam.

[08:53] Team_044 possession (Score: 64-98)
Tim Towns attempts a Layup. Contested by Immanuel Nowitzki (4.8 feet, MAN). TIM TOWNS MAKES IT!
Score: 66-98

[08:38] Team_016 possession (Score: 66-98)
Trae Barnes drives to the basket... FOUL! Offensive foul on Trae Barnes! Pau Quickley drew the charge! [Team fouls: 1] (Trae Barnes: 1 personal fouls) TURNOVER! (dead ball)

[08:24] Team_044 possession (Score: 66-98)
Tim Towns drives, Giannis Doncic stays with him. Tim Towns attempts a Dunk. Contested by Giannis Doncic (3.9 feet, ZONE). Tim Towns misses. Offensive rebound by Tim Siakam! Tim Siakam kicks it out.

[08:07] Team_044 possession (Score: 66-98)
Tim Towns attempts a Layup. Contested by Immanuel Nowitzki (4.8 feet, MAN). TIM TOWNS MAKES IT! Assist: Pau Quickley
Score: 68-98

[07:51] Team_016 possession (Score: 68-98)
Trae Barnes attempts a Midrange. Contested by Tim Towns (5.1 feet, ZONE). TRAE BARNES MAKES IT!
Score: 68-100

[07:37] Team_044 possession (Score: 68-100)
FOUL! Reach-in foul on Giannis Doncic during the drive. [Team fouls: 2] No free throws, side out. (Giannis Doncic: 1 personal fouls)

[07:19] Team_044 possession (Score: 68-100)
FOUL! Shooting foul on Kevin Butler. Tim Towns to the line for 2 free throws. [Team fouls: 3] (Kevin Butler: 1 personal fouls)   FT 1/2: GOOD   FT 2/2: GOOD Tim Towns makes 2/2 from the line.
Score: 70-100

[07:05] Team_016 possession (Score: 70-100)
FOUL! Shooting foul on Tim Siakam. Trae Barnes to the line for 2 free throws. [Team fouls: 1] (Tim Siakam: 1 personal fouls)   FT 1/2: GOOD   FT 2/2: MISS Trae Barnes makes 1/2 from the line. Rebound secured by Tim Siakam.
Score: 70-101

[06:54] Team_044 possession (Score: 70-101)
Tim Towns drives to the basket... Tim Towns commits a violation (traveling/carry)! TURNOVER! (dead ball)

[06:40] Team_016 possession (Score: 70-101)
FOUL! Shooting foul on Pau Quickley. Giannis Doncic to the line for 2 free throws. [Team fouls: 2] (Pau Quickley: 1 personal fouls)   FT 1/2: GOOD   FT 2/2: GOOD Giannis Doncic makes 2/2 from the line.
Score: 70-103

[06:29] Team_044 possession (Score: 70-103)
Tim Siakam attempts a 3Pt. Contested by Kevin Butler (4.5 feet, MAN). Tim Siakam misses. Rebound secured by Lamelo Herro.

[06:12] Team_016 possession (Score: 70-103)
FOUL! Shooting foul on Pau Quickley. Trae Barnes to the line for 2 free throws. [Team fouls: 3] (Pau Quickley: 2 personal fouls)   FT 1/2: GOOD   FT 2/2: GOOD Trae Barnes makes 2/2 from the line.
Score: 70-105

[05:59] Team_044 possession (Score: 70-105)
Pau Quickley drives, Giannis Doncic stays with him. Pau Quickley attempts a Dunk. Contested by Giannis Doncic (4.0 feet, MAN). Pau Quickley misses. Offensive rebound by Victor Anthony! Victor Anthony kicks it out.

[05:46] Team_044 possession (Score: 70-105)
FOUL! Shooting foul on Giannis Doncic. Victor Anthony to the line for 2 free throws. [Team fouls: 4] (Giannis Doncic: 2 personal fouls)   FT 1/2: GOOD   FT 2/2: GOOD Victor Anthony makes 2/2 from the line.
Score: 72-105

[05:29] Team_016 possession (Score: 72-105)
Immanuel Nowitzki drives and kicks out. Trae Barnes attempts a Midrange. Contested by Tim Towns (5.3 feet, ZONE). Trae Barnes misses. Rebound secured by Victor Anthony.

[05:15] Team_044 possession (Score: 72-105)
Tim Siakam attempts a 3Pt. Contested by Kevin Butler (4.5 feet, MAN). TIM SIAKAM MAKES IT! Assist: Kyrie Poole
Score: 75-105

[05:02] Team_016 possession (Score: 75-105)
Kevin Butler attempts a Midrange. Contested by Tim Siakam (3.4 feet, MAN). KEVIN BUTLER MAKES IT! Assist: Lamelo Herro
Score: 75-107

[04:49] Team_044 possession (Score: 75-107)
Victor Anthony drives and kicks out. Victor Anthony attempts a Midrange. Contested by Giannis Doncic (3.7 feet, ZONE). VICTOR ANTHONY MAKES IT!
Score: 77-107

[04:38] Team_016 possession (Score: 77-107)
Giannis Doncic drives, picks up Pau Quickley. Help arrives from Tim Towns! Giannis Doncic attempts a Layup. Contested by Tim Towns (3.3 feet, MAN). Giannis Doncic misses. Rebound secured by Tim Siakam.

[04:28] Team_044 possession (Score: 77-107)
Tim Towns attempts a Layup. BLOCKED BY IMMANUEL NOWITZKI! Ball is loose! Offensive rebound by Tim Siakam! Tim Siakam kicks it out.

[04:17] Team_044 possession (Score: 77-107)
Pau Quickley attempts a Midrange. Contested by Giannis Doncic (4.0 feet, MAN). Pau Quickley misses. FOUL! Loose ball foul on Giannis Doncic during the rebound battle. [IN THE BONUS! 5 team fouls] Tim Siakam to the line for 2 free throws. (Giannis Doncic: 3 personal fouls)   FT 1/2: MISS   FT 2/2: MISS Tim Siakam makes 0/2 from the line. Rebound secured by Lamelo Herro.

[04:05] Team_016 possession (Score: 77-107)
Giannis Doncic attempts a Layup. Contested by Pau Quickley (3.3 feet, MAN). GIANNIS DONCIC MAKES IT! Assist: Lamelo Herro
Score: 77-109

[03:54] Team_044 possession (Score: 77-109)
Kyrie Poole attempts a 3Pt. Contested by Lamelo Herro (3.9 feet, ZONE). Kyrie Poole misses. Rebound secured by Giannis Doncic.

[03:38] Team_016 possession (Score: 77-109)
Giannis Doncic attempts a Midrange. Contested by Pau Quickley (3.3 feet, MAN). Giannis Doncic misses. Rebound secured by Tim Siakam.

[03:28] Team_044 possession (Score: 77-109)
Kyrie Poole drives, picks up Giannis Doncic. Help arrives from Lamelo Herro! Kyrie Poole attempts a Layup. Contested by Lamelo Herro (3.6 feet, ZONE). KYRIE POOLE MAKES IT!
Score: 79-109

[03:13] Team_016 possession (Score: 79-109)
Lamelo Herro attempts a Layup. Contested by Pau Quickley (3.3 feet, ZONE). Lamelo Herro misses. Rebound secured by Tim Siakam.

[02:59] Team_044 possession (Score: 79-109)
Tim Towns makes the Midrange and draws the foul on Immanuel Nowitzki! And-1! Tim Towns to the line for 1. [BONUS: 6 team fouls] (Immanuel Nowitzki: 1 personal fouls)   FT 1/1: GOOD Tim Towns makes 1/1 from the line.
Score: 82-109

[02:43] Team_016 possession (Score: 82-109)
FOUL! Reach-in foul on Kyrie Poole during the drive. [Team fouls: 4] No free throws, side out. (Kyrie Poole: 1 personal fouls)

[02:26] Team_016 possession (Score: 82-109)
Lamelo Herro attempts a Layup. Contested by Kyrie Poole (4.8 feet, MAN). LAMELO HERRO MAKES IT!
Score: 82-111

[02:08] Team_044 possession (Score: 82-111)
Victor Anthony drives to the basket... Victor Anthony throws a bad pass! Stolen by Giannis Doncic! TURNOVER! (live ball)

[01:52] Team_016 possession (Score: 82-111)
Giannis Doncic drives, picks up Pau Quickley. Help arrives from Tim Towns! Giannis Doncic attempts a Dunk. Contested by Tim Towns (3.4 feet, ZONE). Giannis Doncic misses. Rebound secured by Pau Quickley.

[01:35] Team_044 possession (Score: 82-111)
FOUL! Offensive foul on Victor Anthony! Trae Barnes drew the charge! [Team fouls: 5] (Victor Anthony: 1 personal fouls) TURNOVER! (dead ball)

[01:20] Team_016 possession (Score: 82-111)
Immanuel Nowitzki drives and kicks out. Immanuel Nowitzki makes the 3Pt and draws the foul on Tim Towns! And-1! Immanuel Nowitzki to the line for 1. [BONUS: 6 team fouls] (Tim Towns: 1 personal fouls)   FT 1/1: MISS Immanuel Nowitzki makes 0/1 from the line. Rebound secured by Pau Quickley.
Score: 82-114

[01:04] Team_044 possession (Score: 82-114)
Pau Quickley drives to the basket... Pau Quickley throws a bad pass! Stolen by Giannis Doncic! TURNOVER! (live ball)

[00:46] Team_016 possession (Score: 82-114)
Kevin Butler throws a bad pass out of bounds! TURNOVER! (dead ball)

[00:34] Team_044 possession (Score: 82-114)
Tim Siakam drives, picks up Giannis Doncic. Help arrives from Lamelo Herro! Tim Siakam attempts a Dunk. Contested by Lamelo Herro (4.0 feet, ZONE). TIM SIAKAM MAKES IT! Assist: Kyrie Poole
Score: 84-114

[00:21] Team_016 possession (Score: 84-114)
Immanuel Nowitzki attempts a Layup. Contested by Pau Quickley (3.6 feet, ZONE). Immanuel Nowitzki misses. Rebound secured by Tim Siakam.

[00:03] Team_044 possession (Score: 84-114)
Tim Towns attempts a Layup. Contested by Giannis Doncic (4.1 feet, ZONE). TIM TOWNS MAKES IT! Assist: Kyrie Poole
Score: 86-114

================================================================================
                              4TH QUARTER COMPLETE                              
================================================================================

4TH QUARTER SCORE: Team_044 26, Team_016 24

BOX SCORE:
================================================================================

Team_044
--------------------------------------------------------------------------------
Player                MIN  PTS  REB  AST  TO      FG   FG%      3P   3P%
--------------------------------------------------------------------------------
Tim Towns              14   11    0    0   0   5/5   100.0     0/0   0.0
Tim Siakam             14    5    8    0   0   2/3    66.7     0/0   0.0
Kyrie Poole            17    4    0    3   0   2/5    40.0     0/0   0.0
Victor Anthony         14    4    2    0   0   2/2   100.0     0/0   0.0
Karl Fox               34    2    0    0   0   1/2    50.0     0/0   0.0
Isaiah Murray          34    0    0    1   0   0/1     0.0     0/0   0.0
Victor Westbrook       34    0    2    1   0   0/0     0.0     0/0   0.0
Pau Quickley           14    0    2    1   0   0/1     0.0     0/0   0.0

TEAM: FG: 12/19 (63.2%), 3PT: 1/4 (25.0%), REB: 15 (5 off, 10 def), AST: 6, TO: 4
TEAM FOULS: 6 [Team_016 in BONUS]


Team_016
--------------------------------------------------------------------------------
Player                MIN  PTS  REB  AST  TO      FG   FG%      3P   3P%
--------------------------------------------------------------------------------
Ben Barrett            34    6    2    0   0   2/2   100.0     0/0   0.0
Trae Barnes            14    4    1    0   0   2/3    66.7     0/0   0.0
Giannis Doncic         14    4    1    0   0   2/6    33.3     0/0   0.0
Vince Quickley         34    2    0    1   0   1/1   100.0     0/0   0.0
Lamelo Herro           17    2    2    3   0   1/2    50.0     0/0   0.0
Kevin Butler           14    2    0    0   0   1/1   100.0     0/0   0.0
Vince Duncan           34    0    1    0   0   0/0     0.0     0/0   0.0
Giannis Ginobili       34    0    0    0   0   0/1     0.0     0/0   0.0
Immanuel Nowitzki      14    0    0    0   0   0/3     0.0     0/0   0.0

TEAM: FG: 9/19 (47.4%), 3PT: 2/2 (100.0%), REB: 6 (0 off, 6 def), AST: 4, TO: 3
TEAM FOULS: 6 [Team_044 in BONUS]

================================================================================

================================================================================
                               FULL GAME COMPLETE                               
================================================================================

FINAL SCORE: Team_044 86, Team_016 114

SCORING BY QUARTER:
--------------------------------------------------------------------------------
Team                     Q1     Q2     Q3     Q4    FINAL
--------------------------------------------------------------------------------
Team_044                 13     25     22     26       86
Team_016                 34     36     20     24      114
--------------------------------------------------------------------------------

FULL GAME BOX SCORE:
================================================================================

Team_044
--------------------------------------------------------------------------------
Player                MIN  PTS  REB  AST  TO      FG   FG%      3P   3P%      FT STL BLK
--------------------------------------------------------------------------------
Isaiah Murray          34   10    0    2   3   5/10   50.0   0/4     0.0   2/2     1   0
Victor Westbrook       34    2   15    3   2   1/7    14.3   0/3     0.0   0/0     0   1
Karl Fox               34   11    5    2   0   7/17   41.2   0/4     0.0   3/4     0   1
Ayo McCollum           34   14   11    2   1   7/10   70.0   0/0     0.0   0/2     0   1
Zach McGrady           32   10    0    1   1   3/9    33.3   0/1     0.0   1/1     0   0
Kyrie Poole            17    9    0    3   1   4/7    57.1   1/2    50.0   0/0     0   0
Tim Towns              14   14    0    1   1   6/6   100.0   1/1   100.0   3/3     0   0
Tim Siakam             14    7    9    0   2   3/5    60.0   1/3    33.3   1/4     1   0
Pau Quickley           14    0    2    1   0   0/2     0.0   0/0     0.0   0/0     0   1
Victor Anthony         14    8    5    1   2   4/4   100.0   0/0     0.0   2/2     0   0

TEAM: FG: 40/77 (51.9%), 3PT: 3/18 (16.7%), REB: 49 (17 off, 32 def), AST: 16, TO: 13


Team_016
--------------------------------------------------------------------------------
Player                MIN  PTS  REB  AST  TO      FG   FG%      3P   3P%      FT STL BLK
--------------------------------------------------------------------------------
Giannis Ginobili       34    8    0    2   2   3/7    42.9   1/2    50.0   1/1     0   0
Vince Quickley         34   12    8    2   0   9/12   75.0   2/3    66.7   4/5     1   1
Ben Barrett            34   33   19    1   2  12/13   92.3   5/5   100.0   3/4     0   0
Vince Duncan           34   24   12    4   0   9/13   69.2   0/0     0.0  12/14    2   0
Collin Barnes          32    8    0    1   0   2/10   20.0   1/4    25.0   0/2     1   0
Lamelo Herro           17    5    2    3   0   2/4    50.0   1/1   100.0   0/0     0   0
Immanuel Nowitzki      14    0    0    1   2   0/5     0.0   0/1     0.0   0/1     0   1
Kevin Butler           14    2    0    0   2   1/2    50.0   0/0     0.0   0/0     0   0
Giannis Doncic         14   12    1    0   0   5/9    55.6   0/0     0.0   4/4     2   0
Trae Barnes            14    4    4    0   0   2/3    66.7   0/0     0.0   3/4     1   0

TEAM: FG: 46/79 (58.2%), 3PT: 10/16 (62.5%), REB: 43 (8 off, 35 def), AST: 14, TO: 8

================================================================================
