================================================================================
                        FULL GAME - Team_034 vs Team_092                        
================================================================================

================================================================================
                       1ST QUARTER - Team_034 vs Team_092                       
================================================================================

[12:00] Team_034 possession (Score: 0-0)
Cole Antetokounmpo attempts a 3Pt. Contested by Paul James (5.2 feet, MAN). Cole Antetokounmpo misses. FOUL! Loose ball foul on John Giddey during the rebound battle. [Team fouls: 1] No free throws, side out. (John Giddey: 1 personal fouls)

[11:46] Team_034 possession (Score: 0-0)
Devin Poole attempts a 3Pt. Contested by John Giddey (3.9 feet, ZONE). Devin Poole misses. Rebound secured by John Giddey.

[11:29] Team_092 possession (Score: 0-0)
Austin Bridges drives, Terry Doncic stays with him. Austin Bridges attempts a Layup. Contested by Terry Doncic (3.8 feet, ZONE). AUSTIN BRIDGES MAKES IT! Assist: Paul James
Score: 0-2

[11:12] Team_034 possession (Score: 0-2)
FOUL! Shooting foul on Immanuel Ingram. Anthony Bane to the line for 2 free throws. [Team fouls: 2] (Immanuel Ingram: 1 personal fouls)   FT 1/2: GOOD   FT 2/2: GOOD Anthony Bane makes 2/2 from the line.
Score: 2-2

[10:58] Team_092 possession (Score: 2-2)
Austin Bridges attempts a Midrange. Contested by Devin Poole (3.7 feet, MAN). Austin Bridges misses. Offensive rebound by Paul James! Paul James kicks it out.

[10:45] Team_092 possession (Score: 2-2)
Paul James attempts a 3Pt. Contested by Cole Antetokounmpo (5.2 feet, MAN). Paul James misses. FOUL! Loose ball foul on Cole Antetokounmpo during the rebound battle. [Team fouls: 1] No free throws, side out. (Cole Antetokounmpo: 1 personal fouls)

[10:33] Team_092 possession (Score: 2-2)
Paul James attempts a Layup. Contested by Cole Antetokounmpo (5.2 feet, MAN). Paul James misses. Rebound secured by Terry Doncic.

[10:22] Team_034 possession (Score: 2-2)
Ben Hyland drives, John Giddey stays with him. Ben Hyland attempts a Layup. Contested by John Giddey (4.1 feet, ZONE). BEN HYLAND MAKES IT! Assist: Terry Doncic
Score: 4-2

[10:10] Team_092 possession (Score: 4-2)
FOUL! Reach-in foul on Anthony Bane during the drive. [Team fouls: 2] No free throws, side out. (Anthony Bane: 1 personal fouls)

[09:59] Team_092 possession (Score: 4-2)
Karl Gobert attempts a 3Pt. Contested by Ben Hyland (3.5 feet, MAN). Karl Gobert misses. Rebound secured by Anthony Bane.

[09:42] Team_034 possession (Score: 4-2)
Anthony Bane attempts a 3Pt. Contested by John Giddey (4.1 feet, ZONE). ANTHONY BANE MAKES IT! Assist: Cole Antetokounmpo
Score: 7-2

[09:30] Team_092 possession (Score: 7-2)
Karl Gobert attempts a 3Pt. Contested by Devin Poole (3.8 feet, ZONE). Karl Gobert misses. Rebound secured by Anthony Bane.

[09:12] Team_034 possession (Score: 7-2)
Anthony Bane attempts a 3Pt. Contested by Immanuel Ingram (4.1 feet, MAN). Anthony Bane misses. Rebound secured by Paul James.

[09:00] Team_092 possession (Score: 7-2)
Immanuel Ingram drives, Terry Doncic stays with him. Immanuel Ingram attempts a Layup. Contested by Terry Doncic (3.9 feet, ZONE). Immanuel Ingram misses. Offensive rebound by Paul James! Paul James kicks it out.

[08:49] Team_092 possession (Score: 7-2)
Immanuel Ingram drives, Anthony Bane stays with him. Immanuel Ingram attempts a Layup. Contested by Anthony Bane (5.0 feet, MAN). IMMANUEL INGRAM MAKES IT!
Score: 7-4

[08:36] Team_034 possession (Score: 7-4)
Devin Poole attempts a 3Pt. Contested by Austin Bridges (4.3 feet, MAN). DEVIN POOLE MAKES IT! Assist: Terry Doncic
Score: 10-4

[08:20] Team_092 possession (Score: 10-4)
John Giddey drives and kicks out. Immanuel Ingram makes the Midrange and draws the foul on Anthony Bane! And-1! Immanuel Ingram to the line for 1. [Team fouls: 3] (Anthony Bane: 2 personal fouls)   FT 1/1: GOOD Immanuel Ingram makes 1/1 from the line.
Score: 10-7

[08:02] Team_034 possession (Score: 10-7)
Cole Antetokounmpo attempts a Midrange. Contested by Paul James (5.2 feet, MAN). COLE ANTETOKOUNMPO MAKES IT! Assist: Terry Doncic
Score: 12-7

[07:46] Team_092 possession (Score: 12-7)
John Giddey attempts a Midrange. Contested by Terry Doncic (4.3 feet, MAN). John Giddey misses. Rebound secured by Anthony Bane.

[07:32] Team_034 possession (Score: 12-7)
Devin Poole attempts a 3Pt. Contested by John Giddey (3.9 feet, ZONE). DEVIN POOLE MAKES IT! Assist: Anthony Bane
Score: 15-7

[07:17] Team_092 possession (Score: 15-7)
Austin Bridges attempts a Midrange. Contested by Cole Antetokounmpo (4.3 feet, ZONE). AUSTIN BRIDGES MAKES IT!
Score: 15-9

[07:02] Team_034 possession (Score: 15-9)
Ben Hyland attempts a 3Pt. Contested by Karl Gobert (5.1 feet, MAN). Ben Hyland misses. Rebound secured by John Giddey.

[06:44] Team_092 possession (Score: 15-9)
John Giddey drives, picks up Terry Doncic. Help arrives from Ben Hyland! John Giddey attempts a Dunk. Contested by Ben Hyland (4.3 feet, MAN). JOHN GIDDEY MAKES IT!
Score: 15-11

[06:28] Team_034 possession (Score: 15-11)
Devin Poole makes the Midrange and draws the foul on Austin Bridges! And-1! Devin Poole to the line for 1. [Team fouls: 3] (Austin Bridges: 1 personal fouls)   FT 1/1: GOOD Devin Poole makes 1/1 from the line.
Score: 18-11

[06:13] Team_092 possession (Score: 18-11)
Immanuel Ingram attempts a Midrange. Contested by Ben Hyland (3.4 feet, ZONE). Immanuel Ingram misses. Rebound secured by Anthony Bane.

[05:56] Team_034 possession (Score: 18-11)
Ben Hyland attempts a Midrange. Contested by Paul James (4.8 feet, ZONE). Ben Hyland misses. Offensive rebound by Terry Doncic! Terry Doncic's putback is no good. Rebound secured by John Giddey.

[05:42] Team_092 possession (Score: 18-11)
Paul James attempts a Midrange. Contested by Cole Antetokounmpo (5.2 feet, MAN). PAUL JAMES MAKES IT!
Score: 18-13

[05:32] Team_034 possession (Score: 18-13)
Anthony Bane drives and kicks out. Ben Hyland attempts a 3Pt. Contested by John Giddey (4.0 feet, ZONE). Ben Hyland misses. Rebound secured by Paul James.

[05:18] Team_092 possession (Score: 18-13)
Paul James attempts a Midrange. Contested by Devin Poole (4.6 feet, ZONE). Paul James misses. Rebound secured by Cole Antetokounmpo.

[05:05] Team_034 possession (Score: 18-13)
Ben Hyland attempts a 3Pt. Contested by Karl Gobert (5.1 feet, MAN). Ben Hyland misses. Offensive rebound by Anthony Bane! Anthony Bane kicks it out.

[04:51] Team_034 possession (Score: 18-13)
Devin Poole attempts a Layup. Contested by John Giddey (4.0 feet, ZONE). Devin Poole misses. Rebound secured by Immanuel Ingram.

[04:38] Team_092 possession (Score: 18-13)
Austin Bridges attempts a Layup. Contested by Devin Poole (3.8 feet, MAN). AUSTIN BRIDGES MAKES IT! Assist: John Giddey
Score: 18-15

[04:23] Team_034 possession (Score: 18-15)
Terry Doncic makes the Layup and draws the foul on John Giddey! And-1! Terry Doncic to the line for 1. [Team fouls: 4] (John Giddey: 2 personal fouls)   FT 1/1: GOOD Terry Doncic makes 1/1 from the line.
Score: 21-15

[04:10] Team_092 possession (Score: 21-15)
Austin Bridges attempts a 3Pt. Contested by Devin Poole (3.8 feet, ZONE). AUSTIN BRIDGES MAKES IT! Assist: Karl Gobert
Score: 21-18

[03:53] Team_034 possession (Score: 21-18)
Ben Hyland makes the Layup and draws the foul on Karl Gobert! And-1! Ben Hyland to the line for 1. [BONUS: 5 team fouls] (Karl Gobert: 1 personal fouls)   FT 1/1: GOOD Ben Hyland makes 1/1 from the line.
Score: 24-18

[03:42] Team_092 possession (Score: 24-18)
FOUL! Shooting foul on Terry Doncic. John Giddey to the line for 2 free throws. [Team fouls: 4] (Terry Doncic: 1 personal fouls)   FT 1/2: GOOD   FT 2/2: GOOD John Giddey makes 2/2 from the line.
Score: 24-20

[03:29] Team_034 possession (Score: 24-20)
Anthony Bane attempts a 3Pt. Contested by John Giddey (4.3 feet, ZONE). Anthony Bane misses. Offensive rebound by Terry Doncic! Terry Doncic puts it back in!
Score: 26-20

[03:10] Team_092 possession (Score: 26-20)
Paul James attempts a 3Pt. Contested by Devin Poole (4.8 feet, ZONE). Paul James misses. Offensive rebound by John Giddey! John Giddey kicks it out.

[03:00] Team_092 possession (Score: 26-20)
FOUL! Shooting foul on Terry Doncic. Immanuel Ingram to the line for 2 free throws. [BONUS: 5 team fouls] (Terry Doncic: 2 personal fouls)   FT 1/2: GOOD   FT 2/2: MISS Immanuel Ingram makes 1/2 from the line. Offensive rebound by Paul James! Paul James kicks it out.
Score: 26-21

[02:41] Team_092 possession (Score: 26-21)
John Giddey drives and kicks out. Austin Bridges attempts a 3Pt. Contested by Devin Poole (4.2 feet, MAN). Austin Bridges misses. Rebound secured by Cole Antetokounmpo.

[02:30] Team_034 possession (Score: 26-21)
FOUL! Reach-in foul on Paul James during the drive. [IN THE BONUS! 6 team fouls] Cole Antetokounmpo to the line for 2 free throws. (Paul James: 1 personal fouls)   FT 1/2: GOOD   FT 2/2: GOOD Cole Antetokounmpo makes 2/2 from the line.
Score: 28-21

[02:14] Team_092 possession (Score: 28-21)
Austin Bridges drives to the basket... Austin Bridges loses control! Ball rolls out of bounds! TURNOVER! (dead ball)

[02:14] Substitution (Team_034): Devin Poole OUT → Manu Jokic IN (stamina_rule2)

[02:14] Substitution (Team_034): Ben Hyland OUT → Damian Turner IN (stamina_rule2)

[02:14] Substitution (Team_034): Cole Antetokounmpo OUT → Vince Paul IN (stamina_rule2)

[02:14] Substitution (Team_034): Terry Doncic OUT → Nikola Wagner IN (stamina_rule2)

[02:14] Substitution (Team_034): Anthony Bane OUT → Carmelo Anunoby IN (stamina_rule2)

[02:14] Substitution (Team_092): Austin Bridges OUT → Bones Giddey IN (stamina_rule2)

[02:14] Substitution (Team_092): Karl Gobert OUT → Shaquille Russell IN (stamina_rule2)

[02:14] Substitution (Team_092): Paul James OUT → Vince Harris IN (stamina_rule2)

[02:14] Substitution (Team_092): John Giddey OUT → Shaquille Paul IN (stamina_rule2)

[02:14] Substitution (Team_092): Immanuel Ingram OUT → Pau Reaves IN (stamina_rule2)

[01:58] Team_034 possession (Score: 28-21)
Damian Turner attempts a 3Pt. Contested by Shaquille Paul (6.0 feet, ZONE). DAMIAN TURNER MAKES IT! Assist: Manu Jokic
Score: 31-21

[01:47] Team_092 possession (Score: 31-21)
Bones Giddey drives, picks up Manu Jokic. Help arrives from Vince Paul! Bones Giddey attempts a Layup. Contested by Vince Paul (4.4 feet, MAN). Bones Giddey misses. Rebound secured by Nikola Wagner.

[01:32] Team_034 possession (Score: 31-21)
Damian Turner attempts a 3Pt. Contested by Vince Harris (4.5 feet, ZONE). DAMIAN TURNER MAKES IT! Assist: Carmelo Anunoby
Score: 34-21

[01:20] Team_092 possession (Score: 34-21)
FOUL! Shooting foul on Vince Paul. Vince Harris to the line for 2 free throws. [BONUS: 6 team fouls] (Vince Paul: 1 personal fouls)   FT 1/2: GOOD   FT 2/2: GOOD Vince Harris makes 2/2 from the line.
Score: 34-23

[01:04] Team_034 possession (Score: 34-23)
Damian Turner attempts a Midrange. Contested by Shaquille Russell (4.6 feet, MAN). DAMIAN TURNER MAKES IT! Assist: Manu Jokic
Score: 36-23

[00:50] Team_092 possession (Score: 36-23)
FOUL! Offensive foul on Vince Harris! Vince Paul drew the charge! [Team fouls: 7] (Vince Harris: 1 personal fouls) TURNOVER! (dead ball)

[00:38] Team_034 possession (Score: 36-23)
Manu Jokic loses control! Ball rolls out of bounds! TURNOVER! (dead ball)

[00:25] Team_092 possession (Score: 36-23)
Shaquille Paul attempts a Midrange. Contested by Vince Paul (4.8 feet, ZONE). Shaquille Paul misses. Rebound secured by Carmelo Anunoby.

[00:11] Team_034 possession (Score: 36-23)
Carmelo Anunoby drives and kicks out. Nikola Wagner attempts a 3Pt. Contested by Shaquille Paul (5.6 feet, MAN). Nikola Wagner misses. Offensive rebound by Vince Paul! Vince Paul puts it back in!
Score: 38-23

[00:01] Team_092 possession (Score: 38-23)
Shaquille Russell attempts a Midrange. Contested by Damian Turner (5.8 feet, MAN). SHAQUILLE RUSSELL MAKES IT! Assist: Bones Giddey
Score: 38-25

================================================================================
                              1ST QUARTER COMPLETE                              
================================================================================

1ST QUARTER SCORE: Team_034 38, Team_092 25

BOX SCORE:
================================================================================

Team_034
--------------------------------------------------------------------------------
Player                MIN  PTS  REB  AST  TO      FG   FG%      3P   3P%
--------------------------------------------------------------------------------
Devin Poole            10    9    0    0   0   3/5    60.0     0/0   0.0
Damian Turner           2    8    0    0   0   3/3   100.0     0/0   0.0
Terry Doncic           10    5    3    3   0   2/2   100.0     0/0   0.0
Anthony Bane           10    5    5    1   0   2/4    50.0     0/0   0.0
Ben Hyland             10    5    0    0   0   2/4    50.0     0/0   0.0
Cole Antetokounmpo     10    4    2    1   0   2/2   100.0     0/0   0.0
Vince Paul              2    2    1    0   0   1/1   100.0     0/0   0.0
Manu Jokic              2    0    0    2   0   0/0     0.0     0/0   0.0
Nikola Wagner           2    0    1    0   0   0/0     0.0     0/0   0.0
Carmelo Anunoby         2    0    1    1   0   0/0     0.0     0/0   0.0

TEAM: FG: 15/21 (71.4%), 3PT: 6/9 (66.7%), REB: 14 (5 off, 9 def), AST: 8, TO: 1
TEAM FOULS: 6 [Team_092 in BONUS]


Team_092
--------------------------------------------------------------------------------
Player                MIN  PTS  REB  AST  TO      FG   FG%      3P   3P%
--------------------------------------------------------------------------------
Austin Bridges         10    9    0    0   0   4/4   100.0     0/0   0.0
Immanuel Ingram        10    5    1    0   0   2/3    66.7     0/0   0.0
John Giddey            10    4    4    1   0   2/4    50.0     0/0   0.0
Paul James             10    2    6    1   0   1/3    33.3     0/0   0.0
Vince Harris            2    2    0    0   0   1/1   100.0     0/0   0.0
Shaquille Russell       2    2    0    0   0   1/1   100.0     0/0   0.0
Karl Gobert            10    0    0    1   0   0/2     0.0     0/0   0.0
Bones Giddey            2    0    0    1   0   0/1     0.0     0/0   0.0
Shaquille Paul          2    0    0    0   0   0/1     0.0     0/0   0.0

TEAM: FG: 11/20 (55.0%), 3PT: 1/3 (33.3%), REB: 10 (5 off, 5 def), AST: 4, TO: 2
TEAM FOULS: 7 [Team_034 in BONUS]

================================================================================

================================================================================
                       2ND QUARTER - Team_034 vs Team_092                       
================================================================================

[12:00] Team_034 possession (Score: 38-25)
Ben Hyland makes the Layup and draws the foul on Karl Gobert! And-1! Ben Hyland to the line for 1. [Team fouls: 1] (Karl Gobert: 1 personal fouls)   FT 1/1: GOOD Ben Hyland makes 1/1 from the line.
Score: 41-25

[11:45] Team_092 possession (Score: 41-25)
Austin Bridges drives, Terry Doncic stays with him. Austin Bridges attempts a Dunk. Contested by Terry Doncic (3.9 feet, ZONE). AUSTIN BRIDGES MAKES IT! Assist: Paul James
Score: 41-27

[11:31] Team_034 possession (Score: 41-27)
Cole Antetokounmpo attempts a Midrange. Contested by Paul James (5.2 feet, MAN). Cole Antetokounmpo misses. Rebound secured by John Giddey.

[11:18] Team_092 possession (Score: 41-27)
Austin Bridges attempts a 3Pt. Contested by Devin Poole (3.8 feet, MAN). Austin Bridges misses. Offensive rebound by John Giddey! John Giddey kicks it out.

[11:00] Team_092 possession (Score: 41-27)
Paul James attempts a Midrange. Contested by Anthony Bane (5.9 feet, ZONE). PAUL JAMES MAKES IT!
Score: 41-29

[10:45] Team_034 possession (Score: 41-29)
Anthony Bane drives, Immanuel Ingram stays with him. Anthony Bane attempts a Layup. Contested by Immanuel Ingram (4.2 feet, MAN). ANTHONY BANE MAKES IT! Assist: Devin Poole
Score: 43-29

[10:30] Team_092 possession (Score: 43-29)
FOUL! Shooting foul on Devin Poole. Austin Bridges to the line for 2 free throws. [Team fouls: 1] (Devin Poole: 1 personal fouls)   FT 1/2: GOOD   FT 2/2: GOOD Austin Bridges makes 2/2 from the line.
Score: 43-31

[10:12] Team_034 possession (Score: 43-31)
Anthony Bane attempts a Midrange. Contested by Immanuel Ingram (4.2 feet, MAN). Anthony Bane misses. Rebound secured by John Giddey.

[10:00] Team_092 possession (Score: 43-31)
Karl Gobert attempts a Midrange. Contested by Cole Antetokounmpo (4.5 feet, ZONE). Karl Gobert misses. Rebound secured by Cole Antetokounmpo.

[09:49] Team_034 possession (Score: 43-31)
Ben Hyland drives, picks up John Giddey. Help arrives from Austin Bridges! Ben Hyland attempts a Layup. Contested by Austin Bridges (4.4 feet, ZONE). Ben Hyland misses. FOUL! Loose ball foul on Immanuel Ingram during the rebound battle. [Team fouls: 2] No free throws, side out. (Immanuel Ingram: 1 personal fouls)

[09:35] Team_034 possession (Score: 43-31)
Anthony Bane drives, John Giddey stays with him. Anthony Bane attempts a Layup. Contested by John Giddey (4.4 feet, ZONE). ANTHONY BANE MAKES IT! Assist: Devin Poole
Score: 45-31

[09:16] Team_092 possession (Score: 45-31)
John Giddey attempts a Midrange. Contested by Ben Hyland (4.1 feet, ZONE). John Giddey misses. Offensive rebound by John Giddey! John Giddey kicks it out.

[09:01] Team_092 possession (Score: 45-31)
Paul James loses the ball! Stripped by Cole Antetokounmpo! TURNOVER! (live ball)

[08:52] Team_034 possession (Score: 45-31)
Anthony Bane makes the Dunk and draws the foul on Immanuel Ingram! And-1! Anthony Bane to the line for 1. [Team fouls: 3] (Immanuel Ingram: 2 personal fouls)   FT 1/1: GOOD Anthony Bane makes 1/1 from the line.
Score: 48-31

[08:38] Team_092 possession (Score: 48-31)
John Giddey drives and kicks out. Karl Gobert attempts a 3Pt. Contested by Ben Hyland (3.9 feet, MAN). Karl Gobert misses. Rebound secured by Terry Doncic.

[08:21] Team_034 possession (Score: 48-31)
Ben Hyland attempts a Layup. BLOCKED BY JOHN GIDDEY! Ball is loose! Rebound secured by Paul James.

[08:06] Team_092 possession (Score: 48-31)
FOUL! Shooting foul on Ben Hyland. Paul James to the line for 2 free throws. [Team fouls: 2] (Ben Hyland: 1 personal fouls)   FT 1/2: MISS   FT 2/2: GOOD Paul James makes 1/2 from the line.
Score: 48-32

[07:51] Team_034 possession (Score: 48-32)
Devin Poole attempts a 3Pt. Contested by Austin Bridges (4.8 feet, MAN). Devin Poole misses. Rebound secured by Immanuel Ingram.

[07:35] Team_092 possession (Score: 48-32)
Paul James attempts a 3Pt. Contested by Devin Poole (5.1 feet, ZONE). PAUL JAMES MAKES IT! Assist: Immanuel Ingram
Score: 48-35

[07:20] Team_034 possession (Score: 48-35)
FOUL! Holding foul on Immanuel Ingram. [Team fouls: 4] No free throws, side out. (Immanuel Ingram: 3 personal fouls)

[07:02] Team_034 possession (Score: 48-35)
Cole Antetokounmpo drives, Paul James stays with him. Cole Antetokounmpo attempts a Layup. Contested by Paul James (5.6 feet, MAN). COLE ANTETOKOUNMPO MAKES IT!
Score: 50-35

[06:48] Team_092 possession (Score: 50-35)
Austin Bridges attempts a 3Pt. Contested by Devin Poole (4.4 feet, MAN). AUSTIN BRIDGES MAKES IT!
Score: 50-38

[06:34] Team_034 possession (Score: 50-38)
Anthony Bane attempts a 3Pt. Contested by Austin Bridges (5.2 feet, ZONE). ANTHONY BANE MAKES IT! Assist: Terry Doncic
Score: 53-38

[06:17] Team_092 possession (Score: 53-38)
Austin Bridges attempts a Midrange. Contested by Ben Hyland (3.9 feet, ZONE). AUSTIN BRIDGES MAKES IT!
Score: 53-40

[06:06] Team_034 possession (Score: 53-40)
Devin Poole drives, Austin Bridges stays with him. Devin Poole attempts a Dunk. Contested by Austin Bridges (5.1 feet, MAN). DEVIN POOLE MAKES IT!
Score: 55-40

[05:53] Team_092 possession (Score: 55-40)
FOUL! Holding foul on Cole Antetokounmpo. [Team fouls: 3] No free throws, side out. (Cole Antetokounmpo: 1 personal fouls)

[05:39] Team_092 possession (Score: 55-40)
Karl Gobert attempts a Layup. Contested by Ben Hyland (4.1 feet, MAN). KARL GOBERT MAKES IT!
Score: 55-42

[05:28] Team_034 possession (Score: 55-42)
Terry Doncic attempts a Midrange. Contested by Paul James (5.4 feet, ZONE). Terry Doncic misses. Offensive rebound by Terry Doncic! Terry Doncic kicks it out.

[05:14] Team_034 possession (Score: 55-42)
Ben Hyland drives, picks up John Giddey. Help arrives from Austin Bridges! Ben Hyland attempts a Layup. Contested by Austin Bridges (4.9 feet, ZONE). BEN HYLAND MAKES IT! Assist: Devin Poole
Score: 57-42

[05:02] Team_092 possession (Score: 57-42)
FOUL! Shooting foul on Ben Hyland. Karl Gobert to the line for 2 free throws. [Team fouls: 4] (Ben Hyland: 2 personal fouls)   FT 1/2: GOOD   FT 2/2: GOOD Karl Gobert makes 2/2 from the line.
Score: 57-44

[04:44] Team_034 possession (Score: 57-44)
Ben Hyland attempts a Midrange. Contested by Karl Gobert (5.8 feet, ZONE). Ben Hyland misses. Offensive rebound by Terry Doncic! Terry Doncic kicks it out.

[04:31] Team_034 possession (Score: 57-44)
Anthony Bane makes the Layup and draws the foul on John Giddey! And-1! Anthony Bane to the line for 1. [BONUS: 5 team fouls] (John Giddey: 1 personal fouls)   FT 1/1: GOOD Anthony Bane makes 1/1 from the line.
Score: 60-44

[04:17] Team_092 possession (Score: 60-44)
John Giddey attempts a 3Pt. Contested by Terry Doncic (5.2 feet, MAN). John Giddey misses. Offensive rebound by John Giddey! John Giddey kicks it out.

[03:59] Team_092 possession (Score: 60-44)
Immanuel Ingram loses the ball! Stripped by Anthony Bane! TURNOVER! (live ball)

[03:41] Team_034 possession (Score: 60-44)
FOUL! Shooting foul on Austin Bridges. Cole Antetokounmpo to the line for 2 free throws. [BONUS: 6 team fouls] (Austin Bridges: 1 personal fouls)   FT 1/2: GOOD   FT 2/2: GOOD Cole Antetokounmpo makes 2/2 from the line.
Score: 62-44

[03:24] Team_092 possession (Score: 62-44)
Karl Gobert attempts a 3Pt. Contested by Devin Poole (5.0 feet, ZONE). KARL GOBERT MAKES IT! Assist: John Giddey
Score: 62-47

[03:09] Team_034 possession (Score: 62-47)
Anthony Bane drives, John Giddey stays with him. Anthony Bane attempts a Dunk. Contested by John Giddey (5.2 feet, ZONE). Anthony Bane misses. Rebound secured by John Giddey.

[02:51] Team_092 possession (Score: 62-47)
John Giddey attempts a 3Pt. Contested by Devin Poole (5.4 feet, ZONE). John Giddey misses. Offensive rebound by John Giddey! John Giddey kicks it out.

[02:37] Team_092 possession (Score: 62-47)
Karl Gobert makes the Dunk and draws the foul on Cole Antetokounmpo! And-1! Karl Gobert to the line for 1. [BONUS: 5 team fouls] (Cole Antetokounmpo: 2 personal fouls)   FT 1/1: MISS Karl Gobert makes 0/1 from the line. Rebound secured by Terry Doncic.
Score: 62-49

[02:18] Team_034 possession (Score: 62-49)
Terry Doncic attempts a Layup. Contested by John Giddey (5.3 feet, ZONE). TERRY DONCIC MAKES IT! Assist: Cole Antetokounmpo
Score: 64-49

[02:04] Team_092 possession (Score: 64-49)
Austin Bridges attempts a 3Pt. Contested by Devin Poole (5.1 feet, ZONE). Austin Bridges misses. Rebound secured by Terry Doncic.

[01:53] Team_034 possession (Score: 64-49)
Cole Antetokounmpo drives and kicks out. Anthony Bane attempts a 3Pt. Contested by John Giddey (5.5 feet, ZONE). Anthony Bane misses. Rebound secured by Immanuel Ingram.

[01:41] Team_092 possession (Score: 64-49)
Paul James attempts a 3Pt. Contested by Devin Poole (5.9 feet, ZONE). PAUL JAMES MAKES IT! Assist: John Giddey
Score: 64-52

[01:25] Team_034 possession (Score: 64-52)
Anthony Bane attempts a Midrange. Contested by Immanuel Ingram (5.2 feet, MAN). Anthony Bane misses. Rebound secured by Immanuel Ingram.

[01:11] Team_092 possession (Score: 64-52)
Immanuel Ingram drives, Anthony Bane stays with him. Immanuel Ingram attempts a Dunk. Wide open! Anthony Bane is 6.1 feet away. [MAN] Immanuel Ingram misses. Rebound secured by Anthony Bane.

[00:55] Team_034 possession (Score: 64-52)
Devin Poole attempts a Layup. Contested by Austin Bridges (5.8 feet, MAN). DEVIN POOLE MAKES IT! Assist: Terry Doncic
Score: 66-52

[00:42] Team_092 possession (Score: 66-52)
Austin Bridges drives and kicks out. Austin Bridges attempts a Midrange. Contested by Devin Poole (5.8 feet, MAN). AUSTIN BRIDGES MAKES IT! Assist: Karl Gobert
Score: 66-54

[00:28] Team_034 possession (Score: 66-54)
Anthony Bane drives and kicks out. Terry Doncic attempts a 3Pt. Wide open! Paul James is 6.1 feet away. [ZONE] TERRY DONCIC MAKES IT! Assist: Ben Hyland
Score: 69-54

[00:14] Team_092 possession (Score: 69-54)
Karl Gobert attempts a Midrange. Contested by Terry Doncic (5.4 feet, ZONE). KARL GOBERT MAKES IT!
Score: 69-56

================================================================================
                              2ND QUARTER COMPLETE                              
================================================================================

2ND QUARTER SCORE: Team_034 31, Team_092 31

BOX SCORE:
================================================================================

Team_034
--------------------------------------------------------------------------------
Player                MIN  PTS  REB  AST  TO      FG   FG%      3P   3P%
--------------------------------------------------------------------------------
Anthony Bane           22   13    2    0   0   5/8    62.5     0/0   0.0
Ben Hyland             22    5    0    1   0   2/3    66.7     0/0   0.0
Terry Doncic           22    5    5    2   0   2/2   100.0     0/0   0.0
Cole Antetokounmpo     22    4    1    1   0   2/4    50.0     0/0   0.0
Devin Poole            22    4    0    3   0   2/3    66.7     0/0   0.0

TEAM: FG: 13/20 (65.0%), 3PT: 1/2 (50.0%), REB: 8 (3 off, 5 def), AST: 7, TO: 0
TEAM FOULS: 5 [Team_092 in BONUS]


Team_092
--------------------------------------------------------------------------------
Player                MIN  PTS  REB  AST  TO      FG   FG%      3P   3P%
--------------------------------------------------------------------------------
Austin Bridges         22   11    0    0   0   5/6    83.3     0/0   0.0
Paul James             22    9    1    1   0   4/4   100.0     0/0   0.0
Karl Gobert            22    9    0    1   0   4/6    66.7     0/0   0.0
John Giddey            22    0    7    2   0   0/1     0.0     0/0   0.0
Immanuel Ingram        22    0    3    1   0   0/1     0.0     0/0   0.0

TEAM: FG: 13/18 (72.2%), 3PT: 4/5 (80.0%), REB: 11 (4 off, 7 def), AST: 5, TO: 2
TEAM FOULS: 6 [Team_034 in BONUS]

================================================================================

================================================================================
                       3RD QUARTER - Team_034 vs Team_092                       
================================================================================

[12:00] Team_034 possession (Score: 69-56)
Ben Hyland attempts a 3Pt. Contested by Karl Gobert (5.1 feet, MAN). Ben Hyland misses. Rebound secured by Immanuel Ingram.

[11:46] Team_092 possession (Score: 69-56)
John Giddey drives and kicks out. Immanuel Ingram attempts a Midrange. Contested by Anthony Bane (5.2 feet, MAN). IMMANUEL INGRAM MAKES IT!
Score: 69-58

[11:32] Team_034 possession (Score: 69-58)
Anthony Bane attempts a Midrange. Contested by Immanuel Ingram (4.1 feet, MAN). ANTHONY BANE MAKES IT!
Score: 71-58

[11:13] Team_092 possession (Score: 71-58)
FOUL! Reach-in foul on Anthony Bane during the drive. [Team fouls: 1] No free throws, side out. (Anthony Bane: 1 personal fouls)

[10:56] Team_092 possession (Score: 71-58)
John Giddey drives and kicks out. John Giddey attempts a 3Pt. Contested by Cole Antetokounmpo (4.5 feet, ZONE). JOHN GIDDEY MAKES IT! Assist: Paul James
Score: 71-61

[10:38] Team_034 possession (Score: 71-61)
Anthony Bane drives, John Giddey stays with him. Anthony Bane attempts a Dunk. Contested by John Giddey (4.1 feet, ZONE). Anthony Bane misses. Rebound secured by Paul James.

[10:24] Team_092 possession (Score: 71-61)
Austin Bridges attempts a Layup. Contested by Devin Poole (3.7 feet, MAN). AUSTIN BRIDGES MAKES IT!
Score: 71-63

[10:11] Team_034 possession (Score: 71-63)
Terry Doncic attempts a 3Pt. Contested by John Giddey (4.1 feet, ZONE). Terry Doncic misses. FOUL! Loose ball foul on John Giddey during the rebound battle. [Team fouls: 1] No free throws, side out. (John Giddey: 1 personal fouls)

[09:56] Team_034 possession (Score: 71-63)
Terry Doncic attempts a 3Pt. Contested by John Giddey (4.1 feet, ZONE). Terry Doncic misses. Rebound secured by John Giddey.

[09:44] Team_092 possession (Score: 71-63)
Karl Gobert drives, picks up Ben Hyland. Help arrives from Cole Antetokounmpo! Karl Gobert attempts a Layup. Contested by Cole Antetokounmpo (3.5 feet, MAN). Karl Gobert misses. Rebound secured by Anthony Bane.

[09:32] Team_034 possession (Score: 71-63)
Cole Antetokounmpo attempts a 3Pt. Contested by John Giddey (4.5 feet, ZONE). Cole Antetokounmpo misses. Rebound secured by Immanuel Ingram.

[09:18] Team_092 possession (Score: 71-63)
Immanuel Ingram attempts a Midrange. Contested by Terry Doncic (3.9 feet, ZONE). IMMANUEL INGRAM MAKES IT! Assist: John Giddey
Score: 71-65

[09:05] Team_034 possession (Score: 71-65)
FOUL! Reach-in foul on Karl Gobert during the drive. [Team fouls: 2] No free throws, side out. (Karl Gobert: 1 personal fouls)

[08:53] Team_034 possession (Score: 71-65)
FOUL! Shooting foul on Paul James. Cole Antetokounmpo to the line for 2 free throws. [Team fouls: 3] (Paul James: 1 personal fouls)   FT 1/2: GOOD   FT 2/2: GOOD Cole Antetokounmpo makes 2/2 from the line.
Score: 73-65

[08:38] Team_092 possession (Score: 73-65)
Immanuel Ingram attempts a Midrange. Contested by Ben Hyland (3.4 feet, ZONE). IMMANUEL INGRAM MAKES IT!
Score: 73-67

[08:22] Team_034 possession (Score: 73-67)
Devin Poole attempts a Midrange. Contested by Austin Bridges (4.3 feet, MAN). Devin Poole misses. Rebound secured by Paul James.

[08:04] Team_092 possession (Score: 73-67)
Austin Bridges attempts a 3Pt. Contested by Devin Poole (3.7 feet, MAN). Austin Bridges misses. Rebound secured by Cole Antetokounmpo.

[07:51] Team_034 possession (Score: 73-67)
Terry Doncic attempts a 3Pt. Contested by John Giddey (4.1 feet, ZONE). Terry Doncic misses. Rebound secured by John Giddey.

[07:39] Team_092 possession (Score: 73-67)
Karl Gobert drives and kicks out. Austin Bridges attempts a Midrange. Contested by Devin Poole (3.9 feet, MAN). Austin Bridges misses. Rebound secured by Terry Doncic.

[07:24] Team_034 possession (Score: 73-67)
FOUL! Shooting foul on John Giddey. Anthony Bane to the line for 2 free throws. [Team fouls: 4] (John Giddey: 2 personal fouls)   FT 1/2: GOOD   FT 2/2: MISS Anthony Bane makes 1/2 from the line. Rebound secured by Immanuel Ingram.
Score: 74-67

[07:14] Team_092 possession (Score: 74-67)
Austin Bridges drives, Devin Poole stays with him. Austin Bridges attempts a Dunk. Contested by Devin Poole (3.7 feet, MAN). AUSTIN BRIDGES MAKES IT! Assist: Immanuel Ingram
Score: 74-69

[06:59] Team_034 possession (Score: 74-69)
FOUL! Holding foul on John Giddey. [IN THE BONUS! 5 team fouls] Terry Doncic to the line for 2 free throws. (John Giddey: 3 personal fouls)   FT 1/2: GOOD   FT 2/2: GOOD Terry Doncic makes 2/2 from the line.
Score: 76-69

[06:46] Team_092 possession (Score: 76-69)
Karl Gobert attempts a 3Pt. Contested by Ben Hyland (3.5 feet, MAN). Karl Gobert misses. Rebound secured by Cole Antetokounmpo.

[06:37] Team_034 possession (Score: 76-69)
Ben Hyland attempts a 3Pt. Contested by John Giddey (4.1 feet, ZONE). Ben Hyland misses. Offensive rebound by Anthony Bane! Anthony Bane kicks it out.

[06:19] Team_034 possession (Score: 76-69)
Devin Poole attempts a Midrange. Contested by Austin Bridges (4.3 feet, MAN). Devin Poole misses. Offensive rebound by Terry Doncic! Terry Doncic's putback is no good. Offensive rebound by Terry Doncic! Terry Doncic kicks it out.

[06:04] Team_034 possession (Score: 76-69)
Terry Doncic drives to the basket... Terry Doncic loses the ball! Stripped by John Giddey! TURNOVER! (live ball)

[05:54] Team_092 possession (Score: 76-69)
John Giddey attempts a Layup. Contested by Terry Doncic (4.3 feet, MAN). John Giddey misses. Rebound secured by Cole Antetokounmpo.

[05:36] Team_034 possession (Score: 76-69)
Anthony Bane attempts a Layup. Contested by John Giddey (4.1 feet, ZONE). Anthony Bane misses. Rebound secured by John Giddey.

[05:23] Team_092 possession (Score: 76-69)
John Giddey drives, picks up Terry Doncic. Help arrives from Ben Hyland! John Giddey attempts a Layup. Contested by Ben Hyland (4.3 feet, ZONE). JOHN GIDDEY MAKES IT! Assist: Immanuel Ingram
Score: 76-71

[05:07] Team_034 possession (Score: 76-71)
Ben Hyland attempts a 3Pt. Contested by John Giddey (4.2 feet, ZONE). BEN HYLAND MAKES IT! Assist: Cole Antetokounmpo
Score: 79-71

[04:52] Team_092 possession (Score: 79-71)
Paul James attempts a 3Pt. Contested by Terry Doncic (4.7 feet, ZONE). Paul James misses. Rebound secured by Anthony Bane.

[04:41] Team_034 possession (Score: 79-71)
FOUL! Holding foul on Paul James. [IN THE BONUS! 6 team fouls] Cole Antetokounmpo to the line for 2 free throws. (Paul James: 2 personal fouls)   FT 1/2: GOOD   FT 2/2: GOOD Cole Antetokounmpo makes 2/2 from the line.
Score: 81-71

[04:22] Team_092 possession (Score: 81-71)
Austin Bridges attempts a Midrange. Contested by Devin Poole (3.8 feet, MAN). Austin Bridges misses. Rebound secured by Cole Antetokounmpo.

[04:06] Team_034 possession (Score: 81-71)
Terry Doncic drives and kicks out. Terry Doncic attempts a Midrange. Contested by John Giddey (4.2 feet, MAN). Terry Doncic misses. Rebound secured by Paul James.

[03:49] Team_092 possession (Score: 81-71)
John Giddey attempts a Midrange. Contested by Terry Doncic (4.4 feet, MAN). John Giddey misses. Rebound secured by Cole Antetokounmpo.

[03:34] Team_034 possession (Score: 81-71)
Anthony Bane attempts a Midrange. Contested by Immanuel Ingram (4.2 feet, MAN). Anthony Bane misses. Rebound secured by John Giddey.

[03:18] Team_092 possession (Score: 81-71)
John Giddey attempts a Layup. Contested by Terry Doncic (4.5 feet, MAN). JOHN GIDDEY MAKES IT! Assist: Karl Gobert
Score: 81-73

[03:07] Team_034 possession (Score: 81-73)
FOUL! Reach-in foul on Immanuel Ingram during the drive. [IN THE BONUS! 7 team fouls] Anthony Bane to the line for 2 free throws. (Immanuel Ingram: 1 personal fouls)   FT 1/2: GOOD   FT 2/2: GOOD Anthony Bane makes 2/2 from the line.
Score: 83-73

[02:50] Team_092 possession (Score: 83-73)
Immanuel Ingram attempts a 3Pt. Contested by Devin Poole (4.0 feet, ZONE). Immanuel Ingram misses. Rebound secured by Cole Antetokounmpo.

[02:35] Team_034 possession (Score: 83-73)
Ben Hyland attempts a 3Pt. Contested by John Giddey (4.4 feet, ZONE). Ben Hyland misses. Rebound secured by John Giddey.

[02:19] Team_092 possession (Score: 83-73)
Austin Bridges throws a bad pass out of bounds! TURNOVER! (dead ball)

[02:19] Substitution (Team_034): Devin Poole OUT → Manu Jokic IN (stamina_rule2)

[02:19] Substitution (Team_034): Cole Antetokounmpo OUT → Vince Paul IN (stamina_rule2)

[02:19] Substitution (Team_034): Terry Doncic OUT → Nikola Wagner IN (stamina_rule2)

[02:19] Substitution (Team_034): Anthony Bane OUT → Carmelo Anunoby IN (stamina_rule2)

[02:19] Substitution (Team_092): Austin Bridges OUT → Bones Giddey IN (stamina_rule2)

[02:19] Substitution (Team_092): Karl Gobert OUT → Shaquille Russell IN (stamina_rule2)

[02:19] Substitution (Team_092): John Giddey OUT → Shaquille Paul IN (stamina_rule2)

[02:05] Team_034 possession (Score: 83-73)
Nikola Wagner drives to the basket... FOUL! Offensive foul on Nikola Wagner! Shaquille Paul drew the charge! [Team fouls: 2] (Nikola Wagner: 1 personal fouls) TURNOVER! (dead ball)

[01:51] Team_092 possession (Score: 83-73)
Paul James attempts a Midrange. Contested by Vince Paul (4.8 feet, MAN). PAUL JAMES MAKES IT! Assist: Shaquille Russell
Score: 83-75

[01:35] Team_034 possession (Score: 83-75)
Carmelo Anunoby drives, Immanuel Ingram stays with him. Carmelo Anunoby attempts a Dunk. Contested by Immanuel Ingram (4.5 feet, MAN). Carmelo Anunoby misses. Rebound secured by Paul James.

[01:24] Team_092 possession (Score: 83-75)
Shaquille Paul attempts a Midrange. Contested by Carmelo Anunoby (6.0 feet, ZONE). Shaquille Paul misses. Rebound secured by Carmelo Anunoby.

[01:08] Team_034 possession (Score: 83-75)
Vince Paul attempts a Midrange. Contested by Paul James (5.5 feet, MAN). VINCE PAUL MAKES IT! Assist: Carmelo Anunoby
Score: 85-75

[00:52] Team_092 possession (Score: 85-75)
Paul James makes the Layup and draws the foul on Ben Hyland! And-1! Paul James to the line for 1. [Team fouls: 3] (Ben Hyland: 1 personal fouls)   FT 1/1: GOOD Paul James makes 1/1 from the line.
Score: 85-78

[00:41] Team_034 possession (Score: 85-78)
Ben Hyland attempts a 3Pt. Contested by Shaquille Russell (4.2 feet, ZONE). BEN HYLAND MAKES IT! Assist: Nikola Wagner
Score: 88-78

[00:31] Team_092 possession (Score: 88-78)
FOUL! Holding foul on Manu Jokic. [Team fouls: 4] No free throws, side out. (Manu Jokic: 1 personal fouls)

[00:16] Team_092 possession (Score: 88-78)
Shaquille Paul drives, picks up Nikola Wagner. Help arrives from Ben Hyland! Shaquille Paul attempts a Layup. Wide open! Ben Hyland is 6.6 feet away. [MAN] Shaquille Paul misses. Offensive rebound by Paul James! Paul James kicks it out.

[00:03] Team_092 possession (Score: 88-78)
Bones Giddey drives, Carmelo Anunoby stays with him. Bones Giddey attempts a Dunk. Contested by Carmelo Anunoby (5.1 feet, ZONE). BONES GIDDEY MAKES IT! Assist: Shaquille Russell
Score: 88-80

================================================================================
                              3RD QUARTER COMPLETE                              
================================================================================

3RD QUARTER SCORE: Team_034 19, Team_092 24

BOX SCORE:
================================================================================

Team_034
--------------------------------------------------------------------------------
Player                MIN  PTS  REB  AST  TO      FG   FG%      3P   3P%
--------------------------------------------------------------------------------
Ben Hyland             34    6    0    0   0   2/4    50.0     0/0   0.0
Anthony Bane           32    4    3    0   0   2/6    33.3     0/0   0.0
Cole Antetokounmpo     32    4    6    1   0   2/3    66.7     0/0   0.0
Terry Doncic           32    2    3    0   0   1/4    25.0     0/0   0.0
Vince Paul              4    2    0    0   0   1/1   100.0     0/0   0.0
Devin Poole            32    0    0    0   0   0/1     0.0     0/0   0.0
Carmelo Anunoby         4    0    1    1   0   0/1     0.0     0/0   0.0
Nikola Wagner           4    0    0    1   0   0/0     0.0     0/0   0.0

TEAM: FG: 8/20 (40.0%), 3PT: 2/7 (28.6%), REB: 13 (3 off, 10 def), AST: 3, TO: 2
TEAM FOULS: 4


Team_092
--------------------------------------------------------------------------------
Player                MIN  PTS  REB  AST  TO      FG   FG%      3P   3P%
--------------------------------------------------------------------------------
John Giddey            32    7    5    1   0   3/5    60.0     0/0   0.0
Immanuel Ingram        34    6    3    2   0   3/4    75.0     0/0   0.0
Paul James             34    5    5    1   0   2/3    66.7     0/0   0.0
Austin Bridges         32    4    0    0   0   2/4    50.0     0/0   0.0
Bones Giddey            4    2    0    0   0   1/1   100.0     0/0   0.0
Karl Gobert            32    0    0    1   0   0/3     0.0     0/0   0.0
Shaquille Russell       4    0    0    2   0   0/0     0.0     0/0   0.0
Shaquille Paul          4    0    0    0   0   0/1     0.0     0/0   0.0

TEAM: FG: 11/21 (52.4%), 3PT: 0/4 (0.0%), REB: 13 (1 off, 12 def), AST: 7, TO: 1
TEAM FOULS: 7 [Team_034 in BONUS]

================================================================================

================================================================================
                       4TH QUARTER - Team_034 vs Team_092                       
================================================================================

[12:00] Team_034 possession (Score: 88-80)
Terry Doncic drives, picks up John Giddey. Help arrives from Austin Bridges! Terry Doncic attempts a Dunk. Contested by Austin Bridges (4.2 feet, MAN). TERRY DONCIC MAKES IT!
Score: 90-80

[11:48] Team_092 possession (Score: 90-80)
Karl Gobert loses control! Ball rolls out of bounds! TURNOVER! (dead ball)

[11:48] Substitution (Team_034): Ben Hyland OUT → Damian Turner IN (stamina_rule2)

[11:48] Substitution (Team_092): Paul James OUT → Vince Harris IN (stamina_rule2)

[11:48] Substitution (Team_092): Immanuel Ingram OUT → Pau Reaves IN (stamina_rule2)

[11:30] Team_034 possession (Score: 90-80)
Anthony Bane makes the Layup and draws the foul on John Giddey! And-1! Anthony Bane to the line for 1. [Team fouls: 1] (John Giddey: 1 personal fouls)   FT 1/1: GOOD Anthony Bane makes 1/1 from the line.
Score: 93-80

[11:15] Team_092 possession (Score: 93-80)
Austin Bridges attempts a 3Pt. Contested by Devin Poole (3.8 feet, MAN). Austin Bridges misses. Rebound secured by Terry Doncic.

[11:05] Team_034 possession (Score: 93-80)
Terry Doncic makes the 3Pt and draws the foul on John Giddey! And-1! Terry Doncic to the line for 1. [Team fouls: 2] (John Giddey: 2 personal fouls)   FT 1/1: GOOD Terry Doncic makes 1/1 from the line.
Score: 97-80

[10:50] Team_092 possession (Score: 97-80)
Austin Bridges attempts a Layup. Contested by Terry Doncic (3.9 feet, ZONE). Austin Bridges misses. Rebound secured by Terry Doncic.

[10:38] Team_034 possession (Score: 97-80)
Damian Turner attempts a Layup. Contested by Karl Gobert (5.6 feet, MAN). DAMIAN TURNER MAKES IT! Assist: Devin Poole
Score: 99-80

[10:22] Team_092 possession (Score: 99-80)
John Giddey attempts a 3Pt. Contested by Terry Doncic (4.4 feet, MAN). John Giddey misses. Rebound secured by Anthony Bane.

[10:10] Team_034 possession (Score: 99-80)
FOUL! Shooting foul on Karl Gobert. Damian Turner to the line for 2 free throws. [Team fouls: 3] (Karl Gobert: 1 personal fouls)   FT 1/2: MISS   FT 2/2: GOOD Damian Turner makes 1/2 from the line.
Score: 100-80

[09:55] Team_092 possession (Score: 100-80)
Karl Gobert attempts a Midrange. Contested by Damian Turner (5.3 feet, MAN). KARL GOBERT MAKES IT!
Score: 100-82

[09:44] Team_034 possession (Score: 100-82)
Terry Doncic attempts a Midrange. Contested by John Giddey (4.4 feet, MAN). Terry Doncic misses. Rebound secured by Karl Gobert.

[09:32] Team_092 possession (Score: 100-82)
Vince Harris attempts a 3Pt. Contested by Cole Antetokounmpo (4.8 feet, MAN). VINCE HARRIS MAKES IT! Assist: Pau Reaves
Score: 100-85

[09:21] Team_034 possession (Score: 100-85)
Terry Doncic drives to the basket... Terry Doncic commits a violation (traveling/carry)! TURNOVER! (dead ball)

[09:21] Substitution (Team_034): Devin Poole OUT → Manu Jokic IN (stamina_rule2)

[09:21] Substitution (Team_034): Cole Antetokounmpo OUT → Vince Paul IN (stamina_rule2)

[09:21] Substitution (Team_034): Terry Doncic OUT → Nikola Wagner IN (stamina_rule2)

[09:21] Substitution (Team_034): Anthony Bane OUT → Carmelo Anunoby IN (stamina_rule2)

[09:21] Substitution (Team_092): Austin Bridges OUT → Bones Giddey IN (stamina_rule2)

[09:21] Substitution (Team_092): Karl Gobert OUT → Shaquille Russell IN (stamina_rule2)

[09:21] Substitution (Team_092): John Giddey OUT → Shaquille Paul IN (stamina_rule2)

[09:05] Team_092 possession (Score: 100-85)
Pau Reaves drives and kicks out. Bones Giddey attempts a Midrange. Contested by Carmelo Anunoby (5.4 feet, ZONE). BONES GIDDEY MAKES IT!
Score: 100-87

[08:53] Team_034 possession (Score: 100-87)
Manu Jokic attempts a 3Pt. Contested by Bones Giddey (5.2 feet, MAN). Manu Jokic misses. Rebound secured by Shaquille Paul.

[08:43] Team_092 possession (Score: 100-87)
Bones Giddey makes the Layup and draws the foul on Manu Jokic! And-1! Bones Giddey to the line for 1. [Team fouls: 1] (Manu Jokic: 1 personal fouls)   FT 1/1: GOOD Bones Giddey makes 1/1 from the line.
Score: 100-90

[08:33] Team_034 possession (Score: 100-90)
FOUL! Shooting foul on Vince Harris. Manu Jokic to the line for 2 free throws. [Team fouls: 4] (Vince Harris: 1 personal fouls)   FT 1/2: GOOD   FT 2/2: GOOD Manu Jokic makes 2/2 from the line.
Score: 102-90

[08:21] Team_092 possession (Score: 102-90)
Shaquille Paul drives, Carmelo Anunoby stays with him. Shaquille Paul attempts a Layup. Contested by Carmelo Anunoby (6.0 feet, ZONE). SHAQUILLE PAUL MAKES IT! Assist: Bones Giddey
Score: 102-92

[08:08] Team_034 possession (Score: 102-92)
Vince Paul attempts a Layup. Contested by Vince Harris (4.5 feet, MAN). VINCE PAUL MAKES IT! Assist: Damian Turner
Score: 104-92

[07:53] Team_092 possession (Score: 104-92)
Shaquille Russell attempts a 3Pt. Contested by Vince Paul (4.6 feet, ZONE). SHAQUILLE RUSSELL MAKES IT! Assist: Vince Harris
Score: 104-95

[07:36] Team_034 possession (Score: 104-95)
Carmelo Anunoby drives and kicks out. Carmelo Anunoby attempts a 3Pt. Contested by Pau Reaves (4.8 feet, MAN). Carmelo Anunoby misses. Rebound secured by Pau Reaves.

[07:23] Team_092 possession (Score: 104-95)
FOUL! Shooting foul on Damian Turner. Shaquille Russell to the line for 2 free throws. [Team fouls: 2] (Damian Turner: 1 personal fouls)   FT 1/2: GOOD   FT 2/2: GOOD Shaquille Russell makes 2/2 from the line.
Score: 104-97

[07:05] Team_034 possession (Score: 104-97)
Vince Paul throws a bad pass! Stolen by Vince Harris! TURNOVER! (live ball)

[06:47] Team_092 possession (Score: 104-97)
Shaquille Russell drives, Damian Turner stays with him. Shaquille Russell attempts a Layup. Contested by Damian Turner (5.8 feet, MAN). Shaquille Russell misses. Rebound secured by Nikola Wagner.

[06:31] Team_034 possession (Score: 104-97)
Damian Turner attempts a Layup. Contested by Shaquille Russell (4.6 feet, MAN). Damian Turner misses. Rebound secured by Shaquille Russell.

[06:20] Team_092 possession (Score: 104-97)
Shaquille Paul attempts a Midrange. Wide open! Nikola Wagner is 6.6 feet away. [MAN] Shaquille Paul misses. FOUL! Loose ball foul on Vince Paul during the rebound battle. [Team fouls: 3] No free throws, side out. (Vince Paul: 1 personal fouls)

[06:07] Team_092 possession (Score: 104-97)
Shaquille Paul attempts a 3Pt. Contested by Vince Paul (4.8 feet, ZONE). Shaquille Paul misses. Rebound secured by Nikola Wagner.

[05:53] Team_034 possession (Score: 104-97)
Damian Turner attempts a 3Pt. Contested by Vince Harris (4.5 feet, ZONE). Damian Turner misses. FOUL! Loose ball foul on Shaquille Paul during the rebound battle. [IN THE BONUS! 5 team fouls] Carmelo Anunoby to the line for 2 free throws. (Shaquille Paul: 1 personal fouls)   FT 1/2: GOOD   FT 2/2: GOOD Carmelo Anunoby makes 2/2 from the line.
Score: 106-97

[05:37] Team_092 possession (Score: 106-97)
Pau Reaves attempts a Midrange. Contested by Carmelo Anunoby (5.7 feet, MAN). Pau Reaves misses. Rebound secured by Nikola Wagner.

[05:21] Team_034 possession (Score: 106-97)
Manu Jokic attempts a Layup. Contested by Pau Reaves (4.9 feet, ZONE). Manu Jokic misses. Rebound secured by Shaquille Paul.

[05:09] Team_092 possession (Score: 106-97)
Pau Reaves loses control! Ball rolls out of bounds! TURNOVER! (dead ball)

[04:54] Team_034 possession (Score: 106-97)
Vince Paul drives to the basket... FOUL! Offensive foul on Vince Paul! Vince Harris drew the charge! [Team fouls: 4] (Vince Paul: 2 personal fouls) TURNOVER! (dead ball)

[04:39] Team_092 possession (Score: 106-97)
Vince Harris makes the Dunk and draws the foul on Damian Turner! And-1! Vince Harris to the line for 1. [BONUS: 5 team fouls] (Damian Turner: 2 personal fouls)   FT 1/1: GOOD Vince Harris makes 1/1 from the line.
Score: 106-100

[04:22] Team_034 possession (Score: 106-100)
Manu Jokic attempts a Midrange. Contested by Shaquille Russell (4.3 feet, ZONE). Manu Jokic misses. Rebound secured by Shaquille Paul.

[04:07] Team_092 possession (Score: 106-100)
Bones Giddey attempts a 3Pt. Contested by Vince Paul (3.9 feet, ZONE). Bones Giddey misses. Rebound secured by Carmelo Anunoby.

[03:52] Team_034 possession (Score: 106-100)
Nikola Wagner attempts a Midrange. Contested by Shaquille Paul (5.7 feet, MAN). NIKOLA WAGNER MAKES IT! Assist: Manu Jokic
Score: 108-100

[03:40] Team_092 possession (Score: 108-100)
Bones Giddey drives and kicks out. Pau Reaves attempts a Midrange. Contested by Carmelo Anunoby (5.5 feet, MAN). Pau Reaves misses. Rebound secured by Carmelo Anunoby.

[03:30] Team_034 possession (Score: 108-100)
Damian Turner attempts a Layup. BLOCKED BY VINCE HARRIS! Ball is loose! Offensive rebound by Vince Paul! Vince Paul kicks it out.

[03:16] Team_034 possession (Score: 108-100)
Damian Turner drives, Shaquille Russell stays with him. Damian Turner attempts a Dunk. Contested by Shaquille Russell (4.6 feet, MAN). DAMIAN TURNER MAKES IT! Assist: Nikola Wagner
Score: 110-100

[02:58] Team_092 possession (Score: 110-100)
Shaquille Russell drives and kicks out. Pau Reaves makes the 3Pt and draws the foul on Carmelo Anunoby! And-1! Pau Reaves to the line for 1. [BONUS: 6 team fouls] (Carmelo Anunoby: 1 personal fouls)   FT 1/1: GOOD Pau Reaves makes 1/1 from the line.
Score: 110-104

[02:42] Team_034 possession (Score: 110-104)
Vince Paul attempts a 3Pt. Contested by Vince Harris (4.7 feet, ZONE). VINCE PAUL MAKES IT! Assist: Manu Jokic
Score: 113-104

[02:32] Team_092 possession (Score: 113-104)
Vince Harris attempts a 3Pt. Contested by Vince Paul (4.4 feet, MAN). Vince Harris misses. Rebound secured by Nikola Wagner.

[02:16] Team_034 possession (Score: 113-104)
Vince Paul attempts a 3Pt. Contested by Vince Harris (4.8 feet, ZONE). Vince Paul misses. Rebound secured by Shaquille Russell.

[02:04] Team_092 possession (Score: 113-104)
Bones Giddey attempts a 3Pt. Contested by Manu Jokic (4.5 feet, MAN). BONES GIDDEY MAKES IT! Assist: Shaquille Paul
Score: 113-107

[01:51] Team_034 possession (Score: 113-107)
Nikola Wagner drives and kicks out. Nikola Wagner attempts a Midrange. Contested by Shaquille Paul (5.8 feet, MAN). NIKOLA WAGNER MAKES IT!
Score: 115-107

[01:40] Team_092 possession (Score: 115-107)
Pau Reaves drives, picks up Carmelo Anunoby. Help arrives from Damian Turner! Pau Reaves attempts a Dunk. Contested by Damian Turner (6.0 feet, ZONE). PAU REAVES MAKES IT! Assist: Bones Giddey
Score: 115-109

[01:27] Team_034 possession (Score: 115-109)
Manu Jokic attempts a Layup. Contested by Bones Giddey (5.5 feet, MAN). MANU JOKIC MAKES IT! Assist: Nikola Wagner
Score: 117-109

[01:11] Team_092 possession (Score: 117-109)
FOUL! Holding foul on Damian Turner. [IN THE BONUS! 7 team fouls] Shaquille Russell to the line for 2 free throws. (Damian Turner: 3 personal fouls)   FT 1/2: MISS   FT 2/2: GOOD Shaquille Russell makes 1/2 from the line.
Score: 117-110

[00:59] Team_034 possession (Score: 117-110)
Damian Turner attempts a Midrange. Wide open! Shaquille Paul is 6.2 feet away. [ZONE] DAMIAN TURNER MAKES IT!
Score: 119-110

[00:43] Team_092 possession (Score: 119-110)
Vince Harris attempts a 3Pt. Contested by Vince Paul (4.5 feet, MAN). Vince Harris misses. Rebound secured by Vince Paul.

[00:30] Team_034 possession (Score: 119-110)
Damian Turner attempts a 3Pt. Contested by Vince Harris (4.9 feet, ZONE). Damian Turner misses. Offensive rebound by Vince Paul! Vince Paul kicks it out.

[00:14] Team_034 possession (Score: 119-110)
Manu Jokic attempts a 3Pt. Contested by Shaquille Paul (6.0 feet, ZONE). Manu Jokic misses. Rebound secured by Pau Reaves.

[00:01] Team_092 possession (Score: 119-110)
Shaquille Paul attempts a 3Pt. Wide open! Nikola Wagner is 6.9 feet away. [MAN] SHAQUILLE PAUL MAKES IT! Assist: Shaquille Russell
Score: 119-113

================================================================================
                              4TH QUARTER COMPLETE                              
================================================================================

4TH QUARTER SCORE: Team_034 31, Team_092 33

BOX SCORE:
================================================================================

Team_034
--------------------------------------------------------------------------------
Player                MIN  PTS  REB  AST  TO      FG   FG%      3P   3P%
--------------------------------------------------------------------------------
Damian Turner          14    7    0    1   0   4/5    80.0     0/0   0.0
Terry Doncic           35    6    2    0   0   2/3    66.7     0/0   0.0
Vince Paul             14    5    3    0   0   2/3    66.7     0/0   0.0
Manu Jokic             14    4    0    2   0   2/6    33.3     0/0   0.0
Nikola Wagner          14    4    4    2   0   2/2   100.0     0/0   0.0
Anthony Bane           35    3    1    0   0   1/1   100.0     0/0   0.0
Carmelo Anunoby        14    2    2    0   0   1/2    50.0     0/0   0.0
Devin Poole            35    0    0    1   0   0/0     0.0     0/0   0.0

TEAM: FG: 14/22 (63.6%), 3PT: 3/6 (50.0%), REB: 12 (2 off, 10 def), AST: 6, TO: 3
TEAM FOULS: 7 [Team_092 in BONUS]


Team_092
--------------------------------------------------------------------------------
Player                MIN  PTS  REB  AST  TO      FG   FG%      3P   3P%
--------------------------------------------------------------------------------
Bones Giddey           14    8    0    2   0   3/5    60.0     0/0   0.0
Vince Harris           14    6    0    1   0   2/4    50.0     0/0   0.0
Pau Reaves             14    6    2    1   0   2/3    66.7     0/0   0.0
Shaquille Russell      14    6    2    1   0   3/4    75.0     0/0   0.0
Shaquille Paul         14    5    4    1   0   2/3    66.7     0/0   0.0
Karl Gobert            35    2    1    0   0   1/1   100.0     0/0   0.0
Austin Bridges         35    0    0    0   0   0/2     0.0     0/0   0.0
John Giddey            35    0    0    0   0   0/1     0.0     0/0   0.0

TEAM: FG: 13/23 (56.5%), 3PT: 4/10 (40.0%), REB: 9 (1 off, 8 def), AST: 6, TO: 2
TEAM FOULS: 6 [Team_034 in BONUS]

================================================================================

================================================================================
                               FULL GAME COMPLETE                               
================================================================================

FINAL SCORE: Team_034 119, Team_092 113

SCORING BY QUARTER:
--------------------------------------------------------------------------------
Team                     Q1     Q2     Q3     Q4    FINAL
--------------------------------------------------------------------------------
Team_034                 38     31     19     31      119
Team_092                 25     31     24     33      113
--------------------------------------------------------------------------------

FULL GAME BOX SCORE:
================================================================================

Team_034
--------------------------------------------------------------------------------
Player                MIN  PTS  REB  AST  TO      FG   FG%      3P   3P%      FT STL BLK
--------------------------------------------------------------------------------
Devin Poole            35   13    0    4   0   5/9    55.6   2/4    50.0   1/1     0   0
Cole Antetokounmpo     35   12    9    3   1   5/8    62.5   0/1     0.0   8/8     1   0
Terry Doncic           35   18   13    5   1   4/8    50.0   1/3    33.3   4/4     0   0
Anthony Bane           35   25   11    1   0  12/21   57.1   3/4    75.0   8/9     1   0
Ben Hyland             35   16    0    1   0   6/11   54.5   2/5    40.0   2/2     0   0
Damian Turner          14   15    0    1   0   8/9    88.9   3/3   100.0   1/2     0   0
Manu Jokic             14    4    0    4   1   2/6    33.3   0/2     0.0   2/2     0   0
Vince Paul             14    9    4    0   1   3/4    75.0   1/2    50.0   0/0     0   0
Nikola Wagner          14    4    5    3   0   2/2   100.0   0/0     0.0   0/0     0   0
Carmelo Anunoby        14    2    4    2   2   1/3    33.3   0/0     0.0   2/2     0   0

TEAM: FG: 50/83 (60.2%), 3PT: 12/24 (50.0%), REB: 47 (13 off, 34 def), AST: 24, TO: 6


Team_092
--------------------------------------------------------------------------------
Player                MIN  PTS  REB  AST  TO      FG   FG%      3P   3P%      FT STL BLK
--------------------------------------------------------------------------------
Austin Bridges         35   24    0    0   1  11/16   68.8   2/5    40.0   2/2     0   0
Karl Gobert            35   11    1    3   1   5/12   41.7   1/4    25.0   2/3     0   0
John Giddey            35   11   16    4   1   7/13   53.8   0/1     0.0   2/2     1   1
Paul James             35   16   12    3   1   7/10   70.0   2/3    66.7   2/3     0   0
Immanuel Ingram        35   11    7    3   1   3/6    50.0   0/1     0.0   2/3     0   0
Vince Harris           14    8    0    1   1   3/5    60.0   1/3    33.3   3/3     1   1
Pau Reaves             14    6    2    1   1   2/3    66.7   0/0     0.0   1/1     0   0
Bones Giddey           14   10    0    3   0   3/6    50.0   1/2    50.0   1/1     0   0
Shaquille Russell      14    8    2    3   0   4/5    80.0   1/1   100.0   3/4     0   0
Shaquille Paul         14    5    4    1   0   2/5    40.0   1/2    50.0   0/0     0   0

TEAM: FG: 48/82 (58.5%), 3PT: 9/22 (40.9%), REB: 43 (11 off, 32 def), AST: 22, TO: 7

================================================================================
