================================================================================
                        FULL GAME - Team_085 vs Team_083                        
================================================================================

================================================================================
                       1ST QUARTER - Team_085 vs Team_083                       
================================================================================

[12:00] Team_085 possession (Score: 0-0)
Paul Wagner attempts a 3Pt. Contested by Kyrie Griffin (3.7 feet, MAN). Paul Wagner misses. Rebound secured by Kyrie Griffin.

[11:47] Team_083 possession (Score: 0-0)
Karl Jokic throws a bad pass! Stolen by Stephen Bird! TURNOVER! (live ball)

[11:32] Team_085 possession (Score: 0-0)
Larry Duncan attempts a 3Pt. Contested by Yao Oladipo (3.7 feet, MAN). Larry Duncan misses. Rebound secured by Kyrie Griffin.

[11:14] Team_083 possession (Score: 0-0)
Karl Jokic attempts a 3Pt. Contested by Magic Beal (4.5 feet, ZONE). Karl Jokic misses. Rebound secured by Collin Mobley.

[10:55] Team_085 possession (Score: 0-0)
FOUL! Holding foul on Kyrie Griffin. [Team fouls: 1] No free throws, side out. (Kyrie Griffin: 1 personal fouls)

[10:44] Team_085 possession (Score: 0-0)
FOUL! Shooting foul on Karl Jokic. Paul Wagner to the line for 2 free throws. [Team fouls: 2] (Karl Jokic: 1 personal fouls)   FT 1/2: GOOD   FT 2/2: MISS Paul Wagner makes 1/2 from the line. Offensive rebound by Larry Duncan! Larry Duncan kicks it out.
Score: 1-0

[10:26] Team_085 possession (Score: 1-0)
Stephen Bird attempts a Midrange. Contested by Karl Jokic (4.8 feet, MAN). Stephen Bird misses. FOUL! Loose ball foul on Bradley Thompson during the rebound battle. [Team fouls: 3] No free throws, side out. (Bradley Thompson: 1 personal fouls)

[10:09] Team_085 possession (Score: 1-0)
Larry Duncan drives and kicks out. Collin Mobley attempts a Midrange. Contested by Bradley Thompson (3.7 feet, MAN). COLLIN MOBLEY MAKES IT!
Score: 3-0

[09:52] Team_083 possession (Score: 3-0)
Malcolm Brogdon drives, picks up Magic Beal. Help arrives from Larry Duncan! Malcolm Brogdon attempts a Dunk. Contested by Larry Duncan (3.6 feet, MAN). MALCOLM BROGDON MAKES IT!
Score: 3-2

[09:39] Team_085 possession (Score: 3-2)
Magic Beal attempts a 3Pt. Contested by Yao Oladipo (3.8 feet, ZONE). Magic Beal misses. Rebound secured by Kyrie Griffin.

[09:22] Team_083 possession (Score: 3-2)
Kyrie Griffin attempts a Dunk. BLOCKED BY PAUL WAGNER! Ball deflects out of bounds off Kyrie Griffin.

[09:02] Team_085 possession (Score: 3-2)
Stephen Bird attempts a Layup. Contested by Bradley Thompson (3.9 feet, ZONE). STEPHEN BIRD MAKES IT! Assist: Larry Duncan
Score: 5-2

[08:49] Team_083 possession (Score: 5-2)
Malcolm Brogdon attempts a 3Pt. Contested by Magic Beal (3.6 feet, MAN). MALCOLM BROGDON MAKES IT! Assist: Kyrie Griffin
Score: 5-5

[08:33] Team_085 possession (Score: 5-5)
Stephen Bird attempts a 3Pt. Contested by Yao Oladipo (3.6 feet, ZONE). STEPHEN BIRD MAKES IT! Assist: Collin Mobley
Score: 8-5

[08:21] Team_083 possession (Score: 8-5)
Kyrie Griffin attempts a 3Pt. Contested by Magic Beal (4.3 feet, ZONE). Kyrie Griffin misses. Rebound secured by Paul Wagner.

[08:07] Team_085 possession (Score: 8-5)
Magic Beal drives, picks up Kyrie Griffin. Help arrives from Karl Jokic! Magic Beal attempts a Layup. Contested by Karl Jokic (3.8 feet, ZONE). Magic Beal misses. Offensive rebound by Larry Duncan! Larry Duncan kicks it out.

[07:51] Team_085 possession (Score: 8-5)
Larry Duncan loses the ball! Stripped by Yao Oladipo! TURNOVER! (live ball)

[07:37] Team_083 possession (Score: 8-5)
Malcolm Brogdon drives and kicks out. Malcolm Brogdon attempts a Midrange. Contested by Magic Beal (4.0 feet, MAN). MALCOLM BROGDON MAKES IT!
Score: 8-7

[07:19] Team_085 possession (Score: 8-7)
Larry Duncan attempts a Midrange. Contested by Yao Oladipo (3.7 feet, ZONE). LARRY DUNCAN MAKES IT!
Score: 10-7

[07:06] Team_083 possession (Score: 10-7)
Bradley Thompson attempts a Midrange. Contested by Collin Mobley (4.0 feet, MAN). Bradley Thompson misses. Rebound secured by Larry Duncan.

[06:50] Team_085 possession (Score: 10-7)
Collin Mobley drives and kicks out. Stephen Bird attempts a Midrange. Contested by Karl Jokic (4.6 feet, MAN). STEPHEN BIRD MAKES IT! Assist: Paul Wagner
Score: 12-7

[06:35] Team_083 possession (Score: 12-7)
FOUL! Shooting foul on Magic Beal. Karl Jokic to the line for 3 free throws. [Team fouls: 1] (Magic Beal: 1 personal fouls)   FT 1/3: GOOD   FT 2/3: GOOD   FT 3/3: GOOD Karl Jokic makes 3/3 from the line.
Score: 12-10

[06:21] Team_085 possession (Score: 12-10)
FOUL! Holding foul on Bradley Thompson. [Team fouls: 4] No free throws, side out. (Bradley Thompson: 2 personal fouls)

[06:11] Team_085 possession (Score: 12-10)
Paul Wagner attempts a 3Pt. Contested by Kyrie Griffin (3.7 feet, MAN). Paul Wagner misses. Rebound secured by Yao Oladipo.

[05:55] Team_083 possession (Score: 12-10)
Karl Jokic drives, picks up Stephen Bird. Help arrives from Larry Duncan! Karl Jokic attempts a Layup. Contested by Larry Duncan (3.9 feet, MAN). KARL JOKIC MAKES IT! Assist: Bradley Thompson
Score: 12-12

[05:44] Team_085 possession (Score: 12-12)
Paul Wagner attempts a 3Pt. Contested by Malcolm Brogdon (5.1 feet, ZONE). PAUL WAGNER MAKES IT! Assist: Larry Duncan
Score: 15-12

[05:25] Team_083 possession (Score: 15-12)
Bradley Thompson attempts a Layup. Contested by Paul Wagner (3.6 feet, ZONE). Bradley Thompson misses. Rebound secured by Larry Duncan.

[05:11] Team_085 possession (Score: 15-12)
Magic Beal attempts a 3Pt. Contested by Malcolm Brogdon (5.3 feet, MAN). Magic Beal misses. Rebound secured by Kyrie Griffin.

[04:54] Team_083 possession (Score: 15-12)
Yao Oladipo makes the Layup and draws the foul on Magic Beal! And-1! Yao Oladipo to the line for 1. [Team fouls: 2] (Magic Beal: 2 personal fouls)   FT 1/1: GOOD Yao Oladipo makes 1/1 from the line.
Score: 15-15

[04:42] Team_085 possession (Score: 15-15)
Collin Mobley loses the ball! Stripped by Bradley Thompson! TURNOVER! (live ball)

[04:29] Team_083 possession (Score: 15-15)
Kyrie Griffin attempts a 3Pt. Contested by Paul Wagner (3.8 feet, MAN). Kyrie Griffin misses. Rebound secured by Paul Wagner.

[04:13] Team_085 possession (Score: 15-15)
Larry Duncan attempts a 3Pt. Contested by Yao Oladipo (3.8 feet, MAN). Larry Duncan misses. Rebound secured by Yao Oladipo.

[03:55] Team_083 possession (Score: 15-15)
Karl Jokic attempts a 3Pt. Contested by Magic Beal (4.6 feet, ZONE). Karl Jokic misses. Rebound secured by Larry Duncan.

[03:38] Team_085 possession (Score: 15-15)
Paul Wagner drives to the basket... Paul Wagner loses the ball! Stripped by Kyrie Griffin! TURNOVER! (live ball)

[03:26] Team_083 possession (Score: 15-15)
Kyrie Griffin throws a bad pass! Stolen by Paul Wagner! TURNOVER! (live ball)

[03:16] Team_085 possession (Score: 15-15)
Collin Mobley makes the Dunk and draws the foul on Karl Jokic! And-1! Collin Mobley to the line for 1. [BONUS: 5 team fouls] (Karl Jokic: 2 personal fouls)   FT 1/1: GOOD Collin Mobley makes 1/1 from the line.
Score: 18-15

[03:00] Team_083 possession (Score: 18-15)
FOUL! Reach-in foul on Paul Wagner during the drive. [Team fouls: 3] No free throws, side out. (Paul Wagner: 1 personal fouls)

[02:42] Team_083 possession (Score: 18-15)
Yao Oladipo drives, Paul Wagner stays with him. Yao Oladipo attempts a Dunk. Contested by Paul Wagner (3.9 feet, ZONE). YAO OLADIPO MAKES IT! Assist: Bradley Thompson
Score: 18-17

[02:26] Team_085 possession (Score: 18-17)
Larry Duncan attempts a 3Pt. Contested by Karl Jokic (5.1 feet, ZONE). Larry Duncan misses. Offensive rebound by Paul Wagner! Paul Wagner kicks it out.

[02:13] Team_085 possession (Score: 18-17)
Magic Beal drives and kicks out. Magic Beal attempts a 3Pt. Contested by Malcolm Brogdon (5.1 feet, MAN). Magic Beal misses. FOUL! Loose ball foul on Bradley Thompson during the rebound battle. [IN THE BONUS! 6 team fouls] Paul Wagner to the line for 2 free throws. (Bradley Thompson: 3 personal fouls)   FT 1/2: GOOD   FT 2/2: GOOD Paul Wagner makes 2/2 from the line.
Score: 20-17

[02:01] Team_083 possession (Score: 20-17)
Malcolm Brogdon attempts a Midrange. Contested by Paul Wagner (3.4 feet, ZONE). Malcolm Brogdon misses. Rebound secured by Collin Mobley.

[01:48] Team_085 possession (Score: 20-17)
Paul Wagner attempts a 3Pt. Contested by Yao Oladipo (3.9 feet, ZONE). Paul Wagner misses. Rebound secured by Bradley Thompson.

[01:33] Team_083 possession (Score: 20-17)
Bradley Thompson drives, Collin Mobley stays with him. Bradley Thompson attempts a Layup. Contested by Collin Mobley (4.3 feet, MAN). BRADLEY THOMPSON MAKES IT! Assist: Kyrie Griffin
Score: 20-19

[01:15] Team_085 possession (Score: 20-19)
Larry Duncan drives and kicks out. Larry Duncan attempts a 3Pt. Contested by Yao Oladipo (3.7 feet, MAN). LARRY DUNCAN MAKES IT! Assist: Magic Beal
Score: 23-19

[00:58] Team_083 possession (Score: 23-19)
Kyrie Griffin attempts a Midrange. Contested by Stephen Bird (4.2 feet, ZONE). KYRIE GRIFFIN MAKES IT!
Score: 23-21

[00:43] Team_085 possession (Score: 23-21)
Larry Duncan drives, Yao Oladipo stays with him. Larry Duncan attempts a Dunk. Contested by Yao Oladipo (4.1 feet, MAN). LARRY DUNCAN MAKES IT! Assist: Stephen Bird
Score: 25-21

[00:30] Team_083 possession (Score: 25-21)
Yao Oladipo attempts a 3Pt. Contested by Larry Duncan (3.7 feet, MAN). YAO OLADIPO MAKES IT! Assist: Karl Jokic
Score: 25-24

[00:18] Team_085 possession (Score: 25-24)
Stephen Bird attempts a 3Pt. Contested by Karl Jokic (5.1 feet, MAN). STEPHEN BIRD MAKES IT! Assist: Larry Duncan
Score: 28-24

================================================================================
                              1ST QUARTER COMPLETE                              
================================================================================

1ST QUARTER SCORE: Team_085 28, Team_083 24

BOX SCORE:
================================================================================

Team_085
--------------------------------------------------------------------------------
Player                MIN  PTS  REB  AST  TO      FG   FG%      3P   3P%
--------------------------------------------------------------------------------
Stephen Bird           12   10    0    1   0   4/4   100.0     0/0   0.0
Larry Duncan           12    7    6    3   0   3/5    60.0     0/0   0.0
Paul Wagner            12    5    3    1   0   2/5    40.0     0/0   0.0
Collin Mobley          12    5    2    1   0   2/2   100.0     0/0   0.0
Magic Beal             12    0    0    1   0   0/2     0.0     0/0   0.0

TEAM: FG: 11/18 (61.1%), 3PT: 3/10 (30.0%), REB: 11 (4 off, 7 def), AST: 7, TO: 3
TEAM FOULS: 3


Team_083
--------------------------------------------------------------------------------
Player                MIN  PTS  REB  AST  TO      FG   FG%      3P   3P%
--------------------------------------------------------------------------------
Yao Oladipo            12    8    2    0   0   3/3   100.0     0/0   0.0
Malcolm Brogdon        12    7    0    0   0   3/4    75.0     0/0   0.0
Karl Jokic             12    5    0    1   0   2/4    50.0     0/0   0.0
Kyrie Griffin          12    2    4    2   0   1/4    25.0     0/0   0.0
Bradley Thompson       12    2    1    2   0   1/3    33.3     0/0   0.0

TEAM: FG: 10/18 (55.6%), 3PT: 3/7 (42.9%), REB: 7 (0 off, 7 def), AST: 5, TO: 2
TEAM FOULS: 6 [Team_085 in BONUS]

================================================================================

================================================================================
                       2ND QUARTER - Team_085 vs Team_083                       
================================================================================

[12:00] Team_085 possession (Score: 28-24)
Larry Duncan attempts a 3Pt. Contested by Yao Oladipo (4.0 feet, MAN). Larry Duncan misses. Rebound secured by Kyrie Griffin.

[11:47] Team_083 possession (Score: 28-24)
FOUL! Shooting foul on Magic Beal. Yao Oladipo to the line for 3 free throws. [Team fouls: 1] (Magic Beal: 1 personal fouls)   FT 1/3: GOOD   FT 2/3: GOOD   FT 3/3: GOOD Yao Oladipo makes 3/3 from the line.
Score: 28-27

[11:32] Team_085 possession (Score: 28-27)
Paul Wagner drives, Kyrie Griffin stays with him. Paul Wagner attempts a Layup. Contested by Kyrie Griffin (4.0 feet, ZONE). PAUL WAGNER MAKES IT! Assist: Larry Duncan
Score: 30-27

[11:21] Team_083 possession (Score: 30-27)
Karl Jokic attempts a 3Pt. Contested by Stephen Bird (4.3 feet, MAN). Karl Jokic misses. Offensive rebound by Bradley Thompson! Bradley Thompson kicks it out.

[11:07] Team_083 possession (Score: 30-27)
FOUL! Shooting foul on Paul Wagner. Malcolm Brogdon to the line for 2 free throws. [Team fouls: 2] (Paul Wagner: 1 personal fouls)   FT 1/2: GOOD   FT 2/2: GOOD Malcolm Brogdon makes 2/2 from the line.
Score: 30-29

[10:54] Team_085 possession (Score: 30-29)
FOUL! Shooting foul on Bradley Thompson. Collin Mobley to the line for 2 free throws. [Team fouls: 1] (Bradley Thompson: 1 personal fouls)   FT 1/2: GOOD   FT 2/2: GOOD Collin Mobley makes 2/2 from the line.
Score: 32-29

[10:42] Team_083 possession (Score: 32-29)
Yao Oladipo attempts a 3Pt. Contested by Larry Duncan (3.7 feet, MAN). Yao Oladipo misses. Rebound secured by Larry Duncan.

[10:28] Team_085 possession (Score: 32-29)
Larry Duncan attempts a 3Pt. Contested by Yao Oladipo (4.1 feet, MAN). Larry Duncan misses. Rebound secured by Yao Oladipo.

[10:10] Team_083 possession (Score: 32-29)
FOUL! Shooting foul on Paul Wagner. Bradley Thompson to the line for 2 free throws. [Team fouls: 3] (Paul Wagner: 2 personal fouls)   FT 1/2: GOOD   FT 2/2: MISS Bradley Thompson makes 1/2 from the line. Rebound secured by Collin Mobley.
Score: 32-30

[09:54] Team_085 possession (Score: 32-30)
Collin Mobley attempts a Layup. Contested by Bradley Thompson (4.1 feet, MAN). COLLIN MOBLEY MAKES IT! Assist: Magic Beal
Score: 34-30

[09:38] Team_083 possession (Score: 34-30)
Malcolm Brogdon attempts a 3Pt. Contested by Magic Beal (4.2 feet, MAN). Malcolm Brogdon misses. Rebound secured by Collin Mobley.

[09:24] Team_085 possession (Score: 34-30)
Stephen Bird attempts a Layup. Contested by Kyrie Griffin (4.3 feet, ZONE). STEPHEN BIRD MAKES IT!
Score: 36-30

[09:13] Team_083 possession (Score: 36-30)
Yao Oladipo throws a bad pass out of bounds! TURNOVER! (dead ball)

[09:13] Substitution (Team_085): Magic Beal OUT → Khris Brogdon IN (stamina_rule2)

[09:13] Substitution (Team_085): Stephen Bird OUT → Jordan Morant IN (stamina_rule2)

[09:13] Substitution (Team_085): Larry Duncan OUT → Giannis Johnson IN (stamina_rule2)

[09:13] Substitution (Team_085): Paul Wagner OUT → Jalen Leonard IN (stamina_rule2)

[09:13] Substitution (Team_085): Collin Mobley OUT → Malcolm Beal IN (stamina_rule2)

[09:13] Substitution (Team_083): Malcolm Brogdon OUT → Zion Markkanen IN (stamina_rule2)

[09:13] Substitution (Team_083): Karl Jokic OUT → Damian Towns IN (stamina_rule2)

[09:13] Substitution (Team_083): Yao Oladipo OUT → Domantas Doncic IN (stamina_rule2)

[09:13] Substitution (Team_083): Kyrie Griffin OUT → Cole Simmons IN (stamina_rule2)

[09:13] Substitution (Team_083): Bradley Thompson OUT → Victor McCollum IN (stamina_rule2)

[08:56] Team_085 possession (Score: 36-30)
Jordan Morant attempts a Layup. Contested by Damian Towns (5.1 feet, MAN). JORDAN MORANT MAKES IT! Assist: Malcolm Beal
Score: 38-30

[08:42] Team_083 possession (Score: 38-30)
FOUL! Holding foul on Khris Brogdon. [Team fouls: 4] No free throws, side out. (Khris Brogdon: 1 personal fouls)

[08:24] Team_083 possession (Score: 38-30)
Zion Markkanen attempts a 3Pt. Contested by Jordan Morant (3.7 feet, ZONE). Zion Markkanen misses. Offensive rebound by Victor McCollum! Victor McCollum's putback is no good. Rebound secured by Jalen Leonard.

[08:09] Team_085 possession (Score: 38-30)
Malcolm Beal drives and kicks out. Jordan Morant attempts a Midrange. Contested by Damian Towns (4.9 feet, MAN). Jordan Morant misses. Rebound secured by Damian Towns.

[07:52] Team_083 possession (Score: 38-30)
Damian Towns attempts a 3Pt. Contested by Jordan Morant (4.0 feet, ZONE). Damian Towns misses. Rebound secured by Malcolm Beal.

[07:42] Team_085 possession (Score: 38-30)
Giannis Johnson attempts a 3Pt. Contested by Domantas Doncic (4.5 feet, MAN). GIANNIS JOHNSON MAKES IT! Assist: Malcolm Beal
Score: 41-30

[07:25] Team_083 possession (Score: 41-30)
Domantas Doncic attempts a Midrange. Contested by Giannis Johnson (6.0 feet, ZONE). DOMANTAS DONCIC MAKES IT!
Score: 41-32

[07:08] Team_085 possession (Score: 41-32)
Khris Brogdon attempts a Midrange. Contested by Zion Markkanen (5.2 feet, MAN). Khris Brogdon misses. Offensive rebound by Malcolm Beal! Malcolm Beal kicks it out.

[06:53] Team_085 possession (Score: 41-32)
Malcolm Beal drives, Victor McCollum stays with him. Malcolm Beal attempts a Layup. Contested by Victor McCollum (3.5 feet, MAN). MALCOLM BEAL MAKES IT! Assist: Jalen Leonard
Score: 43-32

[06:42] Team_083 possession (Score: 43-32)
Cole Simmons drives and kicks out. Zion Markkanen attempts a 3Pt. Contested by Jordan Morant (3.5 feet, ZONE). Zion Markkanen misses. Rebound secured by Malcolm Beal.

[06:30] Team_085 possession (Score: 43-32)
Jalen Leonard attempts a Layup. Contested by Victor McCollum (4.3 feet, ZONE). JALEN LEONARD MAKES IT!
Score: 45-32

[06:15] Team_083 possession (Score: 45-32)
Cole Simmons drives, Malcolm Beal stays with him. Cole Simmons attempts a Dunk. Contested by Malcolm Beal (4.3 feet, ZONE). COLE SIMMONS MAKES IT! Assist: Zion Markkanen
Score: 45-34

[06:01] Team_085 possession (Score: 45-34)
Malcolm Beal attempts a Midrange. Contested by Victor McCollum (3.5 feet, MAN). MALCOLM BEAL MAKES IT!
Score: 47-34

[05:46] Team_083 possession (Score: 47-34)
Cole Simmons attempts a 3Pt. Contested by Jalen Leonard (4.1 feet, MAN). Cole Simmons misses. Rebound secured by Giannis Johnson.

[05:32] Team_085 possession (Score: 47-34)
Jalen Leonard throws a bad pass out of bounds! TURNOVER! (dead ball)

[05:20] Team_083 possession (Score: 47-34)
Damian Towns drives and kicks out. Damian Towns attempts a 3Pt. Contested by Jordan Morant (3.5 feet, ZONE). Damian Towns misses. Rebound secured by Jalen Leonard.

[05:09] Team_085 possession (Score: 47-34)
Khris Brogdon attempts a 3Pt. Contested by Zion Markkanen (5.2 feet, MAN). Khris Brogdon misses. Rebound secured by Victor McCollum.

[04:56] Team_083 possession (Score: 47-34)
Damian Towns attempts a 3Pt. Contested by Jordan Morant (4.0 feet, MAN). DAMIAN TOWNS MAKES IT!
Score: 47-37

[04:46] Team_085 possession (Score: 47-37)
FOUL! Reach-in foul on Victor McCollum during the drive. [Team fouls: 2] No free throws, side out. (Victor McCollum: 1 personal fouls)

[04:36] Team_085 possession (Score: 47-37)
Giannis Johnson drives and kicks out. Malcolm Beal attempts a Midrange. Contested by Cole Simmons (4.8 feet, ZONE). MALCOLM BEAL MAKES IT! Assist: Giannis Johnson
Score: 49-37

[04:19] Team_083 possession (Score: 49-37)
FOUL! Offensive foul on Damian Towns! Jordan Morant drew the charge! [Team fouls: 3] (Damian Towns: 1 personal fouls) TURNOVER! (dead ball)

[04:00] Team_085 possession (Score: 49-37)
Jordan Morant drives to the basket... FOUL! Offensive foul on Jordan Morant! Victor McCollum drew the charge! [Team fouls: 5] (Jordan Morant: 1 personal fouls) TURNOVER! (dead ball)

[03:46] Team_083 possession (Score: 49-37)
FOUL! Shooting foul on Jordan Morant. Damian Towns to the line for 2 free throws. [BONUS: 6 team fouls] (Jordan Morant: 2 personal fouls)   FT 1/2: GOOD   FT 2/2: GOOD Damian Towns makes 2/2 from the line.
Score: 49-39

[03:33] Team_085 possession (Score: 49-39)
Jalen Leonard attempts a Midrange. Contested by Damian Towns (5.2 feet, ZONE). JALEN LEONARD MAKES IT!
Score: 51-39

[03:19] Team_083 possession (Score: 51-39)
Victor McCollum drives and kicks out. Victor McCollum attempts a Midrange. Contested by Giannis Johnson (5.8 feet, ZONE). Victor McCollum misses. Rebound secured by Jalen Leonard.

[03:04] Team_085 possession (Score: 51-39)
Jordan Morant makes the Layup and draws the foul on Damian Towns! And-1! Jordan Morant to the line for 1. [Team fouls: 4] (Damian Towns: 2 personal fouls)   FT 1/1: GOOD Jordan Morant makes 1/1 from the line.
Score: 54-39

[02:52] Team_083 possession (Score: 54-39)
Victor McCollum drives, Malcolm Beal stays with him. Victor McCollum attempts a Dunk. Contested by Malcolm Beal (5.0 feet, ZONE). VICTOR MCCOLLUM MAKES IT! Assist: Zion Markkanen
Score: 54-41

[02:33] Team_085 possession (Score: 54-41)
Khris Brogdon attempts a 3Pt. Contested by Zion Markkanen (5.2 feet, ZONE). Khris Brogdon misses. Offensive rebound by Jalen Leonard! Jalen Leonard kicks it out.

[02:19] Team_085 possession (Score: 54-41)
Malcolm Beal attempts a Midrange. Contested by Cole Simmons (4.3 feet, ZONE). Malcolm Beal misses. Rebound secured by Cole Simmons.

[02:05] Team_083 possession (Score: 54-41)
Victor McCollum drives to the basket... Victor McCollum loses control! Ball rolls out of bounds! TURNOVER! (dead ball)

[01:52] Team_085 possession (Score: 54-41)
Jalen Leonard attempts a Layup. Contested by Victor McCollum (4.3 feet, ZONE). JALEN LEONARD MAKES IT! Assist: Khris Brogdon
Score: 56-41

[01:37] Team_083 possession (Score: 56-41)
Domantas Doncic attempts a Midrange. Contested by Jalen Leonard (4.4 feet, ZONE). Domantas Doncic misses. Offensive rebound by Victor McCollum! Victor McCollum puts it back in!
Score: 56-43

[01:20] Team_085 possession (Score: 56-43)
Malcolm Beal attempts a 3Pt. BLOCKED BY ZION MARKKANEN! Ball is loose! Rebound secured by Damian Towns.

[01:01] Team_083 possession (Score: 56-43)
FOUL! Holding foul on Giannis Johnson. [IN THE BONUS! 7 team fouls] Domantas Doncic to the line for 2 free throws. (Giannis Johnson: 1 personal fouls)   FT 1/2: GOOD   FT 2/2: GOOD Domantas Doncic makes 2/2 from the line.
Score: 56-45

[00:47] Team_085 possession (Score: 56-45)
Giannis Johnson makes the Layup and draws the foul on Domantas Doncic! And-1! Giannis Johnson to the line for 1. [BONUS: 5 team fouls] (Domantas Doncic: 1 personal fouls)   FT 1/1: GOOD Giannis Johnson makes 1/1 from the line.
Score: 59-45

[00:34] Team_083 possession (Score: 59-45)
Damian Towns throws a bad pass out of bounds! TURNOVER! (dead ball)

[00:23] Team_085 possession (Score: 59-45)
Jalen Leonard attempts a 3Pt. Contested by Cole Simmons (5.2 feet, MAN). JALEN LEONARD MAKES IT! Assist: Giannis Johnson
Score: 62-45

[00:07] Team_083 possession (Score: 62-45)
Cole Simmons attempts a 3Pt. Contested by Jalen Leonard (4.4 feet, MAN). Cole Simmons misses. Rebound secured by Malcolm Beal.

================================================================================
                              2ND QUARTER COMPLETE                              
================================================================================

2ND QUARTER SCORE: Team_085 34, Team_083 21

BOX SCORE:
================================================================================

Team_085
--------------------------------------------------------------------------------
Player                MIN  PTS  REB  AST  TO      FG   FG%      3P   3P%
--------------------------------------------------------------------------------
Jalen Leonard           9    9    4    1   0   4/4   100.0     0/0   0.0
Malcolm Beal            9    6    4    2   0   3/6    50.0     0/0   0.0
Giannis Johnson         9    6    1    2   0   2/2   100.0     0/0   0.0
Jordan Morant           9    5    0    0   0   2/2   100.0     0/0   0.0
Collin Mobley          15    4    2    0   0   2/2   100.0     0/0   0.0
Paul Wagner            15    2    0    0   0   1/1   100.0     0/0   0.0
Stephen Bird           15    2    0    0   0   1/1   100.0     0/0   0.0
Larry Duncan           15    0    1    1   0   0/2     0.0     0/0   0.0
Magic Beal             15    0    0    1   0   0/0     0.0     0/0   0.0
Khris Brogdon           9    0    0    1   0   0/1     0.0     0/0   0.0

TEAM: FG: 15/21 (71.4%), 3PT: 2/6 (33.3%), REB: 11 (2 off, 9 def), AST: 8, TO: 2
TEAM FOULS: 7 [Team_083 in BONUS]


Team_083
--------------------------------------------------------------------------------
Player                MIN  PTS  REB  AST  TO      FG   FG%      3P   3P%
--------------------------------------------------------------------------------
Damian Towns            9    5    2    0   0   2/4    50.0     0/0   0.0
Domantas Doncic         9    4    0    0   0   2/2   100.0     0/0   0.0
Victor McCollum         9    4    2    0   0   2/3    66.7     0/0   0.0
Yao Oladipo            15    3    1    0   0   1/2    50.0     0/0   0.0
Malcolm Brogdon        15    2    0    0   0   1/2    50.0     0/0   0.0
Cole Simmons            9    2    1    0   0   1/4    25.0     0/0   0.0
Kyrie Griffin          15    0    1    0   0   0/0     0.0     0/0   0.0
Bradley Thompson       15    0    1    0   0   0/1     0.0     0/0   0.0
Zion Markkanen          9    0    0    2   0   0/1     0.0     0/0   0.0

TEAM: FG: 9/19 (47.4%), 3PT: 2/8 (25.0%), REB: 9 (3 off, 6 def), AST: 2, TO: 4
TEAM FOULS: 5 [Team_085 in BONUS]

================================================================================

================================================================================
                       3RD QUARTER - Team_085 vs Team_083                       
================================================================================

[12:00] Team_085 possession (Score: 62-45)
Paul Wagner attempts a Midrange. Contested by Kyrie Griffin (3.7 feet, MAN). PAUL WAGNER MAKES IT!
Score: 64-45

[11:47] Team_083 possession (Score: 64-45)
Kyrie Griffin loses the ball! Stripped by Paul Wagner! TURNOVER! (live ball)

[11:28] Team_085 possession (Score: 64-45)
Collin Mobley drives to the basket... FOUL! Offensive foul on Collin Mobley! Kyrie Griffin drew the charge! [Team fouls: 1] (Collin Mobley: 1 personal fouls) TURNOVER! (dead ball)

[11:19] Team_083 possession (Score: 64-45)
Malcolm Brogdon drives and kicks out. Bradley Thompson attempts a 3Pt. Contested by Magic Beal (4.0 feet, ZONE). Bradley Thompson misses. Rebound secured by Paul Wagner.

[11:05] Team_085 possession (Score: 64-45)
Larry Duncan attempts a 3Pt. Contested by Yao Oladipo (3.7 feet, MAN). Larry Duncan misses. Rebound secured by Bradley Thompson.

[10:54] Team_083 possession (Score: 64-45)
Yao Oladipo makes the Layup and draws the foul on Larry Duncan! And-1! Yao Oladipo to the line for 1. [Team fouls: 2] (Larry Duncan: 1 personal fouls)   FT 1/1: GOOD Yao Oladipo makes 1/1 from the line.
Score: 64-48

[10:44] Team_085 possession (Score: 64-48)
FOUL! Shooting foul on Yao Oladipo. Larry Duncan to the line for 2 free throws. [Team fouls: 1] (Yao Oladipo: 1 personal fouls)   FT 1/2: GOOD   FT 2/2: GOOD Larry Duncan makes 2/2 from the line.
Score: 66-48

[10:28] Team_083 possession (Score: 66-48)
Malcolm Brogdon attempts a Layup. BLOCKED BY PAUL WAGNER! Ball is loose! Offensive rebound by Bradley Thompson! Bradley Thompson kicks it out.

[10:09] Team_083 possession (Score: 66-48)
Malcolm Brogdon attempts a 3Pt. Contested by Magic Beal (3.6 feet, MAN). Malcolm Brogdon misses. Offensive rebound by Bradley Thompson! Bradley Thompson puts it back in!
Score: 66-50

[09:57] Team_085 possession (Score: 66-50)
Magic Beal attempts a 3Pt. Contested by Kyrie Griffin (3.8 feet, ZONE). Magic Beal misses. Rebound secured by Yao Oladipo.

[09:42] Team_083 possession (Score: 66-50)
Yao Oladipo attempts a 3Pt. Contested by Magic Beal (4.3 feet, ZONE). Yao Oladipo misses. Rebound secured by Larry Duncan.

[09:30] Team_085 possession (Score: 66-50)
Larry Duncan attempts a 3Pt. Contested by Kyrie Griffin (3.8 feet, ZONE). LARRY DUNCAN MAKES IT! Assist: Paul Wagner
Score: 69-50

[09:17] Team_083 possession (Score: 69-50)
Karl Jokic attempts a 3Pt. Contested by Stephen Bird (3.9 feet, MAN). Karl Jokic misses. FOUL! Loose ball foul on Paul Wagner during the rebound battle. [Team fouls: 3] No free throws, side out. (Paul Wagner: 1 personal fouls)

[09:06] Team_083 possession (Score: 69-50)
Malcolm Brogdon attempts a 3Pt. Contested by Magic Beal (3.6 feet, MAN). Malcolm Brogdon misses. Offensive rebound by Kyrie Griffin! Kyrie Griffin kicks it out.

[08:48] Team_083 possession (Score: 69-50)
Malcolm Brogdon attempts a 3Pt. Contested by Magic Beal (3.6 feet, MAN). Malcolm Brogdon misses. Rebound secured by Collin Mobley.

[08:32] Team_085 possession (Score: 69-50)
FOUL! Shooting foul on Karl Jokic. Stephen Bird to the line for 2 free throws. [Team fouls: 2] (Karl Jokic: 1 personal fouls)   FT 1/2: GOOD   FT 2/2: GOOD Stephen Bird makes 2/2 from the line.
Score: 71-50

[08:19] Team_083 possession (Score: 71-50)
Kyrie Griffin attempts a Midrange. Contested by Stephen Bird (3.7 feet, ZONE). KYRIE GRIFFIN MAKES IT!
Score: 71-52

[08:00] Team_085 possession (Score: 71-52)
Magic Beal attempts a 3Pt. Contested by Yao Oladipo (3.8 feet, ZONE). Magic Beal misses. Rebound secured by Bradley Thompson.

[07:44] Team_083 possession (Score: 71-52)
Malcolm Brogdon attempts a 3Pt. Contested by Magic Beal (3.6 feet, MAN). Malcolm Brogdon misses. Rebound secured by Larry Duncan.

[07:29] Team_085 possession (Score: 71-52)
Paul Wagner attempts a 3Pt. Contested by Kyrie Griffin (3.7 feet, MAN). Paul Wagner misses. Offensive rebound by Paul Wagner! Paul Wagner kicks it out.

[07:15] Team_085 possession (Score: 71-52)
Collin Mobley drives, Kyrie Griffin stays with him. Collin Mobley attempts a Dunk. Contested by Kyrie Griffin (3.3 feet, ZONE). Collin Mobley misses. Rebound secured by Bradley Thompson.

[06:58] Team_083 possession (Score: 71-52)
Kyrie Griffin drives, Paul Wagner stays with him. Kyrie Griffin attempts a Layup. Contested by Paul Wagner (3.8 feet, MAN). KYRIE GRIFFIN MAKES IT! Assist: Bradley Thompson
Score: 71-54

[06:43] Team_085 possession (Score: 71-54)
Paul Wagner attempts a 3Pt. Contested by Yao Oladipo (3.7 feet, ZONE). Paul Wagner misses. Rebound secured by Bradley Thompson.

[06:30] Team_083 possession (Score: 71-54)
Kyrie Griffin drives to the basket... Kyrie Griffin commits a violation (traveling/carry)! TURNOVER! (dead ball)

[06:17] Team_085 possession (Score: 71-54)
FOUL! Reach-in foul on Bradley Thompson during the drive. [Team fouls: 3] No free throws, side out. (Bradley Thompson: 1 personal fouls)

[06:03] Team_085 possession (Score: 71-54)
Collin Mobley drives and kicks out. Larry Duncan attempts a 3Pt. Contested by Yao Oladipo (3.4 feet, ZONE). Larry Duncan misses. Rebound secured by Kyrie Griffin.

[05:47] Team_083 possession (Score: 71-54)
FOUL! Shooting foul on Collin Mobley. Bradley Thompson to the line for 2 free throws. [Team fouls: 4] (Collin Mobley: 2 personal fouls)   FT 1/2: GOOD   FT 2/2: GOOD Bradley Thompson makes 2/2 from the line.
Score: 71-56

[05:32] Team_085 possession (Score: 71-56)
Larry Duncan attempts a Layup. Contested by Yao Oladipo (3.7 feet, MAN). Larry Duncan misses. Rebound secured by Kyrie Griffin.

[05:17] Team_083 possession (Score: 71-56)
Kyrie Griffin attempts a 3Pt. Contested by Larry Duncan (3.4 feet, ZONE). KYRIE GRIFFIN MAKES IT! Assist: Malcolm Brogdon
Score: 71-59

[05:01] Team_085 possession (Score: 71-59)
Paul Wagner attempts a 3Pt. Contested by Kyrie Griffin (3.7 feet, MAN). Paul Wagner misses. Offensive rebound by Paul Wagner! Paul Wagner kicks it out.

[04:46] Team_085 possession (Score: 71-59)
Paul Wagner drives, Kyrie Griffin stays with him. Paul Wagner attempts a Dunk. Contested by Kyrie Griffin (3.7 feet, MAN). PAUL WAGNER MAKES IT! Assist: Stephen Bird
Score: 73-59

[04:28] Team_083 possession (Score: 73-59)
Karl Jokic attempts a Layup. Contested by Paul Wagner (4.0 feet, ZONE). KARL JOKIC MAKES IT! Assist: Malcolm Brogdon
Score: 73-61

[04:14] Team_085 possession (Score: 73-61)
Paul Wagner attempts a Dunk. BLOCKED BY KYRIE GRIFFIN! Ball is loose! Rebound secured by Kyrie Griffin.

[03:55] Team_083 possession (Score: 73-61)
Karl Jokic makes the Layup and draws the foul on Magic Beal! And-1! Karl Jokic to the line for 1. [BONUS: 5 team fouls] (Magic Beal: 1 personal fouls)   FT 1/1: GOOD Karl Jokic makes 1/1 from the line.
Score: 73-64

[03:45] Team_085 possession (Score: 73-64)
Larry Duncan attempts a 3Pt. Contested by Yao Oladipo (3.8 feet, ZONE). LARRY DUNCAN MAKES IT! Assist: Collin Mobley
Score: 76-64

[03:30] Team_083 possession (Score: 76-64)
Malcolm Brogdon attempts a 3Pt. Contested by Magic Beal (3.8 feet, MAN). MALCOLM BROGDON MAKES IT! Assist: Yao Oladipo
Score: 76-67

[03:15] Team_085 possession (Score: 76-67)
Collin Mobley attempts a Layup. Contested by Kyrie Griffin (3.5 feet, ZONE). Collin Mobley misses. Rebound secured by Bradley Thompson.

[03:02] Team_083 possession (Score: 76-67)
Yao Oladipo drives to the basket... Yao Oladipo loses the ball! Stripped by Larry Duncan! TURNOVER! (live ball)

[02:45] Team_085 possession (Score: 76-67)
FOUL! Shooting foul on Kyrie Griffin. Stephen Bird to the line for 2 free throws. [Team fouls: 4] (Kyrie Griffin: 1 personal fouls)   FT 1/2: GOOD   FT 2/2: MISS Stephen Bird makes 1/2 from the line. Rebound secured by Kyrie Griffin.
Score: 77-67

[02:31] Team_083 possession (Score: 77-67)
Kyrie Griffin drives, picks up Paul Wagner. Help arrives from Magic Beal! Kyrie Griffin attempts a Dunk. Contested by Magic Beal (4.0 feet, ZONE). KYRIE GRIFFIN MAKES IT! Assist: Yao Oladipo
Score: 77-69

[02:15] Team_085 possession (Score: 77-69)
Larry Duncan attempts a Midrange. Contested by Yao Oladipo (4.0 feet, ZONE). LARRY DUNCAN MAKES IT!
Score: 79-69

[01:59] Team_083 possession (Score: 79-69)
Karl Jokic attempts a Layup. BLOCKED BY PAUL WAGNER! Ball is loose! Rebound secured by Larry Duncan.

[01:47] Team_085 possession (Score: 79-69)
Collin Mobley attempts a Midrange. Contested by Kyrie Griffin (3.7 feet, ZONE). Collin Mobley misses. Rebound secured by Kyrie Griffin.

[01:33] Team_083 possession (Score: 79-69)
Kyrie Griffin makes the Dunk and draws the foul on Magic Beal! And-1! Kyrie Griffin to the line for 1. [BONUS: 6 team fouls] (Magic Beal: 2 personal fouls)   FT 1/1: GOOD Kyrie Griffin makes 1/1 from the line.
Score: 79-72

[01:17] Team_085 possession (Score: 79-72)
Paul Wagner drives, Kyrie Griffin stays with him. Paul Wagner attempts a Dunk. Contested by Kyrie Griffin (4.1 feet, MAN). PAUL WAGNER MAKES IT!
Score: 81-72

[01:04] Team_083 possession (Score: 81-72)
Kyrie Griffin attempts a Midrange. Contested by Paul Wagner (4.1 feet, MAN). Kyrie Griffin misses. Rebound secured by Paul Wagner.

[00:49] Team_085 possession (Score: 81-72)
Paul Wagner attempts a Layup. Contested by Kyrie Griffin (4.2 feet, ZONE). PAUL WAGNER MAKES IT! Assist: Stephen Bird
Score: 83-72

[00:34] Team_083 possession (Score: 83-72)
Malcolm Brogdon attempts a 3Pt. Contested by Magic Beal (4.1 feet, MAN). Malcolm Brogdon misses. Rebound secured by Larry Duncan.

[00:18] Team_085 possession (Score: 83-72)
Collin Mobley drives, picks up Bradley Thompson. Help arrives from Karl Jokic! Collin Mobley attempts a Dunk. Contested by Karl Jokic (4.1 feet, ZONE). COLLIN MOBLEY MAKES IT! Assist: Paul Wagner
Score: 85-72

================================================================================
                              3RD QUARTER COMPLETE                              
================================================================================

3RD QUARTER SCORE: Team_085 23, Team_083 27

BOX SCORE:
================================================================================

Team_085
--------------------------------------------------------------------------------
Player                MIN  PTS  REB  AST  TO      FG   FG%      3P   3P%
--------------------------------------------------------------------------------
Larry Duncan           27   10    4    0   0   4/6    66.7     0/0   0.0
Paul Wagner            27    8    4    2   0   4/6    66.7     0/0   0.0
Collin Mobley          27    2    1    1   0   1/5    20.0     0/0   0.0
Stephen Bird           27    2    0    2   0   1/2    50.0     0/0   0.0
Magic Beal             27    0    0    0   0   0/2     0.0     0/0   0.0

TEAM: FG: 10/21 (47.6%), 3PT: 2/6 (33.3%), REB: 9 (2 off, 7 def), AST: 5, TO: 1
TEAM FOULS: 6 [Team_083 in BONUS]


Team_083
--------------------------------------------------------------------------------
Player                MIN  PTS  REB  AST  TO      FG   FG%      3P   3P%
--------------------------------------------------------------------------------
Kyrie Griffin          27   12    7    0   0   5/6    83.3     0/0   0.0
Karl Jokic             27    5    0    0   0   2/3    66.7     0/0   0.0
Bradley Thompson       27    4    7    1   0   2/2   100.0     0/0   0.0
Malcolm Brogdon        27    3    0    2   0   1/5    20.0     0/0   0.0
Yao Oladipo            27    3    1    2   0   1/2    50.0     0/0   0.0

TEAM: FG: 11/18 (61.1%), 3PT: 3/7 (42.9%), REB: 15 (4 off, 11 def), AST: 5, TO: 3
TEAM FOULS: 4

================================================================================

================================================================================
                       4TH QUARTER - Team_085 vs Team_083                       
================================================================================

[12:00] Team_085 possession (Score: 85-72)
FOUL! Holding foul on Malcolm Brogdon. [Team fouls: 1] No free throws, side out. (Malcolm Brogdon: 1 personal fouls)

[11:48] Team_085 possession (Score: 85-72)
Collin Mobley attempts a 3Pt. Contested by Yao Oladipo (3.5 feet, ZONE). Collin Mobley misses. Rebound secured by Yao Oladipo.

[11:34] Team_083 possession (Score: 85-72)
Yao Oladipo drives and kicks out. Kyrie Griffin attempts a 3Pt. Contested by Paul Wagner (3.8 feet, MAN). Kyrie Griffin misses. Rebound secured by Larry Duncan.

[11:16] Team_085 possession (Score: 85-72)
Magic Beal attempts a 3Pt. Contested by Malcolm Brogdon (5.5 feet, MAN). Magic Beal misses. Rebound secured by Yao Oladipo.

[11:00] Team_083 possession (Score: 85-72)
Karl Jokic drives, Stephen Bird stays with him. Karl Jokic attempts a Layup. Contested by Stephen Bird (4.4 feet, MAN). Karl Jokic misses. Rebound secured by Collin Mobley.

[10:46] Team_085 possession (Score: 85-72)
FOUL! Holding foul on Kyrie Griffin. [Team fouls: 2] No free throws, side out. (Kyrie Griffin: 1 personal fouls)

[10:28] Team_085 possession (Score: 85-72)
FOUL! Shooting foul on Karl Jokic. Larry Duncan to the line for 2 free throws. [Team fouls: 3] (Karl Jokic: 1 personal fouls)   FT 1/2: GOOD   FT 2/2: GOOD Larry Duncan makes 2/2 from the line.
Score: 87-72

[10:10] Team_083 possession (Score: 87-72)
Malcolm Brogdon drives, picks up Paul Wagner. Help arrives from Magic Beal! Malcolm Brogdon attempts a Layup. Contested by Magic Beal (3.5 feet, ZONE). Malcolm Brogdon misses. Rebound secured by Larry Duncan.

[09:55] Team_085 possession (Score: 87-72)
Paul Wagner attempts a 3Pt. Contested by Kyrie Griffin (4.3 feet, MAN). Paul Wagner misses. Offensive rebound by Larry Duncan! Larry Duncan kicks it out.

[09:41] Team_085 possession (Score: 87-72)
Larry Duncan makes the Layup and draws the foul on Yao Oladipo! And-1! Larry Duncan to the line for 1. [Team fouls: 4] (Yao Oladipo: 1 personal fouls)   FT 1/1: MISS Larry Duncan makes 0/1 from the line. Rebound secured by Yao Oladipo.
Score: 89-72

[09:28] Team_083 possession (Score: 89-72)
Bradley Thompson attempts a Midrange. Contested by Larry Duncan (3.7 feet, ZONE). Bradley Thompson misses. Rebound secured by Paul Wagner.

[09:11] Team_085 possession (Score: 89-72)
FOUL! Reach-in foul on Kyrie Griffin during the drive. [IN THE BONUS! 5 team fouls] Magic Beal to the line for 2 free throws. (Kyrie Griffin: 2 personal fouls)   FT 1/2: GOOD   FT 2/2: MISS Magic Beal makes 1/2 from the line. Rebound secured by Kyrie Griffin.
Score: 90-72

[08:58] Team_083 possession (Score: 90-72)
Malcolm Brogdon attempts a 3Pt. Contested by Magic Beal (4.3 feet, ZONE). Malcolm Brogdon misses. Rebound secured by Larry Duncan.

[08:40] Team_085 possession (Score: 90-72)
Collin Mobley makes the Layup and draws the foul on Bradley Thompson! And-1! Collin Mobley to the line for 1. [BONUS: 6 team fouls] (Bradley Thompson: 1 personal fouls)   FT 1/1: GOOD Collin Mobley makes 1/1 from the line.
Score: 93-72

[08:25] Team_083 possession (Score: 93-72)
Malcolm Brogdon attempts a Midrange. Contested by Stephen Bird (3.9 feet, ZONE). Malcolm Brogdon misses. Rebound secured by Collin Mobley.

[08:13] Team_085 possession (Score: 93-72)
Stephen Bird makes the Layup and draws the foul on Kyrie Griffin! And-1! Stephen Bird to the line for 1. [BONUS: 7 team fouls] (Kyrie Griffin: 3 personal fouls)   FT 1/1: GOOD Stephen Bird makes 1/1 from the line.
Score: 96-72

[07:56] Team_083 possession (Score: 96-72)
Kyrie Griffin attempts a Midrange. Contested by Paul Wagner (4.4 feet, MAN). KYRIE GRIFFIN MAKES IT! Assist: Malcolm Brogdon
Score: 96-74

[07:40] Team_085 possession (Score: 96-74)
Larry Duncan attempts a Layup. Contested by Kyrie Griffin (4.6 feet, ZONE). LARRY DUNCAN MAKES IT! Assist: Stephen Bird
Score: 98-74

[07:25] Team_083 possession (Score: 98-74)
Malcolm Brogdon attempts a 3Pt. Contested by Magic Beal (4.5 feet, MAN). Malcolm Brogdon misses. Rebound secured by Larry Duncan.

[07:12] Team_085 possession (Score: 98-74)
Larry Duncan throws a bad pass out of bounds! TURNOVER! (dead ball)

[07:12] Substitution (Team_085): Magic Beal OUT → Khris Brogdon IN (stamina_rule2)

[07:12] Substitution (Team_085): Stephen Bird OUT → Jordan Morant IN (stamina_rule2)

[07:12] Substitution (Team_085): Larry Duncan OUT → Giannis Johnson IN (stamina_rule2)

[07:12] Substitution (Team_085): Paul Wagner OUT → Jalen Leonard IN (stamina_rule2)

[07:12] Substitution (Team_085): Collin Mobley OUT → Malcolm Beal IN (stamina_rule2)

[07:12] Substitution (Team_083): Malcolm Brogdon OUT → Zion Markkanen IN (stamina_rule2)

[07:12] Substitution (Team_083): Karl Jokic OUT → Damian Towns IN (stamina_rule2)

[07:12] Substitution (Team_083): Yao Oladipo OUT → Domantas Doncic IN (stamina_rule2)

[07:12] Substitution (Team_083): Kyrie Griffin OUT → Cole Simmons IN (stamina_rule2)

[07:12] Substitution (Team_083): Bradley Thompson OUT → Victor McCollum IN (stamina_rule2)

[07:02] Team_083 possession (Score: 98-74)
Domantas Doncic makes the Dunk and draws the foul on Giannis Johnson! And-1! Domantas Doncic to the line for 1. [Team fouls: 1] (Giannis Johnson: 1 personal fouls)   FT 1/1: GOOD Domantas Doncic makes 1/1 from the line.
Score: 98-77

[06:52] Team_085 possession (Score: 98-77)
FOUL! Offensive foul on Giannis Johnson! Domantas Doncic drew the charge! [Team fouls: 2] (Giannis Johnson: 2 personal fouls) TURNOVER! (dead ball)

[06:41] Team_083 possession (Score: 98-77)
Domantas Doncic drives, picks up Malcolm Beal. Help arrives from Jordan Morant! Domantas Doncic attempts a Layup. Contested by Jordan Morant (4.5 feet, ZONE). Domantas Doncic misses. Offensive rebound by Victor McCollum! Victor McCollum puts it back in!
Score: 98-79

[06:27] Team_085 possession (Score: 98-79)
Jordan Morant attempts a Layup. BLOCKED BY VICTOR MCCOLLUM! Ball is loose! Rebound secured by Victor McCollum.

[06:13] Team_083 possession (Score: 98-79)
Zion Markkanen attempts a Midrange. Contested by Jalen Leonard (4.3 feet, ZONE). Zion Markkanen misses. Rebound secured by Giannis Johnson.

[06:02] Team_085 possession (Score: 98-79)
FOUL! Shooting foul on Damian Towns. Jordan Morant to the line for 2 free throws. [BONUS: 8 team fouls] (Damian Towns: 1 personal fouls)   FT 1/2: GOOD   FT 2/2: GOOD Jordan Morant makes 2/2 from the line.
Score: 100-79

[05:49] Team_083 possession (Score: 100-79)
Domantas Doncic attempts a 3Pt. Contested by Giannis Johnson (6.0 feet, MAN). Domantas Doncic misses. Offensive rebound by Damian Towns! Damian Towns kicks it out.

[05:34] Team_083 possession (Score: 100-79)
FOUL! Offensive foul on Zion Markkanen! Khris Brogdon drew the charge! [Team fouls: 9] (Zion Markkanen: 1 personal fouls) TURNOVER! (dead ball)

[05:21] Team_085 possession (Score: 100-79)
Jalen Leonard attempts a 3Pt. Contested by Zion Markkanen (5.7 feet, ZONE). Jalen Leonard misses. Rebound secured by Damian Towns.

[05:04] Team_083 possession (Score: 100-79)
FOUL! Shooting foul on Khris Brogdon. Zion Markkanen to the line for 2 free throws. [Team fouls: 3] (Khris Brogdon: 1 personal fouls)   FT 1/2: GOOD   FT 2/2: GOOD Zion Markkanen makes 2/2 from the line.
Score: 100-81

[04:50] Team_085 possession (Score: 100-81)
Khris Brogdon attempts a 3Pt. Contested by Zion Markkanen (5.2 feet, ZONE). Khris Brogdon misses. Rebound secured by Victor McCollum.

[04:38] Team_083 possession (Score: 100-81)
FOUL! Holding foul on Jordan Morant. [Team fouls: 4] No free throws, side out. (Jordan Morant: 1 personal fouls)

[04:24] Team_083 possession (Score: 100-81)
Domantas Doncic attempts a Layup. BLOCKED BY GIANNIS JOHNSON! Ball is loose! Rebound secured by Giannis Johnson.

[04:08] Team_085 possession (Score: 100-81)
FOUL! Shooting foul on Cole Simmons. Jalen Leonard to the line for 2 free throws. [BONUS: 10 team fouls] (Cole Simmons: 1 personal fouls)   FT 1/2: GOOD   FT 2/2: MISS Jalen Leonard makes 1/2 from the line. Rebound secured by Damian Towns.
Score: 101-81

[03:54] Team_083 possession (Score: 101-81)
Victor McCollum makes the Layup and draws the foul on Malcolm Beal! And-1! Victor McCollum to the line for 1. [BONUS: 5 team fouls] (Malcolm Beal: 1 personal fouls)   FT 1/1: GOOD Victor McCollum makes 1/1 from the line.
Score: 101-84

[03:41] Team_085 possession (Score: 101-84)
Jordan Morant throws a bad pass out of bounds! TURNOVER! (dead ball)

[03:26] Team_083 possession (Score: 101-84)
FOUL! Shooting foul on Malcolm Beal. Cole Simmons to the line for 2 free throws. [BONUS: 6 team fouls] (Malcolm Beal: 2 personal fouls)   FT 1/2: GOOD   FT 2/2: GOOD Cole Simmons makes 2/2 from the line.
Score: 101-86

[03:09] Team_085 possession (Score: 101-86)
Khris Brogdon attempts a Midrange. Contested by Zion Markkanen (5.2 feet, MAN). Khris Brogdon misses. Rebound secured by Cole Simmons.

[02:56] Team_083 possession (Score: 101-86)
Domantas Doncic drives, picks up Giannis Johnson. Help arrives from Jordan Morant! Domantas Doncic attempts a Layup. Contested by Jordan Morant (6.0 feet, MAN). DOMANTAS DONCIC MAKES IT! Assist: Zion Markkanen
Score: 101-88

[02:43] Team_085 possession (Score: 101-88)
Jalen Leonard attempts a Layup. Contested by Victor McCollum (4.3 feet, ZONE). Jalen Leonard misses. Rebound secured by Victor McCollum.

[02:28] Team_083 possession (Score: 101-88)
FOUL! Shooting foul on Malcolm Beal. Victor McCollum to the line for 2 free throws. [BONUS: 7 team fouls] (Malcolm Beal: 3 personal fouls)   FT 1/2: GOOD   FT 2/2: GOOD Victor McCollum makes 2/2 from the line.
Score: 101-90

[02:15] Team_085 possession (Score: 101-90)
Khris Brogdon attempts a 3Pt. Contested by Domantas Doncic (4.3 feet, ZONE). Khris Brogdon misses. FOUL! Loose ball foul on Victor McCollum during the rebound battle. [IN THE BONUS! 11 team fouls] Jalen Leonard to the line for 2 free throws. (Victor McCollum: 1 personal fouls)   FT 1/2: GOOD   FT 2/2: GOOD Jalen Leonard makes 2/2 from the line.
Score: 103-90

[02:04] Team_083 possession (Score: 103-90)
FOUL! Reach-in foul on Malcolm Beal during the drive. [IN THE BONUS! 8 team fouls] Victor McCollum to the line for 2 free throws. (Malcolm Beal: 4 personal fouls)   FT 1/2: GOOD   FT 2/2: GOOD Victor McCollum makes 2/2 from the line.
Score: 103-92

[01:50] Team_085 possession (Score: 103-92)
Giannis Johnson attempts a Midrange. Contested by Damian Towns (4.9 feet, ZONE). GIANNIS JOHNSON MAKES IT!
Score: 105-92

[01:37] Team_083 possession (Score: 105-92)
Cole Simmons drives to the basket... FOUL! Offensive foul on Cole Simmons! Malcolm Beal drew the charge! [Team fouls: 12] (Cole Simmons: 2 personal fouls) TURNOVER! (dead ball)

[01:21] Team_085 possession (Score: 105-92)
FOUL! Holding foul on Zion Markkanen. [IN THE BONUS! 13 team fouls] Khris Brogdon to the line for 2 free throws. (Zion Markkanen: 2 personal fouls)   FT 1/2: GOOD   FT 2/2: MISS Khris Brogdon makes 1/2 from the line. Rebound secured by Damian Towns.
Score: 106-92

[01:07] Team_083 possession (Score: 106-92)
Cole Simmons attempts a Layup. Contested by Malcolm Beal (4.3 feet, ZONE). COLE SIMMONS MAKES IT!
Score: 106-94

[00:50] Team_085 possession (Score: 106-94)
Khris Brogdon attempts a Midrange. Contested by Zion Markkanen (5.2 feet, MAN). Khris Brogdon misses. Rebound secured by Damian Towns.

[00:36] Team_083 possession (Score: 106-94)
FOUL! Holding foul on Giannis Johnson. [IN THE BONUS! 9 team fouls] Domantas Doncic to the line for 2 free throws. (Giannis Johnson: 3 personal fouls)   FT 1/2: MISS   FT 2/2: GOOD Domantas Doncic makes 1/2 from the line.
Score: 106-95

[00:23] Team_085 possession (Score: 106-95)
FOUL! Shooting foul on Victor McCollum. Khris Brogdon to the line for 2 free throws. [BONUS: 14 team fouls] (Victor McCollum: 2 personal fouls)   FT 1/2: GOOD   FT 2/2: GOOD Khris Brogdon makes 2/2 from the line.
Score: 108-95

[00:12] Team_083 possession (Score: 108-95)
Domantas Doncic drives, Giannis Johnson stays with him. Domantas Doncic attempts a Layup. Wide open! Giannis Johnson is 6.0 feet away. [MAN] DOMANTAS DONCIC MAKES IT! Assist: Zion Markkanen
Score: 108-97

================================================================================
                              4TH QUARTER COMPLETE                              
================================================================================

4TH QUARTER SCORE: Team_085 23, Team_083 25

BOX SCORE:
================================================================================

Team_085
--------------------------------------------------------------------------------
Player                MIN  PTS  REB  AST  TO      FG   FG%      3P   3P%
--------------------------------------------------------------------------------
Larry Duncan           32    4    5    0   0   2/3    66.7     0/0   0.0
Collin Mobley          32    3    2    0   0   1/2    50.0     0/0   0.0
Stephen Bird           32    3    0    1   0   1/1   100.0     0/0   0.0
Jordan Morant          16    2    0    0   0   1/2    50.0     0/0   0.0
Giannis Johnson        16    2    2    0   0   1/1   100.0     0/0   0.0
Jalen Leonard          16    2    0    0   0   1/4    25.0     0/0   0.0
Khris Brogdon          16    2    0    0   0   1/4    25.0     0/0   0.0
Magic Beal             32    0    0    0   0   0/2     0.0     0/0   0.0
Paul Wagner            32    0    1    0   0   0/0     0.0     0/0   0.0

TEAM: FG: 8/20 (40.0%), 3PT: 1/5 (20.0%), REB: 10 (1 off, 9 def), AST: 1, TO: 3
TEAM FOULS: 9 [Team_083 in BONUS]


Team_083
--------------------------------------------------------------------------------
Player                MIN  PTS  REB  AST  TO      FG   FG%      3P   3P%
--------------------------------------------------------------------------------
Victor McCollum        16    9    4    0   0   4/4   100.0     0/0   0.0
Domantas Doncic        16    8    0    0   0   4/5    80.0     0/0   0.0
Cole Simmons           16    4    1    0   0   2/2   100.0     0/0   0.0
Kyrie Griffin          32    2    1    0   0   1/1   100.0     0/0   0.0
Zion Markkanen         16    2    0    2   0   1/2    50.0     0/0   0.0
Yao Oladipo            32    0    3    0   0   0/1     0.0     0/0   0.0
Karl Jokic             32    0    0    0   0   0/1     0.0     0/0   0.0
Malcolm Brogdon        32    0    0    1   0   0/4     0.0     0/0   0.0
Bradley Thompson       32    0    0    0   0   0/1     0.0     0/0   0.0
Damian Towns           16    0    5    0   0   0/0     0.0     0/0   0.0

TEAM: FG: 12/21 (57.1%), 3PT: 0/2 (0.0%), REB: 14 (2 off, 12 def), AST: 3, TO: 2
TEAM FOULS: 14 [Team_085 in BONUS]

================================================================================

================================================================================
                               FULL GAME COMPLETE                               
================================================================================

FINAL SCORE: Team_085 108, Team_083 97

SCORING BY QUARTER:
--------------------------------------------------------------------------------
Team                     Q1     Q2     Q3     Q4    FINAL
--------------------------------------------------------------------------------
Team_085                 28     34     23     23      108
Team_083                 24     21     27     25       97
--------------------------------------------------------------------------------

FULL GAME BOX SCORE:
================================================================================

Team_085
--------------------------------------------------------------------------------
Player                MIN  PTS  REB  AST  TO      FG   FG%      3P   3P%      FT STL BLK
--------------------------------------------------------------------------------
Magic Beal             32    0    0    2   0   1/7    14.3   0/5     0.0   1/2     0   0
Stephen Bird           32   17    0    4   0   6/7    85.7   2/2   100.0   4/5     1   0
Larry Duncan           32   21   16    4   3  10/17   58.8   2/7    28.6   4/5     1   0
Paul Wagner            32   15    8    3   1   6/11   54.5   1/5    20.0   3/4     2   3
Collin Mobley          32   14    7    2   1   6/11   54.5   0/1     0.0   4/4     0   0
Khris Brogdon          16    2    0    1   0   2/6    33.3   1/3    33.3   3/4     0   0
Jordan Morant          16    7    0    0   2   3/4    75.0   0/0     0.0   3/3     0   0
Giannis Johnson        16    8    3    2   1   4/4   100.0   1/1   100.0   1/1     0   1
Jalen Leonard          16   11    4    1   1   4/7    57.1   1/2    50.0   3/4     0   0
Malcolm Beal           16    6    4    2   0   2/5    40.0   0/1     0.0   0/0     0   0

TEAM: FG: 44/80 (55.0%), 3PT: 8/27 (29.6%), REB: 41 (9 off, 32 def), AST: 21, TO: 9


Team_083
--------------------------------------------------------------------------------
Player                MIN  PTS  REB  AST  TO      FG   FG%      3P   3P%      FT STL BLK
--------------------------------------------------------------------------------
Malcolm Brogdon        32   12    0    3   0   6/16   37.5   3/9    33.3   2/2     0   0
Karl Jokic             32   10    0    1   1   4/8    50.0   1/3    33.3   4/4     0   0
Yao Oladipo            32   14    7    2   1   5/8    62.5   2/4    50.0   5/5     1   0
Kyrie Griffin          32   16   13    2   3   7/11   63.6   1/3    33.3   1/1     1   1
Bradley Thompson       32    6    9    3   1   2/6    33.3   0/0     0.0   3/4     1   0
Zion Markkanen         16    2    0    4   1   1/3    33.3   0/1     0.0   2/2     0   1
Damian Towns           16    5    7    0   3   2/4    50.0   1/2    50.0   2/2     0   0
Domantas Doncic        16   12    0    0   1   6/7    85.7   0/0     0.0   4/5     0   0
Cole Simmons           16    6    2    0   0   3/6    50.0   0/2     0.0   2/2     0   0
Victor McCollum        16   13    6    0   0   4/5    80.0   0/0     0.0   5/5     0   1

TEAM: FG: 42/76 (55.3%), 3PT: 8/24 (33.3%), REB: 45 (9 off, 36 def), AST: 15, TO: 11

================================================================================
