================================================================================
                        FULL GAME - Team_100 vs Team_087                        
================================================================================

================================================================================
                       1ST QUARTER - Team_100 vs Team_087                       
================================================================================

[12:00] Team_100 possession (Score: 0-0)
FOUL! Holding foul on Malcolm Embiid. [Team fouls: 1] No free throws, side out. (Malcolm Embiid: 1 personal fouls)

[11:43] Team_100 possession (Score: 0-0)
Tyler Griffin attempts a Midrange. BLOCKED BY JIMMY MING! Ball goes out off Jimmy Ming. Tyler Griffin's ball!

[11:29] Team_100 possession (Score: 0-0)
Manu Ball attempts a 3Pt. Contested by Jimmy Ming (4.9 feet, MAN). Manu Ball misses. Rebound secured by Ben Brogdon.

[11:17] Team_087 possession (Score: 0-0)
Jimmy Ming attempts a 3Pt. Wide open! Manu Ball is 6.8 feet away. [MAN] JIMMY MING MAKES IT! Assist: Malcolm Embiid
Score: 0-3

[11:05] Team_100 possession (Score: 0-3)
Pau LaVine attempts a 3Pt. Contested by Malcolm Embiid (3.4 feet, MAN). Pau LaVine misses. Offensive rebound by Chris Mobley! Chris Mobley kicks it out.

[10:55] Team_100 possession (Score: 0-3)
Manu Ball attempts a 3Pt. Contested by Allen Mitchell (4.8 feet, ZONE). Manu Ball misses. Rebound secured by Devin Anunoby.

[10:42] Team_087 possession (Score: 0-3)
Jimmy Ming drives, picks up Pau LaVine. Help arrives from Manu Ball! Jimmy Ming attempts a Layup. Contested by Manu Ball (5.2 feet, ZONE). JIMMY MING MAKES IT! Assist: Devin Anunoby
Score: 0-5

[10:24] Team_100 possession (Score: 0-5)
Luka Green drives, Allen Mitchell stays with him. Luka Green attempts a Dunk. Contested by Allen Mitchell (5.0 feet, MAN). LUKA GREEN MAKES IT! Assist: Manu Ball
Score: 2-5

[10:09] Team_087 possession (Score: 2-5)
Ben Brogdon attempts a 3Pt. Contested by Chris Mobley (5.5 feet, MAN). BEN BROGDON MAKES IT! Assist: Malcolm Embiid
Score: 2-8

[09:56] Team_100 possession (Score: 2-8)
Chris Mobley drives and kicks out. Pau LaVine attempts a Midrange. Contested by Malcolm Embiid (3.3 feet, MAN). Pau LaVine misses. Rebound secured by Ben Brogdon.

[09:42] Team_087 possession (Score: 2-8)
Devin Anunoby attempts a Layup. Contested by Tyler Griffin (5.0 feet, MAN). DEVIN ANUNOBY MAKES IT! Assist: Jimmy Ming
Score: 2-10

[09:24] Team_100 possession (Score: 2-10)
Tyler Griffin attempts a 3Pt. Contested by Devin Anunoby (4.6 feet, MAN). Tyler Griffin misses. Offensive rebound by Chris Mobley! Chris Mobley kicks it out.

[09:06] Team_100 possession (Score: 2-10)
Manu Ball attempts a 3Pt. Contested by Malcolm Embiid (3.4 feet, ZONE). Manu Ball misses. Offensive rebound by Chris Mobley! Chris Mobley kicks it out.

[08:55] Team_100 possession (Score: 2-10)
Chris Mobley makes the Dunk and draws the foul on Malcolm Embiid! And-1! Chris Mobley to the line for 1. [Team fouls: 2] (Malcolm Embiid: 2 personal fouls)   FT 1/1: GOOD Chris Mobley makes 1/1 from the line.
Score: 5-10

[08:36] Team_087 possession (Score: 5-10)
Ben Brogdon throws a bad pass! Stolen by Chris Mobley! TURNOVER! (live ball)

[08:19] Team_100 possession (Score: 5-10)
Manu Ball attempts a 3Pt. Contested by Allen Mitchell (4.8 feet, ZONE). MANU BALL MAKES IT! Assist: Tyler Griffin
Score: 8-10

[08:08] Team_087 possession (Score: 8-10)
Allen Mitchell attempts a 3Pt. Wide open! Manu Ball is 6.5 feet away. [ZONE] ALLEN MITCHELL MAKES IT! Assist: Jimmy Ming
Score: 8-13

[07:57] Team_100 possession (Score: 8-13)
Manu Ball attempts a 3Pt. Contested by Allen Mitchell (4.8 feet, ZONE). Manu Ball misses. Rebound secured by Malcolm Embiid.

[07:41] Team_087 possession (Score: 8-13)
Jimmy Ming commits a violation (traveling/carry)! TURNOVER! (dead ball)

[07:31] Team_100 possession (Score: 8-13)
Luka Green attempts a 3Pt. Contested by Allen Mitchell (5.0 feet, MAN). LUKA GREEN MAKES IT! Assist: Pau LaVine
Score: 11-13

[07:12] Team_087 possession (Score: 11-13)
Ben Brogdon attempts a Midrange. Contested by Pau LaVine (4.8 feet, ZONE). Ben Brogdon misses. Rebound secured by Pau LaVine.

[06:59] Team_100 possession (Score: 11-13)
Tyler Griffin attempts a 3Pt. Contested by Devin Anunoby (4.6 feet, ZONE). Tyler Griffin misses. Rebound secured by Devin Anunoby.

[06:43] Team_087 possession (Score: 11-13)
Jimmy Ming attempts a Midrange. Wide open! Manu Ball is 6.8 feet away. [MAN] JIMMY MING MAKES IT!
Score: 11-15

[06:29] Team_100 possession (Score: 11-15)
Tyler Griffin attempts a 3Pt. Contested by Allen Mitchell (5.0 feet, ZONE). TYLER GRIFFIN MAKES IT! Assist: Manu Ball
Score: 14-15

[06:12] Team_087 possession (Score: 14-15)
Jimmy Ming attempts a Midrange. Wide open! Manu Ball is 6.8 feet away. [MAN] Jimmy Ming misses. Rebound secured by Tyler Griffin.

[05:58] Team_100 possession (Score: 14-15)
Pau LaVine drives, picks up Malcolm Embiid. Help arrives from Jimmy Ming! Pau LaVine attempts a Layup. Contested by Jimmy Ming (3.4 feet, MAN). Pau LaVine misses. Rebound secured by Ben Brogdon.

[05:44] Team_087 possession (Score: 14-15)
Devin Anunoby makes the Layup and draws the foul on Manu Ball! And-1! Devin Anunoby to the line for 1. [Team fouls: 1] (Manu Ball: 1 personal fouls)   FT 1/1: GOOD Devin Anunoby makes 1/1 from the line.
Score: 14-18

[05:29] Team_100 possession (Score: 14-18)
Tyler Griffin attempts a Layup. Contested by Malcolm Embiid (3.6 feet, ZONE). TYLER GRIFFIN MAKES IT!
Score: 16-18

[05:09] Team_087 possession (Score: 16-18)
Malcolm Embiid attempts a 3Pt. Contested by Luka Green (5.6 feet, ZONE). Malcolm Embiid misses. Rebound secured by Tyler Griffin.

[04:56] Team_100 possession (Score: 16-18)
FOUL! Shooting foul on Jimmy Ming. Manu Ball to the line for 2 free throws. [Team fouls: 3] (Jimmy Ming: 1 personal fouls)   FT 1/2: GOOD   FT 2/2: GOOD Manu Ball makes 2/2 from the line.
Score: 18-18

[04:38] Team_087 possession (Score: 18-18)
Ben Brogdon drives, Chris Mobley stays with him. Ben Brogdon attempts a Layup. Contested by Chris Mobley (5.6 feet, MAN). BEN BROGDON MAKES IT! Assist: Devin Anunoby
Score: 18-20

[04:26] Team_100 possession (Score: 18-20)
Luka Green attempts a 3Pt. Contested by Allen Mitchell (5.0 feet, ZONE). LUKA GREEN MAKES IT!
Score: 21-20

[04:10] Team_087 possession (Score: 21-20)
Ben Brogdon drives and kicks out. FOUL! Shooting foul on Luka Green. Devin Anunoby to the line for 3 free throws. [Team fouls: 2] (Luka Green: 1 personal fouls)   FT 1/3: GOOD   FT 2/3: GOOD   FT 3/3: GOOD Devin Anunoby makes 3/3 from the line.
Score: 21-23

[03:54] Team_100 possession (Score: 21-23)
Luka Green attempts a Midrange. Contested by Allen Mitchell (5.0 feet, MAN). LUKA GREEN MAKES IT! Assist: Manu Ball
Score: 23-23

[03:36] Team_087 possession (Score: 23-23)
Allen Mitchell throws a bad pass out of bounds! TURNOVER! (dead ball)

[03:23] Team_100 possession (Score: 23-23)
Luka Green makes the 3Pt and draws the foul on Allen Mitchell! And-1! Luka Green to the line for 1. [Team fouls: 4] (Allen Mitchell: 1 personal fouls)   FT 1/1: GOOD Luka Green makes 1/1 from the line.
Score: 27-23

[03:05] Team_087 possession (Score: 27-23)
Jimmy Ming drives, Manu Ball stays with him. Jimmy Ming attempts a Layup. Wide open! Manu Ball is 6.9 feet away. [MAN] JIMMY MING MAKES IT!
Score: 27-25

[02:53] Team_100 possession (Score: 27-25)
FOUL! Shooting foul on Devin Anunoby. Tyler Griffin to the line for 2 free throws. [BONUS: 5 team fouls] (Devin Anunoby: 1 personal fouls)   FT 1/2: GOOD   FT 2/2: GOOD Tyler Griffin makes 2/2 from the line.
Score: 29-25

[02:38] Team_087 possession (Score: 29-25)
FOUL! Offensive foul on Devin Anunoby! Tyler Griffin drew the charge! [Team fouls: 6] (Devin Anunoby: 2 personal fouls) TURNOVER! (dead ball)

[02:23] Team_100 possession (Score: 29-25)
Pau LaVine drives and kicks out. Manu Ball attempts a 3Pt. Contested by Jimmy Ming (5.0 feet, MAN). MANU BALL MAKES IT! Assist: Chris Mobley
Score: 32-25

[02:07] Team_087 possession (Score: 32-25)
FOUL! Reach-in foul on Chris Mobley during the drive. [Team fouls: 3] No free throws, side out. (Chris Mobley: 1 personal fouls)

[01:53] Team_087 possession (Score: 32-25)
Jimmy Ming attempts a 3Pt. Wide open! Luka Green is 6.2 feet away. [ZONE] JIMMY MING MAKES IT! Assist: Ben Brogdon
Score: 32-28

[01:36] Team_100 possession (Score: 32-28)
Manu Ball attempts a 3Pt. Contested by Allen Mitchell (5.0 feet, ZONE). MANU BALL MAKES IT! Assist: Tyler Griffin
Score: 35-28

[01:26] Team_087 possession (Score: 35-28)
Allen Mitchell attempts a 3Pt. Contested by Luka Green (6.0 feet, ZONE). Allen Mitchell misses. Rebound secured by Chris Mobley.

[01:13] Team_100 possession (Score: 35-28)
FOUL! Reach-in foul on Malcolm Embiid during the drive. [IN THE BONUS! 7 team fouls] Pau LaVine to the line for 2 free throws. (Malcolm Embiid: 3 personal fouls)   FT 1/2: GOOD   FT 2/2: GOOD Pau LaVine makes 2/2 from the line.
Score: 37-28

[00:59] Team_087 possession (Score: 37-28)
Malcolm Embiid attempts a Layup. Contested by Chris Mobley (5.9 feet, ZONE). MALCOLM EMBIID MAKES IT! Assist: Allen Mitchell
Score: 37-30

[00:47] Team_100 possession (Score: 37-30)
Pau LaVine attempts a Layup. Contested by Malcolm Embiid (3.9 feet, MAN). PAU LAVINE MAKES IT! Assist: Manu Ball
Score: 39-30

[00:35] Team_087 possession (Score: 39-30)
Devin Anunoby attempts a 3Pt. Contested by Tyler Griffin (5.5 feet, MAN). Devin Anunoby misses. Offensive rebound by Malcolm Embiid! Malcolm Embiid kicks it out.

[00:24] Team_087 possession (Score: 39-30)
Devin Anunoby drives, Pau LaVine stays with him. Devin Anunoby attempts a Layup. Contested by Pau LaVine (5.2 feet, ZONE). DEVIN ANUNOBY MAKES IT! Assist: Ben Brogdon
Score: 39-32

[00:09] Team_100 possession (Score: 39-32)
Pau LaVine drives and kicks out. Manu Ball attempts a 3Pt. Contested by Allen Mitchell (5.2 feet, ZONE). MANU BALL MAKES IT! Assist: Tyler Griffin
Score: 42-32

================================================================================
                              1ST QUARTER COMPLETE                              
================================================================================

1ST QUARTER SCORE: Team_100 42, Team_087 32

BOX SCORE:
================================================================================

Team_100
--------------------------------------------------------------------------------
Player                MIN  PTS  REB  AST  TO      FG   FG%      3P   3P%
--------------------------------------------------------------------------------
Manu Ball              12   14    0    4   0   5/8    62.5     0/0   0.0
Luka Green             12   14    0    0   0   5/5   100.0     0/0   0.0
Tyler Griffin          12    7    2    3   0   3/4    75.0     0/0   0.0
Pau LaVine             12    4    1    1   0   2/3    66.7     0/0   0.0
Chris Mobley           12    3    4    1   0   1/2    50.0     0/0   0.0

TEAM: FG: 16/22 (72.7%), 3PT: 6/10 (60.0%), REB: 7 (3 off, 4 def), AST: 9, TO: 0
TEAM FOULS: 3


Team_087
--------------------------------------------------------------------------------
Player                MIN  PTS  REB  AST  TO      FG   FG%      3P   3P%
--------------------------------------------------------------------------------
Jimmy Ming             12   12    0    2   0   5/6    83.3     0/0   0.0
Devin Anunoby          12   10    2    2   0   4/4   100.0     0/0   0.0
Ben Brogdon            12    5    3    2   0   2/3    66.7     0/0   0.0
Allen Mitchell         12    3    0    1   0   1/2    50.0     0/0   0.0
Malcolm Embiid         12    2    2    2   0   1/2    50.0     0/0   0.0

TEAM: FG: 13/17 (76.5%), 3PT: 4/6 (66.7%), REB: 7 (1 off, 6 def), AST: 9, TO: 4
TEAM FOULS: 7 [Team_100 in BONUS]

================================================================================

================================================================================
                       2ND QUARTER - Team_100 vs Team_087                       
================================================================================

[12:00] Team_100 possession (Score: 42-32)
Pau LaVine attempts a Layup. Contested by Malcolm Embiid (3.7 feet, ZONE). Pau LaVine misses. Rebound secured by Ben Brogdon.

[11:48] Team_087 possession (Score: 42-32)
Allen Mitchell drives and kicks out. Malcolm Embiid attempts a 3Pt. Contested by Pau LaVine (4.9 feet, MAN). MALCOLM EMBIID MAKES IT! Assist: Ben Brogdon
Score: 42-35

[11:35] Team_100 possession (Score: 42-35)
Manu Ball attempts a Midrange. Contested by Jimmy Ming (5.1 feet, ZONE). MANU BALL MAKES IT!
Score: 44-35

[11:23] Team_087 possession (Score: 44-35)
Malcolm Embiid attempts a 3Pt. Contested by Pau LaVine (5.1 feet, MAN). Malcolm Embiid misses. Rebound secured by Pau LaVine.

[11:07] Team_100 possession (Score: 44-35)
Manu Ball attempts a 3Pt. Contested by Allen Mitchell (5.0 feet, ZONE). Manu Ball misses. FOUL! Loose ball foul on Malcolm Embiid during the rebound battle. [Team fouls: 1] No free throws, side out. (Malcolm Embiid: 1 personal fouls)

[10:50] Team_100 possession (Score: 44-35)
Manu Ball attempts a 3Pt. Contested by Jimmy Ming (5.1 feet, MAN). MANU BALL MAKES IT! Assist: Chris Mobley
Score: 47-35

[10:35] Team_087 possession (Score: 47-35)
Jimmy Ming attempts a 3Pt. Wide open! Luka Green is 6.3 feet away. [ZONE] Jimmy Ming misses. Rebound secured by Pau LaVine.

[10:20] Team_100 possession (Score: 47-35)
Pau LaVine attempts a 3Pt. Contested by Allen Mitchell (5.1 feet, ZONE). Pau LaVine misses. Rebound secured by Ben Brogdon.

[10:06] Team_087 possession (Score: 47-35)
Malcolm Embiid loses the ball! Stripped by Pau LaVine! TURNOVER! (live ball)

[09:50] Team_100 possession (Score: 47-35)
Tyler Griffin attempts a Midrange. Contested by Devin Anunoby (5.1 feet, MAN). Tyler Griffin misses. FOUL! Loose ball foul on Malcolm Embiid during the rebound battle. [Team fouls: 2] No free throws, side out. (Malcolm Embiid: 2 personal fouls)

[09:39] Team_100 possession (Score: 47-35)
Chris Mobley attempts a Layup. BLOCKED BY MALCOLM EMBIID! Ball is loose! Rebound secured by Malcolm Embiid.

[09:25] Team_087 possession (Score: 47-35)
Allen Mitchell commits a violation (traveling/carry)! TURNOVER! (dead ball)

[09:25] Substitution (Team_100): Luka Green OUT → Dirk Sabonis IN (stamina_rule2)

[09:25] Substitution (Team_100): Manu Ball OUT → Evan Butler IN (stamina_rule2)

[09:25] Substitution (Team_100): Tyler Griffin OUT → Tyrese Wade IN (stamina_rule2)

[09:25] Substitution (Team_100): Pau LaVine OUT → Carmelo Ginobili IN (stamina_rule2)

[09:25] Substitution (Team_100): Chris Mobley OUT → John Rozier IN (stamina_rule2)

[09:25] Substitution (Team_087): Allen Mitchell OUT → Wendell Haliburton IN (stamina_rule2)

[09:25] Substitution (Team_087): Jimmy Ming OUT → Ben Lillard IN (stamina_rule2)

[09:25] Substitution (Team_087): Devin Anunoby OUT → Larry Green IN (stamina_rule2)

[09:25] Substitution (Team_087): Malcolm Embiid OUT → Pau Russell IN (stamina_rule2)

[09:25] Substitution (Team_087): Ben Brogdon OUT → Kristaps Young IN (stamina_rule2)

[09:10] Team_100 possession (Score: 47-35)
Dirk Sabonis attempts a 3Pt. Contested by Wendell Haliburton (5.5 feet, MAN). Dirk Sabonis misses. FOUL! Loose ball foul on Pau Russell during the rebound battle. [Team fouls: 3] No free throws, side out. (Pau Russell: 1 personal fouls)

[08:51] Team_100 possession (Score: 47-35)
Tyrese Wade attempts a 3Pt. Contested by Larry Green (3.7 feet, MAN). TYRESE WADE MAKES IT! Assist: Evan Butler
Score: 50-35

[08:40] Team_087 possession (Score: 50-35)
FOUL! Holding foul on John Rozier. [Team fouls: 1] No free throws, side out. (John Rozier: 1 personal fouls)

[08:20] Team_087 possession (Score: 50-35)
Ben Lillard attempts a Midrange. Contested by Carmelo Ginobili (5.4 feet, ZONE). Ben Lillard misses. Rebound secured by Carmelo Ginobili.

[08:06] Team_100 possession (Score: 50-35)
John Rozier drives to the basket... John Rozier throws a bad pass! Stolen by Kristaps Young! TURNOVER! (live ball)

[07:52] Team_087 possession (Score: 50-35)
Pau Russell drives, John Rozier stays with him. Pau Russell attempts a Dunk. Contested by John Rozier (4.6 feet, ZONE). Pau Russell misses. FOUL! Loose ball foul on John Rozier during the rebound battle. [Team fouls: 2] No free throws, side out. (John Rozier: 2 personal fouls)

[07:39] Team_087 possession (Score: 50-35)
Kristaps Young attempts a Layup. Contested by John Rozier (4.9 feet, MAN). KRISTAPS YOUNG MAKES IT! Assist: Ben Lillard
Score: 50-37

[07:27] Team_100 possession (Score: 50-37)
John Rozier attempts a 3Pt. Contested by Kristaps Young (5.2 feet, MAN). John Rozier misses. Rebound secured by Kristaps Young.

[07:12] Team_087 possession (Score: 50-37)
Kristaps Young attempts a Layup. Contested by John Rozier (4.9 feet, ZONE). Kristaps Young misses. Offensive rebound by Kristaps Young! Kristaps Young's putback is no good. Rebound secured by John Rozier.

[06:58] Team_100 possession (Score: 50-37)
Dirk Sabonis drives and kicks out. Tyrese Wade attempts a 3Pt. Contested by Larry Green (4.1 feet, MAN). Tyrese Wade misses. Rebound secured by Kristaps Young.

[06:39] Team_087 possession (Score: 50-37)
Ben Lillard drives to the basket... Ben Lillard loses control! Ball rolls out of bounds! TURNOVER! (dead ball)

[06:20] Team_100 possession (Score: 50-37)
FOUL! Reach-in foul on Pau Russell during the drive. [Team fouls: 4] No free throws, side out. (Pau Russell: 2 personal fouls)

[06:06] Team_100 possession (Score: 50-37)
FOUL! Shooting foul on Larry Green. Tyrese Wade to the line for 3 free throws. [BONUS: 5 team fouls] (Larry Green: 1 personal fouls)   FT 1/3: GOOD   FT 2/3: GOOD   FT 3/3: GOOD Tyrese Wade makes 3/3 from the line.
Score: 53-37

[05:49] Team_087 possession (Score: 53-37)
Kristaps Young attempts a Layup. Contested by John Rozier (4.9 feet, MAN). KRISTAPS YOUNG MAKES IT! Assist: Wendell Haliburton
Score: 53-39

[05:35] Team_100 possession (Score: 53-39)
Tyrese Wade makes the Layup and draws the foul on Larry Green! And-1! Tyrese Wade to the line for 1. [BONUS: 6 team fouls] (Larry Green: 2 personal fouls)   FT 1/1: GOOD Tyrese Wade makes 1/1 from the line.
Score: 56-39

[05:22] Team_087 possession (Score: 56-39)
Kristaps Young attempts a 3Pt. Contested by John Rozier (4.9 feet, MAN). Kristaps Young misses. Rebound secured by Tyrese Wade.

[05:09] Team_100 possession (Score: 56-39)
John Rozier drives to the basket... John Rozier throws a bad pass out of bounds! TURNOVER! (dead ball)

[04:49] Team_087 possession (Score: 56-39)
Pau Russell makes the Layup and draws the foul on John Rozier! And-1! Pau Russell to the line for 1. [Team fouls: 3] (John Rozier: 3 personal fouls)   FT 1/1: GOOD Pau Russell makes 1/1 from the line.
Score: 56-42

[04:35] Team_100 possession (Score: 56-42)
Evan Butler attempts a 3Pt. Contested by Ben Lillard (5.2 feet, MAN). Evan Butler misses. Offensive rebound by John Rozier! John Rozier puts it back in!
Score: 58-42

[04:17] Team_087 possession (Score: 58-42)
Wendell Haliburton drives and kicks out. Kristaps Young attempts a Midrange. Contested by Evan Butler (5.1 feet, ZONE). Kristaps Young misses. Offensive rebound by Larry Green! Larry Green kicks it out.

[04:00] Team_087 possession (Score: 58-42)
Wendell Haliburton attempts a Layup. Wide open! Dirk Sabonis is 6.2 feet away. [MAN] WENDELL HALIBURTON MAKES IT! Assist: Pau Russell
Score: 58-44

[03:45] Team_100 possession (Score: 58-44)
Tyrese Wade makes the Dunk and draws the foul on Ben Lillard! And-1! Tyrese Wade to the line for 1. [BONUS: 7 team fouls] (Ben Lillard: 1 personal fouls)   FT 1/1: GOOD Tyrese Wade makes 1/1 from the line.
Score: 61-44

[03:32] Team_087 possession (Score: 61-44)
Wendell Haliburton attempts a 3Pt. Contested by Tyrese Wade (5.0 feet, ZONE). WENDELL HALIBURTON MAKES IT! Assist: Ben Lillard
Score: 61-47

[03:17] Team_100 possession (Score: 61-47)
Dirk Sabonis drives, Kristaps Young stays with him. Dirk Sabonis attempts a Layup. Contested by Kristaps Young (5.2 feet, ZONE). Dirk Sabonis misses. Rebound secured by Pau Russell.

[02:58] Team_087 possession (Score: 61-47)
Ben Lillard attempts a 3Pt. Contested by Evan Butler (5.3 feet, MAN). Ben Lillard misses. Rebound secured by Carmelo Ginobili.

[02:44] Team_100 possession (Score: 61-47)
Dirk Sabonis attempts a 3Pt. Contested by Pau Russell (5.1 feet, ZONE). Dirk Sabonis misses. Rebound secured by Pau Russell.

[02:30] Team_087 possession (Score: 61-47)
Pau Russell attempts a Midrange. Contested by Carmelo Ginobili (5.4 feet, MAN). Pau Russell misses. Rebound secured by Carmelo Ginobili.

[02:15] Team_100 possession (Score: 61-47)
John Rozier attempts a Midrange. Contested by Larry Green (4.4 feet, ZONE). John Rozier misses. Offensive rebound by John Rozier! John Rozier puts it back in!
Score: 63-47

[02:03] Team_087 possession (Score: 63-47)
Kristaps Young attempts a 3Pt. Contested by Tyrese Wade (4.9 feet, ZONE). Kristaps Young misses. Rebound secured by Carmelo Ginobili.

[01:50] Team_100 possession (Score: 63-47)
Evan Butler attempts a Midrange. Contested by Pau Russell (4.7 feet, ZONE). Evan Butler misses. Offensive rebound by John Rozier! John Rozier puts it back in!
Score: 65-47

[01:39] Team_087 possession (Score: 65-47)
Larry Green attempts a 3Pt. Contested by Tyrese Wade (4.9 feet, ZONE). Larry Green misses. Rebound secured by Carmelo Ginobili.

[01:23] Team_100 possession (Score: 65-47)
Tyrese Wade attempts a 3Pt. Contested by Larry Green (3.7 feet, MAN). Tyrese Wade misses. Rebound secured by Larry Green.

[01:11] Team_087 possession (Score: 65-47)
Wendell Haliburton attempts a 3Pt. Wide open! Dirk Sabonis is 6.4 feet away. [MAN] Wendell Haliburton misses. Rebound secured by Carmelo Ginobili.

[00:56] Team_100 possession (Score: 65-47)
Carmelo Ginobili drives and kicks out. John Rozier attempts a Midrange. Contested by Ben Lillard (5.5 feet, ZONE). John Rozier misses. Rebound secured by Kristaps Young.

[00:45] Team_087 possession (Score: 65-47)
Ben Lillard attempts a Midrange. Contested by Evan Butler (5.4 feet, ZONE). Ben Lillard misses. Rebound secured by Carmelo Ginobili.

[00:30] Team_100 possession (Score: 65-47)
Dirk Sabonis attempts a 3Pt. Contested by Pau Russell (5.2 feet, ZONE). Dirk Sabonis misses. Rebound secured by Kristaps Young.

[00:13] Team_087 possession (Score: 65-47)
Larry Green attempts a 3Pt. Contested by Tyrese Wade (5.1 feet, MAN). LARRY GREEN MAKES IT! Assist: Wendell Haliburton
Score: 65-50

================================================================================
                              2ND QUARTER COMPLETE                              
================================================================================

2ND QUARTER SCORE: Team_100 23, Team_087 18

BOX SCORE:
================================================================================

Team_100
--------------------------------------------------------------------------------
Player                MIN  PTS  REB  AST  TO      FG   FG%      3P   3P%
--------------------------------------------------------------------------------
Tyrese Wade             9   12    1    0   0   4/5    80.0     0/0   0.0
John Rozier             9    6    4    0   0   3/4    75.0     0/0   0.0
Manu Ball              15    5    0    0   0   2/2   100.0     0/0   0.0
Pau LaVine             15    0    4    0   0   0/2     0.0     0/0   0.0
Chris Mobley           15    0    0    1   0   0/1     0.0     0/0   0.0
Carmelo Ginobili        9    0    8    0   0   0/1     0.0     0/0   0.0
Evan Butler             9    0    0    1   0   0/0     0.0     0/0   0.0
Dirk Sabonis            9    0    0    0   0   0/4     0.0     0/0   0.0

TEAM: FG: 9/19 (47.4%), 3PT: 4/9 (44.4%), REB: 16 (6 off, 10 def), AST: 2, TO: 2
TEAM FOULS: 3


Team_087
--------------------------------------------------------------------------------
Player                MIN  PTS  REB  AST  TO      FG   FG%      3P   3P%
--------------------------------------------------------------------------------
Wendell Haliburton      9    5    0    2   0   2/3    66.7     0/0   0.0
Kristaps Young          9    4    5    0   0   2/5    40.0     0/0   0.0
Malcolm Embiid         15    3    1    0   0   1/2    50.0     0/0   0.0
Pau Russell             9    3    2    1   0   1/2    50.0     0/0   0.0
Larry Green             9    3    2    0   0   1/2    50.0     0/0   0.0
Ben Brogdon            15    0    2    1   0   0/0     0.0     0/0   0.0
Jimmy Ming             15    0    0    0   0   0/1     0.0     0/0   0.0
Ben Lillard             9    0    0    2   0   0/3     0.0     0/0   0.0

TEAM: FG: 7/18 (38.9%), 3PT: 2/9 (22.2%), REB: 13 (3 off, 10 def), AST: 6, TO: 3
TEAM FOULS: 7 [Team_100 in BONUS]

================================================================================

================================================================================
                       3RD QUARTER - Team_100 vs Team_087                       
================================================================================

[12:00] Team_100 possession (Score: 65-50)
Tyler Griffin attempts a Layup. Contested by Devin Anunoby (4.6 feet, MAN). TYLER GRIFFIN MAKES IT! Assist: Chris Mobley
Score: 67-50

[11:50] Team_087 possession (Score: 67-50)
Allen Mitchell attempts a 3Pt. Contested by Luka Green (5.8 feet, MAN). Allen Mitchell misses. Offensive rebound by Devin Anunoby! Devin Anunoby puts it back in!
Score: 67-52

[11:37] Team_100 possession (Score: 67-52)
Tyler Griffin attempts a 3Pt. Contested by Allen Mitchell (5.0 feet, ZONE). TYLER GRIFFIN MAKES IT! Assist: Manu Ball
Score: 70-52

[11:22] Team_087 possession (Score: 70-52)
Devin Anunoby attempts a Layup. Contested by Tyler Griffin (5.0 feet, MAN). DEVIN ANUNOBY MAKES IT! Assist: Malcolm Embiid
Score: 70-54

[11:10] Team_100 possession (Score: 70-54)
Pau LaVine attempts a Midrange. Contested by Malcolm Embiid (3.4 feet, MAN). Pau LaVine misses. Offensive rebound by Pau LaVine! Pau LaVine kicks it out.

[10:58] Team_100 possession (Score: 70-54)
Luka Green drives and kicks out. Manu Ball attempts a Midrange. Contested by Malcolm Embiid (3.3 feet, ZONE). Manu Ball misses. Rebound secured by Devin Anunoby.

[10:43] Team_087 possession (Score: 70-54)
Devin Anunoby loses the ball! Stripped by Tyler Griffin! TURNOVER! (live ball)

[10:27] Team_100 possession (Score: 70-54)
Tyler Griffin attempts a 3Pt. Contested by Devin Anunoby (4.6 feet, MAN). Tyler Griffin misses. Rebound secured by Ben Brogdon.

[10:09] Team_087 possession (Score: 70-54)
Allen Mitchell attempts a Layup. Contested by Pau LaVine (4.9 feet, ZONE). ALLEN MITCHELL MAKES IT! Assist: Devin Anunoby
Score: 70-56

[09:53] Team_100 possession (Score: 70-56)
Pau LaVine drives and kicks out. Luka Green attempts a 3Pt. Contested by Allen Mitchell (4.8 feet, ZONE). Luka Green misses. Rebound secured by Malcolm Embiid.

[09:36] Team_087 possession (Score: 70-56)
Devin Anunoby attempts a Midrange. Contested by Tyler Griffin (5.0 feet, ZONE). Devin Anunoby misses. Rebound secured by Tyler Griffin.

[09:24] Team_100 possession (Score: 70-56)
Luka Green attempts a 3Pt. Contested by Allen Mitchell (5.0 feet, ZONE). LUKA GREEN MAKES IT! Assist: Pau LaVine
Score: 73-56

[09:06] Team_087 possession (Score: 73-56)
Devin Anunoby attempts a 3Pt. Contested by Luka Green (5.6 feet, ZONE). Devin Anunoby misses. Offensive rebound by Malcolm Embiid! Malcolm Embiid's putback is no good. Offensive rebound by Devin Anunoby! Devin Anunoby kicks it out.

[08:52] Team_087 possession (Score: 73-56)
Devin Anunoby attempts a Midrange. Contested by Tyler Griffin (5.0 feet, MAN). Devin Anunoby misses. Rebound secured by Chris Mobley.

[08:41] Team_100 possession (Score: 73-56)
Pau LaVine attempts a 3Pt. Contested by Allen Mitchell (4.8 feet, ZONE). Pau LaVine misses. Rebound secured by Devin Anunoby.

[08:28] Team_087 possession (Score: 73-56)
Malcolm Embiid drives, Pau LaVine stays with him. Malcolm Embiid attempts a Dunk. Contested by Pau LaVine (4.8 feet, ZONE). MALCOLM EMBIID MAKES IT! Assist: Devin Anunoby
Score: 73-58

[08:14] Team_100 possession (Score: 73-58)
Luka Green drives and kicks out. Pau LaVine attempts a 3Pt. Contested by Allen Mitchell (4.8 feet, ZONE). Pau LaVine misses. Rebound secured by Malcolm Embiid.

[08:02] Team_087 possession (Score: 73-58)
Malcolm Embiid drives and kicks out. Devin Anunoby attempts a 3Pt. Contested by Tyler Griffin (4.8 feet, MAN). Devin Anunoby misses. Rebound secured by Tyler Griffin.

[07:47] Team_100 possession (Score: 73-58)
Tyler Griffin attempts a Layup. Contested by Devin Anunoby (4.6 feet, MAN). TYLER GRIFFIN MAKES IT! Assist: Pau LaVine
Score: 75-58

[07:27] Team_087 possession (Score: 75-58)
Malcolm Embiid drives and kicks out. Malcolm Embiid attempts a Midrange. Contested by Pau LaVine (4.5 feet, MAN). Malcolm Embiid misses. Rebound secured by Chris Mobley.

[07:14] Team_100 possession (Score: 75-58)
Tyler Griffin attempts a 3Pt. Contested by Allen Mitchell (5.0 feet, ZONE). Tyler Griffin misses. Rebound secured by Ben Brogdon.

[06:58] Team_087 possession (Score: 75-58)
Malcolm Embiid makes the Midrange and draws the foul on Pau LaVine! And-1! Malcolm Embiid to the line for 1. [Team fouls: 1] (Pau LaVine: 1 personal fouls)   FT 1/1: GOOD Malcolm Embiid makes 1/1 from the line.
Score: 75-61

[06:41] Team_100 possession (Score: 75-61)
Manu Ball attempts a 3Pt. Contested by Jimmy Ming (4.9 feet, MAN). Manu Ball misses. Rebound secured by Ben Brogdon.

[06:26] Team_087 possession (Score: 75-61)
Allen Mitchell attempts a 3Pt. Contested by Luka Green (5.8 feet, MAN). Allen Mitchell misses. Offensive rebound by Devin Anunoby! Devin Anunoby puts it back in!
Score: 75-63

[06:12] Team_100 possession (Score: 75-63)
FOUL! Holding foul on Allen Mitchell. [Team fouls: 1] No free throws, side out. (Allen Mitchell: 1 personal fouls)

[05:59] Team_100 possession (Score: 75-63)
Pau LaVine attempts a 3Pt. Contested by Allen Mitchell (4.8 feet, ZONE). Pau LaVine misses. Rebound secured by Ben Brogdon.

[05:46] Team_087 possession (Score: 75-63)
Ben Brogdon attempts a 3Pt. Contested by Chris Mobley (5.5 feet, MAN). BEN BROGDON MAKES IT! Assist: Jimmy Ming
Score: 75-66

[05:31] Team_100 possession (Score: 75-66)
Pau LaVine drives, Malcolm Embiid stays with him. Pau LaVine attempts a Layup. Contested by Malcolm Embiid (3.4 feet, MAN). PAU LAVINE MAKES IT! Assist: Luka Green
Score: 77-66

[05:17] Team_087 possession (Score: 77-66)
FOUL! Shooting foul on Luka Green. Allen Mitchell to the line for 2 free throws. [Team fouls: 2] (Luka Green: 1 personal fouls)   FT 1/2: MISS   FT 2/2: GOOD Allen Mitchell makes 1/2 from the line.
Score: 77-67

[05:00] Team_100 possession (Score: 77-67)
Luka Green attempts a Midrange. Contested by Allen Mitchell (5.0 feet, MAN). LUKA GREEN MAKES IT! Assist: Pau LaVine
Score: 79-67

[04:43] Team_087 possession (Score: 79-67)
Ben Brogdon loses the ball! Stripped by Chris Mobley! TURNOVER! (live ball)

[04:26] Team_100 possession (Score: 79-67)
Chris Mobley drives, Malcolm Embiid stays with him. Chris Mobley attempts a Layup. Contested by Malcolm Embiid (3.7 feet, ZONE). CHRIS MOBLEY MAKES IT! Assist: Tyler Griffin
Score: 81-67

[04:12] Team_087 possession (Score: 81-67)
FOUL! Shooting foul on Tyler Griffin. Jimmy Ming to the line for 2 free throws. [Team fouls: 3] (Tyler Griffin: 1 personal fouls)   FT 1/2: GOOD   FT 2/2: GOOD Jimmy Ming makes 2/2 from the line.
Score: 81-69

[03:55] Team_100 possession (Score: 81-69)
FOUL! Holding foul on Devin Anunoby. [Team fouls: 2] No free throws, side out. (Devin Anunoby: 1 personal fouls)

[03:44] Team_100 possession (Score: 81-69)
FOUL! Shooting foul on Jimmy Ming. Manu Ball to the line for 2 free throws. [Team fouls: 3] (Jimmy Ming: 1 personal fouls)   FT 1/2: GOOD   FT 2/2: GOOD Manu Ball makes 2/2 from the line.
Score: 83-69

[03:29] Team_087 possession (Score: 83-69)
Jimmy Ming attempts a Midrange. Wide open! Manu Ball is 6.9 feet away. [MAN] Jimmy Ming misses. Rebound secured by Pau LaVine.

[03:15] Team_100 possession (Score: 83-69)
FOUL! Reach-in foul on Malcolm Embiid during the drive. [Team fouls: 4] No free throws, side out. (Malcolm Embiid: 1 personal fouls)

[03:01] Team_100 possession (Score: 83-69)
Manu Ball attempts a 3Pt. Contested by Allen Mitchell (4.9 feet, ZONE). Manu Ball misses. Rebound secured by Malcolm Embiid.

[02:48] Team_087 possession (Score: 83-69)
Ben Brogdon drives, Pau LaVine stays with him. Ben Brogdon attempts a Layup. Contested by Pau LaVine (5.1 feet, ZONE). BEN BROGDON MAKES IT! Assist: Devin Anunoby
Score: 83-71

[02:30] Team_100 possession (Score: 83-71)
Pau LaVine attempts a 3Pt. Contested by Allen Mitchell (5.0 feet, ZONE). Pau LaVine misses. Rebound secured by Devin Anunoby.

[02:18] Team_087 possession (Score: 83-71)
Allen Mitchell drives to the basket... Allen Mitchell throws a bad pass! Stolen by Pau LaVine! TURNOVER! (live ball)

[02:07] Team_100 possession (Score: 83-71)
FOUL! Reach-in foul on Malcolm Embiid during the drive. [IN THE BONUS! 5 team fouls] Tyler Griffin to the line for 2 free throws. (Malcolm Embiid: 2 personal fouls)   FT 1/2: GOOD   FT 2/2: GOOD Tyler Griffin makes 2/2 from the line.
Score: 85-71

[01:53] Team_087 possession (Score: 85-71)
Allen Mitchell attempts a 3Pt. Contested by Luka Green (5.9 feet, ZONE). Allen Mitchell misses. Rebound secured by Pau LaVine.

[01:41] Team_100 possession (Score: 85-71)
FOUL! Shooting foul on Allen Mitchell. Tyler Griffin to the line for 3 free throws. [BONUS: 6 team fouls] (Allen Mitchell: 2 personal fouls)   FT 1/3: GOOD   FT 2/3: GOOD   FT 3/3: GOOD Tyler Griffin makes 3/3 from the line.
Score: 88-71

[01:29] Team_087 possession (Score: 88-71)
Malcolm Embiid attempts a 3Pt. Contested by Pau LaVine (5.1 feet, MAN). MALCOLM EMBIID MAKES IT! Assist: Jimmy Ming
Score: 88-74

[01:13] Team_100 possession (Score: 88-74)
Tyler Griffin attempts a 3Pt. Contested by Devin Anunoby (4.9 feet, ZONE). Tyler Griffin misses. Rebound secured by Malcolm Embiid.

[00:58] Team_087 possession (Score: 88-74)
Allen Mitchell attempts a 3Pt. Wide open! Luka Green is 6.0 feet away. [MAN] Allen Mitchell misses. Rebound secured by Chris Mobley.

[00:40] Team_100 possession (Score: 88-74)
Manu Ball throws a bad pass! Stolen by Jimmy Ming! TURNOVER! (live ball)

[00:25] Team_087 possession (Score: 88-74)
Malcolm Embiid attempts a Midrange. Contested by Pau LaVine (5.2 feet, MAN). Malcolm Embiid misses. Offensive rebound by Malcolm Embiid! Malcolm Embiid kicks it out.

[00:10] Team_087 possession (Score: 88-74)
Devin Anunoby attempts a Midrange. Contested by Tyler Griffin (5.5 feet, ZONE). DEVIN ANUNOBY MAKES IT! Assist: Malcolm Embiid
Score: 88-76

================================================================================
                              3RD QUARTER COMPLETE                              
================================================================================

3RD QUARTER SCORE: Team_100 23, Team_087 26

BOX SCORE:
================================================================================

Team_100
--------------------------------------------------------------------------------
Player                MIN  PTS  REB  AST  TO      FG   FG%      3P   3P%
--------------------------------------------------------------------------------
Tyler Griffin          27   12    2    1   0   5/8    62.5     0/0   0.0
Luka Green             27    5    0    1   0   2/4    50.0     0/0   0.0
Chris Mobley           27    2    3    1   0   1/1   100.0     0/0   0.0
Manu Ball              27    2    0    1   0   1/3    33.3     0/0   0.0
Pau LaVine             27    2    3    3   0   1/5    20.0     0/0   0.0

TEAM: FG: 10/21 (47.6%), 3PT: 3/11 (27.3%), REB: 8 (1 off, 7 def), AST: 7, TO: 1
TEAM FOULS: 3


Team_087
--------------------------------------------------------------------------------
Player                MIN  PTS  REB  AST  TO      FG   FG%      3P   3P%
--------------------------------------------------------------------------------
Devin Anunoby          27    8    6    3   0   4/6    66.7     0/0   0.0
Malcolm Embiid         27    8    5    2   0   3/5    60.0     0/0   0.0
Ben Brogdon            27    5    4    0   0   2/2   100.0     0/0   0.0
Allen Mitchell         27    3    0    0   0   2/4    50.0     0/0   0.0
Jimmy Ming             27    2    0    2   0   1/2    50.0     0/0   0.0

TEAM: FG: 12/19 (63.2%), 3PT: 4/6 (66.7%), REB: 15 (4 off, 11 def), AST: 7, TO: 3
TEAM FOULS: 6 [Team_100 in BONUS]

================================================================================

================================================================================
                       4TH QUARTER - Team_100 vs Team_087                       
================================================================================

[12:00] Team_100 possession (Score: 88-76)
FOUL! Offensive foul on Pau LaVine! Malcolm Embiid drew the charge! [Team fouls: 1] (Pau LaVine: 1 personal fouls) TURNOVER! (dead ball)

[11:46] Team_087 possession (Score: 88-76)
Ben Brogdon drives, Chris Mobley stays with him. Ben Brogdon attempts a Dunk. Contested by Chris Mobley (5.9 feet, MAN). Ben Brogdon misses. Rebound secured by Tyler Griffin.

[11:30] Team_100 possession (Score: 88-76)
FOUL! Holding foul on Allen Mitchell. [Team fouls: 1] No free throws, side out. (Allen Mitchell: 1 personal fouls)

[11:16] Team_100 possession (Score: 88-76)
Tyler Griffin loses the ball! Stripped by Devin Anunoby! TURNOVER! (live ball)

[11:03] Team_087 possession (Score: 88-76)
Jimmy Ming attempts a Midrange. Wide open! Chris Mobley is 6.4 feet away. [ZONE] JIMMY MING MAKES IT! Assist: Devin Anunoby
Score: 88-78

[10:48] Team_100 possession (Score: 88-78)
Pau LaVine attempts a 3Pt. Contested by Malcolm Embiid (3.9 feet, MAN). Pau LaVine misses. Rebound secured by Devin Anunoby.

[10:36] Team_087 possession (Score: 88-78)
Devin Anunoby attempts a Midrange. Contested by Tyler Griffin (5.5 feet, MAN). Devin Anunoby misses. Offensive rebound by Devin Anunoby! Devin Anunoby kicks it out.

[10:18] Team_087 possession (Score: 88-78)
FOUL! Shooting foul on Tyler Griffin. Devin Anunoby to the line for 2 free throws. [Team fouls: 2] (Tyler Griffin: 1 personal fouls)   FT 1/2: GOOD   FT 2/2: MISS Devin Anunoby makes 1/2 from the line. Offensive rebound by Malcolm Embiid! Malcolm Embiid kicks it out.
Score: 88-79

[10:05] Team_087 possession (Score: 88-79)
Allen Mitchell drives and kicks out. Allen Mitchell attempts a Midrange. Contested by Luka Green (5.7 feet, MAN). Allen Mitchell misses. Rebound secured by Pau LaVine.

[09:51] Team_100 possession (Score: 88-79)
Luka Green throws a bad pass out of bounds! TURNOVER! (dead ball)

[09:51] Substitution (Team_100): Luka Green OUT → Dirk Sabonis IN (stamina_rule2)

[09:51] Substitution (Team_100): Manu Ball OUT → Evan Butler IN (stamina_rule2)

[09:51] Substitution (Team_100): Tyler Griffin OUT → Tyrese Wade IN (stamina_rule2)

[09:51] Substitution (Team_100): Pau LaVine OUT → Carmelo Ginobili IN (stamina_rule2)

[09:51] Substitution (Team_100): Chris Mobley OUT → John Rozier IN (stamina_rule2)

[09:51] Substitution (Team_087): Allen Mitchell OUT → Wendell Haliburton IN (stamina_rule2)

[09:51] Substitution (Team_087): Jimmy Ming OUT → Ben Lillard IN (stamina_rule2)

[09:51] Substitution (Team_087): Devin Anunoby OUT → Larry Green IN (stamina_rule2)

[09:51] Substitution (Team_087): Malcolm Embiid OUT → Pau Russell IN (stamina_rule2)

[09:51] Substitution (Team_087): Ben Brogdon OUT → Kristaps Young IN (stamina_rule2)

[09:36] Team_087 possession (Score: 88-79)
Wendell Haliburton drives and kicks out. Larry Green attempts a Midrange. Contested by Tyrese Wade (4.5 feet, ZONE). LARRY GREEN MAKES IT!
Score: 88-81

[09:17] Team_100 possession (Score: 88-81)
FOUL! Holding foul on Kristaps Young. [Team fouls: 2] No free throws, side out. (Kristaps Young: 1 personal fouls)

[09:03] Team_100 possession (Score: 88-81)
Evan Butler attempts a 3Pt. Contested by Pau Russell (4.7 feet, ZONE). EVAN BUTLER MAKES IT! Assist: John Rozier
Score: 91-81

[08:52] Team_087 possession (Score: 91-81)
Larry Green attempts a 3Pt. Contested by Tyrese Wade (4.8 feet, MAN). Larry Green misses. Offensive rebound by Larry Green! Larry Green kicks it out.

[08:38] Team_087 possession (Score: 91-81)
Larry Green attempts a Layup. Contested by Tyrese Wade (4.8 feet, MAN). LARRY GREEN MAKES IT! Assist: Pau Russell
Score: 91-83

[08:22] Team_100 possession (Score: 91-83)
Dirk Sabonis attempts a Midrange. Contested by Larry Green (4.4 feet, ZONE). DIRK SABONIS MAKES IT! Assist: Carmelo Ginobili
Score: 93-83

[08:10] Team_087 possession (Score: 93-83)
Wendell Haliburton attempts a 3Pt. Contested by Tyrese Wade (5.0 feet, ZONE). Wendell Haliburton misses. Offensive rebound by Larry Green! Larry Green kicks it out.

[07:50] Team_087 possession (Score: 93-83)
FOUL! Shooting foul on John Rozier. Kristaps Young to the line for 2 free throws. [Team fouls: 3] (John Rozier: 1 personal fouls)   FT 1/2: GOOD   FT 2/2: GOOD Kristaps Young makes 2/2 from the line.
Score: 93-85

[07:36] Team_100 possession (Score: 93-85)
Evan Butler attempts a Midrange. Contested by Pau Russell (4.7 feet, ZONE). EVAN BUTLER MAKES IT!
Score: 95-85

[07:17] Team_087 possession (Score: 95-85)
Pau Russell attempts a 3Pt. Contested by Carmelo Ginobili (5.3 feet, MAN). Pau Russell misses. Rebound secured by John Rozier.

[07:02] Team_100 possession (Score: 95-85)
Dirk Sabonis attempts a Layup. Contested by Kristaps Young (5.2 feet, ZONE). DIRK SABONIS MAKES IT!
Score: 97-85

[06:49] Team_087 possession (Score: 97-85)
Kristaps Young attempts a Midrange. Contested by John Rozier (4.9 feet, MAN). Kristaps Young misses. Offensive rebound by Larry Green! Larry Green kicks it out.

[06:36] Team_087 possession (Score: 97-85)
Ben Lillard drives and kicks out. Kristaps Young attempts a 3Pt. Contested by Tyrese Wade (4.5 feet, ZONE). KRISTAPS YOUNG MAKES IT!
Score: 97-88

[06:24] Team_100 possession (Score: 97-88)
Evan Butler attempts a 3Pt. Contested by Ben Lillard (5.2 feet, MAN). EVAN BUTLER MAKES IT! Assist: Dirk Sabonis
Score: 100-88

[06:05] Team_087 possession (Score: 100-88)
Kristaps Young throws a bad pass! Stolen by John Rozier! TURNOVER! (live ball)

[05:50] Team_100 possession (Score: 100-88)
John Rozier attempts a 3Pt. Contested by Pau Russell (5.2 feet, ZONE). JOHN ROZIER MAKES IT!
Score: 103-88

[05:32] Team_087 possession (Score: 103-88)
Ben Lillard drives and kicks out. Wendell Haliburton attempts a Midrange. Contested by Dirk Sabonis (5.7 feet, MAN). Wendell Haliburton misses. Rebound secured by Tyrese Wade.

[05:18] Team_100 possession (Score: 103-88)
Carmelo Ginobili makes the Layup and draws the foul on Pau Russell! And-1! Carmelo Ginobili to the line for 1. [Team fouls: 3] (Pau Russell: 1 personal fouls)   FT 1/1: GOOD Carmelo Ginobili makes 1/1 from the line.
Score: 106-88

[05:05] Team_087 possession (Score: 106-88)
Wendell Haliburton drives to the basket... Wendell Haliburton throws a bad pass out of bounds! TURNOVER! (dead ball)

[04:52] Team_100 possession (Score: 106-88)
FOUL! Shooting foul on Kristaps Young. Carmelo Ginobili to the line for 2 free throws. [Team fouls: 4] (Kristaps Young: 2 personal fouls)   FT 1/2: GOOD   FT 2/2: GOOD Carmelo Ginobili makes 2/2 from the line.
Score: 108-88

[04:35] Team_087 possession (Score: 108-88)
FOUL! Shooting foul on Carmelo Ginobili. Pau Russell to the line for 2 free throws. [Team fouls: 4] (Carmelo Ginobili: 1 personal fouls)   FT 1/2: GOOD   FT 2/2: MISS Pau Russell makes 1/2 from the line. Rebound secured by Carmelo Ginobili.
Score: 108-89

[04:21] Team_100 possession (Score: 108-89)
Evan Butler attempts a Layup. Contested by Kristaps Young (4.8 feet, ZONE). EVAN BUTLER MAKES IT!
Score: 110-89

[04:08] Team_087 possession (Score: 110-89)
Wendell Haliburton drives, picks up John Rozier. Help arrives from Evan Butler! Wendell Haliburton attempts a Layup. Contested by Evan Butler (5.0 feet, ZONE). WENDELL HALIBURTON MAKES IT! Assist: Kristaps Young
Score: 110-91

[03:54] Team_100 possession (Score: 110-91)
FOUL! Holding foul on Ben Lillard. [IN THE BONUS! 5 team fouls] Evan Butler to the line for 2 free throws. (Ben Lillard: 1 personal fouls)   FT 1/2: GOOD   FT 2/2: GOOD Evan Butler makes 2/2 from the line.
Score: 112-91

[03:39] Team_087 possession (Score: 112-91)
FOUL! Shooting foul on Tyrese Wade. Kristaps Young to the line for 2 free throws. [BONUS: 5 team fouls] (Tyrese Wade: 1 personal fouls)   FT 1/2: GOOD   FT 2/2: GOOD Kristaps Young makes 2/2 from the line.
Score: 112-93

[03:25] Team_100 possession (Score: 112-93)
FOUL! Shooting foul on Kristaps Young. John Rozier to the line for 2 free throws. [BONUS: 6 team fouls] (Kristaps Young: 3 personal fouls)   FT 1/2: GOOD   FT 2/2: GOOD John Rozier makes 2/2 from the line.
Score: 114-93

[03:14] Team_087 possession (Score: 114-93)
Wendell Haliburton attempts a Layup. Contested by John Rozier (5.1 feet, ZONE). WENDELL HALIBURTON MAKES IT!
Score: 114-95

[03:05] Team_100 possession (Score: 114-95)
Tyrese Wade drives and kicks out. Dirk Sabonis attempts a Midrange. Contested by Ben Lillard (5.4 feet, ZONE). DIRK SABONIS MAKES IT! Assist: Evan Butler
Score: 116-95

[02:50] Team_087 possession (Score: 116-95)
Larry Green makes the Layup and draws the foul on Evan Butler! And-1! Larry Green to the line for 1. [BONUS: 6 team fouls] (Evan Butler: 1 personal fouls)   FT 1/1: MISS Larry Green makes 0/1 from the line. Offensive rebound by Larry Green! Larry Green kicks it out.
Score: 116-97

[02:39] Team_087 possession (Score: 116-97)
Pau Russell drives, John Rozier stays with him. Pau Russell attempts a Layup. Contested by John Rozier (4.7 feet, ZONE). PAU RUSSELL MAKES IT!
Score: 116-99

[02:30] Team_100 possession (Score: 116-99)
John Rozier makes the Layup and draws the foul on Kristaps Young! And-1! John Rozier to the line for 1. [BONUS: 7 team fouls] (Kristaps Young: 4 personal fouls)   FT 1/1: GOOD John Rozier makes 1/1 from the line.
Score: 119-99

[02:16] Team_087 possession (Score: 119-99)
Larry Green attempts a 3Pt. Contested by Tyrese Wade (4.9 feet, ZONE). Larry Green misses. Rebound secured by Tyrese Wade.

[02:03] Team_100 possession (Score: 119-99)
John Rozier throws a bad pass out of bounds! TURNOVER! (dead ball)

[01:46] Team_087 possession (Score: 119-99)
Wendell Haliburton drives, Dirk Sabonis stays with him. Wendell Haliburton attempts a Layup. Wide open! Dirk Sabonis is 6.4 feet away. [MAN] WENDELL HALIBURTON MAKES IT! Assist: Larry Green
Score: 119-101

[01:30] Team_100 possession (Score: 119-101)
Carmelo Ginobili drives, Kristaps Young stays with him. Carmelo Ginobili attempts a Dunk. Contested by Kristaps Young (4.8 feet, ZONE). CARMELO GINOBILI MAKES IT! Assist: John Rozier
Score: 121-101

[01:16] Team_087 possession (Score: 121-101)
Pau Russell drives to the basket... Pau Russell commits a violation (traveling/carry)! TURNOVER! (dead ball)

[01:03] Team_100 possession (Score: 121-101)
John Rozier attempts a Midrange. Contested by Kristaps Young (5.5 feet, MAN). John Rozier misses. Offensive rebound by Carmelo Ginobili! Carmelo Ginobili kicks it out.

[00:44] Team_100 possession (Score: 121-101)
FOUL! Shooting foul on Ben Lillard. Evan Butler to the line for 2 free throws. [BONUS: 8 team fouls] (Ben Lillard: 2 personal fouls)   FT 1/2: MISS   FT 2/2: GOOD Evan Butler makes 1/2 from the line.
Score: 122-101

[00:27] Team_087 possession (Score: 122-101)
Pau Russell attempts a 3Pt. Contested by Tyrese Wade (4.9 feet, ZONE). Pau Russell misses. Rebound secured by Carmelo Ginobili.

[00:13] Team_100 possession (Score: 122-101)
Dirk Sabonis attempts a 3Pt. Contested by Pau Russell (5.3 feet, ZONE). Dirk Sabonis misses. Rebound secured by Kristaps Young.

================================================================================
                              4TH QUARTER COMPLETE                              
================================================================================

4TH QUARTER SCORE: Team_100 34, Team_087 25

BOX SCORE:
================================================================================

Team_100
--------------------------------------------------------------------------------
Player                MIN  PTS  REB  AST  TO      FG   FG%      3P   3P%
--------------------------------------------------------------------------------
Evan Butler            19   13    0    1   0   6/6   100.0     0/0   0.0
John Rozier            19    8    1    2   0   3/3   100.0     0/0   0.0
Carmelo Ginobili       19    7    3    1   0   3/3   100.0     0/0   0.0
Dirk Sabonis           19    6    0    1   0   3/4    75.0     0/0   0.0
Tyler Griffin          29    0    1    0   0   0/0     0.0     0/0   0.0
Pau LaVine             29    0    1    0   0   0/1     0.0     0/0   0.0
Tyrese Wade            19    0    2    0   0   0/0     0.0     0/0   0.0

TEAM: FG: 15/17 (88.2%), 3PT: 3/5 (60.0%), REB: 8 (1 off, 7 def), AST: 5, TO: 4
TEAM FOULS: 6 [Team_087 in BONUS]


Team_087
--------------------------------------------------------------------------------
Player                MIN  PTS  REB  AST  TO      FG   FG%      3P   3P%
--------------------------------------------------------------------------------
Kristaps Young         19    7    1    1   0   3/3   100.0     0/0   0.0
Wendell Haliburton     19    6    0    0   0   3/3   100.0     0/0   0.0
Larry Green            19    4    4    1   0   2/3    66.7     0/0   0.0
Jimmy Ming             29    2    0    0   0   1/1   100.0     0/0   0.0
Pau Russell            19    2    0    1   0   1/4    25.0     0/0   0.0
Ben Brogdon            29    0    0    0   0   0/1     0.0     0/0   0.0
Devin Anunoby          29    0    2    1   0   0/0     0.0     0/0   0.0
Malcolm Embiid         29    0    1    0   0   0/0     0.0     0/0   0.0
Allen Mitchell         29    0    0    0   0   0/1     0.0     0/0   0.0
Ben Lillard            19    0    0    0   0   0/1     0.0     0/0   0.0

TEAM: FG: 10/17 (58.8%), 3PT: 0/3 (0.0%), REB: 8 (6 off, 2 def), AST: 4, TO: 3
TEAM FOULS: 8 [Team_100 in BONUS]

================================================================================

================================================================================
                               FULL GAME COMPLETE                               
================================================================================

FINAL SCORE: Team_100 122, Team_087 101

SCORING BY QUARTER:
--------------------------------------------------------------------------------
Team                     Q1     Q2     Q3     Q4    FINAL
--------------------------------------------------------------------------------
Team_100                 42     23     23     34      122
Team_087                 32     18     26     25      101
--------------------------------------------------------------------------------

FULL GAME BOX SCORE:
================================================================================

Team_100
--------------------------------------------------------------------------------
Player                MIN  PTS  REB  AST  TO      FG   FG%      3P   3P%      FT STL BLK
--------------------------------------------------------------------------------
Luka Green             29   19    0    1   1   7/9    77.8   4/4   100.0   1/1     0   0
Manu Ball              29   21    0    5   1   6/11   54.5   3/8    37.5   4/4     0   0
Tyler Griffin          29   19    5    4   1   8/12   66.7   3/7    42.9   7/7     1   0
Pau LaVine             29    6    9    4   1   5/13   38.5   0/5     0.0   2/2     2   0
Chris Mobley           29    5    7    3   0   2/4    50.0   0/0     0.0   1/1     2   0
Dirk Sabonis           19    6    0    1   1   2/7    28.6   0/3     0.0   0/0     0   0
Evan Butler            19   13    0    2   0   7/7   100.0   3/3   100.0   3/4     0   0
Tyrese Wade            19   12    3    0   0   5/6    83.3   2/3    66.7   5/5     0   0
Carmelo Ginobili       19    7   11    1   0   3/4    75.0   0/0     0.0   3/3     0   0
John Rozier            19   14    5    2   2   4/5    80.0   1/2    50.0   3/3     1   0

TEAM: FG: 50/79 (63.3%), 3PT: 16/35 (45.7%), REB: 39 (11 off, 28 def), AST: 23, TO: 7


Team_087
--------------------------------------------------------------------------------
Player                MIN  PTS  REB  AST  TO      FG   FG%      3P   3P%      FT STL BLK
--------------------------------------------------------------------------------
Allen Mitchell         29    6    0    1   2   6/10   60.0   3/6    50.0   1/2     0   0
Jimmy Ming             29   16    0    4   1   7/10   70.0   2/3    66.7   2/2     1   1
Devin Anunoby          29   18   10    6   2   5/7    71.4   0/0     0.0   5/6     1   0
Malcolm Embiid         29   13    9    4   2   4/8    50.0   1/3    33.3   1/1     0   1
Ben Brogdon            29   10    9    3   2   5/7    71.4   2/2   100.0   0/0     0   0
Wendell Haliburton     19   11    0    2   1   6/7    85.7   1/2    50.0   0/0     0   0
Ben Lillard            19    0    0    2   1   1/5    20.0   0/1     0.0   0/0     0   0
Larry Green            19    7    6    1   0   2/4    50.0   1/3    33.3   0/1     0   0
Pau Russell            19    5    2    2   0   2/6    33.3   0/2     0.0   2/3     0   0
Kristaps Young         19   11    6    1   2   4/7    57.1   0/2     0.0   4/4     1   0

TEAM: FG: 42/71 (59.2%), 3PT: 10/24 (41.7%), REB: 43 (14 off, 29 def), AST: 26, TO: 13

================================================================================
