================================================================================
                        FULL GAME - Team_027 vs Team_076                        
================================================================================

================================================================================
                       1ST QUARTER - Team_027 vs Team_076                       
================================================================================

[12:00] Team_027 possession (Score: 0-0)
Scottie Harden attempts a Midrange. Contested by Paul Leonard (5.1 feet, MAN). Scottie Harden misses. Rebound secured by Cade Barnes.

[11:48] Team_076 possession (Score: 0-0)
Dejounte LaVine attempts a 3Pt. Contested by Tim Johnson (4.8 feet, MAN). DEJOUNTE LAVINE MAKES IT! Assist: Cade Barnes
Score: 0-3

[11:33] Team_027 possession (Score: 0-3)
Tim Johnson drives and kicks out. Tony Doncic attempts a 3Pt. Contested by Tobias Mitchell (4.1 feet, MAN). Tony Doncic misses. FOUL! Loose ball foul on Tobias Mitchell during the rebound battle. [Team fouls: 1] No free throws, side out. (Tobias Mitchell: 1 personal fouls)

[11:19] Team_027 possession (Score: 0-3)
Bradley Dosunmu attempts a 3Pt. Contested by Cade Barnes (3.6 feet, MAN). BRADLEY DOSUNMU MAKES IT! Assist: Scottie Harden
Score: 3-3

[11:06] Team_076 possession (Score: 3-3)
FOUL! Shooting foul on Tony Doncic. Tobias Mitchell to the line for 2 free throws. [Team fouls: 1] (Tony Doncic: 1 personal fouls)   FT 1/2: MISS   FT 2/2: GOOD Tobias Mitchell makes 1/2 from the line.
Score: 3-4

[10:51] Team_027 possession (Score: 3-4)
Scottie Harden attempts a 3Pt. Contested by Paul Leonard (5.1 feet, MAN). Scottie Harden misses. Rebound secured by Cade Barnes.

[10:41] Team_076 possession (Score: 3-4)
Tobias Mitchell attempts a 3Pt. Contested by Tim Johnson (5.3 feet, ZONE). TOBIAS MITCHELL MAKES IT!
Score: 3-7

[10:23] Team_027 possession (Score: 3-7)
Tim Johnson attempts a Midrange. Contested by Dejounte LaVine (5.1 feet, MAN). TIM JOHNSON MAKES IT!
Score: 5-7

[10:04] Team_076 possession (Score: 5-7)
D'Angelo Tatum attempts a Midrange. Contested by Scottie Harden (4.8 feet, ZONE). D'Angelo Tatum misses. Rebound secured by John Russell.

[09:51] Team_027 possession (Score: 5-7)
Tim Johnson attempts a 3Pt. Contested by Cade Barnes (3.8 feet, ZONE). TIM JOHNSON MAKES IT! Assist: Tony Doncic
Score: 8-7

[09:39] Team_076 possession (Score: 8-7)
Tobias Mitchell attempts a 3Pt. Contested by Tony Doncic (4.3 feet, MAN). TOBIAS MITCHELL MAKES IT! Assist: Paul Leonard
Score: 8-10

[09:22] Team_027 possession (Score: 8-10)
Tim Johnson drives and kicks out. Tim Johnson attempts a Midrange. Contested by Dejounte LaVine (4.8 feet, MAN). Tim Johnson misses. Rebound secured by Tobias Mitchell.

[09:12] Team_076 possession (Score: 8-10)
Dejounte LaVine attempts a 3Pt. Contested by Tim Johnson (4.8 feet, ZONE). Dejounte LaVine misses. Rebound secured by Bradley Dosunmu.

[09:00] Team_027 possession (Score: 8-10)
Tony Doncic attempts a Layup. BLOCKED BY TOBIAS MITCHELL! Ball is loose! Rebound secured by D'Angelo Tatum.

[08:47] Team_076 possession (Score: 8-10)
FOUL! Shooting foul on John Russell. D'Angelo Tatum to the line for 2 free throws. [Team fouls: 2] (John Russell: 1 personal fouls)   FT 1/2: GOOD   FT 2/2: GOOD D'Angelo Tatum makes 2/2 from the line.
Score: 8-12

[08:33] Team_027 possession (Score: 8-12)
Scottie Harden attempts a 3Pt. Contested by Cade Barnes (3.6 feet, ZONE). Scottie Harden misses. Offensive rebound by John Russell! John Russell puts it back in!
Score: 10-12

[08:19] Team_076 possession (Score: 10-12)
D'Angelo Tatum drives, John Russell stays with him. D'Angelo Tatum attempts a Layup. Contested by John Russell (4.2 feet, MAN). D'ANGELO TATUM MAKES IT!
Score: 10-14

[08:01] Team_027 possession (Score: 10-14)
Tony Doncic attempts a 3Pt. Contested by Tobias Mitchell (4.2 feet, MAN). Tony Doncic misses. Rebound secured by D'Angelo Tatum.

[07:48] Team_076 possession (Score: 10-14)
Tobias Mitchell attempts a 3Pt. Contested by Tony Doncic (4.3 feet, MAN). TOBIAS MITCHELL MAKES IT! Assist: Cade Barnes
Score: 10-17

[07:33] Team_027 possession (Score: 10-17)
Bradley Dosunmu attempts a 3Pt. Contested by Tobias Mitchell (4.2 feet, ZONE). Bradley Dosunmu misses. Rebound secured by D'Angelo Tatum.

[07:22] Team_076 possession (Score: 10-17)
Dejounte LaVine drives and kicks out. Tobias Mitchell attempts a 3Pt. Contested by Tim Johnson (4.9 feet, ZONE). Tobias Mitchell misses. Rebound secured by John Russell.

[07:07] Team_027 possession (Score: 10-17)
Scottie Harden attempts a Midrange. Contested by Paul Leonard (5.1 feet, MAN). SCOTTIE HARDEN MAKES IT!
Score: 12-17

[06:56] Team_076 possession (Score: 12-17)
Dejounte LaVine attempts a 3Pt. Contested by Tim Johnson (4.8 feet, ZONE). Dejounte LaVine misses. Rebound secured by Tony Doncic.

[06:42] Team_027 possession (Score: 12-17)
John Russell drives and kicks out. Scottie Harden attempts a 3Pt. Contested by Cade Barnes (3.5 feet, ZONE). Scottie Harden misses. Offensive rebound by John Russell! John Russell puts it back in!
Score: 14-17

[06:29] Team_076 possession (Score: 14-17)
Paul Leonard drives, Scottie Harden stays with him. Paul Leonard attempts a Layup. Contested by Scottie Harden (4.9 feet, MAN). Paul Leonard misses. FOUL! Loose ball foul on Bradley Dosunmu during the rebound battle. [Team fouls: 3] No free throws, side out. (Bradley Dosunmu: 1 personal fouls)

[06:10] Team_076 possession (Score: 14-17)
D'Angelo Tatum attempts a Midrange. Contested by John Russell (4.2 feet, MAN). D'Angelo Tatum misses. Rebound secured by Tony Doncic.

[05:52] Team_027 possession (Score: 14-17)
Bradley Dosunmu attempts a Midrange. Contested by Paul Leonard (5.2 feet, ZONE). Bradley Dosunmu misses. Offensive rebound by Bradley Dosunmu! Bradley Dosunmu kicks it out.

[05:39] Team_027 possession (Score: 14-17)
Scottie Harden drives and kicks out. FOUL! Shooting foul on Cade Barnes. Scottie Harden to the line for 2 free throws. [Team fouls: 2] (Cade Barnes: 1 personal fouls)   FT 1/2: GOOD   FT 2/2: GOOD Scottie Harden makes 2/2 from the line.
Score: 16-17

[05:24] Team_076 possession (Score: 16-17)
Tobias Mitchell attempts a 3Pt. Contested by Tony Doncic (4.3 feet, MAN). Tobias Mitchell misses. Rebound secured by John Russell.

[05:08] Team_027 possession (Score: 16-17)
Scottie Harden attempts a 3Pt. Contested by Cade Barnes (3.6 feet, ZONE). SCOTTIE HARDEN MAKES IT! Assist: Tim Johnson
Score: 19-17

[04:50] Team_076 possession (Score: 19-17)
FOUL! Reach-in foul on John Russell during the drive. [Team fouls: 4] No free throws, side out. (John Russell: 2 personal fouls)

[04:39] Team_076 possession (Score: 19-17)
FOUL! Reach-in foul on Bradley Dosunmu during the drive. [IN THE BONUS! 5 team fouls] Cade Barnes to the line for 2 free throws. (Bradley Dosunmu: 2 personal fouls)   FT 1/2: GOOD   FT 2/2: GOOD Cade Barnes makes 2/2 from the line.
Score: 19-19

[04:26] Team_027 possession (Score: 19-19)
Bradley Dosunmu drives, picks up Cade Barnes. Help arrives from Tobias Mitchell! Bradley Dosunmu attempts a Dunk. Contested by Tobias Mitchell (3.7 feet, MAN). BRADLEY DOSUNMU MAKES IT! Assist: Tony Doncic
Score: 21-19

[04:11] Team_076 possession (Score: 21-19)
Tobias Mitchell drives to the basket... Tobias Mitchell throws a bad pass out of bounds! TURNOVER! (dead ball)

[03:59] Team_027 possession (Score: 21-19)
Bradley Dosunmu drives and kicks out. Tony Doncic attempts a 3Pt. Contested by Tobias Mitchell (4.2 feet, MAN). TONY DONCIC MAKES IT! Assist: Scottie Harden
Score: 24-19

[03:47] Team_076 possession (Score: 24-19)
Tobias Mitchell attempts a 3Pt. Contested by Tony Doncic (4.4 feet, MAN). Tobias Mitchell misses. Rebound secured by Tony Doncic.

[03:33] Team_027 possession (Score: 24-19)
Scottie Harden attempts a 3Pt. Contested by Paul Leonard (5.3 feet, MAN). Scottie Harden misses. Rebound secured by Cade Barnes.

[03:20] Team_076 possession (Score: 24-19)
Tobias Mitchell attempts a 3Pt. Contested by Tony Doncic (4.4 feet, MAN). Tobias Mitchell misses. Rebound secured by John Russell.

[03:07] Team_027 possession (Score: 24-19)
John Russell drives and kicks out. Tim Johnson attempts a 3Pt. Contested by Dejounte LaVine (5.0 feet, MAN). Tim Johnson misses. Rebound secured by Cade Barnes.

[02:58] Team_076 possession (Score: 24-19)
Cade Barnes attempts a Midrange. Contested by Bradley Dosunmu (4.8 feet, ZONE). CADE BARNES MAKES IT! Assist: D'Angelo Tatum
Score: 24-21

[02:45] Team_027 possession (Score: 24-21)
Tony Doncic attempts a 3Pt. Contested by Cade Barnes (3.9 feet, ZONE). Tony Doncic misses. Offensive rebound by John Russell! John Russell's putback is no good. Offensive rebound by John Russell! John Russell kicks it out.

[02:27] Team_027 possession (Score: 24-21)
Scottie Harden attempts a Midrange. Contested by Paul Leonard (5.4 feet, MAN). Scottie Harden misses. Offensive rebound by John Russell! John Russell's putback is no good. Offensive rebound by Bradley Dosunmu! Bradley Dosunmu kicks it out.

[02:17] Team_027 possession (Score: 24-21)
Bradley Dosunmu loses control! Ball rolls out of bounds! TURNOVER! (dead ball)

[02:17] Substitution (Team_027): Tim Johnson OUT → CJ Green IN (stamina_rule2)

[02:17] Substitution (Team_027): Tony Doncic OUT → Dirk Lillard IN (stamina_rule2)

[02:17] Substitution (Team_027): Scottie Harden OUT → Rudy Quickley IN (stamina_rule2)

[02:17] Substitution (Team_027): Bradley Dosunmu OUT → LeBron Russell IN (stamina_rule2)

[02:17] Substitution (Team_027): John Russell OUT → Ben Stewart IN (stamina_rule2)

[02:17] Substitution (Team_076): Dejounte LaVine OUT → Pascal Lowry IN (stamina_rule2)

[02:17] Substitution (Team_076): Tobias Mitchell OUT → Jalen Poole IN (stamina_rule2)

[02:17] Substitution (Team_076): Paul Leonard OUT → Vince Lowry IN (stamina_rule2)

[02:17] Substitution (Team_076): Cade Barnes OUT → Kevin Nowitzki IN (stamina_rule2)

[02:17] Substitution (Team_076): D'Angelo Tatum OUT → Jordan Doncic IN (stamina_rule2)

[02:04] Team_076 possession (Score: 24-21)
Jalen Poole attempts a Midrange. Contested by Dirk Lillard (4.5 feet, ZONE). JALEN POOLE MAKES IT!
Score: 24-23

[01:52] Team_027 possession (Score: 24-23)
CJ Green attempts a Midrange. Contested by Kevin Nowitzki (4.4 feet, ZONE). CJ GREEN MAKES IT!
Score: 26-23

[01:35] Team_076 possession (Score: 26-23)
Jordan Doncic drives, Ben Stewart stays with him. Jordan Doncic attempts a Dunk. Contested by Ben Stewart (4.1 feet, MAN). JORDAN DONCIC MAKES IT! Assist: Kevin Nowitzki
Score: 26-25

[01:19] Team_027 possession (Score: 26-25)
LeBron Russell attempts a Midrange. Contested by Kevin Nowitzki (4.2 feet, MAN). LeBron Russell misses. Rebound secured by Jordan Doncic.

[01:04] Team_076 possession (Score: 26-25)
Vince Lowry drives and kicks out. Vince Lowry attempts a 3Pt. Contested by Rudy Quickley (3.3 feet, ZONE). Vince Lowry misses. Rebound secured by Ben Stewart.

[00:47] Team_027 possession (Score: 26-25)
Ben Stewart drives, Jordan Doncic stays with him. Ben Stewart attempts a Layup. Contested by Jordan Doncic (3.2 feet, MAN). Ben Stewart misses. Offensive rebound by Ben Stewart! Ben Stewart puts it back in!
Score: 28-25

[00:34] Team_076 possession (Score: 28-25)
Jalen Poole drives, Ben Stewart stays with him. Jalen Poole attempts a Layup. Contested by Ben Stewart (5.0 feet, ZONE). Jalen Poole misses. Rebound secured by Dirk Lillard.

[00:21] Team_027 possession (Score: 28-25)
Dirk Lillard drives and kicks out. Rudy Quickley attempts a 3Pt. Contested by Vince Lowry (4.2 feet, MAN). RUDY QUICKLEY MAKES IT! Assist: Dirk Lillard
Score: 31-25

[00:07] Team_076 possession (Score: 31-25)
Vince Lowry attempts a 3Pt. Contested by Rudy Quickley (3.2 feet, ZONE). Vince Lowry misses. Rebound secured by Ben Stewart.

================================================================================
                              1ST QUARTER COMPLETE                              
================================================================================

1ST QUARTER SCORE: Team_027 31, Team_076 25

BOX SCORE:
================================================================================

Team_027
--------------------------------------------------------------------------------
Player                MIN  PTS  REB  AST  TO      FG   FG%      3P   3P%
--------------------------------------------------------------------------------
Scottie Harden         10    7    0    2   0   3/6    50.0     0/0   0.0
Bradley Dosunmu        10    5    3    0   0   2/3    66.7     0/0   0.0
Tim Johnson            10    5    0    1   0   2/3    66.7     0/0   0.0
John Russell           10    4    8    0   0   2/3    66.7     0/0   0.0
Tony Doncic            10    3    3    2   0   1/3    33.3     0/0   0.0
Rudy Quickley           2    3    0    0   0   1/1   100.0     0/0   0.0
CJ Green                2    2    0    0   0   1/1   100.0     0/0   0.0
Ben Stewart             2    2    3    0   0   1/1   100.0     0/0   0.0
LeBron Russell          2    0    0    0   0   0/1     0.0     0/0   0.0
Dirk Lillard            2    0    1    1   0   0/0     0.0     0/0   0.0

TEAM: FG: 13/22 (59.1%), 3PT: 4/8 (50.0%), REB: 18 (7 off, 11 def), AST: 6, TO: 1
TEAM FOULS: 5 [Team_076 in BONUS]


Team_076
--------------------------------------------------------------------------------
Player                MIN  PTS  REB  AST  TO      FG   FG%      3P   3P%
--------------------------------------------------------------------------------
Tobias Mitchell        10   10    1    0   0   4/7    57.1     0/0   0.0
Cade Barnes            10    4    4    2   0   2/2   100.0     0/0   0.0
D'Angelo Tatum         10    4    4    1   0   2/4    50.0     0/0   0.0
Dejounte LaVine        10    3    0    0   0   1/4    25.0     0/0   0.0
Jalen Poole             2    2    0    0   0   1/2    50.0     0/0   0.0
Jordan Doncic           2    2    1    0   0   1/1   100.0     0/0   0.0
Paul Leonard           10    0    0    1   0   0/0     0.0     0/0   0.0
Kevin Nowitzki          2    0    0    1   0   0/0     0.0     0/0   0.0
Vince Lowry             2    0    0    0   0   0/2     0.0     0/0   0.0

TEAM: FG: 11/22 (50.0%), 3PT: 4/10 (40.0%), REB: 10 (1 off, 9 def), AST: 5, TO: 1
TEAM FOULS: 2

================================================================================

================================================================================
                       2ND QUARTER - Team_027 vs Team_076                       
================================================================================

[12:00] Team_027 possession (Score: 31-25)
Bradley Dosunmu attempts a Midrange. Contested by Paul Leonard (5.2 feet, ZONE). BRADLEY DOSUNMU MAKES IT!
Score: 33-25

[11:43] Team_076 possession (Score: 33-25)
Paul Leonard drives, John Russell stays with him. Paul Leonard attempts a Layup. Contested by John Russell (4.3 feet, ZONE). Paul Leonard misses. Rebound secured by John Russell.

[11:28] Team_027 possession (Score: 33-25)
Scottie Harden attempts a 3Pt. Contested by Cade Barnes (3.6 feet, ZONE). SCOTTIE HARDEN MAKES IT! Assist: Tony Doncic
Score: 36-25

[11:10] Team_076 possession (Score: 36-25)
Dejounte LaVine throws a bad pass! Stolen by Tim Johnson! TURNOVER! (live ball)

[10:54] Team_027 possession (Score: 36-25)
Tony Doncic attempts a 3Pt. Contested by Cade Barnes (3.7 feet, ZONE). Tony Doncic misses. Rebound secured by D'Angelo Tatum.

[10:40] Team_076 possession (Score: 36-25)
D'Angelo Tatum attempts a Layup. Contested by John Russell (4.3 feet, MAN). D'Angelo Tatum misses. Offensive rebound by D'Angelo Tatum! D'Angelo Tatum kicks it out.

[10:28] Team_076 possession (Score: 36-25)
Cade Barnes attempts a Layup. BLOCKED BY TONY DONCIC! Ball is loose! Rebound secured by Bradley Dosunmu.

[10:14] Team_027 possession (Score: 36-25)
John Russell drives, D'Angelo Tatum stays with him. John Russell attempts a Dunk. Contested by D'Angelo Tatum (4.6 feet, MAN). John Russell misses. Rebound secured by Cade Barnes.

[10:00] Team_076 possession (Score: 36-25)
Dejounte LaVine drives to the basket... FOUL! Offensive foul on Dejounte LaVine! John Russell drew the charge! [Team fouls: 1] (Dejounte LaVine: 1 personal fouls) TURNOVER! (dead ball)

[09:43] Team_027 possession (Score: 36-25)
Tony Doncic drives, Tobias Mitchell stays with him. Tony Doncic attempts a Dunk. Contested by Tobias Mitchell (4.4 feet, MAN). TONY DONCIC MAKES IT! Assist: John Russell
Score: 38-25

[09:32] Team_076 possession (Score: 38-25)
Dejounte LaVine attempts a 3Pt. Contested by Tim Johnson (5.1 feet, ZONE). Dejounte LaVine misses. Rebound secured by Bradley Dosunmu.

[09:20] Team_027 possession (Score: 38-25)
Tony Doncic attempts a Layup. Contested by Cade Barnes (3.9 feet, ZONE). TONY DONCIC MAKES IT! Assist: Bradley Dosunmu
Score: 40-25

[09:05] Team_076 possession (Score: 40-25)
Paul Leonard drives, Scottie Harden stays with him. Paul Leonard attempts a Layup. Contested by Scottie Harden (5.2 feet, MAN). PAUL LEONARD MAKES IT! Assist: D'Angelo Tatum
Score: 40-27

[08:49] Team_027 possession (Score: 40-27)
Scottie Harden drives and kicks out. Scottie Harden attempts a 3Pt. Contested by Cade Barnes (3.9 feet, ZONE). Scottie Harden misses. Rebound secured by Tobias Mitchell.

[08:36] Team_076 possession (Score: 40-27)
FOUL! Reach-in foul on Scottie Harden during the drive. [Team fouls: 1] No free throws, side out. (Scottie Harden: 1 personal fouls)

[08:18] Team_076 possession (Score: 40-27)
Tobias Mitchell drives and kicks out. Paul Leonard attempts a Midrange. Contested by Tony Doncic (4.3 feet, ZONE). Paul Leonard misses. Rebound secured by Tony Doncic.

[08:01] Team_027 possession (Score: 40-27)
Tony Doncic attempts a Layup. Contested by Tobias Mitchell (4.6 feet, MAN). TONY DONCIC MAKES IT!
Score: 42-27

[07:44] Team_076 possession (Score: 42-27)
Paul Leonard attempts a 3Pt. Contested by Scottie Harden (5.3 feet, MAN). Paul Leonard misses. Rebound secured by John Russell.

[07:31] Team_027 possession (Score: 42-27)
Tony Doncic attempts a Midrange. Contested by Paul Leonard (5.6 feet, ZONE). Tony Doncic misses. Rebound secured by Tobias Mitchell.

[07:15] Team_076 possession (Score: 42-27)
Cade Barnes drives to the basket... Cade Barnes throws a bad pass out of bounds! TURNOVER! (dead ball)

[07:15] Substitution (Team_027): Tim Johnson OUT → CJ Green IN (stamina_rule2)

[07:15] Substitution (Team_027): Tony Doncic OUT → Dirk Lillard IN (stamina_rule2)

[07:15] Substitution (Team_027): Scottie Harden OUT → Rudy Quickley IN (stamina_rule2)

[07:15] Substitution (Team_027): Bradley Dosunmu OUT → LeBron Russell IN (stamina_rule2)

[07:15] Substitution (Team_027): John Russell OUT → Ben Stewart IN (stamina_rule2)

[07:15] Substitution (Team_076): Dejounte LaVine OUT → Pascal Lowry IN (stamina_rule2)

[07:15] Substitution (Team_076): Tobias Mitchell OUT → Jalen Poole IN (stamina_rule2)

[07:15] Substitution (Team_076): Paul Leonard OUT → Vince Lowry IN (stamina_rule2)

[07:15] Substitution (Team_076): Cade Barnes OUT → Kevin Nowitzki IN (stamina_rule2)

[07:15] Substitution (Team_076): D'Angelo Tatum OUT → Jordan Doncic IN (stamina_rule2)

[07:00] Team_027 possession (Score: 42-27)
CJ Green attempts a Midrange. Wide open! Pascal Lowry is 6.4 feet away. [MAN] CJ GREEN MAKES IT! Assist: Rudy Quickley
Score: 44-27

[06:43] Team_076 possession (Score: 44-27)
FOUL! Shooting foul on Ben Stewart. Jordan Doncic to the line for 2 free throws. [Team fouls: 2] (Ben Stewart: 1 personal fouls)   FT 1/2: GOOD   FT 2/2: GOOD Jordan Doncic makes 2/2 from the line.
Score: 44-29

[06:27] Team_027 possession (Score: 44-29)
Dirk Lillard attempts a 3Pt. Contested by Vince Lowry (4.2 feet, ZONE). Dirk Lillard misses. Rebound secured by Kevin Nowitzki.

[06:11] Team_076 possession (Score: 44-29)
Jordan Doncic attempts a 3Pt. Contested by Rudy Quickley (2.7 feet, ZONE). Jordan Doncic misses. Offensive rebound by Kevin Nowitzki! Kevin Nowitzki kicks it out.

[06:00] Team_076 possession (Score: 44-29)
Kevin Nowitzki attempts a 3Pt. Contested by Rudy Quickley (3.5 feet, ZONE). Kevin Nowitzki misses. FOUL! Loose ball foul on Dirk Lillard during the rebound battle. [Team fouls: 3] No free throws, side out. (Dirk Lillard: 1 personal fouls)

[05:45] Team_076 possession (Score: 44-29)
Vince Lowry attempts a Layup. BLOCKED BY RUDY QUICKLEY! Ball is loose! Offensive rebound by Kevin Nowitzki! Kevin Nowitzki kicks it out.

[05:32] Team_076 possession (Score: 44-29)
Kevin Nowitzki makes the Dunk and draws the foul on Dirk Lillard! And-1! Kevin Nowitzki to the line for 1. [Team fouls: 4] (Dirk Lillard: 2 personal fouls)   FT 1/1: MISS Kevin Nowitzki makes 0/1 from the line. Offensive rebound by Kevin Nowitzki! Kevin Nowitzki kicks it out.
Score: 44-31

[05:18] Team_076 possession (Score: 44-31)
Kevin Nowitzki attempts a 3Pt. Contested by Rudy Quickley (3.5 feet, ZONE). Kevin Nowitzki misses. Offensive rebound by Jordan Doncic! Jordan Doncic kicks it out.

[05:06] Team_076 possession (Score: 44-31)
FOUL! Reach-in foul on Ben Stewart during the drive. [IN THE BONUS! 5 team fouls] Kevin Nowitzki to the line for 2 free throws. (Ben Stewart: 2 personal fouls)   FT 1/2: GOOD   FT 2/2: GOOD Kevin Nowitzki makes 2/2 from the line.
Score: 44-33

[04:53] Team_027 possession (Score: 44-33)
CJ Green attempts a 3Pt. Wide open! Pascal Lowry is 6.4 feet away. [MAN] CJ Green misses. Rebound secured by Jordan Doncic.

[04:40] Team_076 possession (Score: 44-33)
FOUL! Shooting foul on Dirk Lillard. Kevin Nowitzki to the line for 2 free throws. [BONUS: 6 team fouls] (Dirk Lillard: 3 personal fouls)   FT 1/2: GOOD   FT 2/2: GOOD Kevin Nowitzki makes 2/2 from the line.
Score: 44-35

[04:29] Team_027 possession (Score: 44-35)
FOUL! Reach-in foul on Vince Lowry during the drive. [Team fouls: 2] No free throws, side out. (Vince Lowry: 1 personal fouls)

[04:10] Team_027 possession (Score: 44-35)
Rudy Quickley attempts a Midrange. Contested by Vince Lowry (4.6 feet, MAN). Rudy Quickley misses. Rebound secured by Jordan Doncic.

[03:57] Team_076 possession (Score: 44-35)
FOUL! Reach-in foul on Ben Stewart during the drive. [IN THE BONUS! 7 team fouls] Jalen Poole to the line for 2 free throws. (Ben Stewart: 3 personal fouls)   FT 1/2: GOOD   FT 2/2: MISS Jalen Poole makes 1/2 from the line. Rebound secured by Ben Stewart.
Score: 44-36

[03:46] Team_027 possession (Score: 44-36)
LeBron Russell attempts a Layup. BLOCKED BY JORDAN DONCIC! Ball is loose! Rebound secured by Jordan Doncic.

[03:33] Team_076 possession (Score: 44-36)
Kevin Nowitzki attempts a Midrange. Contested by LeBron Russell (5.7 feet, MAN). Kevin Nowitzki misses. Offensive rebound by Kevin Nowitzki! Kevin Nowitzki kicks it out.

[03:16] Team_076 possession (Score: 44-36)
Pascal Lowry attempts a 3Pt. Contested by CJ Green (4.7 feet, MAN). Pascal Lowry misses. Rebound secured by LeBron Russell.

[03:01] Team_027 possession (Score: 44-36)
Rudy Quickley attempts a Midrange. Contested by Kevin Nowitzki (4.7 feet, ZONE). Rudy Quickley misses. Offensive rebound by Ben Stewart! Ben Stewart puts it back in!
Score: 46-36

[02:48] Team_076 possession (Score: 46-36)
Pascal Lowry drives to the basket... Pascal Lowry throws a bad pass out of bounds! TURNOVER! (dead ball)

[02:37] Team_027 possession (Score: 46-36)
Rudy Quickley drives, Vince Lowry stays with him. Rudy Quickley attempts a Layup. Contested by Vince Lowry (4.6 feet, MAN). Rudy Quickley misses. Rebound secured by Vince Lowry.

[02:19] Team_076 possession (Score: 46-36)
FOUL! Reach-in foul on Ben Stewart during the drive. [IN THE BONUS! 8 team fouls] Pascal Lowry to the line for 2 free throws. (Ben Stewart: 4 personal fouls)   FT 1/2: GOOD   FT 2/2: GOOD Pascal Lowry makes 2/2 from the line.
Score: 46-38

[02:04] Team_027 possession (Score: 46-38)
Rudy Quickley attempts a Midrange. Contested by Vince Lowry (4.6 feet, ZONE). RUDY QUICKLEY MAKES IT!
Score: 48-38

[01:47] Team_076 possession (Score: 48-38)
Pascal Lowry attempts a 3Pt. Contested by CJ Green (4.7 feet, MAN). Pascal Lowry misses. Rebound secured by Dirk Lillard.

[01:34] Team_027 possession (Score: 48-38)
Rudy Quickley drives to the basket... Rudy Quickley throws a bad pass! Stolen by Vince Lowry! TURNOVER! (live ball)

[01:18] Team_076 possession (Score: 48-38)
FOUL! Reach-in foul on Ben Stewart during the drive. [IN THE BONUS! 9 team fouls] Pascal Lowry to the line for 2 free throws. (Ben Stewart: 5 personal fouls)   FT 1/2: MISS   FT 2/2: GOOD Pascal Lowry makes 1/2 from the line.
Score: 48-39

[01:02] Team_027 possession (Score: 48-39)
Dirk Lillard attempts a Midrange. Contested by Jalen Poole (5.5 feet, MAN). Dirk Lillard misses. Offensive rebound by Dirk Lillard! Dirk Lillard kicks it out.

[00:48] Team_027 possession (Score: 48-39)
Dirk Lillard attempts a 3Pt. Contested by Vince Lowry (4.3 feet, ZONE). Dirk Lillard misses. Rebound secured by Jordan Doncic.

[00:38] Team_076 possession (Score: 48-39)
FOUL! Holding foul on CJ Green. [IN THE BONUS! 10 team fouls] Pascal Lowry to the line for 2 free throws. (CJ Green: 1 personal fouls)   FT 1/2: GOOD   FT 2/2: GOOD Pascal Lowry makes 2/2 from the line.
Score: 48-41

[00:19] Team_027 possession (Score: 48-41)
Dirk Lillard attempts a 3Pt. Contested by Vince Lowry (4.3 feet, ZONE). DIRK LILLARD MAKES IT! Assist: LeBron Russell
Score: 51-41

[00:03] Team_076 possession (Score: 51-41)
Jalen Poole attempts a Midrange. Contested by Dirk Lillard (4.6 feet, MAN). Jalen Poole misses. Rebound secured by LeBron Russell.

================================================================================
                              2ND QUARTER COMPLETE                              
================================================================================

2ND QUARTER SCORE: Team_027 20, Team_076 16

BOX SCORE:
================================================================================

Team_027
--------------------------------------------------------------------------------
Player                MIN  PTS  REB  AST  TO      FG   FG%      3P   3P%
--------------------------------------------------------------------------------
Tony Doncic            15    6    1    1   0   3/5    60.0     0/0   0.0
Scottie Harden         15    3    0    0   0   1/2    50.0     0/0   0.0
Dirk Lillard            9    3    2    0   0   1/3    33.3     0/0   0.0
Bradley Dosunmu        15    2    2    1   0   1/1   100.0     0/0   0.0
CJ Green                9    2    0    0   0   1/2    50.0     0/0   0.0
Rudy Quickley           9    2    0    1   0   1/3    33.3     0/0   0.0
Ben Stewart             9    2    2    0   0   1/1   100.0     0/0   0.0
John Russell           15    0    2    1   0   0/1     0.0     0/0   0.0
LeBron Russell          9    0    2    1   0   0/1     0.0     0/0   0.0

TEAM: FG: 9/19 (47.4%), 3PT: 2/6 (33.3%), REB: 11 (2 off, 9 def), AST: 5, TO: 1
TEAM FOULS: 10 [Team_076 in BONUS]


Team_076
--------------------------------------------------------------------------------
Player                MIN  PTS  REB  AST  TO      FG   FG%      3P   3P%
--------------------------------------------------------------------------------
Pascal Lowry            9    5    0    0   0   3/5    60.0     0/0   0.0
Kevin Nowitzki          9    4    6    0   0   2/2   100.0     0/0   0.0
Paul Leonard           15    2    0    0   0   1/3    33.3     0/0   0.0
Jordan Doncic           9    2    5    0   0   1/1   100.0     0/0   0.0
D'Angelo Tatum         15    0    2    1   0   0/0     0.0     0/0   0.0
Cade Barnes            15    0    1    0   0   0/1     0.0     0/0   0.0
Dejounte LaVine        15    0    0    0   0   0/1     0.0     0/0   0.0
Tobias Mitchell        15    0    2    0   0   0/1     0.0     0/0   0.0
Jalen Poole             9    0    0    0   0   0/2     0.0     0/0   0.0
Vince Lowry             9    0    1    0   0   0/0     0.0     0/0   0.0

TEAM: FG: 7/16 (43.8%), 3PT: 0/4 (0.0%), REB: 17 (7 off, 10 def), AST: 1, TO: 4
TEAM FOULS: 2

================================================================================

================================================================================
                       3RD QUARTER - Team_027 vs Team_076                       
================================================================================

[12:00] Team_027 possession (Score: 51-41)
Tim Johnson drives and kicks out. John Russell attempts a 3Pt. Contested by D'Angelo Tatum (3.7 feet, MAN). John Russell misses. Rebound secured by Tobias Mitchell.

[11:48] Team_076 possession (Score: 51-41)
Dejounte LaVine attempts a Layup. BLOCKED BY TIM JOHNSON! Ball is loose! Rebound secured by John Russell.

[11:33] Team_027 possession (Score: 51-41)
Bradley Dosunmu attempts a Layup. Contested by Cade Barnes (3.6 feet, ZONE). Bradley Dosunmu misses. Rebound secured by D'Angelo Tatum.

[11:15] Team_076 possession (Score: 51-41)
Paul Leonard drives to the basket... FOUL! Offensive foul on Paul Leonard! Scottie Harden drew the charge! [Team fouls: 1] (Paul Leonard: 1 personal fouls) TURNOVER! (dead ball)

[11:00] Team_027 possession (Score: 51-41)
Bradley Dosunmu attempts a Midrange. Contested by Cade Barnes (3.6 feet, MAN). BRADLEY DOSUNMU MAKES IT! Assist: John Russell
Score: 53-41

[10:45] Team_076 possession (Score: 53-41)
D'Angelo Tatum attempts a 3Pt. Contested by Tony Doncic (4.2 feet, ZONE). D'ANGELO TATUM MAKES IT!
Score: 53-44

[10:30] Team_027 possession (Score: 53-44)
Bradley Dosunmu drives, Cade Barnes stays with him. Bradley Dosunmu attempts a Dunk. Contested by Cade Barnes (3.6 feet, ZONE). Bradley Dosunmu misses. Offensive rebound by Bradley Dosunmu! Bradley Dosunmu kicks it out.

[10:14] Team_027 possession (Score: 53-44)
Scottie Harden attempts a Layup. Contested by Cade Barnes (3.6 feet, ZONE). SCOTTIE HARDEN MAKES IT! Assist: John Russell
Score: 55-44

[09:56] Team_076 possession (Score: 55-44)
FOUL! Shooting foul on Scottie Harden. Paul Leonard to the line for 2 free throws. [Team fouls: 1] (Scottie Harden: 1 personal fouls)   FT 1/2: GOOD   FT 2/2: GOOD Paul Leonard makes 2/2 from the line.
Score: 55-46

[09:39] Team_027 possession (Score: 55-46)
Tony Doncic attempts a 3Pt. Contested by Cade Barnes (3.6 feet, ZONE). Tony Doncic misses. Rebound secured by Cade Barnes.

[09:25] Team_076 possession (Score: 55-46)
Tobias Mitchell attempts a 3Pt. Contested by Tim Johnson (5.3 feet, ZONE). Tobias Mitchell misses. Rebound secured by Tony Doncic.

[09:13] Team_027 possession (Score: 55-46)
Bradley Dosunmu makes the Layup and draws the foul on Cade Barnes! And-1! Bradley Dosunmu to the line for 1. [Team fouls: 2] (Cade Barnes: 1 personal fouls)   FT 1/1: GOOD Bradley Dosunmu makes 1/1 from the line.
Score: 58-46

[08:55] Team_076 possession (Score: 58-46)
D'Angelo Tatum drives and kicks out. D'Angelo Tatum attempts a 3Pt. Contested by Tim Johnson (4.9 feet, ZONE). D'Angelo Tatum misses. Rebound secured by Tony Doncic.

[08:40] Team_027 possession (Score: 58-46)
Tim Johnson drives and kicks out. John Russell attempts a Midrange. Contested by D'Angelo Tatum (3.7 feet, MAN). John Russell misses. Offensive rebound by Bradley Dosunmu! Bradley Dosunmu kicks it out.

[08:23] Team_027 possession (Score: 58-46)
Bradley Dosunmu loses the ball! Stripped by Cade Barnes! TURNOVER! (live ball)

[08:10] Team_076 possession (Score: 58-46)
Paul Leonard commits a violation (traveling/carry)! TURNOVER! (dead ball)

[07:56] Team_027 possession (Score: 58-46)
Scottie Harden attempts a 3Pt. Contested by Dejounte LaVine (4.9 feet, ZONE). Scottie Harden misses. Rebound secured by Tobias Mitchell.

[07:42] Team_076 possession (Score: 58-46)
Paul Leonard attempts a Midrange. Contested by Scottie Harden (4.9 feet, ZONE). Paul Leonard misses. Offensive rebound by Cade Barnes! Cade Barnes kicks it out.

[07:29] Team_076 possession (Score: 58-46)
Tobias Mitchell drives, John Russell stays with him. Tobias Mitchell attempts a Layup. Contested by John Russell (4.3 feet, ZONE). TOBIAS MITCHELL MAKES IT! Assist: Cade Barnes
Score: 58-48

[07:12] Team_027 possession (Score: 58-48)
Tim Johnson drives, Dejounte LaVine stays with him. Tim Johnson attempts a Dunk. Contested by Dejounte LaVine (5.1 feet, MAN). TIM JOHNSON MAKES IT! Assist: Scottie Harden
Score: 60-48

[06:55] Team_076 possession (Score: 60-48)
FOUL! Holding foul on Tony Doncic. [Team fouls: 2] No free throws, side out. (Tony Doncic: 1 personal fouls)

[06:41] Team_076 possession (Score: 60-48)
D'Angelo Tatum attempts a 3Pt. Contested by Tim Johnson (5.1 feet, ZONE). D'Angelo Tatum misses. Rebound secured by Bradley Dosunmu.

[06:21] Team_027 possession (Score: 60-48)
John Russell attempts a Midrange. Contested by D'Angelo Tatum (4.5 feet, MAN). John Russell misses. Rebound secured by D'Angelo Tatum.

[06:06] Team_076 possession (Score: 60-48)
Cade Barnes drives, Bradley Dosunmu stays with him. Cade Barnes attempts a Layup. Contested by Bradley Dosunmu (4.6 feet, MAN). CADE BARNES MAKES IT! Assist: D'Angelo Tatum
Score: 60-50

[05:55] Team_027 possession (Score: 60-50)
Tony Doncic drives to the basket... FOUL! Offensive foul on Tony Doncic! Cade Barnes drew the charge! [Team fouls: 3] (Tony Doncic: 2 personal fouls) TURNOVER! (dead ball)

[05:36] Team_076 possession (Score: 60-50)
Paul Leonard attempts a 3Pt. Contested by Tim Johnson (5.2 feet, ZONE). Paul Leonard misses. Rebound secured by John Russell.

[05:22] Team_027 possession (Score: 60-50)
Bradley Dosunmu drives, Cade Barnes stays with him. Bradley Dosunmu attempts a Layup. Contested by Cade Barnes (3.6 feet, ZONE). BRADLEY DOSUNMU MAKES IT! Assist: Tony Doncic
Score: 62-50

[05:10] Team_076 possession (Score: 62-50)
Cade Barnes attempts a Midrange. Contested by Scottie Harden (4.7 feet, ZONE). Cade Barnes misses. Offensive rebound by D'Angelo Tatum! D'Angelo Tatum kicks it out.

[04:54] Team_076 possession (Score: 62-50)
Paul Leonard attempts a Midrange. Contested by Scottie Harden (4.9 feet, MAN). PAUL LEONARD MAKES IT! Assist: D'Angelo Tatum
Score: 62-52

[04:42] Team_027 possession (Score: 62-52)
Scottie Harden attempts a Midrange. Contested by Paul Leonard (5.2 feet, ZONE). SCOTTIE HARDEN MAKES IT!
Score: 64-52

[04:30] Team_076 possession (Score: 64-52)
FOUL! Reach-in foul on Scottie Harden during the drive. [Team fouls: 4] No free throws, side out. (Scottie Harden: 2 personal fouls)

[04:16] Team_076 possession (Score: 64-52)
Tobias Mitchell attempts a Midrange. Contested by Tony Doncic (4.3 feet, MAN). Tobias Mitchell misses. Rebound secured by Tony Doncic.

[04:02] Team_027 possession (Score: 64-52)
Scottie Harden attempts a 3Pt. Contested by Paul Leonard (5.2 feet, MAN). Scottie Harden misses. Offensive rebound by John Russell! John Russell puts it back in!
Score: 66-52

[03:47] Team_076 possession (Score: 66-52)
D'Angelo Tatum attempts a Midrange. Contested by John Russell (4.3 feet, MAN). D'Angelo Tatum misses. Rebound secured by Tony Doncic.

[03:32] Team_027 possession (Score: 66-52)
Scottie Harden attempts a 3Pt. Contested by Cade Barnes (3.7 feet, ZONE). Scottie Harden misses. Rebound secured by Tobias Mitchell.

[03:18] Team_076 possession (Score: 66-52)
D'Angelo Tatum attempts a 3Pt. Contested by Tim Johnson (5.3 feet, ZONE). D'Angelo Tatum misses. Rebound secured by John Russell.

[03:00] Team_027 possession (Score: 66-52)
Scottie Harden attempts a Midrange. Contested by Paul Leonard (5.3 feet, MAN). Scottie Harden misses. Rebound secured by Tobias Mitchell.

[02:44] Team_076 possession (Score: 66-52)
Dejounte LaVine makes the Layup and draws the foul on John Russell! And-1! Dejounte LaVine to the line for 1. [BONUS: 5 team fouls] (John Russell: 1 personal fouls)   FT 1/1: GOOD Dejounte LaVine makes 1/1 from the line.
Score: 66-55

[02:29] Team_027 possession (Score: 66-55)
Scottie Harden attempts a 3Pt. Contested by Cade Barnes (3.8 feet, ZONE). SCOTTIE HARDEN MAKES IT! Assist: Bradley Dosunmu
Score: 69-55

[02:11] Team_076 possession (Score: 69-55)
D'Angelo Tatum attempts a Layup. Contested by John Russell (4.4 feet, ZONE). D'Angelo Tatum misses. Rebound secured by Tony Doncic.

[02:00] Team_027 possession (Score: 69-55)
Scottie Harden attempts a Layup. Contested by Cade Barnes (3.8 feet, ZONE). Scottie Harden misses. Rebound secured by Tobias Mitchell.

[01:47] Team_076 possession (Score: 69-55)
Cade Barnes attempts a Midrange. Contested by Scottie Harden (5.0 feet, ZONE). Cade Barnes misses. Rebound secured by John Russell.

[01:34] Team_027 possession (Score: 69-55)
Bradley Dosunmu attempts a Layup. BLOCKED BY CADE BARNES! Ball is loose! Offensive rebound by Bradley Dosunmu! Bradley Dosunmu kicks it out.

[01:21] Team_027 possession (Score: 69-55)
John Russell drives, picks up D'Angelo Tatum. Help arrives from Tobias Mitchell! John Russell attempts a Layup. Contested by Tobias Mitchell (4.7 feet, MAN). JOHN RUSSELL MAKES IT!
Score: 71-55

[01:09] Team_076 possession (Score: 71-55)
Tobias Mitchell attempts a Midrange. Contested by Tony Doncic (4.6 feet, MAN). Tobias Mitchell misses. Rebound secured by Tony Doncic.

[00:56] Team_027 possession (Score: 71-55)
John Russell commits a violation (traveling/carry)! TURNOVER! (dead ball)

[00:56] Substitution (Team_027): Tim Johnson OUT → CJ Green IN (stamina_rule2)

[00:56] Substitution (Team_027): Tony Doncic OUT → Dirk Lillard IN (stamina_rule2)

[00:56] Substitution (Team_027): Scottie Harden OUT → Rudy Quickley IN (stamina_rule2)

[00:56] Substitution (Team_027): Bradley Dosunmu OUT → LeBron Russell IN (stamina_rule2)

[00:56] Substitution (Team_027): John Russell OUT → Ben Stewart IN (stamina_rule2)

[00:56] Substitution (Team_076): Dejounte LaVine OUT → Pascal Lowry IN (stamina_rule2)

[00:56] Substitution (Team_076): Tobias Mitchell OUT → Jalen Poole IN (stamina_rule2)

[00:56] Substitution (Team_076): Paul Leonard OUT → Vince Lowry IN (stamina_rule2)

[00:56] Substitution (Team_076): Cade Barnes OUT → Kevin Nowitzki IN (stamina_rule2)

[00:56] Substitution (Team_076): D'Angelo Tatum OUT → Jordan Doncic IN (stamina_rule2)

[00:40] Team_076 possession (Score: 71-55)
Vince Lowry attempts a Layup. BLOCKED BY BEN STEWART! Ball is loose! Rebound secured by LeBron Russell.

[00:27] Team_027 possession (Score: 71-55)
CJ Green drives to the basket... CJ Green loses the ball! Stripped by Pascal Lowry! TURNOVER! (live ball)

[00:14] Team_076 possession (Score: 71-55)
Jalen Poole makes the 3Pt and draws the foul on Dirk Lillard! And-1! Jalen Poole to the line for 1. [BONUS: 6 team fouls] (Dirk Lillard: 1 personal fouls)   FT 1/1: GOOD Jalen Poole makes 1/1 from the line.
Score: 71-59

[00:02] Team_027 possession (Score: 71-59)
FOUL! Shooting foul on Vince Lowry. Rudy Quickley to the line for 2 free throws. [Team fouls: 3] (Vince Lowry: 1 personal fouls)   FT 1/2: GOOD   FT 2/2: GOOD Rudy Quickley makes 2/2 from the line.
Score: 73-59

================================================================================
                              3RD QUARTER COMPLETE                              
================================================================================

3RD QUARTER SCORE: Team_027 22, Team_076 18

BOX SCORE:
================================================================================

Team_027
--------------------------------------------------------------------------------
Player                MIN  PTS  REB  AST  TO      FG   FG%      3P   3P%
--------------------------------------------------------------------------------
Bradley Dosunmu        26    7    4    1   0   3/4    75.0     0/0   0.0
Scottie Harden         26    7    0    1   0   3/7    42.9     0/0   0.0
John Russell           26    4    5    2   0   2/3    66.7     0/0   0.0
Tim Johnson            26    2    0    0   0   1/2    50.0     0/0   0.0
Rudy Quickley          10    2    0    0   0   1/1   100.0     0/0   0.0
Tony Doncic            26    0    6    1   0   0/1     0.0     0/0   0.0
LeBron Russell         10    0    1    0   0   0/0     0.0     0/0   0.0

TEAM: FG: 10/18 (55.6%), 3PT: 2/5 (40.0%), REB: 16 (4 off, 12 def), AST: 5, TO: 4
TEAM FOULS: 6 [Team_076 in BONUS]


Team_076
--------------------------------------------------------------------------------
Player                MIN  PTS  REB  AST  TO      FG   FG%      3P   3P%
--------------------------------------------------------------------------------
Paul Leonard           26    4    0    0   0   2/3    66.7     0/0   0.0
Jalen Poole            10    4    0    0   0   1/1   100.0     0/0   0.0
Dejounte LaVine        26    3    0    0   0   1/2    50.0     0/0   0.0
D'Angelo Tatum         26    3    3    2   0   1/6    16.7     0/0   0.0
Tobias Mitchell        26    2    5    0   0   1/4    25.0     0/0   0.0
Cade Barnes            26    2    2    1   0   1/2    50.0     0/0   0.0
Vince Lowry            10    0    0    0   0   0/1     0.0     0/0   0.0

TEAM: FG: 7/19 (36.8%), 3PT: 2/6 (33.3%), REB: 10 (2 off, 8 def), AST: 3, TO: 2
TEAM FOULS: 3

================================================================================

================================================================================
                       4TH QUARTER - Team_027 vs Team_076                       
================================================================================

[12:00] Team_027 possession (Score: 73-59)
Bradley Dosunmu drives, picks up Cade Barnes. Help arrives from Tobias Mitchell! Bradley Dosunmu attempts a Dunk. Contested by Tobias Mitchell (3.7 feet, ZONE). BRADLEY DOSUNMU MAKES IT!
Score: 75-59

[11:45] Team_076 possession (Score: 75-59)
FOUL! Holding foul on Tim Johnson. [Team fouls: 1] No free throws, side out. (Tim Johnson: 1 personal fouls)

[11:31] Team_076 possession (Score: 75-59)
Cade Barnes attempts a 3Pt. Contested by Tim Johnson (5.3 feet, ZONE). Cade Barnes misses. Rebound secured by John Russell.

[11:17] Team_027 possession (Score: 75-59)
Tony Doncic attempts a 3Pt. Contested by Tobias Mitchell (4.4 feet, MAN). TONY DONCIC MAKES IT! Assist: Scottie Harden
Score: 78-59

[11:01] Team_076 possession (Score: 78-59)
Paul Leonard attempts a 3Pt. Contested by Tim Johnson (5.5 feet, ZONE). Paul Leonard misses. Offensive rebound by D'Angelo Tatum! D'Angelo Tatum kicks it out.

[10:50] Team_076 possession (Score: 78-59)
D'Angelo Tatum drives and kicks out. Tobias Mitchell attempts a 3Pt. Contested by Tony Doncic (4.1 feet, MAN). Tobias Mitchell misses. Rebound secured by Tony Doncic.

[10:37] Team_027 possession (Score: 78-59)
Bradley Dosunmu attempts a 3Pt. Contested by Cade Barnes (3.9 feet, MAN). Bradley Dosunmu misses. Rebound secured by Cade Barnes.

[10:21] Team_076 possession (Score: 78-59)
Paul Leonard commits a violation (traveling/carry)! TURNOVER! (dead ball)

[10:21] Substitution (Team_027): Tim Johnson OUT → CJ Green IN (stamina_rule2)

[10:21] Substitution (Team_027): Tony Doncic OUT → Dirk Lillard IN (stamina_rule2)

[10:21] Substitution (Team_027): Scottie Harden OUT → Rudy Quickley IN (stamina_rule2)

[10:21] Substitution (Team_027): Bradley Dosunmu OUT → LeBron Russell IN (stamina_rule2)

[10:21] Substitution (Team_027): John Russell OUT → Ben Stewart IN (stamina_rule2)

[10:21] Substitution (Team_076): Dejounte LaVine OUT → Pascal Lowry IN (stamina_rule2)

[10:21] Substitution (Team_076): Tobias Mitchell OUT → Jalen Poole IN (stamina_rule2)

[10:21] Substitution (Team_076): Paul Leonard OUT → Vince Lowry IN (stamina_rule2)

[10:21] Substitution (Team_076): Cade Barnes OUT → Kevin Nowitzki IN (stamina_rule2)

[10:21] Substitution (Team_076): D'Angelo Tatum OUT → Jordan Doncic IN (stamina_rule2)

[10:07] Team_027 possession (Score: 78-59)
LeBron Russell drives, Kevin Nowitzki stays with him. LeBron Russell attempts a Layup. Contested by Kevin Nowitzki (4.2 feet, MAN). LeBron Russell misses. Rebound secured by Kevin Nowitzki.

[09:53] Team_076 possession (Score: 78-59)
Jalen Poole attempts a 3Pt. Contested by Dirk Lillard (4.5 feet, MAN). Jalen Poole misses. Rebound secured by Dirk Lillard.

[09:38] Team_027 possession (Score: 78-59)
LeBron Russell attempts a 3Pt. Contested by Vince Lowry (4.2 feet, ZONE). LeBron Russell misses. Rebound secured by Jordan Doncic.

[09:24] Team_076 possession (Score: 78-59)
Jalen Poole makes the Layup and draws the foul on Dirk Lillard! And-1! Jalen Poole to the line for 1. [Team fouls: 2] (Dirk Lillard: 1 personal fouls)   FT 1/1: GOOD Jalen Poole makes 1/1 from the line.
Score: 78-62

[09:08] Team_027 possession (Score: 78-62)
Ben Stewart makes the Layup and draws the foul on Jordan Doncic! And-1! Ben Stewart to the line for 1. [Team fouls: 1] (Jordan Doncic: 1 personal fouls)   FT 1/1: GOOD Ben Stewart makes 1/1 from the line.
Score: 81-62

[08:52] Team_076 possession (Score: 81-62)
FOUL! Reach-in foul on Ben Stewart during the drive. [Team fouls: 3] No free throws, side out. (Ben Stewart: 1 personal fouls)

[08:36] Team_076 possession (Score: 81-62)
Vince Lowry drives, LeBron Russell stays with him. Vince Lowry attempts a Layup. Contested by LeBron Russell (5.4 feet, ZONE). Vince Lowry misses. Offensive rebound by Jordan Doncic! Jordan Doncic kicks it out.

[08:25] Team_076 possession (Score: 81-62)
FOUL! Holding foul on Ben Stewart. [Team fouls: 4] No free throws, side out. (Ben Stewart: 2 personal fouls)

[08:12] Team_076 possession (Score: 81-62)
Kevin Nowitzki attempts a Layup. Contested by Ben Stewart (4.9 feet, ZONE). Kevin Nowitzki misses. Rebound secured by Dirk Lillard.

[07:59] Team_027 possession (Score: 81-62)
Ben Stewart attempts a Layup. Contested by Jordan Doncic (3.2 feet, MAN). Ben Stewart misses. Offensive rebound by Dirk Lillard! Dirk Lillard kicks it out.

[07:47] Team_027 possession (Score: 81-62)
FOUL! Holding foul on Kevin Nowitzki. [Team fouls: 2] No free throws, side out. (Kevin Nowitzki: 1 personal fouls)

[07:34] Team_027 possession (Score: 81-62)
Ben Stewart attempts a Layup. Contested by Jordan Doncic (3.2 feet, MAN). BEN STEWART MAKES IT!
Score: 83-62

[07:19] Team_076 possession (Score: 83-62)
Jalen Poole attempts a 3Pt. Contested by Dirk Lillard (4.5 feet, MAN). Jalen Poole misses. Rebound secured by LeBron Russell.

[07:05] Team_027 possession (Score: 83-62)
Rudy Quickley attempts a 3Pt. Contested by Vince Lowry (4.6 feet, ZONE). Rudy Quickley misses. Rebound secured by Kevin Nowitzki.

[06:50] Team_076 possession (Score: 83-62)
Jordan Doncic drives and kicks out. Kevin Nowitzki attempts a 3Pt. Contested by Rudy Quickley (3.3 feet, ZONE). KEVIN NOWITZKI MAKES IT! Assist: Vince Lowry
Score: 83-65

[06:34] Team_027 possession (Score: 83-65)
Dirk Lillard drives to the basket... FOUL! Offensive foul on Dirk Lillard! Jalen Poole drew the charge! [Team fouls: 5] (Dirk Lillard: 2 personal fouls) TURNOVER! (dead ball)

[06:22] Team_076 possession (Score: 83-65)
Pascal Lowry attempts a 3Pt. Contested by Rudy Quickley (2.9 feet, ZONE). Pascal Lowry misses. Rebound secured by Ben Stewart.

[06:10] Team_027 possession (Score: 83-65)
Ben Stewart drives, picks up Jordan Doncic. Help arrives from Jalen Poole! Ben Stewart attempts a Layup. Contested by Jalen Poole (3.2 feet, MAN). BEN STEWART MAKES IT!
Score: 85-65

[05:56] Team_076 possession (Score: 85-65)
Pascal Lowry attempts a Midrange. BLOCKED BY BEN STEWART! Ball is loose! Offensive rebound by Kevin Nowitzki! Kevin Nowitzki kicks it out.

[05:39] Team_076 possession (Score: 85-65)
Kevin Nowitzki attempts a 3Pt. Contested by LeBron Russell (5.7 feet, MAN). Kevin Nowitzki misses. Rebound secured by LeBron Russell.

[05:27] Team_027 possession (Score: 85-65)
Ben Stewart drives, picks up Jordan Doncic. Help arrives from Jalen Poole! Ben Stewart attempts a Dunk. Contested by Jalen Poole (3.2 feet, ZONE). BEN STEWART MAKES IT! Assist: Rudy Quickley
Score: 87-65

[05:14] Team_076 possession (Score: 87-65)
Pascal Lowry drives to the basket... Pascal Lowry loses control! Ball rolls out of bounds! TURNOVER! (dead ball)

[04:59] Team_027 possession (Score: 87-65)
FOUL! Reach-in foul on Jordan Doncic during the drive. [Team fouls: 3] No free throws, side out. (Jordan Doncic: 2 personal fouls)

[04:46] Team_027 possession (Score: 87-65)
Dirk Lillard attempts a Midrange. Wide open! Pascal Lowry is 6.3 feet away. [ZONE] DIRK LILLARD MAKES IT! Assist: LeBron Russell
Score: 89-65

[04:27] Team_076 possession (Score: 89-65)
Pascal Lowry attempts a 3Pt. Contested by CJ Green (4.7 feet, MAN). PASCAL LOWRY MAKES IT! Assist: Kevin Nowitzki
Score: 89-68

[04:12] Team_027 possession (Score: 89-68)
Rudy Quickley attempts a 3Pt. Contested by Vince Lowry (4.7 feet, ZONE). RUDY QUICKLEY MAKES IT! Assist: CJ Green
Score: 92-68

[03:56] Team_076 possession (Score: 92-68)
Jalen Poole attempts a 3Pt. Contested by Rudy Quickley (3.7 feet, ZONE). Jalen Poole misses. Rebound secured by LeBron Russell.

[03:39] Team_027 possession (Score: 92-68)
Ben Stewart makes the Layup and draws the foul on Jordan Doncic! And-1! Ben Stewart to the line for 1. [Team fouls: 4] (Jordan Doncic: 3 personal fouls)   FT 1/1: GOOD Ben Stewart makes 1/1 from the line.
Score: 95-68

[03:28] Team_076 possession (Score: 95-68)
Pascal Lowry attempts a Midrange. Contested by Dirk Lillard (3.8 feet, ZONE). Pascal Lowry misses. Rebound secured by LeBron Russell.

[03:14] Team_027 possession (Score: 95-68)
CJ Green attempts a 3Pt. Contested by Vince Lowry (4.4 feet, ZONE). CJ GREEN MAKES IT! Assist: Rudy Quickley
Score: 98-68

[02:57] Team_076 possession (Score: 98-68)
Jordan Doncic drives and kicks out. Jalen Poole attempts a Midrange. Contested by LeBron Russell (5.6 feet, ZONE). JALEN POOLE MAKES IT!
Score: 98-70

[02:41] Team_027 possession (Score: 98-70)
Dirk Lillard attempts a 3Pt. Wide open! Pascal Lowry is 6.4 feet away. [ZONE] Dirk Lillard misses. Rebound secured by Jordan Doncic.

[02:25] Team_076 possession (Score: 98-70)
Kevin Nowitzki attempts a 3Pt. Contested by LeBron Russell (5.8 feet, MAN). Kevin Nowitzki misses. Offensive rebound by Kevin Nowitzki! Kevin Nowitzki kicks it out.

[02:09] Team_076 possession (Score: 98-70)
Jalen Poole drives, picks up Dirk Lillard. Help arrives from Rudy Quickley! Jalen Poole attempts a Dunk. Contested by Rudy Quickley (4.6 feet, MAN). Jalen Poole misses. Rebound secured by LeBron Russell.

[01:54] Team_027 possession (Score: 98-70)
FOUL! Reach-in foul on Kevin Nowitzki during the drive. [IN THE BONUS! 5 team fouls] Rudy Quickley to the line for 2 free throws. (Kevin Nowitzki: 2 personal fouls)   FT 1/2: GOOD   FT 2/2: MISS Rudy Quickley makes 1/2 from the line. Offensive rebound by Dirk Lillard! Dirk Lillard kicks it out.
Score: 99-70

[01:41] Team_027 possession (Score: 99-70)
Ben Stewart attempts a Midrange. Contested by Jordan Doncic (3.5 feet, MAN). Ben Stewart misses. Offensive rebound by Dirk Lillard! Dirk Lillard kicks it out.

[01:22] Team_027 possession (Score: 99-70)
CJ Green attempts a 3Pt. Wide open! Pascal Lowry is 6.6 feet away. [MAN] CJ Green misses. Rebound secured by Vince Lowry.

[01:08] Team_076 possession (Score: 99-70)
Kevin Nowitzki makes the Layup and draws the foul on LeBron Russell! And-1! Kevin Nowitzki to the line for 1. [BONUS: 6 team fouls] (LeBron Russell: 1 personal fouls)   FT 1/1: GOOD Kevin Nowitzki makes 1/1 from the line.
Score: 99-73

[00:57] Team_027 possession (Score: 99-73)
Rudy Quickley drives and kicks out. Dirk Lillard attempts a 3Pt. Contested by Jalen Poole (5.7 feet, MAN). Dirk Lillard misses. Rebound secured by Jordan Doncic.

[00:46] Team_076 possession (Score: 99-73)
Kevin Nowitzki makes the Dunk and draws the foul on Dirk Lillard! And-1! Kevin Nowitzki to the line for 1. [BONUS: 7 team fouls] (Dirk Lillard: 3 personal fouls)   FT 1/1: MISS Kevin Nowitzki makes 0/1 from the line. Offensive rebound by Jordan Doncic! Jordan Doncic kicks it out.
Score: 99-75

[00:36] Team_076 possession (Score: 99-75)
Kevin Nowitzki drives, LeBron Russell stays with him. Kevin Nowitzki attempts a Dunk. Contested by LeBron Russell (6.0 feet, MAN). KEVIN NOWITZKI MAKES IT! Assist: Pascal Lowry
Score: 99-77

[00:17] Team_027 possession (Score: 99-77)
Dirk Lillard attempts a 3Pt. Contested by Jalen Poole (5.7 feet, MAN). DIRK LILLARD MAKES IT! Assist: CJ Green
Score: 102-77

[00:06] Team_076 possession (Score: 102-77)
Jalen Poole attempts a 3Pt. Contested by Rudy Quickley (4.1 feet, ZONE). JALEN POOLE MAKES IT! Assist: Pascal Lowry
Score: 102-80

================================================================================
                              4TH QUARTER COMPLETE                              
================================================================================

4TH QUARTER SCORE: Team_027 29, Team_076 21

BOX SCORE:
================================================================================

Team_027
--------------------------------------------------------------------------------
Player                MIN  PTS  REB  AST  TO      FG   FG%      3P   3P%
--------------------------------------------------------------------------------
Ben Stewart            21   12    1    0   0   5/5   100.0     0/0   0.0
Dirk Lillard           21    5    5    0   0   2/3    66.7     0/0   0.0
Tony Doncic            28    3    1    0   0   1/1   100.0     0/0   0.0
Rudy Quickley          21    3    0    2   0   1/3    33.3     0/0   0.0
CJ Green               21    3    0    2   0   1/2    50.0     0/0   0.0
Bradley Dosunmu        28    2    0    0   0   1/2    50.0     0/0   0.0
John Russell           28    0    1    0   0   0/0     0.0     0/0   0.0
Scottie Harden         28    0    0    1   0   0/0     0.0     0/0   0.0
LeBron Russell         21    0    5    1   0   0/2     0.0     0/0   0.0

TEAM: FG: 11/18 (61.1%), 3PT: 4/9 (44.4%), REB: 13 (3 off, 10 def), AST: 6, TO: 1
TEAM FOULS: 7 [Team_076 in BONUS]


Team_076
--------------------------------------------------------------------------------
Player                MIN  PTS  REB  AST  TO      FG   FG%      3P   3P%
--------------------------------------------------------------------------------
Kevin Nowitzki         21    8    4    1   0   3/5    60.0     0/0   0.0
Jalen Poole            21    8    0    0   0   3/7    42.9     0/0   0.0
Pascal Lowry           21    3    0    2   0   1/3    33.3     0/0   0.0
Cade Barnes            28    0    1    0   0   0/1     0.0     0/0   0.0
D'Angelo Tatum         28    0    1    0   0   0/1     0.0     0/0   0.0
Jordan Doncic          21    0    5    0   0   0/0     0.0     0/0   0.0
Vince Lowry            21    0    1    1   0   0/0     0.0     0/0   0.0

TEAM: FG: 7/17 (41.2%), 3PT: 2/8 (25.0%), REB: 12 (5 off, 7 def), AST: 4, TO: 2
TEAM FOULS: 5 [Team_027 in BONUS]

================================================================================

================================================================================
                               FULL GAME COMPLETE                               
================================================================================

FINAL SCORE: Team_027 102, Team_076 80

SCORING BY QUARTER:
--------------------------------------------------------------------------------
Team                     Q1     Q2     Q3     Q4    FINAL
--------------------------------------------------------------------------------
Team_027                 31     20     22     29      102
Team_076                 25     16     18     21       80
--------------------------------------------------------------------------------

FULL GAME BOX SCORE:
================================================================================

Team_027
--------------------------------------------------------------------------------
Player                MIN  PTS  REB  AST  TO      FG   FG%      3P   3P%      FT STL BLK
--------------------------------------------------------------------------------
Tim Johnson            28    7    0    1   0   3/5    60.0   1/1   100.0   0/0     1   1
Tony Doncic            28   12   11    4   0   4/9    44.4   1/4    25.0   0/0     0   1
Scottie Harden         28   17    0    4   1   9/17   52.9   5/9    55.6   2/2     0   0
Bradley Dosunmu        28   16    9    2   2   8/11   72.7   1/3    33.3   1/1     0   0
John Russell           28    8   16    3   1   2/5    40.0   0/0     0.0   0/0     0   0
CJ Green               21    7    0    2   0   3/5    60.0   1/3    33.3   0/0     0   0
Dirk Lillard           21    8    8    1   0   4/7    57.1   2/5    40.0   0/0     0   0
Rudy Quickley          21   10    0    3   1   4/8    50.0   1/2    50.0   3/4     0   1
LeBron Russell         21    0    8    2   0   0/4     0.0   0/1     0.0   0/0     0   0
Ben Stewart            21   16    6    0   2   6/6   100.0   0/0     0.0   2/2     0   2

TEAM: FG: 43/77 (55.8%), 3PT: 12/28 (42.9%), REB: 58 (16 off, 42 def), AST: 22, TO: 7


Team_076
--------------------------------------------------------------------------------
Player                MIN  PTS  REB  AST  TO      FG   FG%      3P   3P%      FT STL BLK
--------------------------------------------------------------------------------
Dejounte LaVine        28    6    0    0   2   2/7    28.6   1/4    25.0   1/1     0   0
Tobias Mitchell        28   12    8    0   1   5/12   41.7   3/7    42.9   1/2     0   1
Paul Leonard           28    6    0    1   4   3/6    50.0   0/2     0.0   2/2     0   0
Cade Barnes            28    6    8    3   0   3/6    50.0   0/1     0.0   2/2     1   1
D'Angelo Tatum         28    7   10    4   0   3/11   27.3   1/3    33.3   2/2     0   0
Pascal Lowry           21    8    0    2   0   3/7    42.9   1/4    25.0   5/6     1   0
Jalen Poole            21   14    0    0   0   4/11   36.4   2/5    40.0   3/4     0   0
Vince Lowry            21    0    2    1   1   0/3     0.0   0/1     0.0   0/0     1   0
Kevin Nowitzki         21   12   10    2   0   4/6    66.7   0/1     0.0   5/7     0   0
Jordan Doncic          21    4   11    0   1   4/4   100.0   0/0     0.0   2/2     0   1

TEAM: FG: 32/74 (43.2%), 3PT: 8/28 (28.6%), REB: 49 (15 off, 34 def), AST: 13, TO: 9

================================================================================
