================================================================================
                        FULL GAME - Team_046 vs Team_070                        
================================================================================

================================================================================
                       1ST QUARTER - Team_046 vs Team_070                       
================================================================================

[12:00] Team_046 possession (Score: 0-0)
Lauri Carter attempts a 3Pt. Contested by John Hyland (4.7 feet, MAN). Lauri Carter misses. FOUL! Loose ball foul on Khris Bryant during the rebound battle. [Team fouls: 1] No free throws, side out. (Khris Bryant: 1 personal fouls)

[11:45] Team_046 possession (Score: 0-0)
Victor Nowitzki attempts a 3Pt. Contested by LeBron Barnes (3.7 feet, MAN). VICTOR NOWITZKI MAKES IT! Assist: Lauri Carter
Score: 3-0

[11:32] Team_070 possession (Score: 3-0)
LeBron Barnes drives and kicks out. Khris Bryant attempts a Midrange. Contested by Cade Wall (3.7 feet, MAN). Khris Bryant misses. Rebound secured by Kevin Allen.

[11:17] Team_046 possession (Score: 3-0)
Victor Nowitzki drives, picks up Khris Bryant. Help arrives from LeBron Barnes! Victor Nowitzki attempts a Dunk. Contested by LeBron Barnes (2.6 feet, ZONE). VICTOR NOWITZKI MAKES IT! Assist: Kevin Allen
Score: 5-0

[11:02] Team_070 possession (Score: 5-0)
Cole Gasol attempts a Midrange. Contested by Cade Wall (3.9 feet, ZONE). Cole Gasol misses. Offensive rebound by Khris Bryant! Khris Bryant's putback is no good. Offensive rebound by Khris Bryant! Khris Bryant kicks it out.

[10:51] Team_070 possession (Score: 5-0)
Cole Gasol attempts a Midrange. Contested by D'Angelo O'Neal (4.2 feet, MAN). Cole Gasol misses. Rebound secured by Kevin Allen.

[10:35] Team_046 possession (Score: 5-0)
Kevin Allen attempts a 3Pt. Contested by Khris Bryant (2.7 feet, MAN). Kevin Allen misses. Rebound secured by Jabari Paul.

[10:19] Team_070 possession (Score: 5-0)
FOUL! Shooting foul on Lauri Carter. Cole Gasol to the line for 2 free throws. [Team fouls: 2] (Lauri Carter: 1 personal fouls)   FT 1/2: GOOD   FT 2/2: GOOD Cole Gasol makes 2/2 from the line.
Score: 5-2

[10:05] Team_046 possession (Score: 5-2)
D'Angelo O'Neal drives to the basket... D'Angelo O'Neal throws a bad pass! Stolen by Khris Bryant! TURNOVER! (live ball)

[09:52] Team_070 possession (Score: 5-2)
Khris Bryant attempts a 3Pt. Contested by Lauri Carter (3.1 feet, ZONE). Khris Bryant misses. Offensive rebound by Khris Bryant! Khris Bryant's putback is no good. Rebound secured by Kevin Allen.

[09:40] Team_046 possession (Score: 5-2)
FOUL! Shooting foul on Khris Bryant. Kevin Allen to the line for 2 free throws. [Team fouls: 2] (Khris Bryant: 2 personal fouls)   FT 1/2: GOOD   FT 2/2: GOOD Kevin Allen makes 2/2 from the line.
Score: 7-2

[09:24] Team_070 possession (Score: 7-2)
Khris Bryant throws a bad pass! Stolen by Cade Wall! TURNOVER! (live ball)

[09:12] Team_046 possession (Score: 7-2)
Victor Nowitzki attempts a Layup. Contested by LeBron Barnes (3.7 feet, MAN). VICTOR NOWITZKI MAKES IT! Assist: Cade Wall
Score: 9-2

[09:00] Team_070 possession (Score: 9-2)
John Hyland attempts a Midrange. Contested by Cade Wall (3.7 feet, ZONE). JOHN HYLAND MAKES IT!
Score: 9-4

[08:46] Team_046 possession (Score: 9-4)
Lauri Carter drives, picks up Khris Bryant. Help arrives from LeBron Barnes! Lauri Carter attempts a Dunk. Contested by LeBron Barnes (2.6 feet, ZONE). LAURI CARTER MAKES IT! Assist: Cade Wall
Score: 11-4

[08:35] Team_070 possession (Score: 11-4)
Khris Bryant attempts a Midrange. Contested by Cade Wall (3.6 feet, ZONE). KHRIS BRYANT MAKES IT!
Score: 11-6

[08:21] Team_046 possession (Score: 11-6)
FOUL! Shooting foul on Khris Bryant. Lauri Carter to the line for 3 free throws. [Team fouls: 3] (Khris Bryant: 3 personal fouls)   FT 1/3: GOOD   FT 2/3: GOOD   FT 3/3: GOOD Lauri Carter makes 3/3 from the line.
Score: 14-6

[08:02] Team_070 possession (Score: 14-6)
Khris Bryant throws a bad pass! Stolen by Cade Wall! TURNOVER! (live ball)

[07:49] Team_046 possession (Score: 14-6)
Kevin Allen attempts a Layup. Contested by Khris Bryant (2.7 feet, ZONE). KEVIN ALLEN MAKES IT! Assist: Victor Nowitzki
Score: 16-6

[07:39] Team_070 possession (Score: 16-6)
FOUL! Shooting foul on D'Angelo O'Neal. Cole Gasol to the line for 3 free throws. [Team fouls: 3] (D'Angelo O'Neal: 1 personal fouls)   FT 1/3: MISS   FT 2/3: GOOD   FT 3/3: MISS Cole Gasol makes 1/3 from the line. Rebound secured by Lauri Carter.
Score: 16-7

[07:23] Team_046 possession (Score: 16-7)
Lauri Carter attempts a Midrange. Contested by John Hyland (4.7 feet, MAN). Lauri Carter misses. Rebound secured by Jabari Paul.

[07:08] Team_070 possession (Score: 16-7)
LeBron Barnes drives and kicks out. Jabari Paul attempts a Midrange. Contested by Cade Wall (3.7 feet, ZONE). JABARI PAUL MAKES IT!
Score: 16-9

[06:53] Team_046 possession (Score: 16-9)
Kevin Allen drives and kicks out. Lauri Carter attempts a Midrange. Contested by John Hyland (4.5 feet, MAN). LAURI CARTER MAKES IT! Assist: D'Angelo O'Neal
Score: 18-9

[06:40] Team_070 possession (Score: 18-9)
FOUL! Holding foul on Lauri Carter. [Team fouls: 4] No free throws, side out. (Lauri Carter: 2 personal fouls)

[06:24] Team_070 possession (Score: 18-9)
LeBron Barnes drives to the basket... LeBron Barnes throws a bad pass out of bounds! TURNOVER! (dead ball)

[06:10] Team_046 possession (Score: 18-9)
Kevin Allen attempts a 3Pt. Contested by Khris Bryant (2.7 feet, ZONE). Kevin Allen misses. Rebound secured by LeBron Barnes.

[05:57] Team_070 possession (Score: 18-9)
Khris Bryant attempts a 3Pt. Contested by Cade Wall (3.7 feet, MAN). Khris Bryant misses. Rebound secured by Lauri Carter.

[05:39] Team_046 possession (Score: 18-9)
D'Angelo O'Neal attempts a Midrange. Contested by Cole Gasol (5.5 feet, MAN). D'ANGELO O'NEAL MAKES IT!
Score: 20-9

[05:24] Team_070 possession (Score: 20-9)
John Hyland attempts a 3Pt. Contested by Lauri Carter (3.2 feet, ZONE). John Hyland misses. Rebound secured by Kevin Allen.

[05:11] Team_046 possession (Score: 20-9)
Victor Nowitzki attempts a 3Pt. Contested by LeBron Barnes (3.7 feet, MAN). Victor Nowitzki misses. Rebound secured by LeBron Barnes.

[04:57] Team_070 possession (Score: 20-9)
Cole Gasol attempts a 3Pt. Contested by D'Angelo O'Neal (4.3 feet, MAN). Cole Gasol misses. Rebound secured by Cade Wall.

[04:43] Team_046 possession (Score: 20-9)
Victor Nowitzki attempts a Midrange. Contested by LeBron Barnes (3.7 feet, MAN). Victor Nowitzki misses. Rebound secured by LeBron Barnes.

[04:27] Team_070 possession (Score: 20-9)
Khris Bryant throws a bad pass out of bounds! TURNOVER! (dead ball)

[04:11] Team_046 possession (Score: 20-9)
D'Angelo O'Neal makes the Layup and draws the foul on LeBron Barnes! And-1! D'Angelo O'Neal to the line for 1. [Team fouls: 4] (LeBron Barnes: 1 personal fouls)   FT 1/1: GOOD D'Angelo O'Neal makes 1/1 from the line.
Score: 23-9

[04:01] Team_070 possession (Score: 23-9)
Khris Bryant attempts a Layup. Contested by Kevin Allen (4.7 feet, ZONE). KHRIS BRYANT MAKES IT! Assist: Jabari Paul
Score: 23-11

[03:45] Team_046 possession (Score: 23-11)
FOUL! Holding foul on Khris Bryant. [IN THE BONUS! 5 team fouls] Kevin Allen to the line for 2 free throws. (Khris Bryant: 4 personal fouls)   FT 1/2: GOOD   FT 2/2: MISS Kevin Allen makes 1/2 from the line. Offensive rebound by Kevin Allen! Kevin Allen kicks it out.
Score: 24-11

[03:34] Team_046 possession (Score: 24-11)
D'Angelo O'Neal attempts a Layup. Contested by Cole Gasol (5.6 feet, MAN). D'Angelo O'Neal misses. Rebound secured by Jabari Paul.

[03:19] Team_070 possession (Score: 24-11)
John Hyland attempts a 3Pt. Contested by Lauri Carter (3.4 feet, MAN). JOHN HYLAND MAKES IT! Assist: Cole Gasol
Score: 24-14

[03:06] Team_046 possession (Score: 24-14)
Lauri Carter attempts a 3Pt. Contested by Khris Bryant (2.9 feet, ZONE). Lauri Carter misses. Rebound secured by LeBron Barnes.

[02:49] Team_070 possession (Score: 24-14)
Khris Bryant makes the Dunk and draws the foul on Kevin Allen! And-1! Khris Bryant to the line for 1. [BONUS: 5 team fouls] (Kevin Allen: 2 personal fouls)   FT 1/1: GOOD Khris Bryant makes 1/1 from the line.
Score: 24-17

[02:35] Team_046 possession (Score: 24-17)
Kevin Allen attempts a Layup. Contested by Khris Bryant (3.0 feet, ZONE). Kevin Allen misses. Rebound secured by Jabari Paul.

[02:20] Team_070 possession (Score: 24-17)
LeBron Barnes drives, picks up Kevin Allen. Help arrives from D'Angelo O'Neal! LeBron Barnes attempts a Layup. Contested by D'Angelo O'Neal (5.4 feet, ZONE). LeBron Barnes misses. Offensive rebound by Khris Bryant! Khris Bryant's putback is no good. Offensive rebound by LeBron Barnes! LeBron Barnes kicks it out.

[02:04] Team_070 possession (Score: 24-17)
John Hyland attempts a 3Pt. Contested by Lauri Carter (3.5 feet, MAN). John Hyland misses. Offensive rebound by Khris Bryant! Khris Bryant puts it back in!
Score: 24-19

[01:49] Team_046 possession (Score: 24-19)
Lauri Carter drives and kicks out. D'Angelo O'Neal attempts a 3Pt. Contested by Khris Bryant (2.9 feet, ZONE). D'Angelo O'Neal misses. Rebound secured by Khris Bryant.

[01:36] Team_070 possession (Score: 24-19)
LeBron Barnes attempts a Midrange. Contested by Lauri Carter (4.1 feet, ZONE). LeBron Barnes misses. Rebound secured by Cade Wall.

[01:18] Team_046 possession (Score: 24-19)
Lauri Carter attempts a Midrange. Contested by Khris Bryant (3.1 feet, ZONE). Lauri Carter misses. Rebound secured by LeBron Barnes.

[01:02] Team_070 possession (Score: 24-19)
John Hyland attempts a 3Pt. Contested by Lauri Carter (3.7 feet, MAN). John Hyland misses. Rebound secured by Lauri Carter.

[00:50] Team_046 possession (Score: 24-19)
D'Angelo O'Neal attempts a Layup. BLOCKED BY COLE GASOL! Ball is loose! Rebound secured by LeBron Barnes.

[00:31] Team_070 possession (Score: 24-19)
Khris Bryant drives, picks up Cade Wall. Help arrives from D'Angelo O'Neal! Khris Bryant attempts a Layup. Contested by D'Angelo O'Neal (4.2 feet, MAN). Khris Bryant misses. Rebound secured by Cade Wall.

[00:13] Team_046 possession (Score: 24-19)
Lauri Carter attempts a Midrange. Contested by John Hyland (5.1 feet, ZONE). LAURI CARTER MAKES IT!
Score: 26-19

================================================================================
                              1ST QUARTER COMPLETE                              
================================================================================

1ST QUARTER SCORE: Team_046 26, Team_070 19

BOX SCORE:
================================================================================

Team_046
--------------------------------------------------------------------------------
Player                MIN  PTS  REB  AST  TO      FG   FG%      3P   3P%
--------------------------------------------------------------------------------
Lauri Carter           12    9    3    1   0   4/8    50.0     0/0   0.0
Victor Nowitzki        12    7    0    1   0   3/5    60.0     0/0   0.0
D'Angelo O'Neal        12    5    0    1   0   2/4    50.0     0/0   0.0
Kevin Allen            12    4    6    1   0   2/5    40.0     0/0   0.0
Cade Wall              12    0    3    2   0   0/0     0.0     0/0   0.0

TEAM: FG: 11/22 (50.0%), 3PT: 2/6 (33.3%), REB: 11 (2 off, 9 def), AST: 6, TO: 1
TEAM FOULS: 5 [Team_070 in BONUS]


Team_070
--------------------------------------------------------------------------------
Player                MIN  PTS  REB  AST  TO      FG   FG%      3P   3P%
--------------------------------------------------------------------------------
Khris Bryant           12    9    3    0   0   4/7    57.1     0/0   0.0
John Hyland            12    5    0    0   0   2/4    50.0     0/0   0.0
Cole Gasol             12    2    0    1   0   1/4    25.0     0/0   0.0
Jabari Paul            12    2    4    1   0   1/1   100.0     0/0   0.0
LeBron Barnes          12    0    7    0   0   0/2     0.0     0/0   0.0

TEAM: FG: 8/18 (44.4%), 3PT: 2/8 (25.0%), REB: 15 (4 off, 11 def), AST: 2, TO: 4
TEAM FOULS: 5 [Team_046 in BONUS]

================================================================================

================================================================================
                       2ND QUARTER - Team_046 vs Team_070                       
================================================================================

[12:00] Team_046 possession (Score: 26-19)
Victor Nowitzki attempts a 3Pt. Contested by Khris Bryant (2.9 feet, ZONE). Victor Nowitzki misses. Rebound secured by LeBron Barnes.

[11:42] Team_070 possession (Score: 26-19)
Jabari Paul drives, Kevin Allen stays with him. Jabari Paul attempts a Dunk. Contested by Kevin Allen (5.8 feet, ZONE). JABARI PAUL MAKES IT!
Score: 26-21

[11:29] Team_046 possession (Score: 26-21)
Cade Wall attempts a Layup. Contested by Khris Bryant (3.4 feet, ZONE). Cade Wall misses. Rebound secured by LeBron Barnes.

[11:15] Team_070 possession (Score: 26-21)
Khris Bryant drives, Kevin Allen stays with him. Khris Bryant attempts a Dunk. Contested by Kevin Allen (5.0 feet, ZONE). KHRIS BRYANT MAKES IT! Assist: Cole Gasol
Score: 26-23

[11:05] Team_046 possession (Score: 26-23)
Lauri Carter drives, picks up Khris Bryant. Help arrives from LeBron Barnes! Lauri Carter attempts a Dunk. Contested by LeBron Barnes (3.1 feet, ZONE). LAURI CARTER MAKES IT! Assist: Cade Wall
Score: 28-23

[10:49] Team_070 possession (Score: 28-23)
John Hyland attempts a 3Pt. Contested by Lauri Carter (3.7 feet, ZONE). John Hyland misses. Rebound secured by Cade Wall.

[10:36] Team_046 possession (Score: 28-23)
FOUL! Holding foul on John Hyland. [Team fouls: 1] No free throws, side out. (John Hyland: 1 personal fouls)

[10:17] Team_046 possession (Score: 28-23)
Cade Wall drives and kicks out. D'Angelo O'Neal attempts a 3Pt. Contested by Khris Bryant (3.1 feet, ZONE). D'Angelo O'Neal misses. Rebound secured by LeBron Barnes.

[10:02] Team_070 possession (Score: 28-23)
LeBron Barnes attempts a Midrange. Wide open! Victor Nowitzki is 6.3 feet away. [MAN] LeBron Barnes misses. FOUL! Loose ball foul on Lauri Carter during the rebound battle. [Team fouls: 1] No free throws, side out. (Lauri Carter: 1 personal fouls)

[09:45] Team_070 possession (Score: 28-23)
John Hyland attempts a Midrange. Contested by Lauri Carter (3.8 feet, MAN). John Hyland misses. Offensive rebound by Khris Bryant! Khris Bryant puts it back in!
Score: 28-25

[09:34] Team_046 possession (Score: 28-25)
Kevin Allen drives to the basket... Kevin Allen throws a bad pass out of bounds! TURNOVER! (dead ball)

[09:34] Substitution (Team_046): D'Angelo O'Neal OUT → Collin Butler IN (stamina_rule2)

[09:34] Substitution (Team_046): Victor Nowitzki OUT → Manu Dosunmu IN (stamina_rule2)

[09:34] Substitution (Team_046): Lauri Carter OUT → Josh Barrett IN (stamina_rule2)

[09:34] Substitution (Team_046): Cade Wall OUT → Chris LaVine IN (stamina_rule2)

[09:34] Substitution (Team_046): Kevin Allen OUT → Paul DeRozan IN (stamina_rule2)

[09:34] Substitution (Team_070): Cole Gasol OUT → Paul Quickley IN (stamina_rule2)

[09:34] Substitution (Team_070): LeBron Barnes OUT → Allen Quickley IN (stamina_rule2)

[09:34] Substitution (Team_070): John Hyland OUT → D'Angelo McGrady IN (stamina_rule2)

[09:34] Substitution (Team_070): Khris Bryant OUT → Luka Gobert IN (stamina_rule2)

[09:34] Substitution (Team_070): Jabari Paul OUT → Russell Morant IN (stamina_rule2)

[09:21] Team_070 possession (Score: 28-25)
Luka Gobert attempts a Layup. Contested by Chris LaVine (4.0 feet, MAN). LUKA GOBERT MAKES IT! Assist: Russell Morant
Score: 28-27

[09:09] Team_046 possession (Score: 28-27)
FOUL! Holding foul on D'Angelo McGrady. [Team fouls: 2] No free throws, side out. (D'Angelo McGrady: 1 personal fouls)

[08:59] Team_046 possession (Score: 28-27)
Josh Barrett attempts a 3Pt. Contested by D'Angelo McGrady (5.7 feet, MAN). Josh Barrett misses. Rebound secured by D'Angelo McGrady.

[08:46] Team_070 possession (Score: 28-27)
D'Angelo McGrady makes the Dunk and draws the foul on Manu Dosunmu! And-1! D'Angelo McGrady to the line for 1. [Team fouls: 2] (Manu Dosunmu: 1 personal fouls)   FT 1/1: GOOD D'Angelo McGrady makes 1/1 from the line.
Score: 28-30

[08:28] Team_046 possession (Score: 28-30)
Paul DeRozan drives, Russell Morant stays with him. Paul DeRozan attempts a Layup. Contested by Russell Morant (3.7 feet, ZONE). Paul DeRozan misses. Offensive rebound by Chris LaVine! Chris LaVine kicks it out.

[08:14] Team_046 possession (Score: 28-30)
Josh Barrett attempts a 3Pt. Contested by D'Angelo McGrady (5.7 feet, MAN). JOSH BARRETT MAKES IT! Assist: Chris LaVine
Score: 31-30

[08:04] Team_070 possession (Score: 31-30)
Luka Gobert drives, picks up Chris LaVine. Help arrives from Manu Dosunmu! Luka Gobert attempts a Layup. Contested by Manu Dosunmu (4.0 feet, ZONE). LUKA GOBERT MAKES IT! Assist: Paul Quickley
Score: 31-32

[07:49] Team_046 possession (Score: 31-32)
FOUL! Holding foul on Paul Quickley. [Team fouls: 3] No free throws, side out. (Paul Quickley: 1 personal fouls)

[07:31] Team_046 possession (Score: 31-32)
Chris LaVine drives to the basket... FOUL! Offensive foul on Chris LaVine! Russell Morant drew the charge! [Team fouls: 3] (Chris LaVine: 1 personal fouls) TURNOVER! (dead ball)

[07:14] Team_070 possession (Score: 31-32)
Allen Quickley attempts a 3Pt. Contested by Manu Dosunmu (4.8 feet, MAN). Allen Quickley misses. Rebound secured by Paul DeRozan.

[07:01] Team_046 possession (Score: 31-32)
Chris LaVine attempts a 3Pt. Wide open! D'Angelo McGrady is 6.1 feet away. [ZONE] CHRIS LAVINE MAKES IT! Assist: Collin Butler
Score: 34-32

[06:43] Team_070 possession (Score: 34-32)
D'Angelo McGrady attempts a Midrange. Contested by Josh Barrett (4.9 feet, ZONE). D'Angelo McGrady misses. Offensive rebound by Luka Gobert! Luka Gobert kicks it out.

[06:28] Team_070 possession (Score: 34-32)
Russell Morant drives and kicks out. D'Angelo McGrady attempts a 3Pt. Contested by Collin Butler (3.9 feet, ZONE). D'Angelo McGrady misses. Rebound secured by Chris LaVine.

[06:14] Team_046 possession (Score: 34-32)
Josh Barrett attempts a 3Pt. Contested by D'Angelo McGrady (5.7 feet, MAN). JOSH BARRETT MAKES IT! Assist: Chris LaVine
Score: 37-32

[05:59] Team_070 possession (Score: 37-32)
Allen Quickley attempts a Midrange. Contested by Manu Dosunmu (4.8 feet, MAN). Allen Quickley misses. Offensive rebound by Luka Gobert! Luka Gobert kicks it out.

[05:47] Team_070 possession (Score: 37-32)
Allen Quickley drives, picks up Manu Dosunmu. Help arrives from Collin Butler! Allen Quickley attempts a Layup. Contested by Collin Butler (4.8 feet, MAN). Allen Quickley misses. FOUL! Loose ball foul on Paul DeRozan during the rebound battle. [Team fouls: 4] No free throws, side out. (Paul DeRozan: 1 personal fouls)

[05:29] Team_070 possession (Score: 37-32)
Allen Quickley drives to the basket... Allen Quickley throws a bad pass! Stolen by Chris LaVine! TURNOVER! (live ball)

[05:14] Team_046 possession (Score: 37-32)
Collin Butler attempts a 3Pt. Contested by Paul Quickley (4.6 feet, MAN). Collin Butler misses. Rebound secured by D'Angelo McGrady.

[05:01] Team_070 possession (Score: 37-32)
D'Angelo McGrady attempts a Midrange. Contested by Josh Barrett (4.9 feet, MAN). D'ANGELO MCGRADY MAKES IT!
Score: 37-34

[04:44] Team_046 possession (Score: 37-34)
FOUL! Shooting foul on Allen Quickley. Manu Dosunmu to the line for 2 free throws. [Team fouls: 4] (Allen Quickley: 1 personal fouls)   FT 1/2: MISS   FT 2/2: GOOD Manu Dosunmu makes 1/2 from the line.
Score: 38-34

[04:25] Team_070 possession (Score: 38-34)
Allen Quickley attempts a 3Pt. Contested by Manu Dosunmu (4.8 feet, MAN). Allen Quickley misses. Rebound secured by Paul DeRozan.

[04:08] Team_046 possession (Score: 38-34)
Josh Barrett makes the Layup and draws the foul on D'Angelo McGrady! And-1! Josh Barrett to the line for 1. [BONUS: 5 team fouls] (D'Angelo McGrady: 2 personal fouls)   FT 1/1: GOOD Josh Barrett makes 1/1 from the line.
Score: 41-34

[03:57] Team_070 possession (Score: 41-34)
Russell Morant drives, picks up Chris LaVine. Help arrives from Manu Dosunmu! Russell Morant attempts a Dunk. Contested by Manu Dosunmu (4.0 feet, MAN). RUSSELL MORANT MAKES IT!
Score: 41-36

[03:45] Team_046 possession (Score: 41-36)
FOUL! Reach-in foul on Russell Morant during the drive. [IN THE BONUS! 6 team fouls] Chris LaVine to the line for 2 free throws. (Russell Morant: 1 personal fouls)   FT 1/2: GOOD   FT 2/2: GOOD Chris LaVine makes 2/2 from the line.
Score: 43-36

[03:32] Team_070 possession (Score: 43-36)
Luka Gobert drives to the basket... Luka Gobert throws a bad pass! Stolen by Chris LaVine! TURNOVER! (live ball)

[03:20] Team_046 possession (Score: 43-36)
Paul DeRozan attempts a Midrange. Contested by Russell Morant (3.7 feet, MAN). PAUL DEROZAN MAKES IT! Assist: Chris LaVine
Score: 45-36

[03:08] Team_070 possession (Score: 45-36)
Allen Quickley attempts a 3Pt. Contested by Collin Butler (3.9 feet, ZONE). Allen Quickley misses. Rebound secured by Chris LaVine.

[02:56] Team_046 possession (Score: 45-36)
Josh Barrett attempts a Layup. Contested by D'Angelo McGrady (5.7 feet, MAN). Josh Barrett misses. Rebound secured by Luka Gobert.

[02:47] Team_070 possession (Score: 45-36)
FOUL! Shooting foul on Chris LaVine. Russell Morant to the line for 2 free throws. [BONUS: 5 team fouls] (Chris LaVine: 2 personal fouls)   FT 1/2: GOOD   FT 2/2: GOOD Russell Morant makes 2/2 from the line.
Score: 45-38

[02:32] Team_046 possession (Score: 45-38)
Paul DeRozan drives, picks up Russell Morant. Help arrives from Paul Quickley! Paul DeRozan attempts a Dunk. Contested by Paul Quickley (3.8 feet, ZONE). Paul DeRozan misses. FOUL! Loose ball foul on Russell Morant during the rebound battle. [IN THE BONUS! 7 team fouls] Chris LaVine to the line for 2 free throws. (Russell Morant: 2 personal fouls)   FT 1/2: GOOD   FT 2/2: MISS Chris LaVine makes 1/2 from the line. Rebound secured by D'Angelo McGrady.
Score: 46-38

[02:22] Team_070 possession (Score: 46-38)
D'Angelo McGrady attempts a 3Pt. Contested by Josh Barrett (5.0 feet, MAN). D'ANGELO MCGRADY MAKES IT! Assist: Allen Quickley
Score: 46-41

[02:03] Team_046 possession (Score: 46-41)
Manu Dosunmu attempts a Midrange. Contested by Allen Quickley (5.8 feet, MAN). MANU DOSUNMU MAKES IT!
Score: 48-41

[01:49] Team_070 possession (Score: 48-41)
FOUL! Shooting foul on Chris LaVine. Russell Morant to the line for 2 free throws. [BONUS: 6 team fouls] (Chris LaVine: 3 personal fouls)   FT 1/2: GOOD   FT 2/2: GOOD Russell Morant makes 2/2 from the line.
Score: 48-43

[01:30] Team_046 possession (Score: 48-43)
Collin Butler attempts a Midrange. Contested by Paul Quickley (4.7 feet, MAN). COLLIN BUTLER MAKES IT! Assist: Manu Dosunmu
Score: 50-43

[01:18] Team_070 possession (Score: 50-43)
Allen Quickley attempts a Midrange. Contested by Josh Barrett (5.0 feet, ZONE). Allen Quickley misses. Rebound secured by Manu Dosunmu.

[01:03] Team_046 possession (Score: 50-43)
Paul DeRozan drives and kicks out. Manu Dosunmu makes the Midrange and draws the foul on Allen Quickley! And-1! Manu Dosunmu to the line for 1. [BONUS: 8 team fouls] (Allen Quickley: 2 personal fouls)   FT 1/1: GOOD Manu Dosunmu makes 1/1 from the line.
Score: 53-43

[00:46] Team_070 possession (Score: 53-43)
D'Angelo McGrady attempts a 3Pt. Contested by Manu Dosunmu (5.0 feet, ZONE). D'Angelo McGrady misses. Rebound secured by Paul DeRozan.

[00:29] Team_046 possession (Score: 53-43)
Collin Butler attempts a 3Pt. Contested by Paul Quickley (4.8 feet, ZONE). Collin Butler misses. Rebound secured by D'Angelo McGrady.

[00:11] Team_070 possession (Score: 53-43)
Paul Quickley drives and kicks out. Allen Quickley attempts a Midrange. Contested by Manu Dosunmu (5.1 feet, MAN). Allen Quickley misses. Rebound secured by Paul DeRozan.

================================================================================
                              2ND QUARTER COMPLETE                              
================================================================================

2ND QUARTER SCORE: Team_046 27, Team_070 24

BOX SCORE:
================================================================================

Team_046
--------------------------------------------------------------------------------
Player                MIN  PTS  REB  AST  TO      FG   FG%      3P   3P%
--------------------------------------------------------------------------------
Josh Barrett            9    9    0    0   0   3/5    60.0     0/0   0.0
Manu Dosunmu            9    6    1    1   0   3/3   100.0     0/0   0.0
Chris LaVine            9    5    3    3   0   2/2   100.0     0/0   0.0
Lauri Carter           15    2    0    0   0   1/1   100.0     0/0   0.0
Paul DeRozan            9    2    4    0   0   1/2    50.0     0/0   0.0
Collin Butler           9    2    0    1   0   1/3    33.3     0/0   0.0
Victor Nowitzki        15    0    0    0   0   0/1     0.0     0/0   0.0
Cade Wall              15    0    1    1   0   0/2     0.0     0/0   0.0

TEAM: FG: 11/19 (57.9%), 3PT: 3/7 (42.9%), REB: 10 (2 off, 8 def), AST: 6, TO: 2
TEAM FOULS: 6 [Team_070 in BONUS]


Team_070
--------------------------------------------------------------------------------
Player                MIN  PTS  REB  AST  TO      FG   FG%      3P   3P%
--------------------------------------------------------------------------------
D'Angelo McGrady        9    8    4    0   0   3/4    75.0     0/0   0.0
Russell Morant          9    6    0    1   0   3/4    75.0     0/0   0.0
Khris Bryant           15    4    1    0   0   2/2   100.0     0/0   0.0
Luka Gobert             9    4    4    0   0   2/2   100.0     0/0   0.0
Jabari Paul            15    2    0    0   0   1/1   100.0     0/0   0.0
LeBron Barnes          15    0    4    0   0   0/0     0.0     0/0   0.0
Cole Gasol             15    0    0    1   0   0/0     0.0     0/0   0.0
John Hyland            15    0    0    0   0   0/1     0.0     0/0   0.0
Paul Quickley           9    0    0    1   0   0/1     0.0     0/0   0.0
Allen Quickley          9    0    0    1   0   0/4     0.0     0/0   0.0

TEAM: FG: 11/19 (57.9%), 3PT: 1/6 (16.7%), REB: 12 (5 off, 7 def), AST: 4, TO: 2
TEAM FOULS: 8 [Team_046 in BONUS]

================================================================================

================================================================================
                       3RD QUARTER - Team_046 vs Team_070                       
================================================================================

[12:00] Team_046 possession (Score: 53-43)
Kevin Allen attempts a Midrange. Contested by Khris Bryant (2.7 feet, MAN). Kevin Allen misses. Rebound secured by Khris Bryant.

[11:49] Team_070 possession (Score: 53-43)
Khris Bryant attempts a Midrange. Contested by Cade Wall (3.6 feet, ZONE). KHRIS BRYANT MAKES IT! Assist: LeBron Barnes
Score: 53-45

[11:34] Team_046 possession (Score: 53-45)
D'Angelo O'Neal drives, Cole Gasol stays with him. D'Angelo O'Neal attempts a Layup. Contested by Cole Gasol (5.5 feet, MAN). D'Angelo O'Neal misses. Rebound secured by Jabari Paul.

[11:19] Team_070 possession (Score: 53-45)
FOUL! Offensive foul on LeBron Barnes! Victor Nowitzki drew the charge! [Team fouls: 1] (LeBron Barnes: 1 personal fouls) TURNOVER! (dead ball)

[11:05] Team_046 possession (Score: 53-45)
Kevin Allen drives to the basket... Kevin Allen loses the ball! Stripped by Khris Bryant! TURNOVER! (live ball)

[10:48] Team_070 possession (Score: 53-45)
John Hyland attempts a Layup. Contested by Kevin Allen (4.6 feet, ZONE). John Hyland misses. Rebound secured by Kevin Allen.

[10:32] Team_046 possession (Score: 53-45)
D'Angelo O'Neal drives, Khris Bryant stays with him. D'Angelo O'Neal attempts a Dunk. Contested by Khris Bryant (2.7 feet, ZONE). D'ANGELO O'NEAL MAKES IT! Assist: Lauri Carter
Score: 55-45

[10:13] Team_070 possession (Score: 55-45)
LeBron Barnes attempts a Midrange. Contested by Victor Nowitzki (6.0 feet, MAN). LeBron Barnes misses. Rebound secured by Cade Wall.

[09:57] Team_046 possession (Score: 55-45)
Victor Nowitzki attempts a Layup. Contested by Khris Bryant (2.6 feet, ZONE). Victor Nowitzki misses. Offensive rebound by Kevin Allen! Kevin Allen kicks it out.

[09:41] Team_046 possession (Score: 55-45)
Lauri Carter drives, Khris Bryant stays with him. Lauri Carter attempts a Layup. Contested by Khris Bryant (2.6 feet, ZONE). Lauri Carter misses. Rebound secured by Khris Bryant.

[09:21] Team_070 possession (Score: 55-45)
John Hyland makes the Layup and draws the foul on Cade Wall! And-1! John Hyland to the line for 1. [Team fouls: 1] (Cade Wall: 1 personal fouls)   FT 1/1: MISS John Hyland makes 0/1 from the line. Rebound secured by Lauri Carter.
Score: 55-47

[09:09] Team_046 possession (Score: 55-47)
Victor Nowitzki attempts a 3Pt. Contested by LeBron Barnes (3.7 feet, MAN). Victor Nowitzki misses. Rebound secured by Khris Bryant.

[08:53] Team_070 possession (Score: 55-47)
Cole Gasol attempts a Layup. Contested by D'Angelo O'Neal (4.2 feet, MAN). COLE GASOL MAKES IT! Assist: John Hyland
Score: 55-49

[08:37] Team_046 possession (Score: 55-49)
Lauri Carter attempts a Midrange. Contested by John Hyland (4.7 feet, MAN). LAURI CARTER MAKES IT!
Score: 57-49

[08:19] Team_070 possession (Score: 57-49)
LeBron Barnes attempts a 3Pt. Contested by Victor Nowitzki (6.0 feet, MAN). LeBron Barnes misses. Rebound secured by Kevin Allen.

[08:04] Team_046 possession (Score: 57-49)
D'Angelo O'Neal attempts a Midrange. Contested by John Hyland (4.7 feet, ZONE). D'Angelo O'Neal misses. Rebound secured by LeBron Barnes.

[07:52] Team_070 possession (Score: 57-49)
Cole Gasol drives, D'Angelo O'Neal stays with him. Cole Gasol attempts a Dunk. Contested by D'Angelo O'Neal (4.2 feet, MAN). Cole Gasol misses. Rebound secured by Cade Wall.

[07:36] Team_046 possession (Score: 57-49)
Kevin Allen attempts a Layup. Contested by Khris Bryant (2.7 feet, ZONE). Kevin Allen misses. Offensive rebound by Kevin Allen! Kevin Allen kicks it out.

[07:21] Team_046 possession (Score: 57-49)
FOUL! Holding foul on Cole Gasol. [Team fouls: 2] No free throws, side out. (Cole Gasol: 1 personal fouls)

[07:03] Team_046 possession (Score: 57-49)
D'Angelo O'Neal attempts a 3Pt. Contested by Cole Gasol (5.5 feet, MAN). D'Angelo O'Neal misses. Rebound secured by Jabari Paul.

[06:49] Team_070 possession (Score: 57-49)
Khris Bryant attempts a 3Pt. Contested by Lauri Carter (3.1 feet, ZONE). Khris Bryant misses. Offensive rebound by LeBron Barnes! LeBron Barnes kicks it out.

[06:36] Team_070 possession (Score: 57-49)
Khris Bryant attempts a 3Pt. Contested by Cade Wall (3.6 feet, MAN). Khris Bryant misses. Rebound secured by Lauri Carter.

[06:22] Team_046 possession (Score: 57-49)
D'Angelo O'Neal attempts a Layup. Contested by Cole Gasol (5.5 feet, MAN). D'ANGELO O'NEAL MAKES IT! Assist: Lauri Carter
Score: 59-49

[06:10] Team_070 possession (Score: 59-49)
John Hyland attempts a Midrange. Contested by Lauri Carter (3.2 feet, ZONE). John Hyland misses. Rebound secured by Cade Wall.

[05:55] Team_046 possession (Score: 59-49)
D'Angelo O'Neal attempts a 3Pt. Contested by Cole Gasol (5.5 feet, MAN). D'ANGELO O'NEAL MAKES IT! Assist: Cade Wall
Score: 62-49

[05:40] Team_070 possession (Score: 62-49)
Jabari Paul attempts a Dunk. BLOCKED BY KEVIN ALLEN! Ball goes out off Kevin Allen. Jabari Paul's ball!

[05:28] Team_070 possession (Score: 62-49)
FOUL! Holding foul on Cade Wall. [Team fouls: 2] No free throws, side out. (Cade Wall: 2 personal fouls)

[05:15] Team_070 possession (Score: 62-49)
LeBron Barnes drives, Victor Nowitzki stays with him. LeBron Barnes attempts a Dunk. Contested by Victor Nowitzki (6.0 feet, MAN). LEBRON BARNES MAKES IT! Assist: Cole Gasol
Score: 62-51

[04:58] Team_046 possession (Score: 62-51)
Victor Nowitzki drives and kicks out. Victor Nowitzki attempts a Midrange. Contested by Khris Bryant (2.4 feet, ZONE). VICTOR NOWITZKI MAKES IT! Assist: Cade Wall
Score: 64-51

[04:46] Team_070 possession (Score: 64-51)
FOUL! Shooting foul on Victor Nowitzki. LeBron Barnes to the line for 2 free throws. [Team fouls: 3] (Victor Nowitzki: 1 personal fouls)   FT 1/2: GOOD   FT 2/2: GOOD LeBron Barnes makes 2/2 from the line.
Score: 64-53

[04:36] Team_046 possession (Score: 64-53)
Victor Nowitzki attempts a Layup. Contested by Khris Bryant (2.6 feet, ZONE). Victor Nowitzki misses. FOUL! Loose ball foul on Jabari Paul during the rebound battle. [Team fouls: 3] No free throws, side out. (Jabari Paul: 1 personal fouls)

[04:24] Team_046 possession (Score: 64-53)
D'Angelo O'Neal attempts a 3Pt. Contested by Cole Gasol (5.5 feet, ZONE). D'Angelo O'Neal misses. Offensive rebound by Kevin Allen! Kevin Allen kicks it out.

[04:11] Team_046 possession (Score: 64-53)
Lauri Carter makes the 3Pt and draws the foul on John Hyland! And-1! Lauri Carter to the line for 1. [Team fouls: 4] (John Hyland: 1 personal fouls)   FT 1/1: GOOD Lauri Carter makes 1/1 from the line.
Score: 68-53

[04:02] Team_070 possession (Score: 68-53)
Khris Bryant attempts a 3Pt. Contested by Lauri Carter (3.2 feet, ZONE). Khris Bryant misses. Rebound secured by Cade Wall.

[03:48] Team_046 possession (Score: 68-53)
Lauri Carter drives and kicks out. Kevin Allen attempts a 3Pt. Contested by Khris Bryant (2.6 feet, MAN). Kevin Allen misses. Rebound secured by Jabari Paul.

[03:31] Team_070 possession (Score: 68-53)
FOUL! Shooting foul on Kevin Allen. Jabari Paul to the line for 2 free throws. [Team fouls: 4] (Kevin Allen: 1 personal fouls)   FT 1/2: GOOD   FT 2/2: GOOD Jabari Paul makes 2/2 from the line.
Score: 68-55

[03:13] Team_046 possession (Score: 68-55)
Cade Wall attempts a Midrange. Contested by Khris Bryant (3.2 feet, MAN). Cade Wall misses. Rebound secured by Khris Bryant.

[02:56] Team_070 possession (Score: 68-55)
Khris Bryant throws a bad pass! Stolen by Cade Wall! TURNOVER! (live ball)

[02:37] Team_046 possession (Score: 68-55)
D'Angelo O'Neal attempts a 3Pt. Contested by Cole Gasol (5.6 feet, MAN). D'Angelo O'Neal misses. Rebound secured by Khris Bryant.

[02:27] Team_070 possession (Score: 68-55)
LeBron Barnes attempts a Layup. Wide open! Victor Nowitzki is 6.1 feet away. [MAN] LEBRON BARNES MAKES IT! Assist: Jabari Paul
Score: 68-57

[02:13] Team_046 possession (Score: 68-57)
Kevin Allen attempts a Midrange. Contested by Khris Bryant (3.0 feet, ZONE). Kevin Allen misses. Rebound secured by Khris Bryant.

[01:59] Team_070 possession (Score: 68-57)
Cole Gasol attempts a Layup. Contested by Kevin Allen (5.2 feet, ZONE). Cole Gasol misses. Rebound secured by Kevin Allen.

[01:48] Team_046 possession (Score: 68-57)
Cade Wall drives and kicks out. Victor Nowitzki attempts a Midrange. Contested by Khris Bryant (2.9 feet, ZONE). Victor Nowitzki misses. Rebound secured by Khris Bryant.

[01:33] Team_070 possession (Score: 68-57)
FOUL! Reach-in foul on Kevin Allen during the drive. [IN THE BONUS! 5 team fouls] Jabari Paul to the line for 2 free throws. (Kevin Allen: 2 personal fouls)   FT 1/2: MISS   FT 2/2: GOOD Jabari Paul makes 1/2 from the line.
Score: 68-58

[01:20] Team_046 possession (Score: 68-58)
Victor Nowitzki attempts a 3Pt. Contested by Khris Bryant (3.0 feet, ZONE). Victor Nowitzki misses. Rebound secured by Khris Bryant.

[01:09] Team_070 possession (Score: 68-58)
Jabari Paul attempts a 3Pt. Contested by Kevin Allen (5.8 feet, MAN). JABARI PAUL MAKES IT! Assist: John Hyland
Score: 68-61

[00:56] Team_046 possession (Score: 68-61)
Kevin Allen attempts a 3Pt. Contested by Khris Bryant (3.2 feet, ZONE). Kevin Allen misses. Rebound secured by Khris Bryant.

[00:40] Team_070 possession (Score: 68-61)
LeBron Barnes attempts a 3Pt. Contested by Lauri Carter (4.1 feet, ZONE). LeBron Barnes misses. Rebound secured by Lauri Carter.

[00:23] Team_046 possession (Score: 68-61)
FOUL! Holding foul on Cole Gasol. [IN THE BONUS! 5 team fouls] D'Angelo O'Neal to the line for 2 free throws. (Cole Gasol: 2 personal fouls)   FT 1/2: GOOD   FT 2/2: GOOD D'Angelo O'Neal makes 2/2 from the line.
Score: 70-61

[00:04] Team_070 possession (Score: 70-61)
Jabari Paul attempts a Midrange. Contested by Kevin Allen (5.9 feet, MAN). Jabari Paul misses. Rebound secured by Cade Wall.

================================================================================
                              3RD QUARTER COMPLETE                              
================================================================================

3RD QUARTER SCORE: Team_046 17, Team_070 18

BOX SCORE:
================================================================================

Team_046
--------------------------------------------------------------------------------
Player                MIN  PTS  REB  AST  TO      FG   FG%      3P   3P%
--------------------------------------------------------------------------------
D'Angelo O'Neal        27    9    0    0   0   4/8    50.0     0/0   0.0
Lauri Carter           27    6    3    2   0   2/4    50.0     0/0   0.0
Victor Nowitzki        27    2    0    0   0   1/3    33.3     0/0   0.0
Kevin Allen            27    0    6    0   0   0/3     0.0     0/0   0.0
Cade Wall              27    0    6    2   0   0/2     0.0     0/0   0.0

TEAM: FG: 7/20 (35.0%), 3PT: 2/7 (28.6%), REB: 15 (4 off, 11 def), AST: 4, TO: 1
TEAM FOULS: 5 [Team_070 in BONUS]


Team_070
--------------------------------------------------------------------------------
Player                MIN  PTS  REB  AST  TO      FG   FG%      3P   3P%
--------------------------------------------------------------------------------
LeBron Barnes          27    6    2    1   0   3/6    50.0     0/0   0.0
Jabari Paul            27    6    3    1   0   3/4    75.0     0/0   0.0
Khris Bryant           27    2    9    0   0   1/3    33.3     0/0   0.0
Cole Gasol             27    2    0    1   0   1/3    33.3     0/0   0.0
John Hyland            27    0    0    2   0   0/3     0.0     0/0   0.0

TEAM: FG: 8/19 (42.1%), 3PT: 1/5 (20.0%), REB: 14 (1 off, 13 def), AST: 5, TO: 2
TEAM FOULS: 5 [Team_046 in BONUS]

================================================================================

================================================================================
                       4TH QUARTER - Team_046 vs Team_070                       
================================================================================

[12:00] Team_046 possession (Score: 70-61)
Kevin Allen attempts a 3Pt. Contested by Khris Bryant (3.0 feet, ZONE). Kevin Allen misses. Rebound secured by Jabari Paul.

[11:46] Team_070 possession (Score: 70-61)
John Hyland drives and kicks out. LeBron Barnes attempts a Midrange. Contested by Victor Nowitzki (5.8 feet, MAN). LEBRON BARNES MAKES IT! Assist: Jabari Paul
Score: 70-63

[11:29] Team_046 possession (Score: 70-63)
Cade Wall attempts a Midrange. Contested by LeBron Barnes (4.5 feet, ZONE). CADE WALL MAKES IT! Assist: Kevin Allen
Score: 72-63

[11:11] Team_070 possession (Score: 72-63)
LeBron Barnes attempts a 3Pt. Wide open! Victor Nowitzki is 6.2 feet away. [MAN] LEBRON BARNES MAKES IT! Assist: John Hyland
Score: 72-66

[10:59] Team_046 possession (Score: 72-66)
Cade Wall attempts a Midrange. Contested by John Hyland (5.4 feet, ZONE). Cade Wall misses. Rebound secured by LeBron Barnes.

[10:46] Team_070 possession (Score: 72-66)
LeBron Barnes attempts a Midrange. Wide open! Victor Nowitzki is 6.3 feet away. [MAN] LeBron Barnes misses. Offensive rebound by LeBron Barnes! LeBron Barnes kicks it out.

[10:30] Team_070 possession (Score: 72-66)
LeBron Barnes attempts a 3Pt. Wide open! Victor Nowitzki is 6.3 feet away. [MAN] LeBron Barnes misses. Rebound secured by Cade Wall.

[10:13] Team_046 possession (Score: 72-66)
FOUL! Holding foul on John Hyland. [Team fouls: 1] No free throws, side out. (John Hyland: 1 personal fouls)

[09:59] Team_046 possession (Score: 72-66)
Cade Wall attempts a Layup. Contested by Khris Bryant (3.6 feet, MAN). Cade Wall misses. Rebound secured by Khris Bryant.

[09:46] Team_070 possession (Score: 72-66)
LeBron Barnes attempts a 3Pt. Wide open! Victor Nowitzki is 6.4 feet away. [ZONE] LeBron Barnes misses. Rebound secured by Kevin Allen.

[09:34] Team_046 possession (Score: 72-66)
D'Angelo O'Neal attempts a 3Pt. Contested by Khris Bryant (3.3 feet, ZONE). D'Angelo O'Neal misses. Rebound secured by LeBron Barnes.

[09:19] Team_070 possession (Score: 72-66)
John Hyland attempts a 3Pt. Contested by Lauri Carter (3.8 feet, ZONE). John Hyland misses. Rebound secured by Cade Wall.

[09:05] Team_046 possession (Score: 72-66)
Victor Nowitzki drives and kicks out. Lauri Carter attempts a Midrange. Contested by LeBron Barnes (4.3 feet, ZONE). Lauri Carter misses. Rebound secured by LeBron Barnes.

[08:50] Team_070 possession (Score: 72-66)
Jabari Paul makes the Dunk and draws the foul on D'Angelo O'Neal! And-1! Jabari Paul to the line for 1. [Team fouls: 1] (D'Angelo O'Neal: 1 personal fouls)   FT 1/1: GOOD Jabari Paul makes 1/1 from the line.
Score: 72-69

[08:40] Team_046 possession (Score: 72-69)
Victor Nowitzki drives, Khris Bryant stays with him. Victor Nowitzki attempts a Layup. Contested by Khris Bryant (3.4 feet, ZONE). VICTOR NOWITZKI MAKES IT! Assist: Cade Wall
Score: 74-69

[08:31] Team_070 possession (Score: 74-69)
LeBron Barnes attempts a Midrange. Wide open! Victor Nowitzki is 6.5 feet away. [MAN] LEBRON BARNES MAKES IT!
Score: 74-71

[08:19] Team_046 possession (Score: 74-71)
D'Angelo O'Neal attempts a 3Pt. Wide open! Cole Gasol is 6.0 feet away. [MAN] D'Angelo O'Neal misses. Rebound secured by Khris Bryant.

[08:02] Team_070 possession (Score: 74-71)
Jabari Paul makes the Layup and draws the foul on Kevin Allen! And-1! Jabari Paul to the line for 1. [Team fouls: 2] (Kevin Allen: 1 personal fouls)   FT 1/1: GOOD Jabari Paul makes 1/1 from the line.
Score: 74-74

[07:45] Team_046 possession (Score: 74-74)
Victor Nowitzki attempts a Midrange. Contested by LeBron Barnes (4.5 feet, MAN). Victor Nowitzki misses. Rebound secured by Jabari Paul.

[07:30] Team_070 possession (Score: 74-74)
Cole Gasol attempts a 3Pt. BLOCKED BY LAURI CARTER! Ball is loose! Offensive rebound by Khris Bryant! Khris Bryant kicks it out.

[07:18] Team_070 possession (Score: 74-74)
Cole Gasol drives to the basket... Cole Gasol commits a violation (traveling/carry)! TURNOVER! (dead ball)

[07:18] Substitution (Team_046): D'Angelo O'Neal OUT → Collin Butler IN (stamina_rule2)

[07:18] Substitution (Team_046): Victor Nowitzki OUT → Manu Dosunmu IN (stamina_rule2)

[07:18] Substitution (Team_046): Lauri Carter OUT → Josh Barrett IN (stamina_rule2)

[07:18] Substitution (Team_046): Cade Wall OUT → Chris LaVine IN (stamina_rule2)

[07:18] Substitution (Team_046): Kevin Allen OUT → Paul DeRozan IN (stamina_rule2)

[07:18] Substitution (Team_070): Cole Gasol OUT → Paul Quickley IN (stamina_rule2)

[07:18] Substitution (Team_070): LeBron Barnes OUT → Allen Quickley IN (stamina_rule2)

[07:18] Substitution (Team_070): John Hyland OUT → D'Angelo McGrady IN (stamina_rule2)

[07:18] Substitution (Team_070): Khris Bryant OUT → Luka Gobert IN (stamina_rule2)

[07:18] Substitution (Team_070): Jabari Paul OUT → Russell Morant IN (stamina_rule2)

[07:00] Team_046 possession (Score: 74-74)
Paul DeRozan attempts a Midrange. Contested by Russell Morant (3.7 feet, MAN). Paul DeRozan misses. Rebound secured by Russell Morant.

[06:44] Team_070 possession (Score: 74-74)
D'Angelo McGrady attempts a 3Pt. Contested by Collin Butler (3.9 feet, ZONE). D'Angelo McGrady misses. Rebound secured by Chris LaVine.

[06:31] Team_046 possession (Score: 74-74)
FOUL! Shooting foul on Russell Morant. Paul DeRozan to the line for 2 free throws. [Team fouls: 2] (Russell Morant: 1 personal fouls)   FT 1/2: GOOD   FT 2/2: GOOD Paul DeRozan makes 2/2 from the line.
Score: 76-74

[06:19] Team_070 possession (Score: 76-74)
Allen Quickley attempts a 3Pt. Contested by Collin Butler (3.9 feet, ZONE). Allen Quickley misses. Rebound secured by Paul DeRozan.

[06:05] Team_046 possession (Score: 76-74)
FOUL! Reach-in foul on Luka Gobert during the drive. [Team fouls: 3] No free throws, side out. (Luka Gobert: 1 personal fouls)

[05:51] Team_046 possession (Score: 76-74)
Collin Butler drives, Paul Quickley stays with him. Collin Butler attempts a Dunk. Contested by Paul Quickley (4.6 feet, MAN). COLLIN BUTLER MAKES IT! Assist: Manu Dosunmu
Score: 78-74

[05:42] Team_070 possession (Score: 78-74)
Allen Quickley attempts a 3Pt. Contested by Manu Dosunmu (4.8 feet, MAN). Allen Quickley misses. Rebound secured by Manu Dosunmu.

[05:26] Team_046 possession (Score: 78-74)
Chris LaVine drives and kicks out. Manu Dosunmu makes the Midrange and draws the foul on Allen Quickley! And-1! Manu Dosunmu to the line for 1. [Team fouls: 4] (Allen Quickley: 1 personal fouls)   FT 1/1: GOOD Manu Dosunmu makes 1/1 from the line.
Score: 81-74

[05:10] Team_070 possession (Score: 81-74)
D'Angelo McGrady drives, Chris LaVine stays with him. D'Angelo McGrady attempts a Layup. Contested by Chris LaVine (3.9 feet, ZONE). D'ANGELO MCGRADY MAKES IT! Assist: Allen Quickley
Score: 81-76

[05:00] Team_046 possession (Score: 81-76)
Chris LaVine attempts a Layup. BLOCKED BY PAUL QUICKLEY! Ball is loose! Rebound secured by Russell Morant.

[04:44] Team_070 possession (Score: 81-76)
Russell Morant attempts a 3Pt. Contested by Chris LaVine (4.0 feet, MAN). Russell Morant misses. Rebound secured by Manu Dosunmu.

[04:28] Team_046 possession (Score: 81-76)
Manu Dosunmu drives and kicks out. Josh Barrett attempts a Midrange. Contested by Allen Quickley (5.2 feet, ZONE). Josh Barrett misses. Offensive rebound by Chris LaVine! Chris LaVine kicks it out.

[04:12] Team_046 possession (Score: 81-76)
Paul DeRozan makes the Layup and draws the foul on Russell Morant! And-1! Paul DeRozan to the line for 1. [BONUS: 5 team fouls] (Russell Morant: 2 personal fouls)   FT 1/1: MISS Paul DeRozan makes 0/1 from the line. Rebound secured by D'Angelo McGrady.
Score: 83-76

[03:58] Team_070 possession (Score: 83-76)
Paul Quickley attempts a Midrange. Contested by Collin Butler (3.8 feet, MAN). Paul Quickley misses. Rebound secured by Chris LaVine.

[03:43] Team_046 possession (Score: 83-76)
Collin Butler makes the Dunk and draws the foul on Paul Quickley! And-1! Collin Butler to the line for 1. [BONUS: 6 team fouls] (Paul Quickley: 1 personal fouls)   FT 1/1: GOOD Collin Butler makes 1/1 from the line.
Score: 86-76

[03:28] Team_070 possession (Score: 86-76)
FOUL! Shooting foul on Chris LaVine. Russell Morant to the line for 2 free throws. [Team fouls: 4] (Chris LaVine: 1 personal fouls)   FT 1/2: GOOD   FT 2/2: GOOD Russell Morant makes 2/2 from the line.
Score: 86-78

[03:14] Team_046 possession (Score: 86-78)
Manu Dosunmu attempts a 3Pt. Contested by Allen Quickley (5.8 feet, MAN). Manu Dosunmu misses. Rebound secured by D'Angelo McGrady.

[03:00] Team_070 possession (Score: 86-78)
Luka Gobert makes the Dunk and draws the foul on Chris LaVine! And-1! Luka Gobert to the line for 1. [BONUS: 5 team fouls] (Chris LaVine: 2 personal fouls)   FT 1/1: GOOD Luka Gobert makes 1/1 from the line.
Score: 86-81

[02:42] Team_046 possession (Score: 86-81)
Paul DeRozan drives, picks up Russell Morant. Help arrives from Paul Quickley! Paul DeRozan attempts a Layup. Contested by Paul Quickley (3.7 feet, MAN). PAUL DEROZAN MAKES IT!
Score: 88-81

[02:26] Team_070 possession (Score: 88-81)
Paul Quickley attempts a Midrange. Contested by Collin Butler (3.8 feet, MAN). PAUL QUICKLEY MAKES IT! Assist: D'Angelo McGrady
Score: 88-83

[02:12] Team_046 possession (Score: 88-83)
FOUL! Shooting foul on Allen Quickley. Manu Dosunmu to the line for 2 free throws. [BONUS: 7 team fouls] (Allen Quickley: 2 personal fouls)   FT 1/2: GOOD   FT 2/2: GOOD Manu Dosunmu makes 2/2 from the line.
Score: 90-83

[01:57] Team_070 possession (Score: 90-83)
Russell Morant drives to the basket... Russell Morant throws a bad pass! Stolen by Chris LaVine! TURNOVER! (live ball)

[01:44] Team_046 possession (Score: 90-83)
Chris LaVine attempts a 3Pt. BLOCKED BY LUKA GOBERT! Ball is loose! Rebound secured by Luka Gobert.

[01:27] Team_070 possession (Score: 90-83)
D'Angelo McGrady attempts a 3Pt. Contested by Collin Butler (3.9 feet, ZONE). D'ANGELO MCGRADY MAKES IT!
Score: 90-86

[01:17] Team_046 possession (Score: 90-86)
Chris LaVine attempts a Midrange. Contested by Luka Gobert (5.2 feet, ZONE). Chris LaVine misses. Rebound secured by Luka Gobert.

[01:04] Team_070 possession (Score: 90-86)
FOUL! Shooting foul on Manu Dosunmu. Allen Quickley to the line for 2 free throws. [BONUS: 6 team fouls] (Manu Dosunmu: 1 personal fouls)   FT 1/2: MISS   FT 2/2: GOOD Allen Quickley makes 1/2 from the line.
Score: 90-87

[00:53] Team_046 possession (Score: 90-87)
Manu Dosunmu attempts a 3Pt. Contested by Paul Quickley (4.9 feet, ZONE). Manu Dosunmu misses. Rebound secured by Luka Gobert.

[00:41] Team_070 possession (Score: 90-87)
Allen Quickley makes the Layup and draws the foul on Collin Butler! And-1! Allen Quickley to the line for 1. [BONUS: 7 team fouls] (Collin Butler: 1 personal fouls)   FT 1/1: GOOD Allen Quickley makes 1/1 from the line.
Score: 90-90

[00:24] Team_046 possession (Score: 90-90)
Manu Dosunmu drives, Russell Morant stays with him. Manu Dosunmu attempts a Dunk. Contested by Russell Morant (4.3 feet, ZONE). MANU DOSUNMU MAKES IT! Assist: Josh Barrett
Score: 92-90

[00:10] Team_070 possession (Score: 92-90)
Allen Quickley attempts a 3Pt. Contested by Manu Dosunmu (4.9 feet, MAN). ALLEN QUICKLEY MAKES IT! Assist: Luka Gobert
Score: 92-93

================================================================================
                              4TH QUARTER COMPLETE                              
================================================================================

4TH QUARTER SCORE: Team_046 22, Team_070 32

BOX SCORE:
================================================================================

Team_046
--------------------------------------------------------------------------------
Player                MIN  PTS  REB  AST  TO      FG   FG%      3P   3P%
--------------------------------------------------------------------------------
Manu Dosunmu           17    7    2    1   0   3/5    60.0     0/0   0.0
Collin Butler          17    5    0    0   0   2/2   100.0     0/0   0.0
Paul DeRozan           17    4    1    0   0   2/4    50.0     0/0   0.0
Cade Wall              32    2    2    1   0   1/3    33.3     0/0   0.0
Victor Nowitzki        32    2    0    0   0   1/3    33.3     0/0   0.0
Kevin Allen            32    0    1    1   0   0/1     0.0     0/0   0.0
D'Angelo O'Neal        32    0    0    0   0   0/2     0.0     0/0   0.0
Chris LaVine           17    0    3    0   0   0/3     0.0     0/0   0.0
Josh Barrett           17    0    0    1   0   0/0     0.0     0/0   0.0

TEAM: FG: 9/23 (39.1%), 3PT: 0/6 (0.0%), REB: 9 (1 off, 8 def), AST: 4, TO: 0
TEAM FOULS: 7 [Team_070 in BONUS]


Team_070
--------------------------------------------------------------------------------
Player                MIN  PTS  REB  AST  TO      FG   FG%      3P   3P%
--------------------------------------------------------------------------------
LeBron Barnes          32    7    4    0   0   3/5    60.0     0/0   0.0
Allen Quickley         17    7    0    1   0   3/5    60.0     0/0   0.0
Jabari Paul            32    6    2    1   0   2/2   100.0     0/0   0.0
D'Angelo McGrady       17    5    2    1   0   2/3    66.7     0/0   0.0
Luka Gobert            17    3    3    1   0   1/1   100.0     0/0   0.0
Russell Morant         17    2    2    0   0   1/2    50.0     0/0   0.0
Paul Quickley          17    2    0    0   0   1/2    50.0     0/0   0.0
John Hyland            32    0    0    1   0   0/1     0.0     0/0   0.0
Khris Bryant           32    0    3    0   0   0/0     0.0     0/0   0.0

TEAM: FG: 13/21 (61.9%), 3PT: 3/10 (30.0%), REB: 16 (2 off, 14 def), AST: 5, TO: 2
TEAM FOULS: 7 [Team_046 in BONUS]

================================================================================

================================================================================
                               FULL GAME COMPLETE                               
================================================================================

FINAL SCORE: Team_046 92, Team_070 93

SCORING BY QUARTER:
--------------------------------------------------------------------------------
Team                     Q1     Q2     Q3     Q4    FINAL
--------------------------------------------------------------------------------
Team_046                 26     27     17     22       92
Team_070                 19     24     18     32       93
--------------------------------------------------------------------------------

FULL GAME BOX SCORE:
================================================================================

Team_046
--------------------------------------------------------------------------------
Player                MIN  PTS  REB  AST  TO      FG   FG%      3P   3P%      FT STL BLK
--------------------------------------------------------------------------------
D'Angelo O'Neal        32   14    0    1   0   5/13   38.5   1/5    20.0   3/3     0   0
Victor Nowitzki        32   11    0    1   1   5/12   41.7   1/5    20.0   0/0     0   0
Lauri Carter           32   17    6    3   1   6/12   50.0   2/3    66.7   4/4     0   1
Cade Wall              32    2   12    6   0   1/7    14.3   0/0     0.0   0/0     3   0
Kevin Allen            32    4   13    2   1   3/10   30.0   0/4     0.0   3/4     0   1
Collin Butler          17    7    0    1   0   3/5    60.0   0/2     0.0   1/1     0   0
Manu Dosunmu           17   13    3    2   1   4/6    66.7   0/2     0.0   5/6     0   0
Josh Barrett           17    9    0    1   0   3/5    60.0   2/3    66.7   1/1     0   0
Chris LaVine           17    5    6    3   0   3/6    50.0   1/2    50.0   3/4     3   0
Paul DeRozan           17    6    5    0   0   4/7    57.1   0/0     0.0   2/3     0   0

TEAM: FG: 38/84 (45.2%), 3PT: 7/26 (26.9%), REB: 45 (9 off, 36 def), AST: 20, TO: 4


Team_070
--------------------------------------------------------------------------------
Player                MIN  PTS  REB  AST  TO      FG   FG%      3P   3P%      FT STL BLK
--------------------------------------------------------------------------------
Cole Gasol             32    4    0    3   1   2/7    28.6   0/2     0.0   3/5     0   1
LeBron Barnes          32   13   17    1   1   6/13   46.2   1/5    20.0   2/2     0   0
John Hyland            32    5    0    3   0   5/12   41.7   2/6    33.3   0/1     0   0
Khris Bryant           32   15   16    0   5   5/10   50.0   0/4     0.0   1/1     2   0
Jabari Paul            32   16    9    3   0   6/7    85.7   1/1   100.0   5/6     0   0
Paul Quickley          17    2    0    1   1   1/3    33.3   0/0     0.0   0/0     0   1
Allen Quickley         17    7    0    2   2   3/9    33.3   1/6    16.7   2/3     0   0
D'Angelo McGrady       17   13    6    1   0   5/7    71.4   2/4    50.0   1/1     0   0
Luka Gobert            17    7    7    1   0   3/3   100.0   0/0     0.0   1/1     0   1
Russell Morant         17    8    2    1   0   4/6    66.7   0/1     0.0   6/6     0   0

TEAM: FG: 40/77 (51.9%), 3PT: 7/29 (24.1%), REB: 57 (12 off, 45 def), AST: 16, TO: 10

================================================================================
