================================================================================
                        FULL GAME - Team_022 vs Team_044                        
================================================================================

================================================================================
                       1ST QUARTER - Team_022 vs Team_044                       
================================================================================

[12:00] Team_022 possession (Score: 0-0)
FOUL! Holding foul on Zach McGrady. [Team fouls: 1] No free throws, side out. (Zach McGrady: 1 personal fouls)

[11:45] Team_022 possession (Score: 0-0)
Michael Ginobili attempts a 3Pt. Contested by Isaiah Murray (4.7 feet, ZONE). Michael Ginobili misses. Rebound secured by Victor Westbrook.

[11:34] Team_044 possession (Score: 0-0)
Ayo McCollum attempts a Layup. Contested by Dirk Markkanen (4.5 feet, MAN). Ayo McCollum misses. Offensive rebound by Ayo McCollum! Ayo McCollum puts it back in!
Score: 0-2

[11:20] Team_022 possession (Score: 0-2)
Dirk Markkanen drives, picks up Ayo McCollum. Help arrives from Zach McGrady! Dirk Markkanen attempts a Dunk. Contested by Zach McGrady (5.1 feet, ZONE). DIRK MARKKANEN MAKES IT! Assist: Michael Ginobili
Score: 2-2

[11:02] Team_044 possession (Score: 2-2)
Karl Fox attempts a Midrange. Contested by Myles Anthony (4.5 feet, ZONE). KARL FOX MAKES IT! Assist: Isaiah Murray
Score: 2-4

[10:46] Team_022 possession (Score: 2-4)
Michael Ginobili attempts a Midrange. Contested by Isaiah Murray (4.7 feet, MAN). Michael Ginobili misses. Rebound secured by Ayo McCollum.

[10:31] Team_044 possession (Score: 2-4)
Zach McGrady drives, picks up Malcolm Allen. Help arrives from Michael Ginobili! Zach McGrady attempts a Dunk. Contested by Michael Ginobili (4.6 feet, MAN). ZACH MCGRADY MAKES IT!
Score: 2-6

[10:13] Team_022 possession (Score: 2-6)
Dirk Markkanen drives, Ayo McCollum stays with him. Dirk Markkanen attempts a Layup. Contested by Ayo McCollum (5.1 feet, MAN). Dirk Markkanen misses. Rebound secured by Victor Westbrook.

[10:01] Team_044 possession (Score: 2-6)
Isaiah Murray attempts a 3Pt. Contested by Michael Ginobili (3.9 feet, MAN). Isaiah Murray misses. Rebound secured by Michael Ginobili.

[09:45] Team_022 possession (Score: 2-6)
Myles Anthony attempts a 3Pt. Contested by Isaiah Murray (4.9 feet, ZONE). Myles Anthony misses. Rebound secured by Karl Fox.

[09:28] Team_044 possession (Score: 2-6)
Zach McGrady attempts a 3Pt. Contested by Michael Ginobili (3.7 feet, ZONE). Zach McGrady misses. Rebound secured by Myles Anthony.

[09:15] Team_022 possession (Score: 2-6)
Lamelo Dosunmu makes the Dunk and draws the foul on Zach McGrady! And-1! Lamelo Dosunmu to the line for 1. [Team fouls: 2] (Zach McGrady: 2 personal fouls)   FT 1/1: GOOD Lamelo Dosunmu makes 1/1 from the line.
Score: 5-6

[09:00] Team_044 possession (Score: 5-6)
Isaiah Murray attempts a 3Pt. Contested by Michael Ginobili (3.9 feet, ZONE). Isaiah Murray misses. FOUL! Loose ball foul on Michael Ginobili during the rebound battle. [Team fouls: 1] No free throws, side out. (Michael Ginobili: 1 personal fouls)

[08:47] Team_044 possession (Score: 5-6)
Karl Fox attempts a 3Pt. Contested by Lamelo Dosunmu (4.7 feet, MAN). Karl Fox misses. Offensive rebound by Ayo McCollum! Ayo McCollum puts it back in!
Score: 5-8

[08:31] Team_022 possession (Score: 5-8)
Michael Ginobili attempts a 3Pt. Contested by Isaiah Murray (4.7 feet, ZONE). MICHAEL GINOBILI MAKES IT! Assist: Dirk Markkanen
Score: 8-8

[08:20] Team_044 possession (Score: 8-8)
Karl Fox attempts a 3Pt. Contested by Lamelo Dosunmu (4.7 feet, MAN). KARL FOX MAKES IT! Assist: Isaiah Murray
Score: 8-11

[08:04] Team_022 possession (Score: 8-11)
Michael Ginobili attempts a Midrange. Contested by Victor Westbrook (5.2 feet, ZONE). Michael Ginobili misses. Rebound secured by Karl Fox.

[07:51] Team_044 possession (Score: 8-11)
Victor Westbrook attempts a 3Pt. Contested by Myles Anthony (4.5 feet, MAN). Victor Westbrook misses. Rebound secured by Myles Anthony.

[07:36] Team_022 possession (Score: 8-11)
Michael Ginobili drives to the basket... Michael Ginobili throws a bad pass! Stolen by Ayo McCollum! TURNOVER! (live ball)

[07:22] Team_044 possession (Score: 8-11)
Victor Westbrook makes the Layup and draws the foul on Michael Ginobili! And-1! Victor Westbrook to the line for 1. [Team fouls: 2] (Michael Ginobili: 2 personal fouls)   FT 1/1: GOOD Victor Westbrook makes 1/1 from the line.
Score: 8-14

[07:08] Team_022 possession (Score: 8-14)
Dirk Markkanen attempts a Midrange. Contested by Isaiah Murray (5.2 feet, ZONE). Dirk Markkanen misses. Rebound secured by Ayo McCollum.

[06:52] Team_044 possession (Score: 8-14)
FOUL! Offensive foul on Isaiah Murray! Michael Ginobili drew the charge! [Team fouls: 3] (Isaiah Murray: 1 personal fouls) TURNOVER! (dead ball)

[06:41] Team_022 possession (Score: 8-14)
Michael Ginobili attempts a Layup. Contested by Isaiah Murray (4.7 feet, MAN). Michael Ginobili misses. Rebound secured by Karl Fox.

[06:22] Team_044 possession (Score: 8-14)
Victor Westbrook makes the Dunk and draws the foul on Michael Ginobili! And-1! Victor Westbrook to the line for 1. [Team fouls: 3] (Michael Ginobili: 3 personal fouls)   FT 1/1: GOOD Victor Westbrook makes 1/1 from the line.
Score: 8-17

[06:11] Team_022 possession (Score: 8-17)
Myles Anthony drives, picks up Karl Fox. Help arrives from Zach McGrady! Myles Anthony attempts a Dunk. Contested by Zach McGrady (4.1 feet, ZONE). Myles Anthony misses. Offensive rebound by Dirk Markkanen! Dirk Markkanen puts it back in!
Score: 10-17

[05:56] Team_044 possession (Score: 10-17)
FOUL! Holding foul on Michael Ginobili. [Team fouls: 4] No free throws, side out. (Michael Ginobili: 4 personal fouls)

[05:39] Team_044 possession (Score: 10-17)
Isaiah Murray attempts a 3Pt. Contested by Michael Ginobili (3.9 feet, MAN). Isaiah Murray misses. Rebound secured by Michael Ginobili.

[05:25] Team_022 possession (Score: 10-17)
Michael Ginobili attempts a 3Pt. Contested by Isaiah Murray (4.7 feet, MAN). Michael Ginobili misses. Rebound secured by Ayo McCollum.

[05:07] Team_044 possession (Score: 10-17)
FOUL! Reach-in foul on Dirk Markkanen during the drive. [IN THE BONUS! 5 team fouls] Ayo McCollum to the line for 2 free throws. (Dirk Markkanen: 1 personal fouls)   FT 1/2: GOOD   FT 2/2: GOOD Ayo McCollum makes 2/2 from the line.
Score: 10-19

[04:49] Team_022 possession (Score: 10-19)
Myles Anthony attempts a 3Pt. Contested by Victor Westbrook (5.4 feet, MAN). Myles Anthony misses. Rebound secured by Karl Fox.

[04:35] Team_044 possession (Score: 10-19)
Isaiah Murray drives, Michael Ginobili stays with him. Isaiah Murray attempts a Dunk. Contested by Michael Ginobili (3.9 feet, MAN). Isaiah Murray misses. Rebound secured by Myles Anthony.

[04:23] Team_022 possession (Score: 10-19)
Malcolm Allen attempts a 3Pt. Contested by Isaiah Murray (5.4 feet, ZONE). Malcolm Allen misses. FOUL! Loose ball foul on Ayo McCollum during the rebound battle. [Team fouls: 4] No free throws, side out. (Ayo McCollum: 1 personal fouls)

[04:05] Team_022 possession (Score: 10-19)
Dirk Markkanen attempts a Midrange. Contested by Ayo McCollum (5.2 feet, MAN). Dirk Markkanen misses. Rebound secured by Victor Westbrook.

[03:50] Team_044 possession (Score: 10-19)
FOUL! Shooting foul on Lamelo Dosunmu. Karl Fox to the line for 2 free throws. [BONUS: 6 team fouls] (Lamelo Dosunmu: 1 personal fouls)   FT 1/2: GOOD   FT 2/2: GOOD Karl Fox makes 2/2 from the line.
Score: 10-21

[03:38] Team_022 possession (Score: 10-21)
Lamelo Dosunmu attempts a 3Pt. Contested by Zach McGrady (4.6 feet, ZONE). Lamelo Dosunmu misses. Rebound secured by Ayo McCollum.

[03:24] Team_044 possession (Score: 10-21)
FOUL! Offensive foul on Isaiah Murray! Michael Ginobili drew the charge! [Team fouls: 5] (Isaiah Murray: 2 personal fouls) TURNOVER! (dead ball)

[03:08] Team_022 possession (Score: 10-21)
Dirk Markkanen drives, picks up Ayo McCollum. Help arrives from Zach McGrady! Dirk Markkanen attempts a Dunk. Contested by Zach McGrady (5.3 feet, MAN). DIRK MARKKANEN MAKES IT!
Score: 12-21

[02:55] Team_044 possession (Score: 12-21)
Isaiah Murray attempts a Layup. BLOCKED BY MICHAEL GINOBILI! Ball is loose! Offensive rebound by Victor Westbrook! Victor Westbrook kicks it out.

[02:37] Team_044 possession (Score: 12-21)
Isaiah Murray attempts a 3Pt. Contested by Michael Ginobili (4.1 feet, ZONE). Isaiah Murray misses. Rebound secured by Dirk Markkanen.

[02:26] Team_022 possession (Score: 12-21)
Malcolm Allen attempts a 3Pt. Contested by Zach McGrady (5.0 feet, MAN). Malcolm Allen misses. Offensive rebound by Dirk Markkanen! Dirk Markkanen puts it back in!
Score: 14-21

[02:12] Team_044 possession (Score: 14-21)
Karl Fox attempts a 3Pt. Contested by Michael Ginobili (3.9 feet, ZONE). KARL FOX MAKES IT! Assist: Ayo McCollum
Score: 14-24

[01:59] Team_022 possession (Score: 14-24)
Lamelo Dosunmu attempts a Midrange. Contested by Victor Westbrook (5.9 feet, ZONE). Lamelo Dosunmu misses. Rebound secured by Karl Fox.

[01:40] Team_044 possession (Score: 14-24)
Victor Westbrook drives and kicks out. Victor Westbrook attempts a 3Pt. Contested by Myles Anthony (4.8 feet, MAN). VICTOR WESTBROOK MAKES IT! Assist: Karl Fox
Score: 14-27

[01:27] Team_022 possession (Score: 14-27)
Lamelo Dosunmu attempts a 3Pt. Contested by Isaiah Murray (5.3 feet, ZONE). Lamelo Dosunmu misses. Rebound secured by Ayo McCollum.

[01:16] Team_044 possession (Score: 14-27)
FOUL! Shooting foul on Dirk Markkanen. Zach McGrady to the line for 2 free throws. [BONUS: 8 team fouls] (Dirk Markkanen: 2 personal fouls)   FT 1/2: GOOD   FT 2/2: GOOD Zach McGrady makes 2/2 from the line.
Score: 14-29

[01:01] Team_022 possession (Score: 14-29)
Dirk Markkanen makes the Layup and draws the foul on Ayo McCollum! And-1! Dirk Markkanen to the line for 1. [BONUS: 6 team fouls] (Ayo McCollum: 2 personal fouls)   FT 1/1: GOOD Dirk Markkanen makes 1/1 from the line.
Score: 17-29

[00:52] Team_044 possession (Score: 17-29)
Isaiah Murray attempts a Midrange. Contested by Michael Ginobili (4.3 feet, MAN). Isaiah Murray misses. Rebound secured by Michael Ginobili.

[00:40] Team_022 possession (Score: 17-29)
FOUL! Holding foul on Ayo McCollum. [IN THE BONUS! 7 team fouls] Dirk Markkanen to the line for 2 free throws. (Ayo McCollum: 3 personal fouls)   FT 1/2: GOOD   FT 2/2: GOOD Dirk Markkanen makes 2/2 from the line.
Score: 19-29

[00:23] Team_044 possession (Score: 19-29)
Victor Westbrook makes the Layup and draws the foul on Dirk Markkanen! And-1! Victor Westbrook to the line for 1. [BONUS: 9 team fouls] (Dirk Markkanen: 3 personal fouls)   FT 1/1: GOOD Victor Westbrook makes 1/1 from the line.
Score: 19-32

[00:08] Team_022 possession (Score: 19-32)
Malcolm Allen drives, Ayo McCollum stays with him. Malcolm Allen attempts a Layup. Contested by Ayo McCollum (5.9 feet, ZONE). Malcolm Allen misses. Offensive rebound by Dirk Markkanen! Dirk Markkanen's putback is no good. Offensive rebound by Michael Ginobili! Michael Ginobili kicks it out.

================================================================================
                              1ST QUARTER COMPLETE                              
================================================================================

1ST QUARTER SCORE: Team_022 19, Team_044 32

BOX SCORE:
================================================================================

Team_022
--------------------------------------------------------------------------------
Player                MIN  PTS  REB  AST  TO      FG   FG%      3P   3P%
--------------------------------------------------------------------------------
Dirk Markkanen         12   13    3    1   0   6/9    66.7     0/0   0.0
Michael Ginobili       12    3    5    1   0   1/6    16.7     0/0   0.0
Lamelo Dosunmu         12    3    0    0   0   1/4    25.0     0/0   0.0
Myles Anthony          12    0    3    0   0   0/2     0.0     0/0   0.0

TEAM: FG: 8/21 (38.1%), 3PT: 2/8 (25.0%), REB: 11 (4 off, 7 def), AST: 2, TO: 1
TEAM FOULS: 9 [Team_044 in BONUS]


Team_044
--------------------------------------------------------------------------------
Player                MIN  PTS  REB  AST  TO      FG   FG%      3P   3P%
--------------------------------------------------------------------------------
Victor Westbrook       12   12    4    0   0   4/5    80.0     0/0   0.0
Karl Fox               12   10    5    1   0   4/4   100.0     0/0   0.0
Ayo McCollum           12    6    8    1   0   3/3   100.0     0/0   0.0
Zach McGrady           12    4    0    0   0   2/3    66.7     0/0   0.0
Isaiah Murray          12    0    0    2   0   0/5     0.0     0/0   0.0

TEAM: FG: 13/20 (65.0%), 3PT: 3/8 (37.5%), REB: 17 (4 off, 13 def), AST: 4, TO: 2
TEAM FOULS: 8 [Team_022 in BONUS]

================================================================================

================================================================================
                       2ND QUARTER - Team_022 vs Team_044                       
================================================================================

[12:00] Team_022 possession (Score: 19-32)
FOUL! Shooting foul on Zach McGrady. Malcolm Allen to the line for 3 free throws. [Team fouls: 1] (Zach McGrady: 1 personal fouls)   FT 1/3: GOOD   FT 2/3: GOOD   FT 3/3: MISS Malcolm Allen makes 2/3 from the line. Rebound secured by Victor Westbrook.
Score: 21-32

[11:43] Team_044 possession (Score: 21-32)
Ayo McCollum attempts a Layup. Contested by Dirk Markkanen (4.9 feet, MAN). AYO MCCOLLUM MAKES IT! Assist: Victor Westbrook
Score: 21-34

[11:28] Team_022 possession (Score: 21-34)
FOUL! Reach-in foul on Ayo McCollum during the drive. [Team fouls: 2] No free throws, side out. (Ayo McCollum: 1 personal fouls)

[11:18] Team_022 possession (Score: 21-34)
Michael Ginobili attempts a 3Pt. Contested by Isaiah Murray (5.0 feet, MAN). Michael Ginobili misses. Rebound secured by Ayo McCollum.

[11:05] Team_044 possession (Score: 21-34)
Isaiah Murray attempts a 3Pt. Contested by Michael Ginobili (4.3 feet, MAN). Isaiah Murray misses. Rebound secured by Myles Anthony.

[10:54] Team_022 possession (Score: 21-34)
Malcolm Allen attempts a 3Pt. Contested by Zach McGrady (5.1 feet, MAN). Malcolm Allen misses. Rebound secured by Victor Westbrook.

[10:40] Team_044 possession (Score: 21-34)
Karl Fox attempts a Midrange. Contested by Lamelo Dosunmu (5.3 feet, MAN). KARL FOX MAKES IT! Assist: Victor Westbrook
Score: 21-36

[10:26] Team_022 possession (Score: 21-36)
Michael Ginobili drives, Isaiah Murray stays with him. Michael Ginobili attempts a Layup. Contested by Isaiah Murray (5.1 feet, MAN). MICHAEL GINOBILI MAKES IT!
Score: 23-36

[10:14] Team_044 possession (Score: 23-36)
Isaiah Murray attempts a Layup. Contested by Michael Ginobili (4.4 feet, MAN). ISAIAH MURRAY MAKES IT! Assist: Ayo McCollum
Score: 23-38

[10:00] Team_022 possession (Score: 23-38)
FOUL! Reach-in foul on Zach McGrady during the drive. [Team fouls: 3] No free throws, side out. (Zach McGrady: 2 personal fouls)

[09:45] Team_022 possession (Score: 23-38)
Myles Anthony makes the 3Pt and draws the foul on Victor Westbrook! And-1! Myles Anthony to the line for 1. [Team fouls: 4] (Victor Westbrook: 1 personal fouls)   FT 1/1: GOOD Myles Anthony makes 1/1 from the line.
Score: 27-38

[09:28] Team_044 possession (Score: 27-38)
Ayo McCollum drives, picks up Dirk Markkanen. Help arrives from Michael Ginobili! Ayo McCollum attempts a Layup. Contested by Michael Ginobili (5.1 feet, MAN). AYO MCCOLLUM MAKES IT! Assist: Karl Fox
Score: 27-40

[09:12] Team_022 possession (Score: 27-40)
Myles Anthony drives, Karl Fox stays with him. Myles Anthony attempts a Dunk. Contested by Karl Fox (4.7 feet, ZONE). MYLES ANTHONY MAKES IT! Assist: Dirk Markkanen
Score: 29-40

[08:54] Team_044 possession (Score: 29-40)
Zach McGrady attempts a Midrange. Contested by Malcolm Allen (5.3 feet, MAN). ZACH MCGRADY MAKES IT! Assist: Karl Fox
Score: 29-42

[08:38] Team_022 possession (Score: 29-42)
Lamelo Dosunmu drives, picks up Karl Fox. Help arrives from Zach McGrady! Lamelo Dosunmu attempts a Dunk. Contested by Zach McGrady (4.9 feet, MAN). Lamelo Dosunmu misses. Rebound secured by Karl Fox.

[08:26] Team_044 possession (Score: 29-42)
Karl Fox attempts a 3Pt. Contested by Lamelo Dosunmu (5.6 feet, MAN). Karl Fox misses. Rebound secured by Michael Ginobili.

[08:14] Team_022 possession (Score: 29-42)
Dirk Markkanen attempts a Midrange. Contested by Isaiah Murray (5.7 feet, ZONE). Dirk Markkanen misses. Rebound secured by Karl Fox.

[07:57] Team_044 possession (Score: 29-42)
Zach McGrady attempts a 3Pt. Contested by Michael Ginobili (4.6 feet, ZONE). Zach McGrady misses. Rebound secured by Michael Ginobili.

[07:41] Team_022 possession (Score: 29-42)
Michael Ginobili attempts a Midrange. Contested by Isaiah Murray (5.4 feet, MAN). Michael Ginobili misses. Rebound secured by Victor Westbrook.

[07:26] Team_044 possession (Score: 29-42)
Zach McGrady attempts a 3Pt. Contested by Malcolm Allen (5.5 feet, MAN). Zach McGrady misses. Rebound secured by Dirk Markkanen.

[07:09] Team_022 possession (Score: 29-42)
Myles Anthony attempts a 3Pt. Contested by Zach McGrady (5.1 feet, ZONE). Myles Anthony misses. FOUL! Loose ball foul on Ayo McCollum during the rebound battle. [IN THE BONUS! 5 team fouls] Michael Ginobili to the line for 2 free throws. (Ayo McCollum: 2 personal fouls)   FT 1/2: GOOD   FT 2/2: GOOD Michael Ginobili makes 2/2 from the line.
Score: 31-42

[06:57] Team_044 possession (Score: 31-42)
Zach McGrady attempts a 3Pt. Contested by Malcolm Allen (5.6 feet, MAN). ZACH MCGRADY MAKES IT! Assist: Isaiah Murray
Score: 31-45

[06:43] Team_022 possession (Score: 31-45)
Myles Anthony drives, Karl Fox stays with him. Myles Anthony attempts a Layup. Contested by Karl Fox (5.0 feet, ZONE). Myles Anthony misses. Offensive rebound by Dirk Markkanen! Dirk Markkanen kicks it out.

[06:26] Team_022 possession (Score: 31-45)
Dirk Markkanen drives and kicks out. Dirk Markkanen attempts a 3Pt. Contested by Ayo McCollum (5.9 feet, MAN). Dirk Markkanen misses. Rebound secured by Karl Fox.

[06:13] Team_044 possession (Score: 31-45)
Karl Fox attempts a Layup. Contested by Lamelo Dosunmu (5.9 feet, MAN). Karl Fox misses. Rebound secured by Dirk Markkanen.

[05:57] Team_022 possession (Score: 31-45)
Myles Anthony attempts a Layup. Wide open! Ayo McCollum is 6.0 feet away. [ZONE] Myles Anthony misses. Rebound secured by Karl Fox.

[05:42] Team_044 possession (Score: 31-45)
Isaiah Murray attempts a 3Pt. Contested by Michael Ginobili (5.0 feet, MAN). Isaiah Murray misses. Rebound secured by Michael Ginobili.

[05:26] Team_022 possession (Score: 31-45)
Lamelo Dosunmu attempts a 3Pt. Contested by Zach McGrady (5.5 feet, ZONE). Lamelo Dosunmu misses. Rebound secured by Ayo McCollum.

[05:17] Team_044 possession (Score: 31-45)
Zach McGrady drives to the basket... Zach McGrady loses control! Ball rolls out of bounds! TURNOVER! (dead ball)

[05:17] Substitution (Team_022): Malcolm Allen OUT → DeMar Harden IN (stamina_rule2)

[05:17] Substitution (Team_022): Michael Ginobili OUT → Lauri Gobert IN (stamina_rule2)

[05:17] Substitution (Team_022): Myles Anthony OUT → Dejounte Towns IN (stamina_rule2)

[05:17] Substitution (Team_022): Lamelo Dosunmu OUT → Kawhi Russell IN (stamina_rule2)

[05:17] Substitution (Team_022): Dirk Markkanen OUT → Cole Iverson IN (stamina_rule2)

[05:17] Substitution (Team_044): Zach McGrady OUT → Kyrie Poole IN (stamina_rule2)

[05:17] Substitution (Team_044): Isaiah Murray OUT → Tim Towns IN (stamina_rule2)

[05:17] Substitution (Team_044): Victor Westbrook OUT → Tim Siakam IN (stamina_rule2)

[05:17] Substitution (Team_044): Karl Fox OUT → Pau Quickley IN (stamina_rule2)

[05:17] Substitution (Team_044): Ayo McCollum OUT → Victor Anthony IN (stamina_rule2)

[05:06] Team_022 possession (Score: 31-45)
Dejounte Towns throws a bad pass! Stolen by Tim Siakam! TURNOVER! (live ball)

[04:53] Team_044 possession (Score: 31-45)
FOUL! Shooting foul on Kawhi Russell. Tim Siakam to the line for 2 free throws. [Team fouls: 1] (Kawhi Russell: 1 personal fouls)   FT 1/2: GOOD   FT 2/2: GOOD Tim Siakam makes 2/2 from the line.
Score: 31-47

[04:41] Team_022 possession (Score: 31-47)
Dejounte Towns attempts a 3Pt. Contested by Tim Siakam (3.8 feet, MAN). Dejounte Towns misses. Rebound secured by Tim Siakam.

[04:28] Team_044 possession (Score: 31-47)
Victor Anthony attempts a 3Pt. Contested by Cole Iverson (5.8 feet, MAN). Victor Anthony misses. Rebound secured by Dejounte Towns.

[04:14] Team_022 possession (Score: 31-47)
Cole Iverson attempts a Layup. Contested by Victor Anthony (4.4 feet, MAN). COLE IVERSON MAKES IT!
Score: 33-47

[04:04] Team_044 possession (Score: 33-47)
Tim Siakam attempts a 3Pt. Contested by Kawhi Russell (4.1 feet, ZONE). TIM SIAKAM MAKES IT! Assist: Victor Anthony
Score: 33-50

[03:53] Team_022 possession (Score: 33-50)
FOUL! Reach-in foul on Victor Anthony during the drive. [IN THE BONUS! 6 team fouls] Cole Iverson to the line for 2 free throws. (Victor Anthony: 1 personal fouls)   FT 1/2: GOOD   FT 2/2: MISS Cole Iverson makes 1/2 from the line. Rebound secured by Tim Siakam.
Score: 34-50

[03:37] Team_044 possession (Score: 34-50)
Kyrie Poole attempts a Midrange. Contested by DeMar Harden (5.3 feet, MAN). KYRIE POOLE MAKES IT!
Score: 34-52

[03:22] Team_022 possession (Score: 34-52)
Cole Iverson drives to the basket... Cole Iverson loses the ball! Stripped by Pau Quickley! TURNOVER! (live ball)

[03:09] Team_044 possession (Score: 34-52)
Kyrie Poole drives and kicks out. Victor Anthony attempts a 3Pt. Contested by Cole Iverson (5.1 feet, MAN). Victor Anthony misses. Rebound secured by Dejounte Towns.

[02:52] Team_022 possession (Score: 34-52)
Lauri Gobert drives, picks up Pau Quickley. Help arrives from Tim Towns! Lauri Gobert attempts a Dunk. Contested by Tim Towns (3.3 feet, ZONE). LAURI GOBERT MAKES IT! Assist: Dejounte Towns
Score: 36-52

[02:37] Team_044 possession (Score: 36-52)
Tim Siakam attempts a Layup. Contested by Dejounte Towns (4.6 feet, MAN). Tim Siakam misses. Offensive rebound by Victor Anthony! Victor Anthony kicks it out.

[02:26] Team_044 possession (Score: 36-52)
Kyrie Poole attempts a 3Pt. Contested by Kawhi Russell (4.0 feet, ZONE). Kyrie Poole misses. Offensive rebound by Tim Siakam! Tim Siakam kicks it out.

[02:10] Team_044 possession (Score: 36-52)
Victor Anthony attempts a Midrange. Contested by Cole Iverson (5.8 feet, MAN). Victor Anthony misses. Offensive rebound by Tim Siakam! Tim Siakam kicks it out.

[01:57] Team_044 possession (Score: 36-52)
FOUL! Offensive foul on Tim Siakam! Dejounte Towns drew the charge! [Team fouls: 7] (Tim Siakam: 1 personal fouls) TURNOVER! (dead ball)

[01:43] Team_022 possession (Score: 36-52)
Dejounte Towns attempts a 3Pt. Contested by Tim Siakam (3.8 feet, MAN). Dejounte Towns misses. Rebound secured by Pau Quickley.

[01:27] Team_044 possession (Score: 36-52)
Kyrie Poole attempts a Midrange. Contested by DeMar Harden (5.3 feet, MAN). Kyrie Poole misses. Rebound secured by Dejounte Towns.

[01:14] Team_022 possession (Score: 36-52)
Kawhi Russell attempts a 3Pt. Contested by Pau Quickley (3.7 feet, MAN). Kawhi Russell misses. FOUL! Loose ball foul on Pau Quickley during the rebound battle. [IN THE BONUS! 8 team fouls] Dejounte Towns to the line for 2 free throws. (Pau Quickley: 1 personal fouls)   FT 1/2: GOOD   FT 2/2: MISS Dejounte Towns makes 1/2 from the line. Rebound secured by Victor Anthony.
Score: 37-52

[01:03] Team_044 possession (Score: 37-52)
Tim Towns drives, picks up Lauri Gobert. Help arrives from DeMar Harden! Tim Towns attempts a Dunk. Contested by DeMar Harden (4.7 feet, MAN). Tim Towns misses. Rebound secured by Dejounte Towns.

[00:51] Team_022 possession (Score: 37-52)
Lauri Gobert attempts a 3Pt. Contested by Tim Towns (5.3 feet, MAN). Lauri Gobert misses. Offensive rebound by Dejounte Towns! Dejounte Towns kicks it out.

[00:38] Team_022 possession (Score: 37-52)
Cole Iverson attempts a Layup. Contested by Victor Anthony (4.4 feet, MAN). Cole Iverson misses. Offensive rebound by Dejounte Towns! Dejounte Towns kicks it out.

[00:20] Team_022 possession (Score: 37-52)
DeMar Harden attempts a 3Pt. Contested by Kyrie Poole (4.6 feet, MAN). DeMar Harden misses. Rebound secured by Pau Quickley.

[00:06] Team_044 possession (Score: 37-52)
Tim Towns attempts a 3Pt. Contested by Kawhi Russell (4.2 feet, ZONE). TIM TOWNS MAKES IT! Assist: Tim Siakam
Score: 37-55

================================================================================
                              2ND QUARTER COMPLETE                              
================================================================================

2ND QUARTER SCORE: Team_022 18, Team_044 23

BOX SCORE:
================================================================================

Team_022
--------------------------------------------------------------------------------
Player                MIN  PTS  REB  AST  TO      FG   FG%      3P   3P%
--------------------------------------------------------------------------------
Myles Anthony          19    6    1    0   0   2/3    66.7     0/0   0.0
Michael Ginobili       19    4    3    0   0   2/4    50.0     0/0   0.0
Cole Iverson            5    2    0    0   0   1/2    50.0     0/0   0.0
Lauri Gobert            5    2    0    0   0   1/1   100.0     0/0   0.0
Malcolm Allen          19    0    0    0   0   0/2     0.0     0/0   0.0
Dirk Markkanen         19    0    3    1   0   0/2     0.0     0/0   0.0
Lamelo Dosunmu         19    0    0    0   0   0/2     0.0     0/0   0.0
Dejounte Towns          5    0    6    1   0   0/2     0.0     0/0   0.0
Victor Anthony          5    0    2    1   0   0/1     0.0     0/0   0.0
Kawhi Russell           5    0    0    0   0   0/1     0.0     0/0   0.0
DeMar Harden            5    0    0    0   0   0/1     0.0     0/0   0.0

TEAM: FG: 6/20 (30.0%), 3PT: 2/10 (20.0%), REB: 14 (4 off, 10 def), AST: 2, TO: 2
TEAM FOULS: 1


Team_044
--------------------------------------------------------------------------------
Player                MIN  PTS  REB  AST  TO      FG   FG%      3P   3P%
--------------------------------------------------------------------------------
Zach McGrady           19    5    0    0   0   2/4    50.0     0/0   0.0
Tim Siakam              5    5    4    1   0   2/2   100.0     0/0   0.0
Ayo McCollum           19    4    2    1   0   2/2   100.0     0/0   0.0
Tim Towns               5    3    0    0   0   1/2    50.0     0/0   0.0
Isaiah Murray          19    2    0    1   0   1/3    33.3     0/0   0.0
Karl Fox               19    2    4    2   0   1/3    33.3     0/0   0.0
Kyrie Poole             5    2    0    0   0   1/3    33.3     0/0   0.0
Victor Westbrook       19    0    3    2   0   0/0     0.0     0/0   0.0
Pau Quickley            5    0    2    0   0   0/0     0.0     0/0   0.0

TEAM: FG: 10/20 (50.0%), 3PT: 3/9 (33.3%), REB: 16 (3 off, 13 def), AST: 8, TO: 2
TEAM FOULS: 8 [Team_022 in BONUS]

================================================================================

================================================================================
                       3RD QUARTER - Team_022 vs Team_044                       
================================================================================

[12:00] Team_022 possession (Score: 37-55)
Michael Ginobili drives and kicks out. Lamelo Dosunmu attempts a 3Pt. Contested by Karl Fox (3.9 feet, MAN). Lamelo Dosunmu misses. Offensive rebound by Dirk Markkanen! Dirk Markkanen puts it back in!
Score: 39-55

[11:46] Team_044 possession (Score: 39-55)
Ayo McCollum attempts a Midrange. Contested by Lamelo Dosunmu (4.6 feet, ZONE). Ayo McCollum misses. Offensive rebound by Ayo McCollum! Ayo McCollum's putback is no good. Rebound secured by Myles Anthony.

[11:32] Team_022 possession (Score: 39-55)
Myles Anthony attempts a 3Pt. Contested by Isaiah Murray (4.9 feet, ZONE). Myles Anthony misses. Rebound secured by Ayo McCollum.

[11:20] Team_044 possession (Score: 39-55)
Karl Fox drives and kicks out. Ayo McCollum attempts a Midrange. Contested by Lamelo Dosunmu (4.6 feet, ZONE). AYO MCCOLLUM MAKES IT!
Score: 39-57

[11:08] Team_022 possession (Score: 39-57)
Lamelo Dosunmu drives, Ayo McCollum stays with him. Lamelo Dosunmu attempts a Dunk. Contested by Ayo McCollum (5.0 feet, ZONE). Lamelo Dosunmu misses. Rebound secured by Ayo McCollum.

[10:51] Team_044 possession (Score: 39-57)
Zach McGrady drives, Malcolm Allen stays with him. Zach McGrady attempts a Layup. Contested by Malcolm Allen (4.6 feet, MAN). ZACH MCGRADY MAKES IT!
Score: 39-59

[10:34] Team_022 possession (Score: 39-59)
Lamelo Dosunmu attempts a 3Pt. Contested by Karl Fox (4.4 feet, MAN). Lamelo Dosunmu misses. Rebound secured by Victor Westbrook.

[10:18] Team_044 possession (Score: 39-59)
Karl Fox drives and kicks out. Victor Westbrook attempts a Midrange. Contested by Malcolm Allen (4.4 feet, ZONE). VICTOR WESTBROOK MAKES IT! Assist: Zach McGrady
Score: 39-61

[10:05] Team_022 possession (Score: 39-61)
Malcolm Allen attempts a 3Pt. Contested by Isaiah Murray (5.4 feet, ZONE). Malcolm Allen misses. Rebound secured by Karl Fox.

[09:54] Team_044 possession (Score: 39-61)
Karl Fox loses the ball! Stripped by Lamelo Dosunmu! TURNOVER! (live ball)

[09:39] Team_022 possession (Score: 39-61)
Myles Anthony attempts a 3Pt. Contested by Victor Westbrook (5.3 feet, MAN). Myles Anthony misses. Offensive rebound by Dirk Markkanen! Dirk Markkanen puts it back in!
Score: 41-61

[09:25] Team_044 possession (Score: 41-61)
Ayo McCollum attempts a Dunk. BLOCKED BY DIRK MARKKANEN! Ball is loose! Rebound secured by Dirk Markkanen.

[09:10] Team_022 possession (Score: 41-61)
FOUL! Offensive foul on Lamelo Dosunmu! Karl Fox drew the charge! [Team fouls: 1] (Lamelo Dosunmu: 1 personal fouls) TURNOVER! (dead ball)

[08:56] Team_044 possession (Score: 41-61)
Victor Westbrook attempts a 3Pt. Contested by Myles Anthony (4.5 feet, MAN). Victor Westbrook misses. Offensive rebound by Ayo McCollum! Ayo McCollum puts it back in!
Score: 41-63

[08:41] Team_022 possession (Score: 41-63)
Dirk Markkanen drives, Ayo McCollum stays with him. Dirk Markkanen attempts a Dunk. Contested by Ayo McCollum (5.1 feet, ZONE). DIRK MARKKANEN MAKES IT! Assist: Malcolm Allen
Score: 43-63

[08:29] Team_044 possession (Score: 43-63)
Ayo McCollum attempts a Midrange. Contested by Dirk Markkanen (4.5 feet, MAN). AYO MCCOLLUM MAKES IT! Assist: Victor Westbrook
Score: 43-65

[08:11] Team_022 possession (Score: 43-65)
Michael Ginobili attempts a Midrange. Contested by Isaiah Murray (4.7 feet, MAN). MICHAEL GINOBILI MAKES IT! Assist: Dirk Markkanen
Score: 45-65

[07:58] Team_044 possession (Score: 45-65)
Karl Fox drives, picks up Lamelo Dosunmu. Help arrives from Michael Ginobili! Karl Fox attempts a Layup. Contested by Michael Ginobili (4.7 feet, MAN). KARL FOX MAKES IT! Assist: Isaiah Murray
Score: 45-67

[07:42] Team_022 possession (Score: 45-67)
Michael Ginobili attempts a 3Pt. Contested by Victor Westbrook (5.2 feet, ZONE). MICHAEL GINOBILI MAKES IT! Assist: Malcolm Allen
Score: 48-67

[07:26] Team_044 possession (Score: 48-67)
Karl Fox attempts a Midrange. Contested by Myles Anthony (4.5 feet, ZONE). Karl Fox misses. Rebound secured by Michael Ginobili.

[07:07] Team_022 possession (Score: 48-67)
Michael Ginobili attempts a Midrange. Contested by Isaiah Murray (4.7 feet, MAN). Michael Ginobili misses. Offensive rebound by Dirk Markkanen! Dirk Markkanen puts it back in!
Score: 50-67

[06:54] Team_044 possession (Score: 50-67)
Zach McGrady attempts a 3Pt. Contested by Malcolm Allen (4.6 feet, MAN). Zach McGrady misses. Rebound secured by Michael Ginobili.

[06:36] Team_022 possession (Score: 50-67)
Michael Ginobili drives and kicks out. Myles Anthony attempts a Midrange. Contested by Victor Westbrook (5.1 feet, MAN). Myles Anthony misses. FOUL! Loose ball foul on Karl Fox during the rebound battle. [Team fouls: 1] No free throws, side out. (Karl Fox: 1 personal fouls)

[06:22] Team_022 possession (Score: 50-67)
FOUL! Reach-in foul on Ayo McCollum during the drive. [Team fouls: 2] No free throws, side out. (Ayo McCollum: 1 personal fouls)

[06:09] Team_022 possession (Score: 50-67)
Dirk Markkanen attempts a 3Pt. Contested by Isaiah Murray (5.2 feet, ZONE). DIRK MARKKANEN MAKES IT! Assist: Michael Ginobili
Score: 53-67

[05:51] Team_044 possession (Score: 53-67)
Victor Westbrook attempts a 3Pt. Contested by Myles Anthony (4.5 feet, MAN). VICTOR WESTBROOK MAKES IT! Assist: Karl Fox
Score: 53-70

[05:38] Team_022 possession (Score: 53-70)
Myles Anthony drives to the basket... Myles Anthony loses control! Ball rolls out of bounds! TURNOVER! (dead ball)

[05:23] Team_044 possession (Score: 53-70)
Zach McGrady attempts a Layup. Contested by Malcolm Allen (4.7 feet, MAN). ZACH MCGRADY MAKES IT!
Score: 53-72

[05:08] Team_022 possession (Score: 53-72)
Malcolm Allen drives and kicks out. Lamelo Dosunmu attempts a 3Pt. Contested by Karl Fox (3.9 feet, MAN). Lamelo Dosunmu misses. Offensive rebound by Dirk Markkanen! Dirk Markkanen puts it back in!
Score: 55-72

[04:54] Team_044 possession (Score: 55-72)
Isaiah Murray attempts a Midrange. Contested by Michael Ginobili (3.9 feet, MAN). Isaiah Murray misses. Rebound secured by Myles Anthony.

[04:41] Team_022 possession (Score: 55-72)
Myles Anthony drives to the basket... FOUL! Offensive foul on Myles Anthony! Victor Westbrook drew the charge! [Team fouls: 2] (Myles Anthony: 1 personal fouls) TURNOVER! (dead ball)

[04:26] Team_044 possession (Score: 55-72)
Victor Westbrook drives, Myles Anthony stays with him. Victor Westbrook attempts a Dunk. Contested by Myles Anthony (4.6 feet, MAN). Victor Westbrook misses. Rebound secured by Michael Ginobili.

[04:11] Team_022 possession (Score: 55-72)
Dirk Markkanen attempts a Midrange. Contested by Karl Fox (4.5 feet, ZONE). Dirk Markkanen misses. Offensive rebound by Dirk Markkanen! Dirk Markkanen puts it back in!
Score: 57-72

[03:53] Team_044 possession (Score: 57-72)
Karl Fox drives, Lamelo Dosunmu stays with him. Karl Fox attempts a Dunk. Contested by Lamelo Dosunmu (4.9 feet, MAN). Karl Fox misses. Offensive rebound by Ayo McCollum! Ayo McCollum kicks it out.

[03:38] Team_044 possession (Score: 57-72)
Ayo McCollum drives, Dirk Markkanen stays with him. Ayo McCollum attempts a Dunk. Contested by Dirk Markkanen (4.7 feet, MAN). AYO MCCOLLUM MAKES IT! Assist: Isaiah Murray
Score: 57-74

[03:27] Team_022 possession (Score: 57-74)
Lamelo Dosunmu attempts a 3Pt. Contested by Isaiah Murray (5.2 feet, ZONE). Lamelo Dosunmu misses. Offensive rebound by Dirk Markkanen! Dirk Markkanen puts it back in!
Score: 59-74

[03:13] Team_044 possession (Score: 59-74)
Isaiah Murray attempts a 3Pt. Contested by Michael Ginobili (4.0 feet, ZONE). Isaiah Murray misses. Rebound secured by Dirk Markkanen.

[02:59] Team_022 possession (Score: 59-74)
Malcolm Allen attempts a 3Pt. Contested by Zach McGrady (5.0 feet, MAN). Malcolm Allen misses. Rebound secured by Karl Fox.

[02:47] Team_044 possession (Score: 59-74)
Zach McGrady attempts a Midrange. Contested by Malcolm Allen (4.9 feet, MAN). ZACH MCGRADY MAKES IT! Assist: Karl Fox
Score: 59-76

[02:35] Team_022 possession (Score: 59-76)
Dirk Markkanen attempts a Layup. BLOCKED BY ZACH MCGRADY! Ball is loose! Rebound secured by Victor Westbrook.

[02:19] Team_044 possession (Score: 59-76)
Karl Fox attempts a Layup. Contested by Lamelo Dosunmu (5.1 feet, MAN). KARL FOX MAKES IT! Assist: Isaiah Murray
Score: 59-78

[02:02] Team_022 possession (Score: 59-78)
Lamelo Dosunmu drives, Ayo McCollum stays with him. Lamelo Dosunmu attempts a Dunk. Contested by Ayo McCollum (5.4 feet, ZONE). Lamelo Dosunmu misses. Offensive rebound by Michael Ginobili! Michael Ginobili kicks it out.

[01:48] Team_022 possession (Score: 59-78)
Michael Ginobili attempts a Midrange. Contested by Karl Fox (4.3 feet, ZONE). Michael Ginobili misses. Rebound secured by Victor Westbrook.

[01:34] Team_044 possession (Score: 59-78)
Karl Fox attempts a Midrange. Contested by Lamelo Dosunmu (5.2 feet, MAN). Karl Fox misses. Offensive rebound by Ayo McCollum! Ayo McCollum kicks it out.

[01:22] Team_044 possession (Score: 59-78)
FOUL! Holding foul on Lamelo Dosunmu. [Team fouls: 3] No free throws, side out. (Lamelo Dosunmu: 2 personal fouls)

[01:05] Team_044 possession (Score: 59-78)
Karl Fox drives and kicks out. Ayo McCollum attempts a Midrange. Contested by Malcolm Allen (4.9 feet, ZONE). Ayo McCollum misses. Rebound secured by Michael Ginobili.

[00:56] Team_022 possession (Score: 59-78)
Michael Ginobili throws a bad pass out of bounds! TURNOVER! (dead ball)

[00:56] Substitution (Team_022): Malcolm Allen OUT → DeMar Harden IN (stamina_rule2)

[00:56] Substitution (Team_022): Michael Ginobili OUT → Lauri Gobert IN (stamina_rule2)

[00:56] Substitution (Team_022): Myles Anthony OUT → Dejounte Towns IN (stamina_rule2)

[00:56] Substitution (Team_022): Lamelo Dosunmu OUT → Kawhi Russell IN (stamina_rule2)

[00:56] Substitution (Team_022): Dirk Markkanen OUT → Cole Iverson IN (stamina_rule2)

[00:56] Substitution (Team_044): Zach McGrady OUT → Kyrie Poole IN (stamina_rule2)

[00:56] Substitution (Team_044): Isaiah Murray OUT → Tim Towns IN (stamina_rule2)

[00:56] Substitution (Team_044): Victor Westbrook OUT → Tim Siakam IN (stamina_rule2)

[00:56] Substitution (Team_044): Karl Fox OUT → Pau Quickley IN (stamina_rule2)

[00:56] Substitution (Team_044): Ayo McCollum OUT → Victor Anthony IN (stamina_rule2)

[00:45] Team_044 possession (Score: 59-78)
Tim Towns drives to the basket... Tim Towns throws a bad pass out of bounds! TURNOVER! (dead ball)

[00:33] Team_022 possession (Score: 59-78)
Dejounte Towns commits a violation (traveling/carry)! TURNOVER! (dead ball)

[00:16] Team_044 possession (Score: 59-78)
Tim Towns attempts a 3Pt. Contested by Kawhi Russell (4.2 feet, ZONE). Tim Towns misses. Rebound secured by Lauri Gobert.

[00:07] Team_022 possession (Score: 59-78)
FOUL! Shooting foul on Tim Siakam. DeMar Harden to the line for 3 free throws. [Team fouls: 3] (Tim Siakam: 1 personal fouls)   FT 1/3: MISS   FT 2/3: GOOD   FT 3/3: GOOD DeMar Harden makes 2/3 from the line.
Score: 61-78

================================================================================
                              3RD QUARTER COMPLETE                              
================================================================================

3RD QUARTER SCORE: Team_022 24, Team_044 23

BOX SCORE:
================================================================================

Team_022
--------------------------------------------------------------------------------
Player                MIN  PTS  REB  AST  TO      FG   FG%      3P   3P%
--------------------------------------------------------------------------------
Dirk Markkanen         30   17    9    1   0   8/9    88.9     0/0   0.0
Michael Ginobili       30    5    5    1   0   2/3    66.7     0/0   0.0
DeMar Harden            6    2    0    0   0   1/1   100.0     0/0   0.0
Myles Anthony          30    0    2    0   0   0/1     0.0     0/0   0.0
Lamelo Dosunmu         30    0    0    0   0   0/2     0.0     0/0   0.0
Malcolm Allen          30    0    0    2   0   0/2     0.0     0/0   0.0
Lauri Gobert            6    0    1    0   0   0/0     0.0     0/0   0.0

TEAM: FG: 11/18 (61.1%), 3PT: 5/9 (55.6%), REB: 16 (8 off, 8 def), AST: 4, TO: 5
TEAM FOULS: 3


Team_044
--------------------------------------------------------------------------------
Player                MIN  PTS  REB  AST  TO      FG   FG%      3P   3P%
--------------------------------------------------------------------------------
Ayo McCollum           30    8    5    0   0   4/6    66.7     0/0   0.0
Zach McGrady           30    6    0    1   0   3/4    75.0     0/0   0.0
Victor Westbrook       30    5    3    1   0   2/3    66.7     0/0   0.0
Karl Fox               30    4    2    2   0   2/4    50.0     0/0   0.0
Isaiah Murray          30    0    0    3   0   0/2     0.0     0/0   0.0
Tim Towns               6    0    0    0   0   0/1     0.0     0/0   0.0

TEAM: FG: 11/20 (55.0%), 3PT: 2/5 (40.0%), REB: 11 (4 off, 7 def), AST: 7, TO: 2
TEAM FOULS: 3

================================================================================

================================================================================
                       4TH QUARTER - Team_022 vs Team_044                       
================================================================================

[12:00] Substitution (Team_022): Malcolm Allen OUT (stamina: 72) → DeMar Harden IN (comeback_detected)

[12:00] Substitution (Team_044): Zach McGrady OUT (stamina: 74) → Kyrie Poole IN (comeback_detected)

[12:00] Team_022 possession (Score: 61-78)
Lamelo Dosunmu attempts a Layup. Contested by Ayo McCollum (5.3 feet, ZONE). LAMELO DOSUNMU MAKES IT!
Score: 63-78

[11:45] Team_044 possession (Score: 63-78)
Ayo McCollum makes the Dunk and draws the foul on Dirk Markkanen! And-1! Ayo McCollum to the line for 1. [Team fouls: 1] (Dirk Markkanen: 1 personal fouls)   FT 1/1: GOOD Ayo McCollum makes 1/1 from the line.
Score: 63-81

[11:33] Team_022 possession (Score: 63-81)
Lamelo Dosunmu attempts a 3Pt. Contested by Karl Fox (4.5 feet, MAN). Lamelo Dosunmu misses. Rebound secured by Ayo McCollum.

[11:16] Team_044 possession (Score: 63-81)
FOUL! Shooting foul on Dirk Markkanen. Karl Fox to the line for 2 free throws. [Team fouls: 2] (Dirk Markkanen: 2 personal fouls)   FT 1/2: MISS   FT 2/2: MISS Karl Fox makes 0/2 from the line. Rebound secured by Michael Ginobili.

[11:00] Team_022 possession (Score: 63-81)
Dirk Markkanen attempts a Layup. Contested by Ayo McCollum (5.4 feet, MAN). Dirk Markkanen misses. Rebound secured by Karl Fox.

[10:46] Team_044 possession (Score: 63-81)
FOUL! Shooting foul on Dirk Markkanen. Ayo McCollum to the line for 2 free throws. [Team fouls: 3] (Dirk Markkanen: 3 personal fouls)   FT 1/2: GOOD   FT 2/2: MISS Ayo McCollum makes 1/2 from the line. Rebound secured by Michael Ginobili.
Score: 63-82

[10:32] Team_022 possession (Score: 63-82)
FOUL! Reach-in foul on Victor Westbrook during the drive. [Team fouls: 1] No free throws, side out. (Victor Westbrook: 1 personal fouls)

[10:20] Team_022 possession (Score: 63-82)
Michael Ginobili attempts a 3Pt. Contested by Isaiah Murray (5.0 feet, MAN). Michael Ginobili misses. Rebound secured by Victor Westbrook.

[10:05] Team_044 possession (Score: 63-82)
Ayo McCollum loses the ball! Stripped by Dirk Markkanen! TURNOVER! (live ball)

[09:51] Team_022 possession (Score: 63-82)
DeMar Harden drives to the basket... DeMar Harden throws a bad pass! Stolen by Kyrie Poole! TURNOVER! (live ball)

[09:41] Team_044 possession (Score: 63-82)
Karl Fox attempts a Layup. Contested by Lamelo Dosunmu (5.3 feet, MAN). Karl Fox misses. Rebound secured by Michael Ginobili.

[09:25] Team_022 possession (Score: 63-82)
FOUL! Shooting foul on Karl Fox. Michael Ginobili to the line for 2 free throws. [Team fouls: 2] (Karl Fox: 1 personal fouls)   FT 1/2: GOOD   FT 2/2: GOOD Michael Ginobili makes 2/2 from the line.
Score: 65-82

[09:13] Team_044 possession (Score: 65-82)
Karl Fox attempts a Midrange. Contested by Myles Anthony (5.0 feet, ZONE). Karl Fox misses. Rebound secured by Michael Ginobili.

[09:00] Team_022 possession (Score: 65-82)
Michael Ginobili attempts a 3Pt. Contested by Isaiah Murray (5.2 feet, MAN). Michael Ginobili misses. Rebound secured by Karl Fox.

[08:45] Team_044 possession (Score: 65-82)
Karl Fox attempts a Midrange. Contested by Lamelo Dosunmu (5.4 feet, MAN). Karl Fox misses. Rebound secured by Dirk Markkanen.

[08:30] Team_022 possession (Score: 65-82)
Myles Anthony attempts a Midrange. Contested by Victor Westbrook (6.0 feet, ZONE). MYLES ANTHONY MAKES IT!
Score: 67-82

[08:17] Team_044 possession (Score: 67-82)
Kyrie Poole attempts a Midrange. Contested by DeMar Harden (5.3 feet, MAN). Kyrie Poole misses. Rebound secured by DeMar Harden.

[08:02] Team_022 possession (Score: 67-82)
Lamelo Dosunmu attempts a 3Pt. Contested by Kyrie Poole (4.9 feet, ZONE). Lamelo Dosunmu misses. Rebound secured by Victor Westbrook.

[07:49] Team_044 possession (Score: 67-82)
Isaiah Murray attempts a 3Pt. Contested by Michael Ginobili (4.5 feet, ZONE). ISAIAH MURRAY MAKES IT! Assist: Kyrie Poole
Score: 67-85

[07:40] Team_022 possession (Score: 67-85)
Dirk Markkanen drives, Karl Fox stays with him. Dirk Markkanen attempts a Dunk. Contested by Karl Fox (5.0 feet, ZONE). DIRK MARKKANEN MAKES IT! Assist: Michael Ginobili
Score: 69-85

[07:27] Team_044 possession (Score: 69-85)
FOUL! Reach-in foul on Dirk Markkanen during the drive. [Team fouls: 4] No free throws, side out. (Dirk Markkanen: 4 personal fouls)

[07:11] Team_044 possession (Score: 69-85)
Ayo McCollum drives, Dirk Markkanen stays with him. Ayo McCollum attempts a Dunk. Contested by Dirk Markkanen (5.3 feet, MAN). AYO MCCOLLUM MAKES IT! Assist: Karl Fox
Score: 69-87

[06:55] Team_022 possession (Score: 69-87)
FOUL! Holding foul on Kyrie Poole. [Team fouls: 3] No free throws, side out. (Kyrie Poole: 1 personal fouls)

[06:38] Team_022 possession (Score: 69-87)
DeMar Harden attempts a Midrange. Wide open! Victor Westbrook is 6.2 feet away. [ZONE] DeMar Harden misses. Rebound secured by Karl Fox.

[06:24] Team_044 possession (Score: 69-87)
Kyrie Poole drives, Dirk Markkanen stays with him. Kyrie Poole attempts a Layup. Contested by Dirk Markkanen (5.5 feet, ZONE). KYRIE POOLE MAKES IT!
Score: 69-89

[06:08] Team_022 possession (Score: 69-89)
Michael Ginobili drives and kicks out. Lamelo Dosunmu attempts a 3Pt. Contested by Kyrie Poole (4.6 feet, ZONE). Lamelo Dosunmu misses. Rebound secured by Ayo McCollum.

[05:57] Team_044 possession (Score: 69-89)
Karl Fox makes the Layup and draws the foul on Dirk Markkanen! And-1! Karl Fox to the line for 1. [BONUS: 5 team fouls] (Dirk Markkanen: 5 personal fouls)   FT 1/1: GOOD Karl Fox makes 1/1 from the line.
Score: 69-92

[05:39] Team_022 possession (Score: 69-92)
Myles Anthony makes the Dunk and draws the foul on Isaiah Murray! And-1! Myles Anthony to the line for 1. [Team fouls: 4] (Isaiah Murray: 1 personal fouls)   FT 1/1: GOOD Myles Anthony makes 1/1 from the line.
Score: 72-92

[05:29] Team_044 possession (Score: 72-92)
Karl Fox attempts a Midrange. Contested by Lamelo Dosunmu (5.8 feet, MAN). Karl Fox misses. Rebound secured by Michael Ginobili.

[05:16] Team_022 possession (Score: 72-92)
Myles Anthony attempts a Layup. BLOCKED BY KARL FOX! Ball is loose! Rebound secured by Ayo McCollum.

[05:04] Team_044 possession (Score: 72-92)
Kyrie Poole attempts a Midrange. Contested by DeMar Harden (5.5 feet, MAN). Kyrie Poole misses. Rebound secured by DeMar Harden.

[04:50] Team_022 possession (Score: 72-92)
Myles Anthony attempts a 3Pt. Wide open! Victor Westbrook is 6.5 feet away. [MAN] Myles Anthony misses. Rebound secured by Victor Westbrook.

[04:36] Team_044 possession (Score: 72-92)
Kyrie Poole attempts a Layup. Contested by Dirk Markkanen (5.8 feet, ZONE). KYRIE POOLE MAKES IT! Assist: Karl Fox
Score: 72-94

[04:24] Team_022 possession (Score: 72-94)
Dirk Markkanen attempts a Layup. Contested by Karl Fox (5.4 feet, ZONE). DIRK MARKKANEN MAKES IT! Assist: Lamelo Dosunmu
Score: 74-94

[04:15] Team_044 possession (Score: 74-94)
Ayo McCollum attempts a Midrange. Contested by Myles Anthony (5.5 feet, ZONE). Ayo McCollum misses. Rebound secured by Michael Ginobili.

[04:03] Team_022 possession (Score: 74-94)
Lamelo Dosunmu attempts a Midrange. Wide open! Isaiah Murray is 6.0 feet away. [ZONE] Lamelo Dosunmu misses. Rebound secured by Ayo McCollum.

[03:48] Team_044 possession (Score: 74-94)
Kyrie Poole attempts a 3Pt. Contested by Michael Ginobili (4.9 feet, ZONE). KYRIE POOLE MAKES IT! Assist: Isaiah Murray
Score: 74-97

[03:29] Team_022 possession (Score: 74-97)
Myles Anthony attempts a Layup. Wide open! Victor Westbrook is 6.7 feet away. [MAN] Myles Anthony misses. Rebound secured by Karl Fox.

[03:18] Team_044 possession (Score: 74-97)
Karl Fox attempts a 3Pt. Wide open! Lamelo Dosunmu is 6.2 feet away. [MAN] Karl Fox misses. Rebound secured by Dirk Markkanen.

[03:07] Team_022 possession (Score: 74-97)
FOUL! Reach-in foul on Victor Westbrook during the drive. [IN THE BONUS! 5 team fouls] Myles Anthony to the line for 2 free throws. (Victor Westbrook: 2 personal fouls)   FT 1/2: GOOD   FT 2/2: GOOD Myles Anthony makes 2/2 from the line.
Score: 76-97

[02:49] Team_044 possession (Score: 76-97)
Victor Westbrook attempts a 3Pt. Contested by Myles Anthony (5.8 feet, MAN). Victor Westbrook misses. Offensive rebound by Victor Westbrook! Victor Westbrook kicks it out.

[02:36] Team_044 possession (Score: 76-97)
Ayo McCollum makes the Layup and draws the foul on Dirk Markkanen! And-1! Ayo McCollum to the line for 1. [BONUS: 6 team fouls] (Dirk Markkanen: 6 personal fouls) Dirk Markkanen FOULS OUT!   FT 1/1: GOOD Ayo McCollum makes 1/1 from the line.
Score: 76-100

[02:36] Substitution (Team_022): Dirk Markkanen OUT (stamina: 40) → Lauri Gobert IN (foul_out)

[02:19] Team_022 possession (Score: 76-100)
Lauri Gobert drives to the basket... Lauri Gobert loses control! Ball rolls out of bounds! TURNOVER! (dead ball)

[02:19] Substitution (Team_022): Michael Ginobili OUT → Malcolm Allen IN (stamina_rule2)

[02:19] Substitution (Team_022): Myles Anthony OUT → Dejounte Towns IN (stamina_rule2)

[02:19] Substitution (Team_022): Lamelo Dosunmu OUT → Kawhi Russell IN (stamina_rule2)

[02:19] Substitution (Team_044): Isaiah Murray OUT → Tim Towns IN (stamina_rule2)

[02:19] Substitution (Team_044): Victor Westbrook OUT → Tim Siakam IN (stamina_rule2)

[02:19] Substitution (Team_044): Karl Fox OUT → Pau Quickley IN (stamina_rule2)

[02:19] Substitution (Team_044): Ayo McCollum OUT → Victor Anthony IN (stamina_rule2)

[02:04] Team_044 possession (Score: 76-100)
FOUL! Shooting foul on Malcolm Allen. Kyrie Poole to the line for 3 free throws. [BONUS: 7 team fouls] (Malcolm Allen: 1 personal fouls)   FT 1/3: GOOD   FT 2/3: GOOD   FT 3/3: GOOD Kyrie Poole makes 3/3 from the line.
Score: 76-103

[01:47] Team_022 possession (Score: 76-103)
Lauri Gobert attempts a 3Pt. Contested by Tim Towns (5.3 feet, ZONE). LAURI GOBERT MAKES IT! Assist: Malcolm Allen
Score: 79-103

[01:34] Team_044 possession (Score: 79-103)
Tim Towns drives, picks up Lauri Gobert. Help arrives from Malcolm Allen! Tim Towns attempts a Layup. Contested by Malcolm Allen (4.7 feet, MAN). Tim Towns misses. Rebound secured by Malcolm Allen.

[01:17] Team_022 possession (Score: 79-103)
Lauri Gobert drives, picks up Tim Towns. Help arrives from Tim Siakam! Lauri Gobert attempts a Layup. Contested by Tim Siakam (5.3 feet, MAN). LAURI GOBERT MAKES IT! Assist: Malcolm Allen
Score: 81-103

[01:01] Team_044 possession (Score: 81-103)
Kyrie Poole drives to the basket... Kyrie Poole commits a violation (traveling/carry)! TURNOVER! (dead ball)

[00:50] Team_022 possession (Score: 81-103)
Lauri Gobert attempts a Midrange. Contested by Tim Towns (5.3 feet, MAN). Lauri Gobert misses. FOUL! Loose ball foul on Tim Siakam during the rebound battle. [IN THE BONUS! 6 team fouls] Dejounte Towns to the line for 2 free throws. (Tim Siakam: 1 personal fouls)   FT 1/2: GOOD   FT 2/2: GOOD Dejounte Towns makes 2/2 from the line.
Score: 83-103

[00:37] Team_044 possession (Score: 83-103)
Pau Quickley drives and kicks out. Victor Anthony attempts a 3Pt. Contested by Kawhi Russell (4.0 feet, MAN). Victor Anthony misses. Rebound secured by Malcolm Allen.

[00:26] Team_022 possession (Score: 83-103)
Lauri Gobert makes the 3Pt and draws the foul on Tim Towns! And-1! Lauri Gobert to the line for 1. [BONUS: 7 team fouls] (Tim Towns: 1 personal fouls)   FT 1/1: GOOD Lauri Gobert makes 1/1 from the line.
Score: 87-103

[00:06] Team_044 possession (Score: 87-103)
Victor Anthony attempts a 3Pt. Contested by Lauri Gobert (5.1 feet, ZONE). Victor Anthony misses. Rebound secured by Malcolm Allen.

================================================================================
                              4TH QUARTER COMPLETE                              
================================================================================

4TH QUARTER SCORE: Team_022 26, Team_044 25

BOX SCORE:
================================================================================

Team_022
--------------------------------------------------------------------------------
Player                MIN  PTS  REB  AST  TO      FG   FG%      3P   3P%
--------------------------------------------------------------------------------
Lauri Gobert            9    9    0    0   0   3/3   100.0     0/0   0.0
Myles Anthony          40    7    0    0   0   3/6    50.0     0/0   0.0
Dirk Markkanen         40    4    2    0   0   2/3    66.7     0/0   0.0
Lamelo Dosunmu         40    2    0    1   0   1/4    25.0     0/0   0.0
Michael Ginobili       40    2    6    1   0   1/4    25.0     0/0   0.0
Dejounte Towns          8    2    0    0   0   1/1   100.0     0/0   0.0
DeMar Harden           18    0    2    0   0   0/1     0.0     0/0   0.0
Malcolm Allen          32    0    3    2   0   0/0     0.0     0/0   0.0

TEAM: FG: 11/22 (50.0%), 3PT: 2/7 (28.6%), REB: 13 (0 off, 13 def), AST: 4, TO: 2
TEAM FOULS: 7 [Team_044 in BONUS]


Team_044
--------------------------------------------------------------------------------
Player                MIN  PTS  REB  AST  TO      FG   FG%      3P   3P%
--------------------------------------------------------------------------------
Kyrie Poole            18   10    0    1   0   4/6    66.7     0/0   0.0
Ayo McCollum           40    8    4    0   0   3/5    60.0     0/0   0.0
Karl Fox               40    3    4    2   0   1/7    14.3     0/0   0.0
Isaiah Murray          40    3    0    1   0   1/1   100.0     0/0   0.0
Victor Westbrook       40    0    4    0   0   0/0     0.0     0/0   0.0
Tim Towns               8    0    0    0   0   0/1     0.0     0/0   0.0
Pau Quickley            8    0    0    0   0   0/1     0.0     0/0   0.0
Victor Anthony          8    0    0    0   0   0/1     0.0     0/0   0.0

TEAM: FG: 9/22 (40.9%), 3PT: 3/5 (60.0%), REB: 12 (1 off, 11 def), AST: 4, TO: 2
TEAM FOULS: 7 [Team_022 in BONUS]

================================================================================

================================================================================
                               FULL GAME COMPLETE                               
================================================================================

FINAL SCORE: Team_022 87, Team_044 103

SCORING BY QUARTER:
--------------------------------------------------------------------------------
Team                     Q1     Q2     Q3     Q4    FINAL
--------------------------------------------------------------------------------
Team_022                 19     18     24     26       87
Team_044                 32     23     23     25      103
--------------------------------------------------------------------------------

FULL GAME BOX SCORE:
================================================================================

Team_022
--------------------------------------------------------------------------------
Player                MIN  PTS  REB  AST  TO      FG   FG%      3P   3P%      FT STL BLK
--------------------------------------------------------------------------------
Michael Ginobili       40   14   19    3   1   7/18   38.9   2/7    28.6   4/4     0   1
Myles Anthony          40   13    6    0   1   8/15   53.3   3/7    42.9   4/4     0   0
Lamelo Dosunmu         40    5    0    1   2   3/13   23.1   1/7    14.3   1/1     1   0
Dirk Markkanen         40   34   17    3   0   8/15   53.3   1/1   100.0   3/3     1   1
Malcolm Allen          32    0    3    4   2   2/6    33.3   1/5    20.0   2/3     0   0
DeMar Harden           18    2    2    0   1   1/3    33.3   1/2    50.0   2/3     0   0
Lauri Gobert            9   11    1    0   0   5/5   100.0   2/2   100.0   1/1     0   0
Dejounte Towns          8    2    6    1   3   0/2     0.0   0/2     0.0   3/4     0   0
Kawhi Russell           8    0    0    0   0   0/1     0.0   0/1     0.0   0/0     0   0
Cole Iverson            6    2    0    0   0   1/2    50.0   0/0     0.0   1/2     0   0

TEAM: FG: 36/81 (44.4%), 3PT: 11/34 (32.4%), REB: 54 (16 off, 38 def), AST: 12, TO: 10


Team_044
--------------------------------------------------------------------------------
Player                MIN  PTS  REB  AST  TO      FG   FG%      3P   3P%      FT STL BLK
--------------------------------------------------------------------------------
Isaiah Murray          40    5    0    7   3   2/11   18.2   1/7    14.3   0/0     0   0
Victor Westbrook       40   17   14    3   0   6/8    75.0   2/3    66.7   3/3     0   0
Karl Fox               40   19   15    7   1  11/21   52.4   3/5    60.0   3/5     0   1
Ayo McCollum           40   26   19    2   1   9/13   69.2   0/0     0.0   5/6     1   0
Zach McGrady           30   15    0    1   0   7/11   63.6   1/5    20.0   2/2     0   1
Kyrie Poole            18   12    0    1   1   5/9    55.6   2/2   100.0   3/3     1   0
Tim Towns               8    3    0    0   0   1/4    25.0   1/2    50.0   0/0     0   0
Tim Siakam              8    5    4    1   1   2/2   100.0   1/1   100.0   2/2     1   0
Pau Quickley            8    0    2    0   0   0/1     0.0   0/0     0.0   0/0     1   0
Victor Anthony          8    0    2    1   1   0/2     0.0   0/2     0.0   0/0     0   0

TEAM: FG: 43/82 (52.4%), 3PT: 11/27 (40.7%), REB: 56 (12 off, 44 def), AST: 23, TO: 8

================================================================================
