================================================================================
                        FULL GAME - Team_010 vs Team_025                        
================================================================================

================================================================================
                       1ST QUARTER - Team_010 vs Team_025                       
================================================================================

[12:00] Team_010 possession (Score: 0-0)
Michael Turner attempts a 3Pt. Contested by Ben Giddey (3.9 feet, MAN). Michael Turner misses. Offensive rebound by Cade Morant! Cade Morant kicks it out.

[11:48] Team_010 possession (Score: 0-0)
RJ Young attempts a Layup. BLOCKED BY BEN GIDDEY! Ball is loose! Rebound secured by Allen Embiid.

[11:29] Team_025 possession (Score: 0-0)
Ben Giddey attempts a 3Pt. Contested by Michael Turner (4.5 feet, MAN). Ben Giddey misses. Offensive rebound by Allen Embiid! Allen Embiid puts it back in!
Score: 0-2

[11:14] Team_010 possession (Score: 0-2)
Anthony Durant attempts a Layup. BLOCKED BY ALLEN EMBIID! Ball is loose! Rebound secured by Allen Embiid.

[10:59] Team_025 possession (Score: 0-2)
Cade Anthony attempts a 3Pt. Contested by Michael Turner (4.7 feet, ZONE). Cade Anthony misses. Rebound secured by Cade Morant.

[10:45] Team_010 possession (Score: 0-2)
RJ Young attempts a 3Pt. Contested by Ben Giddey (3.4 feet, ZONE). RJ YOUNG MAKES IT! Assist: Cade Morant
Score: 3-2

[10:29] Team_025 possession (Score: 3-2)
Desmond Jordan attempts a Layup. Contested by Anthony Durant (3.7 feet, ZONE). DESMOND JORDAN MAKES IT! Assist: Allen Embiid
Score: 3-4

[10:13] Team_010 possession (Score: 3-4)
FOUL! Holding foul on Desmond Jordan. [Team fouls: 1] No free throws, side out. (Desmond Jordan: 1 personal fouls)

[10:01] Team_010 possession (Score: 3-4)
FOUL! Shooting foul on Allen Embiid. Michael Turner to the line for 2 free throws. [Team fouls: 2] (Allen Embiid: 1 personal fouls)   FT 1/2: GOOD   FT 2/2: GOOD Michael Turner makes 2/2 from the line.
Score: 5-4

[09:49] Team_025 possession (Score: 5-4)
Ben Giddey attempts a Midrange. Contested by Michael Turner (4.5 feet, MAN). Ben Giddey misses. Rebound secured by Desmond Antetokounmpo.

[09:36] Team_010 possession (Score: 5-4)
Cade Morant attempts a 3Pt. Contested by Ben Giddey (4.1 feet, ZONE). Cade Morant misses. Rebound secured by Allen Embiid.

[09:27] Team_025 possession (Score: 5-4)
FOUL! Offensive foul on Paolo Lowry! Cade Morant drew the charge! [Team fouls: 3] (Paolo Lowry: 1 personal fouls) TURNOVER! (dead ball)

[09:10] Team_010 possession (Score: 5-4)
RJ Young throws a bad pass! Stolen by Desmond Jordan! TURNOVER! (live ball)

[08:54] Team_025 possession (Score: 5-4)
Paolo Lowry attempts a 3Pt. Contested by Cade Morant (4.3 feet, MAN). Paolo Lowry misses. Rebound secured by Anthony Durant.

[08:36] Team_010 possession (Score: 5-4)
Michael Turner attempts a 3Pt. Contested by Ben Giddey (3.9 feet, ZONE). Michael Turner misses. Offensive rebound by Cade Morant! Cade Morant kicks it out.

[08:23] Team_010 possession (Score: 5-4)
RJ Young attempts a 3Pt. Contested by Desmond Jordan (3.2 feet, MAN). RJ Young misses. Offensive rebound by Anthony Durant! Anthony Durant kicks it out.

[08:09] Team_010 possession (Score: 5-4)
Cade Morant makes the Dunk and draws the foul on Paolo Lowry! And-1! Cade Morant to the line for 1. [Team fouls: 4] (Paolo Lowry: 2 personal fouls)   FT 1/1: GOOD Cade Morant makes 1/1 from the line.
Score: 8-4

[07:52] Team_025 possession (Score: 8-4)
Paolo Lowry attempts a 3Pt. Contested by Cade Morant (4.3 feet, ZONE). Paolo Lowry misses. Rebound secured by Desmond Antetokounmpo.

[07:40] Team_010 possession (Score: 8-4)
Anthony Durant attempts a 3Pt. Contested by Allen Embiid (3.2 feet, MAN). Anthony Durant misses. Rebound secured by Allen Embiid.

[07:28] Team_025 possession (Score: 8-4)
Cade Anthony attempts a 3Pt. Contested by Desmond Antetokounmpo (5.0 feet, MAN). Cade Anthony misses. Rebound secured by Anthony Durant.

[07:09] Team_010 possession (Score: 8-4)
Cade Morant makes the Dunk and draws the foul on Ben Giddey! And-1! Cade Morant to the line for 1. [BONUS: 5 team fouls] (Ben Giddey: 1 personal fouls)   FT 1/1: MISS Cade Morant makes 0/1 from the line. Offensive rebound by Cade Morant! Cade Morant kicks it out.
Score: 10-4

[06:54] Team_010 possession (Score: 10-4)
Michael Turner attempts a 3Pt. Contested by Ben Giddey (3.9 feet, MAN). Michael Turner misses. Rebound secured by Allen Embiid.

[06:41] Team_025 possession (Score: 10-4)
Paolo Lowry drives and kicks out. Cade Anthony attempts a 3Pt. Contested by Cade Morant (3.9 feet, ZONE). Cade Anthony misses. Rebound secured by Anthony Durant.

[06:28] Team_010 possession (Score: 10-4)
Michael Turner makes the Layup and draws the foul on Allen Embiid! And-1! Michael Turner to the line for 1. [BONUS: 6 team fouls] (Allen Embiid: 2 personal fouls)   FT 1/1: GOOD Michael Turner makes 1/1 from the line.
Score: 13-4

[06:11] Team_025 possession (Score: 13-4)
Ben Giddey drives, picks up Michael Turner. Help arrives from Cade Morant! Ben Giddey attempts a Dunk. Contested by Cade Morant (4.5 feet, MAN). BEN GIDDEY MAKES IT! Assist: Paolo Lowry
Score: 13-6

[05:55] Team_010 possession (Score: 13-6)
RJ Young drives, picks up Allen Embiid. Help arrives from Ben Giddey! RJ Young attempts a Dunk. Contested by Ben Giddey (2.7 feet, ZONE). RJ YOUNG MAKES IT! Assist: Desmond Antetokounmpo
Score: 15-6

[05:40] Team_025 possession (Score: 15-6)
Cade Anthony attempts a Layup. Contested by Anthony Durant (4.2 feet, ZONE). CADE ANTHONY MAKES IT! Assist: Desmond Jordan
Score: 15-8

[05:30] Team_010 possession (Score: 15-8)
RJ Young attempts a 3Pt. BLOCKED BY DESMOND JORDAN! Ball deflects out of bounds off RJ Young.

[05:18] Team_025 possession (Score: 15-8)
Desmond Jordan attempts a Midrange. Contested by Anthony Durant (3.7 feet, ZONE). Desmond Jordan misses. Offensive rebound by Desmond Jordan! Desmond Jordan's putback is no good. Offensive rebound by Allen Embiid! Allen Embiid kicks it out.

[05:04] Team_025 possession (Score: 15-8)
Desmond Jordan attempts a 3Pt. Contested by Cade Morant (4.1 feet, ZONE). DESMOND JORDAN MAKES IT! Assist: Ben Giddey
Score: 15-11

[04:49] Team_010 possession (Score: 15-11)
Cade Morant drives and kicks out. Desmond Antetokounmpo attempts a Midrange. Contested by Desmond Jordan (3.4 feet, ZONE). DESMOND ANTETOKOUNMPO MAKES IT! Assist: RJ Young
Score: 17-11

[04:35] Team_025 possession (Score: 17-11)
Allen Embiid drives, picks up Anthony Durant. Help arrives from Cade Morant! Allen Embiid attempts a Dunk. Contested by Cade Morant (3.7 feet, ZONE). ALLEN EMBIID MAKES IT!
Score: 17-13

[04:20] Team_010 possession (Score: 17-13)
FOUL! Reach-in foul on Ben Giddey during the drive. [IN THE BONUS! 7 team fouls] Michael Turner to the line for 2 free throws. (Ben Giddey: 2 personal fouls)   FT 1/2: GOOD   FT 2/2: GOOD Michael Turner makes 2/2 from the line.
Score: 19-13

[04:05] Team_025 possession (Score: 19-13)
Cade Anthony makes the Layup and draws the foul on Cade Morant! And-1! Cade Anthony to the line for 1. [Team fouls: 2] (Cade Morant: 2 personal fouls)   FT 1/1: GOOD Cade Anthony makes 1/1 from the line.
Score: 19-16

[03:52] Team_010 possession (Score: 19-16)
Michael Turner attempts a Midrange. Contested by Ben Giddey (4.0 feet, MAN). Michael Turner misses. Rebound secured by Desmond Jordan.

[03:38] Team_025 possession (Score: 19-16)
Allen Embiid attempts a Layup. Contested by Anthony Durant (3.8 feet, MAN). Allen Embiid misses. Rebound secured by Anthony Durant.

[03:27] Team_010 possession (Score: 19-16)
RJ Young attempts a Midrange. Contested by Ben Giddey (3.6 feet, ZONE). RJ Young misses. Rebound secured by Desmond Jordan.

[03:10] Team_025 possession (Score: 19-16)
Cade Anthony attempts a Layup. Contested by Desmond Antetokounmpo (5.1 feet, MAN). Cade Anthony misses. FOUL! Loose ball foul on Cade Morant during the rebound battle. [Team fouls: 3] No free throws, side out. (Cade Morant: 3 personal fouls)

[02:55] Team_025 possession (Score: 19-16)
Desmond Jordan drives, picks up Anthony Durant. Help arrives from Cade Morant! Desmond Jordan attempts a Layup. Contested by Cade Morant (3.9 feet, ZONE). DESMOND JORDAN MAKES IT!
Score: 19-18

[02:42] Team_010 possession (Score: 19-18)
Cade Morant attempts a 3Pt. Contested by Ben Giddey (4.3 feet, ZONE). CADE MORANT MAKES IT! Assist: RJ Young
Score: 22-18

[02:28] Team_025 possession (Score: 22-18)
Allen Embiid drives, Anthony Durant stays with him. Allen Embiid attempts a Dunk. Contested by Anthony Durant (3.9 feet, ZONE). ALLEN EMBIID MAKES IT! Assist: Paolo Lowry
Score: 22-20

[02:09] Team_010 possession (Score: 22-20)
Cade Morant drives and kicks out. Cade Morant attempts a 3Pt. Contested by Paolo Lowry (5.2 feet, MAN). CADE MORANT MAKES IT!
Score: 25-20

[01:54] Team_025 possession (Score: 25-20)
Desmond Jordan makes the Layup and draws the foul on RJ Young! And-1! Desmond Jordan to the line for 1. [Team fouls: 4] (RJ Young: 1 personal fouls)   FT 1/1: GOOD Desmond Jordan makes 1/1 from the line.
Score: 25-23

[01:40] Team_010 possession (Score: 25-23)
Anthony Durant attempts a Layup. Contested by Allen Embiid (3.6 feet, ZONE). Anthony Durant misses. Offensive rebound by Anthony Durant! Anthony Durant kicks it out.

[01:27] Team_010 possession (Score: 25-23)
Desmond Antetokounmpo attempts a 3Pt. Contested by Cade Anthony (4.7 feet, MAN). Desmond Antetokounmpo misses. Offensive rebound by Anthony Durant! Anthony Durant kicks it out.

[01:17] Team_010 possession (Score: 25-23)
Michael Turner loses the ball! Stripped by Ben Giddey! TURNOVER! (live ball)

[00:57] Team_025 possession (Score: 25-23)
Allen Embiid drives and kicks out. Ben Giddey attempts a 3Pt. Contested by Cade Morant (4.4 feet, ZONE). BEN GIDDEY MAKES IT! Assist: Desmond Jordan
Score: 25-26

[00:44] Team_010 possession (Score: 25-26)
Desmond Antetokounmpo drives, Allen Embiid stays with him. Desmond Antetokounmpo attempts a Dunk. Contested by Allen Embiid (3.6 feet, ZONE). Desmond Antetokounmpo misses. Rebound secured by Allen Embiid.

[00:28] Team_025 possession (Score: 25-26)
Allen Embiid makes the Layup and draws the foul on Anthony Durant! And-1! Allen Embiid to the line for 1. [BONUS: 5 team fouls] (Anthony Durant: 1 personal fouls)   FT 1/1: GOOD Allen Embiid makes 1/1 from the line.
Score: 25-29

[00:15] Team_010 possession (Score: 25-29)
Desmond Antetokounmpo attempts a Midrange. Contested by Desmond Jordan (4.0 feet, ZONE). Desmond Antetokounmpo misses. Rebound secured by Desmond Jordan.

[00:01] Team_025 possession (Score: 25-29)
FOUL! Reach-in foul on Cade Morant during the drive. [IN THE BONUS! 6 team fouls] Paolo Lowry to the line for 2 free throws. (Cade Morant: 4 personal fouls)   FT 1/2: GOOD   FT 2/2: GOOD Paolo Lowry makes 2/2 from the line.
Score: 25-31

================================================================================
                              1ST QUARTER COMPLETE                              
================================================================================

1ST QUARTER SCORE: Team_010 25, Team_025 31

BOX SCORE:
================================================================================

Team_010
--------------------------------------------------------------------------------
Player                MIN  PTS  REB  AST  TO      FG   FG%      3P   3P%
--------------------------------------------------------------------------------
Cade Morant            12    9    4    1   0   3/4    75.0     0/0   0.0
Michael Turner         12    7    0    0   0   3/5    60.0     0/0   0.0
RJ Young               12    5    0    2   0   2/5    40.0     0/0   0.0
Desmond Antetokounmpo   12    2    2    1   0   1/3    33.3     0/0   0.0
Anthony Durant         12    0    7    0   0   0/2     0.0     0/0   0.0

TEAM: FG: 9/19 (47.4%), 3PT: 2/6 (33.3%), REB: 13 (6 off, 7 def), AST: 4, TO: 2
TEAM FOULS: 6 [Team_025 in BONUS]


Team_025
--------------------------------------------------------------------------------
Player                MIN  PTS  REB  AST  TO      FG   FG%      3P   3P%
--------------------------------------------------------------------------------
Desmond Jordan         12   10    3    2   0   4/4   100.0     0/0   0.0
Allen Embiid           12    9    9    1   0   4/5    80.0     0/0   0.0
Cade Anthony           12    5    0    0   0   2/4    50.0     0/0   0.0
Ben Giddey             12    5    0    1   0   2/3    66.7     0/0   0.0
Paolo Lowry            12    2    0    2   0   1/4    25.0     0/0   0.0

TEAM: FG: 13/20 (65.0%), 3PT: 2/6 (33.3%), REB: 12 (3 off, 9 def), AST: 6, TO: 1
TEAM FOULS: 7 [Team_010 in BONUS]

================================================================================

================================================================================
                       2ND QUARTER - Team_010 vs Team_025                       
================================================================================

[12:00] Team_010 possession (Score: 25-31)
Michael Turner drives, picks up Allen Embiid. Help arrives from Ben Giddey! Michael Turner attempts a Dunk. Contested by Ben Giddey (3.6 feet, ZONE). MICHAEL TURNER MAKES IT! Assist: Anthony Durant
Score: 27-31

[11:47] Team_025 possession (Score: 27-31)
Cade Anthony drives, Anthony Durant stays with him. Cade Anthony attempts a Layup. Contested by Anthony Durant (4.6 feet, ZONE). Cade Anthony misses. Rebound secured by Anthony Durant.

[11:33] Team_010 possession (Score: 27-31)
Anthony Durant attempts a Layup. Contested by Allen Embiid (3.7 feet, MAN). Anthony Durant misses. Rebound secured by Allen Embiid.

[11:18] Team_025 possession (Score: 27-31)
Ben Giddey attempts a 3Pt. Contested by Michael Turner (4.8 feet, ZONE). Ben Giddey misses. Rebound secured by Anthony Durant.

[11:06] Team_010 possession (Score: 27-31)
Anthony Durant drives, Allen Embiid stays with him. Anthony Durant attempts a Layup. Contested by Allen Embiid (3.8 feet, MAN). Anthony Durant misses. Offensive rebound by Anthony Durant! Anthony Durant kicks it out.

[10:51] Team_010 possession (Score: 27-31)
Desmond Antetokounmpo drives, picks up Allen Embiid. Help arrives from Ben Giddey! Desmond Antetokounmpo attempts a Dunk. Contested by Ben Giddey (3.6 feet, ZONE). Desmond Antetokounmpo misses. Offensive rebound by Cade Morant! Cade Morant kicks it out.

[10:40] Team_010 possession (Score: 27-31)
Anthony Durant drives, Allen Embiid stays with him. Anthony Durant attempts a Dunk. Contested by Allen Embiid (3.8 feet, MAN). ANTHONY DURANT MAKES IT! Assist: RJ Young
Score: 29-31

[10:26] Team_025 possession (Score: 29-31)
FOUL! Shooting foul on Anthony Durant. Allen Embiid to the line for 3 free throws. [Team fouls: 1] (Anthony Durant: 1 personal fouls)   FT 1/3: GOOD   FT 2/3: GOOD   FT 3/3: GOOD Allen Embiid makes 3/3 from the line.
Score: 29-34

[10:14] Team_010 possession (Score: 29-34)
Cade Morant attempts a Layup. Contested by Paolo Lowry (5.8 feet, MAN). CADE MORANT MAKES IT! Assist: Anthony Durant
Score: 31-34

[09:57] Team_025 possession (Score: 31-34)
Desmond Jordan attempts a Midrange. Contested by RJ Young (5.4 feet, MAN). Desmond Jordan misses. Rebound secured by Cade Morant.

[09:45] Team_010 possession (Score: 31-34)
Desmond Antetokounmpo makes the Midrange and draws the foul on Desmond Jordan! And-1! Desmond Antetokounmpo to the line for 1. [Team fouls: 1] (Desmond Jordan: 1 personal fouls)   FT 1/1: GOOD Desmond Antetokounmpo makes 1/1 from the line.
Score: 34-34

[09:28] Team_025 possession (Score: 34-34)
FOUL! Holding foul on RJ Young. [Team fouls: 2] No free throws, side out. (RJ Young: 1 personal fouls)

[09:16] Team_025 possession (Score: 34-34)
Allen Embiid attempts a 3Pt. Contested by Anthony Durant (4.4 feet, MAN). Allen Embiid misses. Rebound secured by Michael Turner.

[09:00] Team_010 possession (Score: 34-34)
Cade Morant drives and kicks out. Michael Turner attempts a 3Pt. Contested by Ben Giddey (4.4 feet, MAN). Michael Turner misses. Rebound secured by Cade Anthony.

[08:45] Team_025 possession (Score: 34-34)
Allen Embiid attempts a Midrange. Contested by Anthony Durant (4.4 feet, MAN). Allen Embiid misses. Rebound secured by Anthony Durant.

[08:34] Team_010 possession (Score: 34-34)
Cade Morant drives and kicks out. FOUL! Shooting foul on Cade Anthony. Cade Morant to the line for 3 free throws. [Team fouls: 2] (Cade Anthony: 1 personal fouls)   FT 1/3: GOOD   FT 2/3: MISS   FT 3/3: GOOD Cade Morant makes 2/3 from the line.
Score: 36-34

[08:19] Team_025 possession (Score: 36-34)
Allen Embiid attempts a Layup. Contested by Anthony Durant (4.5 feet, ZONE). ALLEN EMBIID MAKES IT! Assist: Desmond Jordan
Score: 36-36

[08:02] Team_010 possession (Score: 36-36)
Desmond Antetokounmpo drives, Cade Anthony stays with him. Desmond Antetokounmpo attempts a Dunk. Contested by Cade Anthony (5.0 feet, MAN). DESMOND ANTETOKOUNMPO MAKES IT! Assist: Cade Morant
Score: 38-36

[07:45] Team_025 possession (Score: 38-36)
Desmond Jordan attempts a 3Pt. Contested by RJ Young (5.6 feet, MAN). Desmond Jordan misses. Rebound secured by Cade Morant.

[07:35] Team_010 possession (Score: 38-36)
Cade Morant attempts a 3Pt. Contested by Cade Anthony (5.4 feet, ZONE). Cade Morant misses. Rebound secured by Allen Embiid.

[07:21] Team_025 possession (Score: 38-36)
Desmond Jordan attempts a Midrange. Contested by Desmond Antetokounmpo (5.3 feet, ZONE). DESMOND JORDAN MAKES IT!
Score: 38-38

[07:04] Team_010 possession (Score: 38-38)
Michael Turner attempts a 3Pt. Contested by Cade Anthony (5.2 feet, ZONE). Michael Turner misses. Rebound secured by Desmond Jordan.

[06:45] Team_025 possession (Score: 38-38)
Paolo Lowry attempts a Layup. Contested by Anthony Durant (5.0 feet, ZONE). PAOLO LOWRY MAKES IT! Assist: Desmond Jordan
Score: 38-40

[06:26] Team_010 possession (Score: 38-40)
Michael Turner attempts a Layup. Contested by Ben Giddey (4.9 feet, MAN). MICHAEL TURNER MAKES IT!
Score: 40-40

[06:16] Team_025 possession (Score: 40-40)
Paolo Lowry throws a bad pass! Stolen by Cade Morant! TURNOVER! (live ball)

[06:02] Team_010 possession (Score: 40-40)
Anthony Durant drives to the basket... Anthony Durant loses the ball! Stripped by Allen Embiid! TURNOVER! (live ball)

[05:47] Team_025 possession (Score: 40-40)
Ben Giddey attempts a 3Pt. Contested by Michael Turner (5.5 feet, MAN). Ben Giddey misses. Rebound secured by Anthony Durant.

[05:28] Team_010 possession (Score: 40-40)
Cade Morant attempts a 3Pt. Contested by Cade Anthony (5.6 feet, ZONE). Cade Morant misses. Rebound secured by Cade Anthony.

[05:16] Team_025 possession (Score: 40-40)
Desmond Jordan drives and kicks out. Desmond Jordan attempts a 3Pt. Contested by RJ Young (6.0 feet, MAN). DESMOND JORDAN MAKES IT! Assist: Cade Anthony
Score: 40-43

[05:01] Team_010 possession (Score: 40-43)
Desmond Antetokounmpo attempts a 3Pt. Contested by Cade Anthony (5.4 feet, ZONE). DESMOND ANTETOKOUNMPO MAKES IT! Assist: RJ Young
Score: 43-43

[04:44] Team_025 possession (Score: 43-43)
Paolo Lowry attempts a 3Pt. Contested by Cade Morant (5.6 feet, MAN). Paolo Lowry misses. Offensive rebound by Allen Embiid! Allen Embiid kicks it out.

[04:30] Team_025 possession (Score: 43-43)
Paolo Lowry makes the Layup and draws the foul on Cade Morant! And-1! Paolo Lowry to the line for 1. [Team fouls: 3] (Cade Morant: 1 personal fouls)   FT 1/1: MISS Paolo Lowry makes 0/1 from the line. Rebound secured by Anthony Durant.
Score: 43-45

[04:16] Team_010 possession (Score: 43-45)
Cade Morant attempts a Midrange. Wide open! Paolo Lowry is 6.4 feet away. [MAN] Cade Morant misses. Rebound secured by Desmond Jordan.

[04:03] Team_025 possession (Score: 43-45)
Desmond Jordan attempts a 3Pt. Contested by Cade Morant (5.5 feet, ZONE). DESMOND JORDAN MAKES IT! Assist: Ben Giddey
Score: 43-48

[03:50] Team_010 possession (Score: 43-48)
Anthony Durant attempts a Midrange. Contested by Allen Embiid (5.0 feet, MAN). Anthony Durant misses. Rebound secured by Allen Embiid.

[03:39] Team_025 possession (Score: 43-48)
Paolo Lowry attempts a 3Pt. Contested by Cade Morant (5.8 feet, ZONE). Paolo Lowry misses. Rebound secured by Cade Morant.

[03:27] Team_010 possession (Score: 43-48)
Desmond Antetokounmpo attempts a Midrange. Contested by Cade Anthony (5.6 feet, MAN). DESMOND ANTETOKOUNMPO MAKES IT! Assist: Cade Morant
Score: 45-48

[03:14] Team_025 possession (Score: 45-48)
Ben Giddey attempts a 3Pt. Contested by Michael Turner (5.8 feet, MAN). BEN GIDDEY MAKES IT! Assist: Cade Anthony
Score: 45-51

[02:57] Team_010 possession (Score: 45-51)
Anthony Durant loses control! Ball rolls out of bounds! TURNOVER! (dead ball)

[02:57] Substitution (Team_010): Cade Morant OUT → Draymond Leonard IN (stamina_rule2)

[02:57] Substitution (Team_010): Michael Turner OUT → Blake Harden IN (stamina_rule2)

[02:57] Substitution (Team_010): RJ Young OUT → Ben Gilgeous-Alexander IN (stamina_rule2)

[02:57] Substitution (Team_010): Desmond Antetokounmpo OUT → Vince Ingram IN (stamina_rule2)

[02:57] Substitution (Team_010): Anthony Durant OUT → Paolo Wade IN (stamina_rule2)

[02:57] Substitution (Team_025): Paolo Lowry OUT → LeBron Griffin IN (stamina_rule2)

[02:57] Substitution (Team_025): Ben Giddey OUT → Dirk Gilgeous-Alexander IN (stamina_rule2)

[02:57] Substitution (Team_025): Desmond Jordan OUT → Immanuel LaVine IN (stamina_rule2)

[02:57] Substitution (Team_025): Cade Anthony OUT → Damian Adebayo IN (stamina_rule2)

[02:57] Substitution (Team_025): Allen Embiid OUT → Nikola Lillard IN (stamina_rule2)

[02:37] Team_025 possession (Score: 45-51)
Damian Adebayo attempts a Midrange. Contested by Vince Ingram (5.4 feet, MAN). Damian Adebayo misses. Rebound secured by Ben Gilgeous-Alexander.

[02:19] Team_010 possession (Score: 45-51)
FOUL! Holding foul on Nikola Lillard. [Team fouls: 3] No free throws, side out. (Nikola Lillard: 1 personal fouls)

[02:03] Team_010 possession (Score: 45-51)
Vince Ingram attempts a Midrange. Contested by Damian Adebayo (5.7 feet, MAN). VINCE INGRAM MAKES IT! Assist: Ben Gilgeous-Alexander
Score: 47-51

[01:50] Team_025 possession (Score: 47-51)
Immanuel LaVine makes the Layup and draws the foul on Ben Gilgeous-Alexander! And-1! Immanuel LaVine to the line for 1. [Team fouls: 4] (Ben Gilgeous-Alexander: 1 personal fouls)   FT 1/1: MISS Immanuel LaVine makes 0/1 from the line. Offensive rebound by Immanuel LaVine! Immanuel LaVine kicks it out.
Score: 47-53

[01:33] Team_025 possession (Score: 47-53)
LeBron Griffin drives, Paolo Wade stays with him. LeBron Griffin attempts a Dunk. Contested by Paolo Wade (5.0 feet, ZONE). LEBRON GRIFFIN MAKES IT! Assist: Damian Adebayo
Score: 47-55

[01:20] Team_010 possession (Score: 47-55)
Ben Gilgeous-Alexander drives, picks up Immanuel LaVine. Help arrives from LeBron Griffin! Ben Gilgeous-Alexander attempts a Dunk. Contested by LeBron Griffin (4.7 feet, MAN). BEN GILGEOUS-ALEXANDER MAKES IT!
Score: 49-55

[01:06] Team_025 possession (Score: 49-55)
LeBron Griffin attempts a Layup. Contested by Paolo Wade (5.0 feet, ZONE). LEBRON GRIFFIN MAKES IT! Assist: Damian Adebayo
Score: 49-57

[00:50] Team_010 possession (Score: 49-57)
Draymond Leonard attempts a 3Pt. Contested by LeBron Griffin (5.1 feet, ZONE). DRAYMOND LEONARD MAKES IT! Assist: Paolo Wade
Score: 52-57

[00:36] Team_025 possession (Score: 52-57)
Immanuel LaVine makes the Layup and draws the foul on Ben Gilgeous-Alexander! And-1! Immanuel LaVine to the line for 1. [BONUS: 5 team fouls] (Ben Gilgeous-Alexander: 2 personal fouls)   FT 1/1: GOOD Immanuel LaVine makes 1/1 from the line.
Score: 52-60

[00:19] Team_010 possession (Score: 52-60)
Vince Ingram drives, picks up Damian Adebayo. Help arrives from LeBron Griffin! Vince Ingram attempts a Layup. Contested by LeBron Griffin (5.7 feet, MAN). VINCE INGRAM MAKES IT! Assist: Blake Harden
Score: 54-60

[00:10] Team_025 possession (Score: 54-60)
LeBron Griffin attempts a Midrange. Contested by Blake Harden (4.5 feet, ZONE). LEBRON GRIFFIN MAKES IT!
Score: 54-62

================================================================================
                              2ND QUARTER COMPLETE                              
================================================================================

2ND QUARTER SCORE: Team_010 29, Team_025 31

BOX SCORE:
================================================================================

Team_010
--------------------------------------------------------------------------------
Player                MIN  PTS  REB  AST  TO      FG   FG%      3P   3P%
--------------------------------------------------------------------------------
Desmond Antetokounmpo   22   10    0    0   0   4/4   100.0     0/0   0.0
Michael Turner         22    4    1    0   0   2/3    66.7     0/0   0.0
Cade Morant            22    4    4    2   0   2/6    33.3     0/0   0.0
Vince Ingram            3    4    0    0   0   2/2   100.0     0/0   0.0
Draymond Leonard        3    3    0    0   0   1/1   100.0     0/0   0.0
Anthony Durant         22    2    6    2   0   1/3    33.3     0/0   0.0
Ben Gilgeous-Alexander    3    2    1    1   0   1/1   100.0     0/0   0.0
RJ Young               22    0    0    2   0   0/0     0.0     0/0   0.0
Paolo Wade              3    0    0    1   0   0/0     0.0     0/0   0.0
Blake Harden            3    0    0    1   0   0/0     0.0     0/0   0.0

TEAM: FG: 13/20 (65.0%), 3PT: 2/5 (40.0%), REB: 12 (2 off, 10 def), AST: 9, TO: 2
TEAM FOULS: 5 [Team_025 in BONUS]


Team_025
--------------------------------------------------------------------------------
Player                MIN  PTS  REB  AST  TO      FG   FG%      3P   3P%
--------------------------------------------------------------------------------
Desmond Jordan         22    8    2    2   0   3/5    60.0     0/0   0.0
LeBron Griffin          3    6    0    0   0   3/3   100.0     0/0   0.0
Allen Embiid           22    5    4    0   0   2/4    50.0     0/0   0.0
Ben Giddey             22    3    0    1   0   1/3    33.3     0/0   0.0
Immanuel LaVine         3    3    1    0   0   1/1   100.0     0/0   0.0
Paolo Lowry            22    2    0    0   0   1/3    33.3     0/0   0.0
Cade Anthony           22    0    2    2   0   0/1     0.0     0/0   0.0
Damian Adebayo          3    0    0    2   0   0/1     0.0     0/0   0.0

TEAM: FG: 11/21 (52.4%), 3PT: 3/8 (37.5%), REB: 9 (2 off, 7 def), AST: 7, TO: 1
TEAM FOULS: 3

================================================================================

================================================================================
                       3RD QUARTER - Team_010 vs Team_025                       
================================================================================

[12:00] Team_010 possession (Score: 54-62)
Michael Turner drives and kicks out. Michael Turner attempts a 3Pt. Contested by Ben Giddey (3.6 feet, MAN). Michael Turner misses. Rebound secured by Allen Embiid.

[11:46] Team_025 possession (Score: 54-62)
Allen Embiid attempts a Midrange. Contested by Anthony Durant (3.6 feet, MAN). Allen Embiid misses. Rebound secured by Anthony Durant.

[11:29] Team_010 possession (Score: 54-62)
Cade Morant attempts a Midrange. Contested by Paolo Lowry (5.4 feet, MAN). Cade Morant misses. Rebound secured by Allen Embiid.

[11:16] Team_025 possession (Score: 54-62)
Desmond Jordan drives, RJ Young stays with him. Desmond Jordan attempts a Dunk. Contested by RJ Young (4.9 feet, MAN). DESMOND JORDAN MAKES IT! Assist: Paolo Lowry
Score: 54-64

[10:59] Team_010 possession (Score: 54-64)
Cade Morant attempts a Midrange. Contested by Paolo Lowry (5.4 feet, MAN). Cade Morant misses. Rebound secured by Desmond Jordan.

[10:46] Team_025 possession (Score: 54-64)
Paolo Lowry drives, picks up Anthony Durant. Help arrives from Cade Morant! Paolo Lowry attempts a Dunk. Contested by Cade Morant (3.9 feet, ZONE). PAOLO LOWRY MAKES IT! Assist: Ben Giddey
Score: 54-66

[10:32] Team_010 possession (Score: 54-66)
Cade Morant attempts a Layup. Contested by Paolo Lowry (5.4 feet, MAN). CADE MORANT MAKES IT! Assist: Desmond Antetokounmpo
Score: 56-66

[10:17] Team_025 possession (Score: 56-66)
Paolo Lowry throws a bad pass! Stolen by Cade Morant! TURNOVER! (live ball)

[10:04] Team_010 possession (Score: 56-66)
Cade Morant attempts a 3Pt. Contested by Paolo Lowry (5.4 feet, MAN). Cade Morant misses. Rebound secured by Desmond Jordan.

[09:47] Team_025 possession (Score: 56-66)
Cade Anthony makes the Midrange and draws the foul on RJ Young! And-1! Cade Anthony to the line for 1. [Team fouls: 1] (RJ Young: 1 personal fouls)   FT 1/1: GOOD Cade Anthony makes 1/1 from the line.
Score: 56-69

[09:38] Team_010 possession (Score: 56-69)
Michael Turner makes the Dunk and draws the foul on Ben Giddey! And-1! Michael Turner to the line for 1. [Team fouls: 1] (Ben Giddey: 1 personal fouls)   FT 1/1: GOOD Michael Turner makes 1/1 from the line.
Score: 59-69

[09:22] Team_025 possession (Score: 59-69)
Desmond Jordan attempts a Midrange. Contested by RJ Young (4.9 feet, MAN). Desmond Jordan misses. Rebound secured by Cade Morant.

[09:06] Team_010 possession (Score: 59-69)
Anthony Durant drives to the basket... Anthony Durant commits a violation (traveling/carry)! TURNOVER! (dead ball)

[08:54] Team_025 possession (Score: 59-69)
Paolo Lowry drives, picks up Anthony Durant. Help arrives from Cade Morant! Paolo Lowry attempts a Layup. Contested by Cade Morant (3.9 feet, ZONE). PAOLO LOWRY MAKES IT! Assist: Ben Giddey
Score: 59-71

[08:39] Team_010 possession (Score: 59-71)
Michael Turner attempts a Midrange. Contested by Desmond Jordan (3.6 feet, ZONE). Michael Turner misses. Rebound secured by Desmond Jordan.

[08:24] Team_025 possession (Score: 59-71)
Cade Anthony drives and kicks out. Desmond Jordan attempts a 3Pt. Contested by Cade Morant (3.9 feet, ZONE). Desmond Jordan misses. Rebound secured by Cade Morant.

[08:08] Team_010 possession (Score: 59-71)
Anthony Durant makes the Layup and draws the foul on Cade Anthony! And-1! Anthony Durant to the line for 1. [Team fouls: 2] (Cade Anthony: 1 personal fouls)   FT 1/1: MISS Anthony Durant makes 0/1 from the line. FOUL! Loose ball foul on Allen Embiid during the free throw rebound! [Team fouls: 3] No free throws, side out. (Allen Embiid: 1 personal fouls)
Score: 61-71

[07:51] Team_010 possession (Score: 61-71)
FOUL! Shooting foul on Desmond Jordan. RJ Young to the line for 2 free throws. [Team fouls: 4] (Desmond Jordan: 1 personal fouls)   FT 1/2: GOOD   FT 2/2: GOOD RJ Young makes 2/2 from the line.
Score: 63-71

[07:35] Team_025 possession (Score: 63-71)
FOUL! Shooting foul on Michael Turner. Cade Anthony to the line for 2 free throws. [Team fouls: 2] (Michael Turner: 1 personal fouls)   FT 1/2: MISS   FT 2/2: GOOD Cade Anthony makes 1/2 from the line.
Score: 63-72

[07:18] Team_010 possession (Score: 63-72)
FOUL! Reach-in foul on Paolo Lowry during the drive. [IN THE BONUS! 5 team fouls] Cade Morant to the line for 2 free throws. (Paolo Lowry: 1 personal fouls)   FT 1/2: GOOD   FT 2/2: GOOD Cade Morant makes 2/2 from the line.
Score: 65-72

[07:02] Team_025 possession (Score: 65-72)
FOUL! Shooting foul on Cade Morant. Ben Giddey to the line for 2 free throws. [Team fouls: 3] (Cade Morant: 1 personal fouls)   FT 1/2: GOOD   FT 2/2: GOOD Ben Giddey makes 2/2 from the line.
Score: 65-74

[06:47] Team_010 possession (Score: 65-74)
Desmond Antetokounmpo attempts a 3Pt. Contested by Ben Giddey (3.8 feet, ZONE). Desmond Antetokounmpo misses. Offensive rebound by Anthony Durant! Anthony Durant kicks it out.

[06:31] Team_010 possession (Score: 65-74)
RJ Young attempts a Layup. BLOCKED BY ALLEN EMBIID! Ball goes out off Allen Embiid. RJ Young's ball!

[06:15] Team_010 possession (Score: 65-74)
Anthony Durant attempts a Layup. Contested by Allen Embiid (3.2 feet, MAN). Anthony Durant misses. Rebound secured by Cade Anthony.

[06:01] Team_025 possession (Score: 65-74)
Ben Giddey attempts a Layup. Contested by Michael Turner (4.5 feet, MAN). BEN GIDDEY MAKES IT!
Score: 65-76

[05:49] Team_010 possession (Score: 65-76)
Cade Morant attempts a 3Pt. Contested by Paolo Lowry (5.4 feet, MAN). Cade Morant misses. Rebound secured by Cade Anthony.

[05:36] Team_025 possession (Score: 65-76)
Cade Anthony drives, picks up Anthony Durant. Help arrives from Cade Morant! Cade Anthony attempts a Dunk. Contested by Cade Morant (4.2 feet, ZONE). Cade Anthony misses. Rebound secured by Desmond Antetokounmpo.

[05:27] Team_010 possession (Score: 65-76)
Desmond Antetokounmpo drives, picks up Cade Anthony. Help arrives from Ben Giddey! Desmond Antetokounmpo attempts a Layup. Contested by Ben Giddey (4.4 feet, MAN). DESMOND ANTETOKOUNMPO MAKES IT! Assist: Anthony Durant
Score: 67-76

[05:17] Team_025 possession (Score: 67-76)
Ben Giddey attempts a 3Pt. Contested by Cade Morant (4.4 feet, ZONE). Ben Giddey misses. Offensive rebound by Desmond Jordan! Desmond Jordan's putback is no good. Offensive rebound by Allen Embiid! Allen Embiid kicks it out.

[05:01] Team_025 possession (Score: 67-76)
Paolo Lowry attempts a Layup. Contested by Cade Morant (4.3 feet, MAN). PAOLO LOWRY MAKES IT! Assist: Allen Embiid
Score: 67-78

[04:47] Team_010 possession (Score: 67-78)
Desmond Antetokounmpo attempts a 3Pt. Contested by Ben Giddey (3.8 feet, ZONE). Desmond Antetokounmpo misses. Rebound secured by Cade Anthony.

[04:33] Team_025 possession (Score: 67-78)
Paolo Lowry attempts a Layup. Contested by Anthony Durant (4.0 feet, ZONE). PAOLO LOWRY MAKES IT! Assist: Cade Anthony
Score: 67-80

[04:15] Team_010 possession (Score: 67-80)
Cade Morant attempts a 3Pt. Contested by Ben Giddey (4.2 feet, ZONE). Cade Morant misses. Rebound secured by Allen Embiid.

[04:01] Team_025 possession (Score: 67-80)
Allen Embiid makes the Layup and draws the foul on Anthony Durant! And-1! Allen Embiid to the line for 1. [Team fouls: 4] (Anthony Durant: 1 personal fouls)   FT 1/1: GOOD Allen Embiid makes 1/1 from the line.
Score: 67-83

[03:46] Team_010 possession (Score: 67-83)
Michael Turner attempts a 3Pt. Contested by Ben Giddey (4.0 feet, ZONE). Michael Turner misses. Rebound secured by Allen Embiid.

[03:29] Team_025 possession (Score: 67-83)
Paolo Lowry attempts a Layup. Contested by Anthony Durant (4.1 feet, ZONE). PAOLO LOWRY MAKES IT! Assist: Ben Giddey
Score: 67-85

[03:17] Team_010 possession (Score: 67-85)
FOUL! Shooting foul on Paolo Lowry. Cade Morant to the line for 2 free throws. [BONUS: 6 team fouls] (Paolo Lowry: 2 personal fouls)   FT 1/2: GOOD   FT 2/2: GOOD Cade Morant makes 2/2 from the line.
Score: 69-85

[03:01] Team_025 possession (Score: 69-85)
FOUL! Holding foul on RJ Young. [IN THE BONUS! 5 team fouls] Desmond Jordan to the line for 2 free throws. (RJ Young: 2 personal fouls)   FT 1/2: GOOD   FT 2/2: GOOD Desmond Jordan makes 2/2 from the line.
Score: 69-87

[02:50] Team_010 possession (Score: 69-87)
Desmond Antetokounmpo attempts a 3Pt. Contested by Ben Giddey (4.0 feet, ZONE). Desmond Antetokounmpo misses. Rebound secured by Desmond Jordan.

[02:36] Team_025 possession (Score: 69-87)
Allen Embiid loses control! Ball rolls out of bounds! TURNOVER! (dead ball)

[02:36] Substitution (Team_010): Cade Morant OUT → Draymond Leonard IN (stamina_rule2)

[02:36] Substitution (Team_010): RJ Young OUT → Ben Gilgeous-Alexander IN (stamina_rule2)

[02:36] Substitution (Team_010): Desmond Antetokounmpo OUT → Vince Ingram IN (stamina_rule2)

[02:36] Substitution (Team_010): Anthony Durant OUT → Paolo Wade IN (stamina_rule2)

[02:36] Substitution (Team_025): Allen Embiid OUT → Nikola Lillard IN (stamina_rule2)

[02:27] Team_010 possession (Score: 69-87)
Draymond Leonard attempts a 3Pt. Contested by Paolo Lowry (5.5 feet, MAN). DRAYMOND LEONARD MAKES IT! Assist: Vince Ingram
Score: 72-87

[02:17] Team_025 possession (Score: 72-87)
Nikola Lillard attempts a Layup. Contested by Paolo Wade (5.3 feet, MAN). Nikola Lillard misses. Rebound secured by Ben Gilgeous-Alexander.

[02:03] Team_010 possession (Score: 72-87)
Paolo Wade attempts a Layup. Contested by Nikola Lillard (4.6 feet, MAN). PAOLO WADE MAKES IT!
Score: 74-87

[01:50] Team_025 possession (Score: 74-87)
Ben Giddey attempts a Midrange. Contested by Ben Gilgeous-Alexander (5.0 feet, ZONE). BEN GIDDEY MAKES IT! Assist: Desmond Jordan
Score: 74-89

[01:41] Team_010 possession (Score: 74-89)
Vince Ingram attempts a Layup. Contested by Cade Anthony (5.3 feet, MAN). VINCE INGRAM MAKES IT!
Score: 76-89

[01:26] Team_025 possession (Score: 76-89)
Ben Giddey attempts a Midrange. Contested by Ben Gilgeous-Alexander (5.0 feet, ZONE). BEN GIDDEY MAKES IT!
Score: 76-91

[01:10] Team_010 possession (Score: 76-91)
Michael Turner attempts a Midrange. Contested by Desmond Jordan (4.0 feet, ZONE). Michael Turner misses. Rebound secured by Cade Anthony.

[00:55] Team_025 possession (Score: 76-91)
Paolo Lowry makes the Dunk and draws the foul on Ben Gilgeous-Alexander! And-1! Paolo Lowry to the line for 1. [BONUS: 6 team fouls] (Ben Gilgeous-Alexander: 1 personal fouls)   FT 1/1: GOOD Paolo Lowry makes 1/1 from the line.
Score: 76-94

[00:43] Team_010 possession (Score: 76-94)
Ben Gilgeous-Alexander attempts a 3Pt. Contested by Desmond Jordan (4.2 feet, MAN). Ben Gilgeous-Alexander misses. Rebound secured by Cade Anthony.

[00:31] Team_025 possession (Score: 76-94)
Nikola Lillard attempts a Midrange. Contested by Paolo Wade (5.3 feet, MAN). Nikola Lillard misses. Rebound secured by Draymond Leonard.

[00:21] Team_010 possession (Score: 76-94)
Draymond Leonard drives, picks up Paolo Lowry. Help arrives from Desmond Jordan! Draymond Leonard attempts a Dunk. Contested by Desmond Jordan (5.8 feet, MAN). DRAYMOND LEONARD MAKES IT!
Score: 78-94

[00:06] Team_025 possession (Score: 78-94)
FOUL! Reach-in foul on Paolo Wade during the drive. [IN THE BONUS! 7 team fouls] Nikola Lillard to the line for 2 free throws. (Paolo Wade: 1 personal fouls)   FT 1/2: MISS   FT 2/2: GOOD Nikola Lillard makes 1/2 from the line.
Score: 78-95

================================================================================
                              3RD QUARTER COMPLETE                              
================================================================================

3RD QUARTER SCORE: Team_010 24, Team_025 33

BOX SCORE:
================================================================================

Team_010
--------------------------------------------------------------------------------
Player                MIN  PTS  REB  AST  TO      FG   FG%      3P   3P%
--------------------------------------------------------------------------------
Cade Morant            31    6    3    0   0   3/8    37.5     0/0   0.0
Draymond Leonard        5    5    1    0   0   2/2   100.0     0/0   0.0
Michael Turner         34    3    0    0   0   1/5    20.0     0/0   0.0
Desmond Antetokounmpo   31    2    1    1   0   1/3    33.3     0/0   0.0
RJ Young               31    2    0    0   0   1/1   100.0     0/0   0.0
Vince Ingram            5    2    0    1   0   1/1   100.0     0/0   0.0
Paolo Wade              5    2    0    0   0   1/1   100.0     0/0   0.0
Anthony Durant         31    0    2    1   0   0/1     0.0     0/0   0.0
Ben Gilgeous-Alexander    5    0    1    0   0   0/1     0.0     0/0   0.0

TEAM: FG: 10/23 (43.5%), 3PT: 1/8 (12.5%), REB: 8 (2 off, 6 def), AST: 3, TO: 1
TEAM FOULS: 7 [Team_025 in BONUS]


Team_025
--------------------------------------------------------------------------------
Player                MIN  PTS  REB  AST  TO      FG   FG%      3P   3P%
--------------------------------------------------------------------------------
Paolo Lowry            34   13    0    1   0   6/6   100.0     0/0   0.0
Ben Giddey             34    8    0    3   0   4/4   100.0     0/0   0.0
Desmond Jordan         34    4    4    1   0   2/3    66.7     0/0   0.0
Cade Anthony           34    4    5    1   0   2/4    50.0     0/0   0.0
Allen Embiid           31    3    5    1   0   1/2    50.0     0/0   0.0
Nikola Lillard          5    1    0    0   0   1/3    33.3     0/0   0.0

TEAM: FG: 16/22 (72.7%), 3PT: 0/0 (0.0%), REB: 14 (1 off, 13 def), AST: 7, TO: 2
TEAM FOULS: 6 [Team_010 in BONUS]

================================================================================

================================================================================
                       4TH QUARTER - Team_010 vs Team_025                       
================================================================================

[12:00] Substitution (Team_010): Cade Morant OUT (stamina: 80) → Draymond Leonard IN (comeback_detected)

[12:00] Substitution (Team_025): Paolo Lowry OUT (stamina: 69) → LeBron Griffin IN (comeback_detected)

[12:00] Team_010 possession (Score: 78-95)
FOUL! Shooting foul on Allen Embiid. Anthony Durant to the line for 2 free throws. [Team fouls: 1] (Allen Embiid: 1 personal fouls)   FT 1/2: GOOD   FT 2/2: GOOD Anthony Durant makes 2/2 from the line.
Score: 80-95

[11:47] Team_025 possession (Score: 80-95)
Desmond Jordan attempts a Layup. Contested by RJ Young (4.8 feet, MAN). DESMOND JORDAN MAKES IT!
Score: 80-97

[11:35] Team_010 possession (Score: 80-97)
Michael Turner makes the Layup and draws the foul on Desmond Jordan! And-1! Michael Turner to the line for 1. [Team fouls: 2] (Desmond Jordan: 1 personal fouls)   FT 1/1: GOOD Michael Turner makes 1/1 from the line.
Score: 83-97

[11:22] Team_025 possession (Score: 83-97)
Ben Giddey attempts a Midrange. Contested by Michael Turner (4.8 feet, MAN). Ben Giddey misses. Rebound secured by Anthony Durant.

[11:06] Team_010 possession (Score: 83-97)
Desmond Antetokounmpo attempts a 3Pt. Contested by LeBron Griffin (4.9 feet, ZONE). Desmond Antetokounmpo misses. Rebound secured by Desmond Jordan.

[10:53] Team_025 possession (Score: 83-97)
LeBron Griffin attempts a 3Pt. Contested by Draymond Leonard (4.3 feet, ZONE). LeBron Griffin misses. Rebound secured by Anthony Durant.

[10:33] Team_010 possession (Score: 83-97)
Anthony Durant drives and kicks out. Michael Turner attempts a Midrange. Contested by Ben Giddey (4.2 feet, MAN). Michael Turner misses. FOUL! Loose ball foul on Cade Anthony during the rebound battle. [Team fouls: 3] No free throws, side out. (Cade Anthony: 1 personal fouls)

[10:18] Team_010 possession (Score: 83-97)
RJ Young attempts a Layup. Contested by Allen Embiid (2.9 feet, ZONE). RJ Young misses. Rebound secured by Desmond Jordan.

[10:06] Team_025 possession (Score: 83-97)
Cade Anthony attempts a 3Pt. Contested by Draymond Leonard (5.0 feet, ZONE). Cade Anthony misses. Offensive rebound by Desmond Jordan! Desmond Jordan's putback is no good. Rebound secured by Desmond Antetokounmpo.

[09:51] Team_010 possession (Score: 83-97)
FOUL! Holding foul on Cade Anthony. [Team fouls: 4] No free throws, side out. (Cade Anthony: 2 personal fouls)

[09:37] Team_010 possession (Score: 83-97)
Draymond Leonard attempts a 3Pt. Contested by LeBron Griffin (5.1 feet, ZONE). Draymond Leonard misses. Rebound secured by Desmond Jordan.

[09:22] Team_025 possession (Score: 83-97)
LeBron Griffin attempts a Midrange. Contested by Draymond Leonard (4.3 feet, ZONE). LEBRON GRIFFIN MAKES IT! Assist: Allen Embiid
Score: 83-99

[09:08] Team_010 possession (Score: 83-99)
Desmond Antetokounmpo attempts a 3Pt. Contested by Cade Anthony (5.0 feet, MAN). Desmond Antetokounmpo misses. Offensive rebound by Desmond Antetokounmpo! Desmond Antetokounmpo kicks it out.

[08:54] Team_010 possession (Score: 83-99)
Desmond Antetokounmpo attempts a Layup. BLOCKED BY ALLEN EMBIID! Ball is loose! Rebound secured by Cade Anthony.

[08:40] Team_025 possession (Score: 83-99)
FOUL! Shooting foul on Desmond Antetokounmpo. LeBron Griffin to the line for 2 free throws. [Team fouls: 1] (Desmond Antetokounmpo: 1 personal fouls)   FT 1/2: GOOD   FT 2/2: GOOD LeBron Griffin makes 2/2 from the line.
Score: 83-101

[08:26] Team_010 possession (Score: 83-101)
RJ Young attempts a Layup. Contested by Desmond Jordan (4.1 feet, MAN). RJ YOUNG MAKES IT!
Score: 85-101

[08:10] Team_025 possession (Score: 85-101)
Desmond Jordan attempts a 3Pt. Contested by Desmond Antetokounmpo (4.7 feet, ZONE). DESMOND JORDAN MAKES IT! Assist: Cade Anthony
Score: 85-104

[07:55] Team_010 possession (Score: 85-104)
Michael Turner attempts a Layup. Contested by Ben Giddey (4.7 feet, MAN). MICHAEL TURNER MAKES IT!
Score: 87-104

[07:40] Team_025 possession (Score: 87-104)
Allen Embiid attempts a 3Pt. Contested by Anthony Durant (4.1 feet, MAN). Allen Embiid misses. Rebound secured by Anthony Durant.

[07:26] Team_010 possession (Score: 87-104)
FOUL! Reach-in foul on Allen Embiid during the drive. [IN THE BONUS! 5 team fouls] Anthony Durant to the line for 2 free throws. (Allen Embiid: 2 personal fouls)   FT 1/2: GOOD   FT 2/2: GOOD Anthony Durant makes 2/2 from the line.
Score: 89-104

[07:09] Team_025 possession (Score: 89-104)
Desmond Jordan drives and kicks out. Ben Giddey attempts a Midrange. Contested by RJ Young (5.2 feet, ZONE). Ben Giddey misses. Rebound secured by RJ Young.

[06:51] Team_010 possession (Score: 89-104)
FOUL! Reach-in foul on LeBron Griffin during the drive. [IN THE BONUS! 6 team fouls] Draymond Leonard to the line for 2 free throws. (LeBron Griffin: 1 personal fouls)   FT 1/2: GOOD   FT 2/2: MISS Draymond Leonard makes 1/2 from the line. Offensive rebound by Anthony Durant! Anthony Durant kicks it out.
Score: 90-104

[06:34] Team_010 possession (Score: 90-104)
Michael Turner attempts a 3Pt. Contested by LeBron Griffin (4.8 feet, ZONE). Michael Turner misses. Offensive rebound by Anthony Durant! Anthony Durant kicks it out.

[06:20] Team_010 possession (Score: 90-104)
Draymond Leonard attempts a 3Pt. Contested by LeBron Griffin (5.1 feet, ZONE). Draymond Leonard misses. FOUL! Loose ball foul on Allen Embiid during the rebound battle. [IN THE BONUS! 7 team fouls] Draymond Leonard to the line for 2 free throws. (Allen Embiid: 3 personal fouls)   FT 1/2: GOOD   FT 2/2: MISS Draymond Leonard makes 1/2 from the line. Offensive rebound by Anthony Durant! Anthony Durant kicks it out.
Score: 91-104

[06:03] Team_010 possession (Score: 91-104)
Anthony Durant attempts a Layup. Contested by Allen Embiid (3.9 feet, ZONE). Anthony Durant misses. FOUL! Loose ball foul on Desmond Jordan during the rebound battle. [IN THE BONUS! 8 team fouls] Draymond Leonard to the line for 2 free throws. (Desmond Jordan: 2 personal fouls)   FT 1/2: MISS   FT 2/2: GOOD Draymond Leonard makes 1/2 from the line.
Score: 92-104

[05:45] Team_025 possession (Score: 92-104)
LeBron Griffin attempts a Midrange. Contested by Draymond Leonard (4.5 feet, MAN). LeBron Griffin misses. Rebound secured by Anthony Durant.

[05:30] Team_010 possession (Score: 92-104)
RJ Young attempts a Midrange. Contested by Desmond Jordan (4.5 feet, MAN). RJ Young misses. Rebound secured by Desmond Jordan.

[05:15] Team_025 possession (Score: 92-104)
Desmond Jordan drives and kicks out. Allen Embiid attempts a 3Pt. Contested by Desmond Antetokounmpo (5.0 feet, ZONE). ALLEN EMBIID MAKES IT! Assist: LeBron Griffin
Score: 92-107

[05:01] Team_010 possession (Score: 92-107)
FOUL! Shooting foul on Ben Giddey. Michael Turner to the line for 3 free throws. [BONUS: 9 team fouls] (Ben Giddey: 1 personal fouls)   FT 1/3: GOOD   FT 2/3: GOOD   FT 3/3: GOOD Michael Turner makes 3/3 from the line.
Score: 95-107

[04:49] Team_025 possession (Score: 95-107)
Desmond Jordan attempts a 3Pt. Contested by Draymond Leonard (4.6 feet, ZONE). DESMOND JORDAN MAKES IT! Assist: LeBron Griffin
Score: 95-110

[04:30] Team_010 possession (Score: 95-110)
Michael Turner attempts a 3Pt. Contested by LeBron Griffin (4.8 feet, ZONE). Michael Turner misses. Rebound secured by Desmond Jordan.

[04:15] Team_025 possession (Score: 95-110)
Allen Embiid attempts a Midrange. Contested by Michael Turner (5.5 feet, ZONE). ALLEN EMBIID MAKES IT! Assist: LeBron Griffin
Score: 95-112

[04:01] Team_010 possession (Score: 95-112)
Anthony Durant attempts a 3Pt. Contested by LeBron Griffin (4.9 feet, ZONE). Anthony Durant misses. Rebound secured by Desmond Jordan.

[03:51] Team_025 possession (Score: 95-112)
Cade Anthony attempts a Midrange. Contested by Desmond Antetokounmpo (5.6 feet, MAN). Cade Anthony misses. Rebound secured by Anthony Durant.

[03:39] Team_010 possession (Score: 95-112)
Michael Turner drives, picks up Ben Giddey. Help arrives from Desmond Jordan! Michael Turner attempts a Layup. Contested by Desmond Jordan (5.3 feet, MAN). Michael Turner misses. Rebound secured by Allen Embiid.

[03:25] Team_025 possession (Score: 95-112)
LeBron Griffin attempts a Midrange. Contested by Draymond Leonard (4.7 feet, MAN). LeBron Griffin misses. Offensive rebound by LeBron Griffin! LeBron Griffin kicks it out.

[03:12] Team_025 possession (Score: 95-112)
Ben Giddey attempts a Midrange. Contested by Michael Turner (5.8 feet, ZONE). Ben Giddey misses. Rebound secured by Anthony Durant.

[02:52] Team_010 possession (Score: 95-112)
FOUL! Reach-in foul on Cade Anthony during the drive. [IN THE BONUS! 10 team fouls] Anthony Durant to the line for 2 free throws. (Cade Anthony: 3 personal fouls)   FT 1/2: GOOD   FT 2/2: MISS Anthony Durant makes 1/2 from the line. Rebound secured by Allen Embiid.
Score: 96-112

[02:38] Team_025 possession (Score: 96-112)
LeBron Griffin attempts a Midrange. Contested by Draymond Leonard (4.8 feet, MAN). LeBron Griffin misses. Rebound secured by Anthony Durant.

[02:21] Team_010 possession (Score: 96-112)
RJ Young attempts a 3Pt. Contested by Desmond Jordan (5.0 feet, MAN). RJ YOUNG MAKES IT! Assist: Draymond Leonard
Score: 99-112

[02:07] Team_025 possession (Score: 99-112)
Ben Giddey attempts a Layup. Contested by Anthony Durant (5.0 feet, ZONE). Ben Giddey misses. Rebound secured by Draymond Leonard.

[01:54] Team_010 possession (Score: 99-112)
Anthony Durant drives to the basket... Anthony Durant loses the ball! Stripped by Allen Embiid! TURNOVER! (live ball)

[01:35] Team_025 possession (Score: 99-112)
FOUL! Shooting foul on Michael Turner. Allen Embiid to the line for 2 free throws. [Team fouls: 2] (Michael Turner: 1 personal fouls)   FT 1/2: MISS   FT 2/2: MISS Allen Embiid makes 0/2 from the line. Rebound secured by Draymond Leonard.

[01:20] Team_010 possession (Score: 99-112)
Michael Turner attempts a Layup. Contested by Allen Embiid (4.5 feet, ZONE). MICHAEL TURNER MAKES IT!
Score: 101-112

[01:05] Team_025 possession (Score: 101-112)
LeBron Griffin makes the Layup and draws the foul on Draymond Leonard! And-1! LeBron Griffin to the line for 1. [Team fouls: 3] (Draymond Leonard: 1 personal fouls)   FT 1/1: MISS LeBron Griffin makes 0/1 from the line. Rebound secured by Draymond Leonard.
Score: 101-114

[00:52] Team_010 possession (Score: 101-114)
Anthony Durant attempts a 3Pt. Contested by LeBron Griffin (5.2 feet, ZONE). Anthony Durant misses. Rebound secured by Allen Embiid.

[00:37] Team_025 possession (Score: 101-114)
Ben Giddey attempts a Midrange. Wide open! Michael Turner is 6.2 feet away. [MAN] Ben Giddey misses. FOUL! Loose ball foul on Anthony Durant during the rebound battle. [Team fouls: 4] No free throws, side out. (Anthony Durant: 1 personal fouls)

[00:20] Team_025 possession (Score: 101-114)
Cade Anthony attempts a 3Pt. Contested by Draymond Leonard (5.5 feet, ZONE). Cade Anthony misses. Rebound secured by Desmond Antetokounmpo.

[00:02] Team_010 possession (Score: 101-114)
Michael Turner attempts a 3Pt. Contested by Ben Giddey (5.9 feet, MAN). MICHAEL TURNER MAKES IT! Assist: Anthony Durant
Score: 104-114

================================================================================
                              4TH QUARTER COMPLETE                              
================================================================================

4TH QUARTER SCORE: Team_010 26, Team_025 19

BOX SCORE:
================================================================================

Team_010
--------------------------------------------------------------------------------
Player                MIN  PTS  REB  AST  TO      FG   FG%      3P   3P%
--------------------------------------------------------------------------------
Michael Turner         46   13    0    0   0   5/7    71.4     0/0   0.0
RJ Young               43    5    1    0   0   2/4    50.0     0/0   0.0
Anthony Durant         43    4   10    1   0   2/5    40.0     0/0   0.0
Draymond Leonard       17    1    3    1   0   1/2    50.0     0/0   0.0
Desmond Antetokounmpo   43    0    4    0   0   0/2     0.0     0/0   0.0

TEAM: FG: 10/20 (50.0%), 3PT: 3/8 (37.5%), REB: 17 (5 off, 12 def), AST: 2, TO: 1
TEAM FOULS: 4


Team_025
--------------------------------------------------------------------------------
Player                MIN  PTS  REB  AST  TO      FG   FG%      3P   3P%
--------------------------------------------------------------------------------
Desmond Jordan         46    8    6    0   0   3/4    75.0     0/0   0.0
Allen Embiid           43    5    4    1   0   2/4    50.0     0/0   0.0
LeBron Griffin         15    4    1    3   0   2/6    33.3     0/0   0.0
Ben Giddey             46    0    0    0   0   0/3     0.0     0/0   0.0
Cade Anthony           46    0    1    1   0   0/3     0.0     0/0   0.0

TEAM: FG: 7/20 (35.0%), 3PT: 2/6 (33.3%), REB: 13 (3 off, 10 def), AST: 5, TO: 0
TEAM FOULS: 10 [Team_010 in BONUS]

================================================================================

================================================================================
                               FULL GAME COMPLETE                               
================================================================================

FINAL SCORE: Team_010 104, Team_025 114

SCORING BY QUARTER:
--------------------------------------------------------------------------------
Team                     Q1     Q2     Q3     Q4    FINAL
--------------------------------------------------------------------------------
Team_010                 25     29     24     26      104
Team_025                 31     31     33     19      114
--------------------------------------------------------------------------------

FULL GAME BOX SCORE:
================================================================================

Team_010
--------------------------------------------------------------------------------
Player                MIN  PTS  REB  AST  TO      FG   FG%      3P   3P%      FT STL BLK
--------------------------------------------------------------------------------
Michael Turner         46   27    1    0   1  11/20   55.0   2/6    33.3  10/10    0   0
RJ Young               43   12    1    4   2   5/10   50.0   2/3    66.7   2/2     0   0
Desmond Antetokounmpo   43   14    7    2   0   5/11   45.5   1/4    25.0   1/1     0   0
Anthony Durant         43    6   25    4   2   4/12   33.3   0/3     0.0   5/7     0   0
Cade Morant            31   19   11    3   1   9/19   47.4   1/7    14.3   7/9     2   0
Draymond Leonard       17    9    4    1   0   3/4    75.0   2/3    66.7   3/6     0   0
Ben Gilgeous-Alexander    5    2    2    1   0   1/2    50.0   0/1     0.0   0/0     0   0
Vince Ingram            5    6    0    1   0   3/3   100.0   0/0     0.0   0/0     0   0
Paolo Wade              5    2    0    1   0   1/1   100.0   0/0     0.0   0/0     0   0
Blake Harden            3    0    0    1   0   0/0     0.0   0/0     0.0   0/0     0   0

TEAM: FG: 42/82 (51.2%), 3PT: 8/27 (29.6%), REB: 50 (15 off, 35 def), AST: 18, TO: 6


Team_025
--------------------------------------------------------------------------------
Player                MIN  PTS  REB  AST  TO      FG   FG%      3P   3P%      FT STL BLK
--------------------------------------------------------------------------------
Ben Giddey             46   16    0    5   0   7/13   53.8   2/4    50.0   2/2     1   1
Desmond Jordan         46   30   15    5   0  12/16   75.0   4/5    80.0   3/3     1   1
Cade Anthony           46    9    8    4   0   4/12   33.3   0/4     0.0   3/4     0   0
Allen Embiid           43   22   22    3   1   8/14   57.1   1/3    33.3   5/7     2   3
Paolo Lowry            34   17    0    3   3   8/13   61.5   0/3     0.0   3/4     0   0
LeBron Griffin         15   10    1    3   0   5/9    55.6   0/1     0.0   2/3     0   0
Nikola Lillard          5    1    0    0   0   1/3    33.3   0/0     0.0   1/2     0   0
Dirk Gilgeous-Alexander    3    0    0    0   0   0/0     0.0   0/0     0.0   0/0     0   0
Immanuel LaVine         3    3    1    0   0   1/1   100.0   0/0     0.0   1/2     0   0
Damian Adebayo          3    0    0    2   0   0/1     0.0   0/0     0.0   0/0     0   0

TEAM: FG: 47/83 (56.6%), 3PT: 7/20 (35.0%), REB: 48 (9 off, 39 def), AST: 25, TO: 4

================================================================================
