================================================================================
                        FULL GAME - Team_043 vs Team_099                        
================================================================================

================================================================================
                       1ST QUARTER - Team_043 vs Team_099                       
================================================================================

[12:00] Team_043 possession (Score: 0-0)
Manu Carter makes the Dunk and draws the foul on Ayo Barrett! And-1! Manu Carter to the line for 1. [Team fouls: 1] (Ayo Barrett: 1 personal fouls)   FT 1/1: GOOD Manu Carter makes 1/1 from the line.
Score: 3-0

[11:48] Team_099 possession (Score: 3-0)
Vince Lillard makes the Layup and draws the foul on Manu Carter! And-1! Vince Lillard to the line for 1. [Team fouls: 1] (Manu Carter: 1 personal fouls)   FT 1/1: GOOD Vince Lillard makes 1/1 from the line.
Score: 3-3

[11:33] Team_043 possession (Score: 3-3)
FOUL! Shooting foul on Larry James. Magic Durant to the line for 3 free throws. [Team fouls: 2] (Larry James: 1 personal fouls)   FT 1/3: GOOD   FT 2/3: GOOD   FT 3/3: GOOD Magic Durant makes 3/3 from the line.
Score: 6-3

[11:18] Team_099 possession (Score: 6-3)
FOUL! Shooting foul on Manu Carter. Larry Wade to the line for 2 free throws. [Team fouls: 2] (Manu Carter: 2 personal fouls)   FT 1/2: GOOD   FT 2/2: GOOD Larry Wade makes 2/2 from the line.
Score: 6-5

[11:03] Team_043 possession (Score: 6-5)
Manu Carter attempts a Layup. Contested by Vince Lillard (3.0 feet, MAN). Manu Carter misses. Rebound secured by Vince Lillard.

[10:52] Team_099 possession (Score: 6-5)
Larry Wade attempts a 3Pt. BLOCKED BY D'ANGELO IVERSON! Ball is loose! Rebound secured by Dwyane Dosunmu.

[10:34] Team_043 possession (Score: 6-5)
Magic Durant attempts a Midrange. Contested by Larry James (5.1 feet, MAN). MAGIC DURANT MAKES IT! Assist: Manu Carter
Score: 8-5

[10:16] Team_099 possession (Score: 8-5)
Ayo Barrett attempts a Midrange. Contested by Magic Durant (5.2 feet, ZONE). Ayo Barrett misses. Rebound secured by Dwyane Dosunmu.

[10:03] Team_043 possession (Score: 8-5)
Dwyane Dosunmu drives, Vince Lillard stays with him. Dwyane Dosunmu attempts a Layup. Contested by Vince Lillard (2.5 feet, ZONE). Dwyane Dosunmu misses. Rebound secured by Vince Lillard.

[09:53] Team_099 possession (Score: 8-5)
Larry Wade attempts a Midrange. Contested by Manu Carter (4.5 feet, ZONE). Larry Wade misses. Rebound secured by D'Angelo Iverson.

[09:41] Team_043 possession (Score: 8-5)
Dwyane Dosunmu drives, picks up Larry Wade. Help arrives from Ayo Barrett! Dwyane Dosunmu attempts a Layup. Contested by Ayo Barrett (4.3 feet, MAN). DWYANE DOSUNMU MAKES IT! Assist: D'Angelo Iverson
Score: 10-5

[09:28] Team_099 possession (Score: 10-5)
Larry James attempts a 3Pt. Contested by Magic Durant (5.2 feet, MAN). Larry James misses. Offensive rebound by Vince Lillard! Vince Lillard's putback is no good. Rebound secured by Manu Carter.

[09:11] Team_043 possession (Score: 10-5)
Magic Durant attempts a 3Pt. Contested by Larry James (5.1 feet, MAN). Magic Durant misses. Rebound secured by Vince Lillard.

[08:58] Team_099 possession (Score: 10-5)
Larry James attempts a 3Pt. Contested by D'Angelo Iverson (3.0 feet, ZONE). Larry James misses. Rebound secured by D'Angelo Iverson.

[08:45] Team_043 possession (Score: 10-5)
D'Angelo Iverson attempts a Midrange. Contested by Damian Ginobili (3.6 feet, ZONE). D'Angelo Iverson misses. Rebound secured by Damian Ginobili.

[08:33] Team_099 possession (Score: 10-5)
Damian Ginobili attempts a 3Pt. Contested by Manu Carter (4.4 feet, ZONE). Damian Ginobili misses. Offensive rebound by Vince Lillard! Vince Lillard's putback is no good. Rebound secured by D'Angelo Iverson.

[08:19] Team_043 possession (Score: 10-5)
D'Angelo Iverson drives, Damian Ginobili stays with him. D'Angelo Iverson attempts a Dunk. Contested by Damian Ginobili (3.6 feet, MAN). D'Angelo Iverson misses. Rebound secured by Larry Wade.

[08:04] Team_099 possession (Score: 10-5)
Vince Lillard attempts a Layup. Contested by Dwyane Dosunmu (4.9 feet, ZONE). Vince Lillard misses. FOUL! Loose ball foul on Manu Carter during the rebound battle. [Team fouls: 3] No free throws, side out. (Manu Carter: 3 personal fouls)

[07:46] Team_099 possession (Score: 10-5)
Vince Lillard drives, picks up Manu Carter. Help arrives from Malcolm Murray! Vince Lillard attempts a Layup. Contested by Malcolm Murray (4.2 feet, MAN). VINCE LILLARD MAKES IT! Assist: Damian Ginobili
Score: 10-7

[07:32] Team_043 possession (Score: 10-7)
Magic Durant attempts a 3Pt. Contested by Larry James (5.1 feet, MAN). MAGIC DURANT MAKES IT! Assist: Manu Carter
Score: 13-7

[07:19] Team_099 possession (Score: 13-7)
Larry James attempts a 3Pt. Contested by D'Angelo Iverson (3.0 feet, ZONE). Larry James misses. Rebound secured by D'Angelo Iverson.

[07:05] Team_043 possession (Score: 13-7)
Malcolm Murray attempts a Midrange. Contested by Ayo Barrett (3.8 feet, MAN). MALCOLM MURRAY MAKES IT! Assist: Magic Durant
Score: 15-7

[06:48] Team_099 possession (Score: 15-7)
Ayo Barrett loses the ball! Stripped by Malcolm Murray! TURNOVER! (live ball)

[06:30] Team_043 possession (Score: 15-7)
FOUL! Shooting foul on Vince Lillard. Malcolm Murray to the line for 2 free throws. [Team fouls: 3] (Vince Lillard: 1 personal fouls)   FT 1/2: GOOD   FT 2/2: GOOD Malcolm Murray makes 2/2 from the line.
Score: 17-7

[06:13] Team_099 possession (Score: 17-7)
Larry James drives and kicks out. FOUL! Shooting foul on Magic Durant. Larry James to the line for 2 free throws. [Team fouls: 4] (Magic Durant: 1 personal fouls)   FT 1/2: GOOD   FT 2/2: MISS Larry James makes 1/2 from the line. Offensive rebound by Larry Wade! Larry Wade puts it back in!
Score: 17-10

[06:01] Team_043 possession (Score: 17-10)
Malcolm Murray attempts a 3Pt. Contested by Ayo Barrett (3.8 feet, MAN). Malcolm Murray misses. Rebound secured by Vince Lillard.

[05:49] Team_099 possession (Score: 17-10)
Damian Ginobili attempts a 3Pt. Contested by D'Angelo Iverson (3.1 feet, MAN). Damian Ginobili misses. Offensive rebound by Vince Lillard! Vince Lillard puts it back in!
Score: 17-12

[05:36] Team_043 possession (Score: 17-12)
D'Angelo Iverson attempts a 3Pt. Contested by Ayo Barrett (3.8 feet, ZONE). D'Angelo Iverson misses. Offensive rebound by D'Angelo Iverson! D'Angelo Iverson kicks it out.

[05:21] Team_043 possession (Score: 17-12)
Dwyane Dosunmu drives, picks up Vince Lillard. Help arrives from Ayo Barrett! Dwyane Dosunmu attempts a Dunk. Contested by Ayo Barrett (2.6 feet, ZONE). DWYANE DOSUNMU MAKES IT! Assist: D'Angelo Iverson
Score: 19-12

[05:07] Team_099 possession (Score: 19-12)
Larry James attempts a 3Pt. Contested by D'Angelo Iverson (3.0 feet, ZONE). Larry James misses. Rebound secured by Manu Carter.

[04:49] Team_043 possession (Score: 19-12)
Malcolm Murray drives and kicks out. Magic Durant attempts a Midrange. Contested by Vince Lillard (2.6 feet, ZONE). Magic Durant misses. Rebound secured by Larry Wade.

[04:35] Team_099 possession (Score: 19-12)
Vince Lillard attempts a Midrange. Contested by Manu Carter (4.3 feet, MAN). Vince Lillard misses. Rebound secured by Manu Carter.

[04:23] Team_043 possession (Score: 19-12)
Magic Durant attempts a 3Pt. Contested by Larry James (5.1 feet, MAN). Magic Durant misses. Rebound secured by Vince Lillard.

[04:07] Team_099 possession (Score: 19-12)
Larry Wade attempts a Midrange. Contested by Manu Carter (4.6 feet, MAN). LARRY WADE MAKES IT! Assist: Damian Ginobili
Score: 19-14

[03:52] Team_043 possession (Score: 19-14)
D'Angelo Iverson attempts a 3Pt. Contested by Ayo Barrett (3.9 feet, ZONE). D'Angelo Iverson misses. Rebound secured by Damian Ginobili.

[03:38] Team_099 possession (Score: 19-14)
Ayo Barrett attempts a Midrange. Contested by Malcolm Murray (4.0 feet, MAN). Ayo Barrett misses. Rebound secured by Dwyane Dosunmu.

[03:27] Team_043 possession (Score: 19-14)
FOUL! Shooting foul on Ayo Barrett. D'Angelo Iverson to the line for 2 free throws. [Team fouls: 4] (Ayo Barrett: 2 personal fouls)   FT 1/2: GOOD   FT 2/2: MISS D'Angelo Iverson makes 1/2 from the line. Offensive rebound by Manu Carter! Manu Carter kicks it out.
Score: 20-14

[03:10] Team_043 possession (Score: 20-14)
FOUL! Shooting foul on Vince Lillard. Manu Carter to the line for 2 free throws. [BONUS: 5 team fouls] (Vince Lillard: 2 personal fouls)   FT 1/2: GOOD   FT 2/2: GOOD Manu Carter makes 2/2 from the line.
Score: 22-14

[02:51] Team_099 possession (Score: 22-14)
Larry James drives, Magic Durant stays with him. Larry James attempts a Dunk. Contested by Magic Durant (5.4 feet, MAN). Larry James misses. Rebound secured by D'Angelo Iverson.

[02:38] Team_043 possession (Score: 22-14)
D'Angelo Iverson attempts a 3Pt. Contested by Damian Ginobili (3.9 feet, MAN). D'Angelo Iverson misses. Rebound secured by Damian Ginobili.

[02:28] Team_099 possession (Score: 22-14)
Larry James makes the Layup and draws the foul on Magic Durant! And-1! Larry James to the line for 1. [BONUS: 5 team fouls] (Magic Durant: 2 personal fouls)   FT 1/1: GOOD Larry James makes 1/1 from the line.
Score: 22-17

[02:13] Team_043 possession (Score: 22-17)
Malcolm Murray attempts a 3Pt. Contested by Ayo Barrett (4.1 feet, ZONE). MALCOLM MURRAY MAKES IT! Assist: Manu Carter
Score: 25-17

[01:59] Team_099 possession (Score: 25-17)
FOUL! Holding foul on Manu Carter. [IN THE BONUS! 6 team fouls] Vince Lillard to the line for 2 free throws. (Manu Carter: 4 personal fouls)   FT 1/2: GOOD   FT 2/2: GOOD Vince Lillard makes 2/2 from the line.
Score: 25-19

[01:41] Team_043 possession (Score: 25-19)
FOUL! Holding foul on Larry Wade. [IN THE BONUS! 6 team fouls] Dwyane Dosunmu to the line for 2 free throws. (Larry Wade: 1 personal fouls)   FT 1/2: MISS   FT 2/2: GOOD Dwyane Dosunmu makes 1/2 from the line.
Score: 26-19

[01:23] Team_099 possession (Score: 26-19)
Larry James attempts a Midrange. Contested by Magic Durant (5.6 feet, MAN). Larry James misses. Rebound secured by Manu Carter.

[01:08] Team_043 possession (Score: 26-19)
D'Angelo Iverson attempts a Layup. BLOCKED BY VINCE LILLARD! Ball is loose! Rebound secured by Damian Ginobili.

[00:50] Team_099 possession (Score: 26-19)
FOUL! Holding foul on D'Angelo Iverson. [IN THE BONUS! 7 team fouls] Damian Ginobili to the line for 2 free throws. (D'Angelo Iverson: 1 personal fouls)   FT 1/2: GOOD   FT 2/2: GOOD Damian Ginobili makes 2/2 from the line.
Score: 26-21

[00:33] Team_043 possession (Score: 26-21)
D'Angelo Iverson drives to the basket... FOUL! Offensive foul on D'Angelo Iverson! Vince Lillard drew the charge! [Team fouls: 8] (D'Angelo Iverson: 2 personal fouls) TURNOVER! (dead ball)

[00:20] Team_099 possession (Score: 26-21)
Damian Ginobili drives, D'Angelo Iverson stays with him. Damian Ginobili attempts a Dunk. Contested by D'Angelo Iverson (3.6 feet, MAN). DAMIAN GINOBILI MAKES IT! Assist: Larry James
Score: 26-23

[00:06] Team_043 possession (Score: 26-23)
D'Angelo Iverson attempts a 3Pt. Contested by Ayo Barrett (4.3 feet, ZONE). D'Angelo Iverson misses. Rebound secured by Vince Lillard.

================================================================================
                              1ST QUARTER COMPLETE                              
================================================================================

1ST QUARTER SCORE: Team_043 26, Team_099 23

BOX SCORE:
================================================================================

Team_043
--------------------------------------------------------------------------------
Player                MIN  PTS  REB  AST  TO      FG   FG%      3P   3P%
--------------------------------------------------------------------------------
Magic Durant           12    8    0    1   0   3/5    60.0     0/0   0.0
Malcolm Murray         12    7    0    0   0   3/5    60.0     0/0   0.0
Manu Carter            12    5    5    3   0   2/3    66.7     0/0   0.0
Dwyane Dosunmu         12    5    3    0   0   3/4    75.0     0/0   0.0
D'Angelo Iverson       12    0    6    2   0   0/6     0.0     0/0   0.0

TEAM: FG: 11/23 (47.8%), 3PT: 3/9 (33.3%), REB: 12 (2 off, 10 def), AST: 6, TO: 1
TEAM FOULS: 8 [Team_099 in BONUS]


Team_099
--------------------------------------------------------------------------------
Player                MIN  PTS  REB  AST  TO      FG   FG%      3P   3P%
--------------------------------------------------------------------------------
Vince Lillard          12    9    7    0   0   4/5    80.0     0/0   0.0
Larry Wade             12    7    3    0   0   3/5    60.0     0/0   0.0
Damian Ginobili        12    4    4    2   0   2/3    66.7     0/0   0.0
Larry James            12    3    0    1   0   1/7    14.3     0/0   0.0
Ayo Barrett            12    0    0    0   0   0/2     0.0     0/0   0.0

TEAM: FG: 10/22 (45.5%), 3PT: 1/7 (14.3%), REB: 16 (4 off, 12 def), AST: 3, TO: 1
TEAM FOULS: 6 [Team_043 in BONUS]

================================================================================

================================================================================
                       2ND QUARTER - Team_043 vs Team_099                       
================================================================================

[12:00] Team_043 possession (Score: 26-23)
FOUL! Shooting foul on Ayo Barrett. Manu Carter to the line for 3 free throws. [Team fouls: 1] (Ayo Barrett: 1 personal fouls)   FT 1/3: GOOD   FT 2/3: MISS   FT 3/3: MISS Manu Carter makes 1/3 from the line. Rebound secured by Damian Ginobili.
Score: 27-23

[11:45] Team_099 possession (Score: 27-23)
Larry Wade attempts a Midrange. Contested by Manu Carter (4.8 feet, ZONE). LARRY WADE MAKES IT!
Score: 27-25

[11:31] Team_043 possession (Score: 27-25)
Manu Carter attempts a Midrange. Contested by Vince Lillard (3.4 feet, MAN). MANU CARTER MAKES IT! Assist: D'Angelo Iverson
Score: 29-25

[11:18] Team_099 possession (Score: 29-25)
Vince Lillard drives and kicks out. Damian Ginobili attempts a 3Pt. Contested by D'Angelo Iverson (3.3 feet, ZONE). DAMIAN GINOBILI MAKES IT!
Score: 29-28

[11:05] Team_043 possession (Score: 29-28)
Manu Carter attempts a Layup. BLOCKED BY VINCE LILLARD! Ball is loose! Offensive rebound by Manu Carter! Manu Carter kicks it out.

[10:52] Team_043 possession (Score: 29-28)
Dwyane Dosunmu drives to the basket... Dwyane Dosunmu throws a bad pass out of bounds! TURNOVER! (dead ball)

[10:52] Substitution (Team_043): Malcolm Murray OUT → Jabari Holiday IN (stamina_rule2)

[10:52] Substitution (Team_043): Magic Durant OUT → Ben LaVine IN (stamina_rule2)

[10:52] Substitution (Team_043): D'Angelo Iverson OUT → Dirk Herro IN (stamina_rule2)

[10:52] Substitution (Team_043): Manu Carter OUT → Joel Murray IN (stamina_rule2)

[10:52] Substitution (Team_043): Dwyane Dosunmu OUT → Terry Randle IN (stamina_rule2)

[10:52] Substitution (Team_099): Ayo Barrett OUT → CJ Cunningham IN (stamina_rule2)

[10:52] Substitution (Team_099): Larry James OUT → Manu Johnson IN (stamina_rule2)

[10:52] Substitution (Team_099): Damian Ginobili OUT → Scottie Quickley IN (stamina_rule2)

[10:52] Substitution (Team_099): Vince Lillard OUT → Donovan Green IN (stamina_rule2)

[10:52] Substitution (Team_099): Larry Wade OUT → Jarrett Fox IN (stamina_rule2)

[10:33] Team_099 possession (Score: 29-28)
Scottie Quickley attempts a 3Pt. Contested by Dirk Herro (4.3 feet, MAN). Scottie Quickley misses. Rebound secured by Terry Randle.

[10:21] Team_043 possession (Score: 29-28)
Jabari Holiday drives and kicks out. Joel Murray attempts a Midrange. Contested by Manu Johnson (4.9 feet, ZONE). Joel Murray misses. Rebound secured by Jarrett Fox.

[10:06] Team_099 possession (Score: 29-28)
Donovan Green drives, Joel Murray stays with him. Donovan Green attempts a Layup. Contested by Joel Murray (5.8 feet, MAN). DONOVAN GREEN MAKES IT! Assist: Jarrett Fox
Score: 29-30

[09:51] Team_043 possession (Score: 29-30)
Jabari Holiday attempts a 3Pt. Wide open! CJ Cunningham is 6.3 feet away. [MAN] Jabari Holiday misses. Rebound secured by Jarrett Fox.

[09:41] Team_099 possession (Score: 29-30)
Donovan Green attempts a 3Pt. Contested by Dirk Herro (4.1 feet, ZONE). DONOVAN GREEN MAKES IT! Assist: Manu Johnson
Score: 29-33

[09:29] Team_043 possession (Score: 29-33)
FOUL! Reach-in foul on CJ Cunningham during the drive. [Team fouls: 3] No free throws, side out. (CJ Cunningham: 1 personal fouls)

[09:15] Team_043 possession (Score: 29-33)
Terry Randle drives to the basket... Terry Randle throws a bad pass! Stolen by Jarrett Fox! TURNOVER! (live ball)

[09:02] Team_099 possession (Score: 29-33)
Donovan Green drives to the basket... Donovan Green throws a bad pass! Stolen by Terry Randle! TURNOVER! (live ball)

[08:46] Team_043 possession (Score: 29-33)
Dirk Herro drives, picks up Scottie Quickley. Help arrives from Manu Johnson! Dirk Herro attempts a Dunk. Contested by Manu Johnson (4.3 feet, MAN). Dirk Herro misses. Offensive rebound by Dirk Herro! Dirk Herro puts it back in!
Score: 31-33

[08:32] Team_099 possession (Score: 31-33)
Donovan Green attempts a 3Pt. Contested by Ben LaVine (5.2 feet, ZONE). Donovan Green misses. Rebound secured by Ben LaVine.

[08:14] Team_043 possession (Score: 31-33)
Dirk Herro attempts a 3Pt. Contested by Scottie Quickley (4.3 feet, MAN). Dirk Herro misses. Rebound secured by Jarrett Fox.

[08:01] Team_099 possession (Score: 31-33)
FOUL! Shooting foul on Terry Randle. Donovan Green to the line for 2 free throws. [Team fouls: 1] (Terry Randle: 1 personal fouls)   FT 1/2: GOOD   FT 2/2: GOOD Donovan Green makes 2/2 from the line.
Score: 31-35

[07:50] Team_043 possession (Score: 31-35)
Jabari Holiday drives, picks up CJ Cunningham. Help arrives from Scottie Quickley! Jabari Holiday attempts a Layup. Wide open! Scottie Quickley is 6.3 feet away. [MAN] JABARI HOLIDAY MAKES IT!
Score: 33-35

[07:34] Team_099 possession (Score: 33-35)
Donovan Green makes the Dunk and draws the foul on Terry Randle! And-1! Donovan Green to the line for 1. [Team fouls: 2] (Terry Randle: 2 personal fouls)   FT 1/1: MISS Donovan Green makes 0/1 from the line. Rebound secured by Dirk Herro.
Score: 33-37

[07:25] Team_043 possession (Score: 33-37)
Dirk Herro drives and kicks out. Joel Murray attempts a 3Pt. Contested by Donovan Green (3.9 feet, MAN). Joel Murray misses. Rebound secured by Scottie Quickley.

[07:09] Team_099 possession (Score: 33-37)
Jarrett Fox throws a bad pass! Stolen by Terry Randle! TURNOVER! (live ball)

[06:56] Team_043 possession (Score: 33-37)
FOUL! Reach-in foul on Donovan Green during the drive. [Team fouls: 4] No free throws, side out. (Donovan Green: 1 personal fouls)

[06:43] Team_043 possession (Score: 33-37)
Joel Murray attempts a Midrange. Contested by Donovan Green (4.2 feet, ZONE). Joel Murray misses. Rebound secured by Jarrett Fox.

[06:27] Team_099 possession (Score: 33-37)
Manu Johnson attempts a Midrange. Contested by Ben LaVine (5.2 feet, MAN). Manu Johnson misses. Rebound secured by Ben LaVine.

[06:14] Team_043 possession (Score: 33-37)
Dirk Herro attempts a Layup. BLOCKED BY MANU JOHNSON! Ball goes out off Manu Johnson. Dirk Herro's ball!

[05:58] Team_043 possession (Score: 33-37)
Dirk Herro throws a bad pass! Stolen by Scottie Quickley! TURNOVER! (live ball)

[05:43] Team_099 possession (Score: 33-37)
Scottie Quickley attempts a 3Pt. Contested by Dirk Herro (4.3 feet, MAN). Scottie Quickley misses. Offensive rebound by Jarrett Fox! Jarrett Fox's putback is no good. Rebound secured by Dirk Herro.

[05:28] Team_043 possession (Score: 33-37)
Jabari Holiday attempts a 3Pt. Wide open! CJ Cunningham is 6.3 feet away. [MAN] Jabari Holiday misses. Rebound secured by Jarrett Fox.

[05:13] Team_099 possession (Score: 33-37)
Manu Johnson drives and kicks out. CJ Cunningham attempts a 3Pt. Contested by Dirk Herro (4.0 feet, ZONE). CJ Cunningham misses. FOUL! Loose ball foul on Ben LaVine during the rebound battle. [Team fouls: 3] No free throws, side out. (Ben LaVine: 1 personal fouls)

[04:55] Team_099 possession (Score: 33-37)
Jarrett Fox drives and kicks out. Scottie Quickley attempts a 3Pt. Contested by Dirk Herro (4.0 feet, ZONE). Scottie Quickley misses. Offensive rebound by Donovan Green! Donovan Green kicks it out.

[04:40] Team_099 possession (Score: 33-37)
Donovan Green attempts a Midrange. Contested by Joel Murray (5.8 feet, ZONE). Donovan Green misses. Rebound secured by Terry Randle.

[04:25] Team_043 possession (Score: 33-37)
Joel Murray attempts a 3Pt. Contested by Donovan Green (4.2 feet, MAN). Joel Murray misses. Rebound secured by Jarrett Fox.

[04:10] Team_099 possession (Score: 33-37)
FOUL! Reach-in foul on Terry Randle during the drive. [Team fouls: 4] No free throws, side out. (Terry Randle: 3 personal fouls)

[03:56] Team_099 possession (Score: 33-37)
Donovan Green drives, Terry Randle stays with him. Donovan Green attempts a Dunk. Contested by Terry Randle (4.5 feet, ZONE). Donovan Green misses. Rebound secured by Terry Randle.

[03:39] Team_043 possession (Score: 33-37)
FOUL! Shooting foul on Manu Johnson. Dirk Herro to the line for 3 free throws. [BONUS: 5 team fouls] (Manu Johnson: 1 personal fouls)   FT 1/3: GOOD   FT 2/3: GOOD   FT 3/3: GOOD Dirk Herro makes 3/3 from the line.
Score: 36-37

[03:24] Team_099 possession (Score: 36-37)
Manu Johnson attempts a 3Pt. Contested by Ben LaVine (5.2 feet, MAN). Manu Johnson misses. FOUL! Loose ball foul on Terry Randle during the rebound battle. [IN THE BONUS! 5 team fouls] Donovan Green to the line for 2 free throws. (Terry Randle: 4 personal fouls)   FT 1/2: GOOD   FT 2/2: MISS Donovan Green makes 1/2 from the line. Rebound secured by Ben LaVine.
Score: 36-38

[03:08] Team_043 possession (Score: 36-38)
Jabari Holiday attempts a Midrange. Wide open! CJ Cunningham is 6.3 feet away. [MAN] Jabari Holiday misses. Rebound secured by Donovan Green.

[02:53] Team_099 possession (Score: 36-38)
FOUL! Reach-in foul on Terry Randle during the drive. [IN THE BONUS! 6 team fouls] Scottie Quickley to the line for 2 free throws. (Terry Randle: 5 personal fouls)   FT 1/2: MISS   FT 2/2: GOOD Scottie Quickley makes 1/2 from the line.
Score: 36-39

[02:40] Team_043 possession (Score: 36-39)
Joel Murray drives to the basket... Joel Murray loses control! Ball rolls out of bounds! TURNOVER! (dead ball)

[02:27] Team_099 possession (Score: 36-39)
Donovan Green attempts a Midrange. Contested by Joel Murray (5.9 feet, MAN). Donovan Green misses. Rebound secured by Ben LaVine.

[02:16] Team_043 possession (Score: 36-39)
Joel Murray attempts a Midrange. Contested by Manu Johnson (5.3 feet, ZONE). JOEL MURRAY MAKES IT!
Score: 38-39

[02:02] Team_099 possession (Score: 38-39)
Donovan Green drives, picks up Joel Murray. Help arrives from Ben LaVine! Donovan Green attempts a Dunk. Contested by Ben LaVine (6.0 feet, MAN). DONOVAN GREEN MAKES IT! Assist: Scottie Quickley
Score: 38-41

[01:46] Team_043 possession (Score: 38-41)
Joel Murray attempts a 3Pt. Contested by Manu Johnson (5.4 feet, ZONE). JOEL MURRAY MAKES IT! Assist: Ben LaVine
Score: 41-41

[01:29] Team_099 possession (Score: 41-41)
CJ Cunningham drives to the basket... CJ Cunningham loses the ball! Stripped by Terry Randle! TURNOVER! (live ball)

[01:15] Team_043 possession (Score: 41-41)
Joel Murray drives and kicks out. Dirk Herro attempts a 3Pt. Contested by Manu Johnson (5.1 feet, ZONE). DIRK HERRO MAKES IT!
Score: 44-41

[01:03] Team_099 possession (Score: 44-41)
Scottie Quickley attempts a 3Pt. Contested by Dirk Herro (4.5 feet, ZONE). SCOTTIE QUICKLEY MAKES IT! Assist: Donovan Green
Score: 44-44

[00:48] Team_043 possession (Score: 44-44)
Jabari Holiday attempts a 3Pt. Contested by Manu Johnson (5.6 feet, ZONE). Jabari Holiday misses. Offensive rebound by Dirk Herro! Dirk Herro puts it back in!
Score: 46-44

[00:34] Team_099 possession (Score: 46-44)
Manu Johnson attempts a Midrange. Contested by Ben LaVine (5.4 feet, MAN). MANU JOHNSON MAKES IT! Assist: CJ Cunningham
Score: 46-46

[00:24] Team_043 possession (Score: 46-46)
Joel Murray attempts a Midrange. Contested by Donovan Green (4.5 feet, ZONE). Joel Murray misses. Offensive rebound by Terry Randle! Terry Randle kicks it out.

[00:08] Team_043 possession (Score: 46-46)
Joel Murray attempts a Midrange. Contested by Donovan Green (4.5 feet, ZONE). Joel Murray misses. Rebound secured by Donovan Green.

================================================================================
                              2ND QUARTER COMPLETE                              
================================================================================

2ND QUARTER SCORE: Team_043 20, Team_099 23

BOX SCORE:
================================================================================

Team_043
--------------------------------------------------------------------------------
Player                MIN  PTS  REB  AST  TO      FG   FG%      3P   3P%
--------------------------------------------------------------------------------
Dirk Herro             11   10    4    0   0   4/6    66.7     0/0   0.0
Joel Murray            11    5    0    0   0   2/5    40.0     0/0   0.0
Manu Carter            14    2    1    0   0   1/2    50.0     0/0   0.0
Jabari Holiday         11    2    0    0   0   1/5    20.0     0/0   0.0
D'Angelo Iverson       14    0    0    1   0   0/0     0.0     0/0   0.0
Terry Randle           11    0    4    0   0   0/0     0.0     0/0   0.0
Ben LaVine             11    0    4    1   0   0/0     0.0     0/0   0.0

TEAM: FG: 8/18 (44.4%), 3PT: 3/8 (37.5%), REB: 11 (4 off, 7 def), AST: 2, TO: 4
TEAM FOULS: 6 [Team_099 in BONUS]


Team_099
--------------------------------------------------------------------------------
Player                MIN  PTS  REB  AST  TO      FG   FG%      3P   3P%
--------------------------------------------------------------------------------
Donovan Green          11    9    3    1   0   4/9    44.4     0/0   0.0
Scottie Quickley       11    4    1    1   0   2/4    50.0     0/0   0.0
Damian Ginobili        14    3    1    0   0   1/1   100.0     0/0   0.0
Larry Wade             14    2    0    0   0   1/1   100.0     0/0   0.0
Manu Johnson           11    2    0    1   0   1/3    33.3     0/0   0.0
Jarrett Fox            11    0    7    1   0   0/0     0.0     0/0   0.0
CJ Cunningham          11    0    0    1   0   0/0     0.0     0/0   0.0

TEAM: FG: 9/18 (50.0%), 3PT: 2/6 (33.3%), REB: 14 (4 off, 10 def), AST: 5, TO: 3
TEAM FOULS: 5 [Team_043 in BONUS]

================================================================================

================================================================================
                       3RD QUARTER - Team_043 vs Team_099                       
================================================================================

[12:00] Team_043 possession (Score: 46-46)
Dwyane Dosunmu loses control! Ball rolls out of bounds! TURNOVER! (dead ball)

[11:42] Team_099 possession (Score: 46-46)
Vince Lillard makes the Layup and draws the foul on Manu Carter! And-1! Vince Lillard to the line for 1. [Team fouls: 1] (Manu Carter: 1 personal fouls)   FT 1/1: GOOD Vince Lillard makes 1/1 from the line.
Score: 46-49

[11:28] Team_043 possession (Score: 46-49)
D'Angelo Iverson attempts a Midrange. Contested by Damian Ginobili (3.6 feet, ZONE). D'Angelo Iverson misses. Rebound secured by Damian Ginobili.

[11:14] Team_099 possession (Score: 46-49)
Larry James drives and kicks out. FOUL! Shooting foul on Manu Carter. Larry Wade to the line for 2 free throws. [Team fouls: 2] (Manu Carter: 2 personal fouls)   FT 1/2: GOOD   FT 2/2: GOOD Larry Wade makes 2/2 from the line.
Score: 46-51

[10:59] Team_043 possession (Score: 46-51)
Magic Durant attempts a 3Pt. Contested by Larry James (5.1 feet, MAN). Magic Durant misses. Rebound secured by Vince Lillard.

[10:43] Team_099 possession (Score: 46-51)
Larry James attempts a 3Pt. Contested by D'Angelo Iverson (3.0 feet, ZONE). LARRY JAMES MAKES IT! Assist: Larry Wade
Score: 46-54

[10:25] Team_043 possession (Score: 46-54)
Dwyane Dosunmu attempts a Layup. Contested by Larry Wade (4.3 feet, MAN). DWYANE DOSUNMU MAKES IT!
Score: 48-54

[10:07] Team_099 possession (Score: 48-54)
Vince Lillard drives to the basket... Vince Lillard throws a bad pass out of bounds! TURNOVER! (dead ball)

[09:49] Team_043 possession (Score: 48-54)
FOUL! Holding foul on Damian Ginobili. [Team fouls: 1] No free throws, side out. (Damian Ginobili: 1 personal fouls)

[09:34] Team_043 possession (Score: 48-54)
D'Angelo Iverson drives to the basket... D'Angelo Iverson loses the ball! Stripped by Damian Ginobili! TURNOVER! (live ball)

[09:20] Team_099 possession (Score: 48-54)
Ayo Barrett drives, Malcolm Murray stays with him. Ayo Barrett attempts a Dunk. Contested by Malcolm Murray (3.8 feet, MAN). AYO BARRETT MAKES IT! Assist: Damian Ginobili
Score: 48-56

[09:08] Team_043 possession (Score: 48-56)
Manu Carter makes the Layup and draws the foul on Vince Lillard! And-1! Manu Carter to the line for 1. [Team fouls: 2] (Vince Lillard: 1 personal fouls)   FT 1/1: GOOD Manu Carter makes 1/1 from the line.
Score: 51-56

[08:53] Team_099 possession (Score: 51-56)
Larry Wade drives to the basket... Larry Wade loses control! Ball rolls out of bounds! TURNOVER! (dead ball)

[08:36] Team_043 possession (Score: 51-56)
D'Angelo Iverson drives, picks up Vince Lillard. Help arrives from Ayo Barrett! D'Angelo Iverson attempts a Dunk. Contested by Ayo Barrett (2.6 feet, ZONE). D'ANGELO IVERSON MAKES IT!
Score: 53-56

[08:18] Team_099 possession (Score: 53-56)
Larry Wade attempts a Midrange. Contested by Manu Carter (4.5 feet, MAN). Larry Wade misses. Rebound secured by Dwyane Dosunmu.

[08:04] Team_043 possession (Score: 53-56)
FOUL! Reach-in foul on Vince Lillard during the drive. [Team fouls: 3] No free throws, side out. (Vince Lillard: 2 personal fouls)

[07:45] Team_043 possession (Score: 53-56)
Dwyane Dosunmu attempts a Midrange. Contested by Larry Wade (4.3 feet, MAN). Dwyane Dosunmu misses. Rebound secured by Larry Wade.

[07:30] Team_099 possession (Score: 53-56)
Damian Ginobili attempts a 3Pt. Contested by Manu Carter (4.4 feet, ZONE). Damian Ginobili misses. Rebound secured by Dwyane Dosunmu.

[07:14] Team_043 possession (Score: 53-56)
Malcolm Murray attempts a Midrange. Contested by Ayo Barrett (3.8 feet, MAN). Malcolm Murray misses. Rebound secured by Damian Ginobili.

[07:03] Team_099 possession (Score: 53-56)
Damian Ginobili drives, D'Angelo Iverson stays with him. Damian Ginobili attempts a Layup. Contested by D'Angelo Iverson (3.1 feet, MAN). DAMIAN GINOBILI MAKES IT! Assist: Ayo Barrett
Score: 53-58

[06:47] Team_043 possession (Score: 53-58)
Malcolm Murray attempts a Midrange. Contested by Ayo Barrett (3.8 feet, MAN). Malcolm Murray misses. Rebound secured by Damian Ginobili.

[06:30] Team_099 possession (Score: 53-58)
Larry James drives and kicks out. Vince Lillard attempts a Midrange. Contested by D'Angelo Iverson (2.9 feet, ZONE). Vince Lillard misses. Offensive rebound by Vince Lillard! Vince Lillard puts it back in!
Score: 53-60

[06:15] Team_043 possession (Score: 53-60)
Dwyane Dosunmu drives, picks up Larry Wade. Help arrives from Ayo Barrett! Dwyane Dosunmu attempts a Layup. Contested by Ayo Barrett (4.3 feet, MAN). Dwyane Dosunmu misses. Rebound secured by Vince Lillard.

[06:00] Team_099 possession (Score: 53-60)
Larry Wade attempts a 3Pt. Contested by D'Angelo Iverson (3.2 feet, ZONE). LARRY WADE MAKES IT! Assist: Larry James
Score: 53-63

[05:45] Team_043 possession (Score: 53-63)
Manu Carter makes the Layup and draws the foul on Vince Lillard! And-1! Manu Carter to the line for 1. [Team fouls: 4] (Vince Lillard: 3 personal fouls)   FT 1/1: GOOD Manu Carter makes 1/1 from the line.
Score: 56-63

[05:28] Team_099 possession (Score: 56-63)
FOUL! Holding foul on Manu Carter. [Team fouls: 3] No free throws, side out. (Manu Carter: 3 personal fouls)

[05:13] Team_099 possession (Score: 56-63)
Larry Wade attempts a Layup. Contested by Manu Carter (4.5 feet, ZONE). LARRY WADE MAKES IT!
Score: 56-65

[04:54] Team_043 possession (Score: 56-65)
Dwyane Dosunmu drives and kicks out. Manu Carter attempts a 3Pt. Contested by Ayo Barrett (3.7 feet, ZONE). Manu Carter misses. Rebound secured by Damian Ginobili.

[04:40] Team_099 possession (Score: 56-65)
Damian Ginobili attempts a 3Pt. Contested by D'Angelo Iverson (3.1 feet, ZONE). Damian Ginobili misses. Rebound secured by D'Angelo Iverson.

[04:23] Team_043 possession (Score: 56-65)
FOUL! Shooting foul on Vince Lillard. Dwyane Dosunmu to the line for 2 free throws. [BONUS: 5 team fouls] (Vince Lillard: 4 personal fouls)   FT 1/2: GOOD   FT 2/2: GOOD Dwyane Dosunmu makes 2/2 from the line.
Score: 58-65

[04:06] Team_099 possession (Score: 58-65)
Larry Wade attempts a 3Pt. Contested by D'Angelo Iverson (3.2 feet, ZONE). Larry Wade misses. Rebound secured by Manu Carter.

[03:52] Team_043 possession (Score: 58-65)
Manu Carter attempts a Midrange. Contested by Vince Lillard (3.1 feet, MAN). Manu Carter misses. Rebound secured by Damian Ginobili.

[03:38] Team_099 possession (Score: 58-65)
Damian Ginobili attempts a Midrange. Contested by D'Angelo Iverson (3.2 feet, MAN). Damian Ginobili misses. Rebound secured by D'Angelo Iverson.

[03:22] Team_043 possession (Score: 58-65)
Dwyane Dosunmu attempts a Layup. Contested by Larry Wade (4.4 feet, MAN). DWYANE DOSUNMU MAKES IT! Assist: Malcolm Murray
Score: 60-65

[03:09] Team_099 possession (Score: 60-65)
Larry James drives to the basket... Larry James throws a bad pass out of bounds! TURNOVER! (dead ball)

[02:55] Team_043 possession (Score: 60-65)
Dwyane Dosunmu throws a bad pass! Stolen by Larry Wade! TURNOVER! (live ball)

[02:44] Team_099 possession (Score: 60-65)
Larry James drives, picks up Magic Durant. Help arrives from D'Angelo Iverson! Larry James attempts a Layup. Contested by D'Angelo Iverson (5.4 feet, MAN). LARRY JAMES MAKES IT! Assist: Ayo Barrett
Score: 60-67

[02:28] Team_043 possession (Score: 60-67)
Magic Durant attempts a 3Pt. Contested by Larry James (5.2 feet, MAN). MAGIC DURANT MAKES IT! Assist: Malcolm Murray
Score: 63-67

[02:11] Team_099 possession (Score: 63-67)
Larry James attempts a Layup. Contested by Manu Carter (4.5 feet, ZONE). LARRY JAMES MAKES IT!
Score: 63-69

[01:55] Team_043 possession (Score: 63-69)
Manu Carter attempts a Midrange. Contested by Larry James (5.7 feet, ZONE). Manu Carter misses. Rebound secured by Vince Lillard.

[01:39] Team_099 possession (Score: 63-69)
Larry Wade attempts a Midrange. Contested by Manu Carter (4.8 feet, ZONE). Larry Wade misses. Rebound secured by Manu Carter.

[01:23] Team_043 possession (Score: 63-69)
Magic Durant attempts a 3Pt. Contested by Larry James (5.3 feet, MAN). MAGIC DURANT MAKES IT!
Score: 66-69

[01:05] Team_099 possession (Score: 66-69)
Vince Lillard drives and kicks out. Larry James attempts a Midrange. Contested by Magic Durant (5.5 feet, ZONE). Larry James misses. Rebound secured by Manu Carter.

[00:48] Team_043 possession (Score: 66-69)
FOUL! Offensive foul on D'Angelo Iverson! Damian Ginobili drew the charge! [Team fouls: 4] (D'Angelo Iverson: 1 personal fouls) TURNOVER! (dead ball)

[00:36] Team_099 possession (Score: 66-69)
Damian Ginobili drives, Manu Carter stays with him. Damian Ginobili attempts a Dunk. Contested by Manu Carter (4.8 feet, ZONE). DAMIAN GINOBILI MAKES IT! Assist: Vince Lillard
Score: 66-71

[00:19] Team_043 possession (Score: 66-71)
Dwyane Dosunmu attempts a Layup. Contested by Vince Lillard (3.1 feet, ZONE). DWYANE DOSUNMU MAKES IT!
Score: 68-71

[00:03] Team_099 possession (Score: 68-71)
Larry James attempts a 3Pt. Contested by Magic Durant (5.6 feet, MAN). LARRY JAMES MAKES IT! Assist: Ayo Barrett
Score: 68-74

================================================================================
                              3RD QUARTER COMPLETE                              
================================================================================

3RD QUARTER SCORE: Team_043 22, Team_099 28

BOX SCORE:
================================================================================

Team_043
--------------------------------------------------------------------------------
Player                MIN  PTS  REB  AST  TO      FG   FG%      3P   3P%
--------------------------------------------------------------------------------
Dwyane Dosunmu         26    8    2    0   0   4/7    57.1     0/0   0.0
Magic Durant           26    6    0    0   0   2/3    66.7     0/0   0.0
Manu Carter            26    6    3    0   0   2/4    50.0     0/0   0.0
D'Angelo Iverson       26    2    2    0   0   1/2    50.0     0/0   0.0
Malcolm Murray         26    0    0    2   0   0/2     0.0     0/0   0.0

TEAM: FG: 9/18 (50.0%), 3PT: 2/3 (66.7%), REB: 7 (0 off, 7 def), AST: 2, TO: 4
TEAM FOULS: 4


Team_099
--------------------------------------------------------------------------------
Player                MIN  PTS  REB  AST  TO      FG   FG%      3P   3P%
--------------------------------------------------------------------------------
Larry James            26   10    0    1   0   4/4   100.0     0/0   0.0
Larry Wade             26    7    1    1   0   3/6    50.0     0/0   0.0
Vince Lillard          26    5    4    1   0   2/3    66.7     0/0   0.0
Damian Ginobili        26    4    5    1   0   2/5    40.0     0/0   0.0
Ayo Barrett            26    2    0    3   0   1/1   100.0     0/0   0.0

TEAM: FG: 12/19 (63.2%), 3PT: 3/6 (50.0%), REB: 10 (1 off, 9 def), AST: 7, TO: 3
TEAM FOULS: 5 [Team_043 in BONUS]

================================================================================

================================================================================
                       4TH QUARTER - Team_043 vs Team_099                       
================================================================================

[12:00] Team_043 possession (Score: 68-74)
Magic Durant drives, Vince Lillard stays with him. Magic Durant attempts a Dunk. Contested by Vince Lillard (2.8 feet, ZONE). MAGIC DURANT MAKES IT!
Score: 70-74

[11:43] Team_099 possession (Score: 70-74)
Larry James drives and kicks out. Larry James makes the Midrange and draws the foul on D'Angelo Iverson! And-1! Larry James to the line for 1. [Team fouls: 1] (D'Angelo Iverson: 1 personal fouls)   FT 1/1: GOOD Larry James makes 1/1 from the line.
Score: 70-77

[11:32] Team_043 possession (Score: 70-77)
Magic Durant attempts a 3Pt. Contested by Ayo Barrett (3.9 feet, ZONE). MAGIC DURANT MAKES IT! Assist: Manu Carter
Score: 73-77

[11:17] Team_099 possession (Score: 73-77)
FOUL! Holding foul on D'Angelo Iverson. [Team fouls: 2] No free throws, side out. (D'Angelo Iverson: 2 personal fouls)

[11:01] Team_099 possession (Score: 73-77)
Damian Ginobili attempts a 3Pt. Contested by D'Angelo Iverson (3.4 feet, MAN). Damian Ginobili misses. Rebound secured by Manu Carter.

[10:43] Team_043 possession (Score: 73-77)
D'Angelo Iverson attempts a 3Pt. Contested by Damian Ginobili (4.0 feet, MAN). D'Angelo Iverson misses. Rebound secured by Vince Lillard.

[10:31] Team_099 possession (Score: 73-77)
FOUL! Shooting foul on Manu Carter. Vince Lillard to the line for 2 free throws. [Team fouls: 3] (Manu Carter: 1 personal fouls)   FT 1/2: GOOD   FT 2/2: GOOD Vince Lillard makes 2/2 from the line.
Score: 73-79

[10:15] Team_043 possession (Score: 73-79)
Magic Durant makes the Layup and draws the foul on Larry James! And-1! Magic Durant to the line for 1. [Team fouls: 1] (Larry James: 1 personal fouls)   FT 1/1: MISS Magic Durant makes 0/1 from the line. Rebound secured by Larry Wade.
Score: 75-79

[10:03] Team_099 possession (Score: 75-79)
FOUL! Shooting foul on Manu Carter. Vince Lillard to the line for 2 free throws. [Team fouls: 4] (Manu Carter: 2 personal fouls)   FT 1/2: GOOD   FT 2/2: MISS Vince Lillard makes 1/2 from the line. Rebound secured by D'Angelo Iverson.
Score: 75-80

[09:50] Team_043 possession (Score: 75-80)
Dwyane Dosunmu drives, picks up Vince Lillard. Help arrives from Ayo Barrett! Dwyane Dosunmu attempts a Dunk. Contested by Ayo Barrett (3.2 feet, ZONE). Dwyane Dosunmu misses. Rebound secured by Vince Lillard.

[09:35] Team_099 possession (Score: 75-80)
Ayo Barrett drives, picks up Malcolm Murray. Help arrives from D'Angelo Iverson! Ayo Barrett attempts a Layup. Contested by D'Angelo Iverson (4.3 feet, MAN). AYO BARRETT MAKES IT! Assist: Vince Lillard
Score: 75-82

[09:18] Team_043 possession (Score: 75-82)
Dwyane Dosunmu attempts a Midrange. Contested by Ayo Barrett (4.2 feet, ZONE). DWYANE DOSUNMU MAKES IT!
Score: 77-82

[09:02] Team_099 possession (Score: 77-82)
Damian Ginobili attempts a 3Pt. Contested by D'Angelo Iverson (3.7 feet, MAN). Damian Ginobili misses. Rebound secured by Dwyane Dosunmu.

[08:44] Team_043 possession (Score: 77-82)
Magic Durant drives to the basket... Magic Durant throws a bad pass out of bounds! TURNOVER! (dead ball)

[08:44] Substitution (Team_043): Malcolm Murray OUT → Jabari Holiday IN (stamina_rule2)

[08:44] Substitution (Team_043): Magic Durant OUT → Ben LaVine IN (stamina_rule2)

[08:44] Substitution (Team_043): D'Angelo Iverson OUT → Dirk Herro IN (stamina_rule2)

[08:44] Substitution (Team_043): Manu Carter OUT → Joel Murray IN (stamina_rule2)

[08:44] Substitution (Team_043): Dwyane Dosunmu OUT → Terry Randle IN (stamina_rule2)

[08:44] Substitution (Team_099): Ayo Barrett OUT → CJ Cunningham IN (stamina_rule2)

[08:44] Substitution (Team_099): Larry James OUT → Manu Johnson IN (stamina_rule2)

[08:44] Substitution (Team_099): Damian Ginobili OUT → Scottie Quickley IN (stamina_rule2)

[08:44] Substitution (Team_099): Vince Lillard OUT → Donovan Green IN (stamina_rule2)

[08:44] Substitution (Team_099): Larry Wade OUT → Jarrett Fox IN (stamina_rule2)

[08:28] Team_099 possession (Score: 77-82)
Scottie Quickley attempts a 3Pt. Contested by Dirk Herro (4.3 feet, MAN). Scottie Quickley misses. Offensive rebound by Donovan Green! Donovan Green kicks it out.

[08:18] Team_099 possession (Score: 77-82)
Scottie Quickley attempts a Midrange. Wide open! Joel Murray is 6.0 feet away. [ZONE] Scottie Quickley misses. Rebound secured by Dirk Herro.

[08:01] Team_043 possession (Score: 77-82)
Dirk Herro attempts a Midrange. Contested by Scottie Quickley (4.3 feet, ZONE). Dirk Herro misses. Rebound secured by Donovan Green.

[07:46] Team_099 possession (Score: 77-82)
Manu Johnson attempts a 3Pt. Contested by Ben LaVine (5.2 feet, MAN). MANU JOHNSON MAKES IT! Assist: CJ Cunningham
Score: 77-85

[07:35] Team_043 possession (Score: 77-85)
Jabari Holiday attempts a 3Pt. Wide open! CJ Cunningham is 6.3 feet away. [MAN] Jabari Holiday misses. Rebound secured by Jarrett Fox.

[07:22] Team_099 possession (Score: 77-85)
FOUL! Reach-in foul on Joel Murray during the drive. [IN THE BONUS! 5 team fouls] Donovan Green to the line for 2 free throws. (Joel Murray: 1 personal fouls)   FT 1/2: GOOD   FT 2/2: MISS Donovan Green makes 1/2 from the line. Rebound secured by Ben LaVine.
Score: 77-86

[07:09] Team_043 possession (Score: 77-86)
Jabari Holiday attempts a Midrange. Contested by Jarrett Fox (4.5 feet, ZONE). JABARI HOLIDAY MAKES IT! Assist: Terry Randle
Score: 79-86

[06:51] Team_099 possession (Score: 79-86)
Scottie Quickley attempts a Midrange. Wide open! Joel Murray is 6.0 feet away. [ZONE] SCOTTIE QUICKLEY MAKES IT! Assist: Jarrett Fox
Score: 79-88

[06:36] Team_043 possession (Score: 79-88)
FOUL! Holding foul on CJ Cunningham. [Team fouls: 2] No free throws, side out. (CJ Cunningham: 1 personal fouls)

[06:17] Team_043 possession (Score: 79-88)
Jabari Holiday attempts a Layup. BLOCKED BY MANU JOHNSON! Ball deflects out of bounds off Jabari Holiday.

[06:03] Team_099 possession (Score: 79-88)
Jarrett Fox drives to the basket... Jarrett Fox loses the ball! Stripped by Terry Randle! TURNOVER! (live ball)

[05:51] Team_043 possession (Score: 79-88)
Jabari Holiday attempts a Layup. BLOCKED BY JARRETT FOX! Ball is loose! Offensive rebound by Dirk Herro! Dirk Herro kicks it out.

[05:39] Team_043 possession (Score: 79-88)
Dirk Herro drives, picks up Jarrett Fox. Help arrives from Manu Johnson! Dirk Herro attempts a Layup. Contested by Manu Johnson (4.3 feet, ZONE). DIRK HERRO MAKES IT! Assist: Joel Murray
Score: 81-88

[05:27] Team_099 possession (Score: 81-88)
Donovan Green makes the Layup and draws the foul on Ben LaVine! And-1! Donovan Green to the line for 1. [BONUS: 6 team fouls] (Ben LaVine: 1 personal fouls)   FT 1/1: GOOD Donovan Green makes 1/1 from the line.
Score: 81-91

[05:15] Team_043 possession (Score: 81-91)
FOUL! Reach-in foul on Jarrett Fox during the drive. [Team fouls: 3] No free throws, side out. (Jarrett Fox: 1 personal fouls)

[05:00] Team_043 possession (Score: 81-91)
Terry Randle attempts a Midrange. Contested by Jarrett Fox (4.4 feet, MAN). Terry Randle misses. Offensive rebound by Terry Randle! Terry Randle kicks it out.

[04:47] Team_043 possession (Score: 81-91)
Jabari Holiday attempts a Layup. Wide open! CJ Cunningham is 6.3 feet away. [MAN] JABARI HOLIDAY MAKES IT! Assist: Dirk Herro
Score: 83-91

[04:34] Team_099 possession (Score: 83-91)
CJ Cunningham attempts a Midrange. Contested by Jabari Holiday (4.8 feet, MAN). CJ CUNNINGHAM MAKES IT! Assist: Manu Johnson
Score: 83-93

[04:21] Team_043 possession (Score: 83-93)
Jabari Holiday attempts a Midrange. Wide open! CJ Cunningham is 6.3 feet away. [MAN] JABARI HOLIDAY MAKES IT! Assist: Terry Randle
Score: 85-93

[04:06] Team_099 possession (Score: 85-93)
CJ Cunningham drives and kicks out. Manu Johnson attempts a 3Pt. Contested by Ben LaVine (5.1 feet, MAN). Manu Johnson misses. Rebound secured by Ben LaVine.

[03:54] Team_043 possession (Score: 85-93)
Dirk Herro drives, Scottie Quickley stays with him. Dirk Herro attempts a Dunk. Contested by Scottie Quickley (4.3 feet, MAN). DIRK HERRO MAKES IT! Assist: Joel Murray
Score: 87-93

[03:43] Team_099 possession (Score: 87-93)
Jarrett Fox drives, Terry Randle stays with him. Jarrett Fox attempts a Dunk. Contested by Terry Randle (4.8 feet, MAN). JARRETT FOX MAKES IT! Assist: Manu Johnson
Score: 87-95

[03:32] Team_043 possession (Score: 87-95)
FOUL! Shooting foul on Donovan Green. Jabari Holiday to the line for 2 free throws. [Team fouls: 4] (Donovan Green: 1 personal fouls)   FT 1/2: GOOD   FT 2/2: MISS Jabari Holiday makes 1/2 from the line. Rebound secured by Jarrett Fox.
Score: 88-95

[03:15] Team_099 possession (Score: 88-95)
Donovan Green drives and kicks out. Manu Johnson makes the 3Pt and draws the foul on Ben LaVine! And-1! Manu Johnson to the line for 1. [BONUS: 7 team fouls] (Ben LaVine: 2 personal fouls)   FT 1/1: MISS Manu Johnson makes 0/1 from the line. Rebound secured by Dirk Herro.
Score: 88-98

[03:01] Team_043 possession (Score: 88-98)
FOUL! Reach-in foul on Jarrett Fox during the drive. [IN THE BONUS! 5 team fouls] Ben LaVine to the line for 2 free throws. (Jarrett Fox: 2 personal fouls)   FT 1/2: GOOD   FT 2/2: GOOD Ben LaVine makes 2/2 from the line.
Score: 90-98

[02:45] Team_099 possession (Score: 90-98)
Donovan Green drives, picks up Terry Randle. Help arrives from Ben LaVine! Donovan Green attempts a Dunk. Contested by Ben LaVine (4.5 feet, ZONE). DONOVAN GREEN MAKES IT!
Score: 90-100

[02:29] Team_043 possession (Score: 90-100)
Jabari Holiday drives and kicks out. Ben LaVine attempts a 3Pt. Contested by Manu Johnson (4.9 feet, MAN). Ben LaVine misses. Rebound secured by Scottie Quickley.

[02:14] Team_099 possession (Score: 90-100)
FOUL! Holding foul on Jabari Holiday. [IN THE BONUS! 8 team fouls] CJ Cunningham to the line for 2 free throws. (Jabari Holiday: 1 personal fouls)   FT 1/2: MISS   FT 2/2: MISS CJ Cunningham makes 0/2 from the line. Rebound secured by Terry Randle.

[01:59] Team_043 possession (Score: 90-100)
Dirk Herro attempts a Midrange. Contested by Scottie Quickley (4.4 feet, MAN). Dirk Herro misses. Rebound secured by Donovan Green.

[01:48] Team_099 possession (Score: 90-100)
Jarrett Fox attempts a Layup. Contested by Terry Randle (4.8 feet, ZONE). JARRETT FOX MAKES IT!
Score: 90-102

[01:30] Team_043 possession (Score: 90-102)
Dirk Herro attempts a 3Pt. Contested by Scottie Quickley (4.4 feet, MAN). Dirk Herro misses. Rebound secured by Jarrett Fox.

[01:13] Team_099 possession (Score: 90-102)
Jarrett Fox attempts a 3Pt. Contested by Dirk Herro (4.5 feet, ZONE). Jarrett Fox misses. Rebound secured by Dirk Herro.

[00:58] Team_043 possession (Score: 90-102)
Terry Randle makes the Layup and draws the foul on Jarrett Fox! And-1! Terry Randle to the line for 1. [BONUS: 6 team fouls] (Jarrett Fox: 3 personal fouls)   FT 1/1: GOOD Terry Randle makes 1/1 from the line.
Score: 93-102

[00:41] Team_099 possession (Score: 93-102)
Scottie Quickley drives and kicks out. Scottie Quickley attempts a 3Pt. Contested by Dirk Herro (4.1 feet, MAN). Scottie Quickley misses. Offensive rebound by Donovan Green! Donovan Green kicks it out.

[00:24] Team_099 possession (Score: 93-102)
CJ Cunningham drives and kicks out. FOUL! Shooting foul on Dirk Herro. Donovan Green to the line for 3 free throws. [BONUS: 9 team fouls] (Dirk Herro: 1 personal fouls)   FT 1/3: GOOD   FT 2/3: GOOD   FT 3/3: GOOD Donovan Green makes 3/3 from the line.
Score: 93-105

[00:07] Team_043 possession (Score: 93-105)
Joel Murray drives, Jarrett Fox stays with him. Joel Murray attempts a Layup. Contested by Jarrett Fox (4.5 feet, ZONE). Joel Murray misses. Rebound secured by Jarrett Fox.

================================================================================
                              4TH QUARTER COMPLETE                              
================================================================================

4TH QUARTER SCORE: Team_043 25, Team_099 31

BOX SCORE:
================================================================================

Team_043
--------------------------------------------------------------------------------
Player                MIN  PTS  REB  AST  TO      FG   FG%      3P   3P%
--------------------------------------------------------------------------------
Jabari Holiday         19    6    0    0   0   3/7    42.9     0/0   0.0
Magic Durant           29    5    0    0   0   2/3    66.7     0/0   0.0
Dirk Herro             19    4    4    1   0   2/5    40.0     0/0   0.0
Terry Randle           19    3    2    2   0   1/1   100.0     0/0   0.0
Dwyane Dosunmu         29    2    1    0   0   1/2    50.0     0/0   0.0
Ben LaVine             19    2    2    0   0   1/1   100.0     0/0   0.0
Manu Carter            29    0    1    1   0   0/0     0.0     0/0   0.0
D'Angelo Iverson       29    0    1    0   0   0/1     0.0     0/0   0.0
Joel Murray            19    0    0    2   0   0/1     0.0     0/0   0.0

TEAM: FG: 10/21 (47.6%), 3PT: 1/4 (25.0%), REB: 11 (2 off, 9 def), AST: 6, TO: 1
TEAM FOULS: 9 [Team_099 in BONUS]


Team_099
--------------------------------------------------------------------------------
Player                MIN  PTS  REB  AST  TO      FG   FG%      3P   3P%
--------------------------------------------------------------------------------
Donovan Green          19    8    4    0   0   3/5    60.0     0/0   0.0
Jarrett Fox            19    4    4    1   0   2/3    66.7     0/0   0.0
Larry James            29    3    0    0   0   1/1   100.0     0/0   0.0
Manu Johnson           19    3    0    2   0   1/1   100.0     0/0   0.0
Vince Lillard          29    2    2    1   0   1/2    50.0     0/0   0.0
Ayo Barrett            29    2    0    0   0   1/1   100.0     0/0   0.0
Scottie Quickley       19    2    1    0   0   1/2    50.0     0/0   0.0
CJ Cunningham          19    2    0    1   0   1/2    50.0     0/0   0.0
Damian Ginobili        29    0    0    0   0   0/2     0.0     0/0   0.0
Larry Wade             29    0    1    0   0   0/0     0.0     0/0   0.0

TEAM: FG: 11/20 (55.0%), 3PT: 1/4 (25.0%), REB: 12 (2 off, 10 def), AST: 5, TO: 1
TEAM FOULS: 6 [Team_043 in BONUS]

================================================================================

================================================================================
                               FULL GAME COMPLETE                               
================================================================================

FINAL SCORE: Team_043 93, Team_099 105

SCORING BY QUARTER:
--------------------------------------------------------------------------------
Team                     Q1     Q2     Q3     Q4    FINAL
--------------------------------------------------------------------------------
Team_043                 26     20     22     25       93
Team_099                 23     23     28     31      105
--------------------------------------------------------------------------------

FULL GAME BOX SCORE:
================================================================================

Team_043
--------------------------------------------------------------------------------
Player                MIN  PTS  REB  AST  TO      FG   FG%      3P   3P%      FT STL BLK
--------------------------------------------------------------------------------
Malcolm Murray         29    7    0    2   1   3/7    42.9   1/2    50.0   2/2     1   0
Magic Durant           29   19    0    1   0   7/11   63.6   5/8    62.5   3/4     0   0
D'Angelo Iverson       29    2    9    3   2   1/9    11.1   0/4     0.0   1/2     0   1
Manu Carter            29   13   10    4   1   5/9    55.6   0/1     0.0   6/8     0   0
Dwyane Dosunmu         29   15    6    0   3   7/12   58.3   0/0     0.0   3/4     0   0
Jabari Holiday         19    8    0    0   1   5/13   38.5   1/4    25.0   1/2     0   0
Ben LaVine             19    2    6    1   0   1/1   100.0   0/0     0.0   2/2     0   0
Dirk Herro             19   14    8    1   2   4/9    44.4   1/3    33.3   3/3     0   0
Joel Murray            19    5    0    2   0   3/7    42.9   1/2    50.0   0/0     0   0
Terry Randle           19    3    6    2   0   1/1   100.0   0/0     0.0   1/1     4   0

TEAM: FG: 38/80 (47.5%), 3PT: 9/24 (37.5%), REB: 41 (8 off, 33 def), AST: 16, TO: 10


Team_099
--------------------------------------------------------------------------------
Player                MIN  PTS  REB  AST  TO      FG   FG%      3P   3P%      FT STL BLK
--------------------------------------------------------------------------------
Ayo Barrett            29    4    0    3   1   2/4    50.0   0/0     0.0   0/0     0   0
Larry James            29   16    0    2   0   9/15   60.0   2/6    33.3   3/4     0   0
Damian Ginobili        29   11   10    3   0   4/10   40.0   1/6    16.7   2/2     1   0
Vince Lillard          29   16   13    2   1   5/8    62.5   0/0     0.0   7/8     0   2
Larry Wade             29   16    6    1   2   5/10   50.0   1/3    33.3   4/4     1   0
CJ Cunningham          19    2    0    2   0   2/3    66.7   0/0     0.0   0/2     0   0
Manu Johnson           19    5    0    3   1   2/4    50.0   1/2    50.0   0/1     0   2
Scottie Quickley       19    6    2    1   1   3/6    50.0   1/3    33.3   1/2     1   0
Donovan Green          19   17    7    1   0   6/13   46.2   1/2    50.0   8/11    0   0
Jarrett Fox            19    4   11    2   2   2/3    66.7   0/1     0.0   0/0     1   1

TEAM: FG: 42/79 (53.2%), 3PT: 7/23 (30.4%), REB: 52 (11 off, 41 def), AST: 20, TO: 8

================================================================================
