================================================================================
                        FULL GAME - Team_079 vs Team_015                        
================================================================================

================================================================================
                       1ST QUARTER - Team_079 vs Team_015                       
================================================================================

[12:00] Team_079 possession (Score: 0-0)
Trae Durant attempts a 3Pt. Contested by Manu Anthony (3.5 feet, ZONE). TRAE DURANT MAKES IT! Assist: Miles Ming
Score: 3-0

[11:46] Team_015 possession (Score: 3-0)
Trae Turner makes the Layup and draws the foul on Miles Ming! And-1! Trae Turner to the line for 1. [Team fouls: 1] (Miles Ming: 1 personal fouls)   FT 1/1: GOOD Trae Turner makes 1/1 from the line.
Score: 3-3

[11:31] Team_079 possession (Score: 3-3)
Khris Embiid attempts a 3Pt. Contested by Manu Anthony (3.9 feet, MAN). KHRIS EMBIID MAKES IT! Assist: Bam Randle
Score: 6-3

[11:13] Team_015 possession (Score: 6-3)
Scottie Gasol attempts a 3Pt. Contested by Trae Durant (3.1 feet, MAN). Scottie Gasol misses. Offensive rebound by Trae Turner! Trae Turner's putback is no good. Rebound secured by Trae Durant.

[11:02] Team_079 possession (Score: 6-3)
Bam Randle attempts a 3Pt. Contested by Manu Anthony (3.5 feet, ZONE). Bam Randle misses. Rebound secured by CJ Banchero.

[10:47] Team_015 possession (Score: 6-3)
Manu Anthony drives, picks up Khris Embiid. Help arrives from Miles Ming! Manu Anthony attempts a Dunk. Contested by Miles Ming (4.8 feet, MAN). MANU ANTHONY MAKES IT!
Score: 6-5

[10:36] Team_079 possession (Score: 6-5)
Bam Randle attempts a Layup. Contested by CJ Banchero (4.1 feet, MAN). BAM RANDLE MAKES IT! Assist: Donovan Randle
Score: 8-5

[10:25] Team_015 possession (Score: 8-5)
FOUL! Shooting foul on Trae Durant. Scottie Gasol to the line for 2 free throws. [Team fouls: 2] (Trae Durant: 1 personal fouls)   FT 1/2: GOOD   FT 2/2: GOOD Scottie Gasol makes 2/2 from the line.
Score: 8-7

[10:12] Team_079 possession (Score: 8-7)
Miles Ming attempts a 3Pt. Contested by Michael Simmons (3.5 feet, ZONE). MILES MING MAKES IT! Assist: Bam Randle
Score: 11-7

[09:58] Team_015 possession (Score: 11-7)
Manu Anthony commits a violation (traveling/carry)! TURNOVER! (dead ball)

[09:43] Team_079 possession (Score: 11-7)
Khris Embiid drives, picks up Scottie Gasol. Help arrives from Michael Simmons! Khris Embiid attempts a Dunk. Contested by Michael Simmons (3.7 feet, ZONE). Khris Embiid misses. Rebound secured by Michael Simmons.

[09:27] Team_015 possession (Score: 11-7)
Michael Simmons drives to the basket... Michael Simmons throws a bad pass! Stolen by Trae Durant! TURNOVER! (live ball)

[09:15] Team_079 possession (Score: 11-7)
Khris Embiid attempts a Layup. Contested by Scottie Gasol (3.7 feet, ZONE). KHRIS EMBIID MAKES IT! Assist: Trae Durant
Score: 13-7

[09:00] Team_015 possession (Score: 13-7)
CJ Banchero attempts a 3Pt. Contested by Bam Randle (4.0 feet, MAN). CJ BANCHERO MAKES IT! Assist: Trae Turner
Score: 13-10

[08:49] Team_079 possession (Score: 13-10)
Trae Durant attempts a Midrange. Contested by Scottie Gasol (3.2 feet, MAN). TRAE DURANT MAKES IT! Assist: Khris Embiid
Score: 15-10

[08:32] Team_015 possession (Score: 15-10)
Scottie Gasol drives, Donovan Randle stays with him. Scottie Gasol attempts a Dunk. Contested by Donovan Randle (4.2 feet, ZONE). SCOTTIE GASOL MAKES IT! Assist: Trae Turner
Score: 15-12

[08:21] Team_079 possession (Score: 15-12)
Trae Durant attempts a 3Pt. Contested by Manu Anthony (3.5 feet, ZONE). TRAE DURANT MAKES IT! Assist: Khris Embiid
Score: 18-12

[08:07] Team_015 possession (Score: 18-12)
Manu Anthony makes the Dunk and draws the foul on Trae Durant! And-1! Manu Anthony to the line for 1. [Team fouls: 3] (Trae Durant: 2 personal fouls)   FT 1/1: GOOD Manu Anthony makes 1/1 from the line.
Score: 18-15

[07:50] Team_079 possession (Score: 18-15)
Khris Embiid attempts a 3Pt. Contested by Manu Anthony (3.9 feet, MAN). Khris Embiid misses. Offensive rebound by Trae Durant! Trae Durant's putback is no good. Rebound secured by Trae Turner.

[07:40] Team_015 possession (Score: 18-15)
Manu Anthony drives and kicks out. Scottie Gasol attempts a 3Pt. Contested by Trae Durant (3.0 feet, ZONE). SCOTTIE GASOL MAKES IT! Assist: CJ Banchero
Score: 18-18

[07:29] Team_079 possession (Score: 18-18)
Miles Ming attempts a 3Pt. Contested by Michael Simmons (3.5 feet, MAN). Miles Ming misses. Offensive rebound by Trae Durant! Trae Durant's putback is no good. Rebound secured by CJ Banchero.

[07:16] Team_015 possession (Score: 18-18)
FOUL! Shooting foul on Donovan Randle. Trae Turner to the line for 2 free throws. [Team fouls: 4] (Donovan Randle: 1 personal fouls)   FT 1/2: GOOD   FT 2/2: GOOD Trae Turner makes 2/2 from the line.
Score: 18-20

[06:58] Team_079 possession (Score: 18-20)
Khris Embiid attempts a 3Pt. Contested by Manu Anthony (3.9 feet, ZONE). KHRIS EMBIID MAKES IT! Assist: Donovan Randle
Score: 21-20

[06:48] Team_015 possession (Score: 21-20)
Scottie Gasol drives, picks up Trae Durant. Help arrives from Miles Ming! Scottie Gasol attempts a Dunk. Contested by Miles Ming (3.1 feet, MAN). SCOTTIE GASOL MAKES IT! Assist: Manu Anthony
Score: 21-22

[06:29] Team_079 possession (Score: 21-22)
Bam Randle drives to the basket... FOUL! Offensive foul on Bam Randle! CJ Banchero drew the charge! [Team fouls: 5] (Bam Randle: 1 personal fouls) TURNOVER! (dead ball)

[06:14] Team_015 possession (Score: 21-22)
Manu Anthony attempts a Midrange. Contested by Trae Durant (3.3 feet, ZONE). Manu Anthony misses. Rebound secured by Donovan Randle.

[06:00] Team_079 possession (Score: 21-22)
Khris Embiid attempts a 3Pt. Contested by Manu Anthony (3.9 feet, MAN). Khris Embiid misses. Rebound secured by Trae Turner.

[05:50] Team_015 possession (Score: 21-22)
Trae Turner drives and kicks out. FOUL! Shooting foul on Trae Durant. Michael Simmons to the line for 3 free throws. [BONUS: 6 team fouls] (Trae Durant: 3 personal fouls)   FT 1/3: GOOD   FT 2/3: GOOD   FT 3/3: GOOD Michael Simmons makes 3/3 from the line.
Score: 21-25

[05:34] Team_079 possession (Score: 21-25)
Miles Ming attempts a 3Pt. Contested by Michael Simmons (3.5 feet, MAN). Miles Ming misses. Rebound secured by Trae Turner.

[05:18] Team_015 possession (Score: 21-25)
Scottie Gasol attempts a Midrange. Contested by Bam Randle (4.3 feet, ZONE). SCOTTIE GASOL MAKES IT!
Score: 21-27

[05:02] Team_079 possession (Score: 21-27)
Miles Ming attempts a 3Pt. Contested by Manu Anthony (3.9 feet, ZONE). Miles Ming misses. Rebound secured by Michael Simmons.

[04:48] Team_015 possession (Score: 21-27)
Manu Anthony drives and kicks out. Trae Turner attempts a 3Pt. Contested by Trae Durant (3.1 feet, ZONE). TRAE TURNER MAKES IT! Assist: Manu Anthony
Score: 21-30

[04:32] Team_079 possession (Score: 21-30)
FOUL! Reach-in foul on Trae Turner during the drive. [Team fouls: 1] No free throws, side out. (Trae Turner: 1 personal fouls)

[04:16] Team_079 possession (Score: 21-30)
Miles Ming attempts a Midrange. Contested by Michael Simmons (3.6 feet, MAN). Miles Ming misses. FOUL! Loose ball foul on CJ Banchero during the rebound battle. [Team fouls: 2] No free throws, side out. (CJ Banchero: 1 personal fouls)

[04:01] Team_079 possession (Score: 21-30)
Donovan Randle makes the Layup and draws the foul on Trae Turner! And-1! Donovan Randle to the line for 1. [Team fouls: 3] (Trae Turner: 2 personal fouls)   FT 1/1: GOOD Donovan Randle makes 1/1 from the line.
Score: 24-30

[03:47] Team_015 possession (Score: 24-30)
Trae Turner attempts a Layup. Contested by Trae Durant (3.3 feet, ZONE). TRAE TURNER MAKES IT!
Score: 24-32

[03:32] Team_079 possession (Score: 24-32)
FOUL! Shooting foul on Manu Anthony. Khris Embiid to the line for 2 free throws. [Team fouls: 4] (Manu Anthony: 1 personal fouls)   FT 1/2: GOOD   FT 2/2: GOOD Khris Embiid makes 2/2 from the line.
Score: 26-32

[03:16] Team_015 possession (Score: 26-32)
CJ Banchero throws a bad pass out of bounds! TURNOVER! (dead ball)

[03:16] Substitution (Team_079): Donovan Randle OUT → James LaVine IN (stamina_rule2)

[03:16] Substitution (Team_015): Trae Turner OUT → Allen Curry IN (stamina_rule2)

[03:02] Team_079 possession (Score: 26-32)
Trae Durant attempts a Layup. Contested by Scottie Gasol (3.5 feet, ZONE). TRAE DURANT MAKES IT! Assist: Bam Randle
Score: 28-32

[02:46] Team_015 possession (Score: 28-32)
Manu Anthony attempts a Layup. Contested by Khris Embiid (5.0 feet, MAN). Manu Anthony misses. Rebound secured by James LaVine.

[02:27] Team_079 possession (Score: 28-32)
FOUL! Holding foul on Scottie Gasol. [IN THE BONUS! 5 team fouls] Trae Durant to the line for 2 free throws. (Scottie Gasol: 1 personal fouls)   FT 1/2: GOOD   FT 2/2: GOOD Trae Durant makes 2/2 from the line.
Score: 30-32

[02:14] Team_015 possession (Score: 30-32)
Scottie Gasol attempts a Layup. Contested by Trae Durant (3.3 feet, ZONE). SCOTTIE GASOL MAKES IT!
Score: 30-34

[02:01] Team_079 possession (Score: 30-34)
Khris Embiid makes the Layup and draws the foul on Manu Anthony! And-1! Khris Embiid to the line for 1. [BONUS: 6 team fouls] (Manu Anthony: 2 personal fouls)   FT 1/1: MISS Khris Embiid makes 0/1 from the line. Offensive rebound by Trae Durant! Trae Durant kicks it out.
Score: 32-34

[01:45] Team_079 possession (Score: 32-34)
Miles Ming attempts a 3Pt. Contested by Manu Anthony (4.1 feet, ZONE). Miles Ming misses. Offensive rebound by Trae Durant! Trae Durant kicks it out.

[01:28] Team_079 possession (Score: 32-34)
Bam Randle attempts a Midrange. Contested by CJ Banchero (4.4 feet, MAN). Bam Randle misses. Rebound secured by CJ Banchero.

[01:16] Team_015 possession (Score: 32-34)
Michael Simmons drives, Miles Ming stays with him. Michael Simmons attempts a Layup. Contested by Miles Ming (4.5 feet, MAN). Michael Simmons misses. Offensive rebound by Allen Curry! Allen Curry's putback is no good. Rebound secured by James LaVine.

[01:00] Team_079 possession (Score: 32-34)
James LaVine attempts a Layup. BLOCKED BY ALLEN CURRY! Ball is loose! Rebound secured by CJ Banchero.

[00:42] Team_015 possession (Score: 32-34)
Scottie Gasol attempts a Layup. Contested by Trae Durant (3.5 feet, ZONE). SCOTTIE GASOL MAKES IT! Assist: Allen Curry
Score: 32-36

[00:24] Team_079 possession (Score: 32-36)
Trae Durant attempts a 3Pt. Contested by Manu Anthony (3.9 feet, ZONE). Trae Durant misses. Offensive rebound by James LaVine! James LaVine's putback is no good. Rebound secured by Allen Curry.

[00:09] Team_015 possession (Score: 32-36)
CJ Banchero drives, picks up Trae Durant. Help arrives from Miles Ming! CJ Banchero attempts a Layup. Contested by Miles Ming (3.3 feet, ZONE). CJ Banchero misses. Rebound secured by Trae Durant.

================================================================================
                              1ST QUARTER COMPLETE                              
================================================================================

1ST QUARTER SCORE: Team_079 32, Team_015 36

BOX SCORE:
================================================================================

Team_079
--------------------------------------------------------------------------------
Player                MIN  PTS  REB  AST  TO      FG   FG%      3P   3P%
--------------------------------------------------------------------------------
Trae Durant            12   12    4    1   0   5/6    83.3     0/0   0.0
Khris Embiid           12   10    0    2   0   4/7    57.1     0/0   0.0
Miles Ming             12    3    0    1   0   1/4    25.0     0/0   0.0
Donovan Randle          9    3    2    2   0   1/1   100.0     0/0   0.0
Bam Randle             12    2    0    3   0   1/3    33.3     0/0   0.0
James LaVine            3    0    2    0   0   0/1     0.0     0/0   0.0
Allen Curry             3    0    1    1   0   0/0     0.0     0/0   0.0

TEAM: FG: 12/22 (54.5%), 3PT: 5/12 (41.7%), REB: 9 (6 off, 3 def), AST: 9, TO: 1
TEAM FOULS: 6 [Team_015 in BONUS]


Team_015
--------------------------------------------------------------------------------
Player                MIN  PTS  REB  AST  TO      FG   FG%      3P   3P%
--------------------------------------------------------------------------------
Scottie Gasol          12   15    0    0   0   7/8    87.5     0/0   0.0
Trae Turner             9   10    3    2   0   4/4   100.0     0/0   0.0
Manu Anthony           12    5    0    2   0   2/4    50.0     0/0   0.0
CJ Banchero            12    3    4    1   0   1/2    50.0     0/0   0.0
Michael Simmons        12    3    2    0   0   1/2    50.0     0/0   0.0

TEAM: FG: 15/20 (75.0%), 3PT: 1/2 (50.0%), REB: 9 (2 off, 7 def), AST: 6, TO: 3
TEAM FOULS: 6 [Team_079 in BONUS]

================================================================================

================================================================================
                       2ND QUARTER - Team_079 vs Team_015                       
================================================================================

[12:00] Team_079 possession (Score: 32-36)
Miles Ming makes the 3Pt and draws the foul on Manu Anthony! And-1! Miles Ming to the line for 1. [Team fouls: 1] (Manu Anthony: 1 personal fouls)   FT 1/1: GOOD Miles Ming makes 1/1 from the line.
Score: 36-36

[11:47] Team_015 possession (Score: 36-36)
Manu Anthony attempts a 3Pt. Contested by Trae Durant (3.6 feet, ZONE). Manu Anthony misses. Rebound secured by Trae Durant.

[11:33] Team_079 possession (Score: 36-36)
Trae Durant attempts a 3Pt. Contested by Scottie Gasol (3.7 feet, MAN). TRAE DURANT MAKES IT! Assist: Donovan Randle
Score: 39-36

[11:16] Team_015 possession (Score: 39-36)
Michael Simmons attempts a 3Pt. Contested by Miles Ming (4.5 feet, MAN). Michael Simmons misses. Offensive rebound by Trae Turner! Trae Turner puts it back in!
Score: 39-38

[11:05] Team_079 possession (Score: 39-38)
Trae Durant attempts a 3Pt. Contested by Manu Anthony (3.8 feet, ZONE). Trae Durant misses. Rebound secured by CJ Banchero.

[10:47] Team_015 possession (Score: 39-38)
Scottie Gasol drives and kicks out. Trae Turner attempts a 3Pt. Contested by Donovan Randle (4.2 feet, MAN). Trae Turner misses. Rebound secured by Donovan Randle.

[10:36] Team_079 possession (Score: 39-38)
Bam Randle attempts a 3Pt. Contested by CJ Banchero (4.5 feet, MAN). BAM RANDLE MAKES IT! Assist: Donovan Randle
Score: 42-38

[10:24] Team_015 possession (Score: 42-38)
FOUL! Shooting foul on Bam Randle. CJ Banchero to the line for 3 free throws. [Team fouls: 1] (Bam Randle: 1 personal fouls)   FT 1/3: GOOD   FT 2/3: GOOD   FT 3/3: GOOD CJ Banchero makes 3/3 from the line.
Score: 42-41

[10:14] Team_079 possession (Score: 42-41)
Trae Durant drives, Trae Turner stays with him. Trae Durant attempts a Layup. Contested by Trae Turner (3.5 feet, ZONE). TRAE DURANT MAKES IT! Assist: Donovan Randle
Score: 44-41

[09:58] Team_015 possession (Score: 44-41)
FOUL! Shooting foul on Miles Ming. Manu Anthony to the line for 2 free throws. [Team fouls: 2] (Miles Ming: 1 personal fouls)   FT 1/2: GOOD   FT 2/2: MISS Manu Anthony makes 1/2 from the line. Rebound secured by Bam Randle.
Score: 44-42

[09:48] Team_079 possession (Score: 44-42)
FOUL! Shooting foul on CJ Banchero. Bam Randle to the line for 2 free throws. [Team fouls: 2] (CJ Banchero: 1 personal fouls)   FT 1/2: GOOD   FT 2/2: GOOD Bam Randle makes 2/2 from the line.
Score: 46-42

[09:35] Team_015 possession (Score: 46-42)
Trae Turner attempts a 3Pt. Contested by Trae Durant (3.8 feet, ZONE). Trae Turner misses. Rebound secured by Donovan Randle.

[09:18] Team_079 possession (Score: 46-42)
Donovan Randle attempts a Layup. Contested by Trae Turner (4.0 feet, ZONE). Donovan Randle misses. Rebound secured by CJ Banchero.

[09:02] Team_015 possession (Score: 46-42)
Michael Simmons attempts a Layup. Contested by Trae Durant (3.6 feet, ZONE). MICHAEL SIMMONS MAKES IT! Assist: CJ Banchero
Score: 46-44

[08:46] Team_079 possession (Score: 46-44)
Donovan Randle drives, Trae Turner stays with him. Donovan Randle attempts a Layup. Contested by Trae Turner (4.0 feet, ZONE). Donovan Randle misses. Rebound secured by CJ Banchero.

[08:26] Team_015 possession (Score: 46-44)
Michael Simmons drives, Trae Durant stays with him. Michael Simmons attempts a Dunk. Contested by Trae Durant (3.7 feet, ZONE). Michael Simmons misses. Rebound secured by Donovan Randle.

[08:09] Team_079 possession (Score: 46-44)
Trae Durant attempts a 3Pt. Contested by Manu Anthony (4.2 feet, ZONE). Trae Durant misses. Rebound secured by Michael Simmons.

[07:50] Team_015 possession (Score: 46-44)
CJ Banchero attempts a 3Pt. Contested by Trae Durant (3.6 feet, ZONE). CJ Banchero misses. FOUL! Loose ball foul on Bam Randle during the rebound battle. [Team fouls: 3] No free throws, side out. (Bam Randle: 2 personal fouls)

[07:36] Team_015 possession (Score: 46-44)
Manu Anthony makes the Layup and draws the foul on Khris Embiid! And-1! Manu Anthony to the line for 1. [Team fouls: 4] (Khris Embiid: 1 personal fouls)   FT 1/1: GOOD Manu Anthony makes 1/1 from the line.
Score: 46-47

[07:20] Team_079 possession (Score: 46-47)
Bam Randle attempts a 3Pt. Contested by CJ Banchero (4.9 feet, MAN). Bam Randle misses. Rebound secured by CJ Banchero.

[07:06] Team_015 possession (Score: 46-47)
Manu Anthony attempts a Midrange. Contested by Khris Embiid (5.5 feet, ZONE). MANU ANTHONY MAKES IT!
Score: 46-49

[06:52] Team_079 possession (Score: 46-49)
Khris Embiid drives, picks up Trae Turner. Help arrives from Michael Simmons! Khris Embiid attempts a Layup. Contested by Michael Simmons (4.3 feet, ZONE). Khris Embiid misses. Rebound secured by Trae Turner.

[06:40] Team_015 possession (Score: 46-49)
Manu Anthony drives, picks up Khris Embiid. Help arrives from Miles Ming! Manu Anthony attempts a Dunk. Contested by Miles Ming (5.6 feet, MAN). MANU ANTHONY MAKES IT! Assist: Scottie Gasol
Score: 46-51

[06:23] Team_079 possession (Score: 46-51)
Bam Randle attempts a Layup. Contested by CJ Banchero (5.0 feet, MAN). BAM RANDLE MAKES IT! Assist: Khris Embiid
Score: 48-51

[06:07] Team_015 possession (Score: 48-51)
Scottie Gasol attempts a Midrange. Contested by Trae Durant (4.0 feet, MAN). Scottie Gasol misses. Rebound secured by Bam Randle.

[05:51] Team_079 possession (Score: 48-51)
Trae Durant attempts a Midrange. Contested by Scottie Gasol (4.5 feet, MAN). TRAE DURANT MAKES IT! Assist: Khris Embiid
Score: 50-51

[05:35] Team_015 possession (Score: 50-51)
Trae Turner drives, Donovan Randle stays with him. Trae Turner attempts a Layup. Contested by Donovan Randle (4.9 feet, MAN). TRAE TURNER MAKES IT!
Score: 50-53

[05:22] Team_079 possession (Score: 50-53)
FOUL! Shooting foul on Trae Turner. Donovan Randle to the line for 2 free throws. [Team fouls: 3] (Trae Turner: 1 personal fouls)   FT 1/2: GOOD   FT 2/2: GOOD Donovan Randle makes 2/2 from the line.
Score: 52-53

[05:06] Team_015 possession (Score: 52-53)
CJ Banchero attempts a 3Pt. Contested by Trae Durant (4.0 feet, ZONE). CJ Banchero misses. Rebound secured by Trae Durant.

[04:53] Team_079 possession (Score: 52-53)
Donovan Randle drives, picks up Trae Turner. Help arrives from Michael Simmons! Donovan Randle attempts a Dunk. Contested by Michael Simmons (4.5 feet, ZONE). DONOVAN RANDLE MAKES IT! Assist: Bam Randle
Score: 54-53

[04:38] Team_015 possession (Score: 54-53)
Scottie Gasol attempts a Layup. Contested by Trae Durant (4.2 feet, MAN). SCOTTIE GASOL MAKES IT!
Score: 54-55

[04:24] Team_079 possession (Score: 54-55)
Bam Randle attempts a 3Pt. Contested by CJ Banchero (5.3 feet, MAN). Bam Randle misses. Rebound secured by CJ Banchero.

[04:09] Team_015 possession (Score: 54-55)
CJ Banchero attempts a 3Pt. Contested by Trae Durant (4.1 feet, ZONE). CJ Banchero misses. Rebound secured by Donovan Randle.

[03:58] Team_079 possession (Score: 54-55)
FOUL! Holding foul on Manu Anthony. [Team fouls: 4] No free throws, side out. (Manu Anthony: 2 personal fouls)

[03:43] Team_079 possession (Score: 54-55)
Trae Durant attempts a 3Pt. Contested by Manu Anthony (4.9 feet, ZONE). TRAE DURANT MAKES IT! Assist: Bam Randle
Score: 57-55

[03:24] Team_015 possession (Score: 57-55)
Trae Turner drives and kicks out. Trae Turner attempts a 3Pt. Contested by Donovan Randle (5.2 feet, MAN). Trae Turner misses. Offensive rebound by CJ Banchero! CJ Banchero kicks it out.

[03:11] Team_015 possession (Score: 57-55)
FOUL! Shooting foul on Trae Durant. Scottie Gasol to the line for 2 free throws. [BONUS: 5 team fouls] (Trae Durant: 1 personal fouls)   FT 1/2: GOOD   FT 2/2: GOOD Scottie Gasol makes 2/2 from the line.
Score: 57-57

[02:56] Team_079 possession (Score: 57-57)
Khris Embiid attempts a 3Pt. Contested by Manu Anthony (5.3 feet, MAN). Khris Embiid misses. Offensive rebound by Donovan Randle! Donovan Randle kicks it out.

[02:41] Team_079 possession (Score: 57-57)
Trae Durant attempts a Layup. Contested by Trae Turner (4.6 feet, ZONE). TRAE DURANT MAKES IT! Assist: Miles Ming
Score: 59-57

[02:23] Team_015 possession (Score: 59-57)
Manu Anthony attempts a 3Pt. Wide open! Khris Embiid is 6.1 feet away. [MAN] Manu Anthony misses. Offensive rebound by CJ Banchero! CJ Banchero kicks it out.

[02:09] Team_015 possession (Score: 59-57)
FOUL! Reach-in foul on Khris Embiid during the drive. [IN THE BONUS! 6 team fouls] Manu Anthony to the line for 2 free throws. (Khris Embiid: 2 personal fouls)   FT 1/2: GOOD   FT 2/2: GOOD Manu Anthony makes 2/2 from the line.
Score: 59-59

[01:54] Team_079 possession (Score: 59-59)
Khris Embiid makes the Layup and draws the foul on Manu Anthony! And-1! Khris Embiid to the line for 1. [BONUS: 5 team fouls] (Manu Anthony: 3 personal fouls)   FT 1/1: GOOD Khris Embiid makes 1/1 from the line.
Score: 62-59

[01:44] Team_015 possession (Score: 62-59)
CJ Banchero drives to the basket... FOUL! Offensive foul on CJ Banchero! Bam Randle drew the charge! [Team fouls: 6] (CJ Banchero: 2 personal fouls) TURNOVER! (dead ball)

[01:26] Team_079 possession (Score: 62-59)
Donovan Randle attempts a Layup. Contested by Trae Turner (5.0 feet, ZONE). DONOVAN RANDLE MAKES IT!
Score: 64-59

[01:08] Team_015 possession (Score: 64-59)
Scottie Gasol attempts a Midrange. Contested by Trae Durant (4.7 feet, MAN). Scottie Gasol misses. Rebound secured by Bam Randle.

[00:51] Team_079 possession (Score: 64-59)
Donovan Randle attempts a Layup. Contested by Trae Turner (5.1 feet, MAN). Donovan Randle misses. Offensive rebound by Trae Durant! Trae Durant kicks it out.

[00:39] Team_079 possession (Score: 64-59)
Donovan Randle attempts a Layup. BLOCKED BY TRAE TURNER! Ball is loose! Rebound secured by Trae Turner.

[00:21] Team_015 possession (Score: 64-59)
Trae Turner attempts a Midrange. Wide open! Miles Ming is 6.2 feet away. [ZONE] TRAE TURNER MAKES IT!
Score: 64-61

[00:07] Team_079 possession (Score: 64-61)
Miles Ming attempts a 3Pt. Contested by Michael Simmons (5.5 feet, MAN). Miles Ming misses. Rebound secured by Trae Turner.

================================================================================
                              2ND QUARTER COMPLETE                              
================================================================================

2ND QUARTER SCORE: Team_079 32, Team_015 25

BOX SCORE:
================================================================================

Team_079
--------------------------------------------------------------------------------
Player                MIN  PTS  REB  AST  TO      FG   FG%      3P   3P%
--------------------------------------------------------------------------------
Trae Durant            24   12    3    0   0   5/7    71.4     0/0   0.0
Bam Randle             24    7    3    2   0   3/5    60.0     0/0   0.0
Donovan Randle         21    6    5    3   0   3/6    50.0     0/0   0.0
Miles Ming             24    4    0    1   0   1/2    50.0     0/0   0.0
Khris Embiid           24    3    0    2   0   1/2    50.0     0/0   0.0

TEAM: FG: 13/22 (59.1%), 3PT: 4/9 (44.4%), REB: 11 (2 off, 9 def), AST: 8, TO: 0
TEAM FOULS: 6 [Team_015 in BONUS]


Team_015
--------------------------------------------------------------------------------
Player                MIN  PTS  REB  AST  TO      FG   FG%      3P   3P%
--------------------------------------------------------------------------------
Manu Anthony           24    9    0    0   0   4/6    66.7     0/0   0.0
Trae Turner            21    6    5    0   0   3/4    75.0     0/0   0.0
Scottie Gasol          24    4    0    1   0   2/5    40.0     0/0   0.0
CJ Banchero            24    3    7    1   0   1/3    33.3     0/0   0.0
Michael Simmons        24    2    1    0   0   1/2    50.0     0/0   0.0

TEAM: FG: 11/20 (55.0%), 3PT: 2/6 (33.3%), REB: 13 (4 off, 9 def), AST: 2, TO: 1
TEAM FOULS: 6 [Team_079 in BONUS]

================================================================================

================================================================================
                       3RD QUARTER - Team_079 vs Team_015                       
================================================================================

[12:00] Team_079 possession (Score: 64-61)
Donovan Randle attempts a 3Pt. Contested by Manu Anthony (3.8 feet, ZONE). Donovan Randle misses. Rebound secured by CJ Banchero.

[11:45] Team_015 possession (Score: 64-61)
Scottie Gasol attempts a Midrange. Contested by Trae Durant (3.1 feet, MAN). Scottie Gasol misses. Rebound secured by Donovan Randle.

[11:31] Team_079 possession (Score: 64-61)
FOUL! Reach-in foul on Scottie Gasol during the drive. [Team fouls: 1] No free throws, side out. (Scottie Gasol: 1 personal fouls)

[11:20] Team_079 possession (Score: 64-61)
Miles Ming attempts a Layup. Contested by Scottie Gasol (3.6 feet, ZONE). MILES MING MAKES IT!
Score: 66-61

[11:04] Team_015 possession (Score: 66-61)
FOUL! Shooting foul on Donovan Randle. Trae Turner to the line for 2 free throws. [Team fouls: 1] (Donovan Randle: 1 personal fouls)   FT 1/2: GOOD   FT 2/2: GOOD Trae Turner makes 2/2 from the line.
Score: 66-63

[10:45] Team_079 possession (Score: 66-63)
FOUL! Reach-in foul on Scottie Gasol during the drive. [Team fouls: 2] No free throws, side out. (Scottie Gasol: 2 personal fouls)

[10:32] Team_079 possession (Score: 66-63)
Miles Ming attempts a 3Pt. Contested by Michael Simmons (3.5 feet, MAN). MILES MING MAKES IT! Assist: Donovan Randle
Score: 69-63

[10:15] Team_015 possession (Score: 69-63)
FOUL! Offensive foul on CJ Banchero! Bam Randle drew the charge! [Team fouls: 3] (CJ Banchero: 1 personal fouls) TURNOVER! (dead ball)

[10:01] Team_079 possession (Score: 69-63)
Trae Durant attempts a Layup. Contested by Scottie Gasol (3.2 feet, ZONE). TRAE DURANT MAKES IT! Assist: Khris Embiid
Score: 71-63

[09:46] Team_015 possession (Score: 71-63)
CJ Banchero attempts a Layup. Contested by Bam Randle (4.0 feet, MAN). CJ Banchero misses. Offensive rebound by Trae Turner! Trae Turner puts it back in!
Score: 71-65

[09:31] Team_079 possession (Score: 71-65)
Trae Durant throws a bad pass! Stolen by Scottie Gasol! TURNOVER! (live ball)

[09:20] Team_015 possession (Score: 71-65)
FOUL! Shooting foul on Miles Ming. Michael Simmons to the line for 2 free throws. [Team fouls: 2] (Miles Ming: 1 personal fouls)   FT 1/2: GOOD   FT 2/2: MISS Michael Simmons makes 1/2 from the line. FOUL! Loose ball foul on Donovan Randle during the free throw rebound! [Team fouls: 3] No free throws, side out. (Donovan Randle: 2 personal fouls)
Score: 71-66

[09:09] Team_015 possession (Score: 71-66)
Michael Simmons drives, picks up Trae Durant. Help arrives from Miles Ming! Michael Simmons attempts a Dunk. Contested by Miles Ming (3.1 feet, ZONE). MICHAEL SIMMONS MAKES IT! Assist: Trae Turner
Score: 71-68

[08:57] Team_079 possession (Score: 71-68)
Trae Durant attempts a Midrange. Contested by Scottie Gasol (3.2 feet, MAN). Trae Durant misses. Rebound secured by Michael Simmons.

[08:42] Team_015 possession (Score: 71-68)
Scottie Gasol attempts a Midrange. Contested by Miles Ming (4.1 feet, ZONE). SCOTTIE GASOL MAKES IT!
Score: 71-70

[08:26] Team_079 possession (Score: 71-70)
Miles Ming attempts a Midrange. Contested by Michael Simmons (3.5 feet, MAN). MILES MING MAKES IT!
Score: 73-70

[08:15] Team_015 possession (Score: 73-70)
Manu Anthony attempts a Layup. BLOCKED BY TRAE DURANT! Ball is loose! Offensive rebound by CJ Banchero! CJ Banchero kicks it out.

[08:01] Team_015 possession (Score: 73-70)
Michael Simmons attempts a 3Pt. Contested by Miles Ming (4.1 feet, MAN). MICHAEL SIMMONS MAKES IT! Assist: Scottie Gasol
Score: 73-73

[07:45] Team_079 possession (Score: 73-73)
Trae Durant drives to the basket... Trae Durant throws a bad pass out of bounds! TURNOVER! (dead ball)

[07:26] Team_015 possession (Score: 73-73)
FOUL! Shooting foul on Khris Embiid. Manu Anthony to the line for 2 free throws. [Team fouls: 4] (Khris Embiid: 1 personal fouls)   FT 1/2: GOOD   FT 2/2: MISS Manu Anthony makes 1/2 from the line. Offensive rebound by CJ Banchero! CJ Banchero puts it back in!
Score: 73-76

[07:12] Team_079 possession (Score: 73-76)
Bam Randle attempts a 3Pt. Contested by CJ Banchero (4.1 feet, MAN). Bam Randle misses. Rebound secured by Michael Simmons.

[06:57] Team_015 possession (Score: 73-76)
Trae Turner attempts a 3Pt. Contested by Donovan Randle (4.3 feet, MAN). Trae Turner misses. Rebound secured by Trae Durant.

[06:45] Team_079 possession (Score: 73-76)
Donovan Randle drives to the basket... FOUL! Offensive foul on Donovan Randle! Trae Turner drew the charge! [Team fouls: 5] (Donovan Randle: 3 personal fouls) TURNOVER! (dead ball)

[06:31] Team_015 possession (Score: 73-76)
Scottie Gasol attempts a Midrange. Contested by Trae Durant (3.1 feet, MAN). Scottie Gasol misses. FOUL! Loose ball foul on Trae Durant during the rebound battle. [IN THE BONUS! 6 team fouls] Trae Turner to the line for 2 free throws. (Trae Durant: 1 personal fouls)   FT 1/2: GOOD   FT 2/2: GOOD Trae Turner makes 2/2 from the line.
Score: 73-78

[06:17] Team_079 possession (Score: 73-78)
Bam Randle attempts a Midrange. Contested by Scottie Gasol (3.3 feet, ZONE). BAM RANDLE MAKES IT!
Score: 75-78

[06:08] Team_015 possession (Score: 75-78)
Scottie Gasol attempts a 3Pt. Contested by Trae Durant (3.1 feet, ZONE). Scottie Gasol misses. Offensive rebound by Trae Turner! Trae Turner's putback is no good. Rebound secured by Trae Durant.

[05:53] Team_079 possession (Score: 75-78)
FOUL! Holding foul on Scottie Gasol. [Team fouls: 4] No free throws, side out. (Scottie Gasol: 3 personal fouls)

[05:43] Team_079 possession (Score: 75-78)
FOUL! Shooting foul on Trae Turner. Donovan Randle to the line for 2 free throws. [BONUS: 5 team fouls] (Trae Turner: 1 personal fouls)   FT 1/2: GOOD   FT 2/2: GOOD Donovan Randle makes 2/2 from the line.
Score: 77-78

[05:28] Team_015 possession (Score: 77-78)
Michael Simmons attempts a Layup. BLOCKED BY MILES MING! Ball is loose! Rebound secured by Bam Randle.

[05:14] Team_079 possession (Score: 77-78)
Bam Randle attempts a Midrange. Contested by CJ Banchero (4.1 feet, MAN). BAM RANDLE MAKES IT! Assist: Khris Embiid
Score: 79-78

[05:00] Team_015 possession (Score: 79-78)
CJ Banchero attempts a Midrange. Contested by Miles Ming (4.0 feet, ZONE). CJ Banchero misses. Rebound secured by Bam Randle.

[04:46] Team_079 possession (Score: 79-78)
Khris Embiid drives and kicks out. Trae Durant attempts a 3Pt. Contested by Scottie Gasol (3.5 feet, MAN). TRAE DURANT MAKES IT! Assist: Khris Embiid
Score: 82-78

[04:30] Team_015 possession (Score: 82-78)
Scottie Gasol drives and kicks out. Michael Simmons attempts a 3Pt. Contested by Trae Durant (3.1 feet, ZONE). Michael Simmons misses. Rebound secured by Trae Durant.

[04:13] Team_079 possession (Score: 82-78)
Trae Durant drives and kicks out. Donovan Randle attempts a 3Pt. Contested by Manu Anthony (3.7 feet, ZONE). Donovan Randle misses. Rebound secured by Michael Simmons.

[03:59] Team_015 possession (Score: 82-78)
Michael Simmons attempts a 3Pt. Contested by Trae Durant (3.2 feet, ZONE). Michael Simmons misses. Offensive rebound by Trae Turner! Trae Turner kicks it out.

[03:44] Team_015 possession (Score: 82-78)
CJ Banchero attempts a 3Pt. Contested by Trae Durant (3.0 feet, ZONE). CJ Banchero misses. Offensive rebound by Trae Turner! Trae Turner kicks it out.

[03:29] Team_015 possession (Score: 82-78)
Michael Simmons drives to the basket... FOUL! Offensive foul on Michael Simmons! Donovan Randle drew the charge! [Team fouls: 6] (Michael Simmons: 1 personal fouls) TURNOVER! (dead ball)

[03:12] Team_079 possession (Score: 82-78)
Khris Embiid attempts a Midrange. Contested by Manu Anthony (4.1 feet, MAN). Khris Embiid misses. Offensive rebound by Trae Durant! Trae Durant puts it back in!
Score: 84-78

[03:03] Team_015 possession (Score: 84-78)
Michael Simmons attempts a Midrange. Contested by Khris Embiid (4.7 feet, ZONE). MICHAEL SIMMONS MAKES IT! Assist: Manu Anthony
Score: 84-80

[02:49] Team_079 possession (Score: 84-80)
Miles Ming attempts a 3Pt. Contested by Michael Simmons (3.8 feet, MAN). Miles Ming misses. Rebound secured by Michael Simmons.

[02:33] Team_015 possession (Score: 84-80)
FOUL! Shooting foul on Trae Durant. Scottie Gasol to the line for 3 free throws. [BONUS: 7 team fouls] (Trae Durant: 2 personal fouls)   FT 1/3: GOOD   FT 2/3: GOOD   FT 3/3: GOOD Scottie Gasol makes 3/3 from the line.
Score: 84-83

[02:17] Team_079 possession (Score: 84-83)
Donovan Randle drives and kicks out. Trae Durant attempts a 3Pt. Contested by Scottie Gasol (3.8 feet, MAN). Trae Durant misses. Rebound secured by Trae Turner.

[02:03] Team_015 possession (Score: 84-83)
Scottie Gasol drives to the basket... Scottie Gasol throws a bad pass! Stolen by Trae Durant! TURNOVER! (live ball)

[01:53] Team_079 possession (Score: 84-83)
Trae Durant attempts a 3Pt. Contested by Scottie Gasol (3.7 feet, MAN). Trae Durant misses. Rebound secured by CJ Banchero.

[01:40] Team_015 possession (Score: 84-83)
Michael Simmons drives, picks up Miles Ming. Help arrives from Khris Embiid! Michael Simmons attempts a Layup. Contested by Khris Embiid (4.5 feet, MAN). MICHAEL SIMMONS MAKES IT!
Score: 84-85

[01:26] Team_079 possession (Score: 84-85)
FOUL! Holding foul on Michael Simmons. [IN THE BONUS! 7 team fouls] Miles Ming to the line for 2 free throws. (Michael Simmons: 2 personal fouls)   FT 1/2: GOOD   FT 2/2: MISS Miles Ming makes 1/2 from the line. Offensive rebound by Donovan Randle! Donovan Randle kicks it out.
Score: 85-85

[01:12] Team_079 possession (Score: 85-85)
FOUL! Shooting foul on Manu Anthony. Khris Embiid to the line for 3 free throws. [BONUS: 8 team fouls] (Manu Anthony: 1 personal fouls)   FT 1/3: MISS   FT 2/3: GOOD   FT 3/3: GOOD Khris Embiid makes 2/3 from the line.
Score: 87-85

[00:57] Team_015 possession (Score: 87-85)
Manu Anthony loses control! Ball rolls out of bounds! TURNOVER! (dead ball)

[00:57] Substitution (Team_079): Khris Embiid OUT → Evan Mobley IN (stamina_rule2)

[00:57] Substitution (Team_079): Miles Ming OUT → Karl Ingram IN (stamina_rule2)

[00:57] Substitution (Team_079): Bam Randle OUT → Anthony Wade IN (stamina_rule2)

[00:57] Substitution (Team_079): Trae Durant OUT → Kobe Curry IN (stamina_rule2)

[00:57] Substitution (Team_079): Donovan Randle OUT → James LaVine IN (stamina_rule2)

[00:57] Substitution (Team_015): Manu Anthony OUT → Dwyane Sabonis IN (stamina_rule2)

[00:57] Substitution (Team_015): Michael Simmons OUT → Paolo Jokic IN (stamina_rule2)

[00:57] Substitution (Team_015): CJ Banchero OUT → Magic Wagner IN (stamina_rule2)

[00:57] Substitution (Team_015): Scottie Gasol OUT → Rudy Paul IN (stamina_rule2)

[00:57] Substitution (Team_015): Trae Turner OUT → Allen Curry IN (stamina_rule2)

[00:39] Team_079 possession (Score: 87-85)
Karl Ingram drives and kicks out. Karl Ingram attempts a Midrange. Contested by Paolo Jokic (5.6 feet, MAN). KARL INGRAM MAKES IT!
Score: 89-85

[00:24] Team_015 possession (Score: 89-85)
Paolo Jokic attempts a 3Pt. Contested by Evan Mobley (5.0 feet, ZONE). Paolo Jokic misses. Rebound secured by James LaVine.

[00:10] Team_079 possession (Score: 89-85)
Evan Mobley drives, picks up Dwyane Sabonis. Help arrives from Magic Wagner! Evan Mobley attempts a Dunk. Contested by Magic Wagner (5.3 feet, MAN). EVAN MOBLEY MAKES IT! Assist: Kobe Curry
Score: 91-85

================================================================================
                              3RD QUARTER COMPLETE                              
================================================================================

3RD QUARTER SCORE: Team_079 27, Team_015 24

BOX SCORE:
================================================================================

Team_079
--------------------------------------------------------------------------------
Player                MIN  PTS  REB  AST  TO      FG   FG%      3P   3P%
--------------------------------------------------------------------------------
Miles Ming             36    7    0    0   0   3/4    75.0     0/0   0.0
Trae Durant            36    7    4    0   0   3/6    50.0     0/0   0.0
Bam Randle             36    4    2    0   0   2/3    66.7     0/0   0.0
Donovan Randle         32    2    2    1   0   1/3    33.3     0/0   0.0
Khris Embiid           36    2    0    3   0   1/1   100.0     0/0   0.0
Karl Ingram             1    2    0    0   0   1/1   100.0     0/0   0.0
Evan Mobley             1    2    0    0   0   1/1   100.0     0/0   0.0
James LaVine            4    0    1    0   0   0/0     0.0     0/0   0.0
Kobe Curry              1    0    0    1   0   0/0     0.0     0/0   0.0

TEAM: FG: 12/19 (63.2%), 3PT: 2/6 (33.3%), REB: 8 (2 off, 6 def), AST: 5, TO: 3
TEAM FOULS: 7 [Team_015 in BONUS]


Team_015
--------------------------------------------------------------------------------
Player                MIN  PTS  REB  AST  TO      FG   FG%      3P   3P%
--------------------------------------------------------------------------------
Michael Simmons        36    9    4    0   0   4/5    80.0     0/0   0.0
Trae Turner            32    6    4    1   0   3/4    75.0     0/0   0.0
Scottie Gasol          36    5    0    1   0   2/5    40.0     0/0   0.0
CJ Banchero            36    3    4    0   0   1/2    50.0     0/0   0.0
Manu Anthony           36    0    0    1   0   0/0     0.0     0/0   0.0
Paolo Jokic             1    0    0    0   0   0/1     0.0     0/0   0.0

TEAM: FG: 10/17 (58.8%), 3PT: 2/5 (40.0%), REB: 13 (6 off, 7 def), AST: 3, TO: 4
TEAM FOULS: 8 [Team_079 in BONUS]

================================================================================

================================================================================
                       4TH QUARTER - Team_079 vs Team_015                       
================================================================================

[12:00] Team_079 possession (Score: 91-85)
Bam Randle attempts a Layup. Contested by Scottie Gasol (3.5 feet, ZONE). Bam Randle misses. Rebound secured by Trae Turner.

[11:47] Team_015 possession (Score: 91-85)
Trae Turner makes the Layup and draws the foul on Donovan Randle! And-1! Trae Turner to the line for 1. [Team fouls: 1] (Donovan Randle: 1 personal fouls)   FT 1/1: GOOD Trae Turner makes 1/1 from the line.
Score: 91-88

[11:33] Team_079 possession (Score: 91-88)
Trae Durant attempts a Midrange. Contested by Scottie Gasol (3.5 feet, MAN). Trae Durant misses. Rebound secured by Michael Simmons.

[11:21] Team_015 possession (Score: 91-88)
Manu Anthony attempts a 3Pt. Contested by Trae Durant (3.5 feet, ZONE). Manu Anthony misses. Rebound secured by Trae Durant.

[11:07] Team_079 possession (Score: 91-88)
Bam Randle loses the ball! Stripped by CJ Banchero! TURNOVER! (live ball)

[10:52] Team_015 possession (Score: 91-88)
CJ Banchero drives, Trae Durant stays with him. CJ Banchero attempts a Dunk. Contested by Trae Durant (3.1 feet, ZONE). CJ Banchero misses. Rebound secured by Trae Durant.

[10:39] Team_079 possession (Score: 91-88)
Bam Randle drives to the basket... FOUL! Offensive foul on Bam Randle! Scottie Gasol drew the charge! [Team fouls: 2] (Bam Randle: 1 personal fouls) TURNOVER! (dead ball)

[10:23] Team_015 possession (Score: 91-88)
FOUL! Holding foul on Khris Embiid. [Team fouls: 3] No free throws, side out. (Khris Embiid: 1 personal fouls)

[10:07] Team_015 possession (Score: 91-88)
CJ Banchero makes the Dunk and draws the foul on Trae Durant! And-1! CJ Banchero to the line for 1. [Team fouls: 4] (Trae Durant: 1 personal fouls)   FT 1/1: GOOD CJ Banchero makes 1/1 from the line.
Score: 91-91

[09:48] Team_079 possession (Score: 91-91)
FOUL! Holding foul on Michael Simmons. [Team fouls: 1] No free throws, side out. (Michael Simmons: 1 personal fouls)

[09:33] Team_079 possession (Score: 91-91)
Khris Embiid attempts a 3Pt. Contested by Manu Anthony (4.3 feet, MAN). Khris Embiid misses. Rebound secured by Michael Simmons.

[09:18] Team_015 possession (Score: 91-91)
Manu Anthony attempts a Midrange. Contested by Miles Ming (4.9 feet, ZONE). Manu Anthony misses. Rebound secured by Donovan Randle.

[09:04] Team_079 possession (Score: 91-91)
Miles Ming attempts a 3Pt. Contested by Manu Anthony (4.3 feet, ZONE). MILES MING MAKES IT! Assist: Donovan Randle
Score: 94-91

[08:45] Team_015 possession (Score: 94-91)
Manu Anthony attempts a 3Pt. Contested by Khris Embiid (5.2 feet, MAN). MANU ANTHONY MAKES IT! Assist: Scottie Gasol
Score: 94-94

[08:32] Team_079 possession (Score: 94-94)
Donovan Randle makes the Dunk and draws the foul on Trae Turner! And-1! Donovan Randle to the line for 1. [Team fouls: 2] (Trae Turner: 1 personal fouls)   FT 1/1: GOOD Donovan Randle makes 1/1 from the line.
Score: 97-94

[08:18] Team_015 possession (Score: 97-94)
Scottie Gasol drives, Trae Durant stays with him. Scottie Gasol attempts a Layup. Contested by Trae Durant (3.6 feet, MAN). Scottie Gasol misses. Rebound secured by Donovan Randle.

[08:02] Team_079 possession (Score: 97-94)
Trae Durant attempts a Midrange. Contested by Scottie Gasol (4.0 feet, MAN). Trae Durant misses. Rebound secured by Michael Simmons.

[07:48] Team_015 possession (Score: 97-94)
Michael Simmons attempts a 3Pt. Contested by Trae Durant (3.6 feet, ZONE). Michael Simmons misses. Rebound secured by Donovan Randle.

[07:37] Team_079 possession (Score: 97-94)
Khris Embiid attempts a 3Pt. Contested by Manu Anthony (4.6 feet, ZONE). Khris Embiid misses. Rebound secured by Michael Simmons.

[07:21] Team_015 possession (Score: 97-94)
Manu Anthony attempts a 3Pt. Contested by Khris Embiid (5.4 feet, MAN). MANU ANTHONY MAKES IT! Assist: Scottie Gasol
Score: 97-97

[07:02] Team_079 possession (Score: 97-97)
Bam Randle attempts a 3Pt. Contested by CJ Banchero (4.8 feet, MAN). Bam Randle misses. Offensive rebound by Donovan Randle! Donovan Randle kicks it out.

[06:49] Team_079 possession (Score: 97-97)
Bam Randle attempts a 3Pt. Contested by CJ Banchero (4.8 feet, MAN). Bam Randle misses. Offensive rebound by Trae Durant! Trae Durant kicks it out.

[06:36] Team_079 possession (Score: 97-97)
Miles Ming attempts a 3Pt. Contested by Michael Simmons (4.4 feet, MAN). Miles Ming misses. Rebound secured by Michael Simmons.

[06:22] Team_015 possession (Score: 97-97)
FOUL! Holding foul on Khris Embiid. [IN THE BONUS! 5 team fouls] Manu Anthony to the line for 2 free throws. (Khris Embiid: 2 personal fouls)   FT 1/2: GOOD   FT 2/2: GOOD Manu Anthony makes 2/2 from the line.
Score: 97-99

[06:12] Team_079 possession (Score: 97-99)
Khris Embiid drives, Scottie Gasol stays with him. Khris Embiid attempts a Dunk. Contested by Scottie Gasol (4.7 feet, ZONE). Khris Embiid misses. Rebound secured by CJ Banchero.

[05:55] Team_015 possession (Score: 97-99)
Trae Turner drives, picks up Donovan Randle. Help arrives from Miles Ming! Trae Turner attempts a Dunk. Contested by Miles Ming (5.3 feet, MAN). TRAE TURNER MAKES IT! Assist: Manu Anthony
Score: 97-101

[05:37] Team_079 possession (Score: 97-101)
Miles Ming drives and kicks out. Trae Durant attempts a 3Pt. Contested by Michael Simmons (4.5 feet, ZONE). Trae Durant misses. Rebound secured by Michael Simmons.

[05:22] Team_015 possession (Score: 97-101)
CJ Banchero attempts a Layup. Contested by Bam Randle (5.1 feet, MAN). CJ Banchero misses. Rebound secured by Bam Randle.

[05:05] Team_079 possession (Score: 97-101)
Miles Ming attempts a 3Pt. Contested by Michael Simmons (4.6 feet, MAN). Miles Ming misses. Rebound secured by CJ Banchero.

[04:49] Team_015 possession (Score: 97-101)
Trae Turner attempts a Layup. Contested by Donovan Randle (5.5 feet, MAN). Trae Turner misses. Rebound secured by Donovan Randle.

[04:34] Team_079 possession (Score: 97-101)
FOUL! Reach-in foul on Scottie Gasol during the drive. [Team fouls: 3] No free throws, side out. (Scottie Gasol: 1 personal fouls)

[04:21] Team_079 possession (Score: 97-101)
Trae Durant attempts a Layup. Contested by Scottie Gasol (4.6 feet, MAN). Trae Durant misses. Rebound secured by CJ Banchero.

[04:04] Team_015 possession (Score: 97-101)
CJ Banchero attempts a Midrange. Contested by Trae Durant (4.0 feet, ZONE). CJ BANCHERO MAKES IT!
Score: 97-103

[03:46] Team_079 possession (Score: 97-103)
Khris Embiid attempts a 3Pt. Contested by Manu Anthony (5.1 feet, MAN). Khris Embiid misses. Rebound secured by Michael Simmons.

[03:32] Team_015 possession (Score: 97-103)
FOUL! Shooting foul on Trae Durant. Scottie Gasol to the line for 2 free throws. [BONUS: 6 team fouls] (Trae Durant: 2 personal fouls)   FT 1/2: MISS   FT 2/2: GOOD Scottie Gasol makes 1/2 from the line.
Score: 97-104

[03:17] Team_079 possession (Score: 97-104)
FOUL! Shooting foul on Michael Simmons. Miles Ming to the line for 2 free throws. [Team fouls: 4] (Michael Simmons: 2 personal fouls)   FT 1/2: GOOD   FT 2/2: MISS Miles Ming makes 1/2 from the line. Rebound secured by Scottie Gasol.
Score: 98-104

[03:06] Team_015 possession (Score: 98-104)
Scottie Gasol attempts a 3Pt. Contested by Trae Durant (4.3 feet, ZONE). Scottie Gasol misses. Rebound secured by Trae Durant.

[02:50] Team_079 possession (Score: 98-104)
Donovan Randle attempts a 3Pt. Contested by Trae Turner (5.3 feet, MAN). Donovan Randle misses. Rebound secured by Michael Simmons.

[02:36] Team_015 possession (Score: 98-104)
CJ Banchero attempts a 3Pt. Contested by Trae Durant (4.2 feet, ZONE). CJ Banchero misses. Rebound secured by Trae Durant.

[02:16] Team_079 possession (Score: 98-104)
Donovan Randle attempts a Layup. BLOCKED BY TRAE TURNER! Ball is loose! Offensive rebound by Trae Durant! Trae Durant kicks it out.

[02:01] Team_079 possession (Score: 98-104)
Bam Randle loses the ball! Stripped by CJ Banchero! TURNOVER! (live ball)

[01:45] Team_015 possession (Score: 98-104)
Scottie Gasol attempts a Layup. BLOCKED BY TRAE DURANT! Ball goes out off Trae Durant. Scottie Gasol's ball!

[01:29] Team_015 possession (Score: 98-104)
Michael Simmons drives, picks up Trae Durant. Help arrives from Miles Ming! Michael Simmons attempts a Dunk. Contested by Miles Ming (4.5 feet, ZONE). MICHAEL SIMMONS MAKES IT! Assist: Trae Turner
Score: 98-106

[01:14] Team_079 possession (Score: 98-106)
FOUL! Offensive foul on Miles Ming! Michael Simmons drew the charge! [Team fouls: 7] (Miles Ming: 1 personal fouls) TURNOVER! (dead ball)

[00:59] Team_015 possession (Score: 98-106)
Manu Anthony attempts a 3Pt. Wide open! Khris Embiid is 6.1 feet away. [MAN] MANU ANTHONY MAKES IT! Assist: Trae Turner
Score: 98-109

[00:47] Team_079 possession (Score: 98-109)
FOUL! Shooting foul on Scottie Gasol. Donovan Randle to the line for 2 free throws. [BONUS: 5 team fouls] (Scottie Gasol: 2 personal fouls)   FT 1/2: GOOD   FT 2/2: GOOD Donovan Randle makes 2/2 from the line.
Score: 100-109

[00:32] Team_015 possession (Score: 100-109)
CJ Banchero attempts a 3Pt. Contested by Trae Durant (4.5 feet, ZONE). CJ BANCHERO MAKES IT! Assist: Trae Turner
Score: 100-112

[00:17] Team_079 possession (Score: 100-112)
Bam Randle attempts a 3Pt. Contested by CJ Banchero (5.8 feet, MAN). Bam Randle misses. Rebound secured by Michael Simmons.

[00:02] Team_015 possession (Score: 100-112)
Trae Turner drives and kicks out. Michael Simmons makes the Midrange and draws the foul on Miles Ming! And-1! Michael Simmons to the line for 1. [BONUS: 8 team fouls] (Miles Ming: 2 personal fouls)   FT 1/1: GOOD Michael Simmons makes 1/1 from the line.
Score: 100-115

================================================================================
                              4TH QUARTER COMPLETE                              
================================================================================

4TH QUARTER SCORE: Team_079 9, Team_015 30

BOX SCORE:
================================================================================

Team_079
--------------------------------------------------------------------------------
Player                MIN  PTS  REB  AST  TO      FG   FG%      3P   3P%
--------------------------------------------------------------------------------
Donovan Randle         45    5    5    1   0   2/3    66.7     0/0   0.0
Miles Ming             48    3    0    0   0   1/5    20.0     0/0   0.0
Bam Randle             48    0    1    0   0   0/2     0.0     0/0   0.0
Trae Durant            48    0    6    0   0   0/3     0.0     0/0   0.0
Khris Embiid           48    0    0    0   0   0/4     0.0     0/0   0.0

TEAM: FG: 3/17 (17.6%), 3PT: 1/8 (12.5%), REB: 12 (3 off, 9 def), AST: 1, TO: 4
TEAM FOULS: 8 [Team_015 in BONUS]


Team_015
--------------------------------------------------------------------------------
Player                MIN  PTS  REB  AST  TO      FG   FG%      3P   3P%
--------------------------------------------------------------------------------
Manu Anthony           48   11    0    1   0   4/6    66.7     0/0   0.0
CJ Banchero            48    8    3    0   0   3/6    50.0     0/0   0.0
Trae Turner            45    5    1    3   0   2/3    66.7     0/0   0.0
Michael Simmons        48    5    9    0   0   2/3    66.7     0/0   0.0
Scottie Gasol          48    1    1    2   0   1/3    33.3     0/0   0.0

TEAM: FG: 12/21 (57.1%), 3PT: 4/8 (50.0%), REB: 14 (0 off, 14 def), AST: 6, TO: 0
TEAM FOULS: 5 [Team_079 in BONUS]

================================================================================

================================================================================
                               FULL GAME COMPLETE                               
================================================================================

FINAL SCORE: Team_079 100, Team_015 115

SCORING BY QUARTER:
--------------------------------------------------------------------------------
Team                     Q1     Q2     Q3     Q4    FINAL
--------------------------------------------------------------------------------
Team_079                 32     32     27      9      100
Team_015                 36     25     24     30      115
--------------------------------------------------------------------------------

FULL GAME BOX SCORE:
================================================================================

Team_079
--------------------------------------------------------------------------------
Player                MIN  PTS  REB  AST  TO      FG   FG%      3P   3P%      FT STL BLK
--------------------------------------------------------------------------------
Khris Embiid           48   15    0    7   2   8/16   50.0   3/8    37.5   5/7     0   0
Miles Ming             48   17    0    2   1   6/15   40.0   4/11   36.4   3/5     0   1
Bam Randle             48   13    6    5   2   6/13   46.2   1/6    16.7   2/2     0   0
Trae Durant            48   31   17    1   1  10/19   52.6   4/8    50.0   2/2     2   2
Donovan Randle         45   16   14    7   2   7/13   53.8   0/2     0.0   8/8     0   0
James LaVine            4    0    3    0   0   0/1     0.0   0/0     0.0   0/0     0   0
Evan Mobley             1    2    0    0   0   1/1   100.0   0/0     0.0   0/0     0   0
Karl Ingram             1    2    0    0   0   1/1   100.0   0/0     0.0   0/0     0   0
Anthony Wade            1    0    0    0   0   0/0     0.0   0/0     0.0   0/0     0   0
Kobe Curry              1    0    0    1   0   0/0     0.0   0/0     0.0   0/0     0   0

TEAM: FG: 40/80 (50.0%), 3PT: 12/35 (34.3%), REB: 40 (13 off, 27 def), AST: 23, TO: 8


Team_015
--------------------------------------------------------------------------------
Player                MIN  PTS  REB  AST  TO      FG   FG%      3P   3P%      FT STL BLK
--------------------------------------------------------------------------------
Manu Anthony           48   25    0    4   2  12/18   66.7   3/5    60.0   8/10    0   0
Michael Simmons        48   19   16    0   0   7/11   63.6   2/3    66.7   5/6     0   0
CJ Banchero            48   17   19    2   3   6/13   46.2   3/6    50.0   4/4     2   0
Scottie Gasol          48   25    1    4   1  12/21   57.1   1/4    25.0   8/9     1   0
Trae Turner            45   27   13    6   2  10/13   76.9   0/2     0.0   8/8     0   2
Allen Curry             4    0    1    1   0   0/0     0.0   0/0     0.0   0/0     0   1
Dwyane Sabonis          1    0    0    0   0   0/0     0.0   0/0     0.0   0/0     0   0
Paolo Jokic             1    0    0    0   0   0/1     0.0   0/1     0.0   0/0     0   0
Magic Wagner            1    0    0    0   0   0/0     0.0   0/0     0.0   0/0     0   0
Rudy Paul               1    0    0    0   0   0/0     0.0   0/0     0.0   0/0     0   0

TEAM: FG: 48/78 (61.5%), 3PT: 9/21 (42.9%), REB: 49 (12 off, 37 def), AST: 17, TO: 8

================================================================================
