================================================================================
                        FULL GAME - Team_050 vs Team_100                        
================================================================================

================================================================================
                       1ST QUARTER - Team_050 vs Team_100                       
================================================================================

[12:00] Team_050 possession (Score: 0-0)
LeBron Bridges attempts a Midrange. Contested by Tyler Griffin (4.9 feet, ZONE). LEBRON BRIDGES MAKES IT!
Score: 2-0

[11:47] Team_100 possession (Score: 2-0)
Pau LaVine attempts a Layup. Contested by LeBron Bridges (4.2 feet, MAN). Pau LaVine misses. Rebound secured by LeBron Bridges.

[11:30] Team_050 possession (Score: 2-0)
Collin Bane drives, Pau LaVine stays with him. Collin Bane attempts a Dunk. Contested by Pau LaVine (4.7 feet, ZONE). COLLIN BANE MAKES IT! Assist: LeBron Bridges
Score: 4-0

[11:18] Team_100 possession (Score: 4-0)
FOUL! Reach-in foul on Giannis LaVine during the drive. [Team fouls: 1] No free throws, side out. (Giannis LaVine: 1 personal fouls)

[11:02] Team_100 possession (Score: 4-0)
Chris Mobley attempts a Midrange. Contested by LeBron Bridges (4.5 feet, ZONE). Chris Mobley misses. Rebound secured by LeBron Bridges.

[10:47] Team_050 possession (Score: 4-0)
Giannis LaVine attempts a 3Pt. Contested by Luka Green (5.8 feet, MAN). Giannis LaVine misses. Rebound secured by Chris Mobley.

[10:31] Team_100 possession (Score: 4-0)
Luka Green attempts a Midrange. Contested by Giannis LaVine (4.1 feet, MAN). LUKA GREEN MAKES IT!
Score: 4-2

[10:15] Team_050 possession (Score: 4-2)
Collin Bane attempts a 3Pt. Contested by Luka Green (5.5 feet, ZONE). Collin Bane misses. Rebound secured by Tyler Griffin.

[09:59] Team_100 possession (Score: 4-2)
Luka Green drives to the basket... Luka Green throws a bad pass! Stolen by Giannis LaVine! TURNOVER! (live ball)

[09:45] Team_050 possession (Score: 4-2)
Joel Banchero attempts a Layup. Contested by Pau LaVine (4.3 feet, ZONE). Joel Banchero misses. Offensive rebound by LeBron Bridges! LeBron Bridges kicks it out.

[09:28] Team_050 possession (Score: 4-2)
Donovan Trent attempts a Midrange. Contested by Chris Mobley (5.0 feet, MAN). Donovan Trent misses. FOUL! Loose ball foul on Tyler Griffin during the rebound battle. [Team fouls: 1] No free throws, side out. (Tyler Griffin: 1 personal fouls)

[09:12] Team_050 possession (Score: 4-2)
Collin Bane attempts a Midrange. Contested by Tyler Griffin (4.9 feet, ZONE). COLLIN BANE MAKES IT! Assist: Donovan Trent
Score: 6-2

[08:57] Team_100 possession (Score: 6-2)
Manu Ball attempts a Midrange. Contested by Joel Banchero (4.3 feet, MAN). Manu Ball misses. Rebound secured by LeBron Bridges.

[08:44] Team_050 possession (Score: 6-2)
Collin Bane attempts a 3Pt. Contested by Tyler Griffin (4.9 feet, MAN). Collin Bane misses. Rebound secured by Chris Mobley.

[08:30] Team_100 possession (Score: 6-2)
Manu Ball attempts a 3Pt. Contested by Joel Banchero (4.3 feet, MAN). MANU BALL MAKES IT! Assist: Tyler Griffin
Score: 6-5

[08:10] Team_050 possession (Score: 6-5)
Collin Bane attempts a 3Pt. Contested by Luka Green (5.5 feet, ZONE). Collin Bane misses. Rebound secured by Pau LaVine.

[07:56] Team_100 possession (Score: 6-5)
Tyler Griffin attempts a 3Pt. Contested by Giannis LaVine (4.1 feet, ZONE). Tyler Griffin misses. Rebound secured by Collin Bane.

[07:42] Team_050 possession (Score: 6-5)
Joel Banchero attempts a 3Pt. Contested by Manu Ball (5.9 feet, MAN). Joel Banchero misses. Offensive rebound by LeBron Bridges! LeBron Bridges kicks it out.

[07:26] Team_050 possession (Score: 6-5)
Joel Banchero attempts a 3Pt. Contested by Luka Green (5.2 feet, ZONE). JOEL BANCHERO MAKES IT! Assist: LeBron Bridges
Score: 9-5

[07:10] Team_100 possession (Score: 9-5)
Manu Ball attempts a Layup. BLOCKED BY COLLIN BANE! Ball is loose! Rebound secured by LeBron Bridges.

[06:57] Team_050 possession (Score: 9-5)
FOUL! Holding foul on Manu Ball. [Team fouls: 2] No free throws, side out. (Manu Ball: 1 personal fouls)

[06:44] Team_050 possession (Score: 9-5)
Giannis LaVine attempts a 3Pt. Contested by Luka Green (5.8 feet, MAN). Giannis LaVine misses. Rebound secured by Tyler Griffin.

[06:31] Team_100 possession (Score: 9-5)
Tyler Griffin makes the Layup and draws the foul on Collin Bane! And-1! Tyler Griffin to the line for 1. [Team fouls: 2] (Collin Bane: 1 personal fouls)   FT 1/1: GOOD Tyler Griffin makes 1/1 from the line.
Score: 9-8

[06:14] Team_050 possession (Score: 9-8)
Collin Bane attempts a 3Pt. Contested by Luka Green (5.5 feet, ZONE). Collin Bane misses. Rebound secured by Tyler Griffin.

[05:57] Team_100 possession (Score: 9-8)
Tyler Griffin attempts a Midrange. Contested by Collin Bane (4.3 feet, ZONE). Tyler Griffin misses. Offensive rebound by Pau LaVine! Pau LaVine kicks it out.

[05:44] Team_100 possession (Score: 9-8)
Manu Ball drives to the basket... FOUL! Offensive foul on Manu Ball! Joel Banchero drew the charge! [Team fouls: 3] (Manu Ball: 2 personal fouls) TURNOVER! (dead ball)

[05:31] Team_050 possession (Score: 9-8)
LeBron Bridges makes the Midrange and draws the foul on Pau LaVine! And-1! LeBron Bridges to the line for 1. [Team fouls: 4] (Pau LaVine: 1 personal fouls)   FT 1/1: MISS LeBron Bridges makes 0/1 from the line. Rebound secured by Pau LaVine.
Score: 11-8

[05:16] Team_100 possession (Score: 11-8)
Luka Green attempts a Layup. Contested by Giannis LaVine (4.1 feet, MAN). Luka Green misses. Rebound secured by LeBron Bridges.

[05:02] Team_050 possession (Score: 11-8)
Collin Bane attempts a 3Pt. Contested by Tyler Griffin (5.0 feet, MAN). COLLIN BANE MAKES IT!
Score: 14-8

[04:49] Team_100 possession (Score: 14-8)
Manu Ball attempts a Midrange. Contested by Joel Banchero (4.3 feet, ZONE). Manu Ball misses. Offensive rebound by Pau LaVine! Pau LaVine kicks it out.

[04:32] Team_100 possession (Score: 14-8)
Tyler Griffin attempts a 3Pt. Contested by Collin Bane (4.3 feet, MAN). Tyler Griffin misses. Rebound secured by Collin Bane.

[04:22] Team_050 possession (Score: 14-8)
Giannis LaVine makes the Layup and draws the foul on Pau LaVine! And-1! Giannis LaVine to the line for 1. [BONUS: 5 team fouls] (Pau LaVine: 2 personal fouls)   FT 1/1: GOOD Giannis LaVine makes 1/1 from the line.
Score: 17-8

[04:12] Team_100 possession (Score: 17-8)
Chris Mobley attempts a Layup. Contested by Donovan Trent (5.2 feet, MAN). CHRIS MOBLEY MAKES IT! Assist: Luka Green
Score: 17-10

[04:03] Team_050 possession (Score: 17-10)
Collin Bane attempts a 3Pt. BLOCKED BY LUKA GREEN! Ball is loose! Offensive rebound by Collin Bane! Collin Bane kicks it out.

[03:52] Team_050 possession (Score: 17-10)
FOUL! Reach-in foul on Luka Green during the drive. [IN THE BONUS! 6 team fouls] Giannis LaVine to the line for 2 free throws. (Luka Green: 1 personal fouls)   FT 1/2: GOOD   FT 2/2: GOOD Giannis LaVine makes 2/2 from the line.
Score: 19-10

[03:33] Team_100 possession (Score: 19-10)
Tyler Griffin makes the Layup and draws the foul on Donovan Trent! And-1! Tyler Griffin to the line for 1. [Team fouls: 3] (Donovan Trent: 1 personal fouls)   FT 1/1: GOOD Tyler Griffin makes 1/1 from the line.
Score: 19-13

[03:18] Team_050 possession (Score: 19-13)
Giannis LaVine attempts a Midrange. Wide open! Manu Ball is 6.6 feet away. [ZONE] GIANNIS LAVINE MAKES IT!
Score: 21-13

[03:06] Team_100 possession (Score: 21-13)
Pau LaVine drives, LeBron Bridges stays with him. Pau LaVine attempts a Layup. Contested by LeBron Bridges (4.5 feet, MAN). PAU LAVINE MAKES IT! Assist: Chris Mobley
Score: 21-15

[02:48] Team_050 possession (Score: 21-15)
Donovan Trent attempts a Layup. Contested by Pau LaVine (4.5 feet, ZONE). DONOVAN TRENT MAKES IT! Assist: LeBron Bridges
Score: 23-15

[02:36] Team_100 possession (Score: 23-15)
Tyler Griffin attempts a 3Pt. Contested by Giannis LaVine (4.3 feet, ZONE). Tyler Griffin misses. Rebound secured by Joel Banchero.

[02:23] Team_050 possession (Score: 23-15)
Collin Bane attempts a Layup. Contested by Tyler Griffin (5.2 feet, MAN). Collin Bane misses. Rebound secured by Tyler Griffin.

[02:07] Team_100 possession (Score: 23-15)
Manu Ball makes the 3Pt and draws the foul on Giannis LaVine! And-1! Manu Ball to the line for 1. [Team fouls: 4] (Giannis LaVine: 2 personal fouls)   FT 1/1: GOOD Manu Ball makes 1/1 from the line.
Score: 23-19

[01:52] Team_050 possession (Score: 23-19)
FOUL! Holding foul on Tyler Griffin. [IN THE BONUS! 7 team fouls] Collin Bane to the line for 2 free throws. (Tyler Griffin: 2 personal fouls)   FT 1/2: GOOD   FT 2/2: GOOD Collin Bane makes 2/2 from the line.
Score: 25-19

[01:40] Team_100 possession (Score: 25-19)
Manu Ball commits a violation (traveling/carry)! TURNOVER! (dead ball)

[01:40] Substitution (Team_050): Giannis LaVine OUT → Damian O'Neal IN (stamina_rule2)

[01:40] Substitution (Team_050): Joel Banchero OUT → Dwyane Towns IN (stamina_rule2)

[01:40] Substitution (Team_050): Collin Bane OUT → Larry Curry IN (stamina_rule2)

[01:40] Substitution (Team_050): LeBron Bridges OUT → Luka Gasol IN (stamina_rule2)

[01:40] Substitution (Team_050): Donovan Trent OUT → Tyler Smith IN (stamina_rule2)

[01:40] Substitution (Team_100): Luka Green OUT → Dirk Sabonis IN (stamina_rule2)

[01:40] Substitution (Team_100): Manu Ball OUT → Evan Butler IN (stamina_rule2)

[01:40] Substitution (Team_100): Tyler Griffin OUT → Tyrese Wade IN (stamina_rule2)

[01:40] Substitution (Team_100): Pau LaVine OUT → Carmelo Ginobili IN (stamina_rule2)

[01:40] Substitution (Team_100): Chris Mobley OUT → John Rozier IN (stamina_rule2)

[01:28] Team_050 possession (Score: 25-19)
Tyler Smith drives and kicks out. Damian O'Neal attempts a 3Pt. Contested by Dirk Sabonis (5.7 feet, MAN). DAMIAN O'NEAL MAKES IT! Assist: Dwyane Towns
Score: 28-19

[01:18] Team_100 possession (Score: 28-19)
Carmelo Ginobili drives and kicks out. John Rozier attempts a 3Pt. Contested by Luka Gasol (4.9 feet, ZONE). John Rozier misses. Rebound secured by Larry Curry.

[01:03] Team_050 possession (Score: 28-19)
Dwyane Towns attempts a 3Pt. Contested by Evan Butler (5.3 feet, MAN). Dwyane Towns misses. Rebound secured by Tyrese Wade.

[00:44] Team_100 possession (Score: 28-19)
FOUL! Holding foul on Damian O'Neal. [IN THE BONUS! 5 team fouls] Dirk Sabonis to the line for 2 free throws. (Damian O'Neal: 1 personal fouls)   FT 1/2: MISS   FT 2/2: GOOD Dirk Sabonis makes 1/2 from the line.
Score: 28-20

[00:30] Team_050 possession (Score: 28-20)
Dwyane Towns attempts a 3Pt. Contested by Evan Butler (5.3 feet, MAN). Dwyane Towns misses. FOUL! Loose ball foul on Carmelo Ginobili during the rebound battle. [IN THE BONUS! 8 team fouls] Larry Curry to the line for 2 free throws. (Carmelo Ginobili: 1 personal fouls)   FT 1/2: GOOD   FT 2/2: GOOD Larry Curry makes 2/2 from the line.
Score: 30-20

[00:15] Team_100 possession (Score: 30-20)
Carmelo Ginobili attempts a 3Pt. Contested by Luka Gasol (4.6 feet, MAN). CARMELO GINOBILI MAKES IT! Assist: John Rozier
Score: 30-23

[00:01] Team_050 possession (Score: 30-23)
Luka Gasol drives and kicks out. Damian O'Neal attempts a 3Pt. Contested by Dirk Sabonis (5.7 feet, MAN). Damian O'Neal misses. Rebound secured by John Rozier.

================================================================================
                              1ST QUARTER COMPLETE                              
================================================================================

1ST QUARTER SCORE: Team_050 30, Team_100 23

BOX SCORE:
================================================================================

Team_050
--------------------------------------------------------------------------------
Player                MIN  PTS  REB  AST  TO      FG   FG%      3P   3P%
--------------------------------------------------------------------------------
Collin Bane            11    9    4    0   0   4/9    44.4     0/0   0.0
Giannis LaVine         11    7    0    0   0   3/5    60.0     0/0   0.0
Joel Banchero          11    3    1    0   0   1/1   100.0     0/0   0.0
Damian O'Neal           2    3    0    0   0   1/1   100.0     0/0   0.0
LeBron Bridges         11    2    7    3   0   1/2    50.0     0/0   0.0
Donovan Trent          11    2    0    1   0   1/1   100.0     0/0   0.0
Larry Curry             2    2    1    0   0   1/1   100.0     0/0   0.0
Dwyane Towns            2    0    0    1   0   0/1     0.0     0/0   0.0
Luka Gasol              2    0    0    0   0   0/1     0.0     0/0   0.0

TEAM: FG: 12/22 (54.5%), 3PT: 3/10 (30.0%), REB: 13 (4 off, 9 def), AST: 5, TO: 0
TEAM FOULS: 5 [Team_100 in BONUS]


Team_100
--------------------------------------------------------------------------------
Player                MIN  PTS  REB  AST  TO      FG   FG%      3P   3P%
--------------------------------------------------------------------------------
Manu Ball              11    7    0    0   0   2/4    50.0     0/0   0.0
Tyler Griffin          11    6    4    1   0   2/5    40.0     0/0   0.0
Carmelo Ginobili        2    3    0    0   0   1/2    50.0     0/0   0.0
Pau LaVine             11    2    4    0   0   1/2    50.0     0/0   0.0
Chris Mobley           11    2    2    1   0   1/2    50.0     0/0   0.0
Luka Green             11    2    0    1   0   1/2    50.0     0/0   0.0
Dirk Sabonis            2    1    0    0   0   1/1   100.0     0/0   0.0
Tyrese Wade             2    0    1    0   0   0/0     0.0     0/0   0.0
John Rozier             2    0    1    1   0   0/0     0.0     0/0   0.0

TEAM: FG: 9/18 (50.0%), 3PT: 3/6 (50.0%), REB: 12 (2 off, 10 def), AST: 4, TO: 3
TEAM FOULS: 8 [Team_050 in BONUS]

================================================================================

================================================================================
                       2ND QUARTER - Team_050 vs Team_100                       
================================================================================

[12:00] Team_050 possession (Score: 30-23)
Donovan Trent attempts a Layup. Contested by Chris Mobley (5.1 feet, MAN). DONOVAN TRENT MAKES IT!
Score: 32-23

[11:43] Team_100 possession (Score: 32-23)
Pau LaVine attempts a 3Pt. Contested by Giannis LaVine (4.0 feet, ZONE). Pau LaVine misses. Rebound secured by Joel Banchero.

[11:27] Team_050 possession (Score: 32-23)
FOUL! Holding foul on Chris Mobley. [Team fouls: 1] No free throws, side out. (Chris Mobley: 1 personal fouls)

[11:12] Team_050 possession (Score: 32-23)
LeBron Bridges attempts a 3Pt. Contested by Pau LaVine (4.8 feet, MAN). LEBRON BRIDGES MAKES IT! Assist: Donovan Trent
Score: 35-23

[10:58] Team_100 possession (Score: 35-23)
Chris Mobley attempts a 3Pt. Contested by Giannis LaVine (4.3 feet, ZONE). Chris Mobley misses. Rebound secured by Joel Banchero.

[10:44] Team_050 possession (Score: 35-23)
Joel Banchero drives to the basket... Joel Banchero loses control! Ball rolls out of bounds! TURNOVER! (dead ball)

[10:44] Substitution (Team_050): LeBron Bridges OUT → Luka Gasol IN (stamina_rule2)

[10:44] Substitution (Team_050): Donovan Trent OUT → Tyler Smith IN (stamina_rule2)

[10:44] Substitution (Team_100): Chris Mobley OUT → John Rozier IN (stamina_rule2)

[10:35] Team_100 possession (Score: 35-23)
John Rozier attempts a Midrange. Contested by Collin Bane (4.6 feet, ZONE). John Rozier misses. Offensive rebound by Pau LaVine! Pau LaVine kicks it out.

[10:26] Team_100 possession (Score: 35-23)
Manu Ball drives, picks up Tyler Smith. Help arrives from Joel Banchero! Manu Ball attempts a Layup. Contested by Joel Banchero (5.2 feet, ZONE). MANU BALL MAKES IT!
Score: 35-25

[10:07] Team_050 possession (Score: 35-25)
Giannis LaVine attempts a 3Pt. Contested by Luka Green (5.9 feet, ZONE). Giannis LaVine misses. FOUL! Loose ball foul on Pau LaVine during the rebound battle. [Team fouls: 2] No free throws, side out. (Pau LaVine: 1 personal fouls)

[09:50] Team_050 possession (Score: 35-25)
Giannis LaVine drives and kicks out. Luka Gasol attempts a 3Pt. Contested by Tyler Griffin (5.1 feet, ZONE). LUKA GASOL MAKES IT! Assist: Joel Banchero
Score: 38-25

[09:36] Team_100 possession (Score: 38-25)
Pau LaVine attempts a Midrange. Contested by Joel Banchero (4.6 feet, ZONE). PAU LAVINE MAKES IT!
Score: 38-27

[09:23] Team_050 possession (Score: 38-27)
FOUL! Shooting foul on Pau LaVine. Luka Gasol to the line for 2 free throws. [Team fouls: 3] (Pau LaVine: 2 personal fouls)   FT 1/2: GOOD   FT 2/2: GOOD Luka Gasol makes 2/2 from the line.
Score: 40-27

[09:07] Team_100 possession (Score: 40-27)
Tyler Griffin attempts a 3Pt. Contested by Collin Bane (4.6 feet, MAN). Tyler Griffin misses. Rebound secured by Joel Banchero.

[08:54] Team_050 possession (Score: 40-27)
Giannis LaVine makes the Dunk and draws the foul on Luka Green! And-1! Giannis LaVine to the line for 1. [Team fouls: 4] (Luka Green: 1 personal fouls)   FT 1/1: GOOD Giannis LaVine makes 1/1 from the line.
Score: 43-27

[08:42] Team_100 possession (Score: 43-27)
Luka Green drives, Giannis LaVine stays with him. Luka Green attempts a Dunk. Contested by Giannis LaVine (4.5 feet, MAN). Luka Green misses. Rebound secured by Collin Bane.

[08:26] Team_050 possession (Score: 43-27)
FOUL! Holding foul on Pau LaVine. [IN THE BONUS! 5 team fouls] Luka Gasol to the line for 2 free throws. (Pau LaVine: 3 personal fouls)   FT 1/2: GOOD   FT 2/2: GOOD Luka Gasol makes 2/2 from the line.
Score: 45-27

[08:10] Team_100 possession (Score: 45-27)
John Rozier attempts a Midrange. Contested by Tyler Smith (5.5 feet, MAN). JOHN ROZIER MAKES IT!
Score: 45-29

[07:54] Team_050 possession (Score: 45-29)
Collin Bane drives and kicks out. Giannis LaVine attempts a 3Pt. Contested by Luka Green (5.7 feet, MAN). GIANNIS LAVINE MAKES IT! Assist: Collin Bane
Score: 48-29

[07:37] Team_100 possession (Score: 48-29)
Tyler Griffin attempts a 3Pt. Contested by Giannis LaVine (4.6 feet, ZONE). Tyler Griffin misses. Rebound secured by Collin Bane.

[07:21] Team_050 possession (Score: 48-29)
Luka Gasol makes the Dunk and draws the foul on Manu Ball! And-1! Luka Gasol to the line for 1. [BONUS: 6 team fouls] (Manu Ball: 1 personal fouls)   FT 1/1: GOOD Luka Gasol makes 1/1 from the line.
Score: 51-29

[07:09] Team_100 possession (Score: 51-29)
Manu Ball drives to the basket... Manu Ball loses control! Ball rolls out of bounds! TURNOVER! (dead ball)

[07:09] Substitution (Team_050): Giannis LaVine OUT → Damian O'Neal IN (stamina_rule2)

[07:09] Substitution (Team_050): Joel Banchero OUT → Dwyane Towns IN (stamina_rule2)

[07:09] Substitution (Team_050): Collin Bane OUT → Larry Curry IN (stamina_rule2)

[07:09] Substitution (Team_100): Luka Green OUT → Dirk Sabonis IN (stamina_rule2)

[07:09] Substitution (Team_100): Manu Ball OUT → Evan Butler IN (stamina_rule2)

[07:09] Substitution (Team_100): Tyler Griffin OUT → Tyrese Wade IN (stamina_rule2)

[07:09] Substitution (Team_100): Pau LaVine OUT → Carmelo Ginobili IN (stamina_rule2)

[06:52] Team_050 possession (Score: 51-29)
Tyler Smith drives and kicks out. Tyler Smith attempts a 3Pt. Contested by John Rozier (4.5 feet, MAN). Tyler Smith misses. Rebound secured by Tyrese Wade.

[06:38] Team_100 possession (Score: 51-29)
Evan Butler attempts a Midrange. Contested by Dwyane Towns (4.2 feet, MAN). EVAN BUTLER MAKES IT!
Score: 51-31

[06:23] Team_050 possession (Score: 51-31)
Luka Gasol attempts a Midrange. Contested by Dirk Sabonis (5.7 feet, ZONE). Luka Gasol misses. Offensive rebound by Larry Curry! Larry Curry kicks it out.

[06:07] Team_050 possession (Score: 51-31)
Dwyane Towns attempts a 3Pt. Contested by Evan Butler (5.3 feet, MAN). DWYANE TOWNS MAKES IT! Assist: Larry Curry
Score: 54-31

[05:53] Team_100 possession (Score: 54-31)
FOUL! Shooting foul on Damian O'Neal. Dirk Sabonis to the line for 2 free throws. [Team fouls: 1] (Damian O'Neal: 1 personal fouls)   FT 1/2: MISS   FT 2/2: GOOD Dirk Sabonis makes 1/2 from the line.
Score: 54-32

[05:36] Team_050 possession (Score: 54-32)
FOUL! Shooting foul on John Rozier. Tyler Smith to the line for 2 free throws. [BONUS: 7 team fouls] (John Rozier: 1 personal fouls)   FT 1/2: GOOD   FT 2/2: GOOD Tyler Smith makes 2/2 from the line.
Score: 56-32

[05:19] Team_100 possession (Score: 56-32)
John Rozier drives and kicks out. John Rozier attempts a Midrange. Contested by Dwyane Towns (4.3 feet, ZONE). John Rozier misses. Rebound secured by Larry Curry.

[05:07] Team_050 possession (Score: 56-32)
Dwyane Towns drives and kicks out. Dwyane Towns attempts a Midrange. Contested by Evan Butler (5.1 feet, MAN). Dwyane Towns misses. Rebound secured by Tyrese Wade.

[04:48] Team_100 possession (Score: 56-32)
FOUL! Shooting foul on Luka Gasol. Carmelo Ginobili to the line for 2 free throws. [Team fouls: 2] (Luka Gasol: 1 personal fouls)   FT 1/2: MISS   FT 2/2: GOOD Carmelo Ginobili makes 1/2 from the line.
Score: 56-33

[04:37] Team_050 possession (Score: 56-33)
Tyler Smith drives to the basket... Tyler Smith throws a bad pass! Stolen by John Rozier! TURNOVER! (live ball)

[04:20] Team_100 possession (Score: 56-33)
John Rozier makes the Layup and draws the foul on Tyler Smith! And-1! John Rozier to the line for 1. [Team fouls: 3] (Tyler Smith: 1 personal fouls)   FT 1/1: GOOD John Rozier makes 1/1 from the line.
Score: 56-36

[04:07] Team_050 possession (Score: 56-36)
Dwyane Towns drives, John Rozier stays with him. Dwyane Towns attempts a Dunk. Contested by John Rozier (4.9 feet, ZONE). DWYANE TOWNS MAKES IT! Assist: Larry Curry
Score: 58-36

[03:49] Team_100 possession (Score: 58-36)
Evan Butler attempts a 3Pt. Contested by Luka Gasol (4.9 feet, ZONE). Evan Butler misses. Rebound secured by Tyler Smith.

[03:33] Team_050 possession (Score: 58-36)
Tyler Smith attempts a 3Pt. Contested by Tyrese Wade (4.9 feet, ZONE). TYLER SMITH MAKES IT!
Score: 61-36

[03:19] Team_100 possession (Score: 61-36)
John Rozier drives and kicks out. Tyrese Wade attempts a 3Pt. Contested by Larry Curry (4.9 feet, MAN). Tyrese Wade misses. Rebound secured by Dwyane Towns.

[03:07] Team_050 possession (Score: 61-36)
Dwyane Towns attempts a 3Pt. Contested by Evan Butler (5.3 feet, MAN). Dwyane Towns misses. Offensive rebound by Larry Curry! Larry Curry kicks it out.

[02:51] Team_050 possession (Score: 61-36)
Larry Curry drives and kicks out. Tyler Smith attempts a 3Pt. Contested by Tyrese Wade (4.5 feet, ZONE). TYLER SMITH MAKES IT! Assist: Luka Gasol
Score: 64-36

[02:39] Team_100 possession (Score: 64-36)
John Rozier commits a violation (traveling/carry)! TURNOVER! (dead ball)

[02:23] Team_050 possession (Score: 64-36)
Damian O'Neal attempts a Midrange. Contested by Evan Butler (5.2 feet, ZONE). Damian O'Neal misses. Rebound secured by John Rozier.

[02:10] Team_100 possession (Score: 64-36)
Dirk Sabonis attempts a Midrange. Contested by Dwyane Towns (4.6 feet, ZONE). Dirk Sabonis misses. Rebound secured by Larry Curry.

[01:55] Team_050 possession (Score: 64-36)
Dwyane Towns attempts a 3Pt. Contested by Tyrese Wade (4.7 feet, ZONE). DWYANE TOWNS MAKES IT! Assist: Damian O'Neal
Score: 67-36

[01:40] Team_100 possession (Score: 67-36)
Tyrese Wade attempts a 3Pt. Contested by Luka Gasol (4.8 feet, ZONE). Tyrese Wade misses. Rebound secured by Larry Curry.

[01:29] Team_050 possession (Score: 67-36)
FOUL! Reach-in foul on John Rozier during the drive. [IN THE BONUS! 8 team fouls] Dwyane Towns to the line for 2 free throws. (John Rozier: 2 personal fouls)   FT 1/2: GOOD   FT 2/2: GOOD Dwyane Towns makes 2/2 from the line.
Score: 69-36

[01:14] Team_100 possession (Score: 69-36)
Dirk Sabonis drives and kicks out. John Rozier attempts a Midrange. Contested by Tyler Smith (5.5 feet, MAN). John Rozier misses. Offensive rebound by Carmelo Ginobili! Carmelo Ginobili kicks it out.

[01:01] Team_100 possession (Score: 69-36)
John Rozier drives, picks up Tyler Smith. Help arrives from Dwyane Towns! John Rozier attempts a Dunk. Contested by Dwyane Towns (5.8 feet, MAN). JOHN ROZIER MAKES IT! Assist: Evan Butler
Score: 69-38

[00:45] Team_050 possession (Score: 69-38)
Larry Curry makes the 3Pt and draws the foul on Tyrese Wade! And-1! Larry Curry to the line for 1. [BONUS: 9 team fouls] (Tyrese Wade: 1 personal fouls)   FT 1/1: GOOD Larry Curry makes 1/1 from the line.
Score: 73-38

[00:33] Team_100 possession (Score: 73-38)
John Rozier drives to the basket... John Rozier throws a bad pass out of bounds! TURNOVER! (dead ball)

[00:19] Team_050 possession (Score: 73-38)
Dwyane Towns drives and kicks out. FOUL! Shooting foul on Carmelo Ginobili. Luka Gasol to the line for 2 free throws. [BONUS: 10 team fouls] (Carmelo Ginobili: 1 personal fouls)   FT 1/2: GOOD   FT 2/2: GOOD Luka Gasol makes 2/2 from the line.
Score: 75-38

[00:01] Team_100 possession (Score: 75-38)
FOUL! Holding foul on Luka Gasol. [Team fouls: 4] No free throws, side out. (Luka Gasol: 2 personal fouls)

================================================================================
                              2ND QUARTER COMPLETE                              
================================================================================

2ND QUARTER SCORE: Team_050 45, Team_100 15

BOX SCORE:
================================================================================

Team_050
--------------------------------------------------------------------------------
Player                MIN  PTS  REB  AST  TO      FG   FG%      3P   3P%
--------------------------------------------------------------------------------
Luka Gasol             13   12    0    1   0   5/5   100.0     0/0   0.0
Dwyane Towns            9   10    1    0   0   4/5    80.0     0/0   0.0
Tyler Smith            13    8    1    0   0   3/4    75.0     0/0   0.0
Giannis LaVine         16    6    0    0   0   2/2   100.0     0/0   0.0
Larry Curry             9    4    5    2   0   1/1   100.0     0/0   0.0
LeBron Bridges         12    3    0    0   0   1/1   100.0     0/0   0.0
Donovan Trent          12    2    0    1   0   1/1   100.0     0/0   0.0
Joel Banchero          16    0    4    1   0   0/0     0.0     0/0   0.0
Collin Bane            16    0    2    1   0   0/0     0.0     0/0   0.0
Damian O'Neal           9    0    0    1   0   0/1     0.0     0/0   0.0

TEAM: FG: 17/20 (85.0%), 3PT: 5/5 (100.0%), REB: 13 (3 off, 10 def), AST: 7, TO: 2
TEAM FOULS: 4


Team_100
--------------------------------------------------------------------------------
Player                MIN  PTS  REB  AST  TO      FG   FG%      3P   3P%
--------------------------------------------------------------------------------
John Rozier            13    7    1    0   0   3/5    60.0     0/0   0.0
Pau LaVine             16    2    1    0   0   1/2    50.0     0/0   0.0
Manu Ball              16    2    0    0   0   1/1   100.0     0/0   0.0
Evan Butler             9    2    0    1   0   1/2    50.0     0/0   0.0
Dirk Sabonis            9    1    0    0   0   1/2    50.0     0/0   0.0
Carmelo Ginobili        9    1    1    0   0   1/1   100.0     0/0   0.0
Chris Mobley           12    0    0    0   0   0/1     0.0     0/0   0.0
Tyler Griffin          16    0    0    0   0   0/2     0.0     0/0   0.0
Luka Green             16    0    0    0   0   0/1     0.0     0/0   0.0
Tyrese Wade             9    0    2    0   0   0/1     0.0     0/0   0.0

TEAM: FG: 8/18 (44.4%), 3PT: 0/6 (0.0%), REB: 5 (2 off, 3 def), AST: 1, TO: 3
TEAM FOULS: 10 [Team_050 in BONUS]

================================================================================

================================================================================
                       3RD QUARTER - Team_050 vs Team_100                       
================================================================================

[12:00] Team_050 possession (Score: 75-38)
Joel Banchero attempts a 3Pt. Contested by Luka Green (5.2 feet, ZONE). Joel Banchero misses. Rebound secured by Tyler Griffin.

[11:44] Team_100 possession (Score: 75-38)
Manu Ball attempts a Layup. Contested by LeBron Bridges (4.2 feet, ZONE). MANU BALL MAKES IT! Assist: Luka Green
Score: 75-40

[11:26] Team_050 possession (Score: 75-40)
Collin Bane loses the ball! Stripped by Tyler Griffin! TURNOVER! (live ball)

[11:12] Team_100 possession (Score: 75-40)
Chris Mobley drives and kicks out. Pau LaVine attempts a 3Pt. Contested by Giannis LaVine (3.9 feet, ZONE). Pau LaVine misses. Rebound secured by LeBron Bridges.

[10:57] Team_050 possession (Score: 75-40)
Joel Banchero attempts a Midrange. Contested by Tyler Griffin (4.6 feet, ZONE). Joel Banchero misses. Rebound secured by Tyler Griffin.

[10:44] Team_100 possession (Score: 75-40)
Tyler Griffin attempts a Layup. Contested by Collin Bane (4.3 feet, MAN). TYLER GRIFFIN MAKES IT!
Score: 75-42

[10:30] Team_050 possession (Score: 75-42)
Collin Bane attempts a 3Pt. Contested by Luka Green (5.5 feet, ZONE). Collin Bane misses. Rebound secured by Pau LaVine.

[10:17] Team_100 possession (Score: 75-42)
Chris Mobley makes the Layup and draws the foul on Donovan Trent! And-1! Chris Mobley to the line for 1. [Team fouls: 1] (Donovan Trent: 1 personal fouls)   FT 1/1: GOOD Chris Mobley makes 1/1 from the line.
Score: 75-45

[10:06] Team_050 possession (Score: 75-45)
LeBron Bridges attempts a Midrange. Wide open! Manu Ball is 6.2 feet away. [ZONE] LeBron Bridges misses. Offensive rebound by LeBron Bridges! LeBron Bridges kicks it out.

[09:55] Team_050 possession (Score: 75-45)
Donovan Trent drives and kicks out. LeBron Bridges attempts a 3Pt. Contested by Pau LaVine (4.5 feet, MAN). LeBron Bridges misses. Rebound secured by Tyler Griffin.

[09:45] Team_100 possession (Score: 75-45)
Luka Green attempts a Layup. Contested by Giannis LaVine (4.1 feet, MAN). Luka Green misses. Rebound secured by Collin Bane.

[09:28] Team_050 possession (Score: 75-45)
Donovan Trent makes the Layup and draws the foul on Chris Mobley! And-1! Donovan Trent to the line for 1. [Team fouls: 1] (Chris Mobley: 1 personal fouls)   FT 1/1: MISS Donovan Trent makes 0/1 from the line. Rebound secured by Chris Mobley.
Score: 77-45

[09:13] Team_100 possession (Score: 77-45)
Luka Green attempts a 3Pt. Contested by Giannis LaVine (4.1 feet, ZONE). Luka Green misses. Offensive rebound by Chris Mobley! Chris Mobley kicks it out.

[08:58] Team_100 possession (Score: 77-45)
Luka Green drives, picks up Donovan Trent. Help arrives from Joel Banchero! Luka Green attempts a Dunk. Contested by Joel Banchero (5.0 feet, ZONE). LUKA GREEN MAKES IT!
Score: 77-47

[08:49] Team_050 possession (Score: 77-47)
Joel Banchero attempts a 3Pt. Contested by Manu Ball (5.9 feet, MAN). Joel Banchero misses. Rebound secured by Pau LaVine.

[08:34] Team_100 possession (Score: 77-47)
Chris Mobley drives and kicks out. Pau LaVine attempts a Midrange. Contested by LeBron Bridges (4.2 feet, MAN). Pau LaVine misses. Offensive rebound by Chris Mobley! Chris Mobley kicks it out.

[08:22] Team_100 possession (Score: 77-47)
Luka Green attempts a 3Pt. Contested by Giannis LaVine (4.1 feet, ZONE). LUKA GREEN MAKES IT! Assist: Chris Mobley
Score: 77-50

[08:07] Team_050 possession (Score: 77-50)
LeBron Bridges attempts a 3Pt. Contested by Luka Green (5.5 feet, ZONE). LEBRON BRIDGES MAKES IT! Assist: Collin Bane
Score: 80-50

[07:51] Team_100 possession (Score: 80-50)
Chris Mobley attempts a Midrange. Contested by LeBron Bridges (4.5 feet, ZONE). CHRIS MOBLEY MAKES IT!
Score: 80-52

[07:40] Team_050 possession (Score: 80-52)
Joel Banchero attempts a Midrange. Contested by Chris Mobley (5.0 feet, ZONE). Joel Banchero misses. Rebound secured by Pau LaVine.

[07:23] Team_100 possession (Score: 80-52)
Tyler Griffin attempts a Midrange. Contested by LeBron Bridges (4.4 feet, ZONE). Tyler Griffin misses. Offensive rebound by Pau LaVine! Pau LaVine kicks it out.

[07:08] Team_100 possession (Score: 80-52)
Pau LaVine drives and kicks out. FOUL! Shooting foul on Donovan Trent. Chris Mobley to the line for 2 free throws. [Team fouls: 2] (Donovan Trent: 2 personal fouls)   FT 1/2: MISS   FT 2/2: GOOD Chris Mobley makes 1/2 from the line.
Score: 80-53

[06:57] Team_050 possession (Score: 80-53)
Collin Bane attempts a 3Pt. Contested by Luka Green (5.5 feet, ZONE). COLLIN BANE MAKES IT! Assist: LeBron Bridges
Score: 83-53

[06:40] Team_100 possession (Score: 83-53)
Chris Mobley drives, Donovan Trent stays with him. Chris Mobley attempts a Layup. Contested by Donovan Trent (5.1 feet, MAN). Chris Mobley misses. Offensive rebound by Chris Mobley! Chris Mobley kicks it out.

[06:25] Team_100 possession (Score: 83-53)
Chris Mobley drives and kicks out. Chris Mobley attempts a 3Pt. Contested by Donovan Trent (4.8 feet, MAN). Chris Mobley misses. Rebound secured by Collin Bane.

[06:10] Team_050 possession (Score: 83-53)
Donovan Trent attempts a Midrange. Contested by Tyler Griffin (4.6 feet, ZONE). Donovan Trent misses. Rebound secured by Pau LaVine.

[05:54] Team_100 possession (Score: 83-53)
Chris Mobley attempts a Layup. Contested by Donovan Trent (5.1 feet, ZONE). Chris Mobley misses. Rebound secured by LeBron Bridges.

[05:44] Team_050 possession (Score: 83-53)
Donovan Trent attempts a Layup. Contested by Chris Mobley (5.0 feet, ZONE). Donovan Trent misses. Offensive rebound by Collin Bane! Collin Bane kicks it out.

[05:29] Team_050 possession (Score: 83-53)
Giannis LaVine makes the Layup and draws the foul on Luka Green! And-1! Giannis LaVine to the line for 1. [Team fouls: 2] (Luka Green: 1 personal fouls)   FT 1/1: GOOD Giannis LaVine makes 1/1 from the line.
Score: 86-53

[05:16] Team_100 possession (Score: 86-53)
Tyler Griffin attempts a 3Pt. Contested by Giannis LaVine (4.1 feet, ZONE). Tyler Griffin misses. Rebound secured by LeBron Bridges.

[04:57] Team_050 possession (Score: 86-53)
Giannis LaVine attempts a 3Pt. Contested by Tyler Griffin (5.3 feet, ZONE). Giannis LaVine misses. Rebound secured by Chris Mobley.

[04:45] Team_100 possession (Score: 86-53)
Manu Ball attempts a Layup. Contested by Donovan Trent (4.9 feet, ZONE). Manu Ball misses. Rebound secured by Joel Banchero.

[04:33] Team_050 possession (Score: 86-53)
Donovan Trent attempts a Midrange. Contested by Chris Mobley (5.1 feet, MAN). Donovan Trent misses. FOUL! Loose ball foul on Tyler Griffin during the rebound battle. [Team fouls: 3] No free throws, side out. (Tyler Griffin: 1 personal fouls)

[04:15] Team_050 possession (Score: 86-53)
Collin Bane attempts a Layup. Contested by Pau LaVine (4.8 feet, ZONE). Collin Bane misses. Rebound secured by Tyler Griffin.

[04:00] Team_100 possession (Score: 86-53)
Chris Mobley attempts a Layup. BLOCKED BY DONOVAN TRENT! Ball is loose! Rebound secured by Collin Bane.

[03:51] Team_050 possession (Score: 86-53)
Giannis LaVine drives to the basket... Giannis LaVine throws a bad pass! Stolen by Luka Green! TURNOVER! (live ball)

[03:34] Team_100 possession (Score: 86-53)
Luka Green drives, Giannis LaVine stays with him. Luka Green attempts a Layup. Contested by Giannis LaVine (4.3 feet, MAN). Luka Green misses. Rebound secured by LeBron Bridges.

[03:21] Team_050 possession (Score: 86-53)
LeBron Bridges attempts a Layup. Contested by Pau LaVine (4.9 feet, MAN). LEBRON BRIDGES MAKES IT!
Score: 88-53

[03:11] Team_100 possession (Score: 88-53)
Tyler Griffin attempts a 3Pt. Contested by Giannis LaVine (4.3 feet, ZONE). Tyler Griffin misses. Rebound secured by LeBron Bridges.

[02:57] Team_050 possession (Score: 88-53)
Joel Banchero drives, picks up Manu Ball. Help arrives from Tyler Griffin! Joel Banchero attempts a Layup. Wide open! Tyler Griffin is 6.1 feet away. [MAN] JOEL BANCHERO MAKES IT!
Score: 90-53

[02:41] Team_100 possession (Score: 90-53)
Luka Green attempts a 3Pt. Contested by Giannis LaVine (4.4 feet, MAN). LUKA GREEN MAKES IT! Assist: Tyler Griffin
Score: 90-56

[02:26] Team_050 possession (Score: 90-56)
LeBron Bridges attempts a 3Pt. Contested by Luka Green (5.7 feet, ZONE). LEBRON BRIDGES MAKES IT! Assist: Joel Banchero
Score: 93-56

[02:13] Team_100 possession (Score: 93-56)
Tyler Griffin attempts a 3Pt. Contested by Collin Bane (4.6 feet, ZONE). Tyler Griffin misses. Rebound secured by LeBron Bridges.

[01:59] Team_050 possession (Score: 93-56)
FOUL! Shooting foul on Pau LaVine. LeBron Bridges to the line for 2 free throws. [Team fouls: 4] (Pau LaVine: 1 personal fouls)   FT 1/2: GOOD   FT 2/2: MISS LeBron Bridges makes 1/2 from the line. Rebound secured by Tyler Griffin.
Score: 94-56

[01:47] Team_100 possession (Score: 94-56)
Chris Mobley attempts a Layup. BLOCKED BY DONOVAN TRENT! Ball is loose! Rebound secured by Joel Banchero.

[01:31] Team_050 possession (Score: 94-56)
FOUL! Shooting foul on Manu Ball. Giannis LaVine to the line for 2 free throws. [BONUS: 5 team fouls] (Manu Ball: 1 personal fouls)   FT 1/2: GOOD   FT 2/2: GOOD Giannis LaVine makes 2/2 from the line.
Score: 96-56

[01:17] Team_100 possession (Score: 96-56)
FOUL! Shooting foul on Donovan Trent. Chris Mobley to the line for 2 free throws. [Team fouls: 3] (Donovan Trent: 3 personal fouls)   FT 1/2: GOOD   FT 2/2: GOOD Chris Mobley makes 2/2 from the line.
Score: 96-58

[01:03] Team_050 possession (Score: 96-58)
Joel Banchero attempts a 3Pt. Wide open! Manu Ball is 6.3 feet away. [MAN] JOEL BANCHERO MAKES IT!
Score: 99-58

[00:49] Team_100 possession (Score: 99-58)
FOUL! Holding foul on LeBron Bridges. [Team fouls: 4] No free throws, side out. (LeBron Bridges: 1 personal fouls)

[00:35] Team_100 possession (Score: 99-58)
Luka Green attempts a 3Pt. Contested by Giannis LaVine (4.6 feet, ZONE). LUKA GREEN MAKES IT! Assist: Pau LaVine
Score: 99-61

[00:22] Team_050 possession (Score: 99-61)
Donovan Trent attempts a Layup. Contested by Chris Mobley (5.6 feet, MAN). DONOVAN TRENT MAKES IT! Assist: Giannis LaVine
Score: 101-61

[00:05] Team_100 possession (Score: 101-61)
Chris Mobley drives and kicks out. Manu Ball attempts a 3Pt. Contested by Giannis LaVine (4.5 feet, ZONE). MANU BALL MAKES IT! Assist: Chris Mobley
Score: 101-64

================================================================================
                              3RD QUARTER COMPLETE                              
================================================================================

3RD QUARTER SCORE: Team_050 26, Team_100 26

BOX SCORE:
================================================================================

Team_050
--------------------------------------------------------------------------------
Player                MIN  PTS  REB  AST  TO      FG   FG%      3P   3P%
--------------------------------------------------------------------------------
LeBron Bridges         24    8    8    1   0   3/4    75.0     0/0   0.0
Joel Banchero          28    5    2    1   0   2/6    33.3     0/0   0.0
Giannis LaVine         28    5    0    1   0   2/3    66.7     0/0   0.0
Collin Bane            28    3    4    1   0   1/3    33.3     0/0   0.0
Donovan Trent          24    2    0    0   0   1/4    25.0     0/0   0.0

TEAM: FG: 9/20 (45.0%), 3PT: 4/8 (50.0%), REB: 14 (3 off, 11 def), AST: 4, TO: 2
TEAM FOULS: 4


Team_100
--------------------------------------------------------------------------------
Player                MIN  PTS  REB  AST  TO      FG   FG%      3P   3P%
--------------------------------------------------------------------------------
Luka Green             28   11    0    1   0   4/6    66.7     0/0   0.0
Chris Mobley           24    8    5    2   0   4/9    44.4     0/0   0.0
Manu Ball              28    5    0    0   0   2/3    66.7     0/0   0.0
Tyler Griffin          28    2    5    1   0   1/4    25.0     0/0   0.0
Pau LaVine             28    0    5    1   0   0/0     0.0     0/0   0.0

TEAM: FG: 11/22 (50.0%), 3PT: 3/6 (50.0%), REB: 15 (4 off, 11 def), AST: 5, TO: 0
TEAM FOULS: 5 [Team_050 in BONUS]

================================================================================

================================================================================
                       4TH QUARTER - Team_050 vs Team_100                       
================================================================================

[12:00] Team_050 possession (Score: 101-64)
Giannis LaVine attempts a Midrange. Contested by Tyler Griffin (5.5 feet, ZONE). GIANNIS LAVINE MAKES IT! Assist: Collin Bane
Score: 103-64

[11:48] Team_100 possession (Score: 103-64)
Tyler Griffin attempts a 3Pt. Contested by Collin Bane (4.6 feet, MAN). Tyler Griffin misses. Offensive rebound by Chris Mobley! Chris Mobley kicks it out.

[11:29] Team_100 possession (Score: 103-64)
Pau LaVine drives to the basket... Pau LaVine throws a bad pass! Stolen by Donovan Trent! TURNOVER! (live ball)

[11:14] Team_050 possession (Score: 103-64)
Donovan Trent drives, Chris Mobley stays with him. Donovan Trent attempts a Layup. Contested by Chris Mobley (5.5 feet, MAN). Donovan Trent misses. FOUL! Loose ball foul on Pau LaVine during the rebound battle. [Team fouls: 1] No free throws, side out. (Pau LaVine: 1 personal fouls)

[10:58] Team_050 possession (Score: 103-64)
Collin Bane attempts a 3Pt. Contested by Tyler Griffin (5.4 feet, MAN). Collin Bane misses. Rebound secured by Pau LaVine.

[10:47] Team_100 possession (Score: 103-64)
Chris Mobley commits a violation (traveling/carry)! TURNOVER! (dead ball)

[10:47] Substitution (Team_050): Giannis LaVine OUT → Damian O'Neal IN (stamina_rule2)

[10:47] Substitution (Team_050): Joel Banchero OUT → Dwyane Towns IN (stamina_rule2)

[10:47] Substitution (Team_050): Collin Bane OUT → Larry Curry IN (stamina_rule2)

[10:47] Substitution (Team_050): LeBron Bridges OUT → Luka Gasol IN (stamina_rule2)

[10:47] Substitution (Team_050): Donovan Trent OUT → Tyler Smith IN (stamina_rule2)

[10:47] Substitution (Team_100): Luka Green OUT → Dirk Sabonis IN (stamina_rule2)

[10:47] Substitution (Team_100): Manu Ball OUT → Evan Butler IN (stamina_rule2)

[10:47] Substitution (Team_100): Tyler Griffin OUT → Tyrese Wade IN (stamina_rule2)

[10:47] Substitution (Team_100): Pau LaVine OUT → Carmelo Ginobili IN (stamina_rule2)

[10:47] Substitution (Team_100): Chris Mobley OUT → John Rozier IN (stamina_rule2)

[10:30] Team_050 possession (Score: 103-64)
Tyler Smith drives, John Rozier stays with him. Tyler Smith attempts a Dunk. Contested by John Rozier (4.9 feet, MAN). TYLER SMITH MAKES IT! Assist: Damian O'Neal
Score: 105-64

[10:12] Team_100 possession (Score: 105-64)
John Rozier attempts a Midrange. Contested by Tyler Smith (5.5 feet, MAN). JOHN ROZIER MAKES IT! Assist: Evan Butler
Score: 105-66

[09:56] Team_050 possession (Score: 105-66)
FOUL! Shooting foul on Tyrese Wade. Larry Curry to the line for 3 free throws. [Team fouls: 2] (Tyrese Wade: 1 personal fouls)   FT 1/3: GOOD   FT 2/3: MISS   FT 3/3: GOOD Larry Curry makes 2/3 from the line.
Score: 107-66

[09:40] Team_100 possession (Score: 107-66)
Tyrese Wade drives, picks up Larry Curry. Help arrives from Dwyane Towns! Tyrese Wade attempts a Layup. Contested by Dwyane Towns (4.5 feet, MAN). Tyrese Wade misses. Rebound secured by Larry Curry.

[09:23] Team_050 possession (Score: 107-66)
Damian O'Neal makes the Layup and draws the foul on John Rozier! And-1! Damian O'Neal to the line for 1. [Team fouls: 3] (John Rozier: 1 personal fouls)   FT 1/1: MISS Damian O'Neal makes 0/1 from the line. Rebound secured by Tyrese Wade.
Score: 109-66

[09:10] Team_100 possession (Score: 109-66)
Dirk Sabonis attempts a 3Pt. Wide open! Damian O'Neal is 6.6 feet away. [MAN] Dirk Sabonis misses. Rebound secured by Larry Curry.

[08:50] Team_050 possession (Score: 109-66)
Larry Curry attempts a 3Pt. Contested by Tyrese Wade (4.6 feet, ZONE). Larry Curry misses. Rebound secured by Tyrese Wade.

[08:35] Team_100 possession (Score: 109-66)
Dirk Sabonis attempts a 3Pt. Wide open! Damian O'Neal is 6.6 feet away. [MAN] Dirk Sabonis misses. Rebound secured by Larry Curry.

[08:19] Team_050 possession (Score: 109-66)
Tyler Smith drives to the basket... FOUL! Offensive foul on Tyler Smith! John Rozier drew the charge! [Team fouls: 1] (Tyler Smith: 1 personal fouls) TURNOVER! (dead ball)

[08:10] Team_100 possession (Score: 109-66)
John Rozier attempts a Layup. BLOCKED BY LUKA GASOL! Ball is loose! Offensive rebound by John Rozier! John Rozier kicks it out.

[08:01] Team_100 possession (Score: 109-66)
Carmelo Ginobili attempts a Layup. BLOCKED BY LUKA GASOL! Ball is loose! Rebound secured by Dwyane Towns.

[07:42] Team_050 possession (Score: 109-66)
Dwyane Towns attempts a 3Pt. Contested by Tyrese Wade (4.7 feet, ZONE). DWYANE TOWNS MAKES IT! Assist: Tyler Smith
Score: 112-66

[07:29] Team_100 possession (Score: 112-66)
Tyrese Wade attempts a Midrange. Contested by Larry Curry (4.5 feet, MAN). Tyrese Wade misses. Offensive rebound by John Rozier! John Rozier puts it back in!
Score: 112-68

[07:15] Team_050 possession (Score: 112-68)
Damian O'Neal drives and kicks out. Luka Gasol attempts a Midrange. Contested by Carmelo Ginobili (5.3 feet, ZONE). Luka Gasol misses. Offensive rebound by Larry Curry! Larry Curry kicks it out.

[06:57] Team_050 possession (Score: 112-68)
FOUL! Reach-in foul on Dirk Sabonis during the drive. [Team fouls: 4] No free throws, side out. (Dirk Sabonis: 1 personal fouls)

[06:43] Team_050 possession (Score: 112-68)
FOUL! Shooting foul on Carmelo Ginobili. Luka Gasol to the line for 2 free throws. [BONUS: 5 team fouls] (Carmelo Ginobili: 1 personal fouls)   FT 1/2: GOOD   FT 2/2: GOOD Luka Gasol makes 2/2 from the line.
Score: 114-68

[06:25] Team_100 possession (Score: 114-68)
Dirk Sabonis attempts a 3Pt. Contested by Luka Gasol (5.2 feet, ZONE). DIRK SABONIS MAKES IT! Assist: Evan Butler
Score: 114-71

[06:11] Team_050 possession (Score: 114-71)
FOUL! Holding foul on Tyrese Wade. [IN THE BONUS! 6 team fouls] Larry Curry to the line for 2 free throws. (Tyrese Wade: 2 personal fouls)   FT 1/2: GOOD   FT 2/2: GOOD Larry Curry makes 2/2 from the line.
Score: 116-71

[05:58] Team_100 possession (Score: 116-71)
Tyrese Wade attempts a Midrange. Contested by Larry Curry (4.5 feet, ZONE). Tyrese Wade misses. Rebound secured by Larry Curry.

[05:42] Team_050 possession (Score: 116-71)
Damian O'Neal attempts a 3Pt. Contested by Dirk Sabonis (5.8 feet, MAN). Damian O'Neal misses. Offensive rebound by Larry Curry! Larry Curry kicks it out.

[05:31] Team_050 possession (Score: 116-71)
Luka Gasol drives and kicks out. Dwyane Towns attempts a 3Pt. Contested by Evan Butler (5.1 feet, MAN). DWYANE TOWNS MAKES IT! Assist: Damian O'Neal
Score: 119-71

[05:18] Team_100 possession (Score: 119-71)
Evan Butler drives to the basket... Evan Butler commits a violation (traveling/carry)! TURNOVER! (dead ball)

[05:08] Team_050 possession (Score: 119-71)
Luka Gasol attempts a 3Pt. Contested by Tyrese Wade (4.5 feet, ZONE). Luka Gasol misses. Rebound secured by John Rozier.

[04:52] Team_100 possession (Score: 119-71)
Dirk Sabonis loses control! Ball rolls out of bounds! TURNOVER! (dead ball)

[04:39] Team_050 possession (Score: 119-71)
FOUL! Reach-in foul on John Rozier during the drive. [IN THE BONUS! 7 team fouls] Larry Curry to the line for 2 free throws. (John Rozier: 2 personal fouls)   FT 1/2: GOOD   FT 2/2: GOOD Larry Curry makes 2/2 from the line.
Score: 121-71

[04:24] Team_100 possession (Score: 121-71)
Evan Butler attempts a 3Pt. Contested by Dwyane Towns (4.2 feet, MAN). Evan Butler misses. Rebound secured by Larry Curry.

[04:11] Team_050 possession (Score: 121-71)
Dwyane Towns attempts a 3Pt. Contested by Evan Butler (5.3 feet, MAN). DWYANE TOWNS MAKES IT!
Score: 124-71

[03:56] Team_100 possession (Score: 124-71)
Tyrese Wade attempts a Midrange. Contested by Larry Curry (4.5 feet, MAN). Tyrese Wade misses. Rebound secured by Tyler Smith.

[03:40] Team_050 possession (Score: 124-71)
Larry Curry drives and kicks out. Dwyane Towns attempts a 3Pt. Contested by Tyrese Wade (4.6 feet, ZONE). DWYANE TOWNS MAKES IT! Assist: Larry Curry
Score: 127-71

[03:25] Team_100 possession (Score: 127-71)
Dirk Sabonis attempts a Layup. Wide open! Damian O'Neal is 6.6 feet away. [MAN] DIRK SABONIS MAKES IT!
Score: 127-73

[03:12] Team_050 possession (Score: 127-73)
Larry Curry drives and kicks out. Tyler Smith attempts a Midrange. Contested by Tyrese Wade (4.6 feet, ZONE). Tyler Smith misses. Rebound secured by Carmelo Ginobili.

[03:01] Team_100 possession (Score: 127-73)
Evan Butler attempts a 3Pt. Contested by Dwyane Towns (4.2 feet, MAN). Evan Butler misses. Offensive rebound by John Rozier! John Rozier puts it back in!
Score: 127-75

[02:50] Team_050 possession (Score: 127-75)
Damian O'Neal attempts a 3Pt. Contested by Tyrese Wade (4.7 feet, ZONE). Damian O'Neal misses. Rebound secured by Tyrese Wade.

[02:36] Team_100 possession (Score: 127-75)
Carmelo Ginobili attempts a Layup. Contested by Luka Gasol (4.7 feet, MAN). CARMELO GINOBILI MAKES IT! Assist: Dirk Sabonis
Score: 127-77

[02:22] Team_050 possession (Score: 127-77)
Damian O'Neal attempts a Midrange. Contested by Dirk Sabonis (5.9 feet, MAN). DAMIAN O'NEAL MAKES IT! Assist: Luka Gasol
Score: 129-77

[02:08] Team_100 possession (Score: 129-77)
John Rozier drives and kicks out. Evan Butler makes the Midrange and draws the foul on Dwyane Towns! And-1! Evan Butler to the line for 1. [Team fouls: 2] (Dwyane Towns: 1 personal fouls)   FT 1/1: GOOD Evan Butler makes 1/1 from the line.
Score: 129-80

[01:56] Team_050 possession (Score: 129-80)
Damian O'Neal attempts a 3Pt. Contested by Tyrese Wade (4.8 feet, ZONE). Damian O'Neal misses. Rebound secured by Carmelo Ginobili.

[01:40] Team_100 possession (Score: 129-80)
FOUL! Offensive foul on Dirk Sabonis! Damian O'Neal drew the charge! [Team fouls: 8] (Dirk Sabonis: 2 personal fouls) TURNOVER! (dead ball)

[01:26] Team_050 possession (Score: 129-80)
FOUL! Shooting foul on Carmelo Ginobili. Luka Gasol to the line for 2 free throws. [BONUS: 9 team fouls] (Carmelo Ginobili: 2 personal fouls)   FT 1/2: MISS   FT 2/2: GOOD Luka Gasol makes 1/2 from the line.
Score: 130-80

[01:13] Team_100 possession (Score: 130-80)
Dirk Sabonis attempts a 3Pt. Contested by Luka Gasol (5.4 feet, ZONE). DIRK SABONIS MAKES IT! Assist: John Rozier
Score: 130-83

[00:55] Team_050 possession (Score: 130-83)
Damian O'Neal attempts a 3Pt. Contested by Tyrese Wade (4.9 feet, ZONE). Damian O'Neal misses. Rebound secured by John Rozier.

[00:39] Team_100 possession (Score: 130-83)
Evan Butler attempts a Midrange. Contested by Tyler Smith (5.3 feet, ZONE). EVAN BUTLER MAKES IT!
Score: 130-85

[00:22] Team_050 possession (Score: 130-85)
FOUL! Holding foul on Dirk Sabonis. [IN THE BONUS! 10 team fouls] Damian O'Neal to the line for 2 free throws. (Dirk Sabonis: 3 personal fouls)   FT 1/2: GOOD   FT 2/2: GOOD Damian O'Neal makes 2/2 from the line.
Score: 132-85

[00:03] Team_100 possession (Score: 132-85)
Carmelo Ginobili attempts a Midrange. BLOCKED BY LARRY CURRY! Ball is loose! Rebound secured by Dwyane Towns.

================================================================================
                              4TH QUARTER COMPLETE                              
================================================================================

4TH QUARTER SCORE: Team_050 31, Team_100 21

BOX SCORE:
================================================================================

Team_050
--------------------------------------------------------------------------------
Player                MIN  PTS  REB  AST  TO      FG   FG%      3P   3P%
--------------------------------------------------------------------------------
Dwyane Towns           19   12    2    0   0   4/4   100.0     0/0   0.0
Larry Curry            19    6    7    1   0   3/5    60.0     0/0   0.0
Damian O'Neal          19    4    0    2   0   2/6    33.3     0/0   0.0
Luka Gasol             23    3    0    1   0   2/3    66.7     0/0   0.0
Giannis LaVine         29    2    0    0   0   1/1   100.0     0/0   0.0
Tyler Smith            23    2    1    1   0   1/1   100.0     0/0   0.0
Collin Bane            29    0    1    1   0   0/1     0.0     0/0   0.0

TEAM: FG: 13/21 (61.9%), 3PT: 3/9 (33.3%), REB: 11 (3 off, 8 def), AST: 6, TO: 1
TEAM FOULS: 2


Team_100
--------------------------------------------------------------------------------
Player                MIN  PTS  REB  AST  TO      FG   FG%      3P   3P%
--------------------------------------------------------------------------------
Dirk Sabonis           19    8    0    1   0   3/5    60.0     0/0   0.0
John Rozier            23    6    5    1   0   3/3   100.0     0/0   0.0
Evan Butler            19    5    0    2   0   2/3    66.7     0/0   0.0
Carmelo Ginobili       19    2    2    0   0   1/3    33.3     0/0   0.0
Chris Mobley           26    0    1    0   0   0/0     0.0     0/0   0.0
Pau LaVine             29    0    1    0   0   0/0     0.0     0/0   0.0
Tyrese Wade            19    0    3    0   0   0/3     0.0     0/0   0.0

TEAM: FG: 9/17 (52.9%), 3PT: 3/6 (50.0%), REB: 12 (4 off, 8 def), AST: 4, TO: 5
TEAM FOULS: 10 [Team_050 in BONUS]

================================================================================

================================================================================
                               FULL GAME COMPLETE                               
================================================================================

FINAL SCORE: Team_050 132, Team_100 85

SCORING BY QUARTER:
--------------------------------------------------------------------------------
Team                     Q1     Q2     Q3     Q4    FINAL
--------------------------------------------------------------------------------
Team_050                 30     45     26     31      132
Team_100                 23     15     26     21       85
--------------------------------------------------------------------------------

FULL GAME BOX SCORE:
================================================================================

Team_050
--------------------------------------------------------------------------------
Player                MIN  PTS  REB  AST  TO      FG   FG%      3P   3P%      FT STL BLK
--------------------------------------------------------------------------------
Giannis LaVine         29   20    0    1   0   8/11   72.7   0/3     0.0   7/7     1   0
Joel Banchero          29    8    7    2   0   3/7    42.9   2/4    50.0   0/0     0   0
Collin Bane            29   12   11    3   1   5/13   38.5   2/8    25.0   2/2     0   1
LeBron Bridges         26   13   15    4   2   5/7    71.4   3/3   100.0   1/3     0   0
Donovan Trent          26    6    0    2   0   3/6    50.0   0/0     0.0   0/1     1   2
Luka Gasol             23   15    0    2   1   5/7    71.4   0/1     0.0  10/11    0   2
Tyler Smith            23   10    2    1   0   4/5    80.0   1/1   100.0   2/2     0   0
Damian O'Neal          19    7    0    3   0   1/6    16.7   0/3     0.0   2/3     0   0
Dwyane Towns           19   22    3    1   1   8/10   80.0   5/6    83.3   2/2     0   0
Larry Curry            19   12   13    3   0   5/7    71.4   2/3    66.7   9/10    0   1

TEAM: FG: 51/83 (61.4%), 3PT: 15/32 (46.9%), REB: 51 (13 off, 38 def), AST: 22, TO: 5


Team_100
--------------------------------------------------------------------------------
Player                MIN  PTS  REB  AST  TO      FG   FG%      3P   3P%      FT STL BLK
--------------------------------------------------------------------------------
Luka Green             29   13    0    2   0   5/9    55.6   3/3   100.0   0/0     1   1
Manu Ball              29   14    0    0   1   4/7    57.1   2/2   100.0   1/1     0   0
Tyler Griffin          29    8    9    2   1   3/11   27.3   0/8     0.0   2/2     1   0
Pau LaVine             29    4   11    1   2   3/5    60.0   0/1     0.0   0/0     0   0
Chris Mobley           26   10    8    3   2   5/12   41.7   0/1     0.0   4/5     0   0
John Rozier            23   13    7    2   1   5/7    71.4   0/0     0.0   1/1     1   0
Dirk Sabonis           19   10    0    1   2   4/7    57.1   2/4    50.0   2/4     0   0
Evan Butler            19    7    0    3   1   3/5    60.0   1/3    33.3   1/1     0   0
Tyrese Wade            19    0    6    0   0   1/5    20.0   0/1     0.0   0/0     0   0
Carmelo Ginobili       19    6    3    0   1   3/6    50.0   1/1   100.0   1/2     0   0

TEAM: FG: 37/75 (49.3%), 3PT: 9/24 (37.5%), REB: 44 (12 off, 32 def), AST: 14, TO: 11

================================================================================
