================================================================================
                        FULL GAME - Team_057 vs Team_032                        
================================================================================

================================================================================
                       1ST QUARTER - Team_057 vs Team_032                       
================================================================================

[12:00] Team_057 possession (Score: 0-0)
Ben Adebayo attempts a 3Pt. Contested by Tobias Bane (4.9 feet, ZONE). Ben Adebayo misses. Offensive rebound by Ben Adebayo! Ben Adebayo kicks it out.

[11:44] Team_057 possession (Score: 0-0)
Kobe Ming attempts a 3Pt. Contested by Tobias Bane (4.6 feet, MAN). Kobe Ming misses. Rebound secured by Anfernee Butler.

[11:33] Team_032 possession (Score: 0-0)
Malcolm Lillard attempts a Layup. Contested by Ben Adebayo (4.8 feet, ZONE). MALCOLM LILLARD MAKES IT! Assist: Tobias Bane
Score: 0-2

[11:20] Team_057 possession (Score: 0-2)
FOUL! Offensive foul on Klay Rozier! DeMar Giddey drew the charge! [Team fouls: 1] (Klay Rozier: 1 personal fouls) TURNOVER! (dead ball)

[11:06] Team_032 possession (Score: 0-2)
Anfernee Butler drives, Ben Adebayo stays with him. Anfernee Butler attempts a Layup. Contested by Ben Adebayo (4.1 feet, MAN). ANFERNEE BUTLER MAKES IT! Assist: DeMar Giddey
Score: 0-4

[10:53] Team_057 possession (Score: 0-4)
Anfernee Adebayo attempts a 3Pt. Contested by Tobias Bane (4.8 feet, ZONE). Anfernee Adebayo misses. Rebound secured by Malcolm Lillard.

[10:38] Team_032 possession (Score: 0-4)
FOUL! Reach-in foul on Ben Adebayo during the drive. [Team fouls: 2] No free throws, side out. (Ben Adebayo: 1 personal fouls)

[10:25] Team_032 possession (Score: 0-4)
Malcolm Lillard attempts a 3Pt. Contested by Miles Middleton (4.8 feet, MAN). Malcolm Lillard misses. Offensive rebound by Malcolm Lillard! Malcolm Lillard kicks it out.

[10:11] Team_032 possession (Score: 0-4)
Tobias Bane attempts a Layup. BLOCKED BY KOBE MING! Ball is loose! Rebound secured by Miles Middleton.

[09:55] Team_057 possession (Score: 0-4)
Klay Rozier attempts a Layup. Contested by DeMar Giddey (4.1 feet, MAN). Klay Rozier misses. Rebound secured by Anfernee Butler.

[09:44] Team_032 possession (Score: 0-4)
Tobias Bane makes the Dunk and draws the foul on Kobe Ming! And-1! Tobias Bane to the line for 1. [Team fouls: 3] (Kobe Ming: 1 personal fouls)   FT 1/1: GOOD Tobias Bane makes 1/1 from the line.
Score: 0-7

[09:26] Team_057 possession (Score: 0-7)
Ben Adebayo attempts a Midrange. Contested by DeMar Giddey (4.4 feet, ZONE). Ben Adebayo misses. Rebound secured by Anfernee Butler.

[09:13] Team_032 possession (Score: 0-7)
Anfernee Butler attempts a Midrange. Contested by Anfernee Adebayo (4.5 feet, ZONE). Anfernee Butler misses. Rebound secured by Anfernee Adebayo.

[09:01] Team_057 possession (Score: 0-7)
Anfernee Adebayo attempts a Layup. Contested by Jalen Westbrook (5.3 feet, MAN). Anfernee Adebayo misses. Rebound secured by Anfernee Butler.

[08:46] Team_032 possession (Score: 0-7)
Jalen Westbrook attempts a Midrange. Contested by Ben Adebayo (4.7 feet, ZONE). Jalen Westbrook misses. Rebound secured by Anfernee Adebayo.

[08:31] Team_057 possession (Score: 0-7)
Klay Rozier attempts a Midrange. Contested by DeMar Giddey (4.1 feet, MAN). KLAY ROZIER MAKES IT!
Score: 2-7

[08:16] Team_032 possession (Score: 2-7)
FOUL! Holding foul on Anfernee Adebayo. [Team fouls: 4] No free throws, side out. (Anfernee Adebayo: 1 personal fouls)

[08:01] Team_032 possession (Score: 2-7)
FOUL! Reach-in foul on Ben Adebayo during the drive. [IN THE BONUS! 5 team fouls] Anfernee Butler to the line for 2 free throws. (Ben Adebayo: 2 personal fouls)   FT 1/2: GOOD   FT 2/2: GOOD Anfernee Butler makes 2/2 from the line.
Score: 2-9

[07:43] Team_057 possession (Score: 2-9)
Klay Rozier makes the Layup and draws the foul on DeMar Giddey! And-1! Klay Rozier to the line for 1. [Team fouls: 1] (DeMar Giddey: 1 personal fouls)   FT 1/1: GOOD Klay Rozier makes 1/1 from the line.
Score: 5-9

[07:30] Team_032 possession (Score: 5-9)
FOUL! Holding foul on Kobe Ming. [IN THE BONUS! 6 team fouls] Tobias Bane to the line for 2 free throws. (Kobe Ming: 2 personal fouls)   FT 1/2: MISS   FT 2/2: GOOD Tobias Bane makes 1/2 from the line.
Score: 5-10

[07:19] Team_057 possession (Score: 5-10)
Miles Middleton attempts a Midrange. Contested by Malcolm Lillard (4.5 feet, MAN). Miles Middleton misses. Rebound secured by Anfernee Butler.

[07:06] Team_032 possession (Score: 5-10)
Jalen Westbrook attempts a 3Pt. Contested by Anfernee Adebayo (5.1 feet, MAN). JALEN WESTBROOK MAKES IT! Assist: DeMar Giddey
Score: 5-13

[06:51] Team_057 possession (Score: 5-13)
Miles Middleton attempts a Layup. BLOCKED BY MALCOLM LILLARD! Ball goes out off Malcolm Lillard. Miles Middleton's ball!

[06:34] Team_057 possession (Score: 5-13)
Anfernee Adebayo attempts a 3Pt. Contested by Jalen Westbrook (5.3 feet, MAN). Anfernee Adebayo misses. Rebound secured by Anfernee Butler.

[06:18] Team_032 possession (Score: 5-13)
Malcolm Lillard makes the Layup and draws the foul on Miles Middleton! And-1! Malcolm Lillard to the line for 1. [BONUS: 7 team fouls] (Miles Middleton: 1 personal fouls)   FT 1/1: GOOD Malcolm Lillard makes 1/1 from the line.
Score: 5-16

[06:06] Team_057 possession (Score: 5-16)
Kobe Ming attempts a 3Pt. Contested by Tobias Bane (4.6 feet, MAN). KOBE MING MAKES IT! Assist: Anfernee Adebayo
Score: 8-16

[05:55] Team_032 possession (Score: 8-16)
DeMar Giddey attempts a Midrange. Contested by Miles Middleton (4.7 feet, ZONE). DeMar Giddey misses. Rebound secured by Miles Middleton.

[05:39] Team_057 possession (Score: 8-16)
Kobe Ming drives and kicks out. Klay Rozier attempts a Midrange. Contested by DeMar Giddey (3.9 feet, MAN). Klay Rozier misses. Rebound secured by Anfernee Butler.

[05:25] Team_032 possession (Score: 8-16)
Tobias Bane attempts a Midrange. Contested by Ben Adebayo (4.7 feet, ZONE). Tobias Bane misses. Offensive rebound by Malcolm Lillard! Malcolm Lillard kicks it out.

[05:10] Team_032 possession (Score: 8-16)
FOUL! Holding foul on Kobe Ming. [IN THE BONUS! 8 team fouls] Tobias Bane to the line for 2 free throws. (Kobe Ming: 3 personal fouls)   FT 1/2: GOOD   FT 2/2: MISS Tobias Bane makes 1/2 from the line. FOUL! Loose ball foul on Anfernee Adebayo during the free throw rebound! [IN THE BONUS! 9 team fouls] Anfernee Butler to the line for 2 free throws. (Anfernee Adebayo: 2 personal fouls)   FT 1/2: GOOD   FT 2/2: GOOD Anfernee Butler makes 2/2 from the line.
Score: 8-19

[04:55] Team_057 possession (Score: 8-19)
Klay Rozier attempts a 3Pt. Contested by Tobias Bane (4.5 feet, ZONE). Klay Rozier misses. Rebound secured by Tobias Bane.

[04:38] Team_032 possession (Score: 8-19)
Jalen Westbrook attempts a Layup. BLOCKED BY ANFERNEE ADEBAYO! Ball is loose! Offensive rebound by Malcolm Lillard! Malcolm Lillard kicks it out.

[04:18] Team_032 possession (Score: 8-19)
FOUL! Shooting foul on Miles Middleton. Malcolm Lillard to the line for 2 free throws. [BONUS: 11 team fouls] (Miles Middleton: 2 personal fouls)   FT 1/2: GOOD   FT 2/2: GOOD Malcolm Lillard makes 2/2 from the line.
Score: 8-21

[04:01] Team_057 possession (Score: 8-21)
Kobe Ming drives, picks up Malcolm Lillard. Help arrives from DeMar Giddey! Kobe Ming attempts a Layup. Contested by DeMar Giddey (5.0 feet, ZONE). KOBE MING MAKES IT!
Score: 10-21

[03:46] Team_032 possession (Score: 10-21)
Malcolm Lillard drives, Ben Adebayo stays with him. Malcolm Lillard attempts a Layup. Contested by Ben Adebayo (4.9 feet, ZONE). MALCOLM LILLARD MAKES IT! Assist: Tobias Bane
Score: 10-23

[03:33] Team_057 possession (Score: 10-23)
FOUL! Offensive foul on Kobe Ming! Tobias Bane drew the charge! [Team fouls: 12] (Kobe Ming: 4 personal fouls) TURNOVER! (dead ball)

[03:19] Team_032 possession (Score: 10-23)
Anfernee Butler attempts a 3Pt. Contested by Kobe Ming (4.2 feet, ZONE). ANFERNEE BUTLER MAKES IT! Assist: Tobias Bane
Score: 10-26

[03:03] Team_057 possession (Score: 10-26)
Kobe Ming attempts a Layup. Contested by Tobias Bane (4.8 feet, MAN). Kobe Ming misses. Rebound secured by Malcolm Lillard.

[02:50] Team_032 possession (Score: 10-26)
DeMar Giddey attempts a 3Pt. Contested by Kobe Ming (4.9 feet, ZONE). DEMAR GIDDEY MAKES IT! Assist: Jalen Westbrook
Score: 10-29

[02:39] Team_057 possession (Score: 10-29)
Ben Adebayo attempts a Midrange. Contested by Jalen Westbrook (5.6 feet, ZONE). Ben Adebayo misses. Offensive rebound by Ben Adebayo! Ben Adebayo kicks it out.

[02:28] Team_057 possession (Score: 10-29)
Klay Rozier drives and kicks out. Ben Adebayo attempts a 3Pt. Contested by Anfernee Butler (4.2 feet, MAN). Ben Adebayo misses. Rebound secured by Tobias Bane.

[02:12] Team_032 possession (Score: 10-29)
Jalen Westbrook attempts a Layup. Contested by Ben Adebayo (5.0 feet, ZONE). Jalen Westbrook misses. Rebound secured by Anfernee Adebayo.

[01:53] Team_057 possession (Score: 10-29)
Kobe Ming drives to the basket... Kobe Ming throws a bad pass out of bounds! TURNOVER! (dead ball)

[01:53] Substitution (Team_057): Kobe Ming OUT → Scottie Johnson IN (stamina_rule2)

[01:53] Substitution (Team_057): Klay Rozier OUT → Bradley Ginobili IN (stamina_rule2)

[01:53] Substitution (Team_057): Anfernee Adebayo OUT → Joel Wade IN (stamina_rule2)

[01:53] Substitution (Team_057): Ben Adebayo OUT → Lamelo Irving IN (stamina_rule2)

[01:53] Substitution (Team_057): Miles Middleton OUT → Zion Lillard IN (stamina_rule2)

[01:53] Substitution (Team_032): Tobias Bane OUT → Anfernee Griffin IN (stamina_rule2)

[01:53] Substitution (Team_032): DeMar Giddey OUT → Myles Herro IN (stamina_rule2)

[01:53] Substitution (Team_032): Jalen Westbrook OUT → Jrue Simmons IN (stamina_rule2)

[01:53] Substitution (Team_032): Anfernee Butler OUT → Jayson O'Neal IN (stamina_rule2)

[01:53] Substitution (Team_032): Malcolm Lillard OUT → Lauri Towns IN (stamina_rule2)

[01:38] Team_032 possession (Score: 10-29)
Anfernee Griffin attempts a 3Pt. Contested by Scottie Johnson (4.5 feet, MAN). Anfernee Griffin misses. Rebound secured by Zion Lillard.

[01:23] Team_057 possession (Score: 10-29)
Lamelo Irving drives, Jayson O'Neal stays with him. Lamelo Irving attempts a Dunk. Contested by Jayson O'Neal (5.4 feet, MAN). LAMELO IRVING MAKES IT!
Score: 12-29

[01:08] Team_032 possession (Score: 12-29)
Jrue Simmons attempts a Layup. Contested by Lamelo Irving (5.1 feet, ZONE). JRUE SIMMONS MAKES IT! Assist: Anfernee Griffin
Score: 12-31

[00:54] Team_057 possession (Score: 12-31)
Scottie Johnson attempts a 3Pt. Contested by Anfernee Griffin (5.3 feet, MAN). SCOTTIE JOHNSON MAKES IT! Assist: Joel Wade
Score: 15-31

[00:43] Team_032 possession (Score: 15-31)
Jayson O'Neal attempts a Midrange. Contested by Lamelo Irving (5.0 feet, MAN). JAYSON O'NEAL MAKES IT!
Score: 15-33

[00:31] Team_057 possession (Score: 15-33)
Lamelo Irving drives, picks up Lauri Towns. Help arrives from Myles Herro! Lamelo Irving attempts a Dunk. Wide open! Myles Herro is 6.1 feet away. [ZONE] Lamelo Irving misses. Rebound secured by Jayson O'Neal.

[00:20] Team_032 possession (Score: 15-33)
Jrue Simmons attempts a 3Pt. Contested by Scottie Johnson (5.1 feet, ZONE). Jrue Simmons misses. Rebound secured by Zion Lillard.

[00:08] Team_057 possession (Score: 15-33)
Lamelo Irving attempts a 3Pt. Contested by Anfernee Griffin (5.8 feet, ZONE). Lamelo Irving misses. Rebound secured by Lauri Towns.

================================================================================
                              1ST QUARTER COMPLETE                              
================================================================================

1ST QUARTER SCORE: Team_057 15, Team_032 33

BOX SCORE:
================================================================================

Team_057
--------------------------------------------------------------------------------
Player                MIN  PTS  REB  AST  TO      FG   FG%      3P   3P%
--------------------------------------------------------------------------------
Kobe Ming              10    5    0    0   0   2/5    40.0     0/0   0.0
Klay Rozier            10    5    0    0   0   2/5    40.0     0/0   0.0
Scottie Johnson         2    3    0    0   0   1/1   100.0     0/0   0.0
Lamelo Irving           2    2    0    0   0   1/3    33.3     0/0   0.0
Ben Adebayo            10    0    2    0   0   0/1     0.0     0/0   0.0
Anfernee Adebayo       10    0    3    1   0   0/3     0.0     0/0   0.0
Miles Middleton        10    0    2    0   0   0/1     0.0     0/0   0.0
Zion Lillard            2    0    2    0   0   0/0     0.0     0/0   0.0
Joel Wade               2    0    0    1   0   0/0     0.0     0/0   0.0

TEAM: FG: 6/19 (31.6%), 3PT: 2/7 (28.6%), REB: 9 (2 off, 7 def), AST: 2, TO: 3
TEAM FOULS: 12 [Team_032 in BONUS]


Team_032
--------------------------------------------------------------------------------
Player                MIN  PTS  REB  AST  TO      FG   FG%      3P   3P%
--------------------------------------------------------------------------------
Anfernee Butler        10   10    7    0   0   4/5    80.0     0/0   0.0
Malcolm Lillard        10    9    5    0   0   4/4   100.0     0/0   0.0
Tobias Bane            10    4    2    3   0   2/3    66.7     0/0   0.0
DeMar Giddey           10    3    0    2   0   1/2    50.0     0/0   0.0
Jalen Westbrook        10    3    0    1   0   1/3    33.3     0/0   0.0
Jrue Simmons            2    2    0    0   0   1/2    50.0     0/0   0.0
Jayson O'Neal           2    2    1    0   0   1/1   100.0     0/0   0.0
Anfernee Griffin        2    0    0    1   0   0/1     0.0     0/0   0.0
Lauri Towns             2    0    1    0   0   0/0     0.0     0/0   0.0

TEAM: FG: 14/21 (66.7%), 3PT: 3/5 (60.0%), REB: 16 (3 off, 13 def), AST: 7, TO: 0
TEAM FOULS: 1

================================================================================

================================================================================
                       2ND QUARTER - Team_057 vs Team_032                       
================================================================================

[12:00] Team_057 possession (Score: 15-33)
Miles Middleton attempts a Midrange. Contested by Jalen Westbrook (4.8 feet, ZONE). Miles Middleton misses. Rebound secured by Malcolm Lillard.

[11:47] Team_032 possession (Score: 15-33)
Malcolm Lillard loses the ball! Stripped by Miles Middleton! TURNOVER! (live ball)

[11:31] Team_057 possession (Score: 15-33)
Kobe Ming attempts a Midrange. Contested by Anfernee Butler (4.3 feet, ZONE). Kobe Ming misses. Rebound secured by Anfernee Butler.

[11:18] Team_032 possession (Score: 15-33)
Anfernee Butler attempts a Midrange. Contested by Ben Adebayo (4.2 feet, MAN). ANFERNEE BUTLER MAKES IT! Assist: DeMar Giddey
Score: 15-35

[11:02] Team_057 possession (Score: 15-35)
Kobe Ming attempts a 3Pt. Contested by DeMar Giddey (4.3 feet, ZONE). Kobe Ming misses. Rebound secured by Tobias Bane.

[10:49] Team_032 possession (Score: 15-35)
Anfernee Butler attempts a 3Pt. Contested by Kobe Ming (4.2 feet, ZONE). Anfernee Butler misses. Rebound secured by Anfernee Adebayo.

[10:33] Team_057 possession (Score: 15-35)
Miles Middleton attempts a Layup. Contested by Malcolm Lillard (4.6 feet, ZONE). MILES MIDDLETON MAKES IT! Assist: Kobe Ming
Score: 17-35

[10:18] Team_032 possession (Score: 17-35)
Malcolm Lillard drives to the basket... FOUL! Offensive foul on Malcolm Lillard! Miles Middleton drew the charge! [Team fouls: 1] (Malcolm Lillard: 1 personal fouls) TURNOVER! (dead ball)

[10:08] Team_057 possession (Score: 17-35)
Ben Adebayo drives, Anfernee Butler stays with him. Ben Adebayo attempts a Dunk. Contested by Anfernee Butler (4.7 feet, MAN). Ben Adebayo misses. Rebound secured by Tobias Bane.

[09:54] Team_032 possession (Score: 17-35)
Anfernee Butler drives and kicks out. Malcolm Lillard attempts a 3Pt. Contested by Kobe Ming (4.7 feet, ZONE). Malcolm Lillard misses. Rebound secured by Ben Adebayo.

[09:40] Team_057 possession (Score: 17-35)
FOUL! Reach-in foul on DeMar Giddey during the drive. [Team fouls: 2] No free throws, side out. (DeMar Giddey: 1 personal fouls)

[09:26] Team_057 possession (Score: 17-35)
Klay Rozier attempts a Midrange. Contested by DeMar Giddey (4.4 feet, MAN). Klay Rozier misses. Rebound secured by Malcolm Lillard.

[09:10] Team_032 possession (Score: 17-35)
Malcolm Lillard attempts a 3Pt. Contested by Kobe Ming (5.1 feet, ZONE). Malcolm Lillard misses. Rebound secured by Miles Middleton.

[08:56] Team_057 possession (Score: 17-35)
Miles Middleton makes the Layup and draws the foul on Malcolm Lillard! And-1! Miles Middleton to the line for 1. [Team fouls: 3] (Malcolm Lillard: 2 personal fouls)   FT 1/1: GOOD Miles Middleton makes 1/1 from the line.
Score: 20-35

[08:39] Team_032 possession (Score: 20-35)
Jalen Westbrook attempts a 3Pt. Contested by Kobe Ming (5.0 feet, ZONE). Jalen Westbrook misses. Rebound secured by Ben Adebayo.

[08:21] Team_057 possession (Score: 20-35)
FOUL! Shooting foul on Jalen Westbrook. Klay Rozier to the line for 2 free throws. [Team fouls: 4] (Jalen Westbrook: 1 personal fouls)   FT 1/2: GOOD   FT 2/2: GOOD Klay Rozier makes 2/2 from the line.
Score: 22-35

[08:03] Team_032 possession (Score: 22-35)
Jalen Westbrook attempts a 3Pt. Contested by Anfernee Adebayo (5.5 feet, MAN). Jalen Westbrook misses. Rebound secured by Anfernee Adebayo.

[07:44] Team_057 possession (Score: 22-35)
Klay Rozier throws a bad pass! Stolen by DeMar Giddey! TURNOVER! (live ball)

[07:30] Team_032 possession (Score: 22-35)
Anfernee Butler drives, picks up Ben Adebayo. Help arrives from Klay Rozier! Anfernee Butler attempts a Dunk. Contested by Klay Rozier (4.6 feet, MAN). ANFERNEE BUTLER MAKES IT!
Score: 22-37

[07:12] Team_057 possession (Score: 22-37)
Klay Rozier attempts a 3Pt. Contested by Jalen Westbrook (5.5 feet, ZONE). Klay Rozier misses. Rebound secured by Anfernee Butler.

[06:59] Team_032 possession (Score: 22-37)
Malcolm Lillard drives and kicks out. Jalen Westbrook attempts a Midrange. Contested by Anfernee Adebayo (5.4 feet, MAN). Jalen Westbrook misses. Rebound secured by Anfernee Adebayo.

[06:45] Team_057 possession (Score: 22-37)
Miles Middleton attempts a Layup. Contested by Malcolm Lillard (4.9 feet, MAN). MILES MIDDLETON MAKES IT!
Score: 24-37

[06:32] Team_032 possession (Score: 24-37)
FOUL! Shooting foul on Klay Rozier. DeMar Giddey to the line for 3 free throws. [Team fouls: 1] (Klay Rozier: 1 personal fouls)   FT 1/3: MISS   FT 2/3: GOOD   FT 3/3: GOOD DeMar Giddey makes 2/3 from the line.
Score: 24-39

[06:18] Team_057 possession (Score: 24-39)
Anfernee Adebayo attempts a 3Pt. Contested by Tobias Bane (5.3 feet, ZONE). Anfernee Adebayo misses. Rebound secured by Tobias Bane.

[06:06] Team_032 possession (Score: 24-39)
Anfernee Butler attempts a Layup. BLOCKED BY BEN ADEBAYO! Ball is loose! Rebound secured by Miles Middleton.

[05:53] Team_057 possession (Score: 24-39)
FOUL! Holding foul on DeMar Giddey. [IN THE BONUS! 5 team fouls] Klay Rozier to the line for 2 free throws. (DeMar Giddey: 2 personal fouls)   FT 1/2: GOOD   FT 2/2: GOOD Klay Rozier makes 2/2 from the line.
Score: 26-39

[05:39] Team_032 possession (Score: 26-39)
Anfernee Butler drives and kicks out. DeMar Giddey attempts a Midrange. Contested by Ben Adebayo (5.3 feet, ZONE). DEMAR GIDDEY MAKES IT!
Score: 26-41

[05:27] Team_057 possession (Score: 26-41)
Miles Middleton attempts a 3Pt. Contested by Tobias Bane (4.9 feet, ZONE). Miles Middleton misses. Rebound secured by Anfernee Butler.

[05:13] Team_032 possession (Score: 26-41)
Jalen Westbrook attempts a Midrange. Contested by Ben Adebayo (5.4 feet, ZONE). Jalen Westbrook misses. FOUL! Loose ball foul on Anfernee Adebayo during the rebound battle. [Team fouls: 2] No free throws, side out. (Anfernee Adebayo: 1 personal fouls)

[04:59] Team_032 possession (Score: 26-41)
Tobias Bane drives, picks up Ben Adebayo. Help arrives from Klay Rozier! Tobias Bane attempts a Layup. Contested by Klay Rozier (5.4 feet, ZONE). TOBIAS BANE MAKES IT!
Score: 26-43

[04:47] Team_057 possession (Score: 26-43)
Klay Rozier attempts a 3Pt. Contested by Tobias Bane (5.3 feet, ZONE). Klay Rozier misses. Rebound secured by Malcolm Lillard.

[04:35] Team_032 possession (Score: 26-43)
DeMar Giddey attempts a 3Pt. Contested by Klay Rozier (4.9 feet, MAN). DEMAR GIDDEY MAKES IT! Assist: Jalen Westbrook
Score: 26-46

[04:17] Team_057 possession (Score: 26-46)
Anfernee Adebayo attempts a 3Pt. Wide open! Jalen Westbrook is 6.2 feet away. [MAN] ANFERNEE ADEBAYO MAKES IT! Assist: Kobe Ming
Score: 29-46

[04:01] Team_032 possession (Score: 29-46)
Tobias Bane attempts a Midrange. Contested by Anfernee Adebayo (5.9 feet, ZONE). TOBIAS BANE MAKES IT!
Score: 29-48

[03:42] Team_057 possession (Score: 29-48)
Klay Rozier attempts a 3Pt. Contested by Tobias Bane (5.4 feet, ZONE). KLAY ROZIER MAKES IT! Assist: Anfernee Adebayo
Score: 32-48

[03:29] Team_032 possession (Score: 32-48)
DeMar Giddey attempts a Layup. BLOCKED BY BEN ADEBAYO! Ball goes out off Ben Adebayo. DeMar Giddey's ball!

[03:11] Team_032 possession (Score: 32-48)
Jalen Westbrook attempts a Layup. Contested by Ben Adebayo (5.7 feet, ZONE). Jalen Westbrook misses. Rebound secured by Anfernee Adebayo.

[02:59] Team_057 possession (Score: 32-48)
Klay Rozier makes the Layup and draws the foul on Jalen Westbrook! And-1! Klay Rozier to the line for 1. [BONUS: 6 team fouls] (Jalen Westbrook: 2 personal fouls)   FT 1/1: GOOD Klay Rozier makes 1/1 from the line.
Score: 35-48

[02:46] Team_032 possession (Score: 35-48)
Malcolm Lillard attempts a 3Pt. Contested by Kobe Ming (5.8 feet, ZONE). Malcolm Lillard misses. Offensive rebound by Anfernee Butler! Anfernee Butler kicks it out.

[02:32] Team_032 possession (Score: 35-48)
Jalen Westbrook attempts a 3Pt. Wide open! Anfernee Adebayo is 6.2 feet away. [MAN] Jalen Westbrook misses. Rebound secured by Anfernee Adebayo.

[02:21] Team_057 possession (Score: 35-48)
Anfernee Adebayo attempts a 3Pt. Wide open! Jalen Westbrook is 6.4 feet away. [MAN] Anfernee Adebayo misses. FOUL! Loose ball foul on Anfernee Butler during the rebound battle. [IN THE BONUS! 7 team fouls] Miles Middleton to the line for 2 free throws. (Anfernee Butler: 1 personal fouls)   FT 1/2: MISS   FT 2/2: GOOD Miles Middleton makes 1/2 from the line.
Score: 36-48

[02:09] Team_032 possession (Score: 36-48)
Malcolm Lillard drives to the basket... Malcolm Lillard loses control! Ball rolls out of bounds! TURNOVER! (dead ball)

[02:09] Substitution (Team_057): Kobe Ming OUT → Scottie Johnson IN (stamina_rule2)

[02:09] Substitution (Team_057): Klay Rozier OUT → Bradley Ginobili IN (stamina_rule2)

[02:09] Substitution (Team_057): Anfernee Adebayo OUT → Joel Wade IN (stamina_rule2)

[02:09] Substitution (Team_057): Ben Adebayo OUT → Lamelo Irving IN (stamina_rule2)

[02:09] Substitution (Team_057): Miles Middleton OUT → Zion Lillard IN (stamina_rule2)

[02:09] Substitution (Team_032): Tobias Bane OUT → Anfernee Griffin IN (stamina_rule2)

[02:09] Substitution (Team_032): DeMar Giddey OUT → Myles Herro IN (stamina_rule2)

[02:09] Substitution (Team_032): Jalen Westbrook OUT → Jrue Simmons IN (stamina_rule2)

[02:09] Substitution (Team_032): Anfernee Butler OUT → Jayson O'Neal IN (stamina_rule2)

[02:09] Substitution (Team_032): Malcolm Lillard OUT → Lauri Towns IN (stamina_rule2)

[01:56] Team_057 possession (Score: 36-48)
Lamelo Irving throws a bad pass! Stolen by Jayson O'Neal! TURNOVER! (live ball)

[01:42] Team_032 possession (Score: 36-48)
Myles Herro attempts a 3Pt. Contested by Bradley Ginobili (4.8 feet, MAN). Myles Herro misses. Rebound secured by Zion Lillard.

[01:29] Team_057 possession (Score: 36-48)
Bradley Ginobili attempts a 3Pt. Wide open! Myles Herro is 6.3 feet away. [MAN] Bradley Ginobili misses. Rebound secured by Lauri Towns.

[01:15] Team_032 possession (Score: 36-48)
Lauri Towns drives to the basket... Lauri Towns commits a violation (traveling/carry)! TURNOVER! (dead ball)

[01:04] Team_057 possession (Score: 36-48)
Scottie Johnson attempts a 3Pt. Contested by Anfernee Griffin (5.3 feet, MAN). Scottie Johnson misses. Rebound secured by Myles Herro.

[00:53] Team_032 possession (Score: 36-48)
Lauri Towns attempts a 3Pt. Contested by Zion Lillard (3.8 feet, MAN). LAURI TOWNS MAKES IT! Assist: Jrue Simmons
Score: 36-51

[00:41] Team_057 possession (Score: 36-51)
FOUL! Shooting foul on Jayson O'Neal. Lamelo Irving to the line for 2 free throws. [BONUS: 8 team fouls] (Jayson O'Neal: 1 personal fouls)   FT 1/2: GOOD   FT 2/2: MISS Lamelo Irving makes 1/2 from the line. FOUL! Loose ball foul on Lauri Towns during the free throw rebound! [IN THE BONUS! 9 team fouls] Lamelo Irving to the line for 2 free throws. (Lauri Towns: 1 personal fouls)   FT 1/2: GOOD   FT 2/2: GOOD Lamelo Irving makes 2/2 from the line.
Score: 39-51

[00:31] Team_032 possession (Score: 39-51)
Lauri Towns attempts a Layup. Contested by Zion Lillard (3.8 feet, MAN). LAURI TOWNS MAKES IT!
Score: 39-53

[00:16] Team_057 possession (Score: 39-53)
Scottie Johnson attempts a Midrange. Contested by Anfernee Griffin (5.3 feet, MAN). SCOTTIE JOHNSON MAKES IT!
Score: 41-53

================================================================================
                              2ND QUARTER COMPLETE                              
================================================================================

2ND QUARTER SCORE: Team_057 26, Team_032 20

BOX SCORE:
================================================================================

Team_057
--------------------------------------------------------------------------------
Player                MIN  PTS  REB  AST  TO      FG   FG%      3P   3P%
--------------------------------------------------------------------------------
Klay Rozier            20   10    0    0   0   4/7    57.1     0/0   0.0
Miles Middleton        20    8    2    0   0   4/6    66.7     0/0   0.0
Anfernee Adebayo       20    3    5    1   0   1/2    50.0     0/0   0.0
Lamelo Irving           4    3    0    0   0   1/1   100.0     0/0   0.0
Scottie Johnson         4    2    0    0   0   1/2    50.0     0/0   0.0
Kobe Ming              20    0    0    2   0   0/2     0.0     0/0   0.0
Ben Adebayo            20    0    2    0   0   0/1     0.0     0/0   0.0
Zion Lillard            4    0    1    0   0   0/0     0.0     0/0   0.0
Bradley Ginobili        4    0    0    0   0   0/1     0.0     0/0   0.0

TEAM: FG: 11/22 (50.0%), 3PT: 3/10 (30.0%), REB: 10 (0 off, 10 def), AST: 3, TO: 2
TEAM FOULS: 2


Team_032
--------------------------------------------------------------------------------
Player                MIN  PTS  REB  AST  TO      FG   FG%      3P   3P%
--------------------------------------------------------------------------------
DeMar Giddey           20    7    0    1   0   3/3   100.0     0/0   0.0
Lauri Towns             4    5    1    0   0   2/2   100.0     0/0   0.0
Anfernee Butler        20    4    5    0   0   2/5    40.0     0/0   0.0
Tobias Bane            20    4    3    0   0   2/2   100.0     0/0   0.0
Malcolm Lillard        20    0    3    0   0   0/2     0.0     0/0   0.0
Jalen Westbrook        20    0    0    1   0   0/4     0.0     0/0   0.0
Myles Herro             4    0    1    0   0   0/1     0.0     0/0   0.0
Jrue Simmons            4    0    0    1   0   0/0     0.0     0/0   0.0

TEAM: FG: 9/19 (47.4%), 3PT: 3/9 (33.3%), REB: 13 (2 off, 11 def), AST: 3, TO: 4
TEAM FOULS: 9 [Team_057 in BONUS]

================================================================================

================================================================================
                       3RD QUARTER - Team_057 vs Team_032                       
================================================================================

[12:00] Team_057 possession (Score: 41-53)
FOUL! Shooting foul on Jalen Westbrook. Anfernee Adebayo to the line for 2 free throws. [Team fouls: 1] (Jalen Westbrook: 1 personal fouls)   FT 1/2: MISS   FT 2/2: GOOD Anfernee Adebayo makes 1/2 from the line.
Score: 42-53

[11:43] Team_032 possession (Score: 42-53)
Anfernee Butler attempts a 3Pt. Contested by Kobe Ming (4.1 feet, ZONE). Anfernee Butler misses. Rebound secured by Anfernee Adebayo.

[11:28] Team_057 possession (Score: 42-53)
Kobe Ming makes the Layup and draws the foul on Malcolm Lillard! And-1! Kobe Ming to the line for 1. [Team fouls: 2] (Malcolm Lillard: 1 personal fouls)   FT 1/1: GOOD Kobe Ming makes 1/1 from the line.
Score: 45-53

[11:12] Team_032 possession (Score: 45-53)
Malcolm Lillard makes the Layup and draws the foul on Miles Middleton! And-1! Malcolm Lillard to the line for 1. [Team fouls: 1] (Miles Middleton: 1 personal fouls)   FT 1/1: GOOD Malcolm Lillard makes 1/1 from the line.
Score: 45-56

[10:56] Team_057 possession (Score: 45-56)
Anfernee Adebayo drives and kicks out. Ben Adebayo attempts a Midrange. Contested by Anfernee Butler (3.8 feet, MAN). Ben Adebayo misses. Rebound secured by Tobias Bane.

[10:43] Team_032 possession (Score: 45-56)
DeMar Giddey loses control! Ball rolls out of bounds! TURNOVER! (dead ball)

[10:30] Team_057 possession (Score: 45-56)
Kobe Ming attempts a Layup. Contested by Anfernee Butler (4.1 feet, ZONE). KOBE MING MAKES IT! Assist: Anfernee Adebayo
Score: 47-56

[10:15] Team_032 possession (Score: 47-56)
DeMar Giddey makes the Layup and draws the foul on Anfernee Adebayo! And-1! DeMar Giddey to the line for 1. [Team fouls: 2] (Anfernee Adebayo: 1 personal fouls)   FT 1/1: GOOD DeMar Giddey makes 1/1 from the line.
Score: 47-59

[10:04] Team_057 possession (Score: 47-59)
Anfernee Adebayo attempts a 3Pt. Contested by Tobias Bane (4.8 feet, ZONE). Anfernee Adebayo misses. Rebound secured by Anfernee Butler.

[09:48] Team_032 possession (Score: 47-59)
Tobias Bane attempts a Midrange. Contested by Kobe Ming (4.6 feet, MAN). Tobias Bane misses. Rebound secured by Ben Adebayo.

[09:30] Team_057 possession (Score: 47-59)
FOUL! Shooting foul on Jalen Westbrook. Anfernee Adebayo to the line for 2 free throws. [Team fouls: 3] (Jalen Westbrook: 2 personal fouls)   FT 1/2: GOOD   FT 2/2: MISS Anfernee Adebayo makes 1/2 from the line. Rebound secured by Malcolm Lillard.
Score: 48-59

[09:12] Team_032 possession (Score: 48-59)
DeMar Giddey drives, Ben Adebayo stays with him. DeMar Giddey attempts a Dunk. Contested by Ben Adebayo (4.8 feet, ZONE). DeMar Giddey misses. Rebound secured by Anfernee Adebayo.

[08:57] Team_057 possession (Score: 48-59)
Ben Adebayo drives, Anfernee Butler stays with him. Ben Adebayo attempts a Dunk. Contested by Anfernee Butler (4.4 feet, MAN). Ben Adebayo misses. Rebound secured by Anfernee Butler.

[08:40] Team_032 possession (Score: 48-59)
Jalen Westbrook attempts a 3Pt. Contested by Anfernee Adebayo (5.1 feet, MAN). Jalen Westbrook misses. Rebound secured by Anfernee Adebayo.

[08:30] Team_057 possession (Score: 48-59)
FOUL! Shooting foul on Anfernee Butler. Ben Adebayo to the line for 2 free throws. [Team fouls: 4] (Anfernee Butler: 1 personal fouls)   FT 1/2: GOOD   FT 2/2: MISS Ben Adebayo makes 1/2 from the line. Offensive rebound by Ben Adebayo! Ben Adebayo kicks it out.
Score: 49-59

[08:13] Team_057 possession (Score: 49-59)
Ben Adebayo loses the ball! Stripped by Anfernee Butler! TURNOVER! (live ball)

[07:57] Team_032 possession (Score: 49-59)
Malcolm Lillard attempts a Dunk. BLOCKED BY KLAY ROZIER! Ball deflects out of bounds off Malcolm Lillard.

[07:42] Team_057 possession (Score: 49-59)
Ben Adebayo drives, Anfernee Butler stays with him. Ben Adebayo attempts a Layup. Contested by Anfernee Butler (4.4 feet, MAN). BEN ADEBAYO MAKES IT!
Score: 51-59

[07:31] Team_032 possession (Score: 51-59)
DeMar Giddey attempts a Layup. Contested by Ben Adebayo (4.8 feet, ZONE). DeMar Giddey misses. Rebound secured by Miles Middleton.

[07:19] Team_057 possession (Score: 51-59)
Ben Adebayo attempts a Layup. Contested by Anfernee Butler (4.4 feet, MAN). Ben Adebayo misses. FOUL! Loose ball foul on Malcolm Lillard during the rebound battle. [IN THE BONUS! 5 team fouls] Miles Middleton to the line for 2 free throws. (Malcolm Lillard: 2 personal fouls)   FT 1/2: GOOD   FT 2/2: GOOD Miles Middleton makes 2/2 from the line.
Score: 53-59

[07:05] Team_032 possession (Score: 53-59)
DeMar Giddey drives and kicks out. Malcolm Lillard attempts a Midrange. Contested by Miles Middleton (4.4 feet, MAN). MALCOLM LILLARD MAKES IT! Assist: Anfernee Butler
Score: 53-61

[06:49] Team_057 possession (Score: 53-61)
Kobe Ming drives and kicks out. Miles Middleton attempts a 3Pt. Contested by DeMar Giddey (3.9 feet, ZONE). Miles Middleton misses. Rebound secured by Tobias Bane.

[06:38] Team_032 possession (Score: 53-61)
DeMar Giddey attempts a Layup. BLOCKED BY KLAY ROZIER! Ball deflects out of bounds off DeMar Giddey.

[06:26] Team_057 possession (Score: 53-61)
Miles Middleton attempts a Layup. Contested by Malcolm Lillard (4.5 feet, MAN). Miles Middleton misses. Rebound secured by Anfernee Butler.

[06:16] Team_032 possession (Score: 53-61)
Jalen Westbrook attempts a 3Pt. Contested by Kobe Ming (4.7 feet, ZONE). Jalen Westbrook misses. Rebound secured by Miles Middleton.

[06:00] Team_057 possession (Score: 53-61)
Miles Middleton drives, Malcolm Lillard stays with him. Miles Middleton attempts a Dunk. Contested by Malcolm Lillard (4.5 feet, ZONE). Miles Middleton misses. FOUL! Loose ball foul on Malcolm Lillard during the rebound battle. [IN THE BONUS! 6 team fouls] Ben Adebayo to the line for 2 free throws. (Malcolm Lillard: 3 personal fouls)   FT 1/2: GOOD   FT 2/2: GOOD Ben Adebayo makes 2/2 from the line.
Score: 55-61

[05:43] Team_032 possession (Score: 55-61)
Malcolm Lillard attempts a Midrange. Contested by Miles Middleton (4.8 feet, ZONE). Malcolm Lillard misses. Rebound secured by Miles Middleton.

[05:26] Team_057 possession (Score: 55-61)
Ben Adebayo makes the Layup and draws the foul on Anfernee Butler! And-1! Ben Adebayo to the line for 1. [BONUS: 7 team fouls] (Anfernee Butler: 2 personal fouls)   FT 1/1: GOOD Ben Adebayo makes 1/1 from the line.
Score: 58-61

[05:07] Team_032 possession (Score: 58-61)
Tobias Bane attempts a 3Pt. Contested by Kobe Ming (4.6 feet, MAN). Tobias Bane misses. FOUL! Loose ball foul on Anfernee Adebayo during the rebound battle. [Team fouls: 3] No free throws, side out. (Anfernee Adebayo: 2 personal fouls)

[04:53] Team_032 possession (Score: 58-61)
Malcolm Lillard drives, Miles Middleton stays with him. Malcolm Lillard attempts a Layup. Contested by Miles Middleton (4.8 feet, MAN). MALCOLM LILLARD MAKES IT! Assist: Anfernee Butler
Score: 58-63

[04:37] Team_057 possession (Score: 58-63)
Ben Adebayo drives, picks up Malcolm Lillard. Help arrives from DeMar Giddey! Ben Adebayo attempts a Dunk. Contested by DeMar Giddey (5.2 feet, ZONE). Ben Adebayo misses. Offensive rebound by Miles Middleton! Miles Middleton kicks it out.

[04:24] Team_057 possession (Score: 58-63)
Miles Middleton drives to the basket... Miles Middleton loses control! Ball rolls out of bounds! TURNOVER! (dead ball)

[04:09] Team_032 possession (Score: 58-63)
Tobias Bane makes the 3Pt and draws the foul on Kobe Ming! And-1! Tobias Bane to the line for 1. [Team fouls: 4] (Kobe Ming: 1 personal fouls)   FT 1/1: GOOD Tobias Bane makes 1/1 from the line.
Score: 58-67

[03:58] Team_057 possession (Score: 58-67)
Anfernee Adebayo attempts a 3Pt. Contested by Tobias Bane (4.9 feet, ZONE). Anfernee Adebayo misses. Rebound secured by Tobias Bane.

[03:40] Team_032 possession (Score: 58-67)
Jalen Westbrook attempts a 3Pt. Contested by Anfernee Adebayo (5.2 feet, MAN). Jalen Westbrook misses. Rebound secured by Miles Middleton.

[03:27] Team_057 possession (Score: 58-67)
Anfernee Adebayo attempts a 3Pt. Contested by Jalen Westbrook (5.4 feet, MAN). Anfernee Adebayo misses. Rebound secured by Malcolm Lillard.

[03:09] Team_032 possession (Score: 58-67)
Malcolm Lillard attempts a Midrange. Contested by Ben Adebayo (5.0 feet, ZONE). MALCOLM LILLARD MAKES IT! Assist: Anfernee Butler
Score: 58-69

[02:53] Team_057 possession (Score: 58-69)
Kobe Ming makes the Midrange and draws the foul on Tobias Bane! And-1! Kobe Ming to the line for 1. [BONUS: 8 team fouls] (Tobias Bane: 1 personal fouls)   FT 1/1: GOOD Kobe Ming makes 1/1 from the line.
Score: 61-69

[02:39] Team_032 possession (Score: 61-69)
FOUL! Shooting foul on Klay Rozier. Anfernee Butler to the line for 2 free throws. [BONUS: 5 team fouls] (Klay Rozier: 1 personal fouls)   FT 1/2: GOOD   FT 2/2: GOOD Anfernee Butler makes 2/2 from the line.
Score: 61-71

[02:25] Team_057 possession (Score: 61-71)
Anfernee Adebayo attempts a Layup. Contested by Jalen Westbrook (5.5 feet, MAN). ANFERNEE ADEBAYO MAKES IT! Assist: Ben Adebayo
Score: 63-71

[02:08] Team_032 possession (Score: 63-71)
FOUL! Shooting foul on Anfernee Adebayo. Jalen Westbrook to the line for 2 free throws. [BONUS: 6 team fouls] (Anfernee Adebayo: 3 personal fouls)   FT 1/2: GOOD   FT 2/2: GOOD Jalen Westbrook makes 2/2 from the line.
Score: 63-73

[01:55] Team_057 possession (Score: 63-73)
Klay Rozier attempts a Midrange. Contested by DeMar Giddey (4.4 feet, MAN). Klay Rozier misses. Rebound secured by Anfernee Butler.

[01:42] Team_032 possession (Score: 63-73)
FOUL! Holding foul on Miles Middleton. [IN THE BONUS! 7 team fouls] Malcolm Lillard to the line for 2 free throws. (Miles Middleton: 2 personal fouls)   FT 1/2: GOOD   FT 2/2: GOOD Malcolm Lillard makes 2/2 from the line.
Score: 63-75

[01:28] Team_057 possession (Score: 63-75)
Klay Rozier attempts a 3Pt. Contested by DeMar Giddey (4.4 feet, MAN). KLAY ROZIER MAKES IT! Assist: Miles Middleton
Score: 66-75

[01:18] Team_032 possession (Score: 66-75)
Jalen Westbrook attempts a 3Pt. Contested by Anfernee Adebayo (5.4 feet, MAN). Jalen Westbrook misses. Offensive rebound by Anfernee Butler! Anfernee Butler kicks it out.

[01:02] Team_032 possession (Score: 66-75)
FOUL! Shooting foul on Anfernee Adebayo. Jalen Westbrook to the line for 2 free throws. [BONUS: 8 team fouls] (Anfernee Adebayo: 4 personal fouls)   FT 1/2: GOOD   FT 2/2: GOOD Jalen Westbrook makes 2/2 from the line.
Score: 66-77

[00:46] Team_057 possession (Score: 66-77)
Anfernee Adebayo drives to the basket... Anfernee Adebayo commits a violation (traveling/carry)! TURNOVER! (dead ball)

[00:46] Substitution (Team_057): Kobe Ming OUT → Scottie Johnson IN (stamina_rule2)

[00:46] Substitution (Team_057): Klay Rozier OUT → Bradley Ginobili IN (stamina_rule2)

[00:46] Substitution (Team_057): Anfernee Adebayo OUT → Joel Wade IN (stamina_rule2)

[00:46] Substitution (Team_057): Ben Adebayo OUT → Lamelo Irving IN (stamina_rule2)

[00:46] Substitution (Team_057): Miles Middleton OUT → Zion Lillard IN (stamina_rule2)

[00:46] Substitution (Team_032): Tobias Bane OUT → Anfernee Griffin IN (stamina_rule2)

[00:46] Substitution (Team_032): DeMar Giddey OUT → Myles Herro IN (stamina_rule2)

[00:46] Substitution (Team_032): Jalen Westbrook OUT → Jrue Simmons IN (stamina_rule2)

[00:46] Substitution (Team_032): Anfernee Butler OUT → Jayson O'Neal IN (stamina_rule2)

[00:46] Substitution (Team_032): Malcolm Lillard OUT → Lauri Towns IN (stamina_rule2)

[00:34] Team_032 possession (Score: 66-77)
Jayson O'Neal attempts a 3Pt. Contested by Lamelo Irving (5.0 feet, MAN). Jayson O'Neal misses. Rebound secured by Lamelo Irving.

[00:18] Team_057 possession (Score: 66-77)
Zion Lillard loses control! Ball rolls out of bounds! TURNOVER! (dead ball)

[00:03] Team_032 possession (Score: 66-77)
Myles Herro attempts a Midrange. Contested by Lamelo Irving (4.7 feet, ZONE). Myles Herro misses. Rebound secured by Zion Lillard.

================================================================================
                              3RD QUARTER COMPLETE                              
================================================================================

3RD QUARTER SCORE: Team_057 25, Team_032 24

BOX SCORE:
================================================================================

Team_057
--------------------------------------------------------------------------------
Player                MIN  PTS  REB  AST  TO      FG   FG%      3P   3P%
--------------------------------------------------------------------------------
Kobe Ming              32    8    0    0   0   3/4    75.0     0/0   0.0
Ben Adebayo            32    7    2    1   0   3/4    75.0     0/0   0.0
Anfernee Adebayo       32    3    3    1   0   2/7    28.6     0/0   0.0
Klay Rozier            32    3    0    0   0   1/2    50.0     0/0   0.0
Miles Middleton        32    2    5    1   0   1/2    50.0     0/0   0.0
Lamelo Irving           5    0    1    0   0   0/0     0.0     0/0   0.0
Zion Lillard            5    0    1    0   0   0/0     0.0     0/0   0.0

TEAM: FG: 10/19 (52.6%), 3PT: 1/4 (25.0%), REB: 12 (2 off, 10 def), AST: 3, TO: 4
TEAM FOULS: 8 [Team_032 in BONUS]


Team_032
--------------------------------------------------------------------------------
Player                MIN  PTS  REB  AST  TO      FG   FG%      3P   3P%
--------------------------------------------------------------------------------
Malcolm Lillard        32   11    2    0   0   5/7    71.4     0/0   0.0
Tobias Bane            32    4    3    0   0   1/2    50.0     0/0   0.0
Jalen Westbrook        32    4    0    0   0   2/5    40.0     0/0   0.0
DeMar Giddey           32    3    0    0   0   1/4    25.0     0/0   0.0
Anfernee Butler        32    2    6    3   0   1/2    50.0     0/0   0.0
Jayson O'Neal           5    0    0    0   0   0/1     0.0     0/0   0.0
Myles Herro             5    0    0    0   0   0/1     0.0     0/0   0.0

TEAM: FG: 10/22 (45.5%), 3PT: 1/6 (16.7%), REB: 11 (2 off, 9 def), AST: 3, TO: 1
TEAM FOULS: 8 [Team_057 in BONUS]

================================================================================

================================================================================
                       4TH QUARTER - Team_057 vs Team_032                       
================================================================================

[12:00] Substitution (Team_057): Kobe Ming OUT (stamina: 73) → Scottie Johnson IN (comeback_detected)

[12:00] Substitution (Team_032): Tobias Bane OUT (stamina: 73) → Anfernee Griffin IN (comeback_detected)

[12:00] Team_057 possession (Score: 66-77)
Anfernee Adebayo loses control! Ball rolls out of bounds! TURNOVER! (dead ball)

[11:45] Team_032 possession (Score: 66-77)
FOUL! Reach-in foul on Scottie Johnson during the drive. [Team fouls: 1] No free throws, side out. (Scottie Johnson: 1 personal fouls)

[11:32] Team_032 possession (Score: 66-77)
DeMar Giddey attempts a 3Pt. Contested by Scottie Johnson (5.1 feet, ZONE). DeMar Giddey misses. Rebound secured by Miles Middleton.

[11:19] Team_057 possession (Score: 66-77)
Anfernee Adebayo attempts a 3Pt. Contested by Jalen Westbrook (5.5 feet, MAN). Anfernee Adebayo misses. Rebound secured by Malcolm Lillard.

[11:06] Team_032 possession (Score: 66-77)
DeMar Giddey drives and kicks out. Anfernee Griffin attempts a Midrange. Contested by Scottie Johnson (4.8 feet, ZONE). ANFERNEE GRIFFIN MAKES IT! Assist: Malcolm Lillard
Score: 66-79

[10:55] Team_057 possession (Score: 66-79)
Klay Rozier attempts a 3Pt. Contested by DeMar Giddey (4.4 feet, MAN). Klay Rozier misses. Offensive rebound by Ben Adebayo! Ben Adebayo kicks it out.

[10:37] Team_057 possession (Score: 66-79)
Scottie Johnson attempts a 3Pt. Contested by Anfernee Griffin (5.3 feet, ZONE). Scottie Johnson misses. Rebound secured by DeMar Giddey.

[10:24] Team_032 possession (Score: 66-79)
Jalen Westbrook attempts a 3Pt. Contested by Anfernee Adebayo (5.4 feet, MAN). Jalen Westbrook misses. Rebound secured by Ben Adebayo.

[10:12] Team_057 possession (Score: 66-79)
FOUL! Holding foul on Anfernee Butler. [Team fouls: 1] No free throws, side out. (Anfernee Butler: 1 personal fouls)

[09:56] Team_057 possession (Score: 66-79)
FOUL! Shooting foul on Jalen Westbrook. Anfernee Adebayo to the line for 3 free throws. [Team fouls: 2] (Jalen Westbrook: 1 personal fouls)   FT 1/3: GOOD   FT 2/3: GOOD   FT 3/3: GOOD Anfernee Adebayo makes 3/3 from the line.
Score: 69-79

[09:38] Team_032 possession (Score: 69-79)
DeMar Giddey attempts a 3Pt. Contested by Klay Rozier (4.4 feet, MAN). DEMAR GIDDEY MAKES IT! Assist: Anfernee Griffin
Score: 69-82

[09:19] Team_057 possession (Score: 69-82)
Ben Adebayo attempts a Midrange. Contested by Anfernee Butler (4.9 feet, MAN). Ben Adebayo misses. Rebound secured by DeMar Giddey.

[09:05] Team_032 possession (Score: 69-82)
Malcolm Lillard attempts a Midrange. Contested by Miles Middleton (5.3 feet, MAN). Malcolm Lillard misses. FOUL! Loose ball foul on Miles Middleton during the rebound battle. [Team fouls: 2] No free throws, side out. (Miles Middleton: 1 personal fouls)

[08:55] Team_032 possession (Score: 69-82)
Malcolm Lillard attempts a Midrange. Contested by Klay Rozier (4.5 feet, ZONE). MALCOLM LILLARD MAKES IT!
Score: 69-84

[08:38] Team_057 possession (Score: 69-84)
Scottie Johnson drives and kicks out. Ben Adebayo attempts a 3Pt. Contested by Anfernee Butler (4.6 feet, MAN). Ben Adebayo misses. Rebound secured by Anfernee Butler.

[08:26] Team_032 possession (Score: 69-84)
FOUL! Reach-in foul on Ben Adebayo during the drive. [Team fouls: 3] No free throws, side out. (Ben Adebayo: 1 personal fouls)

[08:12] Team_032 possession (Score: 69-84)
FOUL! Shooting foul on Klay Rozier. Malcolm Lillard to the line for 2 free throws. [Team fouls: 4] (Klay Rozier: 1 personal fouls)   FT 1/2: GOOD   FT 2/2: GOOD Malcolm Lillard makes 2/2 from the line.
Score: 69-86

[07:56] Team_057 possession (Score: 69-86)
Klay Rozier drives, Malcolm Lillard stays with him. Klay Rozier attempts a Dunk. Contested by Malcolm Lillard (5.2 feet, ZONE). KLAY ROZIER MAKES IT! Assist: Anfernee Adebayo
Score: 71-86

[07:42] Team_032 possession (Score: 71-86)
Malcolm Lillard attempts a 3Pt. Contested by Miles Middleton (5.4 feet, MAN). MALCOLM LILLARD MAKES IT! Assist: Anfernee Griffin
Score: 71-89

[07:29] Team_057 possession (Score: 71-89)
Scottie Johnson attempts a Midrange. Contested by Jalen Westbrook (5.9 feet, ZONE). Scottie Johnson misses. Rebound secured by Anfernee Butler.

[07:15] Team_032 possession (Score: 71-89)
Jalen Westbrook attempts a Layup. Contested by Ben Adebayo (5.4 feet, ZONE). JALEN WESTBROOK MAKES IT! Assist: Anfernee Griffin
Score: 71-91

[07:00] Team_057 possession (Score: 71-91)
Miles Middleton drives to the basket... FOUL! Offensive foul on Miles Middleton! Malcolm Lillard drew the charge! [Team fouls: 5] (Miles Middleton: 2 personal fouls) TURNOVER! (dead ball)

[06:43] Team_032 possession (Score: 71-91)
DeMar Giddey drives, Ben Adebayo stays with him. DeMar Giddey attempts a Dunk. Contested by Ben Adebayo (5.5 feet, ZONE). DeMar Giddey misses. Offensive rebound by Anfernee Butler! Anfernee Butler kicks it out.

[06:29] Team_032 possession (Score: 71-91)
DeMar Giddey attempts a Layup. Contested by Klay Rozier (4.8 feet, MAN). DeMar Giddey misses. Rebound secured by Ben Adebayo.

[06:14] Team_057 possession (Score: 71-91)
Ben Adebayo throws a bad pass! Stolen by Anfernee Butler! TURNOVER! (live ball)

[06:00] Team_032 possession (Score: 71-91)
Jalen Westbrook attempts a 3Pt. Contested by Anfernee Adebayo (5.9 feet, MAN). Jalen Westbrook misses. Rebound secured by Miles Middleton.

[05:45] Team_057 possession (Score: 71-91)
Ben Adebayo drives to the basket... Ben Adebayo throws a bad pass! Stolen by Anfernee Butler! TURNOVER! (live ball)

[05:35] Team_032 possession (Score: 71-91)
DeMar Giddey attempts a 3Pt. Contested by Klay Rozier (4.9 feet, MAN). DEMAR GIDDEY MAKES IT!
Score: 71-94

[05:18] Team_057 possession (Score: 71-94)
Miles Middleton makes the Layup and draws the foul on Malcolm Lillard! And-1! Miles Middleton to the line for 1. [Team fouls: 3] (Malcolm Lillard: 1 personal fouls)   FT 1/1: GOOD Miles Middleton makes 1/1 from the line.
Score: 74-94

[05:04] Team_032 possession (Score: 74-94)
FOUL! Holding foul on Scottie Johnson. [IN THE BONUS! 6 team fouls] Anfernee Griffin to the line for 2 free throws. (Scottie Johnson: 2 personal fouls)   FT 1/2: GOOD   FT 2/2: MISS Anfernee Griffin makes 1/2 from the line. Rebound secured by Miles Middleton.
Score: 74-95

[04:46] Team_057 possession (Score: 74-95)
Miles Middleton attempts a Midrange. Contested by DeMar Giddey (5.0 feet, ZONE). Miles Middleton misses. Rebound secured by Anfernee Butler.

[04:32] Team_032 possession (Score: 74-95)
Jalen Westbrook attempts a 3Pt. Wide open! Anfernee Adebayo is 6.1 feet away. [MAN] Jalen Westbrook misses. Rebound secured by Ben Adebayo.

[04:18] Team_057 possession (Score: 74-95)
Klay Rozier drives, picks up DeMar Giddey. Help arrives from Jalen Westbrook! Klay Rozier attempts a Layup. Contested by Jalen Westbrook (5.3 feet, MAN). KLAY ROZIER MAKES IT! Assist: Miles Middleton
Score: 76-95

[04:04] Team_032 possession (Score: 76-95)
Jalen Westbrook attempts a 3Pt. Contested by Scottie Johnson (5.0 feet, ZONE). Jalen Westbrook misses. Rebound secured by Anfernee Adebayo.

[03:54] Team_057 possession (Score: 76-95)
Miles Middleton drives, Malcolm Lillard stays with him. Miles Middleton attempts a Dunk. Contested by Malcolm Lillard (5.4 feet, ZONE). MILES MIDDLETON MAKES IT!
Score: 78-95

[03:44] Team_032 possession (Score: 78-95)
Anfernee Griffin throws a bad pass out of bounds! TURNOVER! (dead ball)

[03:44] Substitution (Team_057): Klay Rozier OUT → Bradley Ginobili IN (stamina_rule2)

[03:44] Substitution (Team_057): Anfernee Adebayo OUT → Joel Wade IN (stamina_rule2)

[03:44] Substitution (Team_057): Ben Adebayo OUT → Lamelo Irving IN (stamina_rule2)

[03:44] Substitution (Team_057): Miles Middleton OUT → Zion Lillard IN (stamina_rule2)

[03:44] Substitution (Team_032): DeMar Giddey OUT → Myles Herro IN (stamina_rule2)

[03:44] Substitution (Team_032): Jalen Westbrook OUT → Jrue Simmons IN (stamina_rule2)

[03:44] Substitution (Team_032): Anfernee Butler OUT → Jayson O'Neal IN (stamina_rule2)

[03:44] Substitution (Team_032): Malcolm Lillard OUT → Lauri Towns IN (stamina_rule2)

[03:28] Team_057 possession (Score: 78-95)
Joel Wade drives, Lauri Towns stays with him. Joel Wade attempts a Dunk. Contested by Lauri Towns (5.3 feet, ZONE). JOEL WADE MAKES IT! Assist: Zion Lillard
Score: 80-95

[03:12] Team_032 possession (Score: 80-95)
FOUL! Shooting foul on Zion Lillard. Lauri Towns to the line for 2 free throws. [BONUS: 7 team fouls] (Zion Lillard: 1 personal fouls)   FT 1/2: GOOD   FT 2/2: GOOD Lauri Towns makes 2/2 from the line.
Score: 80-97

[02:55] Team_057 possession (Score: 80-97)
Zion Lillard drives to the basket... Zion Lillard throws a bad pass out of bounds! TURNOVER! (dead ball)

[02:40] Team_032 possession (Score: 80-97)
Jrue Simmons attempts a Midrange. Contested by Joel Wade (5.7 feet, MAN). JRUE SIMMONS MAKES IT!
Score: 80-99

[02:28] Team_057 possession (Score: 80-99)
Joel Wade drives to the basket... Joel Wade loses the ball! Stripped by Lauri Towns! TURNOVER! (live ball)

[02:13] Team_032 possession (Score: 80-99)
Jayson O'Neal throws a bad pass! Stolen by Lamelo Irving! TURNOVER! (live ball)

[02:02] Team_057 possession (Score: 80-99)
Zion Lillard drives, picks up Lauri Towns. Help arrives from Myles Herro! Zion Lillard attempts a Layup. Contested by Myles Herro (5.6 feet, MAN). ZION LILLARD MAKES IT! Assist: Scottie Johnson
Score: 82-99

[01:53] Team_032 possession (Score: 82-99)
Jayson O'Neal attempts a Layup. Contested by Zion Lillard (3.8 feet, ZONE). Jayson O'Neal misses. Rebound secured by Zion Lillard.

[01:43] Team_057 possession (Score: 82-99)
FOUL! Holding foul on Myles Herro. [Team fouls: 4] No free throws, side out. (Myles Herro: 1 personal fouls)

[01:27] Team_057 possession (Score: 82-99)
Joel Wade drives to the basket... FOUL! Offensive foul on Joel Wade! Jrue Simmons drew the charge! [Team fouls: 8] (Joel Wade: 1 personal fouls) TURNOVER! (dead ball)

[01:15] Team_032 possession (Score: 82-99)
Myles Herro commits a violation (traveling/carry)! TURNOVER! (dead ball)

[01:00] Team_057 possession (Score: 82-99)
Scottie Johnson attempts a Midrange. Contested by Anfernee Griffin (5.7 feet, MAN). Scottie Johnson misses. Rebound secured by Jayson O'Neal.

[00:47] Team_032 possession (Score: 82-99)
Myles Herro attempts a 3Pt. Contested by Scottie Johnson (5.4 feet, ZONE). MYLES HERRO MAKES IT! Assist: Anfernee Griffin
Score: 82-102

[00:30] Team_057 possession (Score: 82-102)
Lamelo Irving attempts a 3Pt. Wide open! Anfernee Griffin is 6.4 feet away. [ZONE] Lamelo Irving misses. Rebound secured by Jayson O'Neal.

[00:13] Team_032 possession (Score: 82-102)
Anfernee Griffin attempts a Layup. BLOCKED BY BRADLEY GINOBILI! Ball goes out off Bradley Ginobili. Anfernee Griffin's ball!

================================================================================
                              4TH QUARTER COMPLETE                              
================================================================================

4TH QUARTER SCORE: Team_057 16, Team_032 25

BOX SCORE:
================================================================================

Team_057
--------------------------------------------------------------------------------
Player                MIN  PTS  REB  AST  TO      FG   FG%      3P   3P%
--------------------------------------------------------------------------------
Miles Middleton        40    5    3    1   0   2/3    66.7     0/0   0.0
Klay Rozier            40    4    0    0   0   2/2   100.0     0/0   0.0
Anfernee Adebayo       40    3    1    1   0   1/2    50.0     0/0   0.0
Joel Wade               8    2    0    0   0   1/1   100.0     0/0   0.0
Zion Lillard            8    2    1    1   0   1/1   100.0     0/0   0.0
Ben Adebayo            40    0    4    0   0   0/1     0.0     0/0   0.0
Scottie Johnson        17    0    0    1   0   0/4     0.0     0/0   0.0
Lamelo Irving           8    0    0    0   0   0/1     0.0     0/0   0.0

TEAM: FG: 7/15 (46.7%), 3PT: 1/4 (25.0%), REB: 9 (1 off, 8 def), AST: 4, TO: 7
TEAM FOULS: 8 [Team_032 in BONUS]


Team_032
--------------------------------------------------------------------------------
Player                MIN  PTS  REB  AST  TO      FG   FG%      3P   3P%
--------------------------------------------------------------------------------
Malcolm Lillard        40    7    2    1   0   3/3   100.0     0/0   0.0
DeMar Giddey           40    6    2    0   0   2/4    50.0     0/0   0.0
Myles Herro             8    3    0    0   0   1/1   100.0     0/0   0.0
Anfernee Griffin       17    2    0    4   0   1/1   100.0     0/0   0.0
Jalen Westbrook        40    2    0    0   0   1/5    20.0     0/0   0.0
Lauri Towns             8    2    0    0   0   1/1   100.0     0/0   0.0
Jrue Simmons            8    2    0    0   0   1/1   100.0     0/0   0.0
Anfernee Butler        40    0    4    0   0   0/0     0.0     0/0   0.0
Jayson O'Neal           8    0    2    0   0   0/1     0.0     0/0   0.0

TEAM: FG: 10/18 (55.6%), 3PT: 4/9 (44.4%), REB: 10 (2 off, 8 def), AST: 5, TO: 3
TEAM FOULS: 4

================================================================================

================================================================================
                               FULL GAME COMPLETE                               
================================================================================

FINAL SCORE: Team_057 82, Team_032 102

SCORING BY QUARTER:
--------------------------------------------------------------------------------
Team                     Q1     Q2     Q3     Q4    FINAL
--------------------------------------------------------------------------------
Team_057                 15     26     25     16       82
Team_032                 33     20     24     25      102
--------------------------------------------------------------------------------

FULL GAME BOX SCORE:
================================================================================

Team_057
--------------------------------------------------------------------------------
Player                MIN  PTS  REB  AST  TO      FG   FG%      3P   3P%      FT STL BLK
--------------------------------------------------------------------------------
Klay Rozier            40   22    0    0   2   8/15   53.3   2/5    40.0   6/6     0   2
Anfernee Adebayo       40    9   12    4   2   5/15   33.3   3/10   30.0   5/7     0   1
Ben Adebayo            40    7   10    1   4   3/7    42.9   0/0     0.0   4/5     0   2
Miles Middleton        40   15   12    2   1   6/11   54.5   0/1     0.0   5/6     1   0
Kobe Ming              32   13    0    2   1   5/11   45.5   1/3    33.3   2/2     0   1
Scottie Johnson        17    5    0    1   1   2/7    28.6   1/3    33.3   0/0     0   0
Bradley Ginobili        8    0    0    0   1   0/1     0.0   0/1     0.0   0/0     0   1
Joel Wade               8    2    0    1   1   1/1   100.0   0/0     0.0   0/0     0   0
Lamelo Irving           8    5    1    0   2   2/5    40.0   0/2     0.0   1/2     1   0
Zion Lillard            8    2    5    1   1   1/1   100.0   0/0     0.0   0/0     0   0

TEAM: FG: 34/75 (45.3%), 3PT: 7/25 (28.0%), REB: 40 (5 off, 35 def), AST: 12, TO: 16


Team_032
--------------------------------------------------------------------------------
Player                MIN  PTS  REB  AST  TO      FG   FG%      3P   3P%      FT STL BLK
--------------------------------------------------------------------------------
DeMar Giddey           40   19    2    3   1   8/14   57.1   5/6    83.3   3/4     1   0
Jalen Westbrook        40    9    0    2   1   4/17   23.5   1/11    9.1   4/4     0   0
Anfernee Butler        40   16   22    3   0   7/12   58.3   1/3    33.3   4/4     3   0
Malcolm Lillard        40   27   12    1   1  10/14   71.4   1/2    50.0   8/8     0   1
Tobias Bane            32   12    8    3   1   4/6    66.7   1/1   100.0   4/6     0   0
Anfernee Griffin       17    2    0    5   1   0/1     0.0   0/1     0.0   1/2     0   0
Myles Herro             8    3    1    0   2   1/3    33.3   1/2    50.0   0/0     0   0
Jrue Simmons            8    4    0    1   0   2/3    66.7   0/1     0.0   0/0     0   0
Jayson O'Neal           8    2    3    0   1   1/3    33.3   0/1     0.0   0/0     1   0
Lauri Towns             8    7    2    0   0   3/3   100.0   1/1   100.0   2/2     1   0

TEAM: FG: 43/80 (53.8%), 3PT: 11/29 (37.9%), REB: 50 (9 off, 41 def), AST: 18, TO: 8

================================================================================
