================================================================================
                        FULL GAME - Team_047 vs Team_014                        
================================================================================

================================================================================
                       1ST QUARTER - Team_047 vs Team_014                       
================================================================================

[12:00] Team_047 possession (Score: 0-0)
De'Aaron Rose drives, DeMar Adebayo stays with him. De'Aaron Rose attempts a Dunk. Contested by DeMar Adebayo (3.4 feet, ZONE). De'Aaron Rose misses. Offensive rebound by Myles LaVine! Myles LaVine kicks it out.

[11:45] Team_047 possession (Score: 0-0)
Blake Jokic drives, Lamelo Simmons stays with him. Blake Jokic attempts a Layup. Contested by Lamelo Simmons (3.8 feet, MAN). BLAKE JOKIC MAKES IT!
Score: 2-0

[11:32] Team_014 possession (Score: 2-0)
FOUL! Shooting foul on Derrick Irving. Ayo Murray to the line for 2 free throws. [Team fouls: 1] (Derrick Irving: 1 personal fouls)   FT 1/2: GOOD   FT 2/2: GOOD Ayo Murray makes 2/2 from the line.
Score: 2-2

[11:17] Team_047 possession (Score: 2-2)
Myles LaVine attempts a Midrange. Contested by Ayo Murray (4.9 feet, MAN). Myles LaVine misses. Rebound secured by Ayo Murray.

[11:07] Team_014 possession (Score: 2-2)
FOUL! Reach-in foul on Josh Harris during the drive. [Team fouls: 2] No free throws, side out. (Josh Harris: 1 personal fouls)

[10:55] Team_014 possession (Score: 2-2)
Lamelo Simmons attempts a Layup. Contested by Blake Jokic (5.3 feet, MAN). LAMELO SIMMONS MAKES IT! Assist: Ayo Murray
Score: 2-4

[10:37] Team_047 possession (Score: 2-4)
Josh Harris drives and kicks out. Josh Harris attempts a 3Pt. Contested by DeMar Adebayo (3.1 feet, MAN). JOSH HARRIS MAKES IT! Assist: Myles LaVine
Score: 5-4

[10:23] Team_014 possession (Score: 5-4)
Lamelo Simmons drives and kicks out. FOUL! Shooting foul on Josh Harris. DeMar Adebayo to the line for 2 free throws. [Team fouls: 3] (Josh Harris: 2 personal fouls)   FT 1/2: MISS   FT 2/2: GOOD DeMar Adebayo makes 1/2 from the line.
Score: 5-5

[10:12] Team_047 possession (Score: 5-5)
Blake Jokic makes the Layup and draws the foul on DeMar Adebayo! And-1! Blake Jokic to the line for 1. [Team fouls: 1] (DeMar Adebayo: 1 personal fouls)   FT 1/1: GOOD Blake Jokic makes 1/1 from the line.
Score: 8-5

[09:57] Team_014 possession (Score: 8-5)
Jordan Anunoby drives to the basket... FOUL! Offensive foul on Jordan Anunoby! Derrick Irving drew the charge! [Team fouls: 2] (Jordan Anunoby: 1 personal fouls) TURNOVER! (dead ball)

[09:44] Team_047 possession (Score: 8-5)
Derrick Irving attempts a 3Pt. Contested by Jordan Anunoby (5.0 feet, ZONE). Derrick Irving misses. Rebound secured by Ayo Murray.

[09:35] Team_014 possession (Score: 8-5)
FOUL! Reach-in foul on De'Aaron Rose during the drive. [Team fouls: 4] No free throws, side out. (De'Aaron Rose: 1 personal fouls)

[09:19] Team_014 possession (Score: 8-5)
Ayo Murray drives to the basket... Ayo Murray throws a bad pass out of bounds! TURNOVER! (dead ball)

[09:06] Team_047 possession (Score: 8-5)
Derrick Irving drives, DeMar Adebayo stays with him. Derrick Irving attempts a Dunk. Contested by DeMar Adebayo (3.5 feet, ZONE). DERRICK IRVING MAKES IT!
Score: 10-5

[08:55] Team_014 possession (Score: 10-5)
Lamelo Simmons attempts a 3Pt. Contested by Blake Jokic (5.3 feet, MAN). Lamelo Simmons misses. Rebound secured by Myles LaVine.

[08:45] Team_047 possession (Score: 10-5)
Josh Harris attempts a Midrange. Contested by DeMar Adebayo (3.4 feet, MAN). Josh Harris misses. Rebound secured by Michael Cunningham.

[08:30] Team_014 possession (Score: 10-5)
Lamelo Simmons makes the Midrange and draws the foul on Derrick Irving! And-1! Lamelo Simmons to the line for 1. [BONUS: 5 team fouls] (Derrick Irving: 2 personal fouls)   FT 1/1: GOOD Lamelo Simmons makes 1/1 from the line.
Score: 10-8

[08:14] Team_047 possession (Score: 10-8)
De'Aaron Rose attempts a Midrange. Contested by Michael Cunningham (4.3 feet, MAN). De'Aaron Rose misses. Offensive rebound by Myles LaVine! Myles LaVine kicks it out.

[08:02] Team_047 possession (Score: 10-8)
Blake Jokic makes the Layup and draws the foul on Michael Cunningham! And-1! Blake Jokic to the line for 1. [Team fouls: 3] (Michael Cunningham: 1 personal fouls)   FT 1/1: GOOD Blake Jokic makes 1/1 from the line.
Score: 13-8

[07:53] Team_014 possession (Score: 13-8)
DeMar Adebayo attempts a 3Pt. Contested by De'Aaron Rose (3.9 feet, ZONE). DeMar Adebayo misses. Offensive rebound by DeMar Adebayo! DeMar Adebayo kicks it out.

[07:37] Team_014 possession (Score: 13-8)
DeMar Adebayo attempts a Midrange. Contested by Blake Jokic (4.8 feet, ZONE). DeMar Adebayo misses. Rebound secured by Josh Harris.

[07:24] Team_047 possession (Score: 13-8)
Josh Harris drives and kicks out. Myles LaVine attempts a Midrange. Contested by Ayo Murray (4.8 feet, MAN). Myles LaVine misses. Rebound secured by DeMar Adebayo.

[07:08] Team_014 possession (Score: 13-8)
DeMar Adebayo drives and kicks out. DeMar Adebayo attempts a Midrange. Contested by Josh Harris (4.1 feet, MAN). DeMar Adebayo misses. Rebound secured by Myles LaVine.

[06:56] Team_047 possession (Score: 13-8)
De'Aaron Rose drives and kicks out. Myles LaVine attempts a 3Pt. Contested by Jordan Anunoby (4.7 feet, ZONE). Myles LaVine misses. Rebound secured by DeMar Adebayo.

[06:41] Team_014 possession (Score: 13-8)
Ayo Murray drives, picks up Josh Harris. Help arrives from Derrick Irving! Ayo Murray attempts a Layup. Contested by Derrick Irving (4.5 feet, ZONE). Ayo Murray misses. Rebound secured by Josh Harris.

[06:27] Team_047 possession (Score: 13-8)
Blake Jokic drives and kicks out. Derrick Irving attempts a Midrange. Contested by Jordan Anunoby (4.7 feet, MAN). Derrick Irving misses. Rebound secured by DeMar Adebayo.

[06:10] Team_014 possession (Score: 13-8)
Jordan Anunoby drives to the basket... Jordan Anunoby loses control! Ball rolls out of bounds! TURNOVER! (dead ball)

[05:55] Team_047 possession (Score: 13-8)
FOUL! Shooting foul on DeMar Adebayo. Myles LaVine to the line for 2 free throws. [Team fouls: 4] (DeMar Adebayo: 2 personal fouls)   FT 1/2: GOOD   FT 2/2: GOOD Myles LaVine makes 2/2 from the line.
Score: 15-8

[05:39] Team_014 possession (Score: 15-8)
Lamelo Simmons attempts a 3Pt. Contested by De'Aaron Rose (4.4 feet, ZONE). Lamelo Simmons misses. Rebound secured by Myles LaVine.

[05:24] Team_047 possession (Score: 15-8)
Myles LaVine attempts a 3Pt. Contested by Jordan Anunoby (4.8 feet, ZONE). Myles LaVine misses. Rebound secured by Ayo Murray.

[05:11] Team_014 possession (Score: 15-8)
Lamelo Simmons drives to the basket... Lamelo Simmons loses the ball! Stripped by Blake Jokic! TURNOVER! (live ball)

[04:59] Team_047 possession (Score: 15-8)
Josh Harris attempts a Layup. BLOCKED BY DEMAR ADEBAYO! Ball is loose! Rebound secured by DeMar Adebayo.

[04:48] Team_014 possession (Score: 15-8)
FOUL! Holding foul on Blake Jokic. [IN THE BONUS! 6 team fouls] Lamelo Simmons to the line for 2 free throws. (Blake Jokic: 1 personal fouls)   FT 1/2: MISS   FT 2/2: GOOD Lamelo Simmons makes 1/2 from the line.
Score: 15-9

[04:30] Team_047 possession (Score: 15-9)
De'Aaron Rose attempts a Midrange. Contested by DeMar Adebayo (3.5 feet, ZONE). De'Aaron Rose misses. Offensive rebound by Myles LaVine! Myles LaVine kicks it out.

[04:12] Team_047 possession (Score: 15-9)
De'Aaron Rose drives, DeMar Adebayo stays with him. De'Aaron Rose attempts a Layup. Contested by DeMar Adebayo (3.6 feet, ZONE). DE'AARON ROSE MAKES IT! Assist: Josh Harris
Score: 17-9

[04:00] Team_014 possession (Score: 17-9)
Michael Cunningham attempts a Midrange. Contested by De'Aaron Rose (3.9 feet, MAN). Michael Cunningham misses. Rebound secured by Josh Harris.

[03:50] Team_047 possession (Score: 17-9)
De'Aaron Rose drives to the basket... De'Aaron Rose throws a bad pass out of bounds! TURNOVER! (dead ball)

[03:50] Substitution (Team_014): Lamelo Simmons OUT → Tracy Westbrook IN (stamina_rule2)

[03:34] Team_014 possession (Score: 17-9)
Ayo Murray drives, Myles LaVine stays with him. Ayo Murray attempts a Dunk. Contested by Myles LaVine (5.7 feet, MAN). AYO MURRAY MAKES IT! Assist: Tracy Westbrook
Score: 17-11

[03:20] Team_047 possession (Score: 17-11)
FOUL! Offensive foul on De'Aaron Rose! Michael Cunningham drew the charge! [Team fouls: 7] (De'Aaron Rose: 2 personal fouls) TURNOVER! (dead ball)

[03:05] Team_014 possession (Score: 17-11)
Ayo Murray drives, picks up Myles LaVine. Help arrives from Derrick Irving! Ayo Murray attempts a Dunk. Contested by Derrick Irving (5.7 feet, MAN). Ayo Murray misses. Rebound secured by Myles LaVine.

[02:49] Team_047 possession (Score: 17-11)
Blake Jokic attempts a 3Pt. Contested by Tracy Westbrook (5.1 feet, MAN). Blake Jokic misses. Rebound secured by Ayo Murray.

[02:34] Team_014 possession (Score: 17-11)
Ayo Murray attempts a Midrange. Contested by Myles LaVine (5.7 feet, MAN). AYO MURRAY MAKES IT!
Score: 17-13

[02:22] Team_047 possession (Score: 17-13)
Blake Jokic attempts a 3Pt. Contested by Tracy Westbrook (5.1 feet, MAN). Blake Jokic misses. Rebound secured by Michael Cunningham.

[02:07] Team_014 possession (Score: 17-13)
DeMar Adebayo attempts a Midrange. Contested by Josh Harris (4.4 feet, MAN). DeMar Adebayo misses. Rebound secured by Josh Harris.

[01:51] Team_047 possession (Score: 17-13)
Blake Jokic makes the Dunk and draws the foul on Michael Cunningham! And-1! Blake Jokic to the line for 1. [BONUS: 5 team fouls] (Michael Cunningham: 2 personal fouls)   FT 1/1: GOOD Blake Jokic makes 1/1 from the line.
Score: 20-13

[01:35] Team_014 possession (Score: 20-13)
Jordan Anunoby attempts a Layup. Contested by Myles LaVine (5.8 feet, ZONE). Jordan Anunoby misses. Rebound secured by Myles LaVine.

[01:15] Team_047 possession (Score: 20-13)
Myles LaVine drives and kicks out. Josh Harris attempts a Midrange. Contested by DeMar Adebayo (3.7 feet, MAN). Josh Harris misses. Rebound secured by DeMar Adebayo.

[01:04] Team_014 possession (Score: 20-13)
Ayo Murray drives and kicks out. Jordan Anunoby attempts a 3Pt. Contested by De'Aaron Rose (4.5 feet, ZONE). JORDAN ANUNOBY MAKES IT!
Score: 20-16

[00:48] Team_047 possession (Score: 20-16)
Blake Jokic makes the 3Pt and draws the foul on Jordan Anunoby! And-1! Blake Jokic to the line for 1. [BONUS: 6 team fouls] (Jordan Anunoby: 2 personal fouls)   FT 1/1: GOOD Blake Jokic makes 1/1 from the line.
Score: 24-16

[00:33] Team_014 possession (Score: 24-16)
Ayo Murray attempts a 3Pt. Contested by Myles LaVine (5.9 feet, MAN). AYO MURRAY MAKES IT!
Score: 24-19

[00:22] Team_047 possession (Score: 24-19)
De'Aaron Rose attempts a 3Pt. Contested by Jordan Anunoby (5.5 feet, ZONE). DE'AARON ROSE MAKES IT! Assist: Blake Jokic
Score: 27-19

[00:05] Team_014 possession (Score: 27-19)
Jordan Anunoby attempts a 3Pt. Contested by De'Aaron Rose (4.8 feet, ZONE). Jordan Anunoby misses. Rebound secured by Josh Harris.

================================================================================
                              1ST QUARTER COMPLETE                              
================================================================================

1ST QUARTER SCORE: Team_047 27, Team_014 19

BOX SCORE:
================================================================================

Team_047
--------------------------------------------------------------------------------
Player                MIN  PTS  REB  AST  TO      FG   FG%      3P   3P%
--------------------------------------------------------------------------------
Blake Jokic            12   15    0    1   0   5/8    62.5     0/0   0.0
De'Aaron Rose          12    5    0    0   0   2/3    66.7     0/0   0.0
Josh Harris            12    3    5    1   0   1/4    25.0     0/0   0.0
Myles LaVine           12    2    8    1   0   1/4    25.0     0/0   0.0
Derrick Irving         12    2    0    0   0   1/2    50.0     0/0   0.0

TEAM: FG: 10/21 (47.6%), 3PT: 2/6 (33.3%), REB: 13 (3 off, 10 def), AST: 3, TO: 2
TEAM FOULS: 7 [Team_014 in BONUS]


Team_014
--------------------------------------------------------------------------------
Player                MIN  PTS  REB  AST  TO      FG   FG%      3P   3P%
--------------------------------------------------------------------------------
Ayo Murray             12    9    4    1   0   4/6    66.7     0/0   0.0
Lamelo Simmons          8    6    0    0   0   3/5    60.0     0/0   0.0
Jordan Anunoby         12    3    0    0   0   1/3    33.3     0/0   0.0
DeMar Adebayo          12    1    6    0   0   1/4    25.0     0/0   0.0
Michael Cunningham     12    0    2    0   0   0/1     0.0     0/0   0.0
Tracy Westbrook         4    0    0    1   0   0/0     0.0     0/0   0.0

TEAM: FG: 9/19 (47.4%), 3PT: 1/4 (25.0%), REB: 12 (1 off, 11 def), AST: 2, TO: 4
TEAM FOULS: 6 [Team_047 in BONUS]

================================================================================

================================================================================
                       2ND QUARTER - Team_047 vs Team_014                       
================================================================================

[12:00] Team_047 possession (Score: 27-19)
De'Aaron Rose attempts a Midrange. Contested by Michael Cunningham (4.6 feet, MAN). De'Aaron Rose misses. Offensive rebound by Josh Harris! Josh Harris kicks it out.

[11:45] Team_047 possession (Score: 27-19)
Myles LaVine drives, Ayo Murray stays with him. Myles LaVine attempts a Dunk. Contested by Ayo Murray (5.2 feet, MAN). MYLES LAVINE MAKES IT! Assist: Derrick Irving
Score: 29-19

[11:35] Team_014 possession (Score: 29-19)
Jordan Anunoby drives, Josh Harris stays with him. Jordan Anunoby attempts a Layup. Contested by Josh Harris (4.8 feet, ZONE). JORDAN ANUNOBY MAKES IT! Assist: Michael Cunningham
Score: 29-21

[11:20] Team_047 possession (Score: 29-21)
FOUL! Holding foul on DeMar Adebayo. [Team fouls: 1] No free throws, side out. (DeMar Adebayo: 1 personal fouls)

[11:06] Team_047 possession (Score: 29-21)
Derrick Irving drives, picks up DeMar Adebayo. Help arrives from Michael Cunningham! Derrick Irving attempts a Dunk. Contested by Michael Cunningham (4.0 feet, ZONE). Derrick Irving misses. Offensive rebound by Myles LaVine! Myles LaVine kicks it out.

[10:47] Team_047 possession (Score: 29-21)
Derrick Irving attempts a Midrange. Contested by DeMar Adebayo (4.0 feet, ZONE). Derrick Irving misses. Offensive rebound by Josh Harris! Josh Harris kicks it out.

[10:33] Team_047 possession (Score: 29-21)
Myles LaVine attempts a Layup. BLOCKED BY DEMAR ADEBAYO! Ball goes out off DeMar Adebayo. Myles LaVine's ball!

[10:18] Team_047 possession (Score: 29-21)
Myles LaVine drives, picks up DeMar Adebayo. Help arrives from Michael Cunningham! Myles LaVine attempts a Dunk. Contested by Michael Cunningham (3.9 feet, ZONE). Myles LaVine misses. Rebound secured by Ayo Murray.

[10:00] Team_014 possession (Score: 29-21)
Jordan Anunoby attempts a 3Pt. Contested by De'Aaron Rose (4.8 feet, ZONE). Jordan Anunoby misses. Rebound secured by Josh Harris.

[09:44] Team_047 possession (Score: 29-21)
De'Aaron Rose attempts a Layup. Contested by DeMar Adebayo (4.1 feet, ZONE). DE'AARON ROSE MAKES IT! Assist: Blake Jokic
Score: 31-21

[09:29] Team_014 possession (Score: 31-21)
DeMar Adebayo attempts a Midrange. Contested by Josh Harris (4.7 feet, ZONE). DeMar Adebayo misses. Rebound secured by Derrick Irving.

[09:16] Team_047 possession (Score: 31-21)
FOUL! Reach-in foul on Ayo Murray during the drive. [Team fouls: 2] No free throws, side out. (Ayo Murray: 1 personal fouls)

[09:01] Team_047 possession (Score: 31-21)
Derrick Irving attempts a Layup. Contested by Jordan Anunoby (5.6 feet, MAN). DERRICK IRVING MAKES IT! Assist: De'Aaron Rose
Score: 33-21

[08:45] Team_014 possession (Score: 33-21)
Ayo Murray drives, Myles LaVine stays with him. Ayo Murray attempts a Dunk. Wide open! Myles LaVine is 6.1 feet away. [ZONE] Ayo Murray misses. Rebound secured by Myles LaVine.

[08:31] Team_047 possession (Score: 33-21)
Myles LaVine drives, picks up Ayo Murray. Help arrives from Michael Cunningham! Myles LaVine attempts a Dunk. Contested by Michael Cunningham (5.5 feet, MAN). Myles LaVine misses. Rebound secured by Ayo Murray.

[08:18] Team_014 possession (Score: 33-21)
Michael Cunningham drives, picks up De'Aaron Rose. Help arrives from Blake Jokic! Michael Cunningham attempts a Layup. Contested by Blake Jokic (4.5 feet, MAN). Michael Cunningham misses. Rebound secured by Josh Harris.

[08:05] Team_047 possession (Score: 33-21)
Myles LaVine attempts a Midrange. Contested by DeMar Adebayo (4.2 feet, ZONE). Myles LaVine misses. Offensive rebound by Myles LaVine! Myles LaVine kicks it out.

[07:47] Team_047 possession (Score: 33-21)
Myles LaVine drives, Ayo Murray stays with him. Myles LaVine attempts a Dunk. Contested by Ayo Murray (5.6 feet, ZONE). Myles LaVine misses. FOUL! Loose ball foul on Ayo Murray during the rebound battle. [Team fouls: 3] No free throws, side out. (Ayo Murray: 2 personal fouls)

[07:33] Team_047 possession (Score: 33-21)
Myles LaVine throws a bad pass out of bounds! TURNOVER! (dead ball)

[07:33] Substitution (Team_047): De'Aaron Rose OUT → Austin Giddey IN (stamina_rule2)

[07:33] Substitution (Team_047): Derrick Irving OUT → Donovan Iverson IN (stamina_rule2)

[07:33] Substitution (Team_047): Blake Jokic OUT → Blake Jackson IN (stamina_rule2)

[07:33] Substitution (Team_047): Josh Harris OUT → Tony Poole IN (stamina_rule2)

[07:33] Substitution (Team_047): Myles LaVine OUT → Zion Thompson IN (stamina_rule2)

[07:33] Substitution (Team_014): Michael Cunningham OUT → Jalen Booker IN (stamina_rule2)

[07:33] Substitution (Team_014): Jordan Anunoby OUT → Bones Quickley IN (stamina_rule2)

[07:33] Substitution (Team_014): Lamelo Simmons OUT → Tracy Westbrook IN (stamina_rule2)

[07:33] Substitution (Team_014): DeMar Adebayo OUT → Nikola James IN (stamina_rule2)

[07:33] Substitution (Team_014): Ayo Murray OUT → Collin Gasol IN (stamina_rule2)

[07:22] Team_014 possession (Score: 33-21)
Nikola James attempts a Midrange. Contested by Tony Poole (5.1 feet, MAN). NIKOLA JAMES MAKES IT! Assist: Jalen Booker
Score: 33-23

[07:04] Team_047 possession (Score: 33-23)
Austin Giddey attempts a Midrange. Contested by Jalen Booker (4.8 feet, MAN). Austin Giddey misses. Rebound secured by Tracy Westbrook.

[06:52] Team_014 possession (Score: 33-23)
Jalen Booker attempts a 3Pt. Contested by Austin Giddey (4.9 feet, ZONE). Jalen Booker misses. Rebound secured by Zion Thompson.

[06:37] Team_047 possession (Score: 33-23)
FOUL! Shooting foul on Collin Gasol. Austin Giddey to the line for 2 free throws. [Team fouls: 4] (Collin Gasol: 1 personal fouls)   FT 1/2: GOOD   FT 2/2: GOOD Austin Giddey makes 2/2 from the line.
Score: 35-23

[06:26] Team_014 possession (Score: 35-23)
Collin Gasol drives, picks up Zion Thompson. Help arrives from Donovan Iverson! Collin Gasol attempts a Layup. Contested by Donovan Iverson (5.8 feet, MAN). COLLIN GASOL MAKES IT! Assist: Bones Quickley
Score: 35-25

[06:14] Team_047 possession (Score: 35-25)
Zion Thompson attempts a Midrange. Contested by Collin Gasol (5.0 feet, MAN). ZION THOMPSON MAKES IT! Assist: Donovan Iverson
Score: 37-25

[06:04] Team_014 possession (Score: 37-25)
Jalen Booker attempts a 3Pt. Contested by Donovan Iverson (4.3 feet, ZONE). Jalen Booker misses. Rebound secured by Donovan Iverson.

[05:54] Team_047 possession (Score: 37-25)
Zion Thompson drives, Collin Gasol stays with him. Zion Thompson attempts a Layup. Contested by Collin Gasol (5.0 feet, ZONE). ZION THOMPSON MAKES IT! Assist: Blake Jackson
Score: 39-25

[05:37] Team_014 possession (Score: 39-25)
Tracy Westbrook drives and kicks out. Tracy Westbrook attempts a 3Pt. Contested by Donovan Iverson (4.2 feet, ZONE). Tracy Westbrook misses. Rebound secured by Blake Jackson.

[05:21] Team_047 possession (Score: 39-25)
Austin Giddey attempts a 3Pt. Contested by Jalen Booker (4.8 feet, ZONE). AUSTIN GIDDEY MAKES IT! Assist: Tony Poole
Score: 42-25

[05:03] Team_014 possession (Score: 42-25)
FOUL! Holding foul on Zion Thompson. [Team fouls: 1] No free throws, side out. (Zion Thompson: 1 personal fouls)

[04:48] Team_014 possession (Score: 42-25)
Tracy Westbrook commits a violation (traveling/carry)! TURNOVER! (dead ball)

[04:34] Team_047 possession (Score: 42-25)
Zion Thompson attempts a Layup. BLOCKED BY COLLIN GASOL! Ball goes out off Collin Gasol. Zion Thompson's ball!

[04:18] Team_047 possession (Score: 42-25)
Blake Jackson attempts a 3Pt. Contested by Tracy Westbrook (5.0 feet, MAN). Blake Jackson misses. Rebound secured by Collin Gasol.

[04:09] Team_014 possession (Score: 42-25)
Collin Gasol drives to the basket... Collin Gasol commits a violation (traveling/carry)! TURNOVER! (dead ball)

[03:56] Team_047 possession (Score: 42-25)
FOUL! Holding foul on Nikola James. [IN THE BONUS! 5 team fouls] Tony Poole to the line for 2 free throws. (Nikola James: 1 personal fouls)   FT 1/2: GOOD   FT 2/2: GOOD Tony Poole makes 2/2 from the line.
Score: 44-25

[03:40] Team_014 possession (Score: 44-25)
Nikola James drives, Zion Thompson stays with him. Nikola James attempts a Layup. Contested by Zion Thompson (5.4 feet, ZONE). Nikola James misses. Offensive rebound by Collin Gasol! Collin Gasol puts it back in!
Score: 44-27

[03:26] Team_047 possession (Score: 44-27)
Donovan Iverson attempts a 3Pt. Contested by Bones Quickley (5.8 feet, MAN). DONOVAN IVERSON MAKES IT! Assist: Austin Giddey
Score: 47-27

[03:14] Team_014 possession (Score: 47-27)
Tracy Westbrook attempts a Midrange. Contested by Blake Jackson (4.0 feet, ZONE). Tracy Westbrook misses. Rebound secured by Donovan Iverson.

[03:01] Team_047 possession (Score: 47-27)
Tony Poole attempts a Midrange. Contested by Nikola James (5.8 feet, MAN). Tony Poole misses. Offensive rebound by Zion Thompson! Zion Thompson kicks it out.

[02:50] Team_047 possession (Score: 47-27)
Tony Poole attempts a Midrange. Wide open! Bones Quickley is 6.2 feet away. [ZONE] TONY POOLE MAKES IT! Assist: Donovan Iverson
Score: 49-27

[02:37] Team_014 possession (Score: 49-27)
Collin Gasol drives, Zion Thompson stays with him. Collin Gasol attempts a Layup. Contested by Zion Thompson (5.8 feet, ZONE). COLLIN GASOL MAKES IT! Assist: Nikola James
Score: 49-29

[02:25] Team_047 possession (Score: 49-29)
Donovan Iverson attempts a Midrange. Contested by Bones Quickley (5.8 feet, MAN). DONOVAN IVERSON MAKES IT! Assist: Zion Thompson
Score: 51-29

[02:12] Team_014 possession (Score: 51-29)
FOUL! Reach-in foul on Zion Thompson during the drive. [Team fouls: 2] No free throws, side out. (Zion Thompson: 2 personal fouls)

[01:52] Team_014 possession (Score: 51-29)
Bones Quickley throws a bad pass! Stolen by Donovan Iverson! TURNOVER! (live ball)

[01:41] Team_047 possession (Score: 51-29)
Tony Poole attempts a Midrange. Contested by Jalen Booker (4.9 feet, ZONE). Tony Poole misses. Rebound secured by Nikola James.

[01:26] Team_014 possession (Score: 51-29)
Jalen Booker attempts a Layup. BLOCKED BY DONOVAN IVERSON! Ball goes out off Donovan Iverson. Jalen Booker's ball!

[01:12] Team_014 possession (Score: 51-29)
FOUL! Shooting foul on Blake Jackson. Tracy Westbrook to the line for 3 free throws. [Team fouls: 3] (Blake Jackson: 1 personal fouls)   FT 1/3: GOOD   FT 2/3: GOOD   FT 3/3: GOOD Tracy Westbrook makes 3/3 from the line.
Score: 51-32

[00:56] Team_047 possession (Score: 51-32)
Tony Poole attempts a Layup. BLOCKED BY NIKOLA JAMES! Ball is loose! Offensive rebound by Donovan Iverson! Donovan Iverson kicks it out.

[00:40] Team_047 possession (Score: 51-32)
Blake Jackson attempts a Midrange. Contested by Tracy Westbrook (5.2 feet, MAN). Blake Jackson misses. Offensive rebound by Donovan Iverson! Donovan Iverson kicks it out.

[00:23] Team_047 possession (Score: 51-32)
FOUL! Reach-in foul on Jalen Booker during the drive. [IN THE BONUS! 6 team fouls] Austin Giddey to the line for 2 free throws. (Jalen Booker: 1 personal fouls)   FT 1/2: MISS   FT 2/2: GOOD Austin Giddey makes 1/2 from the line.
Score: 52-32

[00:06] Team_014 possession (Score: 52-32)
Jalen Booker drives and kicks out. Nikola James attempts a 3Pt. Contested by Donovan Iverson (4.3 feet, ZONE). Nikola James misses. Offensive rebound by Nikola James! Nikola James kicks it out.

================================================================================
                              2ND QUARTER COMPLETE                              
================================================================================

2ND QUARTER SCORE: Team_047 25, Team_014 13

BOX SCORE:
================================================================================

Team_047
--------------------------------------------------------------------------------
Player                MIN  PTS  REB  AST  TO      FG   FG%      3P   3P%
--------------------------------------------------------------------------------
Austin Giddey           7    6    0    1   0   3/4    75.0     0/0   0.0
Donovan Iverson         7    5    4    2   0   2/2   100.0     0/0   0.0
Zion Thompson           7    4    2    1   0   2/2   100.0     0/0   0.0
Tony Poole              7    4    0    1   0   2/3    66.7     0/0   0.0
Myles LaVine           17    2    3    0   0   1/3    33.3     0/0   0.0
Derrick Irving         17    2    1    1   0   1/1   100.0     0/0   0.0
De'Aaron Rose          17    2    0    1   0   1/1   100.0     0/0   0.0
Josh Harris            17    0    5    0   0   0/0     0.0     0/0   0.0
Blake Jokic            17    0    0    1   0   0/0     0.0     0/0   0.0
Blake Jackson           7    0    1    1   0   0/1     0.0     0/0   0.0

TEAM: FG: 12/17 (70.6%), 3PT: 2/3 (66.7%), REB: 16 (8 off, 8 def), AST: 9, TO: 1
TEAM FOULS: 3


Team_014
--------------------------------------------------------------------------------
Player                MIN  PTS  REB  AST  TO      FG   FG%      3P   3P%
--------------------------------------------------------------------------------
Collin Gasol            7    6    2    0   0   3/3   100.0     0/0   0.0
Tracy Westbrook        11    3    1    0   0   1/3    33.3     0/0   0.0
Jordan Anunoby         17    2    0    0   0   1/2    50.0     0/0   0.0
Nikola James            7    2    2    1   0   1/1   100.0     0/0   0.0
Michael Cunningham     17    0    0    1   0   0/1     0.0     0/0   0.0
Ayo Murray             17    0    2    0   0   0/1     0.0     0/0   0.0
DeMar Adebayo          17    0    0    0   0   0/1     0.0     0/0   0.0
Jalen Booker            7    0    0    1   0   0/2     0.0     0/0   0.0
Bones Quickley          7    0    0    1   0   0/0     0.0     0/0   0.0

TEAM: FG: 6/14 (42.9%), 3PT: 1/4 (25.0%), REB: 7 (2 off, 5 def), AST: 4, TO: 3
TEAM FOULS: 6 [Team_047 in BONUS]

================================================================================

================================================================================
                       3RD QUARTER - Team_047 vs Team_014                       
================================================================================

[12:00] Team_047 possession (Score: 52-32)
Derrick Irving attempts a 3Pt. Contested by Jordan Anunoby (5.0 feet, ZONE). DERRICK IRVING MAKES IT!
Score: 55-32

[11:42] Team_014 possession (Score: 55-32)
Lamelo Simmons makes the Layup and draws the foul on Blake Jokic! And-1! Lamelo Simmons to the line for 1. [Team fouls: 1] (Blake Jokic: 1 personal fouls)   FT 1/1: GOOD Lamelo Simmons makes 1/1 from the line.
Score: 55-35

[11:25] Team_047 possession (Score: 55-35)
FOUL! Reach-in foul on DeMar Adebayo during the drive. [Team fouls: 1] No free throws, side out. (DeMar Adebayo: 1 personal fouls)

[11:13] Team_047 possession (Score: 55-35)
FOUL! Shooting foul on Jordan Anunoby. De'Aaron Rose to the line for 2 free throws. [Team fouls: 2] (Jordan Anunoby: 1 personal fouls)   FT 1/2: GOOD   FT 2/2: GOOD De'Aaron Rose makes 2/2 from the line.
Score: 57-35

[11:01] Team_014 possession (Score: 57-35)
FOUL! Shooting foul on Josh Harris. Lamelo Simmons to the line for 2 free throws. [Team fouls: 2] (Josh Harris: 1 personal fouls)   FT 1/2: GOOD   FT 2/2: GOOD Lamelo Simmons makes 2/2 from the line.
Score: 57-37

[10:42] Team_047 possession (Score: 57-37)
Myles LaVine drives to the basket... Myles LaVine loses the ball! Stripped by Ayo Murray! TURNOVER! (live ball)

[10:26] Team_014 possession (Score: 57-37)
Michael Cunningham attempts a 3Pt. Contested by De'Aaron Rose (3.8 feet, MAN). Michael Cunningham misses. Offensive rebound by Ayo Murray! Ayo Murray kicks it out.

[10:09] Team_014 possession (Score: 57-37)
Ayo Murray drives, Josh Harris stays with him. Ayo Murray attempts a Layup. Contested by Josh Harris (4.5 feet, ZONE). Ayo Murray misses. Rebound secured by Myles LaVine.

[09:56] Team_047 possession (Score: 57-37)
Derrick Irving attempts a 3Pt. Contested by Jordan Anunoby (5.0 feet, ZONE). Derrick Irving misses. Offensive rebound by Myles LaVine! Myles LaVine kicks it out.

[09:46] Team_047 possession (Score: 57-37)
Blake Jokic attempts a Midrange. Contested by Lamelo Simmons (3.8 feet, ZONE). BLAKE JOKIC MAKES IT!
Score: 59-37

[09:34] Team_014 possession (Score: 59-37)
FOUL! Reach-in foul on Josh Harris during the drive. [Team fouls: 3] No free throws, side out. (Josh Harris: 2 personal fouls)

[09:16] Team_014 possession (Score: 59-37)
Michael Cunningham attempts a 3Pt. Contested by Derrick Irving (4.6 feet, ZONE). Michael Cunningham misses. Rebound secured by Derrick Irving.

[09:06] Team_047 possession (Score: 59-37)
Josh Harris attempts a 3Pt. Contested by DeMar Adebayo (3.4 feet, MAN). JOSH HARRIS MAKES IT! Assist: Blake Jokic
Score: 62-37

[08:51] Team_014 possession (Score: 62-37)
Ayo Murray attempts a Midrange. Contested by Josh Harris (4.5 feet, ZONE). Ayo Murray misses. Offensive rebound by DeMar Adebayo! DeMar Adebayo kicks it out.

[08:36] Team_014 possession (Score: 62-37)
Michael Cunningham attempts a Midrange. Contested by De'Aaron Rose (3.8 feet, MAN). Michael Cunningham misses. Offensive rebound by Ayo Murray! Ayo Murray kicks it out.

[08:21] Team_014 possession (Score: 62-37)
Jordan Anunoby attempts a 3Pt. Contested by De'Aaron Rose (4.3 feet, ZONE). JORDAN ANUNOBY MAKES IT! Assist: DeMar Adebayo
Score: 62-40

[08:09] Team_047 possession (Score: 62-40)
Myles LaVine attempts a Midrange. Contested by Ayo Murray (4.9 feet, MAN). MYLES LAVINE MAKES IT! Assist: Blake Jokic
Score: 64-40

[07:50] Team_014 possession (Score: 64-40)
Ayo Murray attempts a Layup. Contested by Josh Harris (4.5 feet, ZONE). AYO MURRAY MAKES IT!
Score: 64-42

[07:34] Team_047 possession (Score: 64-42)
Josh Harris attempts a Midrange. Contested by DeMar Adebayo (3.4 feet, MAN). Josh Harris misses. Rebound secured by Ayo Murray.

[07:19] Team_014 possession (Score: 64-42)
Michael Cunningham attempts a Midrange. Contested by De'Aaron Rose (3.8 feet, MAN). MICHAEL CUNNINGHAM MAKES IT! Assist: DeMar Adebayo
Score: 64-44

[07:01] Team_047 possession (Score: 64-44)
Josh Harris loses control! Ball rolls out of bounds! TURNOVER! (dead ball)

[06:49] Team_014 possession (Score: 64-44)
Michael Cunningham attempts a Layup. BLOCKED BY DERRICK IRVING! Ball is loose! Offensive rebound by DeMar Adebayo! DeMar Adebayo kicks it out.

[06:35] Team_014 possession (Score: 64-44)
Ayo Murray drives, picks up Josh Harris. Help arrives from Derrick Irving! Ayo Murray attempts a Dunk. Contested by Derrick Irving (4.5 feet, ZONE). AYO MURRAY MAKES IT! Assist: Jordan Anunoby
Score: 64-46

[06:25] Team_047 possession (Score: 64-46)
Blake Jokic attempts a Layup. Contested by Lamelo Simmons (3.8 feet, MAN). Blake Jokic misses. Offensive rebound by Myles LaVine! Myles LaVine kicks it out.

[06:08] Team_047 possession (Score: 64-46)
Josh Harris attempts a Midrange. Contested by Jordan Anunoby (5.0 feet, ZONE). JOSH HARRIS MAKES IT!
Score: 66-46

[05:54] Team_014 possession (Score: 66-46)
Ayo Murray drives and kicks out. Jordan Anunoby attempts a 3Pt. Contested by De'Aaron Rose (4.0 feet, ZONE). Jordan Anunoby misses. Rebound secured by Josh Harris.

[05:40] Team_047 possession (Score: 66-46)
De'Aaron Rose drives, picks up DeMar Adebayo. Help arrives from Michael Cunningham! De'Aaron Rose attempts a Layup. Contested by Michael Cunningham (3.4 feet, ZONE). De'Aaron Rose misses. Rebound secured by Michael Cunningham.

[05:27] Team_014 possession (Score: 66-46)
Jordan Anunoby attempts a 3Pt. Contested by De'Aaron Rose (4.3 feet, ZONE). JORDAN ANUNOBY MAKES IT! Assist: Ayo Murray
Score: 66-49

[05:09] Team_047 possession (Score: 66-49)
Blake Jokic attempts a 3Pt. Contested by Lamelo Simmons (3.9 feet, MAN). Blake Jokic misses. Rebound secured by Michael Cunningham.

[04:57] Team_014 possession (Score: 66-49)
Michael Cunningham attempts a Midrange. Contested by Derrick Irving (4.6 feet, ZONE). Michael Cunningham misses. Rebound secured by Derrick Irving.

[04:44] Team_047 possession (Score: 66-49)
FOUL! Holding foul on Jordan Anunoby. [Team fouls: 3] No free throws, side out. (Jordan Anunoby: 2 personal fouls)

[04:31] Team_047 possession (Score: 66-49)
Josh Harris drives, DeMar Adebayo stays with him. Josh Harris attempts a Dunk. Contested by DeMar Adebayo (3.5 feet, MAN). JOSH HARRIS MAKES IT! Assist: Myles LaVine
Score: 68-49

[04:18] Team_014 possession (Score: 68-49)
Michael Cunningham attempts a 3Pt. Contested by De'Aaron Rose (3.9 feet, MAN). Michael Cunningham misses. Rebound secured by Derrick Irving.

[04:02] Team_047 possession (Score: 68-49)
FOUL! Holding foul on DeMar Adebayo. [Team fouls: 4] No free throws, side out. (DeMar Adebayo: 2 personal fouls)

[03:51] Team_047 possession (Score: 68-49)
Josh Harris attempts a Layup. Contested by DeMar Adebayo (3.6 feet, ZONE). Josh Harris misses. Rebound secured by DeMar Adebayo.

[03:36] Team_014 possession (Score: 68-49)
DeMar Adebayo attempts a Midrange. Contested by Myles LaVine (5.2 feet, ZONE). DEMAR ADEBAYO MAKES IT!
Score: 68-51

[03:22] Team_047 possession (Score: 68-51)
Blake Jokic drives and kicks out. Derrick Irving attempts a 3Pt. Contested by Jordan Anunoby (4.9 feet, MAN). Derrick Irving misses. Offensive rebound by Josh Harris! Josh Harris kicks it out.

[03:05] Team_047 possession (Score: 68-51)
Derrick Irving attempts a 3Pt. Contested by Jordan Anunoby (5.2 feet, MAN). Derrick Irving misses. Rebound secured by Michael Cunningham.

[02:48] Team_014 possession (Score: 68-51)
DeMar Adebayo attempts a 3Pt. Contested by Josh Harris (4.3 feet, MAN). DeMar Adebayo misses. Rebound secured by Derrick Irving.

[02:37] Team_047 possession (Score: 68-51)
Josh Harris drives, picks up DeMar Adebayo. Help arrives from Michael Cunningham! Josh Harris attempts a Dunk. Contested by Michael Cunningham (3.7 feet, ZONE). Josh Harris misses. Rebound secured by DeMar Adebayo.

[02:24] Team_014 possession (Score: 68-51)
DeMar Adebayo attempts a Midrange. Contested by Josh Harris (4.4 feet, ZONE). DEMAR ADEBAYO MAKES IT!
Score: 68-53

[02:12] Team_047 possession (Score: 68-53)
De'Aaron Rose drives and kicks out. Myles LaVine attempts a 3Pt. Contested by Jordan Anunoby (5.0 feet, ZONE). Myles LaVine misses. Rebound secured by Ayo Murray.

[01:54] Team_014 possession (Score: 68-53)
Jordan Anunoby drives, picks up Josh Harris. Help arrives from Derrick Irving! Jordan Anunoby attempts a Dunk. Contested by Derrick Irving (4.7 feet, ZONE). JORDAN ANUNOBY MAKES IT!
Score: 68-55

[01:40] Team_047 possession (Score: 68-55)
Josh Harris attempts a 3Pt. Contested by DeMar Adebayo (3.8 feet, MAN). JOSH HARRIS MAKES IT! Assist: De'Aaron Rose
Score: 71-55

[01:25] Team_014 possession (Score: 71-55)
DeMar Adebayo drives, picks up Josh Harris. Help arrives from Derrick Irving! DeMar Adebayo attempts a Dunk. Contested by Derrick Irving (4.5 feet, ZONE). DEMAR ADEBAYO MAKES IT! Assist: Lamelo Simmons
Score: 71-57

[01:11] Team_047 possession (Score: 71-57)
Derrick Irving attempts a 3Pt. Contested by Jordan Anunoby (5.4 feet, MAN). DERRICK IRVING MAKES IT! Assist: De'Aaron Rose
Score: 74-57

[00:56] Team_014 possession (Score: 74-57)
DeMar Adebayo drives to the basket... DeMar Adebayo loses control! Ball rolls out of bounds! TURNOVER! (dead ball)

[00:56] Substitution (Team_047): De'Aaron Rose OUT → Austin Giddey IN (stamina_rule2)

[00:56] Substitution (Team_047): Derrick Irving OUT → Donovan Iverson IN (stamina_rule2)

[00:56] Substitution (Team_047): Blake Jokic OUT → Blake Jackson IN (stamina_rule2)

[00:56] Substitution (Team_047): Josh Harris OUT → Tony Poole IN (stamina_rule2)

[00:56] Substitution (Team_047): Myles LaVine OUT → Zion Thompson IN (stamina_rule2)

[00:56] Substitution (Team_014): Michael Cunningham OUT → Jalen Booker IN (stamina_rule2)

[00:56] Substitution (Team_014): Jordan Anunoby OUT → Bones Quickley IN (stamina_rule2)

[00:56] Substitution (Team_014): Lamelo Simmons OUT → Tracy Westbrook IN (stamina_rule2)

[00:56] Substitution (Team_014): DeMar Adebayo OUT → Nikola James IN (stamina_rule2)

[00:56] Substitution (Team_014): Ayo Murray OUT → Collin Gasol IN (stamina_rule2)

[00:40] Team_047 possession (Score: 74-57)
Zion Thompson attempts a Layup. Contested by Collin Gasol (5.0 feet, ZONE). Zion Thompson misses. Offensive rebound by Blake Jackson! Blake Jackson kicks it out.

[00:31] Team_047 possession (Score: 74-57)
Zion Thompson attempts a Midrange. Contested by Collin Gasol (5.0 feet, MAN). Zion Thompson misses. Offensive rebound by Zion Thompson! Zion Thompson kicks it out.

[00:19] Team_047 possession (Score: 74-57)
Austin Giddey attempts a 3Pt. Contested by Jalen Booker (4.8 feet, ZONE). Austin Giddey misses. FOUL! Loose ball foul on Collin Gasol during the rebound battle. [IN THE BONUS! 5 team fouls] Blake Jackson to the line for 2 free throws. (Collin Gasol: 1 personal fouls)   FT 1/2: GOOD   FT 2/2: GOOD Blake Jackson makes 2/2 from the line.
Score: 76-57

[00:04] Team_014 possession (Score: 76-57)
Nikola James attempts a 3Pt. Contested by Donovan Iverson (4.3 feet, ZONE). NIKOLA JAMES MAKES IT! Assist: Tracy Westbrook
Score: 76-60

================================================================================
                              3RD QUARTER COMPLETE                              
================================================================================

3RD QUARTER SCORE: Team_047 24, Team_014 28

BOX SCORE:
================================================================================

Team_047
--------------------------------------------------------------------------------
Player                MIN  PTS  REB  AST  TO      FG   FG%      3P   3P%
--------------------------------------------------------------------------------
Josh Harris            28   10    2    0   0   4/7    57.1     0/0   0.0
Derrick Irving         28    6    4    0   0   2/3    66.7     0/0   0.0
De'Aaron Rose          28    2    0    2   0   1/3    33.3     0/0   0.0
Myles LaVine           28    2    3    1   0   1/1   100.0     0/0   0.0
Blake Jokic            28    2    0    2   0   1/2    50.0     0/0   0.0
Blake Jackson           8    2    1    0   0   1/1   100.0     0/0   0.0
Zion Thompson           8    0    1    0   0   0/0     0.0     0/0   0.0

TEAM: FG: 10/17 (58.8%), 3PT: 5/7 (71.4%), REB: 11 (5 off, 6 def), AST: 5, TO: 2
TEAM FOULS: 4


Team_014
--------------------------------------------------------------------------------
Player                MIN  PTS  REB  AST  TO      FG   FG%      3P   3P%
--------------------------------------------------------------------------------
Jordan Anunoby         28    8    0    1   0   3/3   100.0     0/0   0.0
DeMar Adebayo          28    6    4    2   0   3/4    75.0     0/0   0.0
Lamelo Simmons         24    5    0    1   0   2/2   100.0     0/0   0.0
Ayo Murray             28    4    4    1   0   2/4    50.0     0/0   0.0
Nikola James            8    3    0    0   0   1/1   100.0     0/0   0.0
Michael Cunningham     28    2    3    0   0   1/4    25.0     0/0   0.0
Tracy Westbrook        12    0    0    1   0   0/0     0.0     0/0   0.0

TEAM: FG: 12/18 (66.7%), 3PT: 3/6 (50.0%), REB: 11 (4 off, 7 def), AST: 6, TO: 1
TEAM FOULS: 5 [Team_047 in BONUS]

================================================================================

================================================================================
                       4TH QUARTER - Team_047 vs Team_014                       
================================================================================

[12:00] Team_047 possession (Score: 76-60)
De'Aaron Rose drives, Michael Cunningham stays with him. De'Aaron Rose attempts a Layup. Contested by Michael Cunningham (4.4 feet, MAN). DE'AARON ROSE MAKES IT!
Score: 78-60

[11:46] Team_014 possession (Score: 78-60)
Lamelo Simmons attempts a 3Pt. Contested by Blake Jokic (5.3 feet, MAN). Lamelo Simmons misses. Offensive rebound by DeMar Adebayo! DeMar Adebayo kicks it out.

[11:35] Team_014 possession (Score: 78-60)
Michael Cunningham attempts a 3Pt. Contested by De'Aaron Rose (4.0 feet, ZONE). Michael Cunningham misses. Rebound secured by Derrick Irving.

[11:15] Team_047 possession (Score: 78-60)
Blake Jokic attempts a 3Pt. Contested by Lamelo Simmons (4.2 feet, MAN). Blake Jokic misses. Rebound secured by Ayo Murray.

[10:59] Team_014 possession (Score: 78-60)
Lamelo Simmons attempts a 3Pt. Contested by De'Aaron Rose (4.6 feet, ZONE). LAMELO SIMMONS MAKES IT! Assist: Michael Cunningham
Score: 78-63

[10:46] Team_047 possession (Score: 78-63)
FOUL! Reach-in foul on Jordan Anunoby during the drive. [Team fouls: 1] No free throws, side out. (Jordan Anunoby: 1 personal fouls)

[10:30] Team_047 possession (Score: 78-63)
Josh Harris attempts a 3Pt. Contested by DeMar Adebayo (3.8 feet, MAN). JOSH HARRIS MAKES IT! Assist: Myles LaVine
Score: 81-63

[10:15] Team_014 possession (Score: 81-63)
Jordan Anunoby attempts a Midrange. Contested by Josh Harris (4.8 feet, ZONE). Jordan Anunoby misses. Rebound secured by Derrick Irving.

[10:01] Team_047 possession (Score: 81-63)
Josh Harris attempts a 3Pt. Contested by Jordan Anunoby (5.3 feet, ZONE). Josh Harris misses. Rebound secured by DeMar Adebayo.

[09:49] Team_014 possession (Score: 81-63)
FOUL! Shooting foul on Josh Harris. Michael Cunningham to the line for 2 free throws. [Team fouls: 1] (Josh Harris: 1 personal fouls)   FT 1/2: GOOD   FT 2/2: GOOD Michael Cunningham makes 2/2 from the line.
Score: 81-65

[09:38] Team_047 possession (Score: 81-65)
De'Aaron Rose attempts a 3Pt. Contested by DeMar Adebayo (3.9 feet, ZONE). De'Aaron Rose misses. Offensive rebound by Myles LaVine! Myles LaVine kicks it out.

[09:25] Team_047 possession (Score: 81-65)
Josh Harris drives, DeMar Adebayo stays with him. Josh Harris attempts a Layup. Contested by DeMar Adebayo (3.9 feet, MAN). Josh Harris misses. Offensive rebound by Josh Harris! Josh Harris kicks it out.

[09:09] Team_047 possession (Score: 81-65)
Myles LaVine attempts a 3Pt. Contested by Jordan Anunoby (5.3 feet, ZONE). Myles LaVine misses. Rebound secured by Michael Cunningham.

[08:53] Team_014 possession (Score: 81-65)
Lamelo Simmons drives to the basket... FOUL! Offensive foul on Lamelo Simmons! Josh Harris drew the charge! [Team fouls: 2] (Lamelo Simmons: 1 personal fouls) TURNOVER! (dead ball)

[08:39] Team_047 possession (Score: 81-65)
Myles LaVine drives and kicks out. De'Aaron Rose attempts a Midrange. Contested by Michael Cunningham (4.6 feet, MAN). DE'AARON ROSE MAKES IT! Assist: Blake Jokic
Score: 83-65

[08:29] Team_014 possession (Score: 83-65)
FOUL! Reach-in foul on Blake Jokic during the drive. [Team fouls: 2] No free throws, side out. (Blake Jokic: 1 personal fouls)

[08:14] Team_014 possession (Score: 83-65)
Lamelo Simmons attempts a 3Pt. Contested by Blake Jokic (5.6 feet, MAN). LAMELO SIMMONS MAKES IT! Assist: Ayo Murray
Score: 83-68

[08:00] Team_047 possession (Score: 83-68)
Derrick Irving attempts a 3Pt. Contested by Jordan Anunoby (5.6 feet, MAN). DERRICK IRVING MAKES IT! Assist: Blake Jokic
Score: 86-68

[07:41] Team_014 possession (Score: 86-68)
Lamelo Simmons attempts a 3Pt. Contested by De'Aaron Rose (4.9 feet, ZONE). Lamelo Simmons misses. Rebound secured by Myles LaVine.

[07:28] Team_047 possession (Score: 86-68)
FOUL! Shooting foul on Ayo Murray. Myles LaVine to the line for 2 free throws. [Team fouls: 3] (Ayo Murray: 1 personal fouls)   FT 1/2: MISS   FT 2/2: GOOD Myles LaVine makes 1/2 from the line.
Score: 87-68

[07:17] Team_014 possession (Score: 87-68)
DeMar Adebayo drives, picks up Josh Harris. Help arrives from Derrick Irving! DeMar Adebayo attempts a Dunk. Contested by Derrick Irving (4.8 feet, ZONE). DEMAR ADEBAYO MAKES IT! Assist: Michael Cunningham
Score: 87-70

[06:59] Team_047 possession (Score: 87-70)
Blake Jokic drives and kicks out. Myles LaVine attempts a Midrange. Contested by Michael Cunningham (4.9 feet, ZONE). Myles LaVine misses. Rebound secured by Ayo Murray.

[06:43] Team_014 possession (Score: 87-70)
Ayo Murray drives to the basket... Ayo Murray throws a bad pass! Stolen by Myles LaVine! TURNOVER! (live ball)

[06:28] Team_047 possession (Score: 87-70)
Derrick Irving attempts a 3Pt. Contested by Jordan Anunoby (5.7 feet, MAN). Derrick Irving misses. FOUL! Loose ball foul on DeMar Adebayo during the rebound battle. [Team fouls: 4] No free throws, side out. (DeMar Adebayo: 1 personal fouls)

[06:19] Team_047 possession (Score: 87-70)
Derrick Irving attempts a 3Pt. Contested by Lamelo Simmons (5.4 feet, ZONE). Derrick Irving misses. Rebound secured by Ayo Murray.

[06:00] Team_014 possession (Score: 87-70)
Michael Cunningham attempts a 3Pt. Contested by De'Aaron Rose (4.7 feet, ZONE). MICHAEL CUNNINGHAM MAKES IT! Assist: Jordan Anunoby
Score: 87-73

[05:44] Team_047 possession (Score: 87-73)
FOUL! Reach-in foul on Ayo Murray during the drive. [IN THE BONUS! 5 team fouls] Blake Jokic to the line for 2 free throws. (Ayo Murray: 2 personal fouls)   FT 1/2: GOOD   FT 2/2: MISS Blake Jokic makes 1/2 from the line. Offensive rebound by Josh Harris! Josh Harris kicks it out.
Score: 88-73

[05:27] Team_047 possession (Score: 88-73)
Josh Harris attempts a 3Pt. Contested by DeMar Adebayo (4.5 feet, MAN). Josh Harris misses. Rebound secured by DeMar Adebayo.

[05:15] Team_014 possession (Score: 88-73)
Ayo Murray drives and kicks out. Ayo Murray attempts a 3Pt. Contested by De'Aaron Rose (5.1 feet, ZONE). Ayo Murray misses. Rebound secured by Myles LaVine.

[05:00] Team_047 possession (Score: 88-73)
Derrick Irving throws a bad pass! Stolen by Jordan Anunoby! TURNOVER! (live ball)

[04:47] Team_014 possession (Score: 88-73)
FOUL! Holding foul on Derrick Irving. [Team fouls: 3] No free throws, side out. (Derrick Irving: 1 personal fouls)

[04:30] Team_014 possession (Score: 88-73)
Michael Cunningham attempts a 3Pt. Contested by Josh Harris (5.1 feet, ZONE). Michael Cunningham misses. Offensive rebound by Ayo Murray! Ayo Murray kicks it out.

[04:20] Team_014 possession (Score: 88-73)
Jordan Anunoby attempts a Midrange. Wide open! Derrick Irving is 6.1 feet away. [MAN] JORDAN ANUNOBY MAKES IT! Assist: Ayo Murray
Score: 88-75

[04:07] Team_047 possession (Score: 88-75)
FOUL! Shooting foul on Ayo Murray. Myles LaVine to the line for 2 free throws. [BONUS: 6 team fouls] (Ayo Murray: 3 personal fouls)   FT 1/2: GOOD   FT 2/2: GOOD Myles LaVine makes 2/2 from the line.
Score: 90-75

[03:52] Team_014 possession (Score: 90-75)
Lamelo Simmons attempts a 3Pt. Contested by De'Aaron Rose (5.4 feet, ZONE). Lamelo Simmons misses. Rebound secured by Myles LaVine.

[03:41] Team_047 possession (Score: 90-75)
Myles LaVine drives and kicks out. Myles LaVine attempts a 3Pt. Contested by Michael Cunningham (5.4 feet, ZONE). Myles LaVine misses. Rebound secured by Ayo Murray.

[03:29] Team_014 possession (Score: 90-75)
Ayo Murray drives and kicks out. Michael Cunningham attempts a Midrange. Contested by De'Aaron Rose (5.4 feet, MAN). Michael Cunningham misses. Rebound secured by Josh Harris.

[03:13] Team_047 possession (Score: 90-75)
Derrick Irving attempts a Midrange. Wide open! Jordan Anunoby is 6.2 feet away. [MAN] DERRICK IRVING MAKES IT!
Score: 92-75

[02:57] Team_014 possession (Score: 92-75)
Ayo Murray drives to the basket... FOUL! Offensive foul on Ayo Murray! Josh Harris drew the charge! [Team fouls: 7] (Ayo Murray: 4 personal fouls) TURNOVER! (dead ball)

[02:42] Team_047 possession (Score: 92-75)
Myles LaVine attempts a Layup. Wide open! Ayo Murray is 6.1 feet away. [MAN] Myles LaVine misses. Rebound secured by DeMar Adebayo.

[02:28] Team_014 possession (Score: 92-75)
Ayo Murray attempts a Midrange. Contested by De'Aaron Rose (5.6 feet, ZONE). Ayo Murray misses. Rebound secured by Josh Harris.

[02:14] Team_047 possession (Score: 92-75)
Josh Harris attempts a 3Pt. Contested by DeMar Adebayo (5.0 feet, MAN). Josh Harris misses. Offensive rebound by Josh Harris! Josh Harris kicks it out.

[01:57] Team_047 possession (Score: 92-75)
Myles LaVine attempts a Midrange. Wide open! Ayo Murray is 6.2 feet away. [MAN] Myles LaVine misses. Rebound secured by Ayo Murray.

[01:39] Team_014 possession (Score: 92-75)
Ayo Murray attempts a Midrange. Wide open! Myles LaVine is 6.7 feet away. [ZONE] Ayo Murray misses. Rebound secured by Myles LaVine.

[01:24] Team_047 possession (Score: 92-75)
Josh Harris drives and kicks out. Derrick Irving attempts a 3Pt. Wide open! Jordan Anunoby is 6.4 feet away. [MAN] Derrick Irving misses. Rebound secured by Ayo Murray.

[01:08] Team_014 possession (Score: 92-75)
Lamelo Simmons attempts a 3Pt. Wide open! Blake Jokic is 6.2 feet away. [MAN] Lamelo Simmons misses. Rebound secured by Josh Harris.

[00:53] Team_047 possession (Score: 92-75)
De'Aaron Rose attempts a Layup. BLOCKED BY MICHAEL CUNNINGHAM! Ball is loose! Offensive rebound by Myles LaVine! Myles LaVine kicks it out.

[00:37] Team_047 possession (Score: 92-75)
Blake Jokic drives and kicks out. De'Aaron Rose attempts a 3Pt. Contested by Michael Cunningham (5.9 feet, MAN). DE'AARON ROSE MAKES IT! Assist: Blake Jokic
Score: 95-75

[00:24] Team_014 possession (Score: 95-75)
Jordan Anunoby drives to the basket... Jordan Anunoby loses the ball! Stripped by Derrick Irving! TURNOVER! (live ball)

[00:05] Team_047 possession (Score: 95-75)
FOUL! Shooting foul on DeMar Adebayo. Josh Harris to the line for 2 free throws. [BONUS: 8 team fouls] (DeMar Adebayo: 2 personal fouls)   FT 1/2: GOOD   FT 2/2: GOOD Josh Harris makes 2/2 from the line.
Score: 97-75

================================================================================
                              4TH QUARTER COMPLETE                              
================================================================================

4TH QUARTER SCORE: Team_047 21, Team_014 15

BOX SCORE:
================================================================================

Team_047
--------------------------------------------------------------------------------
Player                MIN  PTS  REB  AST  TO      FG   FG%      3P   3P%
--------------------------------------------------------------------------------
De'Aaron Rose          40    7    0    0   0   3/3   100.0     0/0   0.0
Derrick Irving         40    5    2    0   0   2/3    66.7     0/0   0.0
Josh Harris            40    5    6    0   0   2/5    40.0     0/0   0.0
Myles LaVine           40    3    7    1   0   2/6    33.3     0/0   0.0
Blake Jokic            40    0    0    3   0   0/2     0.0     0/0   0.0

TEAM: FG: 9/19 (47.4%), 3PT: 2/7 (28.6%), REB: 15 (6 off, 9 def), AST: 4, TO: 1
TEAM FOULS: 3


Team_014
--------------------------------------------------------------------------------
Player                MIN  PTS  REB  AST  TO      FG   FG%      3P   3P%
--------------------------------------------------------------------------------
Lamelo Simmons         37    6    0    0   0   2/5    40.0     0/0   0.0
Michael Cunningham     40    5    1    2   0   2/3    66.7     0/0   0.0
DeMar Adebayo          40    2    4    0   0   1/1   100.0     0/0   0.0
Jordan Anunoby         40    2    0    1   0   1/2    50.0     0/0   0.0
Ayo Murray             40    0    7    2   0   0/4     0.0     0/0   0.0

TEAM: FG: 6/15 (40.0%), 3PT: 3/7 (42.9%), REB: 12 (2 off, 10 def), AST: 5, TO: 4
TEAM FOULS: 8 [Team_047 in BONUS]

================================================================================

================================================================================
                               FULL GAME COMPLETE                               
================================================================================

FINAL SCORE: Team_047 97, Team_014 75

SCORING BY QUARTER:
--------------------------------------------------------------------------------
Team                     Q1     Q2     Q3     Q4    FINAL
--------------------------------------------------------------------------------
Team_047                 27     25     24     21       97
Team_014                 19     13     28     15       75
--------------------------------------------------------------------------------

FULL GAME BOX SCORE:
================================================================================

Team_047
--------------------------------------------------------------------------------
Player                MIN  PTS  REB  AST  TO      FG   FG%      3P   3P%      FT STL BLK
--------------------------------------------------------------------------------
De'Aaron Rose          40   16    0    3   1   5/8    62.5   1/1   100.0   2/2     0   0
Derrick Irving         40   15    7    1   1   6/9    66.7   3/6    50.0   0/0     1   1
Blake Jokic            40   17    0    7   1   7/13   53.8   1/5    20.0   5/6     1   0
Josh Harris            40   18   18    1   1   7/16   43.8   3/5    60.0   2/2     0   0
Myles LaVine           40    9   21    3   2   6/15   40.0   0/2     0.0   5/6     1   0
Austin Giddey           8    6    0    1   0   4/5    80.0   2/2   100.0   3/4     0   0
Donovan Iverson         8    5    4    2   0   2/2   100.0   1/1   100.0   0/0     1   1
Blake Jackson           8    2    2    1   0   0/1     0.0   0/1     0.0   2/2     0   0
Tony Poole              8    4    0    1   0   1/2    50.0   0/0     0.0   2/2     0   0
Zion Thompson           8    4    3    1   0   2/2   100.0   0/0     0.0   0/0     0   0

TEAM: FG: 41/74 (55.4%), 3PT: 11/23 (47.8%), REB: 55 (22 off, 33 def), AST: 21, TO: 6


Team_014
--------------------------------------------------------------------------------
Player                MIN  PTS  REB  AST  TO      FG   FG%      3P   3P%      FT STL BLK
--------------------------------------------------------------------------------
Michael Cunningham     40    7    6    3   2   3/9    33.3   1/4    25.0   2/2     0   1
Jordan Anunoby         40   15    0    2   3   5/9    55.6   2/4    50.0   0/0     1   0
DeMar Adebayo          40    9   14    2   2   4/9    44.4   0/1     0.0   1/2     0   2
Ayo Murray             40   13   17    4   0   7/16   43.8   1/1   100.0   2/2     1   0
Lamelo Simmons         37   17    0    1   2   7/12   58.3   2/7    28.6   5/6     0   0
Tracy Westbrook        12    3    1    2   1   1/3    33.3   1/1   100.0   3/3     0   0
Jalen Booker            8    0    0    1   1   0/2     0.0   0/2     0.0   0/0     0   0
Bones Quickley          8    0    0    1   1   0/0     0.0   0/0     0.0   0/0     0   0
Nikola James            8    5    2    1   0   3/3   100.0   1/1   100.0   0/0     0   1
Collin Gasol            8    6    2    0   0   2/2   100.0   0/0     0.0   0/0     0   1

TEAM: FG: 33/66 (50.0%), 3PT: 8/21 (38.1%), REB: 42 (9 off, 33 def), AST: 17, TO: 12

================================================================================
