================================================================================
                        FULL GAME - Team_079 vs Team_036                        
================================================================================

================================================================================
                       1ST QUARTER - Team_079 vs Team_036                       
================================================================================

[12:00] Team_079 possession (Score: 0-0)
Donovan Randle attempts a Midrange. Contested by Giannis Booker (4.7 feet, ZONE). Donovan Randle misses. Rebound secured by Kobe Simmons.

[11:49] Team_036 possession (Score: 0-0)
Anthony Poole attempts a 3Pt. Contested by Bam Randle (4.9 feet, MAN). ANTHONY POOLE MAKES IT! Assist: Michael Westbrook
Score: 0-3

[11:38] Team_079 possession (Score: 0-3)
Trae Durant attempts a 3Pt. Contested by Terry Durant (4.3 feet, MAN). Trae Durant misses. Offensive rebound by Donovan Randle! Donovan Randle kicks it out.

[11:27] Team_079 possession (Score: 0-3)
Donovan Randle attempts a Midrange. Contested by Kobe Simmons (3.6 feet, MAN). Donovan Randle misses. Rebound secured by Kobe Simmons.

[11:15] Team_036 possession (Score: 0-3)
Michael Westbrook loses the ball! Stripped by Khris Embiid! TURNOVER! (live ball)

[10:59] Team_079 possession (Score: 0-3)
Trae Durant attempts a 3Pt. Contested by Michael Westbrook (4.5 feet, ZONE). TRAE DURANT MAKES IT! Assist: Donovan Randle
Score: 3-3

[10:45] Team_036 possession (Score: 3-3)
Kobe Simmons drives, Donovan Randle stays with him. Kobe Simmons attempts a Dunk. Contested by Donovan Randle (4.6 feet, MAN). KOBE SIMMONS MAKES IT! Assist: Terry Durant
Score: 3-5

[10:28] Team_079 possession (Score: 3-5)
Miles Ming drives to the basket... FOUL! Offensive foul on Miles Ming! Kobe Simmons drew the charge! [Team fouls: 1] (Miles Ming: 1 personal fouls) TURNOVER! (dead ball)

[10:13] Team_036 possession (Score: 3-5)
FOUL! Shooting foul on Trae Durant. Terry Durant to the line for 2 free throws. [Team fouls: 2] (Trae Durant: 1 personal fouls)   FT 1/2: GOOD   FT 2/2: GOOD Terry Durant makes 2/2 from the line.
Score: 3-7

[09:58] Team_079 possession (Score: 3-7)
Khris Embiid loses control! Ball rolls out of bounds! TURNOVER! (dead ball)

[09:46] Team_036 possession (Score: 3-7)
Kobe Simmons drives, picks up Donovan Randle. Help arrives from Miles Ming! Kobe Simmons attempts a Layup. Contested by Miles Ming (4.6 feet, MAN). Kobe Simmons misses. Rebound secured by Trae Durant.

[09:35] Team_079 possession (Score: 3-7)
Trae Durant attempts a Midrange. Contested by Giannis Booker (4.4 feet, ZONE). Trae Durant misses. Rebound secured by Terry Durant.

[09:19] Team_036 possession (Score: 3-7)
Terry Durant attempts a 3Pt. Contested by Trae Durant (3.5 feet, ZONE). Terry Durant misses. Rebound secured by Trae Durant.

[09:01] Team_079 possession (Score: 3-7)
Khris Embiid attempts a 3Pt. Contested by Michael Westbrook (4.9 feet, MAN). KHRIS EMBIID MAKES IT! Assist: Bam Randle
Score: 6-7

[08:47] Team_036 possession (Score: 6-7)
Kobe Simmons drives and kicks out. Giannis Booker attempts a 3Pt. Contested by Miles Ming (4.1 feet, MAN). Giannis Booker misses. Rebound secured by Donovan Randle.

[08:37] Team_079 possession (Score: 6-7)
Donovan Randle attempts a Midrange. Contested by Kobe Simmons (3.6 feet, MAN). Donovan Randle misses. Rebound secured by Giannis Booker.

[08:24] Team_036 possession (Score: 6-7)
Anthony Poole attempts a Layup. BLOCKED BY TRAE DURANT! Ball is loose! Rebound secured by Trae Durant.

[08:12] Team_079 possession (Score: 6-7)
Trae Durant attempts a Midrange. Contested by Terry Durant (4.3 feet, MAN). Trae Durant misses. Offensive rebound by Donovan Randle! Donovan Randle kicks it out.

[07:55] Team_079 possession (Score: 6-7)
FOUL! Shooting foul on Kobe Simmons. Donovan Randle to the line for 3 free throws. [Team fouls: 1] (Kobe Simmons: 1 personal fouls)   FT 1/3: GOOD   FT 2/3: GOOD   FT 3/3: MISS Donovan Randle makes 2/3 from the line. Rebound secured by Giannis Booker.
Score: 8-7

[07:46] Team_036 possession (Score: 8-7)
Terry Durant attempts a Layup. Contested by Trae Durant (3.5 feet, MAN). Terry Durant misses. Rebound secured by Trae Durant.

[07:29] Team_079 possession (Score: 8-7)
Khris Embiid drives, Kobe Simmons stays with him. Khris Embiid attempts a Layup. Contested by Kobe Simmons (3.7 feet, ZONE). KHRIS EMBIID MAKES IT! Assist: Donovan Randle
Score: 10-7

[07:12] Team_036 possession (Score: 10-7)
Kobe Simmons drives and kicks out. Kobe Simmons attempts a Midrange. Contested by Donovan Randle (4.2 feet, MAN). Kobe Simmons misses. Rebound secured by Donovan Randle.

[06:56] Team_079 possession (Score: 10-7)
Miles Ming attempts a 3Pt. Contested by Giannis Booker (4.7 feet, MAN). MILES MING MAKES IT! Assist: Trae Durant
Score: 13-7

[06:42] Team_036 possession (Score: 13-7)
Terry Durant attempts a Midrange. Contested by Trae Durant (3.5 feet, ZONE). TERRY DURANT MAKES IT!
Score: 13-9

[06:29] Team_079 possession (Score: 13-9)
Khris Embiid drives, picks up Michael Westbrook. Help arrives from Anthony Poole! Khris Embiid attempts a Dunk. Contested by Anthony Poole (4.9 feet, MAN). KHRIS EMBIID MAKES IT! Assist: Donovan Randle
Score: 15-9

[06:17] Team_036 possession (Score: 15-9)
Michael Westbrook drives to the basket... Michael Westbrook throws a bad pass out of bounds! TURNOVER! (dead ball)

[06:02] Team_079 possession (Score: 15-9)
Khris Embiid attempts a 3Pt. Contested by Michael Westbrook (4.9 feet, ZONE). Khris Embiid misses. Rebound secured by Terry Durant.

[05:50] Team_036 possession (Score: 15-9)
Terry Durant attempts a Midrange. Contested by Trae Durant (3.5 feet, ZONE). TERRY DURANT MAKES IT!
Score: 15-11

[05:33] Team_079 possession (Score: 15-11)
Trae Durant attempts a Layup. Contested by Terry Durant (4.3 feet, MAN). Trae Durant misses. Rebound secured by Terry Durant.

[05:22] Team_036 possession (Score: 15-11)
Kobe Simmons attempts a 3Pt. Contested by Trae Durant (3.4 feet, ZONE). Kobe Simmons misses. Offensive rebound by Terry Durant! Terry Durant puts it back in!
Score: 15-13

[05:11] Team_079 possession (Score: 15-13)
FOUL! Offensive foul on Bam Randle! Anthony Poole drew the charge! [Team fouls: 3] (Bam Randle: 1 personal fouls) TURNOVER! (dead ball)

[04:54] Team_036 possession (Score: 15-13)
FOUL! Shooting foul on Trae Durant. Terry Durant to the line for 2 free throws. [Team fouls: 4] (Trae Durant: 2 personal fouls)   FT 1/2: GOOD   FT 2/2: GOOD Terry Durant makes 2/2 from the line.
Score: 15-15

[04:41] Team_079 possession (Score: 15-15)
Khris Embiid attempts a Layup. Contested by Kobe Simmons (3.8 feet, ZONE). KHRIS EMBIID MAKES IT!
Score: 17-15

[04:27] Team_036 possession (Score: 17-15)
Kobe Simmons loses the ball! Stripped by Donovan Randle! TURNOVER! (live ball)

[04:14] Team_079 possession (Score: 17-15)
Trae Durant attempts a Midrange. Contested by Terry Durant (4.4 feet, MAN). Trae Durant misses. FOUL! Loose ball foul on Giannis Booker during the rebound battle. [Team fouls: 2] No free throws, side out. (Giannis Booker: 1 personal fouls)

[03:59] Team_079 possession (Score: 17-15)
Bam Randle attempts a 3Pt. Contested by Michael Westbrook (4.6 feet, ZONE). Bam Randle misses. Rebound secured by Terry Durant.

[03:44] Team_036 possession (Score: 17-15)
Terry Durant drives to the basket... Terry Durant throws a bad pass! Stolen by Trae Durant! TURNOVER! (live ball)

[03:30] Team_079 possession (Score: 17-15)
Miles Ming attempts a 3Pt. Contested by Michael Westbrook (5.0 feet, ZONE). Miles Ming misses. Offensive rebound by Donovan Randle! Donovan Randle kicks it out.

[03:15] Team_079 possession (Score: 17-15)
Miles Ming attempts a 3Pt. Contested by Michael Westbrook (5.0 feet, ZONE). Miles Ming misses. Rebound secured by Terry Durant.

[03:04] Team_036 possession (Score: 17-15)
FOUL! Reach-in foul on Khris Embiid during the drive. [IN THE BONUS! 5 team fouls] Michael Westbrook to the line for 2 free throws. (Khris Embiid: 1 personal fouls)   FT 1/2: GOOD   FT 2/2: GOOD Michael Westbrook makes 2/2 from the line.
Score: 17-17

[02:48] Team_079 possession (Score: 17-17)
Miles Ming attempts a 3Pt. Contested by Giannis Booker (4.9 feet, MAN). Miles Ming misses. Offensive rebound by Trae Durant! Trae Durant kicks it out.

[02:33] Team_079 possession (Score: 17-17)
Miles Ming attempts a Midrange. Contested by Giannis Booker (4.9 feet, MAN). MILES MING MAKES IT! Assist: Trae Durant
Score: 19-17

[02:14] Team_036 possession (Score: 19-17)
Anthony Poole attempts a 3Pt. Contested by Trae Durant (4.0 feet, ZONE). Anthony Poole misses. Rebound secured by Trae Durant.

[01:56] Team_079 possession (Score: 19-17)
Bam Randle attempts a 3Pt. Contested by Giannis Booker (4.6 feet, ZONE). BAM RANDLE MAKES IT! Assist: Miles Ming
Score: 22-17

[01:43] Team_036 possession (Score: 22-17)
Kobe Simmons attempts a Midrange. Contested by Donovan Randle (5.0 feet, MAN). Kobe Simmons misses. Offensive rebound by Terry Durant! Terry Durant's putback is no good. Rebound secured by Trae Durant.

[01:28] Team_079 possession (Score: 22-17)
FOUL! Holding foul on Michael Westbrook. [Team fouls: 3] No free throws, side out. (Michael Westbrook: 1 personal fouls)

[01:14] Team_079 possession (Score: 22-17)
Trae Durant attempts a Layup. Contested by Kobe Simmons (3.8 feet, ZONE). Trae Durant misses. Rebound secured by Kobe Simmons.

[00:59] Team_036 possession (Score: 22-17)
Michael Westbrook attempts a Midrange. Contested by Khris Embiid (5.3 feet, MAN). Michael Westbrook misses. Rebound secured by Donovan Randle.

[00:47] Team_079 possession (Score: 22-17)
Trae Durant attempts a 3Pt. Contested by Terry Durant (4.7 feet, MAN). Trae Durant misses. FOUL! Loose ball foul on Terry Durant during the rebound battle. [Team fouls: 4] No free throws, side out. (Terry Durant: 1 personal fouls)

[00:32] Team_079 possession (Score: 22-17)
Bam Randle attempts a 3Pt. Contested by Anthony Poole (5.1 feet, MAN). Bam Randle misses. Rebound secured by Kobe Simmons.

[00:20] Team_036 possession (Score: 22-17)
Giannis Booker attempts a 3Pt. Contested by Trae Durant (3.9 feet, ZONE). GIANNIS BOOKER MAKES IT! Assist: Michael Westbrook
Score: 22-20

[00:06] Team_079 possession (Score: 22-20)
Donovan Randle attempts a Midrange. Contested by Kobe Simmons (4.2 feet, ZONE). Donovan Randle misses. Offensive rebound by Donovan Randle! Donovan Randle kicks it out.

================================================================================
                              1ST QUARTER COMPLETE                              
================================================================================

1ST QUARTER SCORE: Team_079 22, Team_036 20

BOX SCORE:
================================================================================

Team_079
--------------------------------------------------------------------------------
Player                MIN  PTS  REB  AST  TO      FG   FG%      3P   3P%
--------------------------------------------------------------------------------
Khris Embiid           12    9    0    0   0   4/5    80.0     0/0   0.0
Miles Ming             12    5    0    1   0   2/3    66.7     0/0   0.0
Trae Durant            12    3    9    2   0   1/4    25.0     0/0   0.0
Bam Randle             12    3    0    1   0   1/3    33.3     0/0   0.0
Donovan Randle         12    0    7    3   0   0/4     0.0     0/0   0.0

TEAM: FG: 8/19 (42.1%), 3PT: 4/9 (44.4%), REB: 15 (7 off, 8 def), AST: 7, TO: 3
TEAM FOULS: 5 [Team_036 in BONUS]


Team_036
--------------------------------------------------------------------------------
Player                MIN  PTS  REB  AST  TO      FG   FG%      3P   3P%
--------------------------------------------------------------------------------
Terry Durant           12   10    6    1   0   5/7    71.4     0/0   0.0
Anthony Poole          12    3    0    0   0   1/3    33.3     0/0   0.0
Giannis Booker         12    3    2    0   0   1/1   100.0     0/0   0.0
Kobe Simmons           12    2    4    0   0   1/5    20.0     0/0   0.0
Michael Westbrook      12    2    0    2   0   1/2    50.0     0/0   0.0

TEAM: FG: 9/18 (50.0%), 3PT: 3/5 (60.0%), REB: 13 (2 off, 11 def), AST: 3, TO: 4
TEAM FOULS: 4

================================================================================

================================================================================
                       2ND QUARTER - Team_079 vs Team_036                       
================================================================================

[12:00] Team_079 possession (Score: 22-20)
Khris Embiid drives, picks up Kobe Simmons. Help arrives from Giannis Booker! Khris Embiid attempts a Dunk. Contested by Giannis Booker (4.1 feet, ZONE). KHRIS EMBIID MAKES IT! Assist: Trae Durant
Score: 24-20

[11:43] Team_036 possession (Score: 24-20)
Giannis Booker makes the Midrange and draws the foul on Bam Randle! And-1! Giannis Booker to the line for 1. [Team fouls: 1] (Bam Randle: 1 personal fouls)   FT 1/1: GOOD Giannis Booker makes 1/1 from the line.
Score: 24-23

[11:29] Team_079 possession (Score: 24-23)
FOUL! Shooting foul on Anthony Poole. Khris Embiid to the line for 2 free throws. [Team fouls: 1] (Anthony Poole: 1 personal fouls)   FT 1/2: GOOD   FT 2/2: GOOD Khris Embiid makes 2/2 from the line.
Score: 26-23

[11:16] Team_036 possession (Score: 26-23)
Kobe Simmons drives and kicks out. Anthony Poole attempts a 3Pt. Contested by Trae Durant (3.4 feet, ZONE). Anthony Poole misses. Rebound secured by Donovan Randle.

[11:00] Team_079 possession (Score: 26-23)
Miles Ming drives and kicks out. Miles Ming attempts a Midrange. Contested by Giannis Booker (4.9 feet, MAN). Miles Ming misses. Offensive rebound by Donovan Randle! Donovan Randle kicks it out.

[10:43] Team_079 possession (Score: 26-23)
Bam Randle drives to the basket... Bam Randle loses control! Ball rolls out of bounds! TURNOVER! (dead ball)

[10:43] Substitution (Team_079): Khris Embiid OUT → Evan Mobley IN (stamina_rule2)

[10:43] Substitution (Team_079): Miles Ming OUT → Karl Ingram IN (stamina_rule2)

[10:43] Substitution (Team_079): Bam Randle OUT → Anthony Wade IN (stamina_rule2)

[10:43] Substitution (Team_079): Trae Durant OUT → Kobe Curry IN (stamina_rule2)

[10:43] Substitution (Team_079): Donovan Randle OUT → James LaVine IN (stamina_rule2)

[10:43] Substitution (Team_036): Michael Westbrook OUT → Dirk Anunoby IN (stamina_rule2)

[10:43] Substitution (Team_036): Giannis Booker OUT → Tobias Fox IN (stamina_rule2)

[10:43] Substitution (Team_036): Anthony Poole OUT → Pascal Antetokounmpo IN (stamina_rule2)

[10:43] Substitution (Team_036): Terry Durant OUT → Devin Simmons IN (stamina_rule2)

[10:43] Substitution (Team_036): Kobe Simmons OUT → Bradley Murray IN (stamina_rule2)

[10:27] Team_036 possession (Score: 26-23)
Pascal Antetokounmpo attempts a Layup. Contested by James LaVine (4.4 feet, ZONE). Pascal Antetokounmpo misses. Rebound secured by Anthony Wade.

[10:09] Team_079 possession (Score: 26-23)
Anthony Wade makes the Layup and draws the foul on Devin Simmons! And-1! Anthony Wade to the line for 1. [Team fouls: 2] (Devin Simmons: 1 personal fouls)   FT 1/1: GOOD Anthony Wade makes 1/1 from the line.
Score: 29-23

[09:59] Team_036 possession (Score: 29-23)
Pascal Antetokounmpo loses the ball! Stripped by Anthony Wade! TURNOVER! (live ball)

[09:46] Team_079 possession (Score: 29-23)
James LaVine attempts a 3Pt. Contested by Bradley Murray (4.7 feet, MAN). James LaVine misses. Offensive rebound by James LaVine! James LaVine puts it back in!
Score: 31-23

[09:30] Team_036 possession (Score: 31-23)
Bradley Murray commits a violation (traveling/carry)! TURNOVER! (dead ball)

[09:18] Team_079 possession (Score: 31-23)
Evan Mobley attempts a Midrange. Wide open! Dirk Anunoby is 6.0 feet away. [MAN] EVAN MOBLEY MAKES IT! Assist: James LaVine
Score: 33-23

[09:08] Team_036 possession (Score: 33-23)
Bradley Murray attempts a Midrange. Contested by James LaVine (4.1 feet, MAN). Bradley Murray misses. Rebound secured by Kobe Curry.

[08:55] Team_079 possession (Score: 33-23)
Anthony Wade drives, Devin Simmons stays with him. Anthony Wade attempts a Layup. Contested by Devin Simmons (5.3 feet, ZONE). Anthony Wade misses. Offensive rebound by James LaVine! James LaVine's putback is no good. Rebound secured by Pascal Antetokounmpo.

[08:38] Team_036 possession (Score: 33-23)
FOUL! Shooting foul on James LaVine. Pascal Antetokounmpo to the line for 2 free throws. [Team fouls: 2] (James LaVine: 1 personal fouls)   FT 1/2: GOOD   FT 2/2: GOOD Pascal Antetokounmpo makes 2/2 from the line.
Score: 33-25

[08:23] Team_079 possession (Score: 33-25)
James LaVine drives, picks up Devin Simmons. Help arrives from Dirk Anunoby! James LaVine attempts a Dunk. Contested by Dirk Anunoby (5.3 feet, ZONE). JAMES LAVINE MAKES IT! Assist: Evan Mobley
Score: 35-25

[08:08] Team_036 possession (Score: 35-25)
Pascal Antetokounmpo drives, picks up James LaVine. Help arrives from Karl Ingram! Pascal Antetokounmpo attempts a Layup. Contested by Karl Ingram (4.4 feet, ZONE). Pascal Antetokounmpo misses. Rebound secured by James LaVine.

[07:58] Team_079 possession (Score: 35-25)
Evan Mobley attempts a 3Pt. Contested by Tobias Fox (5.0 feet, ZONE). Evan Mobley misses. Offensive rebound by Kobe Curry! Kobe Curry kicks it out.

[07:41] Team_079 possession (Score: 35-25)
James LaVine attempts a Layup. BLOCKED BY DEVIN SIMMONS! Ball is loose! Offensive rebound by Kobe Curry! Kobe Curry kicks it out.

[07:28] Team_079 possession (Score: 35-25)
James LaVine drives, Bradley Murray stays with him. James LaVine attempts a Layup. Contested by Bradley Murray (4.7 feet, MAN). JAMES LAVINE MAKES IT! Assist: Karl Ingram
Score: 37-25

[07:09] Team_036 possession (Score: 37-25)
Devin Simmons attempts a Midrange. Contested by Kobe Curry (4.7 feet, MAN). DEVIN SIMMONS MAKES IT!
Score: 37-27

[06:57] Team_079 possession (Score: 37-27)
FOUL! Holding foul on Dirk Anunoby. [Team fouls: 3] No free throws, side out. (Dirk Anunoby: 1 personal fouls)

[06:38] Team_079 possession (Score: 37-27)
Evan Mobley attempts a 3Pt. Wide open! Dirk Anunoby is 6.0 feet away. [MAN] Evan Mobley misses. Offensive rebound by Kobe Curry! Kobe Curry kicks it out.

[06:26] Team_079 possession (Score: 37-27)
Evan Mobley attempts a Midrange. Contested by Tobias Fox (5.0 feet, ZONE). Evan Mobley misses. Rebound secured by Pascal Antetokounmpo.

[06:09] Team_036 possession (Score: 37-27)
Pascal Antetokounmpo attempts a Midrange. Wide open! Anthony Wade is 6.3 feet away. [MAN] PASCAL ANTETOKOUNMPO MAKES IT!
Score: 37-29

[05:56] Team_079 possession (Score: 37-29)
Karl Ingram attempts a 3Pt. Contested by Tobias Fox (4.6 feet, MAN). Karl Ingram misses. Offensive rebound by Kobe Curry! Kobe Curry kicks it out.

[05:43] Team_079 possession (Score: 37-29)
Karl Ingram attempts a 3Pt. Contested by Tobias Fox (4.6 feet, MAN). KARL INGRAM MAKES IT! Assist: Kobe Curry
Score: 40-29

[05:30] Team_036 possession (Score: 40-29)
Devin Simmons attempts a Layup. Contested by James LaVine (4.3 feet, ZONE). Devin Simmons misses. FOUL! Loose ball foul on Anthony Wade during the rebound battle. [Team fouls: 3] No free throws, side out. (Anthony Wade: 1 personal fouls)

[05:17] Team_036 possession (Score: 40-29)
Pascal Antetokounmpo attempts a 3Pt. Contested by Evan Mobley (4.7 feet, ZONE). Pascal Antetokounmpo misses. Offensive rebound by Devin Simmons! Devin Simmons kicks it out.

[05:01] Team_036 possession (Score: 40-29)
Bradley Murray drives to the basket... Bradley Murray throws a bad pass! Stolen by James LaVine! TURNOVER! (live ball)

[04:49] Team_079 possession (Score: 40-29)
Anthony Wade attempts a 3Pt. Contested by Tobias Fox (4.6 feet, ZONE). Anthony Wade misses. Rebound secured by Devin Simmons.

[04:37] Team_036 possession (Score: 40-29)
FOUL! Reach-in foul on Anthony Wade during the drive. [Team fouls: 4] No free throws, side out. (Anthony Wade: 2 personal fouls)

[04:25] Team_036 possession (Score: 40-29)
Pascal Antetokounmpo attempts a Midrange. Contested by Karl Ingram (5.6 feet, ZONE). Pascal Antetokounmpo misses. Rebound secured by Kobe Curry.

[04:12] Team_079 possession (Score: 40-29)
James LaVine attempts a Midrange. Contested by Bradley Murray (4.7 feet, MAN). JAMES LAVINE MAKES IT!
Score: 42-29

[03:57] Team_036 possession (Score: 42-29)
Tobias Fox attempts a Layup. Contested by Karl Ingram (5.7 feet, MAN). TOBIAS FOX MAKES IT! Assist: Devin Simmons
Score: 42-31

[03:40] Team_079 possession (Score: 42-31)
Anthony Wade attempts a Midrange. Contested by Pascal Antetokounmpo (4.9 feet, MAN). Anthony Wade misses. Offensive rebound by James LaVine! James LaVine's putback is no good. Offensive rebound by James LaVine! James LaVine kicks it out.

[03:24] Team_079 possession (Score: 42-31)
Kobe Curry attempts a Midrange. Contested by Tobias Fox (4.7 feet, ZONE). Kobe Curry misses. Rebound secured by Pascal Antetokounmpo.

[03:15] Team_036 possession (Score: 42-31)
Bradley Murray attempts a Midrange. Wide open! Anthony Wade is 6.0 feet away. [ZONE] Bradley Murray misses. Rebound secured by James LaVine.

[03:02] Team_079 possession (Score: 42-31)
Evan Mobley attempts a 3Pt. Wide open! Dirk Anunoby is 6.1 feet away. [MAN] Evan Mobley misses. Rebound secured by Devin Simmons.

[02:48] Team_036 possession (Score: 42-31)
Dirk Anunoby drives and kicks out. Bradley Murray attempts a 3Pt. Contested by James LaVine (4.3 feet, MAN). Bradley Murray misses. Rebound secured by Kobe Curry.

[02:34] Team_079 possession (Score: 42-31)
Evan Mobley attempts a 3Pt. Wide open! Dirk Anunoby is 6.1 feet away. [MAN] EVAN MOBLEY MAKES IT! Assist: Kobe Curry
Score: 45-31

[02:19] Team_036 possession (Score: 45-31)
Dirk Anunoby attempts a Layup. Contested by Evan Mobley (5.1 feet, MAN). DIRK ANUNOBY MAKES IT! Assist: Bradley Murray
Score: 45-33

[02:04] Team_079 possession (Score: 45-33)
Kobe Curry attempts a Layup. Contested by Devin Simmons (5.6 feet, ZONE). KOBE CURRY MAKES IT! Assist: Karl Ingram
Score: 47-33

[01:47] Team_036 possession (Score: 47-33)
Pascal Antetokounmpo attempts a Midrange. Wide open! Anthony Wade is 6.5 feet away. [MAN] Pascal Antetokounmpo misses. Offensive rebound by Bradley Murray! Bradley Murray kicks it out.

[01:32] Team_036 possession (Score: 47-33)
FOUL! Shooting foul on Anthony Wade. Pascal Antetokounmpo to the line for 2 free throws. [BONUS: 5 team fouls] (Anthony Wade: 3 personal fouls)   FT 1/2: MISS   FT 2/2: GOOD Pascal Antetokounmpo makes 1/2 from the line.
Score: 47-34

[01:17] Team_079 possession (Score: 47-34)
Evan Mobley drives, Dirk Anunoby stays with him. Evan Mobley attempts a Layup. Wide open! Dirk Anunoby is 6.2 feet away. [MAN] EVAN MOBLEY MAKES IT! Assist: Kobe Curry
Score: 49-34

[01:02] Team_036 possession (Score: 49-34)
Bradley Murray attempts a 3Pt. Contested by James LaVine (4.4 feet, MAN). Bradley Murray misses. Rebound secured by James LaVine.

[00:47] Team_079 possession (Score: 49-34)
James LaVine attempts a Midrange. Contested by Bradley Murray (5.0 feet, MAN). JAMES LAVINE MAKES IT!
Score: 51-34

[00:33] Team_036 possession (Score: 51-34)
Pascal Antetokounmpo drives and kicks out. FOUL! Shooting foul on Karl Ingram. Tobias Fox to the line for 2 free throws. [BONUS: 6 team fouls] (Karl Ingram: 1 personal fouls)   FT 1/2: GOOD   FT 2/2: GOOD Tobias Fox makes 2/2 from the line.
Score: 51-36

[00:18] Team_079 possession (Score: 51-36)
Kobe Curry drives to the basket... Kobe Curry loses the ball! Stripped by Devin Simmons! TURNOVER! (live ball)

[00:03] Team_036 possession (Score: 51-36)
Pascal Antetokounmpo attempts a 3Pt. Contested by Karl Ingram (5.9 feet, ZONE). Pascal Antetokounmpo misses. Offensive rebound by Bradley Murray! Bradley Murray kicks it out.

================================================================================
                              2ND QUARTER COMPLETE                              
================================================================================

2ND QUARTER SCORE: Team_079 29, Team_036 16

BOX SCORE:
================================================================================

Team_079
--------------------------------------------------------------------------------
Player                MIN  PTS  REB  AST  TO      FG   FG%      3P   3P%
--------------------------------------------------------------------------------
James LaVine           11   10    5    1   0   5/5   100.0     0/0   0.0
Evan Mobley            11    7    0    1   0   3/5    60.0     0/0   0.0
Khris Embiid           14    4    0    0   0   2/2   100.0     0/0   0.0
Anthony Wade           11    3    1    0   0   1/3    33.3     0/0   0.0
Karl Ingram            11    3    0    2   0   1/1   100.0     0/0   0.0
Kobe Curry             11    2    7    3   0   1/2    50.0     0/0   0.0
Trae Durant            14    0    0    1   0   0/0     0.0     0/0   0.0
Donovan Randle         14    0    2    0   0   0/0     0.0     0/0   0.0

TEAM: FG: 13/18 (72.2%), 3PT: 3/5 (60.0%), REB: 16 (8 off, 8 def), AST: 8, TO: 2
TEAM FOULS: 6 [Team_036 in BONUS]


Team_036
--------------------------------------------------------------------------------
Player                MIN  PTS  REB  AST  TO      FG   FG%      3P   3P%
--------------------------------------------------------------------------------
Pascal Antetokounmpo   11    5    3    0   0   3/6    50.0     0/0   0.0
Tobias Fox             11    4    0    0   0   2/2   100.0     0/0   0.0
Giannis Booker         14    3    0    0   0   1/1   100.0     0/0   0.0
Devin Simmons          11    2    3    1   0   1/1   100.0     0/0   0.0
Dirk Anunoby           11    2    0    0   0   1/2    50.0     0/0   0.0
Kobe Simmons           14    0    0    0   0   0/1     0.0     0/0   0.0
Bradley Murray         11    0    3    1   0   0/3     0.0     0/0   0.0

TEAM: FG: 8/16 (50.0%), 3PT: 0/1 (0.0%), REB: 8 (4 off, 4 def), AST: 2, TO: 3
TEAM FOULS: 3

================================================================================

================================================================================
                       3RD QUARTER - Team_079 vs Team_036                       
================================================================================

[12:00] Team_079 possession (Score: 51-36)
Bam Randle makes the Layup and draws the foul on Anthony Poole! And-1! Bam Randle to the line for 1. [Team fouls: 1] (Anthony Poole: 1 personal fouls)   FT 1/1: GOOD Bam Randle makes 1/1 from the line.
Score: 54-36

[11:45] Team_036 possession (Score: 54-36)
Giannis Booker attempts a 3Pt. Contested by Miles Ming (4.5 feet, MAN). Giannis Booker misses. Offensive rebound by Kobe Simmons! Kobe Simmons puts it back in!
Score: 54-38

[11:26] Team_079 possession (Score: 54-38)
Donovan Randle drives and kicks out. Bam Randle attempts a 3Pt. Contested by Michael Westbrook (4.6 feet, ZONE). BAM RANDLE MAKES IT! Assist: Khris Embiid
Score: 57-38

[11:08] Team_036 possession (Score: 57-38)
Giannis Booker drives and kicks out. Giannis Booker attempts a Midrange. Contested by Trae Durant (3.0 feet, ZONE). Giannis Booker misses. Rebound secured by Trae Durant.

[10:51] Team_079 possession (Score: 57-38)
Trae Durant attempts a Layup. Contested by Terry Durant (4.3 feet, MAN). TRAE DURANT MAKES IT! Assist: Donovan Randle
Score: 59-38

[10:37] Team_036 possession (Score: 59-38)
Terry Durant drives and kicks out. Anthony Poole attempts a 3Pt. BLOCKED BY TRAE DURANT! Ball is loose! Offensive rebound by Kobe Simmons! Kobe Simmons kicks it out.

[10:22] Team_036 possession (Score: 59-38)
Michael Westbrook attempts a Midrange. Contested by Miles Ming (4.6 feet, ZONE). MICHAEL WESTBROOK MAKES IT!
Score: 59-40

[10:07] Team_079 possession (Score: 59-40)
Trae Durant attempts a 3Pt. Contested by Terry Durant (4.3 feet, MAN). Trae Durant misses. Rebound secured by Giannis Booker.

[09:58] Team_036 possession (Score: 59-40)
Michael Westbrook attempts a 3Pt. Contested by Trae Durant (3.5 feet, ZONE). Michael Westbrook misses. Rebound secured by Trae Durant.

[09:46] Team_079 possession (Score: 59-40)
Khris Embiid drives, Michael Westbrook stays with him. Khris Embiid attempts a Layup. Contested by Michael Westbrook (4.9 feet, MAN). Khris Embiid misses. Rebound secured by Terry Durant.

[09:33] Team_036 possession (Score: 59-40)
Giannis Booker attempts a Layup. BLOCKED BY MILES MING! Ball is loose! Rebound secured by Bam Randle.

[09:20] Team_079 possession (Score: 59-40)
Bam Randle attempts a 3Pt. Contested by Anthony Poole (4.7 feet, MAN). BAM RANDLE MAKES IT! Assist: Khris Embiid
Score: 62-40

[09:05] Team_036 possession (Score: 62-40)
Anthony Poole attempts a Midrange. Contested by Miles Ming (4.8 feet, ZONE). ANTHONY POOLE MAKES IT! Assist: Giannis Booker
Score: 62-42

[08:51] Team_079 possession (Score: 62-42)
Khris Embiid attempts a Layup. BLOCKED BY KOBE SIMMONS! Ball is loose! Rebound secured by Kobe Simmons.

[08:36] Team_036 possession (Score: 62-42)
Giannis Booker drives, Trae Durant stays with him. Giannis Booker attempts a Dunk. Contested by Trae Durant (3.4 feet, ZONE). Giannis Booker misses. Rebound secured by Bam Randle.

[08:23] Team_079 possession (Score: 62-42)
Miles Ming attempts a 3Pt. Contested by Michael Westbrook (4.8 feet, ZONE). Miles Ming misses. Rebound secured by Terry Durant.

[08:11] Team_036 possession (Score: 62-42)
FOUL! Shooting foul on Miles Ming. Kobe Simmons to the line for 2 free throws. [Team fouls: 1] (Miles Ming: 1 personal fouls)   FT 1/2: MISS   FT 2/2: GOOD Kobe Simmons makes 1/2 from the line.
Score: 62-43

[07:56] Team_079 possession (Score: 62-43)
Miles Ming attempts a 3Pt. Contested by Giannis Booker (4.7 feet, MAN). Miles Ming misses. Offensive rebound by Donovan Randle! Donovan Randle kicks it out.

[07:43] Team_079 possession (Score: 62-43)
Bam Randle attempts a Midrange. Contested by Anthony Poole (4.7 feet, MAN). Bam Randle misses. Offensive rebound by Donovan Randle! Donovan Randle kicks it out.

[07:32] Team_079 possession (Score: 62-43)
Miles Ming attempts a 3Pt. Contested by Giannis Booker (4.7 feet, MAN). MILES MING MAKES IT!
Score: 65-43

[07:19] Team_036 possession (Score: 65-43)
FOUL! Reach-in foul on Trae Durant during the drive. [Team fouls: 2] No free throws, side out. (Trae Durant: 1 personal fouls)

[07:06] Team_036 possession (Score: 65-43)
Giannis Booker attempts a 3Pt. Contested by Trae Durant (3.4 feet, ZONE). Giannis Booker misses. Rebound secured by Donovan Randle.

[06:51] Team_079 possession (Score: 65-43)
Khris Embiid attempts a 3Pt. Contested by Michael Westbrook (4.9 feet, MAN). Khris Embiid misses. Rebound secured by Kobe Simmons.

[06:35] Team_036 possession (Score: 65-43)
Kobe Simmons makes the Layup and draws the foul on Donovan Randle! And-1! Kobe Simmons to the line for 1. [Team fouls: 3] (Donovan Randle: 1 personal fouls)   FT 1/1: GOOD Kobe Simmons makes 1/1 from the line.
Score: 65-46

[06:22] Team_079 possession (Score: 65-46)
Khris Embiid attempts a Midrange. Contested by Terry Durant (4.7 feet, ZONE). Khris Embiid misses. Rebound secured by Giannis Booker.

[06:04] Team_036 possession (Score: 65-46)
Anthony Poole drives, Bam Randle stays with him. Anthony Poole attempts a Layup. Contested by Bam Randle (4.9 feet, MAN). ANTHONY POOLE MAKES IT!
Score: 65-48

[05:52] Team_079 possession (Score: 65-48)
FOUL! Shooting foul on Kobe Simmons. Donovan Randle to the line for 2 free throws. [Team fouls: 2] (Kobe Simmons: 1 personal fouls)   FT 1/2: MISS   FT 2/2: GOOD Donovan Randle makes 1/2 from the line.
Score: 66-48

[05:35] Team_036 possession (Score: 66-48)
FOUL! Shooting foul on Donovan Randle. Kobe Simmons to the line for 2 free throws. [Team fouls: 4] (Donovan Randle: 2 personal fouls)   FT 1/2: GOOD   FT 2/2: GOOD Kobe Simmons makes 2/2 from the line.
Score: 66-50

[05:16] Team_079 possession (Score: 66-50)
Trae Durant attempts a 3Pt. Contested by Michael Westbrook (4.5 feet, ZONE). Trae Durant misses. Offensive rebound by Trae Durant! Trae Durant's putback is no good. Rebound secured by Terry Durant.

[05:06] Team_036 possession (Score: 66-50)
Anthony Poole attempts a 3Pt. Contested by Bam Randle (5.0 feet, MAN). Anthony Poole misses. Rebound secured by Donovan Randle.

[04:52] Team_079 possession (Score: 66-50)
Miles Ming makes the Dunk and draws the foul on Kobe Simmons! And-1! Miles Ming to the line for 1. [Team fouls: 3] (Kobe Simmons: 2 personal fouls)   FT 1/1: GOOD Miles Ming makes 1/1 from the line.
Score: 69-50

[04:40] Team_036 possession (Score: 69-50)
Giannis Booker drives to the basket... Giannis Booker throws a bad pass out of bounds! TURNOVER! (dead ball)

[04:27] Team_079 possession (Score: 69-50)
Donovan Randle attempts a Layup. Contested by Kobe Simmons (3.7 feet, ZONE). Donovan Randle misses. Rebound secured by Kobe Simmons.

[04:13] Team_036 possession (Score: 69-50)
Terry Durant drives to the basket... FOUL! Offensive foul on Terry Durant! Trae Durant drew the charge! [Team fouls: 4] (Terry Durant: 1 personal fouls) TURNOVER! (dead ball)

[03:56] Team_079 possession (Score: 69-50)
Khris Embiid attempts a 3Pt. Contested by Michael Westbrook (5.0 feet, ZONE). Khris Embiid misses. Rebound secured by Kobe Simmons.

[03:40] Team_036 possession (Score: 69-50)
Anthony Poole attempts a Midrange. Contested by Bam Randle (5.1 feet, MAN). Anthony Poole misses. Rebound secured by Trae Durant.

[03:26] Team_079 possession (Score: 69-50)
Bam Randle throws a bad pass! Stolen by Anthony Poole! TURNOVER! (live ball)

[03:12] Team_036 possession (Score: 69-50)
Giannis Booker attempts a 3Pt. Contested by Trae Durant (3.6 feet, ZONE). GIANNIS BOOKER MAKES IT! Assist: Anthony Poole
Score: 69-53

[02:54] Team_079 possession (Score: 69-53)
Donovan Randle attempts a Layup. Contested by Kobe Simmons (3.8 feet, ZONE). DONOVAN RANDLE MAKES IT! Assist: Khris Embiid
Score: 71-53

[02:39] Team_036 possession (Score: 71-53)
FOUL! Holding foul on Trae Durant. [IN THE BONUS! 5 team fouls] Terry Durant to the line for 2 free throws. (Trae Durant: 2 personal fouls)   FT 1/2: MISS   FT 2/2: GOOD Terry Durant makes 1/2 from the line.
Score: 71-54

[02:26] Team_079 possession (Score: 71-54)
Khris Embiid attempts a 3Pt. Contested by Michael Westbrook (5.1 feet, MAN). KHRIS EMBIID MAKES IT! Assist: Donovan Randle
Score: 74-54

[02:10] Team_036 possession (Score: 74-54)
Giannis Booker drives, Miles Ming stays with him. Giannis Booker attempts a Layup. Contested by Miles Ming (4.8 feet, MAN). GIANNIS BOOKER MAKES IT! Assist: Terry Durant
Score: 74-56

[01:55] Team_079 possession (Score: 74-56)
Miles Ming attempts a 3Pt. Contested by Giannis Booker (5.0 feet, MAN). Miles Ming misses. Rebound secured by Kobe Simmons.

[01:39] Team_036 possession (Score: 74-56)
Anthony Poole attempts a Layup. Contested by Trae Durant (4.0 feet, ZONE). Anthony Poole misses. Rebound secured by Donovan Randle.

[01:27] Team_079 possession (Score: 74-56)
FOUL! Holding foul on Terry Durant. [IN THE BONUS! 5 team fouls] Trae Durant to the line for 2 free throws. (Terry Durant: 2 personal fouls)   FT 1/2: GOOD   FT 2/2: GOOD Trae Durant makes 2/2 from the line.
Score: 76-56

[01:11] Team_036 possession (Score: 76-56)
Kobe Simmons drives, Donovan Randle stays with him. Kobe Simmons attempts a Layup. Contested by Donovan Randle (5.0 feet, MAN). KOBE SIMMONS MAKES IT! Assist: Anthony Poole
Score: 76-58

[00:59] Team_079 possession (Score: 76-58)
Trae Durant attempts a 3Pt. Contested by Terry Durant (4.7 feet, MAN). Trae Durant misses. FOUL! Loose ball foul on Kobe Simmons during the rebound battle. [IN THE BONUS! 6 team fouls] Trae Durant to the line for 2 free throws. (Kobe Simmons: 3 personal fouls)   FT 1/2: MISS   FT 2/2: GOOD Trae Durant makes 1/2 from the line.
Score: 77-58

[00:41] Team_036 possession (Score: 77-58)
Anthony Poole attempts a 3Pt. Contested by Bam Randle (5.4 feet, ZONE). ANTHONY POOLE MAKES IT! Assist: Kobe Simmons
Score: 77-61

[00:31] Team_079 possession (Score: 77-61)
Miles Ming attempts a 3Pt. Contested by Giannis Booker (5.1 feet, MAN). MILES MING MAKES IT! Assist: Khris Embiid
Score: 80-61

[00:19] Team_036 possession (Score: 80-61)
Michael Westbrook attempts a Midrange. Contested by Khris Embiid (5.4 feet, MAN). MICHAEL WESTBROOK MAKES IT!
Score: 80-63

[00:05] Team_079 possession (Score: 80-63)
Miles Ming makes the Layup and draws the foul on Kobe Simmons! And-1! Miles Ming to the line for 1. [BONUS: 7 team fouls] (Kobe Simmons: 4 personal fouls)   FT 1/1: GOOD Miles Ming makes 1/1 from the line.
Score: 83-63

================================================================================
                              3RD QUARTER COMPLETE                              
================================================================================

3RD QUARTER SCORE: Team_079 32, Team_036 27

BOX SCORE:
================================================================================

Team_079
--------------------------------------------------------------------------------
Player                MIN  PTS  REB  AST  TO      FG   FG%      3P   3P%
--------------------------------------------------------------------------------
Miles Ming             26   12    0    0   0   4/6    66.7     0/0   0.0
Bam Randle             26    9    2    0   0   3/3   100.0     0/0   0.0
Trae Durant            26    5    3    0   0   3/5    60.0     0/0   0.0
Khris Embiid           26    3    0    4   0   1/6    16.7     0/0   0.0
Donovan Randle         26    3    5    2   0   2/3    66.7     0/0   0.0

TEAM: FG: 13/23 (56.5%), 3PT: 5/11 (45.5%), REB: 11 (3 off, 8 def), AST: 6, TO: 1
TEAM FOULS: 5 [Team_036 in BONUS]


Team_036
--------------------------------------------------------------------------------
Player                MIN  PTS  REB  AST  TO      FG   FG%      3P   3P%
--------------------------------------------------------------------------------
Kobe Simmons           26   10    7    1   0   5/5   100.0     0/0   0.0
Anthony Poole          26    7    0    2   0   3/6    50.0     0/0   0.0
Giannis Booker         26    5    2    1   0   2/6    33.3     0/0   0.0
Michael Westbrook      26    4    0    0   0   2/3    66.7     0/0   0.0
Terry Durant           26    1    3    1   0   1/1   100.0     0/0   0.0

TEAM: FG: 13/21 (61.9%), 3PT: 3/6 (50.0%), REB: 11 (2 off, 9 def), AST: 5, TO: 2
TEAM FOULS: 7 [Team_079 in BONUS]

================================================================================

================================================================================
                       4TH QUARTER - Team_079 vs Team_036                       
================================================================================

[12:00] Team_079 possession (Score: 83-63)
Donovan Randle attempts a Midrange. Contested by Kobe Simmons (4.0 feet, MAN). Donovan Randle misses. Rebound secured by Kobe Simmons.

[11:44] Team_036 possession (Score: 83-63)
Terry Durant attempts a 3Pt. Contested by Miles Ming (4.9 feet, ZONE). Terry Durant misses. Rebound secured by Donovan Randle.

[11:27] Team_079 possession (Score: 83-63)
Donovan Randle drives and kicks out. Donovan Randle attempts a 3Pt. Contested by Michael Westbrook (5.0 feet, ZONE). DONOVAN RANDLE MAKES IT! Assist: Miles Ming
Score: 86-63

[11:11] Team_036 possession (Score: 86-63)
Giannis Booker attempts a 3Pt. Contested by Miles Ming (4.9 feet, MAN). Giannis Booker misses. Rebound secured by Trae Durant.

[10:58] Team_079 possession (Score: 86-63)
Miles Ming attempts a 3Pt. Contested by Michael Westbrook (5.2 feet, ZONE). MILES MING MAKES IT! Assist: Trae Durant
Score: 89-63

[10:41] Team_036 possession (Score: 89-63)
FOUL! Shooting foul on Trae Durant. Terry Durant to the line for 2 free throws. [Team fouls: 1] (Trae Durant: 1 personal fouls)   FT 1/2: MISS   FT 2/2: GOOD Terry Durant makes 1/2 from the line.
Score: 89-64

[10:28] Team_079 possession (Score: 89-64)
Donovan Randle attempts a Midrange. Contested by Kobe Simmons (4.1 feet, MAN). DONOVAN RANDLE MAKES IT!
Score: 91-64

[10:10] Team_036 possession (Score: 91-64)
Terry Durant attempts a Midrange. Contested by Trae Durant (3.9 feet, MAN). Terry Durant misses. Rebound secured by Bam Randle.

[09:53] Team_079 possession (Score: 91-64)
Bam Randle makes the Layup and draws the foul on Anthony Poole! And-1! Bam Randle to the line for 1. [Team fouls: 1] (Anthony Poole: 1 personal fouls)   FT 1/1: GOOD Bam Randle makes 1/1 from the line.
Score: 94-64

[09:36] Team_036 possession (Score: 94-64)
Anthony Poole drives and kicks out. FOUL! Shooting foul on Trae Durant. Terry Durant to the line for 3 free throws. [Team fouls: 2] (Trae Durant: 2 personal fouls)   FT 1/3: GOOD   FT 2/3: GOOD   FT 3/3: GOOD Terry Durant makes 3/3 from the line.
Score: 94-67

[09:24] Team_079 possession (Score: 94-67)
Khris Embiid drives, Michael Westbrook stays with him. Khris Embiid attempts a Layup. Contested by Michael Westbrook (5.4 feet, MAN). Khris Embiid misses. Rebound secured by Kobe Simmons.

[09:09] Team_036 possession (Score: 94-67)
Michael Westbrook attempts a 3Pt. Contested by Trae Durant (4.0 feet, ZONE). MICHAEL WESTBROOK MAKES IT!
Score: 94-70

[08:54] Team_079 possession (Score: 94-70)
Trae Durant attempts a 3Pt. Contested by Terry Durant (4.9 feet, MAN). Trae Durant misses. Rebound secured by Giannis Booker.

[08:37] Team_036 possession (Score: 94-70)
Giannis Booker drives, Trae Durant stays with him. Giannis Booker attempts a Dunk. Contested by Trae Durant (4.0 feet, ZONE). Giannis Booker misses. Rebound secured by Trae Durant.

[08:25] Team_079 possession (Score: 94-70)
Bam Randle attempts a Midrange. Contested by Anthony Poole (5.3 feet, MAN). BAM RANDLE MAKES IT! Assist: Miles Ming
Score: 96-70

[08:15] Team_036 possession (Score: 96-70)
Giannis Booker attempts a Midrange. Contested by Miles Ming (5.2 feet, MAN). GIANNIS BOOKER MAKES IT! Assist: Kobe Simmons
Score: 96-72

[08:02] Team_079 possession (Score: 96-72)
Miles Ming attempts a Midrange. Contested by Giannis Booker (5.3 feet, MAN). Miles Ming misses. Rebound secured by Terry Durant.

[07:45] Team_036 possession (Score: 96-72)
Kobe Simmons attempts a Layup. Contested by Donovan Randle (5.5 feet, MAN). Kobe Simmons misses. Rebound secured by Trae Durant.

[07:33] Team_079 possession (Score: 96-72)
Khris Embiid drives, Michael Westbrook stays with him. Khris Embiid attempts a Layup. Contested by Michael Westbrook (5.6 feet, MAN). KHRIS EMBIID MAKES IT! Assist: Miles Ming
Score: 98-72

[07:22] Team_036 possession (Score: 98-72)
Terry Durant attempts a 3Pt. Contested by Trae Durant (4.2 feet, ZONE). Terry Durant misses. Rebound secured by Trae Durant.

[07:05] Team_079 possession (Score: 98-72)
Bam Randle attempts a 3Pt. Contested by Anthony Poole (5.5 feet, MAN). Bam Randle misses. Rebound secured by Kobe Simmons.

[06:53] Team_036 possession (Score: 98-72)
Terry Durant attempts a Midrange. Contested by Trae Durant (4.3 feet, MAN). Terry Durant misses. Offensive rebound by Terry Durant! Terry Durant kicks it out.

[06:38] Team_036 possession (Score: 98-72)
Giannis Booker attempts a 3Pt. Contested by Khris Embiid (5.7 feet, ZONE). Giannis Booker misses. Rebound secured by Trae Durant.

[06:27] Team_079 possession (Score: 98-72)
Trae Durant makes the Layup and draws the foul on Giannis Booker! And-1! Trae Durant to the line for 1. [Team fouls: 2] (Giannis Booker: 1 personal fouls)   FT 1/1: GOOD Trae Durant makes 1/1 from the line.
Score: 101-72

[06:12] Team_036 possession (Score: 101-72)
Michael Westbrook attempts a 3Pt. Contested by Khris Embiid (5.8 feet, MAN). MICHAEL WESTBROOK MAKES IT! Assist: Terry Durant
Score: 101-75

[05:57] Team_079 possession (Score: 101-75)
Donovan Randle attempts a Midrange. Contested by Terry Durant (5.6 feet, ZONE). Donovan Randle misses. Rebound secured by Kobe Simmons.

[05:42] Team_036 possession (Score: 101-75)
Terry Durant attempts a 3Pt. Contested by Trae Durant (4.4 feet, ZONE). Terry Durant misses. Offensive rebound by Kobe Simmons! Kobe Simmons puts it back in!
Score: 101-77

[05:30] Team_079 possession (Score: 101-77)
Miles Ming throws a bad pass out of bounds! TURNOVER! (dead ball)

[05:30] Substitution (Team_079): Khris Embiid OUT → Evan Mobley IN (stamina_rule2)

[05:30] Substitution (Team_079): Miles Ming OUT → Karl Ingram IN (stamina_rule2)

[05:30] Substitution (Team_079): Bam Randle OUT → Anthony Wade IN (stamina_rule2)

[05:30] Substitution (Team_079): Trae Durant OUT → Kobe Curry IN (stamina_rule2)

[05:30] Substitution (Team_079): Donovan Randle OUT → James LaVine IN (stamina_rule2)

[05:30] Substitution (Team_036): Michael Westbrook OUT → Dirk Anunoby IN (stamina_rule2)

[05:30] Substitution (Team_036): Giannis Booker OUT → Tobias Fox IN (stamina_rule2)

[05:30] Substitution (Team_036): Anthony Poole OUT → Pascal Antetokounmpo IN (stamina_rule2)

[05:30] Substitution (Team_036): Terry Durant OUT → Devin Simmons IN (stamina_rule2)

[05:30] Substitution (Team_036): Kobe Simmons OUT → Bradley Murray IN (stamina_rule2)

[05:17] Team_036 possession (Score: 101-77)
Devin Simmons attempts a 3Pt. Wide open! Anthony Wade is 6.2 feet away. [ZONE] DEVIN SIMMONS MAKES IT! Assist: Tobias Fox
Score: 101-80

[05:01] Team_079 possession (Score: 101-80)
James LaVine drives, Devin Simmons stays with him. James LaVine attempts a Layup. Contested by Devin Simmons (5.3 feet, ZONE). James LaVine misses. Rebound secured by Devin Simmons.

[04:47] Team_036 possession (Score: 101-80)
FOUL! Holding foul on Anthony Wade. [Team fouls: 3] No free throws, side out. (Anthony Wade: 1 personal fouls)

[04:36] Team_036 possession (Score: 101-80)
FOUL! Reach-in foul on Karl Ingram during the drive. [Team fouls: 4] No free throws, side out. (Karl Ingram: 1 personal fouls)

[04:24] Team_036 possession (Score: 101-80)
Pascal Antetokounmpo drives and kicks out. Pascal Antetokounmpo attempts a Midrange. Wide open! Anthony Wade is 6.0 feet away. [MAN] PASCAL ANTETOKOUNMPO MAKES IT! Assist: Bradley Murray
Score: 101-82

[04:09] Team_079 possession (Score: 101-82)
Anthony Wade attempts a 3Pt. Contested by Pascal Antetokounmpo (4.9 feet, ZONE). Anthony Wade misses. Rebound secured by Pascal Antetokounmpo.

[03:55] Team_036 possession (Score: 101-82)
Dirk Anunoby attempts a 3Pt. Contested by Evan Mobley (4.9 feet, MAN). Dirk Anunoby misses. Offensive rebound by Devin Simmons! Devin Simmons kicks it out.

[03:38] Team_036 possession (Score: 101-82)
Devin Simmons attempts a 3Pt. Contested by Kobe Curry (4.7 feet, MAN). Devin Simmons misses. Rebound secured by Kobe Curry.

[03:25] Team_079 possession (Score: 101-82)
Karl Ingram attempts a Midrange. Contested by Tobias Fox (4.6 feet, MAN). Karl Ingram misses. Rebound secured by Pascal Antetokounmpo.

[03:07] Team_036 possession (Score: 101-82)
Pascal Antetokounmpo attempts a Layup. BLOCKED BY JAMES LAVINE! Ball is loose! Offensive rebound by Bradley Murray! Bradley Murray kicks it out.

[02:52] Team_036 possession (Score: 101-82)
Devin Simmons attempts a 3Pt. Contested by Kobe Curry (4.7 feet, MAN). DEVIN SIMMONS MAKES IT! Assist: Pascal Antetokounmpo
Score: 101-85

[02:37] Team_079 possession (Score: 101-85)
James LaVine attempts a Layup. Contested by Bradley Murray (4.7 feet, MAN). James LaVine misses. Rebound secured by Pascal Antetokounmpo.

[02:22] Team_036 possession (Score: 101-85)
Tobias Fox attempts a Layup. Contested by James LaVine (4.5 feet, ZONE). TOBIAS FOX MAKES IT!
Score: 101-87

[02:09] Team_079 possession (Score: 101-87)
Anthony Wade attempts a 3Pt. Contested by Pascal Antetokounmpo (4.9 feet, MAN). Anthony Wade misses. Rebound secured by Bradley Murray.

[01:54] Team_036 possession (Score: 101-87)
FOUL! Reach-in foul on Kobe Curry during the drive. [IN THE BONUS! 6 team fouls] Pascal Antetokounmpo to the line for 2 free throws. (Kobe Curry: 1 personal fouls)   FT 1/2: GOOD   FT 2/2: MISS Pascal Antetokounmpo makes 1/2 from the line. FOUL! Loose ball foul on Anthony Wade during the free throw rebound! [IN THE BONUS! 7 team fouls] Devin Simmons to the line for 2 free throws. (Anthony Wade: 2 personal fouls)   FT 1/2: GOOD   FT 2/2: MISS Devin Simmons makes 1/2 from the line. Rebound secured by Anthony Wade.
Score: 101-89

[01:40] Team_079 possession (Score: 101-89)
Kobe Curry attempts a Layup. Contested by Devin Simmons (5.4 feet, ZONE). Kobe Curry misses. Offensive rebound by Kobe Curry! Kobe Curry kicks it out.

[01:28] Team_079 possession (Score: 101-89)
Karl Ingram attempts a Layup. Contested by Devin Simmons (5.3 feet, ZONE). KARL INGRAM MAKES IT! Assist: Anthony Wade
Score: 103-89

[01:10] Team_036 possession (Score: 103-89)
FOUL! Holding foul on Anthony Wade. [IN THE BONUS! 8 team fouls] Pascal Antetokounmpo to the line for 2 free throws. (Anthony Wade: 3 personal fouls)   FT 1/2: GOOD   FT 2/2: GOOD Pascal Antetokounmpo makes 2/2 from the line.
Score: 103-91

[00:56] Team_079 possession (Score: 103-91)
Anthony Wade makes the Layup and draws the foul on Devin Simmons! And-1! Anthony Wade to the line for 1. [Team fouls: 3] (Devin Simmons: 1 personal fouls)   FT 1/1: GOOD Anthony Wade makes 1/1 from the line.
Score: 106-91

[00:47] Team_036 possession (Score: 106-91)
Devin Simmons attempts a 3Pt. Contested by Evan Mobley (4.6 feet, ZONE). Devin Simmons misses. Offensive rebound by Devin Simmons! Devin Simmons kicks it out.

[00:29] Team_036 possession (Score: 106-91)
FOUL! Shooting foul on Evan Mobley. Dirk Anunoby to the line for 3 free throws. [BONUS: 9 team fouls] (Evan Mobley: 1 personal fouls)   FT 1/3: MISS   FT 2/3: GOOD   FT 3/3: GOOD Dirk Anunoby makes 2/3 from the line.
Score: 106-93

[00:14] Team_079 possession (Score: 106-93)
Evan Mobley attempts a 3Pt. Wide open! Dirk Anunoby is 6.0 feet away. [MAN] Evan Mobley misses. Rebound secured by Devin Simmons.

================================================================================
                              4TH QUARTER COMPLETE                              
================================================================================

4TH QUARTER SCORE: Team_079 23, Team_036 30

BOX SCORE:
================================================================================

Team_079
--------------------------------------------------------------------------------
Player                MIN  PTS  REB  AST  TO      FG   FG%      3P   3P%
--------------------------------------------------------------------------------
Donovan Randle         33    5    1    0   0   2/4    50.0     0/0   0.0
Bam Randle             33    5    1    0   0   2/3    66.7     0/0   0.0
Miles Ming             33    3    0    3   0   1/2    50.0     0/0   0.0
Trae Durant            33    3    5    1   0   1/2    50.0     0/0   0.0
Anthony Wade           16    3    1    1   0   1/3    33.3     0/0   0.0
Khris Embiid           33    2    0    0   0   1/2    50.0     0/0   0.0
Karl Ingram            16    2    0    0   0   1/2    50.0     0/0   0.0
James LaVine           16    0    0    0   0   0/2     0.0     0/0   0.0
Kobe Curry             16    0    2    0   0   0/0     0.0     0/0   0.0
Evan Mobley            16    0    0    0   0   0/1     0.0     0/0   0.0

TEAM: FG: 9/21 (42.9%), 3PT: 1/6 (16.7%), REB: 10 (1 off, 9 def), AST: 5, TO: 1
TEAM FOULS: 9 [Team_036 in BONUS]


Team_036
--------------------------------------------------------------------------------
Player                MIN  PTS  REB  AST  TO      FG   FG%      3P   3P%
--------------------------------------------------------------------------------
Michael Westbrook      33    6    0    0   0   2/2   100.0     0/0   0.0
Devin Simmons          16    6    4    0   0   2/3    66.7     0/0   0.0
Terry Durant           33    4    2    1   0   2/5    40.0     0/0   0.0
Pascal Antetokounmpo   16    4    3    1   0   2/3    66.7     0/0   0.0
Kobe Simmons           33    2    5    1   0   1/2    50.0     0/0   0.0
Giannis Booker         33    2    1    0   0   1/4    25.0     0/0   0.0
Tobias Fox             16    2    0    1   0   1/1   100.0     0/0   0.0
Dirk Anunoby           16    2    0    0   0   1/1   100.0     0/0   0.0
Bradley Murray         16    0    2    1   0   0/0     0.0     0/0   0.0

TEAM: FG: 12/21 (57.1%), 3PT: 6/11 (54.5%), REB: 17 (5 off, 12 def), AST: 5, TO: 0
TEAM FOULS: 3

================================================================================

================================================================================
                               FULL GAME COMPLETE                               
================================================================================

FINAL SCORE: Team_079 106, Team_036 93

SCORING BY QUARTER:
--------------------------------------------------------------------------------
Team                     Q1     Q2     Q3     Q4    FINAL
--------------------------------------------------------------------------------
Team_079                 22     29     32     23      106
Team_036                 20     16     27     30       93
--------------------------------------------------------------------------------

FULL GAME BOX SCORE:
================================================================================

Team_079
--------------------------------------------------------------------------------
Player                MIN  PTS  REB  AST  TO      FG   FG%      3P   3P%      FT STL BLK
--------------------------------------------------------------------------------
Khris Embiid           33   18    0    4   2   8/15   53.3   2/5    40.0   2/2     1   0
Miles Ming             33   20    0    4   1   7/11   63.6   4/7    57.1   2/2     0   1
Bam Randle             33   17    3    1   2   5/8    62.5   2/5    40.0   2/2     0   0
Trae Durant            33   11   17    4   1   4/10   40.0   2/5    40.0   4/5     1   2
Donovan Randle         33    8   15    5   0   5/12   41.7   0/1     0.0   3/5     1   0
Evan Mobley            16    7    0    1   0   3/6    50.0   1/3    33.3   0/0     0   0
Karl Ingram            16    5    0    2   0   2/3    66.7   1/1   100.0   0/0     0   0
Anthony Wade           16    6    2    1   1   2/6    33.3   0/3     0.0   2/2     1   0
Kobe Curry             16    2    9    3   0   1/2    50.0   0/0     0.0   0/0     0   0
James LaVine           16   10    5    1   0   5/7    71.4   1/1   100.0   0/0     1   1

TEAM: FG: 43/81 (53.1%), 3PT: 13/31 (41.9%), REB: 52 (19 off, 33 def), AST: 26, TO: 7


Team_036
--------------------------------------------------------------------------------
Player                MIN  PTS  REB  AST  TO      FG   FG%      3P   3P%      FT STL BLK
--------------------------------------------------------------------------------
Michael Westbrook      33   12    0    2   3   5/7    71.4   2/3    66.7   2/2     0   0
Giannis Booker         33   13    5    1   1   6/13   46.2   3/6    50.0   1/1     0   0
Anthony Poole          33   10    0    2   1   5/10   50.0   2/4    50.0   0/0     1   0
Terry Durant           33   15   11    3   0   6/11   54.5   1/4    25.0   9/11    0   0
Kobe Simmons           33   14   16    2   1   6/12   50.0   1/1   100.0   4/5     0   1
Dirk Anunoby           16    4    0    0   1   2/3    66.7   1/1   100.0   2/3     0   0
Tobias Fox             16    6    0    1   0   2/2   100.0   0/0     0.0   2/2     0   0
Pascal Antetokounmpo   16    9    6    1   1   5/9    55.6   0/0     0.0   6/8     0   0
Devin Simmons          16    8    7    1   0   3/4    75.0   2/3    66.7   0/0     1   1
Bradley Murray         16    0    5    2   1   0/3     0.0   0/1     0.0   0/0     0   0

TEAM: FG: 42/76 (55.3%), 3PT: 12/23 (52.2%), REB: 49 (13 off, 36 def), AST: 15, TO: 9

================================================================================
