================================================================================
                        FULL GAME - Team_032 vs Team_018                        
================================================================================

================================================================================
                       1ST QUARTER - Team_032 vs Team_018                       
================================================================================

[12:00] Team_032 possession (Score: 0-0)
Malcolm Lillard attempts a Layup. Contested by Domantas Wall (3.8 feet, MAN). MALCOLM LILLARD MAKES IT! Assist: Jalen Westbrook
Score: 2-0

[11:44] Team_018 possession (Score: 2-0)
Domantas Wall attempts a 3Pt. Contested by Jalen Westbrook (5.1 feet, ZONE). Domantas Wall misses. Rebound secured by Malcolm Lillard.

[11:30] Team_032 possession (Score: 2-0)
DeMar Giddey attempts a 3Pt. Contested by Klay Stewart (4.4 feet, ZONE). DeMar Giddey misses. Rebound secured by Domantas Wall.

[11:15] Team_018 possession (Score: 2-0)
FOUL! Holding foul on Jalen Westbrook. [Team fouls: 1] No free throws, side out. (Jalen Westbrook: 1 personal fouls)

[11:01] Team_018 possession (Score: 2-0)
Allen Markkanen attempts a 3Pt. Contested by Jalen Westbrook (5.2 feet, MAN). ALLEN MARKKANEN MAKES IT! Assist: Klay Stewart
Score: 2-3

[10:51] Team_032 possession (Score: 2-3)
FOUL! Shooting foul on Allen Markkanen. Anfernee Butler to the line for 2 free throws. [Team fouls: 1] (Allen Markkanen: 1 personal fouls)   FT 1/2: GOOD   FT 2/2: GOOD Anfernee Butler makes 2/2 from the line.
Score: 4-3

[10:36] Team_018 possession (Score: 4-3)
Allen Markkanen attempts a 3Pt. Contested by Jalen Westbrook (5.2 feet, MAN). Allen Markkanen misses. Rebound secured by Malcolm Lillard.

[10:19] Team_032 possession (Score: 4-3)
DeMar Giddey drives and kicks out. Jalen Westbrook attempts a Midrange. Contested by Allen Markkanen (3.8 feet, ZONE). Jalen Westbrook misses. Offensive rebound by Anfernee Butler! Anfernee Butler kicks it out.

[10:03] Team_032 possession (Score: 4-3)
Tobias Bane makes the Dunk and draws the foul on Klay Stewart! And-1! Tobias Bane to the line for 1. [Team fouls: 2] (Klay Stewart: 1 personal fouls)   FT 1/1: GOOD Tobias Bane makes 1/1 from the line.
Score: 7-3

[09:45] Team_018 possession (Score: 7-3)
FOUL! Reach-in foul on DeMar Giddey during the drive. [Team fouls: 2] No free throws, side out. (DeMar Giddey: 1 personal fouls)

[09:32] Team_018 possession (Score: 7-3)
Allen Markkanen attempts a 3Pt. Contested by Jalen Westbrook (5.2 feet, MAN). Allen Markkanen misses. Offensive rebound by Domantas Wall! Domantas Wall puts it back in!
Score: 7-5

[09:18] Team_032 possession (Score: 7-5)
Anfernee Butler attempts a 3Pt. Contested by Klay Stewart (3.8 feet, ZONE). Anfernee Butler misses. Rebound secured by Domantas Wall.

[09:01] Team_018 possession (Score: 7-5)
Bones Anunoby drives, Anfernee Butler stays with him. Bones Anunoby attempts a Layup. Contested by Anfernee Butler (4.2 feet, MAN). BONES ANUNOBY MAKES IT!
Score: 7-7

[08:47] Team_032 possession (Score: 7-7)
Jalen Westbrook drives to the basket... FOUL! Offensive foul on Jalen Westbrook! Domantas Wall drew the charge! [Team fouls: 3] (Jalen Westbrook: 2 personal fouls) TURNOVER! (dead ball)

[08:37] Team_018 possession (Score: 7-7)
Bones Anunoby makes the Dunk and draws the foul on Anfernee Butler! And-1! Bones Anunoby to the line for 1. [Team fouls: 4] (Anfernee Butler: 1 personal fouls)   FT 1/1: GOOD Bones Anunoby makes 1/1 from the line.
Score: 7-10

[08:24] Team_032 possession (Score: 7-10)
Malcolm Lillard attempts a Midrange. Contested by Domantas Wall (3.8 feet, MAN). Malcolm Lillard misses. Rebound secured by Domantas Wall.

[08:06] Team_018 possession (Score: 7-10)
Allen Markkanen attempts a Layup. Contested by Malcolm Lillard (5.0 feet, ZONE). ALLEN MARKKANEN MAKES IT! Assist: Klay Stewart
Score: 7-12

[07:56] Team_032 possession (Score: 7-12)
Malcolm Lillard loses control! Ball rolls out of bounds! TURNOVER! (dead ball)

[07:41] Team_018 possession (Score: 7-12)
Allen Markkanen attempts a 3Pt. Contested by Tobias Bane (4.7 feet, ZONE). ALLEN MARKKANEN MAKES IT! Assist: Bones Anunoby
Score: 7-15

[07:24] Team_032 possession (Score: 7-15)
DeMar Giddey attempts a Midrange. Contested by Tracy Bryant (3.7 feet, ZONE). DeMar Giddey misses. Offensive rebound by Anfernee Butler! Anfernee Butler kicks it out.

[07:14] Team_032 possession (Score: 7-15)
Jalen Westbrook loses control! Ball rolls out of bounds! TURNOVER! (dead ball)

[06:56] Team_018 possession (Score: 7-15)
Bones Anunoby attempts a Midrange. Contested by Anfernee Butler (4.2 feet, MAN). Bones Anunoby misses. Offensive rebound by Domantas Wall! Domantas Wall's putback is no good. Offensive rebound by Domantas Wall! Domantas Wall kicks it out.

[06:40] Team_018 possession (Score: 7-15)
Domantas Wall drives and kicks out. Tracy Bryant attempts a Midrange. Contested by DeMar Giddey (3.9 feet, MAN). TRACY BRYANT MAKES IT! Assist: Bones Anunoby
Score: 7-17

[06:22] Team_032 possession (Score: 7-17)
Tobias Bane attempts a 3Pt. Contested by Klay Stewart (4.3 feet, MAN). Tobias Bane misses. FOUL! Loose ball foul on Domantas Wall during the rebound battle. [Team fouls: 3] No free throws, side out. (Domantas Wall: 1 personal fouls)

[06:05] Team_032 possession (Score: 7-17)
Anfernee Butler attempts a Layup. Contested by Bones Anunoby (3.0 feet, MAN). Anfernee Butler misses. Rebound secured by Domantas Wall.

[05:51] Team_018 possession (Score: 7-17)
Tracy Bryant throws a bad pass! Stolen by DeMar Giddey! TURNOVER! (live ball)

[05:36] Team_032 possession (Score: 7-17)
FOUL! Holding foul on Domantas Wall. [Team fouls: 4] No free throws, side out. (Domantas Wall: 2 personal fouls)

[05:22] Team_032 possession (Score: 7-17)
Tobias Bane attempts a 3Pt. Contested by Klay Stewart (4.3 feet, MAN). Tobias Bane misses. Rebound secured by Bones Anunoby.

[05:04] Team_018 possession (Score: 7-17)
Tracy Bryant makes the Midrange and draws the foul on DeMar Giddey! And-1! Tracy Bryant to the line for 1. [BONUS: 6 team fouls] (DeMar Giddey: 2 personal fouls)   FT 1/1: GOOD Tracy Bryant makes 1/1 from the line.
Score: 7-20

[04:49] Team_032 possession (Score: 7-20)
Anfernee Butler attempts a 3Pt. Contested by Bones Anunoby (3.0 feet, MAN). Anfernee Butler misses. Offensive rebound by Malcolm Lillard! Malcolm Lillard kicks it out.

[04:34] Team_032 possession (Score: 7-20)
DeMar Giddey attempts a 3Pt. Contested by Tracy Bryant (3.7 feet, MAN). DeMar Giddey misses. Rebound secured by Bones Anunoby.

[04:25] Team_018 possession (Score: 7-20)
Domantas Wall drives, Malcolm Lillard stays with him. Domantas Wall attempts a Dunk. Contested by Malcolm Lillard (4.9 feet, ZONE). Domantas Wall misses. Rebound secured by Tobias Bane.

[04:10] Team_032 possession (Score: 7-20)
Jalen Westbrook attempts a Layup. BLOCKED BY ALLEN MARKKANEN! Ball is loose! Rebound secured by Bones Anunoby.

[03:56] Team_018 possession (Score: 7-20)
Klay Stewart attempts a 3Pt. Contested by Tobias Bane (4.6 feet, MAN). Klay Stewart misses. Rebound secured by Malcolm Lillard.

[03:42] Team_032 possession (Score: 7-20)
Jalen Westbrook drives and kicks out. Jalen Westbrook makes the Midrange and draws the foul on Bones Anunoby! And-1! Jalen Westbrook to the line for 1. [BONUS: 5 team fouls] (Bones Anunoby: 1 personal fouls)   FT 1/1: GOOD Jalen Westbrook makes 1/1 from the line.
Score: 10-20

[03:28] Team_018 possession (Score: 10-20)
Tracy Bryant attempts a 3Pt. Contested by Tobias Bane (4.8 feet, ZONE). Tracy Bryant misses. Rebound secured by Anfernee Butler.

[03:12] Team_032 possession (Score: 10-20)
DeMar Giddey attempts a 3Pt. Contested by Klay Stewart (4.5 feet, ZONE). DEMAR GIDDEY MAKES IT! Assist: Tobias Bane
Score: 13-20

[02:57] Team_018 possession (Score: 13-20)
Domantas Wall attempts a Layup. Contested by Malcolm Lillard (5.0 feet, ZONE). Domantas Wall misses. Rebound secured by Tobias Bane.

[02:42] Team_032 possession (Score: 13-20)
DeMar Giddey drives, Domantas Wall stays with him. DeMar Giddey attempts a Layup. Contested by Domantas Wall (4.1 feet, ZONE). DeMar Giddey misses. Rebound secured by Domantas Wall.

[02:26] Team_018 possession (Score: 13-20)
Tracy Bryant attempts a 3Pt. Contested by DeMar Giddey (4.5 feet, ZONE). TRACY BRYANT MAKES IT! Assist: Klay Stewart
Score: 13-23

[02:15] Team_032 possession (Score: 13-23)
Jalen Westbrook drives and kicks out. DeMar Giddey attempts a 3Pt. Contested by Klay Stewart (4.3 feet, ZONE). DeMar Giddey misses. Rebound secured by Domantas Wall.

[02:02] Team_018 possession (Score: 13-23)
Allen Markkanen drives, Jalen Westbrook stays with him. Allen Markkanen attempts a Layup. Contested by Jalen Westbrook (5.5 feet, MAN). Allen Markkanen misses. Rebound secured by Tobias Bane.

[01:47] Team_032 possession (Score: 13-23)
Malcolm Lillard attempts a Midrange. Contested by Bones Anunoby (4.1 feet, ZONE). Malcolm Lillard misses. Offensive rebound by Malcolm Lillard! Malcolm Lillard kicks it out.

[01:34] Team_032 possession (Score: 13-23)
Tobias Bane attempts a Midrange. Contested by Tracy Bryant (3.9 feet, ZONE). TOBIAS BANE MAKES IT! Assist: DeMar Giddey
Score: 15-23

[01:15] Team_018 possession (Score: 15-23)
Klay Stewart attempts a 3Pt. Contested by Tobias Bane (4.9 feet, MAN). Klay Stewart misses. Rebound secured by Malcolm Lillard.

[01:00] Team_032 possession (Score: 15-23)
FOUL! Shooting foul on Klay Stewart. DeMar Giddey to the line for 3 free throws. [BONUS: 6 team fouls] (Klay Stewart: 2 personal fouls)   FT 1/3: GOOD   FT 2/3: MISS   FT 3/3: GOOD DeMar Giddey makes 2/3 from the line.
Score: 17-23

[00:46] Team_018 possession (Score: 17-23)
Tracy Bryant makes the Dunk and draws the foul on Malcolm Lillard! And-1! Tracy Bryant to the line for 1. [BONUS: 7 team fouls] (Malcolm Lillard: 2 personal fouls)   FT 1/1: GOOD Tracy Bryant makes 1/1 from the line.
Score: 17-26

[00:30] Team_032 possession (Score: 17-26)
FOUL! Holding foul on Tracy Bryant. [IN THE BONUS! 7 team fouls] DeMar Giddey to the line for 2 free throws. (Tracy Bryant: 1 personal fouls)   FT 1/2: MISS   FT 2/2: GOOD DeMar Giddey makes 1/2 from the line.
Score: 18-26

[00:17] Team_018 possession (Score: 18-26)
Allen Markkanen drives, Jalen Westbrook stays with him. Allen Markkanen attempts a Dunk. Contested by Jalen Westbrook (5.7 feet, MAN). ALLEN MARKKANEN MAKES IT! Assist: Bones Anunoby
Score: 18-28

[00:04] Team_032 possession (Score: 18-28)
Jalen Westbrook attempts a 3Pt. Contested by Klay Stewart (4.8 feet, ZONE). Jalen Westbrook misses. Offensive rebound by Anfernee Butler! Anfernee Butler kicks it out.

================================================================================
                              1ST QUARTER COMPLETE                              
================================================================================

1ST QUARTER SCORE: Team_032 18, Team_018 28

BOX SCORE:
================================================================================

Team_032
--------------------------------------------------------------------------------
Player                MIN  PTS  REB  AST  TO      FG   FG%      3P   3P%
--------------------------------------------------------------------------------
DeMar Giddey           12    6    0    1   0   3/6    50.0     0/0   0.0
Tobias Bane            12    5    3    1   0   2/3    66.7     0/0   0.0
Jalen Westbrook        12    3    0    1   0   1/3    33.3     0/0   0.0
Malcolm Lillard        12    2    7    0   0   1/2    50.0     0/0   0.0
Anfernee Butler        12    2    4    0   0   1/3    33.3     0/0   0.0

TEAM: FG: 8/17 (47.1%), 3PT: 2/6 (33.3%), REB: 14 (6 off, 8 def), AST: 3, TO: 3
TEAM FOULS: 7 [Team_018 in BONUS]


Team_018
--------------------------------------------------------------------------------
Player                MIN  PTS  REB  AST  TO      FG   FG%      3P   3P%
--------------------------------------------------------------------------------
Tracy Bryant           12   11    0    0   0   4/5    80.0     0/0   0.0
Allen Markkanen        12   10    0    0   0   4/6    66.7     0/0   0.0
Bones Anunoby          12    5    3    3   0   2/2   100.0     0/0   0.0
Domantas Wall          12    2    8    0   0   1/4    25.0     0/0   0.0
Klay Stewart           12    0    0    3   0   0/2     0.0     0/0   0.0

TEAM: FG: 11/19 (57.9%), 3PT: 4/9 (44.4%), REB: 11 (2 off, 9 def), AST: 6, TO: 1
TEAM FOULS: 7 [Team_032 in BONUS]

================================================================================

================================================================================
                       2ND QUARTER - Team_032 vs Team_018                       
================================================================================

[12:00] Team_032 possession (Score: 18-28)
Jalen Westbrook attempts a Layup. Contested by Allen Markkanen (4.2 feet, MAN). JALEN WESTBROOK MAKES IT!
Score: 20-28

[11:45] Team_018 possession (Score: 20-28)
Domantas Wall attempts a Midrange. Contested by Malcolm Lillard (5.1 feet, MAN). DOMANTAS WALL MAKES IT!
Score: 20-30

[11:33] Team_032 possession (Score: 20-30)
FOUL! Reach-in foul on Domantas Wall during the drive. [Team fouls: 1] No free throws, side out. (Domantas Wall: 1 personal fouls)

[11:19] Team_032 possession (Score: 20-30)
Tobias Bane attempts a 3Pt. Contested by Klay Stewart (4.6 feet, ZONE). Tobias Bane misses. Rebound secured by Domantas Wall.

[11:04] Team_018 possession (Score: 20-30)
Bones Anunoby drives and kicks out. Tracy Bryant attempts a Midrange. Contested by DeMar Giddey (4.4 feet, MAN). Tracy Bryant misses. Rebound secured by Tobias Bane.

[10:48] Team_032 possession (Score: 20-30)
DeMar Giddey attempts a Layup. Contested by Domantas Wall (4.3 feet, ZONE). DeMar Giddey misses. Rebound secured by Bones Anunoby.

[10:31] Team_018 possession (Score: 20-30)
FOUL! Reach-in foul on Malcolm Lillard during the drive. [Team fouls: 1] No free throws, side out. (Malcolm Lillard: 1 personal fouls)

[10:19] Team_018 possession (Score: 20-30)
Domantas Wall attempts a 3Pt. Contested by Malcolm Lillard (5.2 feet, MAN). Domantas Wall misses. Offensive rebound by Bones Anunoby! Bones Anunoby kicks it out.

[10:05] Team_018 possession (Score: 20-30)
FOUL! Offensive foul on Allen Markkanen! Jalen Westbrook drew the charge! [Team fouls: 2] (Allen Markkanen: 1 personal fouls) TURNOVER! (dead ball)

[09:52] Team_032 possession (Score: 20-30)
Malcolm Lillard attempts a Midrange. Contested by Domantas Wall (4.5 feet, MAN). Malcolm Lillard misses. FOUL! Loose ball foul on Allen Markkanen during the rebound battle. [Team fouls: 3] No free throws, side out. (Allen Markkanen: 2 personal fouls)

[09:41] Team_032 possession (Score: 20-30)
Malcolm Lillard attempts a 3Pt. Contested by Klay Stewart (4.9 feet, ZONE). MALCOLM LILLARD MAKES IT! Assist: Tobias Bane
Score: 23-30

[09:29] Team_018 possession (Score: 23-30)
Klay Stewart attempts a 3Pt. Contested by Tobias Bane (5.1 feet, MAN). Klay Stewart misses. Rebound secured by Malcolm Lillard.

[09:16] Team_032 possession (Score: 23-30)
FOUL! Reach-in foul on Domantas Wall during the drive. [Team fouls: 4] No free throws, side out. (Domantas Wall: 2 personal fouls)

[09:03] Team_032 possession (Score: 23-30)
DeMar Giddey attempts a 3Pt. Contested by Klay Stewart (4.9 feet, ZONE). DeMar Giddey misses. Rebound secured by Allen Markkanen.

[08:49] Team_018 possession (Score: 23-30)
Domantas Wall attempts a Layup. Contested by Malcolm Lillard (5.3 feet, ZONE). DOMANTAS WALL MAKES IT! Assist: Bones Anunoby
Score: 23-32

[08:36] Team_032 possession (Score: 23-32)
Malcolm Lillard drives, picks up Domantas Wall. Help arrives from Klay Stewart! Malcolm Lillard attempts a Dunk. Contested by Klay Stewart (4.8 feet, MAN). MALCOLM LILLARD MAKES IT! Assist: DeMar Giddey
Score: 25-32

[08:20] Team_018 possession (Score: 25-32)
Tracy Bryant attempts a Layup. Contested by Malcolm Lillard (5.5 feet, ZONE). TRACY BRYANT MAKES IT!
Score: 25-34

[08:11] Team_032 possession (Score: 25-34)
Tobias Bane attempts a 3Pt. Contested by Klay Stewart (5.0 feet, MAN). Tobias Bane misses. Rebound secured by Domantas Wall.

[07:58] Team_018 possession (Score: 25-34)
Domantas Wall drives, Malcolm Lillard stays with him. Domantas Wall attempts a Layup. Contested by Malcolm Lillard (5.4 feet, MAN). DOMANTAS WALL MAKES IT!
Score: 25-36

[07:46] Team_032 possession (Score: 25-36)
DeMar Giddey attempts a 3Pt. Contested by Klay Stewart (5.1 feet, ZONE). DeMar Giddey misses. Rebound secured by Bones Anunoby.

[07:30] Team_018 possession (Score: 25-36)
Domantas Wall drives to the basket... Domantas Wall throws a bad pass! Stolen by Malcolm Lillard! TURNOVER! (live ball)

[07:16] Team_032 possession (Score: 25-36)
FOUL! Reach-in foul on Domantas Wall during the drive. [IN THE BONUS! 5 team fouls] Tobias Bane to the line for 2 free throws. (Domantas Wall: 3 personal fouls)   FT 1/2: GOOD   FT 2/2: GOOD Tobias Bane makes 2/2 from the line.
Score: 27-36

[06:58] Team_018 possession (Score: 27-36)
Klay Stewart makes the Dunk and draws the foul on Malcolm Lillard! And-1! Klay Stewart to the line for 1. [Team fouls: 2] (Malcolm Lillard: 2 personal fouls)   FT 1/1: GOOD Klay Stewart makes 1/1 from the line.
Score: 27-39

[06:42] Team_032 possession (Score: 27-39)
DeMar Giddey makes the Midrange and draws the foul on Tracy Bryant! And-1! DeMar Giddey to the line for 1. [BONUS: 6 team fouls] (Tracy Bryant: 1 personal fouls)   FT 1/1: GOOD DeMar Giddey makes 1/1 from the line.
Score: 30-39

[06:26] Team_018 possession (Score: 30-39)
Domantas Wall drives, picks up Malcolm Lillard. Help arrives from DeMar Giddey! Domantas Wall attempts a Layup. Contested by DeMar Giddey (5.6 feet, ZONE). Domantas Wall misses. Rebound secured by Malcolm Lillard.

[06:12] Team_032 possession (Score: 30-39)
Tobias Bane attempts a 3Pt. Contested by Klay Stewart (5.2 feet, MAN). Tobias Bane misses. Rebound secured by Allen Markkanen.

[05:56] Team_018 possession (Score: 30-39)
Domantas Wall attempts a 3Pt. Contested by Malcolm Lillard (5.6 feet, MAN). DOMANTAS WALL MAKES IT! Assist: Allen Markkanen
Score: 30-42

[05:39] Team_032 possession (Score: 30-42)
Jalen Westbrook attempts a Midrange. Contested by Tracy Bryant (4.6 feet, ZONE). JALEN WESTBROOK MAKES IT! Assist: Tobias Bane
Score: 32-42

[05:23] Team_018 possession (Score: 32-42)
Allen Markkanen attempts a 3Pt. Contested by Tobias Bane (5.7 feet, ZONE). Allen Markkanen misses. Rebound secured by Malcolm Lillard.

[05:06] Team_032 possession (Score: 32-42)
Tobias Bane makes the 3Pt and draws the foul on Klay Stewart! And-1! Tobias Bane to the line for 1. [BONUS: 7 team fouls] (Klay Stewart: 1 personal fouls)   FT 1/1: GOOD Tobias Bane makes 1/1 from the line.
Score: 36-42

[04:50] Team_018 possession (Score: 36-42)
FOUL! Reach-in foul on DeMar Giddey during the drive. [Team fouls: 3] No free throws, side out. (DeMar Giddey: 1 personal fouls)

[04:39] Team_018 possession (Score: 36-42)
FOUL! Holding foul on Malcolm Lillard. [Team fouls: 4] No free throws, side out. (Malcolm Lillard: 3 personal fouls)

[04:22] Team_018 possession (Score: 36-42)
Bones Anunoby attempts a Midrange. Wide open! Jalen Westbrook is 6.4 feet away. [ZONE] Bones Anunoby misses. Rebound secured by Malcolm Lillard.

[04:12] Team_032 possession (Score: 36-42)
Jalen Westbrook drives and kicks out. FOUL! Shooting foul on Klay Stewart. Tobias Bane to the line for 3 free throws. [BONUS: 8 team fouls] (Klay Stewart: 2 personal fouls)   FT 1/3: GOOD   FT 2/3: GOOD   FT 3/3: GOOD Tobias Bane makes 3/3 from the line.
Score: 39-42

[03:57] Team_018 possession (Score: 39-42)
Domantas Wall drives and kicks out. FOUL! Shooting foul on Anfernee Butler. Klay Stewart to the line for 2 free throws. [BONUS: 5 team fouls] (Anfernee Butler: 1 personal fouls)   FT 1/2: MISS   FT 2/2: GOOD Klay Stewart makes 1/2 from the line.
Score: 39-43

[03:45] Team_032 possession (Score: 39-43)
FOUL! Shooting foul on Allen Markkanen. Jalen Westbrook to the line for 2 free throws. [BONUS: 9 team fouls] (Allen Markkanen: 3 personal fouls)   FT 1/2: GOOD   FT 2/2: MISS Jalen Westbrook makes 1/2 from the line. Rebound secured by Allen Markkanen.
Score: 40-43

[03:31] Team_018 possession (Score: 40-43)
FOUL! Holding foul on Anfernee Butler. [IN THE BONUS! 6 team fouls] Bones Anunoby to the line for 2 free throws. (Anfernee Butler: 2 personal fouls)   FT 1/2: MISS   FT 2/2: GOOD Bones Anunoby makes 1/2 from the line.
Score: 40-44

[03:16] Team_032 possession (Score: 40-44)
Anfernee Butler attempts a Layup. Contested by Bones Anunoby (4.9 feet, MAN). ANFERNEE BUTLER MAKES IT!
Score: 42-44

[03:02] Team_018 possession (Score: 42-44)
Tracy Bryant loses the ball! Stripped by DeMar Giddey! TURNOVER! (live ball)

[02:48] Team_032 possession (Score: 42-44)
Anfernee Butler attempts a 3Pt. Contested by Klay Stewart (5.2 feet, ZONE). Anfernee Butler misses. Rebound secured by Allen Markkanen.

[02:33] Team_018 possession (Score: 42-44)
Klay Stewart attempts a Midrange. Contested by Tobias Bane (6.0 feet, MAN). KLAY STEWART MAKES IT!
Score: 42-46

[02:15] Team_032 possession (Score: 42-46)
Anfernee Butler attempts a Layup. BLOCKED BY BONES ANUNOBY! Ball is loose! Rebound secured by Domantas Wall.

[02:02] Team_018 possession (Score: 42-46)
Bones Anunoby attempts a 3Pt. Wide open! Anfernee Butler is 6.0 feet away. [MAN] Bones Anunoby misses. Offensive rebound by Domantas Wall! Domantas Wall kicks it out.

[01:47] Team_018 possession (Score: 42-46)
Bones Anunoby attempts a 3Pt. Wide open! Anfernee Butler is 6.1 feet away. [MAN] BONES ANUNOBY MAKES IT! Assist: Domantas Wall
Score: 42-49

[01:32] Team_032 possession (Score: 42-49)
Anfernee Butler attempts a 3Pt. Contested by Bones Anunoby (5.2 feet, MAN). ANFERNEE BUTLER MAKES IT! Assist: Jalen Westbrook
Score: 45-49

[01:16] Team_018 possession (Score: 45-49)
Allen Markkanen attempts a 3Pt. Wide open! Tobias Bane is 6.3 feet away. [ZONE] ALLEN MARKKANEN MAKES IT! Assist: Klay Stewart
Score: 45-52

[01:01] Team_032 possession (Score: 45-52)
Malcolm Lillard attempts a 3Pt. Wide open! Domantas Wall is 6.1 feet away. [MAN] MALCOLM LILLARD MAKES IT! Assist: DeMar Giddey
Score: 48-52

[00:51] Team_018 possession (Score: 48-52)
Allen Markkanen attempts a 3Pt. Wide open! Tobias Bane is 6.4 feet away. [ZONE] Allen Markkanen misses. Rebound secured by Tobias Bane.

[00:34] Team_032 possession (Score: 48-52)
Jalen Westbrook attempts a Layup. Wide open! Domantas Wall is 6.1 feet away. [ZONE] JALEN WESTBROOK MAKES IT! Assist: Malcolm Lillard
Score: 50-52

[00:21] Team_018 possession (Score: 50-52)
Bones Anunoby attempts a Layup. Wide open! Anfernee Butler is 6.3 feet away. [MAN] BONES ANUNOBY MAKES IT! Assist: Allen Markkanen
Score: 50-54

[00:06] Team_032 possession (Score: 50-54)
Tobias Bane attempts a Midrange. Wide open! Klay Stewart is 6.0 feet away. [MAN] TOBIAS BANE MAKES IT!
Score: 52-54

================================================================================
                              2ND QUARTER COMPLETE                              
================================================================================

2ND QUARTER SCORE: Team_032 34, Team_018 26

BOX SCORE:
================================================================================

Team_032
--------------------------------------------------------------------------------
Player                MIN  PTS  REB  AST  TO      FG   FG%      3P   3P%
--------------------------------------------------------------------------------
Tobias Bane            24   11    2    2   0   4/7    57.1     0/0   0.0
Malcolm Lillard        24    8    4    1   0   3/3   100.0     0/0   0.0
Jalen Westbrook        24    6    0    1   0   3/4    75.0     0/0   0.0
Anfernee Butler        24    5    1    0   0   2/4    50.0     0/0   0.0
DeMar Giddey           24    3    0    2   0   1/4    25.0     0/0   0.0

TEAM: FG: 13/22 (59.1%), 3PT: 4/10 (40.0%), REB: 7 (1 off, 6 def), AST: 6, TO: 0
TEAM FOULS: 6 [Team_018 in BONUS]


Team_018
--------------------------------------------------------------------------------
Player                MIN  PTS  REB  AST  TO      FG   FG%      3P   3P%
--------------------------------------------------------------------------------
Domantas Wall          24    9    4    1   0   4/5    80.0     0/0   0.0
Bones Anunoby          24    6    3    1   0   3/5    60.0     0/0   0.0
Klay Stewart           24    6    0    1   0   3/4    75.0     0/0   0.0
Allen Markkanen        24    3    4    2   0   1/3    33.3     0/0   0.0
Tracy Bryant           24    2    0    0   0   1/1   100.0     0/0   0.0

TEAM: FG: 12/18 (66.7%), 3PT: 3/6 (50.0%), REB: 11 (2 off, 9 def), AST: 5, TO: 3
TEAM FOULS: 9 [Team_032 in BONUS]

================================================================================

================================================================================
                       3RD QUARTER - Team_032 vs Team_018                       
================================================================================

[12:00] Team_032 possession (Score: 52-54)
Jalen Westbrook attempts a Layup. Contested by Allen Markkanen (4.1 feet, MAN). Jalen Westbrook misses. Rebound secured by Allen Markkanen.

[11:44] Team_018 possession (Score: 52-54)
Bones Anunoby attempts a 3Pt. Contested by Anfernee Butler (4.2 feet, MAN). Bones Anunoby misses. Rebound secured by Tobias Bane.

[11:34] Team_032 possession (Score: 52-54)
Jalen Westbrook makes the Midrange and draws the foul on Allen Markkanen! And-1! Jalen Westbrook to the line for 1. [Team fouls: 1] (Allen Markkanen: 1 personal fouls)   FT 1/1: GOOD Jalen Westbrook makes 1/1 from the line.
Score: 55-54

[11:20] Team_018 possession (Score: 55-54)
Bones Anunoby attempts a Midrange. Contested by Anfernee Butler (4.2 feet, ZONE). BONES ANUNOBY MAKES IT!
Score: 55-56

[11:06] Team_032 possession (Score: 55-56)
Jalen Westbrook attempts a 3Pt. Contested by Klay Stewart (4.4 feet, ZONE). Jalen Westbrook misses. Offensive rebound by Malcolm Lillard! Malcolm Lillard kicks it out.

[10:52] Team_032 possession (Score: 55-56)
Tobias Bane drives and kicks out. Tobias Bane attempts a 3Pt. Contested by Klay Stewart (4.1 feet, ZONE). Tobias Bane misses. Rebound secured by Allen Markkanen.

[10:35] Team_018 possession (Score: 55-56)
Tracy Bryant attempts a 3Pt. Contested by DeMar Giddey (4.2 feet, MAN). TRACY BRYANT MAKES IT! Assist: Allen Markkanen
Score: 55-59

[10:22] Team_032 possession (Score: 55-59)
Malcolm Lillard drives to the basket... Malcolm Lillard throws a bad pass! Stolen by Domantas Wall! TURNOVER! (live ball)

[10:04] Team_018 possession (Score: 55-59)
FOUL! Offensive foul on Domantas Wall! Malcolm Lillard drew the charge! [Team fouls: 2] (Domantas Wall: 1 personal fouls) TURNOVER! (dead ball)

[09:49] Team_032 possession (Score: 55-59)
Tobias Bane loses the ball! Stripped by Klay Stewart! TURNOVER! (live ball)

[09:31] Team_018 possession (Score: 55-59)
Klay Stewart attempts a Layup. Contested by Malcolm Lillard (4.9 feet, ZONE). Klay Stewart misses. Rebound secured by Tobias Bane.

[09:20] Team_032 possession (Score: 55-59)
DeMar Giddey attempts a 3Pt. Contested by Klay Stewart (4.4 feet, ZONE). DEMAR GIDDEY MAKES IT! Assist: Malcolm Lillard
Score: 58-59

[09:04] Team_018 possession (Score: 58-59)
Allen Markkanen attempts a 3Pt. Contested by Jalen Westbrook (5.2 feet, MAN). Allen Markkanen misses. Rebound secured by Malcolm Lillard.

[08:45] Team_032 possession (Score: 58-59)
DeMar Giddey attempts a Layup. BLOCKED BY TRACY BRYANT! Ball deflects out of bounds off DeMar Giddey.

[08:32] Team_018 possession (Score: 58-59)
Domantas Wall attempts a 3Pt. Contested by Tobias Bane (4.6 feet, ZONE). Domantas Wall misses. Rebound secured by Malcolm Lillard.

[08:16] Team_032 possession (Score: 58-59)
Jalen Westbrook attempts a Layup. BLOCKED BY DOMANTAS WALL! Ball is loose! Rebound secured by Bones Anunoby.

[08:03] Team_018 possession (Score: 58-59)
Tracy Bryant drives to the basket... Tracy Bryant throws a bad pass out of bounds! TURNOVER! (dead ball)

[07:51] Team_032 possession (Score: 58-59)
Jalen Westbrook attempts a 3Pt. Contested by Klay Stewart (4.4 feet, ZONE). JALEN WESTBROOK MAKES IT! Assist: DeMar Giddey
Score: 61-59

[07:33] Team_018 possession (Score: 61-59)
Domantas Wall loses control! Ball rolls out of bounds! TURNOVER! (dead ball)

[07:18] Team_032 possession (Score: 61-59)
Jalen Westbrook makes the Midrange and draws the foul on Allen Markkanen! And-1! Jalen Westbrook to the line for 1. [Team fouls: 3] (Allen Markkanen: 2 personal fouls)   FT 1/1: GOOD Jalen Westbrook makes 1/1 from the line.
Score: 64-59

[07:04] Team_018 possession (Score: 64-59)
Bones Anunoby attempts a Layup. Contested by Anfernee Butler (4.2 feet, MAN). BONES ANUNOBY MAKES IT! Assist: Allen Markkanen
Score: 64-61

[06:48] Team_032 possession (Score: 64-61)
Jalen Westbrook drives, picks up Allen Markkanen. Help arrives from Klay Stewart! Jalen Westbrook attempts a Dunk. Contested by Klay Stewart (4.1 feet, MAN). Jalen Westbrook misses. Offensive rebound by Malcolm Lillard! Malcolm Lillard kicks it out.

[06:34] Team_032 possession (Score: 64-61)
Anfernee Butler drives and kicks out. Jalen Westbrook makes the 3Pt and draws the foul on Allen Markkanen! And-1! Jalen Westbrook to the line for 1. [Team fouls: 4] (Allen Markkanen: 3 personal fouls)   FT 1/1: GOOD Jalen Westbrook makes 1/1 from the line.
Score: 68-61

[06:20] Team_018 possession (Score: 68-61)
FOUL! Shooting foul on Tobias Bane. Klay Stewart to the line for 2 free throws. [Team fouls: 1] (Tobias Bane: 1 personal fouls)   FT 1/2: MISS   FT 2/2: MISS Klay Stewart makes 0/2 from the line. FOUL! Loose ball foul on Tobias Bane during the free throw rebound! [Team fouls: 2] No free throws, side out. (Tobias Bane: 2 personal fouls)

[06:02] Team_018 possession (Score: 68-61)
Bones Anunoby drives and kicks out. Tracy Bryant attempts a 3Pt. Contested by DeMar Giddey (3.9 feet, MAN). Tracy Bryant misses. Rebound secured by Tobias Bane.

[05:45] Team_032 possession (Score: 68-61)
Tobias Bane attempts a 3Pt. Contested by Klay Stewart (4.3 feet, ZONE). TOBIAS BANE MAKES IT! Assist: Anfernee Butler
Score: 71-61

[05:28] Team_018 possession (Score: 71-61)
Allen Markkanen attempts a Layup. Contested by Jalen Westbrook (5.2 feet, MAN). ALLEN MARKKANEN MAKES IT! Assist: Klay Stewart
Score: 71-63

[05:14] Team_032 possession (Score: 71-63)
DeMar Giddey attempts a Midrange. Contested by Tracy Bryant (3.7 feet, MAN). DeMar Giddey misses. Rebound secured by Allen Markkanen.

[04:58] Team_018 possession (Score: 71-63)
Domantas Wall attempts a 3Pt. Contested by Malcolm Lillard (4.9 feet, MAN). DOMANTAS WALL MAKES IT! Assist: Tracy Bryant
Score: 71-66

[04:42] Team_032 possession (Score: 71-66)
DeMar Giddey makes the Layup and draws the foul on Allen Markkanen! And-1! DeMar Giddey to the line for 1. [BONUS: 5 team fouls] (Allen Markkanen: 4 personal fouls)   FT 1/1: MISS DeMar Giddey makes 0/1 from the line. Rebound secured by Allen Markkanen.
Score: 73-66

[04:28] Team_018 possession (Score: 73-66)
Domantas Wall makes the Dunk and draws the foul on Malcolm Lillard! And-1! Domantas Wall to the line for 1. [Team fouls: 3] (Malcolm Lillard: 1 personal fouls)   FT 1/1: GOOD Domantas Wall makes 1/1 from the line.
Score: 73-69

[04:14] Team_032 possession (Score: 73-69)
Jalen Westbrook attempts a Midrange. Contested by Klay Stewart (4.4 feet, ZONE). Jalen Westbrook misses. Rebound secured by Domantas Wall.

[03:59] Team_018 possession (Score: 73-69)
Tracy Bryant drives, DeMar Giddey stays with him. Tracy Bryant attempts a Layup. Contested by DeMar Giddey (4.3 feet, MAN). TRACY BRYANT MAKES IT! Assist: Bones Anunoby
Score: 73-71

[03:42] Team_032 possession (Score: 73-71)
DeMar Giddey attempts a Layup. Contested by Bones Anunoby (3.8 feet, ZONE). DEMAR GIDDEY MAKES IT! Assist: Tobias Bane
Score: 75-71

[03:30] Team_018 possession (Score: 75-71)
Klay Stewart attempts a 3Pt. Contested by Tobias Bane (4.7 feet, ZONE). Klay Stewart misses. Rebound secured by Malcolm Lillard.

[03:11] Team_032 possession (Score: 75-71)
Jalen Westbrook attempts a 3Pt. Contested by Allen Markkanen (4.1 feet, MAN). JALEN WESTBROOK MAKES IT!
Score: 78-71

[02:59] Team_018 possession (Score: 78-71)
Allen Markkanen attempts a 3Pt. Contested by Jalen Westbrook (5.4 feet, MAN). Allen Markkanen misses. Rebound secured by Malcolm Lillard.

[02:40] Team_032 possession (Score: 78-71)
Anfernee Butler drives, Bones Anunoby stays with him. Anfernee Butler attempts a Layup. Contested by Bones Anunoby (3.2 feet, MAN). ANFERNEE BUTLER MAKES IT!
Score: 80-71

[02:26] Team_018 possession (Score: 80-71)
FOUL! Reach-in foul on DeMar Giddey during the drive. [Team fouls: 4] No free throws, side out. (DeMar Giddey: 1 personal fouls)

[02:09] Team_018 possession (Score: 80-71)
FOUL! Reach-in foul on DeMar Giddey during the drive. [IN THE BONUS! 5 team fouls] Tracy Bryant to the line for 2 free throws. (DeMar Giddey: 2 personal fouls)   FT 1/2: GOOD   FT 2/2: MISS Tracy Bryant makes 1/2 from the line. Rebound secured by Malcolm Lillard.
Score: 80-72

[01:58] Team_032 possession (Score: 80-72)
Malcolm Lillard attempts a Midrange. Contested by Domantas Wall (4.2 feet, MAN). Malcolm Lillard misses. Offensive rebound by Malcolm Lillard! Malcolm Lillard kicks it out.

[01:44] Team_032 possession (Score: 80-72)
FOUL! Shooting foul on Allen Markkanen. Malcolm Lillard to the line for 2 free throws. [BONUS: 6 team fouls] (Allen Markkanen: 5 personal fouls)   FT 1/2: GOOD   FT 2/2: GOOD Malcolm Lillard makes 2/2 from the line.
Score: 82-72

[01:30] Team_018 possession (Score: 82-72)
FOUL! Holding foul on Tobias Bane. [IN THE BONUS! 6 team fouls] Klay Stewart to the line for 2 free throws. (Tobias Bane: 3 personal fouls)   FT 1/2: GOOD   FT 2/2: MISS Klay Stewart makes 1/2 from the line. Rebound secured by Malcolm Lillard.
Score: 82-73

[01:15] Team_032 possession (Score: 82-73)
Jalen Westbrook attempts a 3Pt. Contested by Allen Markkanen (4.3 feet, MAN). Jalen Westbrook misses. Rebound secured by Allen Markkanen.

[01:00] Team_018 possession (Score: 82-73)
Klay Stewart attempts a 3Pt. Contested by Tobias Bane (4.9 feet, MAN). Klay Stewart misses. Offensive rebound by Domantas Wall! Domantas Wall puts it back in!
Score: 82-75

[00:44] Team_032 possession (Score: 82-75)
Jalen Westbrook drives and kicks out. Anfernee Butler attempts a 3Pt. Contested by Klay Stewart (4.5 feet, ZONE). Anfernee Butler misses. Rebound secured by Bones Anunoby.

[00:27] Team_018 possession (Score: 82-75)
Domantas Wall attempts a Layup. Contested by Malcolm Lillard (5.1 feet, ZONE). DOMANTAS WALL MAKES IT!
Score: 82-77

[00:12] Team_032 possession (Score: 82-77)
Malcolm Lillard drives, Domantas Wall stays with him. Malcolm Lillard attempts a Layup. Contested by Domantas Wall (4.4 feet, ZONE). MALCOLM LILLARD MAKES IT! Assist: Jalen Westbrook
Score: 84-77

[00:01] Team_018 possession (Score: 84-77)
Allen Markkanen attempts a 3Pt. Contested by DeMar Giddey (4.8 feet, ZONE). Allen Markkanen misses. Offensive rebound by Domantas Wall! Domantas Wall's putback is no good. Rebound secured by Malcolm Lillard.

================================================================================
                              3RD QUARTER COMPLETE                              
================================================================================

3RD QUARTER SCORE: Team_032 32, Team_018 23

BOX SCORE:
================================================================================

Team_032
--------------------------------------------------------------------------------
Player                MIN  PTS  REB  AST  TO      FG   FG%      3P   3P%
--------------------------------------------------------------------------------
Jalen Westbrook        37   16    0    1   0   5/10   50.0     0/0   0.0
DeMar Giddey           37    5    0    1   0   2/5    40.0     0/0   0.0
Tobias Bane            37    3    3    1   0   1/2    50.0     0/0   0.0
Anfernee Butler        37    2    0    1   0   1/1   100.0     0/0   0.0

TEAM: FG: 11/20 (55.0%), 3PT: 4/5 (80.0%), REB: 12 (3 off, 9 def), AST: 5, TO: 2
TEAM FOULS: 6 [Team_018 in BONUS]


Team_018
--------------------------------------------------------------------------------
Player                MIN  PTS  REB  AST  TO      FG   FG%      3P   3P%
--------------------------------------------------------------------------------
Domantas Wall          37   10    2    0   0   4/5    80.0     0/0   0.0
Tracy Bryant           37    5    0    1   0   2/3    66.7     0/0   0.0
Bones Anunoby          37    4    3    1   0   2/4    50.0     0/0   0.0
Malcolm Lillard        37    4   10    1   0   2/2   100.0     0/0   0.0
Allen Markkanen        37    2    5    2   0   1/4    25.0     0/0   0.0
Klay Stewart           37    0    0    1   0   0/2     0.0     0/0   0.0

TEAM: FG: 9/19 (47.4%), 3PT: 3/9 (33.3%), REB: 11 (3 off, 8 def), AST: 5, TO: 3
TEAM FOULS: 6 [Team_032 in BONUS]

================================================================================

================================================================================
                       4TH QUARTER - Team_032 vs Team_018                       
================================================================================

[12:00] Team_032 possession (Score: 84-77)
FOUL! Shooting foul on Domantas Wall. Malcolm Lillard to the line for 2 free throws. [Team fouls: 1] (Domantas Wall: 1 personal fouls)   FT 1/2: GOOD   FT 2/2: GOOD Malcolm Lillard makes 2/2 from the line.
Score: 86-77

[11:43] Team_018 possession (Score: 86-77)
Allen Markkanen drives, Jalen Westbrook stays with him. Allen Markkanen attempts a Dunk. Contested by Jalen Westbrook (5.5 feet, MAN). Allen Markkanen misses. Rebound secured by Anfernee Butler.

[11:25] Team_032 possession (Score: 86-77)
Malcolm Lillard attempts a Layup. Contested by Domantas Wall (4.3 feet, MAN). MALCOLM LILLARD MAKES IT!
Score: 88-77

[11:10] Team_018 possession (Score: 88-77)
Klay Stewart attempts a 3Pt. Contested by Tobias Bane (4.9 feet, MAN). KLAY STEWART MAKES IT! Assist: Bones Anunoby
Score: 88-80

[10:56] Team_032 possession (Score: 88-80)
Tobias Bane drives and kicks out. FOUL! Shooting foul on Tracy Bryant. Tobias Bane to the line for 2 free throws. [Team fouls: 2] (Tracy Bryant: 1 personal fouls)   FT 1/2: GOOD   FT 2/2: GOOD Tobias Bane makes 2/2 from the line.
Score: 90-80

[10:41] Team_018 possession (Score: 90-80)
Klay Stewart drives, picks up Tobias Bane. Help arrives from Jalen Westbrook! Klay Stewart attempts a Dunk. Contested by Jalen Westbrook (4.9 feet, MAN). KLAY STEWART MAKES IT! Assist: Allen Markkanen
Score: 90-82

[10:24] Team_032 possession (Score: 90-82)
DeMar Giddey attempts a Midrange. Contested by Tracy Bryant (4.0 feet, MAN). DeMar Giddey misses. Rebound secured by Allen Markkanen.

[10:10] Team_018 possession (Score: 90-82)
Domantas Wall attempts a Midrange. Contested by Anfernee Butler (4.6 feet, ZONE). DOMANTAS WALL MAKES IT! Assist: Tracy Bryant
Score: 90-84

[09:57] Team_032 possession (Score: 90-84)
Jalen Westbrook attempts a Layup. Contested by Allen Markkanen (4.4 feet, MAN). Jalen Westbrook misses. Rebound secured by Domantas Wall.

[09:43] Team_018 possession (Score: 90-84)
Allen Markkanen drives and kicks out. FOUL! Shooting foul on Anfernee Butler. Klay Stewart to the line for 2 free throws. [Team fouls: 1] (Anfernee Butler: 1 personal fouls)   FT 1/2: MISS   FT 2/2: MISS Klay Stewart makes 0/2 from the line. Offensive rebound by Domantas Wall! Domantas Wall's putback is no good.

[09:28] Team_032 possession (Score: 90-84)
Anfernee Butler attempts a Midrange. Contested by Bones Anunoby (3.7 feet, MAN). Anfernee Butler misses. Rebound secured by Allen Markkanen.

[09:14] Team_018 possession (Score: 90-84)
Tracy Bryant attempts a Midrange. Contested by DeMar Giddey (4.9 feet, ZONE). TRACY BRYANT MAKES IT! Assist: Bones Anunoby
Score: 90-86

[08:57] Team_032 possession (Score: 90-86)
DeMar Giddey attempts a Midrange. Contested by Bones Anunoby (4.4 feet, ZONE). DeMar Giddey misses. Rebound secured by Allen Markkanen.

[08:43] Team_018 possession (Score: 90-86)
Bones Anunoby attempts a 3Pt. Contested by Anfernee Butler (4.9 feet, MAN). BONES ANUNOBY MAKES IT! Assist: Allen Markkanen
Score: 90-89

[08:27] Team_032 possession (Score: 90-89)
Anfernee Butler drives, Domantas Wall stays with him. Anfernee Butler attempts a Dunk. Contested by Domantas Wall (4.0 feet, ZONE). ANFERNEE BUTLER MAKES IT! Assist: Tobias Bane
Score: 92-89

[08:11] Team_018 possession (Score: 92-89)
Domantas Wall drives to the basket... Domantas Wall loses control! Ball rolls out of bounds! TURNOVER! (dead ball)

[08:11] Substitution (Team_032): Tobias Bane OUT → Anfernee Griffin IN (stamina_rule2)

[08:11] Substitution (Team_032): DeMar Giddey OUT → Myles Herro IN (stamina_rule2)

[08:11] Substitution (Team_032): Jalen Westbrook OUT → Jrue Simmons IN (stamina_rule2)

[08:11] Substitution (Team_032): Anfernee Butler OUT → Jayson O'Neal IN (stamina_rule2)

[08:11] Substitution (Team_032): Malcolm Lillard OUT → Lauri Towns IN (stamina_rule2)

[08:11] Substitution (Team_018): Klay Stewart OUT → Michael Simons IN (stamina_rule2)

[08:11] Substitution (Team_018): Tracy Bryant OUT → Miles Herro IN (stamina_rule2)

[08:11] Substitution (Team_018): Allen Markkanen OUT → Austin Antetokounmpo IN (stamina_rule2)

[08:11] Substitution (Team_018): Bones Anunoby OUT → Shai Wade IN (stamina_rule2)

[08:11] Substitution (Team_018): Domantas Wall OUT → Julius Jackson IN (stamina_rule2)

[07:51] Team_032 possession (Score: 92-89)
FOUL! Reach-in foul on Julius Jackson during the drive. [Team fouls: 3] No free throws, side out. (Julius Jackson: 1 personal fouls)

[07:36] Team_032 possession (Score: 92-89)
Anfernee Griffin drives and kicks out. Jayson O'Neal attempts a Midrange. Contested by Shai Wade (4.9 feet, MAN). JAYSON O'NEAL MAKES IT! Assist: Myles Herro
Score: 94-89

[07:26] Team_018 possession (Score: 94-89)
Miles Herro attempts a 3Pt. Wide open! Myles Herro is 6.3 feet away. [MAN] Miles Herro misses. Rebound secured by Myles Herro.

[07:10] Team_032 possession (Score: 94-89)
Anfernee Griffin attempts a 3Pt. Contested by Michael Simons (5.1 feet, MAN). Anfernee Griffin misses. Rebound secured by Julius Jackson.

[06:59] Team_018 possession (Score: 94-89)
Michael Simons attempts a 3Pt. BLOCKED BY ANFERNEE GRIFFIN! Ball is loose! Rebound secured by Lauri Towns.

[06:45] Team_032 possession (Score: 94-89)
Myles Herro attempts a Layup. Contested by Julius Jackson (4.7 feet, ZONE). Myles Herro misses. Offensive rebound by Lauri Towns! Lauri Towns kicks it out.

[06:28] Team_032 possession (Score: 94-89)
Anfernee Griffin attempts a 3Pt. Contested by Michael Simons (5.1 feet, ZONE). Anfernee Griffin misses. Rebound secured by Shai Wade.

[06:10] Team_018 possession (Score: 94-89)
Shai Wade attempts a Midrange. Contested by Jayson O'Neal (4.2 feet, MAN). Shai Wade misses. Rebound secured by Lauri Towns.

[05:53] Team_032 possession (Score: 94-89)
Jayson O'Neal drives and kicks out. Jrue Simmons attempts a 3Pt. Contested by Michael Simons (5.4 feet, ZONE). Jrue Simmons misses. Rebound secured by Julius Jackson.

[05:42] Team_018 possession (Score: 94-89)
Julius Jackson throws a bad pass out of bounds! TURNOVER! (dead ball)

[05:29] Team_032 possession (Score: 94-89)
Myles Herro attempts a Midrange. Contested by Shai Wade (4.8 feet, ZONE). MYLES HERRO MAKES IT! Assist: Lauri Towns
Score: 96-89

[05:19] Team_018 possession (Score: 96-89)
Michael Simons attempts a Midrange. Contested by Anfernee Griffin (5.4 feet, MAN). Michael Simons misses. Rebound secured by Myles Herro.

[05:03] Team_032 possession (Score: 96-89)
Jayson O'Neal drives and kicks out. Jrue Simmons attempts a Midrange. Contested by Miles Herro (5.5 feet, ZONE). JRUE SIMMONS MAKES IT!
Score: 98-89

[04:49] Team_018 possession (Score: 98-89)
Austin Antetokounmpo attempts a Midrange. Contested by Jrue Simmons (4.3 feet, MAN). Austin Antetokounmpo misses. Rebound secured by Myles Herro.

[04:38] Team_032 possession (Score: 98-89)
Anfernee Griffin attempts a Midrange. Contested by Julius Jackson (4.5 feet, ZONE). Anfernee Griffin misses. Offensive rebound by Lauri Towns! Lauri Towns kicks it out.

[04:22] Team_032 possession (Score: 98-89)
Jrue Simmons attempts a Midrange. Contested by Miles Herro (5.8 feet, ZONE). Jrue Simmons misses. Rebound secured by Shai Wade.

[04:08] Team_018 possession (Score: 98-89)
Shai Wade attempts a 3Pt. Contested by Anfernee Griffin (4.6 feet, ZONE). SHAI WADE MAKES IT! Assist: Julius Jackson
Score: 98-92

[03:55] Team_032 possession (Score: 98-92)
Anfernee Griffin makes the Layup and draws the foul on Michael Simons! And-1! Anfernee Griffin to the line for 1. [Team fouls: 4] (Michael Simons: 1 personal fouls)   FT 1/1: MISS Anfernee Griffin makes 0/1 from the line. Rebound secured by Shai Wade.
Score: 100-92

[03:41] Team_018 possession (Score: 100-92)
Shai Wade drives, Lauri Towns stays with him. Shai Wade attempts a Dunk. Contested by Lauri Towns (4.9 feet, ZONE). SHAI WADE MAKES IT!
Score: 100-94

[03:29] Team_032 possession (Score: 100-94)
Myles Herro loses the ball! Stripped by Miles Herro! TURNOVER! (live ball)

[03:12] Team_018 possession (Score: 100-94)
Michael Simons attempts a 3Pt. Contested by Anfernee Griffin (5.4 feet, MAN). Michael Simons misses. Rebound secured by Lauri Towns.

[02:56] Team_032 possession (Score: 100-94)
Jayson O'Neal attempts a 3Pt. Contested by Michael Simons (5.6 feet, ZONE). Jayson O'Neal misses. Rebound secured by Shai Wade.

[02:38] Team_018 possession (Score: 100-94)
Julius Jackson attempts a Midrange. Wide open! Myles Herro is 6.5 feet away. [ZONE] JULIUS JACKSON MAKES IT!
Score: 100-96

[02:25] Team_032 possession (Score: 100-96)
Myles Herro attempts a Midrange. Contested by Miles Herro (5.4 feet, MAN). MYLES HERRO MAKES IT!
Score: 102-96

[02:10] Team_018 possession (Score: 102-96)
Shai Wade makes the Dunk and draws the foul on Myles Herro! And-1! Shai Wade to the line for 1. [Team fouls: 2] (Myles Herro: 1 personal fouls)   FT 1/1: GOOD Shai Wade makes 1/1 from the line.
Score: 102-99

[01:55] Team_032 possession (Score: 102-99)
Myles Herro drives and kicks out. Jayson O'Neal attempts a Midrange. Contested by Shai Wade (4.9 feet, MAN). Jayson O'Neal misses. Rebound secured by Austin Antetokounmpo.

[01:40] Team_018 possession (Score: 102-99)
Shai Wade drives, Jayson O'Neal stays with him. Shai Wade attempts a Dunk. Contested by Jayson O'Neal (4.2 feet, MAN). SHAI WADE MAKES IT! Assist: Michael Simons
Score: 102-101

[01:29] Team_032 possession (Score: 102-101)
Myles Herro drives, Miles Herro stays with him. Myles Herro attempts a Dunk. Contested by Miles Herro (5.4 feet, MAN). Myles Herro misses. Rebound secured by Shai Wade.

[01:15] Team_018 possession (Score: 102-101)
Michael Simons drives, picks up Anfernee Griffin. Help arrives from Myles Herro! Michael Simons attempts a Layup. Contested by Myles Herro (5.4 feet, MAN). MICHAEL SIMONS MAKES IT! Assist: Julius Jackson
Score: 102-103

[01:00] Team_032 possession (Score: 102-103)
Anfernee Griffin attempts a 3Pt. Contested by Michael Simons (5.1 feet, ZONE). Anfernee Griffin misses. Rebound secured by Austin Antetokounmpo.

[00:49] Team_018 possession (Score: 102-103)
Michael Simons attempts a 3Pt. Contested by Anfernee Griffin (5.4 feet, MAN). MICHAEL SIMONS MAKES IT!
Score: 102-106

[00:35] Team_032 possession (Score: 102-106)
Lauri Towns attempts a Midrange. Contested by Miles Herro (5.7 feet, ZONE). LAURI TOWNS MAKES IT! Assist: Anfernee Griffin
Score: 104-106

[00:21] Team_018 possession (Score: 104-106)
Miles Herro makes the Layup and draws the foul on Lauri Towns! And-1! Miles Herro to the line for 1. [Team fouls: 3] (Lauri Towns: 1 personal fouls)   FT 1/1: GOOD Miles Herro makes 1/1 from the line.
Score: 104-109

[00:11] Team_032 possession (Score: 104-109)
Anfernee Griffin attempts a 3Pt. Contested by Miles Herro (5.3 feet, ZONE). Anfernee Griffin misses. Offensive rebound by Lauri Towns! Lauri Towns kicks it out.

================================================================================
                              4TH QUARTER COMPLETE                              
================================================================================

4TH QUARTER SCORE: Team_032 20, Team_018 32

BOX SCORE:
================================================================================

Team_032
--------------------------------------------------------------------------------
Player                MIN  PTS  REB  AST  TO      FG   FG%      3P   3P%
--------------------------------------------------------------------------------
Malcolm Lillard        41    4    0    0   0   2/2   100.0     0/0   0.0
Myles Herro             8    4    3    1   0   2/4    50.0     0/0   0.0
Anfernee Butler        41    2    1    0   0   1/2    50.0     0/0   0.0
Tobias Bane            41    2    0    1   0   1/1   100.0     0/0   0.0
Domantas Wall          41    2    2    0   0   1/1   100.0     0/0   0.0
Jayson O'Neal           8    2    0    0   0   1/3    33.3     0/0   0.0
Lauri Towns             8    2    6    1   0   1/1   100.0     0/0   0.0
Jrue Simmons            8    2    0    0   0   1/2    50.0     0/0   0.0
DeMar Giddey           41    0    0    0   0   0/2     0.0     0/0   0.0
Jalen Westbrook        41    0    0    0   0   0/1     0.0     0/0   0.0
Anfernee Griffin        8    0    0    1   0   0/4     0.0     0/0   0.0

TEAM: FG: 9/22 (40.9%), 3PT: 0/4 (0.0%), REB: 11 (3 off, 8 def), AST: 4, TO: 1
TEAM FOULS: 3


Team_018
--------------------------------------------------------------------------------
Player                MIN  PTS  REB  AST  TO      FG   FG%      3P   3P%
--------------------------------------------------------------------------------
Shai Wade               8   10    5    0   0   4/5    80.0     0/0   0.0
Klay Stewart           41    5    0    0   0   2/2   100.0     0/0   0.0
Michael Simons          8    5    0    1   0   2/5    40.0     0/0   0.0
Bones Anunoby          41    3    0    2   0   1/1   100.0     0/0   0.0
Miles Herro             8    3    0    0   0   1/2    50.0     0/0   0.0
Tracy Bryant           41    2    0    1   0   1/1   100.0     0/0   0.0
Julius Jackson          8    2    2    2   0   1/1   100.0     0/0   0.0
Allen Markkanen        41    0    3    2   0   0/2     0.0     0/0   0.0
Austin Antetokounmpo    8    0    2    0   0   0/1     0.0     0/0   0.0

TEAM: FG: 13/21 (61.9%), 3PT: 4/7 (57.1%), REB: 13 (0 off, 13 def), AST: 8, TO: 2
TEAM FOULS: 4

================================================================================

================================================================================
                               FULL GAME COMPLETE                               
================================================================================

FINAL SCORE: Team_032 104, Team_018 109

SCORING BY QUARTER:
--------------------------------------------------------------------------------
Team                     Q1     Q2     Q3     Q4    FINAL
--------------------------------------------------------------------------------
Team_032                 18     34     32     20      104
Team_018                 28     26     23     32      109
--------------------------------------------------------------------------------

FULL GAME BOX SCORE:
================================================================================

Team_032
--------------------------------------------------------------------------------
Player                MIN  PTS  REB  AST  TO      FG   FG%      3P   3P%      FT STL BLK
--------------------------------------------------------------------------------
Tobias Bane            41   21    8    5   1   7/12   58.3   2/6    33.3   9/9     0   0
DeMar Giddey           41   14    0    4   1   5/16   31.2   3/7    42.9   4/7     2   0
Jalen Westbrook        41   25    0    3   1   9/18   50.0   2/3    66.7   5/6     0   0
Anfernee Butler        41   11    6    1   1   6/11   54.5   1/3    33.3   2/2     0   0
Malcolm Lillard        41   18   21    2   1   8/9    88.9   2/2   100.0   4/4     1   0
Anfernee Griffin        8    0    0    1   0   1/5    20.0   0/3     0.0   0/1     0   1
Myles Herro             8    4    3    1   1   2/4    50.0   0/0     0.0   0/0     0   0
Jrue Simmons            8    2    0    0   0   0/1     0.0   0/0     0.0   0/0     0   0
Jayson O'Neal           8    2    0    0   0   1/3    33.3   0/1     0.0   0/0     0   0
Lauri Towns             8    2    6    1   0   1/1   100.0   0/0     0.0   0/0     0   0

TEAM: FG: 41/81 (50.6%), 3PT: 10/25 (40.0%), REB: 44 (13 off, 31 def), AST: 18, TO: 6


Team_018
--------------------------------------------------------------------------------
Player                MIN  PTS  REB  AST  TO      FG   FG%      3P   3P%      FT STL BLK
--------------------------------------------------------------------------------
Klay Stewart           41   11    0    5   0   5/10   50.0   2/6    33.3   3/9     1   0
Tracy Bryant           41   20    0    2   2   7/9    77.8   2/3    66.7   3/4     0   1
Allen Markkanen        41   15   12    6   2   7/16   43.8   4/10   40.0   0/0     0   1
Bones Anunoby          41   18    9    7   1   7/11   63.6   2/3    66.7   2/3     0   1
Domantas Wall          41   23   16    1   3  10/15   66.7   2/4    50.0   1/1     1   1
Michael Simons          8    5    0    1   0   2/5    40.0   1/3    33.3   0/0     0   0
Miles Herro             8    3    0    0   0   1/2    50.0   0/1     0.0   1/1     1   0
Austin Antetokounmpo    8    0    2    0   0   0/1     0.0   0/0     0.0   0/0     0   0
Shai Wade               8   10    5    0   0   4/5    80.0   1/1   100.0   1/1     0   0
Julius Jackson          8    2    2    2   1   1/1   100.0   0/0     0.0   0/0     0   0

TEAM: FG: 45/77 (58.4%), 3PT: 14/31 (45.2%), REB: 46 (7 off, 39 def), AST: 24, TO: 9

================================================================================
