================================================================================
                        FULL GAME - Team_090 vs Team_007                        
================================================================================

================================================================================
                       1ST QUARTER - Team_090 vs Team_007                       
================================================================================

[12:00] Team_090 possession (Score: 0-0)
Tracy Adebayo drives and kicks out. Gary Brogdon attempts a 3Pt. Contested by John Quickley (3.0 feet, ZONE). Gary Brogdon misses. Rebound secured by John Quickley.

[11:44] Team_007 possession (Score: 0-0)
FOUL! Holding foul on Zach Wall. [Team fouls: 1] No free throws, side out. (Zach Wall: 1 personal fouls)

[11:31] Team_007 possession (Score: 0-0)
FOUL! Holding foul on Gary Brogdon. [Team fouls: 2] No free throws, side out. (Gary Brogdon: 1 personal fouls)

[11:17] Team_007 possession (Score: 0-0)
Carmelo Siakam loses the ball! Stripped by Tracy Adebayo! TURNOVER! (live ball)

[11:04] Team_090 possession (Score: 0-0)
Gary Brogdon attempts a 3Pt. Contested by John Quickley (3.2 feet, MAN). Gary Brogdon misses. Rebound secured by Carmelo Siakam.

[10:49] Team_007 possession (Score: 0-0)
Tobias Johnson attempts a 3Pt. Contested by Derrick Mitchell (3.6 feet, MAN). Tobias Johnson misses. Offensive rebound by Bones Siakam! Bones Siakam puts it back in!
Score: 0-2

[10:38] Team_090 possession (Score: 0-2)
Tracy Adebayo drives, picks up John Quickley. Help arrives from Jaren Dosunmu! Tracy Adebayo attempts a Dunk. Contested by Jaren Dosunmu (2.9 feet, ZONE). Tracy Adebayo misses. Rebound secured by Bones Siakam.

[10:22] Team_007 possession (Score: 0-2)
FOUL! Holding foul on Tracy Adebayo. [Team fouls: 3] No free throws, side out. (Tracy Adebayo: 1 personal fouls)

[10:10] Team_007 possession (Score: 0-2)
Tobias Johnson attempts a 3Pt. Contested by Derrick Mitchell (3.6 feet, ZONE). Tobias Johnson misses. Rebound secured by Tracy Adebayo.

[09:53] Team_090 possession (Score: 0-2)
FOUL! Holding foul on Tobias Johnson. [Team fouls: 1] No free throws, side out. (Tobias Johnson: 1 personal fouls)

[09:43] Team_090 possession (Score: 0-2)
FOUL! Offensive foul on Tracy Adebayo! John Quickley drew the charge! [Team fouls: 4] (Tracy Adebayo: 2 personal fouls) TURNOVER! (dead ball)

[09:28] Team_007 possession (Score: 0-2)
Tobias Johnson attempts a 3Pt. Contested by Derrick Mitchell (3.6 feet, MAN). Tobias Johnson misses. Rebound secured by Zach Wall.

[09:13] Team_090 possession (Score: 0-2)
FOUL! Reach-in foul on John Quickley during the drive. [Team fouls: 2] No free throws, side out. (John Quickley: 1 personal fouls)

[08:55] Team_090 possession (Score: 0-2)
Derrick Mitchell attempts a 3Pt. Contested by Tobias Johnson (5.1 feet, MAN). Derrick Mitchell misses. Offensive rebound by Tracy Adebayo! Tracy Adebayo kicks it out.

[08:38] Team_090 possession (Score: 0-2)
Gary Brogdon attempts a 3Pt. Contested by John Quickley (3.2 feet, ZONE). GARY BROGDON MAKES IT! Assist: Derrick Mitchell
Score: 3-2

[08:23] Team_007 possession (Score: 3-2)
Tobias Johnson attempts a 3Pt. Contested by Derrick Mitchell (3.6 feet, ZONE). Tobias Johnson misses. Rebound secured by Tracy Adebayo.

[08:07] Team_090 possession (Score: 3-2)
Tracy Adebayo attempts a Layup. Contested by John Quickley (2.9 feet, MAN). TRACY ADEBAYO MAKES IT! Assist: Derrick Mitchell
Score: 5-2

[07:49] Team_007 possession (Score: 5-2)
Carmelo Siakam drives, picks up Gary Brogdon. Help arrives from Larry Bridges! Carmelo Siakam attempts a Dunk. Contested by Larry Bridges (4.0 feet, ZONE). CARMELO SIAKAM MAKES IT!
Score: 5-4

[07:36] Team_090 possession (Score: 5-4)
Larry Bridges attempts a 3Pt. Contested by John Quickley (3.1 feet, ZONE). LARRY BRIDGES MAKES IT!
Score: 8-4

[07:22] Team_007 possession (Score: 8-4)
FOUL! Holding foul on Gary Brogdon. [IN THE BONUS! 5 team fouls] John Quickley to the line for 2 free throws. (Gary Brogdon: 2 personal fouls)   FT 1/2: GOOD   FT 2/2: GOOD John Quickley makes 2/2 from the line.
Score: 8-6

[07:10] Team_090 possession (Score: 8-6)
Gary Brogdon attempts a Layup. Contested by John Quickley (3.2 feet, MAN). GARY BROGDON MAKES IT! Assist: Zach Wall
Score: 10-6

[06:58] Team_007 possession (Score: 10-6)
John Quickley attempts a Layup. Contested by Gary Brogdon (4.3 feet, ZONE). JOHN QUICKLEY MAKES IT!
Score: 10-8

[06:47] Team_090 possession (Score: 10-8)
Zach Wall attempts a 3Pt. Contested by Tobias Johnson (5.1 feet, ZONE). Zach Wall misses. Offensive rebound by Tracy Adebayo! Tracy Adebayo kicks it out.

[06:34] Team_090 possession (Score: 10-8)
FOUL! Shooting foul on Tobias Johnson. Derrick Mitchell to the line for 3 free throws. [Team fouls: 3] (Tobias Johnson: 2 personal fouls)   FT 1/3: GOOD   FT 2/3: MISS   FT 3/3: MISS Derrick Mitchell makes 1/3 from the line. Rebound secured by Bones Siakam.
Score: 11-8

[06:22] Team_007 possession (Score: 11-8)
FOUL! Reach-in foul on Gary Brogdon during the drive. [IN THE BONUS! 6 team fouls] John Quickley to the line for 2 free throws. (Gary Brogdon: 3 personal fouls)   FT 1/2: GOOD   FT 2/2: GOOD John Quickley makes 2/2 from the line.
Score: 11-10

[06:06] Team_090 possession (Score: 11-10)
Derrick Mitchell attempts a 3Pt. Contested by Tobias Johnson (5.1 feet, MAN). Derrick Mitchell misses. Offensive rebound by Tracy Adebayo! Tracy Adebayo kicks it out.

[05:54] Team_090 possession (Score: 11-10)
Derrick Mitchell drives to the basket... Derrick Mitchell commits a violation (traveling/carry)! TURNOVER! (dead ball)

[05:39] Team_007 possession (Score: 11-10)
Carmelo Siakam attempts a Midrange. Contested by Tracy Adebayo (5.2 feet, MAN). CARMELO SIAKAM MAKES IT! Assist: Tobias Johnson
Score: 11-12

[05:20] Team_090 possession (Score: 11-12)
Derrick Mitchell attempts a Midrange. Contested by Tobias Johnson (5.1 feet, MAN). Derrick Mitchell misses. Rebound secured by John Quickley.

[05:05] Team_007 possession (Score: 11-12)
John Quickley drives, Gary Brogdon stays with him. John Quickley attempts a Layup. Contested by Gary Brogdon (4.4 feet, ZONE). JOHN QUICKLEY MAKES IT!
Score: 11-14

[04:50] Team_090 possession (Score: 11-14)
Tracy Adebayo attempts a Layup. BLOCKED BY CARMELO SIAKAM! Ball is loose! Rebound secured by Bones Siakam.

[04:35] Team_007 possession (Score: 11-14)
Jaren Dosunmu attempts a 3Pt. Contested by Larry Bridges (4.8 feet, MAN). Jaren Dosunmu misses. Rebound secured by Zach Wall.

[04:24] Team_090 possession (Score: 11-14)
Gary Brogdon drives and kicks out. Derrick Mitchell attempts a Midrange. Contested by John Quickley (3.2 feet, ZONE). Derrick Mitchell misses. Rebound secured by John Quickley.

[04:10] Team_007 possession (Score: 11-14)
Carmelo Siakam attempts a 3Pt. Contested by Tracy Adebayo (5.3 feet, MAN). Carmelo Siakam misses. Rebound secured by Tracy Adebayo.

[03:54] Team_090 possession (Score: 11-14)
Tracy Adebayo attempts a Layup. Contested by John Quickley (3.1 feet, MAN). TRACY ADEBAYO MAKES IT! Assist: Zach Wall
Score: 13-14

[03:37] Team_007 possession (Score: 13-14)
Carmelo Siakam drives and kicks out. Tobias Johnson attempts a Midrange. Contested by Larry Bridges (4.9 feet, ZONE). TOBIAS JOHNSON MAKES IT! Assist: Carmelo Siakam
Score: 13-16

[03:22] Team_090 possession (Score: 13-16)
Tracy Adebayo attempts a 3Pt. Contested by John Quickley (3.1 feet, MAN). Tracy Adebayo misses. Offensive rebound by Zach Wall! Zach Wall kicks it out.

[03:06] Team_090 possession (Score: 13-16)
Zach Wall drives and kicks out. Larry Bridges attempts a 3Pt. Contested by Tobias Johnson (5.0 feet, ZONE). LARRY BRIDGES MAKES IT! Assist: Zach Wall
Score: 16-16

[02:50] Team_007 possession (Score: 16-16)
Bones Siakam drives, Gary Brogdon stays with him. Bones Siakam attempts a Layup. Contested by Gary Brogdon (4.1 feet, ZONE). Bones Siakam misses. Offensive rebound by Bones Siakam! Bones Siakam kicks it out.

[02:37] Team_007 possession (Score: 16-16)
Carmelo Siakam makes the Layup and draws the foul on Tracy Adebayo! And-1! Carmelo Siakam to the line for 1. [BONUS: 7 team fouls] (Tracy Adebayo: 3 personal fouls)   FT 1/1: GOOD Carmelo Siakam makes 1/1 from the line.
Score: 16-19

[02:24] Team_090 possession (Score: 16-19)
Zach Wall attempts a 3Pt. Contested by John Quickley (3.7 feet, ZONE). Zach Wall misses. FOUL! Loose ball foul on Carmelo Siakam during the rebound battle. [Team fouls: 4] No free throws, side out. (Carmelo Siakam: 1 personal fouls)

[02:13] Team_090 possession (Score: 16-19)
Tracy Adebayo attempts a Layup. Contested by John Quickley (3.3 feet, ZONE). TRACY ADEBAYO MAKES IT! Assist: Gary Brogdon
Score: 18-19

[01:57] Team_007 possession (Score: 18-19)
Jaren Dosunmu attempts a 3Pt. Contested by Larry Bridges (5.0 feet, ZONE). JAREN DOSUNMU MAKES IT! Assist: Tobias Johnson
Score: 18-22

[01:46] Team_090 possession (Score: 18-22)
Gary Brogdon attempts a 3Pt. Contested by Jaren Dosunmu (4.8 feet, ZONE). Gary Brogdon misses. Rebound secured by Carmelo Siakam.

[01:32] Team_007 possession (Score: 18-22)
Carmelo Siakam attempts a Midrange. Contested by Tracy Adebayo (5.5 feet, MAN). CARMELO SIAKAM MAKES IT! Assist: Bones Siakam
Score: 18-24

[01:19] Team_090 possession (Score: 18-24)
Tracy Adebayo attempts a 3Pt. Contested by John Quickley (3.4 feet, ZONE). Tracy Adebayo misses. Rebound secured by Carmelo Siakam.

[01:03] Team_007 possession (Score: 18-24)
Carmelo Siakam makes the Dunk and draws the foul on Gary Brogdon! And-1! Carmelo Siakam to the line for 1. [BONUS: 8 team fouls] (Gary Brogdon: 4 personal fouls)   FT 1/1: GOOD Carmelo Siakam makes 1/1 from the line.
Score: 18-27

[00:47] Team_090 possession (Score: 18-27)
FOUL! Shooting foul on Jaren Dosunmu. Derrick Mitchell to the line for 2 free throws. [BONUS: 5 team fouls] (Jaren Dosunmu: 1 personal fouls)   FT 1/2: GOOD   FT 2/2: GOOD Derrick Mitchell makes 2/2 from the line.
Score: 20-27

[00:35] Team_007 possession (Score: 20-27)
John Quickley attempts a Midrange. Contested by Zach Wall (5.9 feet, ZONE). JOHN QUICKLEY MAKES IT! Assist: Jaren Dosunmu
Score: 20-29

[00:24] Team_090 possession (Score: 20-29)
Derrick Mitchell drives, picks up Tobias Johnson. Help arrives from Bones Siakam! Derrick Mitchell attempts a Layup. Contested by Bones Siakam (5.5 feet, MAN). Derrick Mitchell misses. Rebound secured by Carmelo Siakam.

[00:08] Team_007 possession (Score: 20-29)
John Quickley attempts a 3Pt. Contested by Derrick Mitchell (4.3 feet, ZONE). JOHN QUICKLEY MAKES IT! Assist: Jaren Dosunmu
Score: 20-32

================================================================================
                              1ST QUARTER COMPLETE                              
================================================================================

1ST QUARTER SCORE: Team_090 20, Team_007 32

BOX SCORE:
================================================================================

Team_090
--------------------------------------------------------------------------------
Player                MIN  PTS  REB  AST  TO      FG   FG%      3P   3P%
--------------------------------------------------------------------------------
Tracy Adebayo          12    6    7    0   0   3/7    42.9     0/0   0.0
Larry Bridges          12    6    0    0   0   2/2   100.0     0/0   0.0
Gary Brogdon           12    5    0    1   0   2/5    40.0     0/0   0.0
Derrick Mitchell       12    2    0    2   0   1/4    25.0     0/0   0.0
Zach Wall              12    0    3    3   0   0/0     0.0     0/0   0.0

TEAM: FG: 8/18 (44.4%), 3PT: 2/6 (33.3%), REB: 10 (5 off, 5 def), AST: 6, TO: 2
TEAM FOULS: 8 [Team_007 in BONUS]


Team_007
--------------------------------------------------------------------------------
Player                MIN  PTS  REB  AST  TO      FG   FG%      3P   3P%
--------------------------------------------------------------------------------
John Quickley          12   13    3    0   0   6/6   100.0     0/0   0.0
Carmelo Siakam         12   12    4    1   0   5/6    83.3     0/0   0.0
Jaren Dosunmu          12    3    0    2   0   1/2    50.0     0/0   0.0
Bones Siakam           12    2    5    1   0   1/1   100.0     0/0   0.0
Tobias Johnson         12    2    0    2   0   1/4    25.0     0/0   0.0

TEAM: FG: 14/19 (73.7%), 3PT: 3/8 (37.5%), REB: 12 (2 off, 10 def), AST: 6, TO: 1
TEAM FOULS: 5 [Team_090 in BONUS]

================================================================================

================================================================================
                       2ND QUARTER - Team_090 vs Team_007                       
================================================================================

[12:00] Team_090 possession (Score: 20-32)
Gary Brogdon attempts a 3Pt. Contested by John Quickley (3.7 feet, MAN). Gary Brogdon misses. Rebound secured by Bones Siakam.

[11:45] Team_007 possession (Score: 20-32)
Jaren Dosunmu makes the Dunk and draws the foul on Larry Bridges! And-1! Jaren Dosunmu to the line for 1. [Team fouls: 1] (Larry Bridges: 1 personal fouls)   FT 1/1: MISS Jaren Dosunmu makes 0/1 from the line. Rebound secured by Tracy Adebayo.
Score: 20-34

[11:30] Team_090 possession (Score: 20-34)
Gary Brogdon drives, picks up John Quickley. Help arrives from Jaren Dosunmu! Gary Brogdon attempts a Dunk. Contested by Jaren Dosunmu (3.7 feet, ZONE). GARY BROGDON MAKES IT!
Score: 22-34

[11:15] Team_007 possession (Score: 22-34)
Jaren Dosunmu drives, picks up Larry Bridges. Help arrives from Zach Wall! Jaren Dosunmu attempts a Layup. Contested by Zach Wall (5.1 feet, MAN). Jaren Dosunmu misses. Rebound secured by Tracy Adebayo.

[11:04] Team_090 possession (Score: 22-34)
Tracy Adebayo attempts a Midrange. Contested by John Quickley (3.5 feet, MAN). TRACY ADEBAYO MAKES IT! Assist: Zach Wall
Score: 24-34

[10:47] Team_007 possession (Score: 24-34)
Tobias Johnson drives and kicks out. John Quickley attempts a Midrange. Contested by Zach Wall (5.3 feet, ZONE). John Quickley misses. Rebound secured by Gary Brogdon.

[10:31] Team_090 possession (Score: 24-34)
Gary Brogdon attempts a Midrange. Contested by John Quickley (3.9 feet, ZONE). GARY BROGDON MAKES IT!
Score: 26-34

[10:14] Team_007 possession (Score: 26-34)
Tobias Johnson drives and kicks out. Bones Siakam attempts a Midrange. Contested by Tracy Adebayo (5.4 feet, ZONE). BONES SIAKAM MAKES IT! Assist: Tobias Johnson
Score: 26-36

[09:56] Team_090 possession (Score: 26-36)
Gary Brogdon attempts a Layup. Contested by John Quickley (3.9 feet, ZONE). GARY BROGDON MAKES IT! Assist: Derrick Mitchell
Score: 28-36

[09:44] Team_007 possession (Score: 28-36)
Tobias Johnson attempts a 3Pt. Contested by Derrick Mitchell (4.0 feet, ZONE). TOBIAS JOHNSON MAKES IT! Assist: John Quickley
Score: 28-39

[09:28] Team_090 possession (Score: 28-39)
Zach Wall attempts a 3Pt. Contested by Bones Siakam (4.6 feet, MAN). Zach Wall misses. Rebound secured by Bones Siakam.

[09:13] Team_007 possession (Score: 28-39)
Bones Siakam attempts a 3Pt. Contested by Zach Wall (5.4 feet, MAN). BONES SIAKAM MAKES IT! Assist: Tobias Johnson
Score: 28-42

[08:58] Team_090 possession (Score: 28-42)
Tracy Adebayo drives to the basket... Tracy Adebayo commits a violation (traveling/carry)! TURNOVER! (dead ball)

[08:58] Substitution (Team_090): Derrick Mitchell OUT → OG Anunoby IN (stamina_rule2)

[08:58] Substitution (Team_090): Larry Bridges OUT → Josh Wall IN (stamina_rule2)

[08:58] Substitution (Team_090): Zach Wall OUT → Russell Smith IN (stamina_rule2)

[08:58] Substitution (Team_090): Gary Brogdon OUT → Derrick Nowitzki IN (stamina_rule2)

[08:58] Substitution (Team_090): Tracy Adebayo OUT → Tobias Tatum IN (stamina_rule2)

[08:58] Substitution (Team_007): Tobias Johnson OUT → Wendell Poole IN (stamina_rule2)

[08:58] Substitution (Team_007): Jaren Dosunmu OUT → OG Porzingis IN (stamina_rule2)

[08:58] Substitution (Team_007): Bones Siakam OUT → Gary LaVine IN (stamina_rule2)

[08:58] Substitution (Team_007): John Quickley OUT → Austin Simons IN (stamina_rule2)

[08:58] Substitution (Team_007): Carmelo Siakam OUT → Draymond Harris IN (stamina_rule2)

[08:46] Team_007 possession (Score: 28-42)
OG Porzingis throws a bad pass out of bounds! TURNOVER! (dead ball)

[08:35] Team_090 possession (Score: 28-42)
FOUL! Holding foul on OG Porzingis. [Team fouls: 1] No free throws, side out. (OG Porzingis: 1 personal fouls)

[08:23] Team_090 possession (Score: 28-42)
Derrick Nowitzki attempts a Midrange. Contested by Austin Simons (3.4 feet, ZONE). Derrick Nowitzki misses. Rebound secured by Draymond Harris.

[08:12] Team_007 possession (Score: 28-42)
Draymond Harris attempts a Midrange. Contested by Russell Smith (4.3 feet, ZONE). DRAYMOND HARRIS MAKES IT! Assist: Austin Simons
Score: 28-44

[07:57] Team_090 possession (Score: 28-44)
FOUL! Reach-in foul on Draymond Harris during the drive. [Team fouls: 2] No free throws, side out. (Draymond Harris: 1 personal fouls)

[07:43] Team_090 possession (Score: 28-44)
Russell Smith attempts a Layup. Contested by Gary LaVine (4.6 feet, MAN). Russell Smith misses. Rebound secured by Gary LaVine.

[07:25] Team_007 possession (Score: 28-44)
Draymond Harris drives, Derrick Nowitzki stays with him. Draymond Harris attempts a Layup. Contested by Derrick Nowitzki (4.3 feet, ZONE). DRAYMOND HARRIS MAKES IT!
Score: 28-46

[07:12] Team_090 possession (Score: 28-46)
OG Anunoby attempts a 3Pt. Contested by Wendell Poole (5.3 feet, MAN). OG Anunoby misses. Rebound secured by Gary LaVine.

[07:01] Team_007 possession (Score: 28-46)
Gary LaVine drives to the basket... FOUL! Offensive foul on Gary LaVine! Russell Smith drew the charge! [Team fouls: 3] (Gary LaVine: 1 personal fouls) TURNOVER! (dead ball)

[06:47] Team_090 possession (Score: 28-46)
Josh Wall attempts a 3Pt. Contested by OG Porzingis (4.7 feet, MAN). Josh Wall misses. Offensive rebound by Tobias Tatum! Tobias Tatum kicks it out.

[06:33] Team_090 possession (Score: 28-46)
Josh Wall attempts a Midrange. Contested by Gary LaVine (4.7 feet, ZONE). JOSH WALL MAKES IT!
Score: 30-46

[06:20] Team_007 possession (Score: 30-46)
Wendell Poole attempts a Midrange. Contested by Russell Smith (4.6 feet, ZONE). WENDELL POOLE MAKES IT!
Score: 30-48

[06:06] Team_090 possession (Score: 30-48)
Tobias Tatum drives and kicks out. Tobias Tatum attempts a 3Pt. Contested by OG Porzingis (4.3 feet, ZONE). Tobias Tatum misses. Rebound secured by Draymond Harris.

[05:53] Team_007 possession (Score: 30-48)
Wendell Poole attempts a 3Pt. Contested by Russell Smith (4.6 feet, ZONE). Wendell Poole misses. Rebound secured by Tobias Tatum.

[05:35] Team_090 possession (Score: 30-48)
Derrick Nowitzki attempts a 3Pt. Contested by OG Porzingis (3.9 feet, ZONE). Derrick Nowitzki misses. Rebound secured by Austin Simons.

[05:21] Team_007 possession (Score: 30-48)
Draymond Harris throws a bad pass! Stolen by Tobias Tatum! TURNOVER! (live ball)

[05:07] Team_090 possession (Score: 30-48)
FOUL! Shooting foul on Austin Simons. Derrick Nowitzki to the line for 2 free throws. [Team fouls: 4] (Austin Simons: 1 personal fouls)   FT 1/2: GOOD   FT 2/2: MISS Derrick Nowitzki makes 1/2 from the line. Rebound secured by Gary LaVine.
Score: 31-48

[04:51] Team_007 possession (Score: 31-48)
OG Porzingis attempts a 3Pt. Contested by Josh Wall (3.7 feet, MAN). OG Porzingis misses. Offensive rebound by Draymond Harris! Draymond Harris kicks it out.

[04:35] Team_007 possession (Score: 31-48)
Gary LaVine attempts a Midrange. Contested by Russell Smith (4.5 feet, ZONE). Gary LaVine misses. Rebound secured by Tobias Tatum.

[04:23] Team_090 possession (Score: 31-48)
OG Anunoby attempts a 3Pt. Contested by OG Porzingis (4.3 feet, ZONE). OG Anunoby misses. Rebound secured by Gary LaVine.

[04:05] Team_007 possession (Score: 31-48)
Gary LaVine drives to the basket... Gary LaVine throws a bad pass! Stolen by Russell Smith! TURNOVER! (live ball)

[03:53] Team_090 possession (Score: 31-48)
Russell Smith attempts a 3Pt. Contested by OG Porzingis (4.5 feet, ZONE). RUSSELL SMITH MAKES IT! Assist: Derrick Nowitzki
Score: 34-48

[03:41] Team_007 possession (Score: 34-48)
FOUL! Holding foul on Josh Wall. [Team fouls: 2] No free throws, side out. (Josh Wall: 1 personal fouls)

[03:26] Team_007 possession (Score: 34-48)
Austin Simons drives and kicks out. Wendell Poole attempts a Midrange. Contested by OG Anunoby (5.0 feet, ZONE). WENDELL POOLE MAKES IT! Assist: Gary LaVine
Score: 34-50

[03:13] Team_090 possession (Score: 34-50)
FOUL! Shooting foul on OG Porzingis. Josh Wall to the line for 2 free throws. [BONUS: 5 team fouls] (OG Porzingis: 2 personal fouls)   FT 1/2: GOOD   FT 2/2: GOOD Josh Wall makes 2/2 from the line.
Score: 36-50

[02:56] Team_007 possession (Score: 36-50)
OG Porzingis drives, picks up Derrick Nowitzki. Help arrives from Josh Wall! OG Porzingis attempts a Layup. Contested by Josh Wall (4.0 feet, ZONE). OG PORZINGIS MAKES IT!
Score: 36-52

[02:40] Team_090 possession (Score: 36-52)
Russell Smith attempts a 3Pt. Contested by Gary LaVine (4.6 feet, MAN). Russell Smith misses. Rebound secured by Austin Simons.

[02:24] Team_007 possession (Score: 36-52)
Gary LaVine attempts a Layup. Contested by Russell Smith (4.5 feet, MAN). GARY LAVINE MAKES IT!
Score: 36-54

[02:13] Team_090 possession (Score: 36-54)
Russell Smith attempts a 3Pt. Contested by Gary LaVine (4.6 feet, MAN). Russell Smith misses. Offensive rebound by Russell Smith! Russell Smith kicks it out.

[01:55] Team_090 possession (Score: 36-54)
OG Anunoby attempts a 3Pt. Contested by OG Porzingis (4.3 feet, ZONE). OG Anunoby misses. Rebound secured by Draymond Harris.

[01:39] Team_007 possession (Score: 36-54)
Austin Simons attempts a 3Pt. Contested by Derrick Nowitzki (4.8 feet, MAN). Austin Simons misses. FOUL! Loose ball foul on Tobias Tatum during the rebound battle. [Team fouls: 3] No free throws, side out. (Tobias Tatum: 1 personal fouls)

[01:30] Team_007 possession (Score: 36-54)
Austin Simons makes the Dunk and draws the foul on Derrick Nowitzki! And-1! Austin Simons to the line for 1. [Team fouls: 4] (Derrick Nowitzki: 1 personal fouls)   FT 1/1: GOOD Austin Simons makes 1/1 from the line.
Score: 36-57

[01:15] Team_090 possession (Score: 36-57)
Josh Wall makes the Dunk and draws the foul on OG Porzingis! And-1! Josh Wall to the line for 1. [BONUS: 6 team fouls] (OG Porzingis: 3 personal fouls)   FT 1/1: GOOD Josh Wall makes 1/1 from the line.
Score: 39-57

[00:58] Team_007 possession (Score: 39-57)
Gary LaVine drives and kicks out. OG Porzingis attempts a 3Pt. Contested by Russell Smith (4.5 feet, ZONE). OG Porzingis misses. Rebound secured by Derrick Nowitzki.

[00:43] Team_090 possession (Score: 39-57)
Russell Smith attempts a Midrange. Contested by Gary LaVine (4.7 feet, MAN). Russell Smith misses. FOUL! Loose ball foul on Austin Simons during the rebound battle. [IN THE BONUS! 7 team fouls] Russell Smith to the line for 2 free throws. (Austin Simons: 2 personal fouls)   FT 1/2: GOOD   FT 2/2: GOOD Russell Smith makes 2/2 from the line.
Score: 41-57

[00:26] Team_007 possession (Score: 41-57)
OG Porzingis attempts a 3Pt. Contested by Russell Smith (4.1 feet, ZONE). OG Porzingis misses. Rebound secured by Russell Smith.

[00:10] Team_090 possession (Score: 41-57)
Tobias Tatum makes the Dunk and draws the foul on Draymond Harris! And-1! Tobias Tatum to the line for 1. [BONUS: 8 team fouls] (Draymond Harris: 2 personal fouls)   FT 1/1: GOOD Tobias Tatum makes 1/1 from the line.
Score: 44-57

================================================================================
                              2ND QUARTER COMPLETE                              
================================================================================

2ND QUARTER SCORE: Team_090 24, Team_007 25

BOX SCORE:
================================================================================

Team_090
--------------------------------------------------------------------------------
Player                MIN  PTS  REB  AST  TO      FG   FG%      3P   3P%
--------------------------------------------------------------------------------
Josh Wall               9    7    0    0   0   3/3   100.0     0/0   0.0
Gary Brogdon           15    6    1    0   0   3/4    75.0     0/0   0.0
Russell Smith           9    5    2    0   0   2/4    50.0     0/0   0.0
Tobias Tatum            9    3    3    0   0   1/2    50.0     0/0   0.0
Tracy Adebayo          15    2    2    0   0   1/1   100.0     0/0   0.0
Zach Wall              15    0    0    1   0   0/1     0.0     0/0   0.0
Derrick Mitchell       15    0    0    1   0   0/0     0.0     0/0   0.0
Derrick Nowitzki        9    0    1    1   0   0/3     0.0     0/0   0.0
OG Anunoby              9    0    0    0   0   0/3     0.0     0/0   0.0

TEAM: FG: 10/21 (47.6%), 3PT: 1/8 (12.5%), REB: 9 (2 off, 7 def), AST: 3, TO: 1
TEAM FOULS: 4


Team_007
--------------------------------------------------------------------------------
Player                MIN  PTS  REB  AST  TO      FG   FG%      3P   3P%
--------------------------------------------------------------------------------
Bones Siakam           15    5    2    0   0   2/2   100.0     0/0   0.0
Draymond Harris         9    4    5    0   0   2/2   100.0     0/0   0.0
Wendell Poole           9    4    0    0   0   2/3    66.7     0/0   0.0
Tobias Johnson         15    3    0    2   0   1/2    50.0     0/0   0.0
Austin Simons           9    3    2    1   0   1/1   100.0     0/0   0.0
Gary LaVine             9    2    4    1   0   1/3    33.3     0/0   0.0
OG Porzingis            9    2    0    0   0   1/2    50.0     0/0   0.0
Jaren Dosunmu          15    0    0    0   0   0/2     0.0     0/0   0.0
John Quickley          15    0    0    1   0   0/0     0.0     0/0   0.0

TEAM: FG: 10/17 (58.8%), 3PT: 2/4 (50.0%), REB: 13 (2 off, 11 def), AST: 5, TO: 4
TEAM FOULS: 8 [Team_090 in BONUS]

================================================================================

================================================================================
                       3RD QUARTER - Team_090 vs Team_007                       
================================================================================

[12:00] Team_090 possession (Score: 44-57)
FOUL! Reach-in foul on John Quickley during the drive. [Team fouls: 1] No free throws, side out. (John Quickley: 1 personal fouls)

[11:48] Team_090 possession (Score: 44-57)
Zach Wall attempts a 3Pt. Contested by John Quickley (3.3 feet, ZONE). ZACH WALL MAKES IT! Assist: Derrick Mitchell
Score: 47-57

[11:33] Team_007 possession (Score: 47-57)
FOUL! Holding foul on Gary Brogdon. [Team fouls: 1] No free throws, side out. (Gary Brogdon: 1 personal fouls)

[11:19] Team_007 possession (Score: 47-57)
Bones Siakam attempts a Midrange. Contested by Larry Bridges (4.9 feet, ZONE). BONES SIAKAM MAKES IT! Assist: Tobias Johnson
Score: 47-59

[11:06] Team_090 possession (Score: 47-59)
Derrick Mitchell attempts a 3Pt. Contested by John Quickley (3.3 feet, ZONE). Derrick Mitchell misses. Rebound secured by John Quickley.

[10:52] Team_007 possession (Score: 47-59)
Bones Siakam drives and kicks out. Tobias Johnson attempts a Midrange. Contested by Zach Wall (5.0 feet, ZONE). Tobias Johnson misses. Rebound secured by Gary Brogdon.

[10:37] Team_090 possession (Score: 47-59)
Larry Bridges attempts a Midrange. Contested by Jaren Dosunmu (4.5 feet, MAN). Larry Bridges misses. Rebound secured by John Quickley.

[10:26] Team_007 possession (Score: 47-59)
Carmelo Siakam drives, picks up Tracy Adebayo. Help arrives from Larry Bridges! Carmelo Siakam attempts a Layup. Contested by Larry Bridges (5.2 feet, MAN). CARMELO SIAKAM MAKES IT! Assist: Tobias Johnson
Score: 47-61

[10:09] Team_090 possession (Score: 47-61)
Zach Wall attempts a Layup. Contested by Bones Siakam (3.9 feet, MAN). ZACH WALL MAKES IT! Assist: Derrick Mitchell
Score: 49-61

[09:54] Team_007 possession (Score: 49-61)
Bones Siakam drives, Zach Wall stays with him. Bones Siakam attempts a Dunk. Contested by Zach Wall (5.1 feet, MAN). BONES SIAKAM MAKES IT! Assist: John Quickley
Score: 49-63

[09:42] Team_090 possession (Score: 49-63)
FOUL! Shooting foul on John Quickley. Tracy Adebayo to the line for 2 free throws. [Team fouls: 2] (John Quickley: 2 personal fouls)   FT 1/2: GOOD   FT 2/2: MISS Tracy Adebayo makes 1/2 from the line. Rebound secured by Bones Siakam.
Score: 50-63

[09:26] Team_007 possession (Score: 50-63)
Bones Siakam attempts a Midrange. Contested by Gary Brogdon (3.7 feet, ZONE). Bones Siakam misses. Rebound secured by Gary Brogdon.

[09:10] Team_090 possession (Score: 50-63)
Gary Brogdon attempts a Midrange. Contested by John Quickley (3.2 feet, MAN). Gary Brogdon misses. Rebound secured by Bones Siakam.

[08:59] Team_007 possession (Score: 50-63)
FOUL! Reach-in foul on Gary Brogdon during the drive. [Team fouls: 2] No free throws, side out. (Gary Brogdon: 2 personal fouls)

[08:47] Team_007 possession (Score: 50-63)
Bones Siakam drives, picks up Gary Brogdon. Help arrives from Larry Bridges! Bones Siakam attempts a Dunk. Contested by Larry Bridges (3.7 feet, ZONE). Bones Siakam misses. Rebound secured by Zach Wall.

[08:36] Team_090 possession (Score: 50-63)
FOUL! Holding foul on Tobias Johnson. [Team fouls: 3] No free throws, side out. (Tobias Johnson: 1 personal fouls)

[08:21] Team_090 possession (Score: 50-63)
Gary Brogdon drives, picks up John Quickley. Help arrives from Jaren Dosunmu! Gary Brogdon attempts a Layup. Contested by Jaren Dosunmu (3.2 feet, ZONE). GARY BROGDON MAKES IT!
Score: 52-63

[08:05] Team_007 possession (Score: 52-63)
Jaren Dosunmu attempts a Midrange. Contested by Zach Wall (5.0 feet, ZONE). JAREN DOSUNMU MAKES IT! Assist: Bones Siakam
Score: 52-65

[07:49] Team_090 possession (Score: 52-65)
Derrick Mitchell attempts a Layup. BLOCKED BY JOHN QUICKLEY! Ball goes out off John Quickley. Derrick Mitchell's ball!

[07:34] Team_090 possession (Score: 52-65)
FOUL! Reach-in foul on Tobias Johnson during the drive. [Team fouls: 4] No free throws, side out. (Tobias Johnson: 2 personal fouls)

[07:19] Team_090 possession (Score: 52-65)
Tracy Adebayo throws a bad pass! Stolen by John Quickley! TURNOVER! (live ball)

[07:03] Team_007 possession (Score: 52-65)
Bones Siakam attempts a 3Pt. Contested by Derrick Mitchell (3.3 feet, ZONE). Bones Siakam misses. Rebound secured by Zach Wall.

[06:52] Team_090 possession (Score: 52-65)
Tracy Adebayo attempts a 3Pt. Contested by John Quickley (2.9 feet, ZONE). TRACY ADEBAYO MAKES IT! Assist: Larry Bridges
Score: 55-65

[06:37] Team_007 possession (Score: 55-65)
Jaren Dosunmu drives to the basket... Jaren Dosunmu loses the ball! Stripped by Gary Brogdon! TURNOVER! (live ball)

[06:25] Team_090 possession (Score: 55-65)
Larry Bridges attempts a 3Pt. Contested by Jaren Dosunmu (4.5 feet, MAN). LARRY BRIDGES MAKES IT! Assist: Derrick Mitchell
Score: 58-65

[06:07] Team_007 possession (Score: 58-65)
Jaren Dosunmu drives and kicks out. FOUL! Shooting foul on Derrick Mitchell. Tobias Johnson to the line for 3 free throws. [Team fouls: 3] (Derrick Mitchell: 1 personal fouls)   FT 1/3: GOOD   FT 2/3: GOOD   FT 3/3: GOOD Tobias Johnson makes 3/3 from the line.
Score: 58-68

[05:50] Team_090 possession (Score: 58-68)
Gary Brogdon attempts a 3Pt. Contested by John Quickley (3.3 feet, ZONE). Gary Brogdon misses. Rebound secured by John Quickley.

[05:35] Team_007 possession (Score: 58-68)
Bones Siakam attempts a Layup. Contested by Zach Wall (5.1 feet, MAN). Bones Siakam misses. Rebound secured by Zach Wall.

[05:23] Team_090 possession (Score: 58-68)
Tracy Adebayo attempts a Layup. Contested by John Quickley (2.9 feet, ZONE). Tracy Adebayo misses. Offensive rebound by Gary Brogdon! Gary Brogdon kicks it out.

[05:05] Team_090 possession (Score: 58-68)
Zach Wall drives, picks up John Quickley. Help arrives from Jaren Dosunmu! Zach Wall attempts a Dunk. Contested by Jaren Dosunmu (3.4 feet, ZONE). ZACH WALL MAKES IT!
Score: 60-68

[04:52] Team_007 possession (Score: 60-68)
Jaren Dosunmu attempts a 3Pt. Contested by Larry Bridges (4.8 feet, MAN). Jaren Dosunmu misses. Rebound secured by Gary Brogdon.

[04:39] Team_090 possession (Score: 60-68)
FOUL! Shooting foul on John Quickley. Gary Brogdon to the line for 2 free throws. [BONUS: 5 team fouls] (John Quickley: 3 personal fouls)   FT 1/2: GOOD   FT 2/2: GOOD Gary Brogdon makes 2/2 from the line.
Score: 62-68

[04:27] Team_007 possession (Score: 62-68)
Bones Siakam makes the Layup and draws the foul on Zach Wall! And-1! Bones Siakam to the line for 1. [Team fouls: 4] (Zach Wall: 1 personal fouls)   FT 1/1: GOOD Bones Siakam makes 1/1 from the line.
Score: 62-71

[04:14] Team_090 possession (Score: 62-71)
Larry Bridges attempts a Midrange. Contested by John Quickley (3.3 feet, ZONE). Larry Bridges misses. Rebound secured by Bones Siakam.

[03:58] Team_007 possession (Score: 62-71)
John Quickley attempts a Midrange. Contested by Gary Brogdon (4.5 feet, MAN). John Quickley misses. Rebound secured by Zach Wall.

[03:45] Team_090 possession (Score: 62-71)
Derrick Mitchell drives and kicks out. Gary Brogdon attempts a 3Pt. Contested by John Quickley (3.3 feet, ZONE). Gary Brogdon misses. Rebound secured by Carmelo Siakam.

[03:34] Team_007 possession (Score: 62-71)
Bones Siakam attempts a 3Pt. Contested by Derrick Mitchell (3.4 feet, ZONE). Bones Siakam misses. Rebound secured by Zach Wall.

[03:15] Team_090 possession (Score: 62-71)
Derrick Mitchell attempts a 3Pt. Contested by John Quickley (3.6 feet, ZONE). DERRICK MITCHELL MAKES IT! Assist: Larry Bridges
Score: 65-71

[02:57] Team_007 possession (Score: 65-71)
FOUL! Holding foul on Tracy Adebayo. [IN THE BONUS! 5 team fouls] Carmelo Siakam to the line for 2 free throws. (Tracy Adebayo: 1 personal fouls)   FT 1/2: GOOD   FT 2/2: MISS Carmelo Siakam makes 1/2 from the line. FOUL! Loose ball foul on Gary Brogdon during the free throw rebound! [IN THE BONUS! 6 team fouls] Bones Siakam to the line for 2 free throws. (Gary Brogdon: 3 personal fouls)   FT 1/2: GOOD   FT 2/2: GOOD Bones Siakam makes 2/2 from the line.
Score: 65-74

[02:45] Team_090 possession (Score: 65-74)
Zach Wall drives and kicks out. Zach Wall attempts a 3Pt. Contested by John Quickley (3.4 feet, ZONE). Zach Wall misses. Rebound secured by Bones Siakam.

[02:31] Team_007 possession (Score: 65-74)
Bones Siakam attempts a 3Pt. Contested by Gary Brogdon (4.1 feet, ZONE). Bones Siakam misses. Rebound secured by Tracy Adebayo.

[02:15] Team_090 possession (Score: 65-74)
FOUL! Shooting foul on Tobias Johnson. Derrick Mitchell to the line for 3 free throws. [BONUS: 6 team fouls] (Tobias Johnson: 3 personal fouls)   FT 1/3: GOOD   FT 2/3: MISS   FT 3/3: MISS Derrick Mitchell makes 1/3 from the line. Offensive rebound by Zach Wall! Zach Wall kicks it out.
Score: 66-74

[02:02] Team_090 possession (Score: 66-74)
Derrick Mitchell makes the Midrange and draws the foul on Bones Siakam! And-1! Derrick Mitchell to the line for 1. [BONUS: 7 team fouls] (Bones Siakam: 1 personal fouls)   FT 1/1: GOOD Derrick Mitchell makes 1/1 from the line.
Score: 69-74

[01:48] Team_007 possession (Score: 69-74)
FOUL! Holding foul on Tracy Adebayo. [IN THE BONUS! 7 team fouls] Carmelo Siakam to the line for 2 free throws. (Tracy Adebayo: 2 personal fouls)   FT 1/2: GOOD   FT 2/2: GOOD Carmelo Siakam makes 2/2 from the line.
Score: 69-76

[01:37] Team_090 possession (Score: 69-76)
Zach Wall attempts a 3Pt. Contested by Bones Siakam (4.3 feet, MAN). Zach Wall misses. Rebound secured by Bones Siakam.

[01:28] Team_007 possession (Score: 69-76)
Tobias Johnson attempts a 3Pt. Contested by Derrick Mitchell (3.8 feet, MAN). Tobias Johnson misses. Rebound secured by Tracy Adebayo.

[01:19] Team_090 possession (Score: 69-76)
Tracy Adebayo attempts a Layup. Contested by John Quickley (3.5 feet, ZONE). TRACY ADEBAYO MAKES IT!
Score: 71-76

[01:04] Team_007 possession (Score: 71-76)
Jaren Dosunmu attempts a Midrange. Contested by Tracy Adebayo (5.3 feet, ZONE). Jaren Dosunmu misses. Rebound secured by Tracy Adebayo.

[00:45] Team_090 possession (Score: 71-76)
Larry Bridges attempts a 3Pt. Contested by John Quickley (3.8 feet, ZONE). Larry Bridges misses. Rebound secured by Carmelo Siakam.

[00:34] Team_007 possession (Score: 71-76)
John Quickley drives and kicks out. Bones Siakam attempts a 3Pt. Contested by Derrick Mitchell (3.7 feet, ZONE). Bones Siakam misses. Rebound secured by Tracy Adebayo.

[00:22] Team_090 possession (Score: 71-76)
Tracy Adebayo makes the Midrange and draws the foul on John Quickley! And-1! Tracy Adebayo to the line for 1. [BONUS: 8 team fouls] (John Quickley: 4 personal fouls)   FT 1/1: MISS Tracy Adebayo makes 0/1 from the line. Rebound secured by Bones Siakam.
Score: 73-76

[00:04] Team_007 possession (Score: 73-76)
John Quickley loses the ball! Stripped by Gary Brogdon! TURNOVER! (live ball)

================================================================================
                              3RD QUARTER COMPLETE                              
================================================================================

3RD QUARTER SCORE: Team_090 29, Team_007 19

BOX SCORE:
================================================================================

Team_090
--------------------------------------------------------------------------------
Player                MIN  PTS  REB  AST  TO      FG   FG%      3P   3P%
--------------------------------------------------------------------------------
Zach Wall              27    7    6    0   0   3/5    60.0     0/0   0.0
Derrick Mitchell       27    6    0    3   0   2/4    50.0     0/0   0.0
Tracy Adebayo          27    5    4    0   0   2/4    50.0     0/0   0.0
Gary Brogdon           27    4    4    0   0   2/4    50.0     0/0   0.0
Larry Bridges          27    3    0    2   0   1/4    25.0     0/0   0.0

TEAM: FG: 10/21 (47.6%), 3PT: 4/8 (50.0%), REB: 14 (2 off, 12 def), AST: 5, TO: 1
TEAM FOULS: 7 [Team_007 in BONUS]


Team_007
--------------------------------------------------------------------------------
Player                MIN  PTS  REB  AST  TO      FG   FG%      3P   3P%
--------------------------------------------------------------------------------
Bones Siakam           27   10    6    1   0   4/11   36.4     0/0   0.0
Carmelo Siakam         27    4    2    0   0   2/2   100.0     0/0   0.0
Tobias Johnson         27    3    0    2   0   1/2    50.0     0/0   0.0
Jaren Dosunmu          27    2    0    0   0   1/3    33.3     0/0   0.0
John Quickley          27    0    3    1   0   0/2     0.0     0/0   0.0

TEAM: FG: 8/20 (40.0%), 3PT: 0/5 (0.0%), REB: 11 (0 off, 11 def), AST: 4, TO: 2
TEAM FOULS: 8 [Team_090 in BONUS]

================================================================================

================================================================================
                       4TH QUARTER - Team_090 vs Team_007                       
================================================================================

[12:00] Team_090 possession (Score: 73-76)
Zach Wall throws a bad pass! Stolen by Bones Siakam! TURNOVER! (live ball)

[11:46] Team_007 possession (Score: 73-76)
Tobias Johnson attempts a Layup. Contested by Derrick Mitchell (3.8 feet, MAN). TOBIAS JOHNSON MAKES IT! Assist: John Quickley
Score: 73-78

[11:32] Team_090 possession (Score: 73-78)
Tracy Adebayo drives to the basket... Tracy Adebayo throws a bad pass! Stolen by John Quickley! TURNOVER! (live ball)

[11:18] Team_007 possession (Score: 73-78)
Carmelo Siakam loses the ball! Stripped by Tracy Adebayo! TURNOVER! (live ball)

[11:04] Team_090 possession (Score: 73-78)
Derrick Mitchell attempts a 3Pt. Contested by Tobias Johnson (5.5 feet, MAN). Derrick Mitchell misses. Offensive rebound by Tracy Adebayo! Tracy Adebayo kicks it out.

[10:50] Team_090 possession (Score: 73-78)
Gary Brogdon makes the Midrange and draws the foul on John Quickley! And-1! Gary Brogdon to the line for 1. [Team fouls: 1] (John Quickley: 1 personal fouls)   FT 1/1: MISS Gary Brogdon makes 0/1 from the line. Rebound secured by John Quickley.
Score: 75-78

[10:37] Team_007 possession (Score: 75-78)
John Quickley attempts a Midrange. Contested by Larry Bridges (5.7 feet, ZONE). John Quickley misses. Offensive rebound by Carmelo Siakam! Carmelo Siakam puts it back in!
Score: 75-80

[10:21] Team_090 possession (Score: 75-80)
Zach Wall attempts a 3Pt. Contested by John Quickley (4.1 feet, ZONE). Zach Wall misses. Rebound secured by Carmelo Siakam.

[10:10] Team_007 possession (Score: 75-80)
Tobias Johnson attempts a 3Pt. Contested by Derrick Mitchell (4.0 feet, MAN). Tobias Johnson misses. Rebound secured by Zach Wall.

[09:58] Team_090 possession (Score: 75-80)
Derrick Mitchell loses control! Ball rolls out of bounds! TURNOVER! (dead ball)

[09:58] Substitution (Team_090): Derrick Mitchell OUT → OG Anunoby IN (stamina_rule2)

[09:58] Substitution (Team_090): Larry Bridges OUT → Josh Wall IN (stamina_rule2)

[09:58] Substitution (Team_090): Zach Wall OUT → Russell Smith IN (stamina_rule2)

[09:58] Substitution (Team_090): Gary Brogdon OUT → Derrick Nowitzki IN (stamina_rule2)

[09:58] Substitution (Team_090): Tracy Adebayo OUT → Tobias Tatum IN (stamina_rule2)

[09:58] Substitution (Team_007): Tobias Johnson OUT → Wendell Poole IN (stamina_rule2)

[09:58] Substitution (Team_007): Jaren Dosunmu OUT → OG Porzingis IN (stamina_rule2)

[09:58] Substitution (Team_007): Bones Siakam OUT → Gary LaVine IN (stamina_rule2)

[09:58] Substitution (Team_007): John Quickley OUT → Austin Simons IN (stamina_rule2)

[09:58] Substitution (Team_007): Carmelo Siakam OUT → Draymond Harris IN (stamina_rule2)

[09:45] Team_007 possession (Score: 75-80)
OG Porzingis makes the 3Pt and draws the foul on Russell Smith! And-1! OG Porzingis to the line for 1. [Team fouls: 1] (Russell Smith: 1 personal fouls)   FT 1/1: GOOD OG Porzingis makes 1/1 from the line.
Score: 75-84

[09:30] Team_090 possession (Score: 75-84)
FOUL! Reach-in foul on Austin Simons during the drive. [Team fouls: 2] No free throws, side out. (Austin Simons: 1 personal fouls)

[09:18] Team_090 possession (Score: 75-84)
Derrick Nowitzki attempts a Layup. BLOCKED BY AUSTIN SIMONS! Ball is loose! Rebound secured by Gary LaVine.

[09:04] Team_007 possession (Score: 75-84)
Austin Simons attempts a Layup. Contested by Derrick Nowitzki (4.7 feet, MAN). Austin Simons misses. Rebound secured by Russell Smith.

[08:49] Team_090 possession (Score: 75-84)
OG Anunoby attempts a 3Pt. Contested by Wendell Poole (5.3 feet, MAN). OG ANUNOBY MAKES IT! Assist: Josh Wall
Score: 78-84

[08:31] Team_007 possession (Score: 78-84)
Gary LaVine throws a bad pass out of bounds! TURNOVER! (dead ball)

[08:15] Team_090 possession (Score: 78-84)
OG Anunoby attempts a Layup. Contested by Wendell Poole (5.3 feet, MAN). OG Anunoby misses. Rebound secured by Gary LaVine.

[08:00] Team_007 possession (Score: 78-84)
Wendell Poole drives, OG Anunoby stays with him. Wendell Poole attempts a Dunk. Contested by OG Anunoby (5.3 feet, MAN). WENDELL POOLE MAKES IT! Assist: OG Porzingis
Score: 78-86

[07:47] Team_090 possession (Score: 78-86)
OG Anunoby drives, Austin Simons stays with him. OG Anunoby attempts a Layup. Contested by Austin Simons (3.9 feet, ZONE). OG ANUNOBY MAKES IT! Assist: Russell Smith
Score: 80-86

[07:33] Team_007 possession (Score: 80-86)
Draymond Harris makes the Layup and draws the foul on Derrick Nowitzki! And-1! Draymond Harris to the line for 1. [Team fouls: 2] (Derrick Nowitzki: 1 personal fouls)   FT 1/1: GOOD Draymond Harris makes 1/1 from the line.
Score: 80-89

[07:21] Team_090 possession (Score: 80-89)
FOUL! Holding foul on Wendell Poole. [Team fouls: 3] No free throws, side out. (Wendell Poole: 1 personal fouls)

[07:09] Team_090 possession (Score: 80-89)
Derrick Nowitzki attempts a Midrange. Contested by Austin Simons (3.4 feet, MAN). Derrick Nowitzki misses. Offensive rebound by Russell Smith! Russell Smith kicks it out.

[06:56] Team_090 possession (Score: 80-89)
FOUL! Offensive foul on OG Anunoby! Wendell Poole drew the charge! [Team fouls: 3] (OG Anunoby: 1 personal fouls) TURNOVER! (dead ball)

[06:46] Team_007 possession (Score: 80-89)
Austin Simons drives and kicks out. OG Porzingis makes the Midrange and draws the foul on Josh Wall! And-1! OG Porzingis to the line for 1. [Team fouls: 4] (Josh Wall: 1 personal fouls)   FT 1/1: GOOD OG Porzingis makes 1/1 from the line.
Score: 80-92

[06:30] Team_090 possession (Score: 80-92)
FOUL! Shooting foul on Austin Simons. Tobias Tatum to the line for 2 free throws. [Team fouls: 4] (Austin Simons: 2 personal fouls)   FT 1/2: GOOD   FT 2/2: GOOD Tobias Tatum makes 2/2 from the line.
Score: 82-92

[06:15] Team_007 possession (Score: 82-92)
Draymond Harris makes the Layup and draws the foul on Derrick Nowitzki! And-1! Draymond Harris to the line for 1. [BONUS: 5 team fouls] (Derrick Nowitzki: 2 personal fouls)   FT 1/1: GOOD Draymond Harris makes 1/1 from the line.
Score: 82-95

[05:59] Team_090 possession (Score: 82-95)
Josh Wall attempts a Midrange. Contested by OG Porzingis (4.7 feet, MAN). Josh Wall misses. Rebound secured by Gary LaVine.

[05:45] Team_007 possession (Score: 82-95)
Wendell Poole attempts a 3Pt. Contested by Russell Smith (4.6 feet, ZONE). Wendell Poole misses. FOUL! Loose ball foul on Tobias Tatum during the rebound battle. [IN THE BONUS! 6 team fouls] Austin Simons to the line for 2 free throws. (Tobias Tatum: 1 personal fouls)   FT 1/2: GOOD   FT 2/2: GOOD Austin Simons makes 2/2 from the line.
Score: 82-97

[05:30] Team_090 possession (Score: 82-97)
OG Anunoby attempts a Midrange. Contested by Wendell Poole (5.3 feet, MAN). OG ANUNOBY MAKES IT! Assist: Josh Wall
Score: 84-97

[05:13] Team_007 possession (Score: 84-97)
Gary LaVine attempts a 3Pt. Contested by Russell Smith (4.5 feet, ZONE). Gary LaVine misses. Rebound secured by Derrick Nowitzki.

[04:59] Team_090 possession (Score: 84-97)
Josh Wall attempts a 3Pt. Contested by OG Porzingis (4.7 feet, MAN). Josh Wall misses. Rebound secured by Draymond Harris.

[04:48] Team_007 possession (Score: 84-97)
OG Porzingis attempts a Layup. Contested by Josh Wall (3.7 feet, MAN). OG PORZINGIS MAKES IT! Assist: Austin Simons
Score: 84-99

[04:35] Team_090 possession (Score: 84-99)
FOUL! Shooting foul on Austin Simons. Derrick Nowitzki to the line for 2 free throws. [BONUS: 5 team fouls] (Austin Simons: 3 personal fouls)   FT 1/2: GOOD   FT 2/2: GOOD Derrick Nowitzki makes 2/2 from the line.
Score: 86-99

[04:20] Team_007 possession (Score: 86-99)
Draymond Harris makes the Dunk and draws the foul on Josh Wall! And-1! Draymond Harris to the line for 1. [BONUS: 7 team fouls] (Josh Wall: 2 personal fouls)   FT 1/1: GOOD Draymond Harris makes 1/1 from the line.
Score: 86-102

[04:07] Team_090 possession (Score: 86-102)
Josh Wall loses the ball! Stripped by OG Porzingis! TURNOVER! (live ball)

[03:49] Team_007 possession (Score: 86-102)
Austin Simons commits a violation (traveling/carry)! TURNOVER! (dead ball)

[03:32] Team_090 possession (Score: 86-102)
OG Anunoby attempts a 3Pt. Contested by OG Porzingis (4.3 feet, ZONE). OG ANUNOBY MAKES IT! Assist: Josh Wall
Score: 89-102

[03:15] Team_007 possession (Score: 89-102)
FOUL! Holding foul on OG Anunoby. [IN THE BONUS! 8 team fouls] Wendell Poole to the line for 2 free throws. (OG Anunoby: 2 personal fouls)   FT 1/2: GOOD   FT 2/2: GOOD Wendell Poole makes 2/2 from the line.
Score: 89-104

[03:01] Team_090 possession (Score: 89-104)
Russell Smith attempts a Midrange. Contested by Austin Simons (4.1 feet, ZONE). RUSSELL SMITH MAKES IT!
Score: 91-104

[02:45] Team_007 possession (Score: 91-104)
FOUL! Shooting foul on Derrick Nowitzki. Draymond Harris to the line for 2 free throws. [BONUS: 9 team fouls] (Derrick Nowitzki: 3 personal fouls)   FT 1/2: GOOD   FT 2/2: GOOD Draymond Harris makes 2/2 from the line.
Score: 91-106

[02:35] Team_090 possession (Score: 91-106)
Russell Smith attempts a Midrange. Contested by Gary LaVine (4.6 feet, MAN). Russell Smith misses. Rebound secured by Draymond Harris.

[02:21] Team_007 possession (Score: 91-106)
Gary LaVine attempts a Midrange. Contested by Russell Smith (4.6 feet, ZONE). GARY LAVINE MAKES IT! Assist: Draymond Harris
Score: 91-108

[02:04] Team_090 possession (Score: 91-108)
Tobias Tatum drives and kicks out. OG Anunoby attempts a 3Pt. Contested by Gary LaVine (4.4 feet, ZONE). OG ANUNOBY MAKES IT! Assist: Josh Wall
Score: 94-108

[01:52] Team_007 possession (Score: 94-108)
Austin Simons makes the Layup and draws the foul on Derrick Nowitzki! And-1! Austin Simons to the line for 1. [BONUS: 10 team fouls] (Derrick Nowitzki: 4 personal fouls)   FT 1/1: GOOD Austin Simons makes 1/1 from the line.
Score: 94-111

[01:35] Team_090 possession (Score: 94-111)
Josh Wall drives and kicks out. OG Anunoby attempts a Midrange. Contested by Austin Simons (3.9 feet, ZONE). OG ANUNOBY MAKES IT!
Score: 96-111

[01:19] Team_007 possession (Score: 96-111)
OG Porzingis drives to the basket... OG Porzingis throws a bad pass! Stolen by Josh Wall! TURNOVER! (live ball)

[01:07] Team_090 possession (Score: 96-111)
Josh Wall makes the Layup and draws the foul on Austin Simons! And-1! Josh Wall to the line for 1. [BONUS: 6 team fouls] (Austin Simons: 4 personal fouls)   FT 1/1: GOOD Josh Wall makes 1/1 from the line.
Score: 99-111

[00:54] Team_007 possession (Score: 99-111)
Austin Simons attempts a Layup. Contested by Derrick Nowitzki (4.9 feet, MAN). Austin Simons misses. Rebound secured by Derrick Nowitzki.

[00:44] Team_090 possession (Score: 99-111)
Tobias Tatum makes the Midrange and draws the foul on Austin Simons! And-1! Tobias Tatum to the line for 1. [BONUS: 7 team fouls] (Austin Simons: 5 personal fouls)   FT 1/1: GOOD Tobias Tatum makes 1/1 from the line.
Score: 102-111

[00:28] Team_007 possession (Score: 102-111)
Draymond Harris makes the Dunk and draws the foul on Tobias Tatum! And-1! Draymond Harris to the line for 1. [BONUS: 11 team fouls] (Tobias Tatum: 2 personal fouls)   FT 1/1: GOOD Draymond Harris makes 1/1 from the line.
Score: 102-114

[00:15] Team_090 possession (Score: 102-114)
OG Anunoby attempts a 3Pt. Contested by Wendell Poole (5.5 feet, MAN). OG Anunoby misses. Offensive rebound by Tobias Tatum! Tobias Tatum kicks it out.

================================================================================
                              4TH QUARTER COMPLETE                              
================================================================================

4TH QUARTER SCORE: Team_090 29, Team_007 38

BOX SCORE:
================================================================================

Team_090
--------------------------------------------------------------------------------
Player                MIN  PTS  REB  AST  TO      FG   FG%      3P   3P%
--------------------------------------------------------------------------------
OG Anunoby             19   15    0    0   0   6/7    85.7     0/0   0.0
Tobias Tatum           19    5    1    0   0   2/2   100.0     0/0   0.0
Josh Wall              19    3    0    4   0   1/3    33.3     0/0   0.0
Derrick Nowitzki       19    2    2    0   0   1/2    50.0     0/0   0.0
Russell Smith          19    2    2    1   0   1/2    50.0     0/0   0.0
Tracy Adebayo          30    0    1    0   0   0/0     0.0     0/0   0.0
Gary Brogdon           30    0    0    0   0   0/1     0.0     0/0   0.0
Zach Wall              30    0    1    0   0   0/1     0.0     0/0   0.0

TEAM: FG: 11/18 (61.1%), 3PT: 2/4 (50.0%), REB: 7 (3 off, 4 def), AST: 5, TO: 5
TEAM FOULS: 11 [Team_007 in BONUS]


Team_007
--------------------------------------------------------------------------------
Player                MIN  PTS  REB  AST  TO      FG   FG%      3P   3P%
--------------------------------------------------------------------------------
Draymond Harris        19   14    2    1   0   5/5   100.0     0/0   0.0
OG Porzingis           19    9    0    1   0   3/3   100.0     0/0   0.0
Austin Simons          19    5    0    1   0   2/4    50.0     0/0   0.0
Wendell Poole          19    4    0    0   0   2/2   100.0     0/0   0.0
Tobias Johnson         30    2    0    0   0   1/2    50.0     0/0   0.0
Carmelo Siakam         30    2    2    0   0   1/1   100.0     0/0   0.0
Gary LaVine            19    2    3    0   0   1/2    50.0     0/0   0.0
John Quickley          30    0    1    1   0   0/0     0.0     0/0   0.0

TEAM: FG: 15/19 (78.9%), 3PT: 2/4 (50.0%), REB: 8 (1 off, 7 def), AST: 4, TO: 4
TEAM FOULS: 7 [Team_090 in BONUS]

================================================================================

================================================================================
                               FULL GAME COMPLETE                               
================================================================================

FINAL SCORE: Team_090 102, Team_007 114

SCORING BY QUARTER:
--------------------------------------------------------------------------------
Team                     Q1     Q2     Q3     Q4    FINAL
--------------------------------------------------------------------------------
Team_090                 20     24     29     29      102
Team_007                 32     25     19     38      114
--------------------------------------------------------------------------------

FULL GAME BOX SCORE:
================================================================================

Team_090
--------------------------------------------------------------------------------
Player                MIN  PTS  REB  AST  TO      FG   FG%      3P   3P%      FT STL BLK
--------------------------------------------------------------------------------
Derrick Mitchell       30    8    0    6   1   3/8    37.5   1/3    33.3   5/9     0   0
Larry Bridges          30    9    0    2   0   2/5    40.0   2/3    66.7   0/0     0   0
Zach Wall              30    7   10    4   2   4/8    50.0   1/4    25.0   0/0     0   0
Gary Brogdon           30   15    5    1   1   7/14   50.0   1/5    20.0   2/3     2   0
Tracy Adebayo          30   13   14    0   3   6/12   50.0   1/2    50.0   1/3     2   0
OG Anunoby             19   15    0    0   1   4/8    50.0   2/5    40.0   0/0     0   0
Josh Wall              19   10    0    4   1   5/7    71.4   0/1     0.0   4/4     1   0
Russell Smith          19    7    4    1   0   3/6    50.0   1/2    50.0   2/2     1   0
Derrick Nowitzki       19    2    3    1   0   1/5    20.0   0/1     0.0   3/4     0   0
Tobias Tatum           19    8    4    0   0   4/5    80.0   0/0     0.0   4/4     1   0

TEAM: FG: 39/78 (50.0%), 3PT: 9/26 (34.6%), REB: 40 (12 off, 28 def), AST: 19, TO: 9


Team_007
--------------------------------------------------------------------------------
Player                MIN  PTS  REB  AST  TO      FG   FG%      3P   3P%      FT STL BLK
--------------------------------------------------------------------------------
Tobias Johnson         30   10    0    6   0   4/10   40.0   2/7    28.6   3/3     0   0
Jaren Dosunmu          30    5    0    2   0   3/8    37.5   1/3    33.3   0/1     0   0
Bones Siakam           30   17   13    2   1   4/11   36.4   1/4    25.0   1/1     1   0
John Quickley          30   13    7    3   1   6/8    75.0   1/1   100.0   4/4     2   1
Carmelo Siakam         30   18    8    1   2   7/8    87.5   0/1     0.0   5/6     0   1
Wendell Poole          19    8    0    0   1   3/4    75.0   1/2    50.0   2/2     0   0
OG Porzingis           19   11    0    1   1   3/4    75.0   1/2    50.0   2/2     1   0
Gary LaVine            19    4    7    1   3   2/5    40.0   0/1     0.0   0/0     0   0
Austin Simons          19    8    2    2   1   4/6    66.7   0/0     0.0   4/4     0   1
Draymond Harris        19   18    7    1   1   7/7   100.0   0/0     0.0   6/6     0   0

TEAM: FG: 47/75 (62.7%), 3PT: 7/21 (33.3%), REB: 44 (5 off, 39 def), AST: 19, TO: 11

================================================================================
