================================================================================
                        FULL GAME - Team_095 vs Team_066                        
================================================================================

================================================================================
                       1ST QUARTER - Team_095 vs Team_066                       
================================================================================

[12:00] Team_095 possession (Score: 0-0)
Dejounte Hyland attempts a 3Pt. Contested by Pau Curry (5.5 feet, ZONE). DEJOUNTE HYLAND MAKES IT! Assist: Kyrie Ming
Score: 3-0

[11:46] Team_066 possession (Score: 3-0)
Pau Curry attempts a 3Pt. Contested by Evan Carter (4.1 feet, ZONE). Pau Curry misses. Rebound secured by Evan Carter.

[11:31] Team_095 possession (Score: 3-0)
Evan Carter attempts a 3Pt. Contested by Brandon Reaves (5.3 feet, MAN). EVAN CARTER MAKES IT! Assist: Kyrie Ming
Score: 6-0

[11:19] Team_066 possession (Score: 6-0)
Yao Brogdon drives to the basket... Yao Brogdon throws a bad pass! Stolen by Immanuel Middleton! TURNOVER! (live ball)

[11:03] Team_095 possession (Score: 6-0)
Evan Carter drives, Kyle Wagner stays with him. Evan Carter attempts a Layup. Contested by Kyle Wagner (4.1 feet, ZONE). EVAN CARTER MAKES IT! Assist: Shaquille Ball
Score: 8-0

[10:47] Team_066 possession (Score: 8-0)
FOUL! Reach-in foul on Dejounte Hyland during the drive. [Team fouls: 1] No free throws, side out. (Dejounte Hyland: 1 personal fouls)

[10:35] Team_066 possession (Score: 8-0)
Jimmy Davis drives, Dejounte Hyland stays with him. Jimmy Davis attempts a Dunk. Contested by Dejounte Hyland (5.3 feet, MAN). JIMMY DAVIS MAKES IT! Assist: Brandon Reaves
Score: 8-2

[10:22] Team_095 possession (Score: 8-2)
Kyrie Ming drives, picks up Kyle Wagner. Help arrives from Jimmy Davis! Kyrie Ming attempts a Dunk. Contested by Jimmy Davis (4.1 feet, MAN). Kyrie Ming misses. Rebound secured by Brandon Reaves.

[10:08] Team_066 possession (Score: 8-2)
Kyle Wagner drives and kicks out. Kyle Wagner attempts a 3Pt. Contested by Kyrie Ming (5.1 feet, MAN). Kyle Wagner misses. Offensive rebound by Kyle Wagner! Kyle Wagner kicks it out.

[09:58] Team_066 possession (Score: 8-2)
Kyle Wagner attempts a Layup. Contested by Immanuel Middleton (4.7 feet, ZONE). KYLE WAGNER MAKES IT! Assist: Yao Brogdon
Score: 8-4

[09:46] Team_095 possession (Score: 8-4)
Evan Carter drives and kicks out. Shaquille Ball attempts a 3Pt. Contested by Pau Curry (5.5 feet, MAN). SHAQUILLE BALL MAKES IT! Assist: Evan Carter
Score: 11-4

[09:36] Team_066 possession (Score: 11-4)
Kyle Wagner attempts a Midrange. Contested by Evan Carter (3.7 feet, ZONE). Kyle Wagner misses. Rebound secured by Shaquille Ball.

[09:22] Team_095 possession (Score: 11-4)
Immanuel Middleton drives and kicks out. Dejounte Hyland attempts a 3Pt. Contested by Pau Curry (5.5 feet, ZONE). Dejounte Hyland misses. Rebound secured by Brandon Reaves.

[09:05] Team_066 possession (Score: 11-4)
Pau Curry drives to the basket... Pau Curry throws a bad pass! Stolen by Shaquille Ball! TURNOVER! (live ball)

[08:50] Team_095 possession (Score: 11-4)
Evan Carter attempts a 3Pt. Contested by Pau Curry (5.7 feet, ZONE). EVAN CARTER MAKES IT! Assist: Shaquille Ball
Score: 14-4

[08:36] Team_066 possession (Score: 14-4)
Brandon Reaves attempts a Midrange. Contested by Evan Carter (4.3 feet, MAN). BRANDON REAVES MAKES IT!
Score: 14-6

[08:25] Team_095 possession (Score: 14-6)
Evan Carter drives and kicks out. Evan Carter attempts a Midrange. Contested by Brandon Reaves (5.1 feet, MAN). Evan Carter misses. Rebound secured by Kyle Wagner.

[08:15] Team_066 possession (Score: 14-6)
FOUL! Holding foul on Immanuel Middleton. [Team fouls: 2] No free throws, side out. (Immanuel Middleton: 1 personal fouls)

[07:59] Team_066 possession (Score: 14-6)
Jimmy Davis attempts a Layup. Contested by Immanuel Middleton (5.3 feet, ZONE). JIMMY DAVIS MAKES IT!
Score: 14-8

[07:43] Team_095 possession (Score: 14-8)
Dejounte Hyland attempts a 3Pt. Contested by Pau Curry (5.5 feet, ZONE). Dejounte Hyland misses. Offensive rebound by Evan Carter! Evan Carter's putback is no good. Rebound secured by Kyle Wagner.

[07:28] Team_066 possession (Score: 14-8)
Yao Brogdon attempts a Layup. BLOCKED BY IMMANUEL MIDDLETON! Ball deflects out of bounds off Yao Brogdon.

[07:15] Team_095 possession (Score: 14-8)
Kyrie Ming drives to the basket... FOUL! Offensive foul on Kyrie Ming! Kyle Wagner drew the charge! [Team fouls: 3] (Kyrie Ming: 1 personal fouls) TURNOVER! (dead ball)

[07:02] Team_066 possession (Score: 14-8)
Pau Curry attempts a 3Pt. Contested by Shaquille Ball (4.6 feet, MAN). Pau Curry misses. Rebound secured by Dejounte Hyland.

[06:43] Team_095 possession (Score: 14-8)
Dejounte Hyland attempts a Midrange. Contested by Yao Brogdon (5.1 feet, ZONE). Dejounte Hyland misses. Rebound secured by Kyle Wagner.

[06:27] Team_066 possession (Score: 14-8)
Brandon Reaves attempts a Layup. Contested by Immanuel Middleton (5.3 feet, ZONE). BRANDON REAVES MAKES IT! Assist: Jimmy Davis
Score: 14-10

[06:15] Team_095 possession (Score: 14-10)
Kyrie Ming attempts a Layup. Contested by Kyle Wagner (4.1 feet, MAN). KYRIE MING MAKES IT! Assist: Shaquille Ball
Score: 16-10

[06:04] Team_066 possession (Score: 16-10)
Jimmy Davis attempts a Layup. BLOCKED BY DEJOUNTE HYLAND! Ball deflects out of bounds off Jimmy Davis.

[05:51] Team_095 possession (Score: 16-10)
Immanuel Middleton attempts a 3Pt. Contested by Pau Curry (5.5 feet, ZONE). IMMANUEL MIDDLETON MAKES IT! Assist: Kyrie Ming
Score: 19-10

[05:39] Team_066 possession (Score: 19-10)
Pau Curry attempts a Layup. Contested by Kyrie Ming (5.4 feet, ZONE). PAU CURRY MAKES IT! Assist: Yao Brogdon
Score: 19-12

[05:23] Team_095 possession (Score: 19-12)
Immanuel Middleton attempts a Layup. Contested by Yao Brogdon (5.1 feet, MAN). IMMANUEL MIDDLETON MAKES IT! Assist: Kyrie Ming
Score: 21-12

[05:08] Team_066 possession (Score: 21-12)
Brandon Reaves attempts a Midrange. Contested by Evan Carter (4.4 feet, MAN). Brandon Reaves misses. Rebound secured by Dejounte Hyland.

[04:55] Team_095 possession (Score: 21-12)
Kyrie Ming attempts a Midrange. Contested by Pau Curry (5.8 feet, ZONE). KYRIE MING MAKES IT! Assist: Dejounte Hyland
Score: 23-12

[04:40] Team_066 possession (Score: 23-12)
Jimmy Davis makes the Layup and draws the foul on Dejounte Hyland! And-1! Jimmy Davis to the line for 1. [Team fouls: 4] (Dejounte Hyland: 2 personal fouls)   FT 1/1: GOOD Jimmy Davis makes 1/1 from the line.
Score: 23-15

[04:24] Team_095 possession (Score: 23-15)
Evan Carter attempts a 3Pt. Contested by Pau Curry (5.8 feet, ZONE). Evan Carter misses. Rebound secured by Brandon Reaves.

[04:09] Team_066 possession (Score: 23-15)
Brandon Reaves drives, Evan Carter stays with him. Brandon Reaves attempts a Dunk. Contested by Evan Carter (4.4 feet, MAN). Brandon Reaves misses. Rebound secured by Evan Carter.

[03:52] Team_095 possession (Score: 23-15)
FOUL! Shooting foul on Kyle Wagner. Immanuel Middleton to the line for 2 free throws. [Team fouls: 1] (Kyle Wagner: 1 personal fouls)   FT 1/2: GOOD   FT 2/2: GOOD Immanuel Middleton makes 2/2 from the line.
Score: 25-15

[03:42] Team_066 possession (Score: 25-15)
Kyle Wagner attempts a Layup. Contested by Kyrie Ming (5.2 feet, MAN). Kyle Wagner misses. Rebound secured by Shaquille Ball.

[03:26] Team_095 possession (Score: 25-15)
Shaquille Ball attempts a 3Pt. Contested by Pau Curry (5.7 feet, ZONE). Shaquille Ball misses. Rebound secured by Brandon Reaves.

[03:10] Team_066 possession (Score: 25-15)
Pau Curry drives and kicks out. Kyle Wagner attempts a Midrange. Contested by Kyrie Ming (5.4 feet, MAN). KYLE WAGNER MAKES IT!
Score: 25-17

[02:55] Team_095 possession (Score: 25-17)
Shaquille Ball attempts a Layup. Contested by Kyle Wagner (4.1 feet, ZONE). SHAQUILLE BALL MAKES IT!
Score: 27-17

[02:39] Team_066 possession (Score: 27-17)
Pau Curry makes the Dunk and draws the foul on Shaquille Ball! And-1! Pau Curry to the line for 1. [BONUS: 5 team fouls] (Shaquille Ball: 1 personal fouls)   FT 1/1: GOOD Pau Curry makes 1/1 from the line.
Score: 27-20

[02:24] Team_095 possession (Score: 27-20)
Immanuel Middleton drives, Kyle Wagner stays with him. Immanuel Middleton attempts a Dunk. Contested by Kyle Wagner (4.1 feet, ZONE). Immanuel Middleton misses. Rebound secured by Kyle Wagner.

[02:12] Team_066 possession (Score: 27-20)
Pau Curry attempts a 3Pt. Contested by Shaquille Ball (4.8 feet, MAN). Pau Curry misses. Offensive rebound by Yao Brogdon! Yao Brogdon kicks it out.

[01:58] Team_066 possession (Score: 27-20)
Pau Curry attempts a 3Pt. Contested by Shaquille Ball (4.9 feet, MAN). Pau Curry misses. Rebound secured by Evan Carter.

[01:45] Team_095 possession (Score: 27-20)
Immanuel Middleton attempts a Midrange. Contested by Yao Brogdon (5.4 feet, MAN). Immanuel Middleton misses. FOUL! Loose ball foul on Kyle Wagner during the rebound battle. [Team fouls: 2] No free throws, side out. (Kyle Wagner: 2 personal fouls)

[01:29] Team_095 possession (Score: 27-20)
Kyrie Ming attempts a Midrange. Contested by Kyle Wagner (4.4 feet, MAN). Kyrie Ming misses. FOUL! Loose ball foul on Kyle Wagner during the rebound battle. [Team fouls: 3] No free throws, side out. (Kyle Wagner: 3 personal fouls)

[01:14] Team_095 possession (Score: 27-20)
Immanuel Middleton makes the Dunk and draws the foul on Jimmy Davis! And-1! Immanuel Middleton to the line for 1. [Team fouls: 4] (Jimmy Davis: 1 personal fouls)   FT 1/1: GOOD Immanuel Middleton makes 1/1 from the line.
Score: 30-20

[00:56] Team_066 possession (Score: 30-20)
Pau Curry attempts a 3Pt. Contested by Shaquille Ball (4.9 feet, MAN). Pau Curry misses. Rebound secured by Evan Carter.

[00:44] Team_095 possession (Score: 30-20)
FOUL! Shooting foul on Kyle Wagner. Immanuel Middleton to the line for 2 free throws. [BONUS: 5 team fouls] (Kyle Wagner: 4 personal fouls)   FT 1/2: GOOD   FT 2/2: MISS Immanuel Middleton makes 1/2 from the line. Rebound secured by Yao Brogdon.
Score: 31-20

[00:31] Team_066 possession (Score: 31-20)
Brandon Reaves drives to the basket... Brandon Reaves throws a bad pass! Stolen by Immanuel Middleton! TURNOVER! (live ball)

[00:18] Team_095 possession (Score: 31-20)
Kyrie Ming drives, picks up Kyle Wagner. Help arrives from Jimmy Davis! Kyrie Ming attempts a Dunk. Contested by Jimmy Davis (4.6 feet, MAN). KYRIE MING MAKES IT! Assist: Shaquille Ball
Score: 33-20

[00:03] Team_066 possession (Score: 33-20)
Jimmy Davis attempts a Midrange. Contested by Dejounte Hyland (5.8 feet, ZONE). Jimmy Davis misses. Rebound secured by Dejounte Hyland.

================================================================================
                              1ST QUARTER COMPLETE                              
================================================================================

1ST QUARTER SCORE: Team_095 33, Team_066 20

BOX SCORE:
================================================================================

Team_095
--------------------------------------------------------------------------------
Player                MIN  PTS  REB  AST  TO      FG   FG%      3P   3P%
--------------------------------------------------------------------------------
Immanuel Middleton     12   10    0    0   0   4/7    57.1     0/0   0.0
Evan Carter            12    8    6    1   0   3/5    60.0     0/0   0.0
Kyrie Ming             12    6    0    4   0   3/4    75.0     0/0   0.0
Shaquille Ball         12    5    2    4   0   2/3    66.7     0/0   0.0
Dejounte Hyland        12    3    3    1   0   1/3    33.3     0/0   0.0

TEAM: FG: 13/22 (59.1%), 3PT: 4/7 (57.1%), REB: 12 (3 off, 9 def), AST: 10, TO: 1
TEAM FOULS: 5 [Team_066 in BONUS]


Team_066
--------------------------------------------------------------------------------
Player                MIN  PTS  REB  AST  TO      FG   FG%      3P   3P%
--------------------------------------------------------------------------------
Jimmy Davis            12    7    0    1   0   3/5    60.0     0/0   0.0
Pau Curry              12    5    0    0   0   2/6    33.3     0/0   0.0
Brandon Reaves         12    4    4    1   0   2/4    50.0     0/0   0.0
Kyle Wagner            12    4    5    0   0   2/4    50.0     0/0   0.0
Yao Brogdon            12    0    2    2   0   0/1     0.0     0/0   0.0

TEAM: FG: 9/20 (45.0%), 3PT: 0/4 (0.0%), REB: 10 (2 off, 8 def), AST: 4, TO: 3
TEAM FOULS: 5 [Team_095 in BONUS]

================================================================================

================================================================================
                       2ND QUARTER - Team_095 vs Team_066                       
================================================================================

[12:00] Team_095 possession (Score: 33-20)
FOUL! Reach-in foul on Brandon Reaves during the drive. [Team fouls: 1] No free throws, side out. (Brandon Reaves: 1 personal fouls)

[11:47] Team_095 possession (Score: 33-20)
Dejounte Hyland attempts a Midrange. Contested by Jimmy Davis (4.4 feet, MAN). DEJOUNTE HYLAND MAKES IT!
Score: 35-20

[11:34] Team_066 possession (Score: 35-20)
Jimmy Davis drives and kicks out. Kyle Wagner attempts a 3Pt. Contested by Evan Carter (4.3 feet, ZONE). Kyle Wagner misses. Rebound secured by Dejounte Hyland.

[11:20] Team_095 possession (Score: 35-20)
Evan Carter attempts a Midrange. Contested by Brandon Reaves (5.6 feet, ZONE). EVAN CARTER MAKES IT!
Score: 37-20

[11:04] Team_066 possession (Score: 37-20)
Jimmy Davis attempts a 3Pt. Contested by Dejounte Hyland (5.7 feet, MAN). JIMMY DAVIS MAKES IT! Assist: Kyle Wagner
Score: 37-23

[10:47] Team_095 possession (Score: 37-23)
Evan Carter attempts a 3Pt. Contested by Brandon Reaves (5.7 feet, MAN). Evan Carter misses. Offensive rebound by Evan Carter! Evan Carter puts it back in!
Score: 39-23

[10:29] Team_066 possession (Score: 39-23)
Pau Curry attempts a 3Pt. Contested by Evan Carter (4.6 feet, ZONE). PAU CURRY MAKES IT! Assist: Brandon Reaves
Score: 39-26

[10:17] Team_095 possession (Score: 39-26)
Immanuel Middleton attempts a Midrange. Contested by Yao Brogdon (5.6 feet, MAN). Immanuel Middleton misses. Rebound secured by Yao Brogdon.

[10:07] Team_066 possession (Score: 39-26)
Kyle Wagner drives, Kyrie Ming stays with him. Kyle Wagner attempts a Layup. Contested by Kyrie Ming (5.5 feet, MAN). Kyle Wagner misses. Offensive rebound by Yao Brogdon! Yao Brogdon kicks it out.

[09:53] Team_066 possession (Score: 39-26)
Jimmy Davis attempts a Midrange. Contested by Dejounte Hyland (5.8 feet, MAN). Jimmy Davis misses. Rebound secured by Evan Carter.

[09:37] Team_095 possession (Score: 39-26)
Dejounte Hyland attempts a 3Pt. Wide open! Pau Curry is 6.0 feet away. [ZONE] Dejounte Hyland misses. Rebound secured by Kyle Wagner.

[09:21] Team_066 possession (Score: 39-26)
Jimmy Davis attempts a 3Pt. Contested by Evan Carter (4.8 feet, ZONE). JIMMY DAVIS MAKES IT! Assist: Pau Curry
Score: 39-29

[09:04] Team_095 possession (Score: 39-29)
FOUL! Holding foul on Yao Brogdon. [Team fouls: 2] No free throws, side out. (Yao Brogdon: 1 personal fouls)

[08:55] Team_095 possession (Score: 39-29)
Dejounte Hyland drives and kicks out. Evan Carter attempts a Midrange. Contested by Brandon Reaves (5.7 feet, ZONE). Evan Carter misses. Rebound secured by Brandon Reaves.

[08:37] Team_066 possession (Score: 39-29)
Kyle Wagner drives, Kyrie Ming stays with him. Kyle Wagner attempts a Dunk. Contested by Kyrie Ming (5.7 feet, MAN). KYLE WAGNER MAKES IT!
Score: 39-31

[08:23] Team_095 possession (Score: 39-31)
FOUL! Shooting foul on Kyle Wagner. Kyrie Ming to the line for 2 free throws. [Team fouls: 3] (Kyle Wagner: 1 personal fouls)   FT 1/2: GOOD   FT 2/2: GOOD Kyrie Ming makes 2/2 from the line.
Score: 41-31

[08:12] Team_066 possession (Score: 41-31)
Jimmy Davis attempts a 3Pt. Contested by Evan Carter (5.0 feet, ZONE). Jimmy Davis misses. Rebound secured by Evan Carter.

[07:57] Team_095 possession (Score: 41-31)
Evan Carter attempts a 3Pt. Wide open! Pau Curry is 6.4 feet away. [ZONE] EVAN CARTER MAKES IT! Assist: Shaquille Ball
Score: 44-31

[07:45] Team_066 possession (Score: 44-31)
FOUL! Holding foul on Immanuel Middleton. [Team fouls: 1] No free throws, side out. (Immanuel Middleton: 1 personal fouls)

[07:29] Team_066 possession (Score: 44-31)
Pau Curry attempts a Layup. Wide open! Immanuel Middleton is 6.0 feet away. [ZONE] PAU CURRY MAKES IT!
Score: 44-33

[07:15] Team_095 possession (Score: 44-33)
Kyrie Ming attempts a Midrange. Contested by Kyle Wagner (4.9 feet, MAN). KYRIE MING MAKES IT! Assist: Shaquille Ball
Score: 46-33

[07:04] Team_066 possession (Score: 46-33)
FOUL! Shooting foul on Immanuel Middleton. Kyle Wagner to the line for 2 free throws. [Team fouls: 2] (Immanuel Middleton: 2 personal fouls)   FT 1/2: MISS   FT 2/2: GOOD Kyle Wagner makes 1/2 from the line.
Score: 46-34

[06:52] Team_095 possession (Score: 46-34)
Shaquille Ball attempts a Midrange. Contested by Brandon Reaves (5.9 feet, ZONE). Shaquille Ball misses. FOUL! Loose ball foul on Kyle Wagner during the rebound battle. [Team fouls: 4] No free throws, side out. (Kyle Wagner: 2 personal fouls)

[06:40] Team_095 possession (Score: 46-34)
FOUL! Holding foul on Kyle Wagner. [IN THE BONUS! 5 team fouls] Kyrie Ming to the line for 2 free throws. (Kyle Wagner: 3 personal fouls)   FT 1/2: GOOD   FT 2/2: GOOD Kyrie Ming makes 2/2 from the line.
Score: 48-34

[06:30] Team_066 possession (Score: 48-34)
Pau Curry attempts a 3Pt. Contested by Shaquille Ball (5.5 feet, MAN). Pau Curry misses. Rebound secured by Shaquille Ball.

[06:19] Team_095 possession (Score: 48-34)
Shaquille Ball attempts a Midrange. Wide open! Pau Curry is 6.4 feet away. [MAN] Shaquille Ball misses. Offensive rebound by Evan Carter! Evan Carter kicks it out.

[06:05] Team_095 possession (Score: 48-34)
Immanuel Middleton attempts a 3Pt. Wide open! Yao Brogdon is 6.1 feet away. [MAN] IMMANUEL MIDDLETON MAKES IT! Assist: Dejounte Hyland
Score: 51-34

[05:49] Team_066 possession (Score: 51-34)
Jimmy Davis attempts a Layup. Wide open! Immanuel Middleton is 6.4 feet away. [ZONE] JIMMY DAVIS MAKES IT! Assist: Yao Brogdon
Score: 51-36

[05:35] Team_095 possession (Score: 51-36)
Evan Carter attempts a 3Pt. Wide open! Brandon Reaves is 6.3 feet away. [MAN] Evan Carter misses. Rebound secured by Brandon Reaves.

[05:21] Team_066 possession (Score: 51-36)
Brandon Reaves attempts a Layup. Contested by Evan Carter (5.5 feet, MAN). BRANDON REAVES MAKES IT! Assist: Jimmy Davis
Score: 51-38

[05:05] Team_095 possession (Score: 51-38)
Dejounte Hyland drives and kicks out. Shaquille Ball attempts a 3Pt. Wide open! Pau Curry is 6.8 feet away. [MAN] SHAQUILLE BALL MAKES IT! Assist: Kyrie Ming
Score: 54-38

[04:49] Team_066 possession (Score: 54-38)
Yao Brogdon attempts a Midrange. Wide open! Immanuel Middleton is 6.6 feet away. [MAN] Yao Brogdon misses. FOUL! Loose ball foul on Evan Carter during the rebound battle. [Team fouls: 3] No free throws, side out. (Evan Carter: 1 personal fouls)

[04:33] Team_066 possession (Score: 54-38)
Brandon Reaves attempts a Layup. Contested by Evan Carter (5.6 feet, MAN). BRANDON REAVES MAKES IT! Assist: Kyle Wagner
Score: 54-40

[04:18] Team_095 possession (Score: 54-40)
Shaquille Ball attempts a Midrange. Wide open! Pau Curry is 6.7 feet away. [ZONE] SHAQUILLE BALL MAKES IT! Assist: Immanuel Middleton
Score: 56-40

[04:00] Team_066 possession (Score: 56-40)
Jimmy Davis attempts a 3Pt. Contested by Evan Carter (5.6 feet, ZONE). JIMMY DAVIS MAKES IT! Assist: Yao Brogdon
Score: 56-43

[03:43] Team_095 possession (Score: 56-43)
Evan Carter attempts a Midrange. Wide open! Brandon Reaves is 6.5 feet away. [MAN] EVAN CARTER MAKES IT!
Score: 58-43

[03:26] Team_066 possession (Score: 58-43)
Jimmy Davis drives, picks up Immanuel Middleton. Help arrives from Dejounte Hyland! Jimmy Davis attempts a Dunk. Wide open! Dejounte Hyland is 6.7 feet away. [ZONE] JIMMY DAVIS MAKES IT!
Score: 58-45

[03:16] Team_095 possession (Score: 58-45)
Shaquille Ball attempts a Layup. Contested by Kyle Wagner (5.4 feet, ZONE). SHAQUILLE BALL MAKES IT!
Score: 60-45

[03:01] Team_066 possession (Score: 60-45)
Pau Curry drives, Shaquille Ball stays with him. Pau Curry attempts a Layup. Contested by Shaquille Ball (5.9 feet, MAN). PAU CURRY MAKES IT!
Score: 60-47

[02:44] Team_095 possession (Score: 60-47)
Dejounte Hyland attempts a Layup. Wide open! Yao Brogdon is 6.6 feet away. [ZONE] DEJOUNTE HYLAND MAKES IT! Assist: Shaquille Ball
Score: 62-47

[02:27] Team_066 possession (Score: 62-47)
Pau Curry attempts a 3Pt. Contested by Evan Carter (5.7 feet, ZONE). PAU CURRY MAKES IT! Assist: Kyle Wagner
Score: 62-50

[02:10] Team_095 possession (Score: 62-50)
Evan Carter attempts a 3Pt. Wide open! Brandon Reaves is 6.6 feet away. [MAN] EVAN CARTER MAKES IT! Assist: Dejounte Hyland
Score: 65-50

[01:59] Team_066 possession (Score: 65-50)
Brandon Reaves attempts a Layup. Wide open! Immanuel Middleton is 7.0 feet away. [ZONE] BRANDON REAVES MAKES IT! Assist: Yao Brogdon
Score: 65-52

[01:42] Team_095 possession (Score: 65-52)
Kyrie Ming drives to the basket... Kyrie Ming loses control! Ball rolls out of bounds! TURNOVER! (dead ball)

[01:42] Substitution (Team_095): Dejounte Hyland OUT → Kyle Poole IN (stamina_rule2)

[01:42] Substitution (Team_095): Shaquille Ball OUT → Cade Beal IN (stamina_rule2)

[01:42] Substitution (Team_095): Evan Carter OUT → Tobias Wagner IN (stamina_rule2)

[01:42] Substitution (Team_095): Immanuel Middleton OUT → Gary Davis IN (stamina_rule2)

[01:42] Substitution (Team_095): Kyrie Ming OUT → DeMar McCollum IN (stamina_rule2)

[01:42] Substitution (Team_066): Jimmy Davis OUT → Pascal Carter IN (stamina_rule2)

[01:42] Substitution (Team_066): Pau Curry OUT → Lauri LaVine IN (stamina_rule2)

[01:42] Substitution (Team_066): Brandon Reaves OUT → Brandon Middleton IN (stamina_rule2)

[01:42] Substitution (Team_066): Yao Brogdon OUT → Cole Morant IN (stamina_rule2)

[01:42] Substitution (Team_066): Kyle Wagner OUT → Donovan Simmons IN (stamina_rule2)

[01:29] Team_066 possession (Score: 65-52)
FOUL! Holding foul on Tobias Wagner. [Team fouls: 4] No free throws, side out. (Tobias Wagner: 1 personal fouls)

[01:15] Team_066 possession (Score: 65-52)
Cole Morant attempts a Midrange. Contested by Cade Beal (4.9 feet, ZONE). Cole Morant misses. Rebound secured by Tobias Wagner.

[01:02] Team_095 possession (Score: 65-52)
Cade Beal attempts a Midrange. Contested by Lauri LaVine (3.9 feet, MAN). Cade Beal misses. Rebound secured by Lauri LaVine.

[00:49] Team_066 possession (Score: 65-52)
Lauri LaVine attempts a 3Pt. Contested by Cade Beal (4.5 feet, ZONE). Lauri LaVine misses. Rebound secured by Gary Davis.

[00:35] Team_095 possession (Score: 65-52)
Gary Davis drives to the basket... Gary Davis throws a bad pass! Stolen by Donovan Simmons! TURNOVER! (live ball)

[00:22] Team_066 possession (Score: 65-52)
FOUL! Reach-in foul on Tobias Wagner during the drive. [IN THE BONUS! 5 team fouls] Brandon Middleton to the line for 2 free throws. (Tobias Wagner: 2 personal fouls)   FT 1/2: GOOD   FT 2/2: GOOD Brandon Middleton makes 2/2 from the line.
Score: 65-54

[00:10] Team_095 possession (Score: 65-54)
Tobias Wagner attempts a 3Pt. Contested by Lauri LaVine (4.3 feet, ZONE). Tobias Wagner misses. Rebound secured by Lauri LaVine.

================================================================================
                              2ND QUARTER COMPLETE                              
================================================================================

2ND QUARTER SCORE: Team_095 32, Team_066 34

BOX SCORE:
================================================================================

Team_095
--------------------------------------------------------------------------------
Player                MIN  PTS  REB  AST  TO      FG   FG%      3P   3P%
--------------------------------------------------------------------------------
Evan Carter            23   12    4    0   0   5/6    83.3     0/0   0.0
Shaquille Ball         23    7    2    3   0   3/3   100.0     0/0   0.0
Kyrie Ming             23    6    0    1   0   3/3   100.0     0/0   0.0
Dejounte Hyland        23    4    1    2   0   2/4    50.0     0/0   0.0
Immanuel Middleton     23    3    0    1   0   1/2    50.0     0/0   0.0
Tobias Wagner           2    0    1    0   0   0/1     0.0     0/0   0.0
Cade Beal               2    0    0    0   0   0/1     0.0     0/0   0.0
Gary Davis              2    0    1    0   0   0/0     0.0     0/0   0.0

TEAM: FG: 14/20 (70.0%), 3PT: 4/7 (57.1%), REB: 9 (3 off, 6 def), AST: 7, TO: 2
TEAM FOULS: 5 [Team_066 in BONUS]


Team_066
--------------------------------------------------------------------------------
Player                MIN  PTS  REB  AST  TO      FG   FG%      3P   3P%
--------------------------------------------------------------------------------
Jimmy Davis            23   13    0    1   0   5/8    62.5     0/0   0.0
Pau Curry              23   10    0    1   0   4/5    80.0     0/0   0.0
Brandon Reaves         23    6    2    1   0   3/3   100.0     0/0   0.0
Kyle Wagner            23    3    2    3   0   2/2   100.0     0/0   0.0
Brandon Middleton       2    2    0    0   0   1/1   100.0     0/0   0.0
Yao Brogdon            23    0    2    3   0   0/0     0.0     0/0   0.0
Cole Morant             2    0    0    0   0   0/1     0.0     0/0   0.0
Lauri LaVine            2    0    2    0   0   0/1     0.0     0/0   0.0

TEAM: FG: 15/21 (71.4%), 3PT: 5/8 (62.5%), REB: 8 (2 off, 6 def), AST: 9, TO: 0
TEAM FOULS: 5 [Team_095 in BONUS]

================================================================================

================================================================================
                       3RD QUARTER - Team_095 vs Team_066                       
================================================================================

[12:00] Team_095 possession (Score: 65-54)
Kyrie Ming attempts a Layup. Contested by Kyle Wagner (4.1 feet, MAN). KYRIE MING MAKES IT! Assist: Evan Carter
Score: 67-54

[11:46] Team_066 possession (Score: 67-54)
Jimmy Davis attempts a 3Pt. Contested by Dejounte Hyland (5.3 feet, MAN). JIMMY DAVIS MAKES IT! Assist: Brandon Reaves
Score: 67-57

[11:34] Team_095 possession (Score: 67-57)
FOUL! Holding foul on Pau Curry. [Team fouls: 1] No free throws, side out. (Pau Curry: 1 personal fouls)

[11:24] Team_095 possession (Score: 67-57)
Shaquille Ball attempts a 3Pt. Contested by Pau Curry (5.5 feet, ZONE). Shaquille Ball misses. Rebound secured by Yao Brogdon.

[11:12] Team_066 possession (Score: 67-57)
Brandon Reaves attempts a 3Pt. Contested by Evan Carter (4.3 feet, ZONE). Brandon Reaves misses. Offensive rebound by Kyle Wagner! Kyle Wagner kicks it out.

[11:01] Team_066 possession (Score: 67-57)
Jimmy Davis makes the Midrange and draws the foul on Dejounte Hyland! And-1! Jimmy Davis to the line for 1. [Team fouls: 1] (Dejounte Hyland: 1 personal fouls)   FT 1/1: GOOD Jimmy Davis makes 1/1 from the line.
Score: 67-60

[10:48] Team_095 possession (Score: 67-60)
Immanuel Middleton attempts a Layup. BLOCKED BY YAO BROGDON! Ball deflects out of bounds off Immanuel Middleton.

[10:31] Team_066 possession (Score: 67-60)
Pau Curry attempts a 3Pt. Contested by Shaquille Ball (4.6 feet, MAN). PAU CURRY MAKES IT! Assist: Kyle Wagner
Score: 67-63

[10:17] Team_095 possession (Score: 67-63)
Evan Carter attempts a 3Pt. Contested by Brandon Reaves (5.3 feet, MAN). EVAN CARTER MAKES IT! Assist: Dejounte Hyland
Score: 70-63

[10:01] Team_066 possession (Score: 70-63)
FOUL! Shooting foul on Shaquille Ball. Pau Curry to the line for 3 free throws. [Team fouls: 2] (Shaquille Ball: 1 personal fouls)   FT 1/3: GOOD   FT 2/3: GOOD   FT 3/3: GOOD Pau Curry makes 3/3 from the line.
Score: 70-66

[09:46] Team_095 possession (Score: 70-66)
Dejounte Hyland makes the Layup and draws the foul on Jimmy Davis! And-1! Dejounte Hyland to the line for 1. [Team fouls: 2] (Jimmy Davis: 1 personal fouls)   FT 1/1: GOOD Dejounte Hyland makes 1/1 from the line.
Score: 73-66

[09:33] Team_066 possession (Score: 73-66)
Pau Curry drives, picks up Shaquille Ball. Help arrives from Evan Carter! Pau Curry attempts a Layup. Contested by Evan Carter (4.6 feet, MAN). Pau Curry misses. Rebound secured by Shaquille Ball.

[09:17] Team_095 possession (Score: 73-66)
Evan Carter makes the Dunk and draws the foul on Brandon Reaves! And-1! Evan Carter to the line for 1. [Team fouls: 3] (Brandon Reaves: 1 personal fouls)   FT 1/1: GOOD Evan Carter makes 1/1 from the line.
Score: 76-66

[09:00] Team_066 possession (Score: 76-66)
Brandon Reaves attempts a 3Pt. Contested by Evan Carter (4.3 feet, MAN). Brandon Reaves misses. Rebound secured by Dejounte Hyland.

[08:47] Team_095 possession (Score: 76-66)
Dejounte Hyland attempts a 3Pt. Contested by Yao Brogdon (5.1 feet, ZONE). Dejounte Hyland misses. Rebound secured by Kyle Wagner.

[08:34] Team_066 possession (Score: 76-66)
Kyle Wagner attempts a Layup. BLOCKED BY IMMANUEL MIDDLETON! Ball is loose! Rebound secured by Dejounte Hyland.

[08:21] Team_095 possession (Score: 76-66)
Dejounte Hyland attempts a 3Pt. Contested by Jimmy Davis (3.9 feet, MAN). Dejounte Hyland misses. Rebound secured by Kyle Wagner.

[08:08] Team_066 possession (Score: 76-66)
Brandon Reaves attempts a 3Pt. Contested by Evan Carter (4.3 feet, MAN). Brandon Reaves misses. Offensive rebound by Kyle Wagner! Kyle Wagner kicks it out.

[07:55] Team_066 possession (Score: 76-66)
Pau Curry attempts a Layup. BLOCKED BY SHAQUILLE BALL! Ball goes out off Shaquille Ball. Pau Curry's ball!

[07:39] Team_066 possession (Score: 76-66)
Yao Brogdon drives and kicks out. Pau Curry attempts a Midrange. Contested by Immanuel Middleton (4.8 feet, ZONE). PAU CURRY MAKES IT! Assist: Jimmy Davis
Score: 76-68

[07:24] Team_095 possession (Score: 76-68)
Immanuel Middleton attempts a 3Pt. Contested by Yao Brogdon (5.1 feet, MAN). Immanuel Middleton misses. Rebound secured by Yao Brogdon.

[07:11] Team_066 possession (Score: 76-68)
FOUL! Holding foul on Dejounte Hyland. [Team fouls: 3] No free throws, side out. (Dejounte Hyland: 2 personal fouls)

[06:59] Team_066 possession (Score: 76-68)
Yao Brogdon attempts a Midrange. Contested by Shaquille Ball (4.8 feet, ZONE). YAO BROGDON MAKES IT! Assist: Jimmy Davis
Score: 76-70

[06:45] Team_095 possession (Score: 76-70)
Kyrie Ming attempts a Midrange. Contested by Kyle Wagner (4.1 feet, MAN). Kyrie Ming misses. Offensive rebound by Dejounte Hyland! Dejounte Hyland kicks it out.

[06:30] Team_095 possession (Score: 76-70)
Immanuel Middleton attempts a Layup. Contested by Yao Brogdon (5.1 feet, MAN). IMMANUEL MIDDLETON MAKES IT!
Score: 78-70

[06:15] Team_066 possession (Score: 78-70)
Jimmy Davis drives to the basket... Jimmy Davis loses the ball! Stripped by Dejounte Hyland! TURNOVER! (live ball)

[05:57] Team_095 possession (Score: 78-70)
Kyrie Ming attempts a Layup. Contested by Kyle Wagner (4.1 feet, MAN). KYRIE MING MAKES IT! Assist: Immanuel Middleton
Score: 80-70

[05:43] Team_066 possession (Score: 80-70)
Brandon Reaves attempts a Midrange. Contested by Shaquille Ball (4.8 feet, ZONE). Brandon Reaves misses. Rebound secured by Evan Carter.

[05:31] Team_095 possession (Score: 80-70)
Immanuel Middleton drives, Kyle Wagner stays with him. Immanuel Middleton attempts a Dunk. Contested by Kyle Wagner (3.9 feet, ZONE). Immanuel Middleton misses. Offensive rebound by Dejounte Hyland! Dejounte Hyland kicks it out.

[05:13] Team_095 possession (Score: 80-70)
Evan Carter attempts a 3Pt. Contested by Brandon Reaves (5.3 feet, MAN). Evan Carter misses. Rebound secured by Brandon Reaves.

[05:02] Team_066 possession (Score: 80-70)
Kyle Wagner drives, picks up Immanuel Middleton. Help arrives from Dejounte Hyland! Kyle Wagner attempts a Layup. Contested by Dejounte Hyland (4.8 feet, ZONE). KYLE WAGNER MAKES IT! Assist: Yao Brogdon
Score: 80-72

[04:44] Team_095 possession (Score: 80-72)
FOUL! Holding foul on Brandon Reaves. [Team fouls: 4] No free throws, side out. (Brandon Reaves: 2 personal fouls)

[04:29] Team_095 possession (Score: 80-72)
Shaquille Ball attempts a Midrange. Contested by Pau Curry (5.6 feet, MAN). Shaquille Ball misses. Offensive rebound by Dejounte Hyland! Dejounte Hyland kicks it out.

[04:15] Team_095 possession (Score: 80-72)
Kyrie Ming attempts a Layup. Contested by Kyle Wagner (4.2 feet, ZONE). Kyrie Ming misses. Rebound secured by Yao Brogdon.

[03:59] Team_066 possession (Score: 80-72)
Yao Brogdon attempts a Midrange. Contested by Immanuel Middleton (5.5 feet, MAN). Yao Brogdon misses. Rebound secured by Shaquille Ball.

[03:47] Team_095 possession (Score: 80-72)
Shaquille Ball throws a bad pass! Stolen by Pau Curry! TURNOVER! (live ball)

[03:31] Team_066 possession (Score: 80-72)
Pau Curry makes the Dunk and draws the foul on Evan Carter! And-1! Pau Curry to the line for 1. [Team fouls: 4] (Evan Carter: 1 personal fouls)   FT 1/1: GOOD Pau Curry makes 1/1 from the line.
Score: 80-75

[03:19] Team_095 possession (Score: 80-75)
Shaquille Ball attempts a Layup. Contested by Kyle Wagner (4.1 feet, ZONE). SHAQUILLE BALL MAKES IT!
Score: 82-75

[03:07] Team_066 possession (Score: 82-75)
Jimmy Davis attempts a 3Pt. Contested by Evan Carter (4.5 feet, ZONE). Jimmy Davis misses. Rebound secured by Shaquille Ball.

[02:53] Team_095 possession (Score: 82-75)
Immanuel Middleton attempts a Midrange. Contested by Yao Brogdon (5.3 feet, MAN). Immanuel Middleton misses. Rebound secured by Yao Brogdon.

[02:37] Team_066 possession (Score: 82-75)
Jimmy Davis attempts a 3Pt. Contested by Dejounte Hyland (5.5 feet, ZONE). JIMMY DAVIS MAKES IT!
Score: 82-78

[02:22] Team_095 possession (Score: 82-78)
Shaquille Ball attempts a 3Pt. Contested by Pau Curry (5.7 feet, ZONE). Shaquille Ball misses. Offensive rebound by Dejounte Hyland! Dejounte Hyland kicks it out.

[02:07] Team_095 possession (Score: 82-78)
Evan Carter attempts a 3Pt. Contested by Brandon Reaves (5.5 feet, MAN). Evan Carter misses. Rebound secured by Yao Brogdon.

[01:55] Team_066 possession (Score: 82-78)
Kyle Wagner attempts a 3Pt. Contested by Kyrie Ming (5.3 feet, MAN). Kyle Wagner misses. Rebound secured by Dejounte Hyland.

[01:43] Team_095 possession (Score: 82-78)
Evan Carter attempts a 3Pt. Contested by Brandon Reaves (5.6 feet, MAN). Evan Carter misses. Rebound secured by Brandon Reaves.

[01:30] Team_066 possession (Score: 82-78)
Kyle Wagner attempts a Midrange. Contested by Kyrie Ming (5.4 feet, MAN). KYLE WAGNER MAKES IT! Assist: Brandon Reaves
Score: 82-80

[01:18] Team_095 possession (Score: 82-80)
FOUL! Reach-in foul on Kyle Wagner during the drive. [IN THE BONUS! 5 team fouls] Dejounte Hyland to the line for 2 free throws. (Kyle Wagner: 1 personal fouls)   FT 1/2: GOOD   FT 2/2: GOOD Dejounte Hyland makes 2/2 from the line.
Score: 84-80

[01:06] Team_066 possession (Score: 84-80)
Jimmy Davis drives, picks up Dejounte Hyland. Help arrives from Evan Carter! Jimmy Davis attempts a Dunk. Contested by Evan Carter (5.7 feet, MAN). JIMMY DAVIS MAKES IT!
Score: 84-82

[00:51] Team_095 possession (Score: 84-82)
Kyrie Ming drives, Kyle Wagner stays with him. Kyrie Ming attempts a Dunk. Contested by Kyle Wagner (4.5 feet, MAN). Kyrie Ming misses. Offensive rebound by Evan Carter! Evan Carter's putback is no good. Rebound secured by Yao Brogdon.

[00:37] Team_066 possession (Score: 84-82)
Pau Curry attempts a 3Pt. Contested by Shaquille Ball (5.0 feet, MAN). Pau Curry misses. Rebound secured by Shaquille Ball.

[00:28] Team_095 possession (Score: 84-82)
Immanuel Middleton drives to the basket... Immanuel Middleton loses control! Ball rolls out of bounds! TURNOVER! (dead ball)

[00:28] Substitution (Team_095): Dejounte Hyland OUT → Kyle Poole IN (stamina_rule2)

[00:28] Substitution (Team_095): Shaquille Ball OUT → Cade Beal IN (stamina_rule2)

[00:28] Substitution (Team_095): Evan Carter OUT → Tobias Wagner IN (stamina_rule2)

[00:28] Substitution (Team_095): Immanuel Middleton OUT → Gary Davis IN (stamina_rule2)

[00:28] Substitution (Team_095): Kyrie Ming OUT → DeMar McCollum IN (stamina_rule2)

[00:28] Substitution (Team_066): Jimmy Davis OUT → Pascal Carter IN (stamina_rule2)

[00:28] Substitution (Team_066): Pau Curry OUT → Lauri LaVine IN (stamina_rule2)

[00:28] Substitution (Team_066): Brandon Reaves OUT → Brandon Middleton IN (stamina_rule2)

[00:28] Substitution (Team_066): Yao Brogdon OUT → Cole Morant IN (stamina_rule2)

[00:28] Substitution (Team_066): Kyle Wagner OUT → Donovan Simmons IN (stamina_rule2)

[00:13] Team_066 possession (Score: 84-82)
Lauri LaVine drives and kicks out. Cole Morant attempts a Midrange. Contested by Gary Davis (5.4 feet, MAN). COLE MORANT MAKES IT! Assist: Donovan Simmons
Score: 84-84

================================================================================
                              3RD QUARTER COMPLETE                              
================================================================================

3RD QUARTER SCORE: Team_095 19, Team_066 30

BOX SCORE:
================================================================================

Team_095
--------------------------------------------------------------------------------
Player                MIN  PTS  REB  AST  TO      FG   FG%      3P   3P%
--------------------------------------------------------------------------------
Evan Carter            34    6    1    1   0   2/5    40.0     0/0   0.0
Dejounte Hyland        34    5    7    1   0   2/4    50.0     0/0   0.0
Kyrie Ming             34    4    0    0   0   2/4    50.0     0/0   0.0
Shaquille Ball         34    2    4    0   0   1/2    50.0     0/0   0.0
Yao Brogdon            34    2    6    1   0   1/2    50.0     0/0   0.0
Immanuel Middleton     34    2    0    1   0   1/4    25.0     0/0   0.0

TEAM: FG: 8/19 (42.1%), 3PT: 1/8 (12.5%), REB: 13 (5 off, 8 def), AST: 3, TO: 2
TEAM FOULS: 4


Team_066
--------------------------------------------------------------------------------
Player                MIN  PTS  REB  AST  TO      FG   FG%      3P   3P%
--------------------------------------------------------------------------------
Jimmy Davis            34   11    0    2   0   4/5    80.0     0/0   0.0
Pau Curry              34   11    0    0   0   4/6    66.7     0/0   0.0
Kyle Wagner            34    4    4    1   0   2/4    50.0     0/0   0.0
Cole Morant             2    2    0    0   0   1/1   100.0     0/0   0.0
Brandon Reaves         34    0    2    2   0   0/2     0.0     0/0   0.0
Donovan Simmons         2    0    0    1   0   0/0     0.0     0/0   0.0

TEAM: FG: 12/20 (60.0%), 3PT: 4/8 (50.0%), REB: 11 (2 off, 9 def), AST: 7, TO: 1
TEAM FOULS: 5 [Team_095 in BONUS]

================================================================================

================================================================================
                       4TH QUARTER - Team_095 vs Team_066                       
================================================================================

[12:00] Team_095 possession (Score: 84-84)
Kyrie Ming attempts a Midrange. Contested by Pau Curry (5.9 feet, ZONE). KYRIE MING MAKES IT!
Score: 86-84

[11:49] Team_066 possession (Score: 86-84)
FOUL! Holding foul on Immanuel Middleton. [Team fouls: 1] No free throws, side out. (Immanuel Middleton: 1 personal fouls)

[11:35] Team_066 possession (Score: 86-84)
Jimmy Davis attempts a 3Pt. Contested by Evan Carter (4.6 feet, ZONE). Jimmy Davis misses. Rebound secured by Shaquille Ball.

[11:21] Team_095 possession (Score: 86-84)
Kyrie Ming drives, picks up Kyle Wagner. Help arrives from Jimmy Davis! Kyrie Ming attempts a Dunk. Contested by Jimmy Davis (4.4 feet, MAN). Kyrie Ming misses. Rebound secured by Yao Brogdon.

[11:07] Team_066 possession (Score: 86-84)
Pau Curry attempts a 3Pt. Contested by Shaquille Ball (4.9 feet, MAN). Pau Curry misses. Rebound secured by Shaquille Ball.

[10:53] Team_095 possession (Score: 86-84)
Immanuel Middleton attempts a Midrange. Contested by Yao Brogdon (5.5 feet, MAN). IMMANUEL MIDDLETON MAKES IT!
Score: 88-84

[10:37] Team_066 possession (Score: 88-84)
Pau Curry drives to the basket... Pau Curry loses the ball! Stripped by Immanuel Middleton! TURNOVER! (live ball)

[10:20] Team_095 possession (Score: 88-84)
Evan Carter attempts a Layup. Contested by Brandon Reaves (5.7 feet, MAN). Evan Carter misses. Rebound secured by Kyle Wagner.

[10:11] Team_066 possession (Score: 88-84)
Kyle Wagner drives to the basket... Kyle Wagner loses control! Ball rolls out of bounds! TURNOVER! (dead ball)

[10:11] Substitution (Team_095): Dejounte Hyland OUT → Kyle Poole IN (stamina_rule2)

[10:11] Substitution (Team_095): Shaquille Ball OUT → Cade Beal IN (stamina_rule2)

[10:11] Substitution (Team_095): Evan Carter OUT → Tobias Wagner IN (stamina_rule2)

[10:11] Substitution (Team_095): Immanuel Middleton OUT → Gary Davis IN (stamina_rule2)

[10:11] Substitution (Team_095): Kyrie Ming OUT → DeMar McCollum IN (stamina_rule2)

[10:11] Substitution (Team_066): Jimmy Davis OUT → Pascal Carter IN (stamina_rule2)

[10:11] Substitution (Team_066): Pau Curry OUT → Lauri LaVine IN (stamina_rule2)

[10:11] Substitution (Team_066): Brandon Reaves OUT → Brandon Middleton IN (stamina_rule2)

[10:11] Substitution (Team_066): Yao Brogdon OUT → Cole Morant IN (stamina_rule2)

[10:11] Substitution (Team_066): Kyle Wagner OUT → Donovan Simmons IN (stamina_rule2)

[09:59] Team_095 possession (Score: 88-84)
Kyle Poole attempts a Layup. Wide open! Pascal Carter is 7.0 feet away. [MAN] Kyle Poole misses. FOUL! Loose ball foul on Donovan Simmons during the rebound battle. [Team fouls: 1] No free throws, side out. (Donovan Simmons: 1 personal fouls)

[09:47] Team_095 possession (Score: 88-84)
Tobias Wagner attempts a 3Pt. Contested by Lauri LaVine (4.3 feet, ZONE). Tobias Wagner misses. Rebound secured by Brandon Middleton.

[09:33] Team_066 possession (Score: 88-84)
Cole Morant drives, DeMar McCollum stays with him. Cole Morant attempts a Layup. Contested by DeMar McCollum (5.4 feet, ZONE). Cole Morant misses. Rebound secured by Gary Davis.

[09:18] Team_095 possession (Score: 88-84)
DeMar McCollum drives and kicks out. FOUL! Shooting foul on Lauri LaVine. Kyle Poole to the line for 3 free throws. [Team fouls: 2] (Lauri LaVine: 1 personal fouls)   FT 1/3: GOOD   FT 2/3: GOOD   FT 3/3: GOOD Kyle Poole makes 3/3 from the line.
Score: 91-84

[09:05] Team_066 possession (Score: 91-84)
Pascal Carter attempts a 3Pt. Contested by Cade Beal (4.5 feet, ZONE). PASCAL CARTER MAKES IT! Assist: Cole Morant
Score: 91-87

[08:54] Team_095 possession (Score: 91-87)
FOUL! Reach-in foul on Lauri LaVine during the drive. [Team fouls: 3] No free throws, side out. (Lauri LaVine: 2 personal fouls)

[08:36] Team_095 possession (Score: 91-87)
Gary Davis drives, Donovan Simmons stays with him. Gary Davis attempts a Layup. Contested by Donovan Simmons (4.7 feet, ZONE). Gary Davis misses. Offensive rebound by DeMar McCollum! DeMar McCollum kicks it out.

[08:21] Team_095 possession (Score: 91-87)
Cade Beal drives, picks up Donovan Simmons. Help arrives from Lauri LaVine! Cade Beal attempts a Layup. Contested by Lauri LaVine (4.8 feet, ZONE). CADE BEAL MAKES IT!
Score: 93-87

[08:02] Team_066 possession (Score: 93-87)
FOUL! Shooting foul on Tobias Wagner. Cole Morant to the line for 2 free throws. [Team fouls: 2] (Tobias Wagner: 1 personal fouls)   FT 1/2: GOOD   FT 2/2: MISS Cole Morant makes 1/2 from the line. Rebound secured by DeMar McCollum.
Score: 93-88

[07:49] Team_095 possession (Score: 93-88)
Kyle Poole attempts a 3Pt. Contested by Lauri LaVine (4.3 feet, ZONE). KYLE POOLE MAKES IT! Assist: DeMar McCollum
Score: 96-88

[07:32] Team_066 possession (Score: 96-88)
Pascal Carter makes the Layup and draws the foul on DeMar McCollum! And-1! Pascal Carter to the line for 1. [Team fouls: 3] (DeMar McCollum: 1 personal fouls)   FT 1/1: GOOD Pascal Carter makes 1/1 from the line.
Score: 96-91

[07:16] Team_095 possession (Score: 96-91)
Cade Beal drives, Lauri LaVine stays with him. Cade Beal attempts a Dunk. Contested by Lauri LaVine (3.9 feet, MAN). Cade Beal misses. Rebound secured by Lauri LaVine.

[07:03] Team_066 possession (Score: 96-91)
FOUL! Holding foul on Cade Beal. [Team fouls: 4] No free throws, side out. (Cade Beal: 1 personal fouls)

[06:50] Team_066 possession (Score: 96-91)
Donovan Simmons attempts a 3Pt. Contested by Kyle Poole (4.7 feet, ZONE). DONOVAN SIMMONS MAKES IT! Assist: Pascal Carter
Score: 96-94

[06:32] Team_095 possession (Score: 96-94)
Gary Davis attempts a 3Pt. Contested by Cole Morant (5.3 feet, MAN). Gary Davis misses. Rebound secured by Lauri LaVine.

[06:20] Team_066 possession (Score: 96-94)
FOUL! Holding foul on DeMar McCollum. [IN THE BONUS! 5 team fouls] Donovan Simmons to the line for 2 free throws. (DeMar McCollum: 2 personal fouls)   FT 1/2: GOOD   FT 2/2: MISS Donovan Simmons makes 1/2 from the line. Offensive rebound by Lauri LaVine! Lauri LaVine kicks it out.
Score: 96-95

[06:05] Team_066 possession (Score: 96-95)
FOUL! Offensive foul on Lauri LaVine! Cade Beal drew the charge! [Team fouls: 4] (Lauri LaVine: 3 personal fouls) TURNOVER! (dead ball)

[05:47] Team_095 possession (Score: 96-95)
Gary Davis drives, Cole Morant stays with him. Gary Davis attempts a Dunk. Contested by Cole Morant (5.3 feet, MAN). Gary Davis misses. Rebound secured by Brandon Middleton.

[05:37] Team_066 possession (Score: 96-95)
Brandon Middleton attempts a 3Pt. Contested by Tobias Wagner (3.5 feet, MAN). Brandon Middleton misses. Rebound secured by Tobias Wagner.

[05:18] Team_095 possession (Score: 96-95)
Gary Davis attempts a Layup. BLOCKED BY DONOVAN SIMMONS! Ball deflects out of bounds off Gary Davis.

[05:06] Team_066 possession (Score: 96-95)
Brandon Middleton attempts a Midrange. Contested by Tobias Wagner (3.5 feet, MAN). BRANDON MIDDLETON MAKES IT!
Score: 96-97

[04:53] Team_095 possession (Score: 96-97)
Kyle Poole attempts a 3Pt. Contested by Lauri LaVine (4.3 feet, ZONE). Kyle Poole misses. Rebound secured by Lauri LaVine.

[04:35] Team_066 possession (Score: 96-97)
Lauri LaVine drives to the basket... FOUL! Offensive foul on Lauri LaVine! DeMar McCollum drew the charge! [Team fouls: 5] (Lauri LaVine: 4 personal fouls) TURNOVER! (dead ball)

[04:21] Team_095 possession (Score: 96-97)
Tobias Wagner attempts a Layup. Contested by Brandon Middleton (5.5 feet, MAN). Tobias Wagner misses. Rebound secured by Donovan Simmons.

[04:12] Team_066 possession (Score: 96-97)
Cole Morant attempts a 3Pt. Contested by Gary Davis (6.0 feet, ZONE). Cole Morant misses. Rebound secured by DeMar McCollum.

[03:56] Team_095 possession (Score: 96-97)
Cade Beal attempts a 3Pt. Contested by Lauri LaVine (3.9 feet, MAN). CADE BEAL MAKES IT! Assist: Tobias Wagner
Score: 99-97

[03:44] Team_066 possession (Score: 99-97)
Cole Morant attempts a 3Pt. Contested by Cade Beal (4.9 feet, ZONE). Cole Morant misses. Rebound secured by Gary Davis.

[03:32] Team_095 possession (Score: 99-97)
FOUL! Holding foul on Pascal Carter. [IN THE BONUS! 6 team fouls] Kyle Poole to the line for 2 free throws. (Pascal Carter: 1 personal fouls)   FT 1/2: GOOD   FT 2/2: MISS Kyle Poole makes 1/2 from the line. FOUL! Loose ball foul on Brandon Middleton during the free throw rebound! [IN THE BONUS! 7 team fouls] Tobias Wagner to the line for 2 free throws. (Brandon Middleton: 1 personal fouls)   FT 1/2: GOOD   FT 2/2: GOOD Tobias Wagner makes 2/2 from the line.
Score: 102-97

[03:19] Team_066 possession (Score: 102-97)
Lauri LaVine attempts a 3Pt. Contested by Cade Beal (4.5 feet, ZONE). LAURI LAVINE MAKES IT! Assist: Brandon Middleton
Score: 102-100

[03:09] Team_095 possession (Score: 102-100)
Gary Davis attempts a 3Pt. Contested by Cole Morant (5.3 feet, MAN). Gary Davis misses. Rebound secured by Donovan Simmons.

[02:53] Team_066 possession (Score: 102-100)
Brandon Middleton attempts a 3Pt. Contested by Tobias Wagner (3.6 feet, MAN). Brandon Middleton misses. Offensive rebound by Donovan Simmons! Donovan Simmons kicks it out.

[02:37] Team_066 possession (Score: 102-100)
Donovan Simmons drives and kicks out. Brandon Middleton attempts a 3Pt. Contested by Tobias Wagner (3.9 feet, MAN). Brandon Middleton misses. Rebound secured by Gary Davis.

[02:22] Team_095 possession (Score: 102-100)
Cade Beal makes the Midrange and draws the foul on Lauri LaVine! And-1! Cade Beal to the line for 1. [BONUS: 8 team fouls] (Lauri LaVine: 5 personal fouls)   FT 1/1: GOOD Cade Beal makes 1/1 from the line.
Score: 105-100

[02:07] Team_066 possession (Score: 105-100)
Lauri LaVine attempts a 3Pt. Contested by Cade Beal (4.6 feet, MAN). Lauri LaVine misses. Offensive rebound by Donovan Simmons! Donovan Simmons kicks it out.

[01:55] Team_066 possession (Score: 105-100)
Lauri LaVine attempts a 3Pt. Contested by Kyle Poole (5.0 feet, ZONE). LAURI LAVINE MAKES IT! Assist: Cole Morant
Score: 105-103

[01:38] Team_095 possession (Score: 105-103)
DeMar McCollum drives, picks up Donovan Simmons. Help arrives from Lauri LaVine! DeMar McCollum attempts a Dunk. Contested by Lauri LaVine (5.6 feet, ZONE). DeMar McCollum misses. Offensive rebound by Tobias Wagner! Tobias Wagner kicks it out.

[01:22] Team_095 possession (Score: 105-103)
Cade Beal drives to the basket... Cade Beal throws a bad pass! Stolen by Donovan Simmons! TURNOVER! (live ball)

[01:06] Team_066 possession (Score: 105-103)
Brandon Middleton attempts a 3Pt. Contested by Tobias Wagner (3.8 feet, MAN). Brandon Middleton misses. Rebound secured by DeMar McCollum.

[00:55] Team_095 possession (Score: 105-103)
DeMar McCollum attempts a Layup. BLOCKED BY DONOVAN SIMMONS! Ball deflects out of bounds off DeMar McCollum.

[00:41] Team_066 possession (Score: 105-103)
Lauri LaVine attempts a Midrange. Contested by Cade Beal (4.7 feet, MAN). Lauri LaVine misses. Rebound secured by Tobias Wagner.

[00:24] Team_095 possession (Score: 105-103)
Cade Beal attempts a 3Pt. Contested by Lauri LaVine (4.2 feet, MAN). Cade Beal misses. Offensive rebound by Tobias Wagner! Tobias Wagner kicks it out.

[00:13] Team_095 possession (Score: 105-103)
Gary Davis attempts a Layup. BLOCKED BY COLE MORANT! Ball is loose! Rebound secured by Brandon Middleton.

================================================================================
                              4TH QUARTER COMPLETE                              
================================================================================

4TH QUARTER SCORE: Team_095 21, Team_066 19

BOX SCORE:
================================================================================

Team_095
--------------------------------------------------------------------------------
Player                MIN  PTS  REB  AST  TO      FG   FG%      3P   3P%
--------------------------------------------------------------------------------
Cade Beal              12    8    0    0   0   3/4    75.0     0/0   0.0
Kyle Poole             12    6    0    0   0   2/3    66.7     0/0   0.0
Tobias Wagner          12    3    4    1   0   1/3    33.3     0/0   0.0
Kyrie Ming             37    2    0    0   0   1/2    50.0     0/0   0.0
Immanuel Middleton     37    2    0    0   0   1/1   100.0     0/0   0.0
Shaquille Ball         37    0    2    0   0   0/0     0.0     0/0   0.0
Evan Carter            37    0    0    0   0   0/1     0.0     0/0   0.0
DeMar McCollum         12    0    5    1   0   0/1     0.0     0/0   0.0
Gary Davis             12    0    3    0   0   0/5     0.0     0/0   0.0

TEAM: FG: 8/20 (40.0%), 3PT: 2/6 (33.3%), REB: 14 (4 off, 10 def), AST: 2, TO: 1
TEAM FOULS: 5 [Team_066 in BONUS]


Team_066
--------------------------------------------------------------------------------
Player                MIN  PTS  REB  AST  TO      FG   FG%      3P   3P%
--------------------------------------------------------------------------------
Pascal Carter          12    6    0    1   0   2/2   100.0     0/0   0.0
Lauri LaVine           12    6    4    0   0   2/3    66.7     0/0   0.0
Donovan Simmons        12    3    4    0   0   1/2    50.0     0/0   0.0
Brandon Middleton      12    2    3    1   0   1/3    33.3     0/0   0.0
Jimmy Davis            37    0    0    0   0   0/1     0.0     0/0   0.0
Yao Brogdon            37    0    1    0   0   0/0     0.0     0/0   0.0
Pau Curry              37    0    0    0   0   0/1     0.0     0/0   0.0
Kyle Wagner            37    0    1    0   0   0/0     0.0     0/0   0.0
Cole Morant            12    0    0    2   0   0/4     0.0     0/0   0.0

TEAM: FG: 6/16 (37.5%), 3PT: 4/10 (40.0%), REB: 13 (3 off, 10 def), AST: 4, TO: 4
TEAM FOULS: 8 [Team_095 in BONUS]

================================================================================

================================================================================
                               FULL GAME COMPLETE                               
================================================================================

FINAL SCORE: Team_095 105, Team_066 103

SCORING BY QUARTER:
--------------------------------------------------------------------------------
Team                     Q1     Q2     Q3     Q4    FINAL
--------------------------------------------------------------------------------
Team_095                 33     32     19     21      105
Team_066                 20     34     30     19      103
--------------------------------------------------------------------------------

FULL GAME BOX SCORE:
================================================================================

Team_095
--------------------------------------------------------------------------------
Player                MIN  PTS  REB  AST  TO      FG   FG%      3P   3P%      FT STL BLK
--------------------------------------------------------------------------------
Dejounte Hyland        37   12   11    4   2   6/12   50.0   1/5    20.0   3/3     1   1
Shaquille Ball         37   14   10    7   1   4/6    66.7   0/2     0.0   0/0     1   1
Evan Carter            37   26   11    2   0  11/18   61.1   6/11   54.5   1/1     0   0
Immanuel Middleton     37   17    0    2   1   7/14   50.0   2/3    66.7   4/5     3   2
Kyrie Ming             37   18    0    5   0   8/12   66.7   0/0     0.0   4/4     0   0
Kyle Poole             12    6    0    0   0   1/2    50.0   1/2    50.0   4/5     0   0
Cade Beal              12    8    0    0   0   3/5    60.0   1/1   100.0   1/1     0   0
Tobias Wagner          12    3    5    1   1   0/3     0.0   0/2     0.0   0/0     0   0
Gary Davis             12    0    4    0   0   0/5     0.0   0/2     0.0   0/0     0   0
DeMar McCollum         12    0    5    1   1   1/2    50.0   0/0     0.0   0/0     0   0

TEAM: FG: 43/81 (53.1%), 3PT: 11/28 (39.3%), REB: 48 (15 off, 33 def), AST: 22, TO: 6


Team_066
--------------------------------------------------------------------------------
Player                MIN  PTS  REB  AST  TO      FG   FG%      3P   3P%      FT STL BLK
--------------------------------------------------------------------------------
Jimmy Davis            37   31    0    4   1  12/19   63.2   5/8    62.5   2/2     0   0
Pau Curry              37   26    0    1   0  10/18   55.6   4/11   36.4   5/5     1   0
Brandon Reaves         37   10    8    4   1   5/9    55.6   0/1     0.0   0/0     0   0
Yao Brogdon            37    2   11    6   1   2/4    50.0   0/0     0.0   0/0     0   1
Kyle Wagner            37   11   12    4   3   5/9    55.6   0/1     0.0   1/2     0   0
Pascal Carter          12    6    0    1   0   2/2   100.0   1/1   100.0   1/1     0   0
Lauri LaVine           12    6    6    0   1   3/5    60.0   2/3    66.7   0/0     0   0
Brandon Middleton      12    4    3    1   0   2/4    50.0   0/2     0.0   2/2     0   0
Cole Morant            12    2    0    2   0   0/5     0.0   0/2     0.0   1/2     0   1
Donovan Simmons        12    3    4    1   1   1/2    50.0   1/1   100.0   1/2     2   2

TEAM: FG: 42/77 (54.5%), 3PT: 13/30 (43.3%), REB: 42 (9 off, 33 def), AST: 24, TO: 8

================================================================================
