================================================================================
                        FULL GAME - Team_080 vs Team_008                        
================================================================================

================================================================================
                       1ST QUARTER - Team_080 vs Team_008                       
================================================================================

[12:00] Team_080 possession (Score: 0-0)
FOUL! Holding foul on Khris Hyland. [Team fouls: 1] No free throws, side out. (Khris Hyland: 1 personal fouls)

[11:48] Team_080 possession (Score: 0-0)
Jaren Morant attempts a Layup. BLOCKED BY JRUE HARRIS! Ball deflects out of bounds off Jaren Morant.

[11:28] Team_008 possession (Score: 0-0)
Victor Leonard attempts a Midrange. Contested by Khris Turner (4.9 feet, ZONE). VICTOR LEONARD MAKES IT! Assist: Jrue Harris
Score: 0-2

[11:11] Team_080 possession (Score: 0-2)
Khris Turner attempts a Layup. Contested by Tyrese Thompson (4.6 feet, ZONE). Khris Turner misses. Rebound secured by Magic Young.

[10:57] Team_008 possession (Score: 0-2)
Jrue Harris attempts a 3Pt. Contested by Lauri Dosunmu (4.1 feet, ZONE). Jrue Harris misses. Rebound secured by Draymond Simons.

[10:47] Team_080 possession (Score: 0-2)
FOUL! Shooting foul on Tyrese Thompson. Lauri Dosunmu to the line for 2 free throws. [Team fouls: 2] (Tyrese Thompson: 1 personal fouls)   FT 1/2: GOOD   FT 2/2: GOOD Lauri Dosunmu makes 2/2 from the line.
Score: 2-2

[10:36] Team_008 possession (Score: 2-2)
Khris Hyland attempts a 3Pt. Contested by Lauri Dosunmu (4.1 feet, ZONE). Khris Hyland misses. Rebound secured by Larry Paul.

[10:23] Team_080 possession (Score: 2-2)
Lauri Dosunmu attempts a 3Pt. Contested by Victor Leonard (5.8 feet, MAN). Lauri Dosunmu misses. Offensive rebound by Jaren Morant! Jaren Morant kicks it out.

[10:10] Team_080 possession (Score: 2-2)
Khris Turner drives to the basket... Khris Turner throws a bad pass out of bounds! TURNOVER! (dead ball)

[09:54] Team_008 possession (Score: 2-2)
Khris Hyland attempts a Midrange. Contested by Larry Paul (3.6 feet, MAN). KHRIS HYLAND MAKES IT!
Score: 2-4

[09:40] Team_080 possession (Score: 2-4)
Lauri Dosunmu drives, picks up Victor Leonard. Help arrives from Jrue Harris! Lauri Dosunmu attempts a Dunk. Contested by Jrue Harris (5.8 feet, MAN). Lauri Dosunmu misses. Offensive rebound by Jaren Morant! Jaren Morant kicks it out.

[09:26] Team_080 possession (Score: 2-4)
Jaren Morant attempts a 3Pt. Contested by Victor Leonard (5.4 feet, ZONE). Jaren Morant misses. Rebound secured by Magic Young.

[09:14] Team_008 possession (Score: 2-4)
Jrue Harris makes the Midrange and draws the foul on Khris Turner! And-1! Jrue Harris to the line for 1. [Team fouls: 1] (Khris Turner: 1 personal fouls)   FT 1/1: GOOD Jrue Harris makes 1/1 from the line.
Score: 2-7

[08:54] Team_080 possession (Score: 2-7)
Lauri Dosunmu attempts a Midrange. Contested by Victor Leonard (5.8 feet, MAN). Lauri Dosunmu misses. Rebound secured by Tyrese Thompson.

[08:42] Team_008 possession (Score: 2-7)
Victor Leonard attempts a 3Pt. Contested by Lauri Dosunmu (4.4 feet, ZONE). Victor Leonard misses. Rebound secured by Draymond Simons.

[08:27] Team_080 possession (Score: 2-7)
Lauri Dosunmu attempts a Midrange. Contested by Jrue Harris (5.1 feet, ZONE). LAURI DOSUNMU MAKES IT!
Score: 4-7

[08:12] Team_008 possession (Score: 4-7)
Victor Leonard attempts a 3Pt. Contested by Lauri Dosunmu (4.4 feet, MAN). Victor Leonard misses. Rebound secured by Draymond Simons.

[07:58] Team_080 possession (Score: 4-7)
FOUL! Reach-in foul on Magic Young during the drive. [Team fouls: 3] No free throws, side out. (Magic Young: 1 personal fouls)

[07:40] Team_080 possession (Score: 4-7)
Lauri Dosunmu drives and kicks out. Larry Paul attempts a Midrange. Contested by Khris Hyland (4.0 feet, MAN). Larry Paul misses. Rebound secured by Tyrese Thompson.

[07:29] Team_008 possession (Score: 4-7)
Tyrese Thompson attempts a Midrange. Contested by Jaren Morant (3.9 feet, MAN). Tyrese Thompson misses. Rebound secured by Draymond Simons.

[07:16] Team_080 possession (Score: 4-7)
Khris Turner drives, Jrue Harris stays with him. Khris Turner attempts a Dunk. Contested by Jrue Harris (4.5 feet, MAN). KHRIS TURNER MAKES IT! Assist: Lauri Dosunmu
Score: 6-7

[07:03] Team_008 possession (Score: 6-7)
Khris Hyland drives and kicks out. Magic Young attempts a 3Pt. Contested by Draymond Simons (3.9 feet, MAN). Magic Young misses. Rebound secured by Larry Paul.

[06:47] Team_080 possession (Score: 6-7)
Khris Turner attempts a Midrange. Contested by Jrue Harris (4.5 feet, MAN). KHRIS TURNER MAKES IT!
Score: 8-7

[06:35] Team_008 possession (Score: 8-7)
FOUL! Reach-in foul on Draymond Simons during the drive. [Team fouls: 2] No free throws, side out. (Draymond Simons: 1 personal fouls)

[06:22] Team_008 possession (Score: 8-7)
Magic Young attempts a Midrange. Contested by Jaren Morant (4.1 feet, ZONE). Magic Young misses. Rebound secured by Draymond Simons.

[06:08] Team_080 possession (Score: 8-7)
Larry Paul drives to the basket... Larry Paul throws a bad pass! Stolen by Tyrese Thompson! TURNOVER! (live ball)

[05:55] Team_008 possession (Score: 8-7)
Jrue Harris attempts a Midrange. Contested by Jaren Morant (3.8 feet, ZONE). Jrue Harris misses. Rebound secured by Jaren Morant.

[05:43] Team_080 possession (Score: 8-7)
FOUL! Holding foul on Khris Hyland. [Team fouls: 4] No free throws, side out. (Khris Hyland: 2 personal fouls)

[05:25] Team_080 possession (Score: 8-7)
Khris Turner makes the Midrange and draws the foul on Jrue Harris! And-1! Khris Turner to the line for 1. [BONUS: 5 team fouls] (Jrue Harris: 1 personal fouls)   FT 1/1: GOOD Khris Turner makes 1/1 from the line.
Score: 11-7

[05:11] Team_008 possession (Score: 11-7)
Khris Hyland makes the Layup and draws the foul on Draymond Simons! And-1! Khris Hyland to the line for 1. [Team fouls: 3] (Draymond Simons: 2 personal fouls)   FT 1/1: GOOD Khris Hyland makes 1/1 from the line.
Score: 11-10

[04:54] Team_080 possession (Score: 11-10)
Lauri Dosunmu attempts a 3Pt. Contested by Victor Leonard (5.9 feet, MAN). LAURI DOSUNMU MAKES IT! Assist: Khris Turner
Score: 14-10

[04:40] Team_008 possession (Score: 14-10)
Jrue Harris attempts a Layup. Contested by Khris Turner (4.7 feet, MAN). JRUE HARRIS MAKES IT! Assist: Khris Hyland
Score: 14-12

[04:25] Team_080 possession (Score: 14-12)
Draymond Simons drives, Magic Young stays with him. Draymond Simons attempts a Dunk. Contested by Magic Young (5.3 feet, ZONE). DRAYMOND SIMONS MAKES IT! Assist: Jaren Morant
Score: 16-12

[04:13] Team_008 possession (Score: 16-12)
Victor Leonard attempts a Midrange. Contested by Larry Paul (3.9 feet, ZONE). VICTOR LEONARD MAKES IT! Assist: Khris Hyland
Score: 16-14

[03:59] Team_080 possession (Score: 16-14)
Jaren Morant attempts a Layup. Contested by Tyrese Thompson (4.9 feet, MAN). JAREN MORANT MAKES IT!
Score: 18-14

[03:46] Team_008 possession (Score: 18-14)
Khris Hyland attempts a 3Pt. Contested by Larry Paul (3.7 feet, MAN). Khris Hyland misses. Rebound secured by Draymond Simons.

[03:31] Team_080 possession (Score: 18-14)
Larry Paul attempts a Layup. Contested by Tyrese Thompson (5.0 feet, ZONE). Larry Paul misses. Rebound secured by Tyrese Thompson.

[03:12] Team_008 possession (Score: 18-14)
Jrue Harris drives, picks up Khris Turner. Help arrives from Larry Paul! Jrue Harris attempts a Layup. Contested by Larry Paul (4.8 feet, MAN). JRUE HARRIS MAKES IT! Assist: Victor Leonard
Score: 18-16

[02:58] Team_080 possession (Score: 18-16)
FOUL! Shooting foul on Jrue Harris. Jaren Morant to the line for 2 free throws. [BONUS: 6 team fouls] (Jrue Harris: 2 personal fouls)   FT 1/2: GOOD   FT 2/2: GOOD Jaren Morant makes 2/2 from the line.
Score: 20-16

[02:44] Team_008 possession (Score: 20-16)
Khris Hyland drives and kicks out. Tyrese Thompson attempts a 3Pt. Contested by Jaren Morant (4.0 feet, MAN). Tyrese Thompson misses. Rebound secured by Draymond Simons.

[02:32] Team_080 possession (Score: 20-16)
Larry Paul drives to the basket... Larry Paul loses the ball! Stripped by Khris Hyland! TURNOVER! (live ball)

[02:12] Team_008 possession (Score: 20-16)
Victor Leonard attempts a 3Pt. Contested by Lauri Dosunmu (4.7 feet, ZONE). Victor Leonard misses. Rebound secured by Draymond Simons.

[02:00] Team_080 possession (Score: 20-16)
Larry Paul drives, Tyrese Thompson stays with him. Larry Paul attempts a Dunk. Contested by Tyrese Thompson (5.1 feet, ZONE). LARRY PAUL MAKES IT! Assist: Draymond Simons
Score: 22-16

[01:48] Team_008 possession (Score: 22-16)
FOUL! Reach-in foul on Draymond Simons during the drive. [Team fouls: 4] No free throws, side out. (Draymond Simons: 3 personal fouls)

[01:30] Team_008 possession (Score: 22-16)
Khris Hyland attempts a Layup. Contested by Jaren Morant (4.2 feet, ZONE). Khris Hyland misses. Rebound secured by Larry Paul.

[01:12] Team_080 possession (Score: 22-16)
Draymond Simons attempts a Layup. Contested by Magic Young (5.6 feet, MAN). DRAYMOND SIMONS MAKES IT! Assist: Jaren Morant
Score: 24-16

[00:54] Team_008 possession (Score: 24-16)
Tyrese Thompson attempts a 3Pt. Contested by Lauri Dosunmu (4.6 feet, ZONE). Tyrese Thompson misses. Rebound secured by Larry Paul.

[00:39] Team_080 possession (Score: 24-16)
Draymond Simons drives and kicks out. Khris Turner attempts a 3Pt. Contested by Victor Leonard (5.5 feet, ZONE). Khris Turner misses. Offensive rebound by Draymond Simons! Draymond Simons puts it back in!
Score: 26-16

[00:28] Team_008 possession (Score: 26-16)
Victor Leonard attempts a 3Pt. Contested by Lauri Dosunmu (4.8 feet, MAN). Victor Leonard misses. FOUL! Loose ball foul on Draymond Simons during the rebound battle. [IN THE BONUS! 5 team fouls] Magic Young to the line for 2 free throws. (Draymond Simons: 4 personal fouls)   FT 1/2: GOOD   FT 2/2: GOOD Magic Young makes 2/2 from the line.
Score: 26-18

[00:16] Team_080 possession (Score: 26-18)
Khris Turner attempts a Layup. Contested by Tyrese Thompson (5.2 feet, ZONE). Khris Turner misses. Rebound secured by Magic Young.

[00:05] Team_008 possession (Score: 26-18)
Victor Leonard attempts a Layup. BLOCKED BY LARRY PAUL! Ball is loose! Rebound secured by Jaren Morant.

================================================================================
                              1ST QUARTER COMPLETE                              
================================================================================

1ST QUARTER SCORE: Team_080 26, Team_008 18

BOX SCORE:
================================================================================

Team_080
--------------------------------------------------------------------------------
Player                MIN  PTS  REB  AST  TO      FG   FG%      3P   3P%
--------------------------------------------------------------------------------
Khris Turner           12    7    0    1   0   3/5    60.0     0/0   0.0
Lauri Dosunmu          12    7    0    1   0   3/5    60.0     0/0   0.0
Draymond Simons        12    6    9    1   0   3/3   100.0     0/0   0.0
Jaren Morant           12    4    4    2   0   2/4    50.0     0/0   0.0
Larry Paul             12    2    4    0   0   1/2    50.0     0/0   0.0

TEAM: FG: 12/19 (63.2%), 3PT: 1/2 (50.0%), REB: 17 (3 off, 14 def), AST: 5, TO: 3
TEAM FOULS: 5 [Team_008 in BONUS]


Team_008
--------------------------------------------------------------------------------
Player                MIN  PTS  REB  AST  TO      FG   FG%      3P   3P%
--------------------------------------------------------------------------------
Jrue Harris            12    7    0    1   0   3/5    60.0     0/0   0.0
Khris Hyland           12    5    0    2   0   2/7    28.6     0/0   0.0
Victor Leonard         12    4    0    1   0   2/6    33.3     0/0   0.0
Magic Young            12    2    3    0   0   1/2    50.0     0/0   0.0
Tyrese Thompson        12    0    3    0   0   0/2     0.0     0/0   0.0

TEAM: FG: 8/22 (36.4%), 3PT: 1/8 (12.5%), REB: 6 (0 off, 6 def), AST: 4, TO: 0
TEAM FOULS: 6 [Team_080 in BONUS]

================================================================================

================================================================================
                       2ND QUARTER - Team_080 vs Team_008                       
================================================================================

[12:00] Team_080 possession (Score: 26-18)
FOUL! Holding foul on Tyrese Thompson. [Team fouls: 1] No free throws, side out. (Tyrese Thompson: 1 personal fouls)

[11:43] Team_080 possession (Score: 26-18)
Jaren Morant attempts a Midrange. BLOCKED BY TYRESE THOMPSON! Ball is loose! Rebound secured by Tyrese Thompson.

[11:30] Team_008 possession (Score: 26-18)
Magic Young attempts a Midrange. Contested by Draymond Simons (4.7 feet, MAN). MAGIC YOUNG MAKES IT!
Score: 26-20

[11:13] Team_080 possession (Score: 26-20)
Larry Paul attempts a Layup. Contested by Tyrese Thompson (5.3 feet, ZONE). LARRY PAUL MAKES IT! Assist: Lauri Dosunmu
Score: 28-20

[10:58] Team_008 possession (Score: 28-20)
Magic Young attempts a 3Pt. Contested by Lauri Dosunmu (4.8 feet, ZONE). Magic Young misses. Offensive rebound by Magic Young! Magic Young kicks it out.

[10:46] Team_008 possession (Score: 28-20)
Magic Young attempts a Midrange. Contested by Draymond Simons (4.8 feet, MAN). Magic Young misses. Rebound secured by Draymond Simons.

[10:32] Team_080 possession (Score: 28-20)
Larry Paul drives and kicks out. Khris Turner attempts a 3Pt. Contested by Victor Leonard (5.5 feet, ZONE). Khris Turner misses. FOUL! Loose ball foul on Magic Young during the rebound battle. [Team fouls: 2] No free throws, side out. (Magic Young: 1 personal fouls)

[10:21] Team_080 possession (Score: 28-20)
Larry Paul makes the Layup and draws the foul on Khris Hyland! And-1! Larry Paul to the line for 1. [Team fouls: 3] (Khris Hyland: 1 personal fouls)   FT 1/1: GOOD Larry Paul makes 1/1 from the line.
Score: 31-20

[10:10] Team_008 possession (Score: 31-20)
Victor Leonard drives, picks up Draymond Simons. Help arrives from Khris Turner! Victor Leonard attempts a Dunk. Contested by Khris Turner (4.8 feet, ZONE). VICTOR LEONARD MAKES IT!
Score: 31-22

[09:57] Team_080 possession (Score: 31-22)
Khris Turner attempts a 3Pt. Contested by Victor Leonard (5.7 feet, ZONE). KHRIS TURNER MAKES IT! Assist: Draymond Simons
Score: 34-22

[09:44] Team_008 possession (Score: 34-22)
Jrue Harris drives and kicks out. Khris Hyland attempts a Midrange. Contested by Larry Paul (4.1 feet, MAN). KHRIS HYLAND MAKES IT! Assist: Tyrese Thompson
Score: 34-24

[09:28] Team_080 possession (Score: 34-24)
Khris Turner drives, picks up Tyrese Thompson. Help arrives from Jrue Harris! Khris Turner attempts a Dunk. Contested by Jrue Harris (5.4 feet, ZONE). Khris Turner misses. Rebound secured by Khris Hyland.

[09:13] Team_008 possession (Score: 34-24)
Jrue Harris attempts a Layup. BLOCKED BY KHRIS TURNER! Ball is loose! Offensive rebound by Tyrese Thompson! Tyrese Thompson kicks it out.

[08:58] Team_008 possession (Score: 34-24)
Jrue Harris drives to the basket... Jrue Harris throws a bad pass! Stolen by Khris Turner! TURNOVER! (live ball)

[08:44] Team_080 possession (Score: 34-24)
Larry Paul makes the Layup and draws the foul on Jrue Harris! And-1! Larry Paul to the line for 1. [Team fouls: 4] (Jrue Harris: 1 personal fouls)   FT 1/1: GOOD Larry Paul makes 1/1 from the line.
Score: 37-24

[08:31] Team_008 possession (Score: 37-24)
Magic Young attempts a Layup. Contested by Draymond Simons (5.1 feet, ZONE). MAGIC YOUNG MAKES IT!
Score: 37-26

[08:17] Team_080 possession (Score: 37-26)
Khris Turner drives to the basket... Khris Turner throws a bad pass out of bounds! TURNOVER! (dead ball)

[08:17] Substitution (Team_080): Lauri Dosunmu OUT → Tony James IN (stamina_rule2)

[08:17] Substitution (Team_080): Khris Turner OUT → Larry Reaves IN (stamina_rule2)

[08:17] Substitution (Team_080): Larry Paul OUT → Joel Bryant IN (stamina_rule2)

[08:17] Substitution (Team_080): Jaren Morant OUT → Ja Cunningham IN (stamina_rule2)

[08:17] Substitution (Team_080): Draymond Simons OUT → Trae Brogdon IN (stamina_rule2)

[08:17] Substitution (Team_008): Victor Leonard OUT → Blake Holiday IN (stamina_rule2)

[08:17] Substitution (Team_008): Jrue Harris OUT → Chris Griffin IN (stamina_rule2)

[08:17] Substitution (Team_008): Khris Hyland OUT → Immanuel Young IN (stamina_rule2)

[08:17] Substitution (Team_008): Tyrese Thompson OUT → Khris Giddey IN (stamina_rule2)

[08:17] Substitution (Team_008): Magic Young OUT → Lamelo Middleton IN (stamina_rule2)

[08:05] Team_008 possession (Score: 37-26)
Lamelo Middleton attempts a 3Pt. Contested by Trae Brogdon (5.8 feet, MAN). Lamelo Middleton misses. Offensive rebound by Lamelo Middleton! Lamelo Middleton puts it back in!
Score: 37-28

[07:54] Team_080 possession (Score: 37-28)
FOUL! Shooting foul on Chris Griffin. Larry Reaves to the line for 3 free throws. [BONUS: 5 team fouls] (Chris Griffin: 1 personal fouls)   FT 1/3: MISS   FT 2/3: GOOD   FT 3/3: GOOD Larry Reaves makes 2/3 from the line.
Score: 39-28

[07:39] Team_008 possession (Score: 39-28)
Blake Holiday drives and kicks out. Blake Holiday attempts a 3Pt. Contested by Tony James (4.2 feet, MAN). BLAKE HOLIDAY MAKES IT! Assist: Khris Giddey
Score: 39-31

[07:28] Team_080 possession (Score: 39-31)
Ja Cunningham attempts a Layup. Contested by Lamelo Middleton (4.3 feet, ZONE). Ja Cunningham misses. Rebound secured by Chris Griffin.

[07:16] Team_008 possession (Score: 39-31)
Khris Giddey attempts a 3Pt. Contested by Ja Cunningham (4.7 feet, ZONE). Khris Giddey misses. Rebound secured by Ja Cunningham.

[07:02] Team_080 possession (Score: 39-31)
Joel Bryant attempts a 3Pt. Contested by Khris Giddey (4.5 feet, ZONE). Joel Bryant misses. Offensive rebound by Larry Reaves! Larry Reaves kicks it out.

[06:47] Team_080 possession (Score: 39-31)
Ja Cunningham attempts a Midrange. Contested by Khris Giddey (4.3 feet, MAN). JA CUNNINGHAM MAKES IT!
Score: 41-31

[06:28] Team_008 possession (Score: 41-31)
Chris Griffin attempts a 3Pt. Contested by Larry Reaves (4.8 feet, MAN). CHRIS GRIFFIN MAKES IT! Assist: Khris Giddey
Score: 41-34

[06:12] Team_080 possession (Score: 41-34)
Ja Cunningham attempts a Layup. Contested by Khris Giddey (4.3 feet, MAN). Ja Cunningham misses. Offensive rebound by Ja Cunningham! Ja Cunningham kicks it out.

[05:57] Team_080 possession (Score: 41-34)
Joel Bryant attempts a 3Pt. Contested by Khris Giddey (4.5 feet, ZONE). JOEL BRYANT MAKES IT! Assist: Tony James
Score: 44-34

[05:43] Team_008 possession (Score: 44-34)
Lamelo Middleton attempts a Midrange. Contested by Larry Reaves (4.8 feet, ZONE). Lamelo Middleton misses. FOUL! Loose ball foul on Ja Cunningham during the rebound battle. [Team fouls: 1] No free throws, side out. (Ja Cunningham: 1 personal fouls)

[05:28] Team_008 possession (Score: 44-34)
Immanuel Young makes the Layup and draws the foul on Ja Cunningham! And-1! Immanuel Young to the line for 1. [Team fouls: 2] (Ja Cunningham: 2 personal fouls)   FT 1/1: GOOD Immanuel Young makes 1/1 from the line.
Score: 44-37

[05:12] Team_080 possession (Score: 44-37)
Joel Bryant drives to the basket... FOUL! Offensive foul on Joel Bryant! Immanuel Young drew the charge! [Team fouls: 3] (Joel Bryant: 1 personal fouls) TURNOVER! (dead ball)

[04:59] Team_008 possession (Score: 44-37)
Lamelo Middleton attempts a Midrange. Contested by Tony James (4.5 feet, ZONE). Lamelo Middleton misses. FOUL! Loose ball foul on Ja Cunningham during the rebound battle. [Team fouls: 4] No free throws, side out. (Ja Cunningham: 3 personal fouls)

[04:46] Team_008 possession (Score: 44-37)
Chris Griffin drives and kicks out. Lamelo Middleton attempts a 3Pt. Contested by Joel Bryant (4.4 feet, ZONE). Lamelo Middleton misses. Rebound secured by Trae Brogdon.

[04:28] Team_080 possession (Score: 44-37)
FOUL! Shooting foul on Khris Giddey. Ja Cunningham to the line for 3 free throws. [BONUS: 6 team fouls] (Khris Giddey: 1 personal fouls)   FT 1/3: GOOD   FT 2/3: GOOD   FT 3/3: GOOD Ja Cunningham makes 3/3 from the line.
Score: 47-37

[04:15] Team_008 possession (Score: 47-37)
Khris Giddey attempts a 3Pt. Contested by Ja Cunningham (4.7 feet, MAN). Khris Giddey misses. FOUL! Loose ball foul on Trae Brogdon during the rebound battle. [IN THE BONUS! 5 team fouls] Lamelo Middleton to the line for 2 free throws. (Trae Brogdon: 1 personal fouls)   FT 1/2: GOOD   FT 2/2: GOOD Lamelo Middleton makes 2/2 from the line.
Score: 47-39

[03:56] Team_080 possession (Score: 47-39)
FOUL! Holding foul on Lamelo Middleton. [IN THE BONUS! 7 team fouls] Trae Brogdon to the line for 2 free throws. (Lamelo Middleton: 1 personal fouls)   FT 1/2: GOOD   FT 2/2: GOOD Trae Brogdon makes 2/2 from the line.
Score: 49-39

[03:40] Team_008 possession (Score: 49-39)
FOUL! Shooting foul on Ja Cunningham. Khris Giddey to the line for 2 free throws. [BONUS: 6 team fouls] (Ja Cunningham: 4 personal fouls)   FT 1/2: GOOD   FT 2/2: GOOD Khris Giddey makes 2/2 from the line.
Score: 49-41

[03:28] Team_080 possession (Score: 49-41)
Tony James drives, picks up Blake Holiday. Help arrives from Chris Griffin! Tony James attempts a Dunk. Contested by Chris Griffin (5.6 feet, MAN). Tony James misses. Offensive rebound by Ja Cunningham! Ja Cunningham kicks it out.

[03:12] Team_080 possession (Score: 49-41)
Trae Brogdon attempts a Layup. Contested by Lamelo Middleton (4.2 feet, ZONE). TRAE BROGDON MAKES IT! Assist: Joel Bryant
Score: 51-41

[02:56] Team_008 possession (Score: 51-41)
Chris Griffin attempts a Midrange. Contested by Larry Reaves (4.8 feet, MAN). CHRIS GRIFFIN MAKES IT!
Score: 51-43

[02:38] Team_080 possession (Score: 51-43)
Larry Reaves drives to the basket... Larry Reaves throws a bad pass out of bounds! TURNOVER! (dead ball)

[02:24] Team_008 possession (Score: 51-43)
Blake Holiday attempts a 3Pt. Contested by Tony James (4.4 feet, MAN). BLAKE HOLIDAY MAKES IT! Assist: Immanuel Young
Score: 51-46

[02:11] Team_080 possession (Score: 51-46)
FOUL! Offensive foul on Ja Cunningham! Khris Giddey drew the charge! [Team fouls: 7] (Ja Cunningham: 5 personal fouls) TURNOVER! (dead ball)

[01:58] Team_008 possession (Score: 51-46)
Blake Holiday attempts a 3Pt. Contested by Tony James (4.4 feet, MAN). Blake Holiday misses. Rebound secured by Larry Reaves.

[01:41] Team_080 possession (Score: 51-46)
Joel Bryant attempts a Layup. Contested by Immanuel Young (4.6 feet, MAN). Joel Bryant misses. Rebound secured by Chris Griffin.

[01:30] Team_008 possession (Score: 51-46)
Blake Holiday attempts a 3Pt. Contested by Ja Cunningham (5.0 feet, ZONE). Blake Holiday misses. Offensive rebound by Lamelo Middleton! Lamelo Middleton puts it back in!
Score: 51-48

[01:16] Team_080 possession (Score: 51-48)
Larry Reaves attempts a 3Pt. Contested by Chris Griffin (5.5 feet, MAN). LARRY REAVES MAKES IT! Assist: Trae Brogdon
Score: 54-48

[01:04] Team_008 possession (Score: 54-48)
Blake Holiday throws a bad pass out of bounds! TURNOVER! (dead ball)

[00:50] Team_080 possession (Score: 54-48)
Larry Reaves makes the Layup and draws the foul on Immanuel Young! And-1! Larry Reaves to the line for 1. [BONUS: 8 team fouls] (Immanuel Young: 1 personal fouls)   FT 1/1: GOOD Larry Reaves makes 1/1 from the line.
Score: 57-48

[00:38] Team_008 possession (Score: 57-48)
Immanuel Young attempts a Layup. Contested by Joel Bryant (4.9 feet, MAN). Immanuel Young misses. Rebound secured by Larry Reaves.

[00:26] Team_080 possession (Score: 57-48)
Tony James makes the Layup and draws the foul on Blake Holiday! And-1! Tony James to the line for 1. [BONUS: 9 team fouls] (Blake Holiday: 1 personal fouls)   FT 1/1: GOOD Tony James makes 1/1 from the line.
Score: 60-48

[00:10] Team_008 possession (Score: 60-48)
Khris Giddey attempts a Midrange. Contested by Ja Cunningham (4.7 feet, MAN). Khris Giddey misses. FOUL! Loose ball foul on Trae Brogdon during the rebound battle. [IN THE BONUS! 8 team fouls] Lamelo Middleton to the line for 2 free throws. (Trae Brogdon: 2 personal fouls)   FT 1/2: GOOD   FT 2/2: MISS Lamelo Middleton makes 1/2 from the line. Rebound secured by Larry Reaves.
Score: 60-49

================================================================================
                              2ND QUARTER COMPLETE                              
================================================================================

2ND QUARTER SCORE: Team_080 34, Team_008 31

BOX SCORE:
================================================================================

Team_080
--------------------------------------------------------------------------------
Player                MIN  PTS  REB  AST  TO      FG   FG%      3P   3P%
--------------------------------------------------------------------------------
Larry Paul             16    8    0    0   0   3/3   100.0     0/0   0.0
Ja Cunningham           8    5    3    0   0   2/3    66.7     0/0   0.0
Trae Brogdon            8    4    1    1   0   2/2   100.0     0/0   0.0
Khris Turner           16    3    0    0   0   1/2    50.0     0/0   0.0
Joel Bryant             8    3    0    1   0   1/2    50.0     0/0   0.0
Tony James              8    3    0    1   0   1/1   100.0     0/0   0.0
Jaren Morant           16    0    0    0   0   0/1     0.0     0/0   0.0
Lauri Dosunmu          16    0    0    1   0   0/0     0.0     0/0   0.0
Draymond Simons        16    0    2    1   0   0/0     0.0     0/0   0.0

TEAM: FG: 13/17 (76.5%), 3PT: 5/5 (100.0%), REB: 9 (4 off, 5 def), AST: 5, TO: 4
TEAM FOULS: 8 [Team_008 in BONUS]


Team_008
--------------------------------------------------------------------------------
Player                MIN  PTS  REB  AST  TO      FG   FG%      3P   3P%
--------------------------------------------------------------------------------
Larry Reaves            8    8    4    0   0   3/3   100.0     0/0   0.0
Lamelo Middleton        8    6    3    0   0   3/3   100.0     0/0   0.0
Blake Holiday           8    6    0    0   0   2/3    66.7     0/0   0.0
Chris Griffin           8    5    2    0   0   2/3    66.7     0/0   0.0
Magic Young            16    4    1    0   0   2/3    66.7     0/0   0.0
Immanuel Young          8    3    0    1   0   1/2    50.0     0/0   0.0
Victor Leonard         16    2    0    0   0   1/1   100.0     0/0   0.0
Khris Hyland           16    2    1    0   0   1/1   100.0     0/0   0.0
Khris Giddey            8    2    1    2   0   1/3    33.3     0/0   0.0
Tyrese Thompson        16    0    2    1   0   0/0     0.0     0/0   0.0

TEAM: FG: 13/19 (68.4%), 3PT: 5/7 (71.4%), REB: 11 (7 off, 4 def), AST: 4, TO: 2
TEAM FOULS: 9 [Team_080 in BONUS]

================================================================================

================================================================================
                       3RD QUARTER - Team_080 vs Team_008                       
================================================================================

[12:00] Team_080 possession (Score: 60-49)
Larry Paul attempts a Midrange. Contested by Magic Young (5.3 feet, ZONE). Larry Paul misses. Rebound secured by Tyrese Thompson.

[11:43] Team_008 possession (Score: 60-49)
Victor Leonard attempts a 3Pt. Contested by Lauri Dosunmu (4.4 feet, ZONE). Victor Leonard misses. Rebound secured by Jaren Morant.

[11:29] Team_080 possession (Score: 60-49)
Jaren Morant attempts a 3Pt. Contested by Tyrese Thompson (4.8 feet, MAN). JAREN MORANT MAKES IT! Assist: Draymond Simons
Score: 63-49

[11:14] Team_008 possession (Score: 63-49)
Tyrese Thompson attempts a Layup. Contested by Jaren Morant (3.9 feet, MAN). TYRESE THOMPSON MAKES IT! Assist: Jrue Harris
Score: 63-51

[10:57] Team_080 possession (Score: 63-51)
Draymond Simons makes the Layup and draws the foul on Magic Young! And-1! Draymond Simons to the line for 1. [Team fouls: 1] (Magic Young: 1 personal fouls)   FT 1/1: GOOD Draymond Simons makes 1/1 from the line.
Score: 66-51

[10:44] Team_008 possession (Score: 66-51)
Khris Hyland drives and kicks out. Khris Hyland attempts a 3Pt. Contested by Larry Paul (3.5 feet, MAN). Khris Hyland misses. Rebound secured by Larry Paul.

[10:31] Team_080 possession (Score: 66-51)
Lauri Dosunmu attempts a Midrange. Contested by Victor Leonard (5.8 feet, MAN). LAURI DOSUNMU MAKES IT!
Score: 68-51

[10:15] Team_008 possession (Score: 68-51)
Khris Hyland drives and kicks out. Victor Leonard attempts a 3Pt. Contested by Lauri Dosunmu (4.0 feet, ZONE). Victor Leonard misses. Rebound secured by Jaren Morant.

[09:56] Team_080 possession (Score: 68-51)
Khris Turner attempts a Layup. Contested by Jrue Harris (4.5 feet, MAN). Khris Turner misses. Rebound secured by Khris Hyland.

[09:46] Team_008 possession (Score: 68-51)
FOUL! Reach-in foul on Draymond Simons during the drive. [Team fouls: 1] No free throws, side out. (Draymond Simons: 1 personal fouls)

[09:31] Team_008 possession (Score: 68-51)
Jrue Harris attempts a 3Pt. Contested by Khris Turner (4.7 feet, MAN). Jrue Harris misses. Rebound secured by Larry Paul.

[09:19] Team_080 possession (Score: 68-51)
Larry Paul drives, picks up Khris Hyland. Help arrives from Jrue Harris! Larry Paul attempts a Layup. Contested by Jrue Harris (4.4 feet, MAN). LARRY PAUL MAKES IT! Assist: Lauri Dosunmu
Score: 70-51

[09:00] Team_008 possession (Score: 70-51)
Khris Hyland attempts a Midrange. Contested by Larry Paul (3.6 feet, ZONE). KHRIS HYLAND MAKES IT! Assist: Magic Young
Score: 70-53

[08:44] Team_080 possession (Score: 70-53)
Lauri Dosunmu makes the Midrange and draws the foul on Jrue Harris! And-1! Lauri Dosunmu to the line for 1. [Team fouls: 2] (Jrue Harris: 1 personal fouls)   FT 1/1: MISS Lauri Dosunmu makes 0/1 from the line. Rebound secured by Tyrese Thompson.
Score: 72-53

[08:26] Team_008 possession (Score: 72-53)
Tyrese Thompson drives and kicks out. Tyrese Thompson attempts a 3Pt. Contested by Jaren Morant (3.7 feet, ZONE). Tyrese Thompson misses. Rebound secured by Larry Paul.

[08:11] Team_080 possession (Score: 72-53)
Khris Turner attempts a 3Pt. Contested by Jrue Harris (4.5 feet, MAN). Khris Turner misses. Rebound secured by Magic Young.

[07:57] Team_008 possession (Score: 72-53)
FOUL! Shooting foul on Khris Turner. Khris Hyland to the line for 2 free throws. [Team fouls: 2] (Khris Turner: 1 personal fouls)   FT 1/2: GOOD   FT 2/2: GOOD Khris Hyland makes 2/2 from the line.
Score: 72-55

[07:42] Team_080 possession (Score: 72-55)
Jaren Morant drives, picks up Tyrese Thompson. Help arrives from Jrue Harris! Jaren Morant attempts a Layup. Contested by Jrue Harris (4.8 feet, MAN). JAREN MORANT MAKES IT! Assist: Khris Turner
Score: 74-55

[07:24] Team_008 possession (Score: 74-55)
FOUL! Shooting foul on Lauri Dosunmu. Victor Leonard to the line for 2 free throws. [Team fouls: 3] (Lauri Dosunmu: 1 personal fouls)   FT 1/2: MISS   FT 2/2: GOOD Victor Leonard makes 1/2 from the line.
Score: 74-56

[07:10] Team_080 possession (Score: 74-56)
Draymond Simons attempts a Midrange. Contested by Magic Young (5.1 feet, MAN). Draymond Simons misses. Rebound secured by Tyrese Thompson.

[06:55] Team_008 possession (Score: 74-56)
FOUL! Reach-in foul on Draymond Simons during the drive. [Team fouls: 4] No free throws, side out. (Draymond Simons: 2 personal fouls)

[06:41] Team_008 possession (Score: 74-56)
Victor Leonard attempts a Layup. Contested by Draymond Simons (4.2 feet, ZONE). VICTOR LEONARD MAKES IT! Assist: Magic Young
Score: 74-58

[06:26] Team_080 possession (Score: 74-58)
Lauri Dosunmu attempts a Layup. Contested by Victor Leonard (5.8 feet, MAN). Lauri Dosunmu misses. Rebound secured by Tyrese Thompson.

[06:12] Team_008 possession (Score: 74-58)
Tyrese Thompson attempts a Midrange. Contested by Jaren Morant (3.9 feet, MAN). Tyrese Thompson misses. Rebound secured by Larry Paul.

[05:59] Team_080 possession (Score: 74-58)
Khris Turner attempts a Midrange. Contested by Jrue Harris (4.5 feet, MAN). KHRIS TURNER MAKES IT!
Score: 76-58

[05:41] Team_008 possession (Score: 76-58)
Victor Leonard drives and kicks out. Tyrese Thompson attempts a 3Pt. Contested by Lauri Dosunmu (4.0 feet, ZONE). Tyrese Thompson misses. Offensive rebound by Tyrese Thompson! Tyrese Thompson kicks it out.

[05:29] Team_008 possession (Score: 76-58)
Tyrese Thompson drives, picks up Jaren Morant. Help arrives from Khris Turner! Tyrese Thompson attempts a Layup. Contested by Khris Turner (3.9 feet, MAN). TYRESE THOMPSON MAKES IT! Assist: Magic Young
Score: 76-60

[05:16] Team_080 possession (Score: 76-60)
Larry Paul attempts a 3Pt. Contested by Tyrese Thompson (4.8 feet, ZONE). LARRY PAUL MAKES IT!
Score: 79-60

[05:01] Team_008 possession (Score: 79-60)
Victor Leonard attempts a Layup. Contested by Lauri Dosunmu (4.4 feet, MAN). VICTOR LEONARD MAKES IT! Assist: Magic Young
Score: 79-62

[04:47] Team_080 possession (Score: 79-62)
FOUL! Reach-in foul on Magic Young during the drive. [Team fouls: 3] No free throws, side out. (Magic Young: 2 personal fouls)

[04:36] Team_080 possession (Score: 79-62)
Khris Turner throws a bad pass out of bounds! TURNOVER! (dead ball)

[04:24] Team_008 possession (Score: 79-62)
Jrue Harris attempts a Layup. Contested by Draymond Simons (4.1 feet, ZONE). Jrue Harris misses. Rebound secured by Larry Paul.

[04:10] Team_080 possession (Score: 79-62)
Lauri Dosunmu attempts a 3Pt. Contested by Victor Leonard (5.9 feet, ZONE). LAURI DOSUNMU MAKES IT! Assist: Draymond Simons
Score: 82-62

[03:58] Team_008 possession (Score: 82-62)
Khris Hyland throws a bad pass! Stolen by Larry Paul! TURNOVER! (live ball)

[03:46] Team_080 possession (Score: 82-62)
Jaren Morant attempts a 3Pt. Contested by Tyrese Thompson (4.9 feet, MAN). Jaren Morant misses. Rebound secured by Tyrese Thompson.

[03:35] Team_008 possession (Score: 82-62)
FOUL! Holding foul on Khris Turner. [IN THE BONUS! 5 team fouls] Jrue Harris to the line for 2 free throws. (Khris Turner: 2 personal fouls)   FT 1/2: GOOD   FT 2/2: GOOD Jrue Harris makes 2/2 from the line.
Score: 82-64

[03:19] Team_080 possession (Score: 82-64)
Jaren Morant drives and kicks out. Draymond Simons attempts a 3Pt. Contested by Magic Young (5.2 feet, MAN). Draymond Simons misses. Rebound secured by Khris Hyland.

[03:01] Team_008 possession (Score: 82-64)
Tyrese Thompson attempts a Layup. BLOCKED BY JAREN MORANT! Ball deflects out of bounds off Tyrese Thompson.

[02:46] Team_080 possession (Score: 82-64)
Lauri Dosunmu attempts a 3Pt. Wide open! Victor Leonard is 6.0 feet away. [ZONE] Lauri Dosunmu misses. Rebound secured by Khris Hyland.

[02:30] Team_008 possession (Score: 82-64)
Khris Hyland drives to the basket... FOUL! Offensive foul on Khris Hyland! Draymond Simons drew the charge! [Team fouls: 4] (Khris Hyland: 1 personal fouls) TURNOVER! (dead ball)

[02:16] Team_080 possession (Score: 82-64)
Lauri Dosunmu throws a bad pass! Stolen by Victor Leonard! TURNOVER! (live ball)

[02:01] Team_008 possession (Score: 82-64)
FOUL! Shooting foul on Jaren Morant. Tyrese Thompson to the line for 2 free throws. [BONUS: 6 team fouls] (Jaren Morant: 1 personal fouls)   FT 1/2: MISS   FT 2/2: GOOD Tyrese Thompson makes 1/2 from the line.
Score: 82-65

[01:46] Team_080 possession (Score: 82-65)
Draymond Simons drives to the basket... Draymond Simons loses the ball! Stripped by Tyrese Thompson! TURNOVER! (live ball)

[01:34] Team_008 possession (Score: 82-65)
Jrue Harris drives and kicks out. FOUL! Shooting foul on Khris Turner. Jrue Harris to the line for 2 free throws. [BONUS: 7 team fouls] (Khris Turner: 3 personal fouls)   FT 1/2: MISS   FT 2/2: GOOD Jrue Harris makes 1/2 from the line.
Score: 82-66

[01:19] Team_080 possession (Score: 82-66)
Lauri Dosunmu loses control! Ball rolls out of bounds! TURNOVER! (dead ball)

[01:19] Substitution (Team_080): Lauri Dosunmu OUT → Tony James IN (stamina_rule2)

[01:19] Substitution (Team_080): Khris Turner OUT → Larry Reaves IN (stamina_rule2)

[01:19] Substitution (Team_080): Larry Paul OUT → Joel Bryant IN (stamina_rule2)

[01:19] Substitution (Team_080): Jaren Morant OUT → Ja Cunningham IN (stamina_rule2)

[01:19] Substitution (Team_080): Draymond Simons OUT → Trae Brogdon IN (stamina_rule2)

[01:19] Substitution (Team_008): Victor Leonard OUT → Blake Holiday IN (stamina_rule2)

[01:19] Substitution (Team_008): Jrue Harris OUT → Chris Griffin IN (stamina_rule2)

[01:19] Substitution (Team_008): Khris Hyland OUT → Immanuel Young IN (stamina_rule2)

[01:19] Substitution (Team_008): Tyrese Thompson OUT → Khris Giddey IN (stamina_rule2)

[01:19] Substitution (Team_008): Magic Young OUT → Lamelo Middleton IN (stamina_rule2)

[01:05] Team_008 possession (Score: 82-66)
Blake Holiday attempts a Midrange. Contested by Larry Reaves (4.7 feet, ZONE). BLAKE HOLIDAY MAKES IT!
Score: 82-68

[00:52] Team_080 possession (Score: 82-68)
Joel Bryant drives, picks up Lamelo Middleton. Help arrives from Chris Griffin! Joel Bryant attempts a Layup. Contested by Chris Griffin (4.6 feet, ZONE). JOEL BRYANT MAKES IT! Assist: Tony James
Score: 84-68

[00:36] Team_008 possession (Score: 84-68)
Lamelo Middleton drives, Trae Brogdon stays with him. Lamelo Middleton attempts a Dunk. Contested by Trae Brogdon (5.8 feet, MAN). LAMELO MIDDLETON MAKES IT! Assist: Immanuel Young
Score: 84-70

[00:25] Team_080 possession (Score: 84-70)
Joel Bryant attempts a 3Pt. Contested by Khris Giddey (4.5 feet, ZONE). Joel Bryant misses. Rebound secured by Khris Giddey.

[00:12] Team_008 possession (Score: 84-70)
Chris Griffin makes the Layup and draws the foul on Larry Reaves! And-1! Chris Griffin to the line for 1. [BONUS: 8 team fouls] (Larry Reaves: 1 personal fouls)   FT 1/1: GOOD Chris Griffin makes 1/1 from the line.
Score: 84-73

================================================================================
                              3RD QUARTER COMPLETE                              
================================================================================

3RD QUARTER SCORE: Team_080 24, Team_008 24

BOX SCORE:
================================================================================

Team_080
--------------------------------------------------------------------------------
Player                MIN  PTS  REB  AST  TO      FG   FG%      3P   3P%
--------------------------------------------------------------------------------
Larry Paul             27    5    5    0   0   2/3    66.7     0/0   0.0
Jaren Morant           27    5    2    0   0   2/4    50.0     0/0   0.0
Lauri Dosunmu          27    5    0    1   0   2/5    40.0     0/0   0.0
Draymond Simons        27    3    0    2   0   1/2    50.0     0/0   0.0
Khris Turner           27    2    0    1   0   1/3    33.3     0/0   0.0
Joel Bryant             9    2    0    0   0   1/2    50.0     0/0   0.0
Tony James              9    0    0    1   0   0/0     0.0     0/0   0.0

TEAM: FG: 9/19 (47.4%), 3PT: 3/7 (42.9%), REB: 7 (0 off, 7 def), AST: 5, TO: 4
TEAM FOULS: 8 [Team_008 in BONUS]


Team_008
--------------------------------------------------------------------------------
Player                MIN  PTS  REB  AST  TO      FG   FG%      3P   3P%
--------------------------------------------------------------------------------
Tyrese Thompson        27    5    6    0   0   3/6    50.0     0/0   0.0
Victor Leonard         27    5    0    0   0   3/4    75.0     0/0   0.0
Khris Hyland           27    4    3    0   0   2/4    50.0     0/0   0.0
Jrue Harris            27    3    0    1   0   2/4    50.0     0/0   0.0
Chris Griffin           9    3    0    0   0   1/1   100.0     0/0   0.0
Blake Holiday           9    2    0    0   0   1/1   100.0     0/0   0.0
Lamelo Middleton        9    2    0    0   0   1/1   100.0     0/0   0.0
Magic Young            27    0    1    4   0   0/0     0.0     0/0   0.0
Immanuel Young          9    0    0    1   0   0/0     0.0     0/0   0.0
Khris Giddey            9    0    1    0   0   0/0     0.0     0/0   0.0

TEAM: FG: 13/21 (61.9%), 3PT: 0/2 (0.0%), REB: 11 (1 off, 10 def), AST: 6, TO: 2
TEAM FOULS: 4

================================================================================

================================================================================
                       4TH QUARTER - Team_080 vs Team_008                       
================================================================================

[12:00] Team_080 possession (Score: 84-73)
Larry Paul attempts a Midrange. Contested by Khris Hyland (4.5 feet, MAN). Larry Paul misses. Rebound secured by Tyrese Thompson.

[11:46] Team_008 possession (Score: 84-73)
Magic Young drives, Draymond Simons stays with him. Magic Young attempts a Dunk. Contested by Draymond Simons (4.4 feet, MAN). Magic Young misses. FOUL! Loose ball foul on Draymond Simons during the rebound battle. [Team fouls: 1] No free throws, side out. (Draymond Simons: 1 personal fouls)

[11:32] Team_008 possession (Score: 84-73)
Jrue Harris drives and kicks out. Magic Young attempts a Midrange. Contested by Larry Paul (3.6 feet, ZONE). Magic Young misses. Rebound secured by Jaren Morant.

[11:14] Team_080 possession (Score: 84-73)
Jaren Morant drives, Tyrese Thompson stays with him. Jaren Morant attempts a Layup. Contested by Tyrese Thompson (5.0 feet, MAN). JAREN MORANT MAKES IT! Assist: Draymond Simons
Score: 86-73

[10:55] Team_008 possession (Score: 86-73)
FOUL! Shooting foul on Draymond Simons. Victor Leonard to the line for 2 free throws. [Team fouls: 2] (Draymond Simons: 2 personal fouls)   FT 1/2: GOOD   FT 2/2: GOOD Victor Leonard makes 2/2 from the line.
Score: 86-75

[10:39] Team_080 possession (Score: 86-75)
Lauri Dosunmu drives to the basket... FOUL! Offensive foul on Lauri Dosunmu! Victor Leonard drew the charge! [Team fouls: 3] (Lauri Dosunmu: 1 personal fouls) TURNOVER! (dead ball)

[10:30] Team_008 possession (Score: 86-75)
Tyrese Thompson drives and kicks out. Jrue Harris attempts a Midrange. Contested by Khris Turner (4.8 feet, MAN). Jrue Harris misses. Rebound secured by Larry Paul.

[10:18] Team_080 possession (Score: 86-75)
Draymond Simons drives and kicks out. Lauri Dosunmu attempts a 3Pt. Contested by Khris Hyland (4.3 feet, ZONE). Lauri Dosunmu misses. Offensive rebound by Jaren Morant! Jaren Morant kicks it out.

[10:02] Team_080 possession (Score: 86-75)
Draymond Simons commits a violation (traveling/carry)! TURNOVER! (dead ball)

[10:02] Substitution (Team_080): Lauri Dosunmu OUT → Tony James IN (stamina_rule2)

[10:02] Substitution (Team_080): Khris Turner OUT → Larry Reaves IN (stamina_rule2)

[10:02] Substitution (Team_080): Jaren Morant OUT → Ja Cunningham IN (stamina_rule2)

[10:02] Substitution (Team_080): Draymond Simons OUT → Trae Brogdon IN (stamina_rule2)

[10:02] Substitution (Team_008): Victor Leonard OUT → Blake Holiday IN (stamina_rule2)

[10:02] Substitution (Team_008): Jrue Harris OUT → Chris Griffin IN (stamina_rule2)

[10:02] Substitution (Team_008): Khris Hyland OUT → Immanuel Young IN (stamina_rule2)

[10:02] Substitution (Team_008): Tyrese Thompson OUT → Khris Giddey IN (stamina_rule2)

[10:02] Substitution (Team_008): Magic Young OUT → Lamelo Middleton IN (stamina_rule2)

[09:48] Team_008 possession (Score: 86-75)
Khris Giddey drives, Ja Cunningham stays with him. Khris Giddey attempts a Layup. Contested by Ja Cunningham (4.7 feet, ZONE). KHRIS GIDDEY MAKES IT! Assist: Blake Holiday
Score: 86-77

[09:38] Team_080 possession (Score: 86-77)
Larry Reaves attempts a 3Pt. Contested by Chris Griffin (5.5 feet, MAN). Larry Reaves misses. Rebound secured by Chris Griffin.

[09:22] Team_008 possession (Score: 86-77)
Chris Griffin attempts a 3Pt. Contested by Tony James (4.5 feet, ZONE). Chris Griffin misses. Rebound secured by Larry Paul.

[09:12] Team_080 possession (Score: 86-77)
Trae Brogdon drives and kicks out. Trae Brogdon attempts a 3Pt. Contested by Khris Giddey (4.3 feet, ZONE). TRAE BROGDON MAKES IT! Assist: Larry Paul
Score: 89-77

[08:57] Team_008 possession (Score: 89-77)
Immanuel Young attempts a Midrange. Contested by Larry Paul (4.4 feet, MAN). Immanuel Young misses. Rebound secured by Ja Cunningham.

[08:38] Team_080 possession (Score: 89-77)
Trae Brogdon drives, picks up Lamelo Middleton. Help arrives from Chris Griffin! Trae Brogdon attempts a Layup. Contested by Chris Griffin (4.2 feet, MAN). TRAE BROGDON MAKES IT!
Score: 91-77

[08:25] Team_008 possession (Score: 91-77)
Khris Giddey attempts a 3Pt. Contested by Ja Cunningham (4.7 feet, MAN). Khris Giddey misses. Rebound secured by Larry Reaves.

[08:10] Team_080 possession (Score: 91-77)
Trae Brogdon drives and kicks out. Ja Cunningham attempts a 3Pt. Contested by Khris Giddey (4.3 feet, MAN). JA CUNNINGHAM MAKES IT! Assist: Larry Paul
Score: 94-77

[07:56] Team_008 possession (Score: 94-77)
Khris Giddey drives and kicks out. Blake Holiday attempts a 3Pt. Contested by Tony James (4.2 feet, MAN). Blake Holiday misses. Rebound secured by Larry Reaves.

[07:41] Team_080 possession (Score: 94-77)
FOUL! Shooting foul on Lamelo Middleton. Trae Brogdon to the line for 2 free throws. [Team fouls: 1] (Lamelo Middleton: 1 personal fouls)   FT 1/2: GOOD   FT 2/2: GOOD Trae Brogdon makes 2/2 from the line.
Score: 96-77

[07:27] Team_008 possession (Score: 96-77)
FOUL! Reach-in foul on Ja Cunningham during the drive. [Team fouls: 4] No free throws, side out. (Ja Cunningham: 1 personal fouls)

[07:09] Team_008 possession (Score: 96-77)
Blake Holiday attempts a Midrange. Contested by Tony James (4.4 feet, ZONE). BLAKE HOLIDAY MAKES IT!
Score: 96-79

[06:52] Team_080 possession (Score: 96-79)
Larry Reaves attempts a Layup. Contested by Lamelo Middleton (4.5 feet, ZONE). LARRY REAVES MAKES IT!
Score: 98-79

[06:37] Team_008 possession (Score: 98-79)
Khris Giddey attempts a 3Pt. Contested by Ja Cunningham (4.7 feet, MAN). Khris Giddey misses. Rebound secured by Larry Paul.

[06:19] Team_080 possession (Score: 98-79)
Larry Paul drives and kicks out. Larry Reaves attempts a 3Pt. Contested by Chris Griffin (5.3 feet, MAN). LARRY REAVES MAKES IT!
Score: 101-79

[06:04] Team_008 possession (Score: 101-79)
Lamelo Middleton makes the Layup and draws the foul on Ja Cunningham! And-1! Lamelo Middleton to the line for 1. [BONUS: 5 team fouls] (Ja Cunningham: 2 personal fouls)   FT 1/1: MISS Lamelo Middleton makes 0/1 from the line. Rebound secured by Larry Paul.
Score: 101-81

[05:54] Team_080 possession (Score: 101-81)
Ja Cunningham attempts a Midrange. Contested by Khris Giddey (4.3 feet, MAN). Ja Cunningham misses. Rebound secured by Lamelo Middleton.

[05:43] Team_008 possession (Score: 101-81)
Khris Giddey drives, Ja Cunningham stays with him. Khris Giddey attempts a Layup. Contested by Ja Cunningham (4.7 feet, MAN). Khris Giddey misses. Rebound secured by Larry Reaves.

[05:29] Team_080 possession (Score: 101-81)
Tony James drives to the basket... FOUL! Offensive foul on Tony James! Lamelo Middleton drew the charge! [Team fouls: 6] (Tony James: 1 personal fouls) TURNOVER! (dead ball)

[05:14] Team_008 possession (Score: 101-81)
Immanuel Young drives, picks up Larry Paul. Help arrives from Larry Reaves! Immanuel Young attempts a Dunk. Contested by Larry Reaves (4.8 feet, MAN). Immanuel Young misses. Rebound secured by Ja Cunningham.

[04:59] Team_080 possession (Score: 101-81)
Larry Paul attempts a 3Pt. Contested by Khris Giddey (4.5 feet, ZONE). Larry Paul misses. Rebound secured by Chris Griffin.

[04:45] Team_008 possession (Score: 101-81)
Chris Griffin drives, Larry Reaves stays with him. Chris Griffin attempts a Dunk. Contested by Larry Reaves (4.8 feet, MAN). Chris Griffin misses. Rebound secured by Ja Cunningham.

[04:33] Team_080 possession (Score: 101-81)
Ja Cunningham attempts a 3Pt. Contested by Khris Giddey (4.3 feet, MAN). Ja Cunningham misses. Rebound secured by Chris Griffin.

[04:17] Team_008 possession (Score: 101-81)
Immanuel Young attempts a Layup. Contested by Ja Cunningham (5.3 feet, ZONE). IMMANUEL YOUNG MAKES IT!
Score: 101-83

[04:02] Team_080 possession (Score: 101-83)
Larry Reaves attempts a 3Pt. Contested by Chris Griffin (5.5 feet, MAN). LARRY REAVES MAKES IT! Assist: Tony James
Score: 104-83

[03:45] Team_008 possession (Score: 104-83)
Immanuel Young attempts a 3Pt. Contested by Tony James (4.7 feet, ZONE). Immanuel Young misses. Rebound secured by Larry Reaves.

[03:32] Team_080 possession (Score: 104-83)
Larry Reaves attempts a 3Pt. Contested by Chris Griffin (5.5 feet, MAN). LARRY REAVES MAKES IT! Assist: Tony James
Score: 107-83

[03:18] Team_008 possession (Score: 107-83)
Lamelo Middleton attempts a Layup. Contested by Ja Cunningham (5.1 feet, ZONE). LAMELO MIDDLETON MAKES IT! Assist: Khris Giddey
Score: 107-85

[03:00] Team_080 possession (Score: 107-85)
Ja Cunningham attempts a Layup. Contested by Lamelo Middleton (4.4 feet, ZONE). JA CUNNINGHAM MAKES IT! Assist: Trae Brogdon
Score: 109-85

[02:49] Team_008 possession (Score: 109-85)
Khris Giddey attempts a Midrange. Contested by Larry Reaves (4.5 feet, ZONE). Khris Giddey misses. Rebound secured by Trae Brogdon.

[02:39] Team_080 possession (Score: 109-85)
Trae Brogdon attempts a Layup. BLOCKED BY LAMELO MIDDLETON! Ball is loose! Rebound secured by Chris Griffin.

[02:29] Team_008 possession (Score: 109-85)
Blake Holiday attempts a 3Pt. Contested by Tony James (4.5 feet, ZONE). BLAKE HOLIDAY MAKES IT! Assist: Immanuel Young
Score: 109-88

[02:13] Team_080 possession (Score: 109-88)
Ja Cunningham attempts a 3Pt. Contested by Khris Giddey (4.4 feet, MAN). Ja Cunningham misses. Rebound secured by Chris Griffin.

[02:03] Team_008 possession (Score: 109-88)
FOUL! Reach-in foul on Ja Cunningham during the drive. [IN THE BONUS! 7 team fouls] Chris Griffin to the line for 2 free throws. (Ja Cunningham: 3 personal fouls)   FT 1/2: GOOD   FT 2/2: GOOD Chris Griffin makes 2/2 from the line.
Score: 109-90

[01:51] Team_080 possession (Score: 109-90)
FOUL! Holding foul on Chris Griffin. [Team fouls: 2] No free throws, side out. (Chris Griffin: 1 personal fouls)

[01:39] Team_080 possession (Score: 109-90)
Larry Paul attempts a 3Pt. Contested by Immanuel Young (4.7 feet, MAN). LARRY PAUL MAKES IT! Assist: Tony James
Score: 112-90

[01:21] Team_008 possession (Score: 112-90)
Chris Griffin drives and kicks out. Lamelo Middleton attempts a 3Pt. Contested by Trae Brogdon (5.8 feet, MAN). LAMELO MIDDLETON MAKES IT! Assist: Khris Giddey
Score: 112-93

[01:09] Team_080 possession (Score: 112-93)
Larry Paul makes the Layup and draws the foul on Immanuel Young! And-1! Larry Paul to the line for 1. [Team fouls: 3] (Immanuel Young: 1 personal fouls)   FT 1/1: GOOD Larry Paul makes 1/1 from the line.
Score: 115-93

[00:58] Team_008 possession (Score: 115-93)
Chris Griffin attempts a 3Pt. Contested by Larry Reaves (5.1 feet, MAN). CHRIS GRIFFIN MAKES IT! Assist: Khris Giddey
Score: 115-96

[00:44] Team_080 possession (Score: 115-96)
FOUL! Shooting foul on Immanuel Young. Larry Paul to the line for 2 free throws. [Team fouls: 4] (Immanuel Young: 2 personal fouls)   FT 1/2: MISS   FT 2/2: GOOD Larry Paul makes 1/2 from the line.
Score: 116-96

[00:29] Team_008 possession (Score: 116-96)
FOUL! Shooting foul on Ja Cunningham. Khris Giddey to the line for 2 free throws. [BONUS: 8 team fouls] (Ja Cunningham: 4 personal fouls)   FT 1/2: MISS   FT 2/2: GOOD Khris Giddey makes 1/2 from the line.
Score: 116-97

[00:18] Team_080 possession (Score: 116-97)
Tony James attempts a 3Pt. Contested by Blake Holiday (5.9 feet, MAN). Tony James misses. FOUL! Loose ball foul on Lamelo Middleton during the rebound battle. [IN THE BONUS! 5 team fouls] Larry Reaves to the line for 2 free throws. (Lamelo Middleton: 2 personal fouls)   FT 1/2: MISS   FT 2/2: GOOD Larry Reaves makes 1/2 from the line.
Score: 117-97

[00:02] Team_008 possession (Score: 117-97)
Blake Holiday attempts a 3Pt. Contested by Tony James (4.7 feet, MAN). BLAKE HOLIDAY MAKES IT! Assist: Chris Griffin
Score: 117-100

================================================================================
                              4TH QUARTER COMPLETE                              
================================================================================

4TH QUARTER SCORE: Team_080 33, Team_008 27

BOX SCORE:
================================================================================

Team_080
--------------------------------------------------------------------------------
Player                MIN  PTS  REB  AST  TO      FG   FG%      3P   3P%
--------------------------------------------------------------------------------
Larry Reaves           19   12    4    0   0   5/6    83.3     0/0   0.0
Larry Paul             39    7    4    2   0   3/5    60.0     0/0   0.0
Trae Brogdon           19    7    1    1   0   3/4    75.0     0/0   0.0
Ja Cunningham          19    5    3    0   0   2/5    40.0     0/0   0.0
Jaren Morant           29    2    2    0   0   1/1   100.0     0/0   0.0
Draymond Simons        29    0    0    1   0   0/0     0.0     0/0   0.0
Tony James             19    0    0    3   0   0/0     0.0     0/0   0.0

TEAM: FG: 14/21 (66.7%), 3PT: 4/8 (50.0%), REB: 14 (1 off, 13 def), AST: 7, TO: 3
TEAM FOULS: 8 [Team_008 in BONUS]


Team_008
--------------------------------------------------------------------------------
Player                MIN  PTS  REB  AST  TO      FG   FG%      3P   3P%
--------------------------------------------------------------------------------
Blake Holiday          19    8    0    1   0   3/3   100.0     0/0   0.0
Chris Griffin          19    5    5    1   0   2/4    50.0     0/0   0.0
Lamelo Middleton       19    5    1    0   0   2/3    66.7     0/0   0.0
Khris Giddey           19    3    0    3   0   2/7    28.6     0/0   0.0
Victor Leonard         29    2    0    0   0   1/1   100.0     0/0   0.0
Immanuel Young         19    2    0    1   0   1/4    25.0     0/0   0.0
Tyrese Thompson        29    0    1    0   0   0/1     0.0     0/0   0.0
Magic Young            29    0    1    0   0   0/0     0.0     0/0   0.0
Jrue Harris            29    0    0    0   0   0/1     0.0     0/0   0.0

TEAM: FG: 11/24 (45.8%), 3PT: 3/7 (42.9%), REB: 8 (1 off, 7 def), AST: 6, TO: 0
TEAM FOULS: 5 [Team_080 in BONUS]

================================================================================

================================================================================
                               FULL GAME COMPLETE                               
================================================================================

FINAL SCORE: Team_080 117, Team_008 100

SCORING BY QUARTER:
--------------------------------------------------------------------------------
Team                     Q1     Q2     Q3     Q4    FINAL
--------------------------------------------------------------------------------
Team_080                 26     34     24     33      117
Team_008                 18     31     24     27      100
--------------------------------------------------------------------------------

FULL GAME BOX SCORE:
================================================================================

Team_080
--------------------------------------------------------------------------------
Player                MIN  PTS  REB  AST  TO      FG   FG%      3P   3P%      FT STL BLK
--------------------------------------------------------------------------------
Larry Paul             39   22   13    2   1  10/14   71.4   2/3    66.7   4/5     1   1
Lauri Dosunmu          29   12    0    3   4   5/10   50.0   2/3    66.7   2/3     0   0
Khris Turner           29   12    0    2   2   5/10   50.0   1/2    50.0   1/1     1   1
Jaren Morant           29   11    8    2   2   5/10   50.0   1/3    33.3   2/2     0   1
Draymond Simons        29    9   11    5   1   4/5    80.0   0/0     0.0   1/1     0   0
Tony James             19    3    0    5   1   2/2   100.0   1/1   100.0   1/1     0   0
Larry Reaves           19   20    8    0   2   6/7    85.7   4/5    80.0   4/6     0   0
Ja Cunningham          19   10    6    0   1   3/7    42.9   1/3    33.3   3/3     0   0
Trae Brogdon           19   11    2    2   0   5/6    83.3   0/0     0.0   4/4     0   0
Joel Bryant             9    5    0    1   0   2/4    50.0   1/2    50.0   0/0     0   0

TEAM: FG: 48/76 (63.2%), 3PT: 13/22 (59.1%), REB: 47 (8 off, 39 def), AST: 22, TO: 14


Team_008
--------------------------------------------------------------------------------
Player                MIN  PTS  REB  AST  TO      FG   FG%      3P   3P%      FT STL BLK
--------------------------------------------------------------------------------
Victor Leonard         29   13    0    1   0   8/13   61.5   1/5    20.0   3/4     1   0
Jrue Harris            29   10    0    2   1   5/10   50.0   0/2     0.0   4/5     0   1
Khris Hyland           29   11    4    2   1   4/11   36.4   0/2     0.0   3/3     1   0
Tyrese Thompson        29    5   12    1   0   3/9    33.3   0/1     0.0   1/2     2   1
Magic Young            29    6    6    4   1   2/4    50.0   0/0     0.0   2/2     0   0
Blake Holiday          19   16    0    1   1   7/8    87.5   4/5    80.0   0/0     0   0
Chris Griffin          19   13    7    1   0   6/9    66.7   2/3    66.7   3/3     0   0
Immanuel Young         19    5    0    3   0   2/6    33.3   0/1     0.0   1/1     0   0
Khris Giddey           19    5    2    5   0   4/11   36.4   1/4    25.0   3/4     0   0
Lamelo Middleton       19   13    4    0   0   3/4    75.0   1/1   100.0   3/5     0   1

TEAM: FG: 45/86 (52.3%), 3PT: 9/24 (37.5%), REB: 36 (9 off, 27 def), AST: 20, TO: 4

================================================================================
