================================================================================
                        FULL GAME - Team_051 vs Team_020                        
================================================================================

================================================================================
                       1ST QUARTER - Team_051 vs Team_020                       
================================================================================

[12:00] Team_051 possession (Score: 0-0)
Larry McGrady attempts a 3Pt. Contested by James Cunningham (5.3 feet, MAN). Larry McGrady misses. Rebound secured by Terry Simons.

[11:48] Team_020 possession (Score: 0-0)
Bam Leonard attempts a 3Pt. Contested by Franz Simmons (4.5 feet, MAN). Bam Leonard misses. Offensive rebound by Trae Curry! Trae Curry's putback is no good. Rebound secured by OG Siakam.

[11:35] Team_051 possession (Score: 0-0)
OG Siakam attempts a 3Pt. Contested by Bam Leonard (2.6 feet, ZONE). OG Siakam misses. FOUL! Loose ball foul on Bam Leonard during the rebound battle. [Team fouls: 1] No free throws, side out. (Bam Leonard: 1 personal fouls)

[11:17] Team_051 possession (Score: 0-0)
Larry McGrady attempts a 3Pt. Contested by James Cunningham (5.3 feet, MAN). Larry McGrady misses. Rebound secured by Trae Curry.

[11:04] Team_020 possession (Score: 0-0)
FOUL! Holding foul on OG Siakam. [Team fouls: 1] No free throws, side out. (OG Siakam: 1 personal fouls)

[10:50] Team_020 possession (Score: 0-0)
Jarrett McCollum drives and kicks out. James Cunningham attempts a 3Pt. Contested by Larry McGrady (4.4 feet, MAN). James Cunningham misses. Offensive rebound by Trae Curry! Trae Curry's putback is no good. Offensive rebound by Bam Leonard! Bam Leonard kicks it out.

[10:37] Team_020 possession (Score: 0-0)
Terry Simons attempts a Midrange. Contested by Franz Simmons (4.8 feet, ZONE). Terry Simons misses. Rebound secured by Shaquille Harden.

[10:21] Team_051 possession (Score: 0-0)
Austin Sexton makes the 3Pt and draws the foul on Bam Leonard! And-1! Austin Sexton to the line for 1. [Team fouls: 2] (Bam Leonard: 2 personal fouls)   FT 1/1: MISS Austin Sexton makes 0/1 from the line. Rebound secured by Bam Leonard.
Score: 3-0

[10:07] Team_020 possession (Score: 3-0)
Terry Simons drives to the basket... Terry Simons loses the ball! Stripped by OG Siakam! TURNOVER! (live ball)

[09:52] Team_051 possession (Score: 3-0)
Larry McGrady drives, James Cunningham stays with him. Larry McGrady attempts a Layup. Contested by James Cunningham (5.3 feet, MAN). Larry McGrady misses. Rebound secured by Bam Leonard.

[09:39] Team_020 possession (Score: 3-0)
Trae Curry drives, Franz Simmons stays with him. Trae Curry attempts a Layup. Contested by Franz Simmons (4.6 feet, ZONE). TRAE CURRY MAKES IT! Assist: James Cunningham
Score: 3-2

[09:26] Team_051 possession (Score: 3-2)
Shaquille Harden attempts a Midrange. Contested by Bam Leonard (2.2 feet, ZONE). Shaquille Harden misses. Offensive rebound by Franz Simmons! Franz Simmons kicks it out.

[09:14] Team_051 possession (Score: 3-2)
FOUL! Shooting foul on Bam Leonard. Shaquille Harden to the line for 2 free throws. [Team fouls: 3] (Bam Leonard: 3 personal fouls)   FT 1/2: GOOD   FT 2/2: GOOD Shaquille Harden makes 2/2 from the line.
Score: 5-2

[08:56] Team_020 possession (Score: 5-2)
FOUL! Shooting foul on Franz Simmons. Bam Leonard to the line for 2 free throws. [Team fouls: 2] (Franz Simmons: 1 personal fouls)   FT 1/2: GOOD   FT 2/2: GOOD Bam Leonard makes 2/2 from the line.
Score: 5-4

[08:39] Team_051 possession (Score: 5-4)
Larry McGrady attempts a Layup. BLOCKED BY JARRETT MCCOLLUM! Ball goes out off Jarrett McCollum. Larry McGrady's ball!

[08:24] Team_051 possession (Score: 5-4)
FOUL! Reach-in foul on Trae Curry during the drive. [Team fouls: 4] No free throws, side out. (Trae Curry: 1 personal fouls)

[08:13] Team_051 possession (Score: 5-4)
Austin Sexton throws a bad pass! Stolen by Jarrett McCollum! TURNOVER! (live ball)

[08:00] Team_020 possession (Score: 5-4)
James Cunningham attempts a 3Pt. Contested by Austin Sexton (4.7 feet, ZONE). JAMES CUNNINGHAM MAKES IT! Assist: Jarrett McCollum
Score: 5-7

[07:41] Team_051 possession (Score: 5-7)
Shaquille Harden attempts a 3Pt. Contested by Bam Leonard (2.2 feet, MAN). Shaquille Harden misses. Offensive rebound by Shaquille Harden! Shaquille Harden puts it back in!
Score: 7-7

[07:24] Team_020 possession (Score: 7-7)
Bam Leonard attempts a 3Pt. Contested by Larry McGrady (4.8 feet, ZONE). Bam Leonard misses. Rebound secured by Shaquille Harden.

[07:09] Team_051 possession (Score: 7-7)
FOUL! Reach-in foul on Bam Leonard during the drive. [IN THE BONUS! 5 team fouls] Franz Simmons to the line for 2 free throws. (Bam Leonard: 4 personal fouls)   FT 1/2: GOOD   FT 2/2: MISS Franz Simmons makes 1/2 from the line. Rebound secured by Trae Curry.
Score: 8-7

[06:57] Team_020 possession (Score: 8-7)
Trae Curry drives, picks up Shaquille Harden. Help arrives from Larry McGrady! Trae Curry attempts a Layup. Contested by Larry McGrady (4.6 feet, MAN). TRAE CURRY MAKES IT! Assist: Bam Leonard
Score: 8-9

[06:41] Team_051 possession (Score: 8-9)
Austin Sexton attempts a 3Pt. Contested by James Cunningham (5.0 feet, ZONE). AUSTIN SEXTON MAKES IT! Assist: Franz Simmons
Score: 11-9

[06:27] Team_020 possession (Score: 11-9)
Trae Curry attempts a 3Pt. Contested by Larry McGrady (4.9 feet, ZONE). Trae Curry misses. Rebound secured by Franz Simmons.

[06:11] Team_051 possession (Score: 11-9)
FOUL! Shooting foul on Jarrett McCollum. Austin Sexton to the line for 2 free throws. [BONUS: 6 team fouls] (Jarrett McCollum: 1 personal fouls)   FT 1/2: GOOD   FT 2/2: GOOD Austin Sexton makes 2/2 from the line.
Score: 13-9

[05:57] Team_020 possession (Score: 13-9)
Bam Leonard attempts a Midrange. Contested by Franz Simmons (4.5 feet, MAN). BAM LEONARD MAKES IT! Assist: James Cunningham
Score: 13-11

[05:41] Team_051 possession (Score: 13-11)
FOUL! Holding foul on James Cunningham. [IN THE BONUS! 7 team fouls] Larry McGrady to the line for 2 free throws. (James Cunningham: 1 personal fouls)   FT 1/2: GOOD   FT 2/2: MISS Larry McGrady makes 1/2 from the line. FOUL! Loose ball foul on Bam Leonard during the free throw rebound! [IN THE BONUS! 8 team fouls] Shaquille Harden to the line for 2 free throws. (Bam Leonard: 5 personal fouls)   FT 1/2: MISS   FT 2/2: GOOD Shaquille Harden makes 1/2 from the line.
Score: 15-11

[05:26] Team_020 possession (Score: 15-11)
Bam Leonard attempts a Midrange. Contested by Franz Simmons (4.5 feet, MAN). Bam Leonard misses. Rebound secured by Shaquille Harden.

[05:11] Team_051 possession (Score: 15-11)
Shaquille Harden drives to the basket... Shaquille Harden loses the ball! Stripped by Bam Leonard! TURNOVER! (live ball)

[04:56] Team_020 possession (Score: 15-11)
Bam Leonard attempts a 3Pt. Contested by Austin Sexton (4.7 feet, ZONE). Bam Leonard misses. Rebound secured by Franz Simmons.

[04:42] Team_051 possession (Score: 15-11)
FOUL! Offensive foul on Larry McGrady! James Cunningham drew the charge! [Team fouls: 3] (Larry McGrady: 1 personal fouls) TURNOVER! (dead ball)

[04:30] Team_020 possession (Score: 15-11)
Bam Leonard attempts a Midrange. Contested by Franz Simmons (4.5 feet, MAN). Bam Leonard misses. Offensive rebound by Trae Curry! Trae Curry's putback is no good. Rebound secured by Franz Simmons.

[04:12] Team_051 possession (Score: 15-11)
Austin Sexton attempts a Layup. Contested by Trae Curry (4.7 feet, ZONE). AUSTIN SEXTON MAKES IT!
Score: 17-11

[03:58] Team_020 possession (Score: 17-11)
Bam Leonard attempts a 3Pt. Contested by Franz Simmons (4.6 feet, MAN). Bam Leonard misses. Rebound secured by OG Siakam.

[03:48] Team_051 possession (Score: 17-11)
Franz Simmons drives to the basket... Franz Simmons commits a violation (traveling/carry)! TURNOVER! (dead ball)

[03:32] Team_020 possession (Score: 17-11)
Jarrett McCollum attempts a 3Pt. Contested by Austin Sexton (4.6 feet, MAN). JARRETT MCCOLLUM MAKES IT! Assist: Bam Leonard
Score: 17-14

[03:20] Team_051 possession (Score: 17-14)
FOUL! Reach-in foul on Jarrett McCollum during the drive. [IN THE BONUS! 9 team fouls] Austin Sexton to the line for 2 free throws. (Jarrett McCollum: 2 personal fouls)   FT 1/2: MISS   FT 2/2: GOOD Austin Sexton makes 1/2 from the line.
Score: 18-14

[03:05] Team_020 possession (Score: 18-14)
FOUL! Reach-in foul on Franz Simmons during the drive. [Team fouls: 4] No free throws, side out. (Franz Simmons: 2 personal fouls)

[02:51] Team_020 possession (Score: 18-14)
James Cunningham attempts a Layup. Contested by Franz Simmons (4.7 feet, ZONE). James Cunningham misses. Rebound secured by Shaquille Harden.

[02:37] Team_051 possession (Score: 18-14)
Larry McGrady drives, James Cunningham stays with him. Larry McGrady attempts a Dunk. Contested by James Cunningham (5.4 feet, MAN). LARRY MCGRADY MAKES IT! Assist: Austin Sexton
Score: 20-14

[02:25] Team_020 possession (Score: 20-14)
Terry Simons drives and kicks out. Bam Leonard attempts a 3Pt. Contested by Austin Sexton (4.6 feet, ZONE). Bam Leonard misses. Rebound secured by Shaquille Harden.

[02:12] Team_051 possession (Score: 20-14)
Austin Sexton attempts a Midrange. BLOCKED BY BAM LEONARD! Ball is loose! Rebound secured by Trae Curry.

[02:00] Team_020 possession (Score: 20-14)
James Cunningham loses control! Ball rolls out of bounds! TURNOVER! (dead ball)

[02:00] Substitution (Team_051): Austin Sexton OUT → Myles Harden IN (stamina_rule2)

[02:00] Substitution (Team_051): Larry McGrady OUT → Zion Morant IN (stamina_rule2)

[02:00] Substitution (Team_051): OG Siakam OUT → Jrue Carter IN (stamina_rule2)

[02:00] Substitution (Team_051): Franz Simmons OUT → Tobias Jokic IN (stamina_rule2)

[02:00] Substitution (Team_051): Shaquille Harden OUT → Pau Tatum IN (stamina_rule2)

[02:00] Substitution (Team_020): Jarrett McCollum OUT → Franz Doncic IN (stamina_rule2)

[02:00] Substitution (Team_020): James Cunningham OUT → Stephen Parker IN (stamina_rule2)

[02:00] Substitution (Team_020): Terry Simons OUT → Victor Holiday IN (stamina_rule2)

[02:00] Substitution (Team_020): Bam Leonard OUT → Cole Barnes IN (stamina_rule2)

[02:00] Substitution (Team_020): Trae Curry OUT → Miles Siakam IN (stamina_rule2)

[01:43] Team_051 possession (Score: 20-14)
FOUL! Holding foul on Miles Siakam. [IN THE BONUS! 10 team fouls] Pau Tatum to the line for 2 free throws. (Miles Siakam: 1 personal fouls)   FT 1/2: MISS   FT 2/2: GOOD Pau Tatum makes 1/2 from the line.
Score: 21-14

[01:31] Team_020 possession (Score: 21-14)
Miles Siakam attempts a Layup. Contested by Pau Tatum (4.5 feet, MAN). Miles Siakam misses. Rebound secured by Tobias Jokic.

[01:17] Team_051 possession (Score: 21-14)
FOUL! Shooting foul on Victor Holiday. Pau Tatum to the line for 2 free throws. [BONUS: 11 team fouls] (Victor Holiday: 1 personal fouls)   FT 1/2: GOOD   FT 2/2: MISS Pau Tatum makes 1/2 from the line. Rebound secured by Victor Holiday.
Score: 22-14

[01:01] Team_020 possession (Score: 22-14)
Stephen Parker makes the Layup and draws the foul on Pau Tatum! And-1! Stephen Parker to the line for 1. [BONUS: 5 team fouls] (Pau Tatum: 1 personal fouls)   FT 1/1: GOOD Stephen Parker makes 1/1 from the line.
Score: 22-17

[00:44] Team_051 possession (Score: 22-17)
Jrue Carter makes the Dunk and draws the foul on Miles Siakam! And-1! Jrue Carter to the line for 1. [BONUS: 12 team fouls] (Miles Siakam: 2 personal fouls)   FT 1/1: GOOD Jrue Carter makes 1/1 from the line.
Score: 25-17

[00:34] Team_020 possession (Score: 25-17)
FOUL! Reach-in foul on Pau Tatum during the drive. [IN THE BONUS! 6 team fouls] Stephen Parker to the line for 2 free throws. (Pau Tatum: 2 personal fouls)   FT 1/2: GOOD   FT 2/2: MISS Stephen Parker makes 1/2 from the line. Rebound secured by Pau Tatum.
Score: 25-18

[00:18] Team_051 possession (Score: 25-18)
Pau Tatum attempts a Dunk. BLOCKED BY MILES SIAKAM! Ball is loose! Rebound secured by Victor Holiday.

================================================================================
                              1ST QUARTER COMPLETE                              
================================================================================

1ST QUARTER SCORE: Team_051 25, Team_020 18

BOX SCORE:
================================================================================

Team_051
--------------------------------------------------------------------------------
Player                MIN  PTS  REB  AST  TO      FG   FG%      3P   3P%
--------------------------------------------------------------------------------
Austin Sexton          10    8    0    1   0   4/6    66.7     0/0   0.0
Shaquille Harden       10    6    6    0   0   3/3   100.0     0/0   0.0
Jrue Carter             2    3    0    0   0   1/1   100.0     0/0   0.0
Larry McGrady          10    2    0    0   0   1/4    25.0     0/0   0.0
Pau Tatum               2    1    1    0   0   1/3    33.3     0/0   0.0
OG Siakam              10    0    2    0   0   0/0     0.0     0/0   0.0
Tobias Jokic            2    0    1    0   0   0/0     0.0     0/0   0.0

TEAM: FG: 10/18 (55.6%), 3PT: 2/5 (40.0%), REB: 13 (3 off, 10 def), AST: 2, TO: 4
TEAM FOULS: 6 [Team_020 in BONUS]


Team_020
--------------------------------------------------------------------------------
Player                MIN  PTS  REB  AST  TO      FG   FG%      3P   3P%
--------------------------------------------------------------------------------
Bam Leonard            10    4    3    2   0   2/8    25.0     0/0   0.0
Trae Curry             10    4    3    0   0   2/3    66.7     0/0   0.0
James Cunningham       10    3    0    2   0   1/2    50.0     0/0   0.0
Jarrett McCollum       10    3    0    1   0   1/1   100.0     0/0   0.0
Stephen Parker          2    3    0    0   0   1/2    50.0     0/0   0.0
Terry Simons           10    0    1    0   0   0/2     0.0     0/0   0.0
Franz Simmons          10    0    5    1   0   0/1     0.0     0/0   0.0
Miles Siakam            2    0    0    0   0   0/1     0.0     0/0   0.0
Victor Holiday          2    0    2    0   0   0/0     0.0     0/0   0.0

TEAM: FG: 7/19 (36.8%), 3PT: 2/7 (28.6%), REB: 11 (3 off, 8 def), AST: 5, TO: 2
TEAM FOULS: 12 [Team_051 in BONUS]

================================================================================

================================================================================
                       2ND QUARTER - Team_051 vs Team_020                       
================================================================================

[12:00] Team_051 possession (Score: 25-18)
Franz Simmons drives, Bam Leonard stays with him. Franz Simmons attempts a Dunk. Contested by Bam Leonard (2.9 feet, MAN). Franz Simmons misses. Rebound secured by Trae Curry.

[11:47] Team_020 possession (Score: 25-18)
Jarrett McCollum attempts a 3Pt. Contested by Austin Sexton (4.5 feet, ZONE). Jarrett McCollum misses. Rebound secured by Shaquille Harden.

[11:30] Team_051 possession (Score: 25-18)
OG Siakam attempts a 3Pt. Contested by Terry Simons (4.6 feet, MAN). OG Siakam misses. Rebound secured by Trae Curry.

[11:12] Team_020 possession (Score: 25-18)
FOUL! Reach-in foul on Shaquille Harden during the drive. [Team fouls: 1] No free throws, side out. (Shaquille Harden: 1 personal fouls)

[10:58] Team_020 possession (Score: 25-18)
Trae Curry makes the Layup and draws the foul on Franz Simmons! And-1! Trae Curry to the line for 1. [Team fouls: 2] (Franz Simmons: 1 personal fouls)   FT 1/1: GOOD Trae Curry makes 1/1 from the line.
Score: 25-21

[10:41] Team_051 possession (Score: 25-21)
Larry McGrady makes the Layup and draws the foul on James Cunningham! And-1! Larry McGrady to the line for 1. [Team fouls: 1] (James Cunningham: 1 personal fouls)   FT 1/1: MISS Larry McGrady makes 0/1 from the line. Rebound secured by Trae Curry.
Score: 27-21

[10:27] Team_020 possession (Score: 27-21)
James Cunningham attempts a 3Pt. Contested by Austin Sexton (4.8 feet, ZONE). James Cunningham misses. Offensive rebound by Bam Leonard! Bam Leonard puts it back in!
Score: 27-23

[10:11] Team_051 possession (Score: 27-23)
OG Siakam attempts a 3Pt. Contested by Bam Leonard (2.9 feet, ZONE). OG Siakam misses. Rebound secured by Bam Leonard.

[09:58] Team_020 possession (Score: 27-23)
Jarrett McCollum drives to the basket... FOUL! Offensive foul on Jarrett McCollum! Franz Simmons drew the charge! [Team fouls: 2] (Jarrett McCollum: 1 personal fouls) TURNOVER! (dead ball)

[09:43] Team_051 possession (Score: 27-23)
OG Siakam attempts a 3Pt. Contested by Bam Leonard (2.9 feet, ZONE). OG Siakam misses. Rebound secured by Terry Simons.

[09:28] Team_020 possession (Score: 27-23)
Trae Curry drives and kicks out. James Cunningham attempts a 3Pt. Contested by Larry McGrady (4.8 feet, MAN). James Cunningham misses. Rebound secured by OG Siakam.

[09:17] Team_051 possession (Score: 27-23)
Franz Simmons drives to the basket... Franz Simmons throws a bad pass! Stolen by Bam Leonard! TURNOVER! (live ball)

[09:01] Team_020 possession (Score: 27-23)
Bam Leonard attempts a 3Pt. Contested by Franz Simmons (4.7 feet, MAN). BAM LEONARD MAKES IT! Assist: Jarrett McCollum
Score: 27-26

[08:44] Team_051 possession (Score: 27-26)
Franz Simmons attempts a Midrange. Contested by Bam Leonard (3.3 feet, ZONE). FRANZ SIMMONS MAKES IT!
Score: 29-26

[08:30] Team_020 possession (Score: 29-26)
Jarrett McCollum attempts a 3Pt. Contested by Austin Sexton (4.8 feet, MAN). Jarrett McCollum misses. FOUL! Loose ball foul on Franz Simmons during the rebound battle. [Team fouls: 3] No free throws, side out. (Franz Simmons: 2 personal fouls)

[08:14] Team_020 possession (Score: 29-26)
Trae Curry attempts a Midrange. Contested by Shaquille Harden (4.9 feet, MAN). Trae Curry misses. Rebound secured by Franz Simmons.

[08:00] Team_051 possession (Score: 29-26)
Shaquille Harden drives and kicks out. Shaquille Harden attempts a 3Pt. Contested by Bam Leonard (3.0 feet, ZONE). Shaquille Harden misses. Rebound secured by Bam Leonard.

[07:43] Team_020 possession (Score: 29-26)
Terry Simons attempts a Midrange. Contested by OG Siakam (5.0 feet, MAN). Terry Simons misses. Rebound secured by Franz Simmons.

[07:30] Team_051 possession (Score: 29-26)
Franz Simmons drives to the basket... Franz Simmons throws a bad pass! Stolen by Trae Curry! TURNOVER! (live ball)

[07:18] Team_020 possession (Score: 29-26)
Terry Simons attempts a Layup. Contested by OG Siakam (5.0 feet, MAN). TERRY SIMONS MAKES IT! Assist: Jarrett McCollum
Score: 29-28

[07:03] Team_051 possession (Score: 29-28)
Austin Sexton attempts a Layup. BLOCKED BY JARRETT MCCOLLUM! Ball is loose! Rebound secured by Trae Curry.

[06:51] Team_020 possession (Score: 29-28)
Trae Curry attempts a Midrange. Contested by Shaquille Harden (5.1 feet, MAN). Trae Curry misses. Rebound secured by OG Siakam.

[06:35] Team_051 possession (Score: 29-28)
Austin Sexton makes the 3Pt and draws the foul on James Cunningham! And-1! Austin Sexton to the line for 1. [Team fouls: 3] (James Cunningham: 2 personal fouls)   FT 1/1: GOOD Austin Sexton makes 1/1 from the line.
Score: 33-28

[06:22] Team_020 possession (Score: 33-28)
Bam Leonard attempts a Midrange. Contested by Franz Simmons (5.0 feet, MAN). Bam Leonard misses. Offensive rebound by Bam Leonard! Bam Leonard puts it back in!
Score: 33-30

[06:05] Team_051 possession (Score: 33-30)
FOUL! Reach-in foul on Trae Curry during the drive. [Team fouls: 4] No free throws, side out. (Trae Curry: 1 personal fouls)

[05:51] Team_051 possession (Score: 33-30)
Austin Sexton drives, picks up Jarrett McCollum. Help arrives from Terry Simons! Austin Sexton attempts a Dunk. Contested by Terry Simons (5.1 feet, MAN). Austin Sexton misses. Rebound secured by Bam Leonard.

[05:36] Team_020 possession (Score: 33-30)
Jarrett McCollum attempts a 3Pt. Contested by Austin Sexton (5.1 feet, MAN). Jarrett McCollum misses. Rebound secured by Franz Simmons.

[05:22] Team_051 possession (Score: 33-30)
Austin Sexton attempts a Layup. Contested by Trae Curry (5.5 feet, ZONE). AUSTIN SEXTON MAKES IT! Assist: Larry McGrady
Score: 35-30

[05:10] Team_020 possession (Score: 35-30)
James Cunningham attempts a Midrange. Contested by Larry McGrady (5.5 feet, MAN). James Cunningham misses. Offensive rebound by Trae Curry! Trae Curry kicks it out.

[04:58] Team_020 possession (Score: 35-30)
FOUL! Reach-in foul on Franz Simmons during the drive. [Team fouls: 4] No free throws, side out. (Franz Simmons: 3 personal fouls)

[04:45] Team_020 possession (Score: 35-30)
Jarrett McCollum attempts a 3Pt. Contested by Austin Sexton (5.2 feet, MAN). Jarrett McCollum misses. Rebound secured by Franz Simmons.

[04:33] Team_051 possession (Score: 35-30)
Larry McGrady attempts a 3Pt. Contested by Bam Leonard (3.8 feet, ZONE). LARRY MCGRADY MAKES IT! Assist: Franz Simmons
Score: 38-30

[04:18] Team_020 possession (Score: 38-30)
Trae Curry attempts a 3Pt. Contested by Franz Simmons (5.3 feet, ZONE). TRAE CURRY MAKES IT!
Score: 38-33

[04:06] Team_051 possession (Score: 38-33)
Austin Sexton makes the 3Pt and draws the foul on Jarrett McCollum! And-1! Austin Sexton to the line for 1. [BONUS: 5 team fouls] (Jarrett McCollum: 2 personal fouls)   FT 1/1: GOOD Austin Sexton makes 1/1 from the line.
Score: 42-33

[03:53] Team_020 possession (Score: 42-33)
FOUL! Reach-in foul on Franz Simmons during the drive. [IN THE BONUS! 5 team fouls] Trae Curry to the line for 2 free throws. (Franz Simmons: 4 personal fouls)   FT 1/2: GOOD   FT 2/2: GOOD Trae Curry makes 2/2 from the line.
Score: 42-35

[03:42] Team_051 possession (Score: 42-35)
Franz Simmons attempts a 3Pt. Contested by Bam Leonard (4.2 feet, MAN). Franz Simmons misses. Rebound secured by Terry Simons.

[03:25] Team_020 possession (Score: 42-35)
Terry Simons attempts a Layup. Contested by Franz Simmons (5.7 feet, ZONE). TERRY SIMONS MAKES IT!
Score: 42-37

[03:07] Team_051 possession (Score: 42-37)
Shaquille Harden drives, Bam Leonard stays with him. Shaquille Harden attempts a Layup. Contested by Bam Leonard (3.8 feet, MAN). SHAQUILLE HARDEN MAKES IT! Assist: Franz Simmons
Score: 44-37

[02:54] Team_020 possession (Score: 44-37)
Bam Leonard attempts a Midrange. Contested by Larry McGrady (5.8 feet, ZONE). Bam Leonard misses. Rebound secured by Franz Simmons.

[02:38] Team_051 possession (Score: 44-37)
Larry McGrady attempts a Midrange. Wide open! James Cunningham is 6.2 feet away. [ZONE] LARRY MCGRADY MAKES IT!
Score: 46-37

[02:24] Team_020 possession (Score: 46-37)
Bam Leonard attempts a 3Pt. Contested by Austin Sexton (5.6 feet, ZONE). BAM LEONARD MAKES IT! Assist: James Cunningham
Score: 46-40

[02:11] Team_051 possession (Score: 46-40)
FOUL! Shooting foul on Terry Simons. OG Siakam to the line for 2 free throws. [BONUS: 6 team fouls] (Terry Simons: 1 personal fouls)   FT 1/2: GOOD   FT 2/2: GOOD OG Siakam makes 2/2 from the line.
Score: 48-40

[02:00] Team_020 possession (Score: 48-40)
Trae Curry attempts a Layup. Contested by Franz Simmons (5.6 feet, ZONE). TRAE CURRY MAKES IT! Assist: James Cunningham
Score: 48-42

[01:47] Team_051 possession (Score: 48-42)
OG Siakam attempts a 3Pt. Contested by Bam Leonard (4.3 feet, ZONE). OG Siakam misses. Rebound secured by Bam Leonard.

[01:35] Team_020 possession (Score: 48-42)
Bam Leonard loses control! Ball rolls out of bounds! TURNOVER! (dead ball)

[01:35] Substitution (Team_051): Austin Sexton OUT → Myles Harden IN (stamina_rule2)

[01:35] Substitution (Team_051): Larry McGrady OUT → Zion Morant IN (stamina_rule2)

[01:35] Substitution (Team_051): OG Siakam OUT → Jrue Carter IN (stamina_rule2)

[01:35] Substitution (Team_051): Franz Simmons OUT → Tobias Jokic IN (stamina_rule2)

[01:35] Substitution (Team_051): Shaquille Harden OUT → Pau Tatum IN (stamina_rule2)

[01:35] Substitution (Team_020): Jarrett McCollum OUT → Franz Doncic IN (stamina_rule2)

[01:35] Substitution (Team_020): James Cunningham OUT → Stephen Parker IN (stamina_rule2)

[01:35] Substitution (Team_020): Terry Simons OUT → Victor Holiday IN (stamina_rule2)

[01:35] Substitution (Team_020): Bam Leonard OUT → Cole Barnes IN (stamina_rule2)

[01:35] Substitution (Team_020): Trae Curry OUT → Miles Siakam IN (stamina_rule2)

[01:24] Team_051 possession (Score: 48-42)
Jrue Carter loses the ball! Stripped by Victor Holiday! TURNOVER! (live ball)

[01:09] Team_020 possession (Score: 48-42)
Cole Barnes attempts a Midrange. Contested by Tobias Jokic (5.3 feet, MAN). Cole Barnes misses. Rebound secured by Myles Harden.

[00:56] Team_051 possession (Score: 48-42)
Myles Harden loses control! Ball rolls out of bounds! TURNOVER! (dead ball)

[00:40] Team_020 possession (Score: 48-42)
Cole Barnes drives, Pau Tatum stays with him. Cole Barnes attempts a Layup. Contested by Pau Tatum (4.4 feet, ZONE). COLE BARNES MAKES IT! Assist: Stephen Parker
Score: 48-44

[00:27] Team_051 possession (Score: 48-44)
Pau Tatum drives, Miles Siakam stays with him. Pau Tatum attempts a Dunk. Contested by Miles Siakam (3.8 feet, MAN). PAU TATUM MAKES IT!
Score: 50-44

[00:17] Team_020 possession (Score: 50-44)
Miles Siakam makes the Layup and draws the foul on Pau Tatum! And-1! Miles Siakam to the line for 1. [BONUS: 6 team fouls] (Pau Tatum: 1 personal fouls)   FT 1/1: GOOD Miles Siakam makes 1/1 from the line.
Score: 50-47

================================================================================
                              2ND QUARTER COMPLETE                              
================================================================================

2ND QUARTER SCORE: Team_051 25, Team_020 29

BOX SCORE:
================================================================================

Team_051
--------------------------------------------------------------------------------
Player                MIN  PTS  REB  AST  TO      FG   FG%      3P   3P%
--------------------------------------------------------------------------------
Austin Sexton          21   10    0    0   0   3/5    60.0     0/0   0.0
Larry McGrady          21    5    0    1   0   2/3    66.7     0/0   0.0
Franz Simmons          21    2    5    2   0   1/3    33.3     0/0   0.0
Shaquille Harden       21    2    1    0   0   1/2    50.0     0/0   0.0
OG Siakam              21    2    2    0   0   1/5    20.0     0/0   0.0
Pau Tatum               3    2    0    0   0   1/1   100.0     0/0   0.0
Myles Harden            3    0    1    0   0   0/0     0.0     0/0   0.0

TEAM: FG: 9/19 (47.4%), 3PT: 3/8 (37.5%), REB: 9 (0 off, 9 def), AST: 3, TO: 4
TEAM FOULS: 6 [Team_020 in BONUS]


Team_020
--------------------------------------------------------------------------------
Player                MIN  PTS  REB  AST  TO      FG   FG%      3P   3P%
--------------------------------------------------------------------------------
Trae Curry             21   10    6    0   0   4/7    57.1     0/0   0.0
Bam Leonard            21   10    6    0   0   4/5    80.0     0/0   0.0
Terry Simons           21    4    2    0   0   2/3    66.7     0/0   0.0
Miles Siakam            3    3    0    0   0   1/1   100.0     0/0   0.0
Cole Barnes             3    2    0    0   0   1/2    50.0     0/0   0.0
Jarrett McCollum       21    0    0    2   0   0/3     0.0     0/0   0.0
James Cunningham       21    0    0    2   0   0/0     0.0     0/0   0.0
Stephen Parker          3    0    0    1   0   0/0     0.0     0/0   0.0

TEAM: FG: 12/21 (57.1%), 3PT: 4/7 (57.1%), REB: 14 (4 off, 10 def), AST: 5, TO: 2
TEAM FOULS: 6 [Team_051 in BONUS]

================================================================================

================================================================================
                       3RD QUARTER - Team_051 vs Team_020                       
================================================================================

[12:00] Team_051 possession (Score: 50-47)
Austin Sexton attempts a Midrange. Contested by Bam Leonard (2.3 feet, ZONE). Austin Sexton misses. Rebound secured by Terry Simons.

[11:48] Team_020 possession (Score: 50-47)
FOUL! Reach-in foul on Franz Simmons during the drive. [Team fouls: 1] No free throws, side out. (Franz Simmons: 1 personal fouls)

[11:35] Team_020 possession (Score: 50-47)
Bam Leonard drives, Franz Simmons stays with him. Bam Leonard attempts a Layup. Contested by Franz Simmons (4.5 feet, MAN). BAM LEONARD MAKES IT!
Score: 50-49

[11:22] Team_051 possession (Score: 50-49)
Franz Simmons attempts a Midrange. Contested by Terry Simons (4.7 feet, ZONE). FRANZ SIMMONS MAKES IT! Assist: OG Siakam
Score: 52-49

[11:09] Team_020 possession (Score: 52-49)
Terry Simons attempts a Midrange. BLOCKED BY OG SIAKAM! Ball is loose! Rebound secured by Franz Simmons.

[10:54] Team_051 possession (Score: 52-49)
Larry McGrady attempts a Midrange. Contested by Terry Simons (4.5 feet, ZONE). LARRY MCGRADY MAKES IT!
Score: 54-49

[10:42] Team_020 possession (Score: 54-49)
Jarrett McCollum attempts a Midrange. Contested by Austin Sexton (4.5 feet, MAN). Jarrett McCollum misses. Rebound secured by OG Siakam.

[10:26] Team_051 possession (Score: 54-49)
Austin Sexton attempts a 3Pt. Contested by James Cunningham (5.0 feet, ZONE). Austin Sexton misses. Offensive rebound by Franz Simmons! Franz Simmons kicks it out.

[10:11] Team_051 possession (Score: 54-49)
Austin Sexton attempts a 3Pt. Contested by Bam Leonard (2.3 feet, ZONE). Austin Sexton misses. Rebound secured by Trae Curry.

[09:56] Team_020 possession (Score: 54-49)
Jarrett McCollum attempts a Layup. Contested by Franz Simmons (4.3 feet, ZONE). JARRETT MCCOLLUM MAKES IT! Assist: Bam Leonard
Score: 54-51

[09:44] Team_051 possession (Score: 54-51)
FOUL! Reach-in foul on Trae Curry during the drive. [Team fouls: 1] No free throws, side out. (Trae Curry: 1 personal fouls)

[09:29] Team_051 possession (Score: 54-51)
Austin Sexton attempts a 3Pt. Contested by Jarrett McCollum (4.4 feet, MAN). Austin Sexton misses. Rebound secured by Trae Curry.

[09:15] Team_020 possession (Score: 54-51)
Jarrett McCollum drives, Austin Sexton stays with him. Jarrett McCollum attempts a Dunk. Contested by Austin Sexton (4.5 feet, MAN). Jarrett McCollum misses. Rebound secured by Franz Simmons.

[09:02] Team_051 possession (Score: 54-51)
OG Siakam attempts a 3Pt. Contested by Bam Leonard (2.6 feet, ZONE). OG Siakam misses. Rebound secured by Bam Leonard.

[08:44] Team_020 possession (Score: 54-51)
Bam Leonard attempts a Midrange. Contested by Franz Simmons (4.5 feet, MAN). Bam Leonard misses. Rebound secured by OG Siakam.

[08:28] Team_051 possession (Score: 54-51)
Franz Simmons drives and kicks out. OG Siakam attempts a 3Pt. Contested by Terry Simons (4.2 feet, MAN). OG Siakam misses. Rebound secured by Bam Leonard.

[08:14] Team_020 possession (Score: 54-51)
Trae Curry attempts a 3Pt. Contested by Shaquille Harden (4.6 feet, MAN). Trae Curry misses. Rebound secured by Shaquille Harden.

[08:01] Team_051 possession (Score: 54-51)
Franz Simmons attempts a Layup. Contested by Trae Curry (5.1 feet, ZONE). FRANZ SIMMONS MAKES IT! Assist: OG Siakam
Score: 56-51

[07:46] Team_020 possession (Score: 56-51)
Trae Curry attempts a Midrange. Contested by Shaquille Harden (4.6 feet, MAN). Trae Curry misses. Rebound secured by OG Siakam.

[07:33] Team_051 possession (Score: 56-51)
OG Siakam attempts a Midrange. Contested by Bam Leonard (2.6 feet, ZONE). OG Siakam misses. Rebound secured by Bam Leonard.

[07:22] Team_020 possession (Score: 56-51)
FOUL! Holding foul on OG Siakam. [Team fouls: 2] No free throws, side out. (OG Siakam: 1 personal fouls)

[07:09] Team_020 possession (Score: 56-51)
Trae Curry drives, picks up Franz Simmons. Help arrives from Larry McGrady! Trae Curry attempts a Layup. Contested by Larry McGrady (4.6 feet, ZONE). TRAE CURRY MAKES IT! Assist: Terry Simons
Score: 56-53

[06:56] Team_051 possession (Score: 56-53)
Larry McGrady attempts a Midrange. Contested by James Cunningham (5.3 feet, ZONE). LARRY MCGRADY MAKES IT! Assist: Shaquille Harden
Score: 58-53

[06:39] Team_020 possession (Score: 58-53)
Jarrett McCollum drives and kicks out. Jarrett McCollum attempts a 3Pt. Contested by Austin Sexton (4.4 feet, MAN). Jarrett McCollum misses. Rebound secured by Shaquille Harden.

[06:22] Team_051 possession (Score: 58-53)
Larry McGrady attempts a Midrange. Contested by Bam Leonard (2.6 feet, ZONE). Larry McGrady misses. Rebound secured by Terry Simons.

[06:09] Team_020 possession (Score: 58-53)
Trae Curry attempts a Midrange. Contested by Shaquille Harden (4.6 feet, MAN). Trae Curry misses. Offensive rebound by Bam Leonard! Bam Leonard's putback is no good. Rebound secured by Franz Simmons.

[05:56] Team_051 possession (Score: 58-53)
Franz Simmons makes the Dunk and draws the foul on Jarrett McCollum! And-1! Franz Simmons to the line for 1. [Team fouls: 2] (Jarrett McCollum: 1 personal fouls)   FT 1/1: GOOD Franz Simmons makes 1/1 from the line.
Score: 61-53

[05:41] Team_020 possession (Score: 61-53)
Bam Leonard attempts a 3Pt. Contested by Austin Sexton (4.7 feet, ZONE). BAM LEONARD MAKES IT! Assist: Jarrett McCollum
Score: 61-56

[05:25] Team_051 possession (Score: 61-56)
Larry McGrady drives to the basket... Larry McGrady throws a bad pass! Stolen by James Cunningham! TURNOVER! (live ball)

[05:09] Team_020 possession (Score: 61-56)
FOUL! Shooting foul on Larry McGrady. James Cunningham to the line for 2 free throws. [Team fouls: 3] (Larry McGrady: 1 personal fouls)   FT 1/2: GOOD   FT 2/2: GOOD James Cunningham makes 2/2 from the line.
Score: 61-58

[04:56] Team_051 possession (Score: 61-58)
Austin Sexton drives to the basket... Austin Sexton throws a bad pass out of bounds! TURNOVER! (dead ball)

[04:43] Team_020 possession (Score: 61-58)
Jarrett McCollum attempts a 3Pt. Contested by Austin Sexton (4.5 feet, ZONE). JARRETT MCCOLLUM MAKES IT!
Score: 61-61

[04:30] Team_051 possession (Score: 61-61)
OG Siakam attempts a 3Pt. Contested by Bam Leonard (2.7 feet, ZONE). OG Siakam misses. Rebound secured by Bam Leonard.

[04:13] Team_020 possession (Score: 61-61)
Trae Curry attempts a Midrange. Contested by Franz Simmons (4.7 feet, ZONE). Trae Curry misses. Rebound secured by Shaquille Harden.

[04:03] Team_051 possession (Score: 61-61)
Franz Simmons drives, Bam Leonard stays with him. Franz Simmons attempts a Dunk. Contested by Bam Leonard (2.9 feet, MAN). FRANZ SIMMONS MAKES IT! Assist: OG Siakam
Score: 63-61

[03:46] Team_020 possession (Score: 63-61)
James Cunningham attempts a Layup. Contested by Larry McGrady (4.9 feet, MAN). JAMES CUNNINGHAM MAKES IT!
Score: 63-63

[03:29] Team_051 possession (Score: 63-63)
Franz Simmons drives, Trae Curry stays with him. Franz Simmons attempts a Layup. Contested by Trae Curry (5.3 feet, ZONE). FRANZ SIMMONS MAKES IT!
Score: 65-63

[03:17] Team_020 possession (Score: 65-63)
Terry Simons loses control! Ball rolls out of bounds! TURNOVER! (dead ball)

[03:17] Substitution (Team_020): Trae Curry OUT → Miles Siakam IN (stamina_rule2)

[03:03] Team_051 possession (Score: 65-63)
Franz Simmons attempts a Layup. Contested by Bam Leonard (3.1 feet, ZONE). FRANZ SIMMONS MAKES IT!
Score: 67-63

[02:46] Team_020 possession (Score: 67-63)
Miles Siakam attempts a Layup. Contested by Shaquille Harden (4.6 feet, MAN). Miles Siakam misses. Rebound secured by Franz Simmons.

[02:33] Team_051 possession (Score: 67-63)
Franz Simmons drives and kicks out. Shaquille Harden attempts a Midrange. Contested by Miles Siakam (4.0 feet, MAN). SHAQUILLE HARDEN MAKES IT!
Score: 69-63

[02:21] Team_020 possession (Score: 69-63)
Terry Simons attempts a 3Pt. Contested by Austin Sexton (5.2 feet, ZONE). TERRY SIMONS MAKES IT! Assist: Bam Leonard
Score: 69-66

[02:07] Team_051 possession (Score: 69-66)
OG Siakam attempts a 3Pt. Contested by Bam Leonard (3.0 feet, ZONE). OG Siakam misses. Rebound secured by Bam Leonard.

[01:49] Team_020 possession (Score: 69-66)
James Cunningham attempts a 3Pt. Contested by Larry McGrady (5.1 feet, MAN). JAMES CUNNINGHAM MAKES IT! Assist: Miles Siakam
Score: 69-69

[01:38] Team_051 possession (Score: 69-69)
Shaquille Harden attempts a Layup. Contested by Miles Siakam (3.9 feet, MAN). Shaquille Harden misses. Rebound secured by Miles Siakam.

[01:24] Team_020 possession (Score: 69-69)
FOUL! Shooting foul on Austin Sexton. Jarrett McCollum to the line for 2 free throws. [Team fouls: 4] (Austin Sexton: 1 personal fouls)   FT 1/2: GOOD   FT 2/2: GOOD Jarrett McCollum makes 2/2 from the line.
Score: 69-71

[01:10] Team_051 possession (Score: 69-71)
Larry McGrady attempts a 3Pt. Contested by Bam Leonard (3.2 feet, ZONE). Larry McGrady misses. Rebound secured by Bam Leonard.

[00:56] Team_020 possession (Score: 69-71)
FOUL! Reach-in foul on Shaquille Harden during the drive. [IN THE BONUS! 5 team fouls] Jarrett McCollum to the line for 2 free throws. (Shaquille Harden: 1 personal fouls)   FT 1/2: GOOD   FT 2/2: GOOD Jarrett McCollum makes 2/2 from the line.
Score: 69-73

[00:40] Team_051 possession (Score: 69-73)
Franz Simmons attempts a 3Pt. Contested by Jarrett McCollum (5.3 feet, ZONE). Franz Simmons misses. Rebound secured by Bam Leonard.

[00:26] Team_020 possession (Score: 69-73)
FOUL! Reach-in foul on Franz Simmons during the drive. [IN THE BONUS! 6 team fouls] James Cunningham to the line for 2 free throws. (Franz Simmons: 2 personal fouls)   FT 1/2: GOOD   FT 2/2: MISS James Cunningham makes 1/2 from the line. Rebound secured by Franz Simmons.
Score: 69-74

[00:10] Team_051 possession (Score: 69-74)
OG Siakam attempts a 3Pt. Contested by Bam Leonard (3.3 feet, ZONE). OG Siakam misses. Offensive rebound by Franz Simmons! Franz Simmons kicks it out.

================================================================================
                              3RD QUARTER COMPLETE                              
================================================================================

3RD QUARTER SCORE: Team_051 19, Team_020 27

BOX SCORE:
================================================================================

Team_051
--------------------------------------------------------------------------------
Player                MIN  PTS  REB  AST  TO      FG   FG%      3P   3P%
--------------------------------------------------------------------------------
Franz Simmons          33   13    7    0   0   6/8    75.0     0/0   0.0
Larry McGrady          33    4    0    0   0   2/4    50.0     0/0   0.0
Shaquille Harden       33    2    3    1   0   1/2    50.0     0/0   0.0
Austin Sexton          33    0    0    0   0   0/3     0.0     0/0   0.0
OG Siakam              33    0    3    3   0   0/4     0.0     0/0   0.0

TEAM: FG: 9/21 (42.9%), 3PT: 0/7 (0.0%), REB: 12 (2 off, 10 def), AST: 4, TO: 2
TEAM FOULS: 6 [Team_020 in BONUS]


Team_020
--------------------------------------------------------------------------------
Player                MIN  PTS  REB  AST  TO      FG   FG%      3P   3P%
--------------------------------------------------------------------------------
Jarrett McCollum       33    9    0    1   0   4/7    57.1     0/0   0.0
James Cunningham       33    7    0    0   0   3/4    75.0     0/0   0.0
Bam Leonard            33    5    7    2   0   2/3    66.7     0/0   0.0
Terry Simons           33    3    2    1   0   1/2    50.0     0/0   0.0
Trae Curry             30    2    2    0   0   1/5    20.0     0/0   0.0
Miles Siakam            6    0    1    1   0   0/1     0.0     0/0   0.0

TEAM: FG: 11/22 (50.0%), 3PT: 4/5 (80.0%), REB: 13 (1 off, 12 def), AST: 5, TO: 1
TEAM FOULS: 2

================================================================================

================================================================================
                       4TH QUARTER - Team_051 vs Team_020                       
================================================================================

[12:00] Team_051 possession (Score: 69-74)
Franz Simmons attempts a Layup. Contested by Trae Curry (5.0 feet, ZONE). FRANZ SIMMONS MAKES IT! Assist: OG Siakam
Score: 71-74

[11:47] Team_020 possession (Score: 71-74)
James Cunningham attempts a Midrange. Contested by OG Siakam (4.5 feet, ZONE). James Cunningham misses. Offensive rebound by Bam Leonard! Bam Leonard puts it back in!
Score: 71-76

[11:35] Team_051 possession (Score: 71-76)
Larry McGrady attempts a 3Pt. Contested by James Cunningham (5.5 feet, MAN). Larry McGrady misses. Rebound secured by Terry Simons.

[11:22] Team_020 possession (Score: 71-76)
James Cunningham attempts a 3Pt. Contested by Larry McGrady (5.2 feet, MAN). James Cunningham misses. Rebound secured by Shaquille Harden.

[11:06] Team_051 possession (Score: 71-76)
Austin Sexton drives, Jarrett McCollum stays with him. Austin Sexton attempts a Dunk. Contested by Jarrett McCollum (4.8 feet, MAN). Austin Sexton misses. Rebound secured by Trae Curry.

[10:50] Team_020 possession (Score: 71-76)
Terry Simons attempts a Layup. BLOCKED BY FRANZ SIMMONS! Ball is loose! Offensive rebound by Trae Curry! Trae Curry kicks it out.

[10:33] Team_020 possession (Score: 71-76)
Jarrett McCollum attempts a 3Pt. Contested by Austin Sexton (4.8 feet, ZONE). Jarrett McCollum misses. Rebound secured by OG Siakam.

[10:19] Team_051 possession (Score: 71-76)
Larry McGrady attempts a 3Pt. Contested by James Cunningham (5.7 feet, MAN). LARRY MCGRADY MAKES IT! Assist: Franz Simmons
Score: 74-76

[10:04] Team_020 possession (Score: 74-76)
Terry Simons attempts a 3Pt. Contested by OG Siakam (5.1 feet, MAN). TERRY SIMONS MAKES IT! Assist: James Cunningham
Score: 74-79

[09:46] Team_051 possession (Score: 74-79)
FOUL! Reach-in foul on Trae Curry during the drive. [Team fouls: 1] No free throws, side out. (Trae Curry: 1 personal fouls)

[09:35] Team_051 possession (Score: 74-79)
Austin Sexton attempts a 3Pt. Contested by Jarrett McCollum (5.0 feet, MAN). AUSTIN SEXTON MAKES IT! Assist: Franz Simmons
Score: 77-79

[09:20] Team_020 possession (Score: 77-79)
Bam Leonard drives and kicks out. Jarrett McCollum attempts a 3Pt. Contested by Austin Sexton (4.9 feet, ZONE). Jarrett McCollum misses. Rebound secured by OG Siakam.

[09:03] Team_051 possession (Score: 77-79)
Franz Simmons attempts a Layup. BLOCKED BY BAM LEONARD! Ball is loose! Rebound secured by Terry Simons.

[08:50] Team_020 possession (Score: 77-79)
James Cunningham attempts a 3Pt. Contested by Larry McGrady (5.4 feet, MAN). James Cunningham misses. Rebound secured by Shaquille Harden.

[08:32] Team_051 possession (Score: 77-79)
Franz Simmons attempts a Layup. BLOCKED BY JARRETT MCCOLLUM! Ball is loose! Rebound secured by Bam Leonard.

[08:21] Team_020 possession (Score: 77-79)
Jarrett McCollum makes the Midrange and draws the foul on Larry McGrady! And-1! Jarrett McCollum to the line for 1. [Team fouls: 1] (Larry McGrady: 1 personal fouls)   FT 1/1: GOOD Jarrett McCollum makes 1/1 from the line.
Score: 77-82

[08:04] Team_051 possession (Score: 77-82)
FOUL! Shooting foul on Trae Curry. Austin Sexton to the line for 2 free throws. [Team fouls: 2] (Trae Curry: 2 personal fouls)   FT 1/2: GOOD   FT 2/2: GOOD Austin Sexton makes 2/2 from the line.
Score: 79-82

[07:48] Team_020 possession (Score: 79-82)
Bam Leonard attempts a 3Pt. Contested by Austin Sexton (5.3 feet, ZONE). Bam Leonard misses. Rebound secured by Franz Simmons.

[07:34] Team_051 possession (Score: 79-82)
Austin Sexton drives, picks up Jarrett McCollum. Help arrives from Terry Simons! Austin Sexton attempts a Dunk. Contested by Terry Simons (5.3 feet, MAN). Austin Sexton misses. Rebound secured by Bam Leonard.

[07:20] Team_020 possession (Score: 79-82)
Jarrett McCollum attempts a 3Pt. Contested by Austin Sexton (5.2 feet, ZONE). Jarrett McCollum misses. Offensive rebound by Bam Leonard! Bam Leonard puts it back in!
Score: 79-84

[07:10] Team_051 possession (Score: 79-84)
Shaquille Harden drives, Trae Curry stays with him. Shaquille Harden attempts a Layup. Contested by Trae Curry (4.9 feet, MAN). SHAQUILLE HARDEN MAKES IT!
Score: 81-84

[06:51] Team_020 possession (Score: 81-84)
Trae Curry drives and kicks out. Bam Leonard attempts a 3Pt. Contested by Franz Simmons (5.2 feet, MAN). BAM LEONARD MAKES IT! Assist: Terry Simons
Score: 81-87

[06:36] Team_051 possession (Score: 81-87)
Franz Simmons attempts a 3Pt. Contested by Terry Simons (5.7 feet, ZONE). Franz Simmons misses. Rebound secured by Trae Curry.

[06:20] Team_020 possession (Score: 81-87)
James Cunningham attempts a 3Pt. Contested by Austin Sexton (5.5 feet, ZONE). JAMES CUNNINGHAM MAKES IT! Assist: Trae Curry
Score: 81-90

[06:04] Team_051 possession (Score: 81-90)
OG Siakam attempts a 3Pt. Contested by Bam Leonard (4.0 feet, ZONE). OG Siakam misses. Rebound secured by Trae Curry.

[05:51] Team_020 possession (Score: 81-90)
Terry Simons attempts a Midrange. Contested by OG Siakam (5.6 feet, MAN). Terry Simons misses. Offensive rebound by Trae Curry! Trae Curry's putback is no good. Rebound secured by Franz Simmons.

[05:34] Team_051 possession (Score: 81-90)
FOUL! Shooting foul on Trae Curry. OG Siakam to the line for 2 free throws. [Team fouls: 3] (Trae Curry: 3 personal fouls)   FT 1/2: MISS   FT 2/2: GOOD OG Siakam makes 1/2 from the line.
Score: 82-90

[05:24] Team_020 possession (Score: 82-90)
James Cunningham attempts a 3Pt. Contested by Larry McGrady (5.9 feet, MAN). JAMES CUNNINGHAM MAKES IT! Assist: Bam Leonard
Score: 82-93

[05:11] Team_051 possession (Score: 82-93)
Larry McGrady attempts a Midrange. Wide open! James Cunningham is 6.2 feet away. [MAN] LARRY MCGRADY MAKES IT!
Score: 84-93

[04:56] Team_020 possession (Score: 84-93)
James Cunningham attempts a 3Pt. Contested by Austin Sexton (5.6 feet, ZONE). James Cunningham misses. Rebound secured by OG Siakam.

[04:42] Team_051 possession (Score: 84-93)
Austin Sexton attempts a Midrange. Contested by Jarrett McCollum (5.7 feet, MAN). AUSTIN SEXTON MAKES IT! Assist: OG Siakam
Score: 86-93

[04:27] Team_020 possession (Score: 86-93)
Terry Simons drives, picks up OG Siakam. Help arrives from Austin Sexton! Terry Simons attempts a Layup. Contested by Austin Sexton (5.8 feet, MAN). TERRY SIMONS MAKES IT! Assist: Jarrett McCollum
Score: 86-95

[04:12] Team_051 possession (Score: 86-95)
Franz Simmons attempts a 3Pt. Contested by Bam Leonard (4.6 feet, ZONE). Franz Simmons misses. Rebound secured by Terry Simons.

[03:52] Team_020 possession (Score: 86-95)
James Cunningham attempts a Layup. Wide open! Larry McGrady is 6.1 feet away. [MAN] JAMES CUNNINGHAM MAKES IT! Assist: Bam Leonard
Score: 86-97

[03:34] Team_051 possession (Score: 86-97)
Franz Simmons drives to the basket... Franz Simmons loses the ball! Stripped by Trae Curry! TURNOVER! (live ball)

[03:20] Team_020 possession (Score: 86-97)
Trae Curry makes the Layup and draws the foul on Shaquille Harden! And-1! Trae Curry to the line for 1. [Team fouls: 2] (Shaquille Harden: 1 personal fouls)   FT 1/1: GOOD Trae Curry makes 1/1 from the line.
Score: 86-100

[03:05] Team_051 possession (Score: 86-100)
Austin Sexton attempts a Midrange. Contested by Terry Simons (5.8 feet, ZONE). AUSTIN SEXTON MAKES IT! Assist: Larry McGrady
Score: 88-100

[02:50] Team_020 possession (Score: 88-100)
James Cunningham attempts a 3Pt. Contested by Austin Sexton (5.9 feet, ZONE). James Cunningham misses. FOUL! Loose ball foul on OG Siakam during the rebound battle. [Team fouls: 3] No free throws, side out. (OG Siakam: 1 personal fouls)

[02:36] Team_020 possession (Score: 88-100)
Trae Curry drives, picks up Shaquille Harden. Help arrives from Austin Sexton! Trae Curry attempts a Layup. Wide open! Austin Sexton is 6.1 feet away. [MAN] TRAE CURRY MAKES IT! Assist: Bam Leonard
Score: 88-102

[02:22] Team_051 possession (Score: 88-102)
Shaquille Harden drives, Trae Curry stays with him. Shaquille Harden attempts a Layup. Contested by Trae Curry (5.5 feet, ZONE). SHAQUILLE HARDEN MAKES IT! Assist: Austin Sexton
Score: 90-102

[02:04] Team_020 possession (Score: 90-102)
FOUL! Holding foul on Austin Sexton. [Team fouls: 4] No free throws, side out. (Austin Sexton: 1 personal fouls)

[01:49] Team_020 possession (Score: 90-102)
FOUL! Shooting foul on Austin Sexton. Trae Curry to the line for 2 free throws. [BONUS: 5 team fouls] (Austin Sexton: 2 personal fouls)   FT 1/2: GOOD   FT 2/2: GOOD Trae Curry makes 2/2 from the line.
Score: 90-104

[01:33] Team_051 possession (Score: 90-104)
Shaquille Harden attempts a Layup. BLOCKED BY TRAE CURRY! Ball is loose! Rebound secured by Trae Curry.

[01:16] Team_020 possession (Score: 90-104)
Terry Simons attempts a 3Pt. Wide open! Austin Sexton is 6.3 feet away. [ZONE] Terry Simons misses. FOUL! Loose ball foul on OG Siakam during the rebound battle. [IN THE BONUS! 6 team fouls] Bam Leonard to the line for 2 free throws. (OG Siakam: 2 personal fouls)   FT 1/2: GOOD   FT 2/2: GOOD Bam Leonard makes 2/2 from the line.
Score: 90-106

[01:03] Team_051 possession (Score: 90-106)
Franz Simmons attempts a 3Pt. Contested by Bam Leonard (5.2 feet, MAN). Franz Simmons misses. FOUL! Loose ball foul on Terry Simons during the rebound battle. [Team fouls: 4] No free throws, side out. (Terry Simons: 1 personal fouls)

[00:48] Team_051 possession (Score: 90-106)
Austin Sexton attempts a 3Pt. Contested by Bam Leonard (4.9 feet, ZONE). Austin Sexton misses. Rebound secured by Terry Simons.

[00:36] Team_020 possession (Score: 90-106)
Terry Simons attempts a 3Pt. Wide open! OG Siakam is 6.4 feet away. [ZONE] TERRY SIMONS MAKES IT! Assist: Jarrett McCollum
Score: 90-109

[00:25] Team_051 possession (Score: 90-109)
Larry McGrady attempts a Midrange. Wide open! James Cunningham is 6.8 feet away. [MAN] Larry McGrady misses. Rebound secured by Trae Curry.

[00:10] Team_020 possession (Score: 90-109)
Trae Curry attempts a Layup. Wide open! Franz Simmons is 6.3 feet away. [ZONE] TRAE CURRY MAKES IT! Assist: James Cunningham
Score: 90-111

================================================================================
                              4TH QUARTER COMPLETE                              
================================================================================

4TH QUARTER SCORE: Team_051 21, Team_020 37

BOX SCORE:
================================================================================

Team_051
--------------------------------------------------------------------------------
Player                MIN  PTS  REB  AST  TO      FG   FG%      3P   3P%
--------------------------------------------------------------------------------
Austin Sexton          45    9    0    1   0   4/7    57.1     0/0   0.0
Larry McGrady          45    5    0    1   0   2/4    50.0     0/0   0.0
Shaquille Harden       45    4    2    0   0   2/3    66.7     0/0   0.0
Franz Simmons          45    2    3    2   0   1/5    20.0     0/0   0.0
OG Siakam              45    1    3    2   0   1/2    50.0     0/0   0.0

TEAM: FG: 10/21 (47.6%), 3PT: 2/7 (28.6%), REB: 7 (1 off, 6 def), AST: 6, TO: 1
TEAM FOULS: 6 [Team_020 in BONUS]


Team_020
--------------------------------------------------------------------------------
Player                MIN  PTS  REB  AST  TO      FG   FG%      3P   3P%
--------------------------------------------------------------------------------
Bam Leonard            45    9    5    3   0   4/6    66.7     0/0   0.0
Trae Curry             42    9    6    1   0   4/4   100.0     0/0   0.0
Terry Simons           45    8    4    1   0   3/4    75.0     0/0   0.0
James Cunningham       45    8    0    2   0   3/6    50.0     0/0   0.0
Jarrett McCollum       45    3    0    2   0   1/2    50.0     0/0   0.0

TEAM: FG: 15/22 (68.2%), 3PT: 6/11 (54.5%), REB: 16 (5 off, 11 def), AST: 9, TO: 0
TEAM FOULS: 4

================================================================================

================================================================================
                               FULL GAME COMPLETE                               
================================================================================

FINAL SCORE: Team_051 90, Team_020 111

SCORING BY QUARTER:
--------------------------------------------------------------------------------
Team                     Q1     Q2     Q3     Q4    FINAL
--------------------------------------------------------------------------------
Team_051                 25     25     19     21       90
Team_020                 18     29     27     37      111
--------------------------------------------------------------------------------

FULL GAME BOX SCORE:
================================================================================

Team_051
--------------------------------------------------------------------------------
Player                MIN  PTS  REB  AST  TO      FG   FG%      3P   3P%      FT STL BLK
--------------------------------------------------------------------------------
Austin Sexton          45   27    0    2   1  11/21   52.4   4/8    50.0   7/9     0   0
Larry McGrady          45   16    0    2   1   7/15   46.7   2/6    33.3   1/3     0   0
OG Siakam              45    3   10    5   4   2/11   18.2   0/8     0.0   3/4     1   1
Franz Simmons          45   17   20    5   2   9/18   50.0   0/4     0.0   2/3     0   1
Shaquille Harden       45   14   12    1   1   5/8    62.5   1/1   100.0   2/2     0   0
Myles Harden            3    0    1    0   1   0/0     0.0   0/0     0.0   0/0     0   0
Zion Morant             3    0    0    0   0   0/0     0.0   0/0     0.0   0/0     0   0
Jrue Carter             3    3    0    0   1   1/1   100.0   0/0     0.0   1/1     0   0
Tobias Jokic            3    0    1    0   0   0/0     0.0   0/0     0.0   0/0     0   0
Pau Tatum               3    3    1    0   0   1/3    33.3   0/0     0.0   2/4     0   0

TEAM: FG: 38/79 (48.1%), 3PT: 7/27 (25.9%), REB: 41 (6 off, 35 def), AST: 15, TO: 11


Team_020
--------------------------------------------------------------------------------
Player                MIN  PTS  REB  AST  TO      FG   FG%      3P   3P%      FT STL BLK
--------------------------------------------------------------------------------
Jarrett McCollum       45   15    0    6   0   7/14   50.0   3/7    42.9   5/5     1   3
James Cunningham       45   18    0    6   1   9/14   64.3   5/8    62.5   3/4     1   0
Terry Simons           45   15    9    2   2   7/12   58.3   4/4   100.0   0/0     0   0
Bam Leonard            45   28   21    7   2   7/17   41.2   3/8    37.5   4/4     2   2
Trae Curry             42   25   17    1   0  12/20   60.0   1/3    33.3   6/6     2   1
Miles Siakam            6    3    1    1   0   1/3    33.3   0/0     0.0   1/1     0   1
Franz Doncic            3    0    0    0   0   0/0     0.0   0/0     0.0   0/0     0   0
Stephen Parker          3    3    0    1   0   1/2    50.0   0/0     0.0   2/3     0   0
Victor Holiday          3    0    2    0   0   0/0     0.0   0/0     0.0   0/0     1   0
Cole Barnes             3    2    0    0   0   1/2    50.0   0/0     0.0   0/0     0   0

TEAM: FG: 45/84 (53.6%), 3PT: 16/30 (53.3%), REB: 54 (13 off, 41 def), AST: 24, TO: 5

================================================================================
