================================================================================
                        FULL GAME - Team_064 vs Team_083                        
================================================================================

================================================================================
                       1ST QUARTER - Team_064 vs Team_083                       
================================================================================

[12:00] Team_064 possession (Score: 0-0)
Kawhi Irving makes the Dunk and draws the foul on Yao Oladipo! And-1! Kawhi Irving to the line for 1. [Team fouls: 1] (Yao Oladipo: 1 personal fouls)   FT 1/1: MISS Kawhi Irving makes 0/1 from the line. Rebound secured by Bradley Thompson.
Score: 2-0

[11:44] Team_083 possession (Score: 2-0)
Karl Jokic attempts a 3Pt. Contested by Ja Mitchell (5.7 feet, ZONE). KARL JOKIC MAKES IT! Assist: Bradley Thompson
Score: 2-3

[11:25] Team_064 possession (Score: 2-3)
Kawhi Irving attempts a 3Pt. Contested by Yao Oladipo (3.3 feet, MAN). Kawhi Irving misses. Offensive rebound by Russell Simons! Russell Simons kicks it out.

[11:05] Team_064 possession (Score: 2-3)
Russell Simons drives, Kyrie Griffin stays with him. Russell Simons attempts a Layup. Contested by Kyrie Griffin (3.5 feet, MAN). RUSSELL SIMONS MAKES IT!
Score: 4-3

[10:53] Team_083 possession (Score: 4-3)
Bradley Thompson attempts a Layup. Contested by Shai Hyland (5.1 feet, MAN). Bradley Thompson misses. Rebound secured by Shai Hyland.

[10:40] Team_064 possession (Score: 4-3)
Shai Hyland drives and kicks out. Shai Hyland makes the Midrange and draws the foul on Kyrie Griffin! And-1! Shai Hyland to the line for 1. [Team fouls: 2] (Kyrie Griffin: 1 personal fouls)   FT 1/1: MISS Shai Hyland makes 0/1 from the line. FOUL! Loose ball foul on Bradley Thompson during the free throw rebound! [Team fouls: 3] No free throws, side out. (Bradley Thompson: 1 personal fouls)
Score: 6-3

[10:24] Team_064 possession (Score: 6-3)
Russell Simons attempts a Midrange. Contested by Yao Oladipo (3.5 feet, ZONE). RUSSELL SIMONS MAKES IT!
Score: 8-3

[10:10] Team_083 possession (Score: 8-3)
Malcolm Brogdon attempts a Midrange. Contested by Ja Mitchell (4.8 feet, MAN). Malcolm Brogdon misses. Rebound secured by Russell Simons.

[09:55] Team_064 possession (Score: 8-3)
Jordan Mitchell attempts a 3Pt. Contested by Karl Jokic (4.1 feet, MAN). Jordan Mitchell misses. Rebound secured by Kyrie Griffin.

[09:38] Team_083 possession (Score: 8-3)
Kyrie Griffin attempts a 3Pt. Contested by Russell Simons (3.6 feet, MAN). KYRIE GRIFFIN MAKES IT!
Score: 8-6

[09:24] Team_064 possession (Score: 8-6)
Shai Hyland attempts a Layup. Contested by Bradley Thompson (4.0 feet, MAN). SHAI HYLAND MAKES IT! Assist: Jordan Mitchell
Score: 10-6

[09:08] Team_083 possession (Score: 10-6)
Yao Oladipo attempts a 3Pt. Contested by Ja Mitchell (5.4 feet, ZONE). Yao Oladipo misses. Rebound secured by Shai Hyland.

[08:51] Team_064 possession (Score: 10-6)
Jordan Mitchell attempts a 3Pt. Contested by Karl Jokic (4.1 feet, MAN). Jordan Mitchell misses. Rebound secured by Bradley Thompson.

[08:31] Team_083 possession (Score: 10-6)
Kyrie Griffin attempts a Midrange. Contested by Russell Simons (3.6 feet, MAN). KYRIE GRIFFIN MAKES IT! Assist: Malcolm Brogdon
Score: 10-8

[08:20] Team_064 possession (Score: 10-8)
Ja Mitchell drives, picks up Kyrie Griffin. Help arrives from Karl Jokic! Ja Mitchell attempts a Layup. Contested by Karl Jokic (3.6 feet, ZONE). JA MITCHELL MAKES IT! Assist: Russell Simons
Score: 12-8

[08:05] Team_083 possession (Score: 12-8)
Karl Jokic drives, Russell Simons stays with him. Karl Jokic attempts a Layup. Contested by Russell Simons (3.7 feet, ZONE). KARL JOKIC MAKES IT! Assist: Bradley Thompson
Score: 12-10

[07:49] Team_064 possession (Score: 12-10)
Kawhi Irving attempts a Layup. Contested by Yao Oladipo (3.3 feet, MAN). KAWHI IRVING MAKES IT! Assist: Jordan Mitchell
Score: 14-10

[07:32] Team_083 possession (Score: 14-10)
Yao Oladipo attempts a 3Pt. Contested by Ja Mitchell (5.4 feet, ZONE). YAO OLADIPO MAKES IT! Assist: Karl Jokic
Score: 14-13

[07:14] Team_064 possession (Score: 14-13)
Ja Mitchell attempts a 3Pt. Contested by Malcolm Brogdon (5.1 feet, MAN). Ja Mitchell misses. Rebound secured by Kyrie Griffin.

[06:59] Team_083 possession (Score: 14-13)
Yao Oladipo attempts a 3Pt. Contested by Kawhi Irving (4.6 feet, MAN). YAO OLADIPO MAKES IT! Assist: Karl Jokic
Score: 14-16

[06:43] Team_064 possession (Score: 14-16)
Russell Simons drives, picks up Kyrie Griffin. Help arrives from Karl Jokic! Russell Simons attempts a Dunk. Contested by Karl Jokic (3.5 feet, ZONE). Russell Simons misses. Offensive rebound by Russell Simons! Russell Simons kicks it out.

[06:28] Team_064 possession (Score: 14-16)
Russell Simons attempts a Layup. Contested by Kyrie Griffin (3.5 feet, ZONE). RUSSELL SIMONS MAKES IT! Assist: Kawhi Irving
Score: 16-16

[06:15] Team_083 possession (Score: 16-16)
Yao Oladipo attempts a Midrange. Contested by Kawhi Irving (4.6 feet, ZONE). Yao Oladipo misses. Rebound secured by Kawhi Irving.

[05:59] Team_064 possession (Score: 16-16)
Jordan Mitchell makes the Layup and draws the foul on Karl Jokic! And-1! Jordan Mitchell to the line for 1. [Team fouls: 4] (Karl Jokic: 1 personal fouls)   FT 1/1: GOOD Jordan Mitchell makes 1/1 from the line.
Score: 19-16

[05:46] Team_083 possession (Score: 19-16)
Yao Oladipo drives and kicks out. Karl Jokic attempts a Midrange. Contested by Jordan Mitchell (3.8 feet, MAN). Karl Jokic misses. Rebound secured by Kawhi Irving.

[05:30] Team_064 possession (Score: 19-16)
Kawhi Irving attempts a Layup. Contested by Kyrie Griffin (3.3 feet, ZONE). KAWHI IRVING MAKES IT!
Score: 21-16

[05:19] Team_083 possession (Score: 21-16)
Malcolm Brogdon drives and kicks out. Kyrie Griffin attempts a Midrange. Contested by Kawhi Irving (4.3 feet, ZONE). Kyrie Griffin misses. Rebound secured by Shai Hyland.

[05:06] Team_064 possession (Score: 21-16)
Russell Simons attempts a Layup. Contested by Bradley Thompson (3.8 feet, ZONE). Russell Simons misses. Rebound secured by Kyrie Griffin.

[04:51] Team_083 possession (Score: 21-16)
Bradley Thompson attempts a Layup. Contested by Shai Hyland (5.2 feet, MAN). BRADLEY THOMPSON MAKES IT! Assist: Karl Jokic
Score: 21-18

[04:37] Team_064 possession (Score: 21-18)
Jordan Mitchell attempts a 3Pt. Contested by Karl Jokic (4.1 feet, MAN). Jordan Mitchell misses. Rebound secured by Yao Oladipo.

[04:26] Team_083 possession (Score: 21-18)
Bradley Thompson attempts a Layup. Contested by Shai Hyland (5.2 feet, MAN). BRADLEY THOMPSON MAKES IT!
Score: 21-20

[04:12] Team_064 possession (Score: 21-20)
Jordan Mitchell attempts a Midrange. Contested by Karl Jokic (4.2 feet, MAN). Jordan Mitchell misses. Rebound secured by Yao Oladipo.

[03:59] Team_083 possession (Score: 21-20)
Malcolm Brogdon attempts a 3Pt. Contested by Ja Mitchell (4.9 feet, ZONE). Malcolm Brogdon misses. Rebound secured by Kawhi Irving.

[03:45] Team_064 possession (Score: 21-20)
FOUL! Shooting foul on Kyrie Griffin. Jordan Mitchell to the line for 2 free throws. [BONUS: 5 team fouls] (Kyrie Griffin: 2 personal fouls)   FT 1/2: GOOD   FT 2/2: GOOD Jordan Mitchell makes 2/2 from the line.
Score: 23-20

[03:29] Team_083 possession (Score: 23-20)
Bradley Thompson drives to the basket... Bradley Thompson loses control! Ball rolls out of bounds! TURNOVER! (dead ball)

[03:13] Team_064 possession (Score: 23-20)
Jordan Mitchell drives and kicks out. Kawhi Irving attempts a Midrange. Contested by Yao Oladipo (3.5 feet, MAN). Kawhi Irving misses. Rebound secured by Bradley Thompson.

[03:00] Team_083 possession (Score: 23-20)
Kyrie Griffin throws a bad pass! Stolen by Russell Simons! TURNOVER! (live ball)

[02:49] Team_064 possession (Score: 23-20)
Ja Mitchell attempts a Layup. BLOCKED BY KYRIE GRIFFIN! Ball goes out off Kyrie Griffin. Ja Mitchell's ball!

[02:33] Team_064 possession (Score: 23-20)
Shai Hyland attempts a Midrange. Contested by Bradley Thompson (4.2 feet, MAN). Shai Hyland misses. Rebound secured by Bradley Thompson.

[02:18] Team_083 possession (Score: 23-20)
Karl Jokic drives and kicks out. Malcolm Brogdon attempts a 3Pt. Contested by Ja Mitchell (5.4 feet, MAN). Malcolm Brogdon misses. Rebound secured by Kawhi Irving.

[02:04] Team_064 possession (Score: 23-20)
Shai Hyland attempts a Midrange. Contested by Bradley Thompson (4.3 feet, MAN). Shai Hyland misses. Rebound secured by Yao Oladipo.

[01:46] Team_083 possession (Score: 23-20)
Yao Oladipo attempts a 3Pt. Contested by Ja Mitchell (5.7 feet, ZONE). YAO OLADIPO MAKES IT! Assist: Malcolm Brogdon
Score: 23-23

[01:33] Team_064 possession (Score: 23-23)
Jordan Mitchell drives to the basket... Jordan Mitchell loses the ball! Stripped by Bradley Thompson! TURNOVER! (live ball)

[01:19] Team_083 possession (Score: 23-23)
Yao Oladipo attempts a 3Pt. Contested by Kawhi Irving (4.9 feet, MAN). Yao Oladipo misses. Rebound secured by Russell Simons.

[01:05] Team_064 possession (Score: 23-23)
Russell Simons attempts a Layup. Contested by Kyrie Griffin (3.9 feet, MAN). Russell Simons misses. Rebound secured by Kyrie Griffin.

[00:50] Team_083 possession (Score: 23-23)
Karl Jokic attempts a Midrange. Contested by Russell Simons (4.3 feet, ZONE). Karl Jokic misses. Rebound secured by Russell Simons.

[00:33] Team_064 possession (Score: 23-23)
FOUL! Shooting foul on Yao Oladipo. Kawhi Irving to the line for 2 free throws. [BONUS: 6 team fouls] (Yao Oladipo: 2 personal fouls)   FT 1/2: GOOD   FT 2/2: MISS Kawhi Irving makes 1/2 from the line. Rebound secured by Yao Oladipo.
Score: 24-23

[00:20] Team_083 possession (Score: 24-23)
Yao Oladipo drives, Russell Simons stays with him. Yao Oladipo attempts a Dunk. Contested by Russell Simons (4.2 feet, ZONE). YAO OLADIPO MAKES IT! Assist: Bradley Thompson
Score: 24-25

[00:10] Team_064 possession (Score: 24-25)
Russell Simons attempts a Midrange. Contested by Kyrie Griffin (4.0 feet, MAN). Russell Simons misses. FOUL! Loose ball foul on Bradley Thompson during the rebound battle. [IN THE BONUS! 7 team fouls] Kawhi Irving to the line for 2 free throws. (Bradley Thompson: 2 personal fouls)   FT 1/2: GOOD   FT 2/2: GOOD Kawhi Irving makes 2/2 from the line.
Score: 26-25

================================================================================
                              1ST QUARTER COMPLETE                              
================================================================================

1ST QUARTER SCORE: Team_064 26, Team_083 25

BOX SCORE:
================================================================================

Team_064
--------------------------------------------------------------------------------
Player                MIN  PTS  REB  AST  TO      FG   FG%      3P   3P%
--------------------------------------------------------------------------------
Kawhi Irving           12    6    5    1   0   3/5    60.0     0/0   0.0
Russell Simons         12    6    5    1   0   3/5    60.0     0/0   0.0
Jordan Mitchell        12    5    0    2   0   2/7    28.6     0/0   0.0
Shai Hyland            12    2    3    0   0   1/3    33.3     0/0   0.0
Ja Mitchell            12    2    0    0   0   1/2    50.0     0/0   0.0

TEAM: FG: 10/22 (45.5%), 3PT: 0/4 (0.0%), REB: 13 (3 off, 10 def), AST: 4, TO: 1
TEAM FOULS: 0


Team_083
--------------------------------------------------------------------------------
Player                MIN  PTS  REB  AST  TO      FG   FG%      3P   3P%
--------------------------------------------------------------------------------
Yao Oladipo            12   11    4    0   0   4/8    50.0     0/0   0.0
Karl Jokic             12    5    0    3   0   2/4    50.0     0/0   0.0
Kyrie Griffin          12    5    4    0   0   2/2   100.0     0/0   0.0
Bradley Thompson       12    4    4    3   0   2/3    66.7     0/0   0.0
Malcolm Brogdon        12    0    0    2   0   0/3     0.0     0/0   0.0

TEAM: FG: 10/20 (50.0%), 3PT: 5/8 (62.5%), REB: 12 (0 off, 12 def), AST: 8, TO: 2
TEAM FOULS: 7 [Team_064 in BONUS]

================================================================================

================================================================================
                       2ND QUARTER - Team_064 vs Team_083                       
================================================================================

[12:00] Team_064 possession (Score: 26-25)
Kawhi Irving drives and kicks out. Jordan Mitchell attempts a 3Pt. Contested by Karl Jokic (4.8 feet, MAN). Jordan Mitchell misses. Offensive rebound by Russell Simons! Russell Simons kicks it out.

[11:42] Team_064 possession (Score: 26-25)
Shai Hyland attempts a Midrange. Contested by Bradley Thompson (4.3 feet, MAN). Shai Hyland misses. Offensive rebound by Kawhi Irving! Kawhi Irving kicks it out.

[11:28] Team_064 possession (Score: 26-25)
Russell Simons attempts a 3Pt. Contested by Kyrie Griffin (3.9 feet, MAN). RUSSELL SIMONS MAKES IT! Assist: Shai Hyland
Score: 29-25

[11:16] Team_083 possession (Score: 29-25)
Kyrie Griffin makes the Layup and draws the foul on Russell Simons! And-1! Kyrie Griffin to the line for 1. [Team fouls: 1] (Russell Simons: 1 personal fouls)   FT 1/1: GOOD Kyrie Griffin makes 1/1 from the line.
Score: 29-28

[11:00] Team_064 possession (Score: 29-28)
Jordan Mitchell attempts a 3Pt. Contested by Yao Oladipo (3.3 feet, ZONE). Jordan Mitchell misses. Rebound secured by Bradley Thompson.

[10:43] Team_083 possession (Score: 29-28)
FOUL! Holding foul on Ja Mitchell. [Team fouls: 2] No free throws, side out. (Ja Mitchell: 1 personal fouls)

[10:29] Team_083 possession (Score: 29-28)
Kyrie Griffin attempts a Layup. Contested by Russell Simons (4.2 feet, MAN). KYRIE GRIFFIN MAKES IT!
Score: 29-30

[10:16] Team_064 possession (Score: 29-30)
Shai Hyland attempts a Midrange. Contested by Bradley Thompson (4.5 feet, MAN). Shai Hyland misses. Rebound secured by Yao Oladipo.

[10:03] Team_083 possession (Score: 29-30)
FOUL! Shooting foul on Shai Hyland. Bradley Thompson to the line for 2 free throws. [Team fouls: 3] (Shai Hyland: 1 personal fouls)   FT 1/2: GOOD   FT 2/2: GOOD Bradley Thompson makes 2/2 from the line.
Score: 29-32

[09:46] Team_064 possession (Score: 29-32)
Kawhi Irving attempts a 3Pt. Contested by Yao Oladipo (3.8 feet, ZONE). KAWHI IRVING MAKES IT!
Score: 32-32

[09:35] Team_083 possession (Score: 32-32)
Bradley Thompson drives, Shai Hyland stays with him. Bradley Thompson attempts a Layup. Contested by Shai Hyland (5.7 feet, MAN). Bradley Thompson misses. Rebound secured by Kawhi Irving.

[09:20] Team_064 possession (Score: 32-32)
Shai Hyland attempts a Layup. Contested by Kyrie Griffin (4.3 feet, ZONE). SHAI HYLAND MAKES IT! Assist: Kawhi Irving
Score: 34-32

[09:03] Team_083 possession (Score: 34-32)
Yao Oladipo drives and kicks out. Bradley Thompson attempts a Midrange. Contested by Jordan Mitchell (4.6 feet, ZONE). Bradley Thompson misses. FOUL! Loose ball foul on Russell Simons during the rebound battle. [Team fouls: 4] No free throws, side out. (Russell Simons: 2 personal fouls)

[08:49] Team_083 possession (Score: 34-32)
Bradley Thompson drives and kicks out. Yao Oladipo attempts a Midrange. Contested by Kawhi Irving (5.0 feet, ZONE). Yao Oladipo misses. Rebound secured by Kawhi Irving.

[08:31] Team_064 possession (Score: 34-32)
Kawhi Irving attempts a 3Pt. Contested by Yao Oladipo (3.9 feet, ZONE). KAWHI IRVING MAKES IT! Assist: Jordan Mitchell
Score: 37-32

[08:14] Team_083 possession (Score: 37-32)
Malcolm Brogdon drives and kicks out. Bradley Thompson attempts a Midrange. Contested by Russell Simons (4.3 feet, ZONE). Bradley Thompson misses. Rebound secured by Jordan Mitchell.

[07:58] Team_064 possession (Score: 37-32)
Ja Mitchell attempts a Midrange. Contested by Kyrie Griffin (4.5 feet, ZONE). Ja Mitchell misses. Rebound secured by Bradley Thompson.

[07:43] Team_083 possession (Score: 37-32)
FOUL! Holding foul on Kawhi Irving. [IN THE BONUS! 5 team fouls] Yao Oladipo to the line for 2 free throws. (Kawhi Irving: 1 personal fouls)   FT 1/2: GOOD   FT 2/2: GOOD Yao Oladipo makes 2/2 from the line.
Score: 37-34

[07:28] Team_064 possession (Score: 37-34)
FOUL! Shooting foul on Malcolm Brogdon. Ja Mitchell to the line for 3 free throws. [Team fouls: 1] (Malcolm Brogdon: 1 personal fouls)   FT 1/3: GOOD   FT 2/3: GOOD   FT 3/3: GOOD Ja Mitchell makes 3/3 from the line.
Score: 40-34

[07:12] Team_083 possession (Score: 40-34)
Malcolm Brogdon attempts a 3Pt. Contested by Ja Mitchell (5.6 feet, MAN). Malcolm Brogdon misses. Rebound secured by Jordan Mitchell.

[07:01] Team_064 possession (Score: 40-34)
Russell Simons drives and kicks out. Shai Hyland attempts a 3Pt. Contested by Bradley Thompson (4.7 feet, MAN). SHAI HYLAND MAKES IT! Assist: Russell Simons
Score: 43-34

[06:47] Team_083 possession (Score: 43-34)
Yao Oladipo drives to the basket... Yao Oladipo loses control! Ball rolls out of bounds! TURNOVER! (dead ball)

[06:47] Substitution (Team_064): Ja Mitchell OUT → CJ Haliburton IN (stamina_rule2)

[06:47] Substitution (Team_064): Jordan Mitchell OUT → Ja Simmons IN (stamina_rule2)

[06:47] Substitution (Team_064): Kawhi Irving OUT → Tobias Herro IN (stamina_rule2)

[06:47] Substitution (Team_064): Russell Simons OUT → Austin Smith IN (stamina_rule2)

[06:47] Substitution (Team_064): Shai Hyland OUT → Devin Cunningham IN (stamina_rule2)

[06:47] Substitution (Team_083): Malcolm Brogdon OUT → Zion Markkanen IN (stamina_rule2)

[06:47] Substitution (Team_083): Karl Jokic OUT → Damian Towns IN (stamina_rule2)

[06:47] Substitution (Team_083): Yao Oladipo OUT → Domantas Doncic IN (stamina_rule2)

[06:47] Substitution (Team_083): Kyrie Griffin OUT → Cole Simmons IN (stamina_rule2)

[06:47] Substitution (Team_083): Bradley Thompson OUT → Victor McCollum IN (stamina_rule2)

[06:32] Team_064 possession (Score: 43-34)
Ja Simmons attempts a 3Pt. Contested by Zion Markkanen (5.2 feet, ZONE). JA SIMMONS MAKES IT! Assist: CJ Haliburton
Score: 46-34

[06:22] Team_083 possession (Score: 46-34)
Victor McCollum attempts a Layup. Contested by Austin Smith (5.2 feet, ZONE). Victor McCollum misses. Rebound secured by Devin Cunningham.

[06:11] Team_064 possession (Score: 46-34)
Austin Smith drives, Cole Simmons stays with him. Austin Smith attempts a Dunk. Contested by Cole Simmons (4.4 feet, MAN). Austin Smith misses. Rebound secured by Cole Simmons.

[05:57] Team_083 possession (Score: 46-34)
Cole Simmons drives, picks up Austin Smith. Help arrives from Ja Simmons! Cole Simmons attempts a Layup. Contested by Ja Simmons (4.5 feet, MAN). COLE SIMMONS MAKES IT! Assist: Zion Markkanen
Score: 46-36

[05:40] Team_064 possession (Score: 46-36)
Devin Cunningham makes the Layup and draws the foul on Victor McCollum! And-1! Devin Cunningham to the line for 1. [Team fouls: 2] (Victor McCollum: 1 personal fouls)   FT 1/1: GOOD Devin Cunningham makes 1/1 from the line.
Score: 49-36

[05:26] Team_083 possession (Score: 49-36)
Zion Markkanen attempts a 3Pt. Wide open! CJ Haliburton is 6.2 feet away. [MAN] Zion Markkanen misses. Offensive rebound by Damian Towns! Damian Towns kicks it out.

[05:13] Team_083 possession (Score: 49-36)
Damian Towns drives to the basket... Damian Towns throws a bad pass! Stolen by Austin Smith! TURNOVER! (live ball)

[04:58] Team_064 possession (Score: 49-36)
FOUL! Reach-in foul on Cole Simmons during the drive. [Team fouls: 3] No free throws, side out. (Cole Simmons: 1 personal fouls)

[04:45] Team_064 possession (Score: 49-36)
Ja Simmons attempts a 3Pt. Contested by Damian Towns (4.7 feet, MAN). Ja Simmons misses. Rebound secured by Damian Towns.

[04:31] Team_083 possession (Score: 49-36)
Zion Markkanen attempts a 3Pt. Contested by Austin Smith (4.7 feet, ZONE). ZION MARKKANEN MAKES IT! Assist: Victor McCollum
Score: 49-39

[04:14] Team_064 possession (Score: 49-39)
CJ Haliburton attempts a 3Pt. Contested by Zion Markkanen (5.7 feet, MAN). CJ Haliburton misses. Rebound secured by Cole Simmons.

[03:58] Team_083 possession (Score: 49-39)
Zion Markkanen drives and kicks out. Victor McCollum attempts a 3Pt. Contested by Devin Cunningham (5.2 feet, MAN). Victor McCollum misses. FOUL! Loose ball foul on Ja Simmons during the rebound battle. [IN THE BONUS! 6 team fouls] Victor McCollum to the line for 2 free throws. (Ja Simmons: 1 personal fouls)   FT 1/2: MISS   FT 2/2: GOOD Victor McCollum makes 1/2 from the line.
Score: 49-40

[03:43] Team_064 possession (Score: 49-40)
FOUL! Shooting foul on Damian Towns. Austin Smith to the line for 2 free throws. [Team fouls: 4] (Damian Towns: 1 personal fouls)   FT 1/2: MISS   FT 2/2: GOOD Austin Smith makes 1/2 from the line.
Score: 50-40

[03:30] Team_083 possession (Score: 50-40)
Domantas Doncic attempts a 3Pt. Wide open! Tobias Herro is 6.1 feet away. [MAN] Domantas Doncic misses. Rebound secured by Devin Cunningham.

[03:13] Team_064 possession (Score: 50-40)
Austin Smith drives and kicks out. Ja Simmons attempts a 3Pt. Contested by Damian Towns (4.9 feet, MAN). Ja Simmons misses. Rebound secured by Victor McCollum.

[03:02] Team_083 possession (Score: 50-40)
Victor McCollum attempts a 3Pt. Contested by Devin Cunningham (5.8 feet, MAN). Victor McCollum misses. Rebound secured by Ja Simmons.

[02:46] Team_064 possession (Score: 50-40)
Ja Simmons makes the Layup and draws the foul on Domantas Doncic! And-1! Ja Simmons to the line for 1. [BONUS: 5 team fouls] (Domantas Doncic: 1 personal fouls)   FT 1/1: GOOD Ja Simmons makes 1/1 from the line.
Score: 53-40

[02:28] Team_083 possession (Score: 53-40)
Zion Markkanen attempts a Layup. Wide open! CJ Haliburton is 6.2 feet away. [MAN] ZION MARKKANEN MAKES IT!
Score: 53-42

[02:11] Team_064 possession (Score: 53-42)
Ja Simmons attempts a Midrange. Contested by Domantas Doncic (4.3 feet, ZONE). Ja Simmons misses. Rebound secured by Cole Simmons.

[01:56] Team_083 possession (Score: 53-42)
Cole Simmons drives and kicks out. Victor McCollum attempts a 3Pt. Contested by Austin Smith (4.6 feet, ZONE). VICTOR MCCOLLUM MAKES IT! Assist: Zion Markkanen
Score: 53-45

[01:44] Team_064 possession (Score: 53-45)
Austin Smith drives, Cole Simmons stays with him. Austin Smith attempts a Dunk. Contested by Cole Simmons (4.4 feet, MAN). Austin Smith misses. Offensive rebound by Ja Simmons! Ja Simmons kicks it out.

[01:30] Team_064 possession (Score: 53-45)
Ja Simmons attempts a 3Pt. Contested by Damian Towns (4.7 feet, MAN). Ja Simmons misses. Offensive rebound by Ja Simmons! Ja Simmons kicks it out.

[01:19] Team_064 possession (Score: 53-45)
FOUL! Shooting foul on Zion Markkanen. CJ Haliburton to the line for 2 free throws. [BONUS: 6 team fouls] (Zion Markkanen: 1 personal fouls)   FT 1/2: GOOD   FT 2/2: GOOD CJ Haliburton makes 2/2 from the line.
Score: 55-45

[01:03] Team_083 possession (Score: 55-45)
Domantas Doncic attempts a 3Pt. Wide open! Tobias Herro is 6.1 feet away. [MAN] Domantas Doncic misses. Offensive rebound by Damian Towns! Damian Towns kicks it out.

[00:53] Team_083 possession (Score: 55-45)
Domantas Doncic attempts a Midrange. Wide open! Tobias Herro is 6.1 feet away. [MAN] Domantas Doncic misses. Offensive rebound by Damian Towns! Damian Towns kicks it out.

[00:38] Team_083 possession (Score: 55-45)
Damian Towns drives to the basket... Damian Towns commits a violation (traveling/carry)! TURNOVER! (dead ball)

[00:21] Team_064 possession (Score: 55-45)
Ja Simmons attempts a 3Pt. Contested by Zion Markkanen (5.2 feet, ZONE). Ja Simmons misses. Rebound secured by Cole Simmons.

[00:09] Team_083 possession (Score: 55-45)
Damian Towns throws a bad pass! Stolen by Ja Simmons! TURNOVER! (live ball)

================================================================================
                              2ND QUARTER COMPLETE                              
================================================================================

2ND QUARTER SCORE: Team_064 29, Team_083 20

BOX SCORE:
================================================================================

Team_064
--------------------------------------------------------------------------------
Player                MIN  PTS  REB  AST  TO      FG   FG%      3P   3P%
--------------------------------------------------------------------------------
Kawhi Irving           18    6    3    1   0   2/2   100.0     0/0   0.0
Ja Simmons              7    6    3    0   0   2/5    40.0     0/0   0.0
Shai Hyland            18    5    0    1   0   2/3    66.7     0/0   0.0
Russell Simons         18    3    1    1   0   1/1   100.0     0/0   0.0
Ja Mitchell            18    3    0    0   0   1/2    50.0     0/0   0.0
Devin Cunningham        7    3    2    0   0   1/1   100.0     0/0   0.0
CJ Haliburton           7    2    0    1   0   1/2    50.0     0/0   0.0
Austin Smith            7    1    0    0   0   1/3    33.3     0/0   0.0
Jordan Mitchell        18    0    2    1   0   0/1     0.0     0/0   0.0

TEAM: FG: 11/20 (55.0%), 3PT: 5/9 (55.6%), REB: 11 (4 off, 7 def), AST: 5, TO: 0
TEAM FOULS: 6 [Team_083 in BONUS]


Team_083
--------------------------------------------------------------------------------
Player                MIN  PTS  REB  AST  TO      FG   FG%      3P   3P%
--------------------------------------------------------------------------------
Kyrie Griffin          18    5    1    0   0   2/2   100.0     0/0   0.0
Zion Markkanen          7    5    0    2   0   2/2   100.0     0/0   0.0
Victor McCollum         7    4    1    1   0   2/4    50.0     0/0   0.0
Bradley Thompson       18    2    2    0   0   1/3    33.3     0/0   0.0
Yao Oladipo            18    2    1    0   0   1/1   100.0     0/0   0.0
Cole Simmons            7    2    4    0   0   1/1   100.0     0/0   0.0
Malcolm Brogdon        18    0    0    0   0   0/2     0.0     0/0   0.0
Damian Towns            7    0    4    0   0   0/0     0.0     0/0   0.0
Domantas Doncic         7    0    0    0   0   0/1     0.0     0/0   0.0

TEAM: FG: 9/16 (56.2%), 3PT: 1/4 (25.0%), REB: 13 (4 off, 9 def), AST: 3, TO: 4
TEAM FOULS: 6 [Team_064 in BONUS]

================================================================================

================================================================================
                       3RD QUARTER - Team_064 vs Team_083                       
================================================================================

[12:00] Team_064 possession (Score: 55-45)
Jordan Mitchell attempts a 3Pt. Contested by Karl Jokic (4.1 feet, MAN). Jordan Mitchell misses. Rebound secured by Bradley Thompson.

[11:46] Team_083 possession (Score: 55-45)
FOUL! Holding foul on Kawhi Irving. [Team fouls: 1] No free throws, side out. (Kawhi Irving: 1 personal fouls)

[11:34] Team_083 possession (Score: 55-45)
Karl Jokic makes the Dunk and draws the foul on Russell Simons! And-1! Karl Jokic to the line for 1. [Team fouls: 2] (Russell Simons: 1 personal fouls)   FT 1/1: MISS Karl Jokic makes 0/1 from the line. Offensive rebound by Bradley Thompson! Bradley Thompson's putback is no good.
Score: 55-47

[11:20] Team_064 possession (Score: 55-47)
Ja Mitchell attempts a Midrange. Contested by Malcolm Brogdon (5.1 feet, MAN). Ja Mitchell misses. Rebound secured by Kyrie Griffin.

[11:03] Team_083 possession (Score: 55-47)
Karl Jokic attempts a Midrange. Contested by Ja Mitchell (5.7 feet, ZONE). KARL JOKIC MAKES IT!
Score: 55-49

[10:47] Team_064 possession (Score: 55-49)
Kawhi Irving attempts a Midrange. Contested by Karl Jokic (4.5 feet, ZONE). Kawhi Irving misses. Offensive rebound by Kawhi Irving! Kawhi Irving kicks it out.

[10:31] Team_064 possession (Score: 55-49)
Jordan Mitchell attempts a Midrange. Contested by Karl Jokic (4.1 feet, MAN). Jordan Mitchell misses. Offensive rebound by Kawhi Irving! Kawhi Irving kicks it out.

[10:16] Team_064 possession (Score: 55-49)
Ja Mitchell drives, Malcolm Brogdon stays with him. Ja Mitchell attempts a Layup. Contested by Malcolm Brogdon (5.1 feet, MAN). Ja Mitchell misses. Rebound secured by Yao Oladipo.

[10:02] Team_083 possession (Score: 55-49)
Karl Jokic attempts a 3Pt. Contested by Ja Mitchell (5.7 feet, ZONE). Karl Jokic misses. Offensive rebound by Bradley Thompson! Bradley Thompson puts it back in!
Score: 55-51

[09:46] Team_064 possession (Score: 55-51)
Russell Simons attempts a 3Pt. Contested by Yao Oladipo (3.5 feet, ZONE). Russell Simons misses. Offensive rebound by Russell Simons! Russell Simons kicks it out.

[09:31] Team_064 possession (Score: 55-51)
Russell Simons drives to the basket... Russell Simons commits a violation (traveling/carry)! TURNOVER! (dead ball)

[09:19] Team_083 possession (Score: 55-51)
Karl Jokic attempts a 3Pt. Contested by Ja Mitchell (5.7 feet, ZONE). Karl Jokic misses. Rebound secured by Kawhi Irving.

[09:02] Team_064 possession (Score: 55-51)
Jordan Mitchell drives to the basket... FOUL! Offensive foul on Jordan Mitchell! Kyrie Griffin drew the charge! [Team fouls: 3] (Jordan Mitchell: 1 personal fouls) TURNOVER! (dead ball)

[08:49] Team_083 possession (Score: 55-51)
Malcolm Brogdon attempts a 3Pt. Contested by Ja Mitchell (4.8 feet, ZONE). MALCOLM BROGDON MAKES IT! Assist: Bradley Thompson
Score: 55-54

[08:33] Team_064 possession (Score: 55-54)
Kawhi Irving attempts a Midrange. Contested by Yao Oladipo (3.3 feet, MAN). KAWHI IRVING MAKES IT! Assist: Jordan Mitchell
Score: 57-54

[08:17] Team_083 possession (Score: 57-54)
Bradley Thompson drives and kicks out. Yao Oladipo makes the Midrange and draws the foul on Kawhi Irving! And-1! Yao Oladipo to the line for 1. [Team fouls: 4] (Kawhi Irving: 2 personal fouls)   FT 1/1: GOOD Yao Oladipo makes 1/1 from the line.
Score: 57-57

[08:03] Team_064 possession (Score: 57-57)
Ja Mitchell drives and kicks out. Shai Hyland attempts a Midrange. Contested by Kyrie Griffin (3.4 feet, ZONE). Shai Hyland misses. Rebound secured by Bradley Thompson.

[07:50] Team_083 possession (Score: 57-57)
Malcolm Brogdon attempts a 3Pt. Contested by Ja Mitchell (4.8 feet, ZONE). Malcolm Brogdon misses. Rebound secured by Kawhi Irving.

[07:37] Team_064 possession (Score: 57-57)
Russell Simons drives to the basket... Russell Simons throws a bad pass out of bounds! TURNOVER! (dead ball)

[07:21] Team_083 possession (Score: 57-57)
Bradley Thompson attempts a Midrange. Contested by Kawhi Irving (4.4 feet, ZONE). BRADLEY THOMPSON MAKES IT! Assist: Kyrie Griffin
Score: 57-59

[07:10] Team_064 possession (Score: 57-59)
FOUL! Reach-in foul on Kyrie Griffin during the drive. [Team fouls: 1] No free throws, side out. (Kyrie Griffin: 1 personal fouls)

[06:52] Team_064 possession (Score: 57-59)
Jordan Mitchell attempts a 3Pt. Contested by Yao Oladipo (2.9 feet, ZONE). JORDAN MITCHELL MAKES IT! Assist: Ja Mitchell
Score: 60-59

[06:36] Team_083 possession (Score: 60-59)
Bradley Thompson attempts a 3Pt. Contested by Ja Mitchell (5.3 feet, ZONE). Bradley Thompson misses. Rebound secured by Shai Hyland.

[06:20] Team_064 possession (Score: 60-59)
Shai Hyland makes the Dunk and draws the foul on Karl Jokic! And-1! Shai Hyland to the line for 1. [Team fouls: 2] (Karl Jokic: 1 personal fouls)   FT 1/1: GOOD Shai Hyland makes 1/1 from the line.
Score: 63-59

[06:06] Team_083 possession (Score: 63-59)
FOUL! Holding foul on Kawhi Irving. [IN THE BONUS! 5 team fouls] Yao Oladipo to the line for 2 free throws. (Kawhi Irving: 3 personal fouls)   FT 1/2: GOOD   FT 2/2: GOOD Yao Oladipo makes 2/2 from the line.
Score: 63-61

[05:54] Team_064 possession (Score: 63-61)
Shai Hyland attempts a 3Pt. Contested by Yao Oladipo (3.7 feet, ZONE). Shai Hyland misses. Rebound secured by Bradley Thompson.

[05:41] Team_083 possession (Score: 63-61)
FOUL! Reach-in foul on Russell Simons during the drive. [IN THE BONUS! 6 team fouls] Bradley Thompson to the line for 2 free throws. (Russell Simons: 2 personal fouls)   FT 1/2: GOOD   FT 2/2: GOOD Bradley Thompson makes 2/2 from the line.
Score: 63-63

[05:28] Team_064 possession (Score: 63-63)
Russell Simons attempts a 3Pt. Contested by Kyrie Griffin (3.5 feet, MAN). Russell Simons misses. FOUL! Loose ball foul on Yao Oladipo during the rebound battle. [Team fouls: 3] No free throws, side out. (Yao Oladipo: 1 personal fouls)

[05:13] Team_064 possession (Score: 63-63)
FOUL! Reach-in foul on Malcolm Brogdon during the drive. [Team fouls: 4] No free throws, side out. (Malcolm Brogdon: 1 personal fouls)

[05:01] Team_064 possession (Score: 63-63)
FOUL! Shooting foul on Yao Oladipo. Shai Hyland to the line for 2 free throws. [BONUS: 5 team fouls] (Yao Oladipo: 2 personal fouls)   FT 1/2: GOOD   FT 2/2: GOOD Shai Hyland makes 2/2 from the line.
Score: 65-63

[04:48] Team_083 possession (Score: 65-63)
Kyrie Griffin loses the ball! Stripped by Russell Simons! TURNOVER! (live ball)

[04:31] Team_064 possession (Score: 65-63)
Russell Simons attempts a Layup. BLOCKED BY KARL JOKIC! Ball goes out off Karl Jokic. Russell Simons's ball!

[04:19] Team_064 possession (Score: 65-63)
FOUL! Shooting foul on Karl Jokic. Jordan Mitchell to the line for 2 free throws. [BONUS: 6 team fouls] (Karl Jokic: 2 personal fouls)   FT 1/2: GOOD   FT 2/2: GOOD Jordan Mitchell makes 2/2 from the line.
Score: 67-63

[04:04] Team_083 possession (Score: 67-63)
Karl Jokic drives and kicks out. FOUL! Shooting foul on Ja Mitchell. Malcolm Brogdon to the line for 2 free throws. [BONUS: 7 team fouls] (Ja Mitchell: 1 personal fouls)   FT 1/2: MISS   FT 2/2: GOOD Malcolm Brogdon makes 1/2 from the line.
Score: 67-64

[03:47] Team_064 possession (Score: 67-64)
Ja Mitchell attempts a 3Pt. Contested by Malcolm Brogdon (5.2 feet, MAN). Ja Mitchell misses. Rebound secured by Kyrie Griffin.

[03:27] Team_083 possession (Score: 67-64)
FOUL! Holding foul on Shai Hyland. [IN THE BONUS! 8 team fouls] Bradley Thompson to the line for 2 free throws. (Shai Hyland: 1 personal fouls)   FT 1/2: GOOD   FT 2/2: GOOD Bradley Thompson makes 2/2 from the line.
Score: 67-66

[03:14] Team_064 possession (Score: 67-66)
Shai Hyland attempts a 3Pt. Contested by Bradley Thompson (4.2 feet, MAN). Shai Hyland misses. Rebound secured by Kyrie Griffin.

[03:01] Team_083 possession (Score: 67-66)
Malcolm Brogdon attempts a 3Pt. Contested by Ja Mitchell (5.0 feet, MAN). Malcolm Brogdon misses. Rebound secured by Russell Simons.

[02:47] Team_064 possession (Score: 67-66)
Russell Simons attempts a 3Pt. Contested by Yao Oladipo (3.7 feet, ZONE). Russell Simons misses. Rebound secured by Kyrie Griffin.

[02:34] Team_083 possession (Score: 67-66)
FOUL! Reach-in foul on Kawhi Irving during the drive. [IN THE BONUS! 9 team fouls] Yao Oladipo to the line for 2 free throws. (Kawhi Irving: 4 personal fouls)   FT 1/2: MISS   FT 2/2: GOOD Yao Oladipo makes 1/2 from the line.
Score: 67-67

[02:16] Team_064 possession (Score: 67-67)
FOUL! Reach-in foul on Yao Oladipo during the drive. [IN THE BONUS! 7 team fouls] Kawhi Irving to the line for 2 free throws. (Yao Oladipo: 3 personal fouls)   FT 1/2: GOOD   FT 2/2: GOOD Kawhi Irving makes 2/2 from the line.
Score: 69-67

[01:59] Team_083 possession (Score: 69-67)
FOUL! Holding foul on Russell Simons. [IN THE BONUS! 10 team fouls] Kyrie Griffin to the line for 2 free throws. (Russell Simons: 3 personal fouls)   FT 1/2: GOOD   FT 2/2: GOOD Kyrie Griffin makes 2/2 from the line.
Score: 69-69

[01:42] Team_064 possession (Score: 69-69)
Shai Hyland attempts a Midrange. Contested by Bradley Thompson (4.3 feet, MAN). Shai Hyland misses. Rebound secured by Bradley Thompson.

[01:28] Team_083 possession (Score: 69-69)
Yao Oladipo attempts a 3Pt. Contested by Ja Mitchell (5.8 feet, ZONE). Yao Oladipo misses. Rebound secured by Russell Simons.

[01:10] Team_064 possession (Score: 69-69)
Kawhi Irving attempts a 3Pt. Contested by Yao Oladipo (3.6 feet, MAN). Kawhi Irving misses. Rebound secured by Kyrie Griffin.

[00:56] Team_083 possession (Score: 69-69)
Kyrie Griffin attempts a 3Pt. Contested by Russell Simons (4.1 feet, MAN). KYRIE GRIFFIN MAKES IT! Assist: Malcolm Brogdon
Score: 69-72

[00:42] Team_064 possession (Score: 69-72)
Jordan Mitchell drives, Karl Jokic stays with him. Jordan Mitchell attempts a Dunk. Contested by Karl Jokic (4.5 feet, MAN). JORDAN MITCHELL MAKES IT! Assist: Ja Mitchell
Score: 71-72

[00:31] Team_083 possession (Score: 71-72)
Karl Jokic attempts a 3Pt. Wide open! Ja Mitchell is 6.1 feet away. [ZONE] KARL JOKIC MAKES IT! Assist: Malcolm Brogdon
Score: 71-75

[00:17] Team_064 possession (Score: 71-75)
Ja Mitchell attempts a Layup. Contested by Malcolm Brogdon (5.5 feet, MAN). JA MITCHELL MAKES IT! Assist: Russell Simons
Score: 73-75

[00:02] Team_083 possession (Score: 73-75)
Malcolm Brogdon attempts a Layup. Contested by Russell Simons (3.6 feet, ZONE). Malcolm Brogdon misses. Rebound secured by Russell Simons.

================================================================================
                              3RD QUARTER COMPLETE                              
================================================================================

3RD QUARTER SCORE: Team_064 18, Team_083 30

BOX SCORE:
================================================================================

Team_064
--------------------------------------------------------------------------------
Player                MIN  PTS  REB  AST  TO      FG   FG%      3P   3P%
--------------------------------------------------------------------------------
Jordan Mitchell        30    7    0    1   0   3/4    75.0     0/0   0.0
Shai Hyland            30    5    1    0   0   2/5    40.0     0/0   0.0
Kawhi Irving           30    4    4    0   0   2/3    66.7     0/0   0.0
Ja Mitchell            30    2    0    2   0   1/5    20.0     0/0   0.0
Russell Simons         30    0    5    1   0   0/1     0.0     0/0   0.0

TEAM: FG: 8/18 (44.4%), 3PT: 1/7 (14.3%), REB: 11 (4 off, 7 def), AST: 4, TO: 3
TEAM FOULS: 10 [Team_083 in BONUS]


Team_083
--------------------------------------------------------------------------------
Player                MIN  PTS  REB  AST  TO      FG   FG%      3P   3P%
--------------------------------------------------------------------------------
Bradley Thompson       30    8    6    1   0   4/5    80.0     0/0   0.0
Yao Oladipo            30    6    1    0   0   3/4    75.0     0/0   0.0
Karl Jokic             30    5    0    0   0   2/4    50.0     0/0   0.0
Kyrie Griffin          30    5    5    1   0   2/2   100.0     0/0   0.0
Malcolm Brogdon        30    4    0    2   0   2/5    40.0     0/0   0.0

TEAM: FG: 13/20 (65.0%), 3PT: 4/9 (44.4%), REB: 11 (1 off, 10 def), AST: 4, TO: 1
TEAM FOULS: 7 [Team_064 in BONUS]

================================================================================

================================================================================
                       4TH QUARTER - Team_064 vs Team_083                       
================================================================================

[12:00] Team_064 possession (Score: 73-75)
Jordan Mitchell attempts a Layup. BLOCKED BY KYRIE GRIFFIN! Ball deflects out of bounds off Jordan Mitchell.

[11:41] Team_083 possession (Score: 73-75)
FOUL! Shooting foul on Jordan Mitchell. Malcolm Brogdon to the line for 2 free throws. [Team fouls: 1] (Jordan Mitchell: 1 personal fouls)   FT 1/2: MISS   FT 2/2: GOOD Malcolm Brogdon makes 1/2 from the line.
Score: 73-76

[11:28] Team_064 possession (Score: 73-76)
Jordan Mitchell attempts a Midrange. Contested by Karl Jokic (4.4 feet, MAN). Jordan Mitchell misses. Rebound secured by Kyrie Griffin.

[11:16] Team_083 possession (Score: 73-76)
Yao Oladipo attempts a 3Pt. Contested by Ja Mitchell (5.8 feet, ZONE). Yao Oladipo misses. FOUL! Loose ball foul on Shai Hyland during the rebound battle. [Team fouls: 2] No free throws, side out. (Shai Hyland: 1 personal fouls)

[10:59] Team_083 possession (Score: 73-76)
Yao Oladipo attempts a 3Pt. Contested by Ja Mitchell (5.8 feet, ZONE). Yao Oladipo misses. Rebound secured by Kawhi Irving.

[10:44] Team_064 possession (Score: 73-76)
Russell Simons drives to the basket... FOUL! Offensive foul on Russell Simons! Kyrie Griffin drew the charge! [Team fouls: 3] (Russell Simons: 1 personal fouls) TURNOVER! (dead ball)

[10:29] Team_083 possession (Score: 73-76)
Malcolm Brogdon attempts a Layup. Contested by Russell Simons (3.6 feet, ZONE). Malcolm Brogdon misses. Offensive rebound by Bradley Thompson! Bradley Thompson kicks it out.

[10:11] Team_083 possession (Score: 73-76)
FOUL! Shooting foul on Russell Simons. Bradley Thompson to the line for 2 free throws. [Team fouls: 4] (Russell Simons: 2 personal fouls)   FT 1/2: MISS   FT 2/2: MISS Bradley Thompson makes 0/2 from the line. Rebound secured by Russell Simons.

[09:53] Team_064 possession (Score: 73-76)
Ja Mitchell attempts a 3Pt. Contested by Malcolm Brogdon (5.5 feet, MAN). Ja Mitchell misses. Rebound secured by Yao Oladipo.

[09:38] Team_083 possession (Score: 73-76)
FOUL! Holding foul on Russell Simons. [IN THE BONUS! 5 team fouls] Kyrie Griffin to the line for 2 free throws. (Russell Simons: 3 personal fouls)   FT 1/2: GOOD   FT 2/2: GOOD Kyrie Griffin makes 2/2 from the line.
Score: 73-78

[09:24] Team_064 possession (Score: 73-78)
Russell Simons attempts a Midrange. Contested by Kyrie Griffin (4.1 feet, MAN). RUSSELL SIMONS MAKES IT! Assist: Jordan Mitchell
Score: 75-78

[09:08] Team_083 possession (Score: 75-78)
Yao Oladipo attempts a 3Pt. Contested by Kawhi Irving (5.1 feet, MAN). Yao Oladipo misses. Rebound secured by Kawhi Irving.

[08:51] Team_064 possession (Score: 75-78)
FOUL! Reach-in foul on Kyrie Griffin during the drive. [Team fouls: 1] No free throws, side out. (Kyrie Griffin: 1 personal fouls)

[08:38] Team_064 possession (Score: 75-78)
Jordan Mitchell attempts a Layup. Contested by Karl Jokic (4.7 feet, MAN). Jordan Mitchell misses. Rebound secured by Kyrie Griffin.

[08:23] Team_083 possession (Score: 75-78)
Malcolm Brogdon drives, picks up Ja Mitchell. Help arrives from Jordan Mitchell! Malcolm Brogdon attempts a Layup. Contested by Jordan Mitchell (5.5 feet, MAN). MALCOLM BROGDON MAKES IT! Assist: Bradley Thompson
Score: 75-80

[08:09] Team_064 possession (Score: 75-80)
Ja Mitchell attempts a 3Pt. Contested by Malcolm Brogdon (5.7 feet, MAN). Ja Mitchell misses. Rebound secured by Kyrie Griffin.

[07:50] Team_083 possession (Score: 75-80)
Karl Jokic attempts a 3Pt. Wide open! Ja Mitchell is 6.3 feet away. [ZONE] Karl Jokic misses. Offensive rebound by Bradley Thompson! Bradley Thompson kicks it out.

[07:34] Team_083 possession (Score: 75-80)
Kyrie Griffin drives, picks up Russell Simons. Help arrives from Jordan Mitchell! Kyrie Griffin attempts a Layup. Contested by Jordan Mitchell (4.6 feet, ZONE). KYRIE GRIFFIN MAKES IT! Assist: Bradley Thompson
Score: 75-82

[07:20] Team_064 possession (Score: 75-82)
FOUL! Shooting foul on Kyrie Griffin. Russell Simons to the line for 2 free throws. [Team fouls: 2] (Kyrie Griffin: 2 personal fouls)   FT 1/2: MISS   FT 2/2: GOOD Russell Simons makes 1/2 from the line.
Score: 76-82

[07:06] Team_083 possession (Score: 76-82)
Kyrie Griffin attempts a Midrange. BLOCKED BY RUSSELL SIMONS! Ball is loose! Rebound secured by Russell Simons.

[06:53] Team_064 possession (Score: 76-82)
FOUL! Shooting foul on Malcolm Brogdon. Ja Mitchell to the line for 3 free throws. [Team fouls: 3] (Malcolm Brogdon: 1 personal fouls)   FT 1/3: GOOD   FT 2/3: MISS   FT 3/3: MISS Ja Mitchell makes 1/3 from the line. Rebound secured by Yao Oladipo.
Score: 77-82

[06:37] Team_083 possession (Score: 77-82)
Yao Oladipo drives, picks up Kawhi Irving. Help arrives from Jordan Mitchell! Yao Oladipo attempts a Layup. Contested by Jordan Mitchell (5.4 feet, MAN). YAO OLADIPO MAKES IT! Assist: Karl Jokic
Score: 77-84

[06:21] Team_064 possession (Score: 77-84)
Russell Simons attempts a 3Pt. Contested by Yao Oladipo (4.4 feet, ZONE). Russell Simons misses. Rebound secured by Bradley Thompson.

[06:05] Team_083 possession (Score: 77-84)
Malcolm Brogdon attempts a 3Pt. Contested by Russell Simons (4.3 feet, ZONE). Malcolm Brogdon misses. Offensive rebound by Bradley Thompson! Bradley Thompson kicks it out.

[05:50] Team_083 possession (Score: 77-84)
Karl Jokic attempts a Midrange. Contested by Jordan Mitchell (5.4 feet, MAN). KARL JOKIC MAKES IT!
Score: 77-86

[05:40] Team_064 possession (Score: 77-86)
Jordan Mitchell attempts a Midrange. Contested by Yao Oladipo (4.0 feet, ZONE). Jordan Mitchell misses. Rebound secured by Yao Oladipo.

[05:24] Team_083 possession (Score: 77-86)
Yao Oladipo attempts a 3Pt. Contested by Kawhi Irving (5.6 feet, MAN). YAO OLADIPO MAKES IT! Assist: Malcolm Brogdon
Score: 77-89

[05:13] Team_064 possession (Score: 77-89)
FOUL! Reach-in foul on Malcolm Brogdon during the drive. [Team fouls: 4] No free throws, side out. (Malcolm Brogdon: 2 personal fouls)

[05:00] Team_064 possession (Score: 77-89)
Shai Hyland loses control! Ball rolls out of bounds! TURNOVER! (dead ball)

[05:00] Substitution (Team_064): Ja Mitchell OUT → CJ Haliburton IN (stamina_rule2)

[05:00] Substitution (Team_064): Jordan Mitchell OUT → Ja Simmons IN (stamina_rule2)

[05:00] Substitution (Team_064): Kawhi Irving OUT → Tobias Herro IN (stamina_rule2)

[05:00] Substitution (Team_064): Russell Simons OUT → Austin Smith IN (stamina_rule2)

[05:00] Substitution (Team_064): Shai Hyland OUT → Devin Cunningham IN (stamina_rule2)

[05:00] Substitution (Team_083): Malcolm Brogdon OUT → Zion Markkanen IN (stamina_rule2)

[05:00] Substitution (Team_083): Karl Jokic OUT → Damian Towns IN (stamina_rule2)

[05:00] Substitution (Team_083): Yao Oladipo OUT → Domantas Doncic IN (stamina_rule2)

[05:00] Substitution (Team_083): Kyrie Griffin OUT → Cole Simmons IN (stamina_rule2)

[05:00] Substitution (Team_083): Bradley Thompson OUT → Victor McCollum IN (stamina_rule2)

[04:45] Team_083 possession (Score: 77-89)
Damian Towns attempts a 3Pt. Contested by Austin Smith (5.1 feet, ZONE). Damian Towns misses. Rebound secured by Ja Simmons.

[04:33] Team_064 possession (Score: 77-89)
CJ Haliburton attempts a 3Pt. Contested by Zion Markkanen (5.7 feet, ZONE). CJ Haliburton misses. Rebound secured by Victor McCollum.

[04:20] Team_083 possession (Score: 77-89)
Zion Markkanen makes the Layup and draws the foul on CJ Haliburton! And-1! Zion Markkanen to the line for 1. [BONUS: 6 team fouls] (CJ Haliburton: 1 personal fouls)   FT 1/1: GOOD Zion Markkanen makes 1/1 from the line.
Score: 77-92

[04:09] Team_064 possession (Score: 77-92)
Tobias Herro drives and kicks out. Devin Cunningham attempts a 3Pt. Contested by Victor McCollum (4.0 feet, MAN). Devin Cunningham misses. Offensive rebound by Ja Simmons! Ja Simmons kicks it out.

[03:59] Team_064 possession (Score: 77-92)
CJ Haliburton attempts a Midrange. Contested by Zion Markkanen (5.7 feet, MAN). CJ HALIBURTON MAKES IT! Assist: Tobias Herro
Score: 79-92

[03:46] Team_083 possession (Score: 79-92)
Domantas Doncic attempts a Midrange. Contested by Ja Simmons (5.7 feet, ZONE). Domantas Doncic misses. Rebound secured by Austin Smith.

[03:36] Team_064 possession (Score: 79-92)
Ja Simmons drives, Damian Towns stays with him. Ja Simmons attempts a Layup. Contested by Damian Towns (4.7 feet, MAN). Ja Simmons misses. Rebound secured by Victor McCollum.

[03:23] Team_083 possession (Score: 79-92)
Domantas Doncic attempts a Midrange. Wide open! Tobias Herro is 6.1 feet away. [MAN] DOMANTAS DONCIC MAKES IT! Assist: Zion Markkanen
Score: 79-94

[03:11] Team_064 possession (Score: 79-94)
Tobias Herro attempts a 3Pt. Contested by Zion Markkanen (4.9 feet, ZONE). Tobias Herro misses. Rebound secured by Cole Simmons.

[03:01] Team_083 possession (Score: 79-94)
Zion Markkanen attempts a Midrange. Wide open! CJ Haliburton is 6.2 feet away. [MAN] Zion Markkanen misses. Rebound secured by Austin Smith.

[02:44] Team_064 possession (Score: 79-94)
FOUL! Shooting foul on Victor McCollum. Devin Cunningham to the line for 3 free throws. [BONUS: 5 team fouls] (Victor McCollum: 1 personal fouls)   FT 1/3: MISS   FT 2/3: GOOD   FT 3/3: MISS Devin Cunningham makes 1/3 from the line. Rebound secured by Victor McCollum.
Score: 80-94

[02:32] Team_083 possession (Score: 80-94)
FOUL! Offensive foul on Cole Simmons! Austin Smith drew the charge! [Team fouls: 6] (Cole Simmons: 1 personal fouls) TURNOVER! (dead ball)

[02:19] Team_064 possession (Score: 80-94)
FOUL! Shooting foul on Victor McCollum. Devin Cunningham to the line for 2 free throws. [BONUS: 7 team fouls] (Victor McCollum: 2 personal fouls)   FT 1/2: MISS   FT 2/2: GOOD Devin Cunningham makes 1/2 from the line.
Score: 81-94

[02:05] Team_083 possession (Score: 81-94)
Zion Markkanen attempts a Layup. Wide open! CJ Haliburton is 6.2 feet away. [MAN] Zion Markkanen misses. Rebound secured by Ja Simmons.

[01:48] Team_064 possession (Score: 81-94)
Ja Simmons attempts a 3Pt. Contested by Damian Towns (4.7 feet, MAN). Ja Simmons misses. Offensive rebound by Ja Simmons! Ja Simmons kicks it out.

[01:30] Team_064 possession (Score: 81-94)
FOUL! Offensive foul on Austin Smith! Cole Simmons drew the charge! [Team fouls: 7] (Austin Smith: 1 personal fouls) TURNOVER! (dead ball)

[01:16] Team_083 possession (Score: 81-94)
Victor McCollum drives and kicks out. Zion Markkanen attempts a 3Pt. Contested by CJ Haliburton (6.0 feet, MAN). Zion Markkanen misses. Offensive rebound by Victor McCollum! Victor McCollum puts it back in!
Score: 81-96

[01:05] Team_064 possession (Score: 81-96)
Devin Cunningham drives and kicks out. CJ Haliburton attempts a 3Pt. Contested by Zion Markkanen (5.4 feet, MAN). CJ Haliburton misses. FOUL! Loose ball foul on Damian Towns during the rebound battle. [IN THE BONUS! 8 team fouls] Ja Simmons to the line for 2 free throws. (Damian Towns: 1 personal fouls)   FT 1/2: MISS   FT 2/2: GOOD Ja Simmons makes 1/2 from the line.
Score: 82-96

[00:54] Team_083 possession (Score: 82-96)
Cole Simmons attempts a 3Pt. Contested by Austin Smith (4.5 feet, MAN). Cole Simmons misses. Rebound secured by Austin Smith.

[00:40] Team_064 possession (Score: 82-96)
Ja Simmons attempts a Midrange. Contested by Damian Towns (4.7 feet, MAN). JA SIMMONS MAKES IT! Assist: CJ Haliburton
Score: 84-96

[00:21] Team_083 possession (Score: 84-96)
Damian Towns drives, Austin Smith stays with him. Damian Towns attempts a Dunk. Contested by Austin Smith (5.1 feet, ZONE). DAMIAN TOWNS MAKES IT! Assist: Victor McCollum
Score: 84-98

[00:07] Team_064 possession (Score: 84-98)
Devin Cunningham attempts a 3Pt. Contested by Zion Markkanen (5.2 feet, ZONE). DEVIN CUNNINGHAM MAKES IT! Assist: Ja Simmons
Score: 87-98

================================================================================
                              4TH QUARTER COMPLETE                              
================================================================================

4TH QUARTER SCORE: Team_064 14, Team_083 23

BOX SCORE:
================================================================================

Team_064
--------------------------------------------------------------------------------
Player                MIN  PTS  REB  AST  TO      FG   FG%      3P   3P%
--------------------------------------------------------------------------------
Devin Cunningham       11    4    0    0   0   2/3    66.7     0/0   0.0
Russell Simons         37    3    2    0   0   2/3    66.7     0/0   0.0
Ja Simmons             11    3    4    1   0   2/3    66.7     0/0   0.0
CJ Haliburton          11    2    0    1   0   1/2    50.0     0/0   0.0
Jordan Mitchell        37    0    0    1   0   0/4     0.0     0/0   0.0
Kawhi Irving           37    0    2    0   0   0/0     0.0     0/0   0.0
Ja Mitchell            37    0    0    0   0   0/3     0.0     0/0   0.0
Tobias Herro           11    0    0    1   0   0/1     0.0     0/0   0.0
Austin Smith           11    0    3    0   0   0/0     0.0     0/0   0.0

TEAM: FG: 7/19 (36.8%), 3PT: 1/8 (12.5%), REB: 11 (2 off, 9 def), AST: 4, TO: 3
TEAM FOULS: 7 [Team_083 in BONUS]


Team_083
--------------------------------------------------------------------------------
Player                MIN  PTS  REB  AST  TO      FG   FG%      3P   3P%
--------------------------------------------------------------------------------
Yao Oladipo            37    5    3    0   0   2/4    50.0     0/0   0.0
Kyrie Griffin          37    4    3    0   0   2/3    66.7     0/0   0.0
Malcolm Brogdon        37    3    0    1   0   2/2   100.0     0/0   0.0
Zion Markkanen         11    3    0    1   0   1/3    33.3     0/0   0.0
Karl Jokic             37    2    0    1   0   1/1   100.0     0/0   0.0
Damian Towns           11    2    0    0   0   1/2    50.0     0/0   0.0
Victor McCollum        11    2    4    1   0   1/1   100.0     0/0   0.0
Domantas Doncic        11    2    0    0   0   1/2    50.0     0/0   0.0
Bradley Thompson       37    0    5    2   0   0/1     0.0     0/0   0.0
Cole Simmons           11    0    1    0   0   0/1     0.0     0/0   0.0

TEAM: FG: 11/20 (55.0%), 3PT: 1/5 (20.0%), REB: 16 (5 off, 11 def), AST: 6, TO: 1
TEAM FOULS: 8 [Team_064 in BONUS]

================================================================================

================================================================================
                               FULL GAME COMPLETE                               
================================================================================

FINAL SCORE: Team_064 87, Team_083 98

SCORING BY QUARTER:
--------------------------------------------------------------------------------
Team                     Q1     Q2     Q3     Q4    FINAL
--------------------------------------------------------------------------------
Team_064                 26     29     18     14       87
Team_083                 25     20     30     23       98
--------------------------------------------------------------------------------

FULL GAME BOX SCORE:
================================================================================

Team_064
--------------------------------------------------------------------------------
Player                MIN  PTS  REB  AST  TO      FG   FG%      3P   3P%      FT STL BLK
--------------------------------------------------------------------------------
Ja Mitchell            37    7    0    2   0   3/12   25.0   1/6    16.7   4/6     0   0
Jordan Mitchell        37   12    2    5   2   5/16   31.2   1/6    16.7   5/5     0   0
Kawhi Irving           37   16   14    2   2   6/9    66.7   2/3    66.7   5/7     0   0
Russell Simons         37   12   13    3   0   8/12   66.7   1/3    33.3   1/2     2   1
Shai Hyland            37   12    4    1   2   4/10   40.0   0/2     0.0   3/4     0   0
CJ Haliburton          11    4    0    2   0   2/4    50.0   0/2     0.0   2/2     0   0
Ja Simmons             11    9    7    1   0   3/7    42.9   1/3    33.3   2/3     1   0
Tobias Herro           11    0    0    1   0   0/1     0.0   0/1     0.0   0/0     0   0
Austin Smith           11    1    3    0   1   1/3    33.3   0/0     0.0   1/2     1   0
Devin Cunningham       11    7    2    0   0   4/5    80.0   1/2    50.0   3/6     0   0

TEAM: FG: 36/79 (45.6%), 3PT: 7/28 (25.0%), REB: 46 (13 off, 33 def), AST: 17, TO: 7


Team_083
--------------------------------------------------------------------------------
Player                MIN  PTS  REB  AST  TO      FG   FG%      3P   3P%      FT STL BLK
--------------------------------------------------------------------------------
Malcolm Brogdon        37    7    0    5   0   3/11   27.3   1/5    20.0   2/4     0   0
Karl Jokic             37   12    0    4   0   7/11   63.6   3/4    75.0   0/1     0   1
Yao Oladipo            37   24    9    0   0   7/14   50.0   4/9    44.4   6/7     0   0
Kyrie Griffin          37   19   13    1   3   6/7    85.7   2/2   100.0   5/5     0   2
Bradley Thompson       37   14   17    6   1   6/11   54.5   0/1     0.0   6/8     1   0
Zion Markkanen         11    8    0    3   0   4/6    66.7   1/1   100.0   1/1     0   0
Damian Towns           11    2    4    0   2   1/2    50.0   0/1     0.0   0/0     0   0
Domantas Doncic        11    2    0    0   0   1/3    33.3   0/1     0.0   0/0     0   0
Cole Simmons           11    2    5    0   1   2/3    66.7   0/1     0.0   0/0     0   0
Victor McCollum        11    6    5    2   1   1/3    33.3   0/1     0.0   1/2     0   0

TEAM: FG: 43/76 (56.6%), 3PT: 11/26 (42.3%), REB: 52 (10 off, 42 def), AST: 21, TO: 8

================================================================================
