================================================================================
                        FULL GAME - Team_055 vs Team_003                        
================================================================================

================================================================================
                       1ST QUARTER - Team_055 vs Team_003                       
================================================================================

[12:00] Team_055 possession (Score: 0-0)
Shaquille Herro attempts a 3Pt. Contested by Nikola Bryant (4.2 feet, MAN). Shaquille Herro misses. Rebound secured by Rudy Haliburton.

[11:49] Team_003 possession (Score: 0-0)
Nikola Bryant drives and kicks out. FOUL! Shooting foul on Jrue Sabonis. Victor O'Neal to the line for 2 free throws. [Team fouls: 1] (Jrue Sabonis: 1 personal fouls)   FT 1/2: MISS   FT 2/2: GOOD Victor O'Neal makes 1/2 from the line.
Score: 0-1

[11:37] Team_055 possession (Score: 0-1)
Devin Siakam attempts a Layup. Contested by Giannis Turner (2.9 feet, ZONE). DEVIN SIAKAM MAKES IT!
Score: 2-1

[11:22] Team_003 possession (Score: 2-1)
FOUL! Reach-in foul on Chris Turner during the drive. [Team fouls: 2] No free throws, side out. (Chris Turner: 1 personal fouls)

[11:09] Team_003 possession (Score: 2-1)
Victor O'Neal attempts a 3Pt. Contested by Kevin Bane (4.0 feet, ZONE). Victor O'Neal misses. Rebound secured by Chris Turner.

[10:54] Team_055 possession (Score: 2-1)
Kevin Bane attempts a 3Pt. Contested by Giannis Turner (3.1 feet, ZONE). Kevin Bane misses. Rebound secured by Victor O'Neal.

[10:39] Team_003 possession (Score: 2-1)
Ayo Jackson drives, Devin Siakam stays with him. Ayo Jackson attempts a Dunk. Contested by Devin Siakam (5.5 feet, MAN). AYO JACKSON MAKES IT! Assist: Nikola Bryant
Score: 2-3

[10:24] Team_055 possession (Score: 2-3)
FOUL! Shooting foul on Victor O'Neal. Kevin Bane to the line for 2 free throws. [Team fouls: 1] (Victor O'Neal: 1 personal fouls)   FT 1/2: GOOD   FT 2/2: GOOD Kevin Bane makes 2/2 from the line.
Score: 4-3

[10:10] Team_003 possession (Score: 4-3)
Giannis Turner attempts a 3Pt. Contested by Chris Turner (3.2 feet, MAN). GIANNIS TURNER MAKES IT! Assist: Rudy Haliburton
Score: 4-6

[09:59] Team_055 possession (Score: 4-6)
Devin Siakam drives and kicks out. Jrue Sabonis attempts a Midrange. BLOCKED BY GIANNIS TURNER! Ball is loose! Rebound secured by Victor O'Neal.

[09:45] Team_003 possession (Score: 4-6)
Ayo Jackson attempts a 3Pt. Contested by Kevin Bane (4.3 feet, ZONE). Ayo Jackson misses. Rebound secured by Chris Turner.

[09:33] Team_055 possession (Score: 4-6)
Kevin Bane attempts a Midrange. Contested by Ayo Jackson (5.6 feet, ZONE). KEVIN BANE MAKES IT! Assist: Devin Siakam
Score: 6-6

[09:20] Team_003 possession (Score: 6-6)
Ayo Jackson attempts a Midrange. Contested by Devin Siakam (5.5 feet, MAN). Ayo Jackson misses. FOUL! Loose ball foul on Chris Turner during the rebound battle. [Team fouls: 3] No free throws, side out. (Chris Turner: 2 personal fouls)

[09:03] Team_003 possession (Score: 6-6)
Rudy Haliburton attempts a Layup. Contested by Chris Turner (3.0 feet, ZONE). Rudy Haliburton misses. Rebound secured by Kevin Bane.

[08:50] Team_055 possession (Score: 6-6)
Devin Siakam makes the Midrange and draws the foul on Ayo Jackson! And-1! Devin Siakam to the line for 1. [Team fouls: 2] (Ayo Jackson: 1 personal fouls)   FT 1/1: GOOD Devin Siakam makes 1/1 from the line.
Score: 9-6

[08:33] Team_003 possession (Score: 9-6)
Rudy Haliburton drives, picks up Kevin Bane. Help arrives from Shaquille Herro! Rudy Haliburton attempts a Dunk. Contested by Shaquille Herro (4.1 feet, MAN). Rudy Haliburton misses. Rebound secured by Kevin Bane.

[08:20] Team_055 possession (Score: 9-6)
FOUL! Offensive foul on Kevin Bane! Rudy Haliburton drew the charge! [Team fouls: 4] (Kevin Bane: 1 personal fouls) TURNOVER! (dead ball)

[08:10] Team_003 possession (Score: 9-6)
Giannis Turner attempts a Layup. BLOCKED BY CHRIS TURNER! Ball deflects out of bounds off Giannis Turner.

[07:52] Team_055 possession (Score: 9-6)
Kevin Bane drives and kicks out. Chris Turner attempts a 3Pt. Contested by Giannis Turner (2.8 feet, MAN). Chris Turner misses. Rebound secured by Giannis Turner.

[07:38] Team_003 possession (Score: 9-6)
Nikola Bryant drives to the basket... Nikola Bryant loses the ball! Stripped by Shaquille Herro! TURNOVER! (live ball)

[07:24] Team_055 possession (Score: 9-6)
Chris Turner drives and kicks out. Shaquille Herro attempts a 3Pt. Contested by Giannis Turner (2.8 feet, ZONE). Shaquille Herro misses. Offensive rebound by Jrue Sabonis! Jrue Sabonis kicks it out.

[07:10] Team_055 possession (Score: 9-6)
Chris Turner drives and kicks out. Jrue Sabonis attempts a 3Pt. Contested by Giannis Turner (2.8 feet, MAN). Jrue Sabonis misses. Rebound secured by Rudy Haliburton.

[06:52] Team_003 possession (Score: 9-6)
Rudy Haliburton attempts a 3Pt. Contested by Kevin Bane (4.1 feet, ZONE). Rudy Haliburton misses. Rebound secured by Chris Turner.

[06:39] Team_055 possession (Score: 9-6)
Kevin Bane attempts a Midrange. Contested by Giannis Turner (3.1 feet, ZONE). Kevin Bane misses. Rebound secured by Victor O'Neal.

[06:28] Team_003 possession (Score: 9-6)
Giannis Turner drives, Chris Turner stays with him. Giannis Turner attempts a Dunk. Contested by Chris Turner (3.2 feet, MAN). GIANNIS TURNER MAKES IT!
Score: 9-8

[06:16] Team_055 possession (Score: 9-8)
Jrue Sabonis attempts a 3Pt. Contested by Giannis Turner (2.9 feet, ZONE). Jrue Sabonis misses. Rebound secured by Giannis Turner.

[06:07] Team_003 possession (Score: 9-8)
FOUL! Shooting foul on Chris Turner. Giannis Turner to the line for 2 free throws. [BONUS: 5 team fouls] (Chris Turner: 3 personal fouls)   FT 1/2: MISS   FT 2/2: GOOD Giannis Turner makes 1/2 from the line.
Score: 9-9

[05:56] Team_055 possession (Score: 9-9)
Chris Turner drives and kicks out. Chris Turner attempts a Midrange. Contested by Giannis Turner (2.8 feet, MAN). CHRIS TURNER MAKES IT!
Score: 11-9

[05:42] Team_003 possession (Score: 11-9)
Rudy Haliburton attempts a 3Pt. Contested by Kevin Bane (4.1 feet, ZONE). Rudy Haliburton misses. Rebound secured by Chris Turner.

[05:28] Team_055 possession (Score: 11-9)
Kevin Bane attempts a Layup. Contested by Giannis Turner (3.2 feet, ZONE). KEVIN BANE MAKES IT! Assist: Devin Siakam
Score: 13-9

[05:15] Team_003 possession (Score: 13-9)
Nikola Bryant attempts a 3Pt. Contested by Shaquille Herro (3.9 feet, MAN). NIKOLA BRYANT MAKES IT!
Score: 13-12

[04:57] Team_055 possession (Score: 13-12)
Shaquille Herro drives to the basket... Shaquille Herro throws a bad pass out of bounds! TURNOVER! (dead ball)

[04:41] Team_003 possession (Score: 13-12)
Giannis Turner throws a bad pass! Stolen by Chris Turner! TURNOVER! (live ball)

[04:25] Team_055 possession (Score: 13-12)
FOUL! Reach-in foul on Giannis Turner during the drive. [Team fouls: 3] No free throws, side out. (Giannis Turner: 1 personal fouls)

[04:10] Team_055 possession (Score: 13-12)
Kevin Bane attempts a 3Pt. Contested by Giannis Turner (3.3 feet, ZONE). Kevin Bane misses. Offensive rebound by Jrue Sabonis! Jrue Sabonis kicks it out.

[03:55] Team_055 possession (Score: 13-12)
Chris Turner drives, Giannis Turner stays with him. Chris Turner attempts a Layup. Contested by Giannis Turner (3.2 feet, MAN). Chris Turner misses. Offensive rebound by Jrue Sabonis! Jrue Sabonis kicks it out.

[03:41] Team_055 possession (Score: 13-12)
Shaquille Herro drives and kicks out. Chris Turner attempts a Midrange. Contested by Giannis Turner (3.0 feet, MAN). Chris Turner misses. Rebound secured by Victor O'Neal.

[03:27] Team_003 possession (Score: 13-12)
Giannis Turner attempts a 3Pt. Contested by Kevin Bane (4.4 feet, ZONE). Giannis Turner misses. Offensive rebound by Victor O'Neal! Victor O'Neal kicks it out.

[03:16] Team_003 possession (Score: 13-12)
Ayo Jackson attempts a Midrange. Contested by Devin Siakam (5.7 feet, MAN). AYO JACKSON MAKES IT! Assist: Rudy Haliburton
Score: 13-14

[03:02] Team_055 possession (Score: 13-14)
Kevin Bane attempts a 3Pt. Contested by Rudy Haliburton (3.8 feet, MAN). Kevin Bane misses. Rebound secured by Victor O'Neal.

[02:44] Team_003 possession (Score: 13-14)
Giannis Turner attempts a Midrange. Contested by Kevin Bane (4.5 feet, ZONE). Giannis Turner misses. Offensive rebound by Victor O'Neal! Victor O'Neal kicks it out.

[02:28] Team_003 possession (Score: 13-14)
FOUL! Shooting foul on Chris Turner. Giannis Turner to the line for 2 free throws. [BONUS: 6 team fouls] (Chris Turner: 4 personal fouls)   FT 1/2: GOOD   FT 2/2: GOOD Giannis Turner makes 2/2 from the line.
Score: 13-16

[02:16] Team_055 possession (Score: 13-16)
Jrue Sabonis makes the Layup and draws the foul on Victor O'Neal! And-1! Jrue Sabonis to the line for 1. [Team fouls: 4] (Victor O'Neal: 2 personal fouls)   FT 1/1: GOOD Jrue Sabonis makes 1/1 from the line.
Score: 16-16

[02:02] Team_003 possession (Score: 16-16)
Ayo Jackson attempts a 3Pt. Contested by Devin Siakam (5.8 feet, MAN). Ayo Jackson misses. Rebound secured by Chris Turner.

[01:49] Team_055 possession (Score: 16-16)
Devin Siakam attempts a 3Pt. Contested by Giannis Turner (3.2 feet, ZONE). Devin Siakam misses. Rebound secured by Rudy Haliburton.

[01:36] Team_003 possession (Score: 16-16)
Nikola Bryant makes the Layup and draws the foul on Chris Turner! And-1! Nikola Bryant to the line for 1. [BONUS: 7 team fouls] (Chris Turner: 5 personal fouls)   FT 1/1: GOOD Nikola Bryant makes 1/1 from the line.
Score: 16-19

[01:18] Team_055 possession (Score: 16-19)
Devin Siakam attempts a 3Pt. Contested by Giannis Turner (3.3 feet, ZONE). DEVIN SIAKAM MAKES IT! Assist: Chris Turner
Score: 19-19

[01:06] Team_003 possession (Score: 19-19)
Rudy Haliburton makes the Layup and draws the foul on Kevin Bane! And-1! Rudy Haliburton to the line for 1. [BONUS: 8 team fouls] (Kevin Bane: 2 personal fouls)   FT 1/1: MISS Rudy Haliburton makes 0/1 from the line. Rebound secured by Jrue Sabonis.
Score: 19-21

[00:49] Team_055 possession (Score: 19-21)
Devin Siakam attempts a 3Pt. Contested by Ayo Jackson (5.7 feet, MAN). Devin Siakam misses. Offensive rebound by Jrue Sabonis! Jrue Sabonis kicks it out.

[00:37] Team_055 possession (Score: 19-21)
Kevin Bane attempts a 3Pt. Contested by Giannis Turner (3.7 feet, ZONE). KEVIN BANE MAKES IT! Assist: Jrue Sabonis
Score: 22-21

[00:20] Team_003 possession (Score: 22-21)
Nikola Bryant makes the Dunk and draws the foul on Devin Siakam! And-1! Nikola Bryant to the line for 1. [BONUS: 9 team fouls] (Devin Siakam: 1 personal fouls)   FT 1/1: GOOD Nikola Bryant makes 1/1 from the line.
Score: 22-24

[00:05] Team_055 possession (Score: 22-24)
Devin Siakam attempts a 3Pt. Contested by Rudy Haliburton (3.8 feet, ZONE). Devin Siakam misses. Rebound secured by Victor O'Neal.

================================================================================
                              1ST QUARTER COMPLETE                              
================================================================================

1ST QUARTER SCORE: Team_055 22, Team_003 24

BOX SCORE:
================================================================================

Team_055
--------------------------------------------------------------------------------
Player                MIN  PTS  REB  AST  TO      FG   FG%      3P   3P%
--------------------------------------------------------------------------------
Kevin Bane             12    9    2    0   0   4/8    50.0     0/0   0.0
Devin Siakam           12    8    0    2   0   3/6    50.0     0/0   0.0
Jrue Sabonis           12    3    5    1   0   1/2    50.0     0/0   0.0
Chris Turner           12    2    5    1   0   1/2    50.0     0/0   0.0
Shaquille Herro        12    0    0    0   0   0/2     0.0     0/0   0.0

TEAM: FG: 9/20 (45.0%), 3PT: 2/8 (25.0%), REB: 12 (4 off, 8 def), AST: 4, TO: 2
TEAM FOULS: 9 [Team_003 in BONUS]


Team_003
--------------------------------------------------------------------------------
Player                MIN  PTS  REB  AST  TO      FG   FG%      3P   3P%
--------------------------------------------------------------------------------
Nikola Bryant          12    9    0    1   0   3/3   100.0     0/0   0.0
Giannis Turner         12    8    2    0   0   4/5    80.0     0/0   0.0
Ayo Jackson            12    4    0    0   0   2/4    50.0     0/0   0.0
Victor O'Neal          12    1    8    0   0   1/2    50.0     0/0   0.0
Rudy Haliburton        12    0    4    2   0   0/5     0.0     0/0   0.0

TEAM: FG: 10/19 (52.6%), 3PT: 2/7 (28.6%), REB: 14 (3 off, 11 def), AST: 3, TO: 2
TEAM FOULS: 4

================================================================================

================================================================================
                       2ND QUARTER - Team_055 vs Team_003                       
================================================================================

[12:00] Team_055 possession (Score: 22-24)
Kevin Bane attempts a 3Pt. Contested by Giannis Turner (3.5 feet, ZONE). Kevin Bane misses. Rebound secured by Victor O'Neal.

[11:46] Team_003 possession (Score: 22-24)
Rudy Haliburton attempts a Midrange. Contested by Jrue Sabonis (4.7 feet, ZONE). RUDY HALIBURTON MAKES IT!
Score: 22-26

[11:32] Team_055 possession (Score: 22-26)
Chris Turner drives, picks up Giannis Turner. Help arrives from Nikola Bryant! Chris Turner attempts a Dunk. Contested by Nikola Bryant (3.4 feet, ZONE). CHRIS TURNER MAKES IT!
Score: 24-26

[11:16] Team_003 possession (Score: 24-26)
Victor O'Neal attempts a 3Pt. Contested by Chris Turner (3.4 feet, MAN). Victor O'Neal misses. Offensive rebound by Victor O'Neal! Victor O'Neal kicks it out.

[11:00] Team_003 possession (Score: 24-26)
Nikola Bryant attempts a 3Pt. Contested by Kevin Bane (4.6 feet, ZONE). NIKOLA BRYANT MAKES IT! Assist: Rudy Haliburton
Score: 24-29

[10:45] Team_055 possession (Score: 24-29)
Devin Siakam attempts a Layup. BLOCKED BY RUDY HALIBURTON! Ball is loose! Rebound secured by Giannis Turner.

[10:29] Team_003 possession (Score: 24-29)
Ayo Jackson makes the Dunk and draws the foul on Chris Turner! And-1! Ayo Jackson to the line for 1. [Team fouls: 1] (Chris Turner: 1 personal fouls)   FT 1/1: GOOD Ayo Jackson makes 1/1 from the line.
Score: 24-32

[10:16] Team_055 possession (Score: 24-32)
Devin Siakam attempts a 3Pt. Contested by Ayo Jackson (5.8 feet, MAN). DEVIN SIAKAM MAKES IT! Assist: Shaquille Herro
Score: 27-32

[10:03] Team_003 possession (Score: 27-32)
Giannis Turner makes the Layup and draws the foul on Chris Turner! And-1! Giannis Turner to the line for 1. [Team fouls: 2] (Chris Turner: 2 personal fouls)   FT 1/1: GOOD Giannis Turner makes 1/1 from the line.
Score: 27-35

[09:48] Team_055 possession (Score: 27-35)
Jrue Sabonis drives and kicks out. Devin Siakam attempts a 3Pt. Contested by Ayo Jackson (5.9 feet, ZONE). Devin Siakam misses. Offensive rebound by Kevin Bane! Kevin Bane kicks it out.

[09:36] Team_055 possession (Score: 27-35)
Devin Siakam attempts a Layup. Contested by Ayo Jackson (5.8 feet, MAN). DEVIN SIAKAM MAKES IT! Assist: Shaquille Herro
Score: 29-35

[09:18] Team_003 possession (Score: 29-35)
FOUL! Reach-in foul on Devin Siakam during the drive. [Team fouls: 3] No free throws, side out. (Devin Siakam: 1 personal fouls)

[09:01] Team_003 possession (Score: 29-35)
Giannis Turner attempts a Midrange. Contested by Jrue Sabonis (5.3 feet, ZONE). GIANNIS TURNER MAKES IT!
Score: 29-37

[08:47] Team_055 possession (Score: 29-37)
Kevin Bane attempts a Midrange. Contested by Giannis Turner (4.0 feet, ZONE). Kevin Bane misses. Rebound secured by Rudy Haliburton.

[08:36] Team_003 possession (Score: 29-37)
FOUL! Shooting foul on Shaquille Herro. Rudy Haliburton to the line for 2 free throws. [Team fouls: 4] (Shaquille Herro: 1 personal fouls)   FT 1/2: GOOD   FT 2/2: GOOD Rudy Haliburton makes 2/2 from the line.
Score: 29-39

[08:20] Team_055 possession (Score: 29-39)
Kevin Bane commits a violation (traveling/carry)! TURNOVER! (dead ball)

[08:20] Substitution (Team_055): Devin Siakam OUT → Luka Wall IN (stamina_rule2)

[08:20] Substitution (Team_055): Shaquille Herro OUT → Dirk Duncan IN (stamina_rule2)

[08:20] Substitution (Team_055): Kevin Bane OUT → Kyle Wall IN (stamina_rule2)

[08:20] Substitution (Team_055): Jrue Sabonis OUT → Malcolm Williamson IN (stamina_rule2)

[08:20] Substitution (Team_055): Chris Turner OUT → D'Angelo Antetokounmpo IN (stamina_rule2)

[08:20] Substitution (Team_003): Ayo Jackson OUT → Miles Towns IN (stamina_rule2)

[08:20] Substitution (Team_003): Nikola Bryant OUT → Pau Williamson IN (stamina_rule2)

[08:20] Substitution (Team_003): Rudy Haliburton OUT → Collin Mitchell IN (stamina_rule2)

[08:20] Substitution (Team_003): Giannis Turner OUT → Anfernee Jordan IN (stamina_rule2)

[08:20] Substitution (Team_003): Victor O'Neal OUT → Bam Gilgeous-Alexander IN (stamina_rule2)

[08:03] Team_003 possession (Score: 29-39)
Miles Towns attempts a 3Pt. Contested by Kyle Wall (4.1 feet, ZONE). Miles Towns misses. Rebound secured by Malcolm Williamson.

[07:50] Team_055 possession (Score: 29-39)
Kyle Wall attempts a 3Pt. Contested by Collin Mitchell (4.1 feet, MAN). KYLE WALL MAKES IT!
Score: 32-39

[07:35] Team_003 possession (Score: 32-39)
Anfernee Jordan attempts a Midrange. Contested by Malcolm Williamson (3.8 feet, MAN). Anfernee Jordan misses. Rebound secured by D'Angelo Antetokounmpo.

[07:18] Team_055 possession (Score: 32-39)
Malcolm Williamson attempts a Midrange. Contested by Bam Gilgeous-Alexander (3.3 feet, MAN). Malcolm Williamson misses. Rebound secured by Bam Gilgeous-Alexander.

[07:01] Team_003 possession (Score: 32-39)
Pau Williamson attempts a Midrange. Contested by Dirk Duncan (5.6 feet, ZONE). Pau Williamson misses. Offensive rebound by Bam Gilgeous-Alexander! Bam Gilgeous-Alexander's putback is no good. Rebound secured by Dirk Duncan.

[06:47] Team_055 possession (Score: 32-39)
Luka Wall attempts a Midrange. Contested by Miles Towns (5.3 feet, MAN). LUKA WALL MAKES IT!
Score: 34-39

[06:35] Team_003 possession (Score: 34-39)
Miles Towns attempts a Midrange. Contested by Luka Wall (5.6 feet, ZONE). Miles Towns misses. Rebound secured by Malcolm Williamson.

[06:23] Team_055 possession (Score: 34-39)
Dirk Duncan drives, Pau Williamson stays with him. Dirk Duncan attempts a Layup. Contested by Pau Williamson (4.7 feet, MAN). DIRK DUNCAN MAKES IT! Assist: Kyle Wall
Score: 36-39

[06:09] Team_003 possession (Score: 36-39)
Collin Mitchell attempts a 3Pt. Contested by Kyle Wall (4.4 feet, ZONE). Collin Mitchell misses. Rebound secured by Dirk Duncan.

[05:52] Team_055 possession (Score: 36-39)
Dirk Duncan drives, Bam Gilgeous-Alexander stays with him. Dirk Duncan attempts a Dunk. Contested by Bam Gilgeous-Alexander (2.6 feet, ZONE). Dirk Duncan misses. Offensive rebound by D'Angelo Antetokounmpo! D'Angelo Antetokounmpo puts it back in!
Score: 38-39

[05:38] Team_003 possession (Score: 38-39)
Pau Williamson attempts a 3Pt. Contested by Dirk Duncan (5.6 feet, MAN). Pau Williamson misses. Offensive rebound by Bam Gilgeous-Alexander! Bam Gilgeous-Alexander puts it back in!
Score: 38-41

[05:22] Team_055 possession (Score: 38-41)
Kyle Wall drives, Bam Gilgeous-Alexander stays with him. Kyle Wall attempts a Dunk. Contested by Bam Gilgeous-Alexander (3.0 feet, ZONE). KYLE WALL MAKES IT!
Score: 40-41

[05:06] Team_003 possession (Score: 40-41)
Bam Gilgeous-Alexander drives, picks up D'Angelo Antetokounmpo. Help arrives from Dirk Duncan! Bam Gilgeous-Alexander attempts a Dunk. Contested by Dirk Duncan (5.1 feet, MAN). BAM GILGEOUS-ALEXANDER MAKES IT! Assist: Anfernee Jordan
Score: 40-43

[04:53] Team_055 possession (Score: 40-43)
Dirk Duncan attempts a 3Pt. Contested by Pau Williamson (4.7 feet, MAN). Dirk Duncan misses. Offensive rebound by D'Angelo Antetokounmpo! D'Angelo Antetokounmpo's putback is no good. Offensive rebound by D'Angelo Antetokounmpo! D'Angelo Antetokounmpo kicks it out.

[04:43] Team_055 possession (Score: 40-43)
Malcolm Williamson attempts a Layup. BLOCKED BY BAM GILGEOUS-ALEXANDER! Ball is loose! Rebound secured by Anfernee Jordan.

[04:29] Team_003 possession (Score: 40-43)
Bam Gilgeous-Alexander makes the Dunk and draws the foul on Malcolm Williamson! And-1! Bam Gilgeous-Alexander to the line for 1. [BONUS: 5 team fouls] (Malcolm Williamson: 1 personal fouls)   FT 1/1: GOOD Bam Gilgeous-Alexander makes 1/1 from the line.
Score: 40-46

[04:14] Team_055 possession (Score: 40-46)
Dirk Duncan attempts a 3Pt. Contested by Pau Williamson (4.7 feet, MAN). Dirk Duncan misses. Rebound secured by Anfernee Jordan.

[04:01] Team_003 possession (Score: 40-46)
Pau Williamson attempts a 3Pt. Contested by Kyle Wall (4.1 feet, ZONE). Pau Williamson misses. Rebound secured by Dirk Duncan.

[03:48] Team_055 possession (Score: 40-46)
Dirk Duncan drives and kicks out. Dirk Duncan attempts a Midrange. Contested by Pau Williamson (5.1 feet, MAN). DIRK DUNCAN MAKES IT!
Score: 42-46

[03:32] Team_003 possession (Score: 42-46)
Anfernee Jordan attempts a Midrange. Contested by Malcolm Williamson (3.8 feet, ZONE). Anfernee Jordan misses. Rebound secured by D'Angelo Antetokounmpo.

[03:18] Team_055 possession (Score: 42-46)
Malcolm Williamson attempts a Midrange. Contested by Bam Gilgeous-Alexander (3.3 feet, MAN). MALCOLM WILLIAMSON MAKES IT!
Score: 44-46

[03:07] Team_003 possession (Score: 44-46)
Collin Mitchell attempts a Layup. Contested by Malcolm Williamson (4.2 feet, ZONE). COLLIN MITCHELL MAKES IT! Assist: Miles Towns
Score: 44-48

[02:53] Team_055 possession (Score: 44-48)
Kyle Wall drives to the basket... Kyle Wall loses control! Ball rolls out of bounds! TURNOVER! (dead ball)

[02:38] Team_003 possession (Score: 44-48)
Collin Mitchell attempts a Layup. BLOCKED BY DIRK DUNCAN! Ball is loose! Rebound secured by D'Angelo Antetokounmpo.

[02:24] Team_055 possession (Score: 44-48)
Malcolm Williamson attempts a Midrange. Contested by Bam Gilgeous-Alexander (3.3 feet, MAN). MALCOLM WILLIAMSON MAKES IT!
Score: 46-48

[02:05] Team_003 possession (Score: 46-48)
Anfernee Jordan drives, picks up Malcolm Williamson. Help arrives from Dirk Duncan! Anfernee Jordan attempts a Dunk. Contested by Dirk Duncan (3.8 feet, MAN). ANFERNEE JORDAN MAKES IT! Assist: Miles Towns
Score: 46-50

[01:48] Team_055 possession (Score: 46-50)
Malcolm Williamson attempts a Layup. BLOCKED BY PAU WILLIAMSON! Ball is loose! Rebound secured by Collin Mitchell.

[01:35] Team_003 possession (Score: 46-50)
FOUL! Reach-in foul on Luka Wall during the drive. [IN THE BONUS! 6 team fouls] Miles Towns to the line for 2 free throws. (Luka Wall: 1 personal fouls)   FT 1/2: GOOD   FT 2/2: GOOD Miles Towns makes 2/2 from the line.
Score: 46-52

[01:18] Team_055 possession (Score: 46-52)
Kyle Wall makes the Midrange and draws the foul on Collin Mitchell! And-1! Kyle Wall to the line for 1. [Team fouls: 1] (Collin Mitchell: 1 personal fouls)   FT 1/1: GOOD Kyle Wall makes 1/1 from the line.
Score: 49-52

[01:04] Team_003 possession (Score: 49-52)
FOUL! Reach-in foul on D'Angelo Antetokounmpo during the drive. [IN THE BONUS! 7 team fouls] Bam Gilgeous-Alexander to the line for 2 free throws. (D'Angelo Antetokounmpo: 1 personal fouls)   FT 1/2: GOOD   FT 2/2: GOOD Bam Gilgeous-Alexander makes 2/2 from the line.
Score: 49-54

[00:52] Team_055 possession (Score: 49-54)
Kyle Wall makes the Midrange and draws the foul on Collin Mitchell! And-1! Kyle Wall to the line for 1. [Team fouls: 2] (Collin Mitchell: 2 personal fouls)   FT 1/1: GOOD Kyle Wall makes 1/1 from the line.
Score: 52-54

[00:40] Team_003 possession (Score: 52-54)
Anfernee Jordan attempts a Midrange. Contested by Malcolm Williamson (3.9 feet, MAN). Anfernee Jordan misses. Rebound secured by Malcolm Williamson.

[00:23] Team_055 possession (Score: 52-54)
FOUL! Holding foul on Collin Mitchell. [Team fouls: 3] No free throws, side out. (Collin Mitchell: 3 personal fouls)

[00:04] Team_055 possession (Score: 52-54)
Kyle Wall drives and kicks out. Malcolm Williamson attempts a Midrange. Contested by Bam Gilgeous-Alexander (3.1 feet, MAN). Malcolm Williamson misses. FOUL! Loose ball foul on Bam Gilgeous-Alexander during the rebound battle. [Team fouls: 4] No free throws, side out. (Bam Gilgeous-Alexander: 1 personal fouls)

================================================================================
                              2ND QUARTER COMPLETE                              
================================================================================

2ND QUARTER SCORE: Team_055 30, Team_003 30

BOX SCORE:
================================================================================

Team_055
--------------------------------------------------------------------------------
Player                MIN  PTS  REB  AST  TO      FG   FG%      3P   3P%
--------------------------------------------------------------------------------
Kyle Wall               8   11    0    1   0   4/4   100.0     0/0   0.0
Devin Siakam           16    5    0    0   0   2/3    66.7     0/0   0.0
Malcolm Williamson      8    4    4    0   0   2/5    40.0     0/0   0.0
Dirk Duncan             8    4    3    0   0   2/3    66.7     0/0   0.0
Chris Turner           16    2    0    0   0   1/1   100.0     0/0   0.0
D'Angelo Antetokounmpo    8    2    5    0   0   1/1   100.0     0/0   0.0
Luka Wall               8    2    0    0   0   1/1   100.0     0/0   0.0
Kevin Bane             16    0    1    0   0   0/2     0.0     0/0   0.0
Shaquille Herro        16    0    0    2   0   0/0     0.0     0/0   0.0

TEAM: FG: 13/20 (65.0%), 3PT: 2/4 (50.0%), REB: 12 (4 off, 8 def), AST: 3, TO: 2
TEAM FOULS: 7 [Team_003 in BONUS]


Team_003
--------------------------------------------------------------------------------
Player                MIN  PTS  REB  AST  TO      FG   FG%      3P   3P%
--------------------------------------------------------------------------------
Bam Gilgeous-Alexander    8    9    2    0   0   4/4   100.0     0/0   0.0
Giannis Turner         16    5    1    0   0   2/2   100.0     0/0   0.0
Rudy Haliburton        16    4    1    1   0   2/2   100.0     0/0   0.0
Nikola Bryant          16    3    0    0   0   1/1   100.0     0/0   0.0
Ayo Jackson            16    3    0    0   0   1/1   100.0     0/0   0.0
Miles Towns             8    2    0    2   0   1/3    33.3     0/0   0.0
Anfernee Jordan         8    2    2    1   0   1/4    25.0     0/0   0.0
Collin Mitchell         8    2    1    0   0   1/3    33.3     0/0   0.0
Victor O'Neal          16    0    2    0   0   0/0     0.0     0/0   0.0
Pau Williamson          8    0    0    0   0   0/2     0.0     0/0   0.0

TEAM: FG: 13/22 (59.1%), 3PT: 2/5 (40.0%), REB: 10 (3 off, 7 def), AST: 4, TO: 0
TEAM FOULS: 4

================================================================================

================================================================================
                       3RD QUARTER - Team_055 vs Team_003                       
================================================================================

[12:00] Team_055 possession (Score: 52-54)
FOUL! Shooting foul on Giannis Turner. Chris Turner to the line for 2 free throws. [Team fouls: 1] (Giannis Turner: 1 personal fouls)   FT 1/2: MISS   FT 2/2: GOOD Chris Turner makes 1/2 from the line.
Score: 53-54

[11:46] Team_003 possession (Score: 53-54)
Ayo Jackson commits a violation (traveling/carry)! TURNOVER! (dead ball)

[11:29] Team_055 possession (Score: 53-54)
Devin Siakam attempts a Layup. Contested by Giannis Turner (2.9 feet, ZONE). Devin Siakam misses. Offensive rebound by Chris Turner! Chris Turner puts it back in!
Score: 55-54

[11:13] Team_003 possession (Score: 55-54)
Nikola Bryant attempts a 3Pt. Contested by Kevin Bane (4.3 feet, ZONE). NIKOLA BRYANT MAKES IT! Assist: Victor O'Neal
Score: 55-57

[10:58] Team_055 possession (Score: 55-57)
Chris Turner attempts a Layup. Contested by Giannis Turner (3.0 feet, MAN). CHRIS TURNER MAKES IT!
Score: 57-57

[10:48] Team_003 possession (Score: 57-57)
Victor O'Neal drives and kicks out. Victor O'Neal attempts a 3Pt. Contested by Chris Turner (2.9 feet, MAN). Victor O'Neal misses. Rebound secured by Jrue Sabonis.

[10:30] Team_055 possession (Score: 57-57)
Jrue Sabonis attempts a Midrange. Contested by Giannis Turner (2.9 feet, MAN). Jrue Sabonis misses. Offensive rebound by Chris Turner! Chris Turner's putback is no good. Offensive rebound by Jrue Sabonis! Jrue Sabonis kicks it out.

[10:11] Team_055 possession (Score: 57-57)
Kevin Bane attempts a 3Pt. Contested by Giannis Turner (3.1 feet, ZONE). KEVIN BANE MAKES IT! Assist: Chris Turner
Score: 60-57

[10:01] Team_003 possession (Score: 60-57)
FOUL! Reach-in foul on Shaquille Herro during the drive. [Team fouls: 1] No free throws, side out. (Shaquille Herro: 1 personal fouls)

[09:50] Team_003 possession (Score: 60-57)
Nikola Bryant attempts a Midrange. Contested by Jrue Sabonis (4.5 feet, ZONE). Nikola Bryant misses. Offensive rebound by Rudy Haliburton! Rudy Haliburton's putback is no good. Offensive rebound by Victor O'Neal! Victor O'Neal kicks it out.

[09:31] Team_003 possession (Score: 60-57)
Rudy Haliburton drives, picks up Chris Turner. Help arrives from Shaquille Herro! Rudy Haliburton attempts a Dunk. Contested by Shaquille Herro (3.0 feet, ZONE). RUDY HALIBURTON MAKES IT! Assist: Giannis Turner
Score: 60-59

[09:16] Team_055 possession (Score: 60-59)
FOUL! Offensive foul on Shaquille Herro! Nikola Bryant drew the charge! [Team fouls: 3] (Shaquille Herro: 2 personal fouls) TURNOVER! (dead ball)

[09:04] Team_003 possession (Score: 60-59)
Victor O'Neal attempts a Layup. Contested by Chris Turner (2.9 feet, ZONE). VICTOR O'NEAL MAKES IT! Assist: Rudy Haliburton
Score: 60-61

[08:46] Team_055 possession (Score: 60-61)
Chris Turner throws a bad pass out of bounds! TURNOVER! (dead ball)

[08:32] Team_003 possession (Score: 60-61)
Victor O'Neal attempts a Midrange. Contested by Chris Turner (2.9 feet, MAN). Victor O'Neal misses. Rebound secured by Chris Turner.

[08:15] Team_055 possession (Score: 60-61)
Shaquille Herro attempts a 3Pt. Contested by Nikola Bryant (4.2 feet, MAN). SHAQUILLE HERRO MAKES IT! Assist: Jrue Sabonis
Score: 63-61

[08:05] Team_003 possession (Score: 63-61)
FOUL! Shooting foul on Chris Turner. Victor O'Neal to the line for 3 free throws. [Team fouls: 4] (Chris Turner: 1 personal fouls)   FT 1/3: GOOD   FT 2/3: GOOD   FT 3/3: GOOD Victor O'Neal makes 3/3 from the line.
Score: 63-64

[07:53] Team_055 possession (Score: 63-64)
Devin Siakam attempts a Midrange. Contested by Rudy Haliburton (3.3 feet, ZONE). Devin Siakam misses. Offensive rebound by Chris Turner! Chris Turner puts it back in!
Score: 65-64

[07:37] Team_003 possession (Score: 65-64)
Ayo Jackson drives and kicks out. Victor O'Neal attempts a 3Pt. Contested by Kevin Bane (4.0 feet, ZONE). Victor O'Neal misses. Rebound secured by Jrue Sabonis.

[07:26] Team_055 possession (Score: 65-64)
Chris Turner attempts a Midrange. Contested by Giannis Turner (3.0 feet, ZONE). CHRIS TURNER MAKES IT!
Score: 67-64

[07:09] Team_003 possession (Score: 67-64)
Victor O'Neal attempts a Layup. Contested by Chris Turner (2.9 feet, ZONE). VICTOR O'NEAL MAKES IT!
Score: 67-66

[06:55] Team_055 possession (Score: 67-66)
Kevin Bane drives and kicks out. Jrue Sabonis attempts a Midrange. Contested by Giannis Turner (2.8 feet, ZONE). JRUE SABONIS MAKES IT! Assist: Devin Siakam
Score: 69-66

[06:41] Team_003 possession (Score: 69-66)
Rudy Haliburton attempts a Midrange. Contested by Jrue Sabonis (4.2 feet, ZONE). RUDY HALIBURTON MAKES IT! Assist: Ayo Jackson
Score: 69-68

[06:25] Team_055 possession (Score: 69-68)
Kevin Bane drives and kicks out. Jrue Sabonis attempts a 3Pt. Contested by Giannis Turner (2.8 feet, ZONE). Jrue Sabonis misses. Offensive rebound by Chris Turner! Chris Turner puts it back in!
Score: 71-68

[06:10] Team_003 possession (Score: 71-68)
Rudy Haliburton attempts a Layup. Contested by Chris Turner (3.0 feet, ZONE). RUDY HALIBURTON MAKES IT!
Score: 71-70

[06:00] Team_055 possession (Score: 71-70)
Chris Turner drives and kicks out. Chris Turner attempts a 3Pt. Contested by Giannis Turner (2.8 feet, ZONE). Chris Turner misses. Rebound secured by Victor O'Neal.

[05:45] Team_003 possession (Score: 71-70)
Nikola Bryant attempts a Layup. Contested by Shaquille Herro (3.9 feet, MAN). NIKOLA BRYANT MAKES IT! Assist: Ayo Jackson
Score: 71-72

[05:34] Team_055 possession (Score: 71-72)
Jrue Sabonis drives, Giannis Turner stays with him. Jrue Sabonis attempts a Dunk. Contested by Giannis Turner (2.9 feet, MAN). JRUE SABONIS MAKES IT! Assist: Devin Siakam
Score: 73-72

[05:16] Team_003 possession (Score: 73-72)
FOUL! Shooting foul on Chris Turner. Giannis Turner to the line for 2 free throws. [BONUS: 5 team fouls] (Chris Turner: 2 personal fouls)   FT 1/2: GOOD   FT 2/2: MISS Giannis Turner makes 1/2 from the line. Rebound secured by Jrue Sabonis.
Score: 73-73

[05:04] Team_055 possession (Score: 73-73)
Chris Turner drives, Giannis Turner stays with him. Chris Turner attempts a Dunk. Contested by Giannis Turner (3.1 feet, MAN). CHRIS TURNER MAKES IT!
Score: 75-73

[04:49] Team_003 possession (Score: 75-73)
Rudy Haliburton attempts a Layup. Contested by Kevin Bane (4.1 feet, MAN). RUDY HALIBURTON MAKES IT! Assist: Nikola Bryant
Score: 75-75

[04:35] Team_055 possession (Score: 75-75)
Shaquille Herro attempts a 3Pt. Contested by Giannis Turner (3.1 feet, ZONE). Shaquille Herro misses. Rebound secured by Giannis Turner.

[04:19] Team_003 possession (Score: 75-75)
Ayo Jackson attempts a Layup. Contested by Chris Turner (3.3 feet, ZONE). Ayo Jackson misses. Offensive rebound by Victor O'Neal! Victor O'Neal kicks it out.

[04:00] Team_003 possession (Score: 75-75)
Nikola Bryant attempts a Layup. Contested by Chris Turner (3.3 feet, ZONE). NIKOLA BRYANT MAKES IT! Assist: Ayo Jackson
Score: 75-77

[03:46] Team_055 possession (Score: 75-77)
Jrue Sabonis attempts a Midrange. Contested by Giannis Turner (3.0 feet, MAN). Jrue Sabonis misses. Rebound secured by Giannis Turner.

[03:31] Team_003 possession (Score: 75-77)
Giannis Turner attempts a Midrange. Contested by Chris Turner (3.4 feet, MAN). Giannis Turner misses. Rebound secured by Kevin Bane.

[03:22] Team_055 possession (Score: 75-77)
Chris Turner loses the ball! Stripped by Giannis Turner! TURNOVER! (live ball)

[03:03] Team_003 possession (Score: 75-77)
Rudy Haliburton attempts a 3Pt. Contested by Kevin Bane (4.2 feet, MAN). Rudy Haliburton misses. Offensive rebound by Rudy Haliburton! Rudy Haliburton kicks it out.

[02:51] Team_003 possession (Score: 75-77)
Victor O'Neal attempts a Midrange. Contested by Jrue Sabonis (4.4 feet, ZONE). Victor O'Neal misses. Rebound secured by Jrue Sabonis.

[02:35] Team_055 possession (Score: 75-77)
Shaquille Herro attempts a 3Pt. Contested by Nikola Bryant (4.5 feet, MAN). SHAQUILLE HERRO MAKES IT! Assist: Kevin Bane
Score: 78-77

[02:23] Team_003 possession (Score: 78-77)
Victor O'Neal attempts a Midrange. Contested by Chris Turner (3.2 feet, MAN). Victor O'Neal misses. FOUL! Loose ball foul on Kevin Bane during the rebound battle. [IN THE BONUS! 6 team fouls] Victor O'Neal to the line for 2 free throws. (Kevin Bane: 2 personal fouls)   FT 1/2: GOOD   FT 2/2: MISS Victor O'Neal makes 1/2 from the line. Rebound secured by Kevin Bane.
Score: 78-78

[02:07] Team_055 possession (Score: 78-78)
Shaquille Herro attempts a 3Pt. Contested by Giannis Turner (3.3 feet, ZONE). SHAQUILLE HERRO MAKES IT! Assist: Chris Turner
Score: 81-78

[01:53] Team_003 possession (Score: 81-78)
Victor O'Neal attempts a Midrange. Contested by Devin Siakam (5.5 feet, ZONE). VICTOR O'NEAL MAKES IT! Assist: Rudy Haliburton
Score: 81-80

[01:42] Team_055 possession (Score: 81-80)
Shaquille Herro attempts a Midrange. Contested by Nikola Bryant (4.6 feet, MAN). SHAQUILLE HERRO MAKES IT! Assist: Jrue Sabonis
Score: 83-80

[01:29] Team_003 possession (Score: 83-80)
Rudy Haliburton attempts a Layup. Contested by Chris Turner (3.4 feet, ZONE). Rudy Haliburton misses. Rebound secured by Kevin Bane.

[01:18] Team_055 possession (Score: 83-80)
Shaquille Herro attempts a Midrange. Contested by Nikola Bryant (4.6 feet, ZONE). SHAQUILLE HERRO MAKES IT! Assist: Kevin Bane
Score: 85-80

[01:02] Team_003 possession (Score: 85-80)
Victor O'Neal attempts a 3Pt. Contested by Chris Turner (3.4 feet, MAN). Victor O'Neal misses. Rebound secured by Kevin Bane.

[00:49] Team_055 possession (Score: 85-80)
Jrue Sabonis attempts a Layup. Contested by Giannis Turner (3.4 feet, MAN). JRUE SABONIS MAKES IT! Assist: Chris Turner
Score: 87-80

[00:33] Team_003 possession (Score: 87-80)
Rudy Haliburton attempts a 3Pt. Contested by Kevin Bane (4.4 feet, ZONE). Rudy Haliburton misses. Rebound secured by Chris Turner.

[00:24] Team_055 possession (Score: 87-80)
Devin Siakam drives and kicks out. Kevin Bane attempts a Midrange. Contested by Rudy Haliburton (3.8 feet, MAN). KEVIN BANE MAKES IT! Assist: Shaquille Herro
Score: 89-80

[00:09] Team_003 possession (Score: 89-80)
Ayo Jackson attempts a Layup. Contested by Chris Turner (3.8 feet, ZONE). AYO JACKSON MAKES IT!
Score: 89-82

================================================================================
                              3RD QUARTER COMPLETE                              
================================================================================

3RD QUARTER SCORE: Team_055 37, Team_003 28

BOX SCORE:
================================================================================

Team_055
--------------------------------------------------------------------------------
Player                MIN  PTS  REB  AST  TO      FG   FG%      3P   3P%
--------------------------------------------------------------------------------
Chris Turner           28   13    5    3   0   7/8    87.5     0/0   0.0
Shaquille Herro        28   13    0    1   0   5/6    83.3     0/0   0.0
Jrue Sabonis           28    6    5    2   0   3/4    75.0     0/0   0.0
Kevin Bane             28    5    4    2   0   2/2   100.0     0/0   0.0
Devin Siakam           28    0    0    2   0   0/0     0.0     0/0   0.0

TEAM: FG: 17/20 (85.0%), 3PT: 4/5 (80.0%), REB: 13 (4 off, 9 def), AST: 10, TO: 3
TEAM FOULS: 6 [Team_003 in BONUS]


Team_003
--------------------------------------------------------------------------------
Player                MIN  PTS  REB  AST  TO      FG   FG%      3P   3P%
--------------------------------------------------------------------------------
Victor O'Neal          28    9    3    1   0   4/9    44.4     0/0   0.0
Rudy Haliburton        28    8    1    2   0   4/6    66.7     0/0   0.0
Nikola Bryant          28    7    0    1   0   3/3   100.0     0/0   0.0
Ayo Jackson            28    2    0    3   0   1/2    50.0     0/0   0.0
Giannis Turner         28    0    2    1   0   0/2     0.0     0/0   0.0

TEAM: FG: 12/22 (54.5%), 3PT: 2/4 (50.0%), REB: 7 (4 off, 3 def), AST: 8, TO: 1
TEAM FOULS: 1

================================================================================

================================================================================
                       4TH QUARTER - Team_055 vs Team_003                       
================================================================================

[12:00] Team_055 possession (Score: 89-82)
Shaquille Herro attempts a 3Pt. Contested by Nikola Bryant (4.5 feet, MAN). SHAQUILLE HERRO MAKES IT!
Score: 92-82

[11:42] Team_003 possession (Score: 92-82)
Rudy Haliburton attempts a 3Pt. Contested by Kevin Bane (4.3 feet, ZONE). Rudy Haliburton misses. Offensive rebound by Victor O'Neal! Victor O'Neal kicks it out.

[11:29] Team_003 possession (Score: 92-82)
Rudy Haliburton drives, picks up Jrue Sabonis. Help arrives from Shaquille Herro! Rudy Haliburton attempts a Layup. Contested by Shaquille Herro (4.7 feet, ZONE). RUDY HALIBURTON MAKES IT!
Score: 92-84

[11:18] Team_055 possession (Score: 92-84)
Shaquille Herro attempts a 3Pt. Contested by Nikola Bryant (4.6 feet, ZONE). Shaquille Herro misses. Rebound secured by Victor O'Neal.

[11:08] Team_003 possession (Score: 92-84)
Rudy Haliburton attempts a 3Pt. Contested by Kevin Bane (4.4 feet, ZONE). RUDY HALIBURTON MAKES IT!
Score: 92-87

[10:52] Team_055 possession (Score: 92-87)
Shaquille Herro attempts a Midrange. Contested by Rudy Haliburton (3.9 feet, ZONE). SHAQUILLE HERRO MAKES IT! Assist: Kevin Bane
Score: 94-87

[10:36] Team_003 possession (Score: 94-87)
Victor O'Neal attempts a 3Pt. Contested by Chris Turner (3.5 feet, MAN). VICTOR O'NEAL MAKES IT!
Score: 94-90

[10:18] Team_055 possession (Score: 94-90)
FOUL! Shooting foul on Giannis Turner. Jrue Sabonis to the line for 2 free throws. [Team fouls: 1] (Giannis Turner: 1 personal fouls)   FT 1/2: GOOD   FT 2/2: GOOD Jrue Sabonis makes 2/2 from the line.
Score: 96-90

[10:00] Team_003 possession (Score: 96-90)
Giannis Turner makes the Layup and draws the foul on Chris Turner! And-1! Giannis Turner to the line for 1. [Team fouls: 1] (Chris Turner: 1 personal fouls)   FT 1/1: GOOD Giannis Turner makes 1/1 from the line.
Score: 96-93

[09:46] Team_055 possession (Score: 96-93)
Chris Turner attempts a Midrange. Contested by Rudy Haliburton (4.0 feet, ZONE). Chris Turner misses. FOUL! Loose ball foul on Giannis Turner during the rebound battle. [Team fouls: 2] No free throws, side out. (Giannis Turner: 2 personal fouls)

[09:34] Team_055 possession (Score: 96-93)
Kevin Bane attempts a 3Pt. Contested by Giannis Turner (3.8 feet, ZONE). Kevin Bane misses. Rebound secured by Rudy Haliburton.

[09:20] Team_003 possession (Score: 96-93)
FOUL! Holding foul on Kevin Bane. [Team fouls: 2] No free throws, side out. (Kevin Bane: 1 personal fouls)

[09:03] Team_003 possession (Score: 96-93)
FOUL! Shooting foul on Shaquille Herro. Ayo Jackson to the line for 2 free throws. [Team fouls: 3] (Shaquille Herro: 1 personal fouls)   FT 1/2: MISS   FT 2/2: MISS Ayo Jackson makes 0/2 from the line. Rebound secured by Jrue Sabonis.

[08:51] Team_055 possession (Score: 96-93)
Devin Siakam attempts a Midrange. Contested by Ayo Jackson (5.9 feet, MAN). DEVIN SIAKAM MAKES IT!
Score: 98-93

[08:33] Team_003 possession (Score: 98-93)
Victor O'Neal attempts a Midrange. Contested by Shaquille Herro (4.4 feet, ZONE). VICTOR O'NEAL MAKES IT! Assist: Ayo Jackson
Score: 98-95

[08:19] Team_055 possession (Score: 98-95)
Devin Siakam attempts a 3Pt. Contested by Giannis Turner (3.7 feet, ZONE). Devin Siakam misses. Rebound secured by Victor O'Neal.

[08:02] Team_003 possession (Score: 98-95)
Nikola Bryant attempts a Layup. Contested by Chris Turner (4.1 feet, ZONE). Nikola Bryant misses. Rebound secured by Kevin Bane.

[07:45] Team_055 possession (Score: 98-95)
Shaquille Herro drives, Giannis Turner stays with him. Shaquille Herro attempts a Dunk. Contested by Giannis Turner (3.9 feet, ZONE). SHAQUILLE HERRO MAKES IT!
Score: 100-95

[07:28] Team_003 possession (Score: 100-95)
Ayo Jackson attempts a Layup. BLOCKED BY CHRIS TURNER! Ball is loose! Offensive rebound by Victor O'Neal! Victor O'Neal kicks it out.

[07:17] Team_003 possession (Score: 100-95)
Rudy Haliburton attempts a Midrange. Contested by Shaquille Herro (4.6 feet, ZONE). RUDY HALIBURTON MAKES IT!
Score: 100-97

[07:04] Team_055 possession (Score: 100-97)
Devin Siakam drives and kicks out. Kevin Bane attempts a 3Pt. Contested by Rudy Haliburton (4.2 feet, MAN). KEVIN BANE MAKES IT! Assist: Jrue Sabonis
Score: 103-97

[06:47] Team_003 possession (Score: 103-97)
Nikola Bryant attempts a Midrange. Contested by Shaquille Herro (4.9 feet, MAN). Nikola Bryant misses. Rebound secured by Kevin Bane.

[06:30] Team_055 possession (Score: 103-97)
Chris Turner loses the ball! Stripped by Victor O'Neal! TURNOVER! (live ball)

[06:18] Team_003 possession (Score: 103-97)
Ayo Jackson attempts a 3Pt. Wide open! Devin Siakam is 6.5 feet away. [MAN] Ayo Jackson misses. Rebound secured by Kevin Bane.

[06:01] Team_055 possession (Score: 103-97)
FOUL! Shooting foul on Giannis Turner. Shaquille Herro to the line for 3 free throws. [Team fouls: 3] (Giannis Turner: 3 personal fouls)   FT 1/3: MISS   FT 2/3: GOOD   FT 3/3: MISS Shaquille Herro makes 1/3 from the line. Rebound secured by Giannis Turner.
Score: 104-97

[05:43] Team_003 possession (Score: 104-97)
Victor O'Neal attempts a Layup. Contested by Chris Turner (4.2 feet, ZONE). VICTOR O'NEAL MAKES IT! Assist: Rudy Haliburton
Score: 104-99

[05:26] Team_055 possession (Score: 104-99)
Kevin Bane attempts a 3Pt. Contested by Rudy Haliburton (4.6 feet, MAN). Kevin Bane misses. Rebound secured by Victor O'Neal.

[05:14] Team_003 possession (Score: 104-99)
Nikola Bryant attempts a Midrange. Contested by Shaquille Herro (5.1 feet, MAN). Nikola Bryant misses. Rebound secured by Jrue Sabonis.

[05:02] Team_055 possession (Score: 104-99)
Chris Turner attempts a 3Pt. Contested by Giannis Turner (4.4 feet, ZONE). CHRIS TURNER MAKES IT! Assist: Shaquille Herro
Score: 107-99

[04:47] Team_003 possession (Score: 107-99)
Giannis Turner attempts a Midrange. Contested by Jrue Sabonis (5.9 feet, ZONE). Giannis Turner misses. Rebound secured by Chris Turner.

[04:36] Team_055 possession (Score: 107-99)
Shaquille Herro attempts a Midrange. Contested by Nikola Bryant (5.4 feet, MAN). Shaquille Herro misses. Rebound secured by Giannis Turner.

[04:22] Team_003 possession (Score: 107-99)
Giannis Turner drives, Chris Turner stays with him. Giannis Turner attempts a Layup. Contested by Chris Turner (4.8 feet, MAN). Giannis Turner misses. Rebound secured by Kevin Bane.

[04:05] Team_055 possession (Score: 107-99)
Kevin Bane makes the Midrange and draws the foul on Rudy Haliburton! And-1! Kevin Bane to the line for 1. [Team fouls: 4] (Rudy Haliburton: 1 personal fouls)   FT 1/1: GOOD Kevin Bane makes 1/1 from the line.
Score: 110-99

[03:49] Team_003 possession (Score: 110-99)
Rudy Haliburton attempts a Midrange. Contested by Jrue Sabonis (5.9 feet, ZONE). Rudy Haliburton misses. Offensive rebound by Victor O'Neal! Victor O'Neal kicks it out.

[03:34] Team_003 possession (Score: 110-99)
Giannis Turner makes the Midrange and draws the foul on Chris Turner! And-1! Giannis Turner to the line for 1. [Team fouls: 4] (Chris Turner: 2 personal fouls)   FT 1/1: MISS Giannis Turner makes 0/1 from the line. Rebound secured by Kevin Bane.
Score: 110-101

[03:19] Team_055 possession (Score: 110-101)
Jrue Sabonis drives and kicks out. Devin Siakam attempts a Midrange. Contested by Giannis Turner (4.7 feet, ZONE). Devin Siakam misses. Rebound secured by Victor O'Neal.

[03:02] Team_003 possession (Score: 110-101)
Nikola Bryant attempts a Midrange. Wide open! Devin Siakam is 6.9 feet away. [ZONE] Nikola Bryant misses. Rebound secured by Jrue Sabonis.

[02:46] Team_055 possession (Score: 110-101)
Jrue Sabonis attempts a Layup. Contested by Giannis Turner (4.6 feet, ZONE). JRUE SABONIS MAKES IT! Assist: Chris Turner
Score: 112-101

[02:33] Team_003 possession (Score: 112-101)
Ayo Jackson drives to the basket... Ayo Jackson loses the ball! Stripped by Chris Turner! TURNOVER! (live ball)

[02:22] Team_055 possession (Score: 112-101)
FOUL! Holding foul on Nikola Bryant. [IN THE BONUS! 5 team fouls] Shaquille Herro to the line for 2 free throws. (Nikola Bryant: 1 personal fouls)   FT 1/2: GOOD   FT 2/2: MISS Shaquille Herro makes 1/2 from the line. Rebound secured by Giannis Turner.
Score: 113-101

[02:08] Team_003 possession (Score: 113-101)
Ayo Jackson attempts a Layup. Wide open! Devin Siakam is 7.1 feet away. [MAN] Ayo Jackson misses. Rebound secured by Jrue Sabonis.

[01:54] Team_055 possession (Score: 113-101)
Shaquille Herro attempts a 3Pt. Contested by Giannis Turner (4.9 feet, ZONE). Shaquille Herro misses. Offensive rebound by Kevin Bane! Kevin Bane kicks it out.

[01:42] Team_055 possession (Score: 113-101)
Chris Turner attempts a Midrange. Wide open! Victor O'Neal is 6.0 feet away. [MAN] Chris Turner misses. Rebound secured by Rudy Haliburton.

[01:26] Team_003 possession (Score: 113-101)
Giannis Turner attempts a 3Pt. Contested by Kevin Bane (5.6 feet, ZONE). Giannis Turner misses. Rebound secured by Kevin Bane.

[01:13] Team_055 possession (Score: 113-101)
Kevin Bane attempts a Midrange. Wide open! Nikola Bryant is 6.1 feet away. [ZONE] Kevin Bane misses. Rebound secured by Rudy Haliburton.

[00:55] Team_003 possession (Score: 113-101)
Rudy Haliburton attempts a 3Pt. Wide open! Devin Siakam is 7.1 feet away. [ZONE] Rudy Haliburton misses. Rebound secured by Jrue Sabonis.

[00:38] Team_055 possession (Score: 113-101)
Chris Turner throws a bad pass! Stolen by Victor O'Neal! TURNOVER! (live ball)

[00:19] Team_003 possession (Score: 113-101)
Rudy Haliburton attempts a 3Pt. Contested by Kevin Bane (5.6 feet, MAN). Rudy Haliburton misses. Offensive rebound by Victor O'Neal! Victor O'Neal kicks it out.

[00:05] Team_003 possession (Score: 113-101)
Rudy Haliburton attempts a 3Pt. Contested by Kevin Bane (5.6 feet, ZONE). RUDY HALIBURTON MAKES IT! Assist: Victor O'Neal
Score: 113-104

================================================================================
                              4TH QUARTER COMPLETE                              
================================================================================

4TH QUARTER SCORE: Team_055 24, Team_003 22

BOX SCORE:
================================================================================

Team_055
--------------------------------------------------------------------------------
Player                MIN  PTS  REB  AST  TO      FG   FG%      3P   3P%
--------------------------------------------------------------------------------
Shaquille Herro        40    7    0    1   0   3/6    50.0     0/0   0.0
Kevin Bane             40    6    7    1   0   2/5    40.0     0/0   0.0
Jrue Sabonis           40    4    5    1   0   2/3    66.7     0/0   0.0
Chris Turner           40    3    2    1   0   1/2    50.0     0/0   0.0
Devin Siakam           40    2    0    0   0   1/2    50.0     0/0   0.0

TEAM: FG: 9/19 (47.4%), 3PT: 2/7 (28.6%), REB: 14 (2 off, 12 def), AST: 4, TO: 2
TEAM FOULS: 4


Team_003
--------------------------------------------------------------------------------
Player                MIN  PTS  REB  AST  TO      FG   FG%      3P   3P%
--------------------------------------------------------------------------------
Rudy Haliburton        40   10    3    1   0   4/5    80.0     0/0   0.0
Victor O'Neal          40    7    8    1   0   3/3   100.0     0/0   0.0
Giannis Turner         40    3    3    0   0   1/5    20.0     0/0   0.0
Ayo Jackson            40    0    0    1   0   0/3     0.0     0/0   0.0
Nikola Bryant          40    0    0    0   0   0/4     0.0     0/0   0.0

TEAM: FG: 8/20 (40.0%), 3PT: 3/6 (50.0%), REB: 14 (4 off, 10 def), AST: 3, TO: 1
TEAM FOULS: 5 [Team_055 in BONUS]

================================================================================

================================================================================
                               FULL GAME COMPLETE                               
================================================================================

FINAL SCORE: Team_055 113, Team_003 104

SCORING BY QUARTER:
--------------------------------------------------------------------------------
Team                     Q1     Q2     Q3     Q4    FINAL
--------------------------------------------------------------------------------
Team_055                 22     30     37     24      113
Team_003                 24     30     28     22      104
--------------------------------------------------------------------------------

FULL GAME BOX SCORE:
================================================================================

Team_055
--------------------------------------------------------------------------------
Player                MIN  PTS  REB  AST  TO      FG   FG%      3P   3P%      FT STL BLK
--------------------------------------------------------------------------------
Devin Siakam           40   15    0    4   0  10/15   66.7   2/5    40.0   1/1     0   0
Shaquille Herro        40   20    0    4   2   8/14   57.1   4/8    50.0   2/5     1   0
Kevin Bane             40   20   14    3   2   8/17   47.1   2/7    28.6   3/3     0   0
Jrue Sabonis           40   13   15    4   0   5/8    62.5   0/1     0.0   3/3     0   0
Chris Turner           40   20   12    5   4   7/10   70.0   1/1   100.0   1/2     2   2
Luka Wall               8    2    0    0   0   1/1   100.0   0/0     0.0   0/0     0   0
Dirk Duncan             8    4    3    0   1   3/4    75.0   0/1     0.0   0/0     0   1
Kyle Wall               8   11    0    1   0   4/4   100.0   1/1   100.0   2/2     0   0
Malcolm Williamson      8    4    4    0   0   2/5    40.0   0/0     0.0   0/0     0   0
D'Angelo Antetokounmpo    8    2    5    0   0   0/0     0.0   0/0     0.0   0/0     0   0

TEAM: FG: 48/79 (60.8%), 3PT: 10/24 (41.7%), REB: 51 (14 off, 37 def), AST: 21, TO: 9


Team_003
--------------------------------------------------------------------------------
Player                MIN  PTS  REB  AST  TO      FG   FG%      3P   3P%      FT STL BLK
--------------------------------------------------------------------------------
Ayo Jackson            40    9    0    4   1   4/10   40.0   0/3     0.0   1/3     0   0
Nikola Bryant          40   19    0    2   0   8/12   66.7   3/3   100.0   2/2     0   0
Rudy Haliburton        40   22    9    6   0  10/18   55.6   2/6    33.3   2/3     0   1
Giannis Turner         40   16    8    1   3   7/14   50.0   1/2    50.0   6/9     1   1
Victor O'Neal          40   17   21    2   0   7/13   53.8   2/4    50.0   5/7     2   0
Miles Towns             8    2    0    2   0   1/3    33.3   0/1     0.0   2/2     0   0
Pau Williamson          8    0    0    0   0   1/3    33.3   1/2    50.0   0/0     0   1
Collin Mitchell         8    2    1    0   0   1/3    33.3   0/1     0.0   0/0     0   0
Anfernee Jordan         8    2    2    1   0   1/4    25.0   0/0     0.0   0/0     0   0
Bam Gilgeous-Alexander    8    9    2    0   0   3/3   100.0   0/0     0.0   3/3     0   1

TEAM: FG: 43/83 (51.8%), 3PT: 9/22 (40.9%), REB: 45 (14 off, 31 def), AST: 18, TO: 4

================================================================================
