================================================================================
                        FULL GAME - Team_035 vs Team_005                        
================================================================================

================================================================================
                       1ST QUARTER - Team_035 vs Team_005                       
================================================================================

[12:00] Team_035 possession (Score: 0-0)
Dwyane Johnson attempts a 3Pt. Contested by Cade Markkanen (3.1 feet, MAN). Dwyane Johnson misses. Rebound secured by Jalen Rozier.

[11:45] Team_005 possession (Score: 0-0)
Brandon George attempts a Midrange. Contested by Dwyane Johnson (4.1 feet, ZONE). BRANDON GEORGE MAKES IT! Assist: Cade Markkanen
Score: 0-2

[11:34] Team_035 possession (Score: 0-2)
Domantas Green attempts a 3Pt. Contested by Brandon George (5.5 feet, MAN). Domantas Green misses. Rebound secured by Derrick Allen.

[11:24] Team_005 possession (Score: 0-2)
FOUL! Shooting foul on Dwyane Johnson. Derrick Allen to the line for 2 free throws. [Team fouls: 1] (Dwyane Johnson: 1 personal fouls)   FT 1/2: MISS   FT 2/2: GOOD Derrick Allen makes 1/2 from the line.
Score: 0-3

[11:13] Team_035 possession (Score: 0-3)
Gary Johnson attempts a 3Pt. Contested by Derrick Allen (4.7 feet, MAN). GARY JOHNSON MAKES IT! Assist: Magic Westbrook
Score: 3-3

[10:59] Team_005 possession (Score: 3-3)
Brandon George attempts a 3Pt. Contested by Shaquille Ginobili (4.1 feet, ZONE). Brandon George misses. Rebound secured by Gary Johnson.

[10:49] Team_035 possession (Score: 3-3)
Gary Johnson attempts a 3Pt. Contested by Derrick Allen (4.7 feet, MAN). GARY JOHNSON MAKES IT!
Score: 6-3

[10:30] Team_005 possession (Score: 6-3)
Derrick Allen attempts a Layup. Contested by Dwyane Johnson (4.3 feet, ZONE). Derrick Allen misses. Rebound secured by Gary Johnson.

[10:14] Team_035 possession (Score: 6-3)
Gary Johnson drives, Cade Markkanen stays with him. Gary Johnson attempts a Dunk. Contested by Cade Markkanen (3.7 feet, ZONE). GARY JOHNSON MAKES IT! Assist: Dwyane Johnson
Score: 8-3

[09:56] Team_005 possession (Score: 8-3)
Brandon George attempts a 3Pt. Contested by Domantas Green (4.8 feet, MAN). Brandon George misses. Offensive rebound by Cade Markkanen! Cade Markkanen puts it back in!
Score: 8-5

[09:41] Team_035 possession (Score: 8-5)
Gary Johnson attempts a Midrange. Contested by Brandon George (5.6 feet, ZONE). Gary Johnson misses. FOUL! Loose ball foul on Derrick Allen during the rebound battle. [Team fouls: 1] No free throws, side out. (Derrick Allen: 1 personal fouls)

[09:22] Team_035 possession (Score: 8-5)
Dwyane Johnson attempts a Midrange. Contested by Anthony Rozier (4.5 feet, ZONE). Dwyane Johnson misses. Rebound secured by Jalen Rozier.

[09:12] Team_005 possession (Score: 8-5)
Derrick Allen attempts a Layup. Contested by Gary Johnson (4.2 feet, MAN). DERRICK ALLEN MAKES IT!
Score: 8-7

[08:55] Team_035 possession (Score: 8-7)
Shaquille Ginobili attempts a 3Pt. Contested by Derrick Allen (4.1 feet, ZONE). SHAQUILLE GINOBILI MAKES IT! Assist: Dwyane Johnson
Score: 11-7

[08:41] Team_005 possession (Score: 11-7)
Jalen Rozier drives to the basket... Jalen Rozier throws a bad pass! Stolen by Dwyane Johnson! TURNOVER! (live ball)

[08:24] Team_035 possession (Score: 11-7)
Shaquille Ginobili attempts a Layup. Contested by Anthony Rozier (4.4 feet, MAN). SHAQUILLE GINOBILI MAKES IT! Assist: Magic Westbrook
Score: 13-7

[08:07] Team_005 possession (Score: 13-7)
Cade Markkanen attempts a Layup. Contested by Magic Westbrook (4.1 feet, MAN). Cade Markkanen misses. Offensive rebound by Cade Markkanen! Cade Markkanen puts it back in!
Score: 13-9

[07:49] Team_035 possession (Score: 13-9)
Dwyane Johnson attempts a Layup. Contested by Cade Markkanen (3.1 feet, MAN). DWYANE JOHNSON MAKES IT! Assist: Gary Johnson
Score: 15-9

[07:36] Team_005 possession (Score: 15-9)
FOUL! Reach-in foul on Magic Westbrook during the drive. [Team fouls: 2] No free throws, side out. (Magic Westbrook: 1 personal fouls)

[07:23] Team_005 possession (Score: 15-9)
Anthony Rozier attempts a 3Pt. Contested by Shaquille Ginobili (4.0 feet, MAN). ANTHONY ROZIER MAKES IT!
Score: 15-12

[07:10] Team_035 possession (Score: 15-12)
Magic Westbrook attempts a Midrange. Contested by Brandon George (5.6 feet, ZONE). MAGIC WESTBROOK MAKES IT! Assist: Gary Johnson
Score: 17-12

[06:54] Team_005 possession (Score: 17-12)
Jalen Rozier attempts a 3Pt. Contested by Dwyane Johnson (4.2 feet, MAN). JALEN ROZIER MAKES IT! Assist: Anthony Rozier
Score: 17-15

[06:42] Team_035 possession (Score: 17-15)
Magic Westbrook attempts a Layup. Contested by Cade Markkanen (3.7 feet, ZONE). MAGIC WESTBROOK MAKES IT!
Score: 19-15

[06:25] Team_005 possession (Score: 19-15)
Derrick Allen attempts a Midrange. Contested by Magic Westbrook (4.7 feet, ZONE). DERRICK ALLEN MAKES IT!
Score: 19-17

[06:10] Team_035 possession (Score: 19-17)
Domantas Green attempts a 3Pt. Contested by Brandon George (5.5 feet, MAN). Domantas Green misses. Offensive rebound by Magic Westbrook! Magic Westbrook kicks it out.

[05:58] Team_035 possession (Score: 19-17)
Shaquille Ginobili attempts a Midrange. Contested by Anthony Rozier (4.4 feet, MAN). Shaquille Ginobili misses. Rebound secured by Derrick Allen.

[05:44] Team_005 possession (Score: 19-17)
Derrick Allen attempts a 3Pt. Contested by Shaquille Ginobili (4.3 feet, ZONE). DERRICK ALLEN MAKES IT! Assist: Cade Markkanen
Score: 19-20

[05:29] Team_035 possession (Score: 19-20)
Domantas Green attempts a Midrange. Contested by Derrick Allen (4.6 feet, ZONE). DOMANTAS GREEN MAKES IT!
Score: 21-20

[05:10] Team_005 possession (Score: 21-20)
Derrick Allen attempts a 3Pt. Contested by Gary Johnson (4.2 feet, MAN). Derrick Allen misses. Rebound secured by Gary Johnson.

[04:54] Team_035 possession (Score: 21-20)
Magic Westbrook drives to the basket... Magic Westbrook loses the ball! Stripped by Cade Markkanen! TURNOVER! (live ball)

[04:36] Team_005 possession (Score: 21-20)
Anthony Rozier attempts a 3Pt. Contested by Shaquille Ginobili (4.0 feet, MAN). Anthony Rozier misses. Rebound secured by Magic Westbrook.

[04:21] Team_035 possession (Score: 21-20)
Shaquille Ginobili attempts a 3Pt. Contested by Derrick Allen (4.1 feet, ZONE). Shaquille Ginobili misses. Rebound secured by Cade Markkanen.

[04:11] Team_005 possession (Score: 21-20)
Jalen Rozier makes the Layup and draws the foul on Dwyane Johnson! And-1! Jalen Rozier to the line for 1. [Team fouls: 3] (Dwyane Johnson: 2 personal fouls)   FT 1/1: GOOD Jalen Rozier makes 1/1 from the line.
Score: 21-23

[03:55] Team_035 possession (Score: 21-23)
Domantas Green attempts a 3Pt. Contested by Brandon George (5.7 feet, MAN). Domantas Green misses. Rebound secured by Derrick Allen.

[03:37] Team_005 possession (Score: 21-23)
Anthony Rozier attempts a Midrange. Contested by Gary Johnson (3.9 feet, ZONE). Anthony Rozier misses. Rebound secured by Magic Westbrook.

[03:26] Team_035 possession (Score: 21-23)
FOUL! Shooting foul on Brandon George. Domantas Green to the line for 2 free throws. [Team fouls: 2] (Brandon George: 1 personal fouls)   FT 1/2: GOOD   FT 2/2: GOOD Domantas Green makes 2/2 from the line.
Score: 23-23

[03:12] Team_005 possession (Score: 23-23)
FOUL! Holding foul on Magic Westbrook. [Team fouls: 4] No free throws, side out. (Magic Westbrook: 2 personal fouls)

[03:02] Team_005 possession (Score: 23-23)
Brandon George drives, picks up Domantas Green. Help arrives from Shaquille Ginobili! Brandon George attempts a Dunk. Contested by Shaquille Ginobili (4.9 feet, MAN). BRANDON GEORGE MAKES IT! Assist: Jalen Rozier
Score: 23-25

[02:48] Team_035 possession (Score: 23-25)
Magic Westbrook makes the Layup and draws the foul on Cade Markkanen! And-1! Magic Westbrook to the line for 1. [Team fouls: 3] (Cade Markkanen: 1 personal fouls)   FT 1/1: MISS Magic Westbrook makes 0/1 from the line. Rebound secured by Jalen Rozier.
Score: 25-25

[02:35] Team_005 possession (Score: 25-25)
Anthony Rozier drives, Shaquille Ginobili stays with him. Anthony Rozier attempts a Dunk. Contested by Shaquille Ginobili (4.2 feet, MAN). ANTHONY ROZIER MAKES IT! Assist: Brandon George
Score: 25-27

[02:24] Team_035 possession (Score: 25-27)
Magic Westbrook attempts a Layup. Contested by Cade Markkanen (4.1 feet, ZONE). MAGIC WESTBROOK MAKES IT!
Score: 27-27

[02:12] Team_005 possession (Score: 27-27)
Anthony Rozier makes the Layup and draws the foul on Dwyane Johnson! And-1! Anthony Rozier to the line for 1. [BONUS: 5 team fouls] (Dwyane Johnson: 3 personal fouls)   FT 1/1: GOOD Anthony Rozier makes 1/1 from the line.
Score: 27-30

[02:00] Team_035 possession (Score: 27-30)
Dwyane Johnson attempts a 3Pt. Contested by Derrick Allen (4.4 feet, ZONE). Dwyane Johnson misses. Rebound secured by Jalen Rozier.

[01:46] Team_005 possession (Score: 27-30)
Derrick Allen makes the Layup and draws the foul on Dwyane Johnson! And-1! Derrick Allen to the line for 1. [BONUS: 6 team fouls] (Dwyane Johnson: 4 personal fouls)   FT 1/1: GOOD Derrick Allen makes 1/1 from the line.
Score: 27-33

[01:33] Team_035 possession (Score: 27-33)
Dwyane Johnson drives, Cade Markkanen stays with him. Dwyane Johnson attempts a Dunk. Contested by Cade Markkanen (3.7 feet, ZONE). DWYANE JOHNSON MAKES IT!
Score: 29-33

[01:16] Team_005 possession (Score: 29-33)
Derrick Allen attempts a Midrange. Contested by Gary Johnson (4.5 feet, ZONE). Derrick Allen misses. Rebound secured by Dwyane Johnson.

[00:59] Team_035 possession (Score: 29-33)
Shaquille Ginobili attempts a 3Pt. Contested by Anthony Rozier (4.9 feet, MAN). Shaquille Ginobili misses. Rebound secured by Cade Markkanen.

[00:46] Team_005 possession (Score: 29-33)
Brandon George attempts a 3Pt. Contested by Shaquille Ginobili (4.5 feet, ZONE). Brandon George misses. Rebound secured by Magic Westbrook.

[00:30] Team_035 possession (Score: 29-33)
Gary Johnson attempts a Midrange. Contested by Jalen Rozier (5.8 feet, ZONE). Gary Johnson misses. Rebound secured by Cade Markkanen.

[00:18] Team_005 possession (Score: 29-33)
Brandon George loses the ball! Stripped by Domantas Green! TURNOVER! (live ball)

[00:02] Team_035 possession (Score: 29-33)
Shaquille Ginobili attempts a 3Pt. Contested by Anthony Rozier (5.1 feet, MAN). Shaquille Ginobili misses. FOUL! Loose ball foul on Jalen Rozier during the rebound battle. [Team fouls: 4] No free throws, side out. (Jalen Rozier: 1 personal fouls)

================================================================================
                              1ST QUARTER COMPLETE                              
================================================================================

1ST QUARTER SCORE: Team_035 29, Team_005 33

BOX SCORE:
================================================================================

Team_035
--------------------------------------------------------------------------------
Player                MIN  PTS  REB  AST  TO      FG   FG%      3P   3P%
--------------------------------------------------------------------------------
Gary Johnson           12    8    3    2   0   3/4    75.0     0/0   0.0
Magic Westbrook        12    6    6    2   0   3/4    75.0     0/0   0.0
Shaquille Ginobili     12    5    0    0   0   2/5    40.0     0/0   0.0
Dwyane Johnson         12    4    1    2   0   2/5    40.0     0/0   0.0
Domantas Green         12    4    0    0   0   2/4    50.0     0/0   0.0

TEAM: FG: 12/22 (54.5%), 3PT: 3/9 (33.3%), REB: 10 (3 off, 7 def), AST: 6, TO: 1
TEAM FOULS: 6 [Team_005 in BONUS]


Team_005
--------------------------------------------------------------------------------
Player                MIN  PTS  REB  AST  TO      FG   FG%      3P   3P%
--------------------------------------------------------------------------------
Derrick Allen          12   11    3    0   0   5/8    62.5     0/0   0.0
Anthony Rozier         12    8    0    1   0   3/5    60.0     0/0   0.0
Jalen Rozier           12    6    4    1   0   2/2   100.0     0/0   0.0
Brandon George         12    4    0    1   0   2/4    50.0     0/0   0.0
Cade Markkanen         12    4    5    2   0   2/2   100.0     0/0   0.0

TEAM: FG: 14/21 (66.7%), 3PT: 4/8 (50.0%), REB: 12 (2 off, 10 def), AST: 5, TO: 2
TEAM FOULS: 4

================================================================================

================================================================================
                       2ND QUARTER - Team_035 vs Team_005                       
================================================================================

[12:00] Team_035 possession (Score: 29-33)
Gary Johnson drives, Cade Markkanen stays with him. Gary Johnson attempts a Layup. Contested by Cade Markkanen (4.2 feet, ZONE). GARY JOHNSON MAKES IT!
Score: 31-33

[11:42] Team_005 possession (Score: 31-33)
FOUL! Offensive foul on Brandon George! Domantas Green drew the charge! [Team fouls: 1] (Brandon George: 1 personal fouls) TURNOVER! (dead ball)

[11:29] Team_035 possession (Score: 31-33)
Domantas Green attempts a 3Pt. Contested by Derrick Allen (4.9 feet, ZONE). DOMANTAS GREEN MAKES IT! Assist: Magic Westbrook
Score: 34-33

[11:15] Team_005 possession (Score: 34-33)
Cade Markkanen attempts a 3Pt. Contested by Shaquille Ginobili (4.1 feet, ZONE). CADE MARKKANEN MAKES IT! Assist: Brandon George
Score: 34-36

[11:05] Team_035 possession (Score: 34-36)
Magic Westbrook attempts a Layup. Contested by Cade Markkanen (4.3 feet, MAN). Magic Westbrook misses. Rebound secured by Jalen Rozier.

[10:48] Team_005 possession (Score: 34-36)
Derrick Allen drives to the basket... Derrick Allen throws a bad pass out of bounds! TURNOVER! (dead ball)

[10:48] Substitution (Team_035): Domantas Green OUT → CJ LaVine IN (stamina_rule2)

[10:48] Substitution (Team_035): Shaquille Ginobili OUT → Cole George IN (stamina_rule2)

[10:48] Substitution (Team_035): Gary Johnson OUT → Malcolm Turner IN (stamina_rule2)

[10:48] Substitution (Team_035): Dwyane Johnson OUT → Tobias Jordan IN (stamina_rule2)

[10:48] Substitution (Team_035): Magic Westbrook OUT → John Durant IN (stamina_rule2)

[10:48] Substitution (Team_005): Brandon George OUT → Blake O'Neal IN (stamina_rule2)

[10:48] Substitution (Team_005): Anthony Rozier OUT → Draymond Smith IN (stamina_rule2)

[10:48] Substitution (Team_005): Derrick Allen OUT → Lauri Wade IN (stamina_rule2)

[10:48] Substitution (Team_005): Jalen Rozier OUT → Isaiah Durant IN (stamina_rule2)

[10:48] Substitution (Team_005): Cade Markkanen OUT → Zion Parker IN (stamina_rule2)

[10:33] Team_035 possession (Score: 34-36)
Malcolm Turner attempts a 3Pt. Contested by Blake O'Neal (4.6 feet, ZONE). Malcolm Turner misses. Rebound secured by Lauri Wade.

[10:17] Team_005 possession (Score: 34-36)
Zion Parker drives and kicks out. Draymond Smith attempts a 3Pt. Contested by Cole George (3.5 feet, MAN). Draymond Smith misses. Offensive rebound by Draymond Smith! Draymond Smith kicks it out.

[10:02] Team_005 possession (Score: 34-36)
Lauri Wade attempts a Midrange. Contested by Malcolm Turner (4.8 feet, MAN). Lauri Wade misses. Offensive rebound by Zion Parker! Zion Parker puts it back in!
Score: 34-38

[09:48] Team_035 possession (Score: 34-38)
Cole George attempts a 3Pt. Contested by Blake O'Neal (4.4 feet, ZONE). Cole George misses. Rebound secured by Zion Parker.

[09:34] Team_005 possession (Score: 34-38)
Isaiah Durant attempts a Layup. BLOCKED BY JOHN DURANT! Ball is loose! Rebound secured by Cole George.

[09:22] Team_035 possession (Score: 34-38)
CJ LaVine attempts a 3Pt. Contested by Blake O'Neal (4.2 feet, ZONE). CJ LaVine misses. Rebound secured by Zion Parker.

[09:07] Team_005 possession (Score: 34-38)
Isaiah Durant attempts a Midrange. Contested by CJ LaVine (4.4 feet, ZONE). ISAIAH DURANT MAKES IT!
Score: 34-40

[08:53] Team_035 possession (Score: 34-40)
Cole George drives to the basket... Cole George throws a bad pass! Stolen by Zion Parker! TURNOVER! (live ball)

[08:40] Team_005 possession (Score: 34-40)
Lauri Wade makes the Layup and draws the foul on Malcolm Turner! And-1! Lauri Wade to the line for 1. [Team fouls: 1] (Malcolm Turner: 1 personal fouls)   FT 1/1: GOOD Lauri Wade makes 1/1 from the line.
Score: 34-43

[08:26] Team_035 possession (Score: 34-43)
CJ LaVine makes the Layup and draws the foul on Blake O'Neal! And-1! CJ LaVine to the line for 1. [Team fouls: 2] (Blake O'Neal: 1 personal fouls)   FT 1/1: GOOD CJ LaVine makes 1/1 from the line.
Score: 37-43

[08:11] Team_005 possession (Score: 37-43)
Blake O'Neal attempts a Midrange. Contested by CJ LaVine (4.6 feet, MAN). Blake O'Neal misses. Rebound secured by Cole George.

[07:58] Team_035 possession (Score: 37-43)
John Durant drives, Zion Parker stays with him. John Durant attempts a Dunk. Contested by Zion Parker (4.0 feet, ZONE). John Durant misses. Rebound secured by Lauri Wade.

[07:47] Team_005 possession (Score: 37-43)
Isaiah Durant throws a bad pass out of bounds! TURNOVER! (dead ball)

[07:29] Team_035 possession (Score: 37-43)
Malcolm Turner makes the Layup and draws the foul on Lauri Wade! And-1! Malcolm Turner to the line for 1. [Team fouls: 3] (Lauri Wade: 1 personal fouls)   FT 1/1: GOOD Malcolm Turner makes 1/1 from the line.
Score: 40-43

[07:20] Team_005 possession (Score: 40-43)
Isaiah Durant drives, John Durant stays with him. Isaiah Durant attempts a Layup. Contested by John Durant (4.5 feet, ZONE). Isaiah Durant misses. Rebound secured by Tobias Jordan.

[07:07] Team_035 possession (Score: 40-43)
FOUL! Reach-in foul on Zion Parker during the drive. [Team fouls: 4] No free throws, side out. (Zion Parker: 1 personal fouls)

[06:53] Team_035 possession (Score: 40-43)
Tobias Jordan attempts a 3Pt. Contested by Blake O'Neal (3.8 feet, ZONE). Tobias Jordan misses. FOUL! Loose ball foul on Zion Parker during the rebound battle. [IN THE BONUS! 5 team fouls] Tobias Jordan to the line for 2 free throws. (Zion Parker: 2 personal fouls)   FT 1/2: GOOD   FT 2/2: GOOD Tobias Jordan makes 2/2 from the line.
Score: 42-43

[06:37] Team_005 possession (Score: 42-43)
Isaiah Durant drives, picks up Tobias Jordan. Help arrives from Cole George! Isaiah Durant attempts a Dunk. Contested by Cole George (4.6 feet, MAN). ISAIAH DURANT MAKES IT! Assist: Blake O'Neal
Score: 42-45

[06:22] Team_035 possession (Score: 42-45)
Cole George drives and kicks out. Cole George attempts a Midrange. Contested by Draymond Smith (4.3 feet, MAN). Cole George misses. Offensive rebound by Tobias Jordan! Tobias Jordan kicks it out.

[06:07] Team_035 possession (Score: 42-45)
FOUL! Reach-in foul on Zion Parker during the drive. [IN THE BONUS! 6 team fouls] Cole George to the line for 2 free throws. (Zion Parker: 3 personal fouls)   FT 1/2: GOOD   FT 2/2: GOOD Cole George makes 2/2 from the line.
Score: 44-45

[05:51] Team_005 possession (Score: 44-45)
FOUL! Offensive foul on Draymond Smith! Cole George drew the charge! [Team fouls: 7] (Draymond Smith: 1 personal fouls) TURNOVER! (dead ball)

[05:40] Team_035 possession (Score: 44-45)
John Durant makes the Layup and draws the foul on Zion Parker! And-1! John Durant to the line for 1. [BONUS: 8 team fouls] (Zion Parker: 4 personal fouls)   FT 1/1: GOOD John Durant makes 1/1 from the line.
Score: 47-45

[05:25] Team_005 possession (Score: 47-45)
Isaiah Durant attempts a 3Pt. Contested by CJ LaVine (4.4 feet, ZONE). Isaiah Durant misses. Rebound secured by Tobias Jordan.

[05:07] Team_035 possession (Score: 47-45)
Cole George makes the Layup and draws the foul on Draymond Smith! And-1! Cole George to the line for 1. [BONUS: 9 team fouls] (Draymond Smith: 2 personal fouls)   FT 1/1: GOOD Cole George makes 1/1 from the line.
Score: 50-45

[04:52] Team_005 possession (Score: 50-45)
Draymond Smith drives, Cole George stays with him. Draymond Smith attempts a Dunk. Contested by Cole George (3.3 feet, MAN). DRAYMOND SMITH MAKES IT! Assist: Zion Parker
Score: 50-47

[04:36] Team_035 possession (Score: 50-47)
John Durant attempts a Layup. BLOCKED BY ZION PARKER! Ball is loose! Rebound secured by Draymond Smith.

[04:23] Team_005 possession (Score: 50-47)
Draymond Smith attempts a Layup. Contested by Cole George (3.3 feet, MAN). Draymond Smith misses. Rebound secured by John Durant.

[04:07] Team_035 possession (Score: 50-47)
Tobias Jordan attempts a 3Pt. Contested by Isaiah Durant (4.1 feet, MAN). Tobias Jordan misses. Rebound secured by Zion Parker.

[03:56] Team_005 possession (Score: 50-47)
Blake O'Neal attempts a 3Pt. Contested by CJ LaVine (4.6 feet, MAN). Blake O'Neal misses. Rebound secured by Cole George.

[03:46] Team_035 possession (Score: 50-47)
FOUL! Reach-in foul on Lauri Wade during the drive. [IN THE BONUS! 10 team fouls] Malcolm Turner to the line for 2 free throws. (Lauri Wade: 2 personal fouls)   FT 1/2: MISS   FT 2/2: GOOD Malcolm Turner makes 1/2 from the line.
Score: 51-47

[03:30] Team_005 possession (Score: 51-47)
Draymond Smith drives, picks up John Durant. Help arrives from Cole George! Draymond Smith attempts a Layup. Contested by Cole George (4.1 feet, ZONE). Draymond Smith misses. Offensive rebound by Draymond Smith! Draymond Smith kicks it out.

[03:12] Team_005 possession (Score: 51-47)
Blake O'Neal attempts a 3Pt. Contested by CJ LaVine (4.6 feet, ZONE). Blake O'Neal misses. Rebound secured by Cole George.

[02:57] Team_035 possession (Score: 51-47)
Tobias Jordan makes the Dunk and draws the foul on Isaiah Durant! And-1! Tobias Jordan to the line for 1. [BONUS: 11 team fouls] (Isaiah Durant: 1 personal fouls)   FT 1/1: GOOD Tobias Jordan makes 1/1 from the line.
Score: 54-47

[02:44] Team_005 possession (Score: 54-47)
FOUL! Shooting foul on Tobias Jordan. Isaiah Durant to the line for 2 free throws. [Team fouls: 2] (Tobias Jordan: 1 personal fouls)   FT 1/2: GOOD   FT 2/2: GOOD Isaiah Durant makes 2/2 from the line.
Score: 54-49

[02:30] Team_035 possession (Score: 54-49)
John Durant drives and kicks out. John Durant attempts a Midrange. Contested by Zion Parker (4.2 feet, MAN). JOHN DURANT MAKES IT!
Score: 56-49

[02:18] Team_005 possession (Score: 56-49)
FOUL! Shooting foul on Cole George. Isaiah Durant to the line for 2 free throws. [Team fouls: 3] (Cole George: 1 personal fouls)   FT 1/2: GOOD   FT 2/2: MISS Isaiah Durant makes 1/2 from the line. Rebound secured by John Durant.
Score: 56-50

[02:06] Team_035 possession (Score: 56-50)
FOUL! Offensive foul on CJ LaVine! Blake O'Neal drew the charge! [Team fouls: 4] (CJ LaVine: 1 personal fouls) TURNOVER! (dead ball)

[01:51] Team_005 possession (Score: 56-50)
Blake O'Neal attempts a Midrange. Contested by CJ LaVine (4.7 feet, MAN). BLAKE O'NEAL MAKES IT!
Score: 56-52

[01:38] Team_035 possession (Score: 56-52)
John Durant drives and kicks out. John Durant attempts a 3Pt. Contested by Blake O'Neal (4.4 feet, ZONE). John Durant misses. Offensive rebound by Tobias Jordan! Tobias Jordan kicks it out.

[01:22] Team_035 possession (Score: 56-52)
FOUL! Reach-in foul on Zion Parker during the drive. [IN THE BONUS! 12 team fouls] Tobias Jordan to the line for 2 free throws. (Zion Parker: 5 personal fouls)   FT 1/2: GOOD   FT 2/2: GOOD Tobias Jordan makes 2/2 from the line.
Score: 58-52

[01:05] Team_005 possession (Score: 58-52)
Lauri Wade attempts a Layup. Contested by Malcolm Turner (5.1 feet, MAN). LAURI WADE MAKES IT! Assist: Blake O'Neal
Score: 58-54

[00:50] Team_035 possession (Score: 58-54)
Tobias Jordan attempts a Layup. Contested by Isaiah Durant (4.4 feet, MAN). TOBIAS JORDAN MAKES IT! Assist: CJ LaVine
Score: 60-54

[00:32] Team_005 possession (Score: 60-54)
Lauri Wade attempts a 3Pt. Contested by Malcolm Turner (5.2 feet, MAN). LAURI WADE MAKES IT! Assist: Draymond Smith
Score: 60-57

[00:16] Team_035 possession (Score: 60-57)
FOUL! Shooting foul on Blake O'Neal. CJ LaVine to the line for 3 free throws. [BONUS: 13 team fouls] (Blake O'Neal: 2 personal fouls)   FT 1/3: GOOD   FT 2/3: GOOD   FT 3/3: GOOD CJ LaVine makes 3/3 from the line.
Score: 63-57

================================================================================
                              2ND QUARTER COMPLETE                              
================================================================================

2ND QUARTER SCORE: Team_035 34, Team_005 24

BOX SCORE:
================================================================================

Team_035
--------------------------------------------------------------------------------
Player                MIN  PTS  REB  AST  TO      FG   FG%      3P   3P%
--------------------------------------------------------------------------------
Tobias Jordan          11    9    4    0   0   4/5    80.0     0/0   0.0
CJ LaVine              11    6    0    1   0   2/3    66.7     0/0   0.0
Cole George            11    5    4    0   0   2/3    66.7     0/0   0.0
John Durant            11    5    2    0   0   2/4    50.0     0/0   0.0
Malcolm Turner         11    4    0    0   0   2/3    66.7     0/0   0.0
Domantas Green         14    3    0    0   0   1/1   100.0     0/0   0.0
Gary Johnson           14    2    0    0   0   1/1   100.0     0/0   0.0
Magic Westbrook        14    0    0    1   0   0/1     0.0     0/0   0.0

TEAM: FG: 14/21 (66.7%), 3PT: 3/7 (42.9%), REB: 10 (2 off, 8 def), AST: 2, TO: 2
TEAM FOULS: 4


Team_005
--------------------------------------------------------------------------------
Player                MIN  PTS  REB  AST  TO      FG   FG%      3P   3P%
--------------------------------------------------------------------------------
Lauri Wade             11    8    2    0   0   3/3   100.0     0/0   0.0
Isaiah Durant          11    6    0    0   0   3/7    42.9     0/0   0.0
Cade Markkanen         14    3    0    0   0   1/1   100.0     0/0   0.0
Draymond Smith         11    2    3    1   0   1/2    50.0     0/0   0.0
Zion Parker            11    2    4    1   0   1/1   100.0     0/0   0.0
Blake O'Neal           11    2    0    2   0   1/4    25.0     0/0   0.0
Brandon George         14    0    0    1   0   0/0     0.0     0/0   0.0
Jalen Rozier           14    0    1    0   0   0/0     0.0     0/0   0.0

TEAM: FG: 10/18 (55.6%), 3PT: 2/5 (40.0%), REB: 10 (3 off, 7 def), AST: 5, TO: 4
TEAM FOULS: 13 [Team_035 in BONUS]

================================================================================

================================================================================
                       3RD QUARTER - Team_035 vs Team_005                       
================================================================================

[12:00] Team_035 possession (Score: 63-57)
Gary Johnson drives and kicks out. Domantas Green attempts a 3Pt. Contested by Derrick Allen (4.2 feet, ZONE). Domantas Green misses. Offensive rebound by Magic Westbrook! Magic Westbrook kicks it out.

[11:46] Team_035 possession (Score: 63-57)
FOUL! Reach-in foul on Brandon George during the drive. [Team fouls: 1] No free throws, side out. (Brandon George: 1 personal fouls)

[11:27] Team_035 possession (Score: 63-57)
FOUL! Shooting foul on Anthony Rozier. Magic Westbrook to the line for 2 free throws. [Team fouls: 2] (Anthony Rozier: 1 personal fouls)   FT 1/2: MISS   FT 2/2: GOOD Magic Westbrook makes 1/2 from the line.
Score: 64-57

[11:10] Team_005 possession (Score: 64-57)
Derrick Allen attempts a 3Pt. Contested by Shaquille Ginobili (4.3 feet, ZONE). Derrick Allen misses. Offensive rebound by Cade Markkanen! Cade Markkanen puts it back in!
Score: 64-59

[10:56] Team_035 possession (Score: 64-59)
FOUL! Reach-in foul on Cade Markkanen during the drive. [Team fouls: 3] No free throws, side out. (Cade Markkanen: 1 personal fouls)

[10:42] Team_035 possession (Score: 64-59)
FOUL! Reach-in foul on Anthony Rozier during the drive. [Team fouls: 4] No free throws, side out. (Anthony Rozier: 2 personal fouls)

[10:31] Team_035 possession (Score: 64-59)
Dwyane Johnson attempts a Midrange. Contested by Cade Markkanen (3.1 feet, MAN). Dwyane Johnson misses. Offensive rebound by Dwyane Johnson! Dwyane Johnson's putback is no good. Rebound secured by Cade Markkanen.

[10:16] Team_005 possession (Score: 64-59)
Cade Markkanen drives and kicks out. Brandon George attempts a 3Pt. Contested by Domantas Green (4.6 feet, MAN). Brandon George misses. Rebound secured by Dwyane Johnson.

[10:02] Team_035 possession (Score: 64-59)
Magic Westbrook attempts a Midrange. Contested by Derrick Allen (4.7 feet, ZONE). MAGIC WESTBROOK MAKES IT! Assist: Dwyane Johnson
Score: 66-59

[09:48] Team_005 possession (Score: 66-59)
Derrick Allen makes the 3Pt and draws the foul on Gary Johnson! And-1! Derrick Allen to the line for 1. [Team fouls: 1] (Gary Johnson: 1 personal fouls)   FT 1/1: GOOD Derrick Allen makes 1/1 from the line.
Score: 66-63

[09:35] Team_035 possession (Score: 66-63)
Domantas Green attempts a Midrange. Contested by Brandon George (5.5 feet, MAN). DOMANTAS GREEN MAKES IT!
Score: 68-63

[09:17] Team_005 possession (Score: 68-63)
Jalen Rozier makes the 3Pt and draws the foul on Shaquille Ginobili! And-1! Jalen Rozier to the line for 1. [Team fouls: 2] (Shaquille Ginobili: 1 personal fouls)   FT 1/1: GOOD Jalen Rozier makes 1/1 from the line.
Score: 68-67

[09:01] Team_035 possession (Score: 68-67)
Dwyane Johnson attempts a Midrange. Contested by Cade Markkanen (3.1 feet, MAN). DWYANE JOHNSON MAKES IT! Assist: Gary Johnson
Score: 70-67

[08:46] Team_005 possession (Score: 70-67)
Derrick Allen attempts a Midrange. Contested by Dwyane Johnson (4.3 feet, ZONE). DERRICK ALLEN MAKES IT!
Score: 70-69

[08:29] Team_035 possession (Score: 70-69)
FOUL! Reach-in foul on Cade Markkanen during the drive. [IN THE BONUS! 5 team fouls] Dwyane Johnson to the line for 2 free throws. (Cade Markkanen: 2 personal fouls)   FT 1/2: GOOD   FT 2/2: GOOD Dwyane Johnson makes 2/2 from the line.
Score: 72-69

[08:12] Team_005 possession (Score: 72-69)
Cade Markkanen drives, picks up Magic Westbrook. Help arrives from Domantas Green! Cade Markkanen attempts a Layup. Contested by Domantas Green (4.1 feet, MAN). CADE MARKKANEN MAKES IT!
Score: 72-71

[07:54] Team_035 possession (Score: 72-71)
Shaquille Ginobili attempts a Midrange. Contested by Derrick Allen (4.1 feet, ZONE). Shaquille Ginobili misses. Rebound secured by Derrick Allen.

[07:40] Team_005 possession (Score: 72-71)
Jalen Rozier attempts a 3Pt. Contested by Shaquille Ginobili (4.3 feet, ZONE). Jalen Rozier misses. FOUL! Loose ball foul on Dwyane Johnson during the rebound battle. [Team fouls: 3] No free throws, side out. (Dwyane Johnson: 1 personal fouls)

[07:25] Team_005 possession (Score: 72-71)
Jalen Rozier attempts a 3Pt. Contested by Dwyane Johnson (4.2 feet, ZONE). Jalen Rozier misses. Rebound secured by Dwyane Johnson.

[07:10] Team_035 possession (Score: 72-71)
Magic Westbrook attempts a Midrange. Contested by Cade Markkanen (3.7 feet, MAN). MAGIC WESTBROOK MAKES IT!
Score: 74-71

[07:01] Team_005 possession (Score: 74-71)
Derrick Allen throws a bad pass out of bounds! TURNOVER! (dead ball)

[06:44] Team_035 possession (Score: 74-71)
Dwyane Johnson attempts a Midrange. Contested by Cade Markkanen (3.1 feet, MAN). Dwyane Johnson misses. Rebound secured by Derrick Allen.

[06:26] Team_005 possession (Score: 74-71)
Derrick Allen makes the Dunk and draws the foul on Dwyane Johnson! And-1! Derrick Allen to the line for 1. [Team fouls: 4] (Dwyane Johnson: 2 personal fouls)   FT 1/1: GOOD Derrick Allen makes 1/1 from the line.
Score: 74-74

[06:10] Team_035 possession (Score: 74-74)
Magic Westbrook drives, picks up Cade Markkanen. Help arrives from Anthony Rozier! Magic Westbrook attempts a Layup. Contested by Anthony Rozier (3.7 feet, MAN). MAGIC WESTBROOK MAKES IT! Assist: Domantas Green
Score: 76-74

[05:56] Team_005 possession (Score: 76-74)
Jalen Rozier attempts a Midrange. Contested by Gary Johnson (4.1 feet, ZONE). JALEN ROZIER MAKES IT!
Score: 76-76

[05:42] Team_035 possession (Score: 76-76)
Gary Johnson drives and kicks out. Gary Johnson attempts a 3Pt. Contested by Derrick Allen (4.2 feet, MAN). Gary Johnson misses. Offensive rebound by Magic Westbrook! Magic Westbrook kicks it out.

[05:31] Team_035 possession (Score: 76-76)
Shaquille Ginobili attempts a 3Pt. Contested by Derrick Allen (4.1 feet, ZONE). Shaquille Ginobili misses. Rebound secured by Cade Markkanen.

[05:21] Team_005 possession (Score: 76-76)
FOUL! Shooting foul on Domantas Green. Anthony Rozier to the line for 2 free throws. [BONUS: 5 team fouls] (Domantas Green: 1 personal fouls)   FT 1/2: GOOD   FT 2/2: GOOD Anthony Rozier makes 2/2 from the line.
Score: 76-78

[05:10] Team_035 possession (Score: 76-78)
Domantas Green attempts a 3Pt. Contested by Derrick Allen (4.6 feet, ZONE). Domantas Green misses. Rebound secured by Cade Markkanen.

[04:56] Team_005 possession (Score: 76-78)
FOUL! Shooting foul on Shaquille Ginobili. Anthony Rozier to the line for 3 free throws. [BONUS: 6 team fouls] (Shaquille Ginobili: 2 personal fouls)   FT 1/3: MISS   FT 2/3: GOOD   FT 3/3: GOOD Anthony Rozier makes 2/3 from the line.
Score: 76-80

[04:40] Team_035 possession (Score: 76-80)
Shaquille Ginobili attempts a 3Pt. Contested by Anthony Rozier (4.5 feet, MAN). Shaquille Ginobili misses. Rebound secured by Jalen Rozier.

[04:26] Team_005 possession (Score: 76-80)
Cade Markkanen attempts a Dunk. BLOCKED BY MAGIC WESTBROOK! Ball is loose! Rebound secured by Magic Westbrook.

[04:12] Team_035 possession (Score: 76-80)
FOUL! Holding foul on Derrick Allen. [IN THE BONUS! 6 team fouls] Gary Johnson to the line for 2 free throws. (Derrick Allen: 1 personal fouls)   FT 1/2: MISS   FT 2/2: MISS Gary Johnson makes 0/2 from the line. Rebound secured by Jalen Rozier.

[04:00] Team_005 possession (Score: 76-80)
Jalen Rozier attempts a Midrange. Contested by Dwyane Johnson (4.3 feet, MAN). JALEN ROZIER MAKES IT!
Score: 76-82

[03:41] Team_035 possession (Score: 76-82)
Gary Johnson commits a violation (traveling/carry)! TURNOVER! (dead ball)

[03:30] Team_005 possession (Score: 76-82)
FOUL! Shooting foul on Dwyane Johnson. Jalen Rozier to the line for 2 free throws. [BONUS: 7 team fouls] (Dwyane Johnson: 3 personal fouls)   FT 1/2: GOOD   FT 2/2: GOOD Jalen Rozier makes 2/2 from the line.
Score: 76-84

[03:17] Team_035 possession (Score: 76-84)
FOUL! Shooting foul on Anthony Rozier. Shaquille Ginobili to the line for 2 free throws. [BONUS: 7 team fouls] (Anthony Rozier: 3 personal fouls)   FT 1/2: GOOD   FT 2/2: GOOD Shaquille Ginobili makes 2/2 from the line.
Score: 78-84

[03:01] Team_005 possession (Score: 78-84)
Derrick Allen attempts a 3Pt. Contested by Shaquille Ginobili (4.5 feet, ZONE). Derrick Allen misses. Rebound secured by Gary Johnson.

[02:50] Team_035 possession (Score: 78-84)
Shaquille Ginobili attempts a 3Pt. Contested by Anthony Rozier (4.7 feet, MAN). Shaquille Ginobili misses. Rebound secured by Derrick Allen.

[02:39] Team_005 possession (Score: 78-84)
Cade Markkanen attempts a Layup. Contested by Magic Westbrook (4.4 feet, MAN). CADE MARKKANEN MAKES IT!
Score: 78-86

[02:23] Team_035 possession (Score: 78-86)
Dwyane Johnson attempts a Midrange. Contested by Jalen Rozier (5.1 feet, MAN). Dwyane Johnson misses. Rebound secured by Derrick Allen.

[02:05] Team_005 possession (Score: 78-86)
Jalen Rozier attempts a Midrange. Contested by Dwyane Johnson (4.5 feet, MAN). Jalen Rozier misses. Rebound secured by Gary Johnson.

[01:52] Team_035 possession (Score: 78-86)
Gary Johnson attempts a Midrange. Contested by Derrick Allen (5.0 feet, MAN). Gary Johnson misses. Rebound secured by Cade Markkanen.

[01:38] Team_005 possession (Score: 78-86)
Brandon George attempts a Midrange. Contested by Domantas Green (5.0 feet, MAN). BRANDON GEORGE MAKES IT! Assist: Anthony Rozier
Score: 78-88

[01:22] Team_035 possession (Score: 78-88)
Gary Johnson attempts a 3Pt. Contested by Derrick Allen (5.0 feet, MAN). GARY JOHNSON MAKES IT! Assist: Magic Westbrook
Score: 81-88

[01:10] Team_005 possession (Score: 81-88)
Jalen Rozier loses control! Ball rolls out of bounds! TURNOVER! (dead ball)

[01:10] Substitution (Team_035): Domantas Green OUT → CJ LaVine IN (stamina_rule2)

[01:10] Substitution (Team_035): Shaquille Ginobili OUT → Cole George IN (stamina_rule2)

[01:10] Substitution (Team_035): Gary Johnson OUT → Malcolm Turner IN (stamina_rule2)

[01:10] Substitution (Team_035): Dwyane Johnson OUT → Tobias Jordan IN (stamina_rule2)

[01:10] Substitution (Team_035): Magic Westbrook OUT → John Durant IN (stamina_rule2)

[01:10] Substitution (Team_005): Brandon George OUT → Blake O'Neal IN (stamina_rule2)

[01:10] Substitution (Team_005): Anthony Rozier OUT → Draymond Smith IN (stamina_rule2)

[01:10] Substitution (Team_005): Derrick Allen OUT → Lauri Wade IN (stamina_rule2)

[01:10] Substitution (Team_005): Jalen Rozier OUT → Isaiah Durant IN (stamina_rule2)

[01:10] Substitution (Team_005): Cade Markkanen OUT → Zion Parker IN (stamina_rule2)

[01:00] Team_035 possession (Score: 81-88)
Cole George makes the Dunk and draws the foul on Blake O'Neal! And-1! Cole George to the line for 1. [BONUS: 8 team fouls] (Blake O'Neal: 1 personal fouls)   FT 1/1: GOOD Cole George makes 1/1 from the line.
Score: 84-88

[00:43] Team_005 possession (Score: 84-88)
Zion Parker makes the Layup and draws the foul on John Durant! And-1! Zion Parker to the line for 1. [BONUS: 8 team fouls] (John Durant: 1 personal fouls)   FT 1/1: GOOD Zion Parker makes 1/1 from the line.
Score: 84-91

[00:30] Team_035 possession (Score: 84-91)
Tobias Jordan drives to the basket... Tobias Jordan loses control! Ball rolls out of bounds! TURNOVER! (dead ball)

[00:14] Team_005 possession (Score: 84-91)
Lauri Wade attempts a 3Pt. Contested by CJ LaVine (4.2 feet, ZONE). Lauri Wade misses. Rebound secured by Cole George.

================================================================================
                              3RD QUARTER COMPLETE                              
================================================================================

3RD QUARTER SCORE: Team_035 21, Team_005 34

BOX SCORE:
================================================================================

Team_035
--------------------------------------------------------------------------------
Player                MIN  PTS  REB  AST  TO      FG   FG%      3P   3P%
--------------------------------------------------------------------------------
Magic Westbrook        25    7    3    1   0   4/4   100.0     0/0   0.0
Dwyane Johnson         25    4    2    1   0   2/5    40.0     0/0   0.0
Gary Johnson           25    3    2    1   0   1/2    50.0     0/0   0.0
Cole George            12    3    1    0   0   1/1   100.0     0/0   0.0
Domantas Green         25    2    0    1   0   1/2    50.0     0/0   0.0
Shaquille Ginobili     25    2    0    0   0   1/5    20.0     0/0   0.0

TEAM: FG: 10/20 (50.0%), 3PT: 1/5 (20.0%), REB: 9 (3 off, 6 def), AST: 4, TO: 2
TEAM FOULS: 8 [Team_005 in BONUS]


Team_005
--------------------------------------------------------------------------------
Player                MIN  PTS  REB  AST  TO      FG   FG%      3P   3P%
--------------------------------------------------------------------------------
Jalen Rozier           25   10    2    0   0   4/6    66.7     0/0   0.0
Derrick Allen          25    9    4    0   0   3/4    75.0     0/0   0.0
Cade Markkanen         25    6    6    0   0   3/5    60.0     0/0   0.0
Anthony Rozier         25    4    0    1   0   2/2   100.0     0/0   0.0
Zion Parker            12    3    0    0   0   1/1   100.0     0/0   0.0
Brandon George         25    2    0    0   0   1/1   100.0     0/0   0.0
Lauri Wade             12    0    0    0   0   0/1     0.0     0/0   0.0

TEAM: FG: 14/20 (70.0%), 3PT: 4/7 (57.1%), REB: 11 (2 off, 9 def), AST: 1, TO: 2
TEAM FOULS: 8 [Team_035 in BONUS]

================================================================================

================================================================================
                       4TH QUARTER - Team_035 vs Team_005                       
================================================================================

[12:00] Team_035 possession (Score: 84-91)
Magic Westbrook attempts a Midrange. Contested by Cade Markkanen (3.9 feet, ZONE). Magic Westbrook misses. Rebound secured by Jalen Rozier.

[11:51] Team_005 possession (Score: 84-91)
Cade Markkanen attempts a Layup. Contested by Magic Westbrook (4.3 feet, MAN). CADE MARKKANEN MAKES IT! Assist: Brandon George
Score: 84-93

[11:38] Team_035 possession (Score: 84-93)
Shaquille Ginobili attempts a 3Pt. Contested by Derrick Allen (4.2 feet, ZONE). SHAQUILLE GINOBILI MAKES IT! Assist: Domantas Green
Score: 87-93

[11:19] Team_005 possession (Score: 87-93)
Derrick Allen drives, Gary Johnson stays with him. Derrick Allen attempts a Dunk. Contested by Gary Johnson (4.3 feet, MAN). DERRICK ALLEN MAKES IT! Assist: Cade Markkanen
Score: 87-95

[11:07] Team_035 possession (Score: 87-95)
Domantas Green drives and kicks out. Gary Johnson attempts a Midrange. Contested by Derrick Allen (4.4 feet, MAN). GARY JOHNSON MAKES IT!
Score: 89-95

[10:54] Team_005 possession (Score: 89-95)
Anthony Rozier drives to the basket... Anthony Rozier throws a bad pass out of bounds! TURNOVER! (dead ball)

[10:54] Substitution (Team_035): Domantas Green OUT → CJ LaVine IN (stamina_rule2)

[10:54] Substitution (Team_035): Magic Westbrook OUT → John Durant IN (stamina_rule2)

[10:54] Substitution (Team_005): Brandon George OUT → Blake O'Neal IN (stamina_rule2)

[10:54] Substitution (Team_005): Anthony Rozier OUT → Draymond Smith IN (stamina_rule2)

[10:54] Substitution (Team_005): Jalen Rozier OUT → Isaiah Durant IN (stamina_rule2)

[10:54] Substitution (Team_005): Cade Markkanen OUT → Zion Parker IN (stamina_rule2)

[10:39] Team_035 possession (Score: 89-95)
Dwyane Johnson attempts a 3Pt. Contested by Isaiah Durant (4.2 feet, MAN). DWYANE JOHNSON MAKES IT! Assist: John Durant
Score: 92-95

[10:27] Team_005 possession (Score: 92-95)
Zion Parker attempts a Midrange. Contested by CJ LaVine (4.2 feet, ZONE). ZION PARKER MAKES IT! Assist: Draymond Smith
Score: 92-97

[10:14] Team_035 possession (Score: 92-97)
Gary Johnson attempts a 3Pt. Contested by Derrick Allen (5.0 feet, MAN). GARY JOHNSON MAKES IT! Assist: CJ LaVine
Score: 95-97

[09:59] Team_005 possession (Score: 95-97)
Derrick Allen attempts a Layup. Contested by Dwyane Johnson (4.6 feet, ZONE). DERRICK ALLEN MAKES IT! Assist: Zion Parker
Score: 95-99

[09:42] Team_035 possession (Score: 95-99)
John Durant attempts a 3Pt. Contested by Derrick Allen (4.5 feet, ZONE). John Durant misses. Offensive rebound by John Durant! John Durant kicks it out.

[09:31] Team_035 possession (Score: 95-99)
Dwyane Johnson attempts a 3Pt. Contested by Blake O'Neal (3.9 feet, ZONE). DWYANE JOHNSON MAKES IT!
Score: 98-99

[09:18] Team_005 possession (Score: 98-99)
Derrick Allen attempts a 3Pt. Contested by Gary Johnson (4.5 feet, MAN). DERRICK ALLEN MAKES IT! Assist: Blake O'Neal
Score: 98-102

[09:04] Team_035 possession (Score: 98-102)
FOUL! Shooting foul on Zion Parker. John Durant to the line for 2 free throws. [Team fouls: 1] (Zion Parker: 1 personal fouls)   FT 1/2: GOOD   FT 2/2: GOOD John Durant makes 2/2 from the line.
Score: 100-102

[08:48] Team_005 possession (Score: 100-102)
Derrick Allen attempts a 3Pt. Contested by CJ LaVine (4.5 feet, ZONE). DERRICK ALLEN MAKES IT! Assist: Zion Parker
Score: 100-105

[08:32] Team_035 possession (Score: 100-105)
Gary Johnson attempts a 3Pt. Contested by Blake O'Neal (4.5 feet, ZONE). Gary Johnson misses. Rebound secured by Zion Parker.

[08:19] Team_005 possession (Score: 100-105)
Isaiah Durant attempts a 3Pt. Contested by CJ LaVine (4.4 feet, ZONE). Isaiah Durant misses. Rebound secured by Dwyane Johnson.

[08:00] Team_035 possession (Score: 100-105)
CJ LaVine attempts a 3Pt. Contested by Blake O'Neal (4.2 feet, ZONE). CJ LaVine misses. Rebound secured by Zion Parker.

[07:46] Team_005 possession (Score: 100-105)
Zion Parker attempts a Layup. Contested by Dwyane Johnson (4.6 feet, ZONE). ZION PARKER MAKES IT! Assist: Draymond Smith
Score: 100-107

[07:36] Team_035 possession (Score: 100-107)
John Durant drives and kicks out. FOUL! Shooting foul on Derrick Allen. Gary Johnson to the line for 2 free throws. [Team fouls: 2] (Derrick Allen: 1 personal fouls)   FT 1/2: GOOD   FT 2/2: GOOD Gary Johnson makes 2/2 from the line.
Score: 102-107

[07:20] Team_005 possession (Score: 102-107)
Derrick Allen drives and kicks out. Derrick Allen attempts a Midrange. Contested by Gary Johnson (4.4 feet, ZONE). Derrick Allen misses. Rebound secured by Dwyane Johnson.

[07:08] Team_035 possession (Score: 102-107)
Gary Johnson attempts a 3Pt. Contested by Derrick Allen (5.3 feet, MAN). GARY JOHNSON MAKES IT! Assist: John Durant
Score: 105-107

[06:55] Team_005 possession (Score: 105-107)
Blake O'Neal attempts a 3Pt. Contested by CJ LaVine (4.6 feet, MAN). Blake O'Neal misses. Rebound secured by Dwyane Johnson.

[06:39] Team_035 possession (Score: 105-107)
Gary Johnson attempts a 3Pt. Contested by Derrick Allen (5.4 feet, MAN). Gary Johnson misses. Rebound secured by Draymond Smith.

[06:24] Team_005 possession (Score: 105-107)
Derrick Allen attempts a Midrange. Contested by Gary Johnson (4.8 feet, MAN). Derrick Allen misses. Rebound secured by Gary Johnson.

[06:06] Team_035 possession (Score: 105-107)
CJ LaVine attempts a 3Pt. Contested by Blake O'Neal (4.2 feet, MAN). CJ LaVine misses. Rebound secured by Draymond Smith.

[05:51] Team_005 possession (Score: 105-107)
Zion Parker attempts a Layup. BLOCKED BY DWYANE JOHNSON! Ball is loose! Rebound secured by Gary Johnson.

[05:39] Team_035 possession (Score: 105-107)
Dwyane Johnson attempts a Layup. Contested by Isaiah Durant (4.2 feet, MAN). DWYANE JOHNSON MAKES IT! Assist: CJ LaVine
Score: 107-107

[05:23] Team_005 possession (Score: 107-107)
Isaiah Durant attempts a Midrange. Contested by Shaquille Ginobili (5.2 feet, ZONE). ISAIAH DURANT MAKES IT! Assist: Draymond Smith
Score: 107-109

[05:06] Team_035 possession (Score: 107-109)
John Durant attempts a 3Pt. Contested by Blake O'Neal (4.0 feet, ZONE). JOHN DURANT MAKES IT! Assist: Gary Johnson
Score: 110-109

[04:52] Team_005 possession (Score: 110-109)
Derrick Allen attempts a Midrange. Contested by Shaquille Ginobili (5.2 feet, ZONE). Derrick Allen misses. Rebound secured by Gary Johnson.

[04:38] Team_035 possession (Score: 110-109)
Dwyane Johnson attempts a 3Pt. Contested by Isaiah Durant (4.2 feet, MAN). Dwyane Johnson misses. Rebound secured by Blake O'Neal.

[04:22] Team_005 possession (Score: 110-109)
Draymond Smith attempts a 3Pt. Contested by Shaquille Ginobili (4.9 feet, MAN). Draymond Smith misses. Rebound secured by Dwyane Johnson.

[04:08] Team_035 possession (Score: 110-109)
CJ LaVine attempts a 3Pt. Contested by Blake O'Neal (4.3 feet, MAN). CJ LaVine misses. Rebound secured by Draymond Smith.

[03:49] Team_005 possession (Score: 110-109)
Zion Parker drives, John Durant stays with him. Zion Parker attempts a Layup. Contested by John Durant (4.4 feet, MAN). Zion Parker misses. Offensive rebound by Zion Parker! Zion Parker puts it back in!
Score: 110-111

[03:35] Team_035 possession (Score: 110-111)
FOUL! Holding foul on Draymond Smith. [Team fouls: 3] No free throws, side out. (Draymond Smith: 1 personal fouls)

[03:17] Team_035 possession (Score: 110-111)
John Durant drives to the basket... John Durant throws a bad pass out of bounds! TURNOVER! (dead ball)

[03:17] Substitution (Team_035): Shaquille Ginobili OUT → Cole George IN (stamina_rule2)

[03:17] Substitution (Team_035): Gary Johnson OUT → Malcolm Turner IN (stamina_rule2)

[03:17] Substitution (Team_035): Dwyane Johnson OUT → Tobias Jordan IN (stamina_rule2)

[03:17] Substitution (Team_005): Derrick Allen OUT → Lauri Wade IN (stamina_rule2)

[03:02] Team_005 possession (Score: 110-111)
Draymond Smith attempts a Midrange. Contested by Cole George (3.3 feet, ZONE). Draymond Smith misses. Rebound secured by Cole George.

[02:45] Team_035 possession (Score: 110-111)
Tobias Jordan attempts a Midrange. Contested by Isaiah Durant (4.3 feet, ZONE). TOBIAS JORDAN MAKES IT! Assist: Malcolm Turner
Score: 112-111

[02:27] Team_005 possession (Score: 112-111)
Lauri Wade attempts a Midrange. Contested by Malcolm Turner (4.8 feet, MAN). Lauri Wade misses. Rebound secured by Cole George.

[02:13] Team_035 possession (Score: 112-111)
Malcolm Turner attempts a Layup. Contested by Lauri Wade (5.6 feet, MAN). MALCOLM TURNER MAKES IT! Assist: Tobias Jordan
Score: 114-111

[02:01] Team_005 possession (Score: 114-111)
Zion Parker drives, John Durant stays with him. Zion Parker attempts a Layup. Contested by John Durant (4.5 feet, MAN). Zion Parker misses. Rebound secured by Tobias Jordan.

[01:46] Team_035 possession (Score: 114-111)
Malcolm Turner attempts a 3Pt. Contested by Blake O'Neal (4.9 feet, ZONE). Malcolm Turner misses. Rebound secured by Draymond Smith.

[01:30] Team_005 possession (Score: 114-111)
Blake O'Neal drives, picks up Tobias Jordan. Help arrives from Cole George! Blake O'Neal attempts a Layup. Contested by Cole George (4.7 feet, ZONE). Blake O'Neal misses. Rebound secured by Tobias Jordan.

[01:14] Team_035 possession (Score: 114-111)
Malcolm Turner attempts a Midrange. Contested by Zion Parker (4.9 feet, ZONE). Malcolm Turner misses. Offensive rebound by Cole George! Cole George kicks it out.

[01:04] Team_035 possession (Score: 114-111)
John Durant attempts a Midrange. Contested by Draymond Smith (4.6 feet, ZONE). John Durant misses. Offensive rebound by Cole George! Cole George kicks it out.

[00:49] Team_035 possession (Score: 114-111)
John Durant makes the Dunk and draws the foul on Blake O'Neal! And-1! John Durant to the line for 1. [Team fouls: 4] (Blake O'Neal: 1 personal fouls)   FT 1/1: GOOD John Durant makes 1/1 from the line.
Score: 117-111

[00:33] Team_005 possession (Score: 117-111)
FOUL! Reach-in foul on Tobias Jordan during the drive. [Team fouls: 1] No free throws, side out. (Tobias Jordan: 1 personal fouls)

[00:23] Team_005 possession (Score: 117-111)
Isaiah Durant makes the Midrange and draws the foul on Tobias Jordan! And-1! Isaiah Durant to the line for 1. [Team fouls: 2] (Tobias Jordan: 2 personal fouls)   FT 1/1: MISS Isaiah Durant makes 0/1 from the line. Rebound secured by Cole George.
Score: 117-113

[00:11] Team_035 possession (Score: 117-113)
Tobias Jordan attempts a 3Pt. Contested by Blake O'Neal (4.4 feet, ZONE). TOBIAS JORDAN MAKES IT! Assist: Cole George
Score: 120-113

================================================================================
                              4TH QUARTER COMPLETE                              
================================================================================

4TH QUARTER SCORE: Team_035 36, Team_005 22

BOX SCORE:
================================================================================

Team_035
--------------------------------------------------------------------------------
Player                MIN  PTS  REB  AST  TO      FG   FG%      3P   3P%
--------------------------------------------------------------------------------
Gary Johnson           34   10    3    1   0   4/6    66.7     0/0   0.0
Dwyane Johnson         34    8    4    0   0   3/4    75.0     0/0   0.0
John Durant            22    8    1    2   0   3/3   100.0     0/0   0.0
Tobias Jordan          15    5    2    1   0   2/2   100.0     0/0   0.0
Shaquille Ginobili     34    3    0    0   0   1/1   100.0     0/0   0.0
Malcolm Turner         15    2    0    1   0   1/2    50.0     0/0   0.0
Magic Westbrook        26    0    0    0   0   0/1     0.0     0/0   0.0
Domantas Green         26    0    0    1   0   0/0     0.0     0/0   0.0
CJ LaVine              22    0    0    2   0   0/3     0.0     0/0   0.0
Cole George            15    0    5    1   0   0/0     0.0     0/0   0.0

TEAM: FG: 14/22 (63.6%), 3PT: 7/14 (50.0%), REB: 15 (3 off, 12 def), AST: 9, TO: 1
TEAM FOULS: 2


Team_005
--------------------------------------------------------------------------------
Player                MIN  PTS  REB  AST  TO      FG   FG%      3P   3P%
--------------------------------------------------------------------------------
Derrick Allen          34   10    0    0   0   4/7    57.1     0/0   0.0
Zion Parker            22    6    3    2   0   3/5    60.0     0/0   0.0
Cade Markkanen         26    2    0    1   0   1/1   100.0     0/0   0.0
Isaiah Durant          22    2    0    0   0   1/3    33.3     0/0   0.0
Jalen Rozier           26    0    1    0   0   0/0     0.0     0/0   0.0
Brandon George         26    0    0    1   0   0/0     0.0     0/0   0.0
Draymond Smith         22    0    4    3   0   0/2     0.0     0/0   0.0
Blake O'Neal           22    0    1    1   0   0/2     0.0     0/0   0.0
Lauri Wade             15    0    0    0   0   0/1     0.0     0/0   0.0

TEAM: FG: 9/21 (42.9%), 3PT: 2/5 (40.0%), REB: 9 (1 off, 8 def), AST: 8, TO: 1
TEAM FOULS: 4

================================================================================

================================================================================
                               FULL GAME COMPLETE                               
================================================================================

FINAL SCORE: Team_035 120, Team_005 113

SCORING BY QUARTER:
--------------------------------------------------------------------------------
Team                     Q1     Q2     Q3     Q4    FINAL
--------------------------------------------------------------------------------
Team_035                 29     34     21     36      120
Team_005                 33     24     34     22      113
--------------------------------------------------------------------------------

FULL GAME BOX SCORE:
================================================================================

Team_035
--------------------------------------------------------------------------------
Player                MIN  PTS  REB  AST  TO      FG   FG%      3P   3P%      FT STL BLK
--------------------------------------------------------------------------------
Shaquille Ginobili     34   10    0    0   1   4/11   36.4   2/7    28.6   2/2     0   0
Gary Johnson           34   23    8    4   1   7/11   63.6   5/7    71.4   2/4     0   0
Dwyane Johnson         34   16    7    3   0   7/14   50.0   2/5    40.0   2/2     1   1
Domantas Green         26    9    0    2   1   5/8    62.5   1/4    25.0   2/2     1   0
Magic Westbrook        26   13    9    4   0   7/10   70.0   0/0     0.0   1/3     0   1
CJ LaVine              22    6    0    3   1   2/6    33.3   1/5    20.0   4/4     0   0
John Durant            22   13    3    2   1   6/8    75.0   1/1   100.0   4/4     0   1
Cole George            15    8   10    1   0   3/4    75.0   0/1     0.0   4/4     0   0
Malcolm Turner         15    6    0    1   0   3/5    60.0   0/2     0.0   2/3     0   0
Tobias Jordan          15   14    6    1   1   6/7    85.7   2/3    66.7   5/5     0   0

TEAM: FG: 50/85 (58.8%), 3PT: 14/35 (40.0%), REB: 44 (11 off, 33 def), AST: 21, TO: 6


Team_005
--------------------------------------------------------------------------------
Player                MIN  PTS  REB  AST  TO      FG   FG%      3P   3P%      FT STL BLK
--------------------------------------------------------------------------------
Derrick Allen          34   30    7    0   2  13/20   65.0   5/7    71.4   4/5     0   0
Brandon George         26    6    0    3   2   4/6    66.7   1/3    33.3   0/0     0   0
Anthony Rozier         26   12    0    2   0   5/7    71.4   2/3    66.7   5/6     0   0
Jalen Rozier           26   16    8    1   2   6/8    75.0   2/3    66.7   4/4     0   0
Cade Markkanen         26   15   11    3   1   5/7    71.4   1/1   100.0   0/0     1   0
Blake O'Neal           22    2    1    3   0   1/6    16.7   0/3     0.0   0/0     0   0
Draymond Smith         22    2    7    4   1   1/4    25.0   0/1     0.0   0/0     0   0
Isaiah Durant          22    8    0    0   1   4/10   40.0   0/2     0.0   3/5     0   0
Zion Parker            22   11    7    3   0   4/6    66.7   0/0     0.0   1/1     1   1
Lauri Wade             15    8    2    0   0   4/6    66.7   1/2    50.0   1/1     0   0

TEAM: FG: 47/80 (58.8%), 3PT: 12/25 (48.0%), REB: 42 (8 off, 34 def), AST: 19, TO: 9

================================================================================
