================================================================================
                        FULL GAME - Team_083 vs Team_094                        
================================================================================

================================================================================
                       1ST QUARTER - Team_083 vs Team_094                       
================================================================================

[12:00] Team_083 possession (Score: 0-0)
FOUL! Shooting foul on Terry Ingram. Malcolm Brogdon to the line for 2 free throws. [Team fouls: 1] (Terry Ingram: 1 personal fouls)   FT 1/2: GOOD   FT 2/2: GOOD Malcolm Brogdon makes 2/2 from the line.
Score: 2-0

[11:47] Team_094 possession (Score: 2-0)
Tim Russell makes the Dunk and draws the foul on Kyrie Griffin! And-1! Tim Russell to the line for 1. [Team fouls: 1] (Kyrie Griffin: 1 personal fouls)   FT 1/1: GOOD Tim Russell makes 1/1 from the line.
Score: 2-3

[11:35] Team_083 possession (Score: 2-3)
Malcolm Brogdon attempts a 3Pt. Contested by Terry Ingram (4.4 feet, MAN). MALCOLM BROGDON MAKES IT! Assist: Bradley Thompson
Score: 5-3

[11:23] Team_094 possession (Score: 5-3)
Kobe Wagner drives to the basket... Kobe Wagner loses the ball! Stripped by Kyrie Griffin! TURNOVER! (live ball)

[11:07] Team_083 possession (Score: 5-3)
Yao Oladipo attempts a 3Pt. Contested by Tim Russell (5.1 feet, ZONE). YAO OLADIPO MAKES IT! Assist: Karl Jokic
Score: 8-3

[10:49] Team_094 possession (Score: 8-3)
FOUL! Holding foul on Karl Jokic. [Team fouls: 2] No free throws, side out. (Karl Jokic: 1 personal fouls)

[10:36] Team_094 possession (Score: 8-3)
Kobe Bryant attempts a Midrange. Contested by Yao Oladipo (3.6 feet, ZONE). Kobe Bryant misses. Rebound secured by Bradley Thompson.

[10:19] Team_083 possession (Score: 8-3)
Bradley Thompson throws a bad pass out of bounds! TURNOVER! (dead ball)

[10:03] Team_094 possession (Score: 8-3)
Lauri Thompson drives, picks up Karl Jokic. Help arrives from Yao Oladipo! Lauri Thompson attempts a Dunk. Contested by Yao Oladipo (4.9 feet, MAN). LAURI THOMPSON MAKES IT!
Score: 8-5

[09:50] Team_083 possession (Score: 8-5)
Kyrie Griffin drives to the basket... Kyrie Griffin loses control! Ball rolls out of bounds! TURNOVER! (dead ball)

[09:34] Team_094 possession (Score: 8-5)
FOUL! Shooting foul on Kyrie Griffin. Tim Russell to the line for 2 free throws. [Team fouls: 3] (Kyrie Griffin: 2 personal fouls)   FT 1/2: GOOD   FT 2/2: MISS Tim Russell makes 1/2 from the line. Rebound secured by Bradley Thompson.
Score: 8-6

[09:14] Team_083 possession (Score: 8-6)
Yao Oladipo drives, Tim Russell stays with him. Yao Oladipo attempts a Layup. Contested by Tim Russell (5.1 feet, ZONE). YAO OLADIPO MAKES IT! Assist: Bradley Thompson
Score: 10-6

[08:55] Team_094 possession (Score: 10-6)
Tim Russell attempts a 3Pt. Contested by Kyrie Griffin (3.6 feet, MAN). Tim Russell misses. Rebound secured by Bradley Thompson.

[08:43] Team_083 possession (Score: 10-6)
Karl Jokic attempts a 3Pt. Contested by Lauri Thompson (5.3 feet, MAN). KARL JOKIC MAKES IT! Assist: Malcolm Brogdon
Score: 13-6

[08:29] Team_094 possession (Score: 13-6)
Kobe Wagner attempts a 3Pt. Contested by Yao Oladipo (3.8 feet, ZONE). KOBE WAGNER MAKES IT! Assist: Tim Russell
Score: 13-9

[08:15] Team_083 possession (Score: 13-9)
Yao Oladipo attempts a 3Pt. Contested by Kobe Wagner (4.4 feet, ZONE). YAO OLADIPO MAKES IT!
Score: 16-9

[08:03] Team_094 possession (Score: 16-9)
Kobe Bryant attempts a 3Pt. Contested by Bradley Thompson (3.9 feet, MAN). Kobe Bryant misses. Rebound secured by Kyrie Griffin.

[07:51] Team_083 possession (Score: 16-9)
Karl Jokic drives to the basket... Karl Jokic loses control! Ball rolls out of bounds! TURNOVER! (dead ball)

[07:39] Team_094 possession (Score: 16-9)
Terry Ingram drives, picks up Malcolm Brogdon. Help arrives from Yao Oladipo! Terry Ingram attempts a Dunk. Contested by Yao Oladipo (5.2 feet, MAN). Terry Ingram misses. Rebound secured by Bradley Thompson.

[07:27] Team_083 possession (Score: 16-9)
Yao Oladipo attempts a Midrange. Contested by Terry Ingram (5.0 feet, ZONE). Yao Oladipo misses. Rebound secured by Kobe Bryant.

[07:10] Team_094 possession (Score: 16-9)
Kobe Bryant attempts a 3Pt. Contested by Yao Oladipo (3.6 feet, ZONE). Kobe Bryant misses. Rebound secured by Yao Oladipo.

[06:53] Team_083 possession (Score: 16-9)
Kyrie Griffin attempts a Midrange. Contested by Tim Russell (5.1 feet, MAN). Kyrie Griffin misses. Rebound secured by Tim Russell.

[06:40] Team_094 possession (Score: 16-9)
Lauri Thompson attempts a 3Pt. Contested by Kyrie Griffin (3.8 feet, ZONE). Lauri Thompson misses. Rebound secured by Yao Oladipo.

[06:27] Team_083 possession (Score: 16-9)
Yao Oladipo attempts a Layup. Contested by Kobe Wagner (4.4 feet, MAN). YAO OLADIPO MAKES IT! Assist: Kyrie Griffin
Score: 18-9

[06:12] Team_094 possession (Score: 18-9)
Kobe Wagner attempts a 3Pt. Contested by Yao Oladipo (3.8 feet, MAN). Kobe Wagner misses. Rebound secured by Kyrie Griffin.

[06:02] Team_083 possession (Score: 18-9)
Malcolm Brogdon drives and kicks out. Karl Jokic attempts a Midrange. Contested by Lauri Thompson (4.8 feet, MAN). Karl Jokic misses. Offensive rebound by Kyrie Griffin! Kyrie Griffin kicks it out.

[05:47] Team_083 possession (Score: 18-9)
Yao Oladipo attempts a 3Pt. Contested by Kobe Wagner (4.4 feet, MAN). Yao Oladipo misses. FOUL! Loose ball foul on Kobe Wagner during the rebound battle. [Team fouls: 2] No free throws, side out. (Kobe Wagner: 1 personal fouls)

[05:32] Team_083 possession (Score: 18-9)
Karl Jokic makes the Layup and draws the foul on Lauri Thompson! And-1! Karl Jokic to the line for 1. [Team fouls: 3] (Lauri Thompson: 1 personal fouls)   FT 1/1: GOOD Karl Jokic makes 1/1 from the line.
Score: 21-9

[05:17] Team_094 possession (Score: 21-9)
Lauri Thompson drives and kicks out. Kobe Bryant attempts a Midrange. Contested by Bradley Thompson (3.7 feet, MAN). Kobe Bryant misses. Rebound secured by Kyrie Griffin.

[05:01] Team_083 possession (Score: 21-9)
Yao Oladipo attempts a 3Pt. Contested by Lauri Thompson (5.1 feet, ZONE). YAO OLADIPO MAKES IT! Assist: Karl Jokic
Score: 24-9

[04:51] Team_094 possession (Score: 24-9)
Terry Ingram attempts a 3Pt. Contested by Malcolm Brogdon (5.2 feet, MAN). Terry Ingram misses. Rebound secured by Bradley Thompson.

[04:34] Team_083 possession (Score: 24-9)
Yao Oladipo attempts a Layup. Contested by Tim Russell (5.1 feet, ZONE). YAO OLADIPO MAKES IT!
Score: 26-9

[04:21] Team_094 possession (Score: 26-9)
Tim Russell attempts a Midrange. Contested by Kyrie Griffin (3.7 feet, MAN). TIM RUSSELL MAKES IT!
Score: 26-11

[04:03] Team_083 possession (Score: 26-11)
Malcolm Brogdon attempts a Midrange. Contested by Lauri Thompson (4.5 feet, ZONE). MALCOLM BROGDON MAKES IT!
Score: 28-11

[03:47] Team_094 possession (Score: 28-11)
FOUL! Holding foul on Yao Oladipo. [Team fouls: 4] No free throws, side out. (Yao Oladipo: 1 personal fouls)

[03:33] Team_094 possession (Score: 28-11)
Kobe Wagner attempts a 3Pt. Contested by Kyrie Griffin (4.0 feet, ZONE). KOBE WAGNER MAKES IT! Assist: Terry Ingram
Score: 28-14

[03:17] Team_083 possession (Score: 28-14)
Karl Jokic attempts a 3Pt. Contested by Lauri Thompson (5.4 feet, MAN). KARL JOKIC MAKES IT! Assist: Bradley Thompson
Score: 31-14

[03:01] Team_094 possession (Score: 31-14)
Terry Ingram attempts a 3Pt. Contested by Malcolm Brogdon (5.3 feet, MAN). Terry Ingram misses. Offensive rebound by Tim Russell! Tim Russell kicks it out.

[02:51] Team_094 possession (Score: 31-14)
Terry Ingram attempts a Midrange. Contested by Kyrie Griffin (4.0 feet, ZONE). TERRY INGRAM MAKES IT!
Score: 31-16

[02:33] Team_083 possession (Score: 31-16)
Karl Jokic attempts a 3Pt. Contested by Lauri Thompson (5.5 feet, MAN). Karl Jokic misses. Rebound secured by Kobe Bryant.

[02:16] Team_094 possession (Score: 31-16)
Lauri Thompson attempts a 3Pt. Contested by Karl Jokic (5.1 feet, MAN). Lauri Thompson misses. Rebound secured by Bradley Thompson.

[01:58] Team_083 possession (Score: 31-16)
Kyrie Griffin drives and kicks out. Kyrie Griffin attempts a 3Pt. Contested by Tim Russell (5.1 feet, MAN). Kyrie Griffin misses. Rebound secured by Kobe Wagner.

[01:44] Team_094 possession (Score: 31-16)
Tim Russell attempts a 3Pt. Contested by Yao Oladipo (3.8 feet, ZONE). Tim Russell misses. Rebound secured by Bradley Thompson.

[01:25] Team_083 possession (Score: 31-16)
Kyrie Griffin attempts a 3Pt. Contested by Tim Russell (5.4 feet, MAN). Kyrie Griffin misses. Rebound secured by Kobe Bryant.

[01:12] Team_094 possession (Score: 31-16)
FOUL! Shooting foul on Karl Jokic. Lauri Thompson to the line for 2 free throws. [BONUS: 5 team fouls] (Karl Jokic: 2 personal fouls)   FT 1/2: MISS   FT 2/2: GOOD Lauri Thompson makes 1/2 from the line.
Score: 31-17

[01:00] Team_083 possession (Score: 31-17)
Malcolm Brogdon attempts a 3Pt. Contested by Terry Ingram (4.8 feet, MAN). MALCOLM BROGDON MAKES IT! Assist: Kyrie Griffin
Score: 34-17

[00:41] Team_094 possession (Score: 34-17)
Kobe Bryant drives, Bradley Thompson stays with him. Kobe Bryant attempts a Dunk. Contested by Bradley Thompson (4.4 feet, ZONE). Kobe Bryant misses. Rebound secured by Yao Oladipo.

[00:22] Team_083 possession (Score: 34-17)
Yao Oladipo drives, Tim Russell stays with him. Yao Oladipo attempts a Layup. Contested by Tim Russell (5.5 feet, ZONE). YAO OLADIPO MAKES IT! Assist: Malcolm Brogdon
Score: 36-17

[00:06] Team_094 possession (Score: 36-17)
FOUL! Holding foul on Malcolm Brogdon. [IN THE BONUS! 6 team fouls] Terry Ingram to the line for 2 free throws. (Malcolm Brogdon: 1 personal fouls)   FT 1/2: MISS   FT 2/2: GOOD Terry Ingram makes 1/2 from the line.
Score: 36-18

================================================================================
                              1ST QUARTER COMPLETE                              
================================================================================

1ST QUARTER SCORE: Team_083 36, Team_094 18

BOX SCORE:
================================================================================

Team_083
--------------------------------------------------------------------------------
Player                MIN  PTS  REB  AST  TO      FG   FG%      3P   3P%
--------------------------------------------------------------------------------
Yao Oladipo            12   17    3    0   0   7/8    87.5     0/0   0.0
Malcolm Brogdon        12   10    0    2   0   4/4   100.0     0/0   0.0
Karl Jokic             12    9    0    2   0   3/4    75.0     0/0   0.0
Bradley Thompson       12    0    8    3   0   0/0     0.0     0/0   0.0
Kyrie Griffin          12    0    4    2   0   0/3     0.0     0/0   0.0

TEAM: FG: 14/19 (73.7%), 3PT: 7/9 (77.8%), REB: 15 (2 off, 13 def), AST: 9, TO: 3
TEAM FOULS: 6 [Team_094 in BONUS]


Team_094
--------------------------------------------------------------------------------
Player                MIN  PTS  REB  AST  TO      FG   FG%      3P   3P%
--------------------------------------------------------------------------------
Kobe Wagner            12    6    1    0   0   2/3    66.7     0/0   0.0
Tim Russell            12    5    2    1   0   2/5    40.0     0/0   0.0
Lauri Thompson         12    3    0    0   0   2/5    40.0     0/0   0.0
Terry Ingram           12    3    0    1   0   2/4    50.0     0/0   0.0
Kobe Bryant            12    0    3    0   0   0/4     0.0     0/0   0.0

TEAM: FG: 8/21 (38.1%), 3PT: 2/10 (20.0%), REB: 6 (1 off, 5 def), AST: 2, TO: 1
TEAM FOULS: 3

================================================================================

================================================================================
                       2ND QUARTER - Team_083 vs Team_094                       
================================================================================

[12:00] Team_083 possession (Score: 36-18)
Karl Jokic attempts a 3Pt. BLOCKED BY KOBE WAGNER! Ball is loose! Offensive rebound by Kyrie Griffin! Kyrie Griffin kicks it out.

[11:43] Team_083 possession (Score: 36-18)
Malcolm Brogdon attempts a Layup. Contested by Terry Ingram (4.7 feet, MAN). MALCOLM BROGDON MAKES IT! Assist: Bradley Thompson
Score: 38-18

[11:29] Team_094 possession (Score: 38-18)
Kobe Bryant attempts a Midrange. Contested by Kyrie Griffin (4.0 feet, ZONE). Kobe Bryant misses. Rebound secured by Kyrie Griffin.

[11:13] Team_083 possession (Score: 38-18)
Yao Oladipo drives and kicks out. Karl Jokic attempts a 3Pt. Contested by Lauri Thompson (5.1 feet, MAN). KARL JOKIC MAKES IT! Assist: Malcolm Brogdon
Score: 41-18

[11:01] Team_094 possession (Score: 41-18)
Tim Russell attempts a 3Pt. Contested by Kyrie Griffin (4.0 feet, ZONE). Tim Russell misses. Rebound secured by Bradley Thompson.

[10:46] Team_083 possession (Score: 41-18)
Bradley Thompson drives and kicks out. Malcolm Brogdon attempts a 3Pt. Contested by Terry Ingram (5.2 feet, MAN). Malcolm Brogdon misses. Offensive rebound by Bradley Thompson! Bradley Thompson kicks it out.

[10:32] Team_083 possession (Score: 41-18)
Yao Oladipo drives, Kobe Wagner stays with him. Yao Oladipo attempts a Dunk. Contested by Kobe Wagner (4.8 feet, MAN). YAO OLADIPO MAKES IT!
Score: 43-18

[10:17] Team_094 possession (Score: 43-18)
Kobe Bryant drives, picks up Bradley Thompson. Help arrives from Karl Jokic! Kobe Bryant attempts a Dunk. Contested by Karl Jokic (4.4 feet, MAN). KOBE BRYANT MAKES IT! Assist: Lauri Thompson
Score: 43-20

[10:02] Team_083 possession (Score: 43-20)
Bradley Thompson attempts a Layup. Contested by Tim Russell (5.3 feet, ZONE). BRADLEY THOMPSON MAKES IT! Assist: Kyrie Griffin
Score: 45-20

[09:48] Team_094 possession (Score: 45-20)
Terry Ingram drives and kicks out. Terry Ingram attempts a Midrange. Contested by Malcolm Brogdon (5.3 feet, MAN). Terry Ingram misses. Offensive rebound by Kobe Bryant! Kobe Bryant puts it back in!
Score: 45-22

[09:36] Team_083 possession (Score: 45-22)
Kyrie Griffin drives, Tim Russell stays with him. Kyrie Griffin attempts a Dunk. Contested by Tim Russell (5.6 feet, ZONE). Kyrie Griffin misses. Rebound secured by Kobe Bryant.

[09:18] Team_094 possession (Score: 45-22)
Lauri Thompson attempts a 3Pt. Contested by Yao Oladipo (4.3 feet, ZONE). Lauri Thompson misses. Rebound secured by Bradley Thompson.

[09:02] Team_083 possession (Score: 45-22)
FOUL! Reach-in foul on Terry Ingram during the drive. [Team fouls: 1] No free throws, side out. (Terry Ingram: 1 personal fouls)

[08:45] Team_083 possession (Score: 45-22)
Bradley Thompson attempts a 3Pt. Contested by Kobe Bryant (5.6 feet, MAN). Bradley Thompson misses. Rebound secured by Kobe Wagner.

[08:33] Team_094 possession (Score: 45-22)
Kobe Bryant attempts a Layup. Contested by Bradley Thompson (4.7 feet, MAN). KOBE BRYANT MAKES IT! Assist: Terry Ingram
Score: 45-24

[08:20] Team_083 possession (Score: 45-24)
Kyrie Griffin loses the ball! Stripped by Tim Russell! TURNOVER! (live ball)

[08:01] Team_094 possession (Score: 45-24)
Kobe Wagner attempts a 3Pt. Contested by Yao Oladipo (4.5 feet, ZONE). KOBE WAGNER MAKES IT! Assist: Terry Ingram
Score: 45-27

[07:47] Team_083 possession (Score: 45-27)
Yao Oladipo attempts a Midrange. Contested by Kobe Wagner (5.1 feet, MAN). YAO OLADIPO MAKES IT!
Score: 47-27

[07:36] Team_094 possession (Score: 47-27)
Kobe Wagner attempts a 3Pt. Contested by Yao Oladipo (4.5 feet, ZONE). Kobe Wagner misses. Offensive rebound by Tim Russell! Tim Russell kicks it out.

[07:22] Team_094 possession (Score: 47-27)
Lauri Thompson attempts a 3Pt. Contested by Karl Jokic (5.5 feet, MAN). Lauri Thompson misses. Rebound secured by Bradley Thompson.

[07:05] Team_083 possession (Score: 47-27)
Bradley Thompson attempts a Midrange. Contested by Kobe Bryant (5.7 feet, MAN). Bradley Thompson misses. Rebound secured by Kobe Bryant.

[06:53] Team_094 possession (Score: 47-27)
Tim Russell drives and kicks out. Kobe Wagner attempts a Midrange. Contested by Kyrie Griffin (4.6 feet, ZONE). KOBE WAGNER MAKES IT! Assist: Tim Russell
Score: 47-29

[06:37] Team_083 possession (Score: 47-29)
Kyrie Griffin attempts a Layup. Contested by Tim Russell (5.9 feet, MAN). Kyrie Griffin misses. Rebound secured by Kobe Wagner.

[06:18] Team_094 possession (Score: 47-29)
Tim Russell attempts a Midrange. Contested by Kyrie Griffin (4.7 feet, MAN). TIM RUSSELL MAKES IT!
Score: 47-31

[06:05] Team_083 possession (Score: 47-31)
Malcolm Brogdon attempts a 3Pt. Contested by Terry Ingram (5.5 feet, MAN). MALCOLM BROGDON MAKES IT! Assist: Bradley Thompson
Score: 50-31

[05:51] Team_094 possession (Score: 50-31)
FOUL! Holding foul on Bradley Thompson. [Team fouls: 1] No free throws, side out. (Bradley Thompson: 1 personal fouls)

[05:40] Team_094 possession (Score: 50-31)
FOUL! Holding foul on Malcolm Brogdon. [Team fouls: 2] No free throws, side out. (Malcolm Brogdon: 1 personal fouls)

[05:26] Team_094 possession (Score: 50-31)
Tim Russell makes the Dunk and draws the foul on Kyrie Griffin! And-1! Tim Russell to the line for 1. [Team fouls: 3] (Kyrie Griffin: 1 personal fouls)   FT 1/1: GOOD Tim Russell makes 1/1 from the line.
Score: 50-34

[05:15] Team_083 possession (Score: 50-34)
Kyrie Griffin drives and kicks out. Bradley Thompson attempts a Midrange. Contested by Tim Russell (5.9 feet, ZONE). Bradley Thompson misses. Rebound secured by Kobe Wagner.

[04:58] Team_094 possession (Score: 50-34)
Terry Ingram attempts a 3Pt. Contested by Yao Oladipo (4.8 feet, ZONE). Terry Ingram misses. Rebound secured by Yao Oladipo.

[04:44] Team_083 possession (Score: 50-34)
Bradley Thompson drives to the basket... Bradley Thompson commits a violation (traveling/carry)! TURNOVER! (dead ball)

[04:44] Substitution (Team_083): Malcolm Brogdon OUT → Zion Markkanen IN (stamina_rule2)

[04:44] Substitution (Team_083): Karl Jokic OUT → Damian Towns IN (stamina_rule2)

[04:44] Substitution (Team_083): Yao Oladipo OUT → Domantas Doncic IN (stamina_rule2)

[04:44] Substitution (Team_083): Kyrie Griffin OUT → Cole Simmons IN (stamina_rule2)

[04:44] Substitution (Team_083): Bradley Thompson OUT → Victor McCollum IN (stamina_rule2)

[04:44] Substitution (Team_094): Terry Ingram OUT → Shaquille Bryant IN (stamina_rule2)

[04:44] Substitution (Team_094): Lauri Thompson OUT → Kevin Rozier IN (stamina_rule2)

[04:44] Substitution (Team_094): Kobe Wagner OUT → Ayo Gasol IN (stamina_rule2)

[04:44] Substitution (Team_094): Tim Russell OUT → Domantas Haliburton IN (stamina_rule2)

[04:44] Substitution (Team_094): Kobe Bryant OUT → Isaiah Quickley IN (stamina_rule2)

[04:27] Team_094 possession (Score: 50-34)
Domantas Haliburton drives, Victor McCollum stays with him. Domantas Haliburton attempts a Dunk. Contested by Victor McCollum (4.1 feet, ZONE). DOMANTAS HALIBURTON MAKES IT!
Score: 50-36

[04:09] Team_083 possession (Score: 50-36)
Domantas Doncic attempts a 3Pt. Contested by Ayo Gasol (5.0 feet, MAN). DOMANTAS DONCIC MAKES IT! Assist: Zion Markkanen
Score: 53-36

[03:55] Team_094 possession (Score: 53-36)
Shaquille Bryant attempts a Midrange. Contested by Damian Towns (4.6 feet, ZONE). Shaquille Bryant misses. FOUL! Loose ball foul on Cole Simmons during the rebound battle. [Team fouls: 4] No free throws, side out. (Cole Simmons: 1 personal fouls)

[03:42] Team_094 possession (Score: 53-36)
Isaiah Quickley attempts a 3Pt. Contested by Zion Markkanen (5.7 feet, ZONE). Isaiah Quickley misses. Rebound secured by Cole Simmons.

[03:33] Team_083 possession (Score: 53-36)
Victor McCollum drives, Isaiah Quickley stays with him. Victor McCollum attempts a Layup. Wide open! Isaiah Quickley is 6.7 feet away. [ZONE] VICTOR MCCOLLUM MAKES IT! Assist: Cole Simmons
Score: 55-36

[03:17] Team_094 possession (Score: 55-36)
FOUL! Reach-in foul on Victor McCollum during the drive. [IN THE BONUS! 5 team fouls] Isaiah Quickley to the line for 2 free throws. (Victor McCollum: 1 personal fouls)   FT 1/2: GOOD   FT 2/2: MISS Isaiah Quickley makes 1/2 from the line. Rebound secured by Damian Towns.
Score: 55-37

[03:03] Team_083 possession (Score: 55-37)
FOUL! Holding foul on Kevin Rozier. [Team fouls: 2] No free throws, side out. (Kevin Rozier: 1 personal fouls)

[02:47] Team_083 possession (Score: 55-37)
Victor McCollum drives to the basket... Victor McCollum throws a bad pass! Stolen by Isaiah Quickley! TURNOVER! (live ball)

[02:31] Team_094 possession (Score: 55-37)
Domantas Haliburton makes the Midrange and draws the foul on Cole Simmons! And-1! Domantas Haliburton to the line for 1. [BONUS: 6 team fouls] (Cole Simmons: 2 personal fouls)   FT 1/1: GOOD Domantas Haliburton makes 1/1 from the line.
Score: 55-40

[02:13] Team_083 possession (Score: 55-40)
Damian Towns attempts a 3Pt. Contested by Kevin Rozier (5.5 feet, MAN). DAMIAN TOWNS MAKES IT! Assist: Cole Simmons
Score: 58-40

[02:01] Team_094 possession (Score: 58-40)
Isaiah Quickley attempts a Midrange. Contested by Victor McCollum (4.3 feet, MAN). ISAIAH QUICKLEY MAKES IT! Assist: Domantas Haliburton
Score: 58-42

[01:46] Team_083 possession (Score: 58-42)
Damian Towns attempts a 3Pt. Contested by Kevin Rozier (5.5 feet, MAN). Damian Towns misses. Rebound secured by Domantas Haliburton.

[01:33] Team_094 possession (Score: 58-42)
Isaiah Quickley makes the Dunk and draws the foul on Victor McCollum! And-1! Isaiah Quickley to the line for 1. [BONUS: 7 team fouls] (Victor McCollum: 2 personal fouls)   FT 1/1: MISS Isaiah Quickley makes 0/1 from the line. Rebound secured by Victor McCollum.
Score: 58-44

[01:22] Team_083 possession (Score: 58-44)
Damian Towns attempts a 3Pt. Contested by Kevin Rozier (5.5 feet, MAN). Damian Towns misses. Rebound secured by Domantas Haliburton.

[01:07] Team_094 possession (Score: 58-44)
Domantas Haliburton attempts a Midrange. Contested by Cole Simmons (4.9 feet, MAN). DOMANTAS HALIBURTON MAKES IT! Assist: Shaquille Bryant
Score: 58-46

[00:56] Team_083 possession (Score: 58-46)
Damian Towns attempts a Layup. Wide open! Isaiah Quickley is 6.6 feet away. [ZONE] Damian Towns misses. Rebound secured by Ayo Gasol.

[00:44] Team_094 possession (Score: 58-46)
Kevin Rozier attempts a Midrange. Contested by Damian Towns (5.4 feet, MAN). Kevin Rozier misses. Rebound secured by Damian Towns.

[00:26] Team_083 possession (Score: 58-46)
Domantas Doncic drives, Ayo Gasol stays with him. Domantas Doncic attempts a Dunk. Contested by Ayo Gasol (5.0 feet, MAN). Domantas Doncic misses. Offensive rebound by Victor McCollum! Victor McCollum puts it back in!
Score: 60-46

[00:09] Team_094 possession (Score: 60-46)
Domantas Haliburton attempts a Layup. BLOCKED BY COLE SIMMONS! Ball deflects out of bounds off Domantas Haliburton.

================================================================================
                              2ND QUARTER COMPLETE                              
================================================================================

2ND QUARTER SCORE: Team_083 24, Team_094 28

BOX SCORE:
================================================================================

Team_083
--------------------------------------------------------------------------------
Player                MIN  PTS  REB  AST  TO      FG   FG%      3P   3P%
--------------------------------------------------------------------------------
Malcolm Brogdon        20    5    0    1   0   2/2   100.0     0/0   0.0
Yao Oladipo            20    4    1    0   0   2/2   100.0     0/0   0.0
Victor McCollum         5    4    2    0   0   2/2   100.0     0/0   0.0
Karl Jokic             20    3    0    0   0   1/1   100.0     0/0   0.0
Domantas Doncic         5    3    0    0   0   1/1   100.0     0/0   0.0
Damian Towns            5    3    2    0   0   1/4    25.0     0/0   0.0
Bradley Thompson       20    2    4    2   0   1/3    33.3     0/0   0.0
Kyrie Griffin          20    0    2    1   0   0/3     0.0     0/0   0.0
Zion Markkanen          5    0    0    1   0   0/0     0.0     0/0   0.0
Cole Simmons            5    0    1    2   0   0/0     0.0     0/0   0.0

TEAM: FG: 10/18 (55.6%), 3PT: 3/6 (50.0%), REB: 12 (3 off, 9 def), AST: 7, TO: 3
TEAM FOULS: 7 [Team_094 in BONUS]


Team_094
--------------------------------------------------------------------------------
Player                MIN  PTS  REB  AST  TO      FG   FG%      3P   3P%
--------------------------------------------------------------------------------
Domantas Haliburton     5    7    3    1   0   3/4    75.0     0/0   0.0
Kobe Bryant            20    6    3    0   0   3/4    75.0     0/0   0.0
Tim Russell            20    5    1    1   0   2/3    66.7     0/0   0.0
Kobe Wagner            20    5    3    0   0   2/2   100.0     0/0   0.0
Isaiah Quickley         5    2    0    0   0   1/4    25.0     0/0   0.0
Lauri Thompson         20    0    0    1   0   0/2     0.0     0/0   0.0
Terry Ingram           20    0    0    2   0   0/1     0.0     0/0   0.0
Shaquille Bryant        5    0    0    1   0   0/0     0.0     0/0   0.0
Ayo Gasol               5    0    1    0   0   0/0     0.0     0/0   0.0
Kevin Rozier            5    0    0    0   0   0/1     0.0     0/0   0.0

TEAM: FG: 11/21 (52.4%), 3PT: 1/6 (16.7%), REB: 11 (3 off, 8 def), AST: 6, TO: 0
TEAM FOULS: 2

================================================================================

================================================================================
                       3RD QUARTER - Team_083 vs Team_094                       
================================================================================

[12:00] Team_083 possession (Score: 60-46)
Kyrie Griffin throws a bad pass! Stolen by Tim Russell! TURNOVER! (live ball)

[11:43] Team_094 possession (Score: 60-46)
Terry Ingram attempts a Midrange. Contested by Malcolm Brogdon (5.2 feet, MAN). Terry Ingram misses. Rebound secured by Yao Oladipo.

[11:26] Team_083 possession (Score: 60-46)
Karl Jokic drives, Tim Russell stays with him. Karl Jokic attempts a Layup. Contested by Tim Russell (5.3 feet, ZONE). KARL JOKIC MAKES IT! Assist: Bradley Thompson
Score: 62-46

[11:09] Team_094 possession (Score: 62-46)
Tim Russell attempts a 3Pt. Contested by Kyrie Griffin (3.6 feet, MAN). Tim Russell misses. Rebound secured by Kyrie Griffin.

[10:49] Team_083 possession (Score: 62-46)
Kyrie Griffin drives and kicks out. Karl Jokic attempts a Midrange. Contested by Lauri Thompson (4.8 feet, MAN). KARL JOKIC MAKES IT! Assist: Yao Oladipo
Score: 64-46

[10:34] Team_094 possession (Score: 64-46)
Terry Ingram attempts a Layup. Contested by Kyrie Griffin (3.7 feet, ZONE). Terry Ingram misses. Offensive rebound by Kobe Bryant! Kobe Bryant puts it back in!
Score: 64-48

[10:20] Team_083 possession (Score: 64-48)
FOUL! Shooting foul on Terry Ingram. Malcolm Brogdon to the line for 2 free throws. [Team fouls: 1] (Terry Ingram: 1 personal fouls)   FT 1/2: GOOD   FT 2/2: GOOD Malcolm Brogdon makes 2/2 from the line.
Score: 66-48

[10:10] Team_094 possession (Score: 66-48)
FOUL! Shooting foul on Bradley Thompson. Kobe Bryant to the line for 2 free throws. [Team fouls: 1] (Bradley Thompson: 1 personal fouls)   FT 1/2: GOOD   FT 2/2: GOOD Kobe Bryant makes 2/2 from the line.
Score: 66-50

[09:57] Team_083 possession (Score: 66-50)
FOUL! Reach-in foul on Tim Russell during the drive. [Team fouls: 2] No free throws, side out. (Tim Russell: 1 personal fouls)

[09:43] Team_083 possession (Score: 66-50)
Yao Oladipo drives, picks up Kobe Wagner. Help arrives from Lauri Thompson! Yao Oladipo attempts a Dunk. Contested by Lauri Thompson (4.4 feet, MAN). Yao Oladipo misses. Rebound secured by Kobe Wagner.

[09:26] Team_094 possession (Score: 66-50)
Kobe Wagner attempts a 3Pt. Contested by Yao Oladipo (3.8 feet, ZONE). Kobe Wagner misses. Rebound secured by Bradley Thompson.

[09:09] Team_083 possession (Score: 66-50)
Malcolm Brogdon attempts a Midrange. Contested by Terry Ingram (4.4 feet, MAN). Malcolm Brogdon misses. Rebound secured by Kobe Wagner.

[08:55] Team_094 possession (Score: 66-50)
Kobe Bryant makes the Layup and draws the foul on Bradley Thompson! And-1! Kobe Bryant to the line for 1. [Team fouls: 2] (Bradley Thompson: 2 personal fouls)   FT 1/1: GOOD Kobe Bryant makes 1/1 from the line.
Score: 66-53

[08:42] Team_083 possession (Score: 66-53)
Malcolm Brogdon attempts a Midrange. Contested by Lauri Thompson (4.5 feet, ZONE). Malcolm Brogdon misses. Rebound secured by Tim Russell.

[08:29] Team_094 possession (Score: 66-53)
Kobe Wagner attempts a 3Pt. Contested by Yao Oladipo (3.8 feet, MAN). Kobe Wagner misses. Rebound secured by Yao Oladipo.

[08:14] Team_083 possession (Score: 66-53)
Kyrie Griffin attempts a 3Pt. Contested by Tim Russell (5.1 feet, MAN). Kyrie Griffin misses. Rebound secured by Kobe Wagner.

[07:54] Team_094 possession (Score: 66-53)
Tim Russell attempts a Midrange. Contested by Kyrie Griffin (3.6 feet, MAN). Tim Russell misses. Rebound secured by Bradley Thompson.

[07:37] Team_083 possession (Score: 66-53)
Bradley Thompson drives to the basket... Bradley Thompson loses control! Ball rolls out of bounds! TURNOVER! (dead ball)

[07:25] Team_094 possession (Score: 66-53)
Kobe Bryant attempts a Layup. Contested by Bradley Thompson (3.9 feet, MAN). KOBE BRYANT MAKES IT! Assist: Kobe Wagner
Score: 66-55

[07:14] Team_083 possession (Score: 66-55)
Yao Oladipo attempts a 3Pt. Contested by Kobe Wagner (4.4 feet, ZONE). Yao Oladipo misses. Rebound secured by Kobe Wagner.

[07:00] Team_094 possession (Score: 66-55)
Terry Ingram drives, picks up Malcolm Brogdon. Help arrives from Yao Oladipo! Terry Ingram attempts a Dunk. Contested by Yao Oladipo (5.2 feet, MAN). Terry Ingram misses. Rebound secured by Bradley Thompson.

[06:45] Team_083 possession (Score: 66-55)
FOUL! Shooting foul on Kobe Wagner. Yao Oladipo to the line for 2 free throws. [Team fouls: 3] (Kobe Wagner: 1 personal fouls)   FT 1/2: GOOD   FT 2/2: GOOD Yao Oladipo makes 2/2 from the line.
Score: 68-55

[06:32] Team_094 possession (Score: 68-55)
Tim Russell attempts a 3Pt. Contested by Kyrie Griffin (3.6 feet, MAN). Tim Russell misses. Rebound secured by Bradley Thompson.

[06:18] Team_083 possession (Score: 68-55)
Malcolm Brogdon attempts a Midrange. Contested by Terry Ingram (4.4 feet, MAN). Malcolm Brogdon misses. Offensive rebound by Bradley Thompson! Bradley Thompson's putback is no good. Rebound secured by Kobe Bryant.

[06:06] Team_094 possession (Score: 68-55)
Tim Russell drives and kicks out. Terry Ingram attempts a Midrange. Contested by Malcolm Brogdon (4.8 feet, MAN). Terry Ingram misses. Offensive rebound by Tim Russell! Tim Russell kicks it out.

[05:50] Team_094 possession (Score: 68-55)
Tim Russell drives to the basket... Tim Russell commits a violation (traveling/carry)! TURNOVER! (dead ball)

[05:38] Team_083 possession (Score: 68-55)
Malcolm Brogdon attempts a Midrange. Contested by Terry Ingram (4.4 feet, MAN). Malcolm Brogdon misses. Rebound secured by Kobe Wagner.

[05:22] Team_094 possession (Score: 68-55)
Kobe Bryant attempts a 3Pt. Contested by Yao Oladipo (3.6 feet, ZONE). Kobe Bryant misses. Offensive rebound by Kobe Bryant! Kobe Bryant puts it back in!
Score: 68-57

[05:06] Team_083 possession (Score: 68-57)
FOUL! Shooting foul on Lauri Thompson. Karl Jokic to the line for 3 free throws. [Team fouls: 4] (Lauri Thompson: 1 personal fouls)   FT 1/3: MISS   FT 2/3: GOOD   FT 3/3: GOOD Karl Jokic makes 2/3 from the line.
Score: 70-57

[04:52] Team_094 possession (Score: 70-57)
Tim Russell drives, picks up Bradley Thompson. Help arrives from Karl Jokic! Tim Russell attempts a Layup. Contested by Karl Jokic (3.9 feet, ZONE). TIM RUSSELL MAKES IT!
Score: 70-59

[04:33] Team_083 possession (Score: 70-59)
FOUL! Reach-in foul on Tim Russell during the drive. [IN THE BONUS! 5 team fouls] Kyrie Griffin to the line for 2 free throws. (Tim Russell: 2 personal fouls)   FT 1/2: MISS   FT 2/2: GOOD Kyrie Griffin makes 1/2 from the line.
Score: 71-59

[04:21] Team_094 possession (Score: 71-59)
Lauri Thompson drives and kicks out. Tim Russell attempts a Midrange. Contested by Yao Oladipo (3.4 feet, ZONE). Tim Russell misses. Rebound secured by Yao Oladipo.

[04:03] Team_083 possession (Score: 71-59)
Karl Jokic attempts a 3Pt. Contested by Kobe Wagner (4.7 feet, ZONE). Karl Jokic misses. Offensive rebound by Kyrie Griffin! Kyrie Griffin kicks it out.

[03:48] Team_083 possession (Score: 71-59)
Karl Jokic attempts a Midrange. Contested by Lauri Thompson (5.4 feet, MAN). Karl Jokic misses. Offensive rebound by Kyrie Griffin! Kyrie Griffin kicks it out.

[03:32] Team_083 possession (Score: 71-59)
Karl Jokic drives, Lauri Thompson stays with him. Karl Jokic attempts a Dunk. Contested by Lauri Thompson (5.4 feet, MAN). KARL JOKIC MAKES IT! Assist: Kyrie Griffin
Score: 73-59

[03:12] Team_094 possession (Score: 73-59)
Kobe Wagner drives, picks up Yao Oladipo. Help arrives from Karl Jokic! Kobe Wagner attempts a Layup. Contested by Karl Jokic (3.9 feet, MAN). KOBE WAGNER MAKES IT! Assist: Tim Russell
Score: 73-61

[02:59] Team_083 possession (Score: 73-61)
Karl Jokic attempts a 3Pt. Contested by Terry Ingram (5.4 feet, ZONE). Karl Jokic misses. Rebound secured by Kobe Bryant.

[02:43] Team_094 possession (Score: 73-61)
Terry Ingram attempts a 3Pt. Contested by Yao Oladipo (3.9 feet, ZONE). Terry Ingram misses. Rebound secured by Kyrie Griffin.

[02:24] Team_083 possession (Score: 73-61)
Bradley Thompson loses control! Ball rolls out of bounds! TURNOVER! (dead ball)

[02:24] Substitution (Team_094): Terry Ingram OUT → Shaquille Bryant IN (stamina_rule2)

[02:12] Team_094 possession (Score: 73-61)
Kobe Bryant attempts a Layup. Contested by Kyrie Griffin (3.9 feet, ZONE). KOBE BRYANT MAKES IT! Assist: Tim Russell
Score: 73-63

[02:01] Team_083 possession (Score: 73-63)
Yao Oladipo attempts a 3Pt. Contested by Kobe Wagner (4.7 feet, MAN). Yao Oladipo misses. Offensive rebound by Bradley Thompson! Bradley Thompson kicks it out.

[01:50] Team_083 possession (Score: 73-63)
Yao Oladipo attempts a Layup. Contested by Tim Russell (5.3 feet, ZONE). YAO OLADIPO MAKES IT! Assist: Karl Jokic
Score: 75-63

[01:35] Team_094 possession (Score: 75-63)
FOUL! Reach-in foul on Malcolm Brogdon during the drive. [Team fouls: 3] No free throws, side out. (Malcolm Brogdon: 1 personal fouls)

[01:19] Team_094 possession (Score: 75-63)
Tim Russell drives to the basket... Tim Russell throws a bad pass out of bounds! TURNOVER! (dead ball)

[01:19] Substitution (Team_083): Malcolm Brogdon OUT → Zion Markkanen IN (stamina_rule2)

[01:19] Substitution (Team_083): Karl Jokic OUT → Damian Towns IN (stamina_rule2)

[01:19] Substitution (Team_083): Yao Oladipo OUT → Domantas Doncic IN (stamina_rule2)

[01:19] Substitution (Team_083): Kyrie Griffin OUT → Cole Simmons IN (stamina_rule2)

[01:19] Substitution (Team_083): Bradley Thompson OUT → Victor McCollum IN (stamina_rule2)

[01:19] Substitution (Team_094): Lauri Thompson OUT → Kevin Rozier IN (stamina_rule2)

[01:19] Substitution (Team_094): Kobe Wagner OUT → Ayo Gasol IN (stamina_rule2)

[01:19] Substitution (Team_094): Tim Russell OUT → Domantas Haliburton IN (stamina_rule2)

[01:19] Substitution (Team_094): Kobe Bryant OUT → Isaiah Quickley IN (stamina_rule2)

[01:08] Team_083 possession (Score: 75-63)
FOUL! Reach-in foul on Isaiah Quickley during the drive. [IN THE BONUS! 6 team fouls] Domantas Doncic to the line for 2 free throws. (Isaiah Quickley: 1 personal fouls)   FT 1/2: GOOD   FT 2/2: MISS Domantas Doncic makes 1/2 from the line. Rebound secured by Ayo Gasol.
Score: 76-63

[00:51] Team_094 possession (Score: 76-63)
Domantas Haliburton drives, picks up Cole Simmons. Help arrives from Damian Towns! Domantas Haliburton attempts a Dunk. Contested by Damian Towns (4.9 feet, MAN). DOMANTAS HALIBURTON MAKES IT!
Score: 76-65

[00:40] Team_083 possession (Score: 76-65)
FOUL! Shooting foul on Isaiah Quickley. Victor McCollum to the line for 2 free throws. [BONUS: 7 team fouls] (Isaiah Quickley: 2 personal fouls)   FT 1/2: GOOD   FT 2/2: GOOD Victor McCollum makes 2/2 from the line.
Score: 78-65

[00:27] Team_094 possession (Score: 78-65)
Domantas Haliburton drives and kicks out. Ayo Gasol attempts a 3Pt. Contested by Domantas Doncic (4.5 feet, MAN). AYO GASOL MAKES IT! Assist: Isaiah Quickley
Score: 78-68

[00:10] Team_083 possession (Score: 78-68)
Victor McCollum drives, Isaiah Quickley stays with him. Victor McCollum attempts a Dunk. Wide open! Isaiah Quickley is 6.7 feet away. [MAN] VICTOR MCCOLLUM MAKES IT!
Score: 80-68

================================================================================
                              3RD QUARTER COMPLETE                              
================================================================================

3RD QUARTER SCORE: Team_083 20, Team_094 22

BOX SCORE:
================================================================================

Team_083
--------------------------------------------------------------------------------
Player                MIN  PTS  REB  AST  TO      FG   FG%      3P   3P%
--------------------------------------------------------------------------------
Karl Jokic             31    8    0    1   0   4/5    80.0     0/0   0.0
Yao Oladipo            31    4    3    1   0   2/4    50.0     0/0   0.0
Victor McCollum         6    4    0    0   0   2/2   100.0     0/0   0.0
Malcolm Brogdon        31    2    0    0   0   1/5    20.0     0/0   0.0
Kyrie Griffin          31    1    4    1   0   1/2    50.0     0/0   0.0
Bradley Thompson       31    0    5    1   0   0/0     0.0     0/0   0.0
Domantas Doncic         6    0    0    0   0   0/1     0.0     0/0   0.0

TEAM: FG: 10/19 (52.6%), 3PT: 1/4 (25.0%), REB: 13 (4 off, 9 def), AST: 4, TO: 3
TEAM FOULS: 3


Team_094
--------------------------------------------------------------------------------
Player                MIN  PTS  REB  AST  TO      FG   FG%      3P   3P%
--------------------------------------------------------------------------------
Kobe Bryant            31   13    4    0   0   6/6   100.0     0/0   0.0
Ayo Gasol               6    3    1    0   0   1/1   100.0     0/0   0.0
Tim Russell            31    2    2    2   0   1/4    25.0     0/0   0.0
Kobe Wagner            31    2    5    1   0   1/3    33.3     0/0   0.0
Domantas Haliburton     6    2    0    0   0   1/1   100.0     0/0   0.0
Terry Ingram           30    0    0    0   0   0/3     0.0     0/0   0.0
Lauri Thompson         31    0    0    0   0   0/1     0.0     0/0   0.0
Isaiah Quickley         6    0    0    1   0   0/0     0.0     0/0   0.0

TEAM: FG: 10/19 (52.6%), 3PT: 1/6 (16.7%), REB: 11 (3 off, 8 def), AST: 4, TO: 2
TEAM FOULS: 7 [Team_083 in BONUS]

================================================================================

================================================================================
                       4TH QUARTER - Team_083 vs Team_094                       
================================================================================

[12:00] Team_083 possession (Score: 80-68)
Kyrie Griffin attempts a Midrange. Contested by Tim Russell (5.2 feet, MAN). Kyrie Griffin misses. Rebound secured by Tim Russell.

[11:48] Team_094 possession (Score: 80-68)
Kobe Wagner attempts a 3Pt. Contested by Yao Oladipo (3.9 feet, MAN). Kobe Wagner misses. Rebound secured by Bradley Thompson.

[11:29] Team_083 possession (Score: 80-68)
Kyrie Griffin drives, picks up Tim Russell. Help arrives from Lauri Thompson! Kyrie Griffin attempts a Layup. Contested by Lauri Thompson (5.2 feet, ZONE). KYRIE GRIFFIN MAKES IT! Assist: Yao Oladipo
Score: 82-68

[11:17] Team_094 possession (Score: 82-68)
Tim Russell attempts a Midrange. Contested by Yao Oladipo (3.7 feet, ZONE). Tim Russell misses. Rebound secured by Yao Oladipo.

[11:02] Team_083 possession (Score: 82-68)
Bradley Thompson attempts a Midrange. Contested by Kobe Bryant (5.2 feet, MAN). Bradley Thompson misses. Offensive rebound by Bradley Thompson! Bradley Thompson kicks it out.

[10:45] Team_083 possession (Score: 82-68)
Malcolm Brogdon drives, picks up Tim Russell. Help arrives from Lauri Thompson! Malcolm Brogdon attempts a Dunk. Contested by Lauri Thompson (4.6 feet, ZONE). MALCOLM BROGDON MAKES IT!
Score: 84-68

[10:31] Team_094 possession (Score: 84-68)
Lauri Thompson attempts a 3Pt. Contested by Karl Jokic (5.1 feet, MAN). LAURI THOMPSON MAKES IT! Assist: Tim Russell
Score: 84-71

[10:16] Team_083 possession (Score: 84-71)
Yao Oladipo attempts a 3Pt. Contested by Kobe Wagner (4.6 feet, MAN). Yao Oladipo misses. Rebound secured by Kobe Wagner.

[10:04] Team_094 possession (Score: 84-71)
Tim Russell attempts a 3Pt. Contested by Kyrie Griffin (3.9 feet, MAN). TIM RUSSELL MAKES IT! Assist: Kobe Wagner
Score: 84-74

[09:45] Team_083 possession (Score: 84-74)
Kyrie Griffin attempts a Midrange. Contested by Lauri Thompson (5.4 feet, ZONE). Kyrie Griffin misses. Rebound secured by Kobe Bryant.

[09:34] Team_094 possession (Score: 84-74)
Terry Ingram attempts a 3Pt. Contested by Yao Oladipo (4.0 feet, ZONE). Terry Ingram misses. FOUL! Loose ball foul on Kyrie Griffin during the rebound battle. [Team fouls: 1] No free throws, side out. (Kyrie Griffin: 1 personal fouls)

[09:20] Team_094 possession (Score: 84-74)
FOUL! Holding foul on Yao Oladipo. [Team fouls: 2] No free throws, side out. (Yao Oladipo: 1 personal fouls)

[09:06] Team_094 possession (Score: 84-74)
Kobe Wagner attempts a 3Pt. Contested by Yao Oladipo (4.2 feet, MAN). KOBE WAGNER MAKES IT!
Score: 84-77

[08:53] Team_083 possession (Score: 84-77)
Kyrie Griffin drives, picks up Tim Russell. Help arrives from Lauri Thompson! Kyrie Griffin attempts a Dunk. Contested by Lauri Thompson (5.5 feet, ZONE). KYRIE GRIFFIN MAKES IT!
Score: 86-77

[08:41] Team_094 possession (Score: 86-77)
Terry Ingram drives and kicks out. Kobe Bryant attempts a 3Pt. Contested by Yao Oladipo (3.8 feet, ZONE). Kobe Bryant misses. Rebound secured by Yao Oladipo.

[08:26] Team_083 possession (Score: 86-77)
Bradley Thompson attempts a Midrange. Contested by Lauri Thompson (5.3 feet, ZONE). BRADLEY THOMPSON MAKES IT! Assist: Yao Oladipo
Score: 88-77

[08:10] Team_094 possession (Score: 88-77)
Terry Ingram attempts a 3Pt. Contested by Yao Oladipo (4.2 feet, ZONE). Terry Ingram misses. Rebound secured by Kyrie Griffin.

[07:54] Team_083 possession (Score: 88-77)
Bradley Thompson attempts a Midrange. BLOCKED BY KOBE BRYANT! Ball is loose! Offensive rebound by Kyrie Griffin! Kyrie Griffin kicks it out.

[07:44] Team_083 possession (Score: 88-77)
Kyrie Griffin attempts a 3Pt. Contested by Kobe Wagner (4.9 feet, ZONE). Kyrie Griffin misses. FOUL! Loose ball foul on Kobe Wagner during the rebound battle. [Team fouls: 1] No free throws, side out. (Kobe Wagner: 1 personal fouls)

[07:30] Team_083 possession (Score: 88-77)
Bradley Thompson drives and kicks out. Bradley Thompson attempts a Midrange. Contested by Lauri Thompson (5.4 feet, ZONE). Bradley Thompson misses. Offensive rebound by Bradley Thompson! Bradley Thompson kicks it out.

[07:16] Team_083 possession (Score: 88-77)
Kyrie Griffin makes the 3Pt and draws the foul on Kobe Wagner! And-1! Kyrie Griffin to the line for 1. [Team fouls: 2] (Kobe Wagner: 2 personal fouls)   FT 1/1: GOOD Kyrie Griffin makes 1/1 from the line.
Score: 92-77

[07:04] Team_094 possession (Score: 92-77)
Lauri Thompson attempts a 3Pt. Contested by Karl Jokic (5.4 feet, MAN). Lauri Thompson misses. Rebound secured by Yao Oladipo.

[06:48] Team_083 possession (Score: 92-77)
Karl Jokic attempts a 3Pt. Contested by Lauri Thompson (5.8 feet, MAN). Karl Jokic misses. Rebound secured by Kobe Wagner.

[06:36] Team_094 possession (Score: 92-77)
Lauri Thompson drives to the basket... Lauri Thompson throws a bad pass! Stolen by Kyrie Griffin! TURNOVER! (live ball)

[06:20] Team_083 possession (Score: 92-77)
Karl Jokic attempts a 3Pt. Contested by Lauri Thompson (5.9 feet, MAN). Karl Jokic misses. Rebound secured by Kobe Bryant.

[06:08] Team_094 possession (Score: 92-77)
Kobe Wagner drives, Yao Oladipo stays with him. Kobe Wagner attempts a Layup. Contested by Yao Oladipo (4.5 feet, MAN). KOBE WAGNER MAKES IT! Assist: Tim Russell
Score: 92-79

[05:53] Team_083 possession (Score: 92-79)
Bradley Thompson loses control! Ball rolls out of bounds! TURNOVER! (dead ball)

[05:53] Substitution (Team_083): Malcolm Brogdon OUT → Zion Markkanen IN (stamina_rule2)

[05:53] Substitution (Team_083): Karl Jokic OUT → Damian Towns IN (stamina_rule2)

[05:53] Substitution (Team_083): Yao Oladipo OUT → Domantas Doncic IN (stamina_rule2)

[05:53] Substitution (Team_083): Kyrie Griffin OUT → Cole Simmons IN (stamina_rule2)

[05:53] Substitution (Team_083): Bradley Thompson OUT → Victor McCollum IN (stamina_rule2)

[05:53] Substitution (Team_094): Terry Ingram OUT → Shaquille Bryant IN (stamina_rule2)

[05:53] Substitution (Team_094): Lauri Thompson OUT → Kevin Rozier IN (stamina_rule2)

[05:53] Substitution (Team_094): Kobe Wagner OUT → Ayo Gasol IN (stamina_rule2)

[05:53] Substitution (Team_094): Tim Russell OUT → Domantas Haliburton IN (stamina_rule2)

[05:53] Substitution (Team_094): Kobe Bryant OUT → Isaiah Quickley IN (stamina_rule2)

[05:35] Team_094 possession (Score: 92-79)
Shaquille Bryant attempts a 3Pt. Contested by Zion Markkanen (5.0 feet, MAN). SHAQUILLE BRYANT MAKES IT! Assist: Domantas Haliburton
Score: 92-82

[05:21] Team_083 possession (Score: 92-82)
Cole Simmons attempts a 3Pt. Contested by Domantas Haliburton (5.8 feet, MAN). Cole Simmons misses. Rebound secured by Isaiah Quickley.

[05:06] Team_094 possession (Score: 92-82)
Shaquille Bryant attempts a Midrange. Contested by Zion Markkanen (5.0 feet, MAN). Shaquille Bryant misses. Rebound secured by Damian Towns.

[04:55] Team_083 possession (Score: 92-82)
Damian Towns attempts a 3Pt. Wide open! Domantas Haliburton is 6.3 feet away. [ZONE] Damian Towns misses. Rebound secured by Domantas Haliburton.

[04:44] Team_094 possession (Score: 92-82)
Isaiah Quickley attempts a Layup. Contested by Victor McCollum (4.3 feet, MAN). ISAIAH QUICKLEY MAKES IT! Assist: Shaquille Bryant
Score: 92-84

[04:30] Team_083 possession (Score: 92-84)
FOUL! Offensive foul on Cole Simmons! Domantas Haliburton drew the charge! [Team fouls: 3] (Cole Simmons: 1 personal fouls) TURNOVER! (dead ball)

[04:16] Team_094 possession (Score: 92-84)
Domantas Haliburton attempts a Midrange. Contested by Cole Simmons (4.9 feet, ZONE). Domantas Haliburton misses. Rebound secured by Victor McCollum.

[04:04] Team_083 possession (Score: 92-84)
Damian Towns attempts a 3Pt. Wide open! Domantas Haliburton is 6.3 feet away. [ZONE] Damian Towns misses. Offensive rebound by Damian Towns! Damian Towns kicks it out.

[03:51] Team_083 possession (Score: 92-84)
Cole Simmons drives, Isaiah Quickley stays with him. Cole Simmons attempts a Layup. Wide open! Isaiah Quickley is 6.0 feet away. [ZONE] COLE SIMMONS MAKES IT! Assist: Zion Markkanen
Score: 94-84

[03:37] Team_094 possession (Score: 94-84)
Domantas Haliburton attempts a Midrange. Contested by Cole Simmons (4.9 feet, MAN). DOMANTAS HALIBURTON MAKES IT!
Score: 94-86

[03:21] Team_083 possession (Score: 94-86)
Zion Markkanen attempts a 3Pt. Contested by Shaquille Bryant (5.5 feet, MAN). Zion Markkanen misses. Rebound secured by Isaiah Quickley.

[03:09] Team_094 possession (Score: 94-86)
Shaquille Bryant drives, picks up Victor McCollum. Help arrives from Damian Towns! Shaquille Bryant attempts a Dunk. Contested by Damian Towns (3.7 feet, ZONE). Shaquille Bryant misses. Rebound secured by Victor McCollum.

[02:57] Team_083 possession (Score: 94-86)
Damian Towns drives, picks up Kevin Rozier. Help arrives from Ayo Gasol! Damian Towns attempts a Dunk. Contested by Ayo Gasol (5.5 feet, MAN). DAMIAN TOWNS MAKES IT!
Score: 96-86

[02:43] Team_094 possession (Score: 96-86)
FOUL! Shooting foul on Damian Towns. Kevin Rozier to the line for 2 free throws. [Team fouls: 4] (Damian Towns: 1 personal fouls)   FT 1/2: GOOD   FT 2/2: GOOD Kevin Rozier makes 2/2 from the line.
Score: 96-88

[02:29] Team_083 possession (Score: 96-88)
Damian Towns attempts a Layup. Contested by Kevin Rozier (5.5 feet, MAN). DAMIAN TOWNS MAKES IT! Assist: Domantas Doncic
Score: 98-88

[02:12] Team_094 possession (Score: 98-88)
Isaiah Quickley drives, picks up Victor McCollum. Help arrives from Damian Towns! Isaiah Quickley attempts a Dunk. Contested by Damian Towns (4.3 feet, MAN). ISAIAH QUICKLEY MAKES IT!
Score: 98-90

[02:02] Team_083 possession (Score: 98-90)
Domantas Doncic drives and kicks out. Zion Markkanen attempts a Midrange. Contested by Shaquille Bryant (5.3 feet, MAN). ZION MARKKANEN MAKES IT! Assist: Domantas Doncic
Score: 100-90

[01:47] Team_094 possession (Score: 100-90)
FOUL! Shooting foul on Zion Markkanen. Shaquille Bryant to the line for 2 free throws. [BONUS: 5 team fouls] (Zion Markkanen: 1 personal fouls)   FT 1/2: GOOD   FT 2/2: GOOD Shaquille Bryant makes 2/2 from the line.
Score: 100-92

[01:33] Team_083 possession (Score: 100-92)
FOUL! Reach-in foul on Isaiah Quickley during the drive. [Team fouls: 3] No free throws, side out. (Isaiah Quickley: 1 personal fouls)

[01:15] Team_083 possession (Score: 100-92)
Zion Markkanen attempts a 3Pt. Contested by Shaquille Bryant (5.5 feet, MAN). Zion Markkanen misses. Rebound secured by Domantas Haliburton.

[00:59] Team_094 possession (Score: 100-92)
Ayo Gasol attempts a Midrange. Contested by Domantas Doncic (4.8 feet, ZONE). Ayo Gasol misses. Rebound secured by Victor McCollum.

[00:45] Team_083 possession (Score: 100-92)
Zion Markkanen attempts a Midrange. Contested by Ayo Gasol (5.1 feet, ZONE). Zion Markkanen misses. Rebound secured by Isaiah Quickley.

[00:33] Team_094 possession (Score: 100-92)
Shaquille Bryant makes the Layup and draws the foul on Zion Markkanen! And-1! Shaquille Bryant to the line for 1. [BONUS: 6 team fouls] (Zion Markkanen: 2 personal fouls)   FT 1/1: GOOD Shaquille Bryant makes 1/1 from the line.
Score: 100-95

[00:20] Team_083 possession (Score: 100-95)
Zion Markkanen attempts a 3Pt. Wide open! Domantas Haliburton is 6.0 feet away. [ZONE] ZION MARKKANEN MAKES IT! Assist: Domantas Doncic
Score: 103-95

[00:03] Team_094 possession (Score: 103-95)
Shaquille Bryant attempts a 3Pt. Contested by Zion Markkanen (5.0 feet, ZONE). SHAQUILLE BRYANT MAKES IT! Assist: Domantas Haliburton
Score: 103-98

================================================================================
                              4TH QUARTER COMPLETE                              
================================================================================

4TH QUARTER SCORE: Team_083 23, Team_094 30

BOX SCORE:
================================================================================

Team_083
--------------------------------------------------------------------------------
Player                MIN  PTS  REB  AST  TO      FG   FG%      3P   3P%
--------------------------------------------------------------------------------
Kyrie Griffin          37    8    2    0   0   3/5    60.0     0/0   0.0
Zion Markkanen         11    5    0    1   0   2/5    40.0     0/0   0.0
Damian Towns           11    4    2    0   0   2/3    66.7     0/0   0.0
Bradley Thompson       37    2    4    0   0   1/1   100.0     0/0   0.0
Malcolm Brogdon        37    2    0    0   0   1/1   100.0     0/0   0.0
Cole Simmons           11    2    0    0   0   1/2    50.0     0/0   0.0
Yao Oladipo            37    0    3    2   0   0/1     0.0     0/0   0.0
Karl Jokic             37    0    0    0   0   0/2     0.0     0/0   0.0
Victor McCollum        11    0    3    0   0   0/0     0.0     0/0   0.0
Domantas Doncic        11    0    0    3   0   0/0     0.0     0/0   0.0

TEAM: FG: 10/20 (50.0%), 3PT: 2/9 (22.2%), REB: 14 (5 off, 9 def), AST: 6, TO: 2
TEAM FOULS: 6 [Team_094 in BONUS]


Team_094
--------------------------------------------------------------------------------
Player                MIN  PTS  REB  AST  TO      FG   FG%      3P   3P%
--------------------------------------------------------------------------------
Shaquille Bryant       13   11    0    1   0   4/6    66.7     0/0   0.0
Kobe Wagner            37    5    2    1   0   2/3    66.7     0/0   0.0
Isaiah Quickley        11    4    3    0   0   2/2   100.0     0/0   0.0
Tim Russell            37    3    2    2   0   1/2    50.0     0/0   0.0
Lauri Thompson         37    3    0    0   0   1/2    50.0     0/0   0.0
Domantas Haliburton    11    2    2    2   0   1/2    50.0     0/0   0.0
Kevin Rozier           11    2    0    0   0   1/1   100.0     0/0   0.0
Kobe Bryant            37    0    2    0   0   0/0     0.0     0/0   0.0
Terry Ingram           36    0    0    0   0   0/2     0.0     0/0   0.0
Ayo Gasol              11    0    0    0   0   0/1     0.0     0/0   0.0

TEAM: FG: 12/21 (57.1%), 3PT: 5/8 (62.5%), REB: 11 (1 off, 10 def), AST: 6, TO: 1
TEAM FOULS: 3

================================================================================

================================================================================
                               FULL GAME COMPLETE                               
================================================================================

FINAL SCORE: Team_083 103, Team_094 98

SCORING BY QUARTER:
--------------------------------------------------------------------------------
Team                     Q1     Q2     Q3     Q4    FINAL
--------------------------------------------------------------------------------
Team_083                 36     24     20     23      103
Team_094                 18     28     22     30       98
--------------------------------------------------------------------------------

FULL GAME BOX SCORE:
================================================================================

Team_083
--------------------------------------------------------------------------------
Player                MIN  PTS  REB  AST  TO      FG   FG%      3P   3P%      FT STL BLK
--------------------------------------------------------------------------------
Malcolm Brogdon        37   19    0    3   1   8/12   66.7   3/3   100.0   4/4     0   0
Karl Jokic             37   20    0    3   1   6/10   60.0   3/7    42.9   3/4     0   0
Yao Oladipo            37   25   10    3   0  12/16   75.0   3/5    60.0   2/2     0   0
Kyrie Griffin          37    9   12    4   2   5/14   35.7   1/3    33.3   2/3     2   0
Bradley Thompson       37    4   21    6   5   2/4    50.0   0/1     0.0   0/0     0   0
Zion Markkanen         11    5    0    2   0   1/4    25.0   1/3    33.3   0/0     0   0
Damian Towns           11    7    4    0   0   3/7    42.9   1/4    25.0   0/0     0   0
Domantas Doncic        11    3    0    3   0   3/4    75.0   1/1   100.0   1/2     0   0
Cole Simmons           11    2    1    2   1   1/2    50.0   0/1     0.0   0/0     0   1
Victor McCollum        11    8    5    0   1   3/3   100.0   0/0     0.0   2/2     0   0

TEAM: FG: 44/76 (57.9%), 3PT: 13/28 (46.4%), REB: 54 (14 off, 40 def), AST: 26, TO: 11


Team_094
--------------------------------------------------------------------------------
Player                MIN  PTS  REB  AST  TO      FG   FG%      3P   3P%      FT STL BLK
--------------------------------------------------------------------------------
Lauri Thompson         37    6    0    1   1   3/10   30.0   1/6    16.7   1/2     0   0
Kobe Wagner            37   18   11    2   2   6/10   60.0   4/8    50.0   0/0     0   1
Tim Russell            37   15    7    6   1   7/15   46.7   1/6    16.7   3/4     2   0
Kobe Bryant            37   19   12    0   0   7/12   58.3   1/3    33.3   3/3     0   1
Terry Ingram           36    3    0    3   0   3/11   27.3   0/4     0.0   1/2     0   0
Shaquille Bryant       13   11    0    2   0   4/6    66.7   2/2   100.0   3/3     0   0
Kevin Rozier           11    2    0    0   0   1/2    50.0   0/0     0.0   2/2     0   0
Ayo Gasol              11    3    2    0   0   0/1     0.0   0/0     0.0   0/0     0   0
Domantas Haliburton    11   11    5    3   0   6/8    75.0   0/0     0.0   1/1     0   0
Isaiah Quickley        11    6    3    1   0   3/6    50.0   0/1     0.0   1/3     1   0

TEAM: FG: 41/82 (50.0%), 3PT: 9/30 (30.0%), REB: 39 (8 off, 31 def), AST: 18, TO: 4

================================================================================
