================================================================================
                        FULL GAME - Team_031 vs Team_089                        
================================================================================

================================================================================
                       1ST QUARTER - Team_031 vs Team_089                       
================================================================================

[12:00] Team_031 possession (Score: 0-0)
FOUL! Shooting foul on Jordan Brogdon. Shai Durant to the line for 2 free throws. [Team fouls: 1] (Jordan Brogdon: 1 personal fouls)   FT 1/2: GOOD   FT 2/2: GOOD Shai Durant makes 2/2 from the line.
Score: 2-0

[11:44] Team_089 possession (Score: 2-0)
FOUL! Shooting foul on Gary Morant. Jalen Jackson to the line for 3 free throws. [Team fouls: 1] (Gary Morant: 1 personal fouls)   FT 1/3: GOOD   FT 2/3: GOOD   FT 3/3: GOOD Jalen Jackson makes 3/3 from the line.
Score: 2-3

[11:29] Team_031 possession (Score: 2-3)
Luka Sabonis drives and kicks out. Gary Morant attempts a 3Pt. Contested by Jalen Jackson (4.7 feet, MAN). GARY MORANT MAKES IT! Assist: Luka Sabonis
Score: 5-3

[11:13] Team_089 possession (Score: 5-3)
Jalen Jackson makes the Layup and draws the foul on Pau Irving! And-1! Jalen Jackson to the line for 1. [Team fouls: 2] (Pau Irving: 1 personal fouls)   FT 1/1: GOOD Jalen Jackson makes 1/1 from the line.
Score: 5-6

[11:02] Team_031 possession (Score: 5-6)
Gary Morant makes the Layup and draws the foul on Jalen Jackson! And-1! Gary Morant to the line for 1. [Team fouls: 2] (Jalen Jackson: 1 personal fouls)   FT 1/1: GOOD Gary Morant makes 1/1 from the line.
Score: 8-6

[10:47] Team_089 possession (Score: 8-6)
FOUL! Shooting foul on Gary Morant. Terry Simmons to the line for 3 free throws. [Team fouls: 3] (Gary Morant: 2 personal fouls)   FT 1/3: GOOD   FT 2/3: GOOD   FT 3/3: GOOD Terry Simmons makes 3/3 from the line.
Score: 8-9

[10:37] Team_031 possession (Score: 8-9)
Pau Irving attempts a Layup. BLOCKED BY TERRY SIMMONS! Ball deflects out of bounds off Pau Irving.

[10:27] Team_089 possession (Score: 8-9)
Rudy Smith attempts a 3Pt. Contested by Shai Durant (4.4 feet, ZONE). Rudy Smith misses. Rebound secured by Luka Sabonis.

[10:14] Team_031 possession (Score: 8-9)
Gary Morant drives, Jalen Jackson stays with him. Gary Morant attempts a Layup. Contested by Jalen Jackson (5.3 feet, MAN). Gary Morant misses. Rebound secured by Rudy Smith.

[10:01] Team_089 possession (Score: 8-9)
Terry Simmons drives and kicks out. Allen Mobley attempts a Midrange. Contested by Pau Irving (3.6 feet, MAN). Allen Mobley misses. Rebound secured by Immanuel James.

[09:42] Team_031 possession (Score: 8-9)
Shai Durant attempts a Midrange. Contested by Jordan Brogdon (3.3 feet, MAN). Shai Durant misses. Rebound secured by Rudy Smith.

[09:28] Team_089 possession (Score: 8-9)
FOUL! Offensive foul on Jalen Jackson! Gary Morant drew the charge! [Team fouls: 3] (Jalen Jackson: 2 personal fouls) TURNOVER! (dead ball)

[09:14] Team_031 possession (Score: 8-9)
Luka Sabonis attempts a Dunk. BLOCKED BY JALEN JACKSON! Ball deflects out of bounds off Luka Sabonis.

[09:01] Team_089 possession (Score: 8-9)
FOUL! Shooting foul on Luka Sabonis. Allen Mobley to the line for 2 free throws. [Team fouls: 4] (Luka Sabonis: 1 personal fouls)   FT 1/2: GOOD   FT 2/2: GOOD Allen Mobley makes 2/2 from the line.
Score: 8-11

[08:46] Team_031 possession (Score: 8-11)
Shai Durant drives to the basket... Shai Durant throws a bad pass out of bounds! TURNOVER! (dead ball)

[08:32] Team_089 possession (Score: 8-11)
Allen Mobley drives, Pau Irving stays with him. Allen Mobley attempts a Layup. Contested by Pau Irving (3.7 feet, MAN). Allen Mobley misses. Rebound secured by Luka Sabonis.

[08:22] Team_031 possession (Score: 8-11)
Pau Irving attempts a Midrange. Contested by Allen Mobley (4.2 feet, MAN). Pau Irving misses. Offensive rebound by Immanuel James! Immanuel James puts it back in!
Score: 10-11

[08:09] Team_089 possession (Score: 10-11)
Jalen Jackson drives, Gary Morant stays with him. Jalen Jackson attempts a Dunk. Contested by Gary Morant (4.0 feet, MAN). JALEN JACKSON MAKES IT! Assist: Terry Simmons
Score: 10-13

[08:00] Team_031 possession (Score: 10-13)
Luka Sabonis attempts a Midrange. Contested by Allen Mobley (4.7 feet, ZONE). LUKA SABONIS MAKES IT! Assist: Immanuel James
Score: 12-13

[07:41] Team_089 possession (Score: 12-13)
FOUL! Reach-in foul on Immanuel James during the drive. [IN THE BONUS! 5 team fouls] Rudy Smith to the line for 2 free throws. (Immanuel James: 1 personal fouls)   FT 1/2: GOOD   FT 2/2: GOOD Rudy Smith makes 2/2 from the line.
Score: 12-15

[07:27] Team_031 possession (Score: 12-15)
FOUL! Reach-in foul on Jalen Jackson during the drive. [Team fouls: 4] No free throws, side out. (Jalen Jackson: 3 personal fouls)

[07:14] Team_031 possession (Score: 12-15)
FOUL! Holding foul on Terry Simmons. [IN THE BONUS! 5 team fouls] Luka Sabonis to the line for 2 free throws. (Terry Simmons: 1 personal fouls)   FT 1/2: GOOD   FT 2/2: GOOD Luka Sabonis makes 2/2 from the line.
Score: 14-15

[06:58] Team_089 possession (Score: 14-15)
Jalen Jackson attempts a 3Pt. Contested by Gary Morant (4.0 feet, MAN). JALEN JACKSON MAKES IT! Assist: Allen Mobley
Score: 14-18

[06:45] Team_031 possession (Score: 14-18)
Pau Irving attempts a Midrange. Contested by Jalen Jackson (4.8 feet, ZONE). PAU IRVING MAKES IT! Assist: Immanuel James
Score: 16-18

[06:28] Team_089 possession (Score: 16-18)
Allen Mobley attempts a 3Pt. Contested by Pau Irving (3.7 feet, ZONE). Allen Mobley misses. Offensive rebound by Jalen Jackson! Jalen Jackson kicks it out.

[06:10] Team_089 possession (Score: 16-18)
Jalen Jackson attempts a Midrange. Contested by Gary Morant (4.0 feet, MAN). Jalen Jackson misses. Rebound secured by Luka Sabonis.

[05:56] Team_031 possession (Score: 16-18)
Gary Morant attempts a 3Pt. Contested by Jalen Jackson (5.3 feet, MAN). GARY MORANT MAKES IT! Assist: Immanuel James
Score: 19-18

[05:41] Team_089 possession (Score: 19-18)
Terry Simmons makes the Layup and draws the foul on Luka Sabonis! And-1! Terry Simmons to the line for 1. [BONUS: 6 team fouls] (Luka Sabonis: 2 personal fouls)   FT 1/1: GOOD Terry Simmons makes 1/1 from the line.
Score: 19-21

[05:26] Team_031 possession (Score: 19-21)
Immanuel James makes the Layup and draws the foul on Rudy Smith! And-1! Immanuel James to the line for 1. [BONUS: 6 team fouls] (Rudy Smith: 1 personal fouls)   FT 1/1: MISS Immanuel James makes 0/1 from the line. Offensive rebound by Luka Sabonis! Luka Sabonis puts it back in!
Score: 23-21

[05:11] Team_089 possession (Score: 23-21)
Jalen Jackson loses control! Ball rolls out of bounds! TURNOVER! (dead ball)

[05:00] Team_031 possession (Score: 23-21)
Shai Durant attempts a 3Pt. Contested by Jordan Brogdon (3.4 feet, ZONE). Shai Durant misses. Rebound secured by Rudy Smith.

[04:45] Team_089 possession (Score: 23-21)
Jordan Brogdon drives, Shai Durant stays with him. Jordan Brogdon attempts a Layup. Contested by Shai Durant (3.9 feet, MAN). JORDAN BROGDON MAKES IT! Assist: Terry Simmons
Score: 23-23

[04:33] Team_031 possession (Score: 23-23)
Shai Durant attempts a 3Pt. Contested by Jordan Brogdon (3.4 feet, ZONE). Shai Durant misses. Rebound secured by Jalen Jackson.

[04:18] Team_089 possession (Score: 23-23)
FOUL! Shooting foul on Gary Morant. Rudy Smith to the line for 2 free throws. [BONUS: 7 team fouls] (Gary Morant: 3 personal fouls)   FT 1/2: GOOD   FT 2/2: MISS Rudy Smith makes 1/2 from the line. Rebound secured by Gary Morant.
Score: 23-24

[04:06] Team_031 possession (Score: 23-24)
Gary Morant drives, Jalen Jackson stays with him. Gary Morant attempts a Dunk. Contested by Jalen Jackson (5.4 feet, MAN). Gary Morant misses. Offensive rebound by Luka Sabonis! Luka Sabonis puts it back in!
Score: 25-24

[03:55] Team_089 possession (Score: 25-24)
Jalen Jackson attempts a 3Pt. Contested by Gary Morant (4.2 feet, MAN). Jalen Jackson misses. FOUL! Loose ball foul on Luka Sabonis during the rebound battle. [IN THE BONUS! 8 team fouls] Jalen Jackson to the line for 2 free throws. (Luka Sabonis: 3 personal fouls)   FT 1/2: GOOD   FT 2/2: GOOD Jalen Jackson makes 2/2 from the line.
Score: 25-26

[03:43] Team_031 possession (Score: 25-26)
Shai Durant attempts a Layup. Contested by Jordan Brogdon (3.5 feet, MAN). Shai Durant misses. Offensive rebound by Luka Sabonis! Luka Sabonis's putback is no good. Offensive rebound by Immanuel James! Immanuel James kicks it out.

[03:25] Team_031 possession (Score: 25-26)
Immanuel James attempts a Midrange. Contested by Rudy Smith (5.2 feet, ZONE). IMMANUEL JAMES MAKES IT! Assist: Luka Sabonis
Score: 27-26

[03:14] Team_089 possession (Score: 27-26)
Allen Mobley attempts a Midrange. Contested by Immanuel James (3.5 feet, ZONE). Allen Mobley misses. Offensive rebound by Terry Simmons! Terry Simmons puts it back in!
Score: 27-28

[03:02] Team_031 possession (Score: 27-28)
FOUL! Holding foul on Jalen Jackson. [IN THE BONUS! 7 team fouls] Gary Morant to the line for 2 free throws. (Jalen Jackson: 4 personal fouls)   FT 1/2: MISS   FT 2/2: GOOD Gary Morant makes 1/2 from the line.
Score: 28-28

[02:50] Team_089 possession (Score: 28-28)
Jalen Jackson drives, Immanuel James stays with him. Jalen Jackson attempts a Layup. Contested by Immanuel James (3.7 feet, ZONE). JALEN JACKSON MAKES IT! Assist: Allen Mobley
Score: 28-30

[02:33] Team_031 possession (Score: 28-30)
Luka Sabonis attempts a Midrange. Contested by Terry Simmons (4.4 feet, MAN). Luka Sabonis misses. Offensive rebound by Luka Sabonis! Luka Sabonis puts it back in!
Score: 30-30

[02:19] Team_089 possession (Score: 30-30)
FOUL! Holding foul on Shai Durant. [IN THE BONUS! 9 team fouls] Jordan Brogdon to the line for 2 free throws. (Shai Durant: 1 personal fouls)   FT 1/2: GOOD   FT 2/2: GOOD Jordan Brogdon makes 2/2 from the line.
Score: 30-32

[02:01] Team_031 possession (Score: 30-32)
Gary Morant attempts a 3Pt. Contested by Jalen Jackson (5.5 feet, MAN). Gary Morant misses. Rebound secured by Rudy Smith.

[01:46] Team_089 possession (Score: 30-32)
Rudy Smith attempts a Midrange. Contested by Immanuel James (4.1 feet, ZONE). Rudy Smith misses. Rebound secured by Gary Morant.

[01:30] Team_031 possession (Score: 30-32)
Pau Irving drives to the basket... Pau Irving loses control! Ball rolls out of bounds! TURNOVER! (dead ball)

[01:30] Substitution (Team_031): Shai Durant OUT → Kevin Morant IN (stamina_rule2)

[01:30] Substitution (Team_031): Gary Morant OUT → Isaiah Ingram IN (stamina_rule2)

[01:30] Substitution (Team_031): Pau Irving OUT → Miles Stewart IN (stamina_rule2)

[01:30] Substitution (Team_031): Immanuel James OUT → Kobe Randle IN (stamina_rule2)

[01:30] Substitution (Team_031): Luka Sabonis OUT → Jimmy Poole IN (stamina_rule2)

[01:30] Substitution (Team_089): Jordan Brogdon OUT → Tony Parker IN (stamina_rule2)

[01:30] Substitution (Team_089): Jalen Jackson OUT → Joel Barnes IN (stamina_rule2)

[01:30] Substitution (Team_089): Allen Mobley OUT → Pascal Durant IN (stamina_rule2)

[01:30] Substitution (Team_089): Rudy Smith OUT → Devin Haliburton IN (stamina_rule2)

[01:30] Substitution (Team_089): Terry Simmons OUT → Evan Gasol IN (stamina_rule2)

[01:16] Team_089 possession (Score: 30-32)
Tony Parker attempts a Layup. Contested by Kevin Morant (5.1 feet, MAN). TONY PARKER MAKES IT!
Score: 30-34

[01:02] Team_031 possession (Score: 30-34)
Kevin Morant drives and kicks out. Isaiah Ingram attempts a 3Pt. Contested by Joel Barnes (5.5 feet, MAN). Isaiah Ingram misses. Rebound secured by Pascal Durant.

[00:51] Team_089 possession (Score: 30-34)
Pascal Durant drives, Miles Stewart stays with him. Pascal Durant attempts a Dunk. Wide open! Miles Stewart is 6.2 feet away. [MAN] PASCAL DURANT MAKES IT!
Score: 30-36

[00:37] Team_031 possession (Score: 30-36)
Kobe Randle attempts a Layup. Contested by Devin Haliburton (5.6 feet, MAN). Kobe Randle misses. Rebound secured by Pascal Durant.

[00:26] Team_089 possession (Score: 30-36)
Pascal Durant attempts a 3Pt. Wide open! Miles Stewart is 6.2 feet away. [MAN] Pascal Durant misses. Rebound secured by Isaiah Ingram.

[00:10] Team_031 possession (Score: 30-36)
Kevin Morant attempts a 3Pt. Contested by Pascal Durant (3.9 feet, ZONE). Kevin Morant misses. Rebound secured by Pascal Durant.

================================================================================
                              1ST QUARTER COMPLETE                              
================================================================================

1ST QUARTER SCORE: Team_031 30, Team_089 36

BOX SCORE:
================================================================================

Team_031
--------------------------------------------------------------------------------
Player                MIN  PTS  REB  AST  TO      FG   FG%      3P   3P%
--------------------------------------------------------------------------------
Luka Sabonis           11   12    5    2   0   5/6    83.3     0/0   0.0
Gary Morant            11   10    2    0   0   4/6    66.7     0/0   0.0
Immanuel James         11    4    3    3   0   2/2   100.0     0/0   0.0
Shai Durant            11    2    0    0   0   1/4    25.0     0/0   0.0
Pau Irving             11    2    0    0   0   1/2    50.0     0/0   0.0
Kevin Morant            1    0    0    0   0   0/2     0.0     0/0   0.0
Kobe Randle             1    0    0    0   0   0/1     0.0     0/0   0.0
Isaiah Ingram           1    0    1    0   0   0/0     0.0     0/0   0.0

TEAM: FG: 13/23 (56.5%), 3PT: 1/5 (20.0%), REB: 11 (4 off, 7 def), AST: 5, TO: 2
TEAM FOULS: 9 [Team_089 in BONUS]


Team_089
--------------------------------------------------------------------------------
Player                MIN  PTS  REB  AST  TO      FG   FG%      3P   3P%
--------------------------------------------------------------------------------
Jalen Jackson          11   15    2    0   0   6/7    85.7     0/0   0.0
Terry Simmons          11    8    1    2   0   3/4    75.0     0/0   0.0
Jordan Brogdon         11    4    0    0   0   2/2   100.0     0/0   0.0
Rudy Smith             11    2    4    0   0   1/4    25.0     0/0   0.0
Allen Mobley           11    2    0    2   0   1/2    50.0     0/0   0.0
Tony Parker             1    2    0    0   0   1/1   100.0     0/0   0.0
Pascal Durant           1    2    3    0   0   1/2    50.0     0/0   0.0

TEAM: FG: 15/22 (68.2%), 3PT: 4/6 (66.7%), REB: 10 (2 off, 8 def), AST: 4, TO: 2
TEAM FOULS: 7 [Team_031 in BONUS]

================================================================================

================================================================================
                       2ND QUARTER - Team_031 vs Team_089                       
================================================================================

[12:00] Team_031 possession (Score: 30-36)
Pau Irving attempts a 3Pt. Contested by Jordan Brogdon (3.4 feet, ZONE). Pau Irving misses. Rebound secured by Rudy Smith.

[11:47] Team_089 possession (Score: 30-36)
Allen Mobley attempts a 3Pt. Contested by Pau Irving (3.8 feet, MAN). Allen Mobley misses. FOUL! Loose ball foul on Gary Morant during the rebound battle. [Team fouls: 1] No free throws, side out. (Gary Morant: 1 personal fouls)

[11:34] Team_089 possession (Score: 30-36)
Rudy Smith drives and kicks out. FOUL! Shooting foul on Luka Sabonis. Terry Simmons to the line for 2 free throws. [Team fouls: 2] (Luka Sabonis: 1 personal fouls)   FT 1/2: GOOD   FT 2/2: GOOD Terry Simmons makes 2/2 from the line.
Score: 30-38

[11:20] Team_031 possession (Score: 30-38)
Shai Durant attempts a 3Pt. Contested by Jalen Jackson (5.0 feet, ZONE). Shai Durant misses. Rebound secured by Terry Simmons.

[11:05] Team_089 possession (Score: 30-38)
Jalen Jackson drives and kicks out. Rudy Smith attempts a 3Pt. Contested by Pau Irving (3.8 feet, ZONE). Rudy Smith misses. Rebound secured by Luka Sabonis.

[10:53] Team_031 possession (Score: 30-38)
FOUL! Holding foul on Jalen Jackson. [Team fouls: 1] No free throws, side out. (Jalen Jackson: 1 personal fouls)

[10:38] Team_031 possession (Score: 30-38)
Luka Sabonis attempts a Layup. Contested by Terry Simmons (4.4 feet, ZONE). LUKA SABONIS MAKES IT! Assist: Immanuel James
Score: 32-38

[10:26] Team_089 possession (Score: 32-38)
Rudy Smith makes the Dunk and draws the foul on Immanuel James! And-1! Rudy Smith to the line for 1. [Team fouls: 3] (Immanuel James: 1 personal fouls)   FT 1/1: GOOD Rudy Smith makes 1/1 from the line.
Score: 32-41

[10:10] Team_031 possession (Score: 32-41)
Gary Morant attempts a Midrange. Contested by Jalen Jackson (5.5 feet, ZONE). Gary Morant misses. Rebound secured by Terry Simmons.

[09:54] Team_089 possession (Score: 32-41)
Jordan Brogdon attempts a Layup. Contested by Immanuel James (3.6 feet, ZONE). JORDAN BROGDON MAKES IT! Assist: Jalen Jackson
Score: 32-43

[09:39] Team_031 possession (Score: 32-43)
Pau Irving attempts a 3Pt. Contested by Allen Mobley (4.4 feet, MAN). Pau Irving misses. Rebound secured by Terry Simmons.

[09:28] Team_089 possession (Score: 32-43)
Terry Simmons makes the Midrange and draws the foul on Luka Sabonis! And-1! Terry Simmons to the line for 1. [Team fouls: 4] (Luka Sabonis: 2 personal fouls)   FT 1/1: GOOD Terry Simmons makes 1/1 from the line.
Score: 32-46

[09:15] Team_031 possession (Score: 32-46)
Immanuel James drives and kicks out. Immanuel James attempts a Midrange. Contested by Allen Mobley (4.4 feet, ZONE). IMMANUEL JAMES MAKES IT!
Score: 34-46

[08:57] Team_089 possession (Score: 34-46)
Terry Simmons drives and kicks out. Jalen Jackson attempts a 3Pt. Contested by Gary Morant (4.3 feet, MAN). Jalen Jackson misses. Rebound secured by Immanuel James.

[08:41] Team_031 possession (Score: 34-46)
Pau Irving drives, Allen Mobley stays with him. Pau Irving attempts a Layup. Contested by Allen Mobley (4.5 feet, MAN). PAU IRVING MAKES IT! Assist: Gary Morant
Score: 36-46

[08:29] Team_089 possession (Score: 36-46)
Rudy Smith drives, Immanuel James stays with him. Rudy Smith attempts a Dunk. Contested by Immanuel James (4.3 feet, MAN). RUDY SMITH MAKES IT!
Score: 36-48

[08:12] Team_031 possession (Score: 36-48)
Immanuel James attempts a 3Pt. Contested by Allen Mobley (4.8 feet, ZONE). IMMANUEL JAMES MAKES IT! Assist: Pau Irving
Score: 39-48

[07:58] Team_089 possession (Score: 39-48)
FOUL! Holding foul on Luka Sabonis. [IN THE BONUS! 5 team fouls] Terry Simmons to the line for 2 free throws. (Luka Sabonis: 3 personal fouls)   FT 1/2: GOOD   FT 2/2: MISS Terry Simmons makes 1/2 from the line. Rebound secured by Gary Morant.
Score: 39-49

[07:46] Team_031 possession (Score: 39-49)
Luka Sabonis attempts a Midrange. Contested by Terry Simmons (4.7 feet, ZONE). Luka Sabonis misses. Rebound secured by Jalen Jackson.

[07:29] Team_089 possession (Score: 39-49)
Jalen Jackson drives and kicks out. Jordan Brogdon attempts a 3Pt. Contested by Shai Durant (4.6 feet, MAN). Jordan Brogdon misses. Rebound secured by Luka Sabonis.

[07:12] Team_031 possession (Score: 39-49)
Shai Durant drives, Terry Simmons stays with him. Shai Durant attempts a Dunk. Contested by Terry Simmons (4.4 feet, ZONE). SHAI DURANT MAKES IT!
Score: 41-49

[07:02] Team_089 possession (Score: 41-49)
Rudy Smith drives, Immanuel James stays with him. Rudy Smith attempts a Dunk. Contested by Immanuel James (4.5 feet, ZONE). Rudy Smith misses. Rebound secured by Immanuel James.

[06:45] Team_031 possession (Score: 41-49)
Luka Sabonis attempts a Midrange. Contested by Allen Mobley (5.1 feet, ZONE). Luka Sabonis misses. Rebound secured by Jalen Jackson.

[06:31] Team_089 possession (Score: 41-49)
Jalen Jackson attempts a 3Pt. Contested by Pau Irving (4.6 feet, ZONE). Jalen Jackson misses. Offensive rebound by Jalen Jackson! Jalen Jackson kicks it out.

[06:16] Team_089 possession (Score: 41-49)
Rudy Smith attempts a Midrange. Contested by Immanuel James (4.6 feet, MAN). Rudy Smith misses. FOUL! Loose ball foul on Luka Sabonis during the rebound battle. [IN THE BONUS! 6 team fouls] Terry Simmons to the line for 2 free throws. (Luka Sabonis: 4 personal fouls)   FT 1/2: GOOD   FT 2/2: GOOD Terry Simmons makes 2/2 from the line.
Score: 41-51

[06:02] Team_031 possession (Score: 41-51)
Shai Durant attempts a 3Pt. Contested by Jordan Brogdon (4.3 feet, ZONE). Shai Durant misses. Rebound secured by Jalen Jackson.

[05:51] Team_089 possession (Score: 41-51)
Allen Mobley drives and kicks out. FOUL! Shooting foul on Immanuel James. Rudy Smith to the line for 2 free throws. [BONUS: 7 team fouls] (Immanuel James: 2 personal fouls)   FT 1/2: MISS   FT 2/2: GOOD Rudy Smith makes 1/2 from the line.
Score: 41-52

[05:34] Team_031 possession (Score: 41-52)
Shai Durant attempts a 3Pt. Contested by Jordan Brogdon (4.3 feet, ZONE). SHAI DURANT MAKES IT! Assist: Immanuel James
Score: 44-52

[05:23] Team_089 possession (Score: 44-52)
Jalen Jackson drives and kicks out. FOUL! Shooting foul on Shai Durant. Jordan Brogdon to the line for 2 free throws. [BONUS: 8 team fouls] (Shai Durant: 1 personal fouls)   FT 1/2: MISS   FT 2/2: GOOD Jordan Brogdon makes 1/2 from the line.
Score: 44-53

[05:10] Team_031 possession (Score: 44-53)
Immanuel James attempts a Layup. Contested by Rudy Smith (5.8 feet, ZONE). IMMANUEL JAMES MAKES IT!
Score: 46-53

[04:59] Team_089 possession (Score: 46-53)
Rudy Smith attempts a Midrange. Contested by Immanuel James (4.9 feet, MAN). Rudy Smith misses. Rebound secured by Luka Sabonis.

[04:42] Team_031 possession (Score: 46-53)
Gary Morant attempts a Midrange. Wide open! Jalen Jackson is 6.1 feet away. [MAN] GARY MORANT MAKES IT!
Score: 48-53

[04:25] Team_089 possession (Score: 48-53)
Rudy Smith attempts a Midrange. Contested by Immanuel James (5.0 feet, MAN). Rudy Smith misses. Offensive rebound by Jalen Jackson! Jalen Jackson kicks it out.

[04:11] Team_089 possession (Score: 48-53)
Terry Simmons makes the Layup and draws the foul on Luka Sabonis! And-1! Terry Simmons to the line for 1. [BONUS: 9 team fouls] (Luka Sabonis: 5 personal fouls)   FT 1/1: GOOD Terry Simmons makes 1/1 from the line.
Score: 48-56

[03:58] Team_031 possession (Score: 48-56)
Luka Sabonis attempts a 3Pt. Contested by Jordan Brogdon (5.0 feet, ZONE). Luka Sabonis misses. Rebound secured by Allen Mobley.

[03:49] Team_089 possession (Score: 48-56)
Allen Mobley attempts a Layup. Contested by Luka Sabonis (4.8 feet, ZONE). ALLEN MOBLEY MAKES IT! Assist: Rudy Smith
Score: 48-58

[03:37] Team_031 possession (Score: 48-58)
Immanuel James drives and kicks out. Gary Morant attempts a Midrange. Contested by Jalen Jackson (5.9 feet, MAN). Gary Morant misses. Rebound secured by Terry Simmons.

[03:19] Team_089 possession (Score: 48-58)
Rudy Smith drives and kicks out. Jalen Jackson attempts a 3Pt. Contested by Immanuel James (5.0 feet, ZONE). Jalen Jackson misses. Rebound secured by Immanuel James.

[03:00] Team_031 possession (Score: 48-58)
Pau Irving makes the Layup and draws the foul on Allen Mobley! And-1! Pau Irving to the line for 1. [Team fouls: 2] (Allen Mobley: 1 personal fouls)   FT 1/1: GOOD Pau Irving makes 1/1 from the line.
Score: 51-58

[02:46] Team_089 possession (Score: 51-58)
Jalen Jackson makes the Layup and draws the foul on Immanuel James! And-1! Jalen Jackson to the line for 1. [BONUS: 10 team fouls] (Immanuel James: 3 personal fouls)   FT 1/1: GOOD Jalen Jackson makes 1/1 from the line.
Score: 51-61

[02:31] Team_031 possession (Score: 51-61)
Pau Irving attempts a Layup. BLOCKED BY ALLEN MOBLEY! Ball is loose! Rebound secured by Jalen Jackson.

[02:17] Team_089 possession (Score: 51-61)
Allen Mobley drives to the basket... Allen Mobley throws a bad pass! Stolen by Immanuel James! TURNOVER! (live ball)

[02:00] Team_031 possession (Score: 51-61)
Immanuel James attempts a 3Pt. Contested by Jordan Brogdon (5.1 feet, ZONE). IMMANUEL JAMES MAKES IT! Assist: Shai Durant
Score: 54-61

[01:48] Team_089 possession (Score: 54-61)
Jalen Jackson attempts a Midrange. Contested by Gary Morant (5.5 feet, MAN). Jalen Jackson misses. Rebound secured by Immanuel James.

[01:33] Team_031 possession (Score: 54-61)
Shai Durant attempts a Midrange. Contested by Allen Mobley (5.3 feet, ZONE). Shai Durant misses. Rebound secured by Terry Simmons.

[01:17] Team_089 possession (Score: 54-61)
FOUL! Holding foul on Immanuel James. [IN THE BONUS! 11 team fouls] Rudy Smith to the line for 2 free throws. (Immanuel James: 4 personal fouls)   FT 1/2: MISS   FT 2/2: GOOD Rudy Smith makes 1/2 from the line.
Score: 54-62

[01:03] Team_031 possession (Score: 54-62)
FOUL! Reach-in foul on Terry Simmons during the drive. [Team fouls: 3] No free throws, side out. (Terry Simmons: 1 personal fouls)

[00:50] Team_031 possession (Score: 54-62)
Pau Irving attempts a Midrange. Contested by Terry Simmons (5.3 feet, ZONE). PAU IRVING MAKES IT! Assist: Gary Morant
Score: 56-62

[00:36] Team_089 possession (Score: 56-62)
FOUL! Reach-in foul on Immanuel James during the drive. [IN THE BONUS! 12 team fouls] Terry Simmons to the line for 2 free throws. (Immanuel James: 5 personal fouls)   FT 1/2: MISS   FT 2/2: MISS Terry Simmons makes 0/2 from the line. Rebound secured by Immanuel James.

[00:25] Team_031 possession (Score: 56-62)
Shai Durant attempts a Midrange. Contested by Jordan Brogdon (5.3 feet, MAN). Shai Durant misses. Rebound secured by Allen Mobley.

[00:06] Team_089 possession (Score: 56-62)
Jalen Jackson attempts a 3Pt. Contested by Gary Morant (5.7 feet, ZONE). Jalen Jackson misses. Rebound secured by Gary Morant.

================================================================================
                              2ND QUARTER COMPLETE                              
================================================================================

2ND QUARTER SCORE: Team_031 26, Team_089 26

BOX SCORE:
================================================================================

Team_031
--------------------------------------------------------------------------------
Player                MIN  PTS  REB  AST  TO      FG   FG%      3P   3P%
--------------------------------------------------------------------------------
Immanuel James         23   10    5    2   0   4/5    80.0     0/0   0.0
Pau Irving             23    7    0    1   0   3/6    50.0     0/0   0.0
Shai Durant            23    5    0    1   0   2/6    33.3     0/0   0.0
Luka Sabonis           23    2    3    0   0   1/4    25.0     0/0   0.0
Gary Morant            23    2    2    2   0   1/2    50.0     0/0   0.0

TEAM: FG: 11/23 (47.8%), 3PT: 3/8 (37.5%), REB: 10 (0 off, 10 def), AST: 6, TO: 0
TEAM FOULS: 12 [Team_089 in BONUS]


Team_089
--------------------------------------------------------------------------------
Player                MIN  PTS  REB  AST  TO      FG   FG%      3P   3P%
--------------------------------------------------------------------------------
Terry Simmons          23   10    5    0   0   4/6    66.7     0/0   0.0
Rudy Smith             23    7    1    1   0   4/7    57.1     0/0   0.0
Jalen Jackson          23    3    7    1   0   1/5    20.0     0/0   0.0
Jordan Brogdon         23    3    0    0   0   2/2   100.0     0/0   0.0
Allen Mobley           23    2    2    0   0   1/1   100.0     0/0   0.0

TEAM: FG: 12/22 (54.5%), 3PT: 0/1 (0.0%), REB: 15 (3 off, 12 def), AST: 2, TO: 1
TEAM FOULS: 3

================================================================================

================================================================================
                       3RD QUARTER - Team_031 vs Team_089                       
================================================================================

[12:00] Team_031 possession (Score: 56-62)
Pau Irving attempts a 3Pt. Contested by Jordan Brogdon (3.3 feet, ZONE). Pau Irving misses. Rebound secured by Terry Simmons.

[11:47] Team_089 possession (Score: 56-62)
FOUL! Shooting foul on Pau Irving. Terry Simmons to the line for 2 free throws. [Team fouls: 1] (Pau Irving: 1 personal fouls)   FT 1/2: MISS   FT 2/2: GOOD Terry Simmons makes 1/2 from the line.
Score: 56-63

[11:33] Team_031 possession (Score: 56-63)
Gary Morant attempts a Midrange. Contested by Jalen Jackson (5.3 feet, MAN). GARY MORANT MAKES IT! Assist: Shai Durant
Score: 58-63

[11:17] Team_089 possession (Score: 58-63)
Terry Simmons attempts a Midrange. Contested by Gary Morant (4.4 feet, ZONE). Terry Simmons misses. Offensive rebound by Jalen Jackson! Jalen Jackson kicks it out.

[11:06] Team_089 possession (Score: 58-63)
Terry Simmons makes the Dunk and draws the foul on Luka Sabonis! And-1! Terry Simmons to the line for 1. [Team fouls: 2] (Luka Sabonis: 1 personal fouls)   FT 1/1: GOOD Terry Simmons makes 1/1 from the line.
Score: 58-66

[10:53] Team_031 possession (Score: 58-66)
Luka Sabonis attempts a Layup. Contested by Terry Simmons (4.1 feet, MAN). LUKA SABONIS MAKES IT!
Score: 60-66

[10:36] Team_089 possession (Score: 60-66)
Jalen Jackson throws a bad pass out of bounds! TURNOVER! (dead ball)

[10:25] Team_031 possession (Score: 60-66)
Gary Morant attempts a 3Pt. Contested by Jordan Brogdon (3.8 feet, ZONE). Gary Morant misses. Offensive rebound by Immanuel James! Immanuel James's putback is no good. Rebound secured by Rudy Smith.

[10:08] Team_089 possession (Score: 60-66)
FOUL! Reach-in foul on Shai Durant during the drive. [Team fouls: 3] No free throws, side out. (Shai Durant: 1 personal fouls)

[09:53] Team_089 possession (Score: 60-66)
FOUL! Reach-in foul on Immanuel James during the drive. [Team fouls: 4] No free throws, side out. (Immanuel James: 1 personal fouls)

[09:38] Team_089 possession (Score: 60-66)
Terry Simmons makes the Dunk and draws the foul on Immanuel James! And-1! Terry Simmons to the line for 1. [BONUS: 5 team fouls] (Immanuel James: 2 personal fouls)   FT 1/1: MISS Terry Simmons makes 0/1 from the line. Rebound secured by Gary Morant.
Score: 60-68

[09:28] Team_031 possession (Score: 60-68)
Shai Durant drives and kicks out. FOUL! Shooting foul on Jordan Brogdon. Pau Irving to the line for 3 free throws. [Team fouls: 1] (Jordan Brogdon: 1 personal fouls)   FT 1/3: MISS   FT 2/3: GOOD   FT 3/3: GOOD Pau Irving makes 2/3 from the line.
Score: 62-68

[09:12] Team_089 possession (Score: 62-68)
Allen Mobley drives and kicks out. Jalen Jackson attempts a 3Pt. Contested by Immanuel James (3.0 feet, ZONE). Jalen Jackson misses. Rebound secured by Gary Morant.

[08:54] Team_031 possession (Score: 62-68)
Gary Morant makes the Layup and draws the foul on Terry Simmons! And-1! Gary Morant to the line for 1. [Team fouls: 2] (Terry Simmons: 1 personal fouls)   FT 1/1: GOOD Gary Morant makes 1/1 from the line.
Score: 65-68

[08:44] Team_089 possession (Score: 65-68)
Jalen Jackson attempts a 3Pt. Contested by Pau Irving (3.9 feet, ZONE). Jalen Jackson misses. Rebound secured by Immanuel James.

[08:27] Team_031 possession (Score: 65-68)
Shai Durant makes the Layup and draws the foul on Terry Simmons! And-1! Shai Durant to the line for 1. [Team fouls: 3] (Terry Simmons: 2 personal fouls)   FT 1/1: GOOD Shai Durant makes 1/1 from the line.
Score: 68-68

[08:11] Team_089 possession (Score: 68-68)
Allen Mobley drives, Immanuel James stays with him. Allen Mobley attempts a Dunk. Contested by Immanuel James (3.1 feet, ZONE). ALLEN MOBLEY MAKES IT! Assist: Terry Simmons
Score: 68-70

[07:57] Team_031 possession (Score: 68-70)
Immanuel James makes the Midrange and draws the foul on Rudy Smith! And-1! Immanuel James to the line for 1. [Team fouls: 4] (Rudy Smith: 1 personal fouls)   FT 1/1: GOOD Immanuel James makes 1/1 from the line.
Score: 71-70

[07:44] Team_089 possession (Score: 71-70)
Rudy Smith attempts a 3Pt. Contested by Immanuel James (3.5 feet, MAN). Rudy Smith misses. Offensive rebound by Jalen Jackson! Jalen Jackson kicks it out.

[07:28] Team_089 possession (Score: 71-70)
FOUL! Shooting foul on Gary Morant. Rudy Smith to the line for 2 free throws. [BONUS: 6 team fouls] (Gary Morant: 1 personal fouls)   FT 1/2: GOOD   FT 2/2: GOOD Rudy Smith makes 2/2 from the line.
Score: 71-72

[07:18] Team_031 possession (Score: 71-72)
Shai Durant throws a bad pass! Stolen by Jordan Brogdon! TURNOVER! (live ball)

[07:03] Team_089 possession (Score: 71-72)
Jordan Brogdon attempts a Midrange. Contested by Gary Morant (3.8 feet, ZONE). Jordan Brogdon misses. Rebound secured by Gary Morant.

[06:48] Team_031 possession (Score: 71-72)
Shai Durant attempts a Layup. Contested by Terry Simmons (3.6 feet, ZONE). SHAI DURANT MAKES IT! Assist: Gary Morant
Score: 73-72

[06:36] Team_089 possession (Score: 73-72)
Jalen Jackson attempts a Layup. BLOCKED BY IMMANUEL JAMES! Ball is loose! Rebound secured by Immanuel James.

[06:21] Team_031 possession (Score: 73-72)
Pau Irving attempts a 3Pt. Contested by Jordan Brogdon (3.3 feet, ZONE). Pau Irving misses. Rebound secured by Terry Simmons.

[06:05] Team_089 possession (Score: 73-72)
Terry Simmons attempts a Midrange. Contested by Gary Morant (4.4 feet, ZONE). Terry Simmons misses. Rebound secured by Luka Sabonis.

[05:49] Team_031 possession (Score: 73-72)
Pau Irving attempts a 3Pt. Contested by Allen Mobley (4.2 feet, MAN). Pau Irving misses. FOUL! Loose ball foul on Terry Simmons during the rebound battle. [IN THE BONUS! 5 team fouls] Luka Sabonis to the line for 2 free throws. (Terry Simmons: 3 personal fouls)   FT 1/2: MISS   FT 2/2: MISS Luka Sabonis makes 0/2 from the line. Rebound secured by Jalen Jackson.

[05:35] Team_089 possession (Score: 73-72)
FOUL! Shooting foul on Gary Morant. Jalen Jackson to the line for 2 free throws. [BONUS: 7 team fouls] (Gary Morant: 2 personal fouls)   FT 1/2: GOOD   FT 2/2: MISS Jalen Jackson makes 1/2 from the line. Offensive rebound by Jalen Jackson! Jalen Jackson kicks it out.
Score: 73-73

[05:25] Team_089 possession (Score: 73-73)
Jordan Brogdon drives to the basket... Jordan Brogdon throws a bad pass out of bounds! TURNOVER! (dead ball)

[05:07] Team_031 possession (Score: 73-73)
Shai Durant attempts a 3Pt. Contested by Jordan Brogdon (3.4 feet, MAN). Shai Durant misses. Rebound secured by Jalen Jackson.

[04:51] Team_089 possession (Score: 73-73)
Terry Simmons loses the ball! Stripped by Luka Sabonis! TURNOVER! (live ball)

[04:35] Team_031 possession (Score: 73-73)
Luka Sabonis drives and kicks out. Luka Sabonis attempts a Midrange. Contested by Terry Simmons (3.6 feet, MAN). Luka Sabonis misses. Offensive rebound by Immanuel James! Immanuel James puts it back in!
Score: 75-73

[04:22] Team_089 possession (Score: 75-73)
Allen Mobley makes the Midrange and draws the foul on Pau Irving! And-1! Allen Mobley to the line for 1. [BONUS: 8 team fouls] (Pau Irving: 2 personal fouls)   FT 1/1: GOOD Allen Mobley makes 1/1 from the line.
Score: 75-76

[04:07] Team_031 possession (Score: 75-76)
Gary Morant attempts a Midrange. Contested by Jalen Jackson (5.3 feet, MAN). GARY MORANT MAKES IT! Assist: Pau Irving
Score: 77-76

[03:51] Team_089 possession (Score: 77-76)
FOUL! Offensive foul on Jalen Jackson! Gary Morant drew the charge! [Team fouls: 6] (Jalen Jackson: 1 personal fouls) TURNOVER! (dead ball)

[03:34] Team_031 possession (Score: 77-76)
Pau Irving attempts a Midrange. Contested by Allen Mobley (4.2 feet, MAN). PAU IRVING MAKES IT!
Score: 79-76

[03:19] Team_089 possession (Score: 79-76)
Jordan Brogdon attempts a 3Pt. Contested by Shai Durant (4.1 feet, MAN). Jordan Brogdon misses. Rebound secured by Immanuel James.

[03:05] Team_031 possession (Score: 79-76)
Luka Sabonis drives, Terry Simmons stays with him. Luka Sabonis attempts a Dunk. Contested by Terry Simmons (4.3 feet, MAN). LUKA SABONIS MAKES IT! Assist: Gary Morant
Score: 81-76

[02:51] Team_089 possession (Score: 81-76)
Rudy Smith makes the Dunk and draws the foul on Shai Durant! And-1! Rudy Smith to the line for 1. [BONUS: 9 team fouls] (Shai Durant: 2 personal fouls)   FT 1/1: GOOD Rudy Smith makes 1/1 from the line.
Score: 81-79

[02:37] Team_031 possession (Score: 81-79)
Immanuel James loses the ball! Stripped by Rudy Smith! TURNOVER! (live ball)

[02:21] Team_089 possession (Score: 81-79)
Terry Simmons attempts a Layup. Contested by Luka Sabonis (4.1 feet, MAN). TERRY SIMMONS MAKES IT! Assist: Rudy Smith
Score: 81-81

[02:05] Team_031 possession (Score: 81-81)
Shai Durant attempts a 3Pt. Contested by Jordan Brogdon (3.7 feet, ZONE). SHAI DURANT MAKES IT! Assist: Pau Irving
Score: 84-81

[01:51] Team_089 possession (Score: 84-81)
Allen Mobley loses control! Ball rolls out of bounds! TURNOVER! (dead ball)

[01:51] Substitution (Team_031): Shai Durant OUT → Kevin Morant IN (stamina_rule2)

[01:51] Substitution (Team_031): Gary Morant OUT → Isaiah Ingram IN (stamina_rule2)

[01:51] Substitution (Team_031): Pau Irving OUT → Miles Stewart IN (stamina_rule2)

[01:51] Substitution (Team_031): Immanuel James OUT → Kobe Randle IN (stamina_rule2)

[01:51] Substitution (Team_031): Luka Sabonis OUT → Jimmy Poole IN (stamina_rule2)

[01:51] Substitution (Team_089): Jordan Brogdon OUT → Tony Parker IN (stamina_rule2)

[01:51] Substitution (Team_089): Jalen Jackson OUT → Joel Barnes IN (stamina_rule2)

[01:51] Substitution (Team_089): Rudy Smith OUT → Devin Haliburton IN (stamina_rule2)

[01:51] Substitution (Team_089): Terry Simmons OUT → Evan Gasol IN (stamina_rule2)

[01:34] Team_031 possession (Score: 84-81)
Miles Stewart drives and kicks out. Kevin Morant attempts a 3Pt. Contested by Tony Parker (5.3 feet, ZONE). Kevin Morant misses. Rebound secured by Allen Mobley.

[01:22] Team_089 possession (Score: 84-81)
FOUL! Holding foul on Isaiah Ingram. [IN THE BONUS! 10 team fouls] Joel Barnes to the line for 2 free throws. (Isaiah Ingram: 1 personal fouls)   FT 1/2: MISS   FT 2/2: MISS Joel Barnes makes 0/2 from the line. Rebound secured by Isaiah Ingram.

[01:10] Team_031 possession (Score: 84-81)
FOUL! Offensive foul on Kevin Morant! Tony Parker drew the charge! [Team fouls: 11] (Kevin Morant: 1 personal fouls) TURNOVER! (dead ball)

[00:57] Team_089 possession (Score: 84-81)
Evan Gasol attempts a Midrange. Contested by Jimmy Poole (5.8 feet, MAN). Evan Gasol misses. Offensive rebound by Devin Haliburton! Devin Haliburton kicks it out.

[00:44] Team_089 possession (Score: 84-81)
Evan Gasol attempts a Midrange. Contested by Isaiah Ingram (4.4 feet, ZONE). Evan Gasol misses. Rebound secured by Kobe Randle.

[00:33] Team_031 possession (Score: 84-81)
Miles Stewart attempts a Midrange. Contested by Allen Mobley (4.5 feet, MAN). MILES STEWART MAKES IT!
Score: 86-81

[00:21] Team_089 possession (Score: 86-81)
Allen Mobley attempts a Layup. BLOCKED BY MILES STEWART! Ball goes out off Miles Stewart. Allen Mobley's ball!

[00:07] Team_089 possession (Score: 86-81)
Devin Haliburton drives, Kobe Randle stays with him. Devin Haliburton attempts a Layup. Contested by Kobe Randle (4.8 feet, ZONE). DEVIN HALIBURTON MAKES IT! Assist: Joel Barnes
Score: 86-83

================================================================================
                              3RD QUARTER COMPLETE                              
================================================================================

3RD QUARTER SCORE: Team_031 30, Team_089 21

BOX SCORE:
================================================================================

Team_031
--------------------------------------------------------------------------------
Player                MIN  PTS  REB  AST  TO      FG   FG%      3P   3P%
--------------------------------------------------------------------------------
Shai Durant            33    8    0    1   0   3/4    75.0     0/0   0.0
Gary Morant            33    7    3    2   0   3/4    75.0     0/0   0.0
Immanuel James         33    5    4    0   0   2/2   100.0     0/0   0.0
Pau Irving             33    4    0    2   0   2/5    40.0     0/0   0.0
Luka Sabonis           33    4    1    0   0   2/2   100.0     0/0   0.0
Miles Stewart           3    2    0    0   0   1/2    50.0     0/0   0.0
Isaiah Ingram           3    0    1    0   0   0/0     0.0     0/0   0.0
Kobe Randle             3    0    1    0   0   0/0     0.0     0/0   0.0

TEAM: FG: 13/19 (68.4%), 3PT: 1/6 (16.7%), REB: 12 (3 off, 9 def), AST: 5, TO: 3
TEAM FOULS: 11 [Team_089 in BONUS]


Team_089
--------------------------------------------------------------------------------
Player                MIN  PTS  REB  AST  TO      FG   FG%      3P   3P%
--------------------------------------------------------------------------------
Terry Simmons          33    6    2    1   0   3/5    60.0     0/0   0.0
Rudy Smith             33    5    1    1   0   2/2   100.0     0/0   0.0
Allen Mobley           35    5    1    0   0   2/3    66.7     0/0   0.0
Devin Haliburton        3    2    1    0   0   1/1   100.0     0/0   0.0
Jalen Jackson          33    0    5    0   0   0/2     0.0     0/0   0.0
Jordan Brogdon         33    0    0    0   0   0/2     0.0     0/0   0.0
Evan Gasol              3    0    0    0   0   0/1     0.0     0/0   0.0
Joel Barnes             3    0    0    1   0   0/0     0.0     0/0   0.0

TEAM: FG: 8/17 (47.1%), 3PT: 0/2 (0.0%), REB: 8 (4 off, 4 def), AST: 3, TO: 5
TEAM FOULS: 6 [Team_031 in BONUS]

================================================================================

================================================================================
                       4TH QUARTER - Team_031 vs Team_089                       
================================================================================

[12:00] Team_031 possession (Score: 86-83)
Immanuel James drives, Terry Simmons stays with him. Immanuel James attempts a Layup. Contested by Terry Simmons (4.0 feet, ZONE). IMMANUEL JAMES MAKES IT! Assist: Shai Durant
Score: 88-83

[11:45] Team_089 possession (Score: 88-83)
Rudy Smith attempts a 3Pt. Contested by Immanuel James (3.7 feet, MAN). Rudy Smith misses. Rebound secured by Gary Morant.

[11:34] Team_031 possession (Score: 88-83)
Gary Morant attempts a 3Pt. Contested by Jordan Brogdon (3.9 feet, ZONE). GARY MORANT MAKES IT! Assist: Luka Sabonis
Score: 91-83

[11:19] Team_089 possession (Score: 91-83)
Jalen Jackson makes the Dunk and draws the foul on Gary Morant! And-1! Jalen Jackson to the line for 1. [Team fouls: 1] (Gary Morant: 1 personal fouls)   FT 1/1: MISS Jalen Jackson makes 0/1 from the line. Offensive rebound by Jalen Jackson! Jalen Jackson kicks it out.
Score: 91-85

[11:07] Team_089 possession (Score: 91-85)
Jalen Jackson drives and kicks out. Allen Mobley attempts a 3Pt. Contested by Pau Irving (3.7 feet, ZONE). Allen Mobley misses. Rebound secured by Luka Sabonis.

[10:56] Team_031 possession (Score: 91-85)
Immanuel James attempts a Midrange. Contested by Rudy Smith (5.2 feet, MAN). Immanuel James misses. Rebound secured by Jalen Jackson.

[10:41] Team_089 possession (Score: 91-85)
Allen Mobley attempts a Midrange. Contested by Shai Durant (4.1 feet, ZONE). ALLEN MOBLEY MAKES IT!
Score: 91-87

[10:27] Team_031 possession (Score: 91-87)
Pau Irving drives and kicks out. Gary Morant attempts a 3Pt. Contested by Jalen Jackson (4.9 feet, MAN). Gary Morant misses. Rebound secured by Rudy Smith.

[10:14] Team_089 possession (Score: 91-87)
FOUL! Holding foul on Gary Morant. [Team fouls: 2] No free throws, side out. (Gary Morant: 2 personal fouls)

[10:00] Team_089 possession (Score: 91-87)
Jalen Jackson attempts a 3Pt. Contested by Gary Morant (4.3 feet, MAN). Jalen Jackson misses. Rebound secured by Luka Sabonis.

[09:43] Team_031 possession (Score: 91-87)
Luka Sabonis attempts a Midrange. Contested by Rudy Smith (5.5 feet, ZONE). LUKA SABONIS MAKES IT! Assist: Gary Morant
Score: 93-87

[09:27] Team_089 possession (Score: 93-87)
Jordan Brogdon attempts a 3Pt. Contested by Shai Durant (4.2 feet, MAN). Jordan Brogdon misses. Offensive rebound by Terry Simmons! Terry Simmons puts it back in!
Score: 93-89

[09:15] Team_031 possession (Score: 93-89)
Shai Durant drives and kicks out. Shai Durant attempts a Midrange. Contested by Jordan Brogdon (3.6 feet, MAN). SHAI DURANT MAKES IT!
Score: 95-89

[08:59] Team_089 possession (Score: 95-89)
Jordan Brogdon attempts a 3Pt. Contested by Shai Durant (4.2 feet, MAN). Jordan Brogdon misses. FOUL! Loose ball foul on Gary Morant during the rebound battle. [Team fouls: 3] No free throws, side out. (Gary Morant: 3 personal fouls)

[08:42] Team_089 possession (Score: 95-89)
Terry Simmons drives and kicks out. Rudy Smith attempts a Midrange. Contested by Immanuel James (3.7 feet, MAN). RUDY SMITH MAKES IT! Assist: Jordan Brogdon
Score: 95-91

[08:26] Team_031 possession (Score: 95-91)
Immanuel James attempts a Midrange. Contested by Terry Simmons (4.3 feet, ZONE). Immanuel James misses. Rebound secured by Rudy Smith.

[08:11] Team_089 possession (Score: 95-91)
Jordan Brogdon attempts a Layup. BLOCKED BY SHAI DURANT! Ball is loose! Rebound secured by Immanuel James.

[07:53] Team_031 possession (Score: 95-91)
Shai Durant attempts a 3Pt. Contested by Jordan Brogdon (3.9 feet, MAN). Shai Durant misses. Rebound secured by Rudy Smith.

[07:41] Team_089 possession (Score: 95-91)
Allen Mobley attempts a 3Pt. Contested by Pau Irving (4.2 feet, MAN). Allen Mobley misses. Rebound secured by Luka Sabonis.

[07:26] Team_031 possession (Score: 95-91)
Pau Irving drives and kicks out. Gary Morant attempts a 3Pt. Contested by Jalen Jackson (5.2 feet, MAN). GARY MORANT MAKES IT! Assist: Luka Sabonis
Score: 98-91

[07:11] Team_089 possession (Score: 98-91)
FOUL! Shooting foul on Pau Irving. Jalen Jackson to the line for 2 free throws. [Team fouls: 4] (Pau Irving: 1 personal fouls)   FT 1/2: GOOD   FT 2/2: GOOD Jalen Jackson makes 2/2 from the line.
Score: 98-93

[06:58] Team_031 possession (Score: 98-93)
Pau Irving attempts a Midrange. Contested by Allen Mobley (4.9 feet, MAN). Pau Irving misses. Rebound secured by Terry Simmons.

[06:46] Team_089 possession (Score: 98-93)
Allen Mobley attempts a 3Pt. Contested by Pau Irving (4.3 feet, MAN). Allen Mobley misses. Rebound secured by Gary Morant.

[06:36] Team_031 possession (Score: 98-93)
Pau Irving drives and kicks out. Gary Morant attempts a 3Pt. Contested by Jalen Jackson (5.3 feet, MAN). Gary Morant misses. Rebound secured by Jalen Jackson.

[06:20] Team_089 possession (Score: 98-93)
Rudy Smith attempts a Midrange. Contested by Immanuel James (4.5 feet, MAN). Rudy Smith misses. Offensive rebound by Terry Simmons! Terry Simmons kicks it out.

[06:06] Team_089 possession (Score: 98-93)
Jordan Brogdon attempts a 3Pt. Contested by Shai Durant (4.6 feet, MAN). Jordan Brogdon misses. Rebound secured by Gary Morant.

[05:51] Team_031 possession (Score: 98-93)
Pau Irving attempts a 3Pt. Contested by Jalen Jackson (5.4 feet, ZONE). Pau Irving misses. Rebound secured by Terry Simmons.

[05:39] Team_089 possession (Score: 98-93)
Jordan Brogdon attempts a 3Pt. Contested by Shai Durant (4.7 feet, MAN). JORDAN BROGDON MAKES IT! Assist: Allen Mobley
Score: 98-96

[05:29] Team_031 possession (Score: 98-96)
Luka Sabonis attempts a Midrange. Contested by Terry Simmons (4.9 feet, MAN). Luka Sabonis misses. Rebound secured by Jalen Jackson.

[05:13] Team_089 possession (Score: 98-96)
Jordan Brogdon throws a bad pass! Stolen by Shai Durant! TURNOVER! (live ball)

[05:01] Team_031 possession (Score: 98-96)
FOUL! Shooting foul on Terry Simmons. Luka Sabonis to the line for 2 free throws. [Team fouls: 1] (Terry Simmons: 1 personal fouls)   FT 1/2: GOOD   FT 2/2: MISS Luka Sabonis makes 1/2 from the line. Rebound secured by Rudy Smith.
Score: 99-96

[04:45] Team_089 possession (Score: 99-96)
Jordan Brogdon attempts a 3Pt. Contested by Pau Irving (4.6 feet, ZONE). Jordan Brogdon misses. Offensive rebound by Terry Simmons! Terry Simmons kicks it out.

[04:32] Team_089 possession (Score: 99-96)
FOUL! Holding foul on Pau Irving. [IN THE BONUS! 5 team fouls] Allen Mobley to the line for 2 free throws. (Pau Irving: 2 personal fouls)   FT 1/2: GOOD   FT 2/2: GOOD Allen Mobley makes 2/2 from the line.
Score: 99-98

[04:21] Team_031 possession (Score: 99-98)
Immanuel James attempts a Midrange. Contested by Rudy Smith (5.9 feet, MAN). Immanuel James misses. Rebound secured by Jalen Jackson.

[04:03] Team_089 possession (Score: 99-98)
Allen Mobley drives, picks up Immanuel James. Help arrives from Shai Durant! Allen Mobley attempts a Dunk. Contested by Shai Durant (4.6 feet, ZONE). Allen Mobley misses. Rebound secured by Immanuel James.

[03:48] Team_031 possession (Score: 99-98)
Gary Morant drives, Jalen Jackson stays with him. Gary Morant attempts a Dunk. Wide open! Jalen Jackson is 6.1 feet away. [MAN] Gary Morant misses. Rebound secured by Jalen Jackson.

[03:31] Team_089 possession (Score: 99-98)
Allen Mobley makes the Midrange and draws the foul on Pau Irving! And-1! Allen Mobley to the line for 1. [BONUS: 6 team fouls] (Pau Irving: 3 personal fouls)   FT 1/1: GOOD Allen Mobley makes 1/1 from the line.
Score: 99-101

[03:13] Team_031 possession (Score: 99-101)
FOUL! Reach-in foul on Terry Simmons during the drive. [Team fouls: 2] No free throws, side out. (Terry Simmons: 2 personal fouls)

[02:57] Team_031 possession (Score: 99-101)
Gary Morant drives, picks up Terry Simmons. Help arrives from Jalen Jackson! Gary Morant attempts a Dunk. Contested by Jalen Jackson (5.3 feet, ZONE). GARY MORANT MAKES IT! Assist: Shai Durant
Score: 101-101

[02:44] Team_089 possession (Score: 101-101)
Rudy Smith makes the 3Pt and draws the foul on Immanuel James! And-1! Rudy Smith to the line for 1. [BONUS: 7 team fouls] (Immanuel James: 1 personal fouls)   FT 1/1: GOOD Rudy Smith makes 1/1 from the line.
Score: 101-105

[02:30] Team_031 possession (Score: 101-105)
Pau Irving drives to the basket... Pau Irving throws a bad pass! Stolen by Allen Mobley! TURNOVER! (live ball)

[02:12] Team_089 possession (Score: 101-105)
Rudy Smith attempts a Layup. Contested by Immanuel James (5.3 feet, ZONE). Rudy Smith misses. Rebound secured by Immanuel James.

[02:01] Team_031 possession (Score: 101-105)
Gary Morant attempts a 3Pt. Wide open! Jalen Jackson is 6.3 feet away. [MAN] Gary Morant misses. Rebound secured by Rudy Smith.

[01:48] Team_089 possession (Score: 101-105)
FOUL! Holding foul on Shai Durant. [IN THE BONUS! 8 team fouls] Jordan Brogdon to the line for 2 free throws. (Shai Durant: 1 personal fouls)   FT 1/2: MISS   FT 2/2: GOOD Jordan Brogdon makes 1/2 from the line.
Score: 101-106

[01:33] Team_031 possession (Score: 101-106)
Shai Durant attempts a 3Pt. Contested by Jordan Brogdon (4.9 feet, MAN). Shai Durant misses. Offensive rebound by Immanuel James! Immanuel James kicks it out.

[01:20] Team_031 possession (Score: 101-106)
Shai Durant attempts a 3Pt. Contested by Jordan Brogdon (4.9 feet, MAN). Shai Durant misses. Rebound secured by Terry Simmons.

[01:06] Team_089 possession (Score: 101-106)
Allen Mobley attempts a Layup. Contested by Pau Irving (5.1 feet, MAN). Allen Mobley misses. Offensive rebound by Jalen Jackson! Jalen Jackson kicks it out.

[00:52] Team_089 possession (Score: 101-106)
Allen Mobley attempts a 3Pt. Contested by Pau Irving (5.2 feet, MAN). Allen Mobley misses. Offensive rebound by Jalen Jackson! Jalen Jackson kicks it out.

[00:41] Team_089 possession (Score: 101-106)
Jalen Jackson attempts a 3Pt. Contested by Pau Irving (5.4 feet, ZONE). Jalen Jackson misses. Rebound secured by Gary Morant.

[00:27] Team_031 possession (Score: 101-106)
Pau Irving attempts a 3Pt. Contested by Jordan Brogdon (5.1 feet, ZONE). Pau Irving misses. Rebound secured by Jalen Jackson.

[00:12] Team_089 possession (Score: 101-106)
FOUL! Shooting foul on Immanuel James. Jalen Jackson to the line for 2 free throws. [BONUS: 9 team fouls] (Immanuel James: 2 personal fouls)   FT 1/2: GOOD   FT 2/2: GOOD Jalen Jackson makes 2/2 from the line.
Score: 101-108

[00:03] Team_031 possession (Score: 101-108)
Immanuel James attempts a Layup. Wide open! Rudy Smith is 6.4 feet away. [MAN] IMMANUEL JAMES MAKES IT!
Score: 103-108

================================================================================
                              4TH QUARTER COMPLETE                              
================================================================================

4TH QUARTER SCORE: Team_031 17, Team_089 25

BOX SCORE:
================================================================================

Team_031
--------------------------------------------------------------------------------
Player                MIN  PTS  REB  AST  TO      FG   FG%      3P   3P%
--------------------------------------------------------------------------------
Gary Morant            45    8    4    1   0   3/5    60.0     0/0   0.0
Immanuel James         45    4    4    0   0   2/5    40.0     0/0   0.0
Shai Durant            45    2    0    2   0   1/3    33.3     0/0   0.0
Luka Sabonis           45    2    3    2   0   1/3    33.3     0/0   0.0
Pau Irving             45    0    0    0   0   0/5     0.0     0/0   0.0

TEAM: FG: 7/21 (33.3%), 3PT: 1/6 (16.7%), REB: 11 (1 off, 10 def), AST: 5, TO: 1
TEAM FOULS: 9 [Team_089 in BONUS]


Team_089
--------------------------------------------------------------------------------
Player                MIN  PTS  REB  AST  TO      FG   FG%      3P   3P%
--------------------------------------------------------------------------------
Allen Mobley           47    7    0    1   0   3/6    50.0     0/0   0.0
Rudy Smith             45    6    5    0   0   2/4    50.0     0/0   0.0
Jalen Jackson          45    4   10    0   0   2/5    40.0     0/0   0.0
Jordan Brogdon         45    4    0    1   0   2/4    50.0     0/0   0.0
Terry Simmons          45    2    6    0   0   1/1   100.0     0/0   0.0

TEAM: FG: 10/20 (50.0%), 3PT: 3/9 (33.3%), REB: 21 (7 off, 14 def), AST: 2, TO: 1
TEAM FOULS: 2

================================================================================

================================================================================
                               FULL GAME COMPLETE                               
================================================================================

FINAL SCORE: Team_031 103, Team_089 108

SCORING BY QUARTER:
--------------------------------------------------------------------------------
Team                     Q1     Q2     Q3     Q4    FINAL
--------------------------------------------------------------------------------
Team_031                 30     26     30     17      103
Team_089                 36     26     21     25      108
--------------------------------------------------------------------------------

FULL GAME BOX SCORE:
================================================================================

Team_031
--------------------------------------------------------------------------------
Player                MIN  PTS  REB  AST  TO      FG   FG%      3P   3P%      FT STL BLK
--------------------------------------------------------------------------------
Shai Durant            45   17    0    4   1   8/18   44.4   2/9    22.2   3/3     1   1
Gary Morant            45   27   11    5   0   9/15   60.0   2/5    40.0   3/4     0   0
Pau Irving             45   13    0    3   1   7/19   36.8   0/7     0.0   3/4     0   0
Immanuel James         45   23   16    5   2   9/13   69.2   2/2   100.0   1/2     1   1
Luka Sabonis           45   20   13    4   1   8/14   57.1   0/1     0.0   3/6     1   0
Kevin Morant            3    0    0    0   1   0/2     0.0   0/1     0.0   0/0     0   0
Isaiah Ingram           3    0    2    0   0   0/0     0.0   0/0     0.0   0/0     0   0
Miles Stewart           3    2    0    0   0   1/2    50.0   0/0     0.0   0/0     0   1
Kobe Randle             3    0    1    0   0   0/1     0.0   0/0     0.0   0/0     0   0
Jimmy Poole             3    0    0    0   0   0/0     0.0   0/0     0.0   0/0     0   0

TEAM: FG: 44/86 (51.2%), 3PT: 6/25 (24.0%), REB: 44 (8 off, 36 def), AST: 21, TO: 6


Team_089
--------------------------------------------------------------------------------
Player                MIN  PTS  REB  AST  TO      FG   FG%      3P   3P%      FT STL BLK
--------------------------------------------------------------------------------
Allen Mobley           47   16    3    3   1   8/13   61.5   0/2     0.0   6/6     1   1
Jordan Brogdon         45   11    0    1   1   4/8    50.0   2/4    50.0   4/6     1   0
Jalen Jackson          45   22   24    1   5  10/20   50.0   3/7    42.9  12/14    0   1
Rudy Smith             45   20   11    2   1   8/16   50.0   1/3    33.3  10/13    1   0
Terry Simmons          45   26   14    3   1   8/13   61.5   1/1   100.0  13/18    0   1
Tony Parker             3    2    0    0   0   1/1   100.0   0/0     0.0   0/0     0   0
Joel Barnes             3    0    0    1   0   0/0     0.0   0/0     0.0   0/2     0   0
Devin Haliburton        3    2    1    0   0   1/1   100.0   0/0     0.0   0/0     0   0
Evan Gasol              3    0    0    0   0   0/1     0.0   0/0     0.0   0/0     0   0
Pascal Durant           1    2    3    0   0   1/2    50.0   0/1     0.0   0/0     0   0

TEAM: FG: 45/81 (55.6%), 3PT: 7/18 (38.9%), REB: 54 (16 off, 38 def), AST: 11, TO: 9

================================================================================
