================================================================================
                        FULL GAME - Team_083 vs Team_097                        
================================================================================

================================================================================
                       1ST QUARTER - Team_083 vs Team_097                       
================================================================================

[12:00] Team_083 possession (Score: 0-0)
Karl Jokic attempts a 3Pt. Contested by Jrue Haliburton (5.7 feet, MAN). Karl Jokic misses. Rebound secured by Tyrese Stewart.

[11:42] Team_097 possession (Score: 0-0)
Jrue Haliburton attempts a Layup. Contested by Karl Jokic (5.0 feet, MAN). JRUE HALIBURTON MAKES IT!
Score: 0-2

[11:25] Team_083 possession (Score: 0-2)
Kyrie Griffin drives and kicks out. Malcolm Brogdon attempts a Midrange. Contested by Anthony Haliburton (3.3 feet, ZONE). Malcolm Brogdon misses. Offensive rebound by Bradley Thompson! Bradley Thompson puts it back in!
Score: 2-2

[11:12] Team_097 possession (Score: 2-2)
Shai Poole attempts a 3Pt. Contested by Yao Oladipo (3.9 feet, MAN). Shai Poole misses. Rebound secured by Bradley Thompson.

[10:58] Team_083 possession (Score: 2-2)
FOUL! Offensive foul on Malcolm Brogdon! Evan Brogdon drew the charge! [Team fouls: 1] (Malcolm Brogdon: 1 personal fouls) TURNOVER! (dead ball)

[10:46] Team_097 possession (Score: 2-2)
Tyrese Stewart drives, Bradley Thompson stays with him. Tyrese Stewart attempts a Layup. Contested by Bradley Thompson (4.5 feet, MAN). TYRESE STEWART MAKES IT! Assist: Anthony Haliburton
Score: 2-4

[10:32] Team_083 possession (Score: 2-4)
Bradley Thompson attempts a Layup. Contested by Anthony Haliburton (3.4 feet, ZONE). Bradley Thompson misses. Rebound secured by Tyrese Stewart.

[10:22] Team_097 possession (Score: 2-4)
Tyrese Stewart drives, Bradley Thompson stays with him. Tyrese Stewart attempts a Dunk. Contested by Bradley Thompson (4.5 feet, ZONE). Tyrese Stewart misses. Offensive rebound by Tyrese Stewart! Tyrese Stewart kicks it out.

[10:07] Team_097 possession (Score: 2-4)
Jrue Haliburton attempts a 3Pt. Contested by Karl Jokic (5.0 feet, MAN). Jrue Haliburton misses. Rebound secured by Kyrie Griffin.

[09:56] Team_083 possession (Score: 2-4)
Bradley Thompson attempts a Midrange. Contested by Anthony Haliburton (3.4 feet, ZONE). Bradley Thompson misses. Offensive rebound by Kyrie Griffin! Kyrie Griffin kicks it out.

[09:41] Team_083 possession (Score: 2-4)
Karl Jokic attempts a Midrange. Contested by Jrue Haliburton (5.7 feet, MAN). Karl Jokic misses. Rebound secured by Shai Poole.

[09:25] Team_097 possession (Score: 2-4)
Tyrese Stewart attempts a Layup. Contested by Bradley Thompson (4.5 feet, MAN). TYRESE STEWART MAKES IT! Assist: Jrue Haliburton
Score: 2-6

[09:11] Team_083 possession (Score: 2-6)
Kyrie Griffin makes the Layup and draws the foul on Anthony Haliburton! And-1! Kyrie Griffin to the line for 1. [Team fouls: 1] (Anthony Haliburton: 1 personal fouls)   FT 1/1: GOOD Kyrie Griffin makes 1/1 from the line.
Score: 5-6

[08:57] Team_097 possession (Score: 5-6)
Evan Brogdon attempts a Midrange. Contested by Malcolm Brogdon (5.5 feet, MAN). EVAN BROGDON MAKES IT! Assist: Anthony Haliburton
Score: 5-8

[08:41] Team_083 possession (Score: 5-8)
FOUL! Shooting foul on Evan Brogdon. Malcolm Brogdon to the line for 3 free throws. [Team fouls: 2] (Evan Brogdon: 1 personal fouls)   FT 1/3: GOOD   FT 2/3: GOOD   FT 3/3: GOOD Malcolm Brogdon makes 3/3 from the line.
Score: 8-8

[08:24] Team_097 possession (Score: 8-8)
Anthony Haliburton drives, Kyrie Griffin stays with him. Anthony Haliburton attempts a Layup. Contested by Kyrie Griffin (3.8 feet, MAN). ANTHONY HALIBURTON MAKES IT! Assist: Jrue Haliburton
Score: 8-10

[08:12] Team_083 possession (Score: 8-10)
Yao Oladipo makes the Layup and draws the foul on Jrue Haliburton! And-1! Yao Oladipo to the line for 1. [Team fouls: 3] (Jrue Haliburton: 1 personal fouls)   FT 1/1: GOOD Yao Oladipo makes 1/1 from the line.
Score: 11-10

[07:55] Team_097 possession (Score: 11-10)
Evan Brogdon drives and kicks out. Tyrese Stewart attempts a 3Pt. Contested by Bradley Thompson (3.7 feet, MAN). Tyrese Stewart misses. Rebound secured by Yao Oladipo.

[07:41] Team_083 possession (Score: 11-10)
Malcolm Brogdon attempts a 3Pt. Contested by Shai Poole (3.0 feet, ZONE). Malcolm Brogdon misses. Offensive rebound by Bradley Thompson! Bradley Thompson puts it back in!
Score: 13-10

[07:31] Team_097 possession (Score: 13-10)
Tyrese Stewart attempts a Midrange. Contested by Bradley Thompson (4.5 feet, MAN). TYRESE STEWART MAKES IT!
Score: 13-12

[07:17] Team_083 possession (Score: 13-12)
Yao Oladipo attempts a Dunk. BLOCKED BY ANTHONY HALIBURTON! Ball is loose! Rebound secured by Anthony Haliburton.

[07:02] Team_097 possession (Score: 13-12)
Evan Brogdon attempts a Midrange. Contested by Yao Oladipo (4.1 feet, ZONE). EVAN BROGDON MAKES IT!
Score: 13-14

[06:47] Team_083 possession (Score: 13-14)
Malcolm Brogdon attempts a 3Pt. Contested by Evan Brogdon (4.3 feet, MAN). Malcolm Brogdon misses. Rebound secured by Tyrese Stewart.

[06:32] Team_097 possession (Score: 13-14)
Evan Brogdon drives, picks up Malcolm Brogdon. Help arrives from Yao Oladipo! Evan Brogdon attempts a Dunk. Contested by Yao Oladipo (5.5 feet, MAN). EVAN BROGDON MAKES IT!
Score: 13-16

[06:19] Team_083 possession (Score: 13-16)
Kyrie Griffin attempts a 3Pt. Contested by Shai Poole (3.7 feet, ZONE). Kyrie Griffin misses. Rebound secured by Anthony Haliburton.

[06:03] Team_097 possession (Score: 13-16)
Shai Poole throws a bad pass out of bounds! TURNOVER! (dead ball)

[05:48] Team_083 possession (Score: 13-16)
Kyrie Griffin attempts a Layup. Contested by Anthony Haliburton (3.6 feet, MAN). KYRIE GRIFFIN MAKES IT!
Score: 15-16

[05:35] Team_097 possession (Score: 15-16)
Jrue Haliburton attempts a 3Pt. Contested by Karl Jokic (5.0 feet, MAN). Jrue Haliburton misses. Rebound secured by Yao Oladipo.

[05:17] Team_083 possession (Score: 15-16)
FOUL! Reach-in foul on Anthony Haliburton during the drive. [Team fouls: 4] No free throws, side out. (Anthony Haliburton: 2 personal fouls)

[04:58] Team_083 possession (Score: 15-16)
Kyrie Griffin attempts a Midrange. Contested by Anthony Haliburton (3.7 feet, MAN). KYRIE GRIFFIN MAKES IT!
Score: 17-16

[04:41] Team_097 possession (Score: 17-16)
Tyrese Stewart attempts a 3Pt. Contested by Malcolm Brogdon (5.7 feet, ZONE). Tyrese Stewart misses. Offensive rebound by Tyrese Stewart! Tyrese Stewart kicks it out.

[04:30] Team_097 possession (Score: 17-16)
Jrue Haliburton drives and kicks out. Jrue Haliburton attempts a Midrange. Contested by Karl Jokic (4.6 feet, MAN). JRUE HALIBURTON MAKES IT!
Score: 17-18

[04:13] Team_083 possession (Score: 17-18)
Malcolm Brogdon attempts a 3Pt. Contested by Evan Brogdon (4.4 feet, MAN). Malcolm Brogdon misses. Offensive rebound by Bradley Thompson! Bradley Thompson puts it back in!
Score: 19-18

[03:55] Team_097 possession (Score: 19-18)
Jrue Haliburton attempts a Midrange. Contested by Karl Jokic (5.1 feet, MAN). JRUE HALIBURTON MAKES IT! Assist: Shai Poole
Score: 19-20

[03:45] Team_083 possession (Score: 19-20)
Bradley Thompson attempts a 3Pt. Contested by Shai Poole (3.6 feet, ZONE). Bradley Thompson misses. Offensive rebound by Kyrie Griffin! Kyrie Griffin kicks it out.

[03:31] Team_083 possession (Score: 19-20)
Kyrie Griffin drives, Anthony Haliburton stays with him. Kyrie Griffin attempts a Layup. Contested by Anthony Haliburton (3.8 feet, ZONE). Kyrie Griffin misses. Rebound secured by Tyrese Stewart.

[03:19] Team_097 possession (Score: 19-20)
FOUL! Holding foul on Yao Oladipo. [Team fouls: 2] No free throws, side out. (Yao Oladipo: 1 personal fouls)

[03:06] Team_097 possession (Score: 19-20)
Jrue Haliburton attempts a Midrange. Contested by Yao Oladipo (4.0 feet, ZONE). Jrue Haliburton misses. Rebound secured by Kyrie Griffin.

[02:54] Team_083 possession (Score: 19-20)
Bradley Thompson attempts a 3Pt. Contested by Shai Poole (3.7 feet, ZONE). Bradley Thompson misses. Rebound secured by Tyrese Stewart.

[02:38] Team_097 possession (Score: 19-20)
Tyrese Stewart attempts a Layup. Contested by Bradley Thompson (4.8 feet, MAN). TYRESE STEWART MAKES IT!
Score: 19-22

[02:24] Team_083 possession (Score: 19-22)
Malcolm Brogdon attempts a Midrange. BLOCKED BY EVAN BROGDON! Ball is loose! Rebound secured by Shai Poole.

[02:07] Team_097 possession (Score: 19-22)
Tyrese Stewart attempts a Layup. Contested by Kyrie Griffin (4.6 feet, ZONE). TYRESE STEWART MAKES IT! Assist: Jrue Haliburton
Score: 19-24

[01:51] Team_083 possession (Score: 19-24)
Kyrie Griffin makes the Dunk and draws the foul on Anthony Haliburton! And-1! Kyrie Griffin to the line for 1. [BONUS: 5 team fouls] (Anthony Haliburton: 3 personal fouls)   FT 1/1: GOOD Kyrie Griffin makes 1/1 from the line.
Score: 22-24

[01:32] Team_097 possession (Score: 22-24)
Anthony Haliburton drives, Kyrie Griffin stays with him. Anthony Haliburton attempts a Layup. Contested by Kyrie Griffin (4.2 feet, MAN). ANTHONY HALIBURTON MAKES IT!
Score: 22-26

[01:17] Team_083 possession (Score: 22-26)
Malcolm Brogdon drives and kicks out. Bradley Thompson attempts a 3Pt. Contested by Anthony Haliburton (3.8 feet, ZONE). Bradley Thompson misses. Rebound secured by Anthony Haliburton.

[01:00] Team_097 possession (Score: 22-26)
Jrue Haliburton attempts a 3Pt. Contested by Karl Jokic (5.3 feet, MAN). JRUE HALIBURTON MAKES IT! Assist: Anthony Haliburton
Score: 22-29

[00:49] Team_083 possession (Score: 22-29)
Malcolm Brogdon makes the Dunk and draws the foul on Shai Poole! And-1! Malcolm Brogdon to the line for 1. [BONUS: 6 team fouls] (Shai Poole: 1 personal fouls)   FT 1/1: GOOD Malcolm Brogdon makes 1/1 from the line.
Score: 25-29

[00:33] Team_097 possession (Score: 25-29)
Anthony Haliburton attempts a Midrange. Contested by Yao Oladipo (4.2 feet, ZONE). Anthony Haliburton misses. Rebound secured by Kyrie Griffin.

[00:17] Team_083 possession (Score: 25-29)
Bradley Thompson makes the Layup and draws the foul on Anthony Haliburton! And-1! Bradley Thompson to the line for 1. [BONUS: 7 team fouls] (Anthony Haliburton: 4 personal fouls)   FT 1/1: MISS Bradley Thompson makes 0/1 from the line. Rebound secured by Shai Poole.
Score: 27-29

[00:07] Team_097 possession (Score: 27-29)
Shai Poole attempts a 3Pt. Contested by Yao Oladipo (4.4 feet, MAN). Shai Poole misses. Offensive rebound by Tyrese Stewart! Tyrese Stewart kicks it out.

================================================================================
                              1ST QUARTER COMPLETE                              
================================================================================

1ST QUARTER SCORE: Team_083 27, Team_097 29

BOX SCORE:
================================================================================

Team_083
--------------------------------------------------------------------------------
Player                MIN  PTS  REB  AST  TO      FG   FG%      3P   3P%
--------------------------------------------------------------------------------
Kyrie Griffin          12   10    5    0   0   4/6    66.7     0/0   0.0
Bradley Thompson       12    6    4    0   0   3/6    50.0     0/0   0.0
Malcolm Brogdon        12    6    0    0   0   2/5    40.0     0/0   0.0
Yao Oladipo            12    3    2    0   0   1/2    50.0     0/0   0.0
Karl Jokic             12    0    0    0   0   0/2     0.0     0/0   0.0

TEAM: FG: 10/21 (47.6%), 3PT: 3/7 (42.9%), REB: 11 (5 off, 6 def), AST: 0, TO: 1
TEAM FOULS: 2


Team_097
--------------------------------------------------------------------------------
Player                MIN  PTS  REB  AST  TO      FG   FG%      3P   3P%
--------------------------------------------------------------------------------
Tyrese Stewart         12   10    8    0   0   5/5   100.0     0/0   0.0
Jrue Haliburton        12    9    0    3   0   4/7    57.1     0/0   0.0
Evan Brogdon           12    6    0    0   0   3/4    75.0     0/0   0.0
Anthony Haliburton     12    4    3    3   0   2/3    66.7     0/0   0.0
Shai Poole             12    0    3    1   0   0/1     0.0     0/0   0.0

TEAM: FG: 14/20 (70.0%), 3PT: 1/4 (25.0%), REB: 14 (3 off, 11 def), AST: 7, TO: 1
TEAM FOULS: 7 [Team_083 in BONUS]

================================================================================

================================================================================
                       2ND QUARTER - Team_083 vs Team_097                       
================================================================================

[12:00] Team_083 possession (Score: 27-29)
Malcolm Brogdon attempts a 3Pt. Contested by Shai Poole (3.3 feet, ZONE). MALCOLM BROGDON MAKES IT! Assist: Karl Jokic
Score: 30-29

[11:46] Team_097 possession (Score: 30-29)
Shai Poole attempts a 3Pt. Contested by Malcolm Brogdon (5.6 feet, ZONE). Shai Poole misses. Offensive rebound by Tyrese Stewart! Tyrese Stewart kicks it out.

[11:34] Team_097 possession (Score: 30-29)
FOUL! Shooting foul on Malcolm Brogdon. Evan Brogdon to the line for 2 free throws. [Team fouls: 1] (Malcolm Brogdon: 1 personal fouls)   FT 1/2: GOOD   FT 2/2: GOOD Evan Brogdon makes 2/2 from the line.
Score: 30-31

[11:21] Team_083 possession (Score: 30-31)
FOUL! Shooting foul on Jrue Haliburton. Karl Jokic to the line for 2 free throws. [Team fouls: 1] (Jrue Haliburton: 1 personal fouls)   FT 1/2: GOOD   FT 2/2: GOOD Karl Jokic makes 2/2 from the line.
Score: 32-31

[11:04] Team_097 possession (Score: 32-31)
Anthony Haliburton drives and kicks out. Anthony Haliburton attempts a 3Pt. Contested by Kyrie Griffin (3.9 feet, MAN). Anthony Haliburton misses. Rebound secured by Kyrie Griffin.

[10:49] Team_083 possession (Score: 32-31)
Malcolm Brogdon drives, picks up Evan Brogdon. Help arrives from Shai Poole! Malcolm Brogdon attempts a Dunk. Contested by Shai Poole (4.7 feet, MAN). MALCOLM BROGDON MAKES IT!
Score: 34-31

[10:35] Team_097 possession (Score: 34-31)
Evan Brogdon makes the 3Pt and draws the foul on Malcolm Brogdon! And-1! Evan Brogdon to the line for 1. [Team fouls: 2] (Malcolm Brogdon: 2 personal fouls)   FT 1/1: GOOD Evan Brogdon makes 1/1 from the line.
Score: 34-35

[10:18] Team_083 possession (Score: 34-35)
FOUL! Shooting foul on Anthony Haliburton. Kyrie Griffin to the line for 2 free throws. [Team fouls: 2] (Anthony Haliburton: 1 personal fouls)   FT 1/2: GOOD   FT 2/2: GOOD Kyrie Griffin makes 2/2 from the line.
Score: 36-35

[10:04] Team_097 possession (Score: 36-35)
Shai Poole attempts a Midrange. Contested by Yao Oladipo (4.4 feet, MAN). Shai Poole misses. Rebound secured by Kyrie Griffin.

[09:48] Team_083 possession (Score: 36-35)
Karl Jokic attempts a 3Pt. Wide open! Jrue Haliburton is 6.1 feet away. [MAN] Karl Jokic misses. Rebound secured by Shai Poole.

[09:34] Team_097 possession (Score: 36-35)
Tyrese Stewart drives, Kyrie Griffin stays with him. Tyrese Stewart attempts a Layup. Contested by Kyrie Griffin (4.9 feet, ZONE). Tyrese Stewart misses. Rebound secured by Kyrie Griffin.

[09:23] Team_083 possession (Score: 36-35)
Malcolm Brogdon attempts a 3Pt. Contested by Evan Brogdon (4.9 feet, MAN). MALCOLM BROGDON MAKES IT! Assist: Bradley Thompson
Score: 39-35

[09:10] Team_097 possession (Score: 39-35)
Tyrese Stewart attempts a Layup. Contested by Bradley Thompson (5.2 feet, MAN). TYRESE STEWART MAKES IT! Assist: Evan Brogdon
Score: 39-37

[09:00] Team_083 possession (Score: 39-37)
Karl Jokic attempts a 3Pt. Wide open! Jrue Haliburton is 6.1 feet away. [MAN] KARL JOKIC MAKES IT!
Score: 42-37

[08:46] Team_097 possession (Score: 42-37)
Shai Poole drives, Yao Oladipo stays with him. Shai Poole attempts a Dunk. Contested by Yao Oladipo (4.5 feet, MAN). SHAI POOLE MAKES IT! Assist: Evan Brogdon
Score: 42-39

[08:33] Team_083 possession (Score: 42-39)
Kyrie Griffin attempts a Midrange. Contested by Anthony Haliburton (4.4 feet, MAN). Kyrie Griffin misses. Offensive rebound by Bradley Thompson! Bradley Thompson kicks it out.

[08:20] Team_083 possession (Score: 42-39)
Malcolm Brogdon loses control! Ball rolls out of bounds! TURNOVER! (dead ball)

[08:20] Substitution (Team_083): Malcolm Brogdon OUT → Zion Markkanen IN (stamina_rule2)

[08:20] Substitution (Team_083): Karl Jokic OUT → Damian Towns IN (stamina_rule2)

[08:20] Substitution (Team_083): Yao Oladipo OUT → Domantas Doncic IN (stamina_rule2)

[08:20] Substitution (Team_083): Kyrie Griffin OUT → Cole Simmons IN (stamina_rule2)

[08:20] Substitution (Team_083): Bradley Thompson OUT → Victor McCollum IN (stamina_rule2)

[08:20] Substitution (Team_097): Evan Brogdon OUT → Gary Carter IN (stamina_rule2)

[08:20] Substitution (Team_097): Jrue Haliburton OUT → Dwyane Ginobili IN (stamina_rule2)

[08:20] Substitution (Team_097): Shai Poole OUT → Miles Dosunmu IN (stamina_rule2)

[08:20] Substitution (Team_097): Anthony Haliburton OUT → Joel Simons IN (stamina_rule2)

[08:20] Substitution (Team_097): Tyrese Stewart OUT → Miles Banchero IN (stamina_rule2)

[08:06] Team_097 possession (Score: 42-39)
Dwyane Ginobili drives and kicks out. Miles Dosunmu attempts a 3Pt. Contested by Domantas Doncic (4.5 feet, MAN). Miles Dosunmu misses. Rebound secured by Damian Towns.

[07:52] Team_083 possession (Score: 42-39)
Zion Markkanen drives, Miles Banchero stays with him. Zion Markkanen attempts a Layup. Contested by Miles Banchero (5.0 feet, ZONE). ZION MARKKANEN MAKES IT!
Score: 44-39

[07:33] Team_097 possession (Score: 44-39)
Joel Simons attempts a Midrange. Contested by Domantas Doncic (4.7 feet, ZONE). Joel Simons misses. Rebound secured by Cole Simmons.

[07:17] Team_083 possession (Score: 44-39)
Damian Towns drives to the basket... Damian Towns throws a bad pass out of bounds! TURNOVER! (dead ball)

[07:01] Team_097 possession (Score: 44-39)
Miles Dosunmu attempts a 3Pt. Contested by Domantas Doncic (5.0 feet, MAN). MILES DOSUNMU MAKES IT! Assist: Dwyane Ginobili
Score: 44-42

[06:48] Team_083 possession (Score: 44-42)
FOUL! Holding foul on Dwyane Ginobili. [Team fouls: 3] No free throws, side out. (Dwyane Ginobili: 1 personal fouls)

[06:30] Team_083 possession (Score: 44-42)
Cole Simmons attempts a Midrange. Contested by Miles Dosunmu (3.8 feet, ZONE). Cole Simmons misses. Offensive rebound by Damian Towns! Damian Towns kicks it out.

[06:19] Team_083 possession (Score: 44-42)
Cole Simmons attempts a 3Pt. Contested by Joel Simons (3.5 feet, MAN). Cole Simmons misses. Rebound secured by Miles Dosunmu.

[06:04] Team_097 possession (Score: 44-42)
Miles Dosunmu attempts a Layup. Contested by Domantas Doncic (5.0 feet, MAN). MILES DOSUNMU MAKES IT!
Score: 44-44

[05:51] Team_083 possession (Score: 44-44)
Domantas Doncic attempts a Layup. Contested by Joel Simons (3.7 feet, ZONE). Domantas Doncic misses. Rebound secured by Miles Dosunmu.

[05:34] Team_097 possession (Score: 44-44)
Miles Banchero attempts a Layup. BLOCKED BY VICTOR MCCOLLUM! Ball is loose! Offensive rebound by Joel Simons! Joel Simons kicks it out.

[05:19] Team_097 possession (Score: 44-44)
Miles Banchero attempts a Midrange. Contested by Victor McCollum (4.1 feet, MAN). Miles Banchero misses. Offensive rebound by Joel Simons! Joel Simons kicks it out.

[05:08] Team_097 possession (Score: 44-44)
FOUL! Shooting foul on Zion Markkanen. Gary Carter to the line for 2 free throws. [Team fouls: 3] (Zion Markkanen: 1 personal fouls)   FT 1/2: MISS   FT 2/2: GOOD Gary Carter makes 1/2 from the line.
Score: 44-45

[04:54] Team_083 possession (Score: 44-45)
Damian Towns attempts a 3Pt. Contested by Dwyane Ginobili (5.1 feet, MAN). Damian Towns misses. Rebound secured by Miles Dosunmu.

[04:39] Team_097 possession (Score: 44-45)
Gary Carter attempts a 3Pt. Contested by Zion Markkanen (5.2 feet, ZONE). GARY CARTER MAKES IT! Assist: Joel Simons
Score: 44-48

[04:24] Team_083 possession (Score: 44-48)
Domantas Doncic attempts a 3Pt. Contested by Dwyane Ginobili (4.7 feet, ZONE). DOMANTAS DONCIC MAKES IT! Assist: Victor McCollum
Score: 47-48

[04:13] Team_097 possession (Score: 47-48)
Miles Banchero attempts a Midrange. Contested by Domantas Doncic (4.6 feet, ZONE). MILES BANCHERO MAKES IT! Assist: Gary Carter
Score: 47-50

[04:00] Team_083 possession (Score: 47-50)
Zion Markkanen attempts a 3Pt. Contested by Joel Simons (3.7 feet, ZONE). Zion Markkanen misses. Offensive rebound by Victor McCollum! Victor McCollum puts it back in!
Score: 49-50

[03:41] Team_097 possession (Score: 49-50)
Miles Dosunmu drives, Domantas Doncic stays with him. Miles Dosunmu attempts a Layup. Contested by Domantas Doncic (5.0 feet, MAN). Miles Dosunmu misses. Rebound secured by Damian Towns.

[03:27] Team_083 possession (Score: 49-50)
Domantas Doncic attempts a Midrange. Contested by Miles Dosunmu (3.9 feet, MAN). Domantas Doncic misses. Offensive rebound by Damian Towns! Damian Towns kicks it out.

[03:11] Team_083 possession (Score: 49-50)
Victor McCollum attempts a Midrange. Contested by Joel Simons (4.2 feet, MAN). Victor McCollum misses. Rebound secured by Miles Banchero.

[02:57] Team_097 possession (Score: 49-50)
Gary Carter attempts a Midrange. Contested by Zion Markkanen (5.2 feet, MAN). Gary Carter misses. Rebound secured by Damian Towns.

[02:41] Team_083 possession (Score: 49-50)
Cole Simmons attempts a Midrange. Contested by Joel Simons (3.5 feet, MAN). Cole Simmons misses. Rebound secured by Miles Dosunmu.

[02:29] Team_097 possession (Score: 49-50)
Miles Dosunmu attempts a 3Pt. Contested by Zion Markkanen (5.9 feet, ZONE). Miles Dosunmu misses. Rebound secured by Victor McCollum.

[02:10] Team_083 possession (Score: 49-50)
FOUL! Shooting foul on Joel Simons. Victor McCollum to the line for 2 free throws. [Team fouls: 4] (Joel Simons: 1 personal fouls)   FT 1/2: GOOD   FT 2/2: MISS Victor McCollum makes 1/2 from the line. FOUL! Loose ball foul on Miles Dosunmu during the free throw rebound! [IN THE BONUS! 5 team fouls] Damian Towns to the line for 2 free throws. (Miles Dosunmu: 1 personal fouls)   FT 1/2: GOOD   FT 2/2: MISS Damian Towns makes 1/2 from the line. Rebound secured by Miles Banchero.
Score: 51-50

[01:53] Team_097 possession (Score: 51-50)
Miles Dosunmu attempts a 3Pt. Contested by Domantas Doncic (5.0 feet, MAN). Miles Dosunmu misses. Rebound secured by Cole Simmons.

[01:37] Team_083 possession (Score: 51-50)
FOUL! Holding foul on Gary Carter. [IN THE BONUS! 6 team fouls] Zion Markkanen to the line for 2 free throws. (Gary Carter: 1 personal fouls)   FT 1/2: MISS   FT 2/2: GOOD Zion Markkanen makes 1/2 from the line.
Score: 52-50

[01:22] Team_097 possession (Score: 52-50)
Dwyane Ginobili attempts a 3Pt. Contested by Zion Markkanen (5.3 feet, ZONE). Dwyane Ginobili misses. Rebound secured by Cole Simmons.

[01:05] Team_083 possession (Score: 52-50)
Damian Towns attempts a 3Pt. Contested by Joel Simons (4.1 feet, ZONE). DAMIAN TOWNS MAKES IT!
Score: 55-50

[00:48] Team_097 possession (Score: 55-50)
FOUL! Reach-in foul on Cole Simmons during the drive. [Team fouls: 4] No free throws, side out. (Cole Simmons: 1 personal fouls)

[00:36] Team_097 possession (Score: 55-50)
Gary Carter attempts a Midrange. Contested by Damian Towns (4.7 feet, ZONE). GARY CARTER MAKES IT!
Score: 55-52

[00:25] Team_083 possession (Score: 55-52)
Victor McCollum drives to the basket... Victor McCollum throws a bad pass! Stolen by Joel Simons! TURNOVER! (live ball)

[00:07] Team_097 possession (Score: 55-52)
Joel Simons drives, Victor McCollum stays with him. Joel Simons attempts a Layup. Contested by Victor McCollum (4.2 feet, ZONE). JOEL SIMONS MAKES IT!
Score: 55-54

================================================================================
                              2ND QUARTER COMPLETE                              
================================================================================

2ND QUARTER SCORE: Team_083 28, Team_097 25

BOX SCORE:
================================================================================

Team_083
--------------------------------------------------------------------------------
Player                MIN  PTS  REB  AST  TO      FG   FG%      3P   3P%
--------------------------------------------------------------------------------
Malcolm Brogdon        16    8    0    0   0   3/3   100.0     0/0   0.0
Karl Jokic             16    5    0    1   0   2/3    66.7     0/0   0.0
Damian Towns            8    3    5    0   0   1/2    50.0     0/0   0.0
Zion Markkanen          8    3    0    0   0   2/2   100.0     0/0   0.0
Domantas Doncic         8    3    0    0   0   1/2    50.0     0/0   0.0
Kyrie Griffin          16    2    3    0   0   1/1   100.0     0/0   0.0
Victor McCollum         8    2    2    1   0   1/3    33.3     0/0   0.0
Bradley Thompson       16    0    1    1   0   0/0     0.0     0/0   0.0
Cole Simmons            8    0    3    0   0   0/2     0.0     0/0   0.0

TEAM: FG: 11/18 (61.1%), 3PT: 6/9 (66.7%), REB: 14 (4 off, 10 def), AST: 3, TO: 3
TEAM FOULS: 4


Team_097
--------------------------------------------------------------------------------
Player                MIN  PTS  REB  AST  TO      FG   FG%      3P   3P%
--------------------------------------------------------------------------------
Evan Brogdon           16    6    0    2   0   2/2   100.0     0/0   0.0
Gary Carter             8    6    0    1   0   3/4    75.0     0/0   0.0
Miles Dosunmu           8    5    4    0   0   2/5    40.0     0/0   0.0
Tyrese Stewart         16    2    1    0   0   1/2    50.0     0/0   0.0
Shai Poole             16    2    1    0   0   1/2    50.0     0/0   0.0
Joel Simons             8    2    2    1   0   1/2    50.0     0/0   0.0
Miles Banchero          8    2    2    0   0   1/1   100.0     0/0   0.0
Anthony Haliburton     16    0    0    0   0   0/1     0.0     0/0   0.0
Dwyane Ginobili         8    0    0    1   0   0/2     0.0     0/0   0.0

TEAM: FG: 11/21 (52.4%), 3PT: 3/6 (50.0%), REB: 10 (3 off, 7 def), AST: 5, TO: 0
TEAM FOULS: 6 [Team_083 in BONUS]

================================================================================

================================================================================
                       3RD QUARTER - Team_083 vs Team_097                       
================================================================================

[12:00] Team_083 possession (Score: 55-54)
Bradley Thompson attempts a Layup. BLOCKED BY ANTHONY HALIBURTON! Ball is loose! Rebound secured by Shai Poole.

[11:44] Team_097 possession (Score: 55-54)
Jrue Haliburton attempts a Layup. BLOCKED BY KYRIE GRIFFIN! Ball is loose! Rebound secured by Yao Oladipo.

[11:28] Team_083 possession (Score: 55-54)
Karl Jokic attempts a 3Pt. Contested by Jrue Haliburton (5.7 feet, MAN). Karl Jokic misses. Rebound secured by Anthony Haliburton.

[11:14] Team_097 possession (Score: 55-54)
Shai Poole attempts a 3Pt. Contested by Yao Oladipo (3.9 feet, ZONE). SHAI POOLE MAKES IT!
Score: 55-57

[10:58] Team_083 possession (Score: 55-57)
Bradley Thompson makes the Layup and draws the foul on Anthony Haliburton! And-1! Bradley Thompson to the line for 1. [Team fouls: 1] (Anthony Haliburton: 1 personal fouls)   FT 1/1: MISS Bradley Thompson makes 0/1 from the line. Rebound secured by Tyrese Stewart.
Score: 57-57

[10:45] Team_097 possession (Score: 57-57)
Anthony Haliburton makes the Layup and draws the foul on Kyrie Griffin! And-1! Anthony Haliburton to the line for 1. [Team fouls: 1] (Kyrie Griffin: 1 personal fouls)   FT 1/1: MISS Anthony Haliburton makes 0/1 from the line. Rebound secured by Yao Oladipo.
Score: 57-59

[10:34] Team_083 possession (Score: 57-59)
Yao Oladipo makes the Dunk and draws the foul on Shai Poole! And-1! Yao Oladipo to the line for 1. [Team fouls: 2] (Shai Poole: 1 personal fouls)   FT 1/1: GOOD Yao Oladipo makes 1/1 from the line.
Score: 60-59

[10:25] Team_097 possession (Score: 60-59)
Tyrese Stewart makes the Layup and draws the foul on Bradley Thompson! And-1! Tyrese Stewart to the line for 1. [Team fouls: 2] (Bradley Thompson: 1 personal fouls)   FT 1/1: GOOD Tyrese Stewart makes 1/1 from the line.
Score: 60-62

[10:06] Team_083 possession (Score: 60-62)
Yao Oladipo drives and kicks out. Kyrie Griffin attempts a 3Pt. Contested by Anthony Haliburton (3.3 feet, MAN). Kyrie Griffin misses. Rebound secured by Shai Poole.

[09:52] Team_097 possession (Score: 60-62)
Evan Brogdon drives to the basket... Evan Brogdon commits a violation (traveling/carry)! TURNOVER! (dead ball)

[09:40] Team_083 possession (Score: 60-62)
FOUL! Holding foul on Shai Poole. [Team fouls: 3] No free throws, side out. (Shai Poole: 2 personal fouls)

[09:24] Team_083 possession (Score: 60-62)
FOUL! Shooting foul on Shai Poole. Kyrie Griffin to the line for 2 free throws. [Team fouls: 4] (Shai Poole: 3 personal fouls)   FT 1/2: GOOD   FT 2/2: GOOD Kyrie Griffin makes 2/2 from the line.
Score: 62-62

[09:07] Team_097 possession (Score: 62-62)
Tyrese Stewart attempts a 3Pt. Contested by Bradley Thompson (4.5 feet, MAN). TYRESE STEWART MAKES IT!
Score: 62-65

[08:51] Team_083 possession (Score: 62-65)
Karl Jokic drives and kicks out. Bradley Thompson attempts a 3Pt. Contested by Shai Poole (3.4 feet, ZONE). Bradley Thompson misses. Rebound secured by Anthony Haliburton.

[08:37] Team_097 possession (Score: 62-65)
Shai Poole attempts a 3Pt. BLOCKED BY YAO OLADIPO! Ball is loose! Offensive rebound by Tyrese Stewart! Tyrese Stewart kicks it out.

[08:21] Team_097 possession (Score: 62-65)
Anthony Haliburton drives and kicks out. Tyrese Stewart attempts a 3Pt. Contested by Bradley Thompson (3.7 feet, MAN). Tyrese Stewart misses. Rebound secured by Kyrie Griffin.

[08:08] Team_083 possession (Score: 62-65)
Bradley Thompson makes the Dunk and draws the foul on Anthony Haliburton! And-1! Bradley Thompson to the line for 1. [BONUS: 5 team fouls] (Anthony Haliburton: 2 personal fouls)   FT 1/1: GOOD Bradley Thompson makes 1/1 from the line.
Score: 65-65

[07:56] Team_097 possession (Score: 65-65)
Evan Brogdon attempts a 3Pt. Contested by Malcolm Brogdon (5.5 feet, MAN). Evan Brogdon misses. Rebound secured by Bradley Thompson.

[07:41] Team_083 possession (Score: 65-65)
Malcolm Brogdon attempts a Midrange. Contested by Shai Poole (3.0 feet, ZONE). Malcolm Brogdon misses. Rebound secured by Anthony Haliburton.

[07:27] Team_097 possession (Score: 65-65)
FOUL! Reach-in foul on Yao Oladipo during the drive. [Team fouls: 4] No free throws, side out. (Yao Oladipo: 1 personal fouls)

[07:13] Team_097 possession (Score: 65-65)
Jrue Haliburton attempts a 3Pt. Contested by Malcolm Brogdon (5.3 feet, ZONE). Jrue Haliburton misses. Rebound secured by Kyrie Griffin.

[06:59] Team_083 possession (Score: 65-65)
Yao Oladipo drives to the basket... Yao Oladipo loses the ball! Stripped by Anthony Haliburton! TURNOVER! (live ball)

[06:42] Team_097 possession (Score: 65-65)
Anthony Haliburton drives to the basket... Anthony Haliburton throws a bad pass! Stolen by Kyrie Griffin! TURNOVER! (live ball)

[06:30] Team_083 possession (Score: 65-65)
FOUL! Reach-in foul on Shai Poole during the drive. [IN THE BONUS! 6 team fouls] Yao Oladipo to the line for 2 free throws. (Shai Poole: 4 personal fouls)   FT 1/2: GOOD   FT 2/2: GOOD Yao Oladipo makes 2/2 from the line.
Score: 67-65

[06:19] Team_097 possession (Score: 67-65)
Anthony Haliburton attempts a 3Pt. Contested by Kyrie Griffin (3.8 feet, MAN). Anthony Haliburton misses. Rebound secured by Bradley Thompson.

[06:04] Team_083 possession (Score: 67-65)
Bradley Thompson loses the ball! Stripped by Anthony Haliburton! TURNOVER! (live ball)

[05:48] Team_097 possession (Score: 67-65)
FOUL! Shooting foul on Karl Jokic. Tyrese Stewart to the line for 2 free throws. [BONUS: 5 team fouls] (Karl Jokic: 1 personal fouls)   FT 1/2: GOOD   FT 2/2: GOOD Tyrese Stewart makes 2/2 from the line.
Score: 67-67

[05:36] Team_083 possession (Score: 67-67)
FOUL! Shooting foul on Tyrese Stewart. Malcolm Brogdon to the line for 2 free throws. [BONUS: 7 team fouls] (Tyrese Stewart: 1 personal fouls)   FT 1/2: GOOD   FT 2/2: GOOD Malcolm Brogdon makes 2/2 from the line.
Score: 69-67

[05:23] Team_097 possession (Score: 69-67)
Shai Poole attempts a Midrange. Contested by Yao Oladipo (3.9 feet, MAN). Shai Poole misses. FOUL! Loose ball foul on Kyrie Griffin during the rebound battle. [IN THE BONUS! 6 team fouls] Anthony Haliburton to the line for 2 free throws. (Kyrie Griffin: 2 personal fouls)   FT 1/2: GOOD   FT 2/2: GOOD Anthony Haliburton makes 2/2 from the line.
Score: 69-69

[05:05] Team_083 possession (Score: 69-69)
Yao Oladipo attempts a 3Pt. Contested by Shai Poole (3.7 feet, MAN). YAO OLADIPO MAKES IT! Assist: Karl Jokic
Score: 72-69

[04:47] Team_097 possession (Score: 72-69)
Shai Poole drives, Yao Oladipo stays with him. Shai Poole attempts a Dunk. Contested by Yao Oladipo (4.0 feet, MAN). SHAI POOLE MAKES IT! Assist: Anthony Haliburton
Score: 72-71

[04:29] Team_083 possession (Score: 72-71)
FOUL! Offensive foul on Yao Oladipo! Shai Poole drew the charge! [Team fouls: 7] (Yao Oladipo: 2 personal fouls) TURNOVER! (dead ball)

[04:12] Team_097 possession (Score: 72-71)
Jrue Haliburton attempts a 3Pt. Contested by Karl Jokic (5.1 feet, MAN). Jrue Haliburton misses. FOUL! Loose ball foul on Yao Oladipo during the rebound battle. [IN THE BONUS! 8 team fouls] Anthony Haliburton to the line for 2 free throws. (Yao Oladipo: 3 personal fouls)   FT 1/2: GOOD   FT 2/2: GOOD Anthony Haliburton makes 2/2 from the line.
Score: 72-73

[03:57] Team_083 possession (Score: 72-73)
FOUL! Shooting foul on Anthony Haliburton. Malcolm Brogdon to the line for 2 free throws. [BONUS: 8 team fouls] (Anthony Haliburton: 3 personal fouls)   FT 1/2: MISS   FT 2/2: GOOD Malcolm Brogdon makes 1/2 from the line.
Score: 73-73

[03:42] Team_097 possession (Score: 73-73)
Jrue Haliburton attempts a Midrange. Contested by Kyrie Griffin (4.0 feet, ZONE). Jrue Haliburton misses. Rebound secured by Kyrie Griffin.

[03:29] Team_083 possession (Score: 73-73)
FOUL! Holding foul on Shai Poole. [IN THE BONUS! 9 team fouls] Yao Oladipo to the line for 2 free throws. (Shai Poole: 5 personal fouls)   FT 1/2: MISS   FT 2/2: GOOD Yao Oladipo makes 1/2 from the line.
Score: 74-73

[03:14] Team_097 possession (Score: 74-73)
Evan Brogdon drives to the basket... Evan Brogdon throws a bad pass out of bounds! TURNOVER! (dead ball)

[02:58] Team_083 possession (Score: 74-73)
Malcolm Brogdon attempts a 3Pt. Contested by Shai Poole (3.2 feet, ZONE). MALCOLM BROGDON MAKES IT! Assist: Yao Oladipo
Score: 77-73

[02:40] Team_097 possession (Score: 77-73)
FOUL! Holding foul on Karl Jokic. [IN THE BONUS! 9 team fouls] Jrue Haliburton to the line for 2 free throws. (Karl Jokic: 2 personal fouls)   FT 1/2: GOOD   FT 2/2: MISS Jrue Haliburton makes 1/2 from the line. Rebound secured by Bradley Thompson.
Score: 77-74

[02:29] Team_083 possession (Score: 77-74)
Yao Oladipo attempts a 3Pt. Contested by Evan Brogdon (5.2 feet, ZONE). YAO OLADIPO MAKES IT! Assist: Kyrie Griffin
Score: 80-74

[02:18] Team_097 possession (Score: 80-74)
Tyrese Stewart drives to the basket... FOUL! Offensive foul on Tyrese Stewart! Kyrie Griffin drew the charge! [Team fouls: 10] (Tyrese Stewart: 2 personal fouls) TURNOVER! (dead ball)

[01:59] Team_083 possession (Score: 80-74)
Yao Oladipo attempts a 3Pt. Contested by Shai Poole (4.0 feet, ZONE). Yao Oladipo misses. Rebound secured by Anthony Haliburton.

[01:43] Team_097 possession (Score: 80-74)
Anthony Haliburton drives to the basket... FOUL! Offensive foul on Anthony Haliburton! Kyrie Griffin drew the charge! [Team fouls: 11] (Anthony Haliburton: 4 personal fouls) TURNOVER! (dead ball)

[01:31] Team_083 possession (Score: 80-74)
Yao Oladipo attempts a Layup. Contested by Shai Poole (4.0 feet, MAN). YAO OLADIPO MAKES IT!
Score: 82-74

[01:22] Team_097 possession (Score: 82-74)
Anthony Haliburton attempts a Midrange. Contested by Karl Jokic (5.3 feet, ZONE). ANTHONY HALIBURTON MAKES IT! Assist: Evan Brogdon
Score: 82-76

[01:07] Team_083 possession (Score: 82-76)
Bradley Thompson drives and kicks out. Kyrie Griffin attempts a Midrange. Contested by Anthony Haliburton (3.8 feet, MAN). Kyrie Griffin misses. Offensive rebound by Kyrie Griffin! Kyrie Griffin kicks it out.

[00:56] Team_083 possession (Score: 82-76)
Kyrie Griffin attempts a Midrange. Contested by Jrue Haliburton (5.8 feet, ZONE). Kyrie Griffin misses. Rebound secured by Anthony Haliburton.

[00:39] Team_097 possession (Score: 82-76)
Anthony Haliburton attempts a Midrange. Contested by Kyrie Griffin (4.3 feet, MAN). ANTHONY HALIBURTON MAKES IT! Assist: Tyrese Stewart
Score: 82-78

[00:24] Team_083 possession (Score: 82-78)
Malcolm Brogdon makes the Layup and draws the foul on Anthony Haliburton! And-1! Malcolm Brogdon to the line for 1. [BONUS: 12 team fouls] (Anthony Haliburton: 5 personal fouls)   FT 1/1: GOOD Malcolm Brogdon makes 1/1 from the line.
Score: 85-78

[00:11] Team_097 possession (Score: 85-78)
Anthony Haliburton attempts a Layup. Contested by Kyrie Griffin (4.4 feet, ZONE). Anthony Haliburton misses. Offensive rebound by Tyrese Stewart! Tyrese Stewart kicks it out.

================================================================================
                              3RD QUARTER COMPLETE                              
================================================================================

3RD QUARTER SCORE: Team_083 30, Team_097 24

BOX SCORE:
================================================================================

Team_083
--------------------------------------------------------------------------------
Player                MIN  PTS  REB  AST  TO      FG   FG%      3P   3P%
--------------------------------------------------------------------------------
Yao Oladipo            28   14    2    1   0   6/8    75.0     0/0   0.0
Malcolm Brogdon        28    9    0    0   0   4/5    80.0     0/0   0.0
Bradley Thompson       28    3    3    0   0   1/3    33.3     0/0   0.0
Kyrie Griffin          28    2    4    1   0   1/2    50.0     0/0   0.0
Karl Jokic             28    0    0    1   0   0/2     0.0     0/0   0.0

TEAM: FG: 12/20 (60.0%), 3PT: 3/5 (60.0%), REB: 9 (1 off, 8 def), AST: 3, TO: 3
TEAM FOULS: 9 [Team_097 in BONUS]


Team_097
--------------------------------------------------------------------------------
Player                MIN  PTS  REB  AST  TO      FG   FG%      3P   3P%
--------------------------------------------------------------------------------
Anthony Haliburton     28    8    5    1   0   4/7    57.1     0/0   0.0
Tyrese Stewart         28    8    3    1   0   3/3   100.0     0/0   0.0
Shai Poole             28    5    2    0   0   2/2   100.0     0/0   0.0
Jrue Haliburton        28    0    0    0   0   0/3     0.0     0/0   0.0
Evan Brogdon           28    0    0    1   0   0/1     0.0     0/0   0.0

TEAM: FG: 9/17 (52.9%), 3PT: 3/6 (50.0%), REB: 10 (2 off, 8 def), AST: 3, TO: 5
TEAM FOULS: 12 [Team_083 in BONUS]

================================================================================

================================================================================
                       4TH QUARTER - Team_083 vs Team_097                       
================================================================================

[12:00] Team_083 possession (Score: 85-78)
Kyrie Griffin attempts a 3Pt. Contested by Shai Poole (4.0 feet, ZONE). Kyrie Griffin misses. Offensive rebound by Kyrie Griffin! Kyrie Griffin kicks it out.

[11:47] Team_083 possession (Score: 85-78)
FOUL! Offensive foul on Kyrie Griffin! Anthony Haliburton drew the charge! [Team fouls: 1] (Kyrie Griffin: 1 personal fouls) TURNOVER! (dead ball)

[11:33] Team_097 possession (Score: 85-78)
Evan Brogdon attempts a Layup. Contested by Kyrie Griffin (4.5 feet, ZONE). EVAN BROGDON MAKES IT! Assist: Jrue Haliburton
Score: 85-80

[11:20] Team_083 possession (Score: 85-80)
Yao Oladipo attempts a Layup. Contested by Shai Poole (4.1 feet, MAN). YAO OLADIPO MAKES IT!
Score: 87-80

[11:03] Team_097 possession (Score: 87-80)
Shai Poole attempts a Layup. Contested by Yao Oladipo (4.3 feet, MAN). Shai Poole misses. Rebound secured by Kyrie Griffin.

[10:44] Team_083 possession (Score: 87-80)
Kyrie Griffin drives to the basket... Kyrie Griffin loses the ball! Stripped by Anthony Haliburton! TURNOVER! (live ball)

[10:28] Team_097 possession (Score: 87-80)
Anthony Haliburton makes the Midrange and draws the foul on Kyrie Griffin! And-1! Anthony Haliburton to the line for 1. [Team fouls: 2] (Kyrie Griffin: 2 personal fouls)   FT 1/1: GOOD Anthony Haliburton makes 1/1 from the line.
Score: 87-83

[10:11] Team_083 possession (Score: 87-83)
Malcolm Brogdon drives to the basket... Malcolm Brogdon throws a bad pass out of bounds! TURNOVER! (dead ball)

[10:11] Substitution (Team_083): Malcolm Brogdon OUT → Zion Markkanen IN (stamina_rule2)

[10:11] Substitution (Team_083): Karl Jokic OUT → Damian Towns IN (stamina_rule2)

[10:11] Substitution (Team_083): Yao Oladipo OUT → Domantas Doncic IN (stamina_rule2)

[10:11] Substitution (Team_083): Kyrie Griffin OUT → Cole Simmons IN (stamina_rule2)

[10:11] Substitution (Team_083): Bradley Thompson OUT → Victor McCollum IN (stamina_rule2)

[10:11] Substitution (Team_097): Evan Brogdon OUT → Gary Carter IN (stamina_rule2)

[10:11] Substitution (Team_097): Jrue Haliburton OUT → Dwyane Ginobili IN (stamina_rule2)

[10:11] Substitution (Team_097): Shai Poole OUT → Miles Dosunmu IN (stamina_rule2)

[10:11] Substitution (Team_097): Anthony Haliburton OUT → Joel Simons IN (stamina_rule2)

[10:11] Substitution (Team_097): Tyrese Stewart OUT → Miles Banchero IN (stamina_rule2)

[10:01] Team_097 possession (Score: 87-83)
Dwyane Ginobili attempts a 3Pt. Contested by Damian Towns (4.8 feet, MAN). Dwyane Ginobili misses. Rebound secured by Victor McCollum.

[09:46] Team_083 possession (Score: 87-83)
Damian Towns attempts a Layup. Contested by Joel Simons (4.1 feet, ZONE). DAMIAN TOWNS MAKES IT!
Score: 89-83

[09:33] Team_097 possession (Score: 89-83)
Miles Dosunmu attempts a Midrange. Contested by Cole Simmons (5.3 feet, ZONE). Miles Dosunmu misses. Rebound secured by Victor McCollum.

[09:19] Team_083 possession (Score: 89-83)
Zion Markkanen attempts a 3Pt. Contested by Gary Carter (4.9 feet, MAN). ZION MARKKANEN MAKES IT! Assist: Victor McCollum
Score: 92-83

[09:09] Team_097 possession (Score: 92-83)
Dwyane Ginobili attempts a 3Pt. Contested by Damian Towns (4.8 feet, MAN). Dwyane Ginobili misses. Offensive rebound by Joel Simons! Joel Simons kicks it out.

[08:57] Team_097 possession (Score: 92-83)
FOUL! Holding foul on Zion Markkanen. [Team fouls: 3] No free throws, side out. (Zion Markkanen: 1 personal fouls)

[08:41] Team_097 possession (Score: 92-83)
Miles Dosunmu attempts a 3Pt. Contested by Zion Markkanen (5.9 feet, ZONE). Miles Dosunmu misses. Rebound secured by Cole Simmons.

[08:26] Team_083 possession (Score: 92-83)
Domantas Doncic throws a bad pass! Stolen by Miles Dosunmu! TURNOVER! (live ball)

[08:09] Team_097 possession (Score: 92-83)
Dwyane Ginobili attempts a 3Pt. Contested by Zion Markkanen (5.3 feet, ZONE). Dwyane Ginobili misses. Rebound secured by Victor McCollum.

[07:50] Team_083 possession (Score: 92-83)
Victor McCollum attempts a 3Pt. Contested by Joel Simons (4.2 feet, ZONE). VICTOR MCCOLLUM MAKES IT! Assist: Cole Simmons
Score: 95-83

[07:35] Team_097 possession (Score: 95-83)
Miles Dosunmu attempts a Midrange. Contested by Damian Towns (5.4 feet, ZONE). Miles Dosunmu misses. Rebound secured by Damian Towns.

[07:20] Team_083 possession (Score: 95-83)
FOUL! Reach-in foul on Miles Banchero during the drive. [Team fouls: 1] No free throws, side out. (Miles Banchero: 1 personal fouls)

[07:10] Team_083 possession (Score: 95-83)
Damian Towns attempts a 3Pt. Contested by Joel Simons (4.1 feet, ZONE). Damian Towns misses. Rebound secured by Miles Banchero.

[06:54] Team_097 possession (Score: 95-83)
Miles Banchero drives to the basket... Miles Banchero loses the ball! Stripped by Victor McCollum! TURNOVER! (live ball)

[06:41] Team_083 possession (Score: 95-83)
Domantas Doncic attempts a 3Pt. Contested by Joel Simons (3.7 feet, ZONE). Domantas Doncic misses. Rebound secured by Miles Banchero.

[06:25] Team_097 possession (Score: 95-83)
Miles Banchero drives, picks up Victor McCollum. Help arrives from Damian Towns! Miles Banchero attempts a Layup. Contested by Damian Towns (4.1 feet, MAN). MILES BANCHERO MAKES IT!
Score: 95-85

[06:08] Team_083 possession (Score: 95-85)
Domantas Doncic makes the 3Pt and draws the foul on Miles Dosunmu! And-1! Domantas Doncic to the line for 1. [Team fouls: 2] (Miles Dosunmu: 1 personal fouls)   FT 1/1: GOOD Domantas Doncic makes 1/1 from the line.
Score: 99-85

[05:57] Team_097 possession (Score: 99-85)
Joel Simons attempts a 3Pt. Contested by Cole Simmons (5.0 feet, ZONE). JOEL SIMONS MAKES IT! Assist: Miles Dosunmu
Score: 99-88

[05:39] Team_083 possession (Score: 99-88)
Zion Markkanen attempts a 3Pt. BLOCKED BY GARY CARTER! Ball is loose! Rebound secured by Joel Simons.

[05:25] Team_097 possession (Score: 99-88)
Gary Carter makes the Layup and draws the foul on Damian Towns! And-1! Gary Carter to the line for 1. [Team fouls: 4] (Damian Towns: 1 personal fouls)   FT 1/1: GOOD Gary Carter makes 1/1 from the line.
Score: 99-91

[05:09] Team_083 possession (Score: 99-91)
Cole Simmons drives, picks up Joel Simons. Help arrives from Dwyane Ginobili! Cole Simmons attempts a Layup. Contested by Dwyane Ginobili (3.5 feet, MAN). COLE SIMMONS MAKES IT! Assist: Victor McCollum
Score: 101-91

[04:53] Team_097 possession (Score: 101-91)
FOUL! Shooting foul on Victor McCollum. Gary Carter to the line for 2 free throws. [BONUS: 5 team fouls] (Victor McCollum: 1 personal fouls)   FT 1/2: GOOD   FT 2/2: GOOD Gary Carter makes 2/2 from the line.
Score: 101-93

[04:39] Team_083 possession (Score: 101-93)
Victor McCollum attempts a 3Pt. Contested by Joel Simons (4.2 feet, ZONE). Victor McCollum misses. Rebound secured by Joel Simons.

[04:23] Team_097 possession (Score: 101-93)
Miles Banchero makes the Layup and draws the foul on Cole Simmons! And-1! Miles Banchero to the line for 1. [BONUS: 6 team fouls] (Cole Simmons: 1 personal fouls)   FT 1/1: MISS Miles Banchero makes 0/1 from the line. Rebound secured by Damian Towns.
Score: 101-95

[04:05] Team_083 possession (Score: 101-95)
Domantas Doncic attempts a 3Pt. Contested by Joel Simons (3.7 feet, ZONE). Domantas Doncic misses. Rebound secured by Miles Dosunmu.

[03:48] Team_097 possession (Score: 101-95)
Joel Simons attempts a Layup. Contested by Cole Simmons (5.0 feet, ZONE). JOEL SIMONS MAKES IT! Assist: Miles Dosunmu
Score: 101-97

[03:32] Team_083 possession (Score: 101-97)
Damian Towns makes the Dunk and draws the foul on Joel Simons! And-1! Damian Towns to the line for 1. [Team fouls: 3] (Joel Simons: 1 personal fouls)   FT 1/1: MISS Damian Towns makes 0/1 from the line. Rebound secured by Miles Dosunmu.
Score: 103-97

[03:17] Team_097 possession (Score: 103-97)
Miles Dosunmu attempts a Midrange. Contested by Domantas Doncic (5.0 feet, MAN). Miles Dosunmu misses. Rebound secured by Damian Towns.

[02:59] Team_083 possession (Score: 103-97)
Cole Simmons attempts a Layup. BLOCKED BY JOEL SIMONS! Ball is loose! Rebound secured by Miles Banchero.

[02:48] Team_097 possession (Score: 103-97)
Miles Dosunmu attempts a 3Pt. Contested by Domantas Doncic (5.0 feet, MAN). Miles Dosunmu misses. FOUL! Loose ball foul on Damian Towns during the rebound battle. [IN THE BONUS! 7 team fouls] Joel Simons to the line for 2 free throws. (Damian Towns: 2 personal fouls)   FT 1/2: GOOD   FT 2/2: GOOD Joel Simons makes 2/2 from the line.
Score: 103-99

[02:30] Team_083 possession (Score: 103-99)
Damian Towns drives, picks up Dwyane Ginobili. Help arrives from Miles Dosunmu! Damian Towns attempts a Layup. Contested by Miles Dosunmu (5.1 feet, MAN). Damian Towns misses. Rebound secured by Joel Simons.

[02:18] Team_097 possession (Score: 103-99)
Gary Carter drives and kicks out. Miles Dosunmu attempts a 3Pt. Contested by Zion Markkanen (5.4 feet, ZONE). MILES DOSUNMU MAKES IT! Assist: Gary Carter
Score: 103-102

[02:04] Team_083 possession (Score: 103-102)
Cole Simmons attempts a Midrange. Contested by Joel Simons (3.6 feet, MAN). Cole Simmons misses. Rebound secured by Miles Banchero.

[01:48] Team_097 possession (Score: 103-102)
Joel Simons attempts a 3Pt. Contested by Cole Simmons (5.0 feet, MAN). Joel Simons misses. Offensive rebound by Miles Dosunmu! Miles Dosunmu kicks it out.

[01:31] Team_097 possession (Score: 103-102)
FOUL! Shooting foul on Damian Towns. Dwyane Ginobili to the line for 3 free throws. [BONUS: 8 team fouls] (Damian Towns: 3 personal fouls)   FT 1/3: GOOD   FT 2/3: MISS   FT 3/3: MISS Dwyane Ginobili makes 1/3 from the line. Rebound secured by Cole Simmons.
Score: 103-103

[01:18] Team_083 possession (Score: 103-103)
Victor McCollum attempts a Layup. Contested by Joel Simons (4.3 feet, MAN). VICTOR MCCOLLUM MAKES IT!
Score: 105-103

[01:06] Team_097 possession (Score: 105-103)
Joel Simons attempts a 3Pt. Contested by Cole Simmons (5.1 feet, MAN). Joel Simons misses. Rebound secured by Cole Simmons.

[00:49] Team_083 possession (Score: 105-103)
Zion Markkanen attempts a Midrange. Contested by Joel Simons (4.0 feet, ZONE). ZION MARKKANEN MAKES IT!
Score: 107-103

[00:38] Team_097 possession (Score: 107-103)
FOUL! Reach-in foul on Victor McCollum during the drive. [IN THE BONUS! 9 team fouls] Miles Banchero to the line for 2 free throws. (Victor McCollum: 2 personal fouls)   FT 1/2: GOOD   FT 2/2: GOOD Miles Banchero makes 2/2 from the line.
Score: 107-105

[00:24] Team_083 possession (Score: 107-105)
Damian Towns attempts a Midrange. Contested by Dwyane Ginobili (5.3 feet, MAN). Damian Towns misses. Rebound secured by Joel Simons.

[00:14] Team_097 possession (Score: 107-105)
Joel Simons loses the ball! Stripped by Cole Simmons! TURNOVER! (live ball)

[00:01] Team_083 possession (Score: 107-105)
Domantas Doncic drives and kicks out. Cole Simmons attempts a 3Pt. Contested by Joel Simons (3.9 feet, MAN). Cole Simmons misses. Rebound secured by Miles Dosunmu.

================================================================================
                              4TH QUARTER COMPLETE                              
================================================================================

4TH QUARTER SCORE: Team_083 22, Team_097 27

BOX SCORE:
================================================================================

Team_083
--------------------------------------------------------------------------------
Player                MIN  PTS  REB  AST  TO      FG   FG%      3P   3P%
--------------------------------------------------------------------------------
Victor McCollum        18    5    3    2   0   2/3    66.7     0/0   0.0
Zion Markkanen         18    5    0    0   0   2/3    66.7     0/0   0.0
Domantas Doncic        18    4    0    0   0   1/4    25.0     0/0   0.0
Yao Oladipo            30    2    0    0   0   1/1   100.0     0/0   0.0
Damian Towns           18    2    3    0   0   1/5    20.0     0/0   0.0
Cole Simmons           18    2    3    1   0   1/3    33.3     0/0   0.0
Kyrie Griffin          30    0    2    0   0   0/0     0.0     0/0   0.0

TEAM: FG: 8/19 (42.1%), 3PT: 3/8 (37.5%), REB: 11 (1 off, 10 def), AST: 3, TO: 4
TEAM FOULS: 9 [Team_097 in BONUS]


Team_097
--------------------------------------------------------------------------------
Player                MIN  PTS  REB  AST  TO      FG   FG%      3P   3P%
--------------------------------------------------------------------------------
Joel Simons            18    7    5    0   0   3/4    75.0     0/0   0.0
Gary Carter            18    5    0    1   0   2/2   100.0     0/0   0.0
Miles Banchero         18    4    4    0   0   2/3    66.7     0/0   0.0
Anthony Haliburton     30    3    0    0   0   1/1   100.0     0/0   0.0
Miles Dosunmu          18    3    4    2   0   1/5    20.0     0/0   0.0
Evan Brogdon           30    2    0    0   0   1/1   100.0     0/0   0.0
Jrue Haliburton        30    0    0    1   0   0/0     0.0     0/0   0.0
Shai Poole             30    0    0    0   0   0/1     0.0     0/0   0.0
Dwyane Ginobili        18    0    0    0   0   0/3     0.0     0/0   0.0

TEAM: FG: 10/20 (50.0%), 3PT: 2/7 (28.6%), REB: 13 (2 off, 11 def), AST: 4, TO: 2
TEAM FOULS: 3

================================================================================

================================================================================
                               FULL GAME COMPLETE                               
================================================================================

FINAL SCORE: Team_083 107, Team_097 105

SCORING BY QUARTER:
--------------------------------------------------------------------------------
Team                     Q1     Q2     Q3     Q4    FINAL
--------------------------------------------------------------------------------
Team_083                 27     28     30     22      107
Team_097                 29     25     24     27      105
--------------------------------------------------------------------------------

FULL GAME BOX SCORE:
================================================================================

Team_083
--------------------------------------------------------------------------------
Player                MIN  PTS  REB  AST  TO      FG   FG%      3P   3P%      FT STL BLK
--------------------------------------------------------------------------------
Malcolm Brogdon        30   23    0    0   3  11/15   73.3   6/7    85.7   8/9     0   0
Karl Jokic             30    5    0    2   0   2/7    28.6   1/4    25.0   2/2     0   0
Yao Oladipo            30   19    4    1   2   7/10   70.0   2/3    66.7   5/6     0   1
Kyrie Griffin          30   14   14    1   1   7/10   70.0   0/1     0.0   6/6     1   1
Bradley Thompson       30    9    8    1   2   1/6    16.7   0/1     0.0   1/3     0   0
Zion Markkanen         18    8    0    0   0   4/5    80.0   2/3    66.7   1/2     0   0
Damian Towns           18    5    8    0   0   2/7    28.6   1/3    33.3   0/1     0   0
Domantas Doncic        18    7    0    0   1   2/6    33.3   2/4    50.0   1/1     0   0
Cole Simmons           18    2    6    1   1   1/5    20.0   0/1     0.0   0/0     1   0
Victor McCollum        18    7    5    3   1   2/5    40.0   1/2    50.0   1/2     1   1

TEAM: FG: 41/78 (52.6%), 3PT: 15/29 (51.7%), REB: 45 (11 off, 34 def), AST: 9, TO: 11


Team_097
--------------------------------------------------------------------------------
Player                MIN  PTS  REB  AST  TO      FG   FG%      3P   3P%      FT STL BLK
--------------------------------------------------------------------------------
Evan Brogdon           30   14    0    3   0   6/8    75.0   1/2    50.0   3/3     0   1
Jrue Haliburton        30    9    0    4   1   5/11   45.5   2/5    40.0   1/2     0   0
Shai Poole             30    7    6    1   1   4/7    57.1   1/2    50.0   0/0     0   0
Anthony Haliburton     30   15    8    4   2   5/10   50.0   0/1     0.0   5/6     3   2
Tyrese Stewart         30   20   12    1   2   9/10   90.0   1/1   100.0   3/3     0   0
Gary Carter            18   11    0    2   0   6/7    85.7   1/1   100.0   4/5     0   1
Dwyane Ginobili        18    0    0    1   1   0/5     0.0   0/4     0.0   1/3     0   0
Miles Dosunmu          18    8    8    2   0   3/10   30.0   2/5    40.0   0/0     1   0
Joel Simons            18    9    7    1   1   3/5    60.0   1/2    50.0   2/2     1   1
Miles Banchero         18    6    6    0   0   3/4    75.0   0/0     0.0   2/3     0   0

TEAM: FG: 44/78 (56.4%), 3PT: 9/23 (39.1%), REB: 47 (10 off, 37 def), AST: 19, TO: 8

================================================================================
