================================================================================
                        FULL GAME - Team_080 vs Team_072                        
================================================================================

================================================================================
                       1ST QUARTER - Team_080 vs Team_072                       
================================================================================

[12:00] Team_080 possession (Score: 0-0)
Jaren Morant attempts a 3Pt. Contested by Tracy Giddey (4.7 feet, MAN). Jaren Morant misses. Rebound secured by Tracy Giddey.

[11:41] Team_072 possession (Score: 0-0)
Tyrese Williamson attempts a 3Pt. Contested by Lauri Dosunmu (4.3 feet, ZONE). Tyrese Williamson misses. Offensive rebound by Tyrese Williamson! Tyrese Williamson kicks it out.

[11:26] Team_072 possession (Score: 0-0)
Tracy Giddey attempts a Midrange. Contested by Khris Turner (5.2 feet, ZONE). Tracy Giddey misses. Rebound secured by Draymond Simons.

[11:08] Team_080 possession (Score: 0-0)
Draymond Simons drives and kicks out. Larry Paul attempts a 3Pt. Contested by Cade Poole (4.2 feet, ZONE). LARRY PAUL MAKES IT! Assist: Draymond Simons
Score: 3-0

[10:52] Team_072 possession (Score: 3-0)
FOUL! Shooting foul on Khris Turner. Cade Poole to the line for 3 free throws. [Team fouls: 1] (Khris Turner: 1 personal fouls)   FT 1/3: GOOD   FT 2/3: GOOD   FT 3/3: GOOD Cade Poole makes 3/3 from the line.
Score: 3-3

[10:38] Team_080 possession (Score: 3-3)
Larry Paul attempts a Layup. BLOCKED BY COLLIN GRIFFIN! Ball is loose! Rebound secured by Wendell Anthony.

[10:22] Team_072 possession (Score: 3-3)
Collin Griffin attempts a 3Pt. Contested by Lauri Dosunmu (4.4 feet, ZONE). Collin Griffin misses. Offensive rebound by Tracy Giddey! Tracy Giddey kicks it out.

[10:06] Team_072 possession (Score: 3-3)
FOUL! Shooting foul on Larry Paul. Cade Poole to the line for 2 free throws. [Team fouls: 2] (Larry Paul: 1 personal fouls)   FT 1/2: GOOD   FT 2/2: GOOD Cade Poole makes 2/2 from the line.
Score: 3-5

[09:56] Team_080 possession (Score: 3-5)
Larry Paul attempts a 3Pt. Contested by Wendell Anthony (4.6 feet, MAN). Larry Paul misses. Rebound secured by Tracy Giddey.

[09:44] Team_072 possession (Score: 3-5)
Wendell Anthony attempts a 3Pt. Contested by Larry Paul (3.7 feet, MAN). Wendell Anthony misses. Rebound secured by Jaren Morant.

[09:34] Team_080 possession (Score: 3-5)
Draymond Simons makes the Layup and draws the foul on Collin Griffin! And-1! Draymond Simons to the line for 1. [Team fouls: 1] (Collin Griffin: 1 personal fouls)   FT 1/1: MISS Draymond Simons makes 0/1 from the line. Rebound secured by Tracy Giddey.
Score: 5-5

[09:25] Team_072 possession (Score: 5-5)
Collin Griffin attempts a 3Pt. Contested by Lauri Dosunmu (4.4 feet, ZONE). Collin Griffin misses. Rebound secured by Larry Paul.

[09:13] Team_080 possession (Score: 5-5)
Larry Paul drives and kicks out. Khris Turner attempts a 3Pt. Contested by Cade Poole (4.2 feet, MAN). Khris Turner misses. Rebound secured by Wendell Anthony.

[08:57] Team_072 possession (Score: 5-5)
FOUL! Reach-in foul on Draymond Simons during the drive. [Team fouls: 3] No free throws, side out. (Draymond Simons: 1 personal fouls)

[08:41] Team_072 possession (Score: 5-5)
Wendell Anthony drives, picks up Larry Paul. Help arrives from Khris Turner! Wendell Anthony attempts a Layup. Contested by Khris Turner (3.7 feet, MAN). WENDELL ANTHONY MAKES IT! Assist: Tyrese Williamson
Score: 5-7

[08:28] Team_080 possession (Score: 5-7)
Draymond Simons attempts a Midrange. Contested by Tyrese Williamson (4.5 feet, MAN). Draymond Simons misses. FOUL! Loose ball foul on Tyrese Williamson during the rebound battle. [Team fouls: 2] No free throws, side out. (Tyrese Williamson: 1 personal fouls)

[08:12] Team_080 possession (Score: 5-7)
Jaren Morant attempts a 3Pt. Contested by Tracy Giddey (4.7 feet, MAN). Jaren Morant misses. Rebound secured by Tracy Giddey.

[07:56] Team_072 possession (Score: 5-7)
Tracy Giddey attempts a Midrange. Contested by Khris Turner (5.2 feet, ZONE). Tracy Giddey misses. Rebound secured by Larry Paul.

[07:43] Team_080 possession (Score: 5-7)
FOUL! Shooting foul on Cade Poole. Lauri Dosunmu to the line for 3 free throws. [Team fouls: 3] (Cade Poole: 1 personal fouls)   FT 1/3: MISS   FT 2/3: MISS   FT 3/3: MISS Lauri Dosunmu makes 0/3 from the line. Rebound secured by Tracy Giddey.

[07:24] Team_072 possession (Score: 5-7)
Tracy Giddey makes the Midrange and draws the foul on Jaren Morant! And-1! Tracy Giddey to the line for 1. [Team fouls: 4] (Jaren Morant: 1 personal fouls)   FT 1/1: MISS Tracy Giddey makes 0/1 from the line. Rebound secured by Jaren Morant.
Score: 5-9

[07:14] Team_080 possession (Score: 5-9)
Draymond Simons attempts a Midrange. Contested by Tracy Giddey (4.5 feet, ZONE). Draymond Simons misses. Rebound secured by Wendell Anthony.

[06:59] Team_072 possession (Score: 5-9)
Tracy Giddey attempts a Layup. Contested by Jaren Morant (4.3 feet, MAN). TRACY GIDDEY MAKES IT! Assist: Wendell Anthony
Score: 5-11

[06:45] Team_080 possession (Score: 5-11)
Jaren Morant attempts a Layup. Contested by Tracy Giddey (4.7 feet, MAN). JAREN MORANT MAKES IT! Assist: Draymond Simons
Score: 7-11

[06:31] Team_072 possession (Score: 7-11)
Tyrese Williamson makes the Layup and draws the foul on Draymond Simons! And-1! Tyrese Williamson to the line for 1. [BONUS: 5 team fouls] (Draymond Simons: 2 personal fouls)   FT 1/1: GOOD Tyrese Williamson makes 1/1 from the line.
Score: 7-14

[06:17] Team_080 possession (Score: 7-14)
Larry Paul attempts a Layup. Contested by Tyrese Williamson (4.7 feet, ZONE). Larry Paul misses. Rebound secured by Tyrese Williamson.

[06:03] Team_072 possession (Score: 7-14)
Tracy Giddey drives to the basket... Tracy Giddey loses control! Ball rolls out of bounds! TURNOVER! (dead ball)

[05:49] Team_080 possession (Score: 7-14)
Lauri Dosunmu attempts a Layup. Contested by Tyrese Williamson (5.2 feet, ZONE). Lauri Dosunmu misses. Rebound secured by Tracy Giddey.

[05:34] Team_072 possession (Score: 7-14)
Collin Griffin attempts a Midrange. BLOCKED BY LAURI DOSUNMU! Ball is loose! Offensive rebound by Tracy Giddey! Tracy Giddey kicks it out.

[05:16] Team_072 possession (Score: 7-14)
Tracy Giddey attempts a Layup. Contested by Jaren Morant (4.3 feet, MAN). TRACY GIDDEY MAKES IT!
Score: 7-16

[04:59] Team_080 possession (Score: 7-16)
Draymond Simons attempts a 3Pt. Contested by Tracy Giddey (4.5 feet, ZONE). Draymond Simons misses. Rebound secured by Tracy Giddey.

[04:45] Team_072 possession (Score: 7-16)
Tracy Giddey drives, Jaren Morant stays with him. Tracy Giddey attempts a Layup. Contested by Jaren Morant (4.4 feet, MAN). TRACY GIDDEY MAKES IT! Assist: Cade Poole
Score: 7-18

[04:33] Team_080 possession (Score: 7-18)
Khris Turner drives and kicks out. Khris Turner attempts a Midrange. Contested by Wendell Anthony (4.3 feet, ZONE). KHRIS TURNER MAKES IT!
Score: 9-18

[04:21] Team_072 possession (Score: 9-18)
Wendell Anthony attempts a 3Pt. Contested by Larry Paul (3.7 feet, MAN). Wendell Anthony misses. Rebound secured by Larry Paul.

[04:07] Team_080 possession (Score: 9-18)
Larry Paul attempts a Midrange. Contested by Wendell Anthony (4.7 feet, MAN). Larry Paul misses. Rebound secured by Tyrese Williamson.

[03:53] Team_072 possession (Score: 9-18)
FOUL! Reach-in foul on Lauri Dosunmu during the drive. [IN THE BONUS! 6 team fouls] Collin Griffin to the line for 2 free throws. (Lauri Dosunmu: 1 personal fouls)   FT 1/2: GOOD   FT 2/2: GOOD Collin Griffin makes 2/2 from the line.
Score: 9-20

[03:42] Team_080 possession (Score: 9-20)
Khris Turner attempts a 3Pt. Contested by Cade Poole (4.6 feet, ZONE). Khris Turner misses. Rebound secured by Tyrese Williamson.

[03:25] Team_072 possession (Score: 9-20)
Tracy Giddey attempts a 3Pt. Contested by Jaren Morant (4.5 feet, MAN). Tracy Giddey misses. Rebound secured by Jaren Morant.

[03:10] Team_080 possession (Score: 9-20)
Jaren Morant attempts a Layup. BLOCKED BY TYRESE WILLIAMSON! Ball is loose! Rebound secured by Tyrese Williamson.

[02:53] Team_072 possession (Score: 9-20)
Tyrese Williamson attempts a Layup. Contested by Draymond Simons (4.4 feet, ZONE). Tyrese Williamson misses. Offensive rebound by Tracy Giddey! Tracy Giddey kicks it out.

[02:37] Team_072 possession (Score: 9-20)
Tyrese Williamson makes the Midrange and draws the foul on Larry Paul! And-1! Tyrese Williamson to the line for 1. [BONUS: 7 team fouls] (Larry Paul: 2 personal fouls)   FT 1/1: GOOD Tyrese Williamson makes 1/1 from the line.
Score: 9-23

[02:21] Team_080 possession (Score: 9-23)
Jaren Morant drives and kicks out. Jaren Morant attempts a Midrange. Contested by Tracy Giddey (4.5 feet, MAN). JAREN MORANT MAKES IT! Assist: Lauri Dosunmu
Score: 11-23

[02:05] Team_072 possession (Score: 11-23)
Wendell Anthony attempts a Layup. BLOCKED BY KHRIS TURNER! Ball is loose! Rebound secured by Jaren Morant.

[01:50] Team_080 possession (Score: 11-23)
FOUL! Shooting foul on Collin Griffin. Draymond Simons to the line for 2 free throws. [Team fouls: 4] (Collin Griffin: 2 personal fouls)   FT 1/2: GOOD   FT 2/2: GOOD Draymond Simons makes 2/2 from the line.
Score: 13-23

[01:37] Team_072 possession (Score: 13-23)
Wendell Anthony attempts a 3Pt. Contested by Lauri Dosunmu (4.6 feet, ZONE). Wendell Anthony misses. Rebound secured by Draymond Simons.

[01:22] Team_080 possession (Score: 13-23)
Draymond Simons attempts a Layup. Contested by Tyrese Williamson (4.8 feet, MAN). DRAYMOND SIMONS MAKES IT!
Score: 15-23

[01:11] Team_072 possession (Score: 15-23)
Wendell Anthony drives to the basket... Wendell Anthony commits a violation (traveling/carry)! TURNOVER! (dead ball)

[01:11] Substitution (Team_080): Lauri Dosunmu OUT → Tony James IN (stamina_rule2)

[01:11] Substitution (Team_080): Khris Turner OUT → Larry Reaves IN (stamina_rule2)

[01:11] Substitution (Team_080): Larry Paul OUT → Joel Bryant IN (stamina_rule2)

[01:11] Substitution (Team_080): Jaren Morant OUT → Ja Cunningham IN (stamina_rule2)

[01:11] Substitution (Team_080): Draymond Simons OUT → Trae Brogdon IN (stamina_rule2)

[01:11] Substitution (Team_072): Collin Griffin OUT → Giannis Gobert IN (stamina_rule2)

[01:11] Substitution (Team_072): Cade Poole OUT → CJ Jokic IN (stamina_rule2)

[01:11] Substitution (Team_072): Wendell Anthony OUT → CJ Bane IN (stamina_rule2)

[01:11] Substitution (Team_072): Tracy Giddey OUT → Brandon Durant IN (stamina_rule2)

[01:11] Substitution (Team_072): Tyrese Williamson OUT → Stephen Holiday IN (stamina_rule2)

[01:01] Team_080 possession (Score: 15-23)
Trae Brogdon drives, Stephen Holiday stays with him. Trae Brogdon attempts a Dunk. Contested by Stephen Holiday (4.9 feet, ZONE). TRAE BROGDON MAKES IT! Assist: Ja Cunningham
Score: 17-23

[00:44] Team_072 possession (Score: 17-23)
Giannis Gobert makes the Midrange and draws the foul on Larry Reaves! And-1! Giannis Gobert to the line for 1. [BONUS: 8 team fouls] (Larry Reaves: 1 personal fouls)   FT 1/1: GOOD Giannis Gobert makes 1/1 from the line.
Score: 17-26

[00:28] Team_080 possession (Score: 17-26)
Trae Brogdon attempts a Layup. BLOCKED BY STEPHEN HOLIDAY! Ball is loose! Rebound secured by Brandon Durant.

[00:15] Team_072 possession (Score: 17-26)
FOUL! Shooting foul on Tony James. CJ Bane to the line for 2 free throws. [BONUS: 9 team fouls] (Tony James: 1 personal fouls)   FT 1/2: GOOD   FT 2/2: GOOD CJ Bane makes 2/2 from the line.
Score: 17-28

[00:03] Team_080 possession (Score: 17-28)
Larry Reaves attempts a 3Pt. Contested by CJ Jokic (5.5 feet, MAN). Larry Reaves misses. Offensive rebound by Ja Cunningham! Ja Cunningham kicks it out.

================================================================================
                              1ST QUARTER COMPLETE                              
================================================================================

1ST QUARTER SCORE: Team_080 17, Team_072 28

BOX SCORE:
================================================================================

Team_080
--------------------------------------------------------------------------------
Player                MIN  PTS  REB  AST  TO      FG   FG%      3P   3P%
--------------------------------------------------------------------------------
Jaren Morant           11    4    4    0   0   2/5    40.0     0/0   0.0
Draymond Simons        11    4    3    2   0   2/5    40.0     0/0   0.0
Larry Paul             11    3    3    0   0   1/6    16.7     0/0   0.0
Khris Turner           11    2    0    0   0   1/2    50.0     0/0   0.0
Trae Brogdon            1    2    0    0   0   1/2    50.0     0/0   0.0
Lauri Dosunmu          11    0    0    1   0   0/2     0.0     0/0   0.0
Ja Cunningham           1    0    1    1   0   0/0     0.0     0/0   0.0

TEAM: FG: 7/22 (31.8%), 3PT: 0/6 (0.0%), REB: 11 (2 off, 9 def), AST: 4, TO: 0
TEAM FOULS: 9 [Team_072 in BONUS]


Team_072
--------------------------------------------------------------------------------
Player                MIN  PTS  REB  AST  TO      FG   FG%      3P   3P%
--------------------------------------------------------------------------------
Tracy Giddey           11    6   10    0   0   3/7    42.9     0/0   0.0
Tyrese Williamson      11    6    5    1   0   2/2   100.0     0/0   0.0
Cade Poole             11    5    0    1   0   2/2   100.0     0/0   0.0
Giannis Gobert          1    3    0    0   0   1/1   100.0     0/0   0.0
Wendell Anthony        11    2    3    1   0   1/5    20.0     0/0   0.0
Collin Griffin         11    2    0    0   0   1/2    50.0     0/0   0.0
CJ Bane                 1    2    0    0   0   1/1   100.0     0/0   0.0
Brandon Durant          1    0    1    0   0   0/0     0.0     0/0   0.0

TEAM: FG: 11/20 (55.0%), 3PT: 1/6 (16.7%), REB: 19 (4 off, 15 def), AST: 3, TO: 2
TEAM FOULS: 4

================================================================================

================================================================================
                       2ND QUARTER - Team_080 vs Team_072                       
================================================================================

[12:00] Team_080 possession (Score: 17-28)
Jaren Morant attempts a 3Pt. Contested by Collin Griffin (4.8 feet, ZONE). Jaren Morant misses. Offensive rebound by Draymond Simons! Draymond Simons puts it back in!
Score: 19-28

[11:48] Team_072 possession (Score: 19-28)
Wendell Anthony attempts a 3Pt. Contested by Larry Paul (3.8 feet, MAN). WENDELL ANTHONY MAKES IT! Assist: Tracy Giddey
Score: 19-31

[11:31] Team_080 possession (Score: 19-31)
Larry Paul attempts a Midrange. Contested by Wendell Anthony (4.8 feet, MAN). LARRY PAUL MAKES IT! Assist: Jaren Morant
Score: 21-31

[11:17] Team_072 possession (Score: 21-31)
Tracy Giddey drives, picks up Jaren Morant. Help arrives from Khris Turner! Tracy Giddey attempts a Dunk. Contested by Khris Turner (4.5 feet, MAN). Tracy Giddey misses. Rebound secured by Draymond Simons.

[11:03] Team_080 possession (Score: 21-31)
Draymond Simons attempts a 3Pt. Contested by Cade Poole (4.6 feet, ZONE). Draymond Simons misses. Rebound secured by Tyrese Williamson.

[10:49] Team_072 possession (Score: 21-31)
Collin Griffin attempts a 3Pt. Contested by Lauri Dosunmu (4.6 feet, MAN). COLLIN GRIFFIN MAKES IT! Assist: Tyrese Williamson
Score: 21-34

[10:37] Team_080 possession (Score: 21-34)
Khris Turner attempts a Midrange. Contested by Cade Poole (4.7 feet, MAN). KHRIS TURNER MAKES IT! Assist: Draymond Simons
Score: 23-34

[10:23] Team_072 possession (Score: 23-34)
Cade Poole attempts a 3Pt. Contested by Khris Turner (5.5 feet, MAN). CADE POOLE MAKES IT! Assist: Collin Griffin
Score: 23-37

[10:11] Team_080 possession (Score: 23-37)
Draymond Simons drives, Tyrese Williamson stays with him. Draymond Simons attempts a Layup. Contested by Tyrese Williamson (4.8 feet, MAN). Draymond Simons misses. Rebound secured by Tyrese Williamson.

[09:52] Team_072 possession (Score: 23-37)
Collin Griffin drives and kicks out. Cade Poole attempts a 3Pt. Contested by Lauri Dosunmu (4.5 feet, ZONE). Cade Poole misses. Rebound secured by Jaren Morant.

[09:39] Team_080 possession (Score: 23-37)
Draymond Simons attempts a Midrange. Contested by Tyrese Williamson (4.8 feet, MAN). Draymond Simons misses. Rebound secured by Tracy Giddey.

[09:20] Team_072 possession (Score: 23-37)
Cade Poole attempts a 3Pt. Contested by Lauri Dosunmu (5.1 feet, ZONE). Cade Poole misses. Rebound secured by Jaren Morant.

[09:08] Team_080 possession (Score: 23-37)
Draymond Simons drives to the basket... FOUL! Offensive foul on Draymond Simons! Tyrese Williamson drew the charge! [Team fouls: 1] (Draymond Simons: 1 personal fouls) TURNOVER! (dead ball)

[08:49] Team_072 possession (Score: 23-37)
Tracy Giddey attempts a 3Pt. Contested by Larry Paul (4.4 feet, ZONE). Tracy Giddey misses. Rebound secured by Larry Paul.

[08:37] Team_080 possession (Score: 23-37)
Draymond Simons drives to the basket... Draymond Simons loses the ball! Stripped by Tyrese Williamson! TURNOVER! (live ball)

[08:23] Team_072 possession (Score: 23-37)
Wendell Anthony makes the 3Pt and draws the foul on Larry Paul! And-1! Wendell Anthony to the line for 1. [Team fouls: 2] (Larry Paul: 1 personal fouls)   FT 1/1: GOOD Wendell Anthony makes 1/1 from the line.
Score: 23-41

[08:06] Team_080 possession (Score: 23-41)
Larry Paul attempts a Midrange. Contested by Tracy Giddey (5.1 feet, ZONE). LARRY PAUL MAKES IT!
Score: 25-41

[07:54] Team_072 possession (Score: 25-41)
FOUL! Shooting foul on Larry Paul. Wendell Anthony to the line for 2 free throws. [Team fouls: 3] (Larry Paul: 2 personal fouls)   FT 1/2: GOOD   FT 2/2: GOOD Wendell Anthony makes 2/2 from the line.
Score: 25-43

[07:39] Team_080 possession (Score: 25-43)
Lauri Dosunmu attempts a 3Pt. Contested by Collin Griffin (5.6 feet, MAN). LAURI DOSUNMU MAKES IT! Assist: Draymond Simons
Score: 28-43

[07:22] Team_072 possession (Score: 28-43)
Cade Poole attempts a 3Pt. Contested by Khris Turner (5.7 feet, MAN). Cade Poole misses. Rebound secured by Larry Paul.

[07:06] Team_080 possession (Score: 28-43)
Draymond Simons attempts a Layup. Contested by Tyrese Williamson (5.1 feet, MAN). DRAYMOND SIMONS MAKES IT! Assist: Jaren Morant
Score: 30-43

[06:54] Team_072 possession (Score: 30-43)
Collin Griffin attempts a 3Pt. Contested by Lauri Dosunmu (5.1 feet, ZONE). COLLIN GRIFFIN MAKES IT! Assist: Wendell Anthony
Score: 30-46

[06:40] Team_080 possession (Score: 30-46)
Larry Paul attempts a Midrange. Contested by Wendell Anthony (5.3 feet, ZONE). LARRY PAUL MAKES IT!
Score: 32-46

[06:31] Team_072 possession (Score: 32-46)
Tyrese Williamson attempts a Midrange. Contested by Draymond Simons (5.1 feet, MAN). Tyrese Williamson misses. Rebound secured by Draymond Simons.

[06:19] Team_080 possession (Score: 32-46)
Jaren Morant makes the Dunk and draws the foul on Collin Griffin! And-1! Jaren Morant to the line for 1. [Team fouls: 1] (Collin Griffin: 1 personal fouls)   FT 1/1: GOOD Jaren Morant makes 1/1 from the line.
Score: 35-46

[06:02] Team_072 possession (Score: 35-46)
Tyrese Williamson attempts a Layup. Contested by Draymond Simons (5.1 feet, MAN). Tyrese Williamson misses. Offensive rebound by Tyrese Williamson! Tyrese Williamson kicks it out.

[05:46] Team_072 possession (Score: 35-46)
FOUL! Reach-in foul on Draymond Simons during the drive. [Team fouls: 4] No free throws, side out. (Draymond Simons: 2 personal fouls)

[05:27] Team_072 possession (Score: 35-46)
Cade Poole attempts a 3Pt. Contested by Khris Turner (6.0 feet, MAN). Cade Poole misses. Rebound secured by Larry Paul.

[05:12] Team_080 possession (Score: 35-46)
Khris Turner attempts a 3Pt. Contested by Cade Poole (5.3 feet, ZONE). KHRIS TURNER MAKES IT! Assist: Lauri Dosunmu
Score: 38-46

[04:58] Team_072 possession (Score: 38-46)
Wendell Anthony makes the Layup and draws the foul on Larry Paul! And-1! Wendell Anthony to the line for 1. [BONUS: 5 team fouls] (Larry Paul: 3 personal fouls)   FT 1/1: MISS Wendell Anthony makes 0/1 from the line. Rebound secured by Larry Paul.
Score: 38-48

[04:45] Team_080 possession (Score: 38-48)
Khris Turner attempts a Midrange. Contested by Cade Poole (5.4 feet, MAN). Khris Turner misses. Offensive rebound by Draymond Simons! Draymond Simons kicks it out.

[04:30] Team_080 possession (Score: 38-48)
Jaren Morant attempts a 3Pt. Contested by Tracy Giddey (5.4 feet, MAN). Jaren Morant misses. Rebound secured by Wendell Anthony.

[04:16] Team_072 possession (Score: 38-48)
Tracy Giddey attempts a 3Pt. Contested by Jaren Morant (5.5 feet, MAN). TRACY GIDDEY MAKES IT! Assist: Tyrese Williamson
Score: 38-51

[03:58] Team_080 possession (Score: 38-51)
Larry Paul attempts a Midrange. Contested by Wendell Anthony (5.7 feet, MAN). Larry Paul misses. Offensive rebound by Draymond Simons! Draymond Simons kicks it out.

[03:45] Team_080 possession (Score: 38-51)
FOUL! Shooting foul on Tracy Giddey. Lauri Dosunmu to the line for 2 free throws. [Team fouls: 2] (Tracy Giddey: 1 personal fouls)   FT 1/2: GOOD   FT 2/2: MISS Lauri Dosunmu makes 1/2 from the line. Rebound secured by Wendell Anthony.
Score: 39-51

[03:30] Team_072 possession (Score: 39-51)
Cade Poole attempts a 3Pt. Contested by Lauri Dosunmu (5.8 feet, ZONE). CADE POOLE MAKES IT!
Score: 39-54

[03:18] Team_080 possession (Score: 39-54)
Khris Turner attempts a 3Pt. Contested by Cade Poole (5.6 feet, MAN). KHRIS TURNER MAKES IT! Assist: Lauri Dosunmu
Score: 42-54

[03:02] Team_072 possession (Score: 42-54)
Wendell Anthony attempts a 3Pt. Contested by Lauri Dosunmu (5.5 feet, ZONE). Wendell Anthony misses. Offensive rebound by Tyrese Williamson! Tyrese Williamson kicks it out.

[02:49] Team_072 possession (Score: 42-54)
Tracy Giddey drives and kicks out. Cade Poole attempts a 3Pt. Contested by Lauri Dosunmu (5.6 feet, ZONE). Cade Poole misses. Rebound secured by Draymond Simons.

[02:37] Team_080 possession (Score: 42-54)
Draymond Simons attempts a Midrange. Contested by Tyrese Williamson (5.6 feet, MAN). DRAYMOND SIMONS MAKES IT! Assist: Larry Paul
Score: 44-54

[02:20] Team_072 possession (Score: 44-54)
Cade Poole attempts a 3Pt. Contested by Lauri Dosunmu (6.0 feet, ZONE). Cade Poole misses. Rebound secured by Larry Paul.

[02:03] Team_080 possession (Score: 44-54)
Khris Turner attempts a Layup. BLOCKED BY TRACY GIDDEY! Ball is loose! Rebound secured by Tyrese Williamson.

[01:49] Team_072 possession (Score: 44-54)
Tyrese Williamson drives, Draymond Simons stays with him. Tyrese Williamson attempts a Layup. Contested by Draymond Simons (5.8 feet, MAN). TYRESE WILLIAMSON MAKES IT! Assist: Tracy Giddey
Score: 44-56

[01:35] Team_080 possession (Score: 44-56)
Draymond Simons attempts a Midrange. Contested by Wendell Anthony (5.9 feet, ZONE). Draymond Simons misses. Rebound secured by Collin Griffin.

[01:22] Team_072 possession (Score: 44-56)
Tracy Giddey throws a bad pass out of bounds! TURNOVER! (dead ball)

[01:22] Substitution (Team_080): Lauri Dosunmu OUT → Tony James IN (stamina_rule2)

[01:22] Substitution (Team_080): Khris Turner OUT → Larry Reaves IN (stamina_rule2)

[01:22] Substitution (Team_080): Larry Paul OUT → Joel Bryant IN (stamina_rule2)

[01:22] Substitution (Team_080): Jaren Morant OUT → Ja Cunningham IN (stamina_rule2)

[01:22] Substitution (Team_080): Draymond Simons OUT → Trae Brogdon IN (stamina_rule2)

[01:22] Substitution (Team_072): Collin Griffin OUT → Giannis Gobert IN (stamina_rule2)

[01:22] Substitution (Team_072): Cade Poole OUT → CJ Jokic IN (stamina_rule2)

[01:22] Substitution (Team_072): Wendell Anthony OUT → CJ Bane IN (stamina_rule2)

[01:22] Substitution (Team_072): Tracy Giddey OUT → Brandon Durant IN (stamina_rule2)

[01:22] Substitution (Team_072): Tyrese Williamson OUT → Stephen Holiday IN (stamina_rule2)

[01:11] Team_080 possession (Score: 44-56)
Trae Brogdon attempts a 3Pt. Contested by CJ Bane (4.3 feet, ZONE). TRAE BROGDON MAKES IT! Assist: Tony James
Score: 47-56

[00:58] Team_072 possession (Score: 47-56)
Giannis Gobert drives, Ja Cunningham stays with him. Giannis Gobert attempts a Dunk. Contested by Ja Cunningham (5.1 feet, ZONE). GIANNIS GOBERT MAKES IT! Assist: Brandon Durant
Score: 47-58

[00:44] Team_080 possession (Score: 47-58)
Joel Bryant attempts a 3Pt. Contested by Giannis Gobert (5.2 feet, ZONE). Joel Bryant misses. Rebound secured by CJ Jokic.

[00:31] Team_072 possession (Score: 47-58)
Brandon Durant attempts a Midrange. Contested by Ja Cunningham (4.6 feet, MAN). BRANDON DURANT MAKES IT!
Score: 47-60

[00:17] Team_080 possession (Score: 47-60)
FOUL! Holding foul on CJ Jokic. [Team fouls: 3] No free throws, side out. (CJ Jokic: 1 personal fouls)

[00:04] Team_080 possession (Score: 47-60)
Ja Cunningham attempts a 3Pt. Contested by CJ Jokic (5.3 feet, ZONE). Ja Cunningham misses. Rebound secured by Brandon Durant.

================================================================================
                              2ND QUARTER COMPLETE                              
================================================================================

2ND QUARTER SCORE: Team_080 30, Team_072 32

BOX SCORE:
================================================================================

Team_080
--------------------------------------------------------------------------------
Player                MIN  PTS  REB  AST  TO      FG   FG%      3P   3P%
--------------------------------------------------------------------------------
Khris Turner           22    8    0    0   0   3/4    75.0     0/0   0.0
Draymond Simons        22    6    6    2   0   3/7    42.9     0/0   0.0
Larry Paul             22    6    5    1   0   3/3   100.0     0/0   0.0
Jaren Morant           22    3    2    2   0   1/2    50.0     0/0   0.0
Lauri Dosunmu          22    3    0    2   0   1/2    50.0     0/0   0.0
Trae Brogdon            3    3    0    0   0   1/1   100.0     0/0   0.0
Tony James              3    0    0    1   0   0/0     0.0     0/0   0.0
Joel Bryant             3    0    0    0   0   0/1     0.0     0/0   0.0
Ja Cunningham           3    0    0    0   0   0/1     0.0     0/0   0.0

TEAM: FG: 12/21 (57.1%), 3PT: 5/9 (55.6%), REB: 13 (3 off, 10 def), AST: 8, TO: 2
TEAM FOULS: 5 [Team_072 in BONUS]


Team_072
--------------------------------------------------------------------------------
Player                MIN  PTS  REB  AST  TO      FG   FG%      3P   3P%
--------------------------------------------------------------------------------
Wendell Anthony        22    9    2    1   0   3/4    75.0     0/0   0.0
Collin Griffin         22    6    1    1   0   2/3    66.7     0/0   0.0
Cade Poole             22    6    0    0   0   2/6    33.3     0/0   0.0
Tracy Giddey           22    3    1    2   0   1/4    25.0     0/0   0.0
Tyrese Williamson      22    2    5    2   0   1/2    50.0     0/0   0.0
Giannis Gobert          3    2    0    0   0   1/1   100.0     0/0   0.0
Brandon Durant          3    2    1    1   0   1/1   100.0     0/0   0.0
CJ Jokic                3    0    1    0   0   0/0     0.0     0/0   0.0

TEAM: FG: 11/21 (52.4%), 3PT: 7/12 (58.3%), REB: 11 (2 off, 9 def), AST: 7, TO: 1
TEAM FOULS: 3

================================================================================

================================================================================
                       3RD QUARTER - Team_080 vs Team_072                       
================================================================================

[12:00] Team_080 possession (Score: 47-60)
Larry Paul drives and kicks out. Jaren Morant attempts a Midrange. Contested by Tracy Giddey (4.3 feet, MAN). Jaren Morant misses. Rebound secured by Tracy Giddey.

[11:46] Team_072 possession (Score: 47-60)
Wendell Anthony attempts a 3Pt. Contested by Larry Paul (3.7 feet, MAN). Wendell Anthony misses. Rebound secured by Jaren Morant.

[11:28] Team_080 possession (Score: 47-60)
Jaren Morant attempts a Midrange. Contested by Tracy Giddey (4.7 feet, MAN). Jaren Morant misses. Rebound secured by Wendell Anthony.

[11:13] Team_072 possession (Score: 47-60)
Collin Griffin attempts a 3Pt. Contested by Lauri Dosunmu (4.4 feet, ZONE). Collin Griffin misses. FOUL! Loose ball foul on Larry Paul during the rebound battle. [Team fouls: 1] No free throws, side out. (Larry Paul: 1 personal fouls)

[10:58] Team_072 possession (Score: 47-60)
Wendell Anthony drives to the basket... FOUL! Offensive foul on Wendell Anthony! Larry Paul drew the charge! [Team fouls: 1] (Wendell Anthony: 1 personal fouls) TURNOVER! (dead ball)

[10:41] Team_080 possession (Score: 47-60)
Jaren Morant drives and kicks out. Larry Paul attempts a Midrange. Contested by Wendell Anthony (4.2 feet, MAN). Larry Paul misses. Rebound secured by Tracy Giddey.

[10:25] Team_072 possession (Score: 47-60)
Collin Griffin drives and kicks out. Cade Poole attempts a 3Pt. Contested by Lauri Dosunmu (4.0 feet, ZONE). Cade Poole misses. Rebound secured by Draymond Simons.

[10:11] Team_080 possession (Score: 47-60)
Lauri Dosunmu throws a bad pass! Stolen by Collin Griffin! TURNOVER! (live ball)

[09:53] Team_072 possession (Score: 47-60)
FOUL! Shooting foul on Draymond Simons. Tyrese Williamson to the line for 2 free throws. [Team fouls: 2] (Draymond Simons: 1 personal fouls)   FT 1/2: GOOD   FT 2/2: GOOD Tyrese Williamson makes 2/2 from the line.
Score: 47-62

[09:38] Team_080 possession (Score: 47-62)
Jaren Morant makes the Layup and draws the foul on Tracy Giddey! And-1! Jaren Morant to the line for 1. [Team fouls: 2] (Tracy Giddey: 1 personal fouls)   FT 1/1: GOOD Jaren Morant makes 1/1 from the line.
Score: 50-62

[09:28] Team_072 possession (Score: 50-62)
Cade Poole attempts a 3Pt. Contested by Khris Turner (5.3 feet, MAN). Cade Poole misses. Rebound secured by Larry Paul.

[09:11] Team_080 possession (Score: 50-62)
Jaren Morant drives, picks up Tracy Giddey. Help arrives from Collin Griffin! Jaren Morant attempts a Dunk. Contested by Collin Griffin (4.7 feet, MAN). JAREN MORANT MAKES IT! Assist: Lauri Dosunmu
Score: 52-62

[08:56] Team_072 possession (Score: 52-62)
Wendell Anthony drives to the basket... FOUL! Offensive foul on Wendell Anthony! Larry Paul drew the charge! [Team fouls: 3] (Wendell Anthony: 2 personal fouls) TURNOVER! (dead ball)

[08:46] Team_080 possession (Score: 52-62)
Larry Paul drives, picks up Tyrese Williamson. Help arrives from Collin Griffin! Larry Paul attempts a Dunk. Contested by Collin Griffin (4.7 feet, ZONE). Larry Paul misses. Rebound secured by Tyrese Williamson.

[08:35] Team_072 possession (Score: 52-62)
FOUL! Shooting foul on Draymond Simons. Collin Griffin to the line for 2 free throws. [Team fouls: 3] (Draymond Simons: 2 personal fouls)   FT 1/2: GOOD   FT 2/2: MISS Collin Griffin makes 1/2 from the line. Rebound secured by Jaren Morant.
Score: 52-63

[08:22] Team_080 possession (Score: 52-63)
Larry Paul drives and kicks out. Draymond Simons attempts a 3Pt. Contested by Cade Poole (4.2 feet, ZONE). Draymond Simons misses. Rebound secured by Wendell Anthony.

[08:06] Team_072 possession (Score: 52-63)
Tracy Giddey attempts a 3Pt. Contested by Jaren Morant (4.3 feet, MAN). Tracy Giddey misses. Rebound secured by Draymond Simons.

[07:52] Team_080 possession (Score: 52-63)
Draymond Simons attempts a 3Pt. Contested by Tyrese Williamson (4.5 feet, MAN). Draymond Simons misses. Rebound secured by Tracy Giddey.

[07:41] Team_072 possession (Score: 52-63)
Tracy Giddey drives and kicks out. Wendell Anthony attempts a Midrange. Contested by Larry Paul (3.5 feet, ZONE). Wendell Anthony misses. Rebound secured by Draymond Simons.

[07:25] Team_080 possession (Score: 52-63)
Jaren Morant drives to the basket... Jaren Morant loses the ball! Stripped by Tyrese Williamson! TURNOVER! (live ball)

[07:12] Team_072 possession (Score: 52-63)
Tyrese Williamson throws a bad pass out of bounds! TURNOVER! (dead ball)

[06:59] Team_080 possession (Score: 52-63)
Larry Paul drives and kicks out. Lauri Dosunmu attempts a 3Pt. Contested by Collin Griffin (4.4 feet, MAN). Lauri Dosunmu misses. Offensive rebound by Draymond Simons! Draymond Simons puts it back in!
Score: 54-63

[06:43] Team_072 possession (Score: 54-63)
Tyrese Williamson makes the Layup and draws the foul on Draymond Simons! And-1! Tyrese Williamson to the line for 1. [Team fouls: 4] (Draymond Simons: 3 personal fouls)   FT 1/1: GOOD Tyrese Williamson makes 1/1 from the line.
Score: 54-66

[06:27] Team_080 possession (Score: 54-66)
Jaren Morant drives and kicks out. Draymond Simons attempts a Midrange. Contested by Tyrese Williamson (4.3 feet, MAN). DRAYMOND SIMONS MAKES IT!
Score: 56-66

[06:12] Team_072 possession (Score: 56-66)
FOUL! Holding foul on Larry Paul. [IN THE BONUS! 5 team fouls] Wendell Anthony to the line for 2 free throws. (Larry Paul: 2 personal fouls)   FT 1/2: GOOD   FT 2/2: GOOD Wendell Anthony makes 2/2 from the line.
Score: 56-68

[05:58] Team_080 possession (Score: 56-68)
Larry Paul drives, picks up Wendell Anthony. Help arrives from Collin Griffin! Larry Paul attempts a Layup. Contested by Collin Griffin (4.6 feet, MAN). LARRY PAUL MAKES IT! Assist: Lauri Dosunmu
Score: 58-68

[05:44] Team_072 possession (Score: 58-68)
Collin Griffin drives, Lauri Dosunmu stays with him. Collin Griffin attempts a Dunk. Contested by Lauri Dosunmu (4.4 feet, MAN). Collin Griffin misses. Rebound secured by Jaren Morant.

[05:31] Team_080 possession (Score: 58-68)
Khris Turner attempts a 3Pt. Contested by Cade Poole (4.4 feet, MAN). Khris Turner misses. Rebound secured by Tracy Giddey.

[05:18] Team_072 possession (Score: 58-68)
Tyrese Williamson drives to the basket... Tyrese Williamson throws a bad pass! Stolen by Draymond Simons! TURNOVER! (live ball)

[05:03] Team_080 possession (Score: 58-68)
Khris Turner drives and kicks out. Khris Turner attempts a 3Pt. Contested by Cade Poole (4.2 feet, ZONE). Khris Turner misses. Rebound secured by Wendell Anthony.

[04:48] Team_072 possession (Score: 58-68)
Tracy Giddey attempts a 3Pt. Contested by Jaren Morant (4.4 feet, MAN). Tracy Giddey misses. Rebound secured by Jaren Morant.

[04:34] Team_080 possession (Score: 58-68)
Larry Paul attempts a 3Pt. Contested by Cade Poole (4.6 feet, ZONE). Larry Paul misses. Rebound secured by Wendell Anthony.

[04:21] Team_072 possession (Score: 58-68)
Cade Poole drives, picks up Khris Turner. Help arrives from Larry Paul! Cade Poole attempts a Layup. Contested by Larry Paul (5.3 feet, MAN). Cade Poole misses. Offensive rebound by Tyrese Williamson! Tyrese Williamson kicks it out.

[04:12] Team_072 possession (Score: 58-68)
Collin Griffin drives and kicks out. Tyrese Williamson attempts a 3Pt. Contested by Lauri Dosunmu (4.2 feet, ZONE). Tyrese Williamson misses. Offensive rebound by Tracy Giddey! Tracy Giddey kicks it out.

[03:59] Team_072 possession (Score: 58-68)
Collin Griffin drives and kicks out. Cade Poole attempts a Midrange. Contested by Jaren Morant (3.9 feet, ZONE). Cade Poole misses. FOUL! Loose ball foul on Draymond Simons during the rebound battle. [IN THE BONUS! 6 team fouls] Tyrese Williamson to the line for 2 free throws. (Draymond Simons: 4 personal fouls)   FT 1/2: MISS   FT 2/2: GOOD Tyrese Williamson makes 1/2 from the line.
Score: 58-69

[03:44] Team_080 possession (Score: 58-69)
FOUL! Reach-in foul on Tyrese Williamson during the drive. [Team fouls: 4] No free throws, side out. (Tyrese Williamson: 1 personal fouls)

[03:28] Team_080 possession (Score: 58-69)
Draymond Simons drives, Tyrese Williamson stays with him. Draymond Simons attempts a Layup. Contested by Tyrese Williamson (4.7 feet, ZONE). DRAYMOND SIMONS MAKES IT! Assist: Khris Turner
Score: 60-69

[03:12] Team_072 possession (Score: 60-69)
Tyrese Williamson makes the Midrange and draws the foul on Jaren Morant! And-1! Tyrese Williamson to the line for 1. [BONUS: 7 team fouls] (Jaren Morant: 1 personal fouls)   FT 1/1: GOOD Tyrese Williamson makes 1/1 from the line.
Score: 60-72

[03:01] Team_080 possession (Score: 60-72)
FOUL! Offensive foul on Draymond Simons! Tyrese Williamson drew the charge! [Team fouls: 8] (Draymond Simons: 5 personal fouls) TURNOVER! (dead ball)

[02:46] Team_072 possession (Score: 60-72)
Collin Griffin attempts a 3Pt. Contested by Lauri Dosunmu (4.6 feet, MAN). COLLIN GRIFFIN MAKES IT! Assist: Tracy Giddey
Score: 60-75

[02:35] Team_080 possession (Score: 60-75)
FOUL! Shooting foul on Cade Poole. Draymond Simons to the line for 3 free throws. [BONUS: 5 team fouls] (Cade Poole: 1 personal fouls)   FT 1/3: GOOD   FT 2/3: MISS   FT 3/3: MISS Draymond Simons makes 1/3 from the line. Rebound secured by Tyrese Williamson.
Score: 61-75

[02:22] Team_072 possession (Score: 61-75)
Tracy Giddey attempts a 3Pt. Contested by Lauri Dosunmu (4.9 feet, ZONE). TRACY GIDDEY MAKES IT! Assist: Cade Poole
Score: 61-78

[02:08] Team_080 possession (Score: 61-78)
Khris Turner drives, Tracy Giddey stays with him. Khris Turner attempts a Dunk. Contested by Tracy Giddey (4.7 feet, ZONE). Khris Turner misses. Rebound secured by Tyrese Williamson.

[01:53] Team_072 possession (Score: 61-78)
Tyrese Williamson attempts a Midrange. Contested by Draymond Simons (4.6 feet, MAN). Tyrese Williamson misses. Offensive rebound by Tyrese Williamson! Tyrese Williamson kicks it out.

[01:38] Team_072 possession (Score: 61-78)
Collin Griffin attempts a 3Pt. Contested by Lauri Dosunmu (4.8 feet, MAN). Collin Griffin misses. Offensive rebound by Tyrese Williamson! Tyrese Williamson kicks it out.

[01:25] Team_072 possession (Score: 61-78)
Tracy Giddey drives and kicks out. Cade Poole attempts a 3Pt. Contested by Lauri Dosunmu (4.5 feet, ZONE). Cade Poole misses. Rebound secured by Jaren Morant.

[01:15] Team_080 possession (Score: 61-78)
FOUL! Shooting foul on Cade Poole. Khris Turner to the line for 3 free throws. [BONUS: 6 team fouls] (Cade Poole: 2 personal fouls)   FT 1/3: GOOD   FT 2/3: GOOD   FT 3/3: GOOD Khris Turner makes 3/3 from the line.
Score: 64-78

[01:04] Team_072 possession (Score: 64-78)
Tyrese Williamson makes the Layup and draws the foul on Draymond Simons! And-1! Tyrese Williamson to the line for 1. [BONUS: 9 team fouls] (Draymond Simons: 6 personal fouls) Draymond Simons FOULS OUT!   FT 1/1: MISS Tyrese Williamson makes 0/1 from the line. Rebound secured by Draymond Simons.
Score: 64-80

[01:04] Substitution (Team_080): Draymond Simons OUT (stamina: 63) → Tony James IN (foul_out)

[00:47] Team_080 possession (Score: 64-80)
Larry Paul makes the Dunk and draws the foul on Collin Griffin! And-1! Larry Paul to the line for 1. [BONUS: 7 team fouls] (Collin Griffin: 1 personal fouls)   FT 1/1: GOOD Larry Paul makes 1/1 from the line.
Score: 67-80

[00:36] Team_072 possession (Score: 67-80)
Tracy Giddey attempts a Layup. BLOCKED BY JAREN MORANT! Ball is loose! Rebound secured by Larry Paul.

[00:23] Team_080 possession (Score: 67-80)
Larry Paul attempts a 3Pt. Contested by Wendell Anthony (5.1 feet, MAN). Larry Paul misses. Rebound secured by Tyrese Williamson.

[00:08] Team_072 possession (Score: 67-80)
Wendell Anthony attempts a Midrange. Contested by Larry Paul (4.1 feet, ZONE). WENDELL ANTHONY MAKES IT! Assist: Collin Griffin
Score: 67-82

================================================================================
                              3RD QUARTER COMPLETE                              
================================================================================

3RD QUARTER SCORE: Team_080 20, Team_072 22

BOX SCORE:
================================================================================

Team_080
--------------------------------------------------------------------------------
Player                MIN  PTS  REB  AST  TO      FG   FG%      3P   3P%
--------------------------------------------------------------------------------
Draymond Simons        33    6    5    0   0   3/5    60.0     0/0   0.0
Larry Paul             34    5    2    0   0   2/7    28.6     0/0   0.0
Jaren Morant           34    5    5    0   0   2/4    50.0     0/0   0.0
Khris Turner           34    3    0    1   0   1/4    25.0     0/0   0.0
Lauri Dosunmu          34    0    0    2   0   0/0     0.0     0/0   0.0

TEAM: FG: 8/20 (40.0%), 3PT: 1/6 (16.7%), REB: 12 (1 off, 11 def), AST: 3, TO: 3
TEAM FOULS: 9 [Team_072 in BONUS]


Team_072
--------------------------------------------------------------------------------
Player                MIN  PTS  REB  AST  TO      FG   FG%      3P   3P%
--------------------------------------------------------------------------------
Tyrese Williamson      34    9    8    0   0   4/5    80.0     0/0   0.0
Wendell Anthony        34    4    4    0   0   2/3    66.7     0/0   0.0
Tracy Giddey           34    3    5    1   0   1/6    16.7     0/0   0.0
Collin Griffin         34    3    0    1   0   1/4    25.0     0/0   0.0
Cade Poole             34    0    0    1   0   0/1     0.0     0/0   0.0

TEAM: FG: 8/19 (42.1%), 3PT: 2/6 (33.3%), REB: 17 (5 off, 12 def), AST: 3, TO: 4
TEAM FOULS: 7 [Team_080 in BONUS]

================================================================================

================================================================================
                       4TH QUARTER - Team_080 vs Team_072                       
================================================================================

[12:00] Substitution (Team_080): Lauri Dosunmu OUT (stamina: 67) → Tony James IN (comeback_detected)

[12:00] Substitution (Team_072): Collin Griffin OUT (stamina: 69) → Giannis Gobert IN (comeback_detected)

[12:00] Team_080 possession (Score: 67-82)
Draymond Simons attempts a Layup. Contested by Tyrese Williamson (4.8 feet, MAN). DRAYMOND SIMONS MAKES IT!
Score: 69-82

[11:49] Team_072 possession (Score: 69-82)
Wendell Anthony drives and kicks out. Tyrese Williamson attempts a 3Pt. Contested by Tony James (4.2 feet, ZONE). Tyrese Williamson misses. Rebound secured by Larry Paul.

[11:38] Team_080 possession (Score: 69-82)
Jaren Morant attempts a Midrange. Contested by Tracy Giddey (4.9 feet, MAN). JAREN MORANT MAKES IT! Assist: Larry Paul
Score: 71-82

[11:25] Team_072 possession (Score: 71-82)
Wendell Anthony throws a bad pass out of bounds! TURNOVER! (dead ball)

[11:25] Substitution (Team_080): Khris Turner OUT → Larry Reaves IN (stamina_rule2)

[11:25] Substitution (Team_080): Larry Paul OUT → Joel Bryant IN (stamina_rule2)

[11:25] Substitution (Team_080): Jaren Morant OUT → Ja Cunningham IN (stamina_rule2)

[11:25] Substitution (Team_080): Draymond Simons OUT → Trae Brogdon IN (stamina_rule2)

[11:25] Substitution (Team_072): Cade Poole OUT → CJ Jokic IN (stamina_rule2)

[11:25] Substitution (Team_072): Wendell Anthony OUT → CJ Bane IN (stamina_rule2)

[11:25] Substitution (Team_072): Tracy Giddey OUT → Brandon Durant IN (stamina_rule2)

[11:25] Substitution (Team_072): Tyrese Williamson OUT → Stephen Holiday IN (stamina_rule2)

[11:14] Team_080 possession (Score: 71-82)
Tony James attempts a 3Pt. Contested by Giannis Gobert (5.1 feet, MAN). TONY JAMES MAKES IT! Assist: Trae Brogdon
Score: 74-82

[10:57] Team_072 possession (Score: 74-82)
CJ Bane attempts a 3Pt. Contested by Joel Bryant (4.2 feet, ZONE). CJ Bane misses. Rebound secured by Ja Cunningham.

[10:39] Team_080 possession (Score: 74-82)
FOUL! Offensive foul on Ja Cunningham! Brandon Durant drew the charge! [Team fouls: 1] (Ja Cunningham: 1 personal fouls) TURNOVER! (dead ball)

[10:25] Team_072 possession (Score: 74-82)
Brandon Durant attempts a 3Pt. Contested by Joel Bryant (4.3 feet, ZONE). Brandon Durant misses. Rebound secured by Trae Brogdon.

[10:13] Team_080 possession (Score: 74-82)
Ja Cunningham attempts a Midrange. Contested by CJ Bane (4.5 feet, ZONE). Ja Cunningham misses. FOUL! Loose ball foul on CJ Jokic during the rebound battle. [Team fouls: 1] No free throws, side out. (CJ Jokic: 1 personal fouls)

[09:58] Team_080 possession (Score: 74-82)
Joel Bryant attempts a 3Pt. Contested by Giannis Gobert (5.2 feet, ZONE). Joel Bryant misses. Rebound secured by Stephen Holiday.

[09:46] Team_072 possession (Score: 74-82)
Brandon Durant throws a bad pass! Stolen by Ja Cunningham! TURNOVER! (live ball)

[09:32] Team_080 possession (Score: 74-82)
Ja Cunningham drives and kicks out. Larry Reaves attempts a 3Pt. Contested by Giannis Gobert (4.9 feet, ZONE). Larry Reaves misses. Rebound secured by Brandon Durant.

[09:18] Team_072 possession (Score: 74-82)
CJ Jokic drives to the basket... CJ Jokic throws a bad pass out of bounds! TURNOVER! (dead ball)

[09:00] Team_080 possession (Score: 74-82)
Larry Reaves drives to the basket... Larry Reaves loses control! Ball rolls out of bounds! TURNOVER! (dead ball)

[08:47] Team_072 possession (Score: 74-82)
Stephen Holiday attempts a Midrange. Contested by Ja Cunningham (5.3 feet, ZONE). Stephen Holiday misses. Rebound secured by Trae Brogdon.

[08:36] Team_080 possession (Score: 74-82)
Joel Bryant attempts a Midrange. Contested by CJ Bane (4.8 feet, MAN). JOEL BRYANT MAKES IT! Assist: Ja Cunningham
Score: 76-82

[08:25] Team_072 possession (Score: 76-82)
CJ Bane attempts a 3Pt. Contested by Joel Bryant (4.2 feet, MAN). CJ Bane misses. Rebound secured by Ja Cunningham.

[08:15] Team_080 possession (Score: 76-82)
Larry Reaves attempts a Midrange. Contested by CJ Jokic (5.5 feet, MAN). Larry Reaves misses. Rebound secured by Brandon Durant.

[08:01] Team_072 possession (Score: 76-82)
Brandon Durant attempts a 3Pt. Contested by Ja Cunningham (4.6 feet, MAN). Brandon Durant misses. Rebound secured by Ja Cunningham.

[07:49] Team_080 possession (Score: 76-82)
Trae Brogdon drives to the basket... Trae Brogdon commits a violation (traveling/carry)! TURNOVER! (dead ball)

[07:39] Team_072 possession (Score: 76-82)
CJ Bane makes the Layup and draws the foul on Larry Reaves! And-1! CJ Bane to the line for 1. [Team fouls: 2] (Larry Reaves: 1 personal fouls)   FT 1/1: GOOD CJ Bane makes 1/1 from the line.
Score: 76-85

[07:25] Team_080 possession (Score: 76-85)
FOUL! Reach-in foul on Stephen Holiday during the drive. [Team fouls: 2] No free throws, side out. (Stephen Holiday: 1 personal fouls)

[07:12] Team_080 possession (Score: 76-85)
FOUL! Holding foul on Brandon Durant. [Team fouls: 3] No free throws, side out. (Brandon Durant: 1 personal fouls)

[06:55] Team_080 possession (Score: 76-85)
Joel Bryant drives, Stephen Holiday stays with him. Joel Bryant attempts a Layup. Contested by Stephen Holiday (5.3 feet, ZONE). Joel Bryant misses. Offensive rebound by Larry Reaves! Larry Reaves kicks it out.

[06:42] Team_080 possession (Score: 76-85)
FOUL! Holding foul on Stephen Holiday. [Team fouls: 4] No free throws, side out. (Stephen Holiday: 2 personal fouls)

[06:29] Team_080 possession (Score: 76-85)
Joel Bryant attempts a 3Pt. Contested by CJ Bane (4.8 feet, MAN). Joel Bryant misses. Rebound secured by Stephen Holiday.

[06:15] Team_072 possession (Score: 76-85)
Brandon Durant attempts a Midrange. Contested by Joel Bryant (4.3 feet, ZONE). Brandon Durant misses. Offensive rebound by Stephen Holiday! Stephen Holiday kicks it out.

[05:57] Team_072 possession (Score: 76-85)
CJ Jokic attempts a 3Pt. Contested by Larry Reaves (4.4 feet, MAN). CJ Jokic misses. Offensive rebound by Stephen Holiday! Stephen Holiday kicks it out.

[05:40] Team_072 possession (Score: 76-85)
CJ Bane attempts a Midrange. Contested by Joel Bryant (4.2 feet, MAN). CJ Bane misses. Offensive rebound by Stephen Holiday! Stephen Holiday kicks it out.

[05:26] Team_072 possession (Score: 76-85)
Stephen Holiday attempts a 3Pt. Wide open! Trae Brogdon is 6.0 feet away. [MAN] STEPHEN HOLIDAY MAKES IT! Assist: CJ Jokic
Score: 76-88

[05:10] Team_080 possession (Score: 76-88)
Tony James attempts a Midrange. Contested by CJ Bane (4.7 feet, ZONE). Tony James misses. Rebound secured by Stephen Holiday.

[04:54] Team_072 possession (Score: 76-88)
Giannis Gobert drives, picks up Ja Cunningham. Help arrives from Larry Reaves! Giannis Gobert attempts a Layup. Contested by Larry Reaves (5.1 feet, ZONE). Giannis Gobert misses. Rebound secured by Ja Cunningham.

[04:38] Team_080 possession (Score: 76-88)
Joel Bryant makes the 3Pt and draws the foul on Giannis Gobert! And-1! Joel Bryant to the line for 1. [BONUS: 5 team fouls] (Giannis Gobert: 1 personal fouls)   FT 1/1: GOOD Joel Bryant makes 1/1 from the line.
Score: 80-88

[04:20] Team_072 possession (Score: 80-88)
CJ Bane attempts a 3Pt. Contested by Joel Bryant (4.2 feet, ZONE). CJ BANE MAKES IT! Assist: CJ Jokic
Score: 80-91

[04:04] Team_080 possession (Score: 80-91)
Trae Brogdon drives to the basket... Trae Brogdon loses control! Ball rolls out of bounds! TURNOVER! (dead ball)

[03:54] Team_072 possession (Score: 80-91)
Brandon Durant attempts a Midrange. Contested by Larry Reaves (4.4 feet, ZONE). BRANDON DURANT MAKES IT! Assist: CJ Jokic
Score: 80-93

[03:39] Team_080 possession (Score: 80-93)
Ja Cunningham attempts a Layup. Contested by Brandon Durant (4.0 feet, MAN). Ja Cunningham misses. Rebound secured by Stephen Holiday.

[03:25] Team_072 possession (Score: 80-93)
FOUL! Holding foul on Larry Reaves. [Team fouls: 3] No free throws, side out. (Larry Reaves: 2 personal fouls)

[03:05] Team_072 possession (Score: 80-93)
CJ Bane attempts a 3Pt. Contested by Joel Bryant (4.2 feet, MAN). CJ Bane misses. Offensive rebound by Brandon Durant! Brandon Durant kicks it out.

[02:49] Team_072 possession (Score: 80-93)
Brandon Durant attempts a 3Pt. Contested by Ja Cunningham (4.7 feet, MAN). BRANDON DURANT MAKES IT! Assist: Stephen Holiday
Score: 80-96

[02:35] Team_080 possession (Score: 80-96)
Joel Bryant drives and kicks out. Trae Brogdon attempts a 3Pt. Contested by Giannis Gobert (5.2 feet, ZONE). Trae Brogdon misses. Offensive rebound by Larry Reaves! Larry Reaves kicks it out.

[02:18] Team_080 possession (Score: 80-96)
Trae Brogdon attempts a Layup. Contested by Stephen Holiday (5.1 feet, ZONE). Trae Brogdon misses. Rebound secured by CJ Jokic.

[02:00] Team_072 possession (Score: 80-96)
Stephen Holiday drives, Ja Cunningham stays with him. Stephen Holiday attempts a Layup. Contested by Ja Cunningham (5.5 feet, ZONE). STEPHEN HOLIDAY MAKES IT!
Score: 80-98

[01:47] Team_080 possession (Score: 80-98)
Ja Cunningham attempts a Midrange. Contested by Brandon Durant (4.1 feet, MAN). Ja Cunningham misses. Offensive rebound by Larry Reaves! Larry Reaves kicks it out.

[01:32] Team_080 possession (Score: 80-98)
Trae Brogdon attempts a 3Pt. Contested by Giannis Gobert (5.1 feet, ZONE). Trae Brogdon misses. Rebound secured by CJ Jokic.

[01:22] Team_072 possession (Score: 80-98)
CJ Bane attempts a 3Pt. Contested by Joel Bryant (4.4 feet, ZONE). CJ Bane misses. Offensive rebound by Brandon Durant! Brandon Durant kicks it out.

[01:06] Team_072 possession (Score: 80-98)
CJ Bane attempts a Layup. BLOCKED BY JOEL BRYANT! Ball deflects out of bounds off CJ Bane.

[00:53] Team_080 possession (Score: 80-98)
Ja Cunningham attempts a Midrange. Contested by CJ Bane (4.8 feet, ZONE). Ja Cunningham misses. Rebound secured by Stephen Holiday.

[00:41] Team_072 possession (Score: 80-98)
CJ Bane drives, Joel Bryant stays with him. CJ Bane attempts a Dunk. Contested by Joel Bryant (4.4 feet, MAN). CJ Bane misses. Rebound secured by Larry Reaves.

[00:24] Team_080 possession (Score: 80-98)
Larry Reaves attempts a Layup. Contested by CJ Jokic (5.7 feet, MAN). LARRY REAVES MAKES IT! Assist: Tony James
Score: 82-98

[00:07] Team_072 possession (Score: 82-98)
Stephen Holiday attempts a Midrange. Contested by Ja Cunningham (5.6 feet, ZONE). Stephen Holiday misses. Rebound secured by Joel Bryant.

================================================================================
                              4TH QUARTER COMPLETE                              
================================================================================

4TH QUARTER SCORE: Team_080 15, Team_072 16

BOX SCORE:
================================================================================

Team_080
--------------------------------------------------------------------------------
Player                MIN  PTS  REB  AST  TO      FG   FG%      3P   3P%
--------------------------------------------------------------------------------
Joel Bryant            14    6    1    0   0   2/4    50.0     0/0   0.0
Tony James             16    3    0    1   0   1/2    50.0     0/0   0.0
Draymond Simons        34    2    0    0   0   1/1   100.0     0/0   0.0
Jaren Morant           35    2    0    0   0   1/1   100.0     0/0   0.0
Larry Reaves           14    2    4    0   0   1/2    50.0     0/0   0.0
Larry Paul             35    0    1    1   0   0/0     0.0     0/0   0.0
Trae Brogdon           14    0    2    1   0   0/2     0.0     0/0   0.0
Ja Cunningham          14    0    5    1   0   0/3     0.0     0/0   0.0

TEAM: FG: 6/15 (40.0%), 3PT: 2/5 (40.0%), REB: 13 (4 off, 9 def), AST: 4, TO: 4
TEAM FOULS: 3


Team_072
--------------------------------------------------------------------------------
Player                MIN  PTS  REB  AST  TO      FG   FG%      3P   3P%
--------------------------------------------------------------------------------
CJ Bane                14    6    0    0   0   2/6    33.3     0/0   0.0
Brandon Durant         14    5    4    0   0   2/4    50.0     0/0   0.0
Stephen Holiday        14    5    8    1   0   2/4    50.0     0/0   0.0
Wendell Anthony        35    0    0    0   0   0/1     0.0     0/0   0.0
CJ Jokic               14    0    2    3   0   0/0     0.0     0/0   0.0
Giannis Gobert         15    0    0    0   0   0/1     0.0     0/0   0.0

TEAM: FG: 6/16 (37.5%), 3PT: 3/7 (42.9%), REB: 14 (5 off, 9 def), AST: 4, TO: 3
TEAM FOULS: 5 [Team_080 in BONUS]

================================================================================

================================================================================
                               FULL GAME COMPLETE                               
================================================================================

FINAL SCORE: Team_080 82, Team_072 98

SCORING BY QUARTER:
--------------------------------------------------------------------------------
Team                     Q1     Q2     Q3     Q4    FINAL
--------------------------------------------------------------------------------
Team_080                 17     30     20     15       82
Team_072                 28     32     22     16       98
--------------------------------------------------------------------------------

FULL GAME BOX SCORE:
================================================================================

Team_080
--------------------------------------------------------------------------------
Player                MIN  PTS  REB  AST  TO      FG   FG%      3P   3P%      FT STL BLK
--------------------------------------------------------------------------------
Khris Turner           35   13    0    1   0   5/10   50.0   3/5    60.0   3/3     0   1
Larry Paul             35   14   11    2   0   6/16   37.5   0/3     0.0   1/1     0   0
Jaren Morant           35   14   11    2   0   8/14   57.1   1/4    25.0   2/2     0   1
Lauri Dosunmu          34    3    0    5   2   1/4    25.0   1/2    50.0   1/5     0   1
Draymond Simons        34   18   14    4   3   7/16   43.8   0/4     0.0   3/6     1   0
Tony James             16    3    0    2   1   1/2    50.0   1/1   100.0   0/0     0   0
Larry Reaves           14    2    4    0   1   1/2    50.0   0/0     0.0   0/0     0   0
Joel Bryant            14    6    1    0   0   2/5    40.0   1/4    25.0   1/1     0   1
Ja Cunningham          14    0    6    2   2   0/4     0.0   0/1     0.0   0/0     1   0
Trae Brogdon           14    5    2    1   0   2/5    40.0   1/2    50.0   0/0     0   0

TEAM: FG: 33/78 (42.3%), 3PT: 8/26 (30.8%), REB: 49 (10 off, 39 def), AST: 19, TO: 9


Team_072
--------------------------------------------------------------------------------
Player                MIN  PTS  REB  AST  TO      FG   FG%      3P   3P%      FT STL BLK
--------------------------------------------------------------------------------
Cade Poole             35   11    0    2   2   4/9    44.4   3/8    37.5   5/5     0   0
Wendell Anthony        35   15    9    2   3   5/12   41.7   2/6    33.3   5/6     0   0
Tracy Giddey           35   12   16    3   1   5/17   29.4   2/6    33.3   0/1     0   1
Tyrese Williamson      35   17   18    3   1   6/8    75.0   0/0     0.0   7/9     2   1
Collin Griffin         34   11    1    2   1   5/10   50.0   3/4    75.0   3/4     1   1
Giannis Gobert         15    5    0    0   0   2/3    66.7   0/0     0.0   1/1     0   0
CJ Jokic               14    0    3    3   1   0/0     0.0   0/0     0.0   0/0     0   0
CJ Bane                14    8    0    0   0   3/7    42.9   1/3    33.3   3/3     0   0
Brandon Durant         14    7    6    1   1   3/5    60.0   1/3    33.3   0/0     0   0
Stephen Holiday        14    5    8    1   0   2/4    50.0   1/1   100.0   0/0     0   1

TEAM: FG: 36/76 (47.4%), 3PT: 13/31 (41.9%), REB: 61 (16 off, 45 def), AST: 17, TO: 10

================================================================================
