================================================================================
                        FULL GAME - Team_004 vs Team_049                        
================================================================================

================================================================================
                       1ST QUARTER - Team_004 vs Team_049                       
================================================================================

[12:00] Team_004 possession (Score: 0-0)
Draymond Fox attempts a Midrange. Contested by De'Aaron Allen (4.7 feet, MAN). Draymond Fox misses. Offensive rebound by Anthony Lillard! Anthony Lillard kicks it out.

[11:43] Team_004 possession (Score: 0-0)
FOUL! Shooting foul on Ja Oladipo. Jabari Wade to the line for 2 free throws. [Team fouls: 1] (Ja Oladipo: 1 personal fouls)   FT 1/2: GOOD   FT 2/2: GOOD Jabari Wade makes 2/2 from the line.
Score: 2-0

[11:30] Team_049 possession (Score: 2-0)
FOUL! Reach-in foul on Jabari Wade during the drive. [Team fouls: 1] No free throws, side out. (Jabari Wade: 1 personal fouls)

[11:13] Team_049 possession (Score: 2-0)
Shai Mobley attempts a Layup. Contested by Anthony Lillard (4.4 feet, MAN). Shai Mobley misses. Offensive rebound by Shai Mobley! Shai Mobley puts it back in!
Score: 2-2

[10:58] Team_004 possession (Score: 2-2)
Dwyane Irving attempts a Midrange. Contested by De'Aaron Allen (4.6 feet, ZONE). Dwyane Irving misses. Rebound secured by De'Aaron Allen.

[10:44] Team_049 possession (Score: 2-2)
Shai Mobley attempts a 3Pt. Contested by Jabari Wade (5.0 feet, ZONE). Shai Mobley misses. Rebound secured by Anthony Lillard.

[10:32] Team_004 possession (Score: 2-2)
Anthony Lillard throws a bad pass out of bounds! TURNOVER! (dead ball)

[10:18] Team_049 possession (Score: 2-2)
FOUL! Reach-in foul on Anthony Lillard during the drive. [Team fouls: 2] No free throws, side out. (Anthony Lillard: 1 personal fouls)

[10:08] Team_049 possession (Score: 2-2)
Ja Oladipo drives and kicks out. Jimmy Griffin attempts a 3Pt. Contested by Draymond Fox (4.1 feet, ZONE). Jimmy Griffin misses. Offensive rebound by Jimmy Griffin! Jimmy Griffin kicks it out.

[09:53] Team_049 possession (Score: 2-2)
De'Aaron Allen attempts a 3Pt. Contested by Michael Curry (4.8 feet, ZONE). DE'AARON ALLEN MAKES IT! Assist: Shai Mobley
Score: 2-5

[09:39] Team_004 possession (Score: 2-5)
Michael Curry attempts a 3Pt. Contested by Ja Oladipo (4.4 feet, ZONE). Michael Curry misses. Rebound secured by Shai Mobley.

[09:26] Team_049 possession (Score: 2-5)
Shai Bird attempts a 3Pt. Contested by Michael Curry (5.5 feet, ZONE). Shai Bird misses. Offensive rebound by Shai Mobley! Shai Mobley puts it back in!
Score: 2-7

[09:12] Team_004 possession (Score: 2-7)
Jabari Wade attempts a 3Pt. Contested by Ja Oladipo (5.0 feet, MAN). Jabari Wade misses. Offensive rebound by Anthony Lillard! Anthony Lillard kicks it out.

[09:02] Team_004 possession (Score: 2-7)
Anthony Lillard drives and kicks out. Jabari Wade attempts a 3Pt. Contested by Ja Oladipo (4.2 feet, ZONE). Jabari Wade misses. Rebound secured by De'Aaron Allen.

[08:49] Team_049 possession (Score: 2-7)
FOUL! Reach-in foul on Anthony Lillard during the drive. [Team fouls: 3] No free throws, side out. (Anthony Lillard: 2 personal fouls)

[08:38] Team_049 possession (Score: 2-7)
Jimmy Griffin attempts a Midrange. Contested by Dwyane Irving (3.6 feet, MAN). Jimmy Griffin misses. Offensive rebound by Jimmy Griffin! Jimmy Griffin kicks it out.

[08:23] Team_049 possession (Score: 2-7)
Ja Oladipo attempts a 3Pt. Contested by Jabari Wade (4.9 feet, MAN). Ja Oladipo misses. Rebound secured by Draymond Fox.

[08:10] Team_004 possession (Score: 2-7)
Jabari Wade attempts a 3Pt. Contested by Ja Oladipo (5.0 feet, ZONE). JABARI WADE MAKES IT! Assist: Dwyane Irving
Score: 5-7

[07:52] Team_049 possession (Score: 5-7)
Ja Oladipo attempts a 3Pt. Contested by Jabari Wade (4.9 feet, MAN). Ja Oladipo misses. Rebound secured by Dwyane Irving.

[07:38] Team_004 possession (Score: 5-7)
Jabari Wade drives to the basket... Jabari Wade throws a bad pass out of bounds! TURNOVER! (dead ball)

[07:20] Team_049 possession (Score: 5-7)
Jimmy Griffin attempts a 3Pt. Contested by Dwyane Irving (3.6 feet, MAN). Jimmy Griffin misses. Rebound secured by Anthony Lillard.

[07:10] Team_004 possession (Score: 5-7)
Dwyane Irving attempts a Layup. Contested by De'Aaron Allen (4.6 feet, ZONE). Dwyane Irving misses. Offensive rebound by Draymond Fox! Draymond Fox kicks it out.

[06:59] Team_004 possession (Score: 5-7)
Michael Curry attempts a Midrange. Contested by Jimmy Griffin (4.8 feet, ZONE). Michael Curry misses. Rebound secured by Jimmy Griffin.

[06:42] Team_049 possession (Score: 5-7)
Shai Mobley drives and kicks out. FOUL! Shooting foul on Anthony Lillard. Shai Mobley to the line for 3 free throws. [Team fouls: 4] (Anthony Lillard: 3 personal fouls)   FT 1/3: GOOD   FT 2/3: GOOD   FT 3/3: GOOD Shai Mobley makes 3/3 from the line.
Score: 5-10

[06:26] Team_004 possession (Score: 5-10)
Dwyane Irving attempts a 3Pt. Contested by Jimmy Griffin (5.0 feet, MAN). Dwyane Irving misses. Rebound secured by De'Aaron Allen.

[06:11] Team_049 possession (Score: 5-10)
De'Aaron Allen throws a bad pass! Stolen by Draymond Fox! TURNOVER! (live ball)

[05:59] Team_004 possession (Score: 5-10)
FOUL! Holding foul on Shai Bird. [Team fouls: 2] No free throws, side out. (Shai Bird: 1 personal fouls)

[05:42] Team_004 possession (Score: 5-10)
Dwyane Irving attempts a 3Pt. Contested by Shai Bird (4.2 feet, ZONE). DWYANE IRVING MAKES IT! Assist: Draymond Fox
Score: 8-10

[05:26] Team_049 possession (Score: 8-10)
De'Aaron Allen drives to the basket... De'Aaron Allen loses the ball! Stripped by Draymond Fox! TURNOVER! (live ball)

[05:11] Team_004 possession (Score: 8-10)
Jabari Wade attempts a Midrange. Contested by Ja Oladipo (5.0 feet, MAN). JABARI WADE MAKES IT!
Score: 10-10

[04:58] Team_049 possession (Score: 10-10)
Jimmy Griffin attempts a 3Pt. Contested by Jabari Wade (4.8 feet, ZONE). Jimmy Griffin misses. Rebound secured by Draymond Fox.

[04:41] Team_004 possession (Score: 10-10)
Anthony Lillard makes the Dunk and draws the foul on Ja Oladipo! And-1! Anthony Lillard to the line for 1. [Team fouls: 3] (Ja Oladipo: 2 personal fouls)   FT 1/1: GOOD Anthony Lillard makes 1/1 from the line.
Score: 13-10

[04:24] Team_049 possession (Score: 13-10)
Shai Bird attempts a 3Pt. Contested by Michael Curry (5.5 feet, ZONE). Shai Bird misses. Rebound secured by Draymond Fox.

[04:09] Team_004 possession (Score: 13-10)
Draymond Fox attempts a Midrange. Contested by De'Aaron Allen (4.7 feet, MAN). Draymond Fox misses. Rebound secured by Shai Mobley.

[03:53] Team_049 possession (Score: 13-10)
Jimmy Griffin attempts a Layup. Contested by Dwyane Irving (3.7 feet, MAN). JIMMY GRIFFIN MAKES IT!
Score: 13-12

[03:41] Team_004 possession (Score: 13-12)
FOUL! Reach-in foul on De'Aaron Allen during the drive. [Team fouls: 4] No free throws, side out. (De'Aaron Allen: 1 personal fouls)

[03:25] Team_004 possession (Score: 13-12)
Michael Curry drives and kicks out. Anthony Lillard attempts a 3Pt. Contested by Ja Oladipo (4.4 feet, ZONE). Anthony Lillard misses. Rebound secured by De'Aaron Allen.

[03:11] Team_049 possession (Score: 13-12)
FOUL! Reach-in foul on Anthony Lillard during the drive. [IN THE BONUS! 5 team fouls] De'Aaron Allen to the line for 2 free throws. (Anthony Lillard: 4 personal fouls)   FT 1/2: GOOD   FT 2/2: GOOD De'Aaron Allen makes 2/2 from the line.
Score: 13-14

[02:58] Team_004 possession (Score: 13-14)
Michael Curry drives and kicks out. Anthony Lillard attempts a Midrange. Contested by Shai Mobley (4.5 feet, MAN). Anthony Lillard misses. Rebound secured by Jimmy Griffin.

[02:48] Team_049 possession (Score: 13-14)
Jimmy Griffin attempts a 3Pt. Contested by Dwyane Irving (3.8 feet, MAN). JIMMY GRIFFIN MAKES IT! Assist: Shai Mobley
Score: 13-17

[02:35] Team_004 possession (Score: 13-17)
Michael Curry attempts a Midrange. Contested by Jimmy Griffin (5.1 feet, ZONE). MICHAEL CURRY MAKES IT! Assist: Jabari Wade
Score: 15-17

[02:17] Team_049 possession (Score: 15-17)
De'Aaron Allen attempts a Midrange. Contested by Dwyane Irving (3.6 feet, ZONE). De'Aaron Allen misses. Rebound secured by Anthony Lillard.

[02:05] Team_004 possession (Score: 15-17)
Draymond Fox attempts a 3Pt. Contested by Ja Oladipo (4.9 feet, ZONE). DRAYMOND FOX MAKES IT! Assist: Jabari Wade
Score: 18-17

[01:52] Team_049 possession (Score: 18-17)
De'Aaron Allen drives, Draymond Fox stays with him. De'Aaron Allen attempts a Layup. Contested by Draymond Fox (4.3 feet, MAN). De'Aaron Allen misses. Offensive rebound by De'Aaron Allen! De'Aaron Allen kicks it out.

[01:36] Team_049 possession (Score: 18-17)
FOUL! Reach-in foul on Anthony Lillard during the drive. [IN THE BONUS! 6 team fouls] De'Aaron Allen to the line for 2 free throws. (Anthony Lillard: 5 personal fouls)   FT 1/2: MISS   FT 2/2: GOOD De'Aaron Allen makes 1/2 from the line.
Score: 18-18

[01:21] Team_004 possession (Score: 18-18)
Michael Curry attempts a Midrange. Contested by Shai Bird (4.5 feet, MAN). Michael Curry misses. Rebound secured by Shai Mobley.

[01:08] Team_049 possession (Score: 18-18)
FOUL! Holding foul on Michael Curry. [IN THE BONUS! 7 team fouls] Shai Bird to the line for 2 free throws. (Michael Curry: 1 personal fouls)   FT 1/2: GOOD   FT 2/2: MISS Shai Bird makes 1/2 from the line. Rebound secured by Anthony Lillard.
Score: 18-19

[00:54] Team_004 possession (Score: 18-19)
Michael Curry attempts a 3Pt. Contested by Shai Bird (4.6 feet, MAN). Michael Curry misses. Rebound secured by De'Aaron Allen.

[00:39] Team_049 possession (Score: 18-19)
Shai Bird attempts a Layup. BLOCKED BY MICHAEL CURRY! Ball is loose! Rebound secured by Dwyane Irving.

[00:23] Team_004 possession (Score: 18-19)
Dwyane Irving attempts a Layup. BLOCKED BY JIMMY GRIFFIN! Ball is loose! Offensive rebound by Anthony Lillard! Anthony Lillard kicks it out.

[00:06] Team_004 possession (Score: 18-19)
Jabari Wade attempts a Layup. BLOCKED BY DE'AARON ALLEN! Ball is loose! Offensive rebound by Anthony Lillard! Anthony Lillard kicks it out.

================================================================================
                              1ST QUARTER COMPLETE                              
================================================================================

1ST QUARTER SCORE: Team_004 18, Team_049 19

BOX SCORE:
================================================================================

Team_004
--------------------------------------------------------------------------------
Player                MIN  PTS  REB  AST  TO      FG   FG%      3P   3P%
--------------------------------------------------------------------------------
Jabari Wade            12    7    0    2   0   3/3   100.0     0/0   0.0
Anthony Lillard        12    3    8    0   0   1/2    50.0     0/0   0.0
Dwyane Irving          12    3    2    1   0   1/3    33.3     0/0   0.0
Draymond Fox           12    3    4    1   0   1/2    50.0     0/0   0.0
Michael Curry          12    2    0    0   0   1/7    14.3     0/0   0.0

TEAM: FG: 7/17 (41.2%), 3PT: 3/6 (50.0%), REB: 14 (5 off, 9 def), AST: 4, TO: 2
TEAM FOULS: 7 [Team_049 in BONUS]


Team_049
--------------------------------------------------------------------------------
Player                MIN  PTS  REB  AST  TO      FG   FG%      3P   3P%
--------------------------------------------------------------------------------
Shai Mobley            12    7    5    2   0   3/4    75.0     0/0   0.0
De'Aaron Allen         12    6    6    0   0   3/4    75.0     0/0   0.0
Jimmy Griffin          12    5    4    0   0   2/4    50.0     0/0   0.0
Ja Oladipo             12    0    0    0   0   0/2     0.0     0/0   0.0
Shai Bird              12    0    0    0   0   0/2     0.0     0/0   0.0

TEAM: FG: 8/17 (47.1%), 3PT: 3/9 (33.3%), REB: 15 (5 off, 10 def), AST: 2, TO: 2
TEAM FOULS: 5 [Team_004 in BONUS]

================================================================================

================================================================================
                       2ND QUARTER - Team_004 vs Team_049                       
================================================================================

[12:00] Team_004 possession (Score: 18-19)
Anthony Lillard drives and kicks out. Dwyane Irving attempts a Midrange. Contested by Ja Oladipo (4.6 feet, ZONE). Dwyane Irving misses. Rebound secured by De'Aaron Allen.

[11:43] Team_049 possession (Score: 18-19)
Shai Mobley loses the ball! Stripped by Anthony Lillard! TURNOVER! (live ball)

[11:32] Team_004 possession (Score: 18-19)
Dwyane Irving attempts a Layup. Contested by De'Aaron Allen (4.9 feet, ZONE). Dwyane Irving misses. Offensive rebound by Dwyane Irving! Dwyane Irving kicks it out.

[11:14] Team_004 possession (Score: 18-19)
Michael Curry attempts a Midrange. Contested by Shai Bird (4.5 feet, MAN). MICHAEL CURRY MAKES IT! Assist: Anthony Lillard
Score: 20-19

[11:02] Team_049 possession (Score: 20-19)
Shai Mobley drives and kicks out. Ja Oladipo attempts a Midrange. Contested by Dwyane Irving (3.9 feet, ZONE). Ja Oladipo misses. Rebound secured by Dwyane Irving.

[10:51] Team_004 possession (Score: 20-19)
Draymond Fox loses the ball! Stripped by De'Aaron Allen! TURNOVER! (live ball)

[10:37] Team_049 possession (Score: 20-19)
FOUL! Holding foul on Draymond Fox. [Team fouls: 1] No free throws, side out. (Draymond Fox: 1 personal fouls)

[10:27] Team_049 possession (Score: 20-19)
Shai Bird attempts a Layup. Contested by Michael Curry (5.8 feet, MAN). SHAI BIRD MAKES IT! Assist: Shai Mobley
Score: 20-21

[10:11] Team_004 possession (Score: 20-21)
Michael Curry attempts a 3Pt. Contested by Ja Oladipo (4.9 feet, ZONE). MICHAEL CURRY MAKES IT! Assist: Dwyane Irving
Score: 23-21

[09:56] Team_049 possession (Score: 23-21)
Ja Oladipo attempts a 3Pt. Contested by Michael Curry (5.7 feet, ZONE). Ja Oladipo misses. Offensive rebound by De'Aaron Allen! De'Aaron Allen kicks it out.

[09:41] Team_049 possession (Score: 23-21)
Shai Mobley drives and kicks out. Ja Oladipo attempts a 3Pt. Contested by Jabari Wade (5.4 feet, MAN). JA OLADIPO MAKES IT! Assist: Shai Mobley
Score: 23-24

[09:26] Team_004 possession (Score: 23-24)
Draymond Fox drives and kicks out. Dwyane Irving attempts a 3Pt. Contested by Ja Oladipo (4.9 feet, ZONE). Dwyane Irving misses. Rebound secured by Jimmy Griffin.

[09:16] Team_049 possession (Score: 23-24)
Jimmy Griffin attempts a 3Pt. Contested by Michael Curry (5.6 feet, ZONE). Jimmy Griffin misses. Offensive rebound by De'Aaron Allen! De'Aaron Allen kicks it out.

[09:04] Team_049 possession (Score: 23-24)
Shai Mobley attempts a 3Pt. Contested by Michael Curry (5.9 feet, ZONE). SHAI MOBLEY MAKES IT! Assist: De'Aaron Allen
Score: 23-27

[08:44] Team_004 possession (Score: 23-27)
Michael Curry attempts a 3Pt. Contested by Shai Bird (4.9 feet, ZONE). Michael Curry misses. Offensive rebound by Anthony Lillard! Anthony Lillard kicks it out.

[08:33] Team_004 possession (Score: 23-27)
Draymond Fox drives and kicks out. Michael Curry attempts a 3Pt. Contested by Shai Bird (4.9 feet, MAN). Michael Curry misses. Offensive rebound by Dwyane Irving! Dwyane Irving kicks it out.

[08:15] Team_004 possession (Score: 23-27)
Draymond Fox attempts a Midrange. Contested by Ja Oladipo (5.3 feet, ZONE). Draymond Fox misses. Rebound secured by Shai Mobley.

[07:58] Team_049 possession (Score: 23-27)
Jimmy Griffin drives, Anthony Lillard stays with him. Jimmy Griffin attempts a Dunk. Contested by Anthony Lillard (5.1 feet, ZONE). Jimmy Griffin misses. Rebound secured by Anthony Lillard.

[07:41] Team_004 possession (Score: 23-27)
FOUL! Holding foul on Jimmy Griffin. [Team fouls: 1] No free throws, side out. (Jimmy Griffin: 1 personal fouls)

[07:26] Team_004 possession (Score: 23-27)
FOUL! Shooting foul on Jimmy Griffin. Dwyane Irving to the line for 2 free throws. [Team fouls: 2] (Jimmy Griffin: 2 personal fouls)   FT 1/2: GOOD   FT 2/2: GOOD Dwyane Irving makes 2/2 from the line.
Score: 25-27

[07:13] Team_049 possession (Score: 25-27)
Ja Oladipo attempts a 3Pt. Contested by Jabari Wade (5.8 feet, MAN). Ja Oladipo misses. Rebound secured by Anthony Lillard.

[06:58] Team_004 possession (Score: 25-27)
Dwyane Irving attempts a 3Pt. Contested by Jimmy Griffin (5.9 feet, MAN). Dwyane Irving misses. Rebound secured by Jimmy Griffin.

[06:44] Team_049 possession (Score: 25-27)
Ja Oladipo makes the Midrange and draws the foul on Jabari Wade! And-1! Ja Oladipo to the line for 1. [Team fouls: 2] (Jabari Wade: 1 personal fouls)   FT 1/1: MISS Ja Oladipo makes 0/1 from the line. FOUL! Loose ball foul on Anthony Lillard during the free throw rebound! [Team fouls: 3] No free throws, side out. (Anthony Lillard: 1 personal fouls)
Score: 25-29

[06:34] Team_049 possession (Score: 25-29)
Shai Bird attempts a Midrange. Wide open! Michael Curry is 6.2 feet away. [MAN] Shai Bird misses. Offensive rebound by De'Aaron Allen! De'Aaron Allen kicks it out.

[06:21] Team_049 possession (Score: 25-29)
Shai Mobley attempts a 3Pt. Wide open! Michael Curry is 6.2 feet away. [ZONE] Shai Mobley misses. Rebound secured by Anthony Lillard.

[06:07] Team_004 possession (Score: 25-29)
Jabari Wade drives and kicks out. Jabari Wade attempts a Midrange. Contested by Ja Oladipo (5.4 feet, MAN). JABARI WADE MAKES IT!
Score: 27-29

[05:53] Team_049 possession (Score: 27-29)
Shai Bird attempts a 3Pt. Wide open! Michael Curry is 6.3 feet away. [ZONE] SHAI BIRD MAKES IT! Assist: Shai Mobley
Score: 27-32

[05:37] Team_004 possession (Score: 27-32)
FOUL! Reach-in foul on De'Aaron Allen during the drive. [Team fouls: 3] No free throws, side out. (De'Aaron Allen: 1 personal fouls)

[05:20] Team_004 possession (Score: 27-32)
Dwyane Irving drives, picks up Jimmy Griffin. Help arrives from Ja Oladipo! Dwyane Irving attempts a Dunk. Wide open! Ja Oladipo is 6.1 feet away. [MAN] DWYANE IRVING MAKES IT! Assist: Jabari Wade
Score: 29-32

[05:07] Team_049 possession (Score: 29-32)
Shai Mobley attempts a Midrange. Wide open! Jabari Wade is 6.2 feet away. [ZONE] Shai Mobley misses. Offensive rebound by De'Aaron Allen! De'Aaron Allen kicks it out.

[04:54] Team_049 possession (Score: 29-32)
Shai Bird attempts a 3Pt. Wide open! Michael Curry is 6.4 feet away. [MAN] Shai Bird misses. Rebound secured by Dwyane Irving.

[04:37] Team_004 possession (Score: 29-32)
Anthony Lillard attempts a 3Pt. Contested by Ja Oladipo (5.8 feet, ZONE). Anthony Lillard misses. Rebound secured by Shai Mobley.

[04:22] Team_049 possession (Score: 29-32)
Ja Oladipo attempts a Layup. Wide open! Jabari Wade is 6.3 feet away. [MAN] JA OLADIPO MAKES IT!
Score: 29-34

[04:09] Team_004 possession (Score: 29-34)
Michael Curry attempts a 3Pt. Contested by Shai Bird (5.6 feet, MAN). MICHAEL CURRY MAKES IT! Assist: Dwyane Irving
Score: 32-34

[03:55] Team_049 possession (Score: 32-34)
Shai Mobley drives to the basket... FOUL! Offensive foul on Shai Mobley! Anthony Lillard drew the charge! [Team fouls: 4] (Shai Mobley: 1 personal fouls) TURNOVER! (dead ball)

[03:39] Team_004 possession (Score: 32-34)
Jabari Wade attempts a Layup. Wide open! Ja Oladipo is 6.1 feet away. [MAN] Jabari Wade misses. FOUL! Loose ball foul on De'Aaron Allen during the rebound battle. [IN THE BONUS! 5 team fouls] Dwyane Irving to the line for 2 free throws. (De'Aaron Allen: 2 personal fouls)   FT 1/2: GOOD   FT 2/2: GOOD Dwyane Irving makes 2/2 from the line.
Score: 34-34

[03:29] Team_049 possession (Score: 34-34)
Ja Oladipo attempts a 3Pt. Wide open! Michael Curry is 6.5 feet away. [ZONE] JA OLADIPO MAKES IT! Assist: Shai Bird
Score: 34-37

[03:15] Team_004 possession (Score: 34-37)
Jabari Wade attempts a 3Pt. Wide open! Ja Oladipo is 6.2 feet away. [ZONE] Jabari Wade misses. FOUL! Loose ball foul on De'Aaron Allen during the rebound battle. [IN THE BONUS! 6 team fouls] Dwyane Irving to the line for 2 free throws. (De'Aaron Allen: 3 personal fouls)   FT 1/2: GOOD   FT 2/2: GOOD Dwyane Irving makes 2/2 from the line.
Score: 36-37

[03:03] Team_049 possession (Score: 36-37)
Ja Oladipo attempts a Midrange. Wide open! Jabari Wade is 6.5 feet away. [MAN] JA OLADIPO MAKES IT!
Score: 36-39

[02:48] Team_004 possession (Score: 36-39)
Michael Curry attempts a 3Pt. Contested by Ja Oladipo (5.9 feet, ZONE). Michael Curry misses. Rebound secured by De'Aaron Allen.

[02:34] Team_049 possession (Score: 36-39)
Shai Bird attempts a 3Pt. Wide open! Michael Curry is 6.7 feet away. [MAN] Shai Bird misses. Rebound secured by Anthony Lillard.

[02:20] Team_004 possession (Score: 36-39)
Dwyane Irving attempts a Layup. Wide open! De'Aaron Allen is 6.0 feet away. [ZONE] DWYANE IRVING MAKES IT! Assist: Jabari Wade
Score: 38-39

[02:05] Team_049 possession (Score: 38-39)
De'Aaron Allen attempts a 3Pt. Contested by Draymond Fox (5.8 feet, MAN). De'Aaron Allen misses. Offensive rebound by De'Aaron Allen! De'Aaron Allen kicks it out.

[01:51] Team_049 possession (Score: 38-39)
FOUL! Holding foul on Dwyane Irving. [Team fouls: 4] No free throws, side out. (Dwyane Irving: 1 personal fouls)

[01:32] Team_049 possession (Score: 38-39)
Jimmy Griffin drives and kicks out. Ja Oladipo attempts a 3Pt. Wide open! Michael Curry is 6.8 feet away. [ZONE] Ja Oladipo misses. Rebound secured by Dwyane Irving.

[01:17] Team_004 possession (Score: 38-39)
FOUL! Holding foul on Jimmy Griffin. [IN THE BONUS! 7 team fouls] Dwyane Irving to the line for 2 free throws. (Jimmy Griffin: 3 personal fouls)   FT 1/2: GOOD   FT 2/2: GOOD Dwyane Irving makes 2/2 from the line.
Score: 40-39

[01:03] Team_049 possession (Score: 40-39)
Jimmy Griffin attempts a Layup. BLOCKED BY DWYANE IRVING! Ball deflects out of bounds off Jimmy Griffin.

[00:51] Team_004 possession (Score: 40-39)
Dwyane Irving attempts a 3Pt. Wide open! Jimmy Griffin is 6.7 feet away. [MAN] Dwyane Irving misses. Rebound secured by De'Aaron Allen.

[00:40] Team_049 possession (Score: 40-39)
Shai Bird drives to the basket... Shai Bird commits a violation (traveling/carry)! TURNOVER! (dead ball)

[00:40] Substitution (Team_004): Michael Curry OUT → Karl Reaves IN (stamina_rule2)

[00:40] Substitution (Team_004): Jabari Wade OUT → Russell Barnes IN (stamina_rule2)

[00:40] Substitution (Team_004): Dwyane Irving OUT → Kristaps Green IN (stamina_rule2)

[00:40] Substitution (Team_004): Draymond Fox OUT → Michael Sabonis IN (stamina_rule2)

[00:40] Substitution (Team_004): Anthony Lillard OUT → Shai Beal IN (stamina_rule2)

[00:40] Substitution (Team_049): Shai Bird OUT → Shaquille Lillard IN (stamina_rule2)

[00:40] Substitution (Team_049): Ja Oladipo OUT → Shai Jordan IN (stamina_rule2)

[00:40] Substitution (Team_049): Jimmy Griffin OUT → Desmond Towns IN (stamina_rule2)

[00:40] Substitution (Team_049): De'Aaron Allen OUT → Giannis Anunoby IN (stamina_rule2)

[00:40] Substitution (Team_049): Shai Mobley OUT → Miles Jackson IN (stamina_rule2)

[00:27] Team_004 possession (Score: 40-39)
Kristaps Green attempts a Midrange. Contested by Desmond Towns (4.5 feet, MAN). KRISTAPS GREEN MAKES IT! Assist: Michael Sabonis
Score: 42-39

[00:11] Team_049 possession (Score: 42-39)
Miles Jackson drives, picks up Shai Beal. Help arrives from Russell Barnes! Miles Jackson attempts a Layup. Contested by Russell Barnes (5.1 feet, ZONE). Miles Jackson misses. Rebound secured by Michael Sabonis.

================================================================================
                              2ND QUARTER COMPLETE                              
================================================================================

2ND QUARTER SCORE: Team_004 24, Team_049 20

BOX SCORE:
================================================================================

Team_004
--------------------------------------------------------------------------------
Player                MIN  PTS  REB  AST  TO      FG   FG%      3P   3P%
--------------------------------------------------------------------------------
Dwyane Irving          24   12    5    2   0   6/8    75.0     0/0   0.0
Michael Curry          24    8    0    0   0   3/4    75.0     0/0   0.0
Jabari Wade            24    2    0    2   0   1/1   100.0     0/0   0.0
Kristaps Green          0    2    0    0   0   1/1   100.0     0/0   0.0
Anthony Lillard        24    0    5    1   0   0/2     0.0     0/0   0.0
Draymond Fox           24    0    0    0   0   0/2     0.0     0/0   0.0
Michael Sabonis         0    0    1    1   0   0/0     0.0     0/0   0.0

TEAM: FG: 11/18 (61.1%), 3PT: 3/7 (42.9%), REB: 11 (3 off, 8 def), AST: 6, TO: 1
TEAM FOULS: 4


Team_049
--------------------------------------------------------------------------------
Player                MIN  PTS  REB  AST  TO      FG   FG%      3P   3P%
--------------------------------------------------------------------------------
Ja Oladipo             24   10    0    0   0   4/5    80.0     0/0   0.0
Shai Bird              24    5    0    1   0   2/4    50.0     0/0   0.0
Shai Mobley            24    3    2    3   0   1/3    33.3     0/0   0.0
De'Aaron Allen         24    0    9    1   0   0/0     0.0     0/0   0.0
Jimmy Griffin          24    0    2    0   0   0/3     0.0     0/0   0.0
Miles Jackson           0    0    0    0   0   0/1     0.0     0/0   0.0

TEAM: FG: 7/16 (43.8%), 3PT: 3/7 (42.9%), REB: 13 (6 off, 7 def), AST: 5, TO: 3
TEAM FOULS: 7 [Team_004 in BONUS]

================================================================================

================================================================================
                       3RD QUARTER - Team_004 vs Team_049                       
================================================================================

[12:00] Team_004 possession (Score: 42-39)
Draymond Fox drives to the basket... Draymond Fox loses the ball! Stripped by De'Aaron Allen! TURNOVER! (live ball)

[11:48] Team_049 possession (Score: 42-39)
Shai Mobley drives and kicks out. Shai Bird attempts a Midrange. Contested by Michael Curry (5.0 feet, MAN). SHAI BIRD MAKES IT! Assist: Shai Mobley
Score: 42-41

[11:30] Team_004 possession (Score: 42-41)
Draymond Fox drives, De'Aaron Allen stays with him. Draymond Fox attempts a Dunk. Contested by De'Aaron Allen (4.7 feet, ZONE). DRAYMOND FOX MAKES IT!
Score: 44-41

[11:14] Team_049 possession (Score: 44-41)
Jimmy Griffin attempts a 3Pt. Contested by Michael Curry (5.1 feet, ZONE). Jimmy Griffin misses. Offensive rebound by Jimmy Griffin! Jimmy Griffin kicks it out.

[11:01] Team_049 possession (Score: 44-41)
Shai Bird attempts a 3Pt. Contested by Michael Curry (5.5 feet, MAN). Shai Bird misses. Rebound secured by Anthony Lillard.

[10:45] Team_004 possession (Score: 44-41)
Dwyane Irving attempts a 3Pt. Contested by Ja Oladipo (4.6 feet, ZONE). DWYANE IRVING MAKES IT! Assist: Jabari Wade
Score: 47-41

[10:33] Team_049 possession (Score: 47-41)
Jimmy Griffin attempts a 3Pt. Contested by Dwyane Irving (3.6 feet, MAN). JIMMY GRIFFIN MAKES IT!
Score: 47-44

[10:18] Team_004 possession (Score: 47-44)
Jabari Wade drives, picks up De'Aaron Allen. Help arrives from Ja Oladipo! Jabari Wade attempts a Layup. Contested by Ja Oladipo (5.0 feet, ZONE). Jabari Wade misses. Offensive rebound by Anthony Lillard! Anthony Lillard kicks it out.

[10:00] Team_004 possession (Score: 47-44)
Jabari Wade attempts a Midrange. Contested by Jimmy Griffin (5.4 feet, ZONE). Jabari Wade misses. Rebound secured by Shai Mobley.

[09:50] Team_049 possession (Score: 47-44)
Shai Mobley attempts a Midrange. Contested by Draymond Fox (4.4 feet, ZONE). Shai Mobley misses. Rebound secured by Dwyane Irving.

[09:37] Team_004 possession (Score: 47-44)
Anthony Lillard makes the Layup and draws the foul on Shai Mobley! And-1! Anthony Lillard to the line for 1. [Team fouls: 1] (Shai Mobley: 1 personal fouls)   FT 1/1: GOOD Anthony Lillard makes 1/1 from the line.
Score: 50-44

[09:23] Team_049 possession (Score: 50-44)
Shai Mobley drives and kicks out. Jimmy Griffin attempts a Midrange. Contested by Dwyane Irving (3.5 feet, MAN). Jimmy Griffin misses. Offensive rebound by Shai Mobley! Shai Mobley's putback is no good. Offensive rebound by Shai Mobley! Shai Mobley kicks it out.

[09:08] Team_049 possession (Score: 50-44)
De'Aaron Allen drives and kicks out. Shai Mobley attempts a Midrange. Contested by Dwyane Irving (3.5 feet, ZONE). Shai Mobley misses. Rebound secured by Draymond Fox.

[08:54] Team_004 possession (Score: 50-44)
Michael Curry attempts a Midrange. Contested by Jimmy Griffin (4.8 feet, ZONE). Michael Curry misses. Rebound secured by Shai Mobley.

[08:37] Team_049 possession (Score: 50-44)
Jimmy Griffin attempts a 3Pt. Contested by Michael Curry (5.1 feet, ZONE). Jimmy Griffin misses. Rebound secured by Draymond Fox.

[08:22] Team_004 possession (Score: 50-44)
Jabari Wade attempts a 3Pt. Contested by Ja Oladipo (5.0 feet, MAN). Jabari Wade misses. Rebound secured by Jimmy Griffin.

[08:10] Team_049 possession (Score: 50-44)
Shai Mobley attempts a 3Pt. Contested by Michael Curry (5.3 feet, ZONE). Shai Mobley misses. Rebound secured by Draymond Fox.

[07:58] Team_004 possession (Score: 50-44)
Michael Curry makes the Midrange and draws the foul on De'Aaron Allen! And-1! Michael Curry to the line for 1. [Team fouls: 2] (De'Aaron Allen: 1 personal fouls)   FT 1/1: GOOD Michael Curry makes 1/1 from the line.
Score: 53-44

[07:41] Team_049 possession (Score: 53-44)
De'Aaron Allen attempts a Midrange. Contested by Jabari Wade (4.5 feet, ZONE). De'Aaron Allen misses. Rebound secured by Anthony Lillard.

[07:28] Team_004 possession (Score: 53-44)
Michael Curry attempts a Midrange. Contested by Ja Oladipo (4.4 feet, ZONE). Michael Curry misses. Rebound secured by Jimmy Griffin.

[07:14] Team_049 possession (Score: 53-44)
Shai Mobley attempts a Layup. BLOCKED BY ANTHONY LILLARD! Ball goes out off Anthony Lillard. Shai Mobley's ball!

[06:58] Team_049 possession (Score: 53-44)
Shai Mobley attempts a Midrange. Contested by Anthony Lillard (4.4 feet, MAN). Shai Mobley misses. Rebound secured by Draymond Fox.

[06:45] Team_004 possession (Score: 53-44)
Jabari Wade attempts a Midrange. Contested by Shai Mobley (5.0 feet, ZONE). Jabari Wade misses. Rebound secured by De'Aaron Allen.

[06:28] Team_049 possession (Score: 53-44)
Shai Bird attempts a 3Pt. Contested by Michael Curry (5.5 feet, MAN). Shai Bird misses. Rebound secured by Anthony Lillard.

[06:15] Team_004 possession (Score: 53-44)
Michael Curry attempts a 3Pt. Contested by Ja Oladipo (4.4 feet, ZONE). Michael Curry misses. Rebound secured by Shai Mobley.

[05:59] Team_049 possession (Score: 53-44)
FOUL! Reach-in foul on Draymond Fox during the drive. [Team fouls: 1] No free throws, side out. (Draymond Fox: 1 personal fouls)

[05:41] Team_049 possession (Score: 53-44)
Jimmy Griffin drives to the basket... FOUL! Offensive foul on Jimmy Griffin! Anthony Lillard drew the charge! [Team fouls: 3] (Jimmy Griffin: 1 personal fouls) TURNOVER! (dead ball)

[05:24] Team_004 possession (Score: 53-44)
FOUL! Reach-in foul on De'Aaron Allen during the drive. [Team fouls: 4] No free throws, side out. (De'Aaron Allen: 2 personal fouls)

[05:15] Team_004 possession (Score: 53-44)
Dwyane Irving drives, Jimmy Griffin stays with him. Dwyane Irving attempts a Layup. Contested by Jimmy Griffin (5.0 feet, MAN). DWYANE IRVING MAKES IT! Assist: Jabari Wade
Score: 55-44

[04:59] Team_049 possession (Score: 55-44)
Shai Bird drives and kicks out. De'Aaron Allen attempts a 3Pt. Contested by Draymond Fox (4.2 feet, MAN). De'Aaron Allen misses. Rebound secured by Dwyane Irving.

[04:40] Team_004 possession (Score: 55-44)
Dwyane Irving attempts a 3Pt. Contested by Ja Oladipo (4.6 feet, ZONE). Dwyane Irving misses. Rebound secured by Shai Mobley.

[04:26] Team_049 possession (Score: 55-44)
Ja Oladipo attempts a 3Pt. Contested by Jabari Wade (5.0 feet, MAN). Ja Oladipo misses. FOUL! Loose ball foul on Draymond Fox during the rebound battle. [Team fouls: 2] No free throws, side out. (Draymond Fox: 2 personal fouls)

[04:15] Team_049 possession (Score: 55-44)
De'Aaron Allen drives to the basket... FOUL! Offensive foul on De'Aaron Allen! Draymond Fox drew the charge! [Team fouls: 5] (De'Aaron Allen: 3 personal fouls) TURNOVER! (dead ball)

[03:58] Team_004 possession (Score: 55-44)
Draymond Fox attempts a Midrange. Contested by De'Aaron Allen (4.7 feet, MAN). Draymond Fox misses. Rebound secured by Jimmy Griffin.

[03:45] Team_049 possession (Score: 55-44)
Ja Oladipo attempts a 3Pt. Contested by Jabari Wade (5.1 feet, MAN). JA OLADIPO MAKES IT! Assist: Jimmy Griffin
Score: 55-47

[03:30] Team_004 possession (Score: 55-47)
Jabari Wade attempts a 3Pt. Contested by Ja Oladipo (5.1 feet, ZONE). JABARI WADE MAKES IT! Assist: Draymond Fox
Score: 58-47

[03:14] Team_049 possession (Score: 58-47)
Shai Mobley throws a bad pass out of bounds! TURNOVER! (dead ball)

[03:00] Team_004 possession (Score: 58-47)
Dwyane Irving attempts a 3Pt. Contested by Ja Oladipo (4.7 feet, ZONE). Dwyane Irving misses. Offensive rebound by Anthony Lillard! Anthony Lillard kicks it out.

[02:49] Team_004 possession (Score: 58-47)
Dwyane Irving attempts a Midrange. Contested by Jimmy Griffin (5.2 feet, MAN). DWYANE IRVING MAKES IT! Assist: Jabari Wade
Score: 60-47

[02:34] Team_049 possession (Score: 60-47)
Jimmy Griffin attempts a Midrange. Contested by Dwyane Irving (3.8 feet, ZONE). Jimmy Griffin misses. Offensive rebound by Shai Mobley! Shai Mobley puts it back in!
Score: 60-49

[02:25] Team_004 possession (Score: 60-49)
Jabari Wade attempts a 3Pt. Contested by Jimmy Griffin (5.6 feet, ZONE). Jabari Wade misses. Rebound secured by Jimmy Griffin.

[02:15] Team_049 possession (Score: 60-49)
Shai Mobley drives, Anthony Lillard stays with him. Shai Mobley attempts a Dunk. Contested by Anthony Lillard (4.8 feet, MAN). SHAI MOBLEY MAKES IT! Assist: Shai Bird
Score: 60-51

[02:01] Team_004 possession (Score: 60-51)
Michael Curry drives, Shai Bird stays with him. Michael Curry attempts a Layup. Contested by Shai Bird (4.4 feet, MAN). MICHAEL CURRY MAKES IT! Assist: Dwyane Irving
Score: 62-51

[01:43] Team_049 possession (Score: 62-51)
FOUL! Shooting foul on Draymond Fox. De'Aaron Allen to the line for 2 free throws. [Team fouls: 3] (Draymond Fox: 3 personal fouls)   FT 1/2: GOOD   FT 2/2: MISS De'Aaron Allen makes 1/2 from the line. FOUL! Loose ball foul on Draymond Fox during the free throw rebound! [Team fouls: 4] No free throws, side out. (Draymond Fox: 4 personal fouls)
Score: 62-52

[01:28] Team_049 possession (Score: 62-52)
Shai Bird attempts a Midrange. Contested by Michael Curry (5.7 feet, MAN). Shai Bird misses. Rebound secured by Anthony Lillard.

[01:11] Team_004 possession (Score: 62-52)
Dwyane Irving attempts a 3Pt. Contested by Jimmy Griffin (5.4 feet, MAN). Dwyane Irving misses. FOUL! Loose ball foul on Shai Mobley during the rebound battle. [IN THE BONUS! 6 team fouls] Dwyane Irving to the line for 2 free throws. (Shai Mobley: 2 personal fouls)   FT 1/2: GOOD   FT 2/2: MISS Dwyane Irving makes 1/2 from the line. Rebound secured by De'Aaron Allen.
Score: 63-52

[00:59] Team_049 possession (Score: 63-52)
Jimmy Griffin makes the 3Pt and draws the foul on Michael Curry! And-1! Jimmy Griffin to the line for 1. [BONUS: 5 team fouls] (Michael Curry: 1 personal fouls)   FT 1/1: GOOD Jimmy Griffin makes 1/1 from the line.
Score: 63-56

[00:42] Team_004 possession (Score: 63-56)
Jabari Wade attempts a 3Pt. Contested by Ja Oladipo (5.3 feet, ZONE). Jabari Wade misses. Rebound secured by Shai Mobley.

[00:32] Team_049 possession (Score: 63-56)
FOUL! Shooting foul on Michael Curry. Shai Bird to the line for 2 free throws. [BONUS: 6 team fouls] (Michael Curry: 2 personal fouls)   FT 1/2: GOOD   FT 2/2: GOOD Shai Bird makes 2/2 from the line.
Score: 63-58

[00:20] Team_004 possession (Score: 63-58)
Michael Curry attempts a Midrange. Contested by Jimmy Griffin (5.3 feet, ZONE). MICHAEL CURRY MAKES IT!
Score: 65-58

[00:03] Team_049 possession (Score: 65-58)
Ja Oladipo attempts a 3Pt. Contested by Michael Curry (5.7 feet, ZONE). JA OLADIPO MAKES IT! Assist: Shai Bird
Score: 65-61

================================================================================
                              3RD QUARTER COMPLETE                              
================================================================================

3RD QUARTER SCORE: Team_004 23, Team_049 22

BOX SCORE:
================================================================================

Team_004
--------------------------------------------------------------------------------
Player                MIN  PTS  REB  AST  TO      FG   FG%      3P   3P%
--------------------------------------------------------------------------------
Dwyane Irving          36    7    2    1   0   3/5    60.0     0/0   0.0
Michael Curry          36    7    0    0   0   3/6    50.0     0/0   0.0
Anthony Lillard        36    3    6    0   0   1/1   100.0     0/0   0.0
Jabari Wade            36    3    0    3   0   1/6    16.7     0/0   0.0
Draymond Fox           36    2    4    1   0   1/2    50.0     0/0   0.0
De'Aaron Allen         36    0    3    0   0   0/2     0.0     0/0   0.0

TEAM: FG: 9/20 (45.0%), 3PT: 2/8 (25.0%), REB: 13 (3 off, 10 def), AST: 5, TO: 1
TEAM FOULS: 6 [Team_049 in BONUS]


Team_049
--------------------------------------------------------------------------------
Player                MIN  PTS  REB  AST  TO      FG   FG%      3P   3P%
--------------------------------------------------------------------------------
Jimmy Griffin          36    7    5    1   0   2/3    66.7     0/0   0.0
Ja Oladipo             36    6    0    0   0   2/2   100.0     0/0   0.0
Shai Bird              36    4    0    2   0   2/6    33.3     0/0   0.0
Shai Mobley            36    4    8    1   0   2/5    40.0     0/0   0.0

TEAM: FG: 8/18 (44.4%), 3PT: 4/8 (50.0%), REB: 15 (5 off, 10 def), AST: 4, TO: 3
TEAM FOULS: 6 [Team_004 in BONUS]

================================================================================

================================================================================
                       4TH QUARTER - Team_004 vs Team_049                       
================================================================================

[12:00] Team_004 possession (Score: 65-61)
Draymond Fox attempts a Layup. Contested by De'Aaron Allen (4.9 feet, MAN). DRAYMOND FOX MAKES IT!
Score: 67-61

[11:49] Team_049 possession (Score: 67-61)
FOUL! Holding foul on Anthony Lillard. [Team fouls: 1] No free throws, side out. (Anthony Lillard: 1 personal fouls)

[11:35] Team_049 possession (Score: 67-61)
FOUL! Holding foul on Draymond Fox. [Team fouls: 2] No free throws, side out. (Draymond Fox: 1 personal fouls)

[11:18] Team_049 possession (Score: 67-61)
De'Aaron Allen drives, Draymond Fox stays with him. De'Aaron Allen attempts a Dunk. Contested by Draymond Fox (4.4 feet, MAN). DE'AARON ALLEN MAKES IT!
Score: 67-63

[11:04] Team_004 possession (Score: 67-63)
Draymond Fox attempts a Layup. Contested by De'Aaron Allen (5.0 feet, ZONE). DRAYMOND FOX MAKES IT! Assist: Anthony Lillard
Score: 69-63

[10:48] Team_049 possession (Score: 69-63)
De'Aaron Allen attempts a 3Pt. Contested by Michael Curry (5.2 feet, ZONE). De'Aaron Allen misses. Rebound secured by Dwyane Irving.

[10:37] Team_004 possession (Score: 69-63)
Anthony Lillard attempts a Midrange. Contested by Shai Mobley (5.0 feet, MAN). ANTHONY LILLARD MAKES IT! Assist: Jabari Wade
Score: 71-63

[10:24] Team_049 possession (Score: 71-63)
Ja Oladipo attempts a 3Pt. Contested by Jabari Wade (5.4 feet, MAN). JA OLADIPO MAKES IT! Assist: Jimmy Griffin
Score: 71-66

[10:08] Team_004 possession (Score: 71-66)
Draymond Fox attempts a 3Pt. Contested by Jimmy Griffin (5.5 feet, ZONE). Draymond Fox misses. FOUL! Loose ball foul on Shai Mobley during the rebound battle. [Team fouls: 1] No free throws, side out. (Shai Mobley: 1 personal fouls)

[09:52] Team_004 possession (Score: 71-66)
Anthony Lillard attempts a Midrange. Contested by Jimmy Griffin (5.6 feet, ZONE). Anthony Lillard misses. Rebound secured by Jimmy Griffin.

[09:39] Team_049 possession (Score: 71-66)
Shai Bird attempts a 3Pt. Contested by Michael Curry (5.9 feet, MAN). Shai Bird misses. Offensive rebound by De'Aaron Allen! De'Aaron Allen kicks it out.

[09:23] Team_049 possession (Score: 71-66)
Shai Bird attempts a 3Pt. Contested by Michael Curry (5.9 feet, ZONE). Shai Bird misses. Rebound secured by Anthony Lillard.

[09:09] Team_004 possession (Score: 71-66)
Anthony Lillard attempts a Layup. BLOCKED BY DE'AARON ALLEN! Ball deflects out of bounds off Anthony Lillard.

[08:52] Team_049 possession (Score: 71-66)
Ja Oladipo attempts a 3Pt. Contested by Michael Curry (5.8 feet, ZONE). Ja Oladipo misses. Rebound secured by Anthony Lillard.

[08:40] Team_004 possession (Score: 71-66)
Jabari Wade attempts a 3Pt. Contested by Shai Bird (5.3 feet, ZONE). Jabari Wade misses. Offensive rebound by Dwyane Irving! Dwyane Irving kicks it out.

[08:21] Team_004 possession (Score: 71-66)
Jabari Wade attempts a Layup. Contested by De'Aaron Allen (5.5 feet, ZONE). JABARI WADE MAKES IT!
Score: 73-66

[08:06] Team_049 possession (Score: 73-66)
Shai Mobley makes the Dunk and draws the foul on Jabari Wade! And-1! Shai Mobley to the line for 1. [Team fouls: 3] (Jabari Wade: 1 personal fouls)   FT 1/1: GOOD Shai Mobley makes 1/1 from the line.
Score: 73-69

[07:50] Team_004 possession (Score: 73-69)
Draymond Fox attempts a Layup. Contested by De'Aaron Allen (5.3 feet, ZONE). Draymond Fox misses. Rebound secured by Shai Mobley.

[07:33] Team_049 possession (Score: 73-69)
Shai Bird drives to the basket... Shai Bird throws a bad pass! Stolen by Anthony Lillard! TURNOVER! (live ball)

[07:19] Team_004 possession (Score: 73-69)
Michael Curry attempts a 3Pt. Contested by Shai Bird (5.1 feet, MAN). Michael Curry misses. FOUL! Loose ball foul on Jimmy Griffin during the rebound battle. [Team fouls: 2] No free throws, side out. (Jimmy Griffin: 1 personal fouls)

[07:03] Team_004 possession (Score: 73-69)
Draymond Fox attempts a 3Pt. Contested by De'Aaron Allen (5.4 feet, MAN). Draymond Fox misses. Rebound secured by Jimmy Griffin.

[06:49] Team_049 possession (Score: 73-69)
De'Aaron Allen attempts a 3Pt. Contested by Michael Curry (5.7 feet, ZONE). De'Aaron Allen misses. Rebound secured by Dwyane Irving.

[06:38] Team_004 possession (Score: 73-69)
Jabari Wade drives, picks up Ja Oladipo. Help arrives from Jimmy Griffin! Jabari Wade attempts a Dunk. Contested by Jimmy Griffin (5.8 feet, MAN). JABARI WADE MAKES IT! Assist: Draymond Fox
Score: 75-69

[06:24] Team_049 possession (Score: 75-69)
Jimmy Griffin attempts a 3Pt. Contested by Michael Curry (5.9 feet, ZONE). Jimmy Griffin misses. Rebound secured by Anthony Lillard.

[06:09] Team_004 possession (Score: 75-69)
Michael Curry attempts a 3Pt. Contested by Shai Bird (5.2 feet, MAN). Michael Curry misses. Rebound secured by Jimmy Griffin.

[05:51] Team_049 possession (Score: 75-69)
De'Aaron Allen attempts a 3Pt. Contested by Draymond Fox (5.1 feet, MAN). De'Aaron Allen misses. Rebound secured by Dwyane Irving.

[05:37] Team_004 possession (Score: 75-69)
Anthony Lillard attempts a Midrange. Contested by Ja Oladipo (5.6 feet, ZONE). Anthony Lillard misses. Rebound secured by Shai Mobley.

[05:25] Team_049 possession (Score: 75-69)
Shai Bird loses the ball! Stripped by Michael Curry! TURNOVER! (live ball)

[05:09] Team_004 possession (Score: 75-69)
Draymond Fox attempts a 3Pt. Contested by Ja Oladipo (5.7 feet, ZONE). Draymond Fox misses. Rebound secured by De'Aaron Allen.

[04:55] Team_049 possession (Score: 75-69)
Shai Mobley drives, Anthony Lillard stays with him. Shai Mobley attempts a Dunk. Contested by Anthony Lillard (5.8 feet, ZONE). SHAI MOBLEY MAKES IT! Assist: Shai Bird
Score: 75-71

[04:39] Team_004 possession (Score: 75-71)
Draymond Fox attempts a 3Pt. Contested by De'Aaron Allen (5.7 feet, MAN). Draymond Fox misses. Rebound secured by Shai Mobley.

[04:27] Team_049 possession (Score: 75-71)
Ja Oladipo drives, picks up Jabari Wade. Help arrives from Dwyane Irving! Ja Oladipo attempts a Layup. Wide open! Dwyane Irving is 6.2 feet away. [MAN] JA OLADIPO MAKES IT!
Score: 75-73

[04:09] Team_004 possession (Score: 75-73)
Draymond Fox attempts a Layup. Contested by De'Aaron Allen (5.7 feet, MAN). Draymond Fox misses. Rebound secured by Jimmy Griffin.

[03:54] Team_049 possession (Score: 75-73)
Shai Bird drives, picks up Anthony Lillard. Help arrives from Jabari Wade! Shai Bird attempts a Dunk. Wide open! Jabari Wade is 6.0 feet away. [ZONE] SHAI BIRD MAKES IT! Assist: Jimmy Griffin
Score: 75-75

[03:43] Team_004 possession (Score: 75-75)
Draymond Fox attempts a Midrange. Contested by Ja Oladipo (5.9 feet, ZONE). DRAYMOND FOX MAKES IT! Assist: Anthony Lillard
Score: 77-75

[03:24] Team_049 possession (Score: 77-75)
De'Aaron Allen drives and kicks out. Ja Oladipo attempts a Midrange. Wide open! Jabari Wade is 6.4 feet away. [MAN] Ja Oladipo misses. Rebound secured by Dwyane Irving.

[03:10] Team_004 possession (Score: 77-75)
Anthony Lillard attempts a 3Pt. Contested by Ja Oladipo (5.9 feet, ZONE). Anthony Lillard misses. Rebound secured by Shai Mobley.

[02:52] Team_049 possession (Score: 77-75)
Ja Oladipo attempts a 3Pt. Wide open! Michael Curry is 6.5 feet away. [ZONE] Ja Oladipo misses. Rebound secured by Anthony Lillard.

[02:34] Team_004 possession (Score: 77-75)
Jabari Wade attempts a 3Pt. Wide open! Jimmy Griffin is 6.6 feet away. [ZONE] JABARI WADE MAKES IT! Assist: Dwyane Irving
Score: 80-75

[02:21] Team_049 possession (Score: 80-75)
Shai Bird attempts a Layup. Wide open! Michael Curry is 6.7 feet away. [MAN] SHAI BIRD MAKES IT! Assist: Jimmy Griffin
Score: 80-77

[02:09] Team_004 possession (Score: 80-77)
Anthony Lillard attempts a Layup. Wide open! Shai Mobley is 6.0 feet away. [MAN] ANTHONY LILLARD MAKES IT! Assist: Jabari Wade
Score: 82-77

[01:55] Team_049 possession (Score: 82-77)
Shai Bird drives, picks up Michael Curry. Help arrives from Dwyane Irving! Shai Bird attempts a Layup. Wide open! Dwyane Irving is 6.7 feet away. [MAN] SHAI BIRD MAKES IT!
Score: 82-79

[01:39] Team_004 possession (Score: 82-79)
Michael Curry attempts a 3Pt. Wide open! Ja Oladipo is 6.0 feet away. [ZONE] Michael Curry misses. Rebound secured by Shai Mobley.

[01:27] Team_049 possession (Score: 82-79)
Jimmy Griffin attempts a 3Pt. Contested by Dwyane Irving (5.2 feet, MAN). Jimmy Griffin misses. Rebound secured by Draymond Fox.

[01:12] Team_004 possession (Score: 82-79)
Michael Curry attempts a 3Pt. Wide open! Ja Oladipo is 6.1 feet away. [ZONE] Michael Curry misses. Rebound secured by Shai Mobley.

[01:01] Team_049 possession (Score: 82-79)
Jimmy Griffin attempts a 3Pt. Contested by Dwyane Irving (5.3 feet, MAN). Jimmy Griffin misses. Offensive rebound by De'Aaron Allen! De'Aaron Allen kicks it out.

[00:48] Team_049 possession (Score: 82-79)
FOUL! Shooting foul on Jabari Wade. De'Aaron Allen to the line for 2 free throws. [Team fouls: 4] (Jabari Wade: 2 personal fouls)   FT 1/2: GOOD   FT 2/2: GOOD De'Aaron Allen makes 2/2 from the line.
Score: 82-81

[00:33] Team_004 possession (Score: 82-81)
Jabari Wade attempts a Midrange. Wide open! Ja Oladipo is 6.5 feet away. [MAN] Jabari Wade misses. Rebound secured by Jimmy Griffin.

[00:22] Team_049 possession (Score: 82-81)
Shai Mobley attempts a Midrange. Wide open! Anthony Lillard is 6.6 feet away. [MAN] Shai Mobley misses. FOUL! Loose ball foul on Draymond Fox during the rebound battle. [IN THE BONUS! 5 team fouls] De'Aaron Allen to the line for 2 free throws. (Draymond Fox: 2 personal fouls)   FT 1/2: GOOD   FT 2/2: GOOD De'Aaron Allen makes 2/2 from the line.
Score: 82-83

[00:07] Team_004 possession (Score: 82-83)
Dwyane Irving drives, De'Aaron Allen stays with him. Dwyane Irving attempts a Dunk. Wide open! De'Aaron Allen is 6.3 feet away. [ZONE] Dwyane Irving misses. Rebound secured by Shai Mobley.

================================================================================
                              4TH QUARTER COMPLETE                              
================================================================================

4TH QUARTER SCORE: Team_004 17, Team_049 22

BOX SCORE:
================================================================================

Team_004
--------------------------------------------------------------------------------
Player                MIN  PTS  REB  AST  TO      FG   FG%      3P   3P%
--------------------------------------------------------------------------------
Jabari Wade            48    7    0    2   0   3/4    75.0     0/0   0.0
Draymond Fox           48    6    1    1   0   3/8    37.5     0/0   0.0
Anthony Lillard        48    4    4    2   0   2/6    33.3     0/0   0.0
Dwyane Irving          48    0    7    1   0   0/1     0.0     0/0   0.0
Michael Curry          48    0    0    0   0   0/3     0.0     0/0   0.0

TEAM: FG: 8/22 (36.4%), 3PT: 1/8 (12.5%), REB: 12 (3 off, 9 def), AST: 6, TO: 0
TEAM FOULS: 5 [Team_049 in BONUS]


Team_049
--------------------------------------------------------------------------------
Player                MIN  PTS  REB  AST  TO      FG   FG%      3P   3P%
--------------------------------------------------------------------------------
De'Aaron Allen         48    6    3    0   0   3/7    42.9     0/0   0.0
Shai Bird              48    6    0    1   0   3/4    75.0     0/0   0.0
Ja Oladipo             48    5    0    0   0   2/4    50.0     0/0   0.0
Shai Mobley            48    5    7    0   0   2/2   100.0     0/0   0.0
Jimmy Griffin          48    0    5    3   0   0/2     0.0     0/0   0.0

TEAM: FG: 10/19 (52.6%), 3PT: 1/9 (11.1%), REB: 15 (2 off, 13 def), AST: 4, TO: 2
TEAM FOULS: 2

================================================================================

================================================================================
                               FULL GAME COMPLETE                               
================================================================================

FINAL SCORE: Team_004 82, Team_049 83

SCORING BY QUARTER:
--------------------------------------------------------------------------------
Team                     Q1     Q2     Q3     Q4    FINAL
--------------------------------------------------------------------------------
Team_004                 18     24     23     17       82
Team_049                 19     20     22     22       83
--------------------------------------------------------------------------------

FULL GAME BOX SCORE:
================================================================================

Team_004
--------------------------------------------------------------------------------
Player                MIN  PTS  REB  AST  TO      FG   FG%      3P   3P%      FT STL BLK
--------------------------------------------------------------------------------
Michael Curry          48   17    0    0   1   7/20   35.0   2/9    22.2   1/1     1   1
Jabari Wade            48   19    0    9   0  10/16   62.5   4/7    57.1   2/2     0   0
Dwyane Irving          48   22   16    5   0   7/14   50.0   2/7    28.6   9/10    0   1
Draymond Fox           48   11    9    3   1   5/14   35.7   1/4    25.0   0/0     2   0
Anthony Lillard        48   10   23    3   2   4/11   36.4   0/2     0.0   2/2     2   1
Karl Reaves             0    0    0    0   0   0/0     0.0   0/0     0.0   0/0     0   0
Russell Barnes          0    0    0    0   0   0/0     0.0   0/0     0.0   0/0     0   0
Kristaps Green          0    2    0    0   0   1/1   100.0   0/0     0.0   0/0     0   0
Michael Sabonis         0    0    1    1   0   0/0     0.0   0/0     0.0   0/0     0   0
Shai Beal               0    0    0    0   0   0/0     0.0   0/0     0.0   0/0     0   0

TEAM: FG: 35/77 (45.5%), 3PT: 9/29 (31.0%), REB: 50 (14 off, 36 def), AST: 21, TO: 4


Team_049
--------------------------------------------------------------------------------
Player                MIN  PTS  REB  AST  TO      FG   FG%      3P   3P%      FT STL BLK
--------------------------------------------------------------------------------
Shai Bird              48   15    0    4   4   7/16   43.8   2/8    25.0   3/4     0   0
Ja Oladipo             48   21    0    0   0   7/12   58.3   4/9    44.4   0/1     0   0
Jimmy Griffin          48   12   16    4   0   5/13   38.5   3/8    37.5   1/1     0   1
De'Aaron Allen         48   12   21    1   3   5/12   41.7   1/4    25.0   8/10    2   2
Shai Mobley            48   19   22    6   3   9/15   60.0   1/4    25.0   4/4     0   0
Shaquille Lillard       0    0    0    0   0   0/0     0.0   0/0     0.0   0/0     0   0
Shai Jordan             0    0    0    0   0   0/0     0.0   0/0     0.0   0/0     0   0
Desmond Towns           0    0    0    0   0   0/0     0.0   0/0     0.0   0/0     0   0
Giannis Anunoby         0    0    0    0   0   0/0     0.0   0/0     0.0   0/0     0   0
Miles Jackson           0    0    0    0   0   0/1     0.0   0/0     0.0   0/0     0   0

TEAM: FG: 33/70 (47.1%), 3PT: 11/33 (33.3%), REB: 58 (18 off, 40 def), AST: 15, TO: 10

================================================================================
