================================================================================
                        FULL GAME - Team_081 vs Team_030                        
================================================================================

================================================================================
                       1ST QUARTER - Team_081 vs Team_030                       
================================================================================

[12:00] Team_081 possession (Score: 0-0)
Vince Adebayo attempts a Midrange. Contested by Tim Barrett (4.8 feet, ZONE). Vince Adebayo misses. Offensive rebound by Bradley Sabonis! Bradley Sabonis kicks it out.

[11:48] Team_081 possession (Score: 0-0)
Franz Antetokounmpo attempts a Midrange. Contested by Jaren Green (4.1 feet, MAN). Franz Antetokounmpo misses. Rebound secured by Joel Anunoby.

[11:32] Team_030 possession (Score: 0-0)
Tim Barrett attempts a 3Pt. Contested by Bradley Leonard (3.7 feet, MAN). Tim Barrett misses. Rebound secured by Bradley Sabonis.

[11:19] Team_081 possession (Score: 0-0)
Vince Adebayo attempts a Midrange. Contested by Tim Barrett (4.8 feet, ZONE). VINCE ADEBAYO MAKES IT!
Score: 2-0

[11:04] Team_030 possession (Score: 2-0)
Tim Barrett attempts a Layup. BLOCKED BY FRANZ ANTETOKOUNMPO! Ball deflects out of bounds off Tim Barrett.

[10:50] Team_081 possession (Score: 2-0)
Bradley Leonard drives and kicks out. Franz Antetokounmpo attempts a 3Pt. Contested by Tyler Beal (4.2 feet, ZONE). Franz Antetokounmpo misses. Offensive rebound by Bradley Sabonis! Bradley Sabonis kicks it out.

[10:34] Team_081 possession (Score: 2-0)
FOUL! Reach-in foul on Tim Barrett during the drive. [Team fouls: 1] No free throws, side out. (Tim Barrett: 1 personal fouls)

[10:24] Team_081 possession (Score: 2-0)
Bradley Sabonis drives, Jordan Nowitzki stays with him. Bradley Sabonis attempts a Dunk. Contested by Jordan Nowitzki (4.2 feet, MAN). BRADLEY SABONIS MAKES IT!
Score: 4-0

[10:08] Team_030 possession (Score: 4-0)
Tim Barrett attempts a 3Pt. Contested by Vince Adebayo (3.4 feet, ZONE). Tim Barrett misses. Rebound secured by Bradley Sabonis.

[09:56] Team_081 possession (Score: 4-0)
Franz Antetokounmpo drives and kicks out. Bradley Sabonis attempts a 3Pt. Contested by Tyler Beal (4.2 feet, ZONE). Bradley Sabonis misses. Offensive rebound by Bradley Sabonis! Bradley Sabonis kicks it out.

[09:44] Team_081 possession (Score: 4-0)
Bradley Sabonis attempts a Midrange. Contested by Jordan Nowitzki (4.2 feet, MAN). Bradley Sabonis misses. Rebound secured by Jaren Green.

[09:30] Team_030 possession (Score: 4-0)
Tim Barrett drives, picks up Franz Antetokounmpo. Help arrives from Bradley Leonard! Tim Barrett attempts a Layup. Contested by Bradley Leonard (4.2 feet, ZONE). TIM BARRETT MAKES IT!
Score: 4-2

[09:15] Team_081 possession (Score: 4-2)
Vince Adebayo attempts a Layup. BLOCKED BY JAREN GREEN! Ball is loose! Rebound secured by Jordan Nowitzki.

[09:02] Team_030 possession (Score: 4-2)
Tim Barrett attempts a 3Pt. Contested by Bradley Leonard (3.7 feet, MAN). Tim Barrett misses. Rebound secured by Vince Adebayo.

[08:49] Team_081 possession (Score: 4-2)
Franz Antetokounmpo loses the ball! Stripped by Jaren Green! TURNOVER! (live ball)

[08:32] Team_030 possession (Score: 4-2)
FOUL! Shooting foul on Bradley Leonard. Jaren Green to the line for 2 free throws. [Team fouls: 1] (Bradley Leonard: 1 personal fouls)   FT 1/2: GOOD   FT 2/2: GOOD Jaren Green makes 2/2 from the line.
Score: 4-4

[08:16] Team_081 possession (Score: 4-4)
Vince Adebayo attempts a 3Pt. Contested by Tyler Beal (4.2 feet, ZONE). Vince Adebayo misses. Rebound secured by Jordan Nowitzki.

[08:03] Team_030 possession (Score: 4-4)
Tim Barrett attempts a Layup. Contested by Bradley Leonard (3.7 feet, MAN). Tim Barrett misses. Rebound secured by Bradley Sabonis.

[07:46] Team_081 possession (Score: 4-4)
Julius Durant drives, picks up Tyler Beal. Help arrives from Joel Anunoby! Julius Durant attempts a Dunk. Contested by Joel Anunoby (4.3 feet, MAN). JULIUS DURANT MAKES IT! Assist: Bradley Leonard
Score: 6-4

[07:36] Team_030 possession (Score: 6-4)
Tyler Beal attempts a 3Pt. Contested by Julius Durant (4.3 feet, MAN). Tyler Beal misses. Rebound secured by Vince Adebayo.

[07:20] Team_081 possession (Score: 6-4)
Julius Durant attempts a 3Pt. Contested by Tyler Beal (4.3 feet, MAN). Julius Durant misses. Rebound secured by Jordan Nowitzki.

[07:06] Team_030 possession (Score: 6-4)
Jaren Green attempts a Layup. Contested by Franz Antetokounmpo (5.1 feet, MAN). JAREN GREEN MAKES IT!
Score: 6-6

[06:49] Team_081 possession (Score: 6-6)
Julius Durant attempts a Layup. Contested by Jaren Green (4.1 feet, ZONE). JULIUS DURANT MAKES IT! Assist: Vince Adebayo
Score: 8-6

[06:36] Team_030 possession (Score: 8-6)
Tim Barrett attempts a 3Pt. Contested by Bradley Leonard (3.7 feet, MAN). Tim Barrett misses. Rebound secured by Franz Antetokounmpo.

[06:22] Team_081 possession (Score: 8-6)
Bradley Leonard makes the Layup and draws the foul on Tim Barrett! And-1! Bradley Leonard to the line for 1. [Team fouls: 2] (Tim Barrett: 2 personal fouls)   FT 1/1: GOOD Bradley Leonard makes 1/1 from the line.
Score: 11-6

[06:03] Team_030 possession (Score: 11-6)
Jordan Nowitzki drives, picks up Bradley Sabonis. Help arrives from Bradley Leonard! Jordan Nowitzki attempts a Layup. Contested by Bradley Leonard (4.5 feet, MAN). Jordan Nowitzki misses. Rebound secured by Franz Antetokounmpo.

[05:49] Team_081 possession (Score: 11-6)
Bradley Sabonis drives, Jordan Nowitzki stays with him. Bradley Sabonis attempts a Dunk. Contested by Jordan Nowitzki (4.2 feet, MAN). BRADLEY SABONIS MAKES IT!
Score: 13-6

[05:35] Team_030 possession (Score: 13-6)
Tim Barrett attempts a 3Pt. Contested by Vince Adebayo (3.4 feet, ZONE). Tim Barrett misses. Rebound secured by Franz Antetokounmpo.

[05:25] Team_081 possession (Score: 13-6)
Bradley Leonard attempts a Midrange. Contested by Tim Barrett (4.9 feet, MAN). Bradley Leonard misses. Rebound secured by Joel Anunoby.

[05:10] Team_030 possession (Score: 13-6)
Tim Barrett drives and kicks out. Joel Anunoby attempts a 3Pt. Contested by Vince Adebayo (3.5 feet, MAN). Joel Anunoby misses. Rebound secured by Franz Antetokounmpo.

[04:57] Team_081 possession (Score: 13-6)
Bradley Sabonis attempts a 3Pt. Contested by Tyler Beal (4.1 feet, ZONE). Bradley Sabonis misses. Rebound secured by Joel Anunoby.

[04:42] Team_030 possession (Score: 13-6)
Tim Barrett attempts a 3Pt. Contested by Bradley Leonard (3.7 feet, ZONE). TIM BARRETT MAKES IT! Assist: Jordan Nowitzki
Score: 13-9

[04:31] Team_081 possession (Score: 13-9)
Vince Adebayo attempts a 3Pt. Contested by Joel Anunoby (3.5 feet, MAN). Vince Adebayo misses. Rebound secured by Joel Anunoby.

[04:17] Team_030 possession (Score: 13-9)
FOUL! Reach-in foul on Bradley Sabonis during the drive. [Team fouls: 2] No free throws, side out. (Bradley Sabonis: 1 personal fouls)

[04:04] Team_030 possession (Score: 13-9)
Tyler Beal attempts a 3Pt. Contested by Julius Durant (4.4 feet, MAN). Tyler Beal misses. Rebound secured by Bradley Sabonis.

[03:48] Team_081 possession (Score: 13-9)
Franz Antetokounmpo attempts a Midrange. Contested by Jaren Green (4.2 feet, MAN). FRANZ ANTETOKOUNMPO MAKES IT!
Score: 15-9

[03:38] Team_030 possession (Score: 15-9)
FOUL! Reach-in foul on Bradley Sabonis during the drive. [Team fouls: 3] No free throws, side out. (Bradley Sabonis: 2 personal fouls)

[03:23] Team_030 possession (Score: 15-9)
Tim Barrett attempts a Layup. Contested by Franz Antetokounmpo (4.4 feet, ZONE). TIM BARRETT MAKES IT! Assist: Jordan Nowitzki
Score: 15-11

[03:10] Team_081 possession (Score: 15-11)
Bradley Sabonis throws a bad pass out of bounds! TURNOVER! (dead ball)

[03:10] Substitution (Team_081): Vince Adebayo OUT → Larry Adebayo IN (stamina_rule2)

[02:57] Team_030 possession (Score: 15-11)
Tyler Beal attempts a 3Pt. Contested by Bradley Leonard (4.1 feet, ZONE). Tyler Beal misses. Offensive rebound by Joel Anunoby! Joel Anunoby kicks it out.

[02:44] Team_030 possession (Score: 15-11)
Jordan Nowitzki drives, Franz Antetokounmpo stays with him. Jordan Nowitzki attempts a Layup. Contested by Franz Antetokounmpo (5.0 feet, ZONE). Jordan Nowitzki misses. Rebound secured by Larry Adebayo.

[02:31] Team_081 possession (Score: 15-11)
FOUL! Reach-in foul on Jaren Green during the drive. [Team fouls: 3] No free throws, side out. (Jaren Green: 1 personal fouls)

[02:19] Team_081 possession (Score: 15-11)
Larry Adebayo attempts a Layup. BLOCKED BY JOEL ANUNOBY! Ball is loose! Rebound secured by Joel Anunoby.

[02:01] Team_030 possession (Score: 15-11)
Joel Anunoby makes the Layup and draws the foul on Franz Antetokounmpo! And-1! Joel Anunoby to the line for 1. [Team fouls: 4] (Franz Antetokounmpo: 1 personal fouls)   FT 1/1: GOOD Joel Anunoby makes 1/1 from the line.
Score: 15-14

[01:45] Team_081 possession (Score: 15-14)
Franz Antetokounmpo drives, Jaren Green stays with him. Franz Antetokounmpo attempts a Dunk. Contested by Jaren Green (4.5 feet, MAN). FRANZ ANTETOKOUNMPO MAKES IT! Assist: Bradley Sabonis
Score: 17-14

[01:31] Team_030 possession (Score: 17-14)
Tim Barrett attempts a 3Pt. Contested by Bradley Leonard (4.0 feet, MAN). TIM BARRETT MAKES IT!
Score: 17-17

[01:18] Team_081 possession (Score: 17-17)
Larry Adebayo drives, picks up Jaren Green. Help arrives from Tyler Beal! Larry Adebayo attempts a Layup. Contested by Tyler Beal (4.4 feet, ZONE). Larry Adebayo misses. Offensive rebound by Bradley Sabonis! Bradley Sabonis kicks it out.

[01:04] Team_081 possession (Score: 17-17)
Bradley Leonard drives, Jaren Green stays with him. Bradley Leonard attempts a Dunk. Contested by Jaren Green (4.6 feet, ZONE). BRADLEY LEONARD MAKES IT!
Score: 19-17

[00:48] Team_030 possession (Score: 19-17)
Tyler Beal loses control! Ball rolls out of bounds! TURNOVER! (dead ball)

[00:48] Substitution (Team_081): Julius Durant OUT → Dejounte Bane IN (stamina_rule2)

[00:48] Substitution (Team_081): Bradley Leonard OUT → Lamelo Wade IN (stamina_rule2)

[00:48] Substitution (Team_081): Bradley Sabonis OUT → Chris Holiday IN (stamina_rule2)

[00:48] Substitution (Team_081): Franz Antetokounmpo OUT → D'Angelo Markkanen IN (stamina_rule2)

[00:48] Substitution (Team_030): Tyler Beal OUT → RJ Carter IN (stamina_rule2)

[00:48] Substitution (Team_030): Tim Barrett OUT → Josh Smith IN (stamina_rule2)

[00:48] Substitution (Team_030): Joel Anunoby OUT → Pau James IN (stamina_rule2)

[00:48] Substitution (Team_030): Jordan Nowitzki OUT → Damian Green IN (stamina_rule2)

[00:48] Substitution (Team_030): Jaren Green OUT → Franz Anunoby IN (stamina_rule2)

[00:34] Team_081 possession (Score: 19-17)
Larry Adebayo drives to the basket... Larry Adebayo throws a bad pass! Stolen by Pau James! TURNOVER! (live ball)

[00:22] Team_030 possession (Score: 19-17)
Josh Smith attempts a Midrange. Contested by Larry Adebayo (5.4 feet, ZONE). JOSH SMITH MAKES IT!
Score: 19-19

[00:09] Team_081 possession (Score: 19-19)
Chris Holiday attempts a 3Pt. Contested by RJ Carter (5.7 feet, ZONE). Chris Holiday misses. Offensive rebound by Lamelo Wade! Lamelo Wade kicks it out.

================================================================================
                              1ST QUARTER COMPLETE                              
================================================================================

1ST QUARTER SCORE: Team_081 19, Team_030 19

BOX SCORE:
================================================================================

Team_081
--------------------------------------------------------------------------------
Player                MIN  PTS  REB  AST  TO      FG   FG%      3P   3P%
--------------------------------------------------------------------------------
Bradley Leonard        11    5    0    1   0   2/3    66.7     0/0   0.0
Bradley Sabonis        11    4    8    1   0   2/4    50.0     0/0   0.0
Franz Antetokounmpo    11    4    4    0   0   2/3    66.7     0/0   0.0
Julius Durant          11    4    0    0   0   2/3    66.7     0/0   0.0
Vince Adebayo           9    2    2    1   0   1/4    25.0     0/0   0.0
Larry Adebayo           3    0    1    0   0   0/1     0.0     0/0   0.0
Lamelo Wade             1    0    1    0   0   0/0     0.0     0/0   0.0

TEAM: FG: 9/18 (50.0%), 3PT: 0/4 (0.0%), REB: 16 (5 off, 11 def), AST: 3, TO: 3
TEAM FOULS: 4


Team_030
--------------------------------------------------------------------------------
Player                MIN  PTS  REB  AST  TO      FG   FG%      3P   3P%
--------------------------------------------------------------------------------
Tim Barrett            11   10    0    0   0   4/12   33.3     0/0   0.0
Jaren Green            11    4    1    0   0   2/2   100.0     0/0   0.0
Joel Anunoby           11    3    6    0   0   1/1   100.0     0/0   0.0
Josh Smith              1    2    0    0   0   1/1   100.0     0/0   0.0
Jordan Nowitzki        11    0    3    2   0   0/2     0.0     0/0   0.0
Tyler Beal             11    0    0    0   0   0/2     0.0     0/0   0.0

TEAM: FG: 8/20 (40.0%), 3PT: 2/9 (22.2%), REB: 10 (1 off, 9 def), AST: 2, TO: 1
TEAM FOULS: 3

================================================================================

================================================================================
                       2ND QUARTER - Team_081 vs Team_030                       
================================================================================

[12:00] Team_081 possession (Score: 19-19)
Julius Durant attempts a 3Pt. BLOCKED BY TYLER BEAL! Ball is loose! Rebound secured by Jaren Green.

[11:51] Team_030 possession (Score: 19-19)
Joel Anunoby drives and kicks out. Tyler Beal attempts a 3Pt. Contested by Vince Adebayo (3.4 feet, ZONE). Tyler Beal misses. Rebound secured by Franz Antetokounmpo.

[11:38] Team_081 possession (Score: 19-19)
Bradley Sabonis attempts a 3Pt. Contested by Tyler Beal (4.3 feet, ZONE). BRADLEY SABONIS MAKES IT! Assist: Vince Adebayo
Score: 22-19

[11:24] Team_030 possession (Score: 22-19)
Joel Anunoby attempts a 3Pt. Contested by Vince Adebayo (3.8 feet, MAN). JOEL ANUNOBY MAKES IT!
Score: 22-22

[11:13] Team_081 possession (Score: 22-22)
Julius Durant throws a bad pass! Stolen by Tyler Beal! TURNOVER! (live ball)

[10:59] Team_030 possession (Score: 22-22)
Tim Barrett attempts a 3Pt. Contested by Bradley Leonard (4.0 feet, MAN). Tim Barrett misses. Offensive rebound by Joel Anunoby! Joel Anunoby kicks it out.

[10:42] Team_030 possession (Score: 22-22)
Jaren Green attempts a Midrange. Contested by Franz Antetokounmpo (5.4 feet, MAN). Jaren Green misses. Rebound secured by Vince Adebayo.

[10:23] Team_081 possession (Score: 22-22)
Franz Antetokounmpo attempts a Layup. Contested by Jordan Nowitzki (4.8 feet, ZONE). FRANZ ANTETOKOUNMPO MAKES IT! Assist: Bradley Leonard
Score: 24-22

[10:11] Team_030 possession (Score: 24-22)
Joel Anunoby attempts a 3Pt. Contested by Vince Adebayo (3.9 feet, ZONE). Joel Anunoby misses. Rebound secured by Franz Antetokounmpo.

[09:56] Team_081 possession (Score: 24-22)
Vince Adebayo attempts a 3Pt. Contested by Tyler Beal (4.6 feet, ZONE). Vince Adebayo misses. Rebound secured by Joel Anunoby.

[09:39] Team_030 possession (Score: 24-22)
Tim Barrett attempts a 3Pt. Contested by Julius Durant (4.4 feet, ZONE). Tim Barrett misses. Rebound secured by Bradley Sabonis.

[09:23] Team_081 possession (Score: 24-22)
Bradley Sabonis makes the Midrange and draws the foul on Jordan Nowitzki! And-1! Bradley Sabonis to the line for 1. [Team fouls: 1] (Jordan Nowitzki: 1 personal fouls)   FT 1/1: MISS Bradley Sabonis makes 0/1 from the line. Offensive rebound by Vince Adebayo! Vince Adebayo kicks it out.
Score: 26-22

[09:13] Team_081 possession (Score: 26-22)
FOUL! Shooting foul on Joel Anunoby. Bradley Sabonis to the line for 2 free throws. [Team fouls: 2] (Joel Anunoby: 1 personal fouls)   FT 1/2: GOOD   FT 2/2: GOOD Bradley Sabonis makes 2/2 from the line.
Score: 28-22

[08:57] Team_030 possession (Score: 28-22)
Jordan Nowitzki makes the Layup and draws the foul on Franz Antetokounmpo! And-1! Jordan Nowitzki to the line for 1. [Team fouls: 1] (Franz Antetokounmpo: 1 personal fouls)   FT 1/1: GOOD Jordan Nowitzki makes 1/1 from the line.
Score: 28-25

[08:43] Team_081 possession (Score: 28-25)
Bradley Leonard attempts a 3Pt. Contested by Tyler Beal (4.9 feet, ZONE). Bradley Leonard misses. Offensive rebound by Franz Antetokounmpo! Franz Antetokounmpo's putback is no good. Offensive rebound by Vince Adebayo! Vince Adebayo kicks it out.

[08:27] Team_081 possession (Score: 28-25)
FOUL! Reach-in foul on Jaren Green during the drive. [Team fouls: 4] No free throws, side out. (Jaren Green: 2 personal fouls)

[08:10] Team_081 possession (Score: 28-25)
Bradley Leonard attempts a Midrange. Contested by Jordan Nowitzki (5.1 feet, ZONE). Bradley Leonard misses. Rebound secured by Jordan Nowitzki.

[07:51] Team_030 possession (Score: 28-25)
Tyler Beal drives, Julius Durant stays with him. Tyler Beal attempts a Dunk. Contested by Julius Durant (4.9 feet, MAN). TYLER BEAL MAKES IT! Assist: Jaren Green
Score: 28-27

[07:32] Team_081 possession (Score: 28-27)
Bradley Leonard drives to the basket... Bradley Leonard throws a bad pass! Stolen by Jaren Green! TURNOVER! (live ball)

[07:16] Team_030 possession (Score: 28-27)
Tyler Beal drives, Julius Durant stays with him. Tyler Beal attempts a Dunk. Contested by Julius Durant (4.9 feet, MAN). TYLER BEAL MAKES IT! Assist: Tim Barrett
Score: 28-29

[06:59] Team_081 possession (Score: 28-29)
Franz Antetokounmpo attempts a Midrange. Contested by Jaren Green (4.9 feet, MAN). Franz Antetokounmpo misses. Offensive rebound by Franz Antetokounmpo! Franz Antetokounmpo puts it back in!
Score: 30-29

[06:42] Team_030 possession (Score: 30-29)
Joel Anunoby attempts a 3Pt. Contested by Vince Adebayo (4.2 feet, ZONE). JOEL ANUNOBY MAKES IT! Assist: Jordan Nowitzki
Score: 30-32

[06:26] Team_081 possession (Score: 30-32)
Bradley Leonard attempts a 3Pt. Contested by Tyler Beal (5.1 feet, ZONE). BRADLEY LEONARD MAKES IT! Assist: Vince Adebayo
Score: 33-32

[06:11] Team_030 possession (Score: 33-32)
Jordan Nowitzki drives, Bradley Sabonis stays with him. Jordan Nowitzki attempts a Layup. Contested by Bradley Sabonis (5.3 feet, MAN). JORDAN NOWITZKI MAKES IT! Assist: Jaren Green
Score: 33-34

[06:00] Team_081 possession (Score: 33-34)
Bradley Sabonis attempts a 3Pt. Contested by Jordan Nowitzki (5.1 feet, MAN). Bradley Sabonis misses. Rebound secured by Joel Anunoby.

[05:48] Team_030 possession (Score: 33-34)
FOUL! Holding foul on Vince Adebayo. [Team fouls: 2] No free throws, side out. (Vince Adebayo: 1 personal fouls)

[05:35] Team_030 possession (Score: 33-34)
Tim Barrett drives and kicks out. Jaren Green attempts a Midrange. Contested by Bradley Leonard (4.8 feet, ZONE). Jaren Green misses. Rebound secured by Franz Antetokounmpo.

[05:21] Team_081 possession (Score: 33-34)
FOUL! Shooting foul on Tyler Beal. Julius Durant to the line for 2 free throws. [BONUS: 5 team fouls] (Tyler Beal: 1 personal fouls)   FT 1/2: GOOD   FT 2/2: GOOD Julius Durant makes 2/2 from the line.
Score: 35-34

[05:11] Team_030 possession (Score: 35-34)
FOUL! Offensive foul on Tyler Beal! Julius Durant drew the charge! [Team fouls: 6] (Tyler Beal: 2 personal fouls) TURNOVER! (dead ball)

[04:56] Team_081 possession (Score: 35-34)
Franz Antetokounmpo attempts a Midrange. Contested by Jaren Green (5.2 feet, ZONE). FRANZ ANTETOKOUNMPO MAKES IT!
Score: 37-34

[04:38] Team_030 possession (Score: 37-34)
FOUL! Reach-in foul on Bradley Leonard during the drive. [Team fouls: 3] No free throws, side out. (Bradley Leonard: 1 personal fouls)

[04:22] Team_030 possession (Score: 37-34)
FOUL! Reach-in foul on Julius Durant during the drive. [Team fouls: 4] No free throws, side out. (Julius Durant: 1 personal fouls)

[04:09] Team_030 possession (Score: 37-34)
Joel Anunoby makes the Midrange and draws the foul on Vince Adebayo! And-1! Joel Anunoby to the line for 1. [BONUS: 5 team fouls] (Vince Adebayo: 2 personal fouls)   FT 1/1: MISS Joel Anunoby makes 0/1 from the line. Offensive rebound by Joel Anunoby! Joel Anunoby kicks it out.
Score: 37-36

[03:52] Team_030 possession (Score: 37-36)
Joel Anunoby attempts a 3Pt. Contested by Vince Adebayo (4.6 feet, MAN). Joel Anunoby misses. Rebound secured by Vince Adebayo.

[03:35] Team_081 possession (Score: 37-36)
Bradley Leonard makes the Midrange and draws the foul on Jaren Green! And-1! Bradley Leonard to the line for 1. [BONUS: 7 team fouls] (Jaren Green: 3 personal fouls)   FT 1/1: GOOD Bradley Leonard makes 1/1 from the line.
Score: 40-36

[03:24] Team_030 possession (Score: 40-36)
Joel Anunoby attempts a 3Pt. Contested by Vince Adebayo (4.7 feet, ZONE). Joel Anunoby misses. Rebound secured by Bradley Sabonis.

[03:09] Team_081 possession (Score: 40-36)
Franz Antetokounmpo drives, Jaren Green stays with him. Franz Antetokounmpo attempts a Dunk. Contested by Jaren Green (5.4 feet, MAN). FRANZ ANTETOKOUNMPO MAKES IT! Assist: Bradley Sabonis
Score: 42-36

[02:58] Team_030 possession (Score: 42-36)
Joel Anunoby drives, picks up Franz Antetokounmpo. Help arrives from Bradley Leonard! Joel Anunoby attempts a Layup. Contested by Bradley Leonard (5.9 feet, ZONE). JOEL ANUNOBY MAKES IT! Assist: Jordan Nowitzki
Score: 42-38

[02:43] Team_081 possession (Score: 42-38)
Vince Adebayo attempts a 3Pt. Contested by Joel Anunoby (4.9 feet, MAN). VINCE ADEBAYO MAKES IT! Assist: Franz Antetokounmpo
Score: 45-38

[02:28] Team_030 possession (Score: 45-38)
Jaren Green attempts a Layup. Wide open! Franz Antetokounmpo is 6.3 feet away. [MAN] Jaren Green misses. Rebound secured by Bradley Sabonis.

[02:09] Team_081 possession (Score: 45-38)
Franz Antetokounmpo attempts a Layup. Contested by Jaren Green (5.6 feet, MAN). FRANZ ANTETOKOUNMPO MAKES IT! Assist: Bradley Sabonis
Score: 47-38

[01:54] Team_030 possession (Score: 47-38)
Joel Anunoby attempts a 3Pt. Contested by Vince Adebayo (4.9 feet, MAN). Joel Anunoby misses. Rebound secured by Vince Adebayo.

[01:37] Team_081 possession (Score: 47-38)
Julius Durant attempts a Midrange. Contested by Tyler Beal (5.7 feet, MAN). Julius Durant misses. Offensive rebound by Franz Antetokounmpo! Franz Antetokounmpo kicks it out.

[01:18] Team_081 possession (Score: 47-38)
Julius Durant attempts a 3Pt. Contested by Tyler Beal (5.7 feet, ZONE). Julius Durant misses. Rebound secured by Jordan Nowitzki.

[01:08] Team_030 possession (Score: 47-38)
Jordan Nowitzki drives and kicks out. Jordan Nowitzki makes the Midrange and draws the foul on Bradley Sabonis! And-1! Jordan Nowitzki to the line for 1. [BONUS: 6 team fouls] (Bradley Sabonis: 1 personal fouls)   FT 1/1: GOOD Jordan Nowitzki makes 1/1 from the line.
Score: 47-41

[00:53] Team_081 possession (Score: 47-41)
Bradley Leonard attempts a 3Pt. Contested by Tyler Beal (5.8 feet, ZONE). Bradley Leonard misses. FOUL! Loose ball foul on Jaren Green during the rebound battle. [IN THE BONUS! 8 team fouls] Vince Adebayo to the line for 2 free throws. (Jaren Green: 4 personal fouls)   FT 1/2: GOOD   FT 2/2: GOOD Vince Adebayo makes 2/2 from the line.
Score: 49-41

[00:36] Team_030 possession (Score: 49-41)
Jordan Nowitzki attempts a 3Pt. Contested by Bradley Leonard (5.8 feet, ZONE). Jordan Nowitzki misses. Rebound secured by Bradley Sabonis.

[00:20] Team_081 possession (Score: 49-41)
Vince Adebayo attempts a 3Pt. Contested by Joel Anunoby (5.2 feet, MAN). Vince Adebayo misses. Rebound secured by Joel Anunoby.

[00:07] Team_030 possession (Score: 49-41)
Joel Anunoby attempts a 3Pt. Contested by Vince Adebayo (5.2 feet, MAN). Joel Anunoby misses. Rebound secured by Franz Antetokounmpo.

================================================================================
                              2ND QUARTER COMPLETE                              
================================================================================

2ND QUARTER SCORE: Team_081 30, Team_030 22

BOX SCORE:
================================================================================

Team_081
--------------------------------------------------------------------------------
Player                MIN  PTS  REB  AST  TO      FG   FG%      3P   3P%
--------------------------------------------------------------------------------
Franz Antetokounmpo    24   10    6    1   0   5/5   100.0     0/0   0.0
Bradley Leonard        24    6    0    1   0   2/3    66.7     0/0   0.0
Bradley Sabonis        24    5    4    2   0   2/3    66.7     0/0   0.0
Vince Adebayo          21    5    5    2   0   2/4    50.0     0/0   0.0
Julius Durant          24    2    0    0   0   1/3    33.3     0/0   0.0

TEAM: FG: 12/18 (66.7%), 3PT: 4/9 (44.4%), REB: 15 (4 off, 11 def), AST: 6, TO: 2
TEAM FOULS: 6 [Team_030 in BONUS]


Team_030
--------------------------------------------------------------------------------
Player                MIN  PTS  REB  AST  TO      FG   FG%      3P   3P%
--------------------------------------------------------------------------------
Joel Anunoby           24    8    5    0   0   3/9    33.3     0/0   0.0
Jordan Nowitzki        24    8    2    2   0   3/4    75.0     0/0   0.0
Tyler Beal             24    4    0    0   0   2/2   100.0     0/0   0.0
Jaren Green            24    0    1    2   0   0/2     0.0     0/0   0.0
Tim Barrett            24    0    0    1   0   0/2     0.0     0/0   0.0

TEAM: FG: 8/19 (42.1%), 3PT: 2/9 (22.2%), REB: 8 (2 off, 6 def), AST: 5, TO: 1
TEAM FOULS: 8 [Team_081 in BONUS]

================================================================================

================================================================================
                       3RD QUARTER - Team_081 vs Team_030                       
================================================================================

[12:00] Team_081 possession (Score: 49-41)
Bradley Leonard drives to the basket... Bradley Leonard throws a bad pass! Stolen by Tim Barrett! TURNOVER! (live ball)

[11:42] Team_030 possession (Score: 49-41)
Tim Barrett attempts a Midrange. Contested by Bradley Leonard (3.7 feet, MAN). Tim Barrett misses. FOUL! Loose ball foul on Franz Antetokounmpo during the rebound battle. [Team fouls: 1] No free throws, side out. (Franz Antetokounmpo: 1 personal fouls)

[11:28] Team_030 possession (Score: 49-41)
Joel Anunoby drives, Vince Adebayo stays with him. Joel Anunoby attempts a Dunk. Contested by Vince Adebayo (3.8 feet, MAN). JOEL ANUNOBY MAKES IT!
Score: 49-43

[11:17] Team_081 possession (Score: 49-43)
Bradley Sabonis attempts a Midrange. Contested by Jordan Nowitzki (4.2 feet, MAN). Bradley Sabonis misses. Rebound secured by Joel Anunoby.

[11:04] Team_030 possession (Score: 49-43)
Jordan Nowitzki drives and kicks out. Jordan Nowitzki attempts a 3Pt. Contested by Bradley Sabonis (4.0 feet, MAN). Jordan Nowitzki misses. Rebound secured by Franz Antetokounmpo.

[10:48] Team_081 possession (Score: 49-43)
Julius Durant drives and kicks out. Julius Durant attempts a 3Pt. Contested by Tyler Beal (4.2 feet, ZONE). Julius Durant misses. Offensive rebound by Bradley Sabonis! Bradley Sabonis kicks it out.

[10:32] Team_081 possession (Score: 49-43)
Franz Antetokounmpo attempts a Midrange. Contested by Tim Barrett (4.9 feet, ZONE). Franz Antetokounmpo misses. Offensive rebound by Bradley Sabonis! Bradley Sabonis kicks it out.

[10:17] Team_081 possession (Score: 49-43)
Vince Adebayo attempts a 3Pt. Contested by Jordan Nowitzki (4.3 feet, ZONE). Vince Adebayo misses. Rebound secured by Jordan Nowitzki.

[10:01] Team_030 possession (Score: 49-43)
Joel Anunoby attempts a Layup. Contested by Franz Antetokounmpo (4.6 feet, ZONE). JOEL ANUNOBY MAKES IT! Assist: Jaren Green
Score: 49-45

[09:45] Team_081 possession (Score: 49-45)
Vince Adebayo attempts a 3Pt. Contested by Joel Anunoby (3.5 feet, MAN). Vince Adebayo misses. Rebound secured by Jordan Nowitzki.

[09:26] Team_030 possession (Score: 49-45)
Joel Anunoby attempts a 3Pt. Contested by Bradley Leonard (4.0 feet, ZONE). Joel Anunoby misses. Rebound secured by Franz Antetokounmpo.

[09:16] Team_081 possession (Score: 49-45)
FOUL! Reach-in foul on Jaren Green during the drive. [Team fouls: 1] No free throws, side out. (Jaren Green: 1 personal fouls)

[09:00] Team_081 possession (Score: 49-45)
Vince Adebayo drives to the basket... FOUL! Offensive foul on Vince Adebayo! Jaren Green drew the charge! [Team fouls: 2] (Vince Adebayo: 1 personal fouls) TURNOVER! (dead ball)

[08:43] Team_030 possession (Score: 49-45)
Joel Anunoby attempts a 3Pt. Contested by Vince Adebayo (3.8 feet, MAN). Joel Anunoby misses. Rebound secured by Bradley Sabonis.

[08:32] Team_081 possession (Score: 49-45)
Bradley Sabonis attempts a Layup. Contested by Jaren Green (3.9 feet, ZONE). BRADLEY SABONIS MAKES IT! Assist: Franz Antetokounmpo
Score: 51-45

[08:14] Team_030 possession (Score: 51-45)
FOUL! Shooting foul on Bradley Leonard. Tim Barrett to the line for 2 free throws. [Team fouls: 3] (Bradley Leonard: 1 personal fouls)   FT 1/2: GOOD   FT 2/2: GOOD Tim Barrett makes 2/2 from the line.
Score: 51-47

[08:02] Team_081 possession (Score: 51-47)
FOUL! Shooting foul on Tyler Beal. Julius Durant to the line for 2 free throws. [Team fouls: 2] (Tyler Beal: 1 personal fouls)   FT 1/2: MISS   FT 2/2: GOOD Julius Durant makes 1/2 from the line.
Score: 52-47

[07:49] Team_030 possession (Score: 52-47)
FOUL! Reach-in foul on Franz Antetokounmpo during the drive. [Team fouls: 4] No free throws, side out. (Franz Antetokounmpo: 2 personal fouls)

[07:37] Team_030 possession (Score: 52-47)
FOUL! Holding foul on Julius Durant. [IN THE BONUS! 5 team fouls] Tyler Beal to the line for 2 free throws. (Julius Durant: 1 personal fouls)   FT 1/2: MISS   FT 2/2: GOOD Tyler Beal makes 1/2 from the line.
Score: 52-48

[07:24] Team_081 possession (Score: 52-48)
Franz Antetokounmpo attempts a Midrange. Contested by Jaren Green (4.1 feet, MAN). FRANZ ANTETOKOUNMPO MAKES IT!
Score: 54-48

[07:10] Team_030 possession (Score: 54-48)
Tyler Beal drives and kicks out. Tim Barrett attempts a 3Pt. Contested by Bradley Leonard (3.7 feet, MAN). TIM BARRETT MAKES IT! Assist: Tyler Beal
Score: 54-51

[06:56] Team_081 possession (Score: 54-51)
Bradley Leonard attempts a Midrange. Contested by Tim Barrett (4.9 feet, MAN). Bradley Leonard misses. Rebound secured by Jordan Nowitzki.

[06:41] Team_030 possession (Score: 54-51)
Jaren Green attempts a 3Pt. Contested by Vince Adebayo (4.2 feet, ZONE). Jaren Green misses. Rebound secured by Franz Antetokounmpo.

[06:28] Team_081 possession (Score: 54-51)
Julius Durant attempts a 3Pt. Contested by Tyler Beal (4.3 feet, ZONE). Julius Durant misses. Offensive rebound by Franz Antetokounmpo! Franz Antetokounmpo's putback is no good. Rebound secured by Jaren Green.

[06:10] Team_030 possession (Score: 54-51)
Jaren Green attempts a Midrange. Contested by Franz Antetokounmpo (5.1 feet, MAN). JAREN GREEN MAKES IT! Assist: Tim Barrett
Score: 54-53

[05:51] Team_081 possession (Score: 54-53)
Bradley Sabonis drives, picks up Jaren Green. Help arrives from Tyler Beal! Bradley Sabonis attempts a Dunk. Contested by Tyler Beal (3.9 feet, ZONE). Bradley Sabonis misses. Rebound secured by Jaren Green.

[05:40] Team_030 possession (Score: 54-53)
Joel Anunoby attempts a 3Pt. Contested by Vince Adebayo (3.8 feet, ZONE). Joel Anunoby misses. FOUL! Loose ball foul on Vince Adebayo during the rebound battle. [IN THE BONUS! 6 team fouls] Joel Anunoby to the line for 2 free throws. (Vince Adebayo: 2 personal fouls)   FT 1/2: GOOD   FT 2/2: GOOD Joel Anunoby makes 2/2 from the line.
Score: 54-55

[05:29] Team_081 possession (Score: 54-55)
Bradley Leonard attempts a 3Pt. Contested by Tim Barrett (4.9 feet, MAN). Bradley Leonard misses. Rebound secured by Joel Anunoby.

[05:15] Team_030 possession (Score: 54-55)
Jordan Nowitzki makes the Dunk and draws the foul on Franz Antetokounmpo! And-1! Jordan Nowitzki to the line for 1. [BONUS: 7 team fouls] (Franz Antetokounmpo: 3 personal fouls)   FT 1/1: GOOD Jordan Nowitzki makes 1/1 from the line.
Score: 54-58

[05:00] Team_081 possession (Score: 54-58)
Julius Durant attempts a 3Pt. Contested by Tyler Beal (4.3 feet, ZONE). Julius Durant misses. Rebound secured by Jordan Nowitzki.

[04:46] Team_030 possession (Score: 54-58)
Tyler Beal attempts a 3Pt. Contested by Bradley Leonard (4.0 feet, ZONE). Tyler Beal misses. Rebound secured by Bradley Sabonis.

[04:34] Team_081 possession (Score: 54-58)
Franz Antetokounmpo attempts a 3Pt. Contested by Tim Barrett (4.9 feet, ZONE). FRANZ ANTETOKOUNMPO MAKES IT! Assist: Bradley Leonard
Score: 57-58

[04:23] Team_030 possession (Score: 57-58)
Jordan Nowitzki drives, picks up Franz Antetokounmpo. Help arrives from Bradley Leonard! Jordan Nowitzki attempts a Dunk. Contested by Bradley Leonard (4.8 feet, ZONE). Jordan Nowitzki misses. Rebound secured by Vince Adebayo.

[04:12] Team_081 possession (Score: 57-58)
Vince Adebayo attempts a 3Pt. Contested by Joel Anunoby (3.5 feet, ZONE). Vince Adebayo misses. FOUL! Loose ball foul on Jordan Nowitzki during the rebound battle. [Team fouls: 3] No free throws, side out. (Jordan Nowitzki: 1 personal fouls)

[03:59] Team_081 possession (Score: 57-58)
Julius Durant attempts a Layup. BLOCKED BY JOEL ANUNOBY! Ball goes out off Joel Anunoby. Julius Durant's ball!

[03:41] Team_081 possession (Score: 57-58)
Julius Durant attempts a 3Pt. Contested by Tyler Beal (4.4 feet, MAN). Julius Durant misses. Rebound secured by Jaren Green.

[03:31] Team_030 possession (Score: 57-58)
Tyler Beal throws a bad pass! Stolen by Julius Durant! TURNOVER! (live ball)

[03:18] Team_081 possession (Score: 57-58)
Bradley Leonard attempts a Midrange. Contested by Jaren Green (4.3 feet, ZONE). Bradley Leonard misses. Rebound secured by Joel Anunoby.

[03:01] Team_030 possession (Score: 57-58)
Tim Barrett attempts a 3Pt. Contested by Bradley Leonard (3.9 feet, MAN). Tim Barrett misses. Rebound secured by Vince Adebayo.

[02:46] Team_081 possession (Score: 57-58)
Vince Adebayo drives and kicks out. Bradley Sabonis attempts a 3Pt. Contested by Tyler Beal (4.4 feet, ZONE). BRADLEY SABONIS MAKES IT! Assist: Julius Durant
Score: 60-58

[02:30] Team_030 possession (Score: 60-58)
Tim Barrett attempts a Midrange. Contested by Bradley Leonard (3.9 feet, MAN). TIM BARRETT MAKES IT!
Score: 60-60

[02:19] Team_081 possession (Score: 60-60)
Franz Antetokounmpo drives, picks up Jaren Green. Help arrives from Tyler Beal! Franz Antetokounmpo attempts a Layup. Contested by Tyler Beal (4.4 feet, ZONE). FRANZ ANTETOKOUNMPO MAKES IT!
Score: 62-60

[02:09] Team_030 possession (Score: 62-60)
Jaren Green attempts a 3Pt. Contested by Franz Antetokounmpo (5.3 feet, MAN). Jaren Green misses. Offensive rebound by Joel Anunoby! Joel Anunoby kicks it out.

[01:55] Team_030 possession (Score: 62-60)
Tyler Beal attempts a 3Pt. Contested by Julius Durant (4.5 feet, MAN). Tyler Beal misses. Rebound secured by Franz Antetokounmpo.

[01:40] Team_081 possession (Score: 62-60)
Julius Durant attempts a 3Pt. Contested by Tyler Beal (4.6 feet, ZONE). Julius Durant misses. Offensive rebound by Bradley Sabonis! Bradley Sabonis kicks it out.

[01:26] Team_081 possession (Score: 62-60)
Bradley Leonard attempts a 3Pt. Contested by Tim Barrett (5.2 feet, MAN). Bradley Leonard misses. Rebound secured by Joel Anunoby.

[01:09] Team_030 possession (Score: 62-60)
Tyler Beal loses the ball! Stripped by Julius Durant! TURNOVER! (live ball)

[00:54] Team_081 possession (Score: 62-60)
Bradley Sabonis attempts a 3Pt. Contested by Tyler Beal (4.5 feet, ZONE). Bradley Sabonis misses. Rebound secured by Jordan Nowitzki.

[00:40] Team_030 possession (Score: 62-60)
Joel Anunoby attempts a 3Pt. Contested by Bradley Leonard (4.5 feet, ZONE). Joel Anunoby misses. Rebound secured by Vince Adebayo.

[00:23] Team_081 possession (Score: 62-60)
Bradley Sabonis attempts a Midrange. Contested by Jordan Nowitzki (4.7 feet, MAN). Bradley Sabonis misses. FOUL! Loose ball foul on Jordan Nowitzki during the rebound battle. [Team fouls: 4] No free throws, side out. (Jordan Nowitzki: 2 personal fouls)

[00:04] Team_081 possession (Score: 62-60)
Julius Durant attempts a Midrange. Contested by Tyler Beal (4.8 feet, MAN). Julius Durant misses. Rebound secured by Jaren Green.

================================================================================
                              3RD QUARTER COMPLETE                              
================================================================================

3RD QUARTER SCORE: Team_081 13, Team_030 19

BOX SCORE:
================================================================================

Team_081
--------------------------------------------------------------------------------
Player                MIN  PTS  REB  AST  TO      FG   FG%      3P   3P%
--------------------------------------------------------------------------------
Franz Antetokounmpo    36    7    4    1   0   3/3   100.0     0/0   0.0
Bradley Sabonis        36    5    7    0   0   2/5    40.0     0/0   0.0
Julius Durant          36    1    0    1   0   1/5    20.0     0/0   0.0
Vince Adebayo          33    0    3    0   0   0/2     0.0     0/0   0.0
Bradley Leonard        36    0    0    1   0   0/4     0.0     0/0   0.0

TEAM: FG: 6/19 (31.6%), 3PT: 1/9 (11.1%), REB: 15 (6 off, 9 def), AST: 3, TO: 2
TEAM FOULS: 7 [Team_030 in BONUS]


Team_030
--------------------------------------------------------------------------------
Player                MIN  PTS  REB  AST  TO      FG   FG%      3P   3P%
--------------------------------------------------------------------------------
Tim Barrett            36    7    0    1   0   3/4    75.0     0/0   0.0
Joel Anunoby           36    6    5    0   0   3/6    50.0     0/0   0.0
Jordan Nowitzki        36    3    6    0   0   1/3    33.3     0/0   0.0
Jaren Green            36    2    4    1   0   1/2    50.0     0/0   0.0
Tyler Beal             36    1    0    1   0   1/3    33.3     0/0   0.0

TEAM: FG: 9/18 (50.0%), 3PT: 1/8 (12.5%), REB: 14 (2 off, 12 def), AST: 3, TO: 2
TEAM FOULS: 4

================================================================================

================================================================================
                       4TH QUARTER - Team_081 vs Team_030                       
================================================================================

[12:00] Team_081 possession (Score: 62-60)
Franz Antetokounmpo drives and kicks out. Vince Adebayo attempts a Midrange. Contested by Joel Anunoby (3.7 feet, MAN). Vince Adebayo misses. Rebound secured by Joel Anunoby.

[11:42] Team_030 possession (Score: 62-60)
Jaren Green drives, picks up Franz Antetokounmpo. Help arrives from Bradley Leonard! Jaren Green attempts a Dunk. Contested by Bradley Leonard (5.4 feet, ZONE). Jaren Green misses. Rebound secured by Franz Antetokounmpo.

[11:28] Team_081 possession (Score: 62-60)
Vince Adebayo drives to the basket... Vince Adebayo throws a bad pass! Stolen by Joel Anunoby! TURNOVER! (live ball)

[11:16] Team_030 possession (Score: 62-60)
FOUL! Offensive foul on Tyler Beal! Julius Durant drew the charge! [Team fouls: 1] (Tyler Beal: 1 personal fouls) TURNOVER! (dead ball)

[10:58] Team_081 possession (Score: 62-60)
Bradley Sabonis drives and kicks out. Vince Adebayo attempts a 3Pt. Contested by Tyler Beal (4.6 feet, ZONE). Vince Adebayo misses. Rebound secured by Jordan Nowitzki.

[10:45] Team_030 possession (Score: 62-60)
Tim Barrett makes the Layup and draws the foul on Bradley Leonard! And-1! Tim Barrett to the line for 1. [Team fouls: 1] (Bradley Leonard: 1 personal fouls)   FT 1/1: MISS Tim Barrett makes 0/1 from the line. Offensive rebound by Joel Anunoby! Joel Anunoby kicks it out.
Score: 62-62

[10:31] Team_030 possession (Score: 62-62)
Tyler Beal attempts a 3Pt. Contested by Julius Durant (4.7 feet, MAN). Tyler Beal misses. Rebound secured by Franz Antetokounmpo.

[10:18] Team_081 possession (Score: 62-62)
Vince Adebayo attempts a Midrange. Contested by Tim Barrett (5.2 feet, ZONE). VINCE ADEBAYO MAKES IT! Assist: Bradley Sabonis
Score: 64-62

[10:05] Team_030 possession (Score: 64-62)
Jaren Green attempts a 3Pt. Contested by Bradley Leonard (4.9 feet, ZONE). Jaren Green misses. Rebound secured by Bradley Sabonis.

[09:49] Team_081 possession (Score: 64-62)
Julius Durant drives, picks up Jaren Green. Help arrives from Tyler Beal! Julius Durant attempts a Layup. Contested by Tyler Beal (4.6 feet, ZONE). JULIUS DURANT MAKES IT!
Score: 66-62

[09:38] Team_030 possession (Score: 66-62)
Tim Barrett attempts a 3Pt. Contested by Bradley Leonard (4.2 feet, MAN). TIM BARRETT MAKES IT! Assist: Joel Anunoby
Score: 66-65

[09:21] Team_081 possession (Score: 66-65)
Franz Antetokounmpo attempts a Midrange. Contested by Tim Barrett (5.4 feet, ZONE). FRANZ ANTETOKOUNMPO MAKES IT! Assist: Vince Adebayo
Score: 68-65

[09:07] Team_030 possession (Score: 68-65)
Joel Anunoby attempts a Midrange. Contested by Vince Adebayo (4.6 feet, MAN). Joel Anunoby misses. Offensive rebound by Jordan Nowitzki! Jordan Nowitzki kicks it out.

[08:54] Team_030 possession (Score: 68-65)
Tyler Beal attempts a 3Pt. Contested by Bradley Leonard (4.6 feet, ZONE). TYLER BEAL MAKES IT!
Score: 68-68

[08:43] Team_081 possession (Score: 68-68)
Vince Adebayo makes the Layup and draws the foul on Jaren Green! And-1! Vince Adebayo to the line for 1. [Team fouls: 2] (Jaren Green: 1 personal fouls)   FT 1/1: GOOD Vince Adebayo makes 1/1 from the line.
Score: 71-68

[08:32] Team_030 possession (Score: 71-68)
Joel Anunoby drives, Bradley Sabonis stays with him. Joel Anunoby attempts a Dunk. Contested by Bradley Sabonis (5.0 feet, ZONE). Joel Anunoby misses. Rebound secured by Vince Adebayo.

[08:19] Team_081 possession (Score: 71-68)
Bradley Sabonis drives and kicks out. Vince Adebayo attempts a 3Pt. Contested by Tim Barrett (5.6 feet, ZONE). Vince Adebayo misses. Offensive rebound by Bradley Sabonis! Bradley Sabonis kicks it out.

[08:04] Team_081 possession (Score: 71-68)
FOUL! Shooting foul on Tim Barrett. Vince Adebayo to the line for 3 free throws. [Team fouls: 3] (Tim Barrett: 1 personal fouls)   FT 1/3: MISS   FT 2/3: GOOD   FT 3/3: GOOD Vince Adebayo makes 2/3 from the line.
Score: 73-68

[07:48] Team_030 possession (Score: 73-68)
Jaren Green makes the Midrange and draws the foul on Bradley Leonard! And-1! Jaren Green to the line for 1. [Team fouls: 2] (Bradley Leonard: 2 personal fouls)   FT 1/1: GOOD Jaren Green makes 1/1 from the line.
Score: 73-71

[07:37] Team_081 possession (Score: 73-71)
Bradley Leonard attempts a Layup. BLOCKED BY JAREN GREEN! Ball deflects out of bounds off Bradley Leonard.

[07:20] Team_030 possession (Score: 73-71)
Tyler Beal attempts a Midrange. Contested by Julius Durant (5.1 feet, MAN). Tyler Beal misses. Rebound secured by Bradley Sabonis.

[07:03] Team_081 possession (Score: 73-71)
FOUL! Holding foul on Jaren Green. [Team fouls: 4] No free throws, side out. (Jaren Green: 2 personal fouls)

[06:52] Team_081 possession (Score: 73-71)
Bradley Leonard drives to the basket... Bradley Leonard loses the ball! Stripped by Jaren Green! TURNOVER! (live ball)

[06:36] Team_030 possession (Score: 73-71)
Jordan Nowitzki commits a violation (traveling/carry)! TURNOVER! (dead ball)

[06:36] Substitution (Team_081): Julius Durant OUT → Dejounte Bane IN (stamina_rule2)

[06:36] Substitution (Team_081): Bradley Leonard OUT → Lamelo Wade IN (stamina_rule2)

[06:36] Substitution (Team_081): Vince Adebayo OUT → Larry Adebayo IN (stamina_rule2)

[06:36] Substitution (Team_081): Bradley Sabonis OUT → Chris Holiday IN (stamina_rule2)

[06:36] Substitution (Team_081): Franz Antetokounmpo OUT → D'Angelo Markkanen IN (stamina_rule2)

[06:36] Substitution (Team_030): Tyler Beal OUT → RJ Carter IN (stamina_rule2)

[06:36] Substitution (Team_030): Tim Barrett OUT → Josh Smith IN (stamina_rule2)

[06:36] Substitution (Team_030): Joel Anunoby OUT → Pau James IN (stamina_rule2)

[06:36] Substitution (Team_030): Jordan Nowitzki OUT → Damian Green IN (stamina_rule2)

[06:36] Substitution (Team_030): Jaren Green OUT → Franz Anunoby IN (stamina_rule2)

[06:23] Team_081 possession (Score: 73-71)
FOUL! Holding foul on Damian Green. [IN THE BONUS! 5 team fouls] Chris Holiday to the line for 2 free throws. (Damian Green: 1 personal fouls)   FT 1/2: GOOD   FT 2/2: GOOD Chris Holiday makes 2/2 from the line.
Score: 75-71

[06:09] Team_030 possession (Score: 75-71)
Franz Anunoby drives, Chris Holiday stays with him. Franz Anunoby attempts a Dunk. Contested by Chris Holiday (4.5 feet, MAN). FRANZ ANUNOBY MAKES IT! Assist: Pau James
Score: 75-73

[05:59] Team_081 possession (Score: 75-73)
Dejounte Bane loses control! Ball rolls out of bounds! TURNOVER! (dead ball)

[05:42] Team_030 possession (Score: 75-73)
FOUL! Shooting foul on Chris Holiday. Franz Anunoby to the line for 2 free throws. [Team fouls: 3] (Chris Holiday: 1 personal fouls)   FT 1/2: MISS   FT 2/2: GOOD Franz Anunoby makes 1/2 from the line.
Score: 75-74

[05:28] Team_081 possession (Score: 75-74)
D'Angelo Markkanen makes the Layup and draws the foul on Josh Smith! And-1! D'Angelo Markkanen to the line for 1. [BONUS: 6 team fouls] (Josh Smith: 1 personal fouls)   FT 1/1: GOOD D'Angelo Markkanen makes 1/1 from the line.
Score: 78-74

[05:12] Team_030 possession (Score: 78-74)
Damian Green attempts a Midrange. Contested by Chris Holiday (4.0 feet, MAN). Damian Green misses. FOUL! Loose ball foul on Lamelo Wade during the rebound battle. [Team fouls: 4] No free throws, side out. (Lamelo Wade: 1 personal fouls)

[04:55] Team_030 possession (Score: 78-74)
Pau James attempts a Midrange. Contested by Larry Adebayo (5.3 feet, MAN). Pau James misses. FOUL! Loose ball foul on Larry Adebayo during the rebound battle. [IN THE BONUS! 5 team fouls] Pau James to the line for 2 free throws. (Larry Adebayo: 1 personal fouls)   FT 1/2: GOOD   FT 2/2: GOOD Pau James makes 2/2 from the line.
Score: 78-76

[04:40] Team_081 possession (Score: 78-76)
Lamelo Wade attempts a Layup. BLOCKED BY PAU JAMES! Ball deflects out of bounds off Lamelo Wade.

[04:28] Team_030 possession (Score: 78-76)
RJ Carter attempts a 3Pt. Contested by Chris Holiday (4.4 feet, ZONE). RJ Carter misses. Rebound secured by Chris Holiday.

[04:14] Team_081 possession (Score: 78-76)
Dejounte Bane attempts a 3Pt. Contested by RJ Carter (5.9 feet, MAN). Dejounte Bane misses. Rebound secured by Damian Green.

[04:00] Team_030 possession (Score: 78-76)
Franz Anunoby attempts a Midrange. Contested by Lamelo Wade (5.0 feet, ZONE). Franz Anunoby misses. Rebound secured by Larry Adebayo.

[03:41] Team_081 possession (Score: 78-76)
Lamelo Wade attempts a Midrange. Contested by Pau James (4.3 feet, ZONE). LAMELO WADE MAKES IT! Assist: D'Angelo Markkanen
Score: 80-76

[03:24] Team_030 possession (Score: 80-76)
FOUL! Reach-in foul on Larry Adebayo during the drive. [IN THE BONUS! 6 team fouls] Pau James to the line for 2 free throws. (Larry Adebayo: 2 personal fouls)   FT 1/2: GOOD   FT 2/2: GOOD Pau James makes 2/2 from the line.
Score: 80-78

[03:08] Team_081 possession (Score: 80-78)
D'Angelo Markkanen attempts a Layup. Contested by Franz Anunoby (4.6 feet, MAN). D'ANGELO MARKKANEN MAKES IT! Assist: Lamelo Wade
Score: 82-78

[02:58] Team_030 possession (Score: 82-78)
Pau James attempts a Midrange. Contested by Larry Adebayo (5.3 feet, ZONE). PAU JAMES MAKES IT! Assist: RJ Carter
Score: 82-80

[02:41] Team_081 possession (Score: 82-80)
Chris Holiday attempts a 3Pt. Contested by Damian Green (5.2 feet, MAN). CHRIS HOLIDAY MAKES IT! Assist: Dejounte Bane
Score: 85-80

[02:30] Team_030 possession (Score: 85-80)
Josh Smith attempts a 3Pt. Contested by Chris Holiday (4.4 feet, ZONE). JOSH SMITH MAKES IT! Assist: Pau James
Score: 85-83

[02:16] Team_081 possession (Score: 85-83)
Lamelo Wade attempts a Layup. Contested by Josh Smith (4.5 feet, MAN). Lamelo Wade misses. FOUL! Loose ball foul on Franz Anunoby during the rebound battle. [IN THE BONUS! 7 team fouls] Chris Holiday to the line for 2 free throws. (Franz Anunoby: 1 personal fouls)   FT 1/2: GOOD   FT 2/2: GOOD Chris Holiday makes 2/2 from the line.
Score: 87-83

[02:01] Team_030 possession (Score: 87-83)
Damian Green attempts a Midrange. Contested by Chris Holiday (4.0 feet, MAN). Damian Green misses. Rebound secured by Larry Adebayo.

[01:45] Team_081 possession (Score: 87-83)
Dejounte Bane drives, Damian Green stays with him. Dejounte Bane attempts a Layup. Contested by Damian Green (5.3 feet, ZONE). DEJOUNTE BANE MAKES IT!
Score: 89-83

[01:26] Team_030 possession (Score: 89-83)
Franz Anunoby attempts a Layup. Contested by Chris Holiday (4.5 feet, MAN). Franz Anunoby misses. Offensive rebound by Pau James! Pau James kicks it out.

[01:12] Team_030 possession (Score: 89-83)
Pau James attempts a 3Pt. Contested by Chris Holiday (4.3 feet, ZONE). Pau James misses. Rebound secured by Chris Holiday.

[00:54] Team_081 possession (Score: 89-83)
D'Angelo Markkanen attempts a 3Pt. Contested by Franz Anunoby (4.6 feet, MAN). D'Angelo Markkanen misses. Rebound secured by Franz Anunoby.

[00:38] Team_030 possession (Score: 89-83)
Pau James attempts a Layup. BLOCKED BY LARRY ADEBAYO! Ball is loose! Rebound secured by Lamelo Wade.

[00:24] Team_081 possession (Score: 89-83)
D'Angelo Markkanen attempts a Midrange. Contested by Josh Smith (4.8 feet, ZONE). D'Angelo Markkanen misses. Rebound secured by Damian Green.

[00:11] Team_030 possession (Score: 89-83)
Damian Green drives, Chris Holiday stays with him. Damian Green attempts a Dunk. Contested by Chris Holiday (4.0 feet, MAN). DAMIAN GREEN MAKES IT! Assist: RJ Carter
Score: 89-85

[00:01] Team_081 possession (Score: 89-85)
Larry Adebayo attempts a Midrange. Contested by Damian Green (5.1 feet, ZONE). LARRY ADEBAYO MAKES IT! Assist: Dejounte Bane
Score: 91-85

================================================================================
                              4TH QUARTER COMPLETE                              
================================================================================

4TH QUARTER SCORE: Team_081 29, Team_030 25

BOX SCORE:
================================================================================

Team_081
--------------------------------------------------------------------------------
Player                MIN  PTS  REB  AST  TO      FG   FG%      3P   3P%
--------------------------------------------------------------------------------
Vince Adebayo          39    7    1    1   0   3/3   100.0     0/0   0.0
Chris Holiday           7    7    2    0   0   3/3   100.0     0/0   0.0
D'Angelo Markkanen      7    5    0    1   0   2/4    50.0     0/0   0.0
Franz Antetokounmpo    41    2    2    0   0   1/2    50.0     0/0   0.0
Julius Durant          41    2    0    0   0   1/1   100.0     0/0   0.0
Lamelo Wade             7    2    1    1   0   1/2    50.0     0/0   0.0
Dejounte Bane           7    2    0    2   0   1/2    50.0     0/0   0.0
Larry Adebayo          10    2    2    0   0   1/1   100.0     0/0   0.0
Bradley Sabonis        41    0    3    1   0   0/1     0.0     0/0   0.0
Bradley Leonard        41    0    0    0   0   0/1     0.0     0/0   0.0

TEAM: FG: 13/20 (65.0%), 3PT: 2/4 (50.0%), REB: 11 (1 off, 10 def), AST: 6, TO: 3
TEAM FOULS: 6 [Team_030 in BONUS]


Team_030
--------------------------------------------------------------------------------
Player                MIN  PTS  REB  AST  TO      FG   FG%      3P   3P%
--------------------------------------------------------------------------------
Pau James               7    6    1    2   0   3/5    60.0     0/0   0.0
Jaren Green            41    3    0    0   0   1/3    33.3     0/0   0.0
Tyler Beal             41    3    0    0   0   1/3    33.3     0/0   0.0
Tim Barrett            41    3    0    0   0   1/1   100.0     0/0   0.0
Franz Anunoby           7    3    1    0   0   2/3    66.7     0/0   0.0
Josh Smith              7    3    0    0   0   1/1   100.0     0/0   0.0
Damian Green            7    2    3    0   0   1/2    50.0     0/0   0.0
Joel Anunoby           41    0    2    1   0   0/1     0.0     0/0   0.0
Jordan Nowitzki        41    0    2    0   0   0/0     0.0     0/0   0.0
RJ Carter               7    0    0    2   0   0/1     0.0     0/0   0.0

TEAM: FG: 10/20 (50.0%), 3PT: 3/7 (42.9%), REB: 9 (4 off, 5 def), AST: 5, TO: 2
TEAM FOULS: 7 [Team_081 in BONUS]

================================================================================

================================================================================
                               FULL GAME COMPLETE                               
================================================================================

FINAL SCORE: Team_081 91, Team_030 85

SCORING BY QUARTER:
--------------------------------------------------------------------------------
Team                     Q1     Q2     Q3     Q4    FINAL
--------------------------------------------------------------------------------
Team_081                 19     30     13     29       91
Team_030                 19     22     19     25       85
--------------------------------------------------------------------------------

FULL GAME BOX SCORE:
================================================================================

Team_081
--------------------------------------------------------------------------------
Player                MIN  PTS  REB  AST  TO      FG   FG%      3P   3P%      FT STL BLK
--------------------------------------------------------------------------------
Julius Durant          41    9    0    1   1   5/12   41.7   0/6     0.0   3/4     2   0
Bradley Leonard        41   11    0    3   2   5/12   41.7   2/4    50.0   2/2     0   0
Bradley Sabonis        41   14   22    4   4   5/12   41.7   1/4    25.0   2/3     0   0
Franz Antetokounmpo    41   23   16    2   1  11/13   84.6   1/1   100.0   0/0     0   1
Vince Adebayo          39   14   11    4   0   6/13   46.2   2/8    25.0   5/6     0   0
Larry Adebayo          10    2    3    0   0   1/2    50.0   0/0     0.0   0/0     0   1
Dejounte Bane           7    2    0    2   1   1/2    50.0   0/1     0.0   0/0     0   0
Lamelo Wade             7    2    2    1   0   2/3    66.7   0/0     0.0   0/0     0   0
Chris Holiday           7    7    2    0   1   1/1   100.0   1/1   100.0   4/4     0   0
D'Angelo Markkanen      7    5    0    1   0   2/4    50.0   0/1     0.0   1/1     0   0

TEAM: FG: 40/75 (53.3%), 3PT: 7/26 (26.9%), REB: 57 (16 off, 41 def), AST: 18, TO: 10


Team_030
--------------------------------------------------------------------------------
Player                MIN  PTS  REB  AST  TO      FG   FG%      3P   3P%      FT STL BLK
--------------------------------------------------------------------------------
Tyler Beal             41    8    0    1   5   4/10   40.0   1/6    16.7   1/2     1   1
Tim Barrett            41   20    0    2   0   7/18   38.9   3/10   30.0   2/3     1   0
Joel Anunoby           41   17   18    1   0   7/17   41.2   3/11   27.3   3/4     1   2
Jordan Nowitzki        41   11   13    4   1   4/9    44.4   0/1     0.0   3/3     0   0
Jaren Green            41    9    6    3   0   4/9    44.4   0/2     0.0   3/3     3   2
RJ Carter               7    0    0    2   0   0/1     0.0   0/1     0.0   0/0     0   0
Josh Smith              7    5    0    0   0   2/2   100.0   1/1   100.0   0/0     0   0
Pau James               7    6    1    2   0   3/5    60.0   0/1     0.0   4/4     1   1
Damian Green            7    2    3    0   0   1/2    50.0   0/0     0.0   0/0     0   0
Franz Anunoby           7    3    1    0   0   2/3    66.7   0/0     0.0   1/2     0   0

TEAM: FG: 35/77 (45.5%), 3PT: 8/33 (24.2%), REB: 41 (9 off, 32 def), AST: 15, TO: 6

================================================================================
