================================================================================
                        FULL GAME - Team_066 vs Team_036                        
================================================================================

================================================================================
                       1ST QUARTER - Team_066 vs Team_036                       
================================================================================

[12:00] Team_066 possession (Score: 0-0)
Jimmy Davis loses control! Ball rolls out of bounds! TURNOVER! (dead ball)

[11:44] Team_036 possession (Score: 0-0)
Terry Durant attempts a Midrange. Contested by Yao Brogdon (5.6 feet, MAN). Terry Durant misses. Offensive rebound by Kobe Simmons! Kobe Simmons puts it back in!
Score: 0-2

[11:27] Team_066 possession (Score: 0-2)
Kyle Wagner drives and kicks out. Kyle Wagner makes the Midrange and draws the foul on Kobe Simmons! And-1! Kyle Wagner to the line for 1. [Team fouls: 1] (Kobe Simmons: 1 personal fouls)   FT 1/1: GOOD Kyle Wagner makes 1/1 from the line.
Score: 3-2

[11:15] Team_036 possession (Score: 3-2)
FOUL! Holding foul on Jimmy Davis. [Team fouls: 1] No free throws, side out. (Jimmy Davis: 1 personal fouls)

[10:58] Team_036 possession (Score: 3-2)
Giannis Booker attempts a Midrange. Contested by Pau Curry (5.9 feet, MAN). GIANNIS BOOKER MAKES IT! Assist: Terry Durant
Score: 3-4

[10:45] Team_066 possession (Score: 3-4)
Jimmy Davis attempts a 3Pt. Contested by Michael Westbrook (5.1 feet, MAN). Jimmy Davis misses. Rebound secured by Kobe Simmons.

[10:27] Team_036 possession (Score: 3-4)
Anthony Poole attempts a Midrange. Contested by Brandon Reaves (5.8 feet, MAN). Anthony Poole misses. Offensive rebound by Terry Durant! Terry Durant puts it back in!
Score: 3-6

[10:14] Team_066 possession (Score: 3-6)
FOUL! Holding foul on Giannis Booker. [Team fouls: 2] No free throws, side out. (Giannis Booker: 1 personal fouls)

[09:58] Team_066 possession (Score: 3-6)
FOUL! Reach-in foul on Kobe Simmons during the drive. [Team fouls: 3] No free throws, side out. (Kobe Simmons: 2 personal fouls)

[09:39] Team_066 possession (Score: 3-6)
Pau Curry attempts a Midrange. Contested by Giannis Booker (4.8 feet, MAN). PAU CURRY MAKES IT! Assist: Kyle Wagner
Score: 5-6

[09:25] Team_036 possession (Score: 5-6)
Giannis Booker attempts a 3Pt. Contested by Pau Curry (5.9 feet, ZONE). Giannis Booker misses. Rebound secured by Brandon Reaves.

[09:10] Team_066 possession (Score: 5-6)
Jimmy Davis drives and kicks out. Pau Curry attempts a 3Pt. Contested by Michael Westbrook (4.6 feet, ZONE). Pau Curry misses. Rebound secured by Kobe Simmons.

[08:57] Team_036 possession (Score: 5-6)
Michael Westbrook attempts a 3Pt. Contested by Pau Curry (6.0 feet, ZONE). Michael Westbrook misses. Rebound secured by Kyle Wagner.

[08:44] Team_066 possession (Score: 5-6)
Brandon Reaves attempts a Midrange. Contested by Anthony Poole (5.4 feet, MAN). Brandon Reaves misses. Rebound secured by Giannis Booker.

[08:28] Team_036 possession (Score: 5-6)
Michael Westbrook attempts a 3Pt. Contested by Pau Curry (6.0 feet, ZONE). Michael Westbrook misses. Offensive rebound by Kobe Simmons! Kobe Simmons's putback is no good. Rebound secured by Yao Brogdon.

[08:15] Team_066 possession (Score: 5-6)
Kyle Wagner attempts a 3Pt. Contested by Kobe Simmons (3.3 feet, MAN). Kyle Wagner misses. Rebound secured by Kobe Simmons.

[07:58] Team_036 possession (Score: 5-6)
Anthony Poole makes the Layup and draws the foul on Jimmy Davis! And-1! Anthony Poole to the line for 1. [Team fouls: 2] (Jimmy Davis: 2 personal fouls)   FT 1/1: GOOD Anthony Poole makes 1/1 from the line.
Score: 5-9

[07:45] Team_066 possession (Score: 5-9)
Yao Brogdon makes the Midrange and draws the foul on Terry Durant! And-1! Yao Brogdon to the line for 1. [Team fouls: 4] (Terry Durant: 1 personal fouls)   FT 1/1: GOOD Yao Brogdon makes 1/1 from the line.
Score: 8-9

[07:33] Team_036 possession (Score: 8-9)
Kobe Simmons drives to the basket... Kobe Simmons loses control! Ball rolls out of bounds! TURNOVER! (dead ball)

[07:16] Team_066 possession (Score: 8-9)
Jimmy Davis attempts a Midrange. Contested by Michael Westbrook (5.1 feet, MAN). JIMMY DAVIS MAKES IT! Assist: Pau Curry
Score: 10-9

[07:05] Team_036 possession (Score: 10-9)
Michael Westbrook attempts a 3Pt. Contested by Pau Curry (6.0 feet, ZONE). MICHAEL WESTBROOK MAKES IT! Assist: Kobe Simmons
Score: 10-12

[06:51] Team_066 possession (Score: 10-12)
FOUL! Reach-in foul on Kobe Simmons during the drive. [IN THE BONUS! 5 team fouls] Yao Brogdon to the line for 2 free throws. (Kobe Simmons: 3 personal fouls)   FT 1/2: MISS   FT 2/2: MISS Yao Brogdon makes 0/2 from the line. Rebound secured by Terry Durant.

[06:37] Team_036 possession (Score: 10-12)
Giannis Booker attempts a 3Pt. Contested by Pau Curry (5.9 feet, MAN). Giannis Booker misses. Offensive rebound by Kobe Simmons! Kobe Simmons's putback is no good. Rebound secured by Kyle Wagner.

[06:24] Team_066 possession (Score: 10-12)
Brandon Reaves attempts a Layup. BLOCKED BY ANTHONY POOLE! Ball goes out off Anthony Poole. Brandon Reaves's ball!

[06:12] Team_066 possession (Score: 10-12)
Yao Brogdon drives, Terry Durant stays with him. Yao Brogdon attempts a Layup. Contested by Terry Durant (4.9 feet, MAN). YAO BROGDON MAKES IT!
Score: 12-12

[05:59] Team_036 possession (Score: 12-12)
FOUL! Shooting foul on Jimmy Davis. Michael Westbrook to the line for 2 free throws. [Team fouls: 3] (Jimmy Davis: 3 personal fouls)   FT 1/2: GOOD   FT 2/2: GOOD Michael Westbrook makes 2/2 from the line.
Score: 12-14

[05:46] Team_066 possession (Score: 12-14)
FOUL! Reach-in foul on Kobe Simmons during the drive. [IN THE BONUS! 6 team fouls] Kyle Wagner to the line for 2 free throws. (Kobe Simmons: 4 personal fouls)   FT 1/2: GOOD   FT 2/2: MISS Kyle Wagner makes 1/2 from the line. Rebound secured by Kobe Simmons.
Score: 13-14

[05:31] Team_036 possession (Score: 13-14)
Anthony Poole drives, picks up Kyle Wagner. Help arrives from Jimmy Davis! Anthony Poole attempts a Layup. Contested by Jimmy Davis (4.6 feet, ZONE). Anthony Poole misses. Rebound secured by Kyle Wagner.

[05:18] Team_066 possession (Score: 13-14)
Brandon Reaves attempts a 3Pt. Contested by Michael Westbrook (5.2 feet, ZONE). Brandon Reaves misses. Rebound secured by Giannis Booker.

[05:00] Team_036 possession (Score: 13-14)
Anthony Poole makes the Layup and draws the foul on Kyle Wagner! And-1! Anthony Poole to the line for 1. [Team fouls: 4] (Kyle Wagner: 1 personal fouls)   FT 1/1: GOOD Anthony Poole makes 1/1 from the line.
Score: 13-17

[04:49] Team_066 possession (Score: 13-17)
FOUL! Shooting foul on Kobe Simmons. Kyle Wagner to the line for 2 free throws. [BONUS: 7 team fouls] (Kobe Simmons: 5 personal fouls)   FT 1/2: MISS   FT 2/2: GOOD Kyle Wagner makes 1/2 from the line.
Score: 14-17

[04:36] Team_036 possession (Score: 14-17)
Anthony Poole attempts a 3Pt. Wide open! Pau Curry is 6.3 feet away. [ZONE] ANTHONY POOLE MAKES IT!
Score: 14-20

[04:23] Team_066 possession (Score: 14-20)
Pau Curry attempts a 3Pt. Contested by Michael Westbrook (5.0 feet, ZONE). Pau Curry misses. Offensive rebound by Yao Brogdon! Yao Brogdon kicks it out.

[04:04] Team_066 possession (Score: 14-20)
Yao Brogdon attempts a Layup. BLOCKED BY KOBE SIMMONS! Ball is loose! Rebound secured by Giannis Booker.

[03:51] Team_036 possession (Score: 14-20)
FOUL! Reach-in foul on Kyle Wagner during the drive. [IN THE BONUS! 5 team fouls] Kobe Simmons to the line for 2 free throws. (Kyle Wagner: 2 personal fouls)   FT 1/2: GOOD   FT 2/2: GOOD Kobe Simmons makes 2/2 from the line.
Score: 14-22

[03:38] Team_066 possession (Score: 14-22)
FOUL! Reach-in foul on Kobe Simmons during the drive. [IN THE BONUS! 8 team fouls] Jimmy Davis to the line for 2 free throws. (Kobe Simmons: 6 personal fouls) Kobe Simmons FOULS OUT!   FT 1/2: GOOD   FT 2/2: GOOD Jimmy Davis makes 2/2 from the line.
Score: 16-22

[03:38] Substitution (Team_036): Kobe Simmons OUT (stamina: 73) → Dirk Anunoby IN (foul_out)

[03:22] Team_036 possession (Score: 16-22)
Anthony Poole attempts a 3Pt. Contested by Brandon Reaves (5.9 feet, MAN). Anthony Poole misses. Rebound secured by Kyle Wagner.

[03:05] Team_066 possession (Score: 16-22)
Kyle Wagner drives, Terry Durant stays with him. Kyle Wagner attempts a Dunk. Contested by Terry Durant (4.5 feet, ZONE). KYLE WAGNER MAKES IT! Assist: Brandon Reaves
Score: 18-22

[02:52] Team_036 possession (Score: 18-22)
Terry Durant drives, Yao Brogdon stays with him. Terry Durant attempts a Dunk. Contested by Yao Brogdon (5.8 feet, MAN). Terry Durant misses. Rebound secured by Kyle Wagner.

[02:40] Team_066 possession (Score: 18-22)
Pau Curry attempts a 3Pt. Contested by Giannis Booker (5.0 feet, MAN). Pau Curry misses. FOUL! Loose ball foul on Giannis Booker during the rebound battle. [IN THE BONUS! 9 team fouls] Yao Brogdon to the line for 2 free throws. (Giannis Booker: 2 personal fouls)   FT 1/2: GOOD   FT 2/2: GOOD Yao Brogdon makes 2/2 from the line.
Score: 20-22

[02:26] Team_036 possession (Score: 20-22)
Dirk Anunoby drives, Jimmy Davis stays with him. Dirk Anunoby attempts a Dunk. Contested by Jimmy Davis (4.7 feet, MAN). DIRK ANUNOBY MAKES IT!
Score: 20-24

[02:10] Team_066 possession (Score: 20-24)
Kyle Wagner drives and kicks out. Jimmy Davis attempts a 3Pt. Contested by Anthony Poole (5.1 feet, ZONE). Jimmy Davis misses. Rebound secured by Anthony Poole.

[01:53] Team_036 possession (Score: 20-24)
Dirk Anunoby makes the Dunk and draws the foul on Brandon Reaves! And-1! Dirk Anunoby to the line for 1. [BONUS: 6 team fouls] (Brandon Reaves: 1 personal fouls)   FT 1/1: GOOD Dirk Anunoby makes 1/1 from the line.
Score: 20-27

[01:40] Team_066 possession (Score: 20-27)
Jimmy Davis drives and kicks out. FOUL! Shooting foul on Terry Durant. Kyle Wagner to the line for 3 free throws. [BONUS: 10 team fouls] (Terry Durant: 2 personal fouls)   FT 1/3: GOOD   FT 2/3: MISS   FT 3/3: MISS Kyle Wagner makes 1/3 from the line. Rebound secured by Terry Durant.
Score: 21-27

[01:25] Team_036 possession (Score: 21-27)
Giannis Booker attempts a 3Pt. Wide open! Pau Curry is 6.2 feet away. [MAN] Giannis Booker misses. Rebound secured by Yao Brogdon.

[01:11] Team_066 possession (Score: 21-27)
Kyle Wagner attempts a 3Pt. Contested by Michael Westbrook (4.9 feet, ZONE). KYLE WAGNER MAKES IT! Assist: Brandon Reaves
Score: 24-27

[00:55] Team_036 possession (Score: 24-27)
FOUL! Holding foul on Brandon Reaves. [IN THE BONUS! 7 team fouls] Anthony Poole to the line for 2 free throws. (Brandon Reaves: 2 personal fouls)   FT 1/2: GOOD   FT 2/2: GOOD Anthony Poole makes 2/2 from the line.
Score: 24-29

[00:40] Team_066 possession (Score: 24-29)
Jimmy Davis makes the Layup and draws the foul on Michael Westbrook! And-1! Jimmy Davis to the line for 1. [BONUS: 11 team fouls] (Michael Westbrook: 1 personal fouls)   FT 1/1: GOOD Jimmy Davis makes 1/1 from the line.
Score: 27-29

[00:27] Team_036 possession (Score: 27-29)
FOUL! Shooting foul on Yao Brogdon. Terry Durant to the line for 2 free throws. [BONUS: 8 team fouls] (Yao Brogdon: 1 personal fouls)   FT 1/2: GOOD   FT 2/2: GOOD Terry Durant makes 2/2 from the line.
Score: 27-31

[00:14] Team_066 possession (Score: 27-31)
Yao Brogdon drives, Terry Durant stays with him. Yao Brogdon attempts a Dunk. Contested by Terry Durant (5.3 feet, ZONE). Yao Brogdon misses. Rebound secured by Terry Durant.

================================================================================
                              1ST QUARTER COMPLETE                              
================================================================================

1ST QUARTER SCORE: Team_066 27, Team_036 31

BOX SCORE:
================================================================================

Team_066
--------------------------------------------------------------------------------
Player                MIN  PTS  REB  AST  TO      FG   FG%      3P   3P%
--------------------------------------------------------------------------------
Kyle Wagner            12    9    5    1   0   4/7    57.1     0/0   0.0
Jimmy Davis            12    7    0    0   0   3/6    50.0     0/0   0.0
Yao Brogdon            12    7    3    0   0   3/6    50.0     0/0   0.0
Pau Curry              12    2    0    1   0   1/1   100.0     0/0   0.0
Brandon Reaves         12    0    1    2   0   0/2     0.0     0/0   0.0

TEAM: FG: 11/22 (50.0%), 3PT: 2/5 (40.0%), REB: 7 (1 off, 6 def), AST: 4, TO: 1
TEAM FOULS: 8 [Team_036 in BONUS]


Team_036
--------------------------------------------------------------------------------
Player                MIN  PTS  REB  AST  TO      FG   FG%      3P   3P%
--------------------------------------------------------------------------------
Anthony Poole          12   11    1    0   0   4/6    66.7     0/0   0.0
Michael Westbrook      12    5    0    0   0   2/4    50.0     0/0   0.0
Dirk Anunoby            3    5    0    0   0   2/2   100.0     0/0   0.0
Kobe Simmons            9    4    5    1   0   2/2   100.0     0/0   0.0
Terry Durant           12    4    4    1   0   2/3    66.7     0/0   0.0
Giannis Booker         12    2    3    0   0   1/4    25.0     0/0   0.0

TEAM: FG: 13/21 (61.9%), 3PT: 2/8 (25.0%), REB: 15 (4 off, 11 def), AST: 2, TO: 1
TEAM FOULS: 11 [Team_066 in BONUS]

================================================================================

================================================================================
                       2ND QUARTER - Team_066 vs Team_036                       
================================================================================

[12:00] Team_066 possession (Score: 27-31)
Kyle Wagner attempts a Midrange. Contested by Kobe Simmons (3.3 feet, MAN). Kyle Wagner misses. Offensive rebound by Yao Brogdon! Yao Brogdon kicks it out.

[11:50] Team_066 possession (Score: 27-31)
Jimmy Davis attempts a 3Pt. Contested by Michael Westbrook (5.3 feet, MAN). Jimmy Davis misses. Rebound secured by Kobe Simmons.

[11:40] Team_036 possession (Score: 27-31)
Giannis Booker attempts a 3Pt. Wide open! Pau Curry is 6.2 feet away. [ZONE] Giannis Booker misses. Rebound secured by Kyle Wagner.

[11:28] Team_066 possession (Score: 27-31)
Brandon Reaves attempts a Midrange. Contested by Anthony Poole (5.6 feet, MAN). Brandon Reaves misses. Rebound secured by Giannis Booker.

[11:18] Team_036 possession (Score: 27-31)
Michael Westbrook attempts a 3Pt. Contested by Jimmy Davis (4.9 feet, MAN). Michael Westbrook misses. Rebound secured by Yao Brogdon.

[11:06] Team_066 possession (Score: 27-31)
Brandon Reaves attempts a Midrange. Contested by Terry Durant (5.3 feet, ZONE). BRANDON REAVES MAKES IT!
Score: 29-31

[10:51] Team_036 possession (Score: 29-31)
Anthony Poole attempts a 3Pt. Wide open! Pau Curry is 6.6 feet away. [ZONE] Anthony Poole misses. Rebound secured by Brandon Reaves.

[10:37] Team_066 possession (Score: 29-31)
Yao Brogdon attempts a 3Pt. Contested by Terry Durant (5.3 feet, MAN). Yao Brogdon misses. Offensive rebound by Yao Brogdon! Yao Brogdon kicks it out.

[10:20] Team_066 possession (Score: 29-31)
Yao Brogdon attempts a Layup. Contested by Kobe Simmons (3.9 feet, ZONE). Yao Brogdon misses. Rebound secured by Terry Durant.

[10:03] Team_036 possession (Score: 29-31)
Kobe Simmons throws a bad pass! Stolen by Kyle Wagner! TURNOVER! (live ball)

[09:49] Team_066 possession (Score: 29-31)
Pau Curry attempts a 3Pt. Contested by Giannis Booker (5.2 feet, MAN). Pau Curry misses. Offensive rebound by Yao Brogdon! Yao Brogdon kicks it out.

[09:38] Team_066 possession (Score: 29-31)
Jimmy Davis loses control! Ball rolls out of bounds! TURNOVER! (dead ball)

[09:38] Substitution (Team_066): Jimmy Davis OUT → Pascal Carter IN (stamina_rule2)

[09:38] Substitution (Team_066): Pau Curry OUT → Lauri LaVine IN (stamina_rule2)

[09:38] Substitution (Team_066): Brandon Reaves OUT → Brandon Middleton IN (stamina_rule2)

[09:38] Substitution (Team_066): Yao Brogdon OUT → Cole Morant IN (stamina_rule2)

[09:38] Substitution (Team_066): Kyle Wagner OUT → Donovan Simmons IN (stamina_rule2)

[09:38] Substitution (Team_036): Michael Westbrook OUT → Dirk Anunoby IN (stamina_rule2)

[09:38] Substitution (Team_036): Giannis Booker OUT → Tobias Fox IN (stamina_rule2)

[09:38] Substitution (Team_036): Anthony Poole OUT → Pascal Antetokounmpo IN (stamina_rule2)

[09:38] Substitution (Team_036): Terry Durant OUT → Devin Simmons IN (stamina_rule2)

[09:23] Team_036 possession (Score: 29-31)
Tobias Fox attempts a Midrange. Contested by Cole Morant (5.9 feet, ZONE). Tobias Fox misses. Rebound secured by Lauri LaVine.

[09:10] Team_066 possession (Score: 29-31)
Cole Morant attempts a 3Pt. Contested by Tobias Fox (5.1 feet, ZONE). Cole Morant misses. Rebound secured by Pascal Antetokounmpo.

[08:54] Team_036 possession (Score: 29-31)
Devin Simmons drives, picks up Cole Morant. Help arrives from Lauri LaVine! Devin Simmons attempts a Layup. Contested by Lauri LaVine (5.6 feet, MAN). Devin Simmons misses. Rebound secured by Lauri LaVine.

[08:38] Team_066 possession (Score: 29-31)
Brandon Middleton attempts a 3Pt. Contested by Pascal Antetokounmpo (4.6 feet, ZONE). Brandon Middleton misses. Rebound secured by Kobe Simmons.

[08:28] Team_036 possession (Score: 29-31)
Kobe Simmons attempts a Layup. Contested by Donovan Simmons (5.2 feet, MAN). KOBE SIMMONS MAKES IT!
Score: 29-33

[08:11] Team_066 possession (Score: 29-33)
FOUL! Holding foul on Tobias Fox. [Team fouls: 1] No free throws, side out. (Tobias Fox: 1 personal fouls)

[07:54] Team_066 possession (Score: 29-33)
Donovan Simmons drives, picks up Kobe Simmons. Help arrives from Dirk Anunoby! Donovan Simmons attempts a Layup. Contested by Dirk Anunoby (3.9 feet, MAN). DONOVAN SIMMONS MAKES IT! Assist: Lauri LaVine
Score: 31-33

[07:37] Team_036 possession (Score: 31-33)
Tobias Fox drives, Lauri LaVine stays with him. Tobias Fox attempts a Layup. Contested by Lauri LaVine (4.3 feet, MAN). TOBIAS FOX MAKES IT!
Score: 31-35

[07:27] Team_066 possession (Score: 31-35)
FOUL! Reach-in foul on Dirk Anunoby during the drive. [Team fouls: 2] No free throws, side out. (Dirk Anunoby: 1 personal fouls)

[07:15] Team_066 possession (Score: 31-35)
FOUL! Shooting foul on Dirk Anunoby. Pascal Carter to the line for 3 free throws. [Team fouls: 3] (Dirk Anunoby: 2 personal fouls)   FT 1/3: GOOD   FT 2/3: GOOD   FT 3/3: GOOD Pascal Carter makes 3/3 from the line.
Score: 34-35

[07:01] Team_036 possession (Score: 34-35)
Tobias Fox drives, Lauri LaVine stays with him. Tobias Fox attempts a Layup. Contested by Lauri LaVine (4.3 feet, MAN). TOBIAS FOX MAKES IT! Assist: Devin Simmons
Score: 34-37

[06:48] Team_066 possession (Score: 34-37)
Cole Morant throws a bad pass out of bounds! TURNOVER! (dead ball)

[06:48] Substitution (Team_036): Kobe Simmons OUT → Bradley Murray IN (stamina_rule2)

[06:35] Team_036 possession (Score: 34-37)
Pascal Antetokounmpo commits a violation (traveling/carry)! TURNOVER! (dead ball)

[06:22] Team_066 possession (Score: 34-37)
Brandon Middleton attempts a 3Pt. Contested by Pascal Antetokounmpo (4.6 feet, MAN). Brandon Middleton misses. Rebound secured by Devin Simmons.

[06:05] Team_036 possession (Score: 34-37)
Tobias Fox drives, picks up Lauri LaVine. Help arrives from Brandon Middleton! Tobias Fox attempts a Layup. Contested by Brandon Middleton (4.3 feet, MAN). Tobias Fox misses. Rebound secured by Donovan Simmons.

[05:50] Team_066 possession (Score: 34-37)
Cole Morant drives and kicks out. FOUL! Shooting foul on Pascal Antetokounmpo. Brandon Middleton to the line for 3 free throws. [Team fouls: 4] (Pascal Antetokounmpo: 1 personal fouls)   FT 1/3: GOOD   FT 2/3: GOOD   FT 3/3: GOOD Brandon Middleton makes 3/3 from the line.
Score: 37-37

[05:34] Team_036 possession (Score: 37-37)
Devin Simmons attempts a Midrange. Contested by Lauri LaVine (4.0 feet, ZONE). Devin Simmons misses. Rebound secured by Lauri LaVine.

[05:19] Team_066 possession (Score: 37-37)
Pascal Carter attempts a 3Pt. Contested by Devin Simmons (5.4 feet, ZONE). Pascal Carter misses. Rebound secured by Devin Simmons.

[05:04] Team_036 possession (Score: 37-37)
Dirk Anunoby attempts a Layup. Contested by Cole Morant (5.9 feet, ZONE). DIRK ANUNOBY MAKES IT! Assist: Bradley Murray
Score: 37-39

[04:50] Team_066 possession (Score: 37-39)
Donovan Simmons attempts a Layup. Contested by Bradley Murray (4.7 feet, MAN). DONOVAN SIMMONS MAKES IT!
Score: 39-39

[04:38] Team_036 possession (Score: 39-39)
Dirk Anunoby attempts a 3Pt. Contested by Lauri LaVine (4.3 feet, ZONE). Dirk Anunoby misses. Rebound secured by Lauri LaVine.

[04:23] Team_066 possession (Score: 39-39)
Pascal Carter attempts a 3Pt. Contested by Dirk Anunoby (5.8 feet, MAN). PASCAL CARTER MAKES IT! Assist: Brandon Middleton
Score: 42-39

[04:07] Team_036 possession (Score: 42-39)
Bradley Murray throws a bad pass out of bounds! TURNOVER! (dead ball)

[03:52] Team_066 possession (Score: 42-39)
Donovan Simmons attempts a Layup. BLOCKED BY DEVIN SIMMONS! Ball is loose! Rebound secured by Devin Simmons.

[03:40] Team_036 possession (Score: 42-39)
Pascal Antetokounmpo attempts a 3Pt. Contested by Lauri LaVine (4.2 feet, ZONE). Pascal Antetokounmpo misses. Rebound secured by Brandon Middleton.

[03:22] Team_066 possession (Score: 42-39)
Brandon Middleton drives to the basket... Brandon Middleton loses control! Ball rolls out of bounds! TURNOVER! (dead ball)

[03:04] Team_036 possession (Score: 42-39)
Bradley Murray drives, Donovan Simmons stays with him. Bradley Murray attempts a Layup. Contested by Donovan Simmons (4.8 feet, MAN). Bradley Murray misses. Rebound secured by Lauri LaVine.

[02:52] Team_066 possession (Score: 42-39)
Lauri LaVine drives and kicks out. FOUL! Shooting foul on Tobias Fox. Lauri LaVine to the line for 2 free throws. [BONUS: 5 team fouls] (Tobias Fox: 2 personal fouls)   FT 1/2: GOOD   FT 2/2: GOOD Lauri LaVine makes 2/2 from the line.
Score: 44-39

[02:39] Team_036 possession (Score: 44-39)
Pascal Antetokounmpo drives to the basket... Pascal Antetokounmpo throws a bad pass out of bounds! TURNOVER! (dead ball)

[02:29] Team_066 possession (Score: 44-39)
Donovan Simmons attempts a Layup. BLOCKED BY DIRK ANUNOBY! Ball is loose! Rebound secured by Devin Simmons.

[02:14] Team_036 possession (Score: 44-39)
FOUL! Shooting foul on Cole Morant. Devin Simmons to the line for 2 free throws. [Team fouls: 1] (Cole Morant: 1 personal fouls)   FT 1/2: GOOD   FT 2/2: MISS Devin Simmons makes 1/2 from the line. Rebound secured by Lauri LaVine.
Score: 44-40

[02:04] Team_066 possession (Score: 44-40)
FOUL! Shooting foul on Tobias Fox. Lauri LaVine to the line for 2 free throws. [BONUS: 6 team fouls] (Tobias Fox: 3 personal fouls)   FT 1/2: GOOD   FT 2/2: GOOD Lauri LaVine makes 2/2 from the line.
Score: 46-40

[01:46] Team_036 possession (Score: 46-40)
Tobias Fox commits a violation (traveling/carry)! TURNOVER! (dead ball)

[01:33] Team_066 possession (Score: 46-40)
Brandon Middleton drives and kicks out. Lauri LaVine attempts a 3Pt. Contested by Tobias Fox (4.6 feet, MAN). LAURI LAVINE MAKES IT! Assist: Donovan Simmons
Score: 49-40

[01:21] Team_036 possession (Score: 49-40)
Pascal Antetokounmpo attempts a 3Pt. Contested by Lauri LaVine (4.3 feet, ZONE). Pascal Antetokounmpo misses. Rebound secured by Lauri LaVine.

[01:07] Team_066 possession (Score: 49-40)
Pascal Carter attempts a 3Pt. Contested by Tobias Fox (4.8 feet, ZONE). PASCAL CARTER MAKES IT!
Score: 52-40

[00:53] Team_036 possession (Score: 52-40)
FOUL! Reach-in foul on Cole Morant during the drive. [Team fouls: 2] No free throws, side out. (Cole Morant: 2 personal fouls)

[00:36] Team_036 possession (Score: 52-40)
Tobias Fox attempts a Layup. Contested by Donovan Simmons (5.5 feet, ZONE). TOBIAS FOX MAKES IT! Assist: Devin Simmons
Score: 52-42

[00:20] Team_066 possession (Score: 52-42)
Brandon Middleton drives to the basket... Brandon Middleton loses the ball! Stripped by Devin Simmons! TURNOVER! (live ball)

[00:06] Team_036 possession (Score: 52-42)
Dirk Anunoby attempts a Midrange. Contested by Lauri LaVine (4.5 feet, ZONE). DIRK ANUNOBY MAKES IT! Assist: Pascal Antetokounmpo
Score: 52-44

================================================================================
                              2ND QUARTER COMPLETE                              
================================================================================

2ND QUARTER SCORE: Team_066 25, Team_036 13

BOX SCORE:
================================================================================

Team_066
--------------------------------------------------------------------------------
Player                MIN  PTS  REB  AST  TO      FG   FG%      3P   3P%
--------------------------------------------------------------------------------
Pascal Carter           9    9    0    0   0   3/4    75.0     0/0   0.0
Lauri LaVine            9    7    7    1   0   3/3   100.0     0/0   0.0
Donovan Simmons         9    4    1    1   0   2/4    50.0     0/0   0.0
Brandon Middleton       9    3    1    1   0   1/3    33.3     0/0   0.0
Brandon Reaves         15    2    1    0   0   1/2    50.0     0/0   0.0
Yao Brogdon            15    0    4    0   0   0/1     0.0     0/0   0.0
Jimmy Davis            15    0    0    0   0   0/1     0.0     0/0   0.0
Kyle Wagner            15    0    1    0   0   0/0     0.0     0/0   0.0
Cole Morant             9    0    0    0   0   0/1     0.0     0/0   0.0

TEAM: FG: 10/19 (52.6%), 3PT: 3/8 (37.5%), REB: 15 (3 off, 12 def), AST: 3, TO: 4
TEAM FOULS: 2


Team_036
--------------------------------------------------------------------------------
Player                MIN  PTS  REB  AST  TO      FG   FG%      3P   3P%
--------------------------------------------------------------------------------
Tobias Fox              9    6    0    0   0   3/5    60.0     0/0   0.0
Dirk Anunoby           13    4    0    0   0   2/3    66.7     0/0   0.0
Kobe Simmons           14    2    2    0   0   1/1   100.0     0/0   0.0
Giannis Booker         15    0    1    0   0   0/1     0.0     0/0   0.0
Michael Westbrook      15    0    0    0   0   0/1     0.0     0/0   0.0
Anthony Poole          15    0    0    0   0   0/1     0.0     0/0   0.0
Terry Durant           15    0    1    0   0   0/0     0.0     0/0   0.0
Pascal Antetokounmpo    9    0    1    1   0   0/2     0.0     0/0   0.0
Devin Simmons           9    0    4    2   0   0/3     0.0     0/0   0.0
Bradley Murray          7    0    0    1   0   0/1     0.0     0/0   0.0

TEAM: FG: 6/18 (33.3%), 3PT: 0/6 (0.0%), REB: 9 (0 off, 9 def), AST: 4, TO: 5
TEAM FOULS: 6 [Team_066 in BONUS]

================================================================================

================================================================================
                       3RD QUARTER - Team_066 vs Team_036                       
================================================================================

[12:00] Team_066 possession (Score: 52-44)
Kyle Wagner drives and kicks out. Yao Brogdon attempts a Midrange. Contested by Terry Durant (4.4 feet, MAN). Yao Brogdon misses. Offensive rebound by Kyle Wagner! Kyle Wagner kicks it out.

[11:47] Team_066 possession (Score: 52-44)
FOUL! Reach-in foul on Kobe Simmons during the drive. [Team fouls: 1] No free throws, side out. (Kobe Simmons: 1 personal fouls)

[11:30] Team_066 possession (Score: 52-44)
Kyle Wagner attempts a Layup. Contested by Kobe Simmons (3.3 feet, MAN). Kyle Wagner misses. Rebound secured by Terry Durant.

[11:18] Team_036 possession (Score: 52-44)
Michael Westbrook attempts a 3Pt. Contested by Pau Curry (6.0 feet, ZONE). Michael Westbrook misses. Rebound secured by Brandon Reaves.

[11:01] Team_066 possession (Score: 52-44)
Pau Curry attempts a 3Pt. Contested by Michael Westbrook (4.9 feet, ZONE). Pau Curry misses. Rebound secured by Terry Durant.

[10:43] Team_036 possession (Score: 52-44)
Michael Westbrook attempts a 3Pt. Contested by Jimmy Davis (4.4 feet, MAN). Michael Westbrook misses. Rebound secured by Yao Brogdon.

[10:27] Team_066 possession (Score: 52-44)
Jimmy Davis drives, Michael Westbrook stays with him. Jimmy Davis attempts a Dunk. Contested by Michael Westbrook (5.1 feet, MAN). JIMMY DAVIS MAKES IT! Assist: Pau Curry
Score: 54-44

[10:11] Team_036 possession (Score: 54-44)
Anthony Poole attempts a 3Pt. Contested by Brandon Reaves (5.8 feet, MAN). ANTHONY POOLE MAKES IT! Assist: Terry Durant
Score: 54-47

[09:54] Team_066 possession (Score: 54-47)
Yao Brogdon attempts a 3Pt. Contested by Terry Durant (4.9 feet, MAN). Yao Brogdon misses. Rebound secured by Terry Durant.

[09:37] Team_036 possession (Score: 54-47)
FOUL! Reach-in foul on Kyle Wagner during the drive. [Team fouls: 1] No free throws, side out. (Kyle Wagner: 1 personal fouls)

[09:23] Team_036 possession (Score: 54-47)
Michael Westbrook drives and kicks out. Kobe Simmons attempts a 3Pt. Contested by Kyle Wagner (3.9 feet, MAN). Kobe Simmons misses. Rebound secured by Yao Brogdon.

[09:08] Team_066 possession (Score: 54-47)
FOUL! Reach-in foul on Kobe Simmons during the drive. [Team fouls: 2] No free throws, side out. (Kobe Simmons: 2 personal fouls)

[08:50] Team_066 possession (Score: 54-47)
Kyle Wagner makes the Layup and draws the foul on Kobe Simmons! And-1! Kyle Wagner to the line for 1. [Team fouls: 3] (Kobe Simmons: 3 personal fouls)   FT 1/1: GOOD Kyle Wagner makes 1/1 from the line.
Score: 57-47

[08:38] Team_036 possession (Score: 57-47)
Giannis Booker attempts a 3Pt. Contested by Pau Curry (5.9 feet, MAN). Giannis Booker misses. Rebound secured by Yao Brogdon.

[08:25] Team_066 possession (Score: 57-47)
Pau Curry drives and kicks out. Kyle Wagner attempts a Midrange. Contested by Kobe Simmons (3.5 feet, MAN). Kyle Wagner misses. Offensive rebound by Kyle Wagner! Kyle Wagner kicks it out.

[08:06] Team_066 possession (Score: 57-47)
Pau Curry attempts a 3Pt. Contested by Giannis Booker (4.8 feet, MAN). Pau Curry misses. Rebound secured by Kobe Simmons.

[07:54] Team_036 possession (Score: 57-47)
Terry Durant attempts a 3Pt. Contested by Yao Brogdon (5.6 feet, MAN). TERRY DURANT MAKES IT! Assist: Kobe Simmons
Score: 57-50

[07:41] Team_066 possession (Score: 57-50)
Yao Brogdon attempts a Layup. BLOCKED BY GIANNIS BOOKER! Ball is loose! Offensive rebound by Yao Brogdon! Yao Brogdon kicks it out.

[07:28] Team_066 possession (Score: 57-50)
Kyle Wagner attempts a Layup. Contested by Kobe Simmons (3.3 feet, MAN). KYLE WAGNER MAKES IT! Assist: Jimmy Davis
Score: 59-50

[07:17] Team_036 possession (Score: 59-50)
Anthony Poole attempts a 3Pt. Wide open! Pau Curry is 6.2 feet away. [ZONE] Anthony Poole misses. FOUL! Loose ball foul on Kyle Wagner during the rebound battle. [Team fouls: 2] No free throws, side out. (Kyle Wagner: 2 personal fouls)

[07:02] Team_036 possession (Score: 59-50)
Giannis Booker attempts a 3Pt. Contested by Pau Curry (5.9 feet, MAN). Giannis Booker misses. Rebound secured by Yao Brogdon.

[06:48] Team_066 possession (Score: 59-50)
FOUL! Reach-in foul on Kobe Simmons during the drive. [Team fouls: 4] No free throws, side out. (Kobe Simmons: 4 personal fouls)

[06:30] Team_066 possession (Score: 59-50)
Yao Brogdon attempts a 3Pt. Contested by Michael Westbrook (5.1 feet, ZONE). Yao Brogdon misses. Rebound secured by Kobe Simmons.

[06:13] Team_036 possession (Score: 59-50)
FOUL! Holding foul on Brandon Reaves. [Team fouls: 3] No free throws, side out. (Brandon Reaves: 1 personal fouls)

[05:59] Team_036 possession (Score: 59-50)
Kobe Simmons attempts a 3Pt. Contested by Pau Curry (5.9 feet, ZONE). KOBE SIMMONS MAKES IT! Assist: Anthony Poole
Score: 59-53

[05:46] Team_066 possession (Score: 59-53)
Pau Curry attempts a Layup. Contested by Kobe Simmons (3.7 feet, ZONE). PAU CURRY MAKES IT!
Score: 61-53

[05:33] Team_036 possession (Score: 61-53)
Kobe Simmons attempts a Midrange. Contested by Brandon Reaves (5.5 feet, ZONE). Kobe Simmons misses. Offensive rebound by Kobe Simmons! Kobe Simmons's putback is no good. Rebound secured by Brandon Reaves.

[05:21] Team_066 possession (Score: 61-53)
Yao Brogdon drives to the basket... Yao Brogdon throws a bad pass! Stolen by Kobe Simmons! TURNOVER! (live ball)

[05:07] Team_036 possession (Score: 61-53)
FOUL! Shooting foul on Kyle Wagner. Anthony Poole to the line for 2 free throws. [Team fouls: 4] (Kyle Wagner: 3 personal fouls)   FT 1/2: GOOD   FT 2/2: GOOD Anthony Poole makes 2/2 from the line.
Score: 61-55

[04:53] Team_066 possession (Score: 61-55)
Pau Curry commits a violation (traveling/carry)! TURNOVER! (dead ball)

[04:42] Team_036 possession (Score: 61-55)
Terry Durant drives, Kyle Wagner stays with him. Terry Durant attempts a Dunk. Contested by Kyle Wagner (4.4 feet, ZONE). TERRY DURANT MAKES IT!
Score: 61-57

[04:25] Team_066 possession (Score: 61-57)
Pau Curry attempts a 3Pt. Contested by Michael Westbrook (5.0 feet, ZONE). PAU CURRY MAKES IT! Assist: Brandon Reaves
Score: 64-57

[04:07] Team_036 possession (Score: 64-57)
Michael Westbrook attempts a Midrange. Contested by Jimmy Davis (4.5 feet, MAN). MICHAEL WESTBROOK MAKES IT!
Score: 64-59

[03:55] Team_066 possession (Score: 64-59)
Kyle Wagner attempts a 3Pt. Contested by Michael Westbrook (4.6 feet, ZONE). KYLE WAGNER MAKES IT! Assist: Jimmy Davis
Score: 67-59

[03:39] Team_036 possession (Score: 67-59)
Anthony Poole attempts a 3Pt. Contested by Brandon Reaves (5.9 feet, MAN). Anthony Poole misses. Offensive rebound by Kobe Simmons! Kobe Simmons puts it back in!
Score: 67-61

[03:28] Team_066 possession (Score: 67-61)
Kyle Wagner attempts a Midrange. Contested by Giannis Booker (4.5 feet, ZONE). Kyle Wagner misses. Rebound secured by Giannis Booker.

[03:10] Team_036 possession (Score: 67-61)
Kobe Simmons attempts a 3Pt. Wide open! Pau Curry is 6.0 feet away. [ZONE] Kobe Simmons misses. FOUL! Loose ball foul on Brandon Reaves during the rebound battle. [IN THE BONUS! 5 team fouls] Kobe Simmons to the line for 2 free throws. (Brandon Reaves: 2 personal fouls)   FT 1/2: GOOD   FT 2/2: GOOD Kobe Simmons makes 2/2 from the line.
Score: 67-63

[02:55] Team_066 possession (Score: 67-63)
Jimmy Davis drives and kicks out. Pau Curry attempts a Midrange. BLOCKED BY ANTHONY POOLE! Ball deflects out of bounds off Pau Curry.

[02:42] Team_036 possession (Score: 67-63)
FOUL! Reach-in foul on Kyle Wagner during the drive. [IN THE BONUS! 6 team fouls] Kobe Simmons to the line for 2 free throws. (Kyle Wagner: 4 personal fouls)   FT 1/2: MISS   FT 2/2: GOOD Kobe Simmons makes 1/2 from the line.
Score: 67-64

[02:28] Team_066 possession (Score: 67-64)
Kyle Wagner makes the Midrange and draws the foul on Kobe Simmons! And-1! Kyle Wagner to the line for 1. [BONUS: 5 team fouls] (Kobe Simmons: 5 personal fouls)   FT 1/1: GOOD Kyle Wagner makes 1/1 from the line.
Score: 70-64

[02:11] Team_036 possession (Score: 70-64)
Terry Durant makes the Layup and draws the foul on Yao Brogdon! And-1! Terry Durant to the line for 1. [BONUS: 7 team fouls] (Yao Brogdon: 1 personal fouls)   FT 1/1: GOOD Terry Durant makes 1/1 from the line.
Score: 70-67

[01:59] Team_066 possession (Score: 70-67)
Kyle Wagner attempts a Layup. Contested by Kobe Simmons (3.7 feet, ZONE). KYLE WAGNER MAKES IT!
Score: 72-67

[01:45] Team_036 possession (Score: 72-67)
FOUL! Reach-in foul on Yao Brogdon during the drive. [IN THE BONUS! 8 team fouls] Giannis Booker to the line for 2 free throws. (Yao Brogdon: 2 personal fouls)   FT 1/2: MISS   FT 2/2: GOOD Giannis Booker makes 1/2 from the line.
Score: 72-68

[01:31] Team_066 possession (Score: 72-68)
Yao Brogdon attempts a Midrange. Contested by Terry Durant (5.2 feet, MAN). Yao Brogdon misses. Rebound secured by Terry Durant.

[01:18] Team_036 possession (Score: 72-68)
Michael Westbrook attempts a 3Pt. Wide open! Pau Curry is 6.3 feet away. [ZONE] Michael Westbrook misses. Rebound secured by Brandon Reaves.

[01:08] Team_066 possession (Score: 72-68)
Pau Curry attempts a 3Pt. Contested by Michael Westbrook (5.2 feet, ZONE). PAU CURRY MAKES IT! Assist: Kyle Wagner
Score: 75-68

[00:53] Team_036 possession (Score: 75-68)
Michael Westbrook makes the Layup and draws the foul on Jimmy Davis! And-1! Michael Westbrook to the line for 1. [BONUS: 9 team fouls] (Jimmy Davis: 1 personal fouls)   FT 1/1: GOOD Michael Westbrook makes 1/1 from the line.
Score: 75-71

[00:38] Team_066 possession (Score: 75-71)
Jimmy Davis attempts a Layup. Contested by Michael Westbrook (5.4 feet, MAN). JIMMY DAVIS MAKES IT! Assist: Kyle Wagner
Score: 77-71

[00:27] Team_036 possession (Score: 77-71)
Michael Westbrook attempts a Midrange. Wide open! Yao Brogdon is 6.0 feet away. [ZONE] MICHAEL WESTBROOK MAKES IT!
Score: 77-73

[00:13] Team_066 possession (Score: 77-73)
Jimmy Davis attempts a 3Pt. Contested by Michael Westbrook (5.5 feet, MAN). Jimmy Davis misses. Rebound secured by Kobe Simmons.

================================================================================
                              3RD QUARTER COMPLETE                              
================================================================================

3RD QUARTER SCORE: Team_066 25, Team_036 29

BOX SCORE:
================================================================================

Team_066
--------------------------------------------------------------------------------
Player                MIN  PTS  REB  AST  TO      FG   FG%      3P   3P%
--------------------------------------------------------------------------------
Kyle Wagner            27   13    2    2   0   5/7    71.4     0/0   0.0
Pau Curry              27    8    0    1   0   3/5    60.0     0/0   0.0
Jimmy Davis            27    4    0    2   0   2/4    50.0     0/0   0.0
Brandon Reaves         27    0    3    1   0   0/0     0.0     0/0   0.0
Yao Brogdon            27    0    5    0   0   0/3     0.0     0/0   0.0

TEAM: FG: 10/19 (52.6%), 3PT: 3/8 (37.5%), REB: 9 (3 off, 6 def), AST: 6, TO: 2
TEAM FOULS: 9 [Team_036 in BONUS]


Team_036
--------------------------------------------------------------------------------
Player                MIN  PTS  REB  AST  TO      FG   FG%      3P   3P%
--------------------------------------------------------------------------------
Terry Durant           27    8    4    1   0   3/3   100.0     0/0   0.0
Kobe Simmons           26    8    5    1   0   4/5    80.0     0/0   0.0
Michael Westbrook      27    7    0    0   0   3/7    42.9     0/0   0.0
Anthony Poole          27    5    0    1   0   2/2   100.0     0/0   0.0
Giannis Booker         27    1    1    0   0   1/3    33.3     0/0   0.0

TEAM: FG: 13/20 (65.0%), 3PT: 5/10 (50.0%), REB: 11 (3 off, 8 def), AST: 3, TO: 0
TEAM FOULS: 5 [Team_066 in BONUS]

================================================================================

================================================================================
                       4TH QUARTER - Team_066 vs Team_036                       
================================================================================

[12:00] Team_066 possession (Score: 77-73)
FOUL! Shooting foul on Anthony Poole. Brandon Reaves to the line for 3 free throws. [Team fouls: 1] (Anthony Poole: 1 personal fouls)   FT 1/3: GOOD   FT 2/3: GOOD   FT 3/3: MISS Brandon Reaves makes 2/3 from the line. Rebound secured by Terry Durant.
Score: 79-73

[11:44] Team_036 possession (Score: 79-73)
Kobe Simmons attempts a Layup. Contested by Kyle Wagner (4.5 feet, MAN). KOBE SIMMONS MAKES IT! Assist: Michael Westbrook
Score: 79-75

[11:26] Team_066 possession (Score: 79-75)
Pau Curry attempts a 3Pt. Contested by Giannis Booker (5.0 feet, MAN). Pau Curry misses. Rebound secured by Terry Durant.

[11:09] Team_036 possession (Score: 79-75)
Terry Durant attempts a 3Pt. Wide open! Pau Curry is 6.2 feet away. [ZONE] TERRY DURANT MAKES IT!
Score: 79-78

[10:52] Team_066 possession (Score: 79-78)
Yao Brogdon attempts a 3Pt. Contested by Terry Durant (5.2 feet, MAN). Yao Brogdon misses. FOUL! Loose ball foul on Terry Durant during the rebound battle. [Team fouls: 2] No free throws, side out. (Terry Durant: 1 personal fouls)

[10:42] Team_066 possession (Score: 79-78)
Yao Brogdon attempts a Midrange. Contested by Anthony Poole (5.6 feet, ZONE). Yao Brogdon misses. Rebound secured by Kobe Simmons.

[10:26] Team_036 possession (Score: 79-78)
Michael Westbrook drives, picks up Kyle Wagner. Help arrives from Jimmy Davis! Michael Westbrook attempts a Dunk. Contested by Jimmy Davis (4.8 feet, ZONE). Michael Westbrook misses. FOUL! Loose ball foul on Kyle Wagner during the rebound battle. [Team fouls: 1] No free throws, side out. (Kyle Wagner: 1 personal fouls)

[10:14] Team_036 possession (Score: 79-78)
Kobe Simmons makes the Layup and draws the foul on Kyle Wagner! And-1! Kobe Simmons to the line for 1. [Team fouls: 2] (Kyle Wagner: 2 personal fouls)   FT 1/1: GOOD Kobe Simmons makes 1/1 from the line.
Score: 79-81

[09:56] Team_066 possession (Score: 79-81)
FOUL! Reach-in foul on Kobe Simmons during the drive. [Team fouls: 3] No free throws, side out. (Kobe Simmons: 1 personal fouls)

[09:42] Team_066 possession (Score: 79-81)
Yao Brogdon attempts a Midrange. Contested by Terry Durant (5.4 feet, MAN). Yao Brogdon misses. Rebound secured by Kobe Simmons.

[09:27] Team_036 possession (Score: 79-81)
Giannis Booker drives, picks up Pau Curry. Help arrives from Jimmy Davis! Giannis Booker attempts a Layup. Wide open! Jimmy Davis is 6.3 feet away. [MAN] GIANNIS BOOKER MAKES IT! Assist: Terry Durant
Score: 79-83

[09:10] Team_066 possession (Score: 79-83)
Kyle Wagner drives, picks up Kobe Simmons. Help arrives from Giannis Booker! Kyle Wagner attempts a Layup. Contested by Giannis Booker (4.1 feet, MAN). Kyle Wagner misses. Rebound secured by Giannis Booker.

[08:55] Team_036 possession (Score: 79-83)
Anthony Poole drives and kicks out. Giannis Booker attempts a Midrange. Wide open! Pau Curry is 6.1 feet away. [MAN] GIANNIS BOOKER MAKES IT!
Score: 79-85

[08:43] Team_066 possession (Score: 79-85)
Kyle Wagner attempts a Layup. Contested by Kobe Simmons (4.1 feet, MAN). KYLE WAGNER MAKES IT! Assist: Brandon Reaves
Score: 81-85

[08:25] Team_036 possession (Score: 81-85)
Anthony Poole attempts a Midrange. Wide open! Brandon Reaves is 6.3 feet away. [MAN] Anthony Poole misses. Offensive rebound by Terry Durant! Terry Durant kicks it out.

[08:14] Team_036 possession (Score: 81-85)
FOUL! Offensive foul on Terry Durant! Yao Brogdon drew the charge! [Team fouls: 4] (Terry Durant: 2 personal fouls) TURNOVER! (dead ball)

[07:58] Team_066 possession (Score: 81-85)
Yao Brogdon attempts a Layup. Contested by Terry Durant (5.5 feet, ZONE). YAO BROGDON MAKES IT! Assist: Jimmy Davis
Score: 83-85

[07:47] Team_036 possession (Score: 83-85)
Anthony Poole attempts a 3Pt. Wide open! Brandon Reaves is 6.4 feet away. [MAN] Anthony Poole misses. Rebound secured by Yao Brogdon.

[07:34] Team_066 possession (Score: 83-85)
Yao Brogdon attempts a 3Pt. Contested by Michael Westbrook (5.7 feet, ZONE). Yao Brogdon misses. Rebound secured by Giannis Booker.

[07:20] Team_036 possession (Score: 83-85)
Terry Durant attempts a 3Pt. Wide open! Pau Curry is 6.6 feet away. [ZONE] TERRY DURANT MAKES IT! Assist: Kobe Simmons
Score: 83-88

[07:05] Team_066 possession (Score: 83-88)
Kyle Wagner attempts a Layup. Contested by Kobe Simmons (4.4 feet, MAN). KYLE WAGNER MAKES IT! Assist: Jimmy Davis
Score: 85-88

[06:48] Team_036 possession (Score: 85-88)
Giannis Booker drives and kicks out. Anthony Poole attempts a 3Pt. Contested by Brandon Reaves (6.0 feet, MAN). Anthony Poole misses. Rebound secured by Yao Brogdon.

[06:32] Team_066 possession (Score: 85-88)
Jimmy Davis attempts a 3Pt. Contested by Michael Westbrook (5.8 feet, ZONE). Jimmy Davis misses. Rebound secured by Terry Durant.

[06:22] Team_036 possession (Score: 85-88)
Michael Westbrook drives to the basket... Michael Westbrook throws a bad pass out of bounds! TURNOVER! (dead ball)

[06:22] Substitution (Team_066): Jimmy Davis OUT → Pascal Carter IN (stamina_rule2)

[06:22] Substitution (Team_066): Pau Curry OUT → Lauri LaVine IN (stamina_rule2)

[06:22] Substitution (Team_066): Brandon Reaves OUT → Brandon Middleton IN (stamina_rule2)

[06:22] Substitution (Team_066): Yao Brogdon OUT → Cole Morant IN (stamina_rule2)

[06:22] Substitution (Team_066): Kyle Wagner OUT → Donovan Simmons IN (stamina_rule2)

[06:22] Substitution (Team_036): Michael Westbrook OUT → Dirk Anunoby IN (stamina_rule2)

[06:22] Substitution (Team_036): Giannis Booker OUT → Tobias Fox IN (stamina_rule2)

[06:22] Substitution (Team_036): Anthony Poole OUT → Pascal Antetokounmpo IN (stamina_rule2)

[06:22] Substitution (Team_036): Terry Durant OUT → Devin Simmons IN (stamina_rule2)

[06:22] Substitution (Team_036): Kobe Simmons OUT → Bradley Murray IN (stamina_rule2)

[06:03] Team_066 possession (Score: 85-88)
Pascal Carter attempts a Midrange. Contested by Devin Simmons (5.4 feet, ZONE). PASCAL CARTER MAKES IT!
Score: 87-88

[05:53] Team_036 possession (Score: 87-88)
Pascal Antetokounmpo attempts a Midrange. Contested by Brandon Middleton (5.4 feet, MAN). Pascal Antetokounmpo misses. Offensive rebound by Devin Simmons! Devin Simmons kicks it out.

[05:37] Team_036 possession (Score: 87-88)
Tobias Fox drives, Lauri LaVine stays with him. Tobias Fox attempts a Dunk. Contested by Lauri LaVine (4.3 feet, MAN). TOBIAS FOX MAKES IT! Assist: Devin Simmons
Score: 87-90

[05:23] Team_066 possession (Score: 87-90)
Cole Morant attempts a Midrange. Contested by Devin Simmons (5.8 feet, MAN). COLE MORANT MAKES IT! Assist: Donovan Simmons
Score: 89-90

[05:08] Team_036 possession (Score: 89-90)
Dirk Anunoby attempts a 3Pt. Wide open! Pascal Carter is 7.1 feet away. [MAN] DIRK ANUNOBY MAKES IT! Assist: Tobias Fox
Score: 89-93

[04:56] Team_066 possession (Score: 89-93)
Donovan Simmons drives, picks up Bradley Murray. Help arrives from Dirk Anunoby! Donovan Simmons attempts a Layup. Contested by Dirk Anunoby (4.7 feet, MAN). DONOVAN SIMMONS MAKES IT!
Score: 91-93

[04:37] Team_036 possession (Score: 91-93)
Tobias Fox attempts a 3Pt. Contested by Lauri LaVine (4.3 feet, ZONE). Tobias Fox misses. FOUL! Loose ball foul on Lauri LaVine during the rebound battle. [Team fouls: 3] No free throws, side out. (Lauri LaVine: 1 personal fouls)

[04:24] Team_036 possession (Score: 91-93)
FOUL! Holding foul on Lauri LaVine. [Team fouls: 4] No free throws, side out. (Lauri LaVine: 2 personal fouls)

[04:11] Team_036 possession (Score: 91-93)
Bradley Murray drives and kicks out. Dirk Anunoby attempts a 3Pt. Contested by Lauri LaVine (3.9 feet, ZONE). Dirk Anunoby misses. Rebound secured by Lauri LaVine.

[03:53] Team_066 possession (Score: 91-93)
Pascal Carter attempts a 3Pt. Contested by Dirk Anunoby (5.7 feet, MAN). Pascal Carter misses. Rebound secured by Pascal Antetokounmpo.

[03:38] Team_036 possession (Score: 91-93)
Pascal Antetokounmpo attempts a 3Pt. Contested by Brandon Middleton (5.4 feet, MAN). PASCAL ANTETOKOUNMPO MAKES IT! Assist: Bradley Murray
Score: 91-96

[03:25] Team_066 possession (Score: 91-96)
Brandon Middleton attempts a 3Pt. Contested by Pascal Antetokounmpo (4.6 feet, MAN). Brandon Middleton misses. Rebound secured by Bradley Murray.

[03:10] Team_036 possession (Score: 91-96)
Devin Simmons attempts a 3Pt. Contested by Lauri LaVine (4.0 feet, ZONE). Devin Simmons misses. Rebound secured by Donovan Simmons.

[02:52] Team_066 possession (Score: 91-96)
FOUL! Shooting foul on Devin Simmons. Pascal Carter to the line for 2 free throws. [BONUS: 5 team fouls] (Devin Simmons: 1 personal fouls)   FT 1/2: GOOD   FT 2/2: GOOD Pascal Carter makes 2/2 from the line.
Score: 93-96

[02:41] Team_036 possession (Score: 93-96)
FOUL! Offensive foul on Tobias Fox! Lauri LaVine drew the charge! [Team fouls: 6] (Tobias Fox: 1 personal fouls) TURNOVER! (dead ball)

[02:25] Team_066 possession (Score: 93-96)
Brandon Middleton attempts a 3Pt. Contested by Pascal Antetokounmpo (4.6 feet, MAN). Brandon Middleton misses. Offensive rebound by Donovan Simmons! Donovan Simmons kicks it out.

[02:07] Team_066 possession (Score: 93-96)
Pascal Carter attempts a Midrange. Contested by Dirk Anunoby (5.7 feet, MAN). PASCAL CARTER MAKES IT! Assist: Donovan Simmons
Score: 95-96

[01:55] Team_036 possession (Score: 95-96)
Devin Simmons attempts a Layup. Contested by Donovan Simmons (5.0 feet, ZONE). DEVIN SIMMONS MAKES IT! Assist: Pascal Antetokounmpo
Score: 95-98

[01:41] Team_066 possession (Score: 95-98)
Donovan Simmons drives to the basket... Donovan Simmons loses the ball! Stripped by Bradley Murray! TURNOVER! (live ball)

[01:29] Team_036 possession (Score: 95-98)
Pascal Antetokounmpo attempts a Midrange. Contested by Donovan Simmons (5.1 feet, ZONE). Pascal Antetokounmpo misses. Rebound secured by Brandon Middleton.

[01:14] Team_066 possession (Score: 95-98)
Pascal Carter attempts a 3Pt. Contested by Tobias Fox (4.7 feet, ZONE). Pascal Carter misses. Offensive rebound by Donovan Simmons! Donovan Simmons kicks it out.

[01:00] Team_066 possession (Score: 95-98)
Lauri LaVine attempts a 3Pt. Contested by Tobias Fox (4.7 feet, ZONE). LAURI LAVINE MAKES IT! Assist: Donovan Simmons
Score: 98-98

[00:45] Team_036 possession (Score: 98-98)
Dirk Anunoby attempts a 3Pt. Wide open! Pascal Carter is 7.1 feet away. [MAN] Dirk Anunoby misses. Rebound secured by Brandon Middleton.

[00:30] Team_066 possession (Score: 98-98)
FOUL! Reach-in foul on Devin Simmons during the drive. [IN THE BONUS! 7 team fouls] Pascal Carter to the line for 2 free throws. (Devin Simmons: 2 personal fouls)   FT 1/2: MISS   FT 2/2: GOOD Pascal Carter makes 1/2 from the line.
Score: 99-98

[00:17] Team_036 possession (Score: 99-98)
Dirk Anunoby attempts a 3Pt. Contested by Lauri LaVine (4.3 feet, ZONE). Dirk Anunoby misses. FOUL! Loose ball foul on Donovan Simmons during the rebound battle. [IN THE BONUS! 5 team fouls] Devin Simmons to the line for 2 free throws. (Donovan Simmons: 1 personal fouls)   FT 1/2: GOOD   FT 2/2: GOOD Devin Simmons makes 2/2 from the line.
Score: 99-100

[00:02] Team_066 possession (Score: 99-100)
Donovan Simmons makes the Layup and draws the foul on Bradley Murray! And-1! Donovan Simmons to the line for 1. [BONUS: 8 team fouls] (Bradley Murray: 1 personal fouls)   FT 1/1: GOOD Donovan Simmons makes 1/1 from the line.
Score: 102-100

================================================================================
                              4TH QUARTER COMPLETE                              
================================================================================

4TH QUARTER SCORE: Team_066 25, Team_036 27

BOX SCORE:
================================================================================

Team_066
--------------------------------------------------------------------------------
Player                MIN  PTS  REB  AST  TO      FG   FG%      3P   3P%
--------------------------------------------------------------------------------
Pascal Carter          16    7    0    0   0   4/5    80.0     0/0   0.0
Donovan Simmons        16    5    3    3   0   2/2   100.0     0/0   0.0
Kyle Wagner            33    4    1    0   0   2/3    66.7     0/0   0.0
Lauri LaVine           16    3    1    0   0   1/1   100.0     0/0   0.0
Yao Brogdon            33    2    2    0   0   1/4    25.0     0/0   0.0
Cole Morant            16    2    0    0   0   1/1   100.0     0/0   0.0
Brandon Reaves         33    0    0    1   0   0/1     0.0     0/0   0.0
Pau Curry              33    0    0    0   0   0/1     0.0     0/0   0.0
Jimmy Davis            33    0    0    2   0   0/1     0.0     0/0   0.0
Brandon Middleton      16    0    2    0   0   0/1     0.0     0/0   0.0

TEAM: FG: 11/20 (55.0%), 3PT: 1/7 (14.3%), REB: 9 (3 off, 6 def), AST: 6, TO: 1
TEAM FOULS: 5 [Team_036 in BONUS]


Team_036
--------------------------------------------------------------------------------
Player                MIN  PTS  REB  AST  TO      FG   FG%      3P   3P%
--------------------------------------------------------------------------------
Terry Durant           33    6    4    1   0   2/2   100.0     0/0   0.0
Kobe Simmons           32    5    3    1   0   2/2   100.0     0/0   0.0
Giannis Booker         33    4    2    0   0   2/3    66.7     0/0   0.0
Devin Simmons          16    4    2    1   0   2/3    66.7     0/0   0.0
Dirk Anunoby           19    3    0    0   0   1/2    50.0     0/0   0.0
Pascal Antetokounmpo   16    3    1    1   0   1/2    50.0     0/0   0.0
Tobias Fox             16    2    0    1   0   1/1   100.0     0/0   0.0
Michael Westbrook      33    0    0    1   0   0/0     0.0     0/0   0.0
Anthony Poole          33    0    0    0   0   0/1     0.0     0/0   0.0
Bradley Murray         13    0    1    1   0   0/1     0.0     0/0   0.0

TEAM: FG: 11/17 (64.7%), 3PT: 5/8 (62.5%), REB: 13 (4 off, 9 def), AST: 7, TO: 3
TEAM FOULS: 8 [Team_066 in BONUS]

================================================================================

================================================================================
                               FULL GAME COMPLETE                               
================================================================================

FINAL SCORE: Team_066 102, Team_036 100

SCORING BY QUARTER:
--------------------------------------------------------------------------------
Team                     Q1     Q2     Q3     Q4    FINAL
--------------------------------------------------------------------------------
Team_066                 27     25     25     25      102
Team_036                 31     13     29     27      100
--------------------------------------------------------------------------------

FULL GAME BOX SCORE:
================================================================================

Team_066
--------------------------------------------------------------------------------
Player                MIN  PTS  REB  AST  TO      FG   FG%      3P   3P%      FT STL BLK
--------------------------------------------------------------------------------
Jimmy Davis            33   11    0    4   2   5/12   41.7   0/4     0.0   3/3     0   0
Pau Curry              33   10    0    2   1   5/8    62.5   3/6    50.0   0/0     0   0
Brandon Reaves         33    2    5    4   0   1/5    20.0   0/2     0.0   2/3     0   0
Yao Brogdon            33    9   14    0   1   3/13   23.1   0/3     0.0   3/5     0   0
Kyle Wagner            33   26    9    3   0  11/17   64.7   2/3    66.7   6/10    1   0
Pascal Carter          16   16    0    0   0   7/9    77.8   3/5    60.0   6/7     0   0
Lauri LaVine           16   10    8    1   0   3/3   100.0   1/1   100.0   4/4     0   0
Brandon Middleton      16    3    3    1   1   1/4    25.0   0/3     0.0   3/3     0   0
Cole Morant            16    2    0    0   3   2/3    66.7   0/1     0.0   0/0     0   0
Donovan Simmons        16    9    4    4   0   4/6    66.7   0/0     0.0   1/1     0   0

TEAM: FG: 42/80 (52.5%), 3PT: 9/28 (32.1%), REB: 40 (10 off, 30 def), AST: 19, TO: 8


Team_036
--------------------------------------------------------------------------------
Player                MIN  PTS  REB  AST  TO      FG   FG%      3P   3P%      FT STL BLK
--------------------------------------------------------------------------------
Michael Westbrook      33   12    0    1   0   5/12   41.7   1/7    14.3   3/3     0   0
Giannis Booker         33    7    7    0   0   3/10   30.0   0/6     0.0   1/2     0   1
Anthony Poole          33   16    1    1   2   8/12   66.7   3/6    50.0   6/6     0   2
Terry Durant           33   18   13    3   1   7/8    87.5   3/3   100.0   3/3     0   0
Kobe Simmons           32   19   15    3   1   7/8    87.5   2/2   100.0   6/7     1   1
Dirk Anunoby           19   12    0    0   0   6/8    75.0   2/4    50.0   1/1     0   1
Tobias Fox             16    8    0    1   2   4/6    66.7   0/0     0.0   0/0     0   0
Pascal Antetokounmpo   16    3    2    2   2   1/4    25.0   1/3    33.3   0/0     0   0
Devin Simmons          16    4    6    3   0   1/5    20.0   0/1     0.0   3/4     1   1
Bradley Murray         13    0    1    2   1   0/2     0.0   0/0     0.0   0/0     1   0

TEAM: FG: 43/76 (56.6%), 3PT: 12/32 (37.5%), REB: 48 (11 off, 37 def), AST: 16, TO: 9

================================================================================
