================================================================================
                        FULL GAME - Team_085 vs Team_010                        
================================================================================

================================================================================
                       1ST QUARTER - Team_085 vs Team_010                       
================================================================================

[12:00] Team_085 possession (Score: 0-0)
Paul Wagner drives, picks up Desmond Antetokounmpo. Help arrives from Cade Morant! Paul Wagner attempts a Dunk. Contested by Cade Morant (4.5 feet, MAN). PAUL WAGNER MAKES IT! Assist: Stephen Bird
Score: 2-0

[11:47] Team_010 possession (Score: 2-0)
Anthony Durant attempts a Layup. Contested by Paul Wagner (3.8 feet, ZONE). Anthony Durant misses. FOUL! Loose ball foul on Paul Wagner during the rebound battle. [Team fouls: 1] No free throws, side out. (Paul Wagner: 1 personal fouls)

[11:36] Team_010 possession (Score: 2-0)
Cade Morant attempts a Layup. BLOCKED BY LARRY DUNCAN! Ball is loose! Rebound secured by Collin Mobley.

[11:20] Team_085 possession (Score: 2-0)
Stephen Bird attempts a 3Pt. Contested by RJ Young (5.0 feet, ZONE). Stephen Bird misses. Rebound secured by Cade Morant.

[11:07] Team_010 possession (Score: 2-0)
Desmond Antetokounmpo drives to the basket... Desmond Antetokounmpo loses the ball! Stripped by Paul Wagner! TURNOVER! (live ball)

[10:52] Team_085 possession (Score: 2-0)
Stephen Bird attempts a Layup. Contested by Michael Turner (4.3 feet, MAN). STEPHEN BIRD MAKES IT! Assist: Larry Duncan
Score: 4-0

[10:42] Team_010 possession (Score: 4-0)
Cade Morant attempts a 3Pt. Contested by Magic Beal (4.5 feet, MAN). CADE MORANT MAKES IT! Assist: Anthony Durant
Score: 4-3

[10:25] Team_085 possession (Score: 4-3)
Larry Duncan makes the Dunk and draws the foul on RJ Young! And-1! Larry Duncan to the line for 1. [Team fouls: 1] (RJ Young: 1 personal fouls)   FT 1/1: GOOD Larry Duncan makes 1/1 from the line.
Score: 7-3

[10:09] Team_010 possession (Score: 7-3)
Desmond Antetokounmpo attempts a 3Pt. Contested by Magic Beal (4.2 feet, ZONE). Desmond Antetokounmpo misses. Rebound secured by Larry Duncan.

[09:54] Team_085 possession (Score: 7-3)
Stephen Bird attempts a Midrange. Contested by Michael Turner (4.3 feet, ZONE). Stephen Bird misses. Rebound secured by Desmond Antetokounmpo.

[09:39] Team_010 possession (Score: 7-3)
RJ Young attempts a 3Pt. Contested by Larry Duncan (2.9 feet, MAN). RJ YOUNG MAKES IT! Assist: Anthony Durant
Score: 7-6

[09:24] Team_085 possession (Score: 7-6)
Paul Wagner attempts a Midrange. Contested by Desmond Antetokounmpo (4.5 feet, MAN). Paul Wagner misses. Rebound secured by Desmond Antetokounmpo.

[09:08] Team_010 possession (Score: 7-6)
RJ Young attempts a 3Pt. Contested by Larry Duncan (2.9 feet, MAN). RJ Young misses. Offensive rebound by Anthony Durant! Anthony Durant kicks it out.

[08:55] Team_010 possession (Score: 7-6)
Michael Turner makes the Midrange and draws the foul on Paul Wagner! And-1! Michael Turner to the line for 1. [Team fouls: 2] (Paul Wagner: 2 personal fouls)   FT 1/1: GOOD Michael Turner makes 1/1 from the line.
Score: 7-9

[08:39] Team_085 possession (Score: 7-9)
Larry Duncan drives, RJ Young stays with him. Larry Duncan attempts a Layup. Contested by RJ Young (5.1 feet, MAN). LARRY DUNCAN MAKES IT!
Score: 9-9

[08:22] Team_010 possession (Score: 9-9)
Anthony Durant drives and kicks out. Desmond Antetokounmpo attempts a 3Pt. Contested by Magic Beal (4.0 feet, ZONE). DESMOND ANTETOKOUNMPO MAKES IT! Assist: Anthony Durant
Score: 9-12

[08:07] Team_085 possession (Score: 9-12)
Larry Duncan attempts a Dunk. BLOCKED BY ANTHONY DURANT! Ball deflects out of bounds off Larry Duncan.

[07:53] Team_010 possession (Score: 9-12)
Michael Turner attempts a 3Pt. Contested by Magic Beal (4.3 feet, ZONE). Michael Turner misses. Rebound secured by Larry Duncan.

[07:37] Team_085 possession (Score: 9-12)
Collin Mobley attempts a 3Pt. Contested by Cade Morant (3.8 feet, ZONE). Collin Mobley misses. Rebound secured by Anthony Durant.

[07:20] Team_010 possession (Score: 9-12)
RJ Young drives and kicks out. RJ Young attempts a 3Pt. Contested by Larry Duncan (3.0 feet, MAN). RJ YOUNG MAKES IT! Assist: Michael Turner
Score: 9-15

[07:09] Team_085 possession (Score: 9-15)
FOUL! Shooting foul on Cade Morant. Stephen Bird to the line for 2 free throws. [Team fouls: 2] (Cade Morant: 1 personal fouls)   FT 1/2: GOOD   FT 2/2: MISS Stephen Bird makes 1/2 from the line. Rebound secured by Anthony Durant.
Score: 10-15

[06:55] Team_010 possession (Score: 10-15)
Cade Morant drives, Paul Wagner stays with him. Cade Morant attempts a Dunk. Contested by Paul Wagner (4.0 feet, ZONE). CADE MORANT MAKES IT!
Score: 10-17

[06:38] Team_085 possession (Score: 10-17)
Paul Wagner attempts a Midrange. Contested by RJ Young (5.0 feet, ZONE). Paul Wagner misses. Rebound secured by Desmond Antetokounmpo.

[06:22] Team_010 possession (Score: 10-17)
Desmond Antetokounmpo attempts a Layup. Contested by Collin Mobley (4.1 feet, ZONE). Desmond Antetokounmpo misses. Rebound secured by Collin Mobley.

[06:07] Team_085 possession (Score: 10-17)
FOUL! Shooting foul on RJ Young. Larry Duncan to the line for 2 free throws. [Team fouls: 3] (RJ Young: 2 personal fouls)   FT 1/2: GOOD   FT 2/2: GOOD Larry Duncan makes 2/2 from the line.
Score: 12-17

[05:54] Team_010 possession (Score: 12-17)
Michael Turner attempts a Layup. Contested by Paul Wagner (3.8 feet, ZONE). Michael Turner misses. Rebound secured by Paul Wagner.

[05:40] Team_085 possession (Score: 12-17)
Larry Duncan drives and kicks out. Collin Mobley attempts a Midrange. Contested by Michael Turner (4.0 feet, ZONE). Collin Mobley misses. Rebound secured by Cade Morant.

[05:27] Team_010 possession (Score: 12-17)
FOUL! Reach-in foul on Paul Wagner during the drive. [Team fouls: 3] No free throws, side out. (Paul Wagner: 3 personal fouls)

[05:13] Team_010 possession (Score: 12-17)
Desmond Antetokounmpo attempts a Midrange. Contested by Magic Beal (4.2 feet, ZONE). Desmond Antetokounmpo misses. Rebound secured by Collin Mobley.

[04:57] Team_085 possession (Score: 12-17)
Stephen Bird attempts a 3Pt. Contested by Cade Morant (4.2 feet, ZONE). Stephen Bird misses. Rebound secured by Cade Morant.

[04:42] Team_010 possession (Score: 12-17)
Cade Morant drives, Paul Wagner stays with him. Cade Morant attempts a Layup. Contested by Paul Wagner (4.0 feet, ZONE). Cade Morant misses. Rebound secured by Paul Wagner.

[04:32] Team_085 possession (Score: 12-17)
Collin Mobley drives and kicks out. Stephen Bird attempts a 3Pt. Contested by Cade Morant (4.0 feet, ZONE). STEPHEN BIRD MAKES IT! Assist: Larry Duncan
Score: 15-17

[04:21] Team_010 possession (Score: 15-17)
Desmond Antetokounmpo attempts a 3Pt. Contested by Stephen Bird (3.7 feet, ZONE). Desmond Antetokounmpo misses. FOUL! Loose ball foul on Collin Mobley during the rebound battle. [Team fouls: 4] No free throws, side out. (Collin Mobley: 1 personal fouls)

[04:06] Team_010 possession (Score: 15-17)
Michael Turner attempts a 3Pt. Contested by Magic Beal (4.4 feet, ZONE). MICHAEL TURNER MAKES IT! Assist: Desmond Antetokounmpo
Score: 15-20

[03:56] Team_085 possession (Score: 15-20)
Paul Wagner drives, Desmond Antetokounmpo stays with him. Paul Wagner attempts a Dunk. Contested by Desmond Antetokounmpo (4.7 feet, MAN). PAUL WAGNER MAKES IT! Assist: Stephen Bird
Score: 17-20

[03:42] Team_010 possession (Score: 17-20)
Anthony Durant drives, Paul Wagner stays with him. Anthony Durant attempts a Layup. Contested by Paul Wagner (3.9 feet, ZONE). Anthony Durant misses. FOUL! Loose ball foul on Collin Mobley during the rebound battle. [IN THE BONUS! 5 team fouls] Anthony Durant to the line for 2 free throws. (Collin Mobley: 2 personal fouls)   FT 1/2: GOOD   FT 2/2: MISS Anthony Durant makes 1/2 from the line. Rebound secured by Paul Wagner.
Score: 17-21

[03:29] Team_085 possession (Score: 17-21)
Magic Beal attempts a 3Pt. Contested by Cade Morant (4.5 feet, ZONE). Magic Beal misses. FOUL! Loose ball foul on Anthony Durant during the rebound battle. [Team fouls: 4] No free throws, side out. (Anthony Durant: 1 personal fouls)

[03:14] Team_085 possession (Score: 17-21)
Magic Beal attempts a Midrange. Contested by Michael Turner (4.6 feet, ZONE). MAGIC BEAL MAKES IT!
Score: 19-21

[03:02] Team_010 possession (Score: 19-21)
Anthony Durant drives, picks up Collin Mobley. Help arrives from Magic Beal! Anthony Durant attempts a Dunk. Contested by Magic Beal (4.4 feet, MAN). Anthony Durant misses. Rebound secured by Paul Wagner.

[02:49] Team_085 possession (Score: 19-21)
FOUL! Offensive foul on Magic Beal! Cade Morant drew the charge! [Team fouls: 6] (Magic Beal: 1 personal fouls) TURNOVER! (dead ball)

[02:36] Team_010 possession (Score: 19-21)
Cade Morant drives, picks up Magic Beal. Help arrives from Larry Duncan! Cade Morant attempts a Layup. Contested by Larry Duncan (4.7 feet, MAN). CADE MORANT MAKES IT! Assist: RJ Young
Score: 19-23

[02:16] Team_085 possession (Score: 19-23)
Collin Mobley attempts a Midrange. Contested by Anthony Durant (3.7 feet, MAN). Collin Mobley misses. Rebound secured by Cade Morant.

[01:59] Team_010 possession (Score: 19-23)
Michael Turner drives, picks up Stephen Bird. Help arrives from Larry Duncan! Michael Turner attempts a Dunk. Contested by Larry Duncan (4.0 feet, MAN). Michael Turner misses. Offensive rebound by Anthony Durant! Anthony Durant kicks it out.

[01:46] Team_010 possession (Score: 19-23)
Michael Turner makes the Layup and draws the foul on Paul Wagner! And-1! Michael Turner to the line for 1. [BONUS: 7 team fouls] (Paul Wagner: 4 personal fouls)   FT 1/1: GOOD Michael Turner makes 1/1 from the line.
Score: 19-26

[01:28] Team_085 possession (Score: 19-26)
Stephen Bird drives and kicks out. Stephen Bird attempts a Midrange. Contested by Michael Turner (4.4 feet, MAN). Stephen Bird misses. Rebound secured by Michael Turner.

[01:12] Team_010 possession (Score: 19-26)
Cade Morant attempts a Layup. Contested by Magic Beal (4.8 feet, MAN). CADE MORANT MAKES IT! Assist: Michael Turner
Score: 19-28

[00:58] Team_085 possession (Score: 19-28)
Collin Mobley attempts a Midrange. Contested by Michael Turner (4.3 feet, ZONE). Collin Mobley misses. Rebound secured by Michael Turner.

[00:47] Team_010 possession (Score: 19-28)
Michael Turner attempts a 3Pt. Contested by Stephen Bird (4.2 feet, MAN). Michael Turner misses. Rebound secured by Collin Mobley.

[00:30] Team_085 possession (Score: 19-28)
Larry Duncan attempts a Midrange. Contested by RJ Young (5.5 feet, ZONE). Larry Duncan misses. Rebound secured by Anthony Durant.

[00:17] Team_010 possession (Score: 19-28)
Anthony Durant drives and kicks out. Cade Morant attempts a Midrange. Contested by Larry Duncan (3.6 feet, ZONE). Cade Morant misses. Rebound secured by Larry Duncan.

[00:07] Team_085 possession (Score: 19-28)
Magic Beal attempts a 3Pt. Contested by Cade Morant (4.9 feet, MAN). Magic Beal misses. Offensive rebound by Paul Wagner! Paul Wagner kicks it out.

================================================================================
                              1ST QUARTER COMPLETE                              
================================================================================

1ST QUARTER SCORE: Team_085 19, Team_010 28

BOX SCORE:
================================================================================

Team_085
--------------------------------------------------------------------------------
Player                MIN  PTS  REB  AST  TO      FG   FG%      3P   3P%
--------------------------------------------------------------------------------
Larry Duncan           12    7    4    2   0   3/6    50.0     0/0   0.0
Stephen Bird           12    5    0    2   0   2/7    28.6     0/0   0.0
Paul Wagner            12    4    5    0   0   2/4    50.0     0/0   0.0
Magic Beal             12    2    0    0   0   1/1   100.0     0/0   0.0
Collin Mobley          12    0    4    0   0   0/3     0.0     0/0   0.0

TEAM: FG: 8/21 (38.1%), 3PT: 0/3 (0.0%), REB: 12 (2 off, 10 def), AST: 4, TO: 1
TEAM FOULS: 7 [Team_010 in BONUS]


Team_010
--------------------------------------------------------------------------------
Player                MIN  PTS  REB  AST  TO      FG   FG%      3P   3P%
--------------------------------------------------------------------------------
Cade Morant            12    9    5    0   0   4/6    66.7     0/0   0.0
Michael Turner         12    9    2    2   0   3/6    50.0     0/0   0.0
RJ Young               12    6    0    1   0   2/2   100.0     0/0   0.0
Desmond Antetokounmpo   12    3    3    1   0   1/4    25.0     0/0   0.0
Anthony Durant         12    0    6    3   0   0/3     0.0     0/0   0.0

TEAM: FG: 10/21 (47.6%), 3PT: 3/6 (50.0%), REB: 17 (5 off, 12 def), AST: 7, TO: 1
TEAM FOULS: 4

================================================================================

================================================================================
                       2ND QUARTER - Team_085 vs Team_010                       
================================================================================

[12:00] Team_085 possession (Score: 19-28)
Collin Mobley attempts a Midrange. Contested by Anthony Durant (3.8 feet, MAN). Collin Mobley misses. Rebound secured by Cade Morant.

[11:46] Team_010 possession (Score: 19-28)
Anthony Durant drives and kicks out. Anthony Durant attempts a 3Pt. Contested by Collin Mobley (4.3 feet, MAN). Anthony Durant misses. Rebound secured by Collin Mobley.

[11:31] Team_085 possession (Score: 19-28)
Paul Wagner attempts a Layup. Contested by Anthony Durant (4.2 feet, ZONE). PAUL WAGNER MAKES IT! Assist: Magic Beal
Score: 21-28

[11:15] Team_010 possession (Score: 21-28)
RJ Young attempts a 3Pt. Contested by Magic Beal (4.2 feet, ZONE). RJ Young misses. Rebound secured by Paul Wagner.

[11:06] Team_085 possession (Score: 21-28)
FOUL! Holding foul on Michael Turner. [Team fouls: 1] No free throws, side out. (Michael Turner: 1 personal fouls)

[10:55] Team_085 possession (Score: 21-28)
FOUL! Holding foul on Anthony Durant. [Team fouls: 2] No free throws, side out. (Anthony Durant: 1 personal fouls)

[10:41] Team_085 possession (Score: 21-28)
Stephen Bird attempts a Midrange. Contested by Michael Turner (4.7 feet, MAN). Stephen Bird misses. Offensive rebound by Paul Wagner! Paul Wagner kicks it out.

[10:26] Team_085 possession (Score: 21-28)
Collin Mobley attempts a Layup. BLOCKED BY CADE MORANT! Ball goes out off Cade Morant. Collin Mobley's ball!

[10:15] Team_085 possession (Score: 21-28)
Collin Mobley drives, Anthony Durant stays with him. Collin Mobley attempts a Dunk. Contested by Anthony Durant (4.0 feet, MAN). Collin Mobley misses. Offensive rebound by Larry Duncan! Larry Duncan kicks it out.

[10:01] Team_085 possession (Score: 21-28)
Magic Beal drives, Anthony Durant stays with him. Magic Beal attempts a Dunk. Contested by Anthony Durant (4.6 feet, ZONE). Magic Beal misses. Rebound secured by Michael Turner.

[09:49] Team_010 possession (Score: 21-28)
Desmond Antetokounmpo drives, Paul Wagner stays with him. Desmond Antetokounmpo attempts a Layup. Contested by Paul Wagner (4.1 feet, MAN). DESMOND ANTETOKOUNMPO MAKES IT!
Score: 21-30

[09:33] Team_085 possession (Score: 21-30)
Collin Mobley drives, picks up Anthony Durant. Help arrives from Cade Morant! Collin Mobley attempts a Dunk. Contested by Cade Morant (4.1 feet, ZONE). COLLIN MOBLEY MAKES IT!
Score: 23-30

[09:19] Team_010 possession (Score: 23-30)
FOUL! Reach-in foul on Paul Wagner during the drive. [Team fouls: 1] No free throws, side out. (Paul Wagner: 1 personal fouls)

[09:03] Team_010 possession (Score: 23-30)
Desmond Antetokounmpo attempts a 3Pt. Contested by Magic Beal (4.8 feet, ZONE). Desmond Antetokounmpo misses. Rebound secured by Larry Duncan.

[08:48] Team_085 possession (Score: 23-30)
Larry Duncan loses the ball! Stripped by RJ Young! TURNOVER! (live ball)

[08:32] Team_010 possession (Score: 23-30)
Anthony Durant throws a bad pass! Stolen by Collin Mobley! TURNOVER! (live ball)

[08:23] Team_085 possession (Score: 23-30)
Larry Duncan attempts a 3Pt. Contested by Cade Morant (5.1 feet, ZONE). LARRY DUNCAN MAKES IT! Assist: Collin Mobley
Score: 26-30

[08:09] Team_010 possession (Score: 26-30)
Anthony Durant attempts a Midrange. Contested by Collin Mobley (5.1 feet, MAN). ANTHONY DURANT MAKES IT! Assist: Michael Turner
Score: 26-32

[07:57] Team_085 possession (Score: 26-32)
Larry Duncan attempts a Midrange. Contested by RJ Young (5.8 feet, MAN). LARRY DUNCAN MAKES IT!
Score: 28-32

[07:41] Team_010 possession (Score: 28-32)
FOUL! Reach-in foul on Collin Mobley during the drive. [Team fouls: 2] No free throws, side out. (Collin Mobley: 1 personal fouls)

[07:28] Team_010 possession (Score: 28-32)
Michael Turner loses the ball! Stripped by Stephen Bird! TURNOVER! (live ball)

[07:11] Team_085 possession (Score: 28-32)
Collin Mobley attempts a 3Pt. Contested by Cade Morant (4.8 feet, ZONE). Collin Mobley misses. Rebound secured by Anthony Durant.

[06:57] Team_010 possession (Score: 28-32)
FOUL! Holding foul on Larry Duncan. [Team fouls: 3] No free throws, side out. (Larry Duncan: 1 personal fouls)

[06:42] Team_010 possession (Score: 28-32)
FOUL! Holding foul on Magic Beal. [Team fouls: 4] No free throws, side out. (Magic Beal: 1 personal fouls)

[06:24] Team_010 possession (Score: 28-32)
Cade Morant commits a violation (traveling/carry)! TURNOVER! (dead ball)

[06:24] Substitution (Team_085): Magic Beal OUT → Khris Brogdon IN (stamina_rule2)

[06:24] Substitution (Team_085): Stephen Bird OUT → Jordan Morant IN (stamina_rule2)

[06:24] Substitution (Team_085): Larry Duncan OUT → Giannis Johnson IN (stamina_rule2)

[06:24] Substitution (Team_085): Paul Wagner OUT → Jalen Leonard IN (stamina_rule2)

[06:24] Substitution (Team_085): Collin Mobley OUT → Malcolm Beal IN (stamina_rule2)

[06:24] Substitution (Team_010): Cade Morant OUT → Draymond Leonard IN (stamina_rule2)

[06:24] Substitution (Team_010): Michael Turner OUT → Blake Harden IN (stamina_rule2)

[06:24] Substitution (Team_010): RJ Young OUT → Ben Gilgeous-Alexander IN (stamina_rule2)

[06:24] Substitution (Team_010): Desmond Antetokounmpo OUT → Vince Ingram IN (stamina_rule2)

[06:24] Substitution (Team_010): Anthony Durant OUT → Paolo Wade IN (stamina_rule2)

[06:09] Team_085 possession (Score: 28-32)
Malcolm Beal drives, Paolo Wade stays with him. Malcolm Beal attempts a Layup. Contested by Paolo Wade (4.6 feet, ZONE). Malcolm Beal misses. Rebound secured by Paolo Wade.

[05:57] Team_010 possession (Score: 28-32)
Draymond Leonard drives and kicks out. Draymond Leonard attempts a 3Pt. Contested by Khris Brogdon (5.5 feet, MAN). Draymond Leonard misses. Offensive rebound by Blake Harden! Blake Harden kicks it out.

[05:45] Team_010 possession (Score: 28-32)
Draymond Leonard throws a bad pass! Stolen by Khris Brogdon! TURNOVER! (live ball)

[05:26] Team_085 possession (Score: 28-32)
Jordan Morant attempts a 3Pt. Contested by Blake Harden (4.8 feet, MAN). Jordan Morant misses. Rebound secured by Paolo Wade.

[05:16] Team_010 possession (Score: 28-32)
Blake Harden attempts a Layup. BLOCKED BY KHRIS BROGDON! Ball is loose! Rebound secured by Giannis Johnson.

[05:01] Team_085 possession (Score: 28-32)
Jalen Leonard attempts a 3Pt. Contested by Vince Ingram (5.7 feet, MAN). Jalen Leonard misses. Rebound secured by Blake Harden.

[04:50] Team_010 possession (Score: 28-32)
Ben Gilgeous-Alexander attempts a Layup. Contested by Malcolm Beal (4.6 feet, ZONE). BEN GILGEOUS-ALEXANDER MAKES IT! Assist: Vince Ingram
Score: 28-34

[04:33] Team_085 possession (Score: 28-34)
Malcolm Beal drives to the basket... Malcolm Beal loses the ball! Stripped by Vince Ingram! TURNOVER! (live ball)

[04:16] Team_010 possession (Score: 28-34)
Vince Ingram attempts a 3Pt. Contested by Jordan Morant (4.2 feet, ZONE). Vince Ingram misses. Rebound secured by Malcolm Beal.

[04:01] Team_085 possession (Score: 28-34)
Giannis Johnson attempts a 3Pt. Contested by Draymond Leonard (4.4 feet, ZONE). Giannis Johnson misses. Rebound secured by Blake Harden.

[03:51] Team_010 possession (Score: 28-34)
Paolo Wade attempts a 3Pt. Contested by Jordan Morant (3.7 feet, ZONE). PAOLO WADE MAKES IT! Assist: Ben Gilgeous-Alexander
Score: 28-37

[03:37] Team_085 possession (Score: 28-37)
Jalen Leonard attempts a 3Pt. Contested by Draymond Leonard (4.7 feet, ZONE). Jalen Leonard misses. Rebound secured by Ben Gilgeous-Alexander.

[03:25] Team_010 possession (Score: 28-37)
Vince Ingram attempts a Layup. Contested by Malcolm Beal (5.1 feet, ZONE). VINCE INGRAM MAKES IT!
Score: 28-39

[03:13] Team_085 possession (Score: 28-39)
Jalen Leonard drives, Vince Ingram stays with him. Jalen Leonard attempts a Dunk. Contested by Vince Ingram (5.7 feet, MAN). Jalen Leonard misses. Offensive rebound by Jalen Leonard! Jalen Leonard kicks it out.

[02:59] Team_085 possession (Score: 28-39)
Giannis Johnson drives and kicks out. Jordan Morant attempts a Midrange. Contested by Vince Ingram (5.4 feet, ZONE). JORDAN MORANT MAKES IT!
Score: 30-39

[02:45] Team_010 possession (Score: 30-39)
FOUL! Shooting foul on Jordan Morant. Blake Harden to the line for 2 free throws. [BONUS: 5 team fouls] (Jordan Morant: 1 personal fouls)   FT 1/2: MISS   FT 2/2: GOOD Blake Harden makes 1/2 from the line.
Score: 30-40

[02:36] Team_085 possession (Score: 30-40)
Khris Brogdon attempts a 3Pt. Contested by Draymond Leonard (4.2 feet, ZONE). Khris Brogdon misses. Rebound secured by Paolo Wade.

[02:23] Team_010 possession (Score: 30-40)
Draymond Leonard attempts a Midrange. Wide open! Giannis Johnson is 6.2 feet away. [ZONE] DRAYMOND LEONARD MAKES IT!
Score: 30-42

[02:09] Team_085 possession (Score: 30-42)
Giannis Johnson attempts a Midrange. Contested by Ben Gilgeous-Alexander (4.6 feet, MAN). Giannis Johnson misses. Rebound secured by Ben Gilgeous-Alexander.

[01:54] Team_010 possession (Score: 30-42)
FOUL! Shooting foul on Jordan Morant. Paolo Wade to the line for 2 free throws. [BONUS: 6 team fouls] (Jordan Morant: 2 personal fouls)   FT 1/2: GOOD   FT 2/2: GOOD Paolo Wade makes 2/2 from the line.
Score: 30-44

[01:36] Team_085 possession (Score: 30-44)
Jalen Leonard attempts a Midrange. Contested by Vince Ingram (5.7 feet, MAN). JALEN LEONARD MAKES IT!
Score: 32-44

[01:21] Team_010 possession (Score: 32-44)
Blake Harden attempts a Midrange. Contested by Jordan Morant (3.2 feet, ZONE). Blake Harden misses. Offensive rebound by Blake Harden! Blake Harden kicks it out.

[01:10] Team_010 possession (Score: 32-44)
FOUL! Holding foul on Giannis Johnson. [IN THE BONUS! 7 team fouls] Ben Gilgeous-Alexander to the line for 2 free throws. (Giannis Johnson: 1 personal fouls)   FT 1/2: GOOD   FT 2/2: GOOD Ben Gilgeous-Alexander makes 2/2 from the line.
Score: 32-46

[00:57] Team_085 possession (Score: 32-46)
Khris Brogdon attempts a Midrange. Contested by Draymond Leonard (4.2 feet, MAN). Khris Brogdon misses. Rebound secured by Paolo Wade.

[00:44] Team_010 possession (Score: 32-46)
Vince Ingram drives, picks up Jalen Leonard. Help arrives from Jordan Morant! Vince Ingram attempts a Layup. Contested by Jordan Morant (4.9 feet, MAN). VINCE INGRAM MAKES IT!
Score: 32-48

[00:29] Team_085 possession (Score: 32-48)
Jalen Leonard makes the Layup and draws the foul on Paolo Wade! And-1! Jalen Leonard to the line for 1. [Team fouls: 3] (Paolo Wade: 1 personal fouls)   FT 1/1: GOOD Jalen Leonard makes 1/1 from the line.
Score: 35-48

[00:10] Team_010 possession (Score: 35-48)
Draymond Leonard attempts a Midrange. Contested by Khris Brogdon (5.9 feet, MAN). DRAYMOND LEONARD MAKES IT! Assist: Vince Ingram
Score: 35-50

================================================================================
                              2ND QUARTER COMPLETE                              
================================================================================

2ND QUARTER SCORE: Team_085 16, Team_010 22

BOX SCORE:
================================================================================

Team_085
--------------------------------------------------------------------------------
Player                MIN  PTS  REB  AST  TO      FG   FG%      3P   3P%
--------------------------------------------------------------------------------
Larry Duncan           18    5    2    0   0   2/2   100.0     0/0   0.0
Jalen Leonard           6    5    1    0   0   2/4    50.0     0/0   0.0
Collin Mobley          18    2    1    1   0   1/3    33.3     0/0   0.0
Paul Wagner            18    2    2    0   0   1/1   100.0     0/0   0.0
Jordan Morant           6    2    0    0   0   1/2    50.0     0/0   0.0
Magic Beal             18    0    0    1   0   0/1     0.0     0/0   0.0
Malcolm Beal            6    0    1    0   0   0/1     0.0     0/0   0.0
Giannis Johnson         6    0    1    0   0   0/2     0.0     0/0   0.0
Khris Brogdon           6    0    0    0   0   0/2     0.0     0/0   0.0

TEAM: FG: 7/18 (38.9%), 3PT: 1/7 (14.3%), REB: 8 (3 off, 5 def), AST: 2, TO: 2
TEAM FOULS: 7 [Team_010 in BONUS]


Team_010
--------------------------------------------------------------------------------
Player                MIN  PTS  REB  AST  TO      FG   FG%      3P   3P%
--------------------------------------------------------------------------------
Paolo Wade              6    5    4    0   0   2/2   100.0     0/0   0.0
Ben Gilgeous-Alexander    6    4    2    1   0   2/2   100.0     0/0   0.0
Vince Ingram            6    4    0    2   0   2/3    66.7     0/0   0.0
Draymond Leonard        6    4    0    0   0   2/2   100.0     0/0   0.0
Anthony Durant         18    2    1    0   0   1/2    50.0     0/0   0.0
Desmond Antetokounmpo   18    2    0    0   0   1/2    50.0     0/0   0.0
Blake Harden            6    1    4    0   0   1/2    50.0     0/0   0.0
Cade Morant            18    0    1    0   0   0/0     0.0     0/0   0.0
RJ Young               18    0    0    0   0   0/1     0.0     0/0   0.0
Michael Turner         18    0    1    1   0   0/0     0.0     0/0   0.0

TEAM: FG: 11/16 (68.8%), 3PT: 1/4 (25.0%), REB: 13 (2 off, 11 def), AST: 4, TO: 4
TEAM FOULS: 3

================================================================================

================================================================================
                       3RD QUARTER - Team_085 vs Team_010                       
================================================================================

[12:00] Team_085 possession (Score: 35-50)
Collin Mobley attempts a 3Pt. Contested by Cade Morant (3.8 feet, ZONE). Collin Mobley misses. Rebound secured by Cade Morant.

[11:42] Team_010 possession (Score: 35-50)
RJ Young attempts a 3Pt. Contested by Magic Beal (3.8 feet, ZONE). RJ Young misses. Offensive rebound by Anthony Durant! Anthony Durant kicks it out.

[11:27] Team_010 possession (Score: 35-50)
RJ Young attempts a 3Pt. Contested by Larry Duncan (2.9 feet, MAN). RJ YOUNG MAKES IT! Assist: Michael Turner
Score: 35-53

[11:08] Team_085 possession (Score: 35-53)
Magic Beal attempts a 3Pt. Contested by Cade Morant (4.3 feet, ZONE). Magic Beal misses. Offensive rebound by Paul Wagner! Paul Wagner kicks it out.

[10:53] Team_085 possession (Score: 35-53)
Paul Wagner drives to the basket... Paul Wagner loses control! Ball rolls out of bounds! TURNOVER! (dead ball)

[10:37] Team_010 possession (Score: 35-53)
RJ Young attempts a 3Pt. Contested by Magic Beal (3.8 feet, ZONE). RJ YOUNG MAKES IT! Assist: Cade Morant
Score: 35-56

[10:20] Team_085 possession (Score: 35-56)
Paul Wagner attempts a 3Pt. Contested by Desmond Antetokounmpo (4.5 feet, MAN). Paul Wagner misses. Rebound secured by Anthony Durant.

[10:03] Team_010 possession (Score: 35-56)
Anthony Durant drives to the basket... Anthony Durant throws a bad pass out of bounds! TURNOVER! (dead ball)

[09:50] Team_085 possession (Score: 35-56)
FOUL! Reach-in foul on Michael Turner during the drive. [Team fouls: 1] No free throws, side out. (Michael Turner: 1 personal fouls)

[09:34] Team_085 possession (Score: 35-56)
Stephen Bird attempts a 3Pt. Contested by Michael Turner (4.3 feet, MAN). Stephen Bird misses. Rebound secured by Cade Morant.

[09:21] Team_010 possession (Score: 35-56)
Cade Morant attempts a 3Pt. Contested by Magic Beal (4.5 feet, ZONE). CADE MORANT MAKES IT! Assist: Michael Turner
Score: 35-59

[09:06] Team_085 possession (Score: 35-59)
FOUL! Shooting foul on Anthony Durant. Collin Mobley to the line for 2 free throws. [Team fouls: 2] (Anthony Durant: 1 personal fouls)   FT 1/2: MISS   FT 2/2: GOOD Collin Mobley makes 1/2 from the line.
Score: 36-59

[08:49] Team_010 possession (Score: 36-59)
Anthony Durant attempts a Layup. BLOCKED BY PAUL WAGNER! Ball deflects out of bounds off Anthony Durant.

[08:33] Team_085 possession (Score: 36-59)
FOUL! Reach-in foul on Anthony Durant during the drive. [Team fouls: 3] No free throws, side out. (Anthony Durant: 2 personal fouls)

[08:17] Team_085 possession (Score: 36-59)
Larry Duncan attempts a 3Pt. Contested by Cade Morant (4.3 feet, ZONE). Larry Duncan misses. Rebound secured by Cade Morant.

[08:03] Team_010 possession (Score: 36-59)
FOUL! Shooting foul on Collin Mobley. Cade Morant to the line for 2 free throws. [Team fouls: 1] (Collin Mobley: 1 personal fouls)   FT 1/2: GOOD   FT 2/2: GOOD Cade Morant makes 2/2 from the line.
Score: 36-61

[07:50] Team_085 possession (Score: 36-61)
FOUL! Holding foul on Anthony Durant. [Team fouls: 4] No free throws, side out. (Anthony Durant: 3 personal fouls)

[07:36] Team_085 possession (Score: 36-61)
Larry Duncan drives, Anthony Durant stays with him. Larry Duncan attempts a Layup. Contested by Anthony Durant (3.9 feet, ZONE). LARRY DUNCAN MAKES IT!
Score: 38-61

[07:21] Team_010 possession (Score: 38-61)
Michael Turner drives and kicks out. Desmond Antetokounmpo attempts a Midrange. Contested by Larry Duncan (3.0 feet, ZONE). Desmond Antetokounmpo misses. Rebound secured by Collin Mobley.

[07:08] Team_085 possession (Score: 38-61)
Magic Beal attempts a 3Pt. Contested by Cade Morant (4.3 feet, ZONE). MAGIC BEAL MAKES IT! Assist: Larry Duncan
Score: 41-61

[06:52] Team_010 possession (Score: 41-61)
Anthony Durant attempts a Layup. Contested by Paul Wagner (3.8 feet, ZONE). ANTHONY DURANT MAKES IT! Assist: RJ Young
Score: 41-63

[06:39] Team_085 possession (Score: 41-63)
Larry Duncan makes the Layup and draws the foul on Anthony Durant! And-1! Larry Duncan to the line for 1. [BONUS: 5 team fouls] (Anthony Durant: 4 personal fouls)   FT 1/1: GOOD Larry Duncan makes 1/1 from the line.
Score: 44-63

[06:23] Team_010 possession (Score: 44-63)
RJ Young attempts a Midrange. Contested by Larry Duncan (2.9 feet, MAN). RJ Young misses. Offensive rebound by Cade Morant! Cade Morant kicks it out.

[06:10] Team_010 possession (Score: 44-63)
Anthony Durant drives to the basket... Anthony Durant commits a violation (traveling/carry)! TURNOVER! (dead ball)

[05:56] Team_085 possession (Score: 44-63)
Stephen Bird attempts a 3Pt. Contested by Michael Turner (4.3 feet, MAN). STEPHEN BIRD MAKES IT!
Score: 47-63

[05:45] Team_010 possession (Score: 47-63)
Cade Morant attempts a 3Pt. Contested by Magic Beal (4.5 feet, MAN). Cade Morant misses. Rebound secured by Paul Wagner.

[05:28] Team_085 possession (Score: 47-63)
Collin Mobley attempts a 3Pt. Contested by Cade Morant (3.8 feet, ZONE). Collin Mobley misses. Offensive rebound by Paul Wagner! Paul Wagner kicks it out.

[05:14] Team_085 possession (Score: 47-63)
FOUL! Shooting foul on Cade Morant. Magic Beal to the line for 2 free throws. [BONUS: 6 team fouls] (Cade Morant: 1 personal fouls)   FT 1/2: GOOD   FT 2/2: GOOD Magic Beal makes 2/2 from the line.
Score: 49-63

[04:56] Team_010 possession (Score: 49-63)
Anthony Durant attempts a Midrange. Contested by Collin Mobley (4.2 feet, MAN). Anthony Durant misses. Offensive rebound by Cade Morant! Cade Morant kicks it out.

[04:43] Team_010 possession (Score: 49-63)
Desmond Antetokounmpo attempts a 3Pt. Contested by Magic Beal (4.2 feet, ZONE). DESMOND ANTETOKOUNMPO MAKES IT! Assist: Michael Turner
Score: 49-66

[04:33] Team_085 possession (Score: 49-66)
Larry Duncan attempts a Midrange. Contested by RJ Young (5.1 feet, MAN). Larry Duncan misses. Rebound secured by Cade Morant.

[04:18] Team_010 possession (Score: 49-66)
Michael Turner attempts a Midrange. Contested by Collin Mobley (4.2 feet, ZONE). Michael Turner misses. Offensive rebound by Anthony Durant! Anthony Durant kicks it out.

[04:05] Team_010 possession (Score: 49-66)
Desmond Antetokounmpo attempts a 3Pt. Contested by Paul Wagner (3.7 feet, MAN). Desmond Antetokounmpo misses. Rebound secured by Collin Mobley.

[03:52] Team_085 possession (Score: 49-66)
Collin Mobley drives and kicks out. Larry Duncan attempts a 3Pt. Contested by Cade Morant (4.0 feet, ZONE). Larry Duncan misses. Rebound secured by Cade Morant.

[03:36] Team_010 possession (Score: 49-66)
Anthony Durant attempts a Layup. Contested by Paul Wagner (3.9 feet, ZONE). ANTHONY DURANT MAKES IT! Assist: Cade Morant
Score: 49-68

[03:21] Team_085 possession (Score: 49-68)
Larry Duncan drives, picks up RJ Young. Help arrives from Cade Morant! Larry Duncan attempts a Dunk. Contested by Cade Morant (5.2 feet, MAN). LARRY DUNCAN MAKES IT! Assist: Magic Beal
Score: 51-68

[03:06] Team_010 possession (Score: 51-68)
Cade Morant drives, Paul Wagner stays with him. Cade Morant attempts a Layup. Contested by Paul Wagner (4.1 feet, ZONE). Cade Morant misses. Rebound secured by Larry Duncan.

[02:51] Team_085 possession (Score: 51-68)
Paul Wagner drives and kicks out. Stephen Bird attempts a 3Pt. Contested by Michael Turner (4.2 feet, MAN). Stephen Bird misses. Rebound secured by Anthony Durant.

[02:35] Team_010 possession (Score: 51-68)
Anthony Durant attempts a Midrange. Contested by Larry Duncan (3.6 feet, ZONE). Anthony Durant misses. FOUL! Loose ball foul on Collin Mobley during the rebound battle. [Team fouls: 2] No free throws, side out. (Collin Mobley: 2 personal fouls)

[02:20] Team_010 possession (Score: 51-68)
Desmond Antetokounmpo attempts a Midrange. Contested by Paul Wagner (3.8 feet, MAN). Desmond Antetokounmpo misses. Rebound secured by Larry Duncan.

[02:04] Team_085 possession (Score: 51-68)
Stephen Bird drives, Michael Turner stays with him. Stephen Bird attempts a Dunk. Contested by Michael Turner (4.5 feet, MAN). Stephen Bird misses. Rebound secured by Michael Turner.

[01:52] Team_010 possession (Score: 51-68)
Michael Turner drives to the basket... Michael Turner throws a bad pass out of bounds! TURNOVER! (dead ball)

[01:52] Substitution (Team_085): Magic Beal OUT → Khris Brogdon IN (stamina_rule2)

[01:52] Substitution (Team_085): Stephen Bird OUT → Jordan Morant IN (stamina_rule2)

[01:52] Substitution (Team_085): Larry Duncan OUT → Giannis Johnson IN (stamina_rule2)

[01:52] Substitution (Team_085): Collin Mobley OUT → Malcolm Beal IN (stamina_rule2)

[01:52] Substitution (Team_010): Cade Morant OUT → Draymond Leonard IN (stamina_rule2)

[01:52] Substitution (Team_010): Michael Turner OUT → Blake Harden IN (stamina_rule2)

[01:52] Substitution (Team_010): RJ Young OUT → Ben Gilgeous-Alexander IN (stamina_rule2)

[01:52] Substitution (Team_010): Desmond Antetokounmpo OUT → Vince Ingram IN (stamina_rule2)

[01:52] Substitution (Team_010): Anthony Durant OUT → Paolo Wade IN (stamina_rule2)

[01:33] Team_085 possession (Score: 51-68)
Khris Brogdon attempts a 3Pt. Contested by Draymond Leonard (4.2 feet, MAN). Khris Brogdon misses. Rebound secured by Paolo Wade.

[01:17] Team_010 possession (Score: 51-68)
Draymond Leonard attempts a 3Pt. Contested by Khris Brogdon (5.9 feet, MAN). Draymond Leonard misses. Rebound secured by Paul Wagner.

[01:00] Team_085 possession (Score: 51-68)
Jordan Morant attempts a Midrange. BLOCKED BY BLAKE HARDEN! Ball is loose! Rebound secured by Ben Gilgeous-Alexander.

[00:44] Team_010 possession (Score: 51-68)
Ben Gilgeous-Alexander drives, Giannis Johnson stays with him. Ben Gilgeous-Alexander attempts a Dunk. Wide open! Giannis Johnson is 6.1 feet away. [MAN] BEN GILGEOUS-ALEXANDER MAKES IT!
Score: 51-70

[00:30] Team_085 possession (Score: 51-70)
Jordan Morant attempts a Midrange. Contested by Blake Harden (4.8 feet, MAN). JORDAN MORANT MAKES IT!
Score: 53-70

[00:10] Team_010 possession (Score: 53-70)
Vince Ingram attempts a 3Pt. Contested by Paul Wagner (4.7 feet, MAN). Vince Ingram misses. Rebound secured by Giannis Johnson.

================================================================================
                              3RD QUARTER COMPLETE                              
================================================================================

3RD QUARTER SCORE: Team_085 18, Team_010 20

BOX SCORE:
================================================================================

Team_085
--------------------------------------------------------------------------------
Player                MIN  PTS  REB  AST  TO      FG   FG%      3P   3P%
--------------------------------------------------------------------------------
Larry Duncan           28    7    2    1   0   3/5    60.0     0/0   0.0
Magic Beal             28    5    0    1   0   2/2   100.0     0/0   0.0
Stephen Bird           28    3    0    0   0   1/3    33.3     0/0   0.0
Jordan Morant           8    2    0    0   0   1/2    50.0     0/0   0.0
Collin Mobley          28    1    2    0   0   1/3    33.3     0/0   0.0
Paul Wagner            30    0    4    0   0   0/2     0.0     0/0   0.0
Khris Brogdon           8    0    0    0   0   0/1     0.0     0/0   0.0
Giannis Johnson         8    0    1    0   0   0/0     0.0     0/0   0.0

TEAM: FG: 8/18 (44.4%), 3PT: 2/7 (28.6%), REB: 9 (2 off, 7 def), AST: 2, TO: 1
TEAM FOULS: 2


Team_010
--------------------------------------------------------------------------------
Player                MIN  PTS  REB  AST  TO      FG   FG%      3P   3P%
--------------------------------------------------------------------------------
RJ Young               28    6    0    1   0   2/2   100.0     0/0   0.0
Cade Morant            28    5    7    2   0   2/4    50.0     0/0   0.0
Anthony Durant         28    4    5    0   0   2/3    66.7     0/0   0.0
Desmond Antetokounmpo   28    3    0    0   0   1/3    33.3     0/0   0.0
Ben Gilgeous-Alexander    8    2    1    0   0   1/1   100.0     0/0   0.0
Michael Turner         28    0    1    3   0   0/1     0.0     0/0   0.0
Paolo Wade              8    0    1    0   0   0/0     0.0     0/0   0.0
Draymond Leonard        8    0    0    0   0   0/1     0.0     0/0   0.0
Vince Ingram            8    0    0    0   0   0/1     0.0     0/0   0.0

TEAM: FG: 8/16 (50.0%), 3PT: 4/8 (50.0%), REB: 15 (5 off, 10 def), AST: 6, TO: 3
TEAM FOULS: 6 [Team_085 in BONUS]

================================================================================

================================================================================
                       4TH QUARTER - Team_085 vs Team_010                       
================================================================================

[12:00] Substitution (Team_085): Magic Beal OUT (stamina: 78) → Khris Brogdon IN (comeback_detected)

[12:00] Substitution (Team_010): Cade Morant OUT (stamina: 77) → Draymond Leonard IN (comeback_detected)

[12:00] Team_085 possession (Score: 53-70)
Khris Brogdon drives and kicks out. Larry Duncan attempts a 3Pt. Contested by Draymond Leonard (4.4 feet, ZONE). Larry Duncan misses. Rebound secured by Anthony Durant.

[11:43] Team_010 possession (Score: 53-70)
Draymond Leonard attempts a 3Pt. Contested by Khris Brogdon (5.9 feet, MAN). DRAYMOND LEONARD MAKES IT!
Score: 53-73

[11:28] Team_085 possession (Score: 53-73)
Paul Wagner drives, Anthony Durant stays with him. Paul Wagner attempts a Layup. Contested by Anthony Durant (3.9 feet, ZONE). PAUL WAGNER MAKES IT!
Score: 55-73

[11:18] Team_010 possession (Score: 55-73)
Michael Turner drives and kicks out. Anthony Durant attempts a Midrange. Contested by Paul Wagner (3.8 feet, ZONE). ANTHONY DURANT MAKES IT!
Score: 55-75

[10:59] Team_085 possession (Score: 55-75)
Khris Brogdon attempts a 3Pt. Contested by Draymond Leonard (4.2 feet, ZONE). Khris Brogdon misses. Rebound secured by Michael Turner.

[10:44] Team_010 possession (Score: 55-75)
RJ Young attempts a Layup. Contested by Larry Duncan (3.0 feet, MAN). RJ YOUNG MAKES IT! Assist: Draymond Leonard
Score: 55-77

[10:33] Team_085 possession (Score: 55-77)
Larry Duncan attempts a Layup. Contested by Anthony Durant (4.1 feet, ZONE). LARRY DUNCAN MAKES IT! Assist: Paul Wagner
Score: 57-77

[10:18] Team_010 possession (Score: 57-77)
RJ Young drives, Paul Wagner stays with him. RJ Young attempts a Dunk. Contested by Paul Wagner (3.7 feet, ZONE). RJ YOUNG MAKES IT!
Score: 57-79

[09:58] Team_085 possession (Score: 57-79)
Stephen Bird attempts a 3Pt. Contested by Draymond Leonard (4.6 feet, ZONE). STEPHEN BIRD MAKES IT! Assist: Khris Brogdon
Score: 60-79

[09:44] Team_010 possession (Score: 60-79)
FOUL! Holding foul on Stephen Bird. [Team fouls: 1] No free throws, side out. (Stephen Bird: 1 personal fouls)

[09:29] Team_010 possession (Score: 60-79)
Desmond Antetokounmpo attempts a 3Pt. Contested by Paul Wagner (4.1 feet, MAN). Desmond Antetokounmpo misses. Rebound secured by Larry Duncan.

[09:17] Team_085 possession (Score: 60-79)
Larry Duncan attempts a 3Pt. Contested by RJ Young (5.3 feet, MAN). Larry Duncan misses. Rebound secured by Desmond Antetokounmpo.

[09:05] Team_010 possession (Score: 60-79)
FOUL! Reach-in foul on Khris Brogdon during the drive. [Team fouls: 2] No free throws, side out. (Khris Brogdon: 1 personal fouls)

[08:50] Team_010 possession (Score: 60-79)
Michael Turner attempts a 3Pt. Contested by Stephen Bird (4.1 feet, MAN). Michael Turner misses. Rebound secured by Larry Duncan.

[08:35] Team_085 possession (Score: 60-79)
Paul Wagner attempts a Midrange. Contested by Desmond Antetokounmpo (4.9 feet, MAN). PAUL WAGNER MAKES IT!
Score: 62-79

[08:15] Team_010 possession (Score: 62-79)
Desmond Antetokounmpo drives to the basket... Desmond Antetokounmpo loses the ball! Stripped by Paul Wagner! TURNOVER! (live ball)

[08:01] Team_085 possession (Score: 62-79)
Stephen Bird drives, picks up Michael Turner. Help arrives from RJ Young! Stephen Bird attempts a Dunk. Contested by RJ Young (4.6 feet, MAN). STEPHEN BIRD MAKES IT! Assist: Khris Brogdon
Score: 64-79

[07:49] Team_010 possession (Score: 64-79)
Desmond Antetokounmpo attempts a 3Pt. Contested by Paul Wagner (4.3 feet, MAN). Desmond Antetokounmpo misses. Rebound secured by Paul Wagner.

[07:34] Team_085 possession (Score: 64-79)
Larry Duncan attempts a 3Pt. Contested by RJ Young (5.5 feet, MAN). Larry Duncan misses. Rebound secured by Anthony Durant.

[07:23] Team_010 possession (Score: 64-79)
Draymond Leonard attempts a Midrange. Contested by Khris Brogdon (5.9 feet, MAN). DRAYMOND LEONARD MAKES IT! Assist: Anthony Durant
Score: 64-81

[07:11] Team_085 possession (Score: 64-81)
Collin Mobley attempts a Layup. Contested by Anthony Durant (4.0 feet, ZONE). Collin Mobley misses. Rebound secured by Michael Turner.

[06:56] Team_010 possession (Score: 64-81)
Draymond Leonard attempts a 3Pt. Contested by Paul Wagner (4.8 feet, ZONE). Draymond Leonard misses. Rebound secured by Larry Duncan.

[06:41] Team_085 possession (Score: 64-81)
Stephen Bird attempts a 3Pt. Contested by Michael Turner (4.8 feet, MAN). Stephen Bird misses. Rebound secured by Anthony Durant.

[06:24] Team_010 possession (Score: 64-81)
Draymond Leonard attempts a 3Pt. Contested by Khris Brogdon (5.9 feet, MAN). DRAYMOND LEONARD MAKES IT! Assist: Desmond Antetokounmpo
Score: 64-84

[06:09] Team_085 possession (Score: 64-84)
Stephen Bird drives, Anthony Durant stays with him. Stephen Bird attempts a Dunk. Contested by Anthony Durant (4.5 feet, ZONE). STEPHEN BIRD MAKES IT!
Score: 66-84

[05:56] Team_010 possession (Score: 66-84)
Desmond Antetokounmpo attempts a 3Pt. Contested by Paul Wagner (4.6 feet, MAN). Desmond Antetokounmpo misses. Rebound secured by Collin Mobley.

[05:40] Team_085 possession (Score: 66-84)
Stephen Bird attempts a Layup. BLOCKED BY MICHAEL TURNER! Ball goes out off Michael Turner. Stephen Bird's ball!

[05:23] Team_085 possession (Score: 66-84)
Khris Brogdon drives, Draymond Leonard stays with him. Khris Brogdon attempts a Layup. Contested by Draymond Leonard (4.3 feet, MAN). KHRIS BROGDON MAKES IT!
Score: 68-84

[05:10] Team_010 possession (Score: 68-84)
Draymond Leonard attempts a Midrange. Contested by Khris Brogdon (5.9 feet, MAN). Draymond Leonard misses. Rebound secured by Paul Wagner.

[04:55] Team_085 possession (Score: 68-84)
Khris Brogdon attempts a 3Pt. Contested by Draymond Leonard (4.4 feet, MAN). Khris Brogdon misses. Rebound secured by Draymond Leonard.

[04:41] Team_010 possession (Score: 68-84)
Michael Turner attempts a 3Pt. Contested by Stephen Bird (4.7 feet, MAN). Michael Turner misses. Offensive rebound by Draymond Leonard! Draymond Leonard kicks it out.

[04:23] Team_010 possession (Score: 68-84)
Draymond Leonard drives, Khris Brogdon stays with him. Draymond Leonard attempts a Dunk. Contested by Khris Brogdon (6.0 feet, MAN). DRAYMOND LEONARD MAKES IT! Assist: Michael Turner
Score: 68-86

[04:10] Team_085 possession (Score: 68-86)
Stephen Bird attempts a Midrange. Contested by Michael Turner (5.1 feet, ZONE). STEPHEN BIRD MAKES IT!
Score: 70-86

[03:59] Team_010 possession (Score: 70-86)
Anthony Durant drives and kicks out. Draymond Leonard attempts a 3Pt. Contested by Khris Brogdon (5.6 feet, MAN). DRAYMOND LEONARD MAKES IT! Assist: Michael Turner
Score: 70-89

[03:45] Team_085 possession (Score: 70-89)
Khris Brogdon makes the Layup and draws the foul on Anthony Durant! And-1! Khris Brogdon to the line for 1. [Team fouls: 1] (Anthony Durant: 1 personal fouls)   FT 1/1: MISS Khris Brogdon makes 0/1 from the line. Rebound secured by Draymond Leonard.
Score: 72-89

[03:31] Team_010 possession (Score: 72-89)
Desmond Antetokounmpo attempts a Layup. BLOCKED BY PAUL WAGNER! Ball deflects out of bounds off Desmond Antetokounmpo.

[03:15] Team_085 possession (Score: 72-89)
Stephen Bird attempts a 3Pt. Contested by Draymond Leonard (4.8 feet, ZONE). Stephen Bird misses. Rebound secured by Anthony Durant.

[03:01] Team_010 possession (Score: 72-89)
RJ Young attempts a 3Pt. Contested by Stephen Bird (4.6 feet, ZONE). RJ Young misses. Rebound secured by Paul Wagner.

[02:42] Team_085 possession (Score: 72-89)
Larry Duncan attempts a 3Pt. Contested by Draymond Leonard (4.9 feet, ZONE). LARRY DUNCAN MAKES IT! Assist: Collin Mobley
Score: 75-89

[02:28] Team_010 possession (Score: 75-89)
Draymond Leonard attempts a Layup. Contested by Collin Mobley (5.7 feet, ZONE). DRAYMOND LEONARD MAKES IT! Assist: Michael Turner
Score: 75-91

[02:16] Team_085 possession (Score: 75-91)
Paul Wagner drives and kicks out. Larry Duncan attempts a Midrange. Contested by Desmond Antetokounmpo (5.6 feet, ZONE). Larry Duncan misses. Rebound secured by Anthony Durant.

[01:59] Team_010 possession (Score: 75-91)
RJ Young drives and kicks out. RJ Young attempts a 3Pt. Contested by Khris Brogdon (5.8 feet, ZONE). RJ Young misses. Rebound secured by Collin Mobley.

[01:44] Team_085 possession (Score: 75-91)
FOUL! Holding foul on Desmond Antetokounmpo. [Team fouls: 2] No free throws, side out. (Desmond Antetokounmpo: 1 personal fouls)

[01:33] Team_085 possession (Score: 75-91)
FOUL! Holding foul on Anthony Durant. [Team fouls: 3] No free throws, side out. (Anthony Durant: 2 personal fouls)

[01:19] Team_085 possession (Score: 75-91)
Khris Brogdon attempts a Layup. Contested by Anthony Durant (5.0 feet, ZONE). Khris Brogdon misses. Rebound secured by Michael Turner.

[01:05] Team_010 possession (Score: 75-91)
Anthony Durant attempts a Midrange. Contested by Larry Duncan (4.7 feet, ZONE). ANTHONY DURANT MAKES IT! Assist: Michael Turner
Score: 75-93

[00:52] Team_085 possession (Score: 75-93)
Paul Wagner attempts a Layup. BLOCKED BY ANTHONY DURANT! Ball is loose! Rebound secured by Draymond Leonard.

[00:34] Team_010 possession (Score: 75-93)
Draymond Leonard attempts a Layup. Wide open! Khris Brogdon is 6.3 feet away. [MAN] Draymond Leonard misses. Rebound secured by Collin Mobley.

[00:20] Team_085 possession (Score: 75-93)
Collin Mobley attempts a Layup. Contested by Anthony Durant (5.1 feet, MAN). COLLIN MOBLEY MAKES IT! Assist: Larry Duncan
Score: 77-93

[00:09] Team_010 possession (Score: 77-93)
Michael Turner attempts a 3Pt. Contested by Paul Wagner (5.5 feet, ZONE). MICHAEL TURNER MAKES IT! Assist: Draymond Leonard
Score: 77-96

================================================================================
                              4TH QUARTER COMPLETE                              
================================================================================

4TH QUARTER SCORE: Team_085 24, Team_010 26

BOX SCORE:
================================================================================

Team_085
--------------------------------------------------------------------------------
Player                MIN  PTS  REB  AST  TO      FG   FG%      3P   3P%
--------------------------------------------------------------------------------
Stephen Bird           41    9    0    0   0   4/6    66.7     0/0   0.0
Larry Duncan           41    5    3    1   0   2/4    50.0     0/0   0.0
Paul Wagner            42    4    3    1   0   2/4    50.0     0/0   0.0
Khris Brogdon          20    2    0    2   0   1/6    16.7     0/0   0.0
Collin Mobley          41    2    3    1   0   1/2    50.0     0/0   0.0

TEAM: FG: 10/22 (45.5%), 3PT: 2/8 (25.0%), REB: 9 (0 off, 9 def), AST: 5, TO: 0
TEAM FOULS: 2


Team_010
--------------------------------------------------------------------------------
Player                MIN  PTS  REB  AST  TO      FG   FG%      3P   3P%
--------------------------------------------------------------------------------
Draymond Leonard       20   15    4    2   0   6/9    66.7     0/0   0.0
Anthony Durant         41    4    5    1   0   2/2   100.0     0/0   0.0
RJ Young               41    4    0    0   0   2/4    50.0     0/0   0.0
Michael Turner         41    3    3    4   0   1/2    50.0     0/0   0.0
Desmond Antetokounmpo   41    0    1    1   0   0/4     0.0     0/0   0.0

TEAM: FG: 11/21 (52.4%), 3PT: 3/9 (33.3%), REB: 13 (1 off, 12 def), AST: 8, TO: 1
TEAM FOULS: 3

================================================================================

================================================================================
                               FULL GAME COMPLETE                               
================================================================================

FINAL SCORE: Team_085 77, Team_010 96

SCORING BY QUARTER:
--------------------------------------------------------------------------------
Team                     Q1     Q2     Q3     Q4    FINAL
--------------------------------------------------------------------------------
Team_085                 19     16     18     24       77
Team_010                 28     22     20     26       96
--------------------------------------------------------------------------------

FULL GAME BOX SCORE:
================================================================================

Team_085
--------------------------------------------------------------------------------
Player                MIN  PTS  REB  AST  TO      FG   FG%      3P   3P%      FT STL BLK
--------------------------------------------------------------------------------
Paul Wagner            42   10   14    1   0   5/11   45.5   0/1     0.0   0/0     2   2
Stephen Bird           41   17    0    2   0   6/15   40.0   2/7    28.6   1/2     1   0
Larry Duncan           41   24   11    4   1  10/17   58.8   2/5    40.0   4/4     0   1
Collin Mobley          41    5   10    2   1   4/12   33.3   0/3     0.0   1/2     1   0
Magic Beal             28    7    0    2   1   3/4    75.0   1/1   100.0   2/2     0   0
Khris Brogdon          20    2    0    2   1   1/9    11.1   0/4     0.0   0/1     1   1
Jordan Morant           8    4    0    0   0   1/3    33.3   0/1     0.0   0/0     0   0
Giannis Johnson         8    0    2    0   0   1/3    33.3   0/1     0.0   0/0     0   0
Malcolm Beal            8    0    1    0   0   0/1     0.0   0/0     0.0   0/0     0   0
Jalen Leonard           6    5    1    0   0   2/4    50.0   0/2     0.0   1/1     0   0

TEAM: FG: 33/79 (41.8%), 3PT: 5/25 (20.0%), REB: 38 (7 off, 31 def), AST: 13, TO: 4


Team_010
--------------------------------------------------------------------------------
Player                MIN  PTS  REB  AST  TO      FG   FG%      3P   3P%      FT STL BLK
--------------------------------------------------------------------------------
Michael Turner         41   12    7   10   1   5/10   50.0   2/5    40.0   2/2     0   1
RJ Young               41   16    0    2   2   6/9    66.7   3/5    60.0   0/0     1   0
Desmond Antetokounmpo   41    8    4    2   2   2/12   16.7   1/7    14.3   0/0     0   0
Anthony Durant         41   10   17    4   1   6/11   54.5   0/0     0.0   1/2     0   2
Cade Morant            28   14   13    2   2   6/10   60.0   2/3    66.7   2/2     0   1
Draymond Leonard       20   19    4    2   1   7/11   63.6   2/4    50.0   0/0     0   0
Blake Harden            8    1    4    0   0   1/2    50.0   0/0     0.0   1/2     0   1
Ben Gilgeous-Alexander    8    6    3    1   0   2/2   100.0   0/0     0.0   2/2     0   0
Vince Ingram            8    4    0    2   0   2/4    50.0   0/2     0.0   0/0     1   0
Paolo Wade              8    5    5    0   0   2/2   100.0   1/1   100.0   2/2     0   0

TEAM: FG: 40/74 (54.1%), 3PT: 11/27 (40.7%), REB: 58 (13 off, 45 def), AST: 25, TO: 9

================================================================================
