================================================================================
                        FULL GAME - Team_005 vs Team_022                        
================================================================================

================================================================================
                       1ST QUARTER - Team_005 vs Team_022                       
================================================================================

[12:00] Team_005 possession (Score: 0-0)
Cade Markkanen attempts a Midrange. Contested by Dirk Markkanen (4.4 feet, MAN). CADE MARKKANEN MAKES IT!
Score: 2-0

[11:45] Team_022 possession (Score: 2-0)
Myles Anthony makes the Layup and draws the foul on Derrick Allen! And-1! Myles Anthony to the line for 1. [Team fouls: 1] (Derrick Allen: 1 personal fouls)   FT 1/1: GOOD Myles Anthony makes 1/1 from the line.
Score: 2-3

[11:34] Team_005 possession (Score: 2-3)
Anthony Rozier attempts a 3Pt. Contested by Michael Ginobili (3.6 feet, MAN). Anthony Rozier misses. Rebound secured by Myles Anthony.

[11:21] Team_022 possession (Score: 2-3)
FOUL! Shooting foul on Anthony Rozier. Myles Anthony to the line for 2 free throws. [Team fouls: 2] (Anthony Rozier: 1 personal fouls)   FT 1/2: GOOD   FT 2/2: GOOD Myles Anthony makes 2/2 from the line.
Score: 2-5

[11:10] Team_005 possession (Score: 2-5)
Brandon George drives, Malcolm Allen stays with him. Brandon George attempts a Dunk. Contested by Malcolm Allen (4.6 feet, MAN). Brandon George misses. Offensive rebound by Cade Markkanen! Cade Markkanen puts it back in!
Score: 4-5

[10:54] Team_022 possession (Score: 4-5)
Myles Anthony attempts a Layup. BLOCKED BY CADE MARKKANEN! Ball is loose! Rebound secured by Jalen Rozier.

[10:37] Team_005 possession (Score: 4-5)
Derrick Allen attempts a 3Pt. Contested by Myles Anthony (4.8 feet, MAN). Derrick Allen misses. Offensive rebound by Jalen Rozier! Jalen Rozier kicks it out.

[10:21] Team_005 possession (Score: 4-5)
Anthony Rozier throws a bad pass out of bounds! TURNOVER! (dead ball)

[10:02] Team_022 possession (Score: 4-5)
Michael Ginobili attempts a Layup. Contested by Cade Markkanen (3.3 feet, ZONE). MICHAEL GINOBILI MAKES IT!
Score: 4-7

[09:49] Team_005 possession (Score: 4-7)
Derrick Allen drives to the basket... Derrick Allen throws a bad pass out of bounds! TURNOVER! (dead ball)

[09:32] Team_022 possession (Score: 4-7)
Lamelo Dosunmu attempts a 3Pt. Contested by Derrick Allen (4.7 feet, ZONE). Lamelo Dosunmu misses. Offensive rebound by Michael Ginobili! Michael Ginobili kicks it out.

[09:18] Team_022 possession (Score: 4-7)
Dirk Markkanen drives to the basket... FOUL! Offensive foul on Dirk Markkanen! Cade Markkanen drew the charge! [Team fouls: 1] (Dirk Markkanen: 1 personal fouls) TURNOVER! (dead ball)

[09:03] Team_005 possession (Score: 4-7)
Cade Markkanen makes the Layup and draws the foul on Dirk Markkanen! And-1! Cade Markkanen to the line for 1. [Team fouls: 2] (Dirk Markkanen: 2 personal fouls)   FT 1/1: MISS Cade Markkanen makes 0/1 from the line. Rebound secured by Michael Ginobili.
Score: 6-7

[08:45] Team_022 possession (Score: 6-7)
Lamelo Dosunmu attempts a 3Pt. Contested by Cade Markkanen (3.7 feet, MAN). Lamelo Dosunmu misses. Rebound secured by Cade Markkanen.

[08:35] Team_005 possession (Score: 6-7)
Jalen Rozier drives to the basket... FOUL! Offensive foul on Jalen Rozier! Lamelo Dosunmu drew the charge! [Team fouls: 3] (Jalen Rozier: 1 personal fouls) TURNOVER! (dead ball)

[08:20] Team_022 possession (Score: 6-7)
Michael Ginobili attempts a 3Pt. Contested by Derrick Allen (4.3 feet, ZONE). MICHAEL GINOBILI MAKES IT! Assist: Lamelo Dosunmu
Score: 6-10

[08:05] Team_005 possession (Score: 6-10)
Anthony Rozier drives and kicks out. Derrick Allen attempts a 3Pt. Contested by Myles Anthony (4.4 feet, MAN). Derrick Allen misses. FOUL! Loose ball foul on Dirk Markkanen during the rebound battle. [Team fouls: 3] No free throws, side out. (Dirk Markkanen: 3 personal fouls)

[07:54] Team_005 possession (Score: 6-10)
Cade Markkanen drives to the basket... FOUL! Offensive foul on Cade Markkanen! Dirk Markkanen drew the charge! [Team fouls: 4] (Cade Markkanen: 1 personal fouls) TURNOVER! (dead ball)

[07:37] Team_022 possession (Score: 6-10)
Michael Ginobili attempts a Midrange. Contested by Cade Markkanen (3.3 feet, ZONE). MICHAEL GINOBILI MAKES IT!
Score: 6-12

[07:21] Team_005 possession (Score: 6-12)
FOUL! Holding foul on Myles Anthony. [Team fouls: 4] No free throws, side out. (Myles Anthony: 1 personal fouls)

[07:06] Team_005 possession (Score: 6-12)
Brandon George attempts a 3Pt. Contested by Malcolm Allen (4.6 feet, MAN). Brandon George misses. FOUL! Loose ball foul on Michael Ginobili during the rebound battle. [IN THE BONUS! 5 team fouls] Cade Markkanen to the line for 2 free throws. (Michael Ginobili: 1 personal fouls)   FT 1/2: GOOD   FT 2/2: GOOD Cade Markkanen makes 2/2 from the line.
Score: 8-12

[06:49] Team_022 possession (Score: 8-12)
FOUL! Holding foul on Brandon George. [IN THE BONUS! 5 team fouls] Malcolm Allen to the line for 2 free throws. (Brandon George: 1 personal fouls)   FT 1/2: GOOD   FT 2/2: GOOD Malcolm Allen makes 2/2 from the line.
Score: 8-14

[06:35] Team_005 possession (Score: 8-14)
FOUL! Shooting foul on Myles Anthony. Derrick Allen to the line for 2 free throws. [BONUS: 6 team fouls] (Myles Anthony: 2 personal fouls)   FT 1/2: GOOD   FT 2/2: GOOD Derrick Allen makes 2/2 from the line.
Score: 10-14

[06:19] Team_022 possession (Score: 10-14)
Myles Anthony drives to the basket... Myles Anthony throws a bad pass! Stolen by Derrick Allen! TURNOVER! (live ball)

[06:02] Team_005 possession (Score: 10-14)
Anthony Rozier loses the ball! Stripped by Michael Ginobili! TURNOVER! (live ball)

[05:49] Team_022 possession (Score: 10-14)
Myles Anthony drives and kicks out. Myles Anthony attempts a 3Pt. Contested by Derrick Allen (4.2 feet, MAN). Myles Anthony misses. FOUL! Loose ball foul on Jalen Rozier during the rebound battle. [IN THE BONUS! 6 team fouls] Michael Ginobili to the line for 2 free throws. (Jalen Rozier: 2 personal fouls)   FT 1/2: GOOD   FT 2/2: GOOD Michael Ginobili makes 2/2 from the line.
Score: 10-16

[05:37] Team_005 possession (Score: 10-16)
Anthony Rozier drives and kicks out. Brandon George attempts a Midrange. Contested by Myles Anthony (4.4 feet, ZONE). BRANDON GEORGE MAKES IT! Assist: Derrick Allen
Score: 12-16

[05:19] Team_022 possession (Score: 12-16)
Dirk Markkanen drives and kicks out. Lamelo Dosunmu attempts a Midrange. Contested by Cade Markkanen (3.3 feet, MAN). Lamelo Dosunmu misses. Rebound secured by Jalen Rozier.

[05:06] Team_005 possession (Score: 12-16)
Jalen Rozier attempts a 3Pt. Contested by Michael Ginobili (3.8 feet, ZONE). Jalen Rozier misses. Rebound secured by Myles Anthony.

[04:51] Team_022 possession (Score: 12-16)
Michael Ginobili attempts a 3Pt. Contested by Derrick Allen (4.3 feet, ZONE). MICHAEL GINOBILI MAKES IT! Assist: Malcolm Allen
Score: 12-19

[04:39] Team_005 possession (Score: 12-19)
Brandon George loses the ball! Stripped by Malcolm Allen! TURNOVER! (live ball)

[04:25] Team_022 possession (Score: 12-19)
Dirk Markkanen attempts a 3Pt. Contested by Derrick Allen (4.8 feet, ZONE). DIRK MARKKANEN MAKES IT! Assist: Malcolm Allen
Score: 12-22

[04:09] Team_005 possession (Score: 12-22)
Jalen Rozier attempts a 3Pt. Contested by Michael Ginobili (3.9 feet, ZONE). Jalen Rozier misses. Offensive rebound by Jalen Rozier! Jalen Rozier kicks it out.

[03:55] Team_005 possession (Score: 12-22)
Jalen Rozier attempts a Midrange. Contested by Lamelo Dosunmu (5.1 feet, MAN). Jalen Rozier misses. Rebound secured by Michael Ginobili.

[03:37] Team_022 possession (Score: 12-22)
Myles Anthony drives to the basket... Myles Anthony throws a bad pass! Stolen by Derrick Allen! TURNOVER! (live ball)

[03:25] Team_005 possession (Score: 12-22)
Cade Markkanen throws a bad pass out of bounds! TURNOVER! (dead ball)

[03:13] Team_022 possession (Score: 12-22)
Michael Ginobili makes the 3Pt and draws the foul on Derrick Allen! And-1! Michael Ginobili to the line for 1. [BONUS: 7 team fouls] (Derrick Allen: 2 personal fouls)   FT 1/1: GOOD Michael Ginobili makes 1/1 from the line.
Score: 12-26

[02:58] Team_005 possession (Score: 12-26)
Derrick Allen attempts a 3Pt. Contested by Myles Anthony (5.0 feet, MAN). Derrick Allen misses. Rebound secured by Michael Ginobili.

[02:44] Team_022 possession (Score: 12-26)
Myles Anthony makes the Layup and draws the foul on Derrick Allen! And-1! Myles Anthony to the line for 1. [BONUS: 8 team fouls] (Derrick Allen: 3 personal fouls)   FT 1/1: GOOD Myles Anthony makes 1/1 from the line.
Score: 12-29

[02:29] Team_005 possession (Score: 12-29)
Cade Markkanen makes the Layup and draws the foul on Dirk Markkanen! And-1! Cade Markkanen to the line for 1. [BONUS: 7 team fouls] (Dirk Markkanen: 4 personal fouls)   FT 1/1: GOOD Cade Markkanen makes 1/1 from the line.
Score: 15-29

[02:15] Team_022 possession (Score: 15-29)
Malcolm Allen attempts a Midrange. Contested by Derrick Allen (5.1 feet, ZONE). Malcolm Allen misses. Rebound secured by Cade Markkanen.

[02:00] Team_005 possession (Score: 15-29)
FOUL! Holding foul on Lamelo Dosunmu. [IN THE BONUS! 8 team fouls] Jalen Rozier to the line for 2 free throws. (Lamelo Dosunmu: 1 personal fouls)   FT 1/2: GOOD   FT 2/2: GOOD Jalen Rozier makes 2/2 from the line.
Score: 17-29

[01:45] Team_022 possession (Score: 17-29)
Lamelo Dosunmu drives to the basket... FOUL! Offensive foul on Lamelo Dosunmu! Cade Markkanen drew the charge! [Team fouls: 9] (Lamelo Dosunmu: 2 personal fouls) TURNOVER! (dead ball)

[01:30] Team_005 possession (Score: 17-29)
Brandon George drives and kicks out. Derrick Allen attempts a 3Pt. Contested by Michael Ginobili (3.9 feet, ZONE). Derrick Allen misses. Rebound secured by Michael Ginobili.

[01:17] Team_022 possession (Score: 17-29)
Myles Anthony attempts a 3Pt. Contested by Jalen Rozier (5.4 feet, ZONE). Myles Anthony misses. Rebound secured by Derrick Allen.

[01:03] Team_005 possession (Score: 17-29)
Jalen Rozier loses control! Ball rolls out of bounds! TURNOVER! (dead ball)

[01:03] Substitution (Team_005): Brandon George OUT → Blake O'Neal IN (stamina_rule2)

[01:03] Substitution (Team_005): Anthony Rozier OUT → Draymond Smith IN (stamina_rule2)

[01:03] Substitution (Team_005): Derrick Allen OUT → Lauri Wade IN (stamina_rule2)

[01:03] Substitution (Team_005): Jalen Rozier OUT → Isaiah Durant IN (stamina_rule2)

[01:03] Substitution (Team_005): Cade Markkanen OUT → Zion Parker IN (stamina_rule2)

[01:03] Substitution (Team_022): Malcolm Allen OUT → DeMar Harden IN (stamina_rule2)

[01:03] Substitution (Team_022): Michael Ginobili OUT → Lauri Gobert IN (stamina_rule2)

[01:03] Substitution (Team_022): Myles Anthony OUT → Dejounte Towns IN (stamina_rule2)

[01:03] Substitution (Team_022): Lamelo Dosunmu OUT → Kawhi Russell IN (stamina_rule2)

[01:03] Substitution (Team_022): Dirk Markkanen OUT → Cole Iverson IN (stamina_rule2)

[00:52] Team_022 possession (Score: 17-29)
Kawhi Russell drives, picks up Zion Parker. Help arrives from Blake O'Neal! Kawhi Russell attempts a Layup. Contested by Blake O'Neal (4.3 feet, ZONE). Kawhi Russell misses. Rebound secured by Lauri Wade.

[00:35] Team_005 possession (Score: 17-29)
Zion Parker makes the Dunk and draws the foul on Lauri Gobert! And-1! Zion Parker to the line for 1. [BONUS: 10 team fouls] (Lauri Gobert: 1 personal fouls)   FT 1/1: GOOD Zion Parker makes 1/1 from the line.
Score: 20-29

[00:21] Team_022 possession (Score: 20-29)
Cole Iverson drives and kicks out. DeMar Harden attempts a 3Pt. Contested by Blake O'Neal (4.1 feet, MAN). DeMar Harden misses. Rebound secured by Lauri Wade.

[00:06] Team_005 possession (Score: 20-29)
Isaiah Durant attempts a 3Pt. Contested by Kawhi Russell (4.3 feet, ZONE). Isaiah Durant misses. Rebound secured by Kawhi Russell.

================================================================================
                              1ST QUARTER COMPLETE                              
================================================================================

1ST QUARTER SCORE: Team_005 20, Team_022 29

BOX SCORE:
================================================================================

Team_005
--------------------------------------------------------------------------------
Player                MIN  PTS  REB  AST  TO      FG   FG%      3P   3P%
--------------------------------------------------------------------------------
Cade Markkanen         11    9    3    0   0   4/5    80.0     0/0   0.0
Zion Parker             1    3    0    0   0   1/1   100.0     0/0   0.0
Jalen Rozier           11    2    5    0   0   1/3    33.3     0/0   0.0
Derrick Allen          11    2    1    1   0   1/2    50.0     0/0   0.0
Brandon George         11    2    0    0   0   1/2    50.0     0/0   0.0
Anthony Rozier         11    0    0    0   0   0/1     0.0     0/0   0.0
Lauri Wade              1    0    2    0   0   0/0     0.0     0/0   0.0
Isaiah Durant           1    0    0    0   0   0/1     0.0     0/0   0.0

TEAM: FG: 8/15 (53.3%), 3PT: 1/5 (20.0%), REB: 11 (4 off, 7 def), AST: 1, TO: 8
TEAM FOULS: 8 [Team_022 in BONUS]


Team_022
--------------------------------------------------------------------------------
Player                MIN  PTS  REB  AST  TO      FG   FG%      3P   3P%
--------------------------------------------------------------------------------
Michael Ginobili       11   16    5    0   0   6/6   100.0     0/0   0.0
Myles Anthony          11    8    2    0   0   3/5    60.0     0/0   0.0
Dirk Markkanen         11    3    0    0   0   1/2    50.0     0/0   0.0
Malcolm Allen          11    2    0    2   0   1/2    50.0     0/0   0.0
Lamelo Dosunmu         11    0    0    1   0   0/1     0.0     0/0   0.0
Kawhi Russell           1    0    1    0   0   0/1     0.0     0/0   0.0
Cole Iverson            1    0    0    0   0   0/1     0.0     0/0   0.0

TEAM: FG: 11/18 (61.1%), 3PT: 4/6 (66.7%), REB: 8 (1 off, 7 def), AST: 3, TO: 4
TEAM FOULS: 10 [Team_005 in BONUS]

================================================================================

================================================================================
                       2ND QUARTER - Team_005 vs Team_022                       
================================================================================

[12:00] Team_005 possession (Score: 20-29)
Brandon George attempts a Midrange. Contested by Lamelo Dosunmu (5.0 feet, ZONE). Brandon George misses. Rebound secured by Myles Anthony.

[11:49] Team_022 possession (Score: 20-29)
Dirk Markkanen attempts a Midrange. Contested by Cade Markkanen (4.0 feet, MAN). Dirk Markkanen misses. Rebound secured by Jalen Rozier.

[11:38] Team_005 possession (Score: 20-29)
Jalen Rozier attempts a 3Pt. Contested by Lamelo Dosunmu (5.2 feet, MAN). JALEN ROZIER MAKES IT! Assist: Brandon George
Score: 23-29

[11:23] Team_022 possession (Score: 23-29)
Lamelo Dosunmu attempts a Midrange. Contested by Derrick Allen (4.8 feet, ZONE). Lamelo Dosunmu misses. Offensive rebound by Dirk Markkanen! Dirk Markkanen's putback is no good. Offensive rebound by Michael Ginobili! Michael Ginobili kicks it out.

[11:12] Team_022 possession (Score: 23-29)
Dirk Markkanen attempts a Midrange. Contested by Anthony Rozier (5.4 feet, ZONE). DIRK MARKKANEN MAKES IT!
Score: 23-31

[10:59] Team_005 possession (Score: 23-31)
Jalen Rozier drives and kicks out. Anthony Rozier attempts a Midrange. Contested by Myles Anthony (4.7 feet, ZONE). Anthony Rozier misses. Offensive rebound by Jalen Rozier! Jalen Rozier kicks it out.

[10:41] Team_005 possession (Score: 23-31)
FOUL! Holding foul on Dirk Markkanen. [Team fouls: 1] No free throws, side out. (Dirk Markkanen: 1 personal fouls)

[10:28] Team_005 possession (Score: 23-31)
Derrick Allen attempts a Layup. BLOCKED BY DIRK MARKKANEN! Ball is loose! Offensive rebound by Jalen Rozier! Jalen Rozier kicks it out.

[10:15] Team_005 possession (Score: 23-31)
Derrick Allen attempts a 3Pt. Contested by Myles Anthony (5.2 feet, MAN). Derrick Allen misses. FOUL! Loose ball foul on Michael Ginobili during the rebound battle. [Team fouls: 3] No free throws, side out. (Michael Ginobili: 1 personal fouls)

[10:04] Team_005 possession (Score: 23-31)
Jalen Rozier drives and kicks out. Anthony Rozier attempts a 3Pt. Contested by Michael Ginobili (3.9 feet, MAN). Anthony Rozier misses. Rebound secured by Dirk Markkanen.

[09:48] Team_022 possession (Score: 23-31)
Malcolm Allen attempts a Layup. Contested by Cade Markkanen (4.5 feet, ZONE). MALCOLM ALLEN MAKES IT! Assist: Dirk Markkanen
Score: 23-33

[09:33] Team_005 possession (Score: 23-33)
Anthony Rozier drives, Dirk Markkanen stays with him. Anthony Rozier attempts a Layup. Contested by Dirk Markkanen (5.1 feet, ZONE). Anthony Rozier misses. Rebound secured by Dirk Markkanen.

[09:20] Team_022 possession (Score: 23-33)
Lamelo Dosunmu drives and kicks out. Michael Ginobili attempts a 3Pt. Contested by Anthony Rozier (5.2 feet, MAN). Michael Ginobili misses. Rebound secured by Jalen Rozier.

[09:07] Team_005 possession (Score: 23-33)
Anthony Rozier drives to the basket... Anthony Rozier loses the ball! Stripped by Michael Ginobili! TURNOVER! (live ball)

[08:51] Team_022 possession (Score: 23-33)
Lamelo Dosunmu attempts a 3Pt. Contested by Jalen Rozier (5.8 feet, MAN). Lamelo Dosunmu misses. Rebound secured by Derrick Allen.

[08:36] Team_005 possession (Score: 23-33)
FOUL! Shooting foul on Michael Ginobili. Derrick Allen to the line for 2 free throws. [Team fouls: 4] (Michael Ginobili: 2 personal fouls)   FT 1/2: GOOD   FT 2/2: GOOD Derrick Allen makes 2/2 from the line.
Score: 25-33

[08:23] Team_022 possession (Score: 25-33)
Dirk Markkanen drives, picks up Cade Markkanen. Help arrives from Anthony Rozier! Dirk Markkanen attempts a Dunk. Contested by Anthony Rozier (4.5 feet, MAN). DIRK MARKKANEN MAKES IT! Assist: Lamelo Dosunmu
Score: 25-35

[08:06] Team_005 possession (Score: 25-35)
FOUL! Reach-in foul on Dirk Markkanen during the drive. [IN THE BONUS! 5 team fouls] Derrick Allen to the line for 2 free throws. (Dirk Markkanen: 2 personal fouls)   FT 1/2: GOOD   FT 2/2: GOOD Derrick Allen makes 2/2 from the line.
Score: 27-35

[07:51] Team_022 possession (Score: 27-35)
Lamelo Dosunmu attempts a 3Pt. Contested by Jalen Rozier (5.9 feet, MAN). Lamelo Dosunmu misses. Rebound secured by Derrick Allen.

[07:35] Team_005 possession (Score: 27-35)
Cade Markkanen attempts a Midrange. Contested by Myles Anthony (4.9 feet, ZONE). Cade Markkanen misses. Rebound secured by Myles Anthony.

[07:17] Team_022 possession (Score: 27-35)
Lamelo Dosunmu drives, Jalen Rozier stays with him. Lamelo Dosunmu attempts a Dunk. Contested by Jalen Rozier (5.9 feet, MAN). Lamelo Dosunmu misses. Rebound secured by Derrick Allen.

[07:00] Team_005 possession (Score: 27-35)
Cade Markkanen makes the Layup and draws the foul on Dirk Markkanen! And-1! Cade Markkanen to the line for 1. [BONUS: 6 team fouls] (Dirk Markkanen: 3 personal fouls)   FT 1/1: MISS Cade Markkanen makes 0/1 from the line. Offensive rebound by Cade Markkanen! Cade Markkanen kicks it out.
Score: 29-35

[06:46] Team_005 possession (Score: 29-35)
FOUL! Holding foul on Malcolm Allen. [IN THE BONUS! 7 team fouls] Brandon George to the line for 2 free throws. (Malcolm Allen: 1 personal fouls)   FT 1/2: GOOD   FT 2/2: GOOD Brandon George makes 2/2 from the line.
Score: 31-35

[06:31] Team_022 possession (Score: 31-35)
Dirk Markkanen attempts a Layup. Contested by Cade Markkanen (4.8 feet, ZONE). Dirk Markkanen misses. Rebound secured by Cade Markkanen.

[06:15] Team_005 possession (Score: 31-35)
Derrick Allen attempts a 3Pt. Contested by Michael Ginobili (4.7 feet, ZONE). Derrick Allen misses. Rebound secured by Dirk Markkanen.

[06:00] Team_022 possession (Score: 31-35)
FOUL! Shooting foul on Derrick Allen. Michael Ginobili to the line for 2 free throws. [Team fouls: 1] (Derrick Allen: 1 personal fouls)   FT 1/2: GOOD   FT 2/2: GOOD Michael Ginobili makes 2/2 from the line.
Score: 31-37

[05:50] Team_005 possession (Score: 31-37)
FOUL! Holding foul on Dirk Markkanen. [IN THE BONUS! 8 team fouls] Cade Markkanen to the line for 2 free throws. (Dirk Markkanen: 4 personal fouls)   FT 1/2: GOOD   FT 2/2: GOOD Cade Markkanen makes 2/2 from the line.
Score: 33-37

[05:35] Team_022 possession (Score: 33-37)
Dirk Markkanen attempts a Midrange. Contested by Cade Markkanen (4.9 feet, MAN). DIRK MARKKANEN MAKES IT!
Score: 33-39

[05:21] Team_005 possession (Score: 33-39)
Jalen Rozier attempts a 3Pt. Contested by Lamelo Dosunmu (6.0 feet, MAN). Jalen Rozier misses. Rebound secured by Dirk Markkanen.

[05:07] Team_022 possession (Score: 33-39)
Dirk Markkanen attempts a Layup. Contested by Cade Markkanen (5.0 feet, ZONE). DIRK MARKKANEN MAKES IT! Assist: Malcolm Allen
Score: 33-41

[04:52] Team_005 possession (Score: 33-41)
Derrick Allen attempts a 3Pt. Contested by Michael Ginobili (4.9 feet, ZONE). DERRICK ALLEN MAKES IT! Assist: Brandon George
Score: 36-41

[04:40] Team_022 possession (Score: 36-41)
Lamelo Dosunmu attempts a 3Pt. Contested by Derrick Allen (5.5 feet, ZONE). LAMELO DOSUNMU MAKES IT! Assist: Michael Ginobili
Score: 36-44

[04:25] Team_005 possession (Score: 36-44)
Jalen Rozier makes the 3Pt and draws the foul on Michael Ginobili! And-1! Jalen Rozier to the line for 1. [BONUS: 9 team fouls] (Michael Ginobili: 3 personal fouls)   FT 1/1: GOOD Jalen Rozier makes 1/1 from the line.
Score: 40-44

[04:11] Team_022 possession (Score: 40-44)
Dirk Markkanen attempts a Midrange. Wide open! Jalen Rozier is 6.3 feet away. [ZONE] DIRK MARKKANEN MAKES IT!
Score: 40-46

[03:58] Team_005 possession (Score: 40-46)
Derrick Allen attempts a Midrange. Wide open! Lamelo Dosunmu is 6.3 feet away. [ZONE] Derrick Allen misses. Rebound secured by Michael Ginobili.

[03:43] Team_022 possession (Score: 40-46)
Lamelo Dosunmu attempts a 3Pt. Contested by Derrick Allen (5.6 feet, ZONE). Lamelo Dosunmu misses. Rebound secured by Derrick Allen.

[03:29] Team_005 possession (Score: 40-46)
Cade Markkanen drives to the basket... Cade Markkanen throws a bad pass out of bounds! TURNOVER! (dead ball)

[03:29] Substitution (Team_005): Brandon George OUT → Blake O'Neal IN (stamina_rule2)

[03:29] Substitution (Team_005): Anthony Rozier OUT → Draymond Smith IN (stamina_rule2)

[03:29] Substitution (Team_005): Derrick Allen OUT → Lauri Wade IN (stamina_rule2)

[03:29] Substitution (Team_005): Jalen Rozier OUT → Isaiah Durant IN (stamina_rule2)

[03:29] Substitution (Team_005): Cade Markkanen OUT → Zion Parker IN (stamina_rule2)

[03:29] Substitution (Team_022): Malcolm Allen OUT → DeMar Harden IN (stamina_rule2)

[03:29] Substitution (Team_022): Michael Ginobili OUT → Lauri Gobert IN (stamina_rule2)

[03:29] Substitution (Team_022): Myles Anthony OUT → Dejounte Towns IN (stamina_rule2)

[03:29] Substitution (Team_022): Lamelo Dosunmu OUT → Kawhi Russell IN (stamina_rule2)

[03:29] Substitution (Team_022): Dirk Markkanen OUT → Cole Iverson IN (stamina_rule2)

[03:16] Team_022 possession (Score: 40-46)
Dejounte Towns makes the Layup and draws the foul on Lauri Wade! And-1! Dejounte Towns to the line for 1. [Team fouls: 2] (Lauri Wade: 1 personal fouls)   FT 1/1: MISS Dejounte Towns makes 0/1 from the line. Rebound secured by Lauri Wade.
Score: 40-48

[03:03] Team_005 possession (Score: 40-48)
FOUL! Holding foul on Lauri Gobert. [IN THE BONUS! 10 team fouls] Draymond Smith to the line for 2 free throws. (Lauri Gobert: 1 personal fouls)   FT 1/2: GOOD   FT 2/2: MISS Draymond Smith makes 1/2 from the line. Rebound secured by Lauri Gobert.
Score: 41-48

[02:50] Team_022 possession (Score: 41-48)
Kawhi Russell attempts a 3Pt. Contested by Isaiah Durant (4.7 feet, MAN). Kawhi Russell misses. FOUL! Loose ball foul on Draymond Smith during the rebound battle. [Team fouls: 3] No free throws, side out. (Draymond Smith: 1 personal fouls)

[02:38] Team_022 possession (Score: 41-48)
Dejounte Towns drives to the basket... Dejounte Towns throws a bad pass! Stolen by Zion Parker! TURNOVER! (live ball)

[02:25] Team_005 possession (Score: 41-48)
Lauri Wade makes the Midrange and draws the foul on Lauri Gobert! And-1! Lauri Wade to the line for 1. [BONUS: 11 team fouls] (Lauri Gobert: 2 personal fouls)   FT 1/1: GOOD Lauri Wade makes 1/1 from the line.
Score: 44-48

[02:11] Team_022 possession (Score: 44-48)
DeMar Harden attempts a 3Pt. Contested by Blake O'Neal (4.1 feet, MAN). DeMar Harden misses. Offensive rebound by Lauri Gobert! Lauri Gobert kicks it out.

[02:02] Team_022 possession (Score: 44-48)
Lauri Gobert attempts a Midrange. Contested by Draymond Smith (4.3 feet, MAN). Lauri Gobert misses. Rebound secured by Draymond Smith.

[01:48] Team_005 possession (Score: 44-48)
Zion Parker loses control! Ball rolls out of bounds! TURNOVER! (dead ball)

[01:35] Team_022 possession (Score: 44-48)
Cole Iverson throws a bad pass out of bounds! TURNOVER! (dead ball)

[01:22] Team_005 possession (Score: 44-48)
Zion Parker drives, Cole Iverson stays with him. Zion Parker attempts a Layup. Contested by Cole Iverson (5.1 feet, MAN). ZION PARKER MAKES IT! Assist: Draymond Smith
Score: 46-48

[01:08] Team_022 possession (Score: 46-48)
Cole Iverson attempts a Layup. Contested by Zion Parker (4.1 feet, MAN). COLE IVERSON MAKES IT! Assist: Lauri Gobert
Score: 46-50

[00:52] Team_005 possession (Score: 46-50)
Isaiah Durant throws a bad pass out of bounds! TURNOVER! (dead ball)

[00:40] Team_022 possession (Score: 46-50)
Lauri Gobert attempts a 3Pt. Contested by Draymond Smith (4.3 feet, MAN). Lauri Gobert misses. Rebound secured by Zion Parker.

[00:24] Team_005 possession (Score: 46-50)
Zion Parker attempts a Layup. BLOCKED BY COLE IVERSON! Ball is loose! Rebound secured by Dejounte Towns.

[00:07] Team_022 possession (Score: 46-50)
Kawhi Russell attempts a 3Pt. Contested by Lauri Wade (5.3 feet, ZONE). Kawhi Russell misses. Offensive rebound by Dejounte Towns! Dejounte Towns kicks it out.

================================================================================
                              2ND QUARTER COMPLETE                              
================================================================================

2ND QUARTER SCORE: Team_005 26, Team_022 21

BOX SCORE:
================================================================================

Team_005
--------------------------------------------------------------------------------
Player                MIN  PTS  REB  AST  TO      FG   FG%      3P   3P%
--------------------------------------------------------------------------------
Jalen Rozier           20    7    4    0   0   2/4    50.0     0/0   0.0
Derrick Allen          20    7    4    0   0   3/5    60.0     0/0   0.0
Lauri Wade              4    3    1    0   0   1/1   100.0     0/0   0.0
Brandon George         20    2    0    2   0   1/2    50.0     0/0   0.0
Cade Markkanen         20    2    3    0   0   1/2    50.0     0/0   0.0
Zion Parker             4    2    1    0   0   1/2    50.0     0/0   0.0
Anthony Rozier         20    0    0    0   0   0/1     0.0     0/0   0.0
Draymond Smith          4    0    1    1   0   0/0     0.0     0/0   0.0

TEAM: FG: 9/18 (50.0%), 3PT: 3/5 (60.0%), REB: 14 (4 off, 10 def), AST: 3, TO: 4
TEAM FOULS: 3


Team_022
--------------------------------------------------------------------------------
Player                MIN  PTS  REB  AST  TO      FG   FG%      3P   3P%
--------------------------------------------------------------------------------
Dirk Markkanen         20   10    4    1   0   5/7    71.4     0/0   0.0
Lamelo Dosunmu         20    3    0    1   0   1/6    16.7     0/0   0.0
Michael Ginobili       20    2    2    1   0   1/1   100.0     0/0   0.0
Malcolm Allen          20    2    0    1   0   1/1   100.0     0/0   0.0
Cole Iverson            4    2    0    0   0   1/1   100.0     0/0   0.0
Myles Anthony          20    0    2    0   0   0/0     0.0     0/0   0.0
Dejounte Towns          4    0    2    0   0   0/1     0.0     0/0   0.0
Lauri Gobert            4    0    3    1   0   0/2     0.0     0/0   0.0

TEAM: FG: 9/19 (47.4%), 3PT: 1/5 (20.0%), REB: 13 (4 off, 9 def), AST: 5, TO: 2
TEAM FOULS: 11 [Team_005 in BONUS]

================================================================================

================================================================================
                       3RD QUARTER - Team_005 vs Team_022                       
================================================================================

[12:00] Team_005 possession (Score: 46-50)
Cade Markkanen attempts a Midrange. Contested by Myles Anthony (4.2 feet, ZONE). Cade Markkanen misses. Rebound secured by Dirk Markkanen.

[11:47] Team_022 possession (Score: 46-50)
Lamelo Dosunmu attempts a Midrange. Contested by Derrick Allen (4.7 feet, ZONE). Lamelo Dosunmu misses. Rebound secured by Cade Markkanen.

[11:31] Team_005 possession (Score: 46-50)
Brandon George attempts a 3Pt. Contested by Michael Ginobili (3.7 feet, ZONE). Brandon George misses. Rebound secured by Myles Anthony.

[11:18] Team_022 possession (Score: 46-50)
Michael Ginobili drives, Cade Markkanen stays with him. Michael Ginobili attempts a Layup. Contested by Cade Markkanen (3.3 feet, ZONE). Michael Ginobili misses. Rebound secured by Jalen Rozier.

[11:01] Team_005 possession (Score: 46-50)
Derrick Allen attempts a 3Pt. Contested by Myles Anthony (4.8 feet, MAN). DERRICK ALLEN MAKES IT!
Score: 49-50

[10:47] Team_022 possession (Score: 49-50)
FOUL! Reach-in foul on Cade Markkanen during the drive. [Team fouls: 1] No free throws, side out. (Cade Markkanen: 1 personal fouls)

[10:35] Team_022 possession (Score: 49-50)
Myles Anthony attempts a 3Pt. Contested by Derrick Allen (4.4 feet, ZONE). Myles Anthony misses. Rebound secured by Jalen Rozier.

[10:23] Team_005 possession (Score: 49-50)
Anthony Rozier attempts a 3Pt. Contested by Michael Ginobili (3.6 feet, MAN). Anthony Rozier misses. Rebound secured by Dirk Markkanen.

[10:11] Team_022 possession (Score: 49-50)
Myles Anthony attempts a 3Pt. Contested by Derrick Allen (4.4 feet, ZONE). Myles Anthony misses. Offensive rebound by Dirk Markkanen! Dirk Markkanen's putback is no good. Offensive rebound by Dirk Markkanen! Dirk Markkanen kicks it out.

[09:53] Team_022 possession (Score: 49-50)
Dirk Markkanen drives to the basket... FOUL! Offensive foul on Dirk Markkanen! Cade Markkanen drew the charge! [Team fouls: 1] (Dirk Markkanen: 1 personal fouls) TURNOVER! (dead ball)

[09:41] Team_005 possession (Score: 49-50)
Derrick Allen drives, Myles Anthony stays with him. Derrick Allen attempts a Layup. Contested by Myles Anthony (4.8 feet, MAN). DERRICK ALLEN MAKES IT!
Score: 51-50

[09:27] Team_022 possession (Score: 51-50)
Michael Ginobili attempts a Midrange. Contested by Derrick Allen (4.3 feet, ZONE). Michael Ginobili misses. Rebound secured by Cade Markkanen.

[09:13] Team_005 possession (Score: 51-50)
Cade Markkanen drives to the basket... Cade Markkanen throws a bad pass out of bounds! TURNOVER! (dead ball)

[09:01] Team_022 possession (Score: 51-50)
Michael Ginobili attempts a Midrange. Contested by Derrick Allen (4.3 feet, ZONE). Michael Ginobili misses. Rebound secured by Cade Markkanen.

[08:48] Team_005 possession (Score: 51-50)
Anthony Rozier drives, Dirk Markkanen stays with him. Anthony Rozier attempts a Layup. Contested by Dirk Markkanen (4.7 feet, ZONE). ANTHONY ROZIER MAKES IT! Assist: Jalen Rozier
Score: 53-50

[08:35] Team_022 possession (Score: 53-50)
Dirk Markkanen attempts a Layup. Contested by Cade Markkanen (3.7 feet, MAN). DIRK MARKKANEN MAKES IT! Assist: Lamelo Dosunmu
Score: 53-52

[08:24] Team_005 possession (Score: 53-52)
Anthony Rozier attempts a Layup. Contested by Lamelo Dosunmu (4.7 feet, ZONE). Anthony Rozier misses. Offensive rebound by Jalen Rozier! Jalen Rozier kicks it out.

[08:10] Team_005 possession (Score: 53-52)
Jalen Rozier makes the Midrange and draws the foul on Lamelo Dosunmu! And-1! Jalen Rozier to the line for 1. [Team fouls: 2] (Lamelo Dosunmu: 1 personal fouls)   FT 1/1: GOOD Jalen Rozier makes 1/1 from the line.
Score: 56-52

[07:56] Team_022 possession (Score: 56-52)
Lamelo Dosunmu attempts a 3Pt. Contested by Cade Markkanen (3.7 feet, MAN). Lamelo Dosunmu misses. Rebound secured by Cade Markkanen.

[07:44] Team_005 possession (Score: 56-52)
Cade Markkanen attempts a Midrange. Contested by Dirk Markkanen (4.4 feet, MAN). CADE MARKKANEN MAKES IT! Assist: Anthony Rozier
Score: 58-52

[07:30] Team_022 possession (Score: 58-52)
Malcolm Allen attempts a 3Pt. Contested by Brandon George (5.8 feet, MAN). MALCOLM ALLEN MAKES IT! Assist: Myles Anthony
Score: 58-55

[07:15] Team_005 possession (Score: 58-55)
Brandon George attempts a 3Pt. Contested by Malcolm Allen (4.6 feet, MAN). BRANDON GEORGE MAKES IT! Assist: Jalen Rozier
Score: 61-55

[06:57] Team_022 possession (Score: 61-55)
Malcolm Allen throws a bad pass out of bounds! TURNOVER! (dead ball)

[06:42] Team_005 possession (Score: 61-55)
Cade Markkanen drives and kicks out. Brandon George attempts a Midrange. Contested by Malcolm Allen (4.4 feet, MAN). BRANDON GEORGE MAKES IT! Assist: Jalen Rozier
Score: 63-55

[06:25] Team_022 possession (Score: 63-55)
Dirk Markkanen attempts a Midrange. Contested by Anthony Rozier (5.1 feet, ZONE). DIRK MARKKANEN MAKES IT!
Score: 63-57

[06:11] Team_005 possession (Score: 63-57)
Cade Markkanen makes the Layup and draws the foul on Dirk Markkanen! And-1! Cade Markkanen to the line for 1. [Team fouls: 3] (Dirk Markkanen: 2 personal fouls)   FT 1/1: GOOD Cade Markkanen makes 1/1 from the line.
Score: 66-57

[05:55] Team_022 possession (Score: 66-57)
Malcolm Allen attempts a Midrange. Contested by Jalen Rozier (5.6 feet, ZONE). MALCOLM ALLEN MAKES IT!
Score: 66-59

[05:41] Team_005 possession (Score: 66-59)
FOUL! Offensive foul on Derrick Allen! Myles Anthony drew the charge! [Team fouls: 2] (Derrick Allen: 1 personal fouls) TURNOVER! (dead ball)

[05:26] Team_022 possession (Score: 66-59)
Myles Anthony attempts a Layup. BLOCKED BY ANTHONY ROZIER! Ball is loose! Offensive rebound by Dirk Markkanen! Dirk Markkanen kicks it out.

[05:10] Team_022 possession (Score: 66-59)
FOUL! Reach-in foul on Brandon George during the drive. [Team fouls: 3] No free throws, side out. (Brandon George: 1 personal fouls)

[04:56] Team_022 possession (Score: 66-59)
Malcolm Allen makes the 3Pt and draws the foul on Brandon George! And-1! Malcolm Allen to the line for 1. [Team fouls: 4] (Brandon George: 2 personal fouls)   FT 1/1: GOOD Malcolm Allen makes 1/1 from the line.
Score: 66-63

[04:45] Team_005 possession (Score: 66-63)
Anthony Rozier attempts a 3Pt. Contested by Michael Ginobili (3.6 feet, ZONE). Anthony Rozier misses. Rebound secured by Myles Anthony.

[04:32] Team_022 possession (Score: 66-63)
Dirk Markkanen attempts a 3Pt. Contested by Derrick Allen (4.8 feet, ZONE). DIRK MARKKANEN MAKES IT!
Score: 66-66

[04:17] Team_005 possession (Score: 66-66)
FOUL! Holding foul on Myles Anthony. [Team fouls: 4] No free throws, side out. (Myles Anthony: 1 personal fouls)

[04:03] Team_005 possession (Score: 66-66)
Brandon George attempts a Layup. Contested by Malcolm Allen (4.7 feet, MAN). Brandon George misses. Rebound secured by Michael Ginobili.

[03:51] Team_022 possession (Score: 66-66)
Michael Ginobili attempts a Midrange. Contested by Anthony Rozier (4.9 feet, MAN). Michael Ginobili misses. Rebound secured by Jalen Rozier.

[03:41] Team_005 possession (Score: 66-66)
Anthony Rozier attempts a 3Pt. Contested by Michael Ginobili (3.7 feet, ZONE). Anthony Rozier misses. Rebound secured by Michael Ginobili.

[03:23] Team_022 possession (Score: 66-66)
Malcolm Allen attempts a 3Pt. Contested by Jalen Rozier (5.8 feet, ZONE). Malcolm Allen misses. Rebound secured by Jalen Rozier.

[03:11] Team_005 possession (Score: 66-66)
Brandon George attempts a 3Pt. Contested by Michael Ginobili (3.9 feet, ZONE). Brandon George misses. Rebound secured by Dirk Markkanen.

[02:58] Team_022 possession (Score: 66-66)
Dirk Markkanen attempts a Layup. Contested by Cade Markkanen (4.1 feet, ZONE). DIRK MARKKANEN MAKES IT!
Score: 66-68

[02:41] Team_005 possession (Score: 66-68)
Derrick Allen attempts a Midrange. Contested by Dirk Markkanen (5.3 feet, ZONE). DERRICK ALLEN MAKES IT! Assist: Anthony Rozier
Score: 68-68

[02:29] Team_022 possession (Score: 68-68)
Malcolm Allen attempts a 3Pt. Wide open! Brandon George is 6.1 feet away. [MAN] MALCOLM ALLEN MAKES IT! Assist: Lamelo Dosunmu
Score: 68-71

[02:18] Team_005 possession (Score: 68-71)
FOUL! Reach-in foul on Dirk Markkanen during the drive. [IN THE BONUS! 5 team fouls] Cade Markkanen to the line for 2 free throws. (Dirk Markkanen: 3 personal fouls)   FT 1/2: MISS   FT 2/2: GOOD Cade Markkanen makes 1/2 from the line.
Score: 69-71

[02:09] Team_022 possession (Score: 69-71)
Malcolm Allen drives, picks up Brandon George. Help arrives from Anthony Rozier! Malcolm Allen attempts a Layup. Wide open! Anthony Rozier is 6.2 feet away. [MAN] Malcolm Allen misses. Rebound secured by Jalen Rozier.

[01:56] Team_005 possession (Score: 69-71)
FOUL! Shooting foul on Michael Ginobili. Anthony Rozier to the line for 2 free throws. [BONUS: 6 team fouls] (Michael Ginobili: 1 personal fouls)   FT 1/2: GOOD   FT 2/2: GOOD Anthony Rozier makes 2/2 from the line.
Score: 71-71

[01:42] Team_022 possession (Score: 71-71)
FOUL! Holding foul on Anthony Rozier. [IN THE BONUS! 5 team fouls] Michael Ginobili to the line for 2 free throws. (Anthony Rozier: 1 personal fouls)   FT 1/2: GOOD   FT 2/2: MISS Michael Ginobili makes 1/2 from the line. Offensive rebound by Dirk Markkanen! Dirk Markkanen puts it back in!
Score: 71-74

[01:30] Team_005 possession (Score: 71-74)
FOUL! Shooting foul on Lamelo Dosunmu. Jalen Rozier to the line for 2 free throws. [BONUS: 7 team fouls] (Lamelo Dosunmu: 2 personal fouls)   FT 1/2: GOOD   FT 2/2: GOOD Jalen Rozier makes 2/2 from the line.
Score: 73-74

[01:18] Team_022 possession (Score: 73-74)
Michael Ginobili drives and kicks out. Malcolm Allen attempts a 3Pt. Contested by Derrick Allen (4.7 feet, ZONE). Malcolm Allen misses. Rebound secured by Cade Markkanen.

[01:03] Team_005 possession (Score: 73-74)
Jalen Rozier drives, picks up Lamelo Dosunmu. Help arrives from Michael Ginobili! Jalen Rozier attempts a Dunk. Contested by Michael Ginobili (5.5 feet, ZONE). JALEN ROZIER MAKES IT! Assist: Brandon George
Score: 75-74

[00:49] Team_022 possession (Score: 75-74)
Myles Anthony attempts a 3Pt. Contested by Derrick Allen (4.8 feet, ZONE). Myles Anthony misses. Rebound secured by Cade Markkanen.

[00:35] Team_005 possession (Score: 75-74)
Anthony Rozier attempts a 3Pt. Contested by Michael Ginobili (4.1 feet, ZONE). Anthony Rozier misses. Rebound secured by Dirk Markkanen.

[00:23] Team_022 possession (Score: 75-74)
Michael Ginobili attempts a 3Pt. Contested by Anthony Rozier (5.3 feet, MAN). Michael Ginobili misses. Offensive rebound by Dirk Markkanen! Dirk Markkanen kicks it out.

[00:11] Team_022 possession (Score: 75-74)
Malcolm Allen drives and kicks out. Myles Anthony attempts a 3Pt. Contested by Derrick Allen (4.8 feet, MAN). MYLES ANTHONY MAKES IT! Assist: Malcolm Allen
Score: 75-77

================================================================================
                              3RD QUARTER COMPLETE                              
================================================================================

3RD QUARTER SCORE: Team_005 29, Team_022 27

BOX SCORE:
================================================================================

Team_005
--------------------------------------------------------------------------------
Player                MIN  PTS  REB  AST  TO      FG   FG%      3P   3P%
--------------------------------------------------------------------------------
Jalen Rozier           32    7    6    3   0   3/3   100.0     0/0   0.0
Derrick Allen          32    7    0    0   0   3/3   100.0     0/0   0.0
Cade Markkanen         32    6    6    0   0   3/4    75.0     0/0   0.0
Brandon George         32    5    0    1   0   2/5    40.0     0/0   0.0
Anthony Rozier         32    4    0    2   0   2/6    33.3     0/0   0.0

TEAM: FG: 13/21 (61.9%), 3PT: 2/8 (25.0%), REB: 12 (1 off, 11 def), AST: 6, TO: 2
TEAM FOULS: 5 [Team_022 in BONUS]


Team_022
--------------------------------------------------------------------------------
Player                MIN  PTS  REB  AST  TO      FG   FG%      3P   3P%
--------------------------------------------------------------------------------
Dirk Markkanen         32   12    7    0   0   5/5   100.0     0/0   0.0
Malcolm Allen          32   12    0    1   0   4/6    66.7     0/0   0.0
Myles Anthony          32    3    2    1   0   1/3    33.3     0/0   0.0
Lamelo Dosunmu         32    0    0    2   0   0/2     0.0     0/0   0.0
Michael Ginobili       32    0    2    0   0   0/5     0.0     0/0   0.0

TEAM: FG: 10/21 (47.6%), 3PT: 4/8 (50.0%), REB: 11 (3 off, 8 def), AST: 4, TO: 2
TEAM FOULS: 7 [Team_005 in BONUS]

================================================================================

================================================================================
                       4TH QUARTER - Team_005 vs Team_022                       
================================================================================

[12:00] Substitution (Team_005): Brandon George OUT → Blake O'Neal IN (stamina_rule2)

[12:00] Substitution (Team_005): Anthony Rozier OUT → Draymond Smith IN (stamina_rule2)

[12:00] Substitution (Team_005): Derrick Allen OUT → Lauri Wade IN (stamina_rule2)

[12:00] Substitution (Team_005): Jalen Rozier OUT → Isaiah Durant IN (stamina_rule2)

[12:00] Substitution (Team_005): Cade Markkanen OUT → Zion Parker IN (stamina_rule2)

[12:00] Substitution (Team_022): Malcolm Allen OUT → DeMar Harden IN (stamina_rule2)

[12:00] Substitution (Team_022): Michael Ginobili OUT → Lauri Gobert IN (stamina_rule2)

[12:00] Substitution (Team_022): Myles Anthony OUT → Dejounte Towns IN (stamina_rule2)

[12:00] Substitution (Team_022): Lamelo Dosunmu OUT → Kawhi Russell IN (stamina_rule2)

[12:00] Substitution (Team_022): Dirk Markkanen OUT → Cole Iverson IN (stamina_rule2)

[12:00] Team_005 possession (Score: 75-77)
Anthony Rozier drives to the basket... Anthony Rozier loses control! Ball rolls out of bounds! TURNOVER! (dead ball)

[11:45] Team_022 possession (Score: 75-77)
Kawhi Russell attempts a Layup. Contested by Zion Parker (4.3 feet, ZONE). KAWHI RUSSELL MAKES IT! Assist: Dejounte Towns
Score: 75-79

[11:30] Team_005 possession (Score: 75-79)
Isaiah Durant attempts a 3Pt. Contested by Kawhi Russell (4.3 feet, ZONE). Isaiah Durant misses. FOUL! Loose ball foul on Dejounte Towns during the rebound battle. [Team fouls: 1] No free throws, side out. (Dejounte Towns: 1 personal fouls)

[11:16] Team_005 possession (Score: 75-79)
Blake O'Neal attempts a 3Pt. Contested by DeMar Harden (5.8 feet, MAN). BLAKE O'NEAL MAKES IT! Assist: Isaiah Durant
Score: 78-79

[11:00] Team_022 possession (Score: 78-79)
Kawhi Russell attempts a 3Pt. Contested by Isaiah Durant (4.7 feet, MAN). Kawhi Russell misses. Rebound secured by Zion Parker.

[10:49] Team_005 possession (Score: 78-79)
Blake O'Neal attempts a 3Pt. Contested by Kawhi Russell (4.4 feet, ZONE). BLAKE O'NEAL MAKES IT!
Score: 81-79

[10:34] Team_022 possession (Score: 81-79)
Lauri Gobert attempts a 3Pt. Contested by Draymond Smith (4.3 feet, MAN). LAURI GOBERT MAKES IT! Assist: Cole Iverson
Score: 81-82

[10:19] Team_005 possession (Score: 81-82)
Blake O'Neal attempts a Layup. Contested by Kawhi Russell (4.4 feet, ZONE). Blake O'Neal misses. Rebound secured by Lauri Gobert.

[10:03] Team_022 possession (Score: 81-82)
Dejounte Towns attempts a Midrange. Contested by Zion Parker (4.1 feet, ZONE). DEJOUNTE TOWNS MAKES IT!
Score: 81-84

[09:50] Team_005 possession (Score: 81-84)
FOUL! Reach-in foul on Cole Iverson during the drive. [Team fouls: 2] No free throws, side out. (Cole Iverson: 1 personal fouls)

[09:39] Team_005 possession (Score: 81-84)
Draymond Smith attempts a 3Pt. Contested by Lauri Gobert (4.2 feet, MAN). DRAYMOND SMITH MAKES IT! Assist: Zion Parker
Score: 84-84

[09:25] Team_022 possession (Score: 84-84)
Kawhi Russell attempts a Layup. Contested by Isaiah Durant (4.7 feet, MAN). KAWHI RUSSELL MAKES IT!
Score: 84-86

[09:16] Team_005 possession (Score: 84-86)
Blake O'Neal attempts a 3Pt. Contested by Kawhi Russell (4.4 feet, ZONE). Blake O'Neal misses. Offensive rebound by Zion Parker! Zion Parker puts it back in!
Score: 86-86

[09:03] Team_022 possession (Score: 86-86)
Kawhi Russell attempts a 3Pt. Contested by Blake O'Neal (4.4 feet, ZONE). Kawhi Russell misses. Rebound secured by Zion Parker.

[08:49] Team_005 possession (Score: 86-86)
FOUL! Shooting foul on Kawhi Russell. Lauri Wade to the line for 3 free throws. [Team fouls: 3] (Kawhi Russell: 1 personal fouls)   FT 1/3: GOOD   FT 2/3: GOOD   FT 3/3: GOOD Lauri Wade makes 3/3 from the line.
Score: 89-86

[08:35] Team_022 possession (Score: 89-86)
Dejounte Towns drives and kicks out. DeMar Harden attempts a 3Pt. Contested by Blake O'Neal (4.1 feet, ZONE). DeMar Harden misses. Rebound secured by Draymond Smith.

[08:18] Team_005 possession (Score: 89-86)
Blake O'Neal drives, picks up DeMar Harden. Help arrives from Lauri Gobert! Blake O'Neal attempts a Layup. Contested by Lauri Gobert (5.8 feet, MAN). BLAKE O'NEAL MAKES IT! Assist: Lauri Wade
Score: 91-86

[08:01] Team_022 possession (Score: 91-86)
Kawhi Russell drives, picks up Isaiah Durant. Help arrives from Blake O'Neal! Kawhi Russell attempts a Dunk. Contested by Blake O'Neal (4.7 feet, MAN). KAWHI RUSSELL MAKES IT! Assist: Dejounte Towns
Score: 91-88

[07:46] Team_005 possession (Score: 91-88)
FOUL! Reach-in foul on Kawhi Russell during the drive. [Team fouls: 4] No free throws, side out. (Kawhi Russell: 2 personal fouls)

[07:32] Team_005 possession (Score: 91-88)
Isaiah Durant attempts a 3Pt. Contested by Kawhi Russell (4.3 feet, ZONE). Isaiah Durant misses. Rebound secured by Dejounte Towns.

[07:19] Team_022 possession (Score: 91-88)
Lauri Gobert attempts a 3Pt. Contested by Draymond Smith (4.3 feet, MAN). Lauri Gobert misses. Rebound secured by Zion Parker.

[07:03] Team_005 possession (Score: 91-88)
Lauri Wade loses the ball! Stripped by Dejounte Towns! TURNOVER! (live ball)

[06:52] Team_022 possession (Score: 91-88)
Cole Iverson drives, Zion Parker stays with him. Cole Iverson attempts a Layup. Contested by Zion Parker (4.1 feet, ZONE). Cole Iverson misses. Rebound secured by Zion Parker.

[06:35] Team_005 possession (Score: 91-88)
FOUL! Shooting foul on Kawhi Russell. Zion Parker to the line for 2 free throws. [BONUS: 5 team fouls] (Kawhi Russell: 3 personal fouls)   FT 1/2: MISS   FT 2/2: GOOD Zion Parker makes 1/2 from the line.
Score: 92-88

[06:21] Team_022 possession (Score: 92-88)
Kawhi Russell throws a bad pass out of bounds! TURNOVER! (dead ball)

[06:06] Team_005 possession (Score: 92-88)
Blake O'Neal drives to the basket... Blake O'Neal loses the ball! Stripped by Kawhi Russell! TURNOVER! (live ball)

[05:56] Team_022 possession (Score: 92-88)
DeMar Harden attempts a 3Pt. Contested by Blake O'Neal (4.1 feet, MAN). DeMar Harden misses. Offensive rebound by Dejounte Towns! Dejounte Towns kicks it out.

[05:47] Team_022 possession (Score: 92-88)
Lauri Gobert drives and kicks out. Dejounte Towns attempts a 3Pt. Contested by Blake O'Neal (4.1 feet, ZONE). Dejounte Towns misses. Rebound secured by Zion Parker.

[05:28] Team_005 possession (Score: 92-88)
Isaiah Durant drives, Kawhi Russell stays with him. Isaiah Durant attempts a Dunk. Contested by Kawhi Russell (4.3 feet, MAN). ISAIAH DURANT MAKES IT! Assist: Lauri Wade
Score: 94-88

[05:18] Team_022 possession (Score: 94-88)
DeMar Harden attempts a 3Pt. Contested by Blake O'Neal (4.1 feet, ZONE). DeMar Harden misses. Rebound secured by Zion Parker.

[05:04] Team_005 possession (Score: 94-88)
Lauri Wade attempts a Midrange. Contested by Dejounte Towns (4.5 feet, MAN). LAURI WADE MAKES IT! Assist: Blake O'Neal
Score: 96-88

[04:51] Team_022 possession (Score: 96-88)
Cole Iverson attempts a Layup. Contested by Zion Parker (4.1 feet, ZONE). Cole Iverson misses. Offensive rebound by Lauri Gobert! Lauri Gobert kicks it out.

[04:39] Team_022 possession (Score: 96-88)
Dejounte Towns drives and kicks out. Dejounte Towns attempts a Midrange. Contested by Lauri Wade (5.1 feet, ZONE). Dejounte Towns misses. Rebound secured by Zion Parker.

[04:25] Team_005 possession (Score: 96-88)
Zion Parker attempts a Layup. BLOCKED BY KAWHI RUSSELL! Ball is loose! Rebound secured by Dejounte Towns.

[04:05] Team_022 possession (Score: 96-88)
FOUL! Holding foul on Lauri Wade. [Team fouls: 1] No free throws, side out. (Lauri Wade: 1 personal fouls)

[03:49] Team_022 possession (Score: 96-88)
Kawhi Russell attempts a Layup. Contested by Zion Parker (4.4 feet, ZONE). KAWHI RUSSELL MAKES IT! Assist: Dejounte Towns
Score: 96-90

[03:32] Team_005 possession (Score: 96-90)
Lauri Wade drives and kicks out. Zion Parker attempts a 3Pt. Contested by Cole Iverson (5.3 feet, MAN). Zion Parker misses. Rebound secured by Dejounte Towns.

[03:18] Team_022 possession (Score: 96-90)
DeMar Harden attempts a Layup. Contested by Zion Parker (4.2 feet, ZONE). DEMAR HARDEN MAKES IT!
Score: 96-92

[03:01] Team_005 possession (Score: 96-92)
Isaiah Durant attempts a 3Pt. Contested by Kawhi Russell (4.5 feet, MAN). Isaiah Durant misses. Rebound secured by Lauri Gobert.

[02:46] Team_022 possession (Score: 96-92)
FOUL! Holding foul on Lauri Wade. [Team fouls: 2] No free throws, side out. (Lauri Wade: 2 personal fouls)

[02:32] Team_022 possession (Score: 96-92)
Cole Iverson attempts a 3Pt. Contested by Blake O'Neal (4.4 feet, ZONE). Cole Iverson misses. Rebound secured by Lauri Wade.

[02:18] Team_005 possession (Score: 96-92)
Isaiah Durant makes the Layup and draws the foul on Lauri Gobert! And-1! Isaiah Durant to the line for 1. [BONUS: 6 team fouls] (Lauri Gobert: 1 personal fouls)   FT 1/1: GOOD Isaiah Durant makes 1/1 from the line.
Score: 99-92

[02:08] Team_022 possession (Score: 99-92)
DeMar Harden attempts a Midrange. Contested by Blake O'Neal (4.4 feet, MAN). DEMAR HARDEN MAKES IT! Assist: Lauri Gobert
Score: 99-94

[01:54] Team_005 possession (Score: 99-94)
Draymond Smith attempts a 3Pt. Contested by Lauri Gobert (4.5 feet, MAN). Draymond Smith misses. Rebound secured by Lauri Gobert.

[01:42] Team_022 possession (Score: 99-94)
DeMar Harden attempts a 3Pt. Contested by Blake O'Neal (4.5 feet, ZONE). DEMAR HARDEN MAKES IT!
Score: 99-97

[01:27] Team_005 possession (Score: 99-97)
Blake O'Neal attempts a Midrange. Contested by Kawhi Russell (4.8 feet, ZONE). BLAKE O'NEAL MAKES IT! Assist: Zion Parker
Score: 101-97

[01:15] Team_022 possession (Score: 101-97)
Dejounte Towns attempts a 3Pt. Contested by Blake O'Neal (4.6 feet, ZONE). Dejounte Towns misses. Offensive rebound by Lauri Gobert! Lauri Gobert kicks it out.

[00:59] Team_022 possession (Score: 101-97)
Cole Iverson attempts a Layup. BLOCKED BY ZION PARKER! Ball is loose! Rebound secured by Draymond Smith.

[00:44] Team_005 possession (Score: 101-97)
Draymond Smith drives, Lauri Gobert stays with him. Draymond Smith attempts a Layup. Contested by Lauri Gobert (4.7 feet, MAN). Draymond Smith misses. Rebound secured by Dejounte Towns.

[00:29] Team_022 possession (Score: 101-97)
FOUL! Shooting foul on Draymond Smith. Lauri Gobert to the line for 2 free throws. [Team fouls: 3] (Draymond Smith: 1 personal fouls)   FT 1/2: GOOD   FT 2/2: MISS Lauri Gobert makes 1/2 from the line. Rebound secured by Zion Parker.
Score: 101-98

[00:18] Team_005 possession (Score: 101-98)
Blake O'Neal attempts a Midrange. Contested by Lauri Gobert (5.3 feet, ZONE). Blake O'Neal misses. Offensive rebound by Draymond Smith! Draymond Smith kicks it out.

[00:05] Team_005 possession (Score: 101-98)
Draymond Smith drives to the basket... Draymond Smith loses the ball! Stripped by Cole Iverson! TURNOVER! (live ball)

================================================================================
                              4TH QUARTER COMPLETE                              
================================================================================

4TH QUARTER SCORE: Team_005 26, Team_022 21

BOX SCORE:
================================================================================

Team_005
--------------------------------------------------------------------------------
Player                MIN  PTS  REB  AST  TO      FG   FG%      3P   3P%
--------------------------------------------------------------------------------
Blake O'Neal           16   10    0    1   0   4/5    80.0     0/0   0.0
Isaiah Durant          16    5    0    1   0   2/4    50.0     0/0   0.0
Lauri Wade             16    5    1    2   0   2/3    66.7     0/0   0.0
Zion Parker            16    3   10    2   0   2/3    66.7     0/0   0.0
Draymond Smith         16    3    3    0   0   1/3    33.3     0/0   0.0

TEAM: FG: 11/18 (61.1%), 3PT: 5/8 (62.5%), REB: 14 (3 off, 11 def), AST: 6, TO: 4
TEAM FOULS: 3


Team_022
--------------------------------------------------------------------------------
Player                MIN  PTS  REB  AST  TO      FG   FG%      3P   3P%
--------------------------------------------------------------------------------
Kawhi Russell          16    8    0    0   0   4/6    66.7     0/0   0.0
DeMar Harden           16    7    0    0   0   3/4    75.0     0/0   0.0
Lauri Gobert           16    3    5    1   0   1/4    25.0     0/0   0.0
Dejounte Towns         16    2    5    3   0   1/3    33.3     0/0   0.0
Cole Iverson           16    0    0    1   0   0/3     0.0     0/0   0.0

TEAM: FG: 9/20 (45.0%), 3PT: 2/7 (28.6%), REB: 10 (3 off, 7 def), AST: 5, TO: 1
TEAM FOULS: 6 [Team_005 in BONUS]

================================================================================

================================================================================
                               FULL GAME COMPLETE                               
================================================================================

FINAL SCORE: Team_005 101, Team_022 98

SCORING BY QUARTER:
--------------------------------------------------------------------------------
Team                     Q1     Q2     Q3     Q4    FINAL
--------------------------------------------------------------------------------
Team_005                 20     26     29     26      101
Team_022                 29     21     27     21       98
--------------------------------------------------------------------------------

FULL GAME BOX SCORE:
================================================================================

Team_005
--------------------------------------------------------------------------------
Player                MIN  PTS  REB  AST  TO      FG   FG%      3P   3P%      FT STL BLK
--------------------------------------------------------------------------------
Brandon George         32    9    0    3   2   3/8    37.5   2/4    50.0   2/2     0   0
Anthony Rozier         32    4    0    2   4   3/9    33.3   0/5     0.0   2/2     0   1
Derrick Allen          32   16    5    1   3   7/10   70.0   2/4    50.0   6/6     2   0
Jalen Rozier           32   16   15    3   1   5/9    55.6   2/4    50.0   6/6     0   0
Cade Markkanen         32   17   12    0   3   6/9    66.7   0/0     0.0   7/10    0   1
Blake O'Neal           16   10    0    1   2   5/6    83.3   3/3   100.0   0/0     0   0
Draymond Smith         16    3    4    1   0   1/3    33.3   1/2    50.0   1/2     0   0
Lauri Wade             16    8    4    2   1   3/4    75.0   1/1   100.0   4/4     0   0
Isaiah Durant          16    5    0    1   1   2/5    40.0   0/3     0.0   1/1     0   0
Zion Parker            16    8   11    2   1   3/5    60.0   0/0     0.0   2/3     1   1

TEAM: FG: 41/72 (56.9%), 3PT: 11/26 (42.3%), REB: 51 (12 off, 39 def), AST: 16, TO: 18


Team_022
--------------------------------------------------------------------------------
Player                MIN  PTS  REB  AST  TO      FG   FG%      3P   3P%      FT STL BLK
--------------------------------------------------------------------------------
Malcolm Allen          32   16    0    4   2   6/9    66.7   3/4    75.0   3/3     1   0
Michael Ginobili       32   18    9    1   2   6/11   54.5   3/3   100.0   6/7     2   0
Myles Anthony          32   11    6    1   0   4/8    50.0   0/3     0.0   4/4     0   0
Lamelo Dosunmu         32    3    0    4   0   1/9    11.1   1/6    16.7   0/0     0   0
Dirk Markkanen         32   25   12    1   2  10/13   76.9   2/2   100.0   0/0     0   1
DeMar Harden           16    7    0    0   0   3/4    75.0   1/2    50.0   0/0     0   0
Lauri Gobert           16    3    8    2   0   1/6    16.7   1/3    33.3   1/2     0   0
Dejounte Towns         16    2    7    3   1   1/4    25.0   0/0     0.0   0/1     1   0
Kawhi Russell          16    8    1    0   1   4/7    57.1   0/2     0.0   0/0     1   1
Cole Iverson           16    2    0    1   1   1/5    20.0   0/1     0.0   0/0     1   1

TEAM: FG: 39/78 (50.0%), 3PT: 11/26 (42.3%), REB: 42 (11 off, 31 def), AST: 17, TO: 9

================================================================================
