================================================================================
                        FULL GAME - Team_088 vs Team_079                        
================================================================================

================================================================================
                       1ST QUARTER - Team_088 vs Team_079                       
================================================================================

[12:00] Team_088 possession (Score: 0-0)
Giannis Smith drives, Trae Durant stays with him. Giannis Smith attempts a Dunk. Contested by Trae Durant (3.3 feet, MAN). GIANNIS SMITH MAKES IT! Assist: Josh Duncan
Score: 2-0

[11:46] Team_079 possession (Score: 2-0)
Khris Embiid attempts a 3Pt. Contested by Josh Duncan (5.5 feet, MAN). KHRIS EMBIID MAKES IT! Assist: Bam Randle
Score: 2-3

[11:36] Team_088 possession (Score: 2-3)
Josh Duncan attempts a Layup. Contested by Khris Embiid (4.6 feet, MAN). JOSH DUNCAN MAKES IT! Assist: Giannis Smith
Score: 4-3

[11:18] Team_079 possession (Score: 4-3)
FOUL! Reach-in foul on Giannis Smith during the drive. [Team fouls: 1] No free throws, side out. (Giannis Smith: 1 personal fouls)

[11:03] Team_079 possession (Score: 4-3)
Miles Ming attempts a 3Pt. Contested by Tobias Haliburton (5.2 feet, MAN). Miles Ming misses. Rebound secured by Giannis Smith.

[10:50] Team_088 possession (Score: 4-3)
Tyler Hyland attempts a 3Pt. Contested by Bam Randle (4.1 feet, MAN). Tyler Hyland misses. Rebound secured by Bam Randle.

[10:36] Team_079 possession (Score: 4-3)
Donovan Randle attempts a Layup. BLOCKED BY ALLEN MING! Ball is loose! Rebound secured by Giannis Smith.

[10:27] Team_088 possession (Score: 4-3)
FOUL! Shooting foul on Donovan Randle. Allen Ming to the line for 2 free throws. [Team fouls: 1] (Donovan Randle: 1 personal fouls)   FT 1/2: MISS   FT 2/2: GOOD Allen Ming makes 1/2 from the line.
Score: 5-3

[10:10] Team_079 possession (Score: 5-3)
Bam Randle attempts a 3Pt. Contested by Tyler Hyland (4.3 feet, MAN). Bam Randle misses. Offensive rebound by Donovan Randle! Donovan Randle kicks it out.

[09:55] Team_079 possession (Score: 5-3)
Bam Randle attempts a 3Pt. Contested by Tyler Hyland (4.3 feet, MAN). BAM RANDLE MAKES IT! Assist: Khris Embiid
Score: 5-6

[09:42] Team_088 possession (Score: 5-6)
Tyler Hyland drives, Trae Durant stays with him. Tyler Hyland attempts a Layup. Contested by Trae Durant (3.0 feet, ZONE). Tyler Hyland misses. Rebound secured by Donovan Randle.

[09:27] Team_079 possession (Score: 5-6)
Trae Durant attempts a Midrange. Contested by Giannis Smith (3.8 feet, ZONE). Trae Durant misses. Rebound secured by Giannis Smith.

[09:18] Team_088 possession (Score: 5-6)
FOUL! Shooting foul on Trae Durant. Josh Duncan to the line for 3 free throws. [Team fouls: 2] (Trae Durant: 1 personal fouls)   FT 1/3: GOOD   FT 2/3: GOOD   FT 3/3: GOOD Josh Duncan makes 3/3 from the line.
Score: 8-6

[09:08] Team_079 possession (Score: 8-6)
Miles Ming attempts a Midrange. Contested by Tobias Haliburton (5.2 feet, MAN). Miles Ming misses. Offensive rebound by Donovan Randle! Donovan Randle kicks it out.

[08:54] Team_079 possession (Score: 8-6)
Miles Ming attempts a 3Pt. Contested by Tobias Haliburton (5.2 feet, ZONE). Miles Ming misses. Rebound secured by Tyler Hyland.

[08:43] Team_088 possession (Score: 8-6)
FOUL! Shooting foul on Khris Embiid. Josh Duncan to the line for 2 free throws. [Team fouls: 3] (Khris Embiid: 1 personal fouls)   FT 1/2: GOOD   FT 2/2: MISS Josh Duncan makes 1/2 from the line. Offensive rebound by Allen Ming! Allen Ming's putback is no good.
Score: 9-6

[08:32] Team_079 possession (Score: 9-6)
Trae Durant attempts a 3Pt. Contested by Giannis Smith (3.8 feet, MAN). TRAE DURANT MAKES IT! Assist: Bam Randle
Score: 9-9

[08:18] Team_088 possession (Score: 9-9)
Tyler Hyland drives, picks up Trae Durant. Help arrives from Miles Ming! Tyler Hyland attempts a Dunk. Contested by Miles Ming (3.0 feet, ZONE). TYLER HYLAND MAKES IT! Assist: Giannis Smith
Score: 11-9

[08:05] Team_079 possession (Score: 11-9)
Khris Embiid attempts a Midrange. Contested by Josh Duncan (5.5 feet, MAN). Khris Embiid misses. Rebound secured by Giannis Smith.

[07:50] Team_088 possession (Score: 11-9)
Tyler Hyland attempts a 3Pt. Contested by Bam Randle (4.1 feet, MAN). Tyler Hyland misses. Offensive rebound by Allen Ming! Allen Ming puts it back in!
Score: 13-9

[07:38] Team_079 possession (Score: 13-9)
Donovan Randle drives to the basket... Donovan Randle commits a violation (traveling/carry)! TURNOVER! (dead ball)

[07:20] Team_088 possession (Score: 13-9)
Tyler Hyland attempts a 3Pt. Contested by Bam Randle (4.1 feet, MAN). Tyler Hyland misses. Rebound secured by Donovan Randle.

[07:09] Team_079 possession (Score: 13-9)
Khris Embiid attempts a Midrange. Contested by Tobias Haliburton (5.3 feet, ZONE). KHRIS EMBIID MAKES IT! Assist: Donovan Randle
Score: 13-11

[06:58] Team_088 possession (Score: 13-11)
Tyler Hyland makes the Layup and draws the foul on Bam Randle! And-1! Tyler Hyland to the line for 1. [Team fouls: 4] (Bam Randle: 1 personal fouls)   FT 1/1: GOOD Tyler Hyland makes 1/1 from the line.
Score: 16-11

[06:44] Team_079 possession (Score: 16-11)
Khris Embiid attempts a 3Pt. Contested by Tobias Haliburton (5.3 feet, ZONE). Khris Embiid misses. Rebound secured by Allen Ming.

[06:28] Team_088 possession (Score: 16-11)
Tyler Hyland attempts a Midrange. Contested by Bam Randle (4.1 feet, ZONE). Tyler Hyland misses. Rebound secured by Trae Durant.

[06:18] Team_079 possession (Score: 16-11)
Miles Ming attempts a 3Pt. Contested by Tobias Haliburton (5.2 feet, ZONE). Miles Ming misses. Rebound secured by Giannis Smith.

[06:02] Team_088 possession (Score: 16-11)
Tobias Haliburton attempts a Midrange. Contested by Miles Ming (4.1 feet, MAN). Tobias Haliburton misses. Rebound secured by Donovan Randle.

[05:48] Team_079 possession (Score: 16-11)
Khris Embiid attempts a 3Pt. Contested by Tobias Haliburton (5.3 feet, ZONE). Khris Embiid misses. Offensive rebound by Trae Durant! Trae Durant's putback is no good. Rebound secured by Tyler Hyland.

[05:30] Team_088 possession (Score: 16-11)
Josh Duncan attempts a 3Pt. Contested by Trae Durant (3.1 feet, ZONE). Josh Duncan misses. Rebound secured by Donovan Randle.

[05:18] Team_079 possession (Score: 16-11)
Donovan Randle attempts a 3Pt. Contested by Tobias Haliburton (5.2 feet, ZONE). Donovan Randle misses. Offensive rebound by Trae Durant! Trae Durant puts it back in!
Score: 16-13

[05:05] Team_088 possession (Score: 16-13)
FOUL! Shooting foul on Bam Randle. Allen Ming to the line for 2 free throws. [BONUS: 5 team fouls] (Bam Randle: 2 personal fouls)   FT 1/2: GOOD   FT 2/2: GOOD Allen Ming makes 2/2 from the line.
Score: 18-13

[04:51] Team_079 possession (Score: 18-13)
Donovan Randle makes the Layup and draws the foul on Giannis Smith! And-1! Donovan Randle to the line for 1. [Team fouls: 2] (Giannis Smith: 2 personal fouls)   FT 1/1: GOOD Donovan Randle makes 1/1 from the line.
Score: 18-16

[04:38] Team_088 possession (Score: 18-16)
Giannis Smith attempts a Layup. Contested by Trae Durant (3.3 feet, ZONE). Giannis Smith misses. Offensive rebound by Giannis Smith! Giannis Smith's putback is no good. Rebound secured by Trae Durant.

[04:19] Team_079 possession (Score: 18-16)
Khris Embiid attempts a Layup. Contested by Josh Duncan (5.7 feet, MAN). KHRIS EMBIID MAKES IT! Assist: Miles Ming
Score: 18-18

[04:03] Team_088 possession (Score: 18-18)
Tyler Hyland attempts a 3Pt. Contested by Trae Durant (3.0 feet, ZONE). Tyler Hyland misses. Rebound secured by Bam Randle.

[03:46] Team_079 possession (Score: 18-18)
Bam Randle attempts a 3Pt. Contested by Tobias Haliburton (5.0 feet, ZONE). Bam Randle misses. Rebound secured by Allen Ming.

[03:32] Team_088 possession (Score: 18-18)
Giannis Smith drives to the basket... Giannis Smith throws a bad pass out of bounds! TURNOVER! (dead ball)

[03:32] Substitution (Team_088): Josh Duncan OUT → Klay Quickley IN (stamina_rule2)

[03:32] Substitution (Team_088): Giannis Smith OUT → Zion Harris IN (stamina_rule2)

[03:32] Substitution (Team_088): Allen Ming OUT → Josh Embiid IN (stamina_rule2)

[03:32] Substitution (Team_079): Donovan Randle OUT → James LaVine IN (stamina_rule2)

[03:20] Team_079 possession (Score: 18-18)
Bam Randle attempts a 3Pt. Contested by Tobias Haliburton (5.1 feet, ZONE). BAM RANDLE MAKES IT! Assist: Khris Embiid
Score: 18-21

[03:11] Team_088 possession (Score: 18-21)
FOUL! Offensive foul on Tobias Haliburton! Miles Ming drew the charge! [Team fouls: 3] (Tobias Haliburton: 1 personal fouls) TURNOVER! (dead ball)

[02:59] Team_079 possession (Score: 18-21)
Bam Randle attempts a 3Pt. Contested by Tyler Hyland (4.6 feet, MAN). Bam Randle misses. Rebound secured by Zion Harris.

[02:45] Team_088 possession (Score: 18-21)
Tyler Hyland loses the ball! Stripped by Bam Randle! TURNOVER! (live ball)

[02:30] Team_079 possession (Score: 18-21)
James LaVine drives, Josh Embiid stays with him. James LaVine attempts a Dunk. Contested by Josh Embiid (5.3 feet, MAN). JAMES LAVINE MAKES IT!
Score: 18-23

[02:10] Team_088 possession (Score: 18-23)
Josh Embiid attempts a Midrange. Contested by Trae Durant (3.2 feet, ZONE). Josh Embiid misses. Rebound secured by Bam Randle.

[01:52] Team_079 possession (Score: 18-23)
Khris Embiid attempts a 3Pt. Wide open! Klay Quickley is 6.1 feet away. [ZONE] Khris Embiid misses. Rebound secured by Zion Harris.

[01:34] Team_088 possession (Score: 18-23)
Tobias Haliburton drives to the basket... Tobias Haliburton loses control! Ball rolls out of bounds! TURNOVER! (dead ball)

[01:34] Substitution (Team_088): Tobias Haliburton OUT → Vince Carter IN (stamina_rule2)

[01:34] Substitution (Team_088): Tyler Hyland OUT → Pau Bird IN (stamina_rule2)

[01:34] Substitution (Team_079): Khris Embiid OUT → Evan Mobley IN (stamina_rule2)

[01:34] Substitution (Team_079): Miles Ming OUT → Karl Ingram IN (stamina_rule2)

[01:34] Substitution (Team_079): Bam Randle OUT → Anthony Wade IN (stamina_rule2)

[01:34] Substitution (Team_079): Trae Durant OUT → Kobe Curry IN (stamina_rule2)

[01:23] Team_079 possession (Score: 18-23)
Anthony Wade attempts a 3Pt. Contested by Pau Bird (5.1 feet, MAN). Anthony Wade misses. Offensive rebound by James LaVine! James LaVine puts it back in!
Score: 18-25

[01:07] Team_088 possession (Score: 18-25)
Klay Quickley attempts a 3Pt. Contested by Evan Mobley (4.6 feet, MAN). Klay Quickley misses. Rebound secured by Kobe Curry.

[00:57] Team_079 possession (Score: 18-25)
Kobe Curry attempts a Midrange. Contested by Zion Harris (5.9 feet, MAN). KOBE CURRY MAKES IT!
Score: 18-27

[00:40] Team_088 possession (Score: 18-27)
Pau Bird attempts a 3Pt. Wide open! Anthony Wade is 6.3 feet away. [MAN] PAU BIRD MAKES IT! Assist: Josh Embiid
Score: 21-27

[00:24] Team_079 possession (Score: 21-27)
FOUL! Shooting foul on Zion Harris. Anthony Wade to the line for 2 free throws. [Team fouls: 4] (Zion Harris: 1 personal fouls)   FT 1/2: GOOD   FT 2/2: GOOD Anthony Wade makes 2/2 from the line.
Score: 21-29

[00:10] Team_088 possession (Score: 21-29)
FOUL! Holding foul on Karl Ingram. [IN THE BONUS! 6 team fouls] Vince Carter to the line for 2 free throws. (Karl Ingram: 1 personal fouls)   FT 1/2: GOOD   FT 2/2: GOOD Vince Carter makes 2/2 from the line.
Score: 23-29

================================================================================
                              1ST QUARTER COMPLETE                              
================================================================================

1ST QUARTER SCORE: Team_088 23, Team_079 29

BOX SCORE:
================================================================================

Team_088
--------------------------------------------------------------------------------
Player                MIN  PTS  REB  AST  TO      FG   FG%      3P   3P%
--------------------------------------------------------------------------------
Josh Duncan             9    5    0    1   0   2/4    50.0     0/0   0.0
Tyler Hyland           11    5    2    0   0   2/7    28.6     0/0   0.0
Allen Ming              9    5    4    0   0   3/3   100.0     0/0   0.0
Trae Durant            11    5    3    0   0   2/3    66.7     0/0   0.0
Pau Bird                2    3    0    0   0   1/1   100.0     0/0   0.0
Giannis Smith           9    2    5    2   0   1/2    50.0     0/0   0.0
Vince Carter            2    2    0    0   0   1/1   100.0     0/0   0.0
Tobias Haliburton      11    0    0    0   0   0/1     0.0     0/0   0.0
Zion Harris             3    0    2    0   0   0/0     0.0     0/0   0.0
Josh Embiid             3    0    0    1   0   0/1     0.0     0/0   0.0
Klay Quickley           3    0    0    0   0   0/1     0.0     0/0   0.0

TEAM: FG: 10/21 (47.6%), 3PT: 3/8 (37.5%), REB: 12 (2 off, 10 def), AST: 4, TO: 4
TEAM FOULS: 4


Team_079
--------------------------------------------------------------------------------
Player                MIN  PTS  REB  AST  TO      FG   FG%      3P   3P%
--------------------------------------------------------------------------------
Khris Embiid           11    7    0    2   0   3/7    42.9     0/0   0.0
Bam Randle             11    6    3    2   0   2/4    50.0     0/0   0.0
James LaVine            3    4    1    0   0   2/2   100.0     0/0   0.0
Donovan Randle          9    3    6    1   0   1/2    50.0     0/0   0.0
Kobe Curry              2    2    1    0   0   1/1   100.0     0/0   0.0
Anthony Wade            2    2    0    0   0   1/1   100.0     0/0   0.0
Miles Ming             11    0    0    1   0   0/3     0.0     0/0   0.0

TEAM: FG: 12/23 (52.2%), 3PT: 6/14 (42.9%), REB: 15 (5 off, 10 def), AST: 6, TO: 1
TEAM FOULS: 6 [Team_088 in BONUS]

================================================================================

================================================================================
                       2ND QUARTER - Team_088 vs Team_079                       
================================================================================

[12:00] Team_088 possession (Score: 23-29)
Josh Duncan attempts a 3Pt. Contested by Trae Durant (3.2 feet, ZONE). JOSH DUNCAN MAKES IT! Assist: Giannis Smith
Score: 26-29

[11:43] Team_079 possession (Score: 26-29)
Donovan Randle attempts a Midrange. Contested by Allen Ming (4.3 feet, MAN). DONOVAN RANDLE MAKES IT! Assist: Miles Ming
Score: 26-31

[11:26] Team_088 possession (Score: 26-31)
Giannis Smith drives, Trae Durant stays with him. Giannis Smith attempts a Layup. Contested by Trae Durant (3.4 feet, MAN). GIANNIS SMITH MAKES IT! Assist: Allen Ming
Score: 28-31

[11:09] Team_079 possession (Score: 28-31)
FOUL! Shooting foul on Giannis Smith. Trae Durant to the line for 2 free throws. [Team fouls: 1] (Giannis Smith: 1 personal fouls)   FT 1/2: GOOD   FT 2/2: GOOD Trae Durant makes 2/2 from the line.
Score: 28-33

[10:50] Team_088 possession (Score: 28-33)
Tobias Haliburton attempts a Layup. Contested by Miles Ming (4.3 feet, MAN). TOBIAS HALIBURTON MAKES IT! Assist: Tyler Hyland
Score: 30-33

[10:35] Team_079 possession (Score: 30-33)
Khris Embiid attempts a 3Pt. Contested by Tobias Haliburton (5.5 feet, ZONE). Khris Embiid misses. Rebound secured by Allen Ming.

[10:22] Team_088 possession (Score: 30-33)
Allen Ming attempts a 3Pt. Contested by Khris Embiid (4.9 feet, ZONE). Allen Ming misses. Offensive rebound by Allen Ming! Allen Ming's putback is no good. Rebound secured by Trae Durant.

[10:09] Team_079 possession (Score: 30-33)
Bam Randle attempts a Layup. BLOCKED BY GIANNIS SMITH! Ball goes out off Giannis Smith. Bam Randle's ball!

[09:58] Team_079 possession (Score: 30-33)
Miles Ming drives, picks up Tobias Haliburton. Help arrives from Josh Duncan! Miles Ming attempts a Dunk. Contested by Josh Duncan (5.5 feet, MAN). Miles Ming misses. FOUL! Loose ball foul on Tyler Hyland during the rebound battle. [Team fouls: 2] No free throws, side out. (Tyler Hyland: 1 personal fouls)

[09:47] Team_079 possession (Score: 30-33)
Miles Ming attempts a 3Pt. Contested by Tobias Haliburton (5.5 feet, MAN). Miles Ming misses. Rebound secured by Giannis Smith.

[09:36] Team_088 possession (Score: 30-33)
Tobias Haliburton attempts a Layup. Contested by Trae Durant (3.3 feet, ZONE). TOBIAS HALIBURTON MAKES IT! Assist: Allen Ming
Score: 32-33

[09:22] Team_079 possession (Score: 32-33)
FOUL! Offensive foul on Bam Randle! Tyler Hyland drew the charge! [Team fouls: 1] (Bam Randle: 1 personal fouls) TURNOVER! (dead ball)

[09:12] Team_088 possession (Score: 32-33)
Josh Duncan attempts a Midrange. Contested by Bam Randle (4.7 feet, ZONE). Josh Duncan misses. FOUL! Loose ball foul on Donovan Randle during the rebound battle. [Team fouls: 2] No free throws, side out. (Donovan Randle: 1 personal fouls)

[08:55] Team_088 possession (Score: 32-33)
Josh Duncan attempts a Layup. Contested by Khris Embiid (4.9 feet, MAN). JOSH DUNCAN MAKES IT! Assist: Allen Ming
Score: 34-33

[08:39] Team_079 possession (Score: 34-33)
Trae Durant attempts a 3Pt. Contested by Giannis Smith (4.1 feet, MAN). Trae Durant misses. Rebound secured by Tyler Hyland.

[08:25] Team_088 possession (Score: 34-33)
Josh Duncan attempts a Midrange. Contested by Khris Embiid (5.0 feet, MAN). JOSH DUNCAN MAKES IT! Assist: Tobias Haliburton
Score: 36-33

[08:14] Team_079 possession (Score: 36-33)
Bam Randle attempts a Midrange. Contested by Tyler Hyland (4.9 feet, MAN). Bam Randle misses. FOUL! Loose ball foul on Allen Ming during the rebound battle. [Team fouls: 3] No free throws, side out. (Allen Ming: 1 personal fouls)

[08:00] Team_079 possession (Score: 36-33)
FOUL! Shooting foul on Giannis Smith. Donovan Randle to the line for 2 free throws. [Team fouls: 4] (Giannis Smith: 2 personal fouls)   FT 1/2: GOOD   FT 2/2: GOOD Donovan Randle makes 2/2 from the line.
Score: 36-35

[07:46] Team_088 possession (Score: 36-35)
FOUL! Shooting foul on Trae Durant. Giannis Smith to the line for 2 free throws. [Team fouls: 3] (Trae Durant: 1 personal fouls)   FT 1/2: GOOD   FT 2/2: GOOD Giannis Smith makes 2/2 from the line.
Score: 38-35

[07:34] Team_079 possession (Score: 38-35)
Khris Embiid drives to the basket... Khris Embiid commits a violation (traveling/carry)! TURNOVER! (dead ball)

[07:34] Substitution (Team_088): Josh Duncan OUT → Klay Quickley IN (stamina_rule2)

[07:34] Substitution (Team_088): Tobias Haliburton OUT → Vince Carter IN (stamina_rule2)

[07:34] Substitution (Team_088): Tyler Hyland OUT → Pau Bird IN (stamina_rule2)

[07:34] Substitution (Team_088): Giannis Smith OUT → Zion Harris IN (stamina_rule2)

[07:34] Substitution (Team_088): Allen Ming OUT → Josh Embiid IN (stamina_rule2)

[07:34] Substitution (Team_079): Khris Embiid OUT → Evan Mobley IN (stamina_rule2)

[07:34] Substitution (Team_079): Miles Ming OUT → Karl Ingram IN (stamina_rule2)

[07:34] Substitution (Team_079): Bam Randle OUT → Anthony Wade IN (stamina_rule2)

[07:34] Substitution (Team_079): Trae Durant OUT → Kobe Curry IN (stamina_rule2)

[07:34] Substitution (Team_079): Donovan Randle OUT → James LaVine IN (stamina_rule2)

[07:16] Team_088 possession (Score: 38-35)
Josh Embiid drives, James LaVine stays with him. Josh Embiid attempts a Dunk. Contested by James LaVine (4.0 feet, ZONE). Josh Embiid misses. Rebound secured by Kobe Curry.

[07:02] Team_079 possession (Score: 38-35)
Anthony Wade makes the Layup and draws the foul on Klay Quickley! And-1! Anthony Wade to the line for 1. [BONUS: 5 team fouls] (Klay Quickley: 1 personal fouls)   FT 1/1: GOOD Anthony Wade makes 1/1 from the line.
Score: 38-38

[06:48] Team_088 possession (Score: 38-38)
Josh Embiid drives to the basket... Josh Embiid throws a bad pass out of bounds! TURNOVER! (dead ball)

[06:32] Team_079 possession (Score: 38-38)
FOUL! Offensive foul on Karl Ingram! Vince Carter drew the charge! [Team fouls: 4] (Karl Ingram: 1 personal fouls) TURNOVER! (dead ball)

[06:17] Team_088 possession (Score: 38-38)
Klay Quickley attempts a 3Pt. Contested by Evan Mobley (4.6 feet, MAN). Klay Quickley misses. Rebound secured by Anthony Wade.

[05:59] Team_079 possession (Score: 38-38)
Anthony Wade attempts a Layup. Contested by Zion Harris (5.9 feet, ZONE). ANTHONY WADE MAKES IT! Assist: Karl Ingram
Score: 38-40

[05:48] Team_088 possession (Score: 38-40)
Zion Harris drives to the basket... FOUL! Offensive foul on Zion Harris! James LaVine drew the charge! [Team fouls: 6] (Zion Harris: 1 personal fouls) TURNOVER! (dead ball)

[05:34] Team_079 possession (Score: 38-40)
Anthony Wade attempts a 3Pt. Contested by Pau Bird (5.1 feet, MAN). Anthony Wade misses. Rebound secured by Pau Bird.

[05:19] Team_088 possession (Score: 38-40)
Vince Carter drives and kicks out. Josh Embiid attempts a 3Pt. Contested by James LaVine (4.2 feet, MAN). Josh Embiid misses. Rebound secured by Anthony Wade.

[05:04] Team_079 possession (Score: 38-40)
James LaVine drives and kicks out. Kobe Curry attempts a Midrange. Contested by Pau Bird (5.0 feet, ZONE). Kobe Curry misses. Rebound secured by Josh Embiid.

[04:52] Team_088 possession (Score: 38-40)
Pau Bird attempts a Midrange. Contested by Karl Ingram (5.6 feet, ZONE). PAU BIRD MAKES IT!
Score: 40-40

[04:35] Team_079 possession (Score: 40-40)
James LaVine drives, picks up Josh Embiid. Help arrives from Klay Quickley! James LaVine attempts a Layup. Contested by Klay Quickley (5.3 feet, MAN). JAMES LAVINE MAKES IT! Assist: Kobe Curry
Score: 40-42

[04:18] Team_088 possession (Score: 40-42)
FOUL! Reach-in foul on James LaVine during the drive. [IN THE BONUS! 5 team fouls] Zion Harris to the line for 2 free throws. (James LaVine: 1 personal fouls)   FT 1/2: GOOD   FT 2/2: MISS Zion Harris makes 1/2 from the line. Rebound secured by Anthony Wade.
Score: 41-42

[04:01] Team_079 possession (Score: 41-42)
James LaVine attempts a Midrange. Contested by Pau Bird (5.1 feet, ZONE). James LaVine misses. Rebound secured by Josh Embiid.

[03:47] Team_088 possession (Score: 41-42)
Zion Harris attempts a 3Pt. Contested by Evan Mobley (5.0 feet, ZONE). Zion Harris misses. Rebound secured by Kobe Curry.

[03:32] Team_079 possession (Score: 41-42)
Anthony Wade drives, Zion Harris stays with him. Anthony Wade attempts a Dunk. Contested by Zion Harris (5.9 feet, ZONE). ANTHONY WADE MAKES IT!
Score: 41-44

[03:14] Team_088 possession (Score: 41-44)
Zion Harris drives, picks up James LaVine. Help arrives from Karl Ingram! Zion Harris attempts a Layup. Contested by Karl Ingram (4.7 feet, ZONE). ZION HARRIS MAKES IT! Assist: Pau Bird
Score: 43-44

[03:01] Team_079 possession (Score: 43-44)
Karl Ingram attempts a 3Pt. Contested by Pau Bird (5.1 feet, ZONE). Karl Ingram misses. Rebound secured by Zion Harris.

[02:43] Team_088 possession (Score: 43-44)
Pau Bird attempts a Midrange. Contested by Kobe Curry (4.8 feet, ZONE). Pau Bird misses. Offensive rebound by Pau Bird! Pau Bird kicks it out.

[02:26] Team_088 possession (Score: 43-44)
Vince Carter attempts a 3Pt. Contested by Karl Ingram (5.1 feet, MAN). Vince Carter misses. Offensive rebound by Pau Bird! Pau Bird kicks it out.

[02:16] Team_088 possession (Score: 43-44)
Josh Embiid drives, picks up James LaVine. Help arrives from Karl Ingram! Josh Embiid attempts a Layup. Contested by Karl Ingram (4.1 feet, ZONE). Josh Embiid misses. Rebound secured by Kobe Curry.

[02:04] Team_079 possession (Score: 43-44)
James LaVine attempts a 3Pt. Contested by Josh Embiid (5.4 feet, MAN). James LaVine misses. Rebound secured by Josh Embiid.

[01:47] Team_088 possession (Score: 43-44)
FOUL! Holding foul on James LaVine. [IN THE BONUS! 6 team fouls] Josh Embiid to the line for 2 free throws. (James LaVine: 2 personal fouls)   FT 1/2: GOOD   FT 2/2: GOOD Josh Embiid makes 2/2 from the line.
Score: 45-44

[01:32] Team_079 possession (Score: 45-44)
Anthony Wade attempts a Layup. BLOCKED BY PAU BIRD! Ball is loose! Rebound secured by Pau Bird.

[01:21] Team_088 possession (Score: 45-44)
Pau Bird attempts a 3Pt. Contested by Karl Ingram (5.6 feet, ZONE). Pau Bird misses. Rebound secured by Kobe Curry.

[01:09] Team_079 possession (Score: 45-44)
Karl Ingram makes the Layup and draws the foul on Zion Harris! And-1! Karl Ingram to the line for 1. [BONUS: 7 team fouls] (Zion Harris: 2 personal fouls)   FT 1/1: GOOD Karl Ingram makes 1/1 from the line.
Score: 45-47

[00:56] Team_088 possession (Score: 45-47)
FOUL! Shooting foul on Karl Ingram. Vince Carter to the line for 3 free throws. [BONUS: 7 team fouls] (Karl Ingram: 2 personal fouls)   FT 1/3: GOOD   FT 2/3: GOOD   FT 3/3: GOOD Vince Carter makes 3/3 from the line.
Score: 48-47

[00:42] Team_079 possession (Score: 48-47)
Anthony Wade attempts a 3Pt. Contested by Pau Bird (5.2 feet, ZONE). Anthony Wade misses. Rebound secured by Zion Harris.

[00:27] Team_088 possession (Score: 48-47)
Vince Carter drives to the basket... Vince Carter loses control! Ball rolls out of bounds! TURNOVER! (dead ball)

[00:13] Team_079 possession (Score: 48-47)
Kobe Curry throws a bad pass! Stolen by Zion Harris! TURNOVER! (live ball)

================================================================================
                              2ND QUARTER COMPLETE                              
================================================================================

2ND QUARTER SCORE: Team_088 25, Team_079 18

BOX SCORE:
================================================================================

Team_088
--------------------------------------------------------------------------------
Player                MIN  PTS  REB  AST  TO      FG   FG%      3P   3P%
--------------------------------------------------------------------------------
Josh Duncan            13    7    0    0   0   3/3   100.0     0/0   0.0
Giannis Smith          13    4    2    1   0   2/2   100.0     0/0   0.0
Tobias Haliburton      15    4    0    1   0   2/2   100.0     0/0   0.0
Vince Carter            9    3    0    0   0   1/2    50.0     0/0   0.0
Josh Embiid            11    2    3    0   0   1/3    33.3     0/0   0.0
Pau Bird                9    2    4    1   0   1/2    50.0     0/0   0.0
Zion Harris            11    2    2    0   0   1/3    33.3     0/0   0.0
Allen Ming             13    0    1    3   0   0/1     0.0     0/0   0.0
Tyler Hyland           15    0    1    1   0   0/0     0.0     0/0   0.0
Klay Quickley          11    0    0    0   0   0/1     0.0     0/0   0.0

TEAM: FG: 11/19 (57.9%), 3PT: 2/6 (33.3%), REB: 14 (4 off, 10 def), AST: 7, TO: 3
TEAM FOULS: 7 [Team_079 in BONUS]


Team_079
--------------------------------------------------------------------------------
Player                MIN  PTS  REB  AST  TO      FG   FG%      3P   3P%
--------------------------------------------------------------------------------
Anthony Wade            9    7    3    0   0   3/6    50.0     0/0   0.0
Donovan Randle         13    4    1    0   0   2/2   100.0     0/0   0.0
Karl Ingram             9    3    0    1   0   1/2    50.0     0/0   0.0
Trae Durant            15    2    2    0   0   1/2    50.0     0/0   0.0
James LaVine           11    2    0    0   0   1/4    25.0     0/0   0.0
Miles Ming             15    0    0    1   0   0/1     0.0     0/0   0.0
Khris Embiid           15    0    0    0   0   0/1     0.0     0/0   0.0
Kobe Curry              9    0    4    1   0   0/0     0.0     0/0   0.0

TEAM: FG: 8/18 (44.4%), 3PT: 0/7 (0.0%), REB: 9 (2 off, 7 def), AST: 3, TO: 4
TEAM FOULS: 7 [Team_088 in BONUS]

================================================================================

================================================================================
                       3RD QUARTER - Team_088 vs Team_079                       
================================================================================

[12:00] Team_088 possession (Score: 48-47)
Josh Duncan throws a bad pass out of bounds! TURNOVER! (dead ball)

[11:43] Team_079 possession (Score: 48-47)
Bam Randle drives and kicks out. Donovan Randle attempts a 3Pt. Contested by Tobias Haliburton (5.0 feet, ZONE). Donovan Randle misses. Rebound secured by Giannis Smith.

[11:27] Team_088 possession (Score: 48-47)
FOUL! Shooting foul on Bam Randle. Tyler Hyland to the line for 2 free throws. [Team fouls: 1] (Bam Randle: 1 personal fouls)   FT 1/2: GOOD   FT 2/2: GOOD Tyler Hyland makes 2/2 from the line.
Score: 50-47

[11:14] Team_079 possession (Score: 50-47)
Miles Ming drives and kicks out. FOUL! Shooting foul on Giannis Smith. Donovan Randle to the line for 2 free throws. [Team fouls: 1] (Giannis Smith: 1 personal fouls)   FT 1/2: MISS   FT 2/2: GOOD Donovan Randle makes 1/2 from the line.
Score: 50-48

[11:03] Team_088 possession (Score: 50-48)
Giannis Smith throws a bad pass! Stolen by Trae Durant! TURNOVER! (live ball)

[10:50] Team_079 possession (Score: 50-48)
FOUL! Holding foul on Tyler Hyland. [Team fouls: 2] No free throws, side out. (Tyler Hyland: 1 personal fouls)

[10:33] Team_079 possession (Score: 50-48)
Miles Ming drives to the basket... Miles Ming loses the ball! Stripped by Giannis Smith! TURNOVER! (live ball)

[10:20] Team_088 possession (Score: 50-48)
Allen Ming attempts a Layup. Contested by Donovan Randle (4.4 feet, MAN). ALLEN MING MAKES IT!
Score: 52-48

[10:02] Team_079 possession (Score: 52-48)
FOUL! Shooting foul on Josh Duncan. Donovan Randle to the line for 2 free throws. [Team fouls: 3] (Josh Duncan: 1 personal fouls)   FT 1/2: GOOD   FT 2/2: GOOD Donovan Randle makes 2/2 from the line.
Score: 52-50

[09:47] Team_088 possession (Score: 52-50)
Giannis Smith drives, picks up Trae Durant. Help arrives from Miles Ming! Giannis Smith attempts a Dunk. Contested by Miles Ming (3.3 feet, MAN). GIANNIS SMITH MAKES IT! Assist: Tobias Haliburton
Score: 54-50

[09:35] Team_079 possession (Score: 54-50)
Bam Randle attempts a 3Pt. Contested by Tobias Haliburton (4.9 feet, ZONE). Bam Randle misses. Offensive rebound by Donovan Randle! Donovan Randle kicks it out.

[09:17] Team_079 possession (Score: 54-50)
FOUL! Shooting foul on Tobias Haliburton. Trae Durant to the line for 2 free throws. [Team fouls: 4] (Tobias Haliburton: 1 personal fouls)   FT 1/2: GOOD   FT 2/2: GOOD Trae Durant makes 2/2 from the line.
Score: 54-52

[09:03] Team_088 possession (Score: 54-52)
Josh Duncan attempts a Midrange. Contested by Donovan Randle (4.2 feet, ZONE). Josh Duncan misses. Offensive rebound by Giannis Smith! Giannis Smith's putback is no good. Rebound secured by Trae Durant.

[08:52] Team_079 possession (Score: 54-52)
Miles Ming attempts a Midrange. Contested by Tobias Haliburton (5.2 feet, ZONE). Miles Ming misses. Rebound secured by Allen Ming.

[08:39] Team_088 possession (Score: 54-52)
FOUL! Shooting foul on Trae Durant. Tobias Haliburton to the line for 2 free throws. [Team fouls: 2] (Trae Durant: 1 personal fouls)   FT 1/2: GOOD   FT 2/2: GOOD Tobias Haliburton makes 2/2 from the line.
Score: 56-52

[08:25] Team_079 possession (Score: 56-52)
Trae Durant drives, Giannis Smith stays with him. Trae Durant attempts a Dunk. Contested by Giannis Smith (3.8 feet, MAN). TRAE DURANT MAKES IT! Assist: Khris Embiid
Score: 56-54

[08:07] Team_088 possession (Score: 56-54)
Josh Duncan drives, picks up Khris Embiid. Help arrives from Miles Ming! Josh Duncan attempts a Dunk. Contested by Miles Ming (4.6 feet, MAN). Josh Duncan misses. Offensive rebound by Giannis Smith! Giannis Smith's putback is no good. Rebound secured by Donovan Randle.

[07:51] Team_079 possession (Score: 56-54)
Bam Randle attempts a 3Pt. Contested by Tobias Haliburton (4.9 feet, ZONE). BAM RANDLE MAKES IT! Assist: Donovan Randle
Score: 56-57

[07:38] Team_088 possession (Score: 56-57)
Giannis Smith attempts a Midrange. Contested by Miles Ming (4.3 feet, ZONE). Giannis Smith misses. Rebound secured by Trae Durant.

[07:22] Team_079 possession (Score: 56-57)
Khris Embiid attempts a 3Pt. Contested by Josh Duncan (5.5 feet, MAN). KHRIS EMBIID MAKES IT! Assist: Bam Randle
Score: 56-60

[07:03] Team_088 possession (Score: 56-60)
Tyler Hyland attempts a 3Pt. Contested by Bam Randle (4.1 feet, MAN). Tyler Hyland misses. Rebound secured by Trae Durant.

[06:44] Team_079 possession (Score: 56-60)
Bam Randle attempts a 3Pt. Contested by Tyler Hyland (4.3 feet, MAN). Bam Randle misses. Rebound secured by Tyler Hyland.

[06:32] Team_088 possession (Score: 56-60)
Tyler Hyland attempts a 3Pt. Contested by Bam Randle (4.1 feet, MAN). Tyler Hyland misses. Rebound secured by Bam Randle.

[06:18] Team_079 possession (Score: 56-60)
FOUL! Shooting foul on Giannis Smith. Bam Randle to the line for 2 free throws. [BONUS: 5 team fouls] (Giannis Smith: 2 personal fouls)   FT 1/2: GOOD   FT 2/2: GOOD Bam Randle makes 2/2 from the line.
Score: 56-62

[06:07] Team_088 possession (Score: 56-62)
FOUL! Reach-in foul on Miles Ming during the drive. [Team fouls: 3] No free throws, side out. (Miles Ming: 1 personal fouls)

[05:52] Team_088 possession (Score: 56-62)
FOUL! Offensive foul on Giannis Smith! Trae Durant drew the charge! [Team fouls: 6] (Giannis Smith: 3 personal fouls) TURNOVER! (dead ball)

[05:37] Team_079 possession (Score: 56-62)
Bam Randle drives, picks up Giannis Smith. Help arrives from Tobias Haliburton! Bam Randle attempts a Layup. Contested by Tobias Haliburton (3.8 feet, ZONE). BAM RANDLE MAKES IT! Assist: Donovan Randle
Score: 56-64

[05:20] Team_088 possession (Score: 56-64)
Josh Duncan drives to the basket... FOUL! Offensive foul on Josh Duncan! Trae Durant drew the charge! [Team fouls: 7] (Josh Duncan: 2 personal fouls) TURNOVER! (dead ball)

[05:03] Team_079 possession (Score: 56-64)
Donovan Randle attempts a Midrange. Contested by Allen Ming (4.4 feet, MAN). DONOVAN RANDLE MAKES IT!
Score: 56-66

[04:49] Team_088 possession (Score: 56-66)
Josh Duncan attempts a Layup. Contested by Trae Durant (3.1 feet, ZONE). Josh Duncan misses. Rebound secured by Bam Randle.

[04:31] Team_079 possession (Score: 56-66)
Miles Ming drives and kicks out. Khris Embiid attempts a Midrange. Contested by Josh Duncan (5.3 feet, MAN). KHRIS EMBIID MAKES IT!
Score: 56-68

[04:17] Team_088 possession (Score: 56-68)
Josh Duncan attempts a Midrange. Contested by Khris Embiid (4.6 feet, MAN). JOSH DUNCAN MAKES IT!
Score: 58-68

[04:05] Team_079 possession (Score: 58-68)
Trae Durant drives, picks up Giannis Smith. Help arrives from Tobias Haliburton! Trae Durant attempts a Dunk. Contested by Tobias Haliburton (4.0 feet, MAN). TRAE DURANT MAKES IT! Assist: Khris Embiid
Score: 58-70

[03:54] Team_088 possession (Score: 58-70)
Tobias Haliburton attempts a Layup. BLOCKED BY MILES MING! Ball is loose! Rebound secured by Donovan Randle.

[03:37] Team_079 possession (Score: 58-70)
FOUL! Holding foul on Allen Ming. [IN THE BONUS! 8 team fouls] Donovan Randle to the line for 2 free throws. (Allen Ming: 1 personal fouls)   FT 1/2: GOOD   FT 2/2: GOOD Donovan Randle makes 2/2 from the line.
Score: 58-72

[03:26] Team_088 possession (Score: 58-72)
Allen Ming attempts a 3Pt. Contested by Donovan Randle (4.6 feet, MAN). ALLEN MING MAKES IT! Assist: Josh Duncan
Score: 61-72

[03:14] Team_079 possession (Score: 61-72)
Trae Durant drives to the basket... Trae Durant throws a bad pass! Stolen by Giannis Smith! TURNOVER! (live ball)

[03:04] Team_088 possession (Score: 61-72)
Josh Duncan attempts a Layup. Contested by Trae Durant (3.2 feet, ZONE). Josh Duncan misses. Offensive rebound by Giannis Smith! Giannis Smith puts it back in!
Score: 63-72

[02:49] Team_079 possession (Score: 63-72)
Miles Ming drives, Giannis Smith stays with him. Miles Ming attempts a Dunk. Contested by Giannis Smith (4.5 feet, ZONE). MILES MING MAKES IT! Assist: Donovan Randle
Score: 63-74

[02:31] Team_088 possession (Score: 63-74)
Tyler Hyland attempts a 3Pt. Contested by Trae Durant (3.1 feet, ZONE). Tyler Hyland misses. Offensive rebound by Allen Ming! Allen Ming's putback is no good. Rebound secured by Donovan Randle.

[02:16] Team_079 possession (Score: 63-74)
Trae Durant attempts a Midrange. Contested by Giannis Smith (4.2 feet, MAN). TRAE DURANT MAKES IT!
Score: 63-76

[02:00] Team_088 possession (Score: 63-76)
Tobias Haliburton commits a violation (traveling/carry)! TURNOVER! (dead ball)

[02:00] Substitution (Team_088): Josh Duncan OUT → Klay Quickley IN (stamina_rule2)

[02:00] Substitution (Team_088): Tobias Haliburton OUT → Vince Carter IN (stamina_rule2)

[02:00] Substitution (Team_088): Tyler Hyland OUT → Pau Bird IN (stamina_rule2)

[02:00] Substitution (Team_088): Giannis Smith OUT → Zion Harris IN (stamina_rule2)

[02:00] Substitution (Team_088): Allen Ming OUT → Josh Embiid IN (stamina_rule2)

[02:00] Substitution (Team_079): Khris Embiid OUT → Evan Mobley IN (stamina_rule2)

[02:00] Substitution (Team_079): Miles Ming OUT → Karl Ingram IN (stamina_rule2)

[02:00] Substitution (Team_079): Bam Randle OUT → Anthony Wade IN (stamina_rule2)

[02:00] Substitution (Team_079): Donovan Randle OUT → James LaVine IN (stamina_rule2)

[01:48] Team_079 possession (Score: 63-76)
FOUL! Holding foul on Vince Carter. [IN THE BONUS! 9 team fouls] Karl Ingram to the line for 2 free throws. (Vince Carter: 1 personal fouls)   FT 1/2: GOOD   FT 2/2: GOOD Karl Ingram makes 2/2 from the line.
Score: 63-78

[01:35] Team_088 possession (Score: 63-78)
FOUL! Reach-in foul on Trae Durant during the drive. [Team fouls: 4] No free throws, side out. (Trae Durant: 2 personal fouls)

[01:21] Team_088 possession (Score: 63-78)
Klay Quickley attempts a 3Pt. Contested by Evan Mobley (4.6 feet, MAN). Klay Quickley misses. Rebound secured by Trae Durant.

[01:03] Team_079 possession (Score: 63-78)
Karl Ingram drives, picks up Zion Harris. Help arrives from Klay Quickley! Karl Ingram attempts a Dunk. Contested by Klay Quickley (5.9 feet, ZONE). KARL INGRAM MAKES IT! Assist: James LaVine
Score: 63-80

[00:46] Team_088 possession (Score: 63-80)
Klay Quickley attempts a Midrange. Wide open! Anthony Wade is 6.1 feet away. [ZONE] Klay Quickley misses. Offensive rebound by Pau Bird! Pau Bird kicks it out.

[00:34] Team_088 possession (Score: 63-80)
Vince Carter makes the Dunk and draws the foul on Karl Ingram! And-1! Vince Carter to the line for 1. [BONUS: 5 team fouls] (Karl Ingram: 1 personal fouls)   FT 1/1: GOOD Vince Carter makes 1/1 from the line.
Score: 66-80

[00:20] Team_079 possession (Score: 66-80)
Karl Ingram attempts a 3Pt. Contested by Pau Bird (5.1 feet, ZONE). Karl Ingram misses. Rebound secured by Zion Harris.

[00:05] Team_088 possession (Score: 66-80)
Zion Harris drives, Trae Durant stays with him. Zion Harris attempts a Dunk. Contested by Trae Durant (4.1 feet, MAN). ZION HARRIS MAKES IT! Assist: Vince Carter
Score: 68-80

================================================================================
                              3RD QUARTER COMPLETE                              
================================================================================

3RD QUARTER SCORE: Team_088 20, Team_079 33

BOX SCORE:
================================================================================

Team_088
--------------------------------------------------------------------------------
Player                MIN  PTS  REB  AST  TO      FG   FG%      3P   3P%
--------------------------------------------------------------------------------
Donovan Randle         24    7    4    3   0   4/4   100.0     0/0   0.0
Allen Ming             24    5    1    0   0   2/2   100.0     0/0   0.0
Giannis Smith          24    4    2    0   0   2/3    66.7     0/0   0.0
Vince Carter           11    3    0    1   0   1/1   100.0     0/0   0.0
Tyler Hyland           26    2    1    0   0   1/4    25.0     0/0   0.0
Tobias Haliburton      26    2    0    1   0   1/2    50.0     0/0   0.0
Josh Duncan            24    2    0    1   0   1/4    25.0     0/0   0.0
Zion Harris            13    2    1    0   0   1/1   100.0     0/0   0.0
Klay Quickley          13    0    0    0   0   0/1     0.0     0/0   0.0
Pau Bird               11    0    1    0   0   0/0     0.0     0/0   0.0

TEAM: FG: 9/18 (50.0%), 3PT: 1/5 (20.0%), REB: 9 (5 off, 4 def), AST: 3, TO: 5
TEAM FOULS: 9 [Team_079 in BONUS]


Team_079
--------------------------------------------------------------------------------
Player                MIN  PTS  REB  AST  TO      FG   FG%      3P   3P%
--------------------------------------------------------------------------------
Trae Durant            28    8    4    0   0   4/4   100.0     0/0   0.0
Bam Randle             26    7    2    1   0   3/5    60.0     0/0   0.0
Khris Embiid           26    5    0    2   0   2/2   100.0     0/0   0.0
Karl Ingram            11    4    0    0   0   2/3    66.7     0/0   0.0
Miles Ming             26    2    0    0   0   1/2    50.0     0/0   0.0
James LaVine           13    0    0    1   0   0/0     0.0     0/0   0.0

TEAM: FG: 16/20 (80.0%), 3PT: 2/4 (50.0%), REB: 7 (1 off, 6 def), AST: 7, TO: 2
TEAM FOULS: 5 [Team_088 in BONUS]

================================================================================

================================================================================
                       4TH QUARTER - Team_088 vs Team_079                       
================================================================================

[12:00] Substitution (Team_088): Josh Duncan OUT (stamina: 76) → Klay Quickley IN (comeback_detected)

[12:00] Substitution (Team_079): Khris Embiid OUT (stamina: 79) → Evan Mobley IN (comeback_detected)

[12:00] Team_088 possession (Score: 68-80)
Tyler Hyland attempts a 3Pt. Contested by Bam Randle (4.2 feet, MAN). Tyler Hyland misses. Offensive rebound by Allen Ming! Allen Ming puts it back in!
Score: 70-80

[11:51] Team_079 possession (Score: 70-80)
Bam Randle attempts a 3Pt. Contested by Tobias Haliburton (4.9 feet, ZONE). Bam Randle misses. Offensive rebound by Trae Durant! Trae Durant kicks it out.

[11:40] Team_079 possession (Score: 70-80)
Donovan Randle drives, picks up Allen Ming. Help arrives from Tobias Haliburton! Donovan Randle attempts a Dunk. Contested by Tobias Haliburton (4.5 feet, MAN). DONOVAN RANDLE MAKES IT! Assist: Trae Durant
Score: 70-82

[11:25] Team_088 possession (Score: 70-82)
Giannis Smith attempts a Midrange. Contested by Trae Durant (3.6 feet, MAN). Giannis Smith misses. Rebound secured by Donovan Randle.

[11:11] Team_079 possession (Score: 70-82)
Bam Randle drives and kicks out. Bam Randle attempts a 3Pt. Contested by Tobias Haliburton (5.1 feet, ZONE). BAM RANDLE MAKES IT! Assist: Trae Durant
Score: 70-85

[10:52] Team_088 possession (Score: 70-85)
Tyler Hyland attempts a 3Pt. Contested by Bam Randle (4.2 feet, MAN). TYLER HYLAND MAKES IT! Assist: Klay Quickley
Score: 73-85

[10:38] Team_079 possession (Score: 73-85)
Miles Ming drives and kicks out. Bam Randle attempts a Midrange. Contested by Tyler Hyland (4.7 feet, MAN). Bam Randle misses. Rebound secured by Tyler Hyland.

[10:20] Team_088 possession (Score: 73-85)
Tyler Hyland attempts a 3Pt. Contested by Bam Randle (4.3 feet, MAN). Tyler Hyland misses. Rebound secured by Trae Durant.

[10:08] Team_079 possession (Score: 73-85)
Evan Mobley attempts a Layup. Contested by Giannis Smith (4.8 feet, ZONE). Evan Mobley misses. Rebound secured by Tyler Hyland.

[09:52] Team_088 possession (Score: 73-85)
Tyler Hyland attempts a 3Pt. Contested by Miles Ming (4.2 feet, ZONE). Tyler Hyland misses. Rebound secured by Donovan Randle.

[09:42] Team_079 possession (Score: 73-85)
FOUL! Reach-in foul on Tobias Haliburton during the drive. [Team fouls: 1] No free throws, side out. (Tobias Haliburton: 1 personal fouls)

[09:26] Team_079 possession (Score: 73-85)
FOUL! Reach-in foul on Giannis Smith during the drive. [Team fouls: 2] No free throws, side out. (Giannis Smith: 1 personal fouls)

[09:13] Team_079 possession (Score: 73-85)
Miles Ming attempts a 3Pt. Contested by Tobias Haliburton (5.5 feet, MAN). Miles Ming misses. Rebound secured by Allen Ming.

[09:00] Team_088 possession (Score: 73-85)
Allen Ming drives, picks up Donovan Randle. Help arrives from Miles Ming! Allen Ming attempts a Dunk. Contested by Miles Ming (4.7 feet, MAN). Allen Ming misses. Offensive rebound by Giannis Smith! Giannis Smith kicks it out.

[08:50] Team_088 possession (Score: 73-85)
Tobias Haliburton attempts a 3Pt. Contested by Miles Ming (4.5 feet, ZONE). Tobias Haliburton misses. Offensive rebound by Allen Ming! Allen Ming puts it back in!
Score: 75-85

[08:34] Team_079 possession (Score: 75-85)
FOUL! Holding foul on Allen Ming. [Team fouls: 3] No free throws, side out. (Allen Ming: 1 personal fouls)

[08:19] Team_079 possession (Score: 75-85)
FOUL! Holding foul on Giannis Smith. [Team fouls: 4] No free throws, side out. (Giannis Smith: 2 personal fouls)

[08:05] Team_079 possession (Score: 75-85)
Bam Randle attempts a 3Pt. Contested by Tyler Hyland (4.8 feet, MAN). BAM RANDLE MAKES IT! Assist: Miles Ming
Score: 75-88

[07:49] Team_088 possession (Score: 75-88)
FOUL! Reach-in foul on Trae Durant during the drive. [Team fouls: 1] No free throws, side out. (Trae Durant: 1 personal fouls)

[07:36] Team_088 possession (Score: 75-88)
Allen Ming attempts a Midrange. Contested by Donovan Randle (4.9 feet, MAN). ALLEN MING MAKES IT!
Score: 77-88

[07:19] Team_079 possession (Score: 77-88)
Bam Randle drives to the basket... Bam Randle loses control! Ball rolls out of bounds! TURNOVER! (dead ball)

[07:19] Substitution (Team_088): Tobias Haliburton OUT → Vince Carter IN (stamina_rule2)

[07:19] Substitution (Team_088): Tyler Hyland OUT → Pau Bird IN (stamina_rule2)

[07:19] Substitution (Team_088): Giannis Smith OUT → Zion Harris IN (stamina_rule2)

[07:19] Substitution (Team_088): Allen Ming OUT → Josh Embiid IN (stamina_rule2)

[07:19] Substitution (Team_079): Miles Ming OUT → Karl Ingram IN (stamina_rule2)

[07:19] Substitution (Team_079): Bam Randle OUT → Anthony Wade IN (stamina_rule2)

[07:19] Substitution (Team_079): Trae Durant OUT → Kobe Curry IN (stamina_rule2)

[07:19] Substitution (Team_079): Donovan Randle OUT → James LaVine IN (stamina_rule2)

[07:06] Team_088 possession (Score: 77-88)
Vince Carter attempts a Layup. BLOCKED BY ANTHONY WADE! Ball is loose! Rebound secured by Anthony Wade.

[06:51] Team_079 possession (Score: 77-88)
Karl Ingram attempts a 3Pt. Contested by Vince Carter (4.9 feet, MAN). Karl Ingram misses. Offensive rebound by James LaVine! James LaVine puts it back in!
Score: 77-90

[06:40] Team_088 possession (Score: 77-90)
Josh Embiid attempts a Midrange. Contested by Karl Ingram (5.2 feet, ZONE). JOSH EMBIID MAKES IT!
Score: 79-90

[06:22] Team_079 possession (Score: 79-90)
FOUL! Shooting foul on Pau Bird. Anthony Wade to the line for 2 free throws. [BONUS: 5 team fouls] (Pau Bird: 1 personal fouls)   FT 1/2: GOOD   FT 2/2: GOOD Anthony Wade makes 2/2 from the line.
Score: 79-92

[06:10] Team_088 possession (Score: 79-92)
Vince Carter attempts a 3Pt. Contested by Karl Ingram (5.1 feet, ZONE). Vince Carter misses. Rebound secured by James LaVine.

[05:57] Team_079 possession (Score: 79-92)
FOUL! Reach-in foul on Zion Harris during the drive. [IN THE BONUS! 6 team fouls] James LaVine to the line for 2 free throws. (Zion Harris: 1 personal fouls)   FT 1/2: GOOD   FT 2/2: GOOD James LaVine makes 2/2 from the line.
Score: 79-94

[05:42] Team_088 possession (Score: 79-94)
Zion Harris drives to the basket... FOUL! Offensive foul on Zion Harris! James LaVine drew the charge! [Team fouls: 7] (Zion Harris: 2 personal fouls) TURNOVER! (dead ball)

[05:29] Team_079 possession (Score: 79-94)
Anthony Wade attempts a Midrange. Contested by Pau Bird (5.1 feet, MAN). ANTHONY WADE MAKES IT! Assist: Karl Ingram
Score: 79-96

[05:12] Team_088 possession (Score: 79-96)
Klay Quickley attempts a 3Pt. Contested by Evan Mobley (4.8 feet, MAN). Klay Quickley misses. Rebound secured by Kobe Curry.

[04:56] Team_079 possession (Score: 79-96)
Anthony Wade drives to the basket... Anthony Wade loses control! Ball rolls out of bounds! TURNOVER! (dead ball)

[04:41] Team_088 possession (Score: 79-96)
Josh Embiid makes the Midrange and draws the foul on Anthony Wade! And-1! Josh Embiid to the line for 1. [Team fouls: 2] (Anthony Wade: 1 personal fouls)   FT 1/1: GOOD Josh Embiid makes 1/1 from the line.
Score: 82-96

[04:27] Team_079 possession (Score: 82-96)
FOUL! Holding foul on Klay Quickley. [IN THE BONUS! 8 team fouls] Evan Mobley to the line for 2 free throws. (Klay Quickley: 1 personal fouls)   FT 1/2: GOOD   FT 2/2: GOOD Evan Mobley makes 2/2 from the line.
Score: 82-98

[04:14] Team_088 possession (Score: 82-98)
Vince Carter attempts a 3Pt. Contested by Karl Ingram (5.1 feet, ZONE). Vince Carter misses. Rebound secured by Anthony Wade.

[03:59] Team_079 possession (Score: 82-98)
James LaVine attempts a Midrange. Contested by Josh Embiid (5.3 feet, MAN). James LaVine misses. Rebound secured by Josh Embiid.

[03:43] Team_088 possession (Score: 82-98)
Klay Quickley attempts a Layup. BLOCKED BY JAMES LAVINE! Ball is loose! Rebound secured by Anthony Wade.

[03:34] Team_079 possession (Score: 82-98)
Kobe Curry drives, picks up Zion Harris. Help arrives from Vince Carter! Kobe Curry attempts a Dunk. Contested by Vince Carter (5.9 feet, MAN). Kobe Curry misses. Rebound secured by Josh Embiid.

[03:18] Team_088 possession (Score: 82-98)
Zion Harris drives and kicks out. Pau Bird attempts a 3Pt. Contested by Evan Mobley (4.9 feet, ZONE). PAU BIRD MAKES IT! Assist: Zion Harris
Score: 85-98

[03:06] Team_079 possession (Score: 85-98)
Evan Mobley attempts a 3Pt. Contested by Pau Bird (5.4 feet, ZONE). Evan Mobley misses. Rebound secured by Pau Bird.

[02:56] Team_088 possession (Score: 85-98)
FOUL! Holding foul on Evan Mobley. [Team fouls: 3] No free throws, side out. (Evan Mobley: 1 personal fouls)

[02:42] Team_088 possession (Score: 85-98)
Klay Quickley attempts a 3Pt. Contested by Evan Mobley (5.1 feet, MAN). Klay Quickley misses. Offensive rebound by Pau Bird! Pau Bird kicks it out.

[02:32] Team_088 possession (Score: 85-98)
Klay Quickley attempts a 3Pt. Contested by Karl Ingram (5.3 feet, ZONE). Klay Quickley misses. FOUL! Loose ball foul on James LaVine during the rebound battle. [Team fouls: 4] No free throws, side out. (James LaVine: 1 personal fouls)

[02:19] Team_088 possession (Score: 85-98)
Josh Embiid drives to the basket... Josh Embiid loses control! Ball rolls out of bounds! TURNOVER! (dead ball)

[02:19] Substitution (Team_079): Evan Mobley OUT → Khris Embiid IN (starter_return_rule1)

[02:05] Team_079 possession (Score: 85-98)
Karl Ingram attempts a 3Pt. Contested by Vince Carter (4.9 feet, MAN). Karl Ingram misses. Offensive rebound by Kobe Curry! Kobe Curry kicks it out.

[01:51] Team_079 possession (Score: 85-98)
Anthony Wade attempts a Layup. BLOCKED BY PAU BIRD! Ball is loose! Offensive rebound by James LaVine! James LaVine kicks it out.

[01:35] Team_079 possession (Score: 85-98)
Karl Ingram attempts a 3Pt. Contested by Pau Bird (5.1 feet, ZONE). Karl Ingram misses. Rebound secured by Zion Harris.

[01:19] Team_088 possession (Score: 85-98)
Vince Carter attempts a 3Pt. Contested by Khris Embiid (4.2 feet, ZONE). Vince Carter misses. Rebound secured by Kobe Curry.

[01:01] Team_079 possession (Score: 85-98)
Anthony Wade attempts a Midrange. Contested by Pau Bird (5.2 feet, MAN). Anthony Wade misses. Offensive rebound by James LaVine! James LaVine puts it back in!
Score: 85-100

[00:48] Team_088 possession (Score: 85-100)
Josh Embiid drives to the basket... Josh Embiid throws a bad pass! Stolen by James LaVine! TURNOVER! (live ball)

[00:31] Team_079 possession (Score: 85-100)
Anthony Wade drives, picks up Pau Bird. Help arrives from Vince Carter! Anthony Wade attempts a Layup. Contested by Vince Carter (5.2 feet, MAN). ANTHONY WADE MAKES IT! Assist: Khris Embiid
Score: 85-102

[00:13] Team_088 possession (Score: 85-102)
Pau Bird drives, picks up James LaVine. Help arrives from Khris Embiid! Pau Bird attempts a Dunk. Contested by Khris Embiid (4.5 feet, ZONE). PAU BIRD MAKES IT! Assist: Klay Quickley
Score: 87-102

================================================================================
                              4TH QUARTER COMPLETE                              
================================================================================

4TH QUARTER SCORE: Team_088 19, Team_079 22

BOX SCORE:
================================================================================

Team_088
--------------------------------------------------------------------------------
Player                MIN  PTS  REB  AST  TO      FG   FG%      3P   3P%
--------------------------------------------------------------------------------
Allen Ming             28    6    3    0   0   3/3   100.0     0/0   0.0
Josh Embiid            20    5    3    0   0   2/2   100.0     0/0   0.0
Pau Bird               18    5    2    0   0   2/2   100.0     0/0   0.0
Tyler Hyland           30    3    2    0   0   1/3    33.3     0/0   0.0
Giannis Smith          28    0    1    0   0   0/1     0.0     0/0   0.0
Klay Quickley          25    0    0    2   0   0/2     0.0     0/0   0.0
Vince Carter           18    0    0    0   0   0/4     0.0     0/0   0.0
Zion Harris            20    0    1    1   0   0/0     0.0     0/0   0.0

TEAM: FG: 8/17 (47.1%), 3PT: 3/9 (33.3%), REB: 12 (5 off, 7 def), AST: 3, TO: 3
TEAM FOULS: 8 [Team_079 in BONUS]


Team_079
--------------------------------------------------------------------------------
Player                MIN  PTS  REB  AST  TO      FG   FG%      3P   3P%
--------------------------------------------------------------------------------
Bam Randle             30    6    0    0   0   2/2   100.0     0/0   0.0
Anthony Wade           18    6    3    0   0   3/3   100.0     0/0   0.0
James LaVine           20    6    4    0   0   3/4    75.0     0/0   0.0
Donovan Randle         28    2    2    0   0   1/1   100.0     0/0   0.0
Evan Mobley            21    2    0    0   0   1/3    33.3     0/0   0.0
Trae Durant            32    0    2    2   0   0/0     0.0     0/0   0.0
Miles Ming             30    0    0    1   0   0/2     0.0     0/0   0.0
Karl Ingram            18    0    0    1   0   0/1     0.0     0/0   0.0
Kobe Curry             16    0    3    0   0   0/1     0.0     0/0   0.0
Khris Embiid           28    0    0    1   0   0/0     0.0     0/0   0.0

TEAM: FG: 10/17 (58.8%), 3PT: 2/5 (40.0%), REB: 14 (5 off, 9 def), AST: 5, TO: 2
TEAM FOULS: 4

================================================================================

================================================================================
                               FULL GAME COMPLETE                               
================================================================================

FINAL SCORE: Team_088 87, Team_079 102

SCORING BY QUARTER:
--------------------------------------------------------------------------------
Team                     Q1     Q2     Q3     Q4    FINAL
--------------------------------------------------------------------------------
Team_088                 23     25     20     19       87
Team_079                 29     18     33     22      102
--------------------------------------------------------------------------------

FULL GAME BOX SCORE:
================================================================================

Team_088
--------------------------------------------------------------------------------
Player                MIN  PTS  REB  AST  TO      FG   FG%      3P   3P%      FT STL BLK
--------------------------------------------------------------------------------
Tobias Haliburton      30    6    0    2   2   4/6    66.7   1/1   100.0   2/2     0   0
Tyler Hyland           30   10    6    1   1   6/16   37.5   3/11   27.3   3/3     0   0
Giannis Smith          28   10   10    3   3   4/7    57.1   0/0     0.0   2/2     2   1
Allen Ming             28   16    9    3   1   5/6    83.3   1/2    50.0   3/4     0   1
Klay Quickley          25    0    0    2   2   0/5     0.0   0/4     0.0   0/0     0   0
Josh Duncan            24   14    0    2   1   7/12   58.3   2/3    66.7   4/5     0   0
Zion Harris            20    4    6    1   1   3/5    60.0   0/1     0.0   1/2     1   0
Josh Embiid            20    7    6    1   3   2/5    40.0   0/0     0.0   3/3     0   0
Vince Carter           18    8    0    1   1   2/7    28.6   1/4    25.0   6/6     0   0
Pau Bird               18   10    7    1   0   3/4    75.0   1/2    50.0   0/0     0   2

TEAM: FG: 38/75 (50.7%), 3PT: 9/28 (32.1%), REB: 47 (16 off, 31 def), AST: 17, TO: 15


Team_079
--------------------------------------------------------------------------------
Player                MIN  PTS  REB  AST  TO      FG   FG%      3P   3P%      FT STL BLK
--------------------------------------------------------------------------------
Trae Durant            32   15   11    2   0   6/8    75.0   1/2    50.0   4/4     1   0
Miles Ming             30    2    0    3   1   3/10   30.0   0/5     0.0   0/0     0   1
Bam Randle             30   19    5    3   2   7/11   63.6   4/7    57.1   2/2     1   0
Donovan Randle         28   16   13    4   1   7/8    87.5   1/1   100.0   8/9     0   0
Khris Embiid           28   12    0    5   2   4/9    44.4   2/6    33.3   0/0     0   0
Evan Mobley            21    2    0    0   0   0/2     0.0   0/1     0.0   2/2     0   0
James LaVine           20   12    5    1   0   3/7    42.9   0/1     0.0   2/2     1   1
Karl Ingram            18    7    0    2   2   3/6    50.0   1/4    25.0   3/3     0   0
Anthony Wade           18   15    6    0   0   9/12   75.0   1/3    33.3   5/5     0   1
Kobe Curry             16    2    8    1   1   1/2    50.0   0/0     0.0   0/0     0   0

TEAM: FG: 46/78 (59.0%), 3PT: 10/30 (33.3%), REB: 45 (13 off, 32 def), AST: 21, TO: 9

================================================================================
