================================================================================
                        FULL GAME - Team_009 vs Team_094                        
================================================================================

================================================================================
                       1ST QUARTER - Team_009 vs Team_094                       
================================================================================

[12:00] Team_009 possession (Score: 0-0)
FOUL! Reach-in foul on Lauri Thompson during the drive. [Team fouls: 1] No free throws, side out. (Lauri Thompson: 1 personal fouls)

[11:48] Team_009 possession (Score: 0-0)
FOUL! Reach-in foul on Tim Russell during the drive. [Team fouls: 2] No free throws, side out. (Tim Russell: 1 personal fouls)

[11:34] Team_009 possession (Score: 0-0)
Desmond Harden attempts a 3Pt. Contested by Kobe Wagner (4.2 feet, ZONE). Desmond Harden misses. Rebound secured by Tim Russell.

[11:21] Team_094 possession (Score: 0-0)
Tim Russell attempts a 3Pt. Contested by Miles Sabonis (5.4 feet, ZONE). Tim Russell misses. Rebound secured by Anfernee Anunoby.

[11:04] Team_009 possession (Score: 0-0)
Desmond Harden drives, picks up Lauri Thompson. Help arrives from Kobe Wagner! Desmond Harden attempts a Dunk. Contested by Kobe Wagner (4.9 feet, MAN). DESMOND HARDEN MAKES IT!
Score: 2-0

[10:47] Team_094 possession (Score: 2-0)
Tim Russell attempts a Midrange. Contested by Cole Mitchell (4.6 feet, MAN). Tim Russell misses. Rebound secured by Kyle Brogdon.

[10:28] Team_009 possession (Score: 2-0)
Cole Mitchell attempts a Midrange. Contested by Tim Russell (4.7 feet, MAN). COLE MITCHELL MAKES IT!
Score: 4-0

[10:12] Team_094 possession (Score: 4-0)
FOUL! Shooting foul on Desmond Harden. Lauri Thompson to the line for 3 free throws. [Team fouls: 1] (Desmond Harden: 1 personal fouls)   FT 1/3: GOOD   FT 2/3: GOOD   FT 3/3: GOOD Lauri Thompson makes 3/3 from the line.
Score: 4-3

[09:59] Team_009 possession (Score: 4-3)
Anfernee Anunoby attempts a 3Pt. Contested by Kobe Wagner (4.1 feet, ZONE). ANFERNEE ANUNOBY MAKES IT! Assist: Desmond Harden
Score: 7-3

[09:46] Team_094 possession (Score: 7-3)
Kobe Wagner drives, Anfernee Anunoby stays with him. Kobe Wagner attempts a Dunk. Contested by Anfernee Anunoby (5.5 feet, MAN). Kobe Wagner misses. Rebound secured by Anfernee Anunoby.

[09:31] Team_009 possession (Score: 7-3)
Anfernee Anunoby attempts a 3Pt. Contested by Kobe Wagner (4.1 feet, MAN). ANFERNEE ANUNOBY MAKES IT! Assist: Miles Sabonis
Score: 10-3

[09:17] Team_094 possession (Score: 10-3)
Terry Ingram drives and kicks out. Lauri Thompson attempts a 3Pt. Contested by Desmond Harden (4.8 feet, MAN). Lauri Thompson misses. Rebound secured by Kyle Brogdon.

[09:03] Team_009 possession (Score: 10-3)
FOUL! Shooting foul on Tim Russell. Kyle Brogdon to the line for 2 free throws. [Team fouls: 3] (Tim Russell: 2 personal fouls)   FT 1/2: GOOD   FT 2/2: GOOD Kyle Brogdon makes 2/2 from the line.
Score: 12-3

[08:46] Team_094 possession (Score: 12-3)
Lauri Thompson attempts a Layup. Contested by Desmond Harden (5.2 feet, MAN). LAURI THOMPSON MAKES IT! Assist: Terry Ingram
Score: 12-5

[08:32] Team_009 possession (Score: 12-5)
Cole Mitchell attempts a Midrange. Contested by Kobe Wagner (4.1 feet, ZONE). COLE MITCHELL MAKES IT!
Score: 14-5

[08:18] Team_094 possession (Score: 14-5)
Tim Russell drives, Cole Mitchell stays with him. Tim Russell attempts a Dunk. Contested by Cole Mitchell (4.6 feet, MAN). TIM RUSSELL MAKES IT!
Score: 14-7

[08:04] Team_009 possession (Score: 14-7)
FOUL! Holding foul on Kobe Wagner. [Team fouls: 4] No free throws, side out. (Kobe Wagner: 1 personal fouls)

[07:49] Team_009 possession (Score: 14-7)
FOUL! Reach-in foul on Tim Russell during the drive. [IN THE BONUS! 5 team fouls] Cole Mitchell to the line for 2 free throws. (Tim Russell: 3 personal fouls)   FT 1/2: GOOD   FT 2/2: GOOD Cole Mitchell makes 2/2 from the line.
Score: 16-7

[07:32] Team_094 possession (Score: 16-7)
Kobe Bryant drives, Kyle Brogdon stays with him. Kobe Bryant attempts a Dunk. Contested by Kyle Brogdon (5.1 feet, ZONE). KOBE BRYANT MAKES IT! Assist: Kobe Wagner
Score: 16-9

[07:18] Team_009 possession (Score: 16-9)
Cole Mitchell drives and kicks out. Kyle Brogdon attempts a 3Pt. Contested by Kobe Bryant (5.0 feet, MAN). KYLE BROGDON MAKES IT! Assist: Desmond Harden
Score: 19-9

[07:04] Team_094 possession (Score: 19-9)
Tim Russell attempts a Midrange. Contested by Cole Mitchell (4.6 feet, MAN). TIM RUSSELL MAKES IT! Assist: Kobe Wagner
Score: 19-11

[06:50] Team_009 possession (Score: 19-11)
Anfernee Anunoby attempts a Layup. BLOCKED BY KOBE WAGNER! Ball is loose! Offensive rebound by Cole Mitchell! Cole Mitchell kicks it out.

[06:36] Team_009 possession (Score: 19-11)
Miles Sabonis attempts a 3Pt. Contested by Terry Ingram (4.6 feet, ZONE). MILES SABONIS MAKES IT! Assist: Cole Mitchell
Score: 22-11

[06:20] Team_094 possession (Score: 22-11)
Lauri Thompson attempts a Midrange. Contested by Anfernee Anunoby (5.4 feet, ZONE). LAURI THOMPSON MAKES IT!
Score: 22-13

[06:04] Team_009 possession (Score: 22-13)
Cole Mitchell drives to the basket... Cole Mitchell throws a bad pass out of bounds! TURNOVER! (dead ball)

[05:49] Team_094 possession (Score: 22-13)
FOUL! Holding foul on Desmond Harden. [Team fouls: 2] No free throws, side out. (Desmond Harden: 2 personal fouls)

[05:38] Team_094 possession (Score: 22-13)
Terry Ingram attempts a Midrange. Contested by Miles Sabonis (5.6 feet, MAN). Terry Ingram misses. Rebound secured by Cole Mitchell.

[05:25] Team_009 possession (Score: 22-13)
Cole Mitchell commits a violation (traveling/carry)! TURNOVER! (dead ball)

[05:09] Team_094 possession (Score: 22-13)
Kobe Wagner attempts a Layup. Contested by Kyle Brogdon (5.4 feet, ZONE). KOBE WAGNER MAKES IT! Assist: Kobe Bryant
Score: 22-15

[04:50] Team_009 possession (Score: 22-15)
Miles Sabonis attempts a 3Pt. Contested by Terry Ingram (4.6 feet, MAN). Miles Sabonis misses. Offensive rebound by Cole Mitchell! Cole Mitchell kicks it out.

[04:38] Team_009 possession (Score: 22-15)
Desmond Harden attempts a Midrange. Contested by Lauri Thompson (4.9 feet, ZONE). Desmond Harden misses. Rebound secured by Kobe Bryant.

[04:21] Team_094 possession (Score: 22-15)
Tim Russell drives, Kyle Brogdon stays with him. Tim Russell attempts a Dunk. Contested by Kyle Brogdon (5.1 feet, ZONE). Tim Russell misses. Rebound secured by Kyle Brogdon.

[04:05] Team_009 possession (Score: 22-15)
FOUL! Shooting foul on Lauri Thompson. Desmond Harden to the line for 2 free throws. [BONUS: 6 team fouls] (Lauri Thompson: 2 personal fouls)   FT 1/2: GOOD   FT 2/2: GOOD Desmond Harden makes 2/2 from the line.
Score: 24-15

[03:47] Team_094 possession (Score: 24-15)
FOUL! Shooting foul on Miles Sabonis. Kobe Wagner to the line for 2 free throws. [Team fouls: 3] (Miles Sabonis: 1 personal fouls)   FT 1/2: MISS   FT 2/2: MISS Kobe Wagner makes 0/2 from the line. Rebound secured by Anfernee Anunoby.

[03:36] Team_009 possession (Score: 24-15)
Kyle Brogdon makes the Layup and draws the foul on Kobe Bryant! And-1! Kyle Brogdon to the line for 1. [BONUS: 7 team fouls] (Kobe Bryant: 1 personal fouls)   FT 1/1: GOOD Kyle Brogdon makes 1/1 from the line.
Score: 27-15

[03:18] Team_094 possession (Score: 27-15)
Kobe Wagner attempts a Midrange. Contested by Kyle Brogdon (5.5 feet, ZONE). Kobe Wagner misses. Rebound secured by Kyle Brogdon.

[03:05] Team_009 possession (Score: 27-15)
Miles Sabonis attempts a Midrange. Contested by Kobe Bryant (5.0 feet, ZONE). Miles Sabonis misses. Rebound secured by Kobe Bryant.

[02:51] Team_094 possession (Score: 27-15)
Kobe Wagner attempts a Midrange. Contested by Anfernee Anunoby (5.7 feet, MAN). Kobe Wagner misses. Rebound secured by Kyle Brogdon.

[02:39] Team_009 possession (Score: 27-15)
FOUL! Reach-in foul on Kobe Bryant during the drive. [IN THE BONUS! 8 team fouls] Kyle Brogdon to the line for 2 free throws. (Kobe Bryant: 2 personal fouls)   FT 1/2: GOOD   FT 2/2: GOOD Kyle Brogdon makes 2/2 from the line.
Score: 29-15

[02:28] Team_094 possession (Score: 29-15)
Lauri Thompson attempts a 3Pt. Contested by Desmond Harden (5.4 feet, MAN). LAURI THOMPSON MAKES IT! Assist: Terry Ingram
Score: 29-18

[02:17] Team_009 possession (Score: 29-18)
Kyle Brogdon drives, Kobe Bryant stays with him. Kyle Brogdon attempts a Layup. Contested by Kobe Bryant (4.8 feet, MAN). Kyle Brogdon misses. Rebound secured by Tim Russell.

[02:04] Team_094 possession (Score: 29-18)
Kobe Bryant drives to the basket... Kobe Bryant throws a bad pass out of bounds! TURNOVER! (dead ball)

[02:04] Substitution (Team_009): Miles Sabonis OUT → Paul Trent IN (stamina_rule2)

[02:04] Substitution (Team_009): Desmond Harden OUT → Evan Curry IN (stamina_rule2)

[02:04] Substitution (Team_009): Anfernee Anunoby OUT → RJ Jokic IN (stamina_rule2)

[02:04] Substitution (Team_009): Cole Mitchell OUT → Kawhi Herro IN (stamina_rule2)

[02:04] Substitution (Team_009): Kyle Brogdon OUT → Shaquille Green IN (stamina_rule2)

[02:04] Substitution (Team_094): Terry Ingram OUT → Shaquille Bryant IN (stamina_rule2)

[02:04] Substitution (Team_094): Lauri Thompson OUT → Kevin Rozier IN (stamina_rule2)

[02:04] Substitution (Team_094): Kobe Wagner OUT → Ayo Gasol IN (stamina_rule2)

[02:04] Substitution (Team_094): Tim Russell OUT → Domantas Haliburton IN (stamina_rule2)

[02:04] Substitution (Team_094): Kobe Bryant OUT → Isaiah Quickley IN (stamina_rule2)

[01:46] Team_009 possession (Score: 29-18)
Paul Trent attempts a Layup. BLOCKED BY SHAQUILLE BRYANT! Ball goes out off Shaquille Bryant. Paul Trent's ball!

[01:30] Team_009 possession (Score: 29-18)
Kawhi Herro attempts a 3Pt. Contested by Domantas Haliburton (5.9 feet, MAN). Kawhi Herro misses. Rebound secured by Isaiah Quickley.

[01:20] Team_094 possession (Score: 29-18)
Shaquille Bryant attempts a 3Pt. Contested by Paul Trent (5.3 feet, ZONE). SHAQUILLE BRYANT MAKES IT! Assist: Domantas Haliburton
Score: 29-21

[01:03] Team_009 possession (Score: 29-21)
Paul Trent attempts a 3Pt. Contested by Shaquille Bryant (4.6 feet, MAN). Paul Trent misses. Rebound secured by Domantas Haliburton.

[00:50] Team_094 possession (Score: 29-21)
Shaquille Bryant attempts a 3Pt. Contested by Paul Trent (5.3 feet, ZONE). Shaquille Bryant misses. Rebound secured by Shaquille Green.

[00:37] Team_009 possession (Score: 29-21)
Shaquille Green attempts a 3Pt. Wide open! Domantas Haliburton is 6.0 feet away. [ZONE] SHAQUILLE GREEN MAKES IT! Assist: Evan Curry
Score: 32-21

[00:24] Team_094 possession (Score: 32-21)
Shaquille Bryant commits a violation (traveling/carry)! TURNOVER! (dead ball)

[00:10] Team_009 possession (Score: 32-21)
Shaquille Green attempts a Midrange. Wide open! Isaiah Quickley is 6.2 feet away. [MAN] SHAQUILLE GREEN MAKES IT!
Score: 34-21

================================================================================
                              1ST QUARTER COMPLETE                              
================================================================================

1ST QUARTER SCORE: Team_009 34, Team_094 21

BOX SCORE:
================================================================================

Team_009
--------------------------------------------------------------------------------
Player                MIN  PTS  REB  AST  TO      FG   FG%      3P   3P%
--------------------------------------------------------------------------------
Kyle Brogdon           10   10    5    0   0   4/5    80.0     0/0   0.0
Anfernee Anunoby       10    6    3    0   0   2/2   100.0     0/0   0.0
Cole Mitchell          10    6    3    1   0   3/3   100.0     0/0   0.0
Shaquille Green         2    5    1    0   0   2/2   100.0     0/0   0.0
Desmond Harden         10    4    0    2   0   2/4    50.0     0/0   0.0
Miles Sabonis          10    3    0    1   0   1/2    50.0     0/0   0.0
Kawhi Herro             2    0    0    0   0   0/1     0.0     0/0   0.0
Paul Trent              2    0    0    0   0   0/1     0.0     0/0   0.0
Evan Curry              2    0    0    1   0   0/0     0.0     0/0   0.0

TEAM: FG: 14/20 (70.0%), 3PT: 4/7 (57.1%), REB: 12 (2 off, 10 def), AST: 5, TO: 2
TEAM FOULS: 3


Team_094
--------------------------------------------------------------------------------
Player                MIN  PTS  REB  AST  TO      FG   FG%      3P   3P%
--------------------------------------------------------------------------------
Lauri Thompson         10   10    0    0   0   4/4   100.0     0/0   0.0
Tim Russell            10    4    2    0   0   2/5    40.0     0/0   0.0
Shaquille Bryant        2    3    0    0   0   1/2    50.0     0/0   0.0
Kobe Wagner            10    2    0    2   0   1/5    20.0     0/0   0.0
Kobe Bryant            10    2    2    1   0   1/1   100.0     0/0   0.0
Terry Ingram           10    0    0    2   0   0/2     0.0     0/0   0.0
Isaiah Quickley         2    0    1    0   0   0/0     0.0     0/0   0.0
Domantas Haliburton     2    0    1    1   0   0/0     0.0     0/0   0.0

TEAM: FG: 9/19 (47.4%), 3PT: 3/5 (60.0%), REB: 6 (0 off, 6 def), AST: 6, TO: 2
TEAM FOULS: 8 [Team_009 in BONUS]

================================================================================

================================================================================
                       2ND QUARTER - Team_009 vs Team_094                       
================================================================================

[12:00] Team_009 possession (Score: 34-21)
Anfernee Anunoby drives to the basket... Anfernee Anunoby throws a bad pass out of bounds! TURNOVER! (dead ball)

[11:48] Team_094 possession (Score: 34-21)
Kobe Bryant attempts a 3Pt. Contested by Kyle Brogdon (5.2 feet, MAN). Kobe Bryant misses. Rebound secured by Anfernee Anunoby.

[11:35] Team_009 possession (Score: 34-21)
Miles Sabonis attempts a 3Pt. Contested by Terry Ingram (4.7 feet, MAN). Miles Sabonis misses. Rebound secured by Kobe Bryant.

[11:21] Team_094 possession (Score: 34-21)
Kobe Wagner attempts a Midrange. Contested by Anfernee Anunoby (5.6 feet, MAN). Kobe Wagner misses. Rebound secured by Anfernee Anunoby.

[11:05] Team_009 possession (Score: 34-21)
Kyle Brogdon drives and kicks out. Kyle Brogdon attempts a Midrange. Contested by Kobe Bryant (5.1 feet, MAN). Kyle Brogdon misses. FOUL! Loose ball foul on Kobe Wagner during the rebound battle. [Team fouls: 1] No free throws, side out. (Kobe Wagner: 1 personal fouls)

[10:54] Team_009 possession (Score: 34-21)
Miles Sabonis drives, Terry Ingram stays with him. Miles Sabonis attempts a Layup. Contested by Terry Ingram (4.8 feet, MAN). Miles Sabonis misses. FOUL! Loose ball foul on Kobe Wagner during the rebound battle. [Team fouls: 2] No free throws, side out. (Kobe Wagner: 2 personal fouls)

[10:34] Team_009 possession (Score: 34-21)
Anfernee Anunoby drives, picks up Kobe Wagner. Help arrives from Lauri Thompson! Anfernee Anunoby attempts a Dunk. Contested by Lauri Thompson (4.2 feet, MAN). Anfernee Anunoby misses. Offensive rebound by Kyle Brogdon! Kyle Brogdon puts it back in!
Score: 36-21

[10:24] Team_094 possession (Score: 36-21)
FOUL! Reach-in foul on Kyle Brogdon during the drive. [Team fouls: 1] No free throws, side out. (Kyle Brogdon: 1 personal fouls)

[10:08] Team_094 possession (Score: 36-21)
Lauri Thompson attempts a 3Pt. Contested by Desmond Harden (5.4 feet, MAN). Lauri Thompson misses. Rebound secured by Anfernee Anunoby.

[09:51] Team_009 possession (Score: 36-21)
FOUL! Reach-in foul on Terry Ingram during the drive. [Team fouls: 3] No free throws, side out. (Terry Ingram: 1 personal fouls)

[09:41] Team_009 possession (Score: 36-21)
Miles Sabonis drives, Terry Ingram stays with him. Miles Sabonis attempts a Dunk. Contested by Terry Ingram (4.9 feet, MAN). MILES SABONIS MAKES IT! Assist: Kyle Brogdon
Score: 38-21

[09:26] Team_094 possession (Score: 38-21)
Kobe Bryant drives, Kyle Brogdon stays with him. Kobe Bryant attempts a Layup. Contested by Kyle Brogdon (5.4 feet, ZONE). KOBE BRYANT MAKES IT! Assist: Tim Russell
Score: 38-23

[09:14] Team_009 possession (Score: 38-23)
Anfernee Anunoby attempts a 3Pt. Contested by Kobe Wagner (4.4 feet, ZONE). ANFERNEE ANUNOBY MAKES IT! Assist: Desmond Harden
Score: 41-23

[08:57] Team_094 possession (Score: 41-23)
Tim Russell attempts a Midrange. Contested by Desmond Harden (5.3 feet, ZONE). TIM RUSSELL MAKES IT! Assist: Kobe Wagner
Score: 41-25

[08:44] Team_009 possession (Score: 41-25)
Miles Sabonis drives and kicks out. FOUL! Shooting foul on Kobe Wagner. Desmond Harden to the line for 3 free throws. [Team fouls: 4] (Kobe Wagner: 3 personal fouls)   FT 1/3: GOOD   FT 2/3: MISS   FT 3/3: MISS Desmond Harden makes 1/3 from the line. Rebound secured by Kobe Bryant.
Score: 42-25

[08:25] Team_094 possession (Score: 42-25)
Lauri Thompson loses control! Ball rolls out of bounds! TURNOVER! (dead ball)

[08:25] Substitution (Team_009): Miles Sabonis OUT → Paul Trent IN (stamina_rule2)

[08:25] Substitution (Team_009): Desmond Harden OUT → Evan Curry IN (stamina_rule2)

[08:25] Substitution (Team_009): Anfernee Anunoby OUT → RJ Jokic IN (stamina_rule2)

[08:25] Substitution (Team_009): Cole Mitchell OUT → Kawhi Herro IN (stamina_rule2)

[08:25] Substitution (Team_009): Kyle Brogdon OUT → Shaquille Green IN (stamina_rule2)

[08:25] Substitution (Team_094): Terry Ingram OUT → Shaquille Bryant IN (stamina_rule2)

[08:25] Substitution (Team_094): Lauri Thompson OUT → Kevin Rozier IN (stamina_rule2)

[08:25] Substitution (Team_094): Kobe Wagner OUT → Ayo Gasol IN (stamina_rule2)

[08:25] Substitution (Team_094): Tim Russell OUT → Domantas Haliburton IN (stamina_rule2)

[08:25] Substitution (Team_094): Kobe Bryant OUT → Isaiah Quickley IN (stamina_rule2)

[08:09] Team_009 possession (Score: 42-25)
Kawhi Herro drives, Isaiah Quickley stays with him. Kawhi Herro attempts a Dunk. Wide open! Isaiah Quickley is 6.2 feet away. [ZONE] Kawhi Herro misses. Offensive rebound by Shaquille Green! Shaquille Green kicks it out.

[07:53] Team_009 possession (Score: 42-25)
Evan Curry makes the Dunk and draws the foul on Ayo Gasol! And-1! Evan Curry to the line for 1. [BONUS: 5 team fouls] (Ayo Gasol: 1 personal fouls)   FT 1/1: GOOD Evan Curry makes 1/1 from the line.
Score: 45-25

[07:35] Team_094 possession (Score: 45-25)
Kevin Rozier drives, Kawhi Herro stays with him. Kevin Rozier attempts a Dunk. Contested by Kawhi Herro (4.1 feet, ZONE). KEVIN ROZIER MAKES IT! Assist: Shaquille Bryant
Score: 45-27

[07:23] Team_009 possession (Score: 45-27)
RJ Jokic attempts a 3Pt. Contested by Domantas Haliburton (5.6 feet, ZONE). RJ JOKIC MAKES IT! Assist: Paul Trent
Score: 48-27

[07:06] Team_094 possession (Score: 48-27)
Kevin Rozier drives, Kawhi Herro stays with him. Kevin Rozier attempts a Layup. Contested by Kawhi Herro (4.1 feet, ZONE). KEVIN ROZIER MAKES IT!
Score: 48-29

[06:51] Team_009 possession (Score: 48-29)
RJ Jokic attempts a 3Pt. Contested by Ayo Gasol (4.7 feet, MAN). RJ Jokic misses. Rebound secured by Ayo Gasol.

[06:39] Team_094 possession (Score: 48-29)
Kevin Rozier attempts a 3Pt. Wide open! Paul Trent is 6.1 feet away. [ZONE] Kevin Rozier misses. Rebound secured by Shaquille Green.

[06:24] Team_009 possession (Score: 48-29)
FOUL! Holding foul on Ayo Gasol. [IN THE BONUS! 6 team fouls] RJ Jokic to the line for 2 free throws. (Ayo Gasol: 2 personal fouls)   FT 1/2: GOOD   FT 2/2: GOOD RJ Jokic makes 2/2 from the line.
Score: 50-29

[06:12] Team_094 possession (Score: 50-29)
Isaiah Quickley attempts a Layup. Contested by Shaquille Green (5.0 feet, MAN). ISAIAH QUICKLEY MAKES IT! Assist: Kevin Rozier
Score: 50-31

[05:55] Team_009 possession (Score: 50-31)
Paul Trent throws a bad pass out of bounds! TURNOVER! (dead ball)

[05:42] Team_094 possession (Score: 50-31)
Isaiah Quickley loses the ball! Stripped by Shaquille Green! TURNOVER! (live ball)

[05:27] Team_009 possession (Score: 50-31)
Shaquille Green makes the Midrange and draws the foul on Ayo Gasol! And-1! Shaquille Green to the line for 1. [BONUS: 7 team fouls] (Ayo Gasol: 3 personal fouls)   FT 1/1: GOOD Shaquille Green makes 1/1 from the line.
Score: 53-31

[05:12] Team_094 possession (Score: 53-31)
Isaiah Quickley drives to the basket... Isaiah Quickley loses the ball! Stripped by Kawhi Herro! TURNOVER! (live ball)

[04:56] Team_009 possession (Score: 53-31)
RJ Jokic attempts a 3Pt. Contested by Domantas Haliburton (5.6 feet, ZONE). RJ Jokic misses. Rebound secured by Ayo Gasol.

[04:41] Team_094 possession (Score: 53-31)
Ayo Gasol attempts a 3Pt. Contested by Paul Trent (5.9 feet, ZONE). Ayo Gasol misses. Offensive rebound by Isaiah Quickley! Isaiah Quickley kicks it out.

[04:25] Team_094 possession (Score: 53-31)
Shaquille Bryant attempts a 3Pt. Contested by Paul Trent (5.3 feet, ZONE). SHAQUILLE BRYANT MAKES IT! Assist: Kevin Rozier
Score: 53-34

[04:09] Team_009 possession (Score: 53-34)
Kawhi Herro attempts a 3Pt. Contested by Domantas Haliburton (5.9 feet, MAN). Kawhi Herro misses. Rebound secured by Domantas Haliburton.

[03:58] Team_094 possession (Score: 53-34)
Isaiah Quickley drives to the basket... Isaiah Quickley throws a bad pass! Stolen by Shaquille Green! TURNOVER! (live ball)

[03:43] Team_009 possession (Score: 53-34)
FOUL! Shooting foul on Ayo Gasol. RJ Jokic to the line for 3 free throws. [BONUS: 8 team fouls] (Ayo Gasol: 4 personal fouls)   FT 1/3: GOOD   FT 2/3: MISS   FT 3/3: MISS RJ Jokic makes 1/3 from the line. Rebound secured by Isaiah Quickley.
Score: 54-34

[03:26] Team_094 possession (Score: 54-34)
FOUL! Reach-in foul on Kawhi Herro during the drive. [Team fouls: 2] No free throws, side out. (Kawhi Herro: 1 personal fouls)

[03:07] Team_094 possession (Score: 54-34)
Ayo Gasol attempts a Layup. Contested by RJ Jokic (4.7 feet, MAN). AYO GASOL MAKES IT! Assist: Domantas Haliburton
Score: 54-36

[02:53] Team_009 possession (Score: 54-36)
RJ Jokic attempts a 3Pt. Contested by Ayo Gasol (4.7 feet, MAN). RJ Jokic misses. Offensive rebound by Kawhi Herro! Kawhi Herro puts it back in!
Score: 56-36

[02:37] Team_094 possession (Score: 56-36)
Isaiah Quickley attempts a Midrange. Contested by RJ Jokic (4.7 feet, ZONE). Isaiah Quickley misses. Rebound secured by Kawhi Herro.

[02:18] Team_009 possession (Score: 56-36)
RJ Jokic attempts a 3Pt. Contested by Domantas Haliburton (5.6 feet, ZONE). RJ JOKIC MAKES IT!
Score: 59-36

[02:04] Team_094 possession (Score: 59-36)
Domantas Haliburton attempts a Midrange. Contested by Kawhi Herro (3.7 feet, ZONE). Domantas Haliburton misses. Rebound secured by RJ Jokic.

[01:50] Team_009 possession (Score: 59-36)
Paul Trent attempts a 3Pt. Contested by Shaquille Bryant (4.7 feet, MAN). Paul Trent misses. Offensive rebound by Kawhi Herro! Kawhi Herro's putback is no good. Offensive rebound by Kawhi Herro! Kawhi Herro kicks it out.

[01:34] Team_009 possession (Score: 59-36)
RJ Jokic attempts a 3Pt. Contested by Ayo Gasol (4.8 feet, MAN). RJ Jokic misses. Rebound secured by Isaiah Quickley.

[01:16] Team_094 possession (Score: 59-36)
Ayo Gasol drives, Kawhi Herro stays with him. Ayo Gasol attempts a Layup. Contested by Kawhi Herro (3.9 feet, ZONE). AYO GASOL MAKES IT! Assist: Isaiah Quickley
Score: 59-38

[01:00] Team_009 possession (Score: 59-38)
Kawhi Herro attempts a 3Pt. Wide open! Domantas Haliburton is 6.0 feet away. [ZONE] Kawhi Herro misses. Offensive rebound by Shaquille Green! Shaquille Green kicks it out.

[00:45] Team_009 possession (Score: 59-38)
Shaquille Green attempts a Layup. Wide open! Isaiah Quickley is 6.3 feet away. [ZONE] SHAQUILLE GREEN MAKES IT! Assist: Evan Curry
Score: 61-38

[00:30] Team_094 possession (Score: 61-38)
FOUL! Shooting foul on Shaquille Green. Isaiah Quickley to the line for 2 free throws. [Team fouls: 3] (Shaquille Green: 1 personal fouls)   FT 1/2: GOOD   FT 2/2: MISS Isaiah Quickley makes 1/2 from the line. Rebound secured by Kawhi Herro.
Score: 61-39

[00:16] Team_009 possession (Score: 61-39)
Evan Curry attempts a 3Pt. Contested by Kevin Rozier (5.3 feet, MAN). Evan Curry misses. Rebound secured by Domantas Haliburton.

[00:02] Team_094 possession (Score: 61-39)
Isaiah Quickley attempts a 3Pt. Wide open! Paul Trent is 6.1 feet away. [ZONE] Isaiah Quickley misses. Rebound secured by Kawhi Herro.

================================================================================
                              2ND QUARTER COMPLETE                              
================================================================================

2ND QUARTER SCORE: Team_009 27, Team_094 18

BOX SCORE:
================================================================================

Team_009
--------------------------------------------------------------------------------
Player                MIN  PTS  REB  AST  TO      FG   FG%      3P   3P%
--------------------------------------------------------------------------------
RJ Jokic               10    8    1    0   0   3/7    42.9     0/0   0.0
Shaquille Green        10    5    3    0   0   2/2   100.0     0/0   0.0
Anfernee Anunoby       14    3    3    0   0   1/1   100.0     0/0   0.0
Evan Curry             10    3    0    1   0   1/2    50.0     0/0   0.0
Miles Sabonis          14    2    0    0   0   1/3    33.3     0/0   0.0
Kyle Brogdon           14    2    3    1   0   1/1   100.0     0/0   0.0
Kawhi Herro            10    2    5    0   0   1/2    50.0     0/0   0.0
Desmond Harden         14    0    0    1   0   0/0     0.0     0/0   0.0
Paul Trent             10    0    0    1   0   0/0     0.0     0/0   0.0

TEAM: FG: 10/18 (55.6%), 3PT: 4/11 (36.4%), REB: 15 (7 off, 8 def), AST: 4, TO: 2
TEAM FOULS: 3


Team_094
--------------------------------------------------------------------------------
Player                MIN  PTS  REB  AST  TO      FG   FG%      3P   3P%
--------------------------------------------------------------------------------
Kevin Rozier           10    4    0    2   0   2/3    66.7     0/0   0.0
Ayo Gasol              10    4    2    0   0   2/2   100.0     0/0   0.0
Shaquille Bryant       10    3    0    1   0   1/1   100.0     0/0   0.0
Kobe Bryant            14    2    2    0   0   1/2    50.0     0/0   0.0
Tim Russell            14    2    0    1   0   1/1   100.0     0/0   0.0
Isaiah Quickley        10    2    3    1   0   1/4    25.0     0/0   0.0
Kobe Wagner            14    0    0    1   0   0/1     0.0     0/0   0.0
Lauri Thompson         14    0    0    0   0   0/1     0.0     0/0   0.0
Domantas Haliburton    10    0    2    1   0   0/1     0.0     0/0   0.0

TEAM: FG: 8/16 (50.0%), 3PT: 1/5 (20.0%), REB: 9 (1 off, 8 def), AST: 7, TO: 4
TEAM FOULS: 8 [Team_009 in BONUS]

================================================================================

================================================================================
                       3RD QUARTER - Team_009 vs Team_094                       
================================================================================

[12:00] Team_009 possession (Score: 61-39)
Anfernee Anunoby attempts a 3Pt. Contested by Kobe Wagner (4.1 feet, MAN). Anfernee Anunoby misses. Rebound secured by Kobe Bryant.

[11:45] Team_094 possession (Score: 61-39)
Tim Russell drives, Cole Mitchell stays with him. Tim Russell attempts a Layup. Contested by Cole Mitchell (4.6 feet, MAN). TIM RUSSELL MAKES IT! Assist: Terry Ingram
Score: 61-41

[11:33] Team_009 possession (Score: 61-41)
Desmond Harden makes the Midrange and draws the foul on Tim Russell! And-1! Desmond Harden to the line for 1. [Team fouls: 1] (Tim Russell: 1 personal fouls)   FT 1/1: GOOD Desmond Harden makes 1/1 from the line.
Score: 64-41

[11:20] Team_094 possession (Score: 64-41)
Lauri Thompson attempts a 3Pt. Contested by Desmond Harden (5.2 feet, MAN). LAURI THOMPSON MAKES IT!
Score: 64-44

[11:06] Team_009 possession (Score: 64-44)
FOUL! Holding foul on Kobe Wagner. [Team fouls: 2] No free throws, side out. (Kobe Wagner: 1 personal fouls)

[10:55] Team_009 possession (Score: 64-44)
FOUL! Shooting foul on Terry Ingram. Miles Sabonis to the line for 3 free throws. [Team fouls: 3] (Terry Ingram: 1 personal fouls)   FT 1/3: MISS   FT 2/3: GOOD   FT 3/3: GOOD Miles Sabonis makes 2/3 from the line.
Score: 66-44

[10:43] Team_094 possession (Score: 66-44)
Kobe Bryant attempts a Midrange. Contested by Cole Mitchell (4.7 feet, ZONE). Kobe Bryant misses. Rebound secured by Kyle Brogdon.

[10:28] Team_009 possession (Score: 66-44)
FOUL! Shooting foul on Lauri Thompson. Anfernee Anunoby to the line for 2 free throws. [Team fouls: 4] (Lauri Thompson: 1 personal fouls)   FT 1/2: MISS   FT 2/2: GOOD Anfernee Anunoby makes 1/2 from the line.
Score: 67-44

[10:11] Team_094 possession (Score: 67-44)
Kobe Bryant drives, picks up Kyle Brogdon. Help arrives from Miles Sabonis! Kobe Bryant attempts a Layup. Contested by Miles Sabonis (5.1 feet, MAN). Kobe Bryant misses. Rebound secured by Kyle Brogdon.

[09:59] Team_009 possession (Score: 67-44)
Desmond Harden attempts a 3Pt. Contested by Kobe Wagner (4.2 feet, ZONE). DESMOND HARDEN MAKES IT! Assist: Miles Sabonis
Score: 70-44

[09:43] Team_094 possession (Score: 70-44)
Kobe Bryant drives to the basket... Kobe Bryant loses control! Ball rolls out of bounds! TURNOVER! (dead ball)

[09:25] Team_009 possession (Score: 70-44)
Cole Mitchell attempts a 3Pt. Contested by Kobe Wagner (4.1 feet, ZONE). Cole Mitchell misses. Rebound secured by Kobe Bryant.

[09:11] Team_094 possession (Score: 70-44)
Kobe Bryant drives, Kyle Brogdon stays with him. Kobe Bryant attempts a Layup. Contested by Kyle Brogdon (5.1 feet, MAN). KOBE BRYANT MAKES IT! Assist: Terry Ingram
Score: 70-46

[08:55] Team_009 possession (Score: 70-46)
Kyle Brogdon drives and kicks out. Anfernee Anunoby attempts a 3Pt. Contested by Kobe Wagner (4.1 feet, ZONE). Anfernee Anunoby misses. Rebound secured by Kobe Bryant.

[08:41] Team_094 possession (Score: 70-46)
Terry Ingram attempts a 3Pt. Contested by Desmond Harden (5.2 feet, ZONE). Terry Ingram misses. Rebound secured by Kyle Brogdon.

[08:25] Team_009 possession (Score: 70-46)
Cole Mitchell attempts a 3Pt. Contested by Kobe Wagner (4.1 feet, ZONE). Cole Mitchell misses. Rebound secured by Kobe Bryant.

[08:08] Team_094 possession (Score: 70-46)
Terry Ingram attempts a 3Pt. Contested by Miles Sabonis (5.6 feet, MAN). Terry Ingram misses. FOUL! Loose ball foul on Anfernee Anunoby during the rebound battle. [Team fouls: 1] No free throws, side out. (Anfernee Anunoby: 1 personal fouls)

[07:53] Team_094 possession (Score: 70-46)
Tim Russell attempts a 3Pt. Contested by Cole Mitchell (4.6 feet, MAN). Tim Russell misses. Offensive rebound by Kobe Bryant! Kobe Bryant puts it back in!
Score: 70-48

[07:35] Team_009 possession (Score: 70-48)
Anfernee Anunoby attempts a 3Pt. Contested by Kobe Wagner (4.1 feet, MAN). Anfernee Anunoby misses. FOUL! Loose ball foul on Kobe Bryant during the rebound battle. [IN THE BONUS! 5 team fouls] Cole Mitchell to the line for 2 free throws. (Kobe Bryant: 1 personal fouls)   FT 1/2: GOOD   FT 2/2: GOOD Cole Mitchell makes 2/2 from the line.
Score: 72-48

[07:19] Team_094 possession (Score: 72-48)
Tim Russell attempts a Midrange. Contested by Cole Mitchell (4.6 feet, ZONE). Tim Russell misses. Rebound secured by Cole Mitchell.

[07:02] Team_009 possession (Score: 72-48)
Kyle Brogdon drives and kicks out. Desmond Harden attempts a 3Pt. Contested by Lauri Thompson (4.8 feet, MAN). Desmond Harden misses. Rebound secured by Kobe Wagner.

[06:48] Team_094 possession (Score: 72-48)
Kobe Wagner attempts a 3Pt. Contested by Miles Sabonis (5.7 feet, ZONE). Kobe Wagner misses. Rebound secured by Anfernee Anunoby.

[06:35] Team_009 possession (Score: 72-48)
Cole Mitchell attempts a 3Pt. Contested by Terry Ingram (4.6 feet, ZONE). Cole Mitchell misses. Offensive rebound by Cole Mitchell! Cole Mitchell kicks it out.

[06:18] Team_009 possession (Score: 72-48)
Desmond Harden attempts a 3Pt. Contested by Kobe Wagner (4.2 feet, ZONE). Desmond Harden misses. Offensive rebound by Cole Mitchell! Cole Mitchell kicks it out.

[06:06] Team_009 possession (Score: 72-48)
FOUL! Holding foul on Tim Russell. [IN THE BONUS! 6 team fouls] Cole Mitchell to the line for 2 free throws. (Tim Russell: 2 personal fouls)   FT 1/2: GOOD   FT 2/2: GOOD Cole Mitchell makes 2/2 from the line.
Score: 74-48

[05:51] Team_094 possession (Score: 74-48)
Lauri Thompson attempts a 3Pt. Contested by Desmond Harden (5.2 feet, MAN). Lauri Thompson misses. Rebound secured by Cole Mitchell.

[05:36] Team_009 possession (Score: 74-48)
FOUL! Reach-in foul on Tim Russell during the drive. [IN THE BONUS! 7 team fouls] Cole Mitchell to the line for 2 free throws. (Tim Russell: 3 personal fouls)   FT 1/2: MISS   FT 2/2: MISS Cole Mitchell makes 0/2 from the line. Rebound secured by Tim Russell.

[05:24] Team_094 possession (Score: 74-48)
Kobe Bryant attempts a 3Pt. Contested by Miles Sabonis (5.5 feet, ZONE). Kobe Bryant misses. Rebound secured by Cole Mitchell.

[05:07] Team_009 possession (Score: 74-48)
Miles Sabonis drives to the basket... Miles Sabonis loses control! Ball rolls out of bounds! TURNOVER! (dead ball)

[04:55] Team_094 possession (Score: 74-48)
Terry Ingram attempts a Midrange. BLOCKED BY MILES SABONIS! Ball is loose! Rebound secured by Cole Mitchell.

[04:37] Team_009 possession (Score: 74-48)
Desmond Harden attempts a Midrange. Contested by Lauri Thompson (4.9 feet, MAN). DESMOND HARDEN MAKES IT! Assist: Anfernee Anunoby
Score: 76-48

[04:20] Team_094 possession (Score: 76-48)
Terry Ingram drives and kicks out. FOUL! Shooting foul on Miles Sabonis. Lauri Thompson to the line for 3 free throws. [Team fouls: 2] (Miles Sabonis: 1 personal fouls)   FT 1/3: GOOD   FT 2/3: GOOD   FT 3/3: GOOD Lauri Thompson makes 3/3 from the line.
Score: 76-51

[04:06] Team_009 possession (Score: 76-51)
Desmond Harden attempts a 3Pt. Contested by Kobe Wagner (4.2 feet, ZONE). Desmond Harden misses. FOUL! Loose ball foul on Tim Russell during the rebound battle. [IN THE BONUS! 8 team fouls] Kyle Brogdon to the line for 2 free throws. (Tim Russell: 4 personal fouls)   FT 1/2: GOOD   FT 2/2: MISS Kyle Brogdon makes 1/2 from the line. Rebound secured by Kobe Bryant.
Score: 77-51

[03:49] Team_094 possession (Score: 77-51)
Terry Ingram makes the Dunk and draws the foul on Kyle Brogdon! And-1! Terry Ingram to the line for 1. [Team fouls: 3] (Kyle Brogdon: 1 personal fouls)   FT 1/1: GOOD Terry Ingram makes 1/1 from the line.
Score: 77-54

[03:32] Team_009 possession (Score: 77-54)
Cole Mitchell makes the Layup and draws the foul on Lauri Thompson! And-1! Cole Mitchell to the line for 1. [BONUS: 9 team fouls] (Lauri Thompson: 2 personal fouls)   FT 1/1: GOOD Cole Mitchell makes 1/1 from the line.
Score: 80-54

[03:17] Team_094 possession (Score: 80-54)
Lauri Thompson attempts a 3Pt. Contested by Desmond Harden (5.4 feet, MAN). LAURI THOMPSON MAKES IT! Assist: Terry Ingram
Score: 80-57

[02:59] Team_009 possession (Score: 80-57)
Cole Mitchell attempts a 3Pt. Contested by Kobe Wagner (4.2 feet, ZONE). Cole Mitchell misses. Rebound secured by Kobe Bryant.

[02:45] Team_094 possession (Score: 80-57)
Kobe Bryant attempts a Midrange. Contested by Kyle Brogdon (5.3 feet, MAN). Kobe Bryant misses. Rebound secured by Kyle Brogdon.

[02:31] Team_009 possession (Score: 80-57)
Miles Sabonis attempts a 3Pt. Contested by Kobe Wagner (4.2 feet, ZONE). Miles Sabonis misses. Offensive rebound by Cole Mitchell! Cole Mitchell kicks it out.

[02:14] Team_009 possession (Score: 80-57)
Anfernee Anunoby attempts a Midrange. Contested by Kobe Wagner (4.3 feet, MAN). Anfernee Anunoby misses. Offensive rebound by Kyle Brogdon! Kyle Brogdon puts it back in!
Score: 82-57

[02:03] Team_094 possession (Score: 82-57)
Tim Russell attempts a Layup. Contested by Cole Mitchell (4.9 feet, MAN). Tim Russell misses. Rebound secured by Kyle Brogdon.

[01:53] Team_009 possession (Score: 82-57)
Desmond Harden drives and kicks out. Anfernee Anunoby attempts a 3Pt. Contested by Kobe Wagner (4.4 feet, MAN). Anfernee Anunoby misses. Offensive rebound by Kyle Brogdon! Kyle Brogdon puts it back in!
Score: 84-57

[01:40] Team_094 possession (Score: 84-57)
Kobe Wagner makes the Dunk and draws the foul on Anfernee Anunoby! And-1! Kobe Wagner to the line for 1. [Team fouls: 4] (Anfernee Anunoby: 2 personal fouls)   FT 1/1: MISS Kobe Wagner makes 0/1 from the line. Rebound secured by Anfernee Anunoby.
Score: 84-59

[01:23] Team_009 possession (Score: 84-59)
Desmond Harden attempts a Midrange. Contested by Lauri Thompson (5.1 feet, ZONE). Desmond Harden misses. Rebound secured by Tim Russell.

[01:12] Team_094 possession (Score: 84-59)
Kobe Bryant attempts a Layup. Contested by Kyle Brogdon (5.5 feet, ZONE). KOBE BRYANT MAKES IT! Assist: Kobe Wagner
Score: 84-61

[00:54] Team_009 possession (Score: 84-61)
Miles Sabonis drives, picks up Terry Ingram. Help arrives from Kobe Wagner! Miles Sabonis attempts a Dunk. Contested by Kobe Wagner (5.0 feet, MAN). MILES SABONIS MAKES IT! Assist: Anfernee Anunoby
Score: 86-61

[00:43] Team_094 possession (Score: 86-61)
Terry Ingram attempts a Midrange. Contested by Anfernee Anunoby (5.8 feet, ZONE). TERRY INGRAM MAKES IT!
Score: 86-63

[00:29] Team_009 possession (Score: 86-63)
Desmond Harden drives to the basket... Desmond Harden throws a bad pass! Stolen by Lauri Thompson! TURNOVER! (live ball)

[00:14] Team_094 possession (Score: 86-63)
Tim Russell drives, Kyle Brogdon stays with him. Tim Russell attempts a Layup. Contested by Kyle Brogdon (5.5 feet, ZONE). TIM RUSSELL MAKES IT! Assist: Lauri Thompson
Score: 86-65

================================================================================
                              3RD QUARTER COMPLETE                              
================================================================================

3RD QUARTER SCORE: Team_009 25, Team_094 26

BOX SCORE:
================================================================================

Team_009
--------------------------------------------------------------------------------
Player                MIN  PTS  REB  AST  TO      FG   FG%      3P   3P%
--------------------------------------------------------------------------------
Desmond Harden         26    8    0    0   0   3/5    60.0     0/0   0.0
Cole Mitchell          26    7    7    0   0   3/7    42.9     0/0   0.0
Miles Sabonis          26    4    0    1   0   2/2   100.0     0/0   0.0
Kyle Brogdon           26    4    7    0   0   2/4    50.0     0/0   0.0
Anfernee Anunoby       26    1    2    2   0   1/2    50.0     0/0   0.0

TEAM: FG: 11/20 (55.0%), 3PT: 3/8 (37.5%), REB: 17 (6 off, 11 def), AST: 3, TO: 2
TEAM FOULS: 4


Team_094
--------------------------------------------------------------------------------
Player                MIN  PTS  REB  AST  TO      FG   FG%      3P   3P%
--------------------------------------------------------------------------------
Lauri Thompson         26    9    0    1   0   3/4    75.0     0/0   0.0
Kobe Bryant            26    6    8    0   0   3/7    42.9     0/0   0.0
Terry Ingram           26    5    0    3   0   2/4    50.0     0/0   0.0
Tim Russell            26    4    2    0   0   2/4    50.0     0/0   0.0
Kobe Wagner            26    0    1    1   0   0/2     0.0     0/0   0.0

TEAM: FG: 10/21 (47.6%), 3PT: 3/7 (42.9%), REB: 10 (2 off, 8 def), AST: 5, TO: 1
TEAM FOULS: 9 [Team_009 in BONUS]

================================================================================

================================================================================
                       4TH QUARTER - Team_009 vs Team_094                       
================================================================================

[12:00] Team_009 possession (Score: 86-65)
FOUL! Shooting foul on Kobe Wagner. Anfernee Anunoby to the line for 3 free throws. [Team fouls: 1] (Kobe Wagner: 1 personal fouls)   FT 1/3: GOOD   FT 2/3: MISS   FT 3/3: GOOD Anfernee Anunoby makes 2/3 from the line.
Score: 88-65

[11:43] Team_094 possession (Score: 88-65)
FOUL! Shooting foul on Desmond Harden. Lauri Thompson to the line for 2 free throws. [Team fouls: 1] (Desmond Harden: 1 personal fouls)   FT 1/2: GOOD   FT 2/2: MISS Lauri Thompson makes 1/2 from the line. Offensive rebound by Tim Russell! Tim Russell kicks it out.
Score: 88-66

[11:30] Team_094 possession (Score: 88-66)
Terry Ingram drives and kicks out. FOUL! Shooting foul on Miles Sabonis. Terry Ingram to the line for 2 free throws. [Team fouls: 2] (Miles Sabonis: 1 personal fouls)   FT 1/2: MISS   FT 2/2: GOOD Terry Ingram makes 1/2 from the line.
Score: 88-67

[11:20] Team_009 possession (Score: 88-67)
Cole Mitchell drives, Tim Russell stays with him. Cole Mitchell attempts a Layup. Contested by Tim Russell (5.0 feet, ZONE). COLE MITCHELL MAKES IT! Assist: Anfernee Anunoby
Score: 90-67

[11:08] Team_094 possession (Score: 90-67)
Tim Russell attempts a Midrange. Contested by Cole Mitchell (5.1 feet, MAN). TIM RUSSELL MAKES IT! Assist: Terry Ingram
Score: 90-69

[10:54] Team_009 possession (Score: 90-69)
Anfernee Anunoby attempts a 3Pt. Contested by Kobe Wagner (4.5 feet, MAN). Anfernee Anunoby misses. Rebound secured by Kobe Bryant.

[10:37] Team_094 possession (Score: 90-69)
Kobe Wagner attempts a 3Pt. Contested by Anfernee Anunoby (5.9 feet, MAN). Kobe Wagner misses. Rebound secured by Cole Mitchell.

[10:24] Team_009 possession (Score: 90-69)
Anfernee Anunoby attempts a Layup. BLOCKED BY KOBE WAGNER! Ball deflects out of bounds off Anfernee Anunoby.

[10:07] Team_094 possession (Score: 90-69)
FOUL! Reach-in foul on Kyle Brogdon during the drive. [Team fouls: 3] No free throws, side out. (Kyle Brogdon: 1 personal fouls)

[09:54] Team_094 possession (Score: 90-69)
Kobe Bryant drives, Kyle Brogdon stays with him. Kobe Bryant attempts a Layup. Contested by Kyle Brogdon (5.7 feet, MAN). Kobe Bryant misses. FOUL! Loose ball foul on Anfernee Anunoby during the rebound battle. [Team fouls: 4] No free throws, side out. (Anfernee Anunoby: 1 personal fouls)

[09:38] Team_094 possession (Score: 90-69)
Kobe Bryant drives and kicks out. Lauri Thompson attempts a Midrange. Contested by Desmond Harden (5.5 feet, ZONE). LAURI THOMPSON MAKES IT! Assist: Tim Russell
Score: 90-71

[09:27] Team_009 possession (Score: 90-71)
Kyle Brogdon drives to the basket... Kyle Brogdon commits a violation (traveling/carry)! TURNOVER! (dead ball)

[09:27] Substitution (Team_009): Miles Sabonis OUT → Paul Trent IN (stamina_rule2)

[09:27] Substitution (Team_009): Desmond Harden OUT → Evan Curry IN (stamina_rule2)

[09:27] Substitution (Team_009): Anfernee Anunoby OUT → RJ Jokic IN (stamina_rule2)

[09:27] Substitution (Team_009): Cole Mitchell OUT → Kawhi Herro IN (stamina_rule2)

[09:27] Substitution (Team_009): Kyle Brogdon OUT → Shaquille Green IN (stamina_rule2)

[09:27] Substitution (Team_094): Terry Ingram OUT → Shaquille Bryant IN (stamina_rule2)

[09:27] Substitution (Team_094): Lauri Thompson OUT → Kevin Rozier IN (stamina_rule2)

[09:27] Substitution (Team_094): Kobe Wagner OUT → Ayo Gasol IN (stamina_rule2)

[09:27] Substitution (Team_094): Tim Russell OUT → Domantas Haliburton IN (stamina_rule2)

[09:27] Substitution (Team_094): Kobe Bryant OUT → Isaiah Quickley IN (stamina_rule2)

[09:13] Team_094 possession (Score: 90-71)
FOUL! Shooting foul on Paul Trent. Shaquille Bryant to the line for 2 free throws. [BONUS: 5 team fouls] (Paul Trent: 1 personal fouls)   FT 1/2: GOOD   FT 2/2: GOOD Shaquille Bryant makes 2/2 from the line.
Score: 90-73

[09:01] Team_009 possession (Score: 90-73)
RJ Jokic attempts a 3Pt. Contested by Ayo Gasol (4.7 feet, MAN). RJ Jokic misses. Rebound secured by Domantas Haliburton.

[08:51] Team_094 possession (Score: 90-73)
FOUL! Holding foul on Paul Trent. [IN THE BONUS! 6 team fouls] Shaquille Bryant to the line for 2 free throws. (Paul Trent: 2 personal fouls)   FT 1/2: GOOD   FT 2/2: GOOD Shaquille Bryant makes 2/2 from the line.
Score: 90-75

[08:33] Team_009 possession (Score: 90-75)
Kawhi Herro attempts a Layup. Contested by Domantas Haliburton (5.9 feet, ZONE). KAWHI HERRO MAKES IT!
Score: 92-75

[08:19] Team_094 possession (Score: 92-75)
Ayo Gasol drives, Kawhi Herro stays with him. Ayo Gasol attempts a Dunk. Contested by Kawhi Herro (3.9 feet, ZONE). AYO GASOL MAKES IT! Assist: Isaiah Quickley
Score: 92-77

[08:08] Team_009 possession (Score: 92-77)
Kawhi Herro drives, Isaiah Quickley stays with him. Kawhi Herro attempts a Dunk. Wide open! Isaiah Quickley is 6.2 feet away. [ZONE] KAWHI HERRO MAKES IT!
Score: 94-77

[07:53] Team_094 possession (Score: 94-77)
Ayo Gasol throws a bad pass out of bounds! TURNOVER! (dead ball)

[07:37] Team_009 possession (Score: 94-77)
RJ Jokic attempts a Midrange. Contested by Ayo Gasol (4.7 feet, MAN). RJ Jokic misses. Offensive rebound by Kawhi Herro! Kawhi Herro's putback is no good. Rebound secured by Isaiah Quickley.

[07:22] Team_094 possession (Score: 94-77)
FOUL! Holding foul on Evan Curry. [IN THE BONUS! 7 team fouls] Kevin Rozier to the line for 2 free throws. (Evan Curry: 1 personal fouls)   FT 1/2: MISS   FT 2/2: GOOD Kevin Rozier makes 1/2 from the line.
Score: 94-78

[07:07] Team_009 possession (Score: 94-78)
Paul Trent attempts a Midrange. Contested by Ayo Gasol (4.2 feet, ZONE). PAUL TRENT MAKES IT! Assist: Evan Curry
Score: 96-78

[06:51] Team_094 possession (Score: 96-78)
Domantas Haliburton drives, picks up Kawhi Herro. Help arrives from Paul Trent! Domantas Haliburton attempts a Layup. Contested by Paul Trent (3.7 feet, MAN). Domantas Haliburton misses. Rebound secured by RJ Jokic.

[06:32] Team_009 possession (Score: 96-78)
RJ Jokic drives, Isaiah Quickley stays with him. RJ Jokic attempts a Dunk. Contested by Isaiah Quickley (5.8 feet, ZONE). RJ Jokic misses. Rebound secured by Domantas Haliburton.

[06:22] Team_094 possession (Score: 96-78)
Domantas Haliburton attempts a Layup. BLOCKED BY KAWHI HERRO! Ball is loose! Rebound secured by RJ Jokic.

[06:11] Team_009 possession (Score: 96-78)
RJ Jokic drives and kicks out. Shaquille Green attempts a 3Pt. Wide open! Isaiah Quickley is 6.1 feet away. [MAN] Shaquille Green misses. Rebound secured by Ayo Gasol.

[05:58] Team_094 possession (Score: 96-78)
Kevin Rozier attempts a Midrange. Contested by Evan Curry (5.8 feet, MAN). Kevin Rozier misses. Offensive rebound by Domantas Haliburton! Domantas Haliburton kicks it out.

[05:43] Team_094 possession (Score: 96-78)
FOUL! Shooting foul on Kawhi Herro. Ayo Gasol to the line for 2 free throws. [BONUS: 8 team fouls] (Kawhi Herro: 1 personal fouls)   FT 1/2: GOOD   FT 2/2: GOOD Ayo Gasol makes 2/2 from the line.
Score: 96-80

[05:25] Team_009 possession (Score: 96-80)
Shaquille Green attempts a Layup. Wide open! Isaiah Quickley is 6.2 feet away. [ZONE] SHAQUILLE GREEN MAKES IT!
Score: 98-80

[05:06] Team_094 possession (Score: 98-80)
Kevin Rozier attempts a Midrange. Contested by RJ Jokic (5.0 feet, ZONE). Kevin Rozier misses. Rebound secured by Shaquille Green.

[04:50] Team_009 possession (Score: 98-80)
Evan Curry drives to the basket... Evan Curry loses the ball! Stripped by Isaiah Quickley! TURNOVER! (live ball)

[04:31] Team_094 possession (Score: 98-80)
Shaquille Bryant drives and kicks out. Domantas Haliburton attempts a Midrange. Contested by Kawhi Herro (3.6 feet, MAN). Domantas Haliburton misses. Offensive rebound by Domantas Haliburton! Domantas Haliburton kicks it out.

[04:16] Team_094 possession (Score: 98-80)
Domantas Haliburton attempts a Layup. Contested by Kawhi Herro (3.7 feet, ZONE). Domantas Haliburton misses. Rebound secured by Shaquille Green.

[04:00] Team_009 possession (Score: 98-80)
Paul Trent drives to the basket... Paul Trent throws a bad pass! Stolen by Shaquille Bryant! TURNOVER! (live ball)

[03:45] Team_094 possession (Score: 98-80)
Shaquille Bryant drives and kicks out. Shaquille Bryant attempts a Midrange. Contested by Paul Trent (5.6 feet, MAN). Shaquille Bryant misses. Rebound secured by Shaquille Green.

[03:30] Team_009 possession (Score: 98-80)
RJ Jokic attempts a Midrange. Contested by Ayo Gasol (4.7 feet, MAN). RJ Jokic misses. Rebound secured by Ayo Gasol.

[03:17] Team_094 possession (Score: 98-80)
Kevin Rozier drives, Evan Curry stays with him. Kevin Rozier attempts a Layup. Contested by Evan Curry (5.8 feet, MAN). Kevin Rozier misses. Rebound secured by Shaquille Green.

[03:02] Team_009 possession (Score: 98-80)
Evan Curry attempts a 3Pt. Contested by Kevin Rozier (5.1 feet, MAN). Evan Curry misses. Rebound secured by Isaiah Quickley.

[02:48] Team_094 possession (Score: 98-80)
Shaquille Bryant attempts a Midrange. Contested by RJ Jokic (4.1 feet, ZONE). Shaquille Bryant misses. Offensive rebound by Domantas Haliburton! Domantas Haliburton kicks it out.

[02:33] Team_094 possession (Score: 98-80)
Domantas Haliburton attempts a Layup. Contested by Kawhi Herro (3.7 feet, ZONE). Domantas Haliburton misses. Offensive rebound by Isaiah Quickley! Isaiah Quickley kicks it out.

[02:21] Team_094 possession (Score: 98-80)
FOUL! Reach-in foul on Kawhi Herro during the drive. [IN THE BONUS! 9 team fouls] Isaiah Quickley to the line for 2 free throws. (Kawhi Herro: 2 personal fouls)   FT 1/2: GOOD   FT 2/2: GOOD Isaiah Quickley makes 2/2 from the line.
Score: 98-82

[02:08] Team_009 possession (Score: 98-82)
Shaquille Green attempts a Layup. Wide open! Domantas Haliburton is 6.0 feet away. [ZONE] SHAQUILLE GREEN MAKES IT!
Score: 100-82

[01:53] Team_094 possession (Score: 100-82)
FOUL! Holding foul on Kawhi Herro. [IN THE BONUS! 10 team fouls] Domantas Haliburton to the line for 2 free throws. (Kawhi Herro: 3 personal fouls)   FT 1/2: GOOD   FT 2/2: GOOD Domantas Haliburton makes 2/2 from the line.
Score: 100-84

[01:40] Team_009 possession (Score: 100-84)
Evan Curry attempts a 3Pt. Contested by Domantas Haliburton (6.0 feet, ZONE). Evan Curry misses. Offensive rebound by Kawhi Herro! Kawhi Herro puts it back in!
Score: 102-84

[01:25] Team_094 possession (Score: 102-84)
FOUL! Holding foul on Evan Curry. [IN THE BONUS! 11 team fouls] Kevin Rozier to the line for 2 free throws. (Evan Curry: 2 personal fouls)   FT 1/2: MISS   FT 2/2: GOOD Kevin Rozier makes 1/2 from the line.
Score: 102-85

[01:10] Team_009 possession (Score: 102-85)
Shaquille Green drives, Isaiah Quickley stays with him. Shaquille Green attempts a Dunk. Wide open! Isaiah Quickley is 6.3 feet away. [MAN] Shaquille Green misses. Rebound secured by Isaiah Quickley.

[00:53] Team_094 possession (Score: 102-85)
Shaquille Bryant attempts a 3Pt. Contested by Paul Trent (5.4 feet, ZONE). Shaquille Bryant misses. Offensive rebound by Isaiah Quickley! Isaiah Quickley kicks it out.

[00:35] Team_094 possession (Score: 102-85)
Kevin Rozier attempts a 3Pt. Wide open! Paul Trent is 6.2 feet away. [ZONE] Kevin Rozier misses. Rebound secured by Shaquille Green.

[00:21] Team_009 possession (Score: 102-85)
Paul Trent attempts a Layup. Contested by Shaquille Bryant (4.8 feet, MAN). Paul Trent misses. Offensive rebound by Kawhi Herro! Kawhi Herro puts it back in!
Score: 104-85

[00:07] Team_094 possession (Score: 104-85)
Kevin Rozier attempts a 3Pt. Contested by RJ Jokic (5.0 feet, ZONE). KEVIN ROZIER MAKES IT! Assist: Shaquille Bryant
Score: 104-88

================================================================================
                              4TH QUARTER COMPLETE                              
================================================================================

4TH QUARTER SCORE: Team_009 18, Team_094 23

BOX SCORE:
================================================================================

Team_009
--------------------------------------------------------------------------------
Player                MIN  PTS  REB  AST  TO      FG   FG%      3P   3P%
--------------------------------------------------------------------------------
Kawhi Herro            20    8    2    0   0   4/4   100.0     0/0   0.0
Shaquille Green        20    4    5    0   0   2/3    66.7     0/0   0.0
Anfernee Anunoby       29    2    0    1   0   1/3    33.3     0/0   0.0
Cole Mitchell          29    2    1    0   0   1/1   100.0     0/0   0.0
Paul Trent             20    2    0    0   0   1/1   100.0     0/0   0.0
RJ Jokic               20    0    2    0   0   0/5     0.0     0/0   0.0
Evan Curry             20    0    0    1   0   0/1     0.0     0/0   0.0

TEAM: FG: 9/18 (50.0%), 3PT: 2/5 (40.0%), REB: 11 (3 off, 8 def), AST: 2, TO: 3
TEAM FOULS: 11 [Team_094 in BONUS]


Team_094
--------------------------------------------------------------------------------
Player                MIN  PTS  REB  AST  TO      FG   FG%      3P   3P%
--------------------------------------------------------------------------------
Kevin Rozier           20    5    0    0   0   3/6    50.0     0/0   0.0
Shaquille Bryant       20    4    0    1   0   2/3    66.7     0/0   0.0
Ayo Gasol              20    4    2    0   0   2/2   100.0     0/0   0.0
Tim Russell            29    2    1    1   0   1/1   100.0     0/0   0.0
Lauri Thompson         29    2    0    0   0   1/1   100.0     0/0   0.0
Domantas Haliburton    20    2    5    0   0   1/4    25.0     0/0   0.0
Isaiah Quickley        20    2    5    1   0   1/1   100.0     0/0   0.0
Terry Ingram           29    1    0    1   0   1/1   100.0     0/0   0.0
Kobe Bryant            29    0    2    0   0   0/0     0.0     0/0   0.0
Kobe Wagner            29    0    0    0   0   0/1     0.0     0/0   0.0

TEAM: FG: 12/20 (60.0%), 3PT: 1/3 (33.3%), REB: 14 (7 off, 7 def), AST: 4, TO: 1
TEAM FOULS: 1

================================================================================

================================================================================
                               FULL GAME COMPLETE                               
================================================================================

FINAL SCORE: Team_009 104, Team_094 88

SCORING BY QUARTER:
--------------------------------------------------------------------------------
Team                     Q1     Q2     Q3     Q4    FINAL
--------------------------------------------------------------------------------
Team_009                 34     27     25     18      104
Team_094                 21     18     26     23       88
--------------------------------------------------------------------------------

FULL GAME BOX SCORE:
================================================================================

Team_009
--------------------------------------------------------------------------------
Player                MIN  PTS  REB  AST  TO      FG   FG%      3P   3P%      FT STL BLK
--------------------------------------------------------------------------------
Miles Sabonis          29    9    0    2   1   4/7    57.1   2/3    66.7   2/3     0   1
Desmond Harden         29   12    0    3   0   6/10   60.0   1/3    33.3   4/6     0   0
Anfernee Anunoby       29   12    8    3   1   8/11   72.7   5/7    71.4   3/5     0   0
Cole Mitchell          29   15   11    1   3   6/10   60.0   0/3     0.0   7/9     0   0
Kyle Brogdon           29   16   15    1   1   3/6    50.0   0/0     0.0   6/7     0   0
Paul Trent             20    2    0    1   1   2/3    66.7   0/1     0.0   0/0     0   0
Evan Curry             20    3    0    3   0   2/4    50.0   1/3    33.3   1/1     0   0
RJ Jokic               20    8    3    0   0   3/12   25.0   3/8    37.5   3/5     0   0
Kawhi Herro            20   10    7    0   1   2/4    50.0   0/2     0.0   0/0     1   1
Shaquille Green        20   14    9    0   1   6/7    85.7   1/1   100.0   1/1     2   0

TEAM: FG: 44/76 (57.9%), 3PT: 13/31 (41.9%), REB: 55 (18 off, 37 def), AST: 14, TO: 9


Team_094
--------------------------------------------------------------------------------
Player                MIN  PTS  REB  AST  TO      FG   FG%      3P   3P%      FT STL BLK
--------------------------------------------------------------------------------
Terry Ingram           29    6    0    6   0   4/8    50.0   0/1     0.0   2/3     0   0
Lauri Thompson         29   21    0    1   2   6/8    75.0   4/6    66.7   7/8     1   0
Kobe Wagner            29    2    1    4   1   1/9    11.1   0/2     0.0   0/3     0   2
Tim Russell            29   12    5    2   0   7/12   58.3   1/2    50.0   0/0     0   0
Kobe Bryant            29   10   14    1   0   5/10   50.0   0/2     0.0   0/0     0   0
Shaquille Bryant       20   10    0    2   1   3/5    60.0   2/3    66.7   4/4     1   1
Kevin Rozier           20    9    0    2   0   3/7    42.9   1/3    33.3   2/4     0   0
Ayo Gasol              20    8    4    0   1   4/4   100.0   0/0     0.0   2/2     0   0
Domantas Haliburton    20    2    8    2   2   0/4     0.0   0/0     0.0   2/2     0   0
Isaiah Quickley        20    4    9    2   1   2/5    40.0   0/1     0.0   3/4     1   0

TEAM: FG: 39/76 (51.3%), 3PT: 8/20 (40.0%), REB: 39 (10 off, 29 def), AST: 22, TO: 8

================================================================================
