================================================================================
                        FULL GAME - Team_085 vs Team_025                        
================================================================================

================================================================================
                       1ST QUARTER - Team_085 vs Team_025                       
================================================================================

[12:00] Team_085 possession (Score: 0-0)
Paul Wagner attempts a 3Pt. Contested by Ben Giddey (3.9 feet, ZONE). PAUL WAGNER MAKES IT! Assist: Stephen Bird
Score: 3-0

[11:45] Team_025 possession (Score: 3-0)
Desmond Jordan drives, picks up Collin Mobley. Help arrives from Magic Beal! Desmond Jordan attempts a Dunk. Contested by Magic Beal (4.1 feet, ZONE). DESMOND JORDAN MAKES IT!
Score: 3-2

[11:32] Team_085 possession (Score: 3-2)
Stephen Bird attempts a Midrange. Contested by Ben Giddey (3.9 feet, MAN). STEPHEN BIRD MAKES IT!
Score: 5-2

[11:16] Team_025 possession (Score: 5-2)
FOUL! Reach-in foul on Larry Duncan during the drive. [Team fouls: 1] No free throws, side out. (Larry Duncan: 1 personal fouls)

[11:04] Team_025 possession (Score: 5-2)
Desmond Jordan attempts a 3Pt. Contested by Magic Beal (4.2 feet, ZONE). Desmond Jordan misses. Rebound secured by Collin Mobley.

[10:51] Team_085 possession (Score: 5-2)
Larry Duncan attempts a Midrange. Contested by Cade Anthony (4.6 feet, ZONE). LARRY DUNCAN MAKES IT!
Score: 7-2

[10:37] Team_025 possession (Score: 7-2)
Ben Giddey makes the 3Pt and draws the foul on Stephen Bird! And-1! Ben Giddey to the line for 1. [Team fouls: 2] (Stephen Bird: 1 personal fouls)   FT 1/1: GOOD Ben Giddey makes 1/1 from the line.
Score: 7-6

[10:23] Team_085 possession (Score: 7-6)
Collin Mobley attempts a Layup. Contested by Allen Embiid (2.8 feet, MAN). COLLIN MOBLEY MAKES IT! Assist: Magic Beal
Score: 9-6

[10:06] Team_025 possession (Score: 9-6)
Ben Giddey drives and kicks out. Paolo Lowry attempts a 3Pt. Contested by Magic Beal (4.0 feet, ZONE). Paolo Lowry misses. Rebound secured by Paul Wagner.

[09:50] Team_085 possession (Score: 9-6)
Paul Wagner drives to the basket... Paul Wagner loses the ball! Stripped by Cade Anthony! TURNOVER! (live ball)

[09:37] Team_025 possession (Score: 9-6)
Ben Giddey attempts a Midrange. Contested by Stephen Bird (3.8 feet, ZONE). BEN GIDDEY MAKES IT! Assist: Allen Embiid
Score: 9-8

[09:22] Team_085 possession (Score: 9-8)
Magic Beal drives and kicks out. Magic Beal attempts a 3Pt. Contested by Ben Giddey (3.6 feet, ZONE). Magic Beal misses. Rebound secured by Allen Embiid.

[09:09] Team_025 possession (Score: 9-8)
Allen Embiid attempts a 3Pt. Contested by Collin Mobley (4.0 feet, MAN). ALLEN EMBIID MAKES IT! Assist: Cade Anthony
Score: 9-11

[08:57] Team_085 possession (Score: 9-11)
Paul Wagner attempts a 3Pt. Contested by Cade Anthony (4.5 feet, MAN). Paul Wagner misses. Rebound secured by Allen Embiid.

[08:46] Team_025 possession (Score: 9-11)
Cade Anthony attempts a 3Pt. Contested by Paul Wagner (4.2 feet, ZONE). Cade Anthony misses. Rebound secured by Larry Duncan.

[08:32] Team_085 possession (Score: 9-11)
Magic Beal attempts a 3Pt. Contested by Ben Giddey (4.0 feet, ZONE). Magic Beal misses. Offensive rebound by Paul Wagner! Paul Wagner kicks it out.

[08:19] Team_085 possession (Score: 9-11)
Magic Beal drives and kicks out. Stephen Bird attempts a Midrange. Contested by Desmond Jordan (3.3 feet, ZONE). STEPHEN BIRD MAKES IT!
Score: 11-11

[08:05] Team_025 possession (Score: 11-11)
Ben Giddey loses the ball! Stripped by Stephen Bird! TURNOVER! (live ball)

[07:51] Team_085 possession (Score: 11-11)
Magic Beal drives to the basket... Magic Beal throws a bad pass! Stolen by Allen Embiid! TURNOVER! (live ball)

[07:40] Team_025 possession (Score: 11-11)
FOUL! Reach-in foul on Paul Wagner during the drive. [Team fouls: 3] No free throws, side out. (Paul Wagner: 1 personal fouls)

[07:24] Team_025 possession (Score: 11-11)
Desmond Jordan drives, Paul Wagner stays with him. Desmond Jordan attempts a Layup. Contested by Paul Wagner (3.7 feet, ZONE). Desmond Jordan misses. Rebound secured by Collin Mobley.

[07:07] Team_085 possession (Score: 11-11)
Collin Mobley attempts a Midrange. Contested by Allen Embiid (2.8 feet, MAN). Collin Mobley misses. Rebound secured by Cade Anthony.

[06:54] Team_025 possession (Score: 11-11)
Cade Anthony attempts a 3Pt. Contested by Paul Wagner (4.2 feet, MAN). Cade Anthony misses. Offensive rebound by Desmond Jordan! Desmond Jordan puts it back in!
Score: 11-13

[06:36] Team_085 possession (Score: 11-13)
Stephen Bird attempts a Midrange. Contested by Ben Giddey (3.9 feet, MAN). Stephen Bird misses. Rebound secured by Allen Embiid.

[06:25] Team_025 possession (Score: 11-13)
Paolo Lowry attempts a Layup. Contested by Magic Beal (4.4 feet, MAN). Paolo Lowry misses. Offensive rebound by Allen Embiid! Allen Embiid puts it back in!
Score: 11-15

[06:09] Team_085 possession (Score: 11-15)
Stephen Bird drives to the basket... FOUL! Offensive foul on Stephen Bird! Allen Embiid drew the charge! [Team fouls: 4] (Stephen Bird: 2 personal fouls) TURNOVER! (dead ball)

[05:56] Team_025 possession (Score: 11-15)
Allen Embiid attempts a Midrange. Contested by Collin Mobley (4.0 feet, MAN). Allen Embiid misses. Offensive rebound by Desmond Jordan! Desmond Jordan puts it back in!
Score: 11-17

[05:41] Team_085 possession (Score: 11-17)
FOUL! Reach-in foul on Cade Anthony during the drive. [Team fouls: 1] No free throws, side out. (Cade Anthony: 1 personal fouls)

[05:27] Team_085 possession (Score: 11-17)
Collin Mobley drives, Allen Embiid stays with him. Collin Mobley attempts a Dunk. Contested by Allen Embiid (2.8 feet, MAN). COLLIN MOBLEY MAKES IT! Assist: Magic Beal
Score: 13-17

[05:12] Team_025 possession (Score: 13-17)
Desmond Jordan drives, Larry Duncan stays with him. Desmond Jordan attempts a Dunk. Contested by Larry Duncan (3.2 feet, MAN). Desmond Jordan misses. Rebound secured by Paul Wagner.

[04:57] Team_085 possession (Score: 13-17)
Magic Beal attempts a Midrange. Contested by Paolo Lowry (5.4 feet, MAN). Magic Beal misses. Offensive rebound by Larry Duncan! Larry Duncan kicks it out.

[04:41] Team_085 possession (Score: 13-17)
Paul Wagner attempts a Midrange. Contested by Cade Anthony (4.5 feet, MAN). Paul Wagner misses. Offensive rebound by Larry Duncan! Larry Duncan kicks it out.

[04:31] Team_085 possession (Score: 13-17)
Magic Beal attempts a Layup. BLOCKED BY DESMOND JORDAN! Ball goes out off Desmond Jordan. Magic Beal's ball!

[04:15] Team_085 possession (Score: 13-17)
Magic Beal attempts a Layup. Contested by Allen Embiid (3.5 feet, ZONE). Magic Beal misses. Rebound secured by Allen Embiid.

[04:05] Team_025 possession (Score: 13-17)
Paolo Lowry attempts a 3Pt. Contested by Magic Beal (4.5 feet, MAN). PAOLO LOWRY MAKES IT!
Score: 13-20

[03:53] Team_085 possession (Score: 13-20)
Magic Beal attempts a Midrange. Contested by Cade Anthony (4.7 feet, ZONE). MAGIC BEAL MAKES IT!
Score: 15-20

[03:37] Team_025 possession (Score: 15-20)
Allen Embiid drives and kicks out. Paolo Lowry attempts a 3Pt. Contested by Magic Beal (4.2 feet, MAN). Paolo Lowry misses. Rebound secured by Paul Wagner.

[03:25] Team_085 possession (Score: 15-20)
Magic Beal attempts a Layup. Contested by Allen Embiid (3.6 feet, ZONE). MAGIC BEAL MAKES IT!
Score: 17-20

[03:09] Team_025 possession (Score: 17-20)
Paolo Lowry attempts a 3Pt. Contested by Magic Beal (4.6 feet, MAN). Paolo Lowry misses. Rebound secured by Collin Mobley.

[02:59] Team_085 possession (Score: 17-20)
Collin Mobley attempts a Layup. Contested by Allen Embiid (3.1 feet, MAN). COLLIN MOBLEY MAKES IT!
Score: 19-20

[02:41] Team_025 possession (Score: 19-20)
Cade Anthony drives to the basket... FOUL! Offensive foul on Cade Anthony! Paul Wagner drew the charge! [Team fouls: 2] (Cade Anthony: 2 personal fouls) TURNOVER! (dead ball)

[02:25] Team_085 possession (Score: 19-20)
FOUL! Holding foul on Paolo Lowry. [Team fouls: 3] No free throws, side out. (Paolo Lowry: 1 personal fouls)

[02:11] Team_085 possession (Score: 19-20)
Collin Mobley attempts a Midrange. Contested by Allen Embiid (3.2 feet, MAN). Collin Mobley misses. Rebound secured by Cade Anthony.

[01:59] Team_025 possession (Score: 19-20)
Cade Anthony attempts a Midrange. Contested by Stephen Bird (4.5 feet, ZONE). CADE ANTHONY MAKES IT!
Score: 19-22

[01:45] Team_085 possession (Score: 19-22)
Paul Wagner attempts a 3Pt. Contested by Ben Giddey (4.3 feet, ZONE). Paul Wagner misses. Offensive rebound by Paul Wagner! Paul Wagner kicks it out.

[01:34] Team_085 possession (Score: 19-22)
Larry Duncan attempts a Midrange. Contested by Desmond Jordan (4.1 feet, MAN). LARRY DUNCAN MAKES IT! Assist: Paul Wagner
Score: 21-22

[01:17] Team_025 possession (Score: 21-22)
Allen Embiid commits a violation (traveling/carry)! TURNOVER! (dead ball)

[01:17] Substitution (Team_085): Magic Beal OUT → Khris Brogdon IN (stamina_rule2)

[01:17] Substitution (Team_085): Stephen Bird OUT → Jordan Morant IN (stamina_rule2)

[01:17] Substitution (Team_085): Larry Duncan OUT → Giannis Johnson IN (stamina_rule2)

[01:17] Substitution (Team_085): Paul Wagner OUT → Jalen Leonard IN (stamina_rule2)

[01:17] Substitution (Team_085): Collin Mobley OUT → Malcolm Beal IN (stamina_rule2)

[01:17] Substitution (Team_025): Paolo Lowry OUT → LeBron Griffin IN (stamina_rule2)

[01:17] Substitution (Team_025): Ben Giddey OUT → Dirk Gilgeous-Alexander IN (stamina_rule2)

[01:17] Substitution (Team_025): Desmond Jordan OUT → Immanuel LaVine IN (stamina_rule2)

[01:17] Substitution (Team_025): Cade Anthony OUT → Damian Adebayo IN (stamina_rule2)

[01:17] Substitution (Team_025): Allen Embiid OUT → Nikola Lillard IN (stamina_rule2)

[01:06] Team_085 possession (Score: 21-22)
Jalen Leonard attempts a Layup. Contested by Damian Adebayo (5.3 feet, MAN). Jalen Leonard misses. Rebound secured by Nikola Lillard.

[00:53] Team_025 possession (Score: 21-22)
Damian Adebayo drives to the basket... Damian Adebayo throws a bad pass! Stolen by Malcolm Beal! TURNOVER! (live ball)

[00:41] Team_085 possession (Score: 21-22)
Jordan Morant attempts a 3Pt. Contested by Damian Adebayo (5.1 feet, ZONE). Jordan Morant misses. Offensive rebound by Malcolm Beal! Malcolm Beal kicks it out.

[00:28] Team_085 possession (Score: 21-22)
Malcolm Beal loses the ball! Stripped by Nikola Lillard! TURNOVER! (live ball)

[00:13] Team_025 possession (Score: 21-22)
FOUL! Shooting foul on Malcolm Beal. Damian Adebayo to the line for 2 free throws. [BONUS: 5 team fouls] (Malcolm Beal: 1 personal fouls)   FT 1/2: GOOD   FT 2/2: MISS Damian Adebayo makes 1/2 from the line. Rebound secured by Malcolm Beal.
Score: 21-23

================================================================================
                              1ST QUARTER COMPLETE                              
================================================================================

1ST QUARTER SCORE: Team_085 21, Team_025 23

BOX SCORE:
================================================================================

Team_085
--------------------------------------------------------------------------------
Player                MIN  PTS  REB  AST  TO      FG   FG%      3P   3P%
--------------------------------------------------------------------------------
Collin Mobley          11    6    3    0   0   3/5    60.0     0/0   0.0
Stephen Bird           11    4    0    1   0   2/3    66.7     0/0   0.0
Larry Duncan           11    4    3    0   0   2/2   100.0     0/0   0.0
Magic Beal             11    4    0    2   0   2/4    50.0     0/0   0.0
Paul Wagner            11    3    5    1   0   1/2    50.0     0/0   0.0
Jalen Leonard           1    0    0    0   0   0/1     0.0     0/0   0.0
Malcolm Beal            1    0    2    0   0   0/0     0.0     0/0   0.0

TEAM: FG: 10/17 (58.8%), 3PT: 1/2 (50.0%), REB: 13 (5 off, 8 def), AST: 4, TO: 4
TEAM FOULS: 5 [Team_025 in BONUS]


Team_025
--------------------------------------------------------------------------------
Player                MIN  PTS  REB  AST  TO      FG   FG%      3P   3P%
--------------------------------------------------------------------------------
Desmond Jordan         11    6    2    0   0   3/6    50.0     0/0   0.0
Ben Giddey             11    6    0    0   0   2/3    66.7     0/0   0.0
Allen Embiid           11    5    5    1   0   2/3    66.7     0/0   0.0
Paolo Lowry            11    3    0    0   0   1/2    50.0     0/0   0.0
Cade Anthony           11    2    2    1   0   1/2    50.0     0/0   0.0
Nikola Lillard          1    0    1    0   0   0/0     0.0     0/0   0.0
Damian Adebayo          1    0    0    0   0   0/1     0.0     0/0   0.0

TEAM: FG: 9/17 (52.9%), 3PT: 4/7 (57.1%), REB: 10 (3 off, 7 def), AST: 2, TO: 4
TEAM FOULS: 3

================================================================================

================================================================================
                       2ND QUARTER - Team_085 vs Team_025                       
================================================================================

[12:00] Team_085 possession (Score: 21-23)
Paul Wagner drives to the basket... FOUL! Offensive foul on Paul Wagner! Cade Anthony drew the charge! [Team fouls: 1] (Paul Wagner: 1 personal fouls) TURNOVER! (dead ball)

[11:44] Team_025 possession (Score: 21-23)
Desmond Jordan loses the ball! Stripped by Larry Duncan! TURNOVER! (live ball)

[11:30] Team_085 possession (Score: 21-23)
Larry Duncan attempts a 3Pt. Contested by Desmond Jordan (3.9 feet, MAN). Larry Duncan misses. Rebound secured by Allen Embiid.

[11:16] Team_025 possession (Score: 21-23)
Allen Embiid drives and kicks out. Cade Anthony attempts a Midrange. Contested by Paul Wagner (3.7 feet, ZONE). CADE ANTHONY MAKES IT!
Score: 21-25

[11:01] Team_085 possession (Score: 21-25)
Magic Beal attempts a 3Pt. Contested by Ben Giddey (4.3 feet, ZONE). Magic Beal misses. Rebound secured by Cade Anthony.

[10:45] Team_025 possession (Score: 21-25)
Paolo Lowry attempts a 3Pt. Contested by Magic Beal (4.6 feet, MAN). Paolo Lowry misses. Rebound secured by Paul Wagner.

[10:31] Team_085 possession (Score: 21-25)
Collin Mobley attempts a Layup. Contested by Allen Embiid (3.2 feet, MAN). Collin Mobley misses. Rebound secured by Allen Embiid.

[10:14] Team_025 possession (Score: 21-25)
Allen Embiid drives and kicks out. Paolo Lowry attempts a Midrange. Contested by Stephen Bird (3.9 feet, ZONE). Paolo Lowry misses. FOUL! Loose ball foul on Collin Mobley during the rebound battle. [Team fouls: 2] No free throws, side out. (Collin Mobley: 1 personal fouls)

[09:55] Team_025 possession (Score: 21-25)
Desmond Jordan attempts a Layup. Contested by Paul Wagner (3.9 feet, ZONE). Desmond Jordan misses. Rebound secured by Larry Duncan.

[09:38] Team_085 possession (Score: 21-25)
Collin Mobley attempts a Layup. Contested by Allen Embiid (3.3 feet, MAN). COLLIN MOBLEY MAKES IT! Assist: Magic Beal
Score: 23-25

[09:22] Team_025 possession (Score: 23-25)
FOUL! Reach-in foul on Collin Mobley during the drive. [Team fouls: 3] No free throws, side out. (Collin Mobley: 2 personal fouls)

[09:11] Team_025 possession (Score: 23-25)
FOUL! Holding foul on Magic Beal. [Team fouls: 4] No free throws, side out. (Magic Beal: 1 personal fouls)

[09:00] Team_025 possession (Score: 23-25)
Cade Anthony attempts a 3Pt. Contested by Magic Beal (5.1 feet, ZONE). Cade Anthony misses. Offensive rebound by Allen Embiid! Allen Embiid's putback is no good. Offensive rebound by Allen Embiid! Allen Embiid kicks it out.

[08:47] Team_025 possession (Score: 23-25)
Paolo Lowry attempts a Midrange. Contested by Magic Beal (4.8 feet, MAN). Paolo Lowry misses. Rebound secured by Collin Mobley.

[08:32] Team_085 possession (Score: 23-25)
Collin Mobley drives, Allen Embiid stays with him. Collin Mobley attempts a Layup. Contested by Allen Embiid (3.5 feet, MAN). COLLIN MOBLEY MAKES IT! Assist: Magic Beal
Score: 25-25

[08:18] Team_025 possession (Score: 25-25)
Allen Embiid drives to the basket... Allen Embiid throws a bad pass! Stolen by Paul Wagner! TURNOVER! (live ball)

[08:04] Team_085 possession (Score: 25-25)
Magic Beal attempts a Midrange. Contested by Paolo Lowry (5.8 feet, MAN). Magic Beal misses. FOUL! Loose ball foul on Allen Embiid during the rebound battle. [Team fouls: 1] No free throws, side out. (Allen Embiid: 1 personal fouls)

[07:46] Team_085 possession (Score: 25-25)
Larry Duncan makes the Midrange and draws the foul on Allen Embiid! And-1! Larry Duncan to the line for 1. [Team fouls: 2] (Allen Embiid: 2 personal fouls)   FT 1/1: GOOD Larry Duncan makes 1/1 from the line.
Score: 28-25

[07:31] Team_025 possession (Score: 28-25)
Cade Anthony attempts a 3Pt. Contested by Paul Wagner (4.7 feet, MAN). Cade Anthony misses. Rebound secured by Larry Duncan.

[07:17] Team_085 possession (Score: 28-25)
Collin Mobley makes the Layup and draws the foul on Allen Embiid! And-1! Collin Mobley to the line for 1. [Team fouls: 3] (Allen Embiid: 3 personal fouls)   FT 1/1: GOOD Collin Mobley makes 1/1 from the line.
Score: 31-25

[07:02] Team_025 possession (Score: 31-25)
Desmond Jordan attempts a 3Pt. Contested by Larry Duncan (3.9 feet, MAN). Desmond Jordan misses. Rebound secured by Larry Duncan.

[06:47] Team_085 possession (Score: 31-25)
Stephen Bird attempts a Midrange. Contested by Ben Giddey (4.6 feet, MAN). Stephen Bird misses. Offensive rebound by Larry Duncan! Larry Duncan kicks it out.

[06:32] Team_085 possession (Score: 31-25)
Collin Mobley drives and kicks out. Larry Duncan attempts a 3Pt. Contested by Cade Anthony (4.9 feet, ZONE). Larry Duncan misses. Rebound secured by Cade Anthony.

[06:19] Team_025 possession (Score: 31-25)
Desmond Jordan drives to the basket... FOUL! Offensive foul on Desmond Jordan! Paul Wagner drew the charge! [Team fouls: 4] (Desmond Jordan: 1 personal fouls) TURNOVER! (dead ball)

[06:06] Team_085 possession (Score: 31-25)
Larry Duncan attempts a Layup. BLOCKED BY DESMOND JORDAN! Ball is loose! Rebound secured by Desmond Jordan.

[05:57] Team_025 possession (Score: 31-25)
Cade Anthony attempts a 3Pt. Contested by Paul Wagner (4.9 feet, MAN). Cade Anthony misses. Rebound secured by Collin Mobley.

[05:45] Team_085 possession (Score: 31-25)
Stephen Bird drives, Allen Embiid stays with him. Stephen Bird attempts a Layup. Contested by Allen Embiid (4.3 feet, ZONE). Stephen Bird misses. Offensive rebound by Paul Wagner! Paul Wagner kicks it out.

[05:28] Team_085 possession (Score: 31-25)
FOUL! Shooting foul on Desmond Jordan. Collin Mobley to the line for 2 free throws. [BONUS: 5 team fouls] (Desmond Jordan: 2 personal fouls)   FT 1/2: GOOD   FT 2/2: GOOD Collin Mobley makes 2/2 from the line.
Score: 33-25

[05:15] Team_025 possession (Score: 33-25)
Paolo Lowry attempts a 3Pt. Contested by Paul Wagner (4.7 feet, ZONE). Paolo Lowry misses. Rebound secured by Collin Mobley.

[05:03] Team_085 possession (Score: 33-25)
Collin Mobley attempts a Layup. BLOCKED BY ALLEN EMBIID! Ball deflects out of bounds off Collin Mobley.

[04:48] Team_025 possession (Score: 33-25)
Cade Anthony drives and kicks out. Ben Giddey attempts a Midrange. Contested by Stephen Bird (4.8 feet, MAN). Ben Giddey misses. Rebound secured by Larry Duncan.

[04:34] Team_085 possession (Score: 33-25)
Magic Beal drives, Paolo Lowry stays with him. Magic Beal attempts a Dunk. Wide open! Paolo Lowry is 6.1 feet away. [MAN] MAGIC BEAL MAKES IT! Assist: Collin Mobley
Score: 35-25

[04:17] Team_025 possession (Score: 35-25)
Desmond Jordan drives, Larry Duncan stays with him. Desmond Jordan attempts a Layup. Contested by Larry Duncan (4.3 feet, MAN). Desmond Jordan misses. Rebound secured by Paul Wagner.

[04:01] Team_085 possession (Score: 35-25)
Magic Beal attempts a 3Pt. Contested by Cade Anthony (5.5 feet, ZONE). MAGIC BEAL MAKES IT! Assist: Collin Mobley
Score: 38-25

[03:48] Team_025 possession (Score: 38-25)
Allen Embiid attempts a Layup. BLOCKED BY PAUL WAGNER! Ball is loose! Rebound secured by Collin Mobley.

[03:33] Team_085 possession (Score: 38-25)
Larry Duncan attempts a Midrange. Contested by Desmond Jordan (4.9 feet, MAN). Larry Duncan misses. Rebound secured by Allen Embiid.

[03:21] Team_025 possession (Score: 38-25)
Desmond Jordan attempts a 3Pt. Contested by Magic Beal (5.4 feet, ZONE). Desmond Jordan misses. Rebound secured by Paul Wagner.

[03:08] Team_085 possession (Score: 38-25)
Magic Beal attempts a Layup. Wide open! Paolo Lowry is 6.3 feet away. [MAN] Magic Beal misses. Offensive rebound by Larry Duncan! Larry Duncan kicks it out.

[02:54] Team_085 possession (Score: 38-25)
FOUL! Shooting foul on Cade Anthony. Paul Wagner to the line for 2 free throws. [BONUS: 6 team fouls] (Cade Anthony: 1 personal fouls)   FT 1/2: GOOD   FT 2/2: MISS Paul Wagner makes 1/2 from the line. Rebound secured by Allen Embiid.
Score: 39-25

[02:37] Team_025 possession (Score: 39-25)
Ben Giddey attempts a 3Pt. Contested by Magic Beal (5.7 feet, ZONE). BEN GIDDEY MAKES IT! Assist: Paolo Lowry
Score: 39-28

[02:24] Team_085 possession (Score: 39-28)
Larry Duncan attempts a 3Pt. Contested by Desmond Jordan (5.1 feet, MAN). Larry Duncan misses. Offensive rebound by Larry Duncan! Larry Duncan kicks it out.

[02:12] Team_085 possession (Score: 39-28)
Larry Duncan drives and kicks out. Stephen Bird attempts a 3Pt. Contested by Cade Anthony (5.6 feet, ZONE). Stephen Bird misses. Rebound secured by Desmond Jordan.

[01:58] Team_025 possession (Score: 39-28)
Allen Embiid attempts a Midrange. Contested by Larry Duncan (4.7 feet, ZONE). Allen Embiid misses. Offensive rebound by Allen Embiid! Allen Embiid kicks it out.

[01:42] Team_025 possession (Score: 39-28)
Cade Anthony drives to the basket... FOUL! Offensive foul on Cade Anthony! Paul Wagner drew the charge! [Team fouls: 7] (Cade Anthony: 2 personal fouls) TURNOVER! (dead ball)

[01:27] Team_085 possession (Score: 39-28)
FOUL! Holding foul on Cade Anthony. [IN THE BONUS! 8 team fouls] Paul Wagner to the line for 2 free throws. (Cade Anthony: 3 personal fouls)   FT 1/2: GOOD   FT 2/2: GOOD Paul Wagner makes 2/2 from the line.
Score: 41-28

[01:08] Team_025 possession (Score: 41-28)
FOUL! Reach-in foul on Paul Wagner during the drive. [IN THE BONUS! 6 team fouls] Paolo Lowry to the line for 2 free throws. (Paul Wagner: 2 personal fouls)   FT 1/2: GOOD   FT 2/2: GOOD Paolo Lowry makes 2/2 from the line.
Score: 41-30

[00:50] Team_085 possession (Score: 41-30)
Paul Wagner drives to the basket... FOUL! Offensive foul on Paul Wagner! Allen Embiid drew the charge! [Team fouls: 7] (Paul Wagner: 3 personal fouls) TURNOVER! (dead ball)

[00:35] Team_025 possession (Score: 41-30)
Ben Giddey attempts a Midrange. Contested by Stephen Bird (5.8 feet, MAN). BEN GIDDEY MAKES IT! Assist: Cade Anthony
Score: 41-32

[00:22] Team_085 possession (Score: 41-32)
Magic Beal attempts a 3Pt. Contested by Cade Anthony (6.0 feet, ZONE). MAGIC BEAL MAKES IT! Assist: Larry Duncan
Score: 44-32

[00:11] Team_025 possession (Score: 44-32)
Desmond Jordan attempts a 3Pt. Contested by Paul Wagner (5.2 feet, ZONE). Desmond Jordan misses. Rebound secured by Collin Mobley.

================================================================================
                              2ND QUARTER COMPLETE                              
================================================================================

2ND QUARTER SCORE: Team_085 23, Team_025 9

BOX SCORE:
================================================================================

Team_085
--------------------------------------------------------------------------------
Player                MIN  PTS  REB  AST  TO      FG   FG%      3P   3P%
--------------------------------------------------------------------------------
Collin Mobley          23    9    5    2   0   4/7    57.1     0/0   0.0
Magic Beal             23    8    0    2   0   3/4    75.0     0/0   0.0
Larry Duncan           23    3    7    1   0   1/5    20.0     0/0   0.0
Paul Wagner            23    2    5    0   0   1/2    50.0     0/0   0.0

TEAM: FG: 9/18 (50.0%), 3PT: 2/4 (50.0%), REB: 17 (5 off, 12 def), AST: 5, TO: 2
TEAM FOULS: 7 [Team_025 in BONUS]


Team_025
--------------------------------------------------------------------------------
Player                MIN  PTS  REB  AST  TO      FG   FG%      3P   3P%
--------------------------------------------------------------------------------
Ben Giddey             23    5    0    0   0   2/2   100.0     0/0   0.0
Cade Anthony           23    2    2    1   0   1/4    25.0     0/0   0.0
Paolo Lowry            23    2    0    1   0   1/4    25.0     0/0   0.0
Allen Embiid           23    0    6    0   0   0/1     0.0     0/0   0.0
Desmond Jordan         23    0    3    0   0   0/5     0.0     0/0   0.0

TEAM: FG: 4/16 (25.0%), 3PT: 1/8 (12.5%), REB: 11 (3 off, 8 def), AST: 2, TO: 4
TEAM FOULS: 8 [Team_085 in BONUS]

================================================================================

================================================================================
                       3RD QUARTER - Team_085 vs Team_025                       
================================================================================

[12:00] Team_085 possession (Score: 44-32)
FOUL! Holding foul on Desmond Jordan. [Team fouls: 1] No free throws, side out. (Desmond Jordan: 1 personal fouls)

[11:50] Team_085 possession (Score: 44-32)
Collin Mobley makes the Dunk and draws the foul on Ben Giddey! And-1! Collin Mobley to the line for 1. [Team fouls: 2] (Ben Giddey: 1 personal fouls)   FT 1/1: GOOD Collin Mobley makes 1/1 from the line.
Score: 47-32

[11:32] Team_025 possession (Score: 47-32)
FOUL! Reach-in foul on Collin Mobley during the drive. [Team fouls: 1] No free throws, side out. (Collin Mobley: 1 personal fouls)

[11:18] Team_025 possession (Score: 47-32)
Cade Anthony attempts a Midrange. Contested by Larry Duncan (3.8 feet, ZONE). Cade Anthony misses. Rebound secured by Collin Mobley.

[11:05] Team_085 possession (Score: 47-32)
Larry Duncan drives to the basket... Larry Duncan loses control! Ball rolls out of bounds! TURNOVER! (dead ball)

[10:50] Team_025 possession (Score: 47-32)
Desmond Jordan drives to the basket... Desmond Jordan throws a bad pass out of bounds! TURNOVER! (dead ball)

[10:35] Team_085 possession (Score: 47-32)
Paul Wagner attempts a Midrange. Contested by Cade Anthony (4.5 feet, ZONE). Paul Wagner misses. Rebound secured by Desmond Jordan.

[10:18] Team_025 possession (Score: 47-32)
Cade Anthony attempts a 3Pt. Contested by Magic Beal (4.7 feet, ZONE). Cade Anthony misses. Rebound secured by Paul Wagner.

[10:01] Team_085 possession (Score: 47-32)
Magic Beal makes the Dunk and draws the foul on Desmond Jordan! And-1! Magic Beal to the line for 1. [Team fouls: 3] (Desmond Jordan: 2 personal fouls)   FT 1/1: GOOD Magic Beal makes 1/1 from the line.
Score: 50-32

[09:49] Team_025 possession (Score: 50-32)
Cade Anthony attempts a Midrange. Contested by Paul Wagner (4.2 feet, MAN). CADE ANTHONY MAKES IT! Assist: Paolo Lowry
Score: 50-34

[09:33] Team_085 possession (Score: 50-34)
Larry Duncan attempts a 3Pt. Contested by Desmond Jordan (3.7 feet, MAN). Larry Duncan misses. Rebound secured by Desmond Jordan.

[09:21] Team_025 possession (Score: 50-34)
Paolo Lowry attempts a 3Pt. Contested by Magic Beal (4.4 feet, ZONE). Paolo Lowry misses. Rebound secured by Larry Duncan.

[09:10] Team_085 possession (Score: 50-34)
Paul Wagner attempts a Midrange. Contested by Cade Anthony (4.5 feet, MAN). PAUL WAGNER MAKES IT! Assist: Stephen Bird
Score: 52-34

[08:53] Team_025 possession (Score: 52-34)
Paolo Lowry attempts a 3Pt. Contested by Magic Beal (4.4 feet, MAN). PAOLO LOWRY MAKES IT! Assist: Cade Anthony
Score: 52-37

[08:37] Team_085 possession (Score: 52-37)
Magic Beal attempts a Layup. Contested by Allen Embiid (3.3 feet, ZONE). Magic Beal misses. Rebound secured by Allen Embiid.

[08:25] Team_025 possession (Score: 52-37)
Allen Embiid attempts a 3Pt. Contested by Magic Beal (4.1 feet, ZONE). Allen Embiid misses. Rebound secured by Larry Duncan.

[08:07] Team_085 possession (Score: 52-37)
Magic Beal attempts a 3Pt. Contested by Paolo Lowry (5.3 feet, MAN). Magic Beal misses. Rebound secured by Desmond Jordan.

[07:54] Team_025 possession (Score: 52-37)
Allen Embiid drives, picks up Collin Mobley. Help arrives from Magic Beal! Allen Embiid attempts a Dunk. Contested by Magic Beal (4.0 feet, MAN). ALLEN EMBIID MAKES IT!
Score: 52-39

[07:35] Team_085 possession (Score: 52-39)
Stephen Bird makes the 3Pt and draws the foul on Ben Giddey! And-1! Stephen Bird to the line for 1. [Team fouls: 4] (Ben Giddey: 2 personal fouls)   FT 1/1: GOOD Stephen Bird makes 1/1 from the line.
Score: 56-39

[07:19] Team_025 possession (Score: 56-39)
Desmond Jordan drives and kicks out. Cade Anthony attempts a 3Pt. Contested by Magic Beal (4.0 feet, ZONE). Cade Anthony misses. Rebound secured by Paul Wagner.

[07:03] Team_085 possession (Score: 56-39)
Larry Duncan drives and kicks out. Paul Wagner attempts a 3Pt. Contested by Cade Anthony (4.2 feet, MAN). Paul Wagner misses. Rebound secured by Allen Embiid.

[06:48] Team_025 possession (Score: 56-39)
Cade Anthony attempts a 3Pt. Contested by Magic Beal (4.7 feet, ZONE). Cade Anthony misses. Rebound secured by Larry Duncan.

[06:33] Team_085 possession (Score: 56-39)
Paul Wagner drives, Allen Embiid stays with him. Paul Wagner attempts a Dunk. Contested by Allen Embiid (3.2 feet, ZONE). PAUL WAGNER MAKES IT!
Score: 58-39

[06:17] Team_025 possession (Score: 58-39)
Paolo Lowry attempts a 3Pt. Contested by Magic Beal (4.4 feet, ZONE). Paolo Lowry misses. Rebound secured by Larry Duncan.

[05:58] Team_085 possession (Score: 58-39)
Paul Wagner loses control! Ball rolls out of bounds! TURNOVER! (dead ball)

[05:45] Team_025 possession (Score: 58-39)
Paolo Lowry attempts a Midrange. Contested by Magic Beal (4.4 feet, MAN). PAOLO LOWRY MAKES IT! Assist: Desmond Jordan
Score: 58-41

[05:33] Team_085 possession (Score: 58-41)
Larry Duncan drives to the basket... Larry Duncan throws a bad pass out of bounds! TURNOVER! (dead ball)

[05:19] Team_025 possession (Score: 58-41)
Allen Embiid drives and kicks out. Allen Embiid attempts a 3Pt. Contested by Collin Mobley (3.9 feet, MAN). Allen Embiid misses. Rebound secured by Larry Duncan.

[05:03] Team_085 possession (Score: 58-41)
Collin Mobley drives, picks up Allen Embiid. Help arrives from Ben Giddey! Collin Mobley attempts a Layup. Contested by Ben Giddey (2.8 feet, ZONE). COLLIN MOBLEY MAKES IT!
Score: 60-41

[04:47] Team_025 possession (Score: 60-41)
Paolo Lowry drives, picks up Magic Beal. Help arrives from Larry Duncan! Paolo Lowry attempts a Layup. Contested by Larry Duncan (4.4 feet, MAN). PAOLO LOWRY MAKES IT! Assist: Ben Giddey
Score: 60-43

[04:31] Team_085 possession (Score: 60-43)
Collin Mobley drives, picks up Allen Embiid. Help arrives from Ben Giddey! Collin Mobley attempts a Layup. Contested by Ben Giddey (2.9 feet, MAN). Collin Mobley misses. Rebound secured by Allen Embiid.

[04:17] Team_025 possession (Score: 60-43)
Paolo Lowry makes the Midrange and draws the foul on Magic Beal! And-1! Paolo Lowry to the line for 1. [Team fouls: 2] (Magic Beal: 1 personal fouls)   FT 1/1: GOOD Paolo Lowry makes 1/1 from the line.
Score: 60-46

[04:02] Team_085 possession (Score: 60-46)
Larry Duncan attempts a 3Pt. Contested by Ben Giddey (4.0 feet, ZONE). Larry Duncan misses. Rebound secured by Desmond Jordan.

[03:50] Team_025 possession (Score: 60-46)
Allen Embiid attempts a 3Pt. Contested by Magic Beal (4.2 feet, ZONE). ALLEN EMBIID MAKES IT! Assist: Ben Giddey
Score: 60-49

[03:36] Team_085 possession (Score: 60-49)
Stephen Bird attempts a 3Pt. Contested by Ben Giddey (4.0 feet, ZONE). Stephen Bird misses. Rebound secured by Cade Anthony.

[03:22] Team_025 possession (Score: 60-49)
Allen Embiid attempts a Layup. Contested by Collin Mobley (4.2 feet, ZONE). ALLEN EMBIID MAKES IT! Assist: Ben Giddey
Score: 60-51

[03:08] Team_085 possession (Score: 60-51)
Collin Mobley drives, picks up Allen Embiid. Help arrives from Ben Giddey! Collin Mobley attempts a Dunk. Contested by Ben Giddey (3.0 feet, MAN). COLLIN MOBLEY MAKES IT! Assist: Paul Wagner
Score: 62-51

[02:52] Team_025 possession (Score: 62-51)
Desmond Jordan attempts a Midrange. Contested by Larry Duncan (3.4 feet, MAN). Desmond Jordan misses. Rebound secured by Collin Mobley.

[02:39] Team_085 possession (Score: 62-51)
Larry Duncan makes the Layup and draws the foul on Desmond Jordan! And-1! Larry Duncan to the line for 1. [BONUS: 5 team fouls] (Desmond Jordan: 3 personal fouls)   FT 1/1: GOOD Larry Duncan makes 1/1 from the line.
Score: 65-51

[02:24] Team_025 possession (Score: 65-51)
Ben Giddey attempts a 3Pt. Contested by Stephen Bird (4.1 feet, MAN). Ben Giddey misses. Rebound secured by Collin Mobley.

[02:09] Team_085 possession (Score: 65-51)
Magic Beal attempts a Midrange. Contested by Allen Embiid (3.7 feet, ZONE). Magic Beal misses. Offensive rebound by Paul Wagner! Paul Wagner kicks it out.

[01:58] Team_085 possession (Score: 65-51)
Magic Beal attempts a 3Pt. Contested by Paolo Lowry (5.6 feet, MAN). MAGIC BEAL MAKES IT!
Score: 68-51

[01:49] Team_025 possession (Score: 68-51)
Allen Embiid attempts a 3Pt. Contested by Collin Mobley (4.4 feet, MAN). Allen Embiid misses. Rebound secured by Collin Mobley.

[01:36] Team_085 possession (Score: 68-51)
Paul Wagner attempts a 3Pt. Contested by Ben Giddey (4.2 feet, ZONE). Paul Wagner misses. Rebound secured by Desmond Jordan.

[01:20] Team_025 possession (Score: 68-51)
Paolo Lowry attempts a Midrange. Contested by Magic Beal (4.7 feet, MAN). Paolo Lowry misses. Rebound secured by Collin Mobley.

[01:04] Team_085 possession (Score: 68-51)
FOUL! Shooting foul on Cade Anthony. Paul Wagner to the line for 2 free throws. [BONUS: 6 team fouls] (Cade Anthony: 1 personal fouls)   FT 1/2: MISS   FT 2/2: GOOD Paul Wagner makes 1/2 from the line.
Score: 69-51

[00:44] Team_025 possession (Score: 69-51)
Ben Giddey makes the Layup and draws the foul on Larry Duncan! And-1! Ben Giddey to the line for 1. [Team fouls: 3] (Larry Duncan: 1 personal fouls)   FT 1/1: GOOD Ben Giddey makes 1/1 from the line.
Score: 69-54

[00:30] Team_085 possession (Score: 69-54)
Larry Duncan attempts a 3Pt. Contested by Desmond Jordan (4.2 feet, MAN). LARRY DUNCAN MAKES IT! Assist: Magic Beal
Score: 72-54

[00:17] Team_025 possession (Score: 72-54)
Allen Embiid drives, picks up Paul Wagner. Help arrives from Magic Beal! Allen Embiid attempts a Dunk. Contested by Magic Beal (4.0 feet, ZONE). ALLEN EMBIID MAKES IT! Assist: Cade Anthony
Score: 72-56

[00:06] Team_085 possession (Score: 72-56)
Collin Mobley makes the Layup and draws the foul on Allen Embiid! And-1! Collin Mobley to the line for 1. [BONUS: 7 team fouls] (Allen Embiid: 1 personal fouls)   FT 1/1: GOOD Collin Mobley makes 1/1 from the line.
Score: 75-56

================================================================================
                              3RD QUARTER COMPLETE                              
================================================================================

3RD QUARTER SCORE: Team_085 31, Team_025 24

BOX SCORE:
================================================================================

Team_085
--------------------------------------------------------------------------------
Player                MIN  PTS  REB  AST  TO      FG   FG%      3P   3P%
--------------------------------------------------------------------------------
Collin Mobley          35   10    5    0   0   4/5    80.0     0/0   0.0
Magic Beal             35    6    0    1   0   2/4    50.0     0/0   0.0
Larry Duncan           35    6    5    0   0   2/5    40.0     0/0   0.0
Paul Wagner            35    5    3    1   0   3/5    60.0     0/0   0.0
Stephen Bird           35    4    0    1   0   1/2    50.0     0/0   0.0

TEAM: FG: 12/21 (57.1%), 3PT: 3/8 (37.5%), REB: 13 (1 off, 12 def), AST: 3, TO: 3
TEAM FOULS: 3


Team_025
--------------------------------------------------------------------------------
Player                MIN  PTS  REB  AST  TO      FG   FG%      3P   3P%
--------------------------------------------------------------------------------
Paolo Lowry            35   10    0    1   0   4/7    57.1     0/0   0.0
Allen Embiid           35    9    3    0   0   4/7    57.1     0/0   0.0
Ben Giddey             35    3    0    3   0   1/2    50.0     0/0   0.0
Cade Anthony           35    2    1    2   0   1/4    25.0     0/0   0.0
Desmond Jordan         35    0    5    1   0   0/2     0.0     0/0   0.0

TEAM: FG: 10/22 (45.5%), 3PT: 2/9 (22.2%), REB: 9 (0 off, 9 def), AST: 7, TO: 1
TEAM FOULS: 7 [Team_085 in BONUS]

================================================================================

================================================================================
                       4TH QUARTER - Team_085 vs Team_025                       
================================================================================

[12:00] Team_085 possession (Score: 75-56)
Collin Mobley attempts a Layup. BLOCKED BY ALLEN EMBIID! Ball is loose! Offensive rebound by Paul Wagner! Paul Wagner kicks it out.

[11:43] Team_085 possession (Score: 75-56)
Larry Duncan drives to the basket... Larry Duncan throws a bad pass! Stolen by Allen Embiid! TURNOVER! (live ball)

[11:30] Team_025 possession (Score: 75-56)
Desmond Jordan attempts a 3Pt. Contested by Magic Beal (4.5 feet, ZONE). DESMOND JORDAN MAKES IT! Assist: Ben Giddey
Score: 75-59

[11:12] Team_085 possession (Score: 75-59)
Paul Wagner drives and kicks out. FOUL! Shooting foul on Allen Embiid. Collin Mobley to the line for 3 free throws. [Team fouls: 1] (Allen Embiid: 1 personal fouls)   FT 1/3: MISS   FT 2/3: GOOD   FT 3/3: GOOD Collin Mobley makes 2/3 from the line.
Score: 77-59

[10:57] Team_025 possession (Score: 77-59)
Desmond Jordan attempts a 3Pt. Contested by Larry Duncan (3.6 feet, MAN). DESMOND JORDAN MAKES IT! Assist: Paolo Lowry
Score: 77-62

[10:47] Team_085 possession (Score: 77-62)
Magic Beal attempts a Layup. BLOCKED BY PAOLO LOWRY! Ball is loose! Rebound secured by Desmond Jordan.

[10:34] Team_025 possession (Score: 77-62)
Desmond Jordan attempts a 3Pt. Contested by Larry Duncan (3.7 feet, MAN). DESMOND JORDAN MAKES IT! Assist: Ben Giddey
Score: 77-65

[10:20] Team_085 possession (Score: 77-65)
Larry Duncan attempts a 3Pt. Contested by Desmond Jordan (4.2 feet, MAN). Larry Duncan misses. Rebound secured by Cade Anthony.

[10:06] Team_025 possession (Score: 77-65)
Paolo Lowry attempts a 3Pt. Contested by Magic Beal (4.8 feet, MAN). Paolo Lowry misses. Rebound secured by Paul Wagner.

[09:53] Team_085 possession (Score: 77-65)
Collin Mobley drives, Allen Embiid stays with him. Collin Mobley attempts a Layup. Contested by Allen Embiid (3.5 feet, MAN). Collin Mobley misses. Rebound secured by Desmond Jordan.

[09:34] Team_025 possession (Score: 77-65)
Paolo Lowry makes the Layup and draws the foul on Larry Duncan! And-1! Paolo Lowry to the line for 1. [Team fouls: 1] (Larry Duncan: 1 personal fouls)   FT 1/1: GOOD Paolo Lowry makes 1/1 from the line.
Score: 77-68

[09:19] Team_085 possession (Score: 77-68)
Larry Duncan drives and kicks out. Collin Mobley attempts a Midrange. Contested by Allen Embiid (3.8 feet, MAN). COLLIN MOBLEY MAKES IT!
Score: 79-68

[09:06] Team_025 possession (Score: 79-68)
Desmond Jordan attempts a 3Pt. Contested by Larry Duncan (3.8 feet, MAN). DESMOND JORDAN MAKES IT! Assist: Paolo Lowry
Score: 79-71

[08:56] Team_085 possession (Score: 79-71)
Magic Beal attempts a 3Pt. Contested by Cade Anthony (5.1 feet, ZONE). MAGIC BEAL MAKES IT! Assist: Collin Mobley
Score: 82-71

[08:40] Team_025 possession (Score: 82-71)
Ben Giddey drives to the basket... Ben Giddey loses the ball! Stripped by Stephen Bird! TURNOVER! (live ball)

[08:25] Team_085 possession (Score: 82-71)
Collin Mobley makes the Dunk and draws the foul on Ben Giddey! And-1! Collin Mobley to the line for 1. [Team fouls: 2] (Ben Giddey: 1 personal fouls)   FT 1/1: MISS Collin Mobley makes 0/1 from the line. Rebound secured by Desmond Jordan.
Score: 84-71

[08:08] Team_025 possession (Score: 84-71)
Desmond Jordan attempts a Midrange. Contested by Larry Duncan (4.0 feet, ZONE). DESMOND JORDAN MAKES IT!
Score: 84-73

[07:57] Team_085 possession (Score: 84-73)
Paul Wagner drives and kicks out. Magic Beal attempts a 3Pt. Contested by Cade Anthony (5.0 feet, ZONE). Magic Beal misses. Offensive rebound by Paul Wagner! Paul Wagner kicks it out.

[07:43] Team_085 possession (Score: 84-73)
Stephen Bird drives, picks up Ben Giddey. Help arrives from Desmond Jordan! Stephen Bird attempts a Layup. Contested by Desmond Jordan (4.7 feet, MAN). Stephen Bird misses. Rebound secured by Desmond Jordan.

[07:29] Team_025 possession (Score: 84-73)
Ben Giddey drives, Stephen Bird stays with him. Ben Giddey attempts a Layup. Contested by Stephen Bird (4.9 feet, MAN). BEN GIDDEY MAKES IT! Assist: Paolo Lowry
Score: 84-75

[07:11] Team_085 possession (Score: 84-75)
Paul Wagner attempts a 3Pt. Contested by Cade Anthony (5.2 feet, MAN). PAUL WAGNER MAKES IT! Assist: Larry Duncan
Score: 87-75

[06:59] Team_025 possession (Score: 87-75)
Paolo Lowry attempts a Midrange. Contested by Magic Beal (5.2 feet, MAN). PAOLO LOWRY MAKES IT! Assist: Cade Anthony
Score: 87-77

[06:43] Team_085 possession (Score: 87-77)
Stephen Bird attempts a Layup. Contested by Allen Embiid (4.3 feet, ZONE). STEPHEN BIRD MAKES IT!
Score: 89-77

[06:31] Team_025 possession (Score: 89-77)
Paolo Lowry attempts a 3Pt. Contested by Magic Beal (5.3 feet, MAN). Paolo Lowry misses. Rebound secured by Collin Mobley.

[06:20] Team_085 possession (Score: 89-77)
Stephen Bird attempts a 3Pt. Contested by Cade Anthony (5.3 feet, ZONE). Stephen Bird misses. Offensive rebound by Larry Duncan! Larry Duncan kicks it out.

[06:06] Team_085 possession (Score: 89-77)
Paul Wagner attempts a Layup. Contested by Cade Anthony (5.4 feet, MAN). Paul Wagner misses. Rebound secured by Allen Embiid.

[05:50] Team_025 possession (Score: 89-77)
Desmond Jordan attempts a 3Pt. Contested by Magic Beal (5.2 feet, ZONE). Desmond Jordan misses. Rebound secured by Paul Wagner.

[05:36] Team_085 possession (Score: 89-77)
Larry Duncan attempts a Midrange. Contested by Desmond Jordan (4.8 feet, ZONE). LARRY DUNCAN MAKES IT! Assist: Collin Mobley
Score: 91-77

[05:20] Team_025 possession (Score: 91-77)
Ben Giddey drives and kicks out. Paolo Lowry attempts a Midrange. Contested by Paul Wagner (4.7 feet, ZONE). Paolo Lowry misses. Offensive rebound by Desmond Jordan! Desmond Jordan kicks it out.

[05:06] Team_025 possession (Score: 91-77)
FOUL! Shooting foul on Larry Duncan. Desmond Jordan to the line for 2 free throws. [Team fouls: 2] (Larry Duncan: 2 personal fouls)   FT 1/2: MISS   FT 2/2: GOOD Desmond Jordan makes 1/2 from the line.
Score: 91-78

[04:54] Team_085 possession (Score: 91-78)
Magic Beal loses control! Ball rolls out of bounds! TURNOVER! (dead ball)

[04:54] Substitution (Team_085): Magic Beal OUT → Khris Brogdon IN (stamina_rule2)

[04:54] Substitution (Team_085): Stephen Bird OUT → Jordan Morant IN (stamina_rule2)

[04:54] Substitution (Team_085): Larry Duncan OUT → Giannis Johnson IN (stamina_rule2)

[04:54] Substitution (Team_085): Paul Wagner OUT → Jalen Leonard IN (stamina_rule2)

[04:54] Substitution (Team_085): Collin Mobley OUT → Malcolm Beal IN (stamina_rule2)

[04:54] Substitution (Team_025): Paolo Lowry OUT → LeBron Griffin IN (stamina_rule2)

[04:54] Substitution (Team_025): Ben Giddey OUT → Dirk Gilgeous-Alexander IN (stamina_rule2)

[04:54] Substitution (Team_025): Desmond Jordan OUT → Immanuel LaVine IN (stamina_rule2)

[04:54] Substitution (Team_025): Cade Anthony OUT → Damian Adebayo IN (stamina_rule2)

[04:54] Substitution (Team_025): Allen Embiid OUT → Nikola Lillard IN (stamina_rule2)

[04:42] Team_025 possession (Score: 91-78)
FOUL! Offensive foul on Immanuel LaVine! Giannis Johnson drew the charge! [Team fouls: 3] (Immanuel LaVine: 1 personal fouls) TURNOVER! (dead ball)

[04:31] Team_085 possession (Score: 91-78)
Jalen Leonard attempts a Midrange. Contested by Immanuel LaVine (4.8 feet, ZONE). Jalen Leonard misses. Rebound secured by Dirk Gilgeous-Alexander.

[04:20] Team_025 possession (Score: 91-78)
Damian Adebayo drives, Jalen Leonard stays with him. Damian Adebayo attempts a Dunk. Contested by Jalen Leonard (4.1 feet, MAN). Damian Adebayo misses. Offensive rebound by Nikola Lillard! Nikola Lillard kicks it out.

[04:03] Team_025 possession (Score: 91-78)
Immanuel LaVine drives, Malcolm Beal stays with him. Immanuel LaVine attempts a Layup. Contested by Malcolm Beal (4.4 feet, ZONE). Immanuel LaVine misses. Rebound secured by Giannis Johnson.

[03:45] Team_085 possession (Score: 91-78)
Khris Brogdon attempts a 3Pt. Contested by LeBron Griffin (4.5 feet, MAN). Khris Brogdon misses. Rebound secured by Nikola Lillard.

[03:35] Team_025 possession (Score: 91-78)
Dirk Gilgeous-Alexander drives to the basket... Dirk Gilgeous-Alexander throws a bad pass out of bounds! TURNOVER! (dead ball)

[03:21] Team_085 possession (Score: 91-78)
Jalen Leonard makes the Dunk and draws the foul on Damian Adebayo! And-1! Jalen Leonard to the line for 1. [Team fouls: 4] (Damian Adebayo: 1 personal fouls)   FT 1/1: MISS Jalen Leonard makes 0/1 from the line. Rebound secured by Nikola Lillard.
Score: 93-78

[03:08] Team_025 possession (Score: 93-78)
Damian Adebayo drives, Malcolm Beal stays with him. Damian Adebayo attempts a Dunk. Contested by Malcolm Beal (4.3 feet, ZONE). Damian Adebayo misses. Rebound secured by Giannis Johnson.

[02:58] Team_085 possession (Score: 93-78)
Khris Brogdon attempts a Midrange. Contested by Dirk Gilgeous-Alexander (5.5 feet, ZONE). Khris Brogdon misses. Rebound secured by Dirk Gilgeous-Alexander.

[02:42] Team_025 possession (Score: 93-78)
Nikola Lillard drives, Malcolm Beal stays with him. Nikola Lillard attempts a Layup. Contested by Malcolm Beal (4.5 feet, MAN). NIKOLA LILLARD MAKES IT!
Score: 93-80

[02:25] Team_085 possession (Score: 93-80)
Khris Brogdon attempts a 3Pt. Contested by Damian Adebayo (4.8 feet, ZONE). Khris Brogdon misses. Rebound secured by Nikola Lillard.

[02:10] Team_025 possession (Score: 93-80)
Nikola Lillard attempts a Layup. BLOCKED BY MALCOLM BEAL! Ball is loose! Offensive rebound by Nikola Lillard! Nikola Lillard kicks it out.

[01:57] Team_025 possession (Score: 93-80)
Damian Adebayo attempts a 3Pt. Contested by Jordan Morant (3.5 feet, ZONE). Damian Adebayo misses. FOUL! Loose ball foul on Malcolm Beal during the rebound battle. [Team fouls: 3] No free throws, side out. (Malcolm Beal: 1 personal fouls)

[01:47] Team_025 possession (Score: 93-80)
Immanuel LaVine attempts a Layup. Contested by Giannis Johnson (5.9 feet, MAN). IMMANUEL LAVINE MAKES IT!
Score: 93-82

[01:37] Team_085 possession (Score: 93-82)
Khris Brogdon drives, Nikola Lillard stays with him. Khris Brogdon attempts a Dunk. Contested by Nikola Lillard (4.3 feet, ZONE). Khris Brogdon misses. Rebound secured by Immanuel LaVine.

[01:23] Team_025 possession (Score: 93-82)
Dirk Gilgeous-Alexander attempts a 3Pt. Contested by Jordan Morant (3.7 feet, MAN). Dirk Gilgeous-Alexander misses. Rebound secured by Jalen Leonard.

[01:09] Team_085 possession (Score: 93-82)
Khris Brogdon attempts a 3Pt. Contested by LeBron Griffin (4.5 feet, MAN). KHRIS BROGDON MAKES IT!
Score: 96-82

[00:57] Team_025 possession (Score: 96-82)
FOUL! Shooting foul on Jalen Leonard. Damian Adebayo to the line for 2 free throws. [Team fouls: 4] (Jalen Leonard: 1 personal fouls)   FT 1/2: GOOD   FT 2/2: GOOD Damian Adebayo makes 2/2 from the line.
Score: 96-84

[00:44] Team_085 possession (Score: 96-84)
Jordan Morant attempts a Layup. Contested by Nikola Lillard (4.6 feet, ZONE). JORDAN MORANT MAKES IT! Assist: Malcolm Beal
Score: 98-84

[00:33] Team_025 possession (Score: 98-84)
Immanuel LaVine drives and kicks out. Damian Adebayo attempts a Midrange. Contested by Giannis Johnson (5.8 feet, ZONE). DAMIAN ADEBAYO MAKES IT! Assist: LeBron Griffin
Score: 98-86

[00:22] Team_085 possession (Score: 98-86)
Malcolm Beal attempts a Layup. Contested by Nikola Lillard (3.9 feet, ZONE). MALCOLM BEAL MAKES IT! Assist: Jalen Leonard
Score: 100-86

[00:10] Team_025 possession (Score: 100-86)
Dirk Gilgeous-Alexander drives and kicks out. Immanuel LaVine attempts a Midrange. Contested by Jordan Morant (3.5 feet, ZONE). Immanuel LaVine misses. Rebound secured by Malcolm Beal.

================================================================================
                              4TH QUARTER COMPLETE                              
================================================================================

4TH QUARTER SCORE: Team_085 25, Team_025 30

BOX SCORE:
================================================================================

Team_085
--------------------------------------------------------------------------------
Player                MIN  PTS  REB  AST  TO      FG   FG%      3P   3P%
--------------------------------------------------------------------------------
Collin Mobley          42    4    1    2   0   2/4    50.0     0/0   0.0
Paul Wagner            42    3    4    0   0   1/2    50.0     0/0   0.0
Magic Beal             42    3    0    0   0   1/2    50.0     0/0   0.0
Khris Brogdon           6    3    0    0   0   1/5    20.0     0/0   0.0
Larry Duncan           42    2    1    1   0   1/2    50.0     0/0   0.0
Stephen Bird           42    2    0    0   0   1/2    50.0     0/0   0.0
Jordan Morant           6    2    0    0   0   1/1   100.0     0/0   0.0
Malcolm Beal            6    2    1    1   0   1/1   100.0     0/0   0.0
Jalen Leonard           6    0    1    1   0   0/2     0.0     0/0   0.0
Giannis Johnson         6    0    2    0   0   0/0     0.0     0/0   0.0

TEAM: FG: 9/21 (42.9%), 3PT: 3/6 (50.0%), REB: 10 (3 off, 7 def), AST: 5, TO: 2
TEAM FOULS: 4


Team_025
--------------------------------------------------------------------------------
Player                MIN  PTS  REB  AST  TO      FG   FG%      3P   3P%
--------------------------------------------------------------------------------
Desmond Jordan         42   15    5    0   0   6/7    85.7     0/0   0.0
Paolo Lowry            42    5    0    3   0   2/4    50.0     0/0   0.0
Damian Adebayo          6    4    0    0   0   2/3    66.7     0/0   0.0
Ben Giddey             42    2    0    2   0   1/1   100.0     0/0   0.0
Nikola Lillard          6    2    5    0   0   1/1   100.0     0/0   0.0
Immanuel LaVine         6    2    2    0   0   1/2    50.0     0/0   0.0
Cade Anthony           42    0    1    1   0   0/0     0.0     0/0   0.0
Allen Embiid           42    0    1    0   0   0/0     0.0     0/0   0.0
Dirk Gilgeous-Alexander    6    0    2    0   0   0/2     0.0     0/0   0.0
LeBron Griffin          6    0    0    1   0   0/0     0.0     0/0   0.0

TEAM: FG: 13/20 (65.0%), 3PT: 4/8 (50.0%), REB: 16 (4 off, 12 def), AST: 7, TO: 3
TEAM FOULS: 4

================================================================================

================================================================================
                               FULL GAME COMPLETE                               
================================================================================

FINAL SCORE: Team_085 100, Team_025 86

SCORING BY QUARTER:
--------------------------------------------------------------------------------
Team                     Q1     Q2     Q3     Q4    FINAL
--------------------------------------------------------------------------------
Team_085                 21     23     31     25      100
Team_025                 23      9     24     30       86
--------------------------------------------------------------------------------

FULL GAME BOX SCORE:
================================================================================

Team_085
--------------------------------------------------------------------------------
Player                MIN  PTS  REB  AST  TO      FG   FG%      3P   3P%      FT STL BLK
--------------------------------------------------------------------------------
Magic Beal             42   21    0    5   6   9/15   60.0   4/6    66.7   1/1     0   0
Stephen Bird           42   10    0    2   0   3/6    50.0   1/2    50.0   1/1     2   0
Larry Duncan           42   15   16    2   2   7/15   46.7   1/5    20.0   2/2     1   0
Paul Wagner            42   13   17    2   2   6/11   54.5   2/4    50.0   4/6     1   1
Collin Mobley          42   29   14    4   0  11/19   57.9   0/0     0.0   7/9     0   0
Khris Brogdon           6    3    0    0   0   1/5    20.0   1/3    33.3   0/0     0   0
Jordan Morant           6    2    0    0   0   1/1   100.0   0/0     0.0   0/0     0   0
Giannis Johnson         6    0    2    0   0   0/0     0.0   0/0     0.0   0/0     0   0
Jalen Leonard           6    0    1    1   0   0/3     0.0   0/0     0.0   0/1     0   0
Malcolm Beal            6    2    3    1   1   1/1   100.0   0/0     0.0   0/0     1   1

TEAM: FG: 40/77 (51.9%), 3PT: 9/20 (45.0%), REB: 53 (14 off, 39 def), AST: 17, TO: 11


Team_025
--------------------------------------------------------------------------------
Player                MIN  PTS  REB  AST  TO      FG   FG%      3P   3P%      FT STL BLK
--------------------------------------------------------------------------------
Paolo Lowry            42   20    0    5   1   9/18   50.0   2/9    22.2   4/4     0   1
Ben Giddey             42   16    0    5   3   6/8    75.0   2/3    66.7   2/2     0   0
Desmond Jordan         42   21   15    1   2   7/18   38.9   4/9    44.4   1/2     0   2
Cade Anthony           42    6    6    5   1   3/10   30.0   1/6    16.7   0/0     1   0
Allen Embiid           42   14   15    1   2   7/12   58.3   2/4    50.0   0/0     2   2
LeBron Griffin          6    0    0    1   1   0/0     0.0   0/0     0.0   0/0     0   0
Dirk Gilgeous-Alexander    6    0    2    0   1   0/2     0.0   0/1     0.0   0/0     0   0
Immanuel LaVine         6    2    2    0   1   2/3    66.7   0/0     0.0   0/0     0   0
Damian Adebayo          6    4    0    0   0   1/3    33.3   0/0     0.0   3/4     0   0
Nikola Lillard          6    2    6    0   0   1/1   100.0   0/0     0.0   0/0     1   0

TEAM: FG: 36/75 (48.0%), 3PT: 11/32 (34.4%), REB: 46 (10 off, 36 def), AST: 18, TO: 12

================================================================================
