================================================================================
                        FULL GAME - Team_055 vs Team_018                        
================================================================================

================================================================================
                       1ST QUARTER - Team_055 vs Team_018                       
================================================================================

[12:00] Team_055 possession (Score: 0-0)
Devin Siakam attempts a 3Pt. Contested by Klay Stewart (4.2 feet, ZONE). Devin Siakam misses. Offensive rebound by Chris Turner! Chris Turner's putback is no good. Rebound secured by Allen Markkanen.

[11:46] Team_018 possession (Score: 0-0)
Domantas Wall makes the Layup and draws the foul on Jrue Sabonis! And-1! Domantas Wall to the line for 1. [Team fouls: 1] (Jrue Sabonis: 1 personal fouls)   FT 1/1: GOOD Domantas Wall makes 1/1 from the line.
Score: 0-3

[11:33] Team_055 possession (Score: 0-3)
Devin Siakam attempts a 3Pt. Contested by Klay Stewart (4.2 feet, MAN). Devin Siakam misses. FOUL! Loose ball foul on Allen Markkanen during the rebound battle. [Team fouls: 1] No free throws, side out. (Allen Markkanen: 1 personal fouls)

[11:19] Team_055 possession (Score: 0-3)
Kevin Bane attempts a Layup. Contested by Allen Markkanen (4.2 feet, MAN). KEVIN BANE MAKES IT! Assist: Chris Turner
Score: 2-3

[11:06] Team_018 possession (Score: 2-3)
Tracy Bryant attempts a 3Pt. Contested by Kevin Bane (4.4 feet, ZONE). TRACY BRYANT MAKES IT! Assist: Allen Markkanen
Score: 2-6

[10:52] Team_055 possession (Score: 2-6)
Kevin Bane drives, Allen Markkanen stays with him. Kevin Bane attempts a Layup. Contested by Allen Markkanen (4.2 feet, MAN). Kevin Bane misses. Rebound secured by Domantas Wall.

[10:37] Team_018 possession (Score: 2-6)
Bones Anunoby attempts a Layup. Contested by Chris Turner (3.2 feet, ZONE). BONES ANUNOBY MAKES IT! Assist: Domantas Wall
Score: 2-8

[10:24] Team_055 possession (Score: 2-8)
Devin Siakam attempts a 3Pt. Contested by Klay Stewart (4.2 feet, MAN). Devin Siakam misses. Rebound secured by Domantas Wall.

[10:09] Team_018 possession (Score: 2-8)
FOUL! Holding foul on Devin Siakam. [Team fouls: 2] No free throws, side out. (Devin Siakam: 1 personal fouls)

[09:55] Team_018 possession (Score: 2-8)
Tracy Bryant attempts a 3Pt. Contested by Shaquille Herro (3.9 feet, MAN). TRACY BRYANT MAKES IT! Assist: Domantas Wall
Score: 2-11

[09:42] Team_055 possession (Score: 2-11)
Shaquille Herro drives, picks up Domantas Wall. Help arrives from Klay Stewart! Shaquille Herro attempts a Dunk. Contested by Klay Stewart (3.7 feet, ZONE). SHAQUILLE HERRO MAKES IT! Assist: Devin Siakam
Score: 4-11

[09:24] Team_018 possession (Score: 4-11)
Allen Markkanen drives to the basket... FOUL! Offensive foul on Allen Markkanen! Chris Turner drew the charge! [Team fouls: 2] (Allen Markkanen: 2 personal fouls) TURNOVER! (dead ball)

[09:10] Team_055 possession (Score: 4-11)
Devin Siakam drives and kicks out. Devin Siakam attempts a 3Pt. Contested by Klay Stewart (4.1 feet, ZONE). Devin Siakam misses. Rebound secured by Bones Anunoby.

[08:58] Team_018 possession (Score: 4-11)
FOUL! Reach-in foul on Chris Turner during the drive. [Team fouls: 3] No free throws, side out. (Chris Turner: 1 personal fouls)

[08:40] Team_018 possession (Score: 4-11)
Tracy Bryant throws a bad pass out of bounds! TURNOVER! (dead ball)

[08:24] Team_055 possession (Score: 4-11)
FOUL! Holding foul on Tracy Bryant. [Team fouls: 3] No free throws, side out. (Tracy Bryant: 1 personal fouls)

[08:08] Team_055 possession (Score: 4-11)
Devin Siakam attempts a 3Pt. Contested by Klay Stewart (4.2 feet, ZONE). Devin Siakam misses. Rebound secured by Bones Anunoby.

[07:57] Team_018 possession (Score: 4-11)
FOUL! Holding foul on Kevin Bane. [Team fouls: 4] No free throws, side out. (Kevin Bane: 1 personal fouls)

[07:42] Team_018 possession (Score: 4-11)
Bones Anunoby attempts a 3Pt. Contested by Kevin Bane (4.4 feet, ZONE). Bones Anunoby misses. Offensive rebound by Bones Anunoby! Bones Anunoby kicks it out.

[07:27] Team_018 possession (Score: 4-11)
Tracy Bryant loses control! Ball rolls out of bounds! TURNOVER! (dead ball)

[07:12] Team_055 possession (Score: 4-11)
FOUL! Reach-in foul on Domantas Wall during the drive. [Team fouls: 4] No free throws, side out. (Domantas Wall: 1 personal fouls)

[06:56] Team_055 possession (Score: 4-11)
Jrue Sabonis attempts a Midrange. Contested by Bones Anunoby (3.4 feet, ZONE). Jrue Sabonis misses. FOUL! Loose ball foul on Domantas Wall during the rebound battle. [IN THE BONUS! 5 team fouls] Chris Turner to the line for 2 free throws. (Domantas Wall: 2 personal fouls)   FT 1/2: GOOD   FT 2/2: GOOD Chris Turner makes 2/2 from the line.
Score: 6-11

[06:43] Team_018 possession (Score: 6-11)
FOUL! Reach-in foul on Chris Turner during the drive. [IN THE BONUS! 5 team fouls] Tracy Bryant to the line for 2 free throws. (Chris Turner: 2 personal fouls)   FT 1/2: GOOD   FT 2/2: GOOD Tracy Bryant makes 2/2 from the line.
Score: 6-13

[06:25] Team_055 possession (Score: 6-13)
Shaquille Herro makes the Midrange and draws the foul on Tracy Bryant! And-1! Shaquille Herro to the line for 1. [BONUS: 6 team fouls] (Tracy Bryant: 2 personal fouls)   FT 1/1: GOOD Shaquille Herro makes 1/1 from the line.
Score: 9-13

[06:11] Team_018 possession (Score: 9-13)
Domantas Wall drives, Chris Turner stays with him. Domantas Wall attempts a Layup. Contested by Chris Turner (3.2 feet, MAN). DOMANTAS WALL MAKES IT! Assist: Tracy Bryant
Score: 9-15

[05:57] Team_055 possession (Score: 9-15)
Chris Turner drives to the basket... Chris Turner commits a violation (traveling/carry)! TURNOVER! (dead ball)

[05:42] Team_018 possession (Score: 9-15)
FOUL! Shooting foul on Chris Turner. Klay Stewart to the line for 2 free throws. [BONUS: 6 team fouls] (Chris Turner: 3 personal fouls)   FT 1/2: GOOD   FT 2/2: GOOD Klay Stewart makes 2/2 from the line.
Score: 9-17

[05:25] Team_055 possession (Score: 9-17)
Jrue Sabonis drives, Bones Anunoby stays with him. Jrue Sabonis attempts a Layup. Contested by Bones Anunoby (3.5 feet, MAN). JRUE SABONIS MAKES IT!
Score: 11-17

[05:12] Team_018 possession (Score: 11-17)
Klay Stewart attempts a 3Pt. Contested by Jrue Sabonis (4.5 feet, ZONE). KLAY STEWART MAKES IT! Assist: Domantas Wall
Score: 11-20

[05:00] Team_055 possession (Score: 11-20)
Shaquille Herro makes the Layup and draws the foul on Domantas Wall! And-1! Shaquille Herro to the line for 1. [BONUS: 7 team fouls] (Domantas Wall: 3 personal fouls)   FT 1/1: GOOD Shaquille Herro makes 1/1 from the line.
Score: 14-20

[04:45] Team_018 possession (Score: 14-20)
Allen Markkanen attempts a Midrange. Contested by Kevin Bane (4.4 feet, ZONE). ALLEN MARKKANEN MAKES IT! Assist: Klay Stewart
Score: 14-22

[04:31] Team_055 possession (Score: 14-22)
Shaquille Herro drives and kicks out. Shaquille Herro attempts a 3Pt. Contested by Tracy Bryant (3.4 feet, MAN). Shaquille Herro misses. Rebound secured by Domantas Wall.

[04:16] Team_018 possession (Score: 14-22)
Tracy Bryant drives, Chris Turner stays with him. Tracy Bryant attempts a Layup. Contested by Chris Turner (3.4 feet, ZONE). Tracy Bryant misses. Rebound secured by Jrue Sabonis.

[04:05] Team_055 possession (Score: 14-22)
Devin Siakam attempts a 3Pt. Contested by Klay Stewart (4.2 feet, ZONE). Devin Siakam misses. Rebound secured by Allen Markkanen.

[03:50] Team_018 possession (Score: 14-22)
Klay Stewart drives, Chris Turner stays with him. Klay Stewart attempts a Dunk. Contested by Chris Turner (3.3 feet, ZONE). KLAY STEWART MAKES IT! Assist: Allen Markkanen
Score: 14-24

[03:37] Team_055 possession (Score: 14-24)
Devin Siakam drives and kicks out. Devin Siakam attempts a Midrange. Contested by Tracy Bryant (3.5 feet, ZONE). Devin Siakam misses. Rebound secured by Allen Markkanen.

[03:22] Team_018 possession (Score: 14-24)
Bones Anunoby drives, picks up Chris Turner. Help arrives from Shaquille Herro! Bones Anunoby attempts a Dunk. Contested by Shaquille Herro (3.4 feet, ZONE). Bones Anunoby misses. Rebound secured by Kevin Bane.

[03:07] Team_055 possession (Score: 14-24)
FOUL! Reach-in foul on Klay Stewart during the drive. [IN THE BONUS! 8 team fouls] Devin Siakam to the line for 2 free throws. (Klay Stewart: 1 personal fouls)   FT 1/2: MISS   FT 2/2: GOOD Devin Siakam makes 1/2 from the line.
Score: 15-24

[02:54] Team_018 possession (Score: 15-24)
Bones Anunoby attempts a 3Pt. Contested by Kevin Bane (4.5 feet, ZONE). Bones Anunoby misses. Rebound secured by Chris Turner.

[02:37] Team_055 possession (Score: 15-24)
Jrue Sabonis makes the Layup and draws the foul on Klay Stewart! And-1! Jrue Sabonis to the line for 1. [BONUS: 9 team fouls] (Klay Stewart: 2 personal fouls)   FT 1/1: MISS Jrue Sabonis makes 0/1 from the line. Rebound secured by Domantas Wall.
Score: 17-24

[02:19] Team_018 possession (Score: 17-24)
Allen Markkanen commits a violation (traveling/carry)! TURNOVER! (dead ball)

[02:19] Substitution (Team_055): Devin Siakam OUT → Luka Wall IN (stamina_rule2)

[02:19] Substitution (Team_055): Shaquille Herro OUT → Dirk Duncan IN (stamina_rule2)

[02:19] Substitution (Team_055): Jrue Sabonis OUT → Malcolm Williamson IN (stamina_rule2)

[02:19] Substitution (Team_055): Chris Turner OUT → D'Angelo Antetokounmpo IN (stamina_rule2)

[02:19] Substitution (Team_018): Bones Anunoby OUT → Shai Wade IN (stamina_rule2)

[02:19] Substitution (Team_018): Domantas Wall OUT → Julius Jackson IN (stamina_rule2)

[02:02] Team_055 possession (Score: 17-24)
D'Angelo Antetokounmpo drives and kicks out. Dirk Duncan attempts a 3Pt. Contested by Klay Stewart (4.4 feet, ZONE). Dirk Duncan misses. Rebound secured by Tracy Bryant.

[01:48] Team_018 possession (Score: 17-24)
Klay Stewart attempts a 3Pt. Contested by Kevin Bane (4.4 feet, ZONE). Klay Stewart misses. Offensive rebound by Julius Jackson! Julius Jackson kicks it out.

[01:37] Team_018 possession (Score: 17-24)
Julius Jackson drives, Malcolm Williamson stays with him. Julius Jackson attempts a Layup. Contested by Malcolm Williamson (4.4 feet, ZONE). JULIUS JACKSON MAKES IT!
Score: 17-26

[01:25] Team_055 possession (Score: 17-26)
D'Angelo Antetokounmpo drives and kicks out. Luka Wall attempts a Midrange. Contested by Shai Wade (4.9 feet, ZONE). Luka Wall misses. Rebound secured by Allen Markkanen.

[01:11] Team_018 possession (Score: 17-26)
Shai Wade drives, Malcolm Williamson stays with him. Shai Wade attempts a Layup. Contested by Malcolm Williamson (3.5 feet, ZONE). SHAI WADE MAKES IT! Assist: Klay Stewart
Score: 17-28

[00:55] Team_055 possession (Score: 17-28)
Kevin Bane attempts a Midrange. Contested by Allen Markkanen (4.5 feet, MAN). Kevin Bane misses. Rebound secured by Tracy Bryant.

[00:42] Team_018 possession (Score: 17-28)
FOUL! Reach-in foul on Malcolm Williamson during the drive. [IN THE BONUS! 7 team fouls] Tracy Bryant to the line for 2 free throws. (Malcolm Williamson: 1 personal fouls)   FT 1/2: GOOD   FT 2/2: MISS Tracy Bryant makes 1/2 from the line. Rebound secured by Malcolm Williamson.
Score: 17-29

[00:30] Team_055 possession (Score: 17-29)
Luka Wall drives to the basket... Luka Wall throws a bad pass! Stolen by Julius Jackson! TURNOVER! (live ball)

[00:11] Team_018 possession (Score: 17-29)
Tracy Bryant drives and kicks out. Tracy Bryant makes the Midrange and draws the foul on Dirk Duncan! And-1! Tracy Bryant to the line for 1. [BONUS: 8 team fouls] (Dirk Duncan: 1 personal fouls)   FT 1/1: GOOD Tracy Bryant makes 1/1 from the line.
Score: 17-32

================================================================================
                              1ST QUARTER COMPLETE                              
================================================================================

1ST QUARTER SCORE: Team_055 17, Team_018 32

BOX SCORE:
================================================================================

Team_055
--------------------------------------------------------------------------------
Player                MIN  PTS  REB  AST  TO      FG   FG%      3P   3P%
--------------------------------------------------------------------------------
Shaquille Herro        10    8    0    0   0   3/4    75.0     0/0   0.0
Jrue Sabonis           10    2    2    0   0   1/2    50.0     0/0   0.0
Kevin Bane             12    2    1    0   0   1/3    33.3     0/0   0.0
Chris Turner           10    2    1    1   0   1/1   100.0     0/0   0.0
Devin Siakam           10    1    0    1   0   1/7    14.3     0/0   0.0
D'Angelo Antetokounmpo    2    0    0    0   0   0/2     0.0     0/0   0.0
Malcolm Williamson      2    0    1    0   0   0/0     0.0     0/0   0.0

TEAM: FG: 7/19 (36.8%), 3PT: 0/4 (0.0%), REB: 6 (2 off, 4 def), AST: 2, TO: 2
TEAM FOULS: 8 [Team_018 in BONUS]


Team_018
--------------------------------------------------------------------------------
Player                MIN  PTS  REB  AST  TO      FG   FG%      3P   3P%
--------------------------------------------------------------------------------
Tracy Bryant           12   11    2    1   0   4/6    66.7     0/0   0.0
Klay Stewart           12    7    0    2   0   3/3   100.0     0/0   0.0
Domantas Wall          10    5    4    3   0   2/2   100.0     0/0   0.0
Allen Markkanen        12    2    4    2   0   1/1   100.0     0/0   0.0
Bones Anunoby          10    2    3    0   0   1/3    33.3     0/0   0.0
Julius Jackson          2    2    1    0   0   1/1   100.0     0/0   0.0
Shai Wade               2    2    0    0   0   1/1   100.0     0/0   0.0

TEAM: FG: 13/17 (76.5%), 3PT: 3/4 (75.0%), REB: 13 (2 off, 11 def), AST: 8, TO: 4
TEAM FOULS: 9 [Team_055 in BONUS]

================================================================================

================================================================================
                       2ND QUARTER - Team_055 vs Team_018                       
================================================================================

[12:00] Team_055 possession (Score: 17-32)
Devin Siakam drives, Domantas Wall stays with him. Devin Siakam attempts a Layup. Contested by Domantas Wall (3.6 feet, ZONE). DEVIN SIAKAM MAKES IT! Assist: Chris Turner
Score: 19-32

[11:46] Team_018 possession (Score: 19-32)
Bones Anunoby attempts a 3Pt. Contested by Shaquille Herro (4.0 feet, ZONE). Bones Anunoby misses. Rebound secured by Kevin Bane.

[11:33] Team_055 possession (Score: 19-32)
Shaquille Herro attempts a Layup. Contested by Tracy Bryant (4.0 feet, MAN). Shaquille Herro misses. Rebound secured by Bones Anunoby.

[11:15] Team_018 possession (Score: 19-32)
Klay Stewart attempts a Midrange. Contested by Devin Siakam (5.5 feet, MAN). Klay Stewart misses. Rebound secured by Chris Turner.

[11:00] Team_055 possession (Score: 19-32)
Jrue Sabonis drives, Domantas Wall stays with him. Jrue Sabonis attempts a Layup. Contested by Domantas Wall (3.7 feet, ZONE). JRUE SABONIS MAKES IT! Assist: Shaquille Herro
Score: 21-32

[10:43] Team_018 possession (Score: 21-32)
Allen Markkanen attempts a Midrange. Contested by Kevin Bane (4.7 feet, MAN). Allen Markkanen misses. Offensive rebound by Bones Anunoby! Bones Anunoby kicks it out.

[10:26] Team_018 possession (Score: 21-32)
FOUL! Reach-in foul on Chris Turner during the drive. [Team fouls: 1] No free throws, side out. (Chris Turner: 1 personal fouls)

[10:14] Team_018 possession (Score: 21-32)
Tracy Bryant attempts a Layup. Contested by Shaquille Herro (4.1 feet, MAN). TRACY BRYANT MAKES IT! Assist: Klay Stewart
Score: 21-34

[10:04] Team_055 possession (Score: 21-34)
Jrue Sabonis attempts a Midrange. Contested by Allen Markkanen (4.3 feet, ZONE). Jrue Sabonis misses. Rebound secured by Bones Anunoby.

[09:49] Team_018 possession (Score: 21-34)
Tracy Bryant drives, Shaquille Herro stays with him. Tracy Bryant attempts a Dunk. Contested by Shaquille Herro (4.1 feet, MAN). Tracy Bryant misses. Offensive rebound by Domantas Wall! Domantas Wall's putback is no good. Rebound secured by Jrue Sabonis.

[09:35] Team_055 possession (Score: 21-34)
Devin Siakam throws a bad pass! Stolen by Klay Stewart! TURNOVER! (live ball)

[09:22] Team_018 possession (Score: 21-34)
FOUL! Shooting foul on Chris Turner. Bones Anunoby to the line for 2 free throws. [Team fouls: 2] (Chris Turner: 2 personal fouls)   FT 1/2: GOOD   FT 2/2: GOOD Bones Anunoby makes 2/2 from the line.
Score: 21-36

[09:08] Team_055 possession (Score: 21-36)
FOUL! Offensive foul on Devin Siakam! Klay Stewart drew the charge! [Team fouls: 3] (Devin Siakam: 1 personal fouls) TURNOVER! (dead ball)

[08:52] Team_018 possession (Score: 21-36)
Allen Markkanen drives, picks up Kevin Bane. Help arrives from Shaquille Herro! Allen Markkanen attempts a Dunk. Contested by Shaquille Herro (4.8 feet, MAN). ALLEN MARKKANEN MAKES IT! Assist: Domantas Wall
Score: 21-38

[08:36] Team_055 possession (Score: 21-38)
Chris Turner attempts a Layup. Contested by Domantas Wall (4.2 feet, ZONE). Chris Turner misses. Offensive rebound by Jrue Sabonis! Jrue Sabonis kicks it out.

[08:23] Team_055 possession (Score: 21-38)
Shaquille Herro attempts a Midrange. Contested by Tracy Bryant (4.3 feet, MAN). SHAQUILLE HERRO MAKES IT!
Score: 23-38

[08:13] Team_018 possession (Score: 23-38)
Tracy Bryant attempts a 3Pt. Contested by Shaquille Herro (4.3 feet, MAN). Tracy Bryant misses. Rebound secured by Kevin Bane.

[08:01] Team_055 possession (Score: 23-38)
Kevin Bane attempts a 3Pt. Contested by Allen Markkanen (4.8 feet, MAN). Kevin Bane misses. Rebound secured by Allen Markkanen.

[07:46] Team_018 possession (Score: 23-38)
Bones Anunoby attempts a 3Pt. Contested by Shaquille Herro (4.4 feet, ZONE). Bones Anunoby misses. Offensive rebound by Domantas Wall! Domantas Wall puts it back in!
Score: 23-40

[07:29] Team_055 possession (Score: 23-40)
Shaquille Herro attempts a 3Pt. Contested by Klay Stewart (5.1 feet, ZONE). Shaquille Herro misses. Rebound secured by Domantas Wall.

[07:12] Team_018 possession (Score: 23-40)
FOUL! Reach-in foul on Chris Turner during the drive. [Team fouls: 4] No free throws, side out. (Chris Turner: 3 personal fouls)

[06:53] Team_018 possession (Score: 23-40)
Tracy Bryant attempts a 3Pt. Contested by Shaquille Herro (4.4 feet, MAN). Tracy Bryant misses. Rebound secured by Chris Turner.

[06:39] Team_055 possession (Score: 23-40)
Shaquille Herro attempts a 3Pt. Contested by Tracy Bryant (4.6 feet, ZONE). Shaquille Herro misses. Rebound secured by Bones Anunoby.

[06:28] Team_018 possession (Score: 23-40)
Tracy Bryant attempts a 3Pt. Contested by Shaquille Herro (4.5 feet, MAN). Tracy Bryant misses. Offensive rebound by Bones Anunoby! Bones Anunoby kicks it out.

[06:08] Team_018 possession (Score: 23-40)
Allen Markkanen makes the Layup and draws the foul on Kevin Bane! And-1! Allen Markkanen to the line for 1. [BONUS: 5 team fouls] (Kevin Bane: 1 personal fouls)   FT 1/1: GOOD Allen Markkanen makes 1/1 from the line.
Score: 23-43

[05:53] Team_055 possession (Score: 23-43)
Kevin Bane attempts a Midrange. Contested by Allen Markkanen (5.0 feet, ZONE). KEVIN BANE MAKES IT! Assist: Jrue Sabonis
Score: 25-43

[05:42] Team_018 possession (Score: 25-43)
Allen Markkanen attempts a 3Pt. Contested by Shaquille Herro (4.6 feet, ZONE). Allen Markkanen misses. Rebound secured by Jrue Sabonis.

[05:28] Team_055 possession (Score: 25-43)
Jrue Sabonis makes the Layup and draws the foul on Bones Anunoby! And-1! Jrue Sabonis to the line for 1. [Team fouls: 1] (Bones Anunoby: 1 personal fouls)   FT 1/1: GOOD Jrue Sabonis makes 1/1 from the line.
Score: 28-43

[05:11] Team_018 possession (Score: 28-43)
Bones Anunoby attempts a 3Pt. Contested by Chris Turner (4.1 feet, MAN). Bones Anunoby misses. Rebound secured by Jrue Sabonis.

[04:59] Team_055 possession (Score: 28-43)
Kevin Bane attempts a 3Pt. Contested by Allen Markkanen (5.1 feet, MAN). Kevin Bane misses. FOUL! Loose ball foul on Allen Markkanen during the rebound battle. [Team fouls: 2] No free throws, side out. (Allen Markkanen: 1 personal fouls)

[04:44] Team_055 possession (Score: 28-43)
Devin Siakam attempts a Layup. BLOCKED BY KLAY STEWART! Ball is loose! Rebound secured by Bones Anunoby.

[04:35] Team_018 possession (Score: 28-43)
Tracy Bryant attempts a Midrange. Contested by Shaquille Herro (4.8 feet, MAN). Tracy Bryant misses. Offensive rebound by Domantas Wall! Domantas Wall's putback is no good. Offensive rebound by Domantas Wall! Domantas Wall kicks it out.

[04:19] Team_018 possession (Score: 28-43)
Bones Anunoby attempts a 3Pt. Contested by Chris Turner (4.2 feet, MAN). Bones Anunoby misses. Rebound secured by Chris Turner.

[04:09] Team_055 possession (Score: 28-43)
Chris Turner attempts a Layup. Contested by Domantas Wall (4.9 feet, ZONE). CHRIS TURNER MAKES IT! Assist: Jrue Sabonis
Score: 30-43

[03:53] Team_018 possession (Score: 30-43)
FOUL! Holding foul on Devin Siakam. [IN THE BONUS! 6 team fouls] Klay Stewart to the line for 2 free throws. (Devin Siakam: 2 personal fouls)   FT 1/2: GOOD   FT 2/2: MISS Klay Stewart makes 1/2 from the line. FOUL! Loose ball foul on Jrue Sabonis during the free throw rebound! [IN THE BONUS! 7 team fouls] Bones Anunoby to the line for 2 free throws. (Jrue Sabonis: 1 personal fouls)   FT 1/2: MISS   FT 2/2: MISS Bones Anunoby makes 0/2 from the line. Rebound secured by Kevin Bane.
Score: 30-44

[03:35] Team_055 possession (Score: 30-44)
Jrue Sabonis attempts a 3Pt. Contested by Bones Anunoby (4.6 feet, MAN). Jrue Sabonis misses. Rebound secured by Allen Markkanen.

[03:23] Team_018 possession (Score: 30-44)
Allen Markkanen attempts a Midrange. Contested by Kevin Bane (5.5 feet, MAN). Allen Markkanen misses. Rebound secured by Chris Turner.

[03:09] Team_055 possession (Score: 30-44)
Chris Turner drives, Domantas Wall stays with him. Chris Turner attempts a Dunk. Contested by Domantas Wall (5.0 feet, ZONE). CHRIS TURNER MAKES IT! Assist: Shaquille Herro
Score: 32-44

[02:59] Team_018 possession (Score: 32-44)
Tracy Bryant throws a bad pass! Stolen by Shaquille Herro! TURNOVER! (live ball)

[02:45] Team_055 possession (Score: 32-44)
Chris Turner drives, picks up Domantas Wall. Help arrives from Klay Stewart! Chris Turner attempts a Dunk. Contested by Klay Stewart (5.1 feet, MAN). CHRIS TURNER MAKES IT! Assist: Jrue Sabonis
Score: 34-44

[02:35] Team_018 possession (Score: 34-44)
Klay Stewart drives, picks up Chris Turner. Help arrives from Shaquille Herro! Klay Stewart attempts a Layup. Contested by Shaquille Herro (4.4 feet, ZONE). Klay Stewart misses. Rebound secured by Jrue Sabonis.

[02:18] Team_055 possession (Score: 34-44)
Kevin Bane attempts a Midrange. Contested by Allen Markkanen (5.5 feet, MAN). Kevin Bane misses. Rebound secured by Domantas Wall.

[02:01] Team_018 possession (Score: 34-44)
Allen Markkanen attempts a 3Pt. Contested by Shaquille Herro (5.2 feet, ZONE). Allen Markkanen misses. FOUL! Loose ball foul on Chris Turner during the rebound battle. [IN THE BONUS! 8 team fouls] Domantas Wall to the line for 2 free throws. (Chris Turner: 4 personal fouls)   FT 1/2: GOOD   FT 2/2: GOOD Domantas Wall makes 2/2 from the line.
Score: 34-46

[01:43] Team_055 possession (Score: 34-46)
Jrue Sabonis attempts a 3Pt. Contested by Bones Anunoby (4.9 feet, MAN). Jrue Sabonis misses. Rebound secured by Bones Anunoby.

[01:32] Team_018 possession (Score: 34-46)
Allen Markkanen attempts a 3Pt. Contested by Kevin Bane (5.7 feet, MAN). ALLEN MARKKANEN MAKES IT! Assist: Tracy Bryant
Score: 34-49

[01:20] Team_055 possession (Score: 34-49)
Devin Siakam attempts a Layup. Contested by Domantas Wall (5.2 feet, ZONE). DEVIN SIAKAM MAKES IT! Assist: Kevin Bane
Score: 36-49

[01:11] Team_018 possession (Score: 36-49)
Klay Stewart attempts a Midrange. Wide open! Devin Siakam is 6.7 feet away. [MAN] Klay Stewart misses. Rebound secured by Jrue Sabonis.

[00:56] Team_055 possession (Score: 36-49)
Shaquille Herro attempts a 3Pt. Contested by Tracy Bryant (5.4 feet, MAN). Shaquille Herro misses. FOUL! Loose ball foul on Bones Anunoby during the rebound battle. [Team fouls: 3] No free throws, side out. (Bones Anunoby: 2 personal fouls)

[00:44] Team_055 possession (Score: 36-49)
Kevin Bane drives and kicks out. Devin Siakam attempts a 3Pt. Wide open! Klay Stewart is 6.1 feet away. [MAN] Devin Siakam misses. Rebound secured by Domantas Wall.

[00:32] Team_018 possession (Score: 36-49)
Bones Anunoby attempts a 3Pt. Contested by Shaquille Herro (5.4 feet, ZONE). BONES ANUNOBY MAKES IT!
Score: 36-52

[00:21] Team_055 possession (Score: 36-52)
Chris Turner drives and kicks out. Kevin Bane attempts a 3Pt. Wide open! Klay Stewart is 6.2 feet away. [ZONE] Kevin Bane misses. Offensive rebound by Chris Turner! Chris Turner kicks it out.

[00:10] Team_055 possession (Score: 36-52)
Jrue Sabonis drives, Bones Anunoby stays with him. Jrue Sabonis attempts a Dunk. Contested by Bones Anunoby (5.3 feet, MAN). Jrue Sabonis misses. Offensive rebound by Chris Turner! Chris Turner kicks it out.

================================================================================
                              2ND QUARTER COMPLETE                              
================================================================================

2ND QUARTER SCORE: Team_055 19, Team_018 20

BOX SCORE:
================================================================================

Team_055
--------------------------------------------------------------------------------
Player                MIN  PTS  REB  AST  TO      FG   FG%      3P   3P%
--------------------------------------------------------------------------------
Chris Turner           22    6    8    1   0   3/3   100.0     0/0   0.0
Jrue Sabonis           22    5    6    3   0   2/5    40.0     0/0   0.0
Devin Siakam           22    4    0    0   0   2/3    66.7     0/0   0.0
Kevin Bane             24    2    3    1   0   1/4    25.0     0/0   0.0
Shaquille Herro        22    2    0    2   0   1/4    25.0     0/0   0.0

TEAM: FG: 9/19 (47.4%), 3PT: 0/5 (0.0%), REB: 16 (5 off, 11 def), AST: 7, TO: 2
TEAM FOULS: 8 [Team_018 in BONUS]


Team_018
--------------------------------------------------------------------------------
Player                MIN  PTS  REB  AST  TO      FG   FG%      3P   3P%
--------------------------------------------------------------------------------
Allen Markkanen        24    8    2    0   0   3/5    60.0     0/0   0.0
Bones Anunoby          22    5    7    0   0   2/5    40.0     0/0   0.0
Domantas Wall          22    4    5    1   0   2/2   100.0     0/0   0.0
Tracy Bryant           24    2    0    1   0   1/4    25.0     0/0   0.0
Klay Stewart           24    0    0    1   0   0/3     0.0     0/0   0.0

TEAM: FG: 8/20 (40.0%), 3PT: 4/10 (40.0%), REB: 15 (5 off, 10 def), AST: 3, TO: 1
TEAM FOULS: 3

================================================================================

================================================================================
                       3RD QUARTER - Team_055 vs Team_018                       
================================================================================

[12:00] Team_055 possession (Score: 36-52)
Chris Turner attempts a Dunk. BLOCKED BY DOMANTAS WALL! Ball is loose! Offensive rebound by Chris Turner! Chris Turner kicks it out.

[11:45] Team_055 possession (Score: 36-52)
Devin Siakam drives and kicks out. Devin Siakam attempts a 3Pt. Contested by Klay Stewart (4.1 feet, ZONE). Devin Siakam misses. Rebound secured by Allen Markkanen.

[11:31] Team_018 possession (Score: 36-52)
Tracy Bryant drives and kicks out. FOUL! Shooting foul on Jrue Sabonis. Bones Anunoby to the line for 2 free throws. [Team fouls: 1] (Jrue Sabonis: 1 personal fouls)   FT 1/2: GOOD   FT 2/2: MISS Bones Anunoby makes 1/2 from the line. Offensive rebound by Domantas Wall! Domantas Wall's putback is no good.
Score: 36-53

[11:13] Team_055 possession (Score: 36-53)
Devin Siakam attempts a Midrange. Contested by Klay Stewart (4.2 feet, MAN). Devin Siakam misses. Rebound secured by Bones Anunoby.

[10:57] Team_018 possession (Score: 36-53)
Allen Markkanen makes the Dunk and draws the foul on Kevin Bane! And-1! Allen Markkanen to the line for 1. [Team fouls: 2] (Kevin Bane: 1 personal fouls)   FT 1/1: GOOD Allen Markkanen makes 1/1 from the line.
Score: 36-56

[10:46] Team_055 possession (Score: 36-56)
Jrue Sabonis attempts a 3Pt. Contested by Allen Markkanen (4.0 feet, ZONE). Jrue Sabonis misses. Rebound secured by Bones Anunoby.

[10:29] Team_018 possession (Score: 36-56)
Klay Stewart attempts a 3Pt. Contested by Devin Siakam (5.4 feet, MAN). Klay Stewart misses. Offensive rebound by Domantas Wall! Domantas Wall's putback is no good. Offensive rebound by Domantas Wall! Domantas Wall kicks it out.

[10:14] Team_018 possession (Score: 36-56)
Allen Markkanen attempts a 3Pt. Contested by Kevin Bane (4.4 feet, ZONE). Allen Markkanen misses. Rebound secured by Chris Turner.

[10:01] Team_055 possession (Score: 36-56)
FOUL! Shooting foul on Domantas Wall. Chris Turner to the line for 2 free throws. [Team fouls: 2] (Domantas Wall: 1 personal fouls)   FT 1/2: GOOD   FT 2/2: GOOD Chris Turner makes 2/2 from the line.
Score: 38-56

[09:49] Team_018 possession (Score: 38-56)
Allen Markkanen attempts a Midrange. Contested by Devin Siakam (5.5 feet, ZONE). Allen Markkanen misses. Rebound secured by Kevin Bane.

[09:37] Team_055 possession (Score: 38-56)
Shaquille Herro drives and kicks out. Chris Turner attempts a Midrange. Contested by Bones Anunoby (3.3 feet, ZONE). Chris Turner misses. Offensive rebound by Chris Turner! Chris Turner puts it back in!
Score: 40-56

[09:20] Team_018 possession (Score: 40-56)
Bones Anunoby attempts a Layup. Contested by Jrue Sabonis (4.5 feet, ZONE). BONES ANUNOBY MAKES IT! Assist: Allen Markkanen
Score: 40-58

[09:03] Team_055 possession (Score: 40-58)
FOUL! Offensive foul on Devin Siakam! Klay Stewart drew the charge! [Team fouls: 3] (Devin Siakam: 1 personal fouls) TURNOVER! (dead ball)

[08:48] Team_018 possession (Score: 40-58)
Domantas Wall drives and kicks out. FOUL! Shooting foul on Kevin Bane. Allen Markkanen to the line for 3 free throws. [Team fouls: 4] (Kevin Bane: 2 personal fouls)   FT 1/3: MISS   FT 2/3: GOOD   FT 3/3: MISS Allen Markkanen makes 1/3 from the line. Offensive rebound by Domantas Wall! Domantas Wall puts it back in!
Score: 40-61

[08:37] Team_055 possession (Score: 40-61)
Chris Turner attempts a Midrange. Contested by Tracy Bryant (3.7 feet, ZONE). Chris Turner misses. Rebound secured by Allen Markkanen.

[08:22] Team_018 possession (Score: 40-61)
Klay Stewart attempts a 3Pt. Contested by Shaquille Herro (3.8 feet, ZONE). Klay Stewart misses. Rebound secured by Kevin Bane.

[08:06] Team_055 possession (Score: 40-61)
Chris Turner attempts a Midrange. Contested by Bones Anunoby (3.6 feet, ZONE). Chris Turner misses. Rebound secured by Allen Markkanen.

[07:53] Team_018 possession (Score: 40-61)
Domantas Wall attempts a 3Pt. Contested by Kevin Bane (4.3 feet, ZONE). Domantas Wall misses. Rebound secured by Kevin Bane.

[07:41] Team_055 possession (Score: 40-61)
FOUL! Holding foul on Domantas Wall. [Team fouls: 3] No free throws, side out. (Domantas Wall: 2 personal fouls)

[07:23] Team_055 possession (Score: 40-61)
Devin Siakam drives and kicks out. Devin Siakam attempts a Midrange. Contested by Klay Stewart (4.1 feet, MAN). Devin Siakam misses. FOUL! Loose ball foul on Domantas Wall during the rebound battle. [Team fouls: 4] No free throws, side out. (Domantas Wall: 3 personal fouls)

[07:06] Team_055 possession (Score: 40-61)
Kevin Bane attempts a 3Pt. Contested by Allen Markkanen (4.2 feet, ZONE). Kevin Bane misses. Rebound secured by Domantas Wall.

[06:53] Team_018 possession (Score: 40-61)
Klay Stewart attempts a 3Pt. Contested by Devin Siakam (5.4 feet, MAN). KLAY STEWART MAKES IT! Assist: Tracy Bryant
Score: 40-64

[06:37] Team_055 possession (Score: 40-64)
Jrue Sabonis throws a bad pass! Stolen by Bones Anunoby! TURNOVER! (live ball)

[06:18] Team_018 possession (Score: 40-64)
Tracy Bryant attempts a Midrange. Contested by Shaquille Herro (3.9 feet, MAN). Tracy Bryant misses. Rebound secured by Kevin Bane.

[06:07] Team_055 possession (Score: 40-64)
FOUL! Shooting foul on Bones Anunoby. Jrue Sabonis to the line for 2 free throws. [BONUS: 5 team fouls] (Bones Anunoby: 2 personal fouls)   FT 1/2: GOOD   FT 2/2: GOOD Jrue Sabonis makes 2/2 from the line.
Score: 42-64

[05:52] Team_018 possession (Score: 42-64)
Tracy Bryant attempts a 3Pt. Contested by Kevin Bane (4.4 feet, ZONE). Tracy Bryant misses. Rebound secured by Jrue Sabonis.

[05:40] Team_055 possession (Score: 42-64)
FOUL! Shooting foul on Klay Stewart. Jrue Sabonis to the line for 2 free throws. [BONUS: 6 team fouls] (Klay Stewart: 1 personal fouls)   FT 1/2: MISS   FT 2/2: GOOD Jrue Sabonis makes 1/2 from the line.
Score: 43-64

[05:26] Team_018 possession (Score: 43-64)
FOUL! Shooting foul on Chris Turner. Domantas Wall to the line for 2 free throws. [BONUS: 5 team fouls] (Chris Turner: 1 personal fouls)   FT 1/2: GOOD   FT 2/2: MISS Domantas Wall makes 1/2 from the line. Rebound secured by Chris Turner.
Score: 43-65

[05:14] Team_055 possession (Score: 43-65)
Kevin Bane attempts a 3Pt. Contested by Klay Stewart (4.5 feet, ZONE). Kevin Bane misses. Rebound secured by Bones Anunoby.

[04:58] Team_018 possession (Score: 43-65)
Domantas Wall attempts a Midrange. Contested by Chris Turner (3.2 feet, MAN). DOMANTAS WALL MAKES IT! Assist: Bones Anunoby
Score: 43-67

[04:42] Team_055 possession (Score: 43-67)
Devin Siakam attempts a Midrange. Contested by Klay Stewart (4.2 feet, MAN). Devin Siakam misses. Rebound secured by Allen Markkanen.

[04:29] Team_018 possession (Score: 43-67)
Bones Anunoby attempts a 3Pt. Contested by Chris Turner (3.3 feet, MAN). Bones Anunoby misses. Offensive rebound by Domantas Wall! Domantas Wall puts it back in!
Score: 43-69

[04:09] Team_055 possession (Score: 43-69)
Shaquille Herro attempts a 3Pt. Contested by Klay Stewart (4.4 feet, ZONE). Shaquille Herro misses. FOUL! Loose ball foul on Bones Anunoby during the rebound battle. [IN THE BONUS! 7 team fouls] Jrue Sabonis to the line for 2 free throws. (Bones Anunoby: 3 personal fouls)   FT 1/2: GOOD   FT 2/2: GOOD Jrue Sabonis makes 2/2 from the line.
Score: 45-69

[03:50] Team_018 possession (Score: 45-69)
Klay Stewart makes the Dunk and draws the foul on Chris Turner! And-1! Klay Stewart to the line for 1. [BONUS: 6 team fouls] (Chris Turner: 2 personal fouls)   FT 1/1: MISS Klay Stewart makes 0/1 from the line. Rebound secured by Chris Turner.
Score: 45-71

[03:34] Team_055 possession (Score: 45-71)
FOUL! Holding foul on Klay Stewart. [IN THE BONUS! 8 team fouls] Devin Siakam to the line for 2 free throws. (Klay Stewart: 2 personal fouls)   FT 1/2: MISS   FT 2/2: GOOD Devin Siakam makes 1/2 from the line.
Score: 46-71

[03:17] Team_018 possession (Score: 46-71)
Domantas Wall drives, picks up Chris Turner. Help arrives from Shaquille Herro! Domantas Wall attempts a Layup. Contested by Shaquille Herro (3.3 feet, ZONE). DOMANTAS WALL MAKES IT! Assist: Bones Anunoby
Score: 46-73

[03:06] Team_055 possession (Score: 46-73)
FOUL! Holding foul on Klay Stewart. [IN THE BONUS! 9 team fouls] Devin Siakam to the line for 2 free throws. (Klay Stewart: 3 personal fouls)   FT 1/2: GOOD   FT 2/2: GOOD Devin Siakam makes 2/2 from the line.
Score: 48-73

[02:51] Team_018 possession (Score: 48-73)
FOUL! Shooting foul on Chris Turner. Bones Anunoby to the line for 2 free throws. [BONUS: 7 team fouls] (Chris Turner: 3 personal fouls)   FT 1/2: GOOD   FT 2/2: GOOD Bones Anunoby makes 2/2 from the line.
Score: 48-75

[02:39] Team_055 possession (Score: 48-75)
Jrue Sabonis drives and kicks out. Chris Turner attempts a Midrange. Contested by Domantas Wall (3.8 feet, MAN). CHRIS TURNER MAKES IT!
Score: 50-75

[02:25] Team_018 possession (Score: 50-75)
Allen Markkanen attempts a Midrange. Contested by Kevin Bane (4.5 feet, MAN). ALLEN MARKKANEN MAKES IT!
Score: 50-77

[02:07] Team_055 possession (Score: 50-77)
Chris Turner drives and kicks out. Chris Turner attempts a 3Pt. Contested by Klay Stewart (4.3 feet, ZONE). Chris Turner misses. Rebound secured by Domantas Wall.

[01:51] Team_018 possession (Score: 50-77)
Allen Markkanen attempts a Layup. Contested by Kevin Bane (4.6 feet, MAN). ALLEN MARKKANEN MAKES IT! Assist: Klay Stewart
Score: 50-79

[01:40] Team_055 possession (Score: 50-79)
FOUL! Offensive foul on Chris Turner! Domantas Wall drew the charge! [Team fouls: 8] (Chris Turner: 4 personal fouls) TURNOVER! (dead ball)

[01:24] Team_018 possession (Score: 50-79)
Klay Stewart attempts a Midrange. Contested by Shaquille Herro (4.2 feet, ZONE). Klay Stewart misses. Offensive rebound by Domantas Wall! Domantas Wall puts it back in!
Score: 50-81

[01:13] Team_055 possession (Score: 50-81)
Jrue Sabonis attempts a Midrange. Contested by Bones Anunoby (3.9 feet, MAN). Jrue Sabonis misses. Offensive rebound by Chris Turner! Chris Turner's putback is no good. Rebound secured by Domantas Wall.

[00:54] Team_018 possession (Score: 50-81)
Bones Anunoby attempts a Layup. Contested by Chris Turner (3.7 feet, MAN). BONES ANUNOBY MAKES IT! Assist: Tracy Bryant
Score: 50-83

[00:39] Team_055 possession (Score: 50-83)
Devin Siakam attempts a Midrange. Contested by Klay Stewart (4.5 feet, MAN). Devin Siakam misses. Rebound secured by Bones Anunoby.

[00:20] Team_018 possession (Score: 50-83)
Klay Stewart attempts a 3Pt. Contested by Kevin Bane (4.5 feet, ZONE). KLAY STEWART MAKES IT! Assist: Tracy Bryant
Score: 50-86

[00:03] Team_055 possession (Score: 50-86)
Jrue Sabonis attempts a Midrange. Contested by Bones Anunoby (4.0 feet, MAN). Jrue Sabonis misses. Offensive rebound by Chris Turner! Chris Turner puts it back in!
Score: 52-86

================================================================================
                              3RD QUARTER COMPLETE                              
================================================================================

3RD QUARTER SCORE: Team_055 16, Team_018 34

BOX SCORE:
================================================================================

Team_055
--------------------------------------------------------------------------------
Player                MIN  PTS  REB  AST  TO      FG   FG%      3P   3P%
--------------------------------------------------------------------------------
Domantas Wall          34   11    7    0   0   5/7    71.4     0/0   0.0
Chris Turner           34    8    7    0   0   4/7    57.1     0/0   0.0
Jrue Sabonis           34    5    1    0   0   3/5    60.0     0/0   0.0
Devin Siakam           34    3    0    0   0   2/6    33.3     0/0   0.0
Kevin Bane             36    0    4    0   0   0/2     0.0     0/0   0.0

TEAM: FG: 9/20 (45.0%), 3PT: 1/4 (25.0%), REB: 14 (5 off, 9 def), AST: 0, TO: 3
TEAM FOULS: 8 [Team_018 in BONUS]


Team_018
--------------------------------------------------------------------------------
Player                MIN  PTS  REB  AST  TO      FG   FG%      3P   3P%
--------------------------------------------------------------------------------
Allen Markkanen        36    7    4    1   0   3/5    60.0     0/0   0.0
Bones Anunoby          34    6    4    2   0   3/3   100.0     0/0   0.0
Klay Stewart           36    6    0    1   0   2/4    50.0     0/0   0.0
Tracy Bryant           36    0    0    3   0   0/3     0.0     0/0   0.0

TEAM: FG: 13/22 (59.1%), 3PT: 3/7 (42.9%), REB: 13 (3 off, 10 def), AST: 7, TO: 0
TEAM FOULS: 9 [Team_055 in BONUS]

================================================================================

================================================================================
                       4TH QUARTER - Team_055 vs Team_018                       
================================================================================

[12:00] Substitution (Team_055): Devin Siakam OUT (stamina: 66) → Luka Wall IN (comeback_detected)

[12:00] Substitution (Team_018): Klay Stewart OUT (stamina: 71) → Michael Simons IN (comeback_detected)

[12:00] Team_055 possession (Score: 52-86)
Shaquille Herro attempts a 3Pt. Contested by Tracy Bryant (3.8 feet, ZONE). Shaquille Herro misses. Rebound secured by Bones Anunoby.

[11:46] Team_018 possession (Score: 52-86)
Tracy Bryant drives and kicks out. Michael Simons attempts a 3Pt. Contested by Kevin Bane (4.2 feet, ZONE). MICHAEL SIMONS MAKES IT! Assist: Domantas Wall
Score: 52-89

[11:36] Team_055 possession (Score: 52-89)
Chris Turner makes the Layup and draws the foul on Domantas Wall! And-1! Chris Turner to the line for 1. [Team fouls: 1] (Domantas Wall: 1 personal fouls)   FT 1/1: GOOD Chris Turner makes 1/1 from the line.
Score: 55-89

[11:20] Team_018 possession (Score: 55-89)
Bones Anunoby attempts a 3Pt. Contested by Chris Turner (3.6 feet, MAN). Bones Anunoby misses. Rebound secured by Jrue Sabonis.

[11:05] Team_055 possession (Score: 55-89)
Jrue Sabonis makes the Layup and draws the foul on Bones Anunoby! And-1! Jrue Sabonis to the line for 1. [Team fouls: 2] (Bones Anunoby: 1 personal fouls)   FT 1/1: GOOD Jrue Sabonis makes 1/1 from the line.
Score: 58-89

[10:56] Team_018 possession (Score: 58-89)
Tracy Bryant attempts a 3Pt. Contested by Luka Wall (6.0 feet, ZONE). Tracy Bryant misses. Rebound secured by Chris Turner.

[10:42] Team_055 possession (Score: 58-89)
Jrue Sabonis drives and kicks out. Shaquille Herro attempts a 3Pt. Contested by Tracy Bryant (3.8 feet, ZONE). SHAQUILLE HERRO MAKES IT! Assist: Luka Wall
Score: 61-89

[10:27] Team_018 possession (Score: 61-89)
Michael Simons makes the Layup and draws the foul on Shaquille Herro! And-1! Michael Simons to the line for 1. [Team fouls: 1] (Shaquille Herro: 1 personal fouls)   FT 1/1: GOOD Michael Simons makes 1/1 from the line.
Score: 61-92

[10:17] Team_055 possession (Score: 61-92)
Shaquille Herro attempts a 3Pt. Contested by Tracy Bryant (4.0 feet, MAN). Shaquille Herro misses. Rebound secured by Domantas Wall.

[10:02] Team_018 possession (Score: 61-92)
Allen Markkanen commits a violation (traveling/carry)! TURNOVER! (dead ball)

[10:02] Substitution (Team_055): Shaquille Herro OUT → Dirk Duncan IN (stamina_rule2)

[10:02] Substitution (Team_055): Kevin Bane OUT → Kyle Wall IN (stamina_rule2)

[10:02] Substitution (Team_055): Jrue Sabonis OUT → Malcolm Williamson IN (stamina_rule2)

[10:02] Substitution (Team_055): Chris Turner OUT → D'Angelo Antetokounmpo IN (stamina_rule2)

[10:02] Substitution (Team_018): Tracy Bryant OUT → Miles Herro IN (stamina_rule2)

[10:02] Substitution (Team_018): Allen Markkanen OUT → Austin Antetokounmpo IN (stamina_rule2)

[10:02] Substitution (Team_018): Bones Anunoby OUT → Shai Wade IN (stamina_rule2)

[10:02] Substitution (Team_018): Domantas Wall OUT → Julius Jackson IN (stamina_rule2)

[09:47] Team_055 possession (Score: 61-92)
Dirk Duncan attempts a Layup. Contested by Julius Jackson (4.4 feet, ZONE). Dirk Duncan misses. Rebound secured by Julius Jackson.

[09:34] Team_018 possession (Score: 61-92)
Austin Antetokounmpo loses control! Ball rolls out of bounds! TURNOVER! (dead ball)

[09:21] Team_055 possession (Score: 61-92)
Kyle Wall attempts a 3Pt. Contested by Austin Antetokounmpo (5.4 feet, MAN). Kyle Wall misses. Rebound secured by Julius Jackson.

[09:05] Team_018 possession (Score: 61-92)
Michael Simons makes the Layup and draws the foul on Luka Wall! And-1! Michael Simons to the line for 1. [Team fouls: 2] (Luka Wall: 1 personal fouls)   FT 1/1: GOOD Michael Simons makes 1/1 from the line.
Score: 61-95

[08:48] Team_055 possession (Score: 61-95)
D'Angelo Antetokounmpo attempts a 3Pt. Contested by Michael Simons (5.9 feet, ZONE). D'Angelo Antetokounmpo misses. Offensive rebound by D'Angelo Antetokounmpo! D'Angelo Antetokounmpo puts it back in!
Score: 63-95

[08:38] Team_018 possession (Score: 63-95)
Miles Herro attempts a Layup. Contested by Malcolm Williamson (4.2 feet, ZONE). MILES HERRO MAKES IT! Assist: Julius Jackson
Score: 63-97

[08:23] Team_055 possession (Score: 63-97)
Malcolm Williamson attempts a Layup. Contested by Shai Wade (5.3 feet, MAN). Malcolm Williamson misses. Offensive rebound by D'Angelo Antetokounmpo! D'Angelo Antetokounmpo puts it back in!
Score: 65-97

[08:11] Team_018 possession (Score: 65-97)
FOUL! Reach-in foul on Malcolm Williamson during the drive. [Team fouls: 3] No free throws, side out. (Malcolm Williamson: 1 personal fouls)

[07:54] Team_018 possession (Score: 65-97)
Michael Simons attempts a 3Pt. Contested by Malcolm Williamson (4.3 feet, ZONE). Michael Simons misses. Rebound secured by Malcolm Williamson.

[07:40] Team_055 possession (Score: 65-97)
D'Angelo Antetokounmpo drives, Julius Jackson stays with him. D'Angelo Antetokounmpo attempts a Layup. Contested by Julius Jackson (5.3 feet, MAN). D'Angelo Antetokounmpo misses. Rebound secured by Austin Antetokounmpo.

[07:29] Team_018 possession (Score: 65-97)
Miles Herro attempts a Midrange. Contested by Kyle Wall (4.4 feet, ZONE). Miles Herro misses. Rebound secured by Malcolm Williamson.

[07:15] Team_055 possession (Score: 65-97)
D'Angelo Antetokounmpo drives to the basket... D'Angelo Antetokounmpo loses the ball! Stripped by Julius Jackson! TURNOVER! (live ball)

[06:56] Team_018 possession (Score: 65-97)
Michael Simons attempts a 3Pt. Contested by Malcolm Williamson (4.3 feet, ZONE). Michael Simons misses. Offensive rebound by Julius Jackson! Julius Jackson kicks it out.

[06:42] Team_018 possession (Score: 65-97)
Michael Simons attempts a 3Pt. Contested by Luka Wall (6.0 feet, MAN). Michael Simons misses. Offensive rebound by Shai Wade! Shai Wade kicks it out.

[06:31] Team_018 possession (Score: 65-97)
Miles Herro attempts a Layup. Contested by Malcolm Williamson (4.2 feet, ZONE). MILES HERRO MAKES IT!
Score: 65-99

[06:16] Team_055 possession (Score: 65-99)
Kyle Wall attempts a Midrange. Contested by Austin Antetokounmpo (5.4 feet, MAN). KYLE WALL MAKES IT! Assist: Dirk Duncan
Score: 67-99

[05:59] Team_018 possession (Score: 67-99)
Austin Antetokounmpo attempts a 3Pt. Contested by Kyle Wall (3.6 feet, MAN). Austin Antetokounmpo misses. Rebound secured by Dirk Duncan.

[05:45] Team_055 possession (Score: 67-99)
Malcolm Williamson attempts a 3Pt. Contested by Michael Simons (5.8 feet, ZONE). Malcolm Williamson misses. Rebound secured by Austin Antetokounmpo.

[05:32] Team_018 possession (Score: 67-99)
Miles Herro attempts a 3Pt. Contested by Kyle Wall (4.4 feet, ZONE). MILES HERRO MAKES IT! Assist: Julius Jackson
Score: 67-102

[05:23] Team_055 possession (Score: 67-102)
Malcolm Williamson attempts a Layup. Contested by Julius Jackson (5.1 feet, ZONE). Malcolm Williamson misses. Rebound secured by Austin Antetokounmpo.

[05:09] Team_018 possession (Score: 67-102)
Julius Jackson attempts a 3Pt. Contested by D'Angelo Antetokounmpo (4.9 feet, MAN). Julius Jackson misses. Rebound secured by Malcolm Williamson.

[04:55] Team_055 possession (Score: 67-102)
D'Angelo Antetokounmpo attempts a Midrange. Contested by Julius Jackson (5.3 feet, MAN). D'Angelo Antetokounmpo misses. Offensive rebound by D'Angelo Antetokounmpo! D'Angelo Antetokounmpo's putback is no good. Offensive rebound by Malcolm Williamson! Malcolm Williamson kicks it out.

[04:38] Team_055 possession (Score: 67-102)
Malcolm Williamson makes the Dunk and draws the foul on Miles Herro! And-1! Malcolm Williamson to the line for 1. [Team fouls: 3] (Miles Herro: 1 personal fouls)   FT 1/1: GOOD Malcolm Williamson makes 1/1 from the line.
Score: 70-102

[04:27] Team_018 possession (Score: 70-102)
Miles Herro drives, Malcolm Williamson stays with him. Miles Herro attempts a Layup. Contested by Malcolm Williamson (4.2 feet, ZONE). MILES HERRO MAKES IT! Assist: Julius Jackson
Score: 70-104

[04:12] Team_055 possession (Score: 70-104)
D'Angelo Antetokounmpo attempts a Midrange. Contested by Julius Jackson (5.3 feet, MAN). D'Angelo Antetokounmpo misses. Rebound secured by Austin Antetokounmpo.

[04:01] Team_018 possession (Score: 70-104)
Michael Simons attempts a 3Pt. Wide open! Luka Wall is 6.1 feet away. [MAN] Michael Simons misses. Rebound secured by Dirk Duncan.

[03:45] Team_055 possession (Score: 70-104)
Malcolm Williamson drives, picks up Julius Jackson. Help arrives from Miles Herro! Malcolm Williamson attempts a Dunk. Contested by Miles Herro (5.1 feet, ZONE). MALCOLM WILLIAMSON MAKES IT!
Score: 72-104

[03:32] Team_018 possession (Score: 72-104)
Michael Simons attempts a 3Pt. Wide open! Luka Wall is 6.1 feet away. [MAN] MICHAEL SIMONS MAKES IT! Assist: Julius Jackson
Score: 72-107

[03:17] Team_055 possession (Score: 72-107)
Malcolm Williamson attempts a Midrange. Contested by Shai Wade (5.3 feet, MAN). MALCOLM WILLIAMSON MAKES IT! Assist: Dirk Duncan
Score: 74-107

[03:02] Team_018 possession (Score: 74-107)
Miles Herro attempts a Layup. Contested by Malcolm Williamson (4.2 feet, ZONE). MILES HERRO MAKES IT! Assist: Michael Simons
Score: 74-109

[02:44] Team_055 possession (Score: 74-109)
Malcolm Williamson attempts a Layup. BLOCKED BY SHAI WADE! Ball is loose! Rebound secured by Austin Antetokounmpo.

[02:31] Team_018 possession (Score: 74-109)
Miles Herro attempts a Midrange. Contested by D'Angelo Antetokounmpo (4.7 feet, ZONE). Miles Herro misses. Rebound secured by Kyle Wall.

[02:17] Team_055 possession (Score: 74-109)
Dirk Duncan attempts a 3Pt. Contested by Miles Herro (5.2 feet, MAN). Dirk Duncan misses. Rebound secured by Shai Wade.

[02:00] Team_018 possession (Score: 74-109)
Julius Jackson drives, D'Angelo Antetokounmpo stays with him. Julius Jackson attempts a Dunk. Contested by D'Angelo Antetokounmpo (4.9 feet, MAN). JULIUS JACKSON MAKES IT! Assist: Michael Simons
Score: 74-111

[01:48] Team_055 possession (Score: 74-111)
D'Angelo Antetokounmpo attempts a Midrange. Wide open! Miles Herro is 6.0 feet away. [ZONE] D'Angelo Antetokounmpo misses. Rebound secured by Austin Antetokounmpo.

[01:34] Team_018 possession (Score: 74-111)
Miles Herro attempts a Midrange. Contested by D'Angelo Antetokounmpo (4.8 feet, ZONE). Miles Herro misses. FOUL! Loose ball foul on Malcolm Williamson during the rebound battle. [Team fouls: 4] No free throws, side out. (Malcolm Williamson: 2 personal fouls)

[01:19] Team_018 possession (Score: 74-111)
Julius Jackson drives and kicks out. Shai Wade attempts a 3Pt. Contested by Malcolm Williamson (4.1 feet, MAN). Shai Wade misses. FOUL! Loose ball foul on Malcolm Williamson during the rebound battle. [IN THE BONUS! 5 team fouls] Julius Jackson to the line for 2 free throws. (Malcolm Williamson: 3 personal fouls)   FT 1/2: MISS   FT 2/2: MISS Julius Jackson makes 0/2 from the line. Rebound secured by D'Angelo Antetokounmpo.

[01:04] Team_055 possession (Score: 74-111)
D'Angelo Antetokounmpo attempts a Midrange. Wide open! Miles Herro is 6.1 feet away. [ZONE] D'ANGELO ANTETOKOUNMPO MAKES IT! Assist: Malcolm Williamson
Score: 76-111

[00:49] Team_018 possession (Score: 76-111)
Miles Herro drives and kicks out. Shai Wade attempts a 3Pt. Contested by Kyle Wall (4.4 feet, ZONE). SHAI WADE MAKES IT! Assist: Miles Herro
Score: 76-114

[00:31] Team_055 possession (Score: 76-114)
FOUL! Holding foul on Austin Antetokounmpo. [Team fouls: 4] No free throws, side out. (Austin Antetokounmpo: 1 personal fouls)

[00:16] Team_055 possession (Score: 76-114)
Kyle Wall attempts a Layup. BLOCKED BY MILES HERRO! Ball is loose! Rebound secured by Shai Wade.

[00:03] Team_018 possession (Score: 76-114)
Michael Simons attempts a 3Pt. Contested by Kyle Wall (4.7 feet, ZONE). Michael Simons misses. Rebound secured by Malcolm Williamson.

================================================================================
                              4TH QUARTER COMPLETE                              
================================================================================

4TH QUARTER SCORE: Team_055 24, Team_018 28

BOX SCORE:
================================================================================

Team_055
--------------------------------------------------------------------------------
Player                MIN  PTS  REB  AST  TO      FG   FG%      3P   3P%
--------------------------------------------------------------------------------
Malcolm Williamson     12    7    5    1   0   3/6    50.0     0/0   0.0
D'Angelo Antetokounmpo   12    6    3    0   0   3/6    50.0     0/0   0.0
Shaquille Herro        36    3    0    0   0   1/3    33.3     0/0   0.0
Chris Turner           36    3    1    0   0   1/1   100.0     0/0   0.0
Jrue Sabonis           36    3    1    0   0   1/1   100.0     0/0   0.0
Kyle Wall              10    2    1    0   0   1/3    33.3     0/0   0.0
Luka Wall              14    0    0    1   0   0/0     0.0     0/0   0.0
Dirk Duncan            12    0    2    2   0   0/2     0.0     0/0   0.0

TEAM: FG: 10/22 (45.5%), 3PT: 1/6 (16.7%), REB: 12 (3 off, 9 def), AST: 4, TO: 1
TEAM FOULS: 5 [Team_018 in BONUS]


Team_018
--------------------------------------------------------------------------------
Player                MIN  PTS  REB  AST  TO      FG   FG%      3P   3P%
--------------------------------------------------------------------------------
Michael Simons         12   12    0    2   0   4/7    57.1     0/0   0.0
Miles Herro            10   11    0    1   0   5/7    71.4     0/0   0.0
Shai Wade              12    3    3    0   0   1/1   100.0     0/0   0.0
Julius Jackson         12    2    4    4   0   1/3    33.3     0/0   0.0
Bones Anunoby          36    0    1    0   0   0/1     0.0     0/0   0.0
Domantas Wall          36    0    1    1   0   0/0     0.0     0/0   0.0
Tracy Bryant           38    0    0    0   0   0/1     0.0     0/0   0.0
Austin Antetokounmpo   10    0    6    0   0   0/1     0.0     0/0   0.0

TEAM: FG: 11/21 (52.4%), 3PT: 2/9 (22.2%), REB: 16 (4 off, 12 def), AST: 8, TO: 2
TEAM FOULS: 4

================================================================================

================================================================================
                               FULL GAME COMPLETE                               
================================================================================

FINAL SCORE: Team_055 76, Team_018 114

SCORING BY QUARTER:
--------------------------------------------------------------------------------
Team                     Q1     Q2     Q3     Q4    FINAL
--------------------------------------------------------------------------------
Team_055                 17     19     16     24       76
Team_018                 32     20     34     28      114
--------------------------------------------------------------------------------

FULL GAME BOX SCORE:
================================================================================

Team_055
--------------------------------------------------------------------------------
Player                MIN  PTS  REB  AST  TO      FG   FG%      3P   3P%      FT STL BLK
--------------------------------------------------------------------------------
Kevin Bane             38    4    8    1   0   2/9    22.2   0/3     0.0   0/0     0   0
Shaquille Herro        36   13    0    2   0   6/12   50.0   1/5    20.0   2/2     1   0
Jrue Sabonis           36   15   10    3   1  10/16   62.5   0/3     0.0   7/9     0   0
Chris Turner           36   19   17    2   1   5/8    62.5   0/0     0.0   5/5     0   0
Devin Siakam           34    8    0    1   4   3/14   21.4   0/4     0.0   4/6     0   0
Luka Wall              14    0    0    1   0   0/0     0.0   0/0     0.0   0/0     0   0
Dirk Duncan            12    0    2    2   0   0/2     0.0   0/1     0.0   0/0     0   0
Malcolm Williamson     12    7    6    1   1   4/7    57.1   0/1     0.0   1/1     0   0
D'Angelo Antetokounmpo   12    6    3    0   0   2/7    28.6   1/1   100.0   0/0     0   0
Kyle Wall              10    2    1    0   1   1/3    33.3   0/1     0.0   0/0     0   0

TEAM: FG: 35/80 (43.8%), 3PT: 2/19 (10.5%), REB: 48 (15 off, 33 def), AST: 13, TO: 8


Team_018
--------------------------------------------------------------------------------
Player                MIN  PTS  REB  AST  TO      FG   FG%      3P   3P%      FT STL BLK
--------------------------------------------------------------------------------
Tracy Bryant           38   13    2    5   4   6/15   40.0   2/6    33.3   4/5     0   0
Allen Markkanen        38   17   10    3   2   8/12   66.7   2/4    50.0   3/5     0   0
Bones Anunoby          36   13   15    2   0   8/14   57.1   3/8    37.5   5/6     1   0
Domantas Wall          36   20   18    5   0   5/7    71.4   0/1     0.0   4/5     0   1
Klay Stewart           36   13    0    4   0   6/11   54.5   3/4    75.0   3/5     1   1
Michael Simons         12   12    0    2   0   3/6    50.0   1/4    25.0   2/2     0   0
Shai Wade              12    5    3    0   0   1/1   100.0   0/0     0.0   0/0     0   1
Julius Jackson         12    4    5    4   0   2/4    50.0   0/1     0.0   0/2     2   0
Miles Herro            10   11    0    1   0   6/8    75.0   1/1   100.0   0/0     0   1
Austin Antetokounmpo   10    0    6    0   1   0/1     0.0   0/1     0.0   0/0     0   0

TEAM: FG: 45/80 (56.2%), 3PT: 12/30 (40.0%), REB: 57 (14 off, 43 def), AST: 26, TO: 7

================================================================================
