================================================================================
                        FULL GAME - Team_065 vs Team_006                        
================================================================================

================================================================================
                       1ST QUARTER - Team_065 vs Team_006                       
================================================================================

[12:00] Team_065 possession (Score: 0-0)
RJ Harden drives and kicks out. Karl Booker attempts a 3Pt. Contested by Bradley Gobert (2.8 feet, MAN). Karl Booker misses. Rebound secured by Ja Butler.

[11:49] Team_006 possession (Score: 0-0)
Franz Wagner attempts a 3Pt. Contested by RJ Harden (4.0 feet, ZONE). Franz Wagner misses. Rebound secured by Russell Wade.

[11:37] Team_065 possession (Score: 0-0)
Paul Williamson attempts a 3Pt. Contested by Jayson Young (4.7 feet, ZONE). Paul Williamson misses. Rebound secured by Ja Butler.

[11:23] Team_006 possession (Score: 0-0)
FOUL! Shooting foul on Russell Wade. Ja Butler to the line for 2 free throws. [Team fouls: 1] (Russell Wade: 1 personal fouls)   FT 1/2: GOOD   FT 2/2: MISS Ja Butler makes 1/2 from the line. Offensive rebound by Bradley Gobert! Bradley Gobert kicks it out.
Score: 0-1

[11:09] Team_006 possession (Score: 0-1)
Jayson Young makes the Dunk and draws the foul on Manu McGrady! And-1! Jayson Young to the line for 1. [Team fouls: 2] (Manu McGrady: 1 personal fouls)   FT 1/1: MISS Jayson Young makes 0/1 from the line. Rebound secured by Russell Wade.
Score: 0-3

[10:51] Team_065 possession (Score: 0-3)
Russell Wade makes the Layup and draws the foul on Ja Butler! And-1! Russell Wade to the line for 1. [Team fouls: 1] (Ja Butler: 1 personal fouls)   FT 1/1: GOOD Russell Wade makes 1/1 from the line.
Score: 3-3

[10:38] Team_006 possession (Score: 3-3)
Franz Wagner makes the Midrange and draws the foul on Paul Williamson! And-1! Franz Wagner to the line for 1. [Team fouls: 3] (Paul Williamson: 1 personal fouls)   FT 1/1: GOOD Franz Wagner makes 1/1 from the line.
Score: 3-6

[10:26] Team_065 possession (Score: 3-6)
Russell Wade attempts a Midrange. Contested by Franz Wagner (4.9 feet, ZONE). Russell Wade misses. Offensive rebound by Manu McGrady! Manu McGrady kicks it out.

[10:15] Team_065 possession (Score: 3-6)
FOUL! Reach-in foul on Jayson Young during the drive. [Team fouls: 2] No free throws, side out. (Jayson Young: 1 personal fouls)

[10:04] Team_065 possession (Score: 3-6)
Russell Wade attempts a 3Pt. Contested by Ja Butler (2.9 feet, MAN). Russell Wade misses. Rebound secured by Shai Westbrook.

[09:50] Team_006 possession (Score: 3-6)
Franz Wagner attempts a Layup. Contested by Karl Booker (4.9 feet, ZONE). FRANZ WAGNER MAKES IT!
Score: 3-8

[09:37] Team_065 possession (Score: 3-8)
Russell Wade attempts a 3Pt. Contested by Shai Westbrook (3.9 feet, ZONE). Russell Wade misses. Rebound secured by Ja Butler.

[09:25] Team_006 possession (Score: 3-8)
Bradley Gobert attempts a Layup. Contested by Russell Wade (2.9 feet, ZONE). Bradley Gobert misses. Rebound secured by Manu McGrady.

[09:09] Team_065 possession (Score: 3-8)
Russell Wade drives and kicks out. Manu McGrady attempts a Midrange. Contested by Ja Butler (2.9 feet, ZONE). Manu McGrady misses. Rebound secured by Bradley Gobert.

[08:54] Team_006 possession (Score: 3-8)
Shai Westbrook attempts a 3Pt. Contested by RJ Harden (3.9 feet, MAN). Shai Westbrook misses. Rebound secured by Russell Wade.

[08:39] Team_065 possession (Score: 3-8)
Manu McGrady drives and kicks out. Manu McGrady attempts a 3Pt. Contested by Shai Westbrook (3.8 feet, ZONE). Manu McGrady misses. Rebound secured by Shai Westbrook.

[08:28] Team_006 possession (Score: 3-8)
Bradley Gobert attempts a Layup. Contested by Russell Wade (2.9 feet, MAN). BRADLEY GOBERT MAKES IT! Assist: Jayson Young
Score: 3-10

[08:12] Team_065 possession (Score: 3-10)
Manu McGrady attempts a 3Pt. Contested by Jayson Young (4.5 feet, MAN). Manu McGrady misses. Rebound secured by Ja Butler.

[07:59] Team_006 possession (Score: 3-10)
Bradley Gobert drives, Russell Wade stays with him. Bradley Gobert attempts a Layup. Contested by Russell Wade (2.9 feet, ZONE). Bradley Gobert misses. FOUL! Loose ball foul on Manu McGrady during the rebound battle. [Team fouls: 4] No free throws, side out. (Manu McGrady: 2 personal fouls)

[07:48] Team_006 possession (Score: 3-10)
Bradley Gobert drives to the basket... Bradley Gobert loses the ball! Stripped by Russell Wade! TURNOVER! (live ball)

[07:33] Team_065 possession (Score: 3-10)
Manu McGrady attempts a Layup. Contested by Jayson Young (4.5 feet, MAN). Manu McGrady misses. Offensive rebound by Russell Wade! Russell Wade's putback is no good. Rebound secured by Ja Butler.

[07:19] Team_006 possession (Score: 3-10)
Bradley Gobert makes the Dunk and draws the foul on Paul Williamson! And-1! Bradley Gobert to the line for 1. [BONUS: 5 team fouls] (Paul Williamson: 2 personal fouls)   FT 1/1: MISS Bradley Gobert makes 0/1 from the line. Rebound secured by Manu McGrady.
Score: 3-12

[07:07] Team_065 possession (Score: 3-12)
Manu McGrady attempts a 3Pt. Contested by Shai Westbrook (3.8 feet, ZONE). Manu McGrady misses. Rebound secured by Shai Westbrook.

[06:55] Team_006 possession (Score: 3-12)
Jayson Young attempts a 3Pt. Contested by Manu McGrady (4.9 feet, MAN). Jayson Young misses. Rebound secured by RJ Harden.

[06:46] Team_065 possession (Score: 3-12)
RJ Harden drives, picks up Shai Westbrook. Help arrives from Franz Wagner! RJ Harden attempts a Layup. Contested by Franz Wagner (4.2 feet, MAN). RJ HARDEN MAKES IT! Assist: Karl Booker
Score: 5-12

[06:26] Team_006 possession (Score: 5-12)
Ja Butler drives, Russell Wade stays with him. Ja Butler attempts a Layup. Contested by Russell Wade (3.2 feet, MAN). Ja Butler misses. Rebound secured by Russell Wade.

[06:08] Team_065 possession (Score: 5-12)
FOUL! Reach-in foul on Bradley Gobert during the drive. [Team fouls: 3] No free throws, side out. (Bradley Gobert: 1 personal fouls)

[05:51] Team_065 possession (Score: 5-12)
Karl Booker drives and kicks out. Manu McGrady attempts a 3Pt. Contested by Jayson Young (4.6 feet, MAN). Manu McGrady misses. Rebound secured by Shai Westbrook.

[05:37] Team_006 possession (Score: 5-12)
Jayson Young drives and kicks out. Jayson Young attempts a Midrange. Contested by Paul Williamson (3.4 feet, ZONE). Jayson Young misses. Offensive rebound by Ja Butler! Ja Butler's putback is no good. Rebound secured by RJ Harden.

[05:27] Team_065 possession (Score: 5-12)
FOUL! Holding foul on Franz Wagner. [Team fouls: 4] No free throws, side out. (Franz Wagner: 1 personal fouls)

[05:09] Team_065 possession (Score: 5-12)
Paul Williamson attempts a 3Pt. Contested by Franz Wagner (5.0 feet, MAN). PAUL WILLIAMSON MAKES IT! Assist: RJ Harden
Score: 8-12

[04:59] Team_006 possession (Score: 8-12)
Bradley Gobert attempts a 3Pt. Contested by RJ Harden (3.8 feet, ZONE). Bradley Gobert misses. Rebound secured by RJ Harden.

[04:47] Team_065 possession (Score: 8-12)
Russell Wade attempts a 3Pt. Contested by Ja Butler (3.1 feet, MAN). RUSSELL WADE MAKES IT! Assist: Paul Williamson
Score: 11-12

[04:37] Team_006 possession (Score: 11-12)
Shai Westbrook attempts a Midrange. Contested by RJ Harden (3.9 feet, MAN). Shai Westbrook misses. FOUL! Loose ball foul on Manu McGrady during the rebound battle. [IN THE BONUS! 6 team fouls] Bradley Gobert to the line for 2 free throws. (Manu McGrady: 3 personal fouls)   FT 1/2: MISS   FT 2/2: MISS Bradley Gobert makes 0/2 from the line. Rebound secured by Manu McGrady.

[04:23] Team_065 possession (Score: 11-12)
Karl Booker attempts a Midrange. Contested by Bradley Gobert (3.0 feet, MAN). Karl Booker misses. Rebound secured by Bradley Gobert.

[04:09] Team_006 possession (Score: 11-12)
Franz Wagner attempts a Midrange. Contested by Karl Booker (5.0 feet, ZONE). FRANZ WAGNER MAKES IT!
Score: 11-14

[03:53] Team_065 possession (Score: 11-14)
RJ Harden attempts a Midrange. Contested by Franz Wagner (5.4 feet, ZONE). RJ HARDEN MAKES IT! Assist: Russell Wade
Score: 13-14

[03:37] Team_006 possession (Score: 13-14)
Franz Wagner drives, picks up Paul Williamson. Help arrives from Manu McGrady! Franz Wagner attempts a Layup. Contested by Manu McGrady (3.7 feet, MAN). FRANZ WAGNER MAKES IT! Assist: Ja Butler
Score: 13-16

[03:18] Team_065 possession (Score: 13-16)
FOUL! Holding foul on Ja Butler. [IN THE BONUS! 5 team fouls] Russell Wade to the line for 2 free throws. (Ja Butler: 2 personal fouls)   FT 1/2: GOOD   FT 2/2: GOOD Russell Wade makes 2/2 from the line.
Score: 15-16

[03:02] Team_006 possession (Score: 15-16)
FOUL! Reach-in foul on Russell Wade during the drive. [IN THE BONUS! 7 team fouls] Franz Wagner to the line for 2 free throws. (Russell Wade: 2 personal fouls)   FT 1/2: GOOD   FT 2/2: GOOD Franz Wagner makes 2/2 from the line.
Score: 15-18

[02:45] Team_065 possession (Score: 15-18)
FOUL! Reach-in foul on Franz Wagner during the drive. [IN THE BONUS! 6 team fouls] Paul Williamson to the line for 2 free throws. (Franz Wagner: 2 personal fouls)   FT 1/2: GOOD   FT 2/2: GOOD Paul Williamson makes 2/2 from the line.
Score: 17-18

[02:32] Team_006 possession (Score: 17-18)
Franz Wagner attempts a 3Pt. Contested by Paul Williamson (3.8 feet, MAN). Franz Wagner misses. Rebound secured by Russell Wade.

[02:19] Team_065 possession (Score: 17-18)
RJ Harden attempts a Layup. Contested by Ja Butler (3.7 feet, ZONE). RJ Harden misses. Rebound secured by Bradley Gobert.

[02:03] Team_006 possession (Score: 17-18)
Bradley Gobert drives and kicks out. Jayson Young attempts a 3Pt. Contested by RJ Harden (4.2 feet, ZONE). Jayson Young misses. Offensive rebound by Ja Butler! Ja Butler puts it back in!
Score: 17-20

[01:50] Team_065 possession (Score: 17-20)
Russell Wade attempts a 3Pt. Contested by Shai Westbrook (4.2 feet, ZONE). Russell Wade misses. Rebound secured by Shai Westbrook.

[01:37] Team_006 possession (Score: 17-20)
Franz Wagner attempts a 3Pt. Contested by Paul Williamson (3.9 feet, MAN). Franz Wagner misses. Rebound secured by Manu McGrady.

[01:23] Team_065 possession (Score: 17-20)
Karl Booker drives and kicks out. Paul Williamson attempts a 3Pt. Contested by Shai Westbrook (4.3 feet, ZONE). Paul Williamson misses. Offensive rebound by Manu McGrady! Manu McGrady kicks it out.

[01:13] Team_065 possession (Score: 17-20)
RJ Harden attempts a 3Pt. Contested by Jayson Young (5.4 feet, ZONE). RJ Harden misses. FOUL! Loose ball foul on Bradley Gobert during the rebound battle. [IN THE BONUS! 7 team fouls] Manu McGrady to the line for 2 free throws. (Bradley Gobert: 2 personal fouls)   FT 1/2: GOOD   FT 2/2: GOOD Manu McGrady makes 2/2 from the line.
Score: 19-20

[00:59] Team_006 possession (Score: 19-20)
FOUL! Shooting foul on Paul Williamson. Bradley Gobert to the line for 2 free throws. [BONUS: 8 team fouls] (Paul Williamson: 3 personal fouls)   FT 1/2: GOOD   FT 2/2: MISS Bradley Gobert makes 1/2 from the line. Rebound secured by RJ Harden.
Score: 19-21

[00:43] Team_065 possession (Score: 19-21)
FOUL! Holding foul on Ja Butler. [IN THE BONUS! 8 team fouls] Russell Wade to the line for 2 free throws. (Ja Butler: 3 personal fouls)   FT 1/2: GOOD   FT 2/2: GOOD Russell Wade makes 2/2 from the line.
Score: 21-21

[00:28] Team_006 possession (Score: 21-21)
Franz Wagner drives to the basket... Franz Wagner throws a bad pass! Stolen by Russell Wade! TURNOVER! (live ball)

[00:16] Team_065 possession (Score: 21-21)
RJ Harden makes the Layup and draws the foul on Bradley Gobert! And-1! RJ Harden to the line for 1. [BONUS: 9 team fouls] (Bradley Gobert: 3 personal fouls)   FT 1/1: MISS RJ Harden makes 0/1 from the line. Rebound secured by Bradley Gobert.
Score: 23-21

[00:03] Team_006 possession (Score: 23-21)
Shai Westbrook drives to the basket... Shai Westbrook throws a bad pass! Stolen by RJ Harden! TURNOVER! (live ball)

================================================================================
                              1ST QUARTER COMPLETE                              
================================================================================

1ST QUARTER SCORE: Team_065 23, Team_006 21

BOX SCORE:
================================================================================

Team_065
--------------------------------------------------------------------------------
Player                MIN  PTS  REB  AST  TO      FG   FG%      3P   3P%
--------------------------------------------------------------------------------
Russell Wade           12   10    5    1   0   4/8    50.0     0/0   0.0
Paul Williamson        12    5    0    1   0   2/3    66.7     0/0   0.0
RJ Harden              12    4    4    1   0   2/5    40.0     0/0   0.0
Manu McGrady           12    2    6    0   0   1/5    20.0     0/0   0.0
Karl Booker            12    0    0    1   0   0/2     0.0     0/0   0.0

TEAM: FG: 9/23 (39.1%), 3PT: 3/9 (33.3%), REB: 14 (3 off, 11 def), AST: 4, TO: 0
TEAM FOULS: 8 [Team_006 in BONUS]


Team_006
--------------------------------------------------------------------------------
Player                MIN  PTS  REB  AST  TO      FG   FG%      3P   3P%
--------------------------------------------------------------------------------
Franz Wagner           12   11    0    0   0   5/8    62.5     0/0   0.0
Ja Butler              12    2    7    1   0   1/2    50.0     0/0   0.0
Bradley Gobert         12    2    5    0   0   1/5    20.0     0/0   0.0
Jayson Young           12    0    0    1   0   0/3     0.0     0/0   0.0
Shai Westbrook         12    0    5    0   0   0/2     0.0     0/0   0.0

TEAM: FG: 7/20 (35.0%), 3PT: 0/6 (0.0%), REB: 18 (5 off, 13 def), AST: 2, TO: 3
TEAM FOULS: 9 [Team_065 in BONUS]

================================================================================

================================================================================
                       2ND QUARTER - Team_065 vs Team_006                       
================================================================================

[12:00] Team_065 possession (Score: 23-21)
Karl Booker attempts a Midrange. Contested by Bradley Gobert (3.3 feet, MAN). Karl Booker misses. Rebound secured by Ja Butler.

[11:43] Team_006 possession (Score: 23-21)
Jayson Young attempts a 3Pt. Contested by RJ Harden (4.5 feet, ZONE). Jayson Young misses. Rebound secured by Russell Wade.

[11:29] Team_065 possession (Score: 23-21)
FOUL! Holding foul on Ja Butler. [Team fouls: 1] No free throws, side out. (Ja Butler: 1 personal fouls)

[11:17] Team_065 possession (Score: 23-21)
FOUL! Shooting foul on Franz Wagner. Paul Williamson to the line for 2 free throws. [Team fouls: 2] (Franz Wagner: 1 personal fouls)   FT 1/2: GOOD   FT 2/2: GOOD Paul Williamson makes 2/2 from the line.
Score: 25-21

[10:59] Team_006 possession (Score: 25-21)
Ja Butler attempts a Layup. Contested by Russell Wade (3.6 feet, MAN). JA BUTLER MAKES IT! Assist: Shai Westbrook
Score: 25-23

[10:43] Team_065 possession (Score: 25-23)
Paul Williamson drives and kicks out. RJ Harden attempts a 3Pt. Contested by Shai Westbrook (4.3 feet, MAN). RJ Harden misses. Rebound secured by Bradley Gobert.

[10:28] Team_006 possession (Score: 25-23)
Ja Butler makes the Dunk and draws the foul on Paul Williamson! And-1! Ja Butler to the line for 1. [Team fouls: 1] (Paul Williamson: 1 personal fouls)   FT 1/1: GOOD Ja Butler makes 1/1 from the line.
Score: 25-26

[10:09] Team_065 possession (Score: 25-26)
Paul Williamson attempts a Midrange. Contested by Franz Wagner (5.5 feet, MAN). Paul Williamson misses. Rebound secured by Ja Butler.

[09:57] Team_006 possession (Score: 25-26)
Jayson Young attempts a 3Pt. Contested by RJ Harden (4.7 feet, ZONE). Jayson Young misses. Offensive rebound by Bradley Gobert! Bradley Gobert kicks it out.

[09:38] Team_006 possession (Score: 25-26)
Jayson Young attempts a 3Pt. Contested by RJ Harden (4.8 feet, ZONE). Jayson Young misses. Offensive rebound by Shai Westbrook! Shai Westbrook kicks it out.

[09:19] Team_006 possession (Score: 25-26)
Bradley Gobert drives, Russell Wade stays with him. Bradley Gobert attempts a Dunk. Contested by Russell Wade (3.5 feet, MAN). BRADLEY GOBERT MAKES IT!
Score: 25-28

[09:02] Team_065 possession (Score: 25-28)
Karl Booker attempts a Layup. Contested by Bradley Gobert (3.7 feet, MAN). KARL BOOKER MAKES IT!
Score: 27-28

[08:46] Team_006 possession (Score: 27-28)
Jayson Young drives, picks up Russell Wade. Help arrives from Paul Williamson! Jayson Young attempts a Dunk. Contested by Paul Williamson (4.0 feet, ZONE). Jayson Young misses. Rebound secured by Manu McGrady.

[08:32] Team_065 possession (Score: 27-28)
Manu McGrady attempts a Layup. Contested by Bradley Gobert (3.8 feet, ZONE). MANU MCGRADY MAKES IT! Assist: RJ Harden
Score: 29-28

[08:18] Team_006 possession (Score: 29-28)
Ja Butler attempts a Midrange. Contested by Russell Wade (3.9 feet, MAN). JA BUTLER MAKES IT! Assist: Bradley Gobert
Score: 29-30

[08:07] Team_065 possession (Score: 29-30)
Russell Wade attempts a Midrange. Contested by Franz Wagner (5.7 feet, ZONE). RUSSELL WADE MAKES IT! Assist: Paul Williamson
Score: 31-30

[07:52] Team_006 possession (Score: 31-30)
Shai Westbrook attempts a 3Pt. Contested by RJ Harden (4.6 feet, ZONE). Shai Westbrook misses. Rebound secured by Manu McGrady.

[07:34] Team_065 possession (Score: 31-30)
FOUL! Shooting foul on Bradley Gobert. Russell Wade to the line for 2 free throws. [Team fouls: 3] (Bradley Gobert: 1 personal fouls)   FT 1/2: GOOD   FT 2/2: MISS Russell Wade makes 1/2 from the line. Rebound secured by Bradley Gobert.
Score: 32-30

[07:21] Team_006 possession (Score: 32-30)
Shai Westbrook drives and kicks out. Bradley Gobert attempts a 3Pt. Contested by Russell Wade (4.0 feet, MAN). Bradley Gobert misses. Rebound secured by Russell Wade.

[07:04] Team_065 possession (Score: 32-30)
Russell Wade makes the Midrange and draws the foul on Ja Butler! And-1! Russell Wade to the line for 1. [Team fouls: 4] (Ja Butler: 2 personal fouls)   FT 1/1: MISS Russell Wade makes 0/1 from the line. Rebound secured by Bradley Gobert.
Score: 34-30

[06:51] Team_006 possession (Score: 34-30)
Ja Butler attempts a 3Pt. Contested by RJ Harden (4.8 feet, ZONE). Ja Butler misses. Rebound secured by Russell Wade.

[06:39] Team_065 possession (Score: 34-30)
Russell Wade attempts a 3Pt. Contested by Shai Westbrook (4.8 feet, ZONE). Russell Wade misses. Offensive rebound by Manu McGrady! Manu McGrady kicks it out.

[06:26] Team_065 possession (Score: 34-30)
FOUL! Reach-in foul on Bradley Gobert during the drive. [IN THE BONUS! 5 team fouls] Karl Booker to the line for 2 free throws. (Bradley Gobert: 2 personal fouls)   FT 1/2: MISS   FT 2/2: GOOD Karl Booker makes 1/2 from the line.
Score: 35-30

[06:10] Team_006 possession (Score: 35-30)
FOUL! Shooting foul on Russell Wade. Bradley Gobert to the line for 2 free throws. [Team fouls: 2] (Russell Wade: 1 personal fouls)   FT 1/2: MISS   FT 2/2: MISS Bradley Gobert makes 0/2 from the line. Rebound secured by RJ Harden.

[05:57] Team_065 possession (Score: 35-30)
Russell Wade attempts a 3Pt. Contested by Ja Butler (4.4 feet, MAN). Russell Wade misses. Rebound secured by Bradley Gobert.

[05:41] Team_006 possession (Score: 35-30)
Bradley Gobert drives to the basket... Bradley Gobert throws a bad pass out of bounds! TURNOVER! (dead ball)

[05:41] Substitution (Team_065): RJ Harden OUT → Paul Curry IN (stamina_rule2)

[05:41] Substitution (Team_065): Paul Williamson OUT → Derrick Poole IN (stamina_rule2)

[05:41] Substitution (Team_065): Manu McGrady OUT → D'Angelo Porzingis IN (stamina_rule2)

[05:41] Substitution (Team_065): Russell Wade OUT → Karl Leonard IN (stamina_rule2)

[05:41] Substitution (Team_065): Karl Booker OUT → Vince Mobley IN (stamina_rule2)

[05:41] Substitution (Team_006): Shai Westbrook OUT → Miles Harris IN (stamina_rule2)

[05:41] Substitution (Team_006): Franz Wagner OUT → Lamelo Westbrook IN (stamina_rule2)

[05:41] Substitution (Team_006): Jayson Young OUT → Vince Sabonis IN (stamina_rule2)

[05:41] Substitution (Team_006): Ja Butler OUT → Cade Ball IN (stamina_rule2)

[05:41] Substitution (Team_006): Bradley Gobert OUT → Shaquille Sexton IN (stamina_rule2)

[05:26] Team_065 possession (Score: 35-30)
Paul Curry attempts a 3Pt. Contested by Lamelo Westbrook (4.0 feet, ZONE). Paul Curry misses. Rebound secured by Cade Ball.

[05:14] Team_006 possession (Score: 35-30)
Shaquille Sexton attempts a Midrange. Contested by Vince Mobley (4.2 feet, MAN). Shaquille Sexton misses. Rebound secured by D'Angelo Porzingis.

[05:01] Team_065 possession (Score: 35-30)
D'Angelo Porzingis commits a violation (traveling/carry)! TURNOVER! (dead ball)

[04:46] Team_006 possession (Score: 35-30)
Miles Harris attempts a 3Pt. Contested by Paul Curry (4.9 feet, MAN). MILES HARRIS MAKES IT!
Score: 35-33

[04:32] Team_065 possession (Score: 35-33)
Derrick Poole attempts a 3Pt. Contested by Lamelo Westbrook (3.6 feet, MAN). Derrick Poole misses. Offensive rebound by D'Angelo Porzingis! D'Angelo Porzingis kicks it out.

[04:13] Team_065 possession (Score: 35-33)
Paul Curry attempts a 3Pt. Contested by Lamelo Westbrook (4.0 feet, ZONE). Paul Curry misses. Rebound secured by Vince Sabonis.

[04:00] Team_006 possession (Score: 35-33)
Shaquille Sexton drives and kicks out. Shaquille Sexton attempts a Midrange. Contested by Derrick Poole (5.0 feet, ZONE). Shaquille Sexton misses. FOUL! Loose ball foul on Karl Leonard during the rebound battle. [Team fouls: 3] No free throws, side out. (Karl Leonard: 1 personal fouls)

[03:45] Team_006 possession (Score: 35-33)
Cade Ball drives, Karl Leonard stays with him. Cade Ball attempts a Dunk. Contested by Karl Leonard (4.4 feet, MAN). Cade Ball misses. Rebound secured by D'Angelo Porzingis.

[03:27] Team_065 possession (Score: 35-33)
Karl Leonard drives, picks up Cade Ball. Help arrives from Lamelo Westbrook! Karl Leonard attempts a Layup. Contested by Lamelo Westbrook (4.5 feet, MAN). Karl Leonard misses. Rebound secured by Cade Ball.

[03:13] Team_006 possession (Score: 35-33)
Shaquille Sexton drives, Vince Mobley stays with him. Shaquille Sexton attempts a Layup. Contested by Vince Mobley (4.2 feet, MAN). Shaquille Sexton misses. Rebound secured by Vince Mobley.

[02:59] Team_065 possession (Score: 35-33)
Karl Leonard drives to the basket... Karl Leonard throws a bad pass out of bounds! TURNOVER! (dead ball)

[02:39] Team_006 possession (Score: 35-33)
Cade Ball attempts a Midrange. Contested by Karl Leonard (4.4 feet, MAN). CADE BALL MAKES IT!
Score: 35-35

[02:26] Team_065 possession (Score: 35-35)
Karl Leonard makes the Midrange and draws the foul on Miles Harris! And-1! Karl Leonard to the line for 1. [BONUS: 6 team fouls] (Miles Harris: 1 personal fouls)   FT 1/1: MISS Karl Leonard makes 0/1 from the line. Rebound secured by Vince Sabonis.
Score: 37-35

[02:12] Team_006 possession (Score: 37-35)
FOUL! Reach-in foul on Vince Mobley during the drive. [Team fouls: 4] No free throws, side out. (Vince Mobley: 1 personal fouls)

[02:00] Team_006 possession (Score: 37-35)
Vince Sabonis makes the Midrange and draws the foul on D'Angelo Porzingis! And-1! Vince Sabonis to the line for 1. [BONUS: 5 team fouls] (D'Angelo Porzingis: 1 personal fouls)   FT 1/1: MISS Vince Sabonis makes 0/1 from the line. Rebound secured by Karl Leonard.
Score: 37-37

[01:46] Team_065 possession (Score: 37-37)
Vince Mobley attempts a Layup. Contested by Cade Ball (4.2 feet, ZONE). VINCE MOBLEY MAKES IT!
Score: 39-37

[01:33] Team_006 possession (Score: 39-37)
Shaquille Sexton attempts a Layup. Contested by Vince Mobley (4.2 feet, ZONE). Shaquille Sexton misses. Offensive rebound by Shaquille Sexton! Shaquille Sexton kicks it out.

[01:22] Team_006 possession (Score: 39-37)
Miles Harris attempts a 3Pt. Contested by Paul Curry (4.9 feet, MAN). Miles Harris misses. Rebound secured by Vince Mobley.

[01:09] Team_065 possession (Score: 39-37)
Derrick Poole drives, Lamelo Westbrook stays with him. Derrick Poole attempts a Dunk. Contested by Lamelo Westbrook (3.6 feet, MAN). Derrick Poole misses. Rebound secured by Cade Ball.

[00:53] Team_006 possession (Score: 39-37)
Lamelo Westbrook attempts a Layup. BLOCKED BY D'ANGELO PORZINGIS! Ball is loose! Rebound secured by D'Angelo Porzingis.

[00:42] Team_065 possession (Score: 39-37)
D'Angelo Porzingis attempts a 3Pt. Contested by Vince Sabonis (4.9 feet, MAN). D'ANGELO PORZINGIS MAKES IT! Assist: Karl Leonard
Score: 42-37

[00:27] Team_006 possession (Score: 42-37)
Cade Ball attempts a Midrange. Contested by Karl Leonard (4.4 feet, MAN). Cade Ball misses. Rebound secured by D'Angelo Porzingis.

[00:15] Team_065 possession (Score: 42-37)
Karl Leonard attempts a Layup. Contested by Cade Ball (4.5 feet, MAN). KARL LEONARD MAKES IT! Assist: Paul Curry
Score: 44-37

[00:03] Team_006 possession (Score: 44-37)
Shaquille Sexton attempts a Midrange. Contested by Vince Mobley (4.2 feet, MAN). Shaquille Sexton misses. Rebound secured by D'Angelo Porzingis.

================================================================================
                              2ND QUARTER COMPLETE                              
================================================================================

2ND QUARTER SCORE: Team_065 21, Team_006 16

BOX SCORE:
================================================================================

Team_065
--------------------------------------------------------------------------------
Player                MIN  PTS  REB  AST  TO      FG   FG%      3P   3P%
--------------------------------------------------------------------------------
Karl Booker            19    3    0    0   0   2/3    66.7     0/0   0.0
D'Angelo Porzingis      6    3    6    0   0   1/1   100.0     0/0   0.0
Russell Wade           19    2    3    0   0   1/4    25.0     0/0   0.0
Paul Williamson        19    2    0    1   0   1/3    33.3     0/0   0.0
Manu McGrady           19    2    3    0   0   1/1   100.0     0/0   0.0
Karl Leonard            6    2    1    1   0   1/3    33.3     0/0   0.0
Vince Mobley            6    2    2    0   0   1/1   100.0     0/0   0.0
RJ Harden              19    0    1    1   0   0/0     0.0     0/0   0.0
Paul Curry              6    0    0    1   0   0/2     0.0     0/0   0.0
Derrick Poole           6    0    0    0   0   0/1     0.0     0/0   0.0

TEAM: FG: 8/19 (42.1%), 3PT: 1/4 (25.0%), REB: 16 (2 off, 14 def), AST: 4, TO: 2
TEAM FOULS: 5 [Team_006 in BONUS]


Team_006
--------------------------------------------------------------------------------
Player                MIN  PTS  REB  AST  TO      FG   FG%      3P   3P%
--------------------------------------------------------------------------------
Ja Butler              19    7    2    0   0   3/4    75.0     0/0   0.0
Miles Harris            6    3    0    0   0   1/2    50.0     0/0   0.0
Bradley Gobert         19    2    5    1   0   1/2    50.0     0/0   0.0
Cade Ball               6    2    4    0   0   1/3    33.3     0/0   0.0
Jayson Young           19    0    0    0   0   0/2     0.0     0/0   0.0
Shai Westbrook         19    0    1    1   0   0/2     0.0     0/0   0.0
Shaquille Sexton        6    0    1    0   0   0/3     0.0     0/0   0.0
Vince Sabonis           6    0    2    0   0   0/1     0.0     0/0   0.0
Lamelo Westbrook        6    0    0    0   0   0/1     0.0     0/0   0.0

TEAM: FG: 6/20 (30.0%), 3PT: 1/5 (20.0%), REB: 15 (4 off, 11 def), AST: 2, TO: 1
TEAM FOULS: 6 [Team_065 in BONUS]

================================================================================

================================================================================
                       3RD QUARTER - Team_065 vs Team_006                       
================================================================================

[12:00] Team_065 possession (Score: 44-37)
Paul Williamson attempts a 3Pt. Contested by Shai Westbrook (3.9 feet, ZONE). PAUL WILLIAMSON MAKES IT!
Score: 47-37

[11:42] Team_006 possession (Score: 47-37)
Bradley Gobert drives and kicks out. Franz Wagner attempts a 3Pt. Contested by Paul Williamson (3.4 feet, MAN). Franz Wagner misses. Rebound secured by Russell Wade.

[11:29] Team_065 possession (Score: 47-37)
Paul Williamson attempts a 3Pt. Contested by Franz Wagner (4.9 feet, MAN). Paul Williamson misses. Offensive rebound by Russell Wade! Russell Wade's putback is no good. Rebound secured by Shai Westbrook.

[11:11] Team_006 possession (Score: 47-37)
Bradley Gobert attempts a 3Pt. Contested by RJ Harden (3.8 feet, ZONE). Bradley Gobert misses. Rebound secured by Manu McGrady.

[10:54] Team_065 possession (Score: 47-37)
Karl Booker attempts a Layup. BLOCKED BY BRADLEY GOBERT! Ball is loose! Rebound secured by Ja Butler.

[10:39] Team_006 possession (Score: 47-37)
Bradley Gobert drives to the basket... Bradley Gobert throws a bad pass! Stolen by Karl Booker! TURNOVER! (live ball)

[10:20] Team_065 possession (Score: 47-37)
Manu McGrady attempts a Midrange. Contested by Jayson Young (4.5 feet, MAN). MANU MCGRADY MAKES IT! Assist: RJ Harden
Score: 49-37

[10:07] Team_006 possession (Score: 49-37)
Shai Westbrook makes the Layup and draws the foul on RJ Harden! And-1! Shai Westbrook to the line for 1. [Team fouls: 1] (RJ Harden: 1 personal fouls)   FT 1/1: GOOD Shai Westbrook makes 1/1 from the line.
Score: 49-40

[09:53] Team_065 possession (Score: 49-40)
Manu McGrady attempts a Midrange. Contested by Jayson Young (4.5 feet, MAN). Manu McGrady misses. Offensive rebound by Manu McGrady! Manu McGrady kicks it out.

[09:42] Team_065 possession (Score: 49-40)
Russell Wade attempts a 3Pt. Contested by Shai Westbrook (3.9 feet, ZONE). Russell Wade misses. Rebound secured by Ja Butler.

[09:25] Team_006 possession (Score: 49-40)
Ja Butler attempts a 3Pt. Contested by Russell Wade (3.2 feet, MAN). Ja Butler misses. Rebound secured by RJ Harden.

[09:12] Team_065 possession (Score: 49-40)
Manu McGrady attempts a Midrange. Contested by Jayson Young (4.5 feet, ZONE). MANU MCGRADY MAKES IT! Assist: RJ Harden
Score: 51-40

[08:57] Team_006 possession (Score: 51-40)
Bradley Gobert commits a violation (traveling/carry)! TURNOVER! (dead ball)

[08:42] Team_065 possession (Score: 51-40)
Paul Williamson attempts a Midrange. Contested by Franz Wagner (4.9 feet, ZONE). Paul Williamson misses. Rebound secured by Ja Butler.

[08:28] Team_006 possession (Score: 51-40)
Ja Butler drives and kicks out. Bradley Gobert attempts a 3Pt. Contested by Russell Wade (3.0 feet, MAN). Bradley Gobert misses. Rebound secured by RJ Harden.

[08:14] Team_065 possession (Score: 51-40)
RJ Harden drives, Bradley Gobert stays with him. RJ Harden attempts a Dunk. Contested by Bradley Gobert (3.2 feet, ZONE). RJ HARDEN MAKES IT!
Score: 53-40

[07:57] Team_006 possession (Score: 53-40)
Ja Butler drives, Russell Wade stays with him. Ja Butler attempts a Dunk. Contested by Russell Wade (3.2 feet, MAN). JA BUTLER MAKES IT! Assist: Shai Westbrook
Score: 53-42

[07:41] Team_065 possession (Score: 53-42)
Paul Williamson attempts a 3Pt. Contested by Franz Wagner (4.9 feet, MAN). Paul Williamson misses. Rebound secured by Shai Westbrook.

[07:28] Team_006 possession (Score: 53-42)
Shai Westbrook makes the Midrange and draws the foul on Russell Wade! And-1! Shai Westbrook to the line for 1. [Team fouls: 2] (Russell Wade: 1 personal fouls)   FT 1/1: GOOD Shai Westbrook makes 1/1 from the line.
Score: 53-45

[07:13] Team_065 possession (Score: 53-45)
Manu McGrady drives and kicks out. Karl Booker attempts a Midrange. Contested by Bradley Gobert (2.8 feet, ZONE). Karl Booker misses. Rebound secured by Bradley Gobert.

[07:00] Team_006 possession (Score: 53-45)
Jayson Young attempts a 3Pt. Contested by Russell Wade (3.4 feet, ZONE). Jayson Young misses. Rebound secured by RJ Harden.

[06:44] Team_065 possession (Score: 53-45)
RJ Harden attempts a 3Pt. Contested by Shai Westbrook (4.2 feet, ZONE). RJ Harden misses. Rebound secured by Ja Butler.

[06:29] Team_006 possession (Score: 53-45)
Franz Wagner drives, picks up Karl Booker. Help arrives from Paul Williamson! Franz Wagner attempts a Dunk. Contested by Paul Williamson (4.9 feet, ZONE). Franz Wagner misses. Offensive rebound by Bradley Gobert! Bradley Gobert kicks it out.

[06:16] Team_006 possession (Score: 53-45)
Shai Westbrook drives, picks up Russell Wade. Help arrives from Paul Williamson! Shai Westbrook attempts a Layup. Contested by Paul Williamson (3.0 feet, ZONE). Shai Westbrook misses. Rebound secured by Russell Wade.

[06:01] Team_065 possession (Score: 53-45)
Russell Wade attempts a Layup. Contested by Bradley Gobert (2.9 feet, ZONE). Russell Wade misses. Rebound secured by Shai Westbrook.

[05:46] Team_006 possession (Score: 53-45)
Shai Westbrook drives, RJ Harden stays with him. Shai Westbrook attempts a Dunk. Contested by RJ Harden (3.9 feet, MAN). Shai Westbrook misses. Rebound secured by RJ Harden.

[05:28] Team_065 possession (Score: 53-45)
Russell Wade drives, Ja Butler stays with him. Russell Wade attempts a Layup. Contested by Ja Butler (2.9 feet, MAN). RUSSELL WADE MAKES IT!
Score: 55-45

[05:11] Team_006 possession (Score: 55-45)
Shai Westbrook attempts a 3Pt. Contested by RJ Harden (3.9 feet, MAN). SHAI WESTBROOK MAKES IT! Assist: Jayson Young
Score: 55-48

[04:52] Team_065 possession (Score: 55-48)
Russell Wade attempts a 3Pt. Contested by Ja Butler (3.0 feet, MAN). Russell Wade misses. Rebound secured by Bradley Gobert.

[04:42] Team_006 possession (Score: 55-48)
Jayson Young drives and kicks out. Shai Westbrook attempts a Midrange. BLOCKED BY RJ HARDEN! Ball is loose! Rebound secured by Manu McGrady.

[04:32] Team_065 possession (Score: 55-48)
Paul Williamson attempts a Midrange. Contested by Shai Westbrook (4.0 feet, ZONE). Paul Williamson misses. Offensive rebound by Manu McGrady! Manu McGrady kicks it out.

[04:18] Team_065 possession (Score: 55-48)
FOUL! Shooting foul on Shai Westbrook. Paul Williamson to the line for 3 free throws. [Team fouls: 1] (Shai Westbrook: 1 personal fouls)   FT 1/3: GOOD   FT 2/3: GOOD   FT 3/3: GOOD Paul Williamson makes 3/3 from the line.
Score: 58-48

[04:02] Team_006 possession (Score: 58-48)
Jayson Young throws a bad pass! Stolen by Manu McGrady! TURNOVER! (live ball)

[03:49] Team_065 possession (Score: 58-48)
FOUL! Holding foul on Jayson Young. [Team fouls: 2] No free throws, side out. (Jayson Young: 1 personal fouls)

[03:33] Team_065 possession (Score: 58-48)
Manu McGrady attempts a 3Pt. Contested by Jayson Young (4.6 feet, MAN). Manu McGrady misses. Rebound secured by Bradley Gobert.

[03:21] Team_006 possession (Score: 58-48)
Jayson Young makes the Layup and draws the foul on Karl Booker! And-1! Jayson Young to the line for 1. [Team fouls: 3] (Karl Booker: 1 personal fouls)   FT 1/1: GOOD Jayson Young makes 1/1 from the line.
Score: 58-51

[03:09] Team_065 possession (Score: 58-51)
RJ Harden drives, Shai Westbrook stays with him. RJ Harden attempts a Layup. Contested by Shai Westbrook (4.4 feet, MAN). RJ Harden misses. Rebound secured by Shai Westbrook.

[02:51] Team_006 possession (Score: 58-51)
Franz Wagner drives to the basket... FOUL! Offensive foul on Franz Wagner! Paul Williamson drew the charge! [Team fouls: 3] (Franz Wagner: 1 personal fouls) TURNOVER! (dead ball)

[02:34] Team_065 possession (Score: 58-51)
Karl Booker drives and kicks out. Karl Booker attempts a Midrange. Contested by Shai Westbrook (4.0 feet, ZONE). Karl Booker misses. Rebound secured by Ja Butler.

[02:20] Team_006 possession (Score: 58-51)
Shai Westbrook attempts a Midrange. Contested by RJ Harden (4.1 feet, MAN). Shai Westbrook misses. Rebound secured by RJ Harden.

[02:08] Team_065 possession (Score: 58-51)
Russell Wade attempts a 3Pt. Contested by Ja Butler (3.3 feet, MAN). Russell Wade misses. Offensive rebound by Russell Wade! Russell Wade's putback is no good. Rebound secured by Shai Westbrook.

[01:55] Team_006 possession (Score: 58-51)
Ja Butler loses the ball! Stripped by Russell Wade! TURNOVER! (live ball)

[01:36] Team_065 possession (Score: 58-51)
Russell Wade attempts a Layup. BLOCKED BY SHAI WESTBROOK! Ball is loose! Rebound secured by Shai Westbrook.

[01:21] Team_006 possession (Score: 58-51)
FOUL! Shooting foul on RJ Harden. Shai Westbrook to the line for 3 free throws. [Team fouls: 4] (RJ Harden: 2 personal fouls)   FT 1/3: GOOD   FT 2/3: GOOD   FT 3/3: GOOD Shai Westbrook makes 3/3 from the line.
Score: 58-54

[01:10] Team_065 possession (Score: 58-54)
Russell Wade attempts a Layup. Contested by Ja Butler (3.4 feet, MAN). RUSSELL WADE MAKES IT! Assist: RJ Harden
Score: 60-54

[00:57] Team_006 possession (Score: 60-54)
Bradley Gobert loses the ball! Stripped by Russell Wade! TURNOVER! (live ball)

[00:43] Team_065 possession (Score: 60-54)
RJ Harden attempts a 3Pt. Contested by Shai Westbrook (4.6 feet, ZONE). RJ Harden misses. FOUL! Loose ball foul on Ja Butler during the rebound battle. [Team fouls: 4] No free throws, side out. (Ja Butler: 1 personal fouls)

[00:28] Team_065 possession (Score: 60-54)
Manu McGrady attempts a 3Pt. Contested by Shai Westbrook (4.2 feet, ZONE). MANU MCGRADY MAKES IT! Assist: Russell Wade
Score: 63-54

[00:13] Team_006 possession (Score: 63-54)
Ja Butler makes the Layup and draws the foul on Paul Williamson! And-1! Ja Butler to the line for 1. [BONUS: 5 team fouls] (Paul Williamson: 1 personal fouls)   FT 1/1: GOOD Ja Butler makes 1/1 from the line.
Score: 63-57

================================================================================
                              3RD QUARTER COMPLETE                              
================================================================================

3RD QUARTER SCORE: Team_065 19, Team_006 20

BOX SCORE:
================================================================================

Team_065
--------------------------------------------------------------------------------
Player                MIN  PTS  REB  AST  TO      FG   FG%      3P   3P%
--------------------------------------------------------------------------------
Manu McGrady           31    7    5    0   0   3/5    60.0     0/0   0.0
Paul Williamson        31    6    0    0   0   2/5    40.0     0/0   0.0
Russell Wade           31    4    2    1   0   2/7    28.6     0/0   0.0
RJ Harden              31    2    5    3   0   1/3    33.3     0/0   0.0
Karl Booker            31    0    0    0   0   0/2     0.0     0/0   0.0

TEAM: FG: 8/22 (36.4%), 3PT: 3/10 (30.0%), REB: 14 (5 off, 9 def), AST: 4, TO: 0
TEAM FOULS: 5 [Team_006 in BONUS]


Team_006
--------------------------------------------------------------------------------
Player                MIN  PTS  REB  AST  TO      FG   FG%      3P   3P%
--------------------------------------------------------------------------------
Shai Westbrook         31   12    6    1   0   4/7    57.1     0/0   0.0
Ja Butler              31    5    5    0   0   2/4    50.0     0/0   0.0
Jayson Young           31    3    0    1   0   1/3    33.3     0/0   0.0
Bradley Gobert         31    0    4    0   0   0/2     0.0     0/0   0.0

TEAM: FG: 7/16 (43.8%), 3PT: 2/5 (40.0%), REB: 13 (1 off, 12 def), AST: 2, TO: 6
TEAM FOULS: 4

================================================================================

================================================================================
                       4TH QUARTER - Team_065 vs Team_006                       
================================================================================

[12:00] Team_065 possession (Score: 63-57)
RJ Harden attempts a Midrange. Contested by Shai Westbrook (4.5 feet, MAN). RJ Harden misses. Rebound secured by Shai Westbrook.

[11:43] Team_006 possession (Score: 63-57)
Franz Wagner attempts a Layup. Contested by Russell Wade (3.4 feet, ZONE). FRANZ WAGNER MAKES IT!
Score: 63-59

[11:32] Team_065 possession (Score: 63-59)
RJ Harden drives and kicks out. Paul Williamson attempts a 3Pt. Contested by Franz Wagner (5.2 feet, MAN). Paul Williamson misses. Rebound secured by Ja Butler.

[11:14] Team_006 possession (Score: 63-59)
Bradley Gobert attempts a 3Pt. Contested by Russell Wade (3.2 feet, MAN). Bradley Gobert misses. Rebound secured by RJ Harden.

[11:04] Team_065 possession (Score: 63-59)
Manu McGrady drives and kicks out. Manu McGrady attempts a 3Pt. Contested by Jayson Young (4.9 feet, MAN). Manu McGrady misses. Rebound secured by Ja Butler.

[10:50] Team_006 possession (Score: 63-59)
Bradley Gobert drives, picks up Russell Wade. Help arrives from Paul Williamson! Bradley Gobert attempts a Layup. Contested by Paul Williamson (3.3 feet, MAN). BRADLEY GOBERT MAKES IT! Assist: Shai Westbrook
Score: 63-61

[10:39] Team_065 possession (Score: 63-61)
Karl Booker attempts a Midrange. Contested by Jayson Young (4.9 feet, ZONE). KARL BOOKER MAKES IT!
Score: 65-61

[10:26] Team_006 possession (Score: 65-61)
Franz Wagner attempts a 3Pt. Contested by RJ Harden (4.4 feet, ZONE). Franz Wagner misses. Rebound secured by RJ Harden.

[10:08] Team_065 possession (Score: 65-61)
Paul Williamson attempts a 3Pt. Contested by Franz Wagner (5.4 feet, MAN). Paul Williamson misses. Rebound secured by Ja Butler.

[09:53] Team_006 possession (Score: 65-61)
FOUL! Reach-in foul on Paul Williamson during the drive. [Team fouls: 1] No free throws, side out. (Paul Williamson: 1 personal fouls)

[09:38] Team_006 possession (Score: 65-61)
Shai Westbrook attempts a Layup. Contested by RJ Harden (4.3 feet, MAN). SHAI WESTBROOK MAKES IT! Assist: Franz Wagner
Score: 65-63

[09:24] Team_065 possession (Score: 65-63)
Russell Wade attempts a Midrange. Contested by Ja Butler (3.7 feet, MAN). RUSSELL WADE MAKES IT!
Score: 67-63

[09:14] Team_006 possession (Score: 67-63)
Ja Butler attempts a Midrange. Contested by Russell Wade (3.7 feet, ZONE). Ja Butler misses. Rebound secured by Russell Wade.

[08:56] Team_065 possession (Score: 67-63)
RJ Harden drives and kicks out. RJ Harden makes the Midrange and draws the foul on Franz Wagner! And-1! RJ Harden to the line for 1. [Team fouls: 1] (Franz Wagner: 1 personal fouls)   FT 1/1: GOOD RJ Harden makes 1/1 from the line.
Score: 70-63

[08:46] Team_006 possession (Score: 70-63)
Bradley Gobert attempts a Midrange. Contested by Russell Wade (3.5 feet, MAN). BRADLEY GOBERT MAKES IT!
Score: 70-65

[08:33] Team_065 possession (Score: 70-65)
FOUL! Holding foul on Ja Butler. [Team fouls: 2] No free throws, side out. (Ja Butler: 1 personal fouls)

[08:21] Team_065 possession (Score: 70-65)
Manu McGrady attempts a 3Pt. Contested by Jayson Young (5.2 feet, MAN). Manu McGrady misses. Rebound secured by Bradley Gobert.

[08:11] Team_006 possession (Score: 70-65)
Jayson Young attempts a 3Pt. Contested by Manu McGrady (5.5 feet, MAN). Jayson Young misses. Rebound secured by Russell Wade.

[07:57] Team_065 possession (Score: 70-65)
Paul Williamson attempts a 3Pt. Contested by Franz Wagner (5.7 feet, MAN). Paul Williamson misses. Rebound secured by Ja Butler.

[07:43] Team_006 possession (Score: 70-65)
Ja Butler attempts a Layup. BLOCKED BY RUSSELL WADE! Ball is loose! Rebound secured by Manu McGrady.

[07:28] Team_065 possession (Score: 70-65)
Karl Booker drives to the basket... FOUL! Offensive foul on Karl Booker! Bradley Gobert drew the charge! [Team fouls: 2] (Karl Booker: 1 personal fouls) TURNOVER! (dead ball)

[07:13] Team_006 possession (Score: 70-65)
Shai Westbrook drives and kicks out. Ja Butler attempts a Midrange. Contested by Russell Wade (4.0 feet, MAN). Ja Butler misses. FOUL! Loose ball foul on Russell Wade during the rebound battle. [Team fouls: 3] No free throws, side out. (Russell Wade: 1 personal fouls)

[07:02] Team_006 possession (Score: 70-65)
Franz Wagner attempts a 3Pt. Contested by RJ Harden (4.8 feet, ZONE). Franz Wagner misses. Rebound secured by Manu McGrady.

[06:48] Team_065 possession (Score: 70-65)
Karl Booker attempts a Midrange. Contested by Bradley Gobert (4.1 feet, MAN). Karl Booker misses. Rebound secured by Bradley Gobert.

[06:36] Team_006 possession (Score: 70-65)
Franz Wagner attempts a 3Pt. Contested by RJ Harden (4.9 feet, ZONE). Franz Wagner misses. Offensive rebound by Shai Westbrook! Shai Westbrook kicks it out.

[06:22] Team_006 possession (Score: 70-65)
Ja Butler drives and kicks out. Shai Westbrook attempts a 3Pt. Contested by RJ Harden (5.0 feet, ZONE). Shai Westbrook misses. Rebound secured by RJ Harden.

[06:07] Team_065 possession (Score: 70-65)
Russell Wade attempts a 3Pt. Contested by Ja Butler (4.3 feet, ZONE). Russell Wade misses. Offensive rebound by Russell Wade! Russell Wade puts it back in!
Score: 72-65

[05:50] Team_006 possession (Score: 72-65)
Jayson Young attempts a 3Pt. Contested by Paul Williamson (4.8 feet, ZONE). Jayson Young misses. Offensive rebound by Bradley Gobert! Bradley Gobert kicks it out.

[05:35] Team_006 possession (Score: 72-65)
Bradley Gobert drives, picks up Russell Wade. Help arrives from Paul Williamson! Bradley Gobert attempts a Dunk. Contested by Paul Williamson (4.0 feet, ZONE). Bradley Gobert misses. Rebound secured by Russell Wade.

[05:18] Team_065 possession (Score: 72-65)
Karl Booker drives and kicks out. Paul Williamson attempts a 3Pt. Contested by Ja Butler (4.6 feet, ZONE). Paul Williamson misses. Rebound secured by Ja Butler.

[05:04] Team_006 possession (Score: 72-65)
Franz Wagner attempts a Midrange. Contested by Russell Wade (4.3 feet, ZONE). FRANZ WAGNER MAKES IT! Assist: Ja Butler
Score: 72-67

[04:51] Team_065 possession (Score: 72-67)
Russell Wade drives, Ja Butler stays with him. Russell Wade attempts a Layup. Contested by Ja Butler (4.6 feet, MAN). RUSSELL WADE MAKES IT! Assist: Manu McGrady
Score: 74-67

[04:39] Team_006 possession (Score: 74-67)
Franz Wagner attempts a Layup. Contested by Paul Williamson (4.8 feet, MAN). Franz Wagner misses. Offensive rebound by Shai Westbrook! Shai Westbrook kicks it out.

[04:25] Team_006 possession (Score: 74-67)
Bradley Gobert attempts a Midrange. Contested by Paul Williamson (4.6 feet, ZONE). Bradley Gobert misses. Rebound secured by RJ Harden.

[04:10] Team_065 possession (Score: 74-67)
Russell Wade drives, picks up Ja Butler. Help arrives from Shai Westbrook! Russell Wade attempts a Layup. Contested by Shai Westbrook (4.7 feet, MAN). RUSSELL WADE MAKES IT! Assist: Paul Williamson
Score: 76-67

[03:58] Team_006 possession (Score: 76-67)
Jayson Young attempts a 3Pt. Contested by RJ Harden (5.5 feet, ZONE). JAYSON YOUNG MAKES IT! Assist: Ja Butler
Score: 76-70

[03:44] Team_065 possession (Score: 76-70)
RJ Harden attempts a 3Pt. Contested by Shai Westbrook (5.5 feet, ZONE). RJ Harden misses. Rebound secured by Shai Westbrook.

[03:27] Team_006 possession (Score: 76-70)
Shai Westbrook drives and kicks out. FOUL! Shooting foul on RJ Harden. Franz Wagner to the line for 3 free throws. [Team fouls: 4] (RJ Harden: 1 personal fouls)   FT 1/3: MISS   FT 2/3: GOOD   FT 3/3: GOOD Franz Wagner makes 2/3 from the line.
Score: 76-72

[03:13] Team_065 possession (Score: 76-72)
Paul Williamson attempts a 3Pt. Contested by Shai Westbrook (5.4 feet, ZONE). Paul Williamson misses. Rebound secured by Ja Butler.

[02:57] Team_006 possession (Score: 76-72)
Franz Wagner attempts a 3Pt. Contested by Paul Williamson (5.0 feet, MAN). Franz Wagner misses. Rebound secured by RJ Harden.

[02:45] Team_065 possession (Score: 76-72)
Manu McGrady attempts a 3Pt. Contested by Jayson Young (5.9 feet, MAN). MANU MCGRADY MAKES IT! Assist: Paul Williamson
Score: 79-72

[02:29] Team_006 possession (Score: 79-72)
Shai Westbrook makes the Layup and draws the foul on RJ Harden! And-1! Shai Westbrook to the line for 1. [BONUS: 5 team fouls] (RJ Harden: 2 personal fouls)   FT 1/1: MISS Shai Westbrook makes 0/1 from the line. Rebound secured by RJ Harden.
Score: 79-74

[02:15] Team_065 possession (Score: 79-74)
RJ Harden attempts a 3Pt. Contested by Shai Westbrook (5.8 feet, MAN). RJ Harden misses. Offensive rebound by Manu McGrady! Manu McGrady kicks it out.

[02:00] Team_065 possession (Score: 79-74)
Manu McGrady attempts a 3Pt. Contested by Shai Westbrook (5.4 feet, ZONE). Manu McGrady misses. Rebound secured by Ja Butler.

[01:47] Team_006 possession (Score: 79-74)
Bradley Gobert drives and kicks out. Jayson Young attempts a 3Pt. Wide open! Manu McGrady is 6.3 feet away. [MAN] Jayson Young misses. Rebound secured by Russell Wade.

[01:30] Team_065 possession (Score: 79-74)
Karl Booker makes the Layup and draws the foul on Bradley Gobert! And-1! Karl Booker to the line for 1. [Team fouls: 3] (Bradley Gobert: 1 personal fouls)   FT 1/1: GOOD Karl Booker makes 1/1 from the line.
Score: 82-74

[01:11] Team_006 possession (Score: 82-74)
FOUL! Shooting foul on Russell Wade. Shai Westbrook to the line for 2 free throws. [BONUS: 6 team fouls] (Russell Wade: 2 personal fouls)   FT 1/2: GOOD   FT 2/2: MISS Shai Westbrook makes 1/2 from the line. FOUL! Loose ball foul on Russell Wade during the free throw rebound! [IN THE BONUS! 7 team fouls] Bradley Gobert to the line for 2 free throws. (Russell Wade: 3 personal fouls)   FT 1/2: GOOD   FT 2/2: GOOD Bradley Gobert makes 2/2 from the line.
Score: 82-77

[00:55] Team_065 possession (Score: 82-77)
Paul Williamson attempts a 3Pt. Wide open! Franz Wagner is 6.7 feet away. [MAN] Paul Williamson misses. Rebound secured by Shai Westbrook.

[00:41] Team_006 possession (Score: 82-77)
Ja Butler makes the 3Pt and draws the foul on RJ Harden! And-1! Ja Butler to the line for 1. [BONUS: 8 team fouls] (RJ Harden: 3 personal fouls)   FT 1/1: MISS Ja Butler makes 0/1 from the line. Rebound secured by Russell Wade.
Score: 82-80

[00:23] Team_065 possession (Score: 82-80)
Manu McGrady drives, Jayson Young stays with him. Manu McGrady attempts a Layup. Wide open! Jayson Young is 6.2 feet away. [MAN] MANU MCGRADY MAKES IT! Assist: Karl Booker
Score: 84-80

[00:08] Team_006 possession (Score: 84-80)
Shai Westbrook attempts a Midrange. Contested by RJ Harden (5.7 feet, MAN). SHAI WESTBROOK MAKES IT!
Score: 84-82

================================================================================
                              4TH QUARTER COMPLETE                              
================================================================================

4TH QUARTER SCORE: Team_065 21, Team_006 25

BOX SCORE:
================================================================================

Team_065
--------------------------------------------------------------------------------
Player                MIN  PTS  REB  AST  TO      FG   FG%      3P   3P%
--------------------------------------------------------------------------------
Russell Wade           43    8    6    0   0   4/4   100.0     0/0   0.0
Manu McGrady           43    5    3    1   0   2/5    40.0     0/0   0.0
Karl Booker            43    5    0    1   0   2/4    50.0     0/0   0.0
RJ Harden              43    3    6    0   0   1/4    25.0     0/0   0.0
Paul Williamson        43    0    0    2   0   0/4     0.0     0/0   0.0

TEAM: FG: 9/21 (42.9%), 3PT: 2/9 (22.2%), REB: 15 (2 off, 13 def), AST: 4, TO: 1
TEAM FOULS: 8 [Team_006 in BONUS]


Team_006
--------------------------------------------------------------------------------
Player                MIN  PTS  REB  AST  TO      FG   FG%      3P   3P%
--------------------------------------------------------------------------------
Bradley Gobert         43    7    3    0   0   3/7    42.9     0/0   0.0
Franz Wagner           43    6    0    1   0   3/6    50.0     0/0   0.0
Shai Westbrook         43    4    6    1   0   2/3    66.7     0/0   0.0
Jayson Young           43    3    0    0   0   1/2    50.0     0/0   0.0
Ja Butler              43    0    7    2   0   0/4     0.0     0/0   0.0

TEAM: FG: 9/22 (40.9%), 3PT: 1/7 (14.3%), REB: 16 (4 off, 12 def), AST: 4, TO: 0
TEAM FOULS: 3

================================================================================

================================================================================
                               FULL GAME COMPLETE                               
================================================================================

FINAL SCORE: Team_065 84, Team_006 82

SCORING BY QUARTER:
--------------------------------------------------------------------------------
Team                     Q1     Q2     Q3     Q4    FINAL
--------------------------------------------------------------------------------
Team_065                 23     21     19     21       84
Team_006                 21     16     20     25       82
--------------------------------------------------------------------------------

FULL GAME BOX SCORE:
================================================================================

Team_065
--------------------------------------------------------------------------------
Player                MIN  PTS  REB  AST  TO      FG   FG%      3P   3P%      FT STL BLK
--------------------------------------------------------------------------------
RJ Harden              43    9   16    5   1   5/13   38.5   1/3    33.3   1/2     1   1
Paul Williamson        43   13    0    4   0   5/15   33.3   3/10   30.0   7/7     0   0
Manu McGrady           43   16   17    1   0   6/15   40.0   2/7    28.6   2/2     1   0
Russell Wade           43   24   16    2   0   9/21   42.9   2/9    22.2   6/8     4   1
Karl Booker            43    8    0    2   0   4/11   36.4   0/0     0.0   2/3     1   0
Paul Curry              6    0    0    1   0   0/2     0.0   0/2     0.0   0/0     0   0
Derrick Poole           6    0    0    0   0   0/1     0.0   0/0     0.0   0/0     0   0
D'Angelo Porzingis      6    3    6    0   1   1/1   100.0   1/1   100.0   0/0     0   1
Karl Leonard            6    2    1    1   1   1/3    33.3   0/0     0.0   0/1     0   0
Vince Mobley            6    2    2    0   0   1/1   100.0   0/0     0.0   0/0     0   0

TEAM: FG: 34/85 (40.0%), 3PT: 9/32 (28.1%), REB: 59 (12 off, 47 def), AST: 16, TO: 3


Team_006
--------------------------------------------------------------------------------
Player                MIN  PTS  REB  AST  TO      FG   FG%      3P   3P%      FT STL BLK
--------------------------------------------------------------------------------
Shai Westbrook         43   16   18    3   0   8/16   50.0   2/4    50.0   6/8     0   1
Franz Wagner           43   17    0    1   0   7/13   53.8   0/6     0.0   5/6     0   0
Jayson Young           43    6    0    2   5   2/10   20.0   1/5    20.0   1/2     0   0
Ja Butler              43   14   21    3   2   5/13   38.5   0/3     0.0   3/5     0   0
Bradley Gobert         43   11   17    1   3   5/16   31.2   0/3     0.0   1/7     0   1
Miles Harris            6    3    0    0   0   1/2    50.0   1/2    50.0   0/0     0   0
Lamelo Westbrook        6    0    0    0   0   0/1     0.0   0/0     0.0   0/0     0   0
Vince Sabonis           6    0    2    0   0   0/1     0.0   0/0     0.0   0/1     0   0
Cade Ball               6    2    4    0   0   1/3    33.3   0/0     0.0   0/0     0   0
Shaquille Sexton        6    0    1    0   0   0/3     0.0   0/0     0.0   0/0     0   0

TEAM: FG: 29/78 (37.2%), 3PT: 4/23 (17.4%), REB: 62 (14 off, 48 def), AST: 10, TO: 10

================================================================================
