================================================================================
                        FULL GAME - Team_071 vs Team_045                        
================================================================================

================================================================================
                       1ST QUARTER - Team_071 vs Team_045                       
================================================================================

[12:00] Team_071 possession (Score: 0-0)
Allen Williamson attempts a 3Pt. Contested by Rudy Antetokounmpo (4.9 feet, MAN). Allen Williamson misses. Rebound secured by Cole Simons.

[11:46] Team_045 possession (Score: 0-0)
Zion Butler drives, Dejounte Paul stays with him. Zion Butler attempts a Dunk. Contested by Dejounte Paul (4.4 feet, MAN). ZION BUTLER MAKES IT!
Score: 0-2

[11:35] Team_071 possession (Score: 0-2)
Bam Iverson attempts a 3Pt. Contested by Cole Simons (3.4 feet, MAN). Bam Iverson misses. Rebound secured by Zion Butler.

[11:23] Team_045 possession (Score: 0-2)
Trae Russell attempts a 3Pt. Contested by Victor Anunoby (4.7 feet, ZONE). Trae Russell misses. Rebound secured by Bam Iverson.

[11:06] Team_071 possession (Score: 0-2)
Allen Williamson attempts a 3Pt. Contested by Cole Simons (3.7 feet, ZONE). Allen Williamson misses. Rebound secured by DeMar Turner.

[10:53] Team_045 possession (Score: 0-2)
Zion Butler drives and kicks out. DeMar Turner attempts a 3Pt. Contested by Victor Anunoby (4.2 feet, ZONE). DeMar Turner misses. Rebound secured by Dejounte Paul.

[10:36] Team_071 possession (Score: 0-2)
Dejounte Paul attempts a Midrange. Contested by Zion Butler (3.6 feet, MAN). DEJOUNTE PAUL MAKES IT! Assist: Bam Iverson
Score: 2-2

[10:19] Team_045 possession (Score: 2-2)
Rudy Antetokounmpo attempts a Midrange. Contested by Allen Williamson (4.3 feet, MAN). RUDY ANTETOKOUNMPO MAKES IT!
Score: 2-4

[10:02] Team_071 possession (Score: 2-4)
Jimmy Simons attempts a Midrange. Contested by Zion Butler (3.3 feet, MAN). JIMMY SIMONS MAKES IT!
Score: 4-4

[09:49] Team_045 possession (Score: 4-4)
Cole Simons attempts a Midrange. Contested by Jimmy Simons (4.7 feet, ZONE). Cole Simons misses. Rebound secured by Jimmy Simons.

[09:35] Team_071 possession (Score: 4-4)
Allen Williamson attempts a 3Pt. Contested by Cole Simons (3.7 feet, ZONE). Allen Williamson misses. Rebound secured by DeMar Turner.

[09:19] Team_045 possession (Score: 4-4)
Rudy Antetokounmpo attempts a 3Pt. Contested by Victor Anunoby (4.5 feet, ZONE). RUDY ANTETOKOUNMPO MAKES IT! Assist: Trae Russell
Score: 4-7

[09:05] Team_071 possession (Score: 4-7)
FOUL! Holding foul on Rudy Antetokounmpo. [Team fouls: 1] No free throws, side out. (Rudy Antetokounmpo: 1 personal fouls)

[08:51] Team_071 possession (Score: 4-7)
Allen Williamson attempts a 3Pt. Contested by Cole Simons (3.7 feet, ZONE). Allen Williamson misses. Rebound secured by Zion Butler.

[08:37] Team_045 possession (Score: 4-7)
FOUL! Shooting foul on Jimmy Simons. Rudy Antetokounmpo to the line for 2 free throws. [Team fouls: 1] (Jimmy Simons: 1 personal fouls)   FT 1/2: GOOD   FT 2/2: MISS Rudy Antetokounmpo makes 1/2 from the line. Rebound secured by Dejounte Paul.
Score: 4-8

[08:23] Team_071 possession (Score: 4-8)
Bam Iverson attempts a Midrange. Contested by Cole Simons (3.4 feet, MAN). Bam Iverson misses. Offensive rebound by Jimmy Simons! Jimmy Simons kicks it out.

[08:07] Team_071 possession (Score: 4-8)
Victor Anunoby attempts a Midrange. Contested by DeMar Turner (5.0 feet, ZONE). VICTOR ANUNOBY MAKES IT!
Score: 6-8

[07:56] Team_045 possession (Score: 6-8)
Rudy Antetokounmpo attempts a 3Pt. Contested by Victor Anunoby (4.5 feet, ZONE). RUDY ANTETOKOUNMPO MAKES IT! Assist: DeMar Turner
Score: 6-11

[07:45] Team_071 possession (Score: 6-11)
Dejounte Paul makes the Layup and draws the foul on Zion Butler! And-1! Dejounte Paul to the line for 1. [Team fouls: 2] (Zion Butler: 1 personal fouls)   FT 1/1: GOOD Dejounte Paul makes 1/1 from the line.
Score: 9-11

[07:32] Team_045 possession (Score: 9-11)
Rudy Antetokounmpo attempts a 3Pt. Contested by Allen Williamson (4.3 feet, MAN). RUDY ANTETOKOUNMPO MAKES IT! Assist: Trae Russell
Score: 9-14

[07:16] Team_071 possession (Score: 9-14)
FOUL! Holding foul on Cole Simons. [Team fouls: 3] No free throws, side out. (Cole Simons: 1 personal fouls)

[07:06] Team_071 possession (Score: 9-14)
Jimmy Simons attempts a Layup. Contested by Zion Butler (3.3 feet, MAN). JIMMY SIMONS MAKES IT! Assist: Dejounte Paul
Score: 11-14

[06:54] Team_045 possession (Score: 11-14)
DeMar Turner drives, Dejounte Paul stays with him. DeMar Turner attempts a Layup. Contested by Dejounte Paul (4.4 feet, ZONE). DEMAR TURNER MAKES IT! Assist: Rudy Antetokounmpo
Score: 11-16

[06:42] Team_071 possession (Score: 11-16)
Dejounte Paul attempts a Midrange. Contested by Trae Russell (5.8 feet, ZONE). Dejounte Paul misses. Rebound secured by Zion Butler.

[06:29] Team_045 possession (Score: 11-16)
Zion Butler attempts a Layup. Contested by Dejounte Paul (4.4 feet, ZONE). Zion Butler misses. Offensive rebound by DeMar Turner! DeMar Turner kicks it out.

[06:14] Team_045 possession (Score: 11-16)
Rudy Antetokounmpo drives and kicks out. Rudy Antetokounmpo attempts a 3Pt. Contested by Allen Williamson (3.9 feet, MAN). Rudy Antetokounmpo misses. Rebound secured by Bam Iverson.

[05:58] Team_071 possession (Score: 11-16)
Allen Williamson attempts a 3Pt. Contested by Rudy Antetokounmpo (4.9 feet, MAN). Allen Williamson misses. Offensive rebound by Dejounte Paul! Dejounte Paul kicks it out.

[05:44] Team_071 possession (Score: 11-16)
Victor Anunoby drives to the basket... Victor Anunoby throws a bad pass out of bounds! TURNOVER! (dead ball)

[05:28] Team_045 possession (Score: 11-16)
Trae Russell drives, Dejounte Paul stays with him. Trae Russell attempts a Layup. Contested by Dejounte Paul (4.7 feet, ZONE). TRAE RUSSELL MAKES IT! Assist: Cole Simons
Score: 11-18

[05:15] Team_071 possession (Score: 11-18)
Bam Iverson commits a violation (traveling/carry)! TURNOVER! (dead ball)

[05:02] Team_045 possession (Score: 11-18)
Zion Butler drives and kicks out. Trae Russell attempts a Midrange. Contested by Victor Anunoby (4.2 feet, MAN). TRAE RUSSELL MAKES IT!
Score: 11-20

[04:51] Team_071 possession (Score: 11-20)
Jimmy Simons makes the Midrange and draws the foul on DeMar Turner! And-1! Jimmy Simons to the line for 1. [Team fouls: 4] (DeMar Turner: 1 personal fouls)   FT 1/1: GOOD Jimmy Simons makes 1/1 from the line.
Score: 14-20

[04:37] Team_045 possession (Score: 14-20)
Rudy Antetokounmpo attempts a 3Pt. Contested by Victor Anunoby (4.6 feet, ZONE). Rudy Antetokounmpo misses. Rebound secured by Dejounte Paul.

[04:25] Team_071 possession (Score: 14-20)
Dejounte Paul drives, picks up Zion Butler. Help arrives from Rudy Antetokounmpo! Dejounte Paul attempts a Layup. Contested by Rudy Antetokounmpo (3.8 feet, MAN). DEJOUNTE PAUL MAKES IT!
Score: 16-20

[04:07] Team_045 possession (Score: 16-20)
Cole Simons attempts a 3Pt. Contested by Victor Anunoby (4.9 feet, ZONE). Cole Simons misses. Rebound secured by Jimmy Simons.

[03:54] Team_071 possession (Score: 16-20)
Jimmy Simons attempts a 3Pt. Contested by Cole Simons (3.5 feet, ZONE). Jimmy Simons misses. Rebound secured by Zion Butler.

[03:40] Team_045 possession (Score: 16-20)
DeMar Turner attempts a Midrange. Contested by Jimmy Simons (4.6 feet, MAN). DeMar Turner misses. Rebound secured by Bam Iverson.

[03:29] Team_071 possession (Score: 16-20)
Allen Williamson drives, Zion Butler stays with him. Allen Williamson attempts a Layup. Contested by Zion Butler (4.0 feet, ZONE). Allen Williamson misses. Rebound secured by DeMar Turner.

[03:11] Team_045 possession (Score: 16-20)
Trae Russell attempts a Midrange. Contested by Jimmy Simons (4.9 feet, ZONE). Trae Russell misses. Rebound secured by Dejounte Paul.

[02:56] Team_071 possession (Score: 16-20)
Bam Iverson attempts a 3Pt. Contested by Cole Simons (3.7 feet, ZONE). BAM IVERSON MAKES IT!
Score: 19-20

[02:43] Team_045 possession (Score: 19-20)
DeMar Turner attempts a 3Pt. Contested by Jimmy Simons (4.7 feet, MAN). DeMar Turner misses. Rebound secured by Jimmy Simons.

[02:25] Team_071 possession (Score: 19-20)
FOUL! Reach-in foul on Zion Butler during the drive. [IN THE BONUS! 5 team fouls] Allen Williamson to the line for 2 free throws. (Zion Butler: 2 personal fouls)   FT 1/2: GOOD   FT 2/2: MISS Allen Williamson makes 1/2 from the line. Rebound secured by DeMar Turner.
Score: 20-20

[02:13] Team_045 possession (Score: 20-20)
Rudy Antetokounmpo attempts a 3Pt. Contested by Allen Williamson (4.6 feet, MAN). Rudy Antetokounmpo misses. Rebound secured by Bam Iverson.

[01:56] Team_071 possession (Score: 20-20)
FOUL! Reach-in foul on Rudy Antetokounmpo during the drive. [IN THE BONUS! 6 team fouls] Allen Williamson to the line for 2 free throws. (Rudy Antetokounmpo: 2 personal fouls)   FT 1/2: GOOD   FT 2/2: GOOD Allen Williamson makes 2/2 from the line.
Score: 22-20

[01:42] Team_045 possession (Score: 22-20)
Zion Butler attempts a Dunk. BLOCKED BY ALLEN WILLIAMSON! Ball is loose! Rebound secured by Jimmy Simons.

[01:27] Team_071 possession (Score: 22-20)
Victor Anunoby makes the Dunk and draws the foul on Cole Simons! And-1! Victor Anunoby to the line for 1. [BONUS: 7 team fouls] (Cole Simons: 2 personal fouls)   FT 1/1: GOOD Victor Anunoby makes 1/1 from the line.
Score: 25-20

[01:10] Team_045 possession (Score: 25-20)
Trae Russell attempts a 3Pt. Contested by Victor Anunoby (5.1 feet, MAN). Trae Russell misses. Offensive rebound by DeMar Turner! DeMar Turner kicks it out.

[00:54] Team_045 possession (Score: 25-20)
DeMar Turner attempts a 3Pt. Contested by Victor Anunoby (4.9 feet, ZONE). DeMar Turner misses. Rebound secured by Dejounte Paul.

[00:38] Team_071 possession (Score: 25-20)
Victor Anunoby attempts a Layup. BLOCKED BY DEMAR TURNER! Ball is loose! Rebound secured by Zion Butler.

[00:23] Team_045 possession (Score: 25-20)
Zion Butler drives, Dejounte Paul stays with him. Zion Butler attempts a Layup. Contested by Dejounte Paul (4.9 feet, ZONE). ZION BUTLER MAKES IT! Assist: Cole Simons
Score: 25-22

[00:08] Team_071 possession (Score: 25-22)
Bam Iverson attempts a 3Pt. Contested by Cole Simons (4.0 feet, MAN). Bam Iverson misses. Rebound secured by DeMar Turner.

================================================================================
                              1ST QUARTER COMPLETE                              
================================================================================

1ST QUARTER SCORE: Team_071 25, Team_045 22

BOX SCORE:
================================================================================

Team_071
--------------------------------------------------------------------------------
Player                MIN  PTS  REB  AST  TO      FG   FG%      3P   3P%
--------------------------------------------------------------------------------
Dejounte Paul          12    7    6    1   0   3/4    75.0     0/0   0.0
Jimmy Simons           12    7    5    0   0   3/4    75.0     0/0   0.0
Victor Anunoby         12    5    0    0   0   2/3    66.7     0/0   0.0
Bam Iverson            12    3    4    1   0   1/3    33.3     0/0   0.0
Allen Williamson       12    2    0    0   0   1/7    14.3     0/0   0.0

TEAM: FG: 10/21 (47.6%), 3PT: 1/8 (12.5%), REB: 15 (2 off, 13 def), AST: 2, TO: 2
TEAM FOULS: 1


Team_045
--------------------------------------------------------------------------------
Player                MIN  PTS  REB  AST  TO      FG   FG%      3P   3P%
--------------------------------------------------------------------------------
Rudy Antetokounmpo     12   11    0    1   0   4/8    50.0     0/0   0.0
Zion Butler            12    4    5    0   0   2/4    50.0     0/0   0.0
Trae Russell           12    4    0    2   0   2/4    50.0     0/0   0.0
DeMar Turner           12    2    7    1   0   1/4    25.0     0/0   0.0
Cole Simons            12    0    1    2   0   0/2     0.0     0/0   0.0

TEAM: FG: 9/22 (40.9%), 3PT: 3/9 (33.3%), REB: 13 (2 off, 11 def), AST: 6, TO: 0
TEAM FOULS: 7 [Team_071 in BONUS]

================================================================================

================================================================================
                       2ND QUARTER - Team_071 vs Team_045                       
================================================================================

[12:00] Team_071 possession (Score: 25-22)
Bam Iverson makes the Layup and draws the foul on Zion Butler! And-1! Bam Iverson to the line for 1. [Team fouls: 1] (Zion Butler: 1 personal fouls)   FT 1/1: GOOD Bam Iverson makes 1/1 from the line.
Score: 28-22

[11:44] Team_045 possession (Score: 28-22)
Trae Russell drives, Jimmy Simons stays with him. Trae Russell attempts a Layup. Contested by Jimmy Simons (5.0 feet, ZONE). Trae Russell misses. Rebound secured by Jimmy Simons.

[11:25] Team_071 possession (Score: 28-22)
Victor Anunoby attempts a 3Pt. Contested by Cole Simons (3.8 feet, MAN). Victor Anunoby misses. Rebound secured by Zion Butler.

[11:08] Team_045 possession (Score: 28-22)
Zion Butler drives, Dejounte Paul stays with him. Zion Butler attempts a Layup. Contested by Dejounte Paul (4.8 feet, MAN). Zion Butler misses. Rebound secured by Bam Iverson.

[10:57] Team_071 possession (Score: 28-22)
Jimmy Simons attempts a Midrange. Contested by Cole Simons (3.8 feet, ZONE). JIMMY SIMONS MAKES IT! Assist: Allen Williamson
Score: 30-22

[10:42] Team_045 possession (Score: 30-22)
DeMar Turner makes the Layup and draws the foul on Jimmy Simons! And-1! DeMar Turner to the line for 1. [Team fouls: 1] (Jimmy Simons: 1 personal fouls)   FT 1/1: GOOD DeMar Turner makes 1/1 from the line.
Score: 30-25

[10:24] Team_071 possession (Score: 30-25)
Bam Iverson makes the Midrange and draws the foul on Cole Simons! And-1! Bam Iverson to the line for 1. [Team fouls: 2] (Cole Simons: 1 personal fouls)   FT 1/1: GOOD Bam Iverson makes 1/1 from the line.
Score: 33-25

[10:08] Team_045 possession (Score: 33-25)
Cole Simons attempts a Layup. BLOCKED BY ALLEN WILLIAMSON! Ball goes out off Allen Williamson. Cole Simons's ball!

[09:53] Team_045 possession (Score: 33-25)
FOUL! Holding foul on Victor Anunoby. [Team fouls: 2] No free throws, side out. (Victor Anunoby: 1 personal fouls)

[09:39] Team_045 possession (Score: 33-25)
Zion Butler attempts a Layup. Contested by Jimmy Simons (5.0 feet, ZONE). ZION BUTLER MAKES IT! Assist: Cole Simons
Score: 33-27

[09:24] Team_071 possession (Score: 33-27)
Victor Anunoby makes the Layup and draws the foul on Cole Simons! And-1! Victor Anunoby to the line for 1. [Team fouls: 3] (Cole Simons: 2 personal fouls)   FT 1/1: GOOD Victor Anunoby makes 1/1 from the line.
Score: 36-27

[09:07] Team_045 possession (Score: 36-27)
DeMar Turner makes the Dunk and draws the foul on Dejounte Paul! And-1! DeMar Turner to the line for 1. [Team fouls: 3] (Dejounte Paul: 1 personal fouls)   FT 1/1: GOOD DeMar Turner makes 1/1 from the line.
Score: 36-30

[08:51] Team_071 possession (Score: 36-30)
Victor Anunoby drives, Cole Simons stays with him. Victor Anunoby attempts a Dunk. Contested by Cole Simons (4.1 feet, MAN). Victor Anunoby misses. Rebound secured by Zion Butler.

[08:37] Team_045 possession (Score: 36-30)
Zion Butler drives, picks up Dejounte Paul. Help arrives from Allen Williamson! Zion Butler attempts a Layup. Contested by Allen Williamson (5.1 feet, ZONE). ZION BUTLER MAKES IT!
Score: 36-32

[08:24] Team_071 possession (Score: 36-32)
Jimmy Simons drives, picks up Zion Butler. Help arrives from Rudy Antetokounmpo! Jimmy Simons attempts a Dunk. Contested by Rudy Antetokounmpo (4.3 feet, ZONE). Jimmy Simons misses. Rebound secured by Cole Simons.

[08:10] Team_045 possession (Score: 36-32)
Zion Butler attempts a Midrange. Contested by Dejounte Paul (5.1 feet, MAN). ZION BUTLER MAKES IT! Assist: Rudy Antetokounmpo
Score: 36-34

[07:56] Team_071 possession (Score: 36-34)
Dejounte Paul attempts a Layup. Contested by Zion Butler (4.8 feet, MAN). DEJOUNTE PAUL MAKES IT! Assist: Allen Williamson
Score: 38-34

[07:41] Team_045 possession (Score: 38-34)
Trae Russell attempts a 3Pt. Contested by Victor Anunoby (5.5 feet, ZONE). TRAE RUSSELL MAKES IT! Assist: DeMar Turner
Score: 38-37

[07:25] Team_071 possession (Score: 38-37)
Allen Williamson attempts a Midrange. Contested by Rudy Antetokounmpo (5.5 feet, MAN). ALLEN WILLIAMSON MAKES IT!
Score: 40-37

[07:13] Team_045 possession (Score: 40-37)
Cole Simons drives and kicks out. Rudy Antetokounmpo attempts a 3Pt. Contested by Allen Williamson (4.9 feet, MAN). Rudy Antetokounmpo misses. Offensive rebound by DeMar Turner! DeMar Turner kicks it out.

[06:59] Team_045 possession (Score: 40-37)
Zion Butler throws a bad pass! Stolen by Dejounte Paul! TURNOVER! (live ball)

[06:47] Team_071 possession (Score: 40-37)
Bam Iverson attempts a Midrange. Contested by Cole Simons (4.5 feet, MAN). BAM IVERSON MAKES IT!
Score: 42-37

[06:31] Team_045 possession (Score: 42-37)
Trae Russell attempts a 3Pt. Contested by Jimmy Simons (5.7 feet, ZONE). Trae Russell misses. Rebound secured by Jimmy Simons.

[06:17] Team_071 possession (Score: 42-37)
Victor Anunoby attempts a 3Pt. Contested by Cole Simons (4.5 feet, ZONE). Victor Anunoby misses. FOUL! Loose ball foul on Cole Simons during the rebound battle. [Team fouls: 4] No free throws, side out. (Cole Simons: 3 personal fouls)

[06:03] Team_071 possession (Score: 42-37)
Victor Anunoby makes the Layup and draws the foul on Zion Butler! And-1! Victor Anunoby to the line for 1. [BONUS: 5 team fouls] (Zion Butler: 2 personal fouls)   FT 1/1: GOOD Victor Anunoby makes 1/1 from the line.
Score: 45-37

[05:49] Team_045 possession (Score: 45-37)
DeMar Turner makes the Layup and draws the foul on Jimmy Simons! And-1! DeMar Turner to the line for 1. [Team fouls: 4] (Jimmy Simons: 2 personal fouls)   FT 1/1: GOOD DeMar Turner makes 1/1 from the line.
Score: 45-40

[05:36] Team_071 possession (Score: 45-40)
FOUL! Shooting foul on Rudy Antetokounmpo. Allen Williamson to the line for 2 free throws. [BONUS: 6 team fouls] (Rudy Antetokounmpo: 1 personal fouls)   FT 1/2: GOOD   FT 2/2: GOOD Allen Williamson makes 2/2 from the line.
Score: 47-40

[05:25] Team_045 possession (Score: 47-40)
DeMar Turner attempts a Midrange. Contested by Jimmy Simons (5.7 feet, MAN). DeMar Turner misses. Rebound secured by Bam Iverson.

[05:15] Team_071 possession (Score: 47-40)
FOUL! Reach-in foul on Zion Butler during the drive. [IN THE BONUS! 7 team fouls] Bam Iverson to the line for 2 free throws. (Zion Butler: 3 personal fouls)   FT 1/2: GOOD   FT 2/2: GOOD Bam Iverson makes 2/2 from the line.
Score: 49-40

[04:58] Team_045 possession (Score: 49-40)
Rudy Antetokounmpo attempts a 3Pt. Contested by Victor Anunoby (5.7 feet, ZONE). RUDY ANTETOKOUNMPO MAKES IT! Assist: Cole Simons
Score: 49-43

[04:46] Team_071 possession (Score: 49-43)
Jimmy Simons drives, Zion Butler stays with him. Jimmy Simons attempts a Dunk. Contested by Zion Butler (5.1 feet, ZONE). Jimmy Simons misses. Rebound secured by DeMar Turner.

[04:33] Team_045 possession (Score: 49-43)
Zion Butler attempts a Midrange. Contested by Dejounte Paul (5.6 feet, MAN). ZION BUTLER MAKES IT! Assist: Cole Simons
Score: 49-45

[04:21] Team_071 possession (Score: 49-45)
Jimmy Simons attempts a 3Pt. Contested by Cole Simons (4.9 feet, ZONE). Jimmy Simons misses. Rebound secured by Cole Simons.

[04:06] Team_045 possession (Score: 49-45)
Rudy Antetokounmpo attempts a 3Pt. Contested by Allen Williamson (5.6 feet, MAN). RUDY ANTETOKOUNMPO MAKES IT! Assist: Trae Russell
Score: 49-48

[03:54] Team_071 possession (Score: 49-48)
Bam Iverson attempts a Midrange. Wide open! DeMar Turner is 6.1 feet away. [ZONE] BAM IVERSON MAKES IT!
Score: 51-48

[03:39] Team_045 possession (Score: 51-48)
DeMar Turner attempts a 3Pt. Contested by Jimmy Simons (6.0 feet, MAN). DeMar Turner misses. Rebound secured by Dejounte Paul.

[03:27] Team_071 possession (Score: 51-48)
Jimmy Simons attempts a Layup. Wide open! DeMar Turner is 6.1 feet away. [MAN] Jimmy Simons misses. Offensive rebound by Bam Iverson! Bam Iverson kicks it out.

[03:12] Team_071 possession (Score: 51-48)
Jimmy Simons attempts a Midrange. Wide open! DeMar Turner is 6.1 feet away. [MAN] JIMMY SIMONS MAKES IT!
Score: 53-48

[02:57] Team_045 possession (Score: 53-48)
Cole Simons attempts a Midrange. Contested by Bam Iverson (5.6 feet, MAN). Cole Simons misses. Rebound secured by Bam Iverson.

[02:41] Team_071 possession (Score: 53-48)
Victor Anunoby attempts a 3Pt. Wide open! Trae Russell is 6.7 feet away. [MAN] Victor Anunoby misses. Rebound secured by Zion Butler.

[02:31] Team_045 possession (Score: 53-48)
Cole Simons attempts a Midrange. Wide open! Jimmy Simons is 6.4 feet away. [ZONE] Cole Simons misses. Offensive rebound by DeMar Turner! DeMar Turner kicks it out.

[02:16] Team_045 possession (Score: 53-48)
Zion Butler attempts a Midrange. Contested by Dejounte Paul (6.0 feet, MAN). Zion Butler misses. Rebound secured by Jimmy Simons.

[02:05] Team_071 possession (Score: 53-48)
Dejounte Paul attempts a Layup. Contested by Zion Butler (5.9 feet, MAN). Dejounte Paul misses. Rebound secured by Zion Butler.

[01:49] Team_045 possession (Score: 53-48)
Cole Simons attempts a 3Pt. Wide open! Victor Anunoby is 6.3 feet away. [ZONE] Cole Simons misses. Rebound secured by Bam Iverson.

[01:34] Team_071 possession (Score: 53-48)
Dejounte Paul attempts a Midrange. Wide open! Zion Butler is 6.0 feet away. [MAN] Dejounte Paul misses. Rebound secured by Cole Simons.

[01:18] Team_045 possession (Score: 53-48)
Trae Russell attempts a 3Pt. Wide open! Victor Anunoby is 6.4 feet away. [ZONE] Trae Russell misses. Offensive rebound by Zion Butler! Zion Butler kicks it out.

[01:04] Team_045 possession (Score: 53-48)
Rudy Antetokounmpo drives, Dejounte Paul stays with him. Rudy Antetokounmpo attempts a Dunk. Wide open! Dejounte Paul is 6.3 feet away. [ZONE] RUDY ANTETOKOUNMPO MAKES IT! Assist: Trae Russell
Score: 53-50

[00:50] Team_071 possession (Score: 53-50)
Bam Iverson attempts a 3Pt. Contested by Cole Simons (5.7 feet, ZONE). Bam Iverson misses. Rebound secured by DeMar Turner.

[00:36] Team_045 possession (Score: 53-50)
Zion Butler attempts a Layup. Wide open! Dejounte Paul is 6.2 feet away. [MAN] ZION BUTLER MAKES IT! Assist: Trae Russell
Score: 53-52

[00:20] Team_071 possession (Score: 53-52)
Jimmy Simons attempts a 3Pt. Contested by Cole Simons (5.7 feet, ZONE). Jimmy Simons misses. Rebound secured by Cole Simons.

[00:01] Team_045 possession (Score: 53-52)
FOUL! Holding foul on Dejounte Paul. [IN THE BONUS! 5 team fouls] Zion Butler to the line for 2 free throws. (Dejounte Paul: 2 personal fouls)   FT 1/2: GOOD   FT 2/2: GOOD Zion Butler makes 2/2 from the line.
Score: 53-54

================================================================================
                              2ND QUARTER COMPLETE                              
================================================================================

2ND QUARTER SCORE: Team_071 28, Team_045 32

BOX SCORE:
================================================================================

Team_071
--------------------------------------------------------------------------------
Player                MIN  PTS  REB  AST  TO      FG   FG%      3P   3P%
--------------------------------------------------------------------------------
Bam Iverson            24   12    5    0   0   5/6    83.3     0/0   0.0
Victor Anunoby         24    6    0    0   0   2/5    40.0     0/0   0.0
Jimmy Simons           24    4    3    0   0   2/6    33.3     0/0   0.0
Allen Williamson       24    4    0    2   0   2/2   100.0     0/0   0.0
Dejounte Paul          24    2    2    0   0   1/3    33.3     0/0   0.0

TEAM: FG: 12/22 (54.5%), 3PT: 0/5 (0.0%), REB: 10 (2 off, 8 def), AST: 2, TO: 0
TEAM FOULS: 5 [Team_045 in BONUS]


Team_045
--------------------------------------------------------------------------------
Player                MIN  PTS  REB  AST  TO      FG   FG%      3P   3P%
--------------------------------------------------------------------------------
Zion Butler            24   12    5    0   0   6/8    75.0     0/0   0.0
DeMar Turner           24    9    4    1   0   3/5    60.0     0/0   0.0
Rudy Antetokounmpo     24    8    0    1   0   3/3   100.0     0/0   0.0
Trae Russell           24    3    0    3   0   1/3    33.3     0/0   0.0
Cole Simons            24    0    4    3   0   0/2     0.0     0/0   0.0

TEAM: FG: 13/21 (61.9%), 3PT: 3/6 (50.0%), REB: 13 (3 off, 10 def), AST: 8, TO: 1
TEAM FOULS: 7 [Team_071 in BONUS]

================================================================================

================================================================================
                       3RD QUARTER - Team_071 vs Team_045                       
================================================================================

[12:00] Team_071 possession (Score: 53-54)
Bam Iverson attempts a 3Pt. Contested by Cole Simons (3.4 feet, ZONE). Bam Iverson misses. Rebound secured by Zion Butler.

[11:46] Team_045 possession (Score: 53-54)
Cole Simons throws a bad pass! Stolen by Bam Iverson! TURNOVER! (live ball)

[11:31] Team_071 possession (Score: 53-54)
Dejounte Paul drives, Zion Butler stays with him. Dejounte Paul attempts a Layup. Contested by Zion Butler (3.6 feet, MAN). Dejounte Paul misses. Rebound secured by Zion Butler.

[11:21] Team_045 possession (Score: 53-54)
Rudy Antetokounmpo throws a bad pass! Stolen by Allen Williamson! TURNOVER! (live ball)

[11:10] Team_071 possession (Score: 53-54)
Allen Williamson attempts a 3Pt. Contested by Cole Simons (3.7 feet, ZONE). Allen Williamson misses. Rebound secured by Cole Simons.

[10:58] Team_045 possession (Score: 53-54)
Zion Butler makes the Midrange and draws the foul on Bam Iverson! And-1! Zion Butler to the line for 1. [Team fouls: 1] (Bam Iverson: 1 personal fouls)   FT 1/1: GOOD Zion Butler makes 1/1 from the line.
Score: 53-57

[10:45] Team_071 possession (Score: 53-57)
Bam Iverson attempts a 3Pt. Contested by Cole Simons (3.4 feet, MAN). BAM IVERSON MAKES IT! Assist: Allen Williamson
Score: 56-57

[10:31] Team_045 possession (Score: 56-57)
Trae Russell attempts a 3Pt. Contested by Victor Anunoby (4.7 feet, ZONE). Trae Russell misses. Rebound secured by Bam Iverson.

[10:20] Team_071 possession (Score: 56-57)
Bam Iverson drives and kicks out. Bam Iverson attempts a Midrange. Contested by Zion Butler (3.2 feet, ZONE). BAM IVERSON MAKES IT!
Score: 58-57

[10:08] Team_045 possession (Score: 58-57)
DeMar Turner attempts a 3Pt. Contested by Jimmy Simons (4.4 feet, MAN). DeMar Turner misses. Rebound secured by Bam Iverson.

[09:58] Team_071 possession (Score: 58-57)
Allen Williamson drives, Zion Butler stays with him. Allen Williamson attempts a Dunk. Contested by Zion Butler (3.7 feet, ZONE). Allen Williamson misses. Rebound secured by Cole Simons.

[09:45] Team_045 possession (Score: 58-57)
Trae Russell attempts a 3Pt. Contested by Victor Anunoby (4.7 feet, ZONE). Trae Russell misses. Rebound secured by Dejounte Paul.

[09:29] Team_071 possession (Score: 58-57)
Dejounte Paul attempts a Layup. Contested by Zion Butler (3.6 feet, MAN). DEJOUNTE PAUL MAKES IT! Assist: Jimmy Simons
Score: 60-57

[09:18] Team_045 possession (Score: 60-57)
DeMar Turner attempts a 3Pt. Contested by Jimmy Simons (4.4 feet, MAN). DeMar Turner misses. Offensive rebound by Zion Butler! Zion Butler puts it back in!
Score: 60-59

[08:59] Team_071 possession (Score: 60-59)
Dejounte Paul throws a bad pass out of bounds! TURNOVER! (dead ball)

[08:45] Team_045 possession (Score: 60-59)
Cole Simons attempts a 3Pt. Contested by Bam Iverson (4.1 feet, MAN). COLE SIMONS MAKES IT! Assist: Zion Butler
Score: 60-62

[08:34] Team_071 possession (Score: 60-62)
Dejounte Paul drives, picks up Zion Butler. Help arrives from Rudy Antetokounmpo! Dejounte Paul attempts a Dunk. Contested by Rudy Antetokounmpo (3.6 feet, ZONE). DEJOUNTE PAUL MAKES IT! Assist: Allen Williamson
Score: 62-62

[08:17] Team_045 possession (Score: 62-62)
Cole Simons drives and kicks out. Rudy Antetokounmpo attempts a 3Pt. Contested by Victor Anunoby (4.2 feet, ZONE). RUDY ANTETOKOUNMPO MAKES IT! Assist: Zion Butler
Score: 62-65

[08:00] Team_071 possession (Score: 62-65)
Jimmy Simons drives to the basket... Jimmy Simons throws a bad pass! Stolen by Zion Butler! TURNOVER! (live ball)

[07:50] Team_045 possession (Score: 62-65)
FOUL! Shooting foul on Jimmy Simons. Cole Simons to the line for 2 free throws. [Team fouls: 2] (Jimmy Simons: 1 personal fouls)   FT 1/2: GOOD   FT 2/2: GOOD Cole Simons makes 2/2 from the line.
Score: 62-67

[07:37] Team_071 possession (Score: 62-67)
Victor Anunoby drives and kicks out. FOUL! Shooting foul on Cole Simons. Victor Anunoby to the line for 2 free throws. [Team fouls: 1] (Cole Simons: 1 personal fouls)   FT 1/2: GOOD   FT 2/2: MISS Victor Anunoby makes 1/2 from the line. Offensive rebound by Jimmy Simons! Jimmy Simons kicks it out.
Score: 63-67

[07:21] Team_071 possession (Score: 63-67)
Dejounte Paul attempts a 3Pt. Contested by Cole Simons (3.7 feet, ZONE). Dejounte Paul misses. Rebound secured by Zion Butler.

[07:12] Team_045 possession (Score: 63-67)
Trae Russell attempts a 3Pt. Contested by Victor Anunoby (4.7 feet, ZONE). Trae Russell misses. Rebound secured by Dejounte Paul.

[06:57] Team_071 possession (Score: 63-67)
Jimmy Simons attempts a Midrange. Contested by Zion Butler (3.3 feet, MAN). JIMMY SIMONS MAKES IT!
Score: 65-67

[06:41] Team_045 possession (Score: 65-67)
Zion Butler attempts a Layup. Contested by Dejounte Paul (4.4 feet, MAN). ZION BUTLER MAKES IT! Assist: DeMar Turner
Score: 65-69

[06:26] Team_071 possession (Score: 65-69)
Jimmy Simons attempts a 3Pt. Contested by Zion Butler (3.3 feet, MAN). Jimmy Simons misses. Rebound secured by DeMar Turner.

[06:12] Team_045 possession (Score: 65-69)
FOUL! Shooting foul on Dejounte Paul. Zion Butler to the line for 2 free throws. [Team fouls: 3] (Dejounte Paul: 1 personal fouls)   FT 1/2: GOOD   FT 2/2: GOOD Zion Butler makes 2/2 from the line.
Score: 65-71

[05:59] Team_071 possession (Score: 65-71)
Victor Anunoby attempts a 3Pt. Contested by Cole Simons (3.3 feet, MAN). Victor Anunoby misses. Rebound secured by Zion Butler.

[05:47] Team_045 possession (Score: 65-71)
Zion Butler attempts a Layup. Contested by Dejounte Paul (4.4 feet, MAN). ZION BUTLER MAKES IT! Assist: Trae Russell
Score: 65-73

[05:33] Team_071 possession (Score: 65-73)
Allen Williamson drives to the basket... Allen Williamson throws a bad pass! Stolen by Rudy Antetokounmpo! TURNOVER! (live ball)

[05:18] Team_045 possession (Score: 65-73)
DeMar Turner drives and kicks out. Trae Russell attempts a Midrange. Contested by Victor Anunoby (4.2 feet, MAN). Trae Russell misses. Rebound secured by Bam Iverson.

[05:04] Team_071 possession (Score: 65-73)
Bam Iverson attempts a Layup. BLOCKED BY ZION BUTLER! Ball is loose! Offensive rebound by Jimmy Simons! Jimmy Simons kicks it out.

[04:50] Team_071 possession (Score: 65-73)
Allen Williamson attempts a 3Pt. Contested by Rudy Antetokounmpo (4.9 feet, MAN). Allen Williamson misses. Rebound secured by Zion Butler.

[04:32] Team_045 possession (Score: 65-73)
Zion Butler attempts a Midrange. Contested by Victor Anunoby (4.6 feet, ZONE). ZION BUTLER MAKES IT! Assist: Rudy Antetokounmpo
Score: 65-75

[04:19] Team_071 possession (Score: 65-75)
Jimmy Simons drives to the basket... Jimmy Simons throws a bad pass out of bounds! TURNOVER! (dead ball)

[04:07] Team_045 possession (Score: 65-75)
DeMar Turner attempts a 3Pt. Contested by Jimmy Simons (4.6 feet, MAN). DeMar Turner misses. Rebound secured by Dejounte Paul.

[03:48] Team_071 possession (Score: 65-75)
Jimmy Simons drives, DeMar Turner stays with him. Jimmy Simons attempts a Dunk. Contested by DeMar Turner (5.1 feet, MAN). Jimmy Simons misses. Rebound secured by Zion Butler.

[03:34] Team_045 possession (Score: 65-75)
FOUL! Shooting foul on Jimmy Simons. DeMar Turner to the line for 2 free throws. [Team fouls: 4] (Jimmy Simons: 2 personal fouls)   FT 1/2: GOOD   FT 2/2: GOOD DeMar Turner makes 2/2 from the line.
Score: 65-77

[03:16] Team_071 possession (Score: 65-77)
Victor Anunoby attempts a 3Pt. Contested by Cole Simons (3.6 feet, MAN). Victor Anunoby misses. Rebound secured by DeMar Turner.

[02:57] Team_045 possession (Score: 65-77)
DeMar Turner attempts a 3Pt. Contested by Jimmy Simons (4.7 feet, MAN). DeMar Turner misses. Rebound secured by Bam Iverson.

[02:42] Team_071 possession (Score: 65-77)
Victor Anunoby attempts a Midrange. BLOCKED BY COLE SIMONS! Ball is loose! Rebound secured by Zion Butler.

[02:26] Team_045 possession (Score: 65-77)
Trae Russell attempts a Layup. BLOCKED BY VICTOR ANUNOBY! Ball deflects out of bounds off Trae Russell.

[02:08] Team_071 possession (Score: 65-77)
Allen Williamson attempts a 3Pt. Contested by Cole Simons (4.1 feet, ZONE). Allen Williamson misses. Rebound secured by DeMar Turner.

[01:56] Team_045 possession (Score: 65-77)
Zion Butler drives, Dejounte Paul stays with him. Zion Butler attempts a Dunk. Contested by Dejounte Paul (4.7 feet, ZONE). Zion Butler misses. Rebound secured by Bam Iverson.

[01:44] Team_071 possession (Score: 65-77)
Jimmy Simons attempts a Layup. Contested by DeMar Turner (5.2 feet, MAN). Jimmy Simons misses. Offensive rebound by Jimmy Simons! Jimmy Simons kicks it out.

[01:30] Team_071 possession (Score: 65-77)
Dejounte Paul drives to the basket... Dejounte Paul loses control! Ball rolls out of bounds! TURNOVER! (dead ball)

[01:30] Substitution (Team_071): Allen Williamson OUT → Evan Sexton IN (stamina_rule2)

[01:30] Substitution (Team_071): Victor Anunoby OUT → Paul Ball IN (stamina_rule2)

[01:30] Substitution (Team_071): Bam Iverson OUT → Immanuel Ginobili IN (stamina_rule2)

[01:30] Substitution (Team_071): Jimmy Simons OUT → Jordan Durant IN (stamina_rule2)

[01:30] Substitution (Team_071): Dejounte Paul OUT → Tyrese Brogdon IN (stamina_rule2)

[01:30] Substitution (Team_045): Rudy Antetokounmpo OUT → John Wagner IN (stamina_rule2)

[01:30] Substitution (Team_045): Trae Russell OUT → Julius James IN (stamina_rule2)

[01:30] Substitution (Team_045): Cole Simons OUT → Gary Towns IN (stamina_rule2)

[01:30] Substitution (Team_045): DeMar Turner OUT → Tim Sexton IN (stamina_rule2)

[01:30] Substitution (Team_045): Zion Butler OUT → Stephen Paul IN (stamina_rule2)

[01:16] Team_045 possession (Score: 65-77)
John Wagner attempts a Layup. Contested by Evan Sexton (5.4 feet, MAN). John Wagner misses. Rebound secured by Immanuel Ginobili.

[01:02] Team_071 possession (Score: 65-77)
FOUL! Shooting foul on Gary Towns. Immanuel Ginobili to the line for 2 free throws. [Team fouls: 2] (Gary Towns: 1 personal fouls)   FT 1/2: GOOD   FT 2/2: GOOD Immanuel Ginobili makes 2/2 from the line.
Score: 67-77

[00:49] Team_045 possession (Score: 67-77)
Julius James attempts a 3Pt. Contested by Paul Ball (4.5 feet, ZONE). JULIUS JAMES MAKES IT! Assist: Tim Sexton
Score: 67-80

[00:34] Team_071 possession (Score: 67-80)
Evan Sexton drives, John Wagner stays with him. Evan Sexton attempts a Layup. Contested by John Wagner (4.6 feet, MAN). EVAN SEXTON MAKES IT!
Score: 69-80

[00:15] Team_045 possession (Score: 69-80)
Stephen Paul drives and kicks out. John Wagner attempts a Midrange. Contested by Jordan Durant (4.8 feet, ZONE). JOHN WAGNER MAKES IT!
Score: 69-82

================================================================================
                              3RD QUARTER COMPLETE                              
================================================================================

3RD QUARTER SCORE: Team_071 16, Team_045 28

BOX SCORE:
================================================================================

Team_071
--------------------------------------------------------------------------------
Player                MIN  PTS  REB  AST  TO      FG   FG%      3P   3P%
--------------------------------------------------------------------------------
Bam Iverson            35    5    5    0   0   2/3    66.7     0/0   0.0
Dejounte Paul          35    4    3    0   0   2/4    50.0     0/0   0.0
Jimmy Simons           35    2    3    1   0   1/3    33.3     0/0   0.0
Immanuel Ginobili       1    2    1    0   0   1/1   100.0     0/0   0.0
Evan Sexton             1    2    0    0   0   1/1   100.0     0/0   0.0
Allen Williamson       35    0    0    2   0   0/4     0.0     0/0   0.0
Victor Anunoby         35    0    0    0   0   0/3     0.0     0/0   0.0

TEAM: FG: 7/19 (36.8%), 3PT: 1/9 (11.1%), REB: 12 (3 off, 9 def), AST: 3, TO: 5
TEAM FOULS: 4


Team_045
--------------------------------------------------------------------------------
Player                MIN  PTS  REB  AST  TO      FG   FG%      3P   3P%
--------------------------------------------------------------------------------
Zion Butler            35   13    8    2   0   6/7    85.7     0/0   0.0
Cole Simons            35    5    2    0   0   2/2   100.0     0/0   0.0
Rudy Antetokounmpo     35    3    0    1   0   1/1   100.0     0/0   0.0
Julius James            1    3    0    0   0   1/1   100.0     0/0   0.0
DeMar Turner           35    2    3    1   0   1/5    20.0     0/0   0.0
John Wagner             1    2    0    0   0   1/2    50.0     0/0   0.0
Trae Russell           35    0    0    1   0   0/4     0.0     0/0   0.0
Tim Sexton              1    0    0    1   0   0/0     0.0     0/0   0.0

TEAM: FG: 12/22 (54.5%), 3PT: 3/9 (33.3%), REB: 13 (1 off, 12 def), AST: 6, TO: 2
TEAM FOULS: 2

================================================================================

================================================================================
                       4TH QUARTER - Team_071 vs Team_045                       
================================================================================

[12:00] Substitution (Team_071): Allen Williamson OUT (stamina: 75) → Evan Sexton IN (comeback_detected)

[12:00] Substitution (Team_045): Rudy Antetokounmpo OUT (stamina: 76) → John Wagner IN (comeback_detected)

[12:00] Team_071 possession (Score: 69-82)
FOUL! Shooting foul on Zion Butler. Dejounte Paul to the line for 2 free throws. [Team fouls: 1] (Zion Butler: 1 personal fouls)   FT 1/2: MISS   FT 2/2: MISS Dejounte Paul makes 0/2 from the line. Rebound secured by DeMar Turner.

[11:44] Team_045 possession (Score: 69-82)
Cole Simons attempts a Midrange. Contested by Bam Iverson (4.2 feet, ZONE). Cole Simons misses. Rebound secured by Bam Iverson.

[11:31] Team_071 possession (Score: 69-82)
Evan Sexton attempts a Midrange. Contested by Cole Simons (4.0 feet, ZONE). Evan Sexton misses. Rebound secured by Zion Butler.

[11:20] Team_045 possession (Score: 69-82)
Cole Simons attempts a 3Pt. Contested by Bam Iverson (4.3 feet, MAN). Cole Simons misses. Rebound secured by Jimmy Simons.

[11:03] Team_071 possession (Score: 69-82)
Dejounte Paul drives, Zion Butler stays with him. Dejounte Paul attempts a Dunk. Contested by Zion Butler (4.0 feet, ZONE). DEJOUNTE PAUL MAKES IT!
Score: 71-82

[10:49] Team_045 possession (Score: 71-82)
DeMar Turner drives, Jimmy Simons stays with him. DeMar Turner attempts a Dunk. Contested by Jimmy Simons (4.7 feet, MAN). DEMAR TURNER MAKES IT!
Score: 71-84

[10:36] Team_071 possession (Score: 71-84)
Evan Sexton attempts a Layup. Contested by Zion Butler (4.2 feet, ZONE). Evan Sexton misses. Rebound secured by Cole Simons.

[10:25] Team_045 possession (Score: 71-84)
DeMar Turner drives, Jimmy Simons stays with him. DeMar Turner attempts a Layup. Contested by Jimmy Simons (4.7 feet, MAN). DeMar Turner misses. Rebound secured by Jimmy Simons.

[10:09] Team_071 possession (Score: 71-84)
Evan Sexton drives to the basket... FOUL! Offensive foul on Evan Sexton! John Wagner drew the charge! [Team fouls: 1] (Evan Sexton: 1 personal fouls) TURNOVER! (dead ball)

[09:52] Team_045 possession (Score: 71-84)
Zion Butler drives, picks up Dejounte Paul. Help arrives from Evan Sexton! Zion Butler attempts a Dunk. Contested by Evan Sexton (4.7 feet, MAN). Zion Butler misses. Offensive rebound by Zion Butler! Zion Butler puts it back in!
Score: 71-86

[09:37] Team_071 possession (Score: 71-86)
Victor Anunoby makes the 3Pt and draws the foul on Cole Simons! And-1! Victor Anunoby to the line for 1. [Team fouls: 2] (Cole Simons: 1 personal fouls)   FT 1/1: GOOD Victor Anunoby makes 1/1 from the line.
Score: 75-86

[09:25] Team_045 possession (Score: 75-86)
Zion Butler attempts a 3Pt. Contested by Dejounte Paul (4.8 feet, MAN). Zion Butler misses. Rebound secured by Jimmy Simons.

[09:07] Team_071 possession (Score: 75-86)
Bam Iverson attempts a 3Pt. Contested by Cole Simons (3.9 feet, ZONE). Bam Iverson misses. Rebound secured by DeMar Turner.

[08:57] Team_045 possession (Score: 75-86)
DeMar Turner attempts a 3Pt. Contested by Victor Anunoby (4.9 feet, ZONE). DeMar Turner misses. Rebound secured by Jimmy Simons.

[08:44] Team_071 possession (Score: 75-86)
Dejounte Paul drives to the basket... Dejounte Paul throws a bad pass out of bounds! TURNOVER! (dead ball)

[08:44] Substitution (Team_071): Victor Anunoby OUT → Paul Ball IN (stamina_rule2)

[08:44] Substitution (Team_071): Bam Iverson OUT → Immanuel Ginobili IN (stamina_rule2)

[08:44] Substitution (Team_071): Jimmy Simons OUT → Jordan Durant IN (stamina_rule2)

[08:44] Substitution (Team_071): Dejounte Paul OUT → Tyrese Brogdon IN (stamina_rule2)

[08:44] Substitution (Team_045): Trae Russell OUT → Julius James IN (stamina_rule2)

[08:44] Substitution (Team_045): Cole Simons OUT → Gary Towns IN (stamina_rule2)

[08:44] Substitution (Team_045): DeMar Turner OUT → Tim Sexton IN (stamina_rule2)

[08:44] Substitution (Team_045): Zion Butler OUT → Stephen Paul IN (stamina_rule2)

[08:28] Team_045 possession (Score: 75-86)
FOUL! Reach-in foul on Immanuel Ginobili during the drive. [Team fouls: 2] No free throws, side out. (Immanuel Ginobili: 1 personal fouls)

[08:14] Team_045 possession (Score: 75-86)
John Wagner makes the Layup and draws the foul on Evan Sexton! And-1! John Wagner to the line for 1. [Team fouls: 3] (Evan Sexton: 2 personal fouls)   FT 1/1: MISS John Wagner makes 0/1 from the line. Rebound secured by Evan Sexton.
Score: 75-88

[07:57] Team_071 possession (Score: 75-88)
Tyrese Brogdon attempts a Midrange. Contested by Stephen Paul (4.9 feet, MAN). TYRESE BROGDON MAKES IT! Assist: Evan Sexton
Score: 77-88

[07:40] Team_045 possession (Score: 77-88)
John Wagner drives, picks up Evan Sexton. Help arrives from Immanuel Ginobili! John Wagner attempts a Dunk. Contested by Immanuel Ginobili (5.4 feet, MAN). John Wagner misses. Rebound secured by Immanuel Ginobili.

[07:24] Team_071 possession (Score: 77-88)
Jordan Durant attempts a 3Pt. Contested by Tim Sexton (4.5 feet, MAN). Jordan Durant misses. Rebound secured by Julius James.

[07:09] Team_045 possession (Score: 77-88)
Tim Sexton commits a violation (traveling/carry)! TURNOVER! (dead ball)

[06:57] Team_071 possession (Score: 77-88)
Tyrese Brogdon attempts a Midrange. Contested by Julius James (4.4 feet, ZONE). Tyrese Brogdon misses. FOUL! Loose ball foul on Tim Sexton during the rebound battle. [Team fouls: 3] No free throws, side out. (Tim Sexton: 1 personal fouls)

[06:38] Team_071 possession (Score: 77-88)
Paul Ball attempts a 3Pt. Contested by Julius James (4.0 feet, ZONE). Paul Ball misses. Offensive rebound by Immanuel Ginobili! Immanuel Ginobili kicks it out.

[06:23] Team_071 possession (Score: 77-88)
Paul Ball attempts a Midrange. Contested by Julius James (4.0 feet, MAN). Paul Ball misses. Rebound secured by Tim Sexton.

[06:07] Team_045 possession (Score: 77-88)
Stephen Paul drives, picks up Tyrese Brogdon. Help arrives from Evan Sexton! Stephen Paul attempts a Dunk. Contested by Evan Sexton (5.6 feet, ZONE). Stephen Paul misses. Rebound secured by Evan Sexton.

[05:56] Team_071 possession (Score: 77-88)
Tyrese Brogdon attempts a Midrange. Contested by Stephen Paul (4.9 feet, MAN). TYRESE BROGDON MAKES IT! Assist: Immanuel Ginobili
Score: 79-88

[05:42] Team_045 possession (Score: 79-88)
Gary Towns attempts a 3Pt. Contested by Paul Ball (4.1 feet, ZONE). Gary Towns misses. Rebound secured by Jordan Durant.

[05:31] Team_071 possession (Score: 79-88)
Jordan Durant attempts a Layup. Contested by Tim Sexton (4.5 feet, MAN). JORDAN DURANT MAKES IT!
Score: 81-88

[05:14] Team_045 possession (Score: 81-88)
John Wagner attempts a 3Pt. Contested by Paul Ball (4.5 feet, ZONE). John Wagner misses. Rebound secured by Jordan Durant.

[05:03] Team_071 possession (Score: 81-88)
Paul Ball drives and kicks out. Jordan Durant attempts a 3Pt. Contested by Tim Sexton (4.6 feet, MAN). Jordan Durant misses. Rebound secured by Tim Sexton.

[04:45] Team_045 possession (Score: 81-88)
John Wagner attempts a Midrange. Contested by Evan Sexton (5.5 feet, MAN). JOHN WAGNER MAKES IT!
Score: 81-90

[04:32] Team_071 possession (Score: 81-90)
Immanuel Ginobili attempts a Midrange. Contested by Gary Towns (4.9 feet, MAN). IMMANUEL GINOBILI MAKES IT!
Score: 83-90

[04:15] Team_045 possession (Score: 83-90)
Tim Sexton attempts a 3Pt. Contested by Paul Ball (4.7 feet, ZONE). TIM SEXTON MAKES IT! Assist: John Wagner
Score: 83-93

[04:04] Team_071 possession (Score: 83-93)
Tyrese Brogdon makes the Dunk and draws the foul on Stephen Paul! And-1! Tyrese Brogdon to the line for 1. [Team fouls: 4] (Stephen Paul: 1 personal fouls)   FT 1/1: GOOD Tyrese Brogdon makes 1/1 from the line.
Score: 86-93

[03:50] Team_045 possession (Score: 86-93)
Gary Towns attempts a 3Pt. Contested by Immanuel Ginobili (4.0 feet, MAN). Gary Towns misses. Rebound secured by Immanuel Ginobili.

[03:36] Team_071 possession (Score: 86-93)
Paul Ball attempts a 3Pt. Contested by John Wagner (4.4 feet, ZONE). Paul Ball misses. FOUL! Loose ball foul on Stephen Paul during the rebound battle. [IN THE BONUS! 5 team fouls] Immanuel Ginobili to the line for 2 free throws. (Stephen Paul: 2 personal fouls)   FT 1/2: MISS   FT 2/2: GOOD Immanuel Ginobili makes 1/2 from the line.
Score: 87-93

[03:21] Team_045 possession (Score: 87-93)
John Wagner attempts a 3Pt. Contested by Evan Sexton (5.6 feet, MAN). John Wagner misses. Rebound secured by Jordan Durant.

[03:11] Team_071 possession (Score: 87-93)
Tyrese Brogdon makes the Midrange and draws the foul on Tim Sexton! And-1! Tyrese Brogdon to the line for 1. [BONUS: 6 team fouls] (Tim Sexton: 2 personal fouls)   FT 1/1: MISS Tyrese Brogdon makes 0/1 from the line. Offensive rebound by Jordan Durant! Jordan Durant kicks it out.
Score: 89-93

[02:59] Team_071 possession (Score: 89-93)
Evan Sexton attempts a Layup. Contested by Stephen Paul (4.9 feet, ZONE). EVAN SEXTON MAKES IT! Assist: Immanuel Ginobili
Score: 91-93

[02:44] Team_045 possession (Score: 91-93)
Stephen Paul attempts a Midrange. Contested by Tyrese Brogdon (5.6 feet, MAN). STEPHEN PAUL MAKES IT!
Score: 91-95

[02:26] Team_071 possession (Score: 91-95)
Tyrese Brogdon attempts a Midrange. Contested by Stephen Paul (5.0 feet, MAN). Tyrese Brogdon misses. Rebound secured by Tim Sexton.

[02:09] Team_045 possession (Score: 91-95)
John Wagner drives and kicks out. John Wagner attempts a 3Pt. Contested by Evan Sexton (5.6 feet, MAN). JOHN WAGNER MAKES IT! Assist: Stephen Paul
Score: 91-98

[01:54] Team_071 possession (Score: 91-98)
Paul Ball attempts a Midrange. Contested by Julius James (4.0 feet, MAN). PAUL BALL MAKES IT!
Score: 93-98

[01:39] Team_045 possession (Score: 93-98)
Julius James attempts a Layup. Contested by Jordan Durant (5.0 feet, ZONE). JULIUS JAMES MAKES IT! Assist: John Wagner
Score: 93-100

[01:23] Team_071 possession (Score: 93-100)
Evan Sexton attempts a 3Pt. Contested by John Wagner (5.1 feet, MAN). Evan Sexton misses. Rebound secured by Tim Sexton.

[01:05] Team_045 possession (Score: 93-100)
Stephen Paul attempts a Layup. Contested by Tyrese Brogdon (5.7 feet, MAN). STEPHEN PAUL MAKES IT! Assist: John Wagner
Score: 93-102

[00:52] Team_071 possession (Score: 93-102)
Immanuel Ginobili makes the 3Pt and draws the foul on Gary Towns! And-1! Immanuel Ginobili to the line for 1. [BONUS: 7 team fouls] (Gary Towns: 1 personal fouls)   FT 1/1: GOOD Immanuel Ginobili makes 1/1 from the line.
Score: 97-102

[00:37] Team_045 possession (Score: 97-102)
Stephen Paul attempts a 3Pt. Contested by Tyrese Brogdon (5.7 feet, MAN). Stephen Paul misses. Offensive rebound by Tim Sexton! Tim Sexton kicks it out.

[00:22] Team_045 possession (Score: 97-102)
Gary Towns attempts a 3Pt. Contested by Paul Ball (4.3 feet, ZONE). Gary Towns misses. Rebound secured by Immanuel Ginobili.

[00:11] Team_071 possession (Score: 97-102)
FOUL! Holding foul on Julius James. [IN THE BONUS! 8 team fouls] Paul Ball to the line for 2 free throws. (Julius James: 1 personal fouls)   FT 1/2: GOOD   FT 2/2: GOOD Paul Ball makes 2/2 from the line.
Score: 99-102

================================================================================
                              4TH QUARTER COMPLETE                              
================================================================================

4TH QUARTER SCORE: Team_071 30, Team_045 20

BOX SCORE:
================================================================================

Team_071
--------------------------------------------------------------------------------
Player                MIN  PTS  REB  AST  TO      FG   FG%      3P   3P%
--------------------------------------------------------------------------------
Tyrese Brogdon         10    7    0    0   0   3/4    75.0     0/0   0.0
Immanuel Ginobili      10    7    4    2   0   3/3   100.0     0/0   0.0
Victor Anunoby         39    4    0    0   0   1/1   100.0     0/0   0.0
Paul Ball              10    4    0    0   0   2/4    50.0     0/0   0.0
Dejounte Paul          39    2    0    0   0   1/2    50.0     0/0   0.0
Evan Sexton            13    2    2    1   0   1/4    25.0     0/0   0.0
Jordan Durant          10    2    5    0   0   1/2    50.0     0/0   0.0
Bam Iverson            39    0    1    0   0   0/1     0.0     0/0   0.0
Jimmy Simons           39    0    4    0   0   0/0     0.0     0/0   0.0

TEAM: FG: 12/21 (57.1%), 3PT: 3/6 (50.0%), REB: 16 (3 off, 13 def), AST: 3, TO: 2
TEAM FOULS: 3


Team_045
--------------------------------------------------------------------------------
Player                MIN  PTS  REB  AST  TO      FG   FG%      3P   3P%
--------------------------------------------------------------------------------
John Wagner            13    5    0    3   0   2/6    33.3     0/0   0.0
Stephen Paul           10    4    0    1   0   2/3    66.7     0/0   0.0
Tim Sexton             10    3    5    0   0   1/1   100.0     0/0   0.0
DeMar Turner           39    2    2    0   0   1/3    33.3     0/0   0.0
Zion Butler            39    2    2    0   0   1/2    50.0     0/0   0.0
Julius James           10    2    1    0   0   1/1   100.0     0/0   0.0
Cole Simons            39    0    1    0   0   0/2     0.0     0/0   0.0
Gary Towns             10    0    0    0   0   0/3     0.0     0/0   0.0

TEAM: FG: 8/21 (38.1%), 3PT: 1/9 (11.1%), REB: 11 (2 off, 9 def), AST: 4, TO: 1
TEAM FOULS: 8 [Team_071 in BONUS]

================================================================================

================================================================================
                               FULL GAME COMPLETE                               
================================================================================

FINAL SCORE: Team_071 99, Team_045 102

SCORING BY QUARTER:
--------------------------------------------------------------------------------
Team                     Q1     Q2     Q3     Q4    FINAL
--------------------------------------------------------------------------------
Team_071                 25     28     16     30       99
Team_045                 22     32     28     20      102
--------------------------------------------------------------------------------

FULL GAME BOX SCORE:
================================================================================

Team_071
--------------------------------------------------------------------------------
Player                MIN  PTS  REB  AST  TO      FG   FG%      3P   3P%      FT STL BLK
--------------------------------------------------------------------------------
Victor Anunoby         39   15    0    0   0   5/12   41.7   1/5    20.0   5/6     0   1
Bam Iverson            39   20   15    1   1   8/13   61.5   2/7    28.6   4/4     1   0
Jimmy Simons           39   13   15    1   1   6/13   46.2   0/4     0.0   1/1     0   0
Dejounte Paul          39   15   11    1   4   7/13   53.8   0/1     0.0   1/3     1   0
Allen Williamson       35    6    0    4   2   3/13   23.1   0/7     0.0   5/6     1   2
Evan Sexton            13    4    2    1   1   2/5    40.0   0/1     0.0   0/0     0   0
Paul Ball              10    4    0    0   0   2/4    50.0   1/1   100.0   2/2     0   0
Immanuel Ginobili      10    9    5    2   0   3/3   100.0   1/1   100.0   4/5     0   0
Jordan Durant          10    2    5    0   0   1/2    50.0   0/1     0.0   0/0     0   0
Tyrese Brogdon         10    7    0    0   0   3/4    75.0   0/0     0.0   1/2     0   0

TEAM: FG: 41/83 (49.4%), 3PT: 5/28 (17.9%), REB: 53 (10 off, 43 def), AST: 10, TO: 9


Team_045
--------------------------------------------------------------------------------
Player                MIN  PTS  REB  AST  TO      FG   FG%      3P   3P%      FT STL BLK
--------------------------------------------------------------------------------
Trae Russell           39    7    0    6   0   2/10   20.0   1/6    16.7   0/0     0   0
Cole Simons            39    5    8    5   1   3/9    33.3   1/4    25.0   2/2     0   1
DeMar Turner           39   15   16    3   0   7/18   38.9   1/8    12.5   5/5     0   1
Zion Butler            39   31   20    2   1  14/20   70.0   0/1     0.0   5/5     1   1
Rudy Antetokounmpo     35   22    0    3   1   7/11   63.6   5/7    71.4   1/2     1   0
John Wagner            13    7    0    3   0   2/7    28.6   0/2     0.0   0/1     0   0
Julius James           10    5    1    0   0   2/2   100.0   1/1   100.0   0/0     0   0
Gary Towns             10    0    0    0   0   0/3     0.0   0/3     0.0   0/0     0   0
Tim Sexton             10    3    5    1   1   1/1   100.0   1/1   100.0   0/0     0   0
Stephen Paul           10    4    0    1   0   3/4    75.0   0/0     0.0   0/0     0   0

TEAM: FG: 42/86 (48.8%), 3PT: 10/33 (30.3%), REB: 50 (8 off, 42 def), AST: 24, TO: 4

================================================================================
