================================================================================
                        FULL GAME - Team_005 vs Team_049                        
================================================================================

================================================================================
                       1ST QUARTER - Team_005 vs Team_049                       
================================================================================

[12:00] Team_005 possession (Score: 0-0)
Jalen Rozier attempts a 3Pt. Contested by De'Aaron Allen (4.6 feet, MAN). Jalen Rozier misses. Rebound secured by Shai Mobley.

[11:45] Team_049 possession (Score: 0-0)
Shai Mobley drives to the basket... Shai Mobley throws a bad pass! Stolen by Cade Markkanen! TURNOVER! (live ball)

[11:29] Team_005 possession (Score: 0-0)
Derrick Allen makes the Dunk and draws the foul on Ja Oladipo! And-1! Derrick Allen to the line for 1. [Team fouls: 1] (Ja Oladipo: 1 personal fouls)   FT 1/1: GOOD Derrick Allen makes 1/1 from the line.
Score: 3-0

[11:17] Team_049 possession (Score: 3-0)
Jimmy Griffin attempts a 3Pt. Contested by Derrick Allen (4.3 feet, ZONE). Jimmy Griffin misses. Rebound secured by Cade Markkanen.

[11:02] Team_005 possession (Score: 3-0)
Derrick Allen drives and kicks out. Cade Markkanen attempts a 3Pt. Contested by Shai Mobley (4.2 feet, MAN). CADE MARKKANEN MAKES IT! Assist: Brandon George
Score: 6-0

[10:51] Team_049 possession (Score: 6-0)
Ja Oladipo attempts a 3Pt. Contested by Anthony Rozier (4.8 feet, MAN). JA OLADIPO MAKES IT! Assist: Jimmy Griffin
Score: 6-3

[10:36] Team_005 possession (Score: 6-3)
Cade Markkanen makes the Layup and draws the foul on Ja Oladipo! And-1! Cade Markkanen to the line for 1. [Team fouls: 2] (Ja Oladipo: 2 personal fouls)   FT 1/1: GOOD Cade Markkanen makes 1/1 from the line.
Score: 9-3

[10:22] Team_049 possession (Score: 9-3)
FOUL! Reach-in foul on Anthony Rozier during the drive. [Team fouls: 1] No free throws, side out. (Anthony Rozier: 1 personal fouls)

[10:03] Team_049 possession (Score: 9-3)
Shai Bird attempts a 3Pt. Contested by Derrick Allen (4.7 feet, ZONE). Shai Bird misses. Rebound secured by Jalen Rozier.

[09:50] Team_005 possession (Score: 9-3)
Jalen Rozier attempts a Midrange. Contested by De'Aaron Allen (4.6 feet, ZONE). JALEN ROZIER MAKES IT!
Score: 11-3

[09:36] Team_049 possession (Score: 11-3)
Shai Mobley attempts a 3Pt. Contested by Derrick Allen (4.5 feet, ZONE). Shai Mobley misses. Offensive rebound by Jimmy Griffin! Jimmy Griffin kicks it out.

[09:22] Team_049 possession (Score: 11-3)
Shai Bird attempts a Layup. Contested by Brandon George (5.6 feet, MAN). SHAI BIRD MAKES IT! Assist: De'Aaron Allen
Score: 11-5

[09:05] Team_005 possession (Score: 11-5)
Derrick Allen attempts a Midrange. Contested by Jimmy Griffin (5.1 feet, MAN). DERRICK ALLEN MAKES IT!
Score: 13-5

[08:49] Team_049 possession (Score: 13-5)
Shai Bird attempts a Midrange. Contested by Jalen Rozier (5.3 feet, ZONE). SHAI BIRD MAKES IT!
Score: 13-7

[08:36] Team_005 possession (Score: 13-7)
Derrick Allen attempts a 3Pt. Contested by Jimmy Griffin (5.1 feet, MAN). Derrick Allen misses. Rebound secured by Shai Mobley.

[08:22] Team_049 possession (Score: 13-7)
Shai Mobley attempts a Midrange. Contested by Anthony Rozier (4.9 feet, ZONE). Shai Mobley misses. Rebound secured by Jalen Rozier.

[08:09] Team_005 possession (Score: 13-7)
Cade Markkanen attempts a Midrange. Contested by Shai Mobley (4.1 feet, MAN). Cade Markkanen misses. FOUL! Loose ball foul on Shai Mobley during the rebound battle. [Team fouls: 3] No free throws, side out. (Shai Mobley: 1 personal fouls)

[07:57] Team_005 possession (Score: 13-7)
Anthony Rozier drives, picks up Ja Oladipo. Help arrives from Jimmy Griffin! Anthony Rozier attempts a Layup. Contested by Jimmy Griffin (4.3 feet, MAN). ANTHONY ROZIER MAKES IT! Assist: Brandon George
Score: 15-7

[07:43] Team_049 possession (Score: 15-7)
Shai Mobley attempts a Midrange. Contested by Jalen Rozier (5.2 feet, ZONE). Shai Mobley misses. Rebound secured by Cade Markkanen.

[07:31] Team_005 possession (Score: 15-7)
Cade Markkanen attempts a Dunk. BLOCKED BY SHAI MOBLEY! Ball is loose! Rebound secured by Shai Mobley.

[07:15] Team_049 possession (Score: 15-7)
Jimmy Griffin drives, Cade Markkanen stays with him. Jimmy Griffin attempts a Layup. Contested by Cade Markkanen (3.3 feet, ZONE). JIMMY GRIFFIN MAKES IT! Assist: Shai Bird
Score: 15-9

[06:58] Team_005 possession (Score: 15-9)
Jalen Rozier attempts a Layup. Contested by De'Aaron Allen (4.6 feet, ZONE). Jalen Rozier misses. Rebound secured by Shai Mobley.

[06:45] Team_049 possession (Score: 15-9)
Jimmy Griffin makes the Midrange and draws the foul on Derrick Allen! And-1! Jimmy Griffin to the line for 1. [Team fouls: 2] (Derrick Allen: 1 personal fouls)   FT 1/1: GOOD Jimmy Griffin makes 1/1 from the line.
Score: 15-12

[06:30] Team_005 possession (Score: 15-12)
Brandon George drives to the basket... Brandon George loses the ball! Stripped by Shai Mobley! TURNOVER! (live ball)

[06:12] Team_049 possession (Score: 15-12)
De'Aaron Allen attempts a 3Pt. Contested by Derrick Allen (4.1 feet, ZONE). De'Aaron Allen misses. Rebound secured by Derrick Allen.

[05:55] Team_005 possession (Score: 15-12)
Jalen Rozier makes the Dunk and draws the foul on De'Aaron Allen! And-1! Jalen Rozier to the line for 1. [Team fouls: 4] (De'Aaron Allen: 1 personal fouls)   FT 1/1: GOOD Jalen Rozier makes 1/1 from the line.
Score: 18-12

[05:37] Team_049 possession (Score: 18-12)
De'Aaron Allen drives, Cade Markkanen stays with him. De'Aaron Allen attempts a Layup. Contested by Cade Markkanen (3.1 feet, ZONE). De'Aaron Allen misses. Rebound secured by Cade Markkanen.

[05:23] Team_005 possession (Score: 18-12)
Jalen Rozier attempts a 3Pt. Contested by Ja Oladipo (4.6 feet, ZONE). Jalen Rozier misses. Rebound secured by De'Aaron Allen.

[05:08] Team_049 possession (Score: 18-12)
Shai Bird drives and kicks out. Ja Oladipo attempts a 3Pt. Contested by Jalen Rozier (4.9 feet, ZONE). Ja Oladipo misses. Rebound secured by Derrick Allen.

[04:53] Team_005 possession (Score: 18-12)
Brandon George attempts a 3Pt. Contested by Ja Oladipo (4.5 feet, ZONE). Brandon George misses. Rebound secured by De'Aaron Allen.

[04:37] Team_049 possession (Score: 18-12)
De'Aaron Allen attempts a Layup. BLOCKED BY CADE MARKKANEN! Ball goes out off Cade Markkanen. De'Aaron Allen's ball!

[04:24] Team_049 possession (Score: 18-12)
De'Aaron Allen attempts a 3Pt. Contested by Cade Markkanen (3.2 feet, MAN). DE'AARON ALLEN MAKES IT!
Score: 18-15

[04:06] Team_005 possession (Score: 18-15)
Brandon George drives, De'Aaron Allen stays with him. Brandon George attempts a Dunk. Contested by De'Aaron Allen (4.5 feet, ZONE). BRANDON GEORGE MAKES IT! Assist: Cade Markkanen
Score: 20-15

[03:53] Team_049 possession (Score: 20-15)
Ja Oladipo drives, picks up Anthony Rozier. Help arrives from Derrick Allen! Ja Oladipo attempts a Layup. Contested by Derrick Allen (5.0 feet, MAN). JA OLADIPO MAKES IT! Assist: Jimmy Griffin
Score: 20-17

[03:40] Team_005 possession (Score: 20-17)
Cade Markkanen attempts a Layup. Contested by Shai Mobley (4.2 feet, MAN). CADE MARKKANEN MAKES IT!
Score: 22-17

[03:28] Team_049 possession (Score: 22-17)
Jimmy Griffin attempts a Midrange. Contested by Derrick Allen (4.4 feet, MAN). Jimmy Griffin misses. Rebound secured by Derrick Allen.

[03:18] Team_005 possession (Score: 22-17)
Brandon George drives, De'Aaron Allen stays with him. Brandon George attempts a Layup. Contested by De'Aaron Allen (4.6 feet, ZONE). BRANDON GEORGE MAKES IT!
Score: 24-17

[03:07] Team_049 possession (Score: 24-17)
Shai Bird attempts a 3Pt. Contested by Brandon George (5.8 feet, MAN). Shai Bird misses. Rebound secured by Derrick Allen.

[02:52] Team_005 possession (Score: 24-17)
Jalen Rozier attempts a Midrange. Contested by De'Aaron Allen (4.8 feet, MAN). Jalen Rozier misses. Rebound secured by Jimmy Griffin.

[02:36] Team_049 possession (Score: 24-17)
FOUL! Holding foul on Anthony Rozier. [Team fouls: 3] No free throws, side out. (Anthony Rozier: 2 personal fouls)

[02:25] Team_049 possession (Score: 24-17)
Jimmy Griffin attempts a Layup. BLOCKED BY ANTHONY ROZIER! Ball is loose! Rebound secured by Jalen Rozier.

[02:10] Team_005 possession (Score: 24-17)
FOUL! Holding foul on De'Aaron Allen. [IN THE BONUS! 5 team fouls] Jalen Rozier to the line for 2 free throws. (De'Aaron Allen: 2 personal fouls)   FT 1/2: GOOD   FT 2/2: GOOD Jalen Rozier makes 2/2 from the line.
Score: 26-17

[01:54] Team_049 possession (Score: 26-17)
Jimmy Griffin attempts a 3Pt. Contested by Derrick Allen (4.5 feet, ZONE). Jimmy Griffin misses. Rebound secured by Jalen Rozier.

[01:41] Team_005 possession (Score: 26-17)
Derrick Allen attempts a 3Pt. Contested by Ja Oladipo (4.9 feet, ZONE). DERRICK ALLEN MAKES IT! Assist: Jalen Rozier
Score: 29-17

[01:30] Team_049 possession (Score: 29-17)
Shai Mobley drives, Cade Markkanen stays with him. Shai Mobley attempts a Dunk. Contested by Cade Markkanen (4.1 feet, ZONE). Shai Mobley misses. Rebound secured by Jalen Rozier.

[01:17] Team_005 possession (Score: 29-17)
Brandon George drives, picks up Shai Bird. Help arrives from Jimmy Griffin! Brandon George attempts a Layup. Contested by Jimmy Griffin (4.5 feet, MAN). Brandon George misses. Rebound secured by De'Aaron Allen.

[01:05] Team_049 possession (Score: 29-17)
Jimmy Griffin attempts a 3Pt. Contested by Derrick Allen (4.6 feet, MAN). Jimmy Griffin misses. Rebound secured by Derrick Allen.

[00:50] Team_005 possession (Score: 29-17)
Brandon George attempts a 3Pt. Contested by Ja Oladipo (4.8 feet, ZONE). BRANDON GEORGE MAKES IT! Assist: Anthony Rozier
Score: 32-17

[00:35] Team_049 possession (Score: 32-17)
De'Aaron Allen attempts a 3Pt. Contested by Jalen Rozier (5.2 feet, ZONE). DE'AARON ALLEN MAKES IT! Assist: Shai Bird
Score: 32-20

[00:20] Team_005 possession (Score: 32-20)
Anthony Rozier attempts a 3Pt. Contested by Ja Oladipo (4.8 feet, ZONE). Anthony Rozier misses. Rebound secured by De'Aaron Allen.

[00:05] Team_049 possession (Score: 32-20)
Jimmy Griffin attempts a 3Pt. Contested by Derrick Allen (4.7 feet, ZONE). Jimmy Griffin misses. Rebound secured by Cade Markkanen.

================================================================================
                              1ST QUARTER COMPLETE                              
================================================================================

1ST QUARTER SCORE: Team_005 32, Team_049 20

BOX SCORE:
================================================================================

Team_005
--------------------------------------------------------------------------------
Player                MIN  PTS  REB  AST  TO      FG   FG%      3P   3P%
--------------------------------------------------------------------------------
Derrick Allen          12    8    5    0   0   3/4    75.0     0/0   0.0
Cade Markkanen         12    8    5    1   0   3/4    75.0     0/0   0.0
Jalen Rozier           12    7    5    1   0   3/7    42.9     0/0   0.0
Brandon George         12    7    0    2   0   3/5    60.0     0/0   0.0
Anthony Rozier         12    2    0    1   0   1/2    50.0     0/0   0.0

TEAM: FG: 13/22 (59.1%), 3PT: 2/7 (28.6%), REB: 15 (1 off, 14 def), AST: 5, TO: 1
TEAM FOULS: 3


Team_049
--------------------------------------------------------------------------------
Player                MIN  PTS  REB  AST  TO      FG   FG%      3P   3P%
--------------------------------------------------------------------------------
De'Aaron Allen         12    6    4    1   0   2/4    50.0     0/0   0.0
Jimmy Griffin          12    5    2    2   0   2/8    25.0     0/0   0.0
Ja Oladipo             12    5    0    0   0   2/2   100.0     0/0   0.0
Shai Bird              12    4    0    2   0   2/5    40.0     0/0   0.0
Shai Mobley            12    0    4    0   0   0/3     0.0     0/0   0.0

TEAM: FG: 8/22 (36.4%), 3PT: 3/10 (30.0%), REB: 10 (1 off, 9 def), AST: 5, TO: 1
TEAM FOULS: 5 [Team_005 in BONUS]

================================================================================

================================================================================
                       2ND QUARTER - Team_005 vs Team_049                       
================================================================================

[12:00] Team_005 possession (Score: 32-20)
Anthony Rozier attempts a 3Pt. Contested by Ja Oladipo (4.6 feet, MAN). ANTHONY ROZIER MAKES IT! Assist: Derrick Allen
Score: 35-20

[11:45] Team_049 possession (Score: 35-20)
De'Aaron Allen drives and kicks out. Shai Bird attempts a 3Pt. Contested by Brandon George (5.6 feet, MAN). SHAI BIRD MAKES IT! Assist: Ja Oladipo
Score: 35-23

[11:33] Team_005 possession (Score: 35-23)
Jalen Rozier attempts a Layup. Contested by Shai Mobley (4.9 feet, ZONE). Jalen Rozier misses. Rebound secured by Jimmy Griffin.

[11:20] Team_049 possession (Score: 35-23)
Ja Oladipo loses control! Ball rolls out of bounds! TURNOVER! (dead ball)

[11:20] Substitution (Team_005): Brandon George OUT → Blake O'Neal IN (stamina_rule2)

[11:20] Substitution (Team_005): Anthony Rozier OUT → Draymond Smith IN (stamina_rule2)

[11:20] Substitution (Team_005): Derrick Allen OUT → Lauri Wade IN (stamina_rule2)

[11:20] Substitution (Team_005): Jalen Rozier OUT → Isaiah Durant IN (stamina_rule2)

[11:20] Substitution (Team_005): Cade Markkanen OUT → Zion Parker IN (stamina_rule2)

[11:20] Substitution (Team_049): Shai Bird OUT → Shaquille Lillard IN (stamina_rule2)

[11:20] Substitution (Team_049): Ja Oladipo OUT → Shai Jordan IN (stamina_rule2)

[11:20] Substitution (Team_049): Jimmy Griffin OUT → Desmond Towns IN (stamina_rule2)

[11:20] Substitution (Team_049): De'Aaron Allen OUT → Giannis Anunoby IN (stamina_rule2)

[11:20] Substitution (Team_049): Shai Mobley OUT → Miles Jackson IN (stamina_rule2)

[11:02] Team_005 possession (Score: 35-23)
Isaiah Durant drives and kicks out. Isaiah Durant attempts a 3Pt. Contested by Shaquille Lillard (4.5 feet, ZONE). ISAIAH DURANT MAKES IT! Assist: Lauri Wade
Score: 38-23

[10:45] Team_049 possession (Score: 38-23)
Shai Jordan attempts a 3Pt. Contested by Draymond Smith (4.3 feet, MAN). Shai Jordan misses. Rebound secured by Draymond Smith.

[10:30] Team_005 possession (Score: 38-23)
Blake O'Neal attempts a 3Pt. Contested by Shaquille Lillard (4.9 feet, MAN). Blake O'Neal misses. FOUL! Loose ball foul on Shai Jordan during the rebound battle. [Team fouls: 1] No free throws, side out. (Shai Jordan: 1 personal fouls)

[10:17] Team_005 possession (Score: 38-23)
Zion Parker attempts a 3Pt. Contested by Miles Jackson (3.5 feet, MAN). Zion Parker misses. Rebound secured by Miles Jackson.

[10:03] Team_049 possession (Score: 38-23)
Shaquille Lillard drives, Blake O'Neal stays with him. Shaquille Lillard attempts a Layup. Contested by Blake O'Neal (4.3 feet, MAN). SHAQUILLE LILLARD MAKES IT! Assist: Miles Jackson
Score: 38-25

[09:50] Team_005 possession (Score: 38-25)
Isaiah Durant makes the Dunk and draws the foul on Giannis Anunoby! And-1! Isaiah Durant to the line for 1. [Team fouls: 2] (Giannis Anunoby: 1 personal fouls)   FT 1/1: GOOD Isaiah Durant makes 1/1 from the line.
Score: 41-25

[09:36] Team_049 possession (Score: 41-25)
Desmond Towns drives, picks up Zion Parker. Help arrives from Blake O'Neal! Desmond Towns attempts a Layup. Contested by Blake O'Neal (4.1 feet, ZONE). DESMOND TOWNS MAKES IT!
Score: 41-27

[09:20] Team_005 possession (Score: 41-27)
Blake O'Neal attempts a Layup. Contested by Shaquille Lillard (4.9 feet, MAN). BLAKE O'NEAL MAKES IT!
Score: 43-27

[09:04] Team_049 possession (Score: 43-27)
Desmond Towns drives and kicks out. Shaquille Lillard attempts a Midrange. Contested by Blake O'Neal (4.1 feet, MAN). SHAQUILLE LILLARD MAKES IT!
Score: 43-29

[08:48] Team_005 possession (Score: 43-29)
Blake O'Neal attempts a Layup. Contested by Shaquille Lillard (4.9 feet, MAN). Blake O'Neal misses. Offensive rebound by Zion Parker! Zion Parker's putback is no good. Rebound secured by Miles Jackson.

[08:35] Team_049 possession (Score: 43-29)
Desmond Towns attempts a 3Pt. Contested by Blake O'Neal (4.2 feet, ZONE). Desmond Towns misses. Rebound secured by Lauri Wade.

[08:20] Team_005 possession (Score: 43-29)
Isaiah Durant makes the Dunk and draws the foul on Miles Jackson! And-1! Isaiah Durant to the line for 1. [Team fouls: 3] (Miles Jackson: 1 personal fouls)   FT 1/1: MISS Isaiah Durant makes 0/1 from the line. Rebound secured by Shai Jordan.
Score: 45-29

[08:07] Team_049 possession (Score: 45-29)
Shai Jordan attempts a 3Pt. Contested by Blake O'Neal (4.1 feet, ZONE). Shai Jordan misses. Rebound secured by Zion Parker.

[07:56] Team_005 possession (Score: 45-29)
Blake O'Neal attempts a 3Pt. Contested by Shaquille Lillard (4.9 feet, ZONE). Blake O'Neal misses. Rebound secured by Shai Jordan.

[07:39] Team_049 possession (Score: 45-29)
Shai Jordan attempts a 3Pt. Contested by Draymond Smith (4.3 feet, MAN). Shai Jordan misses. Rebound secured by Zion Parker.

[07:24] Team_005 possession (Score: 45-29)
Zion Parker attempts a Layup. Contested by Miles Jackson (3.5 feet, MAN). Zion Parker misses. Rebound secured by Shai Jordan.

[07:07] Team_049 possession (Score: 45-29)
Desmond Towns attempts a 3Pt. Contested by Lauri Wade (5.2 feet, MAN). Desmond Towns misses. Rebound secured by Draymond Smith.

[06:56] Team_005 possession (Score: 45-29)
Isaiah Durant drives and kicks out. Zion Parker attempts a Midrange. Contested by Desmond Towns (4.5 feet, ZONE). Zion Parker misses. Rebound secured by Giannis Anunoby.

[06:39] Team_049 possession (Score: 45-29)
Shai Jordan attempts a Midrange. Contested by Draymond Smith (4.3 feet, MAN). Shai Jordan misses. Offensive rebound by Giannis Anunoby! Giannis Anunoby kicks it out.

[06:26] Team_049 possession (Score: 45-29)
Shaquille Lillard attempts a Layup. Contested by Zion Parker (4.2 feet, ZONE). SHAQUILLE LILLARD MAKES IT! Assist: Giannis Anunoby
Score: 45-31

[06:16] Team_005 possession (Score: 45-31)
FOUL! Holding foul on Shai Jordan. [Team fouls: 4] No free throws, side out. (Shai Jordan: 2 personal fouls)

[06:01] Team_005 possession (Score: 45-31)
Lauri Wade attempts a Layup. BLOCKED BY MILES JACKSON! Ball deflects out of bounds off Lauri Wade.

[05:47] Team_049 possession (Score: 45-31)
Giannis Anunoby drives, Isaiah Durant stays with him. Giannis Anunoby attempts a Dunk. Contested by Isaiah Durant (4.4 feet, MAN). GIANNIS ANUNOBY MAKES IT!
Score: 45-33

[05:32] Team_005 possession (Score: 45-33)
Draymond Smith attempts a Midrange. Contested by Shai Jordan (5.9 feet, MAN). Draymond Smith misses. Rebound secured by Miles Jackson.

[05:18] Team_049 possession (Score: 45-33)
Miles Jackson loses control! Ball rolls out of bounds! TURNOVER! (dead ball)

[04:59] Team_005 possession (Score: 45-33)
Zion Parker attempts a Midrange. Contested by Desmond Towns (4.5 feet, ZONE). Zion Parker misses. Rebound secured by Miles Jackson.

[04:43] Team_049 possession (Score: 45-33)
Miles Jackson drives and kicks out. Shai Jordan attempts a 3Pt. Contested by Draymond Smith (4.3 feet, ZONE). SHAI JORDAN MAKES IT! Assist: Shaquille Lillard
Score: 45-36

[04:30] Team_005 possession (Score: 45-36)
Lauri Wade attempts a 3Pt. Contested by Desmond Towns (4.5 feet, MAN). Lauri Wade misses. Rebound secured by Miles Jackson.

[04:15] Team_049 possession (Score: 45-36)
Desmond Towns attempts a Layup. Contested by Zion Parker (4.2 feet, ZONE). Desmond Towns misses. Rebound secured by Lauri Wade.

[04:01] Team_005 possession (Score: 45-36)
Zion Parker attempts a Layup. Contested by Miles Jackson (3.5 feet, MAN). ZION PARKER MAKES IT! Assist: Lauri Wade
Score: 47-36

[03:43] Team_049 possession (Score: 47-36)
Shai Jordan attempts a 3Pt. Contested by Draymond Smith (4.4 feet, MAN). Shai Jordan misses. Offensive rebound by Giannis Anunoby! Giannis Anunoby kicks it out.

[03:30] Team_049 possession (Score: 47-36)
Giannis Anunoby drives to the basket... Giannis Anunoby loses the ball! Stripped by Isaiah Durant! TURNOVER! (live ball)

[03:16] Team_005 possession (Score: 47-36)
Draymond Smith attempts a 3Pt. Contested by Shai Jordan (5.9 feet, ZONE). Draymond Smith misses. Offensive rebound by Draymond Smith! Draymond Smith kicks it out.

[03:02] Team_005 possession (Score: 47-36)
Isaiah Durant attempts a Layup. BLOCKED BY MILES JACKSON! Ball is loose! Offensive rebound by Draymond Smith! Draymond Smith kicks it out.

[02:49] Team_005 possession (Score: 47-36)
Lauri Wade attempts a 3Pt. Contested by Shaquille Lillard (4.7 feet, ZONE). LAURI WADE MAKES IT! Assist: Blake O'Neal
Score: 50-36

[02:38] Team_049 possession (Score: 50-36)
Desmond Towns attempts a Midrange. Contested by Draymond Smith (4.6 feet, ZONE). Desmond Towns misses. Rebound secured by Zion Parker.

[02:24] Team_005 possession (Score: 50-36)
Draymond Smith attempts a 3Pt. Wide open! Shai Jordan is 6.0 feet away. [MAN] DRAYMOND SMITH MAKES IT! Assist: Blake O'Neal
Score: 53-36

[02:10] Team_049 possession (Score: 53-36)
Giannis Anunoby throws a bad pass! Stolen by Isaiah Durant! TURNOVER! (live ball)

[01:53] Team_005 possession (Score: 53-36)
Lauri Wade attempts a Midrange. Contested by Desmond Towns (4.7 feet, ZONE). Lauri Wade misses. Rebound secured by Miles Jackson.

[01:37] Team_049 possession (Score: 53-36)
Shaquille Lillard drives and kicks out. Miles Jackson attempts a 3Pt. Contested by Blake O'Neal (4.4 feet, ZONE). MILES JACKSON MAKES IT! Assist: Shaquille Lillard
Score: 53-39

[01:21] Team_005 possession (Score: 53-39)
Blake O'Neal drives and kicks out. Isaiah Durant attempts a 3Pt. Contested by Shaquille Lillard (4.8 feet, ZONE). Isaiah Durant misses. Offensive rebound by Draymond Smith! Draymond Smith kicks it out.

[01:10] Team_005 possession (Score: 53-39)
Blake O'Neal attempts a Midrange. Contested by Desmond Towns (5.1 feet, ZONE). Blake O'Neal misses. Rebound secured by Shai Jordan.

[00:52] Team_049 possession (Score: 53-39)
Giannis Anunoby attempts a 3Pt. Contested by Draymond Smith (4.6 feet, ZONE). Giannis Anunoby misses. Rebound secured by Zion Parker.

[00:37] Team_005 possession (Score: 53-39)
Blake O'Neal drives, Shaquille Lillard stays with him. Blake O'Neal attempts a Layup. Contested by Shaquille Lillard (5.2 feet, MAN). BLAKE O'NEAL MAKES IT! Assist: Lauri Wade
Score: 55-39

[00:26] Team_049 possession (Score: 55-39)
Desmond Towns attempts a Midrange. Contested by Lauri Wade (5.5 feet, MAN). Desmond Towns misses. Rebound secured by Zion Parker.

[00:06] Team_005 possession (Score: 55-39)
FOUL! Reach-in foul on Shaquille Lillard during the drive. [IN THE BONUS! 5 team fouls] Blake O'Neal to the line for 2 free throws. (Shaquille Lillard: 1 personal fouls)   FT 1/2: GOOD   FT 2/2: GOOD Blake O'Neal makes 2/2 from the line.
Score: 57-39

================================================================================
                              2ND QUARTER COMPLETE                              
================================================================================

2ND QUARTER SCORE: Team_005 25, Team_049 19

BOX SCORE:
================================================================================

Team_005
--------------------------------------------------------------------------------
Player                MIN  PTS  REB  AST  TO      FG   FG%      3P   3P%
--------------------------------------------------------------------------------
Isaiah Durant          11    6    0    0   0   2/4    50.0     0/0   0.0
Blake O'Neal           11    6    0    2   0   3/6    50.0     0/0   0.0
Anthony Rozier         13    3    0    0   0   1/1   100.0     0/0   0.0
Lauri Wade             11    3    2    3   0   1/4    25.0     0/0   0.0
Draymond Smith         11    3    5    0   0   1/2    50.0     0/0   0.0
Zion Parker            11    2    6    0   0   1/4    25.0     0/0   0.0
Derrick Allen          13    0    0    1   0   0/0     0.0     0/0   0.0
Jalen Rozier           13    0    0    0   0   0/1     0.0     0/0   0.0

TEAM: FG: 9/22 (40.9%), 3PT: 3/6 (50.0%), REB: 14 (5 off, 9 def), AST: 6, TO: 0
TEAM FOULS: 0


Team_049
--------------------------------------------------------------------------------
Player                MIN  PTS  REB  AST  TO      FG   FG%      3P   3P%
--------------------------------------------------------------------------------
Shaquille Lillard      11    6    0    2   0   3/3   100.0     0/0   0.0
Shai Bird              13    3    0    0   0   1/1   100.0     0/0   0.0
Shai Jordan            11    3    4    0   0   1/4    25.0     0/0   0.0
Miles Jackson          11    3    6    1   0   1/1   100.0     0/0   0.0
Desmond Towns          11    2    0    0   0   1/6    16.7     0/0   0.0
Giannis Anunoby        11    2    3    1   0   1/2    50.0     0/0   0.0
Ja Oladipo             13    0    0    1   0   0/0     0.0     0/0   0.0
Jimmy Griffin          13    0    1    0   0   0/0     0.0     0/0   0.0

TEAM: FG: 8/17 (47.1%), 3PT: 0/6 (0.0%), REB: 13 (2 off, 11 def), AST: 5, TO: 4
TEAM FOULS: 5 [Team_005 in BONUS]

================================================================================

================================================================================
                       3RD QUARTER - Team_005 vs Team_049                       
================================================================================

[12:00] Team_005 possession (Score: 57-39)
Anthony Rozier throws a bad pass! Stolen by Ja Oladipo! TURNOVER! (live ball)

[11:44] Team_049 possession (Score: 57-39)
Jimmy Griffin attempts a 3Pt. Contested by Derrick Allen (4.3 feet, ZONE). Jimmy Griffin misses. Offensive rebound by Shai Mobley! Shai Mobley puts it back in!
Score: 57-41

[11:26] Team_005 possession (Score: 57-41)
Cade Markkanen attempts a Midrange. Contested by De'Aaron Allen (4.1 feet, ZONE). Cade Markkanen misses. Rebound secured by Jimmy Griffin.

[11:10] Team_049 possession (Score: 57-41)
Ja Oladipo attempts a 3Pt. Contested by Jalen Rozier (5.1 feet, ZONE). Ja Oladipo misses. Offensive rebound by Shai Mobley! Shai Mobley puts it back in!
Score: 57-43

[10:57] Team_005 possession (Score: 57-43)
Cade Markkanen makes the Dunk and draws the foul on Shai Mobley! And-1! Cade Markkanen to the line for 1. [Team fouls: 1] (Shai Mobley: 1 personal fouls)   FT 1/1: GOOD Cade Markkanen makes 1/1 from the line.
Score: 60-43

[10:46] Team_049 possession (Score: 60-43)
Shai Bird attempts a Midrange. Contested by Derrick Allen (4.7 feet, ZONE). SHAI BIRD MAKES IT!
Score: 60-45

[10:36] Team_005 possession (Score: 60-45)
Brandon George drives, De'Aaron Allen stays with him. Brandon George attempts a Layup. Contested by De'Aaron Allen (4.5 feet, ZONE). BRANDON GEORGE MAKES IT! Assist: Jalen Rozier
Score: 62-45

[10:24] Team_049 possession (Score: 62-45)
Shai Mobley attempts a Midrange. Contested by Anthony Rozier (4.9 feet, ZONE). Shai Mobley misses. Rebound secured by Cade Markkanen.

[10:07] Team_005 possession (Score: 62-45)
Anthony Rozier attempts a Layup. Contested by Ja Oladipo (4.3 feet, MAN). Anthony Rozier misses. Rebound secured by Shai Mobley.

[09:52] Team_049 possession (Score: 62-45)
Shai Bird commits a violation (traveling/carry)! TURNOVER! (dead ball)

[09:43] Team_005 possession (Score: 62-45)
Cade Markkanen attempts a 3Pt. Contested by Ja Oladipo (4.1 feet, ZONE). Cade Markkanen misses. Rebound secured by Shai Mobley.

[09:29] Team_049 possession (Score: 62-45)
Ja Oladipo attempts a 3Pt. Contested by Anthony Rozier (4.8 feet, MAN). Ja Oladipo misses. Rebound secured by Derrick Allen.

[09:11] Team_005 possession (Score: 62-45)
Derrick Allen drives to the basket... FOUL! Offensive foul on Derrick Allen! Jimmy Griffin drew the charge! [Team fouls: 1] (Derrick Allen: 1 personal fouls) TURNOVER! (dead ball)

[08:53] Team_049 possession (Score: 62-45)
De'Aaron Allen drives and kicks out. FOUL! Shooting foul on Brandon George. Shai Bird to the line for 2 free throws. [Team fouls: 2] (Brandon George: 1 personal fouls)   FT 1/2: MISS   FT 2/2: GOOD Shai Bird makes 1/2 from the line.
Score: 62-46

[08:39] Team_005 possession (Score: 62-46)
Derrick Allen drives, Jimmy Griffin stays with him. Derrick Allen attempts a Dunk. Contested by Jimmy Griffin (5.1 feet, MAN). Derrick Allen misses. Rebound secured by Jimmy Griffin.

[08:29] Team_049 possession (Score: 62-46)
FOUL! Reach-in foul on Cade Markkanen during the drive. [Team fouls: 3] No free throws, side out. (Cade Markkanen: 1 personal fouls)

[08:12] Team_049 possession (Score: 62-46)
Ja Oladipo attempts a Midrange. Contested by Anthony Rozier (4.8 feet, MAN). Ja Oladipo misses. Rebound secured by Cade Markkanen.

[07:54] Team_005 possession (Score: 62-46)
Derrick Allen attempts a 3Pt. Contested by Shai Bird (4.3 feet, ZONE). Derrick Allen misses. Offensive rebound by Jalen Rozier! Jalen Rozier kicks it out.

[07:37] Team_005 possession (Score: 62-46)
Jalen Rozier attempts a Midrange. Contested by De'Aaron Allen (4.6 feet, ZONE). Jalen Rozier misses. Rebound secured by De'Aaron Allen.

[07:22] Team_049 possession (Score: 62-46)
Jimmy Griffin attempts a 3Pt. Contested by Derrick Allen (4.3 feet, ZONE). Jimmy Griffin misses. Rebound secured by Jalen Rozier.

[07:04] Team_005 possession (Score: 62-46)
Brandon George attempts a Layup. Contested by Shai Bird (4.1 feet, MAN). BRANDON GEORGE MAKES IT!
Score: 64-46

[06:49] Team_049 possession (Score: 64-46)
Shai Mobley drives and kicks out. Ja Oladipo attempts a 3Pt. Contested by Anthony Rozier (4.6 feet, MAN). Ja Oladipo misses. Offensive rebound by Jimmy Griffin! Jimmy Griffin kicks it out.

[06:33] Team_049 possession (Score: 64-46)
FOUL! Holding foul on Cade Markkanen. [Team fouls: 4] No free throws, side out. (Cade Markkanen: 2 personal fouls)

[06:14] Team_049 possession (Score: 64-46)
FOUL! Shooting foul on Anthony Rozier. Ja Oladipo to the line for 2 free throws. [BONUS: 5 team fouls] (Anthony Rozier: 1 personal fouls)   FT 1/2: GOOD   FT 2/2: MISS Ja Oladipo makes 1/2 from the line. FOUL! Loose ball foul on Derrick Allen during the free throw rebound! [IN THE BONUS! 6 team fouls] Jimmy Griffin to the line for 2 free throws. (Derrick Allen: 2 personal fouls)   FT 1/2: GOOD   FT 2/2: GOOD Jimmy Griffin makes 2/2 from the line.
Score: 64-49

[06:02] Team_005 possession (Score: 64-49)
FOUL! Holding foul on De'Aaron Allen. [Team fouls: 2] No free throws, side out. (De'Aaron Allen: 1 personal fouls)

[05:48] Team_005 possession (Score: 64-49)
Brandon George attempts a 3Pt. Contested by Ja Oladipo (4.4 feet, ZONE). BRANDON GEORGE MAKES IT! Assist: Derrick Allen
Score: 67-49

[05:34] Team_049 possession (Score: 67-49)
Shai Bird attempts a 3Pt. Contested by Derrick Allen (4.7 feet, ZONE). Shai Bird misses. Rebound secured by Jalen Rozier.

[05:18] Team_005 possession (Score: 67-49)
Jalen Rozier attempts a Midrange. Contested by De'Aaron Allen (4.6 feet, MAN). JALEN ROZIER MAKES IT! Assist: Brandon George
Score: 69-49

[05:05] Team_049 possession (Score: 69-49)
Shai Bird attempts a Layup. Contested by Brandon George (5.6 feet, MAN). SHAI BIRD MAKES IT! Assist: De'Aaron Allen
Score: 69-51

[04:51] Team_005 possession (Score: 69-51)
Jalen Rozier drives and kicks out. FOUL! Shooting foul on Shai Bird. Brandon George to the line for 2 free throws. [Team fouls: 3] (Shai Bird: 1 personal fouls)   FT 1/2: GOOD   FT 2/2: GOOD Brandon George makes 2/2 from the line.
Score: 71-51

[04:37] Team_049 possession (Score: 71-51)
Shai Mobley drives to the basket... Shai Mobley loses the ball! Stripped by Cade Markkanen! TURNOVER! (live ball)

[04:24] Team_005 possession (Score: 71-51)
Cade Markkanen drives to the basket... Cade Markkanen loses the ball! Stripped by De'Aaron Allen! TURNOVER! (live ball)

[04:11] Team_049 possession (Score: 71-51)
FOUL! Offensive foul on Shai Mobley! Cade Markkanen drew the charge! [Team fouls: 4] (Shai Mobley: 2 personal fouls) TURNOVER! (dead ball)

[03:54] Team_005 possession (Score: 71-51)
FOUL! Holding foul on Shai Bird. [IN THE BONUS! 5 team fouls] Brandon George to the line for 2 free throws. (Shai Bird: 2 personal fouls)   FT 1/2: MISS   FT 2/2: GOOD Brandon George makes 1/2 from the line.
Score: 72-51

[03:38] Team_049 possession (Score: 72-51)
Jimmy Griffin drives to the basket... Jimmy Griffin throws a bad pass! Stolen by Cade Markkanen! TURNOVER! (live ball)

[03:21] Team_005 possession (Score: 72-51)
Jalen Rozier attempts a 3Pt. Contested by Ja Oladipo (4.7 feet, ZONE). Jalen Rozier misses. Rebound secured by De'Aaron Allen.

[03:11] Team_049 possession (Score: 72-51)
FOUL! Reach-in foul on Cade Markkanen during the drive. [IN THE BONUS! 7 team fouls] Jimmy Griffin to the line for 2 free throws. (Cade Markkanen: 3 personal fouls)   FT 1/2: GOOD   FT 2/2: GOOD Jimmy Griffin makes 2/2 from the line.
Score: 72-53

[03:00] Team_005 possession (Score: 72-53)
Cade Markkanen attempts a Dunk. BLOCKED BY JA OLADIPO! Ball is loose! Rebound secured by De'Aaron Allen.

[02:47] Team_049 possession (Score: 72-53)
FOUL! Holding foul on Brandon George. [IN THE BONUS! 8 team fouls] Shai Bird to the line for 2 free throws. (Brandon George: 2 personal fouls)   FT 1/2: GOOD   FT 2/2: GOOD Shai Bird makes 2/2 from the line.
Score: 72-55

[02:33] Team_005 possession (Score: 72-55)
Anthony Rozier drives, Ja Oladipo stays with him. Anthony Rozier attempts a Layup. Contested by Ja Oladipo (4.5 feet, MAN). ANTHONY ROZIER MAKES IT! Assist: Derrick Allen
Score: 74-55

[02:20] Team_049 possession (Score: 74-55)
FOUL! Shooting foul on Derrick Allen. Jimmy Griffin to the line for 2 free throws. [BONUS: 9 team fouls] (Derrick Allen: 3 personal fouls)   FT 1/2: GOOD   FT 2/2: GOOD Jimmy Griffin makes 2/2 from the line.
Score: 74-57

[02:07] Team_005 possession (Score: 74-57)
Brandon George attempts a Midrange. Contested by De'Aaron Allen (4.7 feet, ZONE). Brandon George misses. Rebound secured by Shai Mobley.

[01:53] Team_049 possession (Score: 74-57)
Shai Bird drives, Jalen Rozier stays with him. Shai Bird attempts a Dunk. Contested by Jalen Rozier (5.6 feet, ZONE). SHAI BIRD MAKES IT! Assist: De'Aaron Allen
Score: 74-59

[01:34] Team_005 possession (Score: 74-59)
Derrick Allen attempts a 3Pt. Contested by Jimmy Griffin (5.4 feet, MAN). DERRICK ALLEN MAKES IT!
Score: 77-59

[01:19] Team_049 possession (Score: 77-59)
Shai Bird attempts a 3Pt. Contested by Derrick Allen (5.0 feet, ZONE). SHAI BIRD MAKES IT! Assist: Ja Oladipo
Score: 77-62

[01:01] Team_005 possession (Score: 77-62)
Jalen Rozier drives and kicks out. Derrick Allen attempts a 3Pt. Contested by Jimmy Griffin (5.1 feet, MAN). Derrick Allen misses. Rebound secured by Jimmy Griffin.

[00:44] Team_049 possession (Score: 77-62)
De'Aaron Allen attempts a Midrange. Contested by Jalen Rozier (5.2 feet, MAN). De'Aaron Allen misses. Rebound secured by Jalen Rozier.

[00:33] Team_005 possession (Score: 77-62)
Cade Markkanen attempts a Midrange. Contested by Shai Mobley (4.5 feet, MAN). Cade Markkanen misses. Rebound secured by Jimmy Griffin.

[00:18] Team_049 possession (Score: 77-62)
FOUL! Shooting foul on Jalen Rozier. De'Aaron Allen to the line for 2 free throws. [BONUS: 10 team fouls] (Jalen Rozier: 1 personal fouls)   FT 1/2: GOOD   FT 2/2: GOOD De'Aaron Allen makes 2/2 from the line.
Score: 77-64

[00:02] Team_005 possession (Score: 77-64)
Jalen Rozier attempts a 3Pt. Contested by Ja Oladipo (5.0 feet, ZONE). Jalen Rozier misses. Rebound secured by Jimmy Griffin.

================================================================================
                              3RD QUARTER COMPLETE                              
================================================================================

3RD QUARTER SCORE: Team_005 20, Team_049 25

BOX SCORE:
================================================================================

Team_005
--------------------------------------------------------------------------------
Player                MIN  PTS  REB  AST  TO      FG   FG%      3P   3P%
--------------------------------------------------------------------------------
Brandon George         25   10    0    1   0   5/6    83.3     0/0   0.0
Cade Markkanen         25    3    2    0   0   1/5    20.0     0/0   0.0
Derrick Allen          25    3    1    2   0   1/2    50.0     0/0   0.0
Jalen Rozier           25    2    4    1   0   1/5    20.0     0/0   0.0
Anthony Rozier         25    2    0    0   0   1/2    50.0     0/0   0.0

TEAM: FG: 9/20 (45.0%), 3PT: 2/5 (40.0%), REB: 7 (1 off, 6 def), AST: 4, TO: 3
TEAM FOULS: 10 [Team_049 in BONUS]


Team_049
--------------------------------------------------------------------------------
Player                MIN  PTS  REB  AST  TO      FG   FG%      3P   3P%
--------------------------------------------------------------------------------
Shai Bird              25   12    0    0   0   6/7    85.7     0/0   0.0
Jimmy Griffin          25    7    6    0   0   3/4    75.0     0/0   0.0
Shai Mobley            25    4    5    0   0   2/3    66.7     0/0   0.0
De'Aaron Allen         25    2    3    2   0   1/2    50.0     0/0   0.0
Ja Oladipo             25    0    0    1   0   0/2     0.0     0/0   0.0

TEAM: FG: 12/18 (66.7%), 3PT: 3/6 (50.0%), REB: 14 (3 off, 11 def), AST: 3, TO: 4
TEAM FOULS: 5 [Team_005 in BONUS]

================================================================================

================================================================================
                       4TH QUARTER - Team_005 vs Team_049                       
================================================================================

[12:00] Team_005 possession (Score: 77-64)
Jalen Rozier attempts a 3Pt. Contested by Ja Oladipo (4.8 feet, ZONE). Jalen Rozier misses. Offensive rebound by Cade Markkanen! Cade Markkanen kicks it out.

[11:51] Team_005 possession (Score: 77-64)
Jalen Rozier drives, De'Aaron Allen stays with him. Jalen Rozier attempts a Layup. Contested by De'Aaron Allen (4.8 feet, ZONE). JALEN ROZIER MAKES IT! Assist: Derrick Allen
Score: 79-64

[11:34] Team_049 possession (Score: 79-64)
FOUL! Shooting foul on Jalen Rozier. Jimmy Griffin to the line for 2 free throws. [Team fouls: 1] (Jalen Rozier: 1 personal fouls)   FT 1/2: MISS   FT 2/2: GOOD Jimmy Griffin makes 1/2 from the line.
Score: 79-65

[11:15] Team_005 possession (Score: 79-65)
Anthony Rozier attempts a Midrange. Contested by Ja Oladipo (4.6 feet, ZONE). ANTHONY ROZIER MAKES IT! Assist: Derrick Allen
Score: 81-65

[10:58] Team_049 possession (Score: 81-65)
Shai Bird attempts a 3Pt. Contested by Derrick Allen (5.0 feet, ZONE). SHAI BIRD MAKES IT! Assist: De'Aaron Allen
Score: 81-68

[10:44] Team_005 possession (Score: 81-68)
Jalen Rozier attempts a 3Pt. Contested by De'Aaron Allen (4.9 feet, MAN). Jalen Rozier misses. Rebound secured by De'Aaron Allen.

[10:33] Team_049 possession (Score: 81-68)
Shai Mobley attempts a Layup. Contested by Cade Markkanen (4.2 feet, ZONE). Shai Mobley misses. Rebound secured by Derrick Allen.

[10:15] Team_005 possession (Score: 81-68)
Anthony Rozier attempts a 3Pt. Contested by Ja Oladipo (4.7 feet, ZONE). Anthony Rozier misses. Offensive rebound by Derrick Allen! Derrick Allen kicks it out.

[09:58] Team_005 possession (Score: 81-68)
Anthony Rozier attempts a Midrange. Contested by Shai Mobley (4.8 feet, ZONE). Anthony Rozier misses. Offensive rebound by Cade Markkanen! Cade Markkanen kicks it out.

[09:44] Team_005 possession (Score: 81-68)
Derrick Allen attempts a Midrange. Contested by Jimmy Griffin (5.6 feet, MAN). DERRICK ALLEN MAKES IT!
Score: 83-68

[09:28] Team_049 possession (Score: 83-68)
Ja Oladipo attempts a 3Pt. Contested by Derrick Allen (4.9 feet, ZONE). Ja Oladipo misses. Rebound secured by Jalen Rozier.

[09:12] Team_005 possession (Score: 83-68)
Anthony Rozier makes the Dunk and draws the foul on De'Aaron Allen! And-1! Anthony Rozier to the line for 1. [Team fouls: 1] (De'Aaron Allen: 1 personal fouls)   FT 1/1: GOOD Anthony Rozier makes 1/1 from the line.
Score: 86-68

[08:59] Team_049 possession (Score: 86-68)
Shai Bird attempts a 3Pt. Contested by Derrick Allen (5.2 feet, ZONE). Shai Bird misses. Rebound secured by Cade Markkanen.

[08:48] Team_005 possession (Score: 86-68)
Cade Markkanen drives and kicks out. Cade Markkanen attempts a 3Pt. Contested by Shai Bird (4.8 feet, ZONE). Cade Markkanen misses. Rebound secured by Shai Mobley.

[08:33] Team_049 possession (Score: 86-68)
Jimmy Griffin drives and kicks out. Shai Bird attempts a Midrange. Contested by Brandon George (6.0 feet, ZONE). Shai Bird misses. FOUL! Loose ball foul on Jalen Rozier during the rebound battle. [Team fouls: 2] No free throws, side out. (Jalen Rozier: 2 personal fouls)

[08:18] Team_049 possession (Score: 86-68)
Ja Oladipo attempts a 3Pt. Contested by Anthony Rozier (5.6 feet, MAN). Ja Oladipo misses. FOUL! Loose ball foul on Cade Markkanen during the rebound battle. [Team fouls: 3] No free throws, side out. (Cade Markkanen: 1 personal fouls)

[08:00] Team_049 possession (Score: 86-68)
Shai Mobley drives, Cade Markkanen stays with him. Shai Mobley attempts a Dunk. Contested by Cade Markkanen (4.6 feet, MAN). SHAI MOBLEY MAKES IT!
Score: 86-70

[07:46] Team_005 possession (Score: 86-70)
Anthony Rozier attempts a 3Pt. Contested by Ja Oladipo (5.0 feet, MAN). Anthony Rozier misses. Offensive rebound by Derrick Allen! Derrick Allen kicks it out.

[07:29] Team_005 possession (Score: 86-70)
FOUL! Holding foul on Shai Mobley. [Team fouls: 2] No free throws, side out. (Shai Mobley: 1 personal fouls)

[07:14] Team_005 possession (Score: 86-70)
Anthony Rozier drives to the basket... Anthony Rozier throws a bad pass out of bounds! TURNOVER! (dead ball)

[07:14] Substitution (Team_005): Brandon George OUT → Blake O'Neal IN (stamina_rule2)

[07:14] Substitution (Team_005): Anthony Rozier OUT → Draymond Smith IN (stamina_rule2)

[07:14] Substitution (Team_005): Derrick Allen OUT → Lauri Wade IN (stamina_rule2)

[07:14] Substitution (Team_005): Jalen Rozier OUT → Isaiah Durant IN (stamina_rule2)

[07:14] Substitution (Team_005): Cade Markkanen OUT → Zion Parker IN (stamina_rule2)

[07:14] Substitution (Team_049): Shai Bird OUT → Shaquille Lillard IN (stamina_rule2)

[07:14] Substitution (Team_049): Ja Oladipo OUT → Shai Jordan IN (stamina_rule2)

[07:14] Substitution (Team_049): Jimmy Griffin OUT → Desmond Towns IN (stamina_rule2)

[07:14] Substitution (Team_049): De'Aaron Allen OUT → Giannis Anunoby IN (stamina_rule2)

[07:14] Substitution (Team_049): Shai Mobley OUT → Miles Jackson IN (stamina_rule2)

[07:01] Team_049 possession (Score: 86-70)
Miles Jackson commits a violation (traveling/carry)! TURNOVER! (dead ball)

[06:45] Team_005 possession (Score: 86-70)
Lauri Wade attempts a Midrange. Contested by Desmond Towns (4.5 feet, ZONE). Lauri Wade misses. Rebound secured by Miles Jackson.

[06:30] Team_049 possession (Score: 86-70)
Desmond Towns attempts a 3Pt. Contested by Blake O'Neal (4.2 feet, ZONE). Desmond Towns misses. Rebound secured by Draymond Smith.

[06:15] Team_005 possession (Score: 86-70)
Lauri Wade attempts a Midrange. Contested by Desmond Towns (4.5 feet, MAN). LAURI WADE MAKES IT! Assist: Draymond Smith
Score: 88-70

[06:03] Team_049 possession (Score: 88-70)
Shaquille Lillard attempts a 3Pt. Contested by Blake O'Neal (4.3 feet, ZONE). Shaquille Lillard misses. Rebound secured by Draymond Smith.

[05:51] Team_005 possession (Score: 88-70)
Isaiah Durant drives to the basket... Isaiah Durant loses the ball! Stripped by Giannis Anunoby! TURNOVER! (live ball)

[05:37] Team_049 possession (Score: 88-70)
Miles Jackson attempts a 3Pt. Contested by Zion Parker (4.1 feet, MAN). MILES JACKSON MAKES IT! Assist: Shai Jordan
Score: 88-73

[05:26] Team_005 possession (Score: 88-73)
FOUL! Reach-in foul on Miles Jackson during the drive. [Team fouls: 3] No free throws, side out. (Miles Jackson: 1 personal fouls)

[05:15] Team_005 possession (Score: 88-73)
Draymond Smith attempts a Midrange. Contested by Shai Jordan (5.9 feet, ZONE). DRAYMOND SMITH MAKES IT! Assist: Isaiah Durant
Score: 90-73

[04:58] Team_049 possession (Score: 90-73)
Miles Jackson drives, Zion Parker stays with him. Miles Jackson attempts a Dunk. Contested by Zion Parker (4.1 feet, ZONE). MILES JACKSON MAKES IT!
Score: 90-75

[04:40] Team_005 possession (Score: 90-75)
FOUL! Reach-in foul on Miles Jackson during the drive. [Team fouls: 4] No free throws, side out. (Miles Jackson: 2 personal fouls)

[04:30] Team_005 possession (Score: 90-75)
Zion Parker drives and kicks out. Lauri Wade attempts a 3Pt. Contested by Desmond Towns (4.5 feet, MAN). Lauri Wade misses. Rebound secured by Shai Jordan.

[04:16] Team_049 possession (Score: 90-75)
Giannis Anunoby attempts a 3Pt. Contested by Blake O'Neal (4.1 feet, ZONE). Giannis Anunoby misses. Rebound secured by Lauri Wade.

[04:01] Team_005 possession (Score: 90-75)
FOUL! Holding foul on Giannis Anunoby. [IN THE BONUS! 5 team fouls] Isaiah Durant to the line for 2 free throws. (Giannis Anunoby: 1 personal fouls)   FT 1/2: GOOD   FT 2/2: MISS Isaiah Durant makes 1/2 from the line. Rebound secured by Miles Jackson.
Score: 91-75

[03:51] Team_049 possession (Score: 91-75)
Miles Jackson attempts a Layup. Contested by Zion Parker (4.1 feet, ZONE). MILES JACKSON MAKES IT!
Score: 91-77

[03:32] Team_005 possession (Score: 91-77)
Lauri Wade makes the Layup and draws the foul on Shai Jordan! And-1! Lauri Wade to the line for 1. [BONUS: 6 team fouls] (Shai Jordan: 1 personal fouls)   FT 1/1: GOOD Lauri Wade makes 1/1 from the line.
Score: 94-77

[03:15] Team_049 possession (Score: 94-77)
Shaquille Lillard attempts a 3Pt. Contested by Blake O'Neal (4.3 feet, ZONE). Shaquille Lillard misses. Offensive rebound by Miles Jackson! Miles Jackson's putback is no good. Rebound secured by Lauri Wade.

[03:02] Team_005 possession (Score: 94-77)
Draymond Smith drives, Miles Jackson stays with him. Draymond Smith attempts a Dunk. Contested by Miles Jackson (3.2 feet, ZONE). DRAYMOND SMITH MAKES IT! Assist: Blake O'Neal
Score: 96-77

[02:50] Team_049 possession (Score: 96-77)
FOUL! Reach-in foul on Zion Parker during the drive. [Team fouls: 4] No free throws, side out. (Zion Parker: 1 personal fouls)

[02:35] Team_049 possession (Score: 96-77)
Shai Jordan attempts a 3Pt. Contested by Draymond Smith (4.3 feet, MAN). Shai Jordan misses. Rebound secured by Zion Parker.

[02:22] Team_005 possession (Score: 96-77)
FOUL! Shooting foul on Miles Jackson. Zion Parker to the line for 2 free throws. [BONUS: 7 team fouls] (Miles Jackson: 3 personal fouls)   FT 1/2: GOOD   FT 2/2: GOOD Zion Parker makes 2/2 from the line.
Score: 98-77

[02:09] Team_049 possession (Score: 98-77)
Shaquille Lillard attempts a 3Pt. Contested by Blake O'Neal (4.3 feet, MAN). SHAQUILLE LILLARD MAKES IT! Assist: Giannis Anunoby
Score: 98-80

[01:50] Team_005 possession (Score: 98-80)
Draymond Smith makes the Layup and draws the foul on Shai Jordan! And-1! Draymond Smith to the line for 1. [BONUS: 8 team fouls] (Shai Jordan: 2 personal fouls)   FT 1/1: MISS Draymond Smith makes 0/1 from the line. Rebound secured by Giannis Anunoby.
Score: 100-80

[01:34] Team_049 possession (Score: 100-80)
Shai Jordan attempts a Layup. BLOCKED BY DRAYMOND SMITH! Ball is loose! Offensive rebound by Miles Jackson! Miles Jackson kicks it out.

[01:17] Team_049 possession (Score: 100-80)
Shai Jordan drives to the basket... Shai Jordan loses the ball! Stripped by Zion Parker! TURNOVER! (live ball)

[01:02] Team_005 possession (Score: 100-80)
Blake O'Neal attempts a 3Pt. Contested by Shaquille Lillard (4.9 feet, MAN). Blake O'Neal misses. Rebound secured by Giannis Anunoby.

[00:49] Team_049 possession (Score: 100-80)
Desmond Towns attempts a 3Pt. Contested by Lauri Wade (5.2 feet, MAN). DESMOND TOWNS MAKES IT! Assist: Shaquille Lillard
Score: 100-83

[00:39] Team_005 possession (Score: 100-83)
Draymond Smith attempts a 3Pt. Contested by Shai Jordan (5.9 feet, MAN). DRAYMOND SMITH MAKES IT!
Score: 103-83

[00:25] Team_049 possession (Score: 103-83)
Miles Jackson drives, Zion Parker stays with him. Miles Jackson attempts a Dunk. Contested by Zion Parker (4.1 feet, ZONE). Miles Jackson misses. Rebound secured by Lauri Wade.

[00:05] Team_005 possession (Score: 103-83)
Zion Parker attempts a Layup. BLOCKED BY MILES JACKSON! Ball deflects out of bounds off Zion Parker.

================================================================================
                              4TH QUARTER COMPLETE                              
================================================================================

4TH QUARTER SCORE: Team_005 26, Team_049 19

BOX SCORE:
================================================================================

Team_005
--------------------------------------------------------------------------------
Player                MIN  PTS  REB  AST  TO      FG   FG%      3P   3P%
--------------------------------------------------------------------------------
Draymond Smith         18    7    2    1   0   3/4    75.0     0/0   0.0
Anthony Rozier         30    5    0    0   0   2/2   100.0     0/0   0.0
Lauri Wade             18    5    3    0   0   2/3    66.7     0/0   0.0
Jalen Rozier           30    2    1    0   0   1/2    50.0     0/0   0.0
Derrick Allen          30    2    3    2   0   1/1   100.0     0/0   0.0
Zion Parker            18    2    1    0   0   1/3    33.3     0/0   0.0
Cade Markkanen         30    0    3    0   0   0/1     0.0     0/0   0.0
Isaiah Durant          18    0    0    1   0   0/0     0.0     0/0   0.0
Blake O'Neal           18    0    0    1   0   0/1     0.0     0/0   0.0

TEAM: FG: 10/18 (55.6%), 3PT: 1/3 (33.3%), REB: 12 (4 off, 8 def), AST: 5, TO: 2
TEAM FOULS: 4


Team_049
--------------------------------------------------------------------------------
Player                MIN  PTS  REB  AST  TO      FG   FG%      3P   3P%
--------------------------------------------------------------------------------
Miles Jackson          18    7    3    0   0   3/4    75.0     0/0   0.0
Shai Bird              30    3    0    0   0   1/2    50.0     0/0   0.0
Desmond Towns          18    3    0    0   0   1/2    50.0     0/0   0.0
Shaquille Lillard      18    3    0    1   0   1/3    33.3     0/0   0.0
Shai Mobley            30    2    1    0   0   1/2    50.0     0/0   0.0
Jimmy Griffin          30    1    0    0   0   1/1   100.0     0/0   0.0
De'Aaron Allen         30    0    3    1   0   0/0     0.0     0/0   0.0
Ja Oladipo             30    0    0    0   0   0/1     0.0     0/0   0.0
Shai Jordan            18    0    1    1   0   0/1     0.0     0/0   0.0
Giannis Anunoby        18    0    2    1   0   0/1     0.0     0/0   0.0

TEAM: FG: 8/17 (47.1%), 3PT: 4/11 (36.4%), REB: 11 (4 off, 7 def), AST: 4, TO: 2
TEAM FOULS: 8 [Team_005 in BONUS]

================================================================================

================================================================================
                               FULL GAME COMPLETE                               
================================================================================

FINAL SCORE: Team_005 103, Team_049 83

SCORING BY QUARTER:
--------------------------------------------------------------------------------
Team                     Q1     Q2     Q3     Q4    FINAL
--------------------------------------------------------------------------------
Team_005                 32     25     20     26      103
Team_049                 20     19     25     19       83
--------------------------------------------------------------------------------

FULL GAME BOX SCORE:
================================================================================

Team_005
--------------------------------------------------------------------------------
Player                MIN  PTS  REB  AST  TO      FG   FG%      3P   3P%      FT STL BLK
--------------------------------------------------------------------------------
Brandon George         30   17    0    3   0   6/9    66.7   2/3    66.7   3/4     0   0
Anthony Rozier         30   12    0    1   2   5/7    71.4   1/2    50.0   1/1     0   1
Derrick Allen          30   13    9    5   2   6/8    75.0   2/3    66.7   1/1     0   0
Jalen Rozier           30   11   10    2   0   5/15   33.3   0/5     0.0   3/3     0   0
Cade Markkanen         30   11   10    1   1   3/9    33.3   0/1     0.0   2/2     3   1
Blake O'Neal           18    6    0    3   0   3/7    42.9   0/2     0.0   2/2     0   0
Draymond Smith         18   10    7    1   1   4/6    66.7   2/2   100.0   0/1     0   1
Lauri Wade             18    8    5    3   0   3/7    42.9   1/2    50.0   1/1     0   0
Isaiah Durant          18    6    0    1   0   2/4    50.0   0/0     0.0   2/4     2   0
Zion Parker            18    4    7    0   0   2/7    28.6   0/1     0.0   2/2     1   0

TEAM: FG: 41/82 (50.0%), 3PT: 8/21 (38.1%), REB: 48 (11 off, 37 def), AST: 20, TO: 6


Team_049
--------------------------------------------------------------------------------
Player                MIN  PTS  REB  AST  TO      FG   FG%      3P   3P%      FT STL BLK
--------------------------------------------------------------------------------
Shai Bird              30   22    0    2   1   7/12   58.3   2/6    33.3   3/4     0   0
Ja Oladipo             30    5    0    2   3   4/7    57.1   2/4    50.0   1/2     1   1
Jimmy Griffin          30   13    9    2   1   6/13   46.2   1/6    16.7   6/7     0   0
De'Aaron Allen         30    8   10    4   0   5/8    62.5   2/3    66.7   2/2     1   0
Shai Mobley            30    6   10    0   1   1/6    16.7   0/0     0.0   0/0     1   1
Shaquille Lillard      18    9    0    3   0   4/6    66.7   1/3    33.3   0/0     0   0
Shai Jordan            18    3    5    1   1   0/4     0.0   0/4     0.0   0/0     0   0
Desmond Towns          18    5    0    0   0   3/9    33.3   1/4    25.0   0/0     0   0
Giannis Anunoby        18    2    5    2   2   1/3    33.3   0/2     0.0   0/0     1   0
Miles Jackson          18   10    9    1   2   4/5    80.0   1/1   100.0   0/0     0   3

TEAM: FG: 36/74 (48.6%), 3PT: 10/33 (30.3%), REB: 48 (10 off, 38 def), AST: 17, TO: 11

================================================================================
