================================================================================
                        FULL GAME - Team_021 vs Team_086                        
================================================================================

================================================================================
                       1ST QUARTER - Team_021 vs Team_086                       
================================================================================

[12:00] Team_021 possession (Score: 0-0)
FOUL! Holding foul on Miles Gobert. [Team fouls: 1] No free throws, side out. (Miles Gobert: 1 personal fouls)

[11:45] Team_021 possession (Score: 0-0)
Karl Bridges attempts a 3Pt. Contested by Miles Gobert (3.4 feet, MAN). Karl Bridges misses. Offensive rebound by Zach Carter! Zach Carter kicks it out.

[11:31] Team_021 possession (Score: 0-0)
FOUL! Shooting foul on Bones Ginobili. Kyrie Wagner to the line for 2 free throws. [Team fouls: 2] (Bones Ginobili: 1 personal fouls)   FT 1/2: GOOD   FT 2/2: GOOD Kyrie Wagner makes 2/2 from the line.
Score: 2-0

[11:15] Team_086 possession (Score: 2-0)
Bones Ginobili attempts a Midrange. Contested by Karl Bridges (6.0 feet, ZONE). Bones Ginobili misses. Rebound secured by Kyrie Leonard.

[11:05] Team_021 possession (Score: 2-0)
Anthony Oladipo attempts a 3Pt. Contested by Anfernee Harris (4.2 feet, ZONE). Anthony Oladipo misses. Rebound secured by Bones Ginobili.

[10:46] Team_086 possession (Score: 2-0)
Rudy Rose attempts a Midrange. Contested by Karl Bridges (5.8 feet, ZONE). Rudy Rose misses. Rebound secured by Zach Carter.

[10:36] Team_021 possession (Score: 2-0)
Zach Carter makes the Layup and draws the foul on Rudy Rose! And-1! Zach Carter to the line for 1. [Team fouls: 3] (Rudy Rose: 1 personal fouls)   FT 1/1: GOOD Zach Carter makes 1/1 from the line.
Score: 5-0

[10:22] Team_086 possession (Score: 5-0)
Miles Gobert drives, Karl Bridges stays with him. Miles Gobert attempts a Layup. Contested by Karl Bridges (5.8 feet, MAN). MILES GOBERT MAKES IT! Assist: Anfernee Harris
Score: 5-2

[10:08] Team_021 possession (Score: 5-2)
Zach Carter drives and kicks out. Anthony Oladipo attempts a Midrange. Contested by Anfernee Harris (4.2 feet, MAN). ANTHONY OLADIPO MAKES IT! Assist: Kyrie Wagner
Score: 7-2

[09:58] Team_086 possession (Score: 7-2)
Anfernee Harris attempts a 3Pt. Contested by Kyrie Wagner (4.6 feet, ZONE). Anfernee Harris misses. Offensive rebound by Miles Gobert! Miles Gobert kicks it out.

[09:44] Team_086 possession (Score: 7-2)
FOUL! Holding foul on Anthony Oladipo. [Team fouls: 1] No free throws, side out. (Anthony Oladipo: 1 personal fouls)

[09:26] Team_086 possession (Score: 7-2)
Bones Ginobili attempts a Layup. Contested by Zach Carter (4.4 feet, ZONE). Bones Ginobili misses. Rebound secured by Zach Carter.

[09:13] Team_021 possession (Score: 7-2)
Kyrie Wagner attempts a Midrange. Contested by Bones Ginobili (4.8 feet, MAN). Kyrie Wagner misses. Rebound secured by Rudy Rose.

[09:02] Team_086 possession (Score: 7-2)
Miles Gobert attempts a Layup. Contested by Kyrie Wagner (4.2 feet, ZONE). Miles Gobert misses. Rebound secured by Anthony Oladipo.

[08:47] Team_021 possession (Score: 7-2)
Karl Bridges attempts a 3Pt. Contested by Miles Gobert (3.4 feet, MAN). KARL BRIDGES MAKES IT! Assist: Anthony Oladipo
Score: 10-2

[08:35] Team_086 possession (Score: 10-2)
Anfernee Harris drives and kicks out. Rudy Rose attempts a Midrange. Contested by Zach Carter (4.0 feet, MAN). Rudy Rose misses. Rebound secured by Anthony Oladipo.

[08:24] Team_021 possession (Score: 10-2)
Karl Bridges attempts a 3Pt. Contested by Miles Gobert (3.4 feet, MAN). Karl Bridges misses. Rebound secured by Rudy Rose.

[08:10] Team_086 possession (Score: 10-2)
Anfernee Harris attempts a 3Pt. Contested by Anthony Oladipo (5.2 feet, MAN). Anfernee Harris misses. Offensive rebound by Rudy Rose! Rudy Rose puts it back in!
Score: 10-4

[07:52] Team_021 possession (Score: 10-4)
Anthony Oladipo attempts a 3Pt. Contested by Lauri Johnson (4.3 feet, ZONE). Anthony Oladipo misses. Offensive rebound by Zach Carter! Zach Carter kicks it out.

[07:40] Team_021 possession (Score: 10-4)
Kyrie Leonard attempts a Midrange. Contested by Lauri Johnson (4.2 feet, MAN). KYRIE LEONARD MAKES IT!
Score: 12-4

[07:23] Team_086 possession (Score: 12-4)
Lauri Johnson attempts a Layup. Contested by Kyrie Leonard (4.8 feet, MAN). LAURI JOHNSON MAKES IT! Assist: Rudy Rose
Score: 12-6

[07:07] Team_021 possession (Score: 12-6)
Kyrie Wagner drives and kicks out. Zach Carter attempts a Midrange. Contested by Rudy Rose (3.7 feet, MAN). ZACH CARTER MAKES IT! Assist: Anthony Oladipo
Score: 14-6

[06:55] Team_086 possession (Score: 14-6)
FOUL! Shooting foul on Kyrie Leonard. Lauri Johnson to the line for 2 free throws. [Team fouls: 2] (Kyrie Leonard: 1 personal fouls)   FT 1/2: GOOD   FT 2/2: GOOD Lauri Johnson makes 2/2 from the line.
Score: 14-8

[06:43] Team_021 possession (Score: 14-8)
Anthony Oladipo attempts a Midrange. Contested by Anfernee Harris (4.2 feet, MAN). Anthony Oladipo misses. Offensive rebound by Kyrie Leonard! Kyrie Leonard kicks it out.

[06:26] Team_021 possession (Score: 14-8)
Karl Bridges drives to the basket... Karl Bridges loses control! Ball rolls out of bounds! TURNOVER! (dead ball)

[06:11] Team_086 possession (Score: 14-8)
Anfernee Harris attempts a 3Pt. Contested by Anthony Oladipo (5.2 feet, MAN). Anfernee Harris misses. Rebound secured by Zach Carter.

[06:00] Team_021 possession (Score: 14-8)
Anthony Oladipo attempts a 3Pt. Contested by Lauri Johnson (4.3 feet, ZONE). Anthony Oladipo misses. Offensive rebound by Zach Carter! Zach Carter kicks it out.

[05:47] Team_021 possession (Score: 14-8)
Kyrie Leonard attempts a Midrange. Contested by Lauri Johnson (4.2 feet, MAN). Kyrie Leonard misses. Offensive rebound by Zach Carter! Zach Carter kicks it out.

[05:33] Team_021 possession (Score: 14-8)
Anthony Oladipo attempts a 3Pt. Contested by Lauri Johnson (4.3 feet, ZONE). Anthony Oladipo misses. Rebound secured by Rudy Rose.

[05:16] Team_086 possession (Score: 14-8)
FOUL! Reach-in foul on Kyrie Wagner during the drive. [Team fouls: 3] No free throws, side out. (Kyrie Wagner: 1 personal fouls)

[04:59] Team_086 possession (Score: 14-8)
Lauri Johnson attempts a Layup. Contested by Kyrie Leonard (4.8 feet, MAN). LAURI JOHNSON MAKES IT! Assist: Bones Ginobili
Score: 14-10

[04:43] Team_021 possession (Score: 14-10)
Kyrie Leonard attempts a Midrange. Contested by Lauri Johnson (4.3 feet, MAN). Kyrie Leonard misses. Rebound secured by Bones Ginobili.

[04:24] Team_086 possession (Score: 14-10)
Lauri Johnson drives and kicks out. Rudy Rose attempts a Midrange. Contested by Kyrie Wagner (4.1 feet, ZONE). Rudy Rose misses. FOUL! Loose ball foul on Zach Carter during the rebound battle. [Team fouls: 4] No free throws, side out. (Zach Carter: 1 personal fouls)

[04:06] Team_086 possession (Score: 14-10)
Anfernee Harris attempts a 3Pt. Contested by Anthony Oladipo (5.2 feet, MAN). Anfernee Harris misses. Rebound secured by Anthony Oladipo.

[03:51] Team_021 possession (Score: 14-10)
Kyrie Leonard attempts a 3Pt. Contested by Lauri Johnson (4.3 feet, MAN). KYRIE LEONARD MAKES IT! Assist: Zach Carter
Score: 17-10

[03:35] Team_086 possession (Score: 17-10)
Lauri Johnson attempts a 3Pt. Contested by Kyrie Leonard (4.9 feet, MAN). Lauri Johnson misses. Rebound secured by Kyrie Leonard.

[03:23] Team_021 possession (Score: 17-10)
Anthony Oladipo attempts a 3Pt. Contested by Anfernee Harris (4.4 feet, MAN). ANTHONY OLADIPO MAKES IT! Assist: Karl Bridges
Score: 20-10

[03:10] Team_086 possession (Score: 20-10)
Rudy Rose attempts a Midrange. Contested by Kyrie Wagner (4.4 feet, ZONE). RUDY ROSE MAKES IT!
Score: 20-12

[02:51] Team_021 possession (Score: 20-12)
Kyrie Leonard attempts a Midrange. Contested by Lauri Johnson (4.4 feet, MAN). Kyrie Leonard misses. Offensive rebound by Kyrie Leonard! Kyrie Leonard kicks it out.

[02:40] Team_021 possession (Score: 20-12)
Kyrie Wagner attempts a Midrange. Contested by Bones Ginobili (5.0 feet, MAN). KYRIE WAGNER MAKES IT! Assist: Kyrie Leonard
Score: 22-12

[02:28] Team_086 possession (Score: 22-12)
Anfernee Harris attempts a 3Pt. Contested by Anthony Oladipo (5.4 feet, MAN). Anfernee Harris misses. Rebound secured by Zach Carter.

[02:11] Team_021 possession (Score: 22-12)
Karl Bridges attempts a Layup. Contested by Miles Gobert (3.6 feet, MAN). Karl Bridges misses. Rebound secured by Rudy Rose.

[02:01] Team_086 possession (Score: 22-12)
Bones Ginobili attempts a Midrange. Contested by Kyrie Wagner (4.7 feet, ZONE). Bones Ginobili misses. Rebound secured by Kyrie Leonard.

[01:43] Team_021 possession (Score: 22-12)
Karl Bridges throws a bad pass! Stolen by Miles Gobert! TURNOVER! (live ball)

[01:32] Team_086 possession (Score: 22-12)
Anfernee Harris drives, Anthony Oladipo stays with him. Anfernee Harris attempts a Layup. Contested by Anthony Oladipo (5.4 feet, MAN). ANFERNEE HARRIS MAKES IT! Assist: Lauri Johnson
Score: 22-14

[01:14] Team_021 possession (Score: 22-14)
Kyrie Wagner throws a bad pass! Stolen by Bones Ginobili! TURNOVER! (live ball)

[01:01] Team_086 possession (Score: 22-14)
FOUL! Holding foul on Anthony Oladipo. [IN THE BONUS! 5 team fouls] Anfernee Harris to the line for 2 free throws. (Anthony Oladipo: 2 personal fouls)   FT 1/2: GOOD   FT 2/2: GOOD Anfernee Harris makes 2/2 from the line.
Score: 22-16

[00:47] Team_021 possession (Score: 22-16)
Kyrie Leonard attempts a Layup. Contested by Lauri Johnson (4.6 feet, MAN). KYRIE LEONARD MAKES IT! Assist: Anthony Oladipo
Score: 24-16

[00:34] Team_086 possession (Score: 24-16)
Rudy Rose makes the Layup and draws the foul on Zach Carter! And-1! Rudy Rose to the line for 1. [BONUS: 6 team fouls] (Zach Carter: 2 personal fouls)   FT 1/1: GOOD Rudy Rose makes 1/1 from the line.
Score: 24-19

[00:21] Team_021 possession (Score: 24-19)
Karl Bridges attempts a 3Pt. Contested by Miles Gobert (3.8 feet, MAN). Karl Bridges misses. Rebound secured by Miles Gobert.

[00:06] Team_086 possession (Score: 24-19)
Miles Gobert attempts a 3Pt. Contested by Kyrie Leonard (5.3 feet, ZONE). Miles Gobert misses. Rebound secured by Zach Carter.

================================================================================
                              1ST QUARTER COMPLETE                              
================================================================================

1ST QUARTER SCORE: Team_021 24, Team_086 19

BOX SCORE:
================================================================================

Team_021
--------------------------------------------------------------------------------
Player                MIN  PTS  REB  AST  TO      FG   FG%      3P   3P%
--------------------------------------------------------------------------------
Kyrie Leonard          12    7    5    1   0   3/4    75.0     0/0   0.0
Zach Carter            12    5    9    1   0   2/2   100.0     0/0   0.0
Anthony Oladipo        12    5    3    3   0   2/4    50.0     0/0   0.0
Kyrie Wagner           12    4    0    1   0   2/3    66.7     0/0   0.0
Karl Bridges           12    3    0    1   0   1/4    25.0     0/0   0.0

TEAM: FG: 10/17 (58.8%), 3PT: 3/7 (42.9%), REB: 17 (6 off, 11 def), AST: 7, TO: 3
TEAM FOULS: 6 [Team_086 in BONUS]


Team_086
--------------------------------------------------------------------------------
Player                MIN  PTS  REB  AST  TO      FG   FG%      3P   3P%
--------------------------------------------------------------------------------
Rudy Rose              12    7    6    1   0   3/4    75.0     0/0   0.0
Lauri Johnson          12    6    0    1   0   3/4    75.0     0/0   0.0
Anfernee Harris        12    4    0    1   0   2/6    33.3     0/0   0.0
Miles Gobert           12    2    2    0   0   1/3    33.3     0/0   0.0
Bones Ginobili         12    0    2    1   0   0/3     0.0     0/0   0.0

TEAM: FG: 9/20 (45.0%), 3PT: 1/6 (16.7%), REB: 10 (3 off, 7 def), AST: 4, TO: 0
TEAM FOULS: 3

================================================================================

================================================================================
                       2ND QUARTER - Team_021 vs Team_086                       
================================================================================

[12:00] Team_021 possession (Score: 24-19)
Zach Carter attempts a Layup. Contested by Rudy Rose (4.4 feet, MAN). ZACH CARTER MAKES IT! Assist: Karl Bridges
Score: 26-19

[11:48] Team_086 possession (Score: 26-19)
FOUL! Reach-in foul on Zach Carter during the drive. [Team fouls: 1] No free throws, side out. (Zach Carter: 1 personal fouls)

[11:32] Team_086 possession (Score: 26-19)
Miles Gobert attempts a Midrange. Wide open! Karl Bridges is 6.1 feet away. [MAN] MILES GOBERT MAKES IT!
Score: 26-21

[11:22] Team_021 possession (Score: 26-21)
Zach Carter drives, Rudy Rose stays with him. Zach Carter attempts a Layup. Contested by Rudy Rose (4.4 feet, MAN). ZACH CARTER MAKES IT! Assist: Kyrie Wagner
Score: 28-21

[11:06] Team_086 possession (Score: 28-21)
Lauri Johnson makes the Dunk and draws the foul on Kyrie Leonard! And-1! Lauri Johnson to the line for 1. [Team fouls: 2] (Kyrie Leonard: 1 personal fouls)   FT 1/1: GOOD Lauri Johnson makes 1/1 from the line.
Score: 28-24

[10:51] Team_021 possession (Score: 28-24)
Kyrie Wagner attempts a 3Pt. Contested by Bones Ginobili (5.2 feet, MAN). KYRIE WAGNER MAKES IT! Assist: Anthony Oladipo
Score: 31-24

[10:38] Team_086 possession (Score: 31-24)
Lauri Johnson attempts a Layup. Contested by Kyrie Leonard (5.2 feet, MAN). LAURI JOHNSON MAKES IT! Assist: Rudy Rose
Score: 31-26

[10:28] Team_021 possession (Score: 31-26)
Anthony Oladipo attempts a 3Pt. Contested by Anfernee Harris (4.7 feet, MAN). ANTHONY OLADIPO MAKES IT! Assist: Kyrie Wagner
Score: 34-26

[10:11] Team_086 possession (Score: 34-26)
Bones Ginobili attempts a Midrange. Contested by Kyrie Wagner (4.9 feet, MAN). Bones Ginobili misses. Rebound secured by Kyrie Leonard.

[10:00] Team_021 possession (Score: 34-26)
Karl Bridges attempts a Midrange. Contested by Miles Gobert (3.9 feet, MAN). Karl Bridges misses. Rebound secured by Miles Gobert.

[09:46] Team_086 possession (Score: 34-26)
Miles Gobert attempts a 3Pt. Contested by Kyrie Wagner (4.8 feet, ZONE). Miles Gobert misses. Rebound secured by Kyrie Leonard.

[09:36] Team_021 possession (Score: 34-26)
Kyrie Wagner makes the Layup and draws the foul on Bones Ginobili! And-1! Kyrie Wagner to the line for 1. [Team fouls: 1] (Bones Ginobili: 1 personal fouls)   FT 1/1: MISS Kyrie Wagner makes 0/1 from the line. Rebound secured by Miles Gobert.
Score: 36-26

[09:21] Team_086 possession (Score: 36-26)
Anfernee Harris drives, picks up Anthony Oladipo. Help arrives from Kyrie Leonard! Anfernee Harris attempts a Dunk. Contested by Kyrie Leonard (5.7 feet, MAN). ANFERNEE HARRIS MAKES IT!
Score: 36-28

[09:10] Team_021 possession (Score: 36-28)
Zach Carter attempts a Midrange. Contested by Rudy Rose (4.7 feet, MAN). ZACH CARTER MAKES IT! Assist: Kyrie Wagner
Score: 38-28

[08:53] Team_086 possession (Score: 38-28)
Rudy Rose attempts a 3Pt. Contested by Zach Carter (4.9 feet, MAN). Rudy Rose misses. Offensive rebound by Miles Gobert! Miles Gobert kicks it out.

[08:37] Team_086 possession (Score: 38-28)
Anfernee Harris drives, Zach Carter stays with him. Anfernee Harris attempts a Layup. Contested by Zach Carter (5.2 feet, ZONE). Anfernee Harris misses. Rebound secured by Kyrie Leonard.

[08:25] Team_021 possession (Score: 38-28)
Anthony Oladipo attempts a 3Pt. Contested by Anfernee Harris (5.0 feet, MAN). Anthony Oladipo misses. Rebound secured by Bones Ginobili.

[08:07] Team_086 possession (Score: 38-28)
Rudy Rose drives to the basket... FOUL! Offensive foul on Rudy Rose! Kyrie Wagner drew the charge! [Team fouls: 2] (Rudy Rose: 1 personal fouls) TURNOVER! (dead ball)

[07:56] Team_021 possession (Score: 38-28)
Zach Carter attempts a Midrange. Contested by Lauri Johnson (5.5 feet, ZONE). Zach Carter misses. Offensive rebound by Zach Carter! Zach Carter kicks it out.

[07:41] Team_021 possession (Score: 38-28)
FOUL! Offensive foul on Karl Bridges! Miles Gobert drew the charge! [Team fouls: 3] (Karl Bridges: 1 personal fouls) TURNOVER! (dead ball)

[07:27] Team_086 possession (Score: 38-28)
Lauri Johnson commits a violation (traveling/carry)! TURNOVER! (dead ball)

[07:27] Substitution (Team_021): Kyrie Leonard OUT → Joel LaVine IN (stamina_rule2)

[07:27] Substitution (Team_021): Anthony Oladipo OUT → Victor Mitchell IN (stamina_rule2)

[07:27] Substitution (Team_021): Karl Bridges OUT → Paul Allen IN (stamina_rule2)

[07:27] Substitution (Team_021): Kyrie Wagner OUT → Vince George IN (stamina_rule2)

[07:27] Substitution (Team_021): Zach Carter OUT → Magic Ingram IN (stamina_rule2)

[07:27] Substitution (Team_086): Lauri Johnson OUT → Anfernee Green IN (stamina_rule2)

[07:27] Substitution (Team_086): Anfernee Harris OUT → Anthony James IN (stamina_rule2)

[07:27] Substitution (Team_086): Miles Gobert OUT → Franz McGrady IN (stamina_rule2)

[07:27] Substitution (Team_086): Bones Ginobili OUT → Kyle McCollum IN (stamina_rule2)

[07:27] Substitution (Team_086): Rudy Rose OUT → Lamelo Towns IN (stamina_rule2)

[07:16] Team_021 possession (Score: 38-28)
Paul Allen attempts a 3Pt. Contested by Anfernee Green (4.3 feet, ZONE). Paul Allen misses. FOUL! Loose ball foul on Anfernee Green during the rebound battle. [Team fouls: 3] No free throws, side out. (Anfernee Green: 1 personal fouls)

[07:02] Team_021 possession (Score: 38-28)
Paul Allen attempts a Layup. Contested by Lamelo Towns (5.5 feet, ZONE). Paul Allen misses. Rebound secured by Lamelo Towns.

[06:52] Team_086 possession (Score: 38-28)
Kyle McCollum attempts a Midrange. Contested by Victor Mitchell (4.2 feet, ZONE). Kyle McCollum misses. Rebound secured by Magic Ingram.

[06:42] Team_021 possession (Score: 38-28)
Magic Ingram attempts a 3Pt. Contested by Anfernee Green (4.2 feet, ZONE). Magic Ingram misses. Rebound secured by Kyle McCollum.

[06:25] Team_086 possession (Score: 38-28)
Lamelo Towns drives, picks up Magic Ingram. Help arrives from Victor Mitchell! Lamelo Towns attempts a Dunk. Contested by Victor Mitchell (4.8 feet, MAN). Lamelo Towns misses. Offensive rebound by Anfernee Green! Anfernee Green kicks it out.

[06:09] Team_086 possession (Score: 38-28)
Anfernee Green attempts a Midrange. Wide open! Joel LaVine is 6.1 feet away. [MAN] Anfernee Green misses. Rebound secured by Magic Ingram.

[05:53] Team_021 possession (Score: 38-28)
Paul Allen drives, Franz McGrady stays with him. Paul Allen attempts a Dunk. Contested by Franz McGrady (5.1 feet, MAN). PAUL ALLEN MAKES IT!
Score: 40-28

[05:38] Team_086 possession (Score: 40-28)
Anfernee Green attempts a Midrange. Contested by Vince George (5.2 feet, ZONE). Anfernee Green misses. Rebound secured by Magic Ingram.

[05:20] Team_021 possession (Score: 40-28)
FOUL! Offensive foul on Magic Ingram! Lamelo Towns drew the charge! [Team fouls: 4] (Magic Ingram: 1 personal fouls) TURNOVER! (dead ball)

[05:05] Team_086 possession (Score: 40-28)
Lamelo Towns commits a violation (traveling/carry)! TURNOVER! (dead ball)

[04:51] Team_021 possession (Score: 40-28)
Paul Allen throws a bad pass out of bounds! TURNOVER! (dead ball)

[04:36] Team_086 possession (Score: 40-28)
Anfernee Green makes the Layup and draws the foul on Victor Mitchell! And-1! Anfernee Green to the line for 1. [BONUS: 5 team fouls] (Victor Mitchell: 1 personal fouls)   FT 1/1: MISS Anfernee Green makes 0/1 from the line. Rebound secured by Vince George.
Score: 40-30

[04:23] Team_021 possession (Score: 40-30)
Magic Ingram drives to the basket... FOUL! Offensive foul on Magic Ingram! Lamelo Towns drew the charge! [Team fouls: 6] (Magic Ingram: 2 personal fouls) TURNOVER! (dead ball)

[04:13] Team_086 possession (Score: 40-30)
Kyle McCollum makes the Midrange and draws the foul on Vince George! And-1! Kyle McCollum to the line for 1. [BONUS: 7 team fouls] (Vince George: 1 personal fouls)   FT 1/1: GOOD Kyle McCollum makes 1/1 from the line.
Score: 40-33

[04:00] Team_021 possession (Score: 40-33)
Paul Allen attempts a 3Pt. Contested by Franz McGrady (5.1 feet, ZONE). Paul Allen misses. Rebound secured by Anfernee Green.

[03:48] Team_086 possession (Score: 40-33)
Kyle McCollum attempts a 3Pt. Contested by Victor Mitchell (4.2 feet, ZONE). Kyle McCollum misses. Rebound secured by Victor Mitchell.

[03:32] Team_021 possession (Score: 40-33)
Paul Allen attempts a 3Pt. Contested by Franz McGrady (5.1 feet, MAN). Paul Allen misses. Rebound secured by Lamelo Towns.

[03:18] Team_086 possession (Score: 40-33)
Kyle McCollum drives and kicks out. Lamelo Towns attempts a 3Pt. Contested by Victor Mitchell (4.2 feet, ZONE). Lamelo Towns misses. Rebound secured by Victor Mitchell.

[03:05] Team_021 possession (Score: 40-33)
Magic Ingram attempts a Midrange. Contested by Lamelo Towns (5.5 feet, MAN). Magic Ingram misses. Rebound secured by Lamelo Towns.

[02:50] Team_086 possession (Score: 40-33)
FOUL! Shooting foul on Magic Ingram. Lamelo Towns to the line for 2 free throws. [BONUS: 8 team fouls] (Magic Ingram: 3 personal fouls)   FT 1/2: GOOD   FT 2/2: GOOD Lamelo Towns makes 2/2 from the line.
Score: 40-35

[02:33] Team_021 possession (Score: 40-35)
Victor Mitchell attempts a Midrange. Contested by Anthony James (4.0 feet, MAN). VICTOR MITCHELL MAKES IT! Assist: Paul Allen
Score: 42-35

[02:14] Team_086 possession (Score: 42-35)
Franz McGrady attempts a Midrange. Contested by Paul Allen (6.0 feet, MAN). FRANZ MCGRADY MAKES IT!
Score: 42-37

[02:04] Team_021 possession (Score: 42-37)
Vince George attempts a Midrange. Contested by Franz McGrady (4.8 feet, ZONE). Vince George misses. Offensive rebound by Vince George! Vince George kicks it out.

[01:51] Team_021 possession (Score: 42-37)
Joel LaVine attempts a Midrange. Contested by Anthony James (3.9 feet, ZONE). Joel LaVine misses. Rebound secured by Anfernee Green.

[01:34] Team_086 possession (Score: 42-37)
Kyle McCollum attempts a Midrange. Contested by Vince George (5.0 feet, MAN). Kyle McCollum misses. Rebound secured by Magic Ingram.

[01:16] Team_021 possession (Score: 42-37)
Paul Allen attempts a 3Pt. Contested by Franz McGrady (5.1 feet, MAN). Paul Allen misses. Rebound secured by Lamelo Towns.

[00:59] Team_086 possession (Score: 42-37)
Kyle McCollum drives, Vince George stays with him. Kyle McCollum attempts a Dunk. Contested by Vince George (5.0 feet, MAN). KYLE MCCOLLUM MAKES IT!
Score: 42-39

[00:40] Team_021 possession (Score: 42-39)
Joel LaVine attempts a 3Pt. Contested by Anfernee Green (3.9 feet, MAN). JOEL LAVINE MAKES IT! Assist: Paul Allen
Score: 45-39

[00:29] Team_086 possession (Score: 45-39)
FOUL! Reach-in foul on Magic Ingram during the drive. [IN THE BONUS! 9 team fouls] Kyle McCollum to the line for 2 free throws. (Magic Ingram: 4 personal fouls)   FT 1/2: GOOD   FT 2/2: GOOD Kyle McCollum makes 2/2 from the line.
Score: 45-41

[00:16] Team_021 possession (Score: 45-41)
FOUL! Holding foul on Anfernee Green. [Team fouls: 4] No free throws, side out. (Anfernee Green: 2 personal fouls)

[00:01] Team_021 possession (Score: 45-41)
Vince George attempts a Layup. Contested by Lamelo Towns (5.3 feet, ZONE). VINCE GEORGE MAKES IT! Assist: Victor Mitchell
Score: 47-41

================================================================================
                              2ND QUARTER COMPLETE                              
================================================================================

2ND QUARTER SCORE: Team_021 23, Team_086 22

BOX SCORE:
================================================================================

Team_021
--------------------------------------------------------------------------------
Player                MIN  PTS  REB  AST  TO      FG   FG%      3P   3P%
--------------------------------------------------------------------------------
Zach Carter            17    6    1    0   0   3/3   100.0     0/0   0.0
Kyrie Wagner           17    3    0    3   0   1/2    50.0     0/0   0.0
Anthony Oladipo        17    3    0    1   0   1/2    50.0     0/0   0.0
Joel LaVine             8    3    0    0   0   1/2    50.0     0/0   0.0
Paul Allen              8    2    0    2   0   1/5    20.0     0/0   0.0
Vince George            8    2    2    0   0   1/1   100.0     0/0   0.0
Victor Mitchell         8    2    2    1   0   1/1   100.0     0/0   0.0
Karl Bridges           17    0    0    1   0   0/1     0.0     0/0   0.0
Kyrie Leonard          17    0    3    0   0   0/0     0.0     0/0   0.0
Magic Ingram            8    0    5    0   0   0/2     0.0     0/0   0.0

TEAM: FG: 9/19 (47.4%), 3PT: 3/8 (37.5%), REB: 13 (3 off, 10 def), AST: 8, TO: 4
TEAM FOULS: 9 [Team_086 in BONUS]


Team_086
--------------------------------------------------------------------------------
Player                MIN  PTS  REB  AST  TO      FG   FG%      3P   3P%
--------------------------------------------------------------------------------
Kyle McCollum           8    7    1    0   0   3/7    42.9     0/0   0.0
Lauri Johnson          17    5    0    0   0   2/2   100.0     0/0   0.0
Miles Gobert           17    2    3    0   0   1/2    50.0     0/0   0.0
Anfernee Harris        17    2    0    0   0   1/2    50.0     0/0   0.0
Lamelo Towns            8    2    4    0   0   1/1   100.0     0/0   0.0
Franz McGrady           8    2    0    0   0   1/1   100.0     0/0   0.0
Rudy Rose              17    0    0    1   0   0/0     0.0     0/0   0.0
Bones Ginobili         17    0    1    0   0   0/1     0.0     0/0   0.0
Anfernee Green          8    0    3    0   0   0/3     0.0     0/0   0.0

TEAM: FG: 9/19 (47.4%), 3PT: 0/2 (0.0%), REB: 12 (2 off, 10 def), AST: 1, TO: 3
TEAM FOULS: 4

================================================================================

================================================================================
                       3RD QUARTER - Team_021 vs Team_086                       
================================================================================

[12:00] Team_021 possession (Score: 47-41)
Kyrie Leonard attempts a 3Pt. Contested by Lauri Johnson (4.2 feet, MAN). Kyrie Leonard misses. Rebound secured by Bones Ginobili.

[11:46] Team_086 possession (Score: 47-41)
Miles Gobert attempts a 3Pt. Contested by Kyrie Wagner (4.2 feet, ZONE). Miles Gobert misses. Rebound secured by Zach Carter.

[11:32] Team_021 possession (Score: 47-41)
Karl Bridges drives and kicks out. FOUL! Shooting foul on Lauri Johnson. Kyrie Leonard to the line for 3 free throws. [Team fouls: 1] (Lauri Johnson: 1 personal fouls)   FT 1/3: GOOD   FT 2/3: GOOD   FT 3/3: GOOD Kyrie Leonard makes 3/3 from the line.
Score: 50-41

[11:12] Team_086 possession (Score: 50-41)
Anfernee Harris attempts a Layup. BLOCKED BY ANTHONY OLADIPO! Ball is loose! Rebound secured by Zach Carter.

[10:56] Team_021 possession (Score: 50-41)
FOUL! Shooting foul on Rudy Rose. Zach Carter to the line for 2 free throws. [Team fouls: 2] (Rudy Rose: 1 personal fouls)   FT 1/2: GOOD   FT 2/2: MISS Zach Carter makes 1/2 from the line. Rebound secured by Miles Gobert.
Score: 51-41

[10:41] Team_086 possession (Score: 51-41)
Rudy Rose attempts a Midrange. Contested by Karl Bridges (5.8 feet, ZONE). RUDY ROSE MAKES IT!
Score: 51-43

[10:27] Team_021 possession (Score: 51-43)
Karl Bridges attempts a 3Pt. Contested by Lauri Johnson (4.3 feet, ZONE). KARL BRIDGES MAKES IT! Assist: Anthony Oladipo
Score: 54-43

[10:09] Team_086 possession (Score: 54-43)
Rudy Rose drives to the basket... Rudy Rose throws a bad pass! Stolen by Kyrie Wagner! TURNOVER! (live ball)

[09:52] Team_021 possession (Score: 54-43)
Anthony Oladipo attempts a 3Pt. BLOCKED BY BONES GINOBILI! Ball is loose! Rebound secured by Rudy Rose.

[09:41] Team_086 possession (Score: 54-43)
Bones Ginobili drives, Zach Carter stays with him. Bones Ginobili attempts a Dunk. Contested by Zach Carter (4.4 feet, ZONE). BONES GINOBILI MAKES IT! Assist: Rudy Rose
Score: 54-45

[09:23] Team_021 possession (Score: 54-45)
Anthony Oladipo attempts a 3Pt. Contested by Lauri Johnson (4.3 feet, ZONE). ANTHONY OLADIPO MAKES IT! Assist: Kyrie Wagner
Score: 57-45

[09:07] Team_086 possession (Score: 57-45)
Rudy Rose attempts a Layup. Contested by Zach Carter (4.3 feet, ZONE). RUDY ROSE MAKES IT! Assist: Anfernee Harris
Score: 57-47

[08:51] Team_021 possession (Score: 57-47)
Zach Carter drives, Rudy Rose stays with him. Zach Carter attempts a Layup. Contested by Rudy Rose (4.1 feet, MAN). Zach Carter misses. Rebound secured by Miles Gobert.

[08:38] Team_086 possession (Score: 57-47)
Lauri Johnson attempts a 3Pt. Contested by Kyrie Leonard (4.8 feet, MAN). Lauri Johnson misses. Rebound secured by Zach Carter.

[08:20] Team_021 possession (Score: 57-47)
Anthony Oladipo makes the Layup and draws the foul on Anfernee Harris! And-1! Anthony Oladipo to the line for 1. [Team fouls: 3] (Anfernee Harris: 1 personal fouls)   FT 1/1: GOOD Anthony Oladipo makes 1/1 from the line.
Score: 60-47

[08:07] Team_086 possession (Score: 60-47)
Miles Gobert attempts a 3Pt. Contested by Kyrie Wagner (4.2 feet, ZONE). Miles Gobert misses. Rebound secured by Zach Carter.

[07:55] Team_021 possession (Score: 60-47)
Karl Bridges attempts a 3Pt. Contested by Miles Gobert (3.4 feet, MAN). Karl Bridges misses. Rebound secured by Rudy Rose.

[07:44] Team_086 possession (Score: 60-47)
Bones Ginobili attempts a Layup. Contested by Zach Carter (4.4 feet, ZONE). BONES GINOBILI MAKES IT!
Score: 60-49

[07:27] Team_021 possession (Score: 60-49)
Karl Bridges attempts a Midrange. Contested by Miles Gobert (3.4 feet, MAN). Karl Bridges misses. Offensive rebound by Kyrie Leonard! Kyrie Leonard kicks it out.

[07:13] Team_021 possession (Score: 60-49)
Zach Carter drives, picks up Rudy Rose. Help arrives from Anfernee Harris! Zach Carter attempts a Dunk. Contested by Anfernee Harris (4.1 feet, MAN). Zach Carter misses. Offensive rebound by Kyrie Leonard! Kyrie Leonard kicks it out.

[07:00] Team_021 possession (Score: 60-49)
Anthony Oladipo drives, picks up Rudy Rose. Help arrives from Anfernee Harris! Anthony Oladipo attempts a Layup. Contested by Anfernee Harris (3.7 feet, ZONE). ANTHONY OLADIPO MAKES IT! Assist: Karl Bridges
Score: 62-49

[06:45] Team_086 possession (Score: 62-49)
Rudy Rose drives, picks up Zach Carter. Help arrives from Kyrie Leonard! Rudy Rose attempts a Layup. Contested by Kyrie Leonard (4.3 feet, ZONE). RUDY ROSE MAKES IT! Assist: Bones Ginobili
Score: 62-51

[06:30] Team_021 possession (Score: 62-51)
Kyrie Wagner drives and kicks out. Kyrie Leonard attempts a 3Pt. Contested by Lauri Johnson (4.4 feet, MAN). Kyrie Leonard misses. Rebound secured by Bones Ginobili.

[06:16] Team_086 possession (Score: 62-51)
Miles Gobert attempts a 3Pt. Contested by Kyrie Wagner (4.2 feet, ZONE). MILES GOBERT MAKES IT! Assist: Lauri Johnson
Score: 62-54

[05:58] Team_021 possession (Score: 62-54)
Kyrie Wagner attempts a 3Pt. Contested by Lauri Johnson (4.4 feet, ZONE). Kyrie Wagner misses. Rebound secured by Miles Gobert.

[05:41] Team_086 possession (Score: 62-54)
Miles Gobert drives, Zach Carter stays with him. Miles Gobert attempts a Layup. Contested by Zach Carter (4.2 feet, ZONE). MILES GOBERT MAKES IT! Assist: Rudy Rose
Score: 62-56

[05:23] Team_021 possession (Score: 62-56)
Anthony Oladipo drives, picks up Anfernee Harris. Help arrives from Miles Gobert! Anthony Oladipo attempts a Layup. Contested by Miles Gobert (4.2 feet, MAN). ANTHONY OLADIPO MAKES IT! Assist: Zach Carter
Score: 64-56

[05:11] Team_086 possession (Score: 64-56)
FOUL! Holding foul on Anthony Oladipo. [Team fouls: 1] No free throws, side out. (Anthony Oladipo: 1 personal fouls)

[04:59] Team_086 possession (Score: 64-56)
Rudy Rose attempts a Midrange. Contested by Zach Carter (4.3 feet, MAN). Rudy Rose misses. Rebound secured by Kyrie Leonard.

[04:40] Team_021 possession (Score: 64-56)
Anthony Oladipo drives, Anfernee Harris stays with him. Anthony Oladipo attempts a Dunk. Contested by Anfernee Harris (4.2 feet, MAN). ANTHONY OLADIPO MAKES IT!
Score: 66-56

[04:27] Team_086 possession (Score: 66-56)
Lauri Johnson attempts a Midrange. Contested by Kyrie Leonard (4.8 feet, MAN). LAURI JOHNSON MAKES IT! Assist: Rudy Rose
Score: 66-58

[04:10] Team_021 possession (Score: 66-58)
Kyrie Wagner attempts a 3Pt. Contested by Bones Ginobili (4.9 feet, MAN). KYRIE WAGNER MAKES IT! Assist: Karl Bridges
Score: 69-58

[03:56] Team_086 possession (Score: 69-58)
Anfernee Harris drives to the basket... FOUL! Offensive foul on Anfernee Harris! Zach Carter drew the charge! [Team fouls: 4] (Anfernee Harris: 2 personal fouls) TURNOVER! (dead ball)

[03:45] Team_021 possession (Score: 69-58)
Karl Bridges throws a bad pass! Stolen by Miles Gobert! TURNOVER! (live ball)

[03:30] Team_086 possession (Score: 69-58)
Lauri Johnson attempts a Midrange. Contested by Kyrie Leonard (4.9 feet, MAN). LAURI JOHNSON MAKES IT!
Score: 69-60

[03:16] Team_021 possession (Score: 69-60)
Karl Bridges attempts a Midrange. Contested by Miles Gobert (3.5 feet, MAN). KARL BRIDGES MAKES IT! Assist: Kyrie Leonard
Score: 71-60

[03:01] Team_086 possession (Score: 71-60)
Rudy Rose attempts a Midrange. Contested by Zach Carter (4.4 feet, MAN). Rudy Rose misses. Rebound secured by Zach Carter.

[02:46] Team_021 possession (Score: 71-60)
Anthony Oladipo attempts a Midrange. Contested by Miles Gobert (3.6 feet, ZONE). Anthony Oladipo misses. Rebound secured by Bones Ginobili.

[02:31] Team_086 possession (Score: 71-60)
Rudy Rose drives to the basket... Rudy Rose loses the ball! Stripped by Zach Carter! TURNOVER! (live ball)

[02:16] Team_021 possession (Score: 71-60)
Karl Bridges loses control! Ball rolls out of bounds! TURNOVER! (dead ball)

[02:16] Substitution (Team_021): Kyrie Wagner OUT → Vince George IN (stamina_rule2)

[02:16] Substitution (Team_086): Anfernee Harris OUT → Anthony James IN (stamina_rule2)

[02:16] Substitution (Team_086): Bones Ginobili OUT → Kyle McCollum IN (stamina_rule2)

[02:04] Team_086 possession (Score: 71-60)
Anthony James attempts a Layup. Contested by Zach Carter (5.0 feet, ZONE). ANTHONY JAMES MAKES IT! Assist: Miles Gobert
Score: 71-62

[01:47] Team_021 possession (Score: 71-62)
FOUL! Shooting foul on Rudy Rose. Zach Carter to the line for 2 free throws. [BONUS: 5 team fouls] (Rudy Rose: 2 personal fouls)   FT 1/2: GOOD   FT 2/2: GOOD Zach Carter makes 2/2 from the line.
Score: 73-62

[01:32] Team_086 possession (Score: 73-62)
Miles Gobert attempts a Layup. Wide open! Karl Bridges is 6.0 feet away. [MAN] MILES GOBERT MAKES IT! Assist: Anthony James
Score: 73-64

[01:17] Team_021 possession (Score: 73-64)
Karl Bridges drives, Miles Gobert stays with him. Karl Bridges attempts a Dunk. Contested by Miles Gobert (3.7 feet, MAN). KARL BRIDGES MAKES IT! Assist: Anthony Oladipo
Score: 75-64

[01:05] Team_086 possession (Score: 75-64)
Lauri Johnson attempts a 3Pt. Contested by Vince George (5.1 feet, ZONE). LAURI JOHNSON MAKES IT! Assist: Miles Gobert
Score: 75-67

[00:48] Team_021 possession (Score: 75-67)
Zach Carter attempts a Layup. Contested by Rudy Rose (4.5 feet, MAN). Zach Carter misses. Rebound secured by Kyle McCollum.

[00:32] Team_086 possession (Score: 75-67)
Lauri Johnson attempts a Midrange. Wide open! Karl Bridges is 6.1 feet away. [ZONE] Lauri Johnson misses. Rebound secured by Vince George.

[00:18] Team_021 possession (Score: 75-67)
Zach Carter attempts a Midrange. Contested by Miles Gobert (4.3 feet, ZONE). Zach Carter misses. Offensive rebound by Vince George! Vince George kicks it out.

[00:09] Team_021 possession (Score: 75-67)
FOUL! Holding foul on Lauri Johnson. [IN THE BONUS! 6 team fouls] Kyrie Leonard to the line for 2 free throws. (Lauri Johnson: 2 personal fouls)   FT 1/2: GOOD   FT 2/2: GOOD Kyrie Leonard makes 2/2 from the line.
Score: 77-67

================================================================================
                              3RD QUARTER COMPLETE                              
================================================================================

3RD QUARTER SCORE: Team_021 30, Team_086 26

BOX SCORE:
================================================================================

Team_021
--------------------------------------------------------------------------------
Player                MIN  PTS  REB  AST  TO      FG   FG%      3P   3P%
--------------------------------------------------------------------------------
Anthony Oladipo        29   12    0    2   0   5/7    71.4     0/0   0.0
Karl Bridges           29    7    0    2   0   3/4    75.0     0/0   0.0
Kyrie Leonard          29    5    3    1   0   2/3    66.7     0/0   0.0
Kyrie Wagner           27    3    0    1   0   1/3    33.3     0/0   0.0
Zach Carter            29    2    5    1   0   1/4    25.0     0/0   0.0
Vince George           10    0    2    0   0   0/0     0.0     0/0   0.0

TEAM: FG: 12/21 (57.1%), 3PT: 3/7 (42.9%), REB: 10 (3 off, 7 def), AST: 7, TO: 2
TEAM FOULS: 1


Team_086
--------------------------------------------------------------------------------
Player                MIN  PTS  REB  AST  TO      FG   FG%      3P   3P%
--------------------------------------------------------------------------------
Miles Gobert           29    7    3    2   0   3/5    60.0     0/0   0.0
Lauri Johnson          29    7    0    1   0   3/5    60.0     0/0   0.0
Rudy Rose              29    6    2    3   0   3/5    60.0     0/0   0.0
Bones Ginobili         27    4    3    1   0   2/2   100.0     0/0   0.0
Anthony James          10    2    0    1   0   1/1   100.0     0/0   0.0
Anfernee Harris        27    0    0    1   0   0/1     0.0     0/0   0.0
Kyle McCollum          10    0    1    0   0   0/0     0.0     0/0   0.0

TEAM: FG: 12/19 (63.2%), 3PT: 2/5 (40.0%), REB: 9 (0 off, 9 def), AST: 9, TO: 3
TEAM FOULS: 6 [Team_021 in BONUS]

================================================================================

================================================================================
                       4TH QUARTER - Team_021 vs Team_086                       
================================================================================

[12:00] Team_021 possession (Score: 77-67)
Zach Carter attempts a Midrange. Contested by Rudy Rose (4.3 feet, MAN). Zach Carter misses. Offensive rebound by Kyrie Leonard! Kyrie Leonard kicks it out.

[11:48] Team_021 possession (Score: 77-67)
Karl Bridges attempts a 3Pt. Contested by Lauri Johnson (4.5 feet, ZONE). KARL BRIDGES MAKES IT! Assist: Zach Carter
Score: 80-67

[11:37] Team_086 possession (Score: 80-67)
FOUL! Reach-in foul on Kyrie Wagner during the drive. [Team fouls: 1] No free throws, side out. (Kyrie Wagner: 1 personal fouls)

[11:23] Team_086 possession (Score: 80-67)
Miles Gobert drives, picks up Karl Bridges. Help arrives from Kyrie Leonard! Miles Gobert attempts a Layup. Wide open! Kyrie Leonard is 6.0 feet away. [MAN] MILES GOBERT MAKES IT!
Score: 80-69

[11:06] Team_021 possession (Score: 80-69)
Anthony Oladipo drives, Anfernee Harris stays with him. Anthony Oladipo attempts a Layup. Contested by Anfernee Harris (4.2 feet, MAN). ANTHONY OLADIPO MAKES IT! Assist: Kyrie Leonard
Score: 82-69

[10:52] Team_086 possession (Score: 82-69)
Rudy Rose attempts a Midrange. Contested by Zach Carter (4.6 feet, MAN). Rudy Rose misses. Offensive rebound by Miles Gobert! Miles Gobert kicks it out.

[10:35] Team_086 possession (Score: 82-69)
Miles Gobert attempts a 3Pt. Wide open! Karl Bridges is 6.1 feet away. [MAN] Miles Gobert misses. Rebound secured by Zach Carter.

[10:20] Team_021 possession (Score: 82-69)
Karl Bridges attempts a Midrange. Contested by Bones Ginobili (4.7 feet, ZONE). Karl Bridges misses. Rebound secured by Bones Ginobili.

[10:03] Team_086 possession (Score: 82-69)
Miles Gobert attempts a 3Pt. Contested by Kyrie Wagner (4.3 feet, ZONE). Miles Gobert misses. Rebound secured by Anthony Oladipo.

[09:47] Team_021 possession (Score: 82-69)
Kyrie Wagner attempts a 3Pt. Contested by Lauri Johnson (4.9 feet, ZONE). Kyrie Wagner misses. FOUL! Loose ball foul on Bones Ginobili during the rebound battle. [Team fouls: 1] No free throws, side out. (Bones Ginobili: 1 personal fouls)

[09:36] Team_021 possession (Score: 82-69)
Zach Carter attempts a Layup. Contested by Bones Ginobili (5.3 feet, ZONE). Zach Carter misses. Rebound secured by Bones Ginobili.

[09:22] Team_086 possession (Score: 82-69)
Bones Ginobili attempts a Layup. BLOCKED BY KYRIE WAGNER! Ball is loose! Rebound secured by Kyrie Leonard.

[09:08] Team_021 possession (Score: 82-69)
Karl Bridges attempts a Midrange. Contested by Lauri Johnson (4.8 feet, ZONE). Karl Bridges misses. Rebound secured by Miles Gobert.

[08:56] Team_086 possession (Score: 82-69)
Lauri Johnson attempts a 3Pt. Contested by Kyrie Wagner (4.4 feet, ZONE). LAURI JOHNSON MAKES IT! Assist: Bones Ginobili
Score: 82-72

[08:39] Team_021 possession (Score: 82-72)
Anthony Oladipo attempts a Midrange. Contested by Anfernee Harris (4.4 feet, MAN). Anthony Oladipo misses. FOUL! Loose ball foul on Rudy Rose during the rebound battle. [Team fouls: 2] No free throws, side out. (Rudy Rose: 1 personal fouls)

[08:28] Team_021 possession (Score: 82-72)
Kyrie Wagner attempts a Midrange. Contested by Miles Gobert (4.2 feet, ZONE). Kyrie Wagner misses. Rebound secured by Miles Gobert.

[08:14] Team_086 possession (Score: 82-72)
Anfernee Harris attempts a 3Pt. Contested by Kyrie Wagner (4.9 feet, ZONE). Anfernee Harris misses. Rebound secured by Kyrie Leonard.

[08:03] Team_021 possession (Score: 82-72)
Kyrie Wagner makes the 3Pt and draws the foul on Bones Ginobili! And-1! Kyrie Wagner to the line for 1. [Team fouls: 3] (Bones Ginobili: 2 personal fouls)   FT 1/1: GOOD Kyrie Wagner makes 1/1 from the line.
Score: 86-72

[07:47] Team_086 possession (Score: 86-72)
Lauri Johnson loses the ball! Stripped by Kyrie Leonard! TURNOVER! (live ball)

[07:36] Team_021 possession (Score: 86-72)
Zach Carter attempts a Midrange. Contested by Rudy Rose (4.8 feet, MAN). Zach Carter misses. Rebound secured by Miles Gobert.

[07:22] Team_086 possession (Score: 86-72)
Miles Gobert attempts a Layup. Wide open! Karl Bridges is 6.4 feet away. [MAN] MILES GOBERT MAKES IT!
Score: 86-74

[07:10] Team_021 possession (Score: 86-74)
FOUL! Reach-in foul on Anfernee Harris during the drive. [Team fouls: 4] No free throws, side out. (Anfernee Harris: 1 personal fouls)

[06:55] Team_021 possession (Score: 86-74)
Karl Bridges throws a bad pass! Stolen by Miles Gobert! TURNOVER! (live ball)

[06:37] Team_086 possession (Score: 86-74)
Anfernee Harris attempts a Midrange. Wide open! Anthony Oladipo is 6.0 feet away. [MAN] ANFERNEE HARRIS MAKES IT! Assist: Bones Ginobili
Score: 86-76

[06:21] Team_021 possession (Score: 86-76)
Kyrie Wagner attempts a Midrange. Contested by Miles Gobert (4.5 feet, ZONE). Kyrie Wagner misses. Rebound secured by Miles Gobert.

[06:04] Team_086 possession (Score: 86-76)
Lauri Johnson attempts a Midrange. Contested by Kyrie Wagner (4.8 feet, ZONE). Lauri Johnson misses. Rebound secured by Kyrie Leonard.

[05:49] Team_021 possession (Score: 86-76)
Kyrie Wagner attempts a Midrange. Contested by Anfernee Harris (4.9 feet, ZONE). Kyrie Wagner misses. FOUL! Loose ball foul on Rudy Rose during the rebound battle. [IN THE BONUS! 5 team fouls] Zach Carter to the line for 2 free throws. (Rudy Rose: 2 personal fouls)   FT 1/2: GOOD   FT 2/2: GOOD Zach Carter makes 2/2 from the line.
Score: 88-76

[05:34] Team_086 possession (Score: 88-76)
Miles Gobert drives and kicks out. Lauri Johnson attempts a Midrange. Contested by Zach Carter (5.2 feet, ZONE). LAURI JOHNSON MAKES IT!
Score: 88-78

[05:23] Team_021 possession (Score: 88-78)
Kyrie Wagner attempts a Midrange. Contested by Bones Ginobili (5.5 feet, MAN). Kyrie Wagner misses. FOUL! Loose ball foul on Miles Gobert during the rebound battle. [IN THE BONUS! 6 team fouls] Kyrie Leonard to the line for 2 free throws. (Miles Gobert: 1 personal fouls)   FT 1/2: MISS   FT 2/2: GOOD Kyrie Leonard makes 1/2 from the line.
Score: 89-78

[05:12] Team_086 possession (Score: 89-78)
FOUL! Offensive foul on Miles Gobert! Karl Bridges drew the charge! [Team fouls: 7] (Miles Gobert: 2 personal fouls) TURNOVER! (dead ball)

[04:55] Team_021 possession (Score: 89-78)
Kyrie Leonard drives, picks up Bones Ginobili. Help arrives from Anfernee Harris! Kyrie Leonard attempts a Layup. Contested by Anfernee Harris (5.3 feet, ZONE). KYRIE LEONARD MAKES IT! Assist: Zach Carter
Score: 91-78

[04:35] Team_086 possession (Score: 91-78)
Bones Ginobili attempts a 3Pt. Contested by Kyrie Wagner (5.2 feet, MAN). Bones Ginobili misses. Rebound secured by Zach Carter.

[04:16] Team_021 possession (Score: 91-78)
Karl Bridges makes the Layup and draws the foul on Bones Ginobili! And-1! Karl Bridges to the line for 1. [BONUS: 8 team fouls] (Bones Ginobili: 3 personal fouls)   FT 1/1: GOOD Karl Bridges makes 1/1 from the line.
Score: 94-78

[04:02] Team_086 possession (Score: 94-78)
Miles Gobert throws a bad pass! Stolen by Karl Bridges! TURNOVER! (live ball)

[03:48] Team_021 possession (Score: 94-78)
Karl Bridges drives and kicks out. Anthony Oladipo attempts a Midrange. Contested by Bones Ginobili (5.7 feet, ZONE). Anthony Oladipo misses. Rebound secured by Miles Gobert.

[03:37] Team_086 possession (Score: 94-78)
Lauri Johnson attempts a Midrange. Wide open! Karl Bridges is 6.8 feet away. [ZONE] LAURI JOHNSON MAKES IT!
Score: 94-80

[03:21] Team_021 possession (Score: 94-80)
Anthony Oladipo makes the Midrange and draws the foul on Lauri Johnson! And-1! Anthony Oladipo to the line for 1. [BONUS: 9 team fouls] (Lauri Johnson: 1 personal fouls)   FT 1/1: GOOD Anthony Oladipo makes 1/1 from the line.
Score: 97-80

[03:04] Team_086 possession (Score: 97-80)
FOUL! Shooting foul on Anthony Oladipo. Anfernee Harris to the line for 3 free throws. [Team fouls: 2] (Anthony Oladipo: 1 personal fouls)   FT 1/3: GOOD   FT 2/3: GOOD   FT 3/3: GOOD Anfernee Harris makes 3/3 from the line.
Score: 97-83

[02:50] Team_021 possession (Score: 97-83)
Anthony Oladipo attempts a Midrange. Contested by Anfernee Harris (5.2 feet, MAN). ANTHONY OLADIPO MAKES IT! Assist: Kyrie Leonard
Score: 99-83

[02:36] Team_086 possession (Score: 99-83)
Lauri Johnson attempts a Midrange. Wide open! Kyrie Leonard is 6.1 feet away. [MAN] Lauri Johnson misses. Rebound secured by Anthony Oladipo.

[02:22] Team_021 possession (Score: 99-83)
Anthony Oladipo makes the Layup and draws the foul on Bones Ginobili! And-1! Anthony Oladipo to the line for 1. [BONUS: 10 team fouls] (Bones Ginobili: 4 personal fouls)   FT 1/1: GOOD Anthony Oladipo makes 1/1 from the line.
Score: 102-83

[02:09] Team_086 possession (Score: 102-83)
Bones Ginobili attempts a 3Pt. Contested by Kyrie Wagner (5.5 feet, ZONE). Bones Ginobili misses. Rebound secured by Kyrie Leonard.

[01:56] Team_021 possession (Score: 102-83)
Karl Bridges attempts a 3Pt. Contested by Miles Gobert (5.0 feet, MAN). KARL BRIDGES MAKES IT! Assist: Anthony Oladipo
Score: 105-83

[01:44] Team_086 possession (Score: 105-83)
Anfernee Harris attempts a Midrange. Wide open! Anthony Oladipo is 6.6 feet away. [ZONE] ANFERNEE HARRIS MAKES IT!
Score: 105-85

[01:31] Team_021 possession (Score: 105-85)
Anthony Oladipo attempts a 3Pt. Contested by Lauri Johnson (5.9 feet, ZONE). ANTHONY OLADIPO MAKES IT! Assist: Kyrie Leonard
Score: 108-85

[01:14] Team_086 possession (Score: 108-85)
Rudy Rose attempts a Midrange. Wide open! Karl Bridges is 7.1 feet away. [ZONE] Rudy Rose misses. Rebound secured by Kyrie Leonard.

[01:02] Team_021 possession (Score: 108-85)
Zach Carter attempts a Midrange. Contested by Rudy Rose (5.7 feet, MAN). Zach Carter misses. Rebound secured by Rudy Rose.

[00:45] Team_086 possession (Score: 108-85)
Bones Ginobili drives, picks up Kyrie Wagner. Help arrives from Kyrie Leonard! Bones Ginobili attempts a Layup. Contested by Kyrie Leonard (5.7 feet, MAN). BONES GINOBILI MAKES IT! Assist: Lauri Johnson
Score: 108-87

[00:33] Team_021 possession (Score: 108-87)
Kyrie Leonard attempts a 3Pt. Contested by Lauri Johnson (5.9 feet, ZONE). Kyrie Leonard misses. Rebound secured by Miles Gobert.

[00:19] Team_086 possession (Score: 108-87)
Bones Ginobili attempts a Midrange. Contested by Kyrie Wagner (5.8 feet, ZONE). BONES GINOBILI MAKES IT! Assist: Lauri Johnson
Score: 108-89

[00:07] Team_021 possession (Score: 108-89)
Kyrie Wagner attempts a Midrange. Wide open! Bones Ginobili is 6.2 feet away. [MAN] KYRIE WAGNER MAKES IT! Assist: Anthony Oladipo
Score: 110-89

================================================================================
                              4TH QUARTER COMPLETE                              
================================================================================

4TH QUARTER SCORE: Team_021 33, Team_086 22

BOX SCORE:
================================================================================

Team_021
--------------------------------------------------------------------------------
Player                MIN  PTS  REB  AST  TO      FG   FG%      3P   3P%
--------------------------------------------------------------------------------
Anthony Oladipo        41   13    2    2   0   5/5   100.0     0/0   0.0
Karl Bridges           41    9    0    0   0   3/6    50.0     0/0   0.0
Kyrie Wagner           39    6    0    0   0   2/4    50.0     0/0   0.0
Kyrie Leonard          41    3    7    3   0   2/3    66.7     0/0   0.0
Zach Carter            41    2    3    2   0   1/4    25.0     0/0   0.0

TEAM: FG: 13/22 (59.1%), 3PT: 4/5 (80.0%), REB: 12 (3 off, 9 def), AST: 7, TO: 1
TEAM FOULS: 2


Team_086
--------------------------------------------------------------------------------
Player                MIN  PTS  REB  AST  TO      FG   FG%      3P   3P%
--------------------------------------------------------------------------------
Lauri Johnson          41    7    0    2   0   3/5    60.0     0/0   0.0
Anfernee Harris        39    7    0    0   0   3/4    75.0     0/0   0.0
Miles Gobert           41    4    7    0   0   2/4    50.0     0/0   0.0
Bones Ginobili         39    4    2    2   0   2/5    40.0     0/0   0.0
Rudy Rose              41    0    1    0   0   0/1     0.0     0/0   0.0

TEAM: FG: 10/19 (52.6%), 3PT: 2/7 (28.6%), REB: 10 (1 off, 9 def), AST: 4, TO: 3
TEAM FOULS: 10 [Team_021 in BONUS]

================================================================================

================================================================================
                               FULL GAME COMPLETE                               
================================================================================

FINAL SCORE: Team_021 110, Team_086 89

SCORING BY QUARTER:
--------------------------------------------------------------------------------
Team                     Q1     Q2     Q3     Q4    FINAL
--------------------------------------------------------------------------------
Team_021                 24     23     30     33      110
Team_086                 19     22     26     22       89
--------------------------------------------------------------------------------

FULL GAME BOX SCORE:
================================================================================

Team_021
--------------------------------------------------------------------------------
Player                MIN  PTS  REB  AST  TO      FG   FG%      3P   3P%      FT STL BLK
--------------------------------------------------------------------------------
Kyrie Leonard          41   15   18    5   0   4/7    57.1   1/3    33.3   6/7     1   0
Anthony Oladipo        41   33    5    8   0  12/17   70.6   4/8    50.0   3/3     0   1
Karl Bridges           41   19    0    4   5   8/16   50.0   4/7    57.1   1/1     1   0
Zach Carter            41   15   18    4   0   6/12   50.0   0/0     0.0   6/7     1   0
Kyrie Wagner           39   16    0    5   2   9/15   60.0   3/4    75.0   3/4     1   1
Vince George           10    2    4    0   0   1/1   100.0   0/0     0.0   0/0     0   0
Joel LaVine             8    3    0    0   1   1/2    50.0   1/1   100.0   0/0     0   0
Victor Mitchell         8    2    2    1   0   1/1   100.0   0/0     0.0   0/0     0   0
Paul Allen              8    2    0    2   1   1/5    20.0   0/3     0.0   0/0     0   0
Magic Ingram            8    0    5    0   1   0/2     0.0   0/1     0.0   0/0     0   0

TEAM: FG: 44/79 (55.7%), 3PT: 13/27 (48.1%), REB: 52 (15 off, 37 def), AST: 29, TO: 10


Team_086
--------------------------------------------------------------------------------
Player                MIN  PTS  REB  AST  TO      FG   FG%      3P   3P%      FT STL BLK
--------------------------------------------------------------------------------
Lauri Johnson          41   25    0    4   2  10/15   66.7   2/4    50.0   3/3     0   0
Miles Gobert           41   15   15    2   2   8/15   53.3   1/7    14.3   0/0     3   0
Rudy Rose              41   13    9    5   1   5/9    55.6   0/0     0.0   1/1     0   0
Anfernee Harris        39   13    0    2   2   6/13   46.2   2/6    33.3   5/5     0   0
Bones Ginobili         39    8    8    4   1   4/11   36.4   0/2     0.0   0/0     1   1
Anthony James          10    2    0    1   0   1/1   100.0   0/0     0.0   0/0     0   0
Kyle McCollum          10    7    2    0   0   3/7    42.9   0/1     0.0   3/3     0   0
Anfernee Green          8    0    3    0   0   0/3     0.0   0/0     0.0   0/1     0   0
Franz McGrady           8    2    0    0   0   1/1   100.0   0/0     0.0   0/0     0   0
Lamelo Towns            8    2    4    0   1   1/1   100.0   0/0     0.0   2/2     0   0

TEAM: FG: 40/77 (51.9%), 3PT: 5/20 (25.0%), REB: 41 (6 off, 35 def), AST: 18, TO: 9

================================================================================
