================================================================================
                        FULL GAME - Team_077 vs Team_060                        
================================================================================

================================================================================
                       1ST QUARTER - Team_077 vs Team_060                       
================================================================================

[12:00] Team_077 possession (Score: 0-0)
FOUL! Shooting foul on Julius Green. Dejounte Allen to the line for 3 free throws. [Team fouls: 1] (Julius Green: 1 personal fouls)   FT 1/3: GOOD   FT 2/3: GOOD   FT 3/3: MISS Dejounte Allen makes 2/3 from the line. Rebound secured by Immanuel Ming.
Score: 2-0

[11:47] Team_060 possession (Score: 2-0)
Immanuel Ming makes the Dunk and draws the foul on Draymond Dosunmu! And-1! Immanuel Ming to the line for 1. [Team fouls: 1] (Draymond Dosunmu: 1 personal fouls)   FT 1/1: MISS Immanuel Ming makes 0/1 from the line. Rebound secured by Chris Ginobili.
Score: 2-2

[11:33] Team_077 possession (Score: 2-2)
Russell Harden attempts a 3Pt. Contested by Julius Green (4.3 feet, ZONE). Russell Harden misses. Rebound secured by Immanuel Ming.

[11:21] Team_060 possession (Score: 2-2)
Julius Green attempts a 3Pt. Contested by Dejounte Allen (3.5 feet, ZONE). JULIUS GREEN MAKES IT! Assist: Immanuel Ming
Score: 2-5

[11:08] Team_077 possession (Score: 2-5)
Russell Harden loses the ball! Stripped by Larry Westbrook! TURNOVER! (live ball)

[10:53] Team_060 possession (Score: 2-5)
Jaren George makes the Layup and draws the foul on Ja Ball! And-1! Jaren George to the line for 1. [Team fouls: 2] (Ja Ball: 1 personal fouls)   FT 1/1: GOOD Jaren George makes 1/1 from the line.
Score: 2-8

[10:43] Team_077 possession (Score: 2-8)
Chris Ginobili attempts a 3Pt. Contested by Immanuel Ming (4.2 feet, MAN). CHRIS GINOBILI MAKES IT! Assist: Ja Ball
Score: 5-8

[10:32] Team_060 possession (Score: 5-8)
Larry Westbrook attempts a Midrange. Contested by Dejounte Allen (4.2 feet, ZONE). Larry Westbrook misses. Rebound secured by Russell Harden.

[10:16] Team_077 possession (Score: 5-8)
FOUL! Shooting foul on Julius Green. Draymond Dosunmu to the line for 3 free throws. [Team fouls: 2] (Julius Green: 2 personal fouls)   FT 1/3: GOOD   FT 2/3: GOOD   FT 3/3: MISS Draymond Dosunmu makes 2/3 from the line. Rebound secured by Jaren George.
Score: 7-8

[09:57] Team_060 possession (Score: 7-8)
Joel Morant attempts a Midrange. Contested by Ja Ball (3.8 feet, MAN). Joel Morant misses. Rebound secured by Draymond Dosunmu.

[09:43] Team_077 possession (Score: 7-8)
Draymond Dosunmu attempts a 3Pt. Contested by Jaren George (4.8 feet, MAN). Draymond Dosunmu misses. Rebound secured by Jaren George.

[09:27] Team_060 possession (Score: 7-8)
Julius Green attempts a 3Pt. Contested by Dejounte Allen (3.5 feet, MAN). JULIUS GREEN MAKES IT! Assist: Larry Westbrook
Score: 7-11

[09:15] Team_077 possession (Score: 7-11)
Dejounte Allen attempts a Layup. Contested by Julius Green (4.2 feet, MAN). Dejounte Allen misses. Rebound secured by Larry Westbrook.

[08:59] Team_060 possession (Score: 7-11)
Julius Green loses the ball! Stripped by Dejounte Allen! TURNOVER! (live ball)

[08:43] Team_077 possession (Score: 7-11)
Draymond Dosunmu drives and kicks out. Russell Harden attempts a 3Pt. Contested by Larry Westbrook (4.6 feet, MAN). RUSSELL HARDEN MAKES IT! Assist: Ja Ball
Score: 10-11

[08:29] Team_060 possession (Score: 10-11)
Julius Green attempts a Midrange. Contested by Dejounte Allen (3.5 feet, MAN). Julius Green misses. Rebound secured by Chris Ginobili.

[08:10] Team_077 possession (Score: 10-11)
Russell Harden makes the Midrange and draws the foul on Larry Westbrook! And-1! Russell Harden to the line for 1. [Team fouls: 3] (Larry Westbrook: 1 personal fouls)   FT 1/1: GOOD Russell Harden makes 1/1 from the line.
Score: 13-11

[07:59] Team_060 possession (Score: 13-11)
FOUL! Shooting foul on Draymond Dosunmu. Jaren George to the line for 2 free throws. [Team fouls: 3] (Draymond Dosunmu: 2 personal fouls)   FT 1/2: MISS   FT 2/2: MISS Jaren George makes 0/2 from the line. Rebound secured by Draymond Dosunmu.

[07:44] Team_077 possession (Score: 13-11)
Ja Ball attempts a 3Pt. Contested by Julius Green (4.2 feet, ZONE). Ja Ball misses. Offensive rebound by Russell Harden! Russell Harden kicks it out.

[07:29] Team_077 possession (Score: 13-11)
Russell Harden attempts a Layup. Contested by Larry Westbrook (5.2 feet, MAN). Russell Harden misses. Rebound secured by Immanuel Ming.

[07:15] Team_060 possession (Score: 13-11)
Immanuel Ming drives, Draymond Dosunmu stays with him. Immanuel Ming attempts a Layup. Contested by Draymond Dosunmu (4.3 feet, ZONE). IMMANUEL MING MAKES IT!
Score: 13-13

[06:59] Team_077 possession (Score: 13-13)
Russell Harden attempts a 3Pt. Contested by Larry Westbrook (5.2 feet, MAN). RUSSELL HARDEN MAKES IT! Assist: Ja Ball
Score: 16-13

[06:48] Team_060 possession (Score: 16-13)
Joel Morant attempts a 3Pt. Contested by Dejounte Allen (3.4 feet, ZONE). Joel Morant misses. Rebound secured by Russell Harden.

[06:34] Team_077 possession (Score: 16-13)
Dejounte Allen attempts a 3Pt. Contested by Julius Green (4.2 feet, MAN). Dejounte Allen misses. Rebound secured by Jaren George.

[06:15] Team_060 possession (Score: 16-13)
Jaren George attempts a Layup. Contested by Draymond Dosunmu (4.5 feet, MAN). JAREN GEORGE MAKES IT!
Score: 16-15

[06:02] Team_077 possession (Score: 16-15)
Russell Harden makes the Midrange and draws the foul on Larry Westbrook! And-1! Russell Harden to the line for 1. [Team fouls: 4] (Larry Westbrook: 2 personal fouls)   FT 1/1: GOOD Russell Harden makes 1/1 from the line.
Score: 19-15

[05:45] Team_060 possession (Score: 19-15)
Larry Westbrook attempts a Midrange. Contested by Russell Harden (4.9 feet, MAN). Larry Westbrook misses. Rebound secured by Russell Harden.

[05:31] Team_077 possession (Score: 19-15)
Chris Ginobili attempts a 3Pt. Contested by Julius Green (4.3 feet, ZONE). Chris Ginobili misses. Rebound secured by Larry Westbrook.

[05:20] Team_060 possession (Score: 19-15)
FOUL! Shooting foul on Draymond Dosunmu. Jaren George to the line for 2 free throws. [Team fouls: 4] (Draymond Dosunmu: 3 personal fouls)   FT 1/2: GOOD   FT 2/2: GOOD Jaren George makes 2/2 from the line.
Score: 19-17

[05:05] Team_077 possession (Score: 19-17)
Chris Ginobili attempts a Midrange. BLOCKED BY IMMANUEL MING! Ball is loose! Rebound secured by Immanuel Ming.

[04:46] Team_060 possession (Score: 19-17)
Immanuel Ming attempts a Midrange. Contested by Chris Ginobili (3.8 feet, MAN). Immanuel Ming misses. Rebound secured by Russell Harden.

[04:35] Team_077 possession (Score: 19-17)
Draymond Dosunmu attempts a Midrange. Contested by Julius Green (3.5 feet, ZONE). DRAYMOND DOSUNMU MAKES IT!
Score: 21-17

[04:21] Team_060 possession (Score: 21-17)
Larry Westbrook attempts a 3Pt. Contested by Dejounte Allen (4.3 feet, ZONE). LARRY WESTBROOK MAKES IT! Assist: Immanuel Ming
Score: 21-20

[04:05] Team_077 possession (Score: 21-20)
Dejounte Allen attempts a Midrange. Contested by Julius Green (4.3 feet, MAN). Dejounte Allen misses. Rebound secured by Jaren George.

[03:51] Team_060 possession (Score: 21-20)
Immanuel Ming attempts a 3Pt. Contested by Chris Ginobili (3.9 feet, MAN). Immanuel Ming misses. Rebound secured by Russell Harden.

[03:41] Team_077 possession (Score: 21-20)
Chris Ginobili attempts a 3Pt. Contested by Julius Green (4.5 feet, ZONE). Chris Ginobili misses. Rebound secured by Jaren George.

[03:27] Team_060 possession (Score: 21-20)
Joel Morant drives to the basket... Joel Morant loses control! Ball rolls out of bounds! TURNOVER! (dead ball)

[03:27] Substitution (Team_060): Joel Morant OUT → Domantas Barnes IN (stamina_rule2)

[03:27] Substitution (Team_060): Larry Westbrook OUT → Yao Tatum IN (stamina_rule2)

[03:27] Substitution (Team_060): Jaren George OUT → Klay Haliburton IN (stamina_rule2)

[03:14] Team_077 possession (Score: 21-20)
Russell Harden attempts a Midrange. Contested by Julius Green (4.5 feet, ZONE). RUSSELL HARDEN MAKES IT!
Score: 23-20

[02:57] Team_060 possession (Score: 23-20)
Immanuel Ming attempts a Layup. Contested by Chris Ginobili (4.0 feet, MAN). IMMANUEL MING MAKES IT! Assist: Klay Haliburton
Score: 23-22

[02:45] Team_077 possession (Score: 23-22)
FOUL! Shooting foul on Julius Green. Dejounte Allen to the line for 3 free throws. [BONUS: 5 team fouls] (Julius Green: 3 personal fouls)   FT 1/3: GOOD   FT 2/3: MISS   FT 3/3: GOOD Dejounte Allen makes 2/3 from the line.
Score: 25-22

[02:33] Team_060 possession (Score: 25-22)
Immanuel Ming drives to the basket... Immanuel Ming commits a violation (traveling/carry)! TURNOVER! (dead ball)

[02:33] Substitution (Team_077): Chris Ginobili OUT → Tyler Poole IN (stamina_rule2)

[02:33] Substitution (Team_077): Russell Harden OUT → Jordan Simmons IN (stamina_rule2)

[02:33] Substitution (Team_060): Julius Green OUT → Rudy Ginobili IN (stamina_rule2)

[02:16] Team_077 possession (Score: 25-22)
Jordan Simmons attempts a Layup. Contested by Yao Tatum (5.7 feet, MAN). JORDAN SIMMONS MAKES IT! Assist: Dejounte Allen
Score: 27-22

[02:02] Team_060 possession (Score: 27-22)
FOUL! Reach-in foul on Draymond Dosunmu during the drive. [IN THE BONUS! 5 team fouls] Yao Tatum to the line for 2 free throws. (Draymond Dosunmu: 4 personal fouls)   FT 1/2: GOOD   FT 2/2: GOOD Yao Tatum makes 2/2 from the line.
Score: 27-24

[01:50] Team_077 possession (Score: 27-24)
Dejounte Allen attempts a 3Pt. Contested by Domantas Barnes (5.0 feet, ZONE). Dejounte Allen misses. Rebound secured by Domantas Barnes.

[01:32] Team_060 possession (Score: 27-24)
Klay Haliburton drives, Draymond Dosunmu stays with him. Klay Haliburton attempts a Layup. Contested by Draymond Dosunmu (5.0 feet, ZONE). KLAY HALIBURTON MAKES IT!
Score: 27-26

[01:18] Team_077 possession (Score: 27-26)
Ja Ball attempts a Midrange. Contested by Domantas Barnes (4.9 feet, MAN). Ja Ball misses. Rebound secured by Immanuel Ming.

[01:04] Team_060 possession (Score: 27-26)
Klay Haliburton drives to the basket... FOUL! Offensive foul on Klay Haliburton! Draymond Dosunmu drew the charge! [Team fouls: 6] (Klay Haliburton: 1 personal fouls) TURNOVER! (dead ball)

[00:48] Team_077 possession (Score: 27-26)
Dejounte Allen attempts a Layup. Contested by Yao Tatum (5.6 feet, ZONE). Dejounte Allen misses. Offensive rebound by Jordan Simmons! Jordan Simmons kicks it out.

[00:34] Team_077 possession (Score: 27-26)
Draymond Dosunmu attempts a Layup. BLOCKED BY DOMANTAS BARNES! Ball goes out off Domantas Barnes. Draymond Dosunmu's ball!

[00:22] Team_077 possession (Score: 27-26)
Dejounte Allen drives, Rudy Ginobili stays with him. Dejounte Allen attempts a Layup. Contested by Rudy Ginobili (4.7 feet, MAN). Dejounte Allen misses. Rebound secured by Domantas Barnes.

[00:09] Team_060 possession (Score: 27-26)
Immanuel Ming attempts a 3Pt. Contested by Dejounte Allen (4.2 feet, ZONE). Immanuel Ming misses. Rebound secured by Ja Ball.

================================================================================
                              1ST QUARTER COMPLETE                              
================================================================================

1ST QUARTER SCORE: Team_077 27, Team_060 26

BOX SCORE:
================================================================================

Team_077
--------------------------------------------------------------------------------
Player                MIN  PTS  REB  AST  TO      FG   FG%      3P   3P%
--------------------------------------------------------------------------------
Russell Harden         10   14    6    0   0   5/7    71.4     0/0   0.0
Chris Ginobili         10    3    2    0   0   1/4    25.0     0/0   0.0
Dejounte Allen         12    2    0    1   0   1/7    14.3     0/0   0.0
Draymond Dosunmu       12    2    2    0   0   1/3    33.3     0/0   0.0
Jordan Simmons          2    2    1    0   0   1/1   100.0     0/0   0.0
Ja Ball                12    0    1    3   0   0/1     0.0     0/0   0.0

TEAM: FG: 9/23 (39.1%), 3PT: 3/11 (27.3%), REB: 12 (2 off, 10 def), AST: 4, TO: 1
TEAM FOULS: 5 [Team_060 in BONUS]


Team_060
--------------------------------------------------------------------------------
Player                MIN  PTS  REB  AST  TO      FG   FG%      3P   3P%
--------------------------------------------------------------------------------
Jaren George            9    7    5    0   0   3/4    75.0     0/0   0.0
Julius Green           10    6    0    0   0   2/3    66.7     0/0   0.0
Immanuel Ming          12    4    5    2   0   2/6    33.3     0/0   0.0
Larry Westbrook         9    3    2    1   0   1/3    33.3     0/0   0.0
Klay Haliburton         3    2    0    1   0   1/1   100.0     0/0   0.0
Yao Tatum               3    2    0    0   0   1/1   100.0     0/0   0.0
Joel Morant             9    0    0    0   0   0/2     0.0     0/0   0.0
Domantas Barnes         3    0    2    0   0   0/0     0.0     0/0   0.0

TEAM: FG: 10/20 (50.0%), 3PT: 3/6 (50.0%), REB: 14 (0 off, 14 def), AST: 4, TO: 4
TEAM FOULS: 6 [Team_077 in BONUS]

================================================================================

================================================================================
                       2ND QUARTER - Team_077 vs Team_060                       
================================================================================

[12:00] Team_077 possession (Score: 27-26)
Dejounte Allen attempts a Midrange. Contested by Larry Westbrook (5.0 feet, ZONE). Dejounte Allen misses. Rebound secured by Jaren George.

[11:50] Team_060 possession (Score: 27-26)
Joel Morant attempts a Midrange. Contested by Ja Ball (4.1 feet, MAN). JOEL MORANT MAKES IT!
Score: 27-28

[11:36] Team_077 possession (Score: 27-28)
Russell Harden attempts a Midrange. Contested by Larry Westbrook (5.2 feet, ZONE). Russell Harden misses. Rebound secured by Jaren George.

[11:18] Team_060 possession (Score: 27-28)
Larry Westbrook makes the Layup and draws the foul on Russell Harden! And-1! Larry Westbrook to the line for 1. [Team fouls: 1] (Russell Harden: 1 personal fouls)   FT 1/1: GOOD Larry Westbrook makes 1/1 from the line.
Score: 27-31

[11:02] Team_077 possession (Score: 27-31)
Russell Harden drives, Larry Westbrook stays with him. Russell Harden attempts a Layup. Contested by Larry Westbrook (5.2 feet, MAN). Russell Harden misses. Rebound secured by Immanuel Ming.

[10:50] Team_060 possession (Score: 27-31)
FOUL! Reach-in foul on Draymond Dosunmu during the drive. [Team fouls: 2] No free throws, side out. (Draymond Dosunmu: 1 personal fouls)

[10:34] Team_060 possession (Score: 27-31)
Joel Morant drives and kicks out. Jaren George attempts a 3Pt. Contested by Dejounte Allen (4.2 feet, ZONE). Jaren George misses. Rebound secured by Russell Harden.

[10:16] Team_077 possession (Score: 27-31)
Russell Harden drives, picks up Larry Westbrook. Help arrives from Julius Green! Russell Harden attempts a Layup. Contested by Julius Green (5.3 feet, MAN). Russell Harden misses. Rebound secured by Jaren George.

[10:03] Team_060 possession (Score: 27-31)
Larry Westbrook drives to the basket... Larry Westbrook throws a bad pass! Stolen by Draymond Dosunmu! TURNOVER! (live ball)

[09:47] Team_077 possession (Score: 27-31)
Dejounte Allen drives to the basket... FOUL! Offensive foul on Dejounte Allen! Jaren George drew the charge! [Team fouls: 3] (Dejounte Allen: 1 personal fouls) TURNOVER! (dead ball)

[09:30] Team_060 possession (Score: 27-31)
FOUL! Holding foul on Chris Ginobili. [Team fouls: 4] No free throws, side out. (Chris Ginobili: 1 personal fouls)

[09:17] Team_060 possession (Score: 27-31)
FOUL! Holding foul on Ja Ball. [IN THE BONUS! 5 team fouls] Joel Morant to the line for 2 free throws. (Ja Ball: 1 personal fouls)   FT 1/2: GOOD   FT 2/2: MISS Joel Morant makes 1/2 from the line. Rebound secured by Chris Ginobili.
Score: 27-32

[09:01] Team_077 possession (Score: 27-32)
Draymond Dosunmu attempts a Midrange. Contested by Jaren George (5.0 feet, MAN). DRAYMOND DOSUNMU MAKES IT!
Score: 29-32

[08:43] Team_060 possession (Score: 29-32)
Julius Green attempts a Midrange. Contested by Russell Harden (4.5 feet, ZONE). JULIUS GREEN MAKES IT! Assist: Jaren George
Score: 29-34

[08:28] Team_077 possession (Score: 29-34)
Dejounte Allen drives to the basket... Dejounte Allen throws a bad pass! Stolen by Jaren George! TURNOVER! (live ball)

[08:16] Team_060 possession (Score: 29-34)
FOUL! Holding foul on Dejounte Allen. [IN THE BONUS! 6 team fouls] Julius Green to the line for 2 free throws. (Dejounte Allen: 2 personal fouls)   FT 1/2: GOOD   FT 2/2: MISS Julius Green makes 1/2 from the line. Rebound secured by Chris Ginobili.
Score: 29-35

[08:01] Team_077 possession (Score: 29-35)
Russell Harden attempts a 3Pt. Contested by Larry Westbrook (5.5 feet, MAN). Russell Harden misses. Rebound secured by Larry Westbrook.

[07:50] Team_060 possession (Score: 29-35)
Julius Green attempts a 3Pt. Contested by Ja Ball (4.6 feet, ZONE). Julius Green misses. Rebound secured by Chris Ginobili.

[07:38] Team_077 possession (Score: 29-35)
Dejounte Allen drives and kicks out. Ja Ball attempts a 3Pt. Contested by Julius Green (4.2 feet, ZONE). Ja Ball misses. Offensive rebound by Chris Ginobili! Chris Ginobili kicks it out.

[07:22] Team_077 possession (Score: 29-35)
Draymond Dosunmu attempts a 3Pt. Contested by Jaren George (5.2 feet, MAN). Draymond Dosunmu misses. Rebound secured by Immanuel Ming.

[07:05] Team_060 possession (Score: 29-35)
Joel Morant attempts a Midrange. Contested by Ja Ball (4.6 feet, MAN). JOEL MORANT MAKES IT! Assist: Jaren George
Score: 29-37

[06:52] Team_077 possession (Score: 29-37)
Draymond Dosunmu drives, Jaren George stays with him. Draymond Dosunmu attempts a Dunk. Contested by Jaren George (5.2 feet, ZONE). DRAYMOND DOSUNMU MAKES IT! Assist: Chris Ginobili
Score: 31-37

[06:37] Team_060 possession (Score: 31-37)
FOUL! Shooting foul on Russell Harden. Larry Westbrook to the line for 2 free throws. [BONUS: 7 team fouls] (Russell Harden: 2 personal fouls)   FT 1/2: GOOD   FT 2/2: GOOD Larry Westbrook makes 2/2 from the line.
Score: 31-39

[06:20] Team_077 possession (Score: 31-39)
Draymond Dosunmu attempts a Layup. Contested by Jaren George (5.3 feet, MAN). DRAYMOND DOSUNMU MAKES IT! Assist: Russell Harden
Score: 33-39

[06:03] Team_060 possession (Score: 33-39)
Larry Westbrook attempts a 3Pt. Contested by Russell Harden (5.5 feet, MAN). Larry Westbrook misses. Rebound secured by Chris Ginobili.

[05:51] Team_077 possession (Score: 33-39)
Ja Ball drives and kicks out. Russell Harden attempts a 3Pt. Contested by Larry Westbrook (5.3 feet, MAN). Russell Harden misses. Rebound secured by Immanuel Ming.

[05:38] Team_060 possession (Score: 33-39)
FOUL! Shooting foul on Ja Ball. Jaren George to the line for 3 free throws. [BONUS: 8 team fouls] (Ja Ball: 2 personal fouls)   FT 1/3: MISS   FT 2/3: GOOD   FT 3/3: MISS Jaren George makes 1/3 from the line. Rebound secured by Russell Harden.
Score: 33-40

[05:26] Team_077 possession (Score: 33-40)
Draymond Dosunmu attempts a Midrange. Contested by Jaren George (5.4 feet, MAN). DRAYMOND DOSUNMU MAKES IT! Assist: Ja Ball
Score: 35-40

[05:14] Team_060 possession (Score: 35-40)
Jaren George drives and kicks out. Jaren George attempts a 3Pt. Contested by Chris Ginobili (4.6 feet, ZONE). Jaren George misses. Rebound secured by Draymond Dosunmu.

[04:57] Team_077 possession (Score: 35-40)
Russell Harden drives, Jaren George stays with him. Russell Harden attempts a Layup. Wide open! Jaren George is 6.3 feet away. [ZONE] RUSSELL HARDEN MAKES IT!
Score: 37-40

[04:42] Team_060 possession (Score: 37-40)
Jaren George drives, Draymond Dosunmu stays with him. Jaren George attempts a Dunk. Contested by Draymond Dosunmu (5.6 feet, ZONE). Jaren George misses. Rebound secured by Chris Ginobili.

[04:24] Team_077 possession (Score: 37-40)
Chris Ginobili attempts a Midrange. Contested by Immanuel Ming (5.3 feet, MAN). Chris Ginobili misses. Rebound secured by Immanuel Ming.

[04:05] Team_060 possession (Score: 37-40)
Larry Westbrook attempts a 3Pt. Contested by Russell Harden (5.7 feet, MAN). Larry Westbrook misses. Offensive rebound by Jaren George! Jaren George kicks it out.

[03:51] Team_060 possession (Score: 37-40)
Julius Green makes the Layup and draws the foul on Draymond Dosunmu! And-1! Julius Green to the line for 1. [BONUS: 9 team fouls] (Draymond Dosunmu: 2 personal fouls)   FT 1/1: GOOD Julius Green makes 1/1 from the line.
Score: 37-43

[03:36] Team_077 possession (Score: 37-43)
Dejounte Allen attempts a 3Pt. Contested by Julius Green (5.0 feet, MAN). Dejounte Allen misses. Rebound secured by Jaren George.

[03:23] Team_060 possession (Score: 37-43)
Joel Morant makes the Dunk and draws the foul on Draymond Dosunmu! And-1! Joel Morant to the line for 1. [BONUS: 10 team fouls] (Draymond Dosunmu: 3 personal fouls)   FT 1/1: GOOD Joel Morant makes 1/1 from the line.
Score: 37-46

[03:10] Team_077 possession (Score: 37-46)
Chris Ginobili attempts a 3Pt. Contested by Immanuel Ming (5.5 feet, ZONE). Chris Ginobili misses. Rebound secured by Jaren George.

[02:54] Team_060 possession (Score: 37-46)
Julius Green attempts a Midrange. Contested by Dejounte Allen (5.1 feet, MAN). Julius Green misses. Offensive rebound by Jaren George! Jaren George kicks it out.

[02:42] Team_060 possession (Score: 37-46)
Jaren George makes the Layup and draws the foul on Draymond Dosunmu! And-1! Jaren George to the line for 1. [BONUS: 11 team fouls] (Draymond Dosunmu: 4 personal fouls)   FT 1/1: GOOD Jaren George makes 1/1 from the line.
Score: 37-49

[02:23] Team_077 possession (Score: 37-49)
Ja Ball attempts a 3Pt. Wide open! Joel Morant is 6.5 feet away. [MAN] Ja Ball misses. Offensive rebound by Chris Ginobili! Chris Ginobili kicks it out.

[02:09] Team_077 possession (Score: 37-49)
Russell Harden attempts a Midrange. Wide open! Larry Westbrook is 6.2 feet away. [MAN] RUSSELL HARDEN MAKES IT! Assist: Chris Ginobili
Score: 39-49

[01:58] Team_060 possession (Score: 39-49)
Immanuel Ming loses control! Ball rolls out of bounds! TURNOVER! (dead ball)

[01:58] Substitution (Team_077): Ja Ball OUT → Bam Bryant IN (stamina_rule2)

[01:58] Substitution (Team_077): Dejounte Allen OUT → Dejounte Quickley IN (stamina_rule2)

[01:58] Substitution (Team_077): Chris Ginobili OUT → Tyler Poole IN (stamina_rule2)

[01:58] Substitution (Team_077): Russell Harden OUT → Jordan Simmons IN (stamina_rule2)

[01:58] Substitution (Team_077): Draymond Dosunmu OUT → Ayo Griffin IN (stamina_rule2)

[01:58] Substitution (Team_060): Joel Morant OUT → Domantas Barnes IN (stamina_rule2)

[01:58] Substitution (Team_060): Julius Green OUT → Rudy Ginobili IN (stamina_rule2)

[01:58] Substitution (Team_060): Immanuel Ming OUT → Jarrett Wagner IN (stamina_rule2)

[01:58] Substitution (Team_060): Larry Westbrook OUT → Yao Tatum IN (stamina_rule2)

[01:58] Substitution (Team_060): Jaren George OUT → Klay Haliburton IN (stamina_rule2)

[01:43] Team_077 possession (Score: 39-49)
FOUL! Shooting foul on Klay Haliburton. Ayo Griffin to the line for 2 free throws. [Team fouls: 1] (Klay Haliburton: 1 personal fouls)   FT 1/2: GOOD   FT 2/2: MISS Ayo Griffin makes 1/2 from the line. Rebound secured by Klay Haliburton.
Score: 40-49

[01:28] Team_060 possession (Score: 40-49)
Rudy Ginobili attempts a 3Pt. Contested by Dejounte Quickley (4.5 feet, MAN). Rudy Ginobili misses. Rebound secured by Tyler Poole.

[01:14] Team_077 possession (Score: 40-49)
FOUL! Reach-in foul on Rudy Ginobili during the drive. [Team fouls: 2] No free throws, side out. (Rudy Ginobili: 1 personal fouls)

[01:03] Team_077 possession (Score: 40-49)
FOUL! Shooting foul on Klay Haliburton. Ayo Griffin to the line for 2 free throws. [Team fouls: 3] (Klay Haliburton: 2 personal fouls)   FT 1/2: GOOD   FT 2/2: MISS Ayo Griffin makes 1/2 from the line. Offensive rebound by Jordan Simmons! Jordan Simmons kicks it out.
Score: 41-49

[00:48] Team_077 possession (Score: 41-49)
Tyler Poole attempts a Layup. Contested by Jarrett Wagner (5.2 feet, MAN). Tyler Poole misses. Rebound secured by Klay Haliburton.

[00:37] Team_060 possession (Score: 41-49)
FOUL! Offensive foul on Domantas Barnes! Bam Bryant drew the charge! [Team fouls: 4] (Domantas Barnes: 1 personal fouls) TURNOVER! (dead ball)

[00:23] Team_077 possession (Score: 41-49)
Jordan Simmons attempts a Midrange. Contested by Jarrett Wagner (5.3 feet, ZONE). Jordan Simmons misses. Rebound secured by Klay Haliburton.

[00:08] Team_060 possession (Score: 41-49)
Domantas Barnes attempts a 3Pt. Contested by Dejounte Quickley (4.2 feet, ZONE). DOMANTAS BARNES MAKES IT! Assist: Yao Tatum
Score: 41-52

================================================================================
                              2ND QUARTER COMPLETE                              
================================================================================

2ND QUARTER SCORE: Team_077 14, Team_060 26

BOX SCORE:
================================================================================

Team_077
--------------------------------------------------------------------------------
Player                MIN  PTS  REB  AST  TO      FG   FG%      3P   3P%
--------------------------------------------------------------------------------
Draymond Dosunmu       22    8    1    0   0   4/5    80.0     0/0   0.0
Russell Harden         20    4    2    1   0   2/6    33.3     0/0   0.0
Dejounte Allen         22    0    0    0   0   0/2     0.0     0/0   0.0
Chris Ginobili         20    0    7    2   0   0/2     0.0     0/0   0.0
Ja Ball                22    0    0    1   0   0/1     0.0     0/0   0.0
Ayo Griffin             2    0    0    0   0   0/1     0.0     0/0   0.0
Tyler Poole             4    0    1    0   0   0/1     0.0     0/0   0.0
Jordan Simmons          4    0    1    0   0   0/1     0.0     0/0   0.0

TEAM: FG: 6/19 (31.6%), 3PT: 0/4 (0.0%), REB: 12 (3 off, 9 def), AST: 4, TO: 2
TEAM FOULS: 11 [Team_060 in BONUS]


Team_060
--------------------------------------------------------------------------------
Player                MIN  PTS  REB  AST  TO      FG   FG%      3P   3P%
--------------------------------------------------------------------------------
Joel Morant            19    7    0    0   0   3/4    75.0     0/0   0.0
Larry Westbrook        19    5    1    0   0   2/3    66.7     0/0   0.0
Julius Green           20    5    0    0   0   2/3    66.7     0/0   0.0
Jaren George           19    3    7    2   0   1/4    25.0     0/0   0.0
Domantas Barnes         5    3    0    0   0   1/1   100.0     0/0   0.0
Immanuel Ming          22    0    4    0   0   0/0     0.0     0/0   0.0
Klay Haliburton         5    0    3    0   0   0/0     0.0     0/0   0.0
Rudy Ginobili           4    0    0    0   0   0/1     0.0     0/0   0.0
Yao Tatum               5    0    0    1   0   0/0     0.0     0/0   0.0

TEAM: FG: 9/18 (50.0%), 3PT: 1/5 (20.0%), REB: 15 (2 off, 13 def), AST: 3, TO: 3
TEAM FOULS: 4

================================================================================

================================================================================
                       3RD QUARTER - Team_077 vs Team_060                       
================================================================================

[12:00] Team_077 possession (Score: 41-52)
Ja Ball attempts a 3Pt. Contested by Julius Green (4.2 feet, ZONE). Ja Ball misses. Rebound secured by Jaren George.

[11:47] Team_060 possession (Score: 41-52)
Joel Morant attempts a 3Pt. Contested by Russell Harden (4.1 feet, ZONE). Joel Morant misses. FOUL! Loose ball foul on Russell Harden during the rebound battle. [Team fouls: 1] No free throws, side out. (Russell Harden: 1 personal fouls)

[11:32] Team_060 possession (Score: 41-52)
Joel Morant attempts a 3Pt. Contested by Ja Ball (3.8 feet, MAN). Joel Morant misses. Rebound secured by Russell Harden.

[11:18] Team_077 possession (Score: 41-52)
Draymond Dosunmu attempts a Midrange. Contested by Jaren George (4.8 feet, MAN). DRAYMOND DOSUNMU MAKES IT! Assist: Ja Ball
Score: 43-52

[11:01] Team_060 possession (Score: 43-52)
FOUL! Reach-in foul on Russell Harden during the drive. [Team fouls: 2] No free throws, side out. (Russell Harden: 2 personal fouls)

[10:46] Team_060 possession (Score: 43-52)
Immanuel Ming attempts a 3Pt. Contested by Dejounte Allen (3.7 feet, ZONE). Immanuel Ming misses. Rebound secured by Chris Ginobili.

[10:36] Team_077 possession (Score: 43-52)
Ja Ball attempts a 3Pt. Contested by Joel Morant (5.7 feet, MAN). Ja Ball misses. Rebound secured by Immanuel Ming.

[10:22] Team_060 possession (Score: 43-52)
Jaren George attempts a Layup. Contested by Draymond Dosunmu (4.5 feet, MAN). JAREN GEORGE MAKES IT! Assist: Larry Westbrook
Score: 43-54

[10:09] Team_077 possession (Score: 43-54)
Draymond Dosunmu drives and kicks out. Draymond Dosunmu attempts a Midrange. Contested by Jaren George (5.2 feet, MAN). Draymond Dosunmu misses. Rebound secured by Jaren George.

[09:54] Team_060 possession (Score: 43-54)
Jaren George attempts a Midrange. Contested by Draymond Dosunmu (4.5 feet, MAN). Jaren George misses. Rebound secured by Chris Ginobili.

[09:41] Team_077 possession (Score: 43-54)
Russell Harden attempts a 3Pt. Contested by Julius Green (4.3 feet, ZONE). Russell Harden misses. Rebound secured by Larry Westbrook.

[09:26] Team_060 possession (Score: 43-54)
Jaren George drives, picks up Draymond Dosunmu. Help arrives from Ja Ball! Jaren George attempts a Dunk. Contested by Ja Ball (4.5 feet, ZONE). Jaren George misses. Rebound secured by Draymond Dosunmu.

[09:12] Team_077 possession (Score: 43-54)
Dejounte Allen attempts a 3Pt. Contested by Julius Green (4.2 feet, ZONE). DEJOUNTE ALLEN MAKES IT!
Score: 46-54

[08:56] Team_060 possession (Score: 46-54)
Immanuel Ming drives and kicks out. Julius Green attempts a 3Pt. Contested by Dejounte Allen (3.7 feet, MAN). Julius Green misses. Rebound secured by Russell Harden.

[08:40] Team_077 possession (Score: 46-54)
Ja Ball attempts a 3Pt. Contested by Julius Green (4.2 feet, ZONE). JA BALL MAKES IT! Assist: Dejounte Allen
Score: 49-54

[08:25] Team_060 possession (Score: 49-54)
Joel Morant drives and kicks out. Immanuel Ming attempts a 3Pt. Contested by Russell Harden (4.4 feet, ZONE). Immanuel Ming misses. Rebound secured by Chris Ginobili.

[08:10] Team_077 possession (Score: 49-54)
Draymond Dosunmu drives and kicks out. Russell Harden attempts a 3Pt. Contested by Julius Green (3.8 feet, ZONE). Russell Harden misses. Offensive rebound by Draymond Dosunmu! Draymond Dosunmu kicks it out.

[08:01] Team_077 possession (Score: 49-54)
Russell Harden attempts a Midrange. Contested by Larry Westbrook (5.2 feet, MAN). RUSSELL HARDEN MAKES IT!
Score: 51-54

[07:44] Team_060 possession (Score: 51-54)
Larry Westbrook attempts a Layup. Contested by Russell Harden (4.9 feet, MAN). Larry Westbrook misses. Rebound secured by Russell Harden.

[07:34] Team_077 possession (Score: 51-54)
FOUL! Shooting foul on Jaren George. Draymond Dosunmu to the line for 2 free throws. [Team fouls: 1] (Jaren George: 1 personal fouls)   FT 1/2: GOOD   FT 2/2: GOOD Draymond Dosunmu makes 2/2 from the line.
Score: 53-54

[07:16] Team_060 possession (Score: 53-54)
FOUL! Holding foul on Draymond Dosunmu. [Team fouls: 3] No free throws, side out. (Draymond Dosunmu: 1 personal fouls)

[07:02] Team_060 possession (Score: 53-54)
Julius Green attempts a 3Pt. Contested by Dejounte Allen (3.5 feet, ZONE). Julius Green misses. Rebound secured by Russell Harden.

[06:50] Team_077 possession (Score: 53-54)
FOUL! Holding foul on Julius Green. [Team fouls: 2] No free throws, side out. (Julius Green: 1 personal fouls)

[06:34] Team_077 possession (Score: 53-54)
Russell Harden drives and kicks out. Russell Harden attempts a Midrange. Contested by Immanuel Ming (3.7 feet, ZONE). Russell Harden misses. Offensive rebound by Russell Harden! Russell Harden kicks it out.

[06:19] Team_077 possession (Score: 53-54)
Dejounte Allen attempts a 3Pt. Contested by Immanuel Ming (4.1 feet, ZONE). Dejounte Allen misses. Rebound secured by Jaren George.

[06:07] Team_060 possession (Score: 53-54)
Joel Morant attempts a Layup. BLOCKED BY DRAYMOND DOSUNMU! Ball is loose! Rebound secured by Chris Ginobili.

[05:52] Team_077 possession (Score: 53-54)
Draymond Dosunmu attempts a 3Pt. Contested by Jaren George (4.9 feet, MAN). Draymond Dosunmu misses. Rebound secured by Jaren George.

[05:37] Team_060 possession (Score: 53-54)
Immanuel Ming attempts a Midrange. Contested by Chris Ginobili (3.7 feet, MAN). Immanuel Ming misses. Rebound secured by Chris Ginobili.

[05:24] Team_077 possession (Score: 53-54)
Russell Harden drives, picks up Jaren George. Help arrives from Julius Green! Russell Harden attempts a Layup. Contested by Julius Green (5.8 feet, ZONE). RUSSELL HARDEN MAKES IT! Assist: Chris Ginobili
Score: 55-54

[05:06] Team_060 possession (Score: 55-54)
FOUL! Shooting foul on Russell Harden. Larry Westbrook to the line for 2 free throws. [Team fouls: 4] (Russell Harden: 3 personal fouls)   FT 1/2: GOOD   FT 2/2: GOOD Larry Westbrook makes 2/2 from the line.
Score: 55-56

[04:55] Team_077 possession (Score: 55-56)
Ja Ball makes the 3Pt and draws the foul on Joel Morant! And-1! Ja Ball to the line for 1. [Team fouls: 3] (Joel Morant: 1 personal fouls)   FT 1/1: GOOD Ja Ball makes 1/1 from the line.
Score: 59-56

[04:43] Team_060 possession (Score: 59-56)
Immanuel Ming attempts a 3Pt. Contested by Dejounte Allen (3.7 feet, ZONE). Immanuel Ming misses. Rebound secured by Draymond Dosunmu.

[04:27] Team_077 possession (Score: 59-56)
Dejounte Allen attempts a 3Pt. Contested by Julius Green (4.3 feet, MAN). Dejounte Allen misses. Rebound secured by Jaren George.

[04:15] Team_060 possession (Score: 59-56)
Larry Westbrook attempts a 3Pt. Contested by Dejounte Allen (4.3 feet, ZONE). Larry Westbrook misses. Rebound secured by Russell Harden.

[03:59] Team_077 possession (Score: 59-56)
Draymond Dosunmu attempts a Layup. Contested by Jaren George (5.0 feet, ZONE). DRAYMOND DOSUNMU MAKES IT! Assist: Chris Ginobili
Score: 61-56

[03:44] Team_060 possession (Score: 61-56)
Jaren George makes the Layup and draws the foul on Draymond Dosunmu! And-1! Jaren George to the line for 1. [BONUS: 5 team fouls] (Draymond Dosunmu: 2 personal fouls)   FT 1/1: GOOD Jaren George makes 1/1 from the line.
Score: 61-59

[03:31] Team_077 possession (Score: 61-59)
Draymond Dosunmu drives to the basket... Draymond Dosunmu loses control! Ball rolls out of bounds! TURNOVER! (dead ball)

[03:31] Substitution (Team_060): Joel Morant OUT → Domantas Barnes IN (stamina_rule2)

[03:31] Substitution (Team_060): Larry Westbrook OUT → Yao Tatum IN (stamina_rule2)

[03:31] Substitution (Team_060): Jaren George OUT → Klay Haliburton IN (stamina_rule2)

[03:17] Team_060 possession (Score: 61-59)
Klay Haliburton attempts a Midrange. Contested by Draymond Dosunmu (4.8 feet, MAN). KLAY HALIBURTON MAKES IT!
Score: 61-61

[03:04] Team_077 possession (Score: 61-61)
Russell Harden makes the Midrange and draws the foul on Yao Tatum! And-1! Russell Harden to the line for 1. [Team fouls: 4] (Yao Tatum: 1 personal fouls)   FT 1/1: GOOD Russell Harden makes 1/1 from the line.
Score: 64-61

[02:49] Team_060 possession (Score: 64-61)
Immanuel Ming attempts a 3Pt. Contested by Dejounte Allen (3.9 feet, ZONE). Immanuel Ming misses. Offensive rebound by Immanuel Ming! Immanuel Ming kicks it out.

[02:35] Team_060 possession (Score: 64-61)
Domantas Barnes attempts a 3Pt. Contested by Ja Ball (4.3 feet, MAN). Domantas Barnes misses. Rebound secured by Draymond Dosunmu.

[02:19] Team_077 possession (Score: 64-61)
Ja Ball attempts a Midrange. Contested by Yao Tatum (5.6 feet, ZONE). Ja Ball misses. Rebound secured by Immanuel Ming.

[02:06] Team_060 possession (Score: 64-61)
Immanuel Ming drives and kicks out. Domantas Barnes attempts a 3Pt. Contested by Ja Ball (4.4 feet, MAN). Domantas Barnes misses. Offensive rebound by Klay Haliburton! Klay Haliburton's putback is no good. Rebound secured by Draymond Dosunmu.

[01:51] Team_077 possession (Score: 64-61)
Dejounte Allen drives to the basket... FOUL! Offensive foul on Dejounte Allen! Julius Green drew the charge! [Team fouls: 6] (Dejounte Allen: 1 personal fouls) TURNOVER! (dead ball)

[01:37] Team_060 possession (Score: 64-61)
Yao Tatum attempts a 3Pt. Contested by Dejounte Allen (4.1 feet, ZONE). Yao Tatum misses. Rebound secured by Russell Harden.

[01:26] Team_077 possession (Score: 64-61)
Draymond Dosunmu drives to the basket... Draymond Dosunmu loses the ball! Stripped by Klay Haliburton! TURNOVER! (live ball)

[01:10] Team_060 possession (Score: 64-61)
Immanuel Ming loses control! Ball rolls out of bounds! TURNOVER! (dead ball)

[01:10] Substitution (Team_077): Ja Ball OUT → Bam Bryant IN (stamina_rule2)

[01:10] Substitution (Team_077): Dejounte Allen OUT → Dejounte Quickley IN (stamina_rule2)

[01:10] Substitution (Team_077): Chris Ginobili OUT → Tyler Poole IN (stamina_rule2)

[01:10] Substitution (Team_077): Russell Harden OUT → Jordan Simmons IN (stamina_rule2)

[01:10] Substitution (Team_077): Draymond Dosunmu OUT → Ayo Griffin IN (stamina_rule2)

[01:10] Substitution (Team_060): Julius Green OUT → Rudy Ginobili IN (stamina_rule2)

[01:10] Substitution (Team_060): Immanuel Ming OUT → Jarrett Wagner IN (stamina_rule2)

[00:54] Team_077 possession (Score: 64-61)
Bam Bryant drives and kicks out. Dejounte Quickley attempts a 3Pt. Contested by Jarrett Wagner (4.8 feet, ZONE). DEJOUNTE QUICKLEY MAKES IT! Assist: Tyler Poole
Score: 67-61

[00:39] Team_060 possession (Score: 67-61)
Domantas Barnes attempts a Midrange. Contested by Jordan Simmons (3.9 feet, ZONE). Domantas Barnes misses. Rebound secured by Tyler Poole.

[00:26] Team_077 possession (Score: 67-61)
Jordan Simmons attempts a Layup. Contested by Yao Tatum (5.7 feet, MAN). JORDAN SIMMONS MAKES IT!
Score: 69-61

[00:13] Team_060 possession (Score: 69-61)
Jarrett Wagner attempts a Midrange. Contested by Tyler Poole (4.3 feet, MAN). JARRETT WAGNER MAKES IT!
Score: 69-63

[00:02] Team_077 possession (Score: 69-63)
Tyler Poole drives, Yao Tatum stays with him. Tyler Poole attempts a Layup. Contested by Yao Tatum (5.6 feet, ZONE). TYLER POOLE MAKES IT!
Score: 71-63

================================================================================
                              3RD QUARTER COMPLETE                              
================================================================================

3RD QUARTER SCORE: Team_077 30, Team_060 11

BOX SCORE:
================================================================================

Team_077
--------------------------------------------------------------------------------
Player                MIN  PTS  REB  AST  TO      FG   FG%      3P   3P%
--------------------------------------------------------------------------------
Ja Ball                33    7    0    1   0   2/5    40.0     0/0   0.0
Russell Harden         31    7    7    0   0   3/4    75.0     0/0   0.0
Dejounte Allen         33    3    0    1   0   1/3    33.3     0/0   0.0
Dejounte Quickley       3    3    0    0   0   1/1   100.0     0/0   0.0
Tyler Poole             5    2    1    1   0   1/1   100.0     0/0   0.0
Jordan Simmons          5    2    0    0   0   1/1   100.0     0/0   0.0
Chris Ginobili         31    0    5    2   0   0/0     0.0     0/0   0.0

TEAM: FG: 12/20 (60.0%), 3PT: 3/9 (33.3%), REB: 17 (2 off, 15 def), AST: 5, TO: 3
TEAM FOULS: 6 [Team_060 in BONUS]


Team_060
--------------------------------------------------------------------------------
Player                MIN  PTS  REB  AST  TO      FG   FG%      3P   3P%
--------------------------------------------------------------------------------
Draymond Dosunmu       33    6    5    0   0   3/5    60.0     0/0   0.0
Jaren George           28    5    5    0   0   2/4    50.0     0/0   0.0
Larry Westbrook        28    2    1    1   0   1/3    33.3     0/0   0.0
Klay Haliburton         9    2    0    0   0   1/1   100.0     0/0   0.0
Jarrett Wagner          3    2    0    0   0   1/1   100.0     0/0   0.0
Immanuel Ming          33    0    4    0   0   0/5     0.0     0/0   0.0
Joel Morant            28    0    0    0   0   0/3     0.0     0/0   0.0
Julius Green           31    0    0    0   0   0/1     0.0     0/0   0.0
Domantas Barnes         9    0    0    0   0   0/2     0.0     0/0   0.0
Yao Tatum               9    0    0    0   0   0/1     0.0     0/0   0.0

TEAM: FG: 5/21 (23.8%), 3PT: 0/7 (0.0%), REB: 11 (3 off, 8 def), AST: 1, TO: 1
TEAM FOULS: 4

================================================================================

================================================================================
                       4TH QUARTER - Team_077 vs Team_060                       
================================================================================

[12:00] Team_077 possession (Score: 71-63)
Chris Ginobili attempts a 3Pt. Contested by Immanuel Ming (4.3 feet, MAN). CHRIS GINOBILI MAKES IT! Assist: Russell Harden
Score: 74-63

[11:44] Team_060 possession (Score: 74-63)
Immanuel Ming attempts a 3Pt. Contested by Chris Ginobili (3.9 feet, MAN). Immanuel Ming misses. Offensive rebound by Jaren George! Jaren George puts it back in!
Score: 74-65

[11:28] Team_077 possession (Score: 74-65)
Chris Ginobili attempts a 3Pt. Contested by Immanuel Ming (4.3 feet, ZONE). CHRIS GINOBILI MAKES IT! Assist: Dejounte Allen
Score: 77-65

[11:10] Team_060 possession (Score: 77-65)
FOUL! Shooting foul on Russell Harden. Jaren George to the line for 2 free throws. [Team fouls: 1] (Russell Harden: 1 personal fouls)   FT 1/2: GOOD   FT 2/2: MISS Jaren George makes 1/2 from the line. Rebound secured by Russell Harden.
Score: 77-66

[10:56] Team_077 possession (Score: 77-66)
FOUL! Shooting foul on Immanuel Ming. Chris Ginobili to the line for 2 free throws. [Team fouls: 1] (Immanuel Ming: 1 personal fouls)   FT 1/2: MISS   FT 2/2: GOOD Chris Ginobili makes 1/2 from the line.
Score: 78-66

[10:43] Team_060 possession (Score: 78-66)
Larry Westbrook drives, Draymond Dosunmu stays with him. Larry Westbrook attempts a Dunk. Contested by Draymond Dosunmu (5.1 feet, ZONE). Larry Westbrook misses. Offensive rebound by Immanuel Ming! Immanuel Ming kicks it out.

[10:30] Team_060 possession (Score: 78-66)
Joel Morant attempts a Midrange. Contested by Chris Ginobili (3.8 feet, ZONE). JOEL MORANT MAKES IT! Assist: Larry Westbrook
Score: 78-68

[10:14] Team_077 possession (Score: 78-68)
Russell Harden attempts a Layup. Contested by Larry Westbrook (5.2 feet, MAN). Russell Harden misses. Rebound secured by Larry Westbrook.

[09:57] Team_060 possession (Score: 78-68)
Jaren George drives and kicks out. Jaren George attempts a 3Pt. Contested by Draymond Dosunmu (4.7 feet, MAN). JAREN GEORGE MAKES IT! Assist: Julius Green
Score: 78-71

[09:43] Team_077 possession (Score: 78-71)
Ja Ball attempts a 3Pt. Contested by Joel Morant (5.8 feet, MAN). JA BALL MAKES IT! Assist: Draymond Dosunmu
Score: 81-71

[09:29] Team_060 possession (Score: 81-71)
Immanuel Ming drives, picks up Draymond Dosunmu. Help arrives from Ja Ball! Immanuel Ming attempts a Layup. Contested by Ja Ball (4.7 feet, ZONE). Immanuel Ming misses. Offensive rebound by Immanuel Ming! Immanuel Ming kicks it out.

[09:13] Team_060 possession (Score: 81-71)
FOUL! Shooting foul on Dejounte Allen. Julius Green to the line for 2 free throws. [Team fouls: 2] (Dejounte Allen: 1 personal fouls)   FT 1/2: GOOD   FT 2/2: GOOD Julius Green makes 2/2 from the line.
Score: 81-73

[09:02] Team_077 possession (Score: 81-73)
Russell Harden attempts a Layup. BLOCKED BY JAREN GEORGE! Ball is loose! Rebound secured by Jaren George.

[08:50] Team_060 possession (Score: 81-73)
Larry Westbrook drives and kicks out. Larry Westbrook attempts a 3Pt. Contested by Dejounte Allen (4.2 feet, ZONE). Larry Westbrook misses. Offensive rebound by Immanuel Ming! Immanuel Ming kicks it out.

[08:38] Team_060 possession (Score: 81-73)
Joel Morant attempts a Layup. BLOCKED BY JA BALL! Ball is loose! Rebound secured by Russell Harden.

[08:22] Team_077 possession (Score: 81-73)
Ja Ball drives, Joel Morant stays with him. Ja Ball attempts a Dunk. Contested by Joel Morant (5.9 feet, MAN). JA BALL MAKES IT!
Score: 83-73

[08:10] Team_060 possession (Score: 83-73)
Jaren George attempts a Layup. Contested by Draymond Dosunmu (5.0 feet, MAN). JAREN GEORGE MAKES IT!
Score: 83-75

[07:58] Team_077 possession (Score: 83-75)
Russell Harden drives, Jaren George stays with him. Russell Harden attempts a Dunk. Contested by Jaren George (6.0 feet, ZONE). RUSSELL HARDEN MAKES IT!
Score: 85-75

[07:41] Team_060 possession (Score: 85-75)
Immanuel Ming attempts a Midrange. Contested by Chris Ginobili (4.4 feet, MAN). Immanuel Ming misses. Rebound secured by Chris Ginobili.

[07:25] Team_077 possession (Score: 85-75)
Draymond Dosunmu attempts a Midrange. Contested by Julius Green (4.1 feet, ZONE). Draymond Dosunmu misses. Rebound secured by Larry Westbrook.

[07:13] Team_060 possession (Score: 85-75)
Jaren George drives, Draymond Dosunmu stays with him. Jaren George attempts a Layup. Contested by Draymond Dosunmu (5.1 feet, ZONE). Jaren George misses. Offensive rebound by Jaren George! Jaren George puts it back in!
Score: 85-77

[07:01] Team_077 possession (Score: 85-77)
Ja Ball attempts a 3Pt. Contested by Julius Green (4.9 feet, ZONE). JA BALL MAKES IT! Assist: Russell Harden
Score: 88-77

[06:46] Team_060 possession (Score: 88-77)
Larry Westbrook attempts a 3Pt. Contested by Russell Harden (5.7 feet, MAN). LARRY WESTBROOK MAKES IT! Assist: Immanuel Ming
Score: 88-80

[06:31] Team_077 possession (Score: 88-80)
Ja Ball drives and kicks out. Dejounte Allen attempts a 3Pt. Contested by Julius Green (4.7 feet, MAN). DEJOUNTE ALLEN MAKES IT! Assist: Ja Ball
Score: 91-80

[06:18] Team_060 possession (Score: 91-80)
Julius Green attempts a Layup. Contested by Dejounte Allen (4.3 feet, MAN). JULIUS GREEN MAKES IT! Assist: Joel Morant
Score: 91-82

[06:06] Team_077 possession (Score: 91-82)
FOUL! Holding foul on Larry Westbrook. [Team fouls: 2] No free throws, side out. (Larry Westbrook: 1 personal fouls)

[05:52] Team_077 possession (Score: 91-82)
Dejounte Allen attempts a Layup. Contested by Julius Green (5.1 feet, MAN). DEJOUNTE ALLEN MAKES IT! Assist: Chris Ginobili
Score: 93-82

[05:37] Team_060 possession (Score: 93-82)
Larry Westbrook drives and kicks out. Larry Westbrook attempts a Midrange. Contested by Dejounte Allen (4.7 feet, ZONE). LARRY WESTBROOK MAKES IT! Assist: Joel Morant
Score: 93-84

[05:24] Team_077 possession (Score: 93-84)
Chris Ginobili attempts a Midrange. Contested by Immanuel Ming (4.9 feet, MAN). Chris Ginobili misses. Rebound secured by Jaren George.

[05:13] Team_060 possession (Score: 93-84)
Julius Green drives and kicks out. Immanuel Ming attempts a Midrange. Contested by Chris Ginobili (5.0 feet, ZONE). IMMANUEL MING MAKES IT! Assist: Julius Green
Score: 93-86

[05:00] Team_077 possession (Score: 93-86)
FOUL! Holding foul on Joel Morant. [Team fouls: 3] No free throws, side out. (Joel Morant: 1 personal fouls)

[04:44] Team_077 possession (Score: 93-86)
Chris Ginobili attempts a Midrange. Contested by Larry Westbrook (5.8 feet, ZONE). CHRIS GINOBILI MAKES IT! Assist: Draymond Dosunmu
Score: 95-86

[04:29] Team_060 possession (Score: 95-86)
Julius Green drives, Draymond Dosunmu stays with him. Julius Green attempts a Dunk. Contested by Draymond Dosunmu (5.1 feet, ZONE). JULIUS GREEN MAKES IT!
Score: 95-88

[04:16] Team_077 possession (Score: 95-88)
Ja Ball attempts a Layup. Wide open! Jaren George is 6.3 feet away. [ZONE] JA BALL MAKES IT! Assist: Draymond Dosunmu
Score: 97-88

[04:00] Team_060 possession (Score: 97-88)
Larry Westbrook drives, picks up Russell Harden. Help arrives from Ja Ball! Larry Westbrook attempts a Layup. Wide open! Ja Ball is 6.0 feet away. [MAN] LARRY WESTBROOK MAKES IT! Assist: Joel Morant
Score: 97-90

[03:46] Team_077 possession (Score: 97-90)
Chris Ginobili makes the Layup and draws the foul on Immanuel Ming! And-1! Chris Ginobili to the line for 1. [Team fouls: 4] (Immanuel Ming: 2 personal fouls)   FT 1/1: GOOD Chris Ginobili makes 1/1 from the line.
Score: 100-90

[03:31] Team_060 possession (Score: 100-90)
Joel Morant attempts a Layup. Contested by Draymond Dosunmu (5.2 feet, ZONE). Joel Morant misses. Rebound secured by Draymond Dosunmu.

[03:14] Team_077 possession (Score: 100-90)
Draymond Dosunmu makes the Layup and draws the foul on Jaren George! And-1! Draymond Dosunmu to the line for 1. [BONUS: 5 team fouls] (Jaren George: 1 personal fouls)   FT 1/1: GOOD Draymond Dosunmu makes 1/1 from the line.
Score: 103-90

[02:58] Team_060 possession (Score: 103-90)
Joel Morant attempts a 3Pt. Contested by Ja Ball (4.9 feet, ZONE). Joel Morant misses. Rebound secured by Chris Ginobili.

[02:45] Team_077 possession (Score: 103-90)
Ja Ball attempts a 3Pt. Contested by Immanuel Ming (5.2 feet, ZONE). JA BALL MAKES IT! Assist: Chris Ginobili
Score: 106-90

[02:33] Team_060 possession (Score: 106-90)
Immanuel Ming attempts a 3Pt. Contested by Chris Ginobili (5.2 feet, MAN). Immanuel Ming misses. Rebound secured by Draymond Dosunmu.

[02:17] Team_077 possession (Score: 106-90)
Ja Ball attempts a 3Pt. Wide open! Joel Morant is 6.6 feet away. [MAN] Ja Ball misses. Rebound secured by Larry Westbrook.

[02:04] Team_060 possession (Score: 106-90)
Julius Green loses control! Ball rolls out of bounds! TURNOVER! (dead ball)

[02:04] Substitution (Team_077): Ja Ball OUT → Bam Bryant IN (stamina_rule2)

[02:04] Substitution (Team_077): Dejounte Allen OUT → Dejounte Quickley IN (stamina_rule2)

[02:04] Substitution (Team_077): Chris Ginobili OUT → Tyler Poole IN (stamina_rule2)

[02:04] Substitution (Team_077): Russell Harden OUT → Jordan Simmons IN (stamina_rule2)

[02:04] Substitution (Team_077): Draymond Dosunmu OUT → Ayo Griffin IN (stamina_rule2)

[02:04] Substitution (Team_060): Joel Morant OUT → Domantas Barnes IN (stamina_rule2)

[02:04] Substitution (Team_060): Julius Green OUT → Rudy Ginobili IN (stamina_rule2)

[02:04] Substitution (Team_060): Immanuel Ming OUT → Jarrett Wagner IN (stamina_rule2)

[02:04] Substitution (Team_060): Larry Westbrook OUT → Yao Tatum IN (stamina_rule2)

[02:04] Substitution (Team_060): Jaren George OUT → Klay Haliburton IN (stamina_rule2)

[01:54] Team_077 possession (Score: 106-90)
Bam Bryant drives to the basket... Bam Bryant throws a bad pass out of bounds! TURNOVER! (dead ball)

[01:42] Team_060 possession (Score: 106-90)
Jarrett Wagner drives and kicks out. Rudy Ginobili attempts a Midrange. Contested by Jordan Simmons (4.0 feet, ZONE). Rudy Ginobili misses. Offensive rebound by Domantas Barnes! Domantas Barnes kicks it out.

[01:22] Team_060 possession (Score: 106-90)
Jarrett Wagner attempts a Midrange. Contested by Tyler Poole (4.3 feet, MAN). JARRETT WAGNER MAKES IT!
Score: 106-92

[01:13] Team_077 possession (Score: 106-92)
Ayo Griffin drives, Klay Haliburton stays with him. Ayo Griffin attempts a Dunk. Contested by Klay Haliburton (4.1 feet, MAN). Ayo Griffin misses. Rebound secured by Klay Haliburton.

[01:02] Team_060 possession (Score: 106-92)
Yao Tatum attempts a Midrange. Contested by Tyler Poole (4.2 feet, ZONE). YAO TATUM MAKES IT! Assist: Rudy Ginobili
Score: 106-94

[00:50] Team_077 possession (Score: 106-94)
FOUL! Shooting foul on Yao Tatum. Jordan Simmons to the line for 2 free throws. [BONUS: 6 team fouls] (Yao Tatum: 1 personal fouls)   FT 1/2: GOOD   FT 2/2: MISS Jordan Simmons makes 1/2 from the line. Rebound secured by Domantas Barnes.
Score: 107-94

[00:35] Team_060 possession (Score: 107-94)
Yao Tatum attempts a 3Pt. Contested by Dejounte Quickley (4.3 feet, ZONE). Yao Tatum misses. Rebound secured by Jordan Simmons.

[00:23] Team_077 possession (Score: 107-94)
Jordan Simmons attempts a Midrange. Contested by Yao Tatum (5.7 feet, MAN). Jordan Simmons misses. Rebound secured by Rudy Ginobili.

[00:13] Team_060 possession (Score: 107-94)
Jarrett Wagner attempts a Midrange. Contested by Dejounte Quickley (4.4 feet, ZONE). Jarrett Wagner misses. Rebound secured by Ayo Griffin.

[00:01] Team_077 possession (Score: 107-94)
Dejounte Quickley attempts a 3Pt. Contested by Rudy Ginobili (4.5 feet, MAN). Dejounte Quickley misses. Rebound secured by Rudy Ginobili.

================================================================================
                              4TH QUARTER COMPLETE                              
================================================================================

4TH QUARTER SCORE: Team_077 36, Team_060 31

BOX SCORE:
================================================================================

Team_077
--------------------------------------------------------------------------------
Player                MIN  PTS  REB  AST  TO      FG   FG%      3P   3P%
--------------------------------------------------------------------------------
Ja Ball                44   13    0    1   0   5/6    83.3     0/0   0.0
Chris Ginobili         41   12    2    2   0   5/6    83.3     0/0   0.0
Dejounte Allen         44    5    0    1   0   2/2   100.0     0/0   0.0
Draymond Dosunmu       44    3    2    3   0   1/2    50.0     0/0   0.0
Russell Harden         41    2    2    2   0   1/3    33.3     0/0   0.0
Ayo Griffin             5    0    1    0   0   0/1     0.0     0/0   0.0
Jordan Simmons          7    0    1    0   0   0/2     0.0     0/0   0.0
Dejounte Quickley       5    0    0    0   0   0/1     0.0     0/0   0.0

TEAM: FG: 14/23 (60.9%), 3PT: 5/7 (71.4%), REB: 8 (0 off, 8 def), AST: 9, TO: 1
TEAM FOULS: 2


Team_060
--------------------------------------------------------------------------------
Player                MIN  PTS  REB  AST  TO      FG   FG%      3P   3P%
--------------------------------------------------------------------------------
Jaren George           38    9    4    0   0   4/5    80.0     0/0   0.0
Larry Westbrook        38    7    3    1   0   3/3   100.0     0/0   0.0
Julius Green           41    6    0    2   0   3/3   100.0     0/0   0.0
Immanuel Ming          44    2    3    1   0   1/3    33.3     0/0   0.0
Joel Morant            38    2    0    3   0   1/4    25.0     0/0   0.0
Jarrett Wagner          5    2    0    0   0   1/2    50.0     0/0   0.0
Yao Tatum              11    2    0    0   0   1/2    50.0     0/0   0.0
Domantas Barnes        11    0    2    0   0   0/0     0.0     0/0   0.0
Klay Haliburton        11    0    1    0   0   0/0     0.0     0/0   0.0
Rudy Ginobili           7    0    2    1   0   0/0     0.0     0/0   0.0

TEAM: FG: 14/22 (63.6%), 3PT: 2/5 (40.0%), REB: 15 (6 off, 9 def), AST: 8, TO: 1
TEAM FOULS: 6 [Team_077 in BONUS]

================================================================================

================================================================================
                               FULL GAME COMPLETE                               
================================================================================

FINAL SCORE: Team_077 107, Team_060 94

SCORING BY QUARTER:
--------------------------------------------------------------------------------
Team                     Q1     Q2     Q3     Q4    FINAL
--------------------------------------------------------------------------------
Team_077                 27     14     30     36      107
Team_060                 26     26     11     31       94
--------------------------------------------------------------------------------

FULL GAME BOX SCORE:
================================================================================

Team_077
--------------------------------------------------------------------------------
Player                MIN  PTS  REB  AST  TO      FG   FG%      3P   3P%      FT STL BLK
--------------------------------------------------------------------------------
Ja Ball                44   20    1    6   1   8/14   57.1   5/8    62.5   1/1     0   1
Dejounte Allen         44   10    0    3   0   3/13   23.1   2/8    25.0   4/6     1   0
Draymond Dosunmu       44   19   10    3   1  10/16   62.5   0/4     0.0   5/6     1   1
Chris Ginobili         41   15   16    6   2   6/12   50.0   3/6    50.0   2/3     0   0
Russell Harden         41   27   17    3   2  10/19   52.6   1/4    25.0   3/3     0   0
Tyler Poole             7    2    2    1   0   1/2    50.0   0/0     0.0   0/0     0   0
Jordan Simmons          7    4    3    0   0   2/5    40.0   0/0     0.0   1/2     0   0
Bam Bryant              5    0    0    0   0   1/1   100.0   0/0     0.0   0/0     0   0
Dejounte Quickley       5    3    0    0   0   0/1     0.0   0/1     0.0   0/0     0   0
Ayo Griffin             5    0    1    0   1   0/2     0.0   0/0     0.0   2/4     0   0

TEAM: FG: 41/85 (48.2%), 3PT: 11/31 (35.5%), REB: 49 (7 off, 42 def), AST: 22, TO: 7


Team_060
--------------------------------------------------------------------------------
Player                MIN  PTS  REB  AST  TO      FG   FG%      3P   3P%      FT STL BLK
--------------------------------------------------------------------------------
Immanuel Ming          44    6   16    3   2   3/14   21.4   1/6    16.7   0/1     0   1
Julius Green           41   17    0    2   2   8/11   72.7   2/4    50.0   4/5     0   0
Joel Morant            38    9    0    3   2   4/13   30.8   0/3     0.0   2/3     0   0
Larry Westbrook        38   17    7    3   0   7/12   58.3   2/4    50.0   5/5     1   0
Jaren George           38   24   21    2   0   9/16   56.2   0/1     0.0   7/12    1   1
Domantas Barnes        11    3    4    0   1   1/3    33.3   1/2    50.0   0/0     0   1
Yao Tatum              11    4    0    1   1   2/4    50.0   0/2     0.0   2/2     0   0
Klay Haliburton        11    4    4    1   0   2/2   100.0   0/0     0.0   0/0     1   0
Rudy Ginobili           7    0    2    1   1   0/1     0.0   0/1     0.0   0/0     0   0
Jarrett Wagner          5    4    0    0   0   2/3    66.7   0/0     0.0   0/0     0   0

TEAM: FG: 38/81 (46.9%), 3PT: 6/23 (26.1%), REB: 55 (11 off, 44 def), AST: 16, TO: 9

================================================================================
