================================================================================
                        FULL GAME - Team_029 vs Team_010                        
================================================================================

================================================================================
                       1ST QUARTER - Team_029 vs Team_010                       
================================================================================

[12:00] Team_029 possession (Score: 0-0)
FOUL! Holding foul on Michael Turner. [Team fouls: 1] No free throws, side out. (Michael Turner: 1 personal fouls)

[11:50] Team_029 possession (Score: 0-0)
Giannis Banchero attempts a Midrange. Contested by RJ Young (5.3 feet, MAN). Giannis Banchero misses. Rebound secured by Anthony Durant.

[11:35] Team_010 possession (Score: 0-0)
RJ Young attempts a 3Pt. Contested by Giannis Banchero (3.4 feet, MAN). RJ Young misses. Rebound secured by James Wall.

[11:18] Team_029 possession (Score: 0-0)
Devin Butler attempts a 3Pt. Contested by Anthony Durant (4.0 feet, MAN). Devin Butler misses. FOUL! Loose ball foul on Anthony Durant during the rebound battle. [Team fouls: 2] No free throws, side out. (Anthony Durant: 1 personal fouls)

[11:05] Team_029 possession (Score: 0-0)
Devin Butler makes the Dunk and draws the foul on Anthony Durant! And-1! Devin Butler to the line for 1. [Team fouls: 3] (Anthony Durant: 2 personal fouls)   FT 1/1: GOOD Devin Butler makes 1/1 from the line.
Score: 3-0

[10:48] Team_010 possession (Score: 3-0)
Michael Turner makes the Dunk and draws the foul on Scottie Bird! And-1! Michael Turner to the line for 1. [Team fouls: 1] (Scottie Bird: 1 personal fouls)   FT 1/1: GOOD Michael Turner makes 1/1 from the line.
Score: 3-3

[10:34] Team_029 possession (Score: 3-3)
FOUL! Shooting foul on Cade Morant. Paul Iverson to the line for 2 free throws. [Team fouls: 4] (Cade Morant: 1 personal fouls)   FT 1/2: GOOD   FT 2/2: GOOD Paul Iverson makes 2/2 from the line.
Score: 5-3

[10:18] Team_010 possession (Score: 5-3)
Cade Morant attempts a Midrange. Contested by Paul Iverson (4.8 feet, MAN). Cade Morant misses. Offensive rebound by Anthony Durant! Anthony Durant kicks it out.

[10:07] Team_010 possession (Score: 5-3)
Michael Turner throws a bad pass! Stolen by Scottie Bird! TURNOVER! (live ball)

[09:50] Team_029 possession (Score: 5-3)
Devin Butler drives, picks up Anthony Durant. Help arrives from Cade Morant! Devin Butler attempts a Layup. Contested by Cade Morant (4.0 feet, MAN). DEVIN BUTLER MAKES IT! Assist: Scottie Bird
Score: 7-3

[09:31] Team_010 possession (Score: 7-3)
Desmond Antetokounmpo drives to the basket... Desmond Antetokounmpo throws a bad pass! Stolen by James Wall! TURNOVER! (live ball)

[09:18] Team_029 possession (Score: 7-3)
Devin Butler attempts a Layup. Contested by Desmond Antetokounmpo (4.7 feet, ZONE). Devin Butler misses. Offensive rebound by James Wall! James Wall's putback is no good. Offensive rebound by James Wall! James Wall kicks it out.

[09:03] Team_029 possession (Score: 7-3)
FOUL! Holding foul on Desmond Antetokounmpo. [IN THE BONUS! 5 team fouls] James Wall to the line for 2 free throws. (Desmond Antetokounmpo: 1 personal fouls)   FT 1/2: GOOD   FT 2/2: MISS James Wall makes 1/2 from the line. Rebound secured by Desmond Antetokounmpo.
Score: 8-3

[08:46] Team_010 possession (Score: 8-3)
Desmond Antetokounmpo attempts a Midrange. Contested by James Wall (2.8 feet, MAN). Desmond Antetokounmpo misses. Rebound secured by Devin Butler.

[08:29] Team_029 possession (Score: 8-3)
Giannis Banchero attempts a 3Pt. Contested by RJ Young (5.3 feet, MAN). Giannis Banchero misses. Offensive rebound by James Wall! James Wall puts it back in!
Score: 10-3

[08:15] Team_010 possession (Score: 10-3)
Michael Turner drives, James Wall stays with him. Michael Turner attempts a Layup. Contested by James Wall (2.9 feet, ZONE). MICHAEL TURNER MAKES IT!
Score: 10-5

[08:00] Team_029 possession (Score: 10-5)
Scottie Bird drives, Michael Turner stays with him. Scottie Bird attempts a Layup. Contested by Michael Turner (4.3 feet, MAN). SCOTTIE BIRD MAKES IT!
Score: 12-5

[07:42] Team_010 possession (Score: 12-5)
Cade Morant attempts a 3Pt. Contested by Giannis Banchero (4.1 feet, ZONE). Cade Morant misses. Rebound secured by Devin Butler.

[07:31] Team_029 possession (Score: 12-5)
Giannis Banchero attempts a 3Pt. Contested by RJ Young (5.3 feet, MAN). Giannis Banchero misses. Rebound secured by Cade Morant.

[07:19] Team_010 possession (Score: 12-5)
Cade Morant attempts a Layup. Contested by James Wall (3.1 feet, ZONE). CADE MORANT MAKES IT! Assist: Anthony Durant
Score: 12-7

[07:07] Team_029 possession (Score: 12-7)
FOUL! Reach-in foul on Anthony Durant during the drive. [IN THE BONUS! 6 team fouls] Paul Iverson to the line for 2 free throws. (Anthony Durant: 3 personal fouls)   FT 1/2: GOOD   FT 2/2: MISS Paul Iverson makes 1/2 from the line. Rebound secured by Anthony Durant.
Score: 13-7

[06:54] Team_010 possession (Score: 13-7)
RJ Young attempts a Layup. BLOCKED BY SCOTTIE BIRD! Ball deflects out of bounds off RJ Young.

[06:45] Team_029 possession (Score: 13-7)
Paul Iverson attempts a 3Pt. Contested by Cade Morant (4.1 feet, MAN). Paul Iverson misses. Rebound secured by Cade Morant.

[06:28] Team_010 possession (Score: 13-7)
Michael Turner attempts a Layup. Contested by James Wall (2.9 feet, ZONE). Michael Turner misses. Offensive rebound by Cade Morant! Cade Morant kicks it out.

[06:13] Team_010 possession (Score: 13-7)
Anthony Durant attempts a Midrange. Contested by Scottie Bird (3.4 feet, ZONE). ANTHONY DURANT MAKES IT! Assist: RJ Young
Score: 13-9

[05:58] Team_029 possession (Score: 13-9)
Giannis Banchero attempts a 3Pt. Contested by RJ Young (5.3 feet, MAN). GIANNIS BANCHERO MAKES IT! Assist: Paul Iverson
Score: 16-9

[05:43] Team_010 possession (Score: 16-9)
Cade Morant attempts a 3Pt. BLOCKED BY PAUL IVERSON! Ball is loose! Rebound secured by James Wall.

[05:24] Team_029 possession (Score: 16-9)
Giannis Banchero drives and kicks out. FOUL! Shooting foul on Cade Morant. Paul Iverson to the line for 2 free throws. [BONUS: 7 team fouls] (Cade Morant: 2 personal fouls)   FT 1/2: GOOD   FT 2/2: MISS Paul Iverson makes 1/2 from the line. FOUL! Loose ball foul on Cade Morant during the free throw rebound! [IN THE BONUS! 8 team fouls] James Wall to the line for 2 free throws. (Cade Morant: 3 personal fouls)   FT 1/2: GOOD   FT 2/2: GOOD James Wall makes 2/2 from the line.
Score: 19-9

[05:13] Team_010 possession (Score: 19-9)
Desmond Antetokounmpo attempts a 3Pt. Contested by Giannis Banchero (3.8 feet, ZONE). Desmond Antetokounmpo misses. Rebound secured by James Wall.

[05:00] Team_029 possession (Score: 19-9)
FOUL! Offensive foul on Giannis Banchero! RJ Young drew the charge! [Team fouls: 2] (Giannis Banchero: 1 personal fouls) TURNOVER! (dead ball)

[04:46] Team_010 possession (Score: 19-9)
Anthony Durant makes the Layup and draws the foul on Devin Butler! And-1! Anthony Durant to the line for 1. [Team fouls: 3] (Devin Butler: 1 personal fouls)   FT 1/1: MISS Anthony Durant makes 0/1 from the line. Rebound secured by James Wall.
Score: 19-11

[04:31] Team_029 possession (Score: 19-11)
Scottie Bird attempts a 3Pt. Contested by Michael Turner (4.4 feet, MAN). Scottie Bird misses. Rebound secured by Michael Turner.

[04:18] Team_010 possession (Score: 19-11)
Desmond Antetokounmpo attempts a Layup. Contested by James Wall (2.8 feet, ZONE). DESMOND ANTETOKOUNMPO MAKES IT! Assist: RJ Young
Score: 19-13

[04:05] Team_029 possession (Score: 19-13)
Scottie Bird attempts a Layup. Contested by Anthony Durant (3.9 feet, ZONE). SCOTTIE BIRD MAKES IT! Assist: Giannis Banchero
Score: 21-13

[03:50] Team_010 possession (Score: 21-13)
Anthony Durant drives to the basket... Anthony Durant throws a bad pass out of bounds! TURNOVER! (dead ball)

[03:37] Team_029 possession (Score: 21-13)
FOUL! Reach-in foul on Anthony Durant during the drive. [IN THE BONUS! 9 team fouls] Devin Butler to the line for 2 free throws. (Anthony Durant: 4 personal fouls)   FT 1/2: GOOD   FT 2/2: GOOD Devin Butler makes 2/2 from the line.
Score: 23-13

[03:25] Team_010 possession (Score: 23-13)
Cade Morant attempts a Layup. BLOCKED BY PAUL IVERSON! Ball is loose! Offensive rebound by Anthony Durant! Anthony Durant kicks it out.

[03:11] Team_010 possession (Score: 23-13)
Michael Turner attempts a 3Pt. Contested by Scottie Bird (3.6 feet, MAN). Michael Turner misses. Rebound secured by Giannis Banchero.

[03:00] Team_029 possession (Score: 23-13)
FOUL! Reach-in foul on Anthony Durant during the drive. [IN THE BONUS! 10 team fouls] Devin Butler to the line for 2 free throws. (Anthony Durant: 5 personal fouls)   FT 1/2: MISS   FT 2/2: GOOD Devin Butler makes 1/2 from the line.
Score: 24-13

[02:44] Team_010 possession (Score: 24-13)
Cade Morant drives, picks up Paul Iverson. Help arrives from Scottie Bird! Cade Morant attempts a Dunk. Contested by Scottie Bird (5.0 feet, MAN). CADE MORANT MAKES IT! Assist: Michael Turner
Score: 24-15

[02:33] Team_029 possession (Score: 24-15)
Giannis Banchero attempts a 3Pt. Contested by RJ Young (5.5 feet, MAN). GIANNIS BANCHERO MAKES IT! Assist: James Wall
Score: 27-15

[02:22] Team_010 possession (Score: 27-15)
Michael Turner attempts a 3Pt. Contested by Giannis Banchero (4.2 feet, ZONE). Michael Turner misses. Rebound secured by Giannis Banchero.

[02:08] Team_029 possession (Score: 27-15)
Paul Iverson attempts a 3Pt. Contested by Cade Morant (4.5 feet, ZONE). PAUL IVERSON MAKES IT! Assist: Giannis Banchero
Score: 30-15

[01:54] Team_010 possession (Score: 30-15)
Desmond Antetokounmpo drives, picks up James Wall. Help arrives from Scottie Bird! Desmond Antetokounmpo attempts a Dunk. Contested by Scottie Bird (3.1 feet, MAN). DESMOND ANTETOKOUNMPO MAKES IT!
Score: 30-17

[01:41] Team_029 possession (Score: 30-17)
James Wall attempts a Layup. Contested by Anthony Durant (4.5 feet, ZONE). James Wall misses. Rebound secured by Cade Morant.

[01:28] Team_010 possession (Score: 30-17)
FOUL! Holding foul on Giannis Banchero. [Team fouls: 4] No free throws, side out. (Giannis Banchero: 2 personal fouls)

[01:14] Team_010 possession (Score: 30-17)
Michael Turner attempts a 3Pt. Contested by Giannis Banchero (4.3 feet, ZONE). Michael Turner misses. Rebound secured by James Wall.

[01:01] Team_029 possession (Score: 30-17)
James Wall attempts a 3Pt. Contested by Desmond Antetokounmpo (5.2 feet, MAN). James Wall misses. Rebound secured by Cade Morant.

[00:50] Team_010 possession (Score: 30-17)
Cade Morant attempts a 3Pt. Contested by Paul Iverson (5.2 feet, MAN). Cade Morant misses. Rebound secured by James Wall.

[00:31] Team_029 possession (Score: 30-17)
Scottie Bird attempts a 3Pt. Contested by RJ Young (5.5 feet, ZONE). SCOTTIE BIRD MAKES IT! Assist: Giannis Banchero
Score: 33-17

[00:14] Team_010 possession (Score: 33-17)
Desmond Antetokounmpo drives and kicks out. Anthony Durant attempts a Midrange. Contested by James Wall (3.2 feet, ZONE). Anthony Durant misses. Rebound secured by Devin Butler.

================================================================================
                              1ST QUARTER COMPLETE                              
================================================================================

1ST QUARTER SCORE: Team_029 33, Team_010 17

BOX SCORE:
================================================================================

Team_029
--------------------------------------------------------------------------------
Player                MIN  PTS  REB  AST  TO      FG   FG%      3P   3P%
--------------------------------------------------------------------------------
Devin Butler           12    8    4    0   0   4/4   100.0     0/0   0.0
Scottie Bird           12    7    0    1   0   3/4    75.0     0/0   0.0
Giannis Banchero       12    6    2    3   0   2/4    50.0     0/0   0.0
James Wall             12    5    8    1   0   2/4    50.0     0/0   0.0
Paul Iverson           12    5    0    1   0   2/4    50.0     0/0   0.0

TEAM: FG: 13/21 (61.9%), 3PT: 5/9 (55.6%), REB: 14 (3 off, 11 def), AST: 6, TO: 1
TEAM FOULS: 4


Team_010
--------------------------------------------------------------------------------
Player                MIN  PTS  REB  AST  TO      FG   FG%      3P   3P%
--------------------------------------------------------------------------------
Michael Turner         12    5    1    1   0   2/5    40.0     0/0   0.0
Desmond Antetokounmpo   12    4    1    0   0   2/5    40.0     0/0   0.0
Cade Morant            12    4    5    0   0   2/5    40.0     0/0   0.0
Anthony Durant         12    2    4    1   0   1/2    50.0     0/0   0.0
RJ Young               12    0    0    2   0   0/2     0.0     0/0   0.0

TEAM: FG: 7/19 (36.8%), 3PT: 0/8 (0.0%), REB: 11 (3 off, 8 def), AST: 4, TO: 3
TEAM FOULS: 10 [Team_029 in BONUS]

================================================================================

================================================================================
                       2ND QUARTER - Team_029 vs Team_010                       
================================================================================

[12:00] Team_029 possession (Score: 33-17)
James Wall makes the Layup and draws the foul on Anthony Durant! And-1! James Wall to the line for 1. [Team fouls: 1] (Anthony Durant: 1 personal fouls)   FT 1/1: GOOD James Wall makes 1/1 from the line.
Score: 36-17

[11:43] Team_010 possession (Score: 36-17)
Cade Morant attempts a 3Pt. Contested by James Wall (3.4 feet, ZONE). Cade Morant misses. Rebound secured by James Wall.

[11:27] Team_029 possession (Score: 36-17)
Giannis Banchero drives and kicks out. FOUL! Shooting foul on Desmond Antetokounmpo. James Wall to the line for 2 free throws. [Team fouls: 2] (Desmond Antetokounmpo: 1 personal fouls)   FT 1/2: GOOD   FT 2/2: GOOD James Wall makes 2/2 from the line.
Score: 38-17

[11:14] Team_010 possession (Score: 38-17)
Michael Turner attempts a 3Pt. Contested by Giannis Banchero (4.3 feet, ZONE). Michael Turner misses. Offensive rebound by Anthony Durant! Anthony Durant kicks it out.

[11:02] Team_010 possession (Score: 38-17)
Michael Turner makes the Midrange and draws the foul on Scottie Bird! And-1! Michael Turner to the line for 1. [Team fouls: 1] (Scottie Bird: 1 personal fouls)   FT 1/1: GOOD Michael Turner makes 1/1 from the line.
Score: 38-20

[10:46] Team_029 possession (Score: 38-20)
James Wall attempts a 3Pt. Contested by Cade Morant (4.9 feet, ZONE). James Wall misses. Offensive rebound by Devin Butler! Devin Butler kicks it out.

[10:32] Team_029 possession (Score: 38-20)
James Wall attempts a 3Pt. Contested by Cade Morant (5.0 feet, ZONE). JAMES WALL MAKES IT! Assist: Paul Iverson
Score: 41-20

[10:15] Team_010 possession (Score: 41-20)
Desmond Antetokounmpo attempts a Midrange. Contested by James Wall (3.3 feet, MAN). Desmond Antetokounmpo misses. Rebound secured by James Wall.

[10:02] Team_029 possession (Score: 41-20)
Scottie Bird attempts a Midrange. Contested by Michael Turner (4.8 feet, MAN). Scottie Bird misses. Rebound secured by Anthony Durant.

[09:47] Team_010 possession (Score: 41-20)
Desmond Antetokounmpo attempts a 3Pt. Contested by Giannis Banchero (4.4 feet, ZONE). DESMOND ANTETOKOUNMPO MAKES IT! Assist: Michael Turner
Score: 41-23

[09:33] Team_029 possession (Score: 41-23)
James Wall attempts a Midrange. Contested by Desmond Antetokounmpo (5.4 feet, ZONE). JAMES WALL MAKES IT! Assist: Devin Butler
Score: 43-23

[09:17] Team_010 possession (Score: 43-23)
Cade Morant attempts a 3Pt. Contested by Giannis Banchero (4.8 feet, ZONE). Cade Morant misses. Rebound secured by James Wall.

[09:00] Team_029 possession (Score: 43-23)
Giannis Banchero attempts a 3Pt. Contested by RJ Young (5.8 feet, MAN). Giannis Banchero misses. Rebound secured by Michael Turner.

[08:48] Team_010 possession (Score: 43-23)
FOUL! Holding foul on Paul Iverson. [Team fouls: 2] No free throws, side out. (Paul Iverson: 1 personal fouls)

[08:32] Team_010 possession (Score: 43-23)
Desmond Antetokounmpo attempts a Midrange. Contested by James Wall (3.5 feet, MAN). DESMOND ANTETOKOUNMPO MAKES IT!
Score: 43-25

[08:19] Team_029 possession (Score: 43-25)
Paul Iverson attempts a Midrange. Contested by Cade Morant (4.9 feet, MAN). Paul Iverson misses. Rebound secured by Anthony Durant.

[08:00] Team_010 possession (Score: 43-25)
RJ Young attempts a 3Pt. Contested by Giannis Banchero (4.4 feet, ZONE). RJ Young misses. FOUL! Loose ball foul on James Wall during the rebound battle. [Team fouls: 3] No free throws, side out. (James Wall: 1 personal fouls)

[07:43] Team_010 possession (Score: 43-25)
Cade Morant attempts a 3Pt. Contested by Giannis Banchero (5.0 feet, ZONE). Cade Morant misses. Rebound secured by James Wall.

[07:27] Team_029 possession (Score: 43-25)
FOUL! Reach-in foul on Desmond Antetokounmpo during the drive. [Team fouls: 3] No free throws, side out. (Desmond Antetokounmpo: 2 personal fouls)

[07:15] Team_029 possession (Score: 43-25)
Scottie Bird drives, picks up Anthony Durant. Help arrives from Cade Morant! Scottie Bird attempts a Dunk. Contested by Cade Morant (4.8 feet, ZONE). Scottie Bird misses. Rebound secured by Anthony Durant.

[06:58] Team_010 possession (Score: 43-25)
Michael Turner attempts a 3Pt. Contested by Scottie Bird (4.4 feet, MAN). Michael Turner misses. Offensive rebound by Anthony Durant! Anthony Durant kicks it out.

[06:44] Team_010 possession (Score: 43-25)
Cade Morant drives and kicks out. Michael Turner attempts a 3Pt. Contested by Scottie Bird (4.4 feet, MAN). Michael Turner misses. Rebound secured by Devin Butler.

[06:26] Team_029 possession (Score: 43-25)
Scottie Bird attempts a 3Pt. Contested by Cade Morant (5.2 feet, ZONE). SCOTTIE BIRD MAKES IT!
Score: 46-25

[06:12] Team_010 possession (Score: 46-25)
RJ Young makes the Dunk and draws the foul on Giannis Banchero! And-1! RJ Young to the line for 1. [Team fouls: 4] (Giannis Banchero: 1 personal fouls)   FT 1/1: GOOD RJ Young makes 1/1 from the line.
Score: 46-28

[06:01] Team_029 possession (Score: 46-28)
FOUL! Shooting foul on Cade Morant. Paul Iverson to the line for 2 free throws. [Team fouls: 4] (Cade Morant: 1 personal fouls)   FT 1/2: GOOD   FT 2/2: GOOD Paul Iverson makes 2/2 from the line.
Score: 48-28

[05:45] Team_010 possession (Score: 48-28)
Cade Morant attempts a Layup. Contested by Paul Iverson (5.6 feet, MAN). Cade Morant misses. Rebound secured by Devin Butler.

[05:30] Team_029 possession (Score: 48-28)
Paul Iverson attempts a Midrange. Contested by Cade Morant (5.3 feet, MAN). Paul Iverson misses. Rebound secured by Anthony Durant.

[05:12] Team_010 possession (Score: 48-28)
Anthony Durant drives and kicks out. Cade Morant attempts a 3Pt. Contested by Giannis Banchero (5.2 feet, ZONE). Cade Morant misses. Offensive rebound by Cade Morant! Cade Morant kicks it out.

[04:59] Team_010 possession (Score: 48-28)
Desmond Antetokounmpo makes the Layup and draws the foul on Scottie Bird! And-1! Desmond Antetokounmpo to the line for 1. [BONUS: 5 team fouls] (Scottie Bird: 2 personal fouls)   FT 1/1: GOOD Desmond Antetokounmpo makes 1/1 from the line.
Score: 48-31

[04:45] Team_029 possession (Score: 48-31)
Giannis Banchero loses control! Ball rolls out of bounds! TURNOVER! (dead ball)

[04:45] Substitution (Team_029): Paul Iverson OUT → Immanuel Irving IN (stamina_rule2)

[04:45] Substitution (Team_029): Scottie Bird OUT → Bones Carter IN (stamina_rule2)

[04:45] Substitution (Team_029): Giannis Banchero OUT → Pau Anthony IN (stamina_rule2)

[04:45] Substitution (Team_029): James Wall OUT → Derrick Rozier IN (stamina_rule2)

[04:45] Substitution (Team_029): Devin Butler OUT → Shai Ball IN (stamina_rule2)

[04:45] Substitution (Team_010): Cade Morant OUT → Draymond Leonard IN (stamina_rule2)

[04:45] Substitution (Team_010): Michael Turner OUT → Blake Harden IN (stamina_rule2)

[04:45] Substitution (Team_010): RJ Young OUT → Ben Gilgeous-Alexander IN (stamina_rule2)

[04:45] Substitution (Team_010): Desmond Antetokounmpo OUT → Vince Ingram IN (stamina_rule2)

[04:45] Substitution (Team_010): Anthony Durant OUT → Paolo Wade IN (stamina_rule2)

[04:29] Team_010 possession (Score: 48-31)
Paolo Wade attempts a Layup. Contested by Derrick Rozier (4.1 feet, ZONE). Paolo Wade misses. Rebound secured by Pau Anthony.

[04:17] Team_029 possession (Score: 48-31)
Bones Carter attempts a 3Pt. Contested by Draymond Leonard (4.5 feet, ZONE). Bones Carter misses. Rebound secured by Blake Harden.

[04:04] Team_010 possession (Score: 48-31)
Ben Gilgeous-Alexander drives, Derrick Rozier stays with him. Ben Gilgeous-Alexander attempts a Layup. Contested by Derrick Rozier (4.2 feet, ZONE). BEN GILGEOUS-ALEXANDER MAKES IT! Assist: Paolo Wade
Score: 48-33

[03:47] Team_029 possession (Score: 48-33)
Derrick Rozier attempts a Layup. Contested by Vince Ingram (5.7 feet, MAN). DERRICK ROZIER MAKES IT! Assist: Immanuel Irving
Score: 50-33

[03:28] Team_010 possession (Score: 50-33)
Vince Ingram attempts a Midrange. Contested by Derrick Rozier (4.7 feet, MAN). VINCE INGRAM MAKES IT! Assist: Paolo Wade
Score: 50-35

[03:11] Team_029 possession (Score: 50-35)
Bones Carter drives to the basket... FOUL! Offensive foul on Bones Carter! Blake Harden drew the charge! [Team fouls: 6] (Bones Carter: 1 personal fouls) TURNOVER! (dead ball)

[02:56] Team_010 possession (Score: 50-35)
Ben Gilgeous-Alexander drives, picks up Pau Anthony. Help arrives from Bones Carter! Ben Gilgeous-Alexander attempts a Dunk. Contested by Bones Carter (4.0 feet, MAN). BEN GILGEOUS-ALEXANDER MAKES IT!
Score: 50-37

[02:43] Team_029 possession (Score: 50-37)
Shai Ball attempts a Midrange. Contested by Vince Ingram (5.7 feet, ZONE). SHAI BALL MAKES IT!
Score: 52-37

[02:27] Team_010 possession (Score: 52-37)
Paolo Wade attempts a 3Pt. Contested by Pau Anthony (3.9 feet, ZONE). Paolo Wade misses. Rebound secured by Pau Anthony.

[02:13] Team_029 possession (Score: 52-37)
FOUL! Shooting foul on Ben Gilgeous-Alexander. Pau Anthony to the line for 3 free throws. [BONUS: 5 team fouls] (Ben Gilgeous-Alexander: 1 personal fouls)   FT 1/3: GOOD   FT 2/3: MISS   FT 3/3: GOOD Pau Anthony makes 2/3 from the line.
Score: 54-37

[02:01] Team_010 possession (Score: 54-37)
Vince Ingram drives and kicks out. Blake Harden attempts a Midrange. Contested by Pau Anthony (3.7 feet, ZONE). Blake Harden misses. Offensive rebound by Blake Harden! Blake Harden kicks it out.

[01:46] Team_010 possession (Score: 54-37)
FOUL! Holding foul on Immanuel Irving. [IN THE BONUS! 7 team fouls] Draymond Leonard to the line for 2 free throws. (Immanuel Irving: 1 personal fouls)   FT 1/2: GOOD   FT 2/2: GOOD Draymond Leonard makes 2/2 from the line.
Score: 54-39

[01:30] Team_029 possession (Score: 54-39)
Bones Carter attempts a 3Pt. Contested by Blake Harden (4.7 feet, MAN). Bones Carter misses. Rebound secured by Paolo Wade.

[01:17] Team_010 possession (Score: 54-39)
Draymond Leonard attempts a 3Pt. Contested by Pau Anthony (4.1 feet, ZONE). Draymond Leonard misses. Rebound secured by Shai Ball.

[01:04] Team_029 possession (Score: 54-39)
FOUL! Holding foul on Blake Harden. [IN THE BONUS! 6 team fouls] Bones Carter to the line for 2 free throws. (Blake Harden: 1 personal fouls)   FT 1/2: GOOD   FT 2/2: GOOD Bones Carter makes 2/2 from the line.
Score: 56-39

[00:53] Team_010 possession (Score: 56-39)
FOUL! Holding foul on Pau Anthony. [IN THE BONUS! 8 team fouls] Ben Gilgeous-Alexander to the line for 2 free throws. (Pau Anthony: 1 personal fouls)   FT 1/2: MISS   FT 2/2: GOOD Ben Gilgeous-Alexander makes 1/2 from the line.
Score: 56-40

[00:42] Team_029 possession (Score: 56-40)
FOUL! Shooting foul on Vince Ingram. Derrick Rozier to the line for 2 free throws. [BONUS: 7 team fouls] (Vince Ingram: 1 personal fouls)   FT 1/2: GOOD   FT 2/2: GOOD Derrick Rozier makes 2/2 from the line.
Score: 58-40

[00:31] Team_010 possession (Score: 58-40)
Vince Ingram attempts a Midrange. Contested by Derrick Rozier (4.7 feet, ZONE). VINCE INGRAM MAKES IT! Assist: Paolo Wade
Score: 58-42

[00:16] Team_029 possession (Score: 58-42)
Bones Carter drives, Blake Harden stays with him. Bones Carter attempts a Dunk. Contested by Blake Harden (4.7 feet, MAN). BONES CARTER MAKES IT! Assist: Immanuel Irving
Score: 60-42

[00:03] Team_010 possession (Score: 60-42)
Blake Harden attempts a 3Pt. Contested by Pau Anthony (3.4 feet, ZONE). BLAKE HARDEN MAKES IT! Assist: Ben Gilgeous-Alexander
Score: 60-45

================================================================================
                              2ND QUARTER COMPLETE                              
================================================================================

2ND QUARTER SCORE: Team_029 27, Team_010 28

BOX SCORE:
================================================================================

Team_029
--------------------------------------------------------------------------------
Player                MIN  PTS  REB  AST  TO      FG   FG%      3P   3P%
--------------------------------------------------------------------------------
James Wall             20   10    4    0   0   4/4   100.0     0/0   0.0
Bones Carter            5    4    0    0   0   2/4    50.0     0/0   0.0
Derrick Rozier          5    4    0    0   0   2/2   100.0     0/0   0.0
Scottie Bird           20    3    0    0   0   1/3    33.3     0/0   0.0
Paul Iverson           20    2    0    1   0   1/3    33.3     0/0   0.0
Pau Anthony             5    2    2    0   0   1/1   100.0     0/0   0.0
Shai Ball               5    2    1    0   0   1/1   100.0     0/0   0.0
Devin Butler           20    0    3    1   0   0/0     0.0     0/0   0.0
Giannis Banchero       20    0    0    0   0   0/1     0.0     0/0   0.0
Immanuel Irving         5    0    0    2   0   0/0     0.0     0/0   0.0

TEAM: FG: 12/19 (63.2%), 3PT: 3/6 (50.0%), REB: 10 (1 off, 9 def), AST: 4, TO: 2
TEAM FOULS: 8 [Team_010 in BONUS]


Team_010
--------------------------------------------------------------------------------
Player                MIN  PTS  REB  AST  TO      FG   FG%      3P   3P%
--------------------------------------------------------------------------------
Desmond Antetokounmpo   20    8    0    0   0   3/4    75.0     0/0   0.0
Ben Gilgeous-Alexander    5    5    0    1   0   3/3   100.0     0/0   0.0
Vince Ingram            5    4    0    0   0   2/2   100.0     0/0   0.0
Michael Turner         20    3    1    1   0   1/1   100.0     0/0   0.0
RJ Young               20    3    0    0   0   1/1   100.0     0/0   0.0
Blake Harden            5    3    2    0   0   1/1   100.0     0/0   0.0
Draymond Leonard        5    2    0    0   0   1/2    50.0     0/0   0.0
Cade Morant            20    0    1    0   0   0/5     0.0     0/0   0.0
Anthony Durant         20    0    7    0   0   0/0     0.0     0/0   0.0
Paolo Wade              5    0    1    3   0   0/2     0.0     0/0   0.0

TEAM: FG: 12/21 (57.1%), 3PT: 2/7 (28.6%), REB: 12 (5 off, 7 def), AST: 5, TO: 0
TEAM FOULS: 7 [Team_029 in BONUS]

================================================================================

================================================================================
                       3RD QUARTER - Team_029 vs Team_010                       
================================================================================

[12:00] Team_029 possession (Score: 60-45)
James Wall drives and kicks out. Scottie Bird attempts a Midrange. Contested by Michael Turner (4.0 feet, MAN). Scottie Bird misses. Rebound secured by Cade Morant.

[11:42] Team_010 possession (Score: 60-45)
FOUL! Shooting foul on Devin Butler. Anthony Durant to the line for 2 free throws. [Team fouls: 1] (Devin Butler: 1 personal fouls)   FT 1/2: GOOD   FT 2/2: GOOD Anthony Durant makes 2/2 from the line.
Score: 60-47

[11:30] Team_029 possession (Score: 60-47)
Devin Butler drives and kicks out. Giannis Banchero attempts a Midrange. Contested by RJ Young (4.7 feet, MAN). Giannis Banchero misses. Rebound secured by Desmond Antetokounmpo.

[11:17] Team_010 possession (Score: 60-47)
Cade Morant drives, picks up James Wall. Help arrives from Scottie Bird! Cade Morant attempts a Layup. Contested by Scottie Bird (3.1 feet, ZONE). CADE MORANT MAKES IT! Assist: Michael Turner
Score: 60-49

[11:05] Team_029 possession (Score: 60-49)
Scottie Bird drives to the basket... Scottie Bird throws a bad pass out of bounds! TURNOVER! (dead ball)

[10:51] Team_010 possession (Score: 60-49)
Desmond Antetokounmpo attempts a Midrange. Contested by James Wall (2.8 feet, MAN). Desmond Antetokounmpo misses. Rebound secured by James Wall.

[10:37] Team_029 possession (Score: 60-49)
James Wall attempts a Midrange. Contested by Desmond Antetokounmpo (4.8 feet, MAN). JAMES WALL MAKES IT! Assist: Paul Iverson
Score: 62-49

[10:24] Team_010 possession (Score: 62-49)
FOUL! Holding foul on James Wall. [Team fouls: 2] No free throws, side out. (James Wall: 1 personal fouls)

[10:12] Team_010 possession (Score: 62-49)
FOUL! Reach-in foul on James Wall during the drive. [Team fouls: 3] No free throws, side out. (James Wall: 2 personal fouls)

[09:59] Team_010 possession (Score: 62-49)
Michael Turner makes the Layup and draws the foul on James Wall! And-1! Michael Turner to the line for 1. [Team fouls: 4] (James Wall: 3 personal fouls)   FT 1/1: GOOD Michael Turner makes 1/1 from the line.
Score: 62-52

[09:41] Team_029 possession (Score: 62-52)
Paul Iverson drives, picks up Cade Morant. Help arrives from Michael Turner! Paul Iverson attempts a Dunk. Contested by Michael Turner (4.1 feet, MAN). PAUL IVERSON MAKES IT! Assist: James Wall
Score: 64-52

[09:25] Team_010 possession (Score: 64-52)
Desmond Antetokounmpo attempts a 3Pt. Contested by James Wall (2.8 feet, MAN). DESMOND ANTETOKOUNMPO MAKES IT! Assist: Anthony Durant
Score: 64-55

[09:06] Team_029 possession (Score: 64-55)
FOUL! Shooting foul on Cade Morant. Paul Iverson to the line for 2 free throws. [Team fouls: 1] (Cade Morant: 1 personal fouls)   FT 1/2: GOOD   FT 2/2: GOOD Paul Iverson makes 2/2 from the line.
Score: 66-55

[08:52] Team_010 possession (Score: 66-55)
RJ Young attempts a 3Pt. Contested by Paul Iverson (4.1 feet, ZONE). RJ Young misses. Rebound secured by James Wall.

[08:37] Team_029 possession (Score: 66-55)
Scottie Bird loses control! Ball rolls out of bounds! TURNOVER! (dead ball)

[08:24] Team_010 possession (Score: 66-55)
Cade Morant attempts a 3Pt. Contested by Giannis Banchero (4.1 feet, ZONE). Cade Morant misses. Rebound secured by Giannis Banchero.

[08:12] Team_029 possession (Score: 66-55)
Paul Iverson attempts a 3Pt. Contested by Cade Morant (4.1 feet, MAN). PAUL IVERSON MAKES IT! Assist: James Wall
Score: 69-55

[08:02] Team_010 possession (Score: 69-55)
Desmond Antetokounmpo drives and kicks out. Anthony Durant attempts a 3Pt. Contested by Devin Butler (4.1 feet, MAN). Anthony Durant misses. Rebound secured by James Wall.

[07:50] Team_029 possession (Score: 69-55)
Scottie Bird attempts a Midrange. Contested by Michael Turner (4.3 feet, MAN). SCOTTIE BIRD MAKES IT! Assist: Paul Iverson
Score: 71-55

[07:39] Team_010 possession (Score: 71-55)
FOUL! Shooting foul on James Wall. Anthony Durant to the line for 2 free throws. [BONUS: 5 team fouls] (James Wall: 4 personal fouls)   FT 1/2: GOOD   FT 2/2: MISS Anthony Durant makes 1/2 from the line. Rebound secured by Devin Butler.
Score: 71-56

[07:27] Team_029 possession (Score: 71-56)
James Wall attempts a Layup. Contested by Anthony Durant (4.0 feet, ZONE). JAMES WALL MAKES IT! Assist: Giannis Banchero
Score: 73-56

[07:16] Team_010 possession (Score: 73-56)
FOUL! Shooting foul on Paul Iverson. Cade Morant to the line for 2 free throws. [BONUS: 6 team fouls] (Paul Iverson: 1 personal fouls)   FT 1/2: GOOD   FT 2/2: GOOD Cade Morant makes 2/2 from the line.
Score: 73-58

[07:02] Team_029 possession (Score: 73-58)
Paul Iverson attempts a 3Pt. Contested by Cade Morant (4.1 feet, MAN). Paul Iverson misses. Offensive rebound by James Wall! James Wall puts it back in!
Score: 75-58

[06:48] Team_010 possession (Score: 75-58)
Michael Turner attempts a 3Pt. Contested by Giannis Banchero (3.8 feet, ZONE). Michael Turner misses. Rebound secured by James Wall.

[06:34] Team_029 possession (Score: 75-58)
Devin Butler attempts a Layup. Contested by Anthony Durant (4.0 feet, ZONE). DEVIN BUTLER MAKES IT! Assist: Scottie Bird
Score: 77-58

[06:20] Team_010 possession (Score: 77-58)
Michael Turner throws a bad pass! Stolen by Scottie Bird! TURNOVER! (live ball)

[06:03] Team_029 possession (Score: 77-58)
Scottie Bird attempts a 3Pt. Contested by Michael Turner (4.3 feet, MAN). Scottie Bird misses. Rebound secured by Anthony Durant.

[05:51] Team_010 possession (Score: 77-58)
RJ Young drives to the basket... RJ Young loses the ball! Stripped by Giannis Banchero! TURNOVER! (live ball)

[05:35] Team_029 possession (Score: 77-58)
Paul Iverson attempts a Midrange. Contested by Desmond Antetokounmpo (4.5 feet, ZONE). PAUL IVERSON MAKES IT! Assist: James Wall
Score: 79-58

[05:23] Team_010 possession (Score: 79-58)
Michael Turner attempts a Layup. Contested by Scottie Bird (3.4 feet, MAN). MICHAEL TURNER MAKES IT!
Score: 79-60

[05:10] Team_029 possession (Score: 79-60)
Paul Iverson drives and kicks out. Giannis Banchero attempts a Midrange. Contested by RJ Young (4.7 feet, MAN). Giannis Banchero misses. Rebound secured by Michael Turner.

[04:54] Team_010 possession (Score: 79-60)
Desmond Antetokounmpo attempts a Layup. BLOCKED BY JAMES WALL! Ball goes out off James Wall. Desmond Antetokounmpo's ball!

[04:39] Team_010 possession (Score: 79-60)
Michael Turner attempts a 3Pt. Contested by Scottie Bird (3.5 feet, MAN). Michael Turner misses. Rebound secured by James Wall.

[04:23] Team_029 possession (Score: 79-60)
FOUL! Reach-in foul on RJ Young during the drive. [Team fouls: 2] No free throws, side out. (RJ Young: 1 personal fouls)

[04:07] Team_029 possession (Score: 79-60)
Scottie Bird attempts a Midrange. Contested by Michael Turner (4.4 feet, ZONE). Scottie Bird misses. Offensive rebound by Devin Butler! Devin Butler kicks it out.

[03:54] Team_029 possession (Score: 79-60)
James Wall attempts a Midrange. Contested by Desmond Antetokounmpo (4.9 feet, MAN). James Wall misses. Rebound secured by Michael Turner.

[03:37] Team_010 possession (Score: 79-60)
Cade Morant drives and kicks out. Cade Morant attempts a 3Pt. Contested by Giannis Banchero (3.8 feet, ZONE). Cade Morant misses. Rebound secured by Devin Butler.

[03:21] Team_029 possession (Score: 79-60)
Devin Butler makes the Midrange and draws the foul on Anthony Durant! And-1! Devin Butler to the line for 1. [Team fouls: 3] (Anthony Durant: 1 personal fouls)   FT 1/1: MISS Devin Butler makes 0/1 from the line. Rebound secured by Anthony Durant.
Score: 81-60

[03:05] Team_010 possession (Score: 81-60)
FOUL! Reach-in foul on James Wall during the drive. [IN THE BONUS! 7 team fouls] Michael Turner to the line for 2 free throws. (James Wall: 5 personal fouls)   FT 1/2: GOOD   FT 2/2: GOOD Michael Turner makes 2/2 from the line.
Score: 81-62

[02:48] Team_029 possession (Score: 81-62)
Giannis Banchero attempts a Midrange. Contested by RJ Young (5.5 feet, MAN). Giannis Banchero misses. Rebound secured by Cade Morant.

[02:33] Team_010 possession (Score: 81-62)
Desmond Antetokounmpo makes the Layup and draws the foul on James Wall! And-1! Desmond Antetokounmpo to the line for 1. [BONUS: 8 team fouls] (James Wall: 6 personal fouls) James Wall FOULS OUT!   FT 1/1: GOOD Desmond Antetokounmpo makes 1/1 from the line.
Score: 81-65

[02:33] Substitution (Team_029): James Wall OUT (stamina: 72) → Immanuel Irving IN (foul_out)

[02:19] Team_029 possession (Score: 81-65)
FOUL! Shooting foul on Cade Morant. Immanuel Irving to the line for 2 free throws. [Team fouls: 4] (Cade Morant: 2 personal fouls)   FT 1/2: GOOD   FT 2/2: GOOD Immanuel Irving makes 2/2 from the line.
Score: 83-65

[02:03] Team_010 possession (Score: 83-65)
Michael Turner drives and kicks out. RJ Young makes the Midrange and draws the foul on Giannis Banchero! And-1! RJ Young to the line for 1. [BONUS: 9 team fouls] (Giannis Banchero: 1 personal fouls)   FT 1/1: GOOD RJ Young makes 1/1 from the line.
Score: 83-68

[01:44] Team_029 possession (Score: 83-68)
Devin Butler attempts a Midrange. Contested by Michael Turner (4.8 feet, ZONE). DEVIN BUTLER MAKES IT!
Score: 85-68

[01:26] Team_010 possession (Score: 85-68)
Michael Turner attempts a 3Pt. Contested by Scottie Bird (3.8 feet, MAN). Michael Turner misses. Rebound secured by Giannis Banchero.

[01:12] Team_029 possession (Score: 85-68)
Immanuel Irving attempts a 3Pt. Contested by Cade Morant (4.9 feet, MAN). IMMANUEL IRVING MAKES IT! Assist: Giannis Banchero
Score: 88-68

[00:57] Team_010 possession (Score: 88-68)
Desmond Antetokounmpo attempts a Midrange. Contested by Scottie Bird (3.8 feet, ZONE). Desmond Antetokounmpo misses. Rebound secured by Devin Butler.

[00:40] Team_029 possession (Score: 88-68)
Immanuel Irving attempts a 3Pt. Contested by Cade Morant (5.0 feet, MAN). IMMANUEL IRVING MAKES IT! Assist: Devin Butler
Score: 91-68

[00:21] Team_010 possession (Score: 91-68)
FOUL! Holding foul on Devin Butler. [IN THE BONUS! 10 team fouls] Anthony Durant to the line for 2 free throws. (Devin Butler: 2 personal fouls)   FT 1/2: GOOD   FT 2/2: GOOD Anthony Durant makes 2/2 from the line.
Score: 91-70

[00:07] Team_029 possession (Score: 91-70)
Scottie Bird attempts a Midrange. Contested by Michael Turner (4.7 feet, MAN). Scottie Bird misses. Rebound secured by Michael Turner.

================================================================================
                              3RD QUARTER COMPLETE                              
================================================================================

3RD QUARTER SCORE: Team_029 31, Team_010 25

BOX SCORE:
================================================================================

Team_029
--------------------------------------------------------------------------------
Player                MIN  PTS  REB  AST  TO      FG   FG%      3P   3P%
--------------------------------------------------------------------------------
Paul Iverson           32    9    0    2   0   4/5    80.0     0/0   0.0
Immanuel Irving         7    8    0    0   0   3/3   100.0     0/0   0.0
James Wall             29    6    6    3   0   3/5    60.0     0/0   0.0
Devin Butler           32    4    4    1   0   2/4    50.0     0/0   0.0
Scottie Bird           32    2    0    1   0   1/3    33.3     0/0   0.0
Giannis Banchero       32    0    2    2   0   0/1     0.0     0/0   0.0

TEAM: FG: 13/21 (61.9%), 3PT: 4/5 (80.0%), REB: 12 (2 off, 10 def), AST: 9, TO: 2
TEAM FOULS: 10 [Team_010 in BONUS]


Team_010
--------------------------------------------------------------------------------
Player                MIN  PTS  REB  AST  TO      FG   FG%      3P   3P%
--------------------------------------------------------------------------------
Michael Turner         32    7    3    1   0   3/6    50.0     0/0   0.0
Desmond Antetokounmpo   32    6    1    0   0   2/5    40.0     0/0   0.0
Cade Morant            32    4    2    0   0   2/4    50.0     0/0   0.0
Anthony Durant         32    4    2    1   0   2/3    66.7     0/0   0.0
RJ Young               32    3    0    0   0   1/2    50.0     0/0   0.0

TEAM: FG: 10/20 (50.0%), 3PT: 1/6 (16.7%), REB: 8 (0 off, 8 def), AST: 2, TO: 2
TEAM FOULS: 4

================================================================================

================================================================================
                       4TH QUARTER - Team_029 vs Team_010                       
================================================================================

[12:00] Team_029 possession (Score: 91-70)
Scottie Bird attempts a 3Pt. Contested by Cade Morant (4.5 feet, ZONE). Scottie Bird misses. Rebound secured by Anthony Durant.

[11:44] Team_010 possession (Score: 91-70)
Anthony Durant makes the Dunk and draws the foul on Devin Butler! And-1! Anthony Durant to the line for 1. [Team fouls: 1] (Devin Butler: 1 personal fouls)   FT 1/1: GOOD Anthony Durant makes 1/1 from the line.
Score: 91-73

[11:30] Team_029 possession (Score: 91-73)
Giannis Banchero attempts a Midrange. Contested by RJ Young (5.6 feet, MAN). Giannis Banchero misses. Rebound secured by Anthony Durant.

[11:17] Team_010 possession (Score: 91-73)
Michael Turner attempts a 3Pt. Contested by Scottie Bird (3.8 feet, MAN). Michael Turner misses. Rebound secured by Giannis Banchero.

[11:02] Team_029 possession (Score: 91-73)
Scottie Bird attempts a 3Pt. Contested by Michael Turner (4.6 feet, MAN). Scottie Bird misses. Rebound secured by Cade Morant.

[10:51] Team_010 possession (Score: 91-73)
Michael Turner attempts a Layup. Contested by James Wall (2.9 feet, ZONE). MICHAEL TURNER MAKES IT!
Score: 91-75

[10:35] Team_029 possession (Score: 91-75)
FOUL! Reach-in foul on Anthony Durant during the drive. [Team fouls: 1] No free throws, side out. (Anthony Durant: 1 personal fouls)

[10:24] Team_029 possession (Score: 91-75)
Devin Butler drives and kicks out. Giannis Banchero attempts a 3Pt. Contested by RJ Young (5.2 feet, MAN). Giannis Banchero misses. Rebound secured by Cade Morant.

[10:10] Team_010 possession (Score: 91-75)
Anthony Durant attempts a Layup. Contested by Devin Butler (4.9 feet, MAN). Anthony Durant misses. Rebound secured by James Wall.

[09:54] Team_029 possession (Score: 91-75)
Scottie Bird drives, picks up Anthony Durant. Help arrives from Cade Morant! Scottie Bird attempts a Dunk. Contested by Cade Morant (4.4 feet, ZONE). Scottie Bird misses. Offensive rebound by James Wall! James Wall's putback is no good. Rebound secured by Anthony Durant.

[09:41] Team_010 possession (Score: 91-75)
Cade Morant attempts a 3Pt. Contested by Paul Iverson (5.2 feet, MAN). Cade Morant misses. Rebound secured by Giannis Banchero.

[09:29] Team_029 possession (Score: 91-75)
FOUL! Shooting foul on RJ Young. Giannis Banchero to the line for 3 free throws. [Team fouls: 2] (RJ Young: 1 personal fouls)   FT 1/3: GOOD   FT 2/3: GOOD   FT 3/3: GOOD Giannis Banchero makes 3/3 from the line.
Score: 94-75

[09:14] Team_010 possession (Score: 94-75)
Cade Morant attempts a 3Pt. Contested by Giannis Banchero (4.8 feet, ZONE). Cade Morant misses. Rebound secured by James Wall.

[08:57] Team_029 possession (Score: 94-75)
Devin Butler makes the Layup and draws the foul on Anthony Durant! And-1! Devin Butler to the line for 1. [Team fouls: 3] (Anthony Durant: 2 personal fouls)   FT 1/1: GOOD Devin Butler makes 1/1 from the line.
Score: 97-75

[08:45] Team_010 possession (Score: 97-75)
FOUL! Shooting foul on Paul Iverson. Cade Morant to the line for 2 free throws. [Team fouls: 2] (Paul Iverson: 1 personal fouls)   FT 1/2: GOOD   FT 2/2: GOOD Cade Morant makes 2/2 from the line.
Score: 97-77

[08:31] Team_029 possession (Score: 97-77)
Devin Butler attempts a Midrange. Contested by RJ Young (5.8 feet, ZONE). Devin Butler misses. Rebound secured by Cade Morant.

[08:20] Team_010 possession (Score: 97-77)
Michael Turner attempts a Layup. Contested by Scottie Bird (4.3 feet, MAN). Michael Turner misses. Rebound secured by Giannis Banchero.

[08:04] Team_029 possession (Score: 97-77)
James Wall drives to the basket... FOUL! Offensive foul on James Wall! Anthony Durant drew the charge! [Team fouls: 3] (James Wall: 1 personal fouls) TURNOVER! (dead ball)

[07:51] Team_010 possession (Score: 97-77)
Anthony Durant attempts a Layup. BLOCKED BY SCOTTIE BIRD! Ball deflects out of bounds off Anthony Durant.

[07:32] Team_029 possession (Score: 97-77)
Giannis Banchero attempts a Midrange. Contested by Cade Morant (5.3 feet, ZONE). Giannis Banchero misses. Rebound secured by Anthony Durant.

[07:16] Team_010 possession (Score: 97-77)
Desmond Antetokounmpo throws a bad pass! Stolen by James Wall! TURNOVER! (live ball)

[06:59] Team_029 possession (Score: 97-77)
Paul Iverson drives and kicks out. Devin Butler attempts a Midrange. Contested by Anthony Durant (4.7 feet, MAN). Devin Butler misses. Rebound secured by Michael Turner.

[06:45] Team_010 possession (Score: 97-77)
Cade Morant drives, Paul Iverson stays with him. Cade Morant attempts a Dunk. Contested by Paul Iverson (5.5 feet, MAN). Cade Morant misses. Rebound secured by Devin Butler.

[06:28] Team_029 possession (Score: 97-77)
Paul Iverson attempts a Midrange. Contested by Cade Morant (5.2 feet, MAN). Paul Iverson misses. Rebound secured by Michael Turner.

[06:10] Team_010 possession (Score: 97-77)
Cade Morant drives, picks up Paul Iverson. Help arrives from Scottie Bird! Cade Morant attempts a Layup. Contested by Scottie Bird (5.6 feet, MAN). Cade Morant misses. Rebound secured by James Wall.

[05:59] Team_029 possession (Score: 97-77)
Paul Iverson attempts a Midrange. Contested by Cade Morant (5.2 feet, MAN). PAUL IVERSON MAKES IT!
Score: 99-77

[05:46] Team_010 possession (Score: 99-77)
Desmond Antetokounmpo attempts a 3Pt. Contested by James Wall (3.3 feet, MAN). Desmond Antetokounmpo misses. Rebound secured by Giannis Banchero.

[05:30] Team_029 possession (Score: 99-77)
Paul Iverson attempts a 3Pt. Contested by Cade Morant (5.3 feet, ZONE). Paul Iverson misses. Rebound secured by Cade Morant.

[05:13] Team_010 possession (Score: 99-77)
Desmond Antetokounmpo attempts a Midrange. Contested by Giannis Banchero (5.1 feet, ZONE). DESMOND ANTETOKOUNMPO MAKES IT!
Score: 99-79

[04:58] Team_029 possession (Score: 99-79)
FOUL! Holding foul on RJ Young. [Team fouls: 4] No free throws, side out. (RJ Young: 2 personal fouls)

[04:42] Team_029 possession (Score: 99-79)
FOUL! Reach-in foul on Michael Turner during the drive. [IN THE BONUS! 5 team fouls] Scottie Bird to the line for 2 free throws. (Michael Turner: 1 personal fouls)   FT 1/2: GOOD   FT 2/2: GOOD Scottie Bird makes 2/2 from the line.
Score: 101-79

[04:28] Team_010 possession (Score: 101-79)
FOUL! Holding foul on Paul Iverson. [Team fouls: 4] No free throws, side out. (Paul Iverson: 2 personal fouls)

[04:19] Team_010 possession (Score: 101-79)
Anthony Durant drives, James Wall stays with him. Anthony Durant attempts a Dunk. Contested by James Wall (3.6 feet, ZONE). Anthony Durant misses. Rebound secured by James Wall.

[04:03] Team_029 possession (Score: 101-79)
Devin Butler attempts a 3Pt. Contested by Cade Morant (5.7 feet, ZONE). Devin Butler misses. Rebound secured by Anthony Durant.

[03:52] Team_010 possession (Score: 101-79)
RJ Young attempts a 3Pt. Contested by Giannis Banchero (5.1 feet, MAN). RJ YOUNG MAKES IT! Assist: Anthony Durant
Score: 101-82

[03:35] Team_029 possession (Score: 101-82)
Devin Butler attempts a Layup. Wide open! Desmond Antetokounmpo is 6.0 feet away. [ZONE] DEVIN BUTLER MAKES IT! Assist: Scottie Bird
Score: 103-82

[03:18] Team_010 possession (Score: 103-82)
Anthony Durant attempts a 3Pt. Contested by Giannis Banchero (5.6 feet, ZONE). Anthony Durant misses. Rebound secured by Devin Butler.

[03:03] Team_029 possession (Score: 103-82)
FOUL! Shooting foul on Cade Morant. Paul Iverson to the line for 3 free throws. [BONUS: 6 team fouls] (Cade Morant: 1 personal fouls)   FT 1/3: GOOD   FT 2/3: MISS   FT 3/3: GOOD Paul Iverson makes 2/3 from the line.
Score: 105-82

[02:50] Team_010 possession (Score: 105-82)
Cade Morant attempts a 3Pt. Contested by Giannis Banchero (5.8 feet, ZONE). Cade Morant misses. Rebound secured by James Wall.

[02:35] Team_029 possession (Score: 105-82)
James Wall attempts a 3Pt. Wide open! Desmond Antetokounmpo is 6.4 feet away. [MAN] JAMES WALL MAKES IT! Assist: Devin Butler
Score: 108-82

[02:22] Team_010 possession (Score: 108-82)
RJ Young attempts a 3Pt. Contested by Giannis Banchero (5.4 feet, ZONE). RJ Young misses. Rebound secured by James Wall.

[02:08] Team_029 possession (Score: 108-82)
James Wall attempts a 3Pt. Wide open! Cade Morant is 6.2 feet away. [ZONE] James Wall misses. Rebound secured by Anthony Durant.

[01:54] Team_010 possession (Score: 108-82)
Michael Turner makes the 3Pt and draws the foul on Scottie Bird! And-1! Michael Turner to the line for 1. [BONUS: 5 team fouls] (Scottie Bird: 1 personal fouls)   FT 1/1: MISS Michael Turner makes 0/1 from the line. Rebound secured by Giannis Banchero.
Score: 108-85

[01:39] Team_029 possession (Score: 108-85)
Scottie Bird drives and kicks out. Scottie Bird attempts a 3Pt. Contested by Michael Turner (5.9 feet, MAN). SCOTTIE BIRD MAKES IT! Assist: James Wall
Score: 111-85

[01:25] Team_010 possession (Score: 111-85)
Desmond Antetokounmpo drives and kicks out. FOUL! Shooting foul on Giannis Banchero. Desmond Antetokounmpo to the line for 3 free throws. [BONUS: 6 team fouls] (Giannis Banchero: 1 personal fouls)   FT 1/3: MISS   FT 2/3: GOOD   FT 3/3: GOOD Desmond Antetokounmpo makes 2/3 from the line.
Score: 111-87

[01:10] Team_029 possession (Score: 111-87)
Paul Iverson attempts a 3Pt. Wide open! Cade Morant is 6.0 feet away. [ZONE] Paul Iverson misses. Rebound secured by Michael Turner.

[00:55] Team_010 possession (Score: 111-87)
FOUL! Reach-in foul on Paul Iverson during the drive. [IN THE BONUS! 7 team fouls] Cade Morant to the line for 2 free throws. (Paul Iverson: 3 personal fouls)   FT 1/2: GOOD   FT 2/2: GOOD Cade Morant makes 2/2 from the line.
Score: 111-89

[00:40] Team_029 possession (Score: 111-89)
James Wall drives and kicks out. James Wall attempts a 3Pt. Wide open! Michael Turner is 6.1 feet away. [ZONE] JAMES WALL MAKES IT! Assist: Scottie Bird
Score: 114-89

[00:24] Team_010 possession (Score: 114-89)
Michael Turner makes the Layup and draws the foul on James Wall! And-1! Michael Turner to the line for 1. [BONUS: 8 team fouls] (James Wall: 2 personal fouls)   FT 1/1: GOOD Michael Turner makes 1/1 from the line.
Score: 114-92

[00:08] Team_029 possession (Score: 114-92)
Scottie Bird attempts a 3Pt. Wide open! Michael Turner is 6.1 feet away. [MAN] Scottie Bird misses. Offensive rebound by Devin Butler! Devin Butler kicks it out.

================================================================================
                              4TH QUARTER COMPLETE                              
================================================================================

4TH QUARTER SCORE: Team_029 23, Team_010 22

BOX SCORE:
================================================================================

Team_029
--------------------------------------------------------------------------------
Player                MIN  PTS  REB  AST  TO      FG   FG%      3P   3P%
--------------------------------------------------------------------------------
James Wall             41    6    6    1   0   2/3    66.7     0/0   0.0
Scottie Bird           44    5    0    2   0   2/5    40.0     0/0   0.0
Devin Butler           44    5    3    1   0   2/5    40.0     0/0   0.0
Paul Iverson           44    4    0    0   0   2/6    33.3     0/0   0.0
Giannis Banchero       44    3    5    0   0   1/3    33.3     0/0   0.0

TEAM: FG: 9/22 (40.9%), 3PT: 3/9 (33.3%), REB: 15 (2 off, 13 def), AST: 4, TO: 1
TEAM FOULS: 8 [Team_010 in BONUS]


Team_010
--------------------------------------------------------------------------------
Player                MIN  PTS  REB  AST  TO      FG   FG%      3P   3P%
--------------------------------------------------------------------------------
Michael Turner         44    5    3    0   0   2/5    40.0     0/0   0.0
Cade Morant            44    4    4    0   0   2/7    28.6     0/0   0.0
Desmond Antetokounmpo   44    4    0    0   0   2/3    66.7     0/0   0.0
Anthony Durant         44    3    6    1   0   1/5    20.0     0/0   0.0
RJ Young               44    3    0    0   0   1/2    50.0     0/0   0.0

TEAM: FG: 8/22 (36.4%), 3PT: 1/9 (11.1%), REB: 12 (0 off, 12 def), AST: 1, TO: 1
TEAM FOULS: 6 [Team_029 in BONUS]

================================================================================

================================================================================
                               FULL GAME COMPLETE                               
================================================================================

FINAL SCORE: Team_029 114, Team_010 92

SCORING BY QUARTER:
--------------------------------------------------------------------------------
Team                     Q1     Q2     Q3     Q4    FINAL
--------------------------------------------------------------------------------
Team_029                 33     27     31     23      114
Team_010                 17     28     25     22       92
--------------------------------------------------------------------------------

FULL GAME BOX SCORE:
================================================================================

Team_029
--------------------------------------------------------------------------------
Player                MIN  PTS  REB  AST  TO      FG   FG%      3P   3P%      FT STL BLK
--------------------------------------------------------------------------------
Paul Iverson           44   20    0    4   1  10/19   52.6   4/7    57.1  10/13    0   2
Scottie Bird           44   17    0    4   1   7/15   46.7   2/6    33.3   2/2     2   2
Giannis Banchero       44    9    9    5   2   6/12   50.0   4/6    66.7   3/3     1   0
Devin Butler           44   17   14    3   1   8/13   61.5   0/1     0.0   5/7     0   0
James Wall             41   27   24    5   0   7/12   58.3   2/4    50.0   4/5     2   1
Immanuel Irving         7    8    0    2   0   3/3   100.0   2/2   100.0   2/2     0   0
Bones Carter            5    4    0    0   0   1/3    33.3   0/2     0.0   2/2     0   0
Pau Anthony             5    2    2    0   0   1/1   100.0   1/1   100.0   2/3     0   0
Derrick Rozier          5    4    0    0   1   2/2   100.0   0/0     0.0   2/2     0   0
Shai Ball               5    2    1    0   0   1/1   100.0   0/0     0.0   0/0     0   0

TEAM: FG: 47/83 (56.6%), 3PT: 15/29 (51.7%), REB: 51 (8 off, 43 def), AST: 23, TO: 6


Team_010
--------------------------------------------------------------------------------
Player                MIN  PTS  REB  AST  TO      FG   FG%      3P   3P%      FT STL BLK
--------------------------------------------------------------------------------
Cade Morant            44   12   12    0   0   6/21   28.6   0/10    0.0   6/6     0   0
Michael Turner         44   20    8    3   3   9/18   50.0   0/8     0.0   6/7     0   0
RJ Young               44    9    0    2   1   2/6    33.3   1/4    25.0   2/2     0   0
Desmond Antetokounmpo   44   22    2    0   2   9/17   52.9   2/4    50.0   4/5     0   0
Anthony Durant         44    9   19    3   0   3/9    33.3   0/1     0.0   6/8     0   0
Draymond Leonard        5    2    0    0   0   0/1     0.0   0/1     0.0   2/2     0   0
Blake Harden            5    3    2    0   0   1/1   100.0   1/1   100.0   0/0     0   0
Ben Gilgeous-Alexander    5    5    0    1   0   2/2   100.0   0/0     0.0   1/2     0   0
Vince Ingram            5    4    0    0   0   2/2   100.0   0/0     0.0   0/0     0   0
Paolo Wade              5    0    1    3   0   0/2     0.0   0/1     0.0   0/0     0   0

TEAM: FG: 37/82 (45.1%), 3PT: 4/30 (13.3%), REB: 43 (8 off, 35 def), AST: 12, TO: 6

================================================================================
