================================================================================
                        FULL GAME - Team_073 vs Team_077                        
================================================================================

================================================================================
                       1ST QUARTER - Team_073 vs Team_077                       
================================================================================

[12:00] Team_073 possession (Score: 0-0)
Karl Williamson drives, Chris Ginobili stays with him. Karl Williamson attempts a Layup. Contested by Chris Ginobili (4.0 feet, MAN). Karl Williamson misses. Offensive rebound by Bradley Morant! Bradley Morant kicks it out.

[11:47] Team_073 possession (Score: 0-0)
FOUL! Reach-in foul on Draymond Dosunmu during the drive. [Team fouls: 1] No free throws, side out. (Draymond Dosunmu: 1 personal fouls)

[11:29] Team_073 possession (Score: 0-0)
Isaiah Smith attempts a Midrange. Contested by Draymond Dosunmu (4.5 feet, ZONE). Isaiah Smith misses. Rebound secured by Chris Ginobili.

[11:20] Team_077 possession (Score: 0-0)
Dejounte Allen attempts a 3Pt. Contested by Isaiah Smith (4.7 feet, MAN). Dejounte Allen misses. Rebound secured by Isaiah Smith.

[11:07] Team_073 possession (Score: 0-0)
Karl Williamson commits a violation (traveling/carry)! TURNOVER! (dead ball)

[10:56] Team_077 possession (Score: 0-0)
Russell Harden attempts a 3Pt. Contested by Carmelo Porzingis (4.3 feet, MAN). RUSSELL HARDEN MAKES IT! Assist: Draymond Dosunmu
Score: 0-3

[10:43] Team_073 possession (Score: 0-3)
Carmelo Porzingis attempts a 3Pt. Contested by Dejounte Allen (3.8 feet, ZONE). CARMELO PORZINGIS MAKES IT! Assist: Carmelo Young
Score: 3-3

[10:27] Team_077 possession (Score: 3-3)
Dejounte Allen attempts a 3Pt. Contested by Karl Williamson (3.5 feet, ZONE). Dejounte Allen misses. FOUL! Loose ball foul on Isaiah Smith during the rebound battle. [Team fouls: 1] No free throws, side out. (Isaiah Smith: 1 personal fouls)

[10:17] Team_077 possession (Score: 3-3)
Ja Ball attempts a Midrange. Contested by Carmelo Young (5.0 feet, MAN). JA BALL MAKES IT! Assist: Draymond Dosunmu
Score: 3-5

[09:59] Team_073 possession (Score: 3-5)
Carmelo Young attempts a 3Pt. Contested by Ja Ball (4.3 feet, MAN). Carmelo Young misses. Rebound secured by Chris Ginobili.

[09:43] Team_077 possession (Score: 3-5)
Russell Harden attempts a Midrange. Contested by Karl Williamson (3.6 feet, ZONE). Russell Harden misses. Offensive rebound by Russell Harden! Russell Harden kicks it out.

[09:30] Team_077 possession (Score: 3-5)
Dejounte Allen drives, Isaiah Smith stays with him. Dejounte Allen attempts a Layup. Contested by Isaiah Smith (4.7 feet, MAN). DEJOUNTE ALLEN MAKES IT! Assist: Ja Ball
Score: 3-7

[09:20] Team_073 possession (Score: 3-7)
Isaiah Smith makes the Layup and draws the foul on Dejounte Allen! And-1! Isaiah Smith to the line for 1. [Team fouls: 2] (Dejounte Allen: 1 personal fouls)   FT 1/1: GOOD Isaiah Smith makes 1/1 from the line.
Score: 6-7

[09:07] Team_077 possession (Score: 6-7)
Draymond Dosunmu attempts a Midrange. Contested by Isaiah Smith (3.9 feet, ZONE). Draymond Dosunmu misses. Rebound secured by Bradley Morant.

[08:51] Team_073 possession (Score: 6-7)
Isaiah Smith makes the Layup and draws the foul on Dejounte Allen! And-1! Isaiah Smith to the line for 1. [Team fouls: 3] (Dejounte Allen: 2 personal fouls)   FT 1/1: GOOD Isaiah Smith makes 1/1 from the line.
Score: 9-7

[08:32] Team_077 possession (Score: 9-7)
Ja Ball attempts a Midrange. Contested by Carmelo Young (5.0 feet, MAN). Ja Ball misses. Offensive rebound by Russell Harden! Russell Harden kicks it out.

[08:17] Team_077 possession (Score: 9-7)
Dejounte Allen attempts a 3Pt. Contested by Isaiah Smith (4.7 feet, MAN). Dejounte Allen misses. Rebound secured by Bradley Morant.

[08:01] Team_073 possession (Score: 9-7)
Karl Williamson attempts a 3Pt. Contested by Dejounte Allen (4.0 feet, ZONE). Karl Williamson misses. Rebound secured by Chris Ginobili.

[07:48] Team_077 possession (Score: 9-7)
Chris Ginobili attempts a Layup. Contested by Karl Williamson (3.6 feet, MAN). Chris Ginobili misses. Offensive rebound by Russell Harden! Russell Harden kicks it out.

[07:33] Team_077 possession (Score: 9-7)
Dejounte Allen attempts a 3Pt. Contested by Isaiah Smith (4.7 feet, MAN). DEJOUNTE ALLEN MAKES IT! Assist: Chris Ginobili
Score: 9-10

[07:17] Team_073 possession (Score: 9-10)
Bradley Morant makes the Layup and draws the foul on Draymond Dosunmu! And-1! Bradley Morant to the line for 1. [Team fouls: 4] (Draymond Dosunmu: 2 personal fouls)   FT 1/1: GOOD Bradley Morant makes 1/1 from the line.
Score: 12-10

[07:01] Team_077 possession (Score: 12-10)
FOUL! Shooting foul on Carmelo Porzingis. Russell Harden to the line for 2 free throws. [Team fouls: 2] (Carmelo Porzingis: 1 personal fouls)   FT 1/2: GOOD   FT 2/2: GOOD Russell Harden makes 2/2 from the line.
Score: 12-12

[06:47] Team_073 possession (Score: 12-12)
Carmelo Young drives, Ja Ball stays with him. Carmelo Young attempts a Dunk. Contested by Ja Ball (4.3 feet, MAN). CARMELO YOUNG MAKES IT! Assist: Karl Williamson
Score: 14-12

[06:32] Team_077 possession (Score: 14-12)
Chris Ginobili attempts a Midrange. Contested by Karl Williamson (3.6 feet, MAN). CHRIS GINOBILI MAKES IT! Assist: Ja Ball
Score: 14-14

[06:17] Team_073 possession (Score: 14-14)
Karl Williamson attempts a Layup. Contested by Russell Harden (4.7 feet, ZONE). KARL WILLIAMSON MAKES IT!
Score: 16-14

[06:06] Team_077 possession (Score: 16-14)
Dejounte Allen attempts a 3Pt. Contested by Isaiah Smith (4.7 feet, MAN). Dejounte Allen misses. Rebound secured by Bradley Morant.

[05:52] Team_073 possession (Score: 16-14)
Carmelo Porzingis drives, picks up Draymond Dosunmu. Help arrives from Ja Ball! Carmelo Porzingis attempts a Layup. Contested by Ja Ball (4.5 feet, ZONE). CARMELO PORZINGIS MAKES IT!
Score: 18-14

[05:40] Team_077 possession (Score: 18-14)
Draymond Dosunmu attempts a Layup. Contested by Bradley Morant (3.5 feet, MAN). Draymond Dosunmu misses. Rebound secured by Isaiah Smith.

[05:24] Team_073 possession (Score: 18-14)
FOUL! Offensive foul on Carmelo Porzingis! Russell Harden drew the charge! [Team fouls: 3] (Carmelo Porzingis: 2 personal fouls) TURNOVER! (dead ball)

[05:09] Team_077 possession (Score: 18-14)
Dejounte Allen attempts a 3Pt. Contested by Karl Williamson (3.6 feet, ZONE). Dejounte Allen misses. Rebound secured by Carmelo Porzingis.

[04:58] Team_073 possession (Score: 18-14)
Isaiah Smith attempts a 3Pt. Contested by Dejounte Allen (3.9 feet, ZONE). ISAIAH SMITH MAKES IT! Assist: Carmelo Young
Score: 21-14

[04:44] Team_077 possession (Score: 21-14)
Russell Harden attempts a 3Pt. Contested by Carmelo Porzingis (4.3 feet, MAN). Russell Harden misses. Rebound secured by Carmelo Porzingis.

[04:28] Team_073 possession (Score: 21-14)
FOUL! Reach-in foul on Draymond Dosunmu during the drive. [IN THE BONUS! 5 team fouls] Karl Williamson to the line for 2 free throws. (Draymond Dosunmu: 3 personal fouls)   FT 1/2: GOOD   FT 2/2: GOOD Karl Williamson makes 2/2 from the line.
Score: 23-14

[04:13] Team_077 possession (Score: 23-14)
Draymond Dosunmu attempts a Layup. Contested by Bradley Morant (3.6 feet, ZONE). DRAYMOND DOSUNMU MAKES IT!
Score: 23-16

[03:59] Team_073 possession (Score: 23-16)
Bradley Morant drives to the basket... FOUL! Offensive foul on Bradley Morant! Draymond Dosunmu drew the charge! [Team fouls: 4] (Bradley Morant: 1 personal fouls) TURNOVER! (dead ball)

[03:45] Team_077 possession (Score: 23-16)
Russell Harden makes the Midrange and draws the foul on Carmelo Porzingis! And-1! Russell Harden to the line for 1. [BONUS: 5 team fouls] (Carmelo Porzingis: 3 personal fouls)   FT 1/1: MISS Russell Harden makes 0/1 from the line. Rebound secured by Bradley Morant.
Score: 23-18

[03:28] Team_073 possession (Score: 23-18)
Carmelo Young drives to the basket... Carmelo Young loses the ball! Stripped by Ja Ball! TURNOVER! (live ball)

[03:12] Team_077 possession (Score: 23-18)
FOUL! Holding foul on Carmelo Porzingis. [IN THE BONUS! 6 team fouls] Russell Harden to the line for 2 free throws. (Carmelo Porzingis: 4 personal fouls)   FT 1/2: GOOD   FT 2/2: GOOD Russell Harden makes 2/2 from the line.
Score: 23-20

[02:59] Team_073 possession (Score: 23-20)
Bradley Morant makes the Layup and draws the foul on Draymond Dosunmu! And-1! Bradley Morant to the line for 1. [BONUS: 6 team fouls] (Draymond Dosunmu: 4 personal fouls)   FT 1/1: GOOD Bradley Morant makes 1/1 from the line.
Score: 26-20

[02:44] Team_077 possession (Score: 26-20)
FOUL! Holding foul on Karl Williamson. [IN THE BONUS! 7 team fouls] Chris Ginobili to the line for 2 free throws. (Karl Williamson: 1 personal fouls)   FT 1/2: GOOD   FT 2/2: MISS Chris Ginobili makes 1/2 from the line. Rebound secured by Bradley Morant.
Score: 26-21

[02:31] Team_073 possession (Score: 26-21)
Carmelo Young makes the Layup and draws the foul on Draymond Dosunmu! And-1! Carmelo Young to the line for 1. [BONUS: 7 team fouls] (Draymond Dosunmu: 5 personal fouls)   FT 1/1: GOOD Carmelo Young makes 1/1 from the line.
Score: 29-21

[02:20] Team_077 possession (Score: 29-21)
Ja Ball attempts a Midrange. Contested by Carmelo Porzingis (4.4 feet, ZONE). JA BALL MAKES IT! Assist: Dejounte Allen
Score: 29-23

[02:04] Team_073 possession (Score: 29-23)
Karl Williamson drives, Draymond Dosunmu stays with him. Karl Williamson attempts a Layup. Contested by Draymond Dosunmu (4.8 feet, ZONE). Karl Williamson misses. Rebound secured by Draymond Dosunmu.

[01:51] Team_077 possession (Score: 29-23)
Russell Harden attempts a 3Pt. Contested by Karl Williamson (4.0 feet, ZONE). Russell Harden misses. Rebound secured by Carmelo Porzingis.

[01:38] Team_073 possession (Score: 29-23)
Carmelo Young makes the Layup and draws the foul on Ja Ball! And-1! Carmelo Young to the line for 1. [BONUS: 8 team fouls] (Ja Ball: 1 personal fouls)   FT 1/1: MISS Carmelo Young makes 0/1 from the line. Offensive rebound by Carmelo Porzingis! Carmelo Porzingis kicks it out.
Score: 31-23

[01:22] Team_073 possession (Score: 31-23)
FOUL! Shooting foul on Draymond Dosunmu. Carmelo Porzingis to the line for 2 free throws. [BONUS: 9 team fouls] (Draymond Dosunmu: 6 personal fouls) Draymond Dosunmu FOULS OUT!   FT 1/2: GOOD   FT 2/2: GOOD Carmelo Porzingis makes 2/2 from the line.
Score: 33-23

[01:22] Substitution (Team_077): Draymond Dosunmu OUT (stamina: 67) → Bam Bryant IN (foul_out)

[01:12] Team_077 possession (Score: 33-23)
Ja Ball attempts a 3Pt. Contested by Carmelo Young (5.4 feet, MAN). Ja Ball misses. Offensive rebound by Russell Harden! Russell Harden kicks it out.

[00:58] Team_077 possession (Score: 33-23)
Russell Harden drives, Carmelo Porzingis stays with him. Russell Harden attempts a Dunk. Contested by Carmelo Porzingis (4.6 feet, MAN). RUSSELL HARDEN MAKES IT!
Score: 33-25

[00:47] Team_073 possession (Score: 33-25)
Bradley Morant attempts a Midrange. Contested by Russell Harden (5.3 feet, MAN). BRADLEY MORANT MAKES IT!
Score: 35-25

[00:31] Team_077 possession (Score: 35-25)
Dejounte Allen drives, Isaiah Smith stays with him. Dejounte Allen attempts a Dunk. Contested by Isaiah Smith (5.1 feet, MAN). DEJOUNTE ALLEN MAKES IT!
Score: 35-27

[00:17] Team_073 possession (Score: 35-27)
Karl Williamson attempts a Layup. Contested by Russell Harden (5.2 feet, ZONE). Karl Williamson misses. Rebound secured by Ja Ball.

[00:03] Team_077 possession (Score: 35-27)
Chris Ginobili attempts a 3Pt. Contested by Karl Williamson (4.2 feet, ZONE). Chris Ginobili misses. Rebound secured by Carmelo Porzingis.

================================================================================
                              1ST QUARTER COMPLETE                              
================================================================================

1ST QUARTER SCORE: Team_073 35, Team_077 27

BOX SCORE:
================================================================================

Team_073
--------------------------------------------------------------------------------
Player                MIN  PTS  REB  AST  TO      FG   FG%      3P   3P%
--------------------------------------------------------------------------------
Isaiah Smith           12    9    2    0   0   3/4    75.0     0/0   0.0
Bradley Morant         12    8    6    0   0   3/3   100.0     0/0   0.0
Carmelo Porzingis      12    7    5    0   0   3/3   100.0     0/0   0.0
Carmelo Young          12    5    0    2   0   2/3    66.7     0/0   0.0
Karl Williamson        12    4    0    1   0   2/5    40.0     0/0   0.0

TEAM: FG: 13/18 (72.2%), 3PT: 2/4 (50.0%), REB: 13 (2 off, 11 def), AST: 3, TO: 4
TEAM FOULS: 7 [Team_077 in BONUS]


Team_077
--------------------------------------------------------------------------------
Player                MIN  PTS  REB  AST  TO      FG   FG%      3P   3P%
--------------------------------------------------------------------------------
Russell Harden         12    9    4    0   0   4/7    57.1     0/0   0.0
Dejounte Allen         12    7    0    1   0   3/7    42.9     0/0   0.0
Ja Ball                12    4    1    2   0   2/2   100.0     0/0   0.0
Chris Ginobili         12    2    3    1   0   1/2    50.0     0/0   0.0
Draymond Dosunmu       11    2    2    2   0   1/3    33.3     0/0   0.0

TEAM: FG: 11/22 (50.0%), 3PT: 2/9 (22.2%), REB: 10 (5 off, 5 def), AST: 6, TO: 0
TEAM FOULS: 9 [Team_073 in BONUS]

================================================================================

================================================================================
                       2ND QUARTER - Team_073 vs Team_077                       
================================================================================

[12:00] Team_073 possession (Score: 35-27)
Karl Williamson attempts a 3Pt. Contested by Chris Ginobili (4.3 feet, ZONE). Karl Williamson misses. Rebound secured by Russell Harden.

[11:45] Team_077 possession (Score: 35-27)
Dejounte Allen attempts a Midrange. Contested by Bradley Morant (4.7 feet, ZONE). DEJOUNTE ALLEN MAKES IT! Assist: Russell Harden
Score: 35-29

[11:29] Team_073 possession (Score: 35-29)
Carmelo Porzingis drives, Russell Harden stays with him. Carmelo Porzingis attempts a Layup. Contested by Russell Harden (4.9 feet, MAN). CARMELO PORZINGIS MAKES IT! Assist: Carmelo Young
Score: 37-29

[11:14] Team_077 possession (Score: 37-29)
Draymond Dosunmu attempts a 3Pt. Contested by Carmelo Young (4.7 feet, ZONE). Draymond Dosunmu misses. Offensive rebound by Russell Harden! Russell Harden kicks it out.

[10:56] Team_077 possession (Score: 37-29)
Russell Harden drives, Bradley Morant stays with him. Russell Harden attempts a Dunk. Contested by Bradley Morant (4.8 feet, ZONE). RUSSELL HARDEN MAKES IT!
Score: 37-31

[10:40] Team_073 possession (Score: 37-31)
Bradley Morant attempts a Midrange. Contested by Dejounte Allen (4.5 feet, ZONE). Bradley Morant misses. FOUL! Loose ball foul on Draymond Dosunmu during the rebound battle. [Team fouls: 1] No free throws, side out. (Draymond Dosunmu: 1 personal fouls)

[10:23] Team_073 possession (Score: 37-31)
Carmelo Porzingis attempts a Layup. Contested by Russell Harden (5.0 feet, MAN). CARMELO PORZINGIS MAKES IT! Assist: Karl Williamson
Score: 39-31

[10:09] Team_077 possession (Score: 39-31)
FOUL! Offensive foul on Dejounte Allen! Isaiah Smith drew the charge! [Team fouls: 2] (Dejounte Allen: 1 personal fouls) TURNOVER! (dead ball)

[09:58] Team_073 possession (Score: 39-31)
Karl Williamson makes the 3Pt and draws the foul on Chris Ginobili! And-1! Karl Williamson to the line for 1. [Team fouls: 3] (Chris Ginobili: 1 personal fouls)   FT 1/1: MISS Karl Williamson makes 0/1 from the line. Rebound secured by Russell Harden.
Score: 42-31

[09:42] Team_077 possession (Score: 42-31)
Russell Harden attempts a 3Pt. Contested by Carmelo Porzingis (4.8 feet, MAN). Russell Harden misses. Rebound secured by Isaiah Smith.

[09:25] Team_073 possession (Score: 42-31)
Isaiah Smith attempts a 3Pt. Contested by Ja Ball (4.7 feet, ZONE). Isaiah Smith misses. Rebound secured by Draymond Dosunmu.

[09:11] Team_077 possession (Score: 42-31)
FOUL! Reach-in foul on Bradley Morant during the drive. [Team fouls: 1] No free throws, side out. (Bradley Morant: 1 personal fouls)

[08:56] Team_077 possession (Score: 42-31)
Ja Ball attempts a 3Pt. Contested by Karl Williamson (4.2 feet, ZONE). Ja Ball misses. FOUL! Loose ball foul on Carmelo Porzingis during the rebound battle. [Team fouls: 2] No free throws, side out. (Carmelo Porzingis: 1 personal fouls)

[08:41] Team_077 possession (Score: 42-31)
Ja Ball attempts a Midrange. Contested by Carmelo Young (5.7 feet, MAN). Ja Ball misses. Offensive rebound by Draymond Dosunmu! Draymond Dosunmu kicks it out.

[08:27] Team_077 possession (Score: 42-31)
Russell Harden drives, Carmelo Porzingis stays with him. Russell Harden attempts a Layup. Contested by Carmelo Porzingis (4.9 feet, MAN). Russell Harden misses. Rebound secured by Isaiah Smith.

[08:14] Team_073 possession (Score: 42-31)
Karl Williamson attempts a 3Pt. Contested by Ja Ball (4.9 feet, ZONE). Karl Williamson misses. Rebound secured by Russell Harden.

[07:56] Team_077 possession (Score: 42-31)
Draymond Dosunmu attempts a 3Pt. Contested by Bradley Morant (4.4 feet, MAN). DRAYMOND DOSUNMU MAKES IT! Assist: Dejounte Allen
Score: 42-34

[07:43] Team_073 possession (Score: 42-34)
Bradley Morant drives to the basket... Bradley Morant throws a bad pass out of bounds! TURNOVER! (dead ball)

[07:43] Substitution (Team_073): Carmelo Young OUT → Zach Quickley IN (stamina_rule2)

[07:43] Substitution (Team_073): Isaiah Smith OUT → Luka Butler IN (stamina_rule2)

[07:43] Substitution (Team_073): Karl Williamson OUT → Dwyane McCollum IN (stamina_rule2)

[07:43] Substitution (Team_073): Carmelo Porzingis OUT → Shai Thompson IN (stamina_rule2)

[07:43] Substitution (Team_073): Bradley Morant OUT → Ja Rose IN (stamina_rule2)

[07:43] Substitution (Team_077): Ja Ball OUT → Bam Bryant IN (stamina_rule2)

[07:43] Substitution (Team_077): Dejounte Allen OUT → Dejounte Quickley IN (stamina_rule2)

[07:43] Substitution (Team_077): Chris Ginobili OUT → Tyler Poole IN (stamina_rule2)

[07:43] Substitution (Team_077): Russell Harden OUT → Jordan Simmons IN (stamina_rule2)

[07:43] Substitution (Team_077): Draymond Dosunmu OUT → Ayo Griffin IN (stamina_rule2)

[07:28] Team_077 possession (Score: 42-34)
FOUL! Holding foul on Zach Quickley. [Team fouls: 3] No free throws, side out. (Zach Quickley: 1 personal fouls)

[07:17] Team_077 possession (Score: 42-34)
FOUL! Reach-in foul on Luka Butler during the drive. [Team fouls: 4] No free throws, side out. (Luka Butler: 1 personal fouls)

[07:03] Team_077 possession (Score: 42-34)
Tyler Poole throws a bad pass out of bounds! TURNOVER! (dead ball)

[06:45] Team_073 possession (Score: 42-34)
Zach Quickley attempts a Midrange. Contested by Dejounte Quickley (4.6 feet, ZONE). Zach Quickley misses. Offensive rebound by Dwyane McCollum! Dwyane McCollum puts it back in!
Score: 44-34

[06:30] Team_077 possession (Score: 44-34)
FOUL! Shooting foul on Dwyane McCollum. Ayo Griffin to the line for 2 free throws. [BONUS: 5 team fouls] (Dwyane McCollum: 1 personal fouls)   FT 1/2: GOOD   FT 2/2: GOOD Ayo Griffin makes 2/2 from the line.
Score: 44-36

[06:18] Team_073 possession (Score: 44-36)
Dwyane McCollum attempts a 3Pt. Contested by Dejounte Quickley (4.3 feet, ZONE). Dwyane McCollum misses. Rebound secured by Ayo Griffin.

[06:05] Team_077 possession (Score: 44-36)
Dejounte Quickley makes the Midrange and draws the foul on Luka Butler! And-1! Dejounte Quickley to the line for 1. [BONUS: 6 team fouls] (Luka Butler: 2 personal fouls)   FT 1/1: GOOD Dejounte Quickley makes 1/1 from the line.
Score: 44-39

[05:50] Team_073 possession (Score: 44-39)
Dwyane McCollum attempts a 3Pt. Contested by Dejounte Quickley (4.3 feet, ZONE). Dwyane McCollum misses. Rebound secured by Tyler Poole.

[05:36] Team_077 possession (Score: 44-39)
Dejounte Quickley drives and kicks out. Ayo Griffin makes the 3Pt and draws the foul on Luka Butler! And-1! Ayo Griffin to the line for 1. [BONUS: 7 team fouls] (Luka Butler: 3 personal fouls)   FT 1/1: GOOD Ayo Griffin makes 1/1 from the line.
Score: 44-43

[05:25] Team_073 possession (Score: 44-43)
Ja Rose attempts a Midrange. Contested by Ayo Griffin (4.9 feet, MAN). Ja Rose misses. Offensive rebound by Ja Rose! Ja Rose kicks it out.

[05:10] Team_073 possession (Score: 44-43)
Ja Rose attempts a Midrange. Contested by Dejounte Quickley (4.4 feet, ZONE). Ja Rose misses. Rebound secured by Ayo Griffin.

[04:55] Team_077 possession (Score: 44-43)
FOUL! Holding foul on Shai Thompson. [IN THE BONUS! 8 team fouls] Jordan Simmons to the line for 2 free throws. (Shai Thompson: 1 personal fouls)   FT 1/2: GOOD   FT 2/2: GOOD Jordan Simmons makes 2/2 from the line.
Score: 44-45

[04:39] Team_073 possession (Score: 44-45)
Dwyane McCollum attempts a 3Pt. Contested by Tyler Poole (4.2 feet, MAN). Dwyane McCollum misses. Rebound secured by Tyler Poole.

[04:29] Team_077 possession (Score: 44-45)
Ayo Griffin attempts a Layup. Contested by Ja Rose (5.4 feet, MAN). AYO GRIFFIN MAKES IT! Assist: Dejounte Quickley
Score: 44-47

[04:15] Team_073 possession (Score: 44-47)
Luka Butler attempts a Midrange. Contested by Dejounte Quickley (4.8 feet, MAN). Luka Butler misses. Rebound secured by Ayo Griffin.

[03:59] Team_077 possession (Score: 44-47)
Ayo Griffin attempts a Midrange. Contested by Ja Rose (5.4 feet, MAN). Ayo Griffin misses. Rebound secured by Shai Thompson.

[03:41] Team_073 possession (Score: 44-47)
Luka Butler drives to the basket... Luka Butler loses the ball! Stripped by Dejounte Quickley! TURNOVER! (live ball)

[03:26] Team_077 possession (Score: 44-47)
Bam Bryant attempts a Midrange. Contested by Zach Quickley (4.6 feet, MAN). BAM BRYANT MAKES IT!
Score: 44-49

[03:12] Team_073 possession (Score: 44-49)
Zach Quickley attempts a 3Pt. Contested by Dejounte Quickley (4.6 feet, ZONE). Zach Quickley misses. Rebound secured by Tyler Poole.

[02:55] Team_077 possession (Score: 44-49)
Bam Bryant attempts a 3Pt. Contested by Zach Quickley (4.6 feet, MAN). Bam Bryant misses. Rebound secured by Shai Thompson.

[02:42] Team_073 possession (Score: 44-49)
Luka Butler attempts a Layup. BLOCKED BY TYLER POOLE! Ball goes out off Tyler Poole. Luka Butler's ball!

[02:27] Team_073 possession (Score: 44-49)
FOUL! Shooting foul on Jordan Simmons. Shai Thompson to the line for 2 free throws. [Team fouls: 4] (Jordan Simmons: 1 personal fouls)   FT 1/2: GOOD   FT 2/2: GOOD Shai Thompson makes 2/2 from the line.
Score: 46-49

[02:18] Team_077 possession (Score: 46-49)
Tyler Poole attempts a Midrange. Contested by Luka Butler (4.8 feet, ZONE). Tyler Poole misses. Rebound secured by Shai Thompson.

[02:03] Team_073 possession (Score: 46-49)
Ja Rose attempts a Midrange. Contested by Ayo Griffin (4.9 feet, MAN). Ja Rose misses. Rebound secured by Jordan Simmons.

[01:46] Team_077 possession (Score: 46-49)
Bam Bryant attempts a Layup. BLOCKED BY LUKA BUTLER! Ball is loose! Offensive rebound by Ayo Griffin! Ayo Griffin kicks it out.

[01:31] Team_077 possession (Score: 46-49)
Dejounte Quickley attempts a 3Pt. Contested by Luka Butler (4.5 feet, MAN). Dejounte Quickley misses. Offensive rebound by Jordan Simmons! Jordan Simmons kicks it out.

[01:15] Team_077 possession (Score: 46-49)
Tyler Poole attempts a 3Pt. Contested by Dwyane McCollum (4.5 feet, MAN). Tyler Poole misses. Rebound secured by Ja Rose.

[01:00] Team_073 possession (Score: 46-49)
FOUL! Offensive foul on Shai Thompson! Jordan Simmons drew the charge! [Team fouls: 9] (Shai Thompson: 2 personal fouls) TURNOVER! (dead ball)

[00:46] Team_077 possession (Score: 46-49)
Jordan Simmons attempts a 3Pt. Contested by Zach Quickley (4.9 feet, ZONE). JORDAN SIMMONS MAKES IT! Assist: Dejounte Quickley
Score: 46-52

[00:32] Team_073 possession (Score: 46-52)
Shai Thompson attempts a 3Pt. Contested by Jordan Simmons (4.2 feet, MAN). Shai Thompson misses. Rebound secured by Jordan Simmons.

[00:16] Team_077 possession (Score: 46-52)
FOUL! Reach-in foul on Shai Thompson during the drive. [IN THE BONUS! 10 team fouls] Jordan Simmons to the line for 2 free throws. (Shai Thompson: 3 personal fouls)   FT 1/2: MISS   FT 2/2: GOOD Jordan Simmons makes 1/2 from the line.
Score: 46-53

[00:03] Team_073 possession (Score: 46-53)
Luka Butler attempts a Midrange. Contested by Jordan Simmons (4.5 feet, ZONE). Luka Butler misses. Rebound secured by Jordan Simmons.

================================================================================
                              2ND QUARTER COMPLETE                              
================================================================================

2ND QUARTER SCORE: Team_073 11, Team_077 26

BOX SCORE:
================================================================================

Team_073
--------------------------------------------------------------------------------
Player                MIN  PTS  REB  AST  TO      FG   FG%      3P   3P%
--------------------------------------------------------------------------------
Carmelo Porzingis      17    4    0    0   0   2/2   100.0     0/0   0.0
Dwyane McCollum         8    2    1    0   0   1/4    25.0     0/0   0.0
Shai Thompson           8    2    3    0   0   1/2    50.0     0/0   0.0
Karl Williamson        17    0    0    1   0   0/3     0.0     0/0   0.0
Carmelo Young          17    0    0    1   0   0/0     0.0     0/0   0.0
Bradley Morant         17    0    1    0   0   0/0     0.0     0/0   0.0
Isaiah Smith           17    0    2    0   0   0/1     0.0     0/0   0.0
Ja Rose                 8    0    2    0   0   0/2     0.0     0/0   0.0
Luka Butler             8    0    0    0   0   0/2     0.0     0/0   0.0
Zach Quickley           8    0    0    0   0   0/1     0.0     0/0   0.0

TEAM: FG: 4/17 (23.5%), 3PT: 0/9 (0.0%), REB: 9 (3 off, 6 def), AST: 2, TO: 3
TEAM FOULS: 10 [Team_077 in BONUS]


Team_077
--------------------------------------------------------------------------------
Player                MIN  PTS  REB  AST  TO      FG   FG%      3P   3P%
--------------------------------------------------------------------------------
Ayo Griffin             8    8    4    0   0   3/4    75.0     0/0   0.0
Jordan Simmons          8    6    4    0   0   3/3   100.0     0/0   0.0
Draymond Dosunmu       15    3    3    0   0   1/1   100.0     0/0   0.0
Dejounte Quickley       8    3    0    2   0   1/1   100.0     0/0   0.0
Russell Harden         17    2    4    1   0   1/3    33.3     0/0   0.0
Dejounte Allen         17    2    0    1   0   1/1   100.0     0/0   0.0
Bam Bryant              9    2    0    0   0   1/2    50.0     0/0   0.0
Tyler Poole             8    0    3    0   0   0/2     0.0     0/0   0.0

TEAM: FG: 11/17 (64.7%), 3PT: 2/5 (40.0%), REB: 18 (5 off, 13 def), AST: 4, TO: 2
TEAM FOULS: 4

================================================================================

================================================================================
                       3RD QUARTER - Team_073 vs Team_077                       
================================================================================

[12:00] Team_073 possession (Score: 46-53)
Isaiah Smith attempts a 3Pt. Contested by Dejounte Allen (3.9 feet, MAN). ISAIAH SMITH MAKES IT! Assist: Carmelo Young
Score: 49-53

[11:46] Team_077 possession (Score: 49-53)
Russell Harden makes the Midrange and draws the foul on Carmelo Porzingis! And-1! Russell Harden to the line for 1. [Team fouls: 1] (Carmelo Porzingis: 1 personal fouls)   FT 1/1: GOOD Russell Harden makes 1/1 from the line.
Score: 49-56

[11:33] Team_073 possession (Score: 49-56)
FOUL! Offensive foul on Bradley Morant! Draymond Dosunmu drew the charge! [Team fouls: 2] (Bradley Morant: 1 personal fouls) TURNOVER! (dead ball)

[11:16] Team_077 possession (Score: 49-56)
Ja Ball attempts a 3Pt. Contested by Karl Williamson (3.5 feet, ZONE). JA BALL MAKES IT! Assist: Dejounte Allen
Score: 49-59

[10:59] Team_073 possession (Score: 49-59)
Carmelo Young drives, Ja Ball stays with him. Carmelo Young attempts a Layup. Contested by Ja Ball (4.3 feet, MAN). CARMELO YOUNG MAKES IT! Assist: Carmelo Porzingis
Score: 51-59

[10:42] Team_077 possession (Score: 51-59)
FOUL! Shooting foul on Bradley Morant. Draymond Dosunmu to the line for 2 free throws. [Team fouls: 3] (Bradley Morant: 2 personal fouls)   FT 1/2: MISS   FT 2/2: MISS Draymond Dosunmu makes 0/2 from the line. Rebound secured by Bradley Morant.

[10:29] Team_073 possession (Score: 51-59)
FOUL! Reach-in foul on Draymond Dosunmu during the drive. [Team fouls: 1] No free throws, side out. (Draymond Dosunmu: 1 personal fouls)

[10:14] Team_073 possession (Score: 51-59)
Bradley Morant attempts a Midrange. Contested by Draymond Dosunmu (4.7 feet, MAN). Bradley Morant misses. Rebound secured by Draymond Dosunmu.

[10:00] Team_077 possession (Score: 51-59)
Draymond Dosunmu attempts a 3Pt. Contested by Carmelo Young (4.2 feet, ZONE). Draymond Dosunmu misses. Rebound secured by Carmelo Porzingis.

[09:50] Team_073 possession (Score: 51-59)
Carmelo Young attempts a Midrange. Contested by Ja Ball (4.3 feet, MAN). CARMELO YOUNG MAKES IT!
Score: 53-59

[09:34] Team_077 possession (Score: 53-59)
Ja Ball drives to the basket... Ja Ball loses the ball! Stripped by Carmelo Young! TURNOVER! (live ball)

[09:20] Team_073 possession (Score: 53-59)
Carmelo Porzingis attempts a Midrange. Contested by Russell Harden (4.5 feet, MAN). CARMELO PORZINGIS MAKES IT!
Score: 55-59

[09:08] Team_077 possession (Score: 55-59)
Draymond Dosunmu drives, picks up Bradley Morant. Help arrives from Isaiah Smith! Draymond Dosunmu attempts a Layup. Contested by Isaiah Smith (3.5 feet, ZONE). DRAYMOND DOSUNMU MAKES IT! Assist: Russell Harden
Score: 55-61

[08:54] Team_073 possession (Score: 55-61)
Karl Williamson drives and kicks out. Karl Williamson attempts a Midrange. Contested by Russell Harden (4.4 feet, ZONE). KARL WILLIAMSON MAKES IT! Assist: Isaiah Smith
Score: 57-61

[08:37] Team_077 possession (Score: 57-61)
Chris Ginobili attempts a 3Pt. Contested by Karl Williamson (3.6 feet, ZONE). Chris Ginobili misses. Offensive rebound by Draymond Dosunmu! Draymond Dosunmu kicks it out.

[08:25] Team_077 possession (Score: 57-61)
Ja Ball attempts a 3Pt. Contested by Karl Williamson (3.5 feet, ZONE). Ja Ball misses. Rebound secured by Isaiah Smith.

[08:13] Team_073 possession (Score: 57-61)
Carmelo Porzingis attempts a Midrange. BLOCKED BY CHRIS GINOBILI! Ball is loose! Offensive rebound by Carmelo Porzingis! Carmelo Porzingis kicks it out.

[08:00] Team_073 possession (Score: 57-61)
Carmelo Young attempts a 3Pt. Contested by Chris Ginobili (4.0 feet, ZONE). CARMELO YOUNG MAKES IT! Assist: Isaiah Smith
Score: 60-61

[07:47] Team_077 possession (Score: 60-61)
Dejounte Allen attempts a 3Pt. Contested by Karl Williamson (3.5 feet, ZONE). Dejounte Allen misses. Rebound secured by Isaiah Smith.

[07:32] Team_073 possession (Score: 60-61)
Isaiah Smith attempts a Layup. Contested by Russell Harden (4.6 feet, ZONE). ISAIAH SMITH MAKES IT! Assist: Carmelo Young
Score: 62-61

[07:17] Team_077 possession (Score: 62-61)
Chris Ginobili attempts a Midrange. Contested by Carmelo Porzingis (4.3 feet, ZONE). Chris Ginobili misses. Rebound secured by Bradley Morant.

[07:07] Team_073 possession (Score: 62-61)
Bradley Morant drives to the basket... Bradley Morant commits a violation (traveling/carry)! TURNOVER! (dead ball)

[06:50] Team_077 possession (Score: 62-61)
Dejounte Allen drives and kicks out. Chris Ginobili attempts a 3Pt. Contested by Karl Williamson (3.1 feet, MAN). CHRIS GINOBILI MAKES IT! Assist: Ja Ball
Score: 62-64

[06:34] Team_073 possession (Score: 62-64)
Carmelo Porzingis attempts a Midrange. Contested by Russell Harden (4.5 feet, MAN). Carmelo Porzingis misses. Rebound secured by Russell Harden.

[06:20] Team_077 possession (Score: 62-64)
Russell Harden attempts a Midrange. Contested by Carmelo Porzingis (4.3 feet, MAN). Russell Harden misses. Rebound secured by Bradley Morant.

[06:06] Team_073 possession (Score: 62-64)
Bradley Morant drives, Draymond Dosunmu stays with him. Bradley Morant attempts a Layup. Contested by Draymond Dosunmu (4.7 feet, MAN). BRADLEY MORANT MAKES IT! Assist: Carmelo Porzingis
Score: 64-64

[05:49] Team_077 possession (Score: 64-64)
Ja Ball makes the Layup and draws the foul on Carmelo Young! And-1! Ja Ball to the line for 1. [Team fouls: 4] (Carmelo Young: 1 personal fouls)   FT 1/1: MISS Ja Ball makes 0/1 from the line. Offensive rebound by Russell Harden! Russell Harden kicks it out.
Score: 64-66

[05:30] Team_077 possession (Score: 64-66)
Chris Ginobili drives and kicks out. Russell Harden attempts a 3Pt. Contested by Karl Williamson (3.1 feet, ZONE). RUSSELL HARDEN MAKES IT! Assist: Dejounte Allen
Score: 64-69

[05:16] Team_073 possession (Score: 64-69)
Isaiah Smith attempts a 3Pt. Contested by Dejounte Allen (3.9 feet, MAN). Isaiah Smith misses. Offensive rebound by Carmelo Porzingis! Carmelo Porzingis kicks it out.

[05:05] Team_073 possession (Score: 64-69)
Isaiah Smith drives, Draymond Dosunmu stays with him. Isaiah Smith attempts a Layup. Contested by Draymond Dosunmu (4.6 feet, ZONE). ISAIAH SMITH MAKES IT!
Score: 66-69

[04:50] Team_077 possession (Score: 66-69)
Russell Harden makes the Dunk and draws the foul on Carmelo Porzingis! And-1! Russell Harden to the line for 1. [BONUS: 5 team fouls] (Carmelo Porzingis: 2 personal fouls)   FT 1/1: GOOD Russell Harden makes 1/1 from the line.
Score: 66-72

[04:35] Team_073 possession (Score: 66-72)
Carmelo Porzingis attempts a 3Pt. Contested by Russell Harden (4.6 feet, MAN). Carmelo Porzingis misses. Rebound secured by Chris Ginobili.

[04:20] Team_077 possession (Score: 66-72)
Dejounte Allen attempts a 3Pt. Contested by Isaiah Smith (4.7 feet, MAN). Dejounte Allen misses. Rebound secured by Carmelo Porzingis.

[04:05] Team_073 possession (Score: 66-72)
Isaiah Smith drives to the basket... Isaiah Smith loses control! Ball rolls out of bounds! TURNOVER! (dead ball)

[03:53] Team_077 possession (Score: 66-72)
Draymond Dosunmu drives, Bradley Morant stays with him. Draymond Dosunmu attempts a Dunk. Contested by Bradley Morant (3.7 feet, MAN). DRAYMOND DOSUNMU MAKES IT! Assist: Russell Harden
Score: 66-74

[03:41] Team_073 possession (Score: 66-74)
Isaiah Smith drives, Draymond Dosunmu stays with him. Isaiah Smith attempts a Dunk. Contested by Draymond Dosunmu (4.6 feet, ZONE). ISAIAH SMITH MAKES IT! Assist: Bradley Morant
Score: 68-74

[03:25] Team_077 possession (Score: 68-74)
FOUL! Shooting foul on Carmelo Porzingis. Russell Harden to the line for 3 free throws. [BONUS: 6 team fouls] (Carmelo Porzingis: 3 personal fouls)   FT 1/3: GOOD   FT 2/3: GOOD   FT 3/3: GOOD Russell Harden makes 3/3 from the line.
Score: 68-77

[03:11] Team_073 possession (Score: 68-77)
Karl Williamson attempts a Layup. Contested by Chris Ginobili (4.2 feet, MAN). Karl Williamson misses. Rebound secured by Chris Ginobili.

[03:00] Team_077 possession (Score: 68-77)
Ja Ball drives and kicks out. FOUL! Shooting foul on Karl Williamson. Chris Ginobili to the line for 2 free throws. [BONUS: 7 team fouls] (Karl Williamson: 1 personal fouls)   FT 1/2: GOOD   FT 2/2: GOOD Chris Ginobili makes 2/2 from the line.
Score: 68-79

[02:44] Team_073 possession (Score: 68-79)
Isaiah Smith drives and kicks out. Carmelo Young attempts a Midrange. Contested by Ja Ball (4.3 feet, MAN). Carmelo Young misses. Rebound secured by Draymond Dosunmu.

[02:30] Team_077 possession (Score: 68-79)
Russell Harden drives and kicks out. Ja Ball attempts a 3Pt. Contested by Carmelo Young (4.8 feet, MAN). Ja Ball misses. Rebound secured by Carmelo Porzingis.

[02:17] Team_073 possession (Score: 68-79)
Karl Williamson attempts a 3Pt. Contested by Chris Ginobili (4.3 feet, MAN). Karl Williamson misses. Rebound secured by Draymond Dosunmu.

[02:02] Team_077 possession (Score: 68-79)
Chris Ginobili attempts a 3Pt. Contested by Karl Williamson (3.9 feet, ZONE). Chris Ginobili misses. Rebound secured by Bradley Morant.

[01:49] Team_073 possession (Score: 68-79)
FOUL! Reach-in foul on Dejounte Allen during the drive. [Team fouls: 2] No free throws, side out. (Dejounte Allen: 1 personal fouls)

[01:34] Team_073 possession (Score: 68-79)
Carmelo Young attempts a 3Pt. Contested by Dejounte Allen (4.2 feet, ZONE). Carmelo Young misses. Rebound secured by Chris Ginobili.

[01:21] Team_077 possession (Score: 68-79)
Dejounte Allen throws a bad pass out of bounds! TURNOVER! (dead ball)

[01:21] Substitution (Team_073): Carmelo Young OUT → Zach Quickley IN (stamina_rule2)

[01:21] Substitution (Team_073): Isaiah Smith OUT → Luka Butler IN (stamina_rule2)

[01:21] Substitution (Team_073): Karl Williamson OUT → Dwyane McCollum IN (stamina_rule2)

[01:21] Substitution (Team_073): Carmelo Porzingis OUT → Shai Thompson IN (stamina_rule2)

[01:21] Substitution (Team_073): Bradley Morant OUT → Ja Rose IN (stamina_rule2)

[01:21] Substitution (Team_077): Ja Ball OUT → Bam Bryant IN (stamina_rule2)

[01:21] Substitution (Team_077): Dejounte Allen OUT → Dejounte Quickley IN (stamina_rule2)

[01:21] Substitution (Team_077): Chris Ginobili OUT → Tyler Poole IN (stamina_rule2)

[01:21] Substitution (Team_077): Russell Harden OUT → Jordan Simmons IN (stamina_rule2)

[01:21] Substitution (Team_077): Draymond Dosunmu OUT → Ayo Griffin IN (stamina_rule2)

[01:05] Team_073 possession (Score: 68-79)
Zach Quickley makes the Layup and draws the foul on Jordan Simmons! And-1! Zach Quickley to the line for 1. [Team fouls: 3] (Jordan Simmons: 1 personal fouls)   FT 1/1: MISS Zach Quickley makes 0/1 from the line. Offensive rebound by Dwyane McCollum! Dwyane McCollum puts it back in!
Score: 72-79

[00:47] Team_077 possession (Score: 72-79)
Tyler Poole attempts a 3Pt. Contested by Luka Butler (4.8 feet, ZONE). TYLER POOLE MAKES IT! Assist: Dejounte Quickley
Score: 72-82

[00:35] Team_073 possession (Score: 72-82)
Zach Quickley drives and kicks out. Dwyane McCollum attempts a 3Pt. Contested by Tyler Poole (4.2 feet, MAN). Dwyane McCollum misses. Rebound secured by Tyler Poole.

[00:21] Team_077 possession (Score: 72-82)
Dejounte Quickley attempts a Midrange. Contested by Luka Butler (4.5 feet, ZONE). Dejounte Quickley misses. Offensive rebound by Jordan Simmons! Jordan Simmons kicks it out.

[00:05] Team_077 possession (Score: 72-82)
Ayo Griffin drives, Shai Thompson stays with him. Ayo Griffin attempts a Dunk. Contested by Shai Thompson (3.6 feet, ZONE). AYO GRIFFIN MAKES IT!
Score: 72-84

================================================================================
                              3RD QUARTER COMPLETE                              
================================================================================

3RD QUARTER SCORE: Team_073 26, Team_077 31

BOX SCORE:
================================================================================

Team_073
--------------------------------------------------------------------------------
Player                MIN  PTS  REB  AST  TO      FG   FG%      3P   3P%
--------------------------------------------------------------------------------
Isaiah Smith           28    9    2    2   0   4/5    80.0     0/0   0.0
Carmelo Young          28    7    0    2   0   3/4    75.0     0/0   0.0
Dwyane McCollum         9    4    0    0   0   1/1   100.0     0/0   0.0
Carmelo Porzingis      28    2    5    2   0   1/3    33.3     0/0   0.0
Bradley Morant         28    2    4    1   0   1/2    50.0     0/0   0.0
Karl Williamson        28    2    0    0   0   1/3    33.3     0/0   0.0
Zach Quickley           9    0    0    0   0   0/1     0.0     0/0   0.0

TEAM: FG: 11/19 (57.9%), 3PT: 2/5 (40.0%), REB: 11 (2 off, 9 def), AST: 7, TO: 3
TEAM FOULS: 7 [Team_077 in BONUS]


Team_077
--------------------------------------------------------------------------------
Player                MIN  PTS  REB  AST  TO      FG   FG%      3P   3P%
--------------------------------------------------------------------------------
Russell Harden         28   12    2    2   0   4/6    66.7     0/0   0.0
Chris Ginobili         28    5    3    0   0   2/4    50.0     0/0   0.0
Draymond Dosunmu       26    4    4    0   0   2/4    50.0     0/0   0.0
Ja Ball                28    3    0    1   0   1/2    50.0     0/0   0.0
Tyler Poole             9    3    1    0   0   1/1   100.0     0/0   0.0
Ayo Griffin             9    2    0    0   0   1/1   100.0     0/0   0.0
Dejounte Allen         28    0    0    2   0   0/2     0.0     0/0   0.0
Dejounte Quickley       9    0    0    1   0   0/0     0.0     0/0   0.0
Jordan Simmons          9    0    1    0   0   0/0     0.0     0/0   0.0

TEAM: FG: 11/20 (55.0%), 3PT: 3/8 (37.5%), REB: 11 (3 off, 8 def), AST: 6, TO: 2
TEAM FOULS: 3

================================================================================

================================================================================
                       4TH QUARTER - Team_073 vs Team_077                       
================================================================================

[12:00] Substitution (Team_073): Carmelo Young OUT (stamina: 74) → Zach Quickley IN (comeback_detected)

[12:00] Substitution (Team_077): Ja Ball OUT (stamina: 77) → Bam Bryant IN (comeback_detected)

[12:00] Team_073 possession (Score: 72-84)
Carmelo Porzingis drives and kicks out. FOUL! Shooting foul on Chris Ginobili. Zach Quickley to the line for 2 free throws. [Team fouls: 1] (Chris Ginobili: 1 personal fouls)   FT 1/2: GOOD   FT 2/2: MISS Zach Quickley makes 1/2 from the line. Rebound secured by Draymond Dosunmu.
Score: 73-84

[11:46] Team_077 possession (Score: 73-84)
Dejounte Allen attempts a 3Pt. Contested by Isaiah Smith (4.8 feet, MAN). DEJOUNTE ALLEN MAKES IT! Assist: Chris Ginobili
Score: 73-87

[11:32] Team_073 possession (Score: 73-87)
Carmelo Porzingis attempts a 3Pt. BLOCKED BY RUSSELL HARDEN! Ball is loose! Offensive rebound by Carmelo Porzingis! Carmelo Porzingis kicks it out.

[11:18] Team_073 possession (Score: 73-87)
Isaiah Smith drives to the basket... Isaiah Smith loses control! Ball rolls out of bounds! TURNOVER! (dead ball)

[11:01] Team_077 possession (Score: 73-87)
Chris Ginobili attempts a 3Pt. Contested by Karl Williamson (3.8 feet, MAN). CHRIS GINOBILI MAKES IT! Assist: Russell Harden
Score: 73-90

[10:48] Team_073 possession (Score: 73-90)
FOUL! Holding foul on Draymond Dosunmu. [Team fouls: 2] No free throws, side out. (Draymond Dosunmu: 1 personal fouls)

[10:30] Team_073 possession (Score: 73-90)
Carmelo Porzingis loses the ball! Stripped by Russell Harden! TURNOVER! (live ball)

[10:19] Team_077 possession (Score: 73-90)
Dejounte Allen attempts a 3Pt. Contested by Karl Williamson (3.8 feet, ZONE). Dejounte Allen misses. Rebound secured by Bradley Morant.

[10:05] Team_073 possession (Score: 73-90)
Bradley Morant attempts a 3Pt. Contested by Dejounte Allen (4.3 feet, ZONE). Bradley Morant misses. Offensive rebound by Carmelo Porzingis! Carmelo Porzingis kicks it out.

[09:45] Team_073 possession (Score: 73-90)
Zach Quickley drives, Draymond Dosunmu stays with him. Zach Quickley attempts a Dunk. Contested by Draymond Dosunmu (5.0 feet, ZONE). ZACH QUICKLEY MAKES IT! Assist: Isaiah Smith
Score: 75-90

[09:32] Team_077 possession (Score: 75-90)
Chris Ginobili attempts a Midrange. Contested by Isaiah Smith (5.1 feet, ZONE). Chris Ginobili misses. Rebound secured by Isaiah Smith.

[09:21] Team_073 possession (Score: 75-90)
Bradley Morant attempts a Dunk. BLOCKED BY DRAYMOND DOSUNMU! Ball is loose! Rebound secured by Russell Harden.

[09:08] Team_077 possession (Score: 75-90)
Russell Harden makes the Layup and draws the foul on Carmelo Porzingis! And-1! Russell Harden to the line for 1. [Team fouls: 1] (Carmelo Porzingis: 1 personal fouls)   FT 1/1: GOOD Russell Harden makes 1/1 from the line.
Score: 75-93

[08:53] Team_073 possession (Score: 75-93)
Carmelo Porzingis drives, Russell Harden stays with him. Carmelo Porzingis attempts a Dunk. Contested by Russell Harden (5.0 feet, MAN). CARMELO PORZINGIS MAKES IT!
Score: 77-93

[08:36] Team_077 possession (Score: 77-93)
Draymond Dosunmu attempts a Midrange. Contested by Bradley Morant (4.0 feet, MAN). Draymond Dosunmu misses. Offensive rebound by Russell Harden! Russell Harden kicks it out.

[08:21] Team_077 possession (Score: 77-93)
Russell Harden attempts a Layup. Contested by Bradley Morant (4.9 feet, ZONE). RUSSELL HARDEN MAKES IT! Assist: Bam Bryant
Score: 77-95

[08:06] Team_073 possession (Score: 77-95)
Carmelo Porzingis attempts a Midrange. Contested by Russell Harden (5.1 feet, MAN). Carmelo Porzingis misses. Rebound secured by Draymond Dosunmu.

[07:50] Team_077 possession (Score: 77-95)
Chris Ginobili attempts a 3Pt. Contested by Karl Williamson (4.2 feet, ZONE). Chris Ginobili misses. Offensive rebound by Draymond Dosunmu! Draymond Dosunmu kicks it out.

[07:35] Team_077 possession (Score: 77-95)
Chris Ginobili drives and kicks out. Dejounte Allen attempts a 3Pt. Contested by Karl Williamson (3.8 feet, ZONE). Dejounte Allen misses. Rebound secured by Carmelo Porzingis.

[07:21] Team_073 possession (Score: 77-95)
Bradley Morant makes the Layup and draws the foul on Draymond Dosunmu! And-1! Bradley Morant to the line for 1. [Team fouls: 3] (Draymond Dosunmu: 2 personal fouls)   FT 1/1: GOOD Bradley Morant makes 1/1 from the line.
Score: 80-95

[07:09] Team_077 possession (Score: 80-95)
Draymond Dosunmu drives, picks up Bradley Morant. Help arrives from Isaiah Smith! Draymond Dosunmu attempts a Dunk. Contested by Isaiah Smith (4.2 feet, ZONE). Draymond Dosunmu misses. Rebound secured by Carmelo Porzingis.

[06:55] Team_073 possession (Score: 80-95)
Karl Williamson attempts a 3Pt. Contested by Dejounte Allen (4.6 feet, ZONE). Karl Williamson misses. Rebound secured by Russell Harden.

[06:39] Team_077 possession (Score: 80-95)
Draymond Dosunmu attempts a Midrange. Contested by Bradley Morant (4.3 feet, MAN). Draymond Dosunmu misses. Rebound secured by Carmelo Porzingis.

[06:25] Team_073 possession (Score: 80-95)
Karl Williamson attempts a 3Pt. Contested by Dejounte Allen (4.6 feet, ZONE). Karl Williamson misses. Rebound secured by Draymond Dosunmu.

[06:06] Team_077 possession (Score: 80-95)
Dejounte Allen attempts a 3Pt. Contested by Isaiah Smith (5.4 feet, MAN). Dejounte Allen misses. Rebound secured by Bradley Morant.

[05:56] Team_073 possession (Score: 80-95)
Karl Williamson attempts a 3Pt. Contested by Dejounte Allen (4.7 feet, ZONE). KARL WILLIAMSON MAKES IT! Assist: Zach Quickley
Score: 83-95

[05:40] Team_077 possession (Score: 83-95)
Russell Harden attempts a 3Pt. Contested by Carmelo Porzingis (5.0 feet, MAN). RUSSELL HARDEN MAKES IT! Assist: Bam Bryant
Score: 83-98

[05:28] Team_073 possession (Score: 83-98)
Karl Williamson attempts a 3Pt. Contested by Dejounte Allen (4.8 feet, ZONE). Karl Williamson misses. Rebound secured by Draymond Dosunmu.

[05:16] Team_077 possession (Score: 83-98)
FOUL! Shooting foul on Zach Quickley. Bam Bryant to the line for 2 free throws. [Team fouls: 2] (Zach Quickley: 1 personal fouls)   FT 1/2: GOOD   FT 2/2: GOOD Bam Bryant makes 2/2 from the line.
Score: 83-100

[05:04] Team_073 possession (Score: 83-100)
Isaiah Smith attempts a 3Pt. Contested by Russell Harden (5.5 feet, ZONE). Isaiah Smith misses. Rebound secured by Draymond Dosunmu.

[04:51] Team_077 possession (Score: 83-100)
Chris Ginobili attempts a 3Pt. Contested by Karl Williamson (4.6 feet, MAN). Chris Ginobili misses. Rebound secured by Bradley Morant.

[04:40] Team_073 possession (Score: 83-100)
Bradley Morant drives to the basket... Bradley Morant throws a bad pass! Stolen by Draymond Dosunmu! TURNOVER! (live ball)

[04:25] Team_077 possession (Score: 83-100)
FOUL! Offensive foul on Dejounte Allen! Isaiah Smith drew the charge! [Team fouls: 4] (Dejounte Allen: 1 personal fouls) TURNOVER! (dead ball)

[04:10] Team_073 possession (Score: 83-100)
Isaiah Smith attempts a Midrange. Contested by Chris Ginobili (5.1 feet, ZONE). Isaiah Smith misses. Rebound secured by Russell Harden.

[03:57] Team_077 possession (Score: 83-100)
Chris Ginobili attempts a Midrange. Contested by Karl Williamson (4.7 feet, MAN). CHRIS GINOBILI MAKES IT!
Score: 83-102

[03:45] Team_073 possession (Score: 83-102)
Karl Williamson attempts a 3Pt. Contested by Dejounte Allen (5.0 feet, ZONE). Karl Williamson misses. Rebound secured by Draymond Dosunmu.

[03:30] Team_077 possession (Score: 83-102)
FOUL! Holding foul on Zach Quickley. [Team fouls: 3] No free throws, side out. (Zach Quickley: 2 personal fouls)

[03:13] Team_077 possession (Score: 83-102)
Bam Bryant attempts a 3Pt. Contested by Zach Quickley (4.8 feet, ZONE). Bam Bryant misses. Offensive rebound by Draymond Dosunmu! Draymond Dosunmu kicks it out.

[03:02] Team_077 possession (Score: 83-102)
Dejounte Allen attempts a Layup. Contested by Isaiah Smith (5.8 feet, MAN). Dejounte Allen misses. Rebound secured by Bradley Morant.

[02:52] Team_073 possession (Score: 83-102)
Carmelo Porzingis attempts a 3Pt. Contested by Dejounte Allen (5.0 feet, ZONE). CARMELO PORZINGIS MAKES IT! Assist: Isaiah Smith
Score: 86-102

[02:37] Team_077 possession (Score: 86-102)
FOUL! Holding foul on Bradley Morant. [Team fouls: 4] No free throws, side out. (Bradley Morant: 1 personal fouls)

[02:23] Team_077 possession (Score: 86-102)
Russell Harden attempts a Midrange. Contested by Carmelo Porzingis (5.5 feet, ZONE). Russell Harden misses. Rebound secured by Carmelo Porzingis.

[02:12] Team_073 possession (Score: 86-102)
Karl Williamson attempts a Midrange. Contested by Chris Ginobili (5.5 feet, MAN). KARL WILLIAMSON MAKES IT! Assist: Isaiah Smith
Score: 88-102

[01:59] Team_077 possession (Score: 88-102)
Chris Ginobili attempts a 3Pt. Contested by Karl Williamson (5.1 feet, MAN). CHRIS GINOBILI MAKES IT! Assist: Russell Harden
Score: 88-105

[01:48] Team_073 possession (Score: 88-105)
Isaiah Smith attempts a Layup. Contested by Dejounte Allen (5.3 feet, MAN). ISAIAH SMITH MAKES IT! Assist: Zach Quickley
Score: 90-105

[01:36] Team_077 possession (Score: 90-105)
Russell Harden drives, Carmelo Porzingis stays with him. Russell Harden attempts a Dunk. Contested by Carmelo Porzingis (5.6 feet, MAN). RUSSELL HARDEN MAKES IT! Assist: Draymond Dosunmu
Score: 90-107

[01:20] Team_073 possession (Score: 90-107)
Karl Williamson attempts a 3Pt. Contested by Dejounte Allen (5.4 feet, ZONE). Karl Williamson misses. Offensive rebound by Carmelo Porzingis! Carmelo Porzingis kicks it out.

[01:04] Team_073 possession (Score: 90-107)
Zach Quickley attempts a Midrange. Wide open! Russell Harden is 6.4 feet away. [ZONE] ZACH QUICKLEY MAKES IT!
Score: 92-107

[00:48] Team_077 possession (Score: 92-107)
Bam Bryant attempts a 3Pt. Contested by Zach Quickley (5.1 feet, MAN). Bam Bryant misses. Rebound secured by Bradley Morant.

[00:35] Team_073 possession (Score: 92-107)
Bradley Morant attempts a Midrange. Wide open! Draymond Dosunmu is 6.1 feet away. [MAN] BRADLEY MORANT MAKES IT!
Score: 94-107

[00:21] Team_077 possession (Score: 94-107)
Dejounte Allen attempts a 3Pt. Wide open! Isaiah Smith is 6.2 feet away. [MAN] Dejounte Allen misses. Offensive rebound by Russell Harden! Russell Harden kicks it out.

[00:04] Team_077 possession (Score: 94-107)
Chris Ginobili attempts a 3Pt. Contested by Karl Williamson (5.4 feet, MAN). Chris Ginobili misses. Rebound secured by Bradley Morant.

================================================================================
                              4TH QUARTER COMPLETE                              
================================================================================

4TH QUARTER SCORE: Team_073 22, Team_077 23

BOX SCORE:
================================================================================

Team_073
--------------------------------------------------------------------------------
Player                MIN  PTS  REB  AST  TO      FG   FG%      3P   3P%
--------------------------------------------------------------------------------
Carmelo Porzingis      40    5    7    0   0   2/4    50.0     0/0   0.0
Bradley Morant         40    5    6    0   0   2/3    66.7     0/0   0.0
Karl Williamson        40    5    0    0   0   2/6    33.3     0/0   0.0
Zach Quickley          21    4    0    2   0   2/2   100.0     0/0   0.0
Isaiah Smith           40    2    1    3   0   1/3    33.3     0/0   0.0

TEAM: FG: 9/18 (50.0%), 3PT: 2/7 (28.6%), REB: 14 (3 off, 11 def), AST: 5, TO: 3
TEAM FOULS: 4


Team_077
--------------------------------------------------------------------------------
Player                MIN  PTS  REB  AST  TO      FG   FG%      3P   3P%
--------------------------------------------------------------------------------
Russell Harden         40   10    5    2   0   4/5    80.0     0/0   0.0
Chris Ginobili         40    8    0    1   0   3/7    42.9     0/0   0.0
Dejounte Allen         40    3    0    0   0   1/4    25.0     0/0   0.0
Bam Bryant             23    2    0    2   0   1/2    50.0     0/0   0.0
Draymond Dosunmu       38    0    8    1   0   0/2     0.0     0/0   0.0

TEAM: FG: 9/20 (45.0%), 3PT: 4/9 (44.4%), REB: 13 (4 off, 9 def), AST: 6, TO: 1
TEAM FOULS: 4

================================================================================

================================================================================
                               FULL GAME COMPLETE                               
================================================================================

FINAL SCORE: Team_073 94, Team_077 107

SCORING BY QUARTER:
--------------------------------------------------------------------------------
Team                     Q1     Q2     Q3     Q4    FINAL
--------------------------------------------------------------------------------
Team_073                 35     11     26     22       94
Team_077                 27     26     31     23      107
--------------------------------------------------------------------------------

FULL GAME BOX SCORE:
================================================================================

Team_073
--------------------------------------------------------------------------------
Player                MIN  PTS  REB  AST  TO      FG   FG%      3P   3P%      FT STL BLK
--------------------------------------------------------------------------------
Isaiah Smith           40   20    7    5   1   8/13   61.5   2/4    50.0   2/2     0   0
Karl Williamson        40   11    0    2   2   5/17   29.4   1/10   10.0   2/3     0   0
Carmelo Porzingis      40   18   17    2   3   8/12   66.7   2/3    66.7   2/2     0   0
Bradley Morant         40   15   17    1   5   6/8    75.0   0/0     0.0   3/3     0   0
Carmelo Young          28   12    0    5   0   5/7    71.4   1/3    33.3   1/2     1   0
Zach Quickley          21    4    0    2   0   4/6    66.7   0/1     0.0   1/3     0   0
Luka Butler             9    0    0    0   0   0/2     0.0   0/0     0.0   0/0     0   1
Dwyane McCollum         9    6    2    0   1   0/3     0.0   0/3     0.0   0/0     0   0
Shai Thompson           9    2    3    0   1   1/2    50.0   0/1     0.0   2/2     0   0
Ja Rose                 9    0    2    0   0   0/2     0.0   0/0     0.0   0/0     0   0

TEAM: FG: 37/72 (51.4%), 3PT: 6/25 (24.0%), REB: 47 (10 off, 37 def), AST: 17, TO: 13


Team_077
--------------------------------------------------------------------------------
Player                MIN  PTS  REB  AST  TO      FG   FG%      3P   3P%      FT STL BLK
--------------------------------------------------------------------------------
Dejounte Allen         40   12    0    4   3   6/15   40.0   2/10   20.0   0/0     0   0
Chris Ginobili         40   15    6    2   0   5/12   41.7   2/6    33.3   3/4     0   1
Russell Harden         40   33   15    5   1  11/19   57.9   3/6    50.0  10/11    1   1
Draymond Dosunmu       38    9   17    3   0   4/10   40.0   1/2    50.0   0/2     1   1
Ja Ball                28    7    1    3   0   4/5    80.0   1/2    50.0   0/1     1   0
Bam Bryant             23    4    0    2   0   2/4    50.0   0/2     0.0   2/2     0   0
Dejounte Quickley       9    3    0    3   0   2/2   100.0   0/0     0.0   1/1     1   0
Tyler Poole             9    3    4    0   1   1/3    33.3   1/2    50.0   0/0     0   1
Jordan Simmons          9    6    5    0   0   2/2   100.0   1/1   100.0   3/4     0   0
Ayo Griffin             9   10    4    0   0   3/4    75.0   0/0     0.0   3/3     0   0

TEAM: FG: 42/79 (53.2%), 3PT: 11/31 (35.5%), REB: 52 (17 off, 35 def), AST: 22, TO: 5

================================================================================
