================================================================================
                        FULL GAME - Team_063 vs Team_034                        
================================================================================

================================================================================
                       1ST QUARTER - Team_063 vs Team_034                       
================================================================================

[12:00] Team_063 possession (Score: 0-0)
Tyler Harris attempts a Layup. Contested by Anthony Bane (5.1 feet, MAN). TYLER HARRIS MAKES IT!
Score: 2-0

[11:41] Team_034 possession (Score: 2-0)
Devin Poole attempts a Midrange. Contested by Bradley Davis (4.8 feet, MAN). DEVIN POOLE MAKES IT!
Score: 2-2

[11:25] Team_063 possession (Score: 2-2)
Tyler Harris attempts a Midrange. Contested by Cole Antetokounmpo (4.4 feet, ZONE). Tyler Harris misses. Offensive rebound by Tyler Harris! Tyler Harris puts it back in!
Score: 4-2

[11:09] Team_034 possession (Score: 4-2)
Anthony Bane drives to the basket... Anthony Bane loses control! Ball rolls out of bounds! TURNOVER! (dead ball)

[10:54] Team_063 possession (Score: 4-2)
Malcolm Quickley attempts a 3Pt. Contested by Ben Hyland (3.4 feet, ZONE). Malcolm Quickley misses. Rebound secured by Anthony Bane.

[10:39] Team_034 possession (Score: 4-2)
Cole Antetokounmpo drives, picks up Terry Reaves. Help arrives from Malcolm Quickley! Cole Antetokounmpo attempts a Dunk. Contested by Malcolm Quickley (5.1 feet, MAN). Cole Antetokounmpo misses. Rebound secured by Tyler Harris.

[10:24] Team_063 possession (Score: 4-2)
Malcolm Quickley attempts a Midrange. Contested by Ben Hyland (3.4 feet, MAN). MALCOLM QUICKLEY MAKES IT!
Score: 6-2

[10:11] Team_034 possession (Score: 6-2)
Anthony Bane attempts a Midrange. Contested by Malcolm Quickley (3.6 feet, ZONE). Anthony Bane misses. Rebound secured by Dirk Reaves.

[09:53] Team_063 possession (Score: 6-2)
Dirk Reaves drives, picks up Terry Doncic. Help arrives from Ben Hyland! Dirk Reaves attempts a Layup. Contested by Ben Hyland (4.3 feet, MAN). Dirk Reaves misses. Offensive rebound by Tyler Harris! Tyler Harris puts it back in!
Score: 8-2

[09:39] Team_034 possession (Score: 8-2)
Ben Hyland attempts a Midrange. Contested by Malcolm Quickley (3.6 feet, MAN). Ben Hyland misses. Rebound secured by Malcolm Quickley.

[09:27] Team_063 possession (Score: 8-2)
Dirk Reaves drives and kicks out. Terry Reaves attempts a 3Pt. Contested by Cole Antetokounmpo (4.5 feet, MAN). TERRY REAVES MAKES IT!
Score: 11-2

[09:14] Team_034 possession (Score: 11-2)
Anthony Bane drives, picks up Tyler Harris. Help arrives from Malcolm Quickley! Anthony Bane attempts a Layup. Contested by Malcolm Quickley (4.5 feet, MAN). ANTHONY BANE MAKES IT! Assist: Terry Doncic
Score: 11-4

[08:58] Team_063 possession (Score: 11-4)
Terry Reaves attempts a Midrange. Contested by Cole Antetokounmpo (4.8 feet, MAN). Terry Reaves misses. Rebound secured by Terry Doncic.

[08:43] Team_034 possession (Score: 11-4)
Cole Antetokounmpo loses the ball! Stripped by Terry Reaves! TURNOVER! (live ball)

[08:28] Team_063 possession (Score: 11-4)
FOUL! Reach-in foul on Terry Doncic during the drive. [Team fouls: 1] No free throws, side out. (Terry Doncic: 1 personal fouls)

[08:13] Team_063 possession (Score: 11-4)
Tyler Harris makes the Layup and draws the foul on Anthony Bane! And-1! Tyler Harris to the line for 1. [Team fouls: 2] (Anthony Bane: 1 personal fouls)   FT 1/1: GOOD Tyler Harris makes 1/1 from the line.
Score: 14-4

[07:59] Team_034 possession (Score: 14-4)
Terry Doncic attempts a 3Pt. Contested by Dirk Reaves (3.8 feet, MAN). TERRY DONCIC MAKES IT! Assist: Cole Antetokounmpo
Score: 14-7

[07:46] Team_063 possession (Score: 14-7)
Tyler Harris attempts a 3Pt. Contested by Devin Poole (3.8 feet, ZONE). Tyler Harris misses. Rebound secured by Anthony Bane.

[07:35] Team_034 possession (Score: 14-7)
Cole Antetokounmpo attempts a 3Pt. Contested by Terry Reaves (5.1 feet, MAN). COLE ANTETOKOUNMPO MAKES IT! Assist: Anthony Bane
Score: 14-10

[07:21] Team_063 possession (Score: 14-10)
Tyler Harris drives to the basket... Tyler Harris loses the ball! Stripped by Terry Doncic! TURNOVER! (live ball)

[07:10] Team_034 possession (Score: 14-10)
Anthony Bane attempts a Midrange. Contested by Terry Reaves (4.7 feet, ZONE). ANTHONY BANE MAKES IT! Assist: Devin Poole
Score: 14-12

[06:55] Team_063 possession (Score: 14-12)
Dirk Reaves attempts a Midrange. Contested by Terry Doncic (4.3 feet, ZONE). DIRK REAVES MAKES IT!
Score: 16-12

[06:45] Team_034 possession (Score: 16-12)
FOUL! Holding foul on Dirk Reaves. [Team fouls: 1] No free throws, side out. (Dirk Reaves: 1 personal fouls)

[06:31] Team_034 possession (Score: 16-12)
Terry Doncic attempts a Layup. Contested by Dirk Reaves (3.8 feet, MAN). TERRY DONCIC MAKES IT!
Score: 16-14

[06:15] Team_063 possession (Score: 16-14)
Dirk Reaves drives to the basket... Dirk Reaves loses the ball! Stripped by Terry Doncic! TURNOVER! (live ball)

[06:02] Team_034 possession (Score: 16-14)
Terry Doncic attempts a 3Pt. Contested by Malcolm Quickley (3.6 feet, ZONE). Terry Doncic misses. Rebound secured by Malcolm Quickley.

[05:47] Team_063 possession (Score: 16-14)
Terry Reaves attempts a 3Pt. Contested by Cole Antetokounmpo (4.8 feet, MAN). Terry Reaves misses. Rebound secured by Terry Doncic.

[05:28] Team_034 possession (Score: 16-14)
Terry Doncic loses control! Ball rolls out of bounds! TURNOVER! (dead ball)

[05:11] Team_063 possession (Score: 16-14)
Terry Reaves attempts a Midrange. Contested by Cole Antetokounmpo (4.8 feet, MAN). Terry Reaves misses. Rebound secured by Cole Antetokounmpo.

[04:54] Team_034 possession (Score: 16-14)
FOUL! Shooting foul on Malcolm Quickley. Devin Poole to the line for 3 free throws. [Team fouls: 2] (Malcolm Quickley: 1 personal fouls)   FT 1/3: MISS   FT 2/3: GOOD   FT 3/3: MISS Devin Poole makes 1/3 from the line. Rebound secured by Malcolm Quickley.
Score: 16-15

[04:38] Team_063 possession (Score: 16-15)
Bradley Davis attempts a 3Pt. Contested by Devin Poole (4.2 feet, MAN). BRADLEY DAVIS MAKES IT!
Score: 19-15

[04:24] Team_034 possession (Score: 19-15)
Ben Hyland attempts a Midrange. Contested by Malcolm Quickley (3.6 feet, MAN). Ben Hyland misses. Offensive rebound by Anthony Bane! Anthony Bane kicks it out.

[04:09] Team_034 possession (Score: 19-15)
Devin Poole attempts a 3Pt. Contested by Bradley Davis (4.8 feet, MAN). Devin Poole misses. Rebound secured by Malcolm Quickley.

[03:55] Team_063 possession (Score: 19-15)
Tyler Harris drives and kicks out. Bradley Davis attempts a 3Pt. Contested by Devin Poole (4.1 feet, MAN). BRADLEY DAVIS MAKES IT! Assist: Malcolm Quickley
Score: 22-15

[03:41] Team_034 possession (Score: 22-15)
Anthony Bane drives and kicks out. Anthony Bane attempts a 3Pt. Contested by Tyler Harris (4.6 feet, MAN). Anthony Bane misses. Rebound secured by Malcolm Quickley.

[03:31] Team_063 possession (Score: 22-15)
FOUL! Shooting foul on Anthony Bane. Malcolm Quickley to the line for 2 free throws. [Team fouls: 3] (Anthony Bane: 2 personal fouls)   FT 1/2: GOOD   FT 2/2: GOOD Malcolm Quickley makes 2/2 from the line.
Score: 24-15

[03:17] Team_034 possession (Score: 24-15)
Ben Hyland attempts a 3Pt. Contested by Malcolm Quickley (3.7 feet, MAN). Ben Hyland misses. Rebound secured by Tyler Harris.

[03:01] Team_063 possession (Score: 24-15)
Malcolm Quickley drives to the basket... Malcolm Quickley commits a violation (traveling/carry)! TURNOVER! (dead ball)

[03:01] Substitution (Team_063): Tyler Harris OUT → Kyle Green IN (stamina_rule2)

[03:01] Substitution (Team_034): Devin Poole OUT → Manu Jokic IN (stamina_rule2)

[02:44] Team_034 possession (Score: 24-15)
FOUL! Shooting foul on Malcolm Quickley. Manu Jokic to the line for 3 free throws. [Team fouls: 3] (Malcolm Quickley: 2 personal fouls)   FT 1/3: GOOD   FT 2/3: MISS   FT 3/3: GOOD Manu Jokic makes 2/3 from the line.
Score: 24-17

[02:28] Team_063 possession (Score: 24-17)
Bradley Davis attempts a Midrange. Contested by Manu Jokic (4.9 feet, MAN). Bradley Davis misses. Rebound secured by Terry Doncic.

[02:14] Team_034 possession (Score: 24-17)
Anthony Bane drives, Kyle Green stays with him. Anthony Bane attempts a Dunk. Contested by Kyle Green (4.5 feet, MAN). Anthony Bane misses. Rebound secured by Kyle Green.

[02:03] Team_063 possession (Score: 24-17)
Terry Reaves attempts a Midrange. Contested by Cole Antetokounmpo (5.0 feet, ZONE). TERRY REAVES MAKES IT! Assist: Bradley Davis
Score: 26-17

[01:46] Team_034 possession (Score: 26-17)
Manu Jokic attempts a 3Pt. Contested by Bradley Davis (5.2 feet, MAN). Manu Jokic misses. Rebound secured by Malcolm Quickley.

[01:26] Team_063 possession (Score: 26-17)
Kyle Green drives and kicks out. Dirk Reaves attempts a 3Pt. Contested by Terry Doncic (4.4 feet, MAN). DIRK REAVES MAKES IT! Assist: Terry Reaves
Score: 29-17

[01:12] Team_034 possession (Score: 29-17)
Terry Doncic attempts a Midrange. Contested by Dirk Reaves (4.2 feet, MAN). TERRY DONCIC MAKES IT!
Score: 29-19

[00:58] Team_063 possession (Score: 29-19)
Kyle Green attempts a Midrange. Contested by Terry Doncic (4.6 feet, ZONE). KYLE GREEN MAKES IT!
Score: 31-19

[00:48] Team_034 possession (Score: 31-19)
Anthony Bane drives to the basket... Anthony Bane throws a bad pass! Stolen by Kyle Green! TURNOVER! (live ball)

[00:35] Team_063 possession (Score: 31-19)
FOUL! Reach-in foul on Manu Jokic during the drive. [Team fouls: 4] No free throws, side out. (Manu Jokic: 1 personal fouls)

[00:23] Team_063 possession (Score: 31-19)
Terry Reaves attempts a 3Pt. Contested by Ben Hyland (4.3 feet, ZONE). Terry Reaves misses. Offensive rebound by Kyle Green! Kyle Green puts it back in!
Score: 33-19

[00:06] Team_034 possession (Score: 33-19)
Ben Hyland attempts a 3Pt. Contested by Malcolm Quickley (4.1 feet, MAN). BEN HYLAND MAKES IT! Assist: Anthony Bane
Score: 33-22

================================================================================
                              1ST QUARTER COMPLETE                              
================================================================================

1ST QUARTER SCORE: Team_063 33, Team_034 22

BOX SCORE:
================================================================================

Team_063
--------------------------------------------------------------------------------
Player                MIN  PTS  REB  AST  TO      FG   FG%      3P   3P%
--------------------------------------------------------------------------------
Tyler Harris            9    9    4    0   0   4/5    80.0     0/0   0.0
Bradley Davis          12    6    0    1   0   2/3    66.7     0/0   0.0
Dirk Reaves            12    5    1    0   0   2/2   100.0     0/0   0.0
Terry Reaves           12    5    0    1   0   2/5    40.0     0/0   0.0
Malcolm Quickley       12    4    6    1   0   2/3    66.7     0/0   0.0
Kyle Green              3    4    2    0   0   2/2   100.0     0/0   0.0

TEAM: FG: 14/20 (70.0%), 3PT: 2/5 (40.0%), REB: 13 (3 off, 10 def), AST: 3, TO: 3
TEAM FOULS: 3


Team_034
--------------------------------------------------------------------------------
Player                MIN  PTS  REB  AST  TO      FG   FG%      3P   3P%
--------------------------------------------------------------------------------
Terry Doncic           12    7    3    1   0   3/4    75.0     0/0   0.0
Anthony Bane           12    4    3    2   0   2/5    40.0     0/0   0.0
Cole Antetokounmpo     12    3    1    1   0   1/2    50.0     0/0   0.0
Ben Hyland             12    3    0    0   0   1/3    33.3     0/0   0.0
Devin Poole             9    2    0    1   0   1/3    33.3     0/0   0.0
Manu Jokic              3    2    0    0   0   1/2    50.0     0/0   0.0

TEAM: FG: 9/19 (47.4%), 3PT: 4/9 (44.4%), REB: 7 (1 off, 6 def), AST: 5, TO: 4
TEAM FOULS: 4

================================================================================

================================================================================
                       2ND QUARTER - Team_063 vs Team_034                       
================================================================================

[12:00] Team_063 possession (Score: 33-22)
Bradley Davis attempts a 3Pt. Contested by Devin Poole (4.1 feet, ZONE). Bradley Davis misses. Rebound secured by Cole Antetokounmpo.

[11:44] Team_034 possession (Score: 33-22)
Anthony Bane attempts a Midrange. Contested by Tyler Harris (4.4 feet, MAN). ANTHONY BANE MAKES IT!
Score: 33-24

[11:28] Team_063 possession (Score: 33-24)
Bradley Davis attempts a 3Pt. Contested by Devin Poole (4.1 feet, ZONE). BRADLEY DAVIS MAKES IT! Assist: Malcolm Quickley
Score: 36-24

[11:12] Team_034 possession (Score: 36-24)
Devin Poole attempts a 3Pt. Contested by Terry Reaves (4.9 feet, ZONE). Devin Poole misses. Rebound secured by Tyler Harris.

[11:00] Team_063 possession (Score: 36-24)
Bradley Davis drives, picks up Devin Poole. Help arrives from Ben Hyland! Bradley Davis attempts a Layup. Contested by Ben Hyland (4.1 feet, MAN). BRADLEY DAVIS MAKES IT! Assist: Dirk Reaves
Score: 38-24

[10:45] Team_034 possession (Score: 38-24)
Cole Antetokounmpo attempts a 3Pt. Contested by Terry Reaves (5.5 feet, MAN). COLE ANTETOKOUNMPO MAKES IT! Assist: Devin Poole
Score: 38-27

[10:35] Team_063 possession (Score: 38-27)
Bradley Davis drives, Devin Poole stays with him. Bradley Davis attempts a Dunk. Contested by Devin Poole (4.2 feet, MAN). Bradley Davis misses. Rebound secured by Terry Doncic.

[10:22] Team_034 possession (Score: 38-27)
FOUL! Reach-in foul on Tyler Harris during the drive. [Team fouls: 1] No free throws, side out. (Tyler Harris: 1 personal fouls)

[10:10] Team_034 possession (Score: 38-27)
Anthony Bane drives and kicks out. Anthony Bane attempts a Midrange. Contested by Tyler Harris (4.5 feet, MAN). Anthony Bane misses. Rebound secured by Tyler Harris.

[09:55] Team_063 possession (Score: 38-27)
FOUL! Shooting foul on Ben Hyland. Tyler Harris to the line for 2 free throws. [Team fouls: 1] (Ben Hyland: 1 personal fouls)   FT 1/2: GOOD   FT 2/2: GOOD Tyler Harris makes 2/2 from the line.
Score: 40-27

[09:45] Team_034 possession (Score: 40-27)
FOUL! Shooting foul on Malcolm Quickley. Ben Hyland to the line for 2 free throws. [Team fouls: 2] (Malcolm Quickley: 1 personal fouls)   FT 1/2: MISS   FT 2/2: GOOD Ben Hyland makes 1/2 from the line.
Score: 40-28

[09:30] Team_063 possession (Score: 40-28)
FOUL! Shooting foul on Terry Doncic. Dirk Reaves to the line for 2 free throws. [Team fouls: 2] (Terry Doncic: 1 personal fouls)   FT 1/2: GOOD   FT 2/2: GOOD Dirk Reaves makes 2/2 from the line.
Score: 42-28

[09:19] Team_034 possession (Score: 42-28)
Terry Doncic attempts a Midrange. Contested by Dirk Reaves (4.5 feet, MAN). TERRY DONCIC MAKES IT! Assist: Cole Antetokounmpo
Score: 42-30

[09:06] Team_063 possession (Score: 42-30)
Terry Reaves attempts a Midrange. Contested by Ben Hyland (4.5 feet, ZONE). Terry Reaves misses. Rebound secured by Anthony Bane.

[08:54] Team_034 possession (Score: 42-30)
Ben Hyland attempts a Layup. BLOCKED BY TYLER HARRIS! Ball deflects out of bounds off Ben Hyland.

[08:38] Team_063 possession (Score: 42-30)
Malcolm Quickley attempts a 3Pt. Contested by Devin Poole (4.0 feet, ZONE). Malcolm Quickley misses. Rebound secured by Cole Antetokounmpo.

[08:22] Team_034 possession (Score: 42-30)
Ben Hyland attempts a Midrange. Contested by Malcolm Quickley (4.4 feet, MAN). BEN HYLAND MAKES IT! Assist: Terry Doncic
Score: 42-32

[08:10] Team_063 possession (Score: 42-32)
Dirk Reaves attempts a 3Pt. Contested by Terry Doncic (5.1 feet, MAN). Dirk Reaves misses. Rebound secured by Cole Antetokounmpo.

[07:58] Team_034 possession (Score: 42-32)
Cole Antetokounmpo attempts a Layup. Contested by Terry Reaves (5.8 feet, MAN). COLE ANTETOKOUNMPO MAKES IT!
Score: 42-34

[07:41] Team_063 possession (Score: 42-34)
Malcolm Quickley throws a bad pass! Stolen by Ben Hyland! TURNOVER! (live ball)

[07:25] Team_034 possession (Score: 42-34)
Devin Poole attempts a 3Pt. Contested by Malcolm Quickley (4.4 feet, ZONE). Devin Poole misses. Rebound secured by Dirk Reaves.

[07:11] Team_063 possession (Score: 42-34)
Malcolm Quickley attempts a 3Pt. Contested by Ben Hyland (4.3 feet, MAN). Malcolm Quickley misses. Offensive rebound by Tyler Harris! Tyler Harris's putback is no good. Offensive rebound by Malcolm Quickley! Malcolm Quickley kicks it out.

[06:55] Team_063 possession (Score: 42-34)
Tyler Harris attempts a Layup. Contested by Terry Doncic (5.0 feet, ZONE). TYLER HARRIS MAKES IT! Assist: Bradley Davis
Score: 44-34

[06:41] Team_034 possession (Score: 44-34)
Anthony Bane attempts a Midrange. Contested by Tyler Harris (4.9 feet, MAN). Anthony Bane misses. Rebound secured by Dirk Reaves.

[06:22] Team_063 possession (Score: 44-34)
Malcolm Quickley attempts a Midrange. Contested by Cole Antetokounmpo (5.3 feet, ZONE). Malcolm Quickley misses. Rebound secured by Anthony Bane.

[06:06] Team_034 possession (Score: 44-34)
Anthony Bane loses control! Ball rolls out of bounds! TURNOVER! (dead ball)

[06:06] Substitution (Team_063): Bradley Davis OUT → DeMar Banchero IN (stamina_rule2)

[06:06] Substitution (Team_063): Malcolm Quickley OUT → Cole Durant IN (stamina_rule2)

[06:06] Substitution (Team_063): Terry Reaves OUT → Jaren James IN (stamina_rule2)

[06:06] Substitution (Team_063): Dirk Reaves OUT → Lamelo Ball IN (stamina_rule2)

[06:06] Substitution (Team_063): Tyler Harris OUT → Kyle Green IN (stamina_rule2)

[06:06] Substitution (Team_034): Devin Poole OUT → Manu Jokic IN (stamina_rule2)

[06:06] Substitution (Team_034): Ben Hyland OUT → Damian Turner IN (stamina_rule2)

[06:06] Substitution (Team_034): Cole Antetokounmpo OUT → Vince Paul IN (stamina_rule2)

[06:06] Substitution (Team_034): Terry Doncic OUT → Nikola Wagner IN (stamina_rule2)

[06:06] Substitution (Team_034): Anthony Bane OUT → Carmelo Anunoby IN (stamina_rule2)

[05:46] Team_063 possession (Score: 44-34)
Jaren James attempts a 3Pt. Contested by Vince Paul (4.3 feet, ZONE). JAREN JAMES MAKES IT! Assist: Kyle Green
Score: 47-34

[05:33] Team_034 possession (Score: 47-34)
Nikola Wagner drives to the basket... Nikola Wagner commits a violation (traveling/carry)! TURNOVER! (dead ball)

[05:17] Team_063 possession (Score: 47-34)
Cole Durant drives and kicks out. Cole Durant attempts a 3Pt. Contested by Damian Turner (5.4 feet, MAN). Cole Durant misses. Rebound secured by Nikola Wagner.

[04:59] Team_034 possession (Score: 47-34)
FOUL! Shooting foul on Lamelo Ball. Carmelo Anunoby to the line for 2 free throws. [Team fouls: 3] (Lamelo Ball: 1 personal fouls)   FT 1/2: MISS   FT 2/2: MISS Carmelo Anunoby makes 0/2 from the line. Rebound secured by Kyle Green.

[04:46] Team_063 possession (Score: 47-34)
Jaren James drives and kicks out. Lamelo Ball attempts a 3Pt. Wide open! Nikola Wagner is 6.0 feet away. [MAN] Lamelo Ball misses. Rebound secured by Nikola Wagner.

[04:29] Team_034 possession (Score: 47-34)
Damian Turner attempts a Layup. Contested by Kyle Green (4.8 feet, ZONE). DAMIAN TURNER MAKES IT!
Score: 47-36

[04:13] Team_063 possession (Score: 47-36)
Kyle Green drives and kicks out. Kyle Green attempts a Midrange. Contested by Carmelo Anunoby (5.4 feet, MAN). KYLE GREEN MAKES IT! Assist: DeMar Banchero
Score: 49-36

[04:01] Team_034 possession (Score: 49-36)
FOUL! Holding foul on Lamelo Ball. [Team fouls: 4] No free throws, side out. (Lamelo Ball: 2 personal fouls)

[03:45] Team_034 possession (Score: 49-36)
Vince Paul makes the Layup and draws the foul on Jaren James! And-1! Vince Paul to the line for 1. [BONUS: 5 team fouls] (Jaren James: 1 personal fouls)   FT 1/1: GOOD Vince Paul makes 1/1 from the line.
Score: 49-39

[03:30] Team_063 possession (Score: 49-39)
Jaren James attempts a Layup. Contested by Vince Paul (4.3 feet, MAN). Jaren James misses. Rebound secured by Vince Paul.

[03:16] Team_034 possession (Score: 49-39)
Damian Turner attempts a Midrange. Contested by Lamelo Ball (5.1 feet, ZONE). DAMIAN TURNER MAKES IT!
Score: 49-41

[03:02] Team_063 possession (Score: 49-41)
DeMar Banchero drives and kicks out. Jaren James attempts a 3Pt. Contested by Vince Paul (4.2 feet, ZONE). JAREN JAMES MAKES IT!
Score: 52-41

[02:44] Team_034 possession (Score: 52-41)
Manu Jokic attempts a 3Pt. Contested by DeMar Banchero (4.0 feet, MAN). Manu Jokic misses. Offensive rebound by Vince Paul! Vince Paul's putback is no good. Offensive rebound by Carmelo Anunoby! Carmelo Anunoby kicks it out.

[02:26] Team_034 possession (Score: 52-41)
Damian Turner makes the Layup and draws the foul on Lamelo Ball! And-1! Damian Turner to the line for 1. [BONUS: 7 team fouls] (Lamelo Ball: 4 personal fouls)   FT 1/1: GOOD Damian Turner makes 1/1 from the line.
Score: 52-44

[02:14] Team_063 possession (Score: 52-44)
Jaren James attempts a 3Pt. Contested by Vince Paul (4.3 feet, MAN). Jaren James misses. Rebound secured by Vince Paul.

[02:01] Team_034 possession (Score: 52-44)
Vince Paul attempts a 3Pt. Contested by Jaren James (4.3 feet, MAN). Vince Paul misses. Rebound secured by Lamelo Ball.

[01:45] Team_063 possession (Score: 52-44)
DeMar Banchero drives, Carmelo Anunoby stays with him. DeMar Banchero attempts a Dunk. Contested by Carmelo Anunoby (5.8 feet, ZONE). DEMAR BANCHERO MAKES IT! Assist: Lamelo Ball
Score: 54-44

[01:34] Team_034 possession (Score: 54-44)
Manu Jokic attempts a 3Pt. Contested by DeMar Banchero (4.0 feet, MAN). Manu Jokic misses. Rebound secured by Kyle Green.

[01:18] Team_063 possession (Score: 54-44)
Kyle Green drives and kicks out. Jaren James attempts a 3Pt. Contested by Vince Paul (4.2 feet, MAN). Jaren James misses. Rebound secured by Carmelo Anunoby.

[01:05] Team_034 possession (Score: 54-44)
FOUL! Shooting foul on DeMar Banchero. Manu Jokic to the line for 2 free throws. [BONUS: 8 team fouls] (DeMar Banchero: 1 personal fouls)   FT 1/2: GOOD   FT 2/2: GOOD Manu Jokic makes 2/2 from the line.
Score: 54-46

[00:51] Team_063 possession (Score: 54-46)
Lamelo Ball throws a bad pass! Stolen by Nikola Wagner! TURNOVER! (live ball)

[00:37] Team_034 possession (Score: 54-46)
Carmelo Anunoby drives, Kyle Green stays with him. Carmelo Anunoby attempts a Dunk. Contested by Kyle Green (4.5 feet, ZONE). CARMELO ANUNOBY MAKES IT! Assist: Damian Turner
Score: 54-48

[00:27] Team_063 possession (Score: 54-48)
Kyle Green drives, Carmelo Anunoby stays with him. Kyle Green attempts a Dunk. Contested by Carmelo Anunoby (5.5 feet, ZONE). KYLE GREEN MAKES IT! Assist: Lamelo Ball
Score: 56-48

[00:17] Team_034 possession (Score: 56-48)
Damian Turner attempts a 3Pt. BLOCKED BY COLE DURANT! Ball goes out off Cole Durant. Damian Turner's ball!

[00:05] Team_034 possession (Score: 56-48)
Manu Jokic attempts a 3Pt. Contested by DeMar Banchero (4.0 feet, ZONE). Manu Jokic misses. Rebound secured by Kyle Green.

================================================================================
                              2ND QUARTER COMPLETE                              
================================================================================

2ND QUARTER SCORE: Team_063 23, Team_034 26

BOX SCORE:
================================================================================

Team_063
--------------------------------------------------------------------------------
Player                MIN  PTS  REB  AST  TO      FG   FG%      3P   3P%
--------------------------------------------------------------------------------
Jaren James             6    6    0    0   0   2/5    40.0     0/0   0.0
Bradley Davis          18    5    0    1   0   2/4    50.0     0/0   0.0
Tyler Harris           16    4    2    0   0   2/2   100.0     0/0   0.0
Kyle Green              9    4    3    1   0   2/3    66.7     0/0   0.0
Dirk Reaves            18    2    2    1   0   1/2    50.0     0/0   0.0
DeMar Banchero          6    2    0    1   0   1/1   100.0     0/0   0.0
Malcolm Quickley       18    0    1    1   0   0/2     0.0     0/0   0.0
Terry Reaves           18    0    0    0   0   0/1     0.0     0/0   0.0
Cole Durant             6    0    0    0   0   0/1     0.0     0/0   0.0
Lamelo Ball             6    0    1    2   0   0/0     0.0     0/0   0.0

TEAM: FG: 10/21 (47.6%), 3PT: 2/6 (33.3%), REB: 9 (1 off, 8 def), AST: 7, TO: 2
TEAM FOULS: 8 [Team_034 in BONUS]


Team_034
--------------------------------------------------------------------------------
Player                MIN  PTS  REB  AST  TO      FG   FG%      3P   3P%
--------------------------------------------------------------------------------
Damian Turner           6    7    0    1   0   3/3   100.0     0/0   0.0
Cole Antetokounmpo     18    5    3    1   0   2/2   100.0     0/0   0.0
Ben Hyland             18    3    0    0   0   2/3    66.7     0/0   0.0
Vince Paul              6    3    2    0   0   1/2    50.0     0/0   0.0
Anthony Bane           18    2    2    0   0   1/3    33.3     0/0   0.0
Terry Doncic           18    2    1    1   0   1/1   100.0     0/0   0.0
Carmelo Anunoby         6    2    2    0   0   1/2    50.0     0/0   0.0
Manu Jokic              9    2    0    0   0   1/3    33.3     0/0   0.0
Devin Poole            16    0    0    1   0   0/2     0.0     0/0   0.0
Nikola Wagner           6    0    2    0   0   0/0     0.0     0/0   0.0

TEAM: FG: 12/21 (57.1%), 3PT: 1/6 (16.7%), REB: 12 (1 off, 11 def), AST: 4, TO: 2
TEAM FOULS: 2

================================================================================

================================================================================
                       3RD QUARTER - Team_063 vs Team_034                       
================================================================================

[12:00] Team_063 possession (Score: 56-48)
FOUL! Offensive foul on Dirk Reaves! Terry Doncic drew the charge! [Team fouls: 1] (Dirk Reaves: 1 personal fouls) TURNOVER! (dead ball)

[11:44] Team_034 possession (Score: 56-48)
Devin Poole drives, Tyler Harris stays with him. Devin Poole attempts a Layup. Contested by Tyler Harris (4.3 feet, ZONE). Devin Poole misses. Rebound secured by Tyler Harris.

[11:34] Team_063 possession (Score: 56-48)
Malcolm Quickley attempts a Layup. Contested by Ben Hyland (3.4 feet, MAN). MALCOLM QUICKLEY MAKES IT! Assist: Bradley Davis
Score: 58-48

[11:20] Team_034 possession (Score: 58-48)
Anthony Bane attempts a Midrange. Contested by Tyler Harris (4.5 feet, MAN). Anthony Bane misses. Rebound secured by Dirk Reaves.

[11:07] Team_063 possession (Score: 58-48)
FOUL! Holding foul on Devin Poole. [Team fouls: 1] No free throws, side out. (Devin Poole: 1 personal fouls)

[10:55] Team_063 possession (Score: 58-48)
Malcolm Quickley attempts a Midrange. Contested by Cole Antetokounmpo (4.3 feet, ZONE). MALCOLM QUICKLEY MAKES IT! Assist: Terry Reaves
Score: 60-48

[10:45] Team_034 possession (Score: 60-48)
Anthony Bane attempts a 3Pt. Contested by Malcolm Quickley (3.6 feet, ZONE). Anthony Bane misses. Offensive rebound by Anthony Bane! Anthony Bane kicks it out.

[10:29] Team_034 possession (Score: 60-48)
Devin Poole attempts a 3Pt. Contested by Bradley Davis (4.8 feet, MAN). DEVIN POOLE MAKES IT! Assist: Anthony Bane
Score: 60-51

[10:17] Team_063 possession (Score: 60-51)
Terry Reaves drives, Terry Doncic stays with him. Terry Reaves attempts a Layup. Contested by Terry Doncic (4.3 feet, ZONE). Terry Reaves misses. Rebound secured by Terry Doncic.

[10:03] Team_034 possession (Score: 60-51)
Ben Hyland drives, Malcolm Quickley stays with him. Ben Hyland attempts a Dunk. Contested by Malcolm Quickley (3.6 feet, MAN). BEN HYLAND MAKES IT! Assist: Devin Poole
Score: 60-53

[09:49] Team_063 possession (Score: 60-53)
Bradley Davis attempts a Midrange. Contested by Devin Poole (4.1 feet, MAN). Bradley Davis misses. Rebound secured by Terry Doncic.

[09:36] Team_034 possession (Score: 60-53)
FOUL! Shooting foul on Malcolm Quickley. Anthony Bane to the line for 2 free throws. [Team fouls: 2] (Malcolm Quickley: 1 personal fouls)   FT 1/2: GOOD   FT 2/2: GOOD Anthony Bane makes 2/2 from the line.
Score: 60-55

[09:20] Team_063 possession (Score: 60-55)
Bradley Davis attempts a Layup. Contested by Devin Poole (4.1 feet, MAN). BRADLEY DAVIS MAKES IT! Assist: Tyler Harris
Score: 62-55

[09:04] Team_034 possession (Score: 62-55)
Anthony Bane attempts a Layup. Contested by Tyler Harris (4.5 feet, ZONE). Anthony Bane misses. Rebound secured by Malcolm Quickley.

[08:50] Team_063 possession (Score: 62-55)
Bradley Davis attempts a Midrange. Contested by Cole Antetokounmpo (4.7 feet, ZONE). BRADLEY DAVIS MAKES IT! Assist: Malcolm Quickley
Score: 64-55

[08:37] Team_034 possession (Score: 64-55)
FOUL! Reach-in foul on Tyler Harris during the drive. [Team fouls: 3] No free throws, side out. (Tyler Harris: 1 personal fouls)

[08:20] Team_034 possession (Score: 64-55)
Devin Poole drives to the basket... Devin Poole throws a bad pass! Stolen by Bradley Davis! TURNOVER! (live ball)

[08:04] Team_063 possession (Score: 64-55)
Malcolm Quickley attempts a 3Pt. Contested by Devin Poole (3.7 feet, ZONE). MALCOLM QUICKLEY MAKES IT! Assist: Terry Reaves
Score: 67-55

[07:50] Team_034 possession (Score: 67-55)
FOUL! Shooting foul on Tyler Harris. Devin Poole to the line for 2 free throws. [Team fouls: 4] (Tyler Harris: 2 personal fouls)   FT 1/2: GOOD   FT 2/2: MISS Devin Poole makes 1/2 from the line. Rebound secured by Malcolm Quickley.
Score: 67-56

[07:39] Team_063 possession (Score: 67-56)
Terry Reaves drives to the basket... Terry Reaves throws a bad pass! Stolen by Terry Doncic! TURNOVER! (live ball)

[07:26] Team_034 possession (Score: 67-56)
Terry Doncic attempts a 3Pt. Contested by Dirk Reaves (3.8 feet, MAN). Terry Doncic misses. Rebound secured by Malcolm Quickley.

[07:14] Team_063 possession (Score: 67-56)
Terry Reaves drives to the basket... Terry Reaves commits a violation (traveling/carry)! TURNOVER! (dead ball)

[07:00] Team_034 possession (Score: 67-56)
Devin Poole drives and kicks out. Ben Hyland attempts a 3Pt. Contested by Malcolm Quickley (3.5 feet, MAN). Ben Hyland misses. Rebound secured by Tyler Harris.

[06:43] Team_063 possession (Score: 67-56)
Tyler Harris makes the Dunk and draws the foul on Ben Hyland! And-1! Tyler Harris to the line for 1. [Team fouls: 2] (Ben Hyland: 1 personal fouls)   FT 1/1: GOOD Tyler Harris makes 1/1 from the line.
Score: 70-56

[06:27] Team_034 possession (Score: 70-56)
Terry Doncic throws a bad pass! Stolen by Dirk Reaves! TURNOVER! (live ball)

[06:12] Team_063 possession (Score: 70-56)
Dirk Reaves makes the Midrange and draws the foul on Cole Antetokounmpo! And-1! Dirk Reaves to the line for 1. [Team fouls: 3] (Cole Antetokounmpo: 1 personal fouls)   FT 1/1: GOOD Dirk Reaves makes 1/1 from the line.
Score: 73-56

[06:00] Team_034 possession (Score: 73-56)
Terry Doncic attempts a 3Pt. Contested by Malcolm Quickley (3.6 feet, ZONE). Terry Doncic misses. Offensive rebound by Terry Doncic! Terry Doncic puts it back in!
Score: 73-58

[05:43] Team_063 possession (Score: 73-58)
Dirk Reaves attempts a Midrange. Contested by Terry Doncic (4.3 feet, MAN). Dirk Reaves misses. Offensive rebound by Tyler Harris! Tyler Harris puts it back in!
Score: 75-58

[05:32] Team_034 possession (Score: 75-58)
Anthony Bane attempts a Midrange. Contested by Dirk Reaves (3.8 feet, ZONE). ANTHONY BANE MAKES IT!
Score: 75-60

[05:23] Team_063 possession (Score: 75-60)
Dirk Reaves drives and kicks out. Bradley Davis attempts a Midrange. Contested by Terry Doncic (4.1 feet, ZONE). BRADLEY DAVIS MAKES IT!
Score: 77-60

[05:12] Team_034 possession (Score: 77-60)
Devin Poole attempts a Layup. Contested by Bradley Davis (4.8 feet, MAN). DEVIN POOLE MAKES IT!
Score: 77-62

[04:58] Team_063 possession (Score: 77-62)
FOUL! Offensive foul on Bradley Davis! Devin Poole drew the charge! [Team fouls: 5] (Bradley Davis: 1 personal fouls) TURNOVER! (dead ball)

[04:42] Team_034 possession (Score: 77-62)
Anthony Bane attempts a Midrange. BLOCKED BY TYLER HARRIS! Ball deflects out of bounds off Anthony Bane.

[04:29] Team_063 possession (Score: 77-62)
Bradley Davis attempts a 3Pt. Contested by Devin Poole (4.3 feet, MAN). Bradley Davis misses. Rebound secured by Cole Antetokounmpo.

[04:13] Team_034 possession (Score: 77-62)
Ben Hyland attempts a 3Pt. Contested by Malcolm Quickley (3.7 feet, MAN). Ben Hyland misses. Rebound secured by Dirk Reaves.

[03:59] Team_063 possession (Score: 77-62)
Dirk Reaves drives, Terry Doncic stays with him. Dirk Reaves attempts a Dunk. Contested by Terry Doncic (4.4 feet, MAN). DIRK REAVES MAKES IT!
Score: 79-62

[03:46] Team_034 possession (Score: 79-62)
Devin Poole drives, picks up Bradley Davis. Help arrives from Malcolm Quickley! Devin Poole attempts a Layup. Contested by Malcolm Quickley (4.9 feet, MAN). DEVIN POOLE MAKES IT! Assist: Cole Antetokounmpo
Score: 79-64

[03:31] Team_063 possession (Score: 79-64)
Dirk Reaves makes the 3Pt and draws the foul on Terry Doncic! And-1! Dirk Reaves to the line for 1. [Team fouls: 4] (Terry Doncic: 1 personal fouls)   FT 1/1: GOOD Dirk Reaves makes 1/1 from the line.
Score: 83-64

[03:18] Team_034 possession (Score: 83-64)
Cole Antetokounmpo attempts a 3Pt. Contested by Malcolm Quickley (4.2 feet, ZONE). COLE ANTETOKOUNMPO MAKES IT! Assist: Anthony Bane
Score: 83-67

[03:05] Team_063 possession (Score: 83-67)
Tyler Harris attempts a Layup. Contested by Anthony Bane (5.3 feet, MAN). TYLER HARRIS MAKES IT! Assist: Terry Reaves
Score: 85-67

[02:50] Team_034 possession (Score: 85-67)
Terry Doncic attempts a 3Pt. Contested by Dirk Reaves (4.1 feet, MAN). Terry Doncic misses. Rebound secured by Tyler Harris.

[02:36] Team_063 possession (Score: 85-67)
Malcolm Quickley makes the Layup and draws the foul on Ben Hyland! And-1! Malcolm Quickley to the line for 1. [BONUS: 5 team fouls] (Ben Hyland: 2 personal fouls)   FT 1/1: GOOD Malcolm Quickley makes 1/1 from the line.
Score: 88-67

[02:18] Team_034 possession (Score: 88-67)
Cole Antetokounmpo attempts a 3Pt. Contested by Terry Reaves (5.4 feet, MAN). Cole Antetokounmpo misses. Offensive rebound by Anthony Bane! Anthony Bane kicks it out.

[02:03] Team_034 possession (Score: 88-67)
Terry Doncic attempts a Layup. Contested by Dirk Reaves (4.2 feet, MAN). TERRY DONCIC MAKES IT! Assist: Ben Hyland
Score: 88-69

[01:49] Team_063 possession (Score: 88-69)
Bradley Davis attempts a 3Pt. Contested by Devin Poole (4.6 feet, MAN). Bradley Davis misses. Offensive rebound by Dirk Reaves! Dirk Reaves kicks it out.

[01:35] Team_063 possession (Score: 88-69)
Dirk Reaves drives, Terry Doncic stays with him. Dirk Reaves attempts a Layup. Contested by Terry Doncic (4.7 feet, MAN). DIRK REAVES MAKES IT! Assist: Bradley Davis
Score: 90-69

[01:19] Team_034 possession (Score: 90-69)
Cole Antetokounmpo makes the Midrange and draws the foul on Terry Reaves! And-1! Cole Antetokounmpo to the line for 1. [BONUS: 6 team fouls] (Terry Reaves: 1 personal fouls)   FT 1/1: GOOD Cole Antetokounmpo makes 1/1 from the line.
Score: 90-72

[01:01] Team_063 possession (Score: 90-72)
Malcolm Quickley drives and kicks out. FOUL! Shooting foul on Ben Hyland. Malcolm Quickley to the line for 2 free throws. [BONUS: 6 team fouls] (Ben Hyland: 3 personal fouls)   FT 1/2: GOOD   FT 2/2: GOOD Malcolm Quickley makes 2/2 from the line.
Score: 92-72

[00:46] Team_034 possession (Score: 92-72)
Anthony Bane makes the Layup and draws the foul on Tyler Harris! And-1! Anthony Bane to the line for 1. [BONUS: 7 team fouls] (Tyler Harris: 3 personal fouls)   FT 1/1: GOOD Anthony Bane makes 1/1 from the line.
Score: 92-75

[00:29] Team_063 possession (Score: 92-75)
Bradley Davis drives, picks up Terry Doncic. Help arrives from Ben Hyland! Bradley Davis attempts a Dunk. Contested by Ben Hyland (4.8 feet, ZONE). BRADLEY DAVIS MAKES IT!
Score: 94-75

[00:15] Team_034 possession (Score: 94-75)
Terry Doncic attempts a Midrange. Contested by Terry Reaves (5.2 feet, ZONE). TERRY DONCIC MAKES IT!
Score: 94-77

[00:05] Team_063 possession (Score: 94-77)
Bradley Davis attempts a Layup. Contested by Devin Poole (4.8 feet, MAN). BRADLEY DAVIS MAKES IT! Assist: Tyler Harris
Score: 96-77

================================================================================
                              3RD QUARTER COMPLETE                              
================================================================================

3RD QUARTER SCORE: Team_063 40, Team_034 29

BOX SCORE:
================================================================================

Team_063
--------------------------------------------------------------------------------
Player                MIN  PTS  REB  AST  TO      FG   FG%      3P   3P%
--------------------------------------------------------------------------------
Malcolm Quickley       30   12    3    1   0   5/5   100.0     0/0   0.0
Dirk Reaves            30   11    3    0   0   4/4   100.0     0/0   0.0
Bradley Davis          30   10    0    2   0   5/7    71.4     0/0   0.0
Tyler Harris           28    7    4    2   0   3/3   100.0     0/0   0.0
Terry Reaves           30    0    0    3   0   0/1     0.0     0/0   0.0

TEAM: FG: 17/20 (85.0%), 3PT: 2/3 (66.7%), REB: 10 (2 off, 8 def), AST: 8, TO: 4
TEAM FOULS: 7 [Team_034 in BONUS]


Team_034
--------------------------------------------------------------------------------
Player                MIN  PTS  REB  AST  TO      FG   FG%      3P   3P%
--------------------------------------------------------------------------------
Devin Poole            28    7    0    1   0   3/6    50.0     0/0   0.0
Anthony Bane           30    7    2    2   0   3/6    50.0     0/0   0.0
Terry Doncic           30    6    3    0   0   3/5    60.0     0/0   0.0
Cole Antetokounmpo     30    6    1    1   0   2/2   100.0     0/0   0.0
Ben Hyland             30    2    0    1   0   1/2    50.0     0/0   0.0

TEAM: FG: 12/21 (57.1%), 3PT: 3/6 (50.0%), REB: 6 (3 off, 3 def), AST: 5, TO: 2
TEAM FOULS: 6 [Team_063 in BONUS]

================================================================================

================================================================================
                       4TH QUARTER - Team_063 vs Team_034                       
================================================================================

[12:00] Team_063 possession (Score: 96-77)
Malcolm Quickley attempts a Midrange. Contested by Cole Antetokounmpo (4.6 feet, ZONE). Malcolm Quickley misses. Rebound secured by Cole Antetokounmpo.

[11:43] Team_034 possession (Score: 96-77)
Terry Doncic attempts a Layup. Contested by Tyler Harris (4.9 feet, ZONE). Terry Doncic misses. Rebound secured by Dirk Reaves.

[11:28] Team_063 possession (Score: 96-77)
Malcolm Quickley attempts a Layup. Contested by Terry Doncic (4.3 feet, ZONE). MALCOLM QUICKLEY MAKES IT!
Score: 98-77

[11:14] Team_034 possession (Score: 98-77)
Ben Hyland attempts a 3Pt. Contested by Malcolm Quickley (4.0 feet, MAN). Ben Hyland misses. Rebound secured by Dirk Reaves.

[11:03] Team_063 possession (Score: 98-77)
Tyler Harris attempts a Layup. Contested by Anthony Bane (5.4 feet, MAN). TYLER HARRIS MAKES IT! Assist: Dirk Reaves
Score: 100-77

[10:49] Team_034 possession (Score: 100-77)
Ben Hyland attempts a Layup. Contested by Dirk Reaves (4.3 feet, ZONE). BEN HYLAND MAKES IT!
Score: 100-79

[10:39] Team_063 possession (Score: 100-79)
Malcolm Quickley drives and kicks out. FOUL! Shooting foul on Terry Doncic. Malcolm Quickley to the line for 2 free throws. [Team fouls: 1] (Terry Doncic: 1 personal fouls)   FT 1/2: GOOD   FT 2/2: GOOD Malcolm Quickley makes 2/2 from the line.
Score: 102-79

[10:23] Team_034 possession (Score: 102-79)
Anthony Bane attempts a Layup. BLOCKED BY DIRK REAVES! Ball is loose! Rebound secured by Malcolm Quickley.

[10:08] Team_063 possession (Score: 102-79)
Tyler Harris makes the Layup and draws the foul on Terry Doncic! And-1! Tyler Harris to the line for 1. [Team fouls: 2] (Terry Doncic: 2 personal fouls)   FT 1/1: GOOD Tyler Harris makes 1/1 from the line.
Score: 105-79

[09:55] Team_034 possession (Score: 105-79)
Devin Poole attempts a Midrange. Contested by Dirk Reaves (4.3 feet, ZONE). DEVIN POOLE MAKES IT!
Score: 105-81

[09:40] Team_063 possession (Score: 105-81)
Terry Reaves drives to the basket... FOUL! Offensive foul on Terry Reaves! Cole Antetokounmpo drew the charge! [Team fouls: 1] (Terry Reaves: 1 personal fouls) TURNOVER! (dead ball)

[09:26] Team_034 possession (Score: 105-81)
FOUL! Shooting foul on Tyler Harris. Anthony Bane to the line for 2 free throws. [Team fouls: 2] (Tyler Harris: 1 personal fouls)   FT 1/2: GOOD   FT 2/2: GOOD Anthony Bane makes 2/2 from the line.
Score: 105-83

[09:08] Team_063 possession (Score: 105-83)
Bradley Davis attempts a 3Pt. Contested by Devin Poole (5.0 feet, ZONE). Bradley Davis misses. Rebound secured by Anthony Bane.

[08:57] Team_034 possession (Score: 105-83)
Cole Antetokounmpo attempts a 3Pt. Contested by Malcolm Quickley (4.7 feet, ZONE). Cole Antetokounmpo misses. Rebound secured by Malcolm Quickley.

[08:43] Team_063 possession (Score: 105-83)
Bradley Davis attempts a 3Pt. Contested by Terry Doncic (5.0 feet, ZONE). Bradley Davis misses. Rebound secured by Anthony Bane.

[08:24] Team_034 possession (Score: 105-83)
FOUL! Holding foul on Dirk Reaves. [Team fouls: 3] No free throws, side out. (Dirk Reaves: 1 personal fouls)

[08:05] Team_034 possession (Score: 105-83)
Cole Antetokounmpo attempts a 3Pt. Contested by Dirk Reaves (5.1 feet, ZONE). Cole Antetokounmpo misses. Rebound secured by Tyler Harris.

[07:48] Team_063 possession (Score: 105-83)
Malcolm Quickley attempts a Midrange. Contested by Cole Antetokounmpo (5.1 feet, ZONE). Malcolm Quickley misses. Rebound secured by Cole Antetokounmpo.

[07:38] Team_034 possession (Score: 105-83)
Ben Hyland attempts a Layup. Contested by Malcolm Quickley (4.5 feet, MAN). BEN HYLAND MAKES IT! Assist: Anthony Bane
Score: 105-85

[07:21] Team_063 possession (Score: 105-85)
Malcolm Quickley attempts a Layup. Contested by Ben Hyland (4.3 feet, MAN). Malcolm Quickley misses. Offensive rebound by Malcolm Quickley! Malcolm Quickley kicks it out.

[07:06] Team_063 possession (Score: 105-85)
Bradley Davis attempts a Layup. BLOCKED BY TERRY DONCIC! Ball is loose! Rebound secured by Terry Doncic.

[06:52] Team_034 possession (Score: 105-85)
FOUL! Shooting foul on Tyler Harris. Anthony Bane to the line for 2 free throws. [Team fouls: 4] (Tyler Harris: 2 personal fouls)   FT 1/2: GOOD   FT 2/2: GOOD Anthony Bane makes 2/2 from the line.
Score: 105-87

[06:42] Team_063 possession (Score: 105-87)
Tyler Harris drives to the basket... FOUL! Offensive foul on Tyler Harris! Anthony Bane drew the charge! [Team fouls: 5] (Tyler Harris: 3 personal fouls) TURNOVER! (dead ball)

[06:30] Team_034 possession (Score: 105-87)
Ben Hyland drives to the basket... Ben Hyland throws a bad pass out of bounds! TURNOVER! (dead ball)

[06:30] Substitution (Team_063): Bradley Davis OUT → DeMar Banchero IN (stamina_rule2)

[06:30] Substitution (Team_063): Malcolm Quickley OUT → Cole Durant IN (stamina_rule2)

[06:30] Substitution (Team_063): Terry Reaves OUT → Jaren James IN (stamina_rule2)

[06:30] Substitution (Team_063): Dirk Reaves OUT → Lamelo Ball IN (stamina_rule2)

[06:30] Substitution (Team_063): Tyler Harris OUT → Kyle Green IN (stamina_rule2)

[06:30] Substitution (Team_034): Devin Poole OUT → Manu Jokic IN (stamina_rule2)

[06:30] Substitution (Team_034): Ben Hyland OUT → Damian Turner IN (stamina_rule2)

[06:30] Substitution (Team_034): Cole Antetokounmpo OUT → Vince Paul IN (stamina_rule2)

[06:30] Substitution (Team_034): Terry Doncic OUT → Nikola Wagner IN (stamina_rule2)

[06:30] Substitution (Team_034): Anthony Bane OUT → Carmelo Anunoby IN (stamina_rule2)

[06:16] Team_063 possession (Score: 105-87)
Jaren James attempts a Layup. Contested by Carmelo Anunoby (5.5 feet, ZONE). Jaren James misses. Rebound secured by Nikola Wagner.

[05:59] Team_034 possession (Score: 105-87)
FOUL! Shooting foul on Lamelo Ball. Nikola Wagner to the line for 2 free throws. [BONUS: 6 team fouls] (Lamelo Ball: 1 personal fouls)   FT 1/2: MISS   FT 2/2: GOOD Nikola Wagner makes 1/2 from the line.
Score: 105-88

[05:42] Team_063 possession (Score: 105-88)
Jaren James attempts a Midrange. Contested by Vince Paul (4.3 feet, MAN). Jaren James misses. Rebound secured by Carmelo Anunoby.

[05:31] Team_034 possession (Score: 105-88)
Manu Jokic attempts a Midrange. Contested by DeMar Banchero (4.0 feet, MAN). Manu Jokic misses. Rebound secured by Cole Durant.

[05:16] Team_063 possession (Score: 105-88)
DeMar Banchero drives, Manu Jokic stays with him. DeMar Banchero attempts a Layup. Contested by Manu Jokic (5.1 feet, MAN). DeMar Banchero misses. Rebound secured by Vince Paul.

[05:06] Team_034 possession (Score: 105-88)
FOUL! Holding foul on Jaren James. [IN THE BONUS! 7 team fouls] Vince Paul to the line for 2 free throws. (Jaren James: 1 personal fouls)   FT 1/2: GOOD   FT 2/2: GOOD Vince Paul makes 2/2 from the line.
Score: 105-90

[04:56] Team_063 possession (Score: 105-90)
Kyle Green attempts a Midrange. Contested by Carmelo Anunoby (5.5 feet, MAN). Kyle Green misses. Offensive rebound by Lamelo Ball! Lamelo Ball kicks it out.

[04:42] Team_063 possession (Score: 105-90)
DeMar Banchero attempts a Layup. Contested by Carmelo Anunoby (5.8 feet, ZONE). DeMar Banchero misses. Rebound secured by Vince Paul.

[04:27] Team_034 possession (Score: 105-90)
FOUL! Shooting foul on Jaren James. Damian Turner to the line for 2 free throws. [BONUS: 8 team fouls] (Jaren James: 2 personal fouls)   FT 1/2: GOOD   FT 2/2: MISS Damian Turner makes 1/2 from the line. Rebound secured by Kyle Green.
Score: 105-91

[04:11] Team_063 possession (Score: 105-91)
DeMar Banchero attempts a Midrange. Wide open! Nikola Wagner is 6.3 feet away. [ZONE] DEMAR BANCHERO MAKES IT! Assist: Cole Durant
Score: 107-91

[03:59] Team_034 possession (Score: 107-91)
Nikola Wagner attempts a 3Pt. Contested by Lamelo Ball (4.8 feet, MAN). Nikola Wagner misses. Rebound secured by Cole Durant.

[03:41] Team_063 possession (Score: 107-91)
Cole Durant attempts a Midrange. Contested by Damian Turner (5.8 feet, ZONE). Cole Durant misses. Offensive rebound by Kyle Green! Kyle Green puts it back in!
Score: 109-91

[03:29] Team_034 possession (Score: 109-91)
Carmelo Anunoby drives to the basket... Carmelo Anunoby commits a violation (traveling/carry)! TURNOVER! (dead ball)

[03:15] Team_063 possession (Score: 109-91)
Kyle Green attempts a Midrange. Contested by Vince Paul (4.3 feet, ZONE). KYLE GREEN MAKES IT!
Score: 111-91

[03:02] Team_034 possession (Score: 111-91)
Vince Paul attempts a Layup. Contested by Jaren James (4.3 feet, MAN). VINCE PAUL MAKES IT!
Score: 111-93

[02:44] Team_063 possession (Score: 111-93)
Jaren James attempts a 3Pt. Contested by Vince Paul (4.3 feet, ZONE). Jaren James misses. Rebound secured by Nikola Wagner.

[02:28] Team_034 possession (Score: 111-93)
Vince Paul attempts a Midrange. Contested by Jaren James (4.3 feet, MAN). Vince Paul misses. Offensive rebound by Carmelo Anunoby! Carmelo Anunoby kicks it out.

[02:19] Team_034 possession (Score: 111-93)
FOUL! Reach-in foul on Kyle Green during the drive. [IN THE BONUS! 9 team fouls] Carmelo Anunoby to the line for 2 free throws. (Kyle Green: 1 personal fouls)   FT 1/2: GOOD   FT 2/2: GOOD Carmelo Anunoby makes 2/2 from the line.
Score: 111-95

[02:04] Team_063 possession (Score: 111-95)
Lamelo Ball attempts a 3Pt. Wide open! Nikola Wagner is 6.3 feet away. [MAN] LAMELO BALL MAKES IT! Assist: Kyle Green
Score: 114-95

[01:47] Team_034 possession (Score: 114-95)
FOUL! Reach-in foul on Kyle Green during the drive. [IN THE BONUS! 10 team fouls] Damian Turner to the line for 2 free throws. (Kyle Green: 2 personal fouls)   FT 1/2: GOOD   FT 2/2: GOOD Damian Turner makes 2/2 from the line.
Score: 114-97

[01:36] Team_063 possession (Score: 114-97)
DeMar Banchero attempts a Layup. BLOCKED BY MANU JOKIC! Ball is loose! Offensive rebound by Lamelo Ball! Lamelo Ball kicks it out.

[01:19] Team_063 possession (Score: 114-97)
Kyle Green drives, picks up Carmelo Anunoby. Help arrives from Damian Turner! Kyle Green attempts a Layup. Contested by Damian Turner (5.5 feet, MAN). KYLE GREEN MAKES IT! Assist: Jaren James
Score: 116-97

[01:01] Team_034 possession (Score: 116-97)
Nikola Wagner attempts a 3Pt. Contested by Lamelo Ball (4.8 feet, MAN). Nikola Wagner misses. Rebound secured by Cole Durant.

[00:43] Team_063 possession (Score: 116-97)
Lamelo Ball attempts a Midrange. Wide open! Nikola Wagner is 6.3 feet away. [MAN] Lamelo Ball misses. Rebound secured by Carmelo Anunoby.

[00:30] Team_034 possession (Score: 116-97)
Nikola Wagner drives and kicks out. Damian Turner attempts a 3Pt. Contested by DeMar Banchero (3.9 feet, ZONE). Damian Turner misses. Rebound secured by Cole Durant.

[00:17] Team_063 possession (Score: 116-97)
Cole Durant drives and kicks out. FOUL! Shooting foul on Vince Paul. DeMar Banchero to the line for 3 free throws. [Team fouls: 4] (Vince Paul: 1 personal fouls)   FT 1/3: GOOD   FT 2/3: GOOD   FT 3/3: GOOD DeMar Banchero makes 3/3 from the line.
Score: 119-97

================================================================================
                              4TH QUARTER COMPLETE                              
================================================================================

4TH QUARTER SCORE: Team_063 23, Team_034 20

BOX SCORE:
================================================================================

Team_063
--------------------------------------------------------------------------------
Player                MIN  PTS  REB  AST  TO      FG   FG%      3P   3P%
--------------------------------------------------------------------------------
Kyle Green             15    6    2    1   0   3/3   100.0     0/0   0.0
Tyler Harris           33    5    1    0   0   2/2   100.0     0/0   0.0
DeMar Banchero         12    5    0    0   0   2/4    50.0     0/0   0.0
Malcolm Quickley       36    4    3    0   0   2/4    50.0     0/0   0.0
Lamelo Ball            12    3    2    0   0   1/2    50.0     0/0   0.0
Dirk Reaves            36    0    2    1   0   0/0     0.0     0/0   0.0
Bradley Davis          36    0    0    0   0   0/3     0.0     0/0   0.0
Jaren James            12    0    0    1   0   0/3     0.0     0/0   0.0
Cole Durant            12    0    4    1   0   0/0     0.0     0/0   0.0

TEAM: FG: 10/21 (47.6%), 3PT: 1/4 (25.0%), REB: 14 (4 off, 10 def), AST: 4, TO: 2
TEAM FOULS: 10 [Team_034 in BONUS]


Team_034
--------------------------------------------------------------------------------
Player                MIN  PTS  REB  AST  TO      FG   FG%      3P   3P%
--------------------------------------------------------------------------------
Ben Hyland             36    4    0    0   0   2/3    66.7     0/0   0.0
Anthony Bane           36    4    2    1   0   2/3    66.7     0/0   0.0
Vince Paul             12    4    2    0   0   2/2   100.0     0/0   0.0
Devin Poole            33    2    0    0   0   1/1   100.0     0/0   0.0
Carmelo Anunoby        12    2    3    0   0   1/1   100.0     0/0   0.0
Damian Turner          12    2    0    0   0   1/2    50.0     0/0   0.0
Nikola Wagner          12    1    2    0   0   1/4    25.0     0/0   0.0
Cole Antetokounmpo     36    0    2    0   0   0/2     0.0     0/0   0.0
Terry Doncic           36    0    1    0   0   0/1     0.0     0/0   0.0
Manu Jokic             15    0    0    0   0   0/1     0.0     0/0   0.0

TEAM: FG: 10/20 (50.0%), 3PT: 0/5 (0.0%), REB: 12 (1 off, 11 def), AST: 1, TO: 2
TEAM FOULS: 4

================================================================================

================================================================================
                               FULL GAME COMPLETE                               
================================================================================

FINAL SCORE: Team_063 119, Team_034 97

SCORING BY QUARTER:
--------------------------------------------------------------------------------
Team                     Q1     Q2     Q3     Q4    FINAL
--------------------------------------------------------------------------------
Team_063                 33     23     40     23      119
Team_034                 22     26     29     20       97
--------------------------------------------------------------------------------

FULL GAME BOX SCORE:
================================================================================

Team_063
--------------------------------------------------------------------------------
Player                MIN  PTS  REB  AST  TO      FG   FG%      3P   3P%      FT STL BLK
--------------------------------------------------------------------------------
Bradley Davis          36   21    0    4   2   7/15   46.7   2/6    33.3   0/0     1   0
Malcolm Quickley       36   20   13    3   4   9/14   64.3   1/3    33.3   7/7     0   0
Terry Reaves           36    5    0    4   0   2/7    28.6   1/2    50.0   0/0     1   0
Dirk Reaves            36   18    8    2   2  10/11   90.9   1/2    50.0   4/4     1   1
Tyler Harris           33   25   11    2   2  10/11   90.9   0/1     0.0   5/5     0   2
Kyle Green             15   14    7    2   0   6/7    85.7   0/0     0.0   0/0     1   0
DeMar Banchero         12    7    0    1   0   3/5    60.0   0/0     0.0   3/3     0   0
Cole Durant            12    0    4    1   0   2/3    66.7   0/0     0.0   0/0     0   1
Jaren James            12    6    0    1   0   1/7    14.3   1/3    33.3   0/0     0   0
Lamelo Ball            12    3    3    2   1   1/2    50.0   1/1   100.0   0/0     0   0

TEAM: FG: 51/82 (62.2%), 3PT: 7/18 (38.9%), REB: 46 (10 off, 36 def), AST: 22, TO: 11


Team_034
--------------------------------------------------------------------------------
Player                MIN  PTS  REB  AST  TO      FG   FG%      3P   3P%      FT STL BLK
--------------------------------------------------------------------------------
Ben Hyland             36   12    0    1   0   6/11   54.5   1/4    25.0   1/2     1   0
Cole Antetokounmpo     36   14    7    3   2   5/8    62.5   3/5    60.0   1/1     0   0
Terry Doncic           36   15    8    2   4   7/11   63.6   2/5    40.0   0/0     3   1
Anthony Bane           36   17    9    5   1   8/17   47.1   0/0     0.0   7/7     0   0
Devin Poole            33   11    0    3   0   5/12   41.7   1/5    20.0   2/5     0   0
Manu Jokic             15    4    0    0   1   2/6    33.3   1/4    25.0   4/5     0   1
Damian Turner          12    9    0    1   1   4/5    80.0   0/0     0.0   4/5     0   0
Vince Paul             12    7    4    0   0   2/3    66.7   0/1     0.0   3/3     0   0
Nikola Wagner          12    1    4    0   0   1/4    25.0   0/2     0.0   1/2     1   0
Carmelo Anunoby        12    4    5    0   1   2/3    66.7   0/0     0.0   2/4     0   0

TEAM: FG: 43/81 (53.1%), 3PT: 8/26 (30.8%), REB: 37 (6 off, 31 def), AST: 15, TO: 10

================================================================================
