================================================================================
                        FULL GAME - Team_070 vs Team_093                        
================================================================================

================================================================================
                       1ST QUARTER - Team_070 vs Team_093                       
================================================================================

[12:00] Team_070 possession (Score: 0-0)
Khris Bryant attempts a 3Pt. Contested by Carmelo Wagner (3.2 feet, ZONE). Khris Bryant misses. Rebound secured by Ben Cunningham.

[11:45] Team_093 possession (Score: 0-0)
Trae Westbrook attempts a 3Pt. Contested by LeBron Barnes (3.3 feet, MAN). Trae Westbrook misses. Offensive rebound by Carmelo Wagner! Carmelo Wagner kicks it out.

[11:34] Team_093 possession (Score: 0-0)
Trae Westbrook drives, LeBron Barnes stays with him. Trae Westbrook attempts a Layup. Contested by LeBron Barnes (3.3 feet, MAN). Trae Westbrook misses. Offensive rebound by Carmelo Wagner! Carmelo Wagner kicks it out.

[11:16] Team_093 possession (Score: 0-0)
Trae Westbrook attempts a 3Pt. Contested by Khris Bryant (2.2 feet, ZONE). Trae Westbrook misses. Rebound secured by Khris Bryant.

[11:04] Team_070 possession (Score: 0-0)
Cole Gasol drives, picks up Ben Cunningham. Help arrives from Trae Westbrook! Cole Gasol attempts a Dunk. Contested by Trae Westbrook (5.1 feet, ZONE). COLE GASOL MAKES IT!
Score: 2-0

[10:49] Team_093 possession (Score: 2-0)
Carmelo Wagner attempts a Midrange. Contested by LeBron Barnes (3.2 feet, ZONE). CARMELO WAGNER MAKES IT!
Score: 2-2

[10:33] Team_070 possession (Score: 2-2)
Khris Bryant makes the Dunk and draws the foul on Ben Cunningham! And-1! Khris Bryant to the line for 1. [Team fouls: 1] (Ben Cunningham: 1 personal fouls)   FT 1/1: GOOD Khris Bryant makes 1/1 from the line.
Score: 5-2

[10:18] Team_093 possession (Score: 5-2)
Carmelo Wagner attempts a 3Pt. Contested by John Hyland (4.2 feet, MAN). Carmelo Wagner misses. FOUL! Loose ball foul on Khris Bryant during the rebound battle. [Team fouls: 1] No free throws, side out. (Khris Bryant: 1 personal fouls)

[10:03] Team_093 possession (Score: 5-2)
Carmelo Wagner makes the Layup and draws the foul on John Hyland! And-1! Carmelo Wagner to the line for 1. [Team fouls: 2] (John Hyland: 1 personal fouls)   FT 1/1: GOOD Carmelo Wagner makes 1/1 from the line.
Score: 5-5

[09:48] Team_070 possession (Score: 5-5)
Khris Bryant attempts a Midrange. Contested by Vince Barnes (4.0 feet, MAN). KHRIS BRYANT MAKES IT! Assist: John Hyland
Score: 7-5

[09:32] Team_093 possession (Score: 7-5)
Vince Barnes attempts a Layup. BLOCKED BY KHRIS BRYANT! Ball is loose! Rebound secured by Jabari Paul.

[09:21] Team_070 possession (Score: 7-5)
Khris Bryant attempts a Midrange. Contested by Vince Barnes (4.0 feet, MAN). Khris Bryant misses. Offensive rebound by LeBron Barnes! LeBron Barnes kicks it out.

[09:02] Team_070 possession (Score: 7-5)
FOUL! Reach-in foul on Ben Cunningham during the drive. [Team fouls: 2] No free throws, side out. (Ben Cunningham: 2 personal fouls)

[08:50] Team_070 possession (Score: 7-5)
Jabari Paul attempts a Midrange. Wide open! Trae Westbrook is 6.2 feet away. [ZONE] JABARI PAUL MAKES IT! Assist: Khris Bryant
Score: 9-5

[08:36] Team_093 possession (Score: 9-5)
Trae Westbrook attempts a Midrange. Contested by LeBron Barnes (3.3 feet, MAN). TRAE WESTBROOK MAKES IT!
Score: 9-7

[08:22] Team_070 possession (Score: 9-7)
Khris Bryant attempts a 3Pt. Contested by Carmelo Wagner (3.2 feet, ZONE). KHRIS BRYANT MAKES IT! Assist: John Hyland
Score: 12-7

[08:12] Team_093 possession (Score: 12-7)
Trae Westbrook attempts a Midrange. BLOCKED BY COLE GASOL! Ball deflects out of bounds off Trae Westbrook.

[07:57] Team_070 possession (Score: 12-7)
John Hyland makes the Midrange and draws the foul on Vince Barnes! And-1! John Hyland to the line for 1. [Team fouls: 3] (Vince Barnes: 1 personal fouls)   FT 1/1: GOOD John Hyland makes 1/1 from the line.
Score: 15-7

[07:42] Team_093 possession (Score: 15-7)
Carmelo Wagner attempts a 3Pt. Contested by John Hyland (4.2 feet, MAN). Carmelo Wagner misses. Rebound secured by Jabari Paul.

[07:28] Team_070 possession (Score: 15-7)
John Hyland attempts a 3Pt. Contested by Carmelo Wagner (3.3 feet, MAN). John Hyland misses. Rebound secured by Vince Barnes.

[07:14] Team_093 possession (Score: 15-7)
Ben Cunningham drives and kicks out. FOUL! Shooting foul on John Hyland. Carmelo Wagner to the line for 2 free throws. [Team fouls: 3] (John Hyland: 2 personal fouls)   FT 1/2: MISS   FT 2/2: GOOD Carmelo Wagner makes 1/2 from the line.
Score: 15-8

[07:00] Team_070 possession (Score: 15-8)
Cole Gasol attempts a 3Pt. Contested by Carmelo Wagner (3.5 feet, ZONE). COLE GASOL MAKES IT!
Score: 18-8

[06:47] Team_093 possession (Score: 18-8)
Trae Westbrook loses the ball! Stripped by LeBron Barnes! TURNOVER! (live ball)

[06:32] Team_070 possession (Score: 18-8)
LeBron Barnes drives and kicks out. John Hyland attempts a Midrange. Contested by Trae Westbrook (5.4 feet, ZONE). JOHN HYLAND MAKES IT! Assist: LeBron Barnes
Score: 20-8

[06:15] Team_093 possession (Score: 20-8)
Trae Westbrook drives, Khris Bryant stays with him. Trae Westbrook attempts a Layup. Contested by Khris Bryant (2.2 feet, ZONE). Trae Westbrook misses. Rebound secured by Khris Bryant.

[06:02] Team_070 possession (Score: 20-8)
Jabari Paul drives, Ben Cunningham stays with him. Jabari Paul attempts a Dunk. Contested by Ben Cunningham (5.7 feet, MAN). JABARI PAUL MAKES IT!
Score: 22-8

[05:44] Team_093 possession (Score: 22-8)
Damian Williamson attempts a 3Pt. Contested by Khris Bryant (2.4 feet, ZONE). Damian Williamson misses. Rebound secured by Jabari Paul.

[05:34] Team_070 possession (Score: 22-8)
Cole Gasol drives and kicks out. Jabari Paul attempts a 3Pt. Contested by Ben Cunningham (5.0 feet, MAN). Jabari Paul misses. Rebound secured by Ben Cunningham.

[05:17] Team_093 possession (Score: 22-8)
Damian Williamson attempts a 3Pt. Contested by Cole Gasol (5.2 feet, MAN). Damian Williamson misses. Rebound secured by LeBron Barnes.

[05:01] Team_070 possession (Score: 22-8)
John Hyland makes the Layup and draws the foul on Ben Cunningham! And-1! John Hyland to the line for 1. [Team fouls: 4] (Ben Cunningham: 3 personal fouls)   FT 1/1: GOOD John Hyland makes 1/1 from the line.
Score: 25-8

[04:43] Team_093 possession (Score: 25-8)
Trae Westbrook drives, picks up Khris Bryant. Help arrives from LeBron Barnes! Trae Westbrook attempts a Layup. Contested by LeBron Barnes (2.3 feet, ZONE). Trae Westbrook misses. Offensive rebound by Carmelo Wagner! Carmelo Wagner kicks it out.

[04:29] Team_093 possession (Score: 25-8)
Damian Williamson attempts a 3Pt. Contested by Cole Gasol (5.2 feet, MAN). Damian Williamson misses. Rebound secured by Khris Bryant.

[04:18] Team_070 possession (Score: 25-8)
Jabari Paul attempts a Midrange. Contested by Vince Barnes (4.9 feet, ZONE). JABARI PAUL MAKES IT!
Score: 27-8

[04:04] Team_093 possession (Score: 27-8)
Vince Barnes attempts a 3Pt. Contested by Khris Bryant (2.7 feet, MAN). Vince Barnes misses. Rebound secured by Khris Bryant.

[03:48] Team_070 possession (Score: 27-8)
FOUL! Reach-in foul on Ben Cunningham during the drive. [IN THE BONUS! 5 team fouls] Jabari Paul to the line for 2 free throws. (Ben Cunningham: 4 personal fouls)   FT 1/2: GOOD   FT 2/2: GOOD Jabari Paul makes 2/2 from the line.
Score: 29-8

[03:36] Team_093 possession (Score: 29-8)
Ben Cunningham drives, Khris Bryant stays with him. Ben Cunningham attempts a Dunk. Contested by Khris Bryant (3.1 feet, MAN). BEN CUNNINGHAM MAKES IT! Assist: Vince Barnes
Score: 29-10

[03:23] Team_070 possession (Score: 29-10)
Cole Gasol attempts a 3Pt. Contested by Carmelo Wagner (3.8 feet, ZONE). Cole Gasol misses. Rebound secured by Vince Barnes.

[03:09] Team_093 possession (Score: 29-10)
Damian Williamson attempts a Midrange. Contested by Cole Gasol (5.3 feet, MAN). Damian Williamson misses. Rebound secured by Khris Bryant.

[02:52] Team_070 possession (Score: 29-10)
LeBron Barnes attempts a 3Pt. Contested by Carmelo Wagner (4.1 feet, ZONE). LeBron Barnes misses. Rebound secured by Vince Barnes.

[02:37] Team_093 possession (Score: 29-10)
Vince Barnes drives, picks up Khris Bryant. Help arrives from LeBron Barnes! Vince Barnes attempts a Layup. Contested by LeBron Barnes (2.9 feet, ZONE). VINCE BARNES MAKES IT!
Score: 29-12

[02:23] Team_070 possession (Score: 29-12)
LeBron Barnes drives, picks up Ben Cunningham. Help arrives from Trae Westbrook! LeBron Barnes attempts a Dunk. Contested by Trae Westbrook (5.7 feet, ZONE). LeBron Barnes misses. Rebound secured by Vince Barnes.

[02:14] Team_093 possession (Score: 29-12)
Carmelo Wagner attempts a Layup. Contested by John Hyland (4.4 feet, MAN). CARMELO WAGNER MAKES IT!
Score: 29-14

[01:56] Team_070 possession (Score: 29-14)
Khris Bryant attempts a Midrange. Contested by Vince Barnes (4.3 feet, MAN). KHRIS BRYANT MAKES IT!
Score: 31-14

[01:45] Team_093 possession (Score: 31-14)
Vince Barnes drives, picks up Khris Bryant. Help arrives from LeBron Barnes! Vince Barnes attempts a Dunk. Contested by LeBron Barnes (3.0 feet, MAN). VINCE BARNES MAKES IT!
Score: 31-16

[01:31] Team_070 possession (Score: 31-16)
Khris Bryant attempts a Layup. Contested by Vince Barnes (4.3 feet, MAN). KHRIS BRYANT MAKES IT! Assist: Cole Gasol
Score: 33-16

[01:19] Team_093 possession (Score: 33-16)
Damian Williamson attempts a 3Pt. Contested by John Hyland (4.7 feet, ZONE). DAMIAN WILLIAMSON MAKES IT! Assist: Vince Barnes
Score: 33-19

[01:05] Team_070 possession (Score: 33-19)
Khris Bryant attempts a Midrange. Contested by Vince Barnes (4.4 feet, MAN). Khris Bryant misses. Offensive rebound by Khris Bryant! Khris Bryant puts it back in!
Score: 35-19

[00:49] Team_093 possession (Score: 35-19)
FOUL! Shooting foul on Khris Bryant. Carmelo Wagner to the line for 2 free throws. [Team fouls: 4] (Khris Bryant: 2 personal fouls)   FT 1/2: GOOD   FT 2/2: GOOD Carmelo Wagner makes 2/2 from the line.
Score: 35-21

[00:32] Team_070 possession (Score: 35-21)
John Hyland drives and kicks out. LeBron Barnes makes the Midrange and draws the foul on Trae Westbrook! And-1! LeBron Barnes to the line for 1. [BONUS: 6 team fouls] (Trae Westbrook: 1 personal fouls)   FT 1/1: GOOD LeBron Barnes makes 1/1 from the line.
Score: 38-21

[00:16] Team_093 possession (Score: 38-21)
Trae Westbrook attempts a 3Pt. Contested by LeBron Barnes (3.9 feet, ZONE). TRAE WESTBROOK MAKES IT! Assist: Vince Barnes
Score: 38-24

[00:01] Team_070 possession (Score: 38-24)
LeBron Barnes throws a bad pass! Stolen by Trae Westbrook! TURNOVER! (live ball)

================================================================================
                              1ST QUARTER COMPLETE                              
================================================================================

1ST QUARTER SCORE: Team_070 38, Team_093 24

BOX SCORE:
================================================================================

Team_070
--------------------------------------------------------------------------------
Player                MIN  PTS  REB  AST  TO      FG   FG%      3P   3P%
--------------------------------------------------------------------------------
Khris Bryant           12   14    6    1   0   6/7    85.7     0/0   0.0
John Hyland            12    8    0    2   0   3/4    75.0     0/0   0.0
Jabari Paul            12    8    3    0   0   4/4   100.0     0/0   0.0
Cole Gasol             12    5    0    1   0   2/4    50.0     0/0   0.0
LeBron Barnes          12    3    2    1   0   1/3    33.3     0/0   0.0

TEAM: FG: 16/22 (72.7%), 3PT: 2/6 (33.3%), REB: 11 (2 off, 9 def), AST: 5, TO: 1
TEAM FOULS: 4


Team_093
--------------------------------------------------------------------------------
Player                MIN  PTS  REB  AST  TO      FG   FG%      3P   3P%
--------------------------------------------------------------------------------
Carmelo Wagner         12   10    4    0   0   5/6    83.3     0/0   0.0
Trae Westbrook         12    5    0    0   0   2/5    40.0     0/0   0.0
Vince Barnes           12    4    4    3   0   2/4    50.0     0/0   0.0
Damian Williamson      12    3    0    0   0   1/5    20.0     0/0   0.0
Ben Cunningham         12    2    2    0   0   1/1   100.0     0/0   0.0

TEAM: FG: 11/21 (52.4%), 3PT: 2/8 (25.0%), REB: 10 (4 off, 6 def), AST: 3, TO: 1
TEAM FOULS: 6 [Team_070 in BONUS]

================================================================================

================================================================================
                       2ND QUARTER - Team_070 vs Team_093                       
================================================================================

[12:00] Team_070 possession (Score: 38-24)
Jabari Paul attempts a Midrange. Wide open! Ben Cunningham is 6.0 feet away. [MAN] Jabari Paul misses. Rebound secured by Carmelo Wagner.

[11:44] Team_093 possession (Score: 38-24)
Damian Williamson attempts a Layup. BLOCKED BY COLE GASOL! Ball is loose! Rebound secured by LeBron Barnes.

[11:29] Team_070 possession (Score: 38-24)
Cole Gasol attempts a 3Pt. Contested by Carmelo Wagner (4.0 feet, ZONE). COLE GASOL MAKES IT! Assist: John Hyland
Score: 41-24

[11:15] Team_093 possession (Score: 41-24)
Carmelo Wagner attempts a 3Pt. Contested by John Hyland (4.5 feet, MAN). CARMELO WAGNER MAKES IT! Assist: Trae Westbrook
Score: 41-27

[11:02] Team_070 possession (Score: 41-27)
LeBron Barnes drives to the basket... FOUL! Offensive foul on LeBron Barnes! Ben Cunningham drew the charge! [Team fouls: 1] (LeBron Barnes: 1 personal fouls) TURNOVER! (dead ball)

[10:45] Team_093 possession (Score: 41-27)
FOUL! Shooting foul on Cole Gasol. Damian Williamson to the line for 2 free throws. [Team fouls: 2] (Cole Gasol: 1 personal fouls)   FT 1/2: MISS   FT 2/2: MISS Damian Williamson makes 0/2 from the line. FOUL! Loose ball foul on Jabari Paul during the free throw rebound! [Team fouls: 3] No free throws, side out. (Jabari Paul: 1 personal fouls)

[10:31] Team_093 possession (Score: 41-27)
Ben Cunningham attempts a Layup. Contested by Khris Bryant (3.5 feet, ZONE). BEN CUNNINGHAM MAKES IT! Assist: Carmelo Wagner
Score: 41-29

[10:16] Team_070 possession (Score: 41-29)
Jabari Paul attempts a Layup. Wide open! Ben Cunningham is 6.2 feet away. [ZONE] JABARI PAUL MAKES IT! Assist: LeBron Barnes
Score: 43-29

[10:04] Team_093 possession (Score: 43-29)
FOUL! Shooting foul on Khris Bryant. Ben Cunningham to the line for 2 free throws. [Team fouls: 4] (Khris Bryant: 1 personal fouls)   FT 1/2: MISS   FT 2/2: GOOD Ben Cunningham makes 1/2 from the line.
Score: 43-30

[09:55] Team_070 possession (Score: 43-30)
Cole Gasol attempts a 3Pt. Contested by Damian Williamson (5.7 feet, MAN). Cole Gasol misses. Rebound secured by Vince Barnes.

[09:42] Team_093 possession (Score: 43-30)
Trae Westbrook attempts a 3Pt. Contested by LeBron Barnes (4.0 feet, MAN). TRAE WESTBROOK MAKES IT! Assist: Ben Cunningham
Score: 43-33

[09:23] Team_070 possession (Score: 43-33)
LeBron Barnes attempts a 3Pt. Wide open! Trae Westbrook is 6.3 feet away. [MAN] LeBron Barnes misses. Rebound secured by Ben Cunningham.

[09:10] Team_093 possession (Score: 43-33)
Carmelo Wagner drives, picks up Khris Bryant. Help arrives from LeBron Barnes! Carmelo Wagner attempts a Layup. Contested by LeBron Barnes (3.0 feet, ZONE). CARMELO WAGNER MAKES IT! Assist: Ben Cunningham
Score: 43-35

[08:55] Team_070 possession (Score: 43-35)
Khris Bryant drives, Vince Barnes stays with him. Khris Bryant attempts a Dunk. Contested by Vince Barnes (4.6 feet, MAN). KHRIS BRYANT MAKES IT! Assist: Cole Gasol
Score: 45-35

[08:40] Team_093 possession (Score: 45-35)
Damian Williamson makes the Midrange and draws the foul on John Hyland! And-1! Damian Williamson to the line for 1. [BONUS: 5 team fouls] (John Hyland: 1 personal fouls)   FT 1/1: GOOD Damian Williamson makes 1/1 from the line.
Score: 45-38

[08:24] Team_070 possession (Score: 45-38)
Jabari Paul attempts a 3Pt. Wide open! Ben Cunningham is 6.4 feet away. [MAN] JABARI PAUL MAKES IT! Assist: John Hyland
Score: 48-38

[08:06] Team_093 possession (Score: 48-38)
Carmelo Wagner makes the Dunk and draws the foul on John Hyland! And-1! Carmelo Wagner to the line for 1. [BONUS: 6 team fouls] (John Hyland: 2 personal fouls)   FT 1/1: GOOD Carmelo Wagner makes 1/1 from the line.
Score: 48-41

[07:50] Team_070 possession (Score: 48-41)
FOUL! Holding foul on Ben Cunningham. [Team fouls: 1] No free throws, side out. (Ben Cunningham: 1 personal fouls)

[07:35] Team_070 possession (Score: 48-41)
Cole Gasol attempts a Layup. Contested by Damian Williamson (6.0 feet, MAN). COLE GASOL MAKES IT! Assist: Jabari Paul
Score: 50-41

[07:21] Team_093 possession (Score: 50-41)
Ben Cunningham drives, Khris Bryant stays with him. Ben Cunningham attempts a Layup. Contested by Khris Bryant (3.9 feet, MAN). Ben Cunningham misses. Rebound secured by Khris Bryant.

[07:07] Team_070 possession (Score: 50-41)
Cole Gasol attempts a Layup. Wide open! Damian Williamson is 6.0 feet away. [MAN] Cole Gasol misses. Offensive rebound by Khris Bryant! Khris Bryant kicks it out.

[06:51] Team_070 possession (Score: 50-41)
Khris Bryant attempts a 3Pt. Contested by Vince Barnes (4.9 feet, MAN). Khris Bryant misses. Rebound secured by Carmelo Wagner.

[06:36] Team_093 possession (Score: 50-41)
Carmelo Wagner commits a violation (traveling/carry)! TURNOVER! (dead ball)

[06:36] Substitution (Team_070): Cole Gasol OUT → Paul Quickley IN (stamina_rule2)

[06:36] Substitution (Team_070): LeBron Barnes OUT → Allen Quickley IN (stamina_rule2)

[06:36] Substitution (Team_070): John Hyland OUT → D'Angelo McGrady IN (stamina_rule2)

[06:36] Substitution (Team_070): Khris Bryant OUT → Luka Gobert IN (stamina_rule2)

[06:36] Substitution (Team_070): Jabari Paul OUT → Russell Morant IN (stamina_rule2)

[06:36] Substitution (Team_093): Damian Williamson OUT → Shaquille George IN (stamina_rule2)

[06:36] Substitution (Team_093): Trae Westbrook OUT → Immanuel Cunningham IN (stamina_rule2)

[06:36] Substitution (Team_093): Carmelo Wagner OUT → Lauri Parker IN (stamina_rule2)

[06:36] Substitution (Team_093): Vince Barnes OUT → Kobe Murray IN (stamina_rule2)

[06:36] Substitution (Team_093): Ben Cunningham OUT → Cade O'Neal IN (stamina_rule2)

[06:21] Team_070 possession (Score: 50-41)
Luka Gobert attempts a 3Pt. Contested by Shaquille George (4.4 feet, ZONE). Luka Gobert misses. Rebound secured by Cade O'Neal.

[06:03] Team_093 possession (Score: 50-41)
Cade O'Neal attempts a 3Pt. Contested by Paul Quickley (4.4 feet, ZONE). Cade O'Neal misses. Rebound secured by Luka Gobert.

[05:49] Team_070 possession (Score: 50-41)
Russell Morant attempts a Layup. Contested by Kobe Murray (4.2 feet, MAN). Russell Morant misses. Rebound secured by Lauri Parker.

[05:32] Team_093 possession (Score: 50-41)
Cade O'Neal attempts a Layup. Contested by Russell Morant (3.8 feet, MAN). CADE O'NEAL MAKES IT!
Score: 50-43

[05:19] Team_070 possession (Score: 50-43)
FOUL! Holding foul on Shaquille George. [Team fouls: 2] No free throws, side out. (Shaquille George: 1 personal fouls)

[05:02] Team_070 possession (Score: 50-43)
D'Angelo McGrady attempts a 3Pt. Contested by Shaquille George (4.4 feet, ZONE). D'Angelo McGrady misses. Rebound secured by Cade O'Neal.

[04:45] Team_093 possession (Score: 50-43)
Kobe Murray attempts a 3Pt. Contested by Paul Quickley (4.4 feet, ZONE). Kobe Murray misses. Rebound secured by Luka Gobert.

[04:31] Team_070 possession (Score: 50-43)
FOUL! Shooting foul on Immanuel Cunningham. Allen Quickley to the line for 2 free throws. [Team fouls: 3] (Immanuel Cunningham: 1 personal fouls)   FT 1/2: MISS   FT 2/2: MISS Allen Quickley makes 0/2 from the line. Offensive rebound by Russell Morant! Russell Morant puts it back in!
Score: 52-43

[04:19] Team_093 possession (Score: 52-43)
Lauri Parker attempts a 3Pt. Contested by Paul Quickley (4.4 feet, ZONE). LAURI PARKER MAKES IT! Assist: Immanuel Cunningham
Score: 52-46

[04:01] Team_070 possession (Score: 52-46)
Luka Gobert attempts a Midrange. Contested by Kobe Murray (4.1 feet, MAN). Luka Gobert misses. Offensive rebound by Russell Morant! Russell Morant puts it back in!
Score: 54-46

[03:47] Team_093 possession (Score: 54-46)
Shaquille George drives, picks up Russell Morant. Help arrives from Paul Quickley! Shaquille George attempts a Dunk. Contested by Paul Quickley (4.0 feet, ZONE). SHAQUILLE GEORGE MAKES IT!
Score: 54-48

[03:34] Team_070 possession (Score: 54-48)
Paul Quickley drives to the basket... Paul Quickley loses control! Ball rolls out of bounds! TURNOVER! (dead ball)

[03:23] Team_093 possession (Score: 54-48)
Shaquille George attempts a 3Pt. Contested by Paul Quickley (4.6 feet, ZONE). Shaquille George misses. Rebound secured by Luka Gobert.

[03:11] Team_070 possession (Score: 54-48)
FOUL! Reach-in foul on Immanuel Cunningham during the drive. [Team fouls: 4] No free throws, side out. (Immanuel Cunningham: 2 personal fouls)

[03:02] Team_070 possession (Score: 54-48)
Allen Quickley attempts a 3Pt. Contested by Shaquille George (4.4 feet, ZONE). Allen Quickley misses. Rebound secured by Kobe Murray.

[02:45] Team_093 possession (Score: 54-48)
Lauri Parker attempts a 3Pt. Contested by Paul Quickley (4.4 feet, ZONE). Lauri Parker misses. Rebound secured by Russell Morant.

[02:30] Team_070 possession (Score: 54-48)
Allen Quickley attempts a 3Pt. Contested by Immanuel Cunningham (5.7 feet, MAN). Allen Quickley misses. Rebound secured by Kobe Murray.

[02:19] Team_093 possession (Score: 54-48)
Immanuel Cunningham attempts a Layup. Contested by Russell Morant (3.9 feet, ZONE). IMMANUEL CUNNINGHAM MAKES IT! Assist: Lauri Parker
Score: 54-50

[02:06] Team_070 possession (Score: 54-50)
Allen Quickley attempts a 3Pt. Contested by Immanuel Cunningham (5.7 feet, MAN). ALLEN QUICKLEY MAKES IT! Assist: D'Angelo McGrady
Score: 57-50

[01:51] Team_093 possession (Score: 57-50)
Lauri Parker attempts a Layup. Contested by D'Angelo McGrady (5.7 feet, MAN). Lauri Parker misses. Rebound secured by Russell Morant.

[01:37] Team_070 possession (Score: 57-50)
Allen Quickley attempts a 3Pt. Contested by Shaquille George (4.4 feet, ZONE). ALLEN QUICKLEY MAKES IT! Assist: Luka Gobert
Score: 60-50

[01:22] Team_093 possession (Score: 60-50)
Cade O'Neal drives, Russell Morant stays with him. Cade O'Neal attempts a Dunk. Contested by Russell Morant (3.8 feet, MAN). CADE O'NEAL MAKES IT! Assist: Shaquille George
Score: 60-52

[01:10] Team_070 possession (Score: 60-52)
Luka Gobert attempts a Midrange. Contested by Lauri Parker (4.7 feet, ZONE). Luka Gobert misses. Rebound secured by Kobe Murray.

[00:56] Team_093 possession (Score: 60-52)
Lauri Parker attempts a Layup. Contested by Russell Morant (3.8 feet, ZONE). LAURI PARKER MAKES IT!
Score: 60-54

[00:45] Team_070 possession (Score: 60-54)
Luka Gobert drives and kicks out. Luka Gobert attempts a 3Pt. Contested by Shaquille George (4.3 feet, ZONE). Luka Gobert misses. Rebound secured by Cade O'Neal.

[00:29] Team_093 possession (Score: 60-54)
Immanuel Cunningham attempts a 3Pt. Contested by Paul Quickley (4.5 feet, ZONE). Immanuel Cunningham misses. Rebound secured by Russell Morant.

[00:15] Team_070 possession (Score: 60-54)
FOUL! Offensive foul on Luka Gobert! Kobe Murray drew the charge! [Team fouls: 7] (Luka Gobert: 1 personal fouls) TURNOVER! (dead ball)

================================================================================
                              2ND QUARTER COMPLETE                              
================================================================================

2ND QUARTER SCORE: Team_070 22, Team_093 30

BOX SCORE:
================================================================================

Team_070
--------------------------------------------------------------------------------
Player                MIN  PTS  REB  AST  TO      FG   FG%      3P   3P%
--------------------------------------------------------------------------------
Allen Quickley          6    6    0    0   0   2/4    50.0     0/0   0.0
Jabari Paul            18    5    0    1   0   2/3    66.7     0/0   0.0
Cole Gasol             18    5    0    1   0   2/3    66.7     0/0   0.0
Russell Morant          6    4    4    0   0   2/3    66.7     0/0   0.0
Khris Bryant           18    2    2    0   0   1/2    50.0     0/0   0.0
LeBron Barnes          18    0    1    1   0   0/1     0.0     0/0   0.0
John Hyland            18    0    0    2   0   0/0     0.0     0/0   0.0
Luka Gobert             6    0    3    1   0   0/3     0.0     0/0   0.0
D'Angelo McGrady        6    0    0    1   0   0/1     0.0     0/0   0.0

TEAM: FG: 9/20 (45.0%), 3PT: 4/11 (36.4%), REB: 10 (2 off, 8 def), AST: 7, TO: 3
TEAM FOULS: 7 [Team_093 in BONUS]


Team_093
--------------------------------------------------------------------------------
Player                MIN  PTS  REB  AST  TO      FG   FG%      3P   3P%
--------------------------------------------------------------------------------
Carmelo Wagner         18    8    3    1   0   3/3   100.0     0/0   0.0
Lauri Parker            6    5    1    1   0   2/4    50.0     0/0   0.0
Cade O'Neal             6    4    3    0   0   2/3    66.7     0/0   0.0
Damian Williamson      18    3    0    0   0   1/2    50.0     0/0   0.0
Trae Westbrook         18    3    0    1   0   1/1   100.0     0/0   0.0
Ben Cunningham         18    3    1    2   0   2/3    66.7     0/0   0.0
Immanuel Cunningham     6    2    0    1   0   1/2    50.0     0/0   0.0
Shaquille George        6    2    0    1   0   1/2    50.0     0/0   0.0
Vince Barnes           18    0    1    0   0   0/0     0.0     0/0   0.0
Kobe Murray             6    0    3    0   0   0/1     0.0     0/0   0.0

TEAM: FG: 13/21 (61.9%), 3PT: 3/8 (37.5%), REB: 12 (1 off, 11 def), AST: 7, TO: 1
TEAM FOULS: 4

================================================================================

================================================================================
                       3RD QUARTER - Team_070 vs Team_093                       
================================================================================

[12:00] Team_070 possession (Score: 60-54)
FOUL! Shooting foul on Vince Barnes. Khris Bryant to the line for 2 free throws. [Team fouls: 1] (Vince Barnes: 1 personal fouls)   FT 1/2: MISS   FT 2/2: GOOD Khris Bryant makes 1/2 from the line.
Score: 61-54

[11:50] Team_093 possession (Score: 61-54)
Damian Williamson attempts a 3Pt. Contested by LeBron Barnes (3.5 feet, ZONE). Damian Williamson misses. Rebound secured by Khris Bryant.

[11:38] Team_070 possession (Score: 61-54)
John Hyland attempts a 3Pt. Contested by Carmelo Wagner (3.3 feet, MAN). John Hyland misses. Rebound secured by Vince Barnes.

[11:22] Team_093 possession (Score: 61-54)
Damian Williamson attempts a Midrange. Contested by Cole Gasol (5.2 feet, MAN). Damian Williamson misses. Rebound secured by Khris Bryant.

[11:06] Team_070 possession (Score: 61-54)
LeBron Barnes attempts a 3Pt. Contested by Trae Westbrook (5.9 feet, MAN). LeBron Barnes misses. Rebound secured by Vince Barnes.

[10:51] Team_093 possession (Score: 61-54)
Ben Cunningham attempts a Midrange. Contested by Khris Bryant (2.9 feet, MAN). BEN CUNNINGHAM MAKES IT!
Score: 61-56

[10:37] Team_070 possession (Score: 61-56)
John Hyland drives to the basket... John Hyland commits a violation (traveling/carry)! TURNOVER! (dead ball)

[10:26] Team_093 possession (Score: 61-56)
Trae Westbrook attempts a 3Pt. Contested by LeBron Barnes (3.3 feet, MAN). Trae Westbrook misses. Offensive rebound by Ben Cunningham! Ben Cunningham kicks it out.

[10:09] Team_093 possession (Score: 61-56)
Trae Westbrook attempts a 3Pt. Contested by LeBron Barnes (3.3 feet, MAN). TRAE WESTBROOK MAKES IT! Assist: Carmelo Wagner
Score: 61-59

[09:50] Team_070 possession (Score: 61-59)
Khris Bryant attempts a 3Pt. Contested by Vince Barnes (4.0 feet, MAN). KHRIS BRYANT MAKES IT! Assist: LeBron Barnes
Score: 64-59

[09:33] Team_093 possession (Score: 64-59)
Ben Cunningham attempts a Layup. Contested by Khris Bryant (2.9 feet, MAN). BEN CUNNINGHAM MAKES IT! Assist: Carmelo Wagner
Score: 64-61

[09:15] Team_070 possession (Score: 64-61)
Cole Gasol drives, picks up Damian Williamson. Help arrives from Carmelo Wagner! Cole Gasol attempts a Layup. Contested by Carmelo Wagner (5.0 feet, MAN). COLE GASOL MAKES IT! Assist: Jabari Paul
Score: 66-61

[09:03] Team_093 possession (Score: 66-61)
Vince Barnes drives to the basket... Vince Barnes throws a bad pass! Stolen by Khris Bryant! TURNOVER! (live ball)

[08:48] Team_070 possession (Score: 66-61)
Jabari Paul attempts a Layup. Contested by Ben Cunningham (5.7 feet, ZONE). JABARI PAUL MAKES IT! Assist: Cole Gasol
Score: 68-61

[08:37] Team_093 possession (Score: 68-61)
Vince Barnes makes the Dunk and draws the foul on Khris Bryant! And-1! Vince Barnes to the line for 1. [Team fouls: 1] (Khris Bryant: 1 personal fouls)   FT 1/1: MISS Vince Barnes makes 0/1 from the line. Rebound secured by LeBron Barnes.
Score: 68-63

[08:20] Team_070 possession (Score: 68-63)
LeBron Barnes attempts a 3Pt. Contested by Carmelo Wagner (3.8 feet, ZONE). LeBron Barnes misses. Rebound secured by Vince Barnes.

[08:02] Team_093 possession (Score: 68-63)
FOUL! Holding foul on John Hyland. [Team fouls: 2] No free throws, side out. (John Hyland: 1 personal fouls)

[07:51] Team_093 possession (Score: 68-63)
Trae Westbrook drives, Khris Bryant stays with him. Trae Westbrook attempts a Dunk. Contested by Khris Bryant (2.2 feet, ZONE). TRAE WESTBROOK MAKES IT! Assist: Ben Cunningham
Score: 68-65

[07:40] Team_070 possession (Score: 68-65)
LeBron Barnes attempts a Midrange. Contested by Carmelo Wagner (3.8 feet, ZONE). LEBRON BARNES MAKES IT! Assist: Khris Bryant
Score: 70-65

[07:26] Team_093 possession (Score: 70-65)
Damian Williamson attempts a 3Pt. Contested by Khris Bryant (2.4 feet, ZONE). DAMIAN WILLIAMSON MAKES IT! Assist: Carmelo Wagner
Score: 70-68

[07:12] Team_070 possession (Score: 70-68)
FOUL! Reach-in foul on Ben Cunningham during the drive. [Team fouls: 2] No free throws, side out. (Ben Cunningham: 1 personal fouls)

[06:58] Team_070 possession (Score: 70-68)
Cole Gasol drives, Ben Cunningham stays with him. Cole Gasol attempts a Dunk. Contested by Ben Cunningham (5.1 feet, ZONE). Cole Gasol misses. Rebound secured by Vince Barnes.

[06:43] Team_093 possession (Score: 70-68)
Trae Westbrook drives and kicks out. Trae Westbrook attempts a 3Pt. Contested by LeBron Barnes (3.5 feet, MAN). TRAE WESTBROOK MAKES IT! Assist: Ben Cunningham
Score: 70-71

[06:29] Team_070 possession (Score: 70-71)
LeBron Barnes attempts a 3Pt. Contested by Carmelo Wagner (3.8 feet, ZONE). LeBron Barnes misses. Rebound secured by Carmelo Wagner.

[06:10] Team_093 possession (Score: 70-71)
FOUL! Reach-in foul on Khris Bryant during the drive. [Team fouls: 3] No free throws, side out. (Khris Bryant: 2 personal fouls)

[05:57] Team_093 possession (Score: 70-71)
FOUL! Holding foul on Khris Bryant. [Team fouls: 4] No free throws, side out. (Khris Bryant: 3 personal fouls)

[05:39] Team_093 possession (Score: 70-71)
Ben Cunningham drives and kicks out. Damian Williamson attempts a Midrange. Contested by LeBron Barnes (3.5 feet, ZONE). Damian Williamson misses. Offensive rebound by Carmelo Wagner! Carmelo Wagner kicks it out.

[05:27] Team_093 possession (Score: 70-71)
Carmelo Wagner attempts a 3Pt. Contested by John Hyland (4.2 feet, MAN). CARMELO WAGNER MAKES IT! Assist: Damian Williamson
Score: 70-74

[05:09] Team_070 possession (Score: 70-74)
FOUL! Reach-in foul on Ben Cunningham during the drive. [Team fouls: 3] No free throws, side out. (Ben Cunningham: 2 personal fouls)

[04:55] Team_070 possession (Score: 70-74)
LeBron Barnes attempts a 3Pt. Contested by Trae Westbrook (5.9 feet, MAN). LeBron Barnes misses. Rebound secured by Ben Cunningham.

[04:41] Team_093 possession (Score: 70-74)
Damian Williamson attempts a 3Pt. Contested by Khris Bryant (2.4 feet, ZONE). Damian Williamson misses. Rebound secured by Khris Bryant.

[04:32] Team_070 possession (Score: 70-74)
Jabari Paul attempts a Midrange. Contested by Carmelo Wagner (4.2 feet, ZONE). JABARI PAUL MAKES IT! Assist: Cole Gasol
Score: 72-74

[04:21] Team_093 possession (Score: 72-74)
Ben Cunningham attempts a Layup. BLOCKED BY KHRIS BRYANT! Ball is loose! Offensive rebound by Carmelo Wagner! Carmelo Wagner kicks it out.

[04:03] Team_093 possession (Score: 72-74)
Vince Barnes drives and kicks out. Ben Cunningham attempts a 3Pt. Contested by Khris Bryant (2.6 feet, MAN). Ben Cunningham misses. Rebound secured by LeBron Barnes.

[03:47] Team_070 possession (Score: 72-74)
John Hyland drives, Carmelo Wagner stays with him. John Hyland attempts a Layup. Contested by Carmelo Wagner (3.5 feet, MAN). John Hyland misses. Rebound secured by Carmelo Wagner.

[03:31] Team_093 possession (Score: 72-74)
Carmelo Wagner attempts a 3Pt. Contested by John Hyland (4.3 feet, MAN). Carmelo Wagner misses. Rebound secured by Khris Bryant.

[03:16] Team_070 possession (Score: 72-74)
Khris Bryant attempts a 3Pt. Contested by Vince Barnes (4.1 feet, MAN). KHRIS BRYANT MAKES IT! Assist: Cole Gasol
Score: 75-74

[03:07] Team_093 possession (Score: 75-74)
Trae Westbrook attempts a 3Pt. Contested by Khris Bryant (2.5 feet, ZONE). Trae Westbrook misses. FOUL! Loose ball foul on Khris Bryant during the rebound battle. [IN THE BONUS! 5 team fouls] Ben Cunningham to the line for 2 free throws. (Khris Bryant: 4 personal fouls)   FT 1/2: GOOD   FT 2/2: MISS Ben Cunningham makes 1/2 from the line. Rebound secured by Khris Bryant.
Score: 75-75

[02:50] Team_070 possession (Score: 75-75)
Khris Bryant attempts a 3Pt. Contested by Carmelo Wagner (3.5 feet, ZONE). Khris Bryant misses. Rebound secured by Carmelo Wagner.

[02:31] Team_093 possession (Score: 75-75)
Vince Barnes drives and kicks out. Trae Westbrook attempts a 3Pt. Contested by LeBron Barnes (3.8 feet, MAN). Trae Westbrook misses. FOUL! Loose ball foul on Khris Bryant during the rebound battle. [IN THE BONUS! 6 team fouls] Carmelo Wagner to the line for 2 free throws. (Khris Bryant: 5 personal fouls)   FT 1/2: MISS   FT 2/2: MISS Carmelo Wagner makes 0/2 from the line. Rebound secured by Khris Bryant.

[02:13] Team_070 possession (Score: 75-75)
John Hyland attempts a 3Pt. Contested by Carmelo Wagner (3.7 feet, ZONE). John Hyland misses. Rebound secured by Ben Cunningham.

[01:57] Team_093 possession (Score: 75-75)
Vince Barnes attempts a 3Pt. Contested by Khris Bryant (2.9 feet, MAN). Vince Barnes misses. Rebound secured by LeBron Barnes.

[01:39] Team_070 possession (Score: 75-75)
Khris Bryant attempts a 3Pt. Contested by Carmelo Wagner (3.7 feet, ZONE). Khris Bryant misses. Offensive rebound by LeBron Barnes! LeBron Barnes kicks it out.

[01:23] Team_070 possession (Score: 75-75)
Cole Gasol attempts a Midrange. Contested by Vince Barnes (4.6 feet, ZONE). Cole Gasol misses. Rebound secured by Vince Barnes.

[01:11] Team_093 possession (Score: 75-75)
Trae Westbrook attempts a 3Pt. Contested by Khris Bryant (2.7 feet, ZONE). Trae Westbrook misses. Rebound secured by Khris Bryant.

[01:00] Team_070 possession (Score: 75-75)
Jabari Paul attempts a 3Pt. Contested by Carmelo Wagner (4.6 feet, ZONE). Jabari Paul misses. Rebound secured by Carmelo Wagner.

[00:48] Team_093 possession (Score: 75-75)
FOUL! Holding foul on John Hyland. [IN THE BONUS! 7 team fouls] Carmelo Wagner to the line for 2 free throws. (John Hyland: 2 personal fouls)   FT 1/2: GOOD   FT 2/2: GOOD Carmelo Wagner makes 2/2 from the line.
Score: 75-77

[00:32] Team_070 possession (Score: 75-77)
FOUL! Holding foul on Trae Westbrook. [Team fouls: 4] No free throws, side out. (Trae Westbrook: 1 personal fouls)

[00:19] Team_070 possession (Score: 75-77)
John Hyland attempts a 3Pt. Contested by Carmelo Wagner (3.9 feet, ZONE). John Hyland misses. Rebound secured by Vince Barnes.

[00:03] Team_093 possession (Score: 75-77)
FOUL! Holding foul on Cole Gasol. [IN THE BONUS! 8 team fouls] Damian Williamson to the line for 2 free throws. (Cole Gasol: 1 personal fouls)   FT 1/2: GOOD   FT 2/2: GOOD Damian Williamson makes 2/2 from the line.
Score: 75-79

================================================================================
                              3RD QUARTER COMPLETE                              
================================================================================

3RD QUARTER SCORE: Team_070 15, Team_093 25

BOX SCORE:
================================================================================

Team_070
--------------------------------------------------------------------------------
Player                MIN  PTS  REB  AST  TO      FG   FG%      3P   3P%
--------------------------------------------------------------------------------
Khris Bryant           30    7    7    1   0   3/4    75.0     0/0   0.0
Jabari Paul            30    4    0    1   0   2/3    66.7     0/0   0.0
LeBron Barnes          30    2    4    1   0   1/5    20.0     0/0   0.0
Cole Gasol             30    2    0    3   0   1/3    33.3     0/0   0.0
John Hyland            30    0    0    0   0   0/4     0.0     0/0   0.0

TEAM: FG: 7/19 (36.8%), 3PT: 2/11 (18.2%), REB: 9 (1 off, 8 def), AST: 6, TO: 1
TEAM FOULS: 8 [Team_093 in BONUS]


Team_093
--------------------------------------------------------------------------------
Player                MIN  PTS  REB  AST  TO      FG   FG%      3P   3P%
--------------------------------------------------------------------------------
Trae Westbrook         30    8    0    0   0   3/5    60.0     0/0   0.0
Damian Williamson      30    5    0    1   0   2/5    40.0     0/0   0.0
Carmelo Wagner         30    5    6    3   0   2/3    66.7     0/0   0.0
Ben Cunningham         30    4    3    2   0   2/2   100.0     0/0   0.0
Vince Barnes           30    0    6    0   0   0/4     0.0     0/0   0.0

TEAM: FG: 9/19 (47.4%), 3PT: 3/9 (33.3%), REB: 17 (5 off, 12 def), AST: 6, TO: 1
TEAM FOULS: 4

================================================================================

================================================================================
                       4TH QUARTER - Team_070 vs Team_093                       
================================================================================

[12:00] Team_070 possession (Score: 75-79)
LeBron Barnes attempts a 3Pt. Wide open! Trae Westbrook is 6.1 feet away. [MAN] LEBRON BARNES MAKES IT! Assist: Jabari Paul
Score: 78-79

[11:46] Team_093 possession (Score: 78-79)
Vince Barnes attempts a Midrange. Contested by Khris Bryant (3.0 feet, ZONE). VINCE BARNES MAKES IT! Assist: Damian Williamson
Score: 78-81

[11:30] Team_070 possession (Score: 78-81)
Khris Bryant attempts a Midrange. Contested by Ben Cunningham (5.2 feet, ZONE). KHRIS BRYANT MAKES IT! Assist: John Hyland
Score: 80-81

[11:18] Team_093 possession (Score: 80-81)
Ben Cunningham attempts a Midrange. Contested by Khris Bryant (3.3 feet, MAN). Ben Cunningham misses. Rebound secured by Khris Bryant.

[11:01] Team_070 possession (Score: 80-81)
FOUL! Shooting foul on Damian Williamson. Cole Gasol to the line for 2 free throws. [Team fouls: 1] (Damian Williamson: 1 personal fouls)   FT 1/2: GOOD   FT 2/2: GOOD Cole Gasol makes 2/2 from the line.
Score: 82-81

[10:45] Team_093 possession (Score: 82-81)
Ben Cunningham attempts a Layup. Contested by Khris Bryant (3.4 feet, ZONE). BEN CUNNINGHAM MAKES IT!
Score: 82-83

[10:27] Team_070 possession (Score: 82-83)
John Hyland attempts a 3Pt. Contested by Carmelo Wagner (3.9 feet, ZONE). John Hyland misses. Rebound secured by Ben Cunningham.

[10:09] Team_093 possession (Score: 82-83)
FOUL! Reach-in foul on Cole Gasol during the drive. [Team fouls: 1] No free throws, side out. (Cole Gasol: 1 personal fouls)

[09:53] Team_093 possession (Score: 82-83)
Trae Westbrook attempts a 3Pt. Contested by LeBron Barnes (3.9 feet, MAN). Trae Westbrook misses. Rebound secured by Khris Bryant.

[09:40] Team_070 possession (Score: 82-83)
Khris Bryant makes the Dunk and draws the foul on Ben Cunningham! And-1! Khris Bryant to the line for 1. [Team fouls: 2] (Ben Cunningham: 1 personal fouls)   FT 1/1: GOOD Khris Bryant makes 1/1 from the line.
Score: 85-83

[09:25] Team_093 possession (Score: 85-83)
Trae Westbrook drives to the basket... Trae Westbrook throws a bad pass! Stolen by Khris Bryant! TURNOVER! (live ball)

[09:11] Team_070 possession (Score: 85-83)
John Hyland drives to the basket... FOUL! Offensive foul on John Hyland! Carmelo Wagner drew the charge! [Team fouls: 2] (John Hyland: 1 personal fouls) TURNOVER! (dead ball)

[08:55] Team_093 possession (Score: 85-83)
FOUL! Reach-in foul on Khris Bryant during the drive. [Team fouls: 3] No free throws, side out. (Khris Bryant: 1 personal fouls)

[08:43] Team_093 possession (Score: 85-83)
Trae Westbrook throws a bad pass out of bounds! TURNOVER! (dead ball)

[08:43] Substitution (Team_070): Cole Gasol OUT → Paul Quickley IN (stamina_rule2)

[08:43] Substitution (Team_070): LeBron Barnes OUT → Allen Quickley IN (stamina_rule2)

[08:43] Substitution (Team_070): John Hyland OUT → D'Angelo McGrady IN (stamina_rule2)

[08:43] Substitution (Team_070): Khris Bryant OUT → Luka Gobert IN (stamina_rule2)

[08:43] Substitution (Team_070): Jabari Paul OUT → Russell Morant IN (stamina_rule2)

[08:43] Substitution (Team_093): Damian Williamson OUT → Shaquille George IN (stamina_rule2)

[08:43] Substitution (Team_093): Trae Westbrook OUT → Immanuel Cunningham IN (stamina_rule2)

[08:43] Substitution (Team_093): Carmelo Wagner OUT → Lauri Parker IN (stamina_rule2)

[08:43] Substitution (Team_093): Vince Barnes OUT → Kobe Murray IN (stamina_rule2)

[08:43] Substitution (Team_093): Ben Cunningham OUT → Cade O'Neal IN (stamina_rule2)

[08:30] Team_070 possession (Score: 85-83)
Paul Quickley attempts a Layup. Contested by Kobe Murray (4.0 feet, ZONE). Paul Quickley misses. Rebound secured by Lauri Parker.

[08:19] Team_093 possession (Score: 85-83)
Shaquille George drives and kicks out. Cade O'Neal attempts a Midrange. Contested by Russell Morant (3.7 feet, MAN). Cade O'Neal misses. FOUL! Loose ball foul on Luka Gobert during the rebound battle. [Team fouls: 4] No free throws, side out. (Luka Gobert: 1 personal fouls)

[08:05] Team_093 possession (Score: 85-83)
Lauri Parker attempts a Layup. BLOCKED BY PAUL QUICKLEY! Ball is loose! Offensive rebound by Kobe Murray! Kobe Murray kicks it out.

[07:47] Team_093 possession (Score: 85-83)
Cade O'Neal drives, Russell Morant stays with him. Cade O'Neal attempts a Dunk. Contested by Russell Morant (3.8 feet, ZONE). Cade O'Neal misses. Rebound secured by Luka Gobert.

[07:32] Team_070 possession (Score: 85-83)
FOUL! Shooting foul on Kobe Murray. Russell Morant to the line for 2 free throws. [Team fouls: 3] (Kobe Murray: 1 personal fouls)   FT 1/2: GOOD   FT 2/2: GOOD Russell Morant makes 2/2 from the line.
Score: 87-83

[07:13] Team_093 possession (Score: 87-83)
Kobe Murray attempts a 3Pt. Contested by Luka Gobert (4.8 feet, MAN). Kobe Murray misses. FOUL! Loose ball foul on Luka Gobert during the rebound battle. [IN THE BONUS! 5 team fouls] Cade O'Neal to the line for 2 free throws. (Luka Gobert: 2 personal fouls)   FT 1/2: GOOD   FT 2/2: GOOD Cade O'Neal makes 2/2 from the line.
Score: 87-85

[06:59] Team_070 possession (Score: 87-85)
Luka Gobert drives and kicks out. Russell Morant attempts a 3Pt. Contested by Kobe Murray (4.1 feet, MAN). Russell Morant misses. Rebound secured by Kobe Murray.

[06:45] Team_093 possession (Score: 87-85)
Cade O'Neal drives to the basket... Cade O'Neal throws a bad pass! Stolen by Russell Morant! TURNOVER! (live ball)

[06:29] Team_070 possession (Score: 87-85)
D'Angelo McGrady attempts a Layup. Contested by Cade O'Neal (5.3 feet, ZONE). D'ANGELO MCGRADY MAKES IT! Assist: Allen Quickley
Score: 89-85

[06:15] Team_093 possession (Score: 89-85)
Lauri Parker attempts a Midrange. Contested by D'Angelo McGrady (5.7 feet, MAN). Lauri Parker misses. Rebound secured by Luka Gobert.

[05:59] Team_070 possession (Score: 89-85)
Luka Gobert drives, picks up Kobe Murray. Help arrives from Shaquille George! Luka Gobert attempts a Layup. Contested by Shaquille George (4.1 feet, ZONE). Luka Gobert misses. Offensive rebound by Russell Morant! Russell Morant puts it back in!
Score: 91-85

[05:46] Team_093 possession (Score: 91-85)
Shaquille George attempts a Midrange. Contested by Paul Quickley (4.6 feet, MAN). SHAQUILLE GEORGE MAKES IT! Assist: Kobe Murray
Score: 91-87

[05:26] Team_070 possession (Score: 91-87)
Russell Morant drives and kicks out. Luka Gobert attempts a Midrange. Contested by Immanuel Cunningham (5.6 feet, ZONE). Luka Gobert misses. Rebound secured by Kobe Murray.

[05:14] Team_093 possession (Score: 91-87)
Shaquille George attempts a 3Pt. Contested by Paul Quickley (4.6 feet, ZONE). Shaquille George misses. FOUL! Loose ball foul on D'Angelo McGrady during the rebound battle. [IN THE BONUS! 6 team fouls] Cade O'Neal to the line for 2 free throws. (D'Angelo McGrady: 1 personal fouls)   FT 1/2: GOOD   FT 2/2: GOOD Cade O'Neal makes 2/2 from the line.
Score: 91-89

[04:58] Team_070 possession (Score: 91-89)
FOUL! Shooting foul on Shaquille George. Paul Quickley to the line for 3 free throws. [Team fouls: 4] (Shaquille George: 1 personal fouls)   FT 1/3: MISS   FT 2/3: GOOD   FT 3/3: GOOD Paul Quickley makes 2/3 from the line.
Score: 93-89

[04:47] Team_093 possession (Score: 93-89)
Kobe Murray drives, Luka Gobert stays with him. Kobe Murray attempts a Layup. Contested by Luka Gobert (4.8 feet, MAN). KOBE MURRAY MAKES IT! Assist: Cade O'Neal
Score: 93-91

[04:35] Team_070 possession (Score: 93-91)
Paul Quickley attempts a 3Pt. Contested by Shaquille George (4.2 feet, ZONE). Paul Quickley misses. Rebound secured by Cade O'Neal.

[04:22] Team_093 possession (Score: 93-91)
Shaquille George drives and kicks out. Lauri Parker attempts a 3Pt. Contested by Paul Quickley (4.3 feet, ZONE). Lauri Parker misses. Offensive rebound by Cade O'Neal! Cade O'Neal kicks it out.

[04:08] Team_093 possession (Score: 93-91)
Immanuel Cunningham attempts a 3Pt. Contested by Allen Quickley (5.4 feet, MAN). Immanuel Cunningham misses. Rebound secured by Luka Gobert.

[03:55] Team_070 possession (Score: 93-91)
FOUL! Holding foul on Lauri Parker. [IN THE BONUS! 5 team fouls] D'Angelo McGrady to the line for 2 free throws. (Lauri Parker: 1 personal fouls)   FT 1/2: GOOD   FT 2/2: GOOD D'Angelo McGrady makes 2/2 from the line.
Score: 95-91

[03:41] Team_093 possession (Score: 95-91)
Lauri Parker drives, picks up Russell Morant. Help arrives from Paul Quickley! Lauri Parker attempts a Layup. Contested by Paul Quickley (3.8 feet, ZONE). LAURI PARKER MAKES IT! Assist: Shaquille George
Score: 95-93

[03:26] Team_070 possession (Score: 95-93)
Allen Quickley attempts a 3Pt. Contested by Shaquille George (4.4 feet, ZONE). Allen Quickley misses. Offensive rebound by Luka Gobert! Luka Gobert kicks it out.

[03:11] Team_070 possession (Score: 95-93)
Russell Morant makes the Dunk and draws the foul on Kobe Murray! And-1! Russell Morant to the line for 1. [BONUS: 6 team fouls] (Kobe Murray: 2 personal fouls)   FT 1/1: GOOD Russell Morant makes 1/1 from the line.
Score: 98-93

[02:59] Team_093 possession (Score: 98-93)
Lauri Parker attempts a 3Pt. Contested by Paul Quickley (4.4 feet, ZONE). Lauri Parker misses. Rebound secured by D'Angelo McGrady.

[02:40] Team_070 possession (Score: 98-93)
Allen Quickley attempts a Midrange. Contested by Immanuel Cunningham (5.7 feet, MAN). Allen Quickley misses. Rebound secured by Lauri Parker.

[02:24] Team_093 possession (Score: 98-93)
Cade O'Neal attempts a Layup. Contested by Russell Morant (3.8 feet, MAN). CADE O'NEAL MAKES IT! Assist: Shaquille George
Score: 98-95

[02:09] Team_070 possession (Score: 98-95)
Luka Gobert attempts a Midrange. Contested by Lauri Parker (4.7 feet, ZONE). Luka Gobert misses. Rebound secured by Lauri Parker.

[01:56] Team_093 possession (Score: 98-95)
Shaquille George drives to the basket... FOUL! Offensive foul on Shaquille George! Paul Quickley drew the charge! [Team fouls: 7] (Shaquille George: 2 personal fouls) TURNOVER! (dead ball)

[01:39] Team_070 possession (Score: 98-95)
Allen Quickley drives to the basket... Allen Quickley commits a violation (traveling/carry)! TURNOVER! (dead ball)

[01:24] Team_093 possession (Score: 98-95)
Shaquille George attempts a 3Pt. Contested by Paul Quickley (4.7 feet, ZONE). Shaquille George misses. FOUL! Loose ball foul on Luka Gobert during the rebound battle. [IN THE BONUS! 7 team fouls] Cade O'Neal to the line for 2 free throws. (Luka Gobert: 3 personal fouls)   FT 1/2: GOOD   FT 2/2: GOOD Cade O'Neal makes 2/2 from the line.
Score: 98-97

[01:12] Team_070 possession (Score: 98-97)
Russell Morant drives, Kobe Murray stays with him. Russell Morant attempts a Layup. Contested by Kobe Murray (4.3 feet, ZONE). RUSSELL MORANT MAKES IT! Assist: D'Angelo McGrady
Score: 100-97

[00:59] Team_093 possession (Score: 100-97)
Lauri Parker makes the Dunk and draws the foul on Russell Morant! And-1! Lauri Parker to the line for 1. [BONUS: 8 team fouls] (Russell Morant: 1 personal fouls)   FT 1/1: GOOD Lauri Parker makes 1/1 from the line.
Score: 100-100

[00:41] Team_070 possession (Score: 100-100)
Paul Quickley attempts a 3Pt. Contested by Shaquille George (4.3 feet, ZONE). PAUL QUICKLEY MAKES IT! Assist: D'Angelo McGrady
Score: 103-100

[00:22] Team_093 possession (Score: 103-100)
FOUL! Holding foul on Paul Quickley. [IN THE BONUS! 9 team fouls] Shaquille George to the line for 2 free throws. (Paul Quickley: 1 personal fouls)   FT 1/2: GOOD   FT 2/2: MISS Shaquille George makes 1/2 from the line. Offensive rebound by Cade O'Neal! Cade O'Neal kicks it out.
Score: 103-101

[00:09] Team_093 possession (Score: 103-101)
Cade O'Neal attempts a Midrange. Contested by D'Angelo McGrady (5.8 feet, ZONE). Cade O'Neal misses. Rebound secured by D'Angelo McGrady.

================================================================================
                              4TH QUARTER COMPLETE                              
================================================================================

4TH QUARTER SCORE: Team_070 28, Team_093 22

BOX SCORE:
================================================================================

Team_070
--------------------------------------------------------------------------------
Player                MIN  PTS  REB  AST  TO      FG   FG%      3P   3P%
--------------------------------------------------------------------------------
Russell Morant         15    9    1    0   0   4/5    80.0     0/0   0.0
Khris Bryant           34    5    2    0   0   2/2   100.0     0/0   0.0
Paul Quickley          15    5    0    0   0   2/4    50.0     0/0   0.0
D'Angelo McGrady       15    4    2    2   0   2/2   100.0     0/0   0.0
LeBron Barnes          34    3    0    0   0   1/1   100.0     0/0   0.0
Cole Gasol             34    2    0    0   0   1/1   100.0     0/0   0.0
Jabari Paul            34    0    0    1   0   0/0     0.0     0/0   0.0
John Hyland            34    0    0    1   0   0/1     0.0     0/0   0.0
Luka Gobert            15    0    4    0   0   0/2     0.0     0/0   0.0
Allen Quickley         15    0    0    1   0   0/1     0.0     0/0   0.0

TEAM: FG: 12/19 (63.2%), 3PT: 3/5 (60.0%), REB: 9 (2 off, 7 def), AST: 5, TO: 2
TEAM FOULS: 9 [Team_093 in BONUS]


Team_093
--------------------------------------------------------------------------------
Player                MIN  PTS  REB  AST  TO      FG   FG%      3P   3P%
--------------------------------------------------------------------------------
Cade O'Neal            15    8    3    1   0   4/6    66.7     0/0   0.0
Lauri Parker           15    5    3    0   0   2/4    50.0     0/0   0.0
Vince Barnes           34    2    0    0   0   1/1   100.0     0/0   0.0
Ben Cunningham         34    2    1    0   0   1/2    50.0     0/0   0.0
Kobe Murray            15    2    4    1   0   1/1   100.0     0/0   0.0
Shaquille George       15    2    0    2   0   1/1   100.0     0/0   0.0
Damian Williamson      34    0    0    1   0   0/0     0.0     0/0   0.0
Trae Westbrook         34    0    0    0   0   0/1     0.0     0/0   0.0
Immanuel Cunningham    15    0    0    0   0   0/1     0.0     0/0   0.0

TEAM: FG: 10/17 (58.8%), 3PT: 3/6 (50.0%), REB: 11 (4 off, 7 def), AST: 5, TO: 4
TEAM FOULS: 7 [Team_070 in BONUS]

================================================================================

================================================================================
                               FULL GAME COMPLETE                               
================================================================================

FINAL SCORE: Team_070 103, Team_093 101

SCORING BY QUARTER:
--------------------------------------------------------------------------------
Team                     Q1     Q2     Q3     Q4    FINAL
--------------------------------------------------------------------------------
Team_070                 38     22     15     28      103
Team_093                 24     30     25     22      101
--------------------------------------------------------------------------------

FULL GAME BOX SCORE:
================================================================================

Team_070
--------------------------------------------------------------------------------
Player                MIN  PTS  REB  AST  TO      FG   FG%      3P   3P%      FT STL BLK
--------------------------------------------------------------------------------
Cole Gasol             34   14    0    5   0   6/11   54.5   2/4    50.0   2/2     0   2
LeBron Barnes          34    8    7    3   1   3/10   30.0   1/7    14.3   1/1     1   0
John Hyland            34    8    0    5   1   3/9    33.3   0/5     0.0   2/2     0   0
Khris Bryant           34   28   17    2   1  12/15   80.0   3/6    50.0   3/4     2   2
Jabari Paul            34   17    3    3   1   8/10   80.0   1/2    50.0   2/2     0   0
Paul Quickley          15    5    0    0   0   2/4    50.0   2/3    66.7   2/3     0   1
Allen Quickley         15    6    0    1   2   3/6    50.0   2/4    50.0   0/2     0   0
D'Angelo McGrady       15    4    2    3   0   1/2    50.0   0/1     0.0   2/2     0   0
Luka Gobert            15    0    7    1   1   2/7    28.6   0/1     0.0   0/0     0   0
Russell Morant         15   13    6    0   0   3/5    60.0   0/0     0.0   3/3     1   0

TEAM: FG: 44/80 (55.0%), 3PT: 11/33 (33.3%), REB: 39 (7 off, 32 def), AST: 23, TO: 7


Team_093
--------------------------------------------------------------------------------
Player                MIN  PTS  REB  AST  TO      FG   FG%      3P   3P%      FT STL BLK
--------------------------------------------------------------------------------
Damian Williamson      34   11    0    2   0   3/11   27.3   2/7    28.6   3/5     0   0
Trae Westbrook         34   16    0    1   3   6/12   50.0   3/7    42.9   0/0     1   0
Carmelo Wagner         34   23   13    4   2   8/10   80.0   2/4    50.0   7/10    0   0
Vince Barnes           34    6   11    3   0   3/9    33.3   0/2     0.0   0/1     0   0
Ben Cunningham         34   11    7    4   0   7/9    77.8   0/0     0.0   2/4     0   0
Shaquille George       15    4    0    3   1   4/5    80.0   2/3    66.7   1/2     0   0
Immanuel Cunningham    15    2    0    1   0   1/3    33.3   0/2     0.0   0/0     0   0
Lauri Parker           15   10    4    1   0   4/8    50.0   1/3    33.3   1/1     0   0
Kobe Murray            15    2    7    1   1   2/3    66.7   1/2    50.0   0/0     0   0
Cade O'Neal            15   12    6    1   0   3/6    50.0   0/1     0.0   6/6     0   0

TEAM: FG: 43/78 (55.1%), 3PT: 11/31 (35.5%), REB: 50 (14 off, 36 def), AST: 21, TO: 7

================================================================================
