================================================================================
                        FULL GAME - Team_021 vs Team_091                        
================================================================================

================================================================================
                       1ST QUARTER - Team_021 vs Team_091                       
================================================================================

[12:00] Team_021 possession (Score: 0-0)
FOUL! Holding foul on Kyrie Rozier. [Team fouls: 1] No free throws, side out. (Kyrie Rozier: 1 personal fouls)

[11:45] Team_021 possession (Score: 0-0)
Kyrie Wagner loses control! Ball rolls out of bounds! TURNOVER! (dead ball)

[11:31] Team_091 possession (Score: 0-0)
D'Angelo Ingram drives to the basket... FOUL! Offensive foul on D'Angelo Ingram! Kyrie Wagner drew the charge! [Team fouls: 2] (D'Angelo Ingram: 1 personal fouls) TURNOVER! (dead ball)

[11:18] Team_021 possession (Score: 0-0)
Karl Bridges attempts a 3Pt. Contested by Kyrie Rozier (4.0 feet, ZONE). Karl Bridges misses. Rebound secured by Kevin Simons.

[11:08] Team_091 possession (Score: 0-0)
Rudy Bridges drives and kicks out. Rudy Bridges attempts a 3Pt. Contested by Kyrie Wagner (4.0 feet, ZONE). Rudy Bridges misses. FOUL! Loose ball foul on Zach Carter during the rebound battle. [Team fouls: 1] No free throws, side out. (Zach Carter: 1 personal fouls)

[10:49] Team_091 possession (Score: 0-0)
Kevin Simons drives, Zach Carter stays with him. Kevin Simons attempts a Layup. Contested by Zach Carter (4.4 feet, ZONE). Kevin Simons misses. Rebound secured by Kyrie Leonard.

[10:33] Team_021 possession (Score: 0-0)
Anthony Oladipo attempts a 3Pt. Contested by Isaiah Siakam (5.6 feet, MAN). Anthony Oladipo misses. Rebound secured by Kevin Simons.

[10:15] Team_091 possession (Score: 0-0)
Rudy Bridges attempts a 3Pt. Contested by Karl Bridges (5.6 feet, MAN). Rudy Bridges misses. FOUL! Loose ball foul on Anthony Oladipo during the rebound battle. [Team fouls: 2] No free throws, side out. (Anthony Oladipo: 1 personal fouls)

[10:02] Team_091 possession (Score: 0-0)
Rudy Bridges attempts a 3Pt. Contested by Kyrie Wagner (4.1 feet, ZONE). Rudy Bridges misses. Rebound secured by Anthony Oladipo.

[09:48] Team_021 possession (Score: 0-0)
Zach Carter drives, picks up Kevin Simons. Help arrives from Kyrie Rozier! Zach Carter attempts a Dunk. Contested by Kyrie Rozier (4.0 feet, MAN). Zach Carter misses. Offensive rebound by Kyrie Leonard! Kyrie Leonard kicks it out.

[09:36] Team_021 possession (Score: 0-0)
Kyrie Leonard attempts a Midrange. Contested by Rudy Bridges (4.2 feet, ZONE). Kyrie Leonard misses. FOUL! Loose ball foul on Rudy Bridges during the rebound battle. [Team fouls: 3] No free throws, side out. (Rudy Bridges: 1 personal fouls)

[09:25] Team_021 possession (Score: 0-0)
Karl Bridges attempts a Midrange. Contested by Rudy Bridges (4.2 feet, MAN). KARL BRIDGES MAKES IT!
Score: 2-0

[09:08] Team_091 possession (Score: 2-0)
FOUL! Reach-in foul on Zach Carter during the drive. [Team fouls: 3] No free throws, side out. (Zach Carter: 2 personal fouls)

[08:55] Team_091 possession (Score: 2-0)
Kevin Simons makes the Layup and draws the foul on Zach Carter! And-1! Kevin Simons to the line for 1. [Team fouls: 4] (Zach Carter: 3 personal fouls)   FT 1/1: GOOD Kevin Simons makes 1/1 from the line.
Score: 2-3

[08:42] Team_021 possession (Score: 2-3)
Zach Carter drives, Kevin Simons stays with him. Zach Carter attempts a Layup. Contested by Kevin Simons (4.0 feet, MAN). Zach Carter misses. Rebound secured by Rudy Bridges.

[08:29] Team_091 possession (Score: 2-3)
Isaiah Siakam attempts a 3Pt. Contested by Kyrie Wagner (4.3 feet, ZONE). Isaiah Siakam misses. Rebound secured by Kyrie Leonard.

[08:16] Team_021 possession (Score: 2-3)
Kyrie Leonard attempts a 3Pt. Contested by Kyrie Rozier (3.9 feet, ZONE). KYRIE LEONARD MAKES IT! Assist: Anthony Oladipo
Score: 5-3

[08:02] Team_091 possession (Score: 5-3)
Isaiah Siakam drives, picks up Anthony Oladipo. Help arrives from Kyrie Leonard! Isaiah Siakam attempts a Dunk. Contested by Kyrie Leonard (4.9 feet, MAN). Isaiah Siakam misses. Rebound secured by Anthony Oladipo.

[07:47] Team_021 possession (Score: 5-3)
Zach Carter makes the Layup and draws the foul on Kevin Simons! And-1! Zach Carter to the line for 1. [Team fouls: 4] (Kevin Simons: 1 personal fouls)   FT 1/1: GOOD Zach Carter makes 1/1 from the line.
Score: 8-3

[07:33] Team_091 possession (Score: 8-3)
Kevin Simons drives and kicks out. Kyrie Rozier attempts a Midrange. Contested by Anthony Oladipo (4.6 feet, ZONE). KYRIE ROZIER MAKES IT!
Score: 8-5

[07:19] Team_021 possession (Score: 8-5)
Karl Bridges attempts a 3Pt. Contested by Rudy Bridges (4.2 feet, MAN). Karl Bridges misses. Rebound secured by Kyrie Rozier.

[07:08] Team_091 possession (Score: 8-5)
Isaiah Siakam attempts a 3Pt. Contested by Kyrie Wagner (4.3 feet, ZONE). Isaiah Siakam misses. Rebound secured by Zach Carter.

[06:54] Team_021 possession (Score: 8-5)
Kyrie Wagner attempts a Layup. Contested by D'Angelo Ingram (4.7 feet, MAN). Kyrie Wagner misses. Rebound secured by Kyrie Rozier.

[06:40] Team_091 possession (Score: 8-5)
Kyrie Rozier drives and kicks out. FOUL! Shooting foul on Zach Carter. Kevin Simons to the line for 3 free throws. [BONUS: 5 team fouls] (Zach Carter: 4 personal fouls)   FT 1/3: GOOD   FT 2/3: GOOD   FT 3/3: GOOD Kevin Simons makes 3/3 from the line.
Score: 8-8

[06:25] Team_021 possession (Score: 8-8)
FOUL! Shooting foul on Rudy Bridges. Anthony Oladipo to the line for 2 free throws. [BONUS: 5 team fouls] (Rudy Bridges: 2 personal fouls)   FT 1/2: GOOD   FT 2/2: GOOD Anthony Oladipo makes 2/2 from the line.
Score: 10-8

[06:08] Team_091 possession (Score: 10-8)
Kyrie Rozier attempts a 3Pt. Contested by Kyrie Wagner (4.1 feet, ZONE). Kyrie Rozier misses. Rebound secured by Anthony Oladipo.

[05:58] Team_021 possession (Score: 10-8)
Kyrie Wagner attempts a 3Pt. Contested by Kyrie Rozier (4.1 feet, ZONE). Kyrie Wagner misses. Rebound secured by Rudy Bridges.

[05:47] Team_091 possession (Score: 10-8)
Rudy Bridges attempts a 3Pt. Contested by Kyrie Leonard (4.6 feet, ZONE). RUDY BRIDGES MAKES IT! Assist: Kyrie Rozier
Score: 10-11

[05:35] Team_021 possession (Score: 10-11)
Karl Bridges attempts a Midrange. Contested by Rudy Bridges (4.2 feet, MAN). Karl Bridges misses. Rebound secured by Kevin Simons.

[05:23] Team_091 possession (Score: 10-11)
Rudy Bridges attempts a 3Pt. Contested by Kyrie Leonard (4.7 feet, ZONE). Rudy Bridges misses. Rebound secured by Anthony Oladipo.

[05:06] Team_021 possession (Score: 10-11)
Karl Bridges attempts a Midrange. Contested by Isaiah Siakam (5.6 feet, ZONE). Karl Bridges misses. Rebound secured by Kevin Simons.

[04:52] Team_091 possession (Score: 10-11)
Kyrie Rozier attempts a 3Pt. Contested by Kyrie Wagner (4.2 feet, ZONE). Kyrie Rozier misses. Rebound secured by Zach Carter.

[04:41] Team_021 possession (Score: 10-11)
Zach Carter attempts a Midrange. Contested by Kevin Simons (4.1 feet, MAN). ZACH CARTER MAKES IT!
Score: 12-11

[04:26] Team_091 possession (Score: 12-11)
Rudy Bridges makes the Dunk and draws the foul on Kyrie Leonard! And-1! Rudy Bridges to the line for 1. [BONUS: 6 team fouls] (Kyrie Leonard: 1 personal fouls)   FT 1/1: GOOD Rudy Bridges makes 1/1 from the line.
Score: 12-14

[04:09] Team_021 possession (Score: 12-14)
Anthony Oladipo attempts a 3Pt. Contested by Kyrie Rozier (4.1 feet, ZONE). Anthony Oladipo misses. Rebound secured by Kyrie Rozier.

[03:57] Team_091 possession (Score: 12-14)
Isaiah Siakam attempts a 3Pt. Contested by Anthony Oladipo (5.0 feet, MAN). Isaiah Siakam misses. Offensive rebound by Rudy Bridges! Rudy Bridges kicks it out.

[03:42] Team_091 possession (Score: 12-14)
Kyrie Rozier attempts a 3Pt. Contested by Kyrie Leonard (4.8 feet, MAN). Kyrie Rozier misses. Rebound secured by Kyrie Leonard.

[03:25] Team_021 possession (Score: 12-14)
Anthony Oladipo attempts a 3Pt. Contested by Kyrie Rozier (4.1 feet, ZONE). Anthony Oladipo misses. Offensive rebound by Zach Carter! Zach Carter kicks it out.

[03:12] Team_021 possession (Score: 12-14)
Zach Carter attempts a 3Pt. Contested by Kevin Simons (4.2 feet, MAN). Zach Carter misses. Rebound secured by Kevin Simons.

[02:55] Team_091 possession (Score: 12-14)
Rudy Bridges attempts a Layup. Contested by Zach Carter (4.3 feet, ZONE). Rudy Bridges misses. Offensive rebound by Rudy Bridges! Rudy Bridges kicks it out.

[02:45] Team_091 possession (Score: 12-14)
D'Angelo Ingram drives, Kyrie Wagner stays with him. D'Angelo Ingram attempts a Dunk. Contested by Kyrie Wagner (5.2 feet, MAN). D'ANGELO INGRAM MAKES IT!
Score: 12-16

[02:30] Team_021 possession (Score: 12-16)
Anthony Oladipo attempts a Midrange. Contested by Rudy Bridges (4.5 feet, ZONE). Anthony Oladipo misses. Offensive rebound by Zach Carter! Zach Carter kicks it out.

[02:18] Team_021 possession (Score: 12-16)
FOUL! Shooting foul on Kevin Simons. Kyrie Wagner to the line for 2 free throws. [BONUS: 6 team fouls] (Kevin Simons: 2 personal fouls)   FT 1/2: GOOD   FT 2/2: GOOD Kyrie Wagner makes 2/2 from the line.
Score: 14-16

[02:03] Team_091 possession (Score: 14-16)
Isaiah Siakam attempts a 3Pt. Wide open! Karl Bridges is 6.1 feet away. [ZONE] ISAIAH SIAKAM MAKES IT! Assist: Kyrie Rozier
Score: 14-19

[01:51] Team_021 possession (Score: 14-19)
Anthony Oladipo attempts a 3Pt. Contested by Kyrie Rozier (4.3 feet, ZONE). ANTHONY OLADIPO MAKES IT! Assist: Kyrie Wagner
Score: 17-19

[01:39] Team_091 possession (Score: 17-19)
Kyrie Rozier drives and kicks out. D'Angelo Ingram attempts a 3Pt. Contested by Kyrie Wagner (4.4 feet, MAN). D'Angelo Ingram misses. Offensive rebound by Kevin Simons! Kevin Simons's putback is no good. Rebound secured by Zach Carter.

[01:26] Team_021 possession (Score: 17-19)
Kyrie Leonard attempts a Layup. Contested by D'Angelo Ingram (4.9 feet, ZONE). KYRIE LEONARD MAKES IT!
Score: 19-19

[01:12] Team_091 possession (Score: 19-19)
Kyrie Rozier makes the 3Pt and draws the foul on Kyrie Leonard! And-1! Kyrie Rozier to the line for 1. [BONUS: 7 team fouls] (Kyrie Leonard: 2 personal fouls)   FT 1/1: GOOD Kyrie Rozier makes 1/1 from the line.
Score: 19-23

[01:01] Team_021 possession (Score: 19-23)
Zach Carter attempts a Midrange. Contested by Kevin Simons (4.5 feet, MAN). ZACH CARTER MAKES IT! Assist: Kyrie Wagner
Score: 21-23

[00:44] Team_091 possession (Score: 21-23)
D'Angelo Ingram attempts a 3Pt. Contested by Kyrie Wagner (5.4 feet, ZONE). D'Angelo Ingram misses. Rebound secured by Zach Carter.

[00:31] Team_021 possession (Score: 21-23)
Zach Carter attempts a 3Pt. Contested by Rudy Bridges (5.1 feet, ZONE). Zach Carter misses. Rebound secured by Kyrie Rozier.

[00:19] Team_091 possession (Score: 21-23)
Isaiah Siakam throws a bad pass! Stolen by Anthony Oladipo! TURNOVER! (live ball)

[00:06] Team_021 possession (Score: 21-23)
Kyrie Leonard attempts a 3Pt. Contested by Kyrie Rozier (4.4 feet, ZONE). Kyrie Leonard misses. Rebound secured by Kevin Simons.

================================================================================
                              1ST QUARTER COMPLETE                              
================================================================================

1ST QUARTER SCORE: Team_021 21, Team_091 23

BOX SCORE:
================================================================================

Team_021
--------------------------------------------------------------------------------
Player                MIN  PTS  REB  AST  TO      FG   FG%      3P   3P%
--------------------------------------------------------------------------------
Zach Carter            12    7    6    0   0   3/6    50.0     0/0   0.0
Kyrie Leonard          12    5    5    0   0   2/3    66.7     0/0   0.0
Anthony Oladipo        12    5    4    1   0   2/4    50.0     0/0   0.0
Karl Bridges           12    2    0    0   0   1/5    20.0     0/0   0.0
Kyrie Wagner           12    2    0    2   0   1/3    33.3     0/0   0.0

TEAM: FG: 9/21 (42.9%), 3PT: 2/10 (20.0%), REB: 14 (4 off, 10 def), AST: 3, TO: 1
TEAM FOULS: 7 [Team_091 in BONUS]


Team_091
--------------------------------------------------------------------------------
Player                MIN  PTS  REB  AST  TO      FG   FG%      3P   3P%
--------------------------------------------------------------------------------
Kevin Simons           12    6    7    0   0   2/3    66.7     0/0   0.0
Rudy Bridges           12    6    5    0   0   2/4    50.0     0/0   0.0
Kyrie Rozier           12    6    4    2   0   2/6    33.3     0/0   0.0
Isaiah Siakam          12    3    0    0   0   1/4    25.0     0/0   0.0
D'Angelo Ingram        12    2    0    0   0   1/2    50.0     0/0   0.0

TEAM: FG: 8/19 (42.1%), 3PT: 3/11 (27.3%), REB: 17 (5 off, 12 def), AST: 2, TO: 2
TEAM FOULS: 6 [Team_021 in BONUS]

================================================================================

================================================================================
                       2ND QUARTER - Team_021 vs Team_091                       
================================================================================

[12:00] Team_021 possession (Score: 21-23)
Zach Carter drives, Kevin Simons stays with him. Zach Carter attempts a Layup. Contested by Kevin Simons (4.4 feet, ZONE). Zach Carter misses. Rebound secured by Rudy Bridges.

[11:43] Team_091 possession (Score: 21-23)
Rudy Bridges attempts a 3Pt. Contested by Karl Bridges (5.9 feet, MAN). Rudy Bridges misses. Rebound secured by Anthony Oladipo.

[11:32] Team_021 possession (Score: 21-23)
Zach Carter attempts a Midrange. Contested by Kevin Simons (4.4 feet, MAN). Zach Carter misses. Rebound secured by Kevin Simons.

[11:17] Team_091 possession (Score: 21-23)
D'Angelo Ingram attempts a Layup. Contested by Kyrie Wagner (5.3 feet, ZONE). D'ANGELO INGRAM MAKES IT!
Score: 21-25

[11:01] Team_021 possession (Score: 21-25)
Anthony Oladipo attempts a 3Pt. Wide open! Isaiah Siakam is 6.0 feet away. [MAN] Anthony Oladipo misses. Rebound secured by Kyrie Rozier.

[10:44] Team_091 possession (Score: 21-25)
FOUL! Shooting foul on Kyrie Wagner. Isaiah Siakam to the line for 3 free throws. [Team fouls: 1] (Kyrie Wagner: 1 personal fouls)   FT 1/3: MISS   FT 2/3: MISS   FT 3/3: GOOD Isaiah Siakam makes 1/3 from the line.
Score: 21-26

[10:28] Team_021 possession (Score: 21-26)
Karl Bridges drives and kicks out. Kyrie Wagner attempts a 3Pt. Contested by D'Angelo Ingram (5.2 feet, ZONE). KYRIE WAGNER MAKES IT! Assist: Karl Bridges
Score: 24-26

[10:13] Team_091 possession (Score: 24-26)
FOUL! Holding foul on Kyrie Leonard. [Team fouls: 2] No free throws, side out. (Kyrie Leonard: 1 personal fouls)

[09:57] Team_091 possession (Score: 24-26)
D'Angelo Ingram drives, Kyrie Wagner stays with him. D'Angelo Ingram attempts a Dunk. Contested by Kyrie Wagner (5.4 feet, MAN). D'ANGELO INGRAM MAKES IT! Assist: Isaiah Siakam
Score: 24-28

[09:43] Team_021 possession (Score: 24-28)
Kyrie Wagner attempts a 3Pt. Contested by Kyrie Rozier (4.6 feet, ZONE). Kyrie Wagner misses. Rebound secured by Kyrie Rozier.

[09:33] Team_091 possession (Score: 24-28)
Isaiah Siakam attempts a 3Pt. Contested by Kyrie Wagner (4.9 feet, ZONE). Isaiah Siakam misses. Rebound secured by Kyrie Leonard.

[09:17] Team_021 possession (Score: 24-28)
FOUL! Reach-in foul on Kyrie Rozier during the drive. [Team fouls: 1] No free throws, side out. (Kyrie Rozier: 1 personal fouls)

[09:02] Team_021 possession (Score: 24-28)
Kyrie Wagner attempts a Midrange. Contested by Rudy Bridges (4.9 feet, ZONE). Kyrie Wagner misses. Rebound secured by Rudy Bridges.

[08:52] Team_091 possession (Score: 24-28)
Kevin Simons drives and kicks out. Kyrie Rozier attempts a 3Pt. Contested by Kyrie Leonard (5.3 feet, MAN). Kyrie Rozier misses. Offensive rebound by Kevin Simons! Kevin Simons kicks it out.

[08:37] Team_091 possession (Score: 24-28)
FOUL! Offensive foul on Isaiah Siakam! Anthony Oladipo drew the charge! [Team fouls: 2] (Isaiah Siakam: 1 personal fouls) TURNOVER! (dead ball)

[08:24] Team_021 possession (Score: 24-28)
Kyrie Wagner attempts a Midrange. Contested by D'Angelo Ingram (5.4 feet, MAN). Kyrie Wagner misses. Rebound secured by Kyrie Rozier.

[08:14] Team_091 possession (Score: 24-28)
Isaiah Siakam drives and kicks out. Kevin Simons attempts a 3Pt. Contested by Zach Carter (4.9 feet, MAN). Kevin Simons misses. FOUL! Loose ball foul on Anthony Oladipo during the rebound battle. [Team fouls: 3] No free throws, side out. (Anthony Oladipo: 1 personal fouls)

[07:57] Team_091 possession (Score: 24-28)
FOUL! Shooting foul on Kyrie Leonard. D'Angelo Ingram to the line for 2 free throws. [Team fouls: 4] (Kyrie Leonard: 2 personal fouls)   FT 1/2: GOOD   FT 2/2: MISS D'Angelo Ingram makes 1/2 from the line. Rebound secured by Anthony Oladipo.
Score: 24-29

[07:40] Team_021 possession (Score: 24-29)
FOUL! Reach-in foul on Kevin Simons during the drive. [Team fouls: 3] No free throws, side out. (Kevin Simons: 1 personal fouls)

[07:22] Team_021 possession (Score: 24-29)
Anthony Oladipo attempts a 3Pt. Contested by Kyrie Rozier (4.8 feet, ZONE). Anthony Oladipo misses. Rebound secured by Kevin Simons.

[07:03] Team_091 possession (Score: 24-29)
D'Angelo Ingram loses the ball! Stripped by Kyrie Wagner! TURNOVER! (live ball)

[06:49] Team_021 possession (Score: 24-29)
Karl Bridges makes the Layup and draws the foul on Rudy Bridges! And-1! Karl Bridges to the line for 1. [Team fouls: 4] (Rudy Bridges: 1 personal fouls)   FT 1/1: GOOD Karl Bridges makes 1/1 from the line.
Score: 27-29

[06:35] Team_091 possession (Score: 27-29)
Kevin Simons loses the ball! Stripped by Zach Carter! TURNOVER! (live ball)

[06:22] Team_021 possession (Score: 27-29)
Karl Bridges attempts a 3Pt. Contested by Kyrie Rozier (4.9 feet, ZONE). KARL BRIDGES MAKES IT! Assist: Zach Carter
Score: 30-29

[06:09] Team_091 possession (Score: 30-29)
Isaiah Siakam attempts a Midrange. Wide open! Karl Bridges is 6.6 feet away. [ZONE] Isaiah Siakam misses. Rebound secured by Kyrie Leonard.

[05:55] Team_021 possession (Score: 30-29)
Zach Carter attempts a Layup. BLOCKED BY KEVIN SIMONS! Ball deflects out of bounds off Zach Carter.

[05:41] Team_091 possession (Score: 30-29)
Kevin Simons drives and kicks out. Rudy Bridges attempts a 3Pt. Contested by Kyrie Wagner (5.4 feet, ZONE). Rudy Bridges misses. Rebound secured by Zach Carter.

[05:26] Team_021 possession (Score: 30-29)
Kyrie Leonard attempts a Midrange. Contested by Kyrie Rozier (5.0 feet, MAN). Kyrie Leonard misses. Rebound secured by Kevin Simons.

[05:15] Team_091 possession (Score: 30-29)
Kyrie Rozier attempts a 3Pt. Contested by Kyrie Leonard (5.8 feet, MAN). Kyrie Rozier misses. Rebound secured by Kyrie Leonard.

[04:59] Team_021 possession (Score: 30-29)
FOUL! Holding foul on Rudy Bridges. [IN THE BONUS! 5 team fouls] Karl Bridges to the line for 2 free throws. (Rudy Bridges: 2 personal fouls)   FT 1/2: GOOD   FT 2/2: GOOD Karl Bridges makes 2/2 from the line.
Score: 32-29

[04:49] Team_091 possession (Score: 32-29)
Kevin Simons makes the Dunk and draws the foul on Kyrie Leonard! And-1! Kevin Simons to the line for 1. [BONUS: 5 team fouls] (Kyrie Leonard: 3 personal fouls)   FT 1/1: GOOD Kevin Simons makes 1/1 from the line.
Score: 32-32

[04:32] Team_021 possession (Score: 32-32)
Kyrie Wagner attempts a 3Pt. Contested by Kyrie Rozier (5.2 feet, ZONE). Kyrie Wagner misses. Rebound secured by Rudy Bridges.

[04:16] Team_091 possession (Score: 32-32)
Rudy Bridges attempts a Layup. Wide open! Karl Bridges is 6.7 feet away. [MAN] RUDY BRIDGES MAKES IT! Assist: D'Angelo Ingram
Score: 32-34

[04:04] Team_021 possession (Score: 32-34)
Kyrie Leonard attempts a Midrange. Contested by Kyrie Rozier (5.2 feet, ZONE). KYRIE LEONARD MAKES IT! Assist: Zach Carter
Score: 34-34

[03:45] Team_091 possession (Score: 34-34)
FOUL! Holding foul on Kyrie Leonard. [IN THE BONUS! 6 team fouls] Kyrie Rozier to the line for 2 free throws. (Kyrie Leonard: 4 personal fouls)   FT 1/2: GOOD   FT 2/2: GOOD Kyrie Rozier makes 2/2 from the line.
Score: 34-36

[03:33] Team_021 possession (Score: 34-36)
Kyrie Wagner attempts a Midrange. Wide open! D'Angelo Ingram is 6.0 feet away. [MAN] Kyrie Wagner misses. Rebound secured by Kevin Simons.

[03:18] Team_091 possession (Score: 34-36)
Kyrie Rozier attempts a 3Pt. Contested by Kyrie Wagner (5.7 feet, ZONE). Kyrie Rozier misses. FOUL! Loose ball foul on Kyrie Leonard during the rebound battle. [IN THE BONUS! 7 team fouls] Rudy Bridges to the line for 2 free throws. (Kyrie Leonard: 5 personal fouls)   FT 1/2: GOOD   FT 2/2: GOOD Rudy Bridges makes 2/2 from the line.
Score: 34-38

[03:06] Team_021 possession (Score: 34-38)
Zach Carter drives to the basket... Zach Carter throws a bad pass! Stolen by D'Angelo Ingram! TURNOVER! (live ball)

[02:49] Team_091 possession (Score: 34-38)
Isaiah Siakam drives and kicks out. Isaiah Siakam attempts a 3Pt. Wide open! Anthony Oladipo is 6.2 feet away. [MAN] Isaiah Siakam misses. Rebound secured by Kyrie Leonard.

[02:35] Team_021 possession (Score: 34-38)
Zach Carter attempts a Layup. Contested by Kevin Simons (5.8 feet, ZONE). Zach Carter misses. Rebound secured by Rudy Bridges.

[02:20] Team_091 possession (Score: 34-38)
Kevin Simons drives and kicks out. Kyrie Rozier attempts a 3Pt. Wide open! Kyrie Leonard is 6.3 feet away. [MAN] Kyrie Rozier misses. Rebound secured by Zach Carter.

[02:02] Team_021 possession (Score: 34-38)
Zach Carter attempts a Midrange. Contested by Kevin Simons (5.9 feet, MAN). Zach Carter misses. Rebound secured by Kevin Simons.

[01:48] Team_091 possession (Score: 34-38)
Kevin Simons makes the 3Pt and draws the foul on Anthony Oladipo! And-1! Kevin Simons to the line for 1. [BONUS: 8 team fouls] (Anthony Oladipo: 2 personal fouls)   FT 1/1: GOOD Kevin Simons makes 1/1 from the line.
Score: 34-42

[01:36] Team_021 possession (Score: 34-42)
Anthony Oladipo attempts a Layup. Contested by Kevin Simons (5.6 feet, ZONE). ANTHONY OLADIPO MAKES IT! Assist: Zach Carter
Score: 36-42

[01:23] Team_091 possession (Score: 36-42)
Rudy Bridges attempts a Midrange. Wide open! Karl Bridges is 7.1 feet away. [MAN] RUDY BRIDGES MAKES IT!
Score: 36-44

[01:10] Team_021 possession (Score: 36-44)
Zach Carter attempts a 3Pt. Wide open! Kevin Simons is 6.0 feet away. [MAN] Zach Carter misses. Rebound secured by Rudy Bridges.

[01:00] Team_091 possession (Score: 36-44)
Isaiah Siakam attempts a 3Pt. Wide open! Anthony Oladipo is 6.4 feet away. [ZONE] Isaiah Siakam misses. Offensive rebound by Rudy Bridges! Rudy Bridges kicks it out.

[00:46] Team_091 possession (Score: 36-44)
Kevin Simons attempts a 3Pt. Wide open! Anthony Oladipo is 6.6 feet away. [ZONE] Kevin Simons misses. Rebound secured by Anthony Oladipo.

[00:29] Team_021 possession (Score: 36-44)
Kyrie Wagner attempts a 3Pt. Contested by Kyrie Rozier (5.8 feet, ZONE). KYRIE WAGNER MAKES IT! Assist: Kyrie Leonard
Score: 39-44

[00:17] Team_091 possession (Score: 39-44)
Rudy Bridges throws a bad pass out of bounds! TURNOVER! (dead ball)

[00:17] Substitution (Team_021): Kyrie Leonard OUT → Joel LaVine IN (stamina_rule2)

[00:17] Substitution (Team_021): Anthony Oladipo OUT → Victor Mitchell IN (stamina_rule2)

[00:17] Substitution (Team_021): Karl Bridges OUT → Paul Allen IN (stamina_rule2)

[00:17] Substitution (Team_021): Kyrie Wagner OUT → Vince George IN (stamina_rule2)

[00:17] Substitution (Team_021): Zach Carter OUT → Magic Ingram IN (stamina_rule2)

[00:17] Substitution (Team_091): Kyrie Rozier OUT → Karl Morant IN (stamina_rule2)

[00:17] Substitution (Team_091): Isaiah Siakam OUT → Julius Barnes IN (stamina_rule2)

[00:17] Substitution (Team_091): Rudy Bridges OUT → Tim Antetokounmpo IN (stamina_rule2)

[00:17] Substitution (Team_091): D'Angelo Ingram OUT → Zion Mitchell IN (stamina_rule2)

[00:17] Substitution (Team_091): Kevin Simons OUT → Ja George IN (stamina_rule2)

[00:01] Team_021 possession (Score: 39-44)
Victor Mitchell attempts a 3Pt. Contested by Julius Barnes (4.9 feet, MAN). VICTOR MITCHELL MAKES IT! Assist: Joel LaVine
Score: 42-44

================================================================================
                              2ND QUARTER COMPLETE                              
================================================================================

2ND QUARTER SCORE: Team_021 21, Team_091 21

BOX SCORE:
================================================================================

Team_021
--------------------------------------------------------------------------------
Player                MIN  PTS  REB  AST  TO      FG   FG%      3P   3P%
--------------------------------------------------------------------------------
Karl Bridges           24    8    0    1   0   3/3   100.0     0/0   0.0
Kyrie Wagner           24    6    0    0   0   2/7    28.6     0/0   0.0
Victor Mitchell         0    3    0    0   0   1/1   100.0     0/0   0.0
Anthony Oladipo        24    2    3    0   0   1/3    33.3     0/0   0.0
Kyrie Leonard          24    2    4    1   0   1/2    50.0     0/0   0.0
Zach Carter            24    0    2    3   0   0/6     0.0     0/0   0.0
Joel LaVine             0    0    0    1   0   0/0     0.0     0/0   0.0

TEAM: FG: 8/22 (36.4%), 3PT: 3/8 (37.5%), REB: 9 (0 off, 9 def), AST: 6, TO: 1
TEAM FOULS: 8 [Team_091 in BONUS]


Team_091
--------------------------------------------------------------------------------
Player                MIN  PTS  REB  AST  TO      FG   FG%      3P   3P%
--------------------------------------------------------------------------------
Kevin Simons           24    7    6    0   0   2/5    40.0     0/0   0.0
Rudy Bridges           24    6    7    0   0   3/4    75.0     0/0   0.0
D'Angelo Ingram        24    4    0    1   0   2/3    66.7     0/0   0.0
Kyrie Rozier           24    2    3    0   0   1/2    50.0     0/0   0.0
Isaiah Siakam          24    1    0    1   0   1/4    25.0     0/0   0.0

TEAM: FG: 9/18 (50.0%), 3PT: 3/7 (42.9%), REB: 16 (3 off, 13 def), AST: 2, TO: 4
TEAM FOULS: 5 [Team_021 in BONUS]

================================================================================

================================================================================
                       3RD QUARTER - Team_021 vs Team_091                       
================================================================================

[12:00] Team_021 possession (Score: 42-44)
Kyrie Wagner drives and kicks out. Kyrie Leonard attempts a 3Pt. Contested by Kyrie Rozier (4.1 feet, MAN). KYRIE LEONARD MAKES IT!
Score: 45-44

[11:43] Team_091 possession (Score: 45-44)
Kyrie Rozier attempts a 3Pt. Contested by Kyrie Leonard (4.7 feet, MAN). KYRIE ROZIER MAKES IT! Assist: Rudy Bridges
Score: 45-47

[11:24] Team_021 possession (Score: 45-47)
Karl Bridges attempts a Midrange. Contested by Rudy Bridges (4.2 feet, MAN). Karl Bridges misses. FOUL! Loose ball foul on Rudy Bridges during the rebound battle. [Team fouls: 1] No free throws, side out. (Rudy Bridges: 1 personal fouls)

[11:13] Team_021 possession (Score: 45-47)
Kyrie Leonard attempts a Layup. Contested by Kevin Simons (3.4 feet, ZONE). KYRIE LEONARD MAKES IT! Assist: Kyrie Wagner
Score: 47-47

[10:57] Team_091 possession (Score: 47-47)
Kyrie Rozier attempts a 3Pt. Contested by Kyrie Leonard (4.7 feet, MAN). Kyrie Rozier misses. Rebound secured by Kyrie Leonard.

[10:46] Team_021 possession (Score: 47-47)
Kyrie Wagner attempts a 3Pt. Contested by D'Angelo Ingram (4.7 feet, MAN). Kyrie Wagner misses. Rebound secured by Kevin Simons.

[10:31] Team_091 possession (Score: 47-47)
Isaiah Siakam attempts a 3Pt. Contested by Anthony Oladipo (4.9 feet, MAN). Isaiah Siakam misses. Rebound secured by Kyrie Leonard.

[10:12] Team_021 possession (Score: 47-47)
Karl Bridges attempts a 3Pt. Contested by Isaiah Siakam (5.5 feet, ZONE). KARL BRIDGES MAKES IT! Assist: Anthony Oladipo
Score: 50-47

[09:58] Team_091 possession (Score: 50-47)
Kyrie Rozier attempts a 3Pt. Contested by Kyrie Wagner (4.1 feet, ZONE). KYRIE ROZIER MAKES IT! Assist: Rudy Bridges
Score: 50-50

[09:45] Team_021 possession (Score: 50-50)
Zach Carter attempts a 3Pt. Contested by Kevin Simons (4.0 feet, MAN). Zach Carter misses. Rebound secured by Rudy Bridges.

[09:36] Team_091 possession (Score: 50-50)
Kyrie Rozier attempts a 3Pt. Contested by Kyrie Wagner (4.1 feet, ZONE). Kyrie Rozier misses. Rebound secured by Zach Carter.

[09:21] Team_021 possession (Score: 50-50)
Karl Bridges attempts a 3Pt. Contested by Rudy Bridges (4.2 feet, MAN). Karl Bridges misses. Rebound secured by Kyrie Rozier.

[09:06] Team_091 possession (Score: 50-50)
Isaiah Siakam loses the ball! Stripped by Anthony Oladipo! TURNOVER! (live ball)

[08:54] Team_021 possession (Score: 50-50)
Kyrie Wagner drives and kicks out. Kyrie Wagner attempts a 3Pt. Contested by Kyrie Rozier (4.1 feet, ZONE). Kyrie Wagner misses. Offensive rebound by Zach Carter! Zach Carter kicks it out.

[08:41] Team_021 possession (Score: 50-50)
Kyrie Leonard attempts a Midrange. Contested by Kyrie Rozier (3.9 feet, MAN). Kyrie Leonard misses. Offensive rebound by Zach Carter! Zach Carter kicks it out.

[08:30] Team_021 possession (Score: 50-50)
Zach Carter drives and kicks out. Kyrie Leonard attempts a Midrange. Contested by Isaiah Siakam (5.6 feet, ZONE). KYRIE LEONARD MAKES IT! Assist: Zach Carter
Score: 52-50

[08:19] Team_091 possession (Score: 52-50)
Rudy Bridges drives to the basket... Rudy Bridges throws a bad pass! Stolen by Zach Carter! TURNOVER! (live ball)

[08:00] Team_021 possession (Score: 52-50)
Zach Carter attempts a 3Pt. Contested by Kevin Simons (4.0 feet, MAN). Zach Carter misses. Rebound secured by Rudy Bridges.

[07:45] Team_091 possession (Score: 52-50)
Rudy Bridges drives, picks up Zach Carter. Help arrives from Kyrie Leonard! Rudy Bridges attempts a Layup. Contested by Kyrie Leonard (4.1 feet, ZONE). RUDY BRIDGES MAKES IT!
Score: 52-52

[07:29] Team_021 possession (Score: 52-52)
FOUL! Holding foul on Kyrie Rozier. [Team fouls: 2] No free throws, side out. (Kyrie Rozier: 1 personal fouls)

[07:16] Team_021 possession (Score: 52-52)
Zach Carter attempts a 3Pt. Contested by Kevin Simons (4.0 feet, MAN). ZACH CARTER MAKES IT! Assist: Kyrie Leonard
Score: 55-52

[07:05] Team_091 possession (Score: 55-52)
FOUL! Shooting foul on Kyrie Wagner. Kevin Simons to the line for 2 free throws. [Team fouls: 1] (Kyrie Wagner: 1 personal fouls)   FT 1/2: GOOD   FT 2/2: GOOD Kevin Simons makes 2/2 from the line.
Score: 55-54

[06:46] Team_021 possession (Score: 55-54)
Kyrie Leonard attempts a 3Pt. Contested by Kyrie Rozier (3.9 feet, ZONE). Kyrie Leonard misses. Rebound secured by Kevin Simons.

[06:31] Team_091 possession (Score: 55-54)
Kevin Simons attempts a 3Pt. Contested by Kyrie Wagner (4.4 feet, ZONE). KEVIN SIMONS MAKES IT! Assist: Isaiah Siakam
Score: 55-57

[06:13] Team_021 possession (Score: 55-57)
Kyrie Wagner makes the 3Pt and draws the foul on D'Angelo Ingram! And-1! Kyrie Wagner to the line for 1. [Team fouls: 3] (D'Angelo Ingram: 1 personal fouls)   FT 1/1: GOOD Kyrie Wagner makes 1/1 from the line.
Score: 59-57

[05:57] Team_091 possession (Score: 59-57)
FOUL! Shooting foul on Zach Carter. Isaiah Siakam to the line for 2 free throws. [Team fouls: 2] (Zach Carter: 1 personal fouls)   FT 1/2: MISS   FT 2/2: GOOD Isaiah Siakam makes 1/2 from the line.
Score: 59-58

[05:42] Team_021 possession (Score: 59-58)
Kyrie Leonard attempts a 3Pt. Contested by Kyrie Rozier (3.9 feet, ZONE). Kyrie Leonard misses. Offensive rebound by Kyrie Leonard! Kyrie Leonard kicks it out.

[05:25] Team_021 possession (Score: 59-58)
Kyrie Wagner attempts a Midrange. Contested by D'Angelo Ingram (4.7 feet, ZONE). KYRIE WAGNER MAKES IT! Assist: Karl Bridges
Score: 61-58

[05:08] Team_091 possession (Score: 61-58)
Isaiah Siakam loses the ball! Stripped by Anthony Oladipo! TURNOVER! (live ball)

[04:50] Team_021 possession (Score: 61-58)
Zach Carter drives, Kevin Simons stays with him. Zach Carter attempts a Dunk. Contested by Kevin Simons (4.0 feet, MAN). ZACH CARTER MAKES IT!
Score: 63-58

[04:35] Team_091 possession (Score: 63-58)
Kevin Simons attempts a Layup. Contested by Zach Carter (4.5 feet, ZONE). KEVIN SIMONS MAKES IT! Assist: D'Angelo Ingram
Score: 63-60

[04:17] Team_021 possession (Score: 63-60)
Kyrie Leonard drives and kicks out. Karl Bridges attempts a Midrange. Contested by D'Angelo Ingram (4.7 feet, ZONE). KARL BRIDGES MAKES IT!
Score: 65-60

[03:59] Team_091 possession (Score: 65-60)
Kyrie Rozier attempts a 3Pt. Contested by Kyrie Leonard (4.8 feet, MAN). Kyrie Rozier misses. Rebound secured by Anthony Oladipo.

[03:41] Team_021 possession (Score: 65-60)
Anthony Oladipo attempts a Midrange. Contested by Isaiah Siakam (5.7 feet, ZONE). Anthony Oladipo misses. Rebound secured by Kevin Simons.

[03:32] Team_091 possession (Score: 65-60)
Kyrie Rozier attempts a Layup. Contested by Zach Carter (4.3 feet, ZONE). KYRIE ROZIER MAKES IT! Assist: Isaiah Siakam
Score: 65-62

[03:17] Team_021 possession (Score: 65-62)
Zach Carter attempts a Midrange. Contested by Rudy Bridges (4.8 feet, ZONE). Zach Carter misses. Rebound secured by Kevin Simons.

[03:00] Team_091 possession (Score: 65-62)
Kyrie Rozier attempts a 3Pt. Contested by Kyrie Leonard (4.8 feet, MAN). KYRIE ROZIER MAKES IT! Assist: Kevin Simons
Score: 65-65

[02:47] Team_021 possession (Score: 65-65)
FOUL! Reach-in foul on Rudy Bridges during the drive. [Team fouls: 4] No free throws, side out. (Rudy Bridges: 2 personal fouls)

[02:32] Team_021 possession (Score: 65-65)
Anthony Oladipo attempts a Layup. BLOCKED BY RUDY BRIDGES! Ball deflects out of bounds off Anthony Oladipo.

[02:16] Team_091 possession (Score: 65-65)
Rudy Bridges attempts a Midrange. Contested by Karl Bridges (5.8 feet, MAN). Rudy Bridges misses. Rebound secured by Kyrie Leonard.

[02:01] Team_021 possession (Score: 65-65)
Kyrie Leonard drives, Kevin Simons stays with him. Kyrie Leonard attempts a Dunk. Contested by Kevin Simons (3.7 feet, ZONE). Kyrie Leonard misses. Rebound secured by Kyrie Rozier.

[01:46] Team_091 possession (Score: 65-65)
Kevin Simons attempts a Midrange. BLOCKED BY ZACH CARTER! Ball is loose! Rebound secured by Kyrie Leonard.

[01:31] Team_021 possession (Score: 65-65)
Kyrie Leonard attempts a Layup. Contested by Kyrie Rozier (4.2 feet, MAN). KYRIE LEONARD MAKES IT! Assist: Anthony Oladipo
Score: 67-65

[01:14] Team_091 possession (Score: 67-65)
D'Angelo Ingram drives, picks up Zach Carter. Help arrives from Kyrie Leonard! D'Angelo Ingram attempts a Layup. Contested by Kyrie Leonard (5.2 feet, ZONE). D'ANGELO INGRAM MAKES IT! Assist: Kyrie Rozier
Score: 67-67

[01:02] Team_021 possession (Score: 67-67)
Karl Bridges attempts a 3Pt. Contested by Kyrie Rozier (4.2 feet, ZONE). Karl Bridges misses. Rebound secured by Kyrie Rozier.

[00:47] Team_091 possession (Score: 67-67)
Rudy Bridges drives, Karl Bridges stays with him. Rudy Bridges attempts a Layup. Contested by Karl Bridges (5.9 feet, MAN). RUDY BRIDGES MAKES IT! Assist: Kyrie Rozier
Score: 67-69

[00:32] Team_021 possession (Score: 67-69)
Kyrie Leonard attempts a Midrange. Contested by Kyrie Rozier (4.2 feet, MAN). Kyrie Leonard misses. Rebound secured by Kyrie Rozier.

[00:18] Team_091 possession (Score: 67-69)
FOUL! Holding foul on Zach Carter. [Team fouls: 3] No free throws, side out. (Zach Carter: 2 personal fouls)

[00:02] Team_091 possession (Score: 67-69)
FOUL! Holding foul on Karl Bridges. [Team fouls: 4] No free throws, side out. (Karl Bridges: 1 personal fouls)

================================================================================
                              3RD QUARTER COMPLETE                              
================================================================================

3RD QUARTER SCORE: Team_021 25, Team_091 25

BOX SCORE:
================================================================================

Team_021
--------------------------------------------------------------------------------
Player                MIN  PTS  REB  AST  TO      FG   FG%      3P   3P%
--------------------------------------------------------------------------------
Kyrie Leonard          36    9    6    1   0   4/7    57.1     0/0   0.0
Kyrie Wagner           36    6    0    1   0   2/3    66.7     0/0   0.0
Karl Bridges           36    5    0    1   0   2/4    50.0     0/0   0.0
Zach Carter            36    5    3    1   0   2/5    40.0     0/0   0.0
Anthony Oladipo        36    0    1    2   0   0/2     0.0     0/0   0.0

TEAM: FG: 10/21 (47.6%), 3PT: 3/9 (33.3%), REB: 10 (4 off, 6 def), AST: 6, TO: 0
TEAM FOULS: 4


Team_091
--------------------------------------------------------------------------------
Player                MIN  PTS  REB  AST  TO      FG   FG%      3P   3P%
--------------------------------------------------------------------------------
Kyrie Rozier           36   11    4    2   0   4/7    57.1     0/0   0.0
Kevin Simons           36    7    4    1   0   3/4    75.0     0/0   0.0
Rudy Bridges           36    4    2    2   0   2/3    66.7     0/0   0.0
D'Angelo Ingram        36    2    0    1   0   1/1   100.0     0/0   0.0
Isaiah Siakam          36    1    0    2   0   1/2    50.0     0/0   0.0

TEAM: FG: 11/17 (64.7%), 3PT: 4/8 (50.0%), REB: 10 (0 off, 10 def), AST: 8, TO: 3
TEAM FOULS: 4

================================================================================

================================================================================
                       4TH QUARTER - Team_021 vs Team_091                       
================================================================================

[12:00] Team_021 possession (Score: 67-69)
Kyrie Wagner attempts a 3Pt. Contested by D'Angelo Ingram (4.9 feet, MAN). Kyrie Wagner misses. Rebound secured by Kevin Simons.

[11:42] Team_091 possession (Score: 67-69)
Kevin Simons makes the Layup and draws the foul on Zach Carter! And-1! Kevin Simons to the line for 1. [Team fouls: 1] (Zach Carter: 1 personal fouls)   FT 1/1: GOOD Kevin Simons makes 1/1 from the line.
Score: 67-72

[11:29] Team_021 possession (Score: 67-72)
Kyrie Wagner drives, D'Angelo Ingram stays with him. Kyrie Wagner attempts a Layup. Contested by D'Angelo Ingram (5.0 feet, MAN). KYRIE WAGNER MAKES IT!
Score: 69-72

[11:17] Team_091 possession (Score: 69-72)
FOUL! Holding foul on Anthony Oladipo. [Team fouls: 2] No free throws, side out. (Anthony Oladipo: 1 personal fouls)

[11:05] Team_091 possession (Score: 69-72)
Isaiah Siakam drives, Anthony Oladipo stays with him. Isaiah Siakam attempts a Dunk. Contested by Anthony Oladipo (5.2 feet, MAN). Isaiah Siakam misses. Rebound secured by Zach Carter.

[10:51] Team_021 possession (Score: 69-72)
Kyrie Wagner drives and kicks out. FOUL! Shooting foul on Kevin Simons. Kyrie Wagner to the line for 2 free throws. [Team fouls: 1] (Kevin Simons: 1 personal fouls)   FT 1/2: MISS   FT 2/2: GOOD Kyrie Wagner makes 1/2 from the line.
Score: 70-72

[10:36] Team_091 possession (Score: 70-72)
Isaiah Siakam attempts a 3Pt. Contested by Kyrie Wagner (4.7 feet, ZONE). Isaiah Siakam misses. Rebound secured by Anthony Oladipo.

[10:20] Team_021 possession (Score: 70-72)
Zach Carter drives and kicks out. Zach Carter attempts a Midrange. Wide open! Isaiah Siakam is 6.1 feet away. [ZONE] ZACH CARTER MAKES IT!
Score: 72-72

[10:08] Team_091 possession (Score: 72-72)
Kyrie Rozier drives to the basket... FOUL! Offensive foul on Kyrie Rozier! Kyrie Leonard drew the charge! [Team fouls: 2] (Kyrie Rozier: 1 personal fouls) TURNOVER! (dead ball)

[09:59] Team_021 possession (Score: 72-72)
Kyrie Wagner drives to the basket... Kyrie Wagner throws a bad pass! Stolen by Kevin Simons! TURNOVER! (live ball)

[09:43] Team_091 possession (Score: 72-72)
D'Angelo Ingram drives, picks up Kyrie Wagner. Help arrives from Kyrie Leonard! D'Angelo Ingram attempts a Dunk. Contested by Kyrie Leonard (5.4 feet, MAN). D'Angelo Ingram misses. Rebound secured by Zach Carter.

[09:29] Team_021 possession (Score: 72-72)
Zach Carter attempts a Midrange. Contested by D'Angelo Ingram (5.5 feet, ZONE). Zach Carter misses. Rebound secured by Rudy Bridges.

[09:19] Team_091 possession (Score: 72-72)
Rudy Bridges makes the Midrange and draws the foul on Karl Bridges! And-1! Rudy Bridges to the line for 1. [Team fouls: 3] (Karl Bridges: 1 personal fouls)   FT 1/1: GOOD Rudy Bridges makes 1/1 from the line.
Score: 72-75

[09:05] Team_021 possession (Score: 72-75)
Karl Bridges makes the Layup and draws the foul on Rudy Bridges! And-1! Karl Bridges to the line for 1. [Team fouls: 3] (Rudy Bridges: 1 personal fouls)   FT 1/1: MISS Karl Bridges makes 0/1 from the line. Rebound secured by Kyrie Rozier.
Score: 74-75

[08:53] Team_091 possession (Score: 74-75)
Kevin Simons drives, Zach Carter stays with him. Kevin Simons attempts a Dunk. Contested by Zach Carter (5.0 feet, MAN). Kevin Simons misses. Rebound secured by Kyrie Leonard.

[08:34] Team_021 possession (Score: 74-75)
Kyrie Wagner makes the Layup and draws the foul on Kevin Simons! And-1! Kyrie Wagner to the line for 1. [Team fouls: 4] (Kevin Simons: 2 personal fouls)   FT 1/1: GOOD Kyrie Wagner makes 1/1 from the line.
Score: 77-75

[08:20] Team_091 possession (Score: 77-75)
Isaiah Siakam attempts a Midrange. Contested by Anthony Oladipo (5.5 feet, MAN). ISAIAH SIAKAM MAKES IT!
Score: 77-77

[08:09] Team_021 possession (Score: 77-77)
Anthony Oladipo drives, Kevin Simons stays with him. Anthony Oladipo attempts a Dunk. Contested by Kevin Simons (4.4 feet, ZONE). Anthony Oladipo misses. Rebound secured by Kyrie Rozier.

[07:54] Team_091 possession (Score: 77-77)
Kevin Simons commits a violation (traveling/carry)! TURNOVER! (dead ball)

[07:54] Substitution (Team_021): Kyrie Leonard OUT → Joel LaVine IN (stamina_rule2)

[07:54] Substitution (Team_021): Anthony Oladipo OUT → Victor Mitchell IN (stamina_rule2)

[07:54] Substitution (Team_021): Karl Bridges OUT → Paul Allen IN (stamina_rule2)

[07:54] Substitution (Team_021): Kyrie Wagner OUT → Vince George IN (stamina_rule2)

[07:54] Substitution (Team_021): Zach Carter OUT → Magic Ingram IN (stamina_rule2)

[07:54] Substitution (Team_091): Kyrie Rozier OUT → Karl Morant IN (stamina_rule2)

[07:54] Substitution (Team_091): Isaiah Siakam OUT → Julius Barnes IN (stamina_rule2)

[07:54] Substitution (Team_091): Rudy Bridges OUT → Tim Antetokounmpo IN (stamina_rule2)

[07:54] Substitution (Team_091): D'Angelo Ingram OUT → Zion Mitchell IN (stamina_rule2)

[07:54] Substitution (Team_091): Kevin Simons OUT → Ja George IN (stamina_rule2)

[07:35] Team_021 possession (Score: 77-77)
Paul Allen throws a bad pass! Stolen by Tim Antetokounmpo! TURNOVER! (live ball)

[07:22] Team_091 possession (Score: 77-77)
Karl Morant attempts a 3Pt. Contested by Victor Mitchell (4.5 feet, ZONE). KARL MORANT MAKES IT! Assist: Julius Barnes
Score: 77-80

[07:11] Team_021 possession (Score: 77-80)
Joel LaVine makes the Layup and draws the foul on Zion Mitchell! And-1! Joel LaVine to the line for 1. [BONUS: 5 team fouls] (Zion Mitchell: 1 personal fouls)   FT 1/1: GOOD Joel LaVine makes 1/1 from the line.
Score: 80-80

[07:00] Team_091 possession (Score: 80-80)
Zion Mitchell attempts a Layup. Contested by Vince George (5.1 feet, MAN). ZION MITCHELL MAKES IT! Assist: Julius Barnes
Score: 80-82

[06:44] Team_021 possession (Score: 80-82)
FOUL! Shooting foul on Ja George. Magic Ingram to the line for 2 free throws. [BONUS: 6 team fouls] (Ja George: 1 personal fouls)   FT 1/2: GOOD   FT 2/2: GOOD Magic Ingram makes 2/2 from the line.
Score: 82-82

[06:29] Team_091 possession (Score: 82-82)
FOUL! Shooting foul on Vince George. Zion Mitchell to the line for 2 free throws. [Team fouls: 4] (Vince George: 1 personal fouls)   FT 1/2: GOOD   FT 2/2: GOOD Zion Mitchell makes 2/2 from the line.
Score: 82-84

[06:11] Team_021 possession (Score: 82-84)
Paul Allen attempts a Layup. Contested by Tim Antetokounmpo (5.6 feet, MAN). Paul Allen misses. Rebound secured by Ja George.

[05:56] Team_091 possession (Score: 82-84)
Zion Mitchell attempts a Layup. Contested by Vince George (5.1 feet, MAN). Zion Mitchell misses. FOUL! Loose ball foul on Victor Mitchell during the rebound battle. [IN THE BONUS! 5 team fouls] Zion Mitchell to the line for 2 free throws. (Victor Mitchell: 1 personal fouls)   FT 1/2: GOOD   FT 2/2: GOOD Zion Mitchell makes 2/2 from the line.
Score: 82-86

[05:41] Team_021 possession (Score: 82-86)
Victor Mitchell attempts a 3Pt. Contested by Karl Morant (4.8 feet, ZONE). Victor Mitchell misses. Offensive rebound by Magic Ingram! Magic Ingram kicks it out.

[05:27] Team_021 possession (Score: 82-86)
Magic Ingram attempts a Layup. Contested by Ja George (4.8 feet, MAN). MAGIC INGRAM MAKES IT! Assist: Vince George
Score: 84-86

[05:12] Team_091 possession (Score: 84-86)
Karl Morant attempts a Midrange. Wide open! Joel LaVine is 6.2 feet away. [MAN] KARL MORANT MAKES IT! Assist: Julius Barnes
Score: 84-88

[04:57] Team_021 possession (Score: 84-88)
Victor Mitchell attempts a Midrange. Contested by Julius Barnes (4.9 feet, MAN). VICTOR MITCHELL MAKES IT!
Score: 86-88

[04:46] Team_091 possession (Score: 86-88)
Julius Barnes attempts a 3Pt. Contested by Victor Mitchell (4.2 feet, ZONE). Julius Barnes misses. Rebound secured by Victor Mitchell.

[04:34] Team_021 possession (Score: 86-88)
Paul Allen attempts a 3Pt. Contested by Karl Morant (5.0 feet, ZONE). Paul Allen misses. Rebound secured by Ja George.

[04:19] Team_091 possession (Score: 86-88)
Tim Antetokounmpo attempts a Midrange. Contested by Victor Mitchell (4.3 feet, ZONE). Tim Antetokounmpo misses. Rebound secured by Magic Ingram.

[04:03] Team_021 possession (Score: 86-88)
FOUL! Reach-in foul on Zion Mitchell during the drive. [IN THE BONUS! 7 team fouls] Joel LaVine to the line for 2 free throws. (Zion Mitchell: 2 personal fouls)   FT 1/2: MISS   FT 2/2: GOOD Joel LaVine makes 1/2 from the line.
Score: 87-88

[03:46] Team_091 possession (Score: 87-88)
Zion Mitchell drives, Magic Ingram stays with him. Zion Mitchell attempts a Dunk. Contested by Magic Ingram (5.2 feet, ZONE). ZION MITCHELL MAKES IT! Assist: Karl Morant
Score: 87-90

[03:32] Team_021 possession (Score: 87-90)
Paul Allen attempts a Midrange. Contested by Zion Mitchell (5.1 feet, ZONE). Paul Allen misses. FOUL! Loose ball foul on Ja George during the rebound battle. [IN THE BONUS! 8 team fouls] Vince George to the line for 2 free throws. (Ja George: 2 personal fouls)   FT 1/2: MISS   FT 2/2: MISS Vince George makes 0/2 from the line. Rebound secured by Ja George.

[03:19] Team_091 possession (Score: 87-90)
Tim Antetokounmpo attempts a 3Pt. Contested by Paul Allen (6.0 feet, MAN). Tim Antetokounmpo misses. Offensive rebound by Zion Mitchell! Zion Mitchell kicks it out.

[03:05] Team_091 possession (Score: 87-90)
FOUL! Shooting foul on Victor Mitchell. Zion Mitchell to the line for 3 free throws. [BONUS: 6 team fouls] (Victor Mitchell: 2 personal fouls)   FT 1/3: GOOD   FT 2/3: GOOD   FT 3/3: MISS Zion Mitchell makes 2/3 from the line. Rebound secured by Magic Ingram.
Score: 87-92

[02:48] Team_021 possession (Score: 87-92)
Victor Mitchell attempts a 3Pt. Contested by Karl Morant (4.8 feet, ZONE). Victor Mitchell misses. Rebound secured by Tim Antetokounmpo.

[02:32] Team_091 possession (Score: 87-92)
Tim Antetokounmpo attempts a 3Pt. Contested by Paul Allen (6.0 feet, MAN). Tim Antetokounmpo misses. Rebound secured by Vince George.

[02:18] Team_021 possession (Score: 87-92)
Paul Allen attempts a Layup. Contested by Tim Antetokounmpo (5.6 feet, MAN). Paul Allen misses. Offensive rebound by Magic Ingram! Magic Ingram kicks it out.

[02:06] Team_021 possession (Score: 87-92)
Joel LaVine attempts a Midrange. Contested by Karl Morant (4.7 feet, ZONE). Joel LaVine misses. Rebound secured by Tim Antetokounmpo.

[01:53] Team_091 possession (Score: 87-92)
Zion Mitchell attempts a 3Pt. Contested by Victor Mitchell (4.4 feet, ZONE). Zion Mitchell misses. Offensive rebound by Ja George! Ja George kicks it out.

[01:40] Team_091 possession (Score: 87-92)
FOUL! Reach-in foul on Magic Ingram during the drive. [IN THE BONUS! 7 team fouls] Zion Mitchell to the line for 2 free throws. (Magic Ingram: 1 personal fouls)   FT 1/2: GOOD   FT 2/2: GOOD Zion Mitchell makes 2/2 from the line.
Score: 87-94

[01:26] Team_021 possession (Score: 87-94)
Joel LaVine attempts a Layup. Contested by Zion Mitchell (4.7 feet, ZONE). JOEL LAVINE MAKES IT!
Score: 89-94

[01:12] Team_091 possession (Score: 89-94)
Julius Barnes drives, picks up Victor Mitchell. Help arrives from Paul Allen! Julius Barnes attempts a Layup. Contested by Paul Allen (4.2 feet, MAN). JULIUS BARNES MAKES IT! Assist: Zion Mitchell
Score: 89-96

[00:56] Team_021 possession (Score: 89-96)
Joel LaVine attempts a Midrange. Contested by Karl Morant (4.7 feet, MAN). Joel LaVine misses. Rebound secured by Tim Antetokounmpo.

[00:44] Team_091 possession (Score: 89-96)
Tim Antetokounmpo attempts a 3Pt. Contested by Paul Allen (6.0 feet, MAN). Tim Antetokounmpo misses. Rebound secured by Victor Mitchell.

[00:31] Team_021 possession (Score: 89-96)
Vince George attempts a 3Pt. Contested by Karl Morant (4.8 feet, ZONE). Vince George misses. Rebound secured by Zion Mitchell.

[00:21] Team_091 possession (Score: 89-96)
FOUL! Shooting foul on Magic Ingram. Ja George to the line for 2 free throws. [BONUS: 8 team fouls] (Magic Ingram: 2 personal fouls)   FT 1/2: GOOD   FT 2/2: GOOD Ja George makes 2/2 from the line.
Score: 89-98

[00:08] Team_021 possession (Score: 89-98)
Paul Allen attempts a 3Pt. Contested by Karl Morant (5.1 feet, ZONE). PAUL ALLEN MAKES IT! Assist: Joel LaVine
Score: 92-98

================================================================================
                              4TH QUARTER COMPLETE                              
================================================================================

4TH QUARTER SCORE: Team_021 25, Team_091 29

BOX SCORE:
================================================================================

Team_021
--------------------------------------------------------------------------------
Player                MIN  PTS  REB  AST  TO      FG   FG%      3P   3P%
--------------------------------------------------------------------------------
Kyrie Wagner           41    6    0    0   0   3/4    75.0     0/0   0.0
Joel LaVine             8    6    0    1   0   3/5    60.0     0/0   0.0
Magic Ingram            8    4    4    0   0   2/2   100.0     0/0   0.0
Paul Allen              8    3    0    0   0   1/4    25.0     0/0   0.0
Zach Carter            41    2    2    0   0   1/2    50.0     0/0   0.0
Victor Mitchell         8    2    2    0   0   1/2    50.0     0/0   0.0
Anthony Oladipo        41    0    1    0   0   0/1     0.0     0/0   0.0
Karl Bridges           41    0    0    0   0   0/1     0.0     0/0   0.0
Kyrie Leonard          41    0    1    0   0   0/0     0.0     0/0   0.0
Vince George            8    0    1    1   0   0/1     0.0     0/0   0.0

TEAM: FG: 11/22 (50.0%), 3PT: 1/5 (20.0%), REB: 12 (3 off, 9 def), AST: 2, TO: 2
TEAM FOULS: 8 [Team_091 in BONUS]


Team_091
--------------------------------------------------------------------------------
Player                MIN  PTS  REB  AST  TO      FG   FG%      3P   3P%
--------------------------------------------------------------------------------
Zion Mitchell           8   10    2    1   0   5/6    83.3     0/0   0.0
Karl Morant             8    5    0    1   0   2/2   100.0     0/0   0.0
Kevin Simons           41    3    1    0   0   1/2    50.0     0/0   0.0
Rudy Bridges           41    3    1    0   0   1/1   100.0     0/0   0.0
Isaiah Siakam          41    2    0    0   0   1/3    33.3     0/0   0.0
Julius Barnes           8    2    0    3   0   1/2    50.0     0/0   0.0
Ja George               8    2    4    0   0   1/1   100.0     0/0   0.0
D'Angelo Ingram        41    0    0    0   0   0/1     0.0     0/0   0.0
Kyrie Rozier           41    0    2    0   0   0/0     0.0     0/0   0.0
Tim Antetokounmpo       8    0    3    0   0   0/3     0.0     0/0   0.0

TEAM: FG: 12/21 (57.1%), 3PT: 1/6 (16.7%), REB: 12 (2 off, 10 def), AST: 5, TO: 2
TEAM FOULS: 8 [Team_021 in BONUS]

================================================================================

================================================================================
                               FULL GAME COMPLETE                               
================================================================================

FINAL SCORE: Team_021 92, Team_091 98

SCORING BY QUARTER:
--------------------------------------------------------------------------------
Team                     Q1     Q2     Q3     Q4    FINAL
--------------------------------------------------------------------------------
Team_021                 21     21     25     25       92
Team_091                 23     21     25     29       98
--------------------------------------------------------------------------------

FULL GAME BOX SCORE:
================================================================================

Team_021
--------------------------------------------------------------------------------
Player                MIN  PTS  REB  AST  TO      FG   FG%      3P   3P%      FT STL BLK
--------------------------------------------------------------------------------
Kyrie Leonard          41   16   16    2   0   6/11   54.5   1/3    33.3   0/0     0   0
Anthony Oladipo        41    7    9    3   2   3/10   30.0   1/5    20.0   2/2     3   0
Karl Bridges           41   15    0    2   0   5/12   41.7   2/6    33.3   3/4     0   0
Kyrie Wagner           41   20    0    3   1   8/17   47.1   2/7    28.6   5/6     1   0
Zach Carter            41   14   13    4   0   7/20   35.0   1/6    16.7   1/1     2   1
Joel LaVine             8    6    0    2   0   3/5    60.0   0/0     0.0   2/3     0   0
Victor Mitchell         8    5    2    0   0   2/3    66.7   1/2    50.0   0/0     0   0
Paul Allen              8    3    0    0   1   1/4    25.0   1/2    50.0   0/0     0   0
Vince George            8    0    1    1   0   0/1     0.0   0/1     0.0   0/2     0   0
Magic Ingram            8    4    4    0   0   2/2   100.0   0/0     0.0   2/2     0   0

TEAM: FG: 38/86 (44.2%), 3PT: 9/32 (28.1%), REB: 45 (11 off, 34 def), AST: 17, TO: 4


Team_091
--------------------------------------------------------------------------------
Player                MIN  PTS  REB  AST  TO      FG   FG%      3P   3P%      FT STL BLK
--------------------------------------------------------------------------------
Kyrie Rozier           41   19   13    4   1   7/15   46.7   5/12   41.7   3/3     0   0
Isaiah Siakam          41    7    0    3   4   4/13   30.8   2/7    28.6   2/5     0   0
Rudy Bridges           41   19   15    2   2   7/11   63.6   1/4    25.0   4/4     0   1
D'Angelo Ingram        41    8    0    2   1   4/7    57.1   0/1     0.0   1/2     1   0
Kevin Simons           41   23   18    1   3   8/14   57.1   2/3    66.7   9/9     1   1
Karl Morant             8    5    0    1   0   2/2   100.0   1/1   100.0   0/0     0   0
Julius Barnes           8    2    0    3   0   1/2    50.0   0/1     0.0   0/0     0   0
Tim Antetokounmpo       8    0    3    0   0   0/3     0.0   0/2     0.0   0/0     1   0
Zion Mitchell           8   10    2    1   0   5/6    83.3   0/1     0.0   8/9     0   0
Ja George               8    2    4    0   0   1/1   100.0   0/0     0.0   2/2     0   0

TEAM: FG: 40/75 (53.3%), 3PT: 11/32 (34.4%), REB: 55 (10 off, 45 def), AST: 17, TO: 11

================================================================================
