================================================================================
                        FULL GAME - Team_075 vs Team_028                        
================================================================================

================================================================================
                       1ST QUARTER - Team_075 vs Team_028                       
================================================================================

[12:00] Team_075 possession (Score: 0-0)
Larry McCollum attempts a 3Pt. Contested by Austin Russell (4.6 feet, MAN). Larry McCollum misses. Rebound secured by Kawhi Ball.

[11:49] Team_028 possession (Score: 0-0)
Jimmy Brogdon drives, Klay Jokic stays with him. Jimmy Brogdon attempts a Dunk. Contested by Klay Jokic (5.9 feet, MAN). JIMMY BROGDON MAKES IT! Assist: Carmelo Carter
Score: 0-2

[11:32] Team_075 possession (Score: 0-2)
FOUL! Shooting foul on Kawhi Ball. Derrick Stewart to the line for 2 free throws. [Team fouls: 1] (Kawhi Ball: 1 personal fouls)   FT 1/2: GOOD   FT 2/2: GOOD Derrick Stewart makes 2/2 from the line.
Score: 2-2

[11:22] Team_028 possession (Score: 2-2)
Austin Russell makes the Midrange and draws the foul on Larry McCollum! And-1! Austin Russell to the line for 1. [Team fouls: 1] (Larry McCollum: 1 personal fouls)   FT 1/1: GOOD Austin Russell makes 1/1 from the line.
Score: 2-5

[11:06] Team_075 possession (Score: 2-5)
Myles Barrett drives, Kawhi Ball stays with him. Myles Barrett attempts a Layup. Contested by Kawhi Ball (4.5 feet, ZONE). MYLES BARRETT MAKES IT! Assist: Derrick Stewart
Score: 4-5

[10:53] Team_028 possession (Score: 4-5)
Myles Haliburton attempts a Midrange. Contested by Myles Barrett (6.0 feet, MAN). Myles Haliburton misses. Rebound secured by Kawhi Ingram.

[10:41] Team_075 possession (Score: 4-5)
Klay Jokic attempts a Layup. BLOCKED BY JIMMY BROGDON! Ball is loose! Rebound secured by Carmelo Carter.

[10:24] Team_028 possession (Score: 4-5)
Myles Haliburton drives to the basket... Myles Haliburton loses the ball! Stripped by Myles Barrett! TURNOVER! (live ball)

[10:12] Team_075 possession (Score: 4-5)
Derrick Stewart attempts a 3Pt. Contested by Kawhi Ball (4.2 feet, MAN). Derrick Stewart misses. FOUL! Loose ball foul on Carmelo Carter during the rebound battle. [Team fouls: 2] No free throws, side out. (Carmelo Carter: 1 personal fouls)

[09:58] Team_075 possession (Score: 4-5)
FOUL! Shooting foul on Carmelo Carter. Myles Barrett to the line for 2 free throws. [Team fouls: 3] (Carmelo Carter: 2 personal fouls)   FT 1/2: GOOD   FT 2/2: GOOD Myles Barrett makes 2/2 from the line.
Score: 6-5

[09:45] Team_028 possession (Score: 6-5)
Austin Russell makes the Layup and draws the foul on Larry McCollum! And-1! Austin Russell to the line for 1. [Team fouls: 2] (Larry McCollum: 2 personal fouls)   FT 1/1: MISS Austin Russell makes 0/1 from the line. Offensive rebound by Kawhi Ball! Kawhi Ball kicks it out.
Score: 6-7

[09:26] Team_028 possession (Score: 6-7)
Kawhi Ball drives to the basket... FOUL! Offensive foul on Kawhi Ball! Derrick Stewart drew the charge! [Team fouls: 4] (Kawhi Ball: 2 personal fouls) TURNOVER! (dead ball)

[09:17] Team_075 possession (Score: 6-7)
FOUL! Holding foul on Kawhi Ball. [IN THE BONUS! 5 team fouls] Derrick Stewart to the line for 2 free throws. (Kawhi Ball: 3 personal fouls)   FT 1/2: MISS   FT 2/2: GOOD Derrick Stewart makes 1/2 from the line.
Score: 7-7

[09:04] Team_028 possession (Score: 7-7)
Jimmy Brogdon drives, picks up Klay Jokic. Help arrives from Larry McCollum! Jimmy Brogdon attempts a Dunk. Contested by Larry McCollum (5.9 feet, MAN). Jimmy Brogdon misses. Offensive rebound by Kawhi Ball! Kawhi Ball kicks it out.

[08:49] Team_028 possession (Score: 7-7)
Jimmy Brogdon drives to the basket... FOUL! Offensive foul on Jimmy Brogdon! Derrick Stewart drew the charge! [Team fouls: 6] (Jimmy Brogdon: 1 personal fouls) TURNOVER! (dead ball)

[08:34] Team_075 possession (Score: 7-7)
Kawhi Ingram attempts a 3Pt. Contested by Carmelo Carter (4.3 feet, MAN). KAWHI INGRAM MAKES IT! Assist: Klay Jokic
Score: 10-7

[08:16] Team_028 possession (Score: 10-7)
FOUL! Shooting foul on Kawhi Ingram. Carmelo Carter to the line for 3 free throws. [Team fouls: 3] (Kawhi Ingram: 1 personal fouls)   FT 1/3: GOOD   FT 2/3: GOOD   FT 3/3: GOOD Carmelo Carter makes 3/3 from the line.
Score: 10-10

[08:03] Team_075 possession (Score: 10-10)
FOUL! Shooting foul on Carmelo Carter. Larry McCollum to the line for 2 free throws. [BONUS: 7 team fouls] (Carmelo Carter: 3 personal fouls)   FT 1/2: GOOD   FT 2/2: GOOD Larry McCollum makes 2/2 from the line.
Score: 12-10

[07:53] Team_028 possession (Score: 12-10)
Austin Russell attempts a 3Pt. Contested by Larry McCollum (4.1 feet, MAN). AUSTIN RUSSELL MAKES IT! Assist: Myles Haliburton
Score: 12-13

[07:38] Team_075 possession (Score: 12-13)
Myles Barrett attempts a 3Pt. Contested by Myles Haliburton (3.9 feet, MAN). Myles Barrett misses. Offensive rebound by Derrick Stewart! Derrick Stewart kicks it out.

[07:18] Team_075 possession (Score: 12-13)
Klay Jokic attempts a Layup. Contested by Kawhi Ball (4.7 feet, ZONE). KLAY JOKIC MAKES IT! Assist: Larry McCollum
Score: 14-13

[07:04] Team_028 possession (Score: 14-13)
Myles Haliburton attempts a Midrange. Contested by Myles Barrett (6.0 feet, ZONE). MYLES HALIBURTON MAKES IT!
Score: 14-15

[06:46] Team_075 possession (Score: 14-15)
Derrick Stewart attempts a Midrange. Contested by Kawhi Ball (4.2 feet, MAN). DERRICK STEWART MAKES IT! Assist: Larry McCollum
Score: 16-15

[06:33] Team_028 possession (Score: 16-15)
Kawhi Ball attempts a Midrange. Contested by Derrick Stewart (4.7 feet, MAN). Kawhi Ball misses. Offensive rebound by Jimmy Brogdon! Jimmy Brogdon kicks it out.

[06:17] Team_028 possession (Score: 16-15)
Kawhi Ball attempts a Layup. Contested by Derrick Stewart (4.7 feet, ZONE). KAWHI BALL MAKES IT!
Score: 16-17

[06:03] Team_075 possession (Score: 16-17)
Klay Jokic drives to the basket... FOUL! Offensive foul on Klay Jokic! Kawhi Ball drew the charge! [Team fouls: 4] (Klay Jokic: 1 personal fouls) TURNOVER! (dead ball)

[05:50] Team_028 possession (Score: 16-17)
Austin Russell drives and kicks out. Kawhi Ball attempts a 3Pt. Contested by Kawhi Ingram (4.0 feet, ZONE). Kawhi Ball misses. Rebound secured by Klay Jokic.

[05:35] Team_075 possession (Score: 16-17)
Myles Barrett attempts a 3Pt. Contested by Myles Haliburton (3.9 feet, MAN). MYLES BARRETT MAKES IT! Assist: Klay Jokic
Score: 19-17

[05:23] Team_028 possession (Score: 19-17)
Austin Russell attempts a 3Pt. Contested by Larry McCollum (4.1 feet, ZONE). Austin Russell misses. Rebound secured by Klay Jokic.

[05:09] Team_075 possession (Score: 19-17)
Derrick Stewart attempts a 3Pt. Contested by Kawhi Ball (4.2 feet, MAN). Derrick Stewart misses. Rebound secured by Kawhi Ball.

[04:52] Team_028 possession (Score: 19-17)
Kawhi Ball attempts a Layup. Contested by Derrick Stewart (4.7 feet, ZONE). KAWHI BALL MAKES IT! Assist: Myles Haliburton
Score: 19-19

[04:42] Team_075 possession (Score: 19-19)
FOUL! Shooting foul on Kawhi Ball. Klay Jokic to the line for 2 free throws. [BONUS: 8 team fouls] (Kawhi Ball: 4 personal fouls)   FT 1/2: GOOD   FT 2/2: GOOD Klay Jokic makes 2/2 from the line.
Score: 21-19

[04:25] Team_028 possession (Score: 21-19)
Kawhi Ball drives and kicks out. Kawhi Ball attempts a 3Pt. Contested by Larry McCollum (4.3 feet, ZONE). Kawhi Ball misses. Rebound secured by Derrick Stewart.

[04:15] Team_075 possession (Score: 21-19)
Larry McCollum attempts a Midrange. Contested by Austin Russell (4.7 feet, ZONE). Larry McCollum misses. Rebound secured by Carmelo Carter.

[04:04] Team_028 possession (Score: 21-19)
FOUL! Reach-in foul on Derrick Stewart during the drive. [IN THE BONUS! 5 team fouls] Carmelo Carter to the line for 2 free throws. (Derrick Stewart: 1 personal fouls)   FT 1/2: GOOD   FT 2/2: GOOD Carmelo Carter makes 2/2 from the line.
Score: 21-21

[03:46] Team_075 possession (Score: 21-21)
Larry McCollum attempts a 3Pt. Contested by Austin Russell (4.7 feet, ZONE). LARRY MCCOLLUM MAKES IT! Assist: Derrick Stewart
Score: 24-21

[03:35] Team_028 possession (Score: 24-21)
Jimmy Brogdon drives and kicks out. Austin Russell attempts a Midrange. Contested by Larry McCollum (4.4 feet, MAN). Austin Russell misses. FOUL! Loose ball foul on Klay Jokic during the rebound battle. [IN THE BONUS! 6 team fouls] Jimmy Brogdon to the line for 2 free throws. (Klay Jokic: 2 personal fouls)   FT 1/2: GOOD   FT 2/2: MISS Jimmy Brogdon makes 1/2 from the line. Rebound secured by Klay Jokic.
Score: 24-22

[03:25] Team_075 possession (Score: 24-22)
Derrick Stewart drives and kicks out. Kawhi Ingram attempts a 3Pt. Contested by Carmelo Carter (4.6 feet, MAN). KAWHI INGRAM MAKES IT!
Score: 27-22

[03:13] Team_028 possession (Score: 27-22)
Myles Haliburton attempts a 3Pt. Wide open! Myles Barrett is 6.2 feet away. [MAN] MYLES HALIBURTON MAKES IT! Assist: Jimmy Brogdon
Score: 27-25

[02:57] Team_075 possession (Score: 27-25)
Kawhi Ingram attempts a 3Pt. Contested by Carmelo Carter (4.5 feet, MAN). Kawhi Ingram misses. Rebound secured by Kawhi Ball.

[02:43] Team_028 possession (Score: 27-25)
Carmelo Carter attempts a 3Pt. Contested by Kawhi Ingram (4.6 feet, MAN). CARMELO CARTER MAKES IT!
Score: 27-28

[02:31] Team_075 possession (Score: 27-28)
Derrick Stewart attempts a Midrange. Contested by Kawhi Ball (4.5 feet, MAN). Derrick Stewart misses. Rebound secured by Kawhi Ball.

[02:18] Team_028 possession (Score: 27-28)
Carmelo Carter drives and kicks out. Austin Russell attempts a 3Pt. Contested by Larry McCollum (4.6 feet, MAN). AUSTIN RUSSELL MAKES IT! Assist: Myles Haliburton
Score: 27-31

[02:04] Team_075 possession (Score: 27-31)
Myles Barrett attempts a 3Pt. Contested by Myles Haliburton (4.1 feet, MAN). Myles Barrett misses. Rebound secured by Jimmy Brogdon.

[01:47] Team_028 possession (Score: 27-31)
Myles Haliburton attempts a 3Pt. Contested by Larry McCollum (4.7 feet, ZONE). MYLES HALIBURTON MAKES IT!
Score: 27-34

[01:31] Team_075 possession (Score: 27-34)
Larry McCollum attempts a 3Pt. Contested by Austin Russell (4.9 feet, ZONE). Larry McCollum misses. Offensive rebound by Kawhi Ingram! Kawhi Ingram kicks it out.

[01:15] Team_075 possession (Score: 27-34)
Klay Jokic attempts a 3Pt. Contested by Austin Russell (5.3 feet, ZONE). Klay Jokic misses. Rebound secured by Jimmy Brogdon.

[00:57] Team_028 possession (Score: 27-34)
FOUL! Reach-in foul on Derrick Stewart during the drive. [IN THE BONUS! 7 team fouls] Carmelo Carter to the line for 2 free throws. (Derrick Stewart: 2 personal fouls)   FT 1/2: MISS   FT 2/2: GOOD Carmelo Carter makes 1/2 from the line.
Score: 27-35

[00:44] Team_075 possession (Score: 27-35)
Kawhi Ingram attempts a 3Pt. Contested by Kawhi Ball (4.6 feet, ZONE). Kawhi Ingram misses. Rebound secured by Kawhi Ball.

[00:29] Team_028 possession (Score: 27-35)
Myles Haliburton attempts a 3Pt. Wide open! Myles Barrett is 6.4 feet away. [MAN] MYLES HALIBURTON MAKES IT! Assist: Carmelo Carter
Score: 27-38

[00:14] Team_075 possession (Score: 27-38)
Kawhi Ingram attempts a Layup. Contested by Carmelo Carter (4.8 feet, MAN). KAWHI INGRAM MAKES IT!
Score: 29-38

================================================================================
                              1ST QUARTER COMPLETE                              
================================================================================

1ST QUARTER SCORE: Team_075 29, Team_028 38

BOX SCORE:
================================================================================

Team_075
--------------------------------------------------------------------------------
Player                MIN  PTS  REB  AST  TO      FG   FG%      3P   3P%
--------------------------------------------------------------------------------
Kawhi Ingram           12    8    3    0   0   3/5    60.0     0/0   0.0
Myles Barrett          12    7    0    0   0   3/4    75.0     0/0   0.0
Larry McCollum         12    5    0    2   0   2/4    50.0     0/0   0.0
Derrick Stewart        12    5    2    2   0   3/5    60.0     0/0   0.0
Klay Jokic             12    4    3    2   0   2/4    50.0     0/0   0.0

TEAM: FG: 13/22 (59.1%), 3PT: 3/9 (33.3%), REB: 7 (3 off, 4 def), AST: 6, TO: 1
TEAM FOULS: 7 [Team_028 in BONUS]


Team_028
--------------------------------------------------------------------------------
Player                MIN  PTS  REB  AST  TO      FG   FG%      3P   3P%
--------------------------------------------------------------------------------
Myles Haliburton       12   11    0    3   0   4/5    80.0     0/0   0.0
Carmelo Carter         12    9    2    2   0   4/4   100.0     0/0   0.0
Austin Russell         12    9    0    0   0   3/5    60.0     0/0   0.0
Kawhi Ball             12    4    7    0   0   2/3    66.7     0/0   0.0
Jimmy Brogdon          12    2    3    1   0   1/2    50.0     0/0   0.0

TEAM: FG: 14/19 (73.7%), 3PT: 6/7 (85.7%), REB: 13 (4 off, 9 def), AST: 6, TO: 3
TEAM FOULS: 8 [Team_075 in BONUS]

================================================================================

================================================================================
                       2ND QUARTER - Team_075 vs Team_028                       
================================================================================

[12:00] Team_075 possession (Score: 29-38)
FOUL! Shooting foul on Kawhi Ball. Klay Jokic to the line for 2 free throws. [Team fouls: 1] (Kawhi Ball: 1 personal fouls)   FT 1/2: GOOD   FT 2/2: GOOD Klay Jokic makes 2/2 from the line.
Score: 31-38

[11:45] Team_028 possession (Score: 31-38)
Jimmy Brogdon makes the Layup and draws the foul on Derrick Stewart! And-1! Jimmy Brogdon to the line for 1. [Team fouls: 1] (Derrick Stewart: 1 personal fouls)   FT 1/1: GOOD Jimmy Brogdon makes 1/1 from the line.
Score: 31-41

[11:31] Team_075 possession (Score: 31-41)
Larry McCollum attempts a 3Pt. Contested by Austin Russell (4.9 feet, MAN). LARRY MCCOLLUM MAKES IT! Assist: Derrick Stewart
Score: 34-41

[11:13] Team_028 possession (Score: 34-41)
Carmelo Carter attempts a Midrange. Wide open! Myles Barrett is 6.5 feet away. [ZONE] Carmelo Carter misses. Rebound secured by Derrick Stewart.

[10:59] Team_075 possession (Score: 34-41)
Larry McCollum attempts a 3Pt. Contested by Austin Russell (4.9 feet, MAN). Larry McCollum misses. FOUL! Loose ball foul on Carmelo Carter during the rebound battle. [Team fouls: 2] No free throws, side out. (Carmelo Carter: 1 personal fouls)

[10:47] Team_075 possession (Score: 34-41)
Klay Jokic attempts a Layup. Contested by Jimmy Brogdon (5.2 feet, MAN). KLAY JOKIC MAKES IT! Assist: Larry McCollum
Score: 36-41

[10:30] Team_028 possession (Score: 36-41)
FOUL! Shooting foul on Larry McCollum. Carmelo Carter to the line for 3 free throws. [Team fouls: 2] (Larry McCollum: 1 personal fouls)   FT 1/3: GOOD   FT 2/3: GOOD   FT 3/3: GOOD Carmelo Carter makes 3/3 from the line.
Score: 36-44

[10:14] Team_075 possession (Score: 36-44)
Larry McCollum attempts a 3Pt. Contested by Austin Russell (5.0 feet, MAN). LARRY MCCOLLUM MAKES IT! Assist: Kawhi Ingram
Score: 39-44

[09:58] Team_028 possession (Score: 39-44)
Kawhi Ball attempts a Midrange. Contested by Derrick Stewart (5.2 feet, ZONE). KAWHI BALL MAKES IT! Assist: Jimmy Brogdon
Score: 39-46

[09:49] Team_075 possession (Score: 39-46)
Myles Barrett attempts a 3Pt. Contested by Myles Haliburton (4.3 feet, MAN). Myles Barrett misses. Rebound secured by Kawhi Ball.

[09:37] Team_028 possession (Score: 39-46)
Jimmy Brogdon attempts a 3Pt. Wide open! Klay Jokic is 6.3 feet away. [MAN] Jimmy Brogdon misses. Rebound secured by Kawhi Ingram.

[09:25] Team_075 possession (Score: 39-46)
Klay Jokic drives and kicks out. Kawhi Ingram attempts a 3Pt. Contested by Austin Russell (5.1 feet, ZONE). KAWHI INGRAM MAKES IT! Assist: Derrick Stewart
Score: 42-46

[09:10] Team_028 possession (Score: 42-46)
Carmelo Carter attempts a 3Pt. Wide open! Myles Barrett is 6.7 feet away. [ZONE] Carmelo Carter misses. Rebound secured by Klay Jokic.

[08:59] Team_075 possession (Score: 42-46)
Derrick Stewart attempts a 3Pt. Contested by Austin Russell (5.0 feet, ZONE). Derrick Stewart misses. Rebound secured by Jimmy Brogdon.

[08:43] Team_028 possession (Score: 42-46)
Carmelo Carter attempts a Layup. BLOCKED BY DERRICK STEWART! Ball is loose! Rebound secured by Klay Jokic.

[08:34] Team_075 possession (Score: 42-46)
FOUL! Reach-in foul on Kawhi Ball during the drive. [Team fouls: 3] No free throws, side out. (Kawhi Ball: 2 personal fouls)

[08:22] Team_075 possession (Score: 42-46)
Derrick Stewart attempts a Layup. Contested by Kawhi Ball (5.1 feet, ZONE). DERRICK STEWART MAKES IT! Assist: Myles Barrett
Score: 44-46

[08:09] Team_028 possession (Score: 44-46)
Kawhi Ball makes the Layup and draws the foul on Derrick Stewart! And-1! Kawhi Ball to the line for 1. [Team fouls: 3] (Derrick Stewart: 2 personal fouls)   FT 1/1: GOOD Kawhi Ball makes 1/1 from the line.
Score: 44-49

[07:53] Team_075 possession (Score: 44-49)
Larry McCollum attempts a 3Pt. Contested by Austin Russell (5.3 feet, ZONE). Larry McCollum misses. Rebound secured by Carmelo Carter.

[07:40] Team_028 possession (Score: 44-49)
Myles Haliburton drives, Myles Barrett stays with him. Myles Haliburton attempts a Dunk. Wide open! Myles Barrett is 6.7 feet away. [MAN] MYLES HALIBURTON MAKES IT! Assist: Austin Russell
Score: 44-51

[07:29] Team_075 possession (Score: 44-51)
Derrick Stewart attempts a 3Pt. Contested by Kawhi Ball (5.2 feet, MAN). DERRICK STEWART MAKES IT! Assist: Klay Jokic
Score: 47-51

[07:12] Team_028 possession (Score: 47-51)
Carmelo Carter attempts a Midrange. Contested by Kawhi Ingram (5.4 feet, MAN). Carmelo Carter misses. Offensive rebound by Kawhi Ball! Kawhi Ball kicks it out.

[07:01] Team_028 possession (Score: 47-51)
Carmelo Carter attempts a Midrange. Contested by Kawhi Ingram (5.4 feet, MAN). Carmelo Carter misses. Rebound secured by Kawhi Ingram.

[06:47] Team_075 possession (Score: 47-51)
Derrick Stewart drives, Kawhi Ball stays with him. Derrick Stewart attempts a Dunk. Contested by Kawhi Ball (5.4 feet, ZONE). Derrick Stewart misses. Rebound secured by Jimmy Brogdon.

[06:32] Team_028 possession (Score: 47-51)
Jimmy Brogdon attempts a Layup. Wide open! Klay Jokic is 6.7 feet away. [MAN] Jimmy Brogdon misses. Offensive rebound by Jimmy Brogdon! Jimmy Brogdon kicks it out.

[06:19] Team_028 possession (Score: 47-51)
Kawhi Ball makes the Layup and draws the foul on Derrick Stewart! And-1! Kawhi Ball to the line for 1. [Team fouls: 4] (Derrick Stewart: 3 personal fouls)   FT 1/1: MISS Kawhi Ball makes 0/1 from the line. Rebound secured by Derrick Stewart.
Score: 47-53

[06:00] Team_075 possession (Score: 47-53)
Larry McCollum attempts a 3Pt. Contested by Austin Russell (5.5 feet, ZONE). Larry McCollum misses. Rebound secured by Jimmy Brogdon.

[05:45] Team_028 possession (Score: 47-53)
Carmelo Carter attempts a 3Pt. Contested by Larry McCollum (5.7 feet, ZONE). Carmelo Carter misses. Rebound secured by Derrick Stewart.

[05:30] Team_075 possession (Score: 47-53)
Larry McCollum attempts a 3Pt. Contested by Austin Russell (5.6 feet, MAN). Larry McCollum misses. Offensive rebound by Derrick Stewart! Derrick Stewart kicks it out.

[05:18] Team_075 possession (Score: 47-53)
Myles Barrett attempts a Layup. Contested by Myles Haliburton (5.0 feet, MAN). Myles Barrett misses. Rebound secured by Jimmy Brogdon.

[05:06] Team_028 possession (Score: 47-53)
Jimmy Brogdon attempts a Layup. Wide open! Derrick Stewart is 6.1 feet away. [ZONE] JIMMY BROGDON MAKES IT!
Score: 47-55

[04:57] Team_075 possession (Score: 47-55)
Kawhi Ingram attempts a 3Pt. Contested by Austin Russell (5.4 feet, ZONE). KAWHI INGRAM MAKES IT! Assist: Klay Jokic
Score: 50-55

[04:44] Team_028 possession (Score: 50-55)
Carmelo Carter attempts a 3Pt. Contested by Larry McCollum (5.9 feet, ZONE). Carmelo Carter misses. Rebound secured by Derrick Stewart.

[04:31] Team_075 possession (Score: 50-55)
Derrick Stewart makes the Layup and draws the foul on Kawhi Ball! And-1! Derrick Stewart to the line for 1. [Team fouls: 4] (Kawhi Ball: 3 personal fouls)   FT 1/1: MISS Derrick Stewart makes 0/1 from the line. Offensive rebound by Kawhi Ingram! Kawhi Ingram kicks it out.
Score: 52-55

[04:15] Team_075 possession (Score: 52-55)
Kawhi Ingram attempts a 3Pt. Contested by Austin Russell (5.5 feet, ZONE). Kawhi Ingram misses. Rebound secured by Jimmy Brogdon.

[03:57] Team_028 possession (Score: 52-55)
Kawhi Ball attempts a Layup. Wide open! Derrick Stewart is 6.1 feet away. [MAN] KAWHI BALL MAKES IT! Assist: Carmelo Carter
Score: 52-57

[03:42] Team_075 possession (Score: 52-57)
Derrick Stewart attempts a Midrange. Contested by Carmelo Carter (5.8 feet, ZONE). Derrick Stewart misses. Rebound secured by Carmelo Carter.

[03:26] Team_028 possession (Score: 52-57)
Jimmy Brogdon attempts a 3Pt. Wide open! Kawhi Ingram is 6.1 feet away. [ZONE] Jimmy Brogdon misses. Rebound secured by Klay Jokic.

[03:13] Team_075 possession (Score: 52-57)
Kawhi Ingram drives to the basket... Kawhi Ingram throws a bad pass out of bounds! TURNOVER! (dead ball)

[03:13] Substitution (Team_075): Larry McCollum OUT → D'Angelo Anunoby IN (stamina_rule2)

[03:13] Substitution (Team_075): Kawhi Ingram OUT → LeBron Ginobili IN (stamina_rule2)

[03:13] Substitution (Team_075): Myles Barrett OUT → Donovan Paul IN (stamina_rule2)

[03:13] Substitution (Team_075): Derrick Stewart OUT → Collin Duncan IN (stamina_rule2)

[03:13] Substitution (Team_075): Klay Jokic OUT → Kevin Towns IN (stamina_rule2)

[03:13] Substitution (Team_028): Austin Russell OUT → Scottie Ingram IN (stamina_rule2)

[03:13] Substitution (Team_028): Carmelo Carter OUT → Tyrese Quickley IN (stamina_rule2)

[03:13] Substitution (Team_028): Myles Haliburton OUT → Miles Booker IN (stamina_rule2)

[03:13] Substitution (Team_028): Kawhi Ball OUT → Bam Towns IN (stamina_rule2)

[03:13] Substitution (Team_028): Jimmy Brogdon OUT → Collin Bridges IN (stamina_rule2)

[03:00] Team_028 possession (Score: 52-57)
Miles Booker attempts a 3Pt. Contested by D'Angelo Anunoby (5.2 feet, ZONE). Miles Booker misses. Rebound secured by Kevin Towns.

[02:41] Team_075 possession (Score: 52-57)
Kevin Towns drives to the basket... Kevin Towns loses control! Ball rolls out of bounds! TURNOVER! (dead ball)

[02:25] Team_028 possession (Score: 52-57)
Scottie Ingram attempts a 3Pt. Contested by D'Angelo Anunoby (5.3 feet, MAN). Scottie Ingram misses. Rebound secured by Collin Duncan.

[02:13] Team_075 possession (Score: 52-57)
LeBron Ginobili makes the Midrange and draws the foul on Tyrese Quickley! And-1! LeBron Ginobili to the line for 1. [BONUS: 5 team fouls] (Tyrese Quickley: 1 personal fouls)   FT 1/1: GOOD LeBron Ginobili makes 1/1 from the line.
Score: 55-57

[01:58] Team_028 possession (Score: 55-57)
Bam Towns attempts a 3Pt. Contested by Collin Duncan (5.7 feet, MAN). BAM TOWNS MAKES IT! Assist: Scottie Ingram
Score: 55-60

[01:44] Team_075 possession (Score: 55-60)
Kevin Towns attempts a Layup. Contested by Collin Bridges (4.2 feet, MAN). Kevin Towns misses. Rebound secured by Collin Bridges.

[01:29] Team_028 possession (Score: 55-60)
Scottie Ingram drives to the basket... FOUL! Offensive foul on Scottie Ingram! Kevin Towns drew the charge! [Team fouls: 6] (Scottie Ingram: 1 personal fouls) TURNOVER! (dead ball)

[01:18] Team_075 possession (Score: 55-60)
Kevin Towns attempts a Midrange. Contested by Collin Bridges (4.2 feet, MAN). Kevin Towns misses. Rebound secured by Collin Bridges.

[01:04] Team_028 possession (Score: 55-60)
Scottie Ingram drives, D'Angelo Anunoby stays with him. Scottie Ingram attempts a Layup. Contested by D'Angelo Anunoby (5.3 feet, MAN). Scottie Ingram misses. Rebound secured by Collin Duncan.

[00:47] Team_075 possession (Score: 55-60)
Collin Duncan attempts a Layup. Contested by Collin Bridges (3.8 feet, ZONE). Collin Duncan misses. Offensive rebound by Collin Duncan! Collin Duncan kicks it out.

[00:32] Team_075 possession (Score: 55-60)
Donovan Paul attempts a 3Pt. Wide open! Miles Booker is 6.4 feet away. [MAN] DONOVAN PAUL MAKES IT! Assist: LeBron Ginobili
Score: 58-60

[00:15] Team_028 possession (Score: 58-60)
Bam Towns attempts a 3Pt. Contested by D'Angelo Anunoby (5.3 feet, ZONE). BAM TOWNS MAKES IT! Assist: Tyrese Quickley
Score: 58-63

================================================================================
                              2ND QUARTER COMPLETE                              
================================================================================

2ND QUARTER SCORE: Team_075 29, Team_028 25

BOX SCORE:
================================================================================

Team_075
--------------------------------------------------------------------------------
Player                MIN  PTS  REB  AST  TO      FG   FG%      3P   3P%
--------------------------------------------------------------------------------
Larry McCollum         21    6    0    1   0   2/4    50.0     0/0   0.0
Kawhi Ingram           21    6    4    1   0   2/3    66.7     0/0   0.0
Derrick Stewart        21    5    5    2   0   2/5    40.0     0/0   0.0
Klay Jokic             21    4    3    2   0   2/2   100.0     0/0   0.0
LeBron Ginobili         3    3    0    1   0   1/1   100.0     0/0   0.0
Donovan Paul            3    3    0    0   0   1/1   100.0     0/0   0.0
Myles Barrett          21    0    0    1   0   0/2     0.0     0/0   0.0
Kevin Towns             3    0    1    0   0   0/2     0.0     0/0   0.0
Collin Duncan           3    0    3    0   0   0/0     0.0     0/0   0.0

TEAM: FG: 10/20 (50.0%), 3PT: 5/10 (50.0%), REB: 16 (4 off, 12 def), AST: 8, TO: 2
TEAM FOULS: 4


Team_028
--------------------------------------------------------------------------------
Player                MIN  PTS  REB  AST  TO      FG   FG%      3P   3P%
--------------------------------------------------------------------------------
Kawhi Ball             21    7    2    0   0   3/4    75.0     0/0   0.0
Bam Towns               3    6    0    0   0   2/2   100.0     0/0   0.0
Jimmy Brogdon          21    5    6    1   0   2/4    50.0     0/0   0.0
Carmelo Carter         21    3    2    1   0   1/7    14.3     0/0   0.0
Myles Haliburton       21    2    0    0   0   1/1   100.0     0/0   0.0
Austin Russell         21    0    0    1   0   0/0     0.0     0/0   0.0
Miles Booker            3    0    0    0   0   0/1     0.0     0/0   0.0
Scottie Ingram          3    0    0    1   0   0/2     0.0     0/0   0.0
Collin Bridges          3    0    2    0   0   0/0     0.0     0/0   0.0
Tyrese Quickley         3    0    0    1   0   0/0     0.0     0/0   0.0

TEAM: FG: 9/21 (42.9%), 3PT: 3/10 (30.0%), REB: 12 (2 off, 10 def), AST: 5, TO: 1
TEAM FOULS: 6 [Team_075 in BONUS]

================================================================================

================================================================================
                       3RD QUARTER - Team_075 vs Team_028                       
================================================================================

[12:00] Team_075 possession (Score: 58-63)
Derrick Stewart loses the ball! Stripped by Kawhi Ball! TURNOVER! (live ball)

[11:43] Team_028 possession (Score: 58-63)
Carmelo Carter makes the Midrange and draws the foul on Kawhi Ingram! And-1! Carmelo Carter to the line for 1. [Team fouls: 1] (Kawhi Ingram: 1 personal fouls)   FT 1/1: GOOD Carmelo Carter makes 1/1 from the line.
Score: 58-66

[11:25] Team_075 possession (Score: 58-66)
Kawhi Ingram drives, Kawhi Ball stays with him. Kawhi Ingram attempts a Layup. Contested by Kawhi Ball (4.1 feet, ZONE). Kawhi Ingram misses. Rebound secured by Jimmy Brogdon.

[11:10] Team_028 possession (Score: 58-66)
Myles Haliburton drives, Derrick Stewart stays with him. Myles Haliburton attempts a Dunk. Contested by Derrick Stewart (4.6 feet, ZONE). Myles Haliburton misses. Rebound secured by Klay Jokic.

[10:54] Team_075 possession (Score: 58-66)
Myles Barrett attempts a Midrange. Contested by Myles Haliburton (3.9 feet, MAN). Myles Barrett misses. Rebound secured by Kawhi Ball.

[10:36] Team_028 possession (Score: 58-66)
FOUL! Holding foul on Kawhi Ingram. [Team fouls: 2] No free throws, side out. (Kawhi Ingram: 2 personal fouls)

[10:21] Team_028 possession (Score: 58-66)
Jimmy Brogdon attempts a Layup. Contested by Klay Jokic (5.9 feet, MAN). JIMMY BROGDON MAKES IT! Assist: Austin Russell
Score: 58-68

[10:05] Team_075 possession (Score: 58-68)
Klay Jokic drives, Jimmy Brogdon stays with him. Klay Jokic attempts a Layup. Contested by Jimmy Brogdon (4.8 feet, MAN). Klay Jokic misses. Offensive rebound by Kawhi Ingram! Kawhi Ingram kicks it out.

[09:54] Team_075 possession (Score: 58-68)
Larry McCollum attempts a 3Pt. Contested by Austin Russell (4.6 feet, MAN). LARRY MCCOLLUM MAKES IT! Assist: Klay Jokic
Score: 61-68

[09:37] Team_028 possession (Score: 61-68)
Kawhi Ball attempts a Layup. Contested by Derrick Stewart (4.7 feet, MAN). KAWHI BALL MAKES IT! Assist: Austin Russell
Score: 61-70

[09:25] Team_075 possession (Score: 61-70)
Klay Jokic throws a bad pass! Stolen by Jimmy Brogdon! TURNOVER! (live ball)

[09:14] Team_028 possession (Score: 61-70)
Myles Haliburton attempts a 3Pt. Contested by Larry McCollum (4.3 feet, ZONE). Myles Haliburton misses. Rebound secured by Kawhi Ingram.

[08:58] Team_075 possession (Score: 61-70)
Larry McCollum attempts a 3Pt. Contested by Austin Russell (4.6 feet, ZONE). LARRY MCCOLLUM MAKES IT! Assist: Derrick Stewart
Score: 64-70

[08:44] Team_028 possession (Score: 64-70)
Carmelo Carter attempts a Midrange. Contested by Kawhi Ingram (4.3 feet, MAN). CARMELO CARTER MAKES IT! Assist: Myles Haliburton
Score: 64-72

[08:29] Team_075 possession (Score: 64-72)
FOUL! Shooting foul on Jimmy Brogdon. Klay Jokic to the line for 2 free throws. [Team fouls: 1] (Jimmy Brogdon: 1 personal fouls)   FT 1/2: GOOD   FT 2/2: MISS Klay Jokic makes 1/2 from the line. Rebound secured by Carmelo Carter.
Score: 65-72

[08:14] Team_028 possession (Score: 65-72)
Kawhi Ball attempts a 3Pt. Contested by Larry McCollum (4.4 feet, ZONE). Kawhi Ball misses. Rebound secured by Klay Jokic.

[08:00] Team_075 possession (Score: 65-72)
Kawhi Ingram drives and kicks out. Klay Jokic attempts a 3Pt. Contested by Jimmy Brogdon (4.2 feet, MAN). Klay Jokic misses. Offensive rebound by Kawhi Ingram! Kawhi Ingram kicks it out.

[07:49] Team_075 possession (Score: 65-72)
Larry McCollum attempts a 3Pt. Contested by Austin Russell (4.6 feet, ZONE). LARRY MCCOLLUM MAKES IT! Assist: Myles Barrett
Score: 68-72

[07:30] Team_028 possession (Score: 68-72)
Kawhi Ball makes the Layup and draws the foul on Derrick Stewart! And-1! Kawhi Ball to the line for 1. [Team fouls: 3] (Derrick Stewart: 1 personal fouls)   FT 1/1: GOOD Kawhi Ball makes 1/1 from the line.
Score: 68-75

[07:12] Team_075 possession (Score: 68-75)
FOUL! Shooting foul on Carmelo Carter. Kawhi Ingram to the line for 2 free throws. [Team fouls: 2] (Carmelo Carter: 1 personal fouls)   FT 1/2: GOOD   FT 2/2: MISS Kawhi Ingram makes 1/2 from the line. Rebound secured by Carmelo Carter.
Score: 69-75

[07:01] Team_028 possession (Score: 69-75)
FOUL! Shooting foul on Myles Barrett. Myles Haliburton to the line for 2 free throws. [Team fouls: 4] (Myles Barrett: 1 personal fouls)   FT 1/2: GOOD   FT 2/2: GOOD Myles Haliburton makes 2/2 from the line.
Score: 69-77

[06:43] Team_075 possession (Score: 69-77)
Larry McCollum drives and kicks out. Klay Jokic attempts a 3Pt. Contested by Austin Russell (4.4 feet, ZONE). Klay Jokic misses. Rebound secured by Carmelo Carter.

[06:33] Team_028 possession (Score: 69-77)
Kawhi Ball attempts a Dunk. BLOCKED BY LARRY MCCOLLUM! Ball is loose! Rebound secured by Klay Jokic.

[06:20] Team_075 possession (Score: 69-77)
FOUL! Shooting foul on Kawhi Ball. Klay Jokic to the line for 2 free throws. [Team fouls: 3] (Kawhi Ball: 1 personal fouls)   FT 1/2: MISS   FT 2/2: GOOD Klay Jokic makes 1/2 from the line.
Score: 70-77

[06:03] Team_028 possession (Score: 70-77)
Austin Russell attempts a Midrange. Contested by Kawhi Ingram (3.9 feet, ZONE). AUSTIN RUSSELL MAKES IT! Assist: Myles Haliburton
Score: 70-79

[05:45] Team_075 possession (Score: 70-79)
FOUL! Shooting foul on Jimmy Brogdon. Klay Jokic to the line for 3 free throws. [Team fouls: 4] (Jimmy Brogdon: 2 personal fouls)   FT 1/3: GOOD   FT 2/3: GOOD   FT 3/3: GOOD Klay Jokic makes 3/3 from the line.
Score: 73-79

[05:25] Team_028 possession (Score: 73-79)
Kawhi Ball attempts a Midrange. Contested by Derrick Stewart (4.7 feet, MAN). Kawhi Ball misses. Rebound secured by Klay Jokic.

[05:13] Team_075 possession (Score: 73-79)
Klay Jokic attempts a Midrange. Contested by Jimmy Brogdon (4.8 feet, MAN). Klay Jokic misses. Offensive rebound by Kawhi Ingram! Kawhi Ingram kicks it out.

[05:01] Team_075 possession (Score: 73-79)
Derrick Stewart drives, picks up Kawhi Ball. Help arrives from Carmelo Carter! Derrick Stewart attempts a Dunk. Contested by Carmelo Carter (4.2 feet, MAN). Derrick Stewart misses. Rebound secured by Carmelo Carter.

[04:49] Team_028 possession (Score: 73-79)
Jimmy Brogdon makes the Layup and draws the foul on Klay Jokic! And-1! Jimmy Brogdon to the line for 1. [BONUS: 5 team fouls] (Klay Jokic: 1 personal fouls)   FT 1/1: GOOD Jimmy Brogdon makes 1/1 from the line.
Score: 73-82

[04:34] Team_075 possession (Score: 73-82)
Derrick Stewart attempts a Midrange. BLOCKED BY MYLES HALIBURTON! Ball is loose! Rebound secured by Jimmy Brogdon.

[04:15] Team_028 possession (Score: 73-82)
Myles Haliburton attempts a Midrange. Contested by Kawhi Ingram (4.2 feet, ZONE). Myles Haliburton misses. Offensive rebound by Jimmy Brogdon! Jimmy Brogdon kicks it out.

[04:00] Team_028 possession (Score: 73-82)
Myles Haliburton attempts a Midrange. Wide open! Myles Barrett is 6.1 feet away. [MAN] MYLES HALIBURTON MAKES IT!
Score: 73-84

[03:45] Team_075 possession (Score: 73-84)
FOUL! Reach-in foul on Kawhi Ball during the drive. [IN THE BONUS! 5 team fouls] Klay Jokic to the line for 2 free throws. (Kawhi Ball: 2 personal fouls)   FT 1/2: GOOD   FT 2/2: GOOD Klay Jokic makes 2/2 from the line.
Score: 75-84

[03:33] Team_028 possession (Score: 75-84)
FOUL! Offensive foul on Kawhi Ball! Derrick Stewart drew the charge! [Team fouls: 6] (Kawhi Ball: 3 personal fouls) TURNOVER! (dead ball)

[03:16] Team_075 possession (Score: 75-84)
Larry McCollum attempts a 3Pt. Contested by Austin Russell (4.7 feet, ZONE). Larry McCollum misses. Offensive rebound by Kawhi Ingram! Kawhi Ingram kicks it out.

[03:02] Team_075 possession (Score: 75-84)
Myles Barrett drives, Kawhi Ball stays with him. Myles Barrett attempts a Dunk. Contested by Kawhi Ball (4.7 feet, ZONE). MYLES BARRETT MAKES IT! Assist: Klay Jokic
Score: 77-84

[02:48] Team_028 possession (Score: 77-84)
Jimmy Brogdon loses the ball! Stripped by Klay Jokic! TURNOVER! (live ball)

[02:36] Team_075 possession (Score: 77-84)
Larry McCollum attempts a 3Pt. Contested by Austin Russell (4.8 feet, MAN). Larry McCollum misses. Offensive rebound by Derrick Stewart! Derrick Stewart kicks it out.

[02:22] Team_075 possession (Score: 77-84)
Kawhi Ingram attempts a 3Pt. Contested by Austin Russell (4.5 feet, ZONE). KAWHI INGRAM MAKES IT! Assist: Myles Barrett
Score: 80-84

[02:10] Team_028 possession (Score: 80-84)
Kawhi Ball attempts a 3Pt. Contested by Larry McCollum (4.7 feet, ZONE). KAWHI BALL MAKES IT! Assist: Jimmy Brogdon
Score: 80-87

[01:55] Team_075 possession (Score: 80-87)
Derrick Stewart attempts a Layup. Contested by Kawhi Ball (4.5 feet, MAN). Derrick Stewart misses. Rebound secured by Jimmy Brogdon.

[01:41] Team_028 possession (Score: 80-87)
Kawhi Ball drives to the basket... Kawhi Ball throws a bad pass out of bounds! TURNOVER! (dead ball)

[01:41] Substitution (Team_075): Larry McCollum OUT → D'Angelo Anunoby IN (stamina_rule2)

[01:41] Substitution (Team_075): Kawhi Ingram OUT → LeBron Ginobili IN (stamina_rule2)

[01:41] Substitution (Team_075): Myles Barrett OUT → Donovan Paul IN (stamina_rule2)

[01:41] Substitution (Team_075): Derrick Stewart OUT → Collin Duncan IN (stamina_rule2)

[01:41] Substitution (Team_075): Klay Jokic OUT → Kevin Towns IN (stamina_rule2)

[01:41] Substitution (Team_028): Austin Russell OUT → Scottie Ingram IN (stamina_rule2)

[01:41] Substitution (Team_028): Carmelo Carter OUT → Tyrese Quickley IN (stamina_rule2)

[01:41] Substitution (Team_028): Myles Haliburton OUT → Miles Booker IN (stamina_rule2)

[01:41] Substitution (Team_028): Kawhi Ball OUT → Bam Towns IN (stamina_rule2)

[01:41] Substitution (Team_028): Jimmy Brogdon OUT → Collin Bridges IN (stamina_rule2)

[01:26] Team_075 possession (Score: 80-87)
D'Angelo Anunoby attempts a Midrange. Contested by Scottie Ingram (5.5 feet, MAN). D'ANGELO ANUNOBY MAKES IT! Assist: Kevin Towns
Score: 82-87

[01:15] Team_028 possession (Score: 82-87)
Miles Booker drives, Kevin Towns stays with him. Miles Booker attempts a Layup. Contested by Kevin Towns (5.4 feet, ZONE). MILES BOOKER MAKES IT! Assist: Tyrese Quickley
Score: 82-89

[00:59] Team_075 possession (Score: 82-89)
Donovan Paul attempts a 3Pt. Wide open! Scottie Ingram is 6.0 feet away. [ZONE] DONOVAN PAUL MAKES IT! Assist: Kevin Towns
Score: 85-89

[00:45] Team_028 possession (Score: 85-89)
Tyrese Quickley drives, picks up LeBron Ginobili. Help arrives from D'Angelo Anunoby! Tyrese Quickley attempts a Layup. Contested by D'Angelo Anunoby (5.0 feet, MAN). TYRESE QUICKLEY MAKES IT! Assist: Collin Bridges
Score: 85-91

[00:26] Team_075 possession (Score: 85-91)
Donovan Paul drives, Collin Bridges stays with him. Donovan Paul attempts a Layup. Contested by Collin Bridges (4.2 feet, ZONE). DONOVAN PAUL MAKES IT! Assist: LeBron Ginobili
Score: 87-91

[00:16] Team_028 possession (Score: 87-91)
Miles Booker attempts a 3Pt. Contested by Donovan Paul (5.8 feet, MAN). Miles Booker misses. Rebound secured by Collin Duncan.

[00:04] Team_075 possession (Score: 87-91)
Kevin Towns drives to the basket... Kevin Towns throws a bad pass! Stolen by Collin Bridges! TURNOVER! (live ball)

================================================================================
                              3RD QUARTER COMPLETE                              
================================================================================

3RD QUARTER SCORE: Team_075 29, Team_028 28

BOX SCORE:
================================================================================

Team_075
--------------------------------------------------------------------------------
Player                MIN  PTS  REB  AST  TO      FG   FG%      3P   3P%
--------------------------------------------------------------------------------
Larry McCollum         32    9    0    0   0   3/4    75.0     0/0   0.0
Klay Jokic             32    6    4    2   0   3/4    75.0     0/0   0.0
Donovan Paul            5    5    0    0   0   2/2   100.0     0/0   0.0
Kawhi Ingram           32    3    5    0   0   1/3    33.3     0/0   0.0
Myles Barrett          32    2    0    2   0   1/2    50.0     0/0   0.0
D'Angelo Anunoby        5    2    0    0   0   1/1   100.0     0/0   0.0
Derrick Stewart        32    0    1    1   0   0/3     0.0     0/0   0.0
Kevin Towns             5    0    0    2   0   0/0     0.0     0/0   0.0
LeBron Ginobili         5    0    0    1   0   0/0     0.0     0/0   0.0
Collin Duncan           5    0    1    0   0   0/0     0.0     0/0   0.0

TEAM: FG: 11/19 (57.9%), 3PT: 6/6 (100.0%), REB: 11 (5 off, 6 def), AST: 8, TO: 3
TEAM FOULS: 5 [Team_028 in BONUS]


Team_028
--------------------------------------------------------------------------------
Player                MIN  PTS  REB  AST  TO      FG   FG%      3P   3P%
--------------------------------------------------------------------------------
Kawhi Ball             32    8    1    0   0   3/6    50.0     0/0   0.0
Carmelo Carter         32    5    4    0   0   2/2   100.0     0/0   0.0
Jimmy Brogdon          32    5    4    1   0   2/2   100.0     0/0   0.0
Myles Haliburton       32    4    0    2   0   2/4    50.0     0/0   0.0
Austin Russell         32    2    0    2   0   1/1   100.0     0/0   0.0
Miles Booker            5    2    0    0   0   1/2    50.0     0/0   0.0
Tyrese Quickley         5    2    0    1   0   1/1   100.0     0/0   0.0
Collin Bridges          5    0    0    1   0   0/0     0.0     0/0   0.0

TEAM: FG: 12/18 (66.7%), 3PT: 1/4 (25.0%), REB: 9 (1 off, 8 def), AST: 7, TO: 3
TEAM FOULS: 6 [Team_075 in BONUS]

================================================================================

================================================================================
                       4TH QUARTER - Team_075 vs Team_028                       
================================================================================

[12:00] Team_075 possession (Score: 87-91)
Klay Jokic attempts a Midrange. Contested by Jimmy Brogdon (4.8 feet, MAN). KLAY JOKIC MAKES IT!
Score: 89-91

[11:45] Team_028 possession (Score: 89-91)
Austin Russell attempts a 3Pt. Contested by Larry McCollum (4.2 feet, MAN). Austin Russell misses. Rebound secured by Klay Jokic.

[11:29] Team_075 possession (Score: 89-91)
Derrick Stewart attempts a Layup. Contested by Kawhi Ball (4.3 feet, MAN). DERRICK STEWART MAKES IT! Assist: Myles Barrett
Score: 91-91

[11:12] Team_028 possession (Score: 91-91)
FOUL! Shooting foul on Derrick Stewart. Carmelo Carter to the line for 2 free throws. [Team fouls: 1] (Derrick Stewart: 1 personal fouls)   FT 1/2: MISS   FT 2/2: GOOD Carmelo Carter makes 1/2 from the line.
Score: 91-92

[10:54] Team_075 possession (Score: 91-92)
Derrick Stewart makes the Layup and draws the foul on Kawhi Ball! And-1! Derrick Stewart to the line for 1. [Team fouls: 1] (Kawhi Ball: 1 personal fouls)   FT 1/1: GOOD Derrick Stewart makes 1/1 from the line.
Score: 94-92

[10:38] Team_028 possession (Score: 94-92)
FOUL! Reach-in foul on Larry McCollum during the drive. [Team fouls: 2] No free throws, side out. (Larry McCollum: 1 personal fouls)

[10:25] Team_028 possession (Score: 94-92)
Carmelo Carter attempts a Midrange. Contested by Kawhi Ingram (4.6 feet, ZONE). CARMELO CARTER MAKES IT! Assist: Jimmy Brogdon
Score: 94-94

[10:06] Team_075 possession (Score: 94-94)
FOUL! Offensive foul on Larry McCollum! Austin Russell drew the charge! [Team fouls: 3] (Larry McCollum: 2 personal fouls) TURNOVER! (dead ball)

[09:48] Team_028 possession (Score: 94-94)
Carmelo Carter attempts a 3Pt. Contested by Kawhi Ingram (4.6 feet, MAN). Carmelo Carter misses. Offensive rebound by Jimmy Brogdon! Jimmy Brogdon kicks it out.

[09:33] Team_028 possession (Score: 94-94)
Myles Haliburton attempts a Layup. Contested by Derrick Stewart (4.9 feet, ZONE). MYLES HALIBURTON MAKES IT! Assist: Kawhi Ball
Score: 94-96

[09:20] Team_075 possession (Score: 94-96)
FOUL! Shooting foul on Kawhi Ball. Kawhi Ingram to the line for 2 free throws. [Team fouls: 2] (Kawhi Ball: 2 personal fouls)   FT 1/2: GOOD   FT 2/2: GOOD Kawhi Ingram makes 2/2 from the line.
Score: 96-96

[09:06] Team_028 possession (Score: 96-96)
Austin Russell attempts a Layup. Contested by Derrick Stewart (4.7 feet, ZONE). AUSTIN RUSSELL MAKES IT! Assist: Myles Haliburton
Score: 96-98

[08:48] Team_075 possession (Score: 96-98)
Kawhi Ingram attempts a Midrange. Contested by Myles Haliburton (3.7 feet, ZONE). Kawhi Ingram misses. Rebound secured by Kawhi Ball.

[08:31] Team_028 possession (Score: 96-98)
Carmelo Carter drives, Kawhi Ingram stays with him. Carmelo Carter attempts a Layup. Contested by Kawhi Ingram (4.8 feet, MAN). Carmelo Carter misses. Rebound secured by Kawhi Ingram.

[08:17] Team_075 possession (Score: 96-98)
Klay Jokic attempts a Layup. Contested by Kawhi Ball (5.2 feet, ZONE). KLAY JOKIC MAKES IT! Assist: Myles Barrett
Score: 98-98

[08:03] Team_028 possession (Score: 98-98)
FOUL! Shooting foul on Derrick Stewart. Kawhi Ball to the line for 2 free throws. [Team fouls: 4] (Derrick Stewart: 2 personal fouls)   FT 1/2: MISS   FT 2/2: MISS Kawhi Ball makes 0/2 from the line. FOUL! Loose ball foul on Kawhi Ingram during the free throw rebound! [IN THE BONUS! 5 team fouls] Jimmy Brogdon to the line for 2 free throws. (Kawhi Ingram: 1 personal fouls)   FT 1/2: GOOD   FT 2/2: GOOD Jimmy Brogdon makes 2/2 from the line.
Score: 98-100

[07:47] Team_075 possession (Score: 98-100)
Klay Jokic attempts a Midrange. Contested by Jimmy Brogdon (5.2 feet, MAN). Klay Jokic misses. Rebound secured by Jimmy Brogdon.

[07:33] Team_028 possession (Score: 98-100)
Kawhi Ball drives and kicks out. Kawhi Ball attempts a 3Pt. Contested by Derrick Stewart (5.0 feet, MAN). Kawhi Ball misses. Rebound secured by Kawhi Ingram.

[07:17] Team_075 possession (Score: 98-100)
Klay Jokic attempts a Layup. Contested by Jimmy Brogdon (5.3 feet, MAN). KLAY JOKIC MAKES IT! Assist: Larry McCollum
Score: 100-100

[07:03] Team_028 possession (Score: 100-100)
Austin Russell attempts a Midrange. Contested by Kawhi Ingram (4.5 feet, ZONE). AUSTIN RUSSELL MAKES IT!
Score: 100-102

[06:46] Team_075 possession (Score: 100-102)
Larry McCollum attempts a 3Pt. Contested by Austin Russell (5.1 feet, MAN). LARRY MCCOLLUM MAKES IT! Assist: Derrick Stewart
Score: 103-102

[06:34] Team_028 possession (Score: 103-102)
Kawhi Ball attempts a 3Pt. Contested by Larry McCollum (5.0 feet, ZONE). Kawhi Ball misses. Rebound secured by Kawhi Ingram.

[06:20] Team_075 possession (Score: 103-102)
Klay Jokic attempts a 3Pt. Contested by Jimmy Brogdon (5.4 feet, MAN). Klay Jokic misses. Rebound secured by Kawhi Ball.

[06:11] Team_028 possession (Score: 103-102)
Myles Haliburton throws a bad pass! Stolen by Myles Barrett! TURNOVER! (live ball)

[05:54] Team_075 possession (Score: 103-102)
FOUL! Reach-in foul on Austin Russell during the drive. [Team fouls: 3] No free throws, side out. (Austin Russell: 1 personal fouls)

[05:42] Team_075 possession (Score: 103-102)
Myles Barrett attempts a 3Pt. Contested by Austin Russell (5.3 feet, ZONE). Myles Barrett misses. FOUL! Loose ball foul on Jimmy Brogdon during the rebound battle. [Team fouls: 4] No free throws, side out. (Jimmy Brogdon: 1 personal fouls)

[05:29] Team_075 possession (Score: 103-102)
Larry McCollum attempts a 3Pt. Contested by Myles Haliburton (4.4 feet, ZONE). Larry McCollum misses. Offensive rebound by Derrick Stewart! Derrick Stewart kicks it out.

[05:14] Team_075 possession (Score: 103-102)
Kawhi Ingram attempts a Midrange. Contested by Kawhi Ball (5.0 feet, ZONE). KAWHI INGRAM MAKES IT!
Score: 105-102

[04:59] Team_028 possession (Score: 105-102)
Austin Russell drives, Derrick Stewart stays with him. Austin Russell attempts a Dunk. Contested by Derrick Stewart (5.2 feet, ZONE). Austin Russell misses. Rebound secured by Kawhi Ingram.

[04:41] Team_075 possession (Score: 105-102)
Larry McCollum attempts a 3Pt. Contested by Austin Russell (5.3 feet, ZONE). Larry McCollum misses. Offensive rebound by Kawhi Ingram! Kawhi Ingram kicks it out.

[04:30] Team_075 possession (Score: 105-102)
Klay Jokic attempts a Midrange. Contested by Myles Haliburton (4.8 feet, ZONE). Klay Jokic misses. Offensive rebound by Derrick Stewart! Derrick Stewart kicks it out.

[04:18] Team_075 possession (Score: 105-102)
Myles Barrett attempts a Layup. BLOCKED BY MYLES HALIBURTON! Ball is loose! Rebound secured by Kawhi Ball.

[04:06] Team_028 possession (Score: 105-102)
Austin Russell drives, Larry McCollum stays with him. Austin Russell attempts a Dunk. Contested by Larry McCollum (5.1 feet, MAN). Austin Russell misses. Rebound secured by Derrick Stewart.

[03:54] Team_075 possession (Score: 105-102)
Derrick Stewart drives and kicks out. Derrick Stewart attempts a Midrange. Contested by Carmelo Carter (5.5 feet, ZONE). Derrick Stewart misses. Rebound secured by Jimmy Brogdon.

[03:37] Team_028 possession (Score: 105-102)
Austin Russell drives to the basket... Austin Russell throws a bad pass! Stolen by Larry McCollum! TURNOVER! (live ball)

[03:23] Team_075 possession (Score: 105-102)
Klay Jokic makes the Layup and draws the foul on Jimmy Brogdon! And-1! Klay Jokic to the line for 1. [BONUS: 5 team fouls] (Jimmy Brogdon: 2 personal fouls)   FT 1/1: GOOD Klay Jokic makes 1/1 from the line.
Score: 108-102

[03:10] Team_028 possession (Score: 108-102)
Kawhi Ball attempts a Midrange. Wide open! Myles Barrett is 6.9 feet away. [ZONE] Kawhi Ball misses. Rebound secured by Kawhi Ingram.

[02:59] Team_075 possession (Score: 108-102)
Larry McCollum attempts a Midrange. Contested by Austin Russell (5.5 feet, MAN). LARRY MCCOLLUM MAKES IT!
Score: 110-102

[02:45] Team_028 possession (Score: 110-102)
Carmelo Carter attempts a 3Pt. Contested by Larry McCollum (5.7 feet, ZONE). Carmelo Carter misses. Rebound secured by Klay Jokic.

[02:35] Team_075 possession (Score: 110-102)
FOUL! Offensive foul on Larry McCollum! Austin Russell drew the charge! [Team fouls: 6] (Larry McCollum: 3 personal fouls) TURNOVER! (dead ball)

[02:24] Team_028 possession (Score: 110-102)
Austin Russell attempts a Midrange. Contested by Derrick Stewart (5.6 feet, ZONE). AUSTIN RUSSELL MAKES IT! Assist: Carmelo Carter
Score: 110-104

[02:09] Team_075 possession (Score: 110-104)
FOUL! Shooting foul on Myles Haliburton. Myles Barrett to the line for 2 free throws. [BONUS: 6 team fouls] (Myles Haliburton: 1 personal fouls)   FT 1/2: MISS   FT 2/2: MISS Myles Barrett makes 0/2 from the line. Rebound secured by Carmelo Carter.

[01:55] Team_028 possession (Score: 110-104)
Myles Haliburton loses the ball! Stripped by Myles Barrett! TURNOVER! (live ball)

[01:41] Team_075 possession (Score: 110-104)
FOUL! Reach-in foul on Kawhi Ball during the drive. [IN THE BONUS! 7 team fouls] Derrick Stewart to the line for 2 free throws. (Kawhi Ball: 3 personal fouls)   FT 1/2: GOOD   FT 2/2: GOOD Derrick Stewart makes 2/2 from the line.
Score: 112-104

[01:24] Team_028 possession (Score: 112-104)
FOUL! Reach-in foul on Derrick Stewart during the drive. [IN THE BONUS! 7 team fouls] Kawhi Ball to the line for 2 free throws. (Derrick Stewart: 3 personal fouls)   FT 1/2: GOOD   FT 2/2: MISS Kawhi Ball makes 1/2 from the line. Rebound secured by Klay Jokic.
Score: 112-105

[01:07] Team_075 possession (Score: 112-105)
Klay Jokic attempts a Midrange. Contested by Myles Haliburton (5.3 feet, ZONE). Klay Jokic misses. Offensive rebound by Kawhi Ingram! Kawhi Ingram kicks it out.

[00:50] Team_075 possession (Score: 112-105)
Kawhi Ingram makes the Midrange and draws the foul on Carmelo Carter! And-1! Kawhi Ingram to the line for 1. [BONUS: 8 team fouls] (Carmelo Carter: 1 personal fouls)   FT 1/1: GOOD Kawhi Ingram makes 1/1 from the line.
Score: 115-105

[00:35] Team_028 possession (Score: 115-105)
Austin Russell attempts a Midrange. Wide open! Myles Barrett is 7.0 feet away. [ZONE] Austin Russell misses. FOUL! Loose ball foul on Kawhi Ingram during the rebound battle. [IN THE BONUS! 8 team fouls] Carmelo Carter to the line for 2 free throws. (Kawhi Ingram: 2 personal fouls)   FT 1/2: MISS   FT 2/2: GOOD Carmelo Carter makes 1/2 from the line.
Score: 115-106

[00:21] Team_075 possession (Score: 115-106)
Myles Barrett drives, Myles Haliburton stays with him. Myles Barrett attempts a Layup. Contested by Myles Haliburton (5.2 feet, MAN). MYLES BARRETT MAKES IT! Assist: Kawhi Ingram
Score: 117-106

[00:10] Team_028 possession (Score: 117-106)
Kawhi Ball attempts a 3Pt. Contested by Larry McCollum (5.9 feet, ZONE). Kawhi Ball misses. Rebound secured by Derrick Stewart.

================================================================================
                              4TH QUARTER COMPLETE                              
================================================================================

4TH QUARTER SCORE: Team_075 30, Team_028 15

BOX SCORE:
================================================================================

Team_075
--------------------------------------------------------------------------------
Player                MIN  PTS  REB  AST  TO      FG   FG%      3P   3P%
--------------------------------------------------------------------------------
Klay Jokic             44    9    3    0   0   4/6    66.7     0/0   0.0
Derrick Stewart        44    7    5    1   0   3/4    75.0     0/0   0.0
Kawhi Ingram           44    7    7    1   0   3/4    75.0     0/0   0.0
Larry McCollum         44    5    0    1   0   2/2   100.0     0/0   0.0
Myles Barrett          44    2    0    2   0   1/3    33.3     0/0   0.0

TEAM: FG: 13/19 (68.4%), 3PT: 1/2 (50.0%), REB: 15 (5 off, 10 def), AST: 5, TO: 2
TEAM FOULS: 8 [Team_028 in BONUS]


Team_028
--------------------------------------------------------------------------------
Player                MIN  PTS  REB  AST  TO      FG   FG%      3P   3P%
--------------------------------------------------------------------------------
Austin Russell         44    6    0    0   0   3/6    50.0     0/0   0.0
Carmelo Carter         44    4    1    1   0   3/5    60.0     0/0   0.0
Jimmy Brogdon          44    2    3    1   0   1/1   100.0     0/0   0.0
Myles Haliburton       44    2    0    1   0   1/1   100.0     0/0   0.0
Kawhi Ball             44    0    3    1   0   0/5     0.0     0/0   0.0

TEAM: FG: 8/18 (44.4%), 3PT: 0/4 (0.0%), REB: 7 (1 off, 6 def), AST: 4, TO: 3
TEAM FOULS: 8 [Team_075 in BONUS]

================================================================================

================================================================================
                               FULL GAME COMPLETE                               
================================================================================

FINAL SCORE: Team_075 117, Team_028 106

SCORING BY QUARTER:
--------------------------------------------------------------------------------
Team                     Q1     Q2     Q3     Q4    FINAL
--------------------------------------------------------------------------------
Team_075                 29     29     29     30      117
Team_028                 38     25     28     15      106
--------------------------------------------------------------------------------

FULL GAME BOX SCORE:
================================================================================

Team_075
--------------------------------------------------------------------------------
Player                MIN  PTS  REB  AST  TO      FG   FG%      3P   3P%      FT STL BLK
--------------------------------------------------------------------------------
Larry McCollum         44   25    0    4   3   9/14   64.3   7/10   70.0   2/2     1   1
Kawhi Ingram           44   24   19    2   1   7/13   53.8   3/6    50.0   4/5     0   0
Myles Barrett          44   11    0    5   0   5/11   45.5   1/3    33.3   2/4     3   0
Derrick Stewart        44   17   13    6   1   8/17   47.1   1/3    33.3   6/8     0   1
Klay Jokic             44   23   13    6   1  12/17   70.6   1/3    33.3  12/14    1   0
D'Angelo Anunoby        5    2    0    0   2   1/1   100.0   0/0     0.0   0/0     0   0
LeBron Ginobili         5    3    0    2   0   1/1   100.0   0/0     0.0   1/1     0   0
Donovan Paul            5    8    0    0   0   3/3   100.0   2/2   100.0   0/0     0   0
Collin Duncan           5    0    4    0   0   0/0     0.0   0/0     0.0   0/0     0   0
Kevin Towns             5    0    1    2   0   0/2     0.0   0/0     0.0   0/0     0   0

TEAM: FG: 47/80 (58.8%), 3PT: 15/27 (55.6%), REB: 49 (17 off, 32 def), AST: 27, TO: 8


Team_028
--------------------------------------------------------------------------------
Player                MIN  PTS  REB  AST  TO      FG   FG%      3P   3P%      FT STL BLK
--------------------------------------------------------------------------------
Austin Russell         44   17    0    3   2   7/12   58.3   1/3    33.3   1/2     0   0
Carmelo Carter         44   21    9    4   0  10/18   55.6   3/7    42.9  12/15    0   0
Myles Haliburton       44   19    0    6   2   8/11   72.7   3/4    75.0   2/2     0   2
Kawhi Ball             44   19   13    1   1   9/19   47.4   1/4    25.0   3/7     1   0
Jimmy Brogdon          44   14   16    4   4   5/8    62.5   0/2     0.0   3/4     1   1
Scottie Ingram          5    0    0    1   0   0/2     0.0   0/1     0.0   0/0     0   0
Tyrese Quickley         5    2    0    2   0   1/1   100.0   0/0     0.0   0/0     0   0
Miles Booker            5    2    0    0   0   1/3    33.3   0/2     0.0   0/0     0   0
Bam Towns               5    6    0    0   1   2/2   100.0   2/2   100.0   0/0     0   0
Collin Bridges          5    0    2    1   0   0/0     0.0   0/0     0.0   0/0     1   0

TEAM: FG: 43/76 (56.6%), 3PT: 10/25 (40.0%), REB: 41 (8 off, 33 def), AST: 22, TO: 10

================================================================================
