================================================================================
                        FULL GAME - Team_085 vs Team_019                        
================================================================================

================================================================================
                       1ST QUARTER - Team_085 vs Team_019                       
================================================================================

[12:00] Team_085 possession (Score: 0-0)
Collin Mobley drives and kicks out. Stephen Bird attempts a 3Pt. Contested by D'Angelo Randle (3.6 feet, ZONE). Stephen Bird misses. Rebound secured by Tobias Hyland.

[11:48] Team_019 possession (Score: 0-0)
Tobias Hyland attempts a Midrange. Contested by Paul Wagner (3.5 feet, MAN). Tobias Hyland misses. Rebound secured by Collin Mobley.

[11:35] Team_085 possession (Score: 0-0)
Larry Duncan attempts a 3Pt. Contested by D'Angelo Randle (4.0 feet, ZONE). Larry Duncan misses. Offensive rebound by Larry Duncan! Larry Duncan kicks it out.

[11:21] Team_085 possession (Score: 0-0)
Magic Beal attempts a 3Pt. Contested by Rudy Giddey (5.8 feet, MAN). Magic Beal misses. FOUL! Loose ball foul on Tobias Hyland during the rebound battle. [Team fouls: 1] No free throws, side out. (Tobias Hyland: 1 personal fouls)

[11:01] Team_085 possession (Score: 0-0)
Paul Wagner attempts a Layup. Contested by Tobias Hyland (5.9 feet, MAN). PAUL WAGNER MAKES IT! Assist: Collin Mobley
Score: 2-0

[10:42] Team_019 possession (Score: 2-0)
FOUL! Reach-in foul on Larry Duncan during the drive. [Team fouls: 1] No free throws, side out. (Larry Duncan: 1 personal fouls)

[10:32] Team_019 possession (Score: 2-0)
DeMar James drives, Collin Mobley stays with him. DeMar James attempts a Dunk. Contested by Collin Mobley (4.3 feet, MAN). DEMAR JAMES MAKES IT! Assist: Brandon James
Score: 2-2

[10:17] Team_085 possession (Score: 2-2)
Magic Beal attempts a Layup. Contested by Rudy Giddey (5.8 feet, MAN). MAGIC BEAL MAKES IT! Assist: Larry Duncan
Score: 4-2

[10:03] Team_019 possession (Score: 4-2)
DeMar James drives, Paul Wagner stays with him. DeMar James attempts a Dunk. Contested by Paul Wagner (3.9 feet, ZONE). DEMAR JAMES MAKES IT!
Score: 4-4

[09:47] Team_085 possession (Score: 4-4)
Magic Beal attempts a 3Pt. Contested by D'Angelo Randle (4.0 feet, ZONE). Magic Beal misses. Rebound secured by DeMar James.

[09:34] Team_019 possession (Score: 4-4)
DeMar James drives, Paul Wagner stays with him. DeMar James attempts a Dunk. Contested by Paul Wagner (3.9 feet, ZONE). DEMAR JAMES MAKES IT!
Score: 4-6

[09:21] Team_085 possession (Score: 4-6)
Paul Wagner attempts a Midrange. Contested by Tobias Hyland (5.9 feet, MAN). Paul Wagner misses. Rebound secured by Tobias Hyland.

[09:08] Team_019 possession (Score: 4-6)
DeMar James attempts a Midrange. Contested by Collin Mobley (4.3 feet, MAN). DEMAR JAMES MAKES IT!
Score: 4-8

[08:54] Team_085 possession (Score: 4-8)
FOUL! Holding foul on DeMar James. [Team fouls: 2] No free throws, side out. (DeMar James: 1 personal fouls)

[08:38] Team_085 possession (Score: 4-8)
Paul Wagner drives to the basket... FOUL! Offensive foul on Paul Wagner! DeMar James drew the charge! [Team fouls: 2] (Paul Wagner: 1 personal fouls) TURNOVER! (dead ball)

[08:20] Team_019 possession (Score: 4-8)
Rudy Giddey attempts a 3Pt. Contested by Magic Beal (4.2 feet, MAN). Rudy Giddey misses. Rebound secured by Collin Mobley.

[08:06] Team_085 possession (Score: 4-8)
Larry Duncan attempts a 3Pt. Contested by D'Angelo Randle (4.0 feet, MAN). Larry Duncan misses. Rebound secured by Tobias Hyland.

[07:54] Team_019 possession (Score: 4-8)
Rudy Giddey attempts a 3Pt. Contested by Magic Beal (4.2 feet, ZONE). RUDY GIDDEY MAKES IT! Assist: DeMar James
Score: 4-11

[07:37] Team_085 possession (Score: 4-11)
Paul Wagner loses the ball! Stripped by Tobias Hyland! TURNOVER! (live ball)

[07:24] Team_019 possession (Score: 4-11)
Tobias Hyland attempts a Layup. BLOCKED BY MAGIC BEAL! Ball deflects out of bounds off Tobias Hyland.

[07:07] Team_085 possession (Score: 4-11)
Stephen Bird attempts a Layup. Contested by DeMar James (4.5 feet, ZONE). STEPHEN BIRD MAKES IT! Assist: Collin Mobley
Score: 6-11

[06:56] Team_019 possession (Score: 6-11)
FOUL! Shooting foul on Paul Wagner. Tobias Hyland to the line for 2 free throws. [Team fouls: 3] (Paul Wagner: 2 personal fouls)   FT 1/2: GOOD   FT 2/2: GOOD Tobias Hyland makes 2/2 from the line.
Score: 6-13

[06:40] Team_085 possession (Score: 6-13)
Stephen Bird attempts a 3Pt. Contested by Brandon James (5.4 feet, MAN). STEPHEN BIRD MAKES IT! Assist: Collin Mobley
Score: 9-13

[06:21] Team_019 possession (Score: 9-13)
Rudy Giddey drives and kicks out. DeMar James attempts a Midrange. Contested by Collin Mobley (3.9 feet, MAN). DeMar James misses. Offensive rebound by D'Angelo Randle! D'Angelo Randle's putback is no good. Rebound secured by Collin Mobley.

[06:06] Team_085 possession (Score: 9-13)
Stephen Bird makes the Layup and draws the foul on DeMar James! And-1! Stephen Bird to the line for 1. [Team fouls: 3] (DeMar James: 2 personal fouls)   FT 1/1: GOOD Stephen Bird makes 1/1 from the line.
Score: 12-13

[05:49] Team_019 possession (Score: 12-13)
FOUL! Reach-in foul on Paul Wagner during the drive. [Team fouls: 4] No free throws, side out. (Paul Wagner: 3 personal fouls)

[05:40] Team_019 possession (Score: 12-13)
Tobias Hyland drives, Paul Wagner stays with him. Tobias Hyland attempts a Dunk. Contested by Paul Wagner (3.5 feet, ZONE). Tobias Hyland misses. Rebound secured by Larry Duncan.

[05:25] Team_085 possession (Score: 12-13)
Paul Wagner attempts a Midrange. Contested by Brandon James (5.4 feet, ZONE). Paul Wagner misses. Rebound secured by DeMar James.

[05:11] Team_019 possession (Score: 12-13)
DeMar James drives to the basket... FOUL! Offensive foul on DeMar James! Collin Mobley drew the charge! [Team fouls: 4] (DeMar James: 3 personal fouls) TURNOVER! (dead ball)

[05:01] Team_085 possession (Score: 12-13)
Stephen Bird drives to the basket... Stephen Bird throws a bad pass! Stolen by DeMar James! TURNOVER! (live ball)

[04:44] Team_019 possession (Score: 12-13)
Rudy Giddey attempts a 3Pt. Contested by Magic Beal (4.2 feet, MAN). RUDY GIDDEY MAKES IT! Assist: Tobias Hyland
Score: 12-16

[04:33] Team_085 possession (Score: 12-16)
FOUL! Holding foul on Rudy Giddey. [IN THE BONUS! 5 team fouls] Magic Beal to the line for 2 free throws. (Rudy Giddey: 1 personal fouls)   FT 1/2: GOOD   FT 2/2: GOOD Magic Beal makes 2/2 from the line.
Score: 14-16

[04:21] Team_019 possession (Score: 14-16)
D'Angelo Randle attempts a 3Pt. Contested by Magic Beal (4.3 feet, ZONE). D'Angelo Randle misses. Rebound secured by Collin Mobley.

[04:04] Team_085 possession (Score: 14-16)
Paul Wagner attempts a Midrange. Contested by DeMar James (4.7 feet, ZONE). Paul Wagner misses. Rebound secured by DeMar James.

[03:45] Team_019 possession (Score: 14-16)
Brandon James drives to the basket... Brandon James loses the ball! Stripped by Stephen Bird! TURNOVER! (live ball)

[03:30] Team_085 possession (Score: 14-16)
Stephen Bird attempts a Midrange. Contested by Brandon James (5.5 feet, MAN). Stephen Bird misses. Rebound secured by DeMar James.

[03:17] Team_019 possession (Score: 14-16)
DeMar James drives, Collin Mobley stays with him. DeMar James attempts a Layup. Contested by Collin Mobley (4.4 feet, MAN). DEMAR JAMES MAKES IT!
Score: 14-18

[03:07] Team_085 possession (Score: 14-18)
Paul Wagner attempts a 3Pt. Contested by D'Angelo Randle (4.1 feet, ZONE). Paul Wagner misses. Rebound secured by DeMar James.

[02:54] Team_019 possession (Score: 14-18)
D'Angelo Randle attempts a Midrange. BLOCKED BY MAGIC BEAL! Ball is loose! Offensive rebound by D'Angelo Randle! D'Angelo Randle kicks it out.

[02:42] Team_019 possession (Score: 14-18)
D'Angelo Randle attempts a 3Pt. Contested by Larry Duncan (3.5 feet, MAN). D'ANGELO RANDLE MAKES IT! Assist: Brandon James
Score: 14-21

[02:25] Team_085 possession (Score: 14-21)
Paul Wagner attempts a 3Pt. Wide open! Tobias Hyland is 6.2 feet away. [MAN] Paul Wagner misses. Rebound secured by Tobias Hyland.

[02:11] Team_019 possession (Score: 14-21)
Tobias Hyland drives and kicks out. D'Angelo Randle attempts a Midrange. Contested by Paul Wagner (3.8 feet, ZONE). D'Angelo Randle misses. Rebound secured by Collin Mobley.

[01:55] Team_085 possession (Score: 14-21)
Larry Duncan attempts a 3Pt. Contested by D'Angelo Randle (4.3 feet, MAN). LARRY DUNCAN MAKES IT! Assist: Stephen Bird
Score: 17-21

[01:44] Team_019 possession (Score: 17-21)
Brandon James attempts a Midrange. Contested by Paul Wagner (3.8 feet, ZONE). Brandon James misses. FOUL! Loose ball foul on Collin Mobley during the rebound battle. [IN THE BONUS! 6 team fouls] DeMar James to the line for 2 free throws. (Collin Mobley: 1 personal fouls)   FT 1/2: GOOD   FT 2/2: GOOD DeMar James makes 2/2 from the line.
Score: 17-23

[01:33] Team_085 possession (Score: 17-23)
Larry Duncan attempts a Dunk. BLOCKED BY DEMAR JAMES! Ball is loose! Rebound secured by D'Angelo Randle.

[01:16] Team_019 possession (Score: 17-23)
Rudy Giddey makes the Layup and draws the foul on Larry Duncan! And-1! Rudy Giddey to the line for 1. [BONUS: 7 team fouls] (Larry Duncan: 2 personal fouls)   FT 1/1: GOOD Rudy Giddey makes 1/1 from the line.
Score: 17-26

[01:01] Team_085 possession (Score: 17-26)
Magic Beal drives and kicks out. FOUL! Shooting foul on D'Angelo Randle. Collin Mobley to the line for 2 free throws. [BONUS: 6 team fouls] (D'Angelo Randle: 1 personal fouls)   FT 1/2: GOOD   FT 2/2: MISS Collin Mobley makes 1/2 from the line. Rebound secured by Tobias Hyland.
Score: 18-26

[00:45] Team_019 possession (Score: 18-26)
Rudy Giddey attempts a Midrange. Contested by Magic Beal (4.6 feet, MAN). Rudy Giddey misses. Rebound secured by Paul Wagner.

[00:27] Team_085 possession (Score: 18-26)
Stephen Bird drives and kicks out. Stephen Bird attempts a 3Pt. Contested by Brandon James (5.6 feet, MAN). Stephen Bird misses. Rebound secured by Tobias Hyland.

[00:09] Team_019 possession (Score: 18-26)
D'Angelo Randle drives to the basket... D'Angelo Randle throws a bad pass! Stolen by Paul Wagner! TURNOVER! (live ball)

================================================================================
                              1ST QUARTER COMPLETE                              
================================================================================

1ST QUARTER SCORE: Team_085 18, Team_019 26

BOX SCORE:
================================================================================

Team_085
--------------------------------------------------------------------------------
Player                MIN  PTS  REB  AST  TO      FG   FG%      3P   3P%
--------------------------------------------------------------------------------
Stephen Bird           12    8    0    1   0   3/5    60.0     0/0   0.0
Magic Beal             12    4    0    0   0   2/4    50.0     0/0   0.0
Larry Duncan           12    3    3    1   0   1/3    33.3     0/0   0.0
Paul Wagner            12    2    1    0   0   1/6    16.7     0/0   0.0
Collin Mobley          12    0    5    3   0   0/1     0.0     0/0   0.0

TEAM: FG: 7/19 (36.8%), 3PT: 2/6 (33.3%), REB: 8 (2 off, 6 def), AST: 5, TO: 3
TEAM FOULS: 7 [Team_019 in BONUS]


Team_019
--------------------------------------------------------------------------------
Player                MIN  PTS  REB  AST  TO      FG   FG%      3P   3P%
--------------------------------------------------------------------------------
DeMar James            12   12    5    1   0   6/6   100.0     0/0   0.0
Rudy Giddey            12    9    0    0   0   3/6    50.0     0/0   0.0
D'Angelo Randle        12    3    2    0   0   1/2    50.0     0/0   0.0
Tobias Hyland          12    2    6    1   0   1/5    20.0     0/0   0.0
Brandon James          12    0    0    2   0   0/0     0.0     0/0   0.0

TEAM: FG: 11/19 (57.9%), 3PT: 3/5 (60.0%), REB: 14 (2 off, 12 def), AST: 4, TO: 3
TEAM FOULS: 6 [Team_085 in BONUS]

================================================================================

================================================================================
                       2ND QUARTER - Team_085 vs Team_019                       
================================================================================

[12:00] Team_085 possession (Score: 18-26)
Magic Beal drives and kicks out. Larry Duncan attempts a 3Pt. Contested by D'Angelo Randle (4.0 feet, ZONE). LARRY DUNCAN MAKES IT! Assist: Magic Beal
Score: 21-26

[11:47] Team_019 possession (Score: 21-26)
FOUL! Holding foul on Larry Duncan. [Team fouls: 1] No free throws, side out. (Larry Duncan: 1 personal fouls)

[11:33] Team_019 possession (Score: 21-26)
Rudy Giddey attempts a 3Pt. Contested by Magic Beal (4.5 feet, MAN). Rudy Giddey misses. Rebound secured by Paul Wagner.

[11:18] Team_085 possession (Score: 21-26)
Paul Wagner attempts a 3Pt. Wide open! Tobias Hyland is 6.3 feet away. [MAN] Paul Wagner misses. Rebound secured by D'Angelo Randle.

[11:06] Team_019 possession (Score: 21-26)
Brandon James attempts a Midrange. Contested by Larry Duncan (3.4 feet, ZONE). Brandon James misses. FOUL! Loose ball foul on Paul Wagner during the rebound battle. [Team fouls: 2] No free throws, side out. (Paul Wagner: 1 personal fouls)

[10:47] Team_019 possession (Score: 21-26)
Brandon James attempts a 3Pt. Contested by Stephen Bird (3.9 feet, MAN). BRANDON JAMES MAKES IT! Assist: Rudy Giddey
Score: 21-29

[10:32] Team_085 possession (Score: 21-29)
Magic Beal attempts a 3Pt. Wide open! Rudy Giddey is 6.1 feet away. [MAN] Magic Beal misses. Rebound secured by DeMar James.

[10:21] Team_019 possession (Score: 21-29)
Tobias Hyland drives, Paul Wagner stays with him. Tobias Hyland attempts a Layup. Contested by Paul Wagner (3.9 feet, MAN). Tobias Hyland misses. Rebound secured by Larry Duncan.

[10:03] Team_085 possession (Score: 21-29)
FOUL! Holding foul on Brandon James. [Team fouls: 1] No free throws, side out. (Brandon James: 1 personal fouls)

[09:46] Team_085 possession (Score: 21-29)
Stephen Bird attempts a Layup. Contested by Brandon James (5.8 feet, MAN). STEPHEN BIRD MAKES IT!
Score: 23-29

[09:31] Team_019 possession (Score: 23-29)
Brandon James attempts a 3Pt. Contested by Magic Beal (4.5 feet, ZONE). Brandon James misses. Offensive rebound by D'Angelo Randle! D'Angelo Randle kicks it out.

[09:21] Team_019 possession (Score: 23-29)
Tobias Hyland drives, Paul Wagner stays with him. Tobias Hyland attempts a Dunk. Contested by Paul Wagner (4.0 feet, ZONE). Tobias Hyland misses. Rebound secured by Collin Mobley.

[09:12] Team_085 possession (Score: 23-29)
FOUL! Reach-in foul on DeMar James during the drive. [Team fouls: 2] No free throws, side out. (DeMar James: 1 personal fouls)

[08:57] Team_085 possession (Score: 23-29)
Larry Duncan attempts a 3Pt. Contested by D'Angelo Randle (4.7 feet, MAN). Larry Duncan misses. Offensive rebound by Larry Duncan! Larry Duncan kicks it out.

[08:43] Team_085 possession (Score: 23-29)
Paul Wagner attempts a 3Pt. Contested by D'Angelo Randle (4.7 feet, ZONE). Paul Wagner misses. Rebound secured by Tobias Hyland.

[08:32] Team_019 possession (Score: 23-29)
Tobias Hyland attempts a Layup. BLOCKED BY PAUL WAGNER! Ball is loose! Rebound secured by Larry Duncan.

[08:13] Team_085 possession (Score: 23-29)
Collin Mobley drives, DeMar James stays with him. Collin Mobley attempts a Dunk. Contested by DeMar James (5.0 feet, ZONE). COLLIN MOBLEY MAKES IT! Assist: Stephen Bird
Score: 25-29

[08:01] Team_019 possession (Score: 25-29)
FOUL! Shooting foul on Collin Mobley. DeMar James to the line for 3 free throws. [Team fouls: 3] (Collin Mobley: 1 personal fouls)   FT 1/3: GOOD   FT 2/3: GOOD   FT 3/3: GOOD DeMar James makes 3/3 from the line.
Score: 25-32

[07:46] Team_085 possession (Score: 25-32)
Magic Beal attempts a Layup. Contested by DeMar James (5.5 feet, ZONE). Magic Beal misses. Rebound secured by DeMar James.

[07:36] Team_019 possession (Score: 25-32)
Brandon James attempts a 3Pt. Contested by Stephen Bird (4.5 feet, MAN). BRANDON JAMES MAKES IT! Assist: D'Angelo Randle
Score: 25-35

[07:19] Team_085 possession (Score: 25-35)
Larry Duncan attempts a 3Pt. Contested by D'Angelo Randle (5.0 feet, MAN). Larry Duncan misses. Rebound secured by DeMar James.

[07:05] Team_019 possession (Score: 25-35)
Brandon James loses the ball! Stripped by Stephen Bird! TURNOVER! (live ball)

[06:52] Team_085 possession (Score: 25-35)
Collin Mobley makes the Layup and draws the foul on DeMar James! And-1! Collin Mobley to the line for 1. [Team fouls: 3] (DeMar James: 2 personal fouls)   FT 1/1: GOOD Collin Mobley makes 1/1 from the line.
Score: 28-35

[06:35] Team_019 possession (Score: 28-35)
Rudy Giddey attempts a Midrange. Contested by Magic Beal (5.1 feet, MAN). Rudy Giddey misses. Offensive rebound by DeMar James! DeMar James kicks it out.

[06:18] Team_019 possession (Score: 28-35)
Rudy Giddey attempts a 3Pt. Contested by Magic Beal (5.2 feet, ZONE). Rudy Giddey misses. Offensive rebound by DeMar James! DeMar James kicks it out.

[06:03] Team_019 possession (Score: 28-35)
FOUL! Shooting foul on Paul Wagner. Tobias Hyland to the line for 2 free throws. [Team fouls: 4] (Paul Wagner: 2 personal fouls)   FT 1/2: GOOD   FT 2/2: GOOD Tobias Hyland makes 2/2 from the line.
Score: 28-37

[05:51] Team_085 possession (Score: 28-37)
Larry Duncan attempts a 3Pt. Contested by D'Angelo Randle (5.2 feet, ZONE). Larry Duncan misses. Rebound secured by DeMar James.

[05:35] Team_019 possession (Score: 28-37)
Brandon James attempts a Midrange. Contested by Stephen Bird (4.8 feet, ZONE). BRANDON JAMES MAKES IT! Assist: DeMar James
Score: 28-39

[05:20] Team_085 possession (Score: 28-39)
Larry Duncan attempts a 3Pt. Contested by D'Angelo Randle (5.3 feet, ZONE). LARRY DUNCAN MAKES IT! Assist: Paul Wagner
Score: 31-39

[05:05] Team_019 possession (Score: 31-39)
DeMar James attempts a Midrange. Contested by Collin Mobley (5.5 feet, MAN). DEMAR JAMES MAKES IT! Assist: Brandon James
Score: 31-41

[04:50] Team_085 possession (Score: 31-41)
Collin Mobley commits a violation (traveling/carry)! TURNOVER! (dead ball)

[04:50] Substitution (Team_085): Magic Beal OUT → Khris Brogdon IN (stamina_rule2)

[04:50] Substitution (Team_085): Stephen Bird OUT → Jordan Morant IN (stamina_rule2)

[04:50] Substitution (Team_085): Larry Duncan OUT → Giannis Johnson IN (stamina_rule2)

[04:50] Substitution (Team_085): Paul Wagner OUT → Jalen Leonard IN (stamina_rule2)

[04:50] Substitution (Team_085): Collin Mobley OUT → Malcolm Beal IN (stamina_rule2)

[04:50] Substitution (Team_019): Rudy Giddey OUT → Gary Ginobili IN (stamina_rule2)

[04:50] Substitution (Team_019): Brandon James OUT → Jalen Turner IN (stamina_rule2)

[04:50] Substitution (Team_019): D'Angelo Randle OUT → Blake LaVine IN (stamina_rule2)

[04:50] Substitution (Team_019): Tobias Hyland OUT → Shai Ingram IN (stamina_rule2)

[04:50] Substitution (Team_019): DeMar James OUT → Tim Jordan IN (stamina_rule2)

[04:41] Team_019 possession (Score: 31-41)
Gary Ginobili attempts a 3Pt. Contested by Khris Brogdon (5.9 feet, MAN). Gary Ginobili misses. Offensive rebound by Shai Ingram! Shai Ingram kicks it out.

[04:27] Team_019 possession (Score: 31-41)
Gary Ginobili attempts a Midrange. Contested by Khris Brogdon (5.9 feet, MAN). GARY GINOBILI MAKES IT! Assist: Shai Ingram
Score: 31-43

[04:12] Team_085 possession (Score: 31-43)
Jalen Leonard attempts a Midrange. Contested by Shai Ingram (4.9 feet, MAN). JALEN LEONARD MAKES IT!
Score: 33-43

[03:58] Team_019 possession (Score: 33-43)
Jalen Turner attempts a Midrange. Contested by Jordan Morant (3.7 feet, MAN). JALEN TURNER MAKES IT! Assist: Blake LaVine
Score: 33-45

[03:47] Team_085 possession (Score: 33-45)
Jalen Leonard drives and kicks out. Khris Brogdon attempts a Midrange. Contested by Jalen Turner (3.9 feet, ZONE). KHRIS BROGDON MAKES IT! Assist: Jalen Leonard
Score: 35-45

[03:33] Team_019 possession (Score: 35-45)
Tim Jordan drives to the basket... Tim Jordan loses control! Ball rolls out of bounds! TURNOVER! (dead ball)

[03:18] Team_085 possession (Score: 35-45)
Malcolm Beal attempts a Midrange. Contested by Shai Ingram (4.1 feet, MAN). Malcolm Beal misses. Offensive rebound by Malcolm Beal! Malcolm Beal kicks it out.

[03:01] Team_085 possession (Score: 35-45)
Jordan Morant drives, Shai Ingram stays with him. Jordan Morant attempts a Layup. Contested by Shai Ingram (4.7 feet, ZONE). JORDAN MORANT MAKES IT!
Score: 37-45

[02:48] Team_019 possession (Score: 37-45)
Jalen Turner attempts a Midrange. Contested by Jordan Morant (3.7 feet, MAN). Jalen Turner misses. Rebound secured by Jalen Leonard.

[02:33] Team_085 possession (Score: 37-45)
Giannis Johnson drives and kicks out. Giannis Johnson attempts a 3Pt. Contested by Blake LaVine (4.7 feet, MAN). Giannis Johnson misses. Rebound secured by Tim Jordan.

[02:17] Team_019 possession (Score: 37-45)
Shai Ingram attempts a Midrange. Contested by Giannis Johnson (5.8 feet, ZONE). SHAI INGRAM MAKES IT! Assist: Jalen Turner
Score: 37-47

[02:06] Team_085 possession (Score: 37-47)
Khris Brogdon attempts a 3Pt. Contested by Blake LaVine (4.6 feet, ZONE). Khris Brogdon misses. Rebound secured by Shai Ingram.

[01:50] Team_019 possession (Score: 37-47)
Jalen Turner attempts a 3Pt. Contested by Jordan Morant (3.7 feet, ZONE). Jalen Turner misses. Offensive rebound by Shai Ingram! Shai Ingram kicks it out.

[01:37] Team_019 possession (Score: 37-47)
Gary Ginobili drives, picks up Malcolm Beal. Help arrives from Jordan Morant! Gary Ginobili attempts a Dunk. Contested by Jordan Morant (4.8 feet, ZONE). GARY GINOBILI MAKES IT! Assist: Shai Ingram
Score: 37-49

[01:20] Team_085 possession (Score: 37-49)
Malcolm Beal attempts a Layup. Contested by Shai Ingram (4.1 feet, ZONE). MALCOLM BEAL MAKES IT!
Score: 39-49

[01:09] Team_019 possession (Score: 39-49)
Gary Ginobili attempts a Layup. BLOCKED BY MALCOLM BEAL! Ball deflects out of bounds off Gary Ginobili.

[00:56] Team_085 possession (Score: 39-49)
Malcolm Beal makes the Layup and draws the foul on Shai Ingram! And-1! Malcolm Beal to the line for 1. [Team fouls: 4] (Shai Ingram: 1 personal fouls)   FT 1/1: GOOD Malcolm Beal makes 1/1 from the line.
Score: 42-49

[00:38] Team_019 possession (Score: 42-49)
Blake LaVine drives, Malcolm Beal stays with him. Blake LaVine attempts a Dunk. Contested by Malcolm Beal (4.5 feet, ZONE). Blake LaVine misses. Rebound secured by Malcolm Beal.

[00:24] Team_085 possession (Score: 42-49)
FOUL! Holding foul on Gary Ginobili. [IN THE BONUS! 5 team fouls] Khris Brogdon to the line for 2 free throws. (Gary Ginobili: 1 personal fouls)   FT 1/2: GOOD   FT 2/2: MISS Khris Brogdon makes 1/2 from the line. Offensive rebound by Malcolm Beal! Malcolm Beal kicks it out.
Score: 43-49

[00:12] Team_085 possession (Score: 43-49)
FOUL! Reach-in foul on Shai Ingram during the drive. [IN THE BONUS! 6 team fouls] Malcolm Beal to the line for 2 free throws. (Shai Ingram: 2 personal fouls)   FT 1/2: GOOD   FT 2/2: GOOD Malcolm Beal makes 2/2 from the line.
Score: 45-49

================================================================================
                              2ND QUARTER COMPLETE                              
================================================================================

2ND QUARTER SCORE: Team_085 27, Team_019 23

BOX SCORE:
================================================================================

Team_085
--------------------------------------------------------------------------------
Player                MIN  PTS  REB  AST  TO      FG   FG%      3P   3P%
--------------------------------------------------------------------------------
Malcolm Beal            5    7    3    0   0   3/3   100.0     0/0   0.0
Larry Duncan           19    6    3    0   0   2/4    50.0     0/0   0.0
Collin Mobley          19    5    1    0   0   2/2   100.0     0/0   0.0
Stephen Bird           19    2    0    1   0   1/1   100.0     0/0   0.0
Jalen Leonard           5    2    1    1   0   1/1   100.0     0/0   0.0
Khris Brogdon           5    2    0    0   0   1/2    50.0     0/0   0.0
Jordan Morant           5    2    0    0   0   1/1   100.0     0/0   0.0
Magic Beal             19    0    0    1   0   0/2     0.0     0/0   0.0
Paul Wagner            19    0    1    1   0   0/2     0.0     0/0   0.0
Giannis Johnson         5    0    0    0   0   0/1     0.0     0/0   0.0

TEAM: FG: 11/19 (57.9%), 3PT: 1/7 (14.3%), REB: 9 (3 off, 6 def), AST: 4, TO: 1
TEAM FOULS: 4


Team_019
--------------------------------------------------------------------------------
Player                MIN  PTS  REB  AST  TO      FG   FG%      3P   3P%
--------------------------------------------------------------------------------
Brandon James          19    8    0    1   0   3/3   100.0     0/0   0.0
DeMar James            19    5    6    1   0   2/2   100.0     0/0   0.0
Gary Ginobili           5    4    0    0   0   2/3    66.7     0/0   0.0
Tobias Hyland          19    2    1    0   0   1/4    25.0     0/0   0.0
Shai Ingram             5    2    3    2   0   1/1   100.0     0/0   0.0
Jalen Turner            5    2    0    1   0   1/2    50.0     0/0   0.0
Rudy Giddey            19    0    0    1   0   0/1     0.0     0/0   0.0
D'Angelo Randle        19    0    3    1   0   0/0     0.0     0/0   0.0
Blake LaVine            5    0    0    1   0   0/1     0.0     0/0   0.0
Tim Jordan              5    0    1    0   0   0/0     0.0     0/0   0.0

TEAM: FG: 10/17 (58.8%), 3PT: 3/4 (75.0%), REB: 14 (6 off, 8 def), AST: 8, TO: 2
TEAM FOULS: 6 [Team_085 in BONUS]

================================================================================

================================================================================
                       3RD QUARTER - Team_085 vs Team_019                       
================================================================================

[12:00] Team_085 possession (Score: 45-49)
FOUL! Shooting foul on DeMar James. Stephen Bird to the line for 2 free throws. [Team fouls: 1] (DeMar James: 1 personal fouls)   FT 1/2: GOOD   FT 2/2: MISS Stephen Bird makes 1/2 from the line. Rebound secured by Tobias Hyland.
Score: 46-49

[11:48] Team_019 possession (Score: 46-49)
Rudy Giddey attempts a Midrange. Contested by Magic Beal (4.2 feet, MAN). Rudy Giddey misses. Offensive rebound by D'Angelo Randle! D'Angelo Randle's putback is no good. Offensive rebound by D'Angelo Randle! D'Angelo Randle kicks it out.

[11:35] Team_019 possession (Score: 46-49)
DeMar James loses the ball! Stripped by Collin Mobley! TURNOVER! (live ball)

[11:21] Team_085 possession (Score: 46-49)
Magic Beal attempts a 3Pt. Contested by Rudy Giddey (5.8 feet, ZONE). Magic Beal misses. Rebound secured by D'Angelo Randle.

[11:10] Team_019 possession (Score: 46-49)
Rudy Giddey drives and kicks out. Rudy Giddey attempts a Midrange. Contested by Larry Duncan (3.0 feet, ZONE). Rudy Giddey misses. Rebound secured by Collin Mobley.

[10:52] Team_085 possession (Score: 46-49)
Larry Duncan attempts a 3Pt. Contested by D'Angelo Randle (4.0 feet, ZONE). LARRY DUNCAN MAKES IT! Assist: Magic Beal
Score: 49-49

[10:38] Team_019 possession (Score: 49-49)
FOUL! Shooting foul on Paul Wagner. DeMar James to the line for 2 free throws. [Team fouls: 1] (Paul Wagner: 1 personal fouls)   FT 1/2: GOOD   FT 2/2: GOOD DeMar James makes 2/2 from the line.
Score: 49-51

[10:26] Team_085 possession (Score: 49-51)
Paul Wagner attempts a 3Pt. Contested by Rudy Giddey (5.6 feet, ZONE). Paul Wagner misses. Rebound secured by DeMar James.

[10:09] Team_019 possession (Score: 49-51)
Brandon James attempts a 3Pt. Contested by Stephen Bird (3.4 feet, MAN). Brandon James misses. Rebound secured by Paul Wagner.

[09:54] Team_085 possession (Score: 49-51)
Larry Duncan drives, D'Angelo Randle stays with him. Larry Duncan attempts a Layup. Contested by D'Angelo Randle (4.0 feet, MAN). LARRY DUNCAN MAKES IT! Assist: Collin Mobley
Score: 51-51

[09:41] Team_019 possession (Score: 51-51)
DeMar James attempts a Layup. BLOCKED BY COLLIN MOBLEY! Ball is loose! Rebound secured by Larry Duncan.

[09:30] Team_085 possession (Score: 51-51)
Larry Duncan attempts a Midrange. Contested by D'Angelo Randle (4.0 feet, MAN). Larry Duncan misses. Offensive rebound by Larry Duncan! Larry Duncan kicks it out.

[09:16] Team_085 possession (Score: 51-51)
Magic Beal drives and kicks out. Stephen Bird attempts a Midrange. Contested by Brandon James (5.1 feet, MAN). STEPHEN BIRD MAKES IT! Assist: Magic Beal
Score: 53-51

[08:57] Team_019 possession (Score: 53-51)
Rudy Giddey drives, Magic Beal stays with him. Rudy Giddey attempts a Layup. Contested by Magic Beal (4.2 feet, MAN). RUDY GIDDEY MAKES IT!
Score: 53-53

[08:40] Team_085 possession (Score: 53-53)
Collin Mobley drives to the basket... Collin Mobley throws a bad pass! Stolen by DeMar James! TURNOVER! (live ball)

[08:26] Team_019 possession (Score: 53-53)
DeMar James attempts a Midrange. Contested by Collin Mobley (4.3 feet, MAN). DeMar James misses. Offensive rebound by DeMar James! DeMar James's putback is no good. Rebound secured by Collin Mobley.

[08:11] Team_085 possession (Score: 53-53)
Paul Wagner attempts a Midrange. Contested by Tobias Hyland (5.9 feet, MAN). Paul Wagner misses. Rebound secured by Tobias Hyland.

[08:00] Team_019 possession (Score: 53-53)
Brandon James attempts a 3Pt. Contested by Magic Beal (4.0 feet, ZONE). Brandon James misses. Rebound secured by Paul Wagner.

[07:47] Team_085 possession (Score: 53-53)
Collin Mobley attempts a Layup. BLOCKED BY DEMAR JAMES! Ball is loose! Offensive rebound by Paul Wagner! Paul Wagner kicks it out.

[07:30] Team_085 possession (Score: 53-53)
Stephen Bird drives, picks up DeMar James. Help arrives from Brandon James! Stephen Bird attempts a Layup. Contested by Brandon James (4.5 feet, ZONE). Stephen Bird misses. Rebound secured by Tobias Hyland.

[07:15] Team_019 possession (Score: 53-53)
Tobias Hyland attempts a 3Pt. Contested by Paul Wagner (3.5 feet, MAN). Tobias Hyland misses. Rebound secured by Larry Duncan.

[07:03] Team_085 possession (Score: 53-53)
Collin Mobley drives to the basket... FOUL! Offensive foul on Collin Mobley! DeMar James drew the charge! [Team fouls: 2] (Collin Mobley: 1 personal fouls) TURNOVER! (dead ball)

[06:51] Team_019 possession (Score: 53-53)
D'Angelo Randle makes the Dunk and draws the foul on Larry Duncan! And-1! D'Angelo Randle to the line for 1. [Team fouls: 3] (Larry Duncan: 1 personal fouls)   FT 1/1: GOOD D'Angelo Randle makes 1/1 from the line.
Score: 53-56

[06:34] Team_085 possession (Score: 53-56)
Paul Wagner attempts a 3Pt. Contested by Tobias Hyland (5.9 feet, MAN). Paul Wagner misses. Rebound secured by D'Angelo Randle.

[06:23] Team_019 possession (Score: 53-56)
D'Angelo Randle attempts a Midrange. Contested by Larry Duncan (3.3 feet, MAN). D'Angelo Randle misses. Rebound secured by Larry Duncan.

[06:07] Team_085 possession (Score: 53-56)
Stephen Bird drives, Brandon James stays with him. Stephen Bird attempts a Dunk. Contested by Brandon James (5.4 feet, MAN). STEPHEN BIRD MAKES IT! Assist: Paul Wagner
Score: 55-56

[05:55] Team_019 possession (Score: 55-56)
FOUL! Shooting foul on Magic Beal. Rudy Giddey to the line for 3 free throws. [Team fouls: 4] (Magic Beal: 1 personal fouls)   FT 1/3: GOOD   FT 2/3: GOOD   FT 3/3: MISS Rudy Giddey makes 2/3 from the line. Rebound secured by Collin Mobley.
Score: 55-58

[05:43] Team_085 possession (Score: 55-58)
Paul Wagner attempts a 3Pt. Contested by Tobias Hyland (5.9 feet, MAN). PAUL WAGNER MAKES IT! Assist: Magic Beal
Score: 58-58

[05:31] Team_019 possession (Score: 58-58)
D'Angelo Randle throws a bad pass out of bounds! TURNOVER! (dead ball)

[05:14] Team_085 possession (Score: 58-58)
Paul Wagner drives to the basket... Paul Wagner throws a bad pass! Stolen by Tobias Hyland! TURNOVER! (live ball)

[05:00] Team_019 possession (Score: 58-58)
DeMar James attempts a 3Pt. Contested by Collin Mobley (4.3 feet, MAN). DeMar James misses. Rebound secured by Paul Wagner.

[04:42] Team_085 possession (Score: 58-58)
Stephen Bird attempts a 3Pt. Contested by Brandon James (5.4 feet, MAN). Stephen Bird misses. Offensive rebound by Larry Duncan! Larry Duncan kicks it out.

[04:27] Team_085 possession (Score: 58-58)
Paul Wagner attempts a Midrange. Wide open! Tobias Hyland is 6.0 feet away. [MAN] PAUL WAGNER MAKES IT! Assist: Collin Mobley
Score: 60-58

[04:13] Team_019 possession (Score: 60-58)
Brandon James drives and kicks out. D'Angelo Randle attempts a 3Pt. Contested by Larry Duncan (3.1 feet, MAN). D'Angelo Randle misses. Offensive rebound by D'Angelo Randle! D'Angelo Randle kicks it out.

[03:58] Team_019 possession (Score: 60-58)
Brandon James attempts a 3Pt. Contested by Magic Beal (4.1 feet, ZONE). Brandon James misses. Offensive rebound by D'Angelo Randle! D'Angelo Randle kicks it out.

[03:40] Team_019 possession (Score: 60-58)
FOUL! Reach-in foul on Larry Duncan during the drive. [IN THE BONUS! 5 team fouls] D'Angelo Randle to the line for 2 free throws. (Larry Duncan: 2 personal fouls)   FT 1/2: GOOD   FT 2/2: GOOD D'Angelo Randle makes 2/2 from the line.
Score: 60-60

[03:28] Team_085 possession (Score: 60-60)
Collin Mobley commits a violation (traveling/carry)! TURNOVER! (dead ball)

[03:28] Substitution (Team_019): Tobias Hyland OUT → Shai Ingram IN (stamina_rule2)

[03:14] Team_019 possession (Score: 60-60)
Rudy Giddey attempts a 3Pt. Contested by Magic Beal (4.4 feet, MAN). RUDY GIDDEY MAKES IT! Assist: DeMar James
Score: 60-63

[03:00] Team_085 possession (Score: 60-63)
Magic Beal attempts a 3Pt. Contested by Rudy Giddey (5.9 feet, MAN). MAGIC BEAL MAKES IT! Assist: Stephen Bird
Score: 63-63

[02:47] Team_019 possession (Score: 63-63)
Shai Ingram attempts a Midrange. Contested by Paul Wagner (3.7 feet, MAN). Shai Ingram misses. Rebound secured by Larry Duncan.

[02:34] Team_085 possession (Score: 63-63)
Larry Duncan attempts a 3Pt. Contested by D'Angelo Randle (4.3 feet, ZONE). Larry Duncan misses. Rebound secured by D'Angelo Randle.

[02:22] Team_019 possession (Score: 63-63)
FOUL! Shooting foul on Paul Wagner. Shai Ingram to the line for 2 free throws. [BONUS: 6 team fouls] (Paul Wagner: 2 personal fouls)   FT 1/2: GOOD   FT 2/2: GOOD Shai Ingram makes 2/2 from the line.
Score: 63-65

[02:11] Team_085 possession (Score: 63-65)
Paul Wagner commits a violation (traveling/carry)! TURNOVER! (dead ball)

[02:11] Substitution (Team_085): Magic Beal OUT → Khris Brogdon IN (stamina_rule2)

[02:11] Substitution (Team_085): Stephen Bird OUT → Jordan Morant IN (stamina_rule2)

[02:11] Substitution (Team_085): Larry Duncan OUT → Giannis Johnson IN (stamina_rule2)

[02:11] Substitution (Team_085): Collin Mobley OUT → Malcolm Beal IN (stamina_rule2)

[02:11] Substitution (Team_019): Rudy Giddey OUT → Gary Ginobili IN (stamina_rule2)

[02:11] Substitution (Team_019): Brandon James OUT → Jalen Turner IN (stamina_rule2)

[02:11] Substitution (Team_019): D'Angelo Randle OUT → Blake LaVine IN (stamina_rule2)

[02:11] Substitution (Team_019): DeMar James OUT → Tim Jordan IN (stamina_rule2)

[01:56] Team_019 possession (Score: 63-65)
Gary Ginobili attempts a 3Pt. Contested by Khris Brogdon (5.9 feet, MAN). Gary Ginobili misses. Rebound secured by Malcolm Beal.

[01:40] Team_085 possession (Score: 63-65)
Giannis Johnson attempts a 3Pt. Contested by Blake LaVine (4.7 feet, MAN). GIANNIS JOHNSON MAKES IT! Assist: Khris Brogdon
Score: 66-65

[01:28] Team_019 possession (Score: 66-65)
Tim Jordan attempts a Layup. Contested by Paul Wagner (3.8 feet, MAN). TIM JORDAN MAKES IT!
Score: 66-67

[01:13] Team_085 possession (Score: 66-67)
Jordan Morant drives and kicks out. Giannis Johnson attempts a Midrange. Contested by Blake LaVine (4.7 feet, MAN). Giannis Johnson misses. Rebound secured by Shai Ingram.

[00:57] Team_019 possession (Score: 66-67)
Jalen Turner attempts a 3Pt. Contested by Jordan Morant (3.7 feet, MAN). JALEN TURNER MAKES IT! Assist: Shai Ingram
Score: 66-70

[00:41] Team_085 possession (Score: 66-70)
Khris Brogdon loses control! Ball rolls out of bounds! TURNOVER! (dead ball)

[00:41] Substitution (Team_085): Paul Wagner OUT → Jalen Leonard IN (stamina_rule2)

[00:22] Team_019 possession (Score: 66-70)
Shai Ingram attempts a 3Pt. Contested by Jordan Morant (3.5 feet, ZONE). Shai Ingram misses. Rebound secured by Malcolm Beal.

[00:06] Team_085 possession (Score: 66-70)
Malcolm Beal drives to the basket... Malcolm Beal loses control! Ball rolls out of bounds! TURNOVER! (dead ball)

================================================================================
                              3RD QUARTER COMPLETE                              
================================================================================

3RD QUARTER SCORE: Team_085 21, Team_019 21

BOX SCORE:
================================================================================

Team_085
--------------------------------------------------------------------------------
Player                MIN  PTS  REB  AST  TO      FG   FG%      3P   3P%
--------------------------------------------------------------------------------
Larry Duncan           30    5    6    0   0   2/3    66.7     0/0   0.0
Paul Wagner            31    5    4    1   0   2/5    40.0     0/0   0.0
Stephen Bird           30    4    0    1   0   2/4    50.0     0/0   0.0
Magic Beal             30    3    0    3   0   1/2    50.0     0/0   0.0
Giannis Johnson         7    3    0    0   0   1/1   100.0     0/0   0.0
Collin Mobley          30    0    3    2   0   0/0     0.0     0/0   0.0
Malcolm Beal            7    0    2    0   0   0/0     0.0     0/0   0.0
Khris Brogdon           7    0    0    1   0   0/0     0.0     0/0   0.0
Jordan Morant           7    0    0    0   0   0/1     0.0     0/0   0.0

TEAM: FG: 8/16 (50.0%), 3PT: 4/8 (50.0%), REB: 14 (3 off, 11 def), AST: 8, TO: 7
TEAM FOULS: 6 [Team_019 in BONUS]


Team_019
--------------------------------------------------------------------------------
Player                MIN  PTS  REB  AST  TO      FG   FG%      3P   3P%
--------------------------------------------------------------------------------
D'Angelo Randle        30    5    6    0   0   2/3    66.7     0/0   0.0
Rudy Giddey            30    5    0    0   0   2/4    50.0     0/0   0.0
Jalen Turner            7    3    0    0   0   1/1   100.0     0/0   0.0
DeMar James            30    2    1    1   0   1/4    25.0     0/0   0.0
Shai Ingram             8    2    1    1   0   1/3    33.3     0/0   0.0
Tim Jordan              7    2    0    0   0   1/1   100.0     0/0   0.0
Tobias Hyland          28    0    3    0   0   0/1     0.0     0/0   0.0
Brandon James          30    0    0    0   0   0/2     0.0     0/0   0.0
Gary Ginobili           7    0    0    0   0   0/1     0.0     0/0   0.0

TEAM: FG: 8/20 (40.0%), 3PT: 2/9 (22.2%), REB: 12 (4 off, 8 def), AST: 2, TO: 2
TEAM FOULS: 1

================================================================================

================================================================================
                       4TH QUARTER - Team_085 vs Team_019                       
================================================================================

[12:00] Team_085 possession (Score: 66-70)
Magic Beal drives and kicks out. Magic Beal attempts a 3Pt. Contested by Rudy Giddey (5.3 feet, MAN). Magic Beal misses. Rebound secured by Tobias Hyland.

[11:42] Team_019 possession (Score: 66-70)
Brandon James attempts a 3Pt. Contested by Magic Beal (4.1 feet, ZONE). Brandon James misses. Offensive rebound by Tobias Hyland! Tobias Hyland kicks it out.

[11:29] Team_019 possession (Score: 66-70)
Tobias Hyland attempts a 3Pt. Contested by Paul Wagner (3.8 feet, MAN). Tobias Hyland misses. Rebound secured by Collin Mobley.

[11:18] Team_085 possession (Score: 66-70)
Paul Wagner attempts a 3Pt. Contested by D'Angelo Randle (4.0 feet, ZONE). Paul Wagner misses. Rebound secured by DeMar James.

[11:04] Team_019 possession (Score: 66-70)
Brandon James loses control! Ball rolls out of bounds! TURNOVER! (dead ball)

[10:47] Team_085 possession (Score: 66-70)
FOUL! Holding foul on DeMar James. [Team fouls: 1] No free throws, side out. (DeMar James: 1 personal fouls)

[10:34] Team_085 possession (Score: 66-70)
Stephen Bird drives, Brandon James stays with him. Stephen Bird attempts a Dunk. Contested by Brandon James (5.5 feet, MAN). STEPHEN BIRD MAKES IT! Assist: Magic Beal
Score: 68-70

[10:22] Team_019 possession (Score: 68-70)
D'Angelo Randle attempts a Midrange. Contested by Larry Duncan (3.4 feet, MAN). D'Angelo Randle misses. Rebound secured by Paul Wagner.

[10:04] Team_085 possession (Score: 68-70)
Paul Wagner attempts a 3Pt. Contested by D'Angelo Randle (4.1 feet, ZONE). PAUL WAGNER MAKES IT! Assist: Larry Duncan
Score: 71-70

[09:52] Team_019 possession (Score: 71-70)
D'Angelo Randle attempts a 3Pt. Contested by Larry Duncan (3.5 feet, MAN). D'Angelo Randle misses. Rebound secured by Paul Wagner.

[09:35] Team_085 possession (Score: 71-70)
Paul Wagner attempts a 3Pt. Contested by Tobias Hyland (6.0 feet, MAN). PAUL WAGNER MAKES IT!
Score: 74-70

[09:18] Team_019 possession (Score: 74-70)
D'Angelo Randle attempts a 3Pt. Contested by Magic Beal (4.5 feet, ZONE). D'Angelo Randle misses. FOUL! Loose ball foul on Collin Mobley during the rebound battle. [Team fouls: 1] No free throws, side out. (Collin Mobley: 1 personal fouls)

[09:02] Team_019 possession (Score: 74-70)
D'Angelo Randle attempts a Midrange. Contested by Paul Wagner (4.2 feet, ZONE). D'Angelo Randle misses. Rebound secured by Collin Mobley.

[08:49] Team_085 possession (Score: 74-70)
Stephen Bird attempts a 3Pt. Contested by Brandon James (5.6 feet, MAN). Stephen Bird misses. Rebound secured by D'Angelo Randle.

[08:35] Team_019 possession (Score: 74-70)
Tobias Hyland attempts a Midrange. Contested by Paul Wagner (4.1 feet, MAN). Tobias Hyland misses. FOUL! Loose ball foul on Collin Mobley during the rebound battle. [Team fouls: 2] No free throws, side out. (Collin Mobley: 2 personal fouls)

[08:25] Team_019 possession (Score: 74-70)
Brandon James drives and kicks out. DeMar James attempts a 3Pt. Contested by Magic Beal (4.4 feet, ZONE). DeMar James misses. Rebound secured by Paul Wagner.

[08:12] Team_085 possession (Score: 74-70)
FOUL! Reach-in foul on DeMar James during the drive. [Team fouls: 2] No free throws, side out. (DeMar James: 2 personal fouls)

[07:52] Team_085 possession (Score: 74-70)
Larry Duncan attempts a 3Pt. Wide open! Rudy Giddey is 6.0 feet away. [ZONE] Larry Duncan misses. Rebound secured by DeMar James.

[07:41] Team_019 possession (Score: 74-70)
Rudy Giddey drives to the basket... Rudy Giddey loses the ball! Stripped by Magic Beal! TURNOVER! (live ball)

[07:27] Team_085 possession (Score: 74-70)
Magic Beal drives, Rudy Giddey stays with him. Magic Beal attempts a Dunk. Wide open! Rudy Giddey is 6.1 feet away. [MAN] MAGIC BEAL MAKES IT!
Score: 76-70

[07:08] Team_019 possession (Score: 76-70)
Tobias Hyland drives and kicks out. D'Angelo Randle attempts a 3Pt. Contested by Larry Duncan (3.6 feet, MAN). D'Angelo Randle misses. Rebound secured by Collin Mobley.

[06:51] Team_085 possession (Score: 76-70)
Magic Beal attempts a Midrange. Contested by Brandon James (6.0 feet, ZONE). Magic Beal misses. Rebound secured by DeMar James.

[06:34] Team_019 possession (Score: 76-70)
DeMar James attempts a Layup. Contested by Collin Mobley (4.9 feet, MAN). DeMar James misses. Rebound secured by Collin Mobley.

[06:20] Team_085 possession (Score: 76-70)
Larry Duncan attempts a 3Pt. Contested by D'Angelo Randle (4.7 feet, ZONE). Larry Duncan misses. Offensive rebound by Paul Wagner! Paul Wagner kicks it out.

[06:02] Team_085 possession (Score: 76-70)
Stephen Bird attempts a 3Pt. BLOCKED BY BRANDON JAMES! Ball deflects out of bounds off Stephen Bird.

[05:47] Team_019 possession (Score: 76-70)
Brandon James attempts a 3Pt. Contested by Magic Beal (4.7 feet, ZONE). Brandon James misses. FOUL! Loose ball foul on Collin Mobley during the rebound battle. [Team fouls: 3] No free throws, side out. (Collin Mobley: 3 personal fouls)

[05:30] Team_019 possession (Score: 76-70)
D'Angelo Randle attempts a 3Pt. Contested by Larry Duncan (4.0 feet, MAN). D'Angelo Randle misses. Rebound secured by Paul Wagner.

[05:17] Team_085 possession (Score: 76-70)
FOUL! Holding foul on Rudy Giddey. [Team fouls: 3] No free throws, side out. (Rudy Giddey: 1 personal fouls)

[04:59] Team_085 possession (Score: 76-70)
Larry Duncan attempts a 3Pt. Contested by D'Angelo Randle (4.8 feet, ZONE). Larry Duncan misses. Rebound secured by DeMar James.

[04:46] Team_019 possession (Score: 76-70)
D'Angelo Randle attempts a 3Pt. Contested by Magic Beal (5.0 feet, ZONE). D'Angelo Randle misses. Rebound secured by Larry Duncan.

[04:34] Team_085 possession (Score: 76-70)
Collin Mobley drives, DeMar James stays with him. Collin Mobley attempts a Layup. Contested by DeMar James (5.1 feet, MAN). COLLIN MOBLEY MAKES IT! Assist: Paul Wagner
Score: 78-70

[04:18] Team_019 possession (Score: 78-70)
Tobias Hyland attempts a 3Pt. Contested by Stephen Bird (4.5 feet, ZONE). Tobias Hyland misses. Rebound secured by Paul Wagner.

[03:59] Team_085 possession (Score: 78-70)
Collin Mobley attempts a Midrange. Contested by DeMar James (5.2 feet, MAN). Collin Mobley misses. Rebound secured by D'Angelo Randle.

[03:43] Team_019 possession (Score: 78-70)
Rudy Giddey drives to the basket... Rudy Giddey throws a bad pass! Stolen by Paul Wagner! TURNOVER! (live ball)

[03:26] Team_085 possession (Score: 78-70)
Larry Duncan attempts a Layup. Contested by D'Angelo Randle (5.1 feet, MAN). LARRY DUNCAN MAKES IT! Assist: Paul Wagner
Score: 80-70

[03:08] Team_019 possession (Score: 80-70)
Tobias Hyland makes the Midrange and draws the foul on Larry Duncan! And-1! Tobias Hyland to the line for 1. [Team fouls: 4] (Larry Duncan: 1 personal fouls)   FT 1/1: MISS Tobias Hyland makes 0/1 from the line. Rebound secured by Collin Mobley.
Score: 80-72

[02:50] Team_085 possession (Score: 80-72)
Stephen Bird attempts a 3Pt. Contested by D'Angelo Randle (5.0 feet, ZONE). Stephen Bird misses. Offensive rebound by Larry Duncan! Larry Duncan kicks it out.

[02:36] Team_085 possession (Score: 80-72)
Stephen Bird attempts a 3Pt. Contested by D'Angelo Randle (5.0 feet, ZONE). Stephen Bird misses. Rebound secured by DeMar James.

[02:20] Team_019 possession (Score: 80-72)
Brandon James attempts a Layup. Contested by Stephen Bird (4.8 feet, MAN). BRANDON JAMES MAKES IT! Assist: DeMar James
Score: 80-74

[02:05] Team_085 possession (Score: 80-74)
Magic Beal attempts a Midrange. Wide open! Brandon James is 6.4 feet away. [ZONE] Magic Beal misses. Offensive rebound by Paul Wagner! Paul Wagner kicks it out.

[01:47] Team_085 possession (Score: 80-74)
Paul Wagner loses control! Ball rolls out of bounds! TURNOVER! (dead ball)

[01:47] Substitution (Team_085): Magic Beal OUT → Khris Brogdon IN (stamina_rule2)

[01:47] Substitution (Team_085): Stephen Bird OUT → Jordan Morant IN (stamina_rule2)

[01:47] Substitution (Team_085): Larry Duncan OUT → Giannis Johnson IN (stamina_rule2)

[01:47] Substitution (Team_085): Paul Wagner OUT → Jalen Leonard IN (stamina_rule2)

[01:47] Substitution (Team_085): Collin Mobley OUT → Malcolm Beal IN (stamina_rule2)

[01:47] Substitution (Team_019): Rudy Giddey OUT → Gary Ginobili IN (stamina_rule2)

[01:47] Substitution (Team_019): Brandon James OUT → Jalen Turner IN (stamina_rule2)

[01:47] Substitution (Team_019): D'Angelo Randle OUT → Blake LaVine IN (stamina_rule2)

[01:47] Substitution (Team_019): Tobias Hyland OUT → Shai Ingram IN (stamina_rule2)

[01:47] Substitution (Team_019): DeMar James OUT → Tim Jordan IN (stamina_rule2)

[01:35] Team_019 possession (Score: 80-74)
Blake LaVine attempts a 3Pt. Contested by Giannis Johnson (6.0 feet, MAN). Blake LaVine misses. Rebound secured by Jalen Leonard.

[01:25] Team_085 possession (Score: 80-74)
FOUL! Shooting foul on Shai Ingram. Khris Brogdon to the line for 2 free throws. [Team fouls: 4] (Shai Ingram: 1 personal fouls)   FT 1/2: GOOD   FT 2/2: GOOD Khris Brogdon makes 2/2 from the line.
Score: 82-74

[01:09] Team_019 possession (Score: 82-74)
Gary Ginobili attempts a 3Pt. Contested by Khris Brogdon (5.9 feet, MAN). GARY GINOBILI MAKES IT! Assist: Jalen Turner
Score: 82-77

[00:52] Team_085 possession (Score: 82-77)
FOUL! Shooting foul on Shai Ingram. Malcolm Beal to the line for 2 free throws. [BONUS: 5 team fouls] (Shai Ingram: 2 personal fouls)   FT 1/2: GOOD   FT 2/2: GOOD Malcolm Beal makes 2/2 from the line.
Score: 84-77

[00:34] Team_019 possession (Score: 84-77)
FOUL! Shooting foul on Giannis Johnson. Blake LaVine to the line for 2 free throws. [BONUS: 5 team fouls] (Giannis Johnson: 1 personal fouls)   FT 1/2: MISS   FT 2/2: GOOD Blake LaVine makes 1/2 from the line.
Score: 84-78

[00:21] Team_085 possession (Score: 84-78)
Malcolm Beal attempts a Midrange. Contested by Shai Ingram (4.1 feet, MAN). Malcolm Beal misses. Offensive rebound by Jalen Leonard! Jalen Leonard kicks it out.

[00:08] Team_085 possession (Score: 84-78)
Giannis Johnson attempts a Midrange. BLOCKED BY BLAKE LAVINE! Ball is loose! Rebound secured by Tim Jordan.

================================================================================
                              4TH QUARTER COMPLETE                              
================================================================================

4TH QUARTER SCORE: Team_085 18, Team_019 8

BOX SCORE:
================================================================================

Team_085
--------------------------------------------------------------------------------
Player                MIN  PTS  REB  AST  TO      FG   FG%      3P   3P%
--------------------------------------------------------------------------------
Paul Wagner            42    6    7    2   0   2/3    66.7     0/0   0.0
Magic Beal             40    2    0    1   0   1/3    33.3     0/0   0.0
Collin Mobley          40    2    5    0   0   1/2    50.0     0/0   0.0
Stephen Bird           40    2    0    0   0   1/4    25.0     0/0   0.0
Larry Duncan           40    2    2    1   0   1/3    33.3     0/0   0.0
Khris Brogdon           8    2    0    0   0   1/1   100.0     0/0   0.0
Malcolm Beal            8    2    0    0   0   1/1   100.0     0/0   0.0
Jalen Leonard           7    0    2    0   0   0/0     0.0     0/0   0.0
Giannis Johnson         8    0    0    0   0   0/1     0.0     0/0   0.0

TEAM: FG: 8/18 (44.4%), 3PT: 2/8 (25.0%), REB: 16 (4 off, 12 def), AST: 4, TO: 1
TEAM FOULS: 5 [Team_019 in BONUS]


Team_019
--------------------------------------------------------------------------------
Player                MIN  PTS  REB  AST  TO      FG   FG%      3P   3P%
--------------------------------------------------------------------------------
Gary Ginobili           8    3    0    0   0   1/1   100.0     0/0   0.0
Brandon James          40    2    0    0   0   1/2    50.0     0/0   0.0
Blake LaVine            8    1    0    0   0   1/2    50.0     0/0   0.0
Tobias Hyland          39    0    3    0   0   0/4     0.0     0/0   0.0
DeMar James            40    0    7    1   0   0/1     0.0     0/0   0.0
D'Angelo Randle        40    0    2    0   0   0/5     0.0     0/0   0.0
Jalen Turner            8    0    0    1   0   0/0     0.0     0/0   0.0
Tim Jordan              8    0    1    0   0   0/0     0.0     0/0   0.0

TEAM: FG: 3/15 (20.0%), 3PT: 1/7 (14.3%), REB: 13 (4 off, 9 def), AST: 2, TO: 3
TEAM FOULS: 5 [Team_085 in BONUS]

================================================================================

================================================================================
                               FULL GAME COMPLETE                               
================================================================================

FINAL SCORE: Team_085 84, Team_019 78

SCORING BY QUARTER:
--------------------------------------------------------------------------------
Team                     Q1     Q2     Q3     Q4    FINAL
--------------------------------------------------------------------------------
Team_085                 18     27     21     18       84
Team_019                 26     23     21      8       78
--------------------------------------------------------------------------------

FULL GAME BOX SCORE:
================================================================================

Team_085
--------------------------------------------------------------------------------
Player                MIN  PTS  REB  AST  TO      FG   FG%      3P   3P%      FT STL BLK
--------------------------------------------------------------------------------
Paul Wagner            42   13   13    4   4   5/16   31.2   3/10   30.0   0/0     2   1
Magic Beal             40    9    0    5   1   5/12   41.7   1/4    25.0   2/2     1   2
Stephen Bird           40   16    0    3   1   6/13   46.2   1/4    25.0   2/3     2   0
Larry Duncan           40   16   14    2   1   5/12   41.7   3/9    33.3   0/0     0   0
Collin Mobley          40    7   14    5   3   3/5    60.0   0/0     0.0   2/3     1   1
Khris Brogdon           8    4    0    1   1   1/2    50.0   0/1     0.0   3/4     0   0
Jordan Morant           8    2    0    0   0   1/2    50.0   0/0     0.0   0/0     0   0
Giannis Johnson         8    3    0    0   1   1/3    33.3   1/1   100.0   0/0     0   0
Malcolm Beal            8    9    5    0   0   4/4   100.0   0/0     0.0   5/5     0   1
Jalen Leonard           7    2    3    1   0   2/2   100.0   0/0     0.0   0/0     0   0

TEAM: FG: 34/72 (47.2%), 3PT: 9/29 (31.0%), REB: 47 (12 off, 35 def), AST: 21, TO: 12


Team_019
--------------------------------------------------------------------------------
Player                MIN  PTS  REB  AST  TO      FG   FG%      3P   3P%      FT STL BLK
--------------------------------------------------------------------------------
Rudy Giddey            40   14    0    1   2   5/11   45.5   3/6    50.0   3/4     0   0
Brandon James          40   10    0    3   3   5/8    62.5   2/4    50.0   0/0     0   1
D'Angelo Randle        40    8   13    1   2   3/10   30.0   1/5    20.0   3/3     0   0
DeMar James            40   19   19    4   2   8/12   66.7   1/2    50.0   7/7     2   2
Tobias Hyland          39    4   13    1   0   2/14   14.3   0/3     0.0   4/5     2   0
Shai Ingram            10    4    4    3   1   2/4    50.0   0/1     0.0   2/2     0   0
Gary Ginobili           8    7    0    0   0   3/5    60.0   1/2    50.0   0/0     0   0
Jalen Turner            8    5    0    2   0   2/3    66.7   1/1   100.0   0/0     0   0
Blake LaVine            8    1    0    1   0   1/3    33.3   0/1     0.0   1/2     0   1
Tim Jordan              8    2    2    0   0   1/1   100.0   0/0     0.0   0/0     0   0

TEAM: FG: 32/71 (45.1%), 3PT: 9/25 (36.0%), REB: 53 (16 off, 37 def), AST: 16, TO: 10

================================================================================
