================================================================================
                        FULL GAME - Team_031 vs Team_097                        
================================================================================

================================================================================
                       1ST QUARTER - Team_031 vs Team_097                       
================================================================================

[12:00] Team_031 possession (Score: 0-0)
Immanuel James attempts a 3Pt. Contested by Anthony Haliburton (3.7 feet, MAN). Immanuel James misses. Rebound secured by Shai Poole.

[11:44] Team_097 possession (Score: 0-0)
Shai Poole makes the Dunk and draws the foul on Pau Irving! And-1! Shai Poole to the line for 1. [Team fouls: 1] (Pau Irving: 1 personal fouls)   FT 1/1: GOOD Shai Poole makes 1/1 from the line.
Score: 0-3

[11:28] Team_031 possession (Score: 0-3)
Shai Durant attempts a 3Pt. Contested by Evan Brogdon (4.8 feet, MAN). Shai Durant misses. Rebound secured by Shai Poole.

[11:14] Team_097 possession (Score: 0-3)
Evan Brogdon drives, Immanuel James stays with him. Evan Brogdon attempts a Layup. Contested by Immanuel James (3.7 feet, ZONE). Evan Brogdon misses. Rebound secured by Immanuel James.

[11:01] Team_031 possession (Score: 0-3)
Shai Durant attempts a 3Pt. Contested by Evan Brogdon (4.8 feet, ZONE). SHAI DURANT MAKES IT! Assist: Gary Morant
Score: 3-3

[10:47] Team_097 possession (Score: 3-3)
FOUL! Reach-in foul on Shai Durant during the drive. [Team fouls: 2] No free throws, side out. (Shai Durant: 1 personal fouls)

[10:37] Team_097 possession (Score: 3-3)
Tyrese Stewart throws a bad pass out of bounds! TURNOVER! (dead ball)

[10:21] Team_031 possession (Score: 3-3)
Gary Morant attempts a Midrange. Contested by Evan Brogdon (5.3 feet, ZONE). GARY MORANT MAKES IT! Assist: Pau Irving
Score: 5-3

[10:09] Team_097 possession (Score: 5-3)
Evan Brogdon drives to the basket... Evan Brogdon throws a bad pass out of bounds! TURNOVER! (dead ball)

[09:55] Team_031 possession (Score: 5-3)
Pau Irving drives to the basket... FOUL! Offensive foul on Pau Irving! Shai Poole drew the charge! [Team fouls: 3] (Pau Irving: 2 personal fouls) TURNOVER! (dead ball)

[09:39] Team_097 possession (Score: 5-3)
FOUL! Shooting foul on Luka Sabonis. Tyrese Stewart to the line for 2 free throws. [Team fouls: 4] (Luka Sabonis: 1 personal fouls)   FT 1/2: GOOD   FT 2/2: MISS Tyrese Stewart makes 1/2 from the line. Rebound secured by Luka Sabonis.
Score: 5-4

[09:22] Team_031 possession (Score: 5-4)
Pau Irving attempts a 3Pt. Contested by Shai Poole (3.5 feet, ZONE). Pau Irving misses. Rebound secured by Anthony Haliburton.

[09:07] Team_097 possession (Score: 5-4)
FOUL! Shooting foul on Pau Irving. Jrue Haliburton to the line for 2 free throws. [BONUS: 5 team fouls] (Pau Irving: 3 personal fouls)   FT 1/2: GOOD   FT 2/2: MISS Jrue Haliburton makes 1/2 from the line. Rebound secured by Gary Morant.
Score: 5-5

[08:54] Team_031 possession (Score: 5-5)
Pau Irving attempts a 3Pt. Contested by Shai Poole (3.5 feet, MAN). Pau Irving misses. Rebound secured by Tyrese Stewart.

[08:36] Team_097 possession (Score: 5-5)
Anthony Haliburton attempts a Layup. Contested by Luka Sabonis (3.6 feet, ZONE). ANTHONY HALIBURTON MAKES IT! Assist: Evan Brogdon
Score: 5-7

[08:21] Team_031 possession (Score: 5-7)
Shai Durant attempts a 3Pt. Contested by Evan Brogdon (4.8 feet, MAN). SHAI DURANT MAKES IT! Assist: Luka Sabonis
Score: 8-7

[08:09] Team_097 possession (Score: 8-7)
Anthony Haliburton attempts a Dunk. BLOCKED BY IMMANUEL JAMES! Ball goes out off Immanuel James. Anthony Haliburton's ball!

[07:56] Team_097 possession (Score: 8-7)
Jrue Haliburton drives and kicks out. Tyrese Stewart attempts a 3Pt. Contested by Gary Morant (3.8 feet, ZONE). Tyrese Stewart misses. Rebound secured by Gary Morant.

[07:42] Team_031 possession (Score: 8-7)
Luka Sabonis attempts a 3Pt. Contested by Shai Poole (4.0 feet, ZONE). Luka Sabonis misses. FOUL! Loose ball foul on Tyrese Stewart during the rebound battle. [Team fouls: 1] No free throws, side out. (Tyrese Stewart: 1 personal fouls)

[07:25] Team_031 possession (Score: 8-7)
Pau Irving attempts a 3Pt. Contested by Shai Poole (3.5 feet, MAN). Pau Irving misses. Rebound secured by Tyrese Stewart.

[07:11] Team_097 possession (Score: 8-7)
FOUL! Shooting foul on Immanuel James. Evan Brogdon to the line for 2 free throws. [BONUS: 6 team fouls] (Immanuel James: 1 personal fouls)   FT 1/2: MISS   FT 2/2: MISS Evan Brogdon makes 0/2 from the line. Rebound secured by Luka Sabonis.

[06:55] Team_031 possession (Score: 8-7)
Immanuel James drives, picks up Anthony Haliburton. Help arrives from Jrue Haliburton! Immanuel James attempts a Layup. Contested by Jrue Haliburton (3.7 feet, MAN). IMMANUEL JAMES MAKES IT! Assist: Pau Irving
Score: 10-7

[06:40] Team_097 possession (Score: 10-7)
Tyrese Stewart drives and kicks out. Shai Poole attempts a 3Pt. Contested by Pau Irving (3.6 feet, ZONE). Shai Poole misses. Offensive rebound by Tyrese Stewart! Tyrese Stewart kicks it out.

[06:27] Team_097 possession (Score: 10-7)
Evan Brogdon attempts a 3Pt. Contested by Shai Durant (4.6 feet, MAN). Evan Brogdon misses. Rebound secured by Gary Morant.

[06:13] Team_031 possession (Score: 10-7)
Immanuel James attempts a Layup. Contested by Anthony Haliburton (3.7 feet, MAN). IMMANUEL JAMES MAKES IT!
Score: 12-7

[05:58] Team_097 possession (Score: 12-7)
FOUL! Shooting foul on Pau Irving. Evan Brogdon to the line for 2 free throws. [BONUS: 7 team fouls] (Pau Irving: 4 personal fouls)   FT 1/2: GOOD   FT 2/2: GOOD Evan Brogdon makes 2/2 from the line.
Score: 12-9

[05:43] Team_031 possession (Score: 12-9)
Shai Durant drives and kicks out. Luka Sabonis attempts a Midrange. Contested by Anthony Haliburton (3.3 feet, MAN). LUKA SABONIS MAKES IT!
Score: 14-9

[05:28] Team_097 possession (Score: 14-9)
Evan Brogdon attempts a Midrange. Contested by Shai Durant (4.6 feet, MAN). Evan Brogdon misses. Rebound secured by Luka Sabonis.

[05:13] Team_031 possession (Score: 14-9)
Immanuel James attempts a 3Pt. Contested by Anthony Haliburton (3.7 feet, MAN). Immanuel James misses. Rebound secured by Tyrese Stewart.

[04:58] Team_097 possession (Score: 14-9)
Jrue Haliburton throws a bad pass! Stolen by Gary Morant! TURNOVER! (live ball)

[04:43] Team_031 possession (Score: 14-9)
Shai Durant attempts a 3Pt. Contested by Jrue Haliburton (5.4 feet, ZONE). SHAI DURANT MAKES IT! Assist: Pau Irving
Score: 17-9

[04:26] Team_097 possession (Score: 17-9)
Anthony Haliburton commits a violation (traveling/carry)! TURNOVER! (dead ball)

[04:13] Team_031 possession (Score: 17-9)
Gary Morant throws a bad pass! Stolen by Jrue Haliburton! TURNOVER! (live ball)

[03:59] Team_097 possession (Score: 17-9)
Anthony Haliburton attempts a Layup. Contested by Immanuel James (3.7 feet, MAN). Anthony Haliburton misses. Offensive rebound by Tyrese Stewart! Tyrese Stewart kicks it out.

[03:46] Team_097 possession (Score: 17-9)
Evan Brogdon attempts a Midrange. Contested by Shai Durant (4.7 feet, MAN). Evan Brogdon misses. Rebound secured by Luka Sabonis.

[03:29] Team_031 possession (Score: 17-9)
FOUL! Shooting foul on Anthony Haliburton. Luka Sabonis to the line for 2 free throws. [Team fouls: 2] (Anthony Haliburton: 1 personal fouls)   FT 1/2: GOOD   FT 2/2: MISS Luka Sabonis makes 1/2 from the line. Rebound secured by Anthony Haliburton.
Score: 18-9

[03:14] Team_097 possession (Score: 18-9)
Anthony Haliburton attempts a Layup. Contested by Immanuel James (3.8 feet, MAN). ANTHONY HALIBURTON MAKES IT!
Score: 18-11

[02:59] Team_031 possession (Score: 18-11)
Shai Durant attempts a 3Pt. Contested by Shai Poole (3.7 feet, ZONE). Shai Durant misses. Rebound secured by Tyrese Stewart.

[02:43] Team_097 possession (Score: 18-11)
Tyrese Stewart throws a bad pass! Stolen by Luka Sabonis! TURNOVER! (live ball)

[02:28] Team_031 possession (Score: 18-11)
Luka Sabonis makes the Dunk and draws the foul on Jrue Haliburton! And-1! Luka Sabonis to the line for 1. [Team fouls: 3] (Jrue Haliburton: 1 personal fouls)   FT 1/1: GOOD Luka Sabonis makes 1/1 from the line.
Score: 21-11

[02:15] Team_097 possession (Score: 21-11)
Shai Poole attempts a 3Pt. Contested by Pau Irving (4.4 feet, MAN). Shai Poole misses. Rebound secured by Gary Morant.

[02:00] Team_031 possession (Score: 21-11)
Pau Irving attempts a Midrange. Contested by Jrue Haliburton (5.5 feet, ZONE). PAU IRVING MAKES IT!
Score: 23-11

[01:41] Team_097 possession (Score: 23-11)
Jrue Haliburton attempts a Layup. BLOCKED BY GARY MORANT! Ball is loose! Rebound secured by Immanuel James.

[01:23] Team_031 possession (Score: 23-11)
Immanuel James makes the Layup and draws the foul on Anthony Haliburton! And-1! Immanuel James to the line for 1. [Team fouls: 4] (Anthony Haliburton: 2 personal fouls)   FT 1/1: GOOD Immanuel James makes 1/1 from the line.
Score: 26-11

[01:04] Team_097 possession (Score: 26-11)
Evan Brogdon makes the Midrange and draws the foul on Gary Morant! And-1! Evan Brogdon to the line for 1. [BONUS: 8 team fouls] (Gary Morant: 1 personal fouls)   FT 1/1: GOOD Evan Brogdon makes 1/1 from the line.
Score: 26-14

[00:45] Team_031 possession (Score: 26-14)
Shai Durant attempts a 3Pt. Contested by Shai Poole (3.9 feet, ZONE). Shai Durant misses. Rebound secured by Anthony Haliburton.

[00:30] Team_097 possession (Score: 26-14)
FOUL! Holding foul on Immanuel James. [IN THE BONUS! 9 team fouls] Anthony Haliburton to the line for 2 free throws. (Immanuel James: 2 personal fouls)   FT 1/2: GOOD   FT 2/2: GOOD Anthony Haliburton makes 2/2 from the line.
Score: 26-16

[00:17] Team_031 possession (Score: 26-16)
FOUL! Holding foul on Evan Brogdon. [IN THE BONUS! 5 team fouls] Shai Durant to the line for 2 free throws. (Evan Brogdon: 1 personal fouls)   FT 1/2: GOOD   FT 2/2: GOOD Shai Durant makes 2/2 from the line.
Score: 28-16

[00:06] Team_097 possession (Score: 28-16)
Jrue Haliburton attempts a Midrange. Contested by Immanuel James (4.2 feet, ZONE). JRUE HALIBURTON MAKES IT!
Score: 28-18

================================================================================
                              1ST QUARTER COMPLETE                              
================================================================================

1ST QUARTER SCORE: Team_031 28, Team_097 18

BOX SCORE:
================================================================================

Team_031
--------------------------------------------------------------------------------
Player                MIN  PTS  REB  AST  TO      FG   FG%      3P   3P%
--------------------------------------------------------------------------------
Shai Durant            12   11    0    0   0   4/7    57.1     0/0   0.0
Immanuel James         12    7    3    0   0   3/5    60.0     0/0   0.0
Luka Sabonis           12    5    4    1   0   2/3    66.7     0/0   0.0
Gary Morant            12    2    4    1   0   1/1   100.0     0/0   0.0
Pau Irving             12    2    0    3   0   1/4    25.0     0/0   0.0

TEAM: FG: 11/20 (55.0%), 3PT: 3/11 (27.3%), REB: 11 (1 off, 10 def), AST: 5, TO: 2
TEAM FOULS: 9 [Team_097 in BONUS]


Team_097
--------------------------------------------------------------------------------
Player                MIN  PTS  REB  AST  TO      FG   FG%      3P   3P%
--------------------------------------------------------------------------------
Anthony Haliburton     12    6    3    0   0   3/3   100.0     0/0   0.0
Evan Brogdon           12    5    0    1   0   2/7    28.6     0/0   0.0
Shai Poole             12    3    2    0   0   1/2    50.0     0/0   0.0
Jrue Haliburton        12    2    0    0   0   1/4    25.0     0/0   0.0
Tyrese Stewart         12    0    6    0   0   0/1     0.0     0/0   0.0

TEAM: FG: 7/17 (41.2%), 3PT: 0/2 (0.0%), REB: 11 (2 off, 9 def), AST: 1, TO: 5
TEAM FOULS: 5 [Team_031 in BONUS]

================================================================================

================================================================================
                       2ND QUARTER - Team_031 vs Team_097                       
================================================================================

[12:00] Team_031 possession (Score: 28-18)
Immanuel James attempts a Layup. Contested by Anthony Haliburton (4.0 feet, MAN). IMMANUEL JAMES MAKES IT! Assist: Pau Irving
Score: 30-18

[11:47] Team_097 possession (Score: 30-18)
Evan Brogdon attempts a 3Pt. Contested by Shai Durant (4.8 feet, MAN). EVAN BROGDON MAKES IT! Assist: Jrue Haliburton
Score: 30-21

[11:34] Team_031 possession (Score: 30-21)
Shai Durant drives, Evan Brogdon stays with him. Shai Durant attempts a Layup. Contested by Evan Brogdon (5.1 feet, MAN). SHAI DURANT MAKES IT!
Score: 32-21

[11:19] Team_097 possession (Score: 32-21)
Jrue Haliburton loses the ball! Stripped by Gary Morant! TURNOVER! (live ball)

[11:06] Team_031 possession (Score: 32-21)
Immanuel James attempts a 3Pt. Contested by Shai Poole (4.1 feet, ZONE). IMMANUEL JAMES MAKES IT! Assist: Luka Sabonis
Score: 35-21

[10:53] Team_097 possession (Score: 35-21)
Shai Poole attempts a 3Pt. Contested by Pau Irving (4.5 feet, MAN). Shai Poole misses. Rebound secured by Immanuel James.

[10:38] Team_031 possession (Score: 35-21)
Gary Morant attempts a 3Pt. Wide open! Jrue Haliburton is 6.0 feet away. [MAN] Gary Morant misses. Rebound secured by Tyrese Stewart.

[10:23] Team_097 possession (Score: 35-21)
Anthony Haliburton attempts a 3Pt. Contested by Immanuel James (4.2 feet, MAN). Anthony Haliburton misses. Offensive rebound by Tyrese Stewart! Tyrese Stewart kicks it out.

[10:09] Team_097 possession (Score: 35-21)
Anthony Haliburton drives and kicks out. Evan Brogdon attempts a 3Pt. Contested by Pau Irving (4.2 feet, ZONE). Evan Brogdon misses. Rebound secured by Immanuel James.

[09:55] Team_031 possession (Score: 35-21)
Gary Morant attempts a 3Pt. Wide open! Jrue Haliburton is 6.1 feet away. [MAN] GARY MORANT MAKES IT! Assist: Immanuel James
Score: 38-21

[09:45] Team_097 possession (Score: 38-21)
Shai Poole attempts a 3Pt. Contested by Pau Irving (4.7 feet, MAN). SHAI POOLE MAKES IT! Assist: Anthony Haliburton
Score: 38-24

[09:31] Team_031 possession (Score: 38-24)
FOUL! Reach-in foul on Tyrese Stewart during the drive. [Team fouls: 1] No free throws, side out. (Tyrese Stewart: 1 personal fouls)

[09:19] Team_031 possession (Score: 38-24)
Shai Durant attempts a 3Pt. Contested by Shai Poole (4.1 feet, ZONE). SHAI DURANT MAKES IT! Assist: Immanuel James
Score: 41-24

[09:03] Team_097 possession (Score: 41-24)
FOUL! Reach-in foul on Shai Durant during the drive. [Team fouls: 1] No free throws, side out. (Shai Durant: 1 personal fouls)

[08:46] Team_097 possession (Score: 41-24)
Jrue Haliburton attempts a 3Pt. Contested by Gary Morant (4.9 feet, MAN). JRUE HALIBURTON MAKES IT! Assist: Shai Poole
Score: 41-27

[08:30] Team_031 possession (Score: 41-27)
Shai Durant attempts a Midrange. Contested by Anthony Haliburton (4.2 feet, ZONE). Shai Durant misses. Rebound secured by Tyrese Stewart.

[08:14] Team_097 possession (Score: 41-27)
Evan Brogdon attempts a Layup. Contested by Immanuel James (4.7 feet, ZONE). EVAN BROGDON MAKES IT! Assist: Tyrese Stewart
Score: 41-29

[08:02] Team_031 possession (Score: 41-29)
FOUL! Holding foul on Shai Poole. [Team fouls: 2] No free throws, side out. (Shai Poole: 1 personal fouls)

[07:50] Team_031 possession (Score: 41-29)
Shai Durant attempts a 3Pt. Contested by Shai Poole (4.3 feet, ZONE). SHAI DURANT MAKES IT! Assist: Pau Irving
Score: 44-29

[07:37] Team_097 possession (Score: 44-29)
Jrue Haliburton attempts a 3Pt. Contested by Pau Irving (4.9 feet, ZONE). Jrue Haliburton misses. Rebound secured by Immanuel James.

[07:18] Team_031 possession (Score: 44-29)
Shai Durant drives to the basket... Shai Durant commits a violation (traveling/carry)! TURNOVER! (dead ball)

[07:18] Substitution (Team_031): Shai Durant OUT → Kevin Morant IN (stamina_rule2)

[07:18] Substitution (Team_031): Gary Morant OUT → Isaiah Ingram IN (stamina_rule2)

[07:18] Substitution (Team_031): Pau Irving OUT → Miles Stewart IN (stamina_rule2)

[07:18] Substitution (Team_031): Immanuel James OUT → Kobe Randle IN (stamina_rule2)

[07:18] Substitution (Team_031): Luka Sabonis OUT → Jimmy Poole IN (stamina_rule2)

[07:18] Substitution (Team_097): Evan Brogdon OUT → Gary Carter IN (stamina_rule2)

[07:18] Substitution (Team_097): Jrue Haliburton OUT → Dwyane Ginobili IN (stamina_rule2)

[07:18] Substitution (Team_097): Shai Poole OUT → Miles Dosunmu IN (stamina_rule2)

[07:18] Substitution (Team_097): Anthony Haliburton OUT → Joel Simons IN (stamina_rule2)

[07:18] Substitution (Team_097): Tyrese Stewart OUT → Miles Banchero IN (stamina_rule2)

[07:01] Team_097 possession (Score: 44-29)
Gary Carter attempts a 3Pt. Contested by Miles Stewart (5.1 feet, ZONE). Gary Carter misses. Offensive rebound by Miles Dosunmu! Miles Dosunmu kicks it out.

[06:41] Team_097 possession (Score: 44-29)
FOUL! Shooting foul on Jimmy Poole. Miles Banchero to the line for 2 free throws. [Team fouls: 2] (Jimmy Poole: 1 personal fouls)   FT 1/2: GOOD   FT 2/2: GOOD Miles Banchero makes 2/2 from the line.
Score: 44-31

[06:29] Team_031 possession (Score: 44-31)
Kevin Morant attempts a 3Pt. Contested by Joel Simons (3.6 feet, ZONE). Kevin Morant misses. Rebound secured by Miles Dosunmu.

[06:16] Team_097 possession (Score: 44-31)
Gary Carter attempts a 3Pt. Contested by Miles Stewart (5.1 feet, ZONE). Gary Carter misses. Rebound secured by Jimmy Poole.

[06:04] Team_031 possession (Score: 44-31)
Kevin Morant drives, Gary Carter stays with him. Kevin Morant attempts a Dunk. Contested by Gary Carter (4.8 feet, MAN). KEVIN MORANT MAKES IT! Assist: Miles Stewart
Score: 46-31

[05:48] Team_097 possession (Score: 46-31)
FOUL! Offensive foul on Joel Simons! Kobe Randle drew the charge! [Team fouls: 3] (Joel Simons: 1 personal fouls) TURNOVER! (dead ball)

[05:32] Team_031 possession (Score: 46-31)
Kobe Randle drives, picks up Miles Banchero. Help arrives from Dwyane Ginobili! Kobe Randle attempts a Dunk. Contested by Dwyane Ginobili (5.5 feet, ZONE). Kobe Randle misses. Rebound secured by Miles Banchero.

[05:18] Team_097 possession (Score: 46-31)
Dwyane Ginobili attempts a Midrange. Contested by Isaiah Ingram (4.2 feet, ZONE). Dwyane Ginobili misses. Rebound secured by Jimmy Poole.

[05:02] Team_031 possession (Score: 46-31)
Miles Stewart attempts a 3Pt. Contested by Joel Simons (3.6 feet, ZONE). MILES STEWART MAKES IT! Assist: Kobe Randle
Score: 49-31

[04:43] Team_097 possession (Score: 49-31)
Miles Banchero drives, Jimmy Poole stays with him. Miles Banchero attempts a Layup. Contested by Jimmy Poole (5.8 feet, MAN). Miles Banchero misses. Rebound secured by Isaiah Ingram.

[04:30] Team_031 possession (Score: 49-31)
Kevin Morant attempts a Layup. Contested by Gary Carter (4.8 feet, MAN). KEVIN MORANT MAKES IT!
Score: 51-31

[04:18] Team_097 possession (Score: 51-31)
Miles Banchero attempts a Midrange. Contested by Jimmy Poole (5.8 feet, MAN). Miles Banchero misses. Rebound secured by Jimmy Poole.

[04:03] Team_031 possession (Score: 51-31)
Kobe Randle attempts a Midrange. Contested by Dwyane Ginobili (5.3 feet, ZONE). Kobe Randle misses. Rebound secured by Miles Banchero.

[03:51] Team_097 possession (Score: 51-31)
FOUL! Shooting foul on Kobe Randle. Joel Simons to the line for 2 free throws. [Team fouls: 3] (Kobe Randle: 1 personal fouls)   FT 1/2: GOOD   FT 2/2: GOOD Joel Simons makes 2/2 from the line.
Score: 51-33

[03:35] Team_031 possession (Score: 51-33)
Miles Stewart attempts a Layup. Contested by Miles Dosunmu (3.8 feet, MAN). MILES STEWART MAKES IT! Assist: Isaiah Ingram
Score: 53-33

[03:19] Team_097 possession (Score: 53-33)
Miles Banchero drives, Jimmy Poole stays with him. Miles Banchero attempts a Dunk. Contested by Jimmy Poole (5.8 feet, MAN). MILES BANCHERO MAKES IT! Assist: Dwyane Ginobili
Score: 53-35

[03:06] Team_031 possession (Score: 53-35)
Kobe Randle attempts a Midrange. Contested by Miles Dosunmu (4.5 feet, ZONE). KOBE RANDLE MAKES IT! Assist: Isaiah Ingram
Score: 55-35

[02:57] Team_097 possession (Score: 55-35)
Miles Dosunmu attempts a 3Pt. Contested by Miles Stewart (5.8 feet, MAN). Miles Dosunmu misses. Rebound secured by Kobe Randle.

[02:44] Team_031 possession (Score: 55-35)
Jimmy Poole attempts a Midrange. Contested by Joel Simons (3.5 feet, MAN). JIMMY POOLE MAKES IT!
Score: 57-35

[02:27] Team_097 possession (Score: 57-35)
Gary Carter attempts a Midrange. Contested by Kevin Morant (4.6 feet, MAN). Gary Carter misses. FOUL! Loose ball foul on Kobe Randle during the rebound battle. [Team fouls: 4] No free throws, side out. (Kobe Randle: 2 personal fouls)

[02:12] Team_097 possession (Score: 57-35)
Dwyane Ginobili attempts a Layup. Contested by Kobe Randle (4.3 feet, ZONE). DWYANE GINOBILI MAKES IT!
Score: 57-37

[01:55] Team_031 possession (Score: 57-37)
FOUL! Shooting foul on Joel Simons. Isaiah Ingram to the line for 3 free throws. [Team fouls: 4] (Joel Simons: 2 personal fouls)   FT 1/3: GOOD   FT 2/3: GOOD   FT 3/3: GOOD Isaiah Ingram makes 3/3 from the line.
Score: 60-37

[01:36] Team_097 possession (Score: 60-37)
Gary Carter attempts a 3Pt. Contested by Kevin Morant (4.6 feet, ZONE). GARY CARTER MAKES IT! Assist: Dwyane Ginobili
Score: 60-40

[01:19] Team_031 possession (Score: 60-40)
Jimmy Poole attempts a Midrange. Contested by Joel Simons (3.5 feet, MAN). Jimmy Poole misses. Offensive rebound by Jimmy Poole! Jimmy Poole kicks it out.

[01:05] Team_031 possession (Score: 60-40)
Kobe Randle attempts a 3Pt. Contested by Miles Dosunmu (4.5 feet, ZONE). Kobe Randle misses. Rebound secured by Miles Dosunmu.

[00:48] Team_097 possession (Score: 60-40)
Joel Simons attempts a 3Pt. Contested by Kobe Randle (4.6 feet, MAN). Joel Simons misses. Rebound secured by Kobe Randle.

[00:35] Team_031 possession (Score: 60-40)
Miles Stewart loses the ball! Stripped by Miles Dosunmu! TURNOVER! (live ball)

[00:16] Team_097 possession (Score: 60-40)
Joel Simons attempts a 3Pt. Contested by Miles Stewart (5.5 feet, ZONE). Joel Simons misses. Rebound secured by Isaiah Ingram.

[00:06] Team_031 possession (Score: 60-40)
Miles Stewart attempts a Midrange. Contested by Joel Simons (3.6 feet, ZONE). Miles Stewart misses. Offensive rebound by Isaiah Ingram! Isaiah Ingram kicks it out.

================================================================================
                              2ND QUARTER COMPLETE                              
================================================================================

2ND QUARTER SCORE: Team_031 32, Team_097 22

BOX SCORE:
================================================================================

Team_031
--------------------------------------------------------------------------------
Player                MIN  PTS  REB  AST  TO      FG   FG%      3P   3P%
--------------------------------------------------------------------------------
Shai Durant            17    8    0    0   0   3/4    75.0     0/0   0.0
Immanuel James         17    5    3    2   0   2/2   100.0     0/0   0.0
Miles Stewart           7    5    0    1   0   2/2   100.0     0/0   0.0
Kevin Morant            7    4    0    0   0   2/3    66.7     0/0   0.0
Gary Morant            17    3    0    0   0   1/2    50.0     0/0   0.0
Isaiah Ingram           7    3    3    2   0   1/1   100.0     0/0   0.0
Jimmy Poole             7    2    4    0   0   1/1   100.0     0/0   0.0
Kobe Randle             7    2    2    1   0   1/4    25.0     0/0   0.0
Pau Irving             17    0    0    2   0   0/0     0.0     0/0   0.0
Luka Sabonis           17    0    0    1   0   0/0     0.0     0/0   0.0

TEAM: FG: 13/19 (68.4%), 3PT: 6/9 (66.7%), REB: 12 (2 off, 10 def), AST: 9, TO: 2
TEAM FOULS: 4


Team_097
--------------------------------------------------------------------------------
Player                MIN  PTS  REB  AST  TO      FG   FG%      3P   3P%
--------------------------------------------------------------------------------
Evan Brogdon           17    5    0    0   0   2/2   100.0     0/0   0.0
Miles Banchero          7    4    2    0   0   2/4    50.0     0/0   0.0
Jrue Haliburton        17    3    0    1   0   1/2    50.0     0/0   0.0
Shai Poole             17    3    0    1   0   1/2    50.0     0/0   0.0
Gary Carter             7    3    0    0   0   1/2    50.0     0/0   0.0
Dwyane Ginobili         7    2    0    2   0   1/2    50.0     0/0   0.0
Joel Simons             7    2    0    0   0   1/3    33.3     0/0   0.0
Tyrese Stewart         17    0    3    1   0   0/0     0.0     0/0   0.0
Anthony Haliburton     17    0    0    1   0   0/1     0.0     0/0   0.0
Miles Dosunmu           7    0    4    0   0   0/1     0.0     0/0   0.0

TEAM: FG: 9/19 (47.4%), 3PT: 4/10 (40.0%), REB: 9 (3 off, 6 def), AST: 6, TO: 2
TEAM FOULS: 4

================================================================================

================================================================================
                       3RD QUARTER - Team_031 vs Team_097                       
================================================================================

[12:00] Team_031 possession (Score: 60-40)
Luka Sabonis drives, picks up Anthony Haliburton. Help arrives from Jrue Haliburton! Luka Sabonis attempts a Layup. Contested by Jrue Haliburton (3.9 feet, ZONE). Luka Sabonis misses. Rebound secured by Tyrese Stewart.

[11:49] Team_097 possession (Score: 60-40)
Shai Poole makes the Layup and draws the foul on Immanuel James! And-1! Shai Poole to the line for 1. [Team fouls: 1] (Immanuel James: 1 personal fouls)   FT 1/1: GOOD Shai Poole makes 1/1 from the line.
Score: 60-43

[11:35] Team_031 possession (Score: 60-43)
Immanuel James makes the Layup and draws the foul on Anthony Haliburton! And-1! Immanuel James to the line for 1. [Team fouls: 1] (Anthony Haliburton: 1 personal fouls)   FT 1/1: GOOD Immanuel James makes 1/1 from the line.
Score: 63-43

[11:20] Team_097 possession (Score: 63-43)
Tyrese Stewart attempts a 3Pt. Contested by Luka Sabonis (4.1 feet, MAN). Tyrese Stewart misses. FOUL! Loose ball foul on Luka Sabonis during the rebound battle. [Team fouls: 2] No free throws, side out. (Luka Sabonis: 1 personal fouls)

[11:05] Team_097 possession (Score: 63-43)
Tyrese Stewart attempts a Midrange. Contested by Luka Sabonis (4.1 feet, MAN). Tyrese Stewart misses. Rebound secured by Luka Sabonis.

[10:51] Team_031 possession (Score: 63-43)
Luka Sabonis attempts a Midrange. Contested by Anthony Haliburton (3.9 feet, MAN). Luka Sabonis misses. Rebound secured by Anthony Haliburton.

[10:41] Team_097 possession (Score: 63-43)
Evan Brogdon attempts a Midrange. Contested by Immanuel James (3.7 feet, ZONE). EVAN BROGDON MAKES IT!
Score: 63-45

[10:26] Team_031 possession (Score: 63-45)
FOUL! Shooting foul on Anthony Haliburton. Immanuel James to the line for 2 free throws. [Team fouls: 2] (Anthony Haliburton: 2 personal fouls)   FT 1/2: GOOD   FT 2/2: GOOD Immanuel James makes 2/2 from the line.
Score: 65-45

[10:09] Team_097 possession (Score: 65-45)
Tyrese Stewart drives, Luka Sabonis stays with him. Tyrese Stewart attempts a Dunk. Contested by Luka Sabonis (4.1 feet, MAN). TYRESE STEWART MAKES IT! Assist: Jrue Haliburton
Score: 65-47

[09:55] Team_031 possession (Score: 65-47)
Immanuel James attempts a Midrange. Contested by Jrue Haliburton (5.6 feet, ZONE). IMMANUEL JAMES MAKES IT! Assist: Pau Irving
Score: 67-47

[09:38] Team_097 possession (Score: 67-47)
Tyrese Stewart drives, Luka Sabonis stays with him. Tyrese Stewart attempts a Layup. Contested by Luka Sabonis (4.1 feet, MAN). TYRESE STEWART MAKES IT! Assist: Shai Poole
Score: 67-49

[09:20] Team_031 possession (Score: 67-49)
FOUL! Reach-in foul on Evan Brogdon during the drive. [Team fouls: 3] No free throws, side out. (Evan Brogdon: 1 personal fouls)

[09:07] Team_031 possession (Score: 67-49)
Immanuel James loses the ball! Stripped by Anthony Haliburton! TURNOVER! (live ball)

[08:53] Team_097 possession (Score: 67-49)
Shai Poole attempts a Midrange. Contested by Immanuel James (3.6 feet, ZONE). Shai Poole misses. Rebound secured by Gary Morant.

[08:42] Team_031 possession (Score: 67-49)
Luka Sabonis attempts a 3Pt. Contested by Shai Poole (4.0 feet, ZONE). Luka Sabonis misses. Offensive rebound by Luka Sabonis! Luka Sabonis puts it back in!
Score: 69-49

[08:22] Team_097 possession (Score: 69-49)
Tyrese Stewart attempts a Layup. BLOCKED BY LUKA SABONIS! Ball is loose! Offensive rebound by Tyrese Stewart! Tyrese Stewart kicks it out.

[08:06] Team_097 possession (Score: 69-49)
FOUL! Shooting foul on Gary Morant. Jrue Haliburton to the line for 2 free throws. [Team fouls: 4] (Gary Morant: 2 personal fouls)   FT 1/2: GOOD   FT 2/2: GOOD Jrue Haliburton makes 2/2 from the line.
Score: 69-51

[07:54] Team_031 possession (Score: 69-51)
Immanuel James attempts a 3Pt. Contested by Shai Poole (3.8 feet, ZONE). Immanuel James misses. Rebound secured by Tyrese Stewart.

[07:44] Team_097 possession (Score: 69-51)
Tyrese Stewart attempts a 3Pt. Contested by Pau Irving (4.5 feet, ZONE). Tyrese Stewart misses. Rebound secured by Luka Sabonis.

[07:27] Team_031 possession (Score: 69-51)
Gary Morant attempts a 3Pt. Contested by Shai Poole (4.0 feet, ZONE). Gary Morant misses. Rebound secured by Tyrese Stewart.

[07:13] Team_097 possession (Score: 69-51)
Evan Brogdon makes the Layup and draws the foul on Shai Durant! And-1! Evan Brogdon to the line for 1. [BONUS: 5 team fouls] (Shai Durant: 1 personal fouls)   FT 1/1: GOOD Evan Brogdon makes 1/1 from the line.
Score: 69-54

[06:57] Team_031 possession (Score: 69-54)
Immanuel James drives, Anthony Haliburton stays with him. Immanuel James attempts a Layup. Contested by Anthony Haliburton (3.7 feet, MAN). IMMANUEL JAMES MAKES IT! Assist: Luka Sabonis
Score: 71-54

[06:44] Team_097 possession (Score: 71-54)
Evan Brogdon attempts a 3Pt. Contested by Shai Durant (4.6 feet, MAN). Evan Brogdon misses. Rebound secured by Gary Morant.

[06:35] Team_031 possession (Score: 71-54)
Shai Durant attempts a 3Pt. Contested by Shai Poole (3.5 feet, ZONE). SHAI DURANT MAKES IT! Assist: Luka Sabonis
Score: 74-54

[06:24] Team_097 possession (Score: 74-54)
Shai Poole attempts a 3Pt. Contested by Pau Irving (4.2 feet, ZONE). Shai Poole misses. Rebound secured by Immanuel James.

[06:11] Team_031 possession (Score: 74-54)
Immanuel James attempts a 3Pt. Contested by Jrue Haliburton (5.6 feet, ZONE). IMMANUEL JAMES MAKES IT! Assist: Luka Sabonis
Score: 77-54

[06:01] Team_097 possession (Score: 77-54)
Jrue Haliburton drives, picks up Immanuel James. Help arrives from Shai Durant! Jrue Haliburton attempts a Dunk. Contested by Shai Durant (3.5 feet, ZONE). JRUE HALIBURTON MAKES IT! Assist: Evan Brogdon
Score: 77-56

[05:50] Team_031 possession (Score: 77-56)
Pau Irving attempts a 3Pt. Contested by Shai Poole (3.5 feet, MAN). PAU IRVING MAKES IT! Assist: Shai Durant
Score: 80-56

[05:37] Team_097 possession (Score: 80-56)
Evan Brogdon attempts a 3Pt. Contested by Shai Durant (4.6 feet, MAN). Evan Brogdon misses. Offensive rebound by Anthony Haliburton! Anthony Haliburton puts it back in!
Score: 80-58

[05:22] Team_031 possession (Score: 80-58)
Gary Morant drives and kicks out. Gary Morant attempts a 3Pt. Contested by Jrue Haliburton (5.2 feet, MAN). Gary Morant misses. Rebound secured by Tyrese Stewart.

[05:08] Team_097 possession (Score: 80-58)
Shai Poole attempts a Midrange. Contested by Pau Irving (4.2 feet, MAN). SHAI POOLE MAKES IT!
Score: 80-60

[04:53] Team_031 possession (Score: 80-60)
Gary Morant attempts a 3Pt. Contested by Shai Poole (4.0 feet, ZONE). Gary Morant misses. Rebound secured by Anthony Haliburton.

[04:38] Team_097 possession (Score: 80-60)
Tyrese Stewart attempts a Midrange. Contested by Luka Sabonis (4.2 feet, MAN). Tyrese Stewart misses. Rebound secured by Luka Sabonis.

[04:25] Team_031 possession (Score: 80-60)
Immanuel James drives, picks up Anthony Haliburton. Help arrives from Jrue Haliburton! Immanuel James attempts a Dunk. Contested by Jrue Haliburton (3.8 feet, MAN). Immanuel James misses. Rebound secured by Anthony Haliburton.

[04:10] Team_097 possession (Score: 80-60)
Tyrese Stewart drives, picks up Luka Sabonis. Help arrives from Shai Durant! Tyrese Stewart attempts a Layup. Contested by Shai Durant (4.2 feet, MAN). Tyrese Stewart misses. Offensive rebound by Tyrese Stewart! Tyrese Stewart kicks it out.

[03:57] Team_097 possession (Score: 80-60)
Jrue Haliburton attempts a 3Pt. Contested by Gary Morant (4.4 feet, MAN). Jrue Haliburton misses. FOUL! Loose ball foul on Luka Sabonis during the rebound battle. [IN THE BONUS! 6 team fouls] Tyrese Stewart to the line for 2 free throws. (Luka Sabonis: 2 personal fouls)   FT 1/2: MISS   FT 2/2: GOOD Tyrese Stewart makes 1/2 from the line.
Score: 80-61

[03:43] Team_031 possession (Score: 80-61)
FOUL! Holding foul on Evan Brogdon. [Team fouls: 4] No free throws, side out. (Evan Brogdon: 2 personal fouls)

[03:32] Team_031 possession (Score: 80-61)
Pau Irving attempts a 3Pt. Contested by Shai Poole (3.6 feet, ZONE). Pau Irving misses. Rebound secured by Shai Poole.

[03:18] Team_097 possession (Score: 80-61)
Anthony Haliburton attempts a Midrange. Contested by Immanuel James (3.8 feet, MAN). Anthony Haliburton misses. Offensive rebound by Tyrese Stewart! Tyrese Stewart kicks it out.

[03:03] Team_097 possession (Score: 80-61)
Anthony Haliburton drives, picks up Immanuel James. Help arrives from Shai Durant! Anthony Haliburton attempts a Layup. Contested by Shai Durant (3.8 feet, ZONE). ANTHONY HALIBURTON MAKES IT! Assist: Tyrese Stewart
Score: 80-63

[02:51] Team_031 possession (Score: 80-63)
Gary Morant drives and kicks out. Pau Irving attempts a 3Pt. Contested by Shai Poole (3.7 feet, MAN). PAU IRVING MAKES IT! Assist: Shai Durant
Score: 83-63

[02:37] Team_097 possession (Score: 83-63)
Shai Poole attempts a 3Pt. Contested by Pau Irving (4.4 feet, MAN). Shai Poole misses. Rebound secured by Luka Sabonis.

[02:26] Team_031 possession (Score: 83-63)
FOUL! Shooting foul on Jrue Haliburton. Immanuel James to the line for 2 free throws. [BONUS: 5 team fouls] (Jrue Haliburton: 1 personal fouls)   FT 1/2: MISS   FT 2/2: MISS Immanuel James makes 0/2 from the line. Rebound secured by Shai Poole.

[02:11] Team_097 possession (Score: 83-63)
Tyrese Stewart attempts a Layup. BLOCKED BY SHAI DURANT! Ball is loose! Rebound secured by Gary Morant.

[02:00] Team_031 possession (Score: 83-63)
Immanuel James attempts a 3Pt. Contested by Shai Poole (4.1 feet, ZONE). Immanuel James misses. Rebound secured by Tyrese Stewart.

[01:43] Team_097 possession (Score: 83-63)
FOUL! Shooting foul on Shai Durant. Evan Brogdon to the line for 2 free throws. [BONUS: 7 team fouls] (Shai Durant: 2 personal fouls)   FT 1/2: MISS   FT 2/2: GOOD Evan Brogdon makes 1/2 from the line.
Score: 83-64

[01:26] Team_031 possession (Score: 83-64)
Shai Durant loses control! Ball rolls out of bounds! TURNOVER! (dead ball)

[01:26] Substitution (Team_031): Shai Durant OUT → Kevin Morant IN (stamina_rule2)

[01:26] Substitution (Team_031): Gary Morant OUT → Isaiah Ingram IN (stamina_rule2)

[01:26] Substitution (Team_031): Pau Irving OUT → Miles Stewart IN (stamina_rule2)

[01:26] Substitution (Team_031): Immanuel James OUT → Kobe Randle IN (stamina_rule2)

[01:26] Substitution (Team_031): Luka Sabonis OUT → Jimmy Poole IN (stamina_rule2)

[01:26] Substitution (Team_097): Evan Brogdon OUT → Gary Carter IN (stamina_rule2)

[01:26] Substitution (Team_097): Jrue Haliburton OUT → Dwyane Ginobili IN (stamina_rule2)

[01:26] Substitution (Team_097): Shai Poole OUT → Miles Dosunmu IN (stamina_rule2)

[01:26] Substitution (Team_097): Anthony Haliburton OUT → Joel Simons IN (stamina_rule2)

[01:26] Substitution (Team_097): Tyrese Stewart OUT → Miles Banchero IN (stamina_rule2)

[01:11] Team_097 possession (Score: 83-64)
Gary Carter attempts a 3Pt. Contested by Kevin Morant (4.6 feet, MAN). GARY CARTER MAKES IT! Assist: Miles Dosunmu
Score: 83-67

[00:56] Team_031 possession (Score: 83-67)
Isaiah Ingram drives to the basket... Isaiah Ingram throws a bad pass! Stolen by Joel Simons! TURNOVER! (live ball)

[00:40] Team_097 possession (Score: 83-67)
Miles Dosunmu drives, picks up Miles Stewart. Help arrives from Isaiah Ingram! Miles Dosunmu attempts a Layup. Contested by Isaiah Ingram (5.8 feet, MAN). MILES DOSUNMU MAKES IT! Assist: Joel Simons
Score: 83-69

[00:24] Team_031 possession (Score: 83-69)
Kobe Randle attempts a 3Pt. Contested by Joel Simons (4.2 feet, ZONE). Kobe Randle misses. Rebound secured by Miles Dosunmu.

[00:11] Team_097 possession (Score: 83-69)
Joel Simons attempts a Midrange. Contested by Kevin Morant (5.0 feet, ZONE). Joel Simons misses. Rebound secured by Jimmy Poole.

================================================================================
                              3RD QUARTER COMPLETE                              
================================================================================

3RD QUARTER SCORE: Team_031 23, Team_097 29

BOX SCORE:
================================================================================

Team_031
--------------------------------------------------------------------------------
Player                MIN  PTS  REB  AST  TO      FG   FG%      3P   3P%
--------------------------------------------------------------------------------
Immanuel James         28   12    1    0   0   5/9    55.6     0/0   0.0
Pau Irving             28    6    0    1   0   2/3    66.7     0/0   0.0
Shai Durant            28    3    0    2   0   1/1   100.0     0/0   0.0
Luka Sabonis           28    2    5    3   0   1/3    33.3     0/0   0.0
Gary Morant            28    0    3    0   0   0/3     0.0     0/0   0.0
Kobe Randle             8    0    0    0   0   0/1     0.0     0/0   0.0
Jimmy Poole             8    0    1    0   0   0/0     0.0     0/0   0.0

TEAM: FG: 9/20 (45.0%), 3PT: 4/10 (40.0%), REB: 10 (1 off, 9 def), AST: 6, TO: 3
TEAM FOULS: 7 [Team_097 in BONUS]


Team_097
--------------------------------------------------------------------------------
Player                MIN  PTS  REB  AST  TO      FG   FG%      3P   3P%
--------------------------------------------------------------------------------
Evan Brogdon           28    6    0    1   0   3/4    75.0     0/0   0.0
Tyrese Stewart         28    5    8    1   0   3/7    42.9     0/0   0.0
Shai Poole             28    5    2    1   0   2/5    40.0     0/0   0.0
Anthony Haliburton     28    4    5    0   0   2/2   100.0     0/0   0.0
Jrue Haliburton        28    4    0    1   0   2/2   100.0     0/0   0.0
Gary Carter             8    3    0    0   0   1/1   100.0     0/0   0.0
Miles Dosunmu           8    2    1    1   0   1/1   100.0     0/0   0.0
Joel Simons             8    0    0    1   0   0/1     0.0     0/0   0.0

TEAM: FG: 14/23 (60.9%), 3PT: 3/7 (42.9%), REB: 16 (5 off, 11 def), AST: 6, TO: 0
TEAM FOULS: 5 [Team_031 in BONUS]

================================================================================

================================================================================
                       4TH QUARTER - Team_031 vs Team_097                       
================================================================================

[12:00] Team_031 possession (Score: 83-69)
Luka Sabonis attempts a 3Pt. Contested by Shai Poole (4.1 feet, ZONE). LUKA SABONIS MAKES IT! Assist: Gary Morant
Score: 86-69

[11:44] Team_097 possession (Score: 86-69)
FOUL! Shooting foul on Gary Morant. Jrue Haliburton to the line for 2 free throws. [Team fouls: 1] (Gary Morant: 1 personal fouls)   FT 1/2: GOOD   FT 2/2: GOOD Jrue Haliburton makes 2/2 from the line.
Score: 86-71

[11:29] Team_031 possession (Score: 86-71)
Gary Morant attempts a 3Pt. Contested by Shai Poole (4.1 feet, ZONE). Gary Morant misses. Offensive rebound by Luka Sabonis! Luka Sabonis's putback is no good. Rebound secured by Tyrese Stewart.

[11:15] Team_097 possession (Score: 86-71)
Jrue Haliburton throws a bad pass out of bounds! TURNOVER! (dead ball)

[11:15] Substitution (Team_031): Immanuel James OUT → Kobe Randle IN (stamina_rule2)

[11:15] Substitution (Team_031): Luka Sabonis OUT → Jimmy Poole IN (stamina_rule2)

[10:59] Team_031 possession (Score: 86-71)
Kobe Randle makes the Layup and draws the foul on Anthony Haliburton! And-1! Kobe Randle to the line for 1. [Team fouls: 1] (Anthony Haliburton: 1 personal fouls)   FT 1/1: GOOD Kobe Randle makes 1/1 from the line.
Score: 89-71

[10:44] Team_097 possession (Score: 89-71)
Shai Poole makes the Layup and draws the foul on Kobe Randle! And-1! Shai Poole to the line for 1. [Team fouls: 2] (Kobe Randle: 1 personal fouls)   FT 1/1: GOOD Shai Poole makes 1/1 from the line.
Score: 89-74

[10:28] Team_031 possession (Score: 89-74)
Pau Irving attempts a 3Pt. Contested by Shai Poole (3.7 feet, ZONE). Pau Irving misses. Rebound secured by Anthony Haliburton.

[10:10] Team_097 possession (Score: 89-74)
Jrue Haliburton attempts a Layup. Contested by Kobe Randle (4.8 feet, ZONE). Jrue Haliburton misses. Rebound secured by Jimmy Poole.

[09:56] Team_031 possession (Score: 89-74)
Pau Irving attempts a Midrange. Contested by Anthony Haliburton (3.7 feet, ZONE). Pau Irving misses. Rebound secured by Tyrese Stewart.

[09:43] Team_097 possession (Score: 89-74)
Tyrese Stewart drives, picks up Jimmy Poole. Help arrives from Shai Durant! Tyrese Stewart attempts a Dunk. Wide open! Shai Durant is 6.4 feet away. [MAN] TYRESE STEWART MAKES IT! Assist: Jrue Haliburton
Score: 89-76

[09:31] Team_031 possession (Score: 89-76)
Gary Morant attempts a 3Pt. Contested by Shai Poole (4.3 feet, ZONE). GARY MORANT MAKES IT! Assist: Jimmy Poole
Score: 92-76

[09:21] Team_097 possession (Score: 92-76)
Anthony Haliburton drives to the basket... FOUL! Offensive foul on Anthony Haliburton! Kobe Randle drew the charge! [Team fouls: 2] (Anthony Haliburton: 2 personal fouls) TURNOVER! (dead ball)

[09:08] Team_031 possession (Score: 92-76)
FOUL! Shooting foul on Anthony Haliburton. Jimmy Poole to the line for 2 free throws. [Team fouls: 3] (Anthony Haliburton: 3 personal fouls)   FT 1/2: GOOD   FT 2/2: GOOD Jimmy Poole makes 2/2 from the line.
Score: 94-76

[08:51] Team_097 possession (Score: 94-76)
Evan Brogdon attempts a Layup. Contested by Kobe Randle (5.0 feet, ZONE). Evan Brogdon misses. Rebound secured by Gary Morant.

[08:40] Team_031 possession (Score: 94-76)
Gary Morant attempts a 3Pt. Contested by Shai Poole (4.5 feet, ZONE). GARY MORANT MAKES IT! Assist: Pau Irving
Score: 97-76

[08:28] Team_097 possession (Score: 97-76)
FOUL! Offensive foul on Anthony Haliburton! Kobe Randle drew the charge! [Team fouls: 4] (Anthony Haliburton: 4 personal fouls) TURNOVER! (dead ball)

[08:13] Team_031 possession (Score: 97-76)
Kobe Randle attempts a Layup. Contested by Anthony Haliburton (4.7 feet, ZONE). KOBE RANDLE MAKES IT!
Score: 99-76

[07:56] Team_097 possession (Score: 99-76)
Jrue Haliburton drives, Kobe Randle stays with him. Jrue Haliburton attempts a Layup. Contested by Kobe Randle (4.8 feet, ZONE). JRUE HALIBURTON MAKES IT! Assist: Evan Brogdon
Score: 99-78

[07:46] Team_031 possession (Score: 99-78)
Kobe Randle attempts a 3Pt. Contested by Anthony Haliburton (4.8 feet, MAN). Kobe Randle misses. Rebound secured by Tyrese Stewart.

[07:31] Team_097 possession (Score: 99-78)
FOUL! Holding foul on Kobe Randle. [Team fouls: 3] No free throws, side out. (Kobe Randle: 2 personal fouls)

[07:16] Team_097 possession (Score: 99-78)
Anthony Haliburton drives, Kobe Randle stays with him. Anthony Haliburton attempts a Dunk. Contested by Kobe Randle (4.7 feet, MAN). Anthony Haliburton misses. Rebound secured by Jimmy Poole.

[07:04] Team_031 possession (Score: 99-78)
Shai Durant drives, Anthony Haliburton stays with him. Shai Durant attempts a Layup. Contested by Anthony Haliburton (4.2 feet, ZONE). SHAI DURANT MAKES IT! Assist: Gary Morant
Score: 101-78

[06:48] Team_097 possession (Score: 101-78)
Tyrese Stewart attempts a Midrange. Contested by Kobe Randle (5.1 feet, ZONE). Tyrese Stewart misses. Rebound secured by Gary Morant.

[06:32] Team_031 possession (Score: 101-78)
Pau Irving attempts a 3Pt. Contested by Shai Poole (4.3 feet, ZONE). Pau Irving misses. Offensive rebound by Kobe Randle! Kobe Randle kicks it out.

[06:15] Team_031 possession (Score: 101-78)
Jimmy Poole attempts a Layup. Contested by Anthony Haliburton (4.3 feet, ZONE). JIMMY POOLE MAKES IT!
Score: 103-78

[05:57] Team_097 possession (Score: 103-78)
Anthony Haliburton drives, Kobe Randle stays with him. Anthony Haliburton attempts a Layup. Contested by Kobe Randle (4.7 feet, MAN). ANTHONY HALIBURTON MAKES IT!
Score: 103-80

[05:47] Team_031 possession (Score: 103-80)
FOUL! Holding foul on Shai Poole. [IN THE BONUS! 5 team fouls] Pau Irving to the line for 2 free throws. (Shai Poole: 1 personal fouls)   FT 1/2: GOOD   FT 2/2: GOOD Pau Irving makes 2/2 from the line.
Score: 105-80

[05:32] Team_097 possession (Score: 105-80)
Evan Brogdon attempts a Midrange. Contested by Pau Irving (5.1 feet, ZONE). Evan Brogdon misses. Rebound secured by Jimmy Poole.

[05:20] Team_031 possession (Score: 105-80)
Shai Durant attempts a 3Pt. Contested by Shai Poole (4.5 feet, ZONE). Shai Durant misses. Rebound secured by Shai Poole.

[05:04] Team_097 possession (Score: 105-80)
Anthony Haliburton attempts a Midrange. Contested by Kobe Randle (4.7 feet, MAN). ANTHONY HALIBURTON MAKES IT!
Score: 105-82

[04:46] Team_031 possession (Score: 105-82)
Shai Durant attempts a 3Pt. Contested by Shai Poole (4.6 feet, ZONE). Shai Durant misses. Rebound secured by Tyrese Stewart.

[04:34] Team_097 possession (Score: 105-82)
FOUL! Shooting foul on Shai Durant. Evan Brogdon to the line for 2 free throws. [Team fouls: 4] (Shai Durant: 1 personal fouls)   FT 1/2: GOOD   FT 2/2: MISS Evan Brogdon makes 1/2 from the line. Offensive rebound by Tyrese Stewart! Tyrese Stewart kicks it out.
Score: 105-83

[04:22] Team_097 possession (Score: 105-83)
Tyrese Stewart drives and kicks out. Evan Brogdon attempts a 3Pt. Contested by Shai Durant (5.1 feet, MAN). Evan Brogdon misses. Rebound secured by Kobe Randle.

[04:08] Team_031 possession (Score: 105-83)
Gary Morant attempts a 3Pt. Wide open! Jrue Haliburton is 6.5 feet away. [MAN] Gary Morant misses. Rebound secured by Anthony Haliburton.

[03:54] Team_097 possession (Score: 105-83)
Evan Brogdon makes the Layup and draws the foul on Shai Durant! And-1! Evan Brogdon to the line for 1. [BONUS: 5 team fouls] (Shai Durant: 2 personal fouls)   FT 1/1: GOOD Evan Brogdon makes 1/1 from the line.
Score: 105-86

[03:43] Team_031 possession (Score: 105-86)
Shai Durant drives, picks up Evan Brogdon. Help arrives from Shai Poole! Shai Durant attempts a Dunk. Contested by Shai Poole (5.9 feet, MAN). SHAI DURANT MAKES IT! Assist: Jimmy Poole
Score: 107-86

[03:29] Team_097 possession (Score: 107-86)
Jrue Haliburton attempts a 3Pt. Contested by Shai Durant (5.5 feet, ZONE). Jrue Haliburton misses. Rebound secured by Kobe Randle.

[03:18] Team_031 possession (Score: 107-86)
Shai Durant attempts a Midrange. Contested by Anthony Haliburton (4.9 feet, ZONE). SHAI DURANT MAKES IT! Assist: Kobe Randle
Score: 109-86

[03:08] Team_097 possession (Score: 109-86)
Jrue Haliburton drives and kicks out. Shai Poole attempts a 3Pt. Contested by Gary Morant (5.3 feet, ZONE). Shai Poole misses. Offensive rebound by Anthony Haliburton! Anthony Haliburton kicks it out.

[02:52] Team_097 possession (Score: 109-86)
Tyrese Stewart drives, Jimmy Poole stays with him. Tyrese Stewart attempts a Dunk. Wide open! Jimmy Poole is 6.4 feet away. [MAN] TYRESE STEWART MAKES IT! Assist: Anthony Haliburton
Score: 109-88

[02:38] Team_031 possession (Score: 109-88)
Gary Morant attempts a Layup. Contested by Anthony Haliburton (5.3 feet, ZONE). GARY MORANT MAKES IT! Assist: Jimmy Poole
Score: 111-88

[02:29] Team_097 possession (Score: 111-88)
Tyrese Stewart attempts a Midrange. Wide open! Jimmy Poole is 6.4 feet away. [MAN] Tyrese Stewart misses. Rebound secured by Kobe Randle.

[02:11] Team_031 possession (Score: 111-88)
Shai Durant attempts a Layup. Contested by Anthony Haliburton (5.1 feet, ZONE). SHAI DURANT MAKES IT! Assist: Gary Morant
Score: 113-88

[01:54] Team_097 possession (Score: 113-88)
Tyrese Stewart drives and kicks out. Shai Poole attempts a 3Pt. Contested by Pau Irving (5.4 feet, ZONE). Shai Poole misses. Rebound secured by Kobe Randle.

[01:40] Team_031 possession (Score: 113-88)
Kobe Randle attempts a Midrange. Wide open! Jrue Haliburton is 7.0 feet away. [ZONE] KOBE RANDLE MAKES IT! Assist: Jimmy Poole
Score: 115-88

[01:23] Team_097 possession (Score: 115-88)
Shai Poole attempts a 3Pt. Contested by Pau Irving (5.7 feet, MAN). SHAI POOLE MAKES IT! Assist: Tyrese Stewart
Score: 115-91

[01:07] Team_031 possession (Score: 115-91)
Kobe Randle attempts a Midrange. Wide open! Tyrese Stewart is 7.4 feet away. [ZONE] KOBE RANDLE MAKES IT! Assist: Shai Durant
Score: 117-91

[00:51] Team_097 possession (Score: 117-91)
FOUL! Holding foul on Jimmy Poole. [IN THE BONUS! 6 team fouls] Tyrese Stewart to the line for 2 free throws. (Jimmy Poole: 1 personal fouls)   FT 1/2: GOOD   FT 2/2: GOOD Tyrese Stewart makes 2/2 from the line.
Score: 117-93

[00:36] Team_031 possession (Score: 117-93)
Gary Morant attempts a 3Pt. Wide open! Jrue Haliburton is 6.8 feet away. [MAN] Gary Morant misses. Rebound secured by Tyrese Stewart.

[00:21] Team_097 possession (Score: 117-93)
Tyrese Stewart attempts a Layup. Contested by Kobe Randle (5.5 feet, ZONE). TYRESE STEWART MAKES IT!
Score: 117-95

[00:05] Team_031 possession (Score: 117-95)
Gary Morant attempts a 3Pt. Wide open! Jrue Haliburton is 6.9 feet away. [ZONE] Gary Morant misses. Offensive rebound by Kobe Randle! Kobe Randle kicks it out.

================================================================================
                              4TH QUARTER COMPLETE                              
================================================================================

4TH QUARTER SCORE: Team_031 34, Team_097 26

BOX SCORE:
================================================================================

Team_031
--------------------------------------------------------------------------------
Player                MIN  PTS  REB  AST  TO      FG   FG%      3P   3P%
--------------------------------------------------------------------------------
Kobe Randle            20    9    6    1   0   4/5    80.0     0/0   0.0
Gary Morant            40    8    2    3   0   3/6    50.0     0/0   0.0
Shai Durant            40    8    0    1   0   4/6    66.7     0/0   0.0
Jimmy Poole            20    4    3    4   0   2/2   100.0     0/0   0.0
Luka Sabonis           29    3    0    0   0   1/1   100.0     0/0   0.0
Pau Irving             40    2    0    1   0   1/3    33.3     0/0   0.0

TEAM: FG: 15/23 (65.2%), 3PT: 3/10 (30.0%), REB: 12 (3 off, 9 def), AST: 10, TO: 0
TEAM FOULS: 6 [Team_097 in BONUS]


Team_097
--------------------------------------------------------------------------------
Player                MIN  PTS  REB  AST  TO      FG   FG%      3P   3P%
--------------------------------------------------------------------------------
Tyrese Stewart         40    8    6    1   0   4/8    50.0     0/0   0.0
Shai Poole             40    6    1    0   0   2/2   100.0     0/0   0.0
Jrue Haliburton        40    4    0    1   0   2/4    50.0     0/0   0.0
Anthony Haliburton     40    4    3    1   0   2/3    66.7     0/0   0.0
Evan Brogdon           40    3    0    1   0   1/3    33.3     0/0   0.0

TEAM: FG: 11/20 (55.0%), 3PT: 1/2 (50.0%), REB: 9 (2 off, 7 def), AST: 4, TO: 3
TEAM FOULS: 5 [Team_031 in BONUS]

================================================================================

================================================================================
                               FULL GAME COMPLETE                               
================================================================================

FINAL SCORE: Team_031 117, Team_097 95

SCORING BY QUARTER:
--------------------------------------------------------------------------------
Team                     Q1     Q2     Q3     Q4    FINAL
--------------------------------------------------------------------------------
Team_031                 28     32     23     34      117
Team_097                 18     22     29     26       95
--------------------------------------------------------------------------------

FULL GAME BOX SCORE:
================================================================================

Team_031
--------------------------------------------------------------------------------
Player                MIN  PTS  REB  AST  TO      FG   FG%      3P   3P%      FT STL BLK
--------------------------------------------------------------------------------
Shai Durant            40   30    0    3   1  12/18   66.7   6/11   54.5   2/2     0   1
Gary Morant            40   13    9    4   2   6/13   46.2   3/9    33.3   0/0     2   1
Pau Irving             40   10    0    7   1   2/8    25.0   1/6    16.7   2/2     0   0
Immanuel James         29   24    7    2   1  10/16   62.5   2/6    33.3   4/6     0   1
Luka Sabonis           29   10    9    5   0   3/6    50.0   2/2   100.0   2/3     1   1
Kobe Randle            20   11    8    2   0   5/10   50.0   0/3     0.0   1/1     0   0
Jimmy Poole            20    6    8    4   1   3/3   100.0   0/0     0.0   2/2     0   0
Kevin Morant            8    4    0    0   0   2/3    66.7   0/1     0.0   0/0     0   0
Isaiah Ingram           8    3    3    2   0   1/1   100.0   1/1   100.0   3/3     0   0
Miles Stewart           8    5    0    1   1   2/2   100.0   1/1   100.0   0/0     0   0

TEAM: FG: 48/82 (58.5%), 3PT: 16/40 (40.0%), REB: 45 (7 off, 38 def), AST: 30, TO: 7


Team_097
--------------------------------------------------------------------------------
Player                MIN  PTS  REB  AST  TO      FG   FG%      3P   3P%      FT STL BLK
--------------------------------------------------------------------------------
Evan Brogdon           40   19    0    3   0   9/17   52.9   2/4    50.0   7/11    0   0
Jrue Haliburton        40   13    0    3   5   7/13   53.8   2/4    50.0   5/6     1   0
Shai Poole             40   17    5    2   0   6/11   54.5   2/6    33.3   3/3     0   0
Anthony Haliburton     40   14   11    2   2   5/7    71.4   0/0     0.0   2/2     1   0
Tyrese Stewart         40   13   23    3   2   5/14   35.7   0/1     0.0   4/6     0   0
Gary Carter             8    6    0    0   0   2/3    66.7   2/3    66.7   0/0     0   0
Dwyane Ginobili         8    2    0    2   0   1/2    50.0   0/0     0.0   0/0     0   0
Miles Dosunmu           8    2    5    1   0   1/2    50.0   0/1     0.0   0/0     1   0
Joel Simons             8    2    0    1   1   1/4    25.0   0/2     0.0   2/2     1   0
Miles Banchero          8    4    2    0   0   2/4    50.0   0/0     0.0   2/2     0   0

TEAM: FG: 41/79 (51.9%), 3PT: 8/21 (38.1%), REB: 45 (12 off, 33 def), AST: 17, TO: 10

================================================================================
