================================================================================
                        FULL GAME - Team_054 vs Team_003                        
================================================================================

================================================================================
                       1ST QUARTER - Team_054 vs Team_003                       
================================================================================

[12:00] Team_054 possession (Score: 0-0)
Vince Ball attempts a Midrange. Contested by Rudy Haliburton (3.4 feet, MAN). Vince Ball misses. Rebound secured by Rudy Haliburton.

[11:47] Team_003 possession (Score: 0-0)
Rudy Haliburton drives, Blake Russell stays with him. Rudy Haliburton attempts a Layup. Contested by Blake Russell (3.1 feet, ZONE). RUDY HALIBURTON MAKES IT!
Score: 0-2

[11:28] Team_054 possession (Score: 0-2)
Lauri Irving attempts a Midrange. Contested by Nikola Bryant (4.5 feet, MAN). Lauri Irving misses. Offensive rebound by Blake Russell! Blake Russell's putback is no good. Rebound secured by Rudy Haliburton.

[11:18] Team_003 possession (Score: 0-2)
Giannis Turner attempts a 3Pt. Contested by Luka Brogdon (4.3 feet, MAN). Giannis Turner misses. Rebound secured by Luka Brogdon.

[11:03] Team_054 possession (Score: 0-2)
FOUL! Offensive foul on Blake Russell! Giannis Turner drew the charge! [Team fouls: 1] (Blake Russell: 1 personal fouls) TURNOVER! (dead ball)

[10:52] Team_003 possession (Score: 0-2)
Rudy Haliburton makes the Layup and draws the foul on Vince Ball! And-1! Rudy Haliburton to the line for 1. [Team fouls: 2] (Vince Ball: 1 personal fouls)   FT 1/1: GOOD Rudy Haliburton makes 1/1 from the line.
Score: 0-5

[10:42] Team_054 possession (Score: 0-5)
Lauri Irving attempts a Layup. Contested by Giannis Turner (3.3 feet, ZONE). Lauri Irving misses. Rebound secured by Victor O'Neal.

[10:28] Team_003 possession (Score: 0-5)
Giannis Turner attempts a 3Pt. Contested by Luka Brogdon (4.3 feet, MAN). Giannis Turner misses. Offensive rebound by Rudy Haliburton! Rudy Haliburton's putback is no good. Rebound secured by Luka Brogdon.

[10:15] Team_054 possession (Score: 0-5)
Malcolm Harden drives, picks up Ayo Jackson. Help arrives from Rudy Haliburton! Malcolm Harden attempts a Dunk. Contested by Rudy Haliburton (5.5 feet, MAN). MALCOLM HARDEN MAKES IT!
Score: 2-5

[10:04] Team_003 possession (Score: 2-5)
Rudy Haliburton attempts a 3Pt. Contested by Lauri Irving (3.5 feet, ZONE). RUDY HALIBURTON MAKES IT! Assist: Ayo Jackson
Score: 2-8

[09:50] Team_054 possession (Score: 2-8)
Vince Ball drives and kicks out. Vince Ball attempts a 3Pt. Contested by Giannis Turner (2.8 feet, ZONE). Vince Ball misses. Offensive rebound by Luka Brogdon! Luka Brogdon kicks it out.

[09:38] Team_054 possession (Score: 2-8)
Blake Russell drives, picks up Giannis Turner. Help arrives from Nikola Bryant! Blake Russell attempts a Dunk. Contested by Nikola Bryant (3.2 feet, MAN). Blake Russell misses. Rebound secured by Victor O'Neal.

[09:23] Team_003 possession (Score: 2-8)
Giannis Turner drives and kicks out. Rudy Haliburton attempts a Midrange. Contested by Lauri Irving (3.4 feet, ZONE). RUDY HALIBURTON MAKES IT!
Score: 2-10

[09:07] Team_054 possession (Score: 2-10)
Blake Russell drives, picks up Giannis Turner. Help arrives from Nikola Bryant! Blake Russell attempts a Dunk. Contested by Nikola Bryant (3.2 feet, ZONE). BLAKE RUSSELL MAKES IT! Assist: Malcolm Harden
Score: 4-10

[08:55] Team_003 possession (Score: 4-10)
Rudy Haliburton drives and kicks out. Giannis Turner attempts a Midrange. Contested by Luka Brogdon (4.0 feet, MAN). GIANNIS TURNER MAKES IT! Assist: Rudy Haliburton
Score: 4-12

[08:36] Team_054 possession (Score: 4-12)
Vince Ball attempts a Layup. BLOCKED BY GIANNIS TURNER! Ball is loose! Rebound secured by Victor O'Neal.

[08:17] Team_003 possession (Score: 4-12)
Giannis Turner drives and kicks out. Giannis Turner attempts a 3Pt. Contested by Lauri Irving (3.4 feet, ZONE). Giannis Turner misses. Rebound secured by Luka Brogdon.

[08:01] Team_054 possession (Score: 4-12)
Luka Brogdon makes the Layup and draws the foul on Giannis Turner! And-1! Luka Brogdon to the line for 1. [Team fouls: 1] (Giannis Turner: 1 personal fouls)   FT 1/1: GOOD Luka Brogdon makes 1/1 from the line.
Score: 7-12

[07:44] Team_003 possession (Score: 7-12)
Rudy Haliburton attempts a 3Pt. Contested by Luka Brogdon (4.1 feet, ZONE). Rudy Haliburton misses. Rebound secured by Blake Russell.

[07:29] Team_054 possession (Score: 7-12)
Luka Brogdon attempts a 3Pt. Contested by Giannis Turner (3.1 feet, ZONE). Luka Brogdon misses. Rebound secured by Giannis Turner.

[07:17] Team_003 possession (Score: 7-12)
Ayo Jackson attempts a 3Pt. Contested by Malcolm Harden (4.4 feet, MAN). AYO JACKSON MAKES IT! Assist: Rudy Haliburton
Score: 7-15

[07:02] Team_054 possession (Score: 7-15)
Blake Russell drives, Giannis Turner stays with him. Blake Russell attempts a Dunk. Contested by Giannis Turner (3.2 feet, MAN). BLAKE RUSSELL MAKES IT! Assist: Lauri Irving
Score: 9-15

[06:49] Team_003 possession (Score: 9-15)
Nikola Bryant attempts a Midrange. Contested by Lauri Irving (3.7 feet, MAN). Nikola Bryant misses. Offensive rebound by Victor O'Neal! Victor O'Neal kicks it out.

[06:32] Team_003 possession (Score: 9-15)
Rudy Haliburton attempts a 3Pt. Contested by Malcolm Harden (4.2 feet, ZONE). Rudy Haliburton misses. Rebound secured by Lauri Irving.

[06:13] Team_054 possession (Score: 9-15)
Luka Brogdon attempts a Midrange. Contested by Victor O'Neal (4.5 feet, ZONE). Luka Brogdon misses. Rebound secured by Giannis Turner.

[05:57] Team_003 possession (Score: 9-15)
Victor O'Neal attempts a Midrange. Contested by Blake Russell (3.0 feet, MAN). VICTOR O'NEAL MAKES IT! Assist: Ayo Jackson
Score: 9-17

[05:42] Team_054 possession (Score: 9-17)
Lauri Irving attempts a 3Pt. Contested by Giannis Turner (3.3 feet, ZONE). Lauri Irving misses. Rebound secured by Victor O'Neal.

[05:29] Team_003 possession (Score: 9-17)
Giannis Turner attempts a Midrange. Contested by Lauri Irving (3.7 feet, ZONE). Giannis Turner misses. Offensive rebound by Rudy Haliburton! Rudy Haliburton puts it back in!
Score: 9-19

[05:12] Team_054 possession (Score: 9-19)
Malcolm Harden drives, picks up Giannis Turner. Help arrives from Nikola Bryant! Malcolm Harden attempts a Dunk. Contested by Nikola Bryant (3.1 feet, ZONE). MALCOLM HARDEN MAKES IT! Assist: Blake Russell
Score: 11-19

[04:54] Team_003 possession (Score: 11-19)
Nikola Bryant commits a violation (traveling/carry)! TURNOVER! (dead ball)

[04:38] Team_054 possession (Score: 11-19)
Malcolm Harden attempts a 3Pt. Contested by Ayo Jackson (5.6 feet, MAN). Malcolm Harden misses. Rebound secured by Rudy Haliburton.

[04:23] Team_003 possession (Score: 11-19)
Giannis Turner drives, Luka Brogdon stays with him. Giannis Turner attempts a Layup. Contested by Luka Brogdon (4.3 feet, MAN). Giannis Turner misses. Rebound secured by Blake Russell.

[04:10] Team_054 possession (Score: 11-19)
Luka Brogdon drives, Giannis Turner stays with him. Luka Brogdon attempts a Dunk. Contested by Giannis Turner (3.2 feet, MAN). Luka Brogdon misses. Offensive rebound by Blake Russell! Blake Russell's putback is no good. Rebound secured by Rudy Haliburton.

[03:52] Team_003 possession (Score: 11-19)
Rudy Haliburton attempts a 3Pt. Contested by Lauri Irving (3.6 feet, ZONE). Rudy Haliburton misses. Rebound secured by Luka Brogdon.

[03:36] Team_054 possession (Score: 11-19)
Malcolm Harden attempts a 3Pt. Contested by Giannis Turner (3.2 feet, ZONE). Malcolm Harden misses. Offensive rebound by Luka Brogdon! Luka Brogdon kicks it out.

[03:21] Team_054 possession (Score: 11-19)
Lauri Irving attempts a 3Pt. Contested by Giannis Turner (3.5 feet, ZONE). LAURI IRVING MAKES IT! Assist: Blake Russell
Score: 14-19

[03:02] Team_003 possession (Score: 14-19)
Ayo Jackson drives and kicks out. Giannis Turner attempts a 3Pt. Contested by Luka Brogdon (4.1 feet, MAN). GIANNIS TURNER MAKES IT! Assist: Nikola Bryant
Score: 14-22

[02:47] Team_054 possession (Score: 14-22)
Lauri Irving attempts a 3Pt. Contested by Nikola Bryant (4.7 feet, MAN). LAURI IRVING MAKES IT! Assist: Vince Ball
Score: 17-22

[02:38] Team_003 possession (Score: 17-22)
Rudy Haliburton attempts a 3Pt. Contested by Vince Ball (4.3 feet, MAN). RUDY HALIBURTON MAKES IT! Assist: Ayo Jackson
Score: 17-25

[02:23] Team_054 possession (Score: 17-25)
Luka Brogdon attempts a 3Pt. Contested by Giannis Turner (3.4 feet, ZONE). LUKA BROGDON MAKES IT! Assist: Blake Russell
Score: 20-25

[02:08] Team_003 possession (Score: 20-25)
Rudy Haliburton attempts a Midrange. Contested by Vince Ball (4.3 feet, MAN). Rudy Haliburton misses. Offensive rebound by Victor O'Neal! Victor O'Neal kicks it out.

[01:48] Team_003 possession (Score: 20-25)
Nikola Bryant drives to the basket... Nikola Bryant loses the ball! Stripped by Blake Russell! TURNOVER! (live ball)

[01:36] Team_054 possession (Score: 20-25)
Vince Ball attempts a 3Pt. Contested by Giannis Turner (3.3 feet, ZONE). Vince Ball misses. Offensive rebound by Blake Russell! Blake Russell's putback is no good. Rebound secured by Giannis Turner.

[01:22] Team_003 possession (Score: 20-25)
Victor O'Neal attempts a Midrange. Contested by Blake Russell (3.4 feet, MAN). Victor O'Neal misses. Rebound secured by Vince Ball.

[01:05] Team_054 possession (Score: 20-25)
Luka Brogdon attempts a 3Pt. Contested by Giannis Turner (3.5 feet, ZONE). Luka Brogdon misses. Offensive rebound by Luka Brogdon! Luka Brogdon kicks it out.

[00:56] Team_054 possession (Score: 20-25)
Lauri Irving attempts a Midrange. Contested by Nikola Bryant (4.9 feet, MAN). LAURI IRVING MAKES IT! Assist: Blake Russell
Score: 22-25

[00:45] Team_003 possession (Score: 22-25)
Victor O'Neal drives, picks up Blake Russell. Help arrives from Lauri Irving! Victor O'Neal attempts a Dunk. Contested by Lauri Irving (3.5 feet, MAN). Victor O'Neal misses. Rebound secured by Blake Russell.

[00:30] Team_054 possession (Score: 22-25)
Blake Russell drives, Giannis Turner stays with him. Blake Russell attempts a Layup. Contested by Giannis Turner (3.7 feet, MAN). BLAKE RUSSELL MAKES IT!
Score: 24-25

[00:13] Team_003 possession (Score: 24-25)
Victor O'Neal drives, Blake Russell stays with him. Victor O'Neal attempts a Layup. Contested by Blake Russell (3.6 feet, MAN). Victor O'Neal misses. Rebound secured by Vince Ball.

[00:03] Team_054 possession (Score: 24-25)
Vince Ball attempts a Layup. Contested by Rudy Haliburton (3.9 feet, MAN). Vince Ball misses. Offensive rebound by Luka Brogdon! Luka Brogdon kicks it out.

================================================================================
                              1ST QUARTER COMPLETE                              
================================================================================

1ST QUARTER SCORE: Team_054 24, Team_003 25

BOX SCORE:
================================================================================

Team_054
--------------------------------------------------------------------------------
Player                MIN  PTS  REB  AST  TO      FG   FG%      3P   3P%
--------------------------------------------------------------------------------
Lauri Irving           12    8    1    1   0   3/6    50.0     0/0   0.0
Luka Brogdon           12    6    8    0   0   2/5    40.0     0/0   0.0
Blake Russell          12    6    3    4   0   3/4    75.0     0/0   0.0
Giannis Turner         12    5    3    0   0   2/6    33.3     0/0   0.0
Malcolm Harden         12    4    0    1   0   2/3    66.7     0/0   0.0
Vince Ball             12    0    2    1   0   0/3     0.0     0/0   0.0

TEAM: FG: 10/21 (47.6%), 3PT: 3/7 (42.9%), REB: 16 (7 off, 9 def), AST: 7, TO: 1
TEAM FOULS: 2


Team_003
--------------------------------------------------------------------------------
Player                MIN  PTS  REB  AST  TO      FG   FG%      3P   3P%
--------------------------------------------------------------------------------
Rudy Haliburton        12   15    5    2   0   6/9    66.7     0/0   0.0
Ayo Jackson            12    3    0    3   0   1/1   100.0     0/0   0.0
Victor O'Neal          12    2    6    0   0   1/4    25.0     0/0   0.0
Nikola Bryant          12    0    0    1   0   0/0     0.0     0/0   0.0

TEAM: FG: 10/20 (50.0%), 3PT: 3/8 (37.5%), REB: 12 (4 off, 8 def), AST: 6, TO: 2
TEAM FOULS: 1

================================================================================

================================================================================
                       2ND QUARTER - Team_054 vs Team_003                       
================================================================================

[12:00] Team_054 possession (Score: 24-25)
Blake Russell attempts a Midrange. Contested by Giannis Turner (3.5 feet, MAN). Blake Russell misses. Rebound secured by Victor O'Neal.

[11:44] Team_003 possession (Score: 24-25)
Victor O'Neal throws a bad pass out of bounds! TURNOVER! (dead ball)

[11:44] Substitution (Team_054): Malcolm Harden OUT → Shaquille Irving IN (stamina_rule2)

[11:44] Substitution (Team_054): Lauri Irving OUT → Bradley Quickley IN (stamina_rule2)

[11:44] Substitution (Team_054): Blake Russell OUT → Devin Jackson IN (stamina_rule2)

[11:44] Substitution (Team_003): Ayo Jackson OUT → Miles Towns IN (stamina_rule2)

[11:44] Substitution (Team_003): Nikola Bryant OUT → Pau Williamson IN (stamina_rule2)

[11:44] Substitution (Team_003): Giannis Turner OUT → Anfernee Jordan IN (stamina_rule2)

[11:44] Substitution (Team_003): Victor O'Neal OUT → Bam Gilgeous-Alexander IN (stamina_rule2)

[11:26] Team_054 possession (Score: 24-25)
FOUL! Shooting foul on Anfernee Jordan. Vince Ball to the line for 3 free throws. [Team fouls: 1] (Anfernee Jordan: 1 personal fouls)   FT 1/3: MISS   FT 2/3: GOOD   FT 3/3: MISS Vince Ball makes 1/3 from the line. Rebound secured by Rudy Haliburton.
Score: 25-25

[11:13] Team_003 possession (Score: 25-25)
Miles Towns attempts a 3Pt. Contested by Shaquille Irving (4.5 feet, ZONE). Miles Towns misses. Offensive rebound by Bam Gilgeous-Alexander! Bam Gilgeous-Alexander puts it back in!
Score: 25-27

[10:59] Team_054 possession (Score: 25-27)
Shaquille Irving drives to the basket... Shaquille Irving loses control! Ball rolls out of bounds! TURNOVER! (dead ball)

[10:59] Substitution (Team_054): Vince Ball OUT → Vince James IN (stamina_rule2)

[10:59] Substitution (Team_054): Luka Brogdon OUT → Tobias Nowitzki IN (stamina_rule2)

[10:59] Substitution (Team_003): Rudy Haliburton OUT → Collin Mitchell IN (stamina_rule2)

[10:47] Team_003 possession (Score: 25-27)
Miles Towns attempts a Midrange. Contested by Bradley Quickley (4.1 feet, ZONE). Miles Towns misses. Rebound secured by Vince James.

[10:31] Team_054 possession (Score: 25-27)
Bradley Quickley attempts a Midrange. Contested by Pau Williamson (4.8 feet, MAN). BRADLEY QUICKLEY MAKES IT! Assist: Devin Jackson
Score: 27-27

[10:15] Team_003 possession (Score: 27-27)
Pau Williamson drives, Bradley Quickley stays with him. Pau Williamson attempts a Layup. Contested by Bradley Quickley (4.0 feet, MAN). Pau Williamson misses. Offensive rebound by Bam Gilgeous-Alexander! Bam Gilgeous-Alexander puts it back in!
Score: 27-29

[10:02] Team_054 possession (Score: 27-29)
Bradley Quickley attempts a 3Pt. Contested by Pau Williamson (4.8 feet, MAN). BRADLEY QUICKLEY MAKES IT! Assist: Tobias Nowitzki
Score: 30-29

[09:47] Team_003 possession (Score: 30-29)
FOUL! Shooting foul on Bradley Quickley. Pau Williamson to the line for 2 free throws. [Team fouls: 1] (Bradley Quickley: 1 personal fouls)   FT 1/2: MISS   FT 2/2: GOOD Pau Williamson makes 1/2 from the line.
Score: 30-30

[09:33] Team_054 possession (Score: 30-30)
Shaquille Irving attempts a Layup. Contested by Bam Gilgeous-Alexander (3.4 feet, ZONE). Shaquille Irving misses. FOUL! Loose ball foul on Collin Mitchell during the rebound battle. [Team fouls: 2] No free throws, side out. (Collin Mitchell: 1 personal fouls)

[09:20] Team_054 possession (Score: 30-30)
Shaquille Irving drives and kicks out. Devin Jackson attempts a 3Pt. Contested by Bam Gilgeous-Alexander (3.0 feet, MAN). Devin Jackson misses. Offensive rebound by Tobias Nowitzki! Tobias Nowitzki kicks it out.

[09:05] Team_054 possession (Score: 30-30)
Shaquille Irving attempts a 3Pt. Contested by Miles Towns (5.7 feet, ZONE). Shaquille Irving misses. Offensive rebound by Tobias Nowitzki! Tobias Nowitzki kicks it out.

[08:50] Team_054 possession (Score: 30-30)
Bradley Quickley attempts a Midrange. Contested by Pau Williamson (4.8 feet, MAN). Bradley Quickley misses. Rebound secured by Collin Mitchell.

[08:37] Team_003 possession (Score: 30-30)
Anfernee Jordan drives to the basket... Anfernee Jordan throws a bad pass! Stolen by Devin Jackson! TURNOVER! (live ball)

[08:21] Team_054 possession (Score: 30-30)
Vince James drives and kicks out. Tobias Nowitzki attempts a Midrange. Contested by Anfernee Jordan (4.4 feet, ZONE). Tobias Nowitzki misses. Rebound secured by Bam Gilgeous-Alexander.

[08:05] Team_003 possession (Score: 30-30)
Bam Gilgeous-Alexander drives and kicks out. Collin Mitchell attempts a Midrange. Contested by Tobias Nowitzki (5.7 feet, ZONE). COLLIN MITCHELL MAKES IT!
Score: 30-32

[07:50] Team_054 possession (Score: 30-32)
Bradley Quickley drives, picks up Bam Gilgeous-Alexander. Help arrives from Pau Williamson! Bradley Quickley attempts a Layup. Contested by Pau Williamson (2.6 feet, ZONE). Bradley Quickley misses. Rebound secured by Bam Gilgeous-Alexander.

[07:36] Team_003 possession (Score: 30-32)
Pau Williamson loses the ball! Stripped by Bradley Quickley! TURNOVER! (live ball)

[07:21] Team_054 possession (Score: 30-32)
Tobias Nowitzki drives, Bam Gilgeous-Alexander stays with him. Tobias Nowitzki attempts a Dunk. Contested by Bam Gilgeous-Alexander (3.0 feet, ZONE). Tobias Nowitzki misses. Rebound secured by Collin Mitchell.

[07:09] Team_003 possession (Score: 30-32)
Anfernee Jordan attempts a Layup. Contested by Devin Jackson (5.2 feet, ZONE). ANFERNEE JORDAN MAKES IT!
Score: 30-34

[06:54] Team_054 possession (Score: 30-34)
Vince James attempts a Midrange. Contested by Collin Mitchell (4.8 feet, MAN). Vince James misses. Rebound secured by Collin Mitchell.

[06:39] Team_003 possession (Score: 30-34)
Collin Mitchell attempts a 3Pt. Contested by Vince James (5.1 feet, MAN). Collin Mitchell misses. Rebound secured by Vince James.

[06:23] Team_054 possession (Score: 30-34)
FOUL! Reach-in foul on Bam Gilgeous-Alexander during the drive. [Team fouls: 3] No free throws, side out. (Bam Gilgeous-Alexander: 1 personal fouls)

[06:08] Team_054 possession (Score: 30-34)
Shaquille Irving drives and kicks out. Shaquille Irving attempts a Midrange. Contested by Collin Mitchell (4.1 feet, ZONE). SHAQUILLE IRVING MAKES IT! Assist: Vince James
Score: 32-34

[05:52] Team_003 possession (Score: 32-34)
Collin Mitchell attempts a 3Pt. Contested by Shaquille Irving (4.8 feet, ZONE). Collin Mitchell misses. Rebound secured by Devin Jackson.

[05:36] Team_054 possession (Score: 32-34)
Shaquille Irving attempts a 3Pt. Contested by Miles Towns (5.7 feet, MAN). Shaquille Irving misses. Rebound secured by Collin Mitchell.

[05:21] Team_003 possession (Score: 32-34)
Bam Gilgeous-Alexander makes the Dunk and draws the foul on Bradley Quickley! And-1! Bam Gilgeous-Alexander to the line for 1. [Team fouls: 2] (Bradley Quickley: 2 personal fouls)   FT 1/1: GOOD Bam Gilgeous-Alexander makes 1/1 from the line.
Score: 32-37

[05:05] Team_054 possession (Score: 32-37)
FOUL! Shooting foul on Pau Williamson. Vince James to the line for 2 free throws. [Team fouls: 4] (Pau Williamson: 1 personal fouls)   FT 1/2: GOOD   FT 2/2: MISS Vince James makes 1/2 from the line. Rebound secured by Bam Gilgeous-Alexander.
Score: 33-37

[04:52] Team_003 possession (Score: 33-37)
Miles Towns attempts a 3Pt. Contested by Shaquille Irving (4.5 feet, MAN). Miles Towns misses. Rebound secured by Devin Jackson.

[04:40] Team_054 possession (Score: 33-37)
Shaquille Irving drives, Bam Gilgeous-Alexander stays with him. Shaquille Irving attempts a Dunk. Contested by Bam Gilgeous-Alexander (3.5 feet, ZONE). SHAQUILLE IRVING MAKES IT! Assist: Bradley Quickley
Score: 35-37

[04:26] Team_003 possession (Score: 35-37)
Miles Towns drives to the basket... Miles Towns throws a bad pass! Stolen by Devin Jackson! TURNOVER! (live ball)

[04:10] Team_054 possession (Score: 35-37)
Vince James attempts a 3Pt. Contested by Collin Mitchell (4.8 feet, MAN). VINCE JAMES MAKES IT! Assist: Shaquille Irving
Score: 38-37

[03:55] Team_003 possession (Score: 38-37)
Pau Williamson loses control! Ball rolls out of bounds! TURNOVER! (dead ball)

[03:43] Team_054 possession (Score: 38-37)
FOUL! Offensive foul on Devin Jackson! Bam Gilgeous-Alexander drew the charge! [Team fouls: 3] (Devin Jackson: 1 personal fouls) TURNOVER! (dead ball)

[03:29] Team_003 possession (Score: 38-37)
FOUL! Shooting foul on Vince James. Collin Mitchell to the line for 2 free throws. [Team fouls: 4] (Vince James: 1 personal fouls)   FT 1/2: MISS   FT 2/2: GOOD Collin Mitchell makes 1/2 from the line.
Score: 38-38

[03:10] Team_054 possession (Score: 38-38)
FOUL! Reach-in foul on Bam Gilgeous-Alexander during the drive. [IN THE BONUS! 5 team fouls] Devin Jackson to the line for 2 free throws. (Bam Gilgeous-Alexander: 2 personal fouls)   FT 1/2: GOOD   FT 2/2: GOOD Devin Jackson makes 2/2 from the line.
Score: 40-38

[02:58] Team_003 possession (Score: 40-38)
Miles Towns attempts a 3Pt. Contested by Shaquille Irving (4.6 feet, ZONE). MILES TOWNS MAKES IT! Assist: Collin Mitchell
Score: 40-41

[02:46] Team_054 possession (Score: 40-41)
Shaquille Irving attempts a 3Pt. Contested by Miles Towns (5.8 feet, ZONE). Shaquille Irving misses. FOUL! Loose ball foul on Anfernee Jordan during the rebound battle. [IN THE BONUS! 6 team fouls] Vince James to the line for 2 free throws. (Anfernee Jordan: 2 personal fouls)   FT 1/2: GOOD   FT 2/2: GOOD Vince James makes 2/2 from the line.
Score: 42-41

[02:34] Team_003 possession (Score: 42-41)
Miles Towns drives and kicks out. Miles Towns attempts a 3Pt. Contested by Shaquille Irving (4.8 feet, ZONE). Miles Towns misses. Rebound secured by Devin Jackson.

[02:24] Team_054 possession (Score: 42-41)
Devin Jackson makes the Layup and draws the foul on Pau Williamson! And-1! Devin Jackson to the line for 1. [BONUS: 7 team fouls] (Pau Williamson: 2 personal fouls)   FT 1/1: GOOD Devin Jackson makes 1/1 from the line.
Score: 45-41

[02:06] Team_003 possession (Score: 45-41)
Miles Towns attempts a 3Pt. Contested by Shaquille Irving (4.7 feet, ZONE). Miles Towns misses. Rebound secured by Vince James.

[01:51] Team_054 possession (Score: 45-41)
Tobias Nowitzki makes the Layup and draws the foul on Anfernee Jordan! And-1! Tobias Nowitzki to the line for 1. [BONUS: 8 team fouls] (Anfernee Jordan: 3 personal fouls)   FT 1/1: GOOD Tobias Nowitzki makes 1/1 from the line.
Score: 48-41

[01:34] Team_003 possession (Score: 48-41)
Collin Mitchell attempts a 3Pt. Contested by Vince James (5.3 feet, MAN). COLLIN MITCHELL MAKES IT! Assist: Miles Towns
Score: 48-44

[01:21] Team_054 possession (Score: 48-44)
Vince James drives, Collin Mitchell stays with him. Vince James attempts a Dunk. Contested by Collin Mitchell (5.0 feet, MAN). VINCE JAMES MAKES IT! Assist: Tobias Nowitzki
Score: 50-44

[01:07] Team_003 possession (Score: 50-44)
Anfernee Jordan attempts a Midrange. Contested by Vince James (5.0 feet, ZONE). Anfernee Jordan misses. Rebound secured by Devin Jackson.

[00:50] Team_054 possession (Score: 50-44)
Vince James makes the Dunk and draws the foul on Pau Williamson! And-1! Vince James to the line for 1. [BONUS: 9 team fouls] (Pau Williamson: 3 personal fouls)   FT 1/1: GOOD Vince James makes 1/1 from the line.
Score: 53-44

[00:33] Team_003 possession (Score: 53-44)
Pau Williamson attempts a Midrange. Contested by Bradley Quickley (4.4 feet, MAN). Pau Williamson misses. Offensive rebound by Bam Gilgeous-Alexander! Bam Gilgeous-Alexander puts it back in!
Score: 53-46

[00:17] Team_054 possession (Score: 53-46)
Devin Jackson attempts a Layup. BLOCKED BY BAM GILGEOUS-ALEXANDER! Ball is loose! Rebound secured by Anfernee Jordan.

================================================================================
                              2ND QUARTER COMPLETE                              
================================================================================

2ND QUARTER SCORE: Team_054 29, Team_003 21

BOX SCORE:
================================================================================

Team_054
--------------------------------------------------------------------------------
Player                MIN  PTS  REB  AST  TO      FG   FG%      3P   3P%
--------------------------------------------------------------------------------
Vince James            11   10    4    1   0   4/7    57.1     0/0   0.0
Bradley Quickley       11    5    0    1   0   2/4    50.0     0/0   0.0
Devin Jackson          11    5    4    1   0   2/3    66.7     0/0   0.0
Shaquille Irving       11    4    0    1   0   2/3    66.7     0/0   0.0
Tobias Nowitzki        11    3    2    2   0   1/2    50.0     0/0   0.0
Blake Russell          13    0    0    0   0   0/1     0.0     0/0   0.0
Vince Ball             13    0    0    0   0   0/1     0.0     0/0   0.0

TEAM: FG: 11/21 (52.4%), 3PT: 3/5 (60.0%), REB: 10 (3 off, 7 def), AST: 6, TO: 2
TEAM FOULS: 4


Team_003
--------------------------------------------------------------------------------
Player                MIN  PTS  REB  AST  TO      FG   FG%      3P   3P%
--------------------------------------------------------------------------------
Bam Gilgeous-Alexander   11    9    6    0   0   4/4   100.0     0/0   0.0
Collin Mitchell        11    6    4    1   0   3/5    60.0     0/0   0.0
Miles Towns            11    3    0    1   0   1/5    20.0     0/0   0.0
Anfernee Jordan        11    2    1    0   0   1/2    50.0     0/0   0.0
Pau Williamson         11    1    0    0   0   1/1   100.0     0/0   0.0
Victor O'Neal          13    0    1    0   0   0/0     0.0     0/0   0.0
Rudy Haliburton        13    0    1    0   0   0/0     0.0     0/0   0.0

TEAM: FG: 10/17 (58.8%), 3PT: 3/7 (42.9%), REB: 13 (3 off, 10 def), AST: 2, TO: 5
TEAM FOULS: 9 [Team_054 in BONUS]

================================================================================

================================================================================
                       3RD QUARTER - Team_054 vs Team_003                       
================================================================================

[12:00] Team_054 possession (Score: 53-46)
Vince Ball drives and kicks out. Vince Ball attempts a 3Pt. Contested by Giannis Turner (2.8 feet, ZONE). VINCE BALL MAKES IT! Assist: Malcolm Harden
Score: 56-46

[11:44] Team_003 possession (Score: 56-46)
Ayo Jackson drives, Blake Russell stays with him. Ayo Jackson attempts a Dunk. Contested by Blake Russell (3.3 feet, ZONE). AYO JACKSON MAKES IT!
Score: 56-48

[11:32] Team_054 possession (Score: 56-48)
Vince Ball attempts a 3Pt. Contested by Giannis Turner (2.9 feet, ZONE). Vince Ball misses. Rebound secured by Rudy Haliburton.

[11:18] Team_003 possession (Score: 56-48)
Giannis Turner attempts a Layup. Contested by Blake Russell (3.3 feet, ZONE). Giannis Turner misses. Rebound secured by Luka Brogdon.

[11:04] Team_054 possession (Score: 56-48)
Malcolm Harden loses control! Ball rolls out of bounds! TURNOVER! (dead ball)

[10:54] Team_003 possession (Score: 56-48)
Victor O'Neal drives and kicks out. Rudy Haliburton attempts a Midrange. BLOCKED BY VINCE BALL! Ball is loose! Rebound secured by Blake Russell.

[10:39] Team_054 possession (Score: 56-48)
Lauri Irving throws a bad pass out of bounds! TURNOVER! (dead ball)

[10:20] Team_003 possession (Score: 56-48)
Victor O'Neal attempts a Midrange. Contested by Blake Russell (3.0 feet, MAN). Victor O'Neal misses. Rebound secured by Lauri Irving.

[10:06] Team_054 possession (Score: 56-48)
Luka Brogdon drives, picks up Giannis Turner. Help arrives from Nikola Bryant! Luka Brogdon attempts a Dunk. Contested by Nikola Bryant (3.1 feet, ZONE). LUKA BROGDON MAKES IT! Assist: Blake Russell
Score: 58-48

[09:52] Team_003 possession (Score: 58-48)
Giannis Turner attempts a 3Pt. Contested by Luka Brogdon (4.3 feet, MAN). Giannis Turner misses. Rebound secured by Blake Russell.

[09:34] Team_054 possession (Score: 58-48)
FOUL! Reach-in foul on Giannis Turner during the drive. [Team fouls: 1] No free throws, side out. (Giannis Turner: 1 personal fouls)

[09:16] Team_054 possession (Score: 58-48)
Vince Ball attempts a Midrange. Contested by Rudy Haliburton (3.4 feet, MAN). Vince Ball misses. Rebound secured by Victor O'Neal.

[08:57] Team_003 possession (Score: 58-48)
Victor O'Neal drives and kicks out. Giannis Turner makes the Midrange and draws the foul on Luka Brogdon! And-1! Giannis Turner to the line for 1. [Team fouls: 1] (Luka Brogdon: 1 personal fouls)   FT 1/1: GOOD Giannis Turner makes 1/1 from the line.
Score: 58-51

[08:44] Team_054 possession (Score: 58-51)
Vince Ball attempts a 3Pt. Contested by Rudy Haliburton (3.4 feet, MAN). Vince Ball misses. Rebound secured by Victor O'Neal.

[08:28] Team_003 possession (Score: 58-51)
Giannis Turner attempts a 3Pt. Contested by Lauri Irving (3.7 feet, ZONE). GIANNIS TURNER MAKES IT! Assist: Rudy Haliburton
Score: 58-54

[08:11] Team_054 possession (Score: 58-54)
Luka Brogdon attempts a Layup. Contested by Giannis Turner (3.1 feet, MAN). LUKA BROGDON MAKES IT! Assist: Lauri Irving
Score: 60-54

[07:58] Team_003 possession (Score: 60-54)
Giannis Turner attempts a Midrange. Contested by Luka Brogdon (4.3 feet, MAN). Giannis Turner misses. Offensive rebound by Victor O'Neal! Victor O'Neal kicks it out.

[07:41] Team_003 possession (Score: 60-54)
Giannis Turner drives, Luka Brogdon stays with him. Giannis Turner attempts a Dunk. Contested by Luka Brogdon (4.3 feet, MAN). GIANNIS TURNER MAKES IT! Assist: Ayo Jackson
Score: 60-56

[07:24] Team_054 possession (Score: 60-56)
Blake Russell attempts a 3Pt. Contested by Giannis Turner (3.2 feet, MAN). Blake Russell misses. FOUL! Loose ball foul on Giannis Turner during the rebound battle. [Team fouls: 2] No free throws, side out. (Giannis Turner: 2 personal fouls)

[07:10] Team_054 possession (Score: 60-56)
Vince Ball drives, picks up Victor O'Neal. Help arrives from Nikola Bryant! Vince Ball attempts a Layup. Contested by Nikola Bryant (4.3 feet, ZONE). Vince Ball misses. Rebound secured by Rudy Haliburton.

[07:00] Team_003 possession (Score: 60-56)
Ayo Jackson attempts a 3Pt. Contested by Malcolm Harden (4.4 feet, MAN). AYO JACKSON MAKES IT! Assist: Rudy Haliburton
Score: 60-59

[06:43] Team_054 possession (Score: 60-59)
Lauri Irving drives to the basket... Lauri Irving loses control! Ball rolls out of bounds! TURNOVER! (dead ball)

[06:28] Team_003 possession (Score: 60-59)
Rudy Haliburton attempts a Layup. Contested by Blake Russell (3.1 feet, ZONE). Rudy Haliburton misses. Offensive rebound by Victor O'Neal! Victor O'Neal kicks it out.

[06:12] Team_003 possession (Score: 60-59)
Ayo Jackson drives and kicks out. Victor O'Neal attempts a 3Pt. Contested by Blake Russell (3.0 feet, MAN). Victor O'Neal misses. Rebound secured by Luka Brogdon.

[05:59] Team_054 possession (Score: 60-59)
Malcolm Harden attempts a 3Pt. Contested by Giannis Turner (3.1 feet, ZONE). Malcolm Harden misses. Rebound secured by Rudy Haliburton.

[05:45] Team_003 possession (Score: 60-59)
FOUL! Shooting foul on Blake Russell. Ayo Jackson to the line for 2 free throws. [Team fouls: 2] (Blake Russell: 1 personal fouls)   FT 1/2: MISS   FT 2/2: GOOD Ayo Jackson makes 1/2 from the line.
Score: 60-60

[05:33] Team_054 possession (Score: 60-60)
Vince Ball attempts a Midrange. Contested by Rudy Haliburton (3.4 feet, MAN). VINCE BALL MAKES IT! Assist: Malcolm Harden
Score: 62-60

[05:19] Team_003 possession (Score: 62-60)
FOUL! Shooting foul on Blake Russell. Victor O'Neal to the line for 2 free throws. [Team fouls: 3] (Blake Russell: 2 personal fouls)   FT 1/2: GOOD   FT 2/2: GOOD Victor O'Neal makes 2/2 from the line.
Score: 62-62

[05:05] Team_054 possession (Score: 62-62)
FOUL! Shooting foul on Rudy Haliburton. Malcolm Harden to the line for 2 free throws. [Team fouls: 3] (Rudy Haliburton: 1 personal fouls)   FT 1/2: GOOD   FT 2/2: MISS Malcolm Harden makes 1/2 from the line. Offensive rebound by Luka Brogdon! Luka Brogdon kicks it out.
Score: 63-62

[04:51] Team_054 possession (Score: 63-62)
Blake Russell drives and kicks out. Blake Russell attempts a 3Pt. Contested by Giannis Turner (2.8 feet, MAN). Blake Russell misses. Rebound secured by Giannis Turner.

[04:33] Team_003 possession (Score: 63-62)
Nikola Bryant attempts a Midrange. Contested by Lauri Irving (3.7 feet, ZONE). Nikola Bryant misses. Offensive rebound by Rudy Haliburton! Rudy Haliburton puts it back in!
Score: 63-64

[04:22] Team_054 possession (Score: 63-64)
FOUL! Reach-in foul on Giannis Turner during the drive. [Team fouls: 4] No free throws, side out. (Giannis Turner: 3 personal fouls)

[04:05] Team_054 possession (Score: 63-64)
Lauri Irving attempts a Midrange. Contested by Rudy Haliburton (3.8 feet, ZONE). Lauri Irving misses. Offensive rebound by Luka Brogdon! Luka Brogdon kicks it out.

[03:50] Team_054 possession (Score: 63-64)
Vince Ball attempts a Layup. Contested by Rudy Haliburton (3.5 feet, MAN). VINCE BALL MAKES IT!
Score: 65-64

[03:36] Team_003 possession (Score: 65-64)
Victor O'Neal drives, Blake Russell stays with him. Victor O'Neal attempts a Dunk. Contested by Blake Russell (3.2 feet, MAN). VICTOR O'NEAL MAKES IT! Assist: Nikola Bryant
Score: 65-66

[03:21] Team_054 possession (Score: 65-66)
Malcolm Harden throws a bad pass out of bounds! TURNOVER! (dead ball)

[03:07] Team_003 possession (Score: 65-66)
Giannis Turner drives and kicks out. Rudy Haliburton attempts a Midrange. Contested by Malcolm Harden (4.3 feet, ZONE). RUDY HALIBURTON MAKES IT! Assist: Ayo Jackson
Score: 65-68

[02:53] Team_054 possession (Score: 65-68)
Lauri Irving attempts a Midrange. Contested by Nikola Bryant (4.7 feet, ZONE). LAURI IRVING MAKES IT! Assist: Vince Ball
Score: 67-68

[02:35] Team_003 possession (Score: 67-68)
Rudy Haliburton drives, Blake Russell stays with him. Rudy Haliburton attempts a Dunk. Contested by Blake Russell (3.4 feet, ZONE). RUDY HALIBURTON MAKES IT! Assist: Giannis Turner
Score: 67-70

[02:19] Team_054 possession (Score: 67-70)
Lauri Irving attempts a 3Pt. Contested by Giannis Turner (3.6 feet, ZONE). Lauri Irving misses. Offensive rebound by Luka Brogdon! Luka Brogdon kicks it out.

[02:04] Team_054 possession (Score: 67-70)
Vince Ball attempts a Midrange. Contested by Rudy Haliburton (3.6 feet, MAN). VINCE BALL MAKES IT! Assist: Blake Russell
Score: 69-70

[01:50] Team_003 possession (Score: 69-70)
FOUL! Reach-in foul on Blake Russell during the drive. [Team fouls: 4] No free throws, side out. (Blake Russell: 3 personal fouls)

[01:35] Team_003 possession (Score: 69-70)
FOUL! Holding foul on Vince Ball. [IN THE BONUS! 5 team fouls] Rudy Haliburton to the line for 2 free throws. (Vince Ball: 1 personal fouls)   FT 1/2: GOOD   FT 2/2: GOOD Rudy Haliburton makes 2/2 from the line.
Score: 69-72

[01:17] Team_054 possession (Score: 69-72)
Malcolm Harden attempts a 3Pt. Contested by Ayo Jackson (5.8 feet, MAN). Malcolm Harden misses. Offensive rebound by Luka Brogdon! Luka Brogdon kicks it out.

[01:03] Team_054 possession (Score: 69-72)
Malcolm Harden drives to the basket... FOUL! Offensive foul on Malcolm Harden! Ayo Jackson drew the charge! [Team fouls: 6] (Malcolm Harden: 1 personal fouls) TURNOVER! (dead ball)

[00:53] Team_003 possession (Score: 69-72)
Rudy Haliburton drives, Blake Russell stays with him. Rudy Haliburton attempts a Dunk. Contested by Blake Russell (3.6 feet, ZONE). Rudy Haliburton misses. Rebound secured by Blake Russell.

[00:44] Team_054 possession (Score: 69-72)
FOUL! Reach-in foul on Rudy Haliburton during the drive. [IN THE BONUS! 5 team fouls] Vince Ball to the line for 2 free throws. (Rudy Haliburton: 2 personal fouls)   FT 1/2: GOOD   FT 2/2: GOOD Vince Ball makes 2/2 from the line.
Score: 71-72

[00:30] Team_003 possession (Score: 71-72)
Victor O'Neal drives and kicks out. FOUL! Shooting foul on Vince Ball. Rudy Haliburton to the line for 2 free throws. [BONUS: 7 team fouls] (Vince Ball: 2 personal fouls)   FT 1/2: GOOD   FT 2/2: GOOD Rudy Haliburton makes 2/2 from the line.
Score: 71-74

[00:18] Team_054 possession (Score: 71-74)
Vince Ball drives, Rudy Haliburton stays with him. Vince Ball attempts a Layup. Contested by Rudy Haliburton (3.8 feet, MAN). VINCE BALL MAKES IT! Assist: Lauri Irving
Score: 73-74

[00:05] Team_003 possession (Score: 73-74)
Rudy Haliburton attempts a 3Pt. Contested by Luka Brogdon (4.5 feet, ZONE). Rudy Haliburton misses. Rebound secured by Blake Russell.

================================================================================
                              3RD QUARTER COMPLETE                              
================================================================================

3RD QUARTER SCORE: Team_054 20, Team_003 28

BOX SCORE:
================================================================================

Team_054
--------------------------------------------------------------------------------
Player                MIN  PTS  REB  AST  TO      FG   FG%      3P   3P%
--------------------------------------------------------------------------------
Vince Ball             26   13    0    1   0   6/10   60.0     0/0   0.0
Luka Brogdon           26    4    6    0   0   2/2   100.0     0/0   0.0
Lauri Irving           25    2    1    2   0   1/1   100.0     0/0   0.0
Malcolm Harden         25    0    0    2   0   0/1     0.0     0/0   0.0
Blake Russell          25    0    5    2   0   0/1     0.0     0/0   0.0

TEAM: FG: 9/15 (60.0%), 3PT: 0/3 (0.0%), REB: 12 (5 off, 7 def), AST: 7, TO: 5
TEAM FOULS: 7 [Team_003 in BONUS]


Team_003
--------------------------------------------------------------------------------
Player                MIN  PTS  REB  AST  TO      FG   FG%      3P   3P%
--------------------------------------------------------------------------------
Rudy Haliburton        26   10    4    2   0   5/7    71.4     0/0   0.0
Giannis Turner         25    8    1    1   0   3/5    60.0     0/0   0.0
Ayo Jackson            25    6    0    2   0   3/4    75.0     0/0   0.0
Victor O'Neal          25    4    4    0   0   2/4    50.0     0/0   0.0
Nikola Bryant          25    0    0    1   0   0/0     0.0     0/0   0.0

TEAM: FG: 13/20 (65.0%), 3PT: 2/4 (50.0%), REB: 9 (3 off, 6 def), AST: 6, TO: 0
TEAM FOULS: 5 [Team_054 in BONUS]

================================================================================

================================================================================
                       4TH QUARTER - Team_054 vs Team_003                       
================================================================================

[12:00] Team_054 possession (Score: 73-74)
Vince Ball drives, Giannis Turner stays with him. Vince Ball attempts a Layup. Contested by Giannis Turner (3.3 feet, ZONE). VINCE BALL MAKES IT! Assist: Lauri Irving
Score: 75-74

[11:44] Team_003 possession (Score: 75-74)
Nikola Bryant attempts a Midrange. Contested by Lauri Irving (4.0 feet, MAN). Nikola Bryant misses. Offensive rebound by Victor O'Neal! Victor O'Neal kicks it out.

[11:28] Team_003 possession (Score: 75-74)
Giannis Turner attempts a 3Pt. Contested by Luka Brogdon (4.5 feet, MAN). Giannis Turner misses. Offensive rebound by Rudy Haliburton! Rudy Haliburton kicks it out.

[11:15] Team_003 possession (Score: 75-74)
Nikola Bryant drives, Blake Russell stays with him. Nikola Bryant attempts a Layup. Contested by Blake Russell (3.8 feet, ZONE). Nikola Bryant misses. Offensive rebound by Victor O'Neal! Victor O'Neal kicks it out.

[11:02] Team_003 possession (Score: 75-74)
Victor O'Neal throws a bad pass! Stolen by Blake Russell! TURNOVER! (live ball)

[10:45] Team_054 possession (Score: 75-74)
Malcolm Harden attempts a 3Pt. Contested by Ayo Jackson (5.9 feet, MAN). Malcolm Harden misses. Rebound secured by Giannis Turner.

[10:28] Team_003 possession (Score: 75-74)
Rudy Haliburton drives, picks up Blake Russell. Help arrives from Lauri Irving! Rudy Haliburton attempts a Dunk. Contested by Lauri Irving (3.7 feet, ZONE). RUDY HALIBURTON MAKES IT! Assist: Ayo Jackson
Score: 75-76

[10:14] Team_054 possession (Score: 75-76)
Luka Brogdon attempts a 3Pt. Contested by Giannis Turner (3.7 feet, MAN). Luka Brogdon misses. Rebound secured by Victor O'Neal.

[09:59] Team_003 possession (Score: 75-76)
Giannis Turner drives, picks up Luka Brogdon. Help arrives from Lauri Irving! Giannis Turner attempts a Dunk. Contested by Lauri Irving (4.6 feet, MAN). GIANNIS TURNER MAKES IT!
Score: 75-78

[09:46] Team_054 possession (Score: 75-78)
Blake Russell drives, Giannis Turner stays with him. Blake Russell attempts a Layup. Contested by Giannis Turner (3.8 feet, ZONE). Blake Russell misses. Offensive rebound by Blake Russell! Blake Russell puts it back in!
Score: 77-78

[09:34] Team_003 possession (Score: 77-78)
Nikola Bryant attempts a 3Pt. Contested by Lauri Irving (4.2 feet, ZONE). NIKOLA BRYANT MAKES IT! Assist: Ayo Jackson
Score: 77-81

[09:19] Team_054 possession (Score: 77-81)
Blake Russell attempts a Layup. Contested by Giannis Turner (3.9 feet, ZONE). Blake Russell misses. Offensive rebound by Blake Russell! Blake Russell puts it back in!
Score: 79-81

[09:08] Team_003 possession (Score: 79-81)
Giannis Turner attempts a 3Pt. Contested by Lauri Irving (4.3 feet, ZONE). Giannis Turner misses. Rebound secured by Vince Ball.

[08:56] Team_054 possession (Score: 79-81)
Vince Ball attempts a Layup. Contested by Giannis Turner (3.7 feet, ZONE). Vince Ball misses. Offensive rebound by Blake Russell! Blake Russell's putback is no good. Rebound secured by Victor O'Neal.

[08:40] Team_003 possession (Score: 79-81)
Victor O'Neal attempts a 3Pt. Contested by Lauri Irving (4.1 feet, ZONE). Victor O'Neal misses. Rebound secured by Blake Russell.

[08:28] Team_054 possession (Score: 79-81)
Luka Brogdon attempts a Layup. Contested by Giannis Turner (4.0 feet, ZONE). LUKA BROGDON MAKES IT! Assist: Blake Russell
Score: 81-81

[08:18] Team_003 possession (Score: 81-81)
Ayo Jackson attempts a Layup. BLOCKED BY BLAKE RUSSELL! Ball is loose! Rebound secured by Luka Brogdon.

[08:01] Team_054 possession (Score: 81-81)
Malcolm Harden drives and kicks out. Malcolm Harden attempts a 3Pt. Wide open! Ayo Jackson is 6.1 feet away. [ZONE] Malcolm Harden misses. Rebound secured by Rudy Haliburton.

[07:42] Team_003 possession (Score: 81-81)
Rudy Haliburton makes the Layup and draws the foul on Blake Russell! And-1! Rudy Haliburton to the line for 1. [Team fouls: 1] (Blake Russell: 1 personal fouls)   FT 1/1: GOOD Rudy Haliburton makes 1/1 from the line.
Score: 81-84

[07:28] Team_054 possession (Score: 81-84)
Blake Russell drives to the basket... FOUL! Offensive foul on Blake Russell! Victor O'Neal drew the charge! [Team fouls: 2] (Blake Russell: 2 personal fouls) TURNOVER! (dead ball)

[07:14] Team_003 possession (Score: 81-84)
Victor O'Neal attempts a Layup. Contested by Blake Russell (4.1 feet, MAN). Victor O'Neal misses. Rebound secured by Blake Russell.

[06:57] Team_054 possession (Score: 81-84)
Malcolm Harden attempts a 3Pt. Contested by Giannis Turner (4.1 feet, ZONE). Malcolm Harden misses. Rebound secured by Victor O'Neal.

[06:45] Team_003 possession (Score: 81-84)
Victor O'Neal drives, Blake Russell stays with him. Victor O'Neal attempts a Layup. Contested by Blake Russell (4.2 feet, ZONE). VICTOR O'NEAL MAKES IT! Assist: Ayo Jackson
Score: 81-86

[06:27] Team_054 possession (Score: 81-86)
Blake Russell drives, Victor O'Neal stays with him. Blake Russell attempts a Layup. Contested by Victor O'Neal (5.5 feet, MAN). BLAKE RUSSELL MAKES IT! Assist: Malcolm Harden
Score: 83-86

[06:12] Team_003 possession (Score: 83-86)
Giannis Turner makes the Layup and draws the foul on Luka Brogdon! And-1! Giannis Turner to the line for 1. [Team fouls: 3] (Luka Brogdon: 1 personal fouls)   FT 1/1: GOOD Giannis Turner makes 1/1 from the line.
Score: 83-89

[06:00] Team_054 possession (Score: 83-89)
Malcolm Harden drives, Giannis Turner stays with him. Malcolm Harden attempts a Dunk. Contested by Giannis Turner (4.3 feet, ZONE). Malcolm Harden misses. Rebound secured by Rudy Haliburton.

[05:44] Team_003 possession (Score: 83-89)
Victor O'Neal attempts a 3Pt. Contested by Lauri Irving (4.5 feet, ZONE). Victor O'Neal misses. Rebound secured by Luka Brogdon.

[05:26] Team_054 possession (Score: 83-89)
Blake Russell attempts a Midrange. Contested by Rudy Haliburton (4.7 feet, ZONE). Blake Russell misses. Rebound secured by Victor O'Neal.

[05:08] Team_003 possession (Score: 83-89)
Victor O'Neal attempts a Midrange. Contested by Lauri Irving (4.6 feet, ZONE). Victor O'Neal misses. Rebound secured by Blake Russell.

[04:53] Team_054 possession (Score: 83-89)
Luka Brogdon attempts a 3Pt. Contested by Giannis Turner (4.5 feet, MAN). Luka Brogdon misses. Offensive rebound by Luka Brogdon! Luka Brogdon kicks it out.

[04:33] Team_054 possession (Score: 83-89)
Malcolm Harden drives and kicks out. Lauri Irving makes the Midrange and draws the foul on Nikola Bryant! And-1! Lauri Irving to the line for 1. [Team fouls: 1] (Nikola Bryant: 1 personal fouls)   FT 1/1: GOOD Lauri Irving makes 1/1 from the line.
Score: 86-89

[04:18] Team_003 possession (Score: 86-89)
Giannis Turner drives to the basket... Giannis Turner throws a bad pass out of bounds! TURNOVER! (dead ball)

[04:18] Substitution (Team_054): Malcolm Harden OUT → Shaquille Irving IN (stamina_rule2)

[04:18] Substitution (Team_054): Lauri Irving OUT → Bradley Quickley IN (stamina_rule2)

[04:18] Substitution (Team_054): Vince Ball OUT → Vince James IN (stamina_rule2)

[04:18] Substitution (Team_054): Luka Brogdon OUT → Tobias Nowitzki IN (stamina_rule2)

[04:18] Substitution (Team_054): Blake Russell OUT → Devin Jackson IN (stamina_rule2)

[04:18] Substitution (Team_003): Ayo Jackson OUT → Miles Towns IN (stamina_rule2)

[04:18] Substitution (Team_003): Nikola Bryant OUT → Pau Williamson IN (stamina_rule2)

[04:18] Substitution (Team_003): Rudy Haliburton OUT → Collin Mitchell IN (stamina_rule2)

[04:18] Substitution (Team_003): Giannis Turner OUT → Anfernee Jordan IN (stamina_rule2)

[04:18] Substitution (Team_003): Victor O'Neal OUT → Bam Gilgeous-Alexander IN (stamina_rule2)

[04:06] Team_054 possession (Score: 86-89)
Tobias Nowitzki drives, Bam Gilgeous-Alexander stays with him. Tobias Nowitzki attempts a Layup. Contested by Bam Gilgeous-Alexander (3.0 feet, ZONE). Tobias Nowitzki misses. Rebound secured by Anfernee Jordan.

[03:52] Team_003 possession (Score: 86-89)
Pau Williamson attempts a 3Pt. Contested by Shaquille Irving (4.5 feet, ZONE). PAU WILLIAMSON MAKES IT! Assist: Miles Towns
Score: 86-92

[03:37] Team_054 possession (Score: 86-92)
Devin Jackson makes the Layup and draws the foul on Bam Gilgeous-Alexander! And-1! Devin Jackson to the line for 1. [Team fouls: 2] (Bam Gilgeous-Alexander: 1 personal fouls)   FT 1/1: GOOD Devin Jackson makes 1/1 from the line.
Score: 89-92

[03:20] Team_003 possession (Score: 89-92)
Miles Towns attempts a 3Pt. Contested by Shaquille Irving (4.5 feet, MAN). Miles Towns misses. Rebound secured by Vince James.

[03:05] Team_054 possession (Score: 89-92)
Bradley Quickley drives, picks up Bam Gilgeous-Alexander. Help arrives from Pau Williamson! Bradley Quickley attempts a Dunk. Contested by Pau Williamson (2.6 feet, ZONE). Bradley Quickley misses. Rebound secured by Collin Mitchell.

[02:52] Team_003 possession (Score: 89-92)
FOUL! Reach-in foul on Devin Jackson during the drive. [Team fouls: 4] No free throws, side out. (Devin Jackson: 1 personal fouls)

[02:33] Team_003 possession (Score: 89-92)
Collin Mitchell attempts a 3Pt. Contested by Vince James (5.1 feet, MAN). Collin Mitchell misses. Rebound secured by Vince James.

[02:20] Team_054 possession (Score: 89-92)
Devin Jackson attempts a Midrange. Contested by Bam Gilgeous-Alexander (3.1 feet, MAN). DEVIN JACKSON MAKES IT!
Score: 91-92

[02:04] Team_003 possession (Score: 91-92)
Miles Towns attempts a Midrange. Contested by Shaquille Irving (4.5 feet, MAN). Miles Towns misses. Offensive rebound by Bam Gilgeous-Alexander! Bam Gilgeous-Alexander's putback is no good. Rebound secured by Devin Jackson.

[01:50] Team_054 possession (Score: 91-92)
Tobias Nowitzki drives to the basket... Tobias Nowitzki throws a bad pass out of bounds! TURNOVER! (dead ball)

[01:33] Team_003 possession (Score: 91-92)
Anfernee Jordan drives and kicks out. FOUL! Shooting foul on Devin Jackson. Bam Gilgeous-Alexander to the line for 2 free throws. [BONUS: 5 team fouls] (Devin Jackson: 2 personal fouls)   FT 1/2: GOOD   FT 2/2: GOOD Bam Gilgeous-Alexander makes 2/2 from the line.
Score: 91-94

[01:14] Team_054 possession (Score: 91-94)
Devin Jackson attempts a 3Pt. Contested by Miles Towns (5.4 feet, ZONE). Devin Jackson misses. Rebound secured by Bam Gilgeous-Alexander.

[00:58] Team_003 possession (Score: 91-94)
Pau Williamson attempts a Midrange. Contested by Bradley Quickley (4.0 feet, MAN). Pau Williamson misses. Offensive rebound by Bam Gilgeous-Alexander! Bam Gilgeous-Alexander puts it back in!
Score: 91-96

[00:40] Team_054 possession (Score: 91-96)
FOUL! Reach-in foul on Bam Gilgeous-Alexander during the drive. [Team fouls: 3] No free throws, side out. (Bam Gilgeous-Alexander: 2 personal fouls)

[00:22] Team_054 possession (Score: 91-96)
Devin Jackson attempts a Layup. BLOCKED BY BAM GILGEOUS-ALEXANDER! Ball deflects out of bounds off Devin Jackson.

[00:06] Team_003 possession (Score: 91-96)
FOUL! Offensive foul on Anfernee Jordan! Tobias Nowitzki drew the charge! [Team fouls: 4] (Anfernee Jordan: 1 personal fouls) TURNOVER! (dead ball)

================================================================================
                              4TH QUARTER COMPLETE                              
================================================================================

4TH QUARTER SCORE: Team_054 18, Team_003 22

BOX SCORE:
================================================================================

Team_054
--------------------------------------------------------------------------------
Player                MIN  PTS  REB  AST  TO      FG   FG%      3P   3P%
--------------------------------------------------------------------------------
Blake Russell          33    6    5    1   0   3/4    75.0     0/0   0.0
Devin Jackson          16    5    1    0   0   2/4    50.0     0/0   0.0
Lauri Irving           33    3    0    1   0   1/1   100.0     0/0   0.0
Vince Ball             34    2    1    0   0   1/2    50.0     0/0   0.0
Luka Brogdon           34    2    3    0   0   1/2    50.0     0/0   0.0
Malcolm Harden         33    0    0    1   0   0/4     0.0     0/0   0.0
Tobias Nowitzki        15    0    0    0   0   0/1     0.0     0/0   0.0
Vince James            15    0    2    0   0   0/0     0.0     0/0   0.0
Bradley Quickley       16    0    0    0   0   0/1     0.0     0/0   0.0

TEAM: FG: 8/19 (42.1%), 3PT: 0/4 (0.0%), REB: 12 (4 off, 8 def), AST: 3, TO: 2
TEAM FOULS: 5 [Team_003 in BONUS]


Team_003
--------------------------------------------------------------------------------
Player                MIN  PTS  REB  AST  TO      FG   FG%      3P   3P%
--------------------------------------------------------------------------------
Rudy Haliburton        34    5    3    0   0   2/2   100.0     0/0   0.0
Giannis Turner         33    5    1    0   0   2/3    66.7     0/0   0.0
Bam Gilgeous-Alexander   16    4    2    0   0   2/2   100.0     0/0   0.0
Nikola Bryant          33    3    0    0   0   1/1   100.0     0/0   0.0
Pau Williamson         16    3    0    0   0   1/1   100.0     0/0   0.0
Victor O'Neal          33    2    6    0   0   1/5    20.0     0/0   0.0
Ayo Jackson            33    0    0    3   0   0/1     0.0     0/0   0.0
Anfernee Jordan        16    0    1    0   0   0/0     0.0     0/0   0.0
Miles Towns            16    0    0    1   0   0/2     0.0     0/0   0.0
Collin Mitchell        15    0    1    0   0   0/1     0.0     0/0   0.0

TEAM: FG: 9/18 (50.0%), 3PT: 2/7 (28.6%), REB: 14 (5 off, 9 def), AST: 4, TO: 3
TEAM FOULS: 4

================================================================================

================================================================================
                               FULL GAME COMPLETE                               
================================================================================

FINAL SCORE: Team_054 91, Team_003 96

SCORING BY QUARTER:
--------------------------------------------------------------------------------
Team                     Q1     Q2     Q3     Q4    FINAL
--------------------------------------------------------------------------------
Team_054                 24     29     20     18       91
Team_003                 25     21     28     22       96
--------------------------------------------------------------------------------

FULL GAME BOX SCORE:
================================================================================

Team_054
--------------------------------------------------------------------------------
Player                MIN  PTS  REB  AST  TO      FG   FG%      3P   3P%      FT STL BLK
--------------------------------------------------------------------------------
Vince Ball             34   15    3    2   0   7/16   43.8   0/4     0.0   3/5     0   1
Luka Brogdon           34   12   17    0   1   5/9    55.6   1/3    33.3   1/1     0   0
Malcolm Harden         33    4    0    4   2   3/9    33.3   0/4     0.0   1/2     0   0
Lauri Irving           33   13    2    4   2   4/7    57.1   2/3    66.7   1/1     0   0
Blake Russell          33   12   13    7   2   6/10   60.0   0/0     0.0   0/0     2   1
Shaquille Irving       16    4    0    1   0   3/4    75.0   1/2    50.0   0/0     0   0
Bradley Quickley       16    5    0    1   0   2/5    40.0   1/1   100.0   0/0     1   0
Devin Jackson          16   10    5    1   3   4/7    57.1   0/1     0.0   4/4     2   0
Vince James            15   10    6    1   0   3/6    50.0   1/1   100.0   4/5     0   0
Tobias Nowitzki        15    3    2    2   0   1/3    33.3   0/0     0.0   1/1     0   0

TEAM: FG: 38/76 (50.0%), 3PT: 6/19 (31.6%), REB: 50 (19 off, 31 def), AST: 23, TO: 10


Team_003
--------------------------------------------------------------------------------
Player                MIN  PTS  REB  AST  TO      FG   FG%      3P   3P%      FT STL BLK
--------------------------------------------------------------------------------
Rudy Haliburton        34   30   13    4   0   8/13   61.5   2/6    33.3   6/6     0   0
Ayo Jackson            33    9    0    8   1   5/7    71.4   2/2   100.0   1/2     0   0
Nikola Bryant          33    3    0    2   1   2/2   100.0   1/1   100.0   0/0     0   0
Giannis Turner         33   18    5    1   0   7/14   50.0   1/5    20.0   2/2     0   1
Victor O'Neal          33    8   17    0   3   6/15   40.0   0/2     0.0   2/2     0   0
Miles Towns            16    3    0    2   1   2/8    25.0   2/5    40.0   0/0     0   0
Pau Williamson         16    4    0    0   2   5/5   100.0   1/1   100.0   1/2     0   0
Anfernee Jordan        16    2    2    0   2   2/3    66.7   0/0     0.0   0/0     0   0
Bam Gilgeous-Alexander   16   13    8    0   0   2/2   100.0   0/0     0.0   3/3     0   2
Collin Mitchell        15    6    5    1   0   2/5    40.0   1/4    25.0   1/2     0   0

TEAM: FG: 42/75 (56.0%), 3PT: 10/26 (38.5%), REB: 48 (15 off, 33 def), AST: 18, TO: 10

================================================================================
