================================================================================
                        FULL GAME - Team_074 vs Team_092                        
================================================================================

================================================================================
                       1ST QUARTER - Team_074 vs Team_092                       
================================================================================

[12:00] Team_074 possession (Score: 0-0)
Dwyane Quickley attempts a 3Pt. Contested by Paul James (5.0 feet, ZONE). DWYANE QUICKLEY MAKES IT! Assist: Shai Green
Score: 3-0

[11:45] Team_092 possession (Score: 3-0)
FOUL! Shooting foul on Donovan Doncic. Immanuel Ingram to the line for 2 free throws. [Team fouls: 1] (Donovan Doncic: 1 personal fouls)   FT 1/2: GOOD   FT 2/2: GOOD Immanuel Ingram makes 2/2 from the line.
Score: 3-2

[11:30] Team_074 possession (Score: 3-2)
Dwyane Quickley attempts a Midrange. Contested by Paul James (5.0 feet, ZONE). DWYANE QUICKLEY MAKES IT! Assist: Chris Carter
Score: 5-2

[11:17] Team_092 possession (Score: 5-2)
John Giddey attempts a 3Pt. Contested by Dwyane Quickley (5.7 feet, ZONE). John Giddey misses. Rebound secured by Donovan Doncic.

[11:01] Team_074 possession (Score: 5-2)
Dwyane Quickley drives, Austin Bridges stays with him. Dwyane Quickley attempts a Dunk. Contested by Austin Bridges (4.7 feet, MAN). Dwyane Quickley misses. Offensive rebound by James Turner! James Turner puts it back in!
Score: 7-2

[10:46] Team_092 possession (Score: 7-2)
FOUL! Shooting foul on Donovan Doncic. Austin Bridges to the line for 2 free throws. [Team fouls: 2] (Donovan Doncic: 2 personal fouls)   FT 1/2: MISS   FT 2/2: GOOD Austin Bridges makes 1/2 from the line.
Score: 7-3

[10:30] Team_074 possession (Score: 7-3)
Shai Green attempts a 3Pt. Contested by Paul James (5.3 feet, MAN). Shai Green misses. Offensive rebound by Donovan Doncic! Donovan Doncic kicks it out.

[10:15] Team_074 possession (Score: 7-3)
Chris Carter makes the Midrange and draws the foul on Karl Gobert! And-1! Chris Carter to the line for 1. [Team fouls: 1] (Karl Gobert: 1 personal fouls)   FT 1/1: GOOD Chris Carter makes 1/1 from the line.
Score: 10-3

[10:02] Team_092 possession (Score: 10-3)
John Giddey attempts a 3Pt. Contested by Dwyane Quickley (5.7 feet, ZONE). John Giddey misses. Rebound secured by James Turner.

[09:49] Team_074 possession (Score: 10-3)
Chris Carter drives, picks up Karl Gobert. Help arrives from Paul James! Chris Carter attempts a Layup. Contested by Paul James (5.7 feet, MAN). Chris Carter misses. Rebound secured by John Giddey.

[09:36] Team_092 possession (Score: 10-3)
Austin Bridges attempts a Layup. Contested by Dwyane Quickley (5.2 feet, MAN). AUSTIN BRIDGES MAKES IT! Assist: Immanuel Ingram
Score: 10-5

[09:22] Team_074 possession (Score: 10-5)
James Turner drives to the basket... James Turner loses the ball! Stripped by John Giddey! TURNOVER! (live ball)

[09:11] Team_092 possession (Score: 10-5)
Immanuel Ingram drives, James Turner stays with him. Immanuel Ingram attempts a Dunk. Contested by James Turner (3.3 feet, MAN). IMMANUEL INGRAM MAKES IT!
Score: 10-7

[08:55] Team_074 possession (Score: 10-7)
FOUL! Shooting foul on John Giddey. James Turner to the line for 2 free throws. [Team fouls: 2] (John Giddey: 1 personal fouls)   FT 1/2: GOOD   FT 2/2: GOOD James Turner makes 2/2 from the line.
Score: 12-7

[08:38] Team_092 possession (Score: 12-7)
Karl Gobert drives and kicks out. Paul James attempts a 3Pt. Contested by Dwyane Quickley (5.4 feet, ZONE). Paul James misses. FOUL! Loose ball foul on Shai Green during the rebound battle. [Team fouls: 3] No free throws, side out. (Shai Green: 1 personal fouls)

[08:19] Team_092 possession (Score: 12-7)
FOUL! Shooting foul on James Turner. Immanuel Ingram to the line for 2 free throws. [Team fouls: 4] (James Turner: 1 personal fouls)   FT 1/2: MISS   FT 2/2: GOOD Immanuel Ingram makes 1/2 from the line.
Score: 12-8

[08:07] Team_074 possession (Score: 12-8)
Dwyane Quickley attempts a 3Pt. Contested by Austin Bridges (4.7 feet, MAN). Dwyane Quickley misses. Offensive rebound by Donovan Doncic! Donovan Doncic kicks it out.

[07:50] Team_074 possession (Score: 12-8)
James Turner attempts a 3Pt. Contested by John Giddey (4.7 feet, ZONE). James Turner misses. Rebound secured by Paul James.

[07:37] Team_092 possession (Score: 12-8)
John Giddey drives, Donovan Doncic stays with him. John Giddey attempts a Layup. Contested by Donovan Doncic (3.9 feet, MAN). JOHN GIDDEY MAKES IT! Assist: Paul James
Score: 12-10

[07:21] Team_074 possession (Score: 12-10)
Donovan Doncic throws a bad pass! Stolen by John Giddey! TURNOVER! (live ball)

[07:03] Team_092 possession (Score: 12-10)
Immanuel Ingram makes the Layup and draws the foul on Donovan Doncic! And-1! Immanuel Ingram to the line for 1. [BONUS: 5 team fouls] (Donovan Doncic: 3 personal fouls)   FT 1/1: GOOD Immanuel Ingram makes 1/1 from the line.
Score: 12-13

[06:48] Team_074 possession (Score: 12-13)
FOUL! Offensive foul on James Turner! Immanuel Ingram drew the charge! [Team fouls: 6] (James Turner: 2 personal fouls) TURNOVER! (dead ball)

[06:36] Team_092 possession (Score: 12-13)
Karl Gobert attempts a Layup. Contested by Chris Carter (4.1 feet, MAN). KARL GOBERT MAKES IT! Assist: Immanuel Ingram
Score: 12-15

[06:22] Team_074 possession (Score: 12-15)
Shai Green drives and kicks out. Shai Green attempts a Midrange. Contested by Paul James (4.7 feet, ZONE). Shai Green misses. Rebound secured by Paul James.

[06:08] Team_092 possession (Score: 12-15)
Paul James attempts a 3Pt. Wide open! Dwyane Quickley is 6.1 feet away. [ZONE] Paul James misses. Rebound secured by Donovan Doncic.

[05:51] Team_074 possession (Score: 12-15)
Chris Carter attempts a 3Pt. Contested by John Giddey (4.7 feet, ZONE). CHRIS CARTER MAKES IT! Assist: Donovan Doncic
Score: 15-15

[05:39] Team_092 possession (Score: 15-15)
Paul James attempts a 3Pt. Contested by Shai Green (4.1 feet, MAN). Paul James misses. Offensive rebound by Paul James! Paul James kicks it out.

[05:23] Team_092 possession (Score: 15-15)
Immanuel Ingram drives, picks up James Turner. Help arrives from Chris Carter! Immanuel Ingram attempts a Dunk. Contested by Chris Carter (3.3 feet, MAN). IMMANUEL INGRAM MAKES IT! Assist: Austin Bridges
Score: 15-17

[05:13] Team_074 possession (Score: 15-17)
FOUL! Holding foul on Karl Gobert. [Team fouls: 3] No free throws, side out. (Karl Gobert: 2 personal fouls)

[04:57] Team_074 possession (Score: 15-17)
Shai Green attempts a Midrange. Contested by Immanuel Ingram (4.6 feet, ZONE). SHAI GREEN MAKES IT!
Score: 17-17

[04:43] Team_092 possession (Score: 17-17)
Paul James attempts a Layup. Contested by Shai Green (4.2 feet, MAN). Paul James misses. Rebound secured by Donovan Doncic.

[04:34] Team_074 possession (Score: 17-17)
Chris Carter attempts a 3Pt. Contested by Karl Gobert (5.7 feet, MAN). CHRIS CARTER MAKES IT! Assist: Donovan Doncic
Score: 20-17

[04:19] Team_092 possession (Score: 20-17)
Paul James attempts a Midrange. Contested by Shai Green (4.2 feet, MAN). Paul James misses. Rebound secured by James Turner.

[04:06] Team_074 possession (Score: 20-17)
Donovan Doncic attempts a Midrange. Contested by Karl Gobert (5.5 feet, ZONE). DONOVAN DONCIC MAKES IT! Assist: James Turner
Score: 22-17

[03:49] Team_092 possession (Score: 22-17)
John Giddey attempts a Midrange. Contested by Donovan Doncic (4.0 feet, MAN). JOHN GIDDEY MAKES IT!
Score: 22-19

[03:32] Team_074 possession (Score: 22-19)
Chris Carter drives, picks up John Giddey. Help arrives from Austin Bridges! Chris Carter attempts a Dunk. Contested by Austin Bridges (4.8 feet, ZONE). CHRIS CARTER MAKES IT! Assist: Shai Green
Score: 24-19

[03:14] Team_092 possession (Score: 24-19)
Paul James drives to the basket... Paul James throws a bad pass! Stolen by Donovan Doncic! TURNOVER! (live ball)

[03:00] Team_074 possession (Score: 24-19)
Donovan Doncic attempts a Midrange. Contested by Paul James (5.2 feet, ZONE). Donovan Doncic misses. Rebound secured by Paul James.

[02:44] Team_092 possession (Score: 24-19)
John Giddey drives, picks up Donovan Doncic. Help arrives from Chris Carter! John Giddey attempts a Layup. Contested by Chris Carter (4.1 feet, MAN). JOHN GIDDEY MAKES IT! Assist: Karl Gobert
Score: 24-21

[02:32] Team_074 possession (Score: 24-21)
FOUL! Shooting foul on Austin Bridges. James Turner to the line for 2 free throws. [Team fouls: 4] (Austin Bridges: 1 personal fouls)   FT 1/2: GOOD   FT 2/2: GOOD James Turner makes 2/2 from the line.
Score: 26-21

[02:23] Team_092 possession (Score: 26-21)
Paul James attempts a 3Pt. Wide open! Dwyane Quickley is 6.3 feet away. [ZONE] PAUL JAMES MAKES IT! Assist: John Giddey
Score: 26-24

[02:07] Team_074 possession (Score: 26-24)
Shai Green attempts a Midrange. Contested by Paul James (5.5 feet, MAN). Shai Green misses. Offensive rebound by Donovan Doncic! Donovan Doncic kicks it out.

[01:55] Team_074 possession (Score: 26-24)
FOUL! Holding foul on Immanuel Ingram. [IN THE BONUS! 5 team fouls] James Turner to the line for 2 free throws. (Immanuel Ingram: 1 personal fouls)   FT 1/2: GOOD   FT 2/2: GOOD James Turner makes 2/2 from the line.
Score: 28-24

[01:42] Team_092 possession (Score: 28-24)
Paul James attempts a 3Pt. Contested by Shai Green (4.5 feet, MAN). PAUL JAMES MAKES IT! Assist: Immanuel Ingram
Score: 28-27

[01:30] Team_074 possession (Score: 28-27)
Chris Carter attempts a 3Pt. Contested by Karl Gobert (6.0 feet, MAN). Chris Carter misses. Rebound secured by John Giddey.

[01:14] Team_092 possession (Score: 28-27)
Immanuel Ingram attempts a Layup. Contested by Donovan Doncic (3.9 feet, ZONE). Immanuel Ingram misses. Rebound secured by Shai Green.

[01:04] Team_074 possession (Score: 28-27)
Donovan Doncic attempts a Layup. Contested by John Giddey (4.8 feet, ZONE). Donovan Doncic misses. Offensive rebound by James Turner! James Turner kicks it out.

[00:52] Team_074 possession (Score: 28-27)
Dwyane Quickley attempts a 3Pt. Contested by Austin Bridges (5.2 feet, MAN). Dwyane Quickley misses. Offensive rebound by Donovan Doncic! Donovan Doncic kicks it out.

[00:41] Team_074 possession (Score: 28-27)
James Turner drives, picks up Immanuel Ingram. Help arrives from Austin Bridges! James Turner attempts a Dunk. Contested by Austin Bridges (5.0 feet, MAN). JAMES TURNER MAKES IT! Assist: Donovan Doncic
Score: 30-27

[00:27] Team_092 possession (Score: 30-27)
Immanuel Ingram attempts a Midrange. Contested by Donovan Doncic (4.0 feet, ZONE). IMMANUEL INGRAM MAKES IT!
Score: 30-29

[00:13] Team_074 possession (Score: 30-29)
Chris Carter drives to the basket... FOUL! Offensive foul on Chris Carter! John Giddey drew the charge! [Team fouls: 7] (Chris Carter: 1 personal fouls) TURNOVER! (dead ball)

[00:02] Team_092 possession (Score: 30-29)
Immanuel Ingram loses control! Ball rolls out of bounds! TURNOVER! (dead ball)

[00:02] Substitution (Team_074): Dwyane Quickley OUT → James Barnes IN (stamina_rule2)

[00:02] Substitution (Team_074): Chris Carter OUT → Giannis Westbrook IN (stamina_rule2)

[00:02] Substitution (Team_074): Shai Green OUT → Ayo Smith IN (stamina_rule2)

[00:02] Substitution (Team_074): Donovan Doncic OUT → Yao Randle IN (stamina_rule2)

[00:02] Substitution (Team_074): James Turner OUT → Jaren Rozier IN (stamina_rule2)

[00:02] Substitution (Team_092): Austin Bridges OUT → Bones Giddey IN (stamina_rule2)

[00:02] Substitution (Team_092): Karl Gobert OUT → Shaquille Russell IN (stamina_rule2)

[00:02] Substitution (Team_092): Paul James OUT → Vince Harris IN (stamina_rule2)

[00:02] Substitution (Team_092): John Giddey OUT → Shaquille Paul IN (stamina_rule2)

[00:02] Substitution (Team_092): Immanuel Ingram OUT → Pau Reaves IN (stamina_rule2)

================================================================================
                              1ST QUARTER COMPLETE                              
================================================================================

1ST QUARTER SCORE: Team_074 30, Team_092 29

BOX SCORE:
================================================================================

Team_074
--------------------------------------------------------------------------------
Player                MIN  PTS  REB  AST  TO      FG   FG%      3P   3P%
--------------------------------------------------------------------------------
Chris Carter           12   11    0    1   0   4/6    66.7     0/0   0.0
James Turner           12   10    4    1   0   5/6    83.3     0/0   0.0
Dwyane Quickley        12    5    0    0   0   2/2   100.0     0/0   0.0
Shai Green             12    2    1    2   0   1/2    50.0     0/0   0.0
Donovan Doncic         12    2    7    3   0   1/2    50.0     0/0   0.0

TEAM: FG: 13/18 (72.2%), 3PT: 3/5 (60.0%), REB: 12 (6 off, 6 def), AST: 7, TO: 4
TEAM FOULS: 7 [Team_092 in BONUS]


Team_092
--------------------------------------------------------------------------------
Player                MIN  PTS  REB  AST  TO      FG   FG%      3P   3P%
--------------------------------------------------------------------------------
Immanuel Ingram        12   12    0    3   0   6/7    85.7     0/0   0.0
John Giddey            12    6    3    1   0   3/5    60.0     0/0   0.0
Paul James             12    6    4    1   0   2/5    40.0     0/0   0.0
Austin Bridges         12    3    0    1   0   2/2   100.0     0/0   0.0
Karl Gobert            12    2    0    1   0   1/1   100.0     0/0   0.0

TEAM: FG: 14/20 (70.0%), 3PT: 2/5 (40.0%), REB: 7 (2 off, 5 def), AST: 7, TO: 2
TEAM FOULS: 5 [Team_074 in BONUS]

================================================================================

================================================================================
                       2ND QUARTER - Team_074 vs Team_092                       
================================================================================

[12:00] Substitution (Team_074): Dwyane Quickley OUT → James Barnes IN (stamina_rule2)

[12:00] Substitution (Team_074): Chris Carter OUT → Giannis Westbrook IN (stamina_rule2)

[12:00] Substitution (Team_074): Shai Green OUT → Ayo Smith IN (stamina_rule2)

[12:00] Substitution (Team_074): Donovan Doncic OUT → Yao Randle IN (stamina_rule2)

[12:00] Substitution (Team_074): James Turner OUT → Jaren Rozier IN (stamina_rule2)

[12:00] Substitution (Team_092): Austin Bridges OUT → Bones Giddey IN (stamina_rule2)

[12:00] Substitution (Team_092): Karl Gobert OUT → Shaquille Russell IN (stamina_rule2)

[12:00] Substitution (Team_092): Paul James OUT → Vince Harris IN (stamina_rule2)

[12:00] Substitution (Team_092): John Giddey OUT → Shaquille Paul IN (stamina_rule2)

[12:00] Substitution (Team_092): Immanuel Ingram OUT → Pau Reaves IN (stamina_rule2)

[12:00] Team_074 possession (Score: 30-29)
Chris Carter throws a bad pass out of bounds! TURNOVER! (dead ball)

[11:46] Team_092 possession (Score: 30-29)
Shaquille Russell drives to the basket... Shaquille Russell loses the ball! Stripped by Yao Randle! TURNOVER! (live ball)

[11:35] Team_074 possession (Score: 30-29)
James Barnes attempts a 3Pt. Contested by Vince Harris (4.0 feet, ZONE). JAMES BARNES MAKES IT! Assist: Giannis Westbrook
Score: 33-29

[11:22] Team_092 possession (Score: 33-29)
Shaquille Paul attempts a 3Pt. Contested by James Barnes (4.8 feet, ZONE). Shaquille Paul misses. Rebound secured by Yao Randle.

[11:09] Team_074 possession (Score: 33-29)
Giannis Westbrook commits a violation (traveling/carry)! TURNOVER! (dead ball)

[10:57] Team_092 possession (Score: 33-29)
Pau Reaves attempts a Midrange. Contested by Jaren Rozier (4.7 feet, MAN). Pau Reaves misses. Offensive rebound by Shaquille Paul! Shaquille Paul kicks it out.

[10:41] Team_092 possession (Score: 33-29)
Vince Harris attempts a 3Pt. Contested by James Barnes (4.3 feet, ZONE). VINCE HARRIS MAKES IT! Assist: Bones Giddey
Score: 33-32

[10:26] Team_074 possession (Score: 33-32)
Yao Randle attempts a Layup. Contested by Shaquille Paul (5.7 feet, MAN). Yao Randle misses. Offensive rebound by Jaren Rozier! Jaren Rozier kicks it out.

[10:12] Team_074 possession (Score: 33-32)
FOUL! Shooting foul on Bones Giddey. James Barnes to the line for 2 free throws. [Team fouls: 1] (Bones Giddey: 1 personal fouls)   FT 1/2: GOOD   FT 2/2: GOOD James Barnes makes 2/2 from the line.
Score: 35-32

[09:59] Team_092 possession (Score: 35-32)
Vince Harris attempts a 3Pt. Contested by Ayo Smith (4.8 feet, MAN). Vince Harris misses. Rebound secured by Yao Randle.

[09:44] Team_074 possession (Score: 35-32)
Jaren Rozier attempts a Layup. Contested by Pau Reaves (4.6 feet, ZONE). Jaren Rozier misses. Rebound secured by Shaquille Paul.

[09:28] Team_092 possession (Score: 35-32)
Shaquille Russell attempts a Midrange. Contested by Jaren Rozier (4.8 feet, ZONE). SHAQUILLE RUSSELL MAKES IT! Assist: Shaquille Paul
Score: 35-34

[09:10] Team_074 possession (Score: 35-34)
James Barnes makes the Layup and draws the foul on Pau Reaves! And-1! James Barnes to the line for 1. [Team fouls: 2] (Pau Reaves: 1 personal fouls)   FT 1/1: MISS James Barnes makes 0/1 from the line. Rebound secured by Pau Reaves.
Score: 37-34

[08:55] Team_092 possession (Score: 37-34)
FOUL! Shooting foul on James Barnes. Bones Giddey to the line for 2 free throws. [Team fouls: 1] (James Barnes: 1 personal fouls)   FT 1/2: MISS   FT 2/2: MISS Bones Giddey makes 0/2 from the line. Rebound secured by Jaren Rozier.

[08:41] Team_074 possession (Score: 37-34)
James Barnes attempts a Midrange. Contested by Shaquille Russell (4.1 feet, ZONE). JAMES BARNES MAKES IT!
Score: 39-34

[08:26] Team_092 possession (Score: 39-34)
Vince Harris attempts a 3Pt. Contested by Ayo Smith (4.8 feet, MAN). Vince Harris misses. Rebound secured by Yao Randle.

[08:14] Team_074 possession (Score: 39-34)
Giannis Westbrook attempts a 3Pt. Contested by Vince Harris (4.2 feet, ZONE). GIANNIS WESTBROOK MAKES IT! Assist: Ayo Smith
Score: 42-34

[07:59] Team_092 possession (Score: 42-34)
Vince Harris attempts a 3Pt. Contested by James Barnes (4.3 feet, ZONE). VINCE HARRIS MAKES IT! Assist: Pau Reaves
Score: 42-37

[07:47] Team_074 possession (Score: 42-37)
James Barnes attempts a 3Pt. Contested by Vince Harris (4.0 feet, ZONE). James Barnes misses. FOUL! Loose ball foul on Shaquille Russell during the rebound battle. [Team fouls: 3] No free throws, side out. (Shaquille Russell: 1 personal fouls)

[07:34] Team_074 possession (Score: 42-37)
Jaren Rozier drives to the basket... Jaren Rozier throws a bad pass out of bounds! TURNOVER! (dead ball)

[07:18] Team_092 possession (Score: 42-37)
Pau Reaves makes the Layup and draws the foul on Jaren Rozier! And-1! Pau Reaves to the line for 1. [Team fouls: 2] (Jaren Rozier: 1 personal fouls)   FT 1/1: GOOD Pau Reaves makes 1/1 from the line.
Score: 42-40

[07:07] Team_074 possession (Score: 42-40)
Jaren Rozier makes the Layup and draws the foul on Pau Reaves! And-1! Jaren Rozier to the line for 1. [Team fouls: 4] (Pau Reaves: 2 personal fouls)   FT 1/1: GOOD Jaren Rozier makes 1/1 from the line.
Score: 45-40

[06:57] Team_092 possession (Score: 45-40)
Shaquille Paul drives, Yao Randle stays with him. Shaquille Paul attempts a Layup. Contested by Yao Randle (5.1 feet, ZONE). Shaquille Paul misses. Rebound secured by Jaren Rozier.

[06:43] Team_074 possession (Score: 45-40)
Ayo Smith drives and kicks out. Ayo Smith attempts a Midrange. Contested by Shaquille Russell (4.2 feet, ZONE). AYO SMITH MAKES IT!
Score: 47-40

[06:28] Team_092 possession (Score: 47-40)
Bones Giddey attempts a Layup. Contested by Yao Randle (4.1 feet, ZONE). Bones Giddey misses. Rebound secured by Yao Randle.

[06:11] Team_074 possession (Score: 47-40)
Yao Randle attempts a 3Pt. Contested by Shaquille Paul (5.7 feet, MAN). Yao Randle misses. Rebound secured by Pau Reaves.

[05:56] Team_092 possession (Score: 47-40)
Shaquille Russell drives, picks up Yao Randle. Help arrives from Giannis Westbrook! Shaquille Russell attempts a Layup. Contested by Giannis Westbrook (4.9 feet, ZONE). SHAQUILLE RUSSELL MAKES IT! Assist: Vince Harris
Score: 47-42

[05:42] Team_074 possession (Score: 47-42)
FOUL! Shooting foul on Pau Reaves. Jaren Rozier to the line for 2 free throws. [BONUS: 5 team fouls] (Pau Reaves: 3 personal fouls)   FT 1/2: GOOD   FT 2/2: GOOD Jaren Rozier makes 2/2 from the line.
Score: 49-42

[05:30] Team_092 possession (Score: 49-42)
FOUL! Shooting foul on Jaren Rozier. Pau Reaves to the line for 2 free throws. [Team fouls: 3] (Jaren Rozier: 2 personal fouls)   FT 1/2: GOOD   FT 2/2: GOOD Pau Reaves makes 2/2 from the line.
Score: 49-44

[05:15] Team_074 possession (Score: 49-44)
Giannis Westbrook drives and kicks out. James Barnes attempts a 3Pt. Contested by Shaquille Paul (5.6 feet, ZONE). JAMES BARNES MAKES IT! Assist: Jaren Rozier
Score: 52-44

[05:02] Team_092 possession (Score: 52-44)
Shaquille Paul attempts a Midrange. Contested by Giannis Westbrook (5.1 feet, ZONE). Shaquille Paul misses. Offensive rebound by Shaquille Paul! Shaquille Paul kicks it out.

[04:47] Team_092 possession (Score: 52-44)
Bones Giddey throws a bad pass! Stolen by James Barnes! TURNOVER! (live ball)

[04:32] Team_074 possession (Score: 52-44)
FOUL! Reach-in foul on Pau Reaves during the drive. [IN THE BONUS! 6 team fouls] Jaren Rozier to the line for 2 free throws. (Pau Reaves: 4 personal fouls)   FT 1/2: GOOD   FT 2/2: GOOD Jaren Rozier makes 2/2 from the line.
Score: 54-44

[04:19] Team_092 possession (Score: 54-44)
Bones Giddey attempts a 3Pt. Contested by James Barnes (4.0 feet, MAN). Bones Giddey misses. FOUL! Loose ball foul on Jaren Rozier during the rebound battle. [Team fouls: 4] No free throws, side out. (Jaren Rozier: 3 personal fouls)

[04:04] Team_092 possession (Score: 54-44)
Shaquille Paul attempts a 3Pt. Contested by Yao Randle (5.2 feet, MAN). Shaquille Paul misses. Rebound secured by Ayo Smith.

[03:48] Team_074 possession (Score: 54-44)
Jaren Rozier attempts a Layup. Contested by Pau Reaves (4.8 feet, ZONE). JAREN ROZIER MAKES IT! Assist: Giannis Westbrook
Score: 56-44

[03:30] Team_092 possession (Score: 56-44)
Shaquille Russell drives, Yao Randle stays with him. Shaquille Russell attempts a Dunk. Contested by Yao Randle (5.0 feet, ZONE). Shaquille Russell misses. Rebound secured by Yao Randle.

[03:21] Team_074 possession (Score: 56-44)
Ayo Smith attempts a Midrange. Contested by Vince Harris (4.4 feet, MAN). AYO SMITH MAKES IT! Assist: Yao Randle
Score: 58-44

[03:08] Team_092 possession (Score: 58-44)
FOUL! Holding foul on Giannis Westbrook. [IN THE BONUS! 5 team fouls] Shaquille Russell to the line for 2 free throws. (Giannis Westbrook: 1 personal fouls)   FT 1/2: GOOD   FT 2/2: GOOD Shaquille Russell makes 2/2 from the line.
Score: 58-46

[02:51] Team_074 possession (Score: 58-46)
Jaren Rozier attempts a Layup. Contested by Shaquille Paul (5.6 feet, ZONE). Jaren Rozier misses. Rebound secured by Pau Reaves.

[02:37] Team_092 possession (Score: 58-46)
Bones Giddey attempts a 3Pt. Contested by Ayo Smith (4.6 feet, ZONE). Bones Giddey misses. Rebound secured by Ayo Smith.

[02:22] Team_074 possession (Score: 58-46)
Giannis Westbrook drives and kicks out. James Barnes attempts a 3Pt. Contested by Bones Giddey (5.5 feet, MAN). James Barnes misses. Rebound secured by Pau Reaves.

[02:06] Team_092 possession (Score: 58-46)
Shaquille Paul makes the Layup and draws the foul on Giannis Westbrook! And-1! Shaquille Paul to the line for 1. [BONUS: 6 team fouls] (Giannis Westbrook: 2 personal fouls)   FT 1/1: GOOD Shaquille Paul makes 1/1 from the line.
Score: 58-49

[01:55] Team_074 possession (Score: 58-49)
FOUL! Shooting foul on Shaquille Russell. Giannis Westbrook to the line for 2 free throws. [BONUS: 7 team fouls] (Shaquille Russell: 2 personal fouls)   FT 1/2: MISS   FT 2/2: GOOD Giannis Westbrook makes 1/2 from the line.
Score: 59-49

[01:40] Team_092 possession (Score: 59-49)
Shaquille Paul attempts a Midrange. Contested by Yao Randle (5.4 feet, MAN). Shaquille Paul misses. Offensive rebound by Pau Reaves! Pau Reaves kicks it out.

[01:25] Team_092 possession (Score: 59-49)
Shaquille Russell drives, picks up Yao Randle. Help arrives from Giannis Westbrook! Shaquille Russell attempts a Dunk. Contested by Giannis Westbrook (5.2 feet, ZONE). SHAQUILLE RUSSELL MAKES IT!
Score: 59-51

[01:10] Team_074 possession (Score: 59-51)
Giannis Westbrook attempts a 3Pt. Contested by Shaquille Russell (4.7 feet, ZONE). Giannis Westbrook misses. Rebound secured by Shaquille Paul.

[00:58] Team_092 possession (Score: 59-51)
FOUL! Reach-in foul on Yao Randle during the drive. [IN THE BONUS! 7 team fouls] Pau Reaves to the line for 2 free throws. (Yao Randle: 1 personal fouls)   FT 1/2: GOOD   FT 2/2: GOOD Pau Reaves makes 2/2 from the line.
Score: 59-53

[00:42] Team_074 possession (Score: 59-53)
Giannis Westbrook drives and kicks out. James Barnes attempts a Midrange. Contested by Shaquille Russell (4.8 feet, ZONE). James Barnes misses. Offensive rebound by Yao Randle! Yao Randle kicks it out.

[00:31] Team_074 possession (Score: 59-53)
Jaren Rozier attempts a Layup. Contested by Pau Reaves (5.1 feet, MAN). Jaren Rozier misses. FOUL! Loose ball foul on Pau Reaves during the rebound battle. [IN THE BONUS! 8 team fouls] Jaren Rozier to the line for 2 free throws. (Pau Reaves: 5 personal fouls)   FT 1/2: MISS   FT 2/2: GOOD Jaren Rozier makes 1/2 from the line.
Score: 60-53

[00:16] Team_092 possession (Score: 60-53)
Bones Giddey attempts a Midrange. Contested by James Barnes (4.5 feet, MAN). Bones Giddey misses. Rebound secured by Jaren Rozier.

[00:04] Team_074 possession (Score: 60-53)
Ayo Smith attempts a 3Pt. Contested by Vince Harris (4.8 feet, MAN). Ayo Smith misses. FOUL! Loose ball foul on Shaquille Paul during the rebound battle. [IN THE BONUS! 9 team fouls] Jaren Rozier to the line for 2 free throws. (Shaquille Paul: 1 personal fouls)   FT 1/2: GOOD   FT 2/2: MISS Jaren Rozier makes 1/2 from the line. Rebound secured by Vince Harris.
Score: 61-53

================================================================================
                              2ND QUARTER COMPLETE                              
================================================================================

2ND QUARTER SCORE: Team_074 31, Team_092 24

BOX SCORE:
================================================================================

Team_074
--------------------------------------------------------------------------------
Player                MIN  PTS  REB  AST  TO      FG   FG%      3P   3P%
--------------------------------------------------------------------------------
James Barnes           12   10    0    0   0   4/5    80.0     0/0   0.0
Jaren Rozier           12   10    4    1   0   5/7    71.4     0/0   0.0
Vince Harris           12    6    1    1   0   2/4    50.0     0/0   0.0
Giannis Westbrook      12    4    0    2   0   2/4    50.0     0/0   0.0
Ayo Smith              12    4    2    1   0   2/3    66.7     0/0   0.0
Yao Randle             12    0    7    1   0   0/1     0.0     0/0   0.0

TEAM: FG: 13/20 (65.0%), 3PT: 2/5 (40.0%), REB: 14 (4 off, 10 def), AST: 5, TO: 3
TEAM FOULS: 7 [Team_092 in BONUS]


Team_092
--------------------------------------------------------------------------------
Player                MIN  PTS  REB  AST  TO      FG   FG%      3P   3P%
--------------------------------------------------------------------------------
Shaquille Russell      12    8    0    0   0   4/5    80.0     0/0   0.0
Pau Reaves             12    7    5    1   0   3/3   100.0     0/0   0.0
Shaquille Paul         12    3    5    1   0   1/4    25.0     0/0   0.0
Bones Giddey           12    0    0    1   0   0/4     0.0     0/0   0.0

TEAM: FG: 10/20 (50.0%), 3PT: 2/7 (28.6%), REB: 10 (4 off, 6 def), AST: 4, TO: 2
TEAM FOULS: 9 [Team_074 in BONUS]

================================================================================

================================================================================
                       3RD QUARTER - Team_074 vs Team_092                       
================================================================================

[12:00] Team_074 possession (Score: 61-53)
Chris Carter attempts a Midrange. Contested by Karl Gobert (5.7 feet, MAN). Chris Carter misses. Rebound secured by John Giddey.

[11:47] Team_092 possession (Score: 61-53)
John Giddey drives, Donovan Doncic stays with him. John Giddey attempts a Dunk. Contested by Donovan Doncic (3.9 feet, MAN). John Giddey misses. Rebound secured by Shai Green.

[11:34] Team_074 possession (Score: 61-53)
Shai Green attempts a Midrange. Contested by Paul James (5.3 feet, MAN). Shai Green misses. Rebound secured by Immanuel Ingram.

[11:20] Team_092 possession (Score: 61-53)
Paul James attempts a Midrange. Contested by Shai Green (4.1 feet, MAN). PAUL JAMES MAKES IT!
Score: 61-55

[11:09] Team_074 possession (Score: 61-55)
Shai Green makes the Layup and draws the foul on Paul James! And-1! Shai Green to the line for 1. [Team fouls: 1] (Paul James: 1 personal fouls)   FT 1/1: GOOD Shai Green makes 1/1 from the line.
Score: 64-55

[10:57] Team_092 possession (Score: 64-55)
Karl Gobert drives to the basket... Karl Gobert loses control! Ball rolls out of bounds! TURNOVER! (dead ball)

[10:39] Team_074 possession (Score: 64-55)
Chris Carter attempts a 3Pt. Contested by John Giddey (4.7 feet, ZONE). Chris Carter misses. Rebound secured by Immanuel Ingram.

[10:22] Team_092 possession (Score: 64-55)
Austin Bridges makes the Layup and draws the foul on Donovan Doncic! And-1! Austin Bridges to the line for 1. [Team fouls: 1] (Donovan Doncic: 1 personal fouls)   FT 1/1: GOOD Austin Bridges makes 1/1 from the line.
Score: 64-58

[10:09] Team_074 possession (Score: 64-58)
FOUL! Reach-in foul on John Giddey during the drive. [Team fouls: 2] No free throws, side out. (John Giddey: 1 personal fouls)

[09:52] Team_074 possession (Score: 64-58)
Shai Green attempts a Layup. Contested by John Giddey (4.6 feet, ZONE). SHAI GREEN MAKES IT!
Score: 66-58

[09:37] Team_092 possession (Score: 66-58)
Austin Bridges drives, Donovan Doncic stays with him. Austin Bridges attempts a Dunk. Contested by Donovan Doncic (3.5 feet, ZONE). AUSTIN BRIDGES MAKES IT!
Score: 66-60

[09:23] Team_074 possession (Score: 66-60)
Chris Carter throws a bad pass! Stolen by Karl Gobert! TURNOVER! (live ball)

[09:08] Team_092 possession (Score: 66-60)
Karl Gobert attempts a 3Pt. Contested by Chris Carter (4.1 feet, MAN). Karl Gobert misses. Offensive rebound by Paul James! Paul James kicks it out.

[08:53] Team_092 possession (Score: 66-60)
Immanuel Ingram drives, James Turner stays with him. Immanuel Ingram attempts a Dunk. Contested by James Turner (3.3 feet, MAN). Immanuel Ingram misses. FOUL! Loose ball foul on Donovan Doncic during the rebound battle. [Team fouls: 2] No free throws, side out. (Donovan Doncic: 2 personal fouls)

[08:36] Team_092 possession (Score: 66-60)
Austin Bridges attempts a Midrange. Contested by Dwyane Quickley (5.2 feet, MAN). AUSTIN BRIDGES MAKES IT! Assist: Immanuel Ingram
Score: 66-62

[08:21] Team_074 possession (Score: 66-62)
Chris Carter attempts a 3Pt. Contested by John Giddey (4.7 feet, ZONE). Chris Carter misses. Offensive rebound by James Turner! James Turner's putback is no good. Rebound secured by Paul James.

[08:03] Team_092 possession (Score: 66-62)
Austin Bridges attempts a 3Pt. Contested by Dwyane Quickley (5.2 feet, MAN). AUSTIN BRIDGES MAKES IT! Assist: Immanuel Ingram
Score: 66-65

[07:46] Team_074 possession (Score: 66-65)
James Turner drives, Immanuel Ingram stays with him. James Turner attempts a Dunk. Contested by Immanuel Ingram (4.7 feet, MAN). JAMES TURNER MAKES IT!
Score: 68-65

[07:34] Team_092 possession (Score: 68-65)
Karl Gobert drives and kicks out. Paul James attempts a 3Pt. Contested by Dwyane Quickley (5.4 feet, ZONE). Paul James misses. Rebound secured by Donovan Doncic.

[07:20] Team_074 possession (Score: 68-65)
Shai Green makes the Midrange and draws the foul on Paul James! And-1! Shai Green to the line for 1. [Team fouls: 3] (Paul James: 2 personal fouls)   FT 1/1: MISS Shai Green makes 0/1 from the line. Offensive rebound by Donovan Doncic! Donovan Doncic kicks it out.
Score: 70-65

[07:03] Team_074 possession (Score: 70-65)
Chris Carter drives, picks up Karl Gobert. Help arrives from Paul James! Chris Carter attempts a Dunk. Contested by Paul James (5.7 feet, MAN). Chris Carter misses. Rebound secured by Immanuel Ingram.

[06:49] Team_092 possession (Score: 70-65)
John Giddey makes the Dunk and draws the foul on Donovan Doncic! And-1! John Giddey to the line for 1. [Team fouls: 3] (Donovan Doncic: 3 personal fouls)   FT 1/1: GOOD John Giddey makes 1/1 from the line.
Score: 70-68

[06:31] Team_074 possession (Score: 70-68)
Dwyane Quickley attempts a Midrange. Contested by Austin Bridges (4.7 feet, MAN). Dwyane Quickley misses. Rebound secured by John Giddey.

[06:17] Team_092 possession (Score: 70-68)
Karl Gobert attempts a 3Pt. Contested by Dwyane Quickley (5.3 feet, ZONE). Karl Gobert misses. Offensive rebound by Paul James! Paul James kicks it out.

[06:02] Team_092 possession (Score: 70-68)
John Giddey drives to the basket... John Giddey loses control! Ball rolls out of bounds! TURNOVER! (dead ball)

[05:47] Team_074 possession (Score: 70-68)
James Turner makes the Layup and draws the foul on Immanuel Ingram! And-1! James Turner to the line for 1. [Team fouls: 4] (Immanuel Ingram: 1 personal fouls)   FT 1/1: GOOD James Turner makes 1/1 from the line.
Score: 73-68

[05:33] Team_092 possession (Score: 73-68)
Paul James drives, picks up Shai Green. Help arrives from Chris Carter! Paul James attempts a Dunk. Contested by Chris Carter (4.1 feet, MAN). PAUL JAMES MAKES IT! Assist: John Giddey
Score: 73-70

[05:22] Team_074 possession (Score: 73-70)
Donovan Doncic attempts a Layup. Contested by John Giddey (4.4 feet, MAN). DONOVAN DONCIC MAKES IT!
Score: 75-70

[05:05] Team_092 possession (Score: 75-70)
FOUL! Shooting foul on Dwyane Quickley. Karl Gobert to the line for 3 free throws. [Team fouls: 4] (Dwyane Quickley: 1 personal fouls)   FT 1/3: MISS   FT 2/3: MISS   FT 3/3: GOOD Karl Gobert makes 1/3 from the line.
Score: 75-71

[04:51] Team_074 possession (Score: 75-71)
Shai Green attempts a 3Pt. Contested by John Giddey (4.6 feet, ZONE). Shai Green misses. Rebound secured by Immanuel Ingram.

[04:39] Team_092 possession (Score: 75-71)
Karl Gobert attempts a Midrange. Contested by Chris Carter (4.2 feet, MAN). KARL GOBERT MAKES IT! Assist: Immanuel Ingram
Score: 75-73

[04:23] Team_074 possession (Score: 75-73)
Dwyane Quickley attempts a 3Pt. Contested by Austin Bridges (4.8 feet, MAN). Dwyane Quickley misses. Rebound secured by Immanuel Ingram.

[04:11] Team_092 possession (Score: 75-73)
John Giddey drives, picks up Donovan Doncic. Help arrives from Chris Carter! John Giddey attempts a Layup. Contested by Chris Carter (4.0 feet, MAN). JOHN GIDDEY MAKES IT! Assist: Paul James
Score: 75-75

[03:55] Team_074 possession (Score: 75-75)
Chris Carter attempts a 3Pt. Contested by John Giddey (4.8 feet, ZONE). Chris Carter misses. Offensive rebound by James Turner! James Turner's putback is no good. Rebound secured by Paul James.

[03:37] Team_092 possession (Score: 75-75)
John Giddey attempts a Layup. BLOCKED BY DONOVAN DONCIC! Ball goes out off Donovan Doncic. John Giddey's ball!

[03:25] Team_092 possession (Score: 75-75)
FOUL! Shooting foul on Dwyane Quickley. Austin Bridges to the line for 2 free throws. [BONUS: 5 team fouls] (Dwyane Quickley: 2 personal fouls)   FT 1/2: MISS   FT 2/2: GOOD Austin Bridges makes 1/2 from the line.
Score: 75-76

[03:10] Team_074 possession (Score: 75-76)
FOUL! Holding foul on Austin Bridges. [IN THE BONUS! 5 team fouls] Dwyane Quickley to the line for 2 free throws. (Austin Bridges: 1 personal fouls)   FT 1/2: MISS   FT 2/2: GOOD Dwyane Quickley makes 1/2 from the line.
Score: 76-76

[02:55] Team_092 possession (Score: 76-76)
John Giddey drives, Donovan Doncic stays with him. John Giddey attempts a Layup. Contested by Donovan Doncic (4.0 feet, ZONE). JOHN GIDDEY MAKES IT! Assist: Paul James
Score: 76-78

[02:42] Team_074 possession (Score: 76-78)
Chris Carter drives and kicks out. Chris Carter attempts a Midrange. Contested by Karl Gobert (5.2 feet, MAN). Chris Carter misses. Offensive rebound by Donovan Doncic! Donovan Doncic kicks it out.

[02:30] Team_074 possession (Score: 76-78)
FOUL! Shooting foul on Paul James. Shai Green to the line for 3 free throws. [BONUS: 6 team fouls] (Paul James: 3 personal fouls)   FT 1/3: GOOD   FT 2/3: MISS   FT 3/3: GOOD Shai Green makes 2/3 from the line.
Score: 78-78

[02:18] Team_092 possession (Score: 78-78)
Karl Gobert drives and kicks out. Paul James attempts a 3Pt. Contested by Dwyane Quickley (5.7 feet, ZONE). Paul James misses. Rebound secured by James Turner.

[02:05] Team_074 possession (Score: 78-78)
Shai Green attempts a 3Pt. Contested by Paul James (5.5 feet, MAN). Shai Green misses. Rebound secured by Immanuel Ingram.

[01:52] Team_092 possession (Score: 78-78)
Immanuel Ingram drives to the basket... Immanuel Ingram loses control! Ball rolls out of bounds! TURNOVER! (dead ball)

[01:52] Substitution (Team_074): Dwyane Quickley OUT → James Barnes IN (stamina_rule2)

[01:52] Substitution (Team_074): Chris Carter OUT → Giannis Westbrook IN (stamina_rule2)

[01:52] Substitution (Team_074): Shai Green OUT → Ayo Smith IN (stamina_rule2)

[01:52] Substitution (Team_074): Donovan Doncic OUT → Yao Randle IN (stamina_rule2)

[01:52] Substitution (Team_074): James Turner OUT → Jaren Rozier IN (stamina_rule2)

[01:52] Substitution (Team_092): Austin Bridges OUT → Bones Giddey IN (stamina_rule2)

[01:52] Substitution (Team_092): Karl Gobert OUT → Shaquille Russell IN (stamina_rule2)

[01:52] Substitution (Team_092): Paul James OUT → Vince Harris IN (stamina_rule2)

[01:52] Substitution (Team_092): John Giddey OUT → Shaquille Paul IN (stamina_rule2)

[01:52] Substitution (Team_092): Immanuel Ingram OUT → Pau Reaves IN (stamina_rule2)

[01:39] Team_074 possession (Score: 78-78)
Giannis Westbrook attempts a Midrange. Contested by Shaquille Russell (4.3 feet, MAN). Giannis Westbrook misses. Rebound secured by Shaquille Paul.

[01:27] Team_092 possession (Score: 78-78)
Shaquille Russell makes the Layup and draws the foul on Yao Randle! And-1! Shaquille Russell to the line for 1. [BONUS: 6 team fouls] (Yao Randle: 1 personal fouls)   FT 1/1: GOOD Shaquille Russell makes 1/1 from the line.
Score: 78-81

[01:14] Team_074 possession (Score: 78-81)
Ayo Smith attempts a Layup. BLOCKED BY VINCE HARRIS! Ball is loose! Offensive rebound by Jaren Rozier! Jaren Rozier kicks it out.

[00:57] Team_074 possession (Score: 78-81)
Giannis Westbrook attempts a 3Pt. Contested by Vince Harris (4.2 feet, ZONE). Giannis Westbrook misses. Offensive rebound by Yao Randle! Yao Randle kicks it out.

[00:46] Team_074 possession (Score: 78-81)
Yao Randle attempts a Layup. BLOCKED BY SHAQUILLE PAUL! Ball goes out off Shaquille Paul. Yao Randle's ball!

[00:28] Team_074 possession (Score: 78-81)
Giannis Westbrook attempts a 3Pt. Contested by Shaquille Russell (4.3 feet, MAN). GIANNIS WESTBROOK MAKES IT! Assist: Jaren Rozier
Score: 81-81

[00:13] Team_092 possession (Score: 81-81)
Shaquille Paul attempts a 3Pt. Contested by Yao Randle (5.1 feet, MAN). SHAQUILLE PAUL MAKES IT! Assist: Shaquille Russell
Score: 81-84

================================================================================
                              3RD QUARTER COMPLETE                              
================================================================================

3RD QUARTER SCORE: Team_074 20, Team_092 31

BOX SCORE:
================================================================================

Team_074
--------------------------------------------------------------------------------
Player                MIN  PTS  REB  AST  TO      FG   FG%      3P   3P%
--------------------------------------------------------------------------------
Shai Green             23    7    1    0   0   3/6    50.0     0/0   0.0
James Turner           23    5    1    0   0   2/2   100.0     0/0   0.0
Giannis Westbrook      14    3    0    0   0   1/2    50.0     0/0   0.0
Donovan Doncic         23    2    3    0   0   1/1   100.0     0/0   0.0
Dwyane Quickley        23    1    0    0   0   1/3    33.3     0/0   0.0
Chris Carter           23    0    0    0   0   0/5     0.0     0/0   0.0
Jaren Rozier           14    0    1    1   0   0/0     0.0     0/0   0.0
Yao Randle             14    0    1    0   0   0/0     0.0     0/0   0.0

TEAM: FG: 8/19 (42.1%), 3PT: 2/8 (25.0%), REB: 9 (6 off, 3 def), AST: 1, TO: 1
TEAM FOULS: 6 [Team_092 in BONUS]


Team_092
--------------------------------------------------------------------------------
Player                MIN  PTS  REB  AST  TO      FG   FG%      3P   3P%
--------------------------------------------------------------------------------
Austin Bridges         23   11    0    0   0   5/5   100.0     0/0   0.0
John Giddey            23    7    2    1   0   3/4    75.0     0/0   0.0
Paul James             23    4    5    2   0   2/2   100.0     0/0   0.0
Karl Gobert            23    3    0    0   0   2/4    50.0     0/0   0.0
Shaquille Paul         14    3    1    0   0   1/1   100.0     0/0   0.0
Shaquille Russell      14    3    0    1   0   1/1   100.0     0/0   0.0
Immanuel Ingram        23    0    6    3   0   0/0     0.0     0/0   0.0

TEAM: FG: 14/17 (82.4%), 3PT: 3/3 (100.0%), REB: 12 (3 off, 9 def), AST: 7, TO: 3
TEAM FOULS: 6 [Team_074 in BONUS]

================================================================================

================================================================================
                       4TH QUARTER - Team_074 vs Team_092                       
================================================================================

[12:00] Team_074 possession (Score: 81-84)
Donovan Doncic attempts a 3Pt. Contested by John Giddey (4.5 feet, MAN). Donovan Doncic misses. Rebound secured by John Giddey.

[11:48] Team_092 possession (Score: 81-84)
FOUL! Shooting foul on Chris Carter. John Giddey to the line for 2 free throws. [Team fouls: 1] (Chris Carter: 1 personal fouls)   FT 1/2: GOOD   FT 2/2: GOOD John Giddey makes 2/2 from the line.
Score: 81-86

[11:30] Team_074 possession (Score: 81-86)
FOUL! Shooting foul on Paul James. Shai Green to the line for 2 free throws. [Team fouls: 1] (Paul James: 1 personal fouls)   FT 1/2: GOOD   FT 2/2: GOOD Shai Green makes 2/2 from the line.
Score: 83-86

[11:16] Team_092 possession (Score: 83-86)
Immanuel Ingram attempts a Midrange. Contested by Shai Green (3.4 feet, ZONE). IMMANUEL INGRAM MAKES IT! Assist: Karl Gobert
Score: 83-88

[11:01] Team_074 possession (Score: 83-88)
Chris Carter attempts a Layup. Contested by Karl Gobert (5.8 feet, MAN). CHRIS CARTER MAKES IT!
Score: 85-88

[10:48] Team_092 possession (Score: 85-88)
FOUL! Reach-in foul on Chris Carter during the drive. [Team fouls: 2] No free throws, side out. (Chris Carter: 2 personal fouls)

[10:34] Team_092 possession (Score: 85-88)
FOUL! Holding foul on Shai Green. [Team fouls: 3] No free throws, side out. (Shai Green: 1 personal fouls)

[10:22] Team_092 possession (Score: 85-88)
Paul James attempts a 3Pt. Contested by Shai Green (4.3 feet, MAN). Paul James misses. Rebound secured by James Turner.

[10:03] Team_074 possession (Score: 85-88)
Chris Carter attempts a 3Pt. Contested by Karl Gobert (5.9 feet, MAN). Chris Carter misses. Offensive rebound by James Turner! James Turner puts it back in!
Score: 87-88

[09:48] Team_092 possession (Score: 87-88)
Immanuel Ingram attempts a 3Pt. Contested by Dwyane Quickley (5.5 feet, ZONE). Immanuel Ingram misses. Rebound secured by Donovan Doncic.

[09:36] Team_074 possession (Score: 87-88)
Chris Carter attempts a Midrange. Contested by Paul James (5.6 feet, ZONE). Chris Carter misses. Rebound secured by Immanuel Ingram.

[09:22] Team_092 possession (Score: 87-88)
Immanuel Ingram attempts a Midrange. Contested by James Turner (3.5 feet, MAN). IMMANUEL INGRAM MAKES IT!
Score: 87-90

[09:11] Team_074 possession (Score: 87-90)
Shai Green attempts a 3Pt. Contested by John Giddey (4.9 feet, ZONE). Shai Green misses. Rebound secured by John Giddey.

[09:00] Team_092 possession (Score: 87-90)
Paul James makes the Midrange and draws the foul on Chris Carter! And-1! Paul James to the line for 1. [Team fouls: 4] (Chris Carter: 3 personal fouls)   FT 1/1: GOOD Paul James makes 1/1 from the line.
Score: 87-93

[08:41] Team_074 possession (Score: 87-93)
Chris Carter drives and kicks out. Dwyane Quickley attempts a Midrange. Contested by John Giddey (4.5 feet, ZONE). DWYANE QUICKLEY MAKES IT!
Score: 89-93

[08:25] Team_092 possession (Score: 89-93)
Austin Bridges makes the Layup and draws the foul on Donovan Doncic! And-1! Austin Bridges to the line for 1. [BONUS: 5 team fouls] (Donovan Doncic: 1 personal fouls)   FT 1/1: GOOD Austin Bridges makes 1/1 from the line.
Score: 89-96

[08:11] Team_074 possession (Score: 89-96)
Chris Carter drives and kicks out. Dwyane Quickley attempts a 3Pt. Contested by Austin Bridges (5.0 feet, MAN). Dwyane Quickley misses. Rebound secured by John Giddey.

[07:57] Team_092 possession (Score: 89-96)
Paul James drives to the basket... FOUL! Offensive foul on Paul James! Donovan Doncic drew the charge! [Team fouls: 2] (Paul James: 2 personal fouls) TURNOVER! (dead ball)

[07:45] Team_074 possession (Score: 89-96)
Dwyane Quickley attempts a Midrange. Contested by Karl Gobert (5.7 feet, ZONE). Dwyane Quickley misses. Rebound secured by Paul James.

[07:32] Team_092 possession (Score: 89-96)
Karl Gobert drives, Donovan Doncic stays with him. Karl Gobert attempts a Layup. Contested by Donovan Doncic (4.0 feet, ZONE). KARL GOBERT MAKES IT!
Score: 89-98

[07:17] Team_074 possession (Score: 89-98)
James Turner drives to the basket... James Turner throws a bad pass! Stolen by Immanuel Ingram! TURNOVER! (live ball)

[07:05] Team_092 possession (Score: 89-98)
John Giddey attempts a 3Pt. Wide open! Dwyane Quickley is 6.1 feet away. [ZONE] JOHN GIDDEY MAKES IT! Assist: Karl Gobert
Score: 89-101

[06:50] Team_074 possession (Score: 89-101)
Shai Green attempts a 3Pt. Contested by Paul James (5.7 feet, MAN). Shai Green misses. Rebound secured by Immanuel Ingram.

[06:32] Team_092 possession (Score: 89-101)
Austin Bridges attempts a 3Pt. Contested by Shai Green (4.0 feet, ZONE). Austin Bridges misses. Rebound secured by James Turner.

[06:19] Team_074 possession (Score: 89-101)
Chris Carter attempts a 3Pt. Wide open! Karl Gobert is 6.2 feet away. [MAN] Chris Carter misses. Offensive rebound by James Turner! James Turner kicks it out.

[06:08] Team_074 possession (Score: 89-101)
Chris Carter attempts a 3Pt. Contested by Paul James (5.9 feet, ZONE). Chris Carter misses. Offensive rebound by James Turner! James Turner kicks it out.

[05:49] Team_074 possession (Score: 89-101)
Shai Green attempts a 3Pt. Contested by Paul James (5.8 feet, MAN). Shai Green misses. Offensive rebound by James Turner! James Turner kicks it out.

[05:35] Team_074 possession (Score: 89-101)
Chris Carter attempts a 3Pt. Contested by John Giddey (5.5 feet, ZONE). CHRIS CARTER MAKES IT! Assist: James Turner
Score: 92-101

[05:20] Team_092 possession (Score: 92-101)
Immanuel Ingram drives, James Turner stays with him. Immanuel Ingram attempts a Dunk. Contested by James Turner (4.1 feet, MAN). Immanuel Ingram misses. Rebound secured by James Turner.

[05:04] Team_074 possession (Score: 92-101)
Dwyane Quickley drives and kicks out. Donovan Doncic attempts a 3Pt. Contested by John Giddey (5.1 feet, MAN). DONOVAN DONCIC MAKES IT! Assist: James Turner
Score: 95-101

[04:49] Team_092 possession (Score: 95-101)
John Giddey drives, picks up Donovan Doncic. Help arrives from Chris Carter! John Giddey attempts a Layup. Contested by Chris Carter (4.6 feet, ZONE). John Giddey misses. Rebound secured by James Turner.

[04:33] Team_074 possession (Score: 95-101)
Dwyane Quickley attempts a 3Pt. Contested by Austin Bridges (5.7 feet, MAN). Dwyane Quickley misses. Offensive rebound by Donovan Doncic! Donovan Doncic kicks it out.

[04:19] Team_074 possession (Score: 95-101)
Donovan Doncic drives, picks up Immanuel Ingram. Help arrives from Austin Bridges! Donovan Doncic attempts a Layup. Contested by Austin Bridges (5.2 feet, ZONE). Donovan Doncic misses. Rebound secured by Immanuel Ingram.

[04:03] Team_092 possession (Score: 95-101)
Karl Gobert drives, Chris Carter stays with him. Karl Gobert attempts a Dunk. Contested by Chris Carter (5.1 feet, MAN). Karl Gobert misses. Offensive rebound by John Giddey! John Giddey kicks it out.

[03:46] Team_092 possession (Score: 95-101)
John Giddey attempts a 3Pt. Contested by Donovan Doncic (4.7 feet, MAN). John Giddey misses. Rebound secured by James Turner.

[03:36] Team_074 possession (Score: 95-101)
Donovan Doncic attempts a Midrange. Contested by John Giddey (5.5 feet, MAN). Donovan Doncic misses. Rebound secured by Paul James.

[03:21] Team_092 possession (Score: 95-101)
FOUL! Shooting foul on Donovan Doncic. Immanuel Ingram to the line for 2 free throws. [BONUS: 6 team fouls] (Donovan Doncic: 2 personal fouls)   FT 1/2: MISS   FT 2/2: GOOD Immanuel Ingram makes 1/2 from the line.
Score: 95-102

[03:05] Team_074 possession (Score: 95-102)
FOUL! Holding foul on Immanuel Ingram. [Team fouls: 3] No free throws, side out. (Immanuel Ingram: 1 personal fouls)

[02:46] Team_074 possession (Score: 95-102)
Donovan Doncic attempts a 3Pt. Contested by Paul James (6.0 feet, ZONE). DONOVAN DONCIC MAKES IT! Assist: Chris Carter
Score: 98-102

[02:26] Team_092 possession (Score: 98-102)
Immanuel Ingram makes the Layup and draws the foul on Donovan Doncic! And-1! Immanuel Ingram to the line for 1. [BONUS: 7 team fouls] (Donovan Doncic: 3 personal fouls)   FT 1/1: GOOD Immanuel Ingram makes 1/1 from the line.
Score: 98-105

[02:14] Team_074 possession (Score: 98-105)
Donovan Doncic makes the Midrange and draws the foul on John Giddey! And-1! Donovan Doncic to the line for 1. [Team fouls: 4] (John Giddey: 1 personal fouls)   FT 1/1: GOOD Donovan Doncic makes 1/1 from the line.
Score: 101-105

[02:04] Team_092 possession (Score: 101-105)
Karl Gobert drives and kicks out. Karl Gobert attempts a Midrange. Wide open! Dwyane Quickley is 6.6 feet away. [ZONE] KARL GOBERT MAKES IT! Assist: Immanuel Ingram
Score: 101-107

[01:51] Team_074 possession (Score: 101-107)
Chris Carter attempts a Midrange. Wide open! Karl Gobert is 6.7 feet away. [MAN] CHRIS CARTER MAKES IT! Assist: Dwyane Quickley
Score: 103-107

[01:36] Team_092 possession (Score: 103-107)
FOUL! Holding foul on Donovan Doncic. [IN THE BONUS! 8 team fouls] John Giddey to the line for 2 free throws. (Donovan Doncic: 4 personal fouls)   FT 1/2: GOOD   FT 2/2: GOOD John Giddey makes 2/2 from the line.
Score: 103-109

[01:23] Team_074 possession (Score: 103-109)
Chris Carter attempts a Midrange. Wide open! Karl Gobert is 6.7 feet away. [MAN] CHRIS CARTER MAKES IT! Assist: Dwyane Quickley
Score: 105-109

[01:09] Team_092 possession (Score: 105-109)
Immanuel Ingram drives, picks up Donovan Doncic. Help arrives from Chris Carter! Immanuel Ingram attempts a Dunk. Contested by Chris Carter (4.8 feet, ZONE). Immanuel Ingram misses. Offensive rebound by Paul James! Paul James kicks it out.

[00:56] Team_092 possession (Score: 105-109)
Karl Gobert attempts a 3Pt. Wide open! Dwyane Quickley is 6.4 feet away. [ZONE] Karl Gobert misses. Rebound secured by Shai Green.

[00:41] Team_074 possession (Score: 105-109)
Dwyane Quickley attempts a Layup. Wide open! Austin Bridges is 6.3 feet away. [MAN] DWYANE QUICKLEY MAKES IT! Assist: Donovan Doncic
Score: 107-109

[00:24] Team_092 possession (Score: 107-109)
Karl Gobert attempts a 3Pt. Contested by Chris Carter (5.7 feet, MAN). Karl Gobert misses. Rebound secured by Donovan Doncic.

[00:07] Team_074 possession (Score: 107-109)
Donovan Doncic attempts a 3Pt. Wide open! Austin Bridges is 6.5 feet away. [ZONE] DONOVAN DONCIC MAKES IT! Assist: Dwyane Quickley
Score: 110-109

================================================================================
                              4TH QUARTER COMPLETE                              
================================================================================

4TH QUARTER SCORE: Team_074 29, Team_092 25

BOX SCORE:
================================================================================

Team_074
--------------------------------------------------------------------------------
Player                MIN  PTS  REB  AST  TO      FG   FG%      3P   3P%
--------------------------------------------------------------------------------
Donovan Doncic         35   12    3    1   0   4/7    57.1     0/0   0.0
Chris Carter           35    9    0    1   0   4/6    66.7     0/0   0.0
Dwyane Quickley        35    4    0    3   0   2/3    66.7     0/0   0.0
Shai Green             35    2    1    0   0   1/3    33.3     0/0   0.0
James Turner           35    2    9    2   0   1/1   100.0     0/0   0.0

TEAM: FG: 12/20 (60.0%), 3PT: 4/7 (57.1%), REB: 13 (5 off, 8 def), AST: 7, TO: 1
TEAM FOULS: 8 [Team_092 in BONUS]


Team_092
--------------------------------------------------------------------------------
Player                MIN  PTS  REB  AST  TO      FG   FG%      3P   3P%
--------------------------------------------------------------------------------
Immanuel Ingram        35    8    3    1   0   4/6    66.7     0/0   0.0
John Giddey            35    7    4    0   0   3/5    60.0     0/0   0.0
Karl Gobert            35    4    0    2   0   2/4    50.0     0/0   0.0
Paul James             35    3    3    0   0   1/2    50.0     0/0   0.0
Austin Bridges         35    3    0    0   0   1/2    50.0     0/0   0.0

TEAM: FG: 11/19 (57.9%), 3PT: 1/7 (14.3%), REB: 10 (2 off, 8 def), AST: 3, TO: 1
TEAM FOULS: 4

================================================================================

================================================================================
                               FULL GAME COMPLETE                               
================================================================================

FINAL SCORE: Team_074 110, Team_092 109

SCORING BY QUARTER:
--------------------------------------------------------------------------------
Team                     Q1     Q2     Q3     Q4    FINAL
--------------------------------------------------------------------------------
Team_074                 30     31     20     29      110
Team_092                 29     24     31     25      109
--------------------------------------------------------------------------------

FULL GAME BOX SCORE:
================================================================================

Team_074
--------------------------------------------------------------------------------
Player                MIN  PTS  REB  AST  TO      FG   FG%      3P   3P%      FT STL BLK
--------------------------------------------------------------------------------
Dwyane Quickley        35   10    0    3   1   5/8    62.5   1/2    50.0   1/2     0   0
Chris Carter           35   20    0    2   2  10/19   52.6   4/8    50.0   1/1     0   0
Shai Green             35   11    3    2   0   5/11   45.5   1/5    20.0   5/7     0   0
Donovan Doncic         35   16   13    4   2   5/9    55.6   2/3    66.7   1/1     1   1
James Turner           35   17   14    3   2   5/6    83.3   0/1     0.0   7/7     0   0
James Barnes           14   10    0    0   0   3/4    75.0   1/1   100.0   2/3     1   0
Giannis Westbrook      14    7    0    2   2   4/7    57.1   2/3    66.7   1/2     0   0
Ayo Smith              14    4    2    1   0   2/3    66.7   0/1     0.0   0/0     0   0
Yao Randle             14    0    8    1   0   0/1     0.0   0/1     0.0   0/0     1   0
Jaren Rozier           14   10    5    2   0   5/7    71.4   0/0     0.0   7/9     0   0

TEAM: FG: 46/77 (59.7%), 3PT: 11/25 (44.0%), REB: 48 (21 off, 27 def), AST: 20, TO: 9


Team_092
--------------------------------------------------------------------------------
Player                MIN  PTS  REB  AST  TO      FG   FG%      3P   3P%      FT STL BLK
--------------------------------------------------------------------------------
Austin Bridges         35   17    0    1   1   8/9    88.9   1/2    50.0   4/6     0   0
Karl Gobert            35    9    0    3   1   5/9    55.6   1/3    33.3   1/3     1   0
Paul James             35   13   12    3   0   5/9    55.6   2/4    50.0   1/1     0   0
John Giddey            35   20    9    2   3   8/13   61.5   1/4    25.0   5/5     2   0
Immanuel Ingram        35   20    9    7   1  10/13   76.9   0/1     0.0   6/8     1   0
Bones Giddey           14    0    0    1   1   0/4     0.0   0/1     0.0   0/2     0   0
Shaquille Russell      14   11    0    1   0   4/5    80.0   0/0     0.0   3/3     0   0
Vince Harris           14    6    1    1   0   2/4    50.0   2/4    50.0   0/0     0   1
Shaquille Paul         14    6    6    1   1   2/5    40.0   1/3    33.3   1/1     0   1
Pau Reaves             14    7    5    1   0   3/3   100.0   0/0     0.0   5/5     0   0

TEAM: FG: 49/76 (64.5%), 3PT: 8/22 (36.4%), REB: 39 (11 off, 28 def), AST: 21, TO: 8

================================================================================
