================================================================================
                        FULL GAME - Team_017 vs Team_054                        
================================================================================

================================================================================
                       1ST QUARTER - Team_017 vs Team_054                       
================================================================================

[12:00] Team_017 possession (Score: 0-0)
Desmond Reaves attempts a 3Pt. Contested by Malcolm Harden (4.6 feet, MAN). Desmond Reaves misses. Rebound secured by Luka Brogdon.

[11:48] Team_054 possession (Score: 0-0)
Vince Ball drives to the basket... FOUL! Offensive foul on Vince Ball! Bam Williamson drew the charge! [Team fouls: 1] (Vince Ball: 1 personal fouls) TURNOVER! (dead ball)

[11:33] Team_017 possession (Score: 0-0)
Tony Smith attempts a 3Pt. BLOCKED BY LUKA BROGDON! Ball is loose! Rebound secured by Luka Brogdon.

[11:19] Team_054 possession (Score: 0-0)
Malcolm Harden makes the 3Pt and draws the foul on Desmond Reaves! And-1! Malcolm Harden to the line for 1. [Team fouls: 1] (Desmond Reaves: 1 personal fouls)   FT 1/1: GOOD Malcolm Harden makes 1/1 from the line.
Score: 0-4

[11:07] Team_017 possession (Score: 0-4)
FOUL! Shooting foul on Lauri Irving. Desmond Reaves to the line for 3 free throws. [Team fouls: 2] (Lauri Irving: 1 personal fouls)   FT 1/3: GOOD   FT 2/3: GOOD   FT 3/3: GOOD Desmond Reaves makes 3/3 from the line.
Score: 3-4

[10:55] Team_054 possession (Score: 3-4)
Vince Ball drives to the basket... Vince Ball loses the ball! Stripped by Bam Williamson! TURNOVER! (live ball)

[10:44] Team_017 possession (Score: 3-4)
Bam Williamson drives, Blake Russell stays with him. Bam Williamson attempts a Layup. Contested by Blake Russell (3.7 feet, MAN). BAM WILLIAMSON MAKES IT!
Score: 5-4

[10:30] Team_054 possession (Score: 5-4)
Malcolm Harden attempts a 3Pt. Contested by Desmond Reaves (4.3 feet, ZONE). Malcolm Harden misses. Rebound secured by Kyrie Middleton.

[10:15] Team_017 possession (Score: 5-4)
Tony Smith attempts a Layup. Contested by Blake Russell (3.6 feet, ZONE). TONY SMITH MAKES IT!
Score: 7-4

[10:03] Team_054 possession (Score: 7-4)
Luka Brogdon attempts a Layup. Contested by Kyrie Middleton (5.4 feet, MAN). Luka Brogdon misses. Rebound secured by Kyrie Middleton.

[09:45] Team_017 possession (Score: 7-4)
Tony Smith attempts a 3Pt. Contested by Vince Ball (4.7 feet, MAN). TONY SMITH MAKES IT! Assist: Bam Williamson
Score: 10-4

[09:34] Team_054 possession (Score: 10-4)
Vince Ball attempts a 3Pt. Contested by Tony Smith (2.9 feet, ZONE). Vince Ball misses. Rebound secured by Bam Williamson.

[09:19] Team_017 possession (Score: 10-4)
Kyrie Middleton attempts a Midrange. Contested by Luka Brogdon (4.3 feet, MAN). Kyrie Middleton misses. Rebound secured by Blake Russell.

[09:06] Team_054 possession (Score: 10-4)
Lauri Irving drives, Kyrie Middleton stays with him. Lauri Irving attempts a Layup. Contested by Kyrie Middleton (5.5 feet, ZONE). LAURI IRVING MAKES IT!
Score: 10-6

[08:48] Team_017 possession (Score: 10-6)
Vince Banchero attempts a Midrange. Contested by Lauri Irving (3.4 feet, ZONE). Vince Banchero misses. Rebound secured by Lauri Irving.

[08:36] Team_054 possession (Score: 10-6)
Blake Russell drives and kicks out. Luka Brogdon attempts a 3Pt. Contested by Desmond Reaves (4.0 feet, ZONE). LUKA BROGDON MAKES IT! Assist: Malcolm Harden
Score: 10-9

[08:19] Team_017 possession (Score: 10-9)
Tony Smith attempts a 3Pt. Contested by Vince Ball (4.7 feet, MAN). Tony Smith misses. Rebound secured by Lauri Irving.

[08:05] Team_054 possession (Score: 10-9)
Vince Ball drives, Tony Smith stays with him. Vince Ball attempts a Dunk. Contested by Tony Smith (2.9 feet, MAN). VINCE BALL MAKES IT! Assist: Blake Russell
Score: 10-11

[07:49] Team_017 possession (Score: 10-11)
Desmond Reaves attempts a Midrange. Contested by Malcolm Harden (4.6 feet, MAN). DESMOND REAVES MAKES IT!
Score: 12-11

[07:38] Team_054 possession (Score: 12-11)
Malcolm Harden attempts a Midrange. Contested by Desmond Reaves (4.3 feet, MAN). MALCOLM HARDEN MAKES IT! Assist: Luka Brogdon
Score: 12-13

[07:20] Team_017 possession (Score: 12-13)
Tony Smith drives, Vince Ball stays with him. Tony Smith attempts a Dunk. Contested by Vince Ball (4.7 feet, MAN). TONY SMITH MAKES IT!
Score: 14-13

[07:05] Team_054 possession (Score: 14-13)
Luka Brogdon drives, picks up Kyrie Middleton. Help arrives from Vince Banchero! Luka Brogdon attempts a Dunk. Contested by Vince Banchero (5.4 feet, MAN). LUKA BROGDON MAKES IT!
Score: 14-15

[06:53] Team_017 possession (Score: 14-15)
Kyrie Middleton attempts a Midrange. Contested by Luka Brogdon (4.3 feet, MAN). KYRIE MIDDLETON MAKES IT!
Score: 16-15

[06:38] Team_054 possession (Score: 16-15)
FOUL! Shooting foul on Tony Smith. Vince Ball to the line for 3 free throws. [Team fouls: 2] (Tony Smith: 1 personal fouls)   FT 1/3: GOOD   FT 2/3: GOOD   FT 3/3: GOOD Vince Ball makes 3/3 from the line.
Score: 16-18

[06:22] Team_017 possession (Score: 16-18)
Tony Smith drives and kicks out. Bam Williamson attempts a Midrange. Contested by Blake Russell (3.0 feet, MAN). Bam Williamson misses. Rebound secured by Blake Russell.

[06:08] Team_054 possession (Score: 16-18)
Blake Russell attempts a Midrange. Contested by Tony Smith (3.2 feet, ZONE). Blake Russell misses. Rebound secured by Kyrie Middleton.

[05:52] Team_017 possession (Score: 16-18)
Desmond Reaves attempts a Midrange. Contested by Malcolm Harden (4.6 feet, MAN). Desmond Reaves misses. Rebound secured by Luka Brogdon.

[05:35] Team_054 possession (Score: 16-18)
Blake Russell drives, picks up Bam Williamson. Help arrives from Vince Banchero! Blake Russell attempts a Dunk. Contested by Vince Banchero (4.5 feet, ZONE). BLAKE RUSSELL MAKES IT! Assist: Malcolm Harden
Score: 16-20

[05:23] Team_017 possession (Score: 16-20)
FOUL! Holding foul on Blake Russell. [Team fouls: 3] No free throws, side out. (Blake Russell: 1 personal fouls)

[05:07] Team_017 possession (Score: 16-20)
Kyrie Middleton attempts a Layup. Contested by Blake Russell (3.4 feet, ZONE). KYRIE MIDDLETON MAKES IT! Assist: Vince Banchero
Score: 18-20

[04:53] Team_054 possession (Score: 18-20)
Vince Ball drives and kicks out. Lauri Irving attempts a 3Pt. Contested by Vince Banchero (4.1 feet, MAN). LAURI IRVING MAKES IT! Assist: Vince Ball
Score: 18-23

[04:41] Team_017 possession (Score: 18-23)
Desmond Reaves makes the Layup and draws the foul on Lauri Irving! And-1! Desmond Reaves to the line for 1. [Team fouls: 4] (Lauri Irving: 2 personal fouls)   FT 1/1: MISS Desmond Reaves makes 0/1 from the line. Rebound secured by Luka Brogdon.
Score: 20-23

[04:27] Team_054 possession (Score: 20-23)
Blake Russell drives to the basket... Blake Russell throws a bad pass out of bounds! TURNOVER! (dead ball)

[04:13] Team_017 possession (Score: 20-23)
Bam Williamson attempts a 3Pt. Contested by Blake Russell (3.9 feet, MAN). Bam Williamson misses. Rebound secured by Blake Russell.

[03:53] Team_054 possession (Score: 20-23)
Luka Brogdon makes the Layup and draws the foul on Kyrie Middleton! And-1! Luka Brogdon to the line for 1. [Team fouls: 3] (Kyrie Middleton: 1 personal fouls)   FT 1/1: GOOD Luka Brogdon makes 1/1 from the line.
Score: 20-26

[03:38] Team_017 possession (Score: 20-26)
Tony Smith drives and kicks out. Tony Smith attempts a Midrange. Contested by Vince Ball (4.2 feet, MAN). Tony Smith misses. Rebound secured by Blake Russell.

[03:28] Team_054 possession (Score: 20-26)
Vince Ball attempts a 3Pt. Contested by Tony Smith (3.1 feet, MAN). Vince Ball misses. Rebound secured by Tony Smith.

[03:16] Team_017 possession (Score: 20-26)
Kyrie Middleton attempts a Layup. Contested by Blake Russell (3.6 feet, ZONE). Kyrie Middleton misses. Rebound secured by Vince Ball.

[03:00] Team_054 possession (Score: 20-26)
FOUL! Offensive foul on Malcolm Harden! Desmond Reaves drew the charge! [Team fouls: 5] (Malcolm Harden: 1 personal fouls) TURNOVER! (dead ball)

[02:44] Team_017 possession (Score: 20-26)
Tony Smith attempts a 3Pt. Contested by Vince Ball (4.8 feet, MAN). Tony Smith misses. Rebound secured by Blake Russell.

[02:28] Team_054 possession (Score: 20-26)
Luka Brogdon drives, picks up Kyrie Middleton. Help arrives from Vince Banchero! Luka Brogdon attempts a Dunk. Contested by Vince Banchero (5.6 feet, MAN). LUKA BROGDON MAKES IT! Assist: Blake Russell
Score: 20-28

[02:14] Team_017 possession (Score: 20-28)
Desmond Reaves drives to the basket... Desmond Reaves throws a bad pass! Stolen by Malcolm Harden! TURNOVER! (live ball)

[01:58] Team_054 possession (Score: 20-28)
Vince Ball attempts a Layup. Contested by Tony Smith (3.2 feet, MAN). VINCE BALL MAKES IT! Assist: Lauri Irving
Score: 20-30

[01:44] Team_017 possession (Score: 20-30)
FOUL! Reach-in foul on Blake Russell during the drive. [IN THE BONUS! 6 team fouls] Tony Smith to the line for 2 free throws. (Blake Russell: 2 personal fouls)   FT 1/2: GOOD   FT 2/2: GOOD Tony Smith makes 2/2 from the line.
Score: 22-30

[01:26] Team_054 possession (Score: 22-30)
Luka Brogdon makes the Layup and draws the foul on Kyrie Middleton! And-1! Luka Brogdon to the line for 1. [Team fouls: 4] (Kyrie Middleton: 2 personal fouls)   FT 1/1: GOOD Luka Brogdon makes 1/1 from the line.
Score: 22-33

[01:08] Team_017 possession (Score: 22-33)
Vince Banchero attempts a 3Pt. Contested by Lauri Irving (3.8 feet, MAN). Vince Banchero misses. Rebound secured by Blake Russell.

[00:53] Team_054 possession (Score: 22-33)
Luka Brogdon attempts a 3Pt. Contested by Kyrie Middleton (5.7 feet, MAN). LUKA BROGDON MAKES IT! Assist: Blake Russell
Score: 22-36

[00:39] Team_017 possession (Score: 22-36)
Kyrie Middleton makes the Dunk and draws the foul on Luka Brogdon! And-1! Kyrie Middleton to the line for 1. [BONUS: 7 team fouls] (Luka Brogdon: 1 personal fouls)   FT 1/1: GOOD Kyrie Middleton makes 1/1 from the line.
Score: 25-36

[00:23] Team_054 possession (Score: 25-36)
Vince Ball attempts a 3Pt. Contested by Tony Smith (3.4 feet, MAN). Vince Ball misses. Rebound secured by Bam Williamson.

[00:07] Team_017 possession (Score: 25-36)
Tony Smith attempts a 3Pt. Contested by Vince Ball (5.0 feet, MAN). Tony Smith misses. Offensive rebound by Bam Williamson! Bam Williamson puts it back in!
Score: 27-36

================================================================================
                              1ST QUARTER COMPLETE                              
================================================================================

1ST QUARTER SCORE: Team_017 27, Team_054 36

BOX SCORE:
================================================================================

Team_017
--------------------------------------------------------------------------------
Player                MIN  PTS  REB  AST  TO      FG   FG%      3P   3P%
--------------------------------------------------------------------------------
Tony Smith             12    9    1    0   0   4/9    44.4     0/0   0.0
Kyrie Middleton        12    7    3    0   0   3/5    60.0     0/0   0.0
Desmond Reaves         12    5    0    0   0   2/5    40.0     0/0   0.0
Bam Williamson         12    4    3    1   0   2/3    66.7     0/0   0.0
Vince Banchero         12    0    0    1   0   0/2     0.0     0/0   0.0

TEAM: FG: 11/24 (45.8%), 3PT: 3/9 (33.3%), REB: 7 (1 off, 6 def), AST: 2, TO: 1
TEAM FOULS: 4


Team_054
--------------------------------------------------------------------------------
Player                MIN  PTS  REB  AST  TO      FG   FG%      3P   3P%
--------------------------------------------------------------------------------
Luka Brogdon           12   16    4    1   0   6/7    85.7     0/0   0.0
Vince Ball             12    7    1    1   0   3/6    50.0     0/0   0.0
Malcolm Harden         12    6    0    2   0   2/3    66.7     0/0   0.0
Lauri Irving           12    5    2    1   0   2/2   100.0     0/0   0.0
Blake Russell          12    2    6    3   0   1/2    50.0     0/0   0.0

TEAM: FG: 14/20 (70.0%), 3PT: 3/7 (42.9%), REB: 13 (0 off, 13 def), AST: 8, TO: 4
TEAM FOULS: 7 [Team_017 in BONUS]

================================================================================

================================================================================
                       2ND QUARTER - Team_017 vs Team_054                       
================================================================================

[12:00] Team_017 possession (Score: 27-36)
Tony Smith attempts a 3Pt. Contested by Vince Ball (4.8 feet, MAN). Tony Smith misses. Rebound secured by Luka Brogdon.

[11:44] Team_054 possession (Score: 27-36)
Luka Brogdon loses the ball! Stripped by Kyrie Middleton! TURNOVER! (live ball)

[11:33] Team_017 possession (Score: 27-36)
Bam Williamson drives to the basket... Bam Williamson loses the ball! Stripped by Blake Russell! TURNOVER! (live ball)

[11:21] Team_054 possession (Score: 27-36)
Lauri Irving attempts a 3Pt. Contested by Tony Smith (3.6 feet, ZONE). Lauri Irving misses. Rebound secured by Tony Smith.

[11:06] Team_017 possession (Score: 27-36)
Tony Smith attempts a Layup. Contested by Vince Ball (4.9 feet, MAN). TONY SMITH MAKES IT! Assist: Kyrie Middleton
Score: 29-36

[10:50] Team_054 possession (Score: 29-36)
Blake Russell attempts a Layup. Contested by Bam Williamson (4.9 feet, MAN). BLAKE RUSSELL MAKES IT!
Score: 29-38

[10:39] Team_017 possession (Score: 29-38)
FOUL! Offensive foul on Bam Williamson! Blake Russell drew the charge! [Team fouls: 1] (Bam Williamson: 1 personal fouls) TURNOVER! (dead ball)

[10:22] Team_054 possession (Score: 29-38)
Luka Brogdon attempts a 3Pt. Contested by Kyrie Middleton (5.8 feet, MAN). LUKA BROGDON MAKES IT! Assist: Vince Ball
Score: 29-41

[10:07] Team_017 possession (Score: 29-41)
Desmond Reaves attempts a 3Pt. Contested by Malcolm Harden (5.0 feet, MAN). Desmond Reaves misses. Rebound secured by Vince Ball.

[09:51] Team_054 possession (Score: 29-41)
Luka Brogdon drives, picks up Kyrie Middleton. Help arrives from Vince Banchero! Luka Brogdon attempts a Dunk. Contested by Vince Banchero (5.8 feet, MAN). LUKA BROGDON MAKES IT!
Score: 29-43

[09:38] Team_017 possession (Score: 29-43)
Kyrie Middleton attempts a Layup. Contested by Blake Russell (4.1 feet, ZONE). Kyrie Middleton misses. Rebound secured by Blake Russell.

[09:26] Team_054 possession (Score: 29-43)
Lauri Irving attempts a 3Pt. Contested by Tony Smith (3.9 feet, ZONE). Lauri Irving misses. Rebound secured by Kyrie Middleton.

[09:08] Team_017 possession (Score: 29-43)
Bam Williamson drives, picks up Blake Russell. Help arrives from Lauri Irving! Bam Williamson attempts a Dunk. Contested by Lauri Irving (4.5 feet, MAN). BAM WILLIAMSON MAKES IT! Assist: Tony Smith
Score: 31-43

[08:55] Team_054 possession (Score: 31-43)
Lauri Irving attempts a 3Pt. Contested by Vince Banchero (5.1 feet, MAN). LAURI IRVING MAKES IT! Assist: Vince Ball
Score: 31-46

[08:37] Team_017 possession (Score: 31-46)
Desmond Reaves loses the ball! Stripped by Malcolm Harden! TURNOVER! (live ball)

[08:19] Team_054 possession (Score: 31-46)
Lauri Irving attempts a Layup. Contested by Vince Banchero (5.2 feet, MAN). Lauri Irving misses. Offensive rebound by Blake Russell! Blake Russell's putback is no good. Offensive rebound by Luka Brogdon! Luka Brogdon kicks it out.

[08:09] Team_054 possession (Score: 31-46)
Lauri Irving attempts a 3Pt. Contested by Vince Banchero (5.2 feet, MAN). Lauri Irving misses. Rebound secured by Tony Smith.

[07:54] Team_017 possession (Score: 31-46)
Tony Smith attempts a 3Pt. Contested by Lauri Irving (4.7 feet, ZONE). Tony Smith misses. Rebound secured by Luka Brogdon.

[07:41] Team_054 possession (Score: 31-46)
Luka Brogdon throws a bad pass! Stolen by Kyrie Middleton! TURNOVER! (live ball)

[07:32] Team_017 possession (Score: 31-46)
Tony Smith attempts a Layup. Contested by Vince Ball (5.2 feet, MAN). TONY SMITH MAKES IT! Assist: Vince Banchero
Score: 33-46

[07:20] Team_054 possession (Score: 33-46)
Lauri Irving drives, picks up Bam Williamson. Help arrives from Vince Banchero! Lauri Irving attempts a Dunk. Contested by Vince Banchero (5.5 feet, ZONE). LAURI IRVING MAKES IT! Assist: Blake Russell
Score: 33-48

[07:06] Team_017 possession (Score: 33-48)
Bam Williamson drives to the basket... Bam Williamson loses the ball! Stripped by Blake Russell! TURNOVER! (live ball)

[06:52] Team_054 possession (Score: 33-48)
Vince Ball makes the Midrange and draws the foul on Tony Smith! And-1! Vince Ball to the line for 1. [Team fouls: 2] (Tony Smith: 1 personal fouls)   FT 1/1: GOOD Vince Ball makes 1/1 from the line.
Score: 33-51

[06:38] Team_017 possession (Score: 33-51)
Vince Banchero drives and kicks out. Kyrie Middleton attempts a 3Pt. Contested by Luka Brogdon (4.9 feet, MAN). Kyrie Middleton misses. Rebound secured by Blake Russell.

[06:23] Team_054 possession (Score: 33-51)
Malcolm Harden makes the Layup and draws the foul on Desmond Reaves! And-1! Malcolm Harden to the line for 1. [Team fouls: 3] (Desmond Reaves: 1 personal fouls)   FT 1/1: GOOD Malcolm Harden makes 1/1 from the line.
Score: 33-54

[06:10] Team_017 possession (Score: 33-54)
Desmond Reaves attempts a 3Pt. Contested by Malcolm Harden (5.5 feet, MAN). Desmond Reaves misses. Rebound secured by Vince Ball.

[05:56] Team_054 possession (Score: 33-54)
Vince Ball attempts a Midrange. Contested by Vince Banchero (5.2 feet, ZONE). Vince Ball misses. Rebound secured by Bam Williamson.

[05:43] Team_017 possession (Score: 33-54)
Kyrie Middleton drives and kicks out. Tony Smith attempts a Midrange. Contested by Vince Ball (5.1 feet, MAN). Tony Smith misses. Rebound secured by Vince Ball.

[05:28] Team_054 possession (Score: 33-54)
Vince Ball attempts a Midrange. Contested by Tony Smith (4.2 feet, MAN). Vince Ball misses. Rebound secured by Tony Smith.

[05:13] Team_017 possession (Score: 33-54)
Bam Williamson attempts a Midrange. Contested by Vince Ball (5.5 feet, ZONE). BAM WILLIAMSON MAKES IT! Assist: Kyrie Middleton
Score: 35-54

[05:00] Team_054 possession (Score: 35-54)
Vince Ball attempts a 3Pt. Contested by Tony Smith (4.3 feet, ZONE). VINCE BALL MAKES IT! Assist: Lauri Irving
Score: 35-57

[04:44] Team_017 possession (Score: 35-57)
Bam Williamson attempts a Midrange. Contested by Vince Ball (5.6 feet, ZONE). Bam Williamson misses. Offensive rebound by Kyrie Middleton! Kyrie Middleton kicks it out.

[04:31] Team_017 possession (Score: 35-57)
Bam Williamson drives to the basket... Bam Williamson loses control! Ball rolls out of bounds! TURNOVER! (dead ball)

[04:31] Substitution (Team_017): Desmond Reaves OUT → Blake Reaves IN (stamina_rule2)

[04:31] Substitution (Team_017): Vince Banchero OUT → Tobias Bridges IN (stamina_rule2)

[04:31] Substitution (Team_017): Tony Smith OUT → Shaquille Stewart IN (stamina_rule2)

[04:31] Substitution (Team_017): Kyrie Middleton OUT → Ja Stewart IN (stamina_rule2)

[04:31] Substitution (Team_017): Bam Williamson OUT → Klay Holiday IN (stamina_rule2)

[04:31] Substitution (Team_054): Malcolm Harden OUT → Shaquille Irving IN (stamina_rule2)

[04:31] Substitution (Team_054): Lauri Irving OUT → Bradley Quickley IN (stamina_rule2)

[04:31] Substitution (Team_054): Vince Ball OUT → Vince James IN (stamina_rule2)

[04:31] Substitution (Team_054): Luka Brogdon OUT → Tobias Nowitzki IN (stamina_rule2)

[04:31] Substitution (Team_054): Blake Russell OUT → Devin Jackson IN (stamina_rule2)

[04:15] Team_054 possession (Score: 35-57)
Vince James attempts a Layup. Contested by Ja Stewart (5.5 feet, ZONE). VINCE JAMES MAKES IT!
Score: 35-59

[04:00] Team_017 possession (Score: 35-59)
FOUL! Shooting foul on Bradley Quickley. Tobias Bridges to the line for 2 free throws. [Team fouls: 1] (Bradley Quickley: 1 personal fouls)   FT 1/2: GOOD   FT 2/2: GOOD Tobias Bridges makes 2/2 from the line.
Score: 37-59

[03:45] Team_054 possession (Score: 37-59)
Vince James drives to the basket... Vince James loses control! Ball rolls out of bounds! TURNOVER! (dead ball)

[03:31] Team_017 possession (Score: 37-59)
Ja Stewart attempts a Midrange. Contested by Tobias Nowitzki (5.4 feet, MAN). Ja Stewart misses. Rebound secured by Tobias Nowitzki.

[03:16] Team_054 possession (Score: 37-59)
FOUL! Shooting foul on Blake Reaves. Shaquille Irving to the line for 2 free throws. [Team fouls: 4] (Blake Reaves: 1 personal fouls)   FT 1/2: GOOD   FT 2/2: GOOD Shaquille Irving makes 2/2 from the line.
Score: 37-61

[03:05] Team_017 possession (Score: 37-61)
Ja Stewart attempts a 3Pt. Contested by Vince James (4.5 feet, ZONE). Ja Stewart misses. Rebound secured by Devin Jackson.

[02:54] Team_054 possession (Score: 37-61)
Tobias Nowitzki attempts a Layup. Contested by Ja Stewart (4.7 feet, ZONE). TOBIAS NOWITZKI MAKES IT! Assist: Shaquille Irving
Score: 37-63

[02:36] Team_017 possession (Score: 37-63)
Blake Reaves attempts a Midrange. Contested by Shaquille Irving (4.6 feet, MAN). BLAKE REAVES MAKES IT! Assist: Tobias Bridges
Score: 39-63

[02:21] Team_054 possession (Score: 39-63)
Bradley Quickley drives and kicks out. Devin Jackson attempts a 3Pt. Contested by Klay Holiday (5.1 feet, MAN). Devin Jackson misses. Rebound secured by Shaquille Stewart.

[02:08] Team_017 possession (Score: 39-63)
FOUL! Shooting foul on Devin Jackson. Klay Holiday to the line for 2 free throws. [Team fouls: 2] (Devin Jackson: 1 personal fouls)   FT 1/2: GOOD   FT 2/2: MISS Klay Holiday makes 1/2 from the line. Offensive rebound by Shaquille Stewart! Shaquille Stewart kicks it out.
Score: 40-63

[01:54] Team_017 possession (Score: 40-63)
Shaquille Stewart drives to the basket... Shaquille Stewart loses control! Ball rolls out of bounds! TURNOVER! (dead ball)

[01:40] Team_054 possession (Score: 40-63)
Tobias Nowitzki makes the Layup and draws the foul on Ja Stewart! And-1! Tobias Nowitzki to the line for 1. [BONUS: 5 team fouls] (Ja Stewart: 1 personal fouls)   FT 1/1: GOOD Tobias Nowitzki makes 1/1 from the line.
Score: 40-66

[01:24] Team_017 possession (Score: 40-66)
FOUL! Reach-in foul on Vince James during the drive. [Team fouls: 3] No free throws, side out. (Vince James: 1 personal fouls)

[01:12] Team_017 possession (Score: 40-66)
FOUL! Reach-in foul on Tobias Nowitzki during the drive. [Team fouls: 4] No free throws, side out. (Tobias Nowitzki: 1 personal fouls)

[00:56] Team_017 possession (Score: 40-66)
Ja Stewart attempts a Layup. Contested by Devin Jackson (5.0 feet, ZONE). JA STEWART MAKES IT! Assist: Tobias Bridges
Score: 42-66

[00:43] Team_054 possession (Score: 42-66)
Vince James attempts a 3Pt. Contested by Tobias Bridges (4.8 feet, ZONE). VINCE JAMES MAKES IT! Assist: Shaquille Irving
Score: 42-69

[00:32] Team_017 possession (Score: 42-69)
Klay Holiday makes the Layup and draws the foul on Devin Jackson! And-1! Klay Holiday to the line for 1. [BONUS: 5 team fouls] (Devin Jackson: 2 personal fouls)   FT 1/1: GOOD Klay Holiday makes 1/1 from the line.
Score: 45-69

[00:23] Team_054 possession (Score: 45-69)
Devin Jackson drives and kicks out. Bradley Quickley attempts a 3Pt. Contested by Ja Stewart (4.7 feet, ZONE). BRADLEY QUICKLEY MAKES IT! Assist: Shaquille Irving
Score: 45-72

[00:11] Team_017 possession (Score: 45-72)
FOUL! Reach-in foul on Devin Jackson during the drive. [IN THE BONUS! 6 team fouls] Blake Reaves to the line for 2 free throws. (Devin Jackson: 3 personal fouls)   FT 1/2: GOOD   FT 2/2: GOOD Blake Reaves makes 2/2 from the line.
Score: 47-72

================================================================================
                              2ND QUARTER COMPLETE                              
================================================================================

2ND QUARTER SCORE: Team_017 20, Team_054 36

BOX SCORE:
================================================================================

Team_017
--------------------------------------------------------------------------------
Player                MIN  PTS  REB  AST  TO      FG   FG%      3P   3P%
--------------------------------------------------------------------------------
Tony Smith             20    4    3    1   0   2/4    50.0     0/0   0.0
Bam Williamson         20    4    1    0   0   2/2   100.0     0/0   0.0
Blake Reaves            4    4    0    0   0   2/2   100.0     0/0   0.0
Klay Holiday            4    3    0    0   0   1/1   100.0     0/0   0.0
Tobias Bridges          4    2    0    2   0   1/1   100.0     0/0   0.0
Ja Stewart              4    2    0    0   0   1/3    33.3     0/0   0.0
Kyrie Middleton        20    0    2    2   0   0/2     0.0     0/0   0.0
Desmond Reaves         20    0    0    0   0   0/2     0.0     0/0   0.0
Vince Banchero         20    0    0    1   0   0/1     0.0     0/0   0.0
Shaquille Stewart       4    0    2    0   0   0/0     0.0     0/0   0.0

TEAM: FG: 9/18 (50.0%), 3PT: 0/5 (0.0%), REB: 8 (2 off, 6 def), AST: 6, TO: 6
TEAM FOULS: 5 [Team_054 in BONUS]


Team_054
--------------------------------------------------------------------------------
Player                MIN  PTS  REB  AST  TO      FG   FG%      3P   3P%
--------------------------------------------------------------------------------
Vince Ball             20    6    3    2   0   2/4    50.0     0/0   0.0
Luka Brogdon           20    5    3    0   0   2/2   100.0     0/0   0.0
Lauri Irving           20    5    0    1   0   2/5    40.0     0/0   0.0
Vince James             4    5    0    0   0   2/2   100.0     0/0   0.0
Tobias Nowitzki         4    5    1    0   0   2/2   100.0     0/0   0.0
Malcolm Harden         20    3    0    0   0   1/1   100.0     0/0   0.0
Bradley Quickley        4    3    0    0   0   1/2    50.0     0/0   0.0
Blake Russell          20    2    2    1   0   1/1   100.0     0/0   0.0
Shaquille Irving        4    2    0    3   0   1/1   100.0     0/0   0.0
Devin Jackson           4    0    1    0   0   0/0     0.0     0/0   0.0

TEAM: FG: 14/20 (70.0%), 3PT: 4/7 (57.1%), REB: 10 (1 off, 9 def), AST: 7, TO: 3
TEAM FOULS: 6 [Team_017 in BONUS]

================================================================================

================================================================================
                       3RD QUARTER - Team_017 vs Team_054                       
================================================================================

[12:00] Team_017 possession (Score: 47-72)
Tony Smith attempts a Midrange. Contested by Vince Ball (4.7 feet, MAN). Tony Smith misses. Offensive rebound by Bam Williamson! Bam Williamson's putback is no good. Rebound secured by Blake Russell.

[11:51] Team_054 possession (Score: 47-72)
Luka Brogdon attempts a 3Pt. Contested by Kyrie Middleton (5.4 feet, MAN). Luka Brogdon misses. Rebound secured by Bam Williamson.

[11:37] Team_017 possession (Score: 47-72)
Bam Williamson makes the Midrange and draws the foul on Blake Russell! And-1! Bam Williamson to the line for 1. [Team fouls: 1] (Blake Russell: 1 personal fouls)   FT 1/1: GOOD Bam Williamson makes 1/1 from the line.
Score: 50-72

[11:22] Team_054 possession (Score: 50-72)
Vince Ball attempts a Midrange. Contested by Tony Smith (2.9 feet, MAN). VINCE BALL MAKES IT! Assist: Lauri Irving
Score: 50-74

[11:07] Team_017 possession (Score: 50-74)
FOUL! Reach-in foul on Vince Ball during the drive. [Team fouls: 2] No free throws, side out. (Vince Ball: 1 personal fouls)

[10:53] Team_017 possession (Score: 50-74)
Tony Smith attempts a Midrange. Contested by Vince Ball (4.7 feet, MAN). Tony Smith misses. Rebound secured by Blake Russell.

[10:38] Team_054 possession (Score: 50-74)
FOUL! Holding foul on Vince Banchero. [Team fouls: 1] No free throws, side out. (Vince Banchero: 1 personal fouls)

[10:24] Team_054 possession (Score: 50-74)
Vince Ball attempts a Midrange. Contested by Kyrie Middleton (5.1 feet, ZONE). Vince Ball misses. Rebound secured by Bam Williamson.

[10:08] Team_017 possession (Score: 50-74)
Kyrie Middleton attempts a 3Pt. Contested by Lauri Irving (3.7 feet, ZONE). Kyrie Middleton misses. Rebound secured by Luka Brogdon.

[09:54] Team_054 possession (Score: 50-74)
FOUL! Shooting foul on Bam Williamson. Luka Brogdon to the line for 2 free throws. [Team fouls: 2] (Bam Williamson: 1 personal fouls)   FT 1/2: MISS   FT 2/2: MISS Luka Brogdon makes 0/2 from the line. Rebound secured by Bam Williamson.

[09:40] Team_017 possession (Score: 50-74)
Tony Smith attempts a Midrange. Contested by Vince Ball (4.7 feet, MAN). TONY SMITH MAKES IT!
Score: 52-74

[09:26] Team_054 possession (Score: 52-74)
FOUL! Reach-in foul on Tony Smith during the drive. [Team fouls: 3] No free throws, side out. (Tony Smith: 1 personal fouls)

[09:13] Team_054 possession (Score: 52-74)
Luka Brogdon attempts a Layup. Contested by Bam Williamson (4.4 feet, ZONE). LUKA BROGDON MAKES IT! Assist: Malcolm Harden
Score: 52-76

[08:58] Team_017 possession (Score: 52-76)
Vince Banchero attempts a Midrange. Contested by Lauri Irving (3.4 feet, MAN). VINCE BANCHERO MAKES IT!
Score: 54-76

[08:44] Team_054 possession (Score: 54-76)
Vince Ball attempts a Layup. Contested by Tony Smith (2.9 feet, MAN). VINCE BALL MAKES IT!
Score: 54-78

[08:31] Team_017 possession (Score: 54-78)
Kyrie Middleton drives, Luka Brogdon stays with him. Kyrie Middleton attempts a Layup. Contested by Luka Brogdon (4.3 feet, MAN). KYRIE MIDDLETON MAKES IT!
Score: 56-78

[08:20] Team_054 possession (Score: 56-78)
Malcolm Harden makes the Dunk and draws the foul on Desmond Reaves! And-1! Malcolm Harden to the line for 1. [Team fouls: 4] (Desmond Reaves: 1 personal fouls)   FT 1/1: GOOD Malcolm Harden makes 1/1 from the line.
Score: 56-81

[08:02] Team_017 possession (Score: 56-81)
Tony Smith throws a bad pass out of bounds! TURNOVER! (dead ball)

[07:51] Team_054 possession (Score: 56-81)
Vince Ball drives, picks up Tony Smith. Help arrives from Vince Banchero! Vince Ball attempts a Dunk. Contested by Vince Banchero (2.9 feet, MAN). VINCE BALL MAKES IT!
Score: 56-83

[07:37] Team_017 possession (Score: 56-83)
Tony Smith attempts a 3Pt. Contested by Lauri Irving (4.0 feet, ZONE). Tony Smith misses. Rebound secured by Blake Russell.

[07:21] Team_054 possession (Score: 56-83)
Vince Ball attempts a 3Pt. Contested by Desmond Reaves (4.2 feet, ZONE). Vince Ball misses. Rebound secured by Bam Williamson.

[07:06] Team_017 possession (Score: 56-83)
Tony Smith makes the Midrange and draws the foul on Lauri Irving! And-1! Tony Smith to the line for 1. [Team fouls: 3] (Lauri Irving: 1 personal fouls)   FT 1/1: GOOD Tony Smith makes 1/1 from the line.
Score: 59-83

[06:54] Team_054 possession (Score: 59-83)
Luka Brogdon drives and kicks out. FOUL! Shooting foul on Desmond Reaves. Luka Brogdon to the line for 3 free throws. [BONUS: 5 team fouls] (Desmond Reaves: 2 personal fouls)   FT 1/3: GOOD   FT 2/3: GOOD   FT 3/3: MISS Luka Brogdon makes 2/3 from the line. Rebound secured by Tony Smith.
Score: 59-85

[06:37] Team_017 possession (Score: 59-85)
Tony Smith attempts a 3Pt. Contested by Vince Ball (4.7 feet, MAN). Tony Smith misses. Rebound secured by Blake Russell.

[06:19] Team_054 possession (Score: 59-85)
Blake Russell drives, picks up Bam Williamson. Help arrives from Vince Banchero! Blake Russell attempts a Dunk. Contested by Vince Banchero (4.5 feet, MAN). BLAKE RUSSELL MAKES IT!
Score: 59-87

[06:05] Team_017 possession (Score: 59-87)
Bam Williamson makes the Layup and draws the foul on Blake Russell! And-1! Bam Williamson to the line for 1. [Team fouls: 4] (Blake Russell: 2 personal fouls)   FT 1/1: MISS Bam Williamson makes 0/1 from the line. Rebound secured by Lauri Irving.
Score: 61-87

[05:50] Team_054 possession (Score: 61-87)
Blake Russell drives, Bam Williamson stays with him. Blake Russell attempts a Layup. Contested by Bam Williamson (4.5 feet, ZONE). BLAKE RUSSELL MAKES IT! Assist: Luka Brogdon
Score: 61-89

[05:39] Team_017 possession (Score: 61-89)
Kyrie Middleton attempts a 3Pt. Contested by Luka Brogdon (4.3 feet, MAN). Kyrie Middleton misses. Rebound secured by Luka Brogdon.

[05:25] Team_054 possession (Score: 61-89)
Blake Russell attempts a Midrange. Contested by Vince Banchero (4.5 feet, ZONE). Blake Russell misses. Rebound secured by Bam Williamson.

[05:14] Team_017 possession (Score: 61-89)
Bam Williamson attempts a Layup. Contested by Blake Russell (3.8 feet, ZONE). BAM WILLIAMSON MAKES IT! Assist: Tony Smith
Score: 63-89

[04:56] Team_054 possession (Score: 63-89)
Vince Ball attempts a 3Pt. Contested by Tony Smith (2.9 feet, MAN). Vince Ball misses. Rebound secured by Bam Williamson.

[04:46] Team_017 possession (Score: 63-89)
Desmond Reaves loses control! Ball rolls out of bounds! TURNOVER! (dead ball)

[04:31] Team_054 possession (Score: 63-89)
Blake Russell attempts a Midrange. Contested by Bam Williamson (4.6 feet, MAN). Blake Russell misses. Rebound secured by Kyrie Middleton.

[04:13] Team_017 possession (Score: 63-89)
Kyrie Middleton attempts a 3Pt. Contested by Lauri Irving (3.8 feet, ZONE). Kyrie Middleton misses. Offensive rebound by Kyrie Middleton! Kyrie Middleton kicks it out.

[03:55] Team_017 possession (Score: 63-89)
Vince Banchero attempts a Layup. BLOCKED BY BLAKE RUSSELL! Ball deflects out of bounds off Vince Banchero.

[03:41] Team_054 possession (Score: 63-89)
FOUL! Reach-in foul on Bam Williamson during the drive. [IN THE BONUS! 6 team fouls] Luka Brogdon to the line for 2 free throws. (Bam Williamson: 2 personal fouls)   FT 1/2: MISS   FT 2/2: MISS Luka Brogdon makes 0/2 from the line. Rebound secured by Bam Williamson.

[03:23] Team_017 possession (Score: 63-89)
Bam Williamson drives, Blake Russell stays with him. Bam Williamson attempts a Layup. Contested by Blake Russell (4.0 feet, MAN). BAM WILLIAMSON MAKES IT!
Score: 65-89

[03:08] Team_054 possession (Score: 65-89)
Malcolm Harden attempts a 3Pt. Contested by Tony Smith (3.2 feet, ZONE). Malcolm Harden misses. Rebound secured by Kyrie Middleton.

[02:50] Team_017 possession (Score: 65-89)
Vince Banchero drives, picks up Lauri Irving. Help arrives from Vince Ball! Vince Banchero attempts a Dunk. Contested by Vince Ball (3.6 feet, MAN). VINCE BANCHERO MAKES IT!
Score: 67-89

[02:38] Team_054 possession (Score: 67-89)
Malcolm Harden attempts a 3Pt. Contested by Tony Smith (3.3 feet, ZONE). Malcolm Harden misses. Rebound secured by Kyrie Middleton.

[02:23] Team_017 possession (Score: 67-89)
Kyrie Middleton attempts a Midrange. Contested by Luka Brogdon (4.5 feet, MAN). KYRIE MIDDLETON MAKES IT! Assist: Bam Williamson
Score: 69-89

[02:06] Team_054 possession (Score: 69-89)
Lauri Irving attempts a 3Pt. Contested by Tony Smith (3.6 feet, ZONE). Lauri Irving misses. Rebound secured by Kyrie Middleton.

[01:48] Team_017 possession (Score: 69-89)
Desmond Reaves attempts a Midrange. Contested by Malcolm Harden (4.9 feet, MAN). Desmond Reaves misses. Rebound secured by Luka Brogdon.

[01:39] Team_054 possession (Score: 69-89)
Malcolm Harden attempts a Midrange. Contested by Kyrie Middleton (5.6 feet, ZONE). Malcolm Harden misses. Rebound secured by Kyrie Middleton.

[01:24] Team_017 possession (Score: 69-89)
Vince Banchero attempts a 3Pt. Contested by Lauri Irving (3.8 feet, ZONE). Vince Banchero misses. Rebound secured by Vince Ball.

[01:13] Team_054 possession (Score: 69-89)
Luka Brogdon attempts a 3Pt. Contested by Kyrie Middleton (5.7 feet, MAN). Luka Brogdon misses. Offensive rebound by Blake Russell! Blake Russell puts it back in!
Score: 69-91

[01:01] Team_017 possession (Score: 69-91)
Bam Williamson drives to the basket... Bam Williamson loses control! Ball rolls out of bounds! TURNOVER! (dead ball)

[01:01] Substitution (Team_017): Desmond Reaves OUT → Blake Reaves IN (stamina_rule2)

[01:01] Substitution (Team_017): Vince Banchero OUT → Tobias Bridges IN (stamina_rule2)

[01:01] Substitution (Team_017): Tony Smith OUT → Shaquille Stewart IN (stamina_rule2)

[01:01] Substitution (Team_017): Kyrie Middleton OUT → Ja Stewart IN (stamina_rule2)

[01:01] Substitution (Team_017): Bam Williamson OUT → Klay Holiday IN (stamina_rule2)

[01:01] Substitution (Team_054): Malcolm Harden OUT → Shaquille Irving IN (stamina_rule2)

[01:01] Substitution (Team_054): Lauri Irving OUT → Bradley Quickley IN (stamina_rule2)

[01:01] Substitution (Team_054): Vince Ball OUT → Vince James IN (stamina_rule2)

[01:01] Substitution (Team_054): Luka Brogdon OUT → Tobias Nowitzki IN (stamina_rule2)

[01:01] Substitution (Team_054): Blake Russell OUT → Devin Jackson IN (stamina_rule2)

[00:51] Team_054 possession (Score: 69-91)
Tobias Nowitzki attempts a 3Pt. Contested by Tobias Bridges (4.0 feet, ZONE). TOBIAS NOWITZKI MAKES IT!
Score: 69-94

[00:34] Team_017 possession (Score: 69-94)
Shaquille Stewart attempts a 3Pt. Contested by Vince James (5.3 feet, MAN). SHAQUILLE STEWART MAKES IT! Assist: Tobias Bridges
Score: 72-94

[00:23] Team_054 possession (Score: 72-94)
FOUL! Shooting foul on Tobias Bridges. Vince James to the line for 2 free throws. [BONUS: 7 team fouls] (Tobias Bridges: 1 personal fouls)   FT 1/2: MISS   FT 2/2: GOOD Vince James makes 1/2 from the line.
Score: 72-95

[00:09] Team_017 possession (Score: 72-95)
Shaquille Stewart attempts a 3Pt. Contested by Vince James (5.3 feet, MAN). Shaquille Stewart misses. Rebound secured by Vince James.

================================================================================
                              3RD QUARTER COMPLETE                              
================================================================================

3RD QUARTER SCORE: Team_017 25, Team_054 23

BOX SCORE:
================================================================================

Team_017
--------------------------------------------------------------------------------
Player                MIN  PTS  REB  AST  TO      FG   FG%      3P   3P%
--------------------------------------------------------------------------------
Bam Williamson         31    7    7    1   0   3/4    75.0     0/0   0.0
Tony Smith             31    5    1    1   0   2/6    33.3     0/0   0.0
Kyrie Middleton        31    4    6    0   0   2/4    50.0     0/0   0.0
Vince Banchero         31    4    0    0   0   2/4    50.0     0/0   0.0
Shaquille Stewart       5    3    0    0   0   1/2    50.0     0/0   0.0
Desmond Reaves         31    0    0    0   0   0/1     0.0     0/0   0.0
Tobias Bridges          5    0    0    1   0   0/0     0.0     0/0   0.0

TEAM: FG: 10/21 (47.6%), 3PT: 1/7 (14.3%), REB: 15 (2 off, 13 def), AST: 3, TO: 3
TEAM FOULS: 7 [Team_054 in BONUS]


Team_054
--------------------------------------------------------------------------------
Player                MIN  PTS  REB  AST  TO      FG   FG%      3P   3P%
--------------------------------------------------------------------------------
Blake Russell          31    6    5    0   0   3/5    60.0     0/0   0.0
Vince Ball             31    6    1    0   0   3/6    50.0     0/0   0.0
Malcolm Harden         31    3    0    1   0   1/4    25.0     0/0   0.0
Tobias Nowitzki         5    3    0    0   0   1/1   100.0     0/0   0.0
Luka Brogdon           31    2    3    1   0   1/5    20.0     0/0   0.0
Vince James             5    1    1    0   0   1/1   100.0     0/0   0.0
Lauri Irving           31    0    1    1   0   0/1     0.0     0/0   0.0

TEAM: FG: 10/23 (43.5%), 3PT: 2/8 (25.0%), REB: 10 (1 off, 9 def), AST: 3, TO: 0
TEAM FOULS: 4

================================================================================

================================================================================
                       4TH QUARTER - Team_017 vs Team_054                       
================================================================================

[12:00] Substitution (Team_017): Desmond Reaves OUT (stamina: 73) → Blake Reaves IN (comeback_detected)

[12:00] Substitution (Team_054): Malcolm Harden OUT (stamina: 74) → Shaquille Irving IN (comeback_detected)

[12:00] Team_017 possession (Score: 72-95)
FOUL! Offensive foul on Blake Reaves! Shaquille Irving drew the charge! [Team fouls: 1] (Blake Reaves: 1 personal fouls) TURNOVER! (dead ball)

[11:50] Team_054 possession (Score: 72-95)
FOUL! Holding foul on Vince Banchero. [Team fouls: 2] No free throws, side out. (Vince Banchero: 1 personal fouls)

[11:40] Team_054 possession (Score: 72-95)
Vince Ball drives and kicks out. Blake Russell attempts a Midrange. Contested by Bam Williamson (4.3 feet, MAN). BLAKE RUSSELL MAKES IT! Assist: Luka Brogdon
Score: 72-97

[11:25] Team_017 possession (Score: 72-97)
Tony Smith attempts a Midrange. Contested by Vince Ball (4.8 feet, MAN). Tony Smith misses. Rebound secured by Luka Brogdon.

[11:09] Team_054 possession (Score: 72-97)
Luka Brogdon attempts a Midrange. Contested by Kyrie Middleton (5.6 feet, ZONE). LUKA BROGDON MAKES IT! Assist: Lauri Irving
Score: 72-99

[10:57] Team_017 possession (Score: 72-99)
Bam Williamson attempts a Dunk. BLOCKED BY BLAKE RUSSELL! Ball is loose! Rebound secured by Blake Russell.

[10:38] Team_054 possession (Score: 72-99)
Lauri Irving attempts a 3Pt. Contested by Tony Smith (3.6 feet, ZONE). Lauri Irving misses. Rebound secured by Bam Williamson.

[10:26] Team_017 possession (Score: 72-99)
Blake Reaves attempts a Layup. Contested by Shaquille Irving (4.6 feet, MAN). BLAKE REAVES MAKES IT! Assist: Tony Smith
Score: 74-99

[10:13] Team_054 possession (Score: 74-99)
Lauri Irving drives, Bam Williamson stays with him. Lauri Irving attempts a Layup. Contested by Bam Williamson (5.0 feet, ZONE). LAURI IRVING MAKES IT! Assist: Shaquille Irving
Score: 74-101

[09:57] Team_017 possession (Score: 74-101)
FOUL! Shooting foul on Blake Russell. Bam Williamson to the line for 2 free throws. [Team fouls: 1] (Blake Russell: 1 personal fouls)   FT 1/2: GOOD   FT 2/2: MISS Bam Williamson makes 1/2 from the line. Rebound secured by Vince Ball.
Score: 75-101

[09:45] Team_054 possession (Score: 75-101)
Shaquille Irving attempts a 3Pt. Contested by Blake Reaves (5.7 feet, MAN). Shaquille Irving misses. Offensive rebound by Blake Russell! Blake Russell puts it back in!
Score: 75-103

[09:27] Team_017 possession (Score: 75-103)
Tony Smith attempts a Layup. Contested by Blake Russell (4.2 feet, ZONE). TONY SMITH MAKES IT! Assist: Vince Banchero
Score: 77-103

[09:11] Team_054 possession (Score: 77-103)
Luka Brogdon attempts a 3Pt. Contested by Vince Banchero (4.8 feet, ZONE). LUKA BROGDON MAKES IT! Assist: Lauri Irving
Score: 77-106

[08:56] Team_017 possession (Score: 77-106)
Blake Reaves attempts a Layup. Contested by Shaquille Irving (4.6 feet, MAN). BLAKE REAVES MAKES IT! Assist: Bam Williamson
Score: 79-106

[08:45] Team_054 possession (Score: 79-106)
Blake Russell drives to the basket... FOUL! Offensive foul on Blake Russell! Bam Williamson drew the charge! [Team fouls: 2] (Blake Russell: 2 personal fouls) TURNOVER! (dead ball)

[08:33] Team_017 possession (Score: 79-106)
Vince Banchero makes the Layup and draws the foul on Lauri Irving! And-1! Vince Banchero to the line for 1. [Team fouls: 3] (Lauri Irving: 1 personal fouls)   FT 1/1: GOOD Vince Banchero makes 1/1 from the line.
Score: 82-106

[08:18] Team_054 possession (Score: 82-106)
Lauri Irving attempts a Layup. BLOCKED BY BAM WILLIAMSON! Ball deflects out of bounds off Lauri Irving.

[08:01] Team_017 possession (Score: 82-106)
FOUL! Offensive foul on Tony Smith! Vince Ball drew the charge! [Team fouls: 3] (Tony Smith: 1 personal fouls) TURNOVER! (dead ball)

[07:45] Team_054 possession (Score: 82-106)
Lauri Irving attempts a 3Pt. Contested by Vince Banchero (5.1 feet, ZONE). Lauri Irving misses. Rebound secured by Bam Williamson.

[07:32] Team_017 possession (Score: 82-106)
Bam Williamson drives and kicks out. Blake Reaves attempts a 3Pt. Contested by Shaquille Irving (4.6 feet, ZONE). Blake Reaves misses. Rebound secured by Blake Russell.

[07:21] Team_054 possession (Score: 82-106)
Luka Brogdon attempts a Midrange. Contested by Kyrie Middleton (5.9 feet, MAN). Luka Brogdon misses. Rebound secured by Bam Williamson.

[07:12] Team_017 possession (Score: 82-106)
Tony Smith attempts a 3Pt. Contested by Shaquille Irving (5.0 feet, ZONE). Tony Smith misses. Offensive rebound by Bam Williamson! Bam Williamson kicks it out.

[07:01] Team_017 possession (Score: 82-106)
Kyrie Middleton attempts a 3Pt. Contested by Shaquille Irving (4.8 feet, ZONE). Kyrie Middleton misses. Rebound secured by Vince Ball.

[06:45] Team_054 possession (Score: 82-106)
Blake Russell attempts a 3Pt. Contested by Bam Williamson (5.3 feet, MAN). Blake Russell misses. Rebound secured by Kyrie Middleton.

[06:33] Team_017 possession (Score: 82-106)
Vince Banchero attempts a 3Pt. Contested by Shaquille Irving (4.5 feet, ZONE). VINCE BANCHERO MAKES IT! Assist: Kyrie Middleton
Score: 85-106

[06:18] Team_054 possession (Score: 85-106)
FOUL! Shooting foul on Bam Williamson. Blake Russell to the line for 2 free throws. [Team fouls: 4] (Bam Williamson: 1 personal fouls)   FT 1/2: GOOD   FT 2/2: GOOD Blake Russell makes 2/2 from the line.
Score: 85-108

[06:04] Team_017 possession (Score: 85-108)
Blake Reaves attempts a 3Pt. Contested by Luka Brogdon (4.8 feet, ZONE). Blake Reaves misses. Rebound secured by Blake Russell.

[05:48] Team_054 possession (Score: 85-108)
Lauri Irving drives, Bam Williamson stays with him. Lauri Irving attempts a Dunk. Contested by Bam Williamson (5.5 feet, ZONE). LAURI IRVING MAKES IT!
Score: 85-110

[05:33] Team_017 possession (Score: 85-110)
FOUL! Holding foul on Vince Ball. [Team fouls: 4] No free throws, side out. (Vince Ball: 1 personal fouls)

[05:18] Team_017 possession (Score: 85-110)
Blake Reaves attempts a 3Pt. Contested by Shaquille Irving (4.6 feet, ZONE). Blake Reaves misses. Rebound secured by Vince Ball.

[05:00] Team_054 possession (Score: 85-110)
Blake Russell attempts a Layup. Contested by Bam Williamson (5.5 feet, MAN). BLAKE RUSSELL MAKES IT! Assist: Shaquille Irving
Score: 85-112

[04:41] Team_017 possession (Score: 85-112)
FOUL! Shooting foul on Lauri Irving. Bam Williamson to the line for 2 free throws. [BONUS: 5 team fouls] (Lauri Irving: 2 personal fouls)   FT 1/2: GOOD   FT 2/2: MISS Bam Williamson makes 1/2 from the line. Rebound secured by Vince Ball.
Score: 86-112

[04:29] Team_054 possession (Score: 86-112)
Shaquille Irving throws a bad pass! Stolen by Blake Reaves! TURNOVER! (live ball)

[04:13] Team_017 possession (Score: 86-112)
Kyrie Middleton makes the Layup and draws the foul on Luka Brogdon! And-1! Kyrie Middleton to the line for 1. [BONUS: 6 team fouls] (Luka Brogdon: 1 personal fouls)   FT 1/1: GOOD Kyrie Middleton makes 1/1 from the line.
Score: 89-112

[03:56] Team_054 possession (Score: 89-112)
Vince Ball attempts a Layup. Contested by Tony Smith (4.2 feet, MAN). Vince Ball misses. Rebound secured by Bam Williamson.

[03:39] Team_017 possession (Score: 89-112)
FOUL! Shooting foul on Lauri Irving. Blake Reaves to the line for 2 free throws. [BONUS: 7 team fouls] (Lauri Irving: 3 personal fouls)   FT 1/2: GOOD   FT 2/2: GOOD Blake Reaves makes 2/2 from the line.
Score: 91-112

[03:27] Team_054 possession (Score: 91-112)
Shaquille Irving drives, Kyrie Middleton stays with him. Shaquille Irving attempts a Dunk. Wide open! Kyrie Middleton is 6.6 feet away. [ZONE] SHAQUILLE IRVING MAKES IT!
Score: 91-114

[03:12] Team_017 possession (Score: 91-114)
Blake Reaves attempts a Midrange. Contested by Shaquille Irving (4.8 feet, MAN). BLAKE REAVES MAKES IT! Assist: Bam Williamson
Score: 93-114

[02:54] Team_054 possession (Score: 93-114)
Shaquille Irving drives, Kyrie Middleton stays with him. Shaquille Irving attempts a Dunk. Wide open! Kyrie Middleton is 6.7 feet away. [ZONE] SHAQUILLE IRVING MAKES IT! Assist: Lauri Irving
Score: 93-116

[02:41] Team_017 possession (Score: 93-116)
Vince Banchero drives, Lauri Irving stays with him. Vince Banchero attempts a Layup. Contested by Lauri Irving (4.8 feet, MAN). VINCE BANCHERO MAKES IT! Assist: Bam Williamson
Score: 95-116

[02:22] Team_054 possession (Score: 95-116)
Luka Brogdon attempts a 3Pt. Contested by Tony Smith (4.6 feet, ZONE). Luka Brogdon misses. Rebound secured by Kyrie Middleton.

[02:07] Team_017 possession (Score: 95-116)
Tony Smith attempts a 3Pt. Contested by Vince Ball (5.6 feet, MAN). Tony Smith misses. Rebound secured by Luka Brogdon.

[01:53] Team_054 possession (Score: 95-116)
Vince Ball makes the Layup and draws the foul on Tony Smith! And-1! Vince Ball to the line for 1. [BONUS: 5 team fouls] (Tony Smith: 2 personal fouls)   FT 1/1: MISS Vince Ball makes 0/1 from the line. Rebound secured by Kyrie Middleton.
Score: 95-118

[01:37] Team_017 possession (Score: 95-118)
Blake Reaves attempts a 3Pt. Contested by Shaquille Irving (4.9 feet, ZONE). BLAKE REAVES MAKES IT! Assist: Tony Smith
Score: 98-118

[01:20] Team_054 possession (Score: 98-118)
Luka Brogdon attempts a Midrange. Contested by Vince Banchero (5.8 feet, ZONE). LUKA BROGDON MAKES IT!
Score: 98-120

[01:06] Team_017 possession (Score: 98-120)
FOUL! Shooting foul on Blake Russell. Bam Williamson to the line for 2 free throws. [BONUS: 8 team fouls] (Blake Russell: 3 personal fouls)   FT 1/2: GOOD   FT 2/2: GOOD Bam Williamson makes 2/2 from the line.
Score: 100-120

[00:50] Team_054 possession (Score: 100-120)
Shaquille Irving attempts a 3Pt. Contested by Tony Smith (5.2 feet, ZONE). Shaquille Irving misses. Rebound secured by Bam Williamson.

[00:33] Team_017 possession (Score: 100-120)
Tony Smith attempts a Midrange. Contested by Lauri Irving (5.6 feet, ZONE). Tony Smith misses. Rebound secured by Blake Russell.

[00:19] Team_054 possession (Score: 100-120)
Luka Brogdon drives to the basket... Luka Brogdon loses the ball! Stripped by Kyrie Middleton! TURNOVER! (live ball)

[00:02] Team_017 possession (Score: 100-120)
Vince Banchero attempts a Layup. Contested by Blake Russell (5.2 feet, ZONE). VINCE BANCHERO MAKES IT! Assist: Blake Reaves
Score: 102-120

================================================================================
                              4TH QUARTER COMPLETE                              
================================================================================

4TH QUARTER SCORE: Team_017 30, Team_054 25

BOX SCORE:
================================================================================

Team_017
--------------------------------------------------------------------------------
Player                MIN  PTS  REB  AST  TO      FG   FG%      3P   3P%
--------------------------------------------------------------------------------
Blake Reaves           18   11    0    1   0   5/7    71.4     0/0   0.0
Vince Banchero         43   10    0    1   0   4/4   100.0     0/0   0.0
Kyrie Middleton        43    3    3    1   0   1/2    50.0     0/0   0.0
Tony Smith             43    2    0    2   0   1/4    25.0     0/0   0.0
Bam Williamson         43    2    6    3   0   1/5    20.0     0/0   0.0

TEAM: FG: 12/22 (54.5%), 3PT: 2/6 (33.3%), REB: 9 (1 off, 8 def), AST: 8, TO: 2
TEAM FOULS: 5 [Team_054 in BONUS]


Team_054
--------------------------------------------------------------------------------
Player                MIN  PTS  REB  AST  TO      FG   FG%      3P   3P%
--------------------------------------------------------------------------------
Blake Russell          43    8    5    0   0   4/5    80.0     0/0   0.0
Luka Brogdon           43    7    2    1   0   3/5    60.0     0/0   0.0
Lauri Irving           43    4    0    3   0   2/5    40.0     0/0   0.0
Shaquille Irving       18    4    0    2   0   2/3    66.7     0/0   0.0
Vince Ball             43    0    4    0   0   0/2     0.0     0/0   0.0

TEAM: FG: 11/20 (55.0%), 3PT: 2/7 (28.6%), REB: 11 (1 off, 10 def), AST: 6, TO: 3
TEAM FOULS: 8 [Team_017 in BONUS]

================================================================================

================================================================================
                               FULL GAME COMPLETE                               
================================================================================

FINAL SCORE: Team_017 102, Team_054 120

SCORING BY QUARTER:
--------------------------------------------------------------------------------
Team                     Q1     Q2     Q3     Q4    FINAL
--------------------------------------------------------------------------------
Team_017                 27     20     25     30      102
Team_054                 36     36     23     25      120
--------------------------------------------------------------------------------

FULL GAME BOX SCORE:
================================================================================

Team_017
--------------------------------------------------------------------------------
Player                MIN  PTS  REB  AST  TO      FG   FG%      3P   3P%      FT STL BLK
--------------------------------------------------------------------------------
Vince Banchero         43   14    0    3   1   6/11   54.5   1/3    33.3   1/1     0   0
Tony Smith             43   20    5    4   4  10/24   41.7   2/10   20.0   3/3     0   0
Kyrie Middleton        43   14   14    3   1   6/13   46.2   0/3     0.0   2/2     3   0
Bam Williamson         43   17   17    5   1   7/13   53.8   0/1     0.0   5/8     1   1
Desmond Reaves         31    5    0    0   3   2/8    25.0   1/4    25.0   3/4     0   0
Blake Reaves           18   15    0    1   1   7/9    77.8   1/3    33.3   4/4     1   0
Tobias Bridges          5    2    0    3   0   1/1   100.0   0/0     0.0   2/2     0   0
Shaquille Stewart       5    3    2    0   0   1/2    50.0   1/2    50.0   0/0     0   0
Ja Stewart              5    2    0    0   0   1/3    33.3   0/1     0.0   0/0     0   0
Klay Holiday            5    3    0    0   1   1/1   100.0   0/0     0.0   2/3     0   0

TEAM: FG: 42/85 (49.4%), 3PT: 6/27 (22.2%), REB: 39 (6 off, 33 def), AST: 19, TO: 12


Team_054
--------------------------------------------------------------------------------
Player                MIN  PTS  REB  AST  TO      FG   FG%      3P   3P%      FT STL BLK
--------------------------------------------------------------------------------
Lauri Irving           43   14    3    6   2   5/12   41.7   1/7    14.3   0/0     0   0
Vince Ball             43   19    9    3   2  10/20   50.0   2/7    28.6   4/5     0   0
Luka Brogdon           43   30   12    3   3  12/19   63.2   4/6    66.7   4/9     0   1
Blake Russell          43   18   18    4   0   7/11   63.6   0/1     0.0   2/2     2   2
Malcolm Harden         31   12    0    3   1   4/8    50.0   1/4    25.0   3/3     2   0
Shaquille Irving       18    6    0    5   1   4/5    80.0   1/2    50.0   2/2     0   0
Bradley Quickley        5    3    0    0   1   0/1     0.0   0/0     0.0   0/0     0   0
Vince James             5    6    1    0   0   3/3   100.0   1/1   100.0   1/2     0   0
Tobias Nowitzki         5    8    1    0   0   3/3   100.0   1/1   100.0   1/1     0   0
Devin Jackson           5    0    1    0   0   1/1   100.0   0/0     0.0   0/0     0   0

TEAM: FG: 49/83 (59.0%), 3PT: 11/29 (37.9%), REB: 44 (3 off, 41 def), AST: 24, TO: 10

================================================================================
