================================================================================
                        FULL GAME - Team_039 vs Team_004                        
================================================================================

================================================================================
                       1ST QUARTER - Team_039 vs Team_004                       
================================================================================

[12:00] Team_039 possession (Score: 0-0)
Anfernee Carter attempts a 3Pt. Contested by Draymond Fox (4.4 feet, MAN). ANFERNEE CARTER MAKES IT! Assist: Austin O'Neal
Score: 3-0

[11:46] Team_004 possession (Score: 3-0)
FOUL! Shooting foul on Klay Wade. Draymond Fox to the line for 2 free throws. [Team fouls: 1] (Klay Wade: 1 personal fouls)   FT 1/2: MISS   FT 2/2: GOOD Draymond Fox makes 1/2 from the line.
Score: 3-1

[11:27] Team_039 possession (Score: 3-1)
Anfernee Carter attempts a 3Pt. Contested by Michael Curry (5.2 feet, ZONE). ANFERNEE CARTER MAKES IT! Assist: Klay Wade
Score: 6-1

[11:12] Team_004 possession (Score: 6-1)
Draymond Fox attempts a Layup. BLOCKED BY DONOVAN MARKKANEN! Ball deflects out of bounds off Draymond Fox.

[10:54] Team_039 possession (Score: 6-1)
Donovan Markkanen drives, Jabari Wade stays with him. Donovan Markkanen attempts a Layup. Contested by Jabari Wade (4.9 feet, MAN). DONOVAN MARKKANEN MAKES IT! Assist: Jrue Bridges
Score: 8-1

[10:38] Team_004 possession (Score: 8-1)
Michael Curry attempts a 3Pt. Contested by Jrue Bridges (3.2 feet, MAN). Michael Curry misses. Rebound secured by Donovan Markkanen.

[10:23] Team_039 possession (Score: 8-1)
Klay Wade attempts a 3Pt. Contested by Michael Curry (5.6 feet, ZONE). Klay Wade misses. Rebound secured by Draymond Fox.

[10:10] Team_004 possession (Score: 8-1)
Dwyane Irving drives to the basket... Dwyane Irving loses the ball! Stripped by Austin O'Neal! TURNOVER! (live ball)

[09:57] Team_039 possession (Score: 8-1)
Donovan Markkanen attempts a Layup. Contested by Jabari Wade (4.9 feet, MAN). Donovan Markkanen misses. Offensive rebound by Austin O'Neal! Austin O'Neal kicks it out.

[09:43] Team_039 possession (Score: 8-1)
Jrue Bridges drives, picks up Michael Curry. Help arrives from Dwyane Irving! Jrue Bridges attempts a Layup. Contested by Dwyane Irving (5.2 feet, MAN). JRUE BRIDGES MAKES IT! Assist: Donovan Markkanen
Score: 10-1

[09:28] Team_004 possession (Score: 10-1)
Dwyane Irving attempts a Layup. Contested by Klay Wade (4.3 feet, ZONE). DWYANE IRVING MAKES IT!
Score: 10-3

[09:13] Team_039 possession (Score: 10-3)
Austin O'Neal drives, Anthony Lillard stays with him. Austin O'Neal attempts a Dunk. Contested by Anthony Lillard (4.2 feet, ZONE). AUSTIN O'NEAL MAKES IT! Assist: Klay Wade
Score: 12-3

[08:55] Team_004 possession (Score: 12-3)
Anthony Lillard attempts a 3Pt. Contested by Klay Wade (4.4 feet, MAN). Anthony Lillard misses. Rebound secured by Donovan Markkanen.

[08:42] Team_039 possession (Score: 12-3)
Jrue Bridges attempts a 3Pt. Contested by Michael Curry (5.2 feet, MAN). Jrue Bridges misses. Rebound secured by Dwyane Irving.

[08:25] Team_004 possession (Score: 12-3)
FOUL! Offensive foul on Draymond Fox! Klay Wade drew the charge! [Team fouls: 1] (Draymond Fox: 1 personal fouls) TURNOVER! (dead ball)

[08:08] Team_039 possession (Score: 12-3)
Donovan Markkanen attempts a Midrange. Contested by Jabari Wade (4.9 feet, ZONE). DONOVAN MARKKANEN MAKES IT! Assist: Anfernee Carter
Score: 14-3

[07:52] Team_004 possession (Score: 14-3)
Jabari Wade attempts a Midrange. Contested by Donovan Markkanen (4.4 feet, MAN). Jabari Wade misses. Rebound secured by Donovan Markkanen.

[07:35] Team_039 possession (Score: 14-3)
FOUL! Shooting foul on Jabari Wade. Donovan Markkanen to the line for 3 free throws. [Team fouls: 2] (Jabari Wade: 1 personal fouls)   FT 1/3: GOOD   FT 2/3: MISS   FT 3/3: MISS Donovan Markkanen makes 1/3 from the line. Rebound secured by Anthony Lillard.
Score: 15-3

[07:21] Team_004 possession (Score: 15-3)
Anthony Lillard attempts a Layup. Contested by Klay Wade (4.4 feet, MAN). Anthony Lillard misses. Offensive rebound by Anthony Lillard! Anthony Lillard kicks it out.

[07:03] Team_004 possession (Score: 15-3)
Michael Curry attempts a 3Pt. Contested by Jrue Bridges (3.2 feet, ZONE). Michael Curry misses. Rebound secured by Klay Wade.

[06:51] Team_039 possession (Score: 15-3)
Donovan Markkanen drives and kicks out. Jrue Bridges attempts a Midrange. Contested by Draymond Fox (4.1 feet, ZONE). JRUE BRIDGES MAKES IT! Assist: Anfernee Carter
Score: 17-3

[06:34] Team_004 possession (Score: 17-3)
Jabari Wade attempts a Midrange. Contested by Donovan Markkanen (4.4 feet, MAN). Jabari Wade misses. Rebound secured by Klay Wade.

[06:19] Team_039 possession (Score: 17-3)
Jrue Bridges attempts a 3Pt. Contested by Michael Curry (5.2 feet, MAN). Jrue Bridges misses. Rebound secured by Dwyane Irving.

[06:04] Team_004 possession (Score: 17-3)
Anthony Lillard attempts a Layup. Contested by Klay Wade (4.4 feet, ZONE). Anthony Lillard misses. Rebound secured by Klay Wade.

[05:50] Team_039 possession (Score: 17-3)
Austin O'Neal attempts a Midrange. Contested by Dwyane Irving (3.7 feet, MAN). Austin O'Neal misses. Rebound secured by Dwyane Irving.

[05:38] Team_004 possession (Score: 17-3)
Michael Curry attempts a 3Pt. Contested by Jrue Bridges (3.2 feet, MAN). MICHAEL CURRY MAKES IT! Assist: Dwyane Irving
Score: 17-6

[05:22] Team_039 possession (Score: 17-6)
Donovan Markkanen attempts a Layup. Contested by Anthony Lillard (4.4 feet, ZONE). Donovan Markkanen misses. Rebound secured by Dwyane Irving.

[05:04] Team_004 possession (Score: 17-6)
Anthony Lillard attempts a Layup. Contested by Klay Wade (4.4 feet, MAN). Anthony Lillard misses. Rebound secured by Austin O'Neal.

[04:50] Team_039 possession (Score: 17-6)
Klay Wade attempts a Layup. Contested by Anthony Lillard (4.7 feet, ZONE). KLAY WADE MAKES IT!
Score: 19-6

[04:35] Team_004 possession (Score: 19-6)
FOUL! Shooting foul on Klay Wade. Draymond Fox to the line for 3 free throws. [Team fouls: 2] (Klay Wade: 2 personal fouls)   FT 1/3: GOOD   FT 2/3: MISS   FT 3/3: GOOD Draymond Fox makes 2/3 from the line.
Score: 19-8

[04:23] Team_039 possession (Score: 19-8)
Jrue Bridges attempts a 3Pt. Contested by Michael Curry (5.3 feet, ZONE). JRUE BRIDGES MAKES IT! Assist: Klay Wade
Score: 22-8

[04:09] Team_004 possession (Score: 22-8)
Draymond Fox drives, Klay Wade stays with him. Draymond Fox attempts a Layup. Contested by Klay Wade (4.4 feet, ZONE). Draymond Fox misses. Offensive rebound by Draymond Fox! Draymond Fox kicks it out.

[03:58] Team_004 possession (Score: 22-8)
Dwyane Irving attempts a 3Pt. Contested by Donovan Markkanen (4.1 feet, ZONE). DWYANE IRVING MAKES IT! Assist: Draymond Fox
Score: 22-11

[03:44] Team_039 possession (Score: 22-11)
Austin O'Neal attempts a Layup. Contested by Anthony Lillard (4.4 feet, ZONE). Austin O'Neal misses. Rebound secured by Draymond Fox.

[03:31] Team_004 possession (Score: 22-11)
Michael Curry attempts a Midrange. Contested by Donovan Markkanen (4.0 feet, ZONE). MICHAEL CURRY MAKES IT! Assist: Dwyane Irving
Score: 22-13

[03:14] Team_039 possession (Score: 22-13)
Jrue Bridges attempts a 3Pt. Contested by Michael Curry (5.3 feet, ZONE). JRUE BRIDGES MAKES IT! Assist: Klay Wade
Score: 25-13

[03:00] Team_004 possession (Score: 25-13)
Jabari Wade attempts a 3Pt. Contested by Jrue Bridges (4.0 feet, ZONE). JABARI WADE MAKES IT! Assist: Dwyane Irving
Score: 25-16

[02:41] Team_039 possession (Score: 25-16)
Jrue Bridges attempts a Midrange. Contested by Michael Curry (5.4 feet, MAN). Jrue Bridges misses. Offensive rebound by Austin O'Neal! Austin O'Neal kicks it out.

[02:30] Team_039 possession (Score: 25-16)
Anfernee Carter attempts a 3Pt. Contested by Draymond Fox (4.6 feet, MAN). Anfernee Carter misses. Rebound secured by Draymond Fox.

[02:19] Team_004 possession (Score: 25-16)
Dwyane Irving attempts a Midrange. Contested by Donovan Markkanen (4.2 feet, ZONE). Dwyane Irving misses. Rebound secured by Austin O'Neal.

[02:04] Team_039 possession (Score: 25-16)
Anfernee Carter attempts a Layup. Contested by Anthony Lillard (4.7 feet, ZONE). ANFERNEE CARTER MAKES IT! Assist: Jrue Bridges
Score: 27-16

[01:46] Team_004 possession (Score: 27-16)
Michael Curry attempts a Layup. Contested by Klay Wade (4.4 feet, ZONE). Michael Curry misses. Rebound secured by Donovan Markkanen.

[01:37] Team_039 possession (Score: 27-16)
Klay Wade drives, Anthony Lillard stays with him. Klay Wade attempts a Dunk. Contested by Anthony Lillard (5.0 feet, ZONE). KLAY WADE MAKES IT!
Score: 29-16

[01:24] Team_004 possession (Score: 29-16)
Anthony Lillard makes the Midrange and draws the foul on Donovan Markkanen! And-1! Anthony Lillard to the line for 1. [Team fouls: 3] (Donovan Markkanen: 1 personal fouls)   FT 1/1: MISS Anthony Lillard makes 0/1 from the line. Offensive rebound by Dwyane Irving! Dwyane Irving kicks it out.
Score: 29-18

[01:05] Team_004 possession (Score: 29-18)
Dwyane Irving drives, Austin O'Neal stays with him. Dwyane Irving attempts a Layup. Contested by Austin O'Neal (4.7 feet, MAN). Dwyane Irving misses. Rebound secured by Austin O'Neal.

[00:50] Team_039 possession (Score: 29-18)
Anfernee Carter attempts a 3Pt. Contested by Michael Curry (5.6 feet, ZONE). ANFERNEE CARTER MAKES IT! Assist: Austin O'Neal
Score: 32-18

[00:33] Team_004 possession (Score: 32-18)
Draymond Fox attempts a Midrange. Wide open! Anfernee Carter is 7.3 feet away. [ZONE] DRAYMOND FOX MAKES IT! Assist: Jabari Wade
Score: 32-20

[00:18] Team_039 possession (Score: 32-20)
Donovan Markkanen attempts a 3Pt. Contested by Michael Curry (5.6 feet, ZONE). Donovan Markkanen misses. Rebound secured by Dwyane Irving.

[00:04] Team_004 possession (Score: 32-20)
Michael Curry attempts a 3Pt. Contested by Austin O'Neal (4.6 feet, ZONE). Michael Curry misses. Offensive rebound by Dwyane Irving! Dwyane Irving kicks it out.

================================================================================
                              1ST QUARTER COMPLETE                              
================================================================================

1ST QUARTER SCORE: Team_039 32, Team_004 20

BOX SCORE:
================================================================================

Team_039
--------------------------------------------------------------------------------
Player                MIN  PTS  REB  AST  TO      FG   FG%      3P   3P%
--------------------------------------------------------------------------------
Anfernee Carter        12   11    0    2   0   4/5    80.0     0/0   0.0
Jrue Bridges           12   10    0    2   0   4/6    66.7     0/0   0.0
Klay Wade              12    4    3    4   0   2/3    66.7     0/0   0.0
Donovan Markkanen      12    4    4    1   0   2/5    40.0     0/0   0.0
Austin O'Neal          12    2    5    2   0   1/3    33.3     0/0   0.0

TEAM: FG: 13/22 (59.1%), 3PT: 5/11 (45.5%), REB: 12 (2 off, 10 def), AST: 11, TO: 0
TEAM FOULS: 3


Team_004
--------------------------------------------------------------------------------
Player                MIN  PTS  REB  AST  TO      FG   FG%      3P   3P%
--------------------------------------------------------------------------------
Draymond Fox           12    5    4    1   0   3/4    75.0     0/0   0.0
Michael Curry          12    5    0    0   0   2/5    40.0     0/0   0.0
Dwyane Irving          12    5    7    3   0   2/4    50.0     0/0   0.0
Jabari Wade            12    3    0    1   0   1/3    33.3     0/0   0.0
Anthony Lillard        12    0    2    0   0   0/3     0.0     0/0   0.0

TEAM: FG: 8/19 (42.1%), 3PT: 4/7 (57.1%), REB: 13 (4 off, 9 def), AST: 5, TO: 2
TEAM FOULS: 2

================================================================================

================================================================================
                       2ND QUARTER - Team_039 vs Team_004                       
================================================================================

[12:00] Team_039 possession (Score: 32-20)
FOUL! Shooting foul on Michael Curry. Donovan Markkanen to the line for 3 free throws. [Team fouls: 1] (Michael Curry: 1 personal fouls)   FT 1/3: GOOD   FT 2/3: GOOD   FT 3/3: GOOD Donovan Markkanen makes 3/3 from the line.
Score: 35-20

[11:46] Team_004 possession (Score: 35-20)
Draymond Fox attempts a 3Pt. Contested by Jrue Bridges (3.8 feet, ZONE). Draymond Fox misses. FOUL! Loose ball foul on Donovan Markkanen during the rebound battle. [Team fouls: 1] No free throws, side out. (Donovan Markkanen: 1 personal fouls)

[11:33] Team_004 possession (Score: 35-20)
Anthony Lillard attempts a 3Pt. Contested by Jrue Bridges (3.8 feet, ZONE). Anthony Lillard misses. Rebound secured by Donovan Markkanen.

[11:16] Team_039 possession (Score: 35-20)
Austin O'Neal attempts a 3Pt. Contested by Michael Curry (5.4 feet, ZONE). AUSTIN O'NEAL MAKES IT! Assist: Anfernee Carter
Score: 38-20

[11:04] Team_004 possession (Score: 38-20)
Dwyane Irving attempts a 3Pt. Contested by Jrue Bridges (3.9 feet, ZONE). Dwyane Irving misses. Rebound secured by Austin O'Neal.

[10:50] Team_039 possession (Score: 38-20)
Donovan Markkanen makes the Layup and draws the foul on Dwyane Irving! And-1! Donovan Markkanen to the line for 1. [Team fouls: 2] (Dwyane Irving: 1 personal fouls)   FT 1/1: GOOD Donovan Markkanen makes 1/1 from the line.
Score: 41-20

[10:36] Team_004 possession (Score: 41-20)
Dwyane Irving drives, picks up Austin O'Neal. Help arrives from Donovan Markkanen! Dwyane Irving attempts a Dunk. Contested by Donovan Markkanen (4.8 feet, MAN). DWYANE IRVING MAKES IT! Assist: Michael Curry
Score: 41-22

[10:25] Team_039 possession (Score: 41-22)
FOUL! Shooting foul on Anthony Lillard. Klay Wade to the line for 2 free throws. [Team fouls: 3] (Anthony Lillard: 1 personal fouls)   FT 1/2: GOOD   FT 2/2: GOOD Klay Wade makes 2/2 from the line.
Score: 43-22

[10:08] Team_004 possession (Score: 43-22)
FOUL! Shooting foul on Donovan Markkanen. Anthony Lillard to the line for 2 free throws. [Team fouls: 2] (Donovan Markkanen: 2 personal fouls)   FT 1/2: MISS   FT 2/2: MISS Anthony Lillard makes 0/2 from the line. Offensive rebound by Anthony Lillard! Anthony Lillard kicks it out.

[09:52] Team_004 possession (Score: 43-22)
Draymond Fox drives, Klay Wade stays with him. Draymond Fox attempts a Layup. Contested by Klay Wade (4.8 feet, MAN). DRAYMOND FOX MAKES IT!
Score: 43-24

[09:39] Team_039 possession (Score: 43-24)
Anfernee Carter attempts a Midrange. Contested by Draymond Fox (4.9 feet, MAN). ANFERNEE CARTER MAKES IT! Assist: Klay Wade
Score: 45-24

[09:24] Team_004 possession (Score: 45-24)
Anthony Lillard attempts a Midrange. Wide open! Anfernee Carter is 7.4 feet away. [ZONE] Anthony Lillard misses. Rebound secured by Austin O'Neal.

[09:09] Team_039 possession (Score: 45-24)
Donovan Markkanen attempts a 3Pt. Contested by Jabari Wade (5.6 feet, MAN). DONOVAN MARKKANEN MAKES IT! Assist: Klay Wade
Score: 48-24

[08:54] Team_004 possession (Score: 48-24)
Michael Curry attempts a 3Pt. Contested by Jrue Bridges (4.0 feet, MAN). Michael Curry misses. Offensive rebound by Anthony Lillard! Anthony Lillard kicks it out.

[08:38] Team_004 possession (Score: 48-24)
Jabari Wade makes the Layup and draws the foul on Donovan Markkanen! And-1! Jabari Wade to the line for 1. [Team fouls: 3] (Donovan Markkanen: 3 personal fouls)   FT 1/1: GOOD Jabari Wade makes 1/1 from the line.
Score: 48-27

[08:24] Team_039 possession (Score: 48-27)
Donovan Markkanen makes the Layup and draws the foul on Jabari Wade! And-1! Donovan Markkanen to the line for 1. [Team fouls: 4] (Jabari Wade: 1 personal fouls)   FT 1/1: GOOD Donovan Markkanen makes 1/1 from the line.
Score: 51-27

[08:10] Team_004 possession (Score: 51-27)
FOUL! Holding foul on Austin O'Neal. [Team fouls: 4] No free throws, side out. (Austin O'Neal: 1 personal fouls)

[07:58] Team_004 possession (Score: 51-27)
Jabari Wade attempts a 3Pt. Contested by Jrue Bridges (4.6 feet, ZONE). Jabari Wade misses. Offensive rebound by Anthony Lillard! Anthony Lillard kicks it out.

[07:43] Team_004 possession (Score: 51-27)
Michael Curry attempts a 3Pt. Contested by Jrue Bridges (4.2 feet, ZONE). Michael Curry misses. Rebound secured by Austin O'Neal.

[07:32] Team_039 possession (Score: 51-27)
Anfernee Carter attempts a Layup. Contested by Draymond Fox (5.2 feet, MAN). Anfernee Carter misses. Rebound secured by Draymond Fox.

[07:17] Team_004 possession (Score: 51-27)
Dwyane Irving makes the Layup and draws the foul on Klay Wade! And-1! Dwyane Irving to the line for 1. [BONUS: 5 team fouls] (Klay Wade: 1 personal fouls)   FT 1/1: GOOD Dwyane Irving makes 1/1 from the line.
Score: 51-30

[07:04] Team_039 possession (Score: 51-30)
Klay Wade makes the Midrange and draws the foul on Dwyane Irving! And-1! Klay Wade to the line for 1. [BONUS: 5 team fouls] (Dwyane Irving: 2 personal fouls)   FT 1/1: GOOD Klay Wade makes 1/1 from the line.
Score: 54-30

[06:51] Team_004 possession (Score: 54-30)
Jabari Wade attempts a Layup. Wide open! Anfernee Carter is 7.9 feet away. [ZONE] Jabari Wade misses. Rebound secured by Austin O'Neal.

[06:34] Team_039 possession (Score: 54-30)
Austin O'Neal attempts a 3Pt. Contested by Michael Curry (5.9 feet, ZONE). Austin O'Neal misses. Rebound secured by Dwyane Irving.

[06:23] Team_004 possession (Score: 54-30)
Anthony Lillard loses the ball! Stripped by Klay Wade! TURNOVER! (live ball)

[06:09] Team_039 possession (Score: 54-30)
Klay Wade drives and kicks out. Anfernee Carter attempts a Midrange. Contested by Draymond Fox (5.3 feet, MAN). Anfernee Carter misses. FOUL! Loose ball foul on Dwyane Irving during the rebound battle. [IN THE BONUS! 6 team fouls] Donovan Markkanen to the line for 2 free throws. (Dwyane Irving: 3 personal fouls)   FT 1/2: GOOD   FT 2/2: GOOD Donovan Markkanen makes 2/2 from the line.
Score: 56-30

[05:52] Team_004 possession (Score: 56-30)
Jabari Wade attempts a 3Pt. Contested by Donovan Markkanen (5.3 feet, MAN). JABARI WADE MAKES IT! Assist: Dwyane Irving
Score: 56-33

[05:36] Team_039 possession (Score: 56-33)
Jrue Bridges attempts a 3Pt. Contested by Draymond Fox (5.4 feet, ZONE). JRUE BRIDGES MAKES IT! Assist: Donovan Markkanen
Score: 59-33

[05:20] Team_004 possession (Score: 59-33)
Draymond Fox attempts a 3Pt. Contested by Jrue Bridges (4.8 feet, ZONE). Draymond Fox misses. Rebound secured by Austin O'Neal.

[05:08] Team_039 possession (Score: 59-33)
FOUL! Reach-in foul on Anthony Lillard during the drive. [IN THE BONUS! 7 team fouls] Jrue Bridges to the line for 2 free throws. (Anthony Lillard: 2 personal fouls)   FT 1/2: GOOD   FT 2/2: GOOD Jrue Bridges makes 2/2 from the line.
Score: 61-33

[04:51] Team_004 possession (Score: 61-33)
Anthony Lillard loses the ball! Stripped by Klay Wade! TURNOVER! (live ball)

[04:33] Team_039 possession (Score: 61-33)
Klay Wade attempts a Layup. Wide open! Anthony Lillard is 6.0 feet away. [MAN] Klay Wade misses. Rebound secured by Dwyane Irving.

[04:16] Team_004 possession (Score: 61-33)
Dwyane Irving attempts a Midrange. Contested by Austin O'Neal (5.7 feet, MAN). Dwyane Irving misses. Rebound secured by Donovan Markkanen.

[04:06] Team_039 possession (Score: 61-33)
Klay Wade attempts a Layup. Wide open! Anthony Lillard is 6.1 feet away. [MAN] KLAY WADE MAKES IT! Assist: Donovan Markkanen
Score: 63-33

[03:52] Team_004 possession (Score: 63-33)
Anthony Lillard drives, picks up Klay Wade. Help arrives from Donovan Markkanen! Anthony Lillard attempts a Dunk. Contested by Donovan Markkanen (5.5 feet, MAN). ANTHONY LILLARD MAKES IT! Assist: Jabari Wade
Score: 63-35

[03:34] Team_039 possession (Score: 63-35)
Anfernee Carter attempts a 3Pt. Contested by Draymond Fox (5.7 feet, MAN). Anfernee Carter misses. Rebound secured by Draymond Fox.

[03:17] Team_004 possession (Score: 63-35)
Anthony Lillard makes the Layup and draws the foul on Klay Wade! And-1! Anthony Lillard to the line for 1. [BONUS: 6 team fouls] (Klay Wade: 2 personal fouls)   FT 1/1: GOOD Anthony Lillard makes 1/1 from the line.
Score: 63-38

[03:00] Team_039 possession (Score: 63-38)
Anfernee Carter attempts a 3Pt. Wide open! Michael Curry is 6.4 feet away. [ZONE] ANFERNEE CARTER MAKES IT! Assist: Donovan Markkanen
Score: 66-38

[02:46] Team_004 possession (Score: 66-38)
Michael Curry attempts a 3Pt. Contested by Jrue Bridges (5.0 feet, ZONE). MICHAEL CURRY MAKES IT! Assist: Anthony Lillard
Score: 66-41

[02:33] Team_039 possession (Score: 66-41)
Jrue Bridges drives, picks up Michael Curry. Help arrives from Dwyane Irving! Jrue Bridges attempts a Dunk. Wide open! Dwyane Irving is 6.5 feet away. [MAN] JRUE BRIDGES MAKES IT! Assist: Donovan Markkanen
Score: 68-41

[02:18] Team_004 possession (Score: 68-41)
Jabari Wade attempts a 3Pt. Contested by Jrue Bridges (5.5 feet, ZONE). Jabari Wade misses. Rebound secured by Austin O'Neal.

[02:02] Team_039 possession (Score: 68-41)
Donovan Markkanen attempts a 3Pt. Wide open! Michael Curry is 6.6 feet away. [ZONE] DONOVAN MARKKANEN MAKES IT! Assist: Klay Wade
Score: 71-41

[01:45] Team_004 possession (Score: 71-41)
Anthony Lillard drives, Klay Wade stays with him. Anthony Lillard attempts a Dunk. Contested by Klay Wade (5.8 feet, MAN). ANTHONY LILLARD MAKES IT!
Score: 71-43

[01:31] Team_039 possession (Score: 71-43)
Austin O'Neal attempts a 3Pt. Wide open! Michael Curry is 6.5 feet away. [ZONE] AUSTIN O'NEAL MAKES IT!
Score: 74-43

[01:18] Team_004 possession (Score: 74-43)
Jabari Wade attempts a 3Pt. Contested by Jrue Bridges (5.6 feet, ZONE). Jabari Wade misses. FOUL! Loose ball foul on Donovan Markkanen during the rebound battle. [IN THE BONUS! 7 team fouls] Anthony Lillard to the line for 2 free throws. (Donovan Markkanen: 4 personal fouls)   FT 1/2: MISS   FT 2/2: GOOD Anthony Lillard makes 1/2 from the line.
Score: 74-44

[01:03] Team_039 possession (Score: 74-44)
Jrue Bridges drives, picks up Michael Curry. Help arrives from Dwyane Irving! Jrue Bridges attempts a Dunk. Wide open! Dwyane Irving is 6.7 feet away. [MAN] JRUE BRIDGES MAKES IT! Assist: Austin O'Neal
Score: 76-44

[00:50] Team_004 possession (Score: 76-44)
Michael Curry attempts a Midrange. Contested by Jrue Bridges (5.4 feet, MAN). Michael Curry misses. Offensive rebound by Anthony Lillard! Anthony Lillard kicks it out.

[00:37] Team_004 possession (Score: 76-44)
Draymond Fox attempts a Layup. Wide open! Klay Wade is 6.0 feet away. [ZONE] DRAYMOND FOX MAKES IT!
Score: 76-46

[00:25] Team_039 possession (Score: 76-46)
Austin O'Neal attempts a 3Pt. Contested by Dwyane Irving (5.3 feet, MAN). AUSTIN O'NEAL MAKES IT! Assist: Donovan Markkanen
Score: 79-46

[00:15] Team_004 possession (Score: 79-46)
Anthony Lillard drives, picks up Klay Wade. Help arrives from Donovan Markkanen! Anthony Lillard attempts a Layup. Wide open! Donovan Markkanen is 6.1 feet away. [MAN] ANTHONY LILLARD MAKES IT! Assist: Dwyane Irving
Score: 79-48

[00:04] Team_039 possession (Score: 79-48)
Anfernee Carter attempts a Midrange. Wide open! Jabari Wade is 6.8 feet away. [ZONE] Anfernee Carter misses. Offensive rebound by Klay Wade! Klay Wade kicks it out.

================================================================================
                              2ND QUARTER COMPLETE                              
================================================================================

2ND QUARTER SCORE: Team_039 47, Team_004 28

BOX SCORE:
================================================================================

Team_039
--------------------------------------------------------------------------------
Player                MIN  PTS  REB  AST  TO      FG   FG%      3P   3P%
--------------------------------------------------------------------------------
Donovan Markkanen      24   17    2    5   0   6/6   100.0     0/0   0.0
Austin O'Neal          24    9    6    1   0   3/4    75.0     0/0   0.0
Jrue Bridges           24    9    0    0   0   4/4   100.0     0/0   0.0
Klay Wade              24    7    1    3   0   3/4    75.0     0/0   0.0
Anfernee Carter        24    5    0    1   0   2/4    50.0     0/0   0.0

TEAM: FG: 18/22 (81.8%), 3PT: 8/10 (80.0%), REB: 9 (1 off, 8 def), AST: 10, TO: 0
TEAM FOULS: 7 [Team_004 in BONUS]


Team_004
--------------------------------------------------------------------------------
Player                MIN  PTS  REB  AST  TO      FG   FG%      3P   3P%
--------------------------------------------------------------------------------
Anthony Lillard        24   10    4    1   0   5/7    71.4     0/0   0.0
Jabari Wade            24    6    0    1   0   2/4    50.0     0/0   0.0
Dwyane Irving          24    5    3    2   0   2/4    50.0     0/0   0.0
Draymond Fox           24    4    2    0   0   2/3    66.7     0/0   0.0
Michael Curry          24    3    0    1   0   1/2    50.0     0/0   0.0

TEAM: FG: 12/20 (60.0%), 3PT: 3/8 (37.5%), REB: 9 (5 off, 4 def), AST: 5, TO: 2
TEAM FOULS: 7 [Team_039 in BONUS]

================================================================================

================================================================================
                       3RD QUARTER - Team_039 vs Team_004                       
================================================================================

[12:00] Team_039 possession (Score: 79-48)
Austin O'Neal attempts a 3Pt. Contested by Dwyane Irving (3.7 feet, MAN). AUSTIN O'NEAL MAKES IT! Assist: Klay Wade
Score: 82-48

[11:45] Team_004 possession (Score: 82-48)
FOUL! Shooting foul on Donovan Markkanen. Dwyane Irving to the line for 2 free throws. [Team fouls: 1] (Donovan Markkanen: 1 personal fouls)   FT 1/2: MISS   FT 2/2: GOOD Dwyane Irving makes 1/2 from the line.
Score: 82-49

[11:30] Team_039 possession (Score: 82-49)
Anfernee Carter drives and kicks out. Jrue Bridges makes the 3Pt and draws the foul on Michael Curry! And-1! Jrue Bridges to the line for 1. [Team fouls: 1] (Michael Curry: 1 personal fouls)   FT 1/1: GOOD Jrue Bridges makes 1/1 from the line.
Score: 86-49

[11:13] Team_004 possession (Score: 86-49)
Dwyane Irving attempts a Layup. BLOCKED BY KLAY WADE! Ball deflects out of bounds off Dwyane Irving.

[10:58] Team_039 possession (Score: 86-49)
Anfernee Carter drives, Draymond Fox stays with him. Anfernee Carter attempts a Layup. Contested by Draymond Fox (4.4 feet, MAN). ANFERNEE CARTER MAKES IT!
Score: 88-49

[10:42] Team_004 possession (Score: 88-49)
Michael Curry attempts a 3Pt. Contested by Jrue Bridges (3.2 feet, MAN). Michael Curry misses. Offensive rebound by Anthony Lillard! Anthony Lillard kicks it out.

[10:25] Team_004 possession (Score: 88-49)
Jabari Wade drives and kicks out. Anthony Lillard attempts a Midrange. Contested by Klay Wade (4.0 feet, MAN). Anthony Lillard misses. Offensive rebound by Anthony Lillard! Anthony Lillard kicks it out.

[10:07] Team_004 possession (Score: 88-49)
Michael Curry attempts a 3Pt. Contested by Jrue Bridges (3.2 feet, MAN). Michael Curry misses. Offensive rebound by Draymond Fox! Draymond Fox kicks it out.

[09:47] Team_004 possession (Score: 88-49)
Anthony Lillard drives to the basket... Anthony Lillard throws a bad pass! Stolen by Klay Wade! TURNOVER! (live ball)

[09:36] Team_039 possession (Score: 88-49)
Austin O'Neal attempts a 3Pt. Contested by Dwyane Irving (3.7 feet, MAN). Austin O'Neal misses. Rebound secured by Anthony Lillard.

[09:19] Team_004 possession (Score: 88-49)
Jabari Wade attempts a Midrange. Contested by Donovan Markkanen (4.4 feet, MAN). Jabari Wade misses. Rebound secured by Klay Wade.

[09:03] Team_039 possession (Score: 88-49)
Donovan Markkanen attempts a 3Pt. Contested by Jabari Wade (4.9 feet, MAN). Donovan Markkanen misses. Rebound secured by Dwyane Irving.

[08:47] Team_004 possession (Score: 88-49)
Jabari Wade attempts a Midrange. Contested by Austin O'Neal (4.6 feet, ZONE). Jabari Wade misses. Offensive rebound by Anthony Lillard! Anthony Lillard kicks it out.

[08:32] Team_004 possession (Score: 88-49)
Dwyane Irving drives and kicks out. Jabari Wade attempts a Midrange. Contested by Donovan Markkanen (3.7 feet, MAN). Jabari Wade misses. Rebound secured by Austin O'Neal.

[08:12] Team_039 possession (Score: 88-49)
Klay Wade attempts a Layup. Contested by Anthony Lillard (4.7 feet, MAN). Klay Wade misses. Rebound secured by Anthony Lillard.

[07:55] Team_004 possession (Score: 88-49)
Michael Curry throws a bad pass! Stolen by Jrue Bridges! TURNOVER! (live ball)

[07:40] Team_039 possession (Score: 88-49)
FOUL! Shooting foul on Jabari Wade. Anfernee Carter to the line for 2 free throws. [Team fouls: 2] (Jabari Wade: 1 personal fouls)   FT 1/2: GOOD   FT 2/2: GOOD Anfernee Carter makes 2/2 from the line.
Score: 90-49

[07:27] Team_004 possession (Score: 90-49)
Dwyane Irving drives and kicks out. Draymond Fox attempts a 3Pt. Contested by Donovan Markkanen (3.7 feet, ZONE). Draymond Fox misses. Rebound secured by Donovan Markkanen.

[07:12] Team_039 possession (Score: 90-49)
Anfernee Carter attempts a Midrange. Contested by Draymond Fox (4.4 feet, ZONE). ANFERNEE CARTER MAKES IT! Assist: Donovan Markkanen
Score: 92-49

[06:56] Team_004 possession (Score: 92-49)
Anthony Lillard drives, Klay Wade stays with him. Anthony Lillard attempts a Layup. Contested by Klay Wade (4.4 feet, ZONE). Anthony Lillard misses. Rebound secured by Donovan Markkanen.

[06:41] Team_039 possession (Score: 92-49)
Klay Wade drives and kicks out. Anfernee Carter attempts a 3Pt. Contested by Michael Curry (5.0 feet, ZONE). Anfernee Carter misses. Rebound secured by Anthony Lillard.

[06:27] Team_004 possession (Score: 92-49)
Michael Curry attempts a 3Pt. Contested by Jrue Bridges (3.2 feet, ZONE). MICHAEL CURRY MAKES IT! Assist: Draymond Fox
Score: 92-52

[06:13] Team_039 possession (Score: 92-52)
Austin O'Neal attempts a Midrange. Contested by Dwyane Irving (3.7 feet, MAN). Austin O'Neal misses. Rebound secured by Dwyane Irving.

[05:59] Team_004 possession (Score: 92-52)
Anthony Lillard attempts a Midrange. Contested by Klay Wade (4.4 feet, MAN). ANTHONY LILLARD MAKES IT!
Score: 92-54

[05:48] Team_039 possession (Score: 92-54)
Donovan Markkanen drives, Jabari Wade stays with him. Donovan Markkanen attempts a Layup. Contested by Jabari Wade (4.9 feet, MAN). DONOVAN MARKKANEN MAKES IT! Assist: Jrue Bridges
Score: 94-54

[05:32] Team_004 possession (Score: 94-54)
Anthony Lillard drives, picks up Klay Wade. Help arrives from Donovan Markkanen! Anthony Lillard attempts a Dunk. Contested by Donovan Markkanen (4.4 feet, ZONE). ANTHONY LILLARD MAKES IT! Assist: Dwyane Irving
Score: 94-56

[05:19] Team_039 possession (Score: 94-56)
Donovan Markkanen attempts a Midrange. Contested by Jabari Wade (4.9 feet, MAN). DONOVAN MARKKANEN MAKES IT!
Score: 96-56

[05:06] Team_004 possession (Score: 96-56)
Michael Curry commits a violation (traveling/carry)! TURNOVER! (dead ball)

[04:54] Team_039 possession (Score: 96-56)
Klay Wade attempts a 3Pt. Contested by Dwyane Irving (4.1 feet, ZONE). Klay Wade misses. Rebound secured by Dwyane Irving.

[04:40] Team_004 possession (Score: 96-56)
Jabari Wade drives, Donovan Markkanen stays with him. Jabari Wade attempts a Layup. Contested by Donovan Markkanen (4.4 feet, MAN). Jabari Wade misses. Rebound secured by Donovan Markkanen.

[04:25] Team_039 possession (Score: 96-56)
Klay Wade drives to the basket... Klay Wade throws a bad pass! Stolen by Anthony Lillard! TURNOVER! (live ball)

[04:09] Team_004 possession (Score: 96-56)
Dwyane Irving attempts a 3Pt. Contested by Austin O'Neal (4.3 feet, MAN). Dwyane Irving misses. FOUL! Loose ball foul on Klay Wade during the rebound battle. [Team fouls: 2] No free throws, side out. (Klay Wade: 1 personal fouls)

[03:57] Team_004 possession (Score: 96-56)
Jabari Wade attempts a Layup. Contested by Donovan Markkanen (4.5 feet, MAN). JABARI WADE MAKES IT!
Score: 96-58

[03:42] Team_039 possession (Score: 96-58)
Klay Wade attempts a Midrange. Contested by Anthony Lillard (4.8 feet, MAN). Klay Wade misses. Rebound secured by Dwyane Irving.

[03:25] Team_004 possession (Score: 96-58)
Dwyane Irving attempts a 3Pt. Contested by Jrue Bridges (3.5 feet, ZONE). Dwyane Irving misses. Rebound secured by Donovan Markkanen.

[03:13] Team_039 possession (Score: 96-58)
Klay Wade drives to the basket... Klay Wade throws a bad pass! Stolen by Draymond Fox! TURNOVER! (live ball)

[03:01] Team_004 possession (Score: 96-58)
Dwyane Irving drives, Austin O'Neal stays with him. Dwyane Irving attempts a Dunk. Contested by Austin O'Neal (4.4 feet, MAN). DWYANE IRVING MAKES IT! Assist: Jabari Wade
Score: 96-60

[02:42] Team_039 possession (Score: 96-60)
Jrue Bridges attempts a 3Pt. Contested by Michael Curry (5.4 feet, MAN). JRUE BRIDGES MAKES IT! Assist: Donovan Markkanen
Score: 99-60

[02:27] Team_004 possession (Score: 99-60)
Michael Curry attempts a Layup. Contested by Jrue Bridges (3.5 feet, MAN). MICHAEL CURRY MAKES IT! Assist: Dwyane Irving
Score: 99-62

[02:13] Team_039 possession (Score: 99-62)
Jrue Bridges attempts a Midrange. Contested by Michael Curry (5.4 feet, MAN). JRUE BRIDGES MAKES IT! Assist: Donovan Markkanen
Score: 101-62

[02:00] Team_004 possession (Score: 101-62)
Michael Curry drives and kicks out. Jabari Wade attempts a 3Pt. Contested by Jrue Bridges (3.4 feet, ZONE). Jabari Wade misses. Rebound secured by Donovan Markkanen.

[01:51] Team_039 possession (Score: 101-62)
Donovan Markkanen drives and kicks out. Jrue Bridges attempts a Midrange. Contested by Michael Curry (5.3 feet, MAN). Jrue Bridges misses. Rebound secured by Anthony Lillard.

[01:34] Team_004 possession (Score: 101-62)
Jabari Wade attempts a Layup. Contested by Donovan Markkanen (4.7 feet, MAN). JABARI WADE MAKES IT! Assist: Draymond Fox
Score: 101-64

[01:21] Team_039 possession (Score: 101-64)
FOUL! Reach-in foul on Draymond Fox during the drive. [Team fouls: 3] No free throws, side out. (Draymond Fox: 1 personal fouls)

[01:06] Team_039 possession (Score: 101-64)
Donovan Markkanen attempts a Midrange. Contested by Dwyane Irving (4.1 feet, ZONE). DONOVAN MARKKANEN MAKES IT! Assist: Jrue Bridges
Score: 103-64

[00:49] Team_004 possession (Score: 103-64)
Draymond Fox makes the Dunk and draws the foul on Donovan Markkanen! And-1! Draymond Fox to the line for 1. [Team fouls: 3] (Donovan Markkanen: 2 personal fouls)   FT 1/1: GOOD Draymond Fox makes 1/1 from the line.
Score: 103-67

[00:32] Team_039 possession (Score: 103-67)
Donovan Markkanen attempts a Layup. BLOCKED BY DRAYMOND FOX! Ball is loose! Offensive rebound by Austin O'Neal! Austin O'Neal kicks it out.

[00:19] Team_039 possession (Score: 103-67)
Jrue Bridges attempts a Midrange. Contested by Jabari Wade (5.4 feet, ZONE). Jrue Bridges misses. Offensive rebound by Klay Wade! Klay Wade kicks it out.

[00:06] Team_039 possession (Score: 103-67)
FOUL! Holding foul on Anthony Lillard. [Team fouls: 4] No free throws, side out. (Anthony Lillard: 1 personal fouls)

================================================================================
                              3RD QUARTER COMPLETE                              
================================================================================

3RD QUARTER SCORE: Team_039 24, Team_004 19

BOX SCORE:
================================================================================

Team_039
--------------------------------------------------------------------------------
Player                MIN  PTS  REB  AST  TO      FG   FG%      3P   3P%
--------------------------------------------------------------------------------
Jrue Bridges           36    9    0    2   0   3/3   100.0     0/0   0.0
Anfernee Carter        36    6    0    0   0   3/3   100.0     0/0   0.0
Donovan Markkanen      36    6    5    3   0   3/5    60.0     0/0   0.0
Austin O'Neal          36    3    2    0   0   1/3    33.3     0/0   0.0
Klay Wade              36    0    2    1   0   0/4     0.0     0/0   0.0

TEAM: FG: 10/18 (55.6%), 3PT: 2/5 (40.0%), REB: 9 (2 off, 7 def), AST: 6, TO: 2
TEAM FOULS: 3


Team_004
--------------------------------------------------------------------------------
Player                MIN  PTS  REB  AST  TO      FG   FG%      3P   3P%
--------------------------------------------------------------------------------
Michael Curry          36    5    0    0   0   2/3    66.7     0/0   0.0
Anthony Lillard        36    4    8    0   0   2/3    66.7     0/0   0.0
Jabari Wade            36    4    0    1   0   2/4    50.0     0/0   0.0
Dwyane Irving          36    3    4    2   0   2/6    33.3     0/0   0.0
Draymond Fox           36    3    1    2   0   1/1   100.0     0/0   0.0

TEAM: FG: 9/17 (52.9%), 3PT: 1/2 (50.0%), REB: 13 (5 off, 8 def), AST: 5, TO: 3
TEAM FOULS: 4

================================================================================

================================================================================
                       4TH QUARTER - Team_039 vs Team_004                       
================================================================================

[12:00] Team_039 possession (Score: 103-67)
Klay Wade attempts a Layup. Contested by Anthony Lillard (5.0 feet, MAN). KLAY WADE MAKES IT! Assist: Austin O'Neal
Score: 105-67

[11:41] Team_004 possession (Score: 105-67)
Dwyane Irving attempts a 3Pt. Contested by Jrue Bridges (3.8 feet, ZONE). Dwyane Irving misses. Rebound secured by Klay Wade.

[11:30] Team_039 possession (Score: 105-67)
Austin O'Neal attempts a Layup. Contested by Dwyane Irving (3.9 feet, MAN). AUSTIN O'NEAL MAKES IT! Assist: Klay Wade
Score: 107-67

[11:17] Team_004 possession (Score: 107-67)
Jabari Wade attempts a Layup. Wide open! Anfernee Carter is 7.6 feet away. [ZONE] JABARI WADE MAKES IT! Assist: Dwyane Irving
Score: 107-69

[11:03] Team_039 possession (Score: 107-69)
Austin O'Neal drives, picks up Dwyane Irving. Help arrives from Jabari Wade! Austin O'Neal attempts a Dunk. Contested by Jabari Wade (3.9 feet, MAN). Austin O'Neal misses. Rebound secured by Dwyane Irving.

[10:49] Team_004 possession (Score: 107-69)
Draymond Fox attempts a 3Pt. Contested by Jrue Bridges (3.9 feet, ZONE). Draymond Fox misses. Offensive rebound by Dwyane Irving! Dwyane Irving kicks it out.

[10:32] Team_004 possession (Score: 107-69)
Draymond Fox attempts a Layup. Contested by Klay Wade (4.7 feet, MAN). Draymond Fox misses. Offensive rebound by Dwyane Irving! Dwyane Irving kicks it out.

[10:23] Team_004 possession (Score: 107-69)
Anthony Lillard attempts a Layup. Contested by Klay Wade (4.8 feet, MAN). Anthony Lillard misses. Rebound secured by Austin O'Neal.

[10:13] Team_039 possession (Score: 107-69)
FOUL! Holding foul on Jabari Wade. [Team fouls: 1] No free throws, side out. (Jabari Wade: 1 personal fouls)

[10:00] Team_039 possession (Score: 107-69)
Donovan Markkanen attempts a Midrange. Contested by Jabari Wade (5.5 feet, MAN). DONOVAN MARKKANEN MAKES IT!
Score: 109-69

[09:43] Team_004 possession (Score: 109-69)
Anthony Lillard makes the Layup and draws the foul on Donovan Markkanen! And-1! Anthony Lillard to the line for 1. [Team fouls: 1] (Donovan Markkanen: 1 personal fouls)   FT 1/1: GOOD Anthony Lillard makes 1/1 from the line.
Score: 109-72

[09:30] Team_039 possession (Score: 109-72)
Anfernee Carter attempts a Midrange. Contested by Jabari Wade (5.5 feet, ZONE). ANFERNEE CARTER MAKES IT!
Score: 111-72

[09:15] Team_004 possession (Score: 111-72)
Anthony Lillard attempts a 3Pt. Contested by Klay Wade (4.9 feet, MAN). ANTHONY LILLARD MAKES IT! Assist: Dwyane Irving
Score: 111-75

[09:00] Team_039 possession (Score: 111-75)
Jrue Bridges attempts a 3Pt. Contested by Michael Curry (5.7 feet, MAN). JRUE BRIDGES MAKES IT! Assist: Donovan Markkanen
Score: 114-75

[08:45] Team_004 possession (Score: 114-75)
Draymond Fox attempts a Layup. Contested by Klay Wade (4.9 feet, ZONE). Draymond Fox misses. Rebound secured by Austin O'Neal.

[08:33] Team_039 possession (Score: 114-75)
FOUL! Reach-in foul on Anthony Lillard during the drive. [Team fouls: 2] No free throws, side out. (Anthony Lillard: 1 personal fouls)

[08:17] Team_039 possession (Score: 114-75)
FOUL! Reach-in foul on Anthony Lillard during the drive. [Team fouls: 3] No free throws, side out. (Anthony Lillard: 2 personal fouls)

[08:07] Team_039 possession (Score: 114-75)
Jrue Bridges attempts a 3Pt. Contested by Michael Curry (5.8 feet, MAN). Jrue Bridges misses. Rebound secured by Draymond Fox.

[07:49] Team_004 possession (Score: 114-75)
Draymond Fox attempts a Midrange. Contested by Klay Wade (5.1 feet, MAN). Draymond Fox misses. Rebound secured by Donovan Markkanen.

[07:34] Team_039 possession (Score: 114-75)
Anfernee Carter attempts a 3Pt. Contested by Michael Curry (5.9 feet, ZONE). Anfernee Carter misses. Rebound secured by Anthony Lillard.

[07:21] Team_004 possession (Score: 114-75)
Jabari Wade attempts a Midrange. Contested by Donovan Markkanen (5.1 feet, MAN). JABARI WADE MAKES IT!
Score: 114-77

[07:05] Team_039 possession (Score: 114-77)
Austin O'Neal attempts a 3Pt. Contested by Dwyane Irving (4.4 feet, MAN). Austin O'Neal misses. Rebound secured by Dwyane Irving.

[06:52] Team_004 possession (Score: 114-77)
Draymond Fox drives, Klay Wade stays with him. Draymond Fox attempts a Layup. Contested by Klay Wade (5.2 feet, ZONE). DRAYMOND FOX MAKES IT! Assist: Jabari Wade
Score: 114-79

[06:35] Team_039 possession (Score: 114-79)
Donovan Markkanen attempts a 3Pt. Contested by Jabari Wade (5.9 feet, MAN). Donovan Markkanen misses. Rebound secured by Dwyane Irving.

[06:23] Team_004 possession (Score: 114-79)
Draymond Fox drives and kicks out. Jabari Wade attempts a 3Pt. Contested by Donovan Markkanen (4.8 feet, MAN). Jabari Wade misses. Rebound secured by Donovan Markkanen.

[06:09] Team_039 possession (Score: 114-79)
Donovan Markkanen attempts a 3Pt. Contested by Jabari Wade (6.0 feet, MAN). Donovan Markkanen misses. Rebound secured by Draymond Fox.

[05:55] Team_004 possession (Score: 114-79)
Draymond Fox drives and kicks out. Anthony Lillard attempts a 3Pt. Contested by Jrue Bridges (4.5 feet, ZONE). ANTHONY LILLARD MAKES IT! Assist: Michael Curry
Score: 114-82

[05:43] Team_039 possession (Score: 114-82)
Klay Wade makes the Layup and draws the foul on Anthony Lillard! And-1! Klay Wade to the line for 1. [Team fouls: 4] (Anthony Lillard: 3 personal fouls)   FT 1/1: GOOD Klay Wade makes 1/1 from the line.
Score: 117-82

[05:30] Team_004 possession (Score: 117-82)
Michael Curry attempts a 3Pt. Contested by Austin O'Neal (5.4 feet, ZONE). Michael Curry misses. Rebound secured by Donovan Markkanen.

[05:16] Team_039 possession (Score: 117-82)
Donovan Markkanen loses the ball! Stripped by Jabari Wade! TURNOVER! (live ball)

[05:05] Team_004 possession (Score: 117-82)
Dwyane Irving attempts a Layup. Contested by Austin O'Neal (5.6 feet, MAN). DWYANE IRVING MAKES IT! Assist: Anthony Lillard
Score: 117-84

[04:50] Team_039 possession (Score: 117-84)
Donovan Markkanen commits a violation (traveling/carry)! TURNOVER! (dead ball)

[04:50] Substitution (Team_039): Jrue Bridges OUT → Tracy Mitchell IN (stamina_rule2)

[04:50] Substitution (Team_039): Donovan Markkanen OUT → Jayson Cunningham IN (stamina_rule2)

[04:50] Substitution (Team_039): Austin O'Neal OUT → Yao Carter IN (stamina_rule2)

[04:50] Substitution (Team_039): Anfernee Carter OUT → Victor Gasol IN (stamina_rule2)

[04:50] Substitution (Team_039): Klay Wade OUT → Bam Booker IN (stamina_rule2)

[04:50] Substitution (Team_004): Michael Curry OUT → Karl Reaves IN (stamina_rule2)

[04:50] Substitution (Team_004): Jabari Wade OUT → Russell Barnes IN (stamina_rule2)

[04:50] Substitution (Team_004): Dwyane Irving OUT → Kristaps Green IN (stamina_rule2)

[04:50] Substitution (Team_004): Draymond Fox OUT → Michael Sabonis IN (stamina_rule2)

[04:50] Substitution (Team_004): Anthony Lillard OUT → Shai Beal IN (stamina_rule2)

[04:34] Team_004 possession (Score: 117-84)
Kristaps Green attempts a 3Pt. Contested by Yao Carter (4.1 feet, MAN). KRISTAPS GREEN MAKES IT! Assist: Russell Barnes
Score: 117-87

[04:19] Team_039 possession (Score: 117-87)
Tracy Mitchell drives, picks up Shai Beal. Help arrives from Russell Barnes! Tracy Mitchell attempts a Dunk. Contested by Russell Barnes (5.6 feet, ZONE). TRACY MITCHELL MAKES IT! Assist: Jayson Cunningham
Score: 119-87

[04:01] Team_004 possession (Score: 119-87)
Shai Beal drives and kicks out. FOUL! Shooting foul on Bam Booker. Shai Beal to the line for 3 free throws. [Team fouls: 2] (Bam Booker: 1 personal fouls)   FT 1/3: GOOD   FT 2/3: GOOD   FT 3/3: GOOD Shai Beal makes 3/3 from the line.
Score: 119-90

[03:45] Team_039 possession (Score: 119-90)
Bam Booker drives, Shai Beal stays with him. Bam Booker attempts a Dunk. Contested by Shai Beal (5.4 feet, MAN). BAM BOOKER MAKES IT! Assist: Jayson Cunningham
Score: 121-90

[03:33] Team_004 possession (Score: 121-90)
FOUL! Holding foul on Yao Carter. [Team fouls: 3] No free throws, side out. (Yao Carter: 1 personal fouls)

[03:22] Team_004 possession (Score: 121-90)
Shai Beal drives to the basket... Shai Beal throws a bad pass out of bounds! TURNOVER! (dead ball)

[03:09] Team_039 possession (Score: 121-90)
Jayson Cunningham attempts a 3Pt. Contested by Karl Reaves (5.3 feet, ZONE). Jayson Cunningham misses. Rebound secured by Shai Beal.

[02:56] Team_004 possession (Score: 121-90)
Karl Reaves drives and kicks out. Russell Barnes attempts a Midrange. Contested by Victor Gasol (3.3 feet, ZONE). Russell Barnes misses. Rebound secured by Bam Booker.

[02:42] Team_039 possession (Score: 121-90)
FOUL! Reach-in foul on Shai Beal during the drive. [IN THE BONUS! 5 team fouls] Victor Gasol to the line for 2 free throws. (Shai Beal: 1 personal fouls)   FT 1/2: MISS   FT 2/2: GOOD Victor Gasol makes 1/2 from the line.
Score: 122-90

[02:28] Team_004 possession (Score: 122-90)
Shai Beal attempts a Midrange. Contested by Bam Booker (4.7 feet, MAN). Shai Beal misses. Rebound secured by Yao Carter.

[02:19] Team_039 possession (Score: 122-90)
Bam Booker drives and kicks out. FOUL! Shooting foul on Karl Reaves. Yao Carter to the line for 3 free throws. [BONUS: 6 team fouls] (Karl Reaves: 1 personal fouls)   FT 1/3: GOOD   FT 2/3: GOOD   FT 3/3: GOOD Yao Carter makes 3/3 from the line.
Score: 125-90

[02:02] Team_004 possession (Score: 125-90)
Russell Barnes drives and kicks out. Karl Reaves attempts a 3Pt. Contested by Tracy Mitchell (5.6 feet, MAN). Karl Reaves misses. Rebound secured by Bam Booker.

[01:49] Team_039 possession (Score: 125-90)
Yao Carter attempts a 3Pt. Contested by Kristaps Green (4.5 feet, MAN). Yao Carter misses. Rebound secured by Michael Sabonis.

[01:35] Team_004 possession (Score: 125-90)
Michael Sabonis drives and kicks out. Karl Reaves attempts a 3Pt. Contested by Tracy Mitchell (5.6 feet, MAN). Karl Reaves misses. Rebound secured by Victor Gasol.

[01:20] Team_039 possession (Score: 125-90)
Victor Gasol attempts a 3Pt. Contested by Russell Barnes (4.8 feet, ZONE). Victor Gasol misses. Rebound secured by Shai Beal.

[01:08] Team_004 possession (Score: 125-90)
Michael Sabonis drives, Victor Gasol stays with him. Michael Sabonis attempts a Layup. Contested by Victor Gasol (3.3 feet, ZONE). MICHAEL SABONIS MAKES IT! Assist: Russell Barnes
Score: 125-92

[00:55] Team_039 possession (Score: 125-92)
Victor Gasol drives, Shai Beal stays with him. Victor Gasol attempts a Dunk. Contested by Shai Beal (5.3 feet, ZONE). VICTOR GASOL MAKES IT! Assist: Tracy Mitchell
Score: 127-92

[00:40] Team_004 possession (Score: 127-92)
FOUL! Shooting foul on Tracy Mitchell. Karl Reaves to the line for 2 free throws. [Team fouls: 4] (Tracy Mitchell: 1 personal fouls)   FT 1/2: MISS   FT 2/2: MISS Karl Reaves makes 0/2 from the line. Rebound secured by Victor Gasol.

[00:28] Team_039 possession (Score: 127-92)
Yao Carter drives to the basket... Yao Carter loses the ball! Stripped by Shai Beal! TURNOVER! (live ball)

[00:13] Team_004 possession (Score: 127-92)
Kristaps Green attempts a 3Pt. Contested by Tracy Mitchell (5.6 feet, ZONE). KRISTAPS GREEN MAKES IT!
Score: 127-95

================================================================================
                              4TH QUARTER COMPLETE                              
================================================================================

4TH QUARTER SCORE: Team_039 24, Team_004 28

BOX SCORE:
================================================================================

Team_039
--------------------------------------------------------------------------------
Player                MIN  PTS  REB  AST  TO      FG   FG%      3P   3P%
--------------------------------------------------------------------------------
Klay Wade              44    5    1    1   0   2/2   100.0     0/0   0.0
Jrue Bridges           44    3    0    0   0   1/2    50.0     0/0   0.0
Victor Gasol            5    3    2    0   0   2/3    66.7     0/0   0.0
Yao Carter              5    3    1    0   0   1/2    50.0     0/0   0.0
Austin O'Neal          44    2    2    1   0   1/3    33.3     0/0   0.0
Donovan Markkanen      44    2    3    1   0   1/3    33.3     0/0   0.0
Anfernee Carter        44    2    0    0   0   1/2    50.0     0/0   0.0
Tracy Mitchell          5    2    0    1   0   1/1   100.0     0/0   0.0
Bam Booker              5    2    2    0   0   1/1   100.0     0/0   0.0
Jayson Cunningham       5    0    0    2   0   0/1     0.0     0/0   0.0

TEAM: FG: 11/20 (55.0%), 3PT: 1/9 (11.1%), REB: 11 (0 off, 11 def), AST: 6, TO: 3
TEAM FOULS: 4


Team_004
--------------------------------------------------------------------------------
Player                MIN  PTS  REB  AST  TO      FG   FG%      3P   3P%
--------------------------------------------------------------------------------
Anthony Lillard        44    9    1    1   0   3/4    75.0     0/0   0.0
Kristaps Green          5    6    0    0   0   2/2   100.0     0/0   0.0
Jabari Wade            44    4    0    1   0   2/2   100.0     0/0   0.0
Shai Beal               5    3    2    0   0   1/2    50.0     0/0   0.0
Dwyane Irving          44    2    5    2   0   1/2    50.0     0/0   0.0
Draymond Fox           44    2    2    0   0   1/4    25.0     0/0   0.0
Michael Sabonis         5    2    1    0   0   1/2    50.0     0/0   0.0
Michael Curry          44    0    0    1   0   0/1     0.0     0/0   0.0
Russell Barnes          5    0    0    2   0   0/1     0.0     0/0   0.0
Karl Reaves             5    0    0    0   0   0/2     0.0     0/0   0.0

TEAM: FG: 11/22 (50.0%), 3PT: 3/5 (60.0%), REB: 11 (2 off, 9 def), AST: 7, TO: 1
TEAM FOULS: 6 [Team_039 in BONUS]

================================================================================

================================================================================
                               FULL GAME COMPLETE                               
================================================================================

FINAL SCORE: Team_039 127, Team_004 95

SCORING BY QUARTER:
--------------------------------------------------------------------------------
Team                     Q1     Q2     Q3     Q4    FINAL
--------------------------------------------------------------------------------
Team_039                 32     47     24     24      127
Team_004                 20     28     19     28       95
--------------------------------------------------------------------------------

FULL GAME BOX SCORE:
================================================================================

Team_039
--------------------------------------------------------------------------------
Player                MIN  PTS  REB  AST  TO      FG   FG%      3P   3P%      FT STL BLK
--------------------------------------------------------------------------------
Jrue Bridges           44   31    0    4   0  10/13   76.9   5/8    62.5   3/3     1   0
Donovan Markkanen      44   29   14   10   3  12/19   63.2   3/8    37.5   8/10    0   1
Austin O'Neal          44   16   15    4   1   6/13   46.2   4/7    57.1   0/0     1   0
Anfernee Carter        44   24    0    3   0  11/15   73.3   4/7    57.1   2/2     0   0
Klay Wade              44   16    7    9   0   8/14   57.1   0/2     0.0   4/4     3   1
Tracy Mitchell          5    2    0    1   0   1/1   100.0   0/0     0.0   0/0     0   0
Jayson Cunningham       5    0    0    2   0   0/1     0.0   0/1     0.0   0/0     0   0
Yao Carter              5    3    1    0   1   0/1     0.0   0/1     0.0   3/3     0   0
Victor Gasol            5    3    2    0   0   2/3    66.7   0/1     0.0   1/2     0   0
Bam Booker              5    2    2    0   0   2/2   100.0   0/0     0.0   0/0     0   0

TEAM: FG: 52/82 (63.4%), 3PT: 16/35 (45.7%), REB: 41 (5 off, 36 def), AST: 33, TO: 5


Team_004
--------------------------------------------------------------------------------
Player                MIN  PTS  REB  AST  TO      FG   FG%      3P   3P%      FT STL BLK
--------------------------------------------------------------------------------
Michael Curry          44   13    0    2   2   5/11   45.5   3/7    42.9   0/0     0   0
Jabari Wade            44   17    0    4   0   8/14   57.1   3/4    75.0   1/1     1   0
Dwyane Irving          44   15   19    9   1   7/16   43.8   1/4    25.0   2/3     0   0
Draymond Fox           44   14    9    3   1   8/13   61.5   1/2    50.0   4/6     1   1
Anthony Lillard        44   23   15    2   3   8/15   53.3   1/3    33.3   3/7     1   0
Karl Reaves             5    0    0    0   1   0/2     0.0   0/0     0.0   0/2     0   0
Russell Barnes          5    0    0    2   0   0/1     0.0   0/0     0.0   0/0     0   0
Kristaps Green          5    6    0    0   0   2/2   100.0   2/2   100.0   0/0     0   0
Michael Sabonis         5    2    1    0   0   1/2    50.0   0/0     0.0   0/0     0   0
Shai Beal               5    3    2    0   0   1/2    50.0   0/0     0.0   3/3     1   0

TEAM: FG: 40/78 (51.3%), 3PT: 11/22 (50.0%), REB: 46 (16 off, 30 def), AST: 22, TO: 8

================================================================================
