================================================================================
                        FULL GAME - Team_018 vs Team_095                        
================================================================================

================================================================================
                       1ST QUARTER - Team_018 vs Team_095                       
================================================================================

[12:00] Team_018 possession (Score: 0-0)
Allen Markkanen drives, Immanuel Middleton stays with him. Allen Markkanen attempts a Dunk. Contested by Immanuel Middleton (5.2 feet, ZONE). ALLEN MARKKANEN MAKES IT! Assist: Bones Anunoby
Score: 2-0

[11:42] Team_095 possession (Score: 2-0)
Shaquille Ball attempts a 3Pt. Contested by Tracy Bryant (3.4 feet, MAN). Shaquille Ball misses. Rebound secured by Allen Markkanen.

[11:32] Team_018 possession (Score: 2-0)
Domantas Wall attempts a Midrange. Contested by Kyrie Ming (5.4 feet, MAN). DOMANTAS WALL MAKES IT! Assist: Klay Stewart
Score: 4-0

[11:16] Team_095 possession (Score: 4-0)
Dejounte Hyland attempts a Layup. Contested by Domantas Wall (3.4 feet, ZONE). Dejounte Hyland misses. Rebound secured by Domantas Wall.

[11:03] Team_018 possession (Score: 4-0)
Klay Stewart attempts a 3Pt. Contested by Dejounte Hyland (5.1 feet, MAN). KLAY STEWART MAKES IT! Assist: Domantas Wall
Score: 7-0

[10:54] Team_095 possession (Score: 7-0)
Immanuel Middleton attempts a Midrange. Contested by Allen Markkanen (3.8 feet, ZONE). Immanuel Middleton misses. Rebound secured by Bones Anunoby.

[10:40] Team_018 possession (Score: 7-0)
Allen Markkanen makes the Layup and draws the foul on Evan Carter! And-1! Allen Markkanen to the line for 1. [Team fouls: 1] (Evan Carter: 1 personal fouls)   FT 1/1: GOOD Allen Markkanen makes 1/1 from the line.
Score: 10-0

[10:27] Team_095 possession (Score: 10-0)
Kyrie Ming attempts a 3Pt. Contested by Klay Stewart (4.3 feet, ZONE). Kyrie Ming misses. Rebound secured by Allen Markkanen.

[10:16] Team_018 possession (Score: 10-0)
Klay Stewart makes the Dunk and draws the foul on Dejounte Hyland! And-1! Klay Stewart to the line for 1. [Team fouls: 2] (Dejounte Hyland: 1 personal fouls)   FT 1/1: MISS Klay Stewart makes 0/1 from the line. Rebound secured by Dejounte Hyland.
Score: 12-0

[09:59] Team_095 possession (Score: 12-0)
Shaquille Ball attempts a 3Pt. Contested by Tracy Bryant (3.4 feet, MAN). Shaquille Ball misses. Rebound secured by Domantas Wall.

[09:43] Team_018 possession (Score: 12-0)
Tracy Bryant makes the Layup and draws the foul on Shaquille Ball! And-1! Tracy Bryant to the line for 1. [Team fouls: 3] (Shaquille Ball: 1 personal fouls)   FT 1/1: GOOD Tracy Bryant makes 1/1 from the line.
Score: 15-0

[09:32] Team_095 possession (Score: 15-0)
Dejounte Hyland drives, picks up Klay Stewart. Help arrives from Allen Markkanen! Dejounte Hyland attempts a Layup. Contested by Allen Markkanen (4.1 feet, MAN). Dejounte Hyland misses. Rebound secured by Allen Markkanen.

[09:14] Team_018 possession (Score: 15-0)
Allen Markkanen attempts a 3Pt. Contested by Evan Carter (4.2 feet, MAN). ALLEN MARKKANEN MAKES IT! Assist: Bones Anunoby
Score: 18-0

[09:00] Team_095 possession (Score: 18-0)
Immanuel Middleton drives, Domantas Wall stays with him. Immanuel Middleton attempts a Dunk. Contested by Domantas Wall (3.4 feet, ZONE). IMMANUEL MIDDLETON MAKES IT! Assist: Evan Carter
Score: 18-2

[08:46] Team_018 possession (Score: 18-2)
Bones Anunoby attempts a Midrange. Contested by Immanuel Middleton (5.2 feet, MAN). Bones Anunoby misses. Rebound secured by Evan Carter.

[08:32] Team_095 possession (Score: 18-2)
Evan Carter attempts a 3Pt. Contested by Allen Markkanen (4.1 feet, MAN). Evan Carter misses. FOUL! Loose ball foul on Bones Anunoby during the rebound battle. [Team fouls: 1] No free throws, side out. (Bones Anunoby: 1 personal fouls)

[08:16] Team_095 possession (Score: 18-2)
Kyrie Ming drives, Domantas Wall stays with him. Kyrie Ming attempts a Layup. Contested by Domantas Wall (3.6 feet, ZONE). KYRIE MING MAKES IT!
Score: 18-4

[08:02] Team_018 possession (Score: 18-4)
Domantas Wall drives and kicks out. Bones Anunoby attempts a Midrange. Contested by Evan Carter (3.8 feet, ZONE). BONES ANUNOBY MAKES IT!
Score: 20-4

[07:47] Team_095 possession (Score: 20-4)
Kyrie Ming attempts a 3Pt. Contested by Domantas Wall (3.6 feet, MAN). Kyrie Ming misses. Offensive rebound by Dejounte Hyland! Dejounte Hyland kicks it out.

[07:29] Team_095 possession (Score: 20-4)
Shaquille Ball drives and kicks out. Shaquille Ball attempts a 3Pt. Contested by Tracy Bryant (3.4 feet, MAN). SHAQUILLE BALL MAKES IT! Assist: Immanuel Middleton
Score: 20-7

[07:15] Team_018 possession (Score: 20-7)
Allen Markkanen drives to the basket... Allen Markkanen throws a bad pass! Stolen by Evan Carter! TURNOVER! (live ball)

[07:01] Team_095 possession (Score: 20-7)
Dejounte Hyland attempts a Midrange. Contested by Klay Stewart (4.1 feet, MAN). DEJOUNTE HYLAND MAKES IT!
Score: 20-9

[06:48] Team_018 possession (Score: 20-9)
Tracy Bryant attempts a Midrange. Contested by Shaquille Ball (4.7 feet, MAN). Tracy Bryant misses. Rebound secured by Evan Carter.

[06:34] Team_095 possession (Score: 20-9)
Immanuel Middleton makes the Layup and draws the foul on Domantas Wall! And-1! Immanuel Middleton to the line for 1. [Team fouls: 2] (Domantas Wall: 1 personal fouls)   FT 1/1: GOOD Immanuel Middleton makes 1/1 from the line.
Score: 20-12

[06:24] Team_018 possession (Score: 20-12)
Bones Anunoby attempts a 3Pt. Contested by Immanuel Middleton (5.2 feet, MAN). Bones Anunoby misses. Offensive rebound by Bones Anunoby! Bones Anunoby kicks it out.

[06:10] Team_018 possession (Score: 20-12)
Allen Markkanen drives, picks up Evan Carter. Help arrives from Dejounte Hyland! Allen Markkanen attempts a Dunk. Contested by Dejounte Hyland (4.2 feet, MAN). Allen Markkanen misses. Rebound secured by Evan Carter.

[05:53] Team_095 possession (Score: 20-12)
Shaquille Ball attempts a Midrange. Contested by Tracy Bryant (3.4 feet, MAN). Shaquille Ball misses. Rebound secured by Domantas Wall.

[05:39] Team_018 possession (Score: 20-12)
FOUL! Holding foul on Shaquille Ball. [Team fouls: 4] No free throws, side out. (Shaquille Ball: 2 personal fouls)

[05:24] Team_018 possession (Score: 20-12)
Tracy Bryant loses control! Ball rolls out of bounds! TURNOVER! (dead ball)

[05:14] Team_095 possession (Score: 20-12)
FOUL! Shooting foul on Bones Anunoby. Immanuel Middleton to the line for 2 free throws. [Team fouls: 3] (Bones Anunoby: 2 personal fouls)   FT 1/2: GOOD   FT 2/2: GOOD Immanuel Middleton makes 2/2 from the line.
Score: 20-14

[05:04] Team_018 possession (Score: 20-14)
Bones Anunoby attempts a 3Pt. Contested by Evan Carter (4.2 feet, ZONE). Bones Anunoby misses. Rebound secured by Dejounte Hyland.

[04:55] Team_095 possession (Score: 20-14)
Evan Carter makes the Layup and draws the foul on Allen Markkanen! And-1! Evan Carter to the line for 1. [Team fouls: 4] (Allen Markkanen: 1 personal fouls)   FT 1/1: GOOD Evan Carter makes 1/1 from the line.
Score: 20-17

[04:40] Team_018 possession (Score: 20-17)
Domantas Wall makes the Layup and draws the foul on Immanuel Middleton! And-1! Domantas Wall to the line for 1. [BONUS: 5 team fouls] (Immanuel Middleton: 1 personal fouls)   FT 1/1: GOOD Domantas Wall makes 1/1 from the line.
Score: 23-17

[04:27] Team_095 possession (Score: 23-17)
FOUL! Shooting foul on Klay Stewart. Evan Carter to the line for 3 free throws. [BONUS: 5 team fouls] (Klay Stewart: 1 personal fouls)   FT 1/3: MISS   FT 2/3: GOOD   FT 3/3: MISS Evan Carter makes 1/3 from the line. Rebound secured by Domantas Wall.
Score: 23-18

[04:12] Team_018 possession (Score: 23-18)
Klay Stewart makes the Layup and draws the foul on Dejounte Hyland! And-1! Klay Stewart to the line for 1. [BONUS: 6 team fouls] (Dejounte Hyland: 2 personal fouls)   FT 1/1: GOOD Klay Stewart makes 1/1 from the line.
Score: 26-18

[03:58] Team_095 possession (Score: 26-18)
Evan Carter drives and kicks out. Shaquille Ball attempts a 3Pt. Contested by Tracy Bryant (3.5 feet, MAN). SHAQUILLE BALL MAKES IT! Assist: Kyrie Ming
Score: 26-21

[03:46] Team_018 possession (Score: 26-21)
Bones Anunoby drives to the basket... Bones Anunoby throws a bad pass! Stolen by Immanuel Middleton! TURNOVER! (live ball)

[03:32] Team_095 possession (Score: 26-21)
FOUL! Shooting foul on Domantas Wall. Kyrie Ming to the line for 2 free throws. [BONUS: 6 team fouls] (Domantas Wall: 2 personal fouls)   FT 1/2: MISS   FT 2/2: GOOD Kyrie Ming makes 1/2 from the line.
Score: 26-22

[03:20] Team_018 possession (Score: 26-22)
Domantas Wall attempts a Midrange. Contested by Immanuel Middleton (5.3 feet, ZONE). DOMANTAS WALL MAKES IT! Assist: Tracy Bryant
Score: 28-22

[03:03] Team_095 possession (Score: 28-22)
Kyrie Ming attempts a Layup. Contested by Domantas Wall (4.0 feet, MAN). KYRIE MING MAKES IT!
Score: 28-24

[02:51] Team_018 possession (Score: 28-24)
Tracy Bryant drives, Shaquille Ball stays with him. Tracy Bryant attempts a Layup. Contested by Shaquille Ball (4.9 feet, MAN). TRACY BRYANT MAKES IT!
Score: 30-24

[02:38] Team_095 possession (Score: 30-24)
Evan Carter attempts a Layup. Contested by Allen Markkanen (4.2 feet, MAN). EVAN CARTER MAKES IT! Assist: Shaquille Ball
Score: 30-26

[02:23] Team_018 possession (Score: 30-26)
Allen Markkanen drives, Evan Carter stays with him. Allen Markkanen attempts a Layup. Contested by Evan Carter (4.5 feet, MAN). ALLEN MARKKANEN MAKES IT! Assist: Bones Anunoby
Score: 32-26

[02:09] Team_095 possession (Score: 32-26)
FOUL! Reach-in foul on Domantas Wall during the drive. [IN THE BONUS! 7 team fouls] Kyrie Ming to the line for 2 free throws. (Domantas Wall: 3 personal fouls)   FT 1/2: GOOD   FT 2/2: MISS Kyrie Ming makes 1/2 from the line. Rebound secured by Allen Markkanen.
Score: 32-27

[01:55] Team_018 possession (Score: 32-27)
Domantas Wall drives and kicks out. Klay Stewart attempts a 3Pt. Contested by Dejounte Hyland (5.2 feet, MAN). Klay Stewart misses. Rebound secured by Shaquille Ball.

[01:44] Team_095 possession (Score: 32-27)
Evan Carter attempts a 3Pt. Contested by Allen Markkanen (4.3 feet, MAN). EVAN CARTER MAKES IT! Assist: Kyrie Ming
Score: 32-30

[01:27] Team_018 possession (Score: 32-30)
Allen Markkanen attempts a 3Pt. Contested by Evan Carter (4.6 feet, MAN). Allen Markkanen misses. Rebound secured by Shaquille Ball.

[01:09] Team_095 possession (Score: 32-30)
Evan Carter makes the Dunk and draws the foul on Domantas Wall! And-1! Evan Carter to the line for 1. [BONUS: 8 team fouls] (Domantas Wall: 4 personal fouls)   FT 1/1: GOOD Evan Carter makes 1/1 from the line.
Score: 32-33

[00:50] Team_018 possession (Score: 32-33)
Klay Stewart attempts a Midrange. Contested by Dejounte Hyland (5.5 feet, MAN). Klay Stewart misses. Offensive rebound by Bones Anunoby! Bones Anunoby kicks it out.

[00:37] Team_018 possession (Score: 32-33)
Bones Anunoby attempts a Layup. Contested by Immanuel Middleton (5.7 feet, ZONE). Bones Anunoby misses. Rebound secured by Evan Carter.

[00:19] Team_095 possession (Score: 32-33)
Immanuel Middleton attempts a 3Pt. Contested by Klay Stewart (4.5 feet, ZONE). Immanuel Middleton misses. Offensive rebound by Dejounte Hyland! Dejounte Hyland kicks it out.

[00:03] Team_095 possession (Score: 32-33)
Evan Carter drives and kicks out. Immanuel Middleton attempts a Midrange. Contested by Bones Anunoby (4.1 feet, ZONE). Immanuel Middleton misses. Offensive rebound by Evan Carter! Evan Carter's putback is no good. Rebound secured by Bones Anunoby.

================================================================================
                              1ST QUARTER COMPLETE                              
================================================================================

1ST QUARTER SCORE: Team_018 32, Team_095 33

BOX SCORE:
================================================================================

Team_018
--------------------------------------------------------------------------------
Player                MIN  PTS  REB  AST  TO      FG   FG%      3P   3P%
--------------------------------------------------------------------------------
Allen Markkanen        12   10    4    0   0   4/6    66.7     0/0   0.0
Domantas Wall          12    7    4    1   0   3/4    75.0     0/0   0.0
Klay Stewart           12    6    0    1   0   2/3    66.7     0/0   0.0
Tracy Bryant           12    5    0    1   0   2/3    66.7     0/0   0.0

TEAM: FG: 12/20 (60.0%), 3PT: 2/4 (50.0%), REB: 11 (2 off, 9 def), AST: 6, TO: 3
TEAM FOULS: 8 [Team_095 in BONUS]


Team_095
--------------------------------------------------------------------------------
Player                MIN  PTS  REB  AST  TO      FG   FG%      3P   3P%
--------------------------------------------------------------------------------
Evan Carter            12   11    4    1   0   4/6    66.7     0/0   0.0
Immanuel Middleton     12    7    0    1   0   3/4    75.0     0/0   0.0
Shaquille Ball         12    6    2    1   0   2/5    40.0     0/0   0.0
Kyrie Ming             12    5    0    2   0   3/5    60.0     0/0   0.0
Bones Anunoby          12    2    4    3   0   1/4    25.0     0/0   0.0
Dejounte Hyland        12    2    5    0   0   1/3    33.3     0/0   0.0

TEAM: FG: 13/23 (56.5%), 3PT: 1/5 (20.0%), REB: 12 (4 off, 8 def), AST: 5, TO: 0
TEAM FOULS: 6 [Team_018 in BONUS]

================================================================================

================================================================================
                       2ND QUARTER - Team_018 vs Team_095                       
================================================================================

[12:00] Team_018 possession (Score: 32-33)
Allen Markkanen drives to the basket... Allen Markkanen throws a bad pass! Stolen by Evan Carter! TURNOVER! (live ball)

[11:44] Team_095 possession (Score: 32-33)
Immanuel Middleton drives and kicks out. Kyrie Ming attempts a Midrange. Contested by Klay Stewart (4.4 feet, ZONE). Kyrie Ming misses. Rebound secured by Domantas Wall.

[11:30] Team_018 possession (Score: 32-33)
Allen Markkanen attempts a 3Pt. Contested by Evan Carter (4.6 feet, MAN). Allen Markkanen misses. FOUL! Loose ball foul on Evan Carter during the rebound battle. [Team fouls: 1] No free throws, side out. (Evan Carter: 1 personal fouls)

[11:19] Team_018 possession (Score: 32-33)
Domantas Wall attempts a Midrange. Contested by Kyrie Ming (5.7 feet, MAN). DOMANTAS WALL MAKES IT!
Score: 34-33

[11:04] Team_095 possession (Score: 34-33)
Immanuel Middleton drives to the basket... FOUL! Offensive foul on Immanuel Middleton! Bones Anunoby drew the charge! [Team fouls: 2] (Immanuel Middleton: 1 personal fouls) TURNOVER! (dead ball)

[10:52] Team_018 possession (Score: 34-33)
Allen Markkanen attempts a Layup. Contested by Immanuel Middleton (5.7 feet, ZONE). ALLEN MARKKANEN MAKES IT! Assist: Tracy Bryant
Score: 36-33

[10:41] Team_095 possession (Score: 36-33)
Kyrie Ming attempts a 3Pt. Contested by Klay Stewart (4.7 feet, ZONE). Kyrie Ming misses. Rebound secured by Domantas Wall.

[10:28] Team_018 possession (Score: 36-33)
FOUL! Holding foul on Dejounte Hyland. [Team fouls: 3] No free throws, side out. (Dejounte Hyland: 1 personal fouls)

[10:14] Team_018 possession (Score: 36-33)
Domantas Wall attempts a Layup. Contested by Immanuel Middleton (5.7 feet, ZONE). DOMANTAS WALL MAKES IT! Assist: Tracy Bryant
Score: 38-33

[10:00] Team_095 possession (Score: 38-33)
Shaquille Ball attempts a 3Pt. Contested by Klay Stewart (4.6 feet, ZONE). SHAQUILLE BALL MAKES IT! Assist: Dejounte Hyland
Score: 38-36

[09:45] Team_018 possession (Score: 38-36)
Tracy Bryant attempts a 3Pt. Contested by Shaquille Ball (5.2 feet, MAN). TRACY BRYANT MAKES IT! Assist: Domantas Wall
Score: 41-36

[09:30] Team_095 possession (Score: 41-36)
FOUL! Holding foul on Domantas Wall. [Team fouls: 1] No free throws, side out. (Domantas Wall: 1 personal fouls)

[09:13] Team_095 possession (Score: 41-36)
Immanuel Middleton attempts a 3Pt. Contested by Klay Stewart (4.7 feet, ZONE). Immanuel Middleton misses. Rebound secured by Domantas Wall.

[08:59] Team_018 possession (Score: 41-36)
Klay Stewart drives, Dejounte Hyland stays with him. Klay Stewart attempts a Layup. Contested by Dejounte Hyland (5.7 feet, MAN). KLAY STEWART MAKES IT! Assist: Tracy Bryant
Score: 43-36

[08:50] Team_095 possession (Score: 43-36)
Dejounte Hyland attempts a Layup. BLOCKED BY KLAY STEWART! Ball goes out off Klay Stewart. Dejounte Hyland's ball!

[08:36] Team_095 possession (Score: 43-36)
Shaquille Ball drives and kicks out. Shaquille Ball attempts a Midrange. Contested by Tracy Bryant (4.2 feet, MAN). Shaquille Ball misses. Offensive rebound by Evan Carter! Evan Carter kicks it out.

[08:20] Team_095 possession (Score: 43-36)
Dejounte Hyland attempts a 3Pt. Contested by Klay Stewart (4.8 feet, MAN). Dejounte Hyland misses. Rebound secured by Domantas Wall.

[08:07] Team_018 possession (Score: 43-36)
Domantas Wall drives and kicks out. Bones Anunoby attempts a 3Pt. Contested by Evan Carter (4.8 feet, ZONE). Bones Anunoby misses. Rebound secured by Dejounte Hyland.

[07:48] Team_095 possession (Score: 43-36)
Shaquille Ball attempts a Midrange. Contested by Tracy Bryant (4.2 feet, MAN). Shaquille Ball misses. Rebound secured by Domantas Wall.

[07:34] Team_018 possession (Score: 43-36)
Allen Markkanen attempts a 3Pt. Contested by Evan Carter (5.1 feet, ZONE). Allen Markkanen misses. Offensive rebound by Bones Anunoby! Bones Anunoby kicks it out.

[07:21] Team_018 possession (Score: 43-36)
Tracy Bryant attempts a Layup. Wide open! Immanuel Middleton is 6.2 feet away. [ZONE] TRACY BRYANT MAKES IT!
Score: 45-36

[07:07] Team_095 possession (Score: 45-36)
Dejounte Hyland drives and kicks out. Dejounte Hyland attempts a 3Pt. Contested by Klay Stewart (5.1 feet, MAN). DEJOUNTE HYLAND MAKES IT! Assist: Immanuel Middleton
Score: 45-39

[06:49] Team_018 possession (Score: 45-39)
Domantas Wall attempts a Layup. Wide open! Immanuel Middleton is 6.1 feet away. [ZONE] DOMANTAS WALL MAKES IT!
Score: 47-39

[06:36] Team_095 possession (Score: 47-39)
Shaquille Ball attempts a Midrange. Contested by Tracy Bryant (4.4 feet, MAN). SHAQUILLE BALL MAKES IT!
Score: 47-41

[06:22] Team_018 possession (Score: 47-41)
Allen Markkanen attempts a 3Pt. Contested by Evan Carter (5.2 feet, MAN). Allen Markkanen misses. Rebound secured by Shaquille Ball.

[06:06] Team_095 possession (Score: 47-41)
Shaquille Ball loses the ball! Stripped by Tracy Bryant! TURNOVER! (live ball)

[05:52] Team_018 possession (Score: 47-41)
Tracy Bryant throws a bad pass! Stolen by Shaquille Ball! TURNOVER! (live ball)

[05:34] Team_095 possession (Score: 47-41)
Shaquille Ball drives to the basket... Shaquille Ball throws a bad pass out of bounds! TURNOVER! (dead ball)

[05:34] Substitution (Team_018): Klay Stewart OUT → Michael Simons IN (stamina_rule2)

[05:34] Substitution (Team_018): Tracy Bryant OUT → Miles Herro IN (stamina_rule2)

[05:34] Substitution (Team_018): Allen Markkanen OUT → Austin Antetokounmpo IN (stamina_rule2)

[05:34] Substitution (Team_018): Bones Anunoby OUT → Shai Wade IN (stamina_rule2)

[05:34] Substitution (Team_018): Domantas Wall OUT → Julius Jackson IN (stamina_rule2)

[05:34] Substitution (Team_095): Dejounte Hyland OUT → Kyle Poole IN (stamina_rule2)

[05:34] Substitution (Team_095): Shaquille Ball OUT → Cade Beal IN (stamina_rule2)

[05:34] Substitution (Team_095): Evan Carter OUT → Tobias Wagner IN (stamina_rule2)

[05:34] Substitution (Team_095): Immanuel Middleton OUT → Gary Davis IN (stamina_rule2)

[05:34] Substitution (Team_095): Kyrie Ming OUT → DeMar McCollum IN (stamina_rule2)

[05:23] Team_018 possession (Score: 47-41)
Shai Wade drives to the basket... Shai Wade loses the ball! Stripped by Gary Davis! TURNOVER! (live ball)

[05:08] Team_095 possession (Score: 47-41)
Cade Beal attempts a 3Pt. Contested by Miles Herro (5.4 feet, MAN). CADE BEAL MAKES IT! Assist: Tobias Wagner
Score: 47-44

[04:49] Team_018 possession (Score: 47-44)
Miles Herro attempts a 3Pt. Contested by Cade Beal (4.6 feet, MAN). Miles Herro misses. FOUL! Loose ball foul on Tobias Wagner during the rebound battle. [Team fouls: 4] No free throws, side out. (Tobias Wagner: 1 personal fouls)

[04:30] Team_018 possession (Score: 47-44)
Austin Antetokounmpo attempts a Layup. BLOCKED BY TOBIAS WAGNER! Ball is loose! Offensive rebound by Shai Wade! Shai Wade kicks it out.

[04:15] Team_018 possession (Score: 47-44)
Miles Herro drives, Cade Beal stays with him. Miles Herro attempts a Layup. Contested by Cade Beal (4.6 feet, MAN). MILES HERRO MAKES IT! Assist: Michael Simons
Score: 49-44

[04:00] Team_095 possession (Score: 49-44)
Tobias Wagner drives and kicks out. Cade Beal attempts a 3Pt. Contested by Miles Herro (5.5 feet, MAN). CADE BEAL MAKES IT! Assist: Gary Davis
Score: 49-47

[03:44] Team_018 possession (Score: 49-47)
Miles Herro attempts a 3Pt. Contested by Cade Beal (4.6 feet, ZONE). Miles Herro misses. Rebound secured by Gary Davis.

[03:29] Team_095 possession (Score: 49-47)
DeMar McCollum attempts a Midrange. Wide open! Miles Herro is 6.1 feet away. [ZONE] DEMAR MCCOLLUM MAKES IT! Assist: Gary Davis
Score: 49-49

[03:11] Team_018 possession (Score: 49-49)
Michael Simons drives, Kyle Poole stays with him. Michael Simons attempts a Dunk. Contested by Kyle Poole (5.0 feet, MAN). MICHAEL SIMONS MAKES IT! Assist: Miles Herro
Score: 51-49

[02:59] Team_095 possession (Score: 51-49)
FOUL! Reach-in foul on Austin Antetokounmpo during the drive. [Team fouls: 2] No free throws, side out. (Austin Antetokounmpo: 1 personal fouls)

[02:43] Team_095 possession (Score: 51-49)
DeMar McCollum attempts a Midrange. Contested by Julius Jackson (5.4 feet, MAN). DeMar McCollum misses. Rebound secured by Shai Wade.

[02:31] Team_018 possession (Score: 51-49)
Shai Wade drives to the basket... Shai Wade loses the ball! Stripped by Gary Davis! TURNOVER! (live ball)

[02:17] Team_095 possession (Score: 51-49)
Tobias Wagner drives and kicks out. DeMar McCollum attempts a Midrange. Contested by Julius Jackson (4.8 feet, MAN). DeMar McCollum misses. Rebound secured by Julius Jackson.

[02:08] Team_018 possession (Score: 51-49)
Miles Herro attempts a 3Pt. Contested by Cade Beal (4.6 feet, ZONE). MILES HERRO MAKES IT! Assist: Julius Jackson
Score: 54-49

[01:54] Team_095 possession (Score: 54-49)
DeMar McCollum drives and kicks out. Cade Beal attempts a 3Pt. Contested by Miles Herro (5.5 feet, MAN). CADE BEAL MAKES IT! Assist: Gary Davis
Score: 54-52

[01:40] Team_018 possession (Score: 54-52)
Miles Herro attempts a 3Pt. Contested by Cade Beal (4.6 feet, MAN). Miles Herro misses. Rebound secured by DeMar McCollum.

[01:26] Team_095 possession (Score: 54-52)
Kyle Poole attempts a Midrange. Contested by Michael Simons (5.8 feet, MAN). KYLE POOLE MAKES IT! Assist: Gary Davis
Score: 54-54

[01:13] Team_018 possession (Score: 54-54)
Michael Simons drives and kicks out. Miles Herro attempts a 3Pt. Contested by Cade Beal (4.4 feet, ZONE). Miles Herro misses. Rebound secured by DeMar McCollum.

[00:58] Team_095 possession (Score: 54-54)
Gary Davis loses the ball! Stripped by Shai Wade! TURNOVER! (live ball)

[00:46] Team_018 possession (Score: 54-54)
Michael Simons attempts a 3Pt. Contested by Kyle Poole (5.0 feet, MAN). Michael Simons misses. Rebound secured by Tobias Wagner.

[00:32] Team_095 possession (Score: 54-54)
Cade Beal attempts a 3Pt. Contested by Miles Herro (5.4 feet, MAN). Cade Beal misses. Rebound secured by Julius Jackson.

[00:16] Team_018 possession (Score: 54-54)
Austin Antetokounmpo attempts a 3Pt. Contested by Tobias Wagner (3.2 feet, MAN). Austin Antetokounmpo misses. Rebound secured by Gary Davis.

================================================================================
                              2ND QUARTER COMPLETE                              
================================================================================

2ND QUARTER SCORE: Team_018 22, Team_095 21

BOX SCORE:
================================================================================

Team_018
--------------------------------------------------------------------------------
Player                MIN  PTS  REB  AST  TO      FG   FG%      3P   3P%
--------------------------------------------------------------------------------
Domantas Wall          19    6    5    1   0   3/4    75.0     0/0   0.0
Tracy Bryant           19    5    0    3   0   2/2   100.0     0/0   0.0
Miles Herro             5    5    0    1   0   2/4    50.0     0/0   0.0
Allen Markkanen        19    2    0    0   0   1/2    50.0     0/0   0.0
Klay Stewart           19    2    0    0   0   1/1   100.0     0/0   0.0
Michael Simons          5    2    0    1   0   1/3    33.3     0/0   0.0
Bones Anunoby          19    0    2    0   0   0/0     0.0     0/0   0.0
Shai Wade               5    0    3    0   0   0/0     0.0     0/0   0.0
Julius Jackson          5    0    2    1   0   0/0     0.0     0/0   0.0
Austin Antetokounmpo    5    0    0    0   0   0/1     0.0     0/0   0.0

TEAM: FG: 10/17 (58.8%), 3PT: 2/7 (28.6%), REB: 12 (4 off, 8 def), AST: 7, TO: 4
TEAM FOULS: 2


Team_095
--------------------------------------------------------------------------------
Player                MIN  PTS  REB  AST  TO      FG   FG%      3P   3P%
--------------------------------------------------------------------------------
Cade Beal               5    9    0    0   0   3/4    75.0     0/0   0.0
Shaquille Ball         19    5    1    0   0   2/3    66.7     0/0   0.0
Dejounte Hyland        19    3    1    1   0   1/2    50.0     0/0   0.0
DeMar McCollum          5    2    2    0   0   1/2    50.0     0/0   0.0
Kyle Poole              5    2    0    0   0   1/1   100.0     0/0   0.0
Immanuel Middleton     19    0    0    1   0   0/2     0.0     0/0   0.0
Kyrie Ming             19    0    0    0   0   0/1     0.0     0/0   0.0
Evan Carter            19    0    1    0   0   0/0     0.0     0/0   0.0
Tobias Wagner           5    0    1    1   0   0/1     0.0     0/0   0.0
Gary Davis              5    0    2    4   0   0/0     0.0     0/0   0.0

TEAM: FG: 8/16 (50.0%), 3PT: 2/6 (33.3%), REB: 8 (1 off, 7 def), AST: 7, TO: 4
TEAM FOULS: 4

================================================================================

================================================================================
                       3RD QUARTER - Team_018 vs Team_095                       
================================================================================

[12:00] Team_018 possession (Score: 54-54)
Allen Markkanen attempts a Dunk. BLOCKED BY EVAN CARTER! Ball is loose! Rebound secured by Shaquille Ball.

[11:44] Team_095 possession (Score: 54-54)
Evan Carter attempts a 3Pt. Contested by Allen Markkanen (4.1 feet, MAN). EVAN CARTER MAKES IT! Assist: Shaquille Ball
Score: 54-57

[11:28] Team_018 possession (Score: 54-57)
Domantas Wall attempts a Midrange. Contested by Kyrie Ming (5.4 feet, MAN). DOMANTAS WALL MAKES IT!
Score: 56-57

[11:13] Team_095 possession (Score: 56-57)
Evan Carter drives and kicks out. Kyrie Ming attempts a 3Pt. Contested by Allen Markkanen (3.8 feet, ZONE). Kyrie Ming misses. Rebound secured by Bones Anunoby.

[11:01] Team_018 possession (Score: 56-57)
Allen Markkanen attempts a 3Pt. Contested by Evan Carter (4.2 feet, MAN). Allen Markkanen misses. Rebound secured by Evan Carter.

[10:44] Team_095 possession (Score: 56-57)
Immanuel Middleton attempts a Midrange. Contested by Bones Anunoby (3.3 feet, MAN). IMMANUEL MIDDLETON MAKES IT!
Score: 56-59

[10:32] Team_018 possession (Score: 56-59)
Domantas Wall drives, Immanuel Middleton stays with him. Domantas Wall attempts a Layup. Contested by Immanuel Middleton (5.1 feet, ZONE). DOMANTAS WALL MAKES IT! Assist: Tracy Bryant
Score: 58-59

[10:18] Team_095 possession (Score: 58-59)
Evan Carter throws a bad pass! Stolen by Allen Markkanen! TURNOVER! (live ball)

[10:02] Team_018 possession (Score: 58-59)
FOUL! Offensive foul on Klay Stewart! Dejounte Hyland drew the charge! [Team fouls: 1] (Klay Stewart: 1 personal fouls) TURNOVER! (dead ball)

[09:47] Team_095 possession (Score: 58-59)
Dejounte Hyland drives and kicks out. Immanuel Middleton attempts a Midrange. Contested by Bones Anunoby (3.3 feet, MAN). IMMANUEL MIDDLETON MAKES IT!
Score: 58-61

[09:33] Team_018 possession (Score: 58-61)
Bones Anunoby attempts a 3Pt. Contested by Evan Carter (4.2 feet, ZONE). BONES ANUNOBY MAKES IT! Assist: Allen Markkanen
Score: 61-61

[09:22] Team_095 possession (Score: 61-61)
Kyrie Ming drives, Domantas Wall stays with him. Kyrie Ming attempts a Layup. Contested by Domantas Wall (3.6 feet, ZONE). Kyrie Ming misses. FOUL! Loose ball foul on Bones Anunoby during the rebound battle. [Team fouls: 2] No free throws, side out. (Bones Anunoby: 1 personal fouls)

[09:10] Team_095 possession (Score: 61-61)
Dejounte Hyland attempts a 3Pt. BLOCKED BY KLAY STEWART! Ball deflects out of bounds off Dejounte Hyland.

[08:56] Team_018 possession (Score: 61-61)
FOUL! Reach-in foul on Dejounte Hyland during the drive. [Team fouls: 1] No free throws, side out. (Dejounte Hyland: 1 personal fouls)

[08:42] Team_018 possession (Score: 61-61)
FOUL! Reach-in foul on Kyrie Ming during the drive. [Team fouls: 2] No free throws, side out. (Kyrie Ming: 1 personal fouls)

[08:31] Team_018 possession (Score: 61-61)
Allen Markkanen drives to the basket... FOUL! Offensive foul on Allen Markkanen! Evan Carter drew the charge! [Team fouls: 3] (Allen Markkanen: 1 personal fouls) TURNOVER! (dead ball)

[08:18] Team_095 possession (Score: 61-61)
Immanuel Middleton drives, picks up Domantas Wall. Help arrives from Klay Stewart! Immanuel Middleton attempts a Layup. Contested by Klay Stewart (3.4 feet, ZONE). Immanuel Middleton misses. FOUL! Loose ball foul on Domantas Wall during the rebound battle. [Team fouls: 4] No free throws, side out. (Domantas Wall: 1 personal fouls)

[08:08] Team_095 possession (Score: 61-61)
Kyrie Ming drives to the basket... Kyrie Ming throws a bad pass! Stolen by Domantas Wall! TURNOVER! (live ball)

[07:53] Team_018 possession (Score: 61-61)
Tracy Bryant drives and kicks out. Tracy Bryant attempts a 3Pt. Contested by Evan Carter (3.8 feet, ZONE). TRACY BRYANT MAKES IT!
Score: 64-61

[07:37] Team_095 possession (Score: 64-61)
Kyrie Ming drives, picks up Domantas Wall. Help arrives from Klay Stewart! Kyrie Ming attempts a Dunk. Contested by Klay Stewart (3.6 feet, MAN). KYRIE MING MAKES IT!
Score: 64-63

[07:23] Team_018 possession (Score: 64-63)
FOUL! Reach-in foul on Immanuel Middleton during the drive. [Team fouls: 3] No free throws, side out. (Immanuel Middleton: 1 personal fouls)

[07:08] Team_018 possession (Score: 64-63)
Klay Stewart attempts a 3Pt. Contested by Dejounte Hyland (5.1 feet, MAN). KLAY STEWART MAKES IT!
Score: 67-63

[06:51] Team_095 possession (Score: 67-63)
Dejounte Hyland drives and kicks out. Shaquille Ball attempts a 3Pt. Contested by Tracy Bryant (3.4 feet, MAN). Shaquille Ball misses. Rebound secured by Bones Anunoby.

[06:35] Team_018 possession (Score: 67-63)
Allen Markkanen attempts a Midrange. Contested by Evan Carter (4.2 feet, MAN). Allen Markkanen misses. Rebound secured by Shaquille Ball.

[06:21] Team_095 possession (Score: 67-63)
Kyrie Ming drives, Domantas Wall stays with him. Kyrie Ming attempts a Dunk. Contested by Domantas Wall (3.6 feet, ZONE). Kyrie Ming misses. Rebound secured by Bones Anunoby.

[06:02] Team_018 possession (Score: 67-63)
Klay Stewart drives to the basket... Klay Stewart throws a bad pass! Stolen by Dejounte Hyland! TURNOVER! (live ball)

[05:50] Team_095 possession (Score: 67-63)
Evan Carter attempts a Midrange. Contested by Allen Markkanen (4.1 feet, MAN). EVAN CARTER MAKES IT! Assist: Immanuel Middleton
Score: 67-65

[05:34] Team_018 possession (Score: 67-65)
FOUL! Reach-in foul on Kyrie Ming during the drive. [Team fouls: 4] No free throws, side out. (Kyrie Ming: 2 personal fouls)

[05:19] Team_018 possession (Score: 67-65)
Allen Markkanen attempts a Midrange. Contested by Shaquille Ball (4.7 feet, ZONE). ALLEN MARKKANEN MAKES IT!
Score: 69-65

[05:06] Team_095 possession (Score: 69-65)
Dejounte Hyland makes the Layup and draws the foul on Klay Stewart! And-1! Dejounte Hyland to the line for 1. [BONUS: 5 team fouls] (Klay Stewart: 2 personal fouls)   FT 1/1: GOOD Dejounte Hyland makes 1/1 from the line.
Score: 69-68

[04:50] Team_018 possession (Score: 69-68)
Tracy Bryant attempts a Midrange. Contested by Immanuel Middleton (5.3 feet, ZONE). TRACY BRYANT MAKES IT!
Score: 71-68

[04:31] Team_095 possession (Score: 71-68)
Shaquille Ball attempts a 3Pt. Contested by Tracy Bryant (3.4 feet, MAN). Shaquille Ball misses. Offensive rebound by Dejounte Hyland! Dejounte Hyland kicks it out.

[04:17] Team_095 possession (Score: 71-68)
Immanuel Middleton drives and kicks out. Evan Carter attempts a 3Pt. Contested by Allen Markkanen (3.9 feet, MAN). Evan Carter misses. Rebound secured by Bones Anunoby.

[04:04] Team_018 possession (Score: 71-68)
Allen Markkanen attempts a Midrange. Contested by Evan Carter (4.3 feet, MAN). ALLEN MARKKANEN MAKES IT! Assist: Klay Stewart
Score: 73-68

[03:49] Team_095 possession (Score: 73-68)
Evan Carter drives and kicks out. Evan Carter attempts a Midrange. Contested by Allen Markkanen (3.9 feet, MAN). Evan Carter misses. Offensive rebound by Evan Carter! Evan Carter puts it back in!
Score: 73-70

[03:34] Team_018 possession (Score: 73-70)
Tracy Bryant drives, Immanuel Middleton stays with him. Tracy Bryant attempts a Dunk. Contested by Immanuel Middleton (5.4 feet, ZONE). Tracy Bryant misses. Rebound secured by Evan Carter.

[03:19] Team_095 possession (Score: 73-70)
Evan Carter drives and kicks out. Dejounte Hyland attempts a 3Pt. Contested by Klay Stewart (4.2 feet, MAN). Dejounte Hyland misses. Offensive rebound by Evan Carter! Evan Carter's putback is no good. Rebound secured by Bones Anunoby.

[03:05] Team_018 possession (Score: 73-70)
Allen Markkanen attempts a 3Pt. Contested by Evan Carter (4.4 feet, MAN). ALLEN MARKKANEN MAKES IT! Assist: Domantas Wall
Score: 76-70

[02:54] Team_095 possession (Score: 76-70)
FOUL! Reach-in foul on Domantas Wall during the drive. [IN THE BONUS! 6 team fouls] Kyrie Ming to the line for 2 free throws. (Domantas Wall: 2 personal fouls)   FT 1/2: GOOD   FT 2/2: GOOD Kyrie Ming makes 2/2 from the line.
Score: 76-72

[02:41] Team_018 possession (Score: 76-72)
Klay Stewart drives to the basket... Klay Stewart throws a bad pass! Stolen by Dejounte Hyland! TURNOVER! (live ball)

[02:27] Team_095 possession (Score: 76-72)
Evan Carter drives, Allen Markkanen stays with him. Evan Carter attempts a Layup. Contested by Allen Markkanen (4.2 feet, MAN). EVAN CARTER MAKES IT! Assist: Kyrie Ming
Score: 76-74

[02:15] Team_018 possession (Score: 76-74)
Klay Stewart attempts a 3Pt. Contested by Dejounte Hyland (5.3 feet, MAN). Klay Stewart misses. FOUL! Loose ball foul on Evan Carter during the rebound battle. [IN THE BONUS! 5 team fouls] Domantas Wall to the line for 2 free throws. (Evan Carter: 1 personal fouls)   FT 1/2: GOOD   FT 2/2: GOOD Domantas Wall makes 2/2 from the line.
Score: 78-74

[02:02] Team_095 possession (Score: 78-74)
Immanuel Middleton attempts a Midrange. Contested by Bones Anunoby (3.7 feet, ZONE). Immanuel Middleton misses. Rebound secured by Allen Markkanen.

[01:47] Team_018 possession (Score: 78-74)
Tracy Bryant throws a bad pass! Stolen by Shaquille Ball! TURNOVER! (live ball)

[01:31] Team_095 possession (Score: 78-74)
Immanuel Middleton attempts a 3Pt. Contested by Klay Stewart (4.4 feet, ZONE). Immanuel Middleton misses. Rebound secured by Bones Anunoby.

[01:16] Team_018 possession (Score: 78-74)
Domantas Wall drives to the basket... Domantas Wall loses the ball! Stripped by Kyrie Ming! TURNOVER! (live ball)

[01:05] Team_095 possession (Score: 78-74)
Dejounte Hyland attempts a Layup. Contested by Domantas Wall (4.0 feet, ZONE). Dejounte Hyland misses. Rebound secured by Domantas Wall.

[00:47] Team_018 possession (Score: 78-74)
Bones Anunoby drives to the basket... Bones Anunoby commits a violation (traveling/carry)! TURNOVER! (dead ball)

[00:47] Substitution (Team_018): Klay Stewart OUT → Michael Simons IN (stamina_rule2)

[00:47] Substitution (Team_018): Tracy Bryant OUT → Miles Herro IN (stamina_rule2)

[00:47] Substitution (Team_018): Allen Markkanen OUT → Austin Antetokounmpo IN (stamina_rule2)

[00:47] Substitution (Team_018): Bones Anunoby OUT → Shai Wade IN (stamina_rule2)

[00:47] Substitution (Team_018): Domantas Wall OUT → Julius Jackson IN (stamina_rule2)

[00:47] Substitution (Team_095): Dejounte Hyland OUT → Kyle Poole IN (stamina_rule2)

[00:47] Substitution (Team_095): Shaquille Ball OUT → Cade Beal IN (stamina_rule2)

[00:47] Substitution (Team_095): Evan Carter OUT → Tobias Wagner IN (stamina_rule2)

[00:47] Substitution (Team_095): Immanuel Middleton OUT → Gary Davis IN (stamina_rule2)

[00:47] Substitution (Team_095): Kyrie Ming OUT → DeMar McCollum IN (stamina_rule2)

[00:34] Team_095 possession (Score: 78-74)
Kyle Poole drives and kicks out. Kyle Poole attempts a 3Pt. Contested by Michael Simons (5.4 feet, MAN). Kyle Poole misses. Rebound secured by Austin Antetokounmpo.

[00:20] Team_018 possession (Score: 78-74)
Shai Wade drives, picks up DeMar McCollum. Help arrives from Kyle Poole! Shai Wade attempts a Layup. Contested by Kyle Poole (4.4 feet, ZONE). SHAI WADE MAKES IT! Assist: Julius Jackson
Score: 80-74

[00:04] Team_095 possession (Score: 80-74)
Kyle Poole attempts a 3Pt. Contested by Michael Simons (5.8 feet, MAN). Kyle Poole misses. Rebound secured by Shai Wade.

================================================================================
                              3RD QUARTER COMPLETE                              
================================================================================

3RD QUARTER SCORE: Team_018 26, Team_095 20

BOX SCORE:
================================================================================

Team_018
--------------------------------------------------------------------------------
Player                MIN  PTS  REB  AST  TO      FG   FG%      3P   3P%
--------------------------------------------------------------------------------
Allen Markkanen        30    7    1    1   0   3/6    50.0     0/0   0.0
Domantas Wall          30    6    1    1   0   3/3   100.0     0/0   0.0
Tracy Bryant           30    5    0    1   0   2/3    66.7     0/0   0.0
Bones Anunoby          30    3    6    0   0   1/1   100.0     0/0   0.0
Klay Stewart           30    3    0    1   0   1/1   100.0     0/0   0.0
Shai Wade               6    2    1    0   0   1/1   100.0     0/0   0.0
Austin Antetokounmpo    6    0    1    0   0   0/0     0.0     0/0   0.0
Julius Jackson          6    0    0    1   0   0/0     0.0     0/0   0.0

TEAM: FG: 11/15 (73.3%), 3PT: 4/5 (80.0%), REB: 9 (0 off, 9 def), AST: 5, TO: 7
TEAM FOULS: 6 [Team_095 in BONUS]


Team_095
--------------------------------------------------------------------------------
Player                MIN  PTS  REB  AST  TO      FG   FG%      3P   3P%
--------------------------------------------------------------------------------
Evan Carter            30    9    3    0   0   4/6    66.7     0/0   0.0
Immanuel Middleton     30    4    0    1   0   2/5    40.0     0/0   0.0
Kyrie Ming             30    4    0    1   0   2/3    66.7     0/0   0.0
Dejounte Hyland        30    3    3    0   0   1/4    25.0     0/0   0.0
Shaquille Ball         30    0    2    1   0   0/0     0.0     0/0   0.0
Kyle Poole              6    0    0    0   0   0/2     0.0     0/0   0.0

TEAM: FG: 9/20 (45.0%), 3PT: 1/4 (25.0%), REB: 9 (5 off, 4 def), AST: 3, TO: 2
TEAM FOULS: 5 [Team_018 in BONUS]

================================================================================

================================================================================
                       4TH QUARTER - Team_018 vs Team_095                       
================================================================================

[12:00] Team_018 possession (Score: 80-74)
Klay Stewart attempts a Layup. Contested by Dejounte Hyland (5.3 feet, MAN). KLAY STEWART MAKES IT!
Score: 82-74

[11:45] Team_095 possession (Score: 82-74)
Kyrie Ming drives and kicks out. Shaquille Ball attempts a 3Pt. Contested by Klay Stewart (4.3 feet, ZONE). Shaquille Ball misses. Rebound secured by Bones Anunoby.

[11:31] Team_018 possession (Score: 82-74)
Bones Anunoby drives, picks up Immanuel Middleton. Help arrives from Dejounte Hyland! Bones Anunoby attempts a Layup. Contested by Dejounte Hyland (5.5 feet, MAN). BONES ANUNOBY MAKES IT! Assist: Allen Markkanen
Score: 84-74

[11:16] Team_095 possession (Score: 84-74)
Evan Carter attempts a Midrange. Contested by Bones Anunoby (3.9 feet, ZONE). Evan Carter misses. Offensive rebound by Evan Carter! Evan Carter puts it back in!
Score: 84-76

[11:04] Team_018 possession (Score: 84-76)
FOUL! Shooting foul on Evan Carter. Allen Markkanen to the line for 3 free throws. [Team fouls: 1] (Evan Carter: 1 personal fouls)   FT 1/3: MISS   FT 2/3: GOOD   FT 3/3: GOOD Allen Markkanen makes 2/3 from the line.
Score: 86-76

[10:45] Team_095 possession (Score: 86-76)
Evan Carter drives and kicks out. Evan Carter attempts a 3Pt. Contested by Klay Stewart (4.4 feet, ZONE). EVAN CARTER MAKES IT! Assist: Kyrie Ming
Score: 86-79

[10:33] Team_018 possession (Score: 86-79)
Tracy Bryant attempts a 3Pt. Contested by Immanuel Middleton (5.6 feet, ZONE). Tracy Bryant misses. Rebound secured by Evan Carter.

[10:20] Team_095 possession (Score: 86-79)
Evan Carter attempts a 3Pt. Contested by Allen Markkanen (4.3 feet, MAN). Evan Carter misses. FOUL! Loose ball foul on Bones Anunoby during the rebound battle. [Team fouls: 1] No free throws, side out. (Bones Anunoby: 1 personal fouls)

[10:02] Team_095 possession (Score: 86-79)
Kyrie Ming attempts a Layup. Contested by Domantas Wall (4.2 feet, ZONE). Kyrie Ming misses. Rebound secured by Domantas Wall.

[09:47] Team_018 possession (Score: 86-79)
Allen Markkanen drives, Evan Carter stays with him. Allen Markkanen attempts a Layup. Contested by Evan Carter (4.6 feet, MAN). ALLEN MARKKANEN MAKES IT!
Score: 88-79

[09:31] Team_095 possession (Score: 88-79)
Dejounte Hyland drives and kicks out. Dejounte Hyland attempts a 3Pt. Contested by Klay Stewart (4.5 feet, ZONE). Dejounte Hyland misses. Rebound secured by Allen Markkanen.

[09:18] Team_018 possession (Score: 88-79)
Allen Markkanen attempts a 3Pt. Contested by Evan Carter (4.7 feet, ZONE). Allen Markkanen misses. FOUL! Loose ball foul on Evan Carter during the rebound battle. [Team fouls: 2] No free throws, side out. (Evan Carter: 2 personal fouls)

[09:02] Team_018 possession (Score: 88-79)
FOUL! Shooting foul on Evan Carter. Allen Markkanen to the line for 2 free throws. [Team fouls: 3] (Evan Carter: 3 personal fouls)   FT 1/2: GOOD   FT 2/2: GOOD Allen Markkanen makes 2/2 from the line.
Score: 90-79

[08:51] Team_095 possession (Score: 90-79)
Immanuel Middleton attempts a Layup. Contested by Bones Anunoby (4.0 feet, MAN). Immanuel Middleton misses. Rebound secured by Bones Anunoby.

[08:37] Team_018 possession (Score: 90-79)
Allen Markkanen attempts a 3Pt. Contested by Evan Carter (4.8 feet, MAN). Allen Markkanen misses. Rebound secured by Dejounte Hyland.

[08:25] Team_095 possession (Score: 90-79)
Shaquille Ball attempts a Midrange. Contested by Tracy Bryant (3.9 feet, MAN). SHAQUILLE BALL MAKES IT!
Score: 90-81

[08:13] Team_018 possession (Score: 90-81)
Domantas Wall attempts a 3Pt. Contested by Kyrie Ming (5.9 feet, MAN). DOMANTAS WALL MAKES IT! Assist: Tracy Bryant
Score: 93-81

[07:55] Team_095 possession (Score: 93-81)
Evan Carter attempts a 3Pt. Contested by Allen Markkanen (4.5 feet, MAN). Evan Carter misses. Rebound secured by Bones Anunoby.

[07:41] Team_018 possession (Score: 93-81)
Bones Anunoby attempts a Midrange. Contested by Immanuel Middleton (5.9 feet, MAN). Bones Anunoby misses. Offensive rebound by Domantas Wall! Domantas Wall puts it back in!
Score: 95-81

[07:28] Team_095 possession (Score: 95-81)
Kyrie Ming drives and kicks out. Immanuel Middleton makes the 3Pt and draws the foul on Bones Anunoby! And-1! Immanuel Middleton to the line for 1. [Team fouls: 2] (Bones Anunoby: 2 personal fouls)   FT 1/1: GOOD Immanuel Middleton makes 1/1 from the line.
Score: 95-85

[07:13] Team_018 possession (Score: 95-85)
Bones Anunoby attempts a Layup. Contested by Immanuel Middleton (5.9 feet, MAN). BONES ANUNOBY MAKES IT! Assist: Allen Markkanen
Score: 97-85

[06:56] Team_095 possession (Score: 97-85)
Evan Carter makes the Layup and draws the foul on Domantas Wall! And-1! Evan Carter to the line for 1. [Team fouls: 3] (Domantas Wall: 1 personal fouls)   FT 1/1: GOOD Evan Carter makes 1/1 from the line.
Score: 97-88

[06:40] Team_018 possession (Score: 97-88)
Domantas Wall drives to the basket... Domantas Wall throws a bad pass out of bounds! TURNOVER! (dead ball)

[06:40] Substitution (Team_018): Klay Stewart OUT → Michael Simons IN (stamina_rule2)

[06:40] Substitution (Team_018): Tracy Bryant OUT → Miles Herro IN (stamina_rule2)

[06:40] Substitution (Team_018): Allen Markkanen OUT → Austin Antetokounmpo IN (stamina_rule2)

[06:40] Substitution (Team_018): Bones Anunoby OUT → Shai Wade IN (stamina_rule2)

[06:40] Substitution (Team_018): Domantas Wall OUT → Julius Jackson IN (stamina_rule2)

[06:40] Substitution (Team_095): Dejounte Hyland OUT → Kyle Poole IN (stamina_rule2)

[06:40] Substitution (Team_095): Shaquille Ball OUT → Cade Beal IN (stamina_rule2)

[06:40] Substitution (Team_095): Evan Carter OUT → Tobias Wagner IN (stamina_rule2)

[06:40] Substitution (Team_095): Immanuel Middleton OUT → Gary Davis IN (stamina_rule2)

[06:40] Substitution (Team_095): Kyrie Ming OUT → DeMar McCollum IN (stamina_rule2)

[06:23] Team_095 possession (Score: 97-88)
Cade Beal attempts a 3Pt. Contested by Michael Simons (5.4 feet, ZONE). CADE BEAL MAKES IT! Assist: Gary Davis
Score: 97-91

[06:04] Team_018 possession (Score: 97-91)
FOUL! Holding foul on Kyle Poole. [Team fouls: 4] No free throws, side out. (Kyle Poole: 1 personal fouls)

[05:54] Team_018 possession (Score: 97-91)
Austin Antetokounmpo attempts a Layup. Contested by Tobias Wagner (3.2 feet, MAN). AUSTIN ANTETOKOUNMPO MAKES IT!
Score: 99-91

[05:36] Team_095 possession (Score: 99-91)
DeMar McCollum makes the Layup and draws the foul on Julius Jackson! And-1! DeMar McCollum to the line for 1. [Team fouls: 4] (Julius Jackson: 1 personal fouls)   FT 1/1: GOOD DeMar McCollum makes 1/1 from the line.
Score: 99-94

[05:21] Team_018 possession (Score: 99-94)
Shai Wade attempts a Layup. Contested by DeMar McCollum (4.4 feet, ZONE). SHAI WADE MAKES IT! Assist: Miles Herro
Score: 101-94

[05:10] Team_095 possession (Score: 101-94)
Kyle Poole drives and kicks out. DeMar McCollum attempts a 3Pt. Contested by Michael Simons (5.4 feet, ZONE). DeMar McCollum misses. FOUL! Loose ball foul on Julius Jackson during the rebound battle. [IN THE BONUS! 5 team fouls] DeMar McCollum to the line for 2 free throws. (Julius Jackson: 2 personal fouls)   FT 1/2: MISS   FT 2/2: MISS DeMar McCollum makes 0/2 from the line. Rebound secured by Shai Wade.

[04:58] Team_018 possession (Score: 101-94)
Austin Antetokounmpo attempts a Midrange. Contested by Tobias Wagner (3.2 feet, MAN). Austin Antetokounmpo misses. Rebound secured by Gary Davis.

[04:43] Team_095 possession (Score: 101-94)
DeMar McCollum attempts a 3Pt. Contested by Julius Jackson (5.4 feet, MAN). DEMAR MCCOLLUM MAKES IT! Assist: Kyle Poole
Score: 101-97

[04:28] Team_018 possession (Score: 101-97)
Shai Wade drives and kicks out. Michael Simons attempts a Midrange. Contested by Gary Davis (5.4 feet, ZONE). Michael Simons misses. Offensive rebound by Julius Jackson! Julius Jackson kicks it out.

[04:14] Team_018 possession (Score: 101-97)
Michael Simons attempts a Midrange. Contested by Kyle Poole (5.0 feet, MAN). MICHAEL SIMONS MAKES IT! Assist: Shai Wade
Score: 103-97

[03:59] Team_095 possession (Score: 103-97)
Gary Davis attempts a Midrange. Contested by Miles Herro (5.3 feet, ZONE). GARY DAVIS MAKES IT!
Score: 103-99

[03:46] Team_018 possession (Score: 103-99)
Miles Herro attempts a 3Pt. Contested by Cade Beal (4.6 feet, ZONE). MILES HERRO MAKES IT! Assist: Michael Simons
Score: 106-99

[03:31] Team_095 possession (Score: 106-99)
DeMar McCollum attempts a 3Pt. Contested by Michael Simons (6.0 feet, ZONE). DeMar McCollum misses. Rebound secured by Julius Jackson.

[03:13] Team_018 possession (Score: 106-99)
Julius Jackson drives and kicks out. Michael Simons attempts a 3Pt. Contested by Cade Beal (4.4 feet, ZONE). Michael Simons misses. Rebound secured by Tobias Wagner.

[02:58] Team_095 possession (Score: 106-99)
Cade Beal drives to the basket... Cade Beal throws a bad pass! Stolen by Miles Herro! TURNOVER! (live ball)

[02:46] Team_018 possession (Score: 106-99)
Michael Simons attempts a 3Pt. Contested by Cade Beal (4.7 feet, ZONE). Michael Simons misses. Rebound secured by Gary Davis.

[02:29] Team_095 possession (Score: 106-99)
Kyle Poole drives, picks up Julius Jackson. Help arrives from Miles Herro! Kyle Poole attempts a Dunk. Contested by Miles Herro (5.1 feet, ZONE). Kyle Poole misses. Offensive rebound by DeMar McCollum! DeMar McCollum kicks it out.

[02:14] Team_095 possession (Score: 106-99)
Gary Davis attempts a Midrange. Contested by Shai Wade (4.7 feet, MAN). GARY DAVIS MAKES IT!
Score: 106-101

[01:59] Team_018 possession (Score: 106-101)
Miles Herro attempts a 3Pt. Contested by Cade Beal (4.6 feet, ZONE). MILES HERRO MAKES IT! Assist: Shai Wade
Score: 109-101

[01:47] Team_095 possession (Score: 109-101)
Tobias Wagner attempts a Midrange. Contested by Shai Wade (5.3 feet, ZONE). Tobias Wagner misses. FOUL! Loose ball foul on Julius Jackson during the rebound battle. [IN THE BONUS! 6 team fouls] DeMar McCollum to the line for 2 free throws. (Julius Jackson: 3 personal fouls)   FT 1/2: GOOD   FT 2/2: GOOD DeMar McCollum makes 2/2 from the line.
Score: 109-103

[01:33] Team_018 possession (Score: 109-103)
FOUL! Offensive foul on Shai Wade! Gary Davis drew the charge! [Team fouls: 7] (Shai Wade: 1 personal fouls) TURNOVER! (dead ball)

[01:16] Team_095 possession (Score: 109-103)
Kyle Poole attempts a 3Pt. Contested by Michael Simons (5.8 feet, MAN). Kyle Poole misses. Rebound secured by Austin Antetokounmpo.

[00:58] Team_018 possession (Score: 109-103)
Julius Jackson makes the Layup and draws the foul on Kyle Poole! And-1! Julius Jackson to the line for 1. [BONUS: 5 team fouls] (Kyle Poole: 2 personal fouls)   FT 1/1: GOOD Julius Jackson makes 1/1 from the line.
Score: 112-103

[00:41] Team_095 possession (Score: 112-103)
FOUL! Holding foul on Julius Jackson. [IN THE BONUS! 8 team fouls] DeMar McCollum to the line for 2 free throws. (Julius Jackson: 4 personal fouls)   FT 1/2: GOOD   FT 2/2: MISS DeMar McCollum makes 1/2 from the line. Rebound secured by Julius Jackson.
Score: 112-104

[00:25] Team_018 possession (Score: 112-104)
Miles Herro attempts a 3Pt. Contested by Cade Beal (4.6 feet, ZONE). MILES HERRO MAKES IT! Assist: Austin Antetokounmpo
Score: 115-104

[00:08] Team_095 possession (Score: 115-104)
Cade Beal drives and kicks out. Tobias Wagner attempts a 3Pt. Contested by Michael Simons (5.4 feet, ZONE). TOBIAS WAGNER MAKES IT! Assist: Kyle Poole
Score: 115-107

================================================================================
                              4TH QUARTER COMPLETE                              
================================================================================

4TH QUARTER SCORE: Team_018 35, Team_095 33

BOX SCORE:
================================================================================

Team_018
--------------------------------------------------------------------------------
Player                MIN  PTS  REB  AST  TO      FG   FG%      3P   3P%
--------------------------------------------------------------------------------
Miles Herro            13    9    0    1   0   3/3   100.0     0/0   0.0
Allen Markkanen        36    6    1    2   0   3/4    75.0     0/0   0.0
Domantas Wall          36    5    3    0   0   2/2   100.0     0/0   0.0
Bones Anunoby          36    4    3    0   0   2/2   100.0     0/0   0.0
Julius Jackson         13    3    3    0   0   1/2    50.0     0/0   0.0
Klay Stewart           36    2    0    0   0   1/1   100.0     0/0   0.0
Austin Antetokounmpo   13    2    1    1   0   1/2    50.0     0/0   0.0
Shai Wade              13    2    1    2   0   1/1   100.0     0/0   0.0
Michael Simons         13    2    0    1   0   1/2    50.0     0/0   0.0
Tracy Bryant           36    0    0    1   0   0/1     0.0     0/0   0.0

TEAM: FG: 15/20 (75.0%), 3PT: 5/8 (62.5%), REB: 11 (3 off, 8 def), AST: 8, TO: 2
TEAM FOULS: 8 [Team_095 in BONUS]


Team_095
--------------------------------------------------------------------------------
Player                MIN  PTS  REB  AST  TO      FG   FG%      3P   3P%
--------------------------------------------------------------------------------
Evan Carter            36    8    2    0   0   3/4    75.0     0/0   0.0
DeMar McCollum         13    8    1    0   0   3/4    75.0     0/0   0.0
Immanuel Middleton     36    4    0    0   0   1/2    50.0     0/0   0.0
Gary Davis             13    4    2    1   0   2/2   100.0     0/0   0.0
Cade Beal              13    3    0    0   0   1/1   100.0     0/0   0.0
Tobias Wagner          13    3    1    0   0   1/1   100.0     0/0   0.0
Shaquille Ball         36    2    0    0   0   1/1   100.0     0/0   0.0
Kyrie Ming             36    0    0    1   0   0/2     0.0     0/0   0.0
Dejounte Hyland        36    0    2    0   0   0/1     0.0     0/0   0.0
Kyle Poole             13    0    0    2   0   0/2     0.0     0/0   0.0

TEAM: FG: 12/21 (57.1%), 3PT: 2/5 (40.0%), REB: 9 (4 off, 5 def), AST: 4, TO: 1
TEAM FOULS: 5 [Team_018 in BONUS]

================================================================================

================================================================================
                               FULL GAME COMPLETE                               
================================================================================

FINAL SCORE: Team_018 115, Team_095 107

SCORING BY QUARTER:
--------------------------------------------------------------------------------
Team                     Q1     Q2     Q3     Q4    FINAL
--------------------------------------------------------------------------------
Team_018                 32     22     26     35      115
Team_095                 33     21     20     33      107
--------------------------------------------------------------------------------

FULL GAME BOX SCORE:
================================================================================

Team_018
--------------------------------------------------------------------------------
Player                MIN  PTS  REB  AST  TO      FG   FG%      3P   3P%      FT STL BLK
--------------------------------------------------------------------------------
Klay Stewart           36   13    0    2   3   6/7    85.7   3/3   100.0   1/2     0   2
Tracy Bryant           36   15    0    6   5   6/9    66.7   1/2    50.0   1/1     1   0
Allen Markkanen        36   25    6    3   1  11/18   61.1   3/7    42.9   5/6     1   0
Bones Anunoby          36    9   15    3   3   4/7    57.1   1/2    50.0   0/0     0   0
Domantas Wall          36   24   13    3   1  10/12   83.3   1/1   100.0   3/3     1   0
Michael Simons         13    4    0    2   0   2/5    40.0   0/2     0.0   0/0     0   0
Miles Herro            13   14    0    2   1   5/7    71.4   4/6    66.7   0/0     1   0
Austin Antetokounmpo   13    2    2    1   0   1/3    33.3   0/1     0.0   0/0     0   0
Shai Wade              13    4    5    2   2   2/2   100.0   0/0     0.0   0/0     1   0
Julius Jackson         13    3    5    2   0   1/2    50.0   0/0     0.0   1/1     0   0

TEAM: FG: 48/72 (66.7%), 3PT: 13/24 (54.2%), REB: 43 (9 off, 34 def), AST: 26, TO: 16


Team_095
--------------------------------------------------------------------------------
Player                MIN  PTS  REB  AST  TO      FG   FG%      3P   3P%      FT STL BLK
--------------------------------------------------------------------------------
Dejounte Hyland        36    8   11    1   0   4/11   36.4   0/2     0.0   1/1     2   0
Shaquille Ball         36   13    5    2   2   4/8    50.0   1/3    33.3   0/0     2   0
Evan Carter            36   28   10    1   1  12/17   70.6   2/4    50.0   4/6     2   1
Immanuel Middleton     36   15    0    3   2   4/11   36.4   0/2     0.0   4/4     1   0
Kyrie Ming             36    9    0    4   0   6/12   50.0   0/2     0.0   4/6     1   0
Kyle Poole             13    2    0    2   0   1/5    20.0   0/2     0.0   0/0     0   0
Cade Beal              13   12    0    0   0   3/4    75.0   2/3    66.7   0/0     0   0
Tobias Wagner          13    3    2    1   1   2/3    66.7   0/0     0.0   0/0     0   1
Gary Davis             13    4    4    5   1   2/2   100.0   0/0     0.0   0/0     2   0
DeMar McCollum         13   10    3    0   0   4/6    66.7   1/2    50.0   4/7     0   0

TEAM: FG: 42/80 (52.5%), 3PT: 6/20 (30.0%), REB: 38 (14 off, 24 def), AST: 19, TO: 7

================================================================================
