================================================================================
                        FULL GAME - Team_011 vs Team_031                        
================================================================================

================================================================================
                       1ST QUARTER - Team_011 vs Team_031                       
================================================================================

[12:00] Team_011 possession (Score: 0-0)
Magic Tatum attempts a Layup. Contested by Immanuel James (3.2 feet, ZONE). MAGIC TATUM MAKES IT! Assist: Michael Carter
Score: 2-0

[11:43] Team_031 possession (Score: 2-0)
Immanuel James makes the Layup and draws the foul on Pau Barnes! And-1! Immanuel James to the line for 1. [Team fouls: 1] (Pau Barnes: 1 personal fouls)   FT 1/1: MISS Immanuel James makes 0/1 from the line. Rebound secured by Michael Carter.
Score: 2-2

[11:32] Team_011 possession (Score: 2-2)
Magic Tatum drives and kicks out. Michael Carter attempts a 3Pt. Contested by Pau Irving (3.6 feet, MAN). Michael Carter misses. Rebound secured by Luka Sabonis.

[11:18] Team_031 possession (Score: 2-2)
Pau Irving attempts a 3Pt. Contested by Magic Tatum (3.5 feet, ZONE). PAU IRVING MAKES IT! Assist: Shai Durant
Score: 2-5

[10:59] Team_011 possession (Score: 2-5)
Michael Carter drives and kicks out. Pau Barnes attempts a Midrange. Contested by Gary Morant (3.8 feet, ZONE). Pau Barnes misses. Rebound secured by Luka Sabonis.

[10:47] Team_031 possession (Score: 2-5)
Immanuel James attempts a Layup. Contested by Pau Barnes (3.4 feet, ZONE). IMMANUEL JAMES MAKES IT! Assist: Shai Durant
Score: 2-7

[10:31] Team_011 possession (Score: 2-7)
Trae Tatum attempts a Midrange. Contested by Gary Morant (3.7 feet, MAN). TRAE TATUM MAKES IT! Assist: Michael Carter
Score: 4-7

[10:17] Team_031 possession (Score: 4-7)
Gary Morant attempts a Midrange. BLOCKED BY TRAE TATUM! Ball deflects out of bounds off Gary Morant.

[10:03] Team_011 possession (Score: 4-7)
Evan George attempts a 3Pt. Contested by Pau Irving (3.9 feet, ZONE). Evan George misses. Rebound secured by Gary Morant.

[09:47] Team_031 possession (Score: 4-7)
Luka Sabonis drives, Pau Barnes stays with him. Luka Sabonis attempts a Dunk. Contested by Pau Barnes (3.6 feet, ZONE). LUKA SABONIS MAKES IT! Assist: Pau Irving
Score: 4-9

[09:34] Team_011 possession (Score: 4-9)
Magic Tatum drives and kicks out. Magic Tatum attempts a 3Pt. Contested by Pau Irving (3.6 feet, ZONE). Magic Tatum misses. Rebound secured by Gary Morant.

[09:23] Team_031 possession (Score: 4-9)
Luka Sabonis drives, Pau Barnes stays with him. Luka Sabonis attempts a Dunk. Contested by Pau Barnes (3.6 feet, ZONE). LUKA SABONIS MAKES IT! Assist: Immanuel James
Score: 4-11

[09:08] Team_011 possession (Score: 4-11)
Magic Tatum attempts a Layup. Contested by Immanuel James (3.2 feet, ZONE). MAGIC TATUM MAKES IT!
Score: 6-11

[08:51] Team_031 possession (Score: 6-11)
Shai Durant attempts a Midrange. Contested by Pau Barnes (3.1 feet, ZONE). Shai Durant misses. Offensive rebound by Luka Sabonis! Luka Sabonis puts it back in!
Score: 6-13

[08:35] Team_011 possession (Score: 6-13)
Evan George attempts a Layup. Contested by Luka Sabonis (3.5 feet, MAN). EVAN GEORGE MAKES IT! Assist: Trae Tatum
Score: 8-13

[08:18] Team_031 possession (Score: 8-13)
Gary Morant attempts a Midrange. Contested by Trae Tatum (5.2 feet, MAN). GARY MORANT MAKES IT!
Score: 8-15

[08:02] Team_011 possession (Score: 8-15)
Michael Carter drives, Pau Irving stays with him. Michael Carter attempts a Layup. Contested by Pau Irving (3.5 feet, MAN). Michael Carter misses. Rebound secured by Immanuel James.

[07:50] Team_031 possession (Score: 8-15)
Shai Durant drives, Pau Barnes stays with him. Shai Durant attempts a Layup. Contested by Pau Barnes (3.1 feet, ZONE). Shai Durant misses. Rebound secured by Evan George.

[07:37] Team_011 possession (Score: 8-15)
Magic Tatum attempts a Midrange. Contested by Pau Irving (3.8 feet, ZONE). Magic Tatum misses. Rebound secured by Immanuel James.

[07:22] Team_031 possession (Score: 8-15)
Pau Irving makes the Layup and draws the foul on Michael Carter! And-1! Pau Irving to the line for 1. [Team fouls: 2] (Michael Carter: 1 personal fouls)   FT 1/1: MISS Pau Irving makes 0/1 from the line. Rebound secured by Michael Carter.
Score: 8-17

[07:07] Team_011 possession (Score: 8-17)
FOUL! Holding foul on Pau Irving. [Team fouls: 1] No free throws, side out. (Pau Irving: 1 personal fouls)

[06:57] Team_011 possession (Score: 8-17)
Trae Tatum attempts a 3Pt. Contested by Pau Irving (3.5 feet, ZONE). TRAE TATUM MAKES IT! Assist: Evan George
Score: 11-17

[06:44] Team_031 possession (Score: 11-17)
Immanuel James attempts a Midrange. Contested by Michael Carter (4.6 feet, ZONE). Immanuel James misses. Offensive rebound by Immanuel James! Immanuel James puts it back in!
Score: 11-19

[06:29] Team_011 possession (Score: 11-19)
Michael Carter attempts a Midrange. Contested by Gary Morant (3.7 feet, ZONE). MICHAEL CARTER MAKES IT! Assist: Trae Tatum
Score: 13-19

[06:16] Team_031 possession (Score: 13-19)
Pau Irving attempts a 3Pt. Contested by Magic Tatum (3.5 feet, ZONE). Pau Irving misses. Rebound secured by Evan George.

[06:02] Team_011 possession (Score: 13-19)
FOUL! Holding foul on Shai Durant. [Team fouls: 2] No free throws, side out. (Shai Durant: 1 personal fouls)

[05:46] Team_011 possession (Score: 13-19)
Evan George drives, picks up Luka Sabonis. Help arrives from Shai Durant! Evan George attempts a Dunk. Contested by Shai Durant (3.5 feet, MAN). Evan George misses. Rebound secured by Gary Morant.

[05:28] Team_031 possession (Score: 13-19)
Shai Durant attempts a 3Pt. Contested by Magic Tatum (3.6 feet, MAN). Shai Durant misses. FOUL! Loose ball foul on Pau Barnes during the rebound battle. [Team fouls: 3] No free throws, side out. (Pau Barnes: 2 personal fouls)

[05:14] Team_031 possession (Score: 13-19)
Gary Morant attempts a 3Pt. Contested by Magic Tatum (4.0 feet, ZONE). Gary Morant misses. Rebound secured by Evan George.

[04:57] Team_011 possession (Score: 13-19)
FOUL! Reach-in foul on Gary Morant during the drive. [Team fouls: 3] No free throws, side out. (Gary Morant: 1 personal fouls)

[04:43] Team_011 possession (Score: 13-19)
Michael Carter makes the Layup and draws the foul on Pau Irving! And-1! Michael Carter to the line for 1. [Team fouls: 4] (Pau Irving: 2 personal fouls)   FT 1/1: MISS Michael Carter makes 0/1 from the line. Rebound secured by Gary Morant.
Score: 15-19

[04:29] Team_031 possession (Score: 15-19)
Immanuel James attempts a 3Pt. Contested by Magic Tatum (3.9 feet, ZONE). Immanuel James misses. Rebound secured by Pau Barnes.

[04:15] Team_011 possession (Score: 15-19)
Michael Carter attempts a 3Pt. Contested by Pau Irving (3.6 feet, MAN). Michael Carter misses. Rebound secured by Gary Morant.

[04:02] Team_031 possession (Score: 15-19)
Shai Durant attempts a 3Pt. Contested by Trae Tatum (4.8 feet, ZONE). SHAI DURANT MAKES IT!
Score: 15-22

[03:51] Team_011 possession (Score: 15-22)
FOUL! Holding foul on Shai Durant. [IN THE BONUS! 5 team fouls] Magic Tatum to the line for 2 free throws. (Shai Durant: 2 personal fouls)   FT 1/2: GOOD   FT 2/2: GOOD Magic Tatum makes 2/2 from the line.
Score: 17-22

[03:34] Team_031 possession (Score: 17-22)
Gary Morant attempts a 3Pt. Contested by Magic Tatum (4.1 feet, ZONE). Gary Morant misses. Rebound secured by Michael Carter.

[03:17] Team_011 possession (Score: 17-22)
Trae Tatum attempts a Midrange. Contested by Shai Durant (4.0 feet, ZONE). Trae Tatum misses. Offensive rebound by Pau Barnes! Pau Barnes puts it back in!
Score: 19-22

[03:00] Team_031 possession (Score: 19-22)
Immanuel James attempts a 3Pt. Contested by Magic Tatum (4.0 feet, ZONE). Immanuel James misses. Rebound secured by Michael Carter.

[02:45] Team_011 possession (Score: 19-22)
Michael Carter makes the Dunk and draws the foul on Shai Durant! And-1! Michael Carter to the line for 1. [BONUS: 6 team fouls] (Shai Durant: 3 personal fouls)   FT 1/1: GOOD Michael Carter makes 1/1 from the line.
Score: 22-22

[02:30] Team_031 possession (Score: 22-22)
Shai Durant attempts a 3Pt. BLOCKED BY MAGIC TATUM! Ball is loose! Rebound secured by Evan George.

[02:16] Team_011 possession (Score: 22-22)
Michael Carter drives, picks up Pau Irving. Help arrives from Shai Durant! Michael Carter attempts a Dunk. Contested by Shai Durant (3.8 feet, MAN). Michael Carter misses. Rebound secured by Immanuel James.

[02:02] Team_031 possession (Score: 22-22)
Immanuel James attempts a Midrange. Contested by Michael Carter (4.8 feet, ZONE). Immanuel James misses. Rebound secured by Michael Carter.

[01:47] Team_011 possession (Score: 22-22)
Pau Barnes attempts a Midrange. Contested by Pau Irving (4.5 feet, ZONE). PAU BARNES MAKES IT!
Score: 24-22

[01:32] Team_031 possession (Score: 24-22)
Shai Durant loses control! Ball rolls out of bounds! TURNOVER! (dead ball)

[01:32] Substitution (Team_011): Magic Tatum OUT → Shai Leonard IN (stamina_rule2)

[01:32] Substitution (Team_011): Trae Tatum OUT → De'Aaron George IN (stamina_rule2)

[01:32] Substitution (Team_011): Michael Carter OUT → Tyrese Nowitzki IN (stamina_rule2)

[01:32] Substitution (Team_011): Pau Barnes OUT → Russell Davis IN (stamina_rule2)

[01:32] Substitution (Team_011): Evan George OUT → Pau Towns IN (stamina_rule2)

[01:32] Substitution (Team_031): Shai Durant OUT → Kevin Morant IN (stamina_rule2)

[01:32] Substitution (Team_031): Gary Morant OUT → Isaiah Ingram IN (stamina_rule2)

[01:32] Substitution (Team_031): Pau Irving OUT → Miles Stewart IN (stamina_rule2)

[01:32] Substitution (Team_031): Immanuel James OUT → Kobe Randle IN (stamina_rule2)

[01:32] Substitution (Team_031): Luka Sabonis OUT → Jimmy Poole IN (stamina_rule2)

[01:14] Team_011 possession (Score: 24-22)
Pau Towns attempts a Midrange. Contested by Kobe Randle (4.4 feet, ZONE). Pau Towns misses. Rebound secured by Isaiah Ingram.

[01:04] Team_031 possession (Score: 24-22)
Kevin Morant drives and kicks out. Kobe Randle attempts a 3Pt. Contested by Russell Davis (3.8 feet, MAN). Kobe Randle misses. Offensive rebound by Jimmy Poole! Jimmy Poole kicks it out.

[00:48] Team_031 possession (Score: 24-22)
FOUL! Shooting foul on Shai Leonard. Kevin Morant to the line for 3 free throws. [Team fouls: 4] (Shai Leonard: 1 personal fouls)   FT 1/3: GOOD   FT 2/3: GOOD   FT 3/3: GOOD Kevin Morant makes 3/3 from the line.
Score: 24-25

[00:34] Team_011 possession (Score: 24-25)
Russell Davis makes the Layup and draws the foul on Jimmy Poole! And-1! Russell Davis to the line for 1. [BONUS: 7 team fouls] (Jimmy Poole: 1 personal fouls)   FT 1/1: GOOD Russell Davis makes 1/1 from the line.
Score: 27-25

[00:17] Team_031 possession (Score: 27-25)
Jimmy Poole drives and kicks out. Kobe Randle attempts a 3Pt. Contested by Russell Davis (3.8 feet, MAN). Kobe Randle misses. Rebound secured by Pau Towns.

[00:04] Team_011 possession (Score: 27-25)
De'Aaron George attempts a 3Pt. Contested by Isaiah Ingram (4.6 feet, MAN). De'Aaron George misses. Offensive rebound by Pau Towns! Pau Towns kicks it out.

================================================================================
                              1ST QUARTER COMPLETE                              
================================================================================

1ST QUARTER SCORE: Team_011 27, Team_031 25

BOX SCORE:
================================================================================

Team_011
--------------------------------------------------------------------------------
Player                MIN  PTS  REB  AST  TO      FG   FG%      3P   3P%
--------------------------------------------------------------------------------
Magic Tatum            11    6    0    0   0   3/6    50.0     0/0   0.0
Michael Carter         11    5    5    2   0   2/7    28.6     0/0   0.0
Trae Tatum             11    5    0    2   0   2/2   100.0     0/0   0.0
Pau Barnes             11    4    2    0   0   2/2   100.0     0/0   0.0
Russell Davis           1    3    0    0   0   1/1   100.0     0/0   0.0
Evan George            11    2    4    1   0   1/3    33.3     0/0   0.0
Pau Towns               1    0    2    0   0   0/1     0.0     0/0   0.0

TEAM: FG: 11/22 (50.0%), 3PT: 1/3 (33.3%), REB: 13 (2 off, 11 def), AST: 5, TO: 0
TEAM FOULS: 4


Team_031
--------------------------------------------------------------------------------
Player                MIN  PTS  REB  AST  TO      FG   FG%      3P   3P%
--------------------------------------------------------------------------------
Luka Sabonis           11    6    4    0   0   3/3   100.0     0/0   0.0
Immanuel James         11    4    4    1   0   2/6    33.3     0/0   0.0
Pau Irving             11    3    0    1   0   1/3    33.3     0/0   0.0
Shai Durant            11    3    0    2   0   1/3    33.3     0/0   0.0
Kevin Morant            1    3    0    0   0   1/1   100.0     0/0   0.0
Gary Morant            11    2    5    0   0   1/4    25.0     0/0   0.0
Isaiah Ingram           1    0    1    0   0   0/0     0.0     0/0   0.0
Jimmy Poole             1    0    1    0   0   0/1     0.0     0/0   0.0

TEAM: FG: 9/21 (42.9%), 3PT: 3/9 (33.3%), REB: 15 (4 off, 11 def), AST: 4, TO: 1
TEAM FOULS: 7 [Team_011 in BONUS]

================================================================================

================================================================================
                       2ND QUARTER - Team_011 vs Team_031                       
================================================================================

[12:00] Team_011 possession (Score: 27-25)
Trae Tatum attempts a 3Pt. Contested by Gary Morant (3.8 feet, ZONE). Trae Tatum misses. Offensive rebound by Evan George! Evan George puts it back in!
Score: 29-25

[11:46] Team_031 possession (Score: 29-25)
Shai Durant attempts a 3Pt. Contested by Magic Tatum (3.6 feet, MAN). SHAI DURANT MAKES IT! Assist: Gary Morant
Score: 29-28

[11:32] Team_011 possession (Score: 29-28)
Pau Barnes drives and kicks out. Evan George attempts a Midrange. Contested by Luka Sabonis (3.4 feet, MAN). Evan George misses. Rebound secured by Luka Sabonis.

[11:17] Team_031 possession (Score: 29-28)
FOUL! Shooting foul on Pau Barnes. Pau Irving to the line for 2 free throws. [Team fouls: 1] (Pau Barnes: 1 personal fouls)   FT 1/2: GOOD   FT 2/2: GOOD Pau Irving makes 2/2 from the line.
Score: 29-30

[11:01] Team_011 possession (Score: 29-30)
Michael Carter attempts a 3Pt. Contested by Pau Irving (3.7 feet, ZONE). Michael Carter misses. Rebound secured by Gary Morant.

[10:46] Team_031 possession (Score: 29-30)
Luka Sabonis attempts a Midrange. Contested by Michael Carter (4.9 feet, ZONE). Luka Sabonis misses. Rebound secured by Evan George.

[10:29] Team_011 possession (Score: 29-30)
Trae Tatum attempts a Layup. Contested by Gary Morant (3.9 feet, MAN). TRAE TATUM MAKES IT!
Score: 31-30

[10:15] Team_031 possession (Score: 31-30)
Shai Durant drives to the basket... Shai Durant loses the ball! Stripped by Pau Barnes! TURNOVER! (live ball)

[09:59] Team_011 possession (Score: 31-30)
Michael Carter drives to the basket... Michael Carter loses the ball! Stripped by Pau Irving! TURNOVER! (live ball)

[09:42] Team_031 possession (Score: 31-30)
FOUL! Reach-in foul on Evan George during the drive. [Team fouls: 2] No free throws, side out. (Evan George: 1 personal fouls)

[09:25] Team_031 possession (Score: 31-30)
Shai Durant makes the Dunk and draws the foul on Magic Tatum! And-1! Shai Durant to the line for 1. [Team fouls: 3] (Magic Tatum: 1 personal fouls)   FT 1/1: MISS Shai Durant makes 0/1 from the line. Rebound secured by Evan George.
Score: 31-32

[09:12] Team_011 possession (Score: 31-32)
Trae Tatum attempts a Midrange. Contested by Gary Morant (4.0 feet, MAN). Trae Tatum misses. Offensive rebound by Evan George! Evan George's putback is no good. Offensive rebound by Evan George! Evan George kicks it out.

[08:54] Team_011 possession (Score: 31-32)
Evan George loses control! Ball rolls out of bounds! TURNOVER! (dead ball)

[08:54] Substitution (Team_011): Magic Tatum OUT → Shai Leonard IN (stamina_rule2)

[08:54] Substitution (Team_011): Trae Tatum OUT → De'Aaron George IN (stamina_rule2)

[08:54] Substitution (Team_011): Michael Carter OUT → Tyrese Nowitzki IN (stamina_rule2)

[08:54] Substitution (Team_011): Pau Barnes OUT → Russell Davis IN (stamina_rule2)

[08:54] Substitution (Team_011): Evan George OUT → Pau Towns IN (stamina_rule2)

[08:54] Substitution (Team_031): Shai Durant OUT → Kevin Morant IN (stamina_rule2)

[08:54] Substitution (Team_031): Gary Morant OUT → Isaiah Ingram IN (stamina_rule2)

[08:54] Substitution (Team_031): Pau Irving OUT → Miles Stewart IN (stamina_rule2)

[08:54] Substitution (Team_031): Immanuel James OUT → Kobe Randle IN (stamina_rule2)

[08:54] Substitution (Team_031): Luka Sabonis OUT → Jimmy Poole IN (stamina_rule2)

[08:41] Team_031 possession (Score: 31-32)
Kevin Morant drives, Shai Leonard stays with him. Kevin Morant attempts a Layup. Contested by Shai Leonard (4.4 feet, MAN). KEVIN MORANT MAKES IT! Assist: Jimmy Poole
Score: 31-34

[08:25] Team_011 possession (Score: 31-34)
FOUL! Shooting foul on Kobe Randle. Shai Leonard to the line for 2 free throws. [Team fouls: 2] (Kobe Randle: 1 personal fouls)   FT 1/2: GOOD   FT 2/2: GOOD Shai Leonard makes 2/2 from the line.
Score: 33-34

[08:07] Team_031 possession (Score: 33-34)
Jimmy Poole attempts a Midrange. Contested by De'Aaron George (4.7 feet, ZONE). Jimmy Poole misses. Rebound secured by Tyrese Nowitzki.

[07:52] Team_011 possession (Score: 33-34)
Shai Leonard attempts a 3Pt. Contested by Kevin Morant (4.9 feet, MAN). Shai Leonard misses. Rebound secured by Kobe Randle.

[07:34] Team_031 possession (Score: 33-34)
FOUL! Shooting foul on De'Aaron George. Kobe Randle to the line for 2 free throws. [Team fouls: 4] (De'Aaron George: 1 personal fouls)   FT 1/2: GOOD   FT 2/2: GOOD Kobe Randle makes 2/2 from the line.
Score: 33-36

[07:23] Team_011 possession (Score: 33-36)
Pau Towns attempts a Midrange. Contested by Isaiah Ingram (4.2 feet, ZONE). Pau Towns misses. Rebound secured by Jimmy Poole.

[07:11] Team_031 possession (Score: 33-36)
Jimmy Poole attempts a Layup. BLOCKED BY RUSSELL DAVIS! Ball goes out off Russell Davis. Jimmy Poole's ball!

[07:00] Team_031 possession (Score: 33-36)
Kevin Morant attempts a 3Pt. Contested by Shai Leonard (4.4 feet, ZONE). Kevin Morant misses. Rebound secured by Russell Davis.

[06:44] Team_011 possession (Score: 33-36)
FOUL! Reach-in foul on Kobe Randle during the drive. [Team fouls: 3] No free throws, side out. (Kobe Randle: 2 personal fouls)

[06:34] Team_011 possession (Score: 33-36)
Tyrese Nowitzki attempts a Layup. BLOCKED BY MILES STEWART! Ball is loose! Rebound secured by Jimmy Poole.

[06:22] Team_031 possession (Score: 33-36)
Kobe Randle attempts a Midrange. Contested by Russell Davis (4.4 feet, MAN). Kobe Randle misses. Rebound secured by Pau Towns.

[06:12] Team_011 possession (Score: 33-36)
Tyrese Nowitzki drives, Kobe Randle stays with him. Tyrese Nowitzki attempts a Dunk. Contested by Kobe Randle (4.3 feet, ZONE). TYRESE NOWITZKI MAKES IT! Assist: Pau Towns
Score: 35-36

[05:58] Team_031 possession (Score: 35-36)
Jimmy Poole attempts a Layup. BLOCKED BY PAU TOWNS! Ball is loose! Offensive rebound by Isaiah Ingram! Isaiah Ingram kicks it out.

[05:43] Team_031 possession (Score: 35-36)
Kobe Randle attempts a 3Pt. Contested by Tyrese Nowitzki (5.3 feet, ZONE). Kobe Randle misses. Rebound secured by Tyrese Nowitzki.

[05:30] Team_011 possession (Score: 35-36)
Shai Leonard attempts a Midrange. Contested by Jimmy Poole (5.7 feet, ZONE). SHAI LEONARD MAKES IT!
Score: 37-36

[05:20] Team_031 possession (Score: 37-36)
Jimmy Poole drives to the basket... Jimmy Poole commits a violation (traveling/carry)! TURNOVER! (dead ball)

[05:07] Team_011 possession (Score: 37-36)
Shai Leonard makes the Layup and draws the foul on Kobe Randle! And-1! Shai Leonard to the line for 1. [Team fouls: 4] (Kobe Randle: 3 personal fouls)   FT 1/1: GOOD Shai Leonard makes 1/1 from the line.
Score: 40-36

[04:53] Team_031 possession (Score: 40-36)
Jimmy Poole attempts a Layup. BLOCKED BY RUSSELL DAVIS! Ball goes out off Russell Davis. Jimmy Poole's ball!

[04:41] Team_031 possession (Score: 40-36)
Jimmy Poole throws a bad pass! Stolen by Pau Towns! TURNOVER! (live ball)

[04:27] Team_011 possession (Score: 40-36)
De'Aaron George attempts a Layup. Contested by Kobe Randle (4.7 feet, ZONE). DE'AARON GEORGE MAKES IT!
Score: 42-36

[04:10] Team_031 possession (Score: 42-36)
FOUL! Shooting foul on Pau Towns. Jimmy Poole to the line for 2 free throws. [BONUS: 5 team fouls] (Pau Towns: 1 personal fouls)   FT 1/2: GOOD   FT 2/2: MISS Jimmy Poole makes 1/2 from the line. Rebound secured by Pau Towns.
Score: 42-37

[03:57] Team_011 possession (Score: 42-37)
De'Aaron George attempts a 3Pt. Contested by Miles Stewart (5.6 feet, ZONE). De'Aaron George misses. Offensive rebound by Pau Towns! Pau Towns kicks it out.

[03:44] Team_011 possession (Score: 42-37)
Russell Davis drives to the basket... FOUL! Offensive foul on Russell Davis! Kobe Randle drew the charge! [Team fouls: 6] (Russell Davis: 1 personal fouls) TURNOVER! (dead ball)

[03:27] Team_031 possession (Score: 42-37)
Miles Stewart drives, Tyrese Nowitzki stays with him. Miles Stewart attempts a Layup. Contested by Tyrese Nowitzki (4.7 feet, MAN). Miles Stewart misses. Rebound secured by Russell Davis.

[03:11] Team_011 possession (Score: 42-37)
FOUL! Reach-in foul on Isaiah Ingram during the drive. [IN THE BONUS! 5 team fouls] De'Aaron George to the line for 2 free throws. (Isaiah Ingram: 1 personal fouls)   FT 1/2: GOOD   FT 2/2: GOOD De'Aaron George makes 2/2 from the line.
Score: 44-37

[02:58] Team_031 possession (Score: 44-37)
FOUL! Offensive foul on Isaiah Ingram! De'Aaron George drew the charge! [Team fouls: 6] (Isaiah Ingram: 2 personal fouls) TURNOVER! (dead ball)

[02:45] Team_011 possession (Score: 44-37)
Shai Leonard drives, Kevin Morant stays with him. Shai Leonard attempts a Dunk. Contested by Kevin Morant (5.0 feet, MAN). Shai Leonard misses. Offensive rebound by Tyrese Nowitzki! Tyrese Nowitzki kicks it out.

[02:35] Team_011 possession (Score: 44-37)
Russell Davis drives to the basket... Russell Davis commits a violation (traveling/carry)! TURNOVER! (dead ball)

[02:21] Team_031 possession (Score: 44-37)
Isaiah Ingram attempts a Midrange. Contested by Tyrese Nowitzki (5.2 feet, ZONE). Isaiah Ingram misses. Rebound secured by Tyrese Nowitzki.

[02:06] Team_011 possession (Score: 44-37)
Russell Davis attempts a Layup. BLOCKED BY KOBE RANDLE! Ball is loose! Rebound secured by Jimmy Poole.

[01:54] Team_031 possession (Score: 44-37)
Miles Stewart makes the Midrange and draws the foul on Tyrese Nowitzki! And-1! Miles Stewart to the line for 1. [BONUS: 7 team fouls] (Tyrese Nowitzki: 1 personal fouls)   FT 1/1: GOOD Miles Stewart makes 1/1 from the line.
Score: 44-40

[01:41] Team_011 possession (Score: 44-40)
FOUL! Offensive foul on Tyrese Nowitzki! Miles Stewart drew the charge! [Team fouls: 8] (Tyrese Nowitzki: 2 personal fouls) TURNOVER! (dead ball)

[01:24] Team_031 possession (Score: 44-40)
Kobe Randle drives, picks up Russell Davis. Help arrives from Shai Leonard! Kobe Randle attempts a Dunk. Contested by Shai Leonard (4.5 feet, ZONE). KOBE RANDLE MAKES IT!
Score: 44-42

[01:12] Team_011 possession (Score: 44-42)
Tyrese Nowitzki attempts a Layup. Contested by Miles Stewart (5.5 feet, MAN). Tyrese Nowitzki misses. Rebound secured by Kobe Randle.

[00:59] Team_031 possession (Score: 44-42)
FOUL! Shooting foul on Pau Towns. Jimmy Poole to the line for 2 free throws. [BONUS: 9 team fouls] (Pau Towns: 2 personal fouls)   FT 1/2: GOOD   FT 2/2: GOOD Jimmy Poole makes 2/2 from the line.
Score: 44-44

[00:48] Team_011 possession (Score: 44-44)
Shai Leonard attempts a Midrange. Contested by Isaiah Ingram (4.7 feet, ZONE). SHAI LEONARD MAKES IT!
Score: 46-44

[00:35] Team_031 possession (Score: 46-44)
Jimmy Poole throws a bad pass out of bounds! TURNOVER! (dead ball)

[00:16] Team_011 possession (Score: 46-44)
Pau Towns attempts a Layup. Contested by Kobe Randle (4.7 feet, ZONE). PAU TOWNS MAKES IT! Assist: De'Aaron George
Score: 48-44

[00:01] Team_031 possession (Score: 48-44)
FOUL! Reach-in foul on Russell Davis during the drive. [IN THE BONUS! 10 team fouls] Isaiah Ingram to the line for 2 free throws. (Russell Davis: 2 personal fouls)   FT 1/2: GOOD   FT 2/2: GOOD Isaiah Ingram makes 2/2 from the line.
Score: 48-46

================================================================================
                              2ND QUARTER COMPLETE                              
================================================================================

2ND QUARTER SCORE: Team_011 21, Team_031 21

BOX SCORE:
================================================================================

Team_011
--------------------------------------------------------------------------------
Player                MIN  PTS  REB  AST  TO      FG   FG%      3P   3P%
--------------------------------------------------------------------------------
Shai Leonard           10    9    0    0   0   4/5    80.0     0/0   0.0
De'Aaron George        10    4    0    1   0   2/2   100.0     0/0   0.0
Evan George            14    2    4    0   0   1/1   100.0     0/0   0.0
Trae Tatum             14    2    0    0   0   1/1   100.0     0/0   0.0
Tyrese Nowitzki        10    2    4    0   0   1/3    33.3     0/0   0.0
Pau Towns              10    2    3    1   0   1/2    50.0     0/0   0.0
Pau Barnes             14    0    0    0   0   0/1     0.0     0/0   0.0
Michael Carter         14    0    0    0   0   0/1     0.0     0/0   0.0
Russell Davis          10    0    2    0   0   0/1     0.0     0/0   0.0

TEAM: FG: 10/17 (58.8%), 3PT: 1/3 (33.3%), REB: 13 (4 off, 9 def), AST: 2, TO: 5
TEAM FOULS: 10 [Team_031 in BONUS]


Team_031
--------------------------------------------------------------------------------
Player                MIN  PTS  REB  AST  TO      FG   FG%      3P   3P%
--------------------------------------------------------------------------------
Kobe Randle            10    4    2    0   0   2/4    50.0     0/0   0.0
Shai Durant            14    3    0    0   0   1/2    50.0     0/0   0.0
Miles Stewart          10    3    0    0   0   1/2    50.0     0/0   0.0
Pau Irving             14    2    0    0   0   1/1   100.0     0/0   0.0
Kevin Morant           10    2    0    0   0   1/2    50.0     0/0   0.0
Jimmy Poole            10    2    3    1   0   1/3    33.3     0/0   0.0
Isaiah Ingram          10    2    1    0   0   1/2    50.0     0/0   0.0
Gary Morant            14    0    1    1   0   0/0     0.0     0/0   0.0
Luka Sabonis           14    0    1    0   0   0/1     0.0     0/0   0.0

TEAM: FG: 8/17 (47.1%), 3PT: 1/3 (33.3%), REB: 8 (1 off, 7 def), AST: 2, TO: 5
TEAM FOULS: 6 [Team_011 in BONUS]

================================================================================

================================================================================
                       3RD QUARTER - Team_011 vs Team_031                       
================================================================================

[12:00] Team_011 possession (Score: 48-46)
Michael Carter attempts a 3Pt. Contested by Pau Irving (3.5 feet, MAN). MICHAEL CARTER MAKES IT! Assist: Magic Tatum
Score: 51-46

[11:46] Team_031 possession (Score: 51-46)
Pau Irving attempts a Layup. Contested by Pau Barnes (3.0 feet, ZONE). Pau Irving misses. Rebound secured by Michael Carter.

[11:32] Team_011 possession (Score: 51-46)
Evan George makes the Dunk and draws the foul on Luka Sabonis! And-1! Evan George to the line for 1. [Team fouls: 1] (Luka Sabonis: 1 personal fouls)   FT 1/1: MISS Evan George makes 0/1 from the line. Rebound secured by Luka Sabonis.
Score: 53-46

[11:14] Team_031 possession (Score: 53-46)
Shai Durant attempts a Layup. Contested by Magic Tatum (3.6 feet, MAN). Shai Durant misses. Rebound secured by Evan George.

[11:01] Team_011 possession (Score: 53-46)
Magic Tatum attempts a Midrange. Contested by Shai Durant (4.1 feet, MAN). MAGIC TATUM MAKES IT! Assist: Evan George
Score: 55-46

[10:45] Team_031 possession (Score: 55-46)
Immanuel James drives, Pau Barnes stays with him. Immanuel James attempts a Dunk. Contested by Pau Barnes (3.4 feet, MAN). IMMANUEL JAMES MAKES IT! Assist: Gary Morant
Score: 55-48

[10:32] Team_011 possession (Score: 55-48)
Evan George attempts a 3Pt. Contested by Luka Sabonis (3.5 feet, MAN). EVAN GEORGE MAKES IT! Assist: Trae Tatum
Score: 58-48

[10:13] Team_031 possession (Score: 58-48)
FOUL! Offensive foul on Luka Sabonis! Pau Barnes drew the charge! [Team fouls: 2] (Luka Sabonis: 2 personal fouls) TURNOVER! (dead ball)

[09:58] Team_011 possession (Score: 58-48)
Trae Tatum drives, Gary Morant stays with him. Trae Tatum attempts a Dunk. Contested by Gary Morant (3.7 feet, MAN). TRAE TATUM MAKES IT! Assist: Pau Barnes
Score: 60-48

[09:42] Team_031 possession (Score: 60-48)
Gary Morant attempts a Midrange. Contested by Trae Tatum (5.2 feet, ZONE). GARY MORANT MAKES IT!
Score: 60-50

[09:26] Team_011 possession (Score: 60-50)
Pau Barnes attempts a 3Pt. Contested by Pau Irving (4.3 feet, ZONE). PAU BARNES MAKES IT! Assist: Michael Carter
Score: 63-50

[09:13] Team_031 possession (Score: 63-50)
Gary Morant drives, Trae Tatum stays with him. Gary Morant attempts a Dunk. Contested by Trae Tatum (5.2 feet, MAN). GARY MORANT MAKES IT!
Score: 63-52

[09:00] Team_011 possession (Score: 63-52)
Michael Carter attempts a Midrange. Contested by Gary Morant (3.7 feet, ZONE). MICHAEL CARTER MAKES IT! Assist: Magic Tatum
Score: 65-52

[08:45] Team_031 possession (Score: 65-52)
Gary Morant drives, picks up Trae Tatum. Help arrives from Magic Tatum! Gary Morant attempts a Dunk. Contested by Magic Tatum (5.2 feet, MAN). GARY MORANT MAKES IT! Assist: Luka Sabonis
Score: 65-54

[08:28] Team_011 possession (Score: 65-54)
Trae Tatum attempts a Layup. BLOCKED BY SHAI DURANT! Ball goes out off Shai Durant. Trae Tatum's ball!

[08:18] Team_011 possession (Score: 65-54)
Pau Barnes attempts a Midrange. Contested by Luka Sabonis (3.9 feet, ZONE). Pau Barnes misses. FOUL! Loose ball foul on Gary Morant during the rebound battle. [Team fouls: 3] No free throws, side out. (Gary Morant: 1 personal fouls)

[08:07] Team_011 possession (Score: 65-54)
Pau Barnes attempts a Layup. Contested by Immanuel James (3.7 feet, ZONE). Pau Barnes misses. Rebound secured by Gary Morant.

[07:53] Team_031 possession (Score: 65-54)
Pau Irving makes the Layup and draws the foul on Michael Carter! And-1! Pau Irving to the line for 1. [Team fouls: 1] (Michael Carter: 1 personal fouls)   FT 1/1: GOOD Pau Irving makes 1/1 from the line.
Score: 65-57

[07:39] Team_011 possession (Score: 65-57)
FOUL! Holding foul on Shai Durant. [Team fouls: 4] No free throws, side out. (Shai Durant: 1 personal fouls)

[07:20] Team_011 possession (Score: 65-57)
Michael Carter drives, Pau Irving stays with him. Michael Carter attempts a Layup. Contested by Pau Irving (3.5 feet, MAN). Michael Carter misses. Rebound secured by Luka Sabonis.

[07:02] Team_031 possession (Score: 65-57)
Immanuel James attempts a 3Pt. Contested by Pau Barnes (3.4 feet, MAN). Immanuel James misses. Offensive rebound by Luka Sabonis! Luka Sabonis's putback is no good. Offensive rebound by Luka Sabonis! Luka Sabonis kicks it out.

[06:49] Team_031 possession (Score: 65-57)
Gary Morant drives, Trae Tatum stays with him. Gary Morant attempts a Layup. Contested by Trae Tatum (5.2 feet, MAN). GARY MORANT MAKES IT! Assist: Luka Sabonis
Score: 65-59

[06:31] Team_011 possession (Score: 65-59)
Michael Carter drives, picks up Immanuel James. Help arrives from Shai Durant! Michael Carter attempts a Layup. Contested by Shai Durant (2.9 feet, ZONE). MICHAEL CARTER MAKES IT! Assist: Trae Tatum
Score: 67-59

[06:19] Team_031 possession (Score: 67-59)
Pau Irving drives, Michael Carter stays with him. Pau Irving attempts a Dunk. Contested by Michael Carter (4.2 feet, MAN). PAU IRVING MAKES IT! Assist: Gary Morant
Score: 67-61

[06:02] Team_011 possession (Score: 67-61)
FOUL! Shooting foul on Pau Irving. Trae Tatum to the line for 3 free throws. [BONUS: 5 team fouls] (Pau Irving: 1 personal fouls)   FT 1/3: MISS   FT 2/3: GOOD   FT 3/3: GOOD Trae Tatum makes 2/3 from the line.
Score: 69-61

[05:53] Team_031 possession (Score: 69-61)
Immanuel James drives and kicks out. Shai Durant attempts a Midrange. Contested by Michael Carter (4.1 feet, ZONE). Shai Durant misses. Offensive rebound by Immanuel James! Immanuel James puts it back in!
Score: 69-63

[05:41] Team_011 possession (Score: 69-63)
Magic Tatum attempts a 3Pt. Contested by Pau Irving (3.8 feet, ZONE). Magic Tatum misses. Offensive rebound by Evan George! Evan George's putback is no good. Offensive rebound by Pau Barnes! Pau Barnes kicks it out.

[05:25] Team_011 possession (Score: 69-63)
Michael Carter drives, Pau Irving stays with him. Michael Carter attempts a Layup. Contested by Pau Irving (3.5 feet, MAN). MICHAEL CARTER MAKES IT! Assist: Trae Tatum
Score: 71-63

[05:14] Team_031 possession (Score: 71-63)
Gary Morant drives, picks up Pau Barnes. Help arrives from Magic Tatum! Gary Morant attempts a Dunk. Contested by Magic Tatum (3.6 feet, ZONE). GARY MORANT MAKES IT! Assist: Pau Irving
Score: 71-65

[04:59] Team_011 possession (Score: 71-65)
Pau Barnes makes the Layup and draws the foul on Immanuel James! And-1! Pau Barnes to the line for 1. [BONUS: 6 team fouls] (Immanuel James: 1 personal fouls)   FT 1/1: GOOD Pau Barnes makes 1/1 from the line.
Score: 74-65

[04:43] Team_031 possession (Score: 74-65)
Pau Irving attempts a 3Pt. Contested by Michael Carter (4.3 feet, MAN). Pau Irving misses. Rebound secured by Pau Barnes.

[04:28] Team_011 possession (Score: 74-65)
Magic Tatum attempts a 3Pt. Contested by Shai Durant (4.1 feet, MAN). MAGIC TATUM MAKES IT! Assist: Evan George
Score: 77-65

[04:10] Team_031 possession (Score: 77-65)
FOUL! Reach-in foul on Pau Barnes during the drive. [Team fouls: 2] No free throws, side out. (Pau Barnes: 1 personal fouls)

[03:54] Team_031 possession (Score: 77-65)
Shai Durant makes the 3Pt and draws the foul on Magic Tatum! And-1! Shai Durant to the line for 1. [Team fouls: 3] (Magic Tatum: 1 personal fouls)   FT 1/1: MISS Shai Durant makes 0/1 from the line. Offensive rebound by Immanuel James! Immanuel James puts it back in!
Score: 77-70

[03:40] Team_011 possession (Score: 77-70)
Trae Tatum attempts a Midrange. Contested by Gary Morant (3.8 feet, MAN). TRAE TATUM MAKES IT!
Score: 79-70

[03:24] Team_031 possession (Score: 79-70)
Immanuel James drives to the basket... FOUL! Offensive foul on Immanuel James! Pau Barnes drew the charge! [Team fouls: 7] (Immanuel James: 2 personal fouls) TURNOVER! (dead ball)

[03:11] Team_011 possession (Score: 79-70)
Pau Barnes attempts a Layup. Contested by Immanuel James (4.0 feet, MAN). PAU BARNES MAKES IT! Assist: Trae Tatum
Score: 81-70

[02:56] Team_031 possession (Score: 81-70)
Pau Irving attempts a 3Pt. Contested by Magic Tatum (3.7 feet, ZONE). PAU IRVING MAKES IT! Assist: Luka Sabonis
Score: 81-73

[02:39] Team_011 possession (Score: 81-73)
Pau Barnes attempts a 3Pt. Contested by Pau Irving (4.5 feet, ZONE). Pau Barnes misses. Rebound secured by Immanuel James.

[02:25] Team_031 possession (Score: 81-73)
Luka Sabonis attempts a 3Pt. Contested by Pau Barnes (3.9 feet, MAN). Luka Sabonis misses. Rebound secured by Evan George.

[02:16] Team_011 possession (Score: 81-73)
Trae Tatum attempts a 3Pt. Contested by Pau Irving (3.8 feet, ZONE). TRAE TATUM MAKES IT! Assist: Michael Carter
Score: 84-73

[02:05] Team_031 possession (Score: 84-73)
Pau Irving loses the ball! Stripped by Michael Carter! TURNOVER! (live ball)

[01:51] Team_011 possession (Score: 84-73)
Pau Barnes attempts a Layup. BLOCKED BY IMMANUEL JAMES! Ball is loose! Rebound secured by Luka Sabonis.

[01:38] Team_031 possession (Score: 84-73)
Immanuel James attempts a 3Pt. Contested by Magic Tatum (4.1 feet, ZONE). Immanuel James misses. Offensive rebound by Luka Sabonis! Luka Sabonis's putback is no good. Rebound secured by Pau Barnes.

[01:23] Team_011 possession (Score: 84-73)
Trae Tatum commits a violation (traveling/carry)! TURNOVER! (dead ball)

[01:23] Substitution (Team_011): Magic Tatum OUT → Shai Leonard IN (stamina_rule2)

[01:23] Substitution (Team_011): Trae Tatum OUT → De'Aaron George IN (stamina_rule2)

[01:23] Substitution (Team_011): Michael Carter OUT → Tyrese Nowitzki IN (stamina_rule2)

[01:23] Substitution (Team_011): Pau Barnes OUT → Russell Davis IN (stamina_rule2)

[01:23] Substitution (Team_011): Evan George OUT → Pau Towns IN (stamina_rule2)

[01:23] Substitution (Team_031): Shai Durant OUT → Kevin Morant IN (stamina_rule2)

[01:23] Substitution (Team_031): Gary Morant OUT → Isaiah Ingram IN (stamina_rule2)

[01:23] Substitution (Team_031): Pau Irving OUT → Miles Stewart IN (stamina_rule2)

[01:23] Substitution (Team_031): Immanuel James OUT → Kobe Randle IN (stamina_rule2)

[01:23] Substitution (Team_031): Luka Sabonis OUT → Jimmy Poole IN (stamina_rule2)

[01:12] Team_031 possession (Score: 84-73)
FOUL! Shooting foul on Shai Leonard. Jimmy Poole to the line for 2 free throws. [Team fouls: 4] (Shai Leonard: 1 personal fouls)   FT 1/2: GOOD   FT 2/2: GOOD Jimmy Poole makes 2/2 from the line.
Score: 84-75

[00:54] Team_011 possession (Score: 84-75)
Pau Towns drives and kicks out. Tyrese Nowitzki attempts a 3Pt. Contested by Miles Stewart (5.3 feet, MAN). Tyrese Nowitzki misses. Offensive rebound by Tyrese Nowitzki! Tyrese Nowitzki kicks it out.

[00:42] Team_011 possession (Score: 84-75)
Russell Davis attempts a 3Pt. Contested by Kobe Randle (4.0 feet, MAN). Russell Davis misses. Rebound secured by Jimmy Poole.

[00:26] Team_031 possession (Score: 84-75)
Isaiah Ingram attempts a Layup. BLOCKED BY PAU TOWNS! Ball deflects out of bounds off Isaiah Ingram.

[00:14] Team_011 possession (Score: 84-75)
FOUL! Holding foul on Isaiah Ingram. [IN THE BONUS! 8 team fouls] De'Aaron George to the line for 2 free throws. (Isaiah Ingram: 1 personal fouls)   FT 1/2: GOOD   FT 2/2: GOOD De'Aaron George makes 2/2 from the line.
Score: 86-75

[00:01] Team_031 possession (Score: 86-75)
Kevin Morant attempts a 3Pt. Contested by Shai Leonard (4.4 feet, ZONE). Kevin Morant misses. Rebound secured by Russell Davis.

================================================================================
                              3RD QUARTER COMPLETE                              
================================================================================

3RD QUARTER SCORE: Team_011 38, Team_031 29

BOX SCORE:
================================================================================

Team_011
--------------------------------------------------------------------------------
Player                MIN  PTS  REB  AST  TO      FG   FG%      3P   3P%
--------------------------------------------------------------------------------
Michael Carter         25    9    1    2   0   4/5    80.0     0/0   0.0
Trae Tatum             25    9    0    4   0   4/4   100.0     0/0   0.0
Magic Tatum            25    5    0    2   0   2/2   100.0     0/0   0.0
Evan George            25    3    2    2   0   1/2    50.0     0/0   0.0
De'Aaron George        12    2    0    0   0   1/1   100.0     0/0   0.0
Tyrese Nowitzki        12    0    1    0   0   0/0     0.0     0/0   0.0
Russell Davis          12    0    1    0   0   0/1     0.0     0/0   0.0

TEAM: FG: 15/21 (71.4%), 3PT: 6/8 (75.0%), REB: 8 (3 off, 5 def), AST: 11, TO: 1
TEAM FOULS: 4


Team_031
--------------------------------------------------------------------------------
Player                MIN  PTS  REB  AST  TO      FG   FG%      3P   3P%
--------------------------------------------------------------------------------
Gary Morant            25   10    1    2   0   5/5   100.0     0/0   0.0
Immanuel James         25    9    2    0   0   3/4    75.0     0/0   0.0
Pau Irving             25    8    0    1   0   3/5    60.0     0/0   0.0
Pau Barnes             25    8    4    1   0   3/6    50.0     0/0   0.0
Jimmy Poole            12    2    1    0   0   1/1   100.0     0/0   0.0
Luka Sabonis           25    0    4    3   0   0/1     0.0     0/0   0.0
Shai Durant            25    0    0    0   0   0/1     0.0     0/0   0.0
Isaiah Ingram          12    0    0    0   0   0/1     0.0     0/0   0.0
Kevin Morant           12    0    0    0   0   0/1     0.0     0/0   0.0

TEAM: FG: 12/19 (63.2%), 3PT: 2/6 (33.3%), REB: 9 (3 off, 6 def), AST: 6, TO: 3
TEAM FOULS: 8 [Team_011 in BONUS]

================================================================================

================================================================================
                       4TH QUARTER - Team_011 vs Team_031                       
================================================================================

[12:00] Team_011 possession (Score: 86-75)
FOUL! Shooting foul on Gary Morant. Trae Tatum to the line for 2 free throws. [Team fouls: 1] (Gary Morant: 1 personal fouls)   FT 1/2: GOOD   FT 2/2: GOOD Trae Tatum makes 2/2 from the line.
Score: 88-75

[11:43] Team_031 possession (Score: 88-75)
Pau Irving attempts a Midrange. Contested by Trae Tatum (4.8 feet, ZONE). Pau Irving misses. Offensive rebound by Immanuel James! Immanuel James's putback is no good. Rebound secured by Evan George.

[11:29] Team_011 possession (Score: 88-75)
Trae Tatum attempts a 3Pt. Contested by Pau Irving (3.7 feet, ZONE). Trae Tatum misses. Rebound secured by Gary Morant.

[11:15] Team_031 possession (Score: 88-75)
Immanuel James drives, Pau Barnes stays with him. Immanuel James attempts a Dunk. Contested by Pau Barnes (3.6 feet, MAN). IMMANUEL JAMES MAKES IT! Assist: Gary Morant
Score: 88-77

[10:58] Team_011 possession (Score: 88-77)
Michael Carter makes the Layup and draws the foul on Immanuel James! And-1! Michael Carter to the line for 1. [Team fouls: 2] (Immanuel James: 1 personal fouls)   FT 1/1: GOOD Michael Carter makes 1/1 from the line.
Score: 91-77

[10:45] Team_031 possession (Score: 91-77)
FOUL! Holding foul on Pau Barnes. [Team fouls: 1] No free throws, side out. (Pau Barnes: 1 personal fouls)

[10:32] Team_031 possession (Score: 91-77)
Gary Morant attempts a 3Pt. Contested by Magic Tatum (4.2 feet, ZONE). Gary Morant misses. Offensive rebound by Luka Sabonis! Luka Sabonis puts it back in!
Score: 91-79

[10:20] Team_011 possession (Score: 91-79)
Pau Barnes attempts a Layup. Contested by Immanuel James (4.1 feet, ZONE). PAU BARNES MAKES IT! Assist: Trae Tatum
Score: 93-79

[10:02] Team_031 possession (Score: 93-79)
Shai Durant drives, picks up Pau Barnes. Help arrives from Magic Tatum! Shai Durant attempts a Dunk. Contested by Magic Tatum (3.5 feet, ZONE). SHAI DURANT MAKES IT!
Score: 93-81

[09:50] Team_011 possession (Score: 93-81)
Pau Barnes drives, Immanuel James stays with him. Pau Barnes attempts a Layup. Contested by Immanuel James (4.2 feet, ZONE). PAU BARNES MAKES IT!
Score: 95-81

[09:38] Team_031 possession (Score: 95-81)
Shai Durant drives and kicks out. Shai Durant attempts a 3Pt. Contested by Magic Tatum (3.8 feet, ZONE). SHAI DURANT MAKES IT! Assist: Luka Sabonis
Score: 95-84

[09:25] Team_011 possession (Score: 95-84)
Michael Carter attempts a 3Pt. Contested by Gary Morant (4.0 feet, ZONE). Michael Carter misses. Rebound secured by Immanuel James.

[09:12] Team_031 possession (Score: 95-84)
Immanuel James makes the Layup and draws the foul on Pau Barnes! And-1! Immanuel James to the line for 1. [Team fouls: 2] (Pau Barnes: 2 personal fouls)   FT 1/1: GOOD Immanuel James makes 1/1 from the line.
Score: 95-87

[09:03] Team_011 possession (Score: 95-87)
Pau Barnes makes the Dunk and draws the foul on Shai Durant! And-1! Pau Barnes to the line for 1. [Team fouls: 3] (Shai Durant: 1 personal fouls)   FT 1/1: GOOD Pau Barnes makes 1/1 from the line.
Score: 98-87

[08:48] Team_031 possession (Score: 98-87)
Gary Morant attempts a 3Pt. Contested by Pau Barnes (4.1 feet, ZONE). Gary Morant misses. Rebound secured by Pau Barnes.

[08:33] Team_011 possession (Score: 98-87)
Trae Tatum attempts a 3Pt. Contested by Pau Irving (4.0 feet, ZONE). TRAE TATUM MAKES IT! Assist: Pau Barnes
Score: 101-87

[08:23] Team_031 possession (Score: 101-87)
Gary Morant commits a violation (traveling/carry)! TURNOVER! (dead ball)

[08:23] Substitution (Team_011): Magic Tatum OUT → Shai Leonard IN (stamina_rule2)

[08:23] Substitution (Team_011): Trae Tatum OUT → De'Aaron George IN (stamina_rule2)

[08:23] Substitution (Team_011): Michael Carter OUT → Tyrese Nowitzki IN (stamina_rule2)

[08:23] Substitution (Team_011): Pau Barnes OUT → Russell Davis IN (stamina_rule2)

[08:23] Substitution (Team_011): Evan George OUT → Pau Towns IN (stamina_rule2)

[08:23] Substitution (Team_031): Shai Durant OUT → Kevin Morant IN (stamina_rule2)

[08:23] Substitution (Team_031): Gary Morant OUT → Isaiah Ingram IN (stamina_rule2)

[08:23] Substitution (Team_031): Pau Irving OUT → Miles Stewart IN (stamina_rule2)

[08:23] Substitution (Team_031): Immanuel James OUT → Kobe Randle IN (stamina_rule2)

[08:23] Substitution (Team_031): Luka Sabonis OUT → Jimmy Poole IN (stamina_rule2)

[08:11] Team_011 possession (Score: 101-87)
De'Aaron George attempts a Layup. BLOCKED BY ISAIAH INGRAM! Ball is loose! Rebound secured by Kobe Randle.

[07:53] Team_031 possession (Score: 101-87)
Kobe Randle attempts a Midrange. Contested by Russell Davis (4.4 feet, MAN). Kobe Randle misses. Rebound secured by Russell Davis.

[07:37] Team_011 possession (Score: 101-87)
Shai Leonard attempts a 3Pt. Contested by Kevin Morant (4.9 feet, MAN). Shai Leonard misses. Rebound secured by Kobe Randle.

[07:23] Team_031 possession (Score: 101-87)
Kobe Randle makes the Layup and draws the foul on Russell Davis! And-1! Kobe Randle to the line for 1. [Team fouls: 3] (Russell Davis: 1 personal fouls)   FT 1/1: GOOD Kobe Randle makes 1/1 from the line.
Score: 101-90

[07:06] Team_011 possession (Score: 101-90)
Shai Leonard attempts a Midrange. Contested by Kevin Morant (4.9 feet, MAN). Shai Leonard misses. Rebound secured by Kobe Randle.

[06:53] Team_031 possession (Score: 101-90)
FOUL! Reach-in foul on Tyrese Nowitzki during the drive. [Team fouls: 4] No free throws, side out. (Tyrese Nowitzki: 1 personal fouls)

[06:36] Team_031 possession (Score: 101-90)
Kevin Morant drives to the basket... Kevin Morant throws a bad pass out of bounds! TURNOVER! (dead ball)

[06:20] Team_011 possession (Score: 101-90)
De'Aaron George attempts a 3Pt. Contested by Isaiah Ingram (4.6 feet, MAN). De'Aaron George misses. Offensive rebound by Tyrese Nowitzki! Tyrese Nowitzki kicks it out.

[06:09] Team_011 possession (Score: 101-90)
Russell Davis drives, Kobe Randle stays with him. Russell Davis attempts a Layup. Contested by Kobe Randle (4.0 feet, MAN). Russell Davis misses. Offensive rebound by Pau Towns! Pau Towns kicks it out.

[05:55] Team_011 possession (Score: 101-90)
Shai Leonard drives and kicks out. Russell Davis attempts a Midrange. Contested by Isaiah Ingram (4.3 feet, ZONE). Russell Davis misses. Rebound secured by Jimmy Poole.

[05:39] Team_031 possession (Score: 101-90)
Isaiah Ingram makes the Dunk and draws the foul on De'Aaron George! And-1! Isaiah Ingram to the line for 1. [BONUS: 5 team fouls] (De'Aaron George: 1 personal fouls)   FT 1/1: GOOD Isaiah Ingram makes 1/1 from the line.
Score: 101-93

[05:27] Team_011 possession (Score: 101-93)
De'Aaron George drives and kicks out. Shai Leonard attempts a 3Pt. Contested by Kevin Morant (4.9 feet, MAN). Shai Leonard misses. FOUL! Loose ball foul on Jimmy Poole during the rebound battle. [Team fouls: 4] No free throws, side out. (Jimmy Poole: 1 personal fouls)

[05:12] Team_011 possession (Score: 101-93)
Russell Davis attempts a 3Pt. Contested by Kobe Randle (4.0 feet, MAN). RUSSELL DAVIS MAKES IT! Assist: Shai Leonard
Score: 104-93

[04:58] Team_031 possession (Score: 104-93)
Isaiah Ingram attempts a 3Pt. Contested by Tyrese Nowitzki (5.1 feet, ZONE). ISAIAH INGRAM MAKES IT! Assist: Jimmy Poole
Score: 104-96

[04:40] Team_011 possession (Score: 104-96)
De'Aaron George drives to the basket... De'Aaron George throws a bad pass out of bounds! TURNOVER! (dead ball)

[04:28] Team_031 possession (Score: 104-96)
Isaiah Ingram attempts a 3Pt. Contested by De'Aaron George (5.2 feet, MAN). ISAIAH INGRAM MAKES IT! Assist: Miles Stewart
Score: 104-99

[04:09] Team_011 possession (Score: 104-99)
De'Aaron George drives, Isaiah Ingram stays with him. De'Aaron George attempts a Layup. Contested by Isaiah Ingram (4.6 feet, MAN). De'Aaron George misses. Rebound secured by Isaiah Ingram.

[03:56] Team_031 possession (Score: 104-99)
Kevin Morant attempts a Midrange. Contested by Tyrese Nowitzki (4.7 feet, ZONE). Kevin Morant misses. Offensive rebound by Jimmy Poole! Jimmy Poole kicks it out.

[03:41] Team_031 possession (Score: 104-99)
FOUL! Holding foul on Shai Leonard. [IN THE BONUS! 6 team fouls] Kevin Morant to the line for 2 free throws. (Shai Leonard: 1 personal fouls)   FT 1/2: GOOD   FT 2/2: GOOD Kevin Morant makes 2/2 from the line.
Score: 104-101

[03:31] Team_011 possession (Score: 104-101)
Tyrese Nowitzki attempts a 3Pt. Contested by Miles Stewart (5.3 feet, MAN). TYRESE NOWITZKI MAKES IT!
Score: 107-101

[03:18] Team_031 possession (Score: 107-101)
Miles Stewart drives, picks up Tyrese Nowitzki. Help arrives from Shai Leonard! Miles Stewart attempts a Dunk. Contested by Shai Leonard (4.7 feet, MAN). Miles Stewart misses. Rebound secured by Tyrese Nowitzki.

[03:02] Team_011 possession (Score: 107-101)
De'Aaron George attempts a Layup. BLOCKED BY KOBE RANDLE! Ball is loose! Rebound secured by Isaiah Ingram.

[02:50] Team_031 possession (Score: 107-101)
Isaiah Ingram attempts a 3Pt. Contested by De'Aaron George (5.2 feet, MAN). Isaiah Ingram misses. Rebound secured by Tyrese Nowitzki.

[02:32] Team_011 possession (Score: 107-101)
FOUL! Shooting foul on Isaiah Ingram. De'Aaron George to the line for 2 free throws. [BONUS: 5 team fouls] (Isaiah Ingram: 1 personal fouls)   FT 1/2: GOOD   FT 2/2: GOOD De'Aaron George makes 2/2 from the line.
Score: 109-101

[02:19] Team_031 possession (Score: 109-101)
Miles Stewart drives and kicks out. Kobe Randle attempts a Midrange. Contested by Russell Davis (3.8 feet, MAN). Kobe Randle misses. Rebound secured by Pau Towns.

[02:07] Team_011 possession (Score: 109-101)
Pau Towns attempts a Midrange. Contested by Kobe Randle (4.4 feet, ZONE). PAU TOWNS MAKES IT! Assist: Shai Leonard
Score: 111-101

[01:54] Team_031 possession (Score: 111-101)
Jimmy Poole attempts a Layup. BLOCKED BY PAU TOWNS! Ball is loose! Rebound secured by Russell Davis.

[01:41] Team_011 possession (Score: 111-101)
Russell Davis drives and kicks out. Tyrese Nowitzki attempts a 3Pt. Contested by Miles Stewart (5.4 feet, ZONE). Tyrese Nowitzki misses. Rebound secured by Kobe Randle.

[01:22] Team_031 possession (Score: 111-101)
Kobe Randle attempts a Layup. Contested by Russell Davis (4.5 feet, ZONE). KOBE RANDLE MAKES IT! Assist: Jimmy Poole
Score: 111-103

[01:08] Team_011 possession (Score: 111-103)
Tyrese Nowitzki drives to the basket... Tyrese Nowitzki loses control! Ball rolls out of bounds! TURNOVER! (dead ball)

[00:57] Team_031 possession (Score: 111-103)
Jimmy Poole drives and kicks out. Kobe Randle attempts a 3Pt. Contested by Shai Leonard (4.4 feet, ZONE). Kobe Randle misses. Rebound secured by Russell Davis.

[00:39] Team_011 possession (Score: 111-103)
De'Aaron George attempts a 3Pt. Contested by Miles Stewart (5.8 feet, ZONE). De'Aaron George misses. Rebound secured by Kobe Randle.

[00:22] Team_031 possession (Score: 111-103)
Jimmy Poole drives to the basket... Jimmy Poole loses the ball! Stripped by Pau Towns! TURNOVER! (live ball)

[00:03] Team_011 possession (Score: 111-103)
De'Aaron George attempts a Midrange. Contested by Isaiah Ingram (4.9 feet, MAN). De'Aaron George misses. Rebound secured by Kobe Randle.

================================================================================
                              4TH QUARTER COMPLETE                              
================================================================================

4TH QUARTER SCORE: Team_011 25, Team_031 28

BOX SCORE:
================================================================================

Team_011
--------------------------------------------------------------------------------
Player                MIN  PTS  REB  AST  TO      FG   FG%      3P   3P%
--------------------------------------------------------------------------------
Pau Barnes             29    7    1    1   0   3/3   100.0     0/0   0.0
Trae Tatum             29    5    0    1   0   2/3    66.7     0/0   0.0
Michael Carter         29    3    0    0   0   1/2    50.0     0/0   0.0
Russell Davis          20    3    3    0   0   1/2    50.0     0/0   0.0
Tyrese Nowitzki        20    3    4    0   0   1/1   100.0     0/0   0.0
De'Aaron George        20    2    0    0   0   1/6    16.7     0/0   0.0
Pau Towns              20    2    2    0   0   1/1   100.0     0/0   0.0
Shai Leonard           20    0    0    2   0   0/3     0.0     0/0   0.0

TEAM: FG: 10/21 (47.6%), 3PT: 3/7 (42.9%), REB: 10 (3 off, 7 def), AST: 4, TO: 2
TEAM FOULS: 6 [Team_031 in BONUS]


Team_031
--------------------------------------------------------------------------------
Player                MIN  PTS  REB  AST  TO      FG   FG%      3P   3P%
--------------------------------------------------------------------------------
Isaiah Ingram          20    9    2    0   0   3/4    75.0     0/0   0.0
Immanuel James         29    5    1    0   0   2/2   100.0     0/0   0.0
Shai Durant            29    5    0    0   0   2/2   100.0     0/0   0.0
Kobe Randle            20    5    6    0   0   2/3    66.7     0/0   0.0
Luka Sabonis           29    2    1    1   0   1/1   100.0     0/0   0.0
Kevin Morant           20    2    0    0   0   1/1   100.0     0/0   0.0
Pau Irving             29    0    0    0   0   0/1     0.0     0/0   0.0
Evan George            29    0    1    0   0   0/0     0.0     0/0   0.0
Gary Morant            29    0    1    1   0   0/1     0.0     0/0   0.0
Jimmy Poole            20    0    2    2   0   0/2     0.0     0/0   0.0
Miles Stewart          20    0    0    1   0   0/2     0.0     0/0   0.0

TEAM: FG: 11/19 (57.9%), 3PT: 3/5 (60.0%), REB: 14 (3 off, 11 def), AST: 5, TO: 3
TEAM FOULS: 5 [Team_011 in BONUS]

================================================================================

================================================================================
                               FULL GAME COMPLETE                               
================================================================================

FINAL SCORE: Team_011 111, Team_031 103

SCORING BY QUARTER:
--------------------------------------------------------------------------------
Team                     Q1     Q2     Q3     Q4    FINAL
--------------------------------------------------------------------------------
Team_011                 27     21     38     25      111
Team_031                 25     21     29     28      103
--------------------------------------------------------------------------------

FULL GAME BOX SCORE:
================================================================================

Team_011
--------------------------------------------------------------------------------
Player                MIN  PTS  REB  AST  TO      FG   FG%      3P   3P%      FT STL BLK
--------------------------------------------------------------------------------
Magic Tatum            29   11    0    2   0   4/7    57.1   1/1   100.0   2/2     0   1
Trae Tatum             29   21    0    7   1  11/12   91.7   5/6    83.3   4/5     0   1
Michael Carter         29   17    6    4   1   7/15   46.7   1/4    25.0   2/3     1   0
Pau Barnes             29   19    7    2   0   7/11   63.6   1/2    50.0   2/2     1   0
Evan George            29    7   11    3   1   2/5    40.0   1/2    50.0   0/1     0   0
Shai Leonard           20    9    0    2   1   4/8    50.0   0/2     0.0   3/3     0   0
De'Aaron George        20    8    0    1   0   3/8    37.5   0/1     0.0   6/6     0   0
Tyrese Nowitzki        20    5    9    0   3   2/4    50.0   1/1   100.0   0/0     0   0
Russell Davis          20    6    6    0   0   2/5    40.0   1/2    50.0   1/1     0   2
Pau Towns              20    4    7    1   1   2/4    50.0   0/0     0.0   0/0     2   3

TEAM: FG: 46/81 (56.8%), 3PT: 11/21 (52.4%), REB: 44 (12 off, 32 def), AST: 22, TO: 8


Team_031
--------------------------------------------------------------------------------
Player                MIN  PTS  REB  AST  TO      FG   FG%      3P   3P%      FT STL BLK
--------------------------------------------------------------------------------
Shai Durant            29   11    0    2   2   6/10   60.0   3/4    75.0   0/2     0   1
Gary Morant            29   12    8    4   1   7/11   63.6   1/4    25.0   0/0     0   0
Pau Irving             29   13    0    2   1   5/10   50.0   2/4    50.0   3/4     1   0
Immanuel James         29   18    8    1   1   6/11   54.5   0/3     0.0   1/2     0   1
Luka Sabonis           29    8   10    4   1   2/4    50.0   0/1     0.0   0/0     0   0
Kevin Morant           20    7    0    0   2   2/4    50.0   1/3    33.3   5/5     0   0
Isaiah Ingram          20   11    4    0   1   4/7    57.1   2/3    66.7   3/3     0   1
Miles Stewart          20    3    0    1   0   1/4    25.0   0/0     0.0   1/1     0   1
Kobe Randle            20    9    8    0   0   4/7    57.1   0/1     0.0   3/3     0   2
Jimmy Poole            20    4    7    3   3   2/7    28.6   0/0     0.0   5/6     0   0

TEAM: FG: 40/76 (52.6%), 3PT: 9/23 (39.1%), REB: 46 (11 off, 35 def), AST: 17, TO: 12

================================================================================
