================================================================================
                        FULL GAME - Team_062 vs Team_005                        
================================================================================

================================================================================
                       1ST QUARTER - Team_062 vs Team_005                       
================================================================================

[12:00] Team_062 possession (Score: 0-0)
Jalen Reaves drives to the basket... Jalen Reaves loses the ball! Stripped by Cade Markkanen! TURNOVER! (live ball)

[11:45] Team_005 possession (Score: 0-0)
Cade Markkanen drives to the basket... Cade Markkanen commits a violation (traveling/carry)! TURNOVER! (dead ball)

[11:33] Team_062 possession (Score: 0-0)
Chris Bird attempts a Layup. BLOCKED BY CADE MARKKANEN! Ball is loose! Rebound secured by Cade Markkanen.

[11:17] Team_005 possession (Score: 0-0)
Derrick Allen drives, Jalen Reaves stays with him. Derrick Allen attempts a Dunk. Contested by Jalen Reaves (5.3 feet, ZONE). DERRICK ALLEN MAKES IT! Assist: Anthony Rozier
Score: 0-2

[11:02] Team_062 possession (Score: 0-2)
Jalen Reaves attempts a Layup. Contested by Cade Markkanen (3.5 feet, ZONE). Jalen Reaves misses. Rebound secured by Cade Markkanen.

[10:50] Team_005 possession (Score: 0-2)
Brandon George throws a bad pass out of bounds! TURNOVER! (dead ball)

[10:39] Team_062 possession (Score: 0-2)
Michael Hyland attempts a 3Pt. Contested by Derrick Allen (4.2 feet, MAN). Michael Hyland misses. Rebound secured by Derrick Allen.

[10:23] Team_005 possession (Score: 0-2)
Brandon George attempts a Midrange. Contested by Chris Bird (4.4 feet, MAN). Brandon George misses. Rebound secured by Jalen Reaves.

[10:07] Team_062 possession (Score: 0-2)
Jalen Reaves makes the Layup and draws the foul on Cade Markkanen! And-1! Jalen Reaves to the line for 1. [Team fouls: 1] (Cade Markkanen: 1 personal fouls)   FT 1/1: GOOD Jalen Reaves makes 1/1 from the line.
Score: 3-2

[09:51] Team_005 possession (Score: 3-2)
Cade Markkanen drives and kicks out. Jalen Rozier attempts a Midrange. Contested by RJ Williamson (4.4 feet, ZONE). Jalen Rozier misses. Rebound secured by Kawhi Thompson.

[09:36] Team_062 possession (Score: 3-2)
Michael Hyland attempts a 3Pt. Contested by Derrick Allen (4.2 feet, MAN). Michael Hyland misses. Offensive rebound by Kawhi Thompson! Kawhi Thompson kicks it out.

[09:16] Team_062 possession (Score: 3-2)
Michael Hyland attempts a 3Pt. Contested by Derrick Allen (4.2 feet, MAN). Michael Hyland misses. Offensive rebound by Jalen Reaves! Jalen Reaves's putback is no good. Rebound secured by Jalen Rozier.

[09:02] Team_005 possession (Score: 3-2)
Derrick Allen makes the Layup and draws the foul on Michael Hyland! And-1! Derrick Allen to the line for 1. [Team fouls: 1] (Michael Hyland: 1 personal fouls)   FT 1/1: GOOD Derrick Allen makes 1/1 from the line.
Score: 3-5

[08:45] Team_062 possession (Score: 3-5)
RJ Williamson attempts a 3Pt. Contested by Anthony Rozier (4.3 feet, MAN). RJ Williamson misses. Offensive rebound by Jalen Reaves! Jalen Reaves's putback is no good. Rebound secured by Derrick Allen.

[08:30] Team_005 possession (Score: 3-5)
Derrick Allen attempts a Midrange. Contested by Michael Hyland (5.0 feet, MAN). Derrick Allen misses. Rebound secured by Jalen Reaves.

[08:13] Team_062 possession (Score: 3-5)
Michael Hyland attempts a 3Pt. Contested by Derrick Allen (4.2 feet, ZONE). Michael Hyland misses. Rebound secured by Cade Markkanen.

[07:58] Team_005 possession (Score: 3-5)
Jalen Rozier makes the Layup and draws the foul on Kawhi Thompson! And-1! Jalen Rozier to the line for 1. [Team fouls: 2] (Kawhi Thompson: 1 personal fouls)   FT 1/1: GOOD Jalen Rozier makes 1/1 from the line.
Score: 3-8

[07:46] Team_062 possession (Score: 3-8)
Michael Hyland attempts a 3Pt. Contested by Derrick Allen (4.2 feet, MAN). MICHAEL HYLAND MAKES IT!
Score: 6-8

[07:30] Team_005 possession (Score: 6-8)
Cade Markkanen drives and kicks out. Anthony Rozier attempts a 3Pt. Contested by RJ Williamson (4.4 feet, MAN). Anthony Rozier misses. Rebound secured by Kawhi Thompson.

[07:16] Team_062 possession (Score: 6-8)
Kawhi Thompson drives, picks up Cade Markkanen. Help arrives from Anthony Rozier! Kawhi Thompson attempts a Dunk. Contested by Anthony Rozier (3.3 feet, MAN). KAWHI THOMPSON MAKES IT! Assist: Michael Hyland
Score: 8-8

[07:02] Team_005 possession (Score: 8-8)
Brandon George attempts a Midrange. Contested by Chris Bird (4.4 feet, MAN). Brandon George misses. Rebound secured by Jalen Reaves.

[06:50] Team_062 possession (Score: 8-8)
FOUL! Reach-in foul on Derrick Allen during the drive. [Team fouls: 2] No free throws, side out. (Derrick Allen: 1 personal fouls)

[06:31] Team_062 possession (Score: 8-8)
RJ Williamson makes the Layup and draws the foul on Anthony Rozier! And-1! RJ Williamson to the line for 1. [Team fouls: 3] (Anthony Rozier: 1 personal fouls)   FT 1/1: GOOD RJ Williamson makes 1/1 from the line.
Score: 11-8

[06:19] Team_005 possession (Score: 11-8)
Cade Markkanen drives to the basket... Cade Markkanen loses the ball! Stripped by Jalen Reaves! TURNOVER! (live ball)

[06:07] Team_062 possession (Score: 11-8)
FOUL! Reach-in foul on Cade Markkanen during the drive. [Team fouls: 4] No free throws, side out. (Cade Markkanen: 2 personal fouls)

[05:50] Team_062 possession (Score: 11-8)
Kawhi Thompson drives and kicks out. RJ Williamson attempts a 3Pt. Contested by Anthony Rozier (4.6 feet, MAN). RJ WILLIAMSON MAKES IT! Assist: Jalen Reaves
Score: 14-8

[05:38] Team_005 possession (Score: 14-8)
FOUL! Holding foul on Kawhi Thompson. [Team fouls: 3] No free throws, side out. (Kawhi Thompson: 2 personal fouls)

[05:22] Team_005 possession (Score: 14-8)
Cade Markkanen makes the Dunk and draws the foul on Jalen Reaves! And-1! Cade Markkanen to the line for 1. [Team fouls: 4] (Jalen Reaves: 1 personal fouls)   FT 1/1: MISS Cade Markkanen makes 0/1 from the line. Rebound secured by Jalen Reaves.
Score: 14-10

[05:05] Team_062 possession (Score: 14-10)
Michael Hyland attempts a 3Pt. Contested by Brandon George (5.1 feet, ZONE). Michael Hyland misses. Offensive rebound by Kawhi Thompson! Kawhi Thompson kicks it out.

[04:55] Team_062 possession (Score: 14-10)
Michael Hyland throws a bad pass out of bounds! TURNOVER! (dead ball)

[04:39] Team_005 possession (Score: 14-10)
Anthony Rozier drives, RJ Williamson stays with him. Anthony Rozier attempts a Layup. Contested by RJ Williamson (4.5 feet, MAN). ANTHONY ROZIER MAKES IT! Assist: Jalen Rozier
Score: 14-12

[04:22] Team_062 possession (Score: 14-12)
RJ Williamson attempts a Midrange. BLOCKED BY ANTHONY ROZIER! Ball goes out off Anthony Rozier. RJ Williamson's ball!

[04:09] Team_062 possession (Score: 14-12)
Jalen Reaves drives, picks up Cade Markkanen. Help arrives from Anthony Rozier! Jalen Reaves attempts a Layup. Contested by Anthony Rozier (3.6 feet, ZONE). Jalen Reaves misses. Rebound secured by Derrick Allen.

[03:58] Team_005 possession (Score: 14-12)
Jalen Rozier attempts a Midrange. Contested by Jalen Reaves (5.4 feet, ZONE). Jalen Rozier misses. Offensive rebound by Cade Markkanen! Cade Markkanen puts it back in!
Score: 14-14

[03:47] Team_062 possession (Score: 14-14)
Michael Hyland drives, picks up Derrick Allen. Help arrives from Anthony Rozier! Michael Hyland attempts a Dunk. Contested by Anthony Rozier (4.3 feet, MAN). Michael Hyland misses. Offensive rebound by Kawhi Thompson! Kawhi Thompson kicks it out.

[03:36] Team_062 possession (Score: 14-14)
Kawhi Thompson attempts a Layup. BLOCKED BY CADE MARKKANEN! Ball is loose! Rebound secured by Cade Markkanen.

[03:20] Team_005 possession (Score: 14-14)
Derrick Allen attempts a 3Pt. Contested by Michael Hyland (5.2 feet, MAN). DERRICK ALLEN MAKES IT! Assist: Anthony Rozier
Score: 14-17

[03:01] Team_062 possession (Score: 14-17)
Jalen Reaves attempts a 3Pt. Contested by Derrick Allen (4.6 feet, ZONE). JALEN REAVES MAKES IT! Assist: Kawhi Thompson
Score: 17-17

[02:51] Team_005 possession (Score: 17-17)
Cade Markkanen attempts a Midrange. Contested by Jalen Reaves (5.0 feet, MAN). Cade Markkanen misses. Rebound secured by Jalen Reaves.

[02:36] Team_062 possession (Score: 17-17)
Michael Hyland attempts a Midrange. Contested by Jalen Rozier (5.1 feet, ZONE). Michael Hyland misses. Rebound secured by Derrick Allen.

[02:24] Team_005 possession (Score: 17-17)
Brandon George drives to the basket... FOUL! Offensive foul on Brandon George! Jalen Reaves drew the charge! [Team fouls: 5] (Brandon George: 1 personal fouls) TURNOVER! (dead ball)

[02:11] Team_062 possession (Score: 17-17)
Kawhi Thompson attempts a Midrange. Contested by Derrick Allen (4.5 feet, ZONE). KAWHI THOMPSON MAKES IT!
Score: 19-17

[01:54] Team_005 possession (Score: 19-17)
FOUL! Reach-in foul on Chris Bird during the drive. [IN THE BONUS! 5 team fouls] Brandon George to the line for 2 free throws. (Chris Bird: 1 personal fouls)   FT 1/2: GOOD   FT 2/2: GOOD Brandon George makes 2/2 from the line.
Score: 19-19

[01:43] Team_062 possession (Score: 19-19)
Kawhi Thompson attempts a Midrange. Contested by Anthony Rozier (5.0 feet, ZONE). KAWHI THOMPSON MAKES IT! Assist: RJ Williamson
Score: 21-19

[01:27] Team_005 possession (Score: 21-19)
FOUL! Shooting foul on Chris Bird. Brandon George to the line for 3 free throws. [BONUS: 6 team fouls] (Chris Bird: 2 personal fouls)   FT 1/3: MISS   FT 2/3: GOOD   FT 3/3: MISS Brandon George makes 1/3 from the line. Offensive rebound by Cade Markkanen! Cade Markkanen kicks it out.
Score: 21-20

[01:12] Team_005 possession (Score: 21-20)
FOUL! Holding foul on Chris Bird. [IN THE BONUS! 7 team fouls] Brandon George to the line for 2 free throws. (Chris Bird: 3 personal fouls)   FT 1/2: GOOD   FT 2/2: MISS Brandon George makes 1/2 from the line. Rebound secured by Jalen Reaves.
Score: 21-21

[00:58] Team_062 possession (Score: 21-21)
Chris Bird drives, picks up Brandon George. Help arrives from Anthony Rozier! Chris Bird attempts a Layup. Contested by Anthony Rozier (5.8 feet, MAN). CHRIS BIRD MAKES IT!
Score: 23-21

[00:41] Team_005 possession (Score: 23-21)
Derrick Allen attempts a Midrange. Contested by Michael Hyland (5.4 feet, MAN). Derrick Allen misses. Rebound secured by Jalen Reaves.

[00:27] Team_062 possession (Score: 23-21)
RJ Williamson attempts a 3Pt. Contested by Derrick Allen (4.4 feet, ZONE). RJ Williamson misses. Rebound secured by Cade Markkanen.

[00:08] Team_005 possession (Score: 23-21)
Brandon George drives and kicks out. Jalen Rozier attempts a Midrange. Contested by Kawhi Thompson (5.4 feet, MAN). JALEN ROZIER MAKES IT!
Score: 23-23

================================================================================
                              1ST QUARTER COMPLETE                              
================================================================================

1ST QUARTER SCORE: Team_062 23, Team_005 23

BOX SCORE:
================================================================================

Team_062
--------------------------------------------------------------------------------
Player                MIN  PTS  REB  AST  TO      FG   FG%      3P   3P%
--------------------------------------------------------------------------------
Jalen Reaves           12    6    7    1   0   2/4    50.0     0/0   0.0
Kawhi Thompson         12    6    5    1   0   3/4    75.0     0/0   0.0
RJ Williamson          12    6    0    1   0   2/4    50.0     0/0   0.0
Michael Hyland         12    3    0    1   0   1/5    20.0     0/0   0.0
Chris Bird             12    2    0    0   0   1/2    50.0     0/0   0.0

TEAM: FG: 9/19 (47.4%), 3PT: 2/7 (28.6%), REB: 14 (5 off, 9 def), AST: 4, TO: 2
TEAM FOULS: 7 [Team_005 in BONUS]


Team_005
--------------------------------------------------------------------------------
Player                MIN  PTS  REB  AST  TO      FG   FG%      3P   3P%
--------------------------------------------------------------------------------
Derrick Allen          12    8    4    0   0   3/5    60.0     0/0   0.0
Jalen Rozier           12    5    1    1   0   2/2   100.0     0/0   0.0
Cade Markkanen         12    2    7    0   0   1/5    20.0     0/0   0.0
Anthony Rozier         12    2    0    2   0   1/1   100.0     0/0   0.0
Brandon George         12    2    0    0   0   1/3    33.3     0/0   0.0

TEAM: FG: 8/17 (47.1%), 3PT: 1/1 (100.0%), REB: 10 (2 off, 8 def), AST: 3, TO: 4
TEAM FOULS: 5 [Team_062 in BONUS]

================================================================================

================================================================================
                       2ND QUARTER - Team_062 vs Team_005                       
================================================================================

[12:00] Team_062 possession (Score: 23-23)
FOUL! Holding foul on Derrick Allen. [Team fouls: 1] No free throws, side out. (Derrick Allen: 1 personal fouls)

[11:43] Team_062 possession (Score: 23-23)
Michael Hyland attempts a 3Pt. Contested by Derrick Allen (4.4 feet, MAN). Michael Hyland misses. Rebound secured by Derrick Allen.

[11:28] Team_005 possession (Score: 23-23)
Anthony Rozier drives and kicks out. Jalen Rozier attempts a 3Pt. Contested by Kawhi Thompson (5.2 feet, MAN). JALEN ROZIER MAKES IT! Assist: Derrick Allen
Score: 23-26

[11:14] Team_062 possession (Score: 23-26)
RJ Williamson attempts a Midrange. Contested by Anthony Rozier (4.8 feet, MAN). RJ Williamson misses. Rebound secured by Jalen Rozier.

[11:04] Team_005 possession (Score: 23-26)
Derrick Allen attempts a 3Pt. Contested by Michael Hyland (5.4 feet, MAN). Derrick Allen misses. Offensive rebound by Cade Markkanen! Cade Markkanen kicks it out.

[10:49] Team_005 possession (Score: 23-26)
Cade Markkanen drives and kicks out. Derrick Allen attempts a 3Pt. Contested by RJ Williamson (4.8 feet, ZONE). DERRICK ALLEN MAKES IT! Assist: Brandon George
Score: 23-29

[10:39] Team_062 possession (Score: 23-29)
Kawhi Thompson attempts a Midrange. Contested by Jalen Rozier (5.3 feet, MAN). Kawhi Thompson misses. Offensive rebound by Kawhi Thompson! Kawhi Thompson kicks it out.

[10:24] Team_062 possession (Score: 23-29)
Kawhi Thompson makes the Layup and draws the foul on Jalen Rozier! And-1! Kawhi Thompson to the line for 1. [Team fouls: 2] (Jalen Rozier: 1 personal fouls)   FT 1/1: GOOD Kawhi Thompson makes 1/1 from the line.
Score: 26-29

[10:07] Team_005 possession (Score: 26-29)
Jalen Rozier attempts a 3Pt. Contested by Kawhi Thompson (5.6 feet, MAN). Jalen Rozier misses. Rebound secured by Kawhi Thompson.

[09:53] Team_062 possession (Score: 26-29)
Chris Bird attempts a 3Pt. Contested by Derrick Allen (4.9 feet, ZONE). CHRIS BIRD MAKES IT!
Score: 29-29

[09:42] Team_005 possession (Score: 29-29)
Derrick Allen drives to the basket... Derrick Allen loses the ball! Stripped by Jalen Reaves! TURNOVER! (live ball)

[09:29] Team_062 possession (Score: 29-29)
Michael Hyland attempts a 3Pt. Contested by Derrick Allen (4.7 feet, ZONE). Michael Hyland misses. Rebound secured by Cade Markkanen.

[09:15] Team_005 possession (Score: 29-29)
Derrick Allen attempts a 3Pt. Contested by RJ Williamson (5.3 feet, ZONE). Derrick Allen misses. Offensive rebound by Cade Markkanen! Cade Markkanen kicks it out.

[09:01] Team_005 possession (Score: 29-29)
Cade Markkanen attempts a Layup. Contested by Jalen Reaves (5.4 feet, ZONE). Cade Markkanen misses. Offensive rebound by Cade Markkanen! Cade Markkanen kicks it out.

[08:45] Team_005 possession (Score: 29-29)
Anthony Rozier attempts a Midrange. Contested by RJ Williamson (5.1 feet, MAN). ANTHONY ROZIER MAKES IT! Assist: Brandon George
Score: 29-31

[08:28] Team_062 possession (Score: 29-31)
Chris Bird attempts a 3Pt. Wide open! Brandon George is 6.1 feet away. [MAN] CHRIS BIRD MAKES IT! Assist: RJ Williamson
Score: 32-31

[08:18] Team_005 possession (Score: 32-31)
Anthony Rozier attempts a 3Pt. Contested by RJ Williamson (5.1 feet, ZONE). ANTHONY ROZIER MAKES IT! Assist: Jalen Rozier
Score: 32-34

[08:04] Team_062 possession (Score: 32-34)
Kawhi Thompson attempts a Layup. BLOCKED BY JALEN ROZIER! Ball is loose! Rebound secured by Cade Markkanen.

[07:50] Team_005 possession (Score: 32-34)
Jalen Rozier attempts a 3Pt. Contested by RJ Williamson (5.4 feet, ZONE). Jalen Rozier misses. Rebound secured by Jalen Reaves.

[07:37] Team_062 possession (Score: 32-34)
RJ Williamson attempts a 3Pt. Contested by Anthony Rozier (5.3 feet, MAN). RJ Williamson misses. Rebound secured by Jalen Rozier.

[07:20] Team_005 possession (Score: 32-34)
FOUL! Shooting foul on Kawhi Thompson. Jalen Rozier to the line for 2 free throws. [Team fouls: 1] (Kawhi Thompson: 1 personal fouls)   FT 1/2: GOOD   FT 2/2: GOOD Jalen Rozier makes 2/2 from the line.
Score: 32-36

[07:09] Team_062 possession (Score: 32-36)
Kawhi Thompson attempts a 3Pt. Contested by Derrick Allen (5.1 feet, ZONE). KAWHI THOMPSON MAKES IT! Assist: Michael Hyland
Score: 35-36

[06:55] Team_005 possession (Score: 35-36)
Jalen Rozier attempts a 3Pt. Contested by Kawhi Thompson (6.0 feet, MAN). Jalen Rozier misses. Offensive rebound by Derrick Allen! Derrick Allen kicks it out.

[06:42] Team_005 possession (Score: 35-36)
FOUL! Reach-in foul on Jalen Reaves during the drive. [Team fouls: 2] No free throws, side out. (Jalen Reaves: 1 personal fouls)

[06:32] Team_005 possession (Score: 35-36)
Anthony Rozier attempts a 3Pt. Contested by RJ Williamson (5.4 feet, ZONE). Anthony Rozier misses. Rebound secured by Kawhi Thompson.

[06:17] Team_062 possession (Score: 35-36)
RJ Williamson attempts a 3Pt. Contested by Anthony Rozier (5.5 feet, MAN). RJ Williamson misses. Offensive rebound by Kawhi Thompson! Kawhi Thompson kicks it out.

[06:03] Team_062 possession (Score: 35-36)
RJ Williamson attempts a 3Pt. Contested by Anthony Rozier (5.6 feet, MAN). RJ WILLIAMSON MAKES IT! Assist: Jalen Reaves
Score: 38-36

[05:46] Team_005 possession (Score: 38-36)
Brandon George attempts a 3Pt. Contested by RJ Williamson (5.6 feet, ZONE). Brandon George misses. Rebound secured by Jalen Reaves.

[05:31] Team_062 possession (Score: 38-36)
FOUL! Reach-in foul on Anthony Rozier during the drive. [Team fouls: 3] No free throws, side out. (Anthony Rozier: 1 personal fouls)

[05:16] Team_062 possession (Score: 38-36)
FOUL! Shooting foul on Cade Markkanen. Jalen Reaves to the line for 3 free throws. [Team fouls: 4] (Cade Markkanen: 1 personal fouls)   FT 1/3: MISS   FT 2/3: GOOD   FT 3/3: GOOD Jalen Reaves makes 2/3 from the line.
Score: 40-36

[05:04] Team_005 possession (Score: 40-36)
Brandon George attempts a 3Pt. Contested by Chris Bird (5.5 feet, MAN). BRANDON GEORGE MAKES IT! Assist: Anthony Rozier
Score: 40-39

[04:48] Team_062 possession (Score: 40-39)
Michael Hyland attempts a 3Pt. Contested by Derrick Allen (5.3 feet, ZONE). MICHAEL HYLAND MAKES IT! Assist: Kawhi Thompson
Score: 43-39

[04:31] Team_005 possession (Score: 43-39)
Cade Markkanen throws a bad pass! Stolen by Jalen Reaves! TURNOVER! (live ball)

[04:16] Team_062 possession (Score: 43-39)
Jalen Reaves attempts a Midrange. Contested by Cade Markkanen (5.2 feet, MAN). JALEN REAVES MAKES IT!
Score: 45-39

[04:05] Team_005 possession (Score: 45-39)
Brandon George attempts a Midrange. Contested by Chris Bird (5.6 feet, MAN). Brandon George misses. Rebound secured by Jalen Reaves.

[03:49] Team_062 possession (Score: 45-39)
RJ Williamson drives, Cade Markkanen stays with him. RJ Williamson attempts a Dunk. Contested by Cade Markkanen (5.0 feet, ZONE). RJ Williamson misses. Rebound secured by Jalen Rozier.

[03:32] Team_005 possession (Score: 45-39)
Cade Markkanen attempts a 3Pt. Contested by RJ Williamson (5.6 feet, ZONE). Cade Markkanen misses. Rebound secured by Kawhi Thompson.

[03:15] Team_062 possession (Score: 45-39)
RJ Williamson attempts a 3Pt. Contested by Derrick Allen (5.3 feet, ZONE). RJ Williamson misses. Offensive rebound by Jalen Reaves! Jalen Reaves kicks it out.

[03:05] Team_062 possession (Score: 45-39)
Kawhi Thompson attempts a Layup. Wide open! Jalen Rozier is 6.3 feet away. [MAN] KAWHI THOMPSON MAKES IT! Assist: Jalen Reaves
Score: 47-39

[02:50] Team_005 possession (Score: 47-39)
Anthony Rozier attempts a 3Pt. Contested by RJ Williamson (5.9 feet, ZONE). Anthony Rozier misses. Rebound secured by Kawhi Thompson.

[02:34] Team_062 possession (Score: 47-39)
Jalen Reaves attempts a 3Pt. Contested by Derrick Allen (5.8 feet, ZONE). Jalen Reaves misses. Rebound secured by Cade Markkanen.

[02:19] Team_005 possession (Score: 47-39)
Jalen Rozier attempts a Midrange. Wide open! Michael Hyland is 6.4 feet away. [ZONE] JALEN ROZIER MAKES IT!
Score: 47-41

[02:02] Team_062 possession (Score: 47-41)
Jalen Reaves drives, picks up Cade Markkanen. Help arrives from Anthony Rozier! Jalen Reaves attempts a Layup. Contested by Anthony Rozier (5.7 feet, ZONE). JALEN REAVES MAKES IT! Assist: Chris Bird
Score: 49-41

[01:45] Team_005 possession (Score: 49-41)
Cade Markkanen drives to the basket... Cade Markkanen loses the ball! Stripped by Kawhi Thompson! TURNOVER! (live ball)

[01:30] Team_062 possession (Score: 49-41)
Michael Hyland attempts a Midrange. Wide open! Jalen Rozier is 6.5 feet away. [ZONE] Michael Hyland misses. Rebound secured by Derrick Allen.

[01:17] Team_005 possession (Score: 49-41)
FOUL! Holding foul on Michael Hyland. [Team fouls: 3] No free throws, side out. (Michael Hyland: 1 personal fouls)

[01:01] Team_005 possession (Score: 49-41)
Jalen Rozier attempts a Midrange. Wide open! Chris Bird is 6.2 feet away. [ZONE] JALEN ROZIER MAKES IT! Assist: Brandon George
Score: 49-43

[00:48] Team_062 possession (Score: 49-43)
RJ Williamson attempts a 3Pt. Wide open! Anthony Rozier is 6.5 feet away. [ZONE] RJ Williamson misses. Offensive rebound by Jalen Reaves! Jalen Reaves kicks it out.

[00:34] Team_062 possession (Score: 49-43)
Jalen Reaves attempts a 3Pt. Contested by Cade Markkanen (6.0 feet, MAN). Jalen Reaves misses. Rebound secured by Cade Markkanen.

[00:20] Team_005 possession (Score: 49-43)
Brandon George drives, picks up Jalen Reaves. Help arrives from Chris Bird! Brandon George attempts a Layup. Wide open! Chris Bird is 6.9 feet away. [ZONE] BRANDON GEORGE MAKES IT! Assist: Jalen Rozier
Score: 49-45

[00:06] Team_062 possession (Score: 49-45)
RJ Williamson attempts a Midrange. Wide open! Anthony Rozier is 6.6 feet away. [MAN] RJ WILLIAMSON MAKES IT! Assist: Jalen Reaves
Score: 51-45

================================================================================
                              2ND QUARTER COMPLETE                              
================================================================================

2ND QUARTER SCORE: Team_062 28, Team_005 22

BOX SCORE:
================================================================================

Team_062
--------------------------------------------------------------------------------
Player                MIN  PTS  REB  AST  TO      FG   FG%      3P   3P%
--------------------------------------------------------------------------------
Kawhi Thompson         24    8    6    1   0   3/4    75.0     0/0   0.0
Chris Bird             24    6    0    1   0   2/2   100.0     0/0   0.0
Jalen Reaves           24    6    5    3   0   3/5    60.0     0/0   0.0
RJ Williamson          24    5    0    1   0   2/5    40.0     0/0   0.0
Michael Hyland         24    3    0    1   0   1/4    25.0     0/0   0.0

TEAM: FG: 11/20 (55.0%), 3PT: 6/11 (54.5%), REB: 11 (4 off, 7 def), AST: 7, TO: 0
TEAM FOULS: 3


Team_005
--------------------------------------------------------------------------------
Player                MIN  PTS  REB  AST  TO      FG   FG%      3P   3P%
--------------------------------------------------------------------------------
Jalen Rozier           24    9    3    2   0   4/6    66.7     0/0   0.0
Brandon George         24    5    0    3   0   2/4    50.0     0/0   0.0
Anthony Rozier         24    5    0    1   0   2/4    50.0     0/0   0.0
Derrick Allen          24    3    3    1   0   1/1   100.0     0/0   0.0
Cade Markkanen         24    0    7    0   0   0/1     0.0     0/0   0.0

TEAM: FG: 9/16 (56.2%), 3PT: 2/8 (25.0%), REB: 13 (4 off, 9 def), AST: 7, TO: 3
TEAM FOULS: 4

================================================================================

================================================================================
                       3RD QUARTER - Team_062 vs Team_005                       
================================================================================

[12:00] Team_062 possession (Score: 51-45)
Chris Bird drives and kicks out. Kawhi Thompson attempts a 3Pt. Contested by Derrick Allen (4.2 feet, ZONE). Kawhi Thompson misses. Rebound secured by Jalen Rozier.

[11:41] Team_005 possession (Score: 51-45)
Anthony Rozier attempts a Layup. Contested by Jalen Reaves (5.0 feet, ZONE). Anthony Rozier misses. Rebound secured by Jalen Reaves.

[11:31] Team_062 possession (Score: 51-45)
Chris Bird makes the Dunk and draws the foul on Cade Markkanen! And-1! Chris Bird to the line for 1. [Team fouls: 1] (Cade Markkanen: 1 personal fouls)   FT 1/1: GOOD Chris Bird makes 1/1 from the line.
Score: 54-45

[11:17] Team_005 possession (Score: 54-45)
Jalen Rozier attempts a Layup. Contested by Kawhi Thompson (5.2 feet, MAN). Jalen Rozier misses. Rebound secured by Michael Hyland.

[10:57] Team_062 possession (Score: 54-45)
RJ Williamson drives, Cade Markkanen stays with him. RJ Williamson attempts a Dunk. Contested by Cade Markkanen (3.0 feet, ZONE). RJ WILLIAMSON MAKES IT! Assist: Michael Hyland
Score: 56-45

[10:41] Team_005 possession (Score: 56-45)
Derrick Allen attempts a Midrange. Contested by Michael Hyland (5.0 feet, MAN). Derrick Allen misses. Offensive rebound by Cade Markkanen! Cade Markkanen's putback is no good. Rebound secured by Jalen Reaves.

[10:26] Team_062 possession (Score: 56-45)
Kawhi Thompson throws a bad pass out of bounds! TURNOVER! (dead ball)

[10:09] Team_005 possession (Score: 56-45)
Derrick Allen attempts a Midrange. Contested by RJ Williamson (4.8 feet, ZONE). Derrick Allen misses. FOUL! Loose ball foul on Michael Hyland during the rebound battle. [Team fouls: 1] No free throws, side out. (Michael Hyland: 1 personal fouls)

[09:55] Team_005 possession (Score: 56-45)
Derrick Allen drives and kicks out. Derrick Allen attempts a 3Pt. Contested by RJ Williamson (4.4 feet, ZONE). DERRICK ALLEN MAKES IT! Assist: Brandon George
Score: 56-48

[09:37] Team_062 possession (Score: 56-48)
RJ Williamson attempts a 3Pt. Contested by Anthony Rozier (4.3 feet, MAN). RJ Williamson misses. Rebound secured by Derrick Allen.

[09:23] Team_005 possession (Score: 56-48)
Brandon George drives, picks up Chris Bird. Help arrives from Michael Hyland! Brandon George attempts a Layup. Contested by Michael Hyland (4.4 feet, MAN). Brandon George misses. Offensive rebound by Jalen Rozier! Jalen Rozier kicks it out.

[09:12] Team_005 possession (Score: 56-48)
Anthony Rozier drives, Jalen Reaves stays with him. Anthony Rozier attempts a Layup. Contested by Jalen Reaves (5.0 feet, ZONE). ANTHONY ROZIER MAKES IT!
Score: 56-50

[08:52] Team_062 possession (Score: 56-50)
Chris Bird attempts a Midrange. Contested by Derrick Allen (4.4 feet, ZONE). CHRIS BIRD MAKES IT!
Score: 58-50

[08:36] Team_005 possession (Score: 58-50)
Brandon George attempts a 3Pt. Contested by Michael Hyland (4.8 feet, ZONE). BRANDON GEORGE MAKES IT! Assist: Cade Markkanen
Score: 58-53

[08:23] Team_062 possession (Score: 58-53)
Jalen Reaves attempts a Midrange. Contested by Derrick Allen (4.4 feet, ZONE). Jalen Reaves misses. Rebound secured by Jalen Rozier.

[08:12] Team_005 possession (Score: 58-53)
Jalen Rozier drives, Jalen Reaves stays with him. Jalen Rozier attempts a Layup. Contested by Jalen Reaves (5.3 feet, ZONE). JALEN ROZIER MAKES IT! Assist: Anthony Rozier
Score: 58-55

[07:57] Team_062 possession (Score: 58-55)
Michael Hyland attempts a 3Pt. Contested by Derrick Allen (4.2 feet, ZONE). MICHAEL HYLAND MAKES IT! Assist: RJ Williamson
Score: 61-55

[07:44] Team_005 possession (Score: 61-55)
Derrick Allen attempts a Midrange. Contested by Michael Hyland (5.0 feet, ZONE). Derrick Allen misses. Offensive rebound by Jalen Rozier! Jalen Rozier kicks it out.

[07:29] Team_005 possession (Score: 61-55)
FOUL! Holding foul on Jalen Reaves. [Team fouls: 2] No free throws, side out. (Jalen Reaves: 1 personal fouls)

[07:18] Team_005 possession (Score: 61-55)
Jalen Rozier attempts a Midrange. Contested by Jalen Reaves (5.3 feet, ZONE). Jalen Rozier misses. Rebound secured by Michael Hyland.

[07:04] Team_062 possession (Score: 61-55)
FOUL! Shooting foul on Anthony Rozier. Jalen Reaves to the line for 2 free throws. [Team fouls: 2] (Anthony Rozier: 1 personal fouls)   FT 1/2: GOOD   FT 2/2: GOOD Jalen Reaves makes 2/2 from the line.
Score: 63-55

[06:53] Team_005 possession (Score: 63-55)
Cade Markkanen attempts a Midrange. Contested by RJ Williamson (4.2 feet, ZONE). Cade Markkanen misses. Rebound secured by Jalen Reaves.

[06:37] Team_062 possession (Score: 63-55)
Jalen Reaves attempts a 3Pt. Contested by Derrick Allen (4.4 feet, ZONE). Jalen Reaves misses. Rebound secured by Jalen Rozier.

[06:22] Team_005 possession (Score: 63-55)
Cade Markkanen attempts a 3Pt. Contested by RJ Williamson (4.2 feet, ZONE). Cade Markkanen misses. Rebound secured by Kawhi Thompson.

[06:04] Team_062 possession (Score: 63-55)
Michael Hyland attempts a Layup. BLOCKED BY CADE MARKKANEN! Ball is loose! Rebound secured by Cade Markkanen.

[05:55] Team_005 possession (Score: 63-55)
Brandon George attempts a Midrange. Contested by Chris Bird (4.4 feet, MAN). Brandon George misses. Rebound secured by Kawhi Thompson.

[05:41] Team_062 possession (Score: 63-55)
RJ Williamson throws a bad pass out of bounds! TURNOVER! (dead ball)

[05:26] Team_005 possession (Score: 63-55)
Anthony Rozier attempts a 3Pt. Contested by RJ Williamson (4.4 feet, MAN). Anthony Rozier misses. Rebound secured by Jalen Reaves.

[05:11] Team_062 possession (Score: 63-55)
Michael Hyland attempts a Layup. BLOCKED BY CADE MARKKANEN! Ball goes out off Cade Markkanen. Michael Hyland's ball!

[05:01] Team_062 possession (Score: 63-55)
RJ Williamson attempts a 3Pt. Contested by Anthony Rozier (4.4 feet, MAN). RJ Williamson misses. Rebound secured by Derrick Allen.

[04:48] Team_005 possession (Score: 63-55)
Derrick Allen drives and kicks out. Cade Markkanen attempts a Midrange. Contested by Jalen Reaves (5.0 feet, MAN). CADE MARKKANEN MAKES IT!
Score: 63-57

[04:32] Team_062 possession (Score: 63-57)
RJ Williamson attempts a 3Pt. Contested by Derrick Allen (4.0 feet, ZONE). RJ Williamson misses. Rebound secured by Derrick Allen.

[04:14] Team_005 possession (Score: 63-57)
Derrick Allen attempts a 3Pt. Contested by Michael Hyland (5.1 feet, MAN). Derrick Allen misses. Rebound secured by Kawhi Thompson.

[04:03] Team_062 possession (Score: 63-57)
RJ Williamson drives and kicks out. RJ Williamson attempts a 3Pt. Contested by Anthony Rozier (4.7 feet, MAN). RJ Williamson misses. Offensive rebound by Kawhi Thompson! Kawhi Thompson kicks it out.

[03:47] Team_062 possession (Score: 63-57)
Michael Hyland attempts a 3Pt. Contested by Derrick Allen (4.3 feet, MAN). Michael Hyland misses. Rebound secured by Derrick Allen.

[03:29] Team_005 possession (Score: 63-57)
Jalen Rozier attempts a 3Pt. Contested by RJ Williamson (4.8 feet, ZONE). Jalen Rozier misses. Offensive rebound by Jalen Rozier! Jalen Rozier kicks it out.

[03:12] Team_005 possession (Score: 63-57)
Brandon George attempts a Midrange. Contested by Michael Hyland (5.0 feet, ZONE). BRANDON GEORGE MAKES IT! Assist: Derrick Allen
Score: 63-59

[02:58] Team_062 possession (Score: 63-59)
Chris Bird throws a bad pass! Stolen by Brandon George! TURNOVER! (live ball)

[02:44] Team_005 possession (Score: 63-59)
Jalen Rozier attempts a Layup. Contested by Jalen Reaves (5.5 feet, ZONE). JALEN ROZIER MAKES IT! Assist: Brandon George
Score: 63-61

[02:28] Team_062 possession (Score: 63-61)
Kawhi Thompson attempts a 3Pt. Contested by Derrick Allen (4.4 feet, ZONE). Kawhi Thompson misses. Rebound secured by Cade Markkanen.

[02:19] Team_005 possession (Score: 63-61)
Jalen Rozier attempts a Layup. Contested by Kawhi Thompson (5.4 feet, MAN). JALEN ROZIER MAKES IT! Assist: Anthony Rozier
Score: 63-63

[02:08] Team_062 possession (Score: 63-63)
Michael Hyland attempts a 3Pt. Contested by Derrick Allen (4.4 feet, MAN). Michael Hyland misses. Offensive rebound by Jalen Reaves! Jalen Reaves kicks it out.

[01:49] Team_062 possession (Score: 63-63)
Kawhi Thompson attempts a Midrange. Contested by Jalen Rozier (5.2 feet, MAN). KAWHI THOMPSON MAKES IT! Assist: Michael Hyland
Score: 65-63

[01:33] Team_005 possession (Score: 65-63)
Derrick Allen attempts a 3Pt. Contested by RJ Williamson (5.1 feet, ZONE). Derrick Allen misses. Rebound secured by Kawhi Thompson.

[01:21] Team_062 possession (Score: 65-63)
Jalen Reaves attempts a Layup. Contested by Jalen Rozier (5.4 feet, ZONE). Jalen Reaves misses. Rebound secured by Derrick Allen.

[01:03] Team_005 possession (Score: 65-63)
Derrick Allen attempts a Layup. Contested by Jalen Reaves (5.7 feet, ZONE). Derrick Allen misses. FOUL! Loose ball foul on Michael Hyland during the rebound battle. [Team fouls: 3] No free throws, side out. (Michael Hyland: 2 personal fouls)

[00:49] Team_005 possession (Score: 65-63)
Derrick Allen drives, Jalen Reaves stays with him. Derrick Allen attempts a Dunk. Contested by Jalen Reaves (5.7 feet, ZONE). DERRICK ALLEN MAKES IT! Assist: Brandon George
Score: 65-65

[00:34] Team_062 possession (Score: 65-65)
Jalen Reaves drives and kicks out. Jalen Reaves attempts a 3Pt. Contested by Derrick Allen (4.7 feet, ZONE). Jalen Reaves misses. Rebound secured by Cade Markkanen.

[00:20] Team_005 possession (Score: 65-65)
Jalen Rozier drives to the basket... Jalen Rozier throws a bad pass out of bounds! TURNOVER! (dead ball)

[00:20] Substitution (Team_062): Chris Bird OUT → Paolo McCollum IN (stamina_rule2)

[00:20] Substitution (Team_062): RJ Williamson OUT → Tony LaVine IN (stamina_rule2)

[00:20] Substitution (Team_062): Michael Hyland OUT → Paul Poole IN (stamina_rule2)

[00:20] Substitution (Team_062): Kawhi Thompson OUT → RJ Wall IN (stamina_rule2)

[00:20] Substitution (Team_062): Jalen Reaves OUT → Devin Young IN (stamina_rule2)

[00:20] Substitution (Team_005): Brandon George OUT → Blake O'Neal IN (stamina_rule2)

[00:20] Substitution (Team_005): Anthony Rozier OUT → Draymond Smith IN (stamina_rule2)

[00:20] Substitution (Team_005): Derrick Allen OUT → Lauri Wade IN (stamina_rule2)

[00:20] Substitution (Team_005): Jalen Rozier OUT → Isaiah Durant IN (stamina_rule2)

[00:20] Substitution (Team_005): Cade Markkanen OUT → Zion Parker IN (stamina_rule2)

[00:05] Team_062 possession (Score: 65-65)
FOUL! Holding foul on Lauri Wade. [Team fouls: 3] No free throws, side out. (Lauri Wade: 1 personal fouls)

================================================================================
                              3RD QUARTER COMPLETE                              
================================================================================

3RD QUARTER SCORE: Team_062 14, Team_005 20

BOX SCORE:
================================================================================

Team_062
--------------------------------------------------------------------------------
Player                MIN  PTS  REB  AST  TO      FG   FG%      3P   3P%
--------------------------------------------------------------------------------
Chris Bird             36    5    0    0   0   2/3    66.7     0/0   0.0
Michael Hyland         36    3    2    2   0   1/3    33.3     0/0   0.0
Jalen Reaves           36    2    5    0   0   1/5    20.0     0/0   0.0
RJ Williamson          36    2    0    1   0   1/4    25.0     0/0   0.0
Kawhi Thompson         36    2    5    0   0   1/2    50.0     0/0   0.0

TEAM: FG: 6/17 (35.3%), 3PT: 1/7 (14.3%), REB: 11 (2 off, 9 def), AST: 3, TO: 3
TEAM FOULS: 3


Team_005
--------------------------------------------------------------------------------
Player                MIN  PTS  REB  AST  TO      FG   FG%      3P   3P%
--------------------------------------------------------------------------------
Jalen Rozier           36    6    7    0   0   3/5    60.0     0/0   0.0
Derrick Allen          36    5    5    1   0   2/5    40.0     0/0   0.0
Brandon George         36    5    0    3   0   2/3    66.7     0/0   0.0
Anthony Rozier         36    2    0    2   0   1/3    33.3     0/0   0.0
Cade Markkanen         36    2    4    1   0   1/3    33.3     0/0   0.0

TEAM: FG: 9/19 (47.4%), 3PT: 1/5 (20.0%), REB: 17 (6 off, 11 def), AST: 7, TO: 1
TEAM FOULS: 3

================================================================================

================================================================================
                       4TH QUARTER - Team_062 vs Team_005                       
================================================================================

[12:00] Team_062 possession (Score: 65-65)
Jalen Reaves attempts a 3Pt. Contested by Cade Markkanen (3.9 feet, MAN). Jalen Reaves misses. Offensive rebound by Kawhi Thompson! Kawhi Thompson kicks it out.

[11:45] Team_062 possession (Score: 65-65)
Jalen Reaves attempts a Midrange. Contested by Cade Markkanen (3.9 feet, MAN). JALEN REAVES MAKES IT! Assist: RJ Williamson
Score: 67-65

[11:30] Team_005 possession (Score: 67-65)
Derrick Allen attempts a Midrange. Contested by Michael Hyland (5.3 feet, MAN). Derrick Allen misses. Rebound secured by Jalen Reaves.

[11:13] Team_062 possession (Score: 67-65)
Jalen Reaves attempts a Midrange. Contested by Cade Markkanen (4.0 feet, MAN). Jalen Reaves misses. Rebound secured by Derrick Allen.

[10:57] Team_005 possession (Score: 67-65)
Cade Markkanen attempts a Layup. Contested by Jalen Reaves (5.1 feet, ZONE). Cade Markkanen misses. Rebound secured by Jalen Reaves.

[10:38] Team_062 possession (Score: 67-65)
RJ Williamson attempts a 3Pt. Contested by Anthony Rozier (4.8 feet, MAN). RJ Williamson misses. Rebound secured by Derrick Allen.

[10:21] Team_005 possession (Score: 67-65)
Brandon George drives and kicks out. Brandon George attempts a 3Pt. Contested by Chris Bird (4.6 feet, MAN). Brandon George misses. Rebound secured by Kawhi Thompson.

[10:12] Team_062 possession (Score: 67-65)
FOUL! Shooting foul on Cade Markkanen. Jalen Reaves to the line for 2 free throws. [Team fouls: 1] (Cade Markkanen: 1 personal fouls)   FT 1/2: GOOD   FT 2/2: GOOD Jalen Reaves makes 2/2 from the line.
Score: 69-65

[10:02] Team_005 possession (Score: 69-65)
Jalen Rozier attempts a 3Pt. Contested by Kawhi Thompson (5.6 feet, MAN). Jalen Rozier misses. Rebound secured by Jalen Reaves.

[09:49] Team_062 possession (Score: 69-65)
RJ Williamson attempts a Midrange. Contested by Anthony Rozier (4.9 feet, MAN). RJ Williamson misses. Rebound secured by Jalen Rozier.

[09:37] Team_005 possession (Score: 69-65)
Derrick Allen attempts a 3Pt. Contested by Michael Hyland (5.5 feet, MAN). DERRICK ALLEN MAKES IT! Assist: Jalen Rozier
Score: 69-68

[09:27] Team_062 possession (Score: 69-68)
Chris Bird attempts a 3Pt. Contested by Brandon George (5.9 feet, MAN). Chris Bird misses. Rebound secured by Jalen Rozier.

[09:12] Team_005 possession (Score: 69-68)
Anthony Rozier attempts a 3Pt. Contested by RJ Williamson (5.0 feet, ZONE). ANTHONY ROZIER MAKES IT! Assist: Jalen Rozier
Score: 69-71

[09:00] Team_062 possession (Score: 69-71)
Chris Bird makes the Midrange and draws the foul on Anthony Rozier! And-1! Chris Bird to the line for 1. [Team fouls: 2] (Anthony Rozier: 1 personal fouls)   FT 1/1: MISS Chris Bird makes 0/1 from the line. Rebound secured by Derrick Allen.
Score: 71-71

[08:46] Team_005 possession (Score: 71-71)
Jalen Rozier loses the ball! Stripped by Kawhi Thompson! TURNOVER! (live ball)

[08:36] Team_062 possession (Score: 71-71)
Michael Hyland attempts a Midrange. Contested by Derrick Allen (4.8 feet, MAN). Michael Hyland misses. Rebound secured by Derrick Allen.

[08:22] Team_005 possession (Score: 71-71)
Cade Markkanen attempts a 3Pt. Contested by RJ Williamson (4.9 feet, ZONE). CADE MARKKANEN MAKES IT! Assist: Anthony Rozier
Score: 71-74

[08:08] Team_062 possession (Score: 71-74)
Jalen Reaves attempts a Layup. Contested by Cade Markkanen (4.5 feet, ZONE). Jalen Reaves misses. Rebound secured by Derrick Allen.

[07:55] Team_005 possession (Score: 71-74)
Jalen Rozier attempts a 3Pt. Contested by RJ Williamson (5.4 feet, ZONE). Jalen Rozier misses. Offensive rebound by Cade Markkanen! Cade Markkanen kicks it out.

[07:45] Team_005 possession (Score: 71-74)
FOUL! Holding foul on Chris Bird. [Team fouls: 1] No free throws, side out. (Chris Bird: 1 personal fouls)

[07:30] Team_005 possession (Score: 71-74)
Anthony Rozier attempts a Layup. Contested by Jalen Reaves (5.8 feet, ZONE). ANTHONY ROZIER MAKES IT!
Score: 71-76

[07:15] Team_062 possession (Score: 71-76)
Kawhi Thompson attempts a Layup. BLOCKED BY JALEN ROZIER! Ball is loose! Rebound secured by Cade Markkanen.

[07:03] Team_005 possession (Score: 71-76)
Anthony Rozier attempts a 3Pt. Contested by RJ Williamson (5.3 feet, ZONE). ANTHONY ROZIER MAKES IT! Assist: Brandon George
Score: 71-79

[06:51] Team_062 possession (Score: 71-79)
Chris Bird attempts a 3Pt. Contested by Derrick Allen (5.2 feet, ZONE). Chris Bird misses. Rebound secured by Derrick Allen.

[06:37] Team_005 possession (Score: 71-79)
Anthony Rozier attempts a 3Pt. Contested by RJ Williamson (5.3 feet, MAN). ANTHONY ROZIER MAKES IT! Assist: Cade Markkanen
Score: 71-82

[06:23] Team_062 possession (Score: 71-82)
Jalen Reaves drives, Cade Markkanen stays with him. Jalen Reaves attempts a Dunk. Contested by Cade Markkanen (4.8 feet, MAN). JALEN REAVES MAKES IT! Assist: Michael Hyland
Score: 73-82

[06:10] Team_005 possession (Score: 73-82)
Anthony Rozier attempts a Layup. BLOCKED BY JALEN REAVES! Ball is loose! Rebound secured by Kawhi Thompson.

[05:55] Team_062 possession (Score: 73-82)
Michael Hyland attempts a Layup. Contested by Derrick Allen (5.1 feet, MAN). Michael Hyland misses. Rebound secured by Derrick Allen.

[05:43] Team_005 possession (Score: 73-82)
Anthony Rozier attempts a 3Pt. Contested by RJ Williamson (5.5 feet, ZONE). Anthony Rozier misses. Rebound secured by Kawhi Thompson.

[05:25] Team_062 possession (Score: 73-82)
Chris Bird attempts a Midrange. Contested by Cade Markkanen (5.0 feet, ZONE). CHRIS BIRD MAKES IT!
Score: 75-82

[05:10] Team_005 possession (Score: 75-82)
Cade Markkanen makes the Dunk and draws the foul on Jalen Reaves! And-1! Cade Markkanen to the line for 1. [Team fouls: 2] (Jalen Reaves: 1 personal fouls)   FT 1/1: MISS Cade Markkanen makes 0/1 from the line. Rebound secured by Jalen Reaves.
Score: 75-84

[04:56] Team_062 possession (Score: 75-84)
Michael Hyland attempts a Midrange. Contested by Derrick Allen (5.3 feet, MAN). Michael Hyland misses. Offensive rebound by Jalen Reaves! Jalen Reaves kicks it out.

[04:38] Team_062 possession (Score: 75-84)
Michael Hyland drives and kicks out. RJ Williamson attempts a Midrange. Wide open! Anthony Rozier is 6.2 feet away. [ZONE] RJ Williamson misses. Offensive rebound by Kawhi Thompson! Kawhi Thompson kicks it out.

[04:25] Team_062 possession (Score: 75-84)
FOUL! Shooting foul on Jalen Rozier. Kawhi Thompson to the line for 2 free throws. [Team fouls: 3] (Jalen Rozier: 1 personal fouls)   FT 1/2: GOOD   FT 2/2: GOOD Kawhi Thompson makes 2/2 from the line.
Score: 77-84

[04:10] Team_005 possession (Score: 77-84)
Brandon George attempts a 3Pt. Contested by Chris Bird (5.6 feet, MAN). Brandon George misses. Rebound secured by Kawhi Thompson.

[03:54] Team_062 possession (Score: 77-84)
RJ Williamson attempts a 3Pt. Contested by Anthony Rozier (5.9 feet, MAN). RJ Williamson misses. Rebound secured by Jalen Rozier.

[03:40] Team_005 possession (Score: 77-84)
Derrick Allen attempts a Midrange. Wide open! Michael Hyland is 6.2 feet away. [ZONE] DERRICK ALLEN MAKES IT! Assist: Anthony Rozier
Score: 77-86

[03:22] Team_062 possession (Score: 77-86)
Chris Bird attempts a 3Pt. Contested by Derrick Allen (5.6 feet, ZONE). Chris Bird misses. Rebound secured by Jalen Rozier.

[03:06] Team_005 possession (Score: 77-86)
Anthony Rozier attempts a 3Pt. Contested by RJ Williamson (5.8 feet, ZONE). Anthony Rozier misses. FOUL! Loose ball foul on Michael Hyland during the rebound battle. [Team fouls: 3] No free throws, side out. (Michael Hyland: 1 personal fouls)

[02:53] Team_005 possession (Score: 77-86)
Cade Markkanen attempts a 3Pt. Wide open! Jalen Reaves is 6.2 feet away. [MAN] Cade Markkanen misses. Rebound secured by Jalen Reaves.

[02:42] Team_062 possession (Score: 77-86)
RJ Williamson makes the Layup and draws the foul on Cade Markkanen! And-1! RJ Williamson to the line for 1. [Team fouls: 4] (Cade Markkanen: 2 personal fouls)   FT 1/1: GOOD RJ Williamson makes 1/1 from the line.
Score: 80-86

[02:31] Team_005 possession (Score: 80-86)
Cade Markkanen attempts a Midrange. Contested by Michael Hyland (5.9 feet, ZONE). Cade Markkanen misses. Rebound secured by Kawhi Thompson.

[02:16] Team_062 possession (Score: 80-86)
Michael Hyland attempts a 3Pt. Contested by Derrick Allen (5.6 feet, ZONE). Michael Hyland misses. Rebound secured by Derrick Allen.

[02:02] Team_005 possession (Score: 80-86)
Anthony Rozier attempts a 3Pt. Contested by RJ Williamson (6.0 feet, ZONE). Anthony Rozier misses. Rebound secured by Kawhi Thompson.

[01:48] Team_062 possession (Score: 80-86)
Kawhi Thompson drives and kicks out. Michael Hyland attempts a Midrange. Wide open! Derrick Allen is 6.0 feet away. [MAN] Michael Hyland misses. Offensive rebound by Kawhi Thompson! Kawhi Thompson kicks it out.

[01:32] Team_062 possession (Score: 80-86)
Michael Hyland attempts a 3Pt. Contested by Derrick Allen (5.7 feet, MAN). Michael Hyland misses. Rebound secured by Derrick Allen.

[01:13] Team_005 possession (Score: 80-86)
Derrick Allen attempts a 3Pt. Wide open! Michael Hyland is 6.6 feet away. [MAN] Derrick Allen misses. Rebound secured by Jalen Reaves.

[01:00] Team_062 possession (Score: 80-86)
Jalen Reaves drives to the basket... Jalen Reaves loses the ball! Stripped by Cade Markkanen! TURNOVER! (live ball)

[00:41] Team_005 possession (Score: 80-86)
Jalen Rozier attempts a Midrange. Wide open! Kawhi Thompson is 6.7 feet away. [MAN] Jalen Rozier misses. Rebound secured by Jalen Reaves.

[00:31] Team_062 possession (Score: 80-86)
FOUL! Reach-in foul on Cade Markkanen during the drive. [IN THE BONUS! 5 team fouls] RJ Williamson to the line for 2 free throws. (Cade Markkanen: 3 personal fouls)   FT 1/2: GOOD   FT 2/2: GOOD RJ Williamson makes 2/2 from the line.
Score: 82-86

[00:17] Team_005 possession (Score: 82-86)
Jalen Rozier attempts a Midrange. Wide open! Kawhi Thompson is 6.8 feet away. [ZONE] JALEN ROZIER MAKES IT! Assist: Brandon George
Score: 82-88

[00:04] Team_062 possession (Score: 82-88)
Chris Bird loses the ball! Stripped by Brandon George! TURNOVER! (live ball)

================================================================================
                              4TH QUARTER COMPLETE                              
================================================================================

4TH QUARTER SCORE: Team_062 17, Team_005 23

BOX SCORE:
================================================================================

Team_062
--------------------------------------------------------------------------------
Player                MIN  PTS  REB  AST  TO      FG   FG%      3P   3P%
--------------------------------------------------------------------------------
Jalen Reaves           48    6    8    0   0   3/5    60.0     0/0   0.0
RJ Williamson          48    5    0    1   0   2/5    40.0     0/0   0.0
Kawhi Thompson         48    2    9    0   0   1/2    50.0     0/0   0.0
Chris Bird             48    2    0    0   0   1/5    20.0     0/0   0.0
Michael Hyland         48    0    0    1   0   0/4     0.0     0/0   0.0

TEAM: FG: 7/21 (33.3%), 3PT: 0/7 (0.0%), REB: 17 (4 off, 13 def), AST: 2, TO: 2
TEAM FOULS: 3


Team_005
--------------------------------------------------------------------------------
Player                MIN  PTS  REB  AST  TO      FG   FG%      3P   3P%
--------------------------------------------------------------------------------
Anthony Rozier         48   11    0    2   0   4/7    57.1     0/0   0.0
Derrick Allen          48    5    9    0   0   2/4    50.0     0/0   0.0
Cade Markkanen         48    3    3    1   0   1/5    20.0     0/0   0.0
Jalen Rozier           48    2    4    2   0   1/3    33.3     0/0   0.0
Brandon George         48    0    0    2   0   0/2     0.0     0/0   0.0

TEAM: FG: 8/21 (38.1%), 3PT: 5/11 (45.5%), REB: 16 (2 off, 14 def), AST: 7, TO: 1
TEAM FOULS: 5 [Team_062 in BONUS]

================================================================================

================================================================================
                               FULL GAME COMPLETE                               
================================================================================

FINAL SCORE: Team_062 82, Team_005 88

SCORING BY QUARTER:
--------------------------------------------------------------------------------
Team                     Q1     Q2     Q3     Q4    FINAL
--------------------------------------------------------------------------------
Team_062                 23     28     14     17       82
Team_005                 23     22     20     23       88
--------------------------------------------------------------------------------

FULL GAME BOX SCORE:
================================================================================

Team_062
--------------------------------------------------------------------------------
Player                MIN  PTS  REB  AST  TO      FG   FG%      3P   3P%      FT STL BLK
--------------------------------------------------------------------------------
Chris Bird             48   15    0    1   3   6/12   50.0   2/5    40.0   1/2     0   0
RJ Williamson          48   18    0    4   2   6/17   35.3   1/9    11.1   4/4     0   0
Michael Hyland         48    9    2    5   1   3/16   18.8   3/11   27.3   0/0     0   0
Kawhi Thompson         48   18   25    2   1   9/13   69.2   1/2    50.0   3/3     2   0
Jalen Reaves           48   20   25    4   0   9/19   47.4   2/5    40.0   7/8     3   1
Paolo McCollum          0    0    0    0   0   0/0     0.0   0/0     0.0   0/0     0   0
Tony LaVine             0    0    0    0   0   0/0     0.0   0/0     0.0   0/0     0   0
Paul Poole              0    0    0    0   0   0/0     0.0   0/0     0.0   0/0     0   0
RJ Wall                 0    0    0    0   0   0/0     0.0   0/0     0.0   0/0     0   0
Devin Young             0    0    0    0   0   0/0     0.0   0/0     0.0   0/0     0   0

TEAM: FG: 33/77 (42.9%), 3PT: 9/32 (28.1%), REB: 53 (15 off, 38 def), AST: 16, TO: 7


Team_005
--------------------------------------------------------------------------------
Player                MIN  PTS  REB  AST  TO      FG   FG%      3P   3P%      FT STL BLK
--------------------------------------------------------------------------------
Brandon George         48   12    0    8   4   6/13   46.2   2/4    50.0   4/7     2   0
Anthony Rozier         48   20    0    7   1   9/16   56.2   4/9    44.4   0/0     0   1
Derrick Allen          48   21   21    2   1   8/15   53.3   2/5    40.0   1/1     0   0
Jalen Rozier           48   22   15    5   1   9/15   60.0   0/3     0.0   3/3     0   2
Cade Markkanen         48    7   21    2   2   2/13   15.4   1/4    25.0   0/2     2   4
Blake O'Neal            0    0    0    0   0   0/0     0.0   0/0     0.0   0/0     0   0
Draymond Smith          0    0    0    0   0   0/0     0.0   0/0     0.0   0/0     0   0
Lauri Wade              0    0    0    0   0   0/0     0.0   0/0     0.0   0/0     0   0
Isaiah Durant           0    0    0    0   0   0/0     0.0   0/0     0.0   0/0     0   0
Zion Parker             0    0    0    0   0   0/0     0.0   0/0     0.0   0/0     0   0

TEAM: FG: 34/73 (46.6%), 3PT: 9/25 (36.0%), REB: 56 (14 off, 42 def), AST: 24, TO: 9

================================================================================
