================================================================================
                        FULL GAME - Team_019 vs Team_004                        
================================================================================

================================================================================
                       1ST QUARTER - Team_019 vs Team_004                       
================================================================================

[12:00] Team_019 possession (Score: 0-0)
Rudy Giddey attempts a Midrange. Contested by Michael Curry (5.2 feet, MAN). Rudy Giddey misses. Rebound secured by Draymond Fox.

[11:48] Team_004 possession (Score: 0-0)
Anthony Lillard drives to the basket... Anthony Lillard loses the ball! Stripped by DeMar James! TURNOVER! (live ball)

[11:34] Team_019 possession (Score: 0-0)
Tobias Hyland attempts a Midrange. Contested by Draymond Fox (4.2 feet, MAN). Tobias Hyland misses. Offensive rebound by D'Angelo Randle! D'Angelo Randle puts it back in!
Score: 2-0

[11:22] Team_004 possession (Score: 2-0)
FOUL! Reach-in foul on Brandon James during the drive. [Team fouls: 1] No free throws, side out. (Brandon James: 1 personal fouls)

[11:02] Team_004 possession (Score: 2-0)
Jabari Wade loses the ball! Stripped by Brandon James! TURNOVER! (live ball)

[10:48] Team_019 possession (Score: 2-0)
FOUL! Reach-in foul on Draymond Fox during the drive. [Team fouls: 1] No free throws, side out. (Draymond Fox: 1 personal fouls)

[10:30] Team_019 possession (Score: 2-0)
Rudy Giddey attempts a 3Pt. Contested by Michael Curry (5.2 feet, MAN). RUDY GIDDEY MAKES IT! Assist: Tobias Hyland
Score: 5-0

[10:19] Team_004 possession (Score: 5-0)
Anthony Lillard attempts a Midrange. Contested by DeMar James (4.6 feet, MAN). ANTHONY LILLARD MAKES IT! Assist: Jabari Wade
Score: 5-2

[10:06] Team_019 possession (Score: 5-2)
Rudy Giddey attempts a 3Pt. Contested by Michael Curry (5.2 feet, MAN). Rudy Giddey misses. Rebound secured by Dwyane Irving.

[09:49] Team_004 possession (Score: 5-2)
Michael Curry attempts a Midrange. Contested by Tobias Hyland (5.8 feet, ZONE). Michael Curry misses. Offensive rebound by Anthony Lillard! Anthony Lillard kicks it out.

[09:36] Team_004 possession (Score: 5-2)
Jabari Wade attempts a 3Pt. Contested by D'Angelo Randle (4.3 feet, ZONE). JABARI WADE MAKES IT! Assist: Dwyane Irving
Score: 5-5

[09:25] Team_019 possession (Score: 5-5)
Tobias Hyland attempts a 3Pt. Contested by Draymond Fox (4.2 feet, MAN). Tobias Hyland misses. FOUL! Loose ball foul on Dwyane Irving during the rebound battle. [Team fouls: 2] No free throws, side out. (Dwyane Irving: 1 personal fouls)

[09:08] Team_019 possession (Score: 5-5)
Brandon James attempts a Layup. Contested by Anthony Lillard (4.1 feet, ZONE). Brandon James misses. Rebound secured by Dwyane Irving.

[08:56] Team_004 possession (Score: 5-5)
Jabari Wade attempts a 3Pt. Contested by D'Angelo Randle (4.3 feet, ZONE). Jabari Wade misses. Rebound secured by Tobias Hyland.

[08:42] Team_019 possession (Score: 5-5)
D'Angelo Randle attempts a 3Pt. Contested by Dwyane Irving (3.8 feet, MAN). D'Angelo Randle misses. Rebound secured by Draymond Fox.

[08:25] Team_004 possession (Score: 5-5)
Michael Curry attempts a 3Pt. Contested by D'Angelo Randle (3.7 feet, ZONE). MICHAEL CURRY MAKES IT!
Score: 5-8

[08:10] Team_019 possession (Score: 5-8)
Rudy Giddey attempts a 3Pt. Contested by Michael Curry (5.2 feet, ZONE). Rudy Giddey misses. Offensive rebound by D'Angelo Randle! D'Angelo Randle puts it back in!
Score: 7-8

[07:54] Team_004 possession (Score: 7-8)
Michael Curry attempts a Layup. Contested by DeMar James (4.4 feet, ZONE). Michael Curry misses. Rebound secured by DeMar James.

[07:38] Team_019 possession (Score: 7-8)
Tobias Hyland attempts a Midrange. Contested by Draymond Fox (4.2 feet, MAN). Tobias Hyland misses. Rebound secured by Dwyane Irving.

[07:22] Team_004 possession (Score: 7-8)
Anthony Lillard drives and kicks out. Dwyane Irving attempts a Midrange. Contested by Tobias Hyland (5.6 feet, ZONE). DWYANE IRVING MAKES IT!
Score: 7-10

[07:08] Team_019 possession (Score: 7-10)
D'Angelo Randle drives and kicks out. D'Angelo Randle attempts a 3Pt. Contested by Michael Curry (5.0 feet, ZONE). D'Angelo Randle misses. Rebound secured by Draymond Fox.

[06:53] Team_004 possession (Score: 7-10)
Jabari Wade drives to the basket... Jabari Wade loses the ball! Stripped by DeMar James! TURNOVER! (live ball)

[06:40] Team_019 possession (Score: 7-10)
Brandon James attempts a 3Pt. Contested by Jabari Wade (4.7 feet, MAN). BRANDON JAMES MAKES IT! Assist: DeMar James
Score: 10-10

[06:29] Team_004 possession (Score: 10-10)
Jabari Wade drives, picks up Brandon James. Help arrives from D'Angelo Randle! Jabari Wade attempts a Layup. Contested by D'Angelo Randle (5.8 feet, MAN). JABARI WADE MAKES IT! Assist: Michael Curry
Score: 10-12

[06:16] Team_019 possession (Score: 10-12)
Brandon James attempts a 3Pt. Contested by Jabari Wade (4.7 feet, MAN). Brandon James misses. Offensive rebound by DeMar James! DeMar James's putback is no good. Rebound secured by Dwyane Irving.

[06:03] Team_004 possession (Score: 10-12)
Anthony Lillard attempts a Midrange. Contested by D'Angelo Randle (4.0 feet, ZONE). ANTHONY LILLARD MAKES IT!
Score: 10-14

[05:43] Team_019 possession (Score: 10-14)
Rudy Giddey attempts a Midrange. Contested by Dwyane Irving (3.8 feet, ZONE). RUDY GIDDEY MAKES IT! Assist: DeMar James
Score: 12-14

[05:26] Team_004 possession (Score: 12-14)
Michael Curry attempts a 3Pt. Contested by D'Angelo Randle (3.8 feet, ZONE). Michael Curry misses. Rebound secured by DeMar James.

[05:12] Team_019 possession (Score: 12-14)
FOUL! Holding foul on Dwyane Irving. [Team fouls: 3] No free throws, side out. (Dwyane Irving: 2 personal fouls)

[04:56] Team_019 possession (Score: 12-14)
Rudy Giddey drives, picks up Michael Curry. Help arrives from Dwyane Irving! Rudy Giddey attempts a Layup. Contested by Dwyane Irving (5.3 feet, MAN). RUDY GIDDEY MAKES IT! Assist: D'Angelo Randle
Score: 14-14

[04:46] Team_004 possession (Score: 14-14)
FOUL! Shooting foul on DeMar James. Anthony Lillard to the line for 3 free throws. [Team fouls: 2] (DeMar James: 1 personal fouls)   FT 1/3: MISS   FT 2/3: GOOD   FT 3/3: GOOD Anthony Lillard makes 2/3 from the line.
Score: 14-16

[04:31] Team_019 possession (Score: 14-16)
Tobias Hyland attempts a Midrange. Contested by Draymond Fox (4.2 feet, MAN). Tobias Hyland misses. Rebound secured by Dwyane Irving.

[04:15] Team_004 possession (Score: 14-16)
FOUL! Offensive foul on Jabari Wade! Brandon James drew the charge! [Team fouls: 4] (Jabari Wade: 1 personal fouls) TURNOVER! (dead ball)

[04:01] Team_019 possession (Score: 14-16)
D'Angelo Randle makes the Layup and draws the foul on Anthony Lillard! And-1! D'Angelo Randle to the line for 1. [BONUS: 5 team fouls] (Anthony Lillard: 1 personal fouls)   FT 1/1: GOOD D'Angelo Randle makes 1/1 from the line.
Score: 17-16

[03:47] Team_004 possession (Score: 17-16)
Anthony Lillard attempts a Layup. Contested by DeMar James (4.8 feet, MAN). ANTHONY LILLARD MAKES IT! Assist: Draymond Fox
Score: 17-18

[03:34] Team_019 possession (Score: 17-18)
D'Angelo Randle makes the Layup and draws the foul on Dwyane Irving! And-1! D'Angelo Randle to the line for 1. [BONUS: 6 team fouls] (Dwyane Irving: 3 personal fouls)   FT 1/1: GOOD D'Angelo Randle makes 1/1 from the line.
Score: 20-18

[03:18] Team_004 possession (Score: 20-18)
Dwyane Irving attempts a Midrange. Wide open! Tobias Hyland is 6.1 feet away. [ZONE] Dwyane Irving misses. Rebound secured by Tobias Hyland.

[02:59] Team_019 possession (Score: 20-18)
DeMar James makes the Layup and draws the foul on Jabari Wade! And-1! DeMar James to the line for 1. [BONUS: 7 team fouls] (Jabari Wade: 2 personal fouls)   FT 1/1: MISS DeMar James makes 0/1 from the line. Rebound secured by Dwyane Irving.
Score: 22-18

[02:45] Team_004 possession (Score: 22-18)
Jabari Wade loses control! Ball rolls out of bounds! TURNOVER! (dead ball)

[02:45] Substitution (Team_019): D'Angelo Randle OUT → Blake LaVine IN (stamina_rule2)

[02:45] Substitution (Team_019): Tobias Hyland OUT → Shai Ingram IN (stamina_rule2)

[02:45] Substitution (Team_019): DeMar James OUT → Tim Jordan IN (stamina_rule2)

[02:45] Substitution (Team_004): Jabari Wade OUT → Russell Barnes IN (stamina_rule2)

[02:45] Substitution (Team_004): Anthony Lillard OUT → Shai Beal IN (stamina_rule2)

[02:25] Team_019 possession (Score: 22-18)
Tim Jordan attempts a 3Pt. Contested by Michael Curry (5.2 feet, ZONE). Tim Jordan misses. Offensive rebound by Shai Ingram! Shai Ingram kicks it out.

[02:07] Team_019 possession (Score: 22-18)
Shai Ingram attempts a Midrange. Contested by Draymond Fox (4.4 feet, MAN). Shai Ingram misses. Offensive rebound by Shai Ingram! Shai Ingram kicks it out.

[01:55] Team_019 possession (Score: 22-18)
FOUL! Shooting foul on Draymond Fox. Shai Ingram to the line for 2 free throws. [BONUS: 8 team fouls] (Draymond Fox: 2 personal fouls)   FT 1/2: GOOD   FT 2/2: GOOD Shai Ingram makes 2/2 from the line.
Score: 24-18

[01:43] Team_004 possession (Score: 24-18)
FOUL! Shooting foul on Blake LaVine. Russell Barnes to the line for 3 free throws. [Team fouls: 3] (Blake LaVine: 1 personal fouls)   FT 1/3: GOOD   FT 2/3: GOOD   FT 3/3: GOOD Russell Barnes makes 3/3 from the line.
Score: 24-21

[01:30] Team_019 possession (Score: 24-21)
Rudy Giddey drives and kicks out. Shai Ingram attempts a Midrange. Contested by Draymond Fox (4.5 feet, MAN). SHAI INGRAM MAKES IT! Assist: Blake LaVine
Score: 26-21

[01:16] Team_004 possession (Score: 26-21)
FOUL! Holding foul on Shai Ingram. [Team fouls: 4] No free throws, side out. (Shai Ingram: 1 personal fouls)

[00:57] Team_004 possession (Score: 26-21)
Russell Barnes drives, picks up Shai Ingram. Help arrives from Brandon James! Russell Barnes attempts a Layup. Contested by Brandon James (5.1 feet, ZONE). RUSSELL BARNES MAKES IT!
Score: 26-23

[00:43] Team_019 possession (Score: 26-23)
FOUL! Shooting foul on Michael Curry. Blake LaVine to the line for 3 free throws. [BONUS: 9 team fouls] (Michael Curry: 1 personal fouls)   FT 1/3: GOOD   FT 2/3: GOOD   FT 3/3: GOOD Blake LaVine makes 3/3 from the line.
Score: 29-23

[00:29] Team_004 possession (Score: 29-23)
Draymond Fox drives and kicks out. Michael Curry attempts a 3Pt. Contested by Blake LaVine (4.7 feet, ZONE). Michael Curry misses. Rebound secured by Shai Ingram.

[00:13] Team_019 possession (Score: 29-23)
Rudy Giddey drives to the basket... Rudy Giddey loses control! Ball rolls out of bounds! TURNOVER! (dead ball)

[00:13] Substitution (Team_019): Rudy Giddey OUT → Gary Ginobili IN (stamina_rule2)

[00:13] Substitution (Team_019): Brandon James OUT → Jalen Turner IN (stamina_rule2)

[00:13] Substitution (Team_004): Michael Curry OUT → Karl Reaves IN (stamina_rule2)

[00:13] Substitution (Team_004): Dwyane Irving OUT → Kristaps Green IN (stamina_rule2)

[00:13] Substitution (Team_004): Draymond Fox OUT → Michael Sabonis IN (stamina_rule2)

================================================================================
                              1ST QUARTER COMPLETE                              
================================================================================

1ST QUARTER SCORE: Team_019 29, Team_004 23

BOX SCORE:
================================================================================

Team_019
--------------------------------------------------------------------------------
Player                MIN  PTS  REB  AST  TO      FG   FG%      3P   3P%
--------------------------------------------------------------------------------
D'Angelo Randle        10   10    2    1   0   4/6    66.7     0/0   0.0
Rudy Giddey            12    7    0    0   0   3/5    60.0     0/0   0.0
Shai Ingram             2    4    3    0   0   2/2   100.0     0/0   0.0
Brandon James          12    3    0    0   0   1/3    33.3     0/0   0.0
Blake LaVine            2    3    0    1   0   1/1   100.0     0/0   0.0
Tobias Hyland          10    0    2    1   0   0/2     0.0     0/0   0.0
DeMar James            10    0    3    2   0   0/1     0.0     0/0   0.0

TEAM: FG: 11/20 (55.0%), 3PT: 4/7 (57.1%), REB: 11 (6 off, 5 def), AST: 5, TO: 1
TEAM FOULS: 4


Team_004
--------------------------------------------------------------------------------
Player                MIN  PTS  REB  AST  TO      FG   FG%      3P   3P%
--------------------------------------------------------------------------------
Anthony Lillard        10    8    1    0   0   4/4   100.0     0/0   0.0
Jabari Wade            10    5    0    1   0   2/3    66.7     0/0   0.0
Russell Barnes          2    5    0    0   0   2/2   100.0     0/0   0.0
Michael Curry          12    3    0    1   0   1/3    33.3     0/0   0.0
Dwyane Irving          12    2    6    1   0   1/2    50.0     0/0   0.0
Draymond Fox           12    0    3    1   0   0/1     0.0     0/0   0.0

TEAM: FG: 10/15 (66.7%), 3PT: 4/6 (66.7%), REB: 9 (1 off, 8 def), AST: 4, TO: 5
TEAM FOULS: 9 [Team_019 in BONUS]

================================================================================

================================================================================
                       2ND QUARTER - Team_019 vs Team_004                       
================================================================================

[12:00] Team_019 possession (Score: 29-23)
Rudy Giddey attempts a Midrange. Contested by Jabari Wade (4.9 feet, ZONE). RUDY GIDDEY MAKES IT! Assist: Brandon James
Score: 31-23

[11:44] Team_004 possession (Score: 31-23)
FOUL! Reach-in foul on Brandon James during the drive. [Team fouls: 1] No free throws, side out. (Brandon James: 1 personal fouls)

[11:31] Team_004 possession (Score: 31-23)
FOUL! Reach-in foul on DeMar James during the drive. [Team fouls: 2] No free throws, side out. (DeMar James: 1 personal fouls)

[11:19] Team_004 possession (Score: 31-23)
Draymond Fox throws a bad pass! Stolen by Tobias Hyland! TURNOVER! (live ball)

[11:08] Team_019 possession (Score: 31-23)
Tobias Hyland attempts a Midrange. Contested by Draymond Fox (4.6 feet, MAN). Tobias Hyland misses. Rebound secured by Dwyane Irving.

[10:56] Team_004 possession (Score: 31-23)
Jabari Wade attempts a 3Pt. Wide open! Brandon James is 6.2 feet away. [MAN] JABARI WADE MAKES IT! Assist: Anthony Lillard
Score: 31-26

[10:42] Team_019 possession (Score: 31-26)
FOUL! Holding foul on Dwyane Irving. [Team fouls: 1] No free throws, side out. (Dwyane Irving: 1 personal fouls)

[10:31] Team_019 possession (Score: 31-26)
D'Angelo Randle attempts a Midrange. Contested by Draymond Fox (4.9 feet, ZONE). D'Angelo Randle misses. Rebound secured by Draymond Fox.

[10:15] Team_004 possession (Score: 31-26)
Draymond Fox drives, DeMar James stays with him. Draymond Fox attempts a Dunk. Contested by DeMar James (4.7 feet, ZONE). Draymond Fox misses. Rebound secured by Tobias Hyland.

[09:56] Team_019 possession (Score: 31-26)
Rudy Giddey attempts a 3Pt. Contested by Michael Curry (5.7 feet, ZONE). Rudy Giddey misses. Rebound secured by Draymond Fox.

[09:42] Team_004 possession (Score: 31-26)
Draymond Fox attempts a Midrange. Contested by Brandon James (5.9 feet, ZONE). Draymond Fox misses. Rebound secured by DeMar James.

[09:32] Team_019 possession (Score: 31-26)
Brandon James attempts a 3Pt. Contested by Jabari Wade (4.9 feet, MAN). Brandon James misses. Rebound secured by Dwyane Irving.

[09:15] Team_004 possession (Score: 31-26)
Dwyane Irving commits a violation (traveling/carry)! TURNOVER! (dead ball)

[09:15] Substitution (Team_019): Rudy Giddey OUT → Gary Ginobili IN (stamina_rule2)

[09:15] Substitution (Team_019): Brandon James OUT → Jalen Turner IN (stamina_rule2)

[09:15] Substitution (Team_019): D'Angelo Randle OUT → Blake LaVine IN (stamina_rule2)

[09:15] Substitution (Team_019): Tobias Hyland OUT → Shai Ingram IN (stamina_rule2)

[09:15] Substitution (Team_019): DeMar James OUT → Tim Jordan IN (stamina_rule2)

[09:15] Substitution (Team_004): Michael Curry OUT → Karl Reaves IN (stamina_rule2)

[09:15] Substitution (Team_004): Jabari Wade OUT → Russell Barnes IN (stamina_rule2)

[09:15] Substitution (Team_004): Dwyane Irving OUT → Kristaps Green IN (stamina_rule2)

[09:15] Substitution (Team_004): Draymond Fox OUT → Michael Sabonis IN (stamina_rule2)

[09:15] Substitution (Team_004): Anthony Lillard OUT → Shai Beal IN (stamina_rule2)

[09:03] Team_019 possession (Score: 31-26)
Tim Jordan drives, Shai Beal stays with him. Tim Jordan attempts a Layup. Contested by Shai Beal (5.1 feet, ZONE). Tim Jordan misses. Rebound secured by Russell Barnes.

[08:47] Team_004 possession (Score: 31-26)
Russell Barnes attempts a 3Pt. Contested by Jalen Turner (4.5 feet, MAN). RUSSELL BARNES MAKES IT! Assist: Michael Sabonis
Score: 31-29

[08:31] Team_019 possession (Score: 31-29)
Gary Ginobili attempts a 3Pt. Contested by Michael Sabonis (5.4 feet, ZONE). GARY GINOBILI MAKES IT!
Score: 34-29

[08:18] Team_004 possession (Score: 34-29)
Karl Reaves drives to the basket... Karl Reaves loses control! Ball rolls out of bounds! TURNOVER! (dead ball)

[08:05] Team_019 possession (Score: 34-29)
Blake LaVine drives and kicks out. Blake LaVine attempts a 3Pt. Contested by Karl Reaves (5.1 feet, ZONE). BLAKE LAVINE MAKES IT! Assist: Shai Ingram
Score: 37-29

[07:50] Team_004 possession (Score: 37-29)
Russell Barnes attempts a 3Pt. Contested by Blake LaVine (5.3 feet, ZONE). RUSSELL BARNES MAKES IT! Assist: Shai Beal
Score: 37-32

[07:37] Team_019 possession (Score: 37-32)
Gary Ginobili attempts a 3Pt. Contested by Karl Reaves (5.5 feet, MAN). Gary Ginobili misses. Offensive rebound by Shai Ingram! Shai Ingram kicks it out.

[07:26] Team_019 possession (Score: 37-32)
Jalen Turner attempts a Midrange. Contested by Russell Barnes (4.9 feet, MAN). Jalen Turner misses. Rebound secured by Michael Sabonis.

[07:10] Team_004 possession (Score: 37-32)
Shai Beal drives to the basket... Shai Beal throws a bad pass! Stolen by Shai Ingram! TURNOVER! (live ball)

[06:55] Team_019 possession (Score: 37-32)
Shai Ingram attempts a Layup. Contested by Shai Beal (5.0 feet, ZONE). SHAI INGRAM MAKES IT! Assist: Tim Jordan
Score: 39-32

[06:43] Team_004 possession (Score: 39-32)
Karl Reaves attempts a Midrange. Contested by Shai Ingram (4.1 feet, ZONE). Karl Reaves misses. Rebound secured by Tim Jordan.

[06:26] Team_019 possession (Score: 39-32)
Gary Ginobili drives, Shai Beal stays with him. Gary Ginobili attempts a Layup. Contested by Shai Beal (5.6 feet, ZONE). Gary Ginobili misses. Rebound secured by Shai Beal.

[06:09] Team_004 possession (Score: 39-32)
FOUL! Shooting foul on Shai Ingram. Kristaps Green to the line for 2 free throws. [Team fouls: 3] (Shai Ingram: 1 personal fouls)   FT 1/2: GOOD   FT 2/2: GOOD Kristaps Green makes 2/2 from the line.
Score: 39-34

[05:55] Team_019 possession (Score: 39-34)
Jalen Turner makes the 3Pt and draws the foul on Karl Reaves! And-1! Jalen Turner to the line for 1. [Team fouls: 2] (Karl Reaves: 1 personal fouls)   FT 1/1: GOOD Jalen Turner makes 1/1 from the line.
Score: 43-34

[05:42] Team_004 possession (Score: 43-34)
Shai Beal drives and kicks out. Shai Beal attempts a 3Pt. Contested by Blake LaVine (4.7 feet, ZONE). SHAI BEAL MAKES IT! Assist: Karl Reaves
Score: 43-37

[05:25] Team_019 possession (Score: 43-37)
Shai Ingram attempts a Layup. BLOCKED BY RUSSELL BARNES! Ball is loose! Rebound secured by Michael Sabonis.

[05:14] Team_004 possession (Score: 43-37)
Shai Beal attempts a Layup. Contested by Shai Ingram (4.6 feet, ZONE). SHAI BEAL MAKES IT! Assist: Kristaps Green
Score: 43-39

[05:00] Team_019 possession (Score: 43-39)
FOUL! Shooting foul on Russell Barnes. Blake LaVine to the line for 2 free throws. [Team fouls: 3] (Russell Barnes: 1 personal fouls)   FT 1/2: GOOD   FT 2/2: GOOD Blake LaVine makes 2/2 from the line.
Score: 45-39

[04:41] Team_004 possession (Score: 45-39)
FOUL! Reach-in foul on Blake LaVine during the drive. [Team fouls: 4] No free throws, side out. (Blake LaVine: 1 personal fouls)

[04:29] Team_004 possession (Score: 45-39)
Shai Beal attempts a Midrange. Contested by Shai Ingram (4.6 feet, MAN). SHAI BEAL MAKES IT!
Score: 45-41

[04:13] Team_019 possession (Score: 45-41)
Jalen Turner drives, Russell Barnes stays with him. Jalen Turner attempts a Layup. Contested by Russell Barnes (4.9 feet, MAN). JALEN TURNER MAKES IT! Assist: Blake LaVine
Score: 47-41

[03:57] Team_004 possession (Score: 47-41)
FOUL! Holding foul on Shai Ingram. [IN THE BONUS! 5 team fouls] Michael Sabonis to the line for 2 free throws. (Shai Ingram: 2 personal fouls)   FT 1/2: MISS   FT 2/2: GOOD Michael Sabonis makes 1/2 from the line.
Score: 47-42

[03:40] Team_019 possession (Score: 47-42)
FOUL! Holding foul on Karl Reaves. [Team fouls: 4] No free throws, side out. (Karl Reaves: 2 personal fouls)

[03:25] Team_019 possession (Score: 47-42)
Tim Jordan attempts a Midrange. Contested by Shai Beal (5.1 feet, MAN). Tim Jordan misses. Rebound secured by Shai Beal.

[03:11] Team_004 possession (Score: 47-42)
Shai Beal drives and kicks out. Russell Barnes attempts a 3Pt. Contested by Jalen Turner (3.9 feet, MAN). RUSSELL BARNES MAKES IT!
Score: 47-45

[02:58] Team_019 possession (Score: 47-45)
Blake LaVine attempts a Layup. Contested by Kristaps Green (4.5 feet, MAN). BLAKE LAVINE MAKES IT! Assist: Gary Ginobili
Score: 49-45

[02:45] Team_004 possession (Score: 49-45)
Michael Sabonis drives and kicks out. Kristaps Green attempts a Midrange. Contested by Blake LaVine (4.8 feet, ZONE). Kristaps Green misses. Offensive rebound by Michael Sabonis! Michael Sabonis kicks it out.

[02:33] Team_004 possession (Score: 49-45)
Russell Barnes makes the Layup and draws the foul on Jalen Turner! And-1! Russell Barnes to the line for 1. [BONUS: 6 team fouls] (Jalen Turner: 1 personal fouls)   FT 1/1: MISS Russell Barnes makes 0/1 from the line. Offensive rebound by Michael Sabonis! Michael Sabonis kicks it out.
Score: 49-47

[02:18] Team_004 possession (Score: 49-47)
Michael Sabonis makes the Dunk and draws the foul on Jalen Turner! And-1! Michael Sabonis to the line for 1. [BONUS: 7 team fouls] (Jalen Turner: 2 personal fouls)   FT 1/1: GOOD Michael Sabonis makes 1/1 from the line.
Score: 49-50

[02:02] Team_019 possession (Score: 49-50)
Shai Ingram drives to the basket... Shai Ingram loses the ball! Stripped by Shai Beal! TURNOVER! (live ball)

[01:48] Team_004 possession (Score: 49-50)
Kristaps Green drives, picks up Blake LaVine. Help arrives from Jalen Turner! Kristaps Green attempts a Dunk. Contested by Jalen Turner (4.9 feet, MAN). KRISTAPS GREEN MAKES IT! Assist: Russell Barnes
Score: 49-52

[01:34] Team_019 possession (Score: 49-52)
Jalen Turner attempts a Midrange. Contested by Russell Barnes (5.1 feet, ZONE). Jalen Turner misses. Rebound secured by Russell Barnes.

[01:19] Team_004 possession (Score: 49-52)
Karl Reaves loses the ball! Stripped by Gary Ginobili! TURNOVER! (live ball)

[01:06] Team_019 possession (Score: 49-52)
FOUL! Shooting foul on Kristaps Green. Gary Ginobili to the line for 2 free throws. [BONUS: 5 team fouls] (Kristaps Green: 1 personal fouls)   FT 1/2: MISS   FT 2/2: GOOD Gary Ginobili makes 1/2 from the line.
Score: 50-52

[00:52] Team_004 possession (Score: 50-52)
Karl Reaves attempts a 3Pt. Contested by Blake LaVine (4.5 feet, ZONE). Karl Reaves misses. Rebound secured by Blake LaVine.

[00:38] Team_019 possession (Score: 50-52)
Blake LaVine drives to the basket... Blake LaVine throws a bad pass out of bounds! TURNOVER! (dead ball)

[00:25] Team_004 possession (Score: 50-52)
Shai Beal attempts a 3Pt. Contested by Shai Ingram (5.0 feet, MAN). SHAI BEAL MAKES IT!
Score: 50-55

[00:08] Team_019 possession (Score: 50-55)
FOUL! Reach-in foul on Shai Beal during the drive. [IN THE BONUS! 6 team fouls] Jalen Turner to the line for 2 free throws. (Shai Beal: 1 personal fouls)   FT 1/2: GOOD   FT 2/2: MISS Jalen Turner makes 1/2 from the line. Rebound secured by Russell Barnes.
Score: 51-55

================================================================================
                              2ND QUARTER COMPLETE                              
================================================================================

2ND QUARTER SCORE: Team_019 22, Team_004 32

BOX SCORE:
================================================================================

Team_019
--------------------------------------------------------------------------------
Player                MIN  PTS  REB  AST  TO      FG   FG%      3P   3P%
--------------------------------------------------------------------------------
Blake LaVine           12    7    1    1   0   3/3   100.0     0/0   0.0
Jalen Turner            9    6    0    0   0   2/5    40.0     0/0   0.0
Gary Ginobili           9    4    0    1   0   2/3    66.7     0/0   0.0
Rudy Giddey            15    2    0    0   0   1/2    50.0     0/0   0.0
Shai Ingram            12    2    1    1   0   1/2    50.0     0/0   0.0
Brandon James          15    0    0    1   0   0/1     0.0     0/0   0.0
Tobias Hyland          13    0    1    0   0   0/1     0.0     0/0   0.0
D'Angelo Randle        13    0    0    0   0   0/1     0.0     0/0   0.0
DeMar James            13    0    1    0   0   0/0     0.0     0/0   0.0
Tim Jordan             12    0    1    1   0   0/2     0.0     0/0   0.0

TEAM: FG: 9/20 (45.0%), 3PT: 2/4 (50.0%), REB: 5 (1 off, 4 def), AST: 5, TO: 2
TEAM FOULS: 7 [Team_004 in BONUS]


Team_004
--------------------------------------------------------------------------------
Player                MIN  PTS  REB  AST  TO      FG   FG%      3P   3P%
--------------------------------------------------------------------------------
Shai Beal              12   10    2    1   0   4/4   100.0     0/0   0.0
Russell Barnes         12    9    3    1   0   3/3   100.0     0/0   0.0
Michael Sabonis         9    4    4    1   0   2/2   100.0     0/0   0.0
Kristaps Green          9    4    0    1   0   2/2   100.0     0/0   0.0
Jabari Wade            13    3    0    0   0   1/1   100.0     0/0   0.0
Dwyane Irving          15    0    2    0   0   0/0     0.0     0/0   0.0
Anthony Lillard        13    0    0    1   0   0/0     0.0     0/0   0.0
Draymond Fox           15    0    2    0   0   0/2     0.0     0/0   0.0
Karl Reaves             9    0    0    1   0   0/2     0.0     0/0   0.0

TEAM: FG: 12/16 (75.0%), 3PT: 4/5 (80.0%), REB: 13 (2 off, 11 def), AST: 6, TO: 5
TEAM FOULS: 6 [Team_019 in BONUS]

================================================================================

================================================================================
                       3RD QUARTER - Team_019 vs Team_004                       
================================================================================

[12:00] Team_019 possession (Score: 51-55)
Rudy Giddey attempts a 3Pt. Contested by Michael Curry (5.2 feet, ZONE). RUDY GIDDEY MAKES IT!
Score: 54-55

[11:44] Team_004 possession (Score: 54-55)
Jabari Wade drives, Brandon James stays with him. Jabari Wade attempts a Layup. Contested by Brandon James (5.8 feet, MAN). Jabari Wade misses. Rebound secured by DeMar James.

[11:29] Team_019 possession (Score: 54-55)
Rudy Giddey drives, Anthony Lillard stays with him. Rudy Giddey attempts a Dunk. Contested by Anthony Lillard (4.3 feet, ZONE). Rudy Giddey misses. Offensive rebound by D'Angelo Randle! D'Angelo Randle's putback is no good. Rebound secured by Draymond Fox.

[11:12] Team_004 possession (Score: 54-55)
Anthony Lillard attempts a Midrange. Contested by DeMar James (4.6 feet, MAN). Anthony Lillard misses. Rebound secured by DeMar James.

[10:56] Team_019 possession (Score: 54-55)
D'Angelo Randle attempts a Midrange. Contested by Draymond Fox (4.4 feet, ZONE). D'ANGELO RANDLE MAKES IT!
Score: 56-55

[10:42] Team_004 possession (Score: 56-55)
FOUL! Shooting foul on DeMar James. Dwyane Irving to the line for 2 free throws. [Team fouls: 1] (DeMar James: 1 personal fouls)   FT 1/2: GOOD   FT 2/2: GOOD Dwyane Irving makes 2/2 from the line.
Score: 56-57

[10:29] Team_019 possession (Score: 56-57)
Tobias Hyland attempts a 3Pt. Contested by Michael Curry (5.0 feet, ZONE). Tobias Hyland misses. Rebound secured by Dwyane Irving.

[10:17] Team_004 possession (Score: 56-57)
Draymond Fox attempts a 3Pt. Contested by Brandon James (5.5 feet, ZONE). DRAYMOND FOX MAKES IT! Assist: Dwyane Irving
Score: 56-60

[10:01] Team_019 possession (Score: 56-60)
Rudy Giddey drives and kicks out. Tobias Hyland attempts a 3Pt. Contested by Draymond Fox (4.1 feet, MAN). Tobias Hyland misses. Rebound secured by Anthony Lillard.

[09:47] Team_004 possession (Score: 56-60)
Anthony Lillard makes the Midrange and draws the foul on DeMar James! And-1! Anthony Lillard to the line for 1. [Team fouls: 2] (DeMar James: 2 personal fouls)   FT 1/1: GOOD Anthony Lillard makes 1/1 from the line.
Score: 56-63

[09:29] Team_019 possession (Score: 56-63)
Tobias Hyland attempts a 3Pt. Contested by Michael Curry (5.0 feet, ZONE). TOBIAS HYLAND MAKES IT! Assist: D'Angelo Randle
Score: 59-63

[09:12] Team_004 possession (Score: 59-63)
Dwyane Irving drives, DeMar James stays with him. Dwyane Irving attempts a Dunk. Contested by DeMar James (4.5 feet, ZONE). DWYANE IRVING MAKES IT!
Score: 59-65

[08:57] Team_019 possession (Score: 59-65)
DeMar James attempts a Midrange. Contested by Jabari Wade (5.0 feet, ZONE). DEMAR JAMES MAKES IT! Assist: Brandon James
Score: 61-65

[08:45] Team_004 possession (Score: 61-65)
Dwyane Irving drives and kicks out. Jabari Wade attempts a Midrange. Contested by Brandon James (5.1 feet, MAN). Jabari Wade misses. Offensive rebound by Draymond Fox! Draymond Fox kicks it out.

[08:35] Team_004 possession (Score: 61-65)
Draymond Fox attempts a Layup. Contested by DeMar James (4.6 feet, ZONE). Draymond Fox misses. Offensive rebound by Draymond Fox! Draymond Fox kicks it out.

[08:22] Team_004 possession (Score: 61-65)
FOUL! Shooting foul on Tobias Hyland. Michael Curry to the line for 2 free throws. [Team fouls: 3] (Tobias Hyland: 1 personal fouls)   FT 1/2: MISS   FT 2/2: GOOD Michael Curry makes 1/2 from the line.
Score: 61-66

[08:05] Team_019 possession (Score: 61-66)
DeMar James drives, Anthony Lillard stays with him. DeMar James attempts a Dunk. Contested by Anthony Lillard (4.5 feet, ZONE). DeMar James misses. Rebound secured by Anthony Lillard.

[07:49] Team_004 possession (Score: 61-66)
Michael Curry attempts a 3Pt. Contested by D'Angelo Randle (3.7 feet, ZONE). Michael Curry misses. Offensive rebound by Draymond Fox! Draymond Fox kicks it out.

[07:35] Team_004 possession (Score: 61-66)
Dwyane Irving attempts a Layup. Contested by D'Angelo Randle (3.9 feet, MAN). DWYANE IRVING MAKES IT! Assist: Jabari Wade
Score: 61-68

[07:24] Team_019 possession (Score: 61-68)
DeMar James drives to the basket... DeMar James loses the ball! Stripped by Anthony Lillard! TURNOVER! (live ball)

[07:09] Team_004 possession (Score: 61-68)
FOUL! Shooting foul on D'Angelo Randle. Dwyane Irving to the line for 3 free throws. [Team fouls: 4] (D'Angelo Randle: 1 personal fouls)   FT 1/3: GOOD   FT 2/3: GOOD   FT 3/3: GOOD Dwyane Irving makes 3/3 from the line.
Score: 61-71

[06:54] Team_019 possession (Score: 61-71)
D'Angelo Randle attempts a 3Pt. Contested by Dwyane Irving (3.8 feet, MAN). D'Angelo Randle misses. Rebound secured by Draymond Fox.

[06:38] Team_004 possession (Score: 61-71)
Michael Curry attempts a 3Pt. Contested by Rudy Giddey (5.5 feet, MAN). MICHAEL CURRY MAKES IT! Assist: Jabari Wade
Score: 61-74

[06:20] Team_019 possession (Score: 61-74)
Tobias Hyland attempts a Midrange. Contested by Dwyane Irving (3.6 feet, ZONE). Tobias Hyland misses. Rebound secured by Draymond Fox.

[06:09] Team_004 possession (Score: 61-74)
Michael Curry loses the ball! Stripped by Rudy Giddey! TURNOVER! (live ball)

[05:56] Team_019 possession (Score: 61-74)
DeMar James drives to the basket... DeMar James throws a bad pass out of bounds! TURNOVER! (dead ball)

[05:44] Team_004 possession (Score: 61-74)
Draymond Fox attempts a 3Pt. Wide open! Tobias Hyland is 6.0 feet away. [MAN] Draymond Fox misses. Rebound secured by Tobias Hyland.

[05:29] Team_019 possession (Score: 61-74)
Tobias Hyland drives to the basket... Tobias Hyland loses the ball! Stripped by Draymond Fox! TURNOVER! (live ball)

[05:15] Team_004 possession (Score: 61-74)
Draymond Fox attempts a Midrange. Wide open! Tobias Hyland is 6.1 feet away. [MAN] Draymond Fox misses. Offensive rebound by Draymond Fox! Draymond Fox kicks it out.

[05:03] Team_004 possession (Score: 61-74)
Dwyane Irving attempts a 3Pt. Contested by D'Angelo Randle (3.9 feet, ZONE). DWYANE IRVING MAKES IT! Assist: Michael Curry
Score: 61-77

[04:47] Team_019 possession (Score: 61-77)
FOUL! Reach-in foul on Dwyane Irving during the drive. [Team fouls: 1] No free throws, side out. (Dwyane Irving: 1 personal fouls)

[04:34] Team_019 possession (Score: 61-77)
DeMar James drives, picks up Anthony Lillard. Help arrives from Jabari Wade! DeMar James attempts a Dunk. Contested by Jabari Wade (4.6 feet, MAN). DEMAR JAMES MAKES IT! Assist: Brandon James
Score: 63-77

[04:20] Team_004 possession (Score: 63-77)
FOUL! Holding foul on Brandon James. [IN THE BONUS! 5 team fouls] Jabari Wade to the line for 2 free throws. (Brandon James: 1 personal fouls)   FT 1/2: GOOD   FT 2/2: GOOD Jabari Wade makes 2/2 from the line.
Score: 63-79

[04:07] Team_019 possession (Score: 63-79)
Brandon James attempts a Midrange. Contested by Jabari Wade (4.8 feet, MAN). BRANDON JAMES MAKES IT!
Score: 65-79

[03:53] Team_004 possession (Score: 65-79)
Dwyane Irving drives, picks up DeMar James. Help arrives from Brandon James! Dwyane Irving attempts a Layup. Contested by Brandon James (4.7 feet, ZONE). DWYANE IRVING MAKES IT! Assist: Jabari Wade
Score: 65-81

[03:40] Team_019 possession (Score: 65-81)
Rudy Giddey attempts a Midrange. Contested by Michael Curry (5.3 feet, MAN). RUDY GIDDEY MAKES IT!
Score: 67-81

[03:29] Team_004 possession (Score: 67-81)
Dwyane Irving drives, D'Angelo Randle stays with him. Dwyane Irving attempts a Dunk. Contested by D'Angelo Randle (4.1 feet, MAN). Dwyane Irving misses. Rebound secured by D'Angelo Randle.

[03:18] Team_019 possession (Score: 67-81)
FOUL! Holding foul on Jabari Wade. [Team fouls: 2] No free throws, side out. (Jabari Wade: 1 personal fouls)

[03:04] Team_019 possession (Score: 67-81)
FOUL! Offensive foul on Rudy Giddey! Michael Curry drew the charge! [Team fouls: 6] (Rudy Giddey: 1 personal fouls) TURNOVER! (dead ball)

[02:49] Team_004 possession (Score: 67-81)
FOUL! Reach-in foul on DeMar James during the drive. [IN THE BONUS! 7 team fouls] Anthony Lillard to the line for 2 free throws. (DeMar James: 3 personal fouls)   FT 1/2: GOOD   FT 2/2: GOOD Anthony Lillard makes 2/2 from the line.
Score: 67-83

[02:34] Team_019 possession (Score: 67-83)
Rudy Giddey attempts a 3Pt. Contested by Michael Curry (5.4 feet, ZONE). RUDY GIDDEY MAKES IT!
Score: 70-83

[02:19] Team_004 possession (Score: 70-83)
Jabari Wade attempts a 3Pt. Wide open! Brandon James is 6.0 feet away. [MAN] Jabari Wade misses. Offensive rebound by Dwyane Irving! Dwyane Irving kicks it out.

[02:04] Team_004 possession (Score: 70-83)
Dwyane Irving attempts a Midrange. Contested by D'Angelo Randle (4.3 feet, MAN). Dwyane Irving misses. Rebound secured by DeMar James.

[01:52] Team_019 possession (Score: 70-83)
FOUL! Offensive foul on Tobias Hyland! Draymond Fox drew the charge! [Team fouls: 8] (Tobias Hyland: 2 personal fouls) TURNOVER! (dead ball)

[01:38] Team_004 possession (Score: 70-83)
FOUL! Holding foul on D'Angelo Randle. [IN THE BONUS! 9 team fouls] Dwyane Irving to the line for 2 free throws. (D'Angelo Randle: 2 personal fouls)   FT 1/2: GOOD   FT 2/2: MISS Dwyane Irving makes 1/2 from the line. Rebound secured by D'Angelo Randle.
Score: 70-84

[01:22] Team_019 possession (Score: 70-84)
Brandon James attempts a Midrange. Contested by Jabari Wade (5.1 feet, MAN). Brandon James misses. Rebound secured by Anthony Lillard.

[01:12] Team_004 possession (Score: 70-84)
Draymond Fox attempts a 3Pt. Contested by D'Angelo Randle (4.4 feet, ZONE). DRAYMOND FOX MAKES IT! Assist: Michael Curry
Score: 70-87

[00:57] Team_019 possession (Score: 70-87)
D'Angelo Randle attempts a Midrange. Contested by Draymond Fox (4.8 feet, ZONE). D'Angelo Randle misses. Rebound secured by Anthony Lillard.

[00:47] Team_004 possession (Score: 70-87)
Jabari Wade attempts a Layup. Contested by DeMar James (5.4 feet, ZONE). Jabari Wade misses. Rebound secured by DeMar James.

[00:31] Team_019 possession (Score: 70-87)
FOUL! Shooting foul on Draymond Fox. Tobias Hyland to the line for 2 free throws. [Team fouls: 3] (Draymond Fox: 1 personal fouls)   FT 1/2: GOOD   FT 2/2: MISS Tobias Hyland makes 1/2 from the line. Offensive rebound by DeMar James! DeMar James kicks it out.
Score: 71-87

[00:16] Team_019 possession (Score: 71-87)
Rudy Giddey drives to the basket... FOUL! Offensive foul on Rudy Giddey! Anthony Lillard drew the charge! [Team fouls: 10] (Rudy Giddey: 2 personal fouls) TURNOVER! (dead ball)

================================================================================
                              3RD QUARTER COMPLETE                              
================================================================================

3RD QUARTER SCORE: Team_019 20, Team_004 32

BOX SCORE:
================================================================================

Team_019
--------------------------------------------------------------------------------
Player                MIN  PTS  REB  AST  TO      FG   FG%      3P   3P%
--------------------------------------------------------------------------------
Rudy Giddey            27    8    0    0   0   3/5    60.0     0/0   0.0
DeMar James            25    4    5    0   0   2/3    66.7     0/0   0.0
Tobias Hyland          25    3    1    0   0   1/3    33.3     0/0   0.0
D'Angelo Randle        25    2    2    1   0   1/3    33.3     0/0   0.0
Brandon James          27    2    0    2   0   1/2    50.0     0/0   0.0

TEAM: FG: 8/16 (50.0%), 3PT: 3/5 (60.0%), REB: 9 (2 off, 7 def), AST: 3, TO: 6
TEAM FOULS: 10 [Team_004 in BONUS]


Team_004
--------------------------------------------------------------------------------
Player                MIN  PTS  REB  AST  TO      FG   FG%      3P   3P%
--------------------------------------------------------------------------------
Dwyane Irving          27   14    2    1   0   6/8    75.0     0/0   0.0
Draymond Fox           27    6    7    0   0   2/3    66.7     0/0   0.0
Anthony Lillard        25    5    4    0   0   2/3    66.7     0/0   0.0
Michael Curry          27    4    0    2   0   2/2   100.0     0/0   0.0
Jabari Wade            25    2    0    3   0   1/3    33.3     0/0   0.0

TEAM: FG: 13/20 (65.0%), 3PT: 5/6 (83.3%), REB: 12 (5 off, 7 def), AST: 6, TO: 1
TEAM FOULS: 3

================================================================================

================================================================================
                       4TH QUARTER - Team_019 vs Team_004                       
================================================================================

[12:00] Substitution (Team_019): Rudy Giddey OUT (stamina: 69) → Gary Ginobili IN (comeback_detected)

[12:00] Substitution (Team_004): Michael Curry OUT (stamina: 68) → Karl Reaves IN (comeback_detected)

[12:00] Team_019 possession (Score: 71-87)
Brandon James attempts a Midrange. Contested by Jabari Wade (5.0 feet, ZONE). Brandon James misses. Offensive rebound by D'Angelo Randle! D'Angelo Randle kicks it out.

[11:45] Team_019 possession (Score: 71-87)
Gary Ginobili makes the Layup and draws the foul on Karl Reaves! And-1! Gary Ginobili to the line for 1. [Team fouls: 1] (Karl Reaves: 1 personal fouls)   FT 1/1: GOOD Gary Ginobili makes 1/1 from the line.
Score: 74-87

[11:32] Team_004 possession (Score: 74-87)
Dwyane Irving attempts a 3Pt. Contested by D'Angelo Randle (4.3 feet, MAN). Dwyane Irving misses. Rebound secured by Tobias Hyland.

[11:19] Team_019 possession (Score: 74-87)
Brandon James drives to the basket... FOUL! Offensive foul on Brandon James! Jabari Wade drew the charge! [Team fouls: 1] (Brandon James: 1 personal fouls) TURNOVER! (dead ball)

[11:03] Team_004 possession (Score: 74-87)
Jabari Wade attempts a Midrange. Wide open! Brandon James is 6.1 feet away. [MAN] JABARI WADE MAKES IT!
Score: 74-89

[10:47] Team_019 possession (Score: 74-89)
Brandon James attempts a Midrange. Contested by Anthony Lillard (4.7 feet, ZONE). BRANDON JAMES MAKES IT!
Score: 76-89

[10:28] Team_004 possession (Score: 76-89)
Anthony Lillard attempts a Layup. Contested by DeMar James (5.1 feet, MAN). ANTHONY LILLARD MAKES IT! Assist: Dwyane Irving
Score: 76-91

[10:13] Team_019 possession (Score: 76-91)
Brandon James attempts a 3Pt. Contested by Karl Reaves (5.0 feet, ZONE). Brandon James misses. Rebound secured by Dwyane Irving.

[09:56] Team_004 possession (Score: 76-91)
Jabari Wade attempts a 3Pt. Wide open! Brandon James is 6.2 feet away. [MAN] JABARI WADE MAKES IT! Assist: Dwyane Irving
Score: 76-94

[09:41] Team_019 possession (Score: 76-94)
Brandon James attempts a 3Pt. Contested by Jabari Wade (5.3 feet, MAN). Brandon James misses. Rebound secured by Anthony Lillard.

[09:28] Team_004 possession (Score: 76-94)
Jabari Wade attempts a 3Pt. Contested by D'Angelo Randle (4.9 feet, ZONE). JABARI WADE MAKES IT! Assist: Draymond Fox
Score: 76-97

[09:17] Team_019 possession (Score: 76-97)
DeMar James attempts a Midrange. Contested by Dwyane Irving (4.4 feet, ZONE). DEMAR JAMES MAKES IT! Assist: D'Angelo Randle
Score: 78-97

[08:59] Team_004 possession (Score: 78-97)
Karl Reaves attempts a 3Pt. Contested by D'Angelo Randle (4.0 feet, ZONE). KARL REAVES MAKES IT! Assist: Jabari Wade
Score: 78-100

[08:42] Team_019 possession (Score: 78-100)
FOUL! Reach-in foul on Anthony Lillard during the drive. [Team fouls: 2] No free throws, side out. (Anthony Lillard: 1 personal fouls)

[08:27] Team_019 possession (Score: 78-100)
Tobias Hyland attempts a Layup. BLOCKED BY ANTHONY LILLARD! Ball goes out off Anthony Lillard. Tobias Hyland's ball!

[08:12] Team_019 possession (Score: 78-100)
Brandon James drives, picks up Anthony Lillard. Help arrives from Karl Reaves! Brandon James attempts a Layup. Contested by Karl Reaves (5.0 feet, ZONE). BRANDON JAMES MAKES IT! Assist: DeMar James
Score: 80-100

[07:53] Team_004 possession (Score: 80-100)
Dwyane Irving attempts a 3Pt. Contested by D'Angelo Randle (4.8 feet, ZONE). Dwyane Irving misses. Rebound secured by Tobias Hyland.

[07:38] Team_019 possession (Score: 80-100)
FOUL! Holding foul on Karl Reaves. [Team fouls: 3] No free throws, side out. (Karl Reaves: 2 personal fouls)

[07:26] Team_019 possession (Score: 80-100)
Gary Ginobili attempts a 3Pt. Contested by Karl Reaves (5.5 feet, MAN). Gary Ginobili misses. Offensive rebound by DeMar James! DeMar James kicks it out.

[07:08] Team_019 possession (Score: 80-100)
DeMar James attempts a Layup. Contested by Anthony Lillard (5.5 feet, ZONE). DeMar James misses. Rebound secured by Dwyane Irving.

[06:55] Team_004 possession (Score: 80-100)
Anthony Lillard attempts a 3Pt. Contested by D'Angelo Randle (5.0 feet, ZONE). Anthony Lillard misses. Rebound secured by Tobias Hyland.

[06:46] Team_019 possession (Score: 80-100)
FOUL! Shooting foul on Karl Reaves. Brandon James to the line for 2 free throws. [Team fouls: 4] (Karl Reaves: 3 personal fouls)   FT 1/2: GOOD   FT 2/2: MISS Brandon James makes 1/2 from the line. Rebound secured by Dwyane Irving.
Score: 81-100

[06:28] Team_004 possession (Score: 81-100)
Draymond Fox attempts a Midrange. Wide open! Tobias Hyland is 6.9 feet away. [MAN] Draymond Fox misses. Rebound secured by Tobias Hyland.

[06:10] Team_019 possession (Score: 81-100)
FOUL! Holding foul on Draymond Fox. [IN THE BONUS! 5 team fouls] Tobias Hyland to the line for 2 free throws. (Draymond Fox: 1 personal fouls)   FT 1/2: GOOD   FT 2/2: GOOD Tobias Hyland makes 2/2 from the line.
Score: 83-100

[05:57] Team_004 possession (Score: 83-100)
Karl Reaves drives and kicks out. Anthony Lillard attempts a 3Pt. Contested by DeMar James (5.6 feet, MAN). ANTHONY LILLARD MAKES IT! Assist: Dwyane Irving
Score: 83-103

[05:42] Team_019 possession (Score: 83-103)
DeMar James drives, Draymond Fox stays with him. DeMar James attempts a Layup. Contested by Draymond Fox (5.5 feet, ZONE). DEMAR JAMES MAKES IT! Assist: Gary Ginobili
Score: 85-103

[05:25] Team_004 possession (Score: 85-103)
Anthony Lillard drives, DeMar James stays with him. Anthony Lillard attempts a Layup. Contested by DeMar James (5.8 feet, MAN). ANTHONY LILLARD MAKES IT! Assist: Draymond Fox
Score: 85-105

[05:09] Team_019 possession (Score: 85-105)
Gary Ginobili drives, picks up Anthony Lillard. Help arrives from Karl Reaves! Gary Ginobili attempts a Layup. Wide open! Karl Reaves is 6.1 feet away. [ZONE] GARY GINOBILI MAKES IT! Assist: D'Angelo Randle
Score: 87-105

[04:54] Team_004 possession (Score: 87-105)
Dwyane Irving attempts a 3Pt. Contested by D'Angelo Randle (5.3 feet, ZONE). Dwyane Irving misses. Rebound secured by DeMar James.

[04:40] Team_019 possession (Score: 87-105)
FOUL! Holding foul on Dwyane Irving. [IN THE BONUS! 6 team fouls] D'Angelo Randle to the line for 2 free throws. (Dwyane Irving: 1 personal fouls)   FT 1/2: GOOD   FT 2/2: GOOD D'Angelo Randle makes 2/2 from the line.
Score: 89-105

[04:23] Team_004 possession (Score: 89-105)
Karl Reaves attempts a 3Pt. Contested by D'Angelo Randle (4.8 feet, ZONE). KARL REAVES MAKES IT! Assist: Anthony Lillard
Score: 89-108

[04:13] Team_019 possession (Score: 89-108)
D'Angelo Randle attempts a Layup. Contested by Dwyane Irving (4.9 feet, MAN). D'ANGELO RANDLE MAKES IT!
Score: 91-108

[04:03] Team_004 possession (Score: 91-108)
Draymond Fox attempts a 3Pt. Contested by D'Angelo Randle (5.4 feet, ZONE). Draymond Fox misses. Rebound secured by DeMar James.

[03:47] Team_019 possession (Score: 91-108)
Brandon James attempts a 3Pt. Wide open! Jabari Wade is 6.1 feet away. [MAN] BRANDON JAMES MAKES IT! Assist: Tobias Hyland
Score: 94-108

[03:29] Team_004 possession (Score: 94-108)
Dwyane Irving attempts a 3Pt. Contested by D'Angelo Randle (5.5 feet, ZONE). DWYANE IRVING MAKES IT! Assist: Jabari Wade
Score: 94-111

[03:14] Team_019 possession (Score: 94-111)
Gary Ginobili drives to the basket... Gary Ginobili throws a bad pass out of bounds! TURNOVER! (dead ball)

[03:14] Substitution (Team_019): Brandon James OUT → Jalen Turner IN (stamina_rule2)

[03:14] Substitution (Team_019): D'Angelo Randle OUT → Blake LaVine IN (stamina_rule2)

[03:14] Substitution (Team_019): Tobias Hyland OUT → Shai Ingram IN (stamina_rule2)

[03:14] Substitution (Team_019): DeMar James OUT → Tim Jordan IN (stamina_rule2)

[03:14] Substitution (Team_004): Jabari Wade OUT → Russell Barnes IN (stamina_rule2)

[03:14] Substitution (Team_004): Dwyane Irving OUT → Kristaps Green IN (stamina_rule2)

[03:14] Substitution (Team_004): Draymond Fox OUT → Michael Sabonis IN (stamina_rule2)

[03:14] Substitution (Team_004): Anthony Lillard OUT → Shai Beal IN (stamina_rule2)

[03:00] Team_004 possession (Score: 94-111)
Russell Barnes attempts a 3Pt. Contested by Blake LaVine (5.3 feet, ZONE). Russell Barnes misses. Rebound secured by Blake LaVine.

[02:42] Team_019 possession (Score: 94-111)
Jalen Turner drives and kicks out. Gary Ginobili attempts a 3Pt. Contested by Karl Reaves (5.3 feet, ZONE). Gary Ginobili misses. FOUL! Loose ball foul on Shai Beal during the rebound battle. [IN THE BONUS! 7 team fouls] Tim Jordan to the line for 2 free throws. (Shai Beal: 1 personal fouls)   FT 1/2: GOOD   FT 2/2: GOOD Tim Jordan makes 2/2 from the line.
Score: 96-111

[02:27] Team_004 possession (Score: 96-111)
Kristaps Green attempts a 3Pt. Contested by Shai Ingram (4.6 feet, ZONE). Kristaps Green misses. Rebound secured by Blake LaVine.

[02:16] Team_019 possession (Score: 96-111)
Shai Ingram attempts a Midrange. Contested by Michael Sabonis (4.9 feet, MAN). SHAI INGRAM MAKES IT!
Score: 98-111

[02:00] Team_004 possession (Score: 98-111)
Kristaps Green makes the 3Pt and draws the foul on Shai Ingram! And-1! Kristaps Green to the line for 1. [Team fouls: 2] (Shai Ingram: 1 personal fouls)   FT 1/1: GOOD Kristaps Green makes 1/1 from the line.
Score: 98-115

[01:45] Team_019 possession (Score: 98-115)
Shai Ingram makes the Layup and draws the foul on Michael Sabonis! And-1! Shai Ingram to the line for 1. [BONUS: 8 team fouls] (Michael Sabonis: 1 personal fouls)   FT 1/1: GOOD Shai Ingram makes 1/1 from the line.
Score: 101-115

[01:31] Team_004 possession (Score: 101-115)
Russell Barnes attempts a 3Pt. Contested by Blake LaVine (5.3 feet, ZONE). Russell Barnes misses. Rebound secured by Shai Ingram.

[01:15] Team_019 possession (Score: 101-115)
Gary Ginobili attempts a 3Pt. Contested by Karl Reaves (5.8 feet, MAN). Gary Ginobili misses. Rebound secured by Russell Barnes.

[01:04] Team_004 possession (Score: 101-115)
Russell Barnes attempts a Midrange. Contested by Jalen Turner (4.5 feet, MAN). RUSSELL BARNES MAKES IT!
Score: 101-117

[00:51] Team_019 possession (Score: 101-117)
Tim Jordan drives to the basket... Tim Jordan throws a bad pass out of bounds! TURNOVER! (dead ball)

[00:34] Team_004 possession (Score: 101-117)
Karl Reaves throws a bad pass! Stolen by Gary Ginobili! TURNOVER! (live ball)

[00:24] Team_019 possession (Score: 101-117)
Blake LaVine attempts a Midrange. Contested by Russell Barnes (4.8 feet, ZONE). Blake LaVine misses. Rebound secured by Russell Barnes.

[00:10] Team_004 possession (Score: 101-117)
Shai Beal attempts a Midrange. Contested by Shai Ingram (4.6 feet, ZONE). Shai Beal misses. Rebound secured by Shai Ingram.

================================================================================
                              4TH QUARTER COMPLETE                              
================================================================================

4TH QUARTER SCORE: Team_019 30, Team_004 30

BOX SCORE:
================================================================================

Team_019
--------------------------------------------------------------------------------
Player                MIN  PTS  REB  AST  TO      FG   FG%      3P   3P%
--------------------------------------------------------------------------------
Brandon James          36    7    0    0   0   3/6    50.0     0/0   0.0
Gary Ginobili          21    5    0    1   0   2/3    66.7     0/0   0.0
Shai Ingram            15    5    2    0   0   2/2   100.0     0/0   0.0
D'Angelo Randle        34    4    1    2   0   2/2   100.0     0/0   0.0
DeMar James            34    4    3    1   0   2/3    66.7     0/0   0.0
Tobias Hyland          34    2    4    1   0   1/1   100.0     0/0   0.0
Tim Jordan             15    2    0    0   0   1/1   100.0     0/0   0.0
Blake LaVine           15    0    2    0   0   0/1     0.0     0/0   0.0

TEAM: FG: 13/19 (68.4%), 3PT: 1/4 (25.0%), REB: 12 (2 off, 10 def), AST: 5, TO: 3
TEAM FOULS: 2


Team_004
--------------------------------------------------------------------------------
Player                MIN  PTS  REB  AST  TO      FG   FG%      3P   3P%
--------------------------------------------------------------------------------
Jabari Wade            34    8    0    2   0   3/3   100.0     0/0   0.0
Anthony Lillard        34    7    1    1   0   3/4    75.0     0/0   0.0
Karl Reaves            21    6    0    0   0   2/2   100.0     0/0   0.0
Kristaps Green         12    4    0    0   0   1/2    50.0     0/0   0.0
Dwyane Irving          36    3    3    3   0   1/4    25.0     0/0   0.0
Russell Barnes         15    2    2    0   0   1/3    33.3     0/0   0.0
Draymond Fox           36    0    0    2   0   0/2     0.0     0/0   0.0
Shai Beal              15    0    0    0   0   0/1     0.0     0/0   0.0

TEAM: FG: 11/21 (52.4%), 3PT: 6/14 (42.9%), REB: 6 (0 off, 6 def), AST: 8, TO: 1
TEAM FOULS: 8 [Team_019 in BONUS]

================================================================================

================================================================================
                               FULL GAME COMPLETE                               
================================================================================

FINAL SCORE: Team_019 101, Team_004 117

SCORING BY QUARTER:
--------------------------------------------------------------------------------
Team                     Q1     Q2     Q3     Q4    FINAL
--------------------------------------------------------------------------------
Team_019                 29     22     20     30      101
Team_004                 23     32     32     30      117
--------------------------------------------------------------------------------

FULL GAME BOX SCORE:
================================================================================

Team_019
--------------------------------------------------------------------------------
Player                MIN  PTS  REB  AST  TO      FG   FG%      3P   3P%      FT STL BLK
--------------------------------------------------------------------------------
Brandon James          36   12    0    3   0   5/12   41.7   2/6    33.3   1/2     1   0
D'Angelo Randle        34   16    5    4   2   4/9    44.4   0/2     0.0   4/4     0   0
Tobias Hyland          34    5    8    2   3   2/7    28.6   1/2    50.0   3/4     1   0
DeMar James            34    8   12    3   1   4/7    57.1   0/0     0.0   0/1     2   0
Rudy Giddey            27   17    0    0   2   9/14   64.3   4/6    66.7   0/0     1   0
Gary Ginobili          21    9    0    2   1   4/6    66.7   1/2    50.0   2/3     2   0
Blake LaVine           15   10    3    2   0   4/5    80.0   1/1   100.0   5/5     0   0
Shai Ingram            15   11    6    1   2   4/5    80.0   0/0     0.0   3/3     1   0
Tim Jordan             15    2    1    1   0   0/2     0.0   0/0     0.0   2/2     0   0
Jalen Turner           12    6    0    0   1   3/6    50.0   1/1   100.0   2/3     0   0

TEAM: FG: 41/75 (54.7%), 3PT: 10/20 (50.0%), REB: 37 (11 off, 26 def), AST: 18, TO: 12


Team_004
--------------------------------------------------------------------------------
Player                MIN  PTS  REB  AST  TO      FG   FG%      3P   3P%      FT STL BLK
--------------------------------------------------------------------------------
Dwyane Irving          36   19   13    5   1   7/13   53.8   3/6    50.0   6/7     0   0
Draymond Fox           36    6   12    3   1   2/8    25.0   2/4    50.0   0/0     1   0
Jabari Wade            34   18    0    6   3   6/9    66.7   4/5    80.0   2/2     0   0
Anthony Lillard        34   20    6    2   1   9/11   81.8   1/2    50.0   5/6     1   1
Michael Curry          27    7    0    3   2   3/5    60.0   2/3    66.7   1/2     0   0
Karl Reaves            21    6    0    1   2   3/5    60.0   2/3    66.7   0/0     0   0
Russell Barnes         15   16    5    1   0   5/7    71.4   3/5    60.0   3/4     0   1
Shai Beal              15   10    2    1   1   5/6    83.3   1/1   100.0   0/0     1   0
Kristaps Green         12    8    0    1   0   3/4    75.0   1/2    50.0   3/3     0   0
Michael Sabonis        12    4    4    1   1   1/1   100.0   0/0     0.0   2/3     0   0

TEAM: FG: 46/72 (63.9%), 3PT: 19/31 (61.3%), REB: 40 (8 off, 32 def), AST: 24, TO: 12

================================================================================
