================================================================================
                        FULL GAME - Team_049 vs Team_063                        
================================================================================

================================================================================
                       1ST QUARTER - Team_049 vs Team_063                       
================================================================================

[12:00] Team_049 possession (Score: 0-0)
Shai Mobley drives, Tyler Harris stays with him. Shai Mobley attempts a Layup. Contested by Tyler Harris (4.7 feet, MAN). SHAI MOBLEY MAKES IT!
Score: 2-0

[11:47] Team_063 possession (Score: 2-0)
Tyler Harris drives and kicks out. Malcolm Quickley attempts a 3Pt. Contested by Ja Oladipo (4.2 feet, MAN). MALCOLM QUICKLEY MAKES IT! Assist: Bradley Davis
Score: 2-3

[11:33] Team_049 possession (Score: 2-3)
Shai Mobley drives, Tyler Harris stays with him. Shai Mobley attempts a Layup. Contested by Tyler Harris (4.7 feet, ZONE). Shai Mobley misses. Rebound secured by Malcolm Quickley.

[11:19] Team_063 possession (Score: 2-3)
Malcolm Quickley attempts a 3Pt. Contested by Ja Oladipo (4.0 feet, MAN). Malcolm Quickley misses. Rebound secured by De'Aaron Allen.

[11:05] Team_049 possession (Score: 2-3)
FOUL! Offensive foul on De'Aaron Allen! Dirk Reaves drew the charge! [Team fouls: 1] (De'Aaron Allen: 1 personal fouls) TURNOVER! (dead ball)

[10:52] Team_063 possession (Score: 2-3)
FOUL! Reach-in foul on De'Aaron Allen during the drive. [Team fouls: 2] No free throws, side out. (De'Aaron Allen: 2 personal fouls)

[10:35] Team_063 possession (Score: 2-3)
Terry Reaves drives and kicks out. Terry Reaves attempts a 3Pt. Contested by Jimmy Griffin (4.7 feet, MAN). Terry Reaves misses. Rebound secured by Jimmy Griffin.

[10:21] Team_049 possession (Score: 2-3)
Jimmy Griffin attempts a 3Pt. Contested by Malcolm Quickley (3.6 feet, ZONE). Jimmy Griffin misses. Rebound secured by Tyler Harris.

[10:02] Team_063 possession (Score: 2-3)
FOUL! Reach-in foul on De'Aaron Allen during the drive. [Team fouls: 3] No free throws, side out. (De'Aaron Allen: 3 personal fouls)

[09:48] Team_063 possession (Score: 2-3)
Bradley Davis attempts a Midrange. Contested by Ja Oladipo (4.5 feet, ZONE). Bradley Davis misses. Rebound secured by Shai Mobley.

[09:34] Team_049 possession (Score: 2-3)
Ja Oladipo attempts a 3Pt. Contested by Malcolm Quickley (3.7 feet, ZONE). Ja Oladipo misses. FOUL! Loose ball foul on Dirk Reaves during the rebound battle. [Team fouls: 1] No free throws, side out. (Dirk Reaves: 1 personal fouls)

[09:18] Team_049 possession (Score: 2-3)
De'Aaron Allen attempts a Midrange. Contested by Dirk Reaves (3.5 feet, MAN). De'Aaron Allen misses. Rebound secured by Tyler Harris.

[09:01] Team_063 possession (Score: 2-3)
Tyler Harris drives, De'Aaron Allen stays with him. Tyler Harris attempts a Dunk. Contested by De'Aaron Allen (4.2 feet, ZONE). TYLER HARRIS MAKES IT!
Score: 2-5

[08:44] Team_049 possession (Score: 2-5)
Shai Mobley drives, picks up Tyler Harris. Help arrives from Malcolm Quickley! Shai Mobley attempts a Dunk. Contested by Malcolm Quickley (4.7 feet, ZONE). SHAI MOBLEY MAKES IT! Assist: De'Aaron Allen
Score: 4-5

[08:32] Team_063 possession (Score: 4-5)
Tyler Harris drives to the basket... Tyler Harris throws a bad pass! Stolen by Shai Mobley! TURNOVER! (live ball)

[08:21] Team_049 possession (Score: 4-5)
De'Aaron Allen attempts a Layup. Contested by Tyler Harris (4.2 feet, ZONE). DE'AARON ALLEN MAKES IT!
Score: 6-5

[08:11] Team_063 possession (Score: 6-5)
Tyler Harris attempts a Midrange. Contested by Shai Mobley (4.2 feet, MAN). TYLER HARRIS MAKES IT!
Score: 6-7

[07:57] Team_049 possession (Score: 6-7)
Jimmy Griffin drives and kicks out. Shai Mobley attempts a 3Pt. Contested by Malcolm Quickley (3.5 feet, ZONE). Shai Mobley misses. Rebound secured by Malcolm Quickley.

[07:42] Team_063 possession (Score: 6-7)
Malcolm Quickley attempts a Midrange. Contested by Jimmy Griffin (4.5 feet, ZONE). MALCOLM QUICKLEY MAKES IT!
Score: 6-9

[07:27] Team_049 possession (Score: 6-9)
Ja Oladipo attempts a Layup. BLOCKED BY TYLER HARRIS! Ball deflects out of bounds off Ja Oladipo.

[07:13] Team_063 possession (Score: 6-9)
Tyler Harris attempts a Dunk. BLOCKED BY SHAI MOBLEY! Ball is loose! Rebound secured by Shai Mobley.

[07:01] Team_049 possession (Score: 6-9)
Jimmy Griffin attempts a 3Pt. Contested by Terry Reaves (4.7 feet, MAN). Jimmy Griffin misses. Offensive rebound by Shai Mobley! Shai Mobley's putback is no good. Rebound secured by Tyler Harris.

[06:45] Team_063 possession (Score: 6-9)
Bradley Davis drives, picks up De'Aaron Allen. Help arrives from Ja Oladipo! Bradley Davis attempts a Dunk. Contested by Ja Oladipo (4.5 feet, ZONE). BRADLEY DAVIS MAKES IT!
Score: 6-11

[06:28] Team_049 possession (Score: 6-11)
De'Aaron Allen drives and kicks out. Jimmy Griffin attempts a Midrange. Contested by Terry Reaves (4.6 feet, MAN). Jimmy Griffin misses. Rebound secured by Dirk Reaves.

[06:13] Team_063 possession (Score: 6-11)
Malcolm Quickley attempts a Layup. Contested by Ja Oladipo (4.0 feet, MAN). Malcolm Quickley misses. Rebound secured by Jimmy Griffin.

[05:58] Team_049 possession (Score: 6-11)
De'Aaron Allen attempts a 3Pt. Contested by Malcolm Quickley (3.3 feet, ZONE). DE'AARON ALLEN MAKES IT!
Score: 9-11

[05:44] Team_063 possession (Score: 9-11)
Tyler Harris attempts a Midrange. Contested by Shai Mobley (4.2 feet, MAN). Tyler Harris misses. Rebound secured by Jimmy Griffin.

[05:30] Team_049 possession (Score: 9-11)
Jimmy Griffin attempts a 3Pt. Contested by Terry Reaves (4.7 feet, MAN). Jimmy Griffin misses. Offensive rebound by Jimmy Griffin! Jimmy Griffin kicks it out.

[05:14] Team_049 possession (Score: 9-11)
Shai Bird attempts a Midrange. Contested by Bradley Davis (5.3 feet, MAN). SHAI BIRD MAKES IT!
Score: 11-11

[04:59] Team_063 possession (Score: 11-11)
Malcolm Quickley attempts a 3Pt. Contested by Ja Oladipo (4.1 feet, ZONE). Malcolm Quickley misses. Rebound secured by De'Aaron Allen.

[04:44] Team_049 possession (Score: 11-11)
Shai Mobley drives and kicks out. Jimmy Griffin attempts a 3Pt. Contested by Terry Reaves (4.7 feet, MAN). Jimmy Griffin misses. Rebound secured by Dirk Reaves.

[04:29] Team_063 possession (Score: 11-11)
Malcolm Quickley attempts a Layup. BLOCKED BY JIMMY GRIFFIN! Ball is loose! Rebound secured by Jimmy Griffin.

[04:14] Team_049 possession (Score: 11-11)
Ja Oladipo attempts a 3Pt. Contested by Malcolm Quickley (3.8 feet, ZONE). Ja Oladipo misses. Rebound secured by Dirk Reaves.

[03:59] Team_063 possession (Score: 11-11)
Malcolm Quickley attempts a 3Pt. Contested by Ja Oladipo (4.1 feet, ZONE). MALCOLM QUICKLEY MAKES IT! Assist: Dirk Reaves
Score: 11-14

[03:41] Team_049 possession (Score: 11-14)
De'Aaron Allen attempts a Midrange. Contested by Terry Reaves (4.6 feet, ZONE). De'Aaron Allen misses. Rebound secured by Malcolm Quickley.

[03:28] Team_063 possession (Score: 11-14)
Bradley Davis attempts a 3Pt. Contested by Shai Bird (4.3 feet, MAN). Bradley Davis misses. Rebound secured by Jimmy Griffin.

[03:14] Team_049 possession (Score: 11-14)
Shai Bird attempts a Midrange. Contested by Malcolm Quickley (4.1 feet, ZONE). Shai Bird misses. Rebound secured by Malcolm Quickley.

[02:56] Team_063 possession (Score: 11-14)
Terry Reaves attempts a Midrange. Contested by Shai Mobley (4.7 feet, ZONE). Terry Reaves misses. Rebound secured by Jimmy Griffin.

[02:42] Team_049 possession (Score: 11-14)
FOUL! Shooting foul on Dirk Reaves. De'Aaron Allen to the line for 3 free throws. [Team fouls: 2] (Dirk Reaves: 2 personal fouls)   FT 1/3: GOOD   FT 2/3: GOOD   FT 3/3: GOOD De'Aaron Allen makes 3/3 from the line.
Score: 14-14

[02:30] Team_063 possession (Score: 14-14)
Tyler Harris attempts a Layup. Contested by Shai Mobley (4.4 feet, MAN). Tyler Harris misses. Offensive rebound by Dirk Reaves! Dirk Reaves kicks it out.

[02:15] Team_063 possession (Score: 14-14)
Terry Reaves attempts a 3Pt. Contested by Ja Oladipo (4.8 feet, ZONE). TERRY REAVES MAKES IT! Assist: Malcolm Quickley
Score: 14-17

[01:58] Team_049 possession (Score: 14-17)
De'Aaron Allen attempts a 3Pt. Contested by Dirk Reaves (3.9 feet, MAN). De'Aaron Allen misses. Offensive rebound by Shai Mobley! Shai Mobley's putback is no good. Rebound secured by Dirk Reaves.

[01:41] Team_063 possession (Score: 14-17)
Malcolm Quickley drives, picks up De'Aaron Allen. Help arrives from Ja Oladipo! Malcolm Quickley attempts a Layup. Contested by Ja Oladipo (4.3 feet, ZONE). Malcolm Quickley misses. Rebound secured by De'Aaron Allen.

[01:26] Team_049 possession (Score: 14-17)
Ja Oladipo attempts a 3Pt. Contested by Terry Reaves (5.2 feet, ZONE). JA OLADIPO MAKES IT! Assist: Jimmy Griffin
Score: 17-17

[01:11] Team_063 possession (Score: 17-17)
Malcolm Quickley attempts a Midrange. Contested by Ja Oladipo (4.4 feet, MAN). MALCOLM QUICKLEY MAKES IT!
Score: 17-19

[00:55] Team_049 possession (Score: 17-19)
De'Aaron Allen drives, picks up Tyler Harris. Help arrives from Malcolm Quickley! De'Aaron Allen attempts a Dunk. Contested by Malcolm Quickley (4.7 feet, ZONE). DE'AARON ALLEN MAKES IT! Assist: Jimmy Griffin
Score: 19-19

[00:41] Team_063 possession (Score: 19-19)
Malcolm Quickley drives and kicks out. Terry Reaves attempts a Midrange. Contested by Jimmy Griffin (5.1 feet, MAN). TERRY REAVES MAKES IT!
Score: 19-21

[00:27] Team_049 possession (Score: 19-21)
Shai Mobley drives, Tyler Harris stays with him. Shai Mobley attempts a Layup. Contested by Tyler Harris (5.2 feet, MAN). SHAI MOBLEY MAKES IT!
Score: 21-21

[00:14] Team_063 possession (Score: 21-21)
FOUL! Shooting foul on De'Aaron Allen. Dirk Reaves to the line for 3 free throws. [Team fouls: 4] (De'Aaron Allen: 4 personal fouls)   FT 1/3: GOOD   FT 2/3: GOOD   FT 3/3: GOOD Dirk Reaves makes 3/3 from the line.
Score: 21-24

================================================================================
                              1ST QUARTER COMPLETE                              
================================================================================

1ST QUARTER SCORE: Team_049 21, Team_063 24

BOX SCORE:
================================================================================

Team_049
--------------------------------------------------------------------------------
Player                MIN  PTS  REB  AST  TO      FG   FG%      3P   3P%
--------------------------------------------------------------------------------
De'Aaron Allen         12   10    3    1   0   4/8    50.0     0/0   0.0
Shai Mobley            12    6    3    0   0   3/5    60.0     0/0   0.0
Ja Oladipo             12    3    0    0   0   1/3    33.3     0/0   0.0
Shai Bird              12    2    0    0   0   1/2    50.0     0/0   0.0
Jimmy Griffin          12    0    7    2   0   0/3     0.0     0/0   0.0

TEAM: FG: 9/21 (42.9%), 3PT: 3/7 (42.9%), REB: 15 (4 off, 11 def), AST: 3, TO: 1
TEAM FOULS: 4


Team_063
--------------------------------------------------------------------------------
Player                MIN  PTS  REB  AST  TO      FG   FG%      3P   3P%
--------------------------------------------------------------------------------
Malcolm Quickley       12   10    4    1   0   4/9    44.4     0/0   0.0
Terry Reaves           12    5    0    0   0   2/4    50.0     0/0   0.0
Tyler Harris           12    4    3    0   0   2/4    50.0     0/0   0.0
Dirk Reaves            12    3    5    1   0   1/1   100.0     0/0   0.0
Bradley Davis          12    2    0    1   0   1/3    33.3     0/0   0.0

TEAM: FG: 10/21 (47.6%), 3PT: 3/6 (50.0%), REB: 10 (1 off, 9 def), AST: 3, TO: 1
TEAM FOULS: 2

================================================================================

================================================================================
                       2ND QUARTER - Team_049 vs Team_063                       
================================================================================

[12:00] Team_049 possession (Score: 21-24)
Shai Bird makes the Layup and draws the foul on Bradley Davis! And-1! Shai Bird to the line for 1. [Team fouls: 1] (Bradley Davis: 1 personal fouls)   FT 1/1: GOOD Shai Bird makes 1/1 from the line.
Score: 24-24

[11:47] Team_063 possession (Score: 24-24)
FOUL! Shooting foul on Shai Bird. Bradley Davis to the line for 2 free throws. [Team fouls: 1] (Shai Bird: 1 personal fouls)   FT 1/2: GOOD   FT 2/2: GOOD Bradley Davis makes 2/2 from the line.
Score: 24-26

[11:35] Team_049 possession (Score: 24-26)
Jimmy Griffin attempts a 3Pt. Contested by Bradley Davis (5.2 feet, ZONE). Jimmy Griffin misses. Rebound secured by Dirk Reaves.

[11:20] Team_063 possession (Score: 24-26)
FOUL! Offensive foul on Dirk Reaves! De'Aaron Allen drew the charge! [Team fouls: 2] (Dirk Reaves: 1 personal fouls) TURNOVER! (dead ball)

[11:04] Team_049 possession (Score: 24-26)
Jimmy Griffin attempts a 3Pt. Contested by Terry Reaves (5.0 feet, MAN). Jimmy Griffin misses. Rebound secured by Tyler Harris.

[10:51] Team_063 possession (Score: 24-26)
Tyler Harris drives, picks up De'Aaron Allen. Help arrives from Ja Oladipo! Tyler Harris attempts a Dunk. Contested by Ja Oladipo (4.5 feet, ZONE). TYLER HARRIS MAKES IT!
Score: 24-28

[10:38] Team_049 possession (Score: 24-28)
Shai Mobley throws a bad pass! Stolen by Tyler Harris! TURNOVER! (live ball)

[10:23] Team_063 possession (Score: 24-28)
Bradley Davis attempts a 3Pt. Contested by Shai Bird (4.7 feet, MAN). Bradley Davis misses. Rebound secured by De'Aaron Allen.

[10:08] Team_049 possession (Score: 24-28)
Shai Bird attempts a Layup. BLOCKED BY TYLER HARRIS! Ball is loose! Rebound secured by Malcolm Quickley.

[09:50] Team_063 possession (Score: 24-28)
Tyler Harris attempts a Midrange. Contested by Shai Mobley (4.6 feet, MAN). TYLER HARRIS MAKES IT!
Score: 24-30

[09:34] Team_049 possession (Score: 24-30)
Shai Bird drives, Bradley Davis stays with him. Shai Bird attempts a Dunk. Contested by Bradley Davis (5.7 feet, MAN). SHAI BIRD MAKES IT! Assist: Shai Mobley
Score: 26-30

[09:24] Team_063 possession (Score: 26-30)
Malcolm Quickley attempts a 3Pt. Contested by Ja Oladipo (4.6 feet, MAN). Malcolm Quickley misses. Rebound secured by Jimmy Griffin.

[09:09] Team_049 possession (Score: 26-30)
Shai Mobley drives and kicks out. Shai Mobley attempts a Midrange. Contested by Malcolm Quickley (4.2 feet, ZONE). SHAI MOBLEY MAKES IT! Assist: De'Aaron Allen
Score: 28-30

[08:50] Team_063 possession (Score: 28-30)
Tyler Harris attempts a Layup. Contested by De'Aaron Allen (4.7 feet, ZONE). TYLER HARRIS MAKES IT! Assist: Bradley Davis
Score: 28-32

[08:40] Team_049 possession (Score: 28-32)
Shai Bird drives, Bradley Davis stays with him. Shai Bird attempts a Dunk. Contested by Bradley Davis (5.8 feet, MAN). SHAI BIRD MAKES IT!
Score: 30-32

[08:28] Team_063 possession (Score: 30-32)
Malcolm Quickley attempts a Layup. Contested by Ja Oladipo (4.7 feet, MAN). MALCOLM QUICKLEY MAKES IT! Assist: Tyler Harris
Score: 30-34

[08:14] Team_049 possession (Score: 30-34)
Jimmy Griffin attempts a Midrange. Contested by Tyler Harris (5.2 feet, ZONE). Jimmy Griffin misses. Rebound secured by Malcolm Quickley.

[08:00] Team_063 possession (Score: 30-34)
Terry Reaves attempts a 3Pt. Contested by Ja Oladipo (5.2 feet, ZONE). TERRY REAVES MAKES IT! Assist: Tyler Harris
Score: 30-37

[07:46] Team_049 possession (Score: 30-37)
Ja Oladipo drives, picks up Malcolm Quickley. Help arrives from Bradley Davis! Ja Oladipo attempts a Dunk. Contested by Bradley Davis (4.5 feet, MAN). Ja Oladipo misses. Offensive rebound by De'Aaron Allen! De'Aaron Allen kicks it out.

[07:34] Team_049 possession (Score: 30-37)
Jimmy Griffin attempts a Layup. BLOCKED BY TYLER HARRIS! Ball is loose! Offensive rebound by Shai Mobley! Shai Mobley kicks it out.

[07:20] Team_049 possession (Score: 30-37)
Jimmy Griffin attempts a 3Pt. Contested by Malcolm Quickley (4.4 feet, ZONE). Jimmy Griffin misses. Rebound secured by Malcolm Quickley.

[07:05] Team_063 possession (Score: 30-37)
Bradley Davis drives, De'Aaron Allen stays with him. Bradley Davis attempts a Layup. Contested by De'Aaron Allen (5.2 feet, ZONE). BRADLEY DAVIS MAKES IT! Assist: Terry Reaves
Score: 30-39

[06:47] Team_049 possession (Score: 30-39)
De'Aaron Allen drives and kicks out. Ja Oladipo attempts a 3Pt. Contested by Malcolm Quickley (4.6 feet, ZONE). JA OLADIPO MAKES IT! Assist: De'Aaron Allen
Score: 33-39

[06:32] Team_063 possession (Score: 33-39)
FOUL! Shooting foul on De'Aaron Allen. Dirk Reaves to the line for 2 free throws. [Team fouls: 2] (De'Aaron Allen: 1 personal fouls)   FT 1/2: GOOD   FT 2/2: GOOD Dirk Reaves makes 2/2 from the line.
Score: 33-41

[06:13] Team_049 possession (Score: 33-41)
Shai Bird attempts a Midrange. Wide open! Bradley Davis is 6.0 feet away. [MAN] SHAI BIRD MAKES IT!
Score: 35-41

[06:00] Team_063 possession (Score: 35-41)
Tyler Harris attempts a Layup. Contested by Shai Mobley (5.1 feet, MAN). TYLER HARRIS MAKES IT! Assist: Malcolm Quickley
Score: 35-43

[05:47] Team_049 possession (Score: 35-43)
De'Aaron Allen drives and kicks out. Ja Oladipo attempts a 3Pt. Contested by Malcolm Quickley (4.8 feet, ZONE). Ja Oladipo misses. Rebound secured by Dirk Reaves.

[05:29] Team_063 possession (Score: 35-43)
Bradley Davis attempts a Midrange. Contested by Ja Oladipo (5.5 feet, ZONE). Bradley Davis misses. Rebound secured by Shai Mobley.

[05:10] Team_049 possession (Score: 35-43)
Jimmy Griffin attempts a Midrange. Contested by Terry Reaves (5.7 feet, MAN). JIMMY GRIFFIN MAKES IT!
Score: 37-43

[04:54] Team_063 possession (Score: 37-43)
Terry Reaves attempts a Midrange. Contested by Jimmy Griffin (6.0 feet, MAN). TERRY REAVES MAKES IT! Assist: Malcolm Quickley
Score: 37-45

[04:42] Team_049 possession (Score: 37-45)
De'Aaron Allen attempts a 3Pt. Contested by Malcolm Quickley (4.6 feet, ZONE). DE'AARON ALLEN MAKES IT! Assist: Shai Mobley
Score: 40-45

[04:26] Team_063 possession (Score: 40-45)
Tyler Harris attempts a Layup. Contested by Shai Mobley (5.3 feet, MAN). TYLER HARRIS MAKES IT!
Score: 40-47

[04:13] Team_049 possession (Score: 40-47)
Ja Oladipo drives, Malcolm Quickley stays with him. Ja Oladipo attempts a Dunk. Contested by Malcolm Quickley (5.0 feet, MAN). JA OLADIPO MAKES IT! Assist: De'Aaron Allen
Score: 42-47

[04:02] Team_063 possession (Score: 42-47)
Bradley Davis drives, Shai Bird stays with him. Bradley Davis attempts a Dunk. Contested by Shai Bird (5.6 feet, MAN). BRADLEY DAVIS MAKES IT! Assist: Malcolm Quickley
Score: 42-49

[03:48] Team_049 possession (Score: 42-49)
Jimmy Griffin makes the Dunk and draws the foul on Tyler Harris! And-1! Jimmy Griffin to the line for 1. [Team fouls: 3] (Tyler Harris: 1 personal fouls)   FT 1/1: GOOD Jimmy Griffin makes 1/1 from the line.
Score: 45-49

[03:35] Team_063 possession (Score: 45-49)
Bradley Davis attempts a Midrange. Contested by De'Aaron Allen (5.7 feet, ZONE). Bradley Davis misses. Rebound secured by Shai Mobley.

[03:19] Team_049 possession (Score: 45-49)
Shai Bird drives and kicks out. Shai Bird attempts a Midrange. Wide open! Terry Reaves is 6.2 feet away. [ZONE] Shai Bird misses. Rebound secured by Tyler Harris.

[03:05] Team_063 possession (Score: 45-49)
Dirk Reaves makes the Dunk and draws the foul on Ja Oladipo! And-1! Dirk Reaves to the line for 1. [Team fouls: 3] (Ja Oladipo: 1 personal fouls)   FT 1/1: GOOD Dirk Reaves makes 1/1 from the line.
Score: 45-52

[02:50] Team_049 possession (Score: 45-52)
Jimmy Griffin attempts a Midrange. Wide open! Terry Reaves is 6.1 feet away. [MAN] Jimmy Griffin misses. FOUL! Loose ball foul on Dirk Reaves during the rebound battle. [Team fouls: 4] No free throws, side out. (Dirk Reaves: 2 personal fouls)

[02:33] Team_049 possession (Score: 45-52)
Shai Bird attempts a Midrange. Wide open! Bradley Davis is 6.4 feet away. [MAN] Shai Bird misses. Rebound secured by Malcolm Quickley.

[02:19] Team_063 possession (Score: 45-52)
FOUL! Shooting foul on De'Aaron Allen. Tyler Harris to the line for 2 free throws. [Team fouls: 4] (De'Aaron Allen: 2 personal fouls)   FT 1/2: MISS   FT 2/2: MISS Tyler Harris makes 0/2 from the line. Rebound secured by Shai Mobley.

[02:08] Team_049 possession (Score: 45-52)
De'Aaron Allen drives to the basket... De'Aaron Allen throws a bad pass! Stolen by Tyler Harris! TURNOVER! (live ball)

[01:57] Team_063 possession (Score: 45-52)
Malcolm Quickley attempts a Layup. Contested by Ja Oladipo (5.7 feet, MAN). MALCOLM QUICKLEY MAKES IT!
Score: 45-54

[01:39] Team_049 possession (Score: 45-54)
Shai Mobley attempts a Midrange. Wide open! Tyler Harris is 6.4 feet away. [MAN] SHAI MOBLEY MAKES IT! Assist: Ja Oladipo
Score: 47-54

[01:25] Team_063 possession (Score: 47-54)
Bradley Davis attempts a 3Pt. Wide open! Jimmy Griffin is 6.5 feet away. [ZONE] BRADLEY DAVIS MAKES IT! Assist: Dirk Reaves
Score: 47-57

[01:06] Team_049 possession (Score: 47-57)
Shai Bird drives and kicks out. Jimmy Griffin attempts a 3Pt. Wide open! Terry Reaves is 6.6 feet away. [MAN] JIMMY GRIFFIN MAKES IT! Assist: Ja Oladipo
Score: 50-57

[00:55] Team_063 possession (Score: 50-57)
Tyler Harris attempts a 3Pt. Contested by Ja Oladipo (5.9 feet, ZONE). Tyler Harris misses. Offensive rebound by Malcolm Quickley! Malcolm Quickley kicks it out.

[00:39] Team_063 possession (Score: 50-57)
Terry Reaves attempts a 3Pt. Wide open! Ja Oladipo is 6.2 feet away. [ZONE] Terry Reaves misses. Rebound secured by De'Aaron Allen.

[00:25] Team_049 possession (Score: 50-57)
Shai Mobley drives, picks up Tyler Harris. Help arrives from Malcolm Quickley! Shai Mobley attempts a Layup. Wide open! Malcolm Quickley is 6.6 feet away. [MAN] SHAI MOBLEY MAKES IT! Assist: Jimmy Griffin
Score: 52-57

[00:13] Team_063 possession (Score: 52-57)
Dirk Reaves drives to the basket... Dirk Reaves loses control! Ball rolls out of bounds! TURNOVER! (dead ball)

[00:13] Substitution (Team_049): Shai Bird OUT → Shaquille Lillard IN (stamina_rule2)

[00:13] Substitution (Team_049): Ja Oladipo OUT → Shai Jordan IN (stamina_rule2)

[00:13] Substitution (Team_049): Jimmy Griffin OUT → Desmond Towns IN (stamina_rule2)

[00:13] Substitution (Team_049): De'Aaron Allen OUT → Giannis Anunoby IN (stamina_rule2)

[00:13] Substitution (Team_049): Shai Mobley OUT → Miles Jackson IN (stamina_rule2)

[00:13] Substitution (Team_063): Bradley Davis OUT → DeMar Banchero IN (stamina_rule2)

[00:13] Substitution (Team_063): Malcolm Quickley OUT → Cole Durant IN (stamina_rule2)

[00:13] Substitution (Team_063): Terry Reaves OUT → Jaren James IN (stamina_rule2)

[00:13] Substitution (Team_063): Dirk Reaves OUT → Lamelo Ball IN (stamina_rule2)

[00:13] Substitution (Team_063): Tyler Harris OUT → Kyle Green IN (stamina_rule2)

================================================================================
                              2ND QUARTER COMPLETE                              
================================================================================

2ND QUARTER SCORE: Team_049 31, Team_063 33

BOX SCORE:
================================================================================

Team_049
--------------------------------------------------------------------------------
Player                MIN  PTS  REB  AST  TO      FG   FG%      3P   3P%
--------------------------------------------------------------------------------
Shai Bird              24    9    0    0   0   4/7    57.1     0/0   0.0
Jimmy Griffin          24    8    1    1   0   3/7    42.9     0/0   0.0
Shai Mobley            24    6    5    2   0   3/3   100.0     0/0   0.0
Ja Oladipo             24    5    0    2   0   2/2   100.0     0/0   0.0
De'Aaron Allen         24    3    3    3   0   1/2    50.0     0/0   0.0

TEAM: FG: 13/21 (61.9%), 3PT: 1/4 (25.0%), REB: 9 (3 off, 6 def), AST: 8, TO: 2
TEAM FOULS: 4


Team_063
--------------------------------------------------------------------------------
Player                MIN  PTS  REB  AST  TO      FG   FG%      3P   3P%
--------------------------------------------------------------------------------
Tyler Harris           24   10    2    2   0   5/6    83.3     0/0   0.0
Bradley Davis          24    9    0    1   0   4/7    57.1     0/0   0.0
Dirk Reaves            24    5    2    1   0   2/2   100.0     0/0   0.0
Terry Reaves           24    5    0    1   0   2/3    66.7     0/0   0.0
Malcolm Quickley       24    4    5    3   0   2/3    66.7     0/0   0.0

TEAM: FG: 15/21 (71.4%), 3PT: 2/5 (40.0%), REB: 9 (1 off, 8 def), AST: 8, TO: 2
TEAM FOULS: 4

================================================================================

================================================================================
                       3RD QUARTER - Team_049 vs Team_063                       
================================================================================

[12:00] Team_049 possession (Score: 52-57)
Jimmy Griffin attempts a 3Pt. Contested by Terry Reaves (4.7 feet, MAN). JIMMY GRIFFIN MAKES IT! Assist: Shai Mobley
Score: 55-57

[11:42] Team_063 possession (Score: 55-57)
Tyler Harris attempts a Midrange. Contested by Shai Mobley (4.2 feet, MAN). Tyler Harris misses. Rebound secured by De'Aaron Allen.

[11:28] Team_049 possession (Score: 55-57)
Ja Oladipo attempts a 3Pt. Contested by Malcolm Quickley (3.7 feet, ZONE). Ja Oladipo misses. Rebound secured by Malcolm Quickley.

[11:15] Team_063 possession (Score: 55-57)
Dirk Reaves attempts a 3Pt. Contested by Ja Oladipo (4.5 feet, ZONE). DIRK REAVES MAKES IT!
Score: 55-60

[11:03] Team_049 possession (Score: 55-60)
Ja Oladipo attempts a 3Pt. Contested by Malcolm Quickley (3.7 feet, ZONE). Ja Oladipo misses. Rebound secured by Malcolm Quickley.

[10:52] Team_063 possession (Score: 55-60)
Dirk Reaves attempts a Midrange. Contested by De'Aaron Allen (4.5 feet, MAN). Dirk Reaves misses. Rebound secured by Jimmy Griffin.

[10:37] Team_049 possession (Score: 55-60)
FOUL! Holding foul on Malcolm Quickley. [Team fouls: 1] No free throws, side out. (Malcolm Quickley: 1 personal fouls)

[10:23] Team_049 possession (Score: 55-60)
Shai Bird drives and kicks out. Jimmy Griffin attempts a 3Pt. Contested by Terry Reaves (4.6 feet, ZONE). Jimmy Griffin misses. Offensive rebound by Shai Mobley! Shai Mobley's putback is no good. Offensive rebound by Shai Mobley! Shai Mobley kicks it out.

[10:12] Team_049 possession (Score: 55-60)
Shai Bird attempts a Layup. Contested by Tyler Harris (4.8 feet, ZONE). SHAI BIRD MAKES IT! Assist: Jimmy Griffin
Score: 57-60

[09:55] Team_063 possession (Score: 57-60)
Malcolm Quickley attempts a 3Pt. Contested by Ja Oladipo (4.0 feet, MAN). Malcolm Quickley misses. Rebound secured by De'Aaron Allen.

[09:43] Team_049 possession (Score: 57-60)
De'Aaron Allen drives and kicks out. Shai Bird attempts a 3Pt. Contested by Bradley Davis (4.9 feet, MAN). Shai Bird misses. Offensive rebound by Jimmy Griffin! Jimmy Griffin kicks it out.

[09:28] Team_049 possession (Score: 57-60)
Ja Oladipo attempts a 3Pt. Contested by Malcolm Quickley (3.7 feet, MAN). Ja Oladipo misses. Rebound secured by Dirk Reaves.

[09:13] Team_063 possession (Score: 57-60)
Dirk Reaves throws a bad pass! Stolen by De'Aaron Allen! TURNOVER! (live ball)

[08:58] Team_049 possession (Score: 57-60)
FOUL! Shooting foul on Bradley Davis. Shai Bird to the line for 2 free throws. [Team fouls: 2] (Bradley Davis: 1 personal fouls)   FT 1/2: GOOD   FT 2/2: GOOD Shai Bird makes 2/2 from the line.
Score: 59-60

[08:43] Team_063 possession (Score: 59-60)
Malcolm Quickley attempts a 3Pt. Contested by Ja Oladipo (4.0 feet, ZONE). MALCOLM QUICKLEY MAKES IT! Assist: Bradley Davis
Score: 59-63

[08:27] Team_049 possession (Score: 59-63)
Jimmy Griffin attempts a Midrange. Contested by Terry Reaves (4.7 feet, MAN). Jimmy Griffin misses. Rebound secured by Tyler Harris.

[08:15] Team_063 possession (Score: 59-63)
Dirk Reaves throws a bad pass out of bounds! TURNOVER! (dead ball)

[08:03] Team_049 possession (Score: 59-63)
FOUL! Holding foul on Dirk Reaves. [Team fouls: 3] No free throws, side out. (Dirk Reaves: 1 personal fouls)

[07:43] Team_049 possession (Score: 59-63)
Shai Mobley attempts a Midrange. Contested by Malcolm Quickley (3.8 feet, ZONE). Shai Mobley misses. Rebound secured by Dirk Reaves.

[07:31] Team_063 possession (Score: 59-63)
Terry Reaves drives, picks up De'Aaron Allen. Help arrives from Ja Oladipo! Terry Reaves attempts a Layup. Contested by Ja Oladipo (4.6 feet, ZONE). TERRY REAVES MAKES IT! Assist: Bradley Davis
Score: 59-65

[07:18] Team_049 possession (Score: 59-65)
Shai Bird makes the Dunk and draws the foul on Tyler Harris! And-1! Shai Bird to the line for 1. [Team fouls: 4] (Tyler Harris: 1 personal fouls)   FT 1/1: GOOD Shai Bird makes 1/1 from the line.
Score: 62-65

[07:02] Team_063 possession (Score: 62-65)
Terry Reaves throws a bad pass! Stolen by Jimmy Griffin! TURNOVER! (live ball)

[06:48] Team_049 possession (Score: 62-65)
De'Aaron Allen attempts a Midrange. Contested by Dirk Reaves (3.5 feet, MAN). DE'AARON ALLEN MAKES IT!
Score: 64-65

[06:34] Team_063 possession (Score: 64-65)
Dirk Reaves attempts a 3Pt. Contested by Shai Bird (4.1 feet, ZONE). DIRK REAVES MAKES IT! Assist: Terry Reaves
Score: 64-68

[06:20] Team_049 possession (Score: 64-68)
Shai Bird attempts a 3Pt. Contested by Bradley Davis (5.3 feet, MAN). Shai Bird misses. Rebound secured by Tyler Harris.

[06:06] Team_063 possession (Score: 64-68)
Terry Reaves attempts a Midrange. Contested by Jimmy Griffin (5.0 feet, ZONE). Terry Reaves misses. Rebound secured by Jimmy Griffin.

[05:51] Team_049 possession (Score: 64-68)
Jimmy Griffin loses the ball! Stripped by Terry Reaves! TURNOVER! (live ball)

[05:39] Team_063 possession (Score: 64-68)
Dirk Reaves attempts a Layup. Contested by De'Aaron Allen (4.5 feet, ZONE). DIRK REAVES MAKES IT! Assist: Malcolm Quickley
Score: 64-70

[05:24] Team_049 possession (Score: 64-70)
Ja Oladipo attempts a Midrange. Contested by Malcolm Quickley (3.7 feet, MAN). JA OLADIPO MAKES IT!
Score: 66-70

[05:13] Team_063 possession (Score: 66-70)
Tyler Harris throws a bad pass out of bounds! TURNOVER! (dead ball)

[04:59] Team_049 possession (Score: 66-70)
Jimmy Griffin attempts a 3Pt. Contested by Dirk Reaves (3.8 feet, ZONE). Jimmy Griffin misses. Rebound secured by Malcolm Quickley.

[04:44] Team_063 possession (Score: 66-70)
Bradley Davis attempts a Layup. Contested by De'Aaron Allen (4.5 feet, ZONE). BRADLEY DAVIS MAKES IT! Assist: Terry Reaves
Score: 66-72

[04:26] Team_049 possession (Score: 66-72)
Shai Mobley drives to the basket... Shai Mobley throws a bad pass out of bounds! TURNOVER! (dead ball)

[04:12] Team_063 possession (Score: 66-72)
Terry Reaves attempts a 3Pt. Contested by Ja Oladipo (4.6 feet, ZONE). Terry Reaves misses. Rebound secured by Shai Mobley.

[03:58] Team_049 possession (Score: 66-72)
Ja Oladipo attempts a 3Pt. Contested by Malcolm Quickley (3.9 feet, MAN). Ja Oladipo misses. Rebound secured by Dirk Reaves.

[03:44] Team_063 possession (Score: 66-72)
Malcolm Quickley attempts a Layup. BLOCKED BY DE'AARON ALLEN! Ball deflects out of bounds off Malcolm Quickley.

[03:28] Team_049 possession (Score: 66-72)
FOUL! Shooting foul on Tyler Harris. Ja Oladipo to the line for 2 free throws. [BONUS: 5 team fouls] (Tyler Harris: 2 personal fouls)   FT 1/2: GOOD   FT 2/2: GOOD Ja Oladipo makes 2/2 from the line.
Score: 68-72

[03:13] Team_063 possession (Score: 68-72)
Terry Reaves makes the 3Pt and draws the foul on Jimmy Griffin! And-1! Terry Reaves to the line for 1. [Team fouls: 1] (Jimmy Griffin: 1 personal fouls)   FT 1/1: GOOD Terry Reaves makes 1/1 from the line.
Score: 68-76

[03:01] Team_049 possession (Score: 68-76)
Shai Mobley drives to the basket... Shai Mobley loses control! Ball rolls out of bounds! TURNOVER! (dead ball)

[03:01] Substitution (Team_049): Shai Bird OUT → Shaquille Lillard IN (stamina_rule2)

[03:01] Substitution (Team_063): Dirk Reaves OUT → Lamelo Ball IN (stamina_rule2)

[03:01] Substitution (Team_063): Tyler Harris OUT → Kyle Green IN (stamina_rule2)

[02:47] Team_063 possession (Score: 68-76)
Lamelo Ball drives, picks up De'Aaron Allen. Help arrives from Ja Oladipo! Lamelo Ball attempts a Dunk. Contested by Ja Oladipo (4.8 feet, MAN). LAMELO BALL MAKES IT! Assist: Malcolm Quickley
Score: 68-78

[02:33] Team_049 possession (Score: 68-78)
Ja Oladipo attempts a 3Pt. Contested by Malcolm Quickley (4.0 feet, MAN). Ja Oladipo misses. Rebound secured by Kyle Green.

[02:22] Team_063 possession (Score: 68-78)
Bradley Davis attempts a 3Pt. Contested by Ja Oladipo (4.7 feet, ZONE). Bradley Davis misses. Offensive rebound by Lamelo Ball! Lamelo Ball kicks it out.

[02:03] Team_063 possession (Score: 68-78)
Bradley Davis drives and kicks out. Terry Reaves attempts a Midrange. Contested by Jimmy Griffin (5.0 feet, MAN). TERRY REAVES MAKES IT! Assist: Lamelo Ball
Score: 68-80

[01:50] Team_049 possession (Score: 68-80)
Shai Mobley drives to the basket... Shai Mobley commits a violation (traveling/carry)! TURNOVER! (dead ball)

[01:50] Substitution (Team_049): Ja Oladipo OUT → Shai Jordan IN (stamina_rule2)

[01:50] Substitution (Team_049): Jimmy Griffin OUT → Desmond Towns IN (stamina_rule2)

[01:50] Substitution (Team_049): De'Aaron Allen OUT → Giannis Anunoby IN (stamina_rule2)

[01:50] Substitution (Team_049): Shai Mobley OUT → Miles Jackson IN (stamina_rule2)

[01:50] Substitution (Team_063): Bradley Davis OUT → DeMar Banchero IN (stamina_rule2)

[01:50] Substitution (Team_063): Malcolm Quickley OUT → Cole Durant IN (stamina_rule2)

[01:50] Substitution (Team_063): Terry Reaves OUT → Jaren James IN (stamina_rule2)

[01:38] Team_063 possession (Score: 68-80)
Lamelo Ball attempts a 3Pt. Contested by Shaquille Lillard (4.8 feet, ZONE). Lamelo Ball misses. Rebound secured by Giannis Anunoby.

[01:22] Team_049 possession (Score: 68-80)
Giannis Anunoby attempts a 3Pt. Contested by DeMar Banchero (3.9 feet, ZONE). GIANNIS ANUNOBY MAKES IT! Assist: Shaquille Lillard
Score: 71-80

[01:11] Team_063 possession (Score: 71-80)
Cole Durant drives, picks up Miles Jackson. Help arrives from Shai Jordan! Cole Durant attempts a Layup. Contested by Shai Jordan (3.8 feet, ZONE). COLE DURANT MAKES IT!
Score: 71-82

[00:55] Team_049 possession (Score: 71-82)
Giannis Anunoby drives, picks up Kyle Green. Help arrives from Cole Durant! Giannis Anunoby attempts a Layup. Contested by Cole Durant (4.4 feet, ZONE). Giannis Anunoby misses. Rebound secured by Cole Durant.

[00:38] Team_063 possession (Score: 71-82)
Lamelo Ball attempts a Midrange. Contested by Shaquille Lillard (4.8 feet, ZONE). Lamelo Ball misses. Rebound secured by Giannis Anunoby.

[00:21] Team_049 possession (Score: 71-82)
FOUL! Reach-in foul on Kyle Green during the drive. [IN THE BONUS! 6 team fouls] Miles Jackson to the line for 2 free throws. (Kyle Green: 1 personal fouls)   FT 1/2: GOOD   FT 2/2: GOOD Miles Jackson makes 2/2 from the line.
Score: 73-82

[00:04] Team_063 possession (Score: 73-82)
FOUL! Shooting foul on Miles Jackson. DeMar Banchero to the line for 2 free throws. [Team fouls: 2] (Miles Jackson: 1 personal fouls)   FT 1/2: MISS   FT 2/2: GOOD DeMar Banchero makes 1/2 from the line.
Score: 73-83

================================================================================
                              3RD QUARTER COMPLETE                              
================================================================================

3RD QUARTER SCORE: Team_049 21, Team_063 26

BOX SCORE:
================================================================================

Team_049
--------------------------------------------------------------------------------
Player                MIN  PTS  REB  AST  TO      FG   FG%      3P   3P%
--------------------------------------------------------------------------------
Shai Bird              33    7    0    0   0   3/4    75.0     0/0   0.0
Ja Oladipo             35    4    0    0   0   2/7    28.6     0/0   0.0
Jimmy Griffin          35    3    3    1   0   1/3    33.3     0/0   0.0
Giannis Anunoby         2    3    2    0   0   1/2    50.0     0/0   0.0
De'Aaron Allen         35    2    2    0   0   1/1   100.0     0/0   0.0
Miles Jackson           2    2    0    0   0   1/1   100.0     0/0   0.0
Shai Mobley            35    0    2    1   0   0/1     0.0     0/0   0.0
Shaquille Lillard       3    0    0    1   0   0/0     0.0     0/0   0.0

TEAM: FG: 9/19 (47.4%), 3PT: 2/9 (22.2%), REB: 9 (2 off, 7 def), AST: 3, TO: 4
TEAM FOULS: 2


Team_063
--------------------------------------------------------------------------------
Player                MIN  PTS  REB  AST  TO      FG   FG%      3P   3P%
--------------------------------------------------------------------------------
Dirk Reaves            33    8    3    0   0   3/4    75.0     0/0   0.0
Terry Reaves           35    8    0    2   0   3/5    60.0     0/0   0.0
Malcolm Quickley       35    3    3    2   0   1/3    33.3     0/0   0.0
Bradley Davis          35    2    0    2   0   1/1   100.0     0/0   0.0
Lamelo Ball             3    2    1    1   0   1/3    33.3     0/0   0.0
Cole Durant             2    2    1    0   0   1/1   100.0     0/0   0.0
DeMar Banchero          2    1    0    0   0   1/1   100.0     0/0   0.0
Tyler Harris           33    0    2    0   0   0/1     0.0     0/0   0.0
Kyle Green              3    0    1    0   0   0/0     0.0     0/0   0.0

TEAM: FG: 11/19 (57.9%), 3PT: 4/7 (57.1%), REB: 11 (1 off, 10 def), AST: 7, TO: 4
TEAM FOULS: 6 [Team_049 in BONUS]

================================================================================

================================================================================
                       4TH QUARTER - Team_049 vs Team_063                       
================================================================================

[12:00] Substitution (Team_049): Shai Bird OUT (stamina: 80) → Shaquille Lillard IN (comeback_detected)

[12:00] Substitution (Team_063): Bradley Davis OUT (stamina: 77) → DeMar Banchero IN (comeback_detected)

[12:00] Team_049 possession (Score: 73-83)
Ja Oladipo attempts a 3Pt. Contested by DeMar Banchero (4.1 feet, ZONE). Ja Oladipo misses. Offensive rebound by De'Aaron Allen! De'Aaron Allen kicks it out.

[11:48] Team_049 possession (Score: 73-83)
Ja Oladipo drives, Tyler Harris stays with him. Ja Oladipo attempts a Dunk. Contested by Tyler Harris (4.6 feet, ZONE). JA OLADIPO MAKES IT!
Score: 75-83

[11:38] Team_063 possession (Score: 75-83)
Terry Reaves drives to the basket... Terry Reaves loses control! Ball rolls out of bounds! TURNOVER! (dead ball)

[11:25] Team_049 possession (Score: 75-83)
Shaquille Lillard throws a bad pass! Stolen by DeMar Banchero! TURNOVER! (live ball)

[11:10] Team_063 possession (Score: 75-83)
Tyler Harris attempts a 3Pt. Contested by Shai Mobley (4.3 feet, MAN). TYLER HARRIS MAKES IT! Assist: Terry Reaves
Score: 75-86

[10:54] Team_049 possession (Score: 75-86)
Jimmy Griffin attempts a 3Pt. Contested by DeMar Banchero (4.0 feet, ZONE). Jimmy Griffin misses. Rebound secured by Dirk Reaves.

[10:39] Team_063 possession (Score: 75-86)
Tyler Harris attempts a Layup. Contested by De'Aaron Allen (4.4 feet, ZONE). TYLER HARRIS MAKES IT!
Score: 75-88

[10:21] Team_049 possession (Score: 75-88)
FOUL! Shooting foul on Malcolm Quickley. Jimmy Griffin to the line for 2 free throws. [Team fouls: 1] (Malcolm Quickley: 1 personal fouls)   FT 1/2: MISS   FT 2/2: GOOD Jimmy Griffin makes 1/2 from the line.
Score: 76-88

[10:05] Team_063 possession (Score: 76-88)
Dirk Reaves attempts a Midrange. Contested by Jimmy Griffin (5.1 feet, ZONE). DIRK REAVES MAKES IT!
Score: 76-90

[09:51] Team_049 possession (Score: 76-90)
Shai Mobley attempts a Layup. Contested by Tyler Harris (4.8 feet, ZONE). SHAI MOBLEY MAKES IT! Assist: Shaquille Lillard
Score: 78-90

[09:39] Team_063 possession (Score: 78-90)
DeMar Banchero loses the ball! Stripped by Shaquille Lillard! TURNOVER! (live ball)

[09:28] Team_049 possession (Score: 78-90)
Shaquille Lillard loses control! Ball rolls out of bounds! TURNOVER! (dead ball)

[09:28] Substitution (Team_049): Ja Oladipo OUT → Shai Jordan IN (stamina_rule2)

[09:28] Substitution (Team_049): Jimmy Griffin OUT → Desmond Towns IN (stamina_rule2)

[09:28] Substitution (Team_049): De'Aaron Allen OUT → Giannis Anunoby IN (stamina_rule2)

[09:28] Substitution (Team_049): Shai Mobley OUT → Miles Jackson IN (stamina_rule2)

[09:28] Substitution (Team_063): Malcolm Quickley OUT → Cole Durant IN (stamina_rule2)

[09:28] Substitution (Team_063): Terry Reaves OUT → Jaren James IN (stamina_rule2)

[09:16] Team_063 possession (Score: 78-90)
FOUL! Reach-in foul on Giannis Anunoby during the drive. [Team fouls: 1] No free throws, side out. (Giannis Anunoby: 1 personal fouls)

[09:02] Team_063 possession (Score: 78-90)
Tyler Harris drives and kicks out. Jaren James attempts a 3Pt. Contested by Shaquille Lillard (4.5 feet, ZONE). Jaren James misses. Rebound secured by Shai Jordan.

[08:45] Team_049 possession (Score: 78-90)
Miles Jackson attempts a 3Pt. Contested by Tyler Harris (4.7 feet, MAN). MILES JACKSON MAKES IT! Assist: Shai Jordan
Score: 81-90

[08:30] Team_063 possession (Score: 81-90)
Tyler Harris attempts a Midrange. Contested by Miles Jackson (3.3 feet, MAN). TYLER HARRIS MAKES IT! Assist: DeMar Banchero
Score: 81-92

[08:13] Team_049 possession (Score: 81-92)
Shaquille Lillard attempts a 3Pt. Contested by DeMar Banchero (4.1 feet, ZONE). Shaquille Lillard misses. Rebound secured by Dirk Reaves.

[07:57] Team_063 possession (Score: 81-92)
Dirk Reaves attempts a Midrange. Contested by Desmond Towns (4.7 feet, ZONE). DIRK REAVES MAKES IT!
Score: 81-94

[07:44] Team_049 possession (Score: 81-94)
Shaquille Lillard attempts a Layup. Contested by Tyler Harris (5.0 feet, ZONE). SHAQUILLE LILLARD MAKES IT! Assist: Giannis Anunoby
Score: 83-94

[07:35] Team_063 possession (Score: 83-94)
DeMar Banchero attempts a Midrange. Wide open! Shai Jordan is 6.5 feet away. [ZONE] DEMAR BANCHERO MAKES IT!
Score: 83-96

[07:23] Team_049 possession (Score: 83-96)
Miles Jackson loses control! Ball rolls out of bounds! TURNOVER! (dead ball)

[07:23] Substitution (Team_063): Dirk Reaves OUT → Lamelo Ball IN (stamina_rule2)

[07:23] Substitution (Team_063): Tyler Harris OUT → Kyle Green IN (stamina_rule2)

[07:07] Team_063 possession (Score: 83-96)
Lamelo Ball attempts a 3Pt. Contested by Giannis Anunoby (4.9 feet, ZONE). Lamelo Ball misses. Rebound secured by Giannis Anunoby.

[06:53] Team_049 possession (Score: 83-96)
Giannis Anunoby attempts a Midrange. Contested by Lamelo Ball (4.7 feet, ZONE). Giannis Anunoby misses. Offensive rebound by Miles Jackson! Miles Jackson puts it back in!
Score: 85-96

[06:39] Team_063 possession (Score: 85-96)
Cole Durant attempts a 3Pt. Wide open! Shai Jordan is 6.5 feet away. [MAN] Cole Durant misses. Offensive rebound by Lamelo Ball! Lamelo Ball kicks it out.

[06:29] Team_063 possession (Score: 85-96)
DeMar Banchero attempts a 3Pt. Wide open! Shai Jordan is 6.5 feet away. [ZONE] DeMar Banchero misses. Offensive rebound by Lamelo Ball! Lamelo Ball kicks it out.

[06:09] Team_063 possession (Score: 85-96)
Cole Durant attempts a 3Pt. Wide open! Shai Jordan is 6.5 feet away. [MAN] COLE DURANT MAKES IT! Assist: Jaren James
Score: 85-99

[05:51] Team_049 possession (Score: 85-99)
Giannis Anunoby drives, Kyle Green stays with him. Giannis Anunoby attempts a Dunk. Contested by Kyle Green (4.4 feet, ZONE). Giannis Anunoby misses. Rebound secured by Kyle Green.

[05:38] Team_063 possession (Score: 85-99)
Lamelo Ball attempts a Midrange. Contested by Giannis Anunoby (4.9 feet, MAN). Lamelo Ball misses. Rebound secured by Giannis Anunoby.

[05:22] Team_049 possession (Score: 85-99)
Miles Jackson commits a violation (traveling/carry)! TURNOVER! (dead ball)

[05:06] Team_063 possession (Score: 85-99)
DeMar Banchero drives, Miles Jackson stays with him. DeMar Banchero attempts a Layup. Contested by Miles Jackson (3.8 feet, ZONE). DEMAR BANCHERO MAKES IT! Assist: Jaren James
Score: 85-101

[04:53] Team_049 possession (Score: 85-101)
FOUL! Reach-in foul on Kyle Green during the drive. [Team fouls: 2] No free throws, side out. (Kyle Green: 1 personal fouls)

[04:35] Team_049 possession (Score: 85-101)
FOUL! Reach-in foul on Kyle Green during the drive. [Team fouls: 3] No free throws, side out. (Kyle Green: 2 personal fouls)

[04:25] Team_049 possession (Score: 85-101)
FOUL! Shooting foul on Lamelo Ball. Giannis Anunoby to the line for 2 free throws. [Team fouls: 4] (Lamelo Ball: 1 personal fouls)   FT 1/2: GOOD   FT 2/2: GOOD Giannis Anunoby makes 2/2 from the line.
Score: 87-101

[04:12] Team_063 possession (Score: 87-101)
DeMar Banchero attempts a 3Pt. Contested by Shaquille Lillard (5.2 feet, MAN). DEMAR BANCHERO MAKES IT! Assist: Lamelo Ball
Score: 87-104

[03:55] Team_049 possession (Score: 87-104)
Shai Jordan drives and kicks out. Miles Jackson attempts a 3Pt. Contested by DeMar Banchero (4.2 feet, ZONE). Miles Jackson misses. Rebound secured by Kyle Green.

[03:42] Team_063 possession (Score: 87-104)
Kyle Green attempts a Midrange. Contested by Miles Jackson (3.5 feet, MAN). Kyle Green misses. Rebound secured by Giannis Anunoby.

[03:30] Team_049 possession (Score: 87-104)
Miles Jackson drives, picks up Kyle Green. Help arrives from Cole Durant! Miles Jackson attempts a Layup. Contested by Cole Durant (4.4 feet, ZONE). Miles Jackson misses. Rebound secured by Lamelo Ball.

[03:14] Team_063 possession (Score: 87-104)
Cole Durant drives, Shai Jordan stays with him. Cole Durant attempts a Layup. Wide open! Shai Jordan is 6.5 feet away. [MAN] COLE DURANT MAKES IT! Assist: Jaren James
Score: 87-106

[03:00] Team_049 possession (Score: 87-106)
Desmond Towns drives, Kyle Green stays with him. Desmond Towns attempts a Dunk. Contested by Kyle Green (4.5 feet, ZONE). Desmond Towns misses. Rebound secured by Kyle Green.

[02:45] Team_063 possession (Score: 87-106)
DeMar Banchero drives, picks up Shaquille Lillard. Help arrives from Shai Jordan! DeMar Banchero attempts a Dunk. Contested by Shai Jordan (5.4 feet, MAN). DeMar Banchero misses. Rebound secured by Miles Jackson.

[02:35] Team_049 possession (Score: 87-106)
Giannis Anunoby attempts a 3Pt. Contested by Jaren James (4.0 feet, ZONE). Giannis Anunoby misses. FOUL! Loose ball foul on Kyle Green during the rebound battle. [IN THE BONUS! 5 team fouls] Giannis Anunoby to the line for 2 free throws. (Kyle Green: 3 personal fouls)   FT 1/2: MISS   FT 2/2: GOOD Giannis Anunoby makes 1/2 from the line.
Score: 88-106

[02:20] Team_063 possession (Score: 88-106)
Lamelo Ball attempts a 3Pt. Contested by Giannis Anunoby (5.0 feet, MAN). Lamelo Ball misses. Offensive rebound by Kyle Green! Kyle Green puts it back in!
Score: 88-108

[02:05] Team_049 possession (Score: 88-108)
Shaquille Lillard attempts a 3Pt. Contested by Jaren James (4.2 feet, ZONE). SHAQUILLE LILLARD MAKES IT! Assist: Miles Jackson
Score: 91-108

[01:48] Team_063 possession (Score: 91-108)
Jaren James attempts a 3Pt. Contested by Desmond Towns (4.7 feet, MAN). Jaren James misses. Rebound secured by Miles Jackson.

[01:32] Team_049 possession (Score: 91-108)
Giannis Anunoby attempts a Layup. Contested by Lamelo Ball (4.7 feet, MAN). GIANNIS ANUNOBY MAKES IT!
Score: 93-108

[01:16] Team_063 possession (Score: 93-108)
DeMar Banchero attempts a 3Pt. Contested by Shaquille Lillard (5.5 feet, ZONE). DEMAR BANCHERO MAKES IT! Assist: Kyle Green
Score: 93-111

[01:03] Team_049 possession (Score: 93-111)
Giannis Anunoby attempts a Midrange. Contested by Cole Durant (4.4 feet, ZONE). GIANNIS ANUNOBY MAKES IT!
Score: 95-111

[00:49] Team_063 possession (Score: 95-111)
Lamelo Ball attempts a Layup. Contested by Miles Jackson (4.1 feet, ZONE). LAMELO BALL MAKES IT! Assist: Cole Durant
Score: 95-113

[00:33] Team_049 possession (Score: 95-113)
Desmond Towns drives and kicks out. Desmond Towns attempts a 3Pt. Contested by Jaren James (4.3 feet, MAN). Desmond Towns misses. Rebound secured by Kyle Green.

[00:21] Team_063 possession (Score: 95-113)
DeMar Banchero attempts a Layup. Contested by Shaquille Lillard (5.6 feet, MAN). DeMar Banchero misses. Rebound secured by Miles Jackson.

[00:08] Team_049 possession (Score: 95-113)
Desmond Towns attempts a Midrange. Contested by Cole Durant (4.7 feet, ZONE). DESMOND TOWNS MAKES IT!
Score: 97-113

================================================================================
                              4TH QUARTER COMPLETE                              
================================================================================

4TH QUARTER SCORE: Team_049 24, Team_063 30

BOX SCORE:
================================================================================

Team_049
--------------------------------------------------------------------------------
Player                MIN  PTS  REB  AST  TO      FG   FG%      3P   3P%
--------------------------------------------------------------------------------
Giannis Anunoby        11    7    3    1   0   4/5    80.0     0/0   0.0
Shaquille Lillard      15    5    0    1   0   2/3    66.7     0/0   0.0
Miles Jackson          11    5    4    1   0   2/3    66.7     0/0   0.0
Ja Oladipo             37    2    0    0   0   1/1   100.0     0/0   0.0
Shai Mobley            37    2    0    0   0   1/1   100.0     0/0   0.0
Desmond Towns          11    2    0    0   0   1/3    33.3     0/0   0.0
Jimmy Griffin          37    1    0    0   0   1/2    50.0     0/0   0.0
De'Aaron Allen         37    0    1    0   0   0/0     0.0     0/0   0.0
Shai Jordan            11    0    1    1   0   0/1     0.0     0/0   0.0

TEAM: FG: 12/19 (63.2%), 3PT: 3/5 (60.0%), REB: 9 (2 off, 7 def), AST: 4, TO: 4
TEAM FOULS: 1


Team_063
--------------------------------------------------------------------------------
Player                MIN  PTS  REB  AST  TO      FG   FG%      3P   3P%
--------------------------------------------------------------------------------
DeMar Banchero         14   10    0    1   0   4/6    66.7     0/0   0.0
Tyler Harris           38    7    0    0   0   3/4    75.0     0/0   0.0
Cole Durant            11    5    0    1   0   2/2   100.0     0/0   0.0
Dirk Reaves            38    4    2    0   0   2/2   100.0     0/0   0.0
Lamelo Ball            10    2    3    1   0   1/3    33.3     0/0   0.0
Kyle Green             10    2    5    1   0   1/2    50.0     0/0   0.0
Terry Reaves           37    0    0    1   0   0/0     0.0     0/0   0.0
Jaren James            11    0    0    3   0   0/1     0.0     0/0   0.0

TEAM: FG: 13/20 (65.0%), 3PT: 5/7 (71.4%), REB: 10 (3 off, 7 def), AST: 8, TO: 2
TEAM FOULS: 5 [Team_049 in BONUS]

================================================================================

================================================================================
                               FULL GAME COMPLETE                               
================================================================================

FINAL SCORE: Team_049 97, Team_063 113

SCORING BY QUARTER:
--------------------------------------------------------------------------------
Team                     Q1     Q2     Q3     Q4    FINAL
--------------------------------------------------------------------------------
Team_049                 21     31     21     24       97
Team_063                 24     33     26     30      113
--------------------------------------------------------------------------------

FULL GAME BOX SCORE:
================================================================================

Team_049
--------------------------------------------------------------------------------
Player                MIN  PTS  REB  AST  TO      FG   FG%      3P   3P%      FT STL BLK
--------------------------------------------------------------------------------
Ja Oladipo             37   14    0    2   1   5/12   41.7   1/7    14.3   2/2     0   0
Jimmy Griffin          37   12   11    4   3   4/14   28.6   1/8    12.5   2/3     1   1
De'Aaron Allen         37   15    9    4   2   7/12   58.3   3/4    75.0   3/3     1   1
Shai Mobley            37   14   10    3   1   7/10   70.0   0/0     0.0   0/0     1   1
Shai Bird              33   18    0    0   0   9/14   64.3   0/1     0.0   4/4     0   0
Shaquille Lillard      15    5    0    2   2   2/3    66.7   1/2    50.0   0/0     1   0
Shai Jordan            11    0    1    1   0   0/1     0.0   0/0     0.0   0/0     0   0
Desmond Towns          11    2    0    0   0   1/3    33.3   0/0     0.0   0/0     0   0
Giannis Anunoby        11   10    5    1   0   6/8    75.0   2/2   100.0   3/4     0   0
Miles Jackson          11    7    4    1   2   2/3    66.7   1/1   100.0   2/2     0   0

TEAM: FG: 43/80 (53.8%), 3PT: 9/25 (36.0%), REB: 42 (11 off, 31 def), AST: 18, TO: 11


Team_063
--------------------------------------------------------------------------------
Player                MIN  PTS  REB  AST  TO      FG   FG%      3P   3P%      FT STL BLK
--------------------------------------------------------------------------------
Dirk Reaves            38   20   12    2   4   8/9    88.9   3/3   100.0   6/6     0   0
Tyler Harris           38   21    7    2   1  11/16   68.8   1/1   100.0   0/2     2   3
Malcolm Quickley       37   17   12    6   0   7/15   46.7   2/6    33.3   0/0     0   0
Terry Reaves           37   18    0    4   1   5/10   50.0   3/5    60.0   1/1     1   0
Bradley Davis          35   13    0    4   2   7/12   58.3   1/3    33.3   2/2     0   0
DeMar Banchero         14   11    0    1   1   5/7    71.4   2/2   100.0   1/2     1   0
Cole Durant            11    7    1    1   0   3/3   100.0   1/1   100.0   0/0     0   0
Jaren James            11    0    0    3   0   0/1     0.0   0/1     0.0   0/0     0   0
Lamelo Ball            10    4    4    2   0   3/7    42.9   1/3    33.3   0/0     0   0
Kyle Green             10    2    6    1   0   0/1     0.0   0/0     0.0   0/0     0   0

TEAM: FG: 49/81 (60.5%), 3PT: 14/25 (56.0%), REB: 40 (6 off, 34 def), AST: 26, TO: 9

================================================================================
