================================================================================
                        FULL GAME - Team_088 vs Team_011                        
================================================================================

================================================================================
                       1ST QUARTER - Team_088 vs Team_011                       
================================================================================

[12:00] Team_088 possession (Score: 0-0)
Josh Duncan drives and kicks out. Giannis Smith attempts a 3Pt. Contested by Magic Tatum (3.4 feet, ZONE). Giannis Smith misses. Rebound secured by Pau Barnes.

[11:42] Team_011 possession (Score: 0-0)
Trae Tatum attempts a Midrange. Contested by Tobias Haliburton (5.0 feet, ZONE). Trae Tatum misses. Rebound secured by Allen Ming.

[11:30] Team_088 possession (Score: 0-0)
Giannis Smith drives, picks up Pau Barnes. Help arrives from Magic Tatum! Giannis Smith attempts a Dunk. Contested by Magic Tatum (3.2 feet, MAN). Giannis Smith misses. Rebound secured by Evan George.

[11:13] Team_011 possession (Score: 0-0)
Michael Carter attempts a Layup. Contested by Tyler Hyland (4.4 feet, MAN). Michael Carter misses. Rebound secured by Tyler Hyland.

[10:59] Team_088 possession (Score: 0-0)
FOUL! Holding foul on Michael Carter. [Team fouls: 1] No free throws, side out. (Michael Carter: 1 personal fouls)

[10:44] Team_088 possession (Score: 0-0)
Giannis Smith attempts a 3Pt. Contested by Pau Barnes (3.2 feet, MAN). Giannis Smith misses. Rebound secured by Evan George.

[10:27] Team_011 possession (Score: 0-0)
FOUL! Reach-in foul on Giannis Smith during the drive. [Team fouls: 1] No free throws, side out. (Giannis Smith: 1 personal fouls)

[10:11] Team_011 possession (Score: 0-0)
Evan George drives, Giannis Smith stays with him. Evan George attempts a Layup. Contested by Giannis Smith (4.3 feet, ZONE). EVAN GEORGE MAKES IT! Assist: Michael Carter
Score: 0-2

[10:02] Team_088 possession (Score: 0-2)
Tobias Haliburton attempts a 3Pt. Contested by Magic Tatum (3.5 feet, ZONE). Tobias Haliburton misses. Rebound secured by Michael Carter.

[09:47] Team_011 possession (Score: 0-2)
FOUL! Shooting foul on Tobias Haliburton. Magic Tatum to the line for 2 free throws. [Team fouls: 2] (Tobias Haliburton: 1 personal fouls)   FT 1/2: MISS   FT 2/2: MISS Magic Tatum makes 0/2 from the line. Rebound secured by Allen Ming.

[09:33] Team_088 possession (Score: 0-2)
Josh Duncan drives and kicks out. Giannis Smith attempts a 3Pt. Contested by Pau Barnes (2.9 feet, MAN). GIANNIS SMITH MAKES IT! Assist: Tyler Hyland
Score: 3-2

[09:21] Team_011 possession (Score: 3-2)
Magic Tatum attempts a 3Pt. Contested by Josh Duncan (5.5 feet, MAN). Magic Tatum misses. Rebound secured by Allen Ming.

[09:07] Team_088 possession (Score: 3-2)
Tobias Haliburton attempts a Layup. Contested by Trae Tatum (4.6 feet, MAN). Tobias Haliburton misses. Rebound secured by Michael Carter.

[08:51] Team_011 possession (Score: 3-2)
Michael Carter attempts a 3Pt. Contested by Josh Duncan (5.2 feet, ZONE). MICHAEL CARTER MAKES IT! Assist: Magic Tatum
Score: 3-5

[08:35] Team_088 possession (Score: 3-5)
Allen Ming drives, Pau Barnes stays with him. Allen Ming attempts a Layup. Contested by Pau Barnes (3.2 feet, ZONE). ALLEN MING MAKES IT!
Score: 5-5

[08:20] Team_011 possession (Score: 5-5)
Evan George attempts a Layup. Contested by Giannis Smith (4.3 feet, ZONE). Evan George misses. Rebound secured by Allen Ming.

[08:07] Team_088 possession (Score: 5-5)
Tyler Hyland attempts a Midrange. Contested by Michael Carter (4.1 feet, ZONE). Tyler Hyland misses. Offensive rebound by Giannis Smith! Giannis Smith's putback is no good. Rebound secured by Michael Carter.

[07:53] Team_011 possession (Score: 5-5)
Pau Barnes makes the Layup and draws the foul on Giannis Smith! And-1! Pau Barnes to the line for 1. [Team fouls: 3] (Giannis Smith: 2 personal fouls)   FT 1/1: GOOD Pau Barnes makes 1/1 from the line.
Score: 5-8

[07:37] Team_088 possession (Score: 5-8)
Josh Duncan attempts a 3Pt. Contested by Magic Tatum (3.5 feet, ZONE). JOSH DUNCAN MAKES IT!
Score: 8-8

[07:21] Team_011 possession (Score: 8-8)
Trae Tatum attempts a Layup. BLOCKED BY TOBIAS HALIBURTON! Ball is loose! Rebound secured by Tyler Hyland.

[07:09] Team_088 possession (Score: 8-8)
Giannis Smith attempts a Midrange. Contested by Pau Barnes (3.2 feet, ZONE). GIANNIS SMITH MAKES IT!
Score: 10-8

[06:57] Team_011 possession (Score: 10-8)
Evan George drives to the basket... Evan George commits a violation (traveling/carry)! TURNOVER! (dead ball)

[06:40] Team_088 possession (Score: 10-8)
Tyler Hyland attempts a Midrange. Contested by Michael Carter (4.1 feet, ZONE). Tyler Hyland misses. Offensive rebound by Allen Ming! Allen Ming puts it back in!
Score: 12-8

[06:26] Team_011 possession (Score: 12-8)
Evan George attempts a Layup. Contested by Allen Ming (4.5 feet, MAN). EVAN GEORGE MAKES IT! Assist: Michael Carter
Score: 12-10

[06:14] Team_088 possession (Score: 12-10)
Tyler Hyland drives, picks up Pau Barnes. Help arrives from Magic Tatum! Tyler Hyland attempts a Layup. Contested by Magic Tatum (2.9 feet, ZONE). TYLER HYLAND MAKES IT! Assist: Josh Duncan
Score: 14-10

[05:58] Team_011 possession (Score: 14-10)
Evan George attempts a Layup. BLOCKED BY TOBIAS HALIBURTON! Ball is loose! Offensive rebound by Pau Barnes! Pau Barnes kicks it out.

[05:44] Team_011 possession (Score: 14-10)
Michael Carter attempts a Midrange. Contested by Tyler Hyland (4.4 feet, ZONE). MICHAEL CARTER MAKES IT! Assist: Evan George
Score: 14-12

[05:31] Team_088 possession (Score: 14-12)
Josh Duncan attempts a Midrange. Contested by Trae Tatum (4.7 feet, ZONE). JOSH DUNCAN MAKES IT! Assist: Tobias Haliburton
Score: 16-12

[05:16] Team_011 possession (Score: 16-12)
Magic Tatum attempts a Midrange. Contested by Giannis Smith (4.2 feet, ZONE). Magic Tatum misses. FOUL! Loose ball foul on Tyler Hyland during the rebound battle. [IN THE BONUS! 5 team fouls] Pau Barnes to the line for 2 free throws. (Tyler Hyland: 2 personal fouls)   FT 1/2: MISS   FT 2/2: GOOD Pau Barnes makes 1/2 from the line.
Score: 16-13

[05:00] Team_088 possession (Score: 16-13)
Giannis Smith drives and kicks out. FOUL! Shooting foul on Michael Carter. Tobias Haliburton to the line for 3 free throws. [Team fouls: 2] (Michael Carter: 2 personal fouls)   FT 1/3: MISS   FT 2/3: GOOD   FT 3/3: GOOD Tobias Haliburton makes 2/3 from the line.
Score: 18-13

[04:50] Team_011 possession (Score: 18-13)
Magic Tatum drives and kicks out. Michael Carter attempts a 3Pt. Contested by Tyler Hyland (4.6 feet, MAN). MICHAEL CARTER MAKES IT! Assist: Evan George
Score: 18-16

[04:40] Team_088 possession (Score: 18-16)
Tobias Haliburton attempts a 3Pt. Contested by Trae Tatum (4.7 feet, MAN). TOBIAS HALIBURTON MAKES IT! Assist: Giannis Smith
Score: 21-16

[04:27] Team_011 possession (Score: 21-16)
FOUL! Holding foul on Allen Ming. [IN THE BONUS! 6 team fouls] Evan George to the line for 2 free throws. (Allen Ming: 1 personal fouls)   FT 1/2: GOOD   FT 2/2: MISS Evan George makes 1/2 from the line. Rebound secured by Tyler Hyland.
Score: 21-17

[04:12] Team_088 possession (Score: 21-17)
FOUL! Reach-in foul on Pau Barnes during the drive. [Team fouls: 3] No free throws, side out. (Pau Barnes: 1 personal fouls)

[03:57] Team_088 possession (Score: 21-17)
Tobias Haliburton attempts a 3Pt. Contested by Trae Tatum (4.8 feet, MAN). Tobias Haliburton misses. Offensive rebound by Allen Ming! Allen Ming puts it back in!
Score: 23-17

[03:42] Team_011 possession (Score: 23-17)
FOUL! Shooting foul on Giannis Smith. Michael Carter to the line for 2 free throws. [BONUS: 7 team fouls] (Giannis Smith: 3 personal fouls)   FT 1/2: GOOD   FT 2/2: GOOD Michael Carter makes 2/2 from the line.
Score: 23-19

[03:26] Team_088 possession (Score: 23-19)
Tobias Haliburton drives and kicks out. Tyler Hyland attempts a Midrange. BLOCKED BY PAU BARNES! Ball is loose! Rebound secured by Michael Carter.

[03:16] Team_011 possession (Score: 23-19)
Magic Tatum drives, Josh Duncan stays with him. Magic Tatum attempts a Dunk. Contested by Josh Duncan (5.7 feet, MAN). Magic Tatum misses. Offensive rebound by Pau Barnes! Pau Barnes puts it back in!
Score: 23-21

[02:57] Team_088 possession (Score: 23-21)
Josh Duncan attempts a Midrange. BLOCKED BY TRAE TATUM! Ball is loose! Rebound secured by Evan George.

[02:47] Team_011 possession (Score: 23-21)
Evan George attempts a 3Pt. Contested by Tyler Hyland (5.0 feet, ZONE). Evan George misses. Rebound secured by Allen Ming.

[02:28] Team_088 possession (Score: 23-21)
Giannis Smith attempts a Midrange. Contested by Michael Carter (4.6 feet, ZONE). Giannis Smith misses. Rebound secured by Evan George.

[02:12] Team_011 possession (Score: 23-21)
Trae Tatum attempts a 3Pt. Contested by Tobias Haliburton (5.2 feet, MAN). TRAE TATUM MAKES IT! Assist: Magic Tatum
Score: 23-24

[01:53] Team_088 possession (Score: 23-24)
FOUL! Shooting foul on Evan George. Allen Ming to the line for 2 free throws. [Team fouls: 4] (Evan George: 1 personal fouls)   FT 1/2: GOOD   FT 2/2: GOOD Allen Ming makes 2/2 from the line.
Score: 25-24

[01:39] Team_011 possession (Score: 25-24)
FOUL! Shooting foul on Tyler Hyland. Michael Carter to the line for 3 free throws. [BONUS: 8 team fouls] (Tyler Hyland: 3 personal fouls)   FT 1/3: MISS   FT 2/3: GOOD   FT 3/3: MISS Michael Carter makes 1/3 from the line. Rebound secured by Giannis Smith.
Score: 25-25

[01:26] Team_088 possession (Score: 25-25)
FOUL! Holding foul on Michael Carter. [IN THE BONUS! 5 team fouls] Tyler Hyland to the line for 2 free throws. (Michael Carter: 3 personal fouls)   FT 1/2: GOOD   FT 2/2: GOOD Tyler Hyland makes 2/2 from the line.
Score: 27-25

[01:13] Team_011 possession (Score: 27-25)
Michael Carter throws a bad pass! Stolen by Tyler Hyland! TURNOVER! (live ball)

[00:57] Team_088 possession (Score: 27-25)
Giannis Smith attempts a 3Pt. Contested by Michael Carter (4.7 feet, ZONE). Giannis Smith misses. Rebound secured by Evan George.

[00:40] Team_011 possession (Score: 27-25)
Trae Tatum attempts a Midrange. Contested by Tyler Hyland (4.9 feet, ZONE). TRAE TATUM MAKES IT!
Score: 27-27

[00:25] Team_088 possession (Score: 27-27)
Giannis Smith attempts a Layup. Contested by Pau Barnes (3.8 feet, ZONE). Giannis Smith misses. Rebound secured by Evan George.

[00:14] Team_011 possession (Score: 27-27)
Magic Tatum attempts a 3Pt. Contested by Josh Duncan (6.0 feet, MAN). Magic Tatum misses. Rebound secured by Allen Ming.

[00:03] Team_088 possession (Score: 27-27)
Giannis Smith drives to the basket... Giannis Smith loses control! Ball rolls out of bounds! TURNOVER! (dead ball)

[00:03] Substitution (Team_088): Josh Duncan OUT → Klay Quickley IN (stamina_rule2)

[00:03] Substitution (Team_088): Tobias Haliburton OUT → Vince Carter IN (stamina_rule2)

[00:03] Substitution (Team_088): Tyler Hyland OUT → Pau Bird IN (stamina_rule2)

[00:03] Substitution (Team_088): Giannis Smith OUT → Zion Harris IN (stamina_rule2)

[00:03] Substitution (Team_088): Allen Ming OUT → Josh Embiid IN (stamina_rule2)

[00:03] Substitution (Team_011): Magic Tatum OUT → Shai Leonard IN (stamina_rule2)

[00:03] Substitution (Team_011): Trae Tatum OUT → De'Aaron George IN (stamina_rule2)

[00:03] Substitution (Team_011): Michael Carter OUT → Tyrese Nowitzki IN (stamina_rule2)

[00:03] Substitution (Team_011): Pau Barnes OUT → Russell Davis IN (stamina_rule2)

[00:03] Substitution (Team_011): Evan George OUT → Pau Towns IN (stamina_rule2)

================================================================================
                              1ST QUARTER COMPLETE                              
================================================================================

1ST QUARTER SCORE: Team_088 27, Team_011 27

BOX SCORE:
================================================================================

Team_088
--------------------------------------------------------------------------------
Player                MIN  PTS  REB  AST  TO      FG   FG%      3P   3P%
--------------------------------------------------------------------------------
Allen Ming             12    8    8    0   0   4/4   100.0     0/0   0.0
Josh Duncan            12    5    0    1   0   2/4    50.0     0/0   0.0
Giannis Smith          12    5    1    1   0   2/7    28.6     0/0   0.0
Tobias Haliburton      12    5    0    1   0   2/5    40.0     0/0   0.0
Tyler Hyland           12    4    3    1   0   2/3    66.7     0/0   0.0

TEAM: FG: 12/23 (52.2%), 3PT: 3/6 (50.0%), REB: 13 (3 off, 10 def), AST: 4, TO: 1
TEAM FOULS: 8 [Team_011 in BONUS]


Team_011
--------------------------------------------------------------------------------
Player                MIN  PTS  REB  AST  TO      FG   FG%      3P   3P%
--------------------------------------------------------------------------------
Michael Carter         12   10    4    2   0   4/6    66.7     0/0   0.0
Pau Barnes             12    6    3    0   0   3/3   100.0     0/0   0.0
Trae Tatum             12    5    0    0   0   2/4    50.0     0/0   0.0
Evan George            12    4    6    2   0   2/4    50.0     0/0   0.0
Magic Tatum            12    0    0    2   0   0/3     0.0     0/0   0.0

TEAM: FG: 11/21 (52.4%), 3PT: 2/6 (33.3%), REB: 12 (2 off, 10 def), AST: 6, TO: 2
TEAM FOULS: 5 [Team_088 in BONUS]

================================================================================

================================================================================
                       2ND QUARTER - Team_088 vs Team_011                       
================================================================================

[12:00] Team_088 possession (Score: 27-27)
Tobias Haliburton attempts a Midrange. Contested by Trae Tatum (4.9 feet, MAN). TOBIAS HALIBURTON MAKES IT!
Score: 29-27

[11:45] Team_011 possession (Score: 29-27)
Michael Carter attempts a 3Pt. Contested by Tyler Hyland (4.8 feet, MAN). Michael Carter misses. Offensive rebound by Pau Barnes! Pau Barnes puts it back in!
Score: 29-29

[11:30] Team_088 possession (Score: 29-29)
FOUL! Reach-in foul on Pau Barnes during the drive. [Team fouls: 1] No free throws, side out. (Pau Barnes: 1 personal fouls)

[11:14] Team_088 possession (Score: 29-29)
Giannis Smith attempts a 3Pt. Contested by Michael Carter (4.7 feet, ZONE). Giannis Smith misses. Rebound secured by Michael Carter.

[11:00] Team_011 possession (Score: 29-29)
Evan George attempts a Layup. Contested by Allen Ming (5.0 feet, MAN). EVAN GEORGE MAKES IT! Assist: Magic Tatum
Score: 29-31

[10:43] Team_088 possession (Score: 29-31)
Giannis Smith drives to the basket... Giannis Smith loses the ball! Stripped by Pau Barnes! TURNOVER! (live ball)

[10:27] Team_011 possession (Score: 29-31)
Trae Tatum attempts a 3Pt. Contested by Tobias Haliburton (5.4 feet, ZONE). Trae Tatum misses. Rebound secured by Giannis Smith.

[10:13] Team_088 possession (Score: 29-31)
Allen Ming makes the Layup and draws the foul on Pau Barnes! And-1! Allen Ming to the line for 1. [Team fouls: 2] (Pau Barnes: 2 personal fouls)   FT 1/1: GOOD Allen Ming makes 1/1 from the line.
Score: 32-31

[09:54] Team_011 possession (Score: 32-31)
Pau Barnes attempts a Midrange. Wide open! Tobias Haliburton is 6.1 feet away. [ZONE] PAU BARNES MAKES IT! Assist: Magic Tatum
Score: 32-33

[09:36] Team_088 possession (Score: 32-33)
Giannis Smith attempts a Midrange. Contested by Pau Barnes (3.9 feet, MAN). GIANNIS SMITH MAKES IT!
Score: 34-33

[09:18] Team_011 possession (Score: 34-33)
Magic Tatum drives, Giannis Smith stays with him. Magic Tatum attempts a Dunk. Contested by Giannis Smith (5.0 feet, ZONE). MAGIC TATUM MAKES IT! Assist: Michael Carter
Score: 34-35

[09:05] Team_088 possession (Score: 34-35)
Allen Ming drives, Pau Barnes stays with him. Allen Ming attempts a Layup. Contested by Pau Barnes (4.0 feet, MAN). ALLEN MING MAKES IT! Assist: Josh Duncan
Score: 36-35

[08:55] Team_011 possession (Score: 36-35)
Pau Barnes attempts a Midrange. Wide open! Tobias Haliburton is 6.2 feet away. [ZONE] PAU BARNES MAKES IT!
Score: 36-37

[08:41] Team_088 possession (Score: 36-37)
Tobias Haliburton drives, picks up Trae Tatum. Help arrives from Magic Tatum! Tobias Haliburton attempts a Layup. Contested by Magic Tatum (5.3 feet, MAN). TOBIAS HALIBURTON MAKES IT! Assist: Giannis Smith
Score: 38-37

[08:28] Team_011 possession (Score: 38-37)
Magic Tatum attempts a 3Pt. Wide open! Josh Duncan is 6.2 feet away. [MAN] Magic Tatum misses. Rebound secured by Allen Ming.

[08:14] Team_088 possession (Score: 38-37)
Tobias Haliburton attempts a 3Pt. Contested by Trae Tatum (5.4 feet, MAN). TOBIAS HALIBURTON MAKES IT! Assist: Josh Duncan
Score: 41-37

[08:01] Team_011 possession (Score: 41-37)
FOUL! Reach-in foul on Tobias Haliburton during the drive. [Team fouls: 1] No free throws, side out. (Tobias Haliburton: 1 personal fouls)

[07:45] Team_011 possession (Score: 41-37)
Michael Carter attempts a 3Pt. Contested by Tobias Haliburton (5.7 feet, ZONE). MICHAEL CARTER MAKES IT! Assist: Pau Barnes
Score: 41-40

[07:33] Team_088 possession (Score: 41-40)
Allen Ming attempts a Layup. Contested by Pau Barnes (4.2 feet, ZONE). ALLEN MING MAKES IT! Assist: Giannis Smith
Score: 43-40

[07:20] Team_011 possession (Score: 43-40)
Magic Tatum attempts a 3Pt. Wide open! Josh Duncan is 6.3 feet away. [MAN] Magic Tatum misses. Rebound secured by Allen Ming.

[07:07] Team_088 possession (Score: 43-40)
Josh Duncan attempts a Layup. Contested by Magic Tatum (4.3 feet, MAN). Josh Duncan misses. Rebound secured by Evan George.

[06:53] Team_011 possession (Score: 43-40)
Pau Barnes throws a bad pass out of bounds! TURNOVER! (dead ball)

[06:53] Substitution (Team_088): Josh Duncan OUT → Klay Quickley IN (stamina_rule2)

[06:53] Substitution (Team_088): Tobias Haliburton OUT → Vince Carter IN (stamina_rule2)

[06:53] Substitution (Team_088): Tyler Hyland OUT → Pau Bird IN (stamina_rule2)

[06:53] Substitution (Team_088): Giannis Smith OUT → Zion Harris IN (stamina_rule2)

[06:53] Substitution (Team_088): Allen Ming OUT → Josh Embiid IN (stamina_rule2)

[06:53] Substitution (Team_011): Magic Tatum OUT → Shai Leonard IN (stamina_rule2)

[06:53] Substitution (Team_011): Trae Tatum OUT → De'Aaron George IN (stamina_rule2)

[06:53] Substitution (Team_011): Michael Carter OUT → Tyrese Nowitzki IN (stamina_rule2)

[06:53] Substitution (Team_011): Pau Barnes OUT → Russell Davis IN (stamina_rule2)

[06:53] Substitution (Team_011): Evan George OUT → Pau Towns IN (stamina_rule2)

[06:37] Team_088 possession (Score: 43-40)
Josh Embiid drives to the basket... FOUL! Offensive foul on Josh Embiid! Russell Davis drew the charge! [Team fouls: 2] (Josh Embiid: 1 personal fouls) TURNOVER! (dead ball)

[06:26] Team_011 possession (Score: 43-40)
Shai Leonard attempts a Midrange. Contested by Klay Quickley (5.9 feet, MAN). Shai Leonard misses. Rebound secured by Josh Embiid.

[06:08] Team_088 possession (Score: 43-40)
Pau Bird makes the Layup and draws the foul on Russell Davis! And-1! Pau Bird to the line for 1. [Team fouls: 3] (Russell Davis: 1 personal fouls)   FT 1/1: GOOD Pau Bird makes 1/1 from the line.
Score: 46-40

[05:50] Team_011 possession (Score: 46-40)
Tyrese Nowitzki attempts a 3Pt. Contested by Pau Bird (4.9 feet, ZONE). Tyrese Nowitzki misses. Rebound secured by Pau Bird.

[05:39] Team_088 possession (Score: 46-40)
Josh Embiid attempts a Layup. Contested by Russell Davis (3.6 feet, ZONE). JOSH EMBIID MAKES IT!
Score: 48-40

[05:25] Team_011 possession (Score: 48-40)
Pau Towns drives and kicks out. Tyrese Nowitzki attempts a 3Pt. Contested by Pau Bird (5.0 feet, MAN). Tyrese Nowitzki misses. FOUL! Loose ball foul on Pau Bird during the rebound battle. [Team fouls: 3] No free throws, side out. (Pau Bird: 1 personal fouls)

[05:11] Team_011 possession (Score: 48-40)
Pau Towns attempts a Layup. Contested by Zion Harris (5.7 feet, ZONE). PAU TOWNS MAKES IT! Assist: Tyrese Nowitzki
Score: 48-42

[04:58] Team_088 possession (Score: 48-42)
Vince Carter attempts a 3Pt. Contested by Shai Leonard (4.0 feet, ZONE). Vince Carter misses. Rebound secured by Tyrese Nowitzki.

[04:44] Team_011 possession (Score: 48-42)
De'Aaron George attempts a Midrange. Contested by Vince Carter (5.1 feet, MAN). DE'AARON GEORGE MAKES IT!
Score: 48-44

[04:31] Team_088 possession (Score: 48-44)
Josh Embiid attempts a Midrange. Contested by Pau Towns (4.9 feet, MAN). JOSH EMBIID MAKES IT!
Score: 50-44

[04:15] Team_011 possession (Score: 50-44)
Pau Towns attempts a Midrange. Contested by Zion Harris (5.7 feet, ZONE). PAU TOWNS MAKES IT! Assist: Shai Leonard
Score: 50-46

[04:00] Team_088 possession (Score: 50-46)
Pau Bird attempts a 3Pt. Contested by Shai Leonard (4.5 feet, ZONE). Pau Bird misses. Rebound secured by Pau Towns.

[03:49] Team_011 possession (Score: 50-46)
Shai Leonard attempts a 3Pt. Contested by Pau Bird (5.0 feet, ZONE). Shai Leonard misses. Rebound secured by Pau Bird.

[03:33] Team_088 possession (Score: 50-46)
Zion Harris attempts a 3Pt. Contested by Russell Davis (4.3 feet, MAN). Zion Harris misses. Rebound secured by Pau Towns.

[03:18] Team_011 possession (Score: 50-46)
Pau Towns attempts a 3Pt. Contested by Josh Embiid (5.2 feet, MAN). PAU TOWNS MAKES IT! Assist: Tyrese Nowitzki
Score: 50-49

[03:04] Team_088 possession (Score: 50-49)
Klay Quickley attempts a 3Pt. Contested by Shai Leonard (4.4 feet, MAN). Klay Quickley misses. Rebound secured by Tyrese Nowitzki.

[02:52] Team_011 possession (Score: 50-49)
Tyrese Nowitzki attempts a Midrange. Contested by Vince Carter (4.7 feet, ZONE). TYRESE NOWITZKI MAKES IT!
Score: 50-51

[02:33] Team_088 possession (Score: 50-51)
Klay Quickley attempts a Layup. Contested by Shai Leonard (4.4 feet, MAN). KLAY QUICKLEY MAKES IT! Assist: Josh Embiid
Score: 52-51

[02:18] Team_011 possession (Score: 52-51)
Pau Towns drives, Josh Embiid stays with him. Pau Towns attempts a Layup. Contested by Josh Embiid (5.2 feet, ZONE). PAU TOWNS MAKES IT!
Score: 52-53

[02:06] Team_088 possession (Score: 52-53)
Josh Embiid throws a bad pass out of bounds! TURNOVER! (dead ball)

[01:51] Team_011 possession (Score: 52-53)
FOUL! Reach-in foul on Josh Embiid during the drive. [Team fouls: 4] No free throws, side out. (Josh Embiid: 2 personal fouls)

[01:33] Team_011 possession (Score: 52-53)
Tyrese Nowitzki attempts a 3Pt. Contested by Vince Carter (4.7 feet, ZONE). TYRESE NOWITZKI MAKES IT! Assist: Pau Towns
Score: 52-56

[01:20] Team_088 possession (Score: 52-56)
Vince Carter drives and kicks out. Josh Embiid attempts a 3Pt. Contested by Shai Leonard (4.3 feet, ZONE). JOSH EMBIID MAKES IT! Assist: Klay Quickley
Score: 55-56

[01:04] Team_011 possession (Score: 55-56)
De'Aaron George attempts a 3Pt. Contested by Pau Bird (5.3 feet, ZONE). De'Aaron George misses. Offensive rebound by Tyrese Nowitzki! Tyrese Nowitzki kicks it out.

[00:49] Team_011 possession (Score: 55-56)
De'Aaron George drives, Vince Carter stays with him. De'Aaron George attempts a Dunk. Contested by Vince Carter (5.1 feet, MAN). DE'AARON GEORGE MAKES IT! Assist: Russell Davis
Score: 55-58

[00:35] Team_088 possession (Score: 55-58)
Klay Quickley drives, picks up Russell Davis. Help arrives from Shai Leonard! Klay Quickley attempts a Dunk. Contested by Shai Leonard (3.9 feet, ZONE). KLAY QUICKLEY MAKES IT! Assist: Vince Carter
Score: 57-58

[00:17] Team_011 possession (Score: 57-58)
Russell Davis attempts a 3Pt. Contested by Zion Harris (5.4 feet, MAN). Russell Davis misses. Offensive rebound by Pau Towns! Pau Towns kicks it out.

[00:03] Team_011 possession (Score: 57-58)
Pau Towns attempts a Midrange. Contested by Josh Embiid (5.2 feet, MAN). PAU TOWNS MAKES IT!
Score: 57-60

================================================================================
                              2ND QUARTER COMPLETE                              
================================================================================

2ND QUARTER SCORE: Team_088 30, Team_011 33

BOX SCORE:
================================================================================

Team_088
--------------------------------------------------------------------------------
Player                MIN  PTS  REB  AST  TO      FG   FG%      3P   3P%
--------------------------------------------------------------------------------
Tobias Haliburton      18    7    0    0   0   3/3   100.0     0/0   0.0
Allen Ming             18    7    2    0   0   3/3   100.0     0/0   0.0
Josh Embiid             7    7    1    1   0   3/3   100.0     0/0   0.0
Klay Quickley           7    4    0    1   0   2/3    66.7     0/0   0.0
Pau Bird                7    3    2    0   0   1/2    50.0     0/0   0.0
Giannis Smith          18    2    1    2   0   1/2    50.0     0/0   0.0
Josh Duncan            18    0    0    2   0   0/1     0.0     0/0   0.0
Vince Carter            7    0    0    1   0   0/1     0.0     0/0   0.0
Zion Harris             7    0    0    0   0   0/1     0.0     0/0   0.0

TEAM: FG: 13/19 (68.4%), 3PT: 1/6 (16.7%), REB: 6 (0 off, 6 def), AST: 7, TO: 3
TEAM FOULS: 4


Team_011
--------------------------------------------------------------------------------
Player                MIN  PTS  REB  AST  TO      FG   FG%      3P   3P%
--------------------------------------------------------------------------------
Pau Towns               7   11    3    1   0   5/5   100.0     0/0   0.0
Pau Barnes             18    6    1    1   0   3/3   100.0     0/0   0.0
Tyrese Nowitzki         7    5    4    2   0   2/3    66.7     0/0   0.0
De'Aaron George         7    4    0    0   0   2/2   100.0     0/0   0.0
Michael Carter         18    3    1    1   0   1/1   100.0     0/0   0.0
Evan George            18    2    1    0   0   1/1   100.0     0/0   0.0
Magic Tatum            18    2    0    2   0   1/3    33.3     0/0   0.0
Trae Tatum             18    0    0    0   0   0/1     0.0     0/0   0.0
Shai Leonard            7    0    0    1   0   0/2     0.0     0/0   0.0
Russell Davis           7    0    0    1   0   0/0     0.0     0/0   0.0

TEAM: FG: 15/21 (71.4%), 3PT: 4/9 (44.4%), REB: 10 (4 off, 6 def), AST: 9, TO: 1
TEAM FOULS: 3

================================================================================

================================================================================
                       3RD QUARTER - Team_088 vs Team_011                       
================================================================================

[12:00] Team_088 possession (Score: 57-60)
Giannis Smith makes the Dunk and draws the foul on Pau Barnes! And-1! Giannis Smith to the line for 1. [Team fouls: 1] (Pau Barnes: 1 personal fouls)   FT 1/1: GOOD Giannis Smith makes 1/1 from the line.
Score: 60-60

[11:44] Team_011 possession (Score: 60-60)
Magic Tatum drives to the basket... Magic Tatum loses control! Ball rolls out of bounds! TURNOVER! (dead ball)

[11:28] Team_088 possession (Score: 60-60)
Allen Ming attempts a Midrange. Contested by Pau Barnes (3.2 feet, MAN). Allen Ming misses. Offensive rebound by Giannis Smith! Giannis Smith puts it back in!
Score: 62-60

[11:16] Team_011 possession (Score: 62-60)
Michael Carter attempts a 3Pt. Contested by Tyler Hyland (4.4 feet, MAN). MICHAEL CARTER MAKES IT! Assist: Trae Tatum
Score: 62-63

[11:05] Team_088 possession (Score: 62-63)
Josh Duncan drives, Pau Barnes stays with him. Josh Duncan attempts a Dunk. Contested by Pau Barnes (3.0 feet, ZONE). JOSH DUNCAN MAKES IT!
Score: 64-63

[10:52] Team_011 possession (Score: 64-63)
Trae Tatum attempts a Midrange. Contested by Tobias Haliburton (5.0 feet, MAN). TRAE TATUM MAKES IT! Assist: Evan George
Score: 64-65

[10:37] Team_088 possession (Score: 64-65)
Tyler Hyland attempts a 3Pt. Contested by Magic Tatum (3.3 feet, ZONE). Tyler Hyland misses. Rebound secured by Evan George.

[10:23] Team_011 possession (Score: 64-65)
Michael Carter attempts a 3Pt. Contested by Tobias Haliburton (4.9 feet, ZONE). Michael Carter misses. Rebound secured by Tyler Hyland.

[10:09] Team_088 possession (Score: 64-65)
Giannis Smith attempts a Layup. Contested by Pau Barnes (3.2 feet, MAN). GIANNIS SMITH MAKES IT! Assist: Allen Ming
Score: 66-65

[09:54] Team_011 possession (Score: 66-65)
FOUL! Shooting foul on Tobias Haliburton. Magic Tatum to the line for 3 free throws. [Team fouls: 1] (Tobias Haliburton: 1 personal fouls)   FT 1/3: GOOD   FT 2/3: MISS   FT 3/3: GOOD Magic Tatum makes 2/3 from the line.
Score: 66-67

[09:36] Team_088 possession (Score: 66-67)
Tobias Haliburton drives, picks up Trae Tatum. Help arrives from Magic Tatum! Tobias Haliburton attempts a Dunk. Contested by Magic Tatum (4.6 feet, MAN). TOBIAS HALIBURTON MAKES IT! Assist: Tyler Hyland
Score: 68-67

[09:21] Team_011 possession (Score: 68-67)
Magic Tatum drives, Giannis Smith stays with him. Magic Tatum attempts a Layup. Contested by Giannis Smith (4.2 feet, ZONE). Magic Tatum misses. Rebound secured by Tyler Hyland.

[09:10] Team_088 possession (Score: 68-67)
Tobias Haliburton makes the Layup and draws the foul on Pau Barnes! And-1! Tobias Haliburton to the line for 1. [Team fouls: 2] (Pau Barnes: 2 personal fouls)   FT 1/1: GOOD Tobias Haliburton makes 1/1 from the line.
Score: 71-67

[08:54] Team_011 possession (Score: 71-67)
Pau Barnes drives and kicks out. Evan George attempts a 3Pt. Contested by Tobias Haliburton (5.0 feet, ZONE). Evan George misses. Rebound secured by Allen Ming.

[08:38] Team_088 possession (Score: 71-67)
Tobias Haliburton attempts a 3Pt. Contested by Trae Tatum (4.6 feet, MAN). Tobias Haliburton misses. Rebound secured by Michael Carter.

[08:25] Team_011 possession (Score: 71-67)
Trae Tatum attempts a 3Pt. Contested by Tobias Haliburton (5.0 feet, MAN). Trae Tatum misses. Rebound secured by Allen Ming.

[08:09] Team_088 possession (Score: 71-67)
Tyler Hyland attempts a 3Pt. Contested by Michael Carter (4.1 feet, MAN). TYLER HYLAND MAKES IT!
Score: 74-67

[07:57] Team_011 possession (Score: 74-67)
Trae Tatum attempts a Midrange. Contested by Tobias Haliburton (5.0 feet, MAN). TRAE TATUM MAKES IT! Assist: Magic Tatum
Score: 74-69

[07:44] Team_088 possession (Score: 74-69)
Tobias Haliburton attempts a Layup. BLOCKED BY PAU BARNES! Ball is loose! Offensive rebound by Giannis Smith! Giannis Smith kicks it out.

[07:30] Team_088 possession (Score: 74-69)
Tobias Haliburton makes the Layup and draws the foul on Magic Tatum! And-1! Tobias Haliburton to the line for 1. [Team fouls: 3] (Magic Tatum: 1 personal fouls)   FT 1/1: MISS Tobias Haliburton makes 0/1 from the line. Rebound secured by Evan George.
Score: 76-69

[07:13] Team_011 possession (Score: 76-69)
FOUL! Reach-in foul on Tobias Haliburton during the drive. [Team fouls: 2] No free throws, side out. (Tobias Haliburton: 2 personal fouls)

[06:59] Team_011 possession (Score: 76-69)
Michael Carter drives, picks up Giannis Smith. Help arrives from Tobias Haliburton! Michael Carter attempts a Layup. Contested by Tobias Haliburton (3.9 feet, ZONE). MICHAEL CARTER MAKES IT! Assist: Pau Barnes
Score: 76-71

[06:46] Team_088 possession (Score: 76-71)
Allen Ming attempts a Midrange. Contested by Michael Carter (4.4 feet, ZONE). ALLEN MING MAKES IT! Assist: Tobias Haliburton
Score: 78-71

[06:33] Team_011 possession (Score: 78-71)
Michael Carter attempts a Midrange. Contested by Tobias Haliburton (4.9 feet, ZONE). MICHAEL CARTER MAKES IT! Assist: Evan George
Score: 78-73

[06:17] Team_088 possession (Score: 78-73)
Tobias Haliburton attempts a 3Pt. Contested by Magic Tatum (3.5 feet, ZONE). Tobias Haliburton misses. Offensive rebound by Giannis Smith! Giannis Smith puts it back in!
Score: 80-73

[06:03] Team_011 possession (Score: 80-73)
FOUL! Shooting foul on Tobias Haliburton. Michael Carter to the line for 2 free throws. [Team fouls: 3] (Tobias Haliburton: 3 personal fouls)   FT 1/2: GOOD   FT 2/2: GOOD Michael Carter makes 2/2 from the line.
Score: 80-75

[05:44] Team_088 possession (Score: 80-75)
FOUL! Shooting foul on Pau Barnes. Allen Ming to the line for 2 free throws. [Team fouls: 4] (Pau Barnes: 3 personal fouls)   FT 1/2: MISS   FT 2/2: GOOD Allen Ming makes 1/2 from the line.
Score: 81-75

[05:27] Team_011 possession (Score: 81-75)
Magic Tatum drives to the basket... Magic Tatum throws a bad pass out of bounds! TURNOVER! (dead ball)

[05:14] Team_088 possession (Score: 81-75)
Giannis Smith attempts a 3Pt. Contested by Pau Barnes (3.2 feet, MAN). Giannis Smith misses. Rebound secured by Michael Carter.

[04:57] Team_011 possession (Score: 81-75)
Michael Carter drives and kicks out. Trae Tatum attempts a Midrange. Contested by Tobias Haliburton (5.1 feet, ZONE). Trae Tatum misses. Offensive rebound by Evan George! Evan George's putback is no good. Rebound secured by Allen Ming.

[04:43] Team_088 possession (Score: 81-75)
Allen Ming attempts a Midrange. Contested by Pau Barnes (3.2 feet, MAN). Allen Ming misses. Rebound secured by Pau Barnes.

[04:29] Team_011 possession (Score: 81-75)
Evan George throws a bad pass! Stolen by Allen Ming! TURNOVER! (live ball)

[04:12] Team_088 possession (Score: 81-75)
Allen Ming drives, picks up Pau Barnes. Help arrives from Magic Tatum! Allen Ming attempts a Dunk. Contested by Magic Tatum (3.3 feet, ZONE). ALLEN MING MAKES IT! Assist: Tyler Hyland
Score: 83-75

[03:57] Team_011 possession (Score: 83-75)
Trae Tatum attempts a Midrange. Contested by Tobias Haliburton (5.1 feet, MAN). Trae Tatum misses. Rebound secured by Tyler Hyland.

[03:40] Team_088 possession (Score: 83-75)
Giannis Smith drives to the basket... Giannis Smith loses control! Ball rolls out of bounds! TURNOVER! (dead ball)

[03:25] Team_011 possession (Score: 83-75)
Magic Tatum attempts a 3Pt. Contested by Tobias Haliburton (5.4 feet, ZONE). MAGIC TATUM MAKES IT! Assist: Pau Barnes
Score: 83-78

[03:12] Team_088 possession (Score: 83-78)
Tyler Hyland attempts a Midrange. Contested by Michael Carter (4.2 feet, MAN). Tyler Hyland misses. Rebound secured by Evan George.

[03:02] Team_011 possession (Score: 83-78)
Michael Carter attempts a Midrange. Contested by Tyler Hyland (4.6 feet, MAN). Michael Carter misses. Rebound secured by Allen Ming.

[02:48] Team_088 possession (Score: 83-78)
Giannis Smith attempts a 3Pt. Contested by Magic Tatum (3.8 feet, ZONE). GIANNIS SMITH MAKES IT! Assist: Tobias Haliburton
Score: 86-78

[02:30] Team_011 possession (Score: 86-78)
Michael Carter attempts a Midrange. Contested by Tyler Hyland (4.7 feet, MAN). MICHAEL CARTER MAKES IT!
Score: 86-80

[02:20] Team_088 possession (Score: 86-80)
Tyler Hyland attempts a Layup. Contested by Michael Carter (4.3 feet, MAN). Tyler Hyland misses. Offensive rebound by Allen Ming! Allen Ming's putback is no good. Rebound secured by Evan George.

[02:05] Team_011 possession (Score: 86-80)
Michael Carter drives, Giannis Smith stays with him. Michael Carter attempts a Dunk. Contested by Giannis Smith (4.3 feet, ZONE). MICHAEL CARTER MAKES IT! Assist: Magic Tatum
Score: 86-82

[01:52] Team_088 possession (Score: 86-82)
Tobias Haliburton attempts a Layup. Contested by Pau Barnes (3.4 feet, ZONE). Tobias Haliburton misses. Rebound secured by Evan George.

[01:40] Team_011 possession (Score: 86-82)
FOUL! Holding foul on Josh Duncan. [Team fouls: 4] No free throws, side out. (Josh Duncan: 1 personal fouls)

[01:28] Team_011 possession (Score: 86-82)
Pau Barnes drives to the basket... FOUL! Offensive foul on Pau Barnes! Giannis Smith drew the charge! [Team fouls: 5] (Pau Barnes: 4 personal fouls) TURNOVER! (dead ball)

[01:18] Team_088 possession (Score: 86-82)
Allen Ming drives to the basket... Allen Ming loses the ball! Stripped by Pau Barnes! TURNOVER! (live ball)

[01:05] Team_011 possession (Score: 86-82)
Pau Barnes attempts a 3Pt. Contested by Giannis Smith (5.2 feet, MAN). PAU BARNES MAKES IT! Assist: Michael Carter
Score: 86-85

[00:47] Team_088 possession (Score: 86-85)
Allen Ming attempts a Midrange. Contested by Pau Barnes (3.7 feet, MAN). ALLEN MING MAKES IT!
Score: 88-85

[00:30] Team_011 possession (Score: 88-85)
Evan George drives and kicks out. Evan George attempts a Midrange. Contested by Allen Ming (4.9 feet, MAN). Evan George misses. Rebound secured by Tyler Hyland.

[00:17] Team_088 possession (Score: 88-85)
Josh Duncan attempts a Midrange. Contested by Magic Tatum (4.0 feet, MAN). Josh Duncan misses. Rebound secured by Evan George.

[00:04] Team_011 possession (Score: 88-85)
Pau Barnes makes the Layup and draws the foul on Giannis Smith! And-1! Pau Barnes to the line for 1. [BONUS: 5 team fouls] (Giannis Smith: 1 personal fouls)   FT 1/1: GOOD Pau Barnes makes 1/1 from the line.
Score: 88-88

================================================================================
                              3RD QUARTER COMPLETE                              
================================================================================

3RD QUARTER SCORE: Team_088 31, Team_011 28

BOX SCORE:
================================================================================

Team_088
--------------------------------------------------------------------------------
Player                MIN  PTS  REB  AST  TO      FG   FG%      3P   3P%
--------------------------------------------------------------------------------
Giannis Smith          30   12    3    0   0   5/6    83.3     0/0   0.0
Allen Ming             30    7    4    1   0   4/5    80.0     0/0   0.0
Tobias Haliburton      30    5    0    2   0   2/5    40.0     0/0   0.0
Tyler Hyland           30    3    4    2   0   1/4    25.0     0/0   0.0
Josh Duncan            30    2    0    0   0   1/2    50.0     0/0   0.0

TEAM: FG: 13/22 (59.1%), 3PT: 3/6 (50.0%), REB: 11 (4 off, 7 def), AST: 5, TO: 2
TEAM FOULS: 5 [Team_011 in BONUS]


Team_011
--------------------------------------------------------------------------------
Player                MIN  PTS  REB  AST  TO      FG   FG%      3P   3P%
--------------------------------------------------------------------------------
Michael Carter         30   13    2    1   0   6/9    66.7     0/0   0.0
Pau Barnes             30    6    1    2   0   2/3    66.7     0/0   0.0
Magic Tatum            30    5    0    2   0   2/3    66.7     0/0   0.0
Trae Tatum             30    4    0    1   0   2/4    50.0     0/0   0.0
Evan George            30    0    6    2   0   0/1     0.0     0/0   0.0

TEAM: FG: 12/20 (60.0%), 3PT: 4/6 (66.7%), REB: 9 (1 off, 8 def), AST: 8, TO: 4
TEAM FOULS: 5 [Team_088 in BONUS]

================================================================================

================================================================================
                       4TH QUARTER - Team_088 vs Team_011                       
================================================================================

[12:00] Team_088 possession (Score: 88-88)
Giannis Smith drives, Pau Barnes stays with him. Giannis Smith attempts a Layup. Contested by Pau Barnes (3.6 feet, ZONE). GIANNIS SMITH MAKES IT! Assist: Allen Ming
Score: 90-88

[11:49] Team_011 possession (Score: 90-88)
Evan George attempts a 3Pt. Contested by Tobias Haliburton (5.6 feet, ZONE). Evan George misses. Rebound secured by Tyler Hyland.

[11:31] Team_088 possession (Score: 90-88)
FOUL! Shooting foul on Pau Barnes. Allen Ming to the line for 2 free throws. [Team fouls: 1] (Pau Barnes: 1 personal fouls)   FT 1/2: GOOD   FT 2/2: GOOD Allen Ming makes 2/2 from the line.
Score: 92-88

[11:16] Team_011 possession (Score: 92-88)
Magic Tatum attempts a 3Pt. Contested by Tobias Haliburton (5.6 feet, ZONE). Magic Tatum misses. Rebound secured by Giannis Smith.

[11:03] Team_088 possession (Score: 92-88)
Allen Ming attempts a 3Pt. Contested by Pau Barnes (3.7 feet, MAN). Allen Ming misses. Rebound secured by Evan George.

[10:46] Team_011 possession (Score: 92-88)
Pau Barnes drives to the basket... Pau Barnes throws a bad pass out of bounds! TURNOVER! (dead ball)

[10:46] Substitution (Team_088): Josh Duncan OUT → Klay Quickley IN (stamina_rule2)

[10:46] Substitution (Team_088): Tobias Haliburton OUT → Vince Carter IN (stamina_rule2)

[10:46] Substitution (Team_088): Tyler Hyland OUT → Pau Bird IN (stamina_rule2)

[10:46] Substitution (Team_088): Giannis Smith OUT → Zion Harris IN (stamina_rule2)

[10:46] Substitution (Team_088): Allen Ming OUT → Josh Embiid IN (stamina_rule2)

[10:46] Substitution (Team_011): Magic Tatum OUT → Shai Leonard IN (stamina_rule2)

[10:46] Substitution (Team_011): Trae Tatum OUT → De'Aaron George IN (stamina_rule2)

[10:46] Substitution (Team_011): Michael Carter OUT → Tyrese Nowitzki IN (stamina_rule2)

[10:46] Substitution (Team_011): Pau Barnes OUT → Russell Davis IN (stamina_rule2)

[10:46] Substitution (Team_011): Evan George OUT → Pau Towns IN (stamina_rule2)

[10:31] Team_088 possession (Score: 92-88)
Zion Harris attempts a Midrange. Contested by Russell Davis (4.3 feet, MAN). Zion Harris misses. Rebound secured by Russell Davis.

[10:15] Team_011 possession (Score: 92-88)
FOUL! Shooting foul on Josh Embiid. Pau Towns to the line for 2 free throws. [Team fouls: 1] (Josh Embiid: 1 personal fouls)   FT 1/2: GOOD   FT 2/2: GOOD Pau Towns makes 2/2 from the line.
Score: 92-90

[10:02] Team_088 possession (Score: 92-90)
Klay Quickley attempts a Layup. Contested by Shai Leonard (4.4 feet, MAN). Klay Quickley misses. Rebound secured by Pau Towns.

[09:44] Team_011 possession (Score: 92-90)
Russell Davis attempts a Layup. Contested by Zion Harris (5.4 feet, ZONE). RUSSELL DAVIS MAKES IT! Assist: De'Aaron George
Score: 92-92

[09:28] Team_088 possession (Score: 92-92)
FOUL! Holding foul on De'Aaron George. [Team fouls: 2] No free throws, side out. (De'Aaron George: 1 personal fouls)

[09:11] Team_088 possession (Score: 92-92)
Pau Bird attempts a 3Pt. Contested by Shai Leonard (4.5 feet, ZONE). PAU BIRD MAKES IT!
Score: 95-92

[08:59] Team_011 possession (Score: 95-92)
Shai Leonard drives, Zion Harris stays with him. Shai Leonard attempts a Dunk. Contested by Zion Harris (5.8 feet, ZONE). SHAI LEONARD MAKES IT!
Score: 95-94

[08:47] Team_088 possession (Score: 95-94)
Pau Bird attempts a Midrange. Contested by Russell Davis (4.0 feet, ZONE). PAU BIRD MAKES IT! Assist: Vince Carter
Score: 97-94

[08:35] Team_011 possession (Score: 97-94)
FOUL! Shooting foul on Zion Harris. Russell Davis to the line for 2 free throws. [Team fouls: 2] (Zion Harris: 1 personal fouls)   FT 1/2: GOOD   FT 2/2: MISS Russell Davis makes 1/2 from the line. Rebound secured by Pau Bird.
Score: 97-95

[08:22] Team_088 possession (Score: 97-95)
Josh Embiid attempts a Layup. BLOCKED BY PAU TOWNS! Ball is loose! Offensive rebound by Josh Embiid! Josh Embiid kicks it out.

[08:08] Team_088 possession (Score: 97-95)
FOUL! Reach-in foul on Russell Davis during the drive. [Team fouls: 3] No free throws, side out. (Russell Davis: 1 personal fouls)

[07:53] Team_088 possession (Score: 97-95)
Pau Bird attempts a Midrange. Contested by Tyrese Nowitzki (4.9 feet, MAN). Pau Bird misses. Offensive rebound by Pau Bird! Pau Bird kicks it out.

[07:34] Team_088 possession (Score: 97-95)
Zion Harris drives, Russell Davis stays with him. Zion Harris attempts a Layup. Contested by Russell Davis (4.3 feet, ZONE). ZION HARRIS MAKES IT! Assist: Josh Embiid
Score: 99-95

[07:21] Team_011 possession (Score: 99-95)
FOUL! Offensive foul on De'Aaron George! Vince Carter drew the charge! [Team fouls: 4] (De'Aaron George: 2 personal fouls) TURNOVER! (dead ball)

[07:10] Team_088 possession (Score: 99-95)
FOUL! Shooting foul on De'Aaron George. Vince Carter to the line for 2 free throws. [BONUS: 5 team fouls] (De'Aaron George: 3 personal fouls)   FT 1/2: MISS   FT 2/2: GOOD Vince Carter makes 1/2 from the line.
Score: 100-95

[06:58] Team_011 possession (Score: 100-95)
Tyrese Nowitzki attempts a 3Pt. Contested by Pau Bird (4.9 feet, MAN). Tyrese Nowitzki misses. Rebound secured by Josh Embiid.

[06:44] Team_088 possession (Score: 100-95)
Klay Quickley drives, Shai Leonard stays with him. Klay Quickley attempts a Layup. Contested by Shai Leonard (4.4 feet, MAN). KLAY QUICKLEY MAKES IT!
Score: 102-95

[06:33] Team_011 possession (Score: 102-95)
Russell Davis drives, Zion Harris stays with him. Russell Davis attempts a Layup. Contested by Zion Harris (5.4 feet, ZONE). RUSSELL DAVIS MAKES IT! Assist: Pau Towns
Score: 102-97

[06:17] Team_088 possession (Score: 102-97)
Vince Carter attempts a Layup. Contested by Russell Davis (3.5 feet, ZONE). VINCE CARTER MAKES IT!
Score: 104-97

[06:01] Team_011 possession (Score: 104-97)
Pau Towns attempts a 3Pt. Contested by Josh Embiid (5.2 feet, MAN). Pau Towns misses. Rebound secured by Zion Harris.

[05:51] Team_088 possession (Score: 104-97)
Josh Embiid attempts a Layup. Contested by Pau Towns (4.9 feet, MAN). Josh Embiid misses. Offensive rebound by Pau Bird! Pau Bird kicks it out.

[05:38] Team_088 possession (Score: 104-97)
FOUL! Holding foul on Pau Towns. [IN THE BONUS! 6 team fouls] Josh Embiid to the line for 2 free throws. (Pau Towns: 1 personal fouls)   FT 1/2: GOOD   FT 2/2: GOOD Josh Embiid makes 2/2 from the line.
Score: 106-97

[05:19] Team_011 possession (Score: 106-97)
FOUL! Reach-in foul on Zion Harris during the drive. [Team fouls: 3] No free throws, side out. (Zion Harris: 2 personal fouls)

[05:06] Team_011 possession (Score: 106-97)
FOUL! Reach-in foul on Josh Embiid during the drive. [Team fouls: 4] No free throws, side out. (Josh Embiid: 2 personal fouls)

[04:52] Team_011 possession (Score: 106-97)
Tyrese Nowitzki attempts a 3Pt. Contested by Pau Bird (4.9 feet, MAN). Tyrese Nowitzki misses. Rebound secured by Josh Embiid.

[04:38] Team_088 possession (Score: 106-97)
Zion Harris drives and kicks out. Pau Bird attempts a 3Pt. Contested by Tyrese Nowitzki (4.7 feet, MAN). Pau Bird misses. Rebound secured by Pau Towns.

[04:20] Team_011 possession (Score: 106-97)
FOUL! Reach-in foul on Zion Harris during the drive. [IN THE BONUS! 5 team fouls] Shai Leonard to the line for 2 free throws. (Zion Harris: 3 personal fouls)   FT 1/2: GOOD   FT 2/2: GOOD Shai Leonard makes 2/2 from the line.
Score: 106-99

[04:04] Team_088 possession (Score: 106-99)
Zion Harris drives and kicks out. Josh Embiid attempts a Midrange. Contested by Shai Leonard (4.3 feet, ZONE). Josh Embiid misses. Rebound secured by Pau Towns.

[03:48] Team_011 possession (Score: 106-99)
Russell Davis attempts a 3Pt. Contested by Zion Harris (5.4 feet, MAN). Russell Davis misses. FOUL! Loose ball foul on Josh Embiid during the rebound battle. [IN THE BONUS! 6 team fouls] Tyrese Nowitzki to the line for 2 free throws. (Josh Embiid: 3 personal fouls)   FT 1/2: MISS   FT 2/2: GOOD Tyrese Nowitzki makes 1/2 from the line.
Score: 106-100

[03:33] Team_088 possession (Score: 106-100)
FOUL! Shooting foul on Russell Davis. Josh Embiid to the line for 2 free throws. [BONUS: 7 team fouls] (Russell Davis: 2 personal fouls)   FT 1/2: GOOD   FT 2/2: GOOD Josh Embiid makes 2/2 from the line.
Score: 108-100

[03:21] Team_011 possession (Score: 108-100)
Russell Davis drives, Zion Harris stays with him. Russell Davis attempts a Dunk. Contested by Zion Harris (5.4 feet, MAN). Russell Davis misses. Rebound secured by Pau Bird.

[03:05] Team_088 possession (Score: 108-100)
Klay Quickley attempts a 3Pt. Contested by Shai Leonard (4.5 feet, ZONE). Klay Quickley misses. Rebound secured by Russell Davis.

[02:55] Team_011 possession (Score: 108-100)
Shai Leonard attempts a 3Pt. Contested by Klay Quickley (6.0 feet, MAN). Shai Leonard misses. Rebound secured by Pau Bird.

[02:40] Team_088 possession (Score: 108-100)
Josh Embiid drives to the basket... Josh Embiid loses control! Ball rolls out of bounds! TURNOVER! (dead ball)

[02:28] Team_011 possession (Score: 108-100)
De'Aaron George attempts a 3Pt. Contested by Vince Carter (5.2 feet, MAN). DE'AARON GEORGE MAKES IT! Assist: Pau Towns
Score: 108-103

[02:12] Team_088 possession (Score: 108-103)
Zion Harris attempts a Midrange. Contested by Russell Davis (4.4 feet, ZONE). Zion Harris misses. Rebound secured by Pau Towns.

[01:54] Team_011 possession (Score: 108-103)
Shai Leonard drives, Josh Embiid stays with him. Shai Leonard attempts a Layup. Contested by Josh Embiid (5.5 feet, ZONE). SHAI LEONARD MAKES IT! Assist: Russell Davis
Score: 108-105

[01:37] Team_088 possession (Score: 108-105)
Klay Quickley attempts a Midrange. Contested by Shai Leonard (4.6 feet, MAN). Klay Quickley misses. Rebound secured by Pau Towns.

[01:22] Team_011 possession (Score: 108-105)
De'Aaron George drives, Vince Carter stays with him. De'Aaron George attempts a Dunk. Contested by Vince Carter (5.3 feet, MAN). De'Aaron George misses. Rebound secured by Josh Embiid.

[01:07] Team_088 possession (Score: 108-105)
Vince Carter attempts a Midrange. Contested by De'Aaron George (4.7 feet, ZONE). Vince Carter misses. Rebound secured by Tyrese Nowitzki.

[00:52] Team_011 possession (Score: 108-105)
FOUL! Shooting foul on Pau Bird. De'Aaron George to the line for 3 free throws. [BONUS: 7 team fouls] (Pau Bird: 1 personal fouls)   FT 1/3: GOOD   FT 2/3: GOOD   FT 3/3: GOOD De'Aaron George makes 3/3 from the line.
Score: 108-108

[00:38] Team_088 possession (Score: 108-108)
Vince Carter attempts a 3Pt. Contested by De'Aaron George (4.7 feet, MAN). Vince Carter misses. Rebound secured by Tyrese Nowitzki.

[00:22] Team_011 possession (Score: 108-108)
Shai Leonard attempts a 3Pt. Contested by Pau Bird (5.4 feet, ZONE). SHAI LEONARD MAKES IT! Assist: De'Aaron George
Score: 108-111

[00:08] Team_088 possession (Score: 108-111)
Zion Harris drives, picks up Russell Davis. Help arrives from Shai Leonard! Zion Harris attempts a Dunk. Contested by Shai Leonard (4.6 feet, ZONE). Zion Harris misses. Offensive rebound by Pau Bird! Pau Bird kicks it out.

================================================================================
                              4TH QUARTER COMPLETE                              
================================================================================

4TH QUARTER SCORE: Team_088 20, Team_011 23

BOX SCORE:
================================================================================

Team_088
--------------------------------------------------------------------------------
Player                MIN  PTS  REB  AST  TO      FG   FG%      3P   3P%
--------------------------------------------------------------------------------
Pau Bird               17    5    6    0   0   2/2   100.0     0/0   0.0
Josh Embiid            17    4    4    1   0   2/2   100.0     0/0   0.0
Vince Carter           17    3    0    1   0   2/4    50.0     0/0   0.0
Giannis Smith          31    2    1    0   0   1/1   100.0     0/0   0.0
Allen Ming             31    2    0    1   0   1/2    50.0     0/0   0.0
Zion Harris            17    2    1    0   0   1/5    20.0     0/0   0.0
Klay Quickley          17    2    0    0   0   1/4    25.0     0/0   0.0
Tyler Hyland           31    0    1    0   0   0/0     0.0     0/0   0.0

TEAM: FG: 10/20 (50.0%), 3PT: 1/4 (25.0%), REB: 13 (4 off, 9 def), AST: 3, TO: 1
TEAM FOULS: 7 [Team_011 in BONUS]


Team_011
--------------------------------------------------------------------------------
Player                MIN  PTS  REB  AST  TO      FG   FG%      3P   3P%
--------------------------------------------------------------------------------
Shai Leonard           17    9    0    0   0   4/5    80.0     0/0   0.0
De'Aaron George        17    6    0    2   0   2/3    66.7     0/0   0.0
Russell Davis          17    4    2    1   0   2/4    50.0     0/0   0.0
Pau Towns              17    2    5    2   0   1/2    50.0     0/0   0.0
Tyrese Nowitzki        17    1    2    0   0   1/3    33.3     0/0   0.0
Evan George            31    0    1    0   0   0/1     0.0     0/0   0.0
Magic Tatum            31    0    0    0   0   0/1     0.0     0/0   0.0

TEAM: FG: 10/19 (52.6%), 3PT: 4/10 (40.0%), REB: 10 (0 off, 10 def), AST: 5, TO: 2
TEAM FOULS: 7 [Team_088 in BONUS]

================================================================================

================================================================================
                               FULL GAME COMPLETE                               
================================================================================

FINAL SCORE: Team_088 108, Team_011 111

SCORING BY QUARTER:
--------------------------------------------------------------------------------
Team                     Q1     Q2     Q3     Q4    FINAL
--------------------------------------------------------------------------------
Team_088                 27     30     31     20      108
Team_011                 27     33     28     23      111
--------------------------------------------------------------------------------

FULL GAME BOX SCORE:
================================================================================

Team_088
--------------------------------------------------------------------------------
Player                MIN  PTS  REB  AST  TO      FG   FG%      3P   3P%      FT STL BLK
--------------------------------------------------------------------------------
Josh Duncan            31    7    0    3   0   4/8    50.0   1/1   100.0   0/0     0   0
Tobias Haliburton      31   17    0    3   0   8/14   57.1   4/6    66.7   3/5     0   2
Tyler Hyland           31    7    8    3   0   3/7    42.9   1/2    50.0   2/2     1   0
Giannis Smith          31   21    6    3   2   7/14   50.0   1/5    20.0   1/1     0   0
Allen Ming             31   24   14    2   2  11/13   84.6   0/1     0.0   6/7     1   0
Klay Quickley          17    6    0    1   1   3/7    42.9   0/2     0.0   0/0     0   0
Vince Carter           17    3    0    2   1   3/6    50.0   0/2     0.0   1/2     0   0
Pau Bird               17    8    8    0   0   3/4    75.0   1/2    50.0   1/1     0   0
Zion Harris            17    2    1    0   0   1/6    16.7   0/1     0.0   0/0     0   0
Josh Embiid            17   11    5    2   1   3/3   100.0   0/0     0.0   4/4     0   0

TEAM: FG: 48/84 (57.1%), 3PT: 8/22 (36.4%), REB: 43 (11 off, 32 def), AST: 19, TO: 7


Team_011
--------------------------------------------------------------------------------
Player                MIN  PTS  REB  AST  TO      FG   FG%      3P   3P%      FT STL BLK
--------------------------------------------------------------------------------
Magic Tatum            31    7    0    6   2   6/13   46.2   2/7    28.6   2/5     0   0
Trae Tatum             31    9    0    1   0   4/9    44.4   1/3    33.3   0/0     0   1
Michael Carter         31   26    7    4   1  11/16   68.8   4/6    66.7   5/7     0   0
Pau Barnes             31   18    5    3   3   5/6    83.3   1/1   100.0   3/4     2   2
Evan George            31    6   14    4   2   3/7    42.9   0/2     0.0   1/2     0   0
Shai Leonard           17    9    0    1   0   4/7    57.1   1/3    33.3   2/2     0   0
De'Aaron George        17   10    0    2   1   4/5    80.0   2/2   100.0   3/3     0   0
Tyrese Nowitzki        17    6    6    2   0   2/5    40.0   1/4    25.0   1/2     0   0
Russell Davis          17    4    2    2   0   3/5    60.0   1/1   100.0   1/2     0   0
Pau Towns              17   13    8    3   0   6/7    85.7   1/2    50.0   2/2     0   1

TEAM: FG: 48/81 (59.3%), 3PT: 14/31 (45.2%), REB: 41 (7 off, 34 def), AST: 28, TO: 9

================================================================================
