================================================================================
                        FULL GAME - Team_068 vs Team_031                        
================================================================================

================================================================================
                       1ST QUARTER - Team_068 vs Team_031                       
================================================================================

[12:00] Team_068 possession (Score: 0-0)
Zion Anunoby attempts a 3Pt. Contested by Shai Durant (4.3 feet, MAN). Zion Anunoby misses. Rebound secured by Luka Sabonis.

[11:41] Team_031 possession (Score: 0-0)
Shai Durant attempts a 3Pt. Contested by Zion Anunoby (4.5 feet, ZONE). Shai Durant misses. Rebound secured by Gary Simons.

[11:24] Team_068 possession (Score: 0-0)
FOUL! Shooting foul on Immanuel James. Zion Anunoby to the line for 2 free throws. [Team fouls: 1] (Immanuel James: 1 personal fouls)   FT 1/2: GOOD   FT 2/2: GOOD Zion Anunoby makes 2/2 from the line.
Score: 2-0

[11:07] Team_031 possession (Score: 2-0)
Shai Durant attempts a Midrange. Contested by Zion Anunoby (4.5 feet, ZONE). Shai Durant misses. Rebound secured by Gary Simons.

[10:53] Team_068 possession (Score: 2-0)
FOUL! Reach-in foul on Immanuel James during the drive. [Team fouls: 2] No free throws, side out. (Immanuel James: 2 personal fouls)

[10:40] Team_068 possession (Score: 2-0)
Jaren Johnson attempts a 3Pt. Contested by Pau Irving (4.1 feet, MAN). JAREN JOHNSON MAKES IT! Assist: Zion Anunoby
Score: 5-0

[10:27] Team_031 possession (Score: 5-0)
Shai Durant drives to the basket... Shai Durant commits a violation (traveling/carry)! TURNOVER! (dead ball)

[10:13] Team_068 possession (Score: 5-0)
Jaren Johnson drives, Pau Irving stays with him. Jaren Johnson attempts a Dunk. Contested by Pau Irving (4.1 feet, MAN). JAREN JOHNSON MAKES IT!
Score: 7-0

[09:59] Team_031 possession (Score: 7-0)
Immanuel James throws a bad pass out of bounds! TURNOVER! (dead ball)

[09:46] Team_068 possession (Score: 7-0)
FOUL! Holding foul on Pau Irving. [Team fouls: 3] No free throws, side out. (Pau Irving: 1 personal fouls)

[09:34] Team_068 possession (Score: 7-0)
Jaren Johnson attempts a 3Pt. Contested by Pau Irving (4.1 feet, ZONE). JAREN JOHNSON MAKES IT! Assist: Gary Simons
Score: 10-0

[09:19] Team_031 possession (Score: 10-0)
Luka Sabonis makes the Dunk and draws the foul on Malcolm Herro! And-1! Luka Sabonis to the line for 1. [Team fouls: 1] (Malcolm Herro: 1 personal fouls)   FT 1/1: MISS Luka Sabonis makes 0/1 from the line. Rebound secured by Jaren Johnson.
Score: 10-2

[09:01] Team_068 possession (Score: 10-2)
Gary Simons attempts a Midrange. Contested by Immanuel James (3.8 feet, MAN). GARY SIMONS MAKES IT! Assist: Jaren Johnson
Score: 12-2

[08:47] Team_031 possession (Score: 12-2)
Pau Irving attempts a Layup. Contested by Jaren Johnson (3.7 feet, MAN). Pau Irving misses. Rebound secured by Jaren Johnson.

[08:36] Team_068 possession (Score: 12-2)
FOUL! Reach-in foul on Gary Morant during the drive. [Team fouls: 4] No free throws, side out. (Gary Morant: 1 personal fouls)

[08:22] Team_068 possession (Score: 12-2)
FOUL! Holding foul on Luka Sabonis. [IN THE BONUS! 5 team fouls] Nikola Ginobili to the line for 2 free throws. (Luka Sabonis: 1 personal fouls)   FT 1/2: MISS   FT 2/2: GOOD Nikola Ginobili makes 1/2 from the line.
Score: 13-2

[08:09] Team_031 possession (Score: 13-2)
Gary Morant attempts a Midrange. Contested by Malcolm Herro (4.8 feet, MAN). Gary Morant misses. Rebound secured by Nikola Ginobili.

[07:54] Team_068 possession (Score: 13-2)
Jaren Johnson attempts a 3Pt. Contested by Pau Irving (4.1 feet, ZONE). Jaren Johnson misses. Rebound secured by Gary Morant.

[07:39] Team_031 possession (Score: 13-2)
Pau Irving drives, Jaren Johnson stays with him. Pau Irving attempts a Dunk. Contested by Jaren Johnson (3.7 feet, MAN). Pau Irving misses. Rebound secured by Nikola Ginobili.

[07:24] Team_068 possession (Score: 13-2)
Gary Simons drives, Immanuel James stays with him. Gary Simons attempts a Layup. Contested by Immanuel James (3.8 feet, MAN). GARY SIMONS MAKES IT! Assist: Malcolm Herro
Score: 15-2

[07:10] Team_031 possession (Score: 15-2)
Gary Morant attempts a Midrange. Contested by Malcolm Herro (4.8 feet, MAN). GARY MORANT MAKES IT!
Score: 15-4

[06:59] Team_068 possession (Score: 15-4)
Nikola Ginobili drives and kicks out. Jaren Johnson attempts a Midrange. Contested by Pau Irving (3.6 feet, ZONE). Jaren Johnson misses. Rebound secured by Immanuel James.

[06:45] Team_031 possession (Score: 15-4)
Luka Sabonis makes the Dunk and draws the foul on Malcolm Herro! And-1! Luka Sabonis to the line for 1. [Team fouls: 2] (Malcolm Herro: 2 personal fouls)   FT 1/1: GOOD Luka Sabonis makes 1/1 from the line.
Score: 15-7

[06:34] Team_068 possession (Score: 15-7)
Jaren Johnson drives, Immanuel James stays with him. Jaren Johnson attempts a Dunk. Contested by Immanuel James (3.5 feet, ZONE). Jaren Johnson misses. Rebound secured by Luka Sabonis.

[06:23] Team_031 possession (Score: 15-7)
Gary Morant attempts a 3Pt. Contested by Zion Anunoby (5.0 feet, ZONE). Gary Morant misses. Rebound secured by Jaren Johnson.

[06:09] Team_068 possession (Score: 15-7)
Nikola Ginobili attempts a Midrange. Contested by Luka Sabonis (3.2 feet, MAN). Nikola Ginobili misses. Rebound secured by Immanuel James.

[05:54] Team_031 possession (Score: 15-7)
Pau Irving attempts a 3Pt. Contested by Zion Anunoby (4.5 feet, ZONE). Pau Irving misses. Offensive rebound by Luka Sabonis! Luka Sabonis puts it back in!
Score: 15-9

[05:42] Team_068 possession (Score: 15-9)
Nikola Ginobili attempts a Dunk. BLOCKED BY LUKA SABONIS! Ball is loose! Offensive rebound by Jaren Johnson! Jaren Johnson kicks it out.

[05:26] Team_068 possession (Score: 15-9)
Gary Simons attempts a Midrange. Contested by Gary Morant (4.6 feet, ZONE). Gary Simons misses. Rebound secured by Immanuel James.

[05:10] Team_031 possession (Score: 15-9)
Immanuel James drives, picks up Gary Simons. Help arrives from Malcolm Herro! Immanuel James attempts a Layup. Contested by Malcolm Herro (3.6 feet, ZONE). IMMANUEL JAMES MAKES IT! Assist: Pau Irving
Score: 15-11

[04:58] Team_068 possession (Score: 15-11)
Malcolm Herro attempts a Midrange. Contested by Gary Morant (3.8 feet, MAN). Malcolm Herro misses. Offensive rebound by Nikola Ginobili! Nikola Ginobili puts it back in!
Score: 17-11

[04:40] Team_031 possession (Score: 17-11)
Luka Sabonis drives, Gary Simons stays with him. Luka Sabonis attempts a Layup. Contested by Gary Simons (3.9 feet, ZONE). Luka Sabonis misses. Rebound secured by Nikola Ginobili.

[04:21] Team_068 possession (Score: 17-11)
Zion Anunoby attempts a Midrange. Contested by Shai Durant (4.3 feet, MAN). Zion Anunoby misses. Offensive rebound by Nikola Ginobili! Nikola Ginobili puts it back in!
Score: 19-11

[04:09] Team_031 possession (Score: 19-11)
FOUL! Offensive foul on Pau Irving! Jaren Johnson drew the charge! [Team fouls: 6] (Pau Irving: 2 personal fouls) TURNOVER! (dead ball)

[03:57] Team_068 possession (Score: 19-11)
Malcolm Herro attempts a 3Pt. Contested by Pau Irving (3.7 feet, ZONE). Malcolm Herro misses. Rebound secured by Immanuel James.

[03:43] Team_031 possession (Score: 19-11)
Luka Sabonis makes the Layup and draws the foul on Nikola Ginobili! And-1! Luka Sabonis to the line for 1. [Team fouls: 3] (Nikola Ginobili: 1 personal fouls)   FT 1/1: MISS Luka Sabonis makes 0/1 from the line. Rebound secured by Jaren Johnson.
Score: 19-13

[03:28] Team_068 possession (Score: 19-13)
Nikola Ginobili attempts a Midrange. Contested by Luka Sabonis (3.5 feet, MAN). Nikola Ginobili misses. Rebound secured by Immanuel James.

[03:15] Team_031 possession (Score: 19-13)
Pau Irving attempts a Midrange. Contested by Jaren Johnson (3.8 feet, MAN). Pau Irving misses. Rebound secured by Nikola Ginobili.

[03:03] Team_068 possession (Score: 19-13)
Jaren Johnson attempts a 3Pt. Contested by Pau Irving (4.3 feet, ZONE). Jaren Johnson misses. Rebound secured by Immanuel James.

[02:48] Team_031 possession (Score: 19-13)
Luka Sabonis attempts a 3Pt. Contested by Nikola Ginobili (5.0 feet, MAN). Luka Sabonis misses. Rebound secured by Gary Simons.

[02:35] Team_068 possession (Score: 19-13)
FOUL! Shooting foul on Immanuel James. Gary Simons to the line for 3 free throws. [BONUS: 7 team fouls] (Immanuel James: 3 personal fouls)   FT 1/3: MISS   FT 2/3: GOOD   FT 3/3: MISS Gary Simons makes 1/3 from the line. Rebound secured by Gary Morant.
Score: 20-13

[02:19] Team_031 possession (Score: 20-13)
FOUL! Shooting foul on Zion Anunoby. Shai Durant to the line for 3 free throws. [Team fouls: 4] (Zion Anunoby: 1 personal fouls)   FT 1/3: MISS   FT 2/3: MISS   FT 3/3: MISS Shai Durant makes 0/3 from the line. Rebound secured by Gary Simons.

[02:06] Team_068 possession (Score: 20-13)
Malcolm Herro attempts a Midrange. Contested by Pau Irving (3.9 feet, ZONE). Malcolm Herro misses. FOUL! Loose ball foul on Luka Sabonis during the rebound battle. [IN THE BONUS! 8 team fouls] Jaren Johnson to the line for 2 free throws. (Luka Sabonis: 2 personal fouls)   FT 1/2: GOOD   FT 2/2: GOOD Jaren Johnson makes 2/2 from the line.
Score: 22-13

[01:51] Team_031 possession (Score: 22-13)
Pau Irving attempts a Midrange. Contested by Jaren Johnson (4.0 feet, ZONE). Pau Irving misses. Rebound secured by Gary Simons.

[01:35] Team_068 possession (Score: 22-13)
Malcolm Herro attempts a 3Pt. Contested by Gary Morant (4.1 feet, MAN). Malcolm Herro misses. FOUL! Loose ball foul on Luka Sabonis during the rebound battle. [IN THE BONUS! 9 team fouls] Nikola Ginobili to the line for 2 free throws. (Luka Sabonis: 3 personal fouls)   FT 1/2: GOOD   FT 2/2: GOOD Nikola Ginobili makes 2/2 from the line.
Score: 24-13

[01:22] Team_031 possession (Score: 24-13)
Shai Durant attempts a Midrange. Contested by Jaren Johnson (4.1 feet, ZONE). SHAI DURANT MAKES IT!
Score: 24-15

[01:11] Team_068 possession (Score: 24-15)
Zion Anunoby attempts a 3Pt. Contested by Pau Irving (4.4 feet, ZONE). Zion Anunoby misses. Rebound secured by Immanuel James.

[01:02] Team_031 possession (Score: 24-15)
Luka Sabonis attempts a Layup. Contested by Nikola Ginobili (5.2 feet, MAN). LUKA SABONIS MAKES IT! Assist: Pau Irving
Score: 24-17

[00:49] Team_068 possession (Score: 24-17)
Jaren Johnson attempts a 3Pt. Contested by Pau Irving (4.5 feet, MAN). Jaren Johnson misses. Rebound secured by Luka Sabonis.

[00:31] Team_031 possession (Score: 24-17)
Gary Morant drives and kicks out. Immanuel James attempts a 3Pt. Contested by Gary Simons (3.9 feet, MAN). Immanuel James misses. Rebound secured by Gary Simons.

[00:17] Team_068 possession (Score: 24-17)
Zion Anunoby drives and kicks out. Nikola Ginobili attempts a Midrange. Contested by Shai Durant (4.5 feet, ZONE). Nikola Ginobili misses. Rebound secured by Gary Morant.

[00:07] Team_031 possession (Score: 24-17)
Gary Morant attempts a Midrange. Contested by Malcolm Herro (5.3 feet, MAN). Gary Morant misses. Rebound secured by Gary Simons.

================================================================================
                              1ST QUARTER COMPLETE                              
================================================================================

1ST QUARTER SCORE: Team_068 24, Team_031 17

BOX SCORE:
================================================================================

Team_068
--------------------------------------------------------------------------------
Player                MIN  PTS  REB  AST  TO      FG   FG%      3P   3P%
--------------------------------------------------------------------------------
Jaren Johnson          12   10    5    1   0   4/8    50.0     0/0   0.0
Nikola Ginobili        12    7    6    0   0   4/7    57.1     0/0   0.0
Gary Simons            12    4    7    1   0   2/4    50.0     0/0   0.0
Zion Anunoby           12    2    0    1   0   1/4    25.0     0/0   0.0
Malcolm Herro          12    0    0    1   0   0/1     0.0     0/0   0.0

TEAM: FG: 11/24 (45.8%), 3PT: 3/10 (30.0%), REB: 18 (3 off, 15 def), AST: 4, TO: 0
TEAM FOULS: 4


Team_031
--------------------------------------------------------------------------------
Player                MIN  PTS  REB  AST  TO      FG   FG%      3P   3P%
--------------------------------------------------------------------------------
Luka Sabonis           12    7    4    0   0   3/7    42.9     0/0   0.0
Shai Durant            12    2    0    0   0   1/4    25.0     0/0   0.0
Gary Morant            12    2    3    0   0   1/5    20.0     0/0   0.0
Immanuel James         12    2    7    0   0   1/1   100.0     0/0   0.0
Pau Irving             12    0    0    2   0   0/4     0.0     0/0   0.0

TEAM: FG: 6/21 (28.6%), 3PT: 1/5 (20.0%), REB: 14 (1 off, 13 def), AST: 2, TO: 3
TEAM FOULS: 9 [Team_068 in BONUS]

================================================================================

================================================================================
                       2ND QUARTER - Team_068 vs Team_031                       
================================================================================

[12:00] Team_068 possession (Score: 24-17)
Zion Anunoby attempts a Layup. Contested by Immanuel James (4.0 feet, ZONE). ZION ANUNOBY MAKES IT! Assist: Gary Simons
Score: 26-17

[11:46] Team_031 possession (Score: 26-17)
Luka Sabonis drives to the basket... Luka Sabonis throws a bad pass out of bounds! TURNOVER! (dead ball)

[11:46] Substitution (Team_068): Zion Anunoby OUT → Cole Anthony IN (stamina_rule2)

[11:46] Substitution (Team_068): Malcolm Herro OUT → Ja Banchero IN (stamina_rule2)

[11:46] Substitution (Team_068): Jaren Johnson OUT → Miles Murray IN (stamina_rule2)

[11:46] Substitution (Team_068): Gary Simons OUT → Jarrett Oladipo IN (stamina_rule2)

[11:46] Substitution (Team_068): Nikola Ginobili OUT → Franz Curry IN (stamina_rule2)

[11:46] Substitution (Team_031): Shai Durant OUT → Kevin Morant IN (stamina_rule2)

[11:46] Substitution (Team_031): Gary Morant OUT → Isaiah Ingram IN (stamina_rule2)

[11:46] Substitution (Team_031): Pau Irving OUT → Miles Stewart IN (stamina_rule2)

[11:46] Substitution (Team_031): Immanuel James OUT → Kobe Randle IN (stamina_rule2)

[11:46] Substitution (Team_031): Luka Sabonis OUT → Jimmy Poole IN (stamina_rule2)

[11:34] Team_068 possession (Score: 26-17)
Cole Anthony attempts a 3Pt. Contested by Miles Stewart (5.2 feet, ZONE). Cole Anthony misses. FOUL! Loose ball foul on Isaiah Ingram during the rebound battle. [Team fouls: 1] No free throws, side out. (Isaiah Ingram: 1 personal fouls)

[11:21] Team_068 possession (Score: 26-17)
Miles Murray attempts a 3Pt. Contested by Miles Stewart (5.5 feet, ZONE). Miles Murray misses. Rebound secured by Jimmy Poole.

[11:10] Team_031 possession (Score: 26-17)
Kevin Morant attempts a 3Pt. Contested by Cole Anthony (4.8 feet, MAN). Kevin Morant misses. Offensive rebound by Jimmy Poole! Jimmy Poole kicks it out.

[10:55] Team_031 possession (Score: 26-17)
Kobe Randle attempts a 3Pt. Contested by Ja Banchero (5.8 feet, ZONE). KOBE RANDLE MAKES IT! Assist: Jimmy Poole
Score: 26-20

[10:41] Team_068 possession (Score: 26-20)
Franz Curry attempts a Layup. Contested by Kobe Randle (4.9 feet, ZONE). FRANZ CURRY MAKES IT! Assist: Jarrett Oladipo
Score: 28-20

[10:25] Team_031 possession (Score: 28-20)
Kobe Randle drives, Franz Curry stays with him. Kobe Randle attempts a Layup. Contested by Franz Curry (5.0 feet, ZONE). Kobe Randle misses. Rebound secured by Franz Curry.

[10:08] Team_068 possession (Score: 28-20)
Franz Curry attempts a Midrange. Contested by Isaiah Ingram (4.8 feet, ZONE). Franz Curry misses. Rebound secured by Kobe Randle.

[09:56] Team_031 possession (Score: 28-20)
Kobe Randle drives and kicks out. Kevin Morant attempts a 3Pt. Contested by Cole Anthony (4.7 feet, MAN). Kevin Morant misses. Rebound secured by Ja Banchero.

[09:44] Team_068 possession (Score: 28-20)
Cole Anthony attempts a 3Pt. Contested by Miles Stewart (5.2 feet, ZONE). Cole Anthony misses. Rebound secured by Isaiah Ingram.

[09:26] Team_031 possession (Score: 28-20)
Miles Stewart attempts a Midrange. Contested by Miles Murray (3.9 feet, MAN). Miles Stewart misses. Rebound secured by Ja Banchero.

[09:13] Team_068 possession (Score: 28-20)
Ja Banchero attempts a Layup. Contested by Kobe Randle (4.5 feet, ZONE). Ja Banchero misses. Offensive rebound by Jarrett Oladipo! Jarrett Oladipo kicks it out.

[09:02] Team_068 possession (Score: 28-20)
Cole Anthony attempts a Layup. Contested by Kevin Morant (4.8 feet, MAN). Cole Anthony misses. Offensive rebound by Franz Curry! Franz Curry's putback is no good. Rebound secured by Jimmy Poole.

[08:45] Team_031 possession (Score: 28-20)
FOUL! Reach-in foul on Franz Curry during the drive. [Team fouls: 1] No free throws, side out. (Franz Curry: 1 personal fouls)

[08:31] Team_031 possession (Score: 28-20)
Isaiah Ingram attempts a Midrange. Contested by Jarrett Oladipo (4.3 feet, ZONE). Isaiah Ingram misses. Offensive rebound by Isaiah Ingram! Isaiah Ingram kicks it out.

[08:16] Team_031 possession (Score: 28-20)
Isaiah Ingram attempts a 3Pt. Contested by Ja Banchero (5.6 feet, MAN). Isaiah Ingram misses. Rebound secured by Jarrett Oladipo.

[08:01] Team_068 possession (Score: 28-20)
Cole Anthony attempts a Midrange. Contested by Isaiah Ingram (4.2 feet, ZONE). Cole Anthony misses. Offensive rebound by Jarrett Oladipo! Jarrett Oladipo kicks it out.

[07:47] Team_068 possession (Score: 28-20)
Miles Murray drives and kicks out. Miles Murray attempts a 3Pt. Contested by Kevin Morant (4.9 feet, ZONE). MILES MURRAY MAKES IT! Assist: Ja Banchero
Score: 31-20

[07:33] Team_031 possession (Score: 31-20)
Jimmy Poole drives, Franz Curry stays with him. Jimmy Poole attempts a Dunk. Contested by Franz Curry (4.3 feet, ZONE). Jimmy Poole misses. Rebound secured by Jarrett Oladipo.

[07:21] Team_068 possession (Score: 31-20)
Cole Anthony attempts a 3Pt. Contested by Kevin Morant (4.8 feet, MAN). Cole Anthony misses. Rebound secured by Jimmy Poole.

[07:08] Team_031 possession (Score: 31-20)
Jimmy Poole drives and kicks out. Kevin Morant attempts a 3Pt. Contested by Ja Banchero (5.1 feet, ZONE). Kevin Morant misses. Rebound secured by Franz Curry.

[06:49] Team_068 possession (Score: 31-20)
Cole Anthony attempts a 3Pt. Contested by Kevin Morant (4.8 feet, MAN). COLE ANTHONY MAKES IT! Assist: Jarrett Oladipo
Score: 34-20

[06:35] Team_031 possession (Score: 34-20)
Miles Stewart attempts a Layup. Contested by Miles Murray (3.9 feet, MAN). MILES STEWART MAKES IT! Assist: Isaiah Ingram
Score: 34-22

[06:21] Team_068 possession (Score: 34-22)
Miles Murray attempts a 3Pt. Contested by Miles Stewart (5.5 feet, ZONE). Miles Murray misses. Rebound secured by Kobe Randle.

[06:05] Team_031 possession (Score: 34-22)
Isaiah Ingram attempts a 3Pt. Contested by Ja Banchero (5.6 feet, ZONE). ISAIAH INGRAM MAKES IT! Assist: Miles Stewart
Score: 34-25

[05:51] Team_068 possession (Score: 34-25)
Franz Curry attempts a 3Pt. Contested by Miles Stewart (5.8 feet, ZONE). Franz Curry misses. Offensive rebound by Franz Curry! Franz Curry's putback is no good. Rebound secured by Jimmy Poole.

[05:39] Team_031 possession (Score: 34-25)
Miles Stewart attempts a 3Pt. Contested by Miles Murray (3.9 feet, MAN). MILES STEWART MAKES IT! Assist: Kobe Randle
Score: 34-28

[05:24] Team_068 possession (Score: 34-28)
Franz Curry attempts a Midrange. Wide open! Jimmy Poole is 6.2 feet away. [MAN] FRANZ CURRY MAKES IT! Assist: Ja Banchero
Score: 36-28

[05:11] Team_031 possession (Score: 36-28)
Miles Stewart drives and kicks out. Kevin Morant attempts a Midrange. Contested by Cole Anthony (4.7 feet, MAN). KEVIN MORANT MAKES IT! Assist: Isaiah Ingram
Score: 36-30

[04:54] Team_068 possession (Score: 36-30)
Miles Murray attempts a Midrange. Contested by Miles Stewart (5.5 feet, MAN). MILES MURRAY MAKES IT! Assist: Ja Banchero
Score: 38-30

[04:43] Team_031 possession (Score: 38-30)
Miles Stewart loses the ball! Stripped by Miles Murray! TURNOVER! (live ball)

[04:28] Team_068 possession (Score: 38-30)
Franz Curry drives to the basket... FOUL! Offensive foul on Franz Curry! Kobe Randle drew the charge! [Team fouls: 2] (Franz Curry: 2 personal fouls) TURNOVER! (dead ball)

[04:13] Team_031 possession (Score: 38-30)
FOUL! Shooting foul on Ja Banchero. Kobe Randle to the line for 3 free throws. [Team fouls: 3] (Ja Banchero: 1 personal fouls)   FT 1/3: GOOD   FT 2/3: GOOD   FT 3/3: GOOD Kobe Randle makes 3/3 from the line.
Score: 38-33

[04:01] Team_068 possession (Score: 38-33)
Miles Murray drives and kicks out. Cole Anthony attempts a 3Pt. Contested by Kevin Morant (5.0 feet, MAN). Cole Anthony misses. Rebound secured by Isaiah Ingram.

[03:46] Team_031 possession (Score: 38-33)
Miles Stewart attempts a 3Pt. Contested by Ja Banchero (5.2 feet, ZONE). Miles Stewart misses. Rebound secured by Franz Curry.

[03:34] Team_068 possession (Score: 38-33)
Franz Curry attempts a Layup. Wide open! Jimmy Poole is 6.2 feet away. [MAN] FRANZ CURRY MAKES IT! Assist: Miles Murray
Score: 40-33

[03:17] Team_031 possession (Score: 40-33)
FOUL! Shooting foul on Ja Banchero. Kevin Morant to the line for 3 free throws. [Team fouls: 4] (Ja Banchero: 2 personal fouls)   FT 1/3: GOOD   FT 2/3: GOOD   FT 3/3: GOOD Kevin Morant makes 3/3 from the line.
Score: 40-36

[03:00] Team_068 possession (Score: 40-36)
Miles Murray attempts a Layup. Contested by Kobe Randle (4.8 feet, ZONE). MILES MURRAY MAKES IT!
Score: 42-36

[02:46] Team_031 possession (Score: 42-36)
Kobe Randle drives to the basket... Kobe Randle throws a bad pass out of bounds! TURNOVER! (dead ball)

[02:29] Team_068 possession (Score: 42-36)
Cole Anthony throws a bad pass out of bounds! TURNOVER! (dead ball)

[02:15] Team_031 possession (Score: 42-36)
Isaiah Ingram attempts a 3Pt. Contested by Ja Banchero (5.8 feet, ZONE). Isaiah Ingram misses. Rebound secured by Franz Curry.

[02:02] Team_068 possession (Score: 42-36)
Miles Murray drives to the basket... Miles Murray commits a violation (traveling/carry)! TURNOVER! (dead ball)

[01:44] Team_031 possession (Score: 42-36)
Kevin Morant attempts a Layup. BLOCKED BY COLE ANTHONY! Ball is loose! Rebound secured by Franz Curry.

[01:29] Team_068 possession (Score: 42-36)
Jarrett Oladipo drives to the basket... Jarrett Oladipo commits a violation (traveling/carry)! TURNOVER! (dead ball)

[01:11] Team_031 possession (Score: 42-36)
Kobe Randle drives and kicks out. Isaiah Ingram attempts a Midrange. Contested by Miles Murray (4.3 feet, ZONE). ISAIAH INGRAM MAKES IT! Assist: Kevin Morant
Score: 42-38

[00:58] Team_068 possession (Score: 42-38)
Franz Curry attempts a Layup. Wide open! Jimmy Poole is 6.4 feet away. [MAN] FRANZ CURRY MAKES IT! Assist: Jarrett Oladipo
Score: 44-38

[00:42] Team_031 possession (Score: 44-38)
Kevin Morant attempts a 3Pt. Contested by Ja Banchero (5.5 feet, ZONE). Kevin Morant misses. Offensive rebound by Jimmy Poole! Jimmy Poole kicks it out.

[00:31] Team_031 possession (Score: 44-38)
Kevin Morant drives and kicks out. Kobe Randle attempts a 3Pt. Contested by Jarrett Oladipo (4.4 feet, MAN). Kobe Randle misses. Offensive rebound by Kobe Randle! Kobe Randle kicks it out.

[00:21] Team_031 possession (Score: 44-38)
Miles Stewart attempts a Midrange. Contested by Miles Murray (4.3 feet, MAN). MILES STEWART MAKES IT! Assist: Kobe Randle
Score: 44-40

[00:04] Team_068 possession (Score: 44-40)
Jarrett Oladipo drives, picks up Kobe Randle. Help arrives from Isaiah Ingram! Jarrett Oladipo attempts a Dunk. Contested by Isaiah Ingram (5.3 feet, ZONE). Jarrett Oladipo misses. Rebound secured by Kobe Randle.

================================================================================
                              2ND QUARTER COMPLETE                              
================================================================================

2ND QUARTER SCORE: Team_068 20, Team_031 23

BOX SCORE:
================================================================================

Team_068
--------------------------------------------------------------------------------
Player                MIN  PTS  REB  AST  TO      FG   FG%      3P   3P%
--------------------------------------------------------------------------------
Franz Curry            12    8    5    0   0   4/6    66.7     0/0   0.0
Miles Murray           12    7    0    1   0   3/6    50.0     0/0   0.0
Cole Anthony           12    3    0    0   0   1/4    25.0     0/0   0.0
Zion Anunoby           12    2    0    0   0   1/1   100.0     0/0   0.0
Gary Simons            12    0    0    1   0   0/0     0.0     0/0   0.0
Jarrett Oladipo        12    0    5    3   0   0/1     0.0     0/0   0.0
Ja Banchero            12    0    2    3   0   0/0     0.0     0/0   0.0

TEAM: FG: 9/18 (50.0%), 3PT: 1/6 (16.7%), REB: 14 (5 off, 9 def), AST: 8, TO: 4
TEAM FOULS: 4


Team_031
--------------------------------------------------------------------------------
Player                MIN  PTS  REB  AST  TO      FG   FG%      3P   3P%
--------------------------------------------------------------------------------
Miles Stewart          12    7    0    1   0   3/5    60.0     0/0   0.0
Kobe Randle            12    6    4    2   0   2/4    50.0     0/0   0.0
Isaiah Ingram          12    5    3    2   0   2/4    50.0     0/0   0.0
Kevin Morant           12    5    0    1   0   2/3    66.7     0/0   0.0
Jimmy Poole            12    0    6    1   0   0/2     0.0     0/0   0.0

TEAM: FG: 9/18 (50.0%), 3PT: 5/8 (62.5%), REB: 11 (4 off, 7 def), AST: 7, TO: 3
TEAM FOULS: 1

================================================================================

================================================================================
                       3RD QUARTER - Team_068 vs Team_031                       
================================================================================

[12:00] Team_068 possession (Score: 44-40)
Jaren Johnson attempts a 3Pt. Contested by Pau Irving (4.1 feet, MAN). Jaren Johnson misses. Rebound secured by Gary Morant.

[11:42] Team_031 possession (Score: 44-40)
Gary Morant drives and kicks out. Shai Durant attempts a 3Pt. Contested by Zion Anunoby (4.4 feet, MAN). Shai Durant misses. Rebound secured by Jaren Johnson.

[11:30] Team_068 possession (Score: 44-40)
FOUL! Shooting foul on Pau Irving. Jaren Johnson to the line for 2 free throws. [Team fouls: 1] (Pau Irving: 1 personal fouls)   FT 1/2: GOOD   FT 2/2: GOOD Jaren Johnson makes 2/2 from the line.
Score: 46-40

[11:13] Team_031 possession (Score: 46-40)
Gary Morant attempts a Layup. Contested by Malcolm Herro (4.8 feet, MAN). GARY MORANT MAKES IT! Assist: Luka Sabonis
Score: 46-42

[10:56] Team_068 possession (Score: 46-42)
Malcolm Herro drives to the basket... Malcolm Herro loses the ball! Stripped by Gary Morant! TURNOVER! (live ball)

[10:43] Team_031 possession (Score: 46-42)
Luka Sabonis drives, picks up Nikola Ginobili. Help arrives from Malcolm Herro! Luka Sabonis attempts a Layup. Contested by Malcolm Herro (4.6 feet, MAN). LUKA SABONIS MAKES IT!
Score: 46-44

[10:28] Team_068 possession (Score: 46-44)
Malcolm Herro attempts a Midrange. Contested by Immanuel James (3.0 feet, ZONE). Malcolm Herro misses. FOUL! Loose ball foul on Immanuel James during the rebound battle. [Team fouls: 2] No free throws, side out. (Immanuel James: 1 personal fouls)

[10:17] Team_068 possession (Score: 46-44)
Malcolm Herro attempts a 3Pt. Contested by Pau Irving (3.6 feet, ZONE). Malcolm Herro misses. Rebound secured by Luka Sabonis.

[10:04] Team_031 possession (Score: 46-44)
Gary Morant drives to the basket... Gary Morant throws a bad pass! Stolen by Gary Simons! TURNOVER! (live ball)

[09:46] Team_068 possession (Score: 46-44)
Gary Simons drives, picks up Immanuel James. Help arrives from Shai Durant! Gary Simons attempts a Layup. Contested by Shai Durant (3.8 feet, MAN). GARY SIMONS MAKES IT! Assist: Zion Anunoby
Score: 48-44

[09:32] Team_031 possession (Score: 48-44)
Immanuel James drives and kicks out. Gary Morant attempts a 3Pt. Contested by Zion Anunoby (4.4 feet, ZONE). GARY MORANT MAKES IT!
Score: 48-47

[09:16] Team_068 possession (Score: 48-47)
Zion Anunoby attempts a Midrange. Contested by Pau Irving (4.0 feet, ZONE). Zion Anunoby misses. Rebound secured by Luka Sabonis.

[09:03] Team_031 possession (Score: 48-47)
Shai Durant attempts a 3Pt. Contested by Zion Anunoby (4.5 feet, MAN). Shai Durant misses. Rebound secured by Gary Simons.

[08:46] Team_068 possession (Score: 48-47)
Nikola Ginobili drives, Immanuel James stays with him. Nikola Ginobili attempts a Layup. Contested by Immanuel James (3.1 feet, ZONE). NIKOLA GINOBILI MAKES IT! Assist: Malcolm Herro
Score: 50-47

[08:29] Team_031 possession (Score: 50-47)
FOUL! Shooting foul on Malcolm Herro. Pau Irving to the line for 3 free throws. [Team fouls: 1] (Malcolm Herro: 1 personal fouls)   FT 1/3: GOOD   FT 2/3: GOOD   FT 3/3: GOOD Pau Irving makes 3/3 from the line.
Score: 50-50

[08:16] Team_068 possession (Score: 50-50)
Zion Anunoby attempts a Layup. Contested by Shai Durant (4.3 feet, MAN). ZION ANUNOBY MAKES IT!
Score: 52-50

[07:57] Team_031 possession (Score: 52-50)
Gary Morant throws a bad pass out of bounds! TURNOVER! (dead ball)

[07:43] Team_068 possession (Score: 52-50)
Gary Simons drives and kicks out. Jaren Johnson attempts a 3Pt. Contested by Pau Irving (3.6 feet, MAN). Jaren Johnson misses. Rebound secured by Gary Morant.

[07:28] Team_031 possession (Score: 52-50)
Pau Irving attempts a 3Pt. Contested by Zion Anunoby (4.5 feet, ZONE). Pau Irving misses. Rebound secured by Gary Simons.

[07:14] Team_068 possession (Score: 52-50)
Nikola Ginobili makes the Midrange and draws the foul on Gary Morant! And-1! Nikola Ginobili to the line for 1. [Team fouls: 3] (Gary Morant: 1 personal fouls)   FT 1/1: GOOD Nikola Ginobili makes 1/1 from the line.
Score: 55-50

[06:57] Team_031 possession (Score: 55-50)
Shai Durant attempts a 3Pt. Contested by Zion Anunoby (4.5 feet, ZONE). Shai Durant misses. Rebound secured by Gary Simons.

[06:40] Team_068 possession (Score: 55-50)
Jaren Johnson makes the Dunk and draws the foul on Pau Irving! And-1! Jaren Johnson to the line for 1. [Team fouls: 4] (Pau Irving: 2 personal fouls)   FT 1/1: GOOD Jaren Johnson makes 1/1 from the line.
Score: 58-50

[06:25] Team_031 possession (Score: 58-50)
Immanuel James drives and kicks out. Luka Sabonis attempts a Midrange. Contested by Malcolm Herro (4.2 feet, ZONE). Luka Sabonis misses. Rebound secured by Gary Simons.

[06:09] Team_068 possession (Score: 58-50)
Jaren Johnson attempts a Midrange. Contested by Pau Irving (4.1 feet, MAN). JAREN JOHNSON MAKES IT! Assist: Gary Simons
Score: 60-50

[05:54] Team_031 possession (Score: 60-50)
Pau Irving attempts a Midrange. Contested by Gary Simons (3.2 feet, ZONE). Pau Irving misses. Offensive rebound by Immanuel James! Immanuel James puts it back in!
Score: 60-52

[05:41] Team_068 possession (Score: 60-52)
Jaren Johnson attempts a 3Pt. Contested by Pau Irving (4.1 feet, MAN). Jaren Johnson misses. Rebound secured by Luka Sabonis.

[05:31] Team_031 possession (Score: 60-52)
Pau Irving attempts a Midrange. Contested by Malcolm Herro (4.3 feet, ZONE). Pau Irving misses. Rebound secured by Gary Simons.

[05:15] Team_068 possession (Score: 60-52)
Zion Anunoby drives and kicks out. Zion Anunoby attempts a 3Pt. Contested by Shai Durant (3.9 feet, MAN). Zion Anunoby misses. Rebound secured by Immanuel James.

[05:02] Team_031 possession (Score: 60-52)
FOUL! Holding foul on Zion Anunoby. [Team fouls: 2] No free throws, side out. (Zion Anunoby: 1 personal fouls)

[04:51] Team_031 possession (Score: 60-52)
Immanuel James attempts a Midrange. Contested by Malcolm Herro (4.6 feet, ZONE). Immanuel James misses. Rebound secured by Nikola Ginobili.

[04:36] Team_068 possession (Score: 60-52)
Zion Anunoby drives, picks up Shai Durant. Help arrives from Pau Irving! Zion Anunoby attempts a Layup. Contested by Pau Irving (4.3 feet, MAN). ZION ANUNOBY MAKES IT! Assist: Malcolm Herro
Score: 62-52

[04:21] Team_031 possession (Score: 62-52)
FOUL! Shooting foul on Gary Simons. Shai Durant to the line for 2 free throws. [Team fouls: 3] (Gary Simons: 1 personal fouls)   FT 1/2: GOOD   FT 2/2: MISS Shai Durant makes 1/2 from the line. FOUL! Loose ball foul on Gary Simons during the free throw rebound! [Team fouls: 4] No free throws, side out. (Gary Simons: 2 personal fouls)
Score: 62-53

[04:10] Team_031 possession (Score: 62-53)
Pau Irving attempts a Midrange. Contested by Jaren Johnson (3.7 feet, ZONE). Pau Irving misses. Rebound secured by Gary Simons.

[03:53] Team_068 possession (Score: 62-53)
Gary Simons drives, Immanuel James stays with him. Gary Simons attempts a Layup. Contested by Immanuel James (4.0 feet, ZONE). GARY SIMONS MAKES IT! Assist: Jaren Johnson
Score: 64-53

[03:38] Team_031 possession (Score: 64-53)
Gary Morant attempts a 3Pt. Contested by Zion Anunoby (5.0 feet, ZONE). GARY MORANT MAKES IT! Assist: Luka Sabonis
Score: 64-56

[03:24] Team_068 possession (Score: 64-56)
Zion Anunoby throws a bad pass out of bounds! TURNOVER! (dead ball)

[03:09] Team_031 possession (Score: 64-56)
Luka Sabonis attempts a Layup. Contested by Gary Simons (4.0 feet, ZONE). LUKA SABONIS MAKES IT! Assist: Gary Morant
Score: 64-58

[02:51] Team_068 possession (Score: 64-58)
Malcolm Herro attempts a Midrange. Contested by Gary Morant (4.0 feet, MAN). Malcolm Herro misses. Rebound secured by Immanuel James.

[02:36] Team_031 possession (Score: 64-58)
Luka Sabonis drives, picks up Gary Simons. Help arrives from Malcolm Herro! Luka Sabonis attempts a Layup. Contested by Malcolm Herro (4.1 feet, ZONE). LUKA SABONIS MAKES IT! Assist: Shai Durant
Score: 64-60

[02:21] Team_068 possession (Score: 64-60)
FOUL! Shooting foul on Immanuel James. Jaren Johnson to the line for 2 free throws. [BONUS: 5 team fouls] (Immanuel James: 2 personal fouls)   FT 1/2: GOOD   FT 2/2: GOOD Jaren Johnson makes 2/2 from the line.
Score: 66-60

[02:07] Team_031 possession (Score: 66-60)
FOUL! Shooting foul on Jaren Johnson. Luka Sabonis to the line for 2 free throws. [BONUS: 5 team fouls] (Jaren Johnson: 1 personal fouls)   FT 1/2: MISS   FT 2/2: GOOD Luka Sabonis makes 1/2 from the line.
Score: 66-61

[01:53] Team_068 possession (Score: 66-61)
Malcolm Herro attempts a 3Pt. Contested by Shai Durant (4.1 feet, ZONE). MALCOLM HERRO MAKES IT! Assist: Nikola Ginobili
Score: 69-61

[01:39] Team_031 possession (Score: 69-61)
Shai Durant drives, Gary Simons stays with him. Shai Durant attempts a Dunk. Contested by Gary Simons (3.7 feet, ZONE). SHAI DURANT MAKES IT!
Score: 69-63

[01:25] Team_068 possession (Score: 69-63)
Jaren Johnson drives, Pau Irving stays with him. Jaren Johnson attempts a Dunk. Contested by Pau Irving (4.4 feet, MAN). JAREN JOHNSON MAKES IT! Assist: Malcolm Herro
Score: 71-63

[01:11] Team_031 possession (Score: 71-63)
Pau Irving attempts a 3Pt. Contested by Zion Anunoby (4.7 feet, ZONE). Pau Irving misses. Offensive rebound by Immanuel James! Immanuel James kicks it out.

[00:56] Team_031 possession (Score: 71-63)
FOUL! Reach-in foul on Gary Simons during the drive. [IN THE BONUS! 6 team fouls] Luka Sabonis to the line for 2 free throws. (Gary Simons: 3 personal fouls)   FT 1/2: MISS   FT 2/2: GOOD Luka Sabonis makes 1/2 from the line.
Score: 71-64

[00:39] Team_068 possession (Score: 71-64)
Gary Simons attempts a 3Pt. Contested by Immanuel James (4.4 feet, MAN). Gary Simons misses. Rebound secured by Gary Morant.

[00:27] Team_031 possession (Score: 71-64)
Gary Morant loses the ball! Stripped by Malcolm Herro! TURNOVER! (live ball)

[00:08] Team_068 possession (Score: 71-64)
Jaren Johnson attempts a 3Pt. Contested by Pau Irving (4.5 feet, MAN). JAREN JOHNSON MAKES IT! Assist: Zion Anunoby
Score: 74-64

================================================================================
                              3RD QUARTER COMPLETE                              
================================================================================

3RD QUARTER SCORE: Team_068 30, Team_031 24

BOX SCORE:
================================================================================

Team_068
--------------------------------------------------------------------------------
Player                MIN  PTS  REB  AST  TO      FG   FG%      3P   3P%
--------------------------------------------------------------------------------
Jaren Johnson          25   14    2    1   0   6/8    75.0     0/0   0.0
Nikola Ginobili        25    5    1    1   0   2/2   100.0     0/0   0.0
Gary Simons            25    4    6    1   0   2/4    50.0     0/0   0.0
Zion Anunoby           25    4    0    2   0   2/4    50.0     0/0   0.0
Malcolm Herro          25    3    0    3   0   1/3    33.3     0/0   0.0

TEAM: FG: 13/21 (61.9%), 3PT: 2/6 (33.3%), REB: 9 (1 off, 8 def), AST: 8, TO: 2
TEAM FOULS: 6 [Team_031 in BONUS]


Team_031
--------------------------------------------------------------------------------
Player                MIN  PTS  REB  AST  TO      FG   FG%      3P   3P%
--------------------------------------------------------------------------------
Gary Morant            25    8    3    1   0   3/4    75.0     0/0   0.0
Luka Sabonis           25    8    4    2   0   5/5   100.0     0/0   0.0
Pau Irving             25    3    0    0   0   1/4    25.0     0/0   0.0
Shai Durant            25    2    0    1   0   1/3    33.3     0/0   0.0
Immanuel James         25    2    4    0   0   1/3    33.3     0/0   0.0

TEAM: FG: 11/19 (57.9%), 3PT: 2/5 (40.0%), REB: 11 (3 off, 8 def), AST: 4, TO: 3
TEAM FOULS: 5 [Team_068 in BONUS]

================================================================================

================================================================================
                       4TH QUARTER - Team_068 vs Team_031                       
================================================================================

[12:00] Team_068 possession (Score: 74-64)
Zion Anunoby drives, Shai Durant stays with him. Zion Anunoby attempts a Dunk. Contested by Shai Durant (4.5 feet, MAN). ZION ANUNOBY MAKES IT!
Score: 76-64

[11:47] Team_031 possession (Score: 76-64)
Pau Irving drives to the basket... Pau Irving loses control! Ball rolls out of bounds! TURNOVER! (dead ball)

[11:47] Substitution (Team_068): Zion Anunoby OUT → Cole Anthony IN (stamina_rule2)

[11:47] Substitution (Team_068): Malcolm Herro OUT → Ja Banchero IN (stamina_rule2)

[11:47] Substitution (Team_068): Jaren Johnson OUT → Miles Murray IN (stamina_rule2)

[11:47] Substitution (Team_068): Gary Simons OUT → Jarrett Oladipo IN (stamina_rule2)

[11:47] Substitution (Team_068): Nikola Ginobili OUT → Franz Curry IN (stamina_rule2)

[11:47] Substitution (Team_031): Shai Durant OUT → Kevin Morant IN (stamina_rule2)

[11:47] Substitution (Team_031): Gary Morant OUT → Isaiah Ingram IN (stamina_rule2)

[11:47] Substitution (Team_031): Pau Irving OUT → Miles Stewart IN (stamina_rule2)

[11:47] Substitution (Team_031): Immanuel James OUT → Kobe Randle IN (stamina_rule2)

[11:47] Substitution (Team_031): Luka Sabonis OUT → Jimmy Poole IN (stamina_rule2)

[11:36] Team_068 possession (Score: 76-64)
FOUL! Holding foul on Jimmy Poole. [Team fouls: 1] No free throws, side out. (Jimmy Poole: 1 personal fouls)

[11:22] Team_068 possession (Score: 76-64)
Jarrett Oladipo attempts a 3Pt. Contested by Kobe Randle (4.8 feet, MAN). Jarrett Oladipo misses. Rebound secured by Isaiah Ingram.

[11:09] Team_031 possession (Score: 76-64)
Jimmy Poole attempts a 3Pt. Contested by Ja Banchero (5.1 feet, ZONE). JIMMY POOLE MAKES IT! Assist: Miles Stewart
Score: 76-67

[10:52] Team_068 possession (Score: 76-67)
Jarrett Oladipo attempts a Midrange. Contested by Kobe Randle (4.8 feet, MAN). JARRETT OLADIPO MAKES IT!
Score: 78-67

[10:39] Team_031 possession (Score: 78-67)
Isaiah Ingram attempts a Layup. Contested by Franz Curry (4.8 feet, ZONE). ISAIAH INGRAM MAKES IT!
Score: 78-69

[10:28] Team_068 possession (Score: 78-69)
Cole Anthony attempts a 3Pt. Contested by Miles Stewart (5.2 feet, ZONE). Cole Anthony misses. Offensive rebound by Jarrett Oladipo! Jarrett Oladipo kicks it out.

[10:14] Team_068 possession (Score: 78-69)
Ja Banchero attempts a Midrange. Contested by Isaiah Ingram (4.4 feet, MAN). JA BANCHERO MAKES IT! Assist: Jarrett Oladipo
Score: 80-69

[09:58] Team_031 possession (Score: 80-69)
Kevin Morant drives, Franz Curry stays with him. Kevin Morant attempts a Layup. Contested by Franz Curry (4.4 feet, ZONE). Kevin Morant misses. Rebound secured by Franz Curry.

[09:46] Team_068 possession (Score: 80-69)
Cole Anthony attempts a Midrange. Contested by Kevin Morant (4.8 feet, MAN). Cole Anthony misses. Offensive rebound by Franz Curry! Franz Curry puts it back in!
Score: 82-69

[09:30] Team_031 possession (Score: 82-69)
Isaiah Ingram makes the Midrange and draws the foul on Ja Banchero! And-1! Isaiah Ingram to the line for 1. [Team fouls: 1] (Ja Banchero: 1 personal fouls)   FT 1/1: MISS Isaiah Ingram makes 0/1 from the line. Rebound secured by Ja Banchero.
Score: 82-71

[09:16] Team_068 possession (Score: 82-71)
FOUL! Shooting foul on Kevin Morant. Ja Banchero to the line for 2 free throws. [Team fouls: 2] (Kevin Morant: 1 personal fouls)   FT 1/2: GOOD   FT 2/2: GOOD Ja Banchero makes 2/2 from the line.
Score: 84-71

[09:04] Team_031 possession (Score: 84-71)
FOUL! Shooting foul on Ja Banchero. Isaiah Ingram to the line for 2 free throws. [Team fouls: 2] (Ja Banchero: 2 personal fouls)   FT 1/2: MISS   FT 2/2: GOOD Isaiah Ingram makes 1/2 from the line.
Score: 84-72

[08:51] Team_068 possession (Score: 84-72)
Ja Banchero attempts a 3Pt. Contested by Kevin Morant (5.0 feet, ZONE). Ja Banchero misses. Offensive rebound by Jarrett Oladipo! Jarrett Oladipo kicks it out.

[08:39] Team_068 possession (Score: 84-72)
Ja Banchero drives, Kobe Randle stays with him. Ja Banchero attempts a Layup. Contested by Kobe Randle (4.5 feet, ZONE). JA BANCHERO MAKES IT! Assist: Franz Curry
Score: 86-72

[08:28] Team_031 possession (Score: 86-72)
Kevin Morant attempts a 3Pt. Contested by Cole Anthony (4.8 feet, MAN). Kevin Morant misses. Rebound secured by Jarrett Oladipo.

[08:08] Team_068 possession (Score: 86-72)
FOUL! Offensive foul on Miles Murray! Miles Stewart drew the charge! [Team fouls: 3] (Miles Murray: 1 personal fouls) TURNOVER! (dead ball)

[07:56] Team_031 possession (Score: 86-72)
Jimmy Poole drives, Franz Curry stays with him. Jimmy Poole attempts a Layup. Contested by Franz Curry (4.3 feet, ZONE). Jimmy Poole misses. Rebound secured by Franz Curry.

[07:39] Team_068 possession (Score: 86-72)
Cole Anthony drives, picks up Kobe Randle. Help arrives from Isaiah Ingram! Cole Anthony attempts a Layup. Contested by Isaiah Ingram (4.3 feet, ZONE). COLE ANTHONY MAKES IT! Assist: Jarrett Oladipo
Score: 88-72

[07:23] Team_031 possession (Score: 88-72)
Kevin Morant attempts a 3Pt. Contested by Cole Anthony (4.8 feet, MAN). KEVIN MORANT MAKES IT! Assist: Miles Stewart
Score: 88-75

[07:08] Team_068 possession (Score: 88-75)
Franz Curry drives to the basket... Franz Curry throws a bad pass out of bounds! TURNOVER! (dead ball)

[06:53] Team_031 possession (Score: 88-75)
Miles Stewart attempts a 3Pt. Contested by Ja Banchero (5.2 feet, ZONE). Miles Stewart misses. Offensive rebound by Jimmy Poole! Jimmy Poole kicks it out.

[06:35] Team_031 possession (Score: 88-75)
Jimmy Poole drives to the basket... Jimmy Poole throws a bad pass! Stolen by Franz Curry! TURNOVER! (live ball)

[06:22] Team_068 possession (Score: 88-75)
Franz Curry drives, Jimmy Poole stays with him. Franz Curry attempts a Dunk. Wide open! Jimmy Poole is 6.2 feet away. [MAN] FRANZ CURRY MAKES IT!
Score: 90-75

[06:07] Team_031 possession (Score: 90-75)
Miles Stewart attempts a 3Pt. Contested by Ja Banchero (5.2 feet, ZONE). MILES STEWART MAKES IT! Assist: Jimmy Poole
Score: 90-78

[05:52] Team_068 possession (Score: 90-78)
Ja Banchero attempts a Layup. Contested by Isaiah Ingram (4.4 feet, MAN). JA BANCHERO MAKES IT! Assist: Miles Murray
Score: 92-78

[05:36] Team_031 possession (Score: 92-78)
Kobe Randle attempts a 3Pt. Contested by Ja Banchero (5.8 feet, ZONE). Kobe Randle misses. Rebound secured by Franz Curry.

[05:25] Team_068 possession (Score: 92-78)
Miles Murray drives to the basket... Miles Murray throws a bad pass out of bounds! TURNOVER! (dead ball)

[05:11] Team_031 possession (Score: 92-78)
Kevin Morant attempts a Midrange. Contested by Jarrett Oladipo (3.9 feet, ZONE). Kevin Morant misses. Offensive rebound by Jimmy Poole! Jimmy Poole kicks it out.

[04:55] Team_031 possession (Score: 92-78)
Isaiah Ingram attempts a Layup. BLOCKED BY MILES MURRAY! Ball is loose! Rebound secured by Jarrett Oladipo.

[04:42] Team_068 possession (Score: 92-78)
Cole Anthony drives, picks up Kevin Morant. Help arrives from Isaiah Ingram! Cole Anthony attempts a Dunk. Contested by Isaiah Ingram (4.8 feet, MAN). COLE ANTHONY MAKES IT! Assist: Miles Murray
Score: 94-78

[04:28] Team_031 possession (Score: 94-78)
Kobe Randle makes the Layup and draws the foul on Jarrett Oladipo! And-1! Kobe Randle to the line for 1. [Team fouls: 4] (Jarrett Oladipo: 1 personal fouls)   FT 1/1: GOOD Kobe Randle makes 1/1 from the line.
Score: 94-81

[04:13] Team_068 possession (Score: 94-81)
Franz Curry drives, Jimmy Poole stays with him. Franz Curry attempts a Dunk. Wide open! Jimmy Poole is 6.2 feet away. [MAN] FRANZ CURRY MAKES IT! Assist: Ja Banchero
Score: 96-81

[03:57] Team_031 possession (Score: 96-81)
Kobe Randle attempts a Midrange. Contested by Ja Banchero (5.8 feet, ZONE). KOBE RANDLE MAKES IT!
Score: 96-83

[03:44] Team_068 possession (Score: 96-83)
Miles Murray drives to the basket... Miles Murray throws a bad pass out of bounds! TURNOVER! (dead ball)

[03:26] Team_031 possession (Score: 96-83)
Jimmy Poole attempts a Layup. BLOCKED BY JA BANCHERO! Ball is loose! Rebound secured by Franz Curry.

[03:11] Team_068 possession (Score: 96-83)
Jarrett Oladipo attempts a Midrange. Contested by Kobe Randle (5.0 feet, MAN). Jarrett Oladipo misses. Rebound secured by Kobe Randle.

[02:58] Team_031 possession (Score: 96-83)
Isaiah Ingram attempts a Layup. Contested by Franz Curry (4.9 feet, ZONE). ISAIAH INGRAM MAKES IT! Assist: Kobe Randle
Score: 96-85

[02:43] Team_068 possession (Score: 96-85)
Miles Murray attempts a Midrange. Contested by Miles Stewart (5.7 feet, MAN). MILES MURRAY MAKES IT!
Score: 98-85

[02:31] Team_031 possession (Score: 98-85)
Isaiah Ingram attempts a 3Pt. Contested by Ja Banchero (5.7 feet, ZONE). Isaiah Ingram misses. Rebound secured by Jarrett Oladipo.

[02:16] Team_068 possession (Score: 98-85)
Miles Murray attempts a Midrange. Contested by Miles Stewart (5.7 feet, ZONE). Miles Murray misses. Rebound secured by Jimmy Poole.

[02:03] Team_031 possession (Score: 98-85)
FOUL! Reach-in foul on Franz Curry during the drive. [IN THE BONUS! 5 team fouls] Miles Stewart to the line for 2 free throws. (Franz Curry: 1 personal fouls)   FT 1/2: GOOD   FT 2/2: GOOD Miles Stewart makes 2/2 from the line.
Score: 98-87

[01:49] Team_068 possession (Score: 98-87)
FOUL! Shooting foul on Kevin Morant. Cole Anthony to the line for 2 free throws. [Team fouls: 3] (Kevin Morant: 2 personal fouls)   FT 1/2: GOOD   FT 2/2: MISS Cole Anthony makes 1/2 from the line. Rebound secured by Isaiah Ingram.
Score: 99-87

[01:33] Team_031 possession (Score: 99-87)
Isaiah Ingram loses the ball! Stripped by Ja Banchero! TURNOVER! (live ball)

[01:13] Team_068 possession (Score: 99-87)
Jarrett Oladipo attempts a 3Pt. Contested by Kobe Randle (5.2 feet, MAN). Jarrett Oladipo misses. Rebound secured by Isaiah Ingram.

[00:59] Team_031 possession (Score: 99-87)
Kobe Randle attempts a 3Pt. Wide open! Ja Banchero is 6.0 feet away. [ZONE] Kobe Randle misses. Rebound secured by Ja Banchero.

[00:47] Team_068 possession (Score: 99-87)
Miles Murray attempts a Layup. Contested by Kobe Randle (5.0 feet, ZONE). Miles Murray misses. Offensive rebound by Franz Curry! Franz Curry puts it back in!
Score: 101-87

[00:29] Team_031 possession (Score: 101-87)
Jimmy Poole throws a bad pass out of bounds! TURNOVER! (dead ball)

[00:16] Team_068 possession (Score: 101-87)
Franz Curry loses control! Ball rolls out of bounds! TURNOVER! (dead ball)

[00:04] Team_031 possession (Score: 101-87)
Jimmy Poole attempts a 3Pt. Contested by Ja Banchero (5.5 feet, ZONE). Jimmy Poole misses. Rebound secured by Franz Curry.

================================================================================
                              4TH QUARTER COMPLETE                              
================================================================================

4TH QUARTER SCORE: Team_068 27, Team_031 23

BOX SCORE:
================================================================================

Team_068
--------------------------------------------------------------------------------
Player                MIN  PTS  REB  AST  TO      FG   FG%      3P   3P%
--------------------------------------------------------------------------------
Ja Banchero            24    8    2    1   0   4/4   100.0     0/0   0.0
Franz Curry            24    8    7    1   0   4/4   100.0     0/0   0.0
Cole Anthony           24    4    0    0   0   2/3    66.7     0/0   0.0
Zion Anunoby           25    2    0    0   0   1/1   100.0     0/0   0.0
Jarrett Oladipo        24    2    5    2   0   1/4    25.0     0/0   0.0
Miles Murray           24    2    0    2   0   1/2    50.0     0/0   0.0

TEAM: FG: 13/18 (72.2%), 3PT: 0/2 (0.0%), REB: 14 (4 off, 10 def), AST: 6, TO: 5
TEAM FOULS: 5 [Team_031 in BONUS]


Team_031
--------------------------------------------------------------------------------
Player                MIN  PTS  REB  AST  TO      FG   FG%      3P   3P%
--------------------------------------------------------------------------------
Isaiah Ingram          24    5    3    0   0   3/6    50.0     0/0   0.0
Miles Stewart          24    5    0    2   0   2/2   100.0     0/0   0.0
Kobe Randle            24    5    1    1   0   2/4    50.0     0/0   0.0
Jimmy Poole            24    3    3    1   0   1/4    25.0     0/0   0.0
Kevin Morant           24    3    0    0   0   1/3    33.3     0/0   0.0

TEAM: FG: 9/19 (47.4%), 3PT: 3/8 (37.5%), REB: 7 (2 off, 5 def), AST: 4, TO: 4
TEAM FOULS: 3

================================================================================

================================================================================
                               FULL GAME COMPLETE                               
================================================================================

FINAL SCORE: Team_068 101, Team_031 87

SCORING BY QUARTER:
--------------------------------------------------------------------------------
Team                     Q1     Q2     Q3     Q4    FINAL
--------------------------------------------------------------------------------
Team_068                 24     20     30     27      101
Team_031                 17     23     24     23       87
--------------------------------------------------------------------------------

FULL GAME BOX SCORE:
================================================================================

Team_068
--------------------------------------------------------------------------------
Player                MIN  PTS  REB  AST  TO      FG   FG%      3P   3P%      FT STL BLK
--------------------------------------------------------------------------------
Zion Anunoby           25   10    0    3   2   6/11   54.5   0/2     0.0   2/2     0   0
Malcolm Herro          25    3    0    4   0   4/7    57.1   2/4    50.0   0/0     1   0
Jaren Johnson          25   24    7    2   0   9/15   60.0   3/8    37.5   7/7     0   0
Gary Simons            25    8   13    3   0   4/8    50.0   0/2     0.0   1/3     1   0
Nikola Ginobili        25   12    7    1   0   2/5    40.0   0/0     0.0   4/5     0   0
Cole Anthony           24    7    0    0   2   4/8    50.0   1/3    33.3   1/2     0   1
Ja Banchero            24    8    4    4   1   4/4   100.0   0/0     0.0   2/2     1   1
Miles Murray           24    9    0    3   3   5/9    55.6   0/2     0.0   0/0     1   1
Jarrett Oladipo        24    2   10    5   2   1/5    20.0   0/2     0.0   0/0     0   0
Franz Curry            24   16   12    1   1   6/8    75.0   0/1     0.0   0/0     1   0

TEAM: FG: 46/81 (56.8%), 3PT: 6/24 (25.0%), REB: 55 (13 off, 42 def), AST: 26, TO: 11


Team_031
--------------------------------------------------------------------------------
Player                MIN  PTS  REB  AST  TO      FG   FG%      3P   3P%      FT STL BLK
--------------------------------------------------------------------------------
Shai Durant            25    4    0    1   0   2/7    28.6   0/4     0.0   1/5     0   0
Gary Morant            25   10    6    1   2   3/8    37.5   1/2    50.0   0/0     1   0
Pau Irving             25    3    0    2   2   3/10   30.0   2/3    66.7   3/3     0   0
Immanuel James         25    4   11    0   1   2/4    50.0   0/0     0.0   0/0     0   0
Luka Sabonis           25   15    8    2   3   7/11   63.6   0/1     0.0   3/7     0   1
Kevin Morant           24    8    0    1   0   2/5    40.0   2/3    66.7   3/3     0   0
Isaiah Ingram          24   10    6    2   2   4/9    44.4   1/4    25.0   1/3     0   0
Miles Stewart          24   12    0    3   1   6/8    75.0   2/3    66.7   2/2     0   0
Kobe Randle            24   11    5    3   0   5/9    55.6   2/4    50.0   4/4     0   0
Jimmy Poole            24    3    9    2   2   1/6    16.7   1/2    50.0   0/0     0   0

TEAM: FG: 35/77 (45.5%), 3PT: 11/26 (42.3%), REB: 43 (10 off, 33 def), AST: 17, TO: 13

================================================================================
