================================================================================
                        FULL GAME - Team_073 vs Team_056                        
================================================================================

================================================================================
                       1ST QUARTER - Team_073 vs Team_056                       
================================================================================

[12:00] Team_073 possession (Score: 0-0)
FOUL! Shooting foul on Giannis Jokic. Carmelo Porzingis to the line for 3 free throws. [Team fouls: 1] (Giannis Jokic: 1 personal fouls)   FT 1/3: MISS   FT 2/3: GOOD   FT 3/3: GOOD Carmelo Porzingis makes 2/3 from the line.
Score: 2-0

[11:43] Team_056 possession (Score: 2-0)
Giannis Jokic attempts a 3Pt. Contested by Carmelo Young (4.9 feet, MAN). GIANNIS JOKIC MAKES IT! Assist: Yao Poole
Score: 2-3

[11:34] Team_073 possession (Score: 2-3)
Carmelo Young attempts a 3Pt. Contested by Giannis Jokic (4.5 feet, MAN). Carmelo Young misses. Rebound secured by Yao Poole.

[11:19] Team_056 possession (Score: 2-3)
Giannis Jokic attempts a 3Pt. Contested by Karl Williamson (3.5 feet, ZONE). Giannis Jokic misses. Rebound secured by Bradley Morant.

[11:06] Team_073 possession (Score: 2-3)
Carmelo Young drives, Giannis Jokic stays with him. Carmelo Young attempts a Dunk. Contested by Giannis Jokic (4.5 feet, MAN). CARMELO YOUNG MAKES IT!
Score: 4-3

[10:48] Team_056 possession (Score: 4-3)
Magic Russell attempts a Midrange. Contested by Carmelo Porzingis (4.1 feet, ZONE). Magic Russell misses. Rebound secured by Carmelo Porzingis.

[10:35] Team_073 possession (Score: 4-3)
FOUL! Reach-in foul on Jrue Lillard during the drive. [Team fouls: 2] No free throws, side out. (Jrue Lillard: 1 personal fouls)

[10:19] Team_073 possession (Score: 4-3)
Karl Williamson attempts a 3Pt. Contested by Giannis Jokic (4.6 feet, ZONE). Karl Williamson misses. Rebound secured by Jrue Lillard.

[10:07] Team_056 possession (Score: 4-3)
Tony Carter loses control! Ball rolls out of bounds! TURNOVER! (dead ball)

[09:54] Team_073 possession (Score: 4-3)
Isaiah Smith attempts a Layup. Contested by Jrue Lillard (4.0 feet, ZONE). ISAIAH SMITH MAKES IT!
Score: 6-3

[09:41] Team_056 possession (Score: 6-3)
Giannis Jokic attempts a 3Pt. Contested by Karl Williamson (3.5 feet, ZONE). Giannis Jokic misses. FOUL! Loose ball foul on Isaiah Smith during the rebound battle. [Team fouls: 1] No free throws, side out. (Isaiah Smith: 1 personal fouls)

[09:26] Team_056 possession (Score: 6-3)
Tony Carter attempts a 3Pt. Contested by Isaiah Smith (4.9 feet, ZONE). TONY CARTER MAKES IT! Assist: Yao Poole
Score: 6-6

[09:11] Team_073 possession (Score: 6-6)
Carmelo Porzingis attempts a 3Pt. Contested by Jrue Lillard (3.9 feet, MAN). Carmelo Porzingis misses. Rebound secured by Yao Poole.

[08:57] Team_056 possession (Score: 6-6)
Yao Poole attempts a Layup. Contested by Bradley Morant (3.6 feet, MAN). YAO POOLE MAKES IT!
Score: 6-8

[08:46] Team_073 possession (Score: 6-8)
Karl Williamson makes the Dunk and draws the foul on Jrue Lillard! And-1! Karl Williamson to the line for 1. [Team fouls: 3] (Jrue Lillard: 2 personal fouls)   FT 1/1: MISS Karl Williamson makes 0/1 from the line. Rebound secured by Jrue Lillard.
Score: 8-8

[08:30] Team_056 possession (Score: 8-8)
Jrue Lillard attempts a Layup. BLOCKED BY CARMELO PORZINGIS! Ball deflects out of bounds off Jrue Lillard.

[08:16] Team_073 possession (Score: 8-8)
Carmelo Young drives, Jrue Lillard stays with him. Carmelo Young attempts a Layup. Contested by Jrue Lillard (4.0 feet, ZONE). CARMELO YOUNG MAKES IT! Assist: Bradley Morant
Score: 10-8

[08:02] Team_056 possession (Score: 10-8)
Yao Poole attempts a 3Pt. Contested by Karl Williamson (2.8 feet, ZONE). YAO POOLE MAKES IT! Assist: Giannis Jokic
Score: 10-11

[07:43] Team_073 possession (Score: 10-11)
Carmelo Porzingis drives, Jrue Lillard stays with him. Carmelo Porzingis attempts a Dunk. Contested by Jrue Lillard (3.9 feet, ZONE). CARMELO PORZINGIS MAKES IT! Assist: Karl Williamson
Score: 12-11

[07:32] Team_056 possession (Score: 12-11)
FOUL! Reach-in foul on Bradley Morant during the drive. [Team fouls: 2] No free throws, side out. (Bradley Morant: 1 personal fouls)

[07:21] Team_056 possession (Score: 12-11)
Jrue Lillard makes the Layup and draws the foul on Carmelo Porzingis! And-1! Jrue Lillard to the line for 1. [Team fouls: 3] (Carmelo Porzingis: 1 personal fouls)   FT 1/1: GOOD Jrue Lillard makes 1/1 from the line.
Score: 12-14

[07:05] Team_073 possession (Score: 12-14)
Isaiah Smith attempts a Layup. Contested by Yao Poole (4.2 feet, ZONE). Isaiah Smith misses. Offensive rebound by Bradley Morant! Bradley Morant kicks it out.

[06:51] Team_073 possession (Score: 12-14)
Carmelo Porzingis makes the Layup and draws the foul on Jrue Lillard! And-1! Carmelo Porzingis to the line for 1. [Team fouls: 4] (Jrue Lillard: 3 personal fouls)   FT 1/1: GOOD Carmelo Porzingis makes 1/1 from the line.
Score: 15-14

[06:35] Team_056 possession (Score: 15-14)
Jrue Lillard drives, Carmelo Porzingis stays with him. Jrue Lillard attempts a Dunk. Contested by Carmelo Porzingis (4.3 feet, MAN). Jrue Lillard misses. Rebound secured by Bradley Morant.

[06:18] Team_073 possession (Score: 15-14)
Bradley Morant drives, picks up Jrue Lillard. Help arrives from Giannis Jokic! Bradley Morant attempts a Dunk. Contested by Giannis Jokic (4.2 feet, ZONE). BRADLEY MORANT MAKES IT! Assist: Isaiah Smith
Score: 17-14

[06:03] Team_056 possession (Score: 17-14)
Jrue Lillard attempts a Midrange. Contested by Carmelo Porzingis (4.3 feet, MAN). JRUE LILLARD MAKES IT!
Score: 17-16

[05:52] Team_073 possession (Score: 17-16)
FOUL! Shooting foul on Jrue Lillard. Karl Williamson to the line for 2 free throws. [BONUS: 5 team fouls] (Jrue Lillard: 4 personal fouls)   FT 1/2: MISS   FT 2/2: GOOD Karl Williamson makes 1/2 from the line.
Score: 18-16

[05:38] Team_056 possession (Score: 18-16)
FOUL! Reach-in foul on Bradley Morant during the drive. [Team fouls: 4] No free throws, side out. (Bradley Morant: 2 personal fouls)

[05:24] Team_056 possession (Score: 18-16)
Jrue Lillard drives to the basket... Jrue Lillard loses the ball! Stripped by Bradley Morant! TURNOVER! (live ball)

[05:07] Team_073 possession (Score: 18-16)
Karl Williamson attempts a 3Pt. Contested by Jrue Lillard (4.1 feet, ZONE). Karl Williamson misses. Rebound secured by Yao Poole.

[04:57] Team_056 possession (Score: 18-16)
Yao Poole attempts a 3Pt. Contested by Karl Williamson (2.8 feet, ZONE). Yao Poole misses. Rebound secured by Bradley Morant.

[04:44] Team_073 possession (Score: 18-16)
Karl Williamson attempts a 3Pt. Contested by Tony Carter (4.5 feet, MAN). Karl Williamson misses. FOUL! Loose ball foul on Yao Poole during the rebound battle. [IN THE BONUS! 6 team fouls] Carmelo Porzingis to the line for 2 free throws. (Yao Poole: 1 personal fouls)   FT 1/2: GOOD   FT 2/2: GOOD Carmelo Porzingis makes 2/2 from the line.
Score: 20-16

[04:33] Team_056 possession (Score: 20-16)
Giannis Jokic attempts a Midrange. Contested by Carmelo Young (5.0 feet, MAN). Giannis Jokic misses. Offensive rebound by Jrue Lillard! Jrue Lillard puts it back in!
Score: 20-18

[04:20] Team_073 possession (Score: 20-18)
Carmelo Young makes the Layup and draws the foul on Jrue Lillard! And-1! Carmelo Young to the line for 1. [BONUS: 7 team fouls] (Jrue Lillard: 5 personal fouls)   FT 1/1: GOOD Carmelo Young makes 1/1 from the line.
Score: 23-18

[04:05] Team_056 possession (Score: 23-18)
FOUL! Reach-in foul on Carmelo Young during the drive. [IN THE BONUS! 5 team fouls] Giannis Jokic to the line for 2 free throws. (Carmelo Young: 1 personal fouls)   FT 1/2: GOOD   FT 2/2: GOOD Giannis Jokic makes 2/2 from the line.
Score: 23-20

[03:54] Team_073 possession (Score: 23-20)
Karl Williamson attempts a 3Pt. Contested by Tony Carter (4.5 feet, MAN). Karl Williamson misses. Rebound secured by Tony Carter.

[03:41] Team_056 possession (Score: 23-20)
Magic Russell drives to the basket... FOUL! Offensive foul on Magic Russell! Bradley Morant drew the charge! [Team fouls: 8] (Magic Russell: 1 personal fouls) TURNOVER! (dead ball)

[03:24] Team_073 possession (Score: 23-20)
FOUL! Shooting foul on Jrue Lillard. Karl Williamson to the line for 2 free throws. [BONUS: 9 team fouls] (Jrue Lillard: 6 personal fouls) Jrue Lillard FOULS OUT!   FT 1/2: GOOD   FT 2/2: GOOD Karl Williamson makes 2/2 from the line.
Score: 25-20

[03:24] Substitution (Team_056): Jrue Lillard OUT (stamina: 72) → De'Aaron Murray IN (foul_out)

[03:09] Team_056 possession (Score: 25-20)
Giannis Jokic attempts a 3Pt. Contested by Carmelo Young (5.1 feet, MAN). Giannis Jokic misses. Rebound secured by Bradley Morant.

[02:57] Team_073 possession (Score: 25-20)
Karl Williamson attempts a Midrange. Contested by Tony Carter (4.6 feet, MAN). KARL WILLIAMSON MAKES IT!
Score: 27-20

[02:44] Team_056 possession (Score: 27-20)
Giannis Jokic attempts a Midrange. Contested by Carmelo Young (5.2 feet, MAN). Giannis Jokic misses. Rebound secured by Bradley Morant.

[02:27] Team_073 possession (Score: 27-20)
Karl Williamson drives, Tony Carter stays with him. Karl Williamson attempts a Dunk. Contested by Tony Carter (4.7 feet, MAN). Karl Williamson misses. Rebound secured by Magic Russell.

[02:13] Team_056 possession (Score: 27-20)
De'Aaron Murray attempts a 3Pt. Contested by Karl Williamson (3.5 feet, ZONE). DE'AARON MURRAY MAKES IT! Assist: Yao Poole
Score: 27-23

[02:01] Team_073 possession (Score: 27-23)
Carmelo Young attempts a 3Pt. Contested by Giannis Jokic (4.9 feet, MAN). Carmelo Young misses. Rebound secured by Yao Poole.

[01:47] Team_056 possession (Score: 27-23)
De'Aaron Murray drives to the basket... De'Aaron Murray throws a bad pass out of bounds! TURNOVER! (dead ball)

[01:47] Substitution (Team_073): Carmelo Young OUT → Zach Quickley IN (stamina_rule2)

[01:47] Substitution (Team_073): Isaiah Smith OUT → Luka Butler IN (stamina_rule2)

[01:47] Substitution (Team_073): Karl Williamson OUT → Dwyane McCollum IN (stamina_rule2)

[01:47] Substitution (Team_073): Carmelo Porzingis OUT → Shai Thompson IN (stamina_rule2)

[01:47] Substitution (Team_073): Bradley Morant OUT → Ja Rose IN (stamina_rule2)

[01:47] Substitution (Team_056): Giannis Jokic OUT → Damian Barrett IN (stamina_rule2)

[01:47] Substitution (Team_056): Magic Russell OUT → Giannis Jokic IN (stamina_rule2)

[01:47] Substitution (Team_056): Tony Carter OUT → CJ Anthony IN (stamina_rule2)

[01:47] Substitution (Team_056): Yao Poole OUT → Derrick Bane IN (stamina_rule2)

[01:34] Team_073 possession (Score: 27-23)
Ja Rose drives to the basket... Ja Rose throws a bad pass! Stolen by Derrick Bane! TURNOVER! (live ball)

[01:19] Team_056 possession (Score: 27-23)
CJ Anthony attempts a 3Pt. Contested by Luka Butler (4.3 feet, ZONE). CJ Anthony misses. Rebound secured by Dwyane McCollum.

[01:08] Team_073 possession (Score: 27-23)
Dwyane McCollum drives to the basket... Dwyane McCollum loses the ball! Stripped by CJ Anthony! TURNOVER! (live ball)

[00:53] Team_056 possession (Score: 27-23)
Derrick Bane attempts a 3Pt. Contested by Luka Butler (4.8 feet, ZONE). DERRICK BANE MAKES IT! Assist: Giannis Jokic
Score: 27-26

[00:36] Team_073 possession (Score: 27-26)
Zach Quickley attempts a 3Pt. Contested by Giannis Jokic (5.2 feet, ZONE). Zach Quickley misses. Offensive rebound by Dwyane McCollum! Dwyane McCollum puts it back in!
Score: 29-26

[00:22] Team_056 possession (Score: 29-26)
Giannis Jokic drives to the basket... Giannis Jokic throws a bad pass! Stolen by Shai Thompson! TURNOVER! (live ball)

[00:07] Team_073 possession (Score: 29-26)
Dwyane McCollum attempts a 3Pt. Contested by Giannis Jokic (5.0 feet, ZONE). Dwyane McCollum misses. Rebound secured by CJ Anthony.

================================================================================
                              1ST QUARTER COMPLETE                              
================================================================================

1ST QUARTER SCORE: Team_073 29, Team_056 26

BOX SCORE:
================================================================================

Team_073
--------------------------------------------------------------------------------
Player                MIN  PTS  REB  AST  TO      FG   FG%      3P   3P%
--------------------------------------------------------------------------------
Carmelo Porzingis      10    9    1    0   0   4/5    80.0     0/0   0.0
Carmelo Young          10    7    0    0   0   3/5    60.0     0/0   0.0
Karl Williamson        10    5    0    1   0   3/8    37.5     0/0   0.0
Bradley Morant         10    2    6    1   0   1/1   100.0     0/0   0.0
Isaiah Smith           10    2    0    1   0   1/1   100.0     0/0   0.0
Dwyane McCollum         2    2    2    0   0   1/2    50.0     0/0   0.0

TEAM: FG: 13/22 (59.1%), 3PT: 3/10 (30.0%), REB: 9 (2 off, 7 def), AST: 3, TO: 2
TEAM FOULS: 5 [Team_056 in BONUS]


Team_056
--------------------------------------------------------------------------------
Player                MIN  PTS  REB  AST  TO      FG   FG%      3P   3P%
--------------------------------------------------------------------------------
Jrue Lillard            9    7    4    0   0   3/5    60.0     0/0   0.0
Giannis Jokic          12    5    0    2   0   2/5    40.0     0/0   0.0
Yao Poole              10    5    4    3   0   2/3    66.7     0/0   0.0
Tony Carter            10    3    1    0   0   1/1   100.0     0/0   0.0
De'Aaron Murray         3    3    0    0   0   1/1   100.0     0/0   0.0
Derrick Bane            2    3    0    0   0   1/1   100.0     0/0   0.0
Magic Russell          10    0    1    0   0   0/1     0.0     0/0   0.0
CJ Anthony              2    0    1    0   0   0/1     0.0     0/0   0.0

TEAM: FG: 10/18 (55.6%), 3PT: 5/9 (55.6%), REB: 11 (2 off, 9 def), AST: 5, TO: 5
TEAM FOULS: 9 [Team_073 in BONUS]

================================================================================

================================================================================
                       2ND QUARTER - Team_073 vs Team_056                       
================================================================================

[12:00] Team_073 possession (Score: 29-26)
Karl Williamson drives, Tony Carter stays with him. Karl Williamson attempts a Dunk. Contested by Tony Carter (4.5 feet, MAN). KARL WILLIAMSON MAKES IT!
Score: 31-26

[11:45] Team_056 possession (Score: 31-26)
Giannis Jokic throws a bad pass out of bounds! TURNOVER! (dead ball)

[11:45] Substitution (Team_056): Giannis Jokic OUT → De'Aaron Murray IN (stamina_rule2)

[11:29] Team_073 possession (Score: 31-26)
Isaiah Smith makes the Layup and draws the foul on Jrue Lillard! And-1! Isaiah Smith to the line for 1. [Team fouls: 1] (Jrue Lillard: 1 personal fouls)   FT 1/1: GOOD Isaiah Smith makes 1/1 from the line.
Score: 34-26

[11:17] Team_056 possession (Score: 34-26)
Yao Poole attempts a Midrange. Contested by Karl Williamson (2.9 feet, ZONE). Yao Poole misses. Rebound secured by Bradley Morant.

[11:04] Team_073 possession (Score: 34-26)
Isaiah Smith drives and kicks out. Carmelo Young attempts a 3Pt. Contested by De'Aaron Murray (5.9 feet, MAN). CARMELO YOUNG MAKES IT! Assist: Isaiah Smith
Score: 37-26

[10:51] Team_056 possession (Score: 37-26)
Magic Russell attempts a 3Pt. Contested by Isaiah Smith (4.7 feet, MAN). MAGIC RUSSELL MAKES IT! Assist: Jrue Lillard
Score: 37-29

[10:33] Team_073 possession (Score: 37-29)
Isaiah Smith attempts a Midrange. BLOCKED BY MAGIC RUSSELL! Ball is loose! Rebound secured by Tony Carter.

[10:18] Team_056 possession (Score: 37-29)
Tony Carter attempts a Midrange. Contested by Karl Williamson (4.0 feet, MAN). Tony Carter misses. Rebound secured by Carmelo Porzingis.

[10:04] Team_073 possession (Score: 37-29)
Carmelo Young commits a violation (traveling/carry)! TURNOVER! (dead ball)

[10:04] Substitution (Team_073): Carmelo Young OUT → Zach Quickley IN (stamina_rule2)

[10:04] Substitution (Team_073): Isaiah Smith OUT → Luka Butler IN (stamina_rule2)

[10:04] Substitution (Team_056): Magic Russell OUT → Damian Barrett IN (stamina_rule2)

[10:04] Substitution (Team_056): Tony Carter OUT → CJ Anthony IN (stamina_rule2)

[10:04] Substitution (Team_056): Yao Poole OUT → Derrick Bane IN (stamina_rule2)

[09:45] Team_056 possession (Score: 37-29)
FOUL! Holding foul on Carmelo Porzingis. [Team fouls: 1] No free throws, side out. (Carmelo Porzingis: 1 personal fouls)

[09:28] Team_056 possession (Score: 37-29)
Jrue Lillard attempts a Layup. Contested by Carmelo Porzingis (4.6 feet, MAN). Jrue Lillard misses. Rebound secured by Luka Butler.

[09:12] Team_073 possession (Score: 37-29)
Carmelo Porzingis attempts a Layup. Contested by Jrue Lillard (4.0 feet, ZONE). Carmelo Porzingis misses. Rebound secured by CJ Anthony.

[08:57] Team_056 possession (Score: 37-29)
De'Aaron Murray throws a bad pass out of bounds! TURNOVER! (dead ball)

[08:57] Substitution (Team_073): Karl Williamson OUT → Dwyane McCollum IN (stamina_rule2)

[08:57] Substitution (Team_073): Carmelo Porzingis OUT → Shai Thompson IN (stamina_rule2)

[08:57] Substitution (Team_073): Bradley Morant OUT → Ja Rose IN (stamina_rule2)

[08:41] Team_073 possession (Score: 37-29)
Dwyane McCollum makes the Layup and draws the foul on Jrue Lillard! And-1! Dwyane McCollum to the line for 1. [Team fouls: 2] (Jrue Lillard: 2 personal fouls)   FT 1/1: GOOD Dwyane McCollum makes 1/1 from the line.
Score: 40-29

[08:27] Team_056 possession (Score: 40-29)
Derrick Bane drives to the basket... Derrick Bane commits a violation (traveling/carry)! TURNOVER! (dead ball)

[08:14] Team_073 possession (Score: 40-29)
Shai Thompson attempts a 3Pt. Contested by Jrue Lillard (4.3 feet, MAN). Shai Thompson misses. Rebound secured by Derrick Bane.

[07:55] Team_056 possession (Score: 40-29)
Derrick Bane attempts a Midrange. Contested by Ja Rose (5.9 feet, MAN). Derrick Bane misses. Rebound secured by Ja Rose.

[07:41] Team_073 possession (Score: 40-29)
Ja Rose attempts a 3Pt. Contested by Damian Barrett (5.7 feet, ZONE). Ja Rose misses. Rebound secured by Derrick Bane.

[07:26] Team_056 possession (Score: 40-29)
FOUL! Shooting foul on Shai Thompson. Jrue Lillard to the line for 2 free throws. [Team fouls: 2] (Shai Thompson: 1 personal fouls)   FT 1/2: MISS   FT 2/2: GOOD Jrue Lillard makes 1/2 from the line.
Score: 40-30

[07:11] Team_073 possession (Score: 40-30)
Zach Quickley drives and kicks out. Ja Rose attempts a 3Pt. Contested by De'Aaron Murray (5.9 feet, ZONE). Ja Rose misses. Rebound secured by CJ Anthony.

[07:00] Team_056 possession (Score: 40-30)
CJ Anthony makes the Layup and draws the foul on Dwyane McCollum! And-1! CJ Anthony to the line for 1. [Team fouls: 3] (Dwyane McCollum: 1 personal fouls)   FT 1/1: GOOD CJ Anthony makes 1/1 from the line.
Score: 40-33

[06:43] Team_073 possession (Score: 40-33)
Dwyane McCollum attempts a 3Pt. Contested by CJ Anthony (4.2 feet, MAN). Dwyane McCollum misses. Rebound secured by Derrick Bane.

[06:27] Team_056 possession (Score: 40-33)
Derrick Bane drives to the basket... Derrick Bane throws a bad pass! Stolen by Ja Rose! TURNOVER! (live ball)

[06:18] Team_073 possession (Score: 40-33)
Ja Rose attempts a Layup. Contested by Derrick Bane (5.6 feet, MAN). JA ROSE MAKES IT! Assist: Dwyane McCollum
Score: 42-33

[06:00] Team_056 possession (Score: 42-33)
FOUL! Reach-in foul on Shai Thompson during the drive. [Team fouls: 4] No free throws, side out. (Shai Thompson: 2 personal fouls)

[05:48] Team_056 possession (Score: 42-33)
Damian Barrett attempts a Midrange. Contested by Luka Butler (4.6 feet, ZONE). DAMIAN BARRETT MAKES IT! Assist: CJ Anthony
Score: 42-35

[05:31] Team_073 possession (Score: 42-35)
Zach Quickley drives, De'Aaron Murray stays with him. Zach Quickley attempts a Layup. Wide open! De'Aaron Murray is 6.4 feet away. [MAN] Zach Quickley misses. Offensive rebound by Ja Rose! Ja Rose kicks it out.

[05:14] Team_073 possession (Score: 42-35)
Shai Thompson drives to the basket... Shai Thompson loses control! Ball rolls out of bounds! TURNOVER! (dead ball)

[05:14] Substitution (Team_056): Jrue Lillard OUT → RJ Johnson IN (stamina_rule2)

[04:59] Team_056 possession (Score: 42-35)
Derrick Bane drives, Shai Thompson stays with him. Derrick Bane attempts a Layup. Contested by Shai Thompson (4.2 feet, ZONE). DERRICK BANE MAKES IT! Assist: RJ Johnson
Score: 42-37

[04:43] Team_073 possession (Score: 42-37)
Zach Quickley attempts a Midrange. Contested by Damian Barrett (5.8 feet, ZONE). Zach Quickley misses. Rebound secured by CJ Anthony.

[04:29] Team_056 possession (Score: 42-37)
De'Aaron Murray attempts a 3Pt. Contested by Zach Quickley (4.5 feet, MAN). De'Aaron Murray misses. Rebound secured by Ja Rose.

[04:18] Team_073 possession (Score: 42-37)
Luka Butler attempts a Layup. Wide open! Damian Barrett is 6.1 feet away. [MAN] LUKA BUTLER MAKES IT!
Score: 44-37

[04:03] Team_056 possession (Score: 44-37)
Derrick Bane drives and kicks out. RJ Johnson attempts a Midrange. Contested by Dwyane McCollum (4.1 feet, ZONE). RJ Johnson misses. Offensive rebound by RJ Johnson! RJ Johnson kicks it out.

[03:43] Team_056 possession (Score: 44-37)
De'Aaron Murray attempts a 3Pt. Contested by Zach Quickley (4.5 feet, MAN). De'Aaron Murray misses. Rebound secured by Shai Thompson.

[03:29] Team_073 possession (Score: 44-37)
Zach Quickley attempts a 3Pt. Wide open! De'Aaron Murray is 6.6 feet away. [MAN] ZACH QUICKLEY MAKES IT! Assist: Dwyane McCollum
Score: 47-37

[03:11] Team_056 possession (Score: 47-37)
Derrick Bane drives and kicks out. CJ Anthony attempts a 3Pt. Contested by Luka Butler (4.5 feet, ZONE). CJ Anthony misses. Offensive rebound by CJ Anthony! CJ Anthony kicks it out.

[02:59] Team_056 possession (Score: 47-37)
Derrick Bane attempts a Midrange. Contested by Ja Rose (5.9 feet, MAN). Derrick Bane misses. Rebound secured by Dwyane McCollum.

[02:43] Team_073 possession (Score: 47-37)
Dwyane McCollum makes the Midrange and draws the foul on Damian Barrett! And-1! Dwyane McCollum to the line for 1. [Team fouls: 3] (Damian Barrett: 1 personal fouls)   FT 1/1: GOOD Dwyane McCollum makes 1/1 from the line.
Score: 50-37

[02:28] Team_056 possession (Score: 50-37)
De'Aaron Murray drives to the basket... De'Aaron Murray loses the ball! Stripped by Zach Quickley! TURNOVER! (live ball)

[02:16] Team_073 possession (Score: 50-37)
Ja Rose attempts a Layup. Contested by RJ Johnson (4.5 feet, ZONE). JA ROSE MAKES IT! Assist: Shai Thompson
Score: 52-37

[02:03] Team_056 possession (Score: 52-37)
Damian Barrett attempts a 3Pt. Contested by Luka Butler (4.8 feet, ZONE). Damian Barrett misses. Rebound secured by Ja Rose.

[01:46] Team_073 possession (Score: 52-37)
Zach Quickley drives and kicks out. FOUL! Shooting foul on RJ Johnson. Shai Thompson to the line for 2 free throws. [Team fouls: 4] (RJ Johnson: 1 personal fouls)   FT 1/2: MISS   FT 2/2: GOOD Shai Thompson makes 1/2 from the line.
Score: 53-37

[01:26] Team_056 possession (Score: 53-37)
RJ Johnson drives and kicks out. Derrick Bane attempts a 3Pt. Contested by Ja Rose (5.7 feet, MAN). Derrick Bane misses. Rebound secured by Dwyane McCollum.

[01:08] Team_073 possession (Score: 53-37)
Luka Butler attempts a Layup. Wide open! Damian Barrett is 6.3 feet away. [MAN] LUKA BUTLER MAKES IT! Assist: Zach Quickley
Score: 55-37

[00:52] Team_056 possession (Score: 55-37)
FOUL! Reach-in foul on Zach Quickley during the drive. [IN THE BONUS! 5 team fouls] De'Aaron Murray to the line for 2 free throws. (Zach Quickley: 1 personal fouls)   FT 1/2: GOOD   FT 2/2: GOOD De'Aaron Murray makes 2/2 from the line.
Score: 55-39

[00:34] Team_073 possession (Score: 55-39)
Ja Rose makes the Midrange and draws the foul on Derrick Bane! And-1! Ja Rose to the line for 1. [BONUS: 5 team fouls] (Derrick Bane: 1 personal fouls)   FT 1/1: MISS Ja Rose makes 0/1 from the line. Rebound secured by CJ Anthony.
Score: 57-39

[00:19] Team_056 possession (Score: 57-39)
Damian Barrett drives and kicks out. Derrick Bane attempts a 3Pt. Contested by Luka Butler (4.9 feet, ZONE). Derrick Bane misses. Offensive rebound by RJ Johnson! RJ Johnson kicks it out.

[00:06] Team_056 possession (Score: 57-39)
RJ Johnson attempts a Midrange. Contested by Shai Thompson (4.2 feet, MAN). RJ Johnson misses. Rebound secured by Ja Rose.

================================================================================
                              2ND QUARTER COMPLETE                              
================================================================================

2ND QUARTER SCORE: Team_073 28, Team_056 13

BOX SCORE:
================================================================================

Team_073
--------------------------------------------------------------------------------
Player                MIN  PTS  REB  AST  TO      FG   FG%      3P   3P%
--------------------------------------------------------------------------------
Dwyane McCollum        11    6    2    2   0   2/3    66.7     0/0   0.0
Luka Butler            12    4    1    0   0   2/2   100.0     0/0   0.0
Ja Rose                11    4    5    0   0   2/4    50.0     0/0   0.0
Isaiah Smith           13    3    0    1   0   1/2    50.0     0/0   0.0
Carmelo Young          13    3    0    0   0   1/1   100.0     0/0   0.0
Zach Quickley          12    3    0    1   0   1/3    33.3     0/0   0.0
Karl Williamson        14    2    0    0   0   1/1   100.0     0/0   0.0
Shai Thompson          11    1    1    1   0   1/2    50.0     0/0   0.0
Bradley Morant         14    0    1    0   0   0/0     0.0     0/0   0.0
Carmelo Porzingis      14    0    1    0   0   0/1     0.0     0/0   0.0

TEAM: FG: 11/19 (57.9%), 3PT: 1/4 (25.0%), REB: 11 (1 off, 10 def), AST: 5, TO: 2
TEAM FOULS: 5 [Team_056 in BONUS]


Team_056
--------------------------------------------------------------------------------
Player                MIN  PTS  REB  AST  TO      FG   FG%      3P   3P%
--------------------------------------------------------------------------------
Magic Russell          13    3    0    0   0   1/1   100.0     0/0   0.0
CJ Anthony             12    3    5    1   0   1/1   100.0     0/0   0.0
Derrick Bane           12    2    3    0   0   1/3    33.3     0/0   0.0
Damian Barrett         12    2    0    0   0   1/2    50.0     0/0   0.0
De'Aaron Murray        15    2    0    0   0   1/3    33.3     0/0   0.0
Jrue Lillard           16    1    0    1   0   1/2    50.0     0/0   0.0
Yao Poole              13    0    0    0   0   0/1     0.0     0/0   0.0
Tony Carter            13    0    1    0   0   0/1     0.0     0/0   0.0
RJ Johnson              5    0    2    1   0   0/2     0.0     0/0   0.0

TEAM: FG: 6/16 (37.5%), 3PT: 1/4 (25.0%), REB: 11 (3 off, 8 def), AST: 3, TO: 5
TEAM FOULS: 5 [Team_073 in BONUS]

================================================================================

================================================================================
                       3RD QUARTER - Team_073 vs Team_056                       
================================================================================

[12:00] Team_073 possession (Score: 57-39)
Karl Williamson drives to the basket... Karl Williamson loses the ball! Stripped by Jrue Lillard! TURNOVER! (live ball)

[11:50] Team_056 possession (Score: 57-39)
FOUL! Reach-in foul on Karl Williamson during the drive. [Team fouls: 1] No free throws, side out. (Karl Williamson: 1 personal fouls)

[11:39] Team_056 possession (Score: 57-39)
Jrue Lillard attempts a Midrange. Contested by Carmelo Porzingis (4.3 feet, MAN). Jrue Lillard misses. Rebound secured by Bradley Morant.

[11:26] Team_073 possession (Score: 57-39)
Karl Williamson attempts a 3Pt. Contested by Giannis Jokic (4.6 feet, ZONE). Karl Williamson misses. Rebound secured by Yao Poole.

[11:10] Team_056 possession (Score: 57-39)
Giannis Jokic drives, picks up Carmelo Young. Help arrives from Isaiah Smith! Giannis Jokic attempts a Dunk. Contested by Isaiah Smith (4.9 feet, MAN). GIANNIS JOKIC MAKES IT! Assist: Jrue Lillard
Score: 57-41

[10:54] Team_073 possession (Score: 57-41)
Bradley Morant attempts a Midrange. Contested by Yao Poole (4.4 feet, MAN). BRADLEY MORANT MAKES IT! Assist: Karl Williamson
Score: 59-41

[10:39] Team_056 possession (Score: 59-41)
Jrue Lillard attempts a 3Pt. Contested by Karl Williamson (3.7 feet, ZONE). JRUE LILLARD MAKES IT! Assist: Giannis Jokic
Score: 59-44

[10:28] Team_073 possession (Score: 59-44)
FOUL! Reach-in foul on Tony Carter during the drive. [Team fouls: 1] No free throws, side out. (Tony Carter: 1 personal fouls)

[10:13] Team_073 possession (Score: 59-44)
Carmelo Porzingis attempts a 3Pt. Contested by Giannis Jokic (4.4 feet, ZONE). Carmelo Porzingis misses. FOUL! Loose ball foul on Yao Poole during the rebound battle. [Team fouls: 2] No free throws, side out. (Yao Poole: 1 personal fouls)

[10:00] Team_073 possession (Score: 59-44)
Isaiah Smith attempts a Midrange. Contested by Magic Russell (5.7 feet, ZONE). Isaiah Smith misses. Rebound secured by Jrue Lillard.

[09:49] Team_056 possession (Score: 59-44)
Giannis Jokic attempts a Midrange. Contested by Carmelo Young (4.9 feet, MAN). Giannis Jokic misses. Offensive rebound by Yao Poole! Yao Poole kicks it out.

[09:33] Team_056 possession (Score: 59-44)
Giannis Jokic attempts a Midrange. Contested by Carmelo Young (4.9 feet, MAN). Giannis Jokic misses. Rebound secured by Isaiah Smith.

[09:20] Team_073 possession (Score: 59-44)
Karl Williamson attempts a 3Pt. Contested by Tony Carter (4.4 feet, MAN). Karl Williamson misses. Offensive rebound by Bradley Morant! Bradley Morant kicks it out.

[09:07] Team_073 possession (Score: 59-44)
Carmelo Porzingis attempts a Midrange. Contested by Yao Poole (4.2 feet, ZONE). Carmelo Porzingis misses. Rebound secured by Jrue Lillard.

[08:53] Team_056 possession (Score: 59-44)
Giannis Jokic drives and kicks out. Giannis Jokic attempts a 3Pt. Contested by Carmelo Young (4.5 feet, MAN). Giannis Jokic misses. Rebound secured by Isaiah Smith.

[08:41] Team_073 possession (Score: 59-44)
Isaiah Smith attempts a 3Pt. Contested by Giannis Jokic (4.5 feet, ZONE). Isaiah Smith misses. Rebound secured by Tony Carter.

[08:29] Team_056 possession (Score: 59-44)
Yao Poole attempts a Layup. Contested by Bradley Morant (3.6 feet, ZONE). YAO POOLE MAKES IT! Assist: Giannis Jokic
Score: 59-46

[08:14] Team_073 possession (Score: 59-46)
Carmelo Young throws a bad pass! Stolen by Giannis Jokic! TURNOVER! (live ball)

[07:56] Team_056 possession (Score: 59-46)
FOUL! Shooting foul on Bradley Morant. Tony Carter to the line for 2 free throws. [Team fouls: 2] (Bradley Morant: 1 personal fouls)   FT 1/2: MISS   FT 2/2: GOOD Tony Carter makes 1/2 from the line.
Score: 59-47

[07:37] Team_073 possession (Score: 59-47)
Bradley Morant attempts a Midrange. Contested by Yao Poole (4.4 feet, MAN). Bradley Morant misses. Offensive rebound by Carmelo Porzingis! Carmelo Porzingis kicks it out.

[07:21] Team_073 possession (Score: 59-47)
Isaiah Smith drives, Jrue Lillard stays with him. Isaiah Smith attempts a Layup. Contested by Jrue Lillard (4.0 feet, ZONE). ISAIAH SMITH MAKES IT!
Score: 61-47

[07:05] Team_056 possession (Score: 61-47)
Tony Carter attempts a 3Pt. Contested by Karl Williamson (3.8 feet, MAN). Tony Carter misses. Rebound secured by Bradley Morant.

[06:47] Team_073 possession (Score: 61-47)
Isaiah Smith drives and kicks out. Bradley Morant attempts a 3Pt. Contested by Giannis Jokic (4.3 feet, ZONE). Bradley Morant misses. Rebound secured by Jrue Lillard.

[06:31] Team_056 possession (Score: 61-47)
Tony Carter attempts a Midrange. Contested by Carmelo Porzingis (4.4 feet, ZONE). TONY CARTER MAKES IT!
Score: 61-49

[06:17] Team_073 possession (Score: 61-49)
Carmelo Young attempts a 3Pt. Contested by Giannis Jokic (4.5 feet, MAN). Carmelo Young misses. Rebound secured by Tony Carter.

[06:02] Team_056 possession (Score: 61-49)
Tony Carter drives and kicks out. Jrue Lillard attempts a 3Pt. Contested by Carmelo Porzingis (3.7 feet, MAN). Jrue Lillard misses. Offensive rebound by Yao Poole! Yao Poole kicks it out.

[05:49] Team_056 possession (Score: 61-49)
Jrue Lillard drives and kicks out. Giannis Jokic attempts a 3Pt. Contested by Karl Williamson (3.1 feet, ZONE). Giannis Jokic misses. Rebound secured by Carmelo Porzingis.

[05:36] Team_073 possession (Score: 61-49)
Isaiah Smith attempts a Layup. Contested by Magic Russell (5.7 feet, MAN). ISAIAH SMITH MAKES IT!
Score: 63-49

[05:20] Team_056 possession (Score: 63-49)
Giannis Jokic drives and kicks out. Yao Poole attempts a 3Pt. Contested by Karl Williamson (3.1 feet, ZONE). Yao Poole misses. Rebound secured by Isaiah Smith.

[05:03] Team_073 possession (Score: 63-49)
Bradley Morant drives and kicks out. Carmelo Young attempts a 3Pt. Contested by Giannis Jokic (4.3 feet, MAN). CARMELO YOUNG MAKES IT! Assist: Karl Williamson
Score: 66-49

[04:46] Team_056 possession (Score: 66-49)
FOUL! Holding foul on Carmelo Porzingis. [Team fouls: 3] No free throws, side out. (Carmelo Porzingis: 1 personal fouls)

[04:29] Team_056 possession (Score: 66-49)
FOUL! Shooting foul on Bradley Morant. Jrue Lillard to the line for 2 free throws. [Team fouls: 4] (Bradley Morant: 2 personal fouls)   FT 1/2: MISS   FT 2/2: GOOD Jrue Lillard makes 1/2 from the line.
Score: 66-50

[04:12] Team_073 possession (Score: 66-50)
FOUL! Shooting foul on Giannis Jokic. Karl Williamson to the line for 2 free throws. [Team fouls: 3] (Giannis Jokic: 1 personal fouls)   FT 1/2: GOOD   FT 2/2: GOOD Karl Williamson makes 2/2 from the line.
Score: 68-50

[03:58] Team_056 possession (Score: 68-50)
Tony Carter attempts a 3Pt. Contested by Karl Williamson (3.8 feet, MAN). TONY CARTER MAKES IT! Assist: Yao Poole
Score: 68-53

[03:43] Team_073 possession (Score: 68-53)
Carmelo Porzingis drives and kicks out. FOUL! Shooting foul on Tony Carter. Carmelo Porzingis to the line for 2 free throws. [Team fouls: 4] (Tony Carter: 2 personal fouls)   FT 1/2: MISS   FT 2/2: GOOD Carmelo Porzingis makes 1/2 from the line.
Score: 69-53

[03:29] Team_056 possession (Score: 69-53)
Yao Poole drives, Bradley Morant stays with him. Yao Poole attempts a Layup. Contested by Bradley Morant (3.7 feet, ZONE). YAO POOLE MAKES IT!
Score: 69-55

[03:15] Team_073 possession (Score: 69-55)
Karl Williamson attempts a 3Pt. Contested by Giannis Jokic (4.7 feet, ZONE). Karl Williamson misses. Offensive rebound by Carmelo Porzingis! Carmelo Porzingis kicks it out.

[02:57] Team_073 possession (Score: 69-55)
Bradley Morant drives, Jrue Lillard stays with him. Bradley Morant attempts a Layup. Contested by Jrue Lillard (4.4 feet, ZONE). BRADLEY MORANT MAKES IT!
Score: 71-55

[02:40] Team_056 possession (Score: 71-55)
Yao Poole drives, Bradley Morant stays with him. Yao Poole attempts a Layup. Contested by Bradley Morant (3.8 feet, ZONE). Yao Poole misses. Offensive rebound by Jrue Lillard! Jrue Lillard's putback is no good. Offensive rebound by Jrue Lillard! Jrue Lillard kicks it out.

[02:29] Team_056 possession (Score: 71-55)
Jrue Lillard drives and kicks out. Yao Poole attempts a Midrange. Contested by Bradley Morant (4.1 feet, MAN). YAO POOLE MAKES IT!
Score: 71-57

[02:10] Team_073 possession (Score: 71-57)
Isaiah Smith drives, picks up Jrue Lillard. Help arrives from Giannis Jokic! Isaiah Smith attempts a Dunk. Contested by Giannis Jokic (4.3 feet, ZONE). Isaiah Smith misses. Rebound secured by Tony Carter.

[01:52] Team_056 possession (Score: 71-57)
FOUL! Shooting foul on Karl Williamson. Giannis Jokic to the line for 3 free throws. [BONUS: 5 team fouls] (Karl Williamson: 2 personal fouls)   FT 1/3: MISS   FT 2/3: GOOD   FT 3/3: GOOD Giannis Jokic makes 2/3 from the line.
Score: 71-59

[01:40] Team_073 possession (Score: 71-59)
FOUL! Holding foul on Giannis Jokic. [IN THE BONUS! 5 team fouls] Carmelo Young to the line for 2 free throws. (Giannis Jokic: 2 personal fouls)   FT 1/2: GOOD   FT 2/2: GOOD Carmelo Young makes 2/2 from the line.
Score: 73-59

[01:23] Team_056 possession (Score: 73-59)
FOUL! Holding foul on Bradley Morant. [IN THE BONUS! 6 team fouls] Yao Poole to the line for 2 free throws. (Bradley Morant: 3 personal fouls)   FT 1/2: GOOD   FT 2/2: GOOD Yao Poole makes 2/2 from the line.
Score: 73-61

[01:13] Team_073 possession (Score: 73-61)
Carmelo Young drives, Giannis Jokic stays with him. Carmelo Young attempts a Dunk. Contested by Giannis Jokic (4.9 feet, MAN). CARMELO YOUNG MAKES IT! Assist: Karl Williamson
Score: 75-61

[00:59] Team_056 possession (Score: 75-61)
Jrue Lillard attempts a Midrange. Contested by Carmelo Porzingis (4.7 feet, MAN). JRUE LILLARD MAKES IT!
Score: 75-63

[00:40] Team_073 possession (Score: 75-63)
FOUL! Holding foul on Giannis Jokic. [IN THE BONUS! 6 team fouls] Carmelo Young to the line for 2 free throws. (Giannis Jokic: 3 personal fouls)   FT 1/2: GOOD   FT 2/2: GOOD Carmelo Young makes 2/2 from the line.
Score: 77-63

[00:24] Team_056 possession (Score: 77-63)
Jrue Lillard drives and kicks out. Magic Russell attempts a Midrange. Contested by Isaiah Smith (4.7 feet, MAN). MAGIC RUSSELL MAKES IT! Assist: Yao Poole
Score: 77-65

[00:10] Team_073 possession (Score: 77-65)
Carmelo Young attempts a 3Pt. Contested by Giannis Jokic (5.0 feet, ZONE). Carmelo Young misses. Rebound secured by Tony Carter.

================================================================================
                              3RD QUARTER COMPLETE                              
================================================================================

3RD QUARTER SCORE: Team_073 20, Team_056 26

BOX SCORE:
================================================================================

Team_073
--------------------------------------------------------------------------------
Player                MIN  PTS  REB  AST  TO      FG   FG%      3P   3P%
--------------------------------------------------------------------------------
Carmelo Young          25    9    0    0   0   4/6    66.7     0/0   0.0
Bradley Morant         26    4    4    0   0   2/2   100.0     0/0   0.0
Isaiah Smith           25    4    3    0   0   2/6    33.3     0/0   0.0
Karl Williamson        26    2    0    3   0   1/2    50.0     0/0   0.0
Carmelo Porzingis      26    1    3    0   0   1/2    50.0     0/0   0.0

TEAM: FG: 10/18 (55.6%), 3PT: 0/4 (0.0%), REB: 10 (4 off, 6 def), AST: 3, TO: 2
TEAM FOULS: 6 [Team_056 in BONUS]


Team_056
--------------------------------------------------------------------------------
Player                MIN  PTS  REB  AST  TO      FG   FG%      3P   3P%
--------------------------------------------------------------------------------
Yao Poole              25    8    3    2   0   4/4   100.0     0/0   0.0
Jrue Lillard           28    6    4    1   0   3/5    60.0     0/0   0.0
Tony Carter            25    6    4    0   0   3/4    75.0     0/0   0.0
Giannis Jokic          25    4    0    2   0   2/5    40.0     0/0   0.0
Magic Russell          25    2    0    0   0   1/1   100.0     0/0   0.0

TEAM: FG: 13/19 (68.4%), 3PT: 3/4 (75.0%), REB: 11 (3 off, 8 def), AST: 5, TO: 0
TEAM FOULS: 6 [Team_073 in BONUS]

================================================================================

================================================================================
                       4TH QUARTER - Team_073 vs Team_056                       
================================================================================

[12:00] Team_073 possession (Score: 77-65)
FOUL! Shooting foul on Magic Russell. Isaiah Smith to the line for 3 free throws. [Team fouls: 1] (Magic Russell: 1 personal fouls)   FT 1/3: GOOD   FT 2/3: GOOD   FT 3/3: GOOD Isaiah Smith makes 3/3 from the line.
Score: 80-65

[11:50] Team_056 possession (Score: 80-65)
Magic Russell attempts a 3Pt. Contested by Isaiah Smith (4.8 feet, MAN). Magic Russell misses. Rebound secured by Isaiah Smith.

[11:32] Team_073 possession (Score: 80-65)
Bradley Morant attempts a Layup. Contested by Yao Poole (4.9 feet, MAN). BRADLEY MORANT MAKES IT!
Score: 82-65

[11:17] Team_056 possession (Score: 82-65)
Yao Poole attempts a 3Pt. Contested by Karl Williamson (3.1 feet, ZONE). Yao Poole misses. FOUL! Loose ball foul on Bradley Morant during the rebound battle. [Team fouls: 1] No free throws, side out. (Bradley Morant: 1 personal fouls)

[10:59] Team_056 possession (Score: 82-65)
FOUL! Reach-in foul on Bradley Morant during the drive. [Team fouls: 2] No free throws, side out. (Bradley Morant: 2 personal fouls)

[10:40] Team_056 possession (Score: 82-65)
Tony Carter loses the ball! Stripped by Karl Williamson! TURNOVER! (live ball)

[10:29] Team_073 possession (Score: 82-65)
Karl Williamson attempts a 3Pt. Contested by Tony Carter (4.8 feet, MAN). KARL WILLIAMSON MAKES IT! Assist: Carmelo Porzingis
Score: 85-65

[10:14] Team_056 possession (Score: 85-65)
Giannis Jokic drives to the basket... Giannis Jokic throws a bad pass out of bounds! TURNOVER! (dead ball)

[10:14] Substitution (Team_073): Carmelo Young OUT → Zach Quickley IN (stamina_rule2)

[10:14] Substitution (Team_073): Isaiah Smith OUT → Luka Butler IN (stamina_rule2)

[10:14] Substitution (Team_073): Karl Williamson OUT → Dwyane McCollum IN (stamina_rule2)

[10:14] Substitution (Team_073): Carmelo Porzingis OUT → Shai Thompson IN (stamina_rule2)

[10:14] Substitution (Team_073): Bradley Morant OUT → Ja Rose IN (stamina_rule2)

[10:14] Substitution (Team_056): Giannis Jokic OUT → De'Aaron Murray IN (stamina_rule2)

[10:14] Substitution (Team_056): Magic Russell OUT → Damian Barrett IN (stamina_rule2)

[10:14] Substitution (Team_056): Tony Carter OUT → CJ Anthony IN (stamina_rule2)

[10:14] Substitution (Team_056): Jrue Lillard OUT → RJ Johnson IN (stamina_rule2)

[10:14] Substitution (Team_056): Yao Poole OUT → Derrick Bane IN (stamina_rule2)

[09:56] Team_073 possession (Score: 85-65)
Dwyane McCollum attempts a 3Pt. Contested by CJ Anthony (4.2 feet, MAN). Dwyane McCollum misses. Offensive rebound by Ja Rose! Ja Rose kicks it out.

[09:37] Team_073 possession (Score: 85-65)
Ja Rose attempts a Layup. BLOCKED BY RJ JOHNSON! Ball is loose! Offensive rebound by Dwyane McCollum! Dwyane McCollum kicks it out.

[09:26] Team_073 possession (Score: 85-65)
FOUL! Reach-in foul on RJ Johnson during the drive. [Team fouls: 2] No free throws, side out. (RJ Johnson: 1 personal fouls)

[09:10] Team_073 possession (Score: 85-65)
Zach Quickley attempts a Midrange. Contested by Damian Barrett (5.8 feet, ZONE). Zach Quickley misses. Rebound secured by Derrick Bane.

[08:56] Team_056 possession (Score: 85-65)
FOUL! Holding foul on Ja Rose. [Team fouls: 3] No free throws, side out. (Ja Rose: 1 personal fouls)

[08:42] Team_056 possession (Score: 85-65)
CJ Anthony attempts a 3Pt. Contested by Dwyane McCollum (4.0 feet, MAN). CJ Anthony misses. Rebound secured by Dwyane McCollum.

[08:31] Team_073 possession (Score: 85-65)
Luka Butler attempts a 3Pt. Wide open! De'Aaron Murray is 6.4 feet away. [ZONE] LUKA BUTLER MAKES IT! Assist: Ja Rose
Score: 88-65

[08:19] Team_056 possession (Score: 88-65)
RJ Johnson attempts a Layup. Contested by Shai Thompson (3.9 feet, MAN). RJ JOHNSON MAKES IT! Assist: Damian Barrett
Score: 88-67

[08:05] Team_073 possession (Score: 88-67)
Luka Butler drives, RJ Johnson stays with him. Luka Butler attempts a Dunk. Contested by RJ Johnson (4.9 feet, ZONE). Luka Butler misses. Rebound secured by Derrick Bane.

[07:49] Team_056 possession (Score: 88-67)
RJ Johnson drives, Shai Thompson stays with him. RJ Johnson attempts a Dunk. Contested by Shai Thompson (3.9 feet, MAN). RJ JOHNSON MAKES IT! Assist: De'Aaron Murray
Score: 88-69

[07:32] Team_073 possession (Score: 88-69)
Shai Thompson attempts a 3Pt. Contested by RJ Johnson (4.6 feet, MAN). Shai Thompson misses. Rebound secured by Derrick Bane.

[07:18] Team_056 possession (Score: 88-69)
De'Aaron Murray attempts a Layup. BLOCKED BY SHAI THOMPSON! Ball is loose! Offensive rebound by CJ Anthony! CJ Anthony kicks it out.

[07:02] Team_056 possession (Score: 88-69)
FOUL! Shooting foul on Luka Butler. CJ Anthony to the line for 3 free throws. [Team fouls: 4] (Luka Butler: 1 personal fouls)   FT 1/3: GOOD   FT 2/3: MISS   FT 3/3: GOOD CJ Anthony makes 2/3 from the line.
Score: 88-71

[06:49] Team_073 possession (Score: 88-71)
Shai Thompson drives and kicks out. Shai Thompson attempts a 3Pt. Contested by RJ Johnson (4.4 feet, MAN). SHAI THOMPSON MAKES IT! Assist: Dwyane McCollum
Score: 91-71

[06:29] Team_056 possession (Score: 91-71)
FOUL! Reach-in foul on Shai Thompson during the drive. [IN THE BONUS! 5 team fouls] RJ Johnson to the line for 2 free throws. (Shai Thompson: 1 personal fouls)   FT 1/2: GOOD   FT 2/2: GOOD RJ Johnson makes 2/2 from the line.
Score: 91-73

[06:16] Team_073 possession (Score: 91-73)
Ja Rose attempts a Midrange. Wide open! De'Aaron Murray is 6.0 feet away. [ZONE] JA ROSE MAKES IT! Assist: Luka Butler
Score: 93-73

[05:59] Team_056 possession (Score: 93-73)
Damian Barrett drives, picks up Luka Butler. Help arrives from Dwyane McCollum! Damian Barrett attempts a Layup. Contested by Dwyane McCollum (4.6 feet, MAN). Damian Barrett misses. Offensive rebound by CJ Anthony! CJ Anthony kicks it out.

[05:49] Team_056 possession (Score: 93-73)
RJ Johnson attempts a Layup. Contested by Shai Thompson (3.9 feet, MAN). RJ JOHNSON MAKES IT!
Score: 93-75

[05:30] Team_073 possession (Score: 93-75)
Ja Rose drives, Derrick Bane stays with him. Ja Rose attempts a Layup. Contested by Derrick Bane (5.6 feet, MAN). JA ROSE MAKES IT! Assist: Dwyane McCollum
Score: 95-75

[05:15] Team_056 possession (Score: 95-75)
De'Aaron Murray attempts a 3Pt. Contested by Zach Quickley (4.6 feet, MAN). De'Aaron Murray misses. Offensive rebound by CJ Anthony! CJ Anthony kicks it out.

[05:02] Team_056 possession (Score: 95-75)
De'Aaron Murray attempts a 3Pt. Contested by Shai Thompson (3.9 feet, ZONE). De'Aaron Murray misses. Rebound secured by Dwyane McCollum.

[04:46] Team_073 possession (Score: 95-75)
Dwyane McCollum drives to the basket... Dwyane McCollum loses control! Ball rolls out of bounds! TURNOVER! (dead ball)

[04:29] Team_056 possession (Score: 95-75)
RJ Johnson attempts a 3Pt. Contested by Luka Butler (4.5 feet, ZONE). RJ Johnson misses. Offensive rebound by RJ Johnson! RJ Johnson kicks it out.

[04:13] Team_056 possession (Score: 95-75)
CJ Anthony drives to the basket... CJ Anthony loses control! Ball rolls out of bounds! TURNOVER! (dead ball)

[03:59] Team_073 possession (Score: 95-75)
Shai Thompson attempts a 3Pt. Wide open! De'Aaron Murray is 6.1 feet away. [ZONE] SHAI THOMPSON MAKES IT!
Score: 98-75

[03:45] Team_056 possession (Score: 98-75)
RJ Johnson makes the Layup and draws the foul on Shai Thompson! And-1! RJ Johnson to the line for 1. [BONUS: 6 team fouls] (Shai Thompson: 2 personal fouls)   FT 1/1: GOOD RJ Johnson makes 1/1 from the line.
Score: 98-78

[03:31] Team_073 possession (Score: 98-78)
Luka Butler attempts a 3Pt. Wide open! Damian Barrett is 6.1 feet away. [MAN] Luka Butler misses. FOUL! Loose ball foul on CJ Anthony during the rebound battle. [Team fouls: 3] No free throws, side out. (CJ Anthony: 1 personal fouls)

[03:14] Team_073 possession (Score: 98-78)
Dwyane McCollum makes the Dunk and draws the foul on RJ Johnson! And-1! Dwyane McCollum to the line for 1. [Team fouls: 4] (RJ Johnson: 2 personal fouls)   FT 1/1: GOOD Dwyane McCollum makes 1/1 from the line.
Score: 101-78

[02:57] Team_056 possession (Score: 101-78)
FOUL! Reach-in foul on Shai Thompson during the drive. [IN THE BONUS! 7 team fouls] CJ Anthony to the line for 2 free throws. (Shai Thompson: 3 personal fouls)   FT 1/2: GOOD   FT 2/2: GOOD CJ Anthony makes 2/2 from the line.
Score: 101-80

[02:48] Team_073 possession (Score: 101-80)
Zach Quickley drives and kicks out. FOUL! Shooting foul on De'Aaron Murray. Zach Quickley to the line for 3 free throws. [BONUS: 5 team fouls] (De'Aaron Murray: 1 personal fouls)   FT 1/3: GOOD   FT 2/3: GOOD   FT 3/3: GOOD Zach Quickley makes 3/3 from the line.
Score: 104-80

[02:32] Team_056 possession (Score: 104-80)
Derrick Bane drives and kicks out. CJ Anthony attempts a Midrange. Contested by Dwyane McCollum (4.2 feet, ZONE). CJ Anthony misses. Rebound secured by Shai Thompson.

[02:16] Team_073 possession (Score: 104-80)
Ja Rose attempts a Midrange. Contested by CJ Anthony (4.4 feet, ZONE). Ja Rose misses. Offensive rebound by Dwyane McCollum! Dwyane McCollum puts it back in!
Score: 106-80

[01:58] Team_056 possession (Score: 106-80)
De'Aaron Murray attempts a 3Pt. Contested by Luka Butler (4.7 feet, ZONE). DE'AARON MURRAY MAKES IT! Assist: Derrick Bane
Score: 106-83

[01:43] Team_073 possession (Score: 106-83)
Luka Butler attempts a Midrange. Wide open! Damian Barrett is 6.2 feet away. [ZONE] Luka Butler misses. Rebound secured by RJ Johnson.

[01:32] Team_056 possession (Score: 106-83)
Derrick Bane attempts a Midrange. Contested by Luka Butler (5.0 feet, ZONE). Derrick Bane misses. Rebound secured by Dwyane McCollum.

[01:19] Team_073 possession (Score: 106-83)
Zach Quickley attempts a 3Pt. Wide open! De'Aaron Murray is 6.4 feet away. [MAN] ZACH QUICKLEY MAKES IT! Assist: Dwyane McCollum
Score: 109-83

[01:07] Team_056 possession (Score: 109-83)
FOUL! Shooting foul on Shai Thompson. Derrick Bane to the line for 2 free throws. [BONUS: 8 team fouls] (Shai Thompson: 4 personal fouls)   FT 1/2: GOOD   FT 2/2: GOOD Derrick Bane makes 2/2 from the line.
Score: 109-85

[00:52] Team_073 possession (Score: 109-85)
Zach Quickley attempts a 3Pt. Wide open! De'Aaron Murray is 6.4 feet away. [ZONE] ZACH QUICKLEY MAKES IT! Assist: Dwyane McCollum
Score: 112-85

[00:40] Team_056 possession (Score: 112-85)
Derrick Bane attempts a 3Pt. Wide open! Ja Rose is 6.1 feet away. [MAN] Derrick Bane misses. Rebound secured by Shai Thompson.

[00:28] Team_073 possession (Score: 112-85)
Luka Butler attempts a Midrange. Contested by CJ Anthony (4.9 feet, ZONE). LUKA BUTLER MAKES IT! Assist: Dwyane McCollum
Score: 114-85

[00:14] Team_056 possession (Score: 114-85)
De'Aaron Murray attempts a 3Pt. Contested by Zach Quickley (4.7 feet, MAN). De'Aaron Murray misses. Rebound secured by Ja Rose.

================================================================================
                              4TH QUARTER COMPLETE                              
================================================================================

4TH QUARTER SCORE: Team_073 37, Team_056 20

BOX SCORE:
================================================================================

Team_073
--------------------------------------------------------------------------------
Player                MIN  PTS  REB  AST  TO      FG   FG%      3P   3P%
--------------------------------------------------------------------------------
Zach Quickley          22    9    0    0   0   3/4    75.0     0/0   0.0
Shai Thompson          21    6    2    0   0   2/3    66.7     0/0   0.0
Dwyane McCollum        21    5    6    5   0   2/2   100.0     0/0   0.0
Luka Butler            22    5    0    1   0   2/4    50.0     0/0   0.0
Ja Rose                21    4    2    1   0   2/2   100.0     0/0   0.0
Isaiah Smith           27    3    1    0   0   1/1   100.0     0/0   0.0
Karl Williamson        28    3    0    0   0   1/1   100.0     0/0   0.0
Bradley Morant         28    2    0    0   0   1/1   100.0     0/0   0.0
Carmelo Porzingis      28    0    0    1   0   0/0     0.0     0/0   0.0

TEAM: FG: 14/18 (77.8%), 3PT: 6/7 (85.7%), REB: 11 (4 off, 7 def), AST: 8, TO: 1
TEAM FOULS: 8 [Team_056 in BONUS]


Team_056
--------------------------------------------------------------------------------
Player                MIN  PTS  REB  AST  TO      FG   FG%      3P   3P%
--------------------------------------------------------------------------------
RJ Johnson             15   11    2    0   0   5/5   100.0     0/0   0.0
CJ Anthony             22    4    3    0   0   2/3    66.7     0/0   0.0
De'Aaron Murray        25    3    0    1   0   1/3    33.3     0/0   0.0
Derrick Bane           22    2    3    1   0   1/4    25.0     0/0   0.0
Magic Russell          27    0    0    0   0   0/1     0.0     0/0   0.0
Yao Poole              27    0    1    0   0   0/0     0.0     0/0   0.0
Damian Barrett         22    0    0    1   0   0/0     0.0     0/0   0.0

TEAM: FG: 9/16 (56.2%), 3PT: 2/7 (28.6%), REB: 9 (5 off, 4 def), AST: 3, TO: 3
TEAM FOULS: 5 [Team_073 in BONUS]

================================================================================

================================================================================
                               FULL GAME COMPLETE                               
================================================================================

FINAL SCORE: Team_073 114, Team_056 85

SCORING BY QUARTER:
--------------------------------------------------------------------------------
Team                     Q1     Q2     Q3     Q4    FINAL
--------------------------------------------------------------------------------
Team_073                 29     28     20     37      114
Team_056                 26     13     26     20       85
--------------------------------------------------------------------------------

FULL GAME BOX SCORE:
================================================================================

Team_073
--------------------------------------------------------------------------------
Player                MIN  PTS  REB  AST  TO      FG   FG%      3P   3P%      FT STL BLK
--------------------------------------------------------------------------------
Karl Williamson        28   12    0    4   1   7/13   53.8   2/6    33.3   5/7     1   0
Carmelo Porzingis      28   10    5    1   0   4/7    57.1   1/2    50.0   6/8     0   1
Bradley Morant         28    8   11    1   0   5/5   100.0   0/0     0.0   0/0     1   0
Carmelo Young          27   19    0    0   2   4/8    50.0   0/4     0.0   5/5     0   0
Isaiah Smith           27   12    4    2   0   6/11   54.5   1/2    50.0   4/4     0   0
Zach Quickley          22   12    0    1   1   6/9    66.7   4/4   100.0   3/3     1   0
Luka Butler            22    9    1    1   1   4/6    66.7   1/1   100.0   0/0     0   0
Dwyane McCollum        21   13   10    7   1   3/5    60.0   0/2     0.0   3/3     0   0
Shai Thompson          21    7    3    1   0   2/4    50.0   1/3    33.3   1/2     1   1
Ja Rose                21    8    7    1   1   5/7    71.4   0/1     0.0   0/1     1   0

TEAM: FG: 48/77 (62.3%), 3PT: 10/25 (40.0%), REB: 41 (11 off, 30 def), AST: 19, TO: 7


Team_056
--------------------------------------------------------------------------------
Player                MIN  PTS  REB  AST  TO      FG   FG%      3P   3P%      FT STL BLK
--------------------------------------------------------------------------------
Jrue Lillard           30   14    8    2   1   8/13   61.5   1/1   100.0   3/5     1   0
Giannis Jokic          27    9    0    4   2   5/11   45.5   2/4    50.0   4/5     1   0
Magic Russell          27    5    1    0   1   1/3    33.3   1/2    50.0   0/0     0   1
Tony Carter            27    9    6    0   3   4/6    66.7   2/3    66.7   1/2     0   0
Yao Poole              27   13    8    5   1   4/6    66.7   1/2    50.0   2/2     0   0
De'Aaron Murray        25    8    0    1   2   3/7    42.9   2/6    33.3   2/2     0   0
Damian Barrett         22    2    0    1   0   1/2    50.0   0/1     0.0   0/0     0   0
CJ Anthony             22    7    9    1   2   3/5    60.0   1/3    33.3   5/6     1   0
Derrick Bane           22    7    6    1   1   3/8    37.5   1/2    50.0   2/2     1   0
RJ Johnson             15   11    4    1   0   5/7    71.4   0/0     0.0   3/3     0   1

TEAM: FG: 38/69 (55.1%), 3PT: 11/24 (45.8%), REB: 42 (13 off, 29 def), AST: 16, TO: 13

================================================================================
