================================================================================
                        FULL GAME - Team_085 vs Team_004                        
================================================================================

================================================================================
                       1ST QUARTER - Team_085 vs Team_004                       
================================================================================

[12:00] Team_085 possession (Score: 0-0)
Larry Duncan attempts a 3Pt. Contested by Michael Curry (5.4 feet, ZONE). Larry Duncan misses. Rebound secured by Anthony Lillard.

[11:45] Team_004 possession (Score: 0-0)
Michael Curry drives to the basket... Michael Curry loses control! Ball rolls out of bounds! TURNOVER! (dead ball)

[11:32] Team_085 possession (Score: 0-0)
Larry Duncan attempts a 3Pt. Contested by Michael Curry (5.4 feet, ZONE). LARRY DUNCAN MAKES IT! Assist: Magic Beal
Score: 3-0

[11:17] Team_004 possession (Score: 3-0)
Anthony Lillard drives and kicks out. Anthony Lillard attempts a 3Pt. Contested by Collin Mobley (3.9 feet, MAN). Anthony Lillard misses. Rebound secured by Paul Wagner.

[11:03] Team_085 possession (Score: 3-0)
Collin Mobley attempts a Layup. Contested by Anthony Lillard (4.0 feet, ZONE). COLLIN MOBLEY MAKES IT! Assist: Paul Wagner
Score: 5-0

[10:44] Team_004 possession (Score: 5-0)
Jabari Wade attempts a 3Pt. Contested by Stephen Bird (4.1 feet, MAN). Jabari Wade misses. Rebound secured by Larry Duncan.

[10:28] Team_085 possession (Score: 5-0)
Collin Mobley drives to the basket... Collin Mobley loses control! Ball rolls out of bounds! TURNOVER! (dead ball)

[10:13] Team_004 possession (Score: 5-0)
Michael Curry attempts a 3Pt. Contested by Magic Beal (4.1 feet, MAN). Michael Curry misses. FOUL! Loose ball foul on Larry Duncan during the rebound battle. [Team fouls: 1] No free throws, side out. (Larry Duncan: 1 personal fouls)

[10:01] Team_004 possession (Score: 5-0)
Jabari Wade attempts a 3Pt. Contested by Stephen Bird (4.1 feet, MAN). Jabari Wade misses. Rebound secured by Collin Mobley.

[09:49] Team_085 possession (Score: 5-0)
Magic Beal drives to the basket... Magic Beal loses control! Ball rolls out of bounds! TURNOVER! (dead ball)

[09:30] Team_004 possession (Score: 5-0)
Jabari Wade attempts a 3Pt. Contested by Magic Beal (4.7 feet, ZONE). Jabari Wade misses. Rebound secured by Larry Duncan.

[09:18] Team_085 possession (Score: 5-0)
Paul Wagner attempts a Midrange. Contested by Draymond Fox (4.4 feet, MAN). PAUL WAGNER MAKES IT!
Score: 7-0

[09:04] Team_004 possession (Score: 7-0)
Michael Curry attempts a Midrange. Contested by Stephen Bird (3.5 feet, ZONE). Michael Curry misses. Rebound secured by Collin Mobley.

[08:48] Team_085 possession (Score: 7-0)
FOUL! Shooting foul on Michael Curry. Magic Beal to the line for 3 free throws. [Team fouls: 1] (Michael Curry: 1 personal fouls)   FT 1/3: GOOD   FT 2/3: GOOD   FT 3/3: GOOD Magic Beal makes 3/3 from the line.
Score: 10-0

[08:33] Team_004 possession (Score: 10-0)
Draymond Fox attempts a Midrange. Contested by Paul Wagner (3.9 feet, MAN). Draymond Fox misses. Rebound secured by Paul Wagner.

[08:17] Team_085 possession (Score: 10-0)
Magic Beal makes the Layup and draws the foul on Anthony Lillard! And-1! Magic Beal to the line for 1. [Team fouls: 2] (Anthony Lillard: 1 personal fouls)   FT 1/1: GOOD Magic Beal makes 1/1 from the line.
Score: 13-0

[08:02] Team_004 possession (Score: 13-0)
Dwyane Irving drives and kicks out. Jabari Wade attempts a Midrange. BLOCKED BY PAUL WAGNER! Ball is loose! Rebound secured by Paul Wagner.

[07:46] Team_085 possession (Score: 13-0)
Paul Wagner attempts a Layup. Contested by Anthony Lillard (4.4 feet, ZONE). PAUL WAGNER MAKES IT! Assist: Larry Duncan
Score: 15-0

[07:30] Team_004 possession (Score: 15-0)
FOUL! Offensive foul on Draymond Fox! Paul Wagner drew the charge! [Team fouls: 3] (Draymond Fox: 1 personal fouls) TURNOVER! (dead ball)

[07:13] Team_085 possession (Score: 15-0)
Larry Duncan attempts a 3Pt. Contested by Dwyane Irving (3.9 feet, MAN). Larry Duncan misses. Rebound secured by Draymond Fox.

[07:00] Team_004 possession (Score: 15-0)
Michael Curry attempts a 3Pt. Contested by Magic Beal (4.1 feet, ZONE). Michael Curry misses. Rebound secured by Collin Mobley.

[06:48] Team_085 possession (Score: 15-0)
Collin Mobley attempts a Layup. Contested by Anthony Lillard (4.0 feet, ZONE). Collin Mobley misses. Rebound secured by Anthony Lillard.

[06:30] Team_004 possession (Score: 15-0)
Draymond Fox attempts a 3Pt. Contested by Paul Wagner (3.9 feet, MAN). Draymond Fox misses. Rebound secured by Larry Duncan.

[06:14] Team_085 possession (Score: 15-0)
Paul Wagner drives and kicks out. Paul Wagner attempts a 3Pt. Contested by Michael Curry (5.0 feet, ZONE). PAUL WAGNER MAKES IT! Assist: Larry Duncan
Score: 18-0

[06:00] Team_004 possession (Score: 18-0)
Draymond Fox attempts a 3Pt. Contested by Magic Beal (4.4 feet, ZONE). DRAYMOND FOX MAKES IT! Assist: Jabari Wade
Score: 18-3

[05:43] Team_085 possession (Score: 18-3)
FOUL! Holding foul on Dwyane Irving. [Team fouls: 4] No free throws, side out. (Dwyane Irving: 1 personal fouls)

[05:29] Team_085 possession (Score: 18-3)
Paul Wagner attempts a Layup. Contested by Anthony Lillard (4.4 feet, ZONE). PAUL WAGNER MAKES IT! Assist: Larry Duncan
Score: 20-3

[05:09] Team_004 possession (Score: 20-3)
FOUL! Shooting foul on Collin Mobley. Michael Curry to the line for 2 free throws. [Team fouls: 2] (Collin Mobley: 1 personal fouls)   FT 1/2: MISS   FT 2/2: MISS Michael Curry makes 0/2 from the line. Rebound secured by Paul Wagner.

[04:52] Team_085 possession (Score: 20-3)
Collin Mobley drives, Anthony Lillard stays with him. Collin Mobley attempts a Layup. Contested by Anthony Lillard (4.1 feet, ZONE). COLLIN MOBLEY MAKES IT! Assist: Paul Wagner
Score: 22-3

[04:39] Team_004 possession (Score: 22-3)
Anthony Lillard drives, picks up Collin Mobley. Help arrives from Magic Beal! Anthony Lillard attempts a Layup. Contested by Magic Beal (4.3 feet, MAN). Anthony Lillard misses. Rebound secured by Larry Duncan.

[04:28] Team_085 possession (Score: 22-3)
Larry Duncan attempts a 3Pt. Contested by Michael Curry (5.4 feet, ZONE). LARRY DUNCAN MAKES IT! Assist: Collin Mobley
Score: 25-3

[04:18] Team_004 possession (Score: 25-3)
FOUL! Reach-in foul on Paul Wagner during the drive. [Team fouls: 3] No free throws, side out. (Paul Wagner: 1 personal fouls)

[04:06] Team_004 possession (Score: 25-3)
Dwyane Irving drives, picks up Larry Duncan. Help arrives from Magic Beal! Dwyane Irving attempts a Layup. Contested by Magic Beal (3.4 feet, MAN). Dwyane Irving misses. Rebound secured by Paul Wagner.

[03:52] Team_085 possession (Score: 25-3)
Larry Duncan attempts a 3Pt. Contested by Michael Curry (5.5 feet, ZONE). Larry Duncan misses. Offensive rebound by Paul Wagner! Paul Wagner kicks it out.

[03:39] Team_085 possession (Score: 25-3)
Stephen Bird makes the Dunk and draws the foul on Jabari Wade! And-1! Stephen Bird to the line for 1. [BONUS: 5 team fouls] (Jabari Wade: 1 personal fouls)   FT 1/1: GOOD Stephen Bird makes 1/1 from the line.
Score: 28-3

[03:25] Team_004 possession (Score: 28-3)
Dwyane Irving makes the Layup and draws the foul on Paul Wagner! And-1! Dwyane Irving to the line for 1. [Team fouls: 4] (Paul Wagner: 2 personal fouls)   FT 1/1: GOOD Dwyane Irving makes 1/1 from the line.
Score: 28-6

[03:10] Team_085 possession (Score: 28-6)
Stephen Bird attempts a 3Pt. Contested by Michael Curry (5.4 feet, ZONE). STEPHEN BIRD MAKES IT! Assist: Paul Wagner
Score: 31-6

[02:58] Team_004 possession (Score: 31-6)
Draymond Fox makes the Layup and draws the foul on Paul Wagner! And-1! Draymond Fox to the line for 1. [BONUS: 5 team fouls] (Paul Wagner: 3 personal fouls)   FT 1/1: GOOD Draymond Fox makes 1/1 from the line.
Score: 31-9

[02:39] Team_085 possession (Score: 31-9)
Stephen Bird attempts a Layup. Contested by Anthony Lillard (4.7 feet, ZONE). Stephen Bird misses. Rebound secured by Anthony Lillard.

[02:25] Team_004 possession (Score: 31-9)
Dwyane Irving drives and kicks out. Anthony Lillard attempts a 3Pt. Contested by Collin Mobley (4.2 feet, MAN). Anthony Lillard misses. Offensive rebound by Dwyane Irving! Dwyane Irving kicks it out.

[02:08] Team_004 possession (Score: 31-9)
Anthony Lillard makes the Layup and draws the foul on Collin Mobley! And-1! Anthony Lillard to the line for 1. [BONUS: 6 team fouls] (Collin Mobley: 2 personal fouls)   FT 1/1: GOOD Anthony Lillard makes 1/1 from the line.
Score: 31-12

[01:57] Team_085 possession (Score: 31-12)
Larry Duncan attempts a 3Pt. Contested by Dwyane Irving (4.1 feet, MAN). Larry Duncan misses. Rebound secured by Dwyane Irving.

[01:45] Team_004 possession (Score: 31-12)
FOUL! Holding foul on Magic Beal. [IN THE BONUS! 7 team fouls] Michael Curry to the line for 2 free throws. (Magic Beal: 1 personal fouls)   FT 1/2: GOOD   FT 2/2: GOOD Michael Curry makes 2/2 from the line.
Score: 31-14

[01:32] Team_085 possession (Score: 31-14)
Larry Duncan attempts a 3Pt. Contested by Michael Curry (5.7 feet, ZONE). Larry Duncan misses. Rebound secured by Dwyane Irving.

[01:17] Team_004 possession (Score: 31-14)
Draymond Fox throws a bad pass! Stolen by Paul Wagner! TURNOVER! (live ball)

[01:02] Team_085 possession (Score: 31-14)
Paul Wagner makes the Layup and draws the foul on Jabari Wade! And-1! Paul Wagner to the line for 1. [BONUS: 6 team fouls] (Jabari Wade: 2 personal fouls)   FT 1/1: MISS Paul Wagner makes 0/1 from the line. Rebound secured by Draymond Fox.
Score: 33-14

[00:48] Team_004 possession (Score: 33-14)
Jabari Wade attempts a 3Pt. Contested by Stephen Bird (4.6 feet, MAN). Jabari Wade misses. Rebound secured by Larry Duncan.

[00:37] Team_085 possession (Score: 33-14)
Collin Mobley attempts a Midrange. Contested by Jabari Wade (5.1 feet, ZONE). Collin Mobley misses. Rebound secured by Draymond Fox.

[00:25] Team_004 possession (Score: 33-14)
Anthony Lillard makes the Layup and draws the foul on Paul Wagner! And-1! Anthony Lillard to the line for 1. [BONUS: 8 team fouls] (Paul Wagner: 4 personal fouls)   FT 1/1: MISS Anthony Lillard makes 0/1 from the line. Rebound secured by Collin Mobley.
Score: 33-16

[00:10] Team_085 possession (Score: 33-16)
FOUL! Reach-in foul on Draymond Fox during the drive. [IN THE BONUS! 7 team fouls] Paul Wagner to the line for 2 free throws. (Draymond Fox: 2 personal fouls)   FT 1/2: MISS   FT 2/2: MISS Paul Wagner makes 0/2 from the line. Rebound secured by Draymond Fox.

================================================================================
                              1ST QUARTER COMPLETE                              
================================================================================

1ST QUARTER SCORE: Team_085 33, Team_004 16

BOX SCORE:
================================================================================

Team_085
--------------------------------------------------------------------------------
Player                MIN  PTS  REB  AST  TO      FG   FG%      3P   3P%
--------------------------------------------------------------------------------
Paul Wagner            12    9    6    3   0   4/6    66.7     0/0   0.0
Larry Duncan           12    6    5    3   0   2/6    33.3     0/0   0.0
Magic Beal             12    6    0    1   0   2/2   100.0     0/0   0.0
Stephen Bird           12    6    0    0   0   2/3    66.7     0/0   0.0
Collin Mobley          12    4    4    1   0   2/4    50.0     0/0   0.0

TEAM: FG: 12/21 (57.1%), 3PT: 4/8 (50.0%), REB: 15 (1 off, 14 def), AST: 8, TO: 2
TEAM FOULS: 8 [Team_004 in BONUS]


Team_004
--------------------------------------------------------------------------------
Player                MIN  PTS  REB  AST  TO      FG   FG%      3P   3P%
--------------------------------------------------------------------------------
Draymond Fox           12    6    5    0   0   2/4    50.0     0/0   0.0
Anthony Lillard        12    3    3    0   0   1/4    25.0     0/0   0.0
Dwyane Irving          12    3    3    0   0   1/3    33.3     0/0   0.0
Michael Curry          12    2    0    0   0   1/4    25.0     0/0   0.0
Jabari Wade            12    0    0    1   0   0/4     0.0     0/0   0.0

TEAM: FG: 5/19 (26.3%), 3PT: 1/7 (14.3%), REB: 11 (2 off, 9 def), AST: 1, TO: 3
TEAM FOULS: 7 [Team_085 in BONUS]

================================================================================

================================================================================
                       2ND QUARTER - Team_085 vs Team_004                       
================================================================================

[12:00] Team_085 possession (Score: 33-16)
Magic Beal drives and kicks out. Paul Wagner attempts a 3Pt. Contested by Michael Curry (5.3 feet, ZONE). Paul Wagner misses. Rebound secured by Anthony Lillard.

[11:47] Team_004 possession (Score: 33-16)
Michael Curry attempts a 3Pt. Contested by Larry Duncan (3.5 feet, ZONE). Michael Curry misses. Offensive rebound by Anthony Lillard! Anthony Lillard kicks it out.

[11:30] Team_004 possession (Score: 33-16)
Dwyane Irving attempts a Layup. Contested by Larry Duncan (3.7 feet, MAN). Dwyane Irving misses. Rebound secured by Paul Wagner.

[11:17] Team_085 possession (Score: 33-16)
Magic Beal attempts a 3Pt. Contested by Michael Curry (5.7 feet, ZONE). Magic Beal misses. Rebound secured by Draymond Fox.

[11:04] Team_004 possession (Score: 33-16)
Dwyane Irving attempts a Layup. Contested by Paul Wagner (4.1 feet, ZONE). DWYANE IRVING MAKES IT!
Score: 33-18

[10:51] Team_085 possession (Score: 33-18)
Stephen Bird drives, picks up Jabari Wade. Help arrives from Dwyane Irving! Stephen Bird attempts a Dunk. Contested by Dwyane Irving (5.4 feet, MAN). STEPHEN BIRD MAKES IT!
Score: 35-18

[10:38] Team_004 possession (Score: 35-18)
Michael Curry drives, Paul Wagner stays with him. Michael Curry attempts a Dunk. Contested by Paul Wagner (4.0 feet, ZONE). Michael Curry misses. Rebound secured by Larry Duncan.

[10:22] Team_085 possession (Score: 35-18)
Collin Mobley drives and kicks out. Larry Duncan attempts a 3Pt. Contested by Dwyane Irving (4.0 feet, MAN). Larry Duncan misses. Rebound secured by Draymond Fox.

[10:07] Team_004 possession (Score: 35-18)
FOUL! Offensive foul on Dwyane Irving! Larry Duncan drew the charge! [Team fouls: 1] (Dwyane Irving: 1 personal fouls) TURNOVER! (dead ball)

[09:52] Team_085 possession (Score: 35-18)
Collin Mobley attempts a Layup. BLOCKED BY ANTHONY LILLARD! Ball goes out off Anthony Lillard. Collin Mobley's ball!

[09:38] Team_085 possession (Score: 35-18)
Larry Duncan drives to the basket... Larry Duncan throws a bad pass! Stolen by Dwyane Irving! TURNOVER! (live ball)

[09:26] Team_004 possession (Score: 35-18)
Jabari Wade attempts a 3Pt. Contested by Stephen Bird (4.8 feet, MAN). JABARI WADE MAKES IT! Assist: Dwyane Irving
Score: 35-21

[09:14] Team_085 possession (Score: 35-21)
FOUL! Shooting foul on Anthony Lillard. Collin Mobley to the line for 2 free throws. [Team fouls: 2] (Anthony Lillard: 1 personal fouls)   FT 1/2: MISS   FT 2/2: GOOD Collin Mobley makes 1/2 from the line.
Score: 36-21

[08:57] Team_004 possession (Score: 36-21)
Anthony Lillard attempts a Layup. Contested by Paul Wagner (4.4 feet, ZONE). ANTHONY LILLARD MAKES IT! Assist: Draymond Fox
Score: 36-23

[08:45] Team_085 possession (Score: 36-23)
FOUL! Reach-in foul on Anthony Lillard during the drive. [Team fouls: 3] No free throws, side out. (Anthony Lillard: 2 personal fouls)

[08:30] Team_085 possession (Score: 36-23)
Larry Duncan attempts a 3Pt. Contested by Draymond Fox (5.2 feet, ZONE). Larry Duncan misses. Rebound secured by Anthony Lillard.

[08:14] Team_004 possession (Score: 36-23)
Anthony Lillard attempts a Layup. BLOCKED BY PAUL WAGNER! Ball deflects out of bounds off Anthony Lillard.

[07:59] Team_085 possession (Score: 36-23)
FOUL! Reach-in foul on Anthony Lillard during the drive. [Team fouls: 4] No free throws, side out. (Anthony Lillard: 3 personal fouls)

[07:45] Team_085 possession (Score: 36-23)
Collin Mobley drives, Anthony Lillard stays with him. Collin Mobley attempts a Layup. Contested by Anthony Lillard (5.0 feet, MAN). Collin Mobley misses. Offensive rebound by Larry Duncan! Larry Duncan kicks it out.

[07:28] Team_085 possession (Score: 36-23)
FOUL! Holding foul on Michael Curry. [IN THE BONUS! 5 team fouls] Magic Beal to the line for 2 free throws. (Michael Curry: 1 personal fouls)   FT 1/2: GOOD   FT 2/2: GOOD Magic Beal makes 2/2 from the line.
Score: 38-23

[07:10] Team_004 possession (Score: 38-23)
Jabari Wade attempts a Midrange. Contested by Paul Wagner (4.8 feet, ZONE). JABARI WADE MAKES IT! Assist: Dwyane Irving
Score: 38-25

[06:54] Team_085 possession (Score: 38-25)
Paul Wagner attempts a Layup. Contested by Draymond Fox (5.4 feet, MAN). Paul Wagner misses. Offensive rebound by Paul Wagner! Paul Wagner kicks it out.

[06:41] Team_085 possession (Score: 38-25)
Stephen Bird attempts a Midrange. Contested by Jabari Wade (5.9 feet, MAN). STEPHEN BIRD MAKES IT!
Score: 40-25

[06:25] Team_004 possession (Score: 40-25)
FOUL! Shooting foul on Paul Wagner. Draymond Fox to the line for 2 free throws. [Team fouls: 1] (Paul Wagner: 1 personal fouls)   FT 1/2: GOOD   FT 2/2: GOOD Draymond Fox makes 2/2 from the line.
Score: 40-27

[06:12] Team_085 possession (Score: 40-27)
FOUL! Shooting foul on Dwyane Irving. Larry Duncan to the line for 2 free throws. [BONUS: 6 team fouls] (Dwyane Irving: 2 personal fouls)   FT 1/2: MISS   FT 2/2: GOOD Larry Duncan makes 1/2 from the line.
Score: 41-27

[06:01] Team_004 possession (Score: 41-27)
Anthony Lillard attempts a Layup. BLOCKED BY MAGIC BEAL! Ball goes out off Magic Beal. Anthony Lillard's ball!

[05:43] Team_004 possession (Score: 41-27)
Jabari Wade attempts a Midrange. Contested by Stephen Bird (5.3 feet, MAN). Jabari Wade misses. Rebound secured by Paul Wagner.

[05:28] Team_085 possession (Score: 41-27)
Magic Beal attempts a 3Pt. Wide open! Michael Curry is 6.3 feet away. [ZONE] Magic Beal misses. Rebound secured by Draymond Fox.

[05:19] Team_004 possession (Score: 41-27)
Dwyane Irving throws a bad pass! Stolen by Larry Duncan! TURNOVER! (live ball)

[05:01] Team_085 possession (Score: 41-27)
Collin Mobley attempts a Layup. BLOCKED BY JABARI WADE! Ball is loose! Offensive rebound by Paul Wagner! Paul Wagner kicks it out.

[04:45] Team_085 possession (Score: 41-27)
Larry Duncan drives to the basket... FOUL! Offensive foul on Larry Duncan! Dwyane Irving drew the charge! [Team fouls: 2] (Larry Duncan: 1 personal fouls) TURNOVER! (dead ball)

[04:29] Team_004 possession (Score: 41-27)
Jabari Wade attempts a Midrange. Contested by Stephen Bird (5.5 feet, MAN). JABARI WADE MAKES IT! Assist: Anthony Lillard
Score: 41-29

[04:13] Team_085 possession (Score: 41-29)
FOUL! Shooting foul on Anthony Lillard. Magic Beal to the line for 2 free throws. [BONUS: 7 team fouls] (Anthony Lillard: 4 personal fouls)   FT 1/2: GOOD   FT 2/2: GOOD Magic Beal makes 2/2 from the line.
Score: 43-29

[03:58] Team_004 possession (Score: 43-29)
Michael Curry attempts a Midrange. Contested by Magic Beal (5.4 feet, MAN). Michael Curry misses. Rebound secured by Larry Duncan.

[03:46] Team_085 possession (Score: 43-29)
Paul Wagner attempts a Midrange. Contested by Draymond Fox (5.8 feet, MAN). PAUL WAGNER MAKES IT! Assist: Magic Beal
Score: 45-29

[03:29] Team_004 possession (Score: 45-29)
FOUL! Shooting foul on Larry Duncan. Draymond Fox to the line for 2 free throws. [Team fouls: 3] (Larry Duncan: 2 personal fouls)   FT 1/2: MISS   FT 2/2: GOOD Draymond Fox makes 1/2 from the line.
Score: 45-30

[03:14] Team_085 possession (Score: 45-30)
Collin Mobley drives to the basket... Collin Mobley commits a violation (traveling/carry)! TURNOVER! (dead ball)

[03:14] Substitution (Team_085): Magic Beal OUT → Khris Brogdon IN (stamina_rule2)

[03:14] Substitution (Team_085): Stephen Bird OUT → Jordan Morant IN (stamina_rule2)

[03:14] Substitution (Team_085): Larry Duncan OUT → Giannis Johnson IN (stamina_rule2)

[03:14] Substitution (Team_085): Paul Wagner OUT → Jalen Leonard IN (stamina_rule2)

[03:14] Substitution (Team_085): Collin Mobley OUT → Malcolm Beal IN (stamina_rule2)

[03:14] Substitution (Team_004): Michael Curry OUT → Karl Reaves IN (stamina_rule2)

[03:14] Substitution (Team_004): Jabari Wade OUT → Russell Barnes IN (stamina_rule2)

[03:14] Substitution (Team_004): Dwyane Irving OUT → Kristaps Green IN (stamina_rule2)

[03:14] Substitution (Team_004): Draymond Fox OUT → Michael Sabonis IN (stamina_rule2)

[03:14] Substitution (Team_004): Anthony Lillard OUT → Shai Beal IN (stamina_rule2)

[03:00] Team_004 possession (Score: 45-30)
Russell Barnes attempts a 3Pt. Contested by Jordan Morant (4.1 feet, MAN). RUSSELL BARNES MAKES IT! Assist: Shai Beal
Score: 45-33

[02:46] Team_085 possession (Score: 45-33)
Khris Brogdon attempts a 3Pt. Contested by Karl Reaves (4.9 feet, ZONE). Khris Brogdon misses. Rebound secured by Michael Sabonis.

[02:28] Team_004 possession (Score: 45-33)
Kristaps Green attempts a Midrange. Contested by Giannis Johnson (5.9 feet, ZONE). KRISTAPS GREEN MAKES IT!
Score: 45-35

[02:09] Team_085 possession (Score: 45-35)
Jordan Morant drives to the basket... Jordan Morant throws a bad pass out of bounds! TURNOVER! (dead ball)

[01:51] Team_004 possession (Score: 45-35)
Russell Barnes attempts a Layup. Contested by Malcolm Beal (4.9 feet, ZONE). RUSSELL BARNES MAKES IT!
Score: 45-37

[01:39] Team_085 possession (Score: 45-37)
Giannis Johnson attempts a Midrange. Contested by Kristaps Green (4.4 feet, MAN). Giannis Johnson misses. FOUL! Loose ball foul on Russell Barnes during the rebound battle. [IN THE BONUS! 8 team fouls] Malcolm Beal to the line for 2 free throws. (Russell Barnes: 1 personal fouls)   FT 1/2: MISS   FT 2/2: GOOD Malcolm Beal makes 1/2 from the line.
Score: 46-37

[01:25] Team_004 possession (Score: 46-37)
Karl Reaves attempts a Midrange. Contested by Jordan Morant (3.0 feet, ZONE). Karl Reaves misses. Offensive rebound by Shai Beal! Shai Beal kicks it out.

[01:11] Team_004 possession (Score: 46-37)
FOUL! Reach-in foul on Malcolm Beal during the drive. [Team fouls: 4] No free throws, side out. (Malcolm Beal: 1 personal fouls)

[00:53] Team_004 possession (Score: 46-37)
FOUL! Reach-in foul on Malcolm Beal during the drive. [IN THE BONUS! 5 team fouls] Shai Beal to the line for 2 free throws. (Malcolm Beal: 2 personal fouls)   FT 1/2: MISS   FT 2/2: GOOD Shai Beal makes 1/2 from the line.
Score: 46-38

[00:37] Team_085 possession (Score: 46-38)
Giannis Johnson drives and kicks out. Jalen Leonard attempts a 3Pt. Contested by Karl Reaves (5.1 feet, ZONE). Jalen Leonard misses. Offensive rebound by Jalen Leonard! Jalen Leonard kicks it out.

[00:23] Team_085 possession (Score: 46-38)
Jalen Leonard drives to the basket... FOUL! Offensive foul on Jalen Leonard! Shai Beal drew the charge! [Team fouls: 6] (Jalen Leonard: 1 personal fouls) TURNOVER! (dead ball)

[00:13] Team_004 possession (Score: 46-38)
FOUL! Holding foul on Malcolm Beal. [IN THE BONUS! 7 team fouls] Shai Beal to the line for 2 free throws. (Malcolm Beal: 3 personal fouls)   FT 1/2: MISS   FT 2/2: MISS Shai Beal makes 0/2 from the line. Rebound secured by Giannis Johnson.

================================================================================
                              2ND QUARTER COMPLETE                              
================================================================================

2ND QUARTER SCORE: Team_085 13, Team_004 22

BOX SCORE:
================================================================================

Team_085
--------------------------------------------------------------------------------
Player                MIN  PTS  REB  AST  TO      FG   FG%      3P   3P%
--------------------------------------------------------------------------------
Magic Beal             21    4    0    1   0   2/5    40.0     0/0   0.0
Stephen Bird           21    4    0    0   0   2/2   100.0     0/0   0.0
Paul Wagner            21    2    4    0   0   1/1   100.0     0/0   0.0
Larry Duncan           21    1    3    0   0   1/2    50.0     0/0   0.0
Collin Mobley          21    1    0    0   0   1/2    50.0     0/0   0.0
Malcolm Beal            3    1    0    0   0   1/1   100.0     0/0   0.0
Khris Brogdon           3    0    0    0   0   0/1     0.0     0/0   0.0
Jalen Leonard           3    0    1    0   0   0/0     0.0     0/0   0.0
Giannis Johnson         3    0    1    0   0   0/0     0.0     0/0   0.0

TEAM: FG: 8/14 (57.1%), 3PT: 0/4 (0.0%), REB: 9 (4 off, 5 def), AST: 1, TO: 5
TEAM FOULS: 7 [Team_004 in BONUS]


Team_004
--------------------------------------------------------------------------------
Player                MIN  PTS  REB  AST  TO      FG   FG%      3P   3P%
--------------------------------------------------------------------------------
Jabari Wade            21    7    0    0   0   3/4    75.0     0/0   0.0
Russell Barnes          3    5    0    0   0   2/2   100.0     0/0   0.0
Draymond Fox           21    3    3    1   0   2/2   100.0     0/0   0.0
Anthony Lillard        21    2    3    1   0   1/2    50.0     0/0   0.0
Dwyane Irving          21    2    0    2   0   1/2    50.0     0/0   0.0
Kristaps Green          3    2    0    0   0   1/1   100.0     0/0   0.0
Shai Beal               3    1    1    1   0   1/1   100.0     0/0   0.0
Michael Curry          21    0    0    0   0   0/2     0.0     0/0   0.0
Michael Sabonis         3    0    1    0   0   0/0     0.0     0/0   0.0

TEAM: FG: 11/17 (64.7%), 3PT: 2/2 (100.0%), REB: 8 (2 off, 6 def), AST: 5, TO: 2
TEAM FOULS: 8 [Team_085 in BONUS]

================================================================================

================================================================================
                       3RD QUARTER - Team_085 vs Team_004                       
================================================================================

[12:00] Team_085 possession (Score: 46-38)
Collin Mobley attempts a 3Pt. Contested by Dwyane Irving (3.5 feet, ZONE). Collin Mobley misses. Rebound secured by Dwyane Irving.

[11:51] Team_004 possession (Score: 46-38)
Jabari Wade attempts a Midrange. Contested by Stephen Bird (4.1 feet, MAN). Jabari Wade misses. Rebound secured by Larry Duncan.

[11:35] Team_085 possession (Score: 46-38)
Collin Mobley makes the Midrange and draws the foul on Draymond Fox! And-1! Collin Mobley to the line for 1. [Team fouls: 1] (Draymond Fox: 1 personal fouls)   FT 1/1: GOOD Collin Mobley makes 1/1 from the line.
Score: 49-38

[11:23] Team_004 possession (Score: 49-38)
Draymond Fox attempts a Midrange. Contested by Paul Wagner (3.9 feet, MAN). DRAYMOND FOX MAKES IT!
Score: 49-40

[11:08] Team_085 possession (Score: 49-40)
Paul Wagner attempts a 3Pt. Contested by Draymond Fox (4.4 feet, MAN). Paul Wagner misses. Rebound secured by Anthony Lillard.

[10:57] Team_004 possession (Score: 49-40)
Jabari Wade attempts a 3Pt. Contested by Stephen Bird (4.1 feet, MAN). JABARI WADE MAKES IT!
Score: 49-43

[10:43] Team_085 possession (Score: 49-43)
Larry Duncan attempts a 3Pt. Contested by Dwyane Irving (3.9 feet, MAN). LARRY DUNCAN MAKES IT! Assist: Stephen Bird
Score: 52-43

[10:26] Team_004 possession (Score: 52-43)
Anthony Lillard drives to the basket... FOUL! Offensive foul on Anthony Lillard! Paul Wagner drew the charge! [Team fouls: 2] (Anthony Lillard: 1 personal fouls) TURNOVER! (dead ball)

[10:13] Team_085 possession (Score: 52-43)
Stephen Bird attempts a 3Pt. Contested by Michael Curry (5.3 feet, ZONE). Stephen Bird misses. Rebound secured by Anthony Lillard.

[09:58] Team_004 possession (Score: 52-43)
Anthony Lillard attempts a 3Pt. Contested by Magic Beal (4.4 feet, ZONE). Anthony Lillard misses. Rebound secured by Larry Duncan.

[09:44] Team_085 possession (Score: 52-43)
Larry Duncan drives to the basket... Larry Duncan throws a bad pass! Stolen by Dwyane Irving! TURNOVER! (live ball)

[09:29] Team_004 possession (Score: 52-43)
FOUL! Reach-in foul on Larry Duncan during the drive. [Team fouls: 1] No free throws, side out. (Larry Duncan: 1 personal fouls)

[09:14] Team_004 possession (Score: 52-43)
Anthony Lillard drives and kicks out. Dwyane Irving attempts a 3Pt. Contested by Magic Beal (4.0 feet, ZONE). Dwyane Irving misses. Rebound secured by Paul Wagner.

[09:00] Team_085 possession (Score: 52-43)
Collin Mobley attempts a Midrange. Contested by Anthony Lillard (4.0 feet, MAN). Collin Mobley misses. Rebound secured by Draymond Fox.

[08:46] Team_004 possession (Score: 52-43)
Dwyane Irving attempts a 3Pt. Contested by Larry Duncan (3.4 feet, MAN). Dwyane Irving misses. Rebound secured by Collin Mobley.

[08:28] Team_085 possession (Score: 52-43)
Magic Beal attempts a Midrange. Contested by Dwyane Irving (4.0 feet, ZONE). Magic Beal misses. Offensive rebound by Larry Duncan! Larry Duncan kicks it out.

[08:13] Team_085 possession (Score: 52-43)
Larry Duncan makes the Layup and draws the foul on Dwyane Irving! And-1! Larry Duncan to the line for 1. [Team fouls: 3] (Dwyane Irving: 1 personal fouls)   FT 1/1: GOOD Larry Duncan makes 1/1 from the line.
Score: 55-43

[07:59] Team_004 possession (Score: 55-43)
Jabari Wade attempts a 3Pt. Contested by Stephen Bird (4.1 feet, MAN). Jabari Wade misses. Rebound secured by Collin Mobley.

[07:46] Team_085 possession (Score: 55-43)
Stephen Bird attempts a 3Pt. Contested by Michael Curry (5.3 feet, ZONE). Stephen Bird misses. Offensive rebound by Larry Duncan! Larry Duncan kicks it out.

[07:32] Team_085 possession (Score: 55-43)
Magic Beal attempts a 3Pt. Contested by Michael Curry (5.5 feet, MAN). Magic Beal misses. Rebound secured by Dwyane Irving.

[07:15] Team_004 possession (Score: 55-43)
Draymond Fox attempts a Midrange. Contested by Paul Wagner (3.9 feet, MAN). DRAYMOND FOX MAKES IT!
Score: 55-45

[07:02] Team_085 possession (Score: 55-45)
Paul Wagner attempts a 3Pt. Contested by Michael Curry (5.3 feet, ZONE). Paul Wagner misses. FOUL! Loose ball foul on Anthony Lillard during the rebound battle. [Team fouls: 4] No free throws, side out. (Anthony Lillard: 2 personal fouls)

[06:48] Team_085 possession (Score: 55-45)
Collin Mobley drives and kicks out. FOUL! Shooting foul on Anthony Lillard. Collin Mobley to the line for 3 free throws. [BONUS: 5 team fouls] (Anthony Lillard: 3 personal fouls)   FT 1/3: GOOD   FT 2/3: GOOD   FT 3/3: GOOD Collin Mobley makes 3/3 from the line.
Score: 58-45

[06:34] Team_004 possession (Score: 58-45)
Dwyane Irving drives, picks up Paul Wagner. Help arrives from Magic Beal! Dwyane Irving attempts a Layup. Contested by Magic Beal (3.8 feet, ZONE). DWYANE IRVING MAKES IT!
Score: 58-47

[06:19] Team_085 possession (Score: 58-47)
Stephen Bird attempts a 3Pt. Contested by Michael Curry (5.3 feet, ZONE). Stephen Bird misses. Rebound secured by Draymond Fox.

[06:05] Team_004 possession (Score: 58-47)
Draymond Fox drives and kicks out. Draymond Fox attempts a 3Pt. Contested by Paul Wagner (3.5 feet, MAN). Draymond Fox misses. Rebound secured by Paul Wagner.

[05:54] Team_085 possession (Score: 58-47)
Collin Mobley drives, picks up Anthony Lillard. Help arrives from Jabari Wade! Collin Mobley attempts a Dunk. Contested by Jabari Wade (4.0 feet, ZONE). Collin Mobley misses. Offensive rebound by Larry Duncan! Larry Duncan kicks it out.

[05:41] Team_085 possession (Score: 58-47)
Larry Duncan attempts a 3Pt. Contested by Michael Curry (5.4 feet, ZONE). Larry Duncan misses. Rebound secured by Dwyane Irving.

[05:25] Team_004 possession (Score: 58-47)
Jabari Wade attempts a Midrange. Contested by Larry Duncan (3.7 feet, ZONE). Jabari Wade misses. Rebound secured by Collin Mobley.

[05:09] Team_085 possession (Score: 58-47)
Magic Beal makes the Layup and draws the foul on Michael Curry! And-1! Magic Beal to the line for 1. [BONUS: 6 team fouls] (Michael Curry: 1 personal fouls)   FT 1/1: GOOD Magic Beal makes 1/1 from the line.
Score: 61-47

[04:51] Team_004 possession (Score: 61-47)
Jabari Wade attempts a Midrange. Contested by Stephen Bird (4.1 feet, MAN). Jabari Wade misses. Rebound secured by Larry Duncan.

[04:36] Team_085 possession (Score: 61-47)
Collin Mobley makes the Midrange and draws the foul on Draymond Fox! And-1! Collin Mobley to the line for 1. [BONUS: 7 team fouls] (Draymond Fox: 2 personal fouls)   FT 1/1: GOOD Collin Mobley makes 1/1 from the line.
Score: 64-47

[04:27] Team_004 possession (Score: 64-47)
FOUL! Shooting foul on Stephen Bird. Jabari Wade to the line for 3 free throws. [Team fouls: 2] (Stephen Bird: 1 personal fouls)   FT 1/3: MISS   FT 2/3: MISS   FT 3/3: GOOD Jabari Wade makes 1/3 from the line.
Score: 64-48

[04:09] Team_085 possession (Score: 64-48)
FOUL! Shooting foul on Draymond Fox. Paul Wagner to the line for 2 free throws. [BONUS: 8 team fouls] (Draymond Fox: 3 personal fouls)   FT 1/2: GOOD   FT 2/2: GOOD Paul Wagner makes 2/2 from the line.
Score: 66-48

[03:56] Team_004 possession (Score: 66-48)
Draymond Fox loses the ball! Stripped by Paul Wagner! TURNOVER! (live ball)

[03:37] Team_085 possession (Score: 66-48)
Paul Wagner makes the Dunk and draws the foul on Jabari Wade! And-1! Paul Wagner to the line for 1. [BONUS: 9 team fouls] (Jabari Wade: 1 personal fouls)   FT 1/1: GOOD Paul Wagner makes 1/1 from the line.
Score: 69-48

[03:26] Team_004 possession (Score: 69-48)
Jabari Wade makes the Layup and draws the foul on Magic Beal! And-1! Jabari Wade to the line for 1. [Team fouls: 3] (Magic Beal: 1 personal fouls)   FT 1/1: GOOD Jabari Wade makes 1/1 from the line.
Score: 69-51

[03:09] Team_085 possession (Score: 69-51)
FOUL! Shooting foul on Anthony Lillard. Stephen Bird to the line for 2 free throws. [BONUS: 10 team fouls] (Anthony Lillard: 4 personal fouls)   FT 1/2: GOOD   FT 2/2: GOOD Stephen Bird makes 2/2 from the line.
Score: 71-51

[02:58] Team_004 possession (Score: 71-51)
Jabari Wade drives, Paul Wagner stays with him. Jabari Wade attempts a Dunk. Contested by Paul Wagner (4.3 feet, ZONE). JABARI WADE MAKES IT! Assist: Anthony Lillard
Score: 71-53

[02:45] Team_085 possession (Score: 71-53)
Larry Duncan attempts a 3Pt. Contested by Michael Curry (5.6 feet, ZONE). LARRY DUNCAN MAKES IT! Assist: Collin Mobley
Score: 74-53

[02:31] Team_004 possession (Score: 74-53)
Michael Curry attempts a 3Pt. Contested by Magic Beal (4.4 feet, ZONE). Michael Curry misses. Rebound secured by Paul Wagner.

[02:13] Team_085 possession (Score: 74-53)
Stephen Bird drives and kicks out. Larry Duncan attempts a 3Pt. Contested by Dwyane Irving (3.8 feet, MAN). Larry Duncan misses. Rebound secured by Anthony Lillard.

[01:55] Team_004 possession (Score: 74-53)
FOUL! Shooting foul on Paul Wagner. Jabari Wade to the line for 2 free throws. [Team fouls: 4] (Paul Wagner: 1 personal fouls)   FT 1/2: MISS   FT 2/2: GOOD Jabari Wade makes 1/2 from the line.
Score: 74-54

[01:45] Team_085 possession (Score: 74-54)
Stephen Bird drives, picks up Jabari Wade. Help arrives from Dwyane Irving! Stephen Bird attempts a Layup. Contested by Dwyane Irving (5.3 feet, MAN). STEPHEN BIRD MAKES IT! Assist: Collin Mobley
Score: 76-54

[01:29] Team_004 possession (Score: 76-54)
Jabari Wade attempts a 3Pt. Contested by Magic Beal (5.0 feet, ZONE). Jabari Wade misses. Rebound secured by Paul Wagner.

[01:15] Team_085 possession (Score: 76-54)
Magic Beal attempts a 3Pt. Contested by Michael Curry (5.8 feet, ZONE). MAGIC BEAL MAKES IT! Assist: Collin Mobley
Score: 79-54

[01:02] Team_004 possession (Score: 79-54)
Jabari Wade attempts a Midrange. Contested by Stephen Bird (4.6 feet, ZONE). JABARI WADE MAKES IT!
Score: 79-56

[00:46] Team_085 possession (Score: 79-56)
FOUL! Reach-in foul on Anthony Lillard during the drive. [IN THE BONUS! 11 team fouls] Larry Duncan to the line for 2 free throws. (Anthony Lillard: 5 personal fouls)   FT 1/2: GOOD   FT 2/2: MISS Larry Duncan makes 1/2 from the line. Rebound secured by Dwyane Irving.
Score: 80-56

[00:27] Team_004 possession (Score: 80-56)
Michael Curry loses the ball! Stripped by Magic Beal! TURNOVER! (live ball)

[00:16] Team_085 possession (Score: 80-56)
Paul Wagner attempts a 3Pt. Contested by Michael Curry (5.7 feet, ZONE). Paul Wagner misses. Rebound secured by Draymond Fox.

[00:01] Team_004 possession (Score: 80-56)
Anthony Lillard attempts a Midrange. Contested by Collin Mobley (4.8 feet, MAN). Anthony Lillard misses. Rebound secured by Larry Duncan.

================================================================================
                              3RD QUARTER COMPLETE                              
================================================================================

3RD QUARTER SCORE: Team_085 34, Team_004 18

BOX SCORE:
================================================================================

Team_085
--------------------------------------------------------------------------------
Player                MIN  PTS  REB  AST  TO      FG   FG%      3P   3P%
--------------------------------------------------------------------------------
Collin Mobley          33    9    3    3   0   3/5    60.0     0/0   0.0
Larry Duncan           33    9    7    0   0   3/5    60.0     0/0   0.0
Magic Beal             33    6    0    0   0   2/3    66.7     0/0   0.0
Paul Wagner            33    5    5    0   0   2/4    50.0     0/0   0.0
Stephen Bird           33    4    0    1   0   2/5    40.0     0/0   0.0

TEAM: FG: 12/22 (54.5%), 3PT: 3/10 (30.0%), REB: 15 (4 off, 11 def), AST: 4, TO: 1
TEAM FOULS: 4


Team_004
--------------------------------------------------------------------------------
Player                MIN  PTS  REB  AST  TO      FG   FG%      3P   3P%
--------------------------------------------------------------------------------
Jabari Wade            33   12    0    0   0   6/11   54.5     0/0   0.0
Draymond Fox           33    4    3    0   0   2/3    66.7     0/0   0.0
Dwyane Irving          33    2    4    0   0   1/2    50.0     0/0   0.0
Anthony Lillard        33    0    3    1   0   0/3     0.0     0/0   0.0
Michael Curry          33    0    0    0   0   0/1     0.0     0/0   0.0

TEAM: FG: 9/20 (45.0%), 3PT: 2/7 (28.6%), REB: 10 (0 off, 10 def), AST: 1, TO: 3
TEAM FOULS: 11 [Team_085 in BONUS]

================================================================================

================================================================================
                       4TH QUARTER - Team_085 vs Team_004                       
================================================================================

[12:00] Team_085 possession (Score: 80-56)
Paul Wagner attempts a 3Pt. Contested by Draymond Fox (4.7 feet, MAN). Paul Wagner misses. Rebound secured by Anthony Lillard.

[11:41] Team_004 possession (Score: 80-56)
Dwyane Irving drives, Paul Wagner stays with him. Dwyane Irving attempts a Layup. Contested by Paul Wagner (4.1 feet, ZONE). DWYANE IRVING MAKES IT! Assist: Jabari Wade
Score: 80-58

[11:25] Team_085 possession (Score: 80-58)
Paul Wagner makes the Layup and draws the foul on Anthony Lillard! And-1! Paul Wagner to the line for 1. [Team fouls: 1] (Anthony Lillard: 1 personal fouls)   FT 1/1: GOOD Paul Wagner makes 1/1 from the line.
Score: 83-58

[11:13] Team_004 possession (Score: 83-58)
Jabari Wade attempts a Midrange. Contested by Stephen Bird (4.5 feet, MAN). Jabari Wade misses. Offensive rebound by Dwyane Irving! Dwyane Irving kicks it out.

[11:00] Team_004 possession (Score: 83-58)
Anthony Lillard attempts a Layup. Contested by Collin Mobley (4.7 feet, MAN). Anthony Lillard misses. Rebound secured by Larry Duncan.

[10:45] Team_085 possession (Score: 83-58)
FOUL! Holding foul on Dwyane Irving. [Team fouls: 2] No free throws, side out. (Dwyane Irving: 1 personal fouls)

[10:27] Team_085 possession (Score: 83-58)
Stephen Bird attempts a 3Pt. Contested by Jabari Wade (5.4 feet, MAN). Stephen Bird misses. Rebound secured by Anthony Lillard.

[10:10] Team_004 possession (Score: 83-58)
Michael Curry attempts a 3Pt. Contested by Magic Beal (4.6 feet, ZONE). Michael Curry misses. Rebound secured by Collin Mobley.

[09:56] Team_085 possession (Score: 83-58)
Magic Beal drives, Michael Curry stays with him. Magic Beal attempts a Layup. Contested by Michael Curry (5.9 feet, MAN). MAGIC BEAL MAKES IT!
Score: 85-58

[09:45] Team_004 possession (Score: 85-58)
Michael Curry attempts a 3Pt. Contested by Magic Beal (4.7 feet, ZONE). Michael Curry misses. FOUL! Loose ball foul on Collin Mobley during the rebound battle. [Team fouls: 1] No free throws, side out. (Collin Mobley: 1 personal fouls)

[09:26] Team_004 possession (Score: 85-58)
Dwyane Irving attempts a 3Pt. Contested by Larry Duncan (3.9 feet, MAN). Dwyane Irving misses. Offensive rebound by Dwyane Irving! Dwyane Irving kicks it out.

[09:15] Team_004 possession (Score: 85-58)
Dwyane Irving attempts a 3Pt. Contested by Magic Beal (4.9 feet, ZONE). DWYANE IRVING MAKES IT! Assist: Draymond Fox
Score: 85-61

[09:02] Team_085 possession (Score: 85-61)
Larry Duncan makes the Layup and draws the foul on Jabari Wade! And-1! Larry Duncan to the line for 1. [Team fouls: 3] (Jabari Wade: 1 personal fouls)   FT 1/1: GOOD Larry Duncan makes 1/1 from the line.
Score: 88-61

[08:53] Team_004 possession (Score: 88-61)
Michael Curry attempts a Midrange. Contested by Magic Beal (4.8 feet, MAN). MICHAEL CURRY MAKES IT!
Score: 88-63

[08:40] Team_085 possession (Score: 88-63)
Larry Duncan drives and kicks out. Stephen Bird attempts a Midrange. Contested by Jabari Wade (5.5 feet, MAN). STEPHEN BIRD MAKES IT! Assist: Paul Wagner
Score: 90-63

[08:27] Team_004 possession (Score: 90-63)
Michael Curry drives to the basket... Michael Curry loses the ball! Stripped by Magic Beal! TURNOVER! (live ball)

[08:11] Team_085 possession (Score: 90-63)
Stephen Bird drives and kicks out. Larry Duncan attempts a 3Pt. Contested by Michael Curry (5.8 feet, ZONE). Larry Duncan misses. Rebound secured by Draymond Fox.

[07:57] Team_004 possession (Score: 90-63)
Draymond Fox attempts a 3Pt. Contested by Paul Wagner (4.5 feet, MAN). Draymond Fox misses. Offensive rebound by Anthony Lillard! Anthony Lillard kicks it out.

[07:45] Team_004 possession (Score: 90-63)
Jabari Wade attempts a Midrange. Contested by Stephen Bird (5.0 feet, MAN). JABARI WADE MAKES IT! Assist: Dwyane Irving
Score: 90-65

[07:28] Team_085 possession (Score: 90-65)
FOUL! Holding foul on Dwyane Irving. [Team fouls: 4] No free throws, side out. (Dwyane Irving: 2 personal fouls)

[07:14] Team_085 possession (Score: 90-65)
Collin Mobley attempts a Midrange. Contested by Dwyane Irving (4.3 feet, ZONE). Collin Mobley misses. Rebound secured by Draymond Fox.

[07:03] Team_004 possession (Score: 90-65)
Anthony Lillard makes the Layup and draws the foul on Paul Wagner! And-1! Anthony Lillard to the line for 1. [Team fouls: 2] (Paul Wagner: 1 personal fouls)   FT 1/1: MISS Anthony Lillard makes 0/1 from the line. Rebound secured by Paul Wagner.
Score: 90-67

[06:51] Team_085 possession (Score: 90-67)
Collin Mobley drives, picks up Anthony Lillard. Help arrives from Jabari Wade! Collin Mobley attempts a Layup. Contested by Jabari Wade (5.2 feet, MAN). Collin Mobley misses. Rebound secured by Dwyane Irving.

[06:35] Team_004 possession (Score: 90-67)
Jabari Wade attempts a 3Pt. Contested by Stephen Bird (5.2 feet, MAN). Jabari Wade misses. Rebound secured by Collin Mobley.

[06:21] Team_085 possession (Score: 90-67)
Magic Beal attempts a 3Pt. Wide open! Michael Curry is 6.3 feet away. [ZONE] MAGIC BEAL MAKES IT! Assist: Larry Duncan
Score: 93-67

[06:08] Team_004 possession (Score: 93-67)
Anthony Lillard loses the ball! Stripped by Collin Mobley! TURNOVER! (live ball)

[05:58] Team_085 possession (Score: 93-67)
Larry Duncan attempts a 3Pt. Contested by Dwyane Irving (4.9 feet, MAN). Larry Duncan misses. Rebound secured by Anthony Lillard.

[05:40] Team_004 possession (Score: 93-67)
FOUL! Shooting foul on Magic Beal. Michael Curry to the line for 2 free throws. [Team fouls: 3] (Magic Beal: 1 personal fouls)   FT 1/2: GOOD   FT 2/2: GOOD Michael Curry makes 2/2 from the line.
Score: 93-69

[05:28] Team_085 possession (Score: 93-69)
Larry Duncan attempts a 3Pt. Contested by Dwyane Irving (5.0 feet, MAN). Larry Duncan misses. Rebound secured by Draymond Fox.

[05:15] Team_004 possession (Score: 93-69)
Jabari Wade drives and kicks out. Draymond Fox attempts a 3Pt. Contested by Paul Wagner (4.8 feet, MAN). DRAYMOND FOX MAKES IT! Assist: Jabari Wade
Score: 93-72

[05:00] Team_085 possession (Score: 93-72)
Stephen Bird attempts a 3Pt. Wide open! Michael Curry is 6.3 feet away. [ZONE] STEPHEN BIRD MAKES IT! Assist: Larry Duncan
Score: 96-72

[04:43] Team_004 possession (Score: 96-72)
FOUL! Shooting foul on Magic Beal. Michael Curry to the line for 2 free throws. [Team fouls: 4] (Magic Beal: 2 personal fouls)   FT 1/2: GOOD   FT 2/2: MISS Michael Curry makes 1/2 from the line. Rebound secured by Larry Duncan.
Score: 96-73

[04:32] Team_085 possession (Score: 96-73)
Larry Duncan attempts a Midrange. Contested by Dwyane Irving (5.1 feet, MAN). Larry Duncan misses. Rebound secured by Draymond Fox.

[04:17] Team_004 possession (Score: 96-73)
Jabari Wade attempts a 3Pt. Contested by Stephen Bird (5.6 feet, MAN). JABARI WADE MAKES IT! Assist: Michael Curry
Score: 96-76

[04:02] Team_085 possession (Score: 96-76)
FOUL! Reach-in foul on Anthony Lillard during the drive. [IN THE BONUS! 5 team fouls] Larry Duncan to the line for 2 free throws. (Anthony Lillard: 2 personal fouls)   FT 1/2: GOOD   FT 2/2: MISS Larry Duncan makes 1/2 from the line. Rebound secured by Anthony Lillard.
Score: 97-76

[03:45] Team_004 possession (Score: 97-76)
Michael Curry attempts a 3Pt. BLOCKED BY MAGIC BEAL! Ball goes out off Magic Beal. Michael Curry's ball!

[03:32] Team_004 possession (Score: 97-76)
FOUL! Holding foul on Larry Duncan. [IN THE BONUS! 5 team fouls] Dwyane Irving to the line for 2 free throws. (Larry Duncan: 1 personal fouls)   FT 1/2: GOOD   FT 2/2: MISS Dwyane Irving makes 1/2 from the line. Rebound secured by Larry Duncan.
Score: 97-77

[03:17] Team_085 possession (Score: 97-77)
Paul Wagner drives and kicks out. Magic Beal attempts a 3Pt. Wide open! Michael Curry is 6.5 feet away. [MAN] Magic Beal misses. Rebound secured by Anthony Lillard.

[03:04] Team_004 possession (Score: 97-77)
Draymond Fox drives, picks up Paul Wagner. Help arrives from Magic Beal! Draymond Fox attempts a Dunk. Contested by Magic Beal (5.2 feet, ZONE). Draymond Fox misses. Rebound secured by Collin Mobley.

[02:54] Team_085 possession (Score: 97-77)
Magic Beal attempts a 3Pt. Wide open! Michael Curry is 6.7 feet away. [ZONE] MAGIC BEAL MAKES IT! Assist: Paul Wagner
Score: 100-77

[02:37] Team_004 possession (Score: 100-77)
Michael Curry attempts a Midrange. Contested by Stephen Bird (5.5 feet, ZONE). MICHAEL CURRY MAKES IT!
Score: 100-79

[02:24] Team_085 possession (Score: 100-79)
Stephen Bird attempts a Layup. Wide open! Anthony Lillard is 6.2 feet away. [ZONE] STEPHEN BIRD MAKES IT! Assist: Magic Beal
Score: 102-79

[02:08] Team_004 possession (Score: 102-79)
Anthony Lillard attempts a 3Pt. Contested by Paul Wagner (5.3 feet, ZONE). Anthony Lillard misses. Rebound secured by Collin Mobley.

[01:53] Team_085 possession (Score: 102-79)
FOUL! Shooting foul on Dwyane Irving. Larry Duncan to the line for 3 free throws. [BONUS: 6 team fouls] (Dwyane Irving: 3 personal fouls)   FT 1/3: MISS   FT 2/3: GOOD   FT 3/3: GOOD Larry Duncan makes 2/3 from the line.
Score: 104-79

[01:39] Team_004 possession (Score: 104-79)
Anthony Lillard commits a violation (traveling/carry)! TURNOVER! (dead ball)

[01:39] Substitution (Team_085): Magic Beal OUT → Khris Brogdon IN (stamina_rule2)

[01:39] Substitution (Team_085): Stephen Bird OUT → Jordan Morant IN (stamina_rule2)

[01:39] Substitution (Team_085): Larry Duncan OUT → Giannis Johnson IN (stamina_rule2)

[01:39] Substitution (Team_085): Paul Wagner OUT → Jalen Leonard IN (stamina_rule2)

[01:39] Substitution (Team_085): Collin Mobley OUT → Malcolm Beal IN (stamina_rule2)

[01:39] Substitution (Team_004): Michael Curry OUT → Karl Reaves IN (stamina_rule2)

[01:39] Substitution (Team_004): Jabari Wade OUT → Russell Barnes IN (stamina_rule2)

[01:39] Substitution (Team_004): Dwyane Irving OUT → Kristaps Green IN (stamina_rule2)

[01:39] Substitution (Team_004): Draymond Fox OUT → Michael Sabonis IN (stamina_rule2)

[01:39] Substitution (Team_004): Anthony Lillard OUT → Shai Beal IN (stamina_rule2)

[01:27] Team_085 possession (Score: 104-79)
Giannis Johnson makes the Layup and draws the foul on Russell Barnes! And-1! Giannis Johnson to the line for 1. [BONUS: 7 team fouls] (Russell Barnes: 1 personal fouls)   FT 1/1: MISS Giannis Johnson makes 0/1 from the line. Offensive rebound by Jalen Leonard! Jalen Leonard kicks it out.
Score: 106-79

[01:09] Team_085 possession (Score: 106-79)
FOUL! Reach-in foul on Shai Beal during the drive. [IN THE BONUS! 8 team fouls] Malcolm Beal to the line for 2 free throws. (Shai Beal: 1 personal fouls)   FT 1/2: GOOD   FT 2/2: MISS Malcolm Beal makes 1/2 from the line. Rebound secured by Michael Sabonis.
Score: 107-79

[00:55] Team_004 possession (Score: 107-79)
Karl Reaves drives and kicks out. Karl Reaves attempts a 3Pt. Contested by Khris Brogdon (5.5 feet, MAN). Karl Reaves misses. FOUL! Loose ball foul on Malcolm Beal during the rebound battle. [IN THE BONUS! 6 team fouls] Shai Beal to the line for 2 free throws. (Malcolm Beal: 1 personal fouls)   FT 1/2: MISS   FT 2/2: GOOD Shai Beal makes 1/2 from the line.
Score: 107-80

[00:42] Team_085 possession (Score: 107-80)
Khris Brogdon attempts a Layup. Contested by Shai Beal (4.9 feet, ZONE). Khris Brogdon misses. Offensive rebound by Jalen Leonard! Jalen Leonard kicks it out.

[00:31] Team_085 possession (Score: 107-80)
FOUL! Shooting foul on Shai Beal. Malcolm Beal to the line for 2 free throws. [BONUS: 9 team fouls] (Shai Beal: 2 personal fouls)   FT 1/2: MISS   FT 2/2: GOOD Malcolm Beal makes 1/2 from the line.
Score: 108-80

[00:19] Team_004 possession (Score: 108-80)
Shai Beal attempts a Midrange. Contested by Malcolm Beal (4.4 feet, MAN). SHAI BEAL MAKES IT!
Score: 108-82

[00:02] Team_085 possession (Score: 108-82)
Giannis Johnson attempts a Layup. Contested by Kristaps Green (4.4 feet, MAN). Giannis Johnson misses. Offensive rebound by Malcolm Beal! Malcolm Beal kicks it out.

================================================================================
                              4TH QUARTER COMPLETE                              
================================================================================

4TH QUARTER SCORE: Team_085 28, Team_004 26

BOX SCORE:
================================================================================

Team_085
--------------------------------------------------------------------------------
Player                MIN  PTS  REB  AST  TO      FG   FG%      3P   3P%
--------------------------------------------------------------------------------
Magic Beal             44    8    0    1   0   3/3   100.0     0/0   0.0
Stephen Bird           44    7    0    0   0   3/5    60.0     0/0   0.0
Larry Duncan           44    5    3    2   0   2/6    33.3     0/0   0.0
Paul Wagner            44    3    1    2   0   1/3    33.3     0/0   0.0
Malcolm Beal            5    1    1    0   0   1/2    50.0     0/0   0.0
Collin Mobley          44    0    4    0   0   0/2     0.0     0/0   0.0
Jalen Leonard           5    0    2    0   0   0/0     0.0     0/0   0.0

TEAM: FG: 10/21 (47.6%), 3PT: 4/8 (50.0%), REB: 11 (3 off, 8 def), AST: 5, TO: 0
TEAM FOULS: 6 [Team_004 in BONUS]


Team_004
--------------------------------------------------------------------------------
Player                MIN  PTS  REB  AST  TO      FG   FG%      3P   3P%
--------------------------------------------------------------------------------
Michael Curry          44    6    0    1   0   3/5    60.0     0/0   0.0
Dwyane Irving          44    5    4    1   0   2/2   100.0     0/0   0.0
Jabari Wade            44    5    0    2   0   2/3    66.7     0/0   0.0
Draymond Fox           44    3    4    1   0   1/2    50.0     0/0   0.0
Shai Beal               5    3    0    0   0   2/2   100.0     0/0   0.0
Anthony Lillard        44    0    6    0   0   0/3     0.0     0/0   0.0
Michael Sabonis         5    0    1    0   0   0/0     0.0     0/0   0.0

TEAM: FG: 10/18 (55.6%), 3PT: 2/5 (40.0%), REB: 15 (4 off, 11 def), AST: 5, TO: 3
TEAM FOULS: 9 [Team_085 in BONUS]

================================================================================

================================================================================
                               FULL GAME COMPLETE                               
================================================================================

FINAL SCORE: Team_085 108, Team_004 82

SCORING BY QUARTER:
--------------------------------------------------------------------------------
Team                     Q1     Q2     Q3     Q4    FINAL
--------------------------------------------------------------------------------
Team_085                 33     13     34     28      108
Team_004                 16     22     18     26       82
--------------------------------------------------------------------------------

FULL GAME BOX SCORE:
================================================================================

Team_085
--------------------------------------------------------------------------------
Player                MIN  PTS  REB  AST  TO      FG   FG%      3P   3P%      FT STL BLK
--------------------------------------------------------------------------------
Magic Beal             44   24    0    3   1   8/12   66.7   4/7    57.1   9/9     2   2
Stephen Bird           44   21    0    1   2   8/14   57.1   2/5    40.0   3/3     0   0
Larry Duncan           44   21   18    5   1   9/20   45.0   5/13   38.5   7/11    1   0
Paul Wagner            44   19   16    5   0   8/14   57.1   0/3     0.0   4/7     2   2
Collin Mobley          44   14   11    4   2   6/13   46.2   0/1     0.0   6/7     1   0
Khris Brogdon           5    0    0    0   1   0/1     0.0   0/1     0.0   0/0     0   0
Jordan Morant           5    0    0    0   1   0/0     0.0   0/0     0.0   0/0     0   0
Giannis Johnson         5    0    1    0   0   1/1   100.0   0/0     0.0   0/1     0   0
Jalen Leonard           5    0    3    0   0   0/0     0.0   0/0     0.0   0/0     0   0
Malcolm Beal            5    2    1    0   0   1/2    50.0   0/0     0.0   3/6     0   0

TEAM: FG: 42/78 (53.8%), 3PT: 11/30 (36.7%), REB: 50 (12 off, 38 def), AST: 18, TO: 8


Team_004
--------------------------------------------------------------------------------
Player                MIN  PTS  REB  AST  TO      FG   FG%      3P   3P%      FT STL BLK
--------------------------------------------------------------------------------
Michael Curry          44    8    0    1   1   3/11   27.3   0/3     0.0   5/8     0   0
Jabari Wade            44   24    0    3   0  12/23   52.2   4/11   36.4   3/6     0   1
Dwyane Irving          44   12   11    3   2   5/9    55.6   1/2    50.0   2/3     2   0
Draymond Fox           44   16   15    2   5   6/10   60.0   1/2    50.0   4/5     0   0
Anthony Lillard        44    5   15    2   3   2/12   16.7   0/2     0.0   1/3     0   1
Karl Reaves             5    0    0    0   0   1/1   100.0   0/0     0.0   0/0     0   0
Russell Barnes          5    5    0    0   0   2/2   100.0   1/1   100.0   0/0     0   0
Kristaps Green          5    2    0    0   0   1/1   100.0   0/0     0.0   0/0     0   0
Michael Sabonis         5    0    2    0   0   0/0     0.0   0/0     0.0   0/0     0   0
Shai Beal               5    4    1    1   0   2/2   100.0   0/0     0.0   2/6     0   0

TEAM: FG: 35/74 (47.3%), 3PT: 7/21 (33.3%), REB: 44 (8 off, 36 def), AST: 12, TO: 11

================================================================================
