================================================================================
                        FULL GAME - Team_006 vs Team_068                        
================================================================================

================================================================================
                       1ST QUARTER - Team_006 vs Team_068                       
================================================================================

[12:00] Team_006 possession (Score: 0-0)
Jayson Young attempts a 3Pt. Contested by Zion Anunoby (4.8 feet, ZONE). JAYSON YOUNG MAKES IT! Assist: Franz Wagner
Score: 3-0

[11:45] Team_068 possession (Score: 3-0)
Malcolm Herro attempts a 3Pt. Contested by Shai Westbrook (3.8 feet, ZONE). Malcolm Herro misses. Rebound secured by Shai Westbrook.

[11:31] Team_006 possession (Score: 3-0)
Jayson Young attempts a Midrange. Contested by Zion Anunoby (4.8 feet, ZONE). JAYSON YOUNG MAKES IT! Assist: Bradley Gobert
Score: 5-0

[11:14] Team_068 possession (Score: 5-0)
Gary Simons drives, picks up Ja Butler. Help arrives from Shai Westbrook! Gary Simons attempts a Layup. Contested by Shai Westbrook (3.7 feet, MAN). GARY SIMONS MAKES IT! Assist: Malcolm Herro
Score: 5-2

[10:58] Team_006 possession (Score: 5-2)
Jayson Young attempts a Midrange. Contested by Malcolm Herro (4.6 feet, ZONE). JAYSON YOUNG MAKES IT! Assist: Ja Butler
Score: 7-2

[10:42] Team_068 possession (Score: 7-2)
Gary Simons attempts a Midrange. Contested by Bradley Gobert (3.6 feet, ZONE). Gary Simons misses. Rebound secured by Ja Butler.

[10:24] Team_006 possession (Score: 7-2)
Ja Butler attempts a Layup. Contested by Gary Simons (3.3 feet, ZONE). Ja Butler misses. Rebound secured by Gary Simons.

[10:06] Team_068 possession (Score: 7-2)
Zion Anunoby attempts a Midrange. Contested by Shai Westbrook (4.2 feet, MAN). Zion Anunoby misses. Offensive rebound by Jaren Johnson! Jaren Johnson kicks it out.

[09:53] Team_068 possession (Score: 7-2)
Jaren Johnson attempts a 3Pt. Contested by Franz Wagner (5.3 feet, ZONE). Jaren Johnson misses. Rebound secured by Ja Butler.

[09:37] Team_006 possession (Score: 7-2)
Ja Butler attempts a 3Pt. Contested by Jaren Johnson (3.7 feet, ZONE). Ja Butler misses. Rebound secured by Nikola Ginobili.

[09:26] Team_068 possession (Score: 7-2)
Jaren Johnson attempts a 3Pt. Contested by Jayson Young (5.0 feet, MAN). Jaren Johnson misses. Rebound secured by Ja Butler.

[09:08] Team_006 possession (Score: 7-2)
Bradley Gobert drives, picks up Gary Simons. Help arrives from Malcolm Herro! Bradley Gobert attempts a Dunk. Contested by Malcolm Herro (3.1 feet, ZONE). BRADLEY GOBERT MAKES IT! Assist: Shai Westbrook
Score: 9-2

[08:56] Team_068 possession (Score: 9-2)
Jaren Johnson attempts a 3Pt. Contested by Jayson Young (5.0 feet, MAN). Jaren Johnson misses. Rebound secured by Ja Butler.

[08:44] Team_006 possession (Score: 9-2)
Jayson Young drives, Jaren Johnson stays with him. Jayson Young attempts a Layup. Contested by Jaren Johnson (4.0 feet, MAN). JAYSON YOUNG MAKES IT! Assist: Bradley Gobert
Score: 11-2

[08:32] Team_068 possession (Score: 11-2)
Zion Anunoby drives and kicks out. Zion Anunoby attempts a 3Pt. Contested by Shai Westbrook (3.8 feet, MAN). Zion Anunoby misses. Offensive rebound by Jaren Johnson! Jaren Johnson kicks it out.

[08:14] Team_068 possession (Score: 11-2)
Malcolm Herro attempts a 3Pt. Contested by Shai Westbrook (3.8 feet, ZONE). Malcolm Herro misses. Rebound secured by Ja Butler.

[08:00] Team_006 possession (Score: 11-2)
Ja Butler attempts a 3Pt. Contested by Malcolm Herro (4.3 feet, ZONE). Ja Butler misses. Rebound secured by Gary Simons.

[07:49] Team_068 possession (Score: 11-2)
Malcolm Herro attempts a 3Pt. Contested by Shai Westbrook (3.8 feet, ZONE). MALCOLM HERRO MAKES IT! Assist: Zion Anunoby
Score: 11-5

[07:34] Team_006 possession (Score: 11-5)
Bradley Gobert attempts a Layup. Contested by Gary Simons (3.1 feet, ZONE). BRADLEY GOBERT MAKES IT! Assist: Franz Wagner
Score: 13-5

[07:22] Team_068 possession (Score: 13-5)
Zion Anunoby makes the Dunk and draws the foul on Shai Westbrook! And-1! Zion Anunoby to the line for 1. [Team fouls: 1] (Shai Westbrook: 1 personal fouls)   FT 1/1: GOOD Zion Anunoby makes 1/1 from the line.
Score: 13-8

[07:06] Team_006 possession (Score: 13-8)
Jayson Young attempts a 3Pt. Contested by Zion Anunoby (4.8 feet, ZONE). JAYSON YOUNG MAKES IT! Assist: Shai Westbrook
Score: 16-8

[06:52] Team_068 possession (Score: 16-8)
Malcolm Herro makes the Midrange and draws the foul on Franz Wagner! And-1! Malcolm Herro to the line for 1. [Team fouls: 2] (Franz Wagner: 1 personal fouls)   FT 1/1: GOOD Malcolm Herro makes 1/1 from the line.
Score: 16-11

[06:38] Team_006 possession (Score: 16-11)
Jayson Young attempts a 3Pt. Contested by Jaren Johnson (4.0 feet, MAN). Jayson Young misses. Rebound secured by Gary Simons.

[06:23] Team_068 possession (Score: 16-11)
Zion Anunoby makes the Dunk and draws the foul on Shai Westbrook! And-1! Zion Anunoby to the line for 1. [Team fouls: 3] (Shai Westbrook: 2 personal fouls)   FT 1/1: GOOD Zion Anunoby makes 1/1 from the line.
Score: 16-14

[06:06] Team_006 possession (Score: 16-14)
Ja Butler drives, picks up Gary Simons. Help arrives from Malcolm Herro! Ja Butler attempts a Layup. Contested by Malcolm Herro (3.3 feet, MAN). JA BUTLER MAKES IT!
Score: 18-14

[05:54] Team_068 possession (Score: 18-14)
Malcolm Herro loses the ball! Stripped by Franz Wagner! TURNOVER! (live ball)

[05:36] Team_006 possession (Score: 18-14)
Ja Butler attempts a Midrange. Contested by Jaren Johnson (3.7 feet, ZONE). JA BUTLER MAKES IT! Assist: Bradley Gobert
Score: 20-14

[05:21] Team_068 possession (Score: 20-14)
Gary Simons drives, picks up Bradley Gobert. Help arrives from Shai Westbrook! Gary Simons attempts a Dunk. Contested by Shai Westbrook (3.6 feet, ZONE). GARY SIMONS MAKES IT! Assist: Malcolm Herro
Score: 20-16

[05:04] Team_006 possession (Score: 20-16)
Ja Butler makes the Layup and draws the foul on Gary Simons! And-1! Ja Butler to the line for 1. [Team fouls: 1] (Gary Simons: 1 personal fouls)   FT 1/1: GOOD Ja Butler makes 1/1 from the line.
Score: 23-16

[04:49] Team_068 possession (Score: 23-16)
Nikola Ginobili drives, Bradley Gobert stays with him. Nikola Ginobili attempts a Dunk. Contested by Bradley Gobert (2.9 feet, MAN). NIKOLA GINOBILI MAKES IT!
Score: 23-18

[04:36] Team_006 possession (Score: 23-18)
Bradley Gobert drives and kicks out. Shai Westbrook attempts a Midrange. Contested by Zion Anunoby (4.4 feet, MAN). SHAI WESTBROOK MAKES IT! Assist: Ja Butler
Score: 25-18

[04:21] Team_068 possession (Score: 25-18)
Jaren Johnson drives, Bradley Gobert stays with him. Jaren Johnson attempts a Dunk. Contested by Bradley Gobert (3.4 feet, ZONE). Jaren Johnson misses. Offensive rebound by Jaren Johnson! Jaren Johnson kicks it out.

[04:07] Team_068 possession (Score: 25-18)
FOUL! Reach-in foul on Bradley Gobert during the drive. [Team fouls: 4] No free throws, side out. (Bradley Gobert: 1 personal fouls)

[03:53] Team_068 possession (Score: 25-18)
Nikola Ginobili attempts a Midrange. Contested by Bradley Gobert (3.0 feet, MAN). NIKOLA GINOBILI MAKES IT!
Score: 25-20

[03:34] Team_006 possession (Score: 25-20)
Ja Butler attempts a 3Pt. Contested by Zion Anunoby (4.6 feet, ZONE). Ja Butler misses. Rebound secured by Nikola Ginobili.

[03:18] Team_068 possession (Score: 25-20)
Gary Simons attempts a 3Pt. Contested by Ja Butler (3.9 feet, MAN). Gary Simons misses. Offensive rebound by Jaren Johnson! Jaren Johnson kicks it out.

[03:04] Team_068 possession (Score: 25-20)
Nikola Ginobili makes the Layup and draws the foul on Bradley Gobert! And-1! Nikola Ginobili to the line for 1. [BONUS: 5 team fouls] (Bradley Gobert: 2 personal fouls)   FT 1/1: GOOD Nikola Ginobili makes 1/1 from the line.
Score: 25-23

[02:51] Team_006 possession (Score: 25-23)
Franz Wagner attempts a Midrange. Contested by Jaren Johnson (3.9 feet, ZONE). Franz Wagner misses. Offensive rebound by Bradley Gobert! Bradley Gobert kicks it out.

[02:39] Team_006 possession (Score: 25-23)
Shai Westbrook attempts a 3Pt. Contested by Zion Anunoby (4.5 feet, ZONE). Shai Westbrook misses. Rebound secured by Jaren Johnson.

[02:26] Team_068 possession (Score: 25-23)
Jaren Johnson drives and kicks out. Zion Anunoby attempts a 3Pt. Contested by Shai Westbrook (4.1 feet, MAN). Zion Anunoby misses. Offensive rebound by Jaren Johnson! Jaren Johnson kicks it out.

[02:07] Team_068 possession (Score: 25-23)
Gary Simons drives, Ja Butler stays with him. Gary Simons attempts a Layup. Contested by Ja Butler (4.0 feet, MAN). GARY SIMONS MAKES IT! Assist: Malcolm Herro
Score: 25-25

[01:51] Team_006 possession (Score: 25-25)
Bradley Gobert loses control! Ball rolls out of bounds! TURNOVER! (dead ball)

[01:51] Substitution (Team_006): Shai Westbrook OUT → Miles Harris IN (stamina_rule2)

[01:51] Substitution (Team_006): Franz Wagner OUT → Lamelo Westbrook IN (stamina_rule2)

[01:51] Substitution (Team_006): Jayson Young OUT → Vince Sabonis IN (stamina_rule2)

[01:51] Substitution (Team_006): Ja Butler OUT → Cade Ball IN (stamina_rule2)

[01:51] Substitution (Team_006): Bradley Gobert OUT → Shaquille Sexton IN (stamina_rule2)

[01:51] Substitution (Team_068): Zion Anunoby OUT → Cole Anthony IN (stamina_rule2)

[01:51] Substitution (Team_068): Malcolm Herro OUT → Ja Banchero IN (stamina_rule2)

[01:51] Substitution (Team_068): Jaren Johnson OUT → Miles Murray IN (stamina_rule2)

[01:51] Substitution (Team_068): Gary Simons OUT → Jarrett Oladipo IN (stamina_rule2)

[01:51] Substitution (Team_068): Nikola Ginobili OUT → Franz Curry IN (stamina_rule2)

[01:38] Team_068 possession (Score: 25-25)
Ja Banchero attempts a Midrange. Contested by Lamelo Westbrook (3.7 feet, ZONE). Ja Banchero misses. Rebound secured by Cade Ball.

[01:25] Team_006 possession (Score: 25-25)
Lamelo Westbrook attempts a Midrange. Contested by Jarrett Oladipo (3.9 feet, ZONE). Lamelo Westbrook misses. Rebound secured by Jarrett Oladipo.

[01:11] Team_068 possession (Score: 25-25)
FOUL! Shooting foul on Cade Ball. Jarrett Oladipo to the line for 2 free throws. [BONUS: 6 team fouls] (Cade Ball: 1 personal fouls)   FT 1/2: GOOD   FT 2/2: GOOD Jarrett Oladipo makes 2/2 from the line.
Score: 25-27

[00:59] Team_006 possession (Score: 25-27)
FOUL! Reach-in foul on Franz Curry during the drive. [Team fouls: 2] No free throws, side out. (Franz Curry: 1 personal fouls)

[00:43] Team_006 possession (Score: 25-27)
Shaquille Sexton makes the Layup and draws the foul on Ja Banchero! And-1! Shaquille Sexton to the line for 1. [Team fouls: 3] (Ja Banchero: 1 personal fouls)   FT 1/1: GOOD Shaquille Sexton makes 1/1 from the line.
Score: 28-27

[00:30] Team_068 possession (Score: 28-27)
FOUL! Reach-in foul on Shaquille Sexton during the drive. [IN THE BONUS! 7 team fouls] Franz Curry to the line for 2 free throws. (Shaquille Sexton: 1 personal fouls)   FT 1/2: GOOD   FT 2/2: MISS Franz Curry makes 1/2 from the line. Rebound secured by Shaquille Sexton.
Score: 28-28

[00:20] Team_006 possession (Score: 28-28)
Lamelo Westbrook drives, picks up Ja Banchero. Help arrives from Miles Murray! Lamelo Westbrook attempts a Dunk. Contested by Miles Murray (5.2 feet, MAN). LAMELO WESTBROOK MAKES IT! Assist: Shaquille Sexton
Score: 30-28

[00:08] Team_068 possession (Score: 30-28)
Jarrett Oladipo attempts a Layup. BLOCKED BY LAMELO WESTBROOK! Ball is loose! Rebound secured by Vince Sabonis.

================================================================================
                              1ST QUARTER COMPLETE                              
================================================================================

1ST QUARTER SCORE: Team_006 30, Team_068 28

BOX SCORE:
================================================================================

Team_006
--------------------------------------------------------------------------------
Player                MIN  PTS  REB  AST  TO      FG   FG%      3P   3P%
--------------------------------------------------------------------------------
Jayson Young           10   12    0    0   0   5/6    83.3     0/0   0.0
Ja Butler              10    7    5    2   0   3/7    42.9     0/0   0.0
Bradley Gobert         10    4    1    3   0   2/2   100.0     0/0   0.0
Shaquille Sexton        2    3    1    1   0   1/1   100.0     0/0   0.0
Shai Westbrook         10    2    1    2   0   1/2    50.0     0/0   0.0
Lamelo Westbrook        2    2    0    0   0   1/2    50.0     0/0   0.0
Franz Wagner           10    0    0    2   0   0/0     0.0     0/0   0.0
Cade Ball               2    0    1    0   0   0/0     0.0     0/0   0.0
Vince Sabonis           2    0    1    0   0   0/0     0.0     0/0   0.0

TEAM: FG: 13/20 (65.0%), 3PT: 2/7 (28.6%), REB: 10 (1 off, 9 def), AST: 10, TO: 1
TEAM FOULS: 7 [Team_068 in BONUS]


Team_068
--------------------------------------------------------------------------------
Player                MIN  PTS  REB  AST  TO      FG   FG%      3P   3P%
--------------------------------------------------------------------------------
Nikola Ginobili        10    7    2    0   0   3/3   100.0     0/0   0.0
Malcolm Herro          10    6    0    3   0   2/4    50.0     0/0   0.0
Gary Simons            10    6    3    0   0   3/4    75.0     0/0   0.0
Zion Anunoby           10    6    0    1   0   2/2   100.0     0/0   0.0
Jarrett Oladipo         2    2    1    0   0   1/2    50.0     0/0   0.0
Jaren Johnson          10    0    6    0   0   0/3     0.0     0/0   0.0
Ja Banchero             2    0    0    0   0   0/1     0.0     0/0   0.0
Franz Curry             2    0    0    0   0   0/1     0.0     0/0   0.0

TEAM: FG: 11/20 (55.0%), 3PT: 1/6 (16.7%), REB: 12 (5 off, 7 def), AST: 4, TO: 1
TEAM FOULS: 3

================================================================================

================================================================================
                       2ND QUARTER - Team_006 vs Team_068                       
================================================================================

[12:00] Team_006 possession (Score: 30-28)
FOUL! Reach-in foul on Gary Simons during the drive. [Team fouls: 1] No free throws, side out. (Gary Simons: 1 personal fouls)

[11:47] Team_006 possession (Score: 30-28)
Ja Butler drives, picks up Gary Simons. Help arrives from Malcolm Herro! Ja Butler attempts a Dunk. Contested by Malcolm Herro (3.4 feet, ZONE). JA BUTLER MAKES IT! Assist: Shai Westbrook
Score: 32-28

[11:32] Team_068 possession (Score: 32-28)
Gary Simons attempts a Dunk. BLOCKED BY JA BUTLER! Ball is loose! Rebound secured by Ja Butler.

[11:21] Team_006 possession (Score: 32-28)
Bradley Gobert drives, picks up Gary Simons. Help arrives from Malcolm Herro! Bradley Gobert attempts a Dunk. Contested by Malcolm Herro (3.2 feet, ZONE). BRADLEY GOBERT MAKES IT! Assist: Shai Westbrook
Score: 34-28

[11:09] Team_068 possession (Score: 34-28)
Jaren Johnson attempts a Midrange. Contested by Jayson Young (5.1 feet, MAN). Jaren Johnson misses. Rebound secured by Shai Westbrook.

[10:57] Team_006 possession (Score: 34-28)
Shai Westbrook drives, picks up Zion Anunoby. Help arrives from Jaren Johnson! Shai Westbrook attempts a Layup. Contested by Jaren Johnson (4.5 feet, MAN). Shai Westbrook misses. Rebound secured by Gary Simons.

[10:45] Team_068 possession (Score: 34-28)
Gary Simons attempts a Midrange. Contested by Ja Butler (3.9 feet, MAN). GARY SIMONS MAKES IT! Assist: Nikola Ginobili
Score: 34-30

[10:30] Team_006 possession (Score: 34-30)
Bradley Gobert attempts a Layup. Contested by Nikola Ginobili (4.2 feet, MAN). BRADLEY GOBERT MAKES IT! Assist: Ja Butler
Score: 36-30

[10:14] Team_068 possession (Score: 36-30)
Nikola Ginobili attempts a 3Pt. BLOCKED BY SHAI WESTBROOK! Ball is loose! Rebound secured by Bradley Gobert.

[09:55] Team_006 possession (Score: 36-30)
FOUL! Reach-in foul on Gary Simons during the drive. [Team fouls: 2] No free throws, side out. (Gary Simons: 2 personal fouls)

[09:39] Team_006 possession (Score: 36-30)
FOUL! Shooting foul on Nikola Ginobili. Franz Wagner to the line for 2 free throws. [Team fouls: 3] (Nikola Ginobili: 1 personal fouls)   FT 1/2: GOOD   FT 2/2: MISS Franz Wagner makes 1/2 from the line. Rebound secured by Gary Simons.
Score: 37-30

[09:22] Team_068 possession (Score: 37-30)
Zion Anunoby makes the 3Pt and draws the foul on Shai Westbrook! And-1! Zion Anunoby to the line for 1. [Team fouls: 1] (Shai Westbrook: 1 personal fouls)   FT 1/1: GOOD Zion Anunoby makes 1/1 from the line.
Score: 37-34

[09:08] Team_006 possession (Score: 37-34)
Jayson Young attempts a Midrange. Contested by Jaren Johnson (4.3 feet, ZONE). JAYSON YOUNG MAKES IT! Assist: Shai Westbrook
Score: 39-34

[08:54] Team_068 possession (Score: 39-34)
Zion Anunoby attempts a Midrange. Contested by Franz Wagner (5.5 feet, ZONE). Zion Anunoby misses. Rebound secured by Ja Butler.

[08:42] Team_006 possession (Score: 39-34)
FOUL! Reach-in foul on Gary Simons during the drive. [Team fouls: 4] No free throws, side out. (Gary Simons: 3 personal fouls)

[08:26] Team_006 possession (Score: 39-34)
Ja Butler attempts a Midrange. Contested by Gary Simons (3.8 feet, MAN). Ja Butler misses. Rebound secured by Jaren Johnson.

[08:16] Team_068 possession (Score: 39-34)
Nikola Ginobili makes the Layup and draws the foul on Shai Westbrook! And-1! Nikola Ginobili to the line for 1. [Team fouls: 2] (Shai Westbrook: 2 personal fouls)   FT 1/1: GOOD Nikola Ginobili makes 1/1 from the line.
Score: 39-37

[08:02] Team_006 possession (Score: 39-37)
Shai Westbrook drives, picks up Zion Anunoby. Help arrives from Jaren Johnson! Shai Westbrook attempts a Dunk. Contested by Jaren Johnson (4.7 feet, MAN). Shai Westbrook misses. Rebound secured by Jaren Johnson.

[07:50] Team_068 possession (Score: 39-37)
Malcolm Herro attempts a Midrange. Contested by Franz Wagner (5.3 feet, MAN). MALCOLM HERRO MAKES IT! Assist: Gary Simons
Score: 39-39

[07:38] Team_006 possession (Score: 39-39)
Franz Wagner attempts a Midrange. Contested by Malcolm Herro (4.8 feet, ZONE). FRANZ WAGNER MAKES IT! Assist: Bradley Gobert
Score: 41-39

[07:23] Team_068 possession (Score: 41-39)
Zion Anunoby attempts a 3Pt. Contested by Shai Westbrook (4.7 feet, ZONE). Zion Anunoby misses. Rebound secured by Bradley Gobert.

[07:07] Team_006 possession (Score: 41-39)
Ja Butler drives and kicks out. Bradley Gobert attempts a 3Pt. Contested by Nikola Ginobili (4.9 feet, MAN). BRADLEY GOBERT MAKES IT! Assist: Ja Butler
Score: 44-39

[06:50] Team_068 possession (Score: 44-39)
Jaren Johnson attempts a 3Pt. Contested by Jayson Young (5.5 feet, MAN). Jaren Johnson misses. Offensive rebound by Nikola Ginobili! Nikola Ginobili's putback is no good. Rebound secured by Ja Butler.

[06:35] Team_006 possession (Score: 44-39)
Shai Westbrook drives and kicks out. Ja Butler attempts a 3Pt. Contested by Gary Simons (4.1 feet, MAN). Ja Butler misses. Rebound secured by Nikola Ginobili.

[06:23] Team_068 possession (Score: 44-39)
Nikola Ginobili attempts a Layup. Contested by Bradley Gobert (3.7 feet, MAN). Nikola Ginobili misses. Offensive rebound by Nikola Ginobili! Nikola Ginobili kicks it out.

[06:06] Team_068 possession (Score: 44-39)
Nikola Ginobili drives, picks up Bradley Gobert. Help arrives from Shai Westbrook! Nikola Ginobili attempts a Layup. Contested by Shai Westbrook (3.7 feet, MAN). Nikola Ginobili misses. Rebound secured by Bradley Gobert.

[05:48] Team_006 possession (Score: 44-39)
FOUL! Reach-in foul on Gary Simons during the drive. [IN THE BONUS! 5 team fouls] Ja Butler to the line for 2 free throws. (Gary Simons: 4 personal fouls)   FT 1/2: GOOD   FT 2/2: GOOD Ja Butler makes 2/2 from the line.
Score: 46-39

[05:31] Team_068 possession (Score: 46-39)
Malcolm Herro throws a bad pass! Stolen by Franz Wagner! TURNOVER! (live ball)

[05:20] Team_006 possession (Score: 46-39)
Ja Butler attempts a Layup. BLOCKED BY GARY SIMONS! Ball deflects out of bounds off Ja Butler.

[05:06] Team_068 possession (Score: 46-39)
Malcolm Herro throws a bad pass out of bounds! TURNOVER! (dead ball)

[05:06] Substitution (Team_006): Shai Westbrook OUT → Miles Harris IN (stamina_rule2)

[05:06] Substitution (Team_006): Franz Wagner OUT → Lamelo Westbrook IN (stamina_rule2)

[05:06] Substitution (Team_006): Jayson Young OUT → Vince Sabonis IN (stamina_rule2)

[05:06] Substitution (Team_006): Ja Butler OUT → Cade Ball IN (stamina_rule2)

[05:06] Substitution (Team_006): Bradley Gobert OUT → Shaquille Sexton IN (stamina_rule2)

[05:06] Substitution (Team_068): Zion Anunoby OUT → Cole Anthony IN (stamina_rule2)

[05:06] Substitution (Team_068): Malcolm Herro OUT → Ja Banchero IN (stamina_rule2)

[05:06] Substitution (Team_068): Jaren Johnson OUT → Miles Murray IN (stamina_rule2)

[05:06] Substitution (Team_068): Gary Simons OUT → Jarrett Oladipo IN (stamina_rule2)

[05:06] Substitution (Team_068): Nikola Ginobili OUT → Franz Curry IN (stamina_rule2)

[04:53] Team_006 possession (Score: 46-39)
Miles Harris drives, Cole Anthony stays with him. Miles Harris attempts a Dunk. Contested by Cole Anthony (4.8 feet, MAN). Miles Harris misses. Rebound secured by Franz Curry.

[04:40] Team_068 possession (Score: 46-39)
Ja Banchero attempts a 3Pt. Contested by Lamelo Westbrook (3.7 feet, ZONE). Ja Banchero misses. Rebound secured by Shaquille Sexton.

[04:25] Team_006 possession (Score: 46-39)
Lamelo Westbrook attempts a 3Pt. Contested by Ja Banchero (5.2 feet, ZONE). Lamelo Westbrook misses. Offensive rebound by Shaquille Sexton! Shaquille Sexton kicks it out.

[04:10] Team_006 possession (Score: 46-39)
Shaquille Sexton drives, Franz Curry stays with him. Shaquille Sexton attempts a Dunk. Contested by Franz Curry (4.3 feet, ZONE). Shaquille Sexton misses. Offensive rebound by Shaquille Sexton! Shaquille Sexton kicks it out.

[03:54] Team_006 possession (Score: 46-39)
FOUL! Reach-in foul on Jarrett Oladipo during the drive. [IN THE BONUS! 6 team fouls] Cade Ball to the line for 2 free throws. (Jarrett Oladipo: 1 personal fouls)   FT 1/2: GOOD   FT 2/2: MISS Cade Ball makes 1/2 from the line. Rebound secured by Ja Banchero.
Score: 47-39

[03:41] Team_068 possession (Score: 47-39)
Cole Anthony attempts a Layup. BLOCKED BY CADE BALL! Ball is loose! Rebound secured by Shaquille Sexton.

[03:29] Team_006 possession (Score: 47-39)
Miles Harris attempts a 3Pt. Contested by Cole Anthony (4.8 feet, MAN). MILES HARRIS MAKES IT! Assist: Cade Ball
Score: 50-39

[03:12] Team_068 possession (Score: 50-39)
Miles Murray attempts a Layup. Contested by Vince Sabonis (4.9 feet, MAN). MILES MURRAY MAKES IT!
Score: 50-41

[02:59] Team_006 possession (Score: 50-41)
Lamelo Westbrook attempts a Midrange. Contested by Franz Curry (4.4 feet, ZONE). Lamelo Westbrook misses. Rebound secured by Franz Curry.

[02:49] Team_068 possession (Score: 50-41)
Miles Murray drives to the basket... Miles Murray loses control! Ball rolls out of bounds! TURNOVER! (dead ball)

[02:31] Team_006 possession (Score: 50-41)
Vince Sabonis attempts a Layup. Contested by Franz Curry (4.3 feet, ZONE). VINCE SABONIS MAKES IT! Assist: Shaquille Sexton
Score: 52-41

[02:15] Team_068 possession (Score: 52-41)
Cole Anthony attempts a Layup. Contested by Miles Harris (5.1 feet, MAN). COLE ANTHONY MAKES IT! Assist: Jarrett Oladipo
Score: 52-43

[01:58] Team_006 possession (Score: 52-43)
FOUL! Shooting foul on Franz Curry. Shaquille Sexton to the line for 2 free throws. [BONUS: 7 team fouls] (Franz Curry: 1 personal fouls)   FT 1/2: GOOD   FT 2/2: GOOD Shaquille Sexton makes 2/2 from the line.
Score: 54-43

[01:46] Team_068 possession (Score: 54-43)
Miles Murray attempts a 3Pt. Contested by Vince Sabonis (4.9 feet, MAN). Miles Murray misses. Rebound secured by Vince Sabonis.

[01:33] Team_006 possession (Score: 54-43)
Shaquille Sexton drives, picks up Franz Curry. Help arrives from Ja Banchero! Shaquille Sexton attempts a Dunk. Contested by Ja Banchero (4.3 feet, ZONE). SHAQUILLE SEXTON MAKES IT! Assist: Miles Harris
Score: 56-43

[01:18] Team_068 possession (Score: 56-43)
FOUL! Reach-in foul on Cade Ball during the drive. [Team fouls: 3] No free throws, side out. (Cade Ball: 1 personal fouls)

[01:07] Team_068 possession (Score: 56-43)
Jarrett Oladipo attempts a Midrange. Contested by Cade Ball (4.6 feet, MAN). Jarrett Oladipo misses. Offensive rebound by Franz Curry! Franz Curry puts it back in!
Score: 56-45

[00:49] Team_006 possession (Score: 56-45)
FOUL! Reach-in foul on Cole Anthony during the drive. [IN THE BONUS! 8 team fouls] Miles Harris to the line for 2 free throws. (Cole Anthony: 1 personal fouls)   FT 1/2: MISS   FT 2/2: GOOD Miles Harris makes 1/2 from the line.
Score: 57-45

[00:36] Team_068 possession (Score: 57-45)
Ja Banchero attempts a Midrange. Contested by Lamelo Westbrook (3.7 feet, MAN). JA BANCHERO MAKES IT! Assist: Jarrett Oladipo
Score: 57-47

[00:23] Team_006 possession (Score: 57-47)
Vince Sabonis attempts a Midrange. Contested by Jarrett Oladipo (3.8 feet, ZONE). Vince Sabonis misses. Rebound secured by Franz Curry.

[00:07] Team_068 possession (Score: 57-47)
Miles Murray drives, Vince Sabonis stays with him. Miles Murray attempts a Layup. Contested by Vince Sabonis (4.9 feet, MAN). Miles Murray misses. Rebound secured by Cade Ball.

================================================================================
                              2ND QUARTER COMPLETE                              
================================================================================

2ND QUARTER SCORE: Team_006 27, Team_068 19

BOX SCORE:
================================================================================

Team_006
--------------------------------------------------------------------------------
Player                MIN  PTS  REB  AST  TO      FG   FG%      3P   3P%
--------------------------------------------------------------------------------
Bradley Gobert         17    7    3    1   0   3/3   100.0     0/0   0.0
Ja Butler              17    4    3    2   0   2/4    50.0     0/0   0.0
Miles Harris            7    4    0    1   0   2/3    66.7     0/0   0.0
Shaquille Sexton        7    4    4    1   0   2/2   100.0     0/0   0.0
Franz Wagner           17    2    0    0   0   1/2    50.0     0/0   0.0
Jayson Young           17    2    0    0   0   1/1   100.0     0/0   0.0
Vince Sabonis           7    2    1    0   0   1/2    50.0     0/0   0.0
Shai Westbrook         17    0    1    3   0   0/3     0.0     0/0   0.0
Cade Ball               7    0    1    1   0   0/1     0.0     0/0   0.0
Lamelo Westbrook        7    0    0    0   0   0/1     0.0     0/0   0.0

TEAM: FG: 12/22 (54.5%), 3PT: 1/1 (100.0%), REB: 12 (2 off, 10 def), AST: 9, TO: 0
TEAM FOULS: 3


Team_068
--------------------------------------------------------------------------------
Player                MIN  PTS  REB  AST  TO      FG   FG%      3P   3P%
--------------------------------------------------------------------------------
Zion Anunoby           17    4    0    0   0   1/3    33.3     0/0   0.0
Nikola Ginobili        17    3    2    1   0   1/3    33.3     0/0   0.0
Gary Simons            17    2    2    1   0   1/2    50.0     0/0   0.0
Malcolm Herro          17    2    0    0   0   1/1   100.0     0/0   0.0
Franz Curry             7    2    4    0   0   1/1   100.0     0/0   0.0
Ja Banchero             7    2    1    0   0   1/2    50.0     0/0   0.0
Cole Anthony            7    2    0    0   0   1/2    50.0     0/0   0.0
Miles Murray            7    2    0    0   0   1/3    33.3     0/0   0.0
Jaren Johnson          17    0    2    0   0   0/2     0.0     0/0   0.0
Jarrett Oladipo         7    0    0    2   0   0/0     0.0     0/0   0.0

TEAM: FG: 8/19 (42.1%), 3PT: 1/6 (16.7%), REB: 12 (3 off, 9 def), AST: 4, TO: 3
TEAM FOULS: 8 [Team_006 in BONUS]

================================================================================

================================================================================
                       3RD QUARTER - Team_006 vs Team_068                       
================================================================================

[12:00] Team_006 possession (Score: 57-47)
Shai Westbrook drives, picks up Zion Anunoby. Help arrives from Jaren Johnson! Shai Westbrook attempts a Layup. Contested by Jaren Johnson (4.4 feet, MAN). SHAI WESTBROOK MAKES IT! Assist: Ja Butler
Score: 59-47

[11:48] Team_068 possession (Score: 59-47)
Zion Anunoby attempts a 3Pt. Contested by Shai Westbrook (4.2 feet, ZONE). Zion Anunoby misses. Offensive rebound by Nikola Ginobili! Nikola Ginobili puts it back in!
Score: 59-49

[11:32] Team_006 possession (Score: 59-49)
Shai Westbrook throws a bad pass out of bounds! TURNOVER! (dead ball)

[11:16] Team_068 possession (Score: 59-49)
FOUL! Holding foul on Franz Wagner. [Team fouls: 1] No free throws, side out. (Franz Wagner: 1 personal fouls)

[11:04] Team_068 possession (Score: 59-49)
Nikola Ginobili drives and kicks out. Gary Simons attempts a 3Pt. Contested by Ja Butler (2.9 feet, MAN). Gary Simons misses. Offensive rebound by Jaren Johnson! Jaren Johnson kicks it out.

[10:53] Team_068 possession (Score: 59-49)
Malcolm Herro attempts a 3Pt. Contested by Franz Wagner (4.8 feet, MAN). Malcolm Herro misses. Rebound secured by Shai Westbrook.

[10:37] Team_006 possession (Score: 59-49)
Ja Butler attempts a Midrange. Contested by Gary Simons (3.3 feet, MAN). JA BUTLER MAKES IT! Assist: Shai Westbrook
Score: 61-49

[10:23] Team_068 possession (Score: 61-49)
Jaren Johnson attempts a 3Pt. Contested by Franz Wagner (5.3 feet, ZONE). JAREN JOHNSON MAKES IT! Assist: Zion Anunoby
Score: 61-52

[10:09] Team_006 possession (Score: 61-52)
Bradley Gobert drives and kicks out. Ja Butler attempts a 3Pt. Contested by Zion Anunoby (4.4 feet, ZONE). Ja Butler misses. Rebound secured by Gary Simons.

[09:56] Team_068 possession (Score: 61-52)
Gary Simons attempts a Layup. Contested by Bradley Gobert (3.6 feet, ZONE). GARY SIMONS MAKES IT! Assist: Zion Anunoby
Score: 61-54

[09:41] Team_006 possession (Score: 61-54)
FOUL! Reach-in foul on Nikola Ginobili during the drive. [Team fouls: 1] No free throws, side out. (Nikola Ginobili: 1 personal fouls)

[09:29] Team_006 possession (Score: 61-54)
Shai Westbrook attempts a Layup. Contested by Gary Simons (3.2 feet, ZONE). SHAI WESTBROOK MAKES IT! Assist: Franz Wagner
Score: 63-54

[09:16] Team_068 possession (Score: 63-54)
Nikola Ginobili attempts a 3Pt. Contested by Bradley Gobert (2.9 feet, MAN). NIKOLA GINOBILI MAKES IT! Assist: Malcolm Herro
Score: 63-57

[09:04] Team_006 possession (Score: 63-57)
Bradley Gobert drives and kicks out. Bradley Gobert attempts a 3Pt. Contested by Malcolm Herro (4.2 feet, ZONE). Bradley Gobert misses. Rebound secured by Gary Simons.

[08:49] Team_068 possession (Score: 63-57)
Malcolm Herro attempts a 3Pt. Contested by Franz Wagner (4.8 feet, MAN). MALCOLM HERRO MAKES IT! Assist: Jaren Johnson
Score: 63-60

[08:36] Team_006 possession (Score: 63-60)
Shai Westbrook attempts a Midrange. Contested by Zion Anunoby (4.4 feet, MAN). SHAI WESTBROOK MAKES IT!
Score: 65-60

[08:23] Team_068 possession (Score: 65-60)
Malcolm Herro attempts a Midrange. Contested by Franz Wagner (4.8 feet, MAN). MALCOLM HERRO MAKES IT!
Score: 65-62

[08:05] Team_006 possession (Score: 65-62)
Jayson Young attempts a 3Pt. Contested by Jaren Johnson (4.0 feet, MAN). Jayson Young misses. Rebound secured by Gary Simons.

[07:49] Team_068 possession (Score: 65-62)
Jaren Johnson attempts a 3Pt. Contested by Shai Westbrook (4.3 feet, ZONE). JAREN JOHNSON MAKES IT! Assist: Nikola Ginobili
Score: 65-65

[07:34] Team_006 possession (Score: 65-65)
Ja Butler attempts a Midrange. Contested by Jaren Johnson (3.7 feet, ZONE). Ja Butler misses. Rebound secured by Jaren Johnson.

[07:21] Team_068 possession (Score: 65-65)
Malcolm Herro attempts a Midrange. Contested by Franz Wagner (4.8 feet, MAN). MALCOLM HERRO MAKES IT!
Score: 65-67

[07:08] Team_006 possession (Score: 65-67)
Bradley Gobert attempts a Midrange. Contested by Nikola Ginobili (3.9 feet, MAN). Bradley Gobert misses. Rebound secured by Jaren Johnson.

[06:53] Team_068 possession (Score: 65-67)
FOUL! Shooting foul on Bradley Gobert. Nikola Ginobili to the line for 2 free throws. [Team fouls: 2] (Bradley Gobert: 1 personal fouls)   FT 1/2: MISS   FT 2/2: GOOD Nikola Ginobili makes 1/2 from the line.
Score: 65-68

[06:41] Team_006 possession (Score: 65-68)
Ja Butler attempts a 3Pt. Contested by Gary Simons (3.3 feet, MAN). JA BUTLER MAKES IT! Assist: Jayson Young
Score: 68-68

[06:26] Team_068 possession (Score: 68-68)
Nikola Ginobili drives and kicks out. FOUL! Shooting foul on Ja Butler. Jaren Johnson to the line for 2 free throws. [Team fouls: 3] (Ja Butler: 1 personal fouls)   FT 1/2: GOOD   FT 2/2: GOOD Jaren Johnson makes 2/2 from the line.
Score: 68-70

[06:13] Team_006 possession (Score: 68-70)
FOUL! Reach-in foul on Zion Anunoby during the drive. [Team fouls: 2] No free throws, side out. (Zion Anunoby: 1 personal fouls)

[05:58] Team_006 possession (Score: 68-70)
Ja Butler attempts a Layup. Contested by Gary Simons (3.3 feet, ZONE). JA BUTLER MAKES IT! Assist: Shai Westbrook
Score: 70-70

[05:44] Team_068 possession (Score: 70-70)
Zion Anunoby attempts a Midrange. Contested by Franz Wagner (5.2 feet, ZONE). Zion Anunoby misses. Rebound secured by Shai Westbrook.

[05:31] Team_006 possession (Score: 70-70)
Franz Wagner attempts a Midrange. Contested by Malcolm Herro (4.3 feet, MAN). Franz Wagner misses. Offensive rebound by Ja Butler! Ja Butler's putback is no good. Rebound secured by Nikola Ginobili.

[05:16] Team_068 possession (Score: 70-70)
FOUL! Reach-in foul on Shai Westbrook during the drive. [Team fouls: 4] No free throws, side out. (Shai Westbrook: 1 personal fouls)

[04:58] Team_068 possession (Score: 70-70)
Jaren Johnson attempts a 3Pt. Contested by Shai Westbrook (4.3 feet, ZONE). Jaren Johnson misses. Offensive rebound by Nikola Ginobili! Nikola Ginobili puts it back in!
Score: 70-72

[04:43] Team_006 possession (Score: 70-72)
Shai Westbrook makes the Layup and draws the foul on Zion Anunoby! And-1! Shai Westbrook to the line for 1. [Team fouls: 3] (Zion Anunoby: 2 personal fouls)   FT 1/1: GOOD Shai Westbrook makes 1/1 from the line.
Score: 73-72

[04:27] Team_068 possession (Score: 73-72)
Gary Simons makes the Midrange and draws the foul on Jayson Young! And-1! Gary Simons to the line for 1. [BONUS: 5 team fouls] (Jayson Young: 1 personal fouls)   FT 1/1: GOOD Gary Simons makes 1/1 from the line.
Score: 73-75

[04:14] Team_006 possession (Score: 73-75)
FOUL! Reach-in foul on Nikola Ginobili during the drive. [Team fouls: 4] No free throws, side out. (Nikola Ginobili: 2 personal fouls)

[04:00] Team_006 possession (Score: 73-75)
Jayson Young attempts a Layup. Contested by Jaren Johnson (4.1 feet, MAN). Jayson Young misses. FOUL! Loose ball foul on Nikola Ginobili during the rebound battle. [IN THE BONUS! 5 team fouls] Ja Butler to the line for 2 free throws. (Nikola Ginobili: 3 personal fouls)   FT 1/2: GOOD   FT 2/2: MISS Ja Butler makes 1/2 from the line. Rebound secured by Jaren Johnson.
Score: 74-75

[03:48] Team_068 possession (Score: 74-75)
Jaren Johnson attempts a Layup. Contested by Jayson Young (5.1 feet, MAN). JAREN JOHNSON MAKES IT! Assist: Zion Anunoby
Score: 74-77

[03:37] Team_006 possession (Score: 74-77)
FOUL! Shooting foul on Jaren Johnson. Jayson Young to the line for 3 free throws. [BONUS: 6 team fouls] (Jaren Johnson: 1 personal fouls)   FT 1/3: GOOD   FT 2/3: MISS   FT 3/3: GOOD Jayson Young makes 2/3 from the line.
Score: 76-77

[03:25] Team_068 possession (Score: 76-77)
Gary Simons drives to the basket... FOUL! Offensive foul on Gary Simons! Ja Butler drew the charge! [Team fouls: 7] (Gary Simons: 1 personal fouls) TURNOVER! (dead ball)

[03:09] Team_006 possession (Score: 76-77)
Franz Wagner attempts a Midrange. Contested by Malcolm Herro (4.5 feet, MAN). Franz Wagner misses. Rebound secured by Jaren Johnson.

[02:56] Team_068 possession (Score: 76-77)
FOUL! Holding foul on Bradley Gobert. [IN THE BONUS! 6 team fouls] Nikola Ginobili to the line for 2 free throws. (Bradley Gobert: 2 personal fouls)   FT 1/2: GOOD   FT 2/2: GOOD Nikola Ginobili makes 2/2 from the line.
Score: 76-79

[02:44] Team_006 possession (Score: 76-79)
Jayson Young attempts a Midrange. Contested by Gary Simons (3.9 feet, ZONE). Jayson Young misses. Rebound secured by Jaren Johnson.

[02:30] Team_068 possession (Score: 76-79)
Zion Anunoby attempts a 3Pt. Contested by Shai Westbrook (4.5 feet, MAN). Zion Anunoby misses. Rebound secured by Bradley Gobert.

[02:19] Team_006 possession (Score: 76-79)
Franz Wagner loses control! Ball rolls out of bounds! TURNOVER! (dead ball)

[02:19] Substitution (Team_006): Shai Westbrook OUT → Miles Harris IN (stamina_rule2)

[02:19] Substitution (Team_006): Franz Wagner OUT → Lamelo Westbrook IN (stamina_rule2)

[02:19] Substitution (Team_006): Jayson Young OUT → Vince Sabonis IN (stamina_rule2)

[02:19] Substitution (Team_006): Ja Butler OUT → Cade Ball IN (stamina_rule2)

[02:19] Substitution (Team_006): Bradley Gobert OUT → Shaquille Sexton IN (stamina_rule2)

[02:19] Substitution (Team_068): Zion Anunoby OUT → Cole Anthony IN (stamina_rule2)

[02:19] Substitution (Team_068): Malcolm Herro OUT → Ja Banchero IN (stamina_rule2)

[02:19] Substitution (Team_068): Jaren Johnson OUT → Miles Murray IN (stamina_rule2)

[02:19] Substitution (Team_068): Gary Simons OUT → Jarrett Oladipo IN (stamina_rule2)

[02:19] Substitution (Team_068): Nikola Ginobili OUT → Franz Curry IN (stamina_rule2)

[02:03] Team_068 possession (Score: 76-79)
FOUL! Holding foul on Lamelo Westbrook. [IN THE BONUS! 7 team fouls] Ja Banchero to the line for 2 free throws. (Lamelo Westbrook: 1 personal fouls)   FT 1/2: GOOD   FT 2/2: GOOD Ja Banchero makes 2/2 from the line.
Score: 76-81

[01:48] Team_006 possession (Score: 76-81)
Cade Ball drives, Jarrett Oladipo stays with him. Cade Ball attempts a Layup. Contested by Jarrett Oladipo (3.8 feet, MAN). Cade Ball misses. Rebound secured by Franz Curry.

[01:30] Team_068 possession (Score: 76-81)
Cole Anthony drives, Cade Ball stays with him. Cole Anthony attempts a Dunk. Contested by Cade Ball (4.1 feet, ZONE). COLE ANTHONY MAKES IT! Assist: Ja Banchero
Score: 76-83

[01:12] Team_006 possession (Score: 76-83)
Vince Sabonis attempts a 3Pt. Contested by Ja Banchero (5.1 feet, ZONE). Vince Sabonis misses. Rebound secured by Jarrett Oladipo.

[00:58] Team_068 possession (Score: 76-83)
Franz Curry attempts a Layup. Contested by Cade Ball (4.7 feet, ZONE). FRANZ CURRY MAKES IT! Assist: Miles Murray
Score: 76-85

[00:46] Team_006 possession (Score: 76-85)
Cade Ball makes the Layup and draws the foul on Franz Curry! And-1! Cade Ball to the line for 1. [BONUS: 8 team fouls] (Franz Curry: 1 personal fouls)   FT 1/1: GOOD Cade Ball makes 1/1 from the line.
Score: 79-85

[00:33] Team_068 possession (Score: 79-85)
FOUL! Reach-in foul on Cade Ball during the drive. [IN THE BONUS! 8 team fouls] Cole Anthony to the line for 2 free throws. (Cade Ball: 1 personal fouls)   FT 1/2: GOOD   FT 2/2: GOOD Cole Anthony makes 2/2 from the line.
Score: 79-87

[00:18] Team_006 possession (Score: 79-87)
Cade Ball makes the Midrange and draws the foul on Jarrett Oladipo! And-1! Cade Ball to the line for 1. [BONUS: 9 team fouls] (Jarrett Oladipo: 1 personal fouls)   FT 1/1: GOOD Cade Ball makes 1/1 from the line.
Score: 82-87

[00:04] Team_068 possession (Score: 82-87)
Cole Anthony attempts a 3Pt. Contested by Lamelo Westbrook (3.5 feet, ZONE). Cole Anthony misses. Rebound secured by Vince Sabonis.

================================================================================
                              3RD QUARTER COMPLETE                              
================================================================================

3RD QUARTER SCORE: Team_006 25, Team_068 40

BOX SCORE:
================================================================================

Team_006
--------------------------------------------------------------------------------
Player                MIN  PTS  REB  AST  TO      FG   FG%      3P   3P%
--------------------------------------------------------------------------------
Shai Westbrook         27    9    2    2   0   4/4   100.0     0/0   0.0
Ja Butler              27    7    0    1   0   3/4    75.0     0/0   0.0
Cade Ball               9    6    0    0   0   2/3    66.7     0/0   0.0
Jayson Young           27    2    0    1   0   1/4    25.0     0/0   0.0
Bradley Gobert         27    0    1    0   0   0/3     0.0     0/0   0.0
Franz Wagner           27    0    0    1   0   0/2     0.0     0/0   0.0
Vince Sabonis           9    0    1    0   0   0/1     0.0     0/0   0.0

TEAM: FG: 10/21 (47.6%), 3PT: 2/4 (50.0%), REB: 6 (2 off, 4 def), AST: 5, TO: 2
TEAM FOULS: 8 [Team_068 in BONUS]


Team_068
--------------------------------------------------------------------------------
Player                MIN  PTS  REB  AST  TO      FG   FG%      3P   3P%
--------------------------------------------------------------------------------
Nikola Ginobili        27   10    3    1   0   5/5   100.0     0/0   0.0
Jaren Johnson          27   10    6    1   0   4/4   100.0     0/0   0.0
Malcolm Herro          27    7    0    1   0   3/4    75.0     0/0   0.0
Gary Simons            27    5    3    0   0   2/2   100.0     0/0   0.0
Cole Anthony            9    4    0    0   0   2/3    66.7     0/0   0.0
Ja Banchero             9    2    0    1   0   1/1   100.0     0/0   0.0
Franz Curry             9    2    1    0   0   1/1   100.0     0/0   0.0
Zion Anunoby           27    0    0    3   0   0/2     0.0     0/0   0.0
Jarrett Oladipo         9    0    1    0   0   0/0     0.0     0/0   0.0
Miles Murray            9    0    0    1   0   0/0     0.0     0/0   0.0

TEAM: FG: 18/22 (81.8%), 3PT: 6/9 (66.7%), REB: 12 (3 off, 9 def), AST: 8, TO: 1
TEAM FOULS: 9 [Team_006 in BONUS]

================================================================================

================================================================================
                       4TH QUARTER - Team_006 vs Team_068                       
================================================================================

[12:00] Team_006 possession (Score: 82-87)
Ja Butler drives and kicks out. Ja Butler attempts a 3Pt. Contested by Zion Anunoby (4.4 feet, ZONE). Ja Butler misses. Rebound secured by Gary Simons.

[11:42] Team_068 possession (Score: 82-87)
Zion Anunoby attempts a 3Pt. Contested by Shai Westbrook (4.2 feet, ZONE). Zion Anunoby misses. Rebound secured by Bradley Gobert.

[11:28] Team_006 possession (Score: 82-87)
FOUL! Shooting foul on Malcolm Herro. Ja Butler to the line for 2 free throws. [Team fouls: 1] (Malcolm Herro: 1 personal fouls)   FT 1/2: GOOD   FT 2/2: GOOD Ja Butler makes 2/2 from the line.
Score: 84-87

[11:16] Team_068 possession (Score: 84-87)
Nikola Ginobili drives, Bradley Gobert stays with him. Nikola Ginobili attempts a Layup. Contested by Bradley Gobert (3.0 feet, MAN). NIKOLA GINOBILI MAKES IT!
Score: 84-89

[10:57] Team_006 possession (Score: 84-89)
Ja Butler attempts a Midrange. Contested by Gary Simons (3.5 feet, MAN). JA BUTLER MAKES IT! Assist: Shai Westbrook
Score: 86-89

[10:40] Team_068 possession (Score: 86-89)
Zion Anunoby attempts a 3Pt. Contested by Shai Westbrook (4.3 feet, ZONE). Zion Anunoby misses. Offensive rebound by Nikola Ginobili! Nikola Ginobili's putback is no good. Rebound secured by Shai Westbrook.

[10:28] Team_006 possession (Score: 86-89)
FOUL! Offensive foul on Shai Westbrook! Zion Anunoby drew the charge! [Team fouls: 1] (Shai Westbrook: 1 personal fouls) TURNOVER! (dead ball)

[10:16] Team_068 possession (Score: 86-89)
Jaren Johnson attempts a 3Pt. Contested by Shai Westbrook (4.4 feet, ZONE). JAREN JOHNSON MAKES IT! Assist: Malcolm Herro
Score: 86-92

[10:03] Team_006 possession (Score: 86-92)
Bradley Gobert makes the Layup and draws the foul on Gary Simons! And-1! Bradley Gobert to the line for 1. [Team fouls: 2] (Gary Simons: 1 personal fouls)   FT 1/1: GOOD Bradley Gobert makes 1/1 from the line.
Score: 89-92

[09:49] Team_068 possession (Score: 89-92)
Nikola Ginobili attempts a Midrange. Contested by Bradley Gobert (3.2 feet, ZONE). Nikola Ginobili misses. Rebound secured by Bradley Gobert.

[09:40] Team_006 possession (Score: 89-92)
FOUL! Holding foul on Malcolm Herro. [Team fouls: 3] No free throws, side out. (Malcolm Herro: 2 personal fouls)

[09:30] Team_006 possession (Score: 89-92)
Ja Butler drives, picks up Gary Simons. Help arrives from Malcolm Herro! Ja Butler attempts a Layup. Contested by Malcolm Herro (3.7 feet, MAN). JA BUTLER MAKES IT!
Score: 91-92

[09:15] Team_068 possession (Score: 91-92)
Zion Anunoby attempts a 3Pt. Contested by Shai Westbrook (4.5 feet, MAN). Zion Anunoby misses. Offensive rebound by Nikola Ginobili! Nikola Ginobili puts it back in!
Score: 91-94

[08:58] Team_006 possession (Score: 91-94)
Franz Wagner loses the ball! Stripped by Malcolm Herro! TURNOVER! (live ball)

[08:42] Team_068 possession (Score: 91-94)
Zion Anunoby attempts a Midrange. Contested by Shai Westbrook (4.5 feet, MAN). ZION ANUNOBY MAKES IT!
Score: 91-96

[08:26] Team_006 possession (Score: 91-96)
Jayson Young attempts a 3Pt. Contested by Jaren Johnson (4.3 feet, MAN). Jayson Young misses. Rebound secured by Gary Simons.

[08:11] Team_068 possession (Score: 91-96)
Malcolm Herro attempts a 3Pt. Contested by Franz Wagner (5.2 feet, MAN). Malcolm Herro misses. Rebound secured by Shai Westbrook.

[07:55] Team_006 possession (Score: 91-96)
Bradley Gobert attempts a Midrange. Contested by Gary Simons (3.7 feet, ZONE). BRADLEY GOBERT MAKES IT!
Score: 93-96

[07:40] Team_068 possession (Score: 93-96)
Zion Anunoby attempts a 3Pt. Contested by Shai Westbrook (4.6 feet, ZONE). Zion Anunoby misses. Rebound secured by Ja Butler.

[07:28] Team_006 possession (Score: 93-96)
Ja Butler drives and kicks out. Ja Butler attempts a 3Pt. Contested by Gary Simons (3.9 feet, MAN). Ja Butler misses. Offensive rebound by Shai Westbrook! Shai Westbrook kicks it out.

[07:13] Team_006 possession (Score: 93-96)
Bradley Gobert drives to the basket... Bradley Gobert throws a bad pass out of bounds! TURNOVER! (dead ball)

[07:13] Substitution (Team_006): Shai Westbrook OUT → Miles Harris IN (stamina_rule2)

[07:13] Substitution (Team_006): Franz Wagner OUT → Lamelo Westbrook IN (stamina_rule2)

[07:13] Substitution (Team_006): Jayson Young OUT → Vince Sabonis IN (stamina_rule2)

[07:13] Substitution (Team_006): Ja Butler OUT → Cade Ball IN (stamina_rule2)

[07:13] Substitution (Team_006): Bradley Gobert OUT → Shaquille Sexton IN (stamina_rule2)

[07:13] Substitution (Team_068): Zion Anunoby OUT → Cole Anthony IN (stamina_rule2)

[07:13] Substitution (Team_068): Malcolm Herro OUT → Ja Banchero IN (stamina_rule2)

[07:13] Substitution (Team_068): Jaren Johnson OUT → Miles Murray IN (stamina_rule2)

[07:13] Substitution (Team_068): Gary Simons OUT → Jarrett Oladipo IN (stamina_rule2)

[07:13] Substitution (Team_068): Nikola Ginobili OUT → Franz Curry IN (stamina_rule2)

[06:57] Team_068 possession (Score: 93-96)
Cole Anthony attempts a 3Pt. Contested by Lamelo Westbrook (3.5 feet, ZONE). Cole Anthony misses. Rebound secured by Shaquille Sexton.

[06:47] Team_006 possession (Score: 93-96)
Cade Ball drives and kicks out. Shaquille Sexton attempts a Midrange. Contested by Franz Curry (4.3 feet, MAN). Shaquille Sexton misses. Rebound secured by Jarrett Oladipo.

[06:33] Team_068 possession (Score: 93-96)
Ja Banchero attempts a 3Pt. Contested by Lamelo Westbrook (3.7 feet, ZONE). Ja Banchero misses. Rebound secured by Vince Sabonis.

[06:18] Team_006 possession (Score: 93-96)
Vince Sabonis attempts a Midrange. Contested by Jarrett Oladipo (3.8 feet, ZONE). VINCE SABONIS MAKES IT!
Score: 95-96

[06:04] Team_068 possession (Score: 95-96)
Cole Anthony attempts a Midrange. Contested by Shaquille Sexton (5.2 feet, ZONE). Cole Anthony misses. Rebound secured by Cade Ball.

[05:46] Team_006 possession (Score: 95-96)
Lamelo Westbrook attempts a 3Pt. Contested by Jarrett Oladipo (3.9 feet, ZONE). Lamelo Westbrook misses. Rebound secured by Jarrett Oladipo.

[05:30] Team_068 possession (Score: 95-96)
Miles Murray attempts a 3Pt. Contested by Lamelo Westbrook (3.7 feet, ZONE). MILES MURRAY MAKES IT! Assist: Cole Anthony
Score: 95-99

[05:15] Team_006 possession (Score: 95-99)
FOUL! Reach-in foul on Franz Curry during the drive. [Team fouls: 4] No free throws, side out. (Franz Curry: 1 personal fouls)

[05:00] Team_006 possession (Score: 95-99)
Cade Ball attempts a Midrange. Contested by Jarrett Oladipo (3.8 feet, MAN). Cade Ball misses. Offensive rebound by Cade Ball! Cade Ball kicks it out.

[04:46] Team_006 possession (Score: 95-99)
Cade Ball attempts a Midrange. Contested by Jarrett Oladipo (3.8 feet, ZONE). CADE BALL MAKES IT!
Score: 97-99

[04:33] Team_068 possession (Score: 97-99)
Jarrett Oladipo attempts a Layup. Contested by Cade Ball (4.6 feet, ZONE). JARRETT OLADIPO MAKES IT!
Score: 97-101

[04:21] Team_006 possession (Score: 97-101)
Shaquille Sexton drives and kicks out. Lamelo Westbrook attempts a 3Pt. Contested by Ja Banchero (5.1 feet, MAN). Lamelo Westbrook misses. Rebound secured by Franz Curry.

[04:05] Team_068 possession (Score: 97-101)
Miles Murray attempts a 3Pt. Contested by Vince Sabonis (4.9 feet, MAN). Miles Murray misses. Rebound secured by Cade Ball.

[03:55] Team_006 possession (Score: 97-101)
Vince Sabonis drives, Miles Murray stays with him. Vince Sabonis attempts a Dunk. Contested by Miles Murray (3.9 feet, MAN). Vince Sabonis misses. Rebound secured by Franz Curry.

[03:37] Team_068 possession (Score: 97-101)
Miles Murray drives and kicks out. Franz Curry attempts a Midrange. Contested by Shaquille Sexton (5.3 feet, MAN). Franz Curry misses. Rebound secured by Shaquille Sexton.

[03:25] Team_006 possession (Score: 97-101)
FOUL! Reach-in foul on Miles Murray during the drive. [IN THE BONUS! 5 team fouls] Vince Sabonis to the line for 2 free throws. (Miles Murray: 1 personal fouls)   FT 1/2: GOOD   FT 2/2: GOOD Vince Sabonis makes 2/2 from the line.
Score: 99-101

[03:11] Team_068 possession (Score: 99-101)
Jarrett Oladipo drives and kicks out. Jarrett Oladipo attempts a Midrange. Contested by Cade Ball (4.2 feet, MAN). Jarrett Oladipo misses. Offensive rebound by Franz Curry! Franz Curry puts it back in!
Score: 99-103

[02:57] Team_006 possession (Score: 99-103)
Lamelo Westbrook drives and kicks out. Miles Harris attempts a 3Pt. Contested by Ja Banchero (5.1 feet, ZONE). MILES HARRIS MAKES IT! Assist: Lamelo Westbrook
Score: 102-103

[02:39] Team_068 possession (Score: 102-103)
Cole Anthony commits a violation (traveling/carry)! TURNOVER! (dead ball)

[02:24] Team_006 possession (Score: 102-103)
FOUL! Shooting foul on Franz Curry. Shaquille Sexton to the line for 2 free throws. [BONUS: 6 team fouls] (Franz Curry: 2 personal fouls)   FT 1/2: GOOD   FT 2/2: GOOD Shaquille Sexton makes 2/2 from the line.
Score: 104-103

[02:06] Team_068 possession (Score: 104-103)
Franz Curry attempts a Layup. Contested by Cade Ball (4.7 feet, ZONE). FRANZ CURRY MAKES IT!
Score: 104-105

[01:52] Team_006 possession (Score: 104-105)
Lamelo Westbrook attempts a 3Pt. Contested by Ja Banchero (5.2 feet, MAN). LAMELO WESTBROOK MAKES IT! Assist: Shaquille Sexton
Score: 107-105

[01:37] Team_068 possession (Score: 107-105)
Cole Anthony drives and kicks out. Jarrett Oladipo attempts a Midrange. Contested by Cade Ball (4.3 feet, MAN). Jarrett Oladipo misses. Rebound secured by Cade Ball.

[01:25] Team_006 possession (Score: 107-105)
Vince Sabonis attempts a 3Pt. Contested by Ja Banchero (5.1 feet, ZONE). VINCE SABONIS MAKES IT! Assist: Miles Harris
Score: 110-105

[01:07] Team_068 possession (Score: 110-105)
Jarrett Oladipo drives, Cade Ball stays with him. Jarrett Oladipo attempts a Dunk. Contested by Cade Ball (4.6 feet, ZONE). JARRETT OLADIPO MAKES IT!
Score: 110-107

[00:50] Team_006 possession (Score: 110-107)
Cade Ball drives, picks up Jarrett Oladipo. Help arrives from Ja Banchero! Cade Ball attempts a Dunk. Contested by Ja Banchero (3.8 feet, MAN). CADE BALL MAKES IT! Assist: Lamelo Westbrook
Score: 112-107

[00:41] Team_068 possession (Score: 112-107)
Franz Curry drives, picks up Cade Ball. Help arrives from Lamelo Westbrook! Franz Curry attempts a Layup. Contested by Lamelo Westbrook (4.8 feet, ZONE). Franz Curry misses. FOUL! Loose ball foul on Cade Ball during the rebound battle. [Team fouls: 2] No free throws, side out. (Cade Ball: 1 personal fouls)

[00:29] Team_068 possession (Score: 112-107)
Jarrett Oladipo attempts a Midrange. Contested by Cade Ball (4.7 feet, MAN). Jarrett Oladipo misses. Rebound secured by Vince Sabonis.

[00:13] Team_006 possession (Score: 112-107)
Lamelo Westbrook makes the Dunk and draws the foul on Miles Murray! And-1! Lamelo Westbrook to the line for 1. [BONUS: 7 team fouls] (Miles Murray: 2 personal fouls)   FT 1/1: GOOD Lamelo Westbrook makes 1/1 from the line.
Score: 115-107

================================================================================
                              4TH QUARTER COMPLETE                              
================================================================================

4TH QUARTER SCORE: Team_006 33, Team_068 20

BOX SCORE:
================================================================================

Team_006
--------------------------------------------------------------------------------
Player                MIN  PTS  REB  AST  TO      FG   FG%      3P   3P%
--------------------------------------------------------------------------------
Vince Sabonis          16    7    2    0   0   3/4    75.0     0/0   0.0
Ja Butler              32    6    1    0   0   3/4    75.0     0/0   0.0
Lamelo Westbrook       16    6    0    2   0   2/3    66.7     0/0   0.0
Bradley Gobert         32    5    2    0   0   2/2   100.0     0/0   0.0
Cade Ball              16    4    4    0   0   2/3    66.7     0/0   0.0
Miles Harris           16    3    0    1   0   1/1   100.0     0/0   0.0
Shaquille Sexton       16    2    2    1   0   1/2    50.0     0/0   0.0
Shai Westbrook         32    0    3    1   0   0/0     0.0     0/0   0.0
Jayson Young           32    0    0    0   0   0/1     0.0     0/0   0.0

TEAM: FG: 14/20 (70.0%), 3PT: 2/4 (50.0%), REB: 13 (2 off, 11 def), AST: 5, TO: 3
TEAM FOULS: 2


Team_068
--------------------------------------------------------------------------------
Player                MIN  PTS  REB  AST  TO      FG   FG%      3P   3P%
--------------------------------------------------------------------------------
Nikola Ginobili        32    4    1    0   0   2/3    66.7     0/0   0.0
Jarrett Oladipo        16    4    3    0   0   2/3    66.7     0/0   0.0
Franz Curry            16    4    3    0   0   2/2   100.0     0/0   0.0
Jaren Johnson          32    3    0    0   0   1/1   100.0     0/0   0.0
Miles Murray           16    3    0    0   0   1/3    33.3     0/0   0.0
Zion Anunoby           32    2    0    0   0   1/4    25.0     0/0   0.0
Gary Simons            32    0    2    0   0   0/0     0.0     0/0   0.0
Malcolm Herro          32    0    0    1   0   0/1     0.0     0/0   0.0
Cole Anthony           16    0    0    1   0   0/3     0.0     0/0   0.0
Ja Banchero            16    0    0    0   0   0/1     0.0     0/0   0.0

TEAM: FG: 9/21 (42.9%), 3PT: 3/10 (30.0%), REB: 10 (4 off, 6 def), AST: 2, TO: 1
TEAM FOULS: 7 [Team_006 in BONUS]

================================================================================

================================================================================
                               FULL GAME COMPLETE                               
================================================================================

FINAL SCORE: Team_006 115, Team_068 107

SCORING BY QUARTER:
--------------------------------------------------------------------------------
Team                     Q1     Q2     Q3     Q4    FINAL
--------------------------------------------------------------------------------
Team_006                 30     27     25     33      115
Team_068                 28     19     40     20      107
--------------------------------------------------------------------------------

FULL GAME BOX SCORE:
================================================================================

Team_006
--------------------------------------------------------------------------------
Player                MIN  PTS  REB  AST  TO      FG   FG%      3P   3P%      FT STL BLK
--------------------------------------------------------------------------------
Shai Westbrook         32   11    7    8   2   4/8    50.0   0/1     0.0   1/1     0   1
Franz Wagner           32    2    0    3   3   1/4    25.0   0/0     0.0   1/2     2   0
Jayson Young           32   16    0    1   0   7/12   58.3   3/6    50.0   2/3     0   0
Ja Butler              32   24    9    5   0  12/20   60.0   1/4    25.0   6/7     0   1
Bradley Gobert         32   16    7    4   1   7/10   70.0   0/0     0.0   1/1     0   0
Miles Harris           16    7    0    2   0   2/3    66.7   1/1   100.0   1/2     0   0
Lamelo Westbrook       16    8    0    2   0   4/7    57.1   1/2    50.0   1/1     0   1
Vince Sabonis          16    9    5    0   0   4/7    57.1   1/2    50.0   2/2     0   0
Cade Ball              16   10    6    1   0   4/7    57.1   0/0     0.0   3/4     0   1
Shaquille Sexton       16    9    7    3   0   4/5    80.0   0/0     0.0   5/5     0   0

TEAM: FG: 49/83 (59.0%), 3PT: 7/16 (43.8%), REB: 41 (7 off, 34 def), AST: 29, TO: 6


Team_068
--------------------------------------------------------------------------------
Player                MIN  PTS  REB  AST  TO      FG   FG%      3P   3P%      FT STL BLK
--------------------------------------------------------------------------------
Zion Anunoby           32   12    0    4   0   6/13   46.2   3/8    37.5   3/3     0   0
Malcolm Herro          32   15    0    5   4   6/10   60.0   2/6    33.3   1/1     1   0
Jaren Johnson          32   13   14    1   0   5/10   50.0   4/8    50.0   2/2     0   0
Gary Simons            32   13   10    1   0   6/8    75.0   0/0     0.0   1/1     0   1
Nikola Ginobili        32   24    8    2   0   8/11   72.7   1/2    50.0   5/6     0   0
Cole Anthony           16    6    0    1   1   3/8    37.5   0/2     0.0   2/2     0   0
Ja Banchero            16    4    1    1   1   1/4    25.0   0/2     0.0   2/2     0   0
Miles Murray           16    5    0    1   0   2/6    33.3   1/3    33.3   0/0     0   0
Jarrett Oladipo        16    6    5    2   0   5/7    71.4   0/0     0.0   2/2     0   0
Franz Curry            16    8    8    0   0   2/3    66.7   0/0     0.0   1/2     0   0

TEAM: FG: 46/82 (56.1%), 3PT: 11/31 (35.5%), REB: 46 (15 off, 31 def), AST: 18, TO: 6

================================================================================
