================================================================================
                        FULL GAME - Team_070 vs Team_051                        
================================================================================

================================================================================
                       1ST QUARTER - Team_070 vs Team_051                       
================================================================================

[12:00] Team_070 possession (Score: 0-0)
Khris Bryant throws a bad pass out of bounds! TURNOVER! (dead ball)

[11:47] Team_051 possession (Score: 0-0)
FOUL! Shooting foul on Khris Bryant. Austin Sexton to the line for 2 free throws. [Team fouls: 1] (Khris Bryant: 1 personal fouls)   FT 1/2: GOOD   FT 2/2: MISS Austin Sexton makes 1/2 from the line. Offensive rebound by Franz Simmons! Franz Simmons kicks it out.
Score: 0-1

[11:32] Team_051 possession (Score: 0-1)
Shaquille Harden attempts a Midrange. Contested by Cole Gasol (5.2 feet, ZONE). Shaquille Harden misses. Offensive rebound by Franz Simmons! Franz Simmons kicks it out.

[11:19] Team_051 possession (Score: 0-1)
FOUL! Shooting foul on Khris Bryant. Franz Simmons to the line for 2 free throws. [Team fouls: 2] (Khris Bryant: 2 personal fouls)   FT 1/2: GOOD   FT 2/2: GOOD Franz Simmons makes 2/2 from the line.
Score: 0-3

[11:00] Team_070 possession (Score: 0-3)
John Hyland attempts a 3Pt. Contested by Austin Sexton (4.3 feet, ZONE). John Hyland misses. Offensive rebound by Khris Bryant! Khris Bryant puts it back in!
Score: 2-3

[10:43] Team_051 possession (Score: 2-3)
Austin Sexton attempts a Midrange. Contested by Cole Gasol (5.3 feet, MAN). Austin Sexton misses. FOUL! Loose ball foul on Jabari Paul during the rebound battle. [Team fouls: 3] No free throws, side out. (Jabari Paul: 1 personal fouls)

[10:27] Team_051 possession (Score: 2-3)
OG Siakam drives, Khris Bryant stays with him. OG Siakam attempts a Dunk. Contested by Khris Bryant (2.7 feet, ZONE). OG Siakam misses. Offensive rebound by Franz Simmons! Franz Simmons kicks it out.

[10:15] Team_051 possession (Score: 2-3)
FOUL! Reach-in foul on Khris Bryant during the drive. [Team fouls: 4] No free throws, side out. (Khris Bryant: 3 personal fouls)

[10:01] Team_051 possession (Score: 2-3)
Franz Simmons drives and kicks out. OG Siakam attempts a 3Pt. Contested by Khris Bryant (2.4 feet, ZONE). OG SIAKAM MAKES IT! Assist: Larry McGrady
Score: 2-6

[09:48] Team_070 possession (Score: 2-6)
LeBron Barnes drives to the basket... FOUL! Offensive foul on LeBron Barnes! Shaquille Harden drew the charge! [Team fouls: 5] (LeBron Barnes: 1 personal fouls) TURNOVER! (dead ball)

[09:35] Team_051 possession (Score: 2-6)
Shaquille Harden attempts a Layup. Contested by Khris Bryant (2.4 feet, ZONE). Shaquille Harden misses. Rebound secured by LeBron Barnes.

[09:19] Team_070 possession (Score: 2-6)
John Hyland attempts a Midrange. Contested by OG Siakam (3.8 feet, MAN). John Hyland misses. Rebound secured by Shaquille Harden.

[09:03] Team_051 possession (Score: 2-6)
Austin Sexton attempts a 3Pt. Contested by Cole Gasol (5.3 feet, MAN). Austin Sexton misses. Rebound secured by Khris Bryant.

[08:48] Team_070 possession (Score: 2-6)
FOUL! Holding foul on Shaquille Harden. [Team fouls: 1] No free throws, side out. (Shaquille Harden: 1 personal fouls)

[08:36] Team_070 possession (Score: 2-6)
Jabari Paul attempts a Layup. Contested by Shaquille Harden (4.9 feet, MAN). JABARI PAUL MAKES IT! Assist: Cole Gasol
Score: 4-6

[08:18] Team_051 possession (Score: 4-6)
FOUL! Holding foul on Khris Bryant. [IN THE BONUS! 6 team fouls] Franz Simmons to the line for 2 free throws. (Khris Bryant: 4 personal fouls)   FT 1/2: GOOD   FT 2/2: GOOD Franz Simmons makes 2/2 from the line.
Score: 4-8

[08:03] Team_070 possession (Score: 4-8)
Khris Bryant makes the Layup and draws the foul on Larry McGrady! And-1! Khris Bryant to the line for 1. [Team fouls: 2] (Larry McGrady: 1 personal fouls)   FT 1/1: GOOD Khris Bryant makes 1/1 from the line.
Score: 7-8

[07:48] Team_051 possession (Score: 7-8)
OG Siakam attempts a Layup. Contested by John Hyland (4.8 feet, MAN). OG SIAKAM MAKES IT!
Score: 7-10

[07:30] Team_070 possession (Score: 7-10)
LeBron Barnes attempts a Layup. Contested by Larry McGrady (4.9 feet, MAN). LEBRON BARNES MAKES IT! Assist: John Hyland
Score: 9-10

[07:16] Team_051 possession (Score: 9-10)
OG Siakam drives and kicks out. FOUL! Shooting foul on LeBron Barnes. Larry McGrady to the line for 2 free throws. [BONUS: 7 team fouls] (LeBron Barnes: 2 personal fouls)   FT 1/2: GOOD   FT 2/2: GOOD Larry McGrady makes 2/2 from the line.
Score: 9-12

[07:02] Team_070 possession (Score: 9-12)
Jabari Paul attempts a 3Pt. Contested by Shaquille Harden (4.9 feet, MAN). Jabari Paul misses. Offensive rebound by Khris Bryant! Khris Bryant's putback is no good. Rebound secured by OG Siakam.

[06:47] Team_051 possession (Score: 9-12)
Larry McGrady drives and kicks out. Austin Sexton makes the Midrange and draws the foul on LeBron Barnes! And-1! Austin Sexton to the line for 1. [BONUS: 8 team fouls] (LeBron Barnes: 3 personal fouls)   FT 1/1: GOOD Austin Sexton makes 1/1 from the line.
Score: 9-15

[06:31] Team_070 possession (Score: 9-15)
Jabari Paul drives to the basket... Jabari Paul throws a bad pass! Stolen by Shaquille Harden! TURNOVER! (live ball)

[06:21] Team_051 possession (Score: 9-15)
Austin Sexton attempts a 3Pt. Contested by Khris Bryant (2.4 feet, ZONE). Austin Sexton misses. Rebound secured by LeBron Barnes.

[06:05] Team_070 possession (Score: 9-15)
Cole Gasol drives, Franz Simmons stays with him. Cole Gasol attempts a Dunk. Contested by Franz Simmons (4.4 feet, ZONE). COLE GASOL MAKES IT! Assist: John Hyland
Score: 11-15

[05:55] Team_051 possession (Score: 11-15)
Austin Sexton attempts a 3Pt. Contested by Khris Bryant (2.4 feet, ZONE). AUSTIN SEXTON MAKES IT! Assist: Shaquille Harden
Score: 11-18

[05:39] Team_070 possession (Score: 11-18)
Khris Bryant attempts a 3Pt. Contested by Franz Simmons (4.1 feet, MAN). Khris Bryant misses. Rebound secured by Shaquille Harden.

[05:24] Team_051 possession (Score: 11-18)
FOUL! Shooting foul on Khris Bryant. Franz Simmons to the line for 2 free throws. [BONUS: 9 team fouls] (Khris Bryant: 5 personal fouls)   FT 1/2: GOOD   FT 2/2: GOOD Franz Simmons makes 2/2 from the line.
Score: 11-20

[05:07] Team_070 possession (Score: 11-20)
Jabari Paul drives and kicks out. John Hyland attempts a 3Pt. Contested by OG Siakam (3.9 feet, MAN). John Hyland misses. Rebound secured by Franz Simmons.

[04:54] Team_051 possession (Score: 11-20)
Larry McGrady attempts a 3Pt. Contested by Khris Bryant (2.8 feet, ZONE). Larry McGrady misses. Rebound secured by LeBron Barnes.

[04:38] Team_070 possession (Score: 11-20)
LeBron Barnes attempts a Midrange. Contested by Larry McGrady (5.0 feet, ZONE). LeBron Barnes misses. Rebound secured by Franz Simmons.

[04:25] Team_051 possession (Score: 11-20)
Austin Sexton makes the Layup and draws the foul on Cole Gasol! And-1! Austin Sexton to the line for 1. [BONUS: 10 team fouls] (Cole Gasol: 1 personal fouls)   FT 1/1: GOOD Austin Sexton makes 1/1 from the line.
Score: 11-23

[04:09] Team_070 possession (Score: 11-23)
Cole Gasol attempts a Midrange. Contested by Franz Simmons (4.4 feet, ZONE). Cole Gasol misses. Rebound secured by Franz Simmons.

[03:55] Team_051 possession (Score: 11-23)
Franz Simmons attempts a Midrange. Contested by Khris Bryant (3.0 feet, MAN). FRANZ SIMMONS MAKES IT! Assist: OG Siakam
Score: 11-25

[03:41] Team_070 possession (Score: 11-25)
FOUL! Shooting foul on Larry McGrady. Khris Bryant to the line for 2 free throws. [Team fouls: 3] (Larry McGrady: 2 personal fouls)   FT 1/2: GOOD   FT 2/2: GOOD Khris Bryant makes 2/2 from the line.
Score: 13-25

[03:25] Team_051 possession (Score: 13-25)
OG Siakam drives, picks up John Hyland. Help arrives from LeBron Barnes! OG Siakam attempts a Layup. Contested by LeBron Barnes (4.9 feet, MAN). OG Siakam misses. Offensive rebound by Shaquille Harden! Shaquille Harden puts it back in!
Score: 13-27

[03:13] Team_070 possession (Score: 13-27)
FOUL! Reach-in foul on Franz Simmons during the drive. [Team fouls: 4] No free throws, side out. (Franz Simmons: 1 personal fouls)

[02:57] Team_070 possession (Score: 13-27)
Cole Gasol attempts a Midrange. Contested by Franz Simmons (4.5 feet, ZONE). COLE GASOL MAKES IT! Assist: Khris Bryant
Score: 15-27

[02:42] Team_051 possession (Score: 15-27)
Larry McGrady throws a bad pass out of bounds! TURNOVER! (dead ball)

[02:42] Substitution (Team_051): Larry McGrady OUT → Zion Morant IN (stamina_rule2)

[02:42] Substitution (Team_051): OG Siakam OUT → Jrue Carter IN (stamina_rule2)

[02:26] Team_070 possession (Score: 15-27)
LeBron Barnes makes the Layup and draws the foul on Zion Morant! And-1! LeBron Barnes to the line for 1. [BONUS: 5 team fouls] (Zion Morant: 1 personal fouls)   FT 1/1: GOOD LeBron Barnes makes 1/1 from the line.
Score: 18-27

[02:15] Team_051 possession (Score: 18-27)
Zion Morant attempts a 3Pt. Contested by LeBron Barnes (4.1 feet, MAN). ZION MORANT MAKES IT! Assist: Shaquille Harden
Score: 18-30

[02:00] Team_070 possession (Score: 18-30)
Cole Gasol drives, Franz Simmons stays with him. Cole Gasol attempts a Layup. Contested by Franz Simmons (4.6 feet, ZONE). COLE GASOL MAKES IT!
Score: 20-30

[01:46] Team_051 possession (Score: 20-30)
FOUL! Shooting foul on LeBron Barnes. Jrue Carter to the line for 2 free throws. [BONUS: 11 team fouls] (LeBron Barnes: 4 personal fouls)   FT 1/2: GOOD   FT 2/2: GOOD Jrue Carter makes 2/2 from the line.
Score: 20-32

[01:32] Team_070 possession (Score: 20-32)
Cole Gasol attempts a Midrange. Contested by Jrue Carter (4.8 feet, ZONE). COLE GASOL MAKES IT!
Score: 22-32

[01:13] Team_051 possession (Score: 22-32)
Franz Simmons throws a bad pass! Stolen by Khris Bryant! TURNOVER! (live ball)

[00:58] Team_070 possession (Score: 22-32)
Khris Bryant attempts a 3Pt. Contested by Franz Simmons (4.4 feet, MAN). Khris Bryant misses. Rebound secured by Jrue Carter.

[00:42] Team_051 possession (Score: 22-32)
Shaquille Harden attempts a 3Pt. Contested by Khris Bryant (2.9 feet, ZONE). Shaquille Harden misses. Offensive rebound by Franz Simmons! Franz Simmons kicks it out.

[00:30] Team_051 possession (Score: 22-32)
Austin Sexton attempts a 3Pt. Contested by Cole Gasol (5.6 feet, MAN). Austin Sexton misses. Rebound secured by LeBron Barnes.

[00:15] Team_070 possession (Score: 22-32)
FOUL! Reach-in foul on Zion Morant during the drive. [IN THE BONUS! 6 team fouls] LeBron Barnes to the line for 2 free throws. (Zion Morant: 2 personal fouls)   FT 1/2: MISS   FT 2/2: GOOD LeBron Barnes makes 1/2 from the line.
Score: 23-32

[00:02] Team_051 possession (Score: 23-32)
Jrue Carter attempts a Midrange. Contested by John Hyland (5.3 feet, MAN). Jrue Carter misses. Rebound secured by Khris Bryant.

================================================================================
                              1ST QUARTER COMPLETE                              
================================================================================

1ST QUARTER SCORE: Team_070 23, Team_051 32

BOX SCORE:
================================================================================

Team_070
--------------------------------------------------------------------------------
Player                MIN  PTS  REB  AST  TO      FG   FG%      3P   3P%
--------------------------------------------------------------------------------
Cole Gasol             12    8    0    1   0   4/5    80.0     0/0   0.0
Khris Bryant           12    7    3    1   0   3/5    60.0     0/0   0.0
LeBron Barnes          12    6    4    0   0   3/4    75.0     0/0   0.0
Jabari Paul            12    2    0    0   0   1/3    33.3     0/0   0.0
John Hyland            12    0    0    2   0   0/1     0.0     0/0   0.0

TEAM: FG: 11/18 (61.1%), 3PT: 1/4 (25.0%), REB: 8 (2 off, 6 def), AST: 4, TO: 3
TEAM FOULS: 11 [Team_051 in BONUS]


Team_051
--------------------------------------------------------------------------------
Player                MIN  PTS  REB  AST  TO      FG   FG%      3P   3P%
--------------------------------------------------------------------------------
Austin Sexton          12    9    0    0   0   3/6    50.0     0/0   0.0
Franz Simmons          12    8    8    0   0   4/4   100.0     0/0   0.0
OG Siakam              10    5    1    1   0   2/2   100.0     0/0   0.0
Zion Morant             3    3    0    0   0   1/1   100.0     0/0   0.0
Larry McGrady          10    2    0    1   0   1/2    50.0     0/0   0.0
Shaquille Harden       12    2    3    2   0   1/2    50.0     0/0   0.0
Jrue Carter             3    2    1    0   0   1/2    50.0     0/0   0.0

TEAM: FG: 13/19 (68.4%), 3PT: 2/6 (33.3%), REB: 12 (6 off, 6 def), AST: 4, TO: 2
TEAM FOULS: 6 [Team_070 in BONUS]

================================================================================

================================================================================
                       2ND QUARTER - Team_070 vs Team_051                       
================================================================================

[12:00] Team_070 possession (Score: 23-32)
John Hyland attempts a 3Pt. Contested by Franz Simmons (4.4 feet, ZONE). John Hyland misses. Rebound secured by OG Siakam.

[11:45] Team_051 possession (Score: 23-32)
Shaquille Harden makes the Midrange and draws the foul on Khris Bryant! And-1! Shaquille Harden to the line for 1. [Team fouls: 1] (Khris Bryant: 1 personal fouls)   FT 1/1: GOOD Shaquille Harden makes 1/1 from the line.
Score: 23-35

[11:29] Team_070 possession (Score: 23-35)
Jabari Paul drives, Franz Simmons stays with him. Jabari Paul attempts a Layup. Contested by Franz Simmons (5.2 feet, ZONE). Jabari Paul misses. Rebound secured by Shaquille Harden.

[11:15] Team_051 possession (Score: 23-35)
Larry McGrady attempts a Midrange. Contested by LeBron Barnes (4.3 feet, ZONE). LARRY MCGRADY MAKES IT! Assist: OG Siakam
Score: 23-37

[10:56] Team_070 possession (Score: 23-37)
FOUL! Shooting foul on OG Siakam. Cole Gasol to the line for 2 free throws. [Team fouls: 1] (OG Siakam: 1 personal fouls)   FT 1/2: GOOD   FT 2/2: MISS Cole Gasol makes 1/2 from the line. Offensive rebound by Khris Bryant! Khris Bryant's putback is no good.
Score: 24-37

[10:40] Team_051 possession (Score: 24-37)
Franz Simmons attempts a 3Pt. Contested by Khris Bryant (3.4 feet, ZONE). Franz Simmons misses. Rebound secured by Jabari Paul.

[10:27] Team_070 possession (Score: 24-37)
Cole Gasol drives and kicks out. John Hyland attempts a Midrange. Contested by OG Siakam (4.0 feet, MAN). John Hyland misses. Rebound secured by OG Siakam.

[10:15] Team_051 possession (Score: 24-37)
Franz Simmons drives, picks up Khris Bryant. Help arrives from LeBron Barnes! Franz Simmons attempts a Dunk. Contested by LeBron Barnes (3.5 feet, ZONE). Franz Simmons misses. Rebound secured by Jabari Paul.

[10:03] Team_070 possession (Score: 24-37)
Khris Bryant attempts a Midrange. Contested by OG Siakam (3.8 feet, ZONE). KHRIS BRYANT MAKES IT! Assist: John Hyland
Score: 26-37

[09:50] Team_051 possession (Score: 26-37)
Franz Simmons attempts a Layup. Contested by Khris Bryant (3.5 feet, ZONE). FRANZ SIMMONS MAKES IT! Assist: OG Siakam
Score: 26-39

[09:37] Team_070 possession (Score: 26-39)
Cole Gasol attempts a 3Pt. Contested by Austin Sexton (5.0 feet, ZONE). Cole Gasol misses. Rebound secured by Shaquille Harden.

[09:20] Team_051 possession (Score: 26-39)
Larry McGrady attempts a 3Pt. Contested by LeBron Barnes (4.5 feet, MAN). LARRY MCGRADY MAKES IT! Assist: OG Siakam
Score: 26-42

[09:04] Team_070 possession (Score: 26-42)
John Hyland attempts a 3Pt. Contested by OG Siakam (4.0 feet, MAN). John Hyland misses. Rebound secured by Franz Simmons.

[08:48] Team_051 possession (Score: 26-42)
Austin Sexton attempts a 3Pt. Contested by Khris Bryant (3.3 feet, ZONE). AUSTIN SEXTON MAKES IT! Assist: Franz Simmons
Score: 26-45

[08:35] Team_070 possession (Score: 26-45)
LeBron Barnes drives and kicks out. Jabari Paul attempts a 3Pt. Contested by Austin Sexton (5.0 feet, ZONE). Jabari Paul misses. Rebound secured by Shaquille Harden.

[08:18] Team_051 possession (Score: 26-45)
FOUL! Shooting foul on Jabari Paul. Shaquille Harden to the line for 2 free throws. [Team fouls: 2] (Jabari Paul: 1 personal fouls)   FT 1/2: MISS   FT 2/2: GOOD Shaquille Harden makes 1/2 from the line.
Score: 26-46

[08:05] Team_070 possession (Score: 26-46)
John Hyland drives and kicks out. LeBron Barnes attempts a 3Pt. Contested by Austin Sexton (5.1 feet, ZONE). LeBron Barnes misses. Rebound secured by Franz Simmons.

[07:51] Team_051 possession (Score: 26-46)
OG Siakam drives to the basket... OG Siakam loses control! Ball rolls out of bounds! TURNOVER! (dead ball)

[07:51] Substitution (Team_070): Cole Gasol OUT → Paul Quickley IN (stamina_rule2)

[07:51] Substitution (Team_070): LeBron Barnes OUT → Allen Quickley IN (stamina_rule2)

[07:51] Substitution (Team_070): John Hyland OUT → D'Angelo McGrady IN (stamina_rule2)

[07:51] Substitution (Team_070): Khris Bryant OUT → Luka Gobert IN (stamina_rule2)

[07:51] Substitution (Team_070): Jabari Paul OUT → Russell Morant IN (stamina_rule2)

[07:51] Substitution (Team_051): Austin Sexton OUT → Myles Harden IN (stamina_rule2)

[07:51] Substitution (Team_051): Larry McGrady OUT → Zion Morant IN (stamina_rule2)

[07:51] Substitution (Team_051): OG Siakam OUT → Jrue Carter IN (stamina_rule2)

[07:51] Substitution (Team_051): Franz Simmons OUT → Tobias Jokic IN (stamina_rule2)

[07:51] Substitution (Team_051): Shaquille Harden OUT → Pau Tatum IN (stamina_rule2)

[07:36] Team_070 possession (Score: 26-46)
Luka Gobert drives and kicks out. D'Angelo McGrady makes the Midrange and draws the foul on Jrue Carter! And-1! D'Angelo McGrady to the line for 1. [Team fouls: 2] (Jrue Carter: 1 personal fouls)   FT 1/1: GOOD D'Angelo McGrady makes 1/1 from the line.
Score: 29-46

[07:21] Team_051 possession (Score: 29-46)
FOUL! Reach-in foul on Russell Morant during the drive. [Team fouls: 3] No free throws, side out. (Russell Morant: 1 personal fouls)

[07:02] Team_051 possession (Score: 29-46)
Jrue Carter drives, Russell Morant stays with him. Jrue Carter attempts a Dunk. Contested by Russell Morant (4.0 feet, ZONE). JRUE CARTER MAKES IT! Assist: Pau Tatum
Score: 29-48

[06:47] Team_070 possession (Score: 29-48)
Paul Quickley throws a bad pass out of bounds! TURNOVER! (dead ball)

[06:30] Team_051 possession (Score: 29-48)
Zion Morant drives and kicks out. Tobias Jokic attempts a 3Pt. Contested by Luka Gobert (4.8 feet, MAN). Tobias Jokic misses. Rebound secured by Russell Morant.

[06:17] Team_070 possession (Score: 29-48)
FOUL! Holding foul on Myles Harden. [Team fouls: 3] No free throws, side out. (Myles Harden: 1 personal fouls)

[06:06] Team_070 possession (Score: 29-48)
Russell Morant drives to the basket... Russell Morant throws a bad pass out of bounds! TURNOVER! (dead ball)

[05:52] Team_051 possession (Score: 29-48)
Myles Harden attempts a Layup. Contested by Paul Quickley (4.1 feet, MAN). MYLES HARDEN MAKES IT! Assist: Tobias Jokic
Score: 29-50

[05:37] Team_070 possession (Score: 29-50)
Paul Quickley attempts a 3Pt. Contested by Myles Harden (4.5 feet, MAN). Paul Quickley misses. Rebound secured by Myles Harden.

[05:24] Team_051 possession (Score: 29-50)
Myles Harden attempts a 3Pt. Contested by Paul Quickley (4.1 feet, ZONE). Myles Harden misses. Rebound secured by Luka Gobert.

[05:08] Team_070 possession (Score: 29-50)
D'Angelo McGrady attempts a 3Pt. Contested by Myles Harden (4.6 feet, ZONE). D'Angelo McGrady misses. Rebound secured by Tobias Jokic.

[04:53] Team_051 possession (Score: 29-50)
Jrue Carter attempts a 3Pt. Contested by Paul Quickley (4.6 feet, ZONE). JRUE CARTER MAKES IT! Assist: Tobias Jokic
Score: 29-53

[04:41] Team_070 possession (Score: 29-53)
Allen Quickley attempts a 3Pt. Contested by Myles Harden (4.6 feet, ZONE). ALLEN QUICKLEY MAKES IT! Assist: D'Angelo McGrady
Score: 32-53

[04:26] Team_051 possession (Score: 32-53)
Myles Harden attempts a 3Pt. Contested by Paul Quickley (4.1 feet, ZONE). MYLES HARDEN MAKES IT!
Score: 32-56

[04:10] Team_070 possession (Score: 32-56)
Paul Quickley attempts a 3Pt. Contested by Myles Harden (4.5 feet, ZONE). Paul Quickley misses. Offensive rebound by Russell Morant! Russell Morant's putback is no good. Rebound secured by Pau Tatum.

[03:54] Team_051 possession (Score: 32-56)
Jrue Carter drives, Russell Morant stays with him. Jrue Carter attempts a Layup. Contested by Russell Morant (4.0 feet, ZONE). Jrue Carter misses. Offensive rebound by Pau Tatum! Pau Tatum puts it back in!
Score: 32-58

[03:44] Team_070 possession (Score: 32-58)
Paul Quickley attempts a 3Pt. Contested by Myles Harden (4.5 feet, ZONE). Paul Quickley misses. Rebound secured by Pau Tatum.

[03:32] Team_051 possession (Score: 32-58)
Myles Harden attempts a Midrange. Contested by Allen Quickley (5.0 feet, ZONE). Myles Harden misses. Rebound secured by Russell Morant.

[03:20] Team_070 possession (Score: 32-58)
Russell Morant attempts a Midrange. Contested by Pau Tatum (4.4 feet, MAN). RUSSELL MORANT MAKES IT! Assist: Luka Gobert
Score: 34-58

[03:04] Team_051 possession (Score: 34-58)
Zion Morant attempts a 3Pt. Contested by D'Angelo McGrady (5.9 feet, ZONE). ZION MORANT MAKES IT! Assist: Jrue Carter
Score: 34-61

[02:46] Team_070 possession (Score: 34-61)
FOUL! Reach-in foul on Pau Tatum during the drive. [Team fouls: 4] No free throws, side out. (Pau Tatum: 1 personal fouls)

[02:31] Team_070 possession (Score: 34-61)
Allen Quickley attempts a Layup. BLOCKED BY ZION MORANT! Ball is loose! Rebound secured by Tobias Jokic.

[02:14] Team_051 possession (Score: 34-61)
Zion Morant drives and kicks out. Jrue Carter attempts a Midrange. Contested by Allen Quickley (5.2 feet, ZONE). JRUE CARTER MAKES IT! Assist: Tobias Jokic
Score: 34-63

[01:55] Team_070 possession (Score: 34-63)
FOUL! Shooting foul on Jrue Carter. D'Angelo McGrady to the line for 2 free throws. [BONUS: 5 team fouls] (Jrue Carter: 2 personal fouls)   FT 1/2: GOOD   FT 2/2: GOOD D'Angelo McGrady makes 2/2 from the line.
Score: 36-63

[01:44] Team_051 possession (Score: 36-63)
Tobias Jokic makes the Midrange and draws the foul on Luka Gobert! And-1! Tobias Jokic to the line for 1. [Team fouls: 4] (Luka Gobert: 1 personal fouls)   FT 1/1: GOOD Tobias Jokic makes 1/1 from the line.
Score: 36-66

[01:30] Team_070 possession (Score: 36-66)
D'Angelo McGrady drives, Jrue Carter stays with him. D'Angelo McGrady attempts a Layup. Contested by Jrue Carter (4.8 feet, MAN). D'Angelo McGrady misses. Rebound secured by Myles Harden.

[01:18] Team_051 possession (Score: 36-66)
Zion Morant attempts a 3Pt. Contested by Paul Quickley (4.6 feet, ZONE). Zion Morant misses. Rebound secured by D'Angelo McGrady.

[01:04] Team_070 possession (Score: 36-66)
Luka Gobert drives, Pau Tatum stays with him. Luka Gobert attempts a Dunk. Contested by Pau Tatum (4.4 feet, ZONE). LUKA GOBERT MAKES IT! Assist: Allen Quickley
Score: 38-66

[00:46] Team_051 possession (Score: 38-66)
Pau Tatum attempts a 3Pt. Contested by Russell Morant (3.6 feet, MAN). Pau Tatum misses. Offensive rebound by Pau Tatum! Pau Tatum puts it back in!
Score: 38-68

[00:28] Team_070 possession (Score: 38-68)
Paul Quickley attempts a 3Pt. Contested by Myles Harden (4.5 feet, ZONE). Paul Quickley misses. Rebound secured by Myles Harden.

[00:13] Team_051 possession (Score: 38-68)
Tobias Jokic attempts a 3Pt. Contested by Paul Quickley (4.6 feet, ZONE). Tobias Jokic misses. Offensive rebound by Pau Tatum! Pau Tatum puts it back in!
Score: 38-70

================================================================================
                              2ND QUARTER COMPLETE                              
================================================================================

2ND QUARTER SCORE: Team_070 15, Team_051 38

BOX SCORE:
================================================================================

Team_070
--------------------------------------------------------------------------------
Player                MIN  PTS  REB  AST  TO      FG   FG%      3P   3P%
--------------------------------------------------------------------------------
D'Angelo McGrady        8    5    1    1   0   2/4    50.0     0/0   0.0
Allen Quickley          8    3    0    1   0   1/2    50.0     0/0   0.0
Khris Bryant           17    2    1    0   0   1/1   100.0     0/0   0.0
Russell Morant          8    2    2    0   0   1/1   100.0     0/0   0.0
Luka Gobert             8    2    1    1   0   1/1   100.0     0/0   0.0
John Hyland            17    0    0    1   0   0/3     0.0     0/0   0.0
Jabari Paul            17    0    2    0   0   0/1     0.0     0/0   0.0
Cole Gasol             17    0    0    0   0   0/3     0.0     0/0   0.0
LeBron Barnes          17    0    0    0   0   0/1     0.0     0/0   0.0
Paul Quickley           8    0    0    0   0   0/4     0.0     0/0   0.0

TEAM: FG: 6/21 (28.6%), 3PT: 1/9 (11.1%), REB: 7 (1 off, 6 def), AST: 4, TO: 2
TEAM FOULS: 4


Team_051
--------------------------------------------------------------------------------
Player                MIN  PTS  REB  AST  TO      FG   FG%      3P   3P%
--------------------------------------------------------------------------------
Jrue Carter            10    7    0    1   0   3/3   100.0     0/0   0.0
Pau Tatum               8    6    5    1   0   3/3   100.0     0/0   0.0
Larry McGrady          14    5    0    0   0   2/2   100.0     0/0   0.0
Myles Harden            8    5    3    0   0   2/4    50.0     0/0   0.0
Shaquille Harden       17    4    3    0   0   2/2   100.0     0/0   0.0
Austin Sexton          17    3    0    0   0   1/1   100.0     0/0   0.0
Zion Morant            10    3    0    0   0   1/3    33.3     0/0   0.0
Tobias Jokic            8    3    2    3   0   1/1   100.0     0/0   0.0
Franz Simmons          17    2    2    1   0   1/3    33.3     0/0   0.0
OG Siakam              14    0    2    3   0   0/0     0.0     0/0   0.0

TEAM: FG: 16/22 (72.7%), 3PT: 7/10 (70.0%), REB: 17 (3 off, 14 def), AST: 9, TO: 1
TEAM FOULS: 5 [Team_070 in BONUS]

================================================================================

================================================================================
                       3RD QUARTER - Team_070 vs Team_051                       
================================================================================

[12:00] Team_070 possession (Score: 38-70)
LeBron Barnes makes the Layup and draws the foul on Franz Simmons! And-1! LeBron Barnes to the line for 1. [Team fouls: 1] (Franz Simmons: 1 personal fouls)   FT 1/1: GOOD LeBron Barnes makes 1/1 from the line.
Score: 41-70

[11:44] Team_051 possession (Score: 41-70)
OG Siakam commits a violation (traveling/carry)! TURNOVER! (dead ball)

[11:31] Team_070 possession (Score: 41-70)
John Hyland attempts a Midrange. Contested by Franz Simmons (4.1 feet, ZONE). John Hyland misses. Offensive rebound by Khris Bryant! Khris Bryant's putback is no good. Rebound secured by OG Siakam.

[11:14] Team_051 possession (Score: 41-70)
FOUL! Reach-in foul on Khris Bryant during the drive. [Team fouls: 1] No free throws, side out. (Khris Bryant: 1 personal fouls)

[11:00] Team_051 possession (Score: 41-70)
OG Siakam drives and kicks out. FOUL! Shooting foul on Khris Bryant. Larry McGrady to the line for 3 free throws. [Team fouls: 2] (Khris Bryant: 2 personal fouls)   FT 1/3: GOOD   FT 2/3: GOOD   FT 3/3: GOOD Larry McGrady makes 3/3 from the line.
Score: 41-73

[10:44] Team_070 possession (Score: 41-73)
Khris Bryant attempts a Midrange. BLOCKED BY FRANZ SIMMONS! Ball is loose! Rebound secured by OG Siakam.

[10:27] Team_051 possession (Score: 41-73)
Franz Simmons makes the Dunk and draws the foul on Khris Bryant! And-1! Franz Simmons to the line for 1. [Team fouls: 3] (Khris Bryant: 3 personal fouls)   FT 1/1: GOOD Franz Simmons makes 1/1 from the line.
Score: 41-76

[10:15] Team_070 possession (Score: 41-76)
Jabari Paul attempts a Layup. Contested by Shaquille Harden (4.9 feet, MAN). JABARI PAUL MAKES IT! Assist: John Hyland
Score: 43-76

[10:01] Team_051 possession (Score: 43-76)
Austin Sexton attempts a 3Pt. Contested by Khris Bryant (2.4 feet, ZONE). Austin Sexton misses. Rebound secured by LeBron Barnes.

[09:46] Team_070 possession (Score: 43-76)
Jabari Paul makes the Dunk and draws the foul on Franz Simmons! And-1! Jabari Paul to the line for 1. [Team fouls: 2] (Franz Simmons: 2 personal fouls)   FT 1/1: GOOD Jabari Paul makes 1/1 from the line.
Score: 46-76

[09:33] Team_051 possession (Score: 46-76)
Franz Simmons drives and kicks out. Shaquille Harden attempts a 3Pt. Contested by Khris Bryant (2.4 feet, MAN). Shaquille Harden misses. Rebound secured by Khris Bryant.

[09:17] Team_070 possession (Score: 46-76)
John Hyland attempts a Layup. Contested by OG Siakam (3.8 feet, MAN). John Hyland misses. Rebound secured by OG Siakam.

[09:03] Team_051 possession (Score: 46-76)
Larry McGrady drives, LeBron Barnes stays with him. Larry McGrady attempts a Dunk. Contested by LeBron Barnes (3.8 feet, MAN). Larry McGrady misses. Rebound secured by LeBron Barnes.

[08:45] Team_070 possession (Score: 46-76)
Jabari Paul attempts a 3Pt. Contested by Franz Simmons (4.9 feet, ZONE). Jabari Paul misses. FOUL! Loose ball foul on Shaquille Harden during the rebound battle. [Team fouls: 3] No free throws, side out. (Shaquille Harden: 1 personal fouls)

[08:32] Team_070 possession (Score: 46-76)
Cole Gasol drives, Austin Sexton stays with him. Cole Gasol attempts a Layup. Contested by Austin Sexton (4.6 feet, MAN). Cole Gasol misses. Offensive rebound by LeBron Barnes! LeBron Barnes kicks it out.

[08:15] Team_070 possession (Score: 46-76)
FOUL! Reach-in foul on OG Siakam during the drive. [Team fouls: 4] No free throws, side out. (OG Siakam: 1 personal fouls)

[08:03] Team_070 possession (Score: 46-76)
John Hyland attempts a 3Pt. Contested by Austin Sexton (4.3 feet, ZONE). John Hyland misses. Rebound secured by Franz Simmons.

[07:48] Team_051 possession (Score: 46-76)
OG Siakam drives and kicks out. Austin Sexton attempts a 3Pt. Contested by Cole Gasol (5.3 feet, MAN). Austin Sexton misses. Rebound secured by Khris Bryant.

[07:33] Team_070 possession (Score: 46-76)
Cole Gasol attempts a 3Pt. Contested by Austin Sexton (4.6 feet, ZONE). Cole Gasol misses. Rebound secured by Franz Simmons.

[07:22] Team_051 possession (Score: 46-76)
Shaquille Harden loses control! Ball rolls out of bounds! TURNOVER! (dead ball)

[07:11] Team_070 possession (Score: 46-76)
LeBron Barnes attempts a Midrange. Contested by Larry McGrady (4.9 feet, MAN). LEBRON BARNES MAKES IT! Assist: John Hyland
Score: 48-76

[06:58] Team_051 possession (Score: 48-76)
Larry McGrady attempts a Midrange. Contested by LeBron Barnes (3.8 feet, MAN). Larry McGrady misses. Rebound secured by Jabari Paul.

[06:43] Team_070 possession (Score: 48-76)
Khris Bryant attempts a Midrange. Contested by Larry McGrady (4.3 feet, ZONE). KHRIS BRYANT MAKES IT!
Score: 50-76

[06:27] Team_051 possession (Score: 50-76)
OG Siakam makes the Layup and draws the foul on Khris Bryant! And-1! OG Siakam to the line for 1. [Team fouls: 4] (Khris Bryant: 4 personal fouls)   FT 1/1: GOOD OG Siakam makes 1/1 from the line.
Score: 50-79

[06:11] Team_070 possession (Score: 50-79)
Jabari Paul attempts a Layup. Contested by Franz Simmons (4.9 feet, ZONE). JABARI PAUL MAKES IT!
Score: 52-79

[05:54] Team_051 possession (Score: 52-79)
Shaquille Harden attempts a Layup. Contested by Khris Bryant (2.4 feet, ZONE). SHAQUILLE HARDEN MAKES IT! Assist: Franz Simmons
Score: 52-81

[05:43] Team_070 possession (Score: 52-81)
Cole Gasol throws a bad pass out of bounds! TURNOVER! (dead ball)

[05:29] Team_051 possession (Score: 52-81)
Austin Sexton attempts a Midrange. Contested by LeBron Barnes (3.6 feet, ZONE). Austin Sexton misses. Rebound secured by Khris Bryant.

[05:09] Team_070 possession (Score: 52-81)
Khris Bryant drives, picks up Franz Simmons. Help arrives from Larry McGrady! Khris Bryant attempts a Layup. Contested by Larry McGrady (4.1 feet, ZONE). KHRIS BRYANT MAKES IT! Assist: Cole Gasol
Score: 54-81

[05:00] Team_051 possession (Score: 54-81)
Franz Simmons drives, Khris Bryant stays with him. Franz Simmons attempts a Dunk. Contested by Khris Bryant (2.9 feet, ZONE). FRANZ SIMMONS MAKES IT! Assist: OG Siakam
Score: 54-83

[04:45] Team_070 possession (Score: 54-83)
Cole Gasol throws a bad pass out of bounds! TURNOVER! (dead ball)

[04:28] Team_051 possession (Score: 54-83)
Austin Sexton attempts a 3Pt. Contested by LeBron Barnes (3.6 feet, ZONE). Austin Sexton misses. Rebound secured by Khris Bryant.

[04:11] Team_070 possession (Score: 54-83)
Cole Gasol attempts a 3Pt. Contested by Austin Sexton (4.6 feet, MAN). COLE GASOL MAKES IT! Assist: Jabari Paul
Score: 57-83

[03:54] Team_051 possession (Score: 57-83)
Shaquille Harden attempts a Layup. Contested by Khris Bryant (2.5 feet, ZONE). SHAQUILLE HARDEN MAKES IT! Assist: Austin Sexton
Score: 57-85

[03:36] Team_070 possession (Score: 57-85)
Cole Gasol attempts a Midrange. Contested by Shaquille Harden (4.5 feet, ZONE). COLE GASOL MAKES IT! Assist: John Hyland
Score: 59-85

[03:26] Team_051 possession (Score: 59-85)
Franz Simmons attempts a 3Pt. Contested by Khris Bryant (3.1 feet, ZONE). Franz Simmons misses. Rebound secured by Khris Bryant.

[03:16] Team_070 possession (Score: 59-85)
Cole Gasol attempts a 3Pt. Contested by Austin Sexton (4.7 feet, MAN). COLE GASOL MAKES IT! Assist: John Hyland
Score: 62-85

[02:59] Team_051 possession (Score: 62-85)
Shaquille Harden drives and kicks out. Larry McGrady attempts a Midrange. Contested by John Hyland (4.7 feet, ZONE). Larry McGrady misses. Offensive rebound by Shaquille Harden! Shaquille Harden puts it back in!
Score: 62-87

[02:44] Team_070 possession (Score: 62-87)
Khris Bryant attempts a Midrange. Contested by OG Siakam (4.0 feet, ZONE). KHRIS BRYANT MAKES IT! Assist: Cole Gasol
Score: 64-87

[02:28] Team_051 possession (Score: 64-87)
Franz Simmons drives, Jabari Paul stays with him. Franz Simmons attempts a Dunk. Contested by Jabari Paul (5.1 feet, ZONE). Franz Simmons misses. Offensive rebound by Franz Simmons! Franz Simmons kicks it out.

[02:17] Team_051 possession (Score: 64-87)
Larry McGrady throws a bad pass! Stolen by LeBron Barnes! TURNOVER! (live ball)

[02:04] Team_070 possession (Score: 64-87)
Jabari Paul drives, Shaquille Harden stays with him. Jabari Paul attempts a Layup. Contested by Shaquille Harden (5.2 feet, MAN). JABARI PAUL MAKES IT! Assist: Cole Gasol
Score: 66-87

[01:47] Team_051 possession (Score: 66-87)
OG Siakam attempts a 3Pt. Contested by Khris Bryant (3.1 feet, ZONE). OG Siakam misses. Rebound secured by Khris Bryant.

[01:34] Team_070 possession (Score: 66-87)
Khris Bryant attempts a Midrange. Contested by Franz Simmons (4.4 feet, MAN). Khris Bryant misses. Rebound secured by Franz Simmons.

[01:20] Team_051 possession (Score: 66-87)
Austin Sexton drives, picks up Cole Gasol. Help arrives from LeBron Barnes! Austin Sexton attempts a Dunk. Contested by LeBron Barnes (5.5 feet, MAN). AUSTIN SEXTON MAKES IT! Assist: OG Siakam
Score: 66-89

[01:02] Team_070 possession (Score: 66-89)
Khris Bryant drives, picks up Franz Simmons. Help arrives from Austin Sexton! Khris Bryant attempts a Layup. Contested by Austin Sexton (4.4 feet, ZONE). KHRIS BRYANT MAKES IT!
Score: 68-89

[00:45] Team_051 possession (Score: 68-89)
Franz Simmons makes the Dunk and draws the foul on LeBron Barnes! And-1! Franz Simmons to the line for 1. [BONUS: 5 team fouls] (LeBron Barnes: 1 personal fouls)   FT 1/1: GOOD Franz Simmons makes 1/1 from the line.
Score: 68-92

[00:29] Team_070 possession (Score: 68-92)
LeBron Barnes drives to the basket... FOUL! Offensive foul on LeBron Barnes! Franz Simmons drew the charge! [Team fouls: 6] (LeBron Barnes: 2 personal fouls) TURNOVER! (dead ball)

[00:14] Team_051 possession (Score: 68-92)
Austin Sexton attempts a 3Pt. Contested by Cole Gasol (5.6 feet, MAN). AUSTIN SEXTON MAKES IT! Assist: Franz Simmons
Score: 68-95

================================================================================
                              3RD QUARTER COMPLETE                              
================================================================================

3RD QUARTER SCORE: Team_070 30, Team_051 25

BOX SCORE:
================================================================================

Team_070
--------------------------------------------------------------------------------
Player                MIN  PTS  REB  AST  TO      FG   FG%      3P   3P%
--------------------------------------------------------------------------------
Jabari Paul            29    9    1    1   0   4/4   100.0     0/0   0.0
Khris Bryant           29    8    6    0   0   4/6    66.7     0/0   0.0
Cole Gasol             29    8    0    3   0   3/4    75.0     0/0   0.0
LeBron Barnes          29    5    4    0   0   2/2   100.0     0/0   0.0
John Hyland            29    0    0    4   0   0/3     0.0     0/0   0.0

TEAM: FG: 13/19 (68.4%), 3PT: 2/4 (50.0%), REB: 12 (3 off, 9 def), AST: 8, TO: 3
TEAM FOULS: 6 [Team_051 in BONUS]


Team_051
--------------------------------------------------------------------------------
Player                MIN  PTS  REB  AST  TO      FG   FG%      3P   3P%
--------------------------------------------------------------------------------
Franz Simmons          29    8    4    2   0   3/5    60.0     0/0   0.0
Shaquille Harden       29    6    1    0   0   3/3   100.0     0/0   0.0
Austin Sexton          29    5    0    1   0   2/5    40.0     0/0   0.0
OG Siakam              26    3    3    2   0   1/3    33.3     0/0   0.0
Larry McGrady          26    3    0    0   0   1/3    33.3     0/0   0.0

TEAM: FG: 10/19 (52.6%), 3PT: 1/5 (20.0%), REB: 7 (2 off, 5 def), AST: 5, TO: 3
TEAM FOULS: 4

================================================================================

================================================================================
                       4TH QUARTER - Team_070 vs Team_051                       
================================================================================

[12:00] Substitution (Team_070): Cole Gasol OUT (stamina: 71) → Paul Quickley IN (comeback_detected)

[12:00] Substitution (Team_051): Austin Sexton OUT (stamina: 72) → Myles Harden IN (comeback_detected)

[12:00] Team_070 possession (Score: 68-95)
Jabari Paul attempts a Midrange. Contested by Shaquille Harden (5.2 feet, MAN). Jabari Paul misses. Rebound secured by Shaquille Harden.

[11:45] Team_051 possession (Score: 68-95)
FOUL! Reach-in foul on Khris Bryant during the drive. [Team fouls: 1] No free throws, side out. (Khris Bryant: 1 personal fouls)

[11:31] Team_051 possession (Score: 68-95)
Shaquille Harden loses control! Ball rolls out of bounds! TURNOVER! (dead ball)

[11:31] Substitution (Team_070): LeBron Barnes OUT → Allen Quickley IN (stamina_rule2)

[11:31] Substitution (Team_070): John Hyland OUT → D'Angelo McGrady IN (stamina_rule2)

[11:31] Substitution (Team_070): Khris Bryant OUT → Luka Gobert IN (stamina_rule2)

[11:31] Substitution (Team_070): Jabari Paul OUT → Russell Morant IN (stamina_rule2)

[11:31] Substitution (Team_051): Larry McGrady OUT → Zion Morant IN (stamina_rule2)

[11:31] Substitution (Team_051): OG Siakam OUT → Jrue Carter IN (stamina_rule2)

[11:31] Substitution (Team_051): Franz Simmons OUT → Tobias Jokic IN (stamina_rule2)

[11:31] Substitution (Team_051): Shaquille Harden OUT → Pau Tatum IN (stamina_rule2)

[11:19] Team_070 possession (Score: 68-95)
Russell Morant drives to the basket... FOUL! Offensive foul on Russell Morant! Pau Tatum drew the charge! [Team fouls: 2] (Russell Morant: 1 personal fouls) TURNOVER! (dead ball)

[11:02] Team_051 possession (Score: 68-95)
Pau Tatum drives to the basket... FOUL! Offensive foul on Pau Tatum! Russell Morant drew the charge! [Team fouls: 1] (Pau Tatum: 1 personal fouls) TURNOVER! (dead ball)

[10:44] Team_070 possession (Score: 68-95)
FOUL! Shooting foul on Zion Morant. Allen Quickley to the line for 3 free throws. [Team fouls: 2] (Zion Morant: 1 personal fouls)   FT 1/3: MISS   FT 2/3: GOOD   FT 3/3: GOOD Allen Quickley makes 2/3 from the line.
Score: 70-95

[10:26] Team_051 possession (Score: 70-95)
Zion Morant attempts a 3Pt. Contested by Allen Quickley (5.5 feet, MAN). ZION MORANT MAKES IT!
Score: 70-98

[10:11] Team_070 possession (Score: 70-98)
Luka Gobert attempts a 3Pt. Contested by Tobias Jokic (5.3 feet, MAN). Luka Gobert misses. Rebound secured by Tobias Jokic.

[09:54] Team_051 possession (Score: 70-98)
Jrue Carter attempts a 3Pt. Contested by Paul Quickley (4.6 feet, ZONE). JRUE CARTER MAKES IT! Assist: Pau Tatum
Score: 70-101

[09:38] Team_070 possession (Score: 70-101)
Paul Quickley attempts a 3Pt. Contested by Myles Harden (4.5 feet, ZONE). PAUL QUICKLEY MAKES IT! Assist: D'Angelo McGrady
Score: 73-101

[09:19] Team_051 possession (Score: 73-101)
Jrue Carter throws a bad pass out of bounds! TURNOVER! (dead ball)

[09:07] Team_070 possession (Score: 73-101)
Luka Gobert drives, picks up Tobias Jokic. Help arrives from Myles Harden! Luka Gobert attempts a Layup. Contested by Myles Harden (5.3 feet, MAN). LUKA GOBERT MAKES IT! Assist: D'Angelo McGrady
Score: 75-101

[08:55] Team_051 possession (Score: 75-101)
Myles Harden attempts a 3Pt. Contested by Paul Quickley (4.1 feet, ZONE). MYLES HARDEN MAKES IT! Assist: Jrue Carter
Score: 75-104

[08:44] Team_070 possession (Score: 75-104)
Paul Quickley throws a bad pass out of bounds! TURNOVER! (dead ball)

[08:32] Team_051 possession (Score: 75-104)
Myles Harden drives, Russell Morant stays with him. Myles Harden attempts a Layup. Contested by Russell Morant (3.5 feet, ZONE). MYLES HARDEN MAKES IT!
Score: 75-106

[08:16] Team_070 possession (Score: 75-106)
Luka Gobert attempts a 3Pt. Contested by Tobias Jokic (5.3 feet, MAN). Luka Gobert misses. Rebound secured by Myles Harden.

[08:05] Team_051 possession (Score: 75-106)
Myles Harden attempts a 3Pt. Contested by Paul Quickley (4.1 feet, MAN). Myles Harden misses. Rebound secured by Luka Gobert.

[07:51] Team_070 possession (Score: 75-106)
Paul Quickley attempts a Midrange. Contested by Myles Harden (4.5 feet, MAN). Paul Quickley misses. FOUL! Loose ball foul on Tobias Jokic during the rebound battle. [Team fouls: 3] No free throws, side out. (Tobias Jokic: 1 personal fouls)

[07:40] Team_070 possession (Score: 75-106)
Luka Gobert attempts a Midrange. Contested by Tobias Jokic (5.3 feet, MAN). LUKA GOBERT MAKES IT! Assist: Allen Quickley
Score: 77-106

[07:24] Team_051 possession (Score: 77-106)
FOUL! Holding foul on Russell Morant. [Team fouls: 3] No free throws, side out. (Russell Morant: 2 personal fouls)

[07:11] Team_051 possession (Score: 77-106)
Pau Tatum attempts a Midrange. Contested by D'Angelo McGrady (5.5 feet, ZONE). Pau Tatum misses. Rebound secured by D'Angelo McGrady.

[06:53] Team_070 possession (Score: 77-106)
Luka Gobert attempts a Midrange. Contested by Tobias Jokic (5.3 feet, MAN). LUKA GOBERT MAKES IT! Assist: Allen Quickley
Score: 79-106

[06:42] Team_051 possession (Score: 79-106)
Pau Tatum drives and kicks out. Tobias Jokic attempts a 3Pt. Contested by Paul Quickley (4.3 feet, ZONE). Tobias Jokic misses. Rebound secured by Luka Gobert.

[06:30] Team_070 possession (Score: 79-106)
Luka Gobert attempts a Midrange. Contested by Myles Harden (4.7 feet, ZONE). Luka Gobert misses. Rebound secured by Pau Tatum.

[06:15] Team_051 possession (Score: 79-106)
FOUL! Holding foul on D'Angelo McGrady. [Team fouls: 4] No free throws, side out. (D'Angelo McGrady: 1 personal fouls)

[06:05] Team_051 possession (Score: 79-106)
Jrue Carter attempts a 3Pt. Contested by D'Angelo McGrady (5.9 feet, MAN). Jrue Carter misses. Offensive rebound by Tobias Jokic! Tobias Jokic kicks it out.

[05:53] Team_051 possession (Score: 79-106)
Pau Tatum makes the Layup and draws the foul on Paul Quickley! And-1! Pau Tatum to the line for 1. [BONUS: 5 team fouls] (Paul Quickley: 1 personal fouls)   FT 1/1: GOOD Pau Tatum makes 1/1 from the line.
Score: 79-109

[05:39] Team_070 possession (Score: 79-109)
Russell Morant throws a bad pass out of bounds! TURNOVER! (dead ball)

[05:22] Team_051 possession (Score: 79-109)
Zion Morant attempts a 3Pt. Contested by Paul Quickley (4.6 feet, ZONE). Zion Morant misses. Rebound secured by Luka Gobert.

[05:04] Team_070 possession (Score: 79-109)
FOUL! Shooting foul on Myles Harden. Luka Gobert to the line for 3 free throws. [Team fouls: 4] (Myles Harden: 1 personal fouls)   FT 1/3: GOOD   FT 2/3: GOOD   FT 3/3: GOOD Luka Gobert makes 3/3 from the line.
Score: 82-109

[04:51] Team_051 possession (Score: 82-109)
Jrue Carter attempts a 3Pt. Contested by Paul Quickley (4.7 feet, ZONE). Jrue Carter misses. Rebound secured by Luka Gobert.

[04:39] Team_070 possession (Score: 82-109)
Allen Quickley attempts a Midrange. Contested by Jrue Carter (4.7 feet, ZONE). ALLEN QUICKLEY MAKES IT! Assist: Luka Gobert
Score: 84-109

[04:24] Team_051 possession (Score: 84-109)
Zion Morant attempts a Midrange. Contested by Allen Quickley (5.5 feet, MAN). Zion Morant misses. Rebound secured by Luka Gobert.

[04:07] Team_070 possession (Score: 84-109)
Paul Quickley drives, Tobias Jokic stays with him. Paul Quickley attempts a Dunk. Contested by Tobias Jokic (5.2 feet, ZONE). PAUL QUICKLEY MAKES IT! Assist: Allen Quickley
Score: 86-109

[03:54] Team_051 possession (Score: 86-109)
FOUL! Holding foul on Paul Quickley. [IN THE BONUS! 6 team fouls] Myles Harden to the line for 2 free throws. (Paul Quickley: 2 personal fouls)   FT 1/2: GOOD   FT 2/2: GOOD Myles Harden makes 2/2 from the line.
Score: 86-111

[03:40] Team_070 possession (Score: 86-111)
Russell Morant throws a bad pass out of bounds! TURNOVER! (dead ball)

[03:24] Team_051 possession (Score: 86-111)
Pau Tatum drives, Russell Morant stays with him. Pau Tatum attempts a Dunk. Contested by Russell Morant (3.7 feet, ZONE). Pau Tatum misses. Rebound secured by D'Angelo McGrady.

[03:08] Team_070 possession (Score: 86-111)
FOUL! Shooting foul on Pau Tatum. Russell Morant to the line for 2 free throws. [BONUS: 5 team fouls] (Pau Tatum: 2 personal fouls)   FT 1/2: GOOD   FT 2/2: MISS Russell Morant makes 1/2 from the line. Rebound secured by Pau Tatum.
Score: 87-111

[02:52] Team_051 possession (Score: 87-111)
FOUL! Shooting foul on Luka Gobert. Jrue Carter to the line for 3 free throws. [BONUS: 7 team fouls] (Luka Gobert: 1 personal fouls)   FT 1/3: GOOD   FT 2/3: GOOD   FT 3/3: GOOD Jrue Carter makes 3/3 from the line.
Score: 87-114

[02:38] Team_070 possession (Score: 87-114)
Allen Quickley drives to the basket... Allen Quickley loses control! Ball rolls out of bounds! TURNOVER! (dead ball)

[02:27] Team_051 possession (Score: 87-114)
Tobias Jokic attempts a Layup. BLOCKED BY RUSSELL MORANT! Ball deflects out of bounds off Tobias Jokic.

[02:09] Team_070 possession (Score: 87-114)
D'Angelo McGrady drives, Pau Tatum stays with him. D'Angelo McGrady attempts a Layup. Contested by Pau Tatum (4.5 feet, ZONE). D'Angelo McGrady misses. Rebound secured by Pau Tatum.

[01:55] Team_051 possession (Score: 87-114)
Myles Harden makes the Layup and draws the foul on Paul Quickley! And-1! Myles Harden to the line for 1. [BONUS: 8 team fouls] (Paul Quickley: 3 personal fouls)   FT 1/1: GOOD Myles Harden makes 1/1 from the line.
Score: 87-117

[01:39] Team_070 possession (Score: 87-117)
Russell Morant drives, Pau Tatum stays with him. Russell Morant attempts a Layup. Contested by Pau Tatum (4.7 feet, MAN). RUSSELL MORANT MAKES IT!
Score: 89-117

[01:26] Team_051 possession (Score: 89-117)
Jrue Carter attempts a 3Pt. Wide open! D'Angelo McGrady is 6.1 feet away. [MAN] JRUE CARTER MAKES IT! Assist: Zion Morant
Score: 89-120

[01:13] Team_070 possession (Score: 89-120)
FOUL! Reach-in foul on Zion Morant during the drive. [IN THE BONUS! 6 team fouls] Allen Quickley to the line for 2 free throws. (Zion Morant: 2 personal fouls)   FT 1/2: GOOD   FT 2/2: GOOD Allen Quickley makes 2/2 from the line.
Score: 91-120

[00:57] Team_051 possession (Score: 91-120)
FOUL! Shooting foul on Allen Quickley. Zion Morant to the line for 2 free throws. [BONUS: 9 team fouls] (Allen Quickley: 1 personal fouls)   FT 1/2: GOOD   FT 2/2: MISS Zion Morant makes 1/2 from the line. Rebound secured by Luka Gobert.
Score: 91-121

[00:45] Team_070 possession (Score: 91-121)
Russell Morant drives and kicks out. Paul Quickley attempts a Midrange. Contested by Pau Tatum (4.7 feet, ZONE). Paul Quickley misses. Rebound secured by Pau Tatum.

[00:33] Team_051 possession (Score: 91-121)
Myles Harden attempts a 3Pt. Contested by Paul Quickley (4.6 feet, MAN). MYLES HARDEN MAKES IT!
Score: 91-124

[00:14] Team_070 possession (Score: 91-124)
Russell Morant attempts a Layup. Contested by Pau Tatum (4.8 feet, MAN). RUSSELL MORANT MAKES IT! Assist: Paul Quickley
Score: 93-124

================================================================================
                              4TH QUARTER COMPLETE                              
================================================================================

4TH QUARTER SCORE: Team_070 25, Team_051 29

BOX SCORE:
================================================================================

Team_070
--------------------------------------------------------------------------------
Player                MIN  PTS  REB  AST  TO      FG   FG%      3P   3P%
--------------------------------------------------------------------------------
Luka Gobert            19    9    6    1   0   4/7    57.1     0/0   0.0
Allen Quickley         19    6    0    3   0   3/3   100.0     0/0   0.0
Paul Quickley          20    5    0    1   0   2/2   100.0     0/0   0.0
Russell Morant         19    4    1    0   0   2/4    50.0     0/0   0.0
Jabari Paul            29    0    0    0   0   0/1     0.0     0/0   0.0
D'Angelo McGrady       19    0    2    2   0   0/1     0.0     0/0   0.0

TEAM: FG: 11/18 (61.1%), 3PT: 3/5 (60.0%), REB: 9 (1 off, 8 def), AST: 7, TO: 5
TEAM FOULS: 9 [Team_051 in BONUS]


Team_051
--------------------------------------------------------------------------------
Player                MIN  PTS  REB  AST  TO      FG   FG%      3P   3P%
--------------------------------------------------------------------------------
Myles Harden           20   13    1    0   0   5/6    83.3     0/0   0.0
Jrue Carter            22    9    0    1   0   3/4    75.0     0/0   0.0
Zion Morant            22    3    0    1   0   1/4    25.0     0/0   0.0
Pau Tatum              19    3    4    1   0   1/4    25.0     0/0   0.0
Shaquille Harden       29    0    1    0   0   0/0     0.0     0/0   0.0
Tobias Jokic           19    0    2    0   0   0/1     0.0     0/0   0.0

TEAM: FG: 10/19 (52.6%), 3PT: 6/9 (66.7%), REB: 8 (1 off, 7 def), AST: 3, TO: 3
TEAM FOULS: 6 [Team_070 in BONUS]

================================================================================

================================================================================
                               FULL GAME COMPLETE                               
================================================================================

FINAL SCORE: Team_070 93, Team_051 124

SCORING BY QUARTER:
--------------------------------------------------------------------------------
Team                     Q1     Q2     Q3     Q4    FINAL
--------------------------------------------------------------------------------
Team_070                 23     15     30     25       93
Team_051                 32     38     25     29      124
--------------------------------------------------------------------------------

FULL GAME BOX SCORE:
================================================================================

Team_070
--------------------------------------------------------------------------------
Player                MIN  PTS  REB  AST  TO      FG   FG%      3P   3P%      FT STL BLK
--------------------------------------------------------------------------------
LeBron Barnes          29   11    8    0   0   5/7    71.4   0/0     0.0   3/4     1   0
John Hyland            29    0    0    7   1   1/8    12.5   1/4    25.0   0/0     0   0
Khris Bryant           29   17   10    1   3   7/11   63.6   0/2     0.0   3/3     1   0
Jabari Paul            29   11    3    1   0   5/9    55.6   0/1     0.0   1/1     0   0
Cole Gasol             29   16    0    4   2   7/12   58.3   2/4    50.0   1/2     0   0
Paul Quickley          20    5    0    1   2   2/6    33.3   1/5    20.0   0/0     0   0
Allen Quickley         19    9    0    4   0   4/5    80.0   2/2   100.0   4/5     0   0
D'Angelo McGrady       19    5    3    3   0   1/4    25.0   0/1     0.0   3/3     0   0
Luka Gobert            19   11    7    2   1   6/9    66.7   1/3    33.3   3/3     0   0
Russell Morant         19    6    3    0   4   3/5    60.0   0/0     0.0   1/2     0   1

TEAM: FG: 41/76 (53.9%), 3PT: 7/22 (31.8%), REB: 36 (7 off, 29 def), AST: 23, TO: 13


Team_051
--------------------------------------------------------------------------------
Player                MIN  PTS  REB  AST  TO      FG   FG%      3P   3P%      FT STL BLK
--------------------------------------------------------------------------------
Franz Simmons          29   18   14    3   1   8/12   66.7   0/2     0.0   8/8     0   1
Shaquille Harden       29   12    8    2   2   5/6    83.3   0/0     0.0   2/3     1   0
Austin Sexton          29   17    0    1   0   5/11   45.5   3/8    37.5   3/4     0   0
Larry McGrady          27   10    0    1   2   3/6    50.0   1/2    50.0   5/5     0   0
OG Siakam              27    8    6    6   2   5/7    71.4   0/1     0.0   1/1     0   0
Zion Morant            22    9    0    1   0   4/9    44.4   3/5    60.0   1/2     0   1
Jrue Carter            22   18    1    2   2   7/9    77.8   4/5    80.0   5/5     0   0
Myles Harden           20   18    4    0   0   6/9    66.7   3/5    60.0   3/3     0   0
Tobias Jokic           19    3    4    3   0   2/3    66.7   1/1   100.0   1/1     0   0
Pau Tatum              19    9    9    2   0   2/5    40.0   1/1   100.0   1/1     0   0

TEAM: FG: 49/79 (62.0%), 3PT: 16/30 (53.3%), REB: 44 (12 off, 32 def), AST: 21, TO: 9

================================================================================
