================================================================================
                        FULL GAME - Team_097 vs Team_087                        
================================================================================

================================================================================
                       1ST QUARTER - Team_097 vs Team_087                       
================================================================================

[12:00] Team_097 possession (Score: 0-0)
Tyrese Stewart attempts a Midrange. Contested by Jimmy Ming (5.7 feet, ZONE). Tyrese Stewart misses. FOUL! Loose ball foul on Devin Anunoby during the rebound battle. [Team fouls: 1] No free throws, side out. (Devin Anunoby: 1 personal fouls)

[11:47] Team_097 possession (Score: 0-0)
Tyrese Stewart attempts a Layup. BLOCKED BY MALCOLM EMBIID! Ball is loose! Rebound secured by Devin Anunoby.

[11:37] Team_087 possession (Score: 0-0)
Devin Anunoby attempts a 3Pt. Contested by Shai Poole (3.6 feet, ZONE). Devin Anunoby misses. Rebound secured by Tyrese Stewart.

[11:22] Team_097 possession (Score: 0-0)
FOUL! Reach-in foul on Malcolm Embiid during the drive. [Team fouls: 2] No free throws, side out. (Malcolm Embiid: 1 personal fouls)

[11:07] Team_097 possession (Score: 0-0)
Shai Poole attempts a Midrange. Contested by Devin Anunoby (4.9 feet, MAN). SHAI POOLE MAKES IT!
Score: 2-0

[10:52] Team_087 possession (Score: 2-0)
Allen Mitchell attempts a 3Pt. Contested by Evan Brogdon (5.1 feet, MAN). Allen Mitchell misses. Rebound secured by Anthony Haliburton.

[10:41] Team_097 possession (Score: 2-0)
Evan Brogdon attempts a Layup. Contested by Allen Mitchell (5.5 feet, MAN). Evan Brogdon misses. Rebound secured by Malcolm Embiid.

[10:27] Team_087 possession (Score: 2-0)
FOUL! Reach-in foul on Anthony Haliburton during the drive. [Team fouls: 1] No free throws, side out. (Anthony Haliburton: 1 personal fouls)

[10:14] Team_087 possession (Score: 2-0)
Jimmy Ming drives and kicks out. Jimmy Ming attempts a 3Pt. Contested by Jrue Haliburton (5.2 feet, MAN). Jimmy Ming misses. Rebound secured by Tyrese Stewart.

[09:55] Team_097 possession (Score: 2-0)
Tyrese Stewart drives, picks up Malcolm Embiid. Help arrives from Jimmy Ming! Tyrese Stewart attempts a Layup. Contested by Jimmy Ming (4.2 feet, ZONE). TYRESE STEWART MAKES IT! Assist: Jrue Haliburton
Score: 4-0

[09:41] Team_087 possession (Score: 4-0)
Malcolm Embiid drives, Anthony Haliburton stays with him. Malcolm Embiid attempts a Dunk. Contested by Anthony Haliburton (3.5 feet, MAN). Malcolm Embiid misses. Rebound secured by Anthony Haliburton.

[09:25] Team_097 possession (Score: 4-0)
Tyrese Stewart drives, Malcolm Embiid stays with him. Tyrese Stewart attempts a Dunk. Contested by Malcolm Embiid (4.2 feet, MAN). TYRESE STEWART MAKES IT! Assist: Anthony Haliburton
Score: 6-0

[09:11] Team_087 possession (Score: 6-0)
FOUL! Shooting foul on Shai Poole. Devin Anunoby to the line for 2 free throws. [Team fouls: 2] (Shai Poole: 1 personal fouls)   FT 1/2: GOOD   FT 2/2: GOOD Devin Anunoby makes 2/2 from the line.
Score: 6-2

[08:58] Team_097 possession (Score: 6-2)
Anthony Haliburton makes the Layup and draws the foul on Malcolm Embiid! And-1! Anthony Haliburton to the line for 1. [Team fouls: 3] (Malcolm Embiid: 2 personal fouls)   FT 1/1: GOOD Anthony Haliburton makes 1/1 from the line.
Score: 9-2

[08:46] Team_087 possession (Score: 9-2)
Devin Anunoby attempts a Layup. BLOCKED BY SHAI POOLE! Ball is loose! Rebound secured by Anthony Haliburton.

[08:33] Team_097 possession (Score: 9-2)
Jrue Haliburton attempts a 3Pt. Contested by Jimmy Ming (5.3 feet, MAN). JRUE HALIBURTON MAKES IT!
Score: 12-2

[08:16] Team_087 possession (Score: 12-2)
Devin Anunoby attempts a 3Pt. Contested by Shai Poole (3.6 feet, MAN). Devin Anunoby misses. Rebound secured by Tyrese Stewart.

[07:57] Team_097 possession (Score: 12-2)
FOUL! Reach-in foul on Devin Anunoby during the drive. [Team fouls: 4] No free throws, side out. (Devin Anunoby: 2 personal fouls)

[07:44] Team_097 possession (Score: 12-2)
FOUL! Holding foul on Malcolm Embiid. [IN THE BONUS! 5 team fouls] Tyrese Stewart to the line for 2 free throws. (Malcolm Embiid: 3 personal fouls)   FT 1/2: GOOD   FT 2/2: GOOD Tyrese Stewart makes 2/2 from the line.
Score: 14-2

[07:25] Team_087 possession (Score: 14-2)
Malcolm Embiid drives, Anthony Haliburton stays with him. Malcolm Embiid attempts a Dunk. Contested by Anthony Haliburton (3.5 feet, MAN). MALCOLM EMBIID MAKES IT! Assist: Devin Anunoby
Score: 14-4

[07:12] Team_097 possession (Score: 14-4)
Evan Brogdon drives and kicks out. Shai Poole attempts a Midrange. Contested by Malcolm Embiid (3.3 feet, ZONE). Shai Poole misses. Offensive rebound by Anthony Haliburton! Anthony Haliburton's putback is no good. Rebound secured by Devin Anunoby.

[06:58] Team_087 possession (Score: 14-4)
Devin Anunoby attempts a 3Pt. Contested by Shai Poole (3.6 feet, MAN). Devin Anunoby misses. Rebound secured by Tyrese Stewart.

[06:44] Team_097 possession (Score: 14-4)
Evan Brogdon commits a violation (traveling/carry)! TURNOVER! (dead ball)

[06:29] Team_087 possession (Score: 14-4)
Devin Anunoby attempts a 3Pt. Contested by Shai Poole (3.6 feet, ZONE). Devin Anunoby misses. Rebound secured by Anthony Haliburton.

[06:15] Team_097 possession (Score: 14-4)
Evan Brogdon attempts a Layup. Contested by Malcolm Embiid (4.0 feet, ZONE). EVAN BROGDON MAKES IT!
Score: 16-4

[05:56] Team_087 possession (Score: 16-4)
Jimmy Ming attempts a 3Pt. Contested by Jrue Haliburton (5.9 feet, MAN). Jimmy Ming misses. Rebound secured by Tyrese Stewart.

[05:43] Team_097 possession (Score: 16-4)
Anthony Haliburton attempts a Layup. Contested by Malcolm Embiid (3.8 feet, ZONE). ANTHONY HALIBURTON MAKES IT!
Score: 18-4

[05:32] Team_087 possession (Score: 18-4)
Jimmy Ming attempts a 3Pt. Contested by Jrue Haliburton (5.9 feet, MAN). JIMMY MING MAKES IT! Assist: Ben Brogdon
Score: 18-7

[05:19] Team_097 possession (Score: 18-7)
Shai Poole attempts a 3Pt. Contested by Allen Mitchell (5.3 feet, ZONE). Shai Poole misses. Offensive rebound by Tyrese Stewart! Tyrese Stewart kicks it out.

[05:02] Team_097 possession (Score: 18-7)
FOUL! Shooting foul on Malcolm Embiid. Evan Brogdon to the line for 2 free throws. [BONUS: 6 team fouls] (Malcolm Embiid: 4 personal fouls)   FT 1/2: MISS   FT 2/2: GOOD Evan Brogdon makes 1/2 from the line.
Score: 19-7

[04:45] Team_087 possession (Score: 19-7)
Ben Brogdon drives to the basket... Ben Brogdon loses the ball! Stripped by Anthony Haliburton! TURNOVER! (live ball)

[04:29] Team_097 possession (Score: 19-7)
Shai Poole drives and kicks out. Shai Poole attempts a 3Pt. Contested by Allen Mitchell (4.8 feet, ZONE). SHAI POOLE MAKES IT! Assist: Tyrese Stewart
Score: 22-7

[04:17] Team_087 possession (Score: 22-7)
Jimmy Ming attempts a Layup. Contested by Anthony Haliburton (4.1 feet, ZONE). JIMMY MING MAKES IT!
Score: 22-9

[04:06] Team_097 possession (Score: 22-9)
Tyrese Stewart attempts a Midrange. Contested by Malcolm Embiid (4.3 feet, MAN). TYRESE STEWART MAKES IT! Assist: Jrue Haliburton
Score: 24-9

[03:49] Team_087 possession (Score: 24-9)
Malcolm Embiid attempts a 3Pt. Contested by Shai Poole (3.7 feet, ZONE). MALCOLM EMBIID MAKES IT! Assist: Ben Brogdon
Score: 24-12

[03:37] Team_097 possession (Score: 24-12)
Anthony Haliburton attempts a Midrange. Contested by Malcolm Embiid (3.9 feet, MAN). Anthony Haliburton misses. Rebound secured by Ben Brogdon.

[03:22] Team_087 possession (Score: 24-12)
Malcolm Embiid drives and kicks out. Allen Mitchell attempts a 3Pt. Contested by Shai Poole (3.6 feet, ZONE). Allen Mitchell misses. Rebound secured by Anthony Haliburton.

[03:10] Team_097 possession (Score: 24-12)
Tyrese Stewart drives, picks up Malcolm Embiid. Help arrives from Jimmy Ming! Tyrese Stewart attempts a Dunk. Contested by Jimmy Ming (4.4 feet, MAN). Tyrese Stewart misses. Rebound secured by Malcolm Embiid.

[02:57] Team_087 possession (Score: 24-12)
Allen Mitchell attempts a Midrange. Contested by Evan Brogdon (5.3 feet, MAN). ALLEN MITCHELL MAKES IT! Assist: Ben Brogdon
Score: 24-14

[02:44] Team_097 possession (Score: 24-14)
Evan Brogdon drives, Malcolm Embiid stays with him. Evan Brogdon attempts a Layup. Contested by Malcolm Embiid (4.3 feet, ZONE). EVAN BROGDON MAKES IT! Assist: Shai Poole
Score: 26-14

[02:30] Team_087 possession (Score: 26-14)
Devin Anunoby attempts a 3Pt. Contested by Shai Poole (3.9 feet, ZONE). DEVIN ANUNOBY MAKES IT! Assist: Allen Mitchell
Score: 26-17

[02:16] Team_097 possession (Score: 26-17)
Anthony Haliburton attempts a 3Pt. Contested by Malcolm Embiid (4.1 feet, MAN). Anthony Haliburton misses. Offensive rebound by Tyrese Stewart! Tyrese Stewart kicks it out.

[02:01] Team_097 possession (Score: 26-17)
Evan Brogdon attempts a Midrange. Contested by Allen Mitchell (5.6 feet, MAN). EVAN BROGDON MAKES IT! Assist: Shai Poole
Score: 28-17

[01:44] Team_087 possession (Score: 28-17)
FOUL! Reach-in foul on Anthony Haliburton during the drive. [Team fouls: 3] No free throws, side out. (Anthony Haliburton: 2 personal fouls)

[01:31] Team_087 possession (Score: 28-17)
Malcolm Embiid attempts a Layup. BLOCKED BY ANTHONY HALIBURTON! Ball is loose! Rebound secured by Tyrese Stewart.

[01:16] Team_097 possession (Score: 28-17)
Jrue Haliburton attempts a 3Pt. Contested by Jimmy Ming (5.6 feet, MAN). JRUE HALIBURTON MAKES IT! Assist: Evan Brogdon
Score: 31-17

[01:04] Team_087 possession (Score: 31-17)
Jimmy Ming drives, picks up Anthony Haliburton. Help arrives from Jrue Haliburton! Jimmy Ming attempts a Layup. Contested by Jrue Haliburton (4.5 feet, ZONE). Jimmy Ming misses. Offensive rebound by Devin Anunoby! Devin Anunoby kicks it out.

[00:46] Team_087 possession (Score: 31-17)
FOUL! Reach-in foul on Anthony Haliburton during the drive. [Team fouls: 4] No free throws, side out. (Anthony Haliburton: 3 personal fouls)

[00:32] Team_087 possession (Score: 31-17)
Devin Anunoby drives to the basket... Devin Anunoby commits a violation (traveling/carry)! TURNOVER! (dead ball)

[00:32] Substitution (Team_097): Evan Brogdon OUT → Gary Carter IN (stamina_rule2)

[00:32] Substitution (Team_097): Jrue Haliburton OUT → Dwyane Ginobili IN (stamina_rule2)

[00:32] Substitution (Team_097): Shai Poole OUT → Miles Dosunmu IN (stamina_rule2)

[00:32] Substitution (Team_097): Anthony Haliburton OUT → Joel Simons IN (stamina_rule2)

[00:32] Substitution (Team_097): Tyrese Stewart OUT → Miles Banchero IN (stamina_rule2)

[00:32] Substitution (Team_087): Allen Mitchell OUT → Wendell Haliburton IN (stamina_rule2)

[00:32] Substitution (Team_087): Jimmy Ming OUT → Ben Lillard IN (stamina_rule2)

[00:32] Substitution (Team_087): Devin Anunoby OUT → Larry Green IN (stamina_rule2)

[00:32] Substitution (Team_087): Malcolm Embiid OUT → Pau Russell IN (stamina_rule2)

[00:32] Substitution (Team_087): Ben Brogdon OUT → Kristaps Young IN (stamina_rule2)

[00:13] Team_097 possession (Score: 31-17)
Miles Dosunmu attempts a Midrange. Contested by Larry Green (4.6 feet, ZONE). Miles Dosunmu misses. Rebound secured by Kristaps Young.

================================================================================
                              1ST QUARTER COMPLETE                              
================================================================================

1ST QUARTER SCORE: Team_097 31, Team_087 17

BOX SCORE:
================================================================================

Team_097
--------------------------------------------------------------------------------
Player                MIN  PTS  REB  AST  TO      FG   FG%      3P   3P%
--------------------------------------------------------------------------------
Tyrese Stewart         12    8    8    1   0   4/6    66.7     0/0   0.0
Evan Brogdon           12    7    0    1   0   4/6    66.7     0/0   0.0
Jrue Haliburton        12    6    0    2   0   2/2   100.0     0/0   0.0
Anthony Haliburton     12    5    6    1   0   2/3    66.7     0/0   0.0
Shai Poole             12    5    0    2   0   2/2   100.0     0/0   0.0
Miles Dosunmu           0    0    0    0   0   0/1     0.0     0/0   0.0

TEAM: FG: 14/20 (70.0%), 3PT: 2/2 (100.0%), REB: 15 (4 off, 11 def), AST: 7, TO: 1
TEAM FOULS: 4


Team_087
--------------------------------------------------------------------------------
Player                MIN  PTS  REB  AST  TO      FG   FG%      3P   3P%
--------------------------------------------------------------------------------
Devin Anunoby          12    5    3    1   0   2/7    28.6     0/0   0.0
Malcolm Embiid         12    5    2    0   0   2/5    40.0     0/0   0.0
Jimmy Ming             12    5    0    0   0   2/4    50.0     0/0   0.0
Allen Mitchell         12    2    0    1   0   1/2    50.0     0/0   0.0
Ben Brogdon            12    0    1    3   0   0/0     0.0     0/0   0.0
Kristaps Young          0    0    1    0   0   0/0     0.0     0/0   0.0

TEAM: FG: 7/18 (38.9%), 3PT: 3/9 (33.3%), REB: 6 (1 off, 5 def), AST: 5, TO: 2
TEAM FOULS: 6 [Team_097 in BONUS]

================================================================================

================================================================================
                       2ND QUARTER - Team_097 vs Team_087                       
================================================================================

[12:00] Team_097 possession (Score: 31-17)
Jrue Haliburton attempts a Midrange. Contested by Allen Mitchell (5.4 feet, ZONE). JRUE HALIBURTON MAKES IT!
Score: 33-17

[11:47] Team_087 possession (Score: 33-17)
Jimmy Ming drives, picks up Jrue Haliburton. Help arrives from Shai Poole! Jimmy Ming attempts a Layup. Wide open! Shai Poole is 6.1 feet away. [MAN] Jimmy Ming misses. Rebound secured by Shai Poole.

[11:37] Team_097 possession (Score: 33-17)
Anthony Haliburton makes the Layup and draws the foul on Jimmy Ming! And-1! Anthony Haliburton to the line for 1. [Team fouls: 1] (Jimmy Ming: 1 personal fouls)   FT 1/1: GOOD Anthony Haliburton makes 1/1 from the line.
Score: 36-17

[11:27] Team_087 possession (Score: 36-17)
Devin Anunoby drives, picks up Shai Poole. Help arrives from Jrue Haliburton! Devin Anunoby attempts a Layup. Contested by Jrue Haliburton (4.0 feet, MAN). Devin Anunoby misses. Offensive rebound by Malcolm Embiid! Malcolm Embiid kicks it out.

[11:15] Team_087 possession (Score: 36-17)
Jimmy Ming attempts a 3Pt. Contested by Anthony Haliburton (4.4 feet, ZONE). Jimmy Ming misses. Rebound secured by Anthony Haliburton.

[11:03] Team_097 possession (Score: 36-17)
Anthony Haliburton attempts a Midrange. Contested by Malcolm Embiid (4.2 feet, MAN). Anthony Haliburton misses. Rebound secured by Malcolm Embiid.

[10:48] Team_087 possession (Score: 36-17)
FOUL! Shooting foul on Shai Poole. Devin Anunoby to the line for 2 free throws. [Team fouls: 1] (Shai Poole: 1 personal fouls)   FT 1/2: GOOD   FT 2/2: MISS Devin Anunoby makes 1/2 from the line. Offensive rebound by Malcolm Embiid! Malcolm Embiid kicks it out.
Score: 36-18

[10:33] Team_087 possession (Score: 36-18)
Allen Mitchell drives and kicks out. Devin Anunoby attempts a Midrange. Contested by Shai Poole (3.9 feet, MAN). DEVIN ANUNOBY MAKES IT! Assist: Ben Brogdon
Score: 36-20

[10:18] Team_097 possession (Score: 36-20)
Shai Poole attempts a 3Pt. Contested by Allen Mitchell (5.6 feet, ZONE). Shai Poole misses. Rebound secured by Ben Brogdon.

[10:05] Team_087 possession (Score: 36-20)
FOUL! Holding foul on Anthony Haliburton. [Team fouls: 2] No free throws, side out. (Anthony Haliburton: 1 personal fouls)

[09:54] Team_087 possession (Score: 36-20)
Jimmy Ming attempts a Midrange. Contested by Anthony Haliburton (4.6 feet, ZONE). Jimmy Ming misses. Rebound secured by Anthony Haliburton.

[09:38] Team_097 possession (Score: 36-20)
Tyrese Stewart attempts a 3Pt. Contested by Malcolm Embiid (4.8 feet, MAN). TYRESE STEWART MAKES IT! Assist: Shai Poole
Score: 39-20

[09:22] Team_087 possession (Score: 39-20)
FOUL! Shooting foul on Anthony Haliburton. Malcolm Embiid to the line for 2 free throws. [Team fouls: 3] (Anthony Haliburton: 2 personal fouls)   FT 1/2: GOOD   FT 2/2: GOOD Malcolm Embiid makes 2/2 from the line.
Score: 39-22

[09:06] Team_097 possession (Score: 39-22)
Tyrese Stewart attempts a Midrange. Contested by Malcolm Embiid (4.8 feet, MAN). Tyrese Stewart misses. Rebound secured by Devin Anunoby.

[08:54] Team_087 possession (Score: 39-22)
Jimmy Ming attempts a 3Pt. Contested by Shai Poole (4.8 feet, ZONE). JIMMY MING MAKES IT! Assist: Ben Brogdon
Score: 39-25

[08:42] Team_097 possession (Score: 39-25)
Anthony Haliburton drives to the basket... Anthony Haliburton throws a bad pass out of bounds! TURNOVER! (dead ball)

[08:42] Substitution (Team_097): Evan Brogdon OUT → Gary Carter IN (stamina_rule2)

[08:42] Substitution (Team_097): Jrue Haliburton OUT → Dwyane Ginobili IN (stamina_rule2)

[08:42] Substitution (Team_097): Shai Poole OUT → Miles Dosunmu IN (stamina_rule2)

[08:42] Substitution (Team_097): Anthony Haliburton OUT → Joel Simons IN (stamina_rule2)

[08:42] Substitution (Team_097): Tyrese Stewart OUT → Miles Banchero IN (stamina_rule2)

[08:42] Substitution (Team_087): Allen Mitchell OUT → Wendell Haliburton IN (stamina_rule2)

[08:42] Substitution (Team_087): Jimmy Ming OUT → Ben Lillard IN (stamina_rule2)

[08:42] Substitution (Team_087): Devin Anunoby OUT → Larry Green IN (stamina_rule2)

[08:42] Substitution (Team_087): Malcolm Embiid OUT → Pau Russell IN (stamina_rule2)

[08:42] Substitution (Team_087): Ben Brogdon OUT → Kristaps Young IN (stamina_rule2)

[08:26] Team_087 possession (Score: 39-25)
Pau Russell drives, Joel Simons stays with him. Pau Russell attempts a Dunk. Contested by Joel Simons (3.6 feet, ZONE). PAU RUSSELL MAKES IT! Assist: Kristaps Young
Score: 39-27

[08:14] Team_097 possession (Score: 39-27)
Gary Carter makes the Layup and draws the foul on Kristaps Young! And-1! Gary Carter to the line for 1. [Team fouls: 2] (Kristaps Young: 1 personal fouls)   FT 1/1: GOOD Gary Carter makes 1/1 from the line.
Score: 42-27

[08:02] Team_087 possession (Score: 42-27)
FOUL! Shooting foul on Miles Dosunmu. Larry Green to the line for 2 free throws. [Team fouls: 4] (Miles Dosunmu: 1 personal fouls)   FT 1/2: GOOD   FT 2/2: GOOD Larry Green makes 2/2 from the line.
Score: 42-29

[07:48] Team_097 possession (Score: 42-29)
Joel Simons attempts a Layup. Contested by Kristaps Young (5.1 feet, ZONE). Joel Simons misses. Rebound secured by Larry Green.

[07:37] Team_087 possession (Score: 42-29)
Wendell Haliburton attempts a 3Pt. Contested by Gary Carter (5.2 feet, ZONE). WENDELL HALIBURTON MAKES IT! Assist: Ben Lillard
Score: 42-32

[07:23] Team_097 possession (Score: 42-32)
FOUL! Shooting foul on Larry Green. Miles Dosunmu to the line for 2 free throws. [Team fouls: 3] (Larry Green: 1 personal fouls)   FT 1/2: GOOD   FT 2/2: GOOD Miles Dosunmu makes 2/2 from the line.
Score: 44-32

[07:12] Team_087 possession (Score: 44-32)
FOUL! Reach-in foul on Joel Simons during the drive. [IN THE BONUS! 5 team fouls] Pau Russell to the line for 2 free throws. (Joel Simons: 1 personal fouls)   FT 1/2: GOOD   FT 2/2: GOOD Pau Russell makes 2/2 from the line.
Score: 44-34

[06:56] Team_097 possession (Score: 44-34)
Dwyane Ginobili attempts a 3Pt. Contested by Ben Lillard (5.2 feet, MAN). Dwyane Ginobili misses. FOUL! Loose ball foul on Kristaps Young during the rebound battle. [Team fouls: 4] No free throws, side out. (Kristaps Young: 2 personal fouls)

[06:40] Team_097 possession (Score: 44-34)
Miles Banchero attempts a Midrange. Contested by Larry Green (4.2 feet, ZONE). MILES BANCHERO MAKES IT! Assist: Joel Simons
Score: 46-34

[06:28] Team_087 possession (Score: 46-34)
Wendell Haliburton attempts a 3Pt. Contested by Gary Carter (5.2 feet, MAN). Wendell Haliburton misses. Rebound secured by Miles Banchero.

[06:14] Team_097 possession (Score: 46-34)
Dwyane Ginobili attempts a 3Pt. Contested by Pau Russell (4.7 feet, ZONE). Dwyane Ginobili misses. Rebound secured by Kristaps Young.

[05:56] Team_087 possession (Score: 46-34)
Larry Green attempts a 3Pt. Contested by Joel Simons (3.9 feet, ZONE). Larry Green misses. Offensive rebound by Larry Green! Larry Green kicks it out.

[05:41] Team_087 possession (Score: 46-34)
Wendell Haliburton attempts a 3Pt. Contested by Joel Simons (4.1 feet, ZONE). Wendell Haliburton misses. Offensive rebound by Kristaps Young! Kristaps Young's putback is no good. Rebound secured by Miles Banchero.

[05:24] Team_097 possession (Score: 46-34)
Gary Carter attempts a 3Pt. Contested by Wendell Haliburton (5.0 feet, MAN). Gary Carter misses. Rebound secured by Pau Russell.

[05:13] Team_087 possession (Score: 46-34)
Pau Russell attempts a 3Pt. Contested by Joel Simons (3.6 feet, ZONE). Pau Russell misses. Rebound secured by Joel Simons.

[04:59] Team_097 possession (Score: 46-34)
Miles Dosunmu attempts a 3Pt. Contested by Larry Green (4.6 feet, MAN). Miles Dosunmu misses. Rebound secured by Kristaps Young.

[04:44] Team_087 possession (Score: 46-34)
Kristaps Young drives, picks up Joel Simons. Help arrives from Dwyane Ginobili! Kristaps Young attempts a Dunk. Contested by Dwyane Ginobili (4.0 feet, MAN). Kristaps Young misses. Rebound secured by Miles Banchero.

[04:32] Team_097 possession (Score: 46-34)
Gary Carter attempts a 3Pt. Contested by Wendell Haliburton (5.0 feet, MAN). Gary Carter misses. Offensive rebound by Miles Dosunmu! Miles Dosunmu kicks it out.

[04:19] Team_097 possession (Score: 46-34)
Dwyane Ginobili attempts a 3Pt. Contested by Wendell Haliburton (5.1 feet, ZONE). DWYANE GINOBILI MAKES IT! Assist: Joel Simons
Score: 49-34

[04:03] Team_087 possession (Score: 49-34)
Wendell Haliburton drives, Joel Simons stays with him. Wendell Haliburton attempts a Dunk. Contested by Joel Simons (4.1 feet, ZONE). Wendell Haliburton misses. Rebound secured by Miles Banchero.

[03:51] Team_097 possession (Score: 49-34)
Gary Carter attempts a Layup. BLOCKED BY WENDELL HALIBURTON! Ball is loose! Rebound secured by Larry Green.

[03:40] Team_087 possession (Score: 49-34)
Pau Russell makes the Dunk and draws the foul on Joel Simons! And-1! Pau Russell to the line for 1. [BONUS: 6 team fouls] (Joel Simons: 2 personal fouls)   FT 1/1: MISS Pau Russell makes 0/1 from the line. Rebound secured by Joel Simons.
Score: 49-36

[03:30] Team_097 possession (Score: 49-36)
Miles Banchero drives, Kristaps Young stays with him. Miles Banchero attempts a Dunk. Contested by Kristaps Young (5.0 feet, MAN). Miles Banchero misses. Offensive rebound by Miles Dosunmu! Miles Dosunmu kicks it out.

[03:15] Team_097 possession (Score: 49-36)
Joel Simons attempts a Layup. Contested by Pau Russell (5.0 feet, MAN). JOEL SIMONS MAKES IT! Assist: Gary Carter
Score: 51-36

[03:05] Team_087 possession (Score: 51-36)
Larry Green attempts a 3Pt. Contested by Miles Dosunmu (4.1 feet, MAN). Larry Green misses. Rebound secured by Miles Banchero.

[02:52] Team_097 possession (Score: 51-36)
Gary Carter attempts a 3Pt. Contested by Pau Russell (4.6 feet, ZONE). GARY CARTER MAKES IT! Assist: Joel Simons
Score: 54-36

[02:39] Team_087 possession (Score: 54-36)
Kristaps Young attempts a 3Pt. Contested by Joel Simons (4.0 feet, ZONE). KRISTAPS YOUNG MAKES IT! Assist: Pau Russell
Score: 54-39

[02:28] Team_097 possession (Score: 54-39)
Miles Banchero attempts a Midrange. Contested by Kristaps Young (5.1 feet, MAN). MILES BANCHERO MAKES IT!
Score: 56-39

[02:18] Team_087 possession (Score: 56-39)
Larry Green attempts a 3Pt. Contested by Miles Dosunmu (4.1 feet, MAN). Larry Green misses. Rebound secured by Joel Simons.

[02:01] Team_097 possession (Score: 56-39)
Gary Carter drives, picks up Wendell Haliburton. Help arrives from Larry Green! Gary Carter attempts a Layup. Contested by Larry Green (5.0 feet, MAN). Gary Carter misses. Offensive rebound by Miles Dosunmu! Miles Dosunmu kicks it out.

[01:47] Team_097 possession (Score: 56-39)
Miles Banchero attempts a Layup. Contested by Kristaps Young (5.1 feet, ZONE). MILES BANCHERO MAKES IT!
Score: 58-39

[01:34] Team_087 possession (Score: 58-39)
Pau Russell attempts a 3Pt. Contested by Joel Simons (3.7 feet, MAN). Pau Russell misses. Offensive rebound by Larry Green! Larry Green kicks it out.

[01:16] Team_087 possession (Score: 58-39)
Kristaps Young makes the Layup and draws the foul on Joel Simons! And-1! Kristaps Young to the line for 1. [BONUS: 7 team fouls] (Joel Simons: 3 personal fouls)   FT 1/1: GOOD Kristaps Young makes 1/1 from the line.
Score: 58-42

[01:03] Team_097 possession (Score: 58-42)
Joel Simons drives to the basket... Joel Simons throws a bad pass! Stolen by Pau Russell! TURNOVER! (live ball)

[00:48] Team_087 possession (Score: 58-42)
Pau Russell drives to the basket... Pau Russell throws a bad pass out of bounds! TURNOVER! (dead ball)

[00:31] Team_097 possession (Score: 58-42)
Joel Simons attempts a 3Pt. Contested by Pau Russell (5.1 feet, ZONE). Joel Simons misses. Offensive rebound by Joel Simons! Joel Simons kicks it out.

[00:17] Team_097 possession (Score: 58-42)
Miles Banchero drives, Kristaps Young stays with him. Miles Banchero attempts a Dunk. Contested by Kristaps Young (5.3 feet, MAN). MILES BANCHERO MAKES IT! Assist: Gary Carter
Score: 60-42

[00:05] Team_087 possession (Score: 60-42)
Ben Lillard attempts a 3Pt. Contested by Dwyane Ginobili (4.9 feet, MAN). BEN LILLARD MAKES IT! Assist: Larry Green
Score: 60-45

================================================================================
                              2ND QUARTER COMPLETE                              
================================================================================

2ND QUARTER SCORE: Team_097 29, Team_087 28

BOX SCORE:
================================================================================

Team_097
--------------------------------------------------------------------------------
Player                MIN  PTS  REB  AST  TO      FG   FG%      3P   3P%
--------------------------------------------------------------------------------
Miles Banchero          9    8    5    0   0   4/4   100.0     0/0   0.0
Gary Carter             9    6    0    2   0   2/4    50.0     0/0   0.0
Anthony Haliburton     15    3    2    0   0   1/2    50.0     0/0   0.0
Tyrese Stewart         15    3    0    0   0   1/2    50.0     0/0   0.0
Dwyane Ginobili         9    3    0    0   0   1/2    50.0     0/0   0.0
Jrue Haliburton        15    2    0    0   0   1/1   100.0     0/0   0.0
Joel Simons             9    2    4    3   0   1/2    50.0     0/0   0.0
Miles Dosunmu           9    2    4    0   0   1/2    50.0     0/0   0.0
Shai Poole             15    0    1    1   0   0/1     0.0     0/0   0.0

TEAM: FG: 12/20 (60.0%), 3PT: 3/7 (42.9%), REB: 15 (5 off, 10 def), AST: 6, TO: 2
TEAM FOULS: 7 [Team_087 in BONUS]


Team_087
--------------------------------------------------------------------------------
Player                MIN  PTS  REB  AST  TO      FG   FG%      3P   3P%
--------------------------------------------------------------------------------
Kristaps Young          9    6    2    1   0   2/3    66.7     0/0   0.0
Pau Russell             9    4    1    1   0   2/4    50.0     0/0   0.0
Jimmy Ming             15    3    0    0   0   1/4    25.0     0/0   0.0
Wendell Haliburton      9    3    0    0   0   1/4    25.0     0/0   0.0
Ben Lillard             9    3    0    1   0   1/1   100.0     0/0   0.0
Malcolm Embiid         15    2    3    0   0   1/1   100.0     0/0   0.0
Devin Anunoby          15    2    1    0   0   1/1   100.0     0/0   0.0
Larry Green             9    2    4    1   0   1/3    33.3     0/0   0.0
Ben Brogdon            15    0    1    2   0   0/0     0.0     0/0   0.0

TEAM: FG: 10/21 (47.6%), 3PT: 4/10 (40.0%), REB: 13 (5 off, 8 def), AST: 6, TO: 1
TEAM FOULS: 4

================================================================================

================================================================================
                       3RD QUARTER - Team_097 vs Team_087                       
================================================================================

[12:00] Team_097 possession (Score: 60-45)
FOUL! Shooting foul on Malcolm Embiid. Tyrese Stewart to the line for 2 free throws. [Team fouls: 1] (Malcolm Embiid: 1 personal fouls)   FT 1/2: GOOD   FT 2/2: GOOD Tyrese Stewart makes 2/2 from the line.
Score: 62-45

[11:44] Team_087 possession (Score: 62-45)
FOUL! Offensive foul on Malcolm Embiid! Anthony Haliburton drew the charge! [Team fouls: 2] (Malcolm Embiid: 2 personal fouls) TURNOVER! (dead ball)

[11:32] Team_097 possession (Score: 62-45)
Evan Brogdon makes the Dunk and draws the foul on Allen Mitchell! And-1! Evan Brogdon to the line for 1. [Team fouls: 3] (Allen Mitchell: 1 personal fouls)   FT 1/1: GOOD Evan Brogdon makes 1/1 from the line.
Score: 65-45

[11:16] Team_087 possession (Score: 65-45)
Ben Brogdon attempts a Layup. Contested by Anthony Haliburton (3.6 feet, ZONE). Ben Brogdon misses. Rebound secured by Shai Poole.

[11:01] Team_097 possession (Score: 65-45)
Anthony Haliburton attempts a Midrange. Contested by Devin Anunoby (4.8 feet, ZONE). ANTHONY HALIBURTON MAKES IT! Assist: Tyrese Stewart
Score: 67-45

[10:48] Team_087 possession (Score: 67-45)
Ben Brogdon attempts a Midrange. Contested by Jrue Haliburton (5.5 feet, ZONE). BEN BROGDON MAKES IT!
Score: 67-47

[10:37] Team_097 possession (Score: 67-47)
Shai Poole drives to the basket... Shai Poole commits a violation (traveling/carry)! TURNOVER! (dead ball)

[10:24] Team_087 possession (Score: 67-47)
Ben Brogdon drives and kicks out. Devin Anunoby attempts a 3Pt. Contested by Shai Poole (3.4 feet, ZONE). Devin Anunoby misses. Rebound secured by Anthony Haliburton.

[10:13] Team_097 possession (Score: 67-47)
Shai Poole attempts a Midrange. Contested by Devin Anunoby (4.9 feet, MAN). Shai Poole misses. Rebound secured by Ben Brogdon.

[09:54] Team_087 possession (Score: 67-47)
Allen Mitchell drives to the basket... Allen Mitchell throws a bad pass! Stolen by Anthony Haliburton! TURNOVER! (live ball)

[09:38] Team_097 possession (Score: 67-47)
Evan Brogdon attempts a 3Pt. Contested by Allen Mitchell (5.5 feet, MAN). Evan Brogdon misses. Offensive rebound by Anthony Haliburton! Anthony Haliburton puts it back in!
Score: 69-47

[09:22] Team_087 possession (Score: 69-47)
Allen Mitchell drives, Anthony Haliburton stays with him. Allen Mitchell attempts a Dunk. Contested by Anthony Haliburton (3.7 feet, ZONE). Allen Mitchell misses. Offensive rebound by Malcolm Embiid! Malcolm Embiid puts it back in!
Score: 69-49

[09:08] Team_097 possession (Score: 69-49)
Shai Poole makes the Midrange and draws the foul on Devin Anunoby! And-1! Shai Poole to the line for 1. [Team fouls: 4] (Devin Anunoby: 1 personal fouls)   FT 1/1: GOOD Shai Poole makes 1/1 from the line.
Score: 72-49

[08:58] Team_087 possession (Score: 72-49)
Ben Brogdon attempts a 3Pt. Contested by Shai Poole (3.7 feet, ZONE). Ben Brogdon misses. Offensive rebound by Devin Anunoby! Devin Anunoby puts it back in!
Score: 72-51

[08:43] Team_097 possession (Score: 72-51)
Tyrese Stewart makes the Layup and draws the foul on Malcolm Embiid! And-1! Tyrese Stewart to the line for 1. [BONUS: 5 team fouls] (Malcolm Embiid: 3 personal fouls)   FT 1/1: GOOD Tyrese Stewart makes 1/1 from the line.
Score: 75-51

[08:27] Team_087 possession (Score: 75-51)
Malcolm Embiid makes the Layup and draws the foul on Anthony Haliburton! And-1! Malcolm Embiid to the line for 1. [Team fouls: 1] (Anthony Haliburton: 1 personal fouls)   FT 1/1: MISS Malcolm Embiid makes 0/1 from the line. Rebound secured by Shai Poole.
Score: 75-53

[08:17] Team_097 possession (Score: 75-53)
Evan Brogdon attempts a 3Pt. Contested by Allen Mitchell (5.5 feet, ZONE). EVAN BROGDON MAKES IT! Assist: Jrue Haliburton
Score: 78-53

[08:01] Team_087 possession (Score: 78-53)
Ben Brogdon attempts a Layup. Contested by Anthony Haliburton (3.6 feet, ZONE). Ben Brogdon misses. Rebound secured by Tyrese Stewart.

[07:43] Team_097 possession (Score: 78-53)
Jrue Haliburton attempts a Layup. Contested by Jimmy Ming (5.3 feet, MAN). JRUE HALIBURTON MAKES IT! Assist: Shai Poole
Score: 80-53

[07:27] Team_087 possession (Score: 80-53)
Devin Anunoby makes the Layup and draws the foul on Anthony Haliburton! And-1! Devin Anunoby to the line for 1. [Team fouls: 2] (Anthony Haliburton: 2 personal fouls)   FT 1/1: GOOD Devin Anunoby makes 1/1 from the line.
Score: 80-56

[07:14] Team_097 possession (Score: 80-56)
FOUL! Reach-in foul on Malcolm Embiid during the drive. [IN THE BONUS! 6 team fouls] Tyrese Stewart to the line for 2 free throws. (Malcolm Embiid: 4 personal fouls)   FT 1/2: GOOD   FT 2/2: GOOD Tyrese Stewart makes 2/2 from the line.
Score: 82-56

[06:59] Team_087 possession (Score: 82-56)
Malcolm Embiid attempts a Midrange. Contested by Anthony Haliburton (3.5 feet, MAN). Malcolm Embiid misses. Rebound secured by Shai Poole.

[06:46] Team_097 possession (Score: 82-56)
Evan Brogdon attempts a Layup. BLOCKED BY MALCOLM EMBIID! Ball deflects out of bounds off Evan Brogdon.

[06:35] Team_087 possession (Score: 82-56)
Devin Anunoby attempts a Midrange. Contested by Anthony Haliburton (3.5 feet, ZONE). Devin Anunoby misses. Rebound secured by Anthony Haliburton.

[06:17] Team_097 possession (Score: 82-56)
Anthony Haliburton attempts a 3Pt. Contested by Allen Mitchell (5.2 feet, ZONE). Anthony Haliburton misses. Rebound secured by Malcolm Embiid.

[06:03] Team_087 possession (Score: 82-56)
Allen Mitchell attempts a Midrange. Contested by Jrue Haliburton (5.6 feet, ZONE). ALLEN MITCHELL MAKES IT!
Score: 82-58

[05:52] Team_097 possession (Score: 82-58)
Anthony Haliburton attempts a 3Pt. Contested by Allen Mitchell (5.2 feet, ZONE). Anthony Haliburton misses. Offensive rebound by Tyrese Stewart! Tyrese Stewart kicks it out.

[05:38] Team_097 possession (Score: 82-58)
Shai Poole attempts a Midrange. Contested by Devin Anunoby (4.9 feet, MAN). Shai Poole misses. Rebound secured by Devin Anunoby.

[05:23] Team_087 possession (Score: 82-58)
Ben Brogdon drives and kicks out. Devin Anunoby attempts a Midrange. Contested by Jrue Haliburton (5.2 feet, ZONE). Devin Anunoby misses. Rebound secured by Shai Poole.

[05:09] Team_097 possession (Score: 82-58)
FOUL! Holding foul on Malcolm Embiid. [IN THE BONUS! 7 team fouls] Tyrese Stewart to the line for 2 free throws. (Malcolm Embiid: 5 personal fouls)   FT 1/2: GOOD   FT 2/2: MISS Tyrese Stewart makes 1/2 from the line. Rebound secured by Malcolm Embiid.
Score: 83-58

[04:56] Team_087 possession (Score: 83-58)
Devin Anunoby attempts a 3Pt. Contested by Shai Poole (3.7 feet, MAN). Devin Anunoby misses. Rebound secured by Anthony Haliburton.

[04:42] Team_097 possession (Score: 83-58)
Shai Poole drives and kicks out. Shai Poole attempts a 3Pt. Contested by Jimmy Ming (4.9 feet, ZONE). Shai Poole misses. Rebound secured by Ben Brogdon.

[04:28] Team_087 possession (Score: 83-58)
Allen Mitchell makes the 3Pt and draws the foul on Evan Brogdon! And-1! Allen Mitchell to the line for 1. [Team fouls: 3] (Evan Brogdon: 1 personal fouls)   FT 1/1: GOOD Allen Mitchell makes 1/1 from the line.
Score: 83-62

[04:18] Team_097 possession (Score: 83-62)
Shai Poole attempts a Layup. Contested by Devin Anunoby (5.0 feet, MAN). SHAI POOLE MAKES IT! Assist: Anthony Haliburton
Score: 85-62

[04:04] Team_087 possession (Score: 85-62)
Jimmy Ming attempts a 3Pt. Contested by Shai Poole (4.2 feet, ZONE). Jimmy Ming misses. Rebound secured by Tyrese Stewart.

[03:45] Team_097 possession (Score: 85-62)
FOUL! Shooting foul on Allen Mitchell. Shai Poole to the line for 3 free throws. [BONUS: 8 team fouls] (Allen Mitchell: 2 personal fouls)   FT 1/3: GOOD   FT 2/3: GOOD   FT 3/3: MISS Shai Poole makes 2/3 from the line. Offensive rebound by Anthony Haliburton! Anthony Haliburton puts it back in!
Score: 89-62

[03:29] Team_087 possession (Score: 89-62)
FOUL! Shooting foul on Shai Poole. Devin Anunoby to the line for 3 free throws. [Team fouls: 4] (Shai Poole: 1 personal fouls)   FT 1/3: MISS   FT 2/3: GOOD   FT 3/3: MISS Devin Anunoby makes 1/3 from the line. Offensive rebound by Malcolm Embiid! Malcolm Embiid puts it back in!
Score: 89-65

[03:12] Team_097 possession (Score: 89-65)
Shai Poole attempts a 3Pt. Contested by Allen Mitchell (5.4 feet, ZONE). Shai Poole misses. Rebound secured by Devin Anunoby.

[02:55] Team_087 possession (Score: 89-65)
Ben Brogdon attempts a 3Pt. Contested by Anthony Haliburton (3.8 feet, MAN). Ben Brogdon misses. Rebound secured by Shai Poole.

[02:41] Team_097 possession (Score: 89-65)
Evan Brogdon attempts a 3Pt. Contested by Allen Mitchell (5.6 feet, MAN). Evan Brogdon misses. Rebound secured by Devin Anunoby.

[02:25] Team_087 possession (Score: 89-65)
Ben Brogdon attempts a Midrange. Contested by Anthony Haliburton (3.9 feet, ZONE). Ben Brogdon misses. Offensive rebound by Malcolm Embiid! Malcolm Embiid kicks it out.

[02:14] Team_087 possession (Score: 89-65)
Jimmy Ming makes the Dunk and draws the foul on Jrue Haliburton! And-1! Jimmy Ming to the line for 1. [BONUS: 5 team fouls] (Jrue Haliburton: 1 personal fouls)   FT 1/1: MISS Jimmy Ming makes 0/1 from the line. Rebound secured by Tyrese Stewart.
Score: 89-67

[02:00] Team_097 possession (Score: 89-67)
FOUL! Offensive foul on Evan Brogdon! Allen Mitchell drew the charge! [Team fouls: 6] (Evan Brogdon: 2 personal fouls) TURNOVER! (dead ball)

[01:45] Team_087 possession (Score: 89-67)
FOUL! Holding foul on Anthony Haliburton. [IN THE BONUS! 7 team fouls] Malcolm Embiid to the line for 2 free throws. (Anthony Haliburton: 3 personal fouls)   FT 1/2: MISS   FT 2/2: GOOD Malcolm Embiid makes 1/2 from the line.
Score: 89-68

[01:30] Team_097 possession (Score: 89-68)
Shai Poole attempts a Midrange. Contested by Malcolm Embiid (4.3 feet, ZONE). SHAI POOLE MAKES IT! Assist: Jrue Haliburton
Score: 91-68

[01:11] Team_087 possession (Score: 91-68)
Devin Anunoby attempts a 3Pt. Contested by Shai Poole (4.0 feet, ZONE). Devin Anunoby misses. Rebound secured by Tyrese Stewart.

[00:56] Team_097 possession (Score: 91-68)
FOUL! Holding foul on Allen Mitchell. [IN THE BONUS! 9 team fouls] Evan Brogdon to the line for 2 free throws. (Allen Mitchell: 3 personal fouls)   FT 1/2: GOOD   FT 2/2: GOOD Evan Brogdon makes 2/2 from the line.
Score: 93-68

[00:45] Team_087 possession (Score: 93-68)
Allen Mitchell attempts a Layup. Contested by Anthony Haliburton (4.2 feet, ZONE). Allen Mitchell misses. Offensive rebound by Devin Anunoby! Devin Anunoby kicks it out.

[00:33] Team_087 possession (Score: 93-68)
Jimmy Ming drives and kicks out. Jimmy Ming attempts a Midrange. Contested by Anthony Haliburton (3.9 feet, ZONE). Jimmy Ming misses. Rebound secured by Shai Poole.

[00:23] Team_097 possession (Score: 93-68)
Evan Brogdon attempts a Midrange. Contested by Allen Mitchell (5.8 feet, MAN). EVAN BROGDON MAKES IT! Assist: Anthony Haliburton
Score: 95-68

[00:10] Team_087 possession (Score: 95-68)
FOUL! Shooting foul on Shai Poole. Malcolm Embiid to the line for 3 free throws. [BONUS: 8 team fouls] (Shai Poole: 2 personal fouls)   FT 1/3: GOOD   FT 2/3: GOOD   FT 3/3: MISS Malcolm Embiid makes 2/3 from the line. Rebound secured by Shai Poole.
Score: 95-70

================================================================================
                              3RD QUARTER COMPLETE                              
================================================================================

3RD QUARTER SCORE: Team_097 35, Team_087 25

BOX SCORE:
================================================================================

Team_097
--------------------------------------------------------------------------------
Player                MIN  PTS  REB  AST  TO      FG   FG%      3P   3P%
--------------------------------------------------------------------------------
Evan Brogdon           27   10    0    0   0   4/6    66.7     0/0   0.0
Anthony Haliburton     27    8    4    2   0   3/4    75.0     0/0   0.0
Tyrese Stewart         27    7    5    1   0   3/3   100.0     0/0   0.0
Shai Poole             27    7    7    1   0   3/7    42.9     0/0   0.0
Jrue Haliburton        27    2    0    2   0   1/1   100.0     0/0   0.0

TEAM: FG: 14/22 (63.6%), 3PT: 3/6 (50.0%), REB: 16 (2 off, 14 def), AST: 6, TO: 2
TEAM FOULS: 8 [Team_087 in BONUS]


Team_087
--------------------------------------------------------------------------------
Player                MIN  PTS  REB  AST  TO      FG   FG%      3P   3P%
--------------------------------------------------------------------------------
Malcolm Embiid         27    6    4    0   0   3/6    50.0     0/0   0.0
Allen Mitchell         27    6    0    0   0   2/2   100.0     0/0   0.0
Devin Anunoby          27    5    5    0   0   2/5    40.0     0/0   0.0
Ben Brogdon            27    2    2    0   0   1/6    16.7     0/0   0.0
Jimmy Ming             27    0    0    0   0   0/3     0.0     0/0   0.0

TEAM: FG: 8/22 (36.4%), 3PT: 3/8 (37.5%), REB: 11 (4 off, 7 def), AST: 0, TO: 2
TEAM FOULS: 9 [Team_097 in BONUS]

================================================================================

================================================================================
                       4TH QUARTER - Team_097 vs Team_087                       
================================================================================

[12:00] Team_097 possession (Score: 95-70)
Anthony Haliburton attempts a Layup. BLOCKED BY MALCOLM EMBIID! Ball is loose! Rebound secured by Devin Anunoby.

[11:50] Team_087 possession (Score: 95-70)
Malcolm Embiid attempts a Midrange. Contested by Jrue Haliburton (5.7 feet, ZONE). Malcolm Embiid misses. Rebound secured by Shai Poole.

[11:35] Team_097 possession (Score: 95-70)
Evan Brogdon attempts a Midrange. Contested by Malcolm Embiid (4.4 feet, ZONE). Evan Brogdon misses. Rebound secured by Ben Brogdon.

[11:20] Team_087 possession (Score: 95-70)
Malcolm Embiid drives, Anthony Haliburton stays with him. Malcolm Embiid attempts a Dunk. Contested by Anthony Haliburton (4.0 feet, MAN). MALCOLM EMBIID MAKES IT! Assist: Jimmy Ming
Score: 95-72

[11:05] Team_097 possession (Score: 95-72)
Anthony Haliburton attempts a 3Pt. Contested by Malcolm Embiid (4.2 feet, MAN). ANTHONY HALIBURTON MAKES IT! Assist: Evan Brogdon
Score: 98-72

[10:48] Team_087 possession (Score: 98-72)
Devin Anunoby drives and kicks out. Devin Anunoby attempts a Midrange. BLOCKED BY JRUE HALIBURTON! Ball deflects out of bounds off Devin Anunoby.

[10:33] Team_097 possession (Score: 98-72)
Evan Brogdon attempts a Midrange. Contested by Allen Mitchell (5.7 feet, MAN). Evan Brogdon misses. Rebound secured by Ben Brogdon.

[10:16] Team_087 possession (Score: 98-72)
Jimmy Ming drives, Jrue Haliburton stays with him. Jimmy Ming attempts a Layup. Wide open! Jrue Haliburton is 6.2 feet away. [MAN] JIMMY MING MAKES IT! Assist: Malcolm Embiid
Score: 98-74

[10:04] Team_097 possession (Score: 98-74)
Shai Poole attempts a Midrange. Contested by Devin Anunoby (5.4 feet, ZONE). SHAI POOLE MAKES IT!
Score: 100-74

[09:46] Team_087 possession (Score: 100-74)
Allen Mitchell drives, Anthony Haliburton stays with him. Allen Mitchell attempts a Dunk. Contested by Anthony Haliburton (4.3 feet, ZONE). Allen Mitchell misses. Rebound secured by Tyrese Stewart.

[09:26] Team_097 possession (Score: 100-74)
Jrue Haliburton attempts a 3Pt. Contested by Jimmy Ming (5.7 feet, MAN). Jrue Haliburton misses. FOUL! Loose ball foul on Ben Brogdon during the rebound battle. [Team fouls: 1] No free throws, side out. (Ben Brogdon: 1 personal fouls)

[09:11] Team_097 possession (Score: 100-74)
Anthony Haliburton attempts a Midrange. Contested by Malcolm Embiid (4.4 feet, MAN). ANTHONY HALIBURTON MAKES IT! Assist: Tyrese Stewart
Score: 102-74

[08:53] Team_087 possession (Score: 102-74)
FOUL! Shooting foul on Shai Poole. Devin Anunoby to the line for 2 free throws. [Team fouls: 1] (Shai Poole: 1 personal fouls)   FT 1/2: GOOD   FT 2/2: GOOD Devin Anunoby makes 2/2 from the line.
Score: 102-76

[08:38] Team_097 possession (Score: 102-76)
FOUL! Holding foul on Devin Anunoby. [Team fouls: 2] No free throws, side out. (Devin Anunoby: 1 personal fouls)

[08:27] Team_097 possession (Score: 102-76)
Anthony Haliburton makes the Midrange and draws the foul on Ben Brogdon! And-1! Anthony Haliburton to the line for 1. [Team fouls: 3] (Ben Brogdon: 2 personal fouls)   FT 1/1: GOOD Anthony Haliburton makes 1/1 from the line.
Score: 105-76

[08:17] Team_087 possession (Score: 105-76)
Malcolm Embiid attempts a Layup. Contested by Anthony Haliburton (4.4 feet, MAN). MALCOLM EMBIID MAKES IT! Assist: Ben Brogdon
Score: 105-78

[08:03] Team_097 possession (Score: 105-78)
Anthony Haliburton attempts a Midrange. Contested by Malcolm Embiid (4.6 feet, ZONE). Anthony Haliburton misses. Rebound secured by Malcolm Embiid.

[07:53] Team_087 possession (Score: 105-78)
Jimmy Ming attempts a 3Pt. Contested by Shai Poole (4.9 feet, ZONE). Jimmy Ming misses. Rebound secured by Anthony Haliburton.

[07:39] Team_097 possession (Score: 105-78)
Evan Brogdon attempts a 3Pt. Contested by Allen Mitchell (6.0 feet, MAN). Evan Brogdon misses. Rebound secured by Ben Brogdon.

[07:25] Team_087 possession (Score: 105-78)
Jimmy Ming attempts a Layup. Wide open! Jrue Haliburton is 6.5 feet away. [MAN] JIMMY MING MAKES IT!
Score: 105-80

[07:11] Team_097 possession (Score: 105-80)
Jrue Haliburton attempts a Midrange. Contested by Devin Anunoby (5.7 feet, ZONE). JRUE HALIBURTON MAKES IT!
Score: 107-80

[06:55] Team_087 possession (Score: 107-80)
Jimmy Ming attempts a 3Pt. Contested by Shai Poole (5.1 feet, ZONE). Jimmy Ming misses. Rebound secured by Shai Poole.

[06:39] Team_097 possession (Score: 107-80)
Evan Brogdon attempts a 3Pt. Wide open! Allen Mitchell is 6.1 feet away. [MAN] Evan Brogdon misses. Rebound secured by Devin Anunoby.

[06:26] Team_087 possession (Score: 107-80)
Malcolm Embiid drives, picks up Anthony Haliburton. Help arrives from Jrue Haliburton! Malcolm Embiid attempts a Dunk. Contested by Jrue Haliburton (4.7 feet, ZONE). MALCOLM EMBIID MAKES IT! Assist: Allen Mitchell
Score: 107-82

[06:08] Team_097 possession (Score: 107-82)
Tyrese Stewart drives, picks up Malcolm Embiid. Help arrives from Jimmy Ming! Tyrese Stewart attempts a Dunk. Contested by Jimmy Ming (5.2 feet, ZONE). Tyrese Stewart misses. Rebound secured by Malcolm Embiid.

[05:49] Team_087 possession (Score: 107-82)
Malcolm Embiid drives, Anthony Haliburton stays with him. Malcolm Embiid attempts a Layup. Contested by Anthony Haliburton (4.7 feet, MAN). MALCOLM EMBIID MAKES IT! Assist: Allen Mitchell
Score: 107-84

[05:36] Team_097 possession (Score: 107-84)
Evan Brogdon attempts a 3Pt. Wide open! Allen Mitchell is 6.2 feet away. [MAN] EVAN BROGDON MAKES IT! Assist: Jrue Haliburton
Score: 110-84

[05:20] Team_087 possession (Score: 110-84)
Devin Anunoby makes the Layup and draws the foul on Jrue Haliburton! And-1! Devin Anunoby to the line for 1. [Team fouls: 2] (Jrue Haliburton: 1 personal fouls)   FT 1/1: GOOD Devin Anunoby makes 1/1 from the line.
Score: 110-87

[05:06] Team_097 possession (Score: 110-87)
Shai Poole attempts a 3Pt. Wide open! Allen Mitchell is 6.1 feet away. [ZONE] Shai Poole misses. Rebound secured by Devin Anunoby.

[04:54] Team_087 possession (Score: 110-87)
FOUL! Shooting foul on Shai Poole. Ben Brogdon to the line for 3 free throws. [Team fouls: 3] (Shai Poole: 2 personal fouls)   FT 1/3: GOOD   FT 2/3: GOOD   FT 3/3: MISS Ben Brogdon makes 2/3 from the line. Rebound secured by Shai Poole.
Score: 110-89

[04:39] Team_097 possession (Score: 110-89)
Jrue Haliburton drives to the basket... Jrue Haliburton loses control! Ball rolls out of bounds! TURNOVER! (dead ball)

[04:39] Substitution (Team_097): Evan Brogdon OUT → Gary Carter IN (stamina_rule2)

[04:39] Substitution (Team_097): Jrue Haliburton OUT → Dwyane Ginobili IN (stamina_rule2)

[04:39] Substitution (Team_097): Shai Poole OUT → Miles Dosunmu IN (stamina_rule2)

[04:39] Substitution (Team_097): Anthony Haliburton OUT → Joel Simons IN (stamina_rule2)

[04:39] Substitution (Team_097): Tyrese Stewart OUT → Miles Banchero IN (stamina_rule2)

[04:39] Substitution (Team_087): Allen Mitchell OUT → Wendell Haliburton IN (stamina_rule2)

[04:39] Substitution (Team_087): Jimmy Ming OUT → Ben Lillard IN (stamina_rule2)

[04:39] Substitution (Team_087): Devin Anunoby OUT → Larry Green IN (stamina_rule2)

[04:39] Substitution (Team_087): Malcolm Embiid OUT → Pau Russell IN (stamina_rule2)

[04:39] Substitution (Team_087): Ben Brogdon OUT → Kristaps Young IN (stamina_rule2)

[04:21] Team_087 possession (Score: 110-89)
Wendell Haliburton makes the Dunk and draws the foul on Dwyane Ginobili! And-1! Wendell Haliburton to the line for 1. [Team fouls: 4] (Dwyane Ginobili: 1 personal fouls)   FT 1/1: MISS Wendell Haliburton makes 0/1 from the line. Offensive rebound by Larry Green! Larry Green kicks it out.
Score: 110-91

[04:11] Team_087 possession (Score: 110-91)
Pau Russell attempts a Layup. Contested by Joel Simons (3.6 feet, ZONE). PAU RUSSELL MAKES IT!
Score: 110-93

[03:54] Team_097 possession (Score: 110-93)
Joel Simons attempts a Midrange. Contested by Pau Russell (5.0 feet, MAN). Joel Simons misses. Rebound secured by Pau Russell.

[03:41] Team_087 possession (Score: 110-93)
Kristaps Young drives, picks up Joel Simons. Help arrives from Dwyane Ginobili! Kristaps Young attempts a Dunk. Contested by Dwyane Ginobili (4.0 feet, MAN). KRISTAPS YOUNG MAKES IT!
Score: 110-95

[03:25] Team_097 possession (Score: 110-95)
Dwyane Ginobili attempts a 3Pt. Contested by Ben Lillard (5.2 feet, MAN). DWYANE GINOBILI MAKES IT! Assist: Miles Dosunmu
Score: 113-95

[03:08] Team_087 possession (Score: 113-95)
Pau Russell attempts a 3Pt. Contested by Joel Simons (3.6 feet, MAN). Pau Russell misses. Rebound secured by Miles Banchero.

[02:50] Team_097 possession (Score: 113-95)
Miles Dosunmu drives to the basket... Miles Dosunmu throws a bad pass out of bounds! TURNOVER! (dead ball)

[02:36] Team_087 possession (Score: 113-95)
FOUL! Reach-in foul on Gary Carter during the drive. [IN THE BONUS! 5 team fouls] Wendell Haliburton to the line for 2 free throws. (Gary Carter: 1 personal fouls)   FT 1/2: GOOD   FT 2/2: MISS Wendell Haliburton makes 1/2 from the line. Rebound secured by Miles Dosunmu.
Score: 113-96

[02:18] Team_097 possession (Score: 113-96)
Miles Dosunmu drives, Larry Green stays with him. Miles Dosunmu attempts a Layup. Contested by Larry Green (4.6 feet, MAN). MILES DOSUNMU MAKES IT! Assist: Miles Banchero
Score: 115-96

[02:06] Team_087 possession (Score: 115-96)
Larry Green attempts a 3Pt. Contested by Miles Dosunmu (4.1 feet, MAN). Larry Green misses. Offensive rebound by Larry Green! Larry Green kicks it out.

[01:53] Team_087 possession (Score: 115-96)
FOUL! Reach-in foul on Joel Simons during the drive. [IN THE BONUS! 6 team fouls] Kristaps Young to the line for 2 free throws. (Joel Simons: 1 personal fouls)   FT 1/2: GOOD   FT 2/2: GOOD Kristaps Young makes 2/2 from the line.
Score: 115-98

[01:41] Team_097 possession (Score: 115-98)
Miles Banchero attempts a 3Pt. Contested by Pau Russell (5.0 feet, ZONE). Miles Banchero misses. FOUL! Loose ball foul on Larry Green during the rebound battle. [Team fouls: 4] No free throws, side out. (Larry Green: 1 personal fouls)

[01:27] Team_097 possession (Score: 115-98)
Joel Simons makes the Midrange and draws the foul on Pau Russell! And-1! Joel Simons to the line for 1. [BONUS: 5 team fouls] (Pau Russell: 1 personal fouls)   FT 1/1: GOOD Joel Simons makes 1/1 from the line.
Score: 118-98

[01:09] Team_087 possession (Score: 118-98)
Ben Lillard makes the Dunk and draws the foul on Joel Simons! And-1! Ben Lillard to the line for 1. [BONUS: 7 team fouls] (Joel Simons: 2 personal fouls)   FT 1/1: GOOD Ben Lillard makes 1/1 from the line.
Score: 118-101

[00:58] Team_097 possession (Score: 118-101)
FOUL! Shooting foul on Kristaps Young. Joel Simons to the line for 2 free throws. [BONUS: 6 team fouls] (Kristaps Young: 1 personal fouls)   FT 1/2: MISS   FT 2/2: GOOD Joel Simons makes 1/2 from the line.
Score: 119-101

[00:46] Team_087 possession (Score: 119-101)
Wendell Haliburton drives and kicks out. Larry Green attempts a 3Pt. Contested by Miles Dosunmu (3.8 feet, MAN). Larry Green misses. Rebound secured by Miles Banchero.

[00:32] Team_097 possession (Score: 119-101)
Miles Dosunmu attempts a Midrange. Contested by Larry Green (4.6 feet, MAN). MILES DOSUNMU MAKES IT! Assist: Joel Simons
Score: 121-101

[00:15] Team_087 possession (Score: 121-101)
Kristaps Young drives to the basket... Kristaps Young loses control! Ball rolls out of bounds! TURNOVER! (dead ball)

[00:01] Team_097 possession (Score: 121-101)
Miles Dosunmu attempts a 3Pt. Contested by Pau Russell (5.3 feet, ZONE). MILES DOSUNMU MAKES IT! Assist: Miles Banchero
Score: 124-101

================================================================================
                              4TH QUARTER COMPLETE                              
================================================================================

4TH QUARTER SCORE: Team_097 29, Team_087 31

BOX SCORE:
================================================================================

Team_097
--------------------------------------------------------------------------------
Player                MIN  PTS  REB  AST  TO      FG   FG%      3P   3P%
--------------------------------------------------------------------------------
Anthony Haliburton     35    8    1    0   0   3/5    60.0     0/0   0.0
Miles Dosunmu          13    7    2    1   0   3/3   100.0     0/0   0.0
Joel Simons            13    4    0    1   0   2/3    66.7     0/0   0.0
Evan Brogdon           35    3    0    1   0   1/5    20.0     0/0   0.0
Dwyane Ginobili        13    3    0    0   0   1/1   100.0     0/0   0.0
Shai Poole             35    2    3    0   0   1/2    50.0     0/0   0.0
Jrue Haliburton        35    2    0    1   0   1/1   100.0     0/0   0.0
Tyrese Stewart         35    0    2    1   0   0/1     0.0     0/0   0.0
Miles Banchero         13    0    2    2   0   0/0     0.0     0/0   0.0

TEAM: FG: 12/21 (57.1%), 3PT: 4/7 (57.1%), REB: 10 (2 off, 8 def), AST: 7, TO: 2
TEAM FOULS: 7 [Team_087 in BONUS]


Team_087
--------------------------------------------------------------------------------
Player                MIN  PTS  REB  AST  TO      FG   FG%      3P   3P%
--------------------------------------------------------------------------------
Malcolm Embiid         35    8    2    1   0   4/5    80.0     0/0   0.0
Devin Anunoby          35    5    3    0   0   2/3    66.7     0/0   0.0
Jimmy Ming             35    4    0    1   0   2/4    50.0     0/0   0.0
Kristaps Young         13    4    0    0   0   2/2   100.0     0/0   0.0
Ben Lillard            13    3    0    0   0   1/1   100.0     0/0   0.0
Pau Russell            13    2    1    0   0   1/2    50.0     0/0   0.0
Ben Brogdon            35    0    3    1   0   0/1     0.0     0/0   0.0
Allen Mitchell         35    0    0    2   0   0/1     0.0     0/0   0.0
Larry Green            13    0    2    0   0   0/0     0.0     0/0   0.0
Wendell Haliburton     13    0    0    0   0   0/2     0.0     0/0   0.0

TEAM: FG: 12/21 (57.1%), 3PT: 0/4 (0.0%), REB: 11 (2 off, 9 def), AST: 5, TO: 1
TEAM FOULS: 6 [Team_097 in BONUS]

================================================================================

================================================================================
                               FULL GAME COMPLETE                               
================================================================================

FINAL SCORE: Team_097 124, Team_087 101

SCORING BY QUARTER:
--------------------------------------------------------------------------------
Team                     Q1     Q2     Q3     Q4    FINAL
--------------------------------------------------------------------------------
Team_097                 31     29     35     29      124
Team_087                 17     28     25     31      101
--------------------------------------------------------------------------------

FULL GAME BOX SCORE:
================================================================================

Team_097
--------------------------------------------------------------------------------
Player                MIN  PTS  REB  AST  TO      FG   FG%      3P   3P%      FT STL BLK
--------------------------------------------------------------------------------
Evan Brogdon           35   20    0    2   2   9/17   52.9   3/6    50.0   4/5     0   0
Jrue Haliburton        35   12    0    5   1   5/5   100.0   2/2   100.0   0/0     0   1
Shai Poole             35   14   11    4   1   7/13   53.8   1/4    25.0   3/4     0   1
Anthony Haliburton     35   24   14    3   0   7/12   58.3   1/2    50.0   3/3     2   1
Tyrese Stewart         35   18   15    3   1   7/11   63.6   1/1   100.0   8/9     0   0
Gary Carter            13    6    0    2   0   2/4    50.0   1/2    50.0   1/1     0   0
Dwyane Ginobili        13    6    0    0   0   2/3    66.7   2/3    66.7   0/0     0   0
Miles Dosunmu          13    9    6    1   2   4/6    66.7   1/2    50.0   2/2     0   0
Joel Simons            13    6    4    4   0   3/5    60.0   0/0     0.0   2/3     0   0
Miles Banchero         13    8    7    2   0   4/4   100.0   0/0     0.0   0/0     0   0

TEAM: FG: 52/83 (62.7%), 3PT: 12/22 (54.5%), REB: 56 (13 off, 43 def), AST: 26, TO: 7


Team_087
--------------------------------------------------------------------------------
Player                MIN  PTS  REB  AST  TO      FG   FG%      3P   3P%      FT STL BLK
--------------------------------------------------------------------------------
Allen Mitchell         35    8    0    3   0   5/7    71.4   1/2    50.0   1/1     0   0
Jimmy Ming             35   12    0    1   1   5/15   33.3   2/7    28.6   0/1     0   0
Devin Anunoby          35   17   12    1   0   6/15   40.0   2/8    25.0   8/11    0   0
Malcolm Embiid         35   21   12    1   2   7/14   50.0   1/2    50.0   5/8     0   3
Ben Brogdon            35    2    7    6   1   2/8    25.0   1/3    33.3   2/3     0   0
Wendell Haliburton     13    3    0    0   0   1/6    16.7   1/3    33.3   1/3     0   1
Ben Lillard            13    6    0    1   1   2/2   100.0   1/1   100.0   1/1     0   0
Larry Green            13    2    6    1   0   1/3    33.3   0/2     0.0   2/2     0   0
Pau Russell            13    6    2    1   0   3/6    50.0   0/2     0.0   2/3     1   0
Kristaps Young         13   10    3    1   1   4/5    80.0   1/1   100.0   3/3     0   0

TEAM: FG: 37/82 (45.1%), 3PT: 10/31 (32.3%), REB: 41 (12 off, 29 def), AST: 16, TO: 6

================================================================================
