================================================================================
                        FULL GAME - Team_036 vs Team_002                        
================================================================================

================================================================================
                       1ST QUARTER - Team_036 vs Team_002                       
================================================================================

[12:00] Team_036 possession (Score: 0-0)
Kobe Simmons attempts a Dunk. BLOCKED BY TYLER PORZINGIS! Ball is loose! Rebound secured by Carmelo Lowry.

[11:44] Team_002 possession (Score: 0-0)
Tyler Porzingis attempts a Midrange. Contested by Kobe Simmons (3.7 feet, MAN). Tyler Porzingis misses. Rebound secured by Kobe Simmons.

[11:29] Team_036 possession (Score: 0-0)
Terry Durant attempts a 3Pt. Contested by CJ Barrett (4.4 feet, ZONE). TERRY DURANT MAKES IT! Assist: Michael Westbrook
Score: 3-0

[11:14] Team_002 possession (Score: 3-0)
Miles Bane attempts a Midrange. Contested by Anthony Poole (4.8 feet, ZONE). Miles Bane misses. FOUL! Loose ball foul on Kobe Simmons during the rebound battle. [Team fouls: 1] No free throws, side out. (Kobe Simmons: 1 personal fouls)

[10:58] Team_002 possession (Score: 3-0)
CJ Barrett drives and kicks out. Jordan Green attempts a 3Pt. Contested by Anthony Poole (4.9 feet, MAN). JORDAN GREEN MAKES IT! Assist: Miles Bane
Score: 3-3

[10:46] Team_036 possession (Score: 3-3)
Terry Durant attempts a Midrange. Contested by Jordan Green (4.8 feet, ZONE). TERRY DURANT MAKES IT! Assist: Kobe Simmons
Score: 5-3

[10:32] Team_002 possession (Score: 5-3)
Jordan Green makes the Layup and draws the foul on Anthony Poole! And-1! Jordan Green to the line for 1. [Team fouls: 2] (Anthony Poole: 1 personal fouls)   FT 1/1: GOOD Jordan Green makes 1/1 from the line.
Score: 5-6

[10:16] Team_036 possession (Score: 5-6)
Kobe Simmons attempts a Midrange. Contested by CJ Barrett (4.3 feet, ZONE). KOBE SIMMONS MAKES IT!
Score: 7-6

[09:58] Team_002 possession (Score: 7-6)
FOUL! Reach-in foul on Terry Durant during the drive. [Team fouls: 3] No free throws, side out. (Terry Durant: 1 personal fouls)

[09:40] Team_002 possession (Score: 7-6)
CJ Barrett attempts a 3Pt. Contested by Michael Westbrook (5.0 feet, ZONE). CJ BARRETT MAKES IT! Assist: Tyler Porzingis
Score: 7-9

[09:27] Team_036 possession (Score: 7-9)
Anthony Poole attempts a Layup. Contested by Jordan Green (5.1 feet, MAN). ANTHONY POOLE MAKES IT! Assist: Giannis Booker
Score: 9-9

[09:12] Team_002 possession (Score: 9-9)
CJ Barrett makes the Layup and draws the foul on Giannis Booker! And-1! CJ Barrett to the line for 1. [Team fouls: 4] (Giannis Booker: 1 personal fouls)   FT 1/1: GOOD CJ Barrett makes 1/1 from the line.
Score: 9-12

[08:58] Team_036 possession (Score: 9-12)
Giannis Booker attempts a 3Pt. Contested by CJ Barrett (4.3 feet, ZONE). Giannis Booker misses. Rebound secured by Tyler Porzingis.

[08:43] Team_002 possession (Score: 9-12)
Miles Bane attempts a 3Pt. Contested by Michael Westbrook (4.6 feet, MAN). Miles Bane misses. Rebound secured by Kobe Simmons.

[08:27] Team_036 possession (Score: 9-12)
Michael Westbrook drives to the basket... FOUL! Offensive foul on Michael Westbrook! Miles Bane drew the charge! [Team fouls: 5] (Michael Westbrook: 1 personal fouls) TURNOVER! (dead ball)

[08:11] Team_002 possession (Score: 9-12)
Carmelo Lowry attempts a 3Pt. Contested by Giannis Booker (4.5 feet, ZONE). Carmelo Lowry misses. Rebound secured by Terry Durant.

[07:57] Team_036 possession (Score: 9-12)
Giannis Booker attempts a 3Pt. Contested by CJ Barrett (4.3 feet, ZONE). GIANNIS BOOKER MAKES IT! Assist: Michael Westbrook
Score: 12-12

[07:44] Team_002 possession (Score: 12-12)
Tyler Porzingis attempts a 3Pt. Contested by Michael Westbrook (4.9 feet, ZONE). Tyler Porzingis misses. Rebound secured by Kobe Simmons.

[07:31] Team_036 possession (Score: 12-12)
FOUL! Shooting foul on Tyler Porzingis. Michael Westbrook to the line for 2 free throws. [Team fouls: 1] (Tyler Porzingis: 1 personal fouls)   FT 1/2: GOOD   FT 2/2: GOOD Michael Westbrook makes 2/2 from the line.
Score: 14-12

[07:15] Team_002 possession (Score: 14-12)
Tyler Porzingis attempts a 3Pt. Contested by Michael Westbrook (4.9 feet, ZONE). Tyler Porzingis misses. Rebound secured by Giannis Booker.

[07:00] Team_036 possession (Score: 14-12)
Terry Durant attempts a 3Pt. Contested by CJ Barrett (4.4 feet, ZONE). Terry Durant misses. Rebound secured by Tyler Porzingis.

[06:41] Team_002 possession (Score: 14-12)
Jordan Green attempts a 3Pt. Contested by Michael Westbrook (5.5 feet, ZONE). Jordan Green misses. Rebound secured by Terry Durant.

[06:28] Team_036 possession (Score: 14-12)
FOUL! Holding foul on CJ Barrett. [Team fouls: 2] No free throws, side out. (CJ Barrett: 1 personal fouls)

[06:15] Team_036 possession (Score: 14-12)
FOUL! Shooting foul on CJ Barrett. Terry Durant to the line for 2 free throws. [Team fouls: 3] (CJ Barrett: 2 personal fouls)   FT 1/2: MISS   FT 2/2: GOOD Terry Durant makes 1/2 from the line.
Score: 15-12

[05:57] Team_002 possession (Score: 15-12)
Miles Bane attempts a 3Pt. Contested by Michael Westbrook (4.6 feet, ZONE). MILES BANE MAKES IT! Assist: Tyler Porzingis
Score: 15-15

[05:44] Team_036 possession (Score: 15-15)
Kobe Simmons attempts a Layup. Contested by Tyler Porzingis (3.5 feet, ZONE). Kobe Simmons misses. Rebound secured by Miles Bane.

[05:28] Team_002 possession (Score: 15-15)
CJ Barrett attempts a 3Pt. Contested by Michael Westbrook (5.0 feet, ZONE). CJ BARRETT MAKES IT! Assist: Miles Bane
Score: 15-18

[05:11] Team_036 possession (Score: 15-18)
FOUL! Reach-in foul on Tyler Porzingis during the drive. [Team fouls: 4] No free throws, side out. (Tyler Porzingis: 2 personal fouls)

[04:57] Team_036 possession (Score: 15-18)
Giannis Booker attempts a 3Pt. Contested by CJ Barrett (4.3 feet, ZONE). Giannis Booker misses. Rebound secured by Tyler Porzingis.

[04:43] Team_002 possession (Score: 15-18)
CJ Barrett makes the Layup and draws the foul on Giannis Booker! And-1! CJ Barrett to the line for 1. [BONUS: 6 team fouls] (Giannis Booker: 2 personal fouls)   FT 1/1: GOOD CJ Barrett makes 1/1 from the line.
Score: 15-21

[04:24] Team_036 possession (Score: 15-21)
Giannis Booker attempts a 3Pt. Contested by CJ Barrett (4.3 feet, ZONE). Giannis Booker misses. Offensive rebound by Terry Durant! Terry Durant puts it back in!
Score: 17-21

[04:11] Team_002 possession (Score: 17-21)
Tyler Porzingis drives, Kobe Simmons stays with him. Tyler Porzingis attempts a Dunk. Contested by Kobe Simmons (3.8 feet, MAN). TYLER PORZINGIS MAKES IT!
Score: 17-23

[03:57] Team_036 possession (Score: 17-23)
FOUL! Shooting foul on Jordan Green. Anthony Poole to the line for 2 free throws. [BONUS: 5 team fouls] (Jordan Green: 1 personal fouls)   FT 1/2: MISS   FT 2/2: GOOD Anthony Poole makes 1/2 from the line.
Score: 18-23

[03:45] Team_002 possession (Score: 18-23)
Miles Bane drives, picks up Kobe Simmons. Help arrives from Giannis Booker! Miles Bane attempts a Dunk. Contested by Giannis Booker (3.5 feet, ZONE). MILES BANE MAKES IT! Assist: Tyler Porzingis
Score: 18-25

[03:33] Team_036 possession (Score: 18-25)
Terry Durant drives and kicks out. Giannis Booker attempts a 3Pt. Contested by CJ Barrett (4.0 feet, ZONE). Giannis Booker misses. Rebound secured by Tyler Porzingis.

[03:15] Team_002 possession (Score: 18-25)
FOUL! Shooting foul on Michael Westbrook. Miles Bane to the line for 3 free throws. [BONUS: 7 team fouls] (Michael Westbrook: 2 personal fouls)   FT 1/3: GOOD   FT 2/3: MISS   FT 3/3: GOOD Miles Bane makes 2/3 from the line.
Score: 18-27

[02:56] Team_036 possession (Score: 18-27)
Michael Westbrook drives and kicks out. Michael Westbrook makes the Midrange and draws the foul on Miles Bane! And-1! Michael Westbrook to the line for 1. [BONUS: 6 team fouls] (Miles Bane: 1 personal fouls)   FT 1/1: GOOD Michael Westbrook makes 1/1 from the line.
Score: 21-27

[02:41] Team_002 possession (Score: 21-27)
CJ Barrett attempts a Midrange. Contested by Giannis Booker (5.0 feet, MAN). CJ Barrett misses. Offensive rebound by Carmelo Lowry! Carmelo Lowry kicks it out.

[02:28] Team_002 possession (Score: 21-27)
Tyler Porzingis drives and kicks out. Carmelo Lowry attempts a Midrange. Contested by Terry Durant (4.7 feet, MAN). Carmelo Lowry misses. Rebound secured by Giannis Booker.

[02:13] Team_036 possession (Score: 21-27)
Anthony Poole drives, picks up Jordan Green. Help arrives from CJ Barrett! Anthony Poole attempts a Layup. Contested by CJ Barrett (5.3 feet, MAN). Anthony Poole misses. Offensive rebound by Kobe Simmons! Kobe Simmons puts it back in!
Score: 23-27

[02:01] Team_002 possession (Score: 23-27)
CJ Barrett attempts a 3Pt. Contested by Giannis Booker (5.1 feet, MAN). CJ Barrett misses. Rebound secured by Giannis Booker.

[01:45] Team_036 possession (Score: 23-27)
Kobe Simmons attempts a Midrange. Contested by Tyler Porzingis (3.8 feet, MAN). KOBE SIMMONS MAKES IT! Assist: Terry Durant
Score: 25-27

[01:27] Team_002 possession (Score: 25-27)
Carmelo Lowry drives, Kobe Simmons stays with him. Carmelo Lowry attempts a Dunk. Contested by Kobe Simmons (3.7 feet, ZONE). CARMELO LOWRY MAKES IT!
Score: 25-29

[01:12] Team_036 possession (Score: 25-29)
Anthony Poole drives and kicks out. Terry Durant attempts a Midrange. Contested by CJ Barrett (4.3 feet, ZONE). TERRY DURANT MAKES IT! Assist: Kobe Simmons
Score: 27-29

[00:56] Team_002 possession (Score: 27-29)
FOUL! Holding foul on Michael Westbrook. [IN THE BONUS! 8 team fouls] Miles Bane to the line for 2 free throws. (Michael Westbrook: 3 personal fouls)   FT 1/2: GOOD   FT 2/2: GOOD Miles Bane makes 2/2 from the line.
Score: 27-31

[00:37] Team_036 possession (Score: 27-31)
Giannis Booker attempts a Midrange. Contested by Miles Bane (5.0 feet, ZONE). GIANNIS BOOKER MAKES IT! Assist: Kobe Simmons
Score: 29-31

[00:21] Team_002 possession (Score: 29-31)
Miles Bane attempts a 3Pt. Contested by Michael Westbrook (5.0 feet, MAN). Miles Bane misses. Rebound secured by Giannis Booker.

[00:03] Team_036 possession (Score: 29-31)
Michael Westbrook drives, Tyler Porzingis stays with him. Michael Westbrook attempts a Dunk. Contested by Tyler Porzingis (4.1 feet, ZONE). MICHAEL WESTBROOK MAKES IT! Assist: Anthony Poole
Score: 31-31

================================================================================
                              1ST QUARTER COMPLETE                              
================================================================================

1ST QUARTER SCORE: Team_036 31, Team_002 31

BOX SCORE:
================================================================================

Team_036
--------------------------------------------------------------------------------
Player                MIN  PTS  REB  AST  TO      FG   FG%      3P   3P%
--------------------------------------------------------------------------------
Terry Durant           12   10    3    1   0   5/7    71.4     0/0   0.0
Michael Westbrook      12    7    0    2   0   3/3   100.0     0/0   0.0
Kobe Simmons           12    6    4    3   0   3/5    60.0     0/0   0.0
Giannis Booker         12    5    4    1   0   2/4    50.0     0/0   0.0
Anthony Poole          12    3    0    1   0   2/2   100.0     0/0   0.0

TEAM: FG: 15/21 (71.4%), 3PT: 3/6 (50.0%), REB: 11 (2 off, 9 def), AST: 8, TO: 1
TEAM FOULS: 8 [Team_002 in BONUS]


Team_002
--------------------------------------------------------------------------------
Player                MIN  PTS  REB  AST  TO      FG   FG%      3P   3P%
--------------------------------------------------------------------------------
CJ Barrett             12   12    0    0   0   4/5    80.0     0/0   0.0
Miles Bane             12    9    1    2   0   4/6    66.7     0/0   0.0
Jordan Green           12    6    0    0   0   2/3    66.7     0/0   0.0
Carmelo Lowry          12    2    2    0   0   1/2    50.0     0/0   0.0
Tyler Porzingis        12    2    5    3   0   1/5    20.0     0/0   0.0

TEAM: FG: 12/21 (57.1%), 3PT: 4/11 (36.4%), REB: 8 (2 off, 6 def), AST: 5, TO: 0
TEAM FOULS: 6 [Team_036 in BONUS]

================================================================================

================================================================================
                       2ND QUARTER - Team_036 vs Team_002                       
================================================================================

[12:00] Team_036 possession (Score: 31-31)
FOUL! Offensive foul on Kobe Simmons! Tyler Porzingis drew the charge! [Team fouls: 1] (Kobe Simmons: 1 personal fouls) TURNOVER! (dead ball)

[11:45] Team_002 possession (Score: 31-31)
Tyler Porzingis attempts a Layup. Contested by Kobe Simmons (4.0 feet, MAN). TYLER PORZINGIS MAKES IT!
Score: 31-33

[11:35] Team_036 possession (Score: 31-33)
Kobe Simmons drives and kicks out. Terry Durant attempts a Midrange. Contested by Carmelo Lowry (4.2 feet, ZONE). Terry Durant misses. Rebound secured by Carmelo Lowry.

[11:21] Team_002 possession (Score: 31-33)
CJ Barrett drives, Giannis Booker stays with him. CJ Barrett attempts a Dunk. Contested by Giannis Booker (5.1 feet, MAN). CJ BARRETT MAKES IT! Assist: Jordan Green
Score: 31-35

[11:04] Team_036 possession (Score: 31-35)
Anthony Poole drives and kicks out. Giannis Booker attempts a Midrange. Contested by Carmelo Lowry (4.3 feet, ZONE). Giannis Booker misses. Rebound secured by Tyler Porzingis.

[10:46] Team_002 possession (Score: 31-35)
Miles Bane attempts a Midrange. Contested by Michael Westbrook (4.9 feet, MAN). Miles Bane misses. Rebound secured by Kobe Simmons.

[10:30] Team_036 possession (Score: 31-35)
Terry Durant attempts a Dunk. BLOCKED BY CJ BARRETT! Ball deflects out of bounds off Terry Durant.

[10:14] Team_002 possession (Score: 31-35)
Jordan Green attempts a 3Pt. Contested by Michael Westbrook (5.8 feet, ZONE). Jordan Green misses. Rebound secured by Terry Durant.

[10:02] Team_036 possession (Score: 31-35)
Anthony Poole attempts a Midrange. Contested by Jordan Green (5.5 feet, MAN). ANTHONY POOLE MAKES IT!
Score: 33-35

[09:48] Team_002 possession (Score: 33-35)
Carmelo Lowry drives, Kobe Simmons stays with him. Carmelo Lowry attempts a Layup. Contested by Kobe Simmons (4.0 feet, ZONE). CARMELO LOWRY MAKES IT! Assist: Miles Bane
Score: 33-37

[09:33] Team_036 possession (Score: 33-37)
Anthony Poole attempts a 3Pt. Contested by Jordan Green (5.5 feet, MAN). Anthony Poole misses. Rebound secured by Tyler Porzingis.

[09:21] Team_002 possession (Score: 33-37)
Miles Bane attempts a 3Pt. Contested by Michael Westbrook (5.1 feet, MAN). Miles Bane misses. FOUL! Loose ball foul on Kobe Simmons during the rebound battle. [Team fouls: 2] No free throws, side out. (Kobe Simmons: 2 personal fouls)

[09:08] Team_002 possession (Score: 33-37)
CJ Barrett attempts a Midrange. Contested by Giannis Booker (5.3 feet, MAN). CJ Barrett misses. Rebound secured by Giannis Booker.

[08:57] Team_036 possession (Score: 33-37)
Michael Westbrook attempts a Midrange. Contested by Miles Bane (5.3 feet, MAN). MICHAEL WESTBROOK MAKES IT! Assist: Giannis Booker
Score: 35-37

[08:42] Team_002 possession (Score: 35-37)
CJ Barrett commits a violation (traveling/carry)! TURNOVER! (dead ball)

[08:42] Substitution (Team_036): Michael Westbrook OUT → Dirk Anunoby IN (stamina_rule2)

[08:42] Substitution (Team_036): Giannis Booker OUT → Tobias Fox IN (stamina_rule2)

[08:42] Substitution (Team_036): Anthony Poole OUT → Pascal Antetokounmpo IN (stamina_rule2)

[08:42] Substitution (Team_036): Terry Durant OUT → Devin Simmons IN (stamina_rule2)

[08:42] Substitution (Team_036): Kobe Simmons OUT → Bradley Murray IN (stamina_rule2)

[08:42] Substitution (Team_002): Miles Bane OUT → John Duncan IN (stamina_rule2)

[08:42] Substitution (Team_002): CJ Barrett OUT → Dirk Middleton IN (stamina_rule2)

[08:42] Substitution (Team_002): Jordan Green OUT → Anfernee Sexton IN (stamina_rule2)

[08:42] Substitution (Team_002): Carmelo Lowry OUT → Julius Curry IN (stamina_rule2)

[08:42] Substitution (Team_002): Tyler Porzingis OUT → Lamelo O'Neal IN (stamina_rule2)

[08:33] Team_036 possession (Score: 35-37)
Tobias Fox attempts a Layup. Contested by Lamelo O'Neal (4.0 feet, ZONE). TOBIAS FOX MAKES IT! Assist: Devin Simmons
Score: 37-37

[08:18] Team_002 possession (Score: 37-37)
FOUL! Shooting foul on Devin Simmons. Julius Curry to the line for 2 free throws. [Team fouls: 3] (Devin Simmons: 1 personal fouls)   FT 1/2: GOOD   FT 2/2: GOOD Julius Curry makes 2/2 from the line.
Score: 37-39

[08:01] Team_036 possession (Score: 37-39)
Dirk Anunoby attempts a Midrange. Wide open! Dirk Middleton is 6.0 feet away. [ZONE] Dirk Anunoby misses. Rebound secured by Lamelo O'Neal.

[07:48] Team_002 possession (Score: 37-39)
Dirk Middleton throws a bad pass! Stolen by Tobias Fox! TURNOVER! (live ball)

[07:33] Team_036 possession (Score: 37-39)
Tobias Fox attempts a 3Pt. Contested by Julius Curry (5.7 feet, ZONE). Tobias Fox misses. Offensive rebound by Devin Simmons! Devin Simmons kicks it out.

[07:22] Team_036 possession (Score: 37-39)
Bradley Murray attempts a Midrange. Contested by Dirk Middleton (5.5 feet, ZONE). BRADLEY MURRAY MAKES IT!
Score: 39-39

[07:09] Team_002 possession (Score: 39-39)
Dirk Middleton attempts a 3Pt. Contested by Tobias Fox (4.7 feet, ZONE). Dirk Middleton misses. Rebound secured by Devin Simmons.

[06:58] Team_036 possession (Score: 39-39)
Bradley Murray attempts a 3Pt. Contested by Julius Curry (5.2 feet, ZONE). Bradley Murray misses. Rebound secured by Lamelo O'Neal.

[06:45] Team_002 possession (Score: 39-39)
Julius Curry attempts a Midrange. Contested by Devin Simmons (5.1 feet, MAN). JULIUS CURRY MAKES IT! Assist: Lamelo O'Neal
Score: 39-41

[06:30] Team_036 possession (Score: 39-41)
Tobias Fox attempts a Layup. Contested by Dirk Middleton (6.0 feet, MAN). TOBIAS FOX MAKES IT! Assist: Dirk Anunoby
Score: 41-41

[06:18] Team_002 possession (Score: 41-41)
Lamelo O'Neal attempts a Midrange. Contested by Devin Simmons (5.5 feet, ZONE). LAMELO O'NEAL MAKES IT! Assist: Anfernee Sexton
Score: 41-43

[06:02] Team_036 possession (Score: 41-43)
Devin Simmons attempts a Layup. BLOCKED BY LAMELO O'NEAL! Ball is loose! Offensive rebound by Bradley Murray! Bradley Murray kicks it out.

[05:46] Team_036 possession (Score: 41-43)
Pascal Antetokounmpo attempts a 3Pt. Contested by Julius Curry (5.6 feet, ZONE). PASCAL ANTETOKOUNMPO MAKES IT! Assist: Bradley Murray
Score: 44-43

[05:37] Team_002 possession (Score: 44-43)
FOUL! Shooting foul on Devin Simmons. Julius Curry to the line for 2 free throws. [Team fouls: 4] (Devin Simmons: 2 personal fouls)   FT 1/2: GOOD   FT 2/2: GOOD Julius Curry makes 2/2 from the line.
Score: 44-45

[05:25] Team_036 possession (Score: 44-45)
FOUL! Holding foul on Lamelo O'Neal. [Team fouls: 1] No free throws, side out. (Lamelo O'Neal: 1 personal fouls)

[05:11] Team_036 possession (Score: 44-45)
Pascal Antetokounmpo drives to the basket... Pascal Antetokounmpo loses the ball! Stripped by Anfernee Sexton! TURNOVER! (live ball)

[04:57] Team_002 possession (Score: 44-45)
John Duncan drives to the basket... FOUL! Offensive foul on John Duncan! Devin Simmons drew the charge! [Team fouls: 2] (John Duncan: 1 personal fouls) TURNOVER! (dead ball)

[04:42] Team_036 possession (Score: 44-45)
Tobias Fox drives and kicks out. Devin Simmons attempts a 3Pt. Contested by Julius Curry (5.3 feet, ZONE). Devin Simmons misses. Rebound secured by Anfernee Sexton.

[04:28] Team_002 possession (Score: 44-45)
Dirk Middleton attempts a 3Pt. Contested by Tobias Fox (4.7 feet, MAN). DIRK MIDDLETON MAKES IT! Assist: Lamelo O'Neal
Score: 44-48

[04:10] Team_036 possession (Score: 44-48)
Pascal Antetokounmpo attempts a Layup. BLOCKED BY ANFERNEE SEXTON! Ball goes out off Anfernee Sexton. Pascal Antetokounmpo's ball!

[03:52] Team_036 possession (Score: 44-48)
FOUL! Shooting foul on Julius Curry. Pascal Antetokounmpo to the line for 3 free throws. [Team fouls: 3] (Julius Curry: 1 personal fouls)   FT 1/3: MISS   FT 2/3: GOOD   FT 3/3: GOOD Pascal Antetokounmpo makes 2/3 from the line.
Score: 46-48

[03:37] Team_002 possession (Score: 46-48)
Dirk Middleton attempts a 3Pt. Contested by Tobias Fox (4.7 feet, ZONE). Dirk Middleton misses. Rebound secured by Bradley Murray.

[03:22] Team_036 possession (Score: 46-48)
Devin Simmons attempts a Layup. Contested by Julius Curry (5.4 feet, ZONE). Devin Simmons misses. Rebound secured by Anfernee Sexton.

[03:08] Team_002 possession (Score: 46-48)
FOUL! Holding foul on Dirk Anunoby. [IN THE BONUS! 5 team fouls] John Duncan to the line for 2 free throws. (Dirk Anunoby: 1 personal fouls)   FT 1/2: GOOD   FT 2/2: MISS John Duncan makes 1/2 from the line. Offensive rebound by Anfernee Sexton! Anfernee Sexton kicks it out.
Score: 46-49

[02:52] Team_002 possession (Score: 46-49)
FOUL! Shooting foul on Pascal Antetokounmpo. Anfernee Sexton to the line for 2 free throws. [BONUS: 6 team fouls] (Pascal Antetokounmpo: 1 personal fouls)   FT 1/2: GOOD   FT 2/2: GOOD Anfernee Sexton makes 2/2 from the line.
Score: 46-51

[02:38] Team_036 possession (Score: 46-51)
FOUL! Shooting foul on Lamelo O'Neal. Bradley Murray to the line for 2 free throws. [Team fouls: 4] (Lamelo O'Neal: 2 personal fouls)   FT 1/2: GOOD   FT 2/2: GOOD Bradley Murray makes 2/2 from the line.
Score: 48-51

[02:25] Team_002 possession (Score: 48-51)
Lamelo O'Neal drives to the basket... Lamelo O'Neal commits a violation (traveling/carry)! TURNOVER! (dead ball)

[02:15] Team_036 possession (Score: 48-51)
Tobias Fox drives and kicks out. Bradley Murray attempts a 3Pt. Contested by Julius Curry (5.3 feet, ZONE). Bradley Murray misses. Rebound secured by Anfernee Sexton.

[01:56] Team_002 possession (Score: 48-51)
John Duncan attempts a Midrange. Contested by Dirk Anunoby (5.4 feet, MAN). John Duncan misses. Rebound secured by Bradley Murray.

[01:43] Team_036 possession (Score: 48-51)
Tobias Fox attempts a Midrange. Wide open! Dirk Middleton is 6.0 feet away. [MAN] Tobias Fox misses. Rebound secured by Julius Curry.

[01:26] Team_002 possession (Score: 48-51)
Lamelo O'Neal attempts a Layup. Contested by Devin Simmons (5.6 feet, ZONE). LAMELO O'NEAL MAKES IT!
Score: 48-53

[01:13] Team_036 possession (Score: 48-53)
Devin Simmons drives and kicks out. Tobias Fox attempts a 3Pt. Contested by Dirk Middleton (5.7 feet, MAN). TOBIAS FOX MAKES IT!
Score: 51-53

[00:54] Team_002 possession (Score: 51-53)
Anfernee Sexton drives, Devin Simmons stays with him. Anfernee Sexton attempts a Layup. Contested by Devin Simmons (5.8 feet, ZONE). ANFERNEE SEXTON MAKES IT! Assist: Lamelo O'Neal
Score: 51-55

[00:41] Team_036 possession (Score: 51-55)
Tobias Fox drives, Dirk Middleton stays with him. Tobias Fox attempts a Dunk. Wide open! Dirk Middleton is 6.1 feet away. [MAN] TOBIAS FOX MAKES IT!
Score: 53-55

[00:27] Team_002 possession (Score: 53-55)
Dirk Middleton attempts a Midrange. Contested by Tobias Fox (4.7 feet, MAN). Dirk Middleton misses. Offensive rebound by Anfernee Sexton! Anfernee Sexton kicks it out.

[00:13] Team_002 possession (Score: 53-55)
Julius Curry makes the Midrange and draws the foul on Devin Simmons! And-1! Julius Curry to the line for 1. [BONUS: 7 team fouls] (Devin Simmons: 3 personal fouls)   FT 1/1: GOOD Julius Curry makes 1/1 from the line.
Score: 53-58

================================================================================
                              2ND QUARTER COMPLETE                              
================================================================================

2ND QUARTER SCORE: Team_036 22, Team_002 27

BOX SCORE:
================================================================================

Team_036
--------------------------------------------------------------------------------
Player                MIN  PTS  REB  AST  TO      FG   FG%      3P   3P%
--------------------------------------------------------------------------------
Tobias Fox              9    9    0    0   0   4/7    57.1     0/0   0.0
Pascal Antetokounmpo    9    5    0    0   0   2/2   100.0     0/0   0.0
Bradley Murray          9    4    3    1   0   2/3    66.7     0/0   0.0
Anthony Poole          16    2    0    0   0   1/3    33.3     0/0   0.0
Michael Westbrook      16    2    0    0   0   1/1   100.0     0/0   0.0
Kobe Simmons           16    0    1    0   0   0/1     0.0     0/0   0.0
Terry Durant           16    0    1    0   0   0/1     0.0     0/0   0.0
Giannis Booker         16    0    1    1   0   0/0     0.0     0/0   0.0
Devin Simmons           9    0    2    1   0   0/1     0.0     0/0   0.0
Dirk Anunoby            9    0    0    1   0   0/1     0.0     0/0   0.0

TEAM: FG: 10/20 (50.0%), 3PT: 2/4 (50.0%), REB: 8 (2 off, 6 def), AST: 4, TO: 2
TEAM FOULS: 7 [Team_002 in BONUS]


Team_002
--------------------------------------------------------------------------------
Player                MIN  PTS  REB  AST  TO      FG   FG%      3P   3P%
--------------------------------------------------------------------------------
Julius Curry            9    9    1    0   0   4/4   100.0     0/0   0.0
Lamelo O'Neal           9    4    2    3   0   2/2   100.0     0/0   0.0
Anfernee Sexton         9    4    5    1   0   2/2   100.0     0/0   0.0
Dirk Middleton          9    3    0    0   0   1/3    33.3     0/0   0.0
Tyler Porzingis        16    2    2    0   0   1/1   100.0     0/0   0.0
Carmelo Lowry          16    2    2    0   0   1/1   100.0     0/0   0.0
CJ Barrett             16    2    0    0   0   1/2    50.0     0/0   0.0
Jordan Green           16    0    0    1   0   0/1     0.0     0/0   0.0
Miles Bane             16    0    0    1   0   0/1     0.0     0/0   0.0
John Duncan             9    0    0    0   0   0/1     0.0     0/0   0.0

TEAM: FG: 12/18 (66.7%), 3PT: 1/4 (25.0%), REB: 12 (3 off, 9 def), AST: 6, TO: 4
TEAM FOULS: 4

================================================================================

================================================================================
                       3RD QUARTER - Team_036 vs Team_002                       
================================================================================

[12:00] Team_036 possession (Score: 53-58)
Giannis Booker drives, picks up CJ Barrett. Help arrives from Miles Bane! Giannis Booker attempts a Layup. Contested by Miles Bane (4.3 feet, MAN). Giannis Booker misses. Rebound secured by Miles Bane.

[11:46] Team_002 possession (Score: 53-58)
Jordan Green attempts a 3Pt. Contested by Anthony Poole (5.7 feet, MAN). Jordan Green misses. Rebound secured by Kobe Simmons.

[11:34] Team_036 possession (Score: 53-58)
Anthony Poole drives and kicks out. Terry Durant attempts a 3Pt. Contested by Carmelo Lowry (3.8 feet, MAN). Terry Durant misses. Rebound secured by Tyler Porzingis.

[11:18] Team_002 possession (Score: 53-58)
CJ Barrett attempts a 3Pt. Contested by Michael Westbrook (5.0 feet, ZONE). CJ BARRETT MAKES IT! Assist: Tyler Porzingis
Score: 53-61

[11:05] Team_036 possession (Score: 53-61)
Kobe Simmons attempts a 3Pt. Contested by Carmelo Lowry (4.2 feet, ZONE). Kobe Simmons misses. Offensive rebound by Kobe Simmons! Kobe Simmons's putback is no good. Rebound secured by Carmelo Lowry.

[10:53] Team_002 possession (Score: 53-61)
CJ Barrett attempts a Layup. Contested by Giannis Booker (4.9 feet, MAN). CJ Barrett misses. Rebound secured by Giannis Booker.

[10:42] Team_036 possession (Score: 53-61)
Giannis Booker drives to the basket... FOUL! Offensive foul on Giannis Booker! CJ Barrett drew the charge! [Team fouls: 1] (Giannis Booker: 1 personal fouls) TURNOVER! (dead ball)

[10:26] Team_002 possession (Score: 53-61)
CJ Barrett attempts a 3Pt. Contested by Michael Westbrook (5.0 feet, ZONE). CJ Barrett misses. Rebound secured by Terry Durant.

[10:12] Team_036 possession (Score: 53-61)
Giannis Booker attempts a 3Pt. Contested by CJ Barrett (4.3 feet, ZONE). Giannis Booker misses. Offensive rebound by Terry Durant! Terry Durant puts it back in!
Score: 55-61

[09:59] Team_002 possession (Score: 55-61)
Jordan Green loses control! Ball rolls out of bounds! TURNOVER! (dead ball)

[09:46] Team_036 possession (Score: 55-61)
Michael Westbrook attempts a 3Pt. Contested by Miles Bane (4.8 feet, MAN). Michael Westbrook misses. Rebound secured by Miles Bane.

[09:29] Team_002 possession (Score: 55-61)
Miles Bane attempts a 3Pt. Contested by Michael Westbrook (4.6 feet, ZONE). Miles Bane misses. Rebound secured by Terry Durant.

[09:14] Team_036 possession (Score: 55-61)
Anthony Poole attempts a 3Pt. Contested by CJ Barrett (4.6 feet, ZONE). Anthony Poole misses. Rebound secured by Miles Bane.

[08:59] Team_002 possession (Score: 55-61)
CJ Barrett attempts a 3Pt. Contested by Giannis Booker (4.9 feet, MAN). CJ Barrett misses. Offensive rebound by Tyler Porzingis! Tyler Porzingis puts it back in!
Score: 55-63

[08:46] Team_036 possession (Score: 55-63)
Terry Durant makes the Layup and draws the foul on Carmelo Lowry! And-1! Terry Durant to the line for 1. [Team fouls: 1] (Carmelo Lowry: 1 personal fouls)   FT 1/1: MISS Terry Durant makes 0/1 from the line. Rebound secured by Carmelo Lowry.
Score: 57-63

[08:32] Team_002 possession (Score: 57-63)
CJ Barrett attempts a Midrange. Contested by Giannis Booker (4.9 feet, ZONE). CJ Barrett misses. Rebound secured by Kobe Simmons.

[08:14] Team_036 possession (Score: 57-63)
Michael Westbrook drives to the basket... Michael Westbrook throws a bad pass! Stolen by Tyler Porzingis! TURNOVER! (live ball)

[08:00] Team_002 possession (Score: 57-63)
Jordan Green attempts a 3Pt. Contested by Anthony Poole (5.7 feet, MAN). JORDAN GREEN MAKES IT! Assist: Miles Bane
Score: 57-66

[07:41] Team_036 possession (Score: 57-66)
FOUL! Reach-in foul on Jordan Green during the drive. [Team fouls: 2] No free throws, side out. (Jordan Green: 1 personal fouls)

[07:23] Team_036 possession (Score: 57-66)
FOUL! Holding foul on Miles Bane. [Team fouls: 3] No free throws, side out. (Miles Bane: 1 personal fouls)

[07:08] Team_036 possession (Score: 57-66)
Anthony Poole makes the Midrange and draws the foul on CJ Barrett! And-1! Anthony Poole to the line for 1. [Team fouls: 4] (CJ Barrett: 1 personal fouls)   FT 1/1: GOOD Anthony Poole makes 1/1 from the line.
Score: 60-66

[06:56] Team_002 possession (Score: 60-66)
Carmelo Lowry loses the ball! Stripped by Terry Durant! TURNOVER! (live ball)

[06:47] Team_036 possession (Score: 60-66)
Anthony Poole attempts a Layup. Contested by Tyler Porzingis (3.8 feet, ZONE). ANTHONY POOLE MAKES IT! Assist: Michael Westbrook
Score: 62-66

[06:34] Team_002 possession (Score: 62-66)
Jordan Green drives, Kobe Simmons stays with him. Jordan Green attempts a Dunk. Contested by Kobe Simmons (4.3 feet, ZONE). JORDAN GREEN MAKES IT! Assist: Tyler Porzingis
Score: 62-68

[06:19] Team_036 possession (Score: 62-68)
Kobe Simmons drives, Tyler Porzingis stays with him. Kobe Simmons attempts a Layup. Contested by Tyler Porzingis (3.5 feet, MAN). KOBE SIMMONS MAKES IT!
Score: 64-68

[06:05] Team_002 possession (Score: 64-68)
Jordan Green attempts a 3Pt. Contested by Michael Westbrook (5.5 feet, ZONE). Jordan Green misses. Rebound secured by Giannis Booker.

[05:51] Team_036 possession (Score: 64-68)
Anthony Poole attempts a 3Pt. Contested by Jordan Green (5.1 feet, MAN). Anthony Poole misses. Offensive rebound by Kobe Simmons! Kobe Simmons puts it back in!
Score: 66-68

[05:37] Team_002 possession (Score: 66-68)
Carmelo Lowry attempts a Midrange. Contested by Terry Durant (4.4 feet, MAN). Carmelo Lowry misses. Rebound secured by Terry Durant.

[05:23] Team_036 possession (Score: 66-68)
Giannis Booker attempts a 3Pt. Contested by CJ Barrett (4.3 feet, MAN). Giannis Booker misses. Rebound secured by Tyler Porzingis.

[05:06] Team_002 possession (Score: 66-68)
Jordan Green attempts a Layup. Contested by Anthony Poole (5.7 feet, MAN). Jordan Green misses. Rebound secured by Terry Durant.

[04:51] Team_036 possession (Score: 66-68)
Giannis Booker drives and kicks out. Terry Durant attempts a Midrange. Contested by Jordan Green (4.4 feet, ZONE). Terry Durant misses. Rebound secured by Miles Bane.

[04:37] Team_002 possession (Score: 66-68)
Miles Bane drives, Michael Westbrook stays with him. Miles Bane attempts a Layup. Contested by Michael Westbrook (4.6 feet, MAN). Miles Bane misses. Rebound secured by Terry Durant.

[04:24] Team_036 possession (Score: 66-68)
Giannis Booker drives and kicks out. Anthony Poole attempts a Midrange. Contested by Jordan Green (4.4 feet, MAN). Anthony Poole misses. Offensive rebound by Terry Durant! Terry Durant puts it back in!
Score: 68-68

[04:13] Team_002 possession (Score: 68-68)
CJ Barrett attempts a Layup. Contested by Kobe Simmons (3.9 feet, ZONE). CJ BARRETT MAKES IT!
Score: 68-70

[03:59] Team_036 possession (Score: 68-70)
Giannis Booker attempts a 3Pt. Contested by CJ Barrett (4.4 feet, ZONE). Giannis Booker misses. Rebound secured by Carmelo Lowry.

[03:45] Team_002 possession (Score: 68-70)
CJ Barrett drives and kicks out. Carmelo Lowry attempts a Midrange. Contested by Giannis Booker (4.7 feet, ZONE). Carmelo Lowry misses. Offensive rebound by Tyler Porzingis! Tyler Porzingis puts it back in!
Score: 68-72

[03:33] Team_036 possession (Score: 68-72)
Kobe Simmons drives, Tyler Porzingis stays with him. Kobe Simmons attempts a Dunk. Contested by Tyler Porzingis (3.7 feet, ZONE). KOBE SIMMONS MAKES IT! Assist: Terry Durant
Score: 70-72

[03:17] Team_002 possession (Score: 70-72)
CJ Barrett attempts a Midrange. Contested by Giannis Booker (5.0 feet, MAN). CJ Barrett misses. Rebound secured by Kobe Simmons.

[03:03] Team_036 possession (Score: 70-72)
Giannis Booker attempts a 3Pt. Contested by CJ Barrett (4.5 feet, MAN). GIANNIS BOOKER MAKES IT! Assist: Kobe Simmons
Score: 73-72

[02:50] Team_002 possession (Score: 73-72)
Carmelo Lowry makes the Layup and draws the foul on Giannis Booker! And-1! Carmelo Lowry to the line for 1. [Team fouls: 2] (Giannis Booker: 2 personal fouls)   FT 1/1: GOOD Carmelo Lowry makes 1/1 from the line.
Score: 73-75

[02:33] Team_036 possession (Score: 73-75)
Michael Westbrook throws a bad pass out of bounds! TURNOVER! (dead ball)

[02:33] Substitution (Team_036): Michael Westbrook OUT → Dirk Anunoby IN (stamina_rule2)

[02:33] Substitution (Team_036): Terry Durant OUT → Devin Simmons IN (stamina_rule2)

[02:33] Substitution (Team_036): Kobe Simmons OUT → Bradley Murray IN (stamina_rule2)

[02:33] Substitution (Team_002): CJ Barrett OUT → Dirk Middleton IN (stamina_rule2)

[02:33] Substitution (Team_002): Carmelo Lowry OUT → Julius Curry IN (stamina_rule2)

[02:33] Substitution (Team_002): Tyler Porzingis OUT → Lamelo O'Neal IN (stamina_rule2)

[02:24] Team_002 possession (Score: 73-75)
Lamelo O'Neal attempts a Layup. Contested by Devin Simmons (5.5 feet, ZONE). Lamelo O'Neal misses. Rebound secured by Devin Simmons.

[02:11] Team_036 possession (Score: 73-75)
FOUL! Holding foul on Dirk Middleton. [IN THE BONUS! 5 team fouls] Giannis Booker to the line for 2 free throws. (Dirk Middleton: 1 personal fouls)   FT 1/2: MISS   FT 2/2: GOOD Giannis Booker makes 1/2 from the line.
Score: 74-75

[01:58] Team_002 possession (Score: 74-75)
Julius Curry attempts a 3Pt. Contested by Giannis Booker (4.7 feet, ZONE). Julius Curry misses. Offensive rebound by Lamelo O'Neal! Lamelo O'Neal puts it back in!
Score: 74-77

[01:45] Team_036 possession (Score: 74-77)
Devin Simmons attempts a 3Pt. Contested by Lamelo O'Neal (3.7 feet, MAN). Devin Simmons misses. Rebound secured by Julius Curry.

[01:31] Team_002 possession (Score: 74-77)
Jordan Green attempts a Layup. Contested by Devin Simmons (6.0 feet, ZONE). JORDAN GREEN MAKES IT! Assist: Dirk Middleton
Score: 74-79

[01:17] Team_036 possession (Score: 74-79)
Devin Simmons attempts a 3Pt. Contested by Miles Bane (4.9 feet, ZONE). Devin Simmons misses. Rebound secured by Lamelo O'Neal.

[01:03] Team_002 possession (Score: 74-79)
FOUL! Shooting foul on Bradley Murray. Lamelo O'Neal to the line for 2 free throws. [Team fouls: 3] (Bradley Murray: 1 personal fouls)   FT 1/2: MISS   FT 2/2: GOOD Lamelo O'Neal makes 1/2 from the line.
Score: 74-80

[00:46] Team_036 possession (Score: 74-80)
Giannis Booker attempts a 3Pt. Contested by Dirk Middleton (5.9 feet, MAN). Giannis Booker misses. Rebound secured by Julius Curry.

[00:37] Team_002 possession (Score: 74-80)
Miles Bane loses control! Ball rolls out of bounds! TURNOVER! (dead ball)

[00:37] Substitution (Team_036): Giannis Booker OUT → Tobias Fox IN (stamina_rule2)

[00:37] Substitution (Team_036): Anthony Poole OUT → Pascal Antetokounmpo IN (stamina_rule2)

[00:37] Substitution (Team_002): Miles Bane OUT → John Duncan IN (stamina_rule2)

[00:37] Substitution (Team_002): Jordan Green OUT → Anfernee Sexton IN (stamina_rule2)

[00:20] Team_036 possession (Score: 74-80)
FOUL! Shooting foul on Anfernee Sexton. Pascal Antetokounmpo to the line for 2 free throws. [BONUS: 6 team fouls] (Anfernee Sexton: 1 personal fouls)   FT 1/2: GOOD   FT 2/2: GOOD Pascal Antetokounmpo makes 2/2 from the line.
Score: 76-80

[00:08] Team_002 possession (Score: 76-80)
John Duncan attempts a Midrange. Contested by Bradley Murray (4.5 feet, ZONE). JOHN DUNCAN MAKES IT! Assist: Julius Curry
Score: 76-82

================================================================================
                              3RD QUARTER COMPLETE                              
================================================================================

3RD QUARTER SCORE: Team_036 23, Team_002 24

BOX SCORE:
================================================================================

Team_036
--------------------------------------------------------------------------------
Player                MIN  PTS  REB  AST  TO      FG   FG%      3P   3P%
--------------------------------------------------------------------------------
Kobe Simmons           25    6    4    1   0   3/4    75.0     0/0   0.0
Anthony Poole          27    5    0    0   0   2/4    50.0     0/0   0.0
Giannis Booker         27    4    2    0   0   2/7    28.6     0/0   0.0
Terry Durant           25    4    7    1   0   2/3    66.7     0/0   0.0
Pascal Antetokounmpo    9    2    0    0   0   1/1   100.0     0/0   0.0
Michael Westbrook      25    0    0    1   0   0/1     0.0     0/0   0.0
Devin Simmons          11    0    1    0   0   0/2     0.0     0/0   0.0

TEAM: FG: 10/22 (45.5%), 3PT: 3/11 (27.3%), REB: 15 (4 off, 11 def), AST: 3, TO: 3
TEAM FOULS: 3


Team_002
--------------------------------------------------------------------------------
Player                MIN  PTS  REB  AST  TO      FG   FG%      3P   3P%
--------------------------------------------------------------------------------
Jordan Green           27    7    0    0   0   3/6    50.0     0/0   0.0
CJ Barrett             25    5    0    0   0   2/6    33.3     0/0   0.0
Tyler Porzingis        25    4    4    2   0   2/2   100.0     0/0   0.0
Carmelo Lowry          25    3    3    0   0   1/2    50.0     0/0   0.0
Lamelo O'Neal          11    3    2    0   0   2/3    66.7     0/0   0.0
John Duncan             9    2    0    0   0   1/1   100.0     0/0   0.0
Miles Bane             27    0    4    1   0   0/2     0.0     0/0   0.0
Julius Curry           11    0    2    1   0   0/0     0.0     0/0   0.0
Dirk Middleton         11    0    0    1   0   0/0     0.0     0/0   0.0

TEAM: FG: 11/22 (50.0%), 3PT: 4/8 (50.0%), REB: 14 (3 off, 11 def), AST: 5, TO: 3
TEAM FOULS: 6 [Team_036 in BONUS]

================================================================================

================================================================================
                       4TH QUARTER - Team_036 vs Team_002                       
================================================================================

[12:00] Team_036 possession (Score: 76-82)
Giannis Booker drives, picks up CJ Barrett. Help arrives from Miles Bane! Giannis Booker attempts a Layup. Contested by Miles Bane (4.3 feet, MAN). Giannis Booker misses. Rebound secured by CJ Barrett.

[11:44] Team_002 possession (Score: 76-82)
Miles Bane attempts a 3Pt. Contested by Michael Westbrook (4.6 feet, MAN). MILES BANE MAKES IT! Assist: Tyler Porzingis
Score: 76-85

[11:28] Team_036 possession (Score: 76-85)
Giannis Booker attempts a Midrange. Contested by CJ Barrett (4.3 feet, MAN). GIANNIS BOOKER MAKES IT!
Score: 78-85

[11:14] Team_002 possession (Score: 78-85)
FOUL! Holding foul on Anthony Poole. [Team fouls: 1] No free throws, side out. (Anthony Poole: 1 personal fouls)

[10:58] Team_002 possession (Score: 78-85)
Miles Bane attempts a 3Pt. Contested by Michael Westbrook (4.6 feet, ZONE). Miles Bane misses. Rebound secured by Giannis Booker.

[10:42] Team_036 possession (Score: 78-85)
Kobe Simmons drives, Tyler Porzingis stays with him. Kobe Simmons attempts a Dunk. Contested by Tyler Porzingis (3.6 feet, MAN). KOBE SIMMONS MAKES IT! Assist: Michael Westbrook
Score: 80-85

[10:28] Team_002 possession (Score: 80-85)
Jordan Green attempts a 3Pt. Contested by Michael Westbrook (5.5 feet, ZONE). JORDAN GREEN MAKES IT!
Score: 80-88

[10:15] Team_036 possession (Score: 80-88)
FOUL! Shooting foul on Tyler Porzingis. Kobe Simmons to the line for 2 free throws. [Team fouls: 1] (Tyler Porzingis: 1 personal fouls)   FT 1/2: GOOD   FT 2/2: GOOD Kobe Simmons makes 2/2 from the line.
Score: 82-88

[10:04] Team_002 possession (Score: 82-88)
CJ Barrett drives and kicks out. Jordan Green attempts a Midrange. Contested by Anthony Poole (5.3 feet, MAN). Jordan Green misses. Rebound secured by Terry Durant.

[09:49] Team_036 possession (Score: 82-88)
Michael Westbrook attempts a Midrange. Contested by Miles Bane (5.3 feet, MAN). Michael Westbrook misses. Rebound secured by Carmelo Lowry.

[09:35] Team_002 possession (Score: 82-88)
Tyler Porzingis throws a bad pass! Stolen by Kobe Simmons! TURNOVER! (live ball)

[09:18] Team_036 possession (Score: 82-88)
Terry Durant makes the 3Pt and draws the foul on CJ Barrett! And-1! Terry Durant to the line for 1. [Team fouls: 2] (CJ Barrett: 1 personal fouls)   FT 1/1: GOOD Terry Durant makes 1/1 from the line.
Score: 86-88

[09:03] Team_002 possession (Score: 86-88)
CJ Barrett drives, picks up Kobe Simmons. Help arrives from Giannis Booker! CJ Barrett attempts a Layup. Contested by Giannis Booker (4.1 feet, ZONE). CJ Barrett misses. Rebound secured by Giannis Booker.

[08:49] Team_036 possession (Score: 86-88)
Terry Durant attempts a Layup. Contested by Carmelo Lowry (4.6 feet, MAN). TERRY DURANT MAKES IT! Assist: Anthony Poole
Score: 88-88

[08:35] Team_002 possession (Score: 88-88)
CJ Barrett throws a bad pass! Stolen by Giannis Booker! TURNOVER! (live ball)

[08:21] Team_036 possession (Score: 88-88)
Michael Westbrook drives, Tyler Porzingis stays with him. Michael Westbrook attempts a Layup. Contested by Tyler Porzingis (4.0 feet, ZONE). MICHAEL WESTBROOK MAKES IT! Assist: Terry Durant
Score: 90-88

[08:08] Team_002 possession (Score: 90-88)
Carmelo Lowry attempts a 3Pt. Contested by Terry Durant (4.7 feet, MAN). Carmelo Lowry misses. Offensive rebound by Carmelo Lowry! Carmelo Lowry kicks it out.

[07:58] Team_002 possession (Score: 90-88)
Miles Bane attempts a Layup. BLOCKED BY KOBE SIMMONS! Ball is loose! Offensive rebound by Tyler Porzingis! Tyler Porzingis kicks it out.

[07:43] Team_002 possession (Score: 90-88)
Carmelo Lowry makes the Layup and draws the foul on Terry Durant! And-1! Carmelo Lowry to the line for 1. [Team fouls: 3] (Terry Durant: 2 personal fouls)   FT 1/1: MISS Carmelo Lowry makes 0/1 from the line. Rebound secured by Kobe Simmons.
Score: 90-90

[07:26] Team_036 possession (Score: 90-90)
Anthony Poole attempts a Midrange. Contested by CJ Barrett (4.9 feet, ZONE). Anthony Poole misses. Offensive rebound by Terry Durant! Terry Durant's putback is no good. Rebound secured by CJ Barrett.

[07:16] Team_002 possession (Score: 90-90)
Jordan Green attempts a 3Pt. Wide open! Anthony Poole is 6.3 feet away. [ZONE] Jordan Green misses. Rebound secured by Kobe Simmons.

[07:01] Team_036 possession (Score: 90-90)
Michael Westbrook attempts a Layup. BLOCKED BY TYLER PORZINGIS! Ball is loose! Rebound secured by Tyler Porzingis.

[06:44] Team_002 possession (Score: 90-90)
Miles Bane attempts a 3Pt. Contested by Terry Durant (4.8 feet, ZONE). MILES BANE MAKES IT! Assist: Jordan Green
Score: 90-93

[06:31] Team_036 possession (Score: 90-93)
Terry Durant attempts a 3Pt. Contested by Carmelo Lowry (4.9 feet, MAN). Terry Durant misses. Rebound secured by Tyler Porzingis.

[06:17] Team_002 possession (Score: 90-93)
Jordan Green attempts a Layup. Wide open! Anthony Poole is 6.4 feet away. [MAN] JORDAN GREEN MAKES IT! Assist: Carmelo Lowry
Score: 90-95

[05:59] Team_036 possession (Score: 90-95)
Anthony Poole attempts a 3Pt. Contested by Jordan Green (5.9 feet, MAN). Anthony Poole misses. Offensive rebound by Terry Durant! Terry Durant kicks it out.

[05:47] Team_036 possession (Score: 90-95)
FOUL! Shooting foul on Carmelo Lowry. Terry Durant to the line for 2 free throws. [Team fouls: 3] (Carmelo Lowry: 1 personal fouls)   FT 1/2: MISS   FT 2/2: MISS Terry Durant makes 0/2 from the line. Offensive rebound by Terry Durant! Terry Durant kicks it out.

[05:30] Team_036 possession (Score: 90-95)
Terry Durant attempts a 3Pt. Contested by Carmelo Lowry (5.0 feet, MAN). Terry Durant misses. Rebound secured by CJ Barrett.

[05:12] Team_002 possession (Score: 90-95)
FOUL! Holding foul on Giannis Booker. [Team fouls: 4] No free throws, side out. (Giannis Booker: 1 personal fouls)

[04:56] Team_002 possession (Score: 90-95)
Miles Bane attempts a Midrange. Contested by Michael Westbrook (5.2 feet, MAN). Miles Bane misses. Offensive rebound by Tyler Porzingis! Tyler Porzingis puts it back in!
Score: 90-97

[04:37] Team_036 possession (Score: 90-97)
FOUL! Shooting foul on Carmelo Lowry. Michael Westbrook to the line for 2 free throws. [Team fouls: 4] (Carmelo Lowry: 2 personal fouls)   FT 1/2: GOOD   FT 2/2: GOOD Michael Westbrook makes 2/2 from the line.
Score: 92-97

[04:21] Team_002 possession (Score: 92-97)
Miles Bane attempts a Midrange. Contested by Michael Westbrook (5.2 feet, MAN). MILES BANE MAKES IT! Assist: CJ Barrett
Score: 92-99

[04:10] Team_036 possession (Score: 92-99)
Anthony Poole drives to the basket... Anthony Poole loses control! Ball rolls out of bounds! TURNOVER! (dead ball)

[04:10] Substitution (Team_036): Michael Westbrook OUT → Dirk Anunoby IN (stamina_rule2)

[04:10] Substitution (Team_036): Giannis Booker OUT → Tobias Fox IN (stamina_rule2)

[04:10] Substitution (Team_036): Anthony Poole OUT → Pascal Antetokounmpo IN (stamina_rule2)

[04:10] Substitution (Team_036): Terry Durant OUT → Devin Simmons IN (stamina_rule2)

[04:10] Substitution (Team_036): Kobe Simmons OUT → Bradley Murray IN (stamina_rule2)

[04:10] Substitution (Team_002): Miles Bane OUT → John Duncan IN (stamina_rule2)

[04:10] Substitution (Team_002): CJ Barrett OUT → Dirk Middleton IN (stamina_rule2)

[04:10] Substitution (Team_002): Jordan Green OUT → Anfernee Sexton IN (stamina_rule2)

[04:10] Substitution (Team_002): Carmelo Lowry OUT → Julius Curry IN (stamina_rule2)

[04:10] Substitution (Team_002): Tyler Porzingis OUT → Lamelo O'Neal IN (stamina_rule2)

[03:53] Team_002 possession (Score: 92-99)
FOUL! Shooting foul on Pascal Antetokounmpo. Julius Curry to the line for 2 free throws. [BONUS: 5 team fouls] (Pascal Antetokounmpo: 1 personal fouls)   FT 1/2: MISS   FT 2/2: GOOD Julius Curry makes 1/2 from the line.
Score: 92-100

[03:37] Team_036 possession (Score: 92-100)
Devin Simmons attempts a Layup. Contested by Lamelo O'Neal (3.7 feet, ZONE). DEVIN SIMMONS MAKES IT!
Score: 94-100

[03:19] Team_002 possession (Score: 94-100)
FOUL! Reach-in foul on Devin Simmons during the drive. [IN THE BONUS! 6 team fouls] Anfernee Sexton to the line for 2 free throws. (Devin Simmons: 1 personal fouls)   FT 1/2: MISS   FT 2/2: MISS Anfernee Sexton makes 0/2 from the line. Rebound secured by Bradley Murray.

[03:02] Team_036 possession (Score: 94-100)
Tobias Fox attempts a 3Pt. Contested by Julius Curry (5.7 feet, ZONE). TOBIAS FOX MAKES IT! Assist: Pascal Antetokounmpo
Score: 97-100

[02:47] Team_002 possession (Score: 97-100)
Julius Curry drives, Devin Simmons stays with him. Julius Curry attempts a Dunk. Contested by Devin Simmons (5.1 feet, ZONE). Julius Curry misses. Offensive rebound by Anfernee Sexton! Anfernee Sexton kicks it out.

[02:33] Team_002 possession (Score: 97-100)
John Duncan attempts a 3Pt. Contested by Tobias Fox (4.4 feet, ZONE). John Duncan misses. Rebound secured by Bradley Murray.

[02:21] Team_036 possession (Score: 97-100)
Tobias Fox attempts a Midrange. Contested by Dirk Middleton (6.0 feet, MAN). TOBIAS FOX MAKES IT! Assist: Pascal Antetokounmpo
Score: 99-100

[02:03] Team_002 possession (Score: 99-100)
John Duncan drives, Dirk Anunoby stays with him. John Duncan attempts a Layup. Contested by Dirk Anunoby (5.4 feet, MAN). JOHN DUNCAN MAKES IT! Assist: Dirk Middleton
Score: 99-102

[01:49] Team_036 possession (Score: 99-102)
Dirk Anunoby commits a violation (traveling/carry)! TURNOVER! (dead ball)

[01:34] Team_002 possession (Score: 99-102)
Lamelo O'Neal attempts a Layup. BLOCKED BY BRADLEY MURRAY! Ball is loose! Rebound secured by Bradley Murray.

[01:23] Team_036 possession (Score: 99-102)
Tobias Fox drives and kicks out. Tobias Fox attempts a Midrange. Contested by Dirk Middleton (5.6 feet, MAN). TOBIAS FOX MAKES IT!
Score: 101-102

[01:07] Team_002 possession (Score: 101-102)
Lamelo O'Neal drives, Devin Simmons stays with him. Lamelo O'Neal attempts a Layup. Contested by Devin Simmons (5.5 feet, ZONE). Lamelo O'Neal misses. Rebound secured by Devin Simmons.

[00:50] Team_036 possession (Score: 101-102)
FOUL! Shooting foul on John Duncan. Dirk Anunoby to the line for 3 free throws. [BONUS: 5 team fouls] (John Duncan: 1 personal fouls)   FT 1/3: MISS   FT 2/3: GOOD   FT 3/3: GOOD Dirk Anunoby makes 2/3 from the line.
Score: 103-102

[00:36] Team_002 possession (Score: 103-102)
Julius Curry drives and kicks out. Dirk Middleton attempts a 3Pt. Contested by Tobias Fox (4.5 feet, ZONE). DIRK MIDDLETON MAKES IT! Assist: Julius Curry
Score: 103-105

[00:24] Team_036 possession (Score: 103-105)
Devin Simmons attempts a 3Pt. Contested by Lamelo O'Neal (3.7 feet, MAN). DEVIN SIMMONS MAKES IT! Assist: Tobias Fox
Score: 106-105

[00:08] Team_002 possession (Score: 106-105)
Anfernee Sexton attempts a 3Pt. Contested by Pascal Antetokounmpo (5.3 feet, MAN). Anfernee Sexton misses. Rebound secured by Pascal Antetokounmpo.

================================================================================
                              4TH QUARTER COMPLETE                              
================================================================================

4TH QUARTER SCORE: Team_036 30, Team_002 23

BOX SCORE:
================================================================================

Team_036
--------------------------------------------------------------------------------
Player                MIN  PTS  REB  AST  TO      FG   FG%      3P   3P%
--------------------------------------------------------------------------------
Tobias Fox             13    7    0    1   0   3/3   100.0     0/0   0.0
Terry Durant           33    6    3    1   0   2/4    50.0     0/0   0.0
Devin Simmons          15    5    1    0   0   2/2   100.0     0/0   0.0
Kobe Simmons           33    4    2    0   0   2/2   100.0     0/0   0.0
Michael Westbrook      33    4    0    1   0   2/4    50.0     0/0   0.0
Giannis Booker         35    2    2    0   0   1/2    50.0     0/0   0.0
Dirk Anunoby           15    2    0    0   0   1/1   100.0     0/0   0.0
Anthony Poole          35    0    0    1   0   0/1     0.0     0/0   0.0
Bradley Murray         15    0    3    0   0   0/0     0.0     0/0   0.0
Pascal Antetokounmpo   13    0    1    2   0   0/0     0.0     0/0   0.0

TEAM: FG: 13/19 (68.4%), 3PT: 4/6 (66.7%), REB: 13 (3 off, 10 def), AST: 6, TO: 2
TEAM FOULS: 6 [Team_002 in BONUS]


Team_002
--------------------------------------------------------------------------------
Player                MIN  PTS  REB  AST  TO      FG   FG%      3P   3P%
--------------------------------------------------------------------------------
Miles Bane             35    8    0    0   0   3/4    75.0     0/0   0.0
Jordan Green           35    5    0    1   0   2/3    66.7     0/0   0.0
Dirk Middleton         15    3    0    1   0   1/1   100.0     0/0   0.0
Tyler Porzingis        33    2    4    1   0   1/1   100.0     0/0   0.0
John Duncan            13    2    0    0   0   1/2    50.0     0/0   0.0
Julius Curry           15    1    0    1   0   1/1   100.0     0/0   0.0
CJ Barrett             33    0    3    1   0   0/2     0.0     0/0   0.0
Carmelo Lowry          33    0    2    1   0   0/1     0.0     0/0   0.0
Anfernee Sexton        13    0    1    0   0   0/2     0.0     0/0   0.0
Lamelo O'Neal          15    0    0    0   0   0/2     0.0     0/0   0.0

TEAM: FG: 9/19 (47.4%), 3PT: 3/7 (42.9%), REB: 9 (4 off, 5 def), AST: 6, TO: 2
TEAM FOULS: 5 [Team_036 in BONUS]

================================================================================

================================================================================
                               FULL GAME COMPLETE                               
================================================================================

FINAL SCORE: Team_036 106, Team_002 105

SCORING BY QUARTER:
--------------------------------------------------------------------------------
Team                     Q1     Q2     Q3     Q4    FINAL
--------------------------------------------------------------------------------
Team_036                 31     22     23     30      106
Team_002                 31     27     24     23      105
--------------------------------------------------------------------------------

FULL GAME BOX SCORE:
================================================================================

Team_036
--------------------------------------------------------------------------------
Player                MIN  PTS  REB  AST  TO      FG   FG%      3P   3P%      FT STL BLK
--------------------------------------------------------------------------------
Giannis Booker         35   11    9    2   0   7/15   46.7   4/9    44.4   1/2     1   0
Anthony Poole          35   10    0    2   1   8/13   61.5   1/3    33.3   2/3     0   0
Michael Westbrook      33   13    0    4   1   6/9    66.7   0/1     0.0   5/5     0   0
Terry Durant           33   20   14    3   2   5/11   45.5   2/5    40.0   2/6     1   0
Kobe Simmons           33   16   11    4   2   6/10   60.0   0/1     0.0   2/2     1   1
Dirk Anunoby           15    2    0    1   1   1/2    50.0   1/1   100.0   2/3     0   0
Devin Simmons          15    5    4    1   1   3/6    50.0   1/3    33.3   0/0     0   0
Bradley Murray         15    4    6    1   0   2/3    66.7   0/1     0.0   2/2     0   1
Tobias Fox             13   16    0    1   0   6/9    66.7   1/1   100.0   0/0     1   0
Pascal Antetokounmpo   13    7    1    2   0   3/3   100.0   2/2   100.0   4/5     0   0

TEAM: FG: 48/82 (58.5%), 3PT: 12/27 (44.4%), REB: 47 (11 off, 36 def), AST: 21, TO: 8


Team_002
--------------------------------------------------------------------------------
Player                MIN  PTS  REB  AST  TO      FG   FG%      3P   3P%      FT STL BLK
--------------------------------------------------------------------------------
Miles Bane             35   17    5    4   1   7/13   53.8   4/8    50.0   4/5     0   0
Jordan Green           35   18    0    2   1   6/12   50.0   2/7    28.6   1/1     0   0
CJ Barrett             33   19    3    1   2  10/18   55.6   4/6    66.7   2/2     0   1
Carmelo Lowry          33    7    9    1   1   3/6    50.0   0/1     0.0   1/2     0   0
Tyler Porzingis        33   10   15    6   1   2/6    33.3   0/2     0.0   0/0     1   2
Dirk Middleton         15    6    0    2   1   1/3    33.3   1/3    33.3   0/0     0   0
Julius Curry           15   10    3    2   0   7/7   100.0   1/1   100.0   6/7     0   0
Lamelo O'Neal          15    7    4    3   2   3/6    50.0   0/0     0.0   1/2     0   1
John Duncan            13    4    0    0   0   2/4    50.0   0/1     0.0   1/2     0   0
Anfernee Sexton        13    4    6    1   0   2/4    50.0   0/1     0.0   2/4     1   1

TEAM: FG: 44/80 (55.0%), 3PT: 12/30 (40.0%), REB: 43 (12 off, 31 def), AST: 22, TO: 9

================================================================================
