================================================================================
                        FULL GAME - Team_074 vs Team_083                        
================================================================================

================================================================================
                       1ST QUARTER - Team_074 vs Team_083                       
================================================================================

[12:00] Team_074 possession (Score: 0-0)
Chris Carter drives and kicks out. James Turner attempts a Midrange. Contested by Yao Oladipo (3.4 feet, ZONE). James Turner misses. Rebound secured by Bradley Thompson.

[11:49] Team_083 possession (Score: 0-0)
FOUL! Reach-in foul on Chris Carter during the drive. [Team fouls: 1] No free throws, side out. (Chris Carter: 1 personal fouls)

[11:37] Team_083 possession (Score: 0-0)
Karl Jokic attempts a Layup. BLOCKED BY DONOVAN DONCIC! Ball is loose! Rebound secured by Shai Green.

[11:23] Team_074 possession (Score: 0-0)
James Turner attempts a 3Pt. Contested by Bradley Thompson (4.3 feet, MAN). James Turner misses. Rebound secured by Yao Oladipo.

[11:11] Team_083 possession (Score: 0-0)
Bradley Thompson loses the ball! Stripped by James Turner! TURNOVER! (live ball)

[10:56] Team_074 possession (Score: 0-0)
Donovan Doncic attempts a 3Pt. Contested by Kyrie Griffin (3.7 feet, MAN). Donovan Doncic misses. Rebound secured by Kyrie Griffin.

[10:37] Team_083 possession (Score: 0-0)
Bradley Thompson drives and kicks out. Bradley Thompson attempts a 3Pt. Contested by James Turner (3.4 feet, MAN). Bradley Thompson misses. Offensive rebound by Bradley Thompson! Bradley Thompson puts it back in!
Score: 0-2

[10:19] Team_074 possession (Score: 0-2)
FOUL! Shooting foul on Malcolm Brogdon. Dwyane Quickley to the line for 2 free throws. [Team fouls: 1] (Malcolm Brogdon: 1 personal fouls)   FT 1/2: GOOD   FT 2/2: MISS Dwyane Quickley makes 1/2 from the line. Rebound secured by Bradley Thompson.
Score: 1-2

[10:05] Team_083 possession (Score: 1-2)
Bradley Thompson commits a violation (traveling/carry)! TURNOVER! (dead ball)

[09:47] Team_074 possession (Score: 1-2)
FOUL! Shooting foul on Yao Oladipo. Shai Green to the line for 3 free throws. [Team fouls: 2] (Yao Oladipo: 1 personal fouls)   FT 1/3: GOOD   FT 2/3: GOOD   FT 3/3: GOOD Shai Green makes 3/3 from the line.
Score: 4-2

[09:35] Team_083 possession (Score: 4-2)
Bradley Thompson attempts a Layup. Contested by James Turner (3.5 feet, MAN). BRADLEY THOMPSON MAKES IT! Assist: Malcolm Brogdon
Score: 4-4

[09:26] Team_074 possession (Score: 4-4)
Shai Green attempts a 3Pt. Contested by Yao Oladipo (3.9 feet, ZONE). Shai Green misses. Rebound secured by Yao Oladipo.

[09:12] Team_083 possession (Score: 4-4)
Yao Oladipo attempts a 3Pt. Contested by Dwyane Quickley (5.7 feet, ZONE). YAO OLADIPO MAKES IT! Assist: Bradley Thompson
Score: 4-7

[08:56] Team_074 possession (Score: 4-7)
Chris Carter attempts a 3Pt. Contested by Yao Oladipo (4.0 feet, ZONE). Chris Carter misses. Rebound secured by Bradley Thompson.

[08:44] Team_083 possession (Score: 4-7)
FOUL! Shooting foul on Chris Carter. Bradley Thompson to the line for 2 free throws. [Team fouls: 2] (Chris Carter: 2 personal fouls)   FT 1/2: GOOD   FT 2/2: GOOD Bradley Thompson makes 2/2 from the line.
Score: 4-9

[08:28] Team_074 possession (Score: 4-9)
James Turner attempts a Midrange. BLOCKED BY KYRIE GRIFFIN! Ball is loose! Rebound secured by Yao Oladipo.

[08:12] Team_083 possession (Score: 4-9)
Bradley Thompson attempts a Midrange. Contested by James Turner (3.5 feet, MAN). Bradley Thompson misses. Offensive rebound by Kyrie Griffin! Kyrie Griffin kicks it out.

[07:59] Team_083 possession (Score: 4-9)
Karl Jokic drives and kicks out. Yao Oladipo attempts a 3Pt. Contested by Dwyane Quickley (5.4 feet, ZONE). YAO OLADIPO MAKES IT! Assist: Kyrie Griffin
Score: 4-12

[07:48] Team_074 possession (Score: 4-12)
FOUL! Shooting foul on Bradley Thompson. James Turner to the line for 2 free throws. [Team fouls: 3] (Bradley Thompson: 1 personal fouls)   FT 1/2: MISS   FT 2/2: GOOD James Turner makes 1/2 from the line.
Score: 5-12

[07:31] Team_083 possession (Score: 5-12)
Malcolm Brogdon attempts a 3Pt. Contested by Dwyane Quickley (5.1 feet, MAN). Malcolm Brogdon misses. Rebound secured by Donovan Doncic.

[07:18] Team_074 possession (Score: 5-12)
James Turner attempts a Layup. Contested by Kyrie Griffin (4.0 feet, ZONE). JAMES TURNER MAKES IT! Assist: Donovan Doncic
Score: 7-12

[07:05] Team_083 possession (Score: 7-12)
Malcolm Brogdon attempts a 3Pt. Contested by Dwyane Quickley (5.1 feet, MAN). Malcolm Brogdon misses. FOUL! Loose ball foul on James Turner during the rebound battle. [Team fouls: 3] No free throws, side out. (James Turner: 1 personal fouls)

[06:48] Team_083 possession (Score: 7-12)
Yao Oladipo drives and kicks out. Bradley Thompson attempts a 3Pt. Contested by Dwyane Quickley (5.4 feet, ZONE). BRADLEY THOMPSON MAKES IT! Assist: Yao Oladipo
Score: 7-15

[06:35] Team_074 possession (Score: 7-15)
James Turner drives, Kyrie Griffin stays with him. James Turner attempts a Dunk. Contested by Kyrie Griffin (4.0 feet, ZONE). JAMES TURNER MAKES IT! Assist: Chris Carter
Score: 9-15

[06:19] Team_083 possession (Score: 9-15)
FOUL! Shooting foul on Dwyane Quickley. Malcolm Brogdon to the line for 2 free throws. [Team fouls: 4] (Dwyane Quickley: 1 personal fouls)   FT 1/2: GOOD   FT 2/2: GOOD Malcolm Brogdon makes 2/2 from the line.
Score: 9-17

[06:05] Team_074 possession (Score: 9-17)
James Turner attempts a 3Pt. Contested by Yao Oladipo (4.0 feet, ZONE). James Turner misses. Rebound secured by Yao Oladipo.

[05:55] Team_083 possession (Score: 9-17)
Kyrie Griffin attempts a Layup. Contested by Donovan Doncic (4.0 feet, ZONE). KYRIE GRIFFIN MAKES IT!
Score: 9-19

[05:43] Team_074 possession (Score: 9-19)
FOUL! Holding foul on Malcolm Brogdon. [Team fouls: 4] No free throws, side out. (Malcolm Brogdon: 2 personal fouls)

[05:27] Team_074 possession (Score: 9-19)
James Turner makes the Layup and draws the foul on Karl Jokic! And-1! James Turner to the line for 1. [BONUS: 5 team fouls] (Karl Jokic: 1 personal fouls)   FT 1/1: GOOD James Turner makes 1/1 from the line.
Score: 12-19

[05:11] Team_083 possession (Score: 12-19)
Yao Oladipo attempts a Midrange. Contested by Chris Carter (4.6 feet, ZONE). YAO OLADIPO MAKES IT!
Score: 12-21

[05:00] Team_074 possession (Score: 12-21)
Dwyane Quickley attempts a 3Pt. Contested by Malcolm Brogdon (5.2 feet, MAN). Dwyane Quickley misses. Rebound secured by Kyrie Griffin.

[04:48] Team_083 possession (Score: 12-21)
Karl Jokic makes the 3Pt and draws the foul on Dwyane Quickley! And-1! Karl Jokic to the line for 1. [BONUS: 5 team fouls] (Dwyane Quickley: 2 personal fouls)   FT 1/1: GOOD Karl Jokic makes 1/1 from the line.
Score: 12-25

[04:31] Team_074 possession (Score: 12-25)
Dwyane Quickley drives and kicks out. Shai Green attempts a Midrange. Contested by Yao Oladipo (3.4 feet, MAN). Shai Green misses. Rebound secured by Kyrie Griffin.

[04:19] Team_083 possession (Score: 12-25)
Yao Oladipo attempts a Layup. Contested by Donovan Doncic (4.0 feet, ZONE). YAO OLADIPO MAKES IT! Assist: Malcolm Brogdon
Score: 12-27

[04:04] Team_074 possession (Score: 12-27)
Donovan Doncic attempts a 3Pt. Contested by Kyrie Griffin (3.9 feet, MAN). Donovan Doncic misses. Offensive rebound by Donovan Doncic! Donovan Doncic kicks it out.

[03:50] Team_074 possession (Score: 12-27)
James Turner attempts a 3Pt. Contested by Yao Oladipo (4.1 feet, ZONE). James Turner misses. FOUL! Loose ball foul on Yao Oladipo during the rebound battle. [IN THE BONUS! 6 team fouls] Donovan Doncic to the line for 2 free throws. (Yao Oladipo: 2 personal fouls)   FT 1/2: GOOD   FT 2/2: GOOD Donovan Doncic makes 2/2 from the line.
Score: 14-27

[03:32] Team_083 possession (Score: 14-27)
Yao Oladipo drives, Donovan Doncic stays with him. Yao Oladipo attempts a Dunk. Contested by Donovan Doncic (4.1 feet, ZONE). YAO OLADIPO MAKES IT!
Score: 14-29

[03:21] Team_074 possession (Score: 14-29)
James Turner makes the Dunk and draws the foul on Karl Jokic! And-1! James Turner to the line for 1. [BONUS: 7 team fouls] (Karl Jokic: 2 personal fouls)   FT 1/1: MISS James Turner makes 0/1 from the line. Rebound secured by Bradley Thompson.
Score: 16-29

[03:08] Team_083 possession (Score: 16-29)
Kyrie Griffin attempts a 3Pt. Contested by Dwyane Quickley (5.9 feet, ZONE). Kyrie Griffin misses. Rebound secured by James Turner.

[02:55] Team_074 possession (Score: 16-29)
Dwyane Quickley makes the Dunk and draws the foul on Yao Oladipo! And-1! Dwyane Quickley to the line for 1. [BONUS: 8 team fouls] (Yao Oladipo: 3 personal fouls)   FT 1/1: GOOD Dwyane Quickley makes 1/1 from the line.
Score: 19-29

[02:44] Team_083 possession (Score: 19-29)
Malcolm Brogdon drives, picks up Dwyane Quickley. Help arrives from Shai Green! Malcolm Brogdon attempts a Dunk. Contested by Shai Green (5.3 feet, MAN). MALCOLM BROGDON MAKES IT!
Score: 19-31

[02:29] Team_074 possession (Score: 19-31)
FOUL! Shooting foul on Yao Oladipo. Shai Green to the line for 2 free throws. [BONUS: 9 team fouls] (Yao Oladipo: 4 personal fouls)   FT 1/2: GOOD   FT 2/2: GOOD Shai Green makes 2/2 from the line.
Score: 21-31

[02:12] Team_083 possession (Score: 21-31)
Malcolm Brogdon attempts a Layup. Contested by Donovan Doncic (3.6 feet, ZONE). Malcolm Brogdon misses. Rebound secured by James Turner.

[01:55] Team_074 possession (Score: 21-31)
Dwyane Quickley attempts a 3Pt. Contested by Yao Oladipo (4.0 feet, ZONE). Dwyane Quickley misses. Offensive rebound by Donovan Doncic! Donovan Doncic kicks it out.

[01:37] Team_074 possession (Score: 21-31)
Chris Carter attempts a 3Pt. Contested by Karl Jokic (5.4 feet, MAN). Chris Carter misses. Rebound secured by Bradley Thompson.

[01:22] Team_083 possession (Score: 21-31)
Kyrie Griffin attempts a Layup. Contested by James Turner (4.1 feet, ZONE). KYRIE GRIFFIN MAKES IT! Assist: Bradley Thompson
Score: 21-33

[01:04] Team_074 possession (Score: 21-33)
Shai Green attempts a 3Pt. Contested by Yao Oladipo (4.3 feet, ZONE). Shai Green misses. Rebound secured by Kyrie Griffin.

[00:51] Team_083 possession (Score: 21-33)
FOUL! Shooting foul on Chris Carter. Karl Jokic to the line for 2 free throws. [BONUS: 6 team fouls] (Chris Carter: 3 personal fouls)   FT 1/2: GOOD   FT 2/2: GOOD Karl Jokic makes 2/2 from the line.
Score: 21-35

[00:34] Team_074 possession (Score: 21-35)
Chris Carter drives and kicks out. Dwyane Quickley attempts a Midrange. Contested by Yao Oladipo (3.9 feet, ZONE). DWYANE QUICKLEY MAKES IT!
Score: 23-35

[00:20] Team_083 possession (Score: 23-35)
Kyrie Griffin attempts a 3Pt. Wide open! Dwyane Quickley is 6.1 feet away. [ZONE] Kyrie Griffin misses. Rebound secured by Donovan Doncic.

[00:10] Team_074 possession (Score: 23-35)
James Turner makes the Dunk and draws the foul on Bradley Thompson! And-1! James Turner to the line for 1. [BONUS: 10 team fouls] (Bradley Thompson: 2 personal fouls)   FT 1/1: GOOD James Turner makes 1/1 from the line.
Score: 26-35

================================================================================
                              1ST QUARTER COMPLETE                              
================================================================================

1ST QUARTER SCORE: Team_074 26, Team_083 35

BOX SCORE:
================================================================================

Team_074
--------------------------------------------------------------------------------
Player                MIN  PTS  REB  AST  TO      FG   FG%      3P   3P%
--------------------------------------------------------------------------------
James Turner           12   11    2    0   0   5/9    55.6     0/0   0.0
Shai Green             12    5    1    0   0   2/4    50.0     0/0   0.0
Dwyane Quickley        12    5    0    0   0   2/5    40.0     0/0   0.0
Donovan Doncic         12    2    4    1   0   1/2    50.0     0/0   0.0
Chris Carter           12    0    0    1   0   0/3     0.0     0/0   0.0

TEAM: FG: 10/23 (43.5%), 3PT: 2/10 (20.0%), REB: 7 (2 off, 5 def), AST: 2, TO: 0
TEAM FOULS: 6 [Team_083 in BONUS]


Team_083
--------------------------------------------------------------------------------
Player                MIN  PTS  REB  AST  TO      FG   FG%      3P   3P%
--------------------------------------------------------------------------------
Yao Oladipo            12   12    4    1   0   5/5   100.0     0/0   0.0
Bradley Thompson       12    9    6    2   0   4/4   100.0     0/0   0.0
Karl Jokic             12    6    0    0   0   2/3    66.7     0/0   0.0
Kyrie Griffin          12    4    6    1   0   2/4    50.0     0/0   0.0
Malcolm Brogdon        12    4    0    2   0   2/4    50.0     0/0   0.0

TEAM: FG: 15/20 (75.0%), 3PT: 2/5 (40.0%), REB: 16 (3 off, 13 def), AST: 6, TO: 2
TEAM FOULS: 10 [Team_074 in BONUS]

================================================================================

================================================================================
                       2ND QUARTER - Team_074 vs Team_083                       
================================================================================

[12:00] Team_074 possession (Score: 26-35)
Shai Green attempts a Midrange. Contested by Yao Oladipo (4.2 feet, ZONE). SHAI GREEN MAKES IT! Assist: Donovan Doncic
Score: 28-35

[11:47] Team_083 possession (Score: 28-35)
Kyrie Griffin attempts a Layup. Contested by Donovan Doncic (4.2 feet, MAN). KYRIE GRIFFIN MAKES IT! Assist: Bradley Thompson
Score: 28-37

[11:34] Team_074 possession (Score: 28-37)
James Turner attempts a Midrange. Contested by Bradley Thompson (4.7 feet, MAN). James Turner misses. Offensive rebound by Donovan Doncic! Donovan Doncic kicks it out.

[11:17] Team_074 possession (Score: 28-37)
Shai Green attempts a 3Pt. Contested by Yao Oladipo (4.2 feet, MAN). Shai Green misses. Offensive rebound by James Turner! James Turner kicks it out.

[10:59] Team_074 possession (Score: 28-37)
Dwyane Quickley attempts a Midrange. Contested by Malcolm Brogdon (5.5 feet, MAN). Dwyane Quickley misses. FOUL! Loose ball foul on Bradley Thompson during the rebound battle. [Team fouls: 1] No free throws, side out. (Bradley Thompson: 1 personal fouls)

[10:47] Team_074 possession (Score: 28-37)
Donovan Doncic drives and kicks out. Dwyane Quickley attempts a Midrange. Contested by Malcolm Brogdon (5.3 feet, MAN). DWYANE QUICKLEY MAKES IT! Assist: Donovan Doncic
Score: 30-37

[10:35] Team_083 possession (Score: 30-37)
Bradley Thompson attempts a Layup. Contested by James Turner (4.0 feet, MAN). BRADLEY THOMPSON MAKES IT!
Score: 30-39

[10:22] Team_074 possession (Score: 30-39)
Donovan Doncic attempts a Layup. Contested by Kyrie Griffin (4.3 feet, ZONE). Donovan Doncic misses. Rebound secured by Kyrie Griffin.

[10:04] Team_083 possession (Score: 30-39)
FOUL! Shooting foul on Chris Carter. Bradley Thompson to the line for 2 free throws. [Team fouls: 1] (Chris Carter: 1 personal fouls)   FT 1/2: GOOD   FT 2/2: MISS Bradley Thompson makes 1/2 from the line. Rebound secured by James Turner.
Score: 30-40

[09:45] Team_074 possession (Score: 30-40)
James Turner drives, Bradley Thompson stays with him. James Turner attempts a Dunk. Contested by Bradley Thompson (4.9 feet, MAN). James Turner misses. Rebound secured by Bradley Thompson.

[09:33] Team_083 possession (Score: 30-40)
Karl Jokic attempts a 3Pt. Contested by Chris Carter (5.3 feet, MAN). Karl Jokic misses. Rebound secured by James Turner.

[09:17] Team_074 possession (Score: 30-40)
James Turner attempts a Layup. Contested by Kyrie Griffin (4.7 feet, ZONE). JAMES TURNER MAKES IT!
Score: 32-40

[08:59] Team_083 possession (Score: 32-40)
FOUL! Shooting foul on Donovan Doncic. Kyrie Griffin to the line for 2 free throws. [Team fouls: 2] (Donovan Doncic: 1 personal fouls)   FT 1/2: GOOD   FT 2/2: GOOD Kyrie Griffin makes 2/2 from the line.
Score: 32-42

[08:43] Team_074 possession (Score: 32-42)
Dwyane Quickley loses control! Ball rolls out of bounds! TURNOVER! (dead ball)

[08:43] Substitution (Team_074): Dwyane Quickley OUT → James Barnes IN (stamina_rule2)

[08:43] Substitution (Team_074): Chris Carter OUT → Giannis Westbrook IN (stamina_rule2)

[08:43] Substitution (Team_074): Shai Green OUT → Ayo Smith IN (stamina_rule2)

[08:43] Substitution (Team_074): Donovan Doncic OUT → Yao Randle IN (stamina_rule2)

[08:43] Substitution (Team_074): James Turner OUT → Jaren Rozier IN (stamina_rule2)

[08:43] Substitution (Team_083): Malcolm Brogdon OUT → Zion Markkanen IN (stamina_rule2)

[08:43] Substitution (Team_083): Karl Jokic OUT → Damian Towns IN (stamina_rule2)

[08:43] Substitution (Team_083): Yao Oladipo OUT → Domantas Doncic IN (stamina_rule2)

[08:43] Substitution (Team_083): Kyrie Griffin OUT → Cole Simmons IN (stamina_rule2)

[08:43] Substitution (Team_083): Bradley Thompson OUT → Victor McCollum IN (stamina_rule2)

[08:33] Team_083 possession (Score: 32-42)
Damian Towns attempts a Layup. Contested by Giannis Westbrook (4.9 feet, MAN). Damian Towns misses. Rebound secured by Jaren Rozier.

[08:16] Team_074 possession (Score: 32-42)
James Barnes drives, picks up Zion Markkanen. Help arrives from Damian Towns! James Barnes attempts a Layup. Contested by Damian Towns (5.3 feet, MAN). JAMES BARNES MAKES IT! Assist: Ayo Smith
Score: 34-42

[08:06] Team_083 possession (Score: 34-42)
Zion Markkanen attempts a 3Pt. Contested by James Barnes (4.4 feet, ZONE). Zion Markkanen misses. Rebound secured by Jaren Rozier.

[07:50] Team_074 possession (Score: 34-42)
Jaren Rozier makes the Midrange and draws the foul on Damian Towns! And-1! Jaren Rozier to the line for 1. [Team fouls: 2] (Damian Towns: 1 personal fouls)   FT 1/1: GOOD Jaren Rozier makes 1/1 from the line.
Score: 37-42

[07:32] Team_083 possession (Score: 37-42)
Domantas Doncic attempts a 3Pt. Contested by Ayo Smith (4.9 feet, MAN). Domantas Doncic misses. Rebound secured by Ayo Smith.

[07:18] Team_074 possession (Score: 37-42)
FOUL! Reach-in foul on Victor McCollum during the drive. [Team fouls: 3] No free throws, side out. (Victor McCollum: 1 personal fouls)

[07:02] Team_074 possession (Score: 37-42)
James Barnes attempts a Layup. BLOCKED BY VICTOR MCCOLLUM! Ball is loose! Rebound secured by Damian Towns.

[06:44] Team_083 possession (Score: 37-42)
Domantas Doncic attempts a Layup. Contested by Ayo Smith (4.9 feet, MAN). Domantas Doncic misses. Offensive rebound by Victor McCollum! Victor McCollum's putback is no good. Offensive rebound by Damian Towns! Damian Towns kicks it out.

[06:27] Team_083 possession (Score: 37-42)
Domantas Doncic attempts a Layup. Contested by Yao Randle (4.6 feet, ZONE). Domantas Doncic misses. Offensive rebound by Victor McCollum! Victor McCollum puts it back in!
Score: 37-44

[06:10] Team_074 possession (Score: 37-44)
Giannis Westbrook drives, Victor McCollum stays with him. Giannis Westbrook attempts a Dunk. Contested by Victor McCollum (4.1 feet, ZONE). GIANNIS WESTBROOK MAKES IT!
Score: 39-44

[05:53] Team_083 possession (Score: 39-44)
Zion Markkanen drives to the basket... Zion Markkanen commits a violation (traveling/carry)! TURNOVER! (dead ball)

[05:39] Team_074 possession (Score: 39-44)
Giannis Westbrook drives and kicks out. Jaren Rozier attempts a 3Pt. Contested by Zion Markkanen (5.4 feet, ZONE). Jaren Rozier misses. FOUL! Loose ball foul on Damian Towns during the rebound battle. [Team fouls: 4] No free throws, side out. (Damian Towns: 2 personal fouls)

[05:22] Team_074 possession (Score: 39-44)
Yao Randle drives and kicks out. Giannis Westbrook attempts a Midrange. Contested by Damian Towns (4.9 feet, MAN). Giannis Westbrook misses. Rebound secured by Damian Towns.

[05:05] Team_083 possession (Score: 39-44)
Zion Markkanen attempts a 3Pt. Contested by James Barnes (4.4 feet, MAN). Zion Markkanen misses. FOUL! Loose ball foul on Jaren Rozier during the rebound battle. [Team fouls: 3] No free throws, side out. (Jaren Rozier: 1 personal fouls)

[04:51] Team_083 possession (Score: 39-44)
Cole Simmons drives and kicks out. Cole Simmons attempts a 3Pt. Contested by Yao Randle (4.5 feet, MAN). Cole Simmons misses. Rebound secured by Jaren Rozier.

[04:32] Team_074 possession (Score: 39-44)
Jaren Rozier attempts a Layup. Contested by Victor McCollum (3.8 feet, ZONE). JAREN ROZIER MAKES IT! Assist: Ayo Smith
Score: 41-44

[04:14] Team_083 possession (Score: 41-44)
FOUL! Holding foul on James Barnes. [Team fouls: 4] No free throws, side out. (James Barnes: 1 personal fouls)

[03:57] Team_083 possession (Score: 41-44)
Zion Markkanen drives and kicks out. Damian Towns attempts a 3Pt. Contested by James Barnes (4.2 feet, ZONE). Damian Towns misses. Rebound secured by Jaren Rozier.

[03:41] Team_074 possession (Score: 41-44)
Jaren Rozier drives, Victor McCollum stays with him. Jaren Rozier attempts a Layup. Contested by Victor McCollum (3.8 feet, MAN). Jaren Rozier misses. Rebound secured by Cole Simmons.

[03:26] Team_083 possession (Score: 41-44)
Cole Simmons attempts a 3Pt. Contested by Yao Randle (4.5 feet, MAN). COLE SIMMONS MAKES IT! Assist: Victor McCollum
Score: 41-47

[03:15] Team_074 possession (Score: 41-47)
Ayo Smith drives and kicks out. James Barnes attempts a Midrange. Contested by Zion Markkanen (5.4 feet, MAN). JAMES BARNES MAKES IT!
Score: 43-47

[03:00] Team_083 possession (Score: 43-47)
Zion Markkanen attempts a 3Pt. Contested by Giannis Westbrook (4.6 feet, ZONE). ZION MARKKANEN MAKES IT! Assist: Cole Simmons
Score: 43-50

[02:41] Team_074 possession (Score: 43-50)
Ayo Smith attempts a Midrange. Contested by Domantas Doncic (4.7 feet, MAN). Ayo Smith misses. Rebound secured by Victor McCollum.

[02:30] Team_083 possession (Score: 43-50)
Domantas Doncic drives and kicks out. Cole Simmons attempts a Midrange. Contested by Yao Randle (4.5 feet, ZONE). Cole Simmons misses. Offensive rebound by Damian Towns! Damian Towns kicks it out.

[02:14] Team_083 possession (Score: 43-50)
Damian Towns drives and kicks out. Domantas Doncic attempts a 3Pt. Contested by Yao Randle (4.5 feet, ZONE). Domantas Doncic misses. Rebound secured by Yao Randle.

[02:01] Team_074 possession (Score: 43-50)
Jaren Rozier makes the Layup and draws the foul on Damian Towns! And-1! Jaren Rozier to the line for 1. [BONUS: 5 team fouls] (Damian Towns: 3 personal fouls)   FT 1/1: GOOD Jaren Rozier makes 1/1 from the line.
Score: 46-50

[01:44] Team_083 possession (Score: 46-50)
Victor McCollum attempts a 3Pt. Contested by James Barnes (4.9 feet, ZONE). Victor McCollum misses. Offensive rebound by Victor McCollum! Victor McCollum's putback is no good. Rebound secured by Yao Randle.

[01:25] Team_074 possession (Score: 46-50)
FOUL! Reach-in foul on Cole Simmons during the drive. [IN THE BONUS! 6 team fouls] Yao Randle to the line for 2 free throws. (Cole Simmons: 1 personal fouls)   FT 1/2: GOOD   FT 2/2: GOOD Yao Randle makes 2/2 from the line.
Score: 48-50

[01:14] Team_083 possession (Score: 48-50)
Damian Towns drives and kicks out. Cole Simmons attempts a 3Pt. Contested by James Barnes (4.3 feet, ZONE). Cole Simmons misses. Rebound secured by Ayo Smith.

[01:03] Team_074 possession (Score: 48-50)
FOUL! Offensive foul on Ayo Smith! Domantas Doncic drew the charge! [Team fouls: 5] (Ayo Smith: 1 personal fouls) TURNOVER! (dead ball)

[00:54] Team_083 possession (Score: 48-50)
Zion Markkanen drives, picks up Yao Randle. Help arrives from Giannis Westbrook! Zion Markkanen attempts a Dunk. Contested by Giannis Westbrook (4.7 feet, ZONE). ZION MARKKANEN MAKES IT!
Score: 48-52

[00:41] Team_074 possession (Score: 48-52)
Ayo Smith drives and kicks out. Giannis Westbrook attempts a 3Pt. Contested by Damian Towns (5.0 feet, ZONE). Giannis Westbrook misses. Rebound secured by Damian Towns.

[00:25] Team_083 possession (Score: 48-52)
FOUL! Reach-in foul on Yao Randle during the drive. [IN THE BONUS! 6 team fouls] Victor McCollum to the line for 2 free throws. (Yao Randle: 1 personal fouls)   FT 1/2: MISS   FT 2/2: GOOD Victor McCollum makes 1/2 from the line.
Score: 48-53

[00:12] Team_074 possession (Score: 48-53)
Yao Randle attempts a Layup. BLOCKED BY COLE SIMMONS! Ball is loose! Rebound secured by Cole Simmons.

[00:01] Team_083 possession (Score: 48-53)
Cole Simmons attempts a Layup. Contested by Yao Randle (4.6 feet, MAN). Cole Simmons misses. Rebound secured by Yao Randle.

================================================================================
                              2ND QUARTER COMPLETE                              
================================================================================

2ND QUARTER SCORE: Team_074 22, Team_083 18

BOX SCORE:
================================================================================

Team_074
--------------------------------------------------------------------------------
Player                MIN  PTS  REB  AST  TO      FG   FG%      3P   3P%
--------------------------------------------------------------------------------
Jaren Rozier            9    8    4    0   0   3/4    75.0     0/0   0.0
James Barnes            9    4    0    0   0   2/3    66.7     0/0   0.0
Shai Green             16    2    0    0   0   1/1   100.0     0/0   0.0
James Turner           16    2    3    0   0   1/2    50.0     0/0   0.0
Dwyane Quickley        16    2    0    0   0   1/1   100.0     0/0   0.0
Giannis Westbrook       9    2    0    0   0   1/1   100.0     0/0   0.0
Yao Randle              9    2    4    0   0   1/3    33.3     0/0   0.0
Donovan Doncic         16    0    2    2   0   0/1     0.0     0/0   0.0
Ayo Smith               9    0    2    2   0   0/2     0.0     0/0   0.0

TEAM: FG: 10/18 (55.6%), 3PT: 0/0 (0.0%), REB: 14 (4 off, 10 def), AST: 4, TO: 2
TEAM FOULS: 6 [Team_083 in BONUS]


Team_083
--------------------------------------------------------------------------------
Player                MIN  PTS  REB  AST  TO      FG   FG%      3P   3P%
--------------------------------------------------------------------------------
Zion Markkanen          9    5    0    0   0   2/4    50.0     0/0   0.0
Kyrie Griffin          16    4    1    0   0   2/2   100.0     0/0   0.0
Victor McCollum         9    3    3    1   0   2/3    66.7     0/0   0.0
Cole Simmons            9    3    2    1   0   1/3    33.3     0/0   0.0
Bradley Thompson       16    2    1    1   0   1/2    50.0     0/0   0.0
Karl Jokic             16    0    0    0   0   0/1     0.0     0/0   0.0
Damian Towns            9    0    5    0   0   0/3     0.0     0/0   0.0
Domantas Doncic         9    0    0    0   0   0/1     0.0     0/0   0.0

TEAM: FG: 8/19 (42.1%), 3PT: 2/6 (33.3%), REB: 13 (5 off, 8 def), AST: 3, TO: 1
TEAM FOULS: 6 [Team_074 in BONUS]

================================================================================

================================================================================
                       3RD QUARTER - Team_074 vs Team_083                       
================================================================================

[12:00] Team_074 possession (Score: 48-53)
Donovan Doncic attempts a 3Pt. Contested by Kyrie Griffin (3.7 feet, MAN). Donovan Doncic misses. Rebound secured by Kyrie Griffin.

[11:49] Team_083 possession (Score: 48-53)
Malcolm Brogdon makes the 3Pt and draws the foul on Dwyane Quickley! And-1! Malcolm Brogdon to the line for 1. [Team fouls: 1] (Dwyane Quickley: 1 personal fouls)   FT 1/1: GOOD Malcolm Brogdon makes 1/1 from the line.
Score: 48-57

[11:36] Team_074 possession (Score: 48-57)
Dwyane Quickley attempts a Midrange. Contested by Malcolm Brogdon (5.1 feet, MAN). DWYANE QUICKLEY MAKES IT!
Score: 50-57

[11:24] Team_083 possession (Score: 50-57)
Bradley Thompson drives, Donovan Doncic stays with him. Bradley Thompson attempts a Dunk. Contested by Donovan Doncic (3.8 feet, ZONE). Bradley Thompson misses. Rebound secured by James Turner.

[11:08] Team_074 possession (Score: 50-57)
Chris Carter drives to the basket... Chris Carter loses control! Ball rolls out of bounds! TURNOVER! (dead ball)

[10:56] Team_083 possession (Score: 50-57)
Malcolm Brogdon drives and kicks out. Malcolm Brogdon attempts a 3Pt. Contested by Dwyane Quickley (5.4 feet, MAN). Malcolm Brogdon misses. FOUL! Loose ball foul on Shai Green during the rebound battle. [Team fouls: 2] No free throws, side out. (Shai Green: 1 personal fouls)

[10:42] Team_083 possession (Score: 50-57)
Bradley Thompson attempts a Layup. Contested by Donovan Doncic (3.8 feet, ZONE). BRADLEY THOMPSON MAKES IT! Assist: Kyrie Griffin
Score: 50-59

[10:30] Team_074 possession (Score: 50-59)
Donovan Doncic drives to the basket... Donovan Doncic throws a bad pass! Stolen by Kyrie Griffin! TURNOVER! (live ball)

[10:11] Team_083 possession (Score: 50-59)
Malcolm Brogdon attempts a Layup. Contested by Dwyane Quickley (5.1 feet, MAN). MALCOLM BROGDON MAKES IT! Assist: Bradley Thompson
Score: 50-61

[09:59] Team_074 possession (Score: 50-61)
James Turner drives and kicks out. James Turner attempts a Midrange. Contested by Kyrie Griffin (3.4 feet, ZONE). James Turner misses. FOUL! Loose ball foul on Bradley Thompson during the rebound battle. [Team fouls: 1] No free throws, side out. (Bradley Thompson: 1 personal fouls)

[09:48] Team_074 possession (Score: 50-61)
James Turner drives, Kyrie Griffin stays with him. James Turner attempts a Dunk. Contested by Kyrie Griffin (4.0 feet, ZONE). James Turner misses. Rebound secured by Kyrie Griffin.

[09:31] Team_083 possession (Score: 50-61)
Yao Oladipo drives to the basket... Yao Oladipo loses the ball! Stripped by Shai Green! TURNOVER! (live ball)

[09:17] Team_074 possession (Score: 50-61)
Shai Green attempts a 3Pt. Contested by Yao Oladipo (3.9 feet, ZONE). Shai Green misses. Rebound secured by Yao Oladipo.

[08:58] Team_083 possession (Score: 50-61)
Kyrie Griffin makes the Layup and draws the foul on Donovan Doncic! And-1! Kyrie Griffin to the line for 1. [Team fouls: 3] (Donovan Doncic: 1 personal fouls)   FT 1/1: MISS Kyrie Griffin makes 0/1 from the line. Offensive rebound by Kyrie Griffin! Kyrie Griffin kicks it out.
Score: 50-63

[08:42] Team_083 possession (Score: 50-63)
Bradley Thompson attempts a Midrange. Contested by Donovan Doncic (3.8 feet, ZONE). Bradley Thompson misses. Offensive rebound by Kyrie Griffin! Kyrie Griffin kicks it out.

[08:26] Team_083 possession (Score: 50-63)
Malcolm Brogdon attempts a 3Pt. Contested by Dwyane Quickley (5.1 feet, ZONE). Malcolm Brogdon misses. Rebound secured by James Turner.

[08:11] Team_074 possession (Score: 50-63)
Dwyane Quickley drives and kicks out. Shai Green attempts a Midrange. Contested by Yao Oladipo (3.4 feet, MAN). Shai Green misses. Rebound secured by Kyrie Griffin.

[08:01] Team_083 possession (Score: 50-63)
Yao Oladipo attempts a 3Pt. Contested by Shai Green (3.8 feet, MAN). Yao Oladipo misses. Offensive rebound by Kyrie Griffin! Kyrie Griffin kicks it out.

[07:47] Team_083 possession (Score: 50-63)
FOUL! Holding foul on Dwyane Quickley. [Team fouls: 4] No free throws, side out. (Dwyane Quickley: 2 personal fouls)

[07:32] Team_083 possession (Score: 50-63)
Bradley Thompson attempts a 3Pt. Contested by Dwyane Quickley (5.5 feet, ZONE). Bradley Thompson misses. Rebound secured by Shai Green.

[07:18] Team_074 possession (Score: 50-63)
Shai Green attempts a Midrange. Contested by Kyrie Griffin (3.9 feet, ZONE). Shai Green misses. Rebound secured by Kyrie Griffin.

[07:09] Team_083 possession (Score: 50-63)
Yao Oladipo attempts a 3Pt. Contested by Shai Green (3.8 feet, MAN). YAO OLADIPO MAKES IT! Assist: Malcolm Brogdon
Score: 50-66

[06:51] Team_074 possession (Score: 50-66)
Chris Carter drives, Kyrie Griffin stays with him. Chris Carter attempts a Dunk. Contested by Kyrie Griffin (4.0 feet, ZONE). Chris Carter misses. Rebound secured by Kyrie Griffin.

[06:36] Team_083 possession (Score: 50-66)
Bradley Thompson attempts a Midrange. Contested by James Turner (3.5 feet, MAN). BRADLEY THOMPSON MAKES IT! Assist: Malcolm Brogdon
Score: 50-68

[06:20] Team_074 possession (Score: 50-68)
FOUL! Holding foul on Kyrie Griffin. [Team fouls: 2] No free throws, side out. (Kyrie Griffin: 1 personal fouls)

[06:05] Team_074 possession (Score: 50-68)
Chris Carter makes the Layup and draws the foul on Kyrie Griffin! And-1! Chris Carter to the line for 1. [Team fouls: 3] (Kyrie Griffin: 2 personal fouls)   FT 1/1: GOOD Chris Carter makes 1/1 from the line.
Score: 53-68

[05:53] Team_083 possession (Score: 53-68)
Bradley Thompson drives and kicks out. Yao Oladipo attempts a 3Pt. Contested by Dwyane Quickley (5.4 feet, ZONE). Yao Oladipo misses. Rebound secured by James Turner.

[05:41] Team_074 possession (Score: 53-68)
Shai Green attempts a Midrange. Contested by Yao Oladipo (3.9 feet, MAN). SHAI GREEN MAKES IT! Assist: Donovan Doncic
Score: 55-68

[05:25] Team_083 possession (Score: 55-68)
Karl Jokic attempts a 3Pt. Contested by Chris Carter (4.8 feet, MAN). Karl Jokic misses. Offensive rebound by Kyrie Griffin! Kyrie Griffin kicks it out.

[05:12] Team_083 possession (Score: 55-68)
Karl Jokic attempts a 3Pt. Contested by Chris Carter (4.8 feet, MAN). Karl Jokic misses. Rebound secured by James Turner.

[04:56] Team_074 possession (Score: 55-68)
Donovan Doncic attempts a Midrange. Contested by Kyrie Griffin (3.8 feet, MAN). DONOVAN DONCIC MAKES IT!
Score: 57-68

[04:38] Team_083 possession (Score: 57-68)
Bradley Thompson commits a violation (traveling/carry)! TURNOVER! (dead ball)

[04:21] Team_074 possession (Score: 57-68)
Shai Green makes the Dunk and draws the foul on Yao Oladipo! And-1! Shai Green to the line for 1. [Team fouls: 4] (Yao Oladipo: 1 personal fouls)   FT 1/1: GOOD Shai Green makes 1/1 from the line.
Score: 60-68

[04:07] Team_083 possession (Score: 60-68)
Yao Oladipo attempts a Layup. Contested by Shai Green (3.9 feet, MAN). YAO OLADIPO MAKES IT! Assist: Bradley Thompson
Score: 60-70

[03:51] Team_074 possession (Score: 60-70)
Dwyane Quickley attempts a 3Pt. Contested by Malcolm Brogdon (5.2 feet, MAN). Dwyane Quickley misses. Rebound secured by Yao Oladipo.

[03:38] Team_083 possession (Score: 60-70)
Malcolm Brogdon attempts a 3Pt. Contested by Dwyane Quickley (5.2 feet, ZONE). Malcolm Brogdon misses. Rebound secured by Donovan Doncic.

[03:22] Team_074 possession (Score: 60-70)
Chris Carter attempts a Midrange. Contested by Karl Jokic (5.3 feet, ZONE). CHRIS CARTER MAKES IT! Assist: James Turner
Score: 62-70

[03:08] Team_083 possession (Score: 62-70)
Yao Oladipo attempts a Midrange. Contested by Shai Green (4.0 feet, MAN). Yao Oladipo misses. Rebound secured by Donovan Doncic.

[02:53] Team_074 possession (Score: 62-70)
James Turner attempts a Layup. Contested by Bradley Thompson (4.6 feet, MAN). James Turner misses. Rebound secured by Kyrie Griffin.

[02:41] Team_083 possession (Score: 62-70)
FOUL! Holding foul on James Turner. [IN THE BONUS! 5 team fouls] Bradley Thompson to the line for 2 free throws. (James Turner: 1 personal fouls)   FT 1/2: GOOD   FT 2/2: GOOD Bradley Thompson makes 2/2 from the line.
Score: 62-72

[02:26] Team_074 possession (Score: 62-72)
Shai Green drives to the basket... Shai Green loses the ball! Stripped by Kyrie Griffin! TURNOVER! (live ball)

[02:09] Team_083 possession (Score: 62-72)
Yao Oladipo attempts a 3Pt. Contested by Chris Carter (4.8 feet, ZONE). YAO OLADIPO MAKES IT! Assist: Kyrie Griffin
Score: 62-75

[01:53] Team_074 possession (Score: 62-75)
Dwyane Quickley attempts a 3Pt. Contested by Malcolm Brogdon (5.4 feet, MAN). DWYANE QUICKLEY MAKES IT! Assist: James Turner
Score: 65-75

[01:34] Team_083 possession (Score: 65-75)
FOUL! Shooting foul on Shai Green. Malcolm Brogdon to the line for 2 free throws. [BONUS: 6 team fouls] (Shai Green: 2 personal fouls)   FT 1/2: GOOD   FT 2/2: GOOD Malcolm Brogdon makes 2/2 from the line.
Score: 65-77

[01:16] Team_074 possession (Score: 65-77)
Chris Carter attempts a 3Pt. Contested by Karl Jokic (5.4 feet, MAN). CHRIS CARTER MAKES IT! Assist: James Turner
Score: 68-77

[01:05] Team_083 possession (Score: 68-77)
Kyrie Griffin attempts a 3Pt. Contested by Donovan Doncic (4.3 feet, MAN). Kyrie Griffin misses. Rebound secured by Shai Green.

[00:49] Team_074 possession (Score: 68-77)
Chris Carter drives and kicks out. James Turner attempts a Midrange. Contested by Bradley Thompson (4.2 feet, MAN). James Turner misses. Rebound secured by Yao Oladipo.

[00:35] Team_083 possession (Score: 68-77)
Malcolm Brogdon attempts a 3Pt. Contested by Dwyane Quickley (5.4 feet, MAN). Malcolm Brogdon misses. Rebound secured by Donovan Doncic.

[00:22] Team_074 possession (Score: 68-77)
James Turner loses the ball! Stripped by Bradley Thompson! TURNOVER! (live ball)

[00:11] Team_083 possession (Score: 68-77)
Kyrie Griffin drives, picks up Donovan Doncic. Help arrives from Chris Carter! Kyrie Griffin attempts a Dunk. Contested by Chris Carter (4.4 feet, ZONE). Kyrie Griffin misses. Rebound secured by James Turner.

================================================================================
                              3RD QUARTER COMPLETE                              
================================================================================

3RD QUARTER SCORE: Team_074 20, Team_083 24

BOX SCORE:
================================================================================

Team_074
--------------------------------------------------------------------------------
Player                MIN  PTS  REB  AST  TO      FG   FG%      3P   3P%
--------------------------------------------------------------------------------
Chris Carter           28    8    0    0   0   3/5    60.0     0/0   0.0
Dwyane Quickley        28    5    0    0   0   2/4    50.0     0/0   0.0
Shai Green             28    5    2    0   0   2/4    50.0     0/0   0.0
Donovan Doncic         28    2    4    1   0   1/2    50.0     0/0   0.0
James Turner           28    0    5    3   0   0/2     0.0     0/0   0.0

TEAM: FG: 8/17 (47.1%), 3PT: 2/5 (40.0%), REB: 11 (1 off, 10 def), AST: 4, TO: 4
TEAM FOULS: 6 [Team_083 in BONUS]


Team_083
--------------------------------------------------------------------------------
Player                MIN  PTS  REB  AST  TO      FG   FG%      3P   3P%
--------------------------------------------------------------------------------
Malcolm Brogdon        28    8    0    2   0   3/6    50.0     0/0   0.0
Yao Oladipo            28    8    3    0   0   3/4    75.0     0/0   0.0
Bradley Thompson       28    6    0    2   0   3/6    50.0     0/0   0.0
Kyrie Griffin          28    0   11    2   0   0/2     0.0     0/0   0.0
Karl Jokic             28    0    0    0   0   0/1     0.0     0/0   0.0

TEAM: FG: 9/19 (47.4%), 3PT: 3/9 (33.3%), REB: 14 (5 off, 9 def), AST: 6, TO: 2
TEAM FOULS: 4

================================================================================

================================================================================
                       4TH QUARTER - Team_074 vs Team_083                       
================================================================================

[12:00] Team_074 possession (Score: 68-77)
Chris Carter attempts a Midrange. Contested by Karl Jokic (5.4 feet, ZONE). Chris Carter misses. Rebound secured by Yao Oladipo.

[11:43] Team_083 possession (Score: 68-77)
Karl Jokic attempts a Midrange. Contested by Chris Carter (5.1 feet, MAN). Karl Jokic misses. Rebound secured by James Turner.

[11:30] Team_074 possession (Score: 68-77)
Donovan Doncic attempts a 3Pt. Contested by Kyrie Griffin (4.1 feet, MAN). Donovan Doncic misses. FOUL! Loose ball foul on Kyrie Griffin during the rebound battle. [Team fouls: 1] No free throws, side out. (Kyrie Griffin: 1 personal fouls)

[11:19] Team_074 possession (Score: 68-77)
Chris Carter attempts a Midrange. Contested by Karl Jokic (5.4 feet, MAN). Chris Carter misses. Rebound secured by Yao Oladipo.

[11:05] Team_083 possession (Score: 68-77)
Yao Oladipo drives, Donovan Doncic stays with him. Yao Oladipo attempts a Layup. Contested by Donovan Doncic (4.3 feet, ZONE). YAO OLADIPO MAKES IT! Assist: Bradley Thompson
Score: 68-79

[10:53] Team_074 possession (Score: 68-79)
Shai Green makes the Layup and draws the foul on Yao Oladipo! And-1! Shai Green to the line for 1. [Team fouls: 2] (Yao Oladipo: 1 personal fouls)   FT 1/1: GOOD Shai Green makes 1/1 from the line.
Score: 71-79

[10:39] Team_083 possession (Score: 71-79)
Yao Oladipo drives, picks up Donovan Doncic. Help arrives from Chris Carter! Yao Oladipo attempts a Dunk. Contested by Chris Carter (4.3 feet, ZONE). YAO OLADIPO MAKES IT!
Score: 71-81

[10:23] Team_074 possession (Score: 71-81)
Donovan Doncic attempts a Midrange. Contested by Kyrie Griffin (4.3 feet, MAN). Donovan Doncic misses. Rebound secured by Yao Oladipo.

[10:12] Team_083 possession (Score: 71-81)
Karl Jokic attempts a 3Pt. Contested by Chris Carter (5.3 feet, MAN). Karl Jokic misses. Rebound secured by Shai Green.

[09:57] Team_074 possession (Score: 71-81)
James Turner throws a bad pass out of bounds! TURNOVER! (dead ball)

[09:57] Substitution (Team_074): Dwyane Quickley OUT → James Barnes IN (stamina_rule2)

[09:57] Substitution (Team_074): Chris Carter OUT → Giannis Westbrook IN (stamina_rule2)

[09:57] Substitution (Team_074): Shai Green OUT → Ayo Smith IN (stamina_rule2)

[09:57] Substitution (Team_074): Donovan Doncic OUT → Yao Randle IN (stamina_rule2)

[09:57] Substitution (Team_074): James Turner OUT → Jaren Rozier IN (stamina_rule2)

[09:57] Substitution (Team_083): Malcolm Brogdon OUT → Zion Markkanen IN (stamina_rule2)

[09:57] Substitution (Team_083): Karl Jokic OUT → Damian Towns IN (stamina_rule2)

[09:57] Substitution (Team_083): Yao Oladipo OUT → Domantas Doncic IN (stamina_rule2)

[09:57] Substitution (Team_083): Kyrie Griffin OUT → Cole Simmons IN (stamina_rule2)

[09:57] Substitution (Team_083): Bradley Thompson OUT → Victor McCollum IN (stamina_rule2)

[09:45] Team_083 possession (Score: 71-81)
Domantas Doncic attempts a 3Pt. Contested by Ayo Smith (4.9 feet, MAN). Domantas Doncic misses. Offensive rebound by Damian Towns! Damian Towns kicks it out.

[09:35] Team_083 possession (Score: 71-81)
Zion Markkanen drives and kicks out. Zion Markkanen attempts a 3Pt. Contested by James Barnes (4.2 feet, ZONE). Zion Markkanen misses. Rebound secured by Yao Randle.

[09:23] Team_074 possession (Score: 71-81)
James Barnes attempts a Midrange. Contested by Cole Simmons (4.7 feet, ZONE). James Barnes misses. Rebound secured by Cole Simmons.

[09:07] Team_083 possession (Score: 71-81)
FOUL! Offensive foul on Damian Towns! Giannis Westbrook drew the charge! [Team fouls: 3] (Damian Towns: 1 personal fouls) TURNOVER! (dead ball)

[08:56] Team_074 possession (Score: 71-81)
Yao Randle drives and kicks out. Jaren Rozier makes the Midrange and draws the foul on Victor McCollum! And-1! Jaren Rozier to the line for 1. [Team fouls: 4] (Victor McCollum: 1 personal fouls)   FT 1/1: GOOD Jaren Rozier makes 1/1 from the line.
Score: 74-81

[08:45] Team_083 possession (Score: 74-81)
Zion Markkanen attempts a Midrange. Contested by Giannis Westbrook (4.6 feet, ZONE). Zion Markkanen misses. Rebound secured by Yao Randle.

[08:26] Team_074 possession (Score: 74-81)
James Barnes attempts a 3Pt. Contested by Zion Markkanen (5.3 feet, ZONE). James Barnes misses. Rebound secured by Victor McCollum.

[08:07] Team_083 possession (Score: 74-81)
Domantas Doncic attempts a Layup. Contested by Ayo Smith (4.9 feet, MAN). DOMANTAS DONCIC MAKES IT! Assist: Victor McCollum
Score: 74-83

[07:53] Team_074 possession (Score: 74-83)
Jaren Rozier attempts a 3Pt. Contested by Zion Markkanen (5.2 feet, ZONE). Jaren Rozier misses. Rebound secured by Cole Simmons.

[07:38] Team_083 possession (Score: 74-83)
Cole Simmons makes the Midrange and draws the foul on Yao Randle! And-1! Cole Simmons to the line for 1. [Team fouls: 1] (Yao Randle: 1 personal fouls)   FT 1/1: MISS Cole Simmons makes 0/1 from the line. Rebound secured by Ayo Smith.
Score: 74-85

[07:24] Team_074 possession (Score: 74-85)
Jaren Rozier drives to the basket... Jaren Rozier commits a violation (traveling/carry)! TURNOVER! (dead ball)

[07:06] Team_083 possession (Score: 74-85)
Cole Simmons drives and kicks out. Domantas Doncic attempts a 3Pt. Contested by James Barnes (4.2 feet, ZONE). DOMANTAS DONCIC MAKES IT! Assist: Zion Markkanen
Score: 74-88

[06:55] Team_074 possession (Score: 74-88)
James Barnes attempts a 3Pt. Contested by Zion Markkanen (5.3 feet, MAN). James Barnes misses. Rebound secured by Victor McCollum.

[06:39] Team_083 possession (Score: 74-88)
Domantas Doncic drives, Ayo Smith stays with him. Domantas Doncic attempts a Layup. Contested by Ayo Smith (4.9 feet, MAN). Domantas Doncic misses. Rebound secured by Jaren Rozier.

[06:25] Team_074 possession (Score: 74-88)
Jaren Rozier attempts a Layup. Contested by Victor McCollum (3.8 feet, ZONE). JAREN ROZIER MAKES IT! Assist: Ayo Smith
Score: 76-88

[06:15] Team_083 possession (Score: 76-88)
Domantas Doncic drives and kicks out. Zion Markkanen attempts a 3Pt. Contested by James Barnes (4.2 feet, MAN). ZION MARKKANEN MAKES IT! Assist: Damian Towns
Score: 76-91

[06:00] Team_074 possession (Score: 76-91)
Yao Randle attempts a 3Pt. Contested by Domantas Doncic (4.6 feet, ZONE). Yao Randle misses. Offensive rebound by Yao Randle! Yao Randle kicks it out.

[05:48] Team_074 possession (Score: 76-91)
Ayo Smith drives to the basket... Ayo Smith commits a violation (traveling/carry)! TURNOVER! (dead ball)

[05:35] Team_083 possession (Score: 76-91)
Damian Towns attempts a Layup. Contested by Yao Randle (5.0 feet, ZONE). DAMIAN TOWNS MAKES IT! Assist: Victor McCollum
Score: 76-93

[05:17] Team_074 possession (Score: 76-93)
FOUL! Holding foul on Victor McCollum. [IN THE BONUS! 5 team fouls] Jaren Rozier to the line for 2 free throws. (Victor McCollum: 2 personal fouls)   FT 1/2: GOOD   FT 2/2: GOOD Jaren Rozier makes 2/2 from the line.
Score: 78-93

[05:03] Team_083 possession (Score: 78-93)
Domantas Doncic drives, picks up Ayo Smith. Help arrives from Giannis Westbrook! Domantas Doncic attempts a Layup. Contested by Giannis Westbrook (4.9 feet, MAN). DOMANTAS DONCIC MAKES IT!
Score: 78-95

[04:48] Team_074 possession (Score: 78-95)
Jaren Rozier makes the Midrange and draws the foul on Victor McCollum! And-1! Jaren Rozier to the line for 1. [BONUS: 6 team fouls] (Victor McCollum: 3 personal fouls)   FT 1/1: GOOD Jaren Rozier makes 1/1 from the line.
Score: 81-95

[04:36] Team_083 possession (Score: 81-95)
Zion Markkanen attempts a Layup. Contested by Jaren Rozier (4.6 feet, ZONE). Zion Markkanen misses. Rebound secured by Yao Randle.

[04:20] Team_074 possession (Score: 81-95)
Yao Randle makes the 3Pt and draws the foul on Zion Markkanen! And-1! Yao Randle to the line for 1. [BONUS: 7 team fouls] (Zion Markkanen: 1 personal fouls)   FT 1/1: GOOD Yao Randle makes 1/1 from the line.
Score: 85-95

[04:03] Team_083 possession (Score: 85-95)
Damian Towns attempts a Layup. BLOCKED BY YAO RANDLE! Ball is loose! Offensive rebound by Damian Towns! Damian Towns kicks it out.

[03:50] Team_083 possession (Score: 85-95)
Cole Simmons attempts a 3Pt. Contested by James Barnes (4.2 feet, ZONE). Cole Simmons misses. Offensive rebound by Victor McCollum! Victor McCollum's putback is no good. Rebound secured by Jaren Rozier.

[03:36] Team_074 possession (Score: 85-95)
Yao Randle attempts a Midrange. Contested by Cole Simmons (4.9 feet, ZONE). Yao Randle misses. Rebound secured by Cole Simmons.

[03:21] Team_083 possession (Score: 85-95)
FOUL! Shooting foul on Giannis Westbrook. Damian Towns to the line for 2 free throws. [Team fouls: 2] (Giannis Westbrook: 1 personal fouls)   FT 1/2: GOOD   FT 2/2: GOOD Damian Towns makes 2/2 from the line.
Score: 85-97

[03:07] Team_074 possession (Score: 85-97)
Jaren Rozier attempts a 3Pt. Contested by Victor McCollum (3.8 feet, MAN). JAREN ROZIER MAKES IT! Assist: Ayo Smith
Score: 88-97

[02:52] Team_083 possession (Score: 88-97)
FOUL! Reach-in foul on Jaren Rozier during the drive. [Team fouls: 3] No free throws, side out. (Jaren Rozier: 1 personal fouls)

[02:39] Team_083 possession (Score: 88-97)
Damian Towns attempts a Midrange. Contested by Giannis Westbrook (5.0 feet, MAN). Damian Towns misses. Offensive rebound by Victor McCollum! Victor McCollum's putback is no good. Rebound secured by Ayo Smith.

[02:24] Team_074 possession (Score: 88-97)
Giannis Westbrook attempts a 3Pt. Contested by Damian Towns (5.1 feet, MAN). Giannis Westbrook misses. Rebound secured by Cole Simmons.

[02:06] Team_083 possession (Score: 88-97)
Domantas Doncic attempts a 3Pt. Contested by James Barnes (4.5 feet, ZONE). Domantas Doncic misses. Rebound secured by Jaren Rozier.

[01:55] Team_074 possession (Score: 88-97)
Yao Randle makes the Layup and draws the foul on Damian Towns! And-1! Yao Randle to the line for 1. [BONUS: 8 team fouls] (Damian Towns: 2 personal fouls)   FT 1/1: GOOD Yao Randle makes 1/1 from the line.
Score: 91-97

[01:39] Team_083 possession (Score: 91-97)
Victor McCollum drives to the basket... FOUL! Offensive foul on Victor McCollum! Yao Randle drew the charge! [Team fouls: 9] (Victor McCollum: 4 personal fouls) TURNOVER! (dead ball)

[01:25] Team_074 possession (Score: 91-97)
James Barnes attempts a 3Pt. Contested by Zion Markkanen (5.4 feet, ZONE). James Barnes misses. Rebound secured by Cole Simmons.

[01:09] Team_083 possession (Score: 91-97)
Zion Markkanen attempts a 3Pt. Contested by Ayo Smith (5.1 feet, ZONE). ZION MARKKANEN MAKES IT! Assist: Victor McCollum
Score: 91-100

[00:57] Team_074 possession (Score: 91-100)
Jaren Rozier attempts a Midrange. Contested by Cole Simmons (4.8 feet, ZONE). JAREN ROZIER MAKES IT! Assist: Yao Randle
Score: 93-100

[00:44] Team_083 possession (Score: 93-100)
Victor McCollum drives, picks up Jaren Rozier. Help arrives from Giannis Westbrook! Victor McCollum attempts a Dunk. Contested by Giannis Westbrook (5.3 feet, ZONE). Victor McCollum misses. FOUL! Loose ball foul on Jaren Rozier during the rebound battle. [Team fouls: 4] No free throws, side out. (Jaren Rozier: 2 personal fouls)

[00:28] Team_083 possession (Score: 93-100)
Zion Markkanen attempts a 3Pt. Contested by Ayo Smith (5.2 feet, ZONE). ZION MARKKANEN MAKES IT! Assist: Damian Towns
Score: 93-103

[00:15] Team_074 possession (Score: 93-103)
Giannis Westbrook attempts a Layup. Contested by Cole Simmons (5.1 feet, ZONE). Giannis Westbrook misses. Offensive rebound by Jaren Rozier! Jaren Rozier kicks it out.

================================================================================
                              4TH QUARTER COMPLETE                              
================================================================================

4TH QUARTER SCORE: Team_074 25, Team_083 26

BOX SCORE:
================================================================================

Team_074
--------------------------------------------------------------------------------
Player                MIN  PTS  REB  AST  TO      FG   FG%      3P   3P%
--------------------------------------------------------------------------------
Jaren Rozier           19   15    4    0   0   6/7    85.7     0/0   0.0
Yao Randle             19    7    4    1   0   2/3    66.7     0/0   0.0
Shai Green             30    3    1    0   0   1/1   100.0     0/0   0.0
Chris Carter           30    0    0    0   0   0/2     0.0     0/0   0.0
James Turner           30    0    2    0   0   0/0     0.0     0/0   0.0
Donovan Doncic         30    0    0    0   0   0/1     0.0     0/0   0.0
James Barnes           19    0    0    0   0   0/4     0.0     0/0   0.0
Giannis Westbrook      19    0    0    0   0   0/1     0.0     0/0   0.0

TEAM: FG: 9/19 (47.4%), 3PT: 2/7 (28.6%), REB: 11 (3 off, 8 def), AST: 3, TO: 3
TEAM FOULS: 4


Team_083
--------------------------------------------------------------------------------
Player                MIN  PTS  REB  AST  TO      FG   FG%      3P   3P%
--------------------------------------------------------------------------------
Zion Markkanen         19    9    0    1   0   3/6    50.0     0/0   0.0
Domantas Doncic        19    7    0    0   0   3/5    60.0     0/0   0.0
Yao Oladipo            30    4    3    0   0   2/2   100.0     0/0   0.0
Damian Towns           19    4    3    2   0   2/3    66.7     0/0   0.0
Karl Jokic             30    0    0    0   0   0/2     0.0     0/0   0.0
Bradley Thompson       30    0    0    1   0   0/0     0.0     0/0   0.0
Cole Simmons           19    0    5    0   0   0/2     0.0     0/0   0.0
Victor McCollum        19    0    2    3   0   0/0     0.0     0/0   0.0
Ayo Smith              19    0    2    2   0   0/0     0.0     0/0   0.0

TEAM: FG: 10/20 (50.0%), 3PT: 2/5 (40.0%), REB: 15 (5 off, 10 def), AST: 7, TO: 2
TEAM FOULS: 9 [Team_074 in BONUS]

================================================================================

================================================================================
                               FULL GAME COMPLETE                               
================================================================================

FINAL SCORE: Team_074 93, Team_083 103

SCORING BY QUARTER:
--------------------------------------------------------------------------------
Team                     Q1     Q2     Q3     Q4    FINAL
--------------------------------------------------------------------------------
Team_074                 26     22     20     25       93
Team_083                 35     18     24     26      103
--------------------------------------------------------------------------------

FULL GAME BOX SCORE:
================================================================================

Team_074
--------------------------------------------------------------------------------
Player                MIN  PTS  REB  AST  TO      FG   FG%      3P   3P%      FT STL BLK
--------------------------------------------------------------------------------
Dwyane Quickley        30   12    0    0   2   3/8    37.5   1/3    33.3   2/3     0   0
Chris Carter           30    8    0    1   1   4/11   36.4   1/3    33.3   1/1     0   0
Shai Green             30   15    4    0   1   6/10   60.0   1/4    25.0   7/7     1   0
Donovan Doncic         30    4   10    4   0   2/6    33.3   0/2     0.0   2/2     0   1
James Turner           30   13   12    3   2   7/14   50.0   1/3    33.3   3/5     1   0
James Barnes           19    4    0    0   0   1/6    16.7   0/3     0.0   0/0     0   0
Giannis Westbrook      19    2    0    0   1   1/2    50.0   0/1     0.0   0/0     0   0
Ayo Smith              19    0    4    4   1   1/3    33.3   0/0     0.0   0/0     0   0
Yao Randle             19    9    8    1   1   4/7    57.1   1/1   100.0   4/4     0   1
Jaren Rozier           19   23    8    0   0   7/9    77.8   1/2    50.0   6/6     0   0

TEAM: FG: 37/77 (48.1%), 3PT: 6/22 (27.3%), REB: 43 (10 off, 33 def), AST: 13, TO: 9


Team_083
--------------------------------------------------------------------------------
Player                MIN  PTS  REB  AST  TO      FG   FG%      3P   3P%      FT STL BLK
--------------------------------------------------------------------------------
Malcolm Brogdon        30   12    0    4   1   5/10   50.0   1/5    20.0   5/5     0   0
Karl Jokic             30    6    0    0   0   3/8    37.5   1/4    25.0   3/3     0   0
Yao Oladipo            30   24   10    1   0  10/11   90.9   3/3   100.0   0/0     0   0
Kyrie Griffin          30    8   18    3   0   4/8    50.0   0/3     0.0   2/3     2   1
Bradley Thompson       30   17    7    6   3   6/10   60.0   0/1     0.0   5/6     1   0
Zion Markkanen         19   14    0    1   0   4/9    44.4   3/4    75.0   0/0     0   0
Damian Towns           19    4    8    2   2   2/6    33.3   0/0     0.0   2/2     0   0
Domantas Doncic        19    7    0    0   1   4/7    57.1   0/2     0.0   0/0     0   0
Cole Simmons           19    3    7    1   0   2/6    33.3   1/2    50.0   0/1     0   1
Victor McCollum        19    3    5    4   0   1/2    50.0   0/1     0.0   1/2     0   1

TEAM: FG: 42/78 (53.8%), 3PT: 9/25 (36.0%), REB: 58 (18 off, 40 def), AST: 22, TO: 7

================================================================================
