================================================================================
                        FULL GAME - Team_091 vs Team_084                        
================================================================================

================================================================================
                       1ST QUARTER - Team_091 vs Team_084                       
================================================================================

[12:00] Team_091 possession (Score: 0-0)
FOUL! Holding foul on Jarrett Booker. [Team fouls: 1] No free throws, side out. (Jarrett Booker: 1 personal fouls)

[11:42] Team_091 possession (Score: 0-0)
Kevin Simons drives to the basket... Kevin Simons throws a bad pass out of bounds! TURNOVER! (dead ball)

[11:26] Team_084 possession (Score: 0-0)
Dejounte Ginobili attempts a 3Pt. Contested by Isaiah Siakam (5.9 feet, MAN). Dejounte Ginobili misses. Rebound secured by Kevin Simons.

[11:08] Team_091 possession (Score: 0-0)
Isaiah Siakam drives, picks up Dejounte Ginobili. Help arrives from Luka Sexton! Isaiah Siakam attempts a Dunk. Contested by Luka Sexton (4.9 feet, MAN). Isaiah Siakam misses. Rebound secured by Dejounte Ginobili.

[10:57] Team_084 possession (Score: 0-0)
Luka Sexton drives and kicks out. Jarrett Booker attempts a 3Pt. Contested by D'Angelo Ingram (4.6 feet, MAN). Jarrett Booker misses. Offensive rebound by Dejounte Ginobili! Dejounte Ginobili kicks it out.

[10:41] Team_084 possession (Score: 0-0)
Klay Thompson attempts a 3Pt. Contested by Rudy Bridges (4.8 feet, MAN). Klay Thompson misses. Rebound secured by Kevin Simons.

[10:23] Team_091 possession (Score: 0-0)
Isaiah Siakam attempts a Layup. Contested by Giannis Quickley (4.7 feet, ZONE). Isaiah Siakam misses. Rebound secured by Dejounte Ginobili.

[10:09] Team_084 possession (Score: 0-0)
Jarrett Booker attempts a Midrange. Contested by D'Angelo Ingram (4.9 feet, MAN). Jarrett Booker misses. Rebound secured by Rudy Bridges.

[09:58] Team_091 possession (Score: 0-0)
Isaiah Siakam drives, picks up Dejounte Ginobili. Help arrives from Luka Sexton! Isaiah Siakam attempts a Layup. Contested by Luka Sexton (4.9 feet, MAN). ISAIAH SIAKAM MAKES IT!
Score: 2-0

[09:43] Team_084 possession (Score: 2-0)
FOUL! Shooting foul on D'Angelo Ingram. Jarrett Booker to the line for 2 free throws. [Team fouls: 1] (D'Angelo Ingram: 1 personal fouls)   FT 1/2: GOOD   FT 2/2: GOOD Jarrett Booker makes 2/2 from the line.
Score: 2-2

[09:29] Team_091 possession (Score: 2-2)
FOUL! Reach-in foul on Giannis Quickley during the drive. [Team fouls: 2] No free throws, side out. (Giannis Quickley: 1 personal fouls)

[09:15] Team_091 possession (Score: 2-2)
Rudy Bridges drives to the basket... Rudy Bridges commits a violation (traveling/carry)! TURNOVER! (dead ball)

[09:01] Team_084 possession (Score: 2-2)
FOUL! Holding foul on Rudy Bridges. [Team fouls: 2] No free throws, side out. (Rudy Bridges: 1 personal fouls)

[08:47] Team_084 possession (Score: 2-2)
FOUL! Holding foul on D'Angelo Ingram. [Team fouls: 3] No free throws, side out. (D'Angelo Ingram: 2 personal fouls)

[08:30] Team_084 possession (Score: 2-2)
Dejounte Ginobili drives and kicks out. Giannis Quickley attempts a 3Pt. Contested by Kevin Simons (3.5 feet, MAN). GIANNIS QUICKLEY MAKES IT! Assist: Dejounte Ginobili
Score: 2-5

[08:18] Team_091 possession (Score: 2-5)
Rudy Bridges attempts a Layup. Contested by Klay Thompson (4.9 feet, MAN). RUDY BRIDGES MAKES IT! Assist: Isaiah Siakam
Score: 4-5

[08:01] Team_084 possession (Score: 4-5)
Dejounte Ginobili attempts a 3Pt. Contested by Isaiah Siakam (5.9 feet, MAN). DEJOUNTE GINOBILI MAKES IT! Assist: Luka Sexton
Score: 4-8

[07:47] Team_091 possession (Score: 4-8)
Kyrie Rozier attempts a Midrange. Contested by Luka Sexton (3.8 feet, MAN). Kyrie Rozier misses. Offensive rebound by Kevin Simons! Kevin Simons's putback is no good. Rebound secured by Giannis Quickley.

[07:35] Team_084 possession (Score: 4-8)
Luka Sexton attempts a Midrange. Contested by D'Angelo Ingram (5.0 feet, ZONE). Luka Sexton misses. Rebound secured by Rudy Bridges.

[07:24] Team_091 possession (Score: 4-8)
FOUL! Offensive foul on Rudy Bridges! Klay Thompson drew the charge! [Team fouls: 4] (Rudy Bridges: 2 personal fouls) TURNOVER! (dead ball)

[07:09] Team_084 possession (Score: 4-8)
Giannis Quickley attempts a Midrange. Contested by D'Angelo Ingram (4.9 feet, ZONE). Giannis Quickley misses. Rebound secured by Rudy Bridges.

[06:57] Team_091 possession (Score: 4-8)
Isaiah Siakam drives to the basket... Isaiah Siakam commits a violation (traveling/carry)! TURNOVER! (dead ball)

[06:45] Team_084 possession (Score: 4-8)
Jarrett Booker attempts a Midrange. Contested by D'Angelo Ingram (4.9 feet, MAN). Jarrett Booker misses. Offensive rebound by Giannis Quickley! Giannis Quickley's putback is no good. Rebound secured by Kyrie Rozier.

[06:31] Team_091 possession (Score: 4-8)
Rudy Bridges makes the Midrange and draws the foul on Jarrett Booker! And-1! Rudy Bridges to the line for 1. [Team fouls: 3] (Jarrett Booker: 2 personal fouls)   FT 1/1: GOOD Rudy Bridges makes 1/1 from the line.
Score: 7-8

[06:16] Team_084 possession (Score: 7-8)
Klay Thompson attempts a Layup. Contested by Kevin Simons (4.0 feet, ZONE). Klay Thompson misses. Rebound secured by Kevin Simons.

[05:57] Team_091 possession (Score: 7-8)
Kyrie Rozier attempts a Midrange. Contested by Luka Sexton (3.8 feet, MAN). KYRIE ROZIER MAKES IT! Assist: Isaiah Siakam
Score: 9-8

[05:45] Team_084 possession (Score: 9-8)
Klay Thompson attempts a 3Pt. Contested by Rudy Bridges (4.8 feet, MAN). KLAY THOMPSON MAKES IT! Assist: Jarrett Booker
Score: 9-11

[05:34] Team_091 possession (Score: 9-11)
FOUL! Reach-in foul on Giannis Quickley during the drive. [Team fouls: 4] No free throws, side out. (Giannis Quickley: 2 personal fouls)

[05:15] Team_091 possession (Score: 9-11)
Rudy Bridges attempts a Layup. Contested by Klay Thompson (4.9 feet, MAN). RUDY BRIDGES MAKES IT!
Score: 11-11

[04:59] Team_084 possession (Score: 11-11)
Luka Sexton attempts a 3Pt. Contested by Kyrie Rozier (4.4 feet, MAN). Luka Sexton misses. Rebound secured by Kyrie Rozier.

[04:43] Team_091 possession (Score: 11-11)
D'Angelo Ingram attempts a Midrange. Contested by Jarrett Booker (5.6 feet, MAN). D'Angelo Ingram misses. Offensive rebound by Kevin Simons! Kevin Simons's putback is no good. Rebound secured by Giannis Quickley.

[04:31] Team_084 possession (Score: 11-11)
Jarrett Booker attempts a 3Pt. Contested by Kyrie Rozier (4.3 feet, ZONE). Jarrett Booker misses. Rebound secured by Kevin Simons.

[04:18] Team_091 possession (Score: 11-11)
Rudy Bridges attempts a Midrange. Contested by Klay Thompson (5.0 feet, MAN). Rudy Bridges misses. FOUL! Loose ball foul on Giannis Quickley during the rebound battle. [IN THE BONUS! 5 team fouls] Rudy Bridges to the line for 2 free throws. (Giannis Quickley: 3 personal fouls)   FT 1/2: GOOD   FT 2/2: GOOD Rudy Bridges makes 2/2 from the line.
Score: 13-11

[04:06] Team_084 possession (Score: 13-11)
Luka Sexton attempts a 3Pt. Contested by Kyrie Rozier (4.4 feet, ZONE). Luka Sexton misses. Offensive rebound by Dejounte Ginobili! Dejounte Ginobili kicks it out.

[03:50] Team_084 possession (Score: 13-11)
Luka Sexton attempts a 3Pt. Contested by Kyrie Rozier (4.4 feet, MAN). Luka Sexton misses. Rebound secured by Kyrie Rozier.

[03:38] Team_091 possession (Score: 13-11)
Rudy Bridges drives and kicks out. Kevin Simons attempts a 3Pt. Contested by Luka Sexton (3.8 feet, ZONE). KEVIN SIMONS MAKES IT!
Score: 16-11

[03:24] Team_084 possession (Score: 16-11)
FOUL! Reach-in foul on Kyrie Rozier during the drive. [IN THE BONUS! 5 team fouls] Luka Sexton to the line for 2 free throws. (Kyrie Rozier: 1 personal fouls)   FT 1/2: MISS   FT 2/2: GOOD Luka Sexton makes 1/2 from the line.
Score: 16-12

[03:12] Team_091 possession (Score: 16-12)
FOUL! Shooting foul on Jarrett Booker. Rudy Bridges to the line for 2 free throws. [BONUS: 6 team fouls] (Jarrett Booker: 3 personal fouls)   FT 1/2: MISS   FT 2/2: GOOD Rudy Bridges makes 1/2 from the line.
Score: 17-12

[02:56] Team_084 possession (Score: 17-12)
Klay Thompson attempts a 3Pt. Contested by Kyrie Rozier (4.7 feet, ZONE). Klay Thompson misses. Offensive rebound by Dejounte Ginobili! Dejounte Ginobili kicks it out.

[02:41] Team_084 possession (Score: 17-12)
Klay Thompson attempts a 3Pt. Contested by Rudy Bridges (5.0 feet, MAN). Klay Thompson misses. Rebound secured by Kevin Simons.

[02:30] Team_091 possession (Score: 17-12)
Isaiah Siakam attempts a Midrange. Contested by Jarrett Booker (5.1 feet, ZONE). Isaiah Siakam misses. Rebound secured by Klay Thompson.

[02:12] Team_084 possession (Score: 17-12)
FOUL! Reach-in foul on Rudy Bridges during the drive. [IN THE BONUS! 6 team fouls] Klay Thompson to the line for 2 free throws. (Rudy Bridges: 3 personal fouls)   FT 1/2: GOOD   FT 2/2: GOOD Klay Thompson makes 2/2 from the line.
Score: 17-14

[01:55] Team_091 possession (Score: 17-14)
Kyrie Rozier attempts a 3Pt. Contested by Luka Sexton (4.1 feet, MAN). Kyrie Rozier misses. Rebound secured by Giannis Quickley.

[01:39] Team_084 possession (Score: 17-14)
Luka Sexton drives and kicks out. Klay Thompson attempts a 3Pt. Contested by Rudy Bridges (4.6 feet, MAN). Klay Thompson misses. Rebound secured by Kevin Simons.

[01:26] Team_091 possession (Score: 17-14)
D'Angelo Ingram drives, picks up Jarrett Booker. Help arrives from Dejounte Ginobili! D'Angelo Ingram attempts a Dunk. Contested by Dejounte Ginobili (5.8 feet, MAN). D'Angelo Ingram misses. Rebound secured by Giannis Quickley.

[01:12] Team_084 possession (Score: 17-14)
Dejounte Ginobili attempts a 3Pt. Contested by Kyrie Rozier (4.6 feet, ZONE). Dejounte Ginobili misses. FOUL! Loose ball foul on Kyrie Rozier during the rebound battle. [IN THE BONUS! 7 team fouls] Giannis Quickley to the line for 2 free throws. (Kyrie Rozier: 2 personal fouls)   FT 1/2: GOOD   FT 2/2: MISS Giannis Quickley makes 1/2 from the line. Rebound secured by Kevin Simons.
Score: 17-15

[00:54] Team_091 possession (Score: 17-15)
Rudy Bridges attempts a 3Pt. Contested by Luka Sexton (4.1 feet, ZONE). Rudy Bridges misses. Rebound secured by Klay Thompson.

[00:43] Team_084 possession (Score: 17-15)
Luka Sexton drives to the basket... Luka Sexton commits a violation (traveling/carry)! TURNOVER! (dead ball)

[00:43] Substitution (Team_091): Kyrie Rozier OUT → Karl Morant IN (stamina_rule2)

[00:43] Substitution (Team_091): Isaiah Siakam OUT → Julius Barnes IN (stamina_rule2)

[00:43] Substitution (Team_091): Rudy Bridges OUT → Tim Antetokounmpo IN (stamina_rule2)

[00:43] Substitution (Team_091): D'Angelo Ingram OUT → Zion Mitchell IN (stamina_rule2)

[00:43] Substitution (Team_091): Kevin Simons OUT → Ja George IN (stamina_rule2)

[00:43] Substitution (Team_084): Luka Sexton OUT → Magic Bryant IN (stamina_rule2)

[00:43] Substitution (Team_084): Dejounte Ginobili OUT → Chris Parker IN (stamina_rule2)

[00:43] Substitution (Team_084): Klay Thompson OUT → Evan Quickley IN (stamina_rule2)

[00:43] Substitution (Team_084): Jarrett Booker OUT → Pascal Jackson IN (stamina_rule2)

[00:43] Substitution (Team_084): Giannis Quickley OUT → Dejounte Porzingis IN (stamina_rule2)

[00:29] Team_091 possession (Score: 17-15)
Tim Antetokounmpo attempts a 3Pt. Contested by Magic Bryant (3.8 feet, ZONE). Tim Antetokounmpo misses. Rebound secured by Dejounte Porzingis.

[00:14] Team_084 possession (Score: 17-15)
Evan Quickley drives to the basket... Evan Quickley throws a bad pass out of bounds! TURNOVER! (dead ball)

================================================================================
                              1ST QUARTER COMPLETE                              
================================================================================

1ST QUARTER SCORE: Team_091 17, Team_084 15

BOX SCORE:
================================================================================

Team_091
--------------------------------------------------------------------------------
Player                MIN  PTS  REB  AST  TO      FG   FG%      3P   3P%
--------------------------------------------------------------------------------
Rudy Bridges           12   10    3    0   0   5/6    83.3     0/0   0.0
Isaiah Siakam          12    2    0    2   0   1/4    25.0     0/0   0.0
Kyrie Rozier           12    2    3    0   0   1/3    33.3     0/0   0.0
D'Angelo Ingram        12    0    0    0   0   0/2     0.0     0/0   0.0
Tim Antetokounmpo       0    0    0    0   0   0/1     0.0     0/0   0.0

TEAM: FG: 8/17 (47.1%), 3PT: 0/3 (0.0%), REB: 13 (2 off, 11 def), AST: 2, TO: 4
TEAM FOULS: 7 [Team_084 in BONUS]


Team_084
--------------------------------------------------------------------------------
Player                MIN  PTS  REB  AST  TO      FG   FG%      3P   3P%
--------------------------------------------------------------------------------
Klay Thompson          12    5    2    0   0   2/5    40.0     0/0   0.0
Dejounte Ginobili      12    3    5    1   0   1/3    33.3     0/0   0.0
Kevin Simons           12    3    7    0   0   1/1   100.0     0/0   0.0
Giannis Quickley       12    3    4    0   0   1/2    50.0     0/0   0.0
Jarrett Booker         12    2    0    1   0   1/4    25.0     0/0   0.0
Luka Sexton            12    1    0    1   0   1/5    20.0     0/0   0.0
Dejounte Porzingis      0    0    1    0   0   0/0     0.0     0/0   0.0

TEAM: FG: 6/19 (31.6%), 3PT: 2/9 (22.2%), REB: 12 (5 off, 7 def), AST: 3, TO: 2
TEAM FOULS: 6 [Team_091 in BONUS]

================================================================================

================================================================================
                       2ND QUARTER - Team_091 vs Team_084                       
================================================================================

[12:00] Team_091 possession (Score: 17-15)
FOUL! Shooting foul on Giannis Quickley. Kevin Simons to the line for 2 free throws. [Team fouls: 1] (Giannis Quickley: 1 personal fouls)   FT 1/2: GOOD   FT 2/2: GOOD Kevin Simons makes 2/2 from the line.
Score: 19-15

[11:44] Team_084 possession (Score: 19-15)
Dejounte Ginobili attempts a Layup. Wide open! Isaiah Siakam is 6.1 feet away. [MAN] Dejounte Ginobili misses. Rebound secured by Kevin Simons.

[11:28] Team_091 possession (Score: 19-15)
Kevin Simons attempts a Layup. Contested by Giannis Quickley (5.1 feet, MAN). Kevin Simons misses. FOUL! Loose ball foul on Klay Thompson during the rebound battle. [Team fouls: 2] No free throws, side out. (Klay Thompson: 1 personal fouls)

[11:15] Team_091 possession (Score: 19-15)
D'Angelo Ingram drives and kicks out. Rudy Bridges attempts a Midrange. Contested by Klay Thompson (5.2 feet, MAN). Rudy Bridges misses. Rebound secured by Giannis Quickley.

[10:59] Team_084 possession (Score: 19-15)
Dejounte Ginobili attempts a Layup. Wide open! Isaiah Siakam is 6.2 feet away. [MAN] DEJOUNTE GINOBILI MAKES IT!
Score: 19-17

[10:48] Team_091 possession (Score: 19-17)
D'Angelo Ingram drives, Jarrett Booker stays with him. D'Angelo Ingram attempts a Layup. Contested by Jarrett Booker (5.8 feet, MAN). D'ANGELO INGRAM MAKES IT! Assist: Kyrie Rozier
Score: 21-17

[10:33] Team_084 possession (Score: 21-17)
Dejounte Ginobili drives, Isaiah Siakam stays with him. Dejounte Ginobili attempts a Layup. Wide open! Isaiah Siakam is 6.2 feet away. [MAN] DEJOUNTE GINOBILI MAKES IT! Assist: Jarrett Booker
Score: 21-19

[10:16] Team_091 possession (Score: 21-19)
Rudy Bridges attempts a Layup. BLOCKED BY DEJOUNTE GINOBILI! Ball deflects out of bounds off Rudy Bridges.

[10:03] Team_084 possession (Score: 21-19)
Jarrett Booker attempts a Layup. Contested by Kevin Simons (4.3 feet, ZONE). Jarrett Booker misses. Rebound secured by Rudy Bridges.

[09:49] Team_091 possession (Score: 21-19)
Isaiah Siakam attempts a Midrange. Contested by Jarrett Booker (5.3 feet, ZONE). Isaiah Siakam misses. Rebound secured by Giannis Quickley.

[09:36] Team_084 possession (Score: 21-19)
Jarrett Booker drives and kicks out. Dejounte Ginobili attempts a Midrange. Wide open! Isaiah Siakam is 6.2 feet away. [MAN] DEJOUNTE GINOBILI MAKES IT!
Score: 21-21

[09:20] Team_091 possession (Score: 21-21)
D'Angelo Ingram attempts a Midrange. Contested by Jarrett Booker (6.0 feet, MAN). D'Angelo Ingram misses. Rebound secured by Giannis Quickley.

[09:06] Team_084 possession (Score: 21-21)
Jarrett Booker drives, Kevin Simons stays with him. Jarrett Booker attempts a Dunk. Contested by Kevin Simons (4.4 feet, ZONE). Jarrett Booker misses. Rebound secured by Kevin Simons.

[08:51] Team_091 possession (Score: 21-21)
Kevin Simons attempts a 3Pt. Contested by Giannis Quickley (5.4 feet, MAN). Kevin Simons misses. Offensive rebound by Rudy Bridges! Rudy Bridges kicks it out.

[08:35] Team_091 possession (Score: 21-21)
Isaiah Siakam attempts a 3Pt. Contested by Luka Sexton (4.5 feet, ZONE). Isaiah Siakam misses. Rebound secured by Giannis Quickley.

[08:21] Team_084 possession (Score: 21-21)
Giannis Quickley drives, Kevin Simons stays with him. Giannis Quickley attempts a Layup. Contested by Kevin Simons (4.5 feet, MAN). GIANNIS QUICKLEY MAKES IT!
Score: 21-23

[08:03] Team_091 possession (Score: 21-23)
D'Angelo Ingram attempts a Layup. BLOCKED BY GIANNIS QUICKLEY! Ball deflects out of bounds off D'Angelo Ingram.

[07:48] Team_084 possession (Score: 21-23)
FOUL! Holding foul on Isaiah Siakam. [Team fouls: 1] No free throws, side out. (Isaiah Siakam: 1 personal fouls)

[07:34] Team_084 possession (Score: 21-23)
Luka Sexton attempts a 3Pt. Contested by Kyrie Rozier (4.9 feet, ZONE). LUKA SEXTON MAKES IT! Assist: Dejounte Ginobili
Score: 21-26

[07:21] Team_091 possession (Score: 21-26)
Isaiah Siakam attempts a 3Pt. Contested by Luka Sexton (4.6 feet, ZONE). ISAIAH SIAKAM MAKES IT!
Score: 24-26

[07:08] Team_084 possession (Score: 24-26)
Klay Thompson attempts a 3Pt. Contested by Rudy Bridges (5.4 feet, MAN). Klay Thompson misses. Rebound secured by Kyrie Rozier.

[06:53] Team_091 possession (Score: 24-26)
Kyrie Rozier throws a bad pass out of bounds! TURNOVER! (dead ball)

[06:53] Substitution (Team_091): Kyrie Rozier OUT → Karl Morant IN (stamina_rule2)

[06:53] Substitution (Team_091): Isaiah Siakam OUT → Julius Barnes IN (stamina_rule2)

[06:53] Substitution (Team_091): Rudy Bridges OUT → Tim Antetokounmpo IN (stamina_rule2)

[06:53] Substitution (Team_091): D'Angelo Ingram OUT → Zion Mitchell IN (stamina_rule2)

[06:53] Substitution (Team_091): Kevin Simons OUT → Ja George IN (stamina_rule2)

[06:53] Substitution (Team_084): Luka Sexton OUT → Magic Bryant IN (stamina_rule2)

[06:53] Substitution (Team_084): Dejounte Ginobili OUT → Chris Parker IN (stamina_rule2)

[06:53] Substitution (Team_084): Klay Thompson OUT → Evan Quickley IN (stamina_rule2)

[06:53] Substitution (Team_084): Jarrett Booker OUT → Pascal Jackson IN (stamina_rule2)

[06:53] Substitution (Team_084): Giannis Quickley OUT → Dejounte Porzingis IN (stamina_rule2)

[06:38] Team_084 possession (Score: 24-26)
Magic Bryant attempts a Midrange. Contested by Zion Mitchell (4.9 feet, ZONE). MAGIC BRYANT MAKES IT!
Score: 24-28

[06:22] Team_091 possession (Score: 24-28)
Ja George drives and kicks out. Ja George attempts a 3Pt. Contested by Magic Bryant (3.7 feet, ZONE). Ja George misses. Rebound secured by Dejounte Porzingis.

[06:12] Team_084 possession (Score: 24-28)
FOUL! Holding foul on Tim Antetokounmpo. [Team fouls: 2] No free throws, side out. (Tim Antetokounmpo: 1 personal fouls)

[05:57] Team_084 possession (Score: 24-28)
Pascal Jackson attempts a Midrange. Contested by Zion Mitchell (5.1 feet, MAN). Pascal Jackson misses. Rebound secured by Tim Antetokounmpo.

[05:44] Team_091 possession (Score: 24-28)
Julius Barnes attempts a 3Pt. Contested by Chris Parker (4.5 feet, MAN). Julius Barnes misses. Rebound secured by Pascal Jackson.

[05:32] Team_084 possession (Score: 24-28)
Pascal Jackson throws a bad pass! Stolen by Zion Mitchell! TURNOVER! (live ball)

[05:17] Team_091 possession (Score: 24-28)
Julius Barnes attempts a Midrange. Contested by Chris Parker (4.5 feet, MAN). Julius Barnes misses. Rebound secured by Dejounte Porzingis.

[04:59] Team_084 possession (Score: 24-28)
Chris Parker makes the Layup and draws the foul on Zion Mitchell! And-1! Chris Parker to the line for 1. [Team fouls: 3] (Zion Mitchell: 1 personal fouls)   FT 1/1: GOOD Chris Parker makes 1/1 from the line.
Score: 24-31

[04:45] Team_091 possession (Score: 24-31)
Tim Antetokounmpo attempts a Midrange. Contested by Evan Quickley (5.0 feet, MAN). TIM ANTETOKOUNMPO MAKES IT!
Score: 26-31

[04:30] Team_084 possession (Score: 26-31)
Pascal Jackson attempts a 3Pt. Contested by Karl Morant (5.0 feet, ZONE). Pascal Jackson misses. Rebound secured by Zion Mitchell.

[04:15] Team_091 possession (Score: 26-31)
Tim Antetokounmpo attempts a Layup. Contested by Dejounte Porzingis (5.1 feet, ZONE). TIM ANTETOKOUNMPO MAKES IT! Assist: Zion Mitchell
Score: 28-31

[04:02] Team_084 possession (Score: 28-31)
Evan Quickley drives, Zion Mitchell stays with him. Evan Quickley attempts a Dunk. Contested by Zion Mitchell (4.8 feet, ZONE). Evan Quickley misses. Offensive rebound by Dejounte Porzingis! Dejounte Porzingis kicks it out.

[03:45] Team_084 possession (Score: 28-31)
Pascal Jackson attempts a Midrange. Contested by Tim Antetokounmpo (5.6 feet, ZONE). PASCAL JACKSON MAKES IT!
Score: 28-33

[03:33] Team_091 possession (Score: 28-33)
Karl Morant loses the ball! Stripped by Magic Bryant! TURNOVER! (live ball)

[03:20] Team_084 possession (Score: 28-33)
Magic Bryant attempts a Layup. BLOCKED BY KARL MORANT! Ball is loose! Offensive rebound by Pascal Jackson! Pascal Jackson kicks it out.

[03:06] Team_084 possession (Score: 28-33)
Chris Parker throws a bad pass! Stolen by Julius Barnes! TURNOVER! (live ball)

[02:49] Team_091 possession (Score: 28-33)
Zion Mitchell attempts a Midrange. Contested by Pascal Jackson (4.9 feet, ZONE). ZION MITCHELL MAKES IT! Assist: Julius Barnes
Score: 30-33

[02:34] Team_084 possession (Score: 30-33)
Chris Parker attempts a Midrange. Contested by Julius Barnes (5.1 feet, ZONE). CHRIS PARKER MAKES IT! Assist: Dejounte Porzingis
Score: 30-35

[02:19] Team_091 possession (Score: 30-35)
Ja George drives, Dejounte Porzingis stays with him. Ja George attempts a Layup. Contested by Dejounte Porzingis (5.1 feet, ZONE). JA GEORGE MAKES IT! Assist: Karl Morant
Score: 32-35

[02:07] Team_084 possession (Score: 32-35)
Dejounte Porzingis throws a bad pass! Stolen by Ja George! TURNOVER! (live ball)

[01:54] Team_091 possession (Score: 32-35)
Ja George drives to the basket... Ja George throws a bad pass out of bounds! TURNOVER! (dead ball)

[01:36] Team_084 possession (Score: 32-35)
Dejounte Porzingis drives and kicks out. Chris Parker attempts a Midrange. Contested by Tim Antetokounmpo (5.4 feet, ZONE). Chris Parker misses. Rebound secured by Tim Antetokounmpo.

[01:25] Team_091 possession (Score: 32-35)
Julius Barnes attempts a Midrange. Contested by Evan Quickley (4.9 feet, ZONE). Julius Barnes misses. Rebound secured by Pascal Jackson.

[01:12] Team_084 possession (Score: 32-35)
Chris Parker attempts a 3Pt. Contested by Karl Morant (5.0 feet, ZONE). Chris Parker misses. Rebound secured by Tim Antetokounmpo.

[00:59] Team_091 possession (Score: 32-35)
Zion Mitchell drives, picks up Pascal Jackson. Help arrives from Magic Bryant! Zion Mitchell attempts a Dunk. Contested by Magic Bryant (4.9 feet, MAN). Zion Mitchell misses. Offensive rebound by Zion Mitchell! Zion Mitchell kicks it out.

[00:44] Team_091 possession (Score: 32-35)
Julius Barnes attempts a 3Pt. Contested by Chris Parker (4.5 feet, MAN). Julius Barnes misses. Offensive rebound by Zion Mitchell! Zion Mitchell kicks it out.

[00:26] Team_091 possession (Score: 32-35)
Tim Antetokounmpo makes the 3Pt and draws the foul on Evan Quickley! And-1! Tim Antetokounmpo to the line for 1. [Team fouls: 3] (Evan Quickley: 1 personal fouls)   FT 1/1: GOOD Tim Antetokounmpo makes 1/1 from the line.
Score: 36-35

[00:12] Team_084 possession (Score: 36-35)
FOUL! Holding foul on Ja George. [Team fouls: 4] No free throws, side out. (Ja George: 1 personal fouls)

================================================================================
                              2ND QUARTER COMPLETE                              
================================================================================

2ND QUARTER SCORE: Team_091 19, Team_084 20

BOX SCORE:
================================================================================

Team_091
--------------------------------------------------------------------------------
Player                MIN  PTS  REB  AST  TO      FG   FG%      3P   3P%
--------------------------------------------------------------------------------
Tim Antetokounmpo       7    8    3    0   0   3/3   100.0     0/0   0.0
Isaiah Siakam          17    3    0    0   0   1/3    33.3     0/0   0.0
Kevin Simons           17    2    3    0   0   1/1   100.0     0/0   0.0
D'Angelo Ingram        17    2    0    0   0   1/4    25.0     0/0   0.0
Ja George               7    2    0    0   0   1/2    50.0     0/0   0.0
Zion Mitchell           7    2    3    1   0   1/1   100.0     0/0   0.0
Kyrie Rozier           17    0    1    1   0   0/0     0.0     0/0   0.0
Rudy Bridges           17    0    2    0   0   0/1     0.0     0/0   0.0
Julius Barnes           7    0    0    1   0   0/3     0.0     0/0   0.0
Karl Morant             7    0    0    1   0   0/0     0.0     0/0   0.0

TEAM: FG: 8/18 (44.4%), 3PT: 2/4 (50.0%), REB: 12 (4 off, 8 def), AST: 4, TO: 3
TEAM FOULS: 4


Team_084
--------------------------------------------------------------------------------
Player                MIN  PTS  REB  AST  TO      FG   FG%      3P   3P%
--------------------------------------------------------------------------------
Dejounte Ginobili      17    6    0    1   0   3/4    75.0     0/0   0.0
Chris Parker            7    5    0    0   0   2/3    66.7     0/0   0.0
Luka Sexton            17    3    0    0   0   1/1   100.0     0/0   0.0
Giannis Quickley       17    2    4    0   0   1/1   100.0     0/0   0.0
Magic Bryant            7    2    0    0   0   1/1   100.0     0/0   0.0
Pascal Jackson          7    2    3    0   0   1/3    33.3     0/0   0.0
Jarrett Booker         17    0    0    1   0   0/2     0.0     0/0   0.0
Klay Thompson          17    0    0    0   0   0/1     0.0     0/0   0.0
Dejounte Porzingis      7    0    3    1   0   0/1     0.0     0/0   0.0

TEAM: FG: 9/17 (52.9%), 3PT: 1/4 (25.0%), REB: 10 (2 off, 8 def), AST: 3, TO: 3
TEAM FOULS: 3

================================================================================

================================================================================
                       3RD QUARTER - Team_091 vs Team_084                       
================================================================================

[12:00] Team_091 possession (Score: 36-35)
Isaiah Siakam attempts a Layup. Contested by Giannis Quickley (4.7 feet, ZONE). ISAIAH SIAKAM MAKES IT! Assist: Kyrie Rozier
Score: 38-35

[11:47] Team_084 possession (Score: 38-35)
Luka Sexton drives to the basket... Luka Sexton throws a bad pass out of bounds! TURNOVER! (dead ball)

[11:33] Team_091 possession (Score: 38-35)
Rudy Bridges attempts a Layup. Contested by Giannis Quickley (4.5 feet, ZONE). Rudy Bridges misses. Offensive rebound by Kevin Simons! Kevin Simons's putback is no good. Rebound secured by Dejounte Ginobili.

[11:19] Team_084 possession (Score: 38-35)
Dejounte Ginobili attempts a 3Pt. Contested by Isaiah Siakam (5.9 feet, MAN). Dejounte Ginobili misses. Rebound secured by Kevin Simons.

[11:01] Team_091 possession (Score: 38-35)
Kyrie Rozier attempts a 3Pt. Contested by Luka Sexton (3.8 feet, ZONE). Kyrie Rozier misses. Rebound secured by Klay Thompson.

[10:47] Team_084 possession (Score: 38-35)
Dejounte Ginobili attempts a Layup. BLOCKED BY KEVIN SIMONS! Ball deflects out of bounds off Dejounte Ginobili.

[10:36] Team_091 possession (Score: 38-35)
D'Angelo Ingram attempts a 3Pt. Contested by Jarrett Booker (5.5 feet, MAN). D'Angelo Ingram misses. Rebound secured by Dejounte Ginobili.

[10:21] Team_084 possession (Score: 38-35)
Klay Thompson attempts a 3Pt. Contested by Rudy Bridges (4.8 feet, MAN). Klay Thompson misses. Rebound secured by Kyrie Rozier.

[10:08] Team_091 possession (Score: 38-35)
Kevin Simons attempts a Midrange. Contested by Jarrett Booker (5.0 feet, ZONE). KEVIN SIMONS MAKES IT! Assist: Kyrie Rozier
Score: 40-35

[09:54] Team_084 possession (Score: 40-35)
FOUL! Shooting foul on Kevin Simons. Dejounte Ginobili to the line for 2 free throws. [Team fouls: 1] (Kevin Simons: 1 personal fouls)   FT 1/2: GOOD   FT 2/2: MISS Dejounte Ginobili makes 1/2 from the line. Rebound secured by Rudy Bridges.
Score: 40-36

[09:39] Team_091 possession (Score: 40-36)
Kyrie Rozier attempts a Midrange. Contested by Klay Thompson (4.9 feet, ZONE). KYRIE ROZIER MAKES IT! Assist: D'Angelo Ingram
Score: 42-36

[09:24] Team_084 possession (Score: 42-36)
Dejounte Ginobili attempts a 3Pt. Contested by Isaiah Siakam (5.9 feet, ZONE). Dejounte Ginobili misses. Rebound secured by Rudy Bridges.

[09:06] Team_091 possession (Score: 42-36)
Rudy Bridges attempts a Midrange. Contested by Jarrett Booker (4.7 feet, ZONE). Rudy Bridges misses. Rebound secured by Dejounte Ginobili.

[08:52] Team_084 possession (Score: 42-36)
Klay Thompson attempts a Layup. BLOCKED BY KEVIN SIMONS! Ball is loose! Rebound secured by Kyrie Rozier.

[08:36] Team_091 possession (Score: 42-36)
Kevin Simons drives to the basket... Kevin Simons throws a bad pass out of bounds! TURNOVER! (dead ball)

[08:22] Team_084 possession (Score: 42-36)
Jarrett Booker drives and kicks out. Dejounte Ginobili attempts a 3Pt. Contested by Kyrie Rozier (4.1 feet, ZONE). Dejounte Ginobili misses. Rebound secured by Kyrie Rozier.

[08:11] Team_091 possession (Score: 42-36)
D'Angelo Ingram throws a bad pass out of bounds! TURNOVER! (dead ball)

[07:56] Team_084 possession (Score: 42-36)
Klay Thompson attempts a 3Pt. Contested by Kyrie Rozier (4.6 feet, ZONE). Klay Thompson misses. Rebound secured by Kyrie Rozier.

[07:39] Team_091 possession (Score: 42-36)
Kyrie Rozier attempts a Layup. Contested by Luka Sexton (3.8 feet, MAN). KYRIE ROZIER MAKES IT! Assist: Isaiah Siakam
Score: 44-36

[07:25] Team_084 possession (Score: 44-36)
Luka Sexton attempts a 3Pt. Contested by Isaiah Siakam (5.9 feet, ZONE). Luka Sexton misses. Rebound secured by Rudy Bridges.

[07:08] Team_091 possession (Score: 44-36)
D'Angelo Ingram attempts a 3Pt. Contested by Luka Sexton (4.6 feet, ZONE). D'Angelo Ingram misses. Rebound secured by Dejounte Ginobili.

[06:52] Team_084 possession (Score: 44-36)
Giannis Quickley attempts a Layup. Contested by Kevin Simons (3.8 feet, ZONE). GIANNIS QUICKLEY MAKES IT! Assist: Dejounte Ginobili
Score: 44-38

[06:41] Team_091 possession (Score: 44-38)
D'Angelo Ingram drives to the basket... D'Angelo Ingram throws a bad pass! Stolen by Jarrett Booker! TURNOVER! (live ball)

[06:26] Team_084 possession (Score: 44-38)
Jarrett Booker drives, picks up D'Angelo Ingram. Help arrives from Kyrie Rozier! Jarrett Booker attempts a Dunk. Contested by Kyrie Rozier (4.9 feet, MAN). Jarrett Booker misses. Rebound secured by Kevin Simons.

[06:11] Team_091 possession (Score: 44-38)
Isaiah Siakam drives and kicks out. D'Angelo Ingram attempts a Midrange. BLOCKED BY KLAY THOMPSON! Ball is loose! Rebound secured by Klay Thompson.

[05:57] Team_084 possession (Score: 44-38)
FOUL! Reach-in foul on Kevin Simons during the drive. [Team fouls: 2] No free throws, side out. (Kevin Simons: 2 personal fouls)

[05:43] Team_084 possession (Score: 44-38)
Klay Thompson attempts a 3Pt. Contested by Kyrie Rozier (4.5 feet, ZONE). Klay Thompson misses. Rebound secured by Rudy Bridges.

[05:28] Team_091 possession (Score: 44-38)
Isaiah Siakam attempts a 3Pt. Contested by Dejounte Ginobili (4.9 feet, MAN). ISAIAH SIAKAM MAKES IT! Assist: Rudy Bridges
Score: 47-38

[05:09] Team_084 possession (Score: 47-38)
Dejounte Ginobili attempts a Layup. Contested by Kevin Simons (3.8 feet, ZONE). DEJOUNTE GINOBILI MAKES IT! Assist: Jarrett Booker
Score: 47-40

[04:54] Team_091 possession (Score: 47-40)
D'Angelo Ingram attempts a Layup. Contested by Giannis Quickley (5.4 feet, ZONE). D'ANGELO INGRAM MAKES IT!
Score: 49-40

[04:43] Team_084 possession (Score: 49-40)
Klay Thompson attempts a 3Pt. Contested by Rudy Bridges (4.8 feet, MAN). Klay Thompson misses. FOUL! Loose ball foul on Rudy Bridges during the rebound battle. [Team fouls: 3] No free throws, side out. (Rudy Bridges: 1 personal fouls)

[04:27] Team_084 possession (Score: 49-40)
FOUL! Shooting foul on Kevin Simons. Klay Thompson to the line for 2 free throws. [Team fouls: 4] (Kevin Simons: 3 personal fouls)   FT 1/2: GOOD   FT 2/2: MISS Klay Thompson makes 1/2 from the line. Rebound secured by Kevin Simons.
Score: 49-41

[04:12] Team_091 possession (Score: 49-41)
Kyrie Rozier attempts a Midrange. Contested by Jarrett Booker (4.8 feet, ZONE). Kyrie Rozier misses. Rebound secured by Giannis Quickley.

[03:59] Team_084 possession (Score: 49-41)
Klay Thompson attempts a 3Pt. Contested by Rudy Bridges (4.9 feet, ZONE). Klay Thompson misses. Rebound secured by Kevin Simons.

[03:46] Team_091 possession (Score: 49-41)
Kevin Simons attempts a Layup. Contested by Giannis Quickley (5.0 feet, ZONE). KEVIN SIMONS MAKES IT!
Score: 51-41

[03:30] Team_084 possession (Score: 51-41)
Dejounte Ginobili attempts a 3Pt. Contested by Kyrie Rozier (4.4 feet, ZONE). DEJOUNTE GINOBILI MAKES IT! Assist: Luka Sexton
Score: 51-44

[03:16] Team_091 possession (Score: 51-44)
Kevin Simons attempts a Layup. Contested by Jarrett Booker (5.1 feet, ZONE). KEVIN SIMONS MAKES IT!
Score: 53-44

[03:02] Team_084 possession (Score: 53-44)
Klay Thompson drives and kicks out. Dejounte Ginobili attempts a 3Pt. Contested by Kyrie Rozier (4.2 feet, ZONE). Dejounte Ginobili misses. Rebound secured by Rudy Bridges.

[02:53] Team_091 possession (Score: 53-44)
Isaiah Siakam attempts a 3Pt. Contested by Dejounte Ginobili (5.1 feet, MAN). Isaiah Siakam misses. Rebound secured by Giannis Quickley.

[02:38] Team_084 possession (Score: 53-44)
Luka Sexton attempts a Layup. Contested by Kevin Simons (4.2 feet, ZONE). LUKA SEXTON MAKES IT!
Score: 53-46

[02:22] Team_091 possession (Score: 53-46)
FOUL! Reach-in foul on Klay Thompson during the drive. [Team fouls: 1] No free throws, side out. (Klay Thompson: 1 personal fouls)

[02:06] Team_091 possession (Score: 53-46)
Kevin Simons attempts a 3Pt. Contested by Luka Sexton (4.3 feet, ZONE). KEVIN SIMONS MAKES IT! Assist: Kyrie Rozier
Score: 56-46

[01:47] Team_084 possession (Score: 56-46)
Jarrett Booker makes the Midrange and draws the foul on D'Angelo Ingram! And-1! Jarrett Booker to the line for 1. [BONUS: 5 team fouls] (D'Angelo Ingram: 1 personal fouls)   FT 1/1: GOOD Jarrett Booker makes 1/1 from the line.
Score: 56-49

[01:30] Team_091 possession (Score: 56-49)
Kyrie Rozier drives and kicks out. Kevin Simons attempts a Midrange. Contested by Giannis Quickley (4.8 feet, MAN). Kevin Simons misses. Rebound secured by Giannis Quickley.

[01:13] Team_084 possession (Score: 56-49)
Dejounte Ginobili drives, picks up Kevin Simons. Help arrives from Kyrie Rozier! Dejounte Ginobili attempts a Dunk. Contested by Kyrie Rozier (4.2 feet, ZONE). Dejounte Ginobili misses. Offensive rebound by Giannis Quickley! Giannis Quickley's putback is no good. Offensive rebound by Giannis Quickley! Giannis Quickley kicks it out.

[01:02] Team_084 possession (Score: 56-49)
Dejounte Ginobili attempts a Midrange. Wide open! Isaiah Siakam is 6.2 feet away. [MAN] DEJOUNTE GINOBILI MAKES IT!
Score: 56-51

[00:45] Team_091 possession (Score: 56-51)
D'Angelo Ingram attempts a Midrange. Contested by Jarrett Booker (5.9 feet, MAN). D'ANGELO INGRAM MAKES IT!
Score: 58-51

[00:31] Team_084 possession (Score: 58-51)
Dejounte Ginobili attempts a 3Pt. Contested by Kyrie Rozier (4.6 feet, ZONE). DEJOUNTE GINOBILI MAKES IT! Assist: Jarrett Booker
Score: 58-54

[00:16] Team_091 possession (Score: 58-54)
D'Angelo Ingram attempts a 3Pt. Contested by Jarrett Booker (5.9 feet, MAN). D'Angelo Ingram misses. Rebound secured by Giannis Quickley.

[00:03] Team_084 possession (Score: 58-54)
Giannis Quickley drives and kicks out. FOUL! Shooting foul on Isaiah Siakam. Dejounte Ginobili to the line for 2 free throws. [BONUS: 6 team fouls] (Isaiah Siakam: 1 personal fouls)   FT 1/2: GOOD   FT 2/2: GOOD Dejounte Ginobili makes 2/2 from the line.
Score: 58-56

================================================================================
                              3RD QUARTER COMPLETE                              
================================================================================

3RD QUARTER SCORE: Team_091 22, Team_084 21

BOX SCORE:
================================================================================

Team_091
--------------------------------------------------------------------------------
Player                MIN  PTS  REB  AST  TO      FG   FG%      3P   3P%
--------------------------------------------------------------------------------
Kevin Simons           29    9    4    0   0   4/4   100.0     0/0   0.0
Isaiah Siakam          29    5    0    1   0   2/4    50.0     0/0   0.0
Kyrie Rozier           29    4    4    3   0   2/5    40.0     0/0   0.0
D'Angelo Ingram        29    4    0    1   0   2/5    40.0     0/0   0.0
Rudy Bridges           29    0    5    1   0   0/2     0.0     0/0   0.0

TEAM: FG: 10/20 (50.0%), 3PT: 2/7 (28.6%), REB: 14 (1 off, 13 def), AST: 6, TO: 3
TEAM FOULS: 6 [Team_084 in BONUS]


Team_084
--------------------------------------------------------------------------------
Player                MIN  PTS  REB  AST  TO      FG   FG%      3P   3P%
--------------------------------------------------------------------------------
Dejounte Ginobili      29   12    4    1   0   5/9    55.6     0/0   0.0
Jarrett Booker         29    3    0    2   0   1/3    33.3     0/0   0.0
Luka Sexton            29    2    0    1   0   1/2    50.0     0/0   0.0
Giannis Quickley       29    2    6    0   0   1/1   100.0     0/0   0.0
Klay Thompson          29    0    2    0   0   0/7     0.0     0/0   0.0

TEAM: FG: 8/22 (36.4%), 3PT: 2/9 (22.2%), REB: 11 (2 off, 9 def), AST: 4, TO: 1
TEAM FOULS: 1

================================================================================

================================================================================
                       4TH QUARTER - Team_091 vs Team_084                       
================================================================================

[12:00] Team_091 possession (Score: 58-56)
Kevin Simons attempts a Midrange. Contested by Giannis Quickley (5.1 feet, MAN). Kevin Simons misses. Rebound secured by Dejounte Ginobili.

[11:48] Team_084 possession (Score: 58-56)
Jarrett Booker attempts a Layup. Contested by D'Angelo Ingram (5.2 feet, MAN). Jarrett Booker misses. Rebound secured by Rudy Bridges.

[11:39] Team_091 possession (Score: 58-56)
Kevin Simons drives and kicks out. Isaiah Siakam attempts a Midrange. Contested by Dejounte Ginobili (4.9 feet, ZONE). Isaiah Siakam misses. Rebound secured by Klay Thompson.

[11:23] Team_084 possession (Score: 58-56)
Klay Thompson attempts a 3Pt. Contested by Kyrie Rozier (4.8 feet, ZONE). KLAY THOMPSON MAKES IT! Assist: Jarrett Booker
Score: 58-59

[11:10] Team_091 possession (Score: 58-59)
D'Angelo Ingram throws a bad pass! Stolen by Jarrett Booker! TURNOVER! (live ball)

[10:58] Team_084 possession (Score: 58-59)
Giannis Quickley attempts a 3Pt. Contested by Kevin Simons (4.3 feet, MAN). Giannis Quickley misses. Rebound secured by Kevin Simons.

[10:42] Team_091 possession (Score: 58-59)
Kyrie Rozier attempts a Midrange. Contested by Luka Sexton (4.2 feet, MAN). Kyrie Rozier misses. Rebound secured by Klay Thompson.

[10:27] Team_084 possession (Score: 58-59)
Dejounte Ginobili drives, picks up Isaiah Siakam. Help arrives from Rudy Bridges! Dejounte Ginobili attempts a Dunk. Wide open! Rudy Bridges is 6.3 feet away. [MAN] DEJOUNTE GINOBILI MAKES IT! Assist: Jarrett Booker
Score: 58-61

[10:15] Team_091 possession (Score: 58-61)
D'Angelo Ingram attempts a 3Pt. Contested by Jarrett Booker (6.0 feet, MAN). D'Angelo Ingram misses. Rebound secured by Dejounte Ginobili.

[10:01] Team_084 possession (Score: 58-61)
Luka Sexton attempts a 3Pt. Contested by Kyrie Rozier (4.8 feet, MAN). LUKA SEXTON MAKES IT! Assist: Klay Thompson
Score: 58-64

[09:46] Team_091 possession (Score: 58-64)
Rudy Bridges attempts a Midrange. Contested by Klay Thompson (5.5 feet, ZONE). RUDY BRIDGES MAKES IT! Assist: Isaiah Siakam
Score: 60-64

[09:34] Team_084 possession (Score: 60-64)
Dejounte Ginobili attempts a 3Pt. Contested by Kyrie Rozier (4.7 feet, ZONE). Dejounte Ginobili misses. Rebound secured by Kyrie Rozier.

[09:16] Team_091 possession (Score: 60-64)
D'Angelo Ingram attempts a 3Pt. Contested by Luka Sexton (5.1 feet, ZONE). D'Angelo Ingram misses. Rebound secured by Giannis Quickley.

[09:00] Team_084 possession (Score: 60-64)
Giannis Quickley drives and kicks out. Giannis Quickley attempts a 3Pt. Contested by Kyrie Rozier (4.7 feet, ZONE). Giannis Quickley misses. Offensive rebound by Dejounte Ginobili! Dejounte Ginobili kicks it out.

[08:43] Team_084 possession (Score: 60-64)
Dejounte Ginobili attempts a Layup. Wide open! Isaiah Siakam is 6.5 feet away. [MAN] Dejounte Ginobili misses. Rebound secured by Rudy Bridges.

[08:28] Team_091 possession (Score: 60-64)
Isaiah Siakam attempts a Midrange. Contested by Jarrett Booker (5.6 feet, ZONE). Isaiah Siakam misses. Rebound secured by Giannis Quickley.

[08:12] Team_084 possession (Score: 60-64)
FOUL! Holding foul on Kyrie Rozier. [Team fouls: 1] No free throws, side out. (Kyrie Rozier: 1 personal fouls)

[07:57] Team_084 possession (Score: 60-64)
Klay Thompson attempts a 3Pt. Contested by Rudy Bridges (5.4 feet, MAN). Klay Thompson misses. Offensive rebound by Giannis Quickley! Giannis Quickley puts it back in!
Score: 60-66

[07:43] Team_091 possession (Score: 60-66)
Kevin Simons drives to the basket... Kevin Simons throws a bad pass! Stolen by Giannis Quickley! TURNOVER! (live ball)

[07:29] Team_084 possession (Score: 60-66)
Klay Thompson attempts a 3Pt. Contested by Kyrie Rozier (5.2 feet, ZONE). KLAY THOMPSON MAKES IT! Assist: Luka Sexton
Score: 60-69

[07:19] Team_091 possession (Score: 60-69)
D'Angelo Ingram drives and kicks out. Kyrie Rozier attempts a Midrange. Contested by Jarrett Booker (5.6 feet, ZONE). Kyrie Rozier misses. Rebound secured by Dejounte Ginobili.

[07:06] Team_084 possession (Score: 60-69)
Giannis Quickley attempts a Midrange. Contested by Rudy Bridges (5.3 feet, ZONE). Giannis Quickley misses. Rebound secured by Kyrie Rozier.

[06:53] Team_091 possession (Score: 60-69)
Kyrie Rozier attempts a 3Pt. Contested by Luka Sexton (4.7 feet, MAN). Kyrie Rozier misses. Rebound secured by Klay Thompson.

[06:41] Team_084 possession (Score: 60-69)
Jarrett Booker makes the Layup and draws the foul on Kyrie Rozier! And-1! Jarrett Booker to the line for 1. [Team fouls: 2] (Kyrie Rozier: 2 personal fouls)   FT 1/1: GOOD Jarrett Booker makes 1/1 from the line.
Score: 60-72

[06:26] Team_091 possession (Score: 60-72)
FOUL! Shooting foul on Luka Sexton. Isaiah Siakam to the line for 3 free throws. [Team fouls: 1] (Luka Sexton: 1 personal fouls)   FT 1/3: MISS   FT 2/3: MISS   FT 3/3: GOOD Isaiah Siakam makes 1/3 from the line.
Score: 61-72

[06:16] Team_084 possession (Score: 61-72)
Dejounte Ginobili attempts a 3Pt. Contested by Kyrie Rozier (5.1 feet, ZONE). DEJOUNTE GINOBILI MAKES IT!
Score: 61-75

[06:02] Team_091 possession (Score: 61-75)
FOUL! Holding foul on Jarrett Booker. [Team fouls: 2] No free throws, side out. (Jarrett Booker: 1 personal fouls)

[05:48] Team_091 possession (Score: 61-75)
FOUL! Reach-in foul on Giannis Quickley during the drive. [Team fouls: 3] No free throws, side out. (Giannis Quickley: 1 personal fouls)

[05:33] Team_091 possession (Score: 61-75)
Rudy Bridges attempts a 3Pt. Wide open! Klay Thompson is 6.1 feet away. [MAN] Rudy Bridges misses. Rebound secured by Klay Thompson.

[05:21] Team_084 possession (Score: 61-75)
Klay Thompson drives and kicks out. Klay Thompson attempts a 3Pt. Wide open! Isaiah Siakam is 6.9 feet away. [ZONE] Klay Thompson misses. Rebound secured by Kevin Simons.

[05:07] Team_091 possession (Score: 61-75)
Kyrie Rozier attempts a Layup. Contested by Giannis Quickley (5.8 feet, ZONE). Kyrie Rozier misses. Rebound secured by Klay Thompson.

[04:52] Team_084 possession (Score: 61-75)
Dejounte Ginobili attempts a 3Pt. Contested by Kyrie Rozier (5.3 feet, ZONE). Dejounte Ginobili misses. Rebound secured by Rudy Bridges.

[04:38] Team_091 possession (Score: 61-75)
Isaiah Siakam drives, Dejounte Ginobili stays with him. Isaiah Siakam attempts a Dunk. Contested by Dejounte Ginobili (6.0 feet, MAN). ISAIAH SIAKAM MAKES IT! Assist: D'Angelo Ingram
Score: 63-75

[04:24] Team_084 possession (Score: 63-75)
Klay Thompson drives, picks up Rudy Bridges. Help arrives from Kyrie Rozier! Klay Thompson attempts a Layup. Contested by Kyrie Rozier (5.8 feet, MAN). KLAY THOMPSON MAKES IT!
Score: 63-77

[04:09] Team_091 possession (Score: 63-77)
D'Angelo Ingram drives, Jarrett Booker stays with him. D'Angelo Ingram attempts a Dunk. Wide open! Jarrett Booker is 6.7 feet away. [MAN] D'Angelo Ingram misses. Rebound secured by Dejounte Ginobili.

[03:53] Team_084 possession (Score: 63-77)
Luka Sexton drives, Kyrie Rozier stays with him. Luka Sexton attempts a Layup. Contested by Kyrie Rozier (5.5 feet, MAN). Luka Sexton misses. Rebound secured by Rudy Bridges.

[03:35] Team_091 possession (Score: 63-77)
Isaiah Siakam attempts a Midrange. Wide open! Klay Thompson is 6.5 feet away. [ZONE] Isaiah Siakam misses. Rebound secured by Giannis Quickley.

[03:23] Team_084 possession (Score: 63-77)
Jarrett Booker attempts a Midrange. Wide open! D'Angelo Ingram is 6.2 feet away. [MAN] Jarrett Booker misses. Rebound secured by Rudy Bridges.

[03:08] Team_091 possession (Score: 63-77)
Isaiah Siakam attempts a Midrange. Wide open! Dejounte Ginobili is 6.1 feet away. [MAN] Isaiah Siakam misses. Rebound secured by Giannis Quickley.

[02:54] Team_084 possession (Score: 63-77)
Luka Sexton attempts a 3Pt. Contested by Kyrie Rozier (5.7 feet, ZONE). Luka Sexton misses. Rebound secured by Rudy Bridges.

[02:40] Team_091 possession (Score: 63-77)
Kyrie Rozier drives, picks up Giannis Quickley. Help arrives from Dejounte Ginobili! Kyrie Rozier attempts a Layup. Wide open! Dejounte Ginobili is 6.2 feet away. [ZONE] Kyrie Rozier misses. Rebound secured by Giannis Quickley.

[02:25] Team_084 possession (Score: 63-77)
Dejounte Ginobili throws a bad pass out of bounds! TURNOVER! (dead ball)

[02:25] Substitution (Team_091): Kyrie Rozier OUT → Karl Morant IN (stamina_rule2)

[02:25] Substitution (Team_091): Isaiah Siakam OUT → Julius Barnes IN (stamina_rule2)

[02:25] Substitution (Team_091): Rudy Bridges OUT → Tim Antetokounmpo IN (stamina_rule2)

[02:25] Substitution (Team_091): D'Angelo Ingram OUT → Zion Mitchell IN (stamina_rule2)

[02:25] Substitution (Team_091): Kevin Simons OUT → Ja George IN (stamina_rule2)

[02:25] Substitution (Team_084): Luka Sexton OUT → Magic Bryant IN (stamina_rule2)

[02:25] Substitution (Team_084): Dejounte Ginobili OUT → Chris Parker IN (stamina_rule2)

[02:25] Substitution (Team_084): Klay Thompson OUT → Evan Quickley IN (stamina_rule2)

[02:25] Substitution (Team_084): Jarrett Booker OUT → Pascal Jackson IN (stamina_rule2)

[02:25] Substitution (Team_084): Giannis Quickley OUT → Dejounte Porzingis IN (stamina_rule2)

[02:06] Team_091 possession (Score: 63-77)
Zion Mitchell attempts a Midrange. Contested by Pascal Jackson (4.9 feet, MAN). ZION MITCHELL MAKES IT! Assist: Karl Morant
Score: 65-77

[01:53] Team_084 possession (Score: 65-77)
Evan Quickley drives, picks up Tim Antetokounmpo. Help arrives from Karl Morant! Evan Quickley attempts a Dunk. Contested by Karl Morant (5.3 feet, MAN). EVAN QUICKLEY MAKES IT! Assist: Magic Bryant
Score: 65-79

[01:44] Team_091 possession (Score: 65-79)
Zion Mitchell attempts a 3Pt. Contested by Pascal Jackson (4.9 feet, MAN). Zion Mitchell misses. Rebound secured by Dejounte Porzingis.

[01:30] Team_084 possession (Score: 65-79)
Magic Bryant attempts a Midrange. Contested by Karl Morant (4.9 feet, MAN). Magic Bryant misses. FOUL! Loose ball foul on Zion Mitchell during the rebound battle. [Team fouls: 3] No free throws, side out. (Zion Mitchell: 1 personal fouls)

[01:18] Team_084 possession (Score: 65-79)
Magic Bryant drives, picks up Zion Mitchell. Help arrives from Karl Morant! Magic Bryant attempts a Layup. Contested by Karl Morant (4.9 feet, ZONE). MAGIC BRYANT MAKES IT!
Score: 65-81

[01:06] Team_091 possession (Score: 65-81)
Zion Mitchell attempts a 3Pt. Contested by Pascal Jackson (4.9 feet, MAN). Zion Mitchell misses. Rebound secured by Pascal Jackson.

[00:50] Team_084 possession (Score: 65-81)
Dejounte Porzingis drives and kicks out. Dejounte Porzingis attempts a 3Pt. Contested by Ja George (4.7 feet, MAN). Dejounte Porzingis misses. Rebound secured by Zion Mitchell.

[00:34] Team_091 possession (Score: 65-81)
FOUL! Holding foul on Pascal Jackson. [Team fouls: 4] No free throws, side out. (Pascal Jackson: 1 personal fouls)

[00:19] Team_091 possession (Score: 65-81)
FOUL! Shooting foul on Dejounte Porzingis. Ja George to the line for 2 free throws. [BONUS: 5 team fouls] (Dejounte Porzingis: 1 personal fouls)   FT 1/2: GOOD   FT 2/2: GOOD Ja George makes 2/2 from the line.
Score: 67-81

[00:03] Team_084 possession (Score: 67-81)
Magic Bryant attempts a Layup. Contested by Karl Morant (4.9 feet, MAN). Magic Bryant misses. Rebound secured by Ja George.

================================================================================
                              4TH QUARTER COMPLETE                              
================================================================================

4TH QUARTER SCORE: Team_091 9, Team_084 25

BOX SCORE:
================================================================================

Team_091
--------------------------------------------------------------------------------
Player                MIN  PTS  REB  AST  TO      FG   FG%      3P   3P%
--------------------------------------------------------------------------------
Isaiah Siakam          39    3    0    1   0   2/5    40.0     0/0   0.0
Rudy Bridges           39    2    6    0   0   1/2    50.0     0/0   0.0
Zion Mitchell          10    2    1    0   0   1/3    33.3     0/0   0.0
Ja George              10    2    1    0   0   1/1   100.0     0/0   0.0
Kevin Simons           39    0    2    0   0   0/2     0.0     0/0   0.0
Kyrie Rozier           39    0    2    0   0   0/4     0.0     0/0   0.0
D'Angelo Ingram        39    0    0    1   0   0/4     0.0     0/0   0.0
Karl Morant            10    0    0    1   0   0/0     0.0     0/0   0.0

TEAM: FG: 5/21 (23.8%), 3PT: 1/7 (14.3%), REB: 12 (0 off, 12 def), AST: 3, TO: 2
TEAM FOULS: 3


Team_084
--------------------------------------------------------------------------------
Player                MIN  PTS  REB  AST  TO      FG   FG%      3P   3P%
--------------------------------------------------------------------------------
Klay Thompson          39    8    5    1   0   3/4    75.0     0/0   0.0
Dejounte Ginobili      39    5    5    0   0   2/5    40.0     0/0   0.0
Jarrett Booker         39    3    0    2   0   1/3    33.3     0/0   0.0
Luka Sexton            39    3    0    1   0   1/3    33.3     0/0   0.0
Giannis Quickley       39    2    6    0   0   1/3    33.3     0/0   0.0
Evan Quickley          10    2    0    0   0   1/1   100.0     0/0   0.0
Magic Bryant           10    2    0    1   0   1/2    50.0     0/0   0.0
Dejounte Porzingis     10    0    2    0   0   0/1     0.0     0/0   0.0
Pascal Jackson         10    0    1    0   0   0/0     0.0     0/0   0.0

TEAM: FG: 10/22 (45.5%), 3PT: 5/9 (55.6%), REB: 19 (3 off, 16 def), AST: 5, TO: 1
TEAM FOULS: 5 [Team_091 in BONUS]

================================================================================

================================================================================
                               FULL GAME COMPLETE                               
================================================================================

FINAL SCORE: Team_091 67, Team_084 81

SCORING BY QUARTER:
--------------------------------------------------------------------------------
Team                     Q1     Q2     Q3     Q4    FINAL
--------------------------------------------------------------------------------
Team_091                 17     19     22      9       67
Team_084                 15     20     21     25       81
--------------------------------------------------------------------------------

FULL GAME BOX SCORE:
================================================================================

Team_091
--------------------------------------------------------------------------------
Player                MIN  PTS  REB  AST  TO      FG   FG%      3P   3P%      FT STL BLK
--------------------------------------------------------------------------------
Kyrie Rozier           39    6   10    4   1   3/12   25.0   0/3     0.0   0/0     0   0
Isaiah Siakam          39   13    0    4   2   6/16   37.5   3/5    60.0   1/3     0   0
Rudy Bridges           39   12   16    1   2   7/12   58.3   0/2     0.0   4/5     0   0
D'Angelo Ingram        39    6    0    2   4   3/15   20.0   0/5     0.0   0/0     0   0
Kevin Simons           39   14   16    0   1   5/7    71.4   1/1   100.0   2/2     0   2
Karl Morant            10    0    0    2   1   0/0     0.0   0/0     0.0   0/0     0   1
Julius Barnes          10    0    0    1   0   0/3     0.0   0/1     0.0   0/0     1   0
Tim Antetokounmpo      10    8    3    0   0   3/4    75.0   1/2    50.0   1/1     0   0
Zion Mitchell          10    4    4    1   0   2/4    50.0   0/2     0.0   0/0     1   0
Ja George              10    4    1    0   1   2/3    66.7   0/0     0.0   2/2     1   0

TEAM: FG: 31/76 (40.8%), 3PT: 5/21 (23.8%), REB: 51 (7 off, 44 def), AST: 15, TO: 12


Team_084
--------------------------------------------------------------------------------
Player                MIN  PTS  REB  AST  TO      FG   FG%      3P   3P%      FT STL BLK
--------------------------------------------------------------------------------
Luka Sexton            39    9    0    3   2   4/11   36.4   2/6    33.3   1/2     0   0
Dejounte Ginobili      39   26   14    3   1  10/20   50.0   4/10   40.0   3/4     0   1
Klay Thompson          39   13    9    1   0   6/18   33.3   4/11   36.4   3/4     0   1
Jarrett Booker         39    8    0    6   0   4/13   30.8   0/1     0.0   4/4     2   0
Giannis Quickley       39    9   20    0   0   3/6    50.0   0/1     0.0   1/2     1   1
Magic Bryant           10    4    0    1   0   2/3    66.7   0/0     0.0   0/0     1   0
Chris Parker           10    5    0    0   1   2/3    66.7   0/1     0.0   1/1     0   0
Evan Quickley          10    2    0    0   0   1/1   100.0   0/0     0.0   0/0     0   0
Pascal Jackson         10    2    4    0   1   1/3    33.3   0/1     0.0   0/0     0   0
Dejounte Porzingis     10    0    6    1   2   0/2     0.0   0/0     0.0   0/0     0   0

TEAM: FG: 33/80 (41.2%), 3PT: 10/31 (32.3%), REB: 52 (12 off, 40 def), AST: 15, TO: 7

================================================================================
