================================================================================
                        FULL GAME - Team_045 vs Team_027                        
================================================================================

================================================================================
                       1ST QUARTER - Team_045 vs Team_027                       
================================================================================

[12:00] Team_045 possession (Score: 0-0)
Trae Russell attempts a 3Pt. Contested by Tim Johnson (5.4 feet, ZONE). Trae Russell misses. Rebound secured by Bradley Dosunmu.

[11:44] Team_027 possession (Score: 0-0)
Bradley Dosunmu drives, picks up Zion Butler. Help arrives from Rudy Antetokounmpo! Bradley Dosunmu attempts a Layup. Contested by Rudy Antetokounmpo (3.3 feet, MAN). Bradley Dosunmu misses. Rebound secured by Zion Butler.

[11:29] Team_045 possession (Score: 0-0)
Trae Russell loses the ball! Stripped by Tony Doncic! TURNOVER! (live ball)

[11:15] Team_027 possession (Score: 0-0)
Bradley Dosunmu attempts a Midrange. Contested by Trae Russell (5.5 feet, ZONE). BRADLEY DOSUNMU MAKES IT! Assist: John Russell
Score: 0-2

[11:03] Team_045 possession (Score: 0-2)
DeMar Turner drives to the basket... DeMar Turner throws a bad pass out of bounds! TURNOVER! (dead ball)

[10:47] Team_027 possession (Score: 0-2)
Tim Johnson attempts a Midrange. Contested by Rudy Antetokounmpo (4.7 feet, MAN). TIM JOHNSON MAKES IT! Assist: John Russell
Score: 0-4

[10:33] Team_045 possession (Score: 0-4)
DeMar Turner makes the Midrange and draws the foul on Tony Doncic! And-1! DeMar Turner to the line for 1. [Team fouls: 1] (Tony Doncic: 1 personal fouls)   FT 1/1: MISS DeMar Turner makes 0/1 from the line. Rebound secured by John Russell.
Score: 2-4

[10:18] Team_027 possession (Score: 2-4)
Tony Doncic attempts a 3Pt. Contested by Trae Russell (5.5 feet, ZONE). TONY DONCIC MAKES IT! Assist: Tim Johnson
Score: 2-7

[10:06] Team_045 possession (Score: 2-7)
Trae Russell attempts a Midrange. Contested by Tony Doncic (4.4 feet, MAN). Trae Russell misses. Rebound secured by Tony Doncic.

[09:55] Team_027 possession (Score: 2-7)
Scottie Harden drives to the basket... Scottie Harden throws a bad pass! Stolen by Zion Butler! TURNOVER! (live ball)

[09:37] Team_045 possession (Score: 2-7)
Trae Russell attempts a Midrange. Contested by Tim Johnson (5.4 feet, ZONE). TRAE RUSSELL MAKES IT!
Score: 4-7

[09:21] Team_027 possession (Score: 4-7)
Tim Johnson attempts a 3Pt. Contested by Rudy Antetokounmpo (4.7 feet, MAN). Tim Johnson misses. Rebound secured by DeMar Turner.

[09:09] Team_045 possession (Score: 4-7)
Rudy Antetokounmpo drives, picks up Tim Johnson. Help arrives from Tony Doncic! Rudy Antetokounmpo attempts a Dunk. Contested by Tony Doncic (5.3 feet, MAN). Rudy Antetokounmpo misses. Rebound secured by John Russell.

[08:58] Team_027 possession (Score: 4-7)
Tim Johnson drives and kicks out. John Russell attempts a 3Pt. Contested by Zion Butler (3.2 feet, MAN). John Russell misses. Offensive rebound by John Russell! John Russell puts it back in!
Score: 4-9

[08:41] Team_045 possession (Score: 4-9)
Trae Russell attempts a 3Pt. Contested by Scottie Harden (5.0 feet, ZONE). Trae Russell misses. Rebound secured by Bradley Dosunmu.

[08:25] Team_027 possession (Score: 4-9)
John Russell makes the Layup and draws the foul on Zion Butler! And-1! John Russell to the line for 1. [Team fouls: 1] (Zion Butler: 1 personal fouls)   FT 1/1: GOOD John Russell makes 1/1 from the line.
Score: 4-12

[08:11] Team_045 possession (Score: 4-12)
FOUL! Shooting foul on John Russell. Zion Butler to the line for 3 free throws. [Team fouls: 2] (John Russell: 1 personal fouls)   FT 1/3: GOOD   FT 2/3: GOOD   FT 3/3: GOOD Zion Butler makes 3/3 from the line.
Score: 7-12

[07:55] Team_027 possession (Score: 7-12)
Scottie Harden attempts a Midrange. Contested by DeMar Turner (5.0 feet, ZONE). Scottie Harden misses. Rebound secured by DeMar Turner.

[07:42] Team_045 possession (Score: 7-12)
FOUL! Holding foul on Tim Johnson. [Team fouls: 3] No free throws, side out. (Tim Johnson: 1 personal fouls)

[07:30] Team_045 possession (Score: 7-12)
Cole Simons attempts a 3Pt. Contested by Scottie Harden (5.1 feet, MAN). Cole Simons misses. Rebound secured by Tony Doncic.

[07:18] Team_027 possession (Score: 7-12)
Tim Johnson makes the Layup and draws the foul on Rudy Antetokounmpo! And-1! Tim Johnson to the line for 1. [Team fouls: 2] (Rudy Antetokounmpo: 1 personal fouls)   FT 1/1: GOOD Tim Johnson makes 1/1 from the line.
Score: 7-15

[07:04] Team_045 possession (Score: 7-15)
Zion Butler drives and kicks out. Rudy Antetokounmpo attempts a Midrange. Contested by Tim Johnson (4.9 feet, MAN). Rudy Antetokounmpo misses. Rebound secured by John Russell.

[06:51] Team_027 possession (Score: 7-15)
Tim Johnson drives to the basket... FOUL! Offensive foul on Tim Johnson! Zion Butler drew the charge! [Team fouls: 4] (Tim Johnson: 2 personal fouls) TURNOVER! (dead ball)

[06:38] Team_045 possession (Score: 7-15)
Cole Simons attempts a 3Pt. Contested by Tim Johnson (5.5 feet, ZONE). COLE SIMONS MAKES IT! Assist: DeMar Turner
Score: 10-15

[06:22] Team_027 possession (Score: 10-15)
Tim Johnson attempts a Layup. Contested by Rudy Antetokounmpo (4.7 feet, MAN). TIM JOHNSON MAKES IT! Assist: Scottie Harden
Score: 10-17

[06:10] Team_045 possession (Score: 10-17)
FOUL! Shooting foul on Tony Doncic. Trae Russell to the line for 2 free throws. [BONUS: 5 team fouls] (Tony Doncic: 2 personal fouls)   FT 1/2: GOOD   FT 2/2: MISS Trae Russell makes 1/2 from the line. Rebound secured by Tony Doncic.
Score: 11-17

[05:57] Team_027 possession (Score: 11-17)
John Russell attempts a Midrange. Contested by Cole Simons (4.1 feet, ZONE). John Russell misses. Offensive rebound by John Russell! John Russell puts it back in!
Score: 11-19

[05:38] Team_045 possession (Score: 11-19)
Cole Simons drives, Scottie Harden stays with him. Cole Simons attempts a Layup. Contested by Scottie Harden (5.1 feet, MAN). COLE SIMONS MAKES IT! Assist: Trae Russell
Score: 13-19

[05:23] Team_027 possession (Score: 13-19)
Scottie Harden attempts a Midrange. Contested by Cole Simons (3.4 feet, ZONE). Scottie Harden misses. Rebound secured by Cole Simons.

[05:08] Team_045 possession (Score: 13-19)
Cole Simons makes the 3Pt and draws the foul on Tim Johnson! And-1! Cole Simons to the line for 1. [BONUS: 6 team fouls] (Tim Johnson: 3 personal fouls)   FT 1/1: GOOD Cole Simons makes 1/1 from the line.
Score: 17-19

[04:54] Team_027 possession (Score: 17-19)
Scottie Harden attempts a Layup. BLOCKED BY COLE SIMONS! Ball is loose! Rebound secured by DeMar Turner.

[04:40] Team_045 possession (Score: 17-19)
DeMar Turner drives, Bradley Dosunmu stays with him. DeMar Turner attempts a Dunk. Contested by Bradley Dosunmu (4.7 feet, MAN). DEMAR TURNER MAKES IT!
Score: 19-19

[04:25] Team_027 possession (Score: 19-19)
Bradley Dosunmu drives, picks up Zion Butler. Help arrives from Rudy Antetokounmpo! Bradley Dosunmu attempts a Layup. Contested by Rudy Antetokounmpo (3.5 feet, ZONE). BRADLEY DOSUNMU MAKES IT! Assist: John Russell
Score: 19-21

[04:11] Team_045 possession (Score: 19-21)
Cole Simons attempts a Midrange. Contested by Tim Johnson (5.6 feet, ZONE). COLE SIMONS MAKES IT! Assist: Trae Russell
Score: 21-21

[03:59] Team_027 possession (Score: 21-21)
Scottie Harden attempts a 3Pt. Contested by Cole Simons (3.5 feet, MAN). Scottie Harden misses. Rebound secured by Cole Simons.

[03:41] Team_045 possession (Score: 21-21)
Cole Simons attempts a Midrange. Contested by Scottie Harden (5.3 feet, MAN). Cole Simons misses. Rebound secured by Tony Doncic.

[03:25] Team_027 possession (Score: 21-21)
Tony Doncic drives, picks up Cole Simons. Help arrives from Rudy Antetokounmpo! Tony Doncic attempts a Layup. Contested by Rudy Antetokounmpo (3.6 feet, MAN). TONY DONCIC MAKES IT! Assist: Tim Johnson
Score: 21-23

[03:15] Team_045 possession (Score: 21-23)
Trae Russell attempts a Midrange. Contested by Tony Doncic (4.6 feet, MAN). TRAE RUSSELL MAKES IT! Assist: Cole Simons
Score: 23-23

[03:00] Team_027 possession (Score: 23-23)
Bradley Dosunmu attempts a Midrange. Contested by Rudy Antetokounmpo (4.7 feet, ZONE). BRADLEY DOSUNMU MAKES IT!
Score: 23-25

[02:43] Team_045 possession (Score: 23-25)
Trae Russell attempts a 3Pt. Contested by Tony Doncic (4.6 feet, MAN). TRAE RUSSELL MAKES IT! Assist: Rudy Antetokounmpo
Score: 26-25

[02:25] Team_027 possession (Score: 26-25)
FOUL! Reach-in foul on Rudy Antetokounmpo during the drive. [Team fouls: 3] No free throws, side out. (Rudy Antetokounmpo: 2 personal fouls)

[02:08] Team_027 possession (Score: 26-25)
Bradley Dosunmu attempts a 3Pt. Contested by Cole Simons (3.7 feet, ZONE). BRADLEY DOSUNMU MAKES IT!
Score: 26-28

[01:51] Team_045 possession (Score: 26-28)
Rudy Antetokounmpo attempts a 3Pt. Contested by Scottie Harden (5.2 feet, ZONE). Rudy Antetokounmpo misses. Rebound secured by Tony Doncic.

[01:39] Team_027 possession (Score: 26-28)
Scottie Harden drives to the basket... FOUL! Offensive foul on Scottie Harden! Cole Simons drew the charge! [Team fouls: 7] (Scottie Harden: 1 personal fouls) TURNOVER! (dead ball)

[01:27] Team_045 possession (Score: 26-28)
Trae Russell attempts a 3Pt. Contested by Tim Johnson (5.8 feet, ZONE). Trae Russell misses. Offensive rebound by Zion Butler! Zion Butler puts it back in!
Score: 28-28

[01:11] Team_027 possession (Score: 28-28)
Bradley Dosunmu drives to the basket... Bradley Dosunmu throws a bad pass! Stolen by DeMar Turner! TURNOVER! (live ball)

[00:52] Team_045 possession (Score: 28-28)
Rudy Antetokounmpo attempts a 3Pt. Contested by Tim Johnson (5.7 feet, MAN). Rudy Antetokounmpo misses. Rebound secured by Bradley Dosunmu.

[00:35] Team_027 possession (Score: 28-28)
Bradley Dosunmu makes the Layup and draws the foul on DeMar Turner! And-1! Bradley Dosunmu to the line for 1. [Team fouls: 4] (DeMar Turner: 1 personal fouls)   FT 1/1: GOOD Bradley Dosunmu makes 1/1 from the line.
Score: 28-31

[00:20] Team_045 possession (Score: 28-31)
Trae Russell attempts a 3Pt. Contested by Tony Doncic (4.8 feet, MAN). Trae Russell misses. Rebound secured by John Russell.

[00:06] Team_027 possession (Score: 28-31)
John Russell attempts a Midrange. Contested by Zion Butler (4.7 feet, MAN). JOHN RUSSELL MAKES IT! Assist: Tim Johnson
Score: 28-33

================================================================================
                              1ST QUARTER COMPLETE                              
================================================================================

1ST QUARTER SCORE: Team_045 28, Team_027 33

BOX SCORE:
================================================================================

Team_045
--------------------------------------------------------------------------------
Player                MIN  PTS  REB  AST  TO      FG   FG%      3P   3P%
--------------------------------------------------------------------------------
Cole Simons            12   11    2    1   0   4/6    66.7     0/0   0.0
Trae Russell           12    7    0    2   0   3/8    37.5     0/0   0.0
Zion Butler            12    5    2    0   0   2/3    66.7     0/0   0.0
DeMar Turner           12    2    3    1   0   1/2    50.0     0/0   0.0
Rudy Antetokounmpo     12    0    0    1   0   0/3     0.0     0/0   0.0

TEAM: FG: 10/22 (45.5%), 3PT: 5/11 (45.5%), REB: 7 (1 off, 6 def), AST: 5, TO: 2
TEAM FOULS: 4


Team_027
--------------------------------------------------------------------------------
Player                MIN  PTS  REB  AST  TO      FG   FG%      3P   3P%
--------------------------------------------------------------------------------
Bradley Dosunmu        12   12    3    0   0   5/6    83.3     0/0   0.0
John Russell           12    9    6    3   0   4/4   100.0     0/0   0.0
Tim Johnson            12    7    0    3   0   3/4    75.0     0/0   0.0
Tony Doncic            12    5    5    0   0   2/2   100.0     0/0   0.0
Scottie Harden         12    0    0    1   0   0/4     0.0     0/0   0.0

TEAM: FG: 14/20 (70.0%), 3PT: 2/4 (50.0%), REB: 14 (2 off, 12 def), AST: 7, TO: 4
TEAM FOULS: 7 [Team_045 in BONUS]

================================================================================

================================================================================
                       2ND QUARTER - Team_045 vs Team_027                       
================================================================================

[12:00] Team_045 possession (Score: 28-33)
Rudy Antetokounmpo attempts a 3Pt. Contested by Tim Johnson (5.6 feet, ZONE). Rudy Antetokounmpo misses. Rebound secured by John Russell.

[11:47] Team_027 possession (Score: 28-33)
Tony Doncic attempts a 3Pt. Contested by Cole Simons (3.8 feet, ZONE). Tony Doncic misses. Offensive rebound by Bradley Dosunmu! Bradley Dosunmu kicks it out.

[11:34] Team_027 possession (Score: 28-33)
Bradley Dosunmu drives, DeMar Turner stays with him. Bradley Dosunmu attempts a Dunk. Contested by DeMar Turner (5.3 feet, MAN). Bradley Dosunmu misses. Offensive rebound by John Russell! John Russell puts it back in!
Score: 28-35

[11:22] Team_045 possession (Score: 28-35)
Zion Butler drives and kicks out. Cole Simons attempts a 3Pt. Contested by Scottie Harden (5.0 feet, MAN). Cole Simons misses. Rebound secured by Bradley Dosunmu.

[11:09] Team_027 possession (Score: 28-35)
Bradley Dosunmu drives, DeMar Turner stays with him. Bradley Dosunmu attempts a Layup. Contested by DeMar Turner (5.3 feet, MAN). BRADLEY DOSUNMU MAKES IT! Assist: John Russell
Score: 28-37

[10:54] Team_045 possession (Score: 28-37)
Zion Butler drives and kicks out. Rudy Antetokounmpo attempts a Midrange. Contested by Tim Johnson (5.4 feet, ZONE). RUDY ANTETOKOUNMPO MAKES IT! Assist: Trae Russell
Score: 30-37

[10:38] Team_027 possession (Score: 30-37)
Scottie Harden attempts a 3Pt. Contested by Cole Simons (3.9 feet, MAN). Scottie Harden misses. Rebound secured by Cole Simons.

[10:20] Team_045 possession (Score: 30-37)
Cole Simons drives, picks up Scottie Harden. Help arrives from Tony Doncic! Cole Simons attempts a Dunk. Contested by Tony Doncic (5.6 feet, MAN). COLE SIMONS MAKES IT! Assist: Trae Russell
Score: 32-37

[10:05] Team_027 possession (Score: 32-37)
Tim Johnson drives, Rudy Antetokounmpo stays with him. Tim Johnson attempts a Layup. Contested by Rudy Antetokounmpo (5.1 feet, MAN). TIM JOHNSON MAKES IT! Assist: Tony Doncic
Score: 32-39

[09:49] Team_045 possession (Score: 32-39)
FOUL! Reach-in foul on John Russell during the drive. [Team fouls: 1] No free throws, side out. (John Russell: 1 personal fouls)

[09:30] Team_045 possession (Score: 32-39)
Cole Simons attempts a Midrange. Contested by Scottie Harden (5.7 feet, MAN). Cole Simons misses. Rebound secured by John Russell.

[09:18] Team_027 possession (Score: 32-39)
Scottie Harden attempts a 3Pt. Contested by DeMar Turner (5.4 feet, ZONE). Scottie Harden misses. Rebound secured by DeMar Turner.

[09:06] Team_045 possession (Score: 32-39)
Cole Simons attempts a 3Pt. Contested by Scottie Harden (5.7 feet, MAN). Cole Simons misses. Rebound secured by John Russell.

[08:54] Team_027 possession (Score: 32-39)
FOUL! Holding foul on Zion Butler. [Team fouls: 1] No free throws, side out. (Zion Butler: 1 personal fouls)

[08:40] Team_027 possession (Score: 32-39)
John Russell drives, DeMar Turner stays with him. John Russell attempts a Layup. Wide open! DeMar Turner is 6.1 feet away. [ZONE] JOHN RUSSELL MAKES IT!
Score: 32-41

[08:21] Team_045 possession (Score: 32-41)
Cole Simons attempts a Midrange. Contested by Tony Doncic (5.1 feet, ZONE). Cole Simons misses. Rebound secured by Bradley Dosunmu.

[08:08] Team_027 possession (Score: 32-41)
Tim Johnson attempts a 3Pt. Contested by Rudy Antetokounmpo (5.3 feet, MAN). Tim Johnson misses. Rebound secured by Cole Simons.

[07:55] Team_045 possession (Score: 32-41)
Cole Simons attempts a Layup. BLOCKED BY SCOTTIE HARDEN! Ball is loose! Offensive rebound by Zion Butler! Zion Butler kicks it out.

[07:40] Team_045 possession (Score: 32-41)
Trae Russell attempts a 3Pt. Contested by Tony Doncic (5.1 feet, MAN). Trae Russell misses. Rebound secured by Tony Doncic.

[07:25] Team_027 possession (Score: 32-41)
Scottie Harden attempts a Midrange. Contested by Cole Simons (4.4 feet, MAN). Scottie Harden misses. Rebound secured by Cole Simons.

[07:09] Team_045 possession (Score: 32-41)
Rudy Antetokounmpo throws a bad pass! Stolen by Tim Johnson! TURNOVER! (live ball)

[06:56] Team_027 possession (Score: 32-41)
Tony Doncic attempts a 3Pt. Contested by Cole Simons (4.5 feet, ZONE). TONY DONCIC MAKES IT! Assist: Tim Johnson
Score: 32-44

[06:45] Team_045 possession (Score: 32-44)
FOUL! Holding foul on Bradley Dosunmu. [Team fouls: 2] No free throws, side out. (Bradley Dosunmu: 1 personal fouls)

[06:31] Team_045 possession (Score: 32-44)
Zion Butler attempts a Midrange. Contested by John Russell (5.2 feet, MAN). Zion Butler misses. Offensive rebound by Zion Butler! Zion Butler puts it back in!
Score: 34-44

[06:19] Team_027 possession (Score: 34-44)
Bradley Dosunmu drives, Zion Butler stays with him. Bradley Dosunmu attempts a Dunk. Contested by Zion Butler (4.8 feet, ZONE). BRADLEY DOSUNMU MAKES IT! Assist: Tony Doncic
Score: 34-46

[06:04] Team_045 possession (Score: 34-46)
Rudy Antetokounmpo attempts a 3Pt. BLOCKED BY BRADLEY DOSUNMU! Ball is loose! Offensive rebound by DeMar Turner! DeMar Turner kicks it out.

[05:54] Team_045 possession (Score: 34-46)
FOUL! Reach-in foul on John Russell during the drive. [Team fouls: 3] No free throws, side out. (John Russell: 2 personal fouls)

[05:42] Team_045 possession (Score: 34-46)
Cole Simons attempts a 3Pt. Contested by Bradley Dosunmu (5.9 feet, ZONE). Cole Simons misses. Rebound secured by John Russell.

[05:29] Team_027 possession (Score: 34-46)
Bradley Dosunmu drives, Zion Butler stays with him. Bradley Dosunmu attempts a Dunk. Contested by Zion Butler (5.0 feet, ZONE). Bradley Dosunmu misses. Rebound secured by Cole Simons.

[05:13] Team_045 possession (Score: 34-46)
Rudy Antetokounmpo attempts a 3Pt. Wide open! Tim Johnson is 6.4 feet away. [MAN] Rudy Antetokounmpo misses. Rebound secured by Bradley Dosunmu.

[04:59] Team_027 possession (Score: 34-46)
FOUL! Reach-in foul on DeMar Turner during the drive. [Team fouls: 2] No free throws, side out. (DeMar Turner: 1 personal fouls)

[04:46] Team_027 possession (Score: 34-46)
John Russell drives and kicks out. Tim Johnson attempts a 3Pt. Contested by Cole Simons (5.0 feet, ZONE). Tim Johnson misses. Rebound secured by Zion Butler.

[04:31] Team_045 possession (Score: 34-46)
Trae Russell attempts a 3Pt. Wide open! Bradley Dosunmu is 6.0 feet away. [ZONE] Trae Russell misses. Rebound secured by Bradley Dosunmu.

[04:18] Team_027 possession (Score: 34-46)
FOUL! Offensive foul on Tim Johnson! Rudy Antetokounmpo drew the charge! [Team fouls: 4] (Tim Johnson: 1 personal fouls) TURNOVER! (dead ball)

[04:02] Team_045 possession (Score: 34-46)
Rudy Antetokounmpo attempts a Midrange. Wide open! Tim Johnson is 6.5 feet away. [MAN] RUDY ANTETOKOUNMPO MAKES IT!
Score: 36-46

[03:50] Team_027 possession (Score: 36-46)
Tim Johnson drives, Rudy Antetokounmpo stays with him. Tim Johnson attempts a Dunk. Contested by Rudy Antetokounmpo (5.9 feet, MAN). TIM JOHNSON MAKES IT! Assist: Scottie Harden
Score: 36-48

[03:34] Team_045 possession (Score: 36-48)
Cole Simons attempts a 3Pt. Wide open! Scottie Harden is 6.5 feet away. [MAN] COLE SIMONS MAKES IT! Assist: Rudy Antetokounmpo
Score: 39-48

[03:22] Team_027 possession (Score: 39-48)
Tim Johnson attempts a Midrange. Wide open! DeMar Turner is 6.3 feet away. [ZONE] TIM JOHNSON MAKES IT! Assist: Tony Doncic
Score: 39-50

[03:11] Team_045 possession (Score: 39-50)
Rudy Antetokounmpo attempts a Midrange. Wide open! Tim Johnson is 6.7 feet away. [MAN] Rudy Antetokounmpo misses. Rebound secured by Tony Doncic.

[02:56] Team_027 possession (Score: 39-50)
Scottie Harden attempts a 3Pt. Contested by Cole Simons (5.2 feet, ZONE). Scottie Harden misses. Rebound secured by Cole Simons.

[02:44] Team_045 possession (Score: 39-50)
Rudy Antetokounmpo drives, picks up Tim Johnson. Help arrives from Tony Doncic! Rudy Antetokounmpo attempts a Dunk. Wide open! Tony Doncic is 6.7 feet away. [MAN] Rudy Antetokounmpo misses. Rebound secured by John Russell.

[02:32] Team_027 possession (Score: 39-50)
John Russell drives to the basket... FOUL! Offensive foul on John Russell! Zion Butler drew the charge! [Team fouls: 5] (John Russell: 3 personal fouls) TURNOVER! (dead ball)

[02:17] Team_045 possession (Score: 39-50)
DeMar Turner drives and kicks out. DeMar Turner attempts a Midrange. Wide open! Bradley Dosunmu is 6.2 feet away. [MAN] DeMar Turner misses. FOUL! Loose ball foul on John Russell during the rebound battle. [IN THE BONUS! 6 team fouls] DeMar Turner to the line for 2 free throws. (John Russell: 4 personal fouls)   FT 1/2: GOOD   FT 2/2: GOOD DeMar Turner makes 2/2 from the line.
Score: 41-50

[01:58] Team_027 possession (Score: 41-50)
Scottie Harden drives to the basket... Scottie Harden loses the ball! Stripped by Cole Simons! TURNOVER! (live ball)

[01:43] Team_045 possession (Score: 41-50)
Cole Simons drives to the basket... Cole Simons throws a bad pass out of bounds! TURNOVER! (dead ball)

[01:43] Substitution (Team_045): Rudy Antetokounmpo OUT → John Wagner IN (stamina_rule2)

[01:43] Substitution (Team_045): Trae Russell OUT → Julius James IN (stamina_rule2)

[01:43] Substitution (Team_045): Cole Simons OUT → Gary Towns IN (stamina_rule2)

[01:43] Substitution (Team_045): DeMar Turner OUT → Tim Sexton IN (stamina_rule2)

[01:43] Substitution (Team_045): Zion Butler OUT → Stephen Paul IN (stamina_rule2)

[01:43] Substitution (Team_027): Tim Johnson OUT → CJ Green IN (stamina_rule2)

[01:43] Substitution (Team_027): Tony Doncic OUT → Dirk Lillard IN (stamina_rule2)

[01:43] Substitution (Team_027): Scottie Harden OUT → Rudy Quickley IN (stamina_rule2)

[01:43] Substitution (Team_027): Bradley Dosunmu OUT → LeBron Russell IN (stamina_rule2)

[01:43] Substitution (Team_027): John Russell OUT → Ben Stewart IN (stamina_rule2)

[01:27] Team_027 possession (Score: 41-50)
FOUL! Shooting foul on Tim Sexton. LeBron Russell to the line for 2 free throws. [Team fouls: 3] (Tim Sexton: 1 personal fouls)   FT 1/2: GOOD   FT 2/2: MISS LeBron Russell makes 1/2 from the line. Rebound secured by Julius James.
Score: 41-51

[01:16] Team_045 possession (Score: 41-51)
Stephen Paul drives, picks up Ben Stewart. Help arrives from Dirk Lillard! Stephen Paul attempts a Dunk. Contested by Dirk Lillard (4.6 feet, MAN). Stephen Paul misses. Rebound secured by Dirk Lillard.

[01:00] Team_027 possession (Score: 41-51)
FOUL! Offensive foul on Ben Stewart! Stephen Paul drew the charge! [Team fouls: 7] (Ben Stewart: 1 personal fouls) TURNOVER! (dead ball)

[00:48] Team_045 possession (Score: 41-51)
Gary Towns attempts a 3Pt. Contested by Rudy Quickley (3.1 feet, MAN). Gary Towns misses. Rebound secured by Ben Stewart.

[00:34] Team_027 possession (Score: 41-51)
Ben Stewart makes the Midrange and draws the foul on Tim Sexton! And-1! Ben Stewart to the line for 1. [Team fouls: 4] (Tim Sexton: 2 personal fouls)   FT 1/1: GOOD Ben Stewart makes 1/1 from the line.
Score: 41-54

[00:24] Team_045 possession (Score: 41-54)
Stephen Paul drives and kicks out. Tim Sexton attempts a Midrange. Contested by LeBron Russell (5.5 feet, ZONE). Tim Sexton misses. Rebound secured by Dirk Lillard.

[00:09] Team_027 possession (Score: 41-54)
Dirk Lillard drives and kicks out. CJ Green attempts a 3Pt. Contested by John Wagner (4.1 feet, ZONE). CJ Green misses. Rebound secured by Tim Sexton.

================================================================================
                              2ND QUARTER COMPLETE                              
================================================================================

2ND QUARTER SCORE: Team_045 13, Team_027 21

BOX SCORE:
================================================================================

Team_045
--------------------------------------------------------------------------------
Player                MIN  PTS  REB  AST  TO      FG   FG%      3P   3P%
--------------------------------------------------------------------------------
Cole Simons            23    5    5    0   0   2/6    33.3     0/0   0.0
Rudy Antetokounmpo     23    4    0    1   0   2/6    33.3     0/0   0.0
Zion Butler            23    2    3    0   0   1/2    50.0     0/0   0.0
DeMar Turner           23    2    2    0   0   1/1   100.0     0/0   0.0
Trae Russell           23    0    0    2   0   0/2     0.0     0/0   0.0
Julius James            2    0    1    0   0   0/0     0.0     0/0   0.0
Stephen Paul            2    0    0    0   0   0/2     0.0     0/0   0.0
Gary Towns              2    0    0    0   0   0/1     0.0     0/0   0.0
Tim Sexton              2    0    1    0   0   0/0     0.0     0/0   0.0

TEAM: FG: 6/20 (30.0%), 3PT: 1/8 (12.5%), REB: 12 (3 off, 9 def), AST: 3, TO: 2
TEAM FOULS: 4


Team_027
--------------------------------------------------------------------------------
Player                MIN  PTS  REB  AST  TO      FG   FG%      3P   3P%
--------------------------------------------------------------------------------
Tim Johnson            23    6    0    1   0   3/4    75.0     0/0   0.0
John Russell           23    4    6    1   0   2/3    66.7     0/0   0.0
Bradley Dosunmu        23    4    5    0   0   2/3    66.7     0/0   0.0
Tony Doncic            23    3    2    3   0   1/1   100.0     0/0   0.0
Ben Stewart             2    3    1    0   0   1/1   100.0     0/0   0.0
Scottie Harden         23    0    0    1   0   0/4     0.0     0/0   0.0
LeBron Russell          2    0    0    0   0   0/1     0.0     0/0   0.0
Dirk Lillard            2    0    2    0   0   0/1     0.0     0/0   0.0

TEAM: FG: 9/18 (50.0%), 3PT: 1/5 (20.0%), REB: 16 (2 off, 14 def), AST: 6, TO: 4
TEAM FOULS: 7 [Team_045 in BONUS]

================================================================================

================================================================================
                       3RD QUARTER - Team_045 vs Team_027                       
================================================================================

[12:00] Team_045 possession (Score: 41-54)
Rudy Antetokounmpo drives to the basket... Rudy Antetokounmpo loses the ball! Stripped by Tim Johnson! TURNOVER! (live ball)

[11:48] Team_027 possession (Score: 41-54)
Scottie Harden attempts a 3Pt. Contested by Cole Simons (3.3 feet, MAN). SCOTTIE HARDEN MAKES IT! Assist: John Russell
Score: 41-57

[11:33] Team_045 possession (Score: 41-57)
Rudy Antetokounmpo attempts a 3Pt. Contested by Tim Johnson (5.3 feet, ZONE). RUDY ANTETOKOUNMPO MAKES IT!
Score: 44-57

[11:21] Team_027 possession (Score: 44-57)
John Russell drives to the basket... John Russell loses control! Ball rolls out of bounds! TURNOVER! (dead ball)

[11:08] Team_045 possession (Score: 44-57)
Rudy Antetokounmpo drives and kicks out. Zion Butler attempts a 3Pt. Contested by John Russell (3.9 feet, MAN). Zion Butler misses. Offensive rebound by Zion Butler! Zion Butler puts it back in!
Score: 46-57

[10:49] Team_027 possession (Score: 46-57)
Tony Doncic attempts a 3Pt. Contested by Cole Simons (3.4 feet, MAN). Tony Doncic misses. Rebound secured by Cole Simons.

[10:35] Team_045 possession (Score: 46-57)
Cole Simons drives, Scottie Harden stays with him. Cole Simons attempts a Layup. Contested by Scottie Harden (5.1 feet, MAN). COLE SIMONS MAKES IT! Assist: Rudy Antetokounmpo
Score: 48-57

[10:21] Team_027 possession (Score: 48-57)
Bradley Dosunmu throws a bad pass out of bounds! TURNOVER! (dead ball)

[10:07] Team_045 possession (Score: 48-57)
Trae Russell drives and kicks out. Trae Russell attempts a 3Pt. Contested by Scottie Harden (4.5 feet, ZONE). Trae Russell misses. FOUL! Loose ball foul on Tony Doncic during the rebound battle. [Team fouls: 1] No free throws, side out. (Tony Doncic: 1 personal fouls)

[09:47] Team_045 possession (Score: 48-57)
Trae Russell attempts a 3Pt. Contested by Tony Doncic (4.4 feet, MAN). Trae Russell misses. FOUL! Loose ball foul on John Russell during the rebound battle. [Team fouls: 2] No free throws, side out. (John Russell: 1 personal fouls)

[09:31] Team_045 possession (Score: 48-57)
Cole Simons attempts a 3Pt. Contested by Scottie Harden (5.1 feet, MAN). Cole Simons misses. FOUL! Loose ball foul on Bradley Dosunmu during the rebound battle. [Team fouls: 3] No free throws, side out. (Bradley Dosunmu: 1 personal fouls)

[09:13] Team_045 possession (Score: 48-57)
FOUL! Reach-in foul on John Russell during the drive. [Team fouls: 4] No free throws, side out. (John Russell: 2 personal fouls)

[08:57] Team_045 possession (Score: 48-57)
Rudy Antetokounmpo loses control! Ball rolls out of bounds! TURNOVER! (dead ball)

[08:39] Team_027 possession (Score: 48-57)
Tony Doncic attempts a 3Pt. Contested by Cole Simons (3.4 feet, MAN). TONY DONCIC MAKES IT! Assist: Tim Johnson
Score: 48-60

[08:25] Team_045 possession (Score: 48-60)
Rudy Antetokounmpo attempts a 3Pt. Contested by Tony Doncic (4.3 feet, ZONE). Rudy Antetokounmpo misses. Rebound secured by Tony Doncic.

[08:10] Team_027 possession (Score: 48-60)
Tony Doncic drives, picks up Cole Simons. Help arrives from Rudy Antetokounmpo! Tony Doncic attempts a Dunk. Contested by Rudy Antetokounmpo (3.4 feet, MAN). TONY DONCIC MAKES IT! Assist: Scottie Harden
Score: 48-62

[07:55] Team_045 possession (Score: 48-62)
Trae Russell attempts a Midrange. Contested by Bradley Dosunmu (4.9 feet, ZONE). TRAE RUSSELL MAKES IT! Assist: Rudy Antetokounmpo
Score: 50-62

[07:44] Team_027 possession (Score: 50-62)
John Russell attempts a Midrange. Contested by Cole Simons (4.1 feet, ZONE). JOHN RUSSELL MAKES IT! Assist: Tony Doncic
Score: 50-64

[07:31] Team_045 possession (Score: 50-64)
DeMar Turner drives, picks up John Russell. Help arrives from Tony Doncic! DeMar Turner attempts a Dunk. Contested by Tony Doncic (4.2 feet, ZONE). DEMAR TURNER MAKES IT!
Score: 52-64

[07:20] Team_027 possession (Score: 52-64)
Scottie Harden drives and kicks out. Tim Johnson attempts a Midrange. Contested by DeMar Turner (4.9 feet, ZONE). Tim Johnson misses. Offensive rebound by Bradley Dosunmu! Bradley Dosunmu kicks it out.

[07:04] Team_027 possession (Score: 52-64)
Tim Johnson attempts a 3Pt. Contested by Cole Simons (3.6 feet, ZONE). Tim Johnson misses. Rebound secured by DeMar Turner.

[06:47] Team_045 possession (Score: 52-64)
DeMar Turner attempts a 3Pt. Contested by Tim Johnson (5.2 feet, ZONE). DEMAR TURNER MAKES IT! Assist: Trae Russell
Score: 55-64

[06:35] Team_027 possession (Score: 55-64)
FOUL! Shooting foul on Cole Simons. Scottie Harden to the line for 2 free throws. [Team fouls: 1] (Cole Simons: 1 personal fouls)   FT 1/2: GOOD   FT 2/2: GOOD Scottie Harden makes 2/2 from the line.
Score: 55-66

[06:20] Team_045 possession (Score: 55-66)
Zion Butler loses control! Ball rolls out of bounds! TURNOVER! (dead ball)

[06:02] Team_027 possession (Score: 55-66)
FOUL! Shooting foul on Cole Simons. Scottie Harden to the line for 2 free throws. [Team fouls: 2] (Cole Simons: 2 personal fouls)   FT 1/2: GOOD   FT 2/2: GOOD Scottie Harden makes 2/2 from the line.
Score: 55-68

[05:50] Team_045 possession (Score: 55-68)
DeMar Turner attempts a 3Pt. Contested by Tim Johnson (5.2 feet, ZONE). DeMar Turner misses. Offensive rebound by Zion Butler! Zion Butler's putback is no good. Rebound secured by John Russell.

[05:35] Team_027 possession (Score: 55-68)
Tim Johnson drives and kicks out. Tony Doncic attempts a 3Pt. Contested by Cole Simons (3.3 feet, ZONE). Tony Doncic misses. Rebound secured by Cole Simons.

[05:16] Team_045 possession (Score: 55-68)
DeMar Turner drives, John Russell stays with him. DeMar Turner attempts a Layup. Contested by John Russell (4.2 feet, ZONE). DEMAR TURNER MAKES IT! Assist: Zion Butler
Score: 57-68

[05:03] Team_027 possession (Score: 57-68)
Tim Johnson makes the 3Pt and draws the foul on Rudy Antetokounmpo! And-1! Tim Johnson to the line for 1. [Team fouls: 3] (Rudy Antetokounmpo: 1 personal fouls)   FT 1/1: GOOD Tim Johnson makes 1/1 from the line.
Score: 57-72

[04:49] Team_045 possession (Score: 57-72)
FOUL! Holding foul on John Russell. [IN THE BONUS! 5 team fouls] Zion Butler to the line for 2 free throws. (John Russell: 3 personal fouls)   FT 1/2: GOOD   FT 2/2: GOOD Zion Butler makes 2/2 from the line.
Score: 59-72

[04:35] Team_027 possession (Score: 59-72)
Bradley Dosunmu drives, picks up DeMar Turner. Help arrives from Rudy Antetokounmpo! Bradley Dosunmu attempts a Dunk. Contested by Rudy Antetokounmpo (5.0 feet, MAN). BRADLEY DOSUNMU MAKES IT!
Score: 59-74

[04:21] Team_045 possession (Score: 59-74)
Rudy Antetokounmpo attempts a 3Pt. Contested by Tim Johnson (5.3 feet, ZONE). Rudy Antetokounmpo misses. Rebound secured by Tony Doncic.

[04:05] Team_027 possession (Score: 59-74)
FOUL! Shooting foul on Cole Simons. John Russell to the line for 2 free throws. [Team fouls: 4] (Cole Simons: 3 personal fouls)   FT 1/2: GOOD   FT 2/2: GOOD John Russell makes 2/2 from the line.
Score: 59-76

[03:54] Team_045 possession (Score: 59-76)
FOUL! Shooting foul on John Russell. DeMar Turner to the line for 2 free throws. [BONUS: 6 team fouls] (John Russell: 4 personal fouls)   FT 1/2: GOOD   FT 2/2: GOOD DeMar Turner makes 2/2 from the line.
Score: 61-76

[03:38] Team_027 possession (Score: 61-76)
John Russell drives and kicks out. Tim Johnson attempts a 3Pt. Contested by Trae Russell (5.5 feet, ZONE). Tim Johnson misses. Rebound secured by Cole Simons.

[03:23] Team_045 possession (Score: 61-76)
Trae Russell drives and kicks out. DeMar Turner attempts a 3Pt. Contested by Bradley Dosunmu (4.5 feet, MAN). DeMar Turner misses. Rebound secured by Tony Doncic.

[03:10] Team_027 possession (Score: 61-76)
Tim Johnson attempts a Layup. Contested by Rudy Antetokounmpo (4.8 feet, MAN). Tim Johnson misses. Offensive rebound by Bradley Dosunmu! Bradley Dosunmu kicks it out.

[02:56] Team_027 possession (Score: 61-76)
Scottie Harden attempts a Midrange. Contested by Cole Simons (3.6 feet, MAN). Scottie Harden misses. FOUL! Loose ball foul on Zion Butler during the rebound battle. [IN THE BONUS! 5 team fouls] Bradley Dosunmu to the line for 2 free throws. (Zion Butler: 1 personal fouls)   FT 1/2: GOOD   FT 2/2: GOOD Bradley Dosunmu makes 2/2 from the line.
Score: 61-78

[02:43] Team_045 possession (Score: 61-78)
FOUL! Reach-in foul on John Russell during the drive. [IN THE BONUS! 7 team fouls] Zion Butler to the line for 2 free throws. (John Russell: 5 personal fouls)   FT 1/2: GOOD   FT 2/2: GOOD Zion Butler makes 2/2 from the line.
Score: 63-78

[02:27] Team_027 possession (Score: 63-78)
Tim Johnson makes the Layup and draws the foul on Rudy Antetokounmpo! And-1! Tim Johnson to the line for 1. [BONUS: 6 team fouls] (Rudy Antetokounmpo: 2 personal fouls)   FT 1/1: GOOD Tim Johnson makes 1/1 from the line.
Score: 63-81

[02:16] Team_045 possession (Score: 63-81)
Rudy Antetokounmpo attempts a 3Pt. Contested by Tim Johnson (5.5 feet, ZONE). Rudy Antetokounmpo misses. Rebound secured by Bradley Dosunmu.

[01:58] Team_027 possession (Score: 63-81)
John Russell attempts a Layup. Contested by Zion Butler (4.5 feet, MAN). JOHN RUSSELL MAKES IT!
Score: 63-83

[01:44] Team_045 possession (Score: 63-83)
Zion Butler attempts a Layup. Contested by John Russell (4.5 feet, MAN). ZION BUTLER MAKES IT! Assist: DeMar Turner
Score: 65-83

[01:33] Team_027 possession (Score: 65-83)
Scottie Harden attempts a 3Pt. Contested by Cole Simons (3.8 feet, ZONE). SCOTTIE HARDEN MAKES IT!
Score: 65-86

[01:17] Team_045 possession (Score: 65-86)
DeMar Turner attempts a 3Pt. Contested by Bradley Dosunmu (5.0 feet, MAN). DeMar Turner misses. Offensive rebound by Zion Butler! Zion Butler's putback is no good. Offensive rebound by DeMar Turner! DeMar Turner kicks it out.

[01:04] Team_045 possession (Score: 65-86)
Cole Simons attempts a Layup. Contested by Scottie Harden (5.5 feet, MAN). Cole Simons misses. Rebound secured by Bradley Dosunmu.

[00:51] Team_027 possession (Score: 65-86)
Tony Doncic attempts a 3Pt. Contested by Cole Simons (3.9 feet, ZONE). Tony Doncic misses. Rebound secured by Cole Simons.

[00:40] Team_045 possession (Score: 65-86)
Zion Butler makes the Dunk and draws the foul on John Russell! And-1! Zion Butler to the line for 1. [BONUS: 8 team fouls] (John Russell: 6 personal fouls) John Russell FOULS OUT!   FT 1/1: MISS Zion Butler makes 0/1 from the line. Rebound secured by Tony Doncic.
Score: 67-86

[00:40] Substitution (Team_027): John Russell OUT (stamina: 63) → CJ Green IN (foul_out)

[00:28] Team_027 possession (Score: 67-86)
Tim Johnson attempts a Midrange. Contested by Rudy Antetokounmpo (5.1 feet, MAN). Tim Johnson misses. Rebound secured by Cole Simons.

[00:17] Team_045 possession (Score: 67-86)
Cole Simons attempts a Layup. Contested by Scottie Harden (5.6 feet, MAN). Cole Simons misses. Offensive rebound by DeMar Turner! DeMar Turner kicks it out.

[00:07] Team_045 possession (Score: 67-86)
FOUL! Reach-in foul on Bradley Dosunmu during the drive. [IN THE BONUS! 9 team fouls] DeMar Turner to the line for 2 free throws. (Bradley Dosunmu: 2 personal fouls)   FT 1/2: GOOD   FT 2/2: GOOD DeMar Turner makes 2/2 from the line.
Score: 69-86

================================================================================
                              3RD QUARTER COMPLETE                              
================================================================================

3RD QUARTER SCORE: Team_045 28, Team_027 32

BOX SCORE:
================================================================================

Team_045
--------------------------------------------------------------------------------
Player                MIN  PTS  REB  AST  TO      FG   FG%      3P   3P%
--------------------------------------------------------------------------------
DeMar Turner           35   11    6    1   0   5/6    83.3     0/0   0.0
Zion Butler            35    8    1    1   0   4/5    80.0     0/0   0.0
Rudy Antetokounmpo     35    3    0    2   0   1/4    25.0     0/0   0.0
Cole Simons            35    2    5    0   0   1/2    50.0     0/0   0.0
Trae Russell           35    2    0    1   0   1/2    50.0     0/0   0.0

TEAM: FG: 12/19 (63.2%), 3PT: 2/6 (33.3%), REB: 13 (7 off, 6 def), AST: 5, TO: 3
TEAM FOULS: 6 [Team_027 in BONUS]


Team_027
--------------------------------------------------------------------------------
Player                MIN  PTS  REB  AST  TO      FG   FG%      3P   3P%
--------------------------------------------------------------------------------
Scottie Harden         35   10    0    1   0   4/4   100.0     0/0   0.0
Tim Johnson            35    7    0    1   0   2/5    40.0     0/0   0.0
John Russell           34    6    1    1   0   3/4    75.0     0/0   0.0
Tony Doncic            35    5    4    1   0   2/4    50.0     0/0   0.0
Bradley Dosunmu        35    4    4    0   0   2/2   100.0     0/0   0.0

TEAM: FG: 13/19 (68.4%), 3PT: 4/7 (57.1%), REB: 8 (2 off, 6 def), AST: 4, TO: 2
TEAM FOULS: 9 [Team_045 in BONUS]

================================================================================

================================================================================
                       4TH QUARTER - Team_045 vs Team_027                       
================================================================================

[12:00] Substitution (Team_045): Rudy Antetokounmpo OUT (stamina: 70) → John Wagner IN (comeback_detected)

[12:00] Substitution (Team_027): Tim Johnson OUT (stamina: 67) → CJ Green IN (comeback_detected)

[12:00] Team_045 possession (Score: 69-86)
John Wagner attempts a Midrange. Contested by Bradley Dosunmu (4.8 feet, ZONE). John Wagner misses. Rebound secured by Tony Doncic.

[11:43] Team_027 possession (Score: 69-86)
Scottie Harden attempts a 3Pt. Contested by Cole Simons (3.7 feet, MAN). SCOTTIE HARDEN MAKES IT!
Score: 69-89

[11:31] Team_045 possession (Score: 69-89)
DeMar Turner attempts a Midrange. Contested by Bradley Dosunmu (5.0 feet, MAN). DeMar Turner misses. Offensive rebound by DeMar Turner! DeMar Turner kicks it out.

[11:15] Team_045 possession (Score: 69-89)
Cole Simons drives, John Russell stays with him. Cole Simons attempts a Layup. Contested by John Russell (4.8 feet, ZONE). COLE SIMONS MAKES IT! Assist: DeMar Turner
Score: 71-89

[10:59] Team_027 possession (Score: 71-89)
FOUL! Shooting foul on Trae Russell. Bradley Dosunmu to the line for 2 free throws. [Team fouls: 1] (Trae Russell: 1 personal fouls)   FT 1/2: GOOD   FT 2/2: MISS Bradley Dosunmu makes 1/2 from the line. Rebound secured by DeMar Turner.
Score: 71-90

[10:41] Team_045 possession (Score: 71-90)
John Wagner attempts a Midrange. Contested by Bradley Dosunmu (5.0 feet, ZONE). John Wagner misses. Offensive rebound by Zion Butler! Zion Butler puts it back in!
Score: 73-90

[10:30] Team_027 possession (Score: 73-90)
FOUL! Shooting foul on Cole Simons. Bradley Dosunmu to the line for 3 free throws. [Team fouls: 2] (Cole Simons: 1 personal fouls)   FT 1/3: GOOD   FT 2/3: GOOD   FT 3/3: GOOD Bradley Dosunmu makes 3/3 from the line.
Score: 73-93

[10:16] Team_045 possession (Score: 73-93)
FOUL! Holding foul on CJ Green. [Team fouls: 1] No free throws, side out. (CJ Green: 1 personal fouls)

[10:01] Team_045 possession (Score: 73-93)
Zion Butler drives, John Russell stays with him. Zion Butler attempts a Dunk. Contested by John Russell (4.6 feet, MAN). Zion Butler misses. Offensive rebound by Zion Butler! Zion Butler puts it back in!
Score: 75-93

[09:46] Team_027 possession (Score: 75-93)
Tony Doncic drives, Zion Butler stays with him. Tony Doncic attempts a Dunk. Contested by Zion Butler (4.3 feet, ZONE). TONY DONCIC MAKES IT! Assist: John Russell
Score: 75-95

[09:32] Team_045 possession (Score: 75-95)
Trae Russell attempts a Midrange. Contested by Tony Doncic (4.9 feet, MAN). TRAE RUSSELL MAKES IT!
Score: 77-95

[09:20] Team_027 possession (Score: 77-95)
Bradley Dosunmu drives to the basket... Bradley Dosunmu throws a bad pass! Stolen by DeMar Turner! TURNOVER! (live ball)

[09:08] Team_045 possession (Score: 77-95)
Zion Butler drives and kicks out. Trae Russell attempts a 3Pt. Contested by Tony Doncic (4.6 feet, MAN). Trae Russell misses. Offensive rebound by DeMar Turner! DeMar Turner kicks it out.

[08:53] Team_045 possession (Score: 77-95)
Cole Simons attempts a 3Pt. Contested by CJ Green (5.5 feet, ZONE). Cole Simons misses. FOUL! Loose ball foul on Tony Doncic during the rebound battle. [Team fouls: 2] No free throws, side out. (Tony Doncic: 1 personal fouls)

[08:40] Team_045 possession (Score: 77-95)
Cole Simons loses control! Ball rolls out of bounds! TURNOVER! (dead ball)

[08:40] Substitution (Team_045): Trae Russell OUT → Julius James IN (stamina_rule2)

[08:40] Substitution (Team_045): Cole Simons OUT → Gary Towns IN (stamina_rule2)

[08:40] Substitution (Team_045): DeMar Turner OUT → Tim Sexton IN (stamina_rule2)

[08:40] Substitution (Team_045): Zion Butler OUT → Stephen Paul IN (stamina_rule2)

[08:40] Substitution (Team_027): Tony Doncic OUT → Dirk Lillard IN (stamina_rule2)

[08:40] Substitution (Team_027): Scottie Harden OUT → Rudy Quickley IN (stamina_rule2)

[08:40] Substitution (Team_027): Bradley Dosunmu OUT → LeBron Russell IN (stamina_rule2)

[08:40] Substitution (Team_027): John Russell OUT → Ben Stewart IN (stamina_rule2)

[08:27] Team_027 possession (Score: 77-95)
Dirk Lillard attempts a 3Pt. Contested by Tim Sexton (4.6 feet, ZONE). Dirk Lillard misses. Rebound secured by Tim Sexton.

[08:14] Team_045 possession (Score: 77-95)
John Wagner attempts a Midrange. Contested by Dirk Lillard (4.3 feet, ZONE). John Wagner misses. Rebound secured by LeBron Russell.

[07:58] Team_027 possession (Score: 77-95)
Dirk Lillard makes the Midrange and draws the foul on Tim Sexton! And-1! Dirk Lillard to the line for 1. [Team fouls: 3] (Tim Sexton: 1 personal fouls)   FT 1/1: GOOD Dirk Lillard makes 1/1 from the line.
Score: 77-98

[07:47] Team_045 possession (Score: 77-98)
Gary Towns attempts a 3Pt. Contested by Rudy Quickley (3.1 feet, MAN). Gary Towns misses. Offensive rebound by Tim Sexton! Tim Sexton kicks it out.

[07:31] Team_045 possession (Score: 77-98)
FOUL! Reach-in foul on Dirk Lillard during the drive. [Team fouls: 3] No free throws, side out. (Dirk Lillard: 1 personal fouls)

[07:14] Team_045 possession (Score: 77-98)
John Wagner attempts a 3Pt. Contested by Rudy Quickley (3.5 feet, ZONE). John Wagner misses. FOUL! Loose ball foul on Dirk Lillard during the rebound battle. [Team fouls: 4] No free throws, side out. (Dirk Lillard: 2 personal fouls)

[06:59] Team_045 possession (Score: 77-98)
Stephen Paul attempts a Midrange. Contested by Ben Stewart (4.6 feet, MAN). STEPHEN PAUL MAKES IT! Assist: John Wagner
Score: 79-98

[06:45] Team_027 possession (Score: 79-98)
CJ Green attempts a Layup. Contested by Tim Sexton (4.7 feet, ZONE). CJ Green misses. Rebound secured by Stephen Paul.

[06:33] Team_045 possession (Score: 79-98)
Gary Towns drives, Ben Stewart stays with him. Gary Towns attempts a Dunk. Contested by Ben Stewart (4.5 feet, ZONE). Gary Towns misses. Offensive rebound by Julius James! Julius James kicks it out.

[06:17] Team_045 possession (Score: 79-98)
Julius James drives and kicks out. Julius James attempts a 3Pt. Contested by Dirk Lillard (4.1 feet, MAN). Julius James misses. Rebound secured by LeBron Russell.

[06:07] Team_027 possession (Score: 79-98)
Dirk Lillard makes the Layup and draws the foul on Stephen Paul! And-1! Dirk Lillard to the line for 1. [Team fouls: 4] (Stephen Paul: 1 personal fouls)   FT 1/1: MISS Dirk Lillard makes 0/1 from the line. Offensive rebound by Ben Stewart! Ben Stewart puts it back in!
Score: 79-102

[05:54] Team_045 possession (Score: 79-102)
Julius James attempts a Midrange. Contested by Dirk Lillard (4.3 feet, ZONE). Julius James misses. Rebound secured by Ben Stewart.

[05:38] Team_027 possession (Score: 79-102)
Ben Stewart drives, Stephen Paul stays with him. Ben Stewart attempts a Layup. Contested by Stephen Paul (4.4 feet, MAN). BEN STEWART MAKES IT! Assist: CJ Green
Score: 79-104

[05:27] Team_045 possession (Score: 79-104)
Stephen Paul throws a bad pass! Stolen by Ben Stewart! TURNOVER! (live ball)

[05:14] Team_027 possession (Score: 79-104)
CJ Green attempts a 3Pt. Contested by John Wagner (4.3 feet, ZONE). CJ Green misses. Rebound secured by Stephen Paul.

[05:04] Team_045 possession (Score: 79-104)
John Wagner attempts a 3Pt. Contested by CJ Green (5.3 feet, MAN). John Wagner misses. Rebound secured by Ben Stewart.

[04:49] Team_027 possession (Score: 79-104)
Dirk Lillard attempts a 3Pt. Contested by Julius James (4.0 feet, MAN). Dirk Lillard misses. Rebound secured by Tim Sexton.

[04:35] Team_045 possession (Score: 79-104)
Tim Sexton attempts a Midrange. Contested by LeBron Russell (5.9 feet, MAN). TIM SEXTON MAKES IT! Assist: John Wagner
Score: 81-104

[04:20] Team_027 possession (Score: 81-104)
FOUL! Holding foul on John Wagner. [IN THE BONUS! 5 team fouls] CJ Green to the line for 2 free throws. (John Wagner: 1 personal fouls)   FT 1/2: GOOD   FT 2/2: GOOD CJ Green makes 2/2 from the line.
Score: 81-106

[04:03] Team_045 possession (Score: 81-106)
Stephen Paul makes the Layup and draws the foul on Ben Stewart! And-1! Stephen Paul to the line for 1. [BONUS: 5 team fouls] (Ben Stewart: 1 personal fouls)   FT 1/1: GOOD Stephen Paul makes 1/1 from the line.
Score: 84-106

[03:47] Team_027 possession (Score: 84-106)
CJ Green attempts a Layup. Contested by John Wagner (4.4 feet, MAN). CJ GREEN MAKES IT!
Score: 84-108

[03:36] Team_045 possession (Score: 84-108)
Gary Towns attempts a 3Pt. Contested by Rudy Quickley (3.1 feet, MAN). Gary Towns misses. Rebound secured by Dirk Lillard.

[03:25] Team_027 possession (Score: 84-108)
Dirk Lillard attempts a Layup. Contested by Stephen Paul (4.6 feet, ZONE). Dirk Lillard misses. FOUL! Loose ball foul on Julius James during the rebound battle. [IN THE BONUS! 6 team fouls] Dirk Lillard to the line for 2 free throws. (Julius James: 1 personal fouls)   FT 1/2: MISS   FT 2/2: GOOD Dirk Lillard makes 1/2 from the line.
Score: 84-109

[03:13] Team_045 possession (Score: 84-109)
Stephen Paul drives, picks up Ben Stewart. Help arrives from Dirk Lillard! Stephen Paul attempts a Layup. Contested by Dirk Lillard (4.6 feet, MAN). STEPHEN PAUL MAKES IT! Assist: Julius James
Score: 86-109

[03:03] Team_027 possession (Score: 86-109)
Rudy Quickley attempts a 3Pt. Contested by John Wagner (4.9 feet, ZONE). Rudy Quickley misses. FOUL! Loose ball foul on Stephen Paul during the rebound battle. [IN THE BONUS! 7 team fouls] Dirk Lillard to the line for 2 free throws. (Stephen Paul: 2 personal fouls)   FT 1/2: GOOD   FT 2/2: GOOD Dirk Lillard makes 2/2 from the line.
Score: 86-111

[02:49] Team_045 possession (Score: 86-111)
Julius James attempts a 3Pt. Contested by Rudy Quickley (3.5 feet, ZONE). JULIUS JAMES MAKES IT! Assist: Stephen Paul
Score: 89-111

[02:35] Team_027 possession (Score: 89-111)
Ben Stewart drives and kicks out. Rudy Quickley attempts a Midrange. Contested by Gary Towns (5.0 feet, ZONE). RUDY QUICKLEY MAKES IT!
Score: 89-113

[02:20] Team_045 possession (Score: 89-113)
John Wagner attempts a 3Pt. Contested by CJ Green (5.6 feet, MAN). John Wagner misses. Rebound secured by Ben Stewart.

[02:05] Team_027 possession (Score: 89-113)
FOUL! Shooting foul on Julius James. Rudy Quickley to the line for 2 free throws. [BONUS: 8 team fouls] (Julius James: 2 personal fouls)   FT 1/2: GOOD   FT 2/2: GOOD Rudy Quickley makes 2/2 from the line.
Score: 89-115

[01:55] Team_045 possession (Score: 89-115)
John Wagner attempts a 3Pt. Contested by CJ Green (5.6 feet, MAN). JOHN WAGNER MAKES IT! Assist: Tim Sexton
Score: 92-115

[01:42] Team_027 possession (Score: 92-115)
LeBron Russell attempts a Midrange. Contested by Stephen Paul (4.6 feet, ZONE). LeBron Russell misses. Rebound secured by Tim Sexton.

[01:28] Team_045 possession (Score: 92-115)
John Wagner attempts a 3Pt. Contested by CJ Green (5.7 feet, MAN). JOHN WAGNER MAKES IT! Assist: Tim Sexton
Score: 95-115

[01:11] Team_027 possession (Score: 95-115)
LeBron Russell makes the Layup and draws the foul on Stephen Paul! And-1! LeBron Russell to the line for 1. [BONUS: 9 team fouls] (Stephen Paul: 3 personal fouls)   FT 1/1: GOOD LeBron Russell makes 1/1 from the line.
Score: 95-118

[01:01] Team_045 possession (Score: 95-118)
Tim Sexton drives and kicks out. Tim Sexton attempts a 3Pt. Contested by LeBron Russell (5.6 feet, MAN). Tim Sexton misses. Rebound secured by Ben Stewart.

[00:49] Team_027 possession (Score: 95-118)
CJ Green attempts a 3Pt. Contested by John Wagner (4.8 feet, MAN). CJ Green misses. Offensive rebound by Ben Stewart! Ben Stewart's putback is no good. Rebound secured by Stephen Paul.

[00:35] Team_045 possession (Score: 95-118)
Julius James attempts a Layup. Contested by Ben Stewart (5.0 feet, ZONE). JULIUS JAMES MAKES IT! Assist: Stephen Paul
Score: 97-118

[00:19] Team_027 possession (Score: 97-118)
Ben Stewart drives, Stephen Paul stays with him. Ben Stewart attempts a Layup. Contested by Stephen Paul (4.6 feet, MAN). BEN STEWART MAKES IT! Assist: LeBron Russell
Score: 97-120

[00:05] Team_045 possession (Score: 97-120)
John Wagner attempts a 3Pt. Contested by Rudy Quickley (3.6 feet, ZONE). JOHN WAGNER MAKES IT! Assist: Gary Towns
Score: 100-120

================================================================================
                              4TH QUARTER COMPLETE                              
================================================================================

4TH QUARTER SCORE: Team_045 31, Team_027 34

BOX SCORE:
================================================================================

Team_045
--------------------------------------------------------------------------------
Player                MIN  PTS  REB  AST  TO      FG   FG%      3P   3P%
--------------------------------------------------------------------------------
John Wagner            14    9    0    2   0   3/7    42.9     0/0   0.0
Stephen Paul           10    7    3    2   0   3/3   100.0     0/0   0.0
Julius James           10    5    2    1   0   2/4    50.0     0/0   0.0
Zion Butler            38    4    3    0   0   2/2   100.0     0/0   0.0
Cole Simons            38    2    0    0   0   1/1   100.0     0/0   0.0
Trae Russell           38    2    0    0   0   1/1   100.0     0/0   0.0
Tim Sexton             10    2    4    2   0   1/2    50.0     0/0   0.0
DeMar Turner           38    0    3    1   0   0/0     0.0     0/0   0.0
Gary Towns             10    0    0    1   0   0/1     0.0     0/0   0.0

TEAM: FG: 13/21 (61.9%), 3PT: 4/7 (57.1%), REB: 14 (8 off, 6 def), AST: 9, TO: 2
TEAM FOULS: 9 [Team_027 in BONUS]


Team_027
--------------------------------------------------------------------------------
Player                MIN  PTS  REB  AST  TO      FG   FG%      3P   3P%
--------------------------------------------------------------------------------
Ben Stewart            10    8    4    0   0   3/3   100.0     0/0   0.0
Dirk Lillard           10    6    1    0   0   3/5    60.0     0/0   0.0
CJ Green               14    4    0    1   0   2/5    40.0     0/0   0.0
Rudy Quickley          10    4    0    0   0   2/2   100.0     0/0   0.0
Scottie Harden         38    3    0    0   0   1/1   100.0     0/0   0.0
Bradley Dosunmu        38    3    0    0   0   1/2    50.0     0/0   0.0
LeBron Russell         10    3    2    1   0   1/2    50.0     0/0   0.0
Tony Doncic            38    2    1    0   0   1/1   100.0     0/0   0.0
John Russell           38    0    0    1   0   0/0     0.0     0/0   0.0

TEAM: FG: 14/21 (66.7%), 3PT: 3/7 (42.9%), REB: 9 (1 off, 8 def), AST: 3, TO: 1
TEAM FOULS: 5 [Team_045 in BONUS]

================================================================================

================================================================================
                               FULL GAME COMPLETE                               
================================================================================

FINAL SCORE: Team_045 100, Team_027 120

SCORING BY QUARTER:
--------------------------------------------------------------------------------
Team                     Q1     Q2     Q3     Q4    FINAL
--------------------------------------------------------------------------------
Team_045                 28     13     28     31      100
Team_027                 33     21     32     34      120
--------------------------------------------------------------------------------

FULL GAME BOX SCORE:
================================================================================

Team_045
--------------------------------------------------------------------------------
Player                MIN  PTS  REB  AST  TO      FG   FG%      3P   3P%      FT STL BLK
--------------------------------------------------------------------------------
Trae Russell           38   11    0    5   1   6/14   42.9   2/7    28.6   1/2     0   0
Cole Simons            38   20   12    1   2   8/15   53.3   3/6    50.0   1/1     1   1
DeMar Turner           38   15   14    3   1   7/9    77.8   1/2    50.0   6/7     2   0
Zion Butler            38   19    9    1   1   6/9    66.7   1/1   100.0   7/8     1   0
Rudy Antetokounmpo     35    7    0    4   3   3/13   23.1   1/8    12.5   0/0     0   0
John Wagner            14    9    0    2   0   4/8    50.0   3/5    60.0   0/0     0   0
Julius James           10    5    3    1   0   2/4    50.0   1/1   100.0   0/0     0   0
Gary Towns             10    0    0    1   0   0/2     0.0   0/2     0.0   0/0     0   0
Tim Sexton             10    2    5    2   0   1/2    50.0   0/0     0.0   0/0     0   0
Stephen Paul           10    7    3    2   1   3/5    60.0   0/0     0.0   1/1     0   0

TEAM: FG: 41/82 (50.0%), 3PT: 12/32 (37.5%), REB: 46 (19 off, 27 def), AST: 22, TO: 9


Team_027
--------------------------------------------------------------------------------
Player                MIN  PTS  REB  AST  TO      FG   FG%      3P   3P%      FT STL BLK
--------------------------------------------------------------------------------
Tony Doncic            38   15   12    4   1   6/8    75.0   3/5    60.0   0/0     1   0
Scottie Harden         38   13    0    3   2   6/14   42.9   3/7    42.9   4/4     0   1
Bradley Dosunmu        38   23   12    0   3  10/13   76.9   2/2   100.0   7/8     0   1
John Russell           38   19   13    6   2   7/9    77.8   0/0     0.0   3/3     0   0
Tim Johnson            35   20    0    5   2   9/14   64.3   1/4    25.0   3/3     2   0
CJ Green               14    4    0    1   0   1/4    25.0   0/2     0.0   2/2     0   0
Dirk Lillard           10    6    3    0   0   3/6    50.0   0/2     0.0   4/6     0   0
Rudy Quickley          10    4    0    0   0   2/2   100.0   1/1   100.0   2/2     0   0
LeBron Russell         10    3    2    1   0   1/3    33.3   0/0     0.0   2/3     0   0
Ben Stewart            10   11    6    0   1   4/4   100.0   0/0     0.0   1/1     1   0

TEAM: FG: 50/78 (64.1%), 3PT: 10/23 (43.5%), REB: 47 (7 off, 40 def), AST: 20, TO: 11

================================================================================
