================================================================================
                        FULL GAME - Team_010 vs Team_085                        
================================================================================

================================================================================
                       1ST QUARTER - Team_010 vs Team_085                       
================================================================================

[12:00] Team_010 possession (Score: 0-0)
RJ Young attempts a Midrange. Contested by Larry Duncan (3.9 feet, MAN). RJ YOUNG MAKES IT! Assist: Cade Morant
Score: 2-0

[11:47] Team_085 possession (Score: 2-0)
Paul Wagner attempts a 3Pt. Contested by Desmond Antetokounmpo (5.2 feet, MAN). Paul Wagner misses. Rebound secured by Desmond Antetokounmpo.

[11:29] Team_010 possession (Score: 2-0)
FOUL! Holding foul on Stephen Bird. [Team fouls: 1] No free throws, side out. (Stephen Bird: 1 personal fouls)

[11:14] Team_010 possession (Score: 2-0)
FOUL! Holding foul on Larry Duncan. [Team fouls: 2] No free throws, side out. (Larry Duncan: 1 personal fouls)

[11:01] Team_010 possession (Score: 2-0)
Anthony Durant attempts a Midrange. Contested by Collin Mobley (3.1 feet, MAN). ANTHONY DURANT MAKES IT!
Score: 4-0

[10:48] Team_085 possession (Score: 4-0)
Larry Duncan makes the Midrange and draws the foul on RJ Young! And-1! Larry Duncan to the line for 1. [Team fouls: 1] (RJ Young: 1 personal fouls)   FT 1/1: GOOD Larry Duncan makes 1/1 from the line.
Score: 4-3

[10:35] Team_010 possession (Score: 4-3)
Anthony Durant loses the ball! Stripped by Collin Mobley! TURNOVER! (live ball)

[10:19] Team_085 possession (Score: 4-3)
Collin Mobley attempts a Midrange. Wide open! Anthony Durant is 6.4 feet away. [MAN] Collin Mobley misses. Rebound secured by Desmond Antetokounmpo.

[10:06] Team_010 possession (Score: 4-3)
Cade Morant attempts a 3Pt. Wide open! Magic Beal is 6.5 feet away. [MAN] CADE MORANT MAKES IT! Assist: Anthony Durant
Score: 7-3

[09:51] Team_085 possession (Score: 7-3)
FOUL! Shooting foul on Cade Morant. Stephen Bird to the line for 3 free throws. [Team fouls: 2] (Cade Morant: 1 personal fouls)   FT 1/3: GOOD   FT 2/3: MISS   FT 3/3: MISS Stephen Bird makes 1/3 from the line. Rebound secured by Desmond Antetokounmpo.
Score: 7-4

[09:41] Team_010 possession (Score: 7-4)
Michael Turner commits a violation (traveling/carry)! TURNOVER! (dead ball)

[09:25] Team_085 possession (Score: 7-4)
Paul Wagner drives, Anthony Durant stays with him. Paul Wagner attempts a Layup. Heavily contested by Anthony Durant (1.1 feet, ZONE)! PAUL WAGNER MAKES IT!
Score: 7-6

[09:08] Team_010 possession (Score: 7-6)
Cade Morant attempts a Midrange. Wide open! Stephen Bird is 6.9 feet away. [ZONE] CADE MORANT MAKES IT!
Score: 9-6

[08:53] Team_085 possession (Score: 9-6)
Larry Duncan attempts a Midrange. Contested by RJ Young (3.9 feet, MAN). Larry Duncan misses. Rebound secured by Cade Morant.

[08:38] Team_010 possession (Score: 9-6)
FOUL! Holding foul on Larry Duncan. [Team fouls: 3] No free throws, side out. (Larry Duncan: 2 personal fouls)

[08:25] Team_010 possession (Score: 9-6)
Michael Turner attempts a Layup. Contested by Stephen Bird (4.6 feet, MAN). MICHAEL TURNER MAKES IT! Assist: RJ Young
Score: 11-6

[08:09] Team_085 possession (Score: 11-6)
Collin Mobley drives and kicks out. Paul Wagner attempts a Midrange. Contested by Desmond Antetokounmpo (2.5 feet, MAN). Paul Wagner misses. Rebound secured by Cade Morant.

[07:55] Team_010 possession (Score: 11-6)
RJ Young attempts a 3Pt. Contested by Magic Beal (3.8 feet, ZONE). RJ YOUNG MAKES IT! Assist: Anthony Durant
Score: 14-6

[07:41] Team_085 possession (Score: 14-6)
Collin Mobley drives, Anthony Durant stays with him. Collin Mobley attempts a Dunk. Contested by Anthony Durant (2.5 feet, ZONE). Collin Mobley misses. Rebound secured by Desmond Antetokounmpo.

[07:27] Team_010 possession (Score: 14-6)
RJ Young attempts a Midrange. Contested by Paul Wagner (3.5 feet, ZONE). RJ YOUNG MAKES IT! Assist: Desmond Antetokounmpo
Score: 16-6

[07:12] Team_085 possession (Score: 16-6)
Larry Duncan attempts a 3Pt. Wide open! RJ Young is 7.7 feet away. [MAN] LARRY DUNCAN MAKES IT! Assist: Stephen Bird
Score: 16-9

[06:57] Team_010 possession (Score: 16-9)
RJ Young drives to the basket... FOUL! Offensive foul on RJ Young! Larry Duncan drew the charge! [Team fouls: 3] (RJ Young: 2 personal fouls) TURNOVER! (dead ball)

[06:39] Team_085 possession (Score: 16-9)
FOUL! Reach-in foul on Desmond Antetokounmpo during the drive. [Team fouls: 4] No free throws, side out. (Desmond Antetokounmpo: 1 personal fouls)

[06:24] Team_085 possession (Score: 16-9)
Paul Wagner attempts a 3Pt. Contested by Cade Morant (4.1 feet, ZONE). Paul Wagner misses. Rebound secured by Anthony Durant.

[06:11] Team_010 possession (Score: 16-9)
Anthony Durant drives, picks up Paul Wagner. Help arrives from Magic Beal! Anthony Durant attempts a Layup. Contested by Magic Beal (2.1 feet, ZONE). Anthony Durant misses. Rebound secured by Paul Wagner.

[05:56] Team_085 possession (Score: 16-9)
Magic Beal attempts a 3Pt. Heavily contested by Cade Morant (0.5 feet, ZONE)! Magic Beal misses. Offensive rebound by Larry Duncan! Larry Duncan kicks it out.

[05:43] Team_085 possession (Score: 16-9)
FOUL! Shooting foul on Michael Turner. Magic Beal to the line for 2 free throws. [BONUS: 5 team fouls] (Michael Turner: 1 personal fouls)   FT 1/2: GOOD   FT 2/2: GOOD Magic Beal makes 2/2 from the line.
Score: 16-11

[05:28] Team_010 possession (Score: 16-11)
Michael Turner drives to the basket... FOUL! Offensive foul on Michael Turner! Stephen Bird drew the charge! [Team fouls: 6] (Michael Turner: 2 personal fouls) TURNOVER! (dead ball)

[05:13] Team_085 possession (Score: 16-11)
Paul Wagner drives and kicks out. Larry Duncan attempts a 3Pt. Contested by Cade Morant (4.6 feet, ZONE). Larry Duncan misses. Offensive rebound by Larry Duncan! Larry Duncan kicks it out.

[05:03] Team_085 possession (Score: 16-11)
Collin Mobley attempts a Layup. BLOCKED BY ANTHONY DURANT! Ball is loose! Rebound secured by Michael Turner.

[04:47] Team_010 possession (Score: 16-11)
Michael Turner drives and kicks out. Cade Morant attempts a 3Pt. Wide open! Magic Beal is 6.0 feet away. [MAN] Cade Morant misses. Rebound secured by Collin Mobley.

[04:34] Team_085 possession (Score: 16-11)
FOUL! Shooting foul on Desmond Antetokounmpo. Paul Wagner to the line for 3 free throws. [BONUS: 7 team fouls] (Desmond Antetokounmpo: 2 personal fouls)   FT 1/3: MISS   FT 2/3: GOOD   FT 3/3: GOOD Paul Wagner makes 2/3 from the line.
Score: 16-13

[04:20] Team_010 possession (Score: 16-13)
Anthony Durant drives to the basket... Anthony Durant throws a bad pass out of bounds! TURNOVER! (dead ball)

[04:04] Team_085 possession (Score: 16-13)
Stephen Bird attempts a Midrange. Contested by Michael Turner (3.1 feet, MAN). Stephen Bird misses. Rebound secured by Anthony Durant.

[03:50] Team_010 possession (Score: 16-13)
RJ Young attempts a 3Pt. Heavily contested by Larry Duncan (2.0 feet, MAN)! RJ Young misses. Rebound secured by Larry Duncan.

[03:40] Team_085 possession (Score: 16-13)
Larry Duncan attempts a Midrange. Contested by Desmond Antetokounmpo (3.3 feet, ZONE). LARRY DUNCAN MAKES IT! Assist: Stephen Bird
Score: 16-15

[03:28] Team_010 possession (Score: 16-15)
Anthony Durant attempts a 3Pt. Wide open! Collin Mobley is 6.6 feet away. [MAN] Anthony Durant misses. Rebound secured by Larry Duncan.

[03:14] Team_085 possession (Score: 16-15)
FOUL! Offensive foul on Collin Mobley! Anthony Durant drew the charge! [Team fouls: 4] (Collin Mobley: 1 personal fouls) TURNOVER! (dead ball)

[02:59] Team_010 possession (Score: 16-15)
Anthony Durant makes the Layup and draws the foul on Paul Wagner! And-1! Anthony Durant to the line for 1. [BONUS: 5 team fouls] (Paul Wagner: 1 personal fouls)   FT 1/1: GOOD Anthony Durant makes 1/1 from the line.
Score: 19-15

[02:40] Team_085 possession (Score: 19-15)
Stephen Bird drives, Michael Turner stays with him. Stephen Bird attempts a Layup. Heavily contested by Michael Turner (1.1 feet, MAN)! Stephen Bird misses. Offensive rebound by Larry Duncan! Larry Duncan kicks it out.

[02:25] Team_085 possession (Score: 19-15)
Magic Beal drives to the basket... Magic Beal loses control! Ball rolls out of bounds! TURNOVER! (dead ball)

[02:25] Substitution (Team_010): Cade Morant OUT → Draymond Leonard IN (stamina_rule2)

[02:25] Substitution (Team_010): Michael Turner OUT → Blake Harden IN (stamina_rule2)

[02:25] Substitution (Team_010): RJ Young OUT → Ben Gilgeous-Alexander IN (stamina_rule2)

[02:25] Substitution (Team_010): Desmond Antetokounmpo OUT → Vince Ingram IN (stamina_rule2)

[02:25] Substitution (Team_010): Anthony Durant OUT → Paolo Wade IN (stamina_rule2)

[02:25] Substitution (Team_085): Magic Beal OUT → Khris Brogdon IN (stamina_rule2)

[02:25] Substitution (Team_085): Stephen Bird OUT → Jordan Morant IN (stamina_rule2)

[02:25] Substitution (Team_085): Collin Mobley OUT → Malcolm Beal IN (stamina_rule2)

[02:11] Team_010 possession (Score: 19-15)
Paolo Wade drives to the basket... Paolo Wade loses the ball! Stripped by Paul Wagner! TURNOVER! (live ball)

[01:58] Team_085 possession (Score: 19-15)
Khris Brogdon drives and kicks out. Larry Duncan attempts a 3Pt. Contested by Draymond Leonard (4.8 feet, ZONE). LARRY DUNCAN MAKES IT! Assist: Malcolm Beal
Score: 19-18

[01:46] Team_010 possession (Score: 19-18)
Vince Ingram attempts a Midrange. Contested by Larry Duncan (2.9 feet, ZONE). Vince Ingram misses. Offensive rebound by Paolo Wade! Paolo Wade kicks it out.

[01:32] Team_010 possession (Score: 19-18)
Paolo Wade drives, Paul Wagner stays with him. Paolo Wade attempts a Dunk. Heavily contested by Paul Wagner (0.8 feet, MAN)! Paolo Wade misses. Rebound secured by Paul Wagner.

[01:19] Team_085 possession (Score: 19-18)
Jordan Morant attempts a 3Pt. Contested by Draymond Leonard (4.0 feet, ZONE). Jordan Morant misses. Rebound secured by Blake Harden.

[01:04] Team_010 possession (Score: 19-18)
Paolo Wade drives, picks up Paul Wagner. Help arrives from Jordan Morant! Paolo Wade attempts a Dunk. Contested by Jordan Morant (5.3 feet, ZONE). Paolo Wade misses. Rebound secured by Larry Duncan.

[00:48] Team_085 possession (Score: 19-18)
Larry Duncan drives and kicks out. Malcolm Beal attempts a 3Pt. Contested by Paolo Wade (4.4 feet, MAN). Malcolm Beal misses. Rebound secured by Paolo Wade.

[00:37] Team_010 possession (Score: 19-18)
Draymond Leonard attempts a 3Pt. Contested by Paul Wagner (3.4 feet, ZONE). Draymond Leonard misses. FOUL! Loose ball foul on Paul Wagner during the rebound battle. [IN THE BONUS! 6 team fouls] Paolo Wade to the line for 2 free throws. (Paul Wagner: 2 personal fouls)   FT 1/2: MISS   FT 2/2: MISS Paolo Wade makes 0/2 from the line. Rebound secured by Larry Duncan.

[00:25] Team_085 possession (Score: 19-18)
FOUL! Reach-in foul on Paolo Wade during the drive. [IN THE BONUS! 8 team fouls] Larry Duncan to the line for 2 free throws. (Paolo Wade: 1 personal fouls)   FT 1/2: GOOD   FT 2/2: GOOD Larry Duncan makes 2/2 from the line.
Score: 19-20

[00:10] Team_010 possession (Score: 19-20)
Ben Gilgeous-Alexander drives and kicks out. Paolo Wade attempts a Midrange. Contested by Malcolm Beal (2.5 feet, MAN). Paolo Wade misses. Rebound secured by Larry Duncan.

================================================================================
                              1ST QUARTER COMPLETE                              
================================================================================

1ST QUARTER SCORE: Team_010 19, Team_085 20

BOX SCORE:
================================================================================

Team_010
--------------------------------------------------------------------------------
Player                MIN  PTS  REB  AST  TO      FG   FG%      3P   3P%
--------------------------------------------------------------------------------
RJ Young               10    7    0    1   0   3/4    75.0     0/0   0.0
Cade Morant            10    5    2    1   0   2/2   100.0     0/0   0.0
Anthony Durant         10    5    2    2   0   2/4    50.0     0/0   0.0
Michael Turner         10    2    1    0   0   1/2    50.0     0/0   0.0
Desmond Antetokounmpo   10    0    4    1   0   0/0     0.0     0/0   0.0
Paolo Wade              2    0    2    0   0   0/2     0.0     0/0   0.0
Blake Harden            2    0    1    0   0   0/0     0.0     0/0   0.0
Draymond Leonard        2    0    0    0   0   0/1     0.0     0/0   0.0
Ben Gilgeous-Alexander    2    0    0    0   0   0/1     0.0     0/0   0.0

TEAM: FG: 8/16 (50.0%), 3PT: 2/5 (40.0%), REB: 13 (2 off, 11 def), AST: 5, TO: 6
TEAM FOULS: 8 [Team_085 in BONUS]


Team_085
--------------------------------------------------------------------------------
Player                MIN  PTS  REB  AST  TO      FG   FG%      3P   3P%
--------------------------------------------------------------------------------
Larry Duncan           12   13    8    0   0   5/7    71.4     0/0   0.0
Paul Wagner            12    4    2    0   0   2/4    50.0     0/0   0.0
Magic Beal             10    2    0    0   0   1/1   100.0     0/0   0.0
Collin Mobley          10    0    1    0   0   0/4     0.0     0/0   0.0
Stephen Bird           10    0    0    2   0   0/2     0.0     0/0   0.0
Malcolm Beal            2    0    0    1   0   0/0     0.0     0/0   0.0
Jordan Morant           2    0    0    0   0   0/1     0.0     0/0   0.0

TEAM: FG: 8/19 (42.1%), 3PT: 2/6 (33.3%), REB: 10 (3 off, 7 def), AST: 3, TO: 2
TEAM FOULS: 6 [Team_010 in BONUS]

================================================================================

================================================================================
                       2ND QUARTER - Team_010 vs Team_085                       
================================================================================

[12:00] Team_010 possession (Score: 19-20)
Desmond Antetokounmpo attempts a Midrange. Contested by Paul Wagner (2.2 feet, MAN). Desmond Antetokounmpo misses. Rebound secured by Larry Duncan.

[11:43] Team_085 possession (Score: 19-20)
Magic Beal attempts a 3Pt. Contested by Cade Morant (4.0 feet, ZONE). MAGIC BEAL MAKES IT! Assist: Collin Mobley
Score: 19-23

[11:30] Team_010 possession (Score: 19-23)
Michael Turner drives, Stephen Bird stays with him. Michael Turner attempts a Layup. Contested by Stephen Bird (2.3 feet, MAN). MICHAEL TURNER MAKES IT!
Score: 21-23

[11:13] Team_085 possession (Score: 21-23)
Stephen Bird attempts a Midrange. Wide open! Michael Turner is 7.2 feet away. [MAN] STEPHEN BIRD MAKES IT!
Score: 21-25

[10:59] Team_010 possession (Score: 21-25)
Anthony Durant attempts a Midrange. Contested by Larry Duncan (4.7 feet, ZONE). ANTHONY DURANT MAKES IT!
Score: 23-25

[10:45] Team_085 possession (Score: 23-25)
Magic Beal drives, Cade Morant stays with him. Magic Beal attempts a Dunk. Contested by Cade Morant (2.6 feet, MAN). MAGIC BEAL MAKES IT! Assist: Paul Wagner
Score: 23-27

[10:35] Team_010 possession (Score: 23-27)
Michael Turner attempts a Midrange. Contested by Stephen Bird (3.4 feet, MAN). Michael Turner misses. Rebound secured by Paul Wagner.

[10:19] Team_085 possession (Score: 23-27)
FOUL! Shooting foul on RJ Young. Larry Duncan to the line for 3 free throws. [Team fouls: 1] (RJ Young: 1 personal fouls)   FT 1/3: GOOD   FT 2/3: GOOD   FT 3/3: MISS Larry Duncan makes 2/3 from the line. Rebound secured by Anthony Durant.
Score: 23-29

[10:03] Team_010 possession (Score: 23-29)
Anthony Durant attempts a Layup. Contested by Collin Mobley (5.6 feet, MAN). Anthony Durant misses. Rebound secured by Paul Wagner.

[09:47] Team_085 possession (Score: 23-29)
Collin Mobley attempts a Midrange. Wide open! Desmond Antetokounmpo is 6.1 feet away. [ZONE] COLLIN MOBLEY MAKES IT!
Score: 23-31

[09:34] Team_010 possession (Score: 23-31)
RJ Young drives and kicks out. RJ Young attempts a 3Pt. Contested by Larry Duncan (3.3 feet, MAN). RJ YOUNG MAKES IT! Assist: Desmond Antetokounmpo
Score: 26-31

[09:22] Team_085 possession (Score: 26-31)
Magic Beal drives and kicks out. Magic Beal attempts a 3Pt. Contested by Cade Morant (3.9 feet, ZONE). Magic Beal misses. Offensive rebound by Paul Wagner! Paul Wagner kicks it out.

[09:13] Team_085 possession (Score: 26-31)
Larry Duncan attempts a Midrange. Wide open! RJ Young is 8.0 feet away. [MAN] LARRY DUNCAN MAKES IT!
Score: 26-33

[08:55] Team_010 possession (Score: 26-33)
Anthony Durant makes the Layup and draws the foul on Paul Wagner! And-1! Anthony Durant to the line for 1. [Team fouls: 1] (Paul Wagner: 1 personal fouls)   FT 1/1: MISS Anthony Durant makes 0/1 from the line. Rebound secured by Collin Mobley.
Score: 28-33

[08:42] Team_085 possession (Score: 28-33)
Stephen Bird makes the Dunk and draws the foul on Cade Morant! And-1! Stephen Bird to the line for 1. [Team fouls: 2] (Cade Morant: 1 personal fouls)   FT 1/1: GOOD Stephen Bird makes 1/1 from the line.
Score: 28-36

[08:28] Team_010 possession (Score: 28-36)
Desmond Antetokounmpo attempts a 3Pt. Wide open! Magic Beal is 8.6 feet away. [ZONE] Desmond Antetokounmpo misses. Rebound secured by Larry Duncan.

[08:13] Team_085 possession (Score: 28-36)
Larry Duncan drives, RJ Young stays with him. Larry Duncan attempts a Dunk. Contested by RJ Young (3.7 feet, MAN). LARRY DUNCAN MAKES IT! Assist: Collin Mobley
Score: 28-38

[08:03] Team_010 possession (Score: 28-38)
Anthony Durant makes the Layup and draws the foul on Collin Mobley! And-1! Anthony Durant to the line for 1. [Team fouls: 2] (Collin Mobley: 1 personal fouls)   FT 1/1: GOOD Anthony Durant makes 1/1 from the line.
Score: 31-38

[07:50] Team_085 possession (Score: 31-38)
Larry Duncan attempts a 3Pt. Contested by Cade Morant (5.6 feet, ZONE). LARRY DUNCAN MAKES IT! Assist: Stephen Bird
Score: 31-41

[07:34] Team_010 possession (Score: 31-41)
Desmond Antetokounmpo attempts a Layup. Heavily contested by Paul Wagner (0.5 feet, ZONE)! DESMOND ANTETOKOUNMPO MAKES IT!
Score: 33-41

[07:21] Team_085 possession (Score: 33-41)
Collin Mobley attempts a 3Pt. Heavily contested by Anthony Durant (0.5 feet, MAN)! Collin Mobley misses. Rebound secured by Anthony Durant.

[07:06] Team_010 possession (Score: 33-41)
RJ Young attempts a Midrange. Wide open! Larry Duncan is 6.8 feet away. [ZONE] RJ Young misses. Offensive rebound by Anthony Durant! Anthony Durant kicks it out.

[06:52] Team_010 possession (Score: 33-41)
Desmond Antetokounmpo drives, Paul Wagner stays with him. Desmond Antetokounmpo attempts a Layup. Wide open! Paul Wagner is 7.0 feet away. [ZONE] Desmond Antetokounmpo misses. Rebound secured by Collin Mobley.

[06:37] Team_085 possession (Score: 33-41)
Magic Beal attempts a 3Pt. Wide open! Cade Morant is 8.9 feet away. [MAN] Magic Beal misses. Rebound secured by Michael Turner.

[06:20] Team_010 possession (Score: 33-41)
Desmond Antetokounmpo attempts a Layup. Heavily contested by Paul Wagner (0.8 feet, MAN)! DESMOND ANTETOKOUNMPO MAKES IT! Assist: Cade Morant
Score: 35-41

[06:05] Team_085 possession (Score: 35-41)
Stephen Bird attempts a Layup. Contested by Michael Turner (4.1 feet, MAN). Stephen Bird misses. Rebound secured by Anthony Durant.

[05:55] Team_010 possession (Score: 35-41)
Desmond Antetokounmpo attempts a 3Pt. Contested by Paul Wagner (3.1 feet, MAN). Desmond Antetokounmpo misses. Rebound secured by Paul Wagner.

[05:41] Team_085 possession (Score: 35-41)
Stephen Bird attempts a 3Pt. Contested by Michael Turner (5.5 feet, MAN). Stephen Bird misses. Rebound secured by Cade Morant.

[05:25] Team_010 possession (Score: 35-41)
Cade Morant attempts a Layup. Heavily contested by Paul Wagner (0.5 feet, ZONE)! CADE MORANT MAKES IT! Assist: Michael Turner
Score: 37-41

[05:12] Team_085 possession (Score: 37-41)
Magic Beal makes the Dunk and draws the foul on Cade Morant! And-1! Magic Beal to the line for 1. [Team fouls: 3] (Cade Morant: 2 personal fouls)   FT 1/1: GOOD Magic Beal makes 1/1 from the line.
Score: 37-44

[04:56] Team_010 possession (Score: 37-44)
FOUL! Shooting foul on Stephen Bird. Michael Turner to the line for 3 free throws. [Team fouls: 3] (Stephen Bird: 1 personal fouls)   FT 1/3: MISS   FT 2/3: GOOD   FT 3/3: MISS Michael Turner makes 1/3 from the line. Rebound secured by Collin Mobley.
Score: 38-44

[04:45] Team_085 possession (Score: 38-44)
Paul Wagner attempts a 3Pt. Contested by Cade Morant (3.9 feet, ZONE). PAUL WAGNER MAKES IT! Assist: Collin Mobley
Score: 38-47

[04:27] Team_010 possession (Score: 38-47)
Michael Turner attempts a Midrange. Wide open! Larry Duncan is 6.0 feet away. [ZONE] MICHAEL TURNER MAKES IT! Assist: Cade Morant
Score: 40-47

[04:15] Team_085 possession (Score: 40-47)
Collin Mobley drives, picks up Anthony Durant. Help arrives from Cade Morant! Collin Mobley attempts a Dunk. Contested by Cade Morant (2.3 feet, ZONE). Collin Mobley misses. Offensive rebound by Paul Wagner! Paul Wagner kicks it out.

[04:04] Team_085 possession (Score: 40-47)
Stephen Bird attempts a 3Pt. Contested by Cade Morant (2.8 feet, ZONE). Stephen Bird misses. Offensive rebound by Larry Duncan! Larry Duncan kicks it out.

[03:47] Team_085 possession (Score: 40-47)
FOUL! Holding foul on Cade Morant. [Team fouls: 4] No free throws, side out. (Cade Morant: 3 personal fouls)

[03:32] Team_085 possession (Score: 40-47)
Collin Mobley attempts a 3Pt. Contested by Desmond Antetokounmpo (4.4 feet, ZONE). COLLIN MOBLEY MAKES IT! Assist: Stephen Bird
Score: 40-50

[03:20] Team_010 possession (Score: 40-50)
Anthony Durant attempts a Midrange. Contested by Collin Mobley (3.9 feet, MAN). Anthony Durant misses. Offensive rebound by Cade Morant! Cade Morant kicks it out.

[03:02] Team_010 possession (Score: 40-50)
RJ Young drives, Paul Wagner stays with him. RJ Young attempts a Layup. Contested by Paul Wagner (5.3 feet, ZONE). RJ YOUNG MAKES IT!
Score: 42-50

[02:48] Team_085 possession (Score: 42-50)
Paul Wagner attempts a 3Pt. Contested by Cade Morant (4.8 feet, ZONE). Paul Wagner misses. Rebound secured by Cade Morant.

[02:36] Team_010 possession (Score: 42-50)
FOUL! Holding foul on Stephen Bird. [Team fouls: 4] No free throws, side out. (Stephen Bird: 2 personal fouls)

[02:21] Team_010 possession (Score: 42-50)
Cade Morant throws a bad pass out of bounds! TURNOVER! (dead ball)

[02:21] Substitution (Team_010): Cade Morant OUT → Draymond Leonard IN (stamina_rule2)

[02:21] Substitution (Team_010): Michael Turner OUT → Blake Harden IN (stamina_rule2)

[02:21] Substitution (Team_010): RJ Young OUT → Ben Gilgeous-Alexander IN (stamina_rule2)

[02:21] Substitution (Team_010): Desmond Antetokounmpo OUT → Vince Ingram IN (stamina_rule2)

[02:21] Substitution (Team_010): Anthony Durant OUT → Paolo Wade IN (stamina_rule2)

[02:21] Substitution (Team_085): Magic Beal OUT → Khris Brogdon IN (stamina_rule2)

[02:21] Substitution (Team_085): Stephen Bird OUT → Jordan Morant IN (stamina_rule2)

[02:21] Substitution (Team_085): Larry Duncan OUT → Giannis Johnson IN (stamina_rule2)

[02:21] Substitution (Team_085): Paul Wagner OUT → Jalen Leonard IN (stamina_rule2)

[02:21] Substitution (Team_085): Collin Mobley OUT → Malcolm Beal IN (stamina_rule2)

[02:09] Team_085 possession (Score: 42-50)
Khris Brogdon attempts a 3Pt. Heavily contested by Draymond Leonard (1.6 feet, MAN)! KHRIS BROGDON MAKES IT! Assist: Giannis Johnson
Score: 42-53

[01:54] Team_010 possession (Score: 42-53)
Draymond Leonard attempts a Midrange. Wide open! Jalen Leonard is 6.2 feet away. [ZONE] Draymond Leonard misses. Rebound secured by Giannis Johnson.

[01:39] Team_085 possession (Score: 42-53)
Jalen Leonard drives to the basket... Jalen Leonard throws a bad pass! Stolen by Vince Ingram! TURNOVER! (live ball)

[01:25] Team_010 possession (Score: 42-53)
FOUL! Shooting foul on Malcolm Beal. Paolo Wade to the line for 2 free throws. [BONUS: 5 team fouls] (Malcolm Beal: 1 personal fouls)   FT 1/2: GOOD   FT 2/2: GOOD Paolo Wade makes 2/2 from the line.
Score: 44-53

[01:12] Team_085 possession (Score: 44-53)
FOUL! Holding foul on Vince Ingram. [IN THE BONUS! 5 team fouls] Jalen Leonard to the line for 2 free throws. (Vince Ingram: 1 personal fouls)   FT 1/2: GOOD   FT 2/2: GOOD Jalen Leonard makes 2/2 from the line.
Score: 44-55

[00:59] Team_010 possession (Score: 44-55)
Paolo Wade loses the ball! Stripped by Malcolm Beal! TURNOVER! (live ball)

[00:47] Team_085 possession (Score: 44-55)
Malcolm Beal attempts a Midrange. Contested by Paolo Wade (5.7 feet, MAN). Malcolm Beal misses. Offensive rebound by Jalen Leonard! Jalen Leonard kicks it out.

[00:34] Team_085 possession (Score: 44-55)
FOUL! Reach-in foul on Paolo Wade during the drive. [IN THE BONUS! 6 team fouls] Khris Brogdon to the line for 2 free throws. (Paolo Wade: 1 personal fouls)   FT 1/2: GOOD   FT 2/2: GOOD Khris Brogdon makes 2/2 from the line.
Score: 44-57

[00:18] Team_010 possession (Score: 44-57)
Blake Harden attempts a 3Pt. Heavily contested by Jordan Morant (0.5 feet, ZONE)! BLAKE HARDEN MAKES IT! Assist: Draymond Leonard
Score: 47-57

[00:07] Team_085 possession (Score: 47-57)
Malcolm Beal loses control! Ball rolls out of bounds! TURNOVER! (dead ball)

================================================================================
                              2ND QUARTER COMPLETE                              
================================================================================

2ND QUARTER SCORE: Team_010 28, Team_085 37

BOX SCORE:
================================================================================

Team_010
--------------------------------------------------------------------------------
Player                MIN  PTS  REB  AST  TO      FG   FG%      3P   3P%
--------------------------------------------------------------------------------
Anthony Durant         20    5    4    0   0   2/4    50.0     0/0   0.0
RJ Young               20    5    0    0   0   2/2   100.0     0/0   0.0
Desmond Antetokounmpo   20    4    0    1   0   2/6    33.3     0/0   0.0
Michael Turner         20    4    1    1   0   2/4    50.0     0/0   0.0
Blake Harden            5    3    0    0   0   1/1   100.0     0/0   0.0
Cade Morant            20    2    3    2   0   1/1   100.0     0/0   0.0
Paolo Wade              5    2    0    0   0   1/1   100.0     0/0   0.0
Draymond Leonard        5    0    0    1   0   0/1     0.0     0/0   0.0

TEAM: FG: 11/20 (55.0%), 3PT: 1/4 (25.0%), REB: 8 (2 off, 6 def), AST: 5, TO: 2
TEAM FOULS: 6 [Team_085 in BONUS]


Team_085
--------------------------------------------------------------------------------
Player                MIN  PTS  REB  AST  TO      FG   FG%      3P   3P%
--------------------------------------------------------------------------------
Magic Beal             20    8    0    0   0   3/4    75.0     0/0   0.0
Larry Duncan           22    7    3    0   0   3/4    75.0     0/0   0.0
Collin Mobley          20    5    3    3   0   2/3    66.7     0/0   0.0
Stephen Bird           20    5    0    2   0   2/4    50.0     0/0   0.0
Khris Brogdon           5    5    0    0   0   2/2   100.0     0/0   0.0
Paul Wagner            22    3    5    1   0   1/2    50.0     0/0   0.0
Jalen Leonard           2    2    1    0   0   1/1   100.0     0/0   0.0
Giannis Johnson         2    0    1    1   0   0/0     0.0     0/0   0.0

TEAM: FG: 14/20 (70.0%), 3PT: 5/10 (50.0%), REB: 13 (4 off, 9 def), AST: 7, TO: 2
TEAM FOULS: 5 [Team_010 in BONUS]

================================================================================

================================================================================
                       3RD QUARTER - Team_010 vs Team_085                       
================================================================================

[12:00] Team_010 possession (Score: 47-57)
Desmond Antetokounmpo drives, Paul Wagner stays with him. Desmond Antetokounmpo attempts a Dunk. Heavily contested by Paul Wagner (0.5 feet, MAN)! DESMOND ANTETOKOUNMPO MAKES IT! Assist: Anthony Durant
Score: 49-57

[11:47] Team_085 possession (Score: 49-57)
Collin Mobley attempts a Layup. Wide open! Desmond Antetokounmpo is 7.0 feet away. [ZONE] COLLIN MOBLEY MAKES IT!
Score: 49-59

[11:36] Team_010 possession (Score: 49-59)
RJ Young drives, Paul Wagner stays with him. RJ Young attempts a Layup. Contested by Paul Wagner (2.4 feet, ZONE). RJ YOUNG MAKES IT!
Score: 51-59

[11:20] Team_085 possession (Score: 51-59)
Larry Duncan drives and kicks out. Collin Mobley makes the Midrange and draws the foul on Desmond Antetokounmpo! And-1! Collin Mobley to the line for 1. [Team fouls: 1] (Desmond Antetokounmpo: 1 personal fouls)   FT 1/1: GOOD Collin Mobley makes 1/1 from the line.
Score: 51-62

[11:07] Team_010 possession (Score: 51-62)
RJ Young attempts a 3Pt. Contested by Magic Beal (2.1 feet, ZONE). RJ Young misses. Rebound secured by Larry Duncan.

[10:54] Team_085 possession (Score: 51-62)
Stephen Bird makes the Layup and draws the foul on Michael Turner! And-1! Stephen Bird to the line for 1. [Team fouls: 2] (Michael Turner: 1 personal fouls)   FT 1/1: GOOD Stephen Bird makes 1/1 from the line.
Score: 51-65

[10:37] Team_010 possession (Score: 51-65)
Anthony Durant attempts a Midrange. Heavily contested by Larry Duncan (0.8 feet, ZONE)! Anthony Durant misses. Rebound secured by Larry Duncan.

[10:23] Team_085 possession (Score: 51-65)
Stephen Bird drives and kicks out. Magic Beal attempts a 3Pt. Wide open! Cade Morant is 7.0 feet away. [ZONE] MAGIC BEAL MAKES IT! Assist: Collin Mobley
Score: 51-68

[10:08] Team_010 possession (Score: 51-68)
RJ Young attempts a 3Pt. Contested by Paul Wagner (5.5 feet, ZONE). RJ Young misses. Rebound secured by Paul Wagner.

[09:55] Team_085 possession (Score: 51-68)
Stephen Bird attempts a 3Pt. Contested by Michael Turner (5.9 feet, MAN). Stephen Bird misses. Rebound secured by Desmond Antetokounmpo.

[09:44] Team_010 possession (Score: 51-68)
Desmond Antetokounmpo throws a bad pass out of bounds! TURNOVER! (dead ball)

[09:29] Team_085 possession (Score: 51-68)
Stephen Bird attempts a Layup. BLOCKED BY MICHAEL TURNER! Ball is loose! Rebound secured by Anthony Durant.

[09:13] Team_010 possession (Score: 51-68)
Michael Turner loses the ball! Stripped by Stephen Bird! TURNOVER! (live ball)

[08:57] Team_085 possession (Score: 51-68)
Paul Wagner attempts a 3Pt. Contested by Desmond Antetokounmpo (5.3 feet, MAN). Paul Wagner misses. Rebound secured by Anthony Durant.

[08:46] Team_010 possession (Score: 51-68)
Desmond Antetokounmpo drives to the basket... Desmond Antetokounmpo throws a bad pass out of bounds! TURNOVER! (dead ball)

[08:29] Team_085 possession (Score: 51-68)
Stephen Bird throws a bad pass out of bounds! TURNOVER! (dead ball)

[08:16] Team_010 possession (Score: 51-68)
Michael Turner attempts a 3Pt. Contested by Stephen Bird (5.0 feet, MAN). Michael Turner misses. Rebound secured by Larry Duncan.

[08:04] Team_085 possession (Score: 51-68)
Stephen Bird attempts a 3Pt. Contested by Michael Turner (4.1 feet, MAN). Stephen Bird misses. Rebound secured by Anthony Durant.

[07:47] Team_010 possession (Score: 51-68)
RJ Young drives, picks up Larry Duncan. Help arrives from Magic Beal! RJ Young attempts a Dunk. Heavily contested by Magic Beal (0.5 feet, MAN)! RJ YOUNG MAKES IT! Assist: Cade Morant
Score: 53-68

[07:32] Team_085 possession (Score: 53-68)
Magic Beal drives to the basket... Magic Beal loses control! Ball rolls out of bounds! TURNOVER! (dead ball)

[07:16] Team_010 possession (Score: 53-68)
FOUL! Reach-in foul on Collin Mobley during the drive. [Team fouls: 1] No free throws, side out. (Collin Mobley: 1 personal fouls)

[07:02] Team_010 possession (Score: 53-68)
Michael Turner drives to the basket... Michael Turner loses control! Ball rolls out of bounds! TURNOVER! (dead ball)

[06:49] Team_085 possession (Score: 53-68)
Magic Beal attempts a 3Pt. Heavily contested by Cade Morant (1.0 feet, ZONE)! Magic Beal misses. Offensive rebound by Larry Duncan! Larry Duncan kicks it out.

[06:32] Team_085 possession (Score: 53-68)
Larry Duncan attempts a 3Pt. Wide open! RJ Young is 6.6 feet away. [MAN] Larry Duncan misses. Rebound secured by Desmond Antetokounmpo.

[06:17] Team_010 possession (Score: 53-68)
RJ Young drives, Paul Wagner stays with him. RJ Young attempts a Layup. Heavily contested by Paul Wagner (1.4 feet, ZONE)! RJ Young misses. Rebound secured by Larry Duncan.

[06:05] Team_085 possession (Score: 53-68)
Larry Duncan attempts a 3Pt. Wide open! RJ Young is 6.3 feet away. [MAN] LARRY DUNCAN MAKES IT! Assist: Stephen Bird
Score: 53-71

[05:45] Team_010 possession (Score: 53-71)
FOUL! Offensive foul on Anthony Durant! Collin Mobley drew the charge! [Team fouls: 3] (Anthony Durant: 1 personal fouls) TURNOVER! (dead ball)

[05:30] Team_085 possession (Score: 53-71)
Collin Mobley attempts a Midrange. Heavily contested by Anthony Durant (0.5 feet, MAN)! Collin Mobley misses. Rebound secured by Michael Turner.

[05:15] Team_010 possession (Score: 53-71)
Cade Morant commits a violation (traveling/carry)! TURNOVER! (dead ball)

[05:02] Team_085 possession (Score: 53-71)
Larry Duncan drives to the basket... Larry Duncan throws a bad pass! Stolen by RJ Young! TURNOVER! (live ball)

[04:46] Team_010 possession (Score: 53-71)
Anthony Durant commits a violation (traveling/carry)! TURNOVER! (dead ball)

[04:29] Team_085 possession (Score: 53-71)
Collin Mobley drives, Anthony Durant stays with him. Collin Mobley attempts a Dunk. Heavily contested by Anthony Durant (0.8 feet, MAN)! COLLIN MOBLEY MAKES IT!
Score: 53-73

[04:16] Team_010 possession (Score: 53-73)
Anthony Durant attempts a Midrange. Heavily contested by Collin Mobley (1.3 feet, MAN)! ANTHONY DURANT MAKES IT! Assist: Desmond Antetokounmpo
Score: 55-73

[03:57] Team_085 possession (Score: 55-73)
Larry Duncan drives, picks up RJ Young. Help arrives from Cade Morant! Larry Duncan attempts a Dunk. Wide open! Cade Morant is 9.7 feet away. [MAN] LARRY DUNCAN MAKES IT! Assist: Collin Mobley
Score: 55-75

[03:41] Team_010 possession (Score: 55-75)
RJ Young attempts a 3Pt. Wide open! Larry Duncan is 7.3 feet away. [MAN] RJ YOUNG MAKES IT! Assist: Michael Turner
Score: 58-75

[03:25] Team_085 possession (Score: 58-75)
Larry Duncan loses control! Ball rolls out of bounds! TURNOVER! (dead ball)

[03:06] Team_010 possession (Score: 58-75)
Michael Turner drives to the basket... Michael Turner loses the ball! Stripped by Stephen Bird! TURNOVER! (live ball)

[02:50] Team_085 possession (Score: 58-75)
Magic Beal drives to the basket... FOUL! Offensive foul on Magic Beal! Cade Morant drew the charge! [Team fouls: 2] (Magic Beal: 1 personal fouls) TURNOVER! (dead ball)

[02:34] Team_010 possession (Score: 58-75)
Michael Turner attempts a 3Pt. Contested by Stephen Bird (5.2 feet, MAN). MICHAEL TURNER MAKES IT! Assist: Anthony Durant
Score: 61-75

[02:17] Team_085 possession (Score: 61-75)
Magic Beal attempts a Midrange. Contested by Michael Turner (4.1 feet, ZONE). Magic Beal misses. Rebound secured by Cade Morant.

[02:04] Team_010 possession (Score: 61-75)
Desmond Antetokounmpo drives and kicks out. Cade Morant attempts a 3Pt. Contested by Magic Beal (4.1 feet, MAN). Cade Morant misses. Rebound secured by Collin Mobley.

[01:52] Team_085 possession (Score: 61-75)
Collin Mobley drives and kicks out. Stephen Bird attempts a Midrange. Wide open! Michael Turner is 6.6 feet away. [MAN] STEPHEN BIRD MAKES IT!
Score: 61-77

[01:38] Team_010 possession (Score: 61-77)
Desmond Antetokounmpo drives, picks up Paul Wagner. Help arrives from Magic Beal! Desmond Antetokounmpo attempts a Layup. Heavily contested by Magic Beal (0.5 feet, ZONE)! Desmond Antetokounmpo misses. Rebound secured by Larry Duncan.

[01:20] Team_085 possession (Score: 61-77)
Larry Duncan attempts a 3Pt. Wide open! RJ Young is 10.0 feet away. [MAN] Larry Duncan misses. Rebound secured by Anthony Durant.

[01:06] Team_010 possession (Score: 61-77)
Anthony Durant attempts a Layup. Heavily contested by Paul Wagner (1.1 feet, ZONE)! Anthony Durant misses. Rebound secured by Collin Mobley.

[00:50] Team_085 possession (Score: 61-77)
Paul Wagner attempts a Midrange. Contested by Cade Morant (2.9 feet, ZONE). Paul Wagner misses. Rebound secured by Anthony Durant.

[00:38] Team_010 possession (Score: 61-77)
Michael Turner attempts a 3Pt. Contested by Magic Beal (4.1 feet, ZONE). Michael Turner misses. Rebound secured by Paul Wagner.

[00:26] Team_085 possession (Score: 61-77)
Magic Beal attempts a Midrange. Contested by Michael Turner (4.9 feet, ZONE). MAGIC BEAL MAKES IT! Assist: Paul Wagner
Score: 61-79

[00:10] Team_010 possession (Score: 61-79)
Cade Morant loses control! Ball rolls out of bounds! TURNOVER! (dead ball)

[00:10] Substitution (Team_010): Cade Morant OUT → Draymond Leonard IN (stamina_rule2)

[00:10] Substitution (Team_010): Michael Turner OUT → Blake Harden IN (stamina_rule2)

[00:10] Substitution (Team_010): RJ Young OUT → Ben Gilgeous-Alexander IN (stamina_rule2)

[00:10] Substitution (Team_010): Desmond Antetokounmpo OUT → Vince Ingram IN (stamina_rule2)

[00:10] Substitution (Team_010): Anthony Durant OUT → Paolo Wade IN (stamina_rule2)

[00:10] Substitution (Team_085): Magic Beal OUT → Khris Brogdon IN (stamina_rule2)

[00:10] Substitution (Team_085): Stephen Bird OUT → Jordan Morant IN (stamina_rule2)

[00:10] Substitution (Team_085): Larry Duncan OUT → Giannis Johnson IN (stamina_rule2)

[00:10] Substitution (Team_085): Paul Wagner OUT → Jalen Leonard IN (stamina_rule2)

[00:10] Substitution (Team_085): Collin Mobley OUT → Malcolm Beal IN (stamina_rule2)

================================================================================
                              3RD QUARTER COMPLETE                              
================================================================================

3RD QUARTER SCORE: Team_010 14, Team_085 22

BOX SCORE:
================================================================================

Team_010
--------------------------------------------------------------------------------
Player                MIN  PTS  REB  AST  TO      FG   FG%      3P   3P%
--------------------------------------------------------------------------------
RJ Young               32    7    0    0   0   3/6    50.0     0/0   0.0
Michael Turner         32    3    1    1   0   1/3    33.3     0/0   0.0
Desmond Antetokounmpo   32    2    2    1   0   1/3    33.3     0/0   0.0
Anthony Durant         32    2    5    2   0   1/3    33.3     0/0   0.0
Cade Morant            32    0    1    1   0   0/0     0.0     0/0   0.0

TEAM: FG: 6/15 (40.0%), 3PT: 2/6 (33.3%), REB: 9 (0 off, 9 def), AST: 5, TO: 9
TEAM FOULS: 3


Team_085
--------------------------------------------------------------------------------
Player                MIN  PTS  REB  AST  TO      FG   FG%      3P   3P%
--------------------------------------------------------------------------------
Collin Mobley          32    7    2    2   0   3/4    75.0     0/0   0.0
Larry Duncan           34    5    6    0   0   2/4    50.0     0/0   0.0
Stephen Bird           32    5    0    1   0   2/5    40.0     0/0   0.0
Magic Beal             32    5    0    0   0   2/3    66.7     0/0   0.0
Paul Wagner            34    0    2    1   0   0/2     0.0     0/0   0.0

TEAM: FG: 9/18 (50.0%), 3PT: 1/6 (16.7%), REB: 10 (1 off, 9 def), AST: 4, TO: 5
TEAM FOULS: 2

================================================================================

================================================================================
                       4TH QUARTER - Team_010 vs Team_085                       
================================================================================

[12:00] Substitution (Team_010): Cade Morant OUT (stamina: 69) → Draymond Leonard IN (comeback_detected)

[12:00] Substitution (Team_085): Magic Beal OUT (stamina: 70) → Khris Brogdon IN (comeback_detected)

[12:00] Team_010 possession (Score: 61-79)
Michael Turner attempts a 3Pt. Wide open! Stephen Bird is 7.0 feet away. [MAN] Michael Turner misses. Rebound secured by Collin Mobley.

[11:49] Team_085 possession (Score: 61-79)
Collin Mobley attempts a Midrange. Contested by Anthony Durant (2.4 feet, MAN). COLLIN MOBLEY MAKES IT! Assist: Stephen Bird
Score: 61-81

[11:33] Team_010 possession (Score: 61-81)
RJ Young attempts a 3Pt. Contested by Larry Duncan (3.7 feet, MAN). RJ YOUNG MAKES IT! Assist: Michael Turner
Score: 64-81

[11:21] Team_085 possession (Score: 64-81)
Collin Mobley drives and kicks out. Khris Brogdon attempts a 3Pt. Contested by Draymond Leonard (3.9 feet, MAN). Khris Brogdon misses. Rebound secured by Anthony Durant.

[11:08] Team_010 possession (Score: 64-81)
Desmond Antetokounmpo drives and kicks out. Anthony Durant attempts a 3Pt. Contested by Paul Wagner (2.9 feet, ZONE). Anthony Durant misses. Rebound secured by Collin Mobley.

[10:54] Team_085 possession (Score: 64-81)
Stephen Bird attempts a Midrange. Wide open! RJ Young is 6.3 feet away. [ZONE] Stephen Bird misses. Rebound secured by Michael Turner.

[10:41] Team_010 possession (Score: 64-81)
Anthony Durant drives and kicks out. Draymond Leonard attempts a 3Pt. Wide open! Khris Brogdon is 7.2 feet away. [MAN] Draymond Leonard misses. Rebound secured by Collin Mobley.

[10:27] Team_085 possession (Score: 64-81)
FOUL! Reach-in foul on Anthony Durant during the drive. [Team fouls: 1] No free throws, side out. (Anthony Durant: 1 personal fouls)

[10:15] Team_085 possession (Score: 64-81)
Stephen Bird attempts a Midrange. Heavily contested by Michael Turner (1.5 feet, MAN)! Stephen Bird misses. Rebound secured by Michael Turner.

[10:02] Team_010 possession (Score: 64-81)
Draymond Leonard attempts a 3Pt. Wide open! Khris Brogdon is 8.7 feet away. [MAN] DRAYMOND LEONARD MAKES IT! Assist: RJ Young
Score: 67-81

[09:46] Team_085 possession (Score: 67-81)
Paul Wagner drives, Desmond Antetokounmpo stays with him. Paul Wagner attempts a Dunk. Heavily contested by Desmond Antetokounmpo (0.5 feet, MAN)! Paul Wagner misses. Rebound secured by Michael Turner.

[09:32] Team_010 possession (Score: 67-81)
Draymond Leonard attempts a Midrange. Wide open! Khris Brogdon is 9.5 feet away. [MAN] DRAYMOND LEONARD MAKES IT! Assist: Desmond Antetokounmpo
Score: 69-81

[09:21] Team_085 possession (Score: 69-81)
Collin Mobley drives and kicks out. Collin Mobley attempts a 3Pt. Contested by Anthony Durant (5.9 feet, MAN). Collin Mobley misses. Rebound secured by Draymond Leonard.

[09:06] Team_010 possession (Score: 69-81)
Desmond Antetokounmpo drives to the basket... Desmond Antetokounmpo throws a bad pass out of bounds! TURNOVER! (dead ball)

[09:06] Substitution (Team_010): Michael Turner OUT → Blake Harden IN (stamina_rule2)

[09:06] Substitution (Team_010): RJ Young OUT → Ben Gilgeous-Alexander IN (stamina_rule2)

[09:06] Substitution (Team_010): Desmond Antetokounmpo OUT → Vince Ingram IN (stamina_rule2)

[09:06] Substitution (Team_010): Anthony Durant OUT → Paolo Wade IN (stamina_rule2)

[09:06] Substitution (Team_085): Stephen Bird OUT → Jordan Morant IN (stamina_rule2)

[09:06] Substitution (Team_085): Larry Duncan OUT → Giannis Johnson IN (stamina_rule2)

[09:06] Substitution (Team_085): Paul Wagner OUT → Jalen Leonard IN (stamina_rule2)

[09:06] Substitution (Team_085): Collin Mobley OUT → Malcolm Beal IN (stamina_rule2)

[08:55] Team_085 possession (Score: 69-81)
FOUL! Shooting foul on Paolo Wade. Khris Brogdon to the line for 2 free throws. [Team fouls: 2] (Paolo Wade: 1 personal fouls)   FT 1/2: MISS   FT 2/2: GOOD Khris Brogdon makes 1/2 from the line.
Score: 69-82

[08:41] Team_010 possession (Score: 69-82)
Paolo Wade drives, Malcolm Beal stays with him. Paolo Wade attempts a Dunk. Heavily contested by Malcolm Beal (1.6 feet, MAN)! PAOLO WADE MAKES IT! Assist: Draymond Leonard
Score: 71-82

[08:23] Team_085 possession (Score: 71-82)
FOUL! Shooting foul on Vince Ingram. Jalen Leonard to the line for 2 free throws. [Team fouls: 3] (Vince Ingram: 1 personal fouls)   FT 1/2: GOOD   FT 2/2: GOOD Jalen Leonard makes 2/2 from the line.
Score: 71-84

[08:09] Team_010 possession (Score: 71-84)
Vince Ingram drives, Malcolm Beal stays with him. Vince Ingram attempts a Layup. Contested by Malcolm Beal (5.5 feet, ZONE). Vince Ingram misses. Rebound secured by Malcolm Beal.

[07:54] Team_085 possession (Score: 71-84)
Jordan Morant attempts a Layup. Heavily contested by Blake Harden (0.5 feet, MAN)! Jordan Morant misses. Rebound secured by Paolo Wade.

[07:41] Team_010 possession (Score: 71-84)
Draymond Leonard attempts a 3Pt. Wide open! Khris Brogdon is 6.8 feet away. [MAN] Draymond Leonard misses. Rebound secured by Malcolm Beal.

[07:26] Team_085 possession (Score: 71-84)
FOUL! Shooting foul on Paolo Wade. Malcolm Beal to the line for 2 free throws. [Team fouls: 4] (Paolo Wade: 2 personal fouls)   FT 1/2: GOOD   FT 2/2: GOOD Malcolm Beal makes 2/2 from the line.
Score: 71-86

[07:16] Team_010 possession (Score: 71-86)
Vince Ingram attempts a Midrange. Wide open! Giannis Johnson is 6.8 feet away. [ZONE] VINCE INGRAM MAKES IT!
Score: 73-86

[06:58] Team_085 possession (Score: 73-86)
Jordan Morant attempts a 3Pt. Wide open! Draymond Leonard is 6.5 feet away. [ZONE] JORDAN MORANT MAKES IT! Assist: Jalen Leonard
Score: 73-89

[06:40] Team_010 possession (Score: 73-89)
Ben Gilgeous-Alexander attempts a 3Pt. Contested by Jordan Morant (4.4 feet, ZONE). Ben Gilgeous-Alexander misses. Rebound secured by Giannis Johnson.

[06:25] Team_085 possession (Score: 73-89)
Giannis Johnson attempts a 3Pt. Contested by Draymond Leonard (5.0 feet, ZONE). Giannis Johnson misses. Offensive rebound by Jalen Leonard! Jalen Leonard kicks it out.

[06:11] Team_085 possession (Score: 73-89)
Jalen Leonard drives, picks up Paolo Wade. Help arrives from Blake Harden! Jalen Leonard attempts a Layup. Contested by Blake Harden (2.8 feet, ZONE). JALEN LEONARD MAKES IT! Assist: Giannis Johnson
Score: 73-91

[05:55] Team_010 possession (Score: 73-91)
Draymond Leonard attempts a 3Pt. Contested by Khris Brogdon (4.9 feet, MAN). DRAYMOND LEONARD MAKES IT! Assist: Ben Gilgeous-Alexander
Score: 76-91

[05:40] Team_085 possession (Score: 76-91)
Giannis Johnson attempts a 3Pt. Contested by Ben Gilgeous-Alexander (3.9 feet, MAN). Giannis Johnson misses. Rebound secured by Ben Gilgeous-Alexander.

[05:27] Team_010 possession (Score: 76-91)
Ben Gilgeous-Alexander drives, picks up Malcolm Beal. Help arrives from Jordan Morant! Ben Gilgeous-Alexander attempts a Layup. Contested by Jordan Morant (2.9 feet, ZONE). BEN GILGEOUS-ALEXANDER MAKES IT! Assist: Vince Ingram
Score: 78-91

[05:12] Team_085 possession (Score: 78-91)
Jalen Leonard drives and kicks out. Jordan Morant attempts a 3Pt. Contested by Draymond Leonard (3.4 feet, ZONE). Jordan Morant misses. Rebound secured by Paolo Wade.

[04:58] Team_010 possession (Score: 78-91)
Paolo Wade attempts a 3Pt. Contested by Malcolm Beal (3.1 feet, MAN). PAOLO WADE MAKES IT! Assist: Draymond Leonard
Score: 81-91

[04:42] Team_085 possession (Score: 81-91)
Malcolm Beal attempts a Midrange. Wide open! Paolo Wade is 7.4 feet away. [MAN] MALCOLM BEAL MAKES IT! Assist: Jalen Leonard
Score: 81-93

[04:25] Team_010 possession (Score: 81-93)
Paolo Wade makes the Dunk and draws the foul on Jordan Morant! And-1! Paolo Wade to the line for 1. [Team fouls: 1] (Jordan Morant: 1 personal fouls)   FT 1/1: GOOD Paolo Wade makes 1/1 from the line.
Score: 84-93

[04:07] Team_085 possession (Score: 84-93)
Malcolm Beal drives, picks up Paolo Wade. Help arrives from Blake Harden! Malcolm Beal attempts a Layup. Contested by Blake Harden (3.4 feet, MAN). Malcolm Beal misses. Rebound secured by Blake Harden.

[03:51] Team_010 possession (Score: 84-93)
Draymond Leonard drives and kicks out. Vince Ingram attempts a 3Pt. Wide open! Jalen Leonard is 6.1 feet away. [MAN] VINCE INGRAM MAKES IT! Assist: Draymond Leonard
Score: 87-93

[03:36] Team_085 possession (Score: 87-93)
Malcolm Beal attempts a 3Pt. Wide open! Paolo Wade is 7.5 feet away. [MAN] MALCOLM BEAL MAKES IT! Assist: Khris Brogdon
Score: 87-96

[03:20] Team_010 possession (Score: 87-96)
Paolo Wade attempts a Layup. BLOCKED BY MALCOLM BEAL! Ball deflects out of bounds off Paolo Wade.

[03:08] Team_085 possession (Score: 87-96)
Khris Brogdon attempts a Layup. Wide open! Paolo Wade is 7.3 feet away. [ZONE] KHRIS BROGDON MAKES IT! Assist: Jalen Leonard
Score: 87-98

[02:55] Team_010 possession (Score: 87-98)
Blake Harden attempts a 3Pt. Contested by Jordan Morant (5.0 feet, ZONE). BLAKE HARDEN MAKES IT! Assist: Vince Ingram
Score: 90-98

[02:41] Team_085 possession (Score: 90-98)
Khris Brogdon attempts a 3Pt. Contested by Draymond Leonard (3.5 feet, MAN). KHRIS BROGDON MAKES IT! Assist: Malcolm Beal
Score: 90-101

[02:26] Team_010 possession (Score: 90-101)
Ben Gilgeous-Alexander attempts a Midrange. Contested by Jalen Leonard (4.9 feet, ZONE). BEN GILGEOUS-ALEXANDER MAKES IT!
Score: 92-101

[02:10] Team_085 possession (Score: 92-101)
Jalen Leonard drives, Vince Ingram stays with him. Jalen Leonard attempts a Dunk. Wide open! Vince Ingram is 7.6 feet away. [MAN] JALEN LEONARD MAKES IT! Assist: Khris Brogdon
Score: 92-103

[01:55] Team_010 possession (Score: 92-103)
Ben Gilgeous-Alexander attempts a Midrange. Wide open! Jalen Leonard is 7.0 feet away. [ZONE] BEN GILGEOUS-ALEXANDER MAKES IT! Assist: Paolo Wade
Score: 94-103

[01:41] Team_085 possession (Score: 94-103)
Jordan Morant attempts a 3Pt. Contested by Draymond Leonard (5.3 feet, ZONE). JORDAN MORANT MAKES IT! Assist: Khris Brogdon
Score: 94-106

[01:25] Team_010 possession (Score: 94-106)
Ben Gilgeous-Alexander attempts a Midrange. Contested by Jalen Leonard (3.3 feet, ZONE). Ben Gilgeous-Alexander misses. FOUL! Loose ball foul on Malcolm Beal during the rebound battle. [Team fouls: 2] No free throws, side out. (Malcolm Beal: 1 personal fouls)

[01:10] Team_010 possession (Score: 94-106)
Paolo Wade drives and kicks out. Draymond Leonard attempts a Midrange. Contested by Jordan Morant (4.8 feet, ZONE). Draymond Leonard misses. Rebound secured by Giannis Johnson.

[01:01] Team_085 possession (Score: 94-106)
Giannis Johnson attempts a 3Pt. Contested by Ben Gilgeous-Alexander (4.8 feet, MAN). Giannis Johnson misses. Rebound secured by Ben Gilgeous-Alexander.

[00:47] Team_010 possession (Score: 94-106)
FOUL! Holding foul on Giannis Johnson. [Team fouls: 3] No free throws, side out. (Giannis Johnson: 1 personal fouls)

[00:28] Team_010 possession (Score: 94-106)
Ben Gilgeous-Alexander drives and kicks out. Draymond Leonard attempts a Midrange. Wide open! Giannis Johnson is 6.5 feet away. [ZONE] Draymond Leonard misses. Rebound secured by Malcolm Beal.

[00:15] Team_085 possession (Score: 94-106)
Jordan Morant drives and kicks out. Giannis Johnson attempts a 3Pt. Wide open! Ben Gilgeous-Alexander is 7.7 feet away. [MAN] GIANNIS JOHNSON MAKES IT!
Score: 94-109

================================================================================
                              4TH QUARTER COMPLETE                              
================================================================================

4TH QUARTER SCORE: Team_010 33, Team_085 30

BOX SCORE:
================================================================================

Team_010
--------------------------------------------------------------------------------
Player                MIN  PTS  REB  AST  TO      FG   FG%      3P   3P%
--------------------------------------------------------------------------------
Draymond Leonard       17    8    1    3   0   3/4    75.0     0/0   0.0
Paolo Wade             14    8    2    1   0   3/5    60.0     0/0   0.0
Ben Gilgeous-Alexander   14    6    2    1   0   3/5    60.0     0/0   0.0
Vince Ingram           14    5    0    2   0   2/3    66.7     0/0   0.0
RJ Young               35    3    0    1   0   1/1   100.0     0/0   0.0
Blake Harden           14    3    2    0   0   1/1   100.0     0/0   0.0
Michael Turner         35    0    3    1   0   0/1     0.0     0/0   0.0
Anthony Durant         35    0    1    0   0   0/1     0.0     0/0   0.0
Desmond Antetokounmpo   35    0    0    1   0   0/1     0.0     0/0   0.0

TEAM: FG: 13/22 (59.1%), 3PT: 5/8 (62.5%), REB: 11 (1 off, 10 def), AST: 10, TO: 1
TEAM FOULS: 4


Team_085
--------------------------------------------------------------------------------
Player                MIN  PTS  REB  AST  TO      FG   FG%      3P   3P%
--------------------------------------------------------------------------------
Malcolm Beal           14    7    3    1   0   3/4    75.0     0/0   0.0
Khris Brogdon          17    6    0    3   0   3/3   100.0     0/0   0.0
Jalen Leonard          11    6    1    3   0   3/4    75.0     0/0   0.0
Jordan Morant          14    6    0    0   0   2/3    66.7     0/0   0.0
Giannis Johnson        11    3    2    1   0   1/3    33.3     0/0   0.0
Collin Mobley          35    2    3    0   0   1/3    33.3     0/0   0.0
Stephen Bird           35    0    0    1   0   0/2     0.0     0/0   0.0
Paul Wagner            37    0    0    0   0   0/1     0.0     0/0   0.0

TEAM: FG: 13/23 (56.5%), 3PT: 4/6 (66.7%), REB: 9 (1 off, 8 def), AST: 9, TO: 0
TEAM FOULS: 3

================================================================================

================================================================================
                               FULL GAME COMPLETE                               
================================================================================

FINAL SCORE: Team_010 94, Team_085 109

SCORING BY QUARTER:
--------------------------------------------------------------------------------
Team                     Q1     Q2     Q3     Q4    FINAL
--------------------------------------------------------------------------------
Team_010                 19     28     14     33       94
Team_085                 20     37     22     30      109
--------------------------------------------------------------------------------

FULL GAME BOX SCORE:
================================================================================

Team_010
--------------------------------------------------------------------------------
Player                MIN  PTS  REB  AST  TO      FG   FG%      3P   3P%      FT STL BLK
--------------------------------------------------------------------------------
Michael Turner         35    9    6    3   4   4/10   40.0   1/5    20.0   1/3     0   1
RJ Young               35   22    0    2   0   9/13   69.2   3/6    50.0   0/0     1   0
Desmond Antetokounmpo   35    6    6    4   3   3/10   30.0   0/2     0.0   0/0     0   0
Anthony Durant         35   12   12    4   5   5/12   41.7   0/1     0.0   2/3     0   1
Cade Morant            32    7    6    4   4   3/3   100.0   1/1   100.0   0/0     0   0
Draymond Leonard       17    8    1    4   0   4/7    57.1   2/4    50.0   0/0     0   0
Blake Harden           14    6    3    0   0   2/2   100.0   2/2   100.0   0/0     0   0
Ben Gilgeous-Alexander   14    6    2    1   1   3/6    50.0   0/1     0.0   0/0     0   0
Vince Ingram           14    5    0    2   0   1/2    50.0   0/0     0.0   0/0     1   0
Paolo Wade             14   10    4    1   1   4/8    50.0   1/1   100.0   3/5     0   0

TEAM: FG: 38/73 (52.1%), 3PT: 10/23 (43.5%), REB: 41 (5 off, 36 def), AST: 25, TO: 18


Team_085
--------------------------------------------------------------------------------
Player                MIN  PTS  REB  AST  TO      FG   FG%      3P   3P%      FT STL BLK
--------------------------------------------------------------------------------
Larry Duncan           37   25   17    0   3  10/15   66.7   3/6    50.0   5/6     0   0
Paul Wagner            37    7    9    2   0   3/9    33.3   2/6    33.3   2/3     1   0
Stephen Bird           35   10    0    6   2   4/13   30.8   0/4     0.0   3/5     2   0
Collin Mobley          35   14    9    5   2   6/14   42.9   1/2    50.0   1/1     1   0
Magic Beal             32   15    0    0   0   5/7    71.4   1/2    50.0   3/3     0   0
Khris Brogdon          17   11    0    3   0   6/6   100.0   2/2   100.0   3/4     0   0
Jordan Morant          14    6    0    0   0   3/5    60.0   2/3    66.7   0/0     0   0
Malcolm Beal           14    7    3    2   1   3/4    75.0   1/1   100.0   2/2     1   1
Giannis Johnson        11    3    3    2   0   0/2     0.0   0/2     0.0   0/0     0   0
Jalen Leonard          11    8    2    3   1   3/4    75.0   0/0     0.0   4/4     0   0

TEAM: FG: 44/80 (55.0%), 3PT: 12/28 (42.9%), REB: 42 (9 off, 33 def), AST: 23, TO: 9

================================================================================
