================================================================================
                        FULL GAME - Team_005 vs Team_031                        
================================================================================

================================================================================
                       1ST QUARTER - Team_005 vs Team_031                       
================================================================================

[12:00] Team_005 possession (Score: 0-0)
Brandon George attempts a 3Pt. Contested by Shai Durant (5.2 feet, MAN). Brandon George misses. Rebound secured by Luka Sabonis.

[11:45] Team_031 possession (Score: 0-0)
Immanuel James attempts a 3Pt. Contested by Cade Markkanen (5.8 feet, MAN). Immanuel James misses. Rebound secured by Derrick Allen.

[11:33] Team_005 possession (Score: 0-0)
Cade Markkanen attempts a 3Pt. Contested by Luka Sabonis (4.2 feet, MAN). Cade Markkanen misses. FOUL! Loose ball foul on Luka Sabonis during the rebound battle. [Team fouls: 1] No free throws, side out. (Luka Sabonis: 1 personal fouls)

[11:15] Team_005 possession (Score: 0-0)
Anthony Rozier attempts a 3Pt. Contested by Gary Morant (5.0 feet, MAN). Anthony Rozier misses. Rebound secured by Gary Morant.

[11:06] Team_031 possession (Score: 0-0)
FOUL! Shooting foul on Cade Markkanen. Gary Morant to the line for 2 free throws. [Team fouls: 1] (Cade Markkanen: 1 personal fouls)   FT 1/2: MISS   FT 2/2: GOOD Gary Morant makes 1/2 from the line.
Score: 0-1

[10:48] Team_005 possession (Score: 0-1)
Cade Markkanen attempts a 3Pt. Contested by Shai Durant (3.6 feet, ZONE). CADE MARKKANEN MAKES IT! Assist: Derrick Allen
Score: 3-1

[10:37] Team_031 possession (Score: 3-1)
Gary Morant attempts a 3Pt. Wide open! Derrick Allen is 6.3 feet away. [ZONE] Gary Morant misses. Rebound secured by Jalen Rozier.

[10:25] Team_005 possession (Score: 3-1)
Anthony Rozier drives to the basket... Anthony Rozier loses control! Ball rolls out of bounds! TURNOVER! (dead ball)

[10:12] Team_031 possession (Score: 3-1)
Pau Irving makes the Midrange and draws the foul on Derrick Allen! And-1! Pau Irving to the line for 1. [Team fouls: 2] (Derrick Allen: 1 personal fouls)   FT 1/1: GOOD Pau Irving makes 1/1 from the line.
Score: 3-4

[09:54] Team_005 possession (Score: 3-4)
FOUL! Shooting foul on Immanuel James. Jalen Rozier to the line for 3 free throws. [Team fouls: 2] (Immanuel James: 1 personal fouls)   FT 1/3: GOOD   FT 2/3: GOOD   FT 3/3: GOOD Jalen Rozier makes 3/3 from the line.
Score: 6-4

[09:43] Team_031 possession (Score: 6-4)
Luka Sabonis attempts a Midrange. Wide open! Cade Markkanen is 6.6 feet away. [MAN] LUKA SABONIS MAKES IT!
Score: 6-6

[09:30] Team_005 possession (Score: 6-6)
FOUL! Shooting foul on Luka Sabonis. Cade Markkanen to the line for 2 free throws. [Team fouls: 3] (Luka Sabonis: 2 personal fouls)   FT 1/2: GOOD   FT 2/2: GOOD Cade Markkanen makes 2/2 from the line.
Score: 8-6

[09:19] Team_031 possession (Score: 8-6)
Pau Irving attempts a Midrange. Wide open! Jalen Rozier is 8.9 feet away. [ZONE] PAU IRVING MAKES IT! Assist: Luka Sabonis
Score: 8-8

[09:05] Team_005 possession (Score: 8-8)
Brandon George attempts a 3Pt. Contested by Gary Morant (2.2 feet, ZONE). Brandon George misses. Offensive rebound by Cade Markkanen! Cade Markkanen's putback is no good. Rebound secured by Gary Morant.

[08:52] Team_031 possession (Score: 8-8)
Immanuel James drives to the basket... Immanuel James commits a violation (traveling/carry)! TURNOVER! (dead ball)

[08:34] Team_005 possession (Score: 8-8)
Anthony Rozier attempts a 3Pt. Contested by Pau Irving (2.1 feet, ZONE). Anthony Rozier misses. Offensive rebound by Cade Markkanen! Cade Markkanen's putback is no good. Rebound secured by Immanuel James.

[08:20] Team_031 possession (Score: 8-8)
Gary Morant attempts a Midrange. Wide open! Jalen Rozier is 6.4 feet away. [ZONE] Gary Morant misses. Rebound secured by Cade Markkanen.

[08:05] Team_005 possession (Score: 8-8)
Anthony Rozier drives and kicks out. Derrick Allen attempts a 3Pt. Contested by Pau Irving (2.1 feet, MAN). DERRICK ALLEN MAKES IT! Assist: Jalen Rozier
Score: 11-8

[07:50] Team_031 possession (Score: 11-8)
Shai Durant attempts a Midrange. Wide open! Brandon George is 7.2 feet away. [MAN] SHAI DURANT MAKES IT!
Score: 11-10

[07:35] Team_005 possession (Score: 11-10)
Jalen Rozier drives to the basket... Jalen Rozier throws a bad pass! Stolen by Immanuel James! TURNOVER! (live ball)

[07:17] Team_031 possession (Score: 11-10)
Luka Sabonis makes the 3Pt and draws the foul on Cade Markkanen! And-1! Luka Sabonis to the line for 1. [Team fouls: 3] (Cade Markkanen: 2 personal fouls)   FT 1/1: GOOD Luka Sabonis makes 1/1 from the line.
Score: 11-14

[07:00] Team_005 possession (Score: 11-14)
FOUL! Shooting foul on Gary Morant. Cade Markkanen to the line for 2 free throws. [Team fouls: 4] (Gary Morant: 1 personal fouls)   FT 1/2: GOOD   FT 2/2: GOOD Cade Markkanen makes 2/2 from the line.
Score: 13-14

[06:43] Team_031 possession (Score: 13-14)
Luka Sabonis attempts a 3Pt. Contested by Cade Markkanen (2.4 feet, MAN). Luka Sabonis misses. Rebound secured by Cade Markkanen.

[06:32] Team_005 possession (Score: 13-14)
Cade Markkanen drives, Luka Sabonis stays with him. Cade Markkanen attempts a Dunk. Contested by Luka Sabonis (2.2 feet, MAN). CADE MARKKANEN MAKES IT!
Score: 15-14

[06:16] Team_031 possession (Score: 15-14)
Gary Morant attempts a 3Pt. Contested by Brandon George (4.4 feet, ZONE). Gary Morant misses. Offensive rebound by Luka Sabonis! Luka Sabonis puts it back in!
Score: 15-16

[06:01] Team_005 possession (Score: 15-16)
Anthony Rozier drives, Immanuel James stays with him. Anthony Rozier attempts a Layup. Heavily contested by Immanuel James (1.5 feet, ZONE)! Anthony Rozier misses. Rebound secured by Luka Sabonis.

[05:47] Team_031 possession (Score: 15-16)
Shai Durant attempts a Midrange. Contested by Jalen Rozier (3.7 feet, ZONE). SHAI DURANT MAKES IT! Assist: Immanuel James
Score: 15-18

[05:28] Team_005 possession (Score: 15-18)
Anthony Rozier drives and kicks out. Brandon George attempts a 3Pt. Contested by Shai Durant (4.8 feet, MAN). BRANDON GEORGE MAKES IT! Assist: Derrick Allen
Score: 18-18

[05:16] Team_031 possession (Score: 18-18)
FOUL! Holding foul on Derrick Allen. [Team fouls: 4] No free throws, side out. (Derrick Allen: 2 personal fouls)

[05:02] Team_031 possession (Score: 18-18)
Luka Sabonis makes the Dunk and draws the foul on Cade Markkanen! And-1! Luka Sabonis to the line for 1. [BONUS: 5 team fouls] (Cade Markkanen: 3 personal fouls)   FT 1/1: GOOD Luka Sabonis makes 1/1 from the line.
Score: 18-21

[04:51] Team_005 possession (Score: 18-21)
FOUL! Offensive foul on Cade Markkanen! Luka Sabonis drew the charge! [Team fouls: 6] (Cade Markkanen: 4 personal fouls) TURNOVER! (dead ball)

[04:41] Team_031 possession (Score: 18-21)
Pau Irving attempts a 3Pt. Heavily contested by Derrick Allen (1.2 feet, ZONE)! Pau Irving misses. Rebound secured by Cade Markkanen.

[04:27] Team_005 possession (Score: 18-21)
Derrick Allen makes the Layup and draws the foul on Immanuel James! And-1! Derrick Allen to the line for 1. [BONUS: 5 team fouls] (Immanuel James: 2 personal fouls)   FT 1/1: MISS Derrick Allen makes 0/1 from the line. Offensive rebound by Jalen Rozier! Jalen Rozier kicks it out.
Score: 20-21

[04:13] Team_005 possession (Score: 20-21)
Brandon George makes the Layup and draws the foul on Shai Durant! And-1! Brandon George to the line for 1. [BONUS: 6 team fouls] (Shai Durant: 1 personal fouls)   FT 1/1: GOOD Brandon George makes 1/1 from the line.
Score: 23-21

[03:57] Team_031 possession (Score: 23-21)
Gary Morant attempts a Midrange. Contested by Derrick Allen (5.0 feet, ZONE). GARY MORANT MAKES IT! Assist: Pau Irving
Score: 23-23

[03:47] Team_005 possession (Score: 23-23)
Jalen Rozier drives and kicks out. Jalen Rozier attempts a Midrange. Contested by Immanuel James (3.4 feet, MAN). Jalen Rozier misses. FOUL! Loose ball foul on Immanuel James during the rebound battle. [IN THE BONUS! 7 team fouls] Cade Markkanen to the line for 2 free throws. (Immanuel James: 3 personal fouls)   FT 1/2: MISS   FT 2/2: GOOD Cade Markkanen makes 1/2 from the line.
Score: 24-23

[03:31] Team_031 possession (Score: 24-23)
Shai Durant throws a bad pass out of bounds! TURNOVER! (dead ball)

[03:31] Substitution (Team_005): Brandon George OUT → Blake O'Neal IN (stamina_rule2)

[03:31] Substitution (Team_005): Anthony Rozier OUT → Draymond Smith IN (stamina_rule2)

[03:31] Substitution (Team_005): Cade Markkanen OUT → Zion Parker IN (stamina_rule2)

[03:31] Substitution (Team_031): Immanuel James OUT → Kobe Randle IN (stamina_rule2)

[03:16] Team_005 possession (Score: 24-23)
Jalen Rozier attempts a 3Pt. Contested by Kobe Randle (4.0 feet, MAN). JALEN ROZIER MAKES IT! Assist: Derrick Allen
Score: 27-23

[03:00] Team_031 possession (Score: 27-23)
Gary Morant attempts a 3Pt. Contested by Draymond Smith (5.9 feet, ZONE). Gary Morant misses. FOUL! Loose ball foul on Jalen Rozier during the rebound battle. [IN THE BONUS! 7 team fouls] Luka Sabonis to the line for 2 free throws. (Jalen Rozier: 1 personal fouls)   FT 1/2: GOOD   FT 2/2: GOOD Luka Sabonis makes 2/2 from the line.
Score: 27-25

[02:47] Team_005 possession (Score: 27-25)
Draymond Smith makes the Layup and draws the foul on Shai Durant! And-1! Draymond Smith to the line for 1. [BONUS: 8 team fouls] (Shai Durant: 2 personal fouls)   FT 1/1: GOOD Draymond Smith makes 1/1 from the line.
Score: 30-25

[02:36] Team_031 possession (Score: 30-25)
FOUL! Reach-in foul on Zion Parker during the drive. [IN THE BONUS! 8 team fouls] Kobe Randle to the line for 2 free throws. (Zion Parker: 1 personal fouls)   FT 1/2: GOOD   FT 2/2: MISS Kobe Randle makes 1/2 from the line. Rebound secured by Derrick Allen.
Score: 30-26

[02:25] Team_005 possession (Score: 30-26)
Blake O'Neal drives, Shai Durant stays with him. Blake O'Neal attempts a Dunk. Contested by Shai Durant (4.8 feet, MAN). BLAKE O'NEAL MAKES IT! Assist: Derrick Allen
Score: 32-26

[02:12] Team_031 possession (Score: 32-26)
Gary Morant attempts a 3Pt. Contested by Draymond Smith (3.3 feet, MAN). Gary Morant misses. Offensive rebound by Kobe Randle! Kobe Randle kicks it out.

[02:02] Team_031 possession (Score: 32-26)
Pau Irving attempts a 3Pt. Contested by Derrick Allen (5.2 feet, MAN). Pau Irving misses. Rebound secured by Jalen Rozier.

[01:46] Team_005 possession (Score: 32-26)
FOUL! Offensive foul on Derrick Allen! Pau Irving drew the charge! [Team fouls: 9] (Derrick Allen: 3 personal fouls) TURNOVER! (dead ball)

[01:28] Team_031 possession (Score: 32-26)
Kobe Randle attempts a Midrange. Contested by Draymond Smith (2.9 feet, ZONE). Kobe Randle misses. Rebound secured by Zion Parker.

[01:11] Team_005 possession (Score: 32-26)
Jalen Rozier loses the ball! Stripped by Kobe Randle! TURNOVER! (live ball)

[00:55] Team_031 possession (Score: 32-26)
Kobe Randle attempts a 3Pt. Wide open! Jalen Rozier is 6.9 feet away. [ZONE] KOBE RANDLE MAKES IT! Assist: Luka Sabonis
Score: 32-29

[00:38] Team_005 possession (Score: 32-29)
Jalen Rozier drives, Luka Sabonis stays with him. Jalen Rozier attempts a Dunk. Contested by Luka Sabonis (3.9 feet, ZONE). JALEN ROZIER MAKES IT! Assist: Zion Parker
Score: 34-29

[00:25] Team_031 possession (Score: 34-29)
Gary Morant attempts a Layup. Contested by Draymond Smith (3.3 feet, MAN). GARY MORANT MAKES IT! Assist: Luka Sabonis
Score: 34-31

[00:12] Team_005 possession (Score: 34-31)
Draymond Smith attempts a Layup. BLOCKED BY GARY MORANT! Ball is loose! Rebound secured by Kobe Randle.

================================================================================
                              1ST QUARTER COMPLETE                              
================================================================================

1ST QUARTER SCORE: Team_005 34, Team_031 31

BOX SCORE:
================================================================================

Team_005
--------------------------------------------------------------------------------
Player                MIN  PTS  REB  AST  TO      FG   FG%      3P   3P%
--------------------------------------------------------------------------------
Cade Markkanen          9   10    4    0   0   5/5   100.0     0/0   0.0
Jalen Rozier           12    8    3    1   0   3/3   100.0     0/0   0.0
Brandon George          9    6    0    0   0   2/4    50.0     0/0   0.0
Derrick Allen          12    3    2    4   0   1/1   100.0     0/0   0.0
Draymond Smith          3    3    0    0   0   1/2    50.0     0/0   0.0
Blake O'Neal            3    2    0    0   0   1/1   100.0     0/0   0.0
Anthony Rozier          9    0    0    0   0   0/3     0.0     0/0   0.0
Zion Parker             3    0    1    1   0   0/0     0.0     0/0   0.0

TEAM: FG: 13/19 (68.4%), 3PT: 3/7 (42.9%), REB: 12 (4 off, 8 def), AST: 6, TO: 5
TEAM FOULS: 9 [Team_031 in BONUS]


Team_031
--------------------------------------------------------------------------------
Player                MIN  PTS  REB  AST  TO      FG   FG%      3P   3P%
--------------------------------------------------------------------------------
Luka Sabonis           12   13    3    3   0   5/6    83.3     0/0   0.0
Gary Morant            12    5    2    0   0   3/5    60.0     0/0   0.0
Pau Irving             12    5    0    1   0   2/4    50.0     0/0   0.0
Shai Durant            12    4    0    0   0   2/2   100.0     0/0   0.0
Kobe Randle             3    3    2    0   0   1/3    33.3     0/0   0.0
Immanuel James          9    0    1    1   0   0/1     0.0     0/0   0.0

TEAM: FG: 13/21 (61.9%), 3PT: 4/9 (44.4%), REB: 6 (2 off, 4 def), AST: 5, TO: 2
TEAM FOULS: 8 [Team_005 in BONUS]

================================================================================

================================================================================
                       2ND QUARTER - Team_005 vs Team_031                       
================================================================================

[12:00] Team_005 possession (Score: 34-31)
Derrick Allen throws a bad pass! Stolen by Pau Irving! TURNOVER! (live ball)

[11:42] Team_031 possession (Score: 34-31)
Immanuel James attempts a Midrange. Wide open! Brandon George is 7.2 feet away. [ZONE] Immanuel James misses. Rebound secured by Jalen Rozier.

[11:28] Team_005 possession (Score: 34-31)
FOUL! Offensive foul on Derrick Allen! Pau Irving drew the charge! [Team fouls: 1] (Derrick Allen: 1 personal fouls) TURNOVER! (dead ball)

[11:15] Team_031 possession (Score: 34-31)
Shai Durant attempts a 3Pt. Wide open! Derrick Allen is 7.8 feet away. [ZONE] SHAI DURANT MAKES IT! Assist: Luka Sabonis
Score: 34-34

[11:00] Team_005 possession (Score: 34-34)
Jalen Rozier attempts a Layup. Contested by Immanuel James (3.7 feet, ZONE). Jalen Rozier misses. Offensive rebound by Cade Markkanen! Cade Markkanen's putback is no good. Rebound secured by Luka Sabonis.

[10:42] Team_031 possession (Score: 34-34)
Pau Irving attempts a 3Pt. Contested by Derrick Allen (2.8 feet, ZONE). Pau Irving misses. Rebound secured by Anthony Rozier.

[10:27] Team_005 possession (Score: 34-34)
Cade Markkanen attempts a 3Pt. Contested by Pau Irving (5.0 feet, ZONE). Cade Markkanen misses. Offensive rebound by Anthony Rozier! Anthony Rozier kicks it out.

[10:13] Team_005 possession (Score: 34-34)
Anthony Rozier attempts a Layup. Heavily contested by Immanuel James (1.9 feet, ZONE)! ANTHONY ROZIER MAKES IT! Assist: Brandon George
Score: 36-34

[09:58] Team_031 possession (Score: 36-34)
Shai Durant attempts a 3Pt. Wide open! Derrick Allen is 7.5 feet away. [ZONE] SHAI DURANT MAKES IT! Assist: Immanuel James
Score: 36-37

[09:39] Team_005 possession (Score: 36-37)
Brandon George attempts a 3Pt. Wide open! Shai Durant is 6.5 feet away. [MAN] BRANDON GEORGE MAKES IT! Assist: Anthony Rozier
Score: 39-37

[09:24] Team_031 possession (Score: 39-37)
Immanuel James drives to the basket... Immanuel James commits a violation (traveling/carry)! TURNOVER! (dead ball)

[09:24] Substitution (Team_005): Derrick Allen OUT → Lauri Wade IN (stamina_rule2)

[09:24] Substitution (Team_005): Jalen Rozier OUT → Isaiah Durant IN (stamina_rule2)

[09:24] Substitution (Team_031): Shai Durant OUT → Kevin Morant IN (stamina_rule2)

[09:24] Substitution (Team_031): Gary Morant OUT → Isaiah Ingram IN (stamina_rule2)

[09:24] Substitution (Team_031): Pau Irving OUT → Miles Stewart IN (stamina_rule2)

[09:24] Substitution (Team_031): Luka Sabonis OUT → Jimmy Poole IN (stamina_rule2)

[09:12] Team_005 possession (Score: 39-37)
Brandon George throws a bad pass out of bounds! TURNOVER! (dead ball)

[08:53] Team_031 possession (Score: 39-37)
Immanuel James drives and kicks out. Kevin Morant makes the 3Pt and draws the foul on Brandon George! And-1! Kevin Morant to the line for 1. [Team fouls: 2] (Brandon George: 1 personal fouls)   FT 1/1: GOOD Kevin Morant makes 1/1 from the line.
Score: 39-41

[08:38] Team_005 possession (Score: 39-41)
Isaiah Durant loses the ball! Stripped by Immanuel James! TURNOVER! (live ball)

[08:25] Team_031 possession (Score: 39-41)
FOUL! Holding foul on Lauri Wade. [Team fouls: 3] No free throws, side out. (Lauri Wade: 1 personal fouls)

[08:13] Team_031 possession (Score: 39-41)
Kevin Morant drives, Brandon George stays with him. Kevin Morant attempts a Dunk. Contested by Brandon George (5.5 feet, MAN). Kevin Morant misses. Offensive rebound by Immanuel James! Immanuel James's putback is no good. Rebound secured by Anthony Rozier.

[07:58] Team_005 possession (Score: 39-41)
FOUL! Reach-in foul on Immanuel James during the drive. [Team fouls: 1] No free throws, side out. (Immanuel James: 1 personal fouls)

[07:47] Team_005 possession (Score: 39-41)
Lauri Wade attempts a 3Pt. Wide open! Miles Stewart is 8.1 feet away. [ZONE] Lauri Wade misses. Rebound secured by Immanuel James.

[07:35] Team_031 possession (Score: 39-41)
Immanuel James attempts a 3Pt. Contested by Isaiah Durant (4.9 feet, MAN). IMMANUEL JAMES MAKES IT! Assist: Miles Stewart
Score: 39-44

[07:22] Team_005 possession (Score: 39-44)
Lauri Wade drives to the basket... Lauri Wade throws a bad pass! Stolen by Immanuel James! TURNOVER! (live ball)

[07:11] Team_031 possession (Score: 39-44)
Isaiah Ingram makes the Layup and draws the foul on Anthony Rozier! And-1! Isaiah Ingram to the line for 1. [Team fouls: 4] (Anthony Rozier: 1 personal fouls)   FT 1/1: GOOD Isaiah Ingram makes 1/1 from the line.
Score: 39-47

[06:54] Team_005 possession (Score: 39-47)
Cade Markkanen drives to the basket... Cade Markkanen throws a bad pass out of bounds! TURNOVER! (dead ball)

[06:54] Substitution (Team_005): Brandon George OUT → Blake O'Neal IN (stamina_rule2)

[06:54] Substitution (Team_005): Anthony Rozier OUT → Draymond Smith IN (stamina_rule2)

[06:54] Substitution (Team_005): Cade Markkanen OUT → Zion Parker IN (stamina_rule2)

[06:54] Substitution (Team_031): Immanuel James OUT → Kobe Randle IN (stamina_rule2)

[06:40] Team_031 possession (Score: 39-47)
Miles Stewart makes the Layup and draws the foul on Zion Parker! And-1! Miles Stewart to the line for 1. [BONUS: 5 team fouls] (Zion Parker: 1 personal fouls)   FT 1/1: MISS Miles Stewart makes 0/1 from the line. Rebound secured by Draymond Smith.
Score: 39-49

[06:25] Team_005 possession (Score: 39-49)
Draymond Smith attempts a 3Pt. Wide open! Isaiah Ingram is 6.0 feet away. [MAN] DRAYMOND SMITH MAKES IT! Assist: Lauri Wade
Score: 42-49

[06:14] Team_031 possession (Score: 42-49)
FOUL! Offensive foul on Isaiah Ingram! Draymond Smith drew the charge! [Team fouls: 2] (Isaiah Ingram: 1 personal fouls) TURNOVER! (dead ball)

[05:59] Team_005 possession (Score: 42-49)
Lauri Wade makes the Layup and draws the foul on Miles Stewart! And-1! Lauri Wade to the line for 1. [Team fouls: 3] (Miles Stewart: 1 personal fouls)   FT 1/1: GOOD Lauri Wade makes 1/1 from the line.
Score: 45-49

[05:41] Team_031 possession (Score: 45-49)
Kevin Morant attempts a 3Pt. Contested by Blake O'Neal (3.3 feet, ZONE). Kevin Morant misses. Rebound secured by Zion Parker.

[05:27] Team_005 possession (Score: 45-49)
Blake O'Neal attempts a Layup. Contested by Kobe Randle (3.6 feet, ZONE). Blake O'Neal misses. Rebound secured by Kobe Randle.

[05:10] Team_031 possession (Score: 45-49)
Jimmy Poole attempts a 3Pt. Contested by Blake O'Neal (4.3 feet, ZONE). Jimmy Poole misses. Rebound secured by Lauri Wade.

[04:59] Team_005 possession (Score: 45-49)
Draymond Smith attempts a 3Pt. Contested by Miles Stewart (5.1 feet, ZONE). DRAYMOND SMITH MAKES IT! Assist: Blake O'Neal
Score: 48-49

[04:48] Team_031 possession (Score: 48-49)
Kevin Morant attempts a 3Pt. Contested by Blake O'Neal (4.5 feet, MAN). Kevin Morant misses. Rebound secured by Draymond Smith.

[04:34] Team_005 possession (Score: 48-49)
Isaiah Durant drives to the basket... Isaiah Durant loses control! Ball rolls out of bounds! TURNOVER! (dead ball)

[04:20] Team_031 possession (Score: 48-49)
Kevin Morant attempts a Midrange. Contested by Draymond Smith (5.2 feet, ZONE). Kevin Morant misses. Rebound secured by Draymond Smith.

[04:06] Team_005 possession (Score: 48-49)
Draymond Smith attempts a 3Pt. Wide open! Miles Stewart is 7.2 feet away. [ZONE] DRAYMOND SMITH MAKES IT!
Score: 51-49

[03:55] Team_031 possession (Score: 51-49)
Jimmy Poole attempts a 3Pt. Contested by Blake O'Neal (4.6 feet, ZONE). Jimmy Poole misses. Offensive rebound by Isaiah Ingram! Isaiah Ingram kicks it out.

[03:40] Team_031 possession (Score: 51-49)
FOUL! Reach-in foul on Zion Parker during the drive. [IN THE BONUS! 6 team fouls] Jimmy Poole to the line for 2 free throws. (Zion Parker: 2 personal fouls)   FT 1/2: GOOD   FT 2/2: GOOD Jimmy Poole makes 2/2 from the line.
Score: 51-51

[03:22] Team_005 possession (Score: 51-51)
FOUL! Reach-in foul on Jimmy Poole during the drive. [Team fouls: 4] No free throws, side out. (Jimmy Poole: 1 personal fouls)

[03:12] Team_005 possession (Score: 51-51)
Blake O'Neal attempts a 3Pt. Contested by Kevin Morant (5.8 feet, MAN). BLAKE O'NEAL MAKES IT!
Score: 54-51

[02:58] Team_031 possession (Score: 54-51)
Kevin Morant attempts a 3Pt. Contested by Blake O'Neal (5.7 feet, ZONE). KEVIN MORANT MAKES IT! Assist: Miles Stewart
Score: 54-54

[02:46] Team_005 possession (Score: 54-54)
FOUL! Reach-in foul on Kobe Randle during the drive. [IN THE BONUS! 5 team fouls] Isaiah Durant to the line for 2 free throws. (Kobe Randle: 1 personal fouls)   FT 1/2: GOOD   FT 2/2: GOOD Isaiah Durant makes 2/2 from the line.
Score: 56-54

[02:34] Team_031 possession (Score: 56-54)
Isaiah Ingram attempts a Midrange. Wide open! Draymond Smith is 6.6 feet away. [ZONE] Isaiah Ingram misses. Rebound secured by Blake O'Neal.

[02:22] Team_005 possession (Score: 56-54)
FOUL! Shooting foul on Isaiah Ingram. Zion Parker to the line for 2 free throws. [BONUS: 6 team fouls] (Isaiah Ingram: 2 personal fouls)   FT 1/2: GOOD   FT 2/2: GOOD Zion Parker makes 2/2 from the line.
Score: 58-54

[02:10] Team_031 possession (Score: 58-54)
Miles Stewart attempts a 3Pt. Contested by Blake O'Neal (3.5 feet, ZONE). Miles Stewart misses. FOUL! Loose ball foul on Blake O'Neal during the rebound battle. [IN THE BONUS! 7 team fouls] Jimmy Poole to the line for 2 free throws. (Blake O'Neal: 1 personal fouls)   FT 1/2: GOOD   FT 2/2: MISS Jimmy Poole makes 1/2 from the line. Rebound secured by Zion Parker.
Score: 58-55

[02:00] Team_005 possession (Score: 58-55)
Lauri Wade drives and kicks out. Isaiah Durant attempts a 3Pt. Wide open! Kobe Randle is 6.7 feet away. [MAN] Isaiah Durant misses. Rebound secured by Jimmy Poole.

[01:43] Team_031 possession (Score: 58-55)
Jimmy Poole drives and kicks out. Miles Stewart attempts a Midrange. Heavily contested by Draymond Smith (0.5 feet, ZONE)! MILES STEWART MAKES IT!
Score: 58-57

[01:24] Team_005 possession (Score: 58-57)
FOUL! Shooting foul on Kobe Randle. Isaiah Durant to the line for 2 free throws. [BONUS: 7 team fouls] (Kobe Randle: 2 personal fouls)   FT 1/2: MISS   FT 2/2: GOOD Isaiah Durant makes 1/2 from the line.
Score: 59-57

[01:08] Team_031 possession (Score: 59-57)
FOUL! Reach-in foul on Zion Parker during the drive. [IN THE BONUS! 8 team fouls] Jimmy Poole to the line for 2 free throws. (Zion Parker: 3 personal fouls)   FT 1/2: GOOD   FT 2/2: GOOD Jimmy Poole makes 2/2 from the line.
Score: 59-59

[00:51] Team_005 possession (Score: 59-59)
Zion Parker drives and kicks out. Blake O'Neal attempts a 3Pt. Contested by Kevin Morant (3.6 feet, MAN). BLAKE O'NEAL MAKES IT! Assist: Zion Parker
Score: 62-59

[00:40] Team_031 possession (Score: 62-59)
Kevin Morant drives to the basket... Kevin Morant loses control! Ball rolls out of bounds! TURNOVER! (dead ball)

[00:24] Team_005 possession (Score: 62-59)
FOUL! Shooting foul on Kobe Randle. Isaiah Durant to the line for 2 free throws. [BONUS: 8 team fouls] (Kobe Randle: 3 personal fouls)   FT 1/2: MISS   FT 2/2: GOOD Isaiah Durant makes 1/2 from the line.
Score: 63-59

[00:08] Team_031 possession (Score: 63-59)
Miles Stewart attempts a 3Pt. Contested by Lauri Wade (5.1 feet, MAN). MILES STEWART MAKES IT! Assist: Isaiah Ingram
Score: 63-62

================================================================================
                              2ND QUARTER COMPLETE                              
================================================================================

2ND QUARTER SCORE: Team_005 29, Team_031 31

BOX SCORE:
================================================================================

Team_005
--------------------------------------------------------------------------------
Player                MIN  PTS  REB  AST  TO      FG   FG%      3P   3P%
--------------------------------------------------------------------------------
Draymond Smith         10    9    3    0   0   3/3   100.0     0/0   0.0
Blake O'Neal           10    6    1    1   0   2/3    66.7     0/0   0.0
Isaiah Durant           9    4    0    0   0   3/3   100.0     0/0   0.0
Brandon George         14    3    0    1   0   1/1   100.0     0/0   0.0
Lauri Wade              9    3    1    1   0   1/3    33.3     0/0   0.0
Zion Parker            10    2    2    1   0   1/1   100.0     0/0   0.0
Jalen Rozier           15    0    1    0   0   0/1     0.0     0/0   0.0
Luka Sabonis           15    0    1    1   0   0/0     0.0     0/0   0.0

TEAM: FG: 12/16 (75.0%), 3PT: 5/6 (83.3%), REB: 10 (2 off, 8 def), AST: 5, TO: 7
TEAM FOULS: 8 [Team_031 in BONUS]


Team_031
--------------------------------------------------------------------------------
Player                MIN  PTS  REB  AST  TO      FG   FG%      3P   3P%
--------------------------------------------------------------------------------
Kevin Morant            9    7    0    0   0   2/6    33.3     0/0   0.0
Shai Durant            15    6    0    0   0   2/2   100.0     0/0   0.0
Miles Stewart           9    5    0    2   0   2/4    50.0     0/0   0.0
Jimmy Poole             9    4    1    0   0   2/3    66.7     0/0   0.0
Immanuel James         14    3    1    1   0   1/2    50.0     0/0   0.0
Isaiah Ingram           9    3    1    1   0   1/2    50.0     0/0   0.0
Anthony Rozier         14    2    3    1   0   1/1   100.0     0/0   0.0
Pau Irving             15    0    0    0   0   0/1     0.0     0/0   0.0
Kobe Randle            10    0    1    0   0   0/0     0.0     0/0   0.0

TEAM: FG: 10/20 (50.0%), 3PT: 5/10 (50.0%), REB: 6 (3 off, 3 def), AST: 5, TO: 3
TEAM FOULS: 8 [Team_005 in BONUS]

================================================================================

================================================================================
                       3RD QUARTER - Team_005 vs Team_031                       
================================================================================

[12:00] Team_005 possession (Score: 63-62)
Derrick Allen attempts a 3Pt. Contested by Pau Irving (5.4 feet, MAN). DERRICK ALLEN MAKES IT! Assist: Brandon George
Score: 66-62

[11:42] Team_031 possession (Score: 66-62)
Shai Durant attempts a 3Pt. Contested by Derrick Allen (4.8 feet, ZONE). Shai Durant misses. Rebound secured by Cade Markkanen.

[11:26] Team_005 possession (Score: 66-62)
Cade Markkanen drives, Luka Sabonis stays with him. Cade Markkanen attempts a Dunk. Heavily contested by Luka Sabonis (1.3 feet, MAN)! CADE MARKKANEN MAKES IT!
Score: 68-62

[11:15] Team_031 possession (Score: 68-62)
Shai Durant attempts a Midrange. Heavily contested by Brandon George (0.9 feet, MAN)! Shai Durant misses. Rebound secured by Cade Markkanen.

[10:56] Team_005 possession (Score: 68-62)
Derrick Allen attempts a 3Pt. Contested by Pau Irving (3.7 feet, ZONE). Derrick Allen misses. Rebound secured by Immanuel James.

[10:40] Team_031 possession (Score: 68-62)
Pau Irving drives to the basket... Pau Irving loses the ball! Stripped by Derrick Allen! TURNOVER! (live ball)

[10:27] Team_005 possession (Score: 68-62)
FOUL! Reach-in foul on Immanuel James during the drive. [Team fouls: 1] No free throws, side out. (Immanuel James: 1 personal fouls)

[10:14] Team_005 possession (Score: 68-62)
Anthony Rozier attempts a 3Pt. Wide open! Gary Morant is 6.3 feet away. [MAN] ANTHONY ROZIER MAKES IT! Assist: Jalen Rozier
Score: 71-62

[09:57] Team_031 possession (Score: 71-62)
Immanuel James attempts a Midrange. Wide open! Cade Markkanen is 8.3 feet away. [MAN] Immanuel James misses. Rebound secured by Derrick Allen.

[09:41] Team_005 possession (Score: 71-62)
Brandon George attempts a 3Pt. Contested by Shai Durant (4.6 feet, MAN). Brandon George misses. Rebound secured by Immanuel James.

[09:27] Team_031 possession (Score: 71-62)
Immanuel James attempts a 3Pt. Contested by Cade Markkanen (2.4 feet, MAN). Immanuel James misses. Rebound secured by Cade Markkanen.

[09:11] Team_005 possession (Score: 71-62)
Derrick Allen attempts a 3Pt. Contested by Pau Irving (3.5 feet, ZONE). Derrick Allen misses. Offensive rebound by Cade Markkanen! Cade Markkanen's putback is no good. Offensive rebound by Jalen Rozier! Jalen Rozier kicks it out.

[08:51] Team_005 possession (Score: 71-62)
Brandon George drives to the basket... Brandon George loses control! Ball rolls out of bounds! TURNOVER! (dead ball)

[08:37] Team_031 possession (Score: 71-62)
Immanuel James attempts a Midrange. Contested by Cade Markkanen (3.9 feet, MAN). Immanuel James misses. FOUL! Loose ball foul on Derrick Allen during the rebound battle. [Team fouls: 1] No free throws, side out. (Derrick Allen: 1 personal fouls)

[08:25] Team_031 possession (Score: 71-62)
FOUL! Reach-in foul on Cade Markkanen during the drive. [Team fouls: 2] No free throws, side out. (Cade Markkanen: 1 personal fouls)

[08:09] Team_031 possession (Score: 71-62)
Gary Morant attempts a Midrange. Contested by Anthony Rozier (2.5 feet, MAN). Gary Morant misses. Rebound secured by Derrick Allen.

[07:53] Team_005 possession (Score: 71-62)
FOUL! Holding foul on Immanuel James. [Team fouls: 2] No free throws, side out. (Immanuel James: 2 personal fouls)

[07:38] Team_005 possession (Score: 71-62)
Anthony Rozier attempts a 3Pt. Wide open! Pau Irving is 6.4 feet away. [ZONE] Anthony Rozier misses. Rebound secured by Immanuel James.

[07:23] Team_031 possession (Score: 71-62)
Luka Sabonis attempts a 3Pt. Contested by Derrick Allen (3.1 feet, ZONE). Luka Sabonis misses. FOUL! Loose ball foul on Cade Markkanen during the rebound battle. [Team fouls: 3] No free throws, side out. (Cade Markkanen: 2 personal fouls)

[07:08] Team_031 possession (Score: 71-62)
Immanuel James drives to the basket... Immanuel James throws a bad pass! Stolen by Cade Markkanen! TURNOVER! (live ball)

[06:55] Team_005 possession (Score: 71-62)
Anthony Rozier attempts a 3Pt. Wide open! Gary Morant is 6.2 feet away. [MAN] Anthony Rozier misses. Rebound secured by Immanuel James.

[06:41] Team_031 possession (Score: 71-62)
Gary Morant attempts a 3Pt. Contested by Brandon George (4.7 feet, ZONE). GARY MORANT MAKES IT! Assist: Luka Sabonis
Score: 71-65

[06:31] Team_005 possession (Score: 71-65)
Derrick Allen attempts a Layup. BLOCKED BY SHAI DURANT! Ball deflects out of bounds off Derrick Allen.

[06:15] Team_031 possession (Score: 71-65)
Immanuel James attempts a Midrange. Contested by Anthony Rozier (5.2 feet, ZONE). IMMANUEL JAMES MAKES IT!
Score: 71-67

[06:03] Team_005 possession (Score: 71-67)
Derrick Allen attempts a Midrange. Contested by Pau Irving (2.7 feet, MAN). DERRICK ALLEN MAKES IT!
Score: 73-67

[05:50] Team_031 possession (Score: 73-67)
Luka Sabonis attempts a 3Pt. Contested by Cade Markkanen (3.3 feet, MAN). Luka Sabonis misses. Rebound secured by Jalen Rozier.

[05:34] Team_005 possession (Score: 73-67)
Cade Markkanen attempts a Midrange. Heavily contested by Luka Sabonis (1.6 feet, MAN)! Cade Markkanen misses. Rebound secured by Luka Sabonis.

[05:22] Team_031 possession (Score: 73-67)
Gary Morant attempts a Layup. BLOCKED BY DERRICK ALLEN! Ball is loose! Rebound secured by Cade Markkanen.

[05:06] Team_005 possession (Score: 73-67)
Anthony Rozier attempts a Midrange. Contested by Luka Sabonis (2.8 feet, ZONE). Anthony Rozier misses. Rebound secured by Luka Sabonis.

[04:51] Team_031 possession (Score: 73-67)
Immanuel James attempts a 3Pt. Contested by Derrick Allen (2.6 feet, ZONE). IMMANUEL JAMES MAKES IT! Assist: Gary Morant
Score: 73-70

[04:34] Team_005 possession (Score: 73-70)
FOUL! Reach-in foul on Immanuel James during the drive. [Team fouls: 3] No free throws, side out. (Immanuel James: 3 personal fouls)

[04:17] Team_005 possession (Score: 73-70)
Cade Markkanen drives, Luka Sabonis stays with him. Cade Markkanen attempts a Dunk. Heavily contested by Luka Sabonis (0.5 feet, MAN)! CADE MARKKANEN MAKES IT!
Score: 75-70

[04:03] Team_031 possession (Score: 75-70)
Pau Irving drives, picks up Derrick Allen. Help arrives from Anthony Rozier! Pau Irving attempts a Dunk. Heavily contested by Anthony Rozier (1.6 feet, MAN)! PAU IRVING MAKES IT!
Score: 75-72

[03:47] Team_005 possession (Score: 75-72)
Derrick Allen attempts a Midrange. Wide open! Immanuel James is 6.8 feet away. [ZONE] Derrick Allen misses. Rebound secured by Luka Sabonis.

[03:32] Team_031 possession (Score: 75-72)
Shai Durant drives to the basket... FOUL! Offensive foul on Shai Durant! Cade Markkanen drew the charge! [Team fouls: 4] (Shai Durant: 1 personal fouls) TURNOVER! (dead ball)

[03:23] Team_005 possession (Score: 75-72)
Brandon George attempts a 3Pt. Contested by Shai Durant (2.1 feet, MAN). Brandon George misses. Offensive rebound by Jalen Rozier! Jalen Rozier kicks it out.

[03:06] Team_005 possession (Score: 75-72)
Derrick Allen throws a bad pass out of bounds! TURNOVER! (dead ball)

[03:06] Substitution (Team_005): Brandon George OUT → Blake O'Neal IN (stamina_rule2)

[03:06] Substitution (Team_005): Anthony Rozier OUT → Draymond Smith IN (stamina_rule2)

[03:06] Substitution (Team_005): Cade Markkanen OUT → Zion Parker IN (stamina_rule2)

[03:06] Substitution (Team_031): Immanuel James OUT → Kobe Randle IN (stamina_rule2)

[02:51] Team_031 possession (Score: 75-72)
Kobe Randle attempts a 3Pt. Contested by Jalen Rozier (4.1 feet, MAN). Kobe Randle misses. Offensive rebound by Kobe Randle! Kobe Randle kicks it out.

[02:38] Team_031 possession (Score: 75-72)
Kobe Randle attempts a Midrange. Wide open! Derrick Allen is 6.4 feet away. [ZONE] Kobe Randle misses. Rebound secured by Derrick Allen.

[02:23] Team_005 possession (Score: 75-72)
Jalen Rozier attempts a 3Pt. Contested by Kobe Randle (5.9 feet, MAN). Jalen Rozier misses. Rebound secured by Gary Morant.

[02:08] Team_031 possession (Score: 75-72)
Luka Sabonis attempts a 3Pt. Contested by Blake O'Neal (3.4 feet, ZONE). Luka Sabonis misses. Rebound secured by Jalen Rozier.

[01:58] Team_005 possession (Score: 75-72)
FOUL! Offensive foul on Draymond Smith! Gary Morant drew the charge! [Team fouls: 4] (Draymond Smith: 1 personal fouls) TURNOVER! (dead ball)

[01:43] Team_031 possession (Score: 75-72)
Luka Sabonis drives to the basket... FOUL! Offensive foul on Luka Sabonis! Zion Parker drew the charge! [Team fouls: 5] (Luka Sabonis: 1 personal fouls) TURNOVER! (dead ball)

[01:34] Team_005 possession (Score: 75-72)
Jalen Rozier attempts a Layup. Heavily contested by Luka Sabonis (1.1 feet, ZONE)! Jalen Rozier misses. Rebound secured by Luka Sabonis.

[01:22] Team_031 possession (Score: 75-72)
Kobe Randle attempts a Midrange. Wide open! Jalen Rozier is 7.8 feet away. [MAN] KOBE RANDLE MAKES IT! Assist: Gary Morant
Score: 75-74

[01:06] Team_005 possession (Score: 75-74)
Zion Parker makes the Layup and draws the foul on Kobe Randle! And-1! Zion Parker to the line for 1. [BONUS: 6 team fouls] (Kobe Randle: 1 personal fouls)   FT 1/1: GOOD Zion Parker makes 1/1 from the line.
Score: 78-74

[00:53] Team_031 possession (Score: 78-74)
FOUL! Reach-in foul on Zion Parker during the drive. [IN THE BONUS! 5 team fouls] Luka Sabonis to the line for 2 free throws. (Zion Parker: 1 personal fouls)   FT 1/2: GOOD   FT 2/2: GOOD Luka Sabonis makes 2/2 from the line.
Score: 78-76

[00:42] Team_005 possession (Score: 78-76)
Blake O'Neal attempts a 3Pt. Contested by Pau Irving (3.5 feet, ZONE). Blake O'Neal misses. Rebound secured by Kobe Randle.

[00:29] Team_031 possession (Score: 78-76)
Shai Durant makes the Dunk and draws the foul on Blake O'Neal! And-1! Shai Durant to the line for 1. [BONUS: 6 team fouls] (Blake O'Neal: 1 personal fouls)   FT 1/1: GOOD Shai Durant makes 1/1 from the line.
Score: 78-79

[00:15] Team_005 possession (Score: 78-79)
Blake O'Neal makes the Midrange and draws the foul on Shai Durant! And-1! Blake O'Neal to the line for 1. [BONUS: 7 team fouls] (Shai Durant: 2 personal fouls)   FT 1/1: GOOD Blake O'Neal makes 1/1 from the line.
Score: 81-79

================================================================================
                              3RD QUARTER COMPLETE                              
================================================================================

3RD QUARTER SCORE: Team_005 18, Team_031 17

BOX SCORE:
================================================================================

Team_005
--------------------------------------------------------------------------------
Player                MIN  PTS  REB  AST  TO      FG   FG%      3P   3P%
--------------------------------------------------------------------------------
Derrick Allen          27    5    3    0   0   2/5    40.0     0/0   0.0
Cade Markkanen         23    4    4    0   0   2/3    66.7     0/0   0.0
Anthony Rozier         23    3    0    0   0   1/4    25.0     0/0   0.0
Zion Parker            13    3    0    0   0   1/1   100.0     0/0   0.0
Blake O'Neal           13    3    0    0   0   1/2    50.0     0/0   0.0
Brandon George         23    0    0    1   0   0/1     0.0     0/0   0.0
Jalen Rozier           27    0    4    1   0   0/2     0.0     0/0   0.0

TEAM: FG: 7/18 (38.9%), 3PT: 2/8 (25.0%), REB: 11 (2 off, 9 def), AST: 2, TO: 3
TEAM FOULS: 6 [Team_031 in BONUS]


Team_031
--------------------------------------------------------------------------------
Player                MIN  PTS  REB  AST  TO      FG   FG%      3P   3P%
--------------------------------------------------------------------------------
Immanuel James         23    5    5    0   0   2/4    50.0     0/0   0.0
Shai Durant            27    3    0    0   0   1/3    33.3     0/0   0.0
Gary Morant            27    3    1    2   0   1/3    33.3     0/0   0.0
Luka Sabonis           27    2    5    1   0   1/3    33.3     0/0   0.0
Pau Irving             27    2    0    0   0   1/1   100.0     0/0   0.0
Kobe Randle            13    2    2    0   0   1/2    50.0     0/0   0.0

TEAM: FG: 7/16 (43.8%), 3PT: 2/6 (33.3%), REB: 13 (3 off, 10 def), AST: 3, TO: 4
TEAM FOULS: 7 [Team_005 in BONUS]

================================================================================

================================================================================
                       4TH QUARTER - Team_005 vs Team_031                       
================================================================================

[12:00] Team_005 possession (Score: 81-79)
Derrick Allen drives and kicks out. Derrick Allen attempts a Midrange. Contested by Gary Morant (3.7 feet, ZONE). DERRICK ALLEN MAKES IT!
Score: 83-79

[11:48] Team_031 possession (Score: 83-79)
Immanuel James attempts a 3Pt. Contested by Cade Markkanen (3.4 feet, MAN). IMMANUEL JAMES MAKES IT! Assist: Luka Sabonis
Score: 83-82

[11:33] Team_005 possession (Score: 83-82)
Cade Markkanen attempts a Midrange. Contested by Pau Irving (2.9 feet, ZONE). Cade Markkanen misses. Offensive rebound by Jalen Rozier! Jalen Rozier kicks it out.

[11:15] Team_005 possession (Score: 83-82)
Brandon George attempts a 3Pt. Wide open! Pau Irving is 7.3 feet away. [ZONE] BRANDON GEORGE MAKES IT! Assist: Jalen Rozier
Score: 86-82

[11:02] Team_031 possession (Score: 86-82)
Gary Morant attempts a 3Pt. Contested by Derrick Allen (5.2 feet, ZONE). Gary Morant misses. Rebound secured by Derrick Allen.

[10:51] Team_005 possession (Score: 86-82)
Brandon George drives and kicks out. Derrick Allen attempts a 3Pt. Contested by Pau Irving (6.0 feet, MAN). Derrick Allen misses. Rebound secured by Luka Sabonis.

[10:38] Team_031 possession (Score: 86-82)
FOUL! Reach-in foul on Derrick Allen during the drive. [Team fouls: 1] No free throws, side out. (Derrick Allen: 1 personal fouls)

[10:25] Team_031 possession (Score: 86-82)
Pau Irving makes the Midrange and draws the foul on Jalen Rozier! And-1! Pau Irving to the line for 1. [Team fouls: 2] (Jalen Rozier: 1 personal fouls)   FT 1/1: GOOD Pau Irving makes 1/1 from the line.
Score: 86-85

[10:06] Team_005 possession (Score: 86-85)
Jalen Rozier attempts a 3Pt. Contested by Immanuel James (5.5 feet, MAN). Jalen Rozier misses. Rebound secured by Immanuel James.

[09:48] Team_031 possession (Score: 86-85)
FOUL! Shooting foul on Jalen Rozier. Pau Irving to the line for 3 free throws. [Team fouls: 3] (Jalen Rozier: 2 personal fouls)   FT 1/3: MISS   FT 2/3: GOOD   FT 3/3: GOOD Pau Irving makes 2/3 from the line.
Score: 86-87

[09:32] Team_005 possession (Score: 86-87)
Derrick Allen attempts a 3Pt. Contested by Pau Irving (5.7 feet, MAN). DERRICK ALLEN MAKES IT! Assist: Cade Markkanen
Score: 89-87

[09:21] Team_031 possession (Score: 89-87)
Pau Irving attempts a 3Pt. Contested by Derrick Allen (5.4 feet, MAN). PAU IRVING MAKES IT! Assist: Luka Sabonis
Score: 89-90

[09:07] Team_005 possession (Score: 89-90)
Anthony Rozier loses control! Ball rolls out of bounds! TURNOVER! (dead ball)

[09:07] Substitution (Team_005): Brandon George OUT → Blake O'Neal IN (stamina_rule2)

[09:07] Substitution (Team_005): Anthony Rozier OUT → Draymond Smith IN (stamina_rule2)

[09:07] Substitution (Team_005): Derrick Allen OUT → Lauri Wade IN (stamina_rule2)

[09:07] Substitution (Team_005): Jalen Rozier OUT → Isaiah Durant IN (stamina_rule2)

[09:07] Substitution (Team_005): Cade Markkanen OUT → Zion Parker IN (stamina_rule2)

[09:07] Substitution (Team_031): Shai Durant OUT → Kevin Morant IN (stamina_rule2)

[09:07] Substitution (Team_031): Gary Morant OUT → Isaiah Ingram IN (stamina_rule2)

[09:07] Substitution (Team_031): Pau Irving OUT → Miles Stewart IN (stamina_rule2)

[09:07] Substitution (Team_031): Immanuel James OUT → Kobe Randle IN (stamina_rule2)

[09:07] Substitution (Team_031): Luka Sabonis OUT → Jimmy Poole IN (stamina_rule2)

[08:50] Team_031 possession (Score: 89-90)
Isaiah Ingram attempts a Layup. Heavily contested by Zion Parker (0.5 feet, ZONE)! Isaiah Ingram misses. Rebound secured by Zion Parker.

[08:33] Team_005 possession (Score: 89-90)
Zion Parker drives to the basket... Zion Parker loses the ball! Stripped by Jimmy Poole! TURNOVER! (live ball)

[08:15] Team_031 possession (Score: 89-90)
Jimmy Poole attempts a 3Pt. Heavily contested by Zion Parker (1.5 feet, MAN)! Jimmy Poole misses. Rebound secured by Zion Parker.

[08:00] Team_005 possession (Score: 89-90)
Zion Parker attempts a Layup. BLOCKED BY ISAIAH INGRAM! Ball is loose! Offensive rebound by Zion Parker! Zion Parker kicks it out.

[07:49] Team_005 possession (Score: 89-90)
Draymond Smith attempts a Layup. Heavily contested by Isaiah Ingram (1.8 feet, MAN)! DRAYMOND SMITH MAKES IT! Assist: Lauri Wade
Score: 91-90

[07:35] Team_031 possession (Score: 91-90)
Kevin Morant attempts a 3Pt. Wide open! Blake O'Neal is 7.0 feet away. [ZONE] KEVIN MORANT MAKES IT! Assist: Jimmy Poole
Score: 91-93

[07:17] Team_005 possession (Score: 91-93)
Blake O'Neal attempts a 3Pt. Wide open! Kevin Morant is 7.0 feet away. [MAN] Blake O'Neal misses. Rebound secured by Jimmy Poole.

[07:03] Team_031 possession (Score: 91-93)
Kobe Randle attempts a 3Pt. Contested by Isaiah Durant (4.9 feet, MAN). KOBE RANDLE MAKES IT! Assist: Miles Stewart
Score: 91-96

[06:52] Team_005 possession (Score: 91-96)
Blake O'Neal attempts a Midrange. Heavily contested by Kevin Morant (1.8 feet, MAN)! Blake O'Neal misses. Rebound secured by Kobe Randle.

[06:38] Team_031 possession (Score: 91-96)
Jimmy Poole drives and kicks out. Miles Stewart attempts a 3Pt. Contested by Lauri Wade (5.8 feet, ZONE). Miles Stewart misses. Rebound secured by Draymond Smith.

[06:26] Team_005 possession (Score: 91-96)
Blake O'Neal drives, Kevin Morant stays with him. Blake O'Neal attempts a Dunk. Contested by Kevin Morant (2.1 feet, MAN). BLAKE O'NEAL MAKES IT! Assist: Draymond Smith
Score: 93-96

[06:14] Team_031 possession (Score: 93-96)
Miles Stewart attempts a 3Pt. Contested by Blake O'Neal (5.7 feet, ZONE). Miles Stewart misses. Rebound secured by Zion Parker.

[06:02] Team_005 possession (Score: 93-96)
FOUL! Shooting foul on Miles Stewart. Draymond Smith to the line for 2 free throws. [Team fouls: 2] (Miles Stewart: 1 personal fouls)   FT 1/2: MISS   FT 2/2: GOOD Draymond Smith makes 1/2 from the line.
Score: 94-96

[05:47] Team_031 possession (Score: 94-96)
Miles Stewart attempts a 3Pt. Wide open! Blake O'Neal is 6.6 feet away. [ZONE] Miles Stewart misses. Offensive rebound by Jimmy Poole! Jimmy Poole kicks it out.

[05:34] Team_031 possession (Score: 94-96)
Kobe Randle attempts a 3Pt. Heavily contested by Isaiah Durant (1.0 feet, MAN)! Kobe Randle misses. Rebound secured by Draymond Smith.

[05:22] Team_005 possession (Score: 94-96)
Lauri Wade attempts a 3Pt. Contested by Isaiah Ingram (5.3 feet, ZONE). Lauri Wade misses. Rebound secured by Kobe Randle.

[05:07] Team_031 possession (Score: 94-96)
Jimmy Poole drives and kicks out. Miles Stewart attempts a Midrange. Contested by Isaiah Durant (5.9 feet, ZONE). Miles Stewart misses. Offensive rebound by Jimmy Poole! Jimmy Poole kicks it out.

[04:52] Team_031 possession (Score: 94-96)
Jimmy Poole attempts a Midrange. Contested by Zion Parker (2.9 feet, MAN). Jimmy Poole misses. Offensive rebound by Jimmy Poole! Jimmy Poole kicks it out.

[04:35] Team_031 possession (Score: 94-96)
Jimmy Poole attempts a Layup. Heavily contested by Zion Parker (0.5 feet, MAN)! JIMMY POOLE MAKES IT! Assist: Miles Stewart
Score: 94-98

[04:20] Team_005 possession (Score: 94-98)
Zion Parker attempts a Midrange. Contested by Isaiah Ingram (5.0 feet, ZONE). ZION PARKER MAKES IT!
Score: 96-98

[04:09] Team_031 possession (Score: 96-98)
Isaiah Ingram throws a bad pass out of bounds! TURNOVER! (dead ball)

[03:53] Team_005 possession (Score: 96-98)
Blake O'Neal attempts a 3Pt. Contested by Kevin Morant (4.9 feet, MAN). Blake O'Neal misses. Offensive rebound by Zion Parker! Zion Parker's putback is no good. Rebound secured by Jimmy Poole.

[03:38] Team_031 possession (Score: 96-98)
Kobe Randle attempts a Layup. Heavily contested by Zion Parker (0.5 feet, ZONE)! KOBE RANDLE MAKES IT! Assist: Miles Stewart
Score: 96-100

[03:23] Team_005 possession (Score: 96-100)
Isaiah Durant drives and kicks out. Draymond Smith attempts a 3Pt. Wide open! Miles Stewart is 6.0 feet away. [ZONE] DRAYMOND SMITH MAKES IT! Assist: Blake O'Neal
Score: 99-100

[03:12] Team_031 possession (Score: 99-100)
Jimmy Poole drives and kicks out. Kevin Morant attempts a 3Pt. Contested by Blake O'Neal (5.4 feet, MAN). Kevin Morant misses. Rebound secured by Zion Parker.

[03:03] Team_005 possession (Score: 99-100)
Draymond Smith drives to the basket... Draymond Smith throws a bad pass! Stolen by Isaiah Ingram! TURNOVER! (live ball)

[02:51] Team_031 possession (Score: 99-100)
Jimmy Poole attempts a Midrange. Heavily contested by Zion Parker (1.3 feet, MAN)! JIMMY POOLE MAKES IT! Assist: Miles Stewart
Score: 99-102

[02:37] Team_005 possession (Score: 99-102)
Isaiah Durant drives to the basket... Isaiah Durant throws a bad pass out of bounds! TURNOVER! (dead ball)

[02:20] Team_031 possession (Score: 99-102)
Kobe Randle attempts a 3Pt. Contested by Blake O'Neal (6.0 feet, ZONE). Kobe Randle misses. Rebound secured by Draymond Smith.

[02:10] Team_005 possession (Score: 99-102)
Isaiah Durant drives to the basket... FOUL! Offensive foul on Isaiah Durant! Jimmy Poole drew the charge! [Team fouls: 4] (Isaiah Durant: 1 personal fouls) TURNOVER! (dead ball)

[01:52] Team_031 possession (Score: 99-102)
FOUL! Shooting foul on Zion Parker. Jimmy Poole to the line for 2 free throws. [BONUS: 5 team fouls] (Zion Parker: 1 personal fouls)   FT 1/2: GOOD   FT 2/2: GOOD Jimmy Poole makes 2/2 from the line.
Score: 99-104

[01:40] Team_005 possession (Score: 99-104)
Zion Parker drives, Jimmy Poole stays with him. Zion Parker attempts a Dunk. Contested by Jimmy Poole (3.5 feet, MAN). Zion Parker misses. Rebound secured by Isaiah Ingram.

[01:28] Team_031 possession (Score: 99-104)
Isaiah Ingram makes the Layup and draws the foul on Zion Parker! And-1! Isaiah Ingram to the line for 1. [BONUS: 6 team fouls] (Zion Parker: 2 personal fouls)   FT 1/1: GOOD Isaiah Ingram makes 1/1 from the line.
Score: 99-107

[01:17] Team_005 possession (Score: 99-107)
Isaiah Durant attempts a 3Pt. Contested by Kobe Randle (3.8 feet, MAN). ISAIAH DURANT MAKES IT! Assist: Lauri Wade
Score: 102-107

[01:02] Team_031 possession (Score: 102-107)
Kevin Morant attempts a Midrange. Contested by Isaiah Durant (5.2 feet, ZONE). KEVIN MORANT MAKES IT! Assist: Kobe Randle
Score: 102-109

[00:48] Team_005 possession (Score: 102-109)
Lauri Wade commits a violation (traveling/carry)! TURNOVER! (dead ball)

[00:31] Team_031 possession (Score: 102-109)
Kobe Randle attempts a Layup. Wide open! Zion Parker is 6.4 feet away. [ZONE] KOBE RANDLE MAKES IT! Assist: Jimmy Poole
Score: 102-111

[00:16] Team_005 possession (Score: 102-111)
Isaiah Durant makes the Layup and draws the foul on Jimmy Poole! And-1! Isaiah Durant to the line for 1. [Team fouls: 3] (Jimmy Poole: 1 personal fouls)   FT 1/1: GOOD Isaiah Durant makes 1/1 from the line.
Score: 105-111

[00:05] Team_031 possession (Score: 105-111)
Jimmy Poole drives and kicks out. Jimmy Poole attempts a 3Pt. Wide open! Zion Parker is 7.6 feet away. [MAN] Jimmy Poole misses. Offensive rebound by Jimmy Poole! Jimmy Poole kicks it out.

================================================================================
                              4TH QUARTER COMPLETE                              
================================================================================

4TH QUARTER SCORE: Team_005 24, Team_031 32

BOX SCORE:
================================================================================

Team_005
--------------------------------------------------------------------------------
Player                MIN  PTS  REB  AST  TO      FG   FG%      3P   3P%
--------------------------------------------------------------------------------
Draymond Smith         22    6    3    1   0   3/3   100.0     0/0   0.0
Isaiah Durant          18    6    0    0   0   2/2   100.0     0/0   0.0
Derrick Allen          30    5    1    0   0   2/2   100.0     0/0   0.0
Brandon George         26    3    0    0   0   1/2    50.0     0/0   0.0
Zion Parker            22    2    5    0   0   1/2    50.0     0/0   0.0
Blake O'Neal           22    2    0    1   0   1/4    25.0     0/0   0.0
Jalen Rozier           30    0    1    1   0   0/1     0.0     0/0   0.0
Cade Markkanen         26    0    0    1   0   0/0     0.0     0/0   0.0
Lauri Wade             18    0    0    2   0   0/1     0.0     0/0   0.0

TEAM: FG: 10/17 (58.8%), 3PT: 3/7 (42.9%), REB: 11 (3 off, 8 def), AST: 6, TO: 6
TEAM FOULS: 6 [Team_031 in BONUS]


Team_031
--------------------------------------------------------------------------------
Player                MIN  PTS  REB  AST  TO      FG   FG%      3P   3P%
--------------------------------------------------------------------------------
Pau Irving             30    8    0    0   0   3/3   100.0     0/0   0.0
Kobe Randle            22    7    2    1   0   3/5    60.0     0/0   0.0
Jimmy Poole            18    6    6    2   0   3/6    50.0     0/0   0.0
Kevin Morant           18    5    0    0   0   2/2   100.0     0/0   0.0
Immanuel James         26    3    1    0   0   1/1   100.0     0/0   0.0
Isaiah Ingram          18    3    1    0   0   1/2    50.0     0/0   0.0
Luka Sabonis           30    0    1    2   0   0/0     0.0     0/0   0.0
Gary Morant            30    0    0    0   0   0/1     0.0     0/0   0.0
Miles Stewart          18    0    0    4   0   0/1     0.0     0/0   0.0

TEAM: FG: 13/21 (61.9%), 3PT: 5/10 (50.0%), REB: 10 (4 off, 6 def), AST: 9, TO: 1
TEAM FOULS: 3

================================================================================

================================================================================
                               FULL GAME COMPLETE                               
================================================================================

FINAL SCORE: Team_005 105, Team_031 111

SCORING BY QUARTER:
--------------------------------------------------------------------------------
Team                     Q1     Q2     Q3     Q4    FINAL
--------------------------------------------------------------------------------
Team_005                 34     29     18     24      105
Team_031                 31     31     17     32      111
--------------------------------------------------------------------------------

FULL GAME BOX SCORE:
================================================================================

Team_005
--------------------------------------------------------------------------------
Player                MIN  PTS  REB  AST  TO      FG   FG%      3P   3P%      FT STL BLK
--------------------------------------------------------------------------------
Derrick Allen          30   13    6    4   4   4/7    57.1   2/3    66.7   0/1     1   1
Jalen Rozier           30    8    9    3   1   4/8    50.0   2/4    50.0   3/3     0   0
Brandon George         26   12    0    2   2   3/7    42.9   2/5    40.0   1/1     0   0
Anthony Rozier         26    5    3    1   4   4/10   40.0   1/5    20.0   0/0     0   0
Cade Markkanen         26   14    8    1   2   6/7    85.7   1/1   100.0   5/6     1   0
Blake O'Neal           22   13    1    2   2   4/9    44.4   1/4    25.0   1/1     0   0
Draymond Smith         22   18    6    1   1   6/7    85.7   3/3   100.0   2/3     0   0
Zion Parker            22    7    8    2   2   4/5    80.0   0/0     0.0   3/3     0   0
Lauri Wade             18    3    1    3   2   1/4    25.0   0/2     0.0   1/1     0   0
Isaiah Durant          18   10    0    0   1   6/6   100.0   1/1   100.0   5/7     0   0

TEAM: FG: 42/70 (60.0%), 3PT: 13/28 (46.4%), REB: 44 (11 off, 33 def), AST: 19, TO: 21


Team_031
--------------------------------------------------------------------------------
Player                MIN  PTS  REB  AST  TO      FG   FG%      3P   3P%      FT STL BLK
--------------------------------------------------------------------------------
Shai Durant            30   13    0    0   2   5/7    71.4   2/3    66.7   1/1     0   1
Gary Morant            30    8    3    2   0   6/11   54.5   3/5    60.0   1/2     0   1
Pau Irving             30   15    0    1   2   6/9    66.7   2/5    40.0   4/5     1   0
Luka Sabonis           30   15   10    7   2   4/7    57.1   1/4    25.0   6/6     0   0
Immanuel James         26   11    8    2   1   5/9    55.6   3/5    60.0   0/0     3   0
Kobe Randle            22   12    7    1   0   5/10   50.0   2/4    50.0   1/2     1   0
Kevin Morant           18   12    0    0   0   3/7    42.9   2/4    50.0   1/1     0   0
Isaiah Ingram          18    6    2    1   2   2/4    50.0   0/0     0.0   2/2     1   1
Miles Stewart          18    5    0    6   1   1/4    25.0   1/3    33.3   0/1     0   0
Jimmy Poole            18   10    7    2   0   6/10   60.0   0/2     0.0   7/8     1   0

TEAM: FG: 43/78 (55.1%), 3PT: 16/35 (45.7%), REB: 35 (12 off, 23 def), AST: 22, TO: 10

================================================================================
