================================================================================
                        FULL GAME - Team_031 vs Team_093                        
================================================================================

================================================================================
                       1ST QUARTER - Team_031 vs Team_093                       
================================================================================

[12:00] Team_031 possession (Score: 0-0)
Immanuel James makes the Dunk and draws the foul on Vince Barnes! And-1! Immanuel James to the line for 1. [Team fouls: 1] (Vince Barnes: 1 personal fouls)   FT 1/1: GOOD Immanuel James makes 1/1 from the line.
Score: 3-0

[11:46] Team_093 possession (Score: 3-0)
Ben Cunningham loses the ball! Stripped by Luka Sabonis! TURNOVER! (live ball)

[11:34] Team_031 possession (Score: 3-0)
Luka Sabonis loses control! Ball rolls out of bounds! TURNOVER! (dead ball)

[11:22] Team_093 possession (Score: 3-0)
Trae Westbrook attempts a 3Pt. Contested by Pau Irving (4.6 feet, ZONE). Trae Westbrook misses. Rebound secured by Immanuel James.

[11:06] Team_031 possession (Score: 3-0)
Gary Morant commits a violation (traveling/carry)! TURNOVER! (dead ball)

[10:49] Team_093 possession (Score: 3-0)
Trae Westbrook attempts a 3Pt. Wide open! Pau Irving is 7.0 feet away. [ZONE] Trae Westbrook misses. Offensive rebound by Carmelo Wagner! Carmelo Wagner kicks it out.

[10:30] Team_093 possession (Score: 3-0)
Damian Williamson drives and kicks out. Trae Westbrook attempts a Midrange. Contested by Pau Irving (5.2 feet, ZONE). Trae Westbrook misses. Rebound secured by Luka Sabonis.

[10:16] Team_031 possession (Score: 3-0)
Immanuel James attempts a 3Pt. Contested by Carmelo Wagner (4.0 feet, ZONE). Immanuel James misses. FOUL! Loose ball foul on Vince Barnes during the rebound battle. [Team fouls: 2] No free throws, side out. (Vince Barnes: 2 personal fouls)

[10:06] Team_031 possession (Score: 3-0)
Gary Morant attempts a 3Pt. Contested by Carmelo Wagner (4.9 feet, ZONE). Gary Morant misses. Rebound secured by Ben Cunningham.

[09:51] Team_093 possession (Score: 3-0)
Carmelo Wagner attempts a 3Pt. Contested by Pau Irving (5.3 feet, ZONE). Carmelo Wagner misses. Rebound secured by Gary Morant.

[09:37] Team_031 possession (Score: 3-0)
Gary Morant attempts a Layup. Wide open! Trae Westbrook is 6.7 feet away. [MAN] GARY MORANT MAKES IT! Assist: Shai Durant
Score: 5-0

[09:22] Team_093 possession (Score: 5-0)
Damian Williamson attempts a 3Pt. Contested by Pau Irving (6.0 feet, ZONE). Damian Williamson misses. FOUL! Loose ball foul on Gary Morant during the rebound battle. [Team fouls: 1] No free throws, side out. (Gary Morant: 1 personal fouls)

[09:08] Team_093 possession (Score: 5-0)
Carmelo Wagner throws a bad pass! Stolen by Pau Irving! TURNOVER! (live ball)

[08:54] Team_031 possession (Score: 5-0)
Gary Morant attempts a 3Pt. Wide open! Trae Westbrook is 6.7 feet away. [MAN] GARY MORANT MAKES IT! Assist: Luka Sabonis
Score: 8-0

[08:43] Team_093 possession (Score: 8-0)
Damian Williamson drives, Immanuel James stays with him. Damian Williamson attempts a Layup. Heavily contested by Immanuel James (0.7 feet, ZONE)! Damian Williamson misses. Rebound secured by Luka Sabonis.

[08:27] Team_031 possession (Score: 8-0)
FOUL! Holding foul on Trae Westbrook. [Team fouls: 3] No free throws, side out. (Trae Westbrook: 1 personal fouls)

[08:10] Team_031 possession (Score: 8-0)
Immanuel James attempts a Midrange. Contested by Carmelo Wagner (3.0 feet, ZONE). Immanuel James misses. Rebound secured by Ben Cunningham.

[08:00] Team_093 possession (Score: 8-0)
Trae Westbrook attempts a 3Pt. Contested by Gary Morant (3.8 feet, MAN). TRAE WESTBROOK MAKES IT! Assist: Carmelo Wagner
Score: 8-3

[07:44] Team_031 possession (Score: 8-3)
Pau Irving attempts a Midrange. Contested by Trae Westbrook (2.4 feet, ZONE). Pau Irving misses. Rebound secured by Carmelo Wagner.

[07:28] Team_093 possession (Score: 8-3)
Trae Westbrook drives and kicks out. Ben Cunningham attempts a 3Pt. Contested by Luka Sabonis (6.0 feet, MAN). Ben Cunningham misses. Offensive rebound by Carmelo Wagner! Carmelo Wagner kicks it out.

[07:16] Team_093 possession (Score: 8-3)
Trae Westbrook attempts a Midrange. Contested by Pau Irving (3.1 feet, ZONE). TRAE WESTBROOK MAKES IT!
Score: 8-5

[07:07] Team_031 possession (Score: 8-5)
Shai Durant attempts a 3Pt. Contested by Damian Williamson (5.1 feet, MAN). Shai Durant misses. Rebound secured by Ben Cunningham.

[06:52] Team_093 possession (Score: 8-5)
Ben Cunningham makes the Dunk and draws the foul on Shai Durant! And-1! Ben Cunningham to the line for 1. [Team fouls: 2] (Shai Durant: 1 personal fouls)   FT 1/1: GOOD Ben Cunningham makes 1/1 from the line.
Score: 8-8

[06:37] Team_031 possession (Score: 8-8)
Luka Sabonis drives and kicks out. Immanuel James attempts a 3Pt. Contested by Vince Barnes (4.4 feet, ZONE). Immanuel James misses. Rebound secured by Vince Barnes.

[06:25] Team_093 possession (Score: 8-8)
FOUL! Offensive foul on Vince Barnes! Immanuel James drew the charge! [Team fouls: 4] (Vince Barnes: 3 personal fouls) TURNOVER! (dead ball)

[06:16] Team_031 possession (Score: 8-8)
Immanuel James attempts a 3Pt. Heavily contested by Vince Barnes (1.7 feet, MAN)! IMMANUEL JAMES MAKES IT! Assist: Gary Morant
Score: 11-8

[06:00] Team_093 possession (Score: 11-8)
Ben Cunningham drives and kicks out. Vince Barnes attempts a Midrange. Contested by Immanuel James (5.3 feet, MAN). Vince Barnes misses. Rebound secured by Immanuel James.

[05:46] Team_031 possession (Score: 11-8)
Pau Irving attempts a Layup. BLOCKED BY CARMELO WAGNER! Ball is loose! Offensive rebound by Immanuel James! Immanuel James kicks it out.

[05:33] Team_031 possession (Score: 11-8)
Gary Morant attempts a Midrange. Wide open! Trae Westbrook is 7.5 feet away. [MAN] GARY MORANT MAKES IT! Assist: Immanuel James
Score: 13-8

[05:19] Team_093 possession (Score: 13-8)
Carmelo Wagner attempts a Midrange. Contested by Pau Irving (4.3 feet, MAN). CARMELO WAGNER MAKES IT! Assist: Vince Barnes
Score: 13-10

[05:06] Team_031 possession (Score: 13-10)
Shai Durant attempts a 3Pt. Wide open! Damian Williamson is 6.6 feet away. [MAN] SHAI DURANT MAKES IT! Assist: Pau Irving
Score: 16-10

[04:53] Team_093 possession (Score: 16-10)
Ben Cunningham drives, picks up Immanuel James. Help arrives from Shai Durant! Ben Cunningham attempts a Layup. Contested by Shai Durant (2.9 feet, ZONE). Ben Cunningham misses. Rebound secured by Gary Morant.

[04:38] Team_031 possession (Score: 16-10)
Immanuel James attempts a Layup. Contested by Ben Cunningham (4.1 feet, ZONE). IMMANUEL JAMES MAKES IT! Assist: Pau Irving
Score: 18-10

[04:20] Team_093 possession (Score: 18-10)
FOUL! Shooting foul on Luka Sabonis. Ben Cunningham to the line for 2 free throws. [Team fouls: 3] (Luka Sabonis: 1 personal fouls)   FT 1/2: GOOD   FT 2/2: GOOD Ben Cunningham makes 2/2 from the line.
Score: 18-12

[04:04] Team_031 possession (Score: 18-12)
Luka Sabonis attempts a 3Pt. Contested by Carmelo Wagner (3.5 feet, ZONE). Luka Sabonis misses. Offensive rebound by Immanuel James! Immanuel James's putback is no good. Rebound secured by Ben Cunningham.

[03:45] Team_093 possession (Score: 18-12)
Carmelo Wagner attempts a 3Pt. Wide open! Pau Irving is 6.1 feet away. [ZONE] Carmelo Wagner misses. Offensive rebound by Ben Cunningham! Ben Cunningham kicks it out.

[03:28] Team_093 possession (Score: 18-12)
Vince Barnes commits a violation (traveling/carry)! TURNOVER! (dead ball)

[03:28] Substitution (Team_031): Immanuel James OUT → Kobe Randle IN (stamina_rule2)

[03:28] Substitution (Team_093): Damian Williamson OUT → Shaquille George IN (stamina_rule2)

[03:28] Substitution (Team_093): Ben Cunningham OUT → Cade O'Neal IN (stamina_rule2)

[03:12] Team_031 possession (Score: 18-12)
Gary Morant attempts a 3Pt. Wide open! Trae Westbrook is 6.5 feet away. [MAN] Gary Morant misses. Rebound secured by Cade O'Neal.

[02:58] Team_093 possession (Score: 18-12)
FOUL! Shooting foul on Luka Sabonis. Shaquille George to the line for 2 free throws. [Team fouls: 4] (Luka Sabonis: 2 personal fouls)   FT 1/2: GOOD   FT 2/2: GOOD Shaquille George makes 2/2 from the line.
Score: 18-14

[02:45] Team_031 possession (Score: 18-14)
FOUL! Reach-in foul on Cade O'Neal during the drive. [IN THE BONUS! 5 team fouls] Luka Sabonis to the line for 2 free throws. (Cade O'Neal: 1 personal fouls)   FT 1/2: GOOD   FT 2/2: GOOD Luka Sabonis makes 2/2 from the line.
Score: 20-14

[02:30] Team_093 possession (Score: 20-14)
Trae Westbrook drives, Gary Morant stays with him. Trae Westbrook attempts a Dunk. Contested by Gary Morant (3.5 feet, MAN). TRAE WESTBROOK MAKES IT! Assist: Vince Barnes
Score: 20-16

[02:13] Team_031 possession (Score: 20-16)
Shai Durant attempts a Midrange. Wide open! Trae Westbrook is 6.4 feet away. [ZONE] SHAI DURANT MAKES IT! Assist: Pau Irving
Score: 22-16

[01:54] Team_093 possession (Score: 22-16)
Trae Westbrook attempts a 3Pt. Contested by Gary Morant (3.1 feet, MAN). Trae Westbrook misses. Rebound secured by Luka Sabonis.

[01:40] Team_031 possession (Score: 22-16)
Shai Durant attempts a 3Pt. Contested by Carmelo Wagner (4.6 feet, ZONE). Shai Durant misses. Rebound secured by Carmelo Wagner.

[01:25] Team_093 possession (Score: 22-16)
Vince Barnes drives to the basket... Vince Barnes commits a violation (traveling/carry)! TURNOVER! (dead ball)

[01:25] Substitution (Team_031): Shai Durant OUT → Kevin Morant IN (stamina_rule2)

[01:25] Substitution (Team_031): Gary Morant OUT → Isaiah Ingram IN (stamina_rule2)

[01:25] Substitution (Team_031): Pau Irving OUT → Miles Stewart IN (stamina_rule2)

[01:25] Substitution (Team_031): Luka Sabonis OUT → Jimmy Poole IN (stamina_rule2)

[01:25] Substitution (Team_093): Trae Westbrook OUT → Immanuel Cunningham IN (stamina_rule2)

[01:25] Substitution (Team_093): Carmelo Wagner OUT → Lauri Parker IN (stamina_rule2)

[01:25] Substitution (Team_093): Vince Barnes OUT → Kobe Murray IN (stamina_rule2)

[01:07] Team_031 possession (Score: 22-16)
FOUL! Offensive foul on Kevin Morant! Shaquille George drew the charge! [Team fouls: 5] (Kevin Morant: 1 personal fouls) TURNOVER! (dead ball)

[00:52] Team_093 possession (Score: 22-16)
Cade O'Neal drives and kicks out. Cade O'Neal attempts a 3Pt. Wide open! Miles Stewart is 6.4 feet away. [ZONE] Cade O'Neal misses. Rebound secured by Jimmy Poole.

[00:38] Team_031 possession (Score: 22-16)
Jimmy Poole attempts a Midrange. Heavily contested by Kobe Murray (0.5 feet, MAN)! Jimmy Poole misses. Offensive rebound by Jimmy Poole! Jimmy Poole kicks it out.

[00:23] Team_031 possession (Score: 22-16)
Kobe Randle makes the Layup and draws the foul on Kobe Murray! And-1! Kobe Randle to the line for 1. [BONUS: 6 team fouls] (Kobe Murray: 1 personal fouls)   FT 1/1: GOOD Kobe Randle makes 1/1 from the line.
Score: 25-16

[00:08] Team_093 possession (Score: 25-16)
Immanuel Cunningham attempts a 3Pt. Contested by Miles Stewart (4.2 feet, ZONE). IMMANUEL CUNNINGHAM MAKES IT! Assist: Cade O'Neal
Score: 25-19

================================================================================
                              1ST QUARTER COMPLETE                              
================================================================================

1ST QUARTER SCORE: Team_031 25, Team_093 19

BOX SCORE:
================================================================================

Team_031
--------------------------------------------------------------------------------
Player                MIN  PTS  REB  AST  TO      FG   FG%      3P   3P%
--------------------------------------------------------------------------------
Immanuel James          9    8    4    1   0   3/4    75.0     0/0   0.0
Gary Morant            11    7    2    1   0   3/5    60.0     0/0   0.0
Shai Durant            11    5    0    1   0   2/4    50.0     0/0   0.0
Kobe Randle             3    3    0    0   0   1/1   100.0     0/0   0.0
Luka Sabonis           11    2    3    1   0   1/3    33.3     0/0   0.0
Pau Irving             11    0    0    3   0   0/1     0.0     0/0   0.0
Jimmy Poole             1    0    2    0   0   0/0     0.0     0/0   0.0

TEAM: FG: 10/18 (55.6%), 3PT: 3/8 (37.5%), REB: 12 (4 off, 8 def), AST: 7, TO: 3
TEAM FOULS: 5 [Team_093 in BONUS]


Team_093
--------------------------------------------------------------------------------
Player                MIN  PTS  REB  AST  TO      FG   FG%      3P   3P%
--------------------------------------------------------------------------------
Trae Westbrook         11    7    0    0   0   3/5    60.0     0/0   0.0
Ben Cunningham          9    5    5    0   0   2/4    50.0     0/0   0.0
Immanuel Cunningham     1    3    0    0   0   1/1   100.0     0/0   0.0
Carmelo Wagner         11    2    5    1   0   1/2    50.0     0/0   0.0
Shaquille George        3    2    0    0   0   1/1   100.0     0/0   0.0
Damian Williamson       9    0    0    0   0   0/2     0.0     0/0   0.0
Vince Barnes           11    0    1    2   0   0/0     0.0     0/0   0.0
Cade O'Neal             3    0    1    1   0   0/1     0.0     0/0   0.0

TEAM: FG: 8/16 (50.0%), 3PT: 2/5 (40.0%), REB: 11 (4 off, 7 def), AST: 4, TO: 5
TEAM FOULS: 6 [Team_031 in BONUS]

================================================================================

================================================================================
                       2ND QUARTER - Team_031 vs Team_093                       
================================================================================

[12:00] Team_031 possession (Score: 25-19)
Luka Sabonis drives to the basket... Luka Sabonis throws a bad pass! Stolen by Ben Cunningham! TURNOVER! (live ball)

[11:44] Team_093 possession (Score: 25-19)
Carmelo Wagner attempts a Midrange. Contested by Pau Irving (5.1 feet, MAN). Carmelo Wagner misses. Offensive rebound by Carmelo Wagner! Carmelo Wagner kicks it out.

[11:30] Team_093 possession (Score: 25-19)
Damian Williamson attempts a 3Pt. Contested by Pau Irving (3.5 feet, ZONE). Damian Williamson misses. FOUL! Loose ball foul on Luka Sabonis during the rebound battle. [Team fouls: 1] No free throws, side out. (Luka Sabonis: 1 personal fouls)

[11:16] Team_093 possession (Score: 25-19)
Damian Williamson attempts a Midrange. Contested by Pau Irving (2.9 feet, ZONE). DAMIAN WILLIAMSON MAKES IT! Assist: Ben Cunningham
Score: 25-21

[11:01] Team_031 possession (Score: 25-21)
Immanuel James attempts a Midrange. Wide open! Vince Barnes is 7.0 feet away. [MAN] Immanuel James misses. Rebound secured by Ben Cunningham.

[10:48] Team_093 possession (Score: 25-21)
Damian Williamson attempts a 3Pt. Contested by Pau Irving (5.2 feet, ZONE). DAMIAN WILLIAMSON MAKES IT! Assist: Ben Cunningham
Score: 25-24

[10:35] Team_031 possession (Score: 25-24)
Luka Sabonis attempts a Midrange. Wide open! Ben Cunningham is 6.1 feet away. [MAN] Luka Sabonis misses. Offensive rebound by Luka Sabonis! Luka Sabonis puts it back in!
Score: 27-24

[10:20] Team_093 possession (Score: 27-24)
Ben Cunningham drives, picks up Luka Sabonis. Help arrives from Shai Durant! Ben Cunningham attempts a Layup. Heavily contested by Shai Durant (1.8 feet, MAN)! BEN CUNNINGHAM MAKES IT! Assist: Trae Westbrook
Score: 27-26

[10:08] Team_031 possession (Score: 27-26)
Gary Morant attempts a 3Pt. Wide open! Damian Williamson is 8.5 feet away. [ZONE] Gary Morant misses. Rebound secured by Carmelo Wagner.

[09:56] Team_093 possession (Score: 27-26)
Trae Westbrook loses control! Ball rolls out of bounds! TURNOVER! (dead ball)

[09:56] Substitution (Team_031): Shai Durant OUT → Kevin Morant IN (stamina_rule2)

[09:56] Substitution (Team_031): Gary Morant OUT → Isaiah Ingram IN (stamina_rule2)

[09:56] Substitution (Team_031): Pau Irving OUT → Miles Stewart IN (stamina_rule2)

[09:56] Substitution (Team_031): Luka Sabonis OUT → Jimmy Poole IN (stamina_rule2)

[09:56] Substitution (Team_093): Trae Westbrook OUT → Immanuel Cunningham IN (stamina_rule2)

[09:56] Substitution (Team_093): Carmelo Wagner OUT → Lauri Parker IN (stamina_rule2)

[09:56] Substitution (Team_093): Vince Barnes OUT → Kobe Murray IN (stamina_rule2)

[09:39] Team_031 possession (Score: 27-26)
Isaiah Ingram drives and kicks out. Miles Stewart attempts a 3Pt. Contested by Lauri Parker (4.9 feet, MAN). Miles Stewart misses. Offensive rebound by Immanuel James! Immanuel James puts it back in!
Score: 29-26

[09:29] Team_093 possession (Score: 29-26)
Immanuel Cunningham attempts a 3Pt. Contested by Isaiah Ingram (3.2 feet, MAN). Immanuel Cunningham misses. Rebound secured by Jimmy Poole.

[09:15] Team_031 possession (Score: 29-26)
Kevin Morant attempts a 3Pt. Contested by Damian Williamson (5.3 feet, MAN). Kevin Morant misses. Rebound secured by Ben Cunningham.

[09:01] Team_093 possession (Score: 29-26)
FOUL! Shooting foul on Isaiah Ingram. Kobe Murray to the line for 2 free throws. [Team fouls: 2] (Isaiah Ingram: 1 personal fouls)   FT 1/2: GOOD   FT 2/2: GOOD Kobe Murray makes 2/2 from the line.
Score: 29-28

[08:48] Team_031 possession (Score: 29-28)
Immanuel James attempts a 3Pt. Wide open! Kobe Murray is 8.3 feet away. [MAN] IMMANUEL JAMES MAKES IT! Assist: Miles Stewart
Score: 32-28

[08:36] Team_093 possession (Score: 32-28)
FOUL! Shooting foul on Immanuel James. Ben Cunningham to the line for 2 free throws. [Team fouls: 3] (Immanuel James: 1 personal fouls)   FT 1/2: MISS   FT 2/2: GOOD Ben Cunningham makes 1/2 from the line.
Score: 32-29

[08:25] Team_031 possession (Score: 32-29)
Isaiah Ingram attempts a 3Pt. Wide open! Damian Williamson is 6.6 feet away. [ZONE] Isaiah Ingram misses. Rebound secured by Ben Cunningham.

[08:09] Team_093 possession (Score: 32-29)
FOUL! Shooting foul on Immanuel James. Damian Williamson to the line for 2 free throws. [Team fouls: 4] (Immanuel James: 2 personal fouls)   FT 1/2: GOOD   FT 2/2: MISS Damian Williamson makes 1/2 from the line. Rebound secured by Jimmy Poole.
Score: 32-30

[07:56] Team_031 possession (Score: 32-30)
FOUL! Holding foul on Ben Cunningham. [Team fouls: 1] No free throws, side out. (Ben Cunningham: 1 personal fouls)

[07:44] Team_031 possession (Score: 32-30)
Jimmy Poole drives, Kobe Murray stays with him. Jimmy Poole attempts a Layup. Contested by Kobe Murray (4.1 feet, ZONE). JIMMY POOLE MAKES IT! Assist: Immanuel James
Score: 34-30

[07:32] Team_093 possession (Score: 34-30)
Damian Williamson attempts a Layup. Contested by Immanuel James (3.2 feet, ZONE). Damian Williamson misses. Offensive rebound by Kobe Murray! Kobe Murray puts it back in!
Score: 34-32

[07:16] Team_031 possession (Score: 34-32)
Isaiah Ingram attempts a 3Pt. Contested by Lauri Parker (5.0 feet, ZONE). Isaiah Ingram misses. Rebound secured by Kobe Murray.

[07:00] Team_093 possession (Score: 34-32)
Damian Williamson attempts a Layup. Contested by Immanuel James (5.8 feet, ZONE). DAMIAN WILLIAMSON MAKES IT! Assist: Immanuel Cunningham
Score: 34-34

[06:47] Team_031 possession (Score: 34-34)
Jimmy Poole attempts a Midrange. Contested by Immanuel Cunningham (5.7 feet, ZONE). JIMMY POOLE MAKES IT! Assist: Miles Stewart
Score: 36-34

[06:33] Team_093 possession (Score: 36-34)
Lauri Parker loses the ball! Stripped by Miles Stewart! TURNOVER! (live ball)

[06:16] Team_031 possession (Score: 36-34)
Miles Stewart drives, picks up Kobe Murray. Help arrives from Immanuel Cunningham! Miles Stewart attempts a Dunk. Heavily contested by Immanuel Cunningham (1.8 feet, ZONE)! MILES STEWART MAKES IT! Assist: Immanuel James
Score: 38-34

[05:58] Team_093 possession (Score: 38-34)
FOUL! Shooting foul on Isaiah Ingram. Damian Williamson to the line for 2 free throws. [BONUS: 5 team fouls] (Isaiah Ingram: 2 personal fouls)   FT 1/2: MISS   FT 2/2: GOOD Damian Williamson makes 1/2 from the line.
Score: 38-35

[05:41] Team_031 possession (Score: 38-35)
Miles Stewart attempts a Midrange. Contested by Kobe Murray (2.1 feet, ZONE). Miles Stewart misses. Rebound secured by Ben Cunningham.

[05:29] Team_093 possession (Score: 38-35)
Kobe Murray drives and kicks out. Kobe Murray attempts a 3Pt. Contested by Miles Stewart (3.8 feet, ZONE). KOBE MURRAY MAKES IT! Assist: Immanuel Cunningham
Score: 38-38

[05:18] Team_031 possession (Score: 38-38)
Immanuel James makes the Layup and draws the foul on Kobe Murray! And-1! Immanuel James to the line for 1. [Team fouls: 2] (Kobe Murray: 1 personal fouls)   FT 1/1: MISS Immanuel James makes 0/1 from the line. Rebound secured by Ben Cunningham.
Score: 40-38

[05:06] Team_093 possession (Score: 40-38)
Ben Cunningham attempts a Midrange. Wide open! Miles Stewart is 7.7 feet away. [ZONE] Ben Cunningham misses. Rebound secured by Jimmy Poole.

[04:54] Team_031 possession (Score: 40-38)
Immanuel James attempts a Midrange. Contested by Kobe Murray (5.1 feet, ZONE). IMMANUEL JAMES MAKES IT!
Score: 42-38

[04:37] Team_093 possession (Score: 42-38)
Immanuel Cunningham attempts a Midrange. Contested by Isaiah Ingram (5.6 feet, MAN). Immanuel Cunningham misses. Rebound secured by Immanuel James.

[04:23] Team_031 possession (Score: 42-38)
Jimmy Poole attempts a Layup. Contested by Kobe Murray (4.2 feet, MAN). Jimmy Poole misses. FOUL! Loose ball foul on Kobe Murray during the rebound battle. [Team fouls: 3] No free throws, side out. (Kobe Murray: 2 personal fouls)

[04:07] Team_031 possession (Score: 42-38)
Miles Stewart attempts a Midrange. Wide open! Lauri Parker is 6.2 feet away. [MAN] Miles Stewart misses. Rebound secured by Lauri Parker.

[03:50] Team_093 possession (Score: 42-38)
Kobe Murray attempts a Layup. BLOCKED BY IMMANUEL JAMES! Ball is loose! Rebound secured by Immanuel James.

[03:35] Team_031 possession (Score: 42-38)
Kevin Morant attempts a 3Pt. Heavily contested by Damian Williamson (0.6 feet, MAN)! Kevin Morant misses. Rebound secured by Lauri Parker.

[03:16] Team_093 possession (Score: 42-38)
Kobe Murray attempts a Layup. Wide open! Immanuel James is 6.3 feet away. [MAN] KOBE MURRAY MAKES IT! Assist: Immanuel Cunningham
Score: 42-40

[03:04] Team_031 possession (Score: 42-40)
Jimmy Poole drives and kicks out. Kevin Morant attempts a Midrange. Contested by Damian Williamson (5.0 feet, MAN). KEVIN MORANT MAKES IT!
Score: 44-40

[02:48] Team_093 possession (Score: 44-40)
Ben Cunningham attempts a Layup. Contested by Immanuel James (2.7 feet, ZONE). Ben Cunningham misses. Rebound secured by Jimmy Poole.

[02:36] Team_031 possession (Score: 44-40)
FOUL! Shooting foul on Kobe Murray. Immanuel James to the line for 3 free throws. [Team fouls: 4] (Kobe Murray: 3 personal fouls)   FT 1/3: GOOD   FT 2/3: MISS   FT 3/3: GOOD Immanuel James makes 2/3 from the line.
Score: 46-40

[02:22] Team_093 possession (Score: 46-40)
Lauri Parker attempts a 3Pt. Contested by Miles Stewart (4.9 feet, MAN). Lauri Parker misses. Rebound secured by Immanuel James.

[02:07] Team_031 possession (Score: 46-40)
Miles Stewart attempts a 3Pt. Contested by Lauri Parker (4.3 feet, MAN). Miles Stewart misses. Offensive rebound by Isaiah Ingram! Isaiah Ingram kicks it out.

[01:52] Team_031 possession (Score: 46-40)
FOUL! Holding foul on Immanuel Cunningham. [IN THE BONUS! 5 team fouls] Isaiah Ingram to the line for 2 free throws. (Immanuel Cunningham: 1 personal fouls)   FT 1/2: GOOD   FT 2/2: GOOD Isaiah Ingram makes 2/2 from the line.
Score: 48-40

[01:36] Team_093 possession (Score: 48-40)
FOUL! Holding foul on Kevin Morant. [IN THE BONUS! 6 team fouls] Damian Williamson to the line for 2 free throws. (Kevin Morant: 1 personal fouls)   FT 1/2: MISS   FT 2/2: GOOD Damian Williamson makes 1/2 from the line.
Score: 48-41

[01:23] Team_031 possession (Score: 48-41)
Isaiah Ingram attempts a 3Pt. Wide open! Immanuel Cunningham is 6.1 feet away. [MAN] Isaiah Ingram misses. Rebound secured by Ben Cunningham.

[01:12] Team_093 possession (Score: 48-41)
Immanuel Cunningham commits a violation (traveling/carry)! TURNOVER! (dead ball)

[01:12] Substitution (Team_031): Immanuel James OUT → Kobe Randle IN (stamina_rule2)

[01:12] Substitution (Team_093): Damian Williamson OUT → Shaquille George IN (stamina_rule2)

[01:12] Substitution (Team_093): Ben Cunningham OUT → Cade O'Neal IN (stamina_rule2)

[01:00] Team_031 possession (Score: 48-41)
Isaiah Ingram attempts a Layup. Wide open! Immanuel Cunningham is 6.6 feet away. [MAN] ISAIAH INGRAM MAKES IT!
Score: 50-41

[00:46] Team_093 possession (Score: 50-41)
Lauri Parker drives, picks up Kobe Randle. Help arrives from Isaiah Ingram! Lauri Parker attempts a Dunk. Heavily contested by Isaiah Ingram (1.7 feet, ZONE)! LAURI PARKER MAKES IT!
Score: 50-43

[00:28] Team_031 possession (Score: 50-43)
Kobe Randle attempts a 3Pt. Wide open! Kobe Murray is 6.5 feet away. [MAN] KOBE RANDLE MAKES IT! Assist: Kevin Morant
Score: 53-43

[00:11] Team_093 possession (Score: 53-43)
Shaquille George attempts a 3Pt. Wide open! Kevin Morant is 7.6 feet away. [MAN] SHAQUILLE GEORGE MAKES IT! Assist: Lauri Parker
Score: 53-46

================================================================================
                              2ND QUARTER COMPLETE                              
================================================================================

2ND QUARTER SCORE: Team_031 28, Team_093 27

BOX SCORE:
================================================================================

Team_031
--------------------------------------------------------------------------------
Player                MIN  PTS  REB  AST  TO      FG   FG%      3P   3P%
--------------------------------------------------------------------------------
Immanuel James         20    9    5    2   0   4/6    66.7     0/0   0.0
Jimmy Poole            11    4    4    0   0   2/2   100.0     0/0   0.0
Isaiah Ingram          11    4    1    0   0   2/5    40.0     0/0   0.0
Kobe Randle             4    3    0    0   0   1/1   100.0     0/0   0.0
Luka Sabonis           13    2    1    0   0   1/1   100.0     0/0   0.0
Kevin Morant           11    2    0    1   0   1/3    33.3     0/0   0.0
Miles Stewart          11    2    0    2   0   1/3    33.3     0/0   0.0
Gary Morant            13    0    0    0   0   0/1     0.0     0/0   0.0

TEAM: FG: 12/22 (54.5%), 3PT: 3/9 (33.3%), REB: 11 (4 off, 7 def), AST: 5, TO: 1
TEAM FOULS: 6 [Team_093 in BONUS]


Team_093
--------------------------------------------------------------------------------
Player                MIN  PTS  REB  AST  TO      FG   FG%      3P   3P%
--------------------------------------------------------------------------------
Damian Williamson      20    9    0    0   0   5/6    83.3     0/0   0.0
Kobe Murray            11    9    2    0   0   4/5    80.0     0/0   0.0
Ben Cunningham         20    3    7    2   0   2/4    50.0     0/0   0.0
Shaquille George        4    3    0    0   0   1/1   100.0     0/0   0.0
Lauri Parker           11    2    2    1   0   1/2    50.0     0/0   0.0
Carmelo Wagner         13    0    2    0   0   0/0     0.0     0/0   0.0
Trae Westbrook         13    0    0    1   0   0/0     0.0     0/0   0.0
Immanuel Cunningham    11    0    0    3   0   0/2     0.0     0/0   0.0

TEAM: FG: 13/20 (65.0%), 3PT: 2/4 (50.0%), REB: 13 (3 off, 10 def), AST: 7, TO: 3
TEAM FOULS: 5 [Team_031 in BONUS]

================================================================================

================================================================================
                       3RD QUARTER - Team_031 vs Team_093                       
================================================================================

[12:00] Team_031 possession (Score: 53-46)
Shai Durant attempts a 3Pt. Contested by Damian Williamson (3.2 feet, MAN). SHAI DURANT MAKES IT! Assist: Gary Morant
Score: 56-46

[11:48] Team_093 possession (Score: 56-46)
Damian Williamson throws a bad pass out of bounds! TURNOVER! (dead ball)

[11:36] Team_031 possession (Score: 56-46)
Luka Sabonis drives, Ben Cunningham stays with him. Luka Sabonis attempts a Dunk. Contested by Ben Cunningham (3.5 feet, MAN). LUKA SABONIS MAKES IT! Assist: Immanuel James
Score: 58-46

[11:19] Team_093 possession (Score: 58-46)
Damian Williamson attempts a Layup. BLOCKED BY LUKA SABONIS! Ball is loose! Rebound secured by Immanuel James.

[11:05] Team_031 possession (Score: 58-46)
Gary Morant makes the Midrange and draws the foul on Trae Westbrook! And-1! Gary Morant to the line for 1. [Team fouls: 1] (Trae Westbrook: 1 personal fouls)   FT 1/1: GOOD Gary Morant makes 1/1 from the line.
Score: 61-46

[10:52] Team_093 possession (Score: 61-46)
Damian Williamson attempts a 3Pt. Contested by Pau Irving (5.9 feet, ZONE). Damian Williamson misses. Rebound secured by Gary Morant.

[10:39] Team_031 possession (Score: 61-46)
Luka Sabonis attempts a Dunk. BLOCKED BY TRAE WESTBROOK! Ball is loose! Rebound secured by Carmelo Wagner.

[10:26] Team_093 possession (Score: 61-46)
Carmelo Wagner drives, Immanuel James stays with him. Carmelo Wagner attempts a Layup. Contested by Immanuel James (2.6 feet, ZONE). CARMELO WAGNER MAKES IT!
Score: 61-48

[10:08] Team_031 possession (Score: 61-48)
Shai Durant attempts a Midrange. Contested by Carmelo Wagner (4.5 feet, ZONE). Shai Durant misses. Offensive rebound by Immanuel James! Immanuel James puts it back in!
Score: 63-48

[09:54] Team_093 possession (Score: 63-48)
Damian Williamson attempts a 3Pt. Heavily contested by Shai Durant (0.5 feet, MAN)! Damian Williamson misses. Rebound secured by Luka Sabonis.

[09:41] Team_031 possession (Score: 63-48)
Pau Irving commits a violation (traveling/carry)! TURNOVER! (dead ball)

[09:23] Team_093 possession (Score: 63-48)
Ben Cunningham attempts a Midrange. BLOCKED BY LUKA SABONIS! Ball is loose! Rebound secured by Luka Sabonis.

[09:07] Team_031 possession (Score: 63-48)
Luka Sabonis attempts a Midrange. Contested by Trae Westbrook (3.9 feet, ZONE). Luka Sabonis misses. Rebound secured by Carmelo Wagner.

[08:50] Team_093 possession (Score: 63-48)
Carmelo Wagner attempts a Midrange. Contested by Immanuel James (3.7 feet, ZONE). CARMELO WAGNER MAKES IT! Assist: Trae Westbrook
Score: 63-50

[08:37] Team_031 possession (Score: 63-50)
Pau Irving attempts a 3Pt. Contested by Carmelo Wagner (2.3 feet, MAN). Pau Irving misses. Offensive rebound by Luka Sabonis! Luka Sabonis puts it back in!
Score: 65-50

[08:19] Team_093 possession (Score: 65-50)
Trae Westbrook loses the ball! Stripped by Gary Morant! TURNOVER! (live ball)

[08:07] Team_031 possession (Score: 65-50)
Immanuel James makes the Dunk and draws the foul on Ben Cunningham! And-1! Immanuel James to the line for 1. [Team fouls: 2] (Ben Cunningham: 1 personal fouls)   FT 1/1: MISS Immanuel James makes 0/1 from the line. Offensive rebound by Luka Sabonis! Luka Sabonis puts it back in!
Score: 69-50

[07:58] Team_093 possession (Score: 69-50)
Damian Williamson attempts a 3Pt. Contested by Immanuel James (2.9 feet, ZONE). Damian Williamson misses. Rebound secured by Luka Sabonis.

[07:44] Team_031 possession (Score: 69-50)
Pau Irving drives to the basket... FOUL! Offensive foul on Pau Irving! Ben Cunningham drew the charge! [Team fouls: 1] (Pau Irving: 1 personal fouls) TURNOVER! (dead ball)

[07:24] Team_093 possession (Score: 69-50)
Trae Westbrook attempts a 3Pt. Contested by Gary Morant (3.7 feet, MAN). Trae Westbrook misses. Rebound secured by Gary Morant.

[07:12] Team_031 possession (Score: 69-50)
Shai Durant attempts a 3Pt. Contested by Damian Williamson (4.9 feet, MAN). Shai Durant misses. Rebound secured by Carmelo Wagner.

[06:58] Team_093 possession (Score: 69-50)
FOUL! Reach-in foul on Immanuel James during the drive. [Team fouls: 2] No free throws, side out. (Immanuel James: 1 personal fouls)

[06:44] Team_093 possession (Score: 69-50)
Ben Cunningham attempts a Layup. Heavily contested by Luka Sabonis (0.8 feet, MAN)! BEN CUNNINGHAM MAKES IT! Assist: Carmelo Wagner
Score: 69-52

[06:32] Team_031 possession (Score: 69-52)
Pau Irving drives, picks up Ben Cunningham. Help arrives from Trae Westbrook! Pau Irving attempts a Dunk. Contested by Trae Westbrook (2.9 feet, ZONE). PAU IRVING MAKES IT!
Score: 71-52

[06:16] Team_093 possession (Score: 71-52)
Carmelo Wagner attempts a 3Pt. Contested by Pau Irving (2.3 feet, MAN). Carmelo Wagner misses. Rebound secured by Gary Morant.

[06:00] Team_031 possession (Score: 71-52)
Pau Irving drives and kicks out. Immanuel James attempts a Midrange. Contested by Carmelo Wagner (3.1 feet, ZONE). Immanuel James misses. FOUL! Loose ball foul on Ben Cunningham during the rebound battle. [Team fouls: 3] No free throws, side out. (Ben Cunningham: 2 personal fouls)

[05:46] Team_031 possession (Score: 71-52)
Gary Morant attempts a 3Pt. Contested by Carmelo Wagner (3.0 feet, ZONE). Gary Morant misses. Offensive rebound by Immanuel James! Immanuel James's putback is no good. Rebound secured by Carmelo Wagner.

[05:34] Team_093 possession (Score: 71-52)
FOUL! Offensive foul on Vince Barnes! Immanuel James drew the charge! [Team fouls: 4] (Vince Barnes: 1 personal fouls) TURNOVER! (dead ball)

[05:23] Team_031 possession (Score: 71-52)
FOUL! Shooting foul on Ben Cunningham. Luka Sabonis to the line for 3 free throws. [BONUS: 5 team fouls] (Ben Cunningham: 3 personal fouls)   FT 1/3: MISS   FT 2/3: MISS   FT 3/3: GOOD Luka Sabonis makes 1/3 from the line.
Score: 72-52

[05:09] Team_093 possession (Score: 72-52)
Damian Williamson attempts a 3Pt. Wide open! Shai Durant is 7.2 feet away. [MAN] Damian Williamson misses. Rebound secured by Gary Morant.

[04:58] Team_031 possession (Score: 72-52)
FOUL! Shooting foul on Vince Barnes. Pau Irving to the line for 2 free throws. [BONUS: 6 team fouls] (Vince Barnes: 2 personal fouls)   FT 1/2: GOOD   FT 2/2: MISS Pau Irving makes 1/2 from the line. Rebound secured by Vince Barnes.
Score: 73-52

[04:38] Team_093 possession (Score: 73-52)
Carmelo Wagner makes the Midrange and draws the foul on Pau Irving! And-1! Carmelo Wagner to the line for 1. [Team fouls: 3] (Pau Irving: 2 personal fouls)   FT 1/1: GOOD Carmelo Wagner makes 1/1 from the line.
Score: 73-55

[04:25] Team_031 possession (Score: 73-55)
FOUL! Reach-in foul on Vince Barnes during the drive. [IN THE BONUS! 7 team fouls] Immanuel James to the line for 2 free throws. (Vince Barnes: 3 personal fouls)   FT 1/2: GOOD   FT 2/2: GOOD Immanuel James makes 2/2 from the line.
Score: 75-55

[04:08] Team_093 possession (Score: 75-55)
Trae Westbrook attempts a Layup. BLOCKED BY IMMANUEL JAMES! Ball is loose! Rebound secured by Luka Sabonis.

[03:54] Team_031 possession (Score: 75-55)
Luka Sabonis drives, Ben Cunningham stays with him. Luka Sabonis attempts a Layup. Contested by Ben Cunningham (2.6 feet, MAN). LUKA SABONIS MAKES IT!
Score: 77-55

[03:39] Team_093 possession (Score: 77-55)
FOUL! Shooting foul on Pau Irving. Damian Williamson to the line for 3 free throws. [Team fouls: 4] (Pau Irving: 3 personal fouls)   FT 1/3: GOOD   FT 2/3: MISS   FT 3/3: GOOD Damian Williamson makes 2/3 from the line.
Score: 77-57

[03:24] Team_031 possession (Score: 77-57)
Luka Sabonis attempts a 3Pt. Contested by Carmelo Wagner (5.8 feet, ZONE). Luka Sabonis misses. Rebound secured by Vince Barnes.

[03:12] Team_093 possession (Score: 77-57)
FOUL! Holding foul on Immanuel James. [IN THE BONUS! 5 team fouls] Vince Barnes to the line for 2 free throws. (Immanuel James: 2 personal fouls)   FT 1/2: GOOD   FT 2/2: GOOD Vince Barnes makes 2/2 from the line.
Score: 77-59

[02:54] Team_031 possession (Score: 77-59)
Gary Morant attempts a Midrange. Wide open! Trae Westbrook is 6.4 feet away. [MAN] GARY MORANT MAKES IT! Assist: Luka Sabonis
Score: 79-59

[02:41] Team_093 possession (Score: 79-59)
Damian Williamson attempts a 3Pt. Contested by Pau Irving (5.4 feet, ZONE). Damian Williamson misses. Rebound secured by Immanuel James.

[02:26] Team_031 possession (Score: 79-59)
FOUL! Holding foul on Carmelo Wagner. [IN THE BONUS! 8 team fouls] Pau Irving to the line for 2 free throws. (Carmelo Wagner: 1 personal fouls)   FT 1/2: GOOD   FT 2/2: GOOD Pau Irving makes 2/2 from the line.
Score: 81-59

[02:13] Team_093 possession (Score: 81-59)
FOUL! Offensive foul on Carmelo Wagner! Pau Irving drew the charge! [Team fouls: 9] (Carmelo Wagner: 2 personal fouls) TURNOVER! (dead ball)

[01:59] Team_031 possession (Score: 81-59)
Shai Durant attempts a Midrange. Wide open! Vince Barnes is 7.6 feet away. [ZONE] SHAI DURANT MAKES IT! Assist: Luka Sabonis
Score: 83-59

[01:47] Team_093 possession (Score: 83-59)
Trae Westbrook attempts a Layup. Heavily contested by Immanuel James (0.5 feet, ZONE)! TRAE WESTBROOK MAKES IT!
Score: 83-61

[01:35] Team_031 possession (Score: 83-61)
Immanuel James attempts a 3Pt. Heavily contested by Vince Barnes (1.8 feet, MAN)! Immanuel James misses. Rebound secured by Ben Cunningham.

[01:25] Team_093 possession (Score: 83-61)
Carmelo Wagner drives and kicks out. Carmelo Wagner attempts a 3Pt. Contested by Pau Irving (4.6 feet, ZONE). Carmelo Wagner misses. Rebound secured by Gary Morant.

[01:08] Team_031 possession (Score: 83-61)
Immanuel James drives, Ben Cunningham stays with him. Immanuel James attempts a Dunk. Contested by Ben Cunningham (4.5 feet, ZONE). Immanuel James misses. Rebound secured by Carmelo Wagner.

[00:52] Team_093 possession (Score: 83-61)
Trae Westbrook attempts a 3Pt. Contested by Pau Irving (3.7 feet, ZONE). Trae Westbrook misses. Rebound secured by Gary Morant.

[00:38] Team_031 possession (Score: 83-61)
FOUL! Reach-in foul on Ben Cunningham during the drive. [IN THE BONUS! 10 team fouls] Luka Sabonis to the line for 2 free throws. (Ben Cunningham: 4 personal fouls)   FT 1/2: MISS   FT 2/2: GOOD Luka Sabonis makes 1/2 from the line.
Score: 84-61

[00:24] Team_093 possession (Score: 84-61)
Vince Barnes attempts a 3Pt. Contested by Immanuel James (4.4 feet, MAN). VINCE BARNES MAKES IT! Assist: Carmelo Wagner
Score: 84-64

[00:04] Team_031 possession (Score: 84-64)
Pau Irving drives, Ben Cunningham stays with him. Pau Irving attempts a Layup. Contested by Ben Cunningham (5.2 feet, ZONE). PAU IRVING MAKES IT! Assist: Luka Sabonis
Score: 86-64

================================================================================
                              3RD QUARTER COMPLETE                              
================================================================================

3RD QUARTER SCORE: Team_031 33, Team_093 18

BOX SCORE:
================================================================================

Team_031
--------------------------------------------------------------------------------
Player                MIN  PTS  REB  AST  TO      FG   FG%      3P   3P%
--------------------------------------------------------------------------------
Luka Sabonis           25   12    6    3   0   6/9    66.7     0/0   0.0
Pau Irving             25    6    0    0   0   3/4    75.0     0/0   0.0
Shai Durant            25    5    0    0   0   2/3    66.7     0/0   0.0
Gary Morant            25    5    6    1   0   2/3    66.7     0/0   0.0
Immanuel James         32    4    3    1   0   2/4    50.0     0/0   0.0

TEAM: FG: 15/23 (65.2%), 3PT: 3/7 (42.9%), REB: 16 (4 off, 12 def), AST: 5, TO: 2
TEAM FOULS: 5 [Team_093 in BONUS]


Team_093
--------------------------------------------------------------------------------
Player                MIN  PTS  REB  AST  TO      FG   FG%      3P   3P%
--------------------------------------------------------------------------------
Carmelo Wagner         25    7    5    2   0   3/5    60.0     0/0   0.0
Vince Barnes           25    5    2    0   0   2/2   100.0     0/0   0.0
Damian Williamson      32    2    0    0   0   1/7    14.3     0/0   0.0
Ben Cunningham         32    2    1    0   0   1/2    50.0     0/0   0.0
Trae Westbrook         25    2    0    1   0   1/4    25.0     0/0   0.0

TEAM: FG: 8/20 (40.0%), 3PT: 2/10 (20.0%), REB: 7 (0 off, 7 def), AST: 3, TO: 4
TEAM FOULS: 10 [Team_031 in BONUS]

================================================================================

================================================================================
                       4TH QUARTER - Team_031 vs Team_093                       
================================================================================

[12:00] Team_031 possession (Score: 86-64)
Pau Irving attempts a 3Pt. Heavily contested by Carmelo Wagner (1.5 feet, ZONE)! Pau Irving misses. Rebound secured by Carmelo Wagner.

[11:47] Team_093 possession (Score: 86-64)
Ben Cunningham attempts a Midrange. Heavily contested by Luka Sabonis (1.6 feet, MAN)! Ben Cunningham misses. Rebound secured by Immanuel James.

[11:30] Team_031 possession (Score: 86-64)
Immanuel James drives, Vince Barnes stays with him. Immanuel James attempts a Layup. Contested by Vince Barnes (4.1 feet, MAN). IMMANUEL JAMES MAKES IT! Assist: Shai Durant
Score: 88-64

[11:11] Team_093 possession (Score: 88-64)
Vince Barnes drives and kicks out. Trae Westbrook attempts a 3Pt. Contested by Pau Irving (3.5 feet, ZONE). TRAE WESTBROOK MAKES IT! Assist: Ben Cunningham
Score: 88-67

[10:59] Team_031 possession (Score: 88-67)
Shai Durant makes the Layup and draws the foul on Ben Cunningham! And-1! Shai Durant to the line for 1. [Team fouls: 1] (Ben Cunningham: 1 personal fouls)   FT 1/1: GOOD Shai Durant makes 1/1 from the line.
Score: 91-67

[10:41] Team_093 possession (Score: 91-67)
Damian Williamson attempts a Midrange. Contested by Pau Irving (2.4 feet, ZONE). Damian Williamson misses. Rebound secured by Luka Sabonis.

[10:29] Team_031 possession (Score: 91-67)
Pau Irving attempts a Midrange. Heavily contested by Carmelo Wagner (1.9 feet, MAN)! PAU IRVING MAKES IT! Assist: Luka Sabonis
Score: 93-67

[10:15] Team_093 possession (Score: 93-67)
Vince Barnes attempts a Midrange. Contested by Immanuel James (3.3 feet, MAN). Vince Barnes misses. Rebound secured by Luka Sabonis.

[10:00] Team_031 possession (Score: 93-67)
Pau Irving attempts a Midrange. Contested by Carmelo Wagner (3.3 feet, MAN). Pau Irving misses. Rebound secured by Vince Barnes.

[09:41] Team_093 possession (Score: 93-67)
Ben Cunningham attempts a Midrange. Contested by Luka Sabonis (4.0 feet, MAN). Ben Cunningham misses. Rebound secured by Gary Morant.

[09:31] Team_031 possession (Score: 93-67)
FOUL! Reach-in foul on Damian Williamson during the drive. [Team fouls: 2] No free throws, side out. (Damian Williamson: 1 personal fouls)

[09:16] Team_031 possession (Score: 93-67)
Gary Morant drives and kicks out. Immanuel James attempts a 3Pt. Contested by Carmelo Wagner (4.0 feet, ZONE). Immanuel James misses. Rebound secured by Vince Barnes.

[08:58] Team_093 possession (Score: 93-67)
FOUL! Holding foul on Shai Durant. [Team fouls: 1] No free throws, side out. (Shai Durant: 1 personal fouls)

[08:48] Team_093 possession (Score: 93-67)
Carmelo Wagner throws a bad pass! Stolen by Pau Irving! TURNOVER! (live ball)

[08:30] Team_031 possession (Score: 93-67)
Shai Durant attempts a 3Pt. Wide open! Carmelo Wagner is 7.5 feet away. [ZONE] Shai Durant misses. Rebound secured by Ben Cunningham.

[08:16] Team_093 possession (Score: 93-67)
Trae Westbrook attempts a 3Pt. BLOCKED BY GARY MORANT! Ball deflects out of bounds off Trae Westbrook.

[08:02] Team_031 possession (Score: 93-67)
Pau Irving attempts a Midrange. Contested by Carmelo Wagner (5.1 feet, MAN). Pau Irving misses. Rebound secured by Vince Barnes.

[07:47] Team_093 possession (Score: 93-67)
Carmelo Wagner attempts a 3Pt. Contested by Pau Irving (3.4 feet, MAN). Carmelo Wagner misses. Rebound secured by Gary Morant.

[07:32] Team_031 possession (Score: 93-67)
Shai Durant attempts a 3Pt. Contested by Carmelo Wagner (2.7 feet, ZONE). SHAI DURANT MAKES IT! Assist: Immanuel James
Score: 96-67

[07:16] Team_093 possession (Score: 96-67)
Trae Westbrook attempts a 3Pt. Wide open! Pau Irving is 7.1 feet away. [ZONE] Trae Westbrook misses. Rebound secured by Luka Sabonis.

[07:01] Team_031 possession (Score: 96-67)
Pau Irving drives and kicks out. Shai Durant attempts a 3Pt. Contested by Damian Williamson (5.9 feet, MAN). SHAI DURANT MAKES IT! Assist: Immanuel James
Score: 99-67

[06:45] Team_093 possession (Score: 99-67)
Damian Williamson attempts a 3Pt. Heavily contested by Pau Irving (1.9 feet, ZONE)! DAMIAN WILLIAMSON MAKES IT! Assist: Vince Barnes
Score: 99-70

[06:30] Team_031 possession (Score: 99-70)
Luka Sabonis attempts a Midrange. Wide open! Ben Cunningham is 10.0 feet away. [MAN] Luka Sabonis misses. Rebound secured by Vince Barnes.

[06:13] Team_093 possession (Score: 99-70)
Trae Westbrook attempts a Layup. Contested by Immanuel James (2.3 feet, ZONE). TRAE WESTBROOK MAKES IT!
Score: 99-72

[05:59] Team_031 possession (Score: 99-72)
Immanuel James attempts a Midrange. Wide open! Ben Cunningham is 6.8 feet away. [ZONE] Immanuel James misses. Rebound secured by Vince Barnes.

[05:48] Team_093 possession (Score: 99-72)
Vince Barnes attempts a 3Pt. Contested by Pau Irving (4.6 feet, ZONE). Vince Barnes misses. Rebound secured by Immanuel James.

[05:33] Team_031 possession (Score: 99-72)
FOUL! Shooting foul on Vince Barnes. Luka Sabonis to the line for 2 free throws. [Team fouls: 3] (Vince Barnes: 1 personal fouls)   FT 1/2: GOOD   FT 2/2: GOOD Luka Sabonis makes 2/2 from the line.
Score: 101-72

[05:18] Team_093 possession (Score: 101-72)
Ben Cunningham drives and kicks out. Trae Westbrook attempts a Midrange. Contested by Gary Morant (4.9 feet, MAN). TRAE WESTBROOK MAKES IT! Assist: Vince Barnes
Score: 101-74

[05:03] Team_031 possession (Score: 101-74)
Immanuel James attempts a 3Pt. Contested by Vince Barnes (5.3 feet, MAN). Immanuel James misses. Offensive rebound by Immanuel James! Immanuel James kicks it out.

[04:53] Team_031 possession (Score: 101-74)
Gary Morant attempts a 3Pt. Wide open! Carmelo Wagner is 6.7 feet away. [ZONE] Gary Morant misses. Rebound secured by Vince Barnes.

[04:38] Team_093 possession (Score: 101-74)
Carmelo Wagner drives, Pau Irving stays with him. Carmelo Wagner attempts a Layup. Wide open! Pau Irving is 6.1 feet away. [MAN] Carmelo Wagner misses. Rebound secured by Gary Morant.

[04:25] Team_031 possession (Score: 101-74)
Pau Irving attempts a 3Pt. Wide open! Carmelo Wagner is 8.6 feet away. [MAN] Pau Irving misses. Rebound secured by Carmelo Wagner.

[04:05] Team_093 possession (Score: 101-74)
Damian Williamson attempts a 3Pt. Contested by Pau Irving (5.8 feet, ZONE). Damian Williamson misses. Offensive rebound by Carmelo Wagner! Carmelo Wagner kicks it out.

[03:52] Team_093 possession (Score: 101-74)
Damian Williamson attempts a Midrange. Wide open! Immanuel James is 6.5 feet away. [ZONE] DAMIAN WILLIAMSON MAKES IT!
Score: 101-76

[03:40] Team_031 possession (Score: 101-76)
Luka Sabonis drives to the basket... Luka Sabonis commits a violation (traveling/carry)! TURNOVER! (dead ball)

[03:40] Substitution (Team_031): Shai Durant OUT → Kevin Morant IN (stamina_rule2)

[03:40] Substitution (Team_031): Gary Morant OUT → Isaiah Ingram IN (stamina_rule2)

[03:40] Substitution (Team_031): Pau Irving OUT → Miles Stewart IN (stamina_rule2)

[03:40] Substitution (Team_031): Immanuel James OUT → Kobe Randle IN (stamina_rule2)

[03:40] Substitution (Team_031): Luka Sabonis OUT → Jimmy Poole IN (stamina_rule2)

[03:40] Substitution (Team_093): Damian Williamson OUT → Shaquille George IN (stamina_rule2)

[03:40] Substitution (Team_093): Trae Westbrook OUT → Immanuel Cunningham IN (stamina_rule2)

[03:40] Substitution (Team_093): Carmelo Wagner OUT → Lauri Parker IN (stamina_rule2)

[03:40] Substitution (Team_093): Vince Barnes OUT → Kobe Murray IN (stamina_rule2)

[03:40] Substitution (Team_093): Ben Cunningham OUT → Cade O'Neal IN (stamina_rule2)

[03:26] Team_093 possession (Score: 101-76)
Lauri Parker attempts a 3Pt. Wide open! Miles Stewart is 6.4 feet away. [MAN] LAURI PARKER MAKES IT! Assist: Kobe Murray
Score: 101-79

[03:11] Team_031 possession (Score: 101-79)
FOUL! Holding foul on Immanuel Cunningham. [Team fouls: 4] No free throws, side out. (Immanuel Cunningham: 1 personal fouls)

[02:57] Team_031 possession (Score: 101-79)
FOUL! Reach-in foul on Shaquille George during the drive. [IN THE BONUS! 5 team fouls] Kevin Morant to the line for 2 free throws. (Shaquille George: 1 personal fouls)   FT 1/2: GOOD   FT 2/2: GOOD Kevin Morant makes 2/2 from the line.
Score: 103-79

[02:40] Team_093 possession (Score: 103-79)
Shaquille George attempts a 3Pt. Wide open! Kevin Morant is 6.5 feet away. [MAN] Shaquille George misses. Rebound secured by Isaiah Ingram.

[02:25] Team_031 possession (Score: 103-79)
Kobe Randle makes the Layup and draws the foul on Kobe Murray! And-1! Kobe Randle to the line for 1. [BONUS: 6 team fouls] (Kobe Murray: 1 personal fouls)   FT 1/1: GOOD Kobe Randle makes 1/1 from the line.
Score: 106-79

[02:10] Team_093 possession (Score: 106-79)
Cade O'Neal attempts a Midrange. Contested by Jimmy Poole (3.7 feet, MAN). Cade O'Neal misses. Rebound secured by Isaiah Ingram.

[01:57] Team_031 possession (Score: 106-79)
Kevin Morant attempts a Layup. Heavily contested by Kobe Murray (1.4 feet, ZONE)! Kevin Morant misses. Rebound secured by Lauri Parker.

[01:43] Team_093 possession (Score: 106-79)
Kobe Murray attempts a Layup. Wide open! Jimmy Poole is 8.3 feet away. [ZONE] Kobe Murray misses. Rebound secured by Isaiah Ingram.

[01:34] Team_031 possession (Score: 106-79)
FOUL! Shooting foul on Shaquille George. Isaiah Ingram to the line for 2 free throws. [BONUS: 7 team fouls] (Shaquille George: 2 personal fouls)   FT 1/2: GOOD   FT 2/2: GOOD Isaiah Ingram makes 2/2 from the line.
Score: 108-79

[01:20] Team_093 possession (Score: 108-79)
Lauri Parker attempts a Layup. Wide open! Jimmy Poole is 7.0 feet away. [ZONE] Lauri Parker misses. Rebound secured by Isaiah Ingram.

[01:06] Team_031 possession (Score: 108-79)
FOUL! Shooting foul on Kobe Murray. Kobe Randle to the line for 2 free throws. [BONUS: 8 team fouls] (Kobe Murray: 2 personal fouls)   FT 1/2: MISS   FT 2/2: GOOD Kobe Randle makes 1/2 from the line.
Score: 109-79

[00:54] Team_093 possession (Score: 109-79)
Shaquille George attempts a 3Pt. Wide open! Miles Stewart is 6.3 feet away. [ZONE] Shaquille George misses. Rebound secured by Isaiah Ingram.

[00:45] Team_031 possession (Score: 109-79)
Isaiah Ingram attempts a Midrange. Wide open! Cade O'Neal is 7.6 feet away. [ZONE] Isaiah Ingram misses. Rebound secured by Kobe Murray.

[00:31] Team_093 possession (Score: 109-79)
Shaquille George attempts a 3Pt. Wide open! Kevin Morant is 6.8 feet away. [MAN] SHAQUILLE GEORGE MAKES IT! Assist: Cade O'Neal
Score: 109-82

[00:16] Team_031 possession (Score: 109-82)
Isaiah Ingram makes the Dunk and draws the foul on Immanuel Cunningham! And-1! Isaiah Ingram to the line for 1. [BONUS: 9 team fouls] (Immanuel Cunningham: 2 personal fouls)   FT 1/1: GOOD Isaiah Ingram makes 1/1 from the line.
Score: 112-82

================================================================================
                              4TH QUARTER COMPLETE                              
================================================================================

4TH QUARTER SCORE: Team_031 26, Team_093 18

BOX SCORE:
================================================================================

Team_031
--------------------------------------------------------------------------------
Player                MIN  PTS  REB  AST  TO      FG   FG%      3P   3P%
--------------------------------------------------------------------------------
Shai Durant            34    9    0    1   0   3/4    75.0     0/0   0.0
Isaiah Ingram          14    5    5    0   0   2/3    66.7     0/0   0.0
Kobe Randle             8    4    0    0   0   2/2   100.0     0/0   0.0
Pau Irving             34    2    0    0   0   1/5    20.0     0/0   0.0
Immanuel James         41    2    3    2   0   1/2    50.0     0/0   0.0
Luka Sabonis           34    2    3    1   0   1/2    50.0     0/0   0.0
Kevin Morant           14    2    0    0   0   1/2    50.0     0/0   0.0
Gary Morant            34    0    3    0   0   0/2     0.0     0/0   0.0

TEAM: FG: 11/22 (50.0%), 3PT: 1/5 (20.0%), REB: 14 (1 off, 13 def), AST: 4, TO: 1
TEAM FOULS: 1


Team_093
--------------------------------------------------------------------------------
Player                MIN  PTS  REB  AST  TO      FG   FG%      3P   3P%
--------------------------------------------------------------------------------
Trae Westbrook         34    7    0    0   0   3/5    60.0     0/0   0.0
Damian Williamson      41    5    0    0   0   2/3    66.7     0/0   0.0
Lauri Parker           14    3    1    0   0   1/2    50.0     0/0   0.0
Shaquille George        8    3    0    0   0   1/3    33.3     0/0   0.0
Carmelo Wagner         34    0    3    0   0   0/2     0.0     0/0   0.0
Ben Cunningham         41    0    1    1   0   0/2     0.0     0/0   0.0
Vince Barnes           34    0    6    2   0   0/2     0.0     0/0   0.0
Kobe Murray            14    0    1    1   0   0/1     0.0     0/0   0.0
Cade O'Neal             8    0    0    1   0   0/1     0.0     0/0   0.0

TEAM: FG: 7/21 (33.3%), 3PT: 3/9 (33.3%), REB: 12 (1 off, 11 def), AST: 5, TO: 1
TEAM FOULS: 9 [Team_031 in BONUS]

================================================================================

================================================================================
                               FULL GAME COMPLETE                               
================================================================================

FINAL SCORE: Team_031 112, Team_093 82

SCORING BY QUARTER:
--------------------------------------------------------------------------------
Team                     Q1     Q2     Q3     Q4    FINAL
--------------------------------------------------------------------------------
Team_031                 25     28     33     26      112
Team_093                 19     27     18     18       82
--------------------------------------------------------------------------------

FULL GAME BOX SCORE:
================================================================================

Team_031
--------------------------------------------------------------------------------
Player                MIN  PTS  REB  AST  TO      FG   FG%      3P   3P%      FT STL BLK
--------------------------------------------------------------------------------
Immanuel James         41   23   15    6   0   9/15   60.0   3/4    75.0   5/8     0   2
Shai Durant            34   19    0    2   0   7/11   63.6   3/7    42.9   1/1     0   0
Gary Morant            34   12   11    2   3   5/11   45.5   1/6    16.7   1/1     1   1
Pau Irving             34    8    0    3   1   5/11   45.5   1/3    33.3   3/4     2   0
Luka Sabonis           34   18   14    5   2   7/13   53.8   1/3    33.3   6/9     1   2
Kevin Morant           14    4    0    1   1   1/4    25.0   0/2     0.0   2/2     0   0
Isaiah Ingram          14    9    6    0   0   4/8    50.0   0/3     0.0   5/5     0   0
Miles Stewart          14    2    0    2   0   1/3    33.3   0/0     0.0   0/0     1   0
Jimmy Poole            14    4    6    0   0   3/3   100.0   0/0     0.0   0/0     0   0
Kobe Randle             8   10    0    0   0   4/4   100.0   1/1   100.0   3/4     0   0

TEAM: FG: 48/85 (56.5%), 3PT: 10/29 (34.5%), REB: 53 (13 off, 40 def), AST: 21, TO: 7


Team_093
--------------------------------------------------------------------------------
Player                MIN  PTS  REB  AST  TO      FG   FG%      3P   3P%      FT STL BLK
--------------------------------------------------------------------------------
Damian Williamson      41   16    0    0   1   8/18   44.4   3/8    37.5   5/9     0   0
Ben Cunningham         41   10   14    3   1   6/13   46.2   0/0     0.0   4/5     1   0
Trae Westbrook         34   16    0    2   2   5/12   41.7   1/7    14.3   0/0     0   1
Carmelo Wagner         34    9   15    3   3   4/9    44.4   0/3     0.0   1/1     0   1
Vince Barnes           34    5    9    4   3   2/4    50.0   1/2    50.0   2/2     0   0
Immanuel Cunningham    14    3    0    3   1   1/3    33.3   1/2    50.0   0/0     0   0
Lauri Parker           14    5    3    1   1   2/4    50.0   1/2    50.0   0/0     0   0
Kobe Murray            14    9    3    1   0   3/5    60.0   0/0     0.0   2/2     0   0
Shaquille George        8    8    0    0   1   3/5    60.0   2/4    50.0   2/2     0   0
Cade O'Neal             8    0    1    2   0   0/2     0.0   0/0     0.0   0/0     0   0

TEAM: FG: 36/77 (46.8%), 3PT: 9/28 (32.1%), REB: 43 (8 off, 35 def), AST: 19, TO: 13

================================================================================
