================================================================================
                        FULL GAME - Team_095 vs Team_061                        
================================================================================

================================================================================
                       1ST QUARTER - Team_095 vs Team_061                       
================================================================================

[12:00] Team_095 possession (Score: 0-0)
Dejounte Hyland drives and kicks out. Evan Carter attempts a 3Pt. Wide open! Brandon Russell is 7.8 feet away. [ZONE] Evan Carter misses. Rebound secured by Michael Russell.

[11:43] Team_061 possession (Score: 0-0)
Brandon Russell attempts a 3Pt. Contested by Dejounte Hyland (4.0 feet, MAN). Brandon Russell misses. Rebound secured by Shaquille Ball.

[11:28] Team_095 possession (Score: 0-0)
Dejounte Hyland attempts a 3Pt. Contested by Brandon Russell (3.8 feet, ZONE). Dejounte Hyland misses. Rebound secured by Draymond Banchero.

[11:17] Team_061 possession (Score: 0-0)
Draymond Banchero drives and kicks out. Brandon Russell attempts a 3Pt. Wide open! Dejounte Hyland is 6.7 feet away. [MAN] Brandon Russell misses. Offensive rebound by Draymond Banchero! Draymond Banchero's putback is no good. Offensive rebound by Michael Russell! Michael Russell kicks it out.

[11:04] Team_061 possession (Score: 0-0)
Jayson Holiday drives and kicks out. Draymond Banchero attempts a Midrange. Contested by Shaquille Ball (4.3 feet, ZONE). DRAYMOND BANCHERO MAKES IT! Assist: Brandon Russell
Score: 0-2

[10:46] Team_095 possession (Score: 0-2)
Evan Carter attempts a 3Pt. Contested by Michael Russell (5.2 feet, MAN). Evan Carter misses. Rebound secured by Michael Russell.

[10:31] Team_061 possession (Score: 0-2)
FOUL! Reach-in foul on Immanuel Middleton during the drive. [Team fouls: 1] No free throws, side out. (Immanuel Middleton: 1 personal fouls)

[10:21] Team_061 possession (Score: 0-2)
Brandon Russell attempts a 3Pt. Contested by Dejounte Hyland (3.4 feet, MAN). Brandon Russell misses. Rebound secured by Shaquille Ball.

[10:06] Team_095 possession (Score: 0-2)
Dejounte Hyland attempts a Midrange. Contested by Brandon Russell (2.2 feet, MAN). DEJOUNTE HYLAND MAKES IT!
Score: 2-2

[09:51] Team_061 possession (Score: 2-2)
Brandon Russell loses control! Ball rolls out of bounds! TURNOVER! (dead ball)

[09:39] Team_095 possession (Score: 2-2)
Shaquille Ball attempts a 3Pt. Contested by Brandon Russell (3.4 feet, ZONE). Shaquille Ball misses. Rebound secured by Bam Sexton.

[09:25] Team_061 possession (Score: 2-2)
Bam Sexton attempts a Midrange. Contested by Immanuel Middleton (2.2 feet, MAN). BAM SEXTON MAKES IT! Assist: Michael Russell
Score: 2-4

[09:09] Team_095 possession (Score: 2-4)
Shaquille Ball attempts a 3Pt. Contested by Jayson Holiday (4.0 feet, MAN). Shaquille Ball misses. Rebound secured by Michael Russell.

[08:55] Team_061 possession (Score: 2-4)
Draymond Banchero drives and kicks out. Brandon Russell attempts a Midrange. Wide open! Dejounte Hyland is 6.3 feet away. [MAN] BRANDON RUSSELL MAKES IT! Assist: Michael Russell
Score: 2-6

[08:37] Team_095 possession (Score: 2-6)
Shaquille Ball throws a bad pass! Stolen by Jayson Holiday! TURNOVER! (live ball)

[08:26] Team_061 possession (Score: 2-6)
Jayson Holiday drives and kicks out. Jayson Holiday attempts a Midrange. Wide open! Shaquille Ball is 7.5 feet away. [MAN] Jayson Holiday misses. Rebound secured by Dejounte Hyland.

[08:11] Team_095 possession (Score: 2-6)
Evan Carter attempts a 3Pt. Contested by Michael Russell (3.7 feet, MAN). EVAN CARTER MAKES IT! Assist: Dejounte Hyland
Score: 5-6

[07:53] Team_061 possession (Score: 5-6)
Draymond Banchero drives, Immanuel Middleton stays with him. Draymond Banchero attempts a Layup. Heavily contested by Immanuel Middleton (0.5 feet, ZONE)! Draymond Banchero misses. Offensive rebound by Michael Russell! Michael Russell puts it back in!
Score: 5-8

[07:41] Team_095 possession (Score: 5-8)
Evan Carter drives, Draymond Banchero stays with him. Evan Carter attempts a Dunk. Heavily contested by Draymond Banchero (2.0 feet, ZONE)! EVAN CARTER MAKES IT! Assist: Kyrie Ming
Score: 7-8

[07:29] Team_061 possession (Score: 7-8)
FOUL! Holding foul on Dejounte Hyland. [Team fouls: 2] No free throws, side out. (Dejounte Hyland: 1 personal fouls)

[07:13] Team_061 possession (Score: 7-8)
Michael Russell attempts a 3Pt. Heavily contested by Evan Carter (1.5 feet, MAN)! Michael Russell misses. Rebound secured by Dejounte Hyland.

[06:58] Team_095 possession (Score: 7-8)
Evan Carter makes the Midrange and draws the foul on Jayson Holiday! And-1! Evan Carter to the line for 1. [Team fouls: 1] (Jayson Holiday: 1 personal fouls)   FT 1/1: GOOD Evan Carter makes 1/1 from the line.
Score: 10-8

[06:45] Team_061 possession (Score: 10-8)
Brandon Russell attempts a Midrange. Wide open! Dejounte Hyland is 8.0 feet away. [MAN] BRANDON RUSSELL MAKES IT!
Score: 10-10

[06:33] Team_095 possession (Score: 10-10)
Evan Carter attempts a 3Pt. Heavily contested by Michael Russell (1.6 feet, MAN)! Evan Carter misses. Rebound secured by Bam Sexton.

[06:18] Team_061 possession (Score: 10-10)
FOUL! Holding foul on Kyrie Ming. [Team fouls: 3] No free throws, side out. (Kyrie Ming: 1 personal fouls)

[06:03] Team_061 possession (Score: 10-10)
Bam Sexton drives, Immanuel Middleton stays with him. Bam Sexton attempts a Layup. Contested by Immanuel Middleton (2.7 feet, MAN). Bam Sexton misses. Rebound secured by Shaquille Ball.

[05:48] Team_095 possession (Score: 10-10)
Immanuel Middleton attempts a 3Pt. Contested by Brandon Russell (4.4 feet, ZONE). Immanuel Middleton misses. Offensive rebound by Dejounte Hyland! Dejounte Hyland kicks it out.

[05:33] Team_095 possession (Score: 10-10)
Immanuel Middleton attempts a 3Pt. Contested by Brandon Russell (3.0 feet, ZONE). IMMANUEL MIDDLETON MAKES IT! Assist: Evan Carter
Score: 13-10

[05:17] Team_061 possession (Score: 13-10)
FOUL! Holding foul on Dejounte Hyland. [Team fouls: 4] No free throws, side out. (Dejounte Hyland: 2 personal fouls)

[05:03] Team_061 possession (Score: 13-10)
Draymond Banchero attempts a Layup. Contested by Kyrie Ming (4.1 feet, MAN). DRAYMOND BANCHERO MAKES IT!
Score: 13-12

[04:49] Team_095 possession (Score: 13-12)
Kyrie Ming drives and kicks out. Immanuel Middleton attempts a Midrange. Contested by Bam Sexton (2.0 feet, MAN). Immanuel Middleton misses. FOUL! Loose ball foul on Michael Russell during the rebound battle. [Team fouls: 2] No free throws, side out. (Michael Russell: 1 personal fouls)

[04:38] Team_095 possession (Score: 13-12)
Dejounte Hyland loses the ball! Stripped by Brandon Russell! TURNOVER! (live ball)

[04:26] Team_061 possession (Score: 13-12)
Brandon Russell attempts a 3Pt. Contested by Evan Carter (3.9 feet, ZONE). Brandon Russell misses. Offensive rebound by Michael Russell! Michael Russell puts it back in!
Score: 13-14

[04:12] Team_095 possession (Score: 13-14)
Shaquille Ball drives to the basket... FOUL! Offensive foul on Shaquille Ball! Jayson Holiday drew the charge! [Team fouls: 5] (Shaquille Ball: 1 personal fouls) TURNOVER! (dead ball)

[03:56] Team_061 possession (Score: 13-14)
Michael Russell attempts a Midrange. Contested by Evan Carter (3.7 feet, MAN). Michael Russell misses. Rebound secured by Shaquille Ball.

[03:40] Team_095 possession (Score: 13-14)
Shaquille Ball attempts a Layup. BLOCKED BY BAM SEXTON! Ball is loose! Rebound secured by Draymond Banchero.

[03:27] Team_061 possession (Score: 13-14)
Brandon Russell drives, Immanuel Middleton stays with him. Brandon Russell attempts a Dunk. Heavily contested by Immanuel Middleton (1.8 feet, ZONE)! Brandon Russell misses. Offensive rebound by Michael Russell! Michael Russell's putback is no good. Rebound secured by Shaquille Ball.

[03:17] Team_095 possession (Score: 13-14)
Kyrie Ming makes the Layup and draws the foul on Jayson Holiday! And-1! Kyrie Ming to the line for 1. [Team fouls: 3] (Jayson Holiday: 2 personal fouls)   FT 1/1: GOOD Kyrie Ming makes 1/1 from the line.
Score: 16-14

[03:04] Team_061 possession (Score: 16-14)
Draymond Banchero drives, Kyrie Ming stays with him. Draymond Banchero attempts a Layup. Wide open! Kyrie Ming is 10.0 feet away. [MAN] Draymond Banchero misses. Rebound secured by Shaquille Ball.

[02:48] Team_095 possession (Score: 16-14)
Evan Carter attempts a Midrange. Contested by Michael Russell (4.7 feet, MAN). Evan Carter misses. Rebound secured by Bam Sexton.

[02:34] Team_061 possession (Score: 16-14)
Draymond Banchero attempts a 3Pt. Wide open! Dejounte Hyland is 6.4 feet away. [ZONE] DRAYMOND BANCHERO MAKES IT! Assist: Jayson Holiday
Score: 16-17

[02:17] Team_095 possession (Score: 16-17)
Evan Carter attempts a Layup. Heavily contested by Draymond Banchero (0.5 feet, ZONE)! EVAN CARTER MAKES IT! Assist: Dejounte Hyland
Score: 18-17

[02:08] Team_061 possession (Score: 18-17)
Bam Sexton attempts a 3Pt. Contested by Evan Carter (5.0 feet, ZONE). Bam Sexton misses. Rebound secured by Shaquille Ball.

[01:53] Team_095 possession (Score: 18-17)
Immanuel Middleton attempts a 3Pt. Contested by Brandon Russell (4.5 feet, ZONE). Immanuel Middleton misses. Rebound secured by Michael Russell.

[01:34] Team_061 possession (Score: 18-17)
Bam Sexton drives and kicks out. Jayson Holiday attempts a 3Pt. Heavily contested by Evan Carter (1.5 feet, ZONE)! Jayson Holiday misses. Rebound secured by Dejounte Hyland.

[01:19] Team_095 possession (Score: 18-17)
Shaquille Ball drives and kicks out. Kyrie Ming attempts a 3Pt. Wide open! Brandon Russell is 7.6 feet away. [ZONE] Kyrie Ming misses. Rebound secured by Bam Sexton.

[01:04] Team_061 possession (Score: 18-17)
Bam Sexton throws a bad pass! Stolen by Immanuel Middleton! TURNOVER! (live ball)

[00:44] Team_095 possession (Score: 18-17)
Immanuel Middleton attempts a Midrange. Wide open! Bam Sexton is 8.1 feet away. [MAN] IMMANUEL MIDDLETON MAKES IT! Assist: Dejounte Hyland
Score: 20-17

[00:28] Team_061 possession (Score: 20-17)
Bam Sexton attempts a Layup. BLOCKED BY DEJOUNTE HYLAND! Ball deflects out of bounds off Bam Sexton.

[00:11] Team_095 possession (Score: 20-17)
Shaquille Ball drives and kicks out. Kyrie Ming attempts a Midrange. Wide open! Bam Sexton is 6.5 feet away. [ZONE] KYRIE MING MAKES IT! Assist: Dejounte Hyland
Score: 22-17

================================================================================
                              1ST QUARTER COMPLETE                              
================================================================================

1ST QUARTER SCORE: Team_095 22, Team_061 17

BOX SCORE:
================================================================================

Team_095
--------------------------------------------------------------------------------
Player                MIN  PTS  REB  AST  TO      FG   FG%      3P   3P%
--------------------------------------------------------------------------------
Evan Carter            12   10    0    1   0   4/7    57.1     0/0   0.0
Kyrie Ming             12    5    0    1   0   2/2   100.0     0/0   0.0
Immanuel Middleton     12    5    0    0   0   2/3    66.7     0/0   0.0
Dejounte Hyland        12    2    5    4   0   1/3    33.3     0/0   0.0
Shaquille Ball         12    0    7    0   0   0/4     0.0     0/0   0.0

TEAM: FG: 9/19 (47.4%), 3PT: 2/8 (25.0%), REB: 11 (2 off, 9 def), AST: 6, TO: 3
TEAM FOULS: 5 [Team_061 in BONUS]


Team_061
--------------------------------------------------------------------------------
Player                MIN  PTS  REB  AST  TO      FG   FG%      3P   3P%
--------------------------------------------------------------------------------
Draymond Banchero      12    7    2    0   0   3/4    75.0     0/0   0.0
Michael Russell        12    4    7    2   0   2/4    50.0     0/0   0.0
Brandon Russell        12    4    0    1   0   2/5    40.0     0/0   0.0
Bam Sexton             12    2    4    0   0   1/5    20.0     0/0   0.0
Jayson Holiday         12    0    0    1   0   0/1     0.0     0/0   0.0

TEAM: FG: 8/19 (42.1%), 3PT: 2/6 (33.3%), REB: 14 (4 off, 10 def), AST: 4, TO: 2
TEAM FOULS: 3

================================================================================

================================================================================
                       2ND QUARTER - Team_095 vs Team_061                       
================================================================================

[12:00] Team_095 possession (Score: 22-17)
Evan Carter drives to the basket... Evan Carter throws a bad pass! Stolen by Draymond Banchero! TURNOVER! (live ball)

[11:48] Team_061 possession (Score: 22-17)
Brandon Russell attempts a 3Pt. Wide open! Evan Carter is 7.7 feet away. [ZONE] BRANDON RUSSELL MAKES IT! Assist: Draymond Banchero
Score: 22-20

[11:35] Team_095 possession (Score: 22-20)
Dejounte Hyland attempts a 3Pt. Contested by Brandon Russell (4.8 feet, ZONE). DEJOUNTE HYLAND MAKES IT! Assist: Shaquille Ball
Score: 25-20

[11:17] Team_061 possession (Score: 25-20)
Jayson Holiday attempts a Midrange. Contested by Evan Carter (3.2 feet, ZONE). Jayson Holiday misses. Rebound secured by Shaquille Ball.

[11:08] Team_095 possession (Score: 25-20)
Dejounte Hyland attempts a 3Pt. Contested by Brandon Russell (2.5 feet, ZONE). Dejounte Hyland misses. Rebound secured by Draymond Banchero.

[10:53] Team_061 possession (Score: 25-20)
Draymond Banchero drives and kicks out. Brandon Russell attempts a 3Pt. Contested by Evan Carter (4.6 feet, ZONE). Brandon Russell misses. Offensive rebound by Michael Russell! Michael Russell kicks it out.

[10:41] Team_061 possession (Score: 25-20)
Jayson Holiday attempts a 3Pt. Wide open! Shaquille Ball is 6.5 feet away. [ZONE] JAYSON HOLIDAY MAKES IT!
Score: 25-23

[10:28] Team_095 possession (Score: 25-23)
Evan Carter attempts a 3Pt. Contested by Brandon Russell (5.5 feet, ZONE). EVAN CARTER MAKES IT! Assist: Dejounte Hyland
Score: 28-23

[10:18] Team_061 possession (Score: 28-23)
Draymond Banchero attempts a 3Pt. Contested by Kyrie Ming (5.9 feet, MAN). Draymond Banchero misses. Offensive rebound by Michael Russell! Michael Russell kicks it out.

[10:08] Team_061 possession (Score: 28-23)
Jayson Holiday attempts a Midrange. Contested by Shaquille Ball (5.7 feet, MAN). JAYSON HOLIDAY MAKES IT!
Score: 28-25

[09:50] Team_095 possession (Score: 28-25)
Kyrie Ming drives to the basket... Kyrie Ming throws a bad pass! Stolen by Draymond Banchero! TURNOVER! (live ball)

[09:37] Team_061 possession (Score: 28-25)
Draymond Banchero commits a violation (traveling/carry)! TURNOVER! (dead ball)

[09:37] Substitution (Team_095): Dejounte Hyland OUT → Kyle Poole IN (stamina_rule2)

[09:37] Substitution (Team_095): Shaquille Ball OUT → Cade Beal IN (stamina_rule2)

[09:37] Substitution (Team_095): Evan Carter OUT → Tobias Wagner IN (stamina_rule2)

[09:37] Substitution (Team_095): Immanuel Middleton OUT → Gary Davis IN (stamina_rule2)

[09:37] Substitution (Team_095): Kyrie Ming OUT → DeMar McCollum IN (stamina_rule2)

[09:37] Substitution (Team_061): Brandon Russell OUT → Evan Rose IN (stamina_rule2)

[09:37] Substitution (Team_061): Jayson Holiday OUT → Gary Fox IN (stamina_rule2)

[09:37] Substitution (Team_061): Michael Russell OUT → Desmond Morant IN (stamina_rule2)

[09:37] Substitution (Team_061): Bam Sexton OUT → Stephen Towns IN (stamina_rule2)

[09:37] Substitution (Team_061): Draymond Banchero OUT → Tim Durant IN (stamina_rule2)

[09:20] Team_095 possession (Score: 28-25)
Gary Davis attempts a Layup. Contested by Stephen Towns (3.1 feet, MAN). GARY DAVIS MAKES IT! Assist: Kyle Poole
Score: 30-25

[09:02] Team_061 possession (Score: 30-25)
FOUL! Offensive foul on Desmond Morant! Tobias Wagner drew the charge! [Team fouls: 1] (Desmond Morant: 1 personal fouls) TURNOVER! (dead ball)

[08:46] Team_095 possession (Score: 30-25)
Gary Davis drives and kicks out. Tobias Wagner attempts a 3Pt. Wide open! Gary Fox is 6.7 feet away. [ZONE] Tobias Wagner misses. Offensive rebound by DeMar McCollum! DeMar McCollum kicks it out.

[08:35] Team_095 possession (Score: 30-25)
DeMar McCollum attempts a Layup. Contested by Tim Durant (3.0 feet, ZONE). DeMar McCollum misses. Rebound secured by Tim Durant.

[08:20] Team_061 possession (Score: 30-25)
Desmond Morant attempts a 3Pt. Contested by Cade Beal (4.6 feet, ZONE). DESMOND MORANT MAKES IT! Assist: Tim Durant
Score: 30-28

[08:05] Team_095 possession (Score: 30-28)
Gary Davis drives, Tim Durant stays with him. Gary Davis attempts a Layup. Wide open! Tim Durant is 7.1 feet away. [ZONE] Gary Davis misses. FOUL! Loose ball foul on Tim Durant during the rebound battle. [Team fouls: 2] No free throws, side out. (Tim Durant: 1 personal fouls)

[07:51] Team_095 possession (Score: 30-28)
FOUL! Shooting foul on Tim Durant. DeMar McCollum to the line for 2 free throws. [Team fouls: 3] (Tim Durant: 2 personal fouls)   FT 1/2: GOOD   FT 2/2: GOOD DeMar McCollum makes 2/2 from the line.
Score: 32-28

[07:34] Team_061 possession (Score: 32-28)
Gary Fox attempts a Midrange. Contested by Cade Beal (4.3 feet, MAN). GARY FOX MAKES IT!
Score: 32-30

[07:20] Team_095 possession (Score: 32-30)
Kyle Poole loses the ball! Stripped by Evan Rose! TURNOVER! (live ball)

[07:09] Team_061 possession (Score: 32-30)
Evan Rose loses control! Ball rolls out of bounds! TURNOVER! (dead ball)

[06:55] Team_095 possession (Score: 32-30)
FOUL! Shooting foul on Desmond Morant. Cade Beal to the line for 3 free throws. [Team fouls: 4] (Desmond Morant: 2 personal fouls)   FT 1/3: MISS   FT 2/3: MISS   FT 3/3: GOOD Cade Beal makes 1/3 from the line.
Score: 33-30

[06:37] Team_061 possession (Score: 33-30)
Desmond Morant drives and kicks out. Gary Fox attempts a 3Pt. Contested by Cade Beal (4.7 feet, MAN). Gary Fox misses. Rebound secured by DeMar McCollum.

[06:21] Team_095 possession (Score: 33-30)
Cade Beal attempts a 3Pt. Contested by Gary Fox (4.2 feet, MAN). Cade Beal misses. Rebound secured by Stephen Towns.

[06:07] Team_061 possession (Score: 33-30)
Desmond Morant attempts a Midrange. Contested by Tobias Wagner (4.3 feet, ZONE). DESMOND MORANT MAKES IT!
Score: 33-32

[05:55] Team_095 possession (Score: 33-32)
DeMar McCollum drives and kicks out. Kyle Poole attempts a 3Pt. Wide open! Evan Rose is 8.1 feet away. [MAN] Kyle Poole misses. Rebound secured by Stephen Towns.

[05:37] Team_061 possession (Score: 33-32)
Tim Durant drives and kicks out. Tim Durant makes the Midrange and draws the foul on Gary Davis! And-1! Tim Durant to the line for 1. [Team fouls: 1] (Gary Davis: 1 personal fouls)   FT 1/1: GOOD Tim Durant makes 1/1 from the line.
Score: 33-35

[05:26] Team_095 possession (Score: 33-35)
Cade Beal commits a violation (traveling/carry)! TURNOVER! (dead ball)

[05:09] Team_061 possession (Score: 33-35)
Stephen Towns drives to the basket... Stephen Towns commits a violation (traveling/carry)! TURNOVER! (dead ball)

[04:54] Team_095 possession (Score: 33-35)
Tobias Wagner attempts a 3Pt. Wide open! Desmond Morant is 6.5 feet away. [ZONE] TOBIAS WAGNER MAKES IT! Assist: DeMar McCollum
Score: 36-35

[04:41] Team_061 possession (Score: 36-35)
Tim Durant drives and kicks out. Stephen Towns attempts a 3Pt. Contested by Gary Davis (4.4 feet, MAN). STEPHEN TOWNS MAKES IT! Assist: Tim Durant
Score: 36-38

[04:23] Team_095 possession (Score: 36-38)
FOUL! Holding foul on Evan Rose. [IN THE BONUS! 5 team fouls] Kyle Poole to the line for 2 free throws. (Evan Rose: 1 personal fouls)   FT 1/2: GOOD   FT 2/2: MISS Kyle Poole makes 1/2 from the line. Offensive rebound by Tobias Wagner! Tobias Wagner kicks it out.
Score: 37-38

[04:06] Team_095 possession (Score: 37-38)
FOUL! Offensive foul on Cade Beal! Gary Fox drew the charge! [Team fouls: 2] (Cade Beal: 1 personal fouls) TURNOVER! (dead ball)

[03:54] Team_061 possession (Score: 37-38)
Evan Rose attempts a Midrange. Wide open! Kyle Poole is 8.3 feet away. [MAN] Evan Rose misses. Rebound secured by DeMar McCollum.

[03:39] Team_095 possession (Score: 37-38)
Cade Beal attempts a Midrange. Wide open! Gary Fox is 6.0 feet away. [MAN] CADE BEAL MAKES IT!
Score: 39-38

[03:20] Team_061 possession (Score: 39-38)
Tim Durant attempts a Layup. Wide open! DeMar McCollum is 6.8 feet away. [MAN] TIM DURANT MAKES IT! Assist: Desmond Morant
Score: 39-40

[03:02] Team_095 possession (Score: 39-40)
Gary Davis throws a bad pass out of bounds! TURNOVER! (dead ball)

[02:50] Team_061 possession (Score: 39-40)
Gary Fox drives to the basket... FOUL! Offensive foul on Gary Fox! DeMar McCollum drew the charge! [Team fouls: 6] (Gary Fox: 1 personal fouls) TURNOVER! (dead ball)

[02:35] Team_095 possession (Score: 39-40)
Kyle Poole attempts a 3Pt. Wide open! Desmond Morant is 7.1 feet away. [ZONE] KYLE POOLE MAKES IT! Assist: Gary Davis
Score: 42-40

[02:25] Team_061 possession (Score: 42-40)
Stephen Towns attempts a Midrange. Contested by Gary Davis (5.8 feet, MAN). Stephen Towns misses. Rebound secured by Tobias Wagner.

[02:10] Team_095 possession (Score: 42-40)
Tobias Wagner attempts a 3Pt. Contested by Desmond Morant (5.0 feet, ZONE). TOBIAS WAGNER MAKES IT! Assist: Gary Davis
Score: 45-40

[01:56] Team_061 possession (Score: 45-40)
Desmond Morant makes the Layup and draws the foul on Tobias Wagner! And-1! Desmond Morant to the line for 1. [Team fouls: 3] (Tobias Wagner: 1 personal fouls)   FT 1/1: GOOD Desmond Morant makes 1/1 from the line.
Score: 45-43

[01:41] Team_095 possession (Score: 45-43)
Tobias Wagner attempts a Midrange. Contested by Desmond Morant (4.8 feet, MAN). TOBIAS WAGNER MAKES IT!
Score: 47-43

[01:22] Team_061 possession (Score: 47-43)
Desmond Morant attempts a Midrange. Wide open! Gary Davis is 6.0 feet away. [ZONE] DESMOND MORANT MAKES IT!
Score: 47-45

[01:08] Team_095 possession (Score: 47-45)
Cade Beal drives and kicks out. Cade Beal attempts a Midrange. Contested by Gary Fox (5.1 feet, MAN). Cade Beal misses. Offensive rebound by DeMar McCollum! DeMar McCollum kicks it out.

[00:58] Team_095 possession (Score: 47-45)
Gary Davis drives, picks up Stephen Towns. Help arrives from Evan Rose! Gary Davis attempts a Layup. Contested by Evan Rose (3.5 feet, MAN). GARY DAVIS MAKES IT! Assist: DeMar McCollum
Score: 49-45

[00:41] Team_061 possession (Score: 49-45)
Gary Fox loses control! Ball rolls out of bounds! TURNOVER! (dead ball)

[00:30] Team_095 possession (Score: 49-45)
Gary Davis attempts a 3Pt. Contested by Stephen Towns (5.8 feet, MAN). GARY DAVIS MAKES IT! Assist: DeMar McCollum
Score: 52-45

[00:15] Team_061 possession (Score: 52-45)
Desmond Morant attempts a Midrange. Contested by Tobias Wagner (5.1 feet, ZONE). Desmond Morant misses. Rebound secured by Tobias Wagner.

[00:02] Team_095 possession (Score: 52-45)
Tobias Wagner attempts a 3Pt. Contested by Desmond Morant (4.2 feet, MAN). Tobias Wagner misses. Rebound secured by Tim Durant.

================================================================================
                              2ND QUARTER COMPLETE                              
================================================================================

2ND QUARTER SCORE: Team_095 30, Team_061 28

BOX SCORE:
================================================================================

Team_095
--------------------------------------------------------------------------------
Player                MIN  PTS  REB  AST  TO      FG   FG%      3P   3P%
--------------------------------------------------------------------------------
Tobias Wagner          10    8    4    0   0   3/4    75.0     0/0   0.0
Gary Davis             10    7    0    2   0   3/3   100.0     0/0   0.0
Dejounte Hyland        15    3    0    1   0   1/2    50.0     0/0   0.0
Evan Carter            15    3    0    0   0   1/1   100.0     0/0   0.0
Kyle Poole             10    3    0    1   0   1/1   100.0     0/0   0.0
Cade Beal              10    3    0    0   0   2/3    66.7     0/0   0.0
DeMar McCollum         10    2    4    3   0   1/3    33.3     0/0   0.0
Shaquille Ball         15    0    1    1   0   0/0     0.0     0/0   0.0

TEAM: FG: 12/17 (70.6%), 3PT: 7/10 (70.0%), REB: 9 (4 off, 5 def), AST: 8, TO: 6
TEAM FOULS: 3


Team_061
--------------------------------------------------------------------------------
Player                MIN  PTS  REB  AST  TO      FG   FG%      3P   3P%
--------------------------------------------------------------------------------
Desmond Morant         10   10    0    1   0   4/6    66.7     0/0   0.0
Jayson Holiday         15    5    0    0   0   2/3    66.7     0/0   0.0
Tim Durant             10    5    2    2   0   2/2   100.0     0/0   0.0
Brandon Russell        15    3    0    0   0   1/1   100.0     0/0   0.0
Stephen Towns          10    3    2    0   0   1/2    50.0     0/0   0.0
Gary Fox               10    2    0    0   0   1/1   100.0     0/0   0.0
Draymond Banchero      15    0    1    1   0   0/0     0.0     0/0   0.0
Michael Russell        15    0    2    0   0   0/0     0.0     0/0   0.0
Evan Rose              10    0    0    0   0   0/1     0.0     0/0   0.0

TEAM: FG: 11/16 (68.8%), 3PT: 3/3 (100.0%), REB: 7 (2 off, 5 def), AST: 4, TO: 6
TEAM FOULS: 6 [Team_095 in BONUS]

================================================================================

================================================================================
                       3RD QUARTER - Team_095 vs Team_061                       
================================================================================

[12:00] Team_095 possession (Score: 52-45)
Immanuel Middleton drives and kicks out. Kyrie Ming attempts a Midrange. Contested by Jayson Holiday (3.5 feet, ZONE). Kyrie Ming misses. Rebound secured by Michael Russell.

[11:42] Team_061 possession (Score: 52-45)
Bam Sexton drives, picks up Immanuel Middleton. Help arrives from Dejounte Hyland! Bam Sexton attempts a Dunk. Contested by Dejounte Hyland (5.1 feet, MAN). BAM SEXTON MAKES IT! Assist: Draymond Banchero
Score: 52-47

[11:28] Team_095 possession (Score: 52-47)
Kyrie Ming drives, picks up Draymond Banchero. Help arrives from Jayson Holiday! Kyrie Ming attempts a Dunk. Contested by Jayson Holiday (2.2 feet, MAN). KYRIE MING MAKES IT!
Score: 54-47

[11:17] Team_061 possession (Score: 54-47)
Draymond Banchero makes the Layup and draws the foul on Immanuel Middleton! And-1! Draymond Banchero to the line for 1. [Team fouls: 1] (Immanuel Middleton: 1 personal fouls)   FT 1/1: GOOD Draymond Banchero makes 1/1 from the line.
Score: 54-50

[11:06] Team_095 possession (Score: 54-50)
FOUL! Shooting foul on Draymond Banchero. Evan Carter to the line for 2 free throws. [Team fouls: 1] (Draymond Banchero: 1 personal fouls)   FT 1/2: GOOD   FT 2/2: MISS Evan Carter makes 1/2 from the line. Rebound secured by Michael Russell.
Score: 55-50

[10:51] Team_061 possession (Score: 55-50)
Bam Sexton attempts a Layup. Heavily contested by Immanuel Middleton (1.4 feet, ZONE)! BAM SEXTON MAKES IT!
Score: 55-52

[10:38] Team_095 possession (Score: 55-52)
Kyrie Ming drives and kicks out. Evan Carter attempts a Midrange. Contested by Draymond Banchero (5.9 feet, ZONE). EVAN CARTER MAKES IT! Assist: Shaquille Ball
Score: 57-52

[10:21] Team_061 possession (Score: 57-52)
FOUL! Offensive foul on Brandon Russell! Dejounte Hyland drew the charge! [Team fouls: 2] (Brandon Russell: 1 personal fouls) TURNOVER! (dead ball)

[10:05] Team_095 possession (Score: 57-52)
Kyrie Ming drives to the basket... Kyrie Ming loses control! Ball rolls out of bounds! TURNOVER! (dead ball)

[09:51] Team_061 possession (Score: 57-52)
Brandon Russell attempts a Midrange. Wide open! Dejounte Hyland is 6.6 feet away. [MAN] BRANDON RUSSELL MAKES IT!
Score: 57-54

[09:34] Team_095 possession (Score: 57-54)
FOUL! Holding foul on Jayson Holiday. [Team fouls: 3] No free throws, side out. (Jayson Holiday: 1 personal fouls)

[09:22] Team_095 possession (Score: 57-54)
Dejounte Hyland commits a violation (traveling/carry)! TURNOVER! (dead ball)

[09:08] Team_061 possession (Score: 57-54)
Brandon Russell attempts a Midrange. Contested by Dejounte Hyland (3.5 feet, MAN). Brandon Russell misses. FOUL! Loose ball foul on Shaquille Ball during the rebound battle. [Team fouls: 2] No free throws, side out. (Shaquille Ball: 1 personal fouls)

[08:55] Team_061 possession (Score: 57-54)
Brandon Russell drives, Immanuel Middleton stays with him. Brandon Russell attempts a Layup. Contested by Immanuel Middleton (2.5 feet, ZONE). Brandon Russell misses. Rebound secured by Dejounte Hyland.

[08:37] Team_095 possession (Score: 57-54)
Immanuel Middleton attempts a 3Pt. Wide open! Brandon Russell is 6.5 feet away. [ZONE] Immanuel Middleton misses. Rebound secured by Michael Russell.

[08:26] Team_061 possession (Score: 57-54)
Jayson Holiday attempts a 3Pt. Contested by Shaquille Ball (5.8 feet, MAN). Jayson Holiday misses. Rebound secured by Dejounte Hyland.

[08:16] Team_095 possession (Score: 57-54)
Shaquille Ball attempts a 3Pt. Wide open! Michael Russell is 6.6 feet away. [ZONE] Shaquille Ball misses. Rebound secured by Michael Russell.

[08:02] Team_061 possession (Score: 57-54)
Jayson Holiday attempts a 3Pt. Heavily contested by Evan Carter (1.9 feet, ZONE)! Jayson Holiday misses. Rebound secured by Dejounte Hyland.

[07:51] Team_095 possession (Score: 57-54)
Kyrie Ming drives to the basket... FOUL! Offensive foul on Kyrie Ming! Draymond Banchero drew the charge! [Team fouls: 3] (Kyrie Ming: 1 personal fouls) TURNOVER! (dead ball)

[07:42] Team_061 possession (Score: 57-54)
Jayson Holiday attempts a Layup. Wide open! Kyrie Ming is 7.1 feet away. [ZONE] JAYSON HOLIDAY MAKES IT! Assist: Brandon Russell
Score: 57-56

[07:28] Team_095 possession (Score: 57-56)
Shaquille Ball attempts a Layup. BLOCKED BY MICHAEL RUSSELL! Ball is loose! Rebound secured by Michael Russell.

[07:13] Team_061 possession (Score: 57-56)
Draymond Banchero makes the Midrange and draws the foul on Evan Carter! And-1! Draymond Banchero to the line for 1. [Team fouls: 4] (Evan Carter: 1 personal fouls)   FT 1/1: GOOD Draymond Banchero makes 1/1 from the line.
Score: 57-59

[06:56] Team_095 possession (Score: 57-59)
Immanuel Middleton attempts a 3Pt. Contested by Brandon Russell (2.5 feet, ZONE). Immanuel Middleton misses. Rebound secured by Bam Sexton.

[06:44] Team_061 possession (Score: 57-59)
Michael Russell attempts a 3Pt. Contested by Evan Carter (3.4 feet, ZONE). Michael Russell misses. Rebound secured by Evan Carter.

[06:26] Team_095 possession (Score: 57-59)
Shaquille Ball drives, picks up Jayson Holiday. Help arrives from Michael Russell! Shaquille Ball attempts a Dunk. Contested by Michael Russell (4.7 feet, MAN). Shaquille Ball misses. Offensive rebound by Evan Carter! Evan Carter's putback is no good. Rebound secured by Michael Russell.

[06:10] Team_061 possession (Score: 57-59)
Jayson Holiday attempts a Midrange. Contested by Immanuel Middleton (5.4 feet, ZONE). Jayson Holiday misses. Rebound secured by Evan Carter.

[05:56] Team_095 possession (Score: 57-59)
Dejounte Hyland attempts a 3Pt. Contested by Brandon Russell (3.5 feet, MAN). DEJOUNTE HYLAND MAKES IT! Assist: Immanuel Middleton
Score: 60-59

[05:38] Team_061 possession (Score: 60-59)
Michael Russell attempts a 3Pt. Heavily contested by Evan Carter (2.0 feet, ZONE)! MICHAEL RUSSELL MAKES IT! Assist: Brandon Russell
Score: 60-62

[05:25] Team_095 possession (Score: 60-62)
Immanuel Middleton drives, Bam Sexton stays with him. Immanuel Middleton attempts a Dunk. Heavily contested by Bam Sexton (1.6 feet, MAN)! Immanuel Middleton misses. Rebound secured by Michael Russell.

[05:09] Team_061 possession (Score: 60-62)
FOUL! Reach-in foul on Immanuel Middleton during the drive. [IN THE BONUS! 5 team fouls] Brandon Russell to the line for 2 free throws. (Immanuel Middleton: 2 personal fouls)   FT 1/2: GOOD   FT 2/2: GOOD Brandon Russell makes 2/2 from the line.
Score: 60-64

[05:00] Team_095 possession (Score: 60-64)
Kyrie Ming drives to the basket... Kyrie Ming loses control! Ball rolls out of bounds! TURNOVER! (dead ball)

[04:47] Team_061 possession (Score: 60-64)
Draymond Banchero attempts a Midrange. Wide open! Kyrie Ming is 6.6 feet away. [MAN] Draymond Banchero misses. Rebound secured by Dejounte Hyland.

[04:29] Team_095 possession (Score: 60-64)
Kyrie Ming attempts a Midrange. Contested by Bam Sexton (5.4 feet, ZONE). Kyrie Ming misses. Rebound secured by Draymond Banchero.

[04:13] Team_061 possession (Score: 60-64)
Jayson Holiday attempts a Layup. Contested by Shaquille Ball (2.2 feet, MAN). JAYSON HOLIDAY MAKES IT! Assist: Brandon Russell
Score: 60-66

[04:02] Team_095 possession (Score: 60-66)
Immanuel Middleton attempts a 3Pt. Wide open! Brandon Russell is 6.5 feet away. [ZONE] Immanuel Middleton misses. Rebound secured by Michael Russell.

[03:50] Team_061 possession (Score: 60-66)
Michael Russell attempts a Layup. Heavily contested by Evan Carter (1.0 feet, MAN)! MICHAEL RUSSELL MAKES IT! Assist: Draymond Banchero
Score: 60-68

[03:31] Team_095 possession (Score: 60-68)
Evan Carter attempts a Layup. Contested by Draymond Banchero (2.4 feet, ZONE). Evan Carter misses. Rebound secured by Michael Russell.

[03:18] Team_061 possession (Score: 60-68)
Bam Sexton drives to the basket... FOUL! Offensive foul on Bam Sexton! Immanuel Middleton drew the charge! [Team fouls: 4] (Bam Sexton: 1 personal fouls) TURNOVER! (dead ball)

[03:03] Team_095 possession (Score: 60-68)
Immanuel Middleton attempts a 3Pt. Wide open! Bam Sexton is 8.2 feet away. [MAN] Immanuel Middleton misses. Offensive rebound by Dejounte Hyland! Dejounte Hyland kicks it out.

[02:51] Team_095 possession (Score: 60-68)
Shaquille Ball attempts a Midrange. Contested by Jayson Holiday (3.6 feet, MAN). Shaquille Ball misses. Rebound secured by Michael Russell.

[02:36] Team_061 possession (Score: 60-68)
Michael Russell attempts a 3Pt. Contested by Evan Carter (5.5 feet, ZONE). Michael Russell misses. Rebound secured by Evan Carter.

[02:21] Team_095 possession (Score: 60-68)
Shaquille Ball attempts a 3Pt. Contested by Jayson Holiday (5.6 feet, MAN). Shaquille Ball misses. Rebound secured by Draymond Banchero.

[02:10] Team_061 possession (Score: 60-68)
Bam Sexton attempts a 3Pt. Contested by Immanuel Middleton (5.3 feet, MAN). Bam Sexton misses. Rebound secured by Evan Carter.

[01:54] Team_095 possession (Score: 60-68)
Kyrie Ming drives and kicks out. Shaquille Ball attempts a 3Pt. Heavily contested by Brandon Russell (0.5 feet, ZONE)! Shaquille Ball misses. Offensive rebound by Evan Carter! Evan Carter's putback is no good. Rebound secured by Michael Russell.

[01:36] Team_061 possession (Score: 60-68)
Draymond Banchero attempts a Layup. BLOCKED BY IMMANUEL MIDDLETON! Ball is loose! Rebound secured by Evan Carter.

[01:19] Team_095 possession (Score: 60-68)
Shaquille Ball attempts a Midrange. Contested by Michael Russell (4.7 feet, ZONE). SHAQUILLE BALL MAKES IT!
Score: 62-68

[01:03] Team_061 possession (Score: 62-68)
Draymond Banchero attempts a Midrange. Wide open! Immanuel Middleton is 8.3 feet away. [ZONE] Draymond Banchero misses. Rebound secured by Shaquille Ball.

[00:50] Team_095 possession (Score: 62-68)
Immanuel Middleton attempts a Layup. BLOCKED BY JAYSON HOLIDAY! Ball deflects out of bounds off Immanuel Middleton.

[00:39] Team_061 possession (Score: 62-68)
Brandon Russell drives and kicks out. Bam Sexton attempts a Midrange. Contested by Immanuel Middleton (5.1 feet, MAN). BAM SEXTON MAKES IT!
Score: 62-70

[00:28] Team_095 possession (Score: 62-70)
Kyrie Ming drives, picks up Draymond Banchero. Help arrives from Jayson Holiday! Kyrie Ming attempts a Layup. Heavily contested by Jayson Holiday (0.5 feet, MAN)! Kyrie Ming misses. Rebound secured by Michael Russell.

[00:15] Team_061 possession (Score: 62-70)
Brandon Russell attempts a 3Pt. Contested by Dejounte Hyland (2.8 feet, MAN). Brandon Russell misses. Rebound secured by Dejounte Hyland.

[00:01] Team_095 possession (Score: 62-70)
FOUL! Offensive foul on Evan Carter! Michael Russell drew the charge! [Team fouls: 6] (Evan Carter: 2 personal fouls) TURNOVER! (dead ball)

================================================================================
                              3RD QUARTER COMPLETE                              
================================================================================

3RD QUARTER SCORE: Team_095 10, Team_061 25

BOX SCORE:
================================================================================

Team_095
--------------------------------------------------------------------------------
Player                MIN  PTS  REB  AST  TO      FG   FG%      3P   3P%
--------------------------------------------------------------------------------
Dejounte Hyland        27    3    6    0   0   1/1   100.0     0/0   0.0
Kyrie Ming             27    2    0    0   0   1/4    25.0     0/0   0.0
Evan Carter            27    2    5    0   0   1/3    33.3     0/0   0.0
Shaquille Ball         27    2    1    1   0   1/6    16.7     0/0   0.0
Immanuel Middleton     27    0    0    1   0   0/6     0.0     0/0   0.0

TEAM: FG: 4/20 (20.0%), 3PT: 1/6 (16.7%), REB: 14 (3 off, 11 def), AST: 2, TO: 5
TEAM FOULS: 6 [Team_061 in BONUS]


Team_061
--------------------------------------------------------------------------------
Player                MIN  PTS  REB  AST  TO      FG   FG%      3P   3P%
--------------------------------------------------------------------------------
Bam Sexton             27    6    1    0   0   3/4    75.0     0/0   0.0
Draymond Banchero      27    6    3    2   0   2/5    40.0     0/0   0.0
Michael Russell        27    5   12    0   0   2/4    50.0     0/0   0.0
Brandon Russell        27    4    0    3   0   2/4    50.0     0/0   0.0
Jayson Holiday         27    4    0    0   0   2/5    40.0     0/0   0.0

TEAM: FG: 11/22 (50.0%), 3PT: 1/7 (14.3%), REB: 14 (1 off, 13 def), AST: 5, TO: 2
TEAM FOULS: 4

================================================================================

================================================================================
                       4TH QUARTER - Team_095 vs Team_061                       
================================================================================

[12:00] Team_095 possession (Score: 62-70)
Dejounte Hyland attempts a Midrange. Contested by Brandon Russell (4.8 feet, ZONE). DEJOUNTE HYLAND MAKES IT!
Score: 64-70

[11:42] Team_061 possession (Score: 64-70)
Jayson Holiday attempts a Midrange. Contested by Shaquille Ball (3.9 feet, MAN). Jayson Holiday misses. Rebound secured by Shaquille Ball.

[11:27] Team_095 possession (Score: 64-70)
Shaquille Ball attempts a Midrange. Contested by Jayson Holiday (4.5 feet, ZONE). SHAQUILLE BALL MAKES IT!
Score: 66-70

[11:14] Team_061 possession (Score: 66-70)
Brandon Russell attempts a 3Pt. Heavily contested by Evan Carter (1.5 feet, ZONE)! Brandon Russell misses. Offensive rebound by Draymond Banchero! Draymond Banchero's putback is no good. Rebound secured by Evan Carter.

[11:02] Team_095 possession (Score: 66-70)
Kyrie Ming drives, Draymond Banchero stays with him. Kyrie Ming attempts a Dunk. Contested by Draymond Banchero (2.9 feet, MAN). Kyrie Ming misses. Rebound secured by Michael Russell.

[10:45] Team_061 possession (Score: 66-70)
Michael Russell drives and kicks out. Brandon Russell attempts a 3Pt. Contested by Shaquille Ball (4.8 feet, ZONE). Brandon Russell misses. Rebound secured by Dejounte Hyland.

[10:30] Team_095 possession (Score: 66-70)
Shaquille Ball drives, Draymond Banchero stays with him. Shaquille Ball attempts a Dunk. Heavily contested by Draymond Banchero (0.6 feet, ZONE)! SHAQUILLE BALL MAKES IT! Assist: Kyrie Ming
Score: 68-70

[10:15] Team_061 possession (Score: 68-70)
Jayson Holiday attempts a 3Pt. Contested by Shaquille Ball (5.0 feet, MAN). Jayson Holiday misses. Offensive rebound by Draymond Banchero! Draymond Banchero puts it back in!
Score: 68-72

[10:01] Team_095 possession (Score: 68-72)
FOUL! Shooting foul on Michael Russell. Evan Carter to the line for 2 free throws. [Team fouls: 1] (Michael Russell: 1 personal fouls)   FT 1/2: GOOD   FT 2/2: GOOD Evan Carter makes 2/2 from the line.
Score: 70-72

[09:51] Team_061 possession (Score: 70-72)
Jayson Holiday makes the Layup and draws the foul on Kyrie Ming! And-1! Jayson Holiday to the line for 1. [Team fouls: 1] (Kyrie Ming: 1 personal fouls)   FT 1/1: GOOD Jayson Holiday makes 1/1 from the line.
Score: 70-75

[09:37] Team_095 possession (Score: 70-75)
Evan Carter attempts a Midrange. Contested by Michael Russell (5.1 feet, ZONE). Evan Carter misses. Rebound secured by Michael Russell.

[09:20] Team_061 possession (Score: 70-75)
Michael Russell drives, Immanuel Middleton stays with him. Michael Russell attempts a Layup. Wide open! Immanuel Middleton is 6.0 feet away. [ZONE] MICHAEL RUSSELL MAKES IT!
Score: 70-77

[09:05] Team_095 possession (Score: 70-77)
Kyrie Ming attempts a 3Pt. Contested by Brandon Russell (5.5 feet, ZONE). Kyrie Ming misses. Rebound secured by Bam Sexton.

[08:53] Team_061 possession (Score: 70-77)
FOUL! Shooting foul on Evan Carter. Brandon Russell to the line for 2 free throws. [Team fouls: 2] (Evan Carter: 1 personal fouls)   FT 1/2: MISS   FT 2/2: GOOD Brandon Russell makes 1/2 from the line.
Score: 70-78

[08:39] Team_095 possession (Score: 70-78)
Dejounte Hyland drives to the basket... Dejounte Hyland throws a bad pass out of bounds! TURNOVER! (dead ball)

[08:39] Substitution (Team_095): Dejounte Hyland OUT → Kyle Poole IN (stamina_rule2)

[08:39] Substitution (Team_095): Shaquille Ball OUT → Cade Beal IN (stamina_rule2)

[08:39] Substitution (Team_095): Evan Carter OUT → Tobias Wagner IN (stamina_rule2)

[08:39] Substitution (Team_095): Immanuel Middleton OUT → Gary Davis IN (stamina_rule2)

[08:39] Substitution (Team_095): Kyrie Ming OUT → DeMar McCollum IN (stamina_rule2)

[08:39] Substitution (Team_061): Brandon Russell OUT → Evan Rose IN (stamina_rule2)

[08:39] Substitution (Team_061): Jayson Holiday OUT → Gary Fox IN (stamina_rule2)

[08:39] Substitution (Team_061): Michael Russell OUT → Desmond Morant IN (stamina_rule2)

[08:39] Substitution (Team_061): Bam Sexton OUT → Stephen Towns IN (stamina_rule2)

[08:39] Substitution (Team_061): Draymond Banchero OUT → Tim Durant IN (stamina_rule2)

[08:21] Team_061 possession (Score: 70-78)
Tim Durant attempts a Midrange. Contested by DeMar McCollum (5.7 feet, MAN). Tim Durant misses. Offensive rebound by Stephen Towns! Stephen Towns kicks it out.

[08:08] Team_061 possession (Score: 70-78)
Desmond Morant attempts a 3Pt. Contested by Cade Beal (5.7 feet, ZONE). Desmond Morant misses. Rebound secured by Gary Davis.

[07:52] Team_095 possession (Score: 70-78)
DeMar McCollum drives, Tim Durant stays with him. DeMar McCollum attempts a Dunk. Contested by Tim Durant (3.8 feet, MAN). DeMar McCollum misses. Rebound secured by Desmond Morant.

[07:40] Team_061 possession (Score: 70-78)
Evan Rose drives, Kyle Poole stays with him. Evan Rose attempts a Layup. Contested by Kyle Poole (5.1 feet, MAN). EVAN ROSE MAKES IT!
Score: 70-80

[07:26] Team_095 possession (Score: 70-80)
DeMar McCollum drives, picks up Tim Durant. Help arrives from Evan Rose! DeMar McCollum attempts a Dunk. Contested by Evan Rose (3.4 feet, MAN). DeMar McCollum misses. Offensive rebound by Tobias Wagner! Tobias Wagner kicks it out.

[07:11] Team_095 possession (Score: 70-80)
Cade Beal drives, Gary Fox stays with him. Cade Beal attempts a Dunk. Contested by Gary Fox (3.4 feet, MAN). CADE BEAL MAKES IT! Assist: DeMar McCollum
Score: 72-80

[06:59] Team_061 possession (Score: 72-80)
Desmond Morant attempts a 3Pt. Contested by Tobias Wagner (5.8 feet, MAN). Desmond Morant misses. Offensive rebound by Stephen Towns! Stephen Towns kicks it out.

[06:44] Team_061 possession (Score: 72-80)
Desmond Morant attempts a 3Pt. Contested by Tobias Wagner (3.5 feet, MAN). DESMOND MORANT MAKES IT! Assist: Tim Durant
Score: 72-83

[06:26] Team_095 possession (Score: 72-83)
Gary Davis drives and kicks out. Kyle Poole attempts a Midrange. Wide open! Evan Rose is 6.6 feet away. [MAN] Kyle Poole misses. Offensive rebound by Tobias Wagner! Tobias Wagner kicks it out.

[06:11] Team_095 possession (Score: 72-83)
Tobias Wagner attempts a Midrange. Wide open! Gary Fox is 8.6 feet away. [ZONE] Tobias Wagner misses. Rebound secured by Stephen Towns.

[05:53] Team_061 possession (Score: 72-83)
Gary Fox drives to the basket... Gary Fox loses control! Ball rolls out of bounds! TURNOVER! (dead ball)

[05:34] Team_095 possession (Score: 72-83)
Cade Beal attempts a 3Pt. Wide open! Gary Fox is 7.6 feet away. [MAN] CADE BEAL MAKES IT!
Score: 75-83

[05:19] Team_061 possession (Score: 75-83)
Stephen Towns attempts a Midrange. Wide open! Gary Davis is 7.2 feet away. [MAN] Stephen Towns misses. Rebound secured by Gary Davis.

[05:05] Team_095 possession (Score: 75-83)
Kyle Poole attempts a 3Pt. Wide open! Desmond Morant is 6.4 feet away. [ZONE] Kyle Poole misses. Offensive rebound by DeMar McCollum! DeMar McCollum kicks it out.

[04:53] Team_095 possession (Score: 75-83)
DeMar McCollum attempts a Layup. Contested by Tim Durant (5.4 feet, MAN). DEMAR MCCOLLUM MAKES IT! Assist: Kyle Poole
Score: 77-83

[04:42] Team_061 possession (Score: 77-83)
Tim Durant attempts a Layup. BLOCKED BY DEMAR MCCOLLUM! Ball deflects out of bounds off Tim Durant.

[04:25] Team_095 possession (Score: 77-83)
DeMar McCollum drives to the basket... FOUL! Offensive foul on DeMar McCollum! Tim Durant drew the charge! [Team fouls: 3] (DeMar McCollum: 1 personal fouls) TURNOVER! (dead ball)

[04:09] Team_061 possession (Score: 77-83)
Evan Rose attempts a Midrange. Wide open! Cade Beal is 8.2 feet away. [ZONE] Evan Rose misses. Rebound secured by Tobias Wagner.

[03:57] Team_095 possession (Score: 77-83)
Gary Davis loses control! Ball rolls out of bounds! TURNOVER! (dead ball)

[03:43] Team_061 possession (Score: 77-83)
Stephen Towns attempts a Midrange. Wide open! Cade Beal is 6.5 feet away. [ZONE] STEPHEN TOWNS MAKES IT! Assist: Tim Durant
Score: 77-85

[03:29] Team_095 possession (Score: 77-85)
Cade Beal attempts a 3Pt. Contested by Desmond Morant (5.6 feet, ZONE). Cade Beal misses. Rebound secured by Stephen Towns.

[03:11] Team_061 possession (Score: 77-85)
Gary Fox attempts a 3Pt. Contested by Cade Beal (5.3 feet, MAN). Gary Fox misses. Rebound secured by Tobias Wagner.

[03:00] Team_095 possession (Score: 77-85)
FOUL! Reach-in foul on Gary Fox during the drive. [Team fouls: 2] No free throws, side out. (Gary Fox: 1 personal fouls)

[02:46] Team_095 possession (Score: 77-85)
FOUL! Offensive foul on Gary Davis! Stephen Towns drew the charge! [Team fouls: 4] (Gary Davis: 1 personal fouls) TURNOVER! (dead ball)

[02:30] Team_061 possession (Score: 77-85)
Tim Durant throws a bad pass! Stolen by DeMar McCollum! TURNOVER! (live ball)

[02:19] Team_095 possession (Score: 77-85)
DeMar McCollum drives to the basket... FOUL! Offensive foul on DeMar McCollum! Tim Durant drew the charge! [Team fouls: 5] (DeMar McCollum: 2 personal fouls) TURNOVER! (dead ball)

[02:02] Team_061 possession (Score: 77-85)
Desmond Morant attempts a 3Pt. Contested by Cade Beal (3.5 feet, ZONE). DESMOND MORANT MAKES IT! Assist: Tim Durant
Score: 77-88

[01:51] Team_095 possession (Score: 77-88)
DeMar McCollum attempts a 3Pt. Wide open! Tim Durant is 7.4 feet away. [MAN] DeMar McCollum misses. Offensive rebound by Tobias Wagner! Tobias Wagner kicks it out.

[01:40] Team_095 possession (Score: 77-88)
Gary Davis attempts a Midrange. Wide open! Stephen Towns is 9.2 feet away. [ZONE] Gary Davis misses. Rebound secured by Stephen Towns.

[01:26] Team_061 possession (Score: 77-88)
FOUL! Reach-in foul on DeMar McCollum during the drive. [IN THE BONUS! 6 team fouls] Tim Durant to the line for 2 free throws. (DeMar McCollum: 3 personal fouls)   FT 1/2: GOOD   FT 2/2: MISS Tim Durant makes 1/2 from the line. Rebound secured by DeMar McCollum.
Score: 77-89

[01:16] Team_095 possession (Score: 77-89)
Cade Beal attempts a Layup. Contested by Gary Fox (5.3 feet, MAN). Cade Beal misses. Rebound secured by Stephen Towns.

[00:58] Team_061 possession (Score: 77-89)
Gary Fox attempts a Midrange. Contested by Cade Beal (4.4 feet, ZONE). GARY FOX MAKES IT! Assist: Desmond Morant
Score: 77-91

[00:47] Team_095 possession (Score: 77-91)
Cade Beal attempts a Midrange. Wide open! Gary Fox is 6.8 feet away. [ZONE] CADE BEAL MAKES IT! Assist: Kyle Poole
Score: 79-91

[00:33] Team_061 possession (Score: 79-91)
Stephen Towns throws a bad pass! Stolen by Gary Davis! TURNOVER! (live ball)

[00:20] Team_095 possession (Score: 79-91)
DeMar McCollum attempts a Midrange. Heavily contested by Tim Durant (2.0 feet, MAN)! DEMAR MCCOLLUM MAKES IT!
Score: 81-91

[00:08] Team_061 possession (Score: 81-91)
Evan Rose attempts a 3Pt. Heavily contested by Cade Beal (1.9 feet, ZONE)! Evan Rose misses. Rebound secured by DeMar McCollum.

================================================================================
                              4TH QUARTER COMPLETE                              
================================================================================

4TH QUARTER SCORE: Team_095 19, Team_061 21

BOX SCORE:
================================================================================

Team_095
--------------------------------------------------------------------------------
Player                MIN  PTS  REB  AST  TO      FG   FG%      3P   3P%
--------------------------------------------------------------------------------
Cade Beal              18    7    0    0   0   3/5    60.0     0/0   0.0
Shaquille Ball         31    4    1    0   0   2/2   100.0     0/0   0.0
DeMar McCollum         18    4    3    1   0   2/3    66.7     0/0   0.0
Dejounte Hyland        31    2    1    0   0   1/1   100.0     0/0   0.0
Evan Carter            31    2    1    0   0   1/2    50.0     0/0   0.0
Kyrie Ming             31    0    0    1   0   0/2     0.0     0/0   0.0
Gary Davis             18    0    2    0   0   0/1     0.0     0/0   0.0
Tobias Wagner          18    0    5    0   0   0/1     0.0     0/0   0.0
Kyle Poole             18    0    0    2   0   0/0     0.0     0/0   0.0

TEAM: FG: 9/17 (52.9%), 3PT: 1/3 (33.3%), REB: 12 (4 off, 8 def), AST: 4, TO: 5
TEAM FOULS: 6 [Team_061 in BONUS]


Team_061
--------------------------------------------------------------------------------
Player                MIN  PTS  REB  AST  TO      FG   FG%      3P   3P%
--------------------------------------------------------------------------------
Desmond Morant         18    6    1    1   0   2/3    66.7     0/0   0.0
Jayson Holiday         31    3    0    0   0   1/2    50.0     0/0   0.0
Michael Russell        31    2    2    0   0   1/2    50.0     0/0   0.0
Draymond Banchero      31    2    1    0   0   1/1   100.0     0/0   0.0
Stephen Towns          18    2    6    0   0   1/2    50.0     0/0   0.0
Evan Rose              18    2    0    0   0   1/3    33.3     0/0   0.0
Gary Fox               18    2    0    0   0   1/2    50.0     0/0   0.0
Brandon Russell        31    1    0    0   0   1/2    50.0     0/0   0.0
Bam Sexton             31    0    1    0   0   0/0     0.0     0/0   0.0
Tim Durant             18    0    0    3   0   0/2     0.0     0/0   0.0

TEAM: FG: 9/19 (47.4%), 3PT: 3/7 (42.9%), REB: 12 (4 off, 8 def), AST: 4, TO: 3
TEAM FOULS: 2

================================================================================

================================================================================
                               FULL GAME COMPLETE                               
================================================================================

FINAL SCORE: Team_095 81, Team_061 91

SCORING BY QUARTER:
--------------------------------------------------------------------------------
Team                     Q1     Q2     Q3     Q4    FINAL
--------------------------------------------------------------------------------
Team_095                 22     30     10     19       81
Team_061                 17     28     25     21       91
--------------------------------------------------------------------------------

FULL GAME BOX SCORE:
================================================================================

Team_095
--------------------------------------------------------------------------------
Player                MIN  PTS  REB  AST  TO      FG   FG%      3P   3P%      FT STL BLK
--------------------------------------------------------------------------------
Dejounte Hyland        31   10   12    5   3   4/7    57.1   2/4    50.0   0/0     0   1
Shaquille Ball         31    6   10    2   1   4/13   30.8   0/4     0.0   0/0     0   0
Evan Carter            31   17    6    1   4   6/12   50.0   2/4    50.0   4/5     0   0
Immanuel Middleton     31    5    0    1   0   2/9    22.2   1/5    20.0   0/0     1   1
Kyrie Ming             31    7    0    2   3   3/8    37.5   0/1     0.0   1/1     0   0
Kyle Poole             18    3    0    3   2   1/1   100.0   1/1   100.0   1/2     0   0
Cade Beal              18   10    0    0   2   5/8    62.5   2/4    50.0   1/3     0   0
Tobias Wagner          18    8    9    0   0   3/5    60.0   2/3    66.7   0/0     0   0
Gary Davis             18    7    2    2   4   3/4    75.0   1/1   100.0   0/0     1   0
DeMar McCollum         18    6    7    4   0   3/6    50.0   0/0     0.0   2/2     1   1

TEAM: FG: 34/73 (46.6%), 3PT: 11/27 (40.7%), REB: 46 (13 off, 33 def), AST: 20, TO: 19


Team_061
--------------------------------------------------------------------------------
Player                MIN  PTS  REB  AST  TO      FG   FG%      3P   3P%      FT STL BLK
--------------------------------------------------------------------------------
Brandon Russell        31   12    0    4   2   7/13   53.8   2/6    33.3   3/4     1   0
Jayson Holiday         31   12    0    1   0   7/13   53.8   2/4    50.0   1/1     1   1
Michael Russell        31   11   23    2   0   3/8    37.5   1/4    25.0   0/0     0   1
Bam Sexton             31    8    6    0   1   3/8    37.5   0/2     0.0   0/0     0   1
Draymond Banchero      31   15    7    3   2   6/10   60.0   1/1   100.0   2/2     2   0
Evan Rose              18    2    0    0   1   1/4    25.0   0/1     0.0   0/0     1   0
Gary Fox               18    4    0    0   1   2/3    66.7   0/1     0.0   0/0     0   0
Desmond Morant         18   16    1    2   1   6/9    66.7   3/4    75.0   1/1     0   0
Stephen Towns          18    5    8    0   2   1/3    33.3   0/0     0.0   0/0     0   0
Tim Durant             18    5    2    5   3   3/5    60.0   0/0     0.0   2/3     0   0

TEAM: FG: 39/76 (51.3%), 3PT: 9/23 (39.1%), REB: 47 (11 off, 36 def), AST: 17, TO: 13

================================================================================
