================================================================================
                        FULL GAME - Team_004 vs Team_049                        
================================================================================

================================================================================
                       1ST QUARTER - Team_004 vs Team_049                       
================================================================================

[12:00] Team_004 possession (Score: 0-0)
Michael Curry attempts a 3Pt. Wide open! Shai Bird is 7.1 feet away. [MAN] MICHAEL CURRY MAKES IT! Assist: Dwyane Irving
Score: 3-0

[11:49] Team_049 possession (Score: 3-0)
Shai Mobley makes the Midrange and draws the foul on Anthony Lillard! And-1! Shai Mobley to the line for 1. [Team fouls: 1] (Anthony Lillard: 1 personal fouls)   FT 1/1: MISS Shai Mobley makes 0/1 from the line. Rebound secured by Dwyane Irving.
Score: 3-2

[11:37] Team_004 possession (Score: 3-2)
Draymond Fox attempts a 3Pt. Contested by Ja Oladipo (2.4 feet, ZONE). Draymond Fox misses. Rebound secured by Shai Mobley.

[11:24] Team_049 possession (Score: 3-2)
De'Aaron Allen attempts a 3Pt. Contested by Jabari Wade (4.4 feet, ZONE). DE'AARON ALLEN MAKES IT! Assist: Jimmy Griffin
Score: 3-5

[11:10] Team_004 possession (Score: 3-5)
Anthony Lillard drives, picks up Shai Mobley. Help arrives from Ja Oladipo! Anthony Lillard attempts a Dunk. Contested by Ja Oladipo (2.8 feet, MAN). ANTHONY LILLARD MAKES IT!
Score: 5-5

[10:57] Team_049 possession (Score: 5-5)
Shai Mobley attempts a 3Pt. Contested by Michael Curry (4.5 feet, ZONE). Shai Mobley misses. Rebound secured by Anthony Lillard.

[10:44] Team_004 possession (Score: 5-5)
FOUL! Offensive foul on Dwyane Irving! Jimmy Griffin drew the charge! [Team fouls: 2] (Dwyane Irving: 1 personal fouls) TURNOVER! (dead ball)

[10:27] Team_049 possession (Score: 5-5)
FOUL! Holding foul on Jabari Wade. [Team fouls: 3] No free throws, side out. (Jabari Wade: 1 personal fouls)

[10:15] Team_049 possession (Score: 5-5)
Jimmy Griffin attempts a 3Pt. Wide open! Michael Curry is 7.5 feet away. [ZONE] Jimmy Griffin misses. Rebound secured by Dwyane Irving.

[10:00] Team_004 possession (Score: 5-5)
Michael Curry attempts a Midrange. Contested by Shai Bird (4.6 feet, MAN). MICHAEL CURRY MAKES IT!
Score: 7-5

[09:47] Team_049 possession (Score: 7-5)
Shai Mobley drives and kicks out. De'Aaron Allen attempts a 3Pt. Wide open! Michael Curry is 8.5 feet away. [ZONE] De'Aaron Allen misses. Rebound secured by Draymond Fox.

[09:30] Team_004 possession (Score: 7-5)
Anthony Lillard attempts a Midrange. Heavily contested by Shai Mobley (1.4 feet, MAN)! Anthony Lillard misses. Rebound secured by De'Aaron Allen.

[09:14] Team_049 possession (Score: 7-5)
Ja Oladipo attempts a Midrange. Contested by Draymond Fox (4.2 feet, ZONE). Ja Oladipo misses. Rebound secured by Anthony Lillard.

[08:58] Team_004 possession (Score: 7-5)
Anthony Lillard drives and kicks out. Dwyane Irving attempts a Midrange. Contested by Ja Oladipo (4.6 feet, ZONE). Dwyane Irving misses. Rebound secured by Shai Mobley.

[08:40] Team_049 possession (Score: 7-5)
De'Aaron Allen attempts a 3Pt. Contested by Michael Curry (4.0 feet, ZONE). DE'AARON ALLEN MAKES IT! Assist: Jimmy Griffin
Score: 7-8

[08:23] Team_004 possession (Score: 7-8)
Dwyane Irving attempts a 3Pt. Contested by Ja Oladipo (3.6 feet, ZONE). Dwyane Irving misses. Rebound secured by Shai Mobley.

[08:11] Team_049 possession (Score: 7-8)
Jimmy Griffin attempts a 3Pt. Wide open! Dwyane Irving is 7.9 feet away. [MAN] Jimmy Griffin misses. Rebound secured by Anthony Lillard.

[08:01] Team_004 possession (Score: 7-8)
Anthony Lillard attempts a Layup. Heavily contested by Shai Mobley (0.5 feet, MAN)! ANTHONY LILLARD MAKES IT!
Score: 9-8

[07:43] Team_049 possession (Score: 9-8)
Shai Mobley attempts a Layup. Contested by Anthony Lillard (2.7 feet, MAN). SHAI MOBLEY MAKES IT! Assist: Shai Bird
Score: 9-10

[07:25] Team_004 possession (Score: 9-10)
Draymond Fox attempts a Midrange. Contested by De'Aaron Allen (4.4 feet, MAN). DRAYMOND FOX MAKES IT! Assist: Jabari Wade
Score: 11-10

[07:09] Team_049 possession (Score: 11-10)
Jimmy Griffin attempts a Midrange. Wide open! Anthony Lillard is 6.5 feet away. [ZONE] JIMMY GRIFFIN MAKES IT! Assist: Shai Mobley
Score: 11-12

[06:57] Team_004 possession (Score: 11-12)
Michael Curry attempts a Layup. Contested by Shai Bird (4.0 feet, MAN). MICHAEL CURRY MAKES IT! Assist: Anthony Lillard
Score: 13-12

[06:40] Team_049 possession (Score: 13-12)
Ja Oladipo drives, Jabari Wade stays with him. Ja Oladipo attempts a Layup. Heavily contested by Jabari Wade (1.2 feet, MAN)! JA OLADIPO MAKES IT!
Score: 13-14

[06:28] Team_004 possession (Score: 13-14)
FOUL! Holding foul on De'Aaron Allen. [Team fouls: 1] No free throws, side out. (De'Aaron Allen: 1 personal fouls)

[06:10] Team_004 possession (Score: 13-14)
Michael Curry attempts a 3Pt. Wide open! Shai Bird is 6.9 feet away. [MAN] Michael Curry misses. Offensive rebound by Draymond Fox! Draymond Fox kicks it out.

[05:56] Team_004 possession (Score: 13-14)
Draymond Fox throws a bad pass out of bounds! TURNOVER! (dead ball)

[05:37] Team_049 possession (Score: 13-14)
FOUL! Holding foul on Dwyane Irving. [Team fouls: 4] No free throws, side out. (Dwyane Irving: 2 personal fouls)

[05:24] Team_049 possession (Score: 13-14)
Ja Oladipo attempts a 3Pt. Wide open! Michael Curry is 9.6 feet away. [ZONE] Ja Oladipo misses. Rebound secured by Anthony Lillard.

[05:08] Team_004 possession (Score: 13-14)
Dwyane Irving attempts a 3Pt. Wide open! Jimmy Griffin is 7.6 feet away. [ZONE] Dwyane Irving misses. Rebound secured by Shai Mobley.

[04:56] Team_049 possession (Score: 13-14)
De'Aaron Allen drives, Draymond Fox stays with him. De'Aaron Allen attempts a Dunk. Contested by Draymond Fox (3.9 feet, MAN). DE'AARON ALLEN MAKES IT! Assist: Jimmy Griffin
Score: 13-16

[04:43] Team_004 possession (Score: 13-16)
FOUL! Reach-in foul on De'Aaron Allen during the drive. [Team fouls: 2] No free throws, side out. (De'Aaron Allen: 2 personal fouls)

[04:28] Team_004 possession (Score: 13-16)
Draymond Fox attempts a 3Pt. Contested by De'Aaron Allen (3.4 feet, ZONE). Draymond Fox misses. FOUL! Loose ball foul on De'Aaron Allen during the rebound battle. [Team fouls: 3] No free throws, side out. (De'Aaron Allen: 3 personal fouls)

[04:13] Team_004 possession (Score: 13-16)
FOUL! Shooting foul on De'Aaron Allen. Draymond Fox to the line for 2 free throws. [Team fouls: 4] (De'Aaron Allen: 4 personal fouls)   FT 1/2: GOOD   FT 2/2: GOOD Draymond Fox makes 2/2 from the line.
Score: 15-16

[03:59] Team_049 possession (Score: 15-16)
Jimmy Griffin attempts a 3Pt. Wide open! Dwyane Irving is 6.5 feet away. [MAN] Jimmy Griffin misses. Offensive rebound by De'Aaron Allen! De'Aaron Allen kicks it out.

[03:45] Team_049 possession (Score: 15-16)
De'Aaron Allen attempts a 3Pt. Contested by Michael Curry (2.5 feet, ZONE). DE'AARON ALLEN MAKES IT! Assist: Shai Mobley
Score: 15-19

[03:32] Team_004 possession (Score: 15-19)
Jabari Wade drives and kicks out. Anthony Lillard attempts a 3Pt. Wide open! Ja Oladipo is 6.7 feet away. [ZONE] Anthony Lillard misses. Rebound secured by Shai Mobley.

[03:21] Team_049 possession (Score: 15-19)
De'Aaron Allen attempts a Midrange. Wide open! Jabari Wade is 8.8 feet away. [ZONE] DE'AARON ALLEN MAKES IT!
Score: 15-21

[03:07] Team_004 possession (Score: 15-21)
Michael Curry drives and kicks out. Michael Curry attempts a 3Pt. Contested by Shai Bird (5.0 feet, MAN). Michael Curry misses. Rebound secured by Shai Mobley.

[02:53] Team_049 possession (Score: 15-21)
Ja Oladipo attempts a Layup. BLOCKED BY ANTHONY LILLARD! Ball is loose! Rebound secured by Dwyane Irving.

[02:37] Team_004 possession (Score: 15-21)
Michael Curry attempts a 3Pt. Contested by Shai Bird (3.8 feet, MAN). Michael Curry misses. Rebound secured by Shai Mobley.

[02:22] Team_049 possession (Score: 15-21)
Shai Mobley drives and kicks out. Jimmy Griffin attempts a 3Pt. Contested by Dwyane Irving (2.8 feet, MAN). Jimmy Griffin misses. Rebound secured by Draymond Fox.

[02:08] Team_004 possession (Score: 15-21)
Michael Curry attempts a 3Pt. Wide open! Shai Bird is 6.3 feet away. [MAN] MICHAEL CURRY MAKES IT! Assist: Draymond Fox
Score: 18-21

[01:56] Team_049 possession (Score: 18-21)
FOUL! Shooting foul on Draymond Fox. De'Aaron Allen to the line for 2 free throws. [BONUS: 5 team fouls] (Draymond Fox: 1 personal fouls)   FT 1/2: MISS   FT 2/2: MISS De'Aaron Allen makes 0/2 from the line. Rebound secured by Dwyane Irving.

[01:39] Team_004 possession (Score: 18-21)
Anthony Lillard drives, De'Aaron Allen stays with him. Anthony Lillard attempts a Layup. Wide open! De'Aaron Allen is 7.0 feet away. [ZONE] Anthony Lillard misses. Rebound secured by Jimmy Griffin.

[01:25] Team_049 possession (Score: 18-21)
Shai Mobley throws a bad pass out of bounds! TURNOVER! (dead ball)

[01:25] Substitution (Team_004): Michael Curry OUT → Karl Reaves IN (stamina_rule2)

[01:25] Substitution (Team_004): Jabari Wade OUT → Russell Barnes IN (stamina_rule2)

[01:25] Substitution (Team_004): Dwyane Irving OUT → Kristaps Green IN (stamina_rule2)

[01:25] Substitution (Team_004): Draymond Fox OUT → Michael Sabonis IN (stamina_rule2)

[01:25] Substitution (Team_004): Anthony Lillard OUT → Shai Beal IN (stamina_rule2)

[01:25] Substitution (Team_049): Shai Bird OUT → Shaquille Lillard IN (stamina_rule2)

[01:25] Substitution (Team_049): Ja Oladipo OUT → Shai Jordan IN (stamina_rule2)

[01:25] Substitution (Team_049): Jimmy Griffin OUT → Desmond Towns IN (stamina_rule2)

[01:25] Substitution (Team_049): De'Aaron Allen OUT → Giannis Anunoby IN (stamina_rule2)

[01:25] Substitution (Team_049): Shai Mobley OUT → Miles Jackson IN (stamina_rule2)

[01:15] Team_004 possession (Score: 18-21)
FOUL! Holding foul on Giannis Anunoby. [IN THE BONUS! 5 team fouls] Michael Sabonis to the line for 2 free throws. (Giannis Anunoby: 1 personal fouls)   FT 1/2: GOOD   FT 2/2: GOOD Michael Sabonis makes 2/2 from the line.
Score: 20-21

[00:57] Team_049 possession (Score: 20-21)
Shai Jordan attempts a 3Pt. Contested by Karl Reaves (2.6 feet, ZONE). Shai Jordan misses. Offensive rebound by Giannis Anunoby! Giannis Anunoby kicks it out.

[00:41] Team_049 possession (Score: 20-21)
Shai Jordan throws a bad pass out of bounds! TURNOVER! (dead ball)

[00:24] Team_004 possession (Score: 20-21)
Kristaps Green attempts a 3Pt. Contested by Desmond Towns (5.4 feet, MAN). KRISTAPS GREEN MAKES IT! Assist: Shai Beal
Score: 23-21

[00:09] Team_049 possession (Score: 23-21)
Giannis Anunoby loses the ball! Stripped by Michael Sabonis! TURNOVER! (live ball)

================================================================================
                              1ST QUARTER COMPLETE                              
================================================================================

1ST QUARTER SCORE: Team_004 23, Team_049 21

BOX SCORE:
================================================================================

Team_004
--------------------------------------------------------------------------------
Player                MIN  PTS  REB  AST  TO      FG   FG%      3P   3P%
--------------------------------------------------------------------------------
Michael Curry          11   10    0    0   0   4/6    66.7     0/0   0.0
Draymond Fox           11    4    4    1   0   2/3    66.7     0/0   0.0
Anthony Lillard        11    4    4    1   0   2/5    40.0     0/0   0.0
Kristaps Green          1    3    0    0   0   1/1   100.0     0/0   0.0
Michael Sabonis         1    2    0    0   0   1/1   100.0     0/0   0.0
Dwyane Irving          11    0    4    1   0   0/2     0.0     0/0   0.0
Jabari Wade            11    0    0    1   0   0/1     0.0     0/0   0.0
Shai Beal               1    0    0    1   0   0/0     0.0     0/0   0.0

TEAM: FG: 10/19 (52.6%), 3PT: 3/7 (42.9%), REB: 12 (2 off, 10 def), AST: 5, TO: 2
TEAM FOULS: 5 [Team_049 in BONUS]


Team_049
--------------------------------------------------------------------------------
Player                MIN  PTS  REB  AST  TO      FG   FG%      3P   3P%
--------------------------------------------------------------------------------
De'Aaron Allen         11   13    2    0   0   5/6    83.3     0/0   0.0
Shai Mobley            11    2    7    2   0   1/5    20.0     0/0   0.0
Jimmy Griffin          11    2    1    3   0   1/3    33.3     0/0   0.0
Ja Oladipo             11    2    0    0   0   1/4    25.0     0/0   0.0
Shai Bird              11    0    0    1   0   0/0     0.0     0/0   0.0
Giannis Anunoby         1    0    1    0   0   0/0     0.0     0/0   0.0

TEAM: FG: 8/18 (44.4%), 3PT: 3/7 (42.9%), REB: 11 (2 off, 9 def), AST: 6, TO: 3
TEAM FOULS: 5 [Team_004 in BONUS]

================================================================================

================================================================================
                       2ND QUARTER - Team_004 vs Team_049                       
================================================================================

[12:00] Team_004 possession (Score: 23-21)
FOUL! Reach-in foul on Shai Mobley during the drive. [Team fouls: 1] No free throws, side out. (Shai Mobley: 1 personal fouls)

[11:42] Team_004 possession (Score: 23-21)
Michael Curry attempts a Midrange. Contested by Shai Bird (3.6 feet, MAN). Michael Curry misses. Rebound secured by Jimmy Griffin.

[11:29] Team_049 possession (Score: 23-21)
De'Aaron Allen drives and kicks out. Jimmy Griffin attempts a 3Pt. Wide open! Draymond Fox is 6.5 feet away. [ZONE] Jimmy Griffin misses. Rebound secured by Draymond Fox.

[11:12] Team_004 possession (Score: 23-21)
Jabari Wade attempts a Midrange. Wide open! Ja Oladipo is 7.9 feet away. [MAN] Jabari Wade misses. Rebound secured by Shai Mobley.

[10:55] Team_049 possession (Score: 23-21)
Shai Mobley attempts a 3Pt. Heavily contested by Anthony Lillard (1.2 feet, MAN)! Shai Mobley misses. Rebound secured by Anthony Lillard.

[10:43] Team_004 possession (Score: 23-21)
Jabari Wade drives and kicks out. Anthony Lillard attempts a Midrange. Contested by Ja Oladipo (4.8 feet, ZONE). Anthony Lillard misses. Rebound secured by Shai Mobley.

[10:30] Team_049 possession (Score: 23-21)
Shai Mobley attempts a Midrange. Wide open! Anthony Lillard is 6.2 feet away. [MAN] Shai Mobley misses. Offensive rebound by De'Aaron Allen! De'Aaron Allen kicks it out.

[10:16] Team_049 possession (Score: 23-21)
Shai Bird makes the Dunk and draws the foul on Dwyane Irving! And-1! Shai Bird to the line for 1. [Team fouls: 1] (Dwyane Irving: 1 personal fouls)   FT 1/1: GOOD Shai Bird makes 1/1 from the line.
Score: 23-24

[10:02] Team_004 possession (Score: 23-24)
Jabari Wade attempts a 3Pt. Wide open! Ja Oladipo is 6.0 feet away. [ZONE] Jabari Wade misses. Rebound secured by De'Aaron Allen.

[09:52] Team_049 possession (Score: 23-24)
Ja Oladipo drives, picks up Jabari Wade. Help arrives from Dwyane Irving! Ja Oladipo attempts a Layup. Contested by Dwyane Irving (5.2 feet, MAN). Ja Oladipo misses. Rebound secured by Anthony Lillard.

[09:33] Team_004 possession (Score: 23-24)
Anthony Lillard attempts a Layup. BLOCKED BY SHAI MOBLEY! Ball deflects out of bounds off Anthony Lillard.

[09:18] Team_049 possession (Score: 23-24)
Ja Oladipo attempts a 3Pt. Contested by Michael Curry (2.7 feet, ZONE). JA OLADIPO MAKES IT! Assist: Shai Mobley
Score: 23-27

[09:03] Team_004 possession (Score: 23-27)
Draymond Fox drives and kicks out. Jabari Wade attempts a Midrange. Contested by Jimmy Griffin (2.9 feet, ZONE). JABARI WADE MAKES IT! Assist: Michael Curry
Score: 25-27

[08:48] Team_049 possession (Score: 25-27)
Shai Bird attempts a Layup. Contested by Anthony Lillard (4.8 feet, ZONE). Shai Bird misses. Rebound secured by Draymond Fox.

[08:35] Team_004 possession (Score: 25-27)
Michael Curry drives to the basket... Michael Curry throws a bad pass! Stolen by Shai Bird! TURNOVER! (live ball)

[08:19] Team_049 possession (Score: 25-27)
Shai Mobley throws a bad pass! Stolen by Anthony Lillard! TURNOVER! (live ball)

[08:05] Team_004 possession (Score: 25-27)
Anthony Lillard attempts a Layup. Contested by Shai Mobley (3.3 feet, MAN). Anthony Lillard misses. Rebound secured by Jimmy Griffin.

[07:52] Team_049 possession (Score: 25-27)
Shai Mobley attempts a 3Pt. Wide open! Michael Curry is 8.9 feet away. [ZONE] Shai Mobley misses. Offensive rebound by De'Aaron Allen! De'Aaron Allen kicks it out.

[07:39] Team_049 possession (Score: 25-27)
De'Aaron Allen attempts a 3Pt. Contested by Michael Curry (2.7 feet, ZONE). DE'AARON ALLEN MAKES IT! Assist: Jimmy Griffin
Score: 25-30

[07:24] Team_004 possession (Score: 25-30)
Dwyane Irving drives and kicks out. Draymond Fox attempts a 3Pt. Contested by De'Aaron Allen (3.4 feet, MAN). Draymond Fox misses. Offensive rebound by Dwyane Irving! Dwyane Irving kicks it out.

[07:08] Team_004 possession (Score: 25-30)
Dwyane Irving throws a bad pass out of bounds! TURNOVER! (dead ball)

[07:08] Substitution (Team_004): Michael Curry OUT → Karl Reaves IN (stamina_rule2)

[07:08] Substitution (Team_004): Jabari Wade OUT → Russell Barnes IN (stamina_rule2)

[07:08] Substitution (Team_004): Dwyane Irving OUT → Kristaps Green IN (stamina_rule2)

[07:08] Substitution (Team_004): Draymond Fox OUT → Michael Sabonis IN (stamina_rule2)

[07:08] Substitution (Team_004): Anthony Lillard OUT → Shai Beal IN (stamina_rule2)

[07:08] Substitution (Team_049): Shai Bird OUT → Shaquille Lillard IN (stamina_rule2)

[07:08] Substitution (Team_049): Ja Oladipo OUT → Shai Jordan IN (stamina_rule2)

[07:08] Substitution (Team_049): Jimmy Griffin OUT → Desmond Towns IN (stamina_rule2)

[07:08] Substitution (Team_049): De'Aaron Allen OUT → Giannis Anunoby IN (stamina_rule2)

[07:08] Substitution (Team_049): Shai Mobley OUT → Miles Jackson IN (stamina_rule2)

[06:52] Team_049 possession (Score: 25-30)
Shai Jordan attempts a Midrange. Contested by Russell Barnes (4.0 feet, MAN). Shai Jordan misses. Rebound secured by Michael Sabonis.

[06:37] Team_004 possession (Score: 25-30)
FOUL! Offensive foul on Michael Sabonis! Giannis Anunoby drew the charge! [Team fouls: 2] (Michael Sabonis: 1 personal fouls) TURNOVER! (dead ball)

[06:22] Team_049 possession (Score: 25-30)
Miles Jackson attempts a Midrange. Heavily contested by Russell Barnes (1.9 feet, ZONE)! Miles Jackson misses. Rebound secured by Michael Sabonis.

[06:12] Team_004 possession (Score: 25-30)
Russell Barnes attempts a 3Pt. Contested by Shaquille Lillard (5.7 feet, ZONE). Russell Barnes misses. Rebound secured by Shai Jordan.

[05:56] Team_049 possession (Score: 25-30)
Miles Jackson drives to the basket... Miles Jackson throws a bad pass out of bounds! TURNOVER! (dead ball)

[05:37] Team_004 possession (Score: 25-30)
Kristaps Green attempts a 3Pt. Contested by Desmond Towns (3.8 feet, MAN). Kristaps Green misses. Offensive rebound by Shai Beal! Shai Beal kicks it out.

[05:25] Team_004 possession (Score: 25-30)
Shai Beal attempts a Midrange. Wide open! Miles Jackson is 6.5 feet away. [MAN] Shai Beal misses. Rebound secured by Miles Jackson.

[05:10] Team_049 possession (Score: 25-30)
Giannis Anunoby attempts a Midrange. Wide open! Michael Sabonis is 7.4 feet away. [ZONE] GIANNIS ANUNOBY MAKES IT!
Score: 25-32

[04:54] Team_004 possession (Score: 25-32)
Kristaps Green attempts a 3Pt. Contested by Shaquille Lillard (5.2 feet, ZONE). KRISTAPS GREEN MAKES IT!
Score: 28-32

[04:38] Team_049 possession (Score: 28-32)
Shaquille Lillard attempts a 3Pt. Contested by Karl Reaves (3.7 feet, MAN). Shaquille Lillard misses. Offensive rebound by Miles Jackson! Miles Jackson puts it back in!
Score: 28-34

[04:22] Team_004 possession (Score: 28-34)
Kristaps Green makes the Layup and draws the foul on Desmond Towns! And-1! Kristaps Green to the line for 1. [Team fouls: 2] (Desmond Towns: 1 personal fouls)   FT 1/1: GOOD Kristaps Green makes 1/1 from the line.
Score: 31-34

[04:05] Team_049 possession (Score: 31-34)
Desmond Towns throws a bad pass! Stolen by Kristaps Green! TURNOVER! (live ball)

[03:53] Team_004 possession (Score: 31-34)
Karl Reaves drives and kicks out. Michael Sabonis attempts a 3Pt. Contested by Giannis Anunoby (5.2 feet, MAN). MICHAEL SABONIS MAKES IT! Assist: Shai Beal
Score: 34-34

[03:36] Team_049 possession (Score: 34-34)
Shai Jordan attempts a 3Pt. Contested by Russell Barnes (2.2 feet, MAN). Shai Jordan misses. Rebound secured by Michael Sabonis.

[03:21] Team_004 possession (Score: 34-34)
Michael Sabonis attempts a Layup. Contested by Giannis Anunoby (4.6 feet, MAN). Michael Sabonis misses. Rebound secured by Shai Jordan.

[03:08] Team_049 possession (Score: 34-34)
Desmond Towns attempts a 3Pt. Wide open! Karl Reaves is 7.7 feet away. [ZONE] Desmond Towns misses. Rebound secured by Russell Barnes.

[02:53] Team_004 possession (Score: 34-34)
FOUL! Shooting foul on Giannis Anunoby. Michael Sabonis to the line for 2 free throws. [Team fouls: 3] (Giannis Anunoby: 1 personal fouls)   FT 1/2: GOOD   FT 2/2: GOOD Michael Sabonis makes 2/2 from the line.
Score: 36-34

[02:38] Team_049 possession (Score: 36-34)
Giannis Anunoby drives and kicks out. Shai Jordan attempts a Midrange. Contested by Russell Barnes (5.6 feet, MAN). SHAI JORDAN MAKES IT!
Score: 36-36

[02:26] Team_004 possession (Score: 36-36)
Shai Beal attempts a Layup. Wide open! Miles Jackson is 8.9 feet away. [MAN] Shai Beal misses. Rebound secured by Shai Jordan.

[02:14] Team_049 possession (Score: 36-36)
Giannis Anunoby attempts a 3Pt. Wide open! Karl Reaves is 9.2 feet away. [ZONE] Giannis Anunoby misses. Rebound secured by Michael Sabonis.

[01:59] Team_004 possession (Score: 36-36)
Michael Sabonis drives to the basket... Michael Sabonis loses control! Ball rolls out of bounds! TURNOVER! (dead ball)

[01:44] Team_049 possession (Score: 36-36)
Miles Jackson attempts a Midrange. Contested by Kristaps Green (5.3 feet, ZONE). MILES JACKSON MAKES IT!
Score: 36-38

[01:25] Team_004 possession (Score: 36-38)
Kristaps Green attempts a 3Pt. Contested by Desmond Towns (4.4 feet, MAN). KRISTAPS GREEN MAKES IT! Assist: Karl Reaves
Score: 39-38

[01:09] Team_049 possession (Score: 39-38)
FOUL! Shooting foul on Kristaps Green. Desmond Towns to the line for 2 free throws. [Team fouls: 3] (Kristaps Green: 1 personal fouls)   FT 1/2: GOOD   FT 2/2: GOOD Desmond Towns makes 2/2 from the line.
Score: 39-40

[00:57] Team_004 possession (Score: 39-40)
FOUL! Reach-in foul on Giannis Anunoby during the drive. [Team fouls: 4] No free throws, side out. (Giannis Anunoby: 2 personal fouls)

[00:43] Team_004 possession (Score: 39-40)
Kristaps Green commits a violation (traveling/carry)! TURNOVER! (dead ball)

[00:29] Team_049 possession (Score: 39-40)
Miles Jackson drives to the basket... Miles Jackson throws a bad pass! Stolen by Shai Beal! TURNOVER! (live ball)

[00:15] Team_004 possession (Score: 39-40)
Shai Beal attempts a Layup. BLOCKED BY MILES JACKSON! Ball is loose! Rebound secured by Miles Jackson.

[00:04] Team_049 possession (Score: 39-40)
Giannis Anunoby attempts a 3Pt. Wide open! Karl Reaves is 7.0 feet away. [ZONE] GIANNIS ANUNOBY MAKES IT! Assist: Desmond Towns
Score: 39-43

================================================================================
                              2ND QUARTER COMPLETE                              
================================================================================

2ND QUARTER SCORE: Team_004 16, Team_049 22

BOX SCORE:
================================================================================

Team_004
--------------------------------------------------------------------------------
Player                MIN  PTS  REB  AST  TO      FG   FG%      3P   3P%
--------------------------------------------------------------------------------
Kristaps Green          8    9    0    0   0   3/3   100.0     0/0   0.0
Michael Sabonis         8    5    4    0   0   2/3    66.7     0/0   0.0
Jabari Wade            16    2    0    0   0   1/4    25.0     0/0   0.0
Michael Curry          16    0    0    1   0   0/1     0.0     0/0   0.0
Draymond Fox           16    0    2    0   0   0/0     0.0     0/0   0.0
Anthony Lillard        16    0    2    0   0   0/2     0.0     0/0   0.0
Dwyane Irving          16    0    1    0   0   0/0     0.0     0/0   0.0
Russell Barnes          8    0    1    0   0   0/1     0.0     0/0   0.0
Shai Beal               8    0    1    1   0   0/3     0.0     0/0   0.0
Karl Reaves             8    0    0    1   0   0/0     0.0     0/0   0.0

TEAM: FG: 6/17 (35.3%), 3PT: 2/4 (50.0%), REB: 11 (2 off, 9 def), AST: 3, TO: 5
TEAM FOULS: 3


Team_049
--------------------------------------------------------------------------------
Player                MIN  PTS  REB  AST  TO      FG   FG%      3P   3P%
--------------------------------------------------------------------------------
Giannis Anunoby         8    5    0    0   0   2/3    66.7     0/0   0.0
Miles Jackson           8    4    3    0   0   2/3    66.7     0/0   0.0
De'Aaron Allen         16    3    3    0   0   1/2    50.0     0/0   0.0
Shai Bird              16    3    0    0   0   1/2    50.0     0/0   0.0
Ja Oladipo             16    3    0    0   0   1/2    50.0     0/0   0.0
Shai Jordan             8    2    3    0   0   1/3    33.3     0/0   0.0
Desmond Towns           8    2    0    1   0   1/2    50.0     0/0   0.0
Jimmy Griffin          16    0    2    1   0   0/0     0.0     0/0   0.0
Shai Mobley            16    0    2    1   0   0/1     0.0     0/0   0.0

TEAM: FG: 9/18 (50.0%), 3PT: 4/8 (50.0%), REB: 13 (3 off, 10 def), AST: 3, TO: 4
TEAM FOULS: 4

================================================================================

================================================================================
                       3RD QUARTER - Team_004 vs Team_049                       
================================================================================

[12:00] Team_004 possession (Score: 39-43)
Michael Curry attempts a Midrange. Heavily contested by Shai Bird (1.6 feet, MAN)! MICHAEL CURRY MAKES IT! Assist: Draymond Fox
Score: 41-43

[11:47] Team_049 possession (Score: 41-43)
Shai Bird attempts a 3Pt. Contested by Michael Curry (4.6 feet, ZONE). SHAI BIRD MAKES IT! Assist: De'Aaron Allen
Score: 41-46

[11:29] Team_004 possession (Score: 41-46)
Anthony Lillard attempts a Midrange. Contested by Ja Oladipo (4.7 feet, ZONE). ANTHONY LILLARD MAKES IT! Assist: Dwyane Irving
Score: 43-46

[11:12] Team_049 possession (Score: 43-46)
FOUL! Shooting foul on Anthony Lillard. Ja Oladipo to the line for 2 free throws. [Team fouls: 1] (Anthony Lillard: 1 personal fouls)   FT 1/2: GOOD   FT 2/2: GOOD Ja Oladipo makes 2/2 from the line.
Score: 43-48

[10:59] Team_004 possession (Score: 43-48)
Michael Curry throws a bad pass out of bounds! TURNOVER! (dead ball)

[10:46] Team_049 possession (Score: 43-48)
FOUL! Offensive foul on De'Aaron Allen! Draymond Fox drew the charge! [Team fouls: 1] (De'Aaron Allen: 1 personal fouls) TURNOVER! (dead ball)

[10:31] Team_004 possession (Score: 43-48)
Dwyane Irving drives, De'Aaron Allen stays with him. Dwyane Irving attempts a Dunk. Heavily contested by De'Aaron Allen (1.4 feet, ZONE)! DWYANE IRVING MAKES IT! Assist: Anthony Lillard
Score: 45-48

[10:19] Team_049 possession (Score: 45-48)
Shai Mobley attempts a Midrange. Wide open! Dwyane Irving is 7.6 feet away. [ZONE] SHAI MOBLEY MAKES IT!
Score: 45-50

[10:09] Team_004 possession (Score: 45-50)
Jabari Wade attempts a 3Pt. Wide open! Ja Oladipo is 6.8 feet away. [MAN] Jabari Wade misses. Rebound secured by Shai Mobley.

[09:55] Team_049 possession (Score: 45-50)
Ja Oladipo drives to the basket... Ja Oladipo throws a bad pass out of bounds! TURNOVER! (dead ball)

[09:41] Team_004 possession (Score: 45-50)
Draymond Fox attempts a Midrange. Heavily contested by Jimmy Griffin (0.5 feet, ZONE)! Draymond Fox misses. Rebound secured by De'Aaron Allen.

[09:26] Team_049 possession (Score: 45-50)
De'Aaron Allen attempts a Midrange. Contested by Draymond Fox (5.4 feet, MAN). DE'AARON ALLEN MAKES IT! Assist: Shai Bird
Score: 45-52

[09:10] Team_004 possession (Score: 45-52)
FOUL! Shooting foul on Shai Mobley. Michael Curry to the line for 2 free throws. [Team fouls: 2] (Shai Mobley: 1 personal fouls)   FT 1/2: GOOD   FT 2/2: GOOD Michael Curry makes 2/2 from the line.
Score: 47-52

[08:59] Team_049 possession (Score: 47-52)
Jimmy Griffin drives and kicks out. Shai Mobley attempts a 3Pt. Contested by Michael Curry (4.8 feet, ZONE). Shai Mobley misses. Rebound secured by Draymond Fox.

[08:46] Team_004 possession (Score: 47-52)
Jabari Wade attempts a 3Pt. Contested by Ja Oladipo (3.8 feet, ZONE). Jabari Wade misses. Rebound secured by Shai Mobley.

[08:34] Team_049 possession (Score: 47-52)
Jimmy Griffin attempts a 3Pt. Contested by Michael Curry (5.3 feet, ZONE). Jimmy Griffin misses. Rebound secured by Draymond Fox.

[08:22] Team_004 possession (Score: 47-52)
Jabari Wade attempts a Midrange. Wide open! Ja Oladipo is 6.2 feet away. [MAN] Jabari Wade misses. Rebound secured by Shai Mobley.

[08:08] Team_049 possession (Score: 47-52)
De'Aaron Allen attempts a 3Pt. Contested by Draymond Fox (4.5 feet, MAN). De'Aaron Allen misses. Rebound secured by Anthony Lillard.

[07:52] Team_004 possession (Score: 47-52)
Dwyane Irving loses control! Ball rolls out of bounds! TURNOVER! (dead ball)

[07:39] Team_049 possession (Score: 47-52)
De'Aaron Allen drives and kicks out. Shai Mobley attempts a 3Pt. Contested by Michael Curry (5.6 feet, ZONE). Shai Mobley misses. Rebound secured by Draymond Fox.

[07:24] Team_004 possession (Score: 47-52)
Draymond Fox drives and kicks out. Anthony Lillard attempts a 3Pt. Contested by Shai Mobley (2.8 feet, MAN). Anthony Lillard misses. Rebound secured by Jimmy Griffin.

[07:15] Team_049 possession (Score: 47-52)
Shai Bird makes the Layup and draws the foul on Michael Curry! And-1! Shai Bird to the line for 1. [Team fouls: 2] (Michael Curry: 1 personal fouls)   FT 1/1: GOOD Shai Bird makes 1/1 from the line.
Score: 47-55

[07:02] Team_004 possession (Score: 47-55)
Draymond Fox attempts a 3Pt. Contested by Ja Oladipo (2.1 feet, ZONE). Draymond Fox misses. Rebound secured by De'Aaron Allen.

[06:51] Team_049 possession (Score: 47-55)
De'Aaron Allen makes the Layup and draws the foul on Jabari Wade! And-1! De'Aaron Allen to the line for 1. [Team fouls: 3] (Jabari Wade: 1 personal fouls)   FT 1/1: GOOD De'Aaron Allen makes 1/1 from the line.
Score: 47-58

[06:37] Team_004 possession (Score: 47-58)
Draymond Fox attempts a 3Pt. Wide open! De'Aaron Allen is 6.4 feet away. [ZONE] DRAYMOND FOX MAKES IT! Assist: Jabari Wade
Score: 50-58

[06:19] Team_049 possession (Score: 50-58)
Shai Mobley attempts a Midrange. Contested by Anthony Lillard (2.8 feet, MAN). SHAI MOBLEY MAKES IT! Assist: Ja Oladipo
Score: 50-60

[06:02] Team_004 possession (Score: 50-60)
Jabari Wade drives to the basket... Jabari Wade loses the ball! Stripped by De'Aaron Allen! TURNOVER! (live ball)

[05:48] Team_049 possession (Score: 50-60)
Shai Mobley drives, Anthony Lillard stays with him. Shai Mobley attempts a Layup. Contested by Anthony Lillard (5.0 feet, ZONE). SHAI MOBLEY MAKES IT! Assist: Jimmy Griffin
Score: 50-62

[05:33] Team_004 possession (Score: 50-62)
FOUL! Shooting foul on De'Aaron Allen. Anthony Lillard to the line for 2 free throws. [Team fouls: 3] (De'Aaron Allen: 2 personal fouls)   FT 1/2: GOOD   FT 2/2: GOOD Anthony Lillard makes 2/2 from the line.
Score: 52-62

[05:18] Team_049 possession (Score: 52-62)
De'Aaron Allen attempts a 3Pt. Contested by Draymond Fox (5.0 feet, MAN). De'Aaron Allen misses. Rebound secured by Anthony Lillard.

[04:58] Team_004 possession (Score: 52-62)
FOUL! Shooting foul on Shai Mobley. Draymond Fox to the line for 2 free throws. [Team fouls: 4] (Shai Mobley: 2 personal fouls)   FT 1/2: GOOD   FT 2/2: GOOD Draymond Fox makes 2/2 from the line.
Score: 54-62

[04:43] Team_049 possession (Score: 54-62)
Shai Bird attempts a 3Pt. Contested by Dwyane Irving (5.2 feet, ZONE). Shai Bird misses. Offensive rebound by De'Aaron Allen! De'Aaron Allen kicks it out.

[04:26] Team_049 possession (Score: 54-62)
Ja Oladipo attempts a Layup. Contested by Anthony Lillard (4.6 feet, ZONE). Ja Oladipo misses. Rebound secured by Anthony Lillard.

[04:15] Team_004 possession (Score: 54-62)
Dwyane Irving drives and kicks out. Dwyane Irving attempts a 3Pt. Contested by Jimmy Griffin (5.2 feet, MAN). DWYANE IRVING MAKES IT! Assist: Jabari Wade
Score: 57-62

[04:02] Team_049 possession (Score: 57-62)
De'Aaron Allen attempts a 3Pt. Wide open! Michael Curry is 6.6 feet away. [ZONE] De'Aaron Allen misses. Rebound secured by Dwyane Irving.

[03:52] Team_004 possession (Score: 57-62)
Michael Curry attempts a 3Pt. Contested by Shai Bird (4.2 feet, MAN). MICHAEL CURRY MAKES IT!
Score: 60-62

[03:35] Team_049 possession (Score: 60-62)
Ja Oladipo attempts a Layup. Contested by Anthony Lillard (5.4 feet, ZONE). JA OLADIPO MAKES IT!
Score: 60-64

[03:19] Team_004 possession (Score: 60-64)
Michael Curry attempts a 3Pt. Contested by Shai Bird (3.7 feet, MAN). Michael Curry misses. Rebound secured by Shai Mobley.

[03:05] Team_049 possession (Score: 60-64)
De'Aaron Allen drives, picks up Draymond Fox. Help arrives from Jabari Wade! De'Aaron Allen attempts a Dunk. Contested by Jabari Wade (4.1 feet, ZONE). De'Aaron Allen misses. Rebound secured by Dwyane Irving.

[02:49] Team_004 possession (Score: 60-64)
Dwyane Irving makes the Layup and draws the foul on Jimmy Griffin! And-1! Dwyane Irving to the line for 1. [BONUS: 5 team fouls] (Jimmy Griffin: 1 personal fouls)   FT 1/1: GOOD Dwyane Irving makes 1/1 from the line.
Score: 63-64

[02:33] Team_049 possession (Score: 63-64)
FOUL! Shooting foul on Anthony Lillard. Shai Mobley to the line for 2 free throws. [Team fouls: 4] (Anthony Lillard: 2 personal fouls)   FT 1/2: GOOD   FT 2/2: MISS Shai Mobley makes 1/2 from the line. Rebound secured by Dwyane Irving.
Score: 63-65

[02:19] Team_004 possession (Score: 63-65)
Jabari Wade attempts a Layup. Heavily contested by De'Aaron Allen (1.5 feet, ZONE)! JABARI WADE MAKES IT!
Score: 65-65

[02:06] Team_049 possession (Score: 65-65)
Ja Oladipo attempts a 3Pt. Wide open! Michael Curry is 8.2 feet away. [ZONE] JA OLADIPO MAKES IT!
Score: 65-68

[01:52] Team_004 possession (Score: 65-68)
Draymond Fox commits a violation (traveling/carry)! TURNOVER! (dead ball)

[01:52] Substitution (Team_004): Michael Curry OUT → Karl Reaves IN (stamina_rule2)

[01:52] Substitution (Team_004): Jabari Wade OUT → Russell Barnes IN (stamina_rule2)

[01:52] Substitution (Team_004): Dwyane Irving OUT → Kristaps Green IN (stamina_rule2)

[01:52] Substitution (Team_004): Draymond Fox OUT → Michael Sabonis IN (stamina_rule2)

[01:52] Substitution (Team_004): Anthony Lillard OUT → Shai Beal IN (stamina_rule2)

[01:52] Substitution (Team_049): Shai Bird OUT → Shaquille Lillard IN (stamina_rule2)

[01:52] Substitution (Team_049): Ja Oladipo OUT → Shai Jordan IN (stamina_rule2)

[01:52] Substitution (Team_049): Jimmy Griffin OUT → Desmond Towns IN (stamina_rule2)

[01:52] Substitution (Team_049): De'Aaron Allen OUT → Giannis Anunoby IN (stamina_rule2)

[01:52] Substitution (Team_049): Shai Mobley OUT → Miles Jackson IN (stamina_rule2)

[01:38] Team_049 possession (Score: 65-68)
Shaquille Lillard attempts a 3Pt. Contested by Karl Reaves (3.9 feet, MAN). SHAQUILLE LILLARD MAKES IT! Assist: Shai Jordan
Score: 65-71

[01:20] Team_004 possession (Score: 65-71)
Shai Beal attempts a Layup. BLOCKED BY MILES JACKSON! Ball is loose! Rebound secured by Miles Jackson.

[01:04] Team_049 possession (Score: 65-71)
Miles Jackson drives and kicks out. Shai Jordan makes the Midrange and draws the foul on Russell Barnes! And-1! Shai Jordan to the line for 1. [BONUS: 5 team fouls] (Russell Barnes: 1 personal fouls)   FT 1/1: GOOD Shai Jordan makes 1/1 from the line.
Score: 65-74

[00:48] Team_004 possession (Score: 65-74)
Karl Reaves drives and kicks out. Shai Beal attempts a Midrange. Heavily contested by Miles Jackson (1.9 feet, MAN)! Shai Beal misses. FOUL! Loose ball foul on Giannis Anunoby during the rebound battle. [IN THE BONUS! 6 team fouls] Shai Beal to the line for 2 free throws. (Giannis Anunoby: 1 personal fouls)   FT 1/2: GOOD   FT 2/2: GOOD Shai Beal makes 2/2 from the line.
Score: 67-74

[00:34] Team_049 possession (Score: 67-74)
Shai Jordan attempts a Midrange. Contested by Russell Barnes (4.9 feet, MAN). SHAI JORDAN MAKES IT! Assist: Desmond Towns
Score: 67-76

[00:17] Team_004 possession (Score: 67-76)
Shai Beal drives and kicks out. Russell Barnes attempts a Midrange. Wide open! Giannis Anunoby is 9.9 feet away. [ZONE] RUSSELL BARNES MAKES IT!
Score: 69-76

[00:03] Team_049 possession (Score: 69-76)
FOUL! Holding foul on Kristaps Green. [IN THE BONUS! 6 team fouls] Desmond Towns to the line for 2 free throws. (Kristaps Green: 1 personal fouls)   FT 1/2: GOOD   FT 2/2: MISS Desmond Towns makes 1/2 from the line. Rebound secured by Shai Beal.
Score: 69-77

================================================================================
                              3RD QUARTER COMPLETE                              
================================================================================

3RD QUARTER SCORE: Team_004 30, Team_049 34

BOX SCORE:
================================================================================

Team_004
--------------------------------------------------------------------------------
Player                MIN  PTS  REB  AST  TO      FG   FG%      3P   3P%
--------------------------------------------------------------------------------
Dwyane Irving          26    8    3    1   0   3/3   100.0     0/0   0.0
Michael Curry          26    7    0    0   0   3/4    75.0     0/0   0.0
Draymond Fox           26    5    3    1   0   2/5    40.0     0/0   0.0
Anthony Lillard        26    4    3    1   0   2/2   100.0     0/0   0.0
Jabari Wade            26    2    0    2   0   1/4    25.0     0/0   0.0
Shai Beal              10    2    1    0   0   1/2    50.0     0/0   0.0
Russell Barnes         10    2    0    0   0   1/1   100.0     0/0   0.0

TEAM: FG: 13/21 (61.9%), 3PT: 2/6 (33.3%), REB: 10 (0 off, 10 def), AST: 5, TO: 4
TEAM FOULS: 6 [Team_049 in BONUS]


Team_049
--------------------------------------------------------------------------------
Player                MIN  PTS  REB  AST  TO      FG   FG%      3P   3P%
--------------------------------------------------------------------------------
Ja Oladipo             26    7    0    1   0   3/4    75.0     0/0   0.0
Shai Bird              26    6    0    1   0   2/2   100.0     0/0   0.0
Shai Mobley            26    6    4    0   0   3/4    75.0     0/0   0.0
De'Aaron Allen         26    5    3    1   0   2/7    28.6     0/0   0.0
Shai Jordan            10    5    0    1   0   2/2   100.0     0/0   0.0
Shaquille Lillard      10    3    0    0   0   1/1   100.0     0/0   0.0
Jimmy Griffin          26    0    1    1   0   0/2     0.0     0/0   0.0
Miles Jackson          10    0    1    0   0   0/0     0.0     0/0   0.0
Desmond Towns          10    0    0    1   0   0/0     0.0     0/0   0.0

TEAM: FG: 13/23 (56.5%), 3PT: 3/7 (42.9%), REB: 9 (1 off, 8 def), AST: 6, TO: 2
TEAM FOULS: 6 [Team_004 in BONUS]

================================================================================

================================================================================
                       4TH QUARTER - Team_004 vs Team_049                       
================================================================================

[12:00] Team_004 possession (Score: 69-77)
Michael Curry attempts a Layup. Heavily contested by Shai Bird (0.5 feet, MAN)! Michael Curry misses. Rebound secured by Shai Mobley.

[11:49] Team_049 possession (Score: 69-77)
Shai Bird attempts a Midrange. Contested by Anthony Lillard (5.8 feet, ZONE). SHAI BIRD MAKES IT!
Score: 69-79

[11:34] Team_004 possession (Score: 69-79)
Michael Curry attempts a 3Pt. Wide open! Shai Bird is 8.1 feet away. [MAN] Michael Curry misses. Rebound secured by Jimmy Griffin.

[11:18] Team_049 possession (Score: 69-79)
Shai Bird makes the Midrange and draws the foul on Jabari Wade! And-1! Shai Bird to the line for 1. [Team fouls: 1] (Jabari Wade: 1 personal fouls)   FT 1/1: MISS Shai Bird makes 0/1 from the line. Rebound secured by Dwyane Irving.
Score: 69-81

[11:05] Team_004 possession (Score: 69-81)
Draymond Fox drives, De'Aaron Allen stays with him. Draymond Fox attempts a Dunk. Contested by De'Aaron Allen (3.1 feet, MAN). DRAYMOND FOX MAKES IT! Assist: Jabari Wade
Score: 71-81

[10:50] Team_049 possession (Score: 71-81)
Ja Oladipo attempts a Midrange. Wide open! Jabari Wade is 7.0 feet away. [MAN] Ja Oladipo misses. Rebound secured by Anthony Lillard.

[10:35] Team_004 possession (Score: 71-81)
Michael Curry attempts a 3Pt. Contested by Shai Bird (4.4 feet, MAN). Michael Curry misses. Rebound secured by Shai Mobley.

[10:18] Team_049 possession (Score: 71-81)
Shai Mobley attempts a Midrange. Contested by Jabari Wade (3.4 feet, ZONE). Shai Mobley misses. Rebound secured by Anthony Lillard.

[10:03] Team_004 possession (Score: 71-81)
Draymond Fox attempts a 3Pt. Contested by Ja Oladipo (5.6 feet, ZONE). DRAYMOND FOX MAKES IT! Assist: Dwyane Irving
Score: 74-81

[09:51] Team_049 possession (Score: 74-81)
De'Aaron Allen throws a bad pass out of bounds! TURNOVER! (dead ball)

[09:51] Substitution (Team_004): Michael Curry OUT → Karl Reaves IN (stamina_rule2)

[09:51] Substitution (Team_004): Jabari Wade OUT → Russell Barnes IN (stamina_rule2)

[09:51] Substitution (Team_004): Draymond Fox OUT → Michael Sabonis IN (stamina_rule2)

[09:51] Substitution (Team_004): Anthony Lillard OUT → Shai Beal IN (stamina_rule2)

[09:51] Substitution (Team_049): Shai Bird OUT → Shaquille Lillard IN (stamina_rule2)

[09:51] Substitution (Team_049): Ja Oladipo OUT → Shai Jordan IN (stamina_rule2)

[09:51] Substitution (Team_049): Jimmy Griffin OUT → Desmond Towns IN (stamina_rule2)

[09:51] Substitution (Team_049): Shai Mobley OUT → Miles Jackson IN (stamina_rule2)

[09:37] Team_004 possession (Score: 74-81)
FOUL! Reach-in foul on De'Aaron Allen during the drive. [Team fouls: 1] No free throws, side out. (De'Aaron Allen: 1 personal fouls)

[09:20] Team_004 possession (Score: 74-81)
Dwyane Irving drives, Miles Jackson stays with him. Dwyane Irving attempts a Dunk. Wide open! Miles Jackson is 8.4 feet away. [ZONE] Dwyane Irving misses. Rebound secured by De'Aaron Allen.

[09:01] Team_049 possession (Score: 74-81)
Miles Jackson makes the Layup and draws the foul on Shai Beal! And-1! Miles Jackson to the line for 1. [Team fouls: 2] (Shai Beal: 1 personal fouls)   FT 1/1: GOOD Miles Jackson makes 1/1 from the line.
Score: 74-84

[08:48] Team_004 possession (Score: 74-84)
Russell Barnes attempts a 3Pt. Contested by Desmond Towns (5.3 feet, ZONE). Russell Barnes misses. Rebound secured by De'Aaron Allen.

[08:35] Team_049 possession (Score: 74-84)
Shai Jordan drives to the basket... Shai Jordan loses the ball! Stripped by Russell Barnes! TURNOVER! (live ball)

[08:23] Team_004 possession (Score: 74-84)
FOUL! Reach-in foul on Miles Jackson during the drive. [Team fouls: 2] No free throws, side out. (Miles Jackson: 1 personal fouls)

[08:07] Team_004 possession (Score: 74-84)
Shai Beal attempts a Layup. Heavily contested by Miles Jackson (0.7 feet, ZONE)! Shai Beal misses. Rebound secured by Shai Jordan.

[07:53] Team_049 possession (Score: 74-84)
Miles Jackson attempts a Midrange. Contested by Dwyane Irving (2.9 feet, ZONE). Miles Jackson misses. Rebound secured by Shai Beal.

[07:38] Team_004 possession (Score: 74-84)
FOUL! Shooting foul on Shaquille Lillard. Dwyane Irving to the line for 3 free throws. [Team fouls: 3] (Shaquille Lillard: 1 personal fouls)   FT 1/3: GOOD   FT 2/3: MISS   FT 3/3: GOOD Dwyane Irving makes 2/3 from the line.
Score: 76-84

[07:22] Team_049 possession (Score: 76-84)
Shai Jordan attempts a 3Pt. Contested by Russell Barnes (5.1 feet, MAN). Shai Jordan misses. Rebound secured by Michael Sabonis.

[07:07] Team_004 possession (Score: 76-84)
Karl Reaves drives to the basket... Karl Reaves loses the ball! Stripped by Shaquille Lillard! TURNOVER! (live ball)

[06:52] Team_049 possession (Score: 76-84)
Desmond Towns attempts a Midrange. Contested by Dwyane Irving (3.9 feet, ZONE). Desmond Towns misses. Rebound secured by Michael Sabonis.

[06:41] Team_004 possession (Score: 76-84)
Russell Barnes attempts a 3Pt. Wide open! Shaquille Lillard is 10.0 feet away. [ZONE] Russell Barnes misses. Rebound secured by Shai Jordan.

[06:29] Team_049 possession (Score: 76-84)
FOUL! Reach-in foul on Dwyane Irving during the drive. [Team fouls: 3] No free throws, side out. (Dwyane Irving: 1 personal fouls)

[06:18] Team_049 possession (Score: 76-84)
De'Aaron Allen attempts a Midrange. Contested by Michael Sabonis (4.2 feet, MAN). De'Aaron Allen misses. Offensive rebound by De'Aaron Allen! De'Aaron Allen kicks it out.

[06:01] Team_049 possession (Score: 76-84)
Desmond Towns attempts a 3Pt. Contested by Karl Reaves (4.1 feet, ZONE). DESMOND TOWNS MAKES IT! Assist: Shai Jordan
Score: 76-87

[05:47] Team_004 possession (Score: 76-87)
Shai Beal drives to the basket... Shai Beal throws a bad pass! Stolen by Miles Jackson! TURNOVER! (live ball)

[05:29] Team_049 possession (Score: 76-87)
Desmond Towns makes the 3Pt and draws the foul on Karl Reaves! And-1! Desmond Towns to the line for 1. [Team fouls: 4] (Karl Reaves: 1 personal fouls)   FT 1/1: GOOD Desmond Towns makes 1/1 from the line.
Score: 76-91

[05:17] Team_004 possession (Score: 76-91)
Dwyane Irving drives and kicks out. Russell Barnes attempts a Midrange. Wide open! Shai Jordan is 6.7 feet away. [MAN] Russell Barnes misses. Rebound secured by De'Aaron Allen.

[05:02] Team_049 possession (Score: 76-91)
Miles Jackson attempts a Layup. Heavily contested by Shai Beal (1.1 feet, MAN)! MILES JACKSON MAKES IT! Assist: Shai Jordan
Score: 76-93

[04:48] Team_004 possession (Score: 76-93)
Shai Beal attempts a Midrange. Contested by Miles Jackson (2.2 feet, MAN). SHAI BEAL MAKES IT! Assist: Michael Sabonis
Score: 78-93

[04:31] Team_049 possession (Score: 78-93)
Shaquille Lillard attempts a Layup. Contested by Karl Reaves (4.7 feet, MAN). SHAQUILLE LILLARD MAKES IT! Assist: Miles Jackson
Score: 78-95

[04:12] Team_004 possession (Score: 78-95)
Karl Reaves attempts a 3Pt. Contested by Shaquille Lillard (3.0 feet, ZONE). Karl Reaves misses. Rebound secured by Shai Jordan.

[03:54] Team_049 possession (Score: 78-95)
Shaquille Lillard drives, Karl Reaves stays with him. Shaquille Lillard attempts a Dunk. Contested by Karl Reaves (5.7 feet, MAN). SHAQUILLE LILLARD MAKES IT!
Score: 78-97

[03:42] Team_004 possession (Score: 78-97)
Karl Reaves attempts a 3Pt. Wide open! Shaquille Lillard is 6.8 feet away. [MAN] Karl Reaves misses. Rebound secured by Miles Jackson.

[03:24] Team_049 possession (Score: 78-97)
Shai Jordan drives, picks up Shai Beal. Help arrives from Russell Barnes! Shai Jordan attempts a Layup. Wide open! Russell Barnes is 6.6 feet away. [ZONE] SHAI JORDAN MAKES IT!
Score: 78-99

[03:08] Team_004 possession (Score: 78-99)
FOUL! Holding foul on Miles Jackson. [Team fouls: 4] No free throws, side out. (Miles Jackson: 2 personal fouls)

[02:54] Team_004 possession (Score: 78-99)
Dwyane Irving makes the Layup and draws the foul on Miles Jackson! And-1! Dwyane Irving to the line for 1. [BONUS: 5 team fouls] (Miles Jackson: 3 personal fouls)   FT 1/1: GOOD Dwyane Irving makes 1/1 from the line.
Score: 81-99

[02:41] Team_049 possession (Score: 81-99)
Desmond Towns drives to the basket... FOUL! Offensive foul on Desmond Towns! Dwyane Irving drew the charge! [Team fouls: 6] (Desmond Towns: 1 personal fouls) TURNOVER! (dead ball)

[02:26] Team_004 possession (Score: 81-99)
FOUL! Holding foul on Shaquille Lillard. [IN THE BONUS! 7 team fouls] Karl Reaves to the line for 2 free throws. (Shaquille Lillard: 2 personal fouls)   FT 1/2: GOOD   FT 2/2: GOOD Karl Reaves makes 2/2 from the line.
Score: 83-99

[02:13] Team_049 possession (Score: 83-99)
Miles Jackson attempts a Midrange. Contested by Shai Beal (5.9 feet, MAN). MILES JACKSON MAKES IT! Assist: De'Aaron Allen
Score: 83-101

[01:58] Team_004 possession (Score: 83-101)
Karl Reaves drives and kicks out. Michael Sabonis attempts a Midrange. Wide open! De'Aaron Allen is 6.9 feet away. [ZONE] MICHAEL SABONIS MAKES IT! Assist: Karl Reaves
Score: 85-101

[01:44] Team_049 possession (Score: 85-101)
De'Aaron Allen drives and kicks out. Miles Jackson attempts a 3Pt. Contested by Shai Beal (5.1 feet, MAN). MILES JACKSON MAKES IT! Assist: De'Aaron Allen
Score: 85-104

[01:29] Team_004 possession (Score: 85-104)
FOUL! Holding foul on Miles Jackson. [IN THE BONUS! 8 team fouls] Shai Beal to the line for 2 free throws. (Miles Jackson: 4 personal fouls)   FT 1/2: MISS   FT 2/2: GOOD Shai Beal makes 1/2 from the line.
Score: 86-104

[01:15] Team_049 possession (Score: 86-104)
De'Aaron Allen attempts a Midrange. Contested by Dwyane Irving (4.0 feet, ZONE). De'Aaron Allen misses. Rebound secured by Michael Sabonis.

[01:03] Team_004 possession (Score: 86-104)
Michael Sabonis drives, picks up De'Aaron Allen. Help arrives from Shai Jordan! Michael Sabonis attempts a Dunk. Contested by Shai Jordan (5.4 feet, MAN). MICHAEL SABONIS MAKES IT! Assist: Dwyane Irving
Score: 88-104

[00:49] Team_049 possession (Score: 88-104)
Miles Jackson drives and kicks out. Shai Jordan attempts a Midrange. BLOCKED BY RUSSELL BARNES! Ball deflects out of bounds off Shai Jordan.

[00:35] Team_004 possession (Score: 88-104)
FOUL! Offensive foul on Shai Beal! Miles Jackson drew the charge! [Team fouls: 5] (Shai Beal: 2 personal fouls) TURNOVER! (dead ball)

[00:18] Team_049 possession (Score: 88-104)
Miles Jackson attempts a Layup. Contested by Shai Beal (3.7 feet, ZONE). Miles Jackson misses. Rebound secured by Michael Sabonis.

[00:05] Team_004 possession (Score: 88-104)
Dwyane Irving attempts a 3Pt. Wide open! Desmond Towns is 7.4 feet away. [ZONE] Dwyane Irving misses. Rebound secured by Shai Jordan.

================================================================================
                              4TH QUARTER COMPLETE                              
================================================================================

4TH QUARTER SCORE: Team_004 19, Team_049 27

BOX SCORE:
================================================================================

Team_004
--------------------------------------------------------------------------------
Player                MIN  PTS  REB  AST  TO      FG   FG%      3P   3P%
--------------------------------------------------------------------------------
Dwyane Irving          38    5    1    2   0   2/5    40.0     0/0   0.0
Draymond Fox           29    5    0    0   0   2/2   100.0     0/0   0.0
Michael Sabonis        20    4    4    1   0   2/2   100.0     0/0   0.0
Shai Beal              20    3    1    0   0   2/3    66.7     0/0   0.0
Karl Reaves            20    2    0    1   0   1/3    33.3     0/0   0.0
Michael Curry          29    0    0    0   0   0/3     0.0     0/0   0.0
Jabari Wade            29    0    0    1   0   0/0     0.0     0/0   0.0
Anthony Lillard        29    0    2    0   0   0/0     0.0     0/0   0.0
Russell Barnes         20    0    0    0   0   0/2     0.0     0/0   0.0

TEAM: FG: 9/20 (45.0%), 3PT: 2/9 (22.2%), REB: 8 (0 off, 8 def), AST: 5, TO: 3
TEAM FOULS: 5 [Team_049 in BONUS]


Team_049
--------------------------------------------------------------------------------
Player                MIN  PTS  REB  AST  TO      FG   FG%      3P   3P%
--------------------------------------------------------------------------------
Miles Jackson          20   10    1    1   0   4/7    57.1     0/0   0.0
Desmond Towns          20    7    0    0   0   2/3    66.7     0/0   0.0
Shaquille Lillard      20    4    0    0   0   2/2   100.0     0/0   0.0
Shai Bird              29    2    0    0   0   1/2    50.0     0/0   0.0
Shai Jordan            20    2    4    2   0   1/2    50.0     0/0   0.0
Shai Mobley            29    0    2    0   0   0/1     0.0     0/0   0.0
Jimmy Griffin          29    0    1    0   0   0/0     0.0     0/0   0.0
Ja Oladipo             29    0    0    0   0   0/1     0.0     0/0   0.0
De'Aaron Allen         38    0    4    2   0   0/1     0.0     0/0   0.0

TEAM: FG: 10/19 (52.6%), 3PT: 2/3 (66.7%), REB: 12 (1 off, 11 def), AST: 5, TO: 3
TEAM FOULS: 8 [Team_004 in BONUS]

================================================================================

================================================================================
                               FULL GAME COMPLETE                               
================================================================================

FINAL SCORE: Team_004 88, Team_049 104

SCORING BY QUARTER:
--------------------------------------------------------------------------------
Team                     Q1     Q2     Q3     Q4    FINAL
--------------------------------------------------------------------------------
Team_004                 23     16     30     19       88
Team_049                 21     22     34     27      104
--------------------------------------------------------------------------------

FULL GAME BOX SCORE:
================================================================================

Team_004
--------------------------------------------------------------------------------
Player                MIN  PTS  REB  AST  TO      FG   FG%      3P   3P%      FT STL BLK
--------------------------------------------------------------------------------
Dwyane Irving          38   13    9    4   4   5/10   50.0   1/4    25.0   4/5     0   0
Michael Curry          29   17    0    1   1   7/14   50.0   3/7    42.9   2/2     0   0
Jabari Wade            29    4    0    4   0   1/8    12.5   0/3     0.0   0/0     0   0
Draymond Fox           29   14    9    2   4   7/11   63.6   2/4    50.0   4/4     0   0
Anthony Lillard        29    8   11    2   0   4/9    44.4   0/0     0.0   2/2     1   1
Karl Reaves            20    2    0    2   0   3/5    60.0   0/2     0.0   2/2     0   0
Russell Barnes         20    2    1    0   0   0/3     0.0   0/3     0.0   0/0     1   1
Michael Sabonis        20   11    8    1   1   2/3    66.7   0/0     0.0   4/4     1   0
Shai Beal              20    5    3    2   3   2/7    28.6   0/0     0.0   3/4     1   0
Kristaps Green         10   12    0    0   1   4/4   100.0   3/3   100.0   1/1     1   0

TEAM: FG: 38/77 (49.4%), 3PT: 9/26 (34.6%), REB: 41 (4 off, 37 def), AST: 18, TO: 14


Team_049
--------------------------------------------------------------------------------
Player                MIN  PTS  REB  AST  TO      FG   FG%      3P   3P%      FT STL BLK
--------------------------------------------------------------------------------
De'Aaron Allen         38   21   12    3   2   9/17   52.9   4/7    57.1   1/3     1   0
Shai Bird              29   11    0    2   0   4/6    66.7   1/1   100.0   2/3     1   0
Ja Oladipo             29   12    0    1   0   5/11   45.5   2/3    66.7   2/2     0   0
Jimmy Griffin          29    2    5    5   1   1/5    20.0   0/3     0.0   0/0     0   0
Shai Mobley            29    8   15    3   2   4/11   36.4   0/2     0.0   1/3     0   1
Shaquille Lillard      20    7    0    0   2   4/4   100.0   2/2   100.0   0/0     1   0
Shai Jordan            20    9    7    3   2   2/5    40.0   0/2     0.0   1/1     0   0
Desmond Towns          20    9    0    2   1   3/5    60.0   2/3    66.7   4/5     0   0
Miles Jackson          20   14    5    1   1   5/9    55.6   0/0     0.0   1/1     1   2
Giannis Anunoby        10    5    1    0   1   3/4    75.0   1/2    50.0   0/0     0   0

TEAM: FG: 40/78 (51.3%), 3PT: 12/25 (48.0%), REB: 45 (7 off, 38 def), AST: 20, TO: 12

================================================================================
