================================================================================
                        FULL GAME - Team_091 vs Team_080                        
================================================================================

================================================================================
                       1ST QUARTER - Team_091 vs Team_080                       
================================================================================

[12:00] Team_091 possession (Score: 0-0)
D'Angelo Ingram drives to the basket... D'Angelo Ingram loses the ball! Stripped by Draymond Simons! TURNOVER! (live ball)

[11:42] Team_080 possession (Score: 0-0)
Khris Turner drives, Kevin Simons stays with him. Khris Turner attempts a Layup. Contested by Kevin Simons (4.4 feet, ZONE). KHRIS TURNER MAKES IT!
Score: 0-2

[11:28] Team_091 possession (Score: 0-2)
Rudy Bridges attempts a Midrange. Contested by Larry Paul (2.4 feet, MAN). Rudy Bridges misses. Offensive rebound by Kevin Simons! Kevin Simons's putback is no good. Rebound secured by Larry Paul.

[11:16] Team_080 possession (Score: 0-2)
Lauri Dosunmu drives to the basket... Lauri Dosunmu loses the ball! Stripped by Kyrie Rozier! TURNOVER! (live ball)

[11:02] Team_091 possession (Score: 0-2)
Rudy Bridges drives, Larry Paul stays with him. Rudy Bridges attempts a Dunk. Contested by Larry Paul (3.3 feet, MAN). RUDY BRIDGES MAKES IT!
Score: 2-2

[10:50] Team_080 possession (Score: 2-2)
FOUL! Offensive foul on Larry Paul! Rudy Bridges drew the charge! [Team fouls: 1] (Larry Paul: 1 personal fouls) TURNOVER! (dead ball)

[10:37] Team_091 possession (Score: 2-2)
D'Angelo Ingram attempts a 3Pt. Contested by Lauri Dosunmu (4.0 feet, ZONE). D'Angelo Ingram misses. Offensive rebound by Kevin Simons! Kevin Simons's putback is no good. Rebound secured by Draymond Simons.

[10:18] Team_080 possession (Score: 2-2)
Lauri Dosunmu attempts a 3Pt. Contested by Kyrie Rozier (5.4 feet, MAN). Lauri Dosunmu misses. Rebound secured by Kyrie Rozier.

[10:06] Team_091 possession (Score: 2-2)
Rudy Bridges throws a bad pass! Stolen by Larry Paul! TURNOVER! (live ball)

[09:53] Team_080 possession (Score: 2-2)
Lauri Dosunmu attempts a 3Pt. Heavily contested by Kyrie Rozier (0.6 feet, MAN)! Lauri Dosunmu misses. Rebound secured by Kyrie Rozier.

[09:42] Team_091 possession (Score: 2-2)
Kyrie Rozier attempts a Midrange. Contested by Lauri Dosunmu (5.4 feet, MAN). KYRIE ROZIER MAKES IT!
Score: 4-2

[09:25] Team_080 possession (Score: 4-2)
Khris Turner drives, Isaiah Siakam stays with him. Khris Turner attempts a Dunk. Contested by Isaiah Siakam (3.9 feet, MAN). Khris Turner misses. Rebound secured by Rudy Bridges.

[09:09] Team_091 possession (Score: 4-2)
FOUL! Reach-in foul on Khris Turner during the drive. [Team fouls: 2] No free throws, side out. (Khris Turner: 1 personal fouls)

[08:57] Team_091 possession (Score: 4-2)
D'Angelo Ingram attempts a 3Pt. Wide open! Lauri Dosunmu is 7.0 feet away. [ZONE] D'Angelo Ingram misses. Rebound secured by Larry Paul.

[08:40] Team_080 possession (Score: 4-2)
Lauri Dosunmu attempts a 3Pt. Heavily contested by Kyrie Rozier (1.7 feet, MAN)! Lauri Dosunmu misses. Rebound secured by Rudy Bridges.

[08:22] Team_091 possession (Score: 4-2)
FOUL! Holding foul on Larry Paul. [Team fouls: 3] No free throws, side out. (Larry Paul: 2 personal fouls)

[08:06] Team_091 possession (Score: 4-2)
Rudy Bridges attempts a Midrange. Contested by Larry Paul (4.4 feet, MAN). RUDY BRIDGES MAKES IT! Assist: Isaiah Siakam
Score: 6-2

[07:52] Team_080 possession (Score: 6-2)
Larry Paul attempts a 3Pt. Contested by Rudy Bridges (5.9 feet, MAN). Larry Paul misses. Rebound secured by Kyrie Rozier.

[07:33] Team_091 possession (Score: 6-2)
Isaiah Siakam drives and kicks out. FOUL! Shooting foul on Jaren Morant. D'Angelo Ingram to the line for 2 free throws. [Team fouls: 4] (Jaren Morant: 1 personal fouls)   FT 1/2: GOOD   FT 2/2: GOOD D'Angelo Ingram makes 2/2 from the line.
Score: 8-2

[07:16] Team_080 possession (Score: 8-2)
Jaren Morant attempts a Midrange. Contested by D'Angelo Ingram (4.1 feet, MAN). Jaren Morant misses. Rebound secured by Kyrie Rozier.

[07:02] Team_091 possession (Score: 8-2)
D'Angelo Ingram drives, Jaren Morant stays with him. D'Angelo Ingram attempts a Dunk. Wide open! Jaren Morant is 6.6 feet away. [MAN] D'ANGELO INGRAM MAKES IT! Assist: Kevin Simons
Score: 10-2

[06:47] Team_080 possession (Score: 10-2)
Khris Turner attempts a 3Pt. Contested by Kyrie Rozier (5.9 feet, ZONE). Khris Turner misses. Rebound secured by Kevin Simons.

[06:34] Team_091 possession (Score: 10-2)
Isaiah Siakam loses the ball! Stripped by Khris Turner! TURNOVER! (live ball)

[06:20] Team_080 possession (Score: 10-2)
Lauri Dosunmu attempts a 3Pt. Wide open! Kyrie Rozier is 7.0 feet away. [ZONE] LAURI DOSUNMU MAKES IT! Assist: Larry Paul
Score: 10-5

[06:10] Team_091 possession (Score: 10-5)
Kyrie Rozier attempts a 3Pt. Contested by Lauri Dosunmu (5.7 feet, ZONE). KYRIE ROZIER MAKES IT! Assist: Isaiah Siakam
Score: 13-5

[05:57] Team_080 possession (Score: 13-5)
Lauri Dosunmu attempts a Midrange. Contested by Rudy Bridges (3.1 feet, ZONE). Lauri Dosunmu misses. Rebound secured by Rudy Bridges.

[05:40] Team_091 possession (Score: 13-5)
Isaiah Siakam attempts a Midrange. Contested by Khris Turner (2.2 feet, MAN). Isaiah Siakam misses. Offensive rebound by Rudy Bridges! Rudy Bridges kicks it out.

[05:24] Team_091 possession (Score: 13-5)
FOUL! Holding foul on Jaren Morant. [IN THE BONUS! 5 team fouls] D'Angelo Ingram to the line for 2 free throws. (Jaren Morant: 2 personal fouls)   FT 1/2: GOOD   FT 2/2: GOOD D'Angelo Ingram makes 2/2 from the line.
Score: 15-5

[05:04] Team_080 possession (Score: 15-5)
Larry Paul attempts a Layup. Contested by Kevin Simons (5.2 feet, ZONE). LARRY PAUL MAKES IT! Assist: Khris Turner
Score: 15-7

[04:50] Team_091 possession (Score: 15-7)
Kevin Simons attempts a 3Pt. Contested by Lauri Dosunmu (4.5 feet, ZONE). Kevin Simons misses. Rebound secured by Draymond Simons.

[04:33] Team_080 possession (Score: 15-7)
Larry Paul attempts a 3Pt. Contested by Kyrie Rozier (5.3 feet, ZONE). Larry Paul misses. Rebound secured by Kevin Simons.

[04:17] Team_091 possession (Score: 15-7)
Kyrie Rozier attempts a 3Pt. Contested by Lauri Dosunmu (5.8 feet, ZONE). Kyrie Rozier misses. Rebound secured by Jaren Morant.

[04:06] Team_080 possession (Score: 15-7)
Khris Turner drives and kicks out. Khris Turner attempts a Midrange. Contested by D'Angelo Ingram (4.2 feet, ZONE). Khris Turner misses. Rebound secured by Kyrie Rozier.

[03:51] Team_091 possession (Score: 15-7)
Isaiah Siakam attempts a 3Pt. Contested by Lauri Dosunmu (5.3 feet, ZONE). Isaiah Siakam misses. Rebound secured by Draymond Simons.

[03:33] Team_080 possession (Score: 15-7)
Lauri Dosunmu attempts a 3Pt. Contested by Kyrie Rozier (4.3 feet, ZONE). LAURI DOSUNMU MAKES IT! Assist: Jaren Morant
Score: 15-10

[03:16] Team_091 possession (Score: 15-10)
Kyrie Rozier attempts a 3Pt. Contested by Lauri Dosunmu (4.5 feet, ZONE). Kyrie Rozier misses. Rebound secured by Jaren Morant.

[03:02] Team_080 possession (Score: 15-10)
FOUL! Shooting foul on Kevin Simons. Draymond Simons to the line for 2 free throws. [Team fouls: 1] (Kevin Simons: 1 personal fouls)   FT 1/2: GOOD   FT 2/2: MISS Draymond Simons makes 1/2 from the line. FOUL! Loose ball foul on Kyrie Rozier during the free throw rebound! [Team fouls: 2] No free throws, side out. (Kyrie Rozier: 1 personal fouls)
Score: 15-11

[02:45] Team_080 possession (Score: 15-11)
Khris Turner attempts a 3Pt. Wide open! Isaiah Siakam is 7.1 feet away. [MAN] KHRIS TURNER MAKES IT! Assist: Larry Paul
Score: 15-14

[02:29] Team_091 possession (Score: 15-14)
Kyrie Rozier drives, Draymond Simons stays with him. Kyrie Rozier attempts a Dunk. Contested by Draymond Simons (3.7 feet, ZONE). KYRIE ROZIER MAKES IT! Assist: Rudy Bridges
Score: 17-14

[02:17] Team_080 possession (Score: 17-14)
Lauri Dosunmu attempts a 3Pt. Wide open! Kyrie Rozier is 8.5 feet away. [MAN] Lauri Dosunmu misses. Rebound secured by Kevin Simons.

[02:05] Team_091 possession (Score: 17-14)
Kyrie Rozier attempts a Midrange. Wide open! Jaren Morant is 6.2 feet away. [ZONE] Kyrie Rozier misses. Rebound secured by Larry Paul.

[01:46] Team_080 possession (Score: 17-14)
Draymond Simons attempts a Midrange. Wide open! Kevin Simons is 7.6 feet away. [MAN] DRAYMOND SIMONS MAKES IT!
Score: 17-16

[01:34] Team_091 possession (Score: 17-16)
Kyrie Rozier attempts a 3Pt. Contested by Lauri Dosunmu (5.5 feet, ZONE). KYRIE ROZIER MAKES IT! Assist: Isaiah Siakam
Score: 20-16

[01:21] Team_080 possession (Score: 20-16)
Jaren Morant drives, Kevin Simons stays with him. Jaren Morant attempts a Dunk. Wide open! Kevin Simons is 8.2 feet away. [ZONE] Jaren Morant misses. Rebound secured by Rudy Bridges.

[01:07] Team_091 possession (Score: 20-16)
D'Angelo Ingram throws a bad pass! Stolen by Jaren Morant! TURNOVER! (live ball)

[00:52] Team_080 possession (Score: 20-16)
Larry Paul drives and kicks out. Jaren Morant attempts a 3Pt. Wide open! Kyrie Rozier is 7.3 feet away. [ZONE] Jaren Morant misses. Rebound secured by Kevin Simons.

[00:40] Team_091 possession (Score: 20-16)
Isaiah Siakam attempts a 3Pt. Contested by Khris Turner (5.4 feet, MAN). ISAIAH SIAKAM MAKES IT! Assist: D'Angelo Ingram
Score: 23-16

[00:22] Team_080 possession (Score: 23-16)
Draymond Simons drives, Kevin Simons stays with him. Draymond Simons attempts a Layup. Contested by Kevin Simons (4.0 feet, ZONE). DRAYMOND SIMONS MAKES IT! Assist: Larry Paul
Score: 23-18

[00:11] Team_091 possession (Score: 23-18)
Isaiah Siakam drives to the basket... Isaiah Siakam throws a bad pass! Stolen by Draymond Simons! TURNOVER! (live ball)

================================================================================
                              1ST QUARTER COMPLETE                              
================================================================================

1ST QUARTER SCORE: Team_091 23, Team_080 18

BOX SCORE:
================================================================================

Team_091
--------------------------------------------------------------------------------
Player                MIN  PTS  REB  AST  TO      FG   FG%      3P   3P%
--------------------------------------------------------------------------------
Kyrie Rozier           12   10    5    0   0   4/7    57.1     0/0   0.0
D'Angelo Ingram        12    6    0    1   0   3/5    60.0     0/0   0.0
Rudy Bridges           12    4    5    1   0   2/3    66.7     0/0   0.0
Isaiah Siakam          12    3    0    3   0   1/2    50.0     0/0   0.0
Kevin Simons           12    0    4    1   0   0/1     0.0     0/0   0.0

TEAM: FG: 10/18 (55.6%), 3PT: 3/9 (33.3%), REB: 16 (3 off, 13 def), AST: 6, TO: 5
TEAM FOULS: 2


Team_080
--------------------------------------------------------------------------------
Player                MIN  PTS  REB  AST  TO      FG   FG%      3P   3P%
--------------------------------------------------------------------------------
Lauri Dosunmu          12    6    0    0   0   2/7    28.6     0/0   0.0
Khris Turner           12    5    0    1   0   2/5    40.0     0/0   0.0
Draymond Simons        12    4    3    0   0   2/2   100.0     0/0   0.0
Larry Paul             12    2    3    3   0   1/4    25.0     0/0   0.0
Jaren Morant           12    0    3    1   0   0/2     0.0     0/0   0.0

TEAM: FG: 7/20 (35.0%), 3PT: 3/10 (30.0%), REB: 7 (1 off, 6 def), AST: 5, TO: 2
TEAM FOULS: 5 [Team_091 in BONUS]

================================================================================

================================================================================
                       2ND QUARTER - Team_091 vs Team_080                       
================================================================================

[12:00] Team_091 possession (Score: 23-18)
FOUL! Holding foul on Draymond Simons. [Team fouls: 1] No free throws, side out. (Draymond Simons: 1 personal fouls)

[11:45] Team_091 possession (Score: 23-18)
Rudy Bridges attempts a 3Pt. Wide open! Larry Paul is 7.1 feet away. [MAN] Rudy Bridges misses. Offensive rebound by Kevin Simons! Kevin Simons puts it back in!
Score: 25-18

[11:34] Team_080 possession (Score: 25-18)
Draymond Simons attempts a Midrange. Contested by Kevin Simons (5.7 feet, MAN). Draymond Simons misses. Offensive rebound by Draymond Simons! Draymond Simons's putback is no good. Rebound secured by Kyrie Rozier.

[11:18] Team_091 possession (Score: 25-18)
Kevin Simons drives and kicks out. Rudy Bridges attempts a 3Pt. Contested by Larry Paul (3.1 feet, MAN). Rudy Bridges misses. Rebound secured by Draymond Simons.

[11:04] Team_080 possession (Score: 25-18)
FOUL! Reach-in foul on Kyrie Rozier during the drive. [Team fouls: 1] No free throws, side out. (Kyrie Rozier: 1 personal fouls)

[10:47] Team_080 possession (Score: 25-18)
Larry Paul attempts a Midrange. Wide open! Rudy Bridges is 8.5 feet away. [MAN] LARRY PAUL MAKES IT!
Score: 25-20

[10:32] Team_091 possession (Score: 25-20)
Kevin Simons drives and kicks out. D'Angelo Ingram attempts a 3Pt. Wide open! Lauri Dosunmu is 6.4 feet away. [ZONE] D'Angelo Ingram misses. Offensive rebound by Kevin Simons! Kevin Simons puts it back in!
Score: 27-20

[10:16] Team_080 possession (Score: 27-20)
Draymond Simons attempts a 3Pt. Contested by Kevin Simons (2.4 feet, MAN). DRAYMOND SIMONS MAKES IT! Assist: Lauri Dosunmu
Score: 27-23

[09:57] Team_091 possession (Score: 27-23)
Rudy Bridges attempts a 3Pt. Contested by Lauri Dosunmu (2.3 feet, ZONE). RUDY BRIDGES MAKES IT! Assist: D'Angelo Ingram
Score: 30-23

[09:41] Team_080 possession (Score: 30-23)
Lauri Dosunmu attempts a Midrange. Wide open! Kyrie Rozier is 7.0 feet away. [MAN] LAURI DOSUNMU MAKES IT!
Score: 30-25

[09:25] Team_091 possession (Score: 30-25)
Kyrie Rozier attempts a 3Pt. Contested by Lauri Dosunmu (5.0 feet, MAN). Kyrie Rozier misses. Rebound secured by Jaren Morant.

[09:08] Team_080 possession (Score: 30-25)
Khris Turner attempts a 3Pt. Wide open! Isaiah Siakam is 7.5 feet away. [MAN] Khris Turner misses. Rebound secured by Kevin Simons.

[08:52] Team_091 possession (Score: 30-25)
Rudy Bridges attempts a 3Pt. Contested by Larry Paul (4.0 feet, MAN). RUDY BRIDGES MAKES IT! Assist: Kyrie Rozier
Score: 33-25

[08:34] Team_080 possession (Score: 33-25)
Lauri Dosunmu makes the Layup and draws the foul on Kyrie Rozier! And-1! Lauri Dosunmu to the line for 1. [Team fouls: 2] (Kyrie Rozier: 2 personal fouls)   FT 1/1: GOOD Lauri Dosunmu makes 1/1 from the line.
Score: 33-28

[08:22] Team_091 possession (Score: 33-28)
Rudy Bridges throws a bad pass! Stolen by Larry Paul! TURNOVER! (live ball)

[08:10] Team_080 possession (Score: 33-28)
Khris Turner drives, picks up Isaiah Siakam. Help arrives from Rudy Bridges! Khris Turner attempts a Dunk. Contested by Rudy Bridges (3.8 feet, MAN). Khris Turner misses. Rebound secured by Rudy Bridges.

[07:54] Team_091 possession (Score: 33-28)
Isaiah Siakam attempts a 3Pt. Contested by Khris Turner (5.7 feet, MAN). ISAIAH SIAKAM MAKES IT! Assist: D'Angelo Ingram
Score: 36-28

[07:39] Team_080 possession (Score: 36-28)
Lauri Dosunmu attempts a 3Pt. Wide open! Kyrie Rozier is 9.2 feet away. [ZONE] Lauri Dosunmu misses. Offensive rebound by Draymond Simons! Draymond Simons's putback is no good. Offensive rebound by Draymond Simons! Draymond Simons kicks it out.

[07:26] Team_080 possession (Score: 36-28)
Jaren Morant attempts a Layup. BLOCKED BY D'ANGELO INGRAM! Ball is loose! Rebound secured by Kevin Simons.

[07:08] Team_091 possession (Score: 36-28)
Rudy Bridges drives, picks up Larry Paul. Help arrives from Khris Turner! Rudy Bridges attempts a Dunk. Heavily contested by Khris Turner (1.4 feet, MAN)! RUDY BRIDGES MAKES IT! Assist: Kyrie Rozier
Score: 38-28

[06:51] Team_080 possession (Score: 38-28)
Khris Turner attempts a 3Pt. Wide open! Kyrie Rozier is 6.4 feet away. [ZONE] Khris Turner misses. Rebound secured by Rudy Bridges.

[06:40] Team_091 possession (Score: 38-28)
FOUL! Reach-in foul on Lauri Dosunmu during the drive. [Team fouls: 2] No free throws, side out. (Lauri Dosunmu: 1 personal fouls)

[06:23] Team_091 possession (Score: 38-28)
FOUL! Shooting foul on Draymond Simons. Kevin Simons to the line for 2 free throws. [Team fouls: 3] (Draymond Simons: 2 personal fouls)   FT 1/2: MISS   FT 2/2: GOOD Kevin Simons makes 1/2 from the line.
Score: 39-28

[06:09] Team_080 possession (Score: 39-28)
Lauri Dosunmu attempts a 3Pt. Contested by Kyrie Rozier (3.8 feet, MAN). LAURI DOSUNMU MAKES IT! Assist: Jaren Morant
Score: 39-31

[05:54] Team_091 possession (Score: 39-31)
D'Angelo Ingram attempts a 3Pt. Wide open! Jaren Morant is 6.0 feet away. [MAN] D'ANGELO INGRAM MAKES IT! Assist: Kevin Simons
Score: 42-31

[05:40] Team_080 possession (Score: 42-31)
Draymond Simons drives, picks up D'Angelo Ingram. Help arrives from Kyrie Rozier! Draymond Simons attempts a Layup. Wide open! Kyrie Rozier is 8.0 feet away. [ZONE] Draymond Simons misses. Rebound secured by Kevin Simons.

[05:26] Team_091 possession (Score: 42-31)
D'Angelo Ingram attempts a 3Pt. Contested by Lauri Dosunmu (3.3 feet, ZONE). D'Angelo Ingram misses. Rebound secured by Draymond Simons.

[05:11] Team_080 possession (Score: 42-31)
Larry Paul drives to the basket... FOUL! Offensive foul on Larry Paul! Kevin Simons drew the charge! [Team fouls: 4] (Larry Paul: 1 personal fouls) TURNOVER! (dead ball)

[04:55] Team_091 possession (Score: 42-31)
Kyrie Rozier loses the ball! Stripped by Lauri Dosunmu! TURNOVER! (live ball)

[04:42] Team_080 possession (Score: 42-31)
Larry Paul throws a bad pass! Stolen by Rudy Bridges! TURNOVER! (live ball)

[04:30] Team_091 possession (Score: 42-31)
D'Angelo Ingram drives, Draymond Simons stays with him. D'Angelo Ingram attempts a Dunk. Contested by Draymond Simons (4.9 feet, ZONE). D'ANGELO INGRAM MAKES IT! Assist: Rudy Bridges
Score: 44-31

[04:12] Team_080 possession (Score: 44-31)
Khris Turner drives, picks up Isaiah Siakam. Help arrives from Rudy Bridges! Khris Turner attempts a Layup. Wide open! Rudy Bridges is 6.3 feet away. [MAN] KHRIS TURNER MAKES IT!
Score: 44-33

[03:54] Team_091 possession (Score: 44-33)
Rudy Bridges attempts a Layup. Heavily contested by Larry Paul (1.9 feet, MAN)! Rudy Bridges misses. Offensive rebound by Rudy Bridges! Rudy Bridges kicks it out.

[03:42] Team_091 possession (Score: 44-33)
Isaiah Siakam attempts a 3Pt. Wide open! Lauri Dosunmu is 7.2 feet away. [ZONE] ISAIAH SIAKAM MAKES IT! Assist: Kevin Simons
Score: 47-33

[03:26] Team_080 possession (Score: 47-33)
Jaren Morant attempts a Midrange. Contested by Rudy Bridges (3.4 feet, ZONE). JAREN MORANT MAKES IT!
Score: 47-35

[03:09] Team_091 possession (Score: 47-35)
Kevin Simons attempts a 3Pt. Wide open! Jaren Morant is 8.2 feet away. [ZONE] Kevin Simons misses. Rebound secured by Draymond Simons.

[02:56] Team_080 possession (Score: 47-35)
Draymond Simons attempts a Midrange. Contested by Kevin Simons (5.7 feet, MAN). Draymond Simons misses. Rebound secured by Rudy Bridges.

[02:44] Team_091 possession (Score: 47-35)
Kevin Simons attempts a Layup. Wide open! Draymond Simons is 6.2 feet away. [MAN] KEVIN SIMONS MAKES IT! Assist: Kyrie Rozier
Score: 49-35

[02:26] Team_080 possession (Score: 49-35)
FOUL! Holding foul on D'Angelo Ingram. [Team fouls: 3] No free throws, side out. (D'Angelo Ingram: 1 personal fouls)

[02:12] Team_080 possession (Score: 49-35)
Jaren Morant attempts a Layup. Contested by Kevin Simons (5.7 feet, ZONE). JAREN MORANT MAKES IT! Assist: Lauri Dosunmu
Score: 49-37

[01:58] Team_091 possession (Score: 49-37)
Isaiah Siakam loses control! Ball rolls out of bounds! TURNOVER! (dead ball)

[01:58] Substitution (Team_091): Kyrie Rozier OUT → Karl Morant IN (stamina_rule2)

[01:58] Substitution (Team_091): Isaiah Siakam OUT → Julius Barnes IN (stamina_rule2)

[01:58] Substitution (Team_091): Rudy Bridges OUT → Tim Antetokounmpo IN (stamina_rule2)

[01:58] Substitution (Team_091): D'Angelo Ingram OUT → Zion Mitchell IN (stamina_rule2)

[01:58] Substitution (Team_091): Kevin Simons OUT → Ja George IN (stamina_rule2)

[01:58] Substitution (Team_080): Lauri Dosunmu OUT → Tony James IN (stamina_rule2)

[01:58] Substitution (Team_080): Khris Turner OUT → Larry Reaves IN (stamina_rule2)

[01:58] Substitution (Team_080): Larry Paul OUT → Joel Bryant IN (stamina_rule2)

[01:58] Substitution (Team_080): Jaren Morant OUT → Ja Cunningham IN (stamina_rule2)

[01:58] Substitution (Team_080): Draymond Simons OUT → Trae Brogdon IN (stamina_rule2)

[01:45] Team_080 possession (Score: 49-37)
Ja Cunningham attempts a Layup. Heavily contested by Zion Mitchell (1.5 feet, ZONE)! Ja Cunningham misses. Rebound secured by Zion Mitchell.

[01:28] Team_091 possession (Score: 49-37)
Karl Morant attempts a 3Pt. Contested by Tony James (3.1 feet, MAN). KARL MORANT MAKES IT! Assist: Zion Mitchell
Score: 52-37

[01:16] Team_080 possession (Score: 52-37)
Joel Bryant attempts a Midrange. Wide open! Julius Barnes is 6.8 feet away. [ZONE] Joel Bryant misses. Rebound secured by Ja George.

[01:04] Team_091 possession (Score: 52-37)
Ja George drives, Ja Cunningham stays with him. Ja George attempts a Layup. Contested by Ja Cunningham (3.1 feet, ZONE). Ja George misses. Rebound secured by Ja Cunningham.

[00:54] Team_080 possession (Score: 52-37)
Joel Bryant attempts a Midrange. Wide open! Tim Antetokounmpo is 6.3 feet away. [MAN] Joel Bryant misses. Rebound secured by Zion Mitchell.

[00:38] Team_091 possession (Score: 52-37)
Julius Barnes attempts a 3Pt. Wide open! Larry Reaves is 7.5 feet away. [MAN] JULIUS BARNES MAKES IT! Assist: Karl Morant
Score: 55-37

[00:28] Team_080 possession (Score: 55-37)
Larry Reaves attempts a 3Pt. Wide open! Julius Barnes is 6.2 feet away. [MAN] Larry Reaves misses. Rebound secured by Zion Mitchell.

[00:13] Team_091 possession (Score: 55-37)
Julius Barnes drives to the basket... Julius Barnes commits a violation (traveling/carry)! TURNOVER! (dead ball)

[00:01] Team_080 possession (Score: 55-37)
Trae Brogdon attempts a Layup. BLOCKED BY JA GEORGE! Ball deflects out of bounds off Trae Brogdon.

================================================================================
                              2ND QUARTER COMPLETE                              
================================================================================

2ND QUARTER SCORE: Team_091 32, Team_080 19

BOX SCORE:
================================================================================

Team_091
--------------------------------------------------------------------------------
Player                MIN  PTS  REB  AST  TO      FG   FG%      3P   3P%
--------------------------------------------------------------------------------
Rudy Bridges           22    8    4    1   0   3/3   100.0     0/0   0.0
Kevin Simons           22    7    5    2   0   4/6    66.7     0/0   0.0
Isaiah Siakam          22    6    0    0   0   2/2   100.0     0/0   0.0
D'Angelo Ingram        22    5    0    2   0   2/3    66.7     0/0   0.0
Karl Morant             2    3    0    1   0   1/1   100.0     0/0   0.0
Julius Barnes           2    3    0    0   0   1/1   100.0     0/0   0.0
Kyrie Rozier           22    0    1    3   0   0/1     0.0     0/0   0.0
Zion Mitchell           2    0    3    1   0   0/0     0.0     0/0   0.0
Ja George               2    0    1    0   0   0/1     0.0     0/0   0.0

TEAM: FG: 13/18 (72.2%), 3PT: 8/11 (72.7%), REB: 13 (3 off, 10 def), AST: 10, TO: 4
TEAM FOULS: 3


Team_080
--------------------------------------------------------------------------------
Player                MIN  PTS  REB  AST  TO      FG   FG%      3P   3P%
--------------------------------------------------------------------------------
Lauri Dosunmu          22    8    0    2   0   3/3   100.0     0/0   0.0
Jaren Morant           22    4    1    1   0   2/3    66.7     0/0   0.0
Draymond Simons        22    3    4    0   0   1/4    25.0     0/0   0.0
Larry Paul             22    2    0    0   0   1/1   100.0     0/0   0.0
Khris Turner           22    2    0    0   0   1/4    25.0     0/0   0.0
Ja Cunningham           2    0    1    0   0   0/1     0.0     0/0   0.0
Joel Bryant             2    0    0    0   0   0/2     0.0     0/0   0.0
Larry Reaves            2    0    0    0   0   0/1     0.0     0/0   0.0
Trae Brogdon            2    0    0    0   0   0/1     0.0     0/0   0.0

TEAM: FG: 8/20 (40.0%), 3PT: 2/5 (40.0%), REB: 7 (2 off, 5 def), AST: 3, TO: 2
TEAM FOULS: 4

================================================================================

================================================================================
                       3RD QUARTER - Team_091 vs Team_080                       
================================================================================

[12:00] Team_091 possession (Score: 55-37)
Kevin Simons drives to the basket... Kevin Simons loses the ball! Stripped by Draymond Simons! TURNOVER! (live ball)

[11:44] Team_080 possession (Score: 55-37)
Lauri Dosunmu drives to the basket... Lauri Dosunmu throws a bad pass! Stolen by Kevin Simons! TURNOVER! (live ball)

[11:26] Team_091 possession (Score: 55-37)
Isaiah Siakam attempts a 3Pt. Heavily contested by Khris Turner (2.0 feet, MAN)! Isaiah Siakam misses. Rebound secured by Larry Paul.

[11:10] Team_080 possession (Score: 55-37)
Khris Turner attempts a 3Pt. Contested by Kyrie Rozier (4.3 feet, ZONE). KHRIS TURNER MAKES IT! Assist: Larry Paul
Score: 55-40

[10:57] Team_091 possession (Score: 55-40)
FOUL! Reach-in foul on Draymond Simons during the drive. [Team fouls: 1] No free throws, side out. (Draymond Simons: 1 personal fouls)

[10:41] Team_091 possession (Score: 55-40)
Kyrie Rozier drives and kicks out. Kyrie Rozier attempts a Midrange. Heavily contested by Lauri Dosunmu (1.7 feet, MAN)! Kyrie Rozier misses. Offensive rebound by Kevin Simons! Kevin Simons's putback is no good. Rebound secured by Draymond Simons.

[10:21] Team_080 possession (Score: 55-40)
Draymond Simons drives, Kevin Simons stays with him. Draymond Simons attempts a Dunk. Heavily contested by Kevin Simons (1.2 feet, MAN)! Draymond Simons misses. Offensive rebound by Draymond Simons! Draymond Simons puts it back in!
Score: 55-42

[10:05] Team_091 possession (Score: 55-42)
Kevin Simons attempts a Layup. Contested by Draymond Simons (4.5 feet, MAN). Kevin Simons misses. Offensive rebound by Rudy Bridges! Rudy Bridges kicks it out.

[09:53] Team_091 possession (Score: 55-42)
Isaiah Siakam attempts a 3Pt. Contested by Larry Paul (2.0 feet, ZONE). Isaiah Siakam misses. Rebound secured by Larry Paul.

[09:37] Team_080 possession (Score: 55-42)
Draymond Simons attempts a 3Pt. Contested by Kevin Simons (6.0 feet, MAN). Draymond Simons misses. Rebound secured by Kyrie Rozier.

[09:19] Team_091 possession (Score: 55-42)
FOUL! Reach-in foul on Draymond Simons during the drive. [Team fouls: 2] No free throws, side out. (Draymond Simons: 2 personal fouls)

[09:08] Team_091 possession (Score: 55-42)
Kyrie Rozier throws a bad pass! Stolen by Lauri Dosunmu! TURNOVER! (live ball)

[08:57] Team_080 possession (Score: 55-42)
Jaren Morant attempts a Layup. Contested by Kevin Simons (3.8 feet, ZONE). Jaren Morant misses. Rebound secured by Kevin Simons.

[08:42] Team_091 possession (Score: 55-42)
FOUL! Reach-in foul on Draymond Simons during the drive. [Team fouls: 3] No free throws, side out. (Draymond Simons: 3 personal fouls)

[08:31] Team_091 possession (Score: 55-42)
Isaiah Siakam attempts a 3Pt. Wide open! Khris Turner is 8.7 feet away. [MAN] Isaiah Siakam misses. Offensive rebound by Kevin Simons! Kevin Simons's putback is no good. Offensive rebound by Kevin Simons! Kevin Simons kicks it out.

[08:16] Team_091 possession (Score: 55-42)
Kyrie Rozier attempts a 3Pt. Wide open! Lauri Dosunmu is 7.7 feet away. [ZONE] Kyrie Rozier misses. Offensive rebound by Kevin Simons! Kevin Simons puts it back in!
Score: 57-42

[07:59] Team_080 possession (Score: 57-42)
Larry Paul attempts a 3Pt. Wide open! Kyrie Rozier is 8.1 feet away. [ZONE] LARRY PAUL MAKES IT! Assist: Draymond Simons
Score: 57-45

[07:41] Team_091 possession (Score: 57-45)
Kevin Simons attempts a Midrange. Contested by Draymond Simons (3.5 feet, MAN). Kevin Simons misses. Rebound secured by Draymond Simons.

[07:26] Team_080 possession (Score: 57-45)
Draymond Simons drives, Kevin Simons stays with him. Draymond Simons attempts a Layup. Contested by Kevin Simons (5.4 feet, MAN). DRAYMOND SIMONS MAKES IT! Assist: Lauri Dosunmu
Score: 57-47

[07:12] Team_091 possession (Score: 57-47)
D'Angelo Ingram loses the ball! Stripped by Jaren Morant! TURNOVER! (live ball)

[06:57] Team_080 possession (Score: 57-47)
Lauri Dosunmu attempts a 3Pt. Contested by Kyrie Rozier (4.7 feet, ZONE). Lauri Dosunmu misses. Rebound secured by Kyrie Rozier.

[06:45] Team_091 possession (Score: 57-47)
Isaiah Siakam attempts a 3Pt. Contested by Lauri Dosunmu (2.8 feet, ZONE). Isaiah Siakam misses. Rebound secured by Larry Paul.

[06:29] Team_080 possession (Score: 57-47)
Draymond Simons makes the Layup and draws the foul on Kevin Simons! And-1! Draymond Simons to the line for 1. [Team fouls: 1] (Kevin Simons: 1 personal fouls)   FT 1/1: GOOD Draymond Simons makes 1/1 from the line.
Score: 57-50

[06:14] Team_091 possession (Score: 57-50)
D'Angelo Ingram attempts a Midrange. Wide open! Jaren Morant is 6.3 feet away. [MAN] D'ANGELO INGRAM MAKES IT! Assist: Kyrie Rozier
Score: 59-50

[06:01] Team_080 possession (Score: 59-50)
FOUL! Offensive foul on Lauri Dosunmu! Kyrie Rozier drew the charge! [Team fouls: 4] (Lauri Dosunmu: 1 personal fouls) TURNOVER! (dead ball)

[05:46] Team_091 possession (Score: 59-50)
D'Angelo Ingram drives to the basket... D'Angelo Ingram throws a bad pass out of bounds! TURNOVER! (dead ball)

[05:31] Team_080 possession (Score: 59-50)
Khris Turner attempts a 3Pt. Wide open! Kyrie Rozier is 7.4 feet away. [ZONE] Khris Turner misses. Rebound secured by Kyrie Rozier.

[05:12] Team_091 possession (Score: 59-50)
Kevin Simons drives and kicks out. D'Angelo Ingram attempts a Midrange. Contested by Jaren Morant (3.6 feet, MAN). D'Angelo Ingram misses. Offensive rebound by Rudy Bridges! Rudy Bridges kicks it out.

[04:57] Team_091 possession (Score: 59-50)
D'Angelo Ingram attempts a 3Pt. Wide open! Jaren Morant is 6.3 feet away. [MAN] D'Angelo Ingram misses. Rebound secured by Larry Paul.

[04:46] Team_080 possession (Score: 59-50)
Draymond Simons drives and kicks out. Khris Turner attempts a 3Pt. Contested by Kyrie Rozier (3.8 feet, ZONE). Khris Turner misses. Rebound secured by Rudy Bridges.

[04:32] Team_091 possession (Score: 59-50)
D'Angelo Ingram attempts a Midrange. Contested by Jaren Morant (2.5 feet, MAN). D'Angelo Ingram misses. Rebound secured by Jaren Morant.

[04:17] Team_080 possession (Score: 59-50)
Jaren Morant drives, picks up Kevin Simons. Help arrives from Kyrie Rozier! Jaren Morant attempts a Dunk. Contested by Kyrie Rozier (3.5 feet, ZONE). JAREN MORANT MAKES IT!
Score: 59-52

[04:06] Team_091 possession (Score: 59-52)
D'Angelo Ingram attempts a Layup. BLOCKED BY KHRIS TURNER! Ball deflects out of bounds off D'Angelo Ingram.

[03:49] Team_080 possession (Score: 59-52)
Lauri Dosunmu attempts a Midrange. Contested by Rudy Bridges (5.6 feet, ZONE). LAURI DOSUNMU MAKES IT!
Score: 59-54

[03:30] Team_091 possession (Score: 59-54)
Kyrie Rozier makes the 3Pt and draws the foul on Lauri Dosunmu! And-1! Kyrie Rozier to the line for 1. [BONUS: 5 team fouls] (Lauri Dosunmu: 2 personal fouls)   FT 1/1: GOOD Kyrie Rozier makes 1/1 from the line.
Score: 63-54

[03:15] Team_080 possession (Score: 63-54)
Jaren Morant attempts a Layup. Heavily contested by Kevin Simons (1.7 feet, ZONE)! JAREN MORANT MAKES IT! Assist: Draymond Simons
Score: 63-56

[03:02] Team_091 possession (Score: 63-56)
Kevin Simons attempts a Layup. Contested by Draymond Simons (5.7 feet, MAN). KEVIN SIMONS MAKES IT!
Score: 65-56

[02:49] Team_080 possession (Score: 65-56)
Draymond Simons drives and kicks out. Draymond Simons attempts a Midrange. Wide open! Isaiah Siakam is 7.7 feet away. [ZONE] Draymond Simons misses. Rebound secured by Kyrie Rozier.

[02:33] Team_091 possession (Score: 65-56)
Rudy Bridges attempts a 3Pt. Contested by Lauri Dosunmu (5.1 feet, ZONE). Rudy Bridges misses. FOUL! Loose ball foul on Jaren Morant during the rebound battle. [IN THE BONUS! 6 team fouls] Rudy Bridges to the line for 2 free throws. (Jaren Morant: 1 personal fouls)   FT 1/2: GOOD   FT 2/2: GOOD Rudy Bridges makes 2/2 from the line.
Score: 67-56

[02:18] Team_080 possession (Score: 67-56)
Jaren Morant drives, picks up D'Angelo Ingram. Help arrives from Kyrie Rozier! Jaren Morant attempts a Dunk. Contested by Kyrie Rozier (3.6 feet, MAN). JAREN MORANT MAKES IT! Assist: Larry Paul
Score: 67-58

[02:03] Team_091 possession (Score: 67-58)
FOUL! Holding foul on Khris Turner. [IN THE BONUS! 7 team fouls] Isaiah Siakam to the line for 2 free throws. (Khris Turner: 1 personal fouls)   FT 1/2: GOOD   FT 2/2: GOOD Isaiah Siakam makes 2/2 from the line.
Score: 69-58

[01:50] Team_080 possession (Score: 69-58)
Jaren Morant attempts a Layup. Wide open! D'Angelo Ingram is 6.8 feet away. [ZONE] Jaren Morant misses. Offensive rebound by Draymond Simons! Draymond Simons's putback is no good. Rebound secured by Kyrie Rozier.

[01:33] Team_091 possession (Score: 69-58)
Kyrie Rozier attempts a 3Pt. Contested by Khris Turner (5.7 feet, ZONE). KYRIE ROZIER MAKES IT! Assist: Rudy Bridges
Score: 72-58

[01:21] Team_080 possession (Score: 72-58)
Khris Turner attempts a 3Pt. Wide open! Isaiah Siakam is 10.0 feet away. [MAN] Khris Turner misses. Rebound secured by Rudy Bridges.

[01:07] Team_091 possession (Score: 72-58)
FOUL! Holding foul on Draymond Simons. [IN THE BONUS! 8 team fouls] Kevin Simons to the line for 2 free throws. (Draymond Simons: 4 personal fouls)   FT 1/2: GOOD   FT 2/2: GOOD Kevin Simons makes 2/2 from the line.
Score: 74-58

[00:57] Team_080 possession (Score: 74-58)
Jaren Morant attempts a Midrange. Contested by Rudy Bridges (2.7 feet, ZONE). JAREN MORANT MAKES IT!
Score: 74-60

[00:43] Team_091 possession (Score: 74-60)
FOUL! Holding foul on Lauri Dosunmu. [IN THE BONUS! 9 team fouls] Kyrie Rozier to the line for 2 free throws. (Lauri Dosunmu: 3 personal fouls)   FT 1/2: GOOD   FT 2/2: GOOD Kyrie Rozier makes 2/2 from the line.
Score: 76-60

[00:28] Team_080 possession (Score: 76-60)
Draymond Simons drives and kicks out. Jaren Morant attempts a Midrange. Contested by D'Angelo Ingram (4.4 feet, MAN). Jaren Morant misses. Rebound secured by Rudy Bridges.

[00:15] Team_091 possession (Score: 76-60)
FOUL! Holding foul on Khris Turner. [IN THE BONUS! 10 team fouls] Isaiah Siakam to the line for 2 free throws. (Khris Turner: 2 personal fouls)   FT 1/2: GOOD   FT 2/2: GOOD Isaiah Siakam makes 2/2 from the line.
Score: 78-60

================================================================================
                              3RD QUARTER COMPLETE                              
================================================================================

3RD QUARTER SCORE: Team_091 23, Team_080 23

BOX SCORE:
================================================================================

Team_091
--------------------------------------------------------------------------------
Player                MIN  PTS  REB  AST  TO      FG   FG%      3P   3P%
--------------------------------------------------------------------------------
Kyrie Rozier           34    9    5    1   0   3/4    75.0     0/0   0.0
Kevin Simons           34    6    3    0   0   3/4    75.0     0/0   0.0
Isaiah Siakam          34    4    0    0   0   2/5    40.0     0/0   0.0
Rudy Bridges           34    2    5    1   0   1/1   100.0     0/0   0.0
D'Angelo Ingram        34    2    0    0   0   1/4    25.0     0/0   0.0

TEAM: FG: 10/18 (55.6%), 3PT: 4/8 (50.0%), REB: 13 (5 off, 8 def), AST: 2, TO: 4
TEAM FOULS: 1


Team_080
--------------------------------------------------------------------------------
Player                MIN  PTS  REB  AST  TO      FG   FG%      3P   3P%
--------------------------------------------------------------------------------
Jaren Morant           34    8    1    0   0   4/6    66.7     0/0   0.0
Draymond Simons        34    7    3    2   0   3/7    42.9     0/0   0.0
Larry Paul             34    3    4    2   0   1/1   100.0     0/0   0.0
Khris Turner           34    3    0    0   0   1/3    33.3     0/0   0.0
Lauri Dosunmu          34    2    0    1   0   1/2    50.0     0/0   0.0

TEAM: FG: 10/19 (52.6%), 3PT: 2/6 (33.3%), REB: 8 (2 off, 6 def), AST: 5, TO: 2
TEAM FOULS: 10 [Team_091 in BONUS]

================================================================================

================================================================================
                       4TH QUARTER - Team_091 vs Team_080                       
================================================================================

[12:00] Team_091 possession (Score: 78-60)
Rudy Bridges attempts a 3Pt. Contested by Larry Paul (5.4 feet, MAN). Rudy Bridges misses. Rebound secured by Draymond Simons.

[11:45] Team_080 possession (Score: 78-60)
Larry Paul attempts a 3Pt. Wide open! Rudy Bridges is 7.2 feet away. [MAN] LARRY PAUL MAKES IT! Assist: Jaren Morant
Score: 78-63

[11:32] Team_091 possession (Score: 78-63)
Kevin Simons attempts a 3Pt. Contested by Draymond Simons (3.6 feet, MAN). KEVIN SIMONS MAKES IT! Assist: Rudy Bridges
Score: 81-63

[11:16] Team_080 possession (Score: 81-63)
Lauri Dosunmu drives, picks up Kyrie Rozier. Help arrives from Rudy Bridges! Lauri Dosunmu attempts a Dunk. Contested by Rudy Bridges (2.7 feet, MAN). LAURI DOSUNMU MAKES IT! Assist: Jaren Morant
Score: 81-65

[11:06] Team_091 possession (Score: 81-65)
D'Angelo Ingram drives, Draymond Simons stays with him. D'Angelo Ingram attempts a Layup. Wide open! Draymond Simons is 8.0 feet away. [ZONE] D'ANGELO INGRAM MAKES IT!
Score: 83-65

[10:52] Team_080 possession (Score: 83-65)
FOUL! Shooting foul on Kyrie Rozier. Lauri Dosunmu to the line for 2 free throws. [Team fouls: 1] (Kyrie Rozier: 1 personal fouls)   FT 1/2: MISS   FT 2/2: GOOD Lauri Dosunmu makes 1/2 from the line.
Score: 83-66

[10:39] Team_091 possession (Score: 83-66)
Isaiah Siakam attempts a 3Pt. Contested by Lauri Dosunmu (2.3 feet, ZONE). Isaiah Siakam misses. Rebound secured by Draymond Simons.

[10:20] Team_080 possession (Score: 83-66)
Jaren Morant attempts a 3Pt. Wide open! Kyrie Rozier is 6.2 feet away. [ZONE] Jaren Morant misses. Offensive rebound by Draymond Simons! Draymond Simons's putback is no good. Rebound secured by Kevin Simons.

[10:05] Team_091 possession (Score: 83-66)
Isaiah Siakam attempts a 3Pt. Contested by Lauri Dosunmu (2.8 feet, ZONE). Isaiah Siakam misses. Rebound secured by Draymond Simons.

[09:51] Team_080 possession (Score: 83-66)
Lauri Dosunmu makes the Layup and draws the foul on Kevin Simons! And-1! Lauri Dosunmu to the line for 1. [Team fouls: 2] (Kevin Simons: 1 personal fouls)   FT 1/1: GOOD Lauri Dosunmu makes 1/1 from the line.
Score: 83-69

[09:37] Team_091 possession (Score: 83-69)
Isaiah Siakam attempts a 3Pt. Contested by Khris Turner (4.1 feet, MAN). ISAIAH SIAKAM MAKES IT! Assist: Kevin Simons
Score: 86-69

[09:23] Team_080 possession (Score: 86-69)
Khris Turner attempts a 3Pt. Contested by Isaiah Siakam (3.3 feet, MAN). KHRIS TURNER MAKES IT! Assist: Jaren Morant
Score: 86-72

[09:08] Team_091 possession (Score: 86-72)
Isaiah Siakam attempts a 3Pt. Contested by Khris Turner (4.2 feet, MAN). Isaiah Siakam misses. Offensive rebound by Kevin Simons! Kevin Simons kicks it out.

[08:52] Team_091 possession (Score: 86-72)
D'Angelo Ingram drives to the basket... FOUL! Offensive foul on D'Angelo Ingram! Draymond Simons drew the charge! [Team fouls: 3] (D'Angelo Ingram: 1 personal fouls) TURNOVER! (dead ball)

[08:34] Team_080 possession (Score: 86-72)
Lauri Dosunmu drives and kicks out. Lauri Dosunmu attempts a 3Pt. Wide open! Kyrie Rozier is 6.1 feet away. [ZONE] LAURI DOSUNMU MAKES IT! Assist: Jaren Morant
Score: 86-75

[08:23] Team_091 possession (Score: 86-75)
Isaiah Siakam attempts a 3Pt. BLOCKED BY KHRIS TURNER! Ball is loose! Rebound secured by Draymond Simons.

[08:12] Team_080 possession (Score: 86-75)
Larry Paul drives and kicks out. Khris Turner attempts a 3Pt. Wide open! Isaiah Siakam is 9.1 feet away. [MAN] Khris Turner misses. Rebound secured by Kyrie Rozier.

[07:58] Team_091 possession (Score: 86-75)
Kevin Simons drives, Draymond Simons stays with him. Kevin Simons attempts a Layup. Contested by Draymond Simons (4.3 feet, ZONE). KEVIN SIMONS MAKES IT! Assist: Kyrie Rozier
Score: 88-75

[07:46] Team_080 possession (Score: 88-75)
Khris Turner attempts a 3Pt. Contested by Kyrie Rozier (5.3 feet, ZONE). Khris Turner misses. Rebound secured by Kyrie Rozier.

[07:31] Team_091 possession (Score: 88-75)
D'Angelo Ingram attempts a 3Pt. Wide open! Jaren Morant is 6.2 feet away. [MAN] D'ANGELO INGRAM MAKES IT! Assist: Isaiah Siakam
Score: 91-75

[07:20] Team_080 possession (Score: 91-75)
Draymond Simons drives to the basket... Draymond Simons loses the ball! Stripped by Kevin Simons! TURNOVER! (live ball)

[07:05] Team_091 possession (Score: 91-75)
Rudy Bridges attempts a Layup. Heavily contested by Larry Paul (1.5 feet, MAN)! RUDY BRIDGES MAKES IT! Assist: Kyrie Rozier
Score: 93-75

[06:47] Team_080 possession (Score: 93-75)
Khris Turner attempts a Midrange. Wide open! Isaiah Siakam is 7.6 feet away. [MAN] KHRIS TURNER MAKES IT!
Score: 93-77

[06:33] Team_091 possession (Score: 93-77)
Kyrie Rozier attempts a Layup. Contested by Draymond Simons (4.7 feet, ZONE). Kyrie Rozier misses. Rebound secured by Larry Paul.

[06:17] Team_080 possession (Score: 93-77)
Lauri Dosunmu makes the Layup and draws the foul on Kyrie Rozier! And-1! Lauri Dosunmu to the line for 1. [Team fouls: 4] (Kyrie Rozier: 2 personal fouls)   FT 1/1: GOOD Lauri Dosunmu makes 1/1 from the line.
Score: 93-80

[06:03] Team_091 possession (Score: 93-80)
Kevin Simons attempts a Midrange. Wide open! Draymond Simons is 7.9 feet away. [ZONE] Kevin Simons misses. Rebound secured by Draymond Simons.

[05:50] Team_080 possession (Score: 93-80)
Lauri Dosunmu attempts a Layup. Wide open! Kyrie Rozier is 6.9 feet away. [MAN] LAURI DOSUNMU MAKES IT!
Score: 93-82

[05:33] Team_091 possession (Score: 93-82)
Kyrie Rozier attempts a Layup. BLOCKED BY LAURI DOSUNMU! Ball deflects out of bounds off Kyrie Rozier.

[05:19] Team_080 possession (Score: 93-82)
Draymond Simons attempts a Layup. Contested by Kevin Simons (4.2 feet, MAN). DRAYMOND SIMONS MAKES IT! Assist: Khris Turner
Score: 93-84

[05:09] Team_091 possession (Score: 93-84)
FOUL! Holding foul on Larry Paul. [Team fouls: 1] No free throws, side out. (Larry Paul: 1 personal fouls)

[04:52] Team_091 possession (Score: 93-84)
D'Angelo Ingram attempts a 3Pt. Wide open! Jaren Morant is 8.5 feet away. [ZONE] D'ANGELO INGRAM MAKES IT! Assist: Rudy Bridges
Score: 96-84

[04:41] Team_080 possession (Score: 96-84)
Draymond Simons attempts a Layup. Wide open! Kevin Simons is 6.9 feet away. [MAN] DRAYMOND SIMONS MAKES IT!
Score: 96-86

[04:22] Team_091 possession (Score: 96-86)
Kevin Simons attempts a Midrange. Contested by Draymond Simons (3.0 feet, MAN). Kevin Simons misses. Rebound secured by Draymond Simons.

[04:11] Team_080 possession (Score: 96-86)
Jaren Morant drives and kicks out. Khris Turner attempts a 3Pt. Contested by Isaiah Siakam (5.3 feet, MAN). Khris Turner misses. Rebound secured by Kyrie Rozier.

[03:56] Team_091 possession (Score: 96-86)
Kevin Simons makes the Layup and draws the foul on Khris Turner! And-1! Kevin Simons to the line for 1. [Team fouls: 2] (Khris Turner: 1 personal fouls)   FT 1/1: GOOD Kevin Simons makes 1/1 from the line.
Score: 99-86

[03:40] Team_080 possession (Score: 99-86)
Khris Turner attempts a 3Pt. Wide open! Isaiah Siakam is 9.9 feet away. [MAN] KHRIS TURNER MAKES IT! Assist: Larry Paul
Score: 99-89

[03:23] Team_091 possession (Score: 99-89)
Kevin Simons drives, picks up Draymond Simons. Help arrives from Khris Turner! Kevin Simons attempts a Dunk. Wide open! Khris Turner is 6.5 feet away. [MAN] KEVIN SIMONS MAKES IT! Assist: Rudy Bridges
Score: 101-89

[03:09] Team_080 possession (Score: 101-89)
Khris Turner attempts a 3Pt. Contested by Kyrie Rozier (4.6 feet, ZONE). Khris Turner misses. Rebound secured by Kyrie Rozier.

[02:51] Team_091 possession (Score: 101-89)
Kevin Simons attempts a Midrange. Wide open! Draymond Simons is 7.3 feet away. [MAN] Kevin Simons misses. Rebound secured by Draymond Simons.

[02:38] Team_080 possession (Score: 101-89)
Draymond Simons drives and kicks out. Lauri Dosunmu attempts a Midrange. Wide open! Isaiah Siakam is 8.0 feet away. [ZONE] LAURI DOSUNMU MAKES IT! Assist: Jaren Morant
Score: 101-91

[02:23] Team_091 possession (Score: 101-91)
Kyrie Rozier attempts a 3Pt. Contested by Lauri Dosunmu (5.8 feet, MAN). Kyrie Rozier misses. Rebound secured by Jaren Morant.

[02:09] Team_080 possession (Score: 101-91)
Jaren Morant loses control! Ball rolls out of bounds! TURNOVER! (dead ball)

[02:09] Substitution (Team_091): Kyrie Rozier OUT → Karl Morant IN (stamina_rule2)

[02:09] Substitution (Team_091): Isaiah Siakam OUT → Julius Barnes IN (stamina_rule2)

[02:09] Substitution (Team_091): Rudy Bridges OUT → Tim Antetokounmpo IN (stamina_rule2)

[02:09] Substitution (Team_091): D'Angelo Ingram OUT → Zion Mitchell IN (stamina_rule2)

[02:09] Substitution (Team_091): Kevin Simons OUT → Ja George IN (stamina_rule2)

[02:09] Substitution (Team_080): Lauri Dosunmu OUT → Tony James IN (stamina_rule2)

[02:09] Substitution (Team_080): Khris Turner OUT → Larry Reaves IN (stamina_rule2)

[02:09] Substitution (Team_080): Larry Paul OUT → Joel Bryant IN (stamina_rule2)

[02:09] Substitution (Team_080): Jaren Morant OUT → Ja Cunningham IN (stamina_rule2)

[02:09] Substitution (Team_080): Draymond Simons OUT → Trae Brogdon IN (stamina_rule2)

[01:56] Team_091 possession (Score: 101-91)
Tim Antetokounmpo drives to the basket... FOUL! Offensive foul on Tim Antetokounmpo! Ja Cunningham drew the charge! [Team fouls: 5] (Tim Antetokounmpo: 1 personal fouls) TURNOVER! (dead ball)

[01:43] Team_080 possession (Score: 101-91)
Larry Reaves attempts a 3Pt. Contested by Julius Barnes (3.7 feet, MAN). Larry Reaves misses. Rebound secured by Ja George.

[01:27] Team_091 possession (Score: 101-91)
Tim Antetokounmpo makes the Midrange and draws the foul on Ja Cunningham! And-1! Tim Antetokounmpo to the line for 1. [Team fouls: 3] (Ja Cunningham: 1 personal fouls)   FT 1/1: GOOD Tim Antetokounmpo makes 1/1 from the line.
Score: 104-91

[01:14] Team_080 possession (Score: 104-91)
Trae Brogdon attempts a Layup. BLOCKED BY ZION MITCHELL! Ball is loose! Rebound secured by Zion Mitchell.

[00:56] Team_091 possession (Score: 104-91)
FOUL! Shooting foul on Larry Reaves. Tim Antetokounmpo to the line for 2 free throws. [Team fouls: 4] (Larry Reaves: 1 personal fouls)   FT 1/2: GOOD   FT 2/2: GOOD Tim Antetokounmpo makes 2/2 from the line.
Score: 106-91

[00:38] Team_080 possession (Score: 106-91)
Larry Reaves commits a violation (traveling/carry)! TURNOVER! (dead ball)

[00:24] Team_091 possession (Score: 106-91)
Karl Morant drives and kicks out. Julius Barnes attempts a 3Pt. Contested by Larry Reaves (2.3 feet, MAN). JULIUS BARNES MAKES IT! Assist: Karl Morant
Score: 109-91

[00:14] Team_080 possession (Score: 109-91)
Trae Brogdon attempts a Layup. Wide open! Ja George is 6.9 feet away. [MAN] TRAE BROGDON MAKES IT! Assist: Ja Cunningham
Score: 109-93

================================================================================
                              4TH QUARTER COMPLETE                              
================================================================================

4TH QUARTER SCORE: Team_091 31, Team_080 33

BOX SCORE:
================================================================================

Team_091
--------------------------------------------------------------------------------
Player                MIN  PTS  REB  AST  TO      FG   FG%      3P   3P%
--------------------------------------------------------------------------------
Kevin Simons           44   10    2    1   0   4/7    57.1     0/0   0.0
D'Angelo Ingram        44    8    0    0   0   3/3   100.0     0/0   0.0
Tim Antetokounmpo       4    5    0    0   0   2/2   100.0     0/0   0.0
Isaiah Siakam          44    3    0    1   0   1/4    25.0     0/0   0.0
Julius Barnes           4    3    0    0   0   1/1   100.0     0/0   0.0
Rudy Bridges           44    2    0    3   0   1/2    50.0     0/0   0.0
Kyrie Rozier           44    0    4    2   0   0/3     0.0     0/0   0.0
Ja George               4    0    1    0   0   0/0     0.0     0/0   0.0
Zion Mitchell           4    0    1    0   0   0/0     0.0     0/0   0.0
Karl Morant             4    0    0    1   0   0/0     0.0     0/0   0.0

TEAM: FG: 12/22 (54.5%), 3PT: 4/9 (44.4%), REB: 7 (1 off, 6 def), AST: 8, TO: 2
TEAM FOULS: 5 [Team_080 in BONUS]


Team_080
--------------------------------------------------------------------------------
Player                MIN  PTS  REB  AST  TO      FG   FG%      3P   3P%
--------------------------------------------------------------------------------
Lauri Dosunmu          44   16    0    0   0   7/7   100.0     0/0   0.0
Khris Turner           44    8    0    1   0   3/5    60.0     0/0   0.0
Draymond Simons        44    4    7    0   0   2/2   100.0     0/0   0.0
Larry Paul             44    3    1    1   0   1/2    50.0     0/0   0.0
Trae Brogdon            4    2    0    0   0   1/2    50.0     0/0   0.0
Jaren Morant           44    0    1    5   0   0/2     0.0     0/0   0.0
Larry Reaves            4    0    0    0   0   0/1     0.0     0/0   0.0
Ja Cunningham           4    0    0    1   0   0/0     0.0     0/0   0.0

TEAM: FG: 14/21 (66.7%), 3PT: 3/7 (42.9%), REB: 10 (1 off, 9 def), AST: 8, TO: 3
TEAM FOULS: 4

================================================================================

================================================================================
                               FULL GAME COMPLETE                               
================================================================================

FINAL SCORE: Team_091 109, Team_080 93

SCORING BY QUARTER:
--------------------------------------------------------------------------------
Team                     Q1     Q2     Q3     Q4    FINAL
--------------------------------------------------------------------------------
Team_091                 23     32     23     31      109
Team_080                 18     19     23     33       93
--------------------------------------------------------------------------------

FULL GAME BOX SCORE:
================================================================================

Team_091
--------------------------------------------------------------------------------
Player                MIN  PTS  REB  AST  TO      FG   FG%      3P   3P%      FT STL BLK
--------------------------------------------------------------------------------
Kyrie Rozier           44   19   15    6   2   7/15   46.7   5/9    55.6   3/3     1   0
Isaiah Siakam          44   16    0    4   3   5/12   41.7   4/11   36.4   4/4     0   0
Rudy Bridges           44   16   14    6   3   8/10   80.0   4/5    80.0   2/2     1   0
D'Angelo Ingram        44   21    0    3   2   7/13   53.8   3/7    42.9   4/4     0   1
Kevin Simons           44   23   14    4   3   8/15   53.3   1/3    33.3   4/5     2   0
Karl Morant             4    3    0    2   0   2/2   100.0   1/1   100.0   0/0     0   0
Julius Barnes           4    6    0    0   1   1/1   100.0   1/1   100.0   0/0     0   0
Tim Antetokounmpo       4    5    0    0   0   2/2   100.0   0/0     0.0   3/3     0   0
Zion Mitchell           4    0    4    1   1   0/0     0.0   0/0     0.0   0/0     0   1
Ja George               4    0    2    0   0   0/1     0.0   0/0     0.0   0/0     0   1

TEAM: FG: 45/76 (59.2%), 3PT: 19/37 (51.4%), REB: 49 (12 off, 37 def), AST: 26, TO: 15


Team_080
--------------------------------------------------------------------------------
Player                MIN  PTS  REB  AST  TO      FG   FG%      3P   3P%      FT STL BLK
--------------------------------------------------------------------------------
Lauri Dosunmu          44   32    0    3   3  12/18   66.7   3/8    37.5   4/5     2   1
Khris Turner           44   18    0    2   2   7/17   41.2   4/11   36.4   0/0     1   2
Larry Paul             44   10    8    6   2   4/8    50.0   2/4    50.0   0/0     2   0
Jaren Morant           44   12    6    7   1   6/13   46.2   0/1     0.0   0/0     2   0
Draymond Simons        44   18   17    2   0   9/16   56.2   1/2    50.0   2/3     3   0
Tony James              4    0    0    0   0   0/0     0.0   0/0     0.0   0/0     0   0
Larry Reaves            4    0    0    0   1   0/2     0.0   0/2     0.0   0/0     0   0
Joel Bryant             4    0    0    0   0   0/2     0.0   0/0     0.0   0/0     0   0
Ja Cunningham           4    0    1    1   0   0/1     0.0   0/0     0.0   0/0     0   0
Trae Brogdon            4    2    0    0   0   1/3    33.3   0/0     0.0   0/0     0   0

TEAM: FG: 39/80 (48.8%), 3PT: 10/28 (35.7%), REB: 32 (6 off, 26 def), AST: 21, TO: 9

================================================================================
