================================================================================
                        FULL GAME - Team_014 vs Team_050                        
================================================================================

================================================================================
                       1ST QUARTER - Team_014 vs Team_050                       
================================================================================

[12:00] Team_014 possession (Score: 0-0)
Jordan Anunoby attempts a Midrange. Wide open! Joel Banchero is 6.2 feet away. [MAN] JORDAN ANUNOBY MAKES IT! Assist: DeMar Adebayo
Score: 2-0

[11:49] Team_050 possession (Score: 2-0)
Collin Bane drives and kicks out. LeBron Bridges attempts a 3Pt. Contested by Jordan Anunoby (4.3 feet, ZONE). LeBron Bridges misses. Rebound secured by Michael Cunningham.

[11:37] Team_014 possession (Score: 2-0)
Lamelo Simmons attempts a 3Pt. Contested by LeBron Bridges (2.8 feet, ZONE). Lamelo Simmons misses. Rebound secured by Joel Banchero.

[11:19] Team_050 possession (Score: 2-0)
Collin Bane drives, Lamelo Simmons stays with him. Collin Bane attempts a Dunk. Heavily contested by Lamelo Simmons (1.8 feet, MAN)! COLLIN BANE MAKES IT! Assist: Giannis LaVine
Score: 2-2

[11:07] Team_014 possession (Score: 2-2)
DeMar Adebayo drives and kicks out. DeMar Adebayo attempts a 3Pt. Contested by LeBron Bridges (2.6 feet, MAN). DEMAR ADEBAYO MAKES IT! Assist: Ayo Murray
Score: 5-2

[10:58] Team_050 possession (Score: 5-2)
Joel Banchero attempts a 3Pt. Wide open! Jordan Anunoby is 6.1 feet away. [ZONE] Joel Banchero misses. Rebound secured by Michael Cunningham.

[10:45] Team_014 possession (Score: 5-2)
Michael Cunningham attempts a 3Pt. Contested by Giannis LaVine (4.7 feet, ZONE). MICHAEL CUNNINGHAM MAKES IT! Assist: Jordan Anunoby
Score: 8-2

[10:34] Team_050 possession (Score: 8-2)
Collin Bane makes the Layup and draws the foul on Lamelo Simmons! And-1! Collin Bane to the line for 1. [Team fouls: 1] (Lamelo Simmons: 1 personal fouls)   FT 1/1: GOOD Collin Bane makes 1/1 from the line.
Score: 8-5

[10:22] Team_014 possession (Score: 8-5)
Lamelo Simmons attempts a 3Pt. Contested by Collin Bane (4.2 feet, MAN). Lamelo Simmons misses. Rebound secured by Collin Bane.

[10:03] Team_050 possession (Score: 8-5)
LeBron Bridges drives, DeMar Adebayo stays with him. LeBron Bridges attempts a Layup. Contested by DeMar Adebayo (5.8 feet, ZONE). LEBRON BRIDGES MAKES IT! Assist: Collin Bane
Score: 8-7

[09:46] Team_014 possession (Score: 8-7)
Lamelo Simmons attempts a Midrange. Contested by Collin Bane (5.0 feet, ZONE). Lamelo Simmons misses. Rebound secured by Joel Banchero.

[09:31] Team_050 possession (Score: 8-7)
FOUL! Shooting foul on DeMar Adebayo. LeBron Bridges to the line for 2 free throws. [Team fouls: 2] (DeMar Adebayo: 1 personal fouls)   FT 1/2: GOOD   FT 2/2: GOOD LeBron Bridges makes 2/2 from the line.
Score: 8-9

[09:17] Team_014 possession (Score: 8-9)
DeMar Adebayo drives and kicks out. Lamelo Simmons attempts a 3Pt. Heavily contested by Giannis LaVine (1.9 feet, ZONE)! Lamelo Simmons misses. Rebound secured by Collin Bane.

[09:05] Team_050 possession (Score: 8-9)
Giannis LaVine attempts a 3Pt. Contested by Michael Cunningham (3.3 feet, MAN). Giannis LaVine misses. Rebound secured by DeMar Adebayo.

[08:50] Team_014 possession (Score: 8-9)
Michael Cunningham drives, picks up Giannis LaVine. Help arrives from Collin Bane! Michael Cunningham attempts a Layup. Heavily contested by Collin Bane (1.5 feet, MAN)! Michael Cunningham misses. Rebound secured by LeBron Bridges.

[08:36] Team_050 possession (Score: 8-9)
Collin Bane loses control! Ball rolls out of bounds! TURNOVER! (dead ball)

[08:22] Team_014 possession (Score: 8-9)
Lamelo Simmons attempts a Midrange. Wide open! Collin Bane is 6.5 feet away. [MAN] Lamelo Simmons misses. Rebound secured by LeBron Bridges.

[08:08] Team_050 possession (Score: 8-9)
Giannis LaVine attempts a Layup. BLOCKED BY MICHAEL CUNNINGHAM! Ball is loose! Rebound secured by DeMar Adebayo.

[07:57] Team_014 possession (Score: 8-9)
Lamelo Simmons attempts a 3Pt. Heavily contested by Collin Bane (1.5 feet, MAN)! LAMELO SIMMONS MAKES IT! Assist: DeMar Adebayo
Score: 11-9

[07:40] Team_050 possession (Score: 11-9)
Giannis LaVine loses control! Ball rolls out of bounds! TURNOVER! (dead ball)

[07:25] Team_014 possession (Score: 11-9)
Lamelo Simmons makes the Midrange and draws the foul on Collin Bane! And-1! Lamelo Simmons to the line for 1. [Team fouls: 1] (Collin Bane: 1 personal fouls)   FT 1/1: MISS Lamelo Simmons makes 0/1 from the line. Rebound secured by Collin Bane.
Score: 13-9

[07:08] Team_050 possession (Score: 13-9)
LeBron Bridges drives to the basket... LeBron Bridges loses the ball! Stripped by DeMar Adebayo! TURNOVER! (live ball)

[06:54] Team_014 possession (Score: 13-9)
Ayo Murray attempts a Midrange. Contested by Joel Banchero (5.0 feet, ZONE). Ayo Murray misses. Rebound secured by LeBron Bridges.

[06:40] Team_050 possession (Score: 13-9)
Joel Banchero attempts a Midrange. Contested by Jordan Anunoby (4.4 feet, MAN). JOEL BANCHERO MAKES IT!
Score: 13-11

[06:25] Team_014 possession (Score: 13-11)
Lamelo Simmons drives, Collin Bane stays with him. Lamelo Simmons attempts a Dunk. Heavily contested by Collin Bane (1.9 feet, MAN)! Lamelo Simmons misses. Offensive rebound by DeMar Adebayo! DeMar Adebayo kicks it out.

[06:08] Team_014 possession (Score: 13-11)
Lamelo Simmons attempts a 3Pt. Contested by Collin Bane (3.8 feet, MAN). Lamelo Simmons misses. Rebound secured by Joel Banchero.

[05:53] Team_050 possession (Score: 13-11)
Joel Banchero attempts a Midrange. Contested by DeMar Adebayo (5.7 feet, ZONE). Joel Banchero misses. Rebound secured by Michael Cunningham.

[05:39] Team_014 possession (Score: 13-11)
DeMar Adebayo drives to the basket... DeMar Adebayo loses the ball! Stripped by LeBron Bridges! TURNOVER! (live ball)

[05:23] Team_050 possession (Score: 13-11)
FOUL! Holding foul on Michael Cunningham. [Team fouls: 3] No free throws, side out. (Michael Cunningham: 1 personal fouls)

[05:09] Team_050 possession (Score: 13-11)
Giannis LaVine attempts a 3Pt. Contested by Jordan Anunoby (5.5 feet, ZONE). Giannis LaVine misses. Rebound secured by Ayo Murray.

[04:50] Team_014 possession (Score: 13-11)
Jordan Anunoby attempts a 3Pt. Contested by Giannis LaVine (3.6 feet, ZONE). Jordan Anunoby misses. Rebound secured by LeBron Bridges.

[04:40] Team_050 possession (Score: 13-11)
Giannis LaVine attempts a 3Pt. Contested by Michael Cunningham (5.0 feet, MAN). Giannis LaVine misses. Offensive rebound by Collin Bane! Collin Bane kicks it out.

[04:24] Team_050 possession (Score: 13-11)
LeBron Bridges drives and kicks out. Collin Bane attempts a 3Pt. Wide open! Jordan Anunoby is 8.5 feet away. [ZONE] Collin Bane misses. FOUL! Loose ball foul on DeMar Adebayo during the rebound battle. [Team fouls: 4] No free throws, side out. (DeMar Adebayo: 2 personal fouls)

[04:06] Team_050 possession (Score: 13-11)
LeBron Bridges attempts a Layup. Contested by Ayo Murray (4.8 feet, ZONE). LeBron Bridges misses. Rebound secured by Ayo Murray.

[03:48] Team_014 possession (Score: 13-11)
DeMar Adebayo attempts a 3Pt. Contested by LeBron Bridges (4.6 feet, ZONE). DeMar Adebayo misses. Rebound secured by Joel Banchero.

[03:30] Team_050 possession (Score: 13-11)
Giannis LaVine attempts a 3Pt. Wide open! Jordan Anunoby is 6.8 feet away. [ZONE] Giannis LaVine misses. Rebound secured by DeMar Adebayo.

[03:16] Team_014 possession (Score: 13-11)
Ayo Murray attempts a 3Pt. Heavily contested by Giannis LaVine (0.5 feet, ZONE)! Ayo Murray misses. Rebound secured by Collin Bane.

[03:04] Team_050 possession (Score: 13-11)
Giannis LaVine drives and kicks out. LeBron Bridges attempts a Midrange. Contested by DeMar Adebayo (3.9 feet, MAN). LeBron Bridges misses. Rebound secured by Ayo Murray.

[02:51] Team_014 possession (Score: 13-11)
Lamelo Simmons attempts a Midrange. Heavily contested by Collin Bane (0.5 feet, MAN)! Lamelo Simmons misses. Rebound secured by Joel Banchero.

[02:37] Team_050 possession (Score: 13-11)
Joel Banchero attempts a Layup. Wide open! Jordan Anunoby is 7.6 feet away. [MAN] Joel Banchero misses. Rebound secured by Michael Cunningham.

[02:26] Team_014 possession (Score: 13-11)
FOUL! Shooting foul on Donovan Trent. Ayo Murray to the line for 2 free throws. [Team fouls: 2] (Donovan Trent: 1 personal fouls)   FT 1/2: GOOD   FT 2/2: MISS Ayo Murray makes 1/2 from the line. Rebound secured by Joel Banchero.
Score: 14-11

[02:11] Team_050 possession (Score: 14-11)
FOUL! Holding foul on Jordan Anunoby. [IN THE BONUS! 5 team fouls] Joel Banchero to the line for 2 free throws. (Jordan Anunoby: 1 personal fouls)   FT 1/2: GOOD   FT 2/2: GOOD Joel Banchero makes 2/2 from the line.
Score: 14-13

[01:53] Team_014 possession (Score: 14-13)
Ayo Murray attempts a 3Pt. Wide open! Donovan Trent is 7.9 feet away. [MAN] Ayo Murray misses. FOUL! Loose ball foul on Collin Bane during the rebound battle. [Team fouls: 3] No free throws, side out. (Collin Bane: 2 personal fouls)

[01:37] Team_014 possession (Score: 14-13)
DeMar Adebayo attempts a Midrange. Heavily contested by LeBron Bridges (2.0 feet, MAN)! DeMar Adebayo misses. Rebound secured by Collin Bane.

[01:21] Team_050 possession (Score: 14-13)
FOUL! Shooting foul on Michael Cunningham. Giannis LaVine to the line for 3 free throws. [BONUS: 6 team fouls] (Michael Cunningham: 2 personal fouls)   FT 1/3: GOOD   FT 2/3: GOOD   FT 3/3: GOOD Giannis LaVine makes 3/3 from the line.
Score: 14-16

[01:08] Team_014 possession (Score: 14-16)
Michael Cunningham drives, Donovan Trent stays with him. Michael Cunningham attempts a Dunk. Contested by Donovan Trent (5.9 feet, ZONE). Michael Cunningham misses. Rebound secured by Collin Bane.

[00:55] Team_050 possession (Score: 14-16)
Collin Bane attempts a 3Pt. Contested by Jordan Anunoby (5.6 feet, ZONE). Collin Bane misses. Rebound secured by Ayo Murray.

[00:42] Team_014 possession (Score: 14-16)
Lamelo Simmons attempts a 3Pt. Contested by Giannis LaVine (5.5 feet, ZONE). Lamelo Simmons misses. FOUL! Loose ball foul on Joel Banchero during the rebound battle. [Team fouls: 4] No free throws, side out. (Joel Banchero: 1 personal fouls)

[00:30] Team_014 possession (Score: 14-16)
Michael Cunningham attempts a 3Pt. Contested by Giannis LaVine (3.2 feet, MAN). Michael Cunningham misses. Rebound secured by LeBron Bridges.

[00:13] Team_050 possession (Score: 14-16)
FOUL! Reach-in foul on DeMar Adebayo during the drive. [IN THE BONUS! 7 team fouls] Donovan Trent to the line for 2 free throws. (DeMar Adebayo: 3 personal fouls)   FT 1/2: MISS   FT 2/2: GOOD Donovan Trent makes 1/2 from the line.
Score: 14-17

[00:03] Team_014 possession (Score: 14-17)
Michael Cunningham attempts a Midrange. Contested by Giannis LaVine (3.6 feet, MAN). Michael Cunningham misses. Offensive rebound by DeMar Adebayo! DeMar Adebayo kicks it out.

================================================================================
                              1ST QUARTER COMPLETE                              
================================================================================

1ST QUARTER SCORE: Team_014 14, Team_050 17

BOX SCORE:
================================================================================

Team_014
--------------------------------------------------------------------------------
Player                MIN  PTS  REB  AST  TO      FG   FG%      3P   3P%
--------------------------------------------------------------------------------
DeMar Adebayo          12    3    6    2   0   1/4    25.0     0/0   0.0
Michael Cunningham     12    3    4    0   0   1/4    25.0     0/0   0.0
Lamelo Simmons         12    3    0    0   0   1/8    12.5     0/0   0.0
Jordan Anunoby         12    2    0    1   0   1/2    50.0     0/0   0.0
Ayo Murray             12    0    5    1   0   0/3     0.0     0/0   0.0

TEAM: FG: 4/21 (19.0%), 3PT: 2/9 (22.2%), REB: 15 (4 off, 11 def), AST: 4, TO: 1
TEAM FOULS: 7 [Team_050 in BONUS]


Team_050
--------------------------------------------------------------------------------
Player                MIN  PTS  REB  AST  TO      FG   FG%      3P   3P%
--------------------------------------------------------------------------------
Collin Bane            12    5    7    1   0   2/4    50.0     0/0   0.0
Joel Banchero          12    4    6    0   0   2/5    40.0     0/0   0.0
LeBron Bridges         12    4    6    0   0   2/3    66.7     0/0   0.0
Giannis LaVine         12    3    0    1   0   1/6    16.7     0/0   0.0
Donovan Trent          12    1    0    0   0   1/1   100.0     0/0   0.0

TEAM: FG: 8/19 (42.1%), 3PT: 1/6 (16.7%), REB: 19 (2 off, 17 def), AST: 2, TO: 3
TEAM FOULS: 4

================================================================================

================================================================================
                       2ND QUARTER - Team_014 vs Team_050                       
================================================================================

[12:00] Team_014 possession (Score: 14-17)
Jordan Anunoby attempts a 3Pt. Contested by Giannis LaVine (5.3 feet, ZONE). JORDAN ANUNOBY MAKES IT! Assist: DeMar Adebayo
Score: 17-17

[11:47] Team_050 possession (Score: 17-17)
Collin Bane attempts a 3Pt. Wide open! Michael Cunningham is 7.4 feet away. [ZONE] COLLIN BANE MAKES IT!
Score: 17-20

[11:33] Team_014 possession (Score: 17-20)
DeMar Adebayo attempts a Layup. Heavily contested by LeBron Bridges (1.9 feet, MAN)! DEMAR ADEBAYO MAKES IT! Assist: Lamelo Simmons
Score: 19-20

[11:16] Team_050 possession (Score: 19-20)
Donovan Trent attempts a Midrange. Wide open! Ayo Murray is 6.1 feet away. [MAN] Donovan Trent misses. Rebound secured by Michael Cunningham.

[11:02] Team_014 possession (Score: 19-20)
Lamelo Simmons drives, Collin Bane stays with him. Lamelo Simmons attempts a Dunk. Contested by Collin Bane (5.6 feet, MAN). LAMELO SIMMONS MAKES IT! Assist: Michael Cunningham
Score: 21-20

[10:49] Team_050 possession (Score: 21-20)
Collin Bane drives to the basket... Collin Bane loses the ball! Stripped by DeMar Adebayo! TURNOVER! (live ball)

[10:36] Team_014 possession (Score: 21-20)
DeMar Adebayo attempts a 3Pt. Wide open! Giannis LaVine is 9.1 feet away. [ZONE] DEMAR ADEBAYO MAKES IT! Assist: Lamelo Simmons
Score: 24-20

[10:26] Team_050 possession (Score: 24-20)
LeBron Bridges attempts a 3Pt. Contested by Jordan Anunoby (5.4 feet, ZONE). LEBRON BRIDGES MAKES IT! Assist: Joel Banchero
Score: 24-23

[10:11] Team_014 possession (Score: 24-23)
Lamelo Simmons attempts a 3Pt. Wide open! Collin Bane is 8.0 feet away. [MAN] Lamelo Simmons misses. Rebound secured by LeBron Bridges.

[09:59] Team_050 possession (Score: 24-23)
Joel Banchero makes the 3Pt and draws the foul on Jordan Anunoby! And-1! Joel Banchero to the line for 1. [Team fouls: 1] (Jordan Anunoby: 1 personal fouls)   FT 1/1: GOOD Joel Banchero makes 1/1 from the line.
Score: 24-27

[09:40] Team_014 possession (Score: 24-27)
Michael Cunningham attempts a 3Pt. Wide open! Giannis LaVine is 6.5 feet away. [MAN] Michael Cunningham misses. Rebound secured by Joel Banchero.

[09:25] Team_050 possession (Score: 24-27)
LeBron Bridges drives to the basket... LeBron Bridges loses the ball! Stripped by DeMar Adebayo! TURNOVER! (live ball)

[09:06] Team_014 possession (Score: 24-27)
Ayo Murray attempts a Midrange. Contested by Joel Banchero (3.6 feet, ZONE). Ayo Murray misses. Rebound secured by Collin Bane.

[08:53] Team_050 possession (Score: 24-27)
LeBron Bridges attempts a 3Pt. Contested by DeMar Adebayo (3.2 feet, MAN). LeBron Bridges misses. Rebound secured by Ayo Murray.

[08:38] Team_014 possession (Score: 24-27)
Ayo Murray attempts a Layup. Contested by Donovan Trent (4.3 feet, MAN). AYO MURRAY MAKES IT! Assist: Michael Cunningham
Score: 26-27

[08:18] Team_050 possession (Score: 26-27)
FOUL! Reach-in foul on Ayo Murray during the drive. [Team fouls: 2] No free throws, side out. (Ayo Murray: 1 personal fouls)

[08:03] Team_050 possession (Score: 26-27)
Donovan Trent attempts a Midrange. Contested by Lamelo Simmons (3.6 feet, ZONE). Donovan Trent misses. Rebound secured by Ayo Murray.

[07:46] Team_014 possession (Score: 26-27)
Lamelo Simmons attempts a 3Pt. Wide open! Giannis LaVine is 7.6 feet away. [ZONE] Lamelo Simmons misses. Rebound secured by Collin Bane.

[07:32] Team_050 possession (Score: 26-27)
FOUL! Shooting foul on Jordan Anunoby. Giannis LaVine to the line for 2 free throws. [Team fouls: 3] (Jordan Anunoby: 2 personal fouls)   FT 1/2: GOOD   FT 2/2: GOOD Giannis LaVine makes 2/2 from the line.
Score: 26-29

[07:20] Team_014 possession (Score: 26-29)
Ayo Murray attempts a 3Pt. Wide open! Collin Bane is 6.7 feet away. [ZONE] Ayo Murray misses. Rebound secured by LeBron Bridges.

[07:02] Team_050 possession (Score: 26-29)
Giannis LaVine attempts a 3Pt. Wide open! Jordan Anunoby is 6.5 feet away. [ZONE] Giannis LaVine misses. Rebound secured by DeMar Adebayo.

[06:48] Team_014 possession (Score: 26-29)
Ayo Murray drives, Donovan Trent stays with him. Ayo Murray attempts a Layup. Contested by Donovan Trent (4.6 feet, MAN). Ayo Murray misses. Rebound secured by Collin Bane.

[06:39] Team_050 possession (Score: 26-29)
LeBron Bridges attempts a Midrange. Contested by DeMar Adebayo (5.7 feet, MAN). LEBRON BRIDGES MAKES IT! Assist: Giannis LaVine
Score: 26-31

[06:26] Team_014 possession (Score: 26-31)
Ayo Murray attempts a Layup. Contested by Donovan Trent (5.5 feet, MAN). Ayo Murray misses. Rebound secured by Collin Bane.

[06:13] Team_050 possession (Score: 26-31)
FOUL! Holding foul on Ayo Murray. [Team fouls: 4] No free throws, side out. (Ayo Murray: 2 personal fouls)

[05:57] Team_050 possession (Score: 26-31)
Joel Banchero attempts a Layup. Wide open! Ayo Murray is 7.9 feet away. [ZONE] JOEL BANCHERO MAKES IT!
Score: 26-33

[05:41] Team_014 possession (Score: 26-33)
FOUL! Offensive foul on DeMar Adebayo! LeBron Bridges drew the charge! [Team fouls: 5] (DeMar Adebayo: 1 personal fouls) TURNOVER! (dead ball)

[05:27] Team_050 possession (Score: 26-33)
Giannis LaVine attempts a 3Pt. Wide open! Michael Cunningham is 8.3 feet away. [MAN] Giannis LaVine misses. Rebound secured by Ayo Murray.

[05:17] Team_014 possession (Score: 26-33)
Ayo Murray attempts a Layup. BLOCKED BY DONOVAN TRENT! Ball deflects out of bounds off Ayo Murray.

[05:04] Team_050 possession (Score: 26-33)
FOUL! Reach-in foul on DeMar Adebayo during the drive. [IN THE BONUS! 6 team fouls] Collin Bane to the line for 2 free throws. (DeMar Adebayo: 2 personal fouls)   FT 1/2: GOOD   FT 2/2: GOOD Collin Bane makes 2/2 from the line.
Score: 26-35

[04:49] Team_014 possession (Score: 26-35)
Ayo Murray makes the Midrange and draws the foul on LeBron Bridges! And-1! Ayo Murray to the line for 1. [Team fouls: 1] (LeBron Bridges: 1 personal fouls)   FT 1/1: MISS Ayo Murray makes 0/1 from the line. Rebound secured by Collin Bane.
Score: 28-35

[04:33] Team_050 possession (Score: 28-35)
Joel Banchero attempts a 3Pt. Contested by Jordan Anunoby (4.7 feet, ZONE). Joel Banchero misses. Rebound secured by Michael Cunningham.

[04:18] Team_014 possession (Score: 28-35)
Ayo Murray throws a bad pass out of bounds! TURNOVER! (dead ball)

[04:18] Substitution (Team_014): Michael Cunningham OUT → Jalen Booker IN (stamina_rule2)

[04:18] Substitution (Team_014): Jordan Anunoby OUT → Bones Quickley IN (stamina_rule2)

[04:18] Substitution (Team_014): Lamelo Simmons OUT → Tracy Westbrook IN (stamina_rule2)

[04:18] Substitution (Team_014): DeMar Adebayo OUT → Nikola James IN (stamina_rule2)

[04:18] Substitution (Team_014): Ayo Murray OUT → Collin Gasol IN (stamina_rule2)

[04:18] Substitution (Team_050): Giannis LaVine OUT → Damian O'Neal IN (stamina_rule2)

[04:18] Substitution (Team_050): Joel Banchero OUT → Dwyane Towns IN (stamina_rule2)

[04:18] Substitution (Team_050): Collin Bane OUT → Larry Curry IN (stamina_rule2)

[04:18] Substitution (Team_050): LeBron Bridges OUT → Luka Gasol IN (stamina_rule2)

[04:18] Substitution (Team_050): Donovan Trent OUT → Tyler Smith IN (stamina_rule2)

[04:02] Team_050 possession (Score: 28-35)
FOUL! Offensive foul on Damian O'Neal! Jalen Booker drew the charge! [Team fouls: 2] (Damian O'Neal: 1 personal fouls) TURNOVER! (dead ball)

[03:45] Team_014 possession (Score: 28-35)
Bones Quickley attempts a 3Pt. Wide open! Luka Gasol is 6.9 feet away. [ZONE] BONES QUICKLEY MAKES IT! Assist: Jalen Booker
Score: 31-35

[03:28] Team_050 possession (Score: 31-35)
Luka Gasol attempts a Layup. Contested by Collin Gasol (3.9 feet, ZONE). Luka Gasol misses. Rebound secured by Tracy Westbrook.

[03:14] Team_014 possession (Score: 31-35)
Collin Gasol attempts a 3Pt. Contested by Luka Gasol (4.7 feet, ZONE). COLLIN GASOL MAKES IT! Assist: Bones Quickley
Score: 34-35

[03:01] Team_050 possession (Score: 34-35)
FOUL! Shooting foul on Tracy Westbrook. Larry Curry to the line for 2 free throws. [BONUS: 7 team fouls] (Tracy Westbrook: 1 personal fouls)   FT 1/2: GOOD   FT 2/2: GOOD Larry Curry makes 2/2 from the line.
Score: 34-37

[02:50] Team_014 possession (Score: 34-37)
Tracy Westbrook attempts a 3Pt. Wide open! Luka Gasol is 10.0 feet away. [ZONE] TRACY WESTBROOK MAKES IT! Assist: Bones Quickley
Score: 37-37

[02:36] Team_050 possession (Score: 37-37)
Dwyane Towns attempts a 3Pt. Contested by Bones Quickley (3.8 feet, MAN). Dwyane Towns misses. Rebound secured by Nikola James.

[02:22] Team_014 possession (Score: 37-37)
Collin Gasol attempts a Layup. Wide open! Luka Gasol is 8.2 feet away. [ZONE] COLLIN GASOL MAKES IT!
Score: 39-37

[02:07] Team_050 possession (Score: 39-37)
Luka Gasol drives, picks up Nikola James. Help arrives from Jalen Booker! Luka Gasol attempts a Dunk. Contested by Jalen Booker (2.1 feet, MAN). Luka Gasol misses. Offensive rebound by Larry Curry! Larry Curry kicks it out.

[01:52] Team_050 possession (Score: 39-37)
Larry Curry attempts a 3Pt. Heavily contested by Jalen Booker (0.7 feet, ZONE)! Larry Curry misses. Rebound secured by Nikola James.

[01:35] Team_014 possession (Score: 39-37)
Jalen Booker throws a bad pass! Stolen by Damian O'Neal! TURNOVER! (live ball)

[01:21] Team_050 possession (Score: 39-37)
FOUL! Shooting foul on Jalen Booker. Dwyane Towns to the line for 2 free throws. [BONUS: 8 team fouls] (Jalen Booker: 1 personal fouls)   FT 1/2: GOOD   FT 2/2: GOOD Dwyane Towns makes 2/2 from the line.
Score: 39-39

[01:10] Team_014 possession (Score: 39-39)
Tracy Westbrook attempts a Midrange. Contested by Tyler Smith (4.3 feet, ZONE). Tracy Westbrook misses. Rebound secured by Tyler Smith.

[00:55] Team_050 possession (Score: 39-39)
Larry Curry attempts a Midrange. Contested by Bones Quickley (4.2 feet, ZONE). LARRY CURRY MAKES IT!
Score: 39-41

[00:40] Team_014 possession (Score: 39-41)
Bones Quickley attempts a 3Pt. Wide open! Dwyane Towns is 7.8 feet away. [MAN] BONES QUICKLEY MAKES IT! Assist: Nikola James
Score: 42-41

[00:27] Team_050 possession (Score: 42-41)
Tyler Smith drives and kicks out. Damian O'Neal attempts a 3Pt. Contested by Jalen Booker (2.8 feet, ZONE). Damian O'Neal misses. Rebound secured by Collin Gasol.

[00:11] Team_014 possession (Score: 42-41)
Bones Quickley attempts a 3Pt. Contested by Dwyane Towns (5.7 feet, MAN). Bones Quickley misses. FOUL! Loose ball foul on Tyler Smith during the rebound battle. [Team fouls: 3] No free throws, side out. (Tyler Smith: 1 personal fouls)

================================================================================
                              2ND QUARTER COMPLETE                              
================================================================================

2ND QUARTER SCORE: Team_014 28, Team_050 24

BOX SCORE:
================================================================================

Team_014
--------------------------------------------------------------------------------
Player                MIN  PTS  REB  AST  TO      FG   FG%      3P   3P%
--------------------------------------------------------------------------------
Bones Quickley          4    6    0    2   0   2/2   100.0     0/0   0.0
DeMar Adebayo          20    5    1    1   0   2/2   100.0     0/0   0.0
Collin Gasol            4    5    1    0   0   2/2   100.0     0/0   0.0
Jordan Anunoby         20    3    0    0   0   1/1   100.0     0/0   0.0
Tracy Westbrook         4    3    1    0   0   1/2    50.0     0/0   0.0
Lamelo Simmons         20    2    0    2   0   1/3    33.3     0/0   0.0
Ayo Murray             20    2    3    0   0   1/7    14.3     0/0   0.0
Michael Cunningham     20    0    2    2   0   0/1     0.0     0/0   0.0
Jalen Booker            4    0    0    1   0   0/0     0.0     0/0   0.0
Nikola James            4    0    3    1   0   0/0     0.0     0/0   0.0

TEAM: FG: 10/20 (50.0%), 3PT: 6/10 (60.0%), REB: 11 (1 off, 10 def), AST: 9, TO: 3
TEAM FOULS: 8 [Team_050 in BONUS]


Team_050
--------------------------------------------------------------------------------
Player                MIN  PTS  REB  AST  TO      FG   FG%      3P   3P%
--------------------------------------------------------------------------------
Joel Banchero          20    6    1    1   0   2/3    66.7     0/0   0.0
Collin Bane            20    5    5    0   0   2/2   100.0     0/0   0.0
LeBron Bridges         20    5    2    0   0   2/3    66.7     0/0   0.0
Larry Curry             4    4    1    0   0   2/3    66.7     0/0   0.0
Giannis LaVine         20    2    0    1   0   1/3    33.3     0/0   0.0
Dwyane Towns            4    2    0    0   0   1/2    50.0     0/0   0.0
Donovan Trent          20    0    0    0   0   0/2     0.0     0/0   0.0
Luka Gasol              4    0    0    0   0   0/1     0.0     0/0   0.0
Tyler Smith             4    0    1    0   0   0/1     0.0     0/0   0.0

TEAM: FG: 10/20 (50.0%), 3PT: 3/9 (33.3%), REB: 10 (1 off, 9 def), AST: 2, TO: 3
TEAM FOULS: 3

================================================================================

================================================================================
                       3RD QUARTER - Team_014 vs Team_050                       
================================================================================

[12:00] Team_014 possession (Score: 42-41)
FOUL! Reach-in foul on Giannis LaVine during the drive. [Team fouls: 1] No free throws, side out. (Giannis LaVine: 1 personal fouls)

[11:46] Team_014 possession (Score: 42-41)
Lamelo Simmons attempts a Midrange. Wide open! Joel Banchero is 6.0 feet away. [ZONE] LAMELO SIMMONS MAKES IT! Assist: DeMar Adebayo
Score: 44-41

[11:30] Team_050 possession (Score: 44-41)
Giannis LaVine attempts a Midrange. Contested by Ayo Murray (4.5 feet, ZONE). Giannis LaVine misses. FOUL! Loose ball foul on Ayo Murray during the rebound battle. [Team fouls: 1] No free throws, side out. (Ayo Murray: 1 personal fouls)

[11:14] Team_050 possession (Score: 44-41)
FOUL! Shooting foul on DeMar Adebayo. Donovan Trent to the line for 2 free throws. [Team fouls: 2] (DeMar Adebayo: 1 personal fouls)   FT 1/2: GOOD   FT 2/2: GOOD Donovan Trent makes 2/2 from the line.
Score: 44-43

[11:01] Team_014 possession (Score: 44-43)
DeMar Adebayo attempts a 3Pt. Contested by LeBron Bridges (5.6 feet, MAN). DeMar Adebayo misses. Offensive rebound by DeMar Adebayo! DeMar Adebayo kicks it out.

[10:42] Team_014 possession (Score: 44-43)
Lamelo Simmons drives to the basket... Lamelo Simmons loses the ball! Stripped by Collin Bane! TURNOVER! (live ball)

[10:27] Team_050 possession (Score: 44-43)
Donovan Trent attempts a Midrange. Contested by Ayo Murray (3.2 feet, MAN). Donovan Trent misses. Rebound secured by Michael Cunningham.

[10:15] Team_014 possession (Score: 44-43)
Lamelo Simmons attempts a 3Pt. Wide open! Giannis LaVine is 9.5 feet away. [ZONE] LAMELO SIMMONS MAKES IT! Assist: Ayo Murray
Score: 47-43

[10:02] Team_050 possession (Score: 47-43)
Joel Banchero drives and kicks out. Joel Banchero attempts a Midrange. Wide open! DeMar Adebayo is 6.1 feet away. [ZONE] Joel Banchero misses. Rebound secured by Ayo Murray.

[09:47] Team_014 possession (Score: 47-43)
Jordan Anunoby drives and kicks out. Ayo Murray attempts a Midrange. Contested by Donovan Trent (4.5 feet, MAN). Ayo Murray misses. Rebound secured by Collin Bane.

[09:34] Team_050 possession (Score: 47-43)
Giannis LaVine attempts a 3Pt. Heavily contested by Michael Cunningham (0.5 feet, MAN)! Giannis LaVine misses. Rebound secured by Michael Cunningham.

[09:21] Team_014 possession (Score: 47-43)
DeMar Adebayo drives, picks up Donovan Trent. Help arrives from Joel Banchero! DeMar Adebayo attempts a Dunk. Contested by Joel Banchero (3.2 feet, ZONE). DeMar Adebayo misses. Rebound secured by Collin Bane.

[09:09] Team_050 possession (Score: 47-43)
LeBron Bridges loses the ball! Stripped by DeMar Adebayo! TURNOVER! (live ball)

[08:55] Team_014 possession (Score: 47-43)
DeMar Adebayo attempts a Layup. Contested by Donovan Trent (4.9 feet, ZONE). DEMAR ADEBAYO MAKES IT!
Score: 49-43

[08:39] Team_050 possession (Score: 49-43)
Giannis LaVine attempts a Layup. BLOCKED BY JORDAN ANUNOBY! Ball is loose! Rebound secured by Ayo Murray.

[08:26] Team_014 possession (Score: 49-43)
DeMar Adebayo throws a bad pass out of bounds! TURNOVER! (dead ball)

[08:09] Team_050 possession (Score: 49-43)
Giannis LaVine attempts a 3Pt. Contested by Michael Cunningham (5.1 feet, MAN). GIANNIS LAVINE MAKES IT! Assist: LeBron Bridges
Score: 49-46

[07:56] Team_014 possession (Score: 49-46)
Lamelo Simmons attempts a 3Pt. Contested by Collin Bane (3.1 feet, MAN). Lamelo Simmons misses. Rebound secured by Collin Bane.

[07:41] Team_050 possession (Score: 49-46)
LeBron Bridges drives and kicks out. Donovan Trent attempts a Midrange. Wide open! Ayo Murray is 7.5 feet away. [MAN] Donovan Trent misses. Rebound secured by Ayo Murray.

[07:27] Team_014 possession (Score: 49-46)
Ayo Murray drives and kicks out. Lamelo Simmons attempts a 3Pt. Contested by Giannis LaVine (5.6 feet, ZONE). LAMELO SIMMONS MAKES IT!
Score: 52-46

[07:13] Team_050 possession (Score: 52-46)
LeBron Bridges attempts a Midrange. Heavily contested by DeMar Adebayo (1.6 feet, ZONE)! LeBron Bridges misses. Rebound secured by DeMar Adebayo.

[06:58] Team_014 possession (Score: 52-46)
Jordan Anunoby attempts a 3Pt. Wide open! Giannis LaVine is 9.5 feet away. [ZONE] Jordan Anunoby misses. Rebound secured by Joel Banchero.

[06:44] Team_050 possession (Score: 52-46)
Giannis LaVine attempts a 3Pt. Wide open! Michael Cunningham is 6.0 feet away. [MAN] Giannis LaVine misses. Rebound secured by DeMar Adebayo.

[06:31] Team_014 possession (Score: 52-46)
Jordan Anunoby attempts a Midrange. Contested by Joel Banchero (5.1 feet, ZONE). Jordan Anunoby misses. Rebound secured by Collin Bane.

[06:20] Team_050 possession (Score: 52-46)
Giannis LaVine attempts a Midrange. Wide open! Jordan Anunoby is 7.1 feet away. [ZONE] GIANNIS LAVINE MAKES IT!
Score: 52-48

[06:03] Team_014 possession (Score: 52-48)
Lamelo Simmons throws a bad pass! Stolen by Collin Bane! TURNOVER! (live ball)

[05:51] Team_050 possession (Score: 52-48)
Joel Banchero attempts a Midrange. Heavily contested by DeMar Adebayo (0.5 feet, ZONE)! JOEL BANCHERO MAKES IT! Assist: Donovan Trent
Score: 52-50

[05:36] Team_014 possession (Score: 52-50)
DeMar Adebayo drives, Donovan Trent stays with him. DeMar Adebayo attempts a Layup. Contested by Donovan Trent (3.0 feet, ZONE). DeMar Adebayo misses. Rebound secured by LeBron Bridges.

[05:23] Team_050 possession (Score: 52-50)
Donovan Trent attempts a 3Pt. Contested by Jordan Anunoby (5.5 feet, ZONE). DONOVAN TRENT MAKES IT! Assist: Collin Bane
Score: 52-53

[05:14] Team_014 possession (Score: 52-53)
Michael Cunningham drives and kicks out. DeMar Adebayo attempts a 3Pt. Wide open! Giannis LaVine is 6.8 feet away. [ZONE] DEMAR ADEBAYO MAKES IT! Assist: Lamelo Simmons
Score: 55-53

[05:02] Team_050 possession (Score: 55-53)
Giannis LaVine attempts a 3Pt. Contested by Michael Cunningham (4.0 feet, ZONE). GIANNIS LAVINE MAKES IT!
Score: 55-56

[04:47] Team_014 possession (Score: 55-56)
DeMar Adebayo makes the Midrange and draws the foul on Collin Bane! And-1! DeMar Adebayo to the line for 1. [Team fouls: 2] (Collin Bane: 1 personal fouls)   FT 1/1: GOOD DeMar Adebayo makes 1/1 from the line.
Score: 58-56

[04:37] Team_050 possession (Score: 58-56)
Collin Bane attempts a Midrange. Wide open! Jordan Anunoby is 6.7 feet away. [ZONE] COLLIN BANE MAKES IT!
Score: 58-58

[04:27] Team_014 possession (Score: 58-58)
Ayo Murray attempts a Layup. Contested by Donovan Trent (4.9 feet, MAN). AYO MURRAY MAKES IT! Assist: Michael Cunningham
Score: 60-58

[04:10] Team_050 possession (Score: 60-58)
Collin Bane attempts a Layup. Contested by DeMar Adebayo (3.2 feet, ZONE). COLLIN BANE MAKES IT!
Score: 60-60

[03:56] Team_014 possession (Score: 60-60)
FOUL! Reach-in foul on Donovan Trent during the drive. [Team fouls: 3] No free throws, side out. (Donovan Trent: 1 personal fouls)

[03:40] Team_014 possession (Score: 60-60)
DeMar Adebayo drives to the basket... DeMar Adebayo throws a bad pass out of bounds! TURNOVER! (dead ball)

[03:40] Substitution (Team_014): Lamelo Simmons OUT → Tracy Westbrook IN (stamina_rule2)

[03:40] Substitution (Team_050): LeBron Bridges OUT → Luka Gasol IN (stamina_rule2)

[03:24] Team_050 possession (Score: 60-60)
Donovan Trent drives to the basket... Donovan Trent throws a bad pass! Stolen by DeMar Adebayo! TURNOVER! (live ball)

[03:10] Team_014 possession (Score: 60-60)
Tracy Westbrook attempts a Midrange. Contested by Joel Banchero (3.3 feet, ZONE). TRACY WESTBROOK MAKES IT!
Score: 62-60

[02:56] Team_050 possession (Score: 62-60)
Donovan Trent drives, picks up DeMar Adebayo. Help arrives from Michael Cunningham! Donovan Trent attempts a Layup. Contested by Michael Cunningham (2.7 feet, ZONE). DONOVAN TRENT MAKES IT!
Score: 62-62

[02:45] Team_014 possession (Score: 62-62)
Michael Cunningham drives, Donovan Trent stays with him. Michael Cunningham attempts a Layup. Heavily contested by Donovan Trent (1.1 feet, ZONE)! MICHAEL CUNNINGHAM MAKES IT!
Score: 64-62

[02:30] Team_050 possession (Score: 64-62)
Collin Bane attempts a 3Pt. Wide open! Jordan Anunoby is 7.0 feet away. [ZONE] Collin Bane misses. Rebound secured by Michael Cunningham.

[02:14] Team_014 possession (Score: 64-62)
DeMar Adebayo makes the Layup and draws the foul on Luka Gasol! And-1! DeMar Adebayo to the line for 1. [Team fouls: 4] (Luka Gasol: 1 personal fouls)   FT 1/1: GOOD DeMar Adebayo makes 1/1 from the line.
Score: 67-62

[02:00] Team_050 possession (Score: 67-62)
Joel Banchero throws a bad pass! Stolen by Jordan Anunoby! TURNOVER! (live ball)

[01:49] Team_014 possession (Score: 67-62)
Michael Cunningham attempts a Layup. BLOCKED BY JOEL BANCHERO! Ball goes out off Joel Banchero. Michael Cunningham's ball!

[01:33] Team_014 possession (Score: 67-62)
FOUL! Reach-in foul on Giannis LaVine during the drive. [IN THE BONUS! 5 team fouls] Michael Cunningham to the line for 2 free throws. (Giannis LaVine: 2 personal fouls)   FT 1/2: GOOD   FT 2/2: GOOD Michael Cunningham makes 2/2 from the line.
Score: 69-62

[01:21] Team_050 possession (Score: 69-62)
Collin Bane attempts a 3Pt. Wide open! Tracy Westbrook is 7.1 feet away. [MAN] COLLIN BANE MAKES IT! Assist: Joel Banchero
Score: 69-65

[01:09] Team_014 possession (Score: 69-65)
Jordan Anunoby attempts a Layup. Contested by Joel Banchero (5.0 feet, MAN). JORDAN ANUNOBY MAKES IT! Assist: DeMar Adebayo
Score: 71-65

[00:53] Team_050 possession (Score: 71-65)
Donovan Trent drives, picks up DeMar Adebayo. Help arrives from Michael Cunningham! Donovan Trent attempts a Dunk. Contested by Michael Cunningham (5.6 feet, ZONE). Donovan Trent misses. Rebound secured by Michael Cunningham.

[00:34] Team_014 possession (Score: 71-65)
Michael Cunningham makes the Layup and draws the foul on Collin Bane! And-1! Michael Cunningham to the line for 1. [BONUS: 6 team fouls] (Collin Bane: 2 personal fouls)   FT 1/1: GOOD Michael Cunningham makes 1/1 from the line.
Score: 74-65

[00:21] Team_050 possession (Score: 74-65)
Joel Banchero drives and kicks out. Joel Banchero attempts a 3Pt. Wide open! Jordan Anunoby is 7.7 feet away. [ZONE] Joel Banchero misses. Offensive rebound by Joel Banchero! Joel Banchero kicks it out.

[00:06] Team_050 possession (Score: 74-65)
Luka Gasol attempts a 3Pt. Contested by DeMar Adebayo (4.1 feet, MAN). Luka Gasol misses. Offensive rebound by Joel Banchero! Joel Banchero kicks it out.

================================================================================
                              3RD QUARTER COMPLETE                              
================================================================================

3RD QUARTER SCORE: Team_014 32, Team_050 24

BOX SCORE:
================================================================================

Team_014
--------------------------------------------------------------------------------
Player                MIN  PTS  REB  AST  TO      FG   FG%      3P   3P%
--------------------------------------------------------------------------------
DeMar Adebayo          32   11    3    2   0   4/6    66.7     0/0   0.0
Lamelo Simmons         29    8    0    1   0   3/4    75.0     0/0   0.0
Michael Cunningham     32    7    4    1   0   3/3   100.0     0/0   0.0
Ayo Murray             32    2    3    1   0   1/1   100.0     0/0   0.0
Jordan Anunoby         32    2    0    0   0   1/4    25.0     0/0   0.0
Tracy Westbrook         8    2    0    0   0   1/1   100.0     0/0   0.0

TEAM: FG: 13/19 (68.4%), 3PT: 1/3 (33.3%), REB: 10 (1 off, 9 def), AST: 5, TO: 4
TEAM FOULS: 2


Team_050
--------------------------------------------------------------------------------
Player                MIN  PTS  REB  AST  TO      FG   FG%      3P   3P%
--------------------------------------------------------------------------------
Giannis LaVine         32    8    0    0   0   3/6    50.0     0/0   0.0
Collin Bane            32    7    5    1   0   3/4    75.0     0/0   0.0
Donovan Trent          32    7    0    1   0   3/5    60.0     0/0   0.0
Joel Banchero          32    2    3    1   0   1/2    50.0     0/0   0.0
LeBron Bridges         29    0    1    1   0   0/2     0.0     0/0   0.0

TEAM: FG: 10/19 (52.6%), 3PT: 4/7 (57.1%), REB: 9 (3 off, 6 def), AST: 4, TO: 3
TEAM FOULS: 6 [Team_014 in BONUS]

================================================================================

================================================================================
                       4TH QUARTER - Team_014 vs Team_050                       
================================================================================

[12:00] Team_014 possession (Score: 74-65)
FOUL! Reach-in foul on Donovan Trent during the drive. [Team fouls: 1] No free throws, side out. (Donovan Trent: 1 personal fouls)

[11:46] Team_014 possession (Score: 74-65)
DeMar Adebayo attempts a Midrange. Contested by LeBron Bridges (2.1 feet, ZONE). DEMAR ADEBAYO MAKES IT! Assist: Michael Cunningham
Score: 76-65

[11:31] Team_050 possession (Score: 76-65)
Giannis LaVine attempts a Midrange. Wide open! Michael Cunningham is 6.4 feet away. [MAN] Giannis LaVine misses. Rebound secured by DeMar Adebayo.

[11:19] Team_014 possession (Score: 76-65)
Jordan Anunoby attempts a 3Pt. Wide open! Joel Banchero is 6.6 feet away. [MAN] JORDAN ANUNOBY MAKES IT! Assist: Ayo Murray
Score: 79-65

[11:06] Team_050 possession (Score: 79-65)
Donovan Trent attempts a 3Pt. Contested by Jordan Anunoby (2.6 feet, ZONE). Donovan Trent misses. Rebound secured by DeMar Adebayo.

[10:52] Team_014 possession (Score: 79-65)
Lamelo Simmons attempts a 3Pt. Contested by Collin Bane (4.4 feet, ZONE). Lamelo Simmons misses. Rebound secured by Collin Bane.

[10:38] Team_050 possession (Score: 79-65)
Collin Bane attempts a Midrange. Contested by Lamelo Simmons (3.8 feet, ZONE). Collin Bane misses. Rebound secured by Lamelo Simmons.

[10:26] Team_014 possession (Score: 79-65)
DeMar Adebayo loses the ball! Stripped by LeBron Bridges! TURNOVER! (live ball)

[10:16] Team_050 possession (Score: 79-65)
Collin Bane attempts a Midrange. Contested by Lamelo Simmons (2.7 feet, MAN). COLLIN BANE MAKES IT! Assist: Joel Banchero
Score: 79-67

[09:57] Team_014 possession (Score: 79-67)
Lamelo Simmons attempts a 3Pt. Wide open! Collin Bane is 6.4 feet away. [ZONE] Lamelo Simmons misses. Rebound secured by Joel Banchero.

[09:43] Team_050 possession (Score: 79-67)
Giannis LaVine drives and kicks out. Collin Bane attempts a 3Pt. Contested by Jordan Anunoby (5.6 feet, ZONE). COLLIN BANE MAKES IT! Assist: LeBron Bridges
Score: 79-70

[09:33] Team_014 possession (Score: 79-70)
Jordan Anunoby attempts a 3Pt. Contested by Joel Banchero (3.7 feet, MAN). JORDAN ANUNOBY MAKES IT! Assist: Ayo Murray
Score: 82-70

[09:17] Team_050 possession (Score: 82-70)
Collin Bane drives and kicks out. LeBron Bridges attempts a 3Pt. Heavily contested by DeMar Adebayo (1.1 feet, MAN)! LEBRON BRIDGES MAKES IT! Assist: Joel Banchero
Score: 82-73

[09:02] Team_014 possession (Score: 82-73)
DeMar Adebayo drives and kicks out. FOUL! Shooting foul on LeBron Bridges. DeMar Adebayo to the line for 2 free throws. [Team fouls: 2] (LeBron Bridges: 1 personal fouls)   FT 1/2: MISS   FT 2/2: GOOD DeMar Adebayo makes 1/2 from the line.
Score: 83-73

[08:48] Team_050 possession (Score: 83-73)
Collin Bane attempts a 3Pt. Contested by Lamelo Simmons (2.0 feet, MAN). Collin Bane misses. Rebound secured by Lamelo Simmons.

[08:34] Team_014 possession (Score: 83-73)
Jordan Anunoby throws a bad pass! Stolen by Joel Banchero! TURNOVER! (live ball)

[08:24] Team_050 possession (Score: 83-73)
Collin Bane attempts a Layup. Contested by Lamelo Simmons (2.1 feet, MAN). COLLIN BANE MAKES IT!
Score: 83-75

[08:10] Team_014 possession (Score: 83-75)
Ayo Murray makes the Layup and draws the foul on LeBron Bridges! And-1! Ayo Murray to the line for 1. [Team fouls: 3] (LeBron Bridges: 2 personal fouls)   FT 1/1: GOOD Ayo Murray makes 1/1 from the line.
Score: 86-75

[07:55] Team_050 possession (Score: 86-75)
FOUL! Shooting foul on DeMar Adebayo. Donovan Trent to the line for 2 free throws. [Team fouls: 1] (DeMar Adebayo: 1 personal fouls)   FT 1/2: GOOD   FT 2/2: GOOD Donovan Trent makes 2/2 from the line.
Score: 86-77

[07:39] Team_014 possession (Score: 86-77)
Lamelo Simmons attempts a 3Pt. Wide open! LeBron Bridges is 6.2 feet away. [ZONE] Lamelo Simmons misses. Rebound secured by Collin Bane.

[07:25] Team_050 possession (Score: 86-77)
LeBron Bridges attempts a 3Pt. Contested by DeMar Adebayo (4.5 feet, MAN). LeBron Bridges misses. Rebound secured by Lamelo Simmons.

[07:14] Team_014 possession (Score: 86-77)
Michael Cunningham attempts a Layup. Contested by Giannis LaVine (3.0 feet, MAN). Michael Cunningham misses. Rebound secured by Collin Bane.

[07:00] Team_050 possession (Score: 86-77)
Giannis LaVine drives and kicks out. FOUL! Shooting foul on DeMar Adebayo. Joel Banchero to the line for 2 free throws. [Team fouls: 2] (DeMar Adebayo: 2 personal fouls)   FT 1/2: GOOD   FT 2/2: GOOD Joel Banchero makes 2/2 from the line.
Score: 86-79

[06:45] Team_014 possession (Score: 86-79)
FOUL! Shooting foul on Donovan Trent. Michael Cunningham to the line for 2 free throws. [Team fouls: 4] (Donovan Trent: 2 personal fouls)   FT 1/2: GOOD   FT 2/2: MISS Michael Cunningham makes 1/2 from the line. FOUL! Loose ball foul on LeBron Bridges during the free throw rebound! [IN THE BONUS! 5 team fouls] Lamelo Simmons to the line for 2 free throws. (LeBron Bridges: 3 personal fouls)   FT 1/2: MISS   FT 2/2: GOOD Lamelo Simmons makes 1/2 from the line.
Score: 88-79

[06:28] Team_050 possession (Score: 88-79)
Joel Banchero makes the 3Pt and draws the foul on Jordan Anunoby! And-1! Joel Banchero to the line for 1. [Team fouls: 3] (Jordan Anunoby: 1 personal fouls)   FT 1/1: GOOD Joel Banchero makes 1/1 from the line.
Score: 88-83

[06:16] Team_014 possession (Score: 88-83)
Ayo Murray loses the ball! Stripped by LeBron Bridges! TURNOVER! (live ball)

[06:02] Team_050 possession (Score: 88-83)
Donovan Trent drives and kicks out. Donovan Trent attempts a 3Pt. Contested by Ayo Murray (5.2 feet, MAN). Donovan Trent misses. Rebound secured by DeMar Adebayo.

[05:43] Team_014 possession (Score: 88-83)
Ayo Murray drives and kicks out. Michael Cunningham attempts a Midrange. Contested by Giannis LaVine (4.8 feet, MAN). MICHAEL CUNNINGHAM MAKES IT! Assist: DeMar Adebayo
Score: 90-83

[05:32] Team_050 possession (Score: 90-83)
Donovan Trent attempts a Midrange. Contested by Jordan Anunoby (4.3 feet, ZONE). Donovan Trent misses. Offensive rebound by LeBron Bridges! LeBron Bridges kicks it out.

[05:19] Team_050 possession (Score: 90-83)
Joel Banchero drives and kicks out. Collin Bane attempts a 3Pt. Wide open! Lamelo Simmons is 6.8 feet away. [MAN] COLLIN BANE MAKES IT!
Score: 90-86

[05:05] Team_014 possession (Score: 90-86)
Michael Cunningham attempts a Midrange. Heavily contested by Collin Bane (0.5 feet, ZONE)! Michael Cunningham misses. Rebound secured by LeBron Bridges.

[04:50] Team_050 possession (Score: 90-86)
Donovan Trent drives and kicks out. Collin Bane attempts a 3Pt. Contested by Lamelo Simmons (3.9 feet, MAN). Collin Bane misses. Rebound secured by Ayo Murray.

[04:35] Team_014 possession (Score: 90-86)
Jordan Anunoby attempts a 3Pt. Wide open! Giannis LaVine is 7.1 feet away. [ZONE] JORDAN ANUNOBY MAKES IT! Assist: Ayo Murray
Score: 93-86

[04:18] Team_050 possession (Score: 93-86)
Joel Banchero attempts a Midrange. Wide open! Jordan Anunoby is 6.6 feet away. [MAN] JOEL BANCHERO MAKES IT! Assist: Giannis LaVine
Score: 93-88

[04:04] Team_014 possession (Score: 93-88)
DeMar Adebayo attempts a Midrange. Wide open! LeBron Bridges is 6.5 feet away. [MAN] DeMar Adebayo misses. Rebound secured by LeBron Bridges.

[03:46] Team_050 possession (Score: 93-88)
Collin Bane attempts a 3Pt. Wide open! Jordan Anunoby is 6.1 feet away. [ZONE] COLLIN BANE MAKES IT! Assist: LeBron Bridges
Score: 93-91

[03:26] Team_014 possession (Score: 93-91)
Jordan Anunoby drives and kicks out. Jordan Anunoby attempts a 3Pt. Wide open! Giannis LaVine is 7.1 feet away. [ZONE] Jordan Anunoby misses. Rebound secured by Collin Bane.

[03:10] Team_050 possession (Score: 93-91)
Giannis LaVine attempts a 3Pt. Wide open! Jordan Anunoby is 7.1 feet away. [ZONE] Giannis LaVine misses. Rebound secured by DeMar Adebayo.

[02:55] Team_014 possession (Score: 93-91)
Michael Cunningham commits a violation (traveling/carry)! TURNOVER! (dead ball)

[02:55] Substitution (Team_014): Michael Cunningham OUT → Jalen Booker IN (stamina_rule2)

[02:55] Substitution (Team_014): Jordan Anunoby OUT → Bones Quickley IN (stamina_rule2)

[02:55] Substitution (Team_014): Lamelo Simmons OUT → Tracy Westbrook IN (stamina_rule2)

[02:55] Substitution (Team_014): DeMar Adebayo OUT → Nikola James IN (stamina_rule2)

[02:55] Substitution (Team_014): Ayo Murray OUT → Collin Gasol IN (stamina_rule2)

[02:55] Substitution (Team_050): Giannis LaVine OUT → Damian O'Neal IN (stamina_rule2)

[02:55] Substitution (Team_050): Joel Banchero OUT → Dwyane Towns IN (stamina_rule2)

[02:55] Substitution (Team_050): Collin Bane OUT → Larry Curry IN (stamina_rule2)

[02:55] Substitution (Team_050): LeBron Bridges OUT → Luka Gasol IN (stamina_rule2)

[02:55] Substitution (Team_050): Donovan Trent OUT → Tyler Smith IN (stamina_rule2)

[02:44] Team_050 possession (Score: 93-91)
Luka Gasol attempts a 3Pt. Contested by Jalen Booker (3.7 feet, ZONE). Luka Gasol misses. Rebound secured by Nikola James.

[02:32] Team_014 possession (Score: 93-91)
Nikola James attempts a Layup. BLOCKED BY LUKA GASOL! Ball is loose! Offensive rebound by Collin Gasol! Collin Gasol kicks it out.

[02:20] Team_014 possession (Score: 93-91)
Jalen Booker attempts a 3Pt. Wide open! Damian O'Neal is 7.0 feet away. [MAN] Jalen Booker misses. Rebound secured by Larry Curry.

[02:03] Team_050 possession (Score: 93-91)
Tyler Smith attempts a Midrange. Wide open! Collin Gasol is 6.1 feet away. [MAN] Tyler Smith misses. Offensive rebound by Tyler Smith! Tyler Smith kicks it out.

[01:49] Team_050 possession (Score: 93-91)
FOUL! Holding foul on Nikola James. [Team fouls: 4] No free throws, side out. (Nikola James: 1 personal fouls)

[01:35] Team_050 possession (Score: 93-91)
Luka Gasol attempts a 3Pt. Heavily contested by Jalen Booker (0.5 feet, ZONE)! Luka Gasol misses. Rebound secured by Tracy Westbrook.

[01:22] Team_014 possession (Score: 93-91)
Collin Gasol drives, Tyler Smith stays with him. Collin Gasol attempts a Dunk. Contested by Tyler Smith (4.5 feet, MAN). COLLIN GASOL MAKES IT! Assist: Jalen Booker
Score: 95-91

[01:06] Team_050 possession (Score: 95-91)
Dwyane Towns makes the Layup and draws the foul on Bones Quickley! And-1! Dwyane Towns to the line for 1. [BONUS: 5 team fouls] (Bones Quickley: 1 personal fouls)   FT 1/1: GOOD Dwyane Towns makes 1/1 from the line.
Score: 95-94

[00:49] Team_014 possession (Score: 95-94)
Bones Quickley attempts a Midrange. Wide open! Luka Gasol is 8.9 feet away. [ZONE] BONES QUICKLEY MAKES IT!
Score: 97-94

[00:38] Team_050 possession (Score: 97-94)
Dwyane Towns attempts a Midrange. Wide open! Bones Quickley is 8.3 feet away. [MAN] DWYANE TOWNS MAKES IT!
Score: 97-96

[00:26] Team_014 possession (Score: 97-96)
Nikola James attempts a Midrange. Contested by Dwyane Towns (5.4 feet, ZONE). NIKOLA JAMES MAKES IT! Assist: Jalen Booker
Score: 99-96

[00:09] Team_050 possession (Score: 99-96)
Dwyane Towns loses control! Ball rolls out of bounds! TURNOVER! (dead ball)

================================================================================
                              4TH QUARTER COMPLETE                              
================================================================================

4TH QUARTER SCORE: Team_014 25, Team_050 31

BOX SCORE:
================================================================================

Team_014
--------------------------------------------------------------------------------
Player                MIN  PTS  REB  AST  TO      FG   FG%      3P   3P%
--------------------------------------------------------------------------------
Jordan Anunoby         42    9    0    0   0   3/4    75.0     0/0   0.0
DeMar Adebayo          42    3    4    1   0   2/3    66.7     0/0   0.0
Ayo Murray             42    3    1    3   0   1/1   100.0     0/0   0.0
Michael Cunningham     42    2    0    1   0   1/3    33.3     0/0   0.0
Lamelo Simmons         38    2    3    0   0   1/4    25.0     0/0   0.0
Nikola James            7    2    1    0   0   1/1   100.0     0/0   0.0
Collin Gasol            7    2    1    0   0   1/1   100.0     0/0   0.0
Bones Quickley          7    2    0    0   0   1/1   100.0     0/0   0.0
Jalen Booker            7    0    0    2   0   0/1     0.0     0/0   0.0
Tracy Westbrook        10    0    1    0   0   0/0     0.0     0/0   0.0

TEAM: FG: 11/19 (57.9%), 3PT: 3/7 (42.9%), REB: 11 (1 off, 10 def), AST: 7, TO: 4
TEAM FOULS: 5 [Team_050 in BONUS]


Team_050
--------------------------------------------------------------------------------
Player                MIN  PTS  REB  AST  TO      FG   FG%      3P   3P%
--------------------------------------------------------------------------------
Collin Bane            42   13    4    0   0   5/7    71.4     0/0   0.0
Joel Banchero          42    8    1    2   0   3/3   100.0     0/0   0.0
Dwyane Towns            7    5    0    0   0   2/2   100.0     0/0   0.0
LeBron Bridges         38    3    3    2   0   1/2    50.0     0/0   0.0
Donovan Trent          42    2    0    0   0   1/4    25.0     0/0   0.0
Giannis LaVine         42    0    0    1   0   0/2     0.0     0/0   0.0
Luka Gasol             10    0    0    0   0   0/2     0.0     0/0   0.0
Larry Curry             7    0    1    0   0   0/0     0.0     0/0   0.0
Tyler Smith             7    0    1    0   0   0/0     0.0     0/0   0.0

TEAM: FG: 12/22 (54.5%), 3PT: 2/8 (25.0%), REB: 10 (2 off, 8 def), AST: 5, TO: 1
TEAM FOULS: 5 [Team_014 in BONUS]

================================================================================

================================================================================
                               FULL GAME COMPLETE                               
================================================================================

FINAL SCORE: Team_014 99, Team_050 96

SCORING BY QUARTER:
--------------------------------------------------------------------------------
Team                     Q1     Q2     Q3     Q4    FINAL
--------------------------------------------------------------------------------
Team_014                 14     28     32     25       99
Team_050                 17     24     24     31       96
--------------------------------------------------------------------------------

FULL GAME BOX SCORE:
================================================================================

Team_014
--------------------------------------------------------------------------------
Player                MIN  PTS  REB  AST  TO      FG   FG%      3P   3P%      FT STL BLK
--------------------------------------------------------------------------------
Michael Cunningham     42   12   10    4   1   6/12   50.0   1/3    33.3   4/5     0   1
Jordan Anunoby         42   16    0    1   1   6/11   54.5   4/6    66.7   0/0     1   1
DeMar Adebayo          42   22   14    6   4   8/14   57.1   1/2    50.0   3/4     5   0
Ayo Murray             42    7   12    5   3   5/14   35.7   0/2     0.0   2/4     0   0
Lamelo Simmons         38   15    3    3   2   4/17   23.5   2/11   18.2   0/1     0   0
Tracy Westbrook        10    5    2    0   0   2/3    66.7   1/1   100.0   0/0     0   0
Jalen Booker            7    0    0    3   1   0/1     0.0   0/1     0.0   0/0     0   0
Bones Quickley          7    8    0    2   0   3/3   100.0   2/2   100.0   0/0     0   0
Nikola James            7    2    4    1   0   1/1   100.0   0/0     0.0   0/0     0   0
Collin Gasol            7    7    2    0   0   3/3   100.0   1/1   100.0   0/0     0   0

TEAM: FG: 38/79 (48.1%), 3PT: 12/29 (41.4%), REB: 47 (7 off, 40 def), AST: 25, TO: 12


Team_050
--------------------------------------------------------------------------------
Player                MIN  PTS  REB  AST  TO      FG   FG%      3P   3P%      FT STL BLK
--------------------------------------------------------------------------------
Giannis LaVine         42   13    0    3   2   7/19   36.8   3/11   27.3   5/5     0   0
Joel Banchero          42   20   11    4   2   7/12   58.3   2/4    50.0   6/6     1   1
Collin Bane            42   30   21    2   1  11/16   68.8   3/6    50.0   3/3     2   0
Donovan Trent          42   10    0    1   1   5/12   41.7   1/2    50.0   5/6     0   1
LeBron Bridges         38   12   12    3   2   4/9    44.4   1/3    33.3   2/2     3   0
Luka Gasol             10    0    0    0   0   0/3     0.0   0/2     0.0   0/0     0   1
Damian O'Neal           7    0    0    0   1   0/0     0.0   0/0     0.0   0/0     1   0
Dwyane Towns            7    7    0    0   1   3/4    75.0   0/1     0.0   3/3     0   0
Larry Curry             7    4    2    0   0   2/3    66.7   0/1     0.0   2/2     0   0
Tyler Smith             7    0    2    0   0   0/1     0.0   0/0     0.0   0/0     0   0

TEAM: FG: 40/80 (50.0%), 3PT: 10/30 (33.3%), REB: 48 (8 off, 40 def), AST: 13, TO: 10

================================================================================
