================================================================================
                        FULL GAME - Team_092 vs Team_016                        
================================================================================

================================================================================
                       1ST QUARTER - Team_092 vs Team_016                       
================================================================================

[12:00] Team_092 possession (Score: 0-0)
Immanuel Ingram drives to the basket... FOUL! Offensive foul on Immanuel Ingram! Vince Duncan drew the charge! [Team fouls: 1] (Immanuel Ingram: 1 personal fouls) TURNOVER! (dead ball)

[11:46] Team_016 possession (Score: 0-0)
Giannis Ginobili loses the ball! Stripped by Karl Gobert! TURNOVER! (live ball)

[11:33] Team_092 possession (Score: 0-0)
Paul James attempts a 3Pt. Contested by Collin Barnes (3.5 feet, ZONE). Paul James misses. Rebound secured by Vince Duncan.

[11:20] Team_016 possession (Score: 0-0)
Vince Quickley attempts a 3Pt. Wide open! Paul James is 6.3 feet away. [MAN] Vince Quickley misses. Rebound secured by Paul James.

[11:08] Team_092 possession (Score: 0-0)
FOUL! Holding foul on Collin Barnes. [Team fouls: 1] No free throws, side out. (Collin Barnes: 1 personal fouls)

[10:55] Team_092 possession (Score: 0-0)
FOUL! Shooting foul on Vince Duncan. Immanuel Ingram to the line for 2 free throws. [Team fouls: 2] (Vince Duncan: 1 personal fouls)   FT 1/2: MISS   FT 2/2: GOOD Immanuel Ingram makes 1/2 from the line.
Score: 1-0

[10:43] Team_016 possession (Score: 1-0)
Vince Quickley attempts a 3Pt. Contested by Paul James (5.3 feet, MAN). VINCE QUICKLEY MAKES IT! Assist: Ben Barrett
Score: 1-3

[10:26] Team_092 possession (Score: 1-3)
FOUL! Reach-in foul on Vince Quickley during the drive. [Team fouls: 3] No free throws, side out. (Vince Quickley: 1 personal fouls)

[10:10] Team_092 possession (Score: 1-3)
John Giddey drives to the basket... John Giddey loses the ball! Stripped by Ben Barrett! TURNOVER! (live ball)

[09:57] Team_016 possession (Score: 1-3)
Giannis Ginobili drives and kicks out. Ben Barrett attempts a Midrange. Contested by John Giddey (4.7 feet, MAN). Ben Barrett misses. Rebound secured by John Giddey.

[09:42] Team_092 possession (Score: 1-3)
FOUL! Shooting foul on Giannis Ginobili. Karl Gobert to the line for 2 free throws. [Team fouls: 4] (Giannis Ginobili: 1 personal fouls)   FT 1/2: GOOD   FT 2/2: GOOD Karl Gobert makes 2/2 from the line.
Score: 3-3

[09:28] Team_016 possession (Score: 3-3)
Vince Quickley attempts a 3Pt. Wide open! John Giddey is 6.3 feet away. [ZONE] VINCE QUICKLEY MAKES IT! Assist: Ben Barrett
Score: 3-6

[09:15] Team_092 possession (Score: 3-6)
Paul James attempts a 3Pt. Contested by Collin Barnes (5.9 feet, ZONE). Paul James misses. FOUL! Loose ball foul on Vince Quickley during the rebound battle. [IN THE BONUS! 5 team fouls] John Giddey to the line for 2 free throws. (Vince Quickley: 2 personal fouls)   FT 1/2: GOOD   FT 2/2: GOOD John Giddey makes 2/2 from the line.
Score: 5-6

[09:02] Team_016 possession (Score: 5-6)
Ben Barrett attempts a 3Pt. Contested by John Giddey (2.5 feet, MAN). Ben Barrett misses. Rebound secured by Immanuel Ingram.

[08:44] Team_092 possession (Score: 5-6)
Immanuel Ingram attempts a Midrange. Contested by Vince Duncan (4.0 feet, MAN). IMMANUEL INGRAM MAKES IT! Assist: Austin Bridges
Score: 7-6

[08:31] Team_016 possession (Score: 7-6)
Vince Quickley attempts a 3Pt. Contested by John Giddey (4.2 feet, ZONE). Vince Quickley misses. Rebound secured by Paul James.

[08:21] Team_092 possession (Score: 7-6)
Paul James throws a bad pass! Stolen by Vince Quickley! TURNOVER! (live ball)

[08:06] Team_016 possession (Score: 7-6)
Ben Barrett makes the Layup and draws the foul on John Giddey! And-1! Ben Barrett to the line for 1. [Team fouls: 2] (John Giddey: 1 personal fouls)   FT 1/1: GOOD Ben Barrett makes 1/1 from the line.
Score: 7-9

[07:52] Team_092 possession (Score: 7-9)
Immanuel Ingram drives and kicks out. FOUL! Shooting foul on Giannis Ginobili. Paul James to the line for 2 free throws. [BONUS: 6 team fouls] (Giannis Ginobili: 2 personal fouls)   FT 1/2: GOOD   FT 2/2: GOOD Paul James makes 2/2 from the line.
Score: 9-9

[07:39] Team_016 possession (Score: 9-9)
Collin Barnes attempts a 3Pt. Contested by Austin Bridges (3.5 feet, MAN). Collin Barnes misses. Rebound secured by Immanuel Ingram.

[07:24] Team_092 possession (Score: 9-9)
John Giddey attempts a 3Pt. Heavily contested by Ben Barrett (0.5 feet, MAN)! John Giddey misses. Offensive rebound by John Giddey! John Giddey kicks it out.

[07:13] Team_092 possession (Score: 9-9)
Karl Gobert makes the Layup and draws the foul on Giannis Ginobili! And-1! Karl Gobert to the line for 1. [BONUS: 7 team fouls] (Giannis Ginobili: 3 personal fouls)   FT 1/1: GOOD Karl Gobert makes 1/1 from the line.
Score: 12-9

[06:59] Team_016 possession (Score: 12-9)
Giannis Ginobili drives and kicks out. Vince Quickley attempts a 3Pt. Contested by John Giddey (5.1 feet, ZONE). VINCE QUICKLEY MAKES IT! Assist: Vince Duncan
Score: 12-12

[06:41] Team_092 possession (Score: 12-12)
Austin Bridges attempts a Midrange. Wide open! Giannis Ginobili is 8.0 feet away. [ZONE] Austin Bridges misses. Rebound secured by Ben Barrett.

[06:26] Team_016 possession (Score: 12-12)
Giannis Ginobili attempts a 3Pt. Contested by John Giddey (3.5 feet, ZONE). Giannis Ginobili misses. Rebound secured by John Giddey.

[06:12] Team_092 possession (Score: 12-12)
Immanuel Ingram attempts a Layup. BLOCKED BY COLLIN BARNES! Ball is loose! Rebound secured by Vince Duncan.

[06:01] Team_016 possession (Score: 12-12)
Vince Quickley attempts a 3Pt. Contested by Paul James (5.2 feet, MAN). Vince Quickley misses. Rebound secured by Paul James.

[05:50] Team_092 possession (Score: 12-12)
FOUL! Shooting foul on Collin Barnes. Austin Bridges to the line for 3 free throws. [BONUS: 8 team fouls] (Collin Barnes: 2 personal fouls)   FT 1/3: GOOD   FT 2/3: GOOD   FT 3/3: GOOD Austin Bridges makes 3/3 from the line.
Score: 15-12

[05:35] Team_016 possession (Score: 15-12)
Vince Quickley drives to the basket... Vince Quickley commits a violation (traveling/carry)! TURNOVER! (dead ball)

[05:19] Team_092 possession (Score: 15-12)
Karl Gobert attempts a 3Pt. Contested by Collin Barnes (4.9 feet, ZONE). KARL GOBERT MAKES IT! Assist: Austin Bridges
Score: 18-12

[05:07] Team_016 possession (Score: 18-12)
Ben Barrett makes the Layup and draws the foul on Austin Bridges! And-1! Ben Barrett to the line for 1. [Team fouls: 3] (Austin Bridges: 1 personal fouls)   FT 1/1: MISS Ben Barrett makes 0/1 from the line. Rebound secured by John Giddey.
Score: 18-14

[04:49] Team_092 possession (Score: 18-14)
Austin Bridges attempts a 3Pt. Wide open! Collin Barnes is 6.7 feet away. [MAN] AUSTIN BRIDGES MAKES IT! Assist: Immanuel Ingram
Score: 21-14

[04:37] Team_016 possession (Score: 21-14)
Giannis Ginobili attempts a Midrange. Contested by Karl Gobert (4.3 feet, MAN). GIANNIS GINOBILI MAKES IT!
Score: 21-16

[04:27] Team_092 possession (Score: 21-16)
Paul James attempts a 3Pt. Wide open! Vince Quickley is 7.8 feet away. [MAN] PAUL JAMES MAKES IT! Assist: John Giddey
Score: 24-16

[04:11] Team_016 possession (Score: 24-16)
Vince Quickley drives, picks up John Giddey. Help arrives from Austin Bridges! Vince Quickley attempts a Layup. Contested by Austin Bridges (3.3 feet, ZONE). VINCE QUICKLEY MAKES IT! Assist: Ben Barrett
Score: 24-18

[03:54] Team_092 possession (Score: 24-18)
Paul James attempts a 3Pt. Contested by Collin Barnes (2.8 feet, ZONE). Paul James misses. Rebound secured by Ben Barrett.

[03:38] Team_016 possession (Score: 24-18)
Vince Duncan attempts a Dunk. BLOCKED BY JOHN GIDDEY! Ball is loose! Offensive rebound by Ben Barrett! Ben Barrett kicks it out.

[03:20] Team_016 possession (Score: 24-18)
Ben Barrett attempts a 3Pt. Contested by John Giddey (3.8 feet, ZONE). BEN BARRETT MAKES IT! Assist: Giannis Ginobili
Score: 24-21

[03:01] Team_092 possession (Score: 24-21)
Austin Bridges throws a bad pass out of bounds! TURNOVER! (dead ball)

[03:01] Substitution (Team_092): Austin Bridges OUT → Bones Giddey IN (stamina_rule2)

[03:01] Substitution (Team_092): John Giddey OUT → Shaquille Paul IN (stamina_rule2)

[03:01] Substitution (Team_016): Collin Barnes OUT → Lamelo Herro IN (stamina_rule2)

[02:44] Team_016 possession (Score: 24-21)
Lamelo Herro commits a violation (traveling/carry)! TURNOVER! (dead ball)

[02:44] Substitution (Team_092): Karl Gobert OUT → Shaquille Russell IN (stamina_rule2)

[02:44] Substitution (Team_016): Ben Barrett OUT → Giannis Doncic IN (stamina_rule2)

[02:44] Substitution (Team_016): Vince Duncan OUT → Trae Barnes IN (stamina_rule2)

[02:30] Team_092 possession (Score: 24-21)
Paul James makes the Layup and draws the foul on Vince Quickley! And-1! Paul James to the line for 1. [BONUS: 9 team fouls] (Vince Quickley: 3 personal fouls)   FT 1/1: GOOD Paul James makes 1/1 from the line.
Score: 27-21

[02:13] Team_016 possession (Score: 27-21)
Trae Barnes drives, Immanuel Ingram stays with him. Trae Barnes attempts a Dunk. Heavily contested by Immanuel Ingram (1.2 feet, MAN)! Trae Barnes misses. FOUL! Loose ball foul on Paul James during the rebound battle. [Team fouls: 4] No free throws, side out. (Paul James: 1 personal fouls)

[02:01] Team_016 possession (Score: 27-21)
Lamelo Herro attempts a Midrange. Wide open! Bones Giddey is 9.2 feet away. [MAN] Lamelo Herro misses. Rebound secured by Paul James.

[01:46] Team_092 possession (Score: 27-21)
Bones Giddey makes the Dunk and draws the foul on Vince Quickley! And-1! Bones Giddey to the line for 1. [BONUS: 10 team fouls] (Vince Quickley: 4 personal fouls)   FT 1/1: GOOD Bones Giddey makes 1/1 from the line.
Score: 30-21

[01:32] Team_016 possession (Score: 30-21)
FOUL! Reach-in foul on Shaquille Paul during the drive. [IN THE BONUS! 5 team fouls] Vince Quickley to the line for 2 free throws. (Shaquille Paul: 1 personal fouls)   FT 1/2: GOOD   FT 2/2: MISS Vince Quickley makes 1/2 from the line. Rebound secured by Paul James.
Score: 30-22

[01:16] Team_092 possession (Score: 30-22)
Paul James attempts a Midrange. Contested by Vince Quickley (4.2 feet, MAN). Paul James misses. Offensive rebound by Paul James! Paul James kicks it out.

[01:02] Team_092 possession (Score: 30-22)
Immanuel Ingram drives, Trae Barnes stays with him. Immanuel Ingram attempts a Layup. Contested by Trae Barnes (4.0 feet, MAN). IMMANUEL INGRAM MAKES IT! Assist: Shaquille Russell
Score: 32-22

[00:48] Team_016 possession (Score: 32-22)
Vince Quickley attempts a Layup. BLOCKED BY PAUL JAMES! Ball goes out off Paul James. Vince Quickley's ball!

[00:33] Team_016 possession (Score: 32-22)
FOUL! Shooting foul on Immanuel Ingram. Trae Barnes to the line for 2 free throws. [BONUS: 6 team fouls] (Immanuel Ingram: 2 personal fouls)   FT 1/2: GOOD   FT 2/2: MISS Trae Barnes makes 1/2 from the line. Rebound secured by Immanuel Ingram.
Score: 32-23

[00:18] Team_092 possession (Score: 32-23)
Bones Giddey commits a violation (traveling/carry)! TURNOVER! (dead ball)

[00:18] Substitution (Team_092): Paul James OUT → Vince Harris IN (stamina_rule2)

[00:18] Substitution (Team_092): Immanuel Ingram OUT → Pau Reaves IN (stamina_rule2)

[00:18] Substitution (Team_016): Giannis Ginobili OUT → Immanuel Nowitzki IN (stamina_rule2)

[00:18] Substitution (Team_016): Vince Quickley OUT → Kevin Butler IN (stamina_rule2)

[00:01] Team_016 possession (Score: 32-23)
Giannis Doncic attempts a Midrange. Contested by Shaquille Paul (4.0 feet, ZONE). Giannis Doncic misses. Rebound secured by Shaquille Paul.

================================================================================
                              1ST QUARTER COMPLETE                              
================================================================================

1ST QUARTER SCORE: Team_092 32, Team_016 23

BOX SCORE:
================================================================================

Team_092
--------------------------------------------------------------------------------
Player                MIN  PTS  REB  AST  TO      FG   FG%      3P   3P%
--------------------------------------------------------------------------------
Paul James             12    8    6    0   0   3/5    60.0     0/0   0.0
Karl Gobert            10    8    0    0   0   3/3   100.0     0/0   0.0
Austin Bridges          9    6    0    2   0   2/3    66.7     0/0   0.0
Immanuel Ingram        12    5    3    1   0   3/4    75.0     0/0   0.0
Bones Giddey            3    3    0    0   0   1/1   100.0     0/0   0.0
John Giddey             9    2    4    1   0   1/1   100.0     0/0   0.0
Shaquille Russell       3    0    0    1   0   0/0     0.0     0/0   0.0
Shaquille Paul          3    0    1    0   0   0/0     0.0     0/0   0.0

TEAM: FG: 13/17 (76.5%), 3PT: 5/7 (71.4%), REB: 14 (2 off, 12 def), AST: 5, TO: 5
TEAM FOULS: 6 [Team_016 in BONUS]


Team_016
--------------------------------------------------------------------------------
Player                MIN  PTS  REB  AST  TO      FG   FG%      3P   3P%
--------------------------------------------------------------------------------
Vince Quickley         12   11    1    0   0   4/8    50.0     0/0   0.0
Ben Barrett            10    6    3    3   0   2/4    50.0     0/0   0.0
Giannis Ginobili       12    2    0    1   0   1/3    33.3     0/0   0.0
Vince Duncan           10    0    2    1   0   0/0     0.0     0/0   0.0
Collin Barnes           9    0    0    0   0   0/1     0.0     0/0   0.0
Lamelo Herro            3    0    0    0   0   0/1     0.0     0/0   0.0
Trae Barnes             3    0    0    0   0   0/1     0.0     0/0   0.0
Giannis Doncic          3    0    0    0   0   0/1     0.0     0/0   0.0

TEAM: FG: 7/19 (36.8%), 3PT: 3/9 (33.3%), REB: 6 (2 off, 4 def), AST: 5, TO: 3
TEAM FOULS: 10 [Team_092 in BONUS]

================================================================================

================================================================================
                       2ND QUARTER - Team_092 vs Team_016                       
================================================================================

[12:00] Team_092 possession (Score: 32-23)
Immanuel Ingram attempts a Layup. BLOCKED BY VINCE DUNCAN! Ball is loose! Offensive rebound by John Giddey! John Giddey kicks it out.

[11:42] Team_092 possession (Score: 32-23)
John Giddey attempts a Midrange. Contested by Ben Barrett (2.4 feet, ZONE). John Giddey misses. Rebound secured by Vince Duncan.

[11:32] Team_016 possession (Score: 32-23)
Vince Quickley attempts a Midrange. Contested by John Giddey (5.1 feet, ZONE). Vince Quickley misses. Offensive rebound by Ben Barrett! Ben Barrett puts it back in!
Score: 32-25

[11:17] Team_092 possession (Score: 32-25)
Paul James attempts a Midrange. Contested by Vince Duncan (5.2 feet, ZONE). PAUL JAMES MAKES IT! Assist: Karl Gobert
Score: 34-25

[11:03] Team_016 possession (Score: 34-25)
FOUL! Shooting foul on Paul James. Vince Quickley to the line for 2 free throws. [Team fouls: 1] (Paul James: 1 personal fouls)   FT 1/2: GOOD   FT 2/2: GOOD Vince Quickley makes 2/2 from the line.
Score: 34-27

[10:52] Team_092 possession (Score: 34-27)
John Giddey drives, Ben Barrett stays with him. John Giddey attempts a Layup. Contested by Ben Barrett (2.4 feet, MAN). JOHN GIDDEY MAKES IT!
Score: 36-27

[10:35] Team_016 possession (Score: 36-27)
Vince Quickley makes the Layup and draws the foul on Paul James! And-1! Vince Quickley to the line for 1. [Team fouls: 2] (Paul James: 2 personal fouls)   FT 1/1: GOOD Vince Quickley makes 1/1 from the line.
Score: 36-30

[10:22] Team_092 possession (Score: 36-30)
Paul James attempts a Layup. BLOCKED BY VINCE DUNCAN! Ball is loose! Rebound secured by Ben Barrett.

[10:06] Team_016 possession (Score: 36-30)
Collin Barnes makes the Layup and draws the foul on John Giddey! And-1! Collin Barnes to the line for 1. [Team fouls: 3] (John Giddey: 1 personal fouls)   FT 1/1: GOOD Collin Barnes makes 1/1 from the line.
Score: 36-33

[09:52] Team_092 possession (Score: 36-33)
Immanuel Ingram drives to the basket... Immanuel Ingram throws a bad pass out of bounds! TURNOVER! (dead ball)

[09:52] Substitution (Team_092): Paul James OUT → Vince Harris IN (stamina_rule2)

[09:52] Substitution (Team_092): Immanuel Ingram OUT → Pau Reaves IN (stamina_rule2)

[09:52] Substitution (Team_016): Giannis Ginobili OUT → Immanuel Nowitzki IN (stamina_rule2)

[09:52] Substitution (Team_016): Vince Quickley OUT → Kevin Butler IN (stamina_rule2)

[09:34] Team_016 possession (Score: 36-33)
Collin Barnes attempts a 3Pt. Contested by Vince Harris (5.7 feet, ZONE). Collin Barnes misses. FOUL! Loose ball foul on Karl Gobert during the rebound battle. [Team fouls: 4] No free throws, side out. (Karl Gobert: 1 personal fouls)

[09:20] Team_016 possession (Score: 36-33)
Ben Barrett attempts a Midrange. Contested by John Giddey (3.0 feet, MAN). BEN BARRETT MAKES IT! Assist: Vince Duncan
Score: 36-35

[09:09] Team_092 possession (Score: 36-35)
Austin Bridges attempts a 3Pt. Contested by Collin Barnes (2.8 feet, MAN). Austin Bridges misses. Rebound secured by Vince Duncan.

[08:53] Team_016 possession (Score: 36-35)
Collin Barnes attempts a Layup. Wide open! Austin Bridges is 7.4 feet away. [MAN] COLLIN BARNES MAKES IT!
Score: 36-37

[08:41] Team_092 possession (Score: 36-37)
John Giddey attempts a 3Pt. Contested by Collin Barnes (4.3 feet, ZONE). John Giddey misses. Rebound secured by Vince Duncan.

[08:24] Team_016 possession (Score: 36-37)
Ben Barrett attempts a Midrange. Wide open! John Giddey is 6.0 feet away. [MAN] BEN BARRETT MAKES IT! Assist: Vince Duncan
Score: 36-39

[08:08] Team_092 possession (Score: 36-39)
John Giddey drives and kicks out. Vince Harris attempts a 3Pt. Contested by Collin Barnes (4.9 feet, ZONE). Vince Harris misses. Rebound secured by Immanuel Nowitzki.

[07:51] Team_016 possession (Score: 36-39)
Vince Duncan drives and kicks out. Vince Duncan attempts a 3Pt. Contested by Vince Harris (5.8 feet, ZONE). Vince Duncan misses. Offensive rebound by Ben Barrett! Ben Barrett's putback is no good. Rebound secured by Karl Gobert.

[07:38] Team_092 possession (Score: 36-39)
Karl Gobert throws a bad pass! Stolen by Immanuel Nowitzki! TURNOVER! (live ball)

[07:24] Team_016 possession (Score: 36-39)
Kevin Butler drives to the basket... Kevin Butler loses control! Ball rolls out of bounds! TURNOVER! (dead ball)

[07:24] Substitution (Team_092): Austin Bridges OUT → Bones Giddey IN (stamina_rule2)

[07:24] Substitution (Team_092): Karl Gobert OUT → Shaquille Russell IN (stamina_rule2)

[07:24] Substitution (Team_092): John Giddey OUT → Shaquille Paul IN (stamina_rule2)

[07:24] Substitution (Team_016): Collin Barnes OUT → Lamelo Herro IN (stamina_rule2)

[07:24] Substitution (Team_016): Ben Barrett OUT → Giannis Doncic IN (stamina_rule2)

[07:24] Substitution (Team_016): Vince Duncan OUT → Trae Barnes IN (stamina_rule2)

[07:06] Team_092 possession (Score: 36-39)
Vince Harris throws a bad pass! Stolen by Kevin Butler! TURNOVER! (live ball)

[06:53] Team_016 possession (Score: 36-39)
Kevin Butler throws a bad pass! Stolen by Vince Harris! TURNOVER! (live ball)

[06:38] Team_092 possession (Score: 36-39)
Shaquille Paul throws a bad pass! Stolen by Giannis Doncic! TURNOVER! (live ball)

[06:27] Team_016 possession (Score: 36-39)
FOUL! Holding foul on Shaquille Russell. [IN THE BONUS! 5 team fouls] Immanuel Nowitzki to the line for 2 free throws. (Shaquille Russell: 1 personal fouls)   FT 1/2: MISS   FT 2/2: GOOD Immanuel Nowitzki makes 1/2 from the line.
Score: 36-40

[06:15] Team_092 possession (Score: 36-40)
FOUL! Holding foul on Giannis Doncic. [Team fouls: 1] No free throws, side out. (Giannis Doncic: 1 personal fouls)

[06:06] Team_092 possession (Score: 36-40)
Bones Giddey attempts a Midrange. Heavily contested by Kevin Butler (1.1 feet, ZONE)! BONES GIDDEY MAKES IT!
Score: 38-40

[05:48] Team_016 possession (Score: 38-40)
Giannis Doncic makes the Dunk and draws the foul on Shaquille Russell! And-1! Giannis Doncic to the line for 1. [BONUS: 6 team fouls] (Shaquille Russell: 2 personal fouls)   FT 1/1: GOOD Giannis Doncic makes 1/1 from the line.
Score: 38-43

[05:36] Team_092 possession (Score: 38-43)
Pau Reaves attempts a Midrange. Heavily contested by Giannis Doncic (1.8 feet, ZONE)! PAU REAVES MAKES IT! Assist: Bones Giddey
Score: 40-43

[05:24] Team_016 possession (Score: 40-43)
Kevin Butler loses the ball! Stripped by Vince Harris! TURNOVER! (live ball)

[05:10] Team_092 possession (Score: 40-43)
Shaquille Paul attempts a 3Pt. Contested by Giannis Doncic (4.7 feet, MAN). Shaquille Paul misses. Rebound secured by Lamelo Herro.

[05:00] Team_016 possession (Score: 40-43)
Immanuel Nowitzki throws a bad pass out of bounds! TURNOVER! (dead ball)

[04:48] Team_092 possession (Score: 40-43)
Vince Harris attempts a Layup. Contested by Kevin Butler (4.9 feet, MAN). VINCE HARRIS MAKES IT! Assist: Bones Giddey
Score: 42-43

[04:33] Team_016 possession (Score: 42-43)
Kevin Butler attempts a 3Pt. Contested by Vince Harris (3.0 feet, ZONE). Kevin Butler misses. Rebound secured by Shaquille Russell.

[04:14] Team_092 possession (Score: 42-43)
Pau Reaves drives, Trae Barnes stays with him. Pau Reaves attempts a Dunk. Wide open! Trae Barnes is 6.3 feet away. [MAN] PAU REAVES MAKES IT! Assist: Vince Harris
Score: 44-43

[03:58] Team_016 possession (Score: 44-43)
Kevin Butler drives, Vince Harris stays with him. Kevin Butler attempts a Layup. Heavily contested by Vince Harris (1.7 feet, MAN)! Kevin Butler misses. FOUL! Loose ball foul on Pau Reaves during the rebound battle. [IN THE BONUS! 7 team fouls] Trae Barnes to the line for 2 free throws. (Pau Reaves: 1 personal fouls)   FT 1/2: GOOD   FT 2/2: GOOD Trae Barnes makes 2/2 from the line.
Score: 44-45

[03:40] Team_092 possession (Score: 44-45)
Bones Giddey throws a bad pass out of bounds! TURNOVER! (dead ball)

[03:24] Team_016 possession (Score: 44-45)
Kevin Butler loses control! Ball rolls out of bounds! TURNOVER! (dead ball)

[03:12] Team_092 possession (Score: 44-45)
Pau Reaves attempts a Midrange. Contested by Lamelo Herro (5.4 feet, ZONE). Pau Reaves misses. Rebound secured by Trae Barnes.

[02:54] Team_016 possession (Score: 44-45)
Lamelo Herro attempts a Midrange. Contested by Shaquille Paul (5.8 feet, ZONE). Lamelo Herro misses. Rebound secured by Shaquille Russell.

[02:39] Team_092 possession (Score: 44-45)
Vince Harris makes the 3Pt and draws the foul on Kevin Butler! And-1! Vince Harris to the line for 1. [Team fouls: 2] (Kevin Butler: 1 personal fouls)   FT 1/1: GOOD Vince Harris makes 1/1 from the line.
Score: 48-45

[02:22] Team_016 possession (Score: 48-45)
Giannis Doncic attempts a 3Pt. Contested by Shaquille Paul (2.5 feet, MAN). Giannis Doncic misses. FOUL! Loose ball foul on Pau Reaves during the rebound battle. [IN THE BONUS! 8 team fouls] Trae Barnes to the line for 2 free throws. (Pau Reaves: 2 personal fouls)   FT 1/2: GOOD   FT 2/2: GOOD Trae Barnes makes 2/2 from the line.
Score: 48-47

[02:09] Team_092 possession (Score: 48-47)
Vince Harris attempts a 3Pt. Contested by Kevin Butler (4.9 feet, MAN). Vince Harris misses. Rebound secured by Lamelo Herro.

[01:56] Team_016 possession (Score: 48-47)
Kevin Butler drives, Pau Reaves stays with him. Kevin Butler attempts a Layup. Contested by Pau Reaves (3.1 feet, ZONE). Kevin Butler misses. Rebound secured by Shaquille Paul.

[01:41] Team_092 possession (Score: 48-47)
Shaquille Russell drives and kicks out. Shaquille Russell makes the Midrange and draws the foul on Giannis Doncic! And-1! Shaquille Russell to the line for 1. [Team fouls: 3] (Giannis Doncic: 2 personal fouls)   FT 1/1: GOOD Shaquille Russell makes 1/1 from the line.
Score: 51-47

[01:25] Team_016 possession (Score: 51-47)
FOUL! Shooting foul on Vince Harris. Immanuel Nowitzki to the line for 2 free throws. [BONUS: 9 team fouls] (Vince Harris: 1 personal fouls)   FT 1/2: GOOD   FT 2/2: GOOD Immanuel Nowitzki makes 2/2 from the line.
Score: 51-49

[01:15] Team_092 possession (Score: 51-49)
Vince Harris attempts a Layup. Contested by Kevin Butler (4.6 feet, MAN). VINCE HARRIS MAKES IT!
Score: 53-49

[01:04] Team_016 possession (Score: 53-49)
Giannis Doncic attempts a Layup. Contested by Shaquille Paul (2.0 feet, MAN). Giannis Doncic misses. Rebound secured by Pau Reaves.

[00:52] Team_092 possession (Score: 53-49)
Pau Reaves attempts a Midrange. Contested by Immanuel Nowitzki (5.4 feet, ZONE). PAU REAVES MAKES IT!
Score: 55-49

[00:40] Team_016 possession (Score: 55-49)
FOUL! Shooting foul on Shaquille Russell. Giannis Doncic to the line for 2 free throws. [BONUS: 10 team fouls] (Shaquille Russell: 3 personal fouls)   FT 1/2: GOOD   FT 2/2: GOOD Giannis Doncic makes 2/2 from the line.
Score: 55-51

[00:25] Team_092 possession (Score: 55-51)
Pau Reaves attempts a Midrange. Wide open! Trae Barnes is 6.0 feet away. [MAN] Pau Reaves misses. Rebound secured by Lamelo Herro.

[00:16] Team_016 possession (Score: 55-51)
Giannis Doncic drives and kicks out. FOUL! Shooting foul on Pau Reaves. Trae Barnes to the line for 2 free throws. [BONUS: 11 team fouls] (Pau Reaves: 3 personal fouls)   FT 1/2: GOOD   FT 2/2: MISS Trae Barnes makes 1/2 from the line. Rebound secured by Shaquille Paul.
Score: 55-52

[00:04] Team_092 possession (Score: 55-52)
Pau Reaves drives and kicks out. Shaquille Paul attempts a Midrange. Contested by Giannis Doncic (3.4 feet, MAN). Shaquille Paul misses. Offensive rebound by Pau Reaves! Pau Reaves kicks it out.

================================================================================
                              2ND QUARTER COMPLETE                              
================================================================================

2ND QUARTER SCORE: Team_092 23, Team_016 29

BOX SCORE:
================================================================================

Team_092
--------------------------------------------------------------------------------
Player                MIN  PTS  REB  AST  TO      FG   FG%      3P   3P%
--------------------------------------------------------------------------------
Vince Harris           10    8    0    1   0   3/4    75.0     0/0   0.0
Pau Reaves             10    6    2    0   0   3/5    60.0     0/0   0.0
Shaquille Russell      10    3    2    0   0   1/1   100.0     0/0   0.0
John Giddey            14    2    1    0   0   1/4    25.0     0/0   0.0
Paul James             14    2    0    0   0   1/2    50.0     0/0   0.0
Bones Giddey           10    2    0    2   0   1/1   100.0     0/0   0.0
Austin Bridges         14    0    0    0   0   0/1     0.0     0/0   0.0
Shaquille Paul         10    0    2    0   0   0/1     0.0     0/0   0.0

TEAM: FG: 10/19 (52.6%), 3PT: 1/5 (20.0%), REB: 7 (2 off, 5 def), AST: 4, TO: 5
TEAM FOULS: 11 [Team_016 in BONUS]


Team_016
--------------------------------------------------------------------------------
Player                MIN  PTS  REB  AST  TO      FG   FG%      3P   3P%
--------------------------------------------------------------------------------
Ben Barrett            14    6    2    0   0   3/3   100.0     0/0   0.0
Vince Quickley         14    5    0    0   0   2/2   100.0     0/0   0.0
Collin Barnes          14    5    0    0   0   2/2   100.0     0/0   0.0
Giannis Doncic         10    5    0    0   0   2/4    50.0     0/0   0.0
Trae Barnes            10    4    1    0   0   2/2   100.0     0/0   0.0
Immanuel Nowitzki      10    3    1    0   0   2/2   100.0     0/0   0.0
Vince Duncan           14    0    4    2   0   0/1     0.0     0/0   0.0
Karl Gobert            14    0    1    1   0   0/0     0.0     0/0   0.0
Lamelo Herro           10    0    3    0   0   0/1     0.0     0/0   0.0
Kevin Butler           10    0    0    0   0   0/2     0.0     0/0   0.0

TEAM: FG: 13/19 (68.4%), 3PT: 1/2 (50.0%), REB: 12 (3 off, 9 def), AST: 2, TO: 5
TEAM FOULS: 3

================================================================================

================================================================================
                       3RD QUARTER - Team_092 vs Team_016                       
================================================================================

[12:00] Team_092 possession (Score: 55-52)
Immanuel Ingram attempts a Layup. Heavily contested by Vince Duncan (0.5 feet, MAN)! IMMANUEL INGRAM MAKES IT!
Score: 57-52

[11:50] Team_016 possession (Score: 57-52)
Ben Barrett drives and kicks out. Giannis Ginobili attempts a Midrange. Contested by Karl Gobert (5.5 feet, ZONE). GIANNIS GINOBILI MAKES IT!
Score: 57-54

[11:38] Team_092 possession (Score: 57-54)
FOUL! Shooting foul on Vince Quickley. Paul James to the line for 2 free throws. [Team fouls: 1] (Vince Quickley: 1 personal fouls)   FT 1/2: MISS   FT 2/2: GOOD Paul James makes 1/2 from the line.
Score: 58-54

[11:27] Team_016 possession (Score: 58-54)
Vince Duncan attempts a Midrange. Contested by Immanuel Ingram (4.7 feet, MAN). VINCE DUNCAN MAKES IT! Assist: Giannis Ginobili
Score: 58-56

[11:15] Team_092 possession (Score: 58-56)
John Giddey drives, picks up Vince Duncan. Help arrives from Collin Barnes! John Giddey attempts a Dunk. Heavily contested by Collin Barnes (0.5 feet, ZONE)! John Giddey misses. Rebound secured by Vince Duncan.

[11:01] Team_016 possession (Score: 58-56)
FOUL! Shooting foul on Austin Bridges. Ben Barrett to the line for 2 free throws. [Team fouls: 1] (Austin Bridges: 1 personal fouls)   FT 1/2: GOOD   FT 2/2: GOOD Ben Barrett makes 2/2 from the line.
Score: 58-58

[10:49] Team_092 possession (Score: 58-58)
Austin Bridges attempts a Layup. BLOCKED BY VINCE DUNCAN! Ball is loose! Rebound secured by Ben Barrett.

[10:38] Team_016 possession (Score: 58-58)
FOUL! Reach-in foul on Immanuel Ingram during the drive. [Team fouls: 2] No free throws, side out. (Immanuel Ingram: 1 personal fouls)

[10:29] Team_016 possession (Score: 58-58)
Vince Quickley makes the Layup and draws the foul on Paul James! And-1! Vince Quickley to the line for 1. [Team fouls: 3] (Paul James: 1 personal fouls)   FT 1/1: GOOD Vince Quickley makes 1/1 from the line.
Score: 58-61

[10:10] Team_092 possession (Score: 58-61)
Austin Bridges attempts a Midrange. Contested by Collin Barnes (3.5 feet, MAN). AUSTIN BRIDGES MAKES IT!
Score: 60-61

[09:57] Team_016 possession (Score: 60-61)
Vince Duncan attempts a 3Pt. Contested by John Giddey (3.9 feet, ZONE). Vince Duncan misses. Offensive rebound by Vince Duncan! Vince Duncan puts it back in!
Score: 60-63

[09:45] Team_092 possession (Score: 60-63)
Immanuel Ingram attempts a 3Pt. Contested by Collin Barnes (4.0 feet, ZONE). IMMANUEL INGRAM MAKES IT! Assist: Karl Gobert
Score: 63-63

[09:35] Team_016 possession (Score: 63-63)
FOUL! Reach-in foul on John Giddey during the drive. [Team fouls: 4] No free throws, side out. (John Giddey: 1 personal fouls)

[09:20] Team_016 possession (Score: 63-63)
Collin Barnes throws a bad pass! Stolen by Austin Bridges! TURNOVER! (live ball)

[09:06] Team_092 possession (Score: 63-63)
Paul James throws a bad pass out of bounds! TURNOVER! (dead ball)

[08:51] Team_016 possession (Score: 63-63)
Vince Quickley attempts a 3Pt. Contested by Paul James (3.7 feet, MAN). Vince Quickley misses. Offensive rebound by Vince Duncan! Vince Duncan puts it back in!
Score: 63-65

[08:39] Team_092 possession (Score: 63-65)
Austin Bridges attempts a Midrange. Contested by Collin Barnes (3.7 feet, MAN). Austin Bridges misses. Offensive rebound by Paul James! Paul James kicks it out.

[08:26] Team_092 possession (Score: 63-65)
John Giddey attempts a Midrange. Contested by Vince Quickley (5.2 feet, ZONE). John Giddey misses. Rebound secured by Vince Duncan.

[08:11] Team_016 possession (Score: 63-65)
Vince Quickley attempts a 3Pt. Contested by Paul James (4.4 feet, ZONE). Vince Quickley misses. Rebound secured by John Giddey.

[07:57] Team_092 possession (Score: 63-65)
Karl Gobert attempts a 3Pt. Contested by Collin Barnes (3.6 feet, ZONE). KARL GOBERT MAKES IT! Assist: John Giddey
Score: 66-65

[07:41] Team_016 possession (Score: 66-65)
Giannis Ginobili loses control! Ball rolls out of bounds! TURNOVER! (dead ball)

[07:24] Team_092 possession (Score: 66-65)
John Giddey attempts a 3Pt. Wide open! Ben Barrett is 6.5 feet away. [MAN] JOHN GIDDEY MAKES IT! Assist: Austin Bridges
Score: 69-65

[07:12] Team_016 possession (Score: 69-65)
Vince Duncan drives and kicks out. Giannis Ginobili attempts a 3Pt. Contested by Karl Gobert (3.6 feet, MAN). GIANNIS GINOBILI MAKES IT! Assist: Ben Barrett
Score: 69-68

[06:56] Team_092 possession (Score: 69-68)
Paul James drives, picks up Vince Duncan. Help arrives from Collin Barnes! Paul James attempts a Layup. Contested by Collin Barnes (5.1 feet, ZONE). PAUL JAMES MAKES IT! Assist: John Giddey
Score: 71-68

[06:38] Team_016 possession (Score: 71-68)
Vince Quickley attempts a 3Pt. Contested by John Giddey (3.6 feet, ZONE). Vince Quickley misses. Rebound secured by John Giddey.

[06:20] Team_092 possession (Score: 71-68)
Immanuel Ingram drives to the basket... Immanuel Ingram loses control! Ball rolls out of bounds! TURNOVER! (dead ball)

[06:07] Team_016 possession (Score: 71-68)
Collin Barnes commits a violation (traveling/carry)! TURNOVER! (dead ball)

[05:52] Team_092 possession (Score: 71-68)
John Giddey attempts a 3Pt. Contested by Collin Barnes (4.3 feet, ZONE). JOHN GIDDEY MAKES IT! Assist: Paul James
Score: 74-68

[05:40] Team_016 possession (Score: 74-68)
Ben Barrett attempts a Midrange. Contested by John Giddey (6.0 feet, MAN). BEN BARRETT MAKES IT!
Score: 74-70

[05:25] Team_092 possession (Score: 74-70)
Paul James attempts a Midrange. Contested by Vince Quickley (5.7 feet, MAN). Paul James misses. Rebound secured by Vince Duncan.

[05:12] Team_016 possession (Score: 74-70)
Ben Barrett attempts a Layup. Contested by John Giddey (5.6 feet, MAN). BEN BARRETT MAKES IT! Assist: Giannis Ginobili
Score: 74-72

[04:57] Team_092 possession (Score: 74-72)
John Giddey attempts a Layup. Heavily contested by Ben Barrett (0.5 feet, MAN)! John Giddey misses. Offensive rebound by Paul James! Paul James kicks it out.

[04:41] Team_092 possession (Score: 74-72)
Austin Bridges drives to the basket... Austin Bridges throws a bad pass out of bounds! TURNOVER! (dead ball)

[04:27] Team_016 possession (Score: 74-72)
Vince Quickley makes the Dunk and draws the foul on Austin Bridges! And-1! Vince Quickley to the line for 1. [BONUS: 5 team fouls] (Austin Bridges: 2 personal fouls)   FT 1/1: MISS Vince Quickley makes 0/1 from the line. Rebound secured by John Giddey.
Score: 74-74

[04:16] Team_092 possession (Score: 74-74)
John Giddey makes the Layup and draws the foul on Ben Barrett! And-1! John Giddey to the line for 1. [Team fouls: 2] (Ben Barrett: 1 personal fouls)   FT 1/1: GOOD John Giddey makes 1/1 from the line.
Score: 77-74

[04:03] Team_016 possession (Score: 77-74)
Vince Quickley attempts a 3Pt. Wide open! John Giddey is 6.5 feet away. [ZONE] Vince Quickley misses. Rebound secured by John Giddey.

[03:50] Team_092 possession (Score: 77-74)
John Giddey attempts a Midrange. Contested by Ben Barrett (4.9 feet, MAN). JOHN GIDDEY MAKES IT! Assist: Austin Bridges
Score: 79-74

[03:32] Team_016 possession (Score: 79-74)
Giannis Ginobili drives, John Giddey stays with him. Giannis Ginobili attempts a Dunk. Contested by John Giddey (3.6 feet, ZONE). GIANNIS GINOBILI MAKES IT! Assist: Vince Quickley
Score: 79-76

[03:16] Team_092 possession (Score: 79-76)
Karl Gobert attempts a Midrange. Contested by Vince Quickley (4.2 feet, ZONE). Karl Gobert misses. Rebound secured by Vince Quickley.

[03:01] Team_016 possession (Score: 79-76)
Vince Duncan attempts a Midrange. Wide open! John Giddey is 6.2 feet away. [ZONE] VINCE DUNCAN MAKES IT! Assist: Giannis Ginobili
Score: 79-78

[02:52] Team_092 possession (Score: 79-78)
Paul James drives, picks up Vince Quickley. Help arrives from Collin Barnes! Paul James attempts a Dunk. Contested by Collin Barnes (5.5 feet, MAN). Paul James misses. Offensive rebound by John Giddey! John Giddey kicks it out.

[02:33] Team_092 possession (Score: 79-78)
Paul James attempts a Midrange. Wide open! Vince Quickley is 7.0 feet away. [MAN] PAUL JAMES MAKES IT! Assist: Immanuel Ingram
Score: 81-78

[02:19] Team_016 possession (Score: 81-78)
Giannis Ginobili attempts a Layup. Contested by John Giddey (2.2 feet, ZONE). GIANNIS GINOBILI MAKES IT! Assist: Vince Quickley
Score: 81-80

[02:03] Team_092 possession (Score: 81-80)
Immanuel Ingram attempts a 3Pt. Heavily contested by Vince Duncan (0.6 feet, MAN)! Immanuel Ingram misses. Rebound secured by Vince Duncan.

[01:49] Team_016 possession (Score: 81-80)
Collin Barnes attempts a 3Pt. Contested by John Giddey (5.2 feet, ZONE). COLLIN BARNES MAKES IT! Assist: Giannis Ginobili
Score: 81-83

[01:34] Team_092 possession (Score: 81-83)
Austin Bridges drives, picks up Vince Duncan. Help arrives from Collin Barnes! Austin Bridges attempts a Dunk. Heavily contested by Collin Barnes (2.0 feet, ZONE)! AUSTIN BRIDGES MAKES IT! Assist: Paul James
Score: 83-83

[01:18] Team_016 possession (Score: 83-83)
Vince Duncan attempts a Layup. Contested by John Giddey (3.4 feet, ZONE). VINCE DUNCAN MAKES IT! Assist: Vince Quickley
Score: 83-85

[01:04] Team_092 possession (Score: 83-85)
FOUL! Shooting foul on Vince Duncan. John Giddey to the line for 2 free throws. [Team fouls: 3] (Vince Duncan: 1 personal fouls)   FT 1/2: GOOD   FT 2/2: GOOD John Giddey makes 2/2 from the line.
Score: 85-85

[00:53] Team_016 possession (Score: 85-85)
Ben Barrett drives, John Giddey stays with him. Ben Barrett attempts a Dunk. Contested by John Giddey (2.4 feet, ZONE). BEN BARRETT MAKES IT! Assist: Vince Quickley
Score: 85-87

[00:41] Team_092 possession (Score: 85-87)
Paul James attempts a Midrange. Wide open! Giannis Ginobili is 7.4 feet away. [ZONE] PAUL JAMES MAKES IT! Assist: John Giddey
Score: 87-87

[00:24] Team_016 possession (Score: 87-87)
Vince Quickley attempts a Midrange. Wide open! Karl Gobert is 7.3 feet away. [ZONE] VINCE QUICKLEY MAKES IT! Assist: Vince Duncan
Score: 87-89

[00:04] Team_092 possession (Score: 87-89)
Austin Bridges attempts a 3Pt. Contested by Collin Barnes (2.6 feet, ZONE). Austin Bridges misses. Offensive rebound by John Giddey! John Giddey kicks it out.

================================================================================
                              3RD QUARTER COMPLETE                              
================================================================================

3RD QUARTER SCORE: Team_092 32, Team_016 37

BOX SCORE:
================================================================================

Team_092
--------------------------------------------------------------------------------
Player                MIN  PTS  REB  AST  TO      FG   FG%      3P   3P%
--------------------------------------------------------------------------------
John Giddey            26   13    6    3   0   5/7    71.4     0/0   0.0
Paul James             27    7    2    2   0   4/5    80.0     0/0   0.0
Immanuel Ingram        27    5    0    1   0   2/3    66.7     0/0   0.0
Austin Bridges         26    4    0    2   0   2/3    66.7     0/0   0.0
Karl Gobert            27    3    0    1   0   1/2    50.0     0/0   0.0

TEAM: FG: 14/20 (70.0%), 3PT: 4/5 (80.0%), REB: 8 (4 off, 4 def), AST: 9, TO: 3
TEAM FOULS: 5 [Team_016 in BONUS]


Team_016
--------------------------------------------------------------------------------
Player                MIN  PTS  REB  AST  TO      FG   FG%      3P   3P%
--------------------------------------------------------------------------------
Vince Duncan           27   10    6    1   0   5/5   100.0     0/0   0.0
Giannis Ginobili       27    9    0    4   0   4/4   100.0     0/0   0.0
Ben Barrett            27    8    1    1   0   4/4   100.0     0/0   0.0
Vince Quickley         27    5    1    4   0   2/6    33.3     0/0   0.0
Collin Barnes          26    3    0    0   0   1/1   100.0     0/0   0.0

TEAM: FG: 16/20 (80.0%), 3PT: 3/6 (50.0%), REB: 8 (2 off, 6 def), AST: 10, TO: 3
TEAM FOULS: 3

================================================================================

================================================================================
                       4TH QUARTER - Team_092 vs Team_016                       
================================================================================

[12:00] Team_092 possession (Score: 87-89)
Karl Gobert attempts a Layup. Wide open! Giannis Ginobili is 6.5 feet away. [MAN] KARL GOBERT MAKES IT! Assist: John Giddey
Score: 89-89

[11:48] Team_016 possession (Score: 89-89)
Vince Duncan drives and kicks out. Vince Quickley attempts a Midrange. Contested by Paul James (4.8 feet, MAN). VINCE QUICKLEY MAKES IT! Assist: Giannis Ginobili
Score: 89-91

[11:33] Team_092 possession (Score: 89-91)
Karl Gobert attempts a Midrange. Contested by Giannis Ginobili (4.2 feet, MAN). KARL GOBERT MAKES IT! Assist: John Giddey
Score: 91-91

[11:15] Team_016 possession (Score: 91-91)
Giannis Ginobili loses control! Ball rolls out of bounds! TURNOVER! (dead ball)

[11:15] Substitution (Team_092): Austin Bridges OUT → Bones Giddey IN (stamina_rule2)

[11:15] Substitution (Team_092): Karl Gobert OUT → Shaquille Russell IN (stamina_rule2)

[11:15] Substitution (Team_092): Paul James OUT → Vince Harris IN (stamina_rule2)

[11:15] Substitution (Team_092): John Giddey OUT → Shaquille Paul IN (stamina_rule2)

[11:15] Substitution (Team_092): Immanuel Ingram OUT → Pau Reaves IN (stamina_rule2)

[11:15] Substitution (Team_016): Collin Barnes OUT → Lamelo Herro IN (stamina_rule2)

[11:15] Substitution (Team_016): Giannis Ginobili OUT → Immanuel Nowitzki IN (stamina_rule2)

[11:15] Substitution (Team_016): Vince Quickley OUT → Kevin Butler IN (stamina_rule2)

[11:15] Substitution (Team_016): Ben Barrett OUT → Giannis Doncic IN (stamina_rule2)

[11:15] Substitution (Team_016): Vince Duncan OUT → Trae Barnes IN (stamina_rule2)

[10:59] Team_092 possession (Score: 91-91)
Shaquille Russell attempts a 3Pt. Contested by Lamelo Herro (3.0 feet, ZONE). Shaquille Russell misses. Rebound secured by Lamelo Herro.

[10:45] Team_016 possession (Score: 91-91)
Immanuel Nowitzki drives, Shaquille Russell stays with him. Immanuel Nowitzki attempts a Layup. Contested by Shaquille Russell (2.2 feet, MAN). IMMANUEL NOWITZKI MAKES IT!
Score: 91-93

[10:32] Team_092 possession (Score: 91-93)
Shaquille Russell attempts a Layup. Contested by Giannis Doncic (5.1 feet, ZONE). Shaquille Russell misses. FOUL! Loose ball foul on Lamelo Herro during the rebound battle. [Team fouls: 1] No free throws, side out. (Lamelo Herro: 1 personal fouls)

[10:14] Team_092 possession (Score: 91-93)
Bones Giddey attempts a Layup. Heavily contested by Lamelo Herro (1.1 feet, MAN)! BONES GIDDEY MAKES IT! Assist: Vince Harris
Score: 93-93

[10:04] Team_016 possession (Score: 93-93)
Immanuel Nowitzki drives, Shaquille Russell stays with him. Immanuel Nowitzki attempts a Layup. Contested by Shaquille Russell (4.7 feet, MAN). Immanuel Nowitzki misses. Rebound secured by Shaquille Paul.

[09:49] Team_092 possession (Score: 93-93)
Pau Reaves makes the Dunk and draws the foul on Lamelo Herro! And-1! Pau Reaves to the line for 1. [Team fouls: 2] (Lamelo Herro: 2 personal fouls)   FT 1/1: GOOD Pau Reaves makes 1/1 from the line.
Score: 96-93

[09:34] Team_016 possession (Score: 96-93)
Kevin Butler attempts a 3Pt. Heavily contested by Vince Harris (1.7 feet, MAN)! Kevin Butler misses. Offensive rebound by Giannis Doncic! Giannis Doncic kicks it out.

[09:21] Team_016 possession (Score: 96-93)
FOUL! Shooting foul on Vince Harris. Lamelo Herro to the line for 3 free throws. [Team fouls: 1] (Vince Harris: 1 personal fouls)   FT 1/3: MISS   FT 2/3: GOOD   FT 3/3: GOOD Lamelo Herro makes 2/3 from the line.
Score: 96-95

[09:04] Team_092 possession (Score: 96-95)
Pau Reaves attempts a Midrange. Contested by Immanuel Nowitzki (5.4 feet, ZONE). PAU REAVES MAKES IT! Assist: Shaquille Russell
Score: 98-95

[08:45] Team_016 possession (Score: 98-95)
Trae Barnes drives and kicks out. Giannis Doncic attempts a 3Pt. Contested by Shaquille Paul (4.5 feet, MAN). GIANNIS DONCIC MAKES IT! Assist: Kevin Butler
Score: 98-98

[08:30] Team_092 possession (Score: 98-98)
FOUL! Shooting foul on Immanuel Nowitzki. Shaquille Russell to the line for 2 free throws. [Team fouls: 3] (Immanuel Nowitzki: 1 personal fouls)   FT 1/2: MISS   FT 2/2: GOOD Shaquille Russell makes 1/2 from the line.
Score: 99-98

[08:15] Team_016 possession (Score: 99-98)
Trae Barnes makes the Midrange and draws the foul on Pau Reaves! And-1! Trae Barnes to the line for 1. [Team fouls: 2] (Pau Reaves: 1 personal fouls)   FT 1/1: GOOD Trae Barnes makes 1/1 from the line.
Score: 99-101

[08:00] Team_092 possession (Score: 99-101)
FOUL! Reach-in foul on Trae Barnes during the drive. [Team fouls: 4] No free throws, side out. (Trae Barnes: 1 personal fouls)

[07:47] Team_092 possession (Score: 99-101)
Pau Reaves makes the Layup and draws the foul on Giannis Doncic! And-1! Pau Reaves to the line for 1. [BONUS: 5 team fouls] (Giannis Doncic: 1 personal fouls)   FT 1/1: GOOD Pau Reaves makes 1/1 from the line.
Score: 102-101

[07:31] Team_016 possession (Score: 102-101)
Immanuel Nowitzki attempts a Midrange. Wide open! Shaquille Paul is 6.9 feet away. [ZONE] Immanuel Nowitzki misses. Offensive rebound by Trae Barnes! Trae Barnes kicks it out.

[07:14] Team_016 possession (Score: 102-101)
Giannis Doncic drives, Pau Reaves stays with him. Giannis Doncic attempts a Dunk. Heavily contested by Pau Reaves (1.1 feet, ZONE)! GIANNIS DONCIC MAKES IT!
Score: 102-103

[07:01] Team_092 possession (Score: 102-103)
Shaquille Russell attempts a 3Pt. Heavily contested by Lamelo Herro (1.6 feet, ZONE)! Shaquille Russell misses. Rebound secured by Lamelo Herro.

[06:47] Team_016 possession (Score: 102-103)
Kevin Butler attempts a Midrange. Heavily contested by Vince Harris (1.3 feet, MAN)! KEVIN BUTLER MAKES IT! Assist: Giannis Doncic
Score: 102-105

[06:33] Team_092 possession (Score: 102-105)
Vince Harris attempts a 3Pt. Contested by Kevin Butler (2.6 feet, MAN). VINCE HARRIS MAKES IT! Assist: Shaquille Paul
Score: 105-105

[06:16] Team_016 possession (Score: 105-105)
Lamelo Herro attempts a 3Pt. Contested by Vince Harris (3.8 feet, ZONE). Lamelo Herro misses. Rebound secured by Shaquille Paul.

[06:02] Team_092 possession (Score: 105-105)
Pau Reaves drives, Trae Barnes stays with him. Pau Reaves attempts a Layup. Wide open! Trae Barnes is 6.9 feet away. [MAN] Pau Reaves misses. Rebound secured by Trae Barnes.

[05:50] Team_016 possession (Score: 105-105)
Immanuel Nowitzki attempts a Midrange. Contested by Shaquille Paul (5.3 feet, ZONE). IMMANUEL NOWITZKI MAKES IT!
Score: 105-107

[05:34] Team_092 possession (Score: 105-107)
Vince Harris attempts a Midrange. Heavily contested by Giannis Doncic (0.5 feet, ZONE)! Vince Harris misses. Rebound secured by Trae Barnes.

[05:19] Team_016 possession (Score: 105-107)
Trae Barnes drives to the basket... Trae Barnes throws a bad pass! Stolen by Pau Reaves! TURNOVER! (live ball)

[05:09] Team_092 possession (Score: 105-107)
FOUL! Shooting foul on Lamelo Herro. Bones Giddey to the line for 3 free throws. [BONUS: 6 team fouls] (Lamelo Herro: 3 personal fouls)   FT 1/3: GOOD   FT 2/3: MISS   FT 3/3: GOOD Bones Giddey makes 2/3 from the line.
Score: 107-107

[04:54] Team_016 possession (Score: 107-107)
Immanuel Nowitzki drives and kicks out. Immanuel Nowitzki attempts a 3Pt. Contested by Shaquille Paul (4.4 feet, ZONE). Immanuel Nowitzki misses. Rebound secured by Shaquille Russell.

[04:41] Team_092 possession (Score: 107-107)
Pau Reaves drives to the basket... FOUL! Offensive foul on Pau Reaves! Trae Barnes drew the charge! [Team fouls: 3] (Pau Reaves: 2 personal fouls) TURNOVER! (dead ball)

[04:30] Team_016 possession (Score: 107-107)
Kevin Butler attempts a 3Pt. Wide open! Vince Harris is 6.3 feet away. [MAN] Kevin Butler misses. Rebound secured by Shaquille Russell.

[04:19] Team_092 possession (Score: 107-107)
Pau Reaves commits a violation (traveling/carry)! TURNOVER! (dead ball)

[04:06] Team_016 possession (Score: 107-107)
Giannis Doncic attempts a Midrange. Contested by Shaquille Paul (4.4 feet, ZONE). Giannis Doncic misses. Rebound secured by Pau Reaves.

[03:49] Team_092 possession (Score: 107-107)
Pau Reaves drives and kicks out. Shaquille Paul attempts a Midrange. Contested by Giannis Doncic (3.7 feet, MAN). Shaquille Paul misses. Rebound secured by Giannis Doncic.

[03:36] Team_016 possession (Score: 107-107)
Kevin Butler attempts a 3Pt. Contested by Vince Harris (4.4 feet, MAN). Kevin Butler misses. Rebound secured by Shaquille Paul.

[03:21] Team_092 possession (Score: 107-107)
Shaquille Russell makes the Midrange and draws the foul on Immanuel Nowitzki! And-1! Shaquille Russell to the line for 1. [BONUS: 7 team fouls] (Immanuel Nowitzki: 2 personal fouls)   FT 1/1: GOOD Shaquille Russell makes 1/1 from the line.
Score: 110-107

[03:08] Team_016 possession (Score: 110-107)
Trae Barnes attempts a Midrange. Contested by Vince Harris (4.3 feet, ZONE). Trae Barnes misses. FOUL! Loose ball foul on Shaquille Paul during the rebound battle. [Team fouls: 4] No free throws, side out. (Shaquille Paul: 1 personal fouls)

[02:53] Team_016 possession (Score: 110-107)
Lamelo Herro attempts a 3Pt. Contested by Shaquille Russell (4.5 feet, ZONE). Lamelo Herro misses. Offensive rebound by Trae Barnes! Trae Barnes kicks it out.

[02:39] Team_016 possession (Score: 110-107)
Immanuel Nowitzki drives, Pau Reaves stays with him. Immanuel Nowitzki attempts a Layup. Contested by Pau Reaves (2.6 feet, ZONE). Immanuel Nowitzki misses. Rebound secured by Pau Reaves.

[02:28] Team_092 possession (Score: 110-107)
FOUL! Shooting foul on Lamelo Herro. Shaquille Paul to the line for 2 free throws. [BONUS: 8 team fouls] (Lamelo Herro: 4 personal fouls)   FT 1/2: GOOD   FT 2/2: MISS Shaquille Paul makes 1/2 from the line. Offensive rebound by Shaquille Paul! Shaquille Paul kicks it out.
Score: 111-107

[02:14] Team_092 possession (Score: 111-107)
FOUL! Shooting foul on Kevin Butler. Shaquille Russell to the line for 2 free throws. [BONUS: 9 team fouls] (Kevin Butler: 1 personal fouls)   FT 1/2: GOOD   FT 2/2: MISS Shaquille Russell makes 1/2 from the line. Rebound secured by Lamelo Herro.
Score: 112-107

[02:02] Team_016 possession (Score: 112-107)
FOUL! Reach-in foul on Pau Reaves during the drive. [IN THE BONUS! 5 team fouls] Trae Barnes to the line for 2 free throws. (Pau Reaves: 3 personal fouls)   FT 1/2: GOOD   FT 2/2: GOOD Trae Barnes makes 2/2 from the line.
Score: 112-109

[01:48] Team_092 possession (Score: 112-109)
Vince Harris attempts a Midrange. Wide open! Immanuel Nowitzki is 8.2 feet away. [ZONE] VINCE HARRIS MAKES IT!
Score: 114-109

[01:37] Team_016 possession (Score: 114-109)
Kevin Butler throws a bad pass! Stolen by Vince Harris! TURNOVER! (live ball)

[01:21] Team_092 possession (Score: 114-109)
Vince Harris attempts a Midrange. Wide open! Kevin Butler is 6.5 feet away. [MAN] VINCE HARRIS MAKES IT! Assist: Pau Reaves
Score: 116-109

[01:08] Team_016 possession (Score: 116-109)
Lamelo Herro attempts a Layup. Contested by Bones Giddey (3.5 feet, MAN). Lamelo Herro misses. Rebound secured by Shaquille Paul.

[00:53] Team_092 possession (Score: 116-109)
Bones Giddey attempts a Midrange. Contested by Kevin Butler (3.6 feet, ZONE). BONES GIDDEY MAKES IT! Assist: Pau Reaves
Score: 118-109

[00:42] Team_016 possession (Score: 118-109)
Kevin Butler drives to the basket... FOUL! Offensive foul on Kevin Butler! Pau Reaves drew the charge! [Team fouls: 10] (Kevin Butler: 2 personal fouls) TURNOVER! (dead ball)

[00:24] Team_092 possession (Score: 118-109)
Shaquille Paul attempts a 3Pt. Contested by Lamelo Herro (3.5 feet, ZONE). Shaquille Paul misses. Rebound secured by Lamelo Herro.

[00:08] Team_016 possession (Score: 118-109)
Immanuel Nowitzki makes the 3Pt and draws the foul on Bones Giddey! And-1! Immanuel Nowitzki to the line for 1. [BONUS: 6 team fouls] (Bones Giddey: 1 personal fouls)   FT 1/1: GOOD Immanuel Nowitzki makes 1/1 from the line.
Score: 118-113

================================================================================
                              4TH QUARTER COMPLETE                              
================================================================================

4TH QUARTER SCORE: Team_092 31, Team_016 24

BOX SCORE:
================================================================================

Team_092
--------------------------------------------------------------------------------
Player                MIN  PTS  REB  AST  TO      FG   FG%      3P   3P%
--------------------------------------------------------------------------------
Pau Reaves             21    8    3    2   0   3/5    60.0     0/0   0.0
Vince Harris           21    7    0    1   0   3/4    75.0     0/0   0.0
Bones Giddey           21    6    0    0   0   3/3   100.0     0/0   0.0
Karl Gobert            28    4    0    0   0   2/2   100.0     0/0   0.0
Shaquille Russell      21    4    2    1   0   2/5    40.0     0/0   0.0
John Giddey            27    0    0    2   0   0/0     0.0     0/0   0.0
Shaquille Paul         21    0    5    1   0   0/1     0.0     0/0   0.0

TEAM: FG: 13/20 (65.0%), 3PT: 2/5 (40.0%), REB: 10 (2 off, 8 def), AST: 7, TO: 2
TEAM FOULS: 6 [Team_016 in BONUS]


Team_016
--------------------------------------------------------------------------------
Player                MIN  PTS  REB  AST  TO      FG   FG%      3P   3P%
--------------------------------------------------------------------------------
Immanuel Nowitzki      21    8    0    0   0   3/6    50.0     0/0   0.0
Giannis Doncic         21    5    3    1   0   2/3    66.7     0/0   0.0
Trae Barnes            21    5    4    0   0   2/2   100.0     0/0   0.0
Vince Quickley         28    2    0    0   0   1/1   100.0     0/0   0.0
Lamelo Herro           21    2    4    0   0   1/3    33.3     0/0   0.0
Kevin Butler           21    2    0    1   0   1/3    33.3     0/0   0.0
Giannis Ginobili       28    0    0    1   0   0/0     0.0     0/0   0.0

TEAM: FG: 10/18 (55.6%), 3PT: 2/5 (40.0%), REB: 11 (4 off, 7 def), AST: 3, TO: 4
TEAM FOULS: 10 [Team_092 in BONUS]

================================================================================

================================================================================
                               FULL GAME COMPLETE                               
================================================================================

FINAL SCORE: Team_092 118, Team_016 113

SCORING BY QUARTER:
--------------------------------------------------------------------------------
Team                     Q1     Q2     Q3     Q4    FINAL
--------------------------------------------------------------------------------
Team_092                 32     23     32     31      118
Team_016                 23     29     37     24      113
--------------------------------------------------------------------------------

FULL GAME BOX SCORE:
================================================================================

Team_092
--------------------------------------------------------------------------------
Player                MIN  PTS  REB  AST  TO      FG   FG%      3P   3P%      FT STL BLK
--------------------------------------------------------------------------------
Paul James             28   17    8    2   3   8/12   66.7   2/4    50.0   4/5     0   1
Immanuel Ingram        28   10    3    2   1   6/8    75.0   1/2    50.0   1/2     0   0
Karl Gobert            28   15    1    2   1   6/7    85.7   2/2   100.0   3/3     1   0
Austin Bridges         27   10    0    4   3   4/7    57.1   2/3    66.7   3/3     1   0
John Giddey            27   17   11    6   1   6/11   54.5   2/3    66.7   5/5     0   1
Bones Giddey           21   11    0    2   2   5/5   100.0   1/1   100.0   3/4     0   0
Shaquille Paul         21    0    8    1   1   0/2     0.0   0/2     0.0   1/2     0   0
Shaquille Russell      21    7    4    2   1   3/6    50.0   0/2     0.0   4/6     0   0
Vince Harris           21   15    0    2   1   6/8    75.0   2/3    66.7   1/1     3   0
Pau Reaves             21   14    5    2   1   6/10   60.0   0/0     0.0   2/2     1   0

TEAM: FG: 50/76 (65.8%), 3PT: 12/22 (54.5%), REB: 39 (10 off, 29 def), AST: 25, TO: 15


Team_016
--------------------------------------------------------------------------------
Player                MIN  PTS  REB  AST  TO      FG   FG%      3P   3P%      FT STL BLK
--------------------------------------------------------------------------------
Giannis Ginobili       28   11    0    6   3   4/6    66.7   0/1     0.0   0/0     0   0
Vince Quickley         28   23    2    4   0   9/17   52.9   3/9    33.3   5/7     1   0
Ben Barrett            28   20    6    4   0   9/11   81.8   1/2    50.0   3/4     1   0
Vince Duncan           28   10   12    4   0   6/7    85.7   1/1   100.0   0/0     0   3
Collin Barnes          27    8    0    0   3   3/4    75.0   1/2    50.0   1/1     0   1
Lamelo Herro           21    2    7    0   1   1/5    20.0   1/2    50.0   2/3     0   0
Giannis Doncic         21   10    3    1   1   4/8    50.0   1/1   100.0   3/3     1   0
Trae Barnes            21    9    5    0   0   3/4    75.0   0/0     0.0   9/11    0   0
Immanuel Nowitzki      21   11    1    0   2   4/7    57.1   1/1   100.0   4/5     1   0
Kevin Butler           21    2    0    1   5   2/6    33.3   0/3     0.0   0/0     1   0

TEAM: FG: 46/76 (60.5%), 3PT: 9/22 (40.9%), REB: 37 (11 off, 26 def), AST: 20, TO: 15

================================================================================
