================================================================================
                        FULL GAME - Team_002 vs Team_008                        
================================================================================

================================================================================
                       1ST QUARTER - Team_002 vs Team_008                       
================================================================================

[12:00] Team_002 possession (Score: 0-0)
Tyler Porzingis attempts a Midrange. Wide open! Magic Young is 7.7 feet away. [MAN] Tyler Porzingis misses. Rebound secured by Khris Hyland.

[11:50] Team_008 possession (Score: 0-0)
Khris Hyland attempts a Midrange. Contested by Jordan Green (2.9 feet, MAN). Khris Hyland misses. Rebound secured by Carmelo Lowry.

[11:36] Team_002 possession (Score: 0-0)
Tyler Porzingis throws a bad pass! Stolen by Magic Young! TURNOVER! (live ball)

[11:19] Team_008 possession (Score: 0-0)
FOUL! Holding foul on Miles Bane. [Team fouls: 1] No free throws, side out. (Miles Bane: 1 personal fouls)

[11:07] Team_008 possession (Score: 0-0)
Khris Hyland attempts a 3Pt. Heavily contested by CJ Barrett (0.9 feet, ZONE)! Khris Hyland misses. FOUL! Loose ball foul on Tyler Porzingis during the rebound battle. [Team fouls: 2] No free throws, side out. (Tyler Porzingis: 1 personal fouls)

[10:53] Team_008 possession (Score: 0-0)
Jrue Harris attempts a 3Pt. Contested by CJ Barrett (4.8 feet, MAN). Jrue Harris misses. Rebound secured by Tyler Porzingis.

[10:35] Team_002 possession (Score: 0-0)
Miles Bane attempts a 3Pt. Contested by Victor Leonard (3.5 feet, ZONE). MILES BANE MAKES IT! Assist: Tyler Porzingis
Score: 3-0

[10:18] Team_008 possession (Score: 3-0)
Victor Leonard makes the Layup and draws the foul on Miles Bane! And-1! Victor Leonard to the line for 1. [Team fouls: 3] (Miles Bane: 2 personal fouls)   FT 1/1: GOOD Victor Leonard makes 1/1 from the line.
Score: 3-3

[10:01] Team_002 possession (Score: 3-3)
Jordan Green drives, Tyrese Thompson stays with him. Jordan Green attempts a Layup. Heavily contested by Tyrese Thompson (1.2 feet, ZONE)! Jordan Green misses. Rebound secured by Magic Young.

[09:45] Team_008 possession (Score: 3-3)
Jrue Harris attempts a 3Pt. Contested by Jordan Green (3.1 feet, ZONE). Jrue Harris misses. Offensive rebound by Tyrese Thompson! Tyrese Thompson kicks it out.

[09:28] Team_008 possession (Score: 3-3)
Khris Hyland attempts a Layup. Contested by Jordan Green (5.4 feet, MAN). KHRIS HYLAND MAKES IT! Assist: Jrue Harris
Score: 3-5

[09:12] Team_002 possession (Score: 3-5)
Miles Bane attempts a 3Pt. Contested by Khris Hyland (4.7 feet, ZONE). Miles Bane misses. FOUL! Loose ball foul on Tyrese Thompson during the rebound battle. [Team fouls: 1] No free throws, side out. (Tyrese Thompson: 1 personal fouls)

[08:59] Team_002 possession (Score: 3-5)
Jordan Green attempts a Midrange. Wide open! Tyrese Thompson is 6.6 feet away. [ZONE] Jordan Green misses. Rebound secured by Tyrese Thompson.

[08:41] Team_008 possession (Score: 3-5)
Magic Young attempts a Midrange. BLOCKED BY TYLER PORZINGIS! Ball deflects out of bounds off Magic Young.

[08:29] Team_002 possession (Score: 3-5)
Miles Bane attempts a Midrange. BLOCKED BY TYRESE THOMPSON! Ball goes out off Tyrese Thompson. Miles Bane's ball!

[08:12] Team_002 possession (Score: 3-5)
FOUL! Shooting foul on Khris Hyland. Jordan Green to the line for 2 free throws. [Team fouls: 2] (Khris Hyland: 1 personal fouls)   FT 1/2: GOOD   FT 2/2: GOOD Jordan Green makes 2/2 from the line.
Score: 5-5

[07:58] Team_008 possession (Score: 5-5)
Khris Hyland attempts a Layup. Heavily contested by Tyler Porzingis (1.8 feet, ZONE)! KHRIS HYLAND MAKES IT! Assist: Victor Leonard
Score: 5-7

[07:44] Team_002 possession (Score: 5-7)
Miles Bane attempts a 3Pt. Contested by Jrue Harris (3.6 feet, ZONE). Miles Bane misses. Rebound secured by Tyrese Thompson.

[07:34] Team_008 possession (Score: 5-7)
Tyrese Thompson makes the Layup and draws the foul on Carmelo Lowry! And-1! Tyrese Thompson to the line for 1. [Team fouls: 4] (Carmelo Lowry: 1 personal fouls)   FT 1/1: MISS Tyrese Thompson makes 0/1 from the line. Rebound secured by Tyler Porzingis.
Score: 5-9

[07:17] Team_002 possession (Score: 5-9)
Miles Bane attempts a 3Pt. Wide open! Victor Leonard is 6.7 feet away. [MAN] Miles Bane misses. FOUL! Loose ball foul on Khris Hyland during the rebound battle. [Team fouls: 3] No free throws, side out. (Khris Hyland: 2 personal fouls)

[07:03] Team_002 possession (Score: 5-9)
Carmelo Lowry makes the Layup and draws the foul on Tyrese Thompson! And-1! Carmelo Lowry to the line for 1. [Team fouls: 4] (Tyrese Thompson: 2 personal fouls)   FT 1/1: MISS Carmelo Lowry makes 0/1 from the line. Rebound secured by Magic Young.
Score: 7-9

[06:47] Team_008 possession (Score: 7-9)
Victor Leonard attempts a 3Pt. Contested by Miles Bane (2.5 feet, MAN). VICTOR LEONARD MAKES IT! Assist: Tyrese Thompson
Score: 7-12

[06:30] Team_002 possession (Score: 7-12)
Tyler Porzingis drives, picks up Magic Young. Help arrives from Jrue Harris! Tyler Porzingis attempts a Layup. Contested by Jrue Harris (5.7 feet, MAN). TYLER PORZINGIS MAKES IT! Assist: Miles Bane
Score: 9-12

[06:12] Team_008 possession (Score: 9-12)
Jrue Harris attempts a Midrange. Contested by CJ Barrett (3.0 feet, ZONE). Jrue Harris misses. Rebound secured by Miles Bane.

[05:56] Team_002 possession (Score: 9-12)
CJ Barrett makes the Layup and draws the foul on Jrue Harris! And-1! CJ Barrett to the line for 1. [BONUS: 5 team fouls] (Jrue Harris: 1 personal fouls)   FT 1/1: GOOD CJ Barrett makes 1/1 from the line.
Score: 12-12

[05:39] Team_008 possession (Score: 12-12)
FOUL! Reach-in foul on CJ Barrett during the drive. [IN THE BONUS! 5 team fouls] Jrue Harris to the line for 2 free throws. (CJ Barrett: 1 personal fouls)   FT 1/2: GOOD   FT 2/2: GOOD Jrue Harris makes 2/2 from the line.
Score: 12-14

[05:25] Team_002 possession (Score: 12-14)
Tyler Porzingis makes the Layup and draws the foul on Tyrese Thompson! And-1! Tyler Porzingis to the line for 1. [BONUS: 6 team fouls] (Tyrese Thompson: 3 personal fouls)   FT 1/1: GOOD Tyler Porzingis makes 1/1 from the line.
Score: 15-14

[05:11] Team_008 possession (Score: 15-14)
FOUL! Reach-in foul on Tyler Porzingis during the drive. [IN THE BONUS! 6 team fouls] Magic Young to the line for 2 free throws. (Tyler Porzingis: 2 personal fouls)   FT 1/2: GOOD   FT 2/2: GOOD Magic Young makes 2/2 from the line.
Score: 15-16

[04:55] Team_002 possession (Score: 15-16)
Miles Bane attempts a 3Pt. Wide open! Victor Leonard is 8.3 feet away. [ZONE] Miles Bane misses. Rebound secured by Tyrese Thompson.

[04:46] Team_008 possession (Score: 15-16)
Jrue Harris attempts a 3Pt. Contested by Jordan Green (2.5 feet, ZONE). Jrue Harris misses. Rebound secured by Carmelo Lowry.

[04:31] Team_002 possession (Score: 15-16)
Jordan Green makes the Midrange and draws the foul on Jrue Harris! And-1! Jordan Green to the line for 1. [BONUS: 7 team fouls] (Jrue Harris: 2 personal fouls)   FT 1/1: MISS Jordan Green makes 0/1 from the line. Offensive rebound by Tyler Porzingis! Tyler Porzingis puts it back in!
Score: 19-16

[04:21] Team_008 possession (Score: 19-16)
Tyrese Thompson attempts a Midrange. Contested by Carmelo Lowry (5.1 feet, MAN). Tyrese Thompson misses. Rebound secured by Tyler Porzingis.

[04:09] Team_002 possession (Score: 19-16)
Jordan Green makes the 3Pt and draws the foul on Victor Leonard! And-1! Jordan Green to the line for 1. [BONUS: 8 team fouls] (Victor Leonard: 1 personal fouls)   FT 1/1: GOOD Jordan Green makes 1/1 from the line.
Score: 23-16

[03:57] Team_008 possession (Score: 23-16)
Jrue Harris makes the Midrange and draws the foul on CJ Barrett! And-1! Jrue Harris to the line for 1. [BONUS: 7 team fouls] (CJ Barrett: 2 personal fouls)   FT 1/1: GOOD Jrue Harris makes 1/1 from the line.
Score: 23-19

[03:41] Team_002 possession (Score: 23-19)
Miles Bane attempts a 3Pt. Wide open! Victor Leonard is 8.9 feet away. [ZONE] Miles Bane misses. Rebound secured by Magic Young.

[03:28] Team_008 possession (Score: 23-19)
Magic Young attempts a Layup. Heavily contested by Tyler Porzingis (0.5 feet, ZONE)! Magic Young misses. Rebound secured by Carmelo Lowry.

[03:13] Team_002 possession (Score: 23-19)
Tyler Porzingis attempts a Midrange. Contested by Magic Young (4.9 feet, MAN). Tyler Porzingis misses. Rebound secured by Khris Hyland.

[03:03] Team_008 possession (Score: 23-19)
Jrue Harris attempts a 3Pt. Contested by CJ Barrett (5.2 feet, ZONE). Jrue Harris misses. Rebound secured by Tyler Porzingis.

[02:48] Team_002 possession (Score: 23-19)
Jordan Green attempts a Midrange. Wide open! Tyrese Thompson is 7.5 feet away. [ZONE] Jordan Green misses. Offensive rebound by Tyler Porzingis! Tyler Porzingis's putback is no good. Offensive rebound by Carmelo Lowry! Carmelo Lowry kicks it out.

[02:30] Team_002 possession (Score: 23-19)
Jordan Green drives and kicks out. Carmelo Lowry attempts a Midrange. Contested by Tyrese Thompson (2.2 feet, MAN). Carmelo Lowry misses. Rebound secured by Magic Young.

[02:17] Team_008 possession (Score: 23-19)
Victor Leonard throws a bad pass out of bounds! TURNOVER! (dead ball)

[02:17] Substitution (Team_002): CJ Barrett OUT → Dirk Middleton IN (stamina_rule2)

[02:17] Substitution (Team_002): Carmelo Lowry OUT → Julius Curry IN (stamina_rule2)

[02:17] Substitution (Team_002): Tyler Porzingis OUT → Lamelo O'Neal IN (stamina_rule2)

[02:17] Substitution (Team_008): Victor Leonard OUT → Blake Holiday IN (stamina_rule2)

[02:17] Substitution (Team_008): Jrue Harris OUT → Chris Griffin IN (stamina_rule2)

[02:17] Substitution (Team_008): Khris Hyland OUT → Immanuel Young IN (stamina_rule2)

[02:17] Substitution (Team_008): Tyrese Thompson OUT → Khris Giddey IN (stamina_rule2)

[02:17] Substitution (Team_008): Magic Young OUT → Lamelo Middleton IN (stamina_rule2)

[02:01] Team_002 possession (Score: 23-19)
Lamelo O'Neal drives to the basket... Lamelo O'Neal throws a bad pass out of bounds! TURNOVER! (dead ball)

[02:01] Substitution (Team_002): Miles Bane OUT → John Duncan IN (stamina_rule2)

[02:01] Substitution (Team_002): Jordan Green OUT → Anfernee Sexton IN (stamina_rule2)

[01:47] Team_008 possession (Score: 23-19)
Lamelo Middleton throws a bad pass! Stolen by Lamelo O'Neal! TURNOVER! (live ball)

[01:34] Team_002 possession (Score: 23-19)
FOUL! Offensive foul on Dirk Middleton! Chris Griffin drew the charge! [Team fouls: 8] (Dirk Middleton: 1 personal fouls) TURNOVER! (dead ball)

[01:21] Team_008 possession (Score: 23-19)
FOUL! Offensive foul on Lamelo Middleton! Lamelo O'Neal drew the charge! [Team fouls: 9] (Lamelo Middleton: 1 personal fouls) TURNOVER! (dead ball)

[01:10] Team_002 possession (Score: 23-19)
Lamelo O'Neal attempts a Layup. Heavily contested by Lamelo Middleton (0.7 feet, MAN)! Lamelo O'Neal misses. Rebound secured by Chris Griffin.

[00:57] Team_008 possession (Score: 23-19)
Lamelo Middleton makes the Layup and draws the foul on Lamelo O'Neal! And-1! Lamelo Middleton to the line for 1. [BONUS: 9 team fouls] (Lamelo O'Neal: 1 personal fouls)   FT 1/1: GOOD Lamelo Middleton makes 1/1 from the line.
Score: 23-22

[00:41] Team_002 possession (Score: 23-22)
Lamelo O'Neal drives, picks up Lamelo Middleton. Help arrives from Chris Griffin! Lamelo O'Neal attempts a Layup. Contested by Chris Griffin (5.5 feet, ZONE). Lamelo O'Neal misses. Rebound secured by Chris Griffin.

[00:30] Team_008 possession (Score: 23-22)
Immanuel Young attempts a 3Pt. Wide open! Julius Curry is 6.2 feet away. [ZONE] IMMANUEL YOUNG MAKES IT!
Score: 23-25

[00:15] Team_002 possession (Score: 23-25)
John Duncan attempts a 3Pt. Contested by Blake Holiday (3.3 feet, MAN). John Duncan misses. Rebound secured by Khris Giddey.

================================================================================
                              1ST QUARTER COMPLETE                              
================================================================================

1ST QUARTER SCORE: Team_002 23, Team_008 25

BOX SCORE:
================================================================================

Team_002
--------------------------------------------------------------------------------
Player                MIN  PTS  REB  AST  TO      FG   FG%      3P   3P%
--------------------------------------------------------------------------------
Tyler Porzingis        10    9    6    1   0   3/5    60.0     0/0   0.0
Jordan Green           10    6    0    0   0   2/5    40.0     0/0   0.0
Miles Bane             10    3    1    1   0   1/4    25.0     0/0   0.0
CJ Barrett             10    3    0    0   0   1/1   100.0     0/0   0.0
Carmelo Lowry          10    0    4    0   0   0/1     0.0     0/0   0.0
Lamelo O'Neal           2    0    0    0   0   0/2     0.0     0/0   0.0
John Duncan             2    0    0    0   0   0/1     0.0     0/0   0.0

TEAM: FG: 7/19 (36.8%), 3PT: 2/6 (33.3%), REB: 11 (3 off, 8 def), AST: 2, TO: 3
TEAM FOULS: 9 [Team_008 in BONUS]


Team_008
--------------------------------------------------------------------------------
Player                MIN  PTS  REB  AST  TO      FG   FG%      3P   3P%
--------------------------------------------------------------------------------
Victor Leonard         10    6    0    1   0   2/2   100.0     0/0   0.0
Jrue Harris            10    5    0    1   0   2/6    33.3     0/0   0.0
Khris Hyland           10    4    2    0   0   2/3    66.7     0/0   0.0
Lamelo Middleton        2    3    0    0   0   1/1   100.0     0/0   0.0
Immanuel Young          2    3    0    0   0   1/1   100.0     0/0   0.0
Magic Young            10    2    5    0   0   1/3    33.3     0/0   0.0
Tyrese Thompson        10    0    4    1   0   0/2     0.0     0/0   0.0
Chris Griffin           2    0    2    0   0   0/0     0.0     0/0   0.0
Khris Giddey            2    0    1    0   0   0/0     0.0     0/0   0.0

TEAM: FG: 9/18 (50.0%), 3PT: 2/5 (40.0%), REB: 14 (2 off, 12 def), AST: 3, TO: 3
TEAM FOULS: 9 [Team_002 in BONUS]

================================================================================

================================================================================
                       2ND QUARTER - Team_002 vs Team_008                       
================================================================================

[12:00] Team_002 possession (Score: 23-25)
CJ Barrett attempts a 3Pt. Wide open! Victor Leonard is 8.4 feet away. [ZONE] CJ BARRETT MAKES IT! Assist: Carmelo Lowry
Score: 26-25

[11:47] Team_008 possession (Score: 26-25)
Victor Leonard drives and kicks out. Khris Hyland makes the 3Pt and draws the foul on Jordan Green! And-1! Khris Hyland to the line for 1. [Team fouls: 1] (Jordan Green: 1 personal fouls)   FT 1/1: GOOD Khris Hyland makes 1/1 from the line.
Score: 26-29

[11:32] Team_002 possession (Score: 26-29)
FOUL! Reach-in foul on Victor Leonard during the drive. [Team fouls: 1] No free throws, side out. (Victor Leonard: 1 personal fouls)

[11:17] Team_002 possession (Score: 26-29)
FOUL! Reach-in foul on Victor Leonard during the drive. [Team fouls: 2] No free throws, side out. (Victor Leonard: 2 personal fouls)

[10:59] Team_002 possession (Score: 26-29)
Miles Bane attempts a 3Pt. Contested by Khris Hyland (4.7 feet, ZONE). MILES BANE MAKES IT!
Score: 29-29

[10:47] Team_008 possession (Score: 29-29)
Tyrese Thompson attempts a 3Pt. Contested by CJ Barrett (5.2 feet, ZONE). TYRESE THOMPSON MAKES IT! Assist: Magic Young
Score: 29-32

[10:36] Team_002 possession (Score: 29-32)
Jordan Green makes the Layup and draws the foul on Khris Hyland! And-1! Jordan Green to the line for 1. [Team fouls: 3] (Khris Hyland: 1 personal fouls)   FT 1/1: GOOD Jordan Green makes 1/1 from the line.
Score: 32-32

[10:19] Team_008 possession (Score: 32-32)
Jrue Harris drives, picks up Tyler Porzingis. Help arrives from CJ Barrett! Jrue Harris attempts a Dunk. Heavily contested by CJ Barrett (1.2 feet, ZONE)! Jrue Harris misses. Rebound secured by Carmelo Lowry.

[10:05] Team_002 possession (Score: 32-32)
Miles Bane makes the Layup and draws the foul on Victor Leonard! And-1! Miles Bane to the line for 1. [Team fouls: 4] (Victor Leonard: 3 personal fouls)   FT 1/1: GOOD Miles Bane makes 1/1 from the line.
Score: 35-32

[09:51] Team_008 possession (Score: 35-32)
Jrue Harris drives, CJ Barrett stays with him. Jrue Harris attempts a Layup. Contested by CJ Barrett (3.2 feet, MAN). JRUE HARRIS MAKES IT! Assist: Victor Leonard
Score: 35-34

[09:35] Team_002 possession (Score: 35-34)
CJ Barrett attempts a 3Pt. Contested by Victor Leonard (4.6 feet, ZONE). CJ Barrett misses. Offensive rebound by Tyler Porzingis! Tyler Porzingis puts it back in!
Score: 37-34

[09:20] Team_008 possession (Score: 37-34)
Khris Hyland drives, picks up Carmelo Lowry. Help arrives from CJ Barrett! Khris Hyland attempts a Dunk. Contested by CJ Barrett (3.5 feet, ZONE). KHRIS HYLAND MAKES IT! Assist: Victor Leonard
Score: 37-36

[09:08] Team_002 possession (Score: 37-36)
FOUL! Shooting foul on Tyrese Thompson. CJ Barrett to the line for 2 free throws. [BONUS: 5 team fouls] (Tyrese Thompson: 1 personal fouls)   FT 1/2: GOOD   FT 2/2: MISS CJ Barrett makes 1/2 from the line. Rebound secured by Khris Hyland.
Score: 38-36

[08:55] Team_008 possession (Score: 38-36)
Victor Leonard attempts a Midrange. Wide open! Miles Bane is 7.0 feet away. [MAN] Victor Leonard misses. Offensive rebound by Magic Young! Magic Young kicks it out.

[08:44] Team_008 possession (Score: 38-36)
Tyrese Thompson attempts a Midrange. Contested by Carmelo Lowry (5.1 feet, MAN). TYRESE THOMPSON MAKES IT!
Score: 38-38

[08:28] Team_002 possession (Score: 38-38)
Tyler Porzingis attempts a Midrange. Wide open! Jrue Harris is 6.1 feet away. [ZONE] TYLER PORZINGIS MAKES IT!
Score: 40-38

[08:14] Team_008 possession (Score: 40-38)
Jrue Harris drives, Tyler Porzingis stays with him. Jrue Harris attempts a Layup. Contested by Tyler Porzingis (2.6 feet, ZONE). JRUE HARRIS MAKES IT! Assist: Magic Young
Score: 40-40

[07:58] Team_002 possession (Score: 40-40)
Miles Bane attempts a Midrange. Contested by Tyrese Thompson (5.6 feet, ZONE). Miles Bane misses. Rebound secured by Khris Hyland.

[07:42] Team_008 possession (Score: 40-40)
FOUL! Offensive foul on Khris Hyland! Jordan Green drew the charge! [Team fouls: 6] (Khris Hyland: 2 personal fouls) TURNOVER! (dead ball)

[07:28] Team_002 possession (Score: 40-40)
Miles Bane attempts a Midrange. Wide open! Khris Hyland is 7.0 feet away. [ZONE] Miles Bane misses. Rebound secured by Khris Hyland.

[07:18] Team_008 possession (Score: 40-40)
Tyrese Thompson makes the Midrange and draws the foul on Jordan Green! And-1! Tyrese Thompson to the line for 1. [Team fouls: 2] (Jordan Green: 2 personal fouls)   FT 1/1: GOOD Tyrese Thompson makes 1/1 from the line.
Score: 40-43

[06:58] Team_002 possession (Score: 40-43)
Carmelo Lowry attempts a 3Pt. Contested by Victor Leonard (5.0 feet, ZONE). CARMELO LOWRY MAKES IT!
Score: 43-43

[06:38] Team_008 possession (Score: 43-43)
Victor Leonard attempts a 3Pt. Heavily contested by Miles Bane (1.5 feet, MAN)! Victor Leonard misses. Rebound secured by Carmelo Lowry.

[06:23] Team_002 possession (Score: 43-43)
CJ Barrett attempts a 3Pt. Contested by Jrue Harris (3.2 feet, MAN). CJ BARRETT MAKES IT!
Score: 46-43

[06:13] Team_008 possession (Score: 46-43)
Victor Leonard attempts a Midrange. Wide open! Miles Bane is 6.8 feet away. [MAN] VICTOR LEONARD MAKES IT!
Score: 46-45

[06:03] Team_002 possession (Score: 46-45)
CJ Barrett attempts a Layup. BLOCKED BY TYRESE THOMPSON! Ball is loose! Rebound secured by Magic Young.

[05:47] Team_008 possession (Score: 46-45)
Victor Leonard attempts a 3Pt. Wide open! CJ Barrett is 6.6 feet away. [ZONE] Victor Leonard misses. Rebound secured by Miles Bane.

[05:32] Team_002 possession (Score: 46-45)
CJ Barrett attempts a 3Pt. Wide open! Victor Leonard is 8.8 feet away. [ZONE] CJ BARRETT MAKES IT! Assist: Miles Bane
Score: 49-45

[05:21] Team_008 possession (Score: 49-45)
Jrue Harris drives and kicks out. Victor Leonard attempts a 3Pt. Heavily contested by CJ Barrett (1.4 feet, ZONE)! Victor Leonard misses. Rebound secured by Tyler Porzingis.

[05:05] Team_002 possession (Score: 49-45)
Tyler Porzingis drives and kicks out. CJ Barrett attempts a 3Pt. Contested by Jrue Harris (4.2 feet, MAN). CJ Barrett misses. Rebound secured by Tyrese Thompson.

[04:52] Team_008 possession (Score: 49-45)
Magic Young drives to the basket... Magic Young throws a bad pass out of bounds! TURNOVER! (dead ball)

[04:52] Substitution (Team_002): Miles Bane OUT → John Duncan IN (stamina_rule2)

[04:52] Substitution (Team_002): CJ Barrett OUT → Dirk Middleton IN (stamina_rule2)

[04:52] Substitution (Team_002): Jordan Green OUT → Anfernee Sexton IN (stamina_rule2)

[04:52] Substitution (Team_002): Carmelo Lowry OUT → Julius Curry IN (stamina_rule2)

[04:52] Substitution (Team_002): Tyler Porzingis OUT → Lamelo O'Neal IN (stamina_rule2)

[04:52] Substitution (Team_008): Victor Leonard OUT → Blake Holiday IN (stamina_rule2)

[04:52] Substitution (Team_008): Jrue Harris OUT → Chris Griffin IN (stamina_rule2)

[04:52] Substitution (Team_008): Khris Hyland OUT → Immanuel Young IN (stamina_rule2)

[04:52] Substitution (Team_008): Tyrese Thompson OUT → Khris Giddey IN (stamina_rule2)

[04:52] Substitution (Team_008): Magic Young OUT → Lamelo Middleton IN (stamina_rule2)

[04:37] Team_002 possession (Score: 49-45)
Anfernee Sexton attempts a 3Pt. Wide open! Immanuel Young is 6.9 feet away. [MAN] ANFERNEE SEXTON MAKES IT! Assist: John Duncan
Score: 52-45

[04:25] Team_008 possession (Score: 52-45)
Chris Griffin drives and kicks out. Chris Griffin attempts a 3Pt. Wide open! Dirk Middleton is 7.2 feet away. [MAN] CHRIS GRIFFIN MAKES IT! Assist: Blake Holiday
Score: 52-48

[04:08] Team_002 possession (Score: 52-48)
Dirk Middleton throws a bad pass out of bounds! TURNOVER! (dead ball)

[03:52] Team_008 possession (Score: 52-48)
Lamelo Middleton makes the Dunk and draws the foul on John Duncan! And-1! Lamelo Middleton to the line for 1. [Team fouls: 3] (John Duncan: 1 personal fouls)   FT 1/1: GOOD Lamelo Middleton makes 1/1 from the line.
Score: 52-51

[03:42] Team_002 possession (Score: 52-51)
Julius Curry attempts a Midrange. Wide open! Khris Giddey is 7.0 feet away. [MAN] JULIUS CURRY MAKES IT!
Score: 54-51

[03:25] Team_008 possession (Score: 54-51)
Khris Giddey drives to the basket... Khris Giddey throws a bad pass! Stolen by Lamelo O'Neal! TURNOVER! (live ball)

[03:16] Team_002 possession (Score: 54-51)
John Duncan drives, Lamelo Middleton stays with him. John Duncan attempts a Layup. Contested by Lamelo Middleton (3.3 feet, ZONE). JOHN DUNCAN MAKES IT! Assist: Anfernee Sexton
Score: 56-51

[02:57] Team_008 possession (Score: 56-51)
FOUL! Holding foul on John Duncan. [Team fouls: 4] No free throws, side out. (John Duncan: 2 personal fouls)

[02:44] Team_008 possession (Score: 56-51)
Immanuel Young attempts a 3Pt. Wide open! Anfernee Sexton is 6.9 feet away. [MAN] Immanuel Young misses. Rebound secured by Lamelo O'Neal.

[02:30] Team_002 possession (Score: 56-51)
Anfernee Sexton attempts a Layup. BLOCKED BY IMMANUEL YOUNG! Ball is loose! Rebound secured by Lamelo Middleton.

[02:17] Team_008 possession (Score: 56-51)
Immanuel Young drives and kicks out. Blake Holiday attempts a 3Pt. Contested by John Duncan (3.1 feet, MAN). Blake Holiday misses. Offensive rebound by Khris Giddey! Khris Giddey kicks it out.

[02:00] Team_008 possession (Score: 56-51)
Immanuel Young drives to the basket... Immanuel Young loses the ball! Stripped by Anfernee Sexton! TURNOVER! (live ball)

[01:50] Team_002 possession (Score: 56-51)
Dirk Middleton attempts a 3Pt. Wide open! Khris Giddey is 6.8 feet away. [ZONE] DIRK MIDDLETON MAKES IT! Assist: John Duncan
Score: 59-51

[01:31] Team_008 possession (Score: 59-51)
FOUL! Holding foul on Dirk Middleton. [IN THE BONUS! 5 team fouls] Chris Griffin to the line for 2 free throws. (Dirk Middleton: 1 personal fouls)   FT 1/2: MISS   FT 2/2: MISS Chris Griffin makes 0/2 from the line. Rebound secured by Anfernee Sexton.

[01:18] Team_002 possession (Score: 59-51)
Anfernee Sexton attempts a 3Pt. Contested by Khris Giddey (4.8 feet, ZONE). Anfernee Sexton misses. FOUL! Loose ball foul on Khris Giddey during the rebound battle. [IN THE BONUS! 7 team fouls] Anfernee Sexton to the line for 2 free throws. (Khris Giddey: 1 personal fouls)   FT 1/2: GOOD   FT 2/2: GOOD Anfernee Sexton makes 2/2 from the line.
Score: 61-51

[01:04] Team_008 possession (Score: 61-51)
Lamelo Middleton drives to the basket... Lamelo Middleton throws a bad pass! Stolen by Lamelo O'Neal! TURNOVER! (live ball)

[00:48] Team_002 possession (Score: 61-51)
Lamelo O'Neal drives, picks up Lamelo Middleton. Help arrives from Chris Griffin! Lamelo O'Neal attempts a Layup. Contested by Chris Griffin (3.5 feet, MAN). LAMELO O'NEAL MAKES IT! Assist: Anfernee Sexton
Score: 63-51

[00:38] Team_008 possession (Score: 63-51)
Immanuel Young drives and kicks out. Chris Griffin attempts a Midrange. Wide open! Julius Curry is 7.5 feet away. [ZONE] CHRIS GRIFFIN MAKES IT! Assist: Lamelo Middleton
Score: 63-53

[00:26] Team_002 possession (Score: 63-53)
Anfernee Sexton drives and kicks out. Anfernee Sexton attempts a Midrange. Contested by Immanuel Young (4.1 feet, MAN). Anfernee Sexton misses. Rebound secured by Khris Giddey.

[00:10] Team_008 possession (Score: 63-53)
FOUL! Offensive foul on Immanuel Young! Anfernee Sexton drew the charge! [Team fouls: 8] (Immanuel Young: 1 personal fouls) TURNOVER! (dead ball)

================================================================================
                              2ND QUARTER COMPLETE                              
================================================================================

2ND QUARTER SCORE: Team_002 40, Team_008 28

BOX SCORE:
================================================================================

Team_002
--------------------------------------------------------------------------------
Player                MIN  PTS  REB  AST  TO      FG   FG%      3P   3P%
--------------------------------------------------------------------------------
CJ Barrett             17    9    0    0   0   3/5    60.0     0/0   0.0
Miles Bane             18    6    1    1   0   2/4    50.0     0/0   0.0
Anfernee Sexton         7    5    1    2   0   2/4    50.0     0/0   0.0
Tyler Porzingis        17    4    2    0   0   2/3    66.7     0/0   0.0
Carmelo Lowry          17    3    2    1   0   1/1   100.0     0/0   0.0
Jordan Green           18    3    0    0   0   1/1   100.0     0/0   0.0
Dirk Middleton          7    3    0    0   0   1/1   100.0     0/0   0.0
John Duncan             7    2    0    2   0   1/1   100.0     0/0   0.0
Julius Curry            7    2    0    0   0   1/1   100.0     0/0   0.0
Lamelo O'Neal           7    2    1    0   0   1/1   100.0     0/0   0.0

TEAM: FG: 15/22 (68.2%), 3PT: 9/9 (100.0%), REB: 7 (1 off, 6 def), AST: 6, TO: 1
TEAM FOULS: 5 [Team_008 in BONUS]


Team_008
--------------------------------------------------------------------------------
Player                MIN  PTS  REB  AST  TO      FG   FG%      3P   3P%
--------------------------------------------------------------------------------
Tyrese Thompson        17    8    1    0   0   3/3   100.0     0/0   0.0
Khris Hyland           17    6    3    0   0   2/2   100.0     0/0   0.0
Chris Griffin           7    5    0    0   0   2/2   100.0     0/0   0.0
Jrue Harris            17    4    0    0   0   2/4    50.0     0/0   0.0
Lamelo Middleton        7    3    1    1   0   1/1   100.0     0/0   0.0
Victor Leonard         17    2    0    2   0   1/3    33.3     0/0   0.0
Magic Young            17    0    2    2   0   0/0     0.0     0/0   0.0
Blake Holiday           7    0    0    1   0   0/0     0.0     0/0   0.0
Immanuel Young          7    0    0    0   0   0/1     0.0     0/0   0.0
Khris Giddey            7    0    2    0   0   0/0     0.0     0/0   0.0

TEAM: FG: 11/17 (64.7%), 3PT: 1/4 (25.0%), REB: 9 (2 off, 7 def), AST: 6, TO: 6
TEAM FOULS: 8 [Team_002 in BONUS]

================================================================================

================================================================================
                       3RD QUARTER - Team_002 vs Team_008                       
================================================================================

[12:00] Team_002 possession (Score: 63-53)
Miles Bane attempts a Midrange. Contested by Jrue Harris (2.4 feet, ZONE). Miles Bane misses. Rebound secured by Khris Hyland.

[11:44] Team_008 possession (Score: 63-53)
Khris Hyland attempts a Midrange. Contested by CJ Barrett (3.1 feet, ZONE). KHRIS HYLAND MAKES IT! Assist: Victor Leonard
Score: 63-55

[11:31] Team_002 possession (Score: 63-55)
Jordan Green attempts a 3Pt. Wide open! Victor Leonard is 8.4 feet away. [ZONE] Jordan Green misses. FOUL! Loose ball foul on Magic Young during the rebound battle. [Team fouls: 1] No free throws, side out. (Magic Young: 1 personal fouls)

[11:19] Team_002 possession (Score: 63-55)
FOUL! Holding foul on Khris Hyland. [Team fouls: 2] No free throws, side out. (Khris Hyland: 1 personal fouls)

[11:07] Team_002 possession (Score: 63-55)
Jordan Green attempts a 3Pt. Contested by Victor Leonard (5.5 feet, ZONE). Jordan Green misses. Rebound secured by Magic Young.

[10:53] Team_008 possession (Score: 63-55)
Jrue Harris attempts a Midrange. Contested by Miles Bane (4.9 feet, ZONE). JRUE HARRIS MAKES IT!
Score: 63-57

[10:36] Team_002 possession (Score: 63-57)
Jordan Green attempts a 3Pt. Wide open! Victor Leonard is 8.0 feet away. [ZONE] JORDAN GREEN MAKES IT! Assist: Miles Bane
Score: 66-57

[10:20] Team_008 possession (Score: 66-57)
Victor Leonard drives, Miles Bane stays with him. Victor Leonard attempts a Layup. Heavily contested by Miles Bane (0.5 feet, MAN)! Victor Leonard misses. Rebound secured by Miles Bane.

[10:10] Team_002 possession (Score: 66-57)
Jordan Green attempts a Midrange. BLOCKED BY KHRIS HYLAND! Ball is loose! Rebound secured by Khris Hyland.

[09:58] Team_008 possession (Score: 66-57)
Victor Leonard drives, Carmelo Lowry stays with him. Victor Leonard attempts a Dunk. Wide open! Carmelo Lowry is 8.3 feet away. [ZONE] VICTOR LEONARD MAKES IT! Assist: Jrue Harris
Score: 66-59

[09:43] Team_002 possession (Score: 66-59)
CJ Barrett attempts a 3Pt. Contested by Jrue Harris (4.3 feet, MAN). CJ BARRETT MAKES IT! Assist: Jordan Green
Score: 69-59

[09:30] Team_008 possession (Score: 69-59)
Tyrese Thompson drives, Carmelo Lowry stays with him. Tyrese Thompson attempts a Layup. Contested by Carmelo Lowry (4.0 feet, MAN). TYRESE THOMPSON MAKES IT! Assist: Magic Young
Score: 69-61

[09:19] Team_002 possession (Score: 69-61)
FOUL! Shooting foul on Jrue Harris. Carmelo Lowry to the line for 2 free throws. [Team fouls: 3] (Jrue Harris: 1 personal fouls)   FT 1/2: MISS   FT 2/2: GOOD Carmelo Lowry makes 1/2 from the line.
Score: 70-61

[09:04] Team_008 possession (Score: 70-61)
Tyrese Thompson attempts a Layup. Heavily contested by Tyler Porzingis (1.7 feet, ZONE)! Tyrese Thompson misses. Rebound secured by Carmelo Lowry.

[08:46] Team_002 possession (Score: 70-61)
Jordan Green attempts a 3Pt. Contested by Khris Hyland (4.8 feet, MAN). Jordan Green misses. Rebound secured by Tyrese Thompson.

[08:31] Team_008 possession (Score: 70-61)
Tyrese Thompson drives to the basket... Tyrese Thompson throws a bad pass out of bounds! TURNOVER! (dead ball)

[08:13] Team_002 possession (Score: 70-61)
Jordan Green loses the ball! Stripped by Khris Hyland! TURNOVER! (live ball)

[07:59] Team_008 possession (Score: 70-61)
Khris Hyland attempts a 3Pt. Wide open! CJ Barrett is 6.1 feet away. [ZONE] KHRIS HYLAND MAKES IT! Assist: Tyrese Thompson
Score: 70-64

[07:45] Team_002 possession (Score: 70-64)
Carmelo Lowry attempts a Layup. Contested by Tyrese Thompson (2.9 feet, ZONE). CARMELO LOWRY MAKES IT!
Score: 72-64

[07:26] Team_008 possession (Score: 72-64)
FOUL! Shooting foul on Jordan Green. Khris Hyland to the line for 2 free throws. [Team fouls: 1] (Jordan Green: 1 personal fouls)   FT 1/2: GOOD   FT 2/2: MISS Khris Hyland makes 1/2 from the line. Offensive rebound by Tyrese Thompson! Tyrese Thompson kicks it out.
Score: 72-65

[07:11] Team_008 possession (Score: 72-65)
Khris Hyland throws a bad pass! Stolen by Jordan Green! TURNOVER! (live ball)

[06:54] Team_002 possession (Score: 72-65)
CJ Barrett attempts a Midrange. Contested by Jrue Harris (2.5 feet, MAN). CJ BARRETT MAKES IT! Assist: Jordan Green
Score: 74-65

[06:38] Team_008 possession (Score: 74-65)
Victor Leonard makes the Layup and draws the foul on Tyler Porzingis! And-1! Victor Leonard to the line for 1. [Team fouls: 2] (Tyler Porzingis: 1 personal fouls)   FT 1/1: GOOD Victor Leonard makes 1/1 from the line.
Score: 74-68

[06:24] Team_002 possession (Score: 74-68)
Carmelo Lowry attempts a Midrange. Heavily contested by Tyrese Thompson (1.3 feet, MAN)! Carmelo Lowry misses. Rebound secured by Khris Hyland.

[06:13] Team_008 possession (Score: 74-68)
Victor Leonard attempts a 3Pt. Contested by CJ Barrett (4.3 feet, ZONE). VICTOR LEONARD MAKES IT! Assist: Tyrese Thompson
Score: 74-71

[05:57] Team_002 possession (Score: 74-71)
Miles Bane attempts a 3Pt. Contested by Tyrese Thompson (2.4 feet, ZONE). Miles Bane misses. Rebound secured by Tyrese Thompson.

[05:42] Team_008 possession (Score: 74-71)
Jrue Harris attempts a 3Pt. Contested by CJ Barrett (4.6 feet, MAN). JRUE HARRIS MAKES IT! Assist: Tyrese Thompson
Score: 74-74

[05:30] Team_002 possession (Score: 74-74)
CJ Barrett drives and kicks out. Miles Bane attempts a Midrange. Contested by Victor Leonard (2.6 feet, MAN). Miles Bane misses. FOUL! Loose ball foul on Khris Hyland during the rebound battle. [Team fouls: 4] No free throws, side out. (Khris Hyland: 2 personal fouls)

[05:15] Team_002 possession (Score: 74-74)
Carmelo Lowry attempts a 3Pt. Wide open! Victor Leonard is 6.1 feet away. [ZONE] CARMELO LOWRY MAKES IT! Assist: Jordan Green
Score: 77-74

[05:00] Team_008 possession (Score: 77-74)
Khris Hyland attempts a Layup. Contested by Tyler Porzingis (2.7 feet, ZONE). KHRIS HYLAND MAKES IT!
Score: 77-76

[04:46] Team_002 possession (Score: 77-76)
Jordan Green attempts a Midrange. Wide open! Magic Young is 6.5 feet away. [ZONE] Jordan Green misses. Rebound secured by Khris Hyland.

[04:30] Team_008 possession (Score: 77-76)
Magic Young drives, Tyler Porzingis stays with him. Magic Young attempts a Layup. Heavily contested by Tyler Porzingis (0.5 feet, ZONE)! Magic Young misses. Rebound secured by Miles Bane.

[04:12] Team_002 possession (Score: 77-76)
Tyler Porzingis drives and kicks out. CJ Barrett attempts a 3Pt. Contested by Victor Leonard (5.5 feet, ZONE). CJ Barrett misses. Rebound secured by Magic Young.

[03:57] Team_008 possession (Score: 77-76)
Magic Young drives, picks up Tyler Porzingis. Help arrives from CJ Barrett! Magic Young attempts a Dunk. Contested by CJ Barrett (3.8 feet, ZONE). Magic Young misses. Rebound secured by Miles Bane.

[03:41] Team_002 possession (Score: 77-76)
Miles Bane attempts a 3Pt. Contested by Victor Leonard (5.0 feet, ZONE). Miles Bane misses. Rebound secured by Khris Hyland.

[03:25] Team_008 possession (Score: 77-76)
Khris Hyland attempts a 3Pt. Wide open! Jordan Green is 7.3 feet away. [MAN] Khris Hyland misses. Rebound secured by Miles Bane.

[03:06] Team_002 possession (Score: 77-76)
Carmelo Lowry drives, Tyrese Thompson stays with him. Carmelo Lowry attempts a Layup. Wide open! Tyrese Thompson is 6.1 feet away. [ZONE] CARMELO LOWRY MAKES IT! Assist: Jordan Green
Score: 79-76

[02:47] Team_008 possession (Score: 79-76)
Victor Leonard attempts a 3Pt. Contested by Miles Bane (3.6 feet, MAN). Victor Leonard misses. Rebound secured by Carmelo Lowry.

[02:33] Team_002 possession (Score: 79-76)
Miles Bane attempts a Midrange. Contested by Tyrese Thompson (3.8 feet, ZONE). Miles Bane misses. Rebound secured by Magic Young.

[02:15] Team_008 possession (Score: 79-76)
Jrue Harris commits a violation (traveling/carry)! TURNOVER! (dead ball)

[02:15] Substitution (Team_002): Carmelo Lowry OUT → Julius Curry IN (stamina_rule2)

[02:15] Substitution (Team_002): Tyler Porzingis OUT → Lamelo O'Neal IN (stamina_rule2)

[02:15] Substitution (Team_008): Victor Leonard OUT → Blake Holiday IN (stamina_rule2)

[02:15] Substitution (Team_008): Khris Hyland OUT → Immanuel Young IN (stamina_rule2)

[02:15] Substitution (Team_008): Tyrese Thompson OUT → Khris Giddey IN (stamina_rule2)

[02:15] Substitution (Team_008): Magic Young OUT → Lamelo Middleton IN (stamina_rule2)

[02:03] Team_002 possession (Score: 79-76)
Jordan Green attempts a Midrange. Wide open! Immanuel Young is 6.1 feet away. [MAN] JORDAN GREEN MAKES IT!
Score: 81-76

[01:48] Team_008 possession (Score: 81-76)
Blake Holiday attempts a 3Pt. Heavily contested by Miles Bane (0.5 feet, MAN)! Blake Holiday misses. Offensive rebound by Lamelo Middleton! Lamelo Middleton puts it back in!
Score: 81-78

[01:33] Team_002 possession (Score: 81-78)
Lamelo O'Neal drives to the basket... Lamelo O'Neal loses control! Ball rolls out of bounds! TURNOVER! (dead ball)

[01:33] Substitution (Team_002): Miles Bane OUT → John Duncan IN (stamina_rule2)

[01:33] Substitution (Team_002): CJ Barrett OUT → Dirk Middleton IN (stamina_rule2)

[01:33] Substitution (Team_002): Jordan Green OUT → Anfernee Sexton IN (stamina_rule2)

[01:33] Substitution (Team_008): Jrue Harris OUT → Chris Griffin IN (stamina_rule2)

[01:17] Team_008 possession (Score: 81-78)
Blake Holiday attempts a 3Pt. Contested by Julius Curry (5.0 feet, ZONE). Blake Holiday misses. Rebound secured by Anfernee Sexton.

[01:05] Team_002 possession (Score: 81-78)
Dirk Middleton drives to the basket... Dirk Middleton loses the ball! Stripped by Lamelo Middleton! TURNOVER! (live ball)

[00:49] Team_008 possession (Score: 81-78)
Chris Griffin throws a bad pass out of bounds! TURNOVER! (dead ball)

[00:30] Team_002 possession (Score: 81-78)
Lamelo O'Neal attempts a 3Pt. Contested by Khris Giddey (4.6 feet, ZONE). LAMELO O'NEAL MAKES IT! Assist: Julius Curry
Score: 84-78

[00:13] Team_008 possession (Score: 84-78)
Blake Holiday attempts a 3Pt. Contested by Julius Curry (5.8 feet, ZONE). Blake Holiday misses. FOUL! Loose ball foul on Anfernee Sexton during the rebound battle. [Team fouls: 3] No free throws, side out. (Anfernee Sexton: 1 personal fouls)

[00:03] Team_008 possession (Score: 84-78)
Blake Holiday attempts a 3Pt. Wide open! Dirk Middleton is 9.5 feet away. [ZONE] Blake Holiday misses. Rebound secured by Anfernee Sexton.

================================================================================
                              3RD QUARTER COMPLETE                              
================================================================================

3RD QUARTER SCORE: Team_002 21, Team_008 25

BOX SCORE:
================================================================================

Team_002
--------------------------------------------------------------------------------
Player                MIN  PTS  REB  AST  TO      FG   FG%      3P   3P%
--------------------------------------------------------------------------------
Carmelo Lowry          27    8    3    0   0   4/5    80.0     0/0   0.0
Jordan Green           28    5    0    4   0   2/6    33.3     0/0   0.0
CJ Barrett             28    5    0    0   0   2/2   100.0     0/0   0.0
Lamelo O'Neal           9    3    0    0   0   1/1   100.0     0/0   0.0
Miles Bane             28    0    4    1   0   0/4     0.0     0/0   0.0
Tyler Porzingis        27    0    1    0   0   0/1     0.0     0/0   0.0
Anfernee Sexton         8    0    2    0   0   0/0     0.0     0/0   0.0
Julius Curry            9    0    0    1   0   0/0     0.0     0/0   0.0

TEAM: FG: 9/19 (47.4%), 3PT: 4/8 (50.0%), REB: 10 (2 off, 8 def), AST: 6, TO: 3
TEAM FOULS: 3


Team_008
--------------------------------------------------------------------------------
Player                MIN  PTS  REB  AST  TO      FG   FG%      3P   3P%
--------------------------------------------------------------------------------
Victor Leonard         27    8    0    1   0   3/5    60.0     0/0   0.0
Khris Hyland           27    7    5    0   0   3/4    75.0     0/0   0.0
Jrue Harris            28    5    0    1   0   2/2   100.0     0/0   0.0
Tyrese Thompson        27    2    3    3   0   1/2    50.0     0/0   0.0
Lamelo Middleton        9    2    2    0   0   1/1   100.0     0/0   0.0
Magic Young            27    0    3    1   0   0/2     0.0     0/0   0.0
Blake Holiday           9    0    0    0   0   0/2     0.0     0/0   0.0

TEAM: FG: 10/18 (55.6%), 3PT: 4/8 (50.0%), REB: 13 (3 off, 10 def), AST: 6, TO: 4
TEAM FOULS: 4

================================================================================

================================================================================
                       4TH QUARTER - Team_002 vs Team_008                       
================================================================================

[12:00] Team_002 possession (Score: 84-78)
CJ Barrett attempts a 3Pt. Contested by Victor Leonard (4.0 feet, ZONE). CJ Barrett misses. Rebound secured by Tyrese Thompson.

[11:49] Team_008 possession (Score: 84-78)
Magic Young attempts a Layup. BLOCKED BY TYLER PORZINGIS! Ball is loose! Rebound secured by Miles Bane.

[11:34] Team_002 possession (Score: 84-78)
CJ Barrett attempts a 3Pt. Contested by Jrue Harris (4.7 feet, MAN). CJ Barrett misses. Offensive rebound by Tyler Porzingis! Tyler Porzingis puts it back in!
Score: 86-78

[11:21] Team_008 possession (Score: 86-78)
Khris Hyland attempts a 3Pt. Contested by CJ Barrett (4.9 feet, ZONE). Khris Hyland misses. Rebound secured by Carmelo Lowry.

[11:09] Team_002 possession (Score: 86-78)
Miles Bane loses control! Ball rolls out of bounds! TURNOVER! (dead ball)

[10:54] Team_008 possession (Score: 86-78)
Victor Leonard attempts a 3Pt. Contested by Miles Bane (5.4 feet, MAN). Victor Leonard misses. Rebound secured by Tyler Porzingis.

[10:41] Team_002 possession (Score: 86-78)
Tyler Porzingis drives, picks up Tyrese Thompson. Help arrives from Jrue Harris! Tyler Porzingis attempts a Layup. Contested by Jrue Harris (5.9 feet, ZONE). TYLER PORZINGIS MAKES IT! Assist: Carmelo Lowry
Score: 88-78

[10:25] Team_008 possession (Score: 88-78)
Jrue Harris attempts a Midrange. Contested by Carmelo Lowry (3.6 feet, ZONE). Jrue Harris misses. Rebound secured by Tyler Porzingis.

[10:15] Team_002 possession (Score: 88-78)
CJ Barrett drives, Tyrese Thompson stays with him. CJ Barrett attempts a Dunk. Heavily contested by Tyrese Thompson (0.5 feet, ZONE)! CJ Barrett misses. Rebound secured by Tyrese Thompson.

[09:58] Team_008 possession (Score: 88-78)
Jrue Harris attempts a Midrange. Contested by Jordan Green (5.5 feet, ZONE). JRUE HARRIS MAKES IT! Assist: Magic Young
Score: 88-80

[09:42] Team_002 possession (Score: 88-80)
Miles Bane drives and kicks out. Carmelo Lowry attempts a 3Pt. Contested by Victor Leonard (2.4 feet, ZONE). CARMELO LOWRY MAKES IT! Assist: CJ Barrett
Score: 91-80

[09:29] Team_008 possession (Score: 91-80)
Victor Leonard drives, Miles Bane stays with him. Victor Leonard attempts a Layup. Contested by Miles Bane (3.7 feet, MAN). VICTOR LEONARD MAKES IT!
Score: 91-82

[09:13] Team_002 possession (Score: 91-82)
CJ Barrett drives and kicks out. Miles Bane attempts a 3Pt. Contested by Victor Leonard (5.7 feet, ZONE). Miles Bane misses. Rebound secured by Tyrese Thompson.

[09:03] Team_008 possession (Score: 91-82)
Tyrese Thompson attempts a 3Pt. Contested by Carmelo Lowry (3.4 feet, MAN). Tyrese Thompson misses. Rebound secured by Miles Bane.

[08:48] Team_002 possession (Score: 91-82)
Carmelo Lowry attempts a Midrange. Contested by Khris Hyland (5.0 feet, ZONE). Carmelo Lowry misses. Rebound secured by Khris Hyland.

[08:38] Team_008 possession (Score: 91-82)
Magic Young attempts a Midrange. Wide open! Tyler Porzingis is 8.8 feet away. [MAN] Magic Young misses. Rebound secured by Tyler Porzingis.

[08:24] Team_002 possession (Score: 91-82)
Miles Bane attempts a 3Pt. Contested by Victor Leonard (5.6 feet, MAN). Miles Bane misses. Rebound secured by Magic Young.

[08:10] Team_008 possession (Score: 91-82)
Magic Young attempts a 3Pt. Wide open! Miles Bane is 7.2 feet away. [ZONE] Magic Young misses. Rebound secured by Carmelo Lowry.

[07:59] Team_002 possession (Score: 91-82)
FOUL! Holding foul on Magic Young. [Team fouls: 1] No free throws, side out. (Magic Young: 1 personal fouls)

[07:48] Team_002 possession (Score: 91-82)
Jordan Green attempts a Midrange. Contested by Khris Hyland (5.3 feet, MAN). Jordan Green misses. Offensive rebound by Tyler Porzingis! Tyler Porzingis puts it back in!
Score: 93-82

[07:31] Team_008 possession (Score: 93-82)
Victor Leonard attempts a 3Pt. Contested by Miles Bane (5.3 feet, ZONE). Victor Leonard misses. Rebound secured by Carmelo Lowry.

[07:17] Team_002 possession (Score: 93-82)
Tyler Porzingis makes the Dunk and draws the foul on Tyrese Thompson! And-1! Tyler Porzingis to the line for 1. [Team fouls: 2] (Tyrese Thompson: 1 personal fouls)   FT 1/1: GOOD Tyler Porzingis makes 1/1 from the line.
Score: 96-82

[07:04] Team_008 possession (Score: 96-82)
Victor Leonard drives and kicks out. Victor Leonard attempts a 3Pt. Wide open! Miles Bane is 6.3 feet away. [ZONE] Victor Leonard misses. Rebound secured by Carmelo Lowry.

[06:47] Team_002 possession (Score: 96-82)
Tyler Porzingis attempts a 3Pt. Wide open! Victor Leonard is 6.4 feet away. [ZONE] Tyler Porzingis misses. Rebound secured by Magic Young.

[06:33] Team_008 possession (Score: 96-82)
Magic Young throws a bad pass! Stolen by Tyler Porzingis! TURNOVER! (live ball)

[06:19] Team_002 possession (Score: 96-82)
Carmelo Lowry attempts a Layup. Heavily contested by Tyrese Thompson (1.7 feet, MAN)! CARMELO LOWRY MAKES IT! Assist: Tyler Porzingis
Score: 98-82

[06:06] Team_008 possession (Score: 98-82)
Victor Leonard attempts a Midrange. Contested by Miles Bane (4.6 feet, MAN). Victor Leonard misses. Rebound secured by Tyler Porzingis.

[05:49] Team_002 possession (Score: 98-82)
Tyler Porzingis drives and kicks out. Carmelo Lowry attempts a 3Pt. Contested by Victor Leonard (5.2 feet, ZONE). Carmelo Lowry misses. Rebound secured by Khris Hyland.

[05:35] Team_008 possession (Score: 98-82)
Victor Leonard attempts a 3Pt. Wide open! Miles Bane is 8.7 feet away. [ZONE] VICTOR LEONARD MAKES IT! Assist: Magic Young
Score: 98-85

[05:19] Team_002 possession (Score: 98-85)
Carmelo Lowry drives and kicks out. Jordan Green attempts a 3Pt. Contested by Khris Hyland (5.6 feet, MAN). Jordan Green misses. Rebound secured by Tyrese Thompson.

[05:07] Team_008 possession (Score: 98-85)
Tyrese Thompson attempts a Midrange. Contested by Carmelo Lowry (3.6 feet, MAN). Tyrese Thompson misses. Rebound secured by Tyler Porzingis.

[04:55] Team_002 possession (Score: 98-85)
Miles Bane attempts a Layup. Contested by Victor Leonard (2.2 feet, MAN). Miles Bane misses. Rebound secured by Tyrese Thompson.

[04:40] Team_008 possession (Score: 98-85)
FOUL! Reach-in foul on CJ Barrett during the drive. [Team fouls: 1] No free throws, side out. (CJ Barrett: 1 personal fouls)

[04:28] Team_008 possession (Score: 98-85)
Victor Leonard drives, picks up Tyler Porzingis. Help arrives from CJ Barrett! Victor Leonard attempts a Layup. Heavily contested by CJ Barrett (1.8 feet, ZONE)! VICTOR LEONARD MAKES IT!
Score: 98-87

[04:18] Team_002 possession (Score: 98-87)
CJ Barrett attempts a Layup. Wide open! Tyrese Thompson is 6.0 feet away. [ZONE] CJ BARRETT MAKES IT!
Score: 100-87

[04:04] Team_008 possession (Score: 100-87)
Tyrese Thompson throws a bad pass! Stolen by Carmelo Lowry! TURNOVER! (live ball)

[03:51] Team_002 possession (Score: 100-87)
Miles Bane attempts a 3Pt. Wide open! Victor Leonard is 6.4 feet away. [ZONE] Miles Bane misses. Rebound secured by Khris Hyland.

[03:38] Team_008 possession (Score: 100-87)
FOUL! Holding foul on Tyler Porzingis. [Team fouls: 2] No free throws, side out. (Tyler Porzingis: 1 personal fouls)

[03:26] Team_008 possession (Score: 100-87)
Magic Young drives and kicks out. Victor Leonard attempts a Midrange. Wide open! Carmelo Lowry is 9.2 feet away. [ZONE] VICTOR LEONARD MAKES IT! Assist: Tyrese Thompson
Score: 100-89

[03:13] Team_002 possession (Score: 100-89)
FOUL! Shooting foul on Jrue Harris. Jordan Green to the line for 2 free throws. [Team fouls: 3] (Jrue Harris: 1 personal fouls)   FT 1/2: MISS   FT 2/2: GOOD Jordan Green makes 1/2 from the line.
Score: 101-89

[02:59] Team_008 possession (Score: 101-89)
FOUL! Shooting foul on CJ Barrett. Khris Hyland to the line for 2 free throws. [Team fouls: 3] (CJ Barrett: 2 personal fouls)   FT 1/2: GOOD   FT 2/2: GOOD Khris Hyland makes 2/2 from the line.
Score: 101-91

[02:45] Team_002 possession (Score: 101-91)
FOUL! Holding foul on Magic Young. [Team fouls: 4] No free throws, side out. (Magic Young: 2 personal fouls)

[02:30] Team_002 possession (Score: 101-91)
Jordan Green attempts a 3Pt. Wide open! Khris Hyland is 6.6 feet away. [ZONE] JORDAN GREEN MAKES IT! Assist: Carmelo Lowry
Score: 104-91

[02:19] Team_008 possession (Score: 104-91)
Victor Leonard attempts a 3Pt. Wide open! Miles Bane is 6.9 feet away. [MAN] Victor Leonard misses. Rebound secured by Tyler Porzingis.

[02:02] Team_002 possession (Score: 104-91)
FOUL! Reach-in foul on Jrue Harris during the drive. [IN THE BONUS! 5 team fouls] CJ Barrett to the line for 2 free throws. (Jrue Harris: 2 personal fouls)   FT 1/2: MISS   FT 2/2: MISS CJ Barrett makes 0/2 from the line. Rebound secured by Tyrese Thompson.

[01:49] Team_008 possession (Score: 104-91)
Khris Hyland attempts a Layup. Contested by Tyler Porzingis (3.2 feet, ZONE). KHRIS HYLAND MAKES IT! Assist: Tyrese Thompson
Score: 104-93

[01:31] Team_002 possession (Score: 104-93)
Tyler Porzingis attempts a Midrange. Contested by Magic Young (5.3 feet, MAN). TYLER PORZINGIS MAKES IT!
Score: 106-93

[01:20] Team_008 possession (Score: 106-93)
Khris Hyland attempts a 3Pt. Contested by Miles Bane (4.6 feet, ZONE). Khris Hyland misses. Rebound secured by Miles Bane.

[01:07] Team_002 possession (Score: 106-93)
Miles Bane drives and kicks out. CJ Barrett attempts a 3Pt. Wide open! Jrue Harris is 8.1 feet away. [MAN] CJ Barrett misses. Offensive rebound by Tyler Porzingis! Tyler Porzingis kicks it out.

[00:52] Team_002 possession (Score: 106-93)
Tyler Porzingis drives, Magic Young stays with him. Tyler Porzingis attempts a Layup. Contested by Magic Young (5.8 feet, MAN). TYLER PORZINGIS MAKES IT!
Score: 108-93

[00:39] Team_008 possession (Score: 108-93)
FOUL! Reach-in foul on Miles Bane during the drive. [Team fouls: 4] No free throws, side out. (Miles Bane: 1 personal fouls)

[00:19] Team_008 possession (Score: 108-93)
Khris Hyland attempts a Midrange. Wide open! Jordan Green is 7.2 feet away. [MAN] KHRIS HYLAND MAKES IT! Assist: Tyrese Thompson
Score: 108-95

[00:04] Team_002 possession (Score: 108-95)
CJ Barrett drives and kicks out. Carmelo Lowry attempts a Midrange. Contested by Khris Hyland (3.9 feet, ZONE). Carmelo Lowry misses. FOUL! Loose ball foul on Khris Hyland during the rebound battle. [IN THE BONUS! 6 team fouls] Tyler Porzingis to the line for 2 free throws. (Khris Hyland: 1 personal fouls)   FT 1/2: GOOD   FT 2/2: GOOD Tyler Porzingis makes 2/2 from the line.
Score: 110-95

================================================================================
                              4TH QUARTER COMPLETE                              
================================================================================

4TH QUARTER SCORE: Team_002 26, Team_008 17

BOX SCORE:
================================================================================

Team_002
--------------------------------------------------------------------------------
Player                MIN  PTS  REB  AST  TO      FG   FG%      3P   3P%
--------------------------------------------------------------------------------
Tyler Porzingis        39   15    9    1   0   7/9    77.8     0/0   0.0
Carmelo Lowry          39    5    4    2   0   2/4    50.0     0/0   0.0
Jordan Green           40    4    0    0   0   2/2   100.0     0/0   0.0
CJ Barrett             40    2    0    1   0   1/5    20.0     0/0   0.0
Miles Bane             40    0    3    0   0   0/3     0.0     0/0   0.0

TEAM: FG: 12/23 (52.2%), 3PT: 2/6 (33.3%), REB: 16 (3 off, 13 def), AST: 4, TO: 1
TEAM FOULS: 4


Team_008
--------------------------------------------------------------------------------
Player                MIN  PTS  REB  AST  TO      FG   FG%      3P   3P%
--------------------------------------------------------------------------------
Victor Leonard         39    9    0    0   0   4/9    44.4     0/0   0.0
Khris Hyland           39    6    3    0   0   3/5    60.0     0/0   0.0
Jrue Harris            40    2    0    0   0   1/2    50.0     0/0   0.0
Tyrese Thompson        39    0    6    3   0   0/2     0.0     0/0   0.0
Magic Young            39    0    2    2   0   0/3     0.0     0/0   0.0

TEAM: FG: 8/21 (38.1%), 3PT: 1/8 (12.5%), REB: 11 (0 off, 11 def), AST: 5, TO: 2
TEAM FOULS: 6 [Team_002 in BONUS]

================================================================================

================================================================================
                               FULL GAME COMPLETE                               
================================================================================

FINAL SCORE: Team_002 110, Team_008 95

SCORING BY QUARTER:
--------------------------------------------------------------------------------
Team                     Q1     Q2     Q3     Q4    FINAL
--------------------------------------------------------------------------------
Team_002                 23     40     21     26      110
Team_008                 25     28     25     17       95
--------------------------------------------------------------------------------

FULL GAME BOX SCORE:
================================================================================

Team_002
--------------------------------------------------------------------------------
Player                MIN  PTS  REB  AST  TO      FG   FG%      3P   3P%      FT STL BLK
--------------------------------------------------------------------------------
Miles Bane             40    9    9    3   2   4/16   25.0   2/9    22.2   1/1     0   0
Jordan Green           40   18    0    4   2   9/16   56.2   3/5    60.0   5/7     1   0
CJ Barrett             40   19    0    1   0  10/16   62.5   6/7    85.7   2/5     0   0
Carmelo Lowry          39   16   13    3   0   6/10   60.0   2/2   100.0   1/3     1   0
Tyler Porzingis        39   28   19    2   1   7/13   53.8   0/1     0.0   4/4     1   2
Julius Curry            9    2    0    1   0   1/1   100.0   0/0     0.0   0/0     0   0
Lamelo O'Neal           9    5    1    0   0   2/4    50.0   1/1   100.0   0/0     3   0
Dirk Middleton          8    3    0    0   2   1/1   100.0   1/1   100.0   0/0     0   0
John Duncan             8    2    0    2   1   1/2    50.0   0/1     0.0   0/0     0   0
Anfernee Sexton         8    5    3    2   0   2/4    50.0   2/2   100.0   2/2     1   0

TEAM: FG: 43/83 (51.8%), 3PT: 17/29 (58.6%), REB: 44 (9 off, 35 def), AST: 18, TO: 8


Team_008
--------------------------------------------------------------------------------
Player                MIN  PTS  REB  AST  TO      FG   FG%      3P   3P%      FT STL BLK
--------------------------------------------------------------------------------
Jrue Harris            40   16    0    2   2   7/14   50.0   1/4    25.0   3/3     0   0
Victor Leonard         39   25    0    4   1  10/19   52.6   3/9    33.3   2/2     0   0
Khris Hyland           39   23   13    0   2   9/13   69.2   1/4    25.0   4/5     1   1
Tyrese Thompson        39   10   14    7   2   4/9    44.4   1/2    50.0   1/2     0   2
Magic Young            39    2   12    5   1   2/9    22.2   0/1     0.0   2/2     1   0
Blake Holiday           9    0    0    1   0   1/3    33.3   1/3    33.3   0/0     0   0
Immanuel Young          9    3    0    0   3   2/3    66.7   1/2    50.0   0/0     0   1
Khris Giddey            9    0    3    0   0   0/0     0.0   0/0     0.0   0/0     0   0
Lamelo Middleton        9    8    3    1   3   2/2   100.0   0/0     0.0   2/2     1   0
Chris Griffin           8    5    2    0   1   1/1   100.0   0/0     0.0   0/2     0   0

TEAM: FG: 38/74 (51.4%), 3PT: 8/25 (32.0%), REB: 47 (7 off, 40 def), AST: 20, TO: 15

================================================================================
