================================================================================
                        FULL GAME - Team_081 vs Team_100                        
================================================================================

================================================================================
                       1ST QUARTER - Team_081 vs Team_100                       
================================================================================

[12:00] Team_081 possession (Score: 0-0)
Vince Adebayo attempts a 3Pt. Wide open! Tyler Griffin is 7.5 feet away. [MAN] Vince Adebayo misses. Rebound secured by Pau LaVine.

[11:41] Team_100 possession (Score: 0-0)
FOUL! Shooting foul on Franz Antetokounmpo. Chris Mobley to the line for 2 free throws. [Team fouls: 1] (Franz Antetokounmpo: 1 personal fouls)   FT 1/2: GOOD   FT 2/2: GOOD Chris Mobley makes 2/2 from the line.
Score: 0-2

[11:27] Team_081 possession (Score: 0-2)
Julius Durant attempts a 3Pt. Wide open! Luka Green is 8.2 feet away. [MAN] Julius Durant misses. Rebound secured by Pau LaVine.

[11:14] Team_100 possession (Score: 0-2)
Pau LaVine loses the ball! Stripped by Bradley Sabonis! TURNOVER! (live ball)

[11:01] Team_081 possession (Score: 0-2)
Bradley Leonard drives to the basket... Bradley Leonard commits a violation (traveling/carry)! TURNOVER! (dead ball)

[10:48] Team_100 possession (Score: 0-2)
Pau LaVine attempts a Layup. BLOCKED BY FRANZ ANTETOKOUNMPO! Ball is loose! Offensive rebound by Pau LaVine! Pau LaVine kicks it out.

[10:33] Team_100 possession (Score: 0-2)
Tyler Griffin attempts a 3Pt. Wide open! Vince Adebayo is 6.1 feet away. [ZONE] TYLER GRIFFIN MAKES IT! Assist: Manu Ball
Score: 0-5

[10:19] Team_081 possession (Score: 0-5)
Bradley Sabonis attempts a Layup. Contested by Chris Mobley (5.0 feet, ZONE). BRADLEY SABONIS MAKES IT! Assist: Julius Durant
Score: 2-5

[10:05] Team_100 possession (Score: 2-5)
Chris Mobley drives and kicks out. Tyler Griffin attempts a Midrange. Contested by Vince Adebayo (2.5 feet, ZONE). Tyler Griffin misses. Rebound secured by Bradley Sabonis.

[09:54] Team_081 possession (Score: 2-5)
FOUL! Shooting foul on Tyler Griffin. Vince Adebayo to the line for 2 free throws. [Team fouls: 1] (Tyler Griffin: 1 personal fouls)   FT 1/2: GOOD   FT 2/2: GOOD Vince Adebayo makes 2/2 from the line.
Score: 4-5

[09:34] Team_100 possession (Score: 4-5)
Manu Ball attempts a Midrange. Wide open! Bradley Leonard is 7.4 feet away. [MAN] MANU BALL MAKES IT! Assist: Pau LaVine
Score: 4-7

[09:22] Team_081 possession (Score: 4-7)
Bradley Leonard drives, Pau LaVine stays with him. Bradley Leonard attempts a Layup. Wide open! Pau LaVine is 8.4 feet away. [ZONE] BRADLEY LEONARD MAKES IT! Assist: Julius Durant
Score: 6-7

[09:09] Team_100 possession (Score: 6-7)
Chris Mobley drives and kicks out. Pau LaVine attempts a 3Pt. Contested by Bradley Sabonis (3.2 feet, MAN). PAU LAVINE MAKES IT! Assist: Chris Mobley
Score: 6-10

[08:56] Team_081 possession (Score: 6-10)
Franz Antetokounmpo drives, picks up Pau LaVine. Help arrives from Manu Ball! Franz Antetokounmpo attempts a Dunk. Heavily contested by Manu Ball (0.5 feet, ZONE)! FRANZ ANTETOKOUNMPO MAKES IT! Assist: Bradley Leonard
Score: 8-10

[08:45] Team_100 possession (Score: 8-10)
FOUL! Holding foul on Bradley Leonard. [Team fouls: 2] No free throws, side out. (Bradley Leonard: 1 personal fouls)

[08:27] Team_100 possession (Score: 8-10)
Pau LaVine attempts a 3Pt. Contested by Bradley Sabonis (5.2 feet, MAN). PAU LAVINE MAKES IT! Assist: Manu Ball
Score: 8-13

[08:13] Team_081 possession (Score: 8-13)
Julius Durant attempts a 3Pt. Contested by Luka Green (4.5 feet, ZONE). Julius Durant misses. Offensive rebound by Franz Antetokounmpo! Franz Antetokounmpo puts it back in!
Score: 10-13

[07:58] Team_100 possession (Score: 10-13)
Luka Green attempts a 3Pt. Contested by Vince Adebayo (4.8 feet, ZONE). Luka Green misses. FOUL! Loose ball foul on Franz Antetokounmpo during the rebound battle. [Team fouls: 3] No free throws, side out. (Franz Antetokounmpo: 2 personal fouls)

[07:43] Team_100 possession (Score: 10-13)
Tyler Griffin attempts a 3Pt. Contested by Vince Adebayo (3.7 feet, ZONE). TYLER GRIFFIN MAKES IT! Assist: Manu Ball
Score: 10-16

[07:29] Team_081 possession (Score: 10-16)
Bradley Sabonis drives, Pau LaVine stays with him. Bradley Sabonis attempts a Layup. Heavily contested by Pau LaVine (2.0 feet, ZONE)! Bradley Sabonis misses. Rebound secured by Chris Mobley.

[07:18] Team_100 possession (Score: 10-16)
Manu Ball attempts a 3Pt. Wide open! Bradley Leonard is 6.8 feet away. [MAN] Manu Ball misses. Rebound secured by Franz Antetokounmpo.

[07:09] Team_081 possession (Score: 10-16)
Julius Durant attempts a 3Pt. Wide open! Luka Green is 6.9 feet away. [MAN] JULIUS DURANT MAKES IT! Assist: Bradley Sabonis
Score: 13-16

[06:55] Team_100 possession (Score: 13-16)
Luka Green attempts a 3Pt. Heavily contested by Vince Adebayo (1.5 feet, ZONE)! Luka Green misses. Rebound secured by Bradley Sabonis.

[06:41] Team_081 possession (Score: 13-16)
Vince Adebayo drives to the basket... FOUL! Offensive foul on Vince Adebayo! Pau LaVine drew the charge! [Team fouls: 4] (Vince Adebayo: 1 personal fouls) TURNOVER! (dead ball)

[06:31] Team_100 possession (Score: 13-16)
Manu Ball attempts a 3Pt. Contested by Vince Adebayo (3.6 feet, ZONE). Manu Ball misses. Rebound secured by Franz Antetokounmpo.

[06:12] Team_081 possession (Score: 13-16)
Franz Antetokounmpo makes the Layup and draws the foul on Pau LaVine! And-1! Franz Antetokounmpo to the line for 1. [Team fouls: 2] (Pau LaVine: 1 personal fouls)   FT 1/1: GOOD Franz Antetokounmpo makes 1/1 from the line.
Score: 16-16

[05:59] Team_100 possession (Score: 16-16)
Chris Mobley drives and kicks out. Chris Mobley attempts a 3Pt. Contested by Vince Adebayo (2.6 feet, ZONE). CHRIS MOBLEY MAKES IT!
Score: 16-19

[05:39] Team_081 possession (Score: 16-19)
Franz Antetokounmpo attempts a Midrange. Wide open! Manu Ball is 6.4 feet away. [ZONE] Franz Antetokounmpo misses. Offensive rebound by Bradley Sabonis! Bradley Sabonis kicks it out.

[05:22] Team_081 possession (Score: 16-19)
Vince Adebayo attempts a 3Pt. Contested by Tyler Griffin (4.1 feet, MAN). VINCE ADEBAYO MAKES IT! Assist: Julius Durant
Score: 19-19

[05:08] Team_100 possession (Score: 19-19)
Chris Mobley attempts a Layup. Wide open! Franz Antetokounmpo is 7.1 feet away. [ZONE] CHRIS MOBLEY MAKES IT! Assist: Manu Ball
Score: 19-21

[04:57] Team_081 possession (Score: 19-21)
Bradley Sabonis commits a violation (traveling/carry)! TURNOVER! (dead ball)

[04:41] Team_100 possession (Score: 19-21)
FOUL! Shooting foul on Franz Antetokounmpo. Manu Ball to the line for 2 free throws. [BONUS: 5 team fouls] (Franz Antetokounmpo: 3 personal fouls)   FT 1/2: MISS   FT 2/2: MISS Manu Ball makes 0/2 from the line. Rebound secured by Vince Adebayo.

[04:29] Team_081 possession (Score: 19-21)
Julius Durant attempts a 3Pt. Contested by Luka Green (2.8 feet, MAN). Julius Durant misses. Rebound secured by Pau LaVine.

[04:12] Team_100 possession (Score: 19-21)
Luka Green attempts a Layup. Contested by Julius Durant (4.1 feet, MAN). Luka Green misses. Rebound secured by Franz Antetokounmpo.

[03:54] Team_081 possession (Score: 19-21)
Franz Antetokounmpo drives, Pau LaVine stays with him. Franz Antetokounmpo attempts a Dunk. Heavily contested by Pau LaVine (1.8 feet, ZONE)! Franz Antetokounmpo misses. Rebound secured by Tyler Griffin.

[03:41] Team_100 possession (Score: 19-21)
Tyler Griffin attempts a Layup. BLOCKED BY FRANZ ANTETOKOUNMPO! Ball is loose! Rebound secured by Franz Antetokounmpo.

[03:25] Team_081 possession (Score: 19-21)
Bradley Leonard attempts a 3Pt. Wide open! Manu Ball is 9.9 feet away. [MAN] Bradley Leonard misses. Rebound secured by Pau LaVine.

[03:10] Team_100 possession (Score: 19-21)
FOUL! Shooting foul on Bradley Sabonis. Pau LaVine to the line for 3 free throws. [BONUS: 6 team fouls] (Bradley Sabonis: 1 personal fouls)   FT 1/3: MISS   FT 2/3: MISS   FT 3/3: GOOD Pau LaVine makes 1/3 from the line.
Score: 19-22

[02:56] Team_081 possession (Score: 19-22)
Vince Adebayo attempts a 3Pt. Contested by Tyler Griffin (4.1 feet, MAN). Vince Adebayo misses. Rebound secured by Chris Mobley.

[02:40] Team_100 possession (Score: 19-22)
Luka Green drives to the basket... Luka Green loses the ball! Stripped by Julius Durant! TURNOVER! (live ball)

[02:29] Team_081 possession (Score: 19-22)
Bradley Sabonis attempts a Layup. Wide open! Pau LaVine is 6.0 feet away. [MAN] Bradley Sabonis misses. Rebound secured by Chris Mobley.

[02:13] Team_100 possession (Score: 19-22)
FOUL! Shooting foul on Franz Antetokounmpo. Chris Mobley to the line for 2 free throws. [BONUS: 7 team fouls] (Franz Antetokounmpo: 4 personal fouls)   FT 1/2: GOOD   FT 2/2: MISS Chris Mobley makes 1/2 from the line. Rebound secured by Franz Antetokounmpo.
Score: 19-23

[02:03] Team_081 possession (Score: 19-23)
Julius Durant attempts a 3Pt. Wide open! Luka Green is 6.4 feet away. [ZONE] Julius Durant misses. Offensive rebound by Bradley Sabonis! Bradley Sabonis kicks it out.

[01:48] Team_081 possession (Score: 19-23)
Bradley Leonard loses control! Ball rolls out of bounds! TURNOVER! (dead ball)

[01:48] Substitution (Team_081): Julius Durant OUT → Dejounte Bane IN (stamina_rule2)

[01:48] Substitution (Team_081): Bradley Leonard OUT → Lamelo Wade IN (stamina_rule2)

[01:48] Substitution (Team_081): Vince Adebayo OUT → Larry Adebayo IN (stamina_rule2)

[01:48] Substitution (Team_081): Bradley Sabonis OUT → Chris Holiday IN (stamina_rule2)

[01:48] Substitution (Team_081): Franz Antetokounmpo OUT → D'Angelo Markkanen IN (stamina_rule2)

[01:48] Substitution (Team_100): Luka Green OUT → Dirk Sabonis IN (stamina_rule2)

[01:48] Substitution (Team_100): Manu Ball OUT → Evan Butler IN (stamina_rule2)

[01:48] Substitution (Team_100): Tyler Griffin OUT → Tyrese Wade IN (stamina_rule2)

[01:48] Substitution (Team_100): Pau LaVine OUT → Carmelo Ginobili IN (stamina_rule2)

[01:48] Substitution (Team_100): Chris Mobley OUT → John Rozier IN (stamina_rule2)

[01:32] Team_100 possession (Score: 19-23)
FOUL! Offensive foul on Tyrese Wade! Larry Adebayo drew the charge! [Team fouls: 3] (Tyrese Wade: 1 personal fouls) TURNOVER! (dead ball)

[01:21] Team_081 possession (Score: 19-23)
Lamelo Wade attempts a 3Pt. Contested by Tyrese Wade (4.0 feet, ZONE). LAMELO WADE MAKES IT! Assist: Chris Holiday
Score: 22-23

[01:07] Team_100 possession (Score: 22-23)
Carmelo Ginobili attempts a Midrange. Contested by Larry Adebayo (4.4 feet, ZONE). Carmelo Ginobili misses. Offensive rebound by John Rozier! John Rozier's putback is no good. Rebound secured by Lamelo Wade.

[00:55] Team_081 possession (Score: 22-23)
Dejounte Bane attempts a 3Pt. Contested by Dirk Sabonis (3.0 feet, MAN). DEJOUNTE BANE MAKES IT! Assist: Lamelo Wade
Score: 25-23

[00:41] Team_100 possession (Score: 25-23)
Evan Butler attempts a 3Pt. Heavily contested by Chris Holiday (0.5 feet, ZONE)! Evan Butler misses. Rebound secured by Chris Holiday.

[00:25] Team_081 possession (Score: 25-23)
Chris Holiday attempts a Layup. Contested by John Rozier (2.0 feet, ZONE). Chris Holiday misses. Rebound secured by Carmelo Ginobili.

[00:08] Team_100 possession (Score: 25-23)
Tyrese Wade attempts a 3Pt. Contested by Chris Holiday (2.5 feet, ZONE). Tyrese Wade misses. Rebound secured by Chris Holiday.

================================================================================
                              1ST QUARTER COMPLETE                              
================================================================================

1ST QUARTER SCORE: Team_081 25, Team_100 23

BOX SCORE:
================================================================================

Team_081
--------------------------------------------------------------------------------
Player                MIN  PTS  REB  AST  TO      FG   FG%      3P   3P%
--------------------------------------------------------------------------------
Franz Antetokounmpo    10    7    6    0   0   3/4    75.0     0/0   0.0
Vince Adebayo          10    5    1    0   0   2/4    50.0     0/0   0.0
Julius Durant          10    3    0    3   0   1/3    33.3     0/0   0.0
Lamelo Wade             2    3    1    1   0   1/1   100.0     0/0   0.0
Dejounte Bane           2    3    0    0   0   1/1   100.0     0/0   0.0
Bradley Sabonis        10    2    4    1   0   1/3    33.3     0/0   0.0
Bradley Leonard        10    2    0    1   0   1/2    50.0     0/0   0.0
Chris Holiday           2    0    2    1   0   0/1     0.0     0/0   0.0

TEAM: FG: 10/19 (52.6%), 3PT: 5/10 (50.0%), REB: 13 (3 off, 10 def), AST: 7, TO: 4
TEAM FOULS: 7 [Team_100 in BONUS]


Team_100
--------------------------------------------------------------------------------
Player                MIN  PTS  REB  AST  TO      FG   FG%      3P   3P%
--------------------------------------------------------------------------------
Pau LaVine             10    7    5    1   0   3/3   100.0     0/0   0.0
Chris Mobley           10    7    4    1   0   3/5    60.0     0/0   0.0
Tyler Griffin          10    6    1    0   0   2/3    66.7     0/0   0.0
Manu Ball              10    2    0    4   0   1/4    25.0     0/0   0.0
Luka Green             10    0    0    0   0   0/2     0.0     0/0   0.0
Carmelo Ginobili        2    0    1    0   0   0/1     0.0     0/0   0.0
Evan Butler             2    0    0    0   0   0/1     0.0     0/0   0.0
Tyrese Wade             2    0    0    0   0   0/1     0.0     0/0   0.0

TEAM: FG: 9/20 (45.0%), 3PT: 4/9 (44.4%), REB: 12 (3 off, 9 def), AST: 6, TO: 3
TEAM FOULS: 3

================================================================================

================================================================================
                       2ND QUARTER - Team_081 vs Team_100                       
================================================================================

[12:00] Team_081 possession (Score: 25-23)
Bradley Leonard attempts a Midrange. Contested by Manu Ball (5.7 feet, MAN). BRADLEY LEONARD MAKES IT!
Score: 27-23

[11:43] Team_100 possession (Score: 27-23)
Pau LaVine attempts a Layup. Wide open! Franz Antetokounmpo is 7.8 feet away. [ZONE] PAU LAVINE MAKES IT!
Score: 27-25

[11:30] Team_081 possession (Score: 27-25)
Franz Antetokounmpo attempts a 3Pt. Wide open! Luka Green is 8.3 feet away. [ZONE] FRANZ ANTETOKOUNMPO MAKES IT! Assist: Bradley Leonard
Score: 30-25

[11:19] Team_100 possession (Score: 30-25)
Manu Ball attempts a Midrange. Contested by Vince Adebayo (5.4 feet, ZONE). MANU BALL MAKES IT! Assist: Luka Green
Score: 30-27

[11:08] Team_081 possession (Score: 30-27)
Franz Antetokounmpo attempts a Midrange. Contested by Chris Mobley (5.0 feet, MAN). Franz Antetokounmpo misses. Rebound secured by Pau LaVine.

[10:50] Team_100 possession (Score: 30-27)
Tyler Griffin drives, picks up Vince Adebayo. Help arrives from Bradley Leonard! Tyler Griffin attempts a Layup. Contested by Bradley Leonard (3.0 feet, MAN). TYLER GRIFFIN MAKES IT! Assist: Manu Ball
Score: 30-29

[10:35] Team_081 possession (Score: 30-29)
Vince Adebayo attempts a 3Pt. Wide open! Luka Green is 8.4 feet away. [ZONE] Vince Adebayo misses. Rebound secured by Tyler Griffin.

[10:21] Team_100 possession (Score: 30-29)
Pau LaVine attempts a Midrange. Heavily contested by Bradley Leonard (1.4 feet, ZONE)! PAU LAVINE MAKES IT!
Score: 30-31

[10:05] Team_081 possession (Score: 30-31)
Franz Antetokounmpo attempts a Midrange. Wide open! Chris Mobley is 8.5 feet away. [MAN] Franz Antetokounmpo misses. Offensive rebound by Bradley Sabonis! Bradley Sabonis kicks it out.

[09:52] Team_081 possession (Score: 30-31)
Franz Antetokounmpo attempts a Midrange. Wide open! Tyler Griffin is 8.7 feet away. [ZONE] Franz Antetokounmpo misses. Rebound secured by Tyler Griffin.

[09:36] Team_100 possession (Score: 30-31)
Manu Ball drives, Bradley Leonard stays with him. Manu Ball attempts a Layup. Wide open! Bradley Leonard is 7.2 feet away. [MAN] Manu Ball misses. Offensive rebound by Pau LaVine! Pau LaVine kicks it out.

[09:25] Team_100 possession (Score: 30-31)
Pau LaVine drives to the basket... Pau LaVine throws a bad pass! Stolen by Bradley Sabonis! TURNOVER! (live ball)

[09:09] Team_081 possession (Score: 30-31)
Vince Adebayo makes the Layup and draws the foul on Tyler Griffin! And-1! Vince Adebayo to the line for 1. [Team fouls: 1] (Tyler Griffin: 1 personal fouls)   FT 1/1: MISS Vince Adebayo makes 0/1 from the line. Offensive rebound by Bradley Sabonis! Bradley Sabonis kicks it out.
Score: 32-31

[08:53] Team_081 possession (Score: 32-31)
FOUL! Reach-in foul on Pau LaVine during the drive. [Team fouls: 2] No free throws, side out. (Pau LaVine: 1 personal fouls)

[08:36] Team_081 possession (Score: 32-31)
FOUL! Shooting foul on Pau LaVine. Franz Antetokounmpo to the line for 2 free throws. [Team fouls: 3] (Pau LaVine: 2 personal fouls)   FT 1/2: GOOD   FT 2/2: GOOD Franz Antetokounmpo makes 2/2 from the line.
Score: 34-31

[08:18] Team_100 possession (Score: 34-31)
Manu Ball attempts a 3Pt. Wide open! Bradley Leonard is 6.2 feet away. [MAN] MANU BALL MAKES IT! Assist: Tyler Griffin
Score: 34-34

[08:03] Team_081 possession (Score: 34-34)
Franz Antetokounmpo drives, picks up Chris Mobley. Help arrives from Manu Ball! Franz Antetokounmpo attempts a Layup. Contested by Manu Ball (5.0 feet, MAN). FRANZ ANTETOKOUNMPO MAKES IT! Assist: Bradley Leonard
Score: 36-34

[07:45] Team_100 possession (Score: 36-34)
Manu Ball attempts a 3Pt. Contested by Julius Durant (3.5 feet, ZONE). Manu Ball misses. Rebound secured by Franz Antetokounmpo.

[07:31] Team_081 possession (Score: 36-34)
Julius Durant attempts a 3Pt. Wide open! Luka Green is 6.6 feet away. [MAN] JULIUS DURANT MAKES IT! Assist: Bradley Leonard
Score: 39-34

[07:22] Team_100 possession (Score: 39-34)
Pau LaVine attempts a Midrange. Wide open! Bradley Sabonis is 6.3 feet away. [MAN] Pau LaVine misses. Offensive rebound by Pau LaVine! Pau LaVine kicks it out.

[07:07] Team_100 possession (Score: 39-34)
FOUL! Shooting foul on Vince Adebayo. Luka Green to the line for 2 free throws. [Team fouls: 1] (Vince Adebayo: 1 personal fouls)   FT 1/2: GOOD   FT 2/2: MISS Luka Green makes 1/2 from the line. Rebound secured by Bradley Sabonis.
Score: 39-35

[06:56] Team_081 possession (Score: 39-35)
Bradley Leonard attempts a Midrange. Wide open! Manu Ball is 7.5 feet away. [MAN] BRADLEY LEONARD MAKES IT!
Score: 41-35

[06:44] Team_100 possession (Score: 41-35)
Pau LaVine attempts a Midrange. Contested by Bradley Sabonis (4.0 feet, MAN). Pau LaVine misses. Rebound secured by Bradley Sabonis.

[06:29] Team_081 possession (Score: 41-35)
Bradley Leonard attempts a 3Pt. Wide open! Luka Green is 7.1 feet away. [ZONE] Bradley Leonard misses. Rebound secured by Tyler Griffin.

[06:16] Team_100 possession (Score: 41-35)
FOUL! Reach-in foul on Franz Antetokounmpo during the drive. [Team fouls: 2] No free throws, side out. (Franz Antetokounmpo: 1 personal fouls)

[06:07] Team_100 possession (Score: 41-35)
Manu Ball attempts a 3Pt. Contested by Bradley Leonard (4.2 feet, ZONE). Manu Ball misses. Rebound secured by Franz Antetokounmpo.

[05:56] Team_081 possession (Score: 41-35)
Vince Adebayo throws a bad pass out of bounds! TURNOVER! (dead ball)

[05:56] Substitution (Team_081): Julius Durant OUT → Dejounte Bane IN (stamina_rule2)

[05:56] Substitution (Team_081): Bradley Leonard OUT → Lamelo Wade IN (stamina_rule2)

[05:56] Substitution (Team_081): Vince Adebayo OUT → Larry Adebayo IN (stamina_rule2)

[05:56] Substitution (Team_081): Bradley Sabonis OUT → Chris Holiday IN (stamina_rule2)

[05:56] Substitution (Team_081): Franz Antetokounmpo OUT → D'Angelo Markkanen IN (stamina_rule2)

[05:56] Substitution (Team_100): Luka Green OUT → Dirk Sabonis IN (stamina_rule2)

[05:56] Substitution (Team_100): Manu Ball OUT → Evan Butler IN (stamina_rule2)

[05:56] Substitution (Team_100): Tyler Griffin OUT → Tyrese Wade IN (stamina_rule2)

[05:56] Substitution (Team_100): Pau LaVine OUT → Carmelo Ginobili IN (stamina_rule2)

[05:56] Substitution (Team_100): Chris Mobley OUT → John Rozier IN (stamina_rule2)

[05:42] Team_100 possession (Score: 41-35)
Dirk Sabonis drives, Dejounte Bane stays with him. Dirk Sabonis attempts a Layup. Contested by Dejounte Bane (4.6 feet, MAN). DIRK SABONIS MAKES IT! Assist: John Rozier
Score: 41-37

[05:28] Team_081 possession (Score: 41-37)
Dejounte Bane attempts a Layup. Heavily contested by John Rozier (0.5 feet, ZONE)! DEJOUNTE BANE MAKES IT! Assist: Larry Adebayo
Score: 43-37

[05:12] Team_100 possession (Score: 43-37)
Dirk Sabonis attempts a Midrange. Contested by Larry Adebayo (4.1 feet, ZONE). DIRK SABONIS MAKES IT!
Score: 43-39

[04:58] Team_081 possession (Score: 43-39)
Dejounte Bane attempts a Layup. BLOCKED BY DIRK SABONIS! Ball is loose! Rebound secured by Tyrese Wade.

[04:45] Team_100 possession (Score: 43-39)
Tyrese Wade attempts a Midrange. Wide open! Larry Adebayo is 6.1 feet away. [MAN] Tyrese Wade misses. Rebound secured by Lamelo Wade.

[04:35] Team_081 possession (Score: 43-39)
Dejounte Bane drives, Dirk Sabonis stays with him. Dejounte Bane attempts a Dunk. Wide open! Dirk Sabonis is 7.1 feet away. [MAN] Dejounte Bane misses. Rebound secured by Tyrese Wade.

[04:22] Team_100 possession (Score: 43-39)
Dirk Sabonis attempts a Midrange. Contested by Lamelo Wade (3.5 feet, ZONE). Dirk Sabonis misses. Offensive rebound by John Rozier! John Rozier puts it back in!
Score: 43-41

[04:07] Team_081 possession (Score: 43-41)
D'Angelo Markkanen attempts a 3Pt. Heavily contested by Tyrese Wade (0.5 feet, ZONE)! D'ANGELO MARKKANEN MAKES IT! Assist: Larry Adebayo
Score: 46-41

[03:53] Team_100 possession (Score: 46-41)
Dirk Sabonis drives, picks up Chris Holiday. Help arrives from Lamelo Wade! Dirk Sabonis attempts a Layup. Heavily contested by Lamelo Wade (0.6 feet, ZONE)! Dirk Sabonis misses. Rebound secured by Larry Adebayo.

[03:38] Team_081 possession (Score: 46-41)
Chris Holiday loses control! Ball rolls out of bounds! TURNOVER! (dead ball)

[03:26] Team_100 possession (Score: 46-41)
John Rozier attempts a Midrange. Contested by Larry Adebayo (4.6 feet, ZONE). John Rozier misses. Rebound secured by Larry Adebayo.

[03:10] Team_081 possession (Score: 46-41)
Lamelo Wade loses control! Ball rolls out of bounds! TURNOVER! (dead ball)

[02:53] Team_100 possession (Score: 46-41)
Evan Butler attempts a 3Pt. Contested by Lamelo Wade (5.3 feet, MAN). EVAN BUTLER MAKES IT! Assist: Tyrese Wade
Score: 46-44

[02:38] Team_081 possession (Score: 46-44)
Dejounte Bane attempts a Layup. Heavily contested by John Rozier (1.3 feet, ZONE)! DEJOUNTE BANE MAKES IT! Assist: Lamelo Wade
Score: 48-44

[02:21] Team_100 possession (Score: 48-44)
John Rozier drives and kicks out. Carmelo Ginobili attempts a 3Pt. Heavily contested by Chris Holiday (1.2 feet, MAN)! Carmelo Ginobili misses. Rebound secured by Chris Holiday.

[02:08] Team_081 possession (Score: 48-44)
Lamelo Wade attempts a 3Pt. Wide open! Evan Butler is 7.8 feet away. [MAN] Lamelo Wade misses. Rebound secured by John Rozier.

[01:56] Team_100 possession (Score: 48-44)
FOUL! Shooting foul on Chris Holiday. John Rozier to the line for 2 free throws. [Team fouls: 3] (Chris Holiday: 1 personal fouls)   FT 1/2: GOOD   FT 2/2: GOOD John Rozier makes 2/2 from the line.
Score: 48-46

[01:42] Team_081 possession (Score: 48-46)
D'Angelo Markkanen drives and kicks out. Larry Adebayo attempts a 3Pt. Contested by Tyrese Wade (4.9 feet, MAN). Larry Adebayo misses. Rebound secured by John Rozier.

[01:26] Team_100 possession (Score: 48-46)
John Rozier drives to the basket... John Rozier throws a bad pass out of bounds! TURNOVER! (dead ball)

[01:11] Team_081 possession (Score: 48-46)
Chris Holiday attempts a 3Pt. Contested by Tyrese Wade (5.2 feet, ZONE). Chris Holiday misses. Rebound secured by John Rozier.

[00:57] Team_100 possession (Score: 48-46)
Carmelo Ginobili attempts a Layup. Heavily contested by D'Angelo Markkanen (0.7 feet, ZONE)! Carmelo Ginobili misses. Offensive rebound by Carmelo Ginobili! Carmelo Ginobili kicks it out.

[00:37] Team_100 possession (Score: 48-46)
Carmelo Ginobili loses the ball! Stripped by Chris Holiday! TURNOVER! (live ball)

[00:24] Team_081 possession (Score: 48-46)
D'Angelo Markkanen drives, Carmelo Ginobili stays with him. D'Angelo Markkanen attempts a Dunk. Wide open! Carmelo Ginobili is 7.5 feet away. [ZONE] D'ANGELO MARKKANEN MAKES IT! Assist: Dejounte Bane
Score: 50-46

[00:10] Team_100 possession (Score: 50-46)
John Rozier attempts a Midrange. Contested by Chris Holiday (5.4 feet, MAN). John Rozier misses. Rebound secured by Lamelo Wade.

================================================================================
                              2ND QUARTER COMPLETE                              
================================================================================

2ND QUARTER SCORE: Team_081 25, Team_100 23

BOX SCORE:
================================================================================

Team_081
--------------------------------------------------------------------------------
Player                MIN  PTS  REB  AST  TO      FG   FG%      3P   3P%
--------------------------------------------------------------------------------
Franz Antetokounmpo    17    7    2    0   0   3/5    60.0     0/0   0.0
D'Angelo Markkanen      7    5    0    0   0   2/3    66.7     0/0   0.0
Bradley Leonard        17    4    0    3   0   2/3    66.7     0/0   0.0
Dejounte Bane           7    4    0    1   0   2/4    50.0     0/0   0.0
Julius Durant          17    3    0    0   0   1/1   100.0     0/0   0.0
Vince Adebayo          17    0    0    0   0   0/1     0.0     0/0   0.0
Bradley Sabonis        17    0    4    0   0   0/0     0.0     0/0   0.0
Larry Adebayo           7    0    2    2   0   0/0     0.0     0/0   0.0
Lamelo Wade             7    0    2    1   0   0/1     0.0     0/0   0.0
Chris Holiday           7    0    1    0   0   0/1     0.0     0/0   0.0

TEAM: FG: 10/19 (52.6%), 3PT: 3/7 (42.9%), REB: 11 (2 off, 9 def), AST: 7, TO: 3
TEAM FOULS: 3


Team_100
--------------------------------------------------------------------------------
Player                MIN  PTS  REB  AST  TO      FG   FG%      3P   3P%
--------------------------------------------------------------------------------
Manu Ball              17    5    0    1   0   2/4    50.0     0/0   0.0
Pau LaVine             17    4    3    0   0   2/3    66.7     0/0   0.0
Dirk Sabonis            7    4    0    0   0   2/3    66.7     0/0   0.0
John Rozier             7    4    4    1   0   2/5    40.0     0/0   0.0
Evan Butler             7    3    0    0   0   1/1   100.0     0/0   0.0
Tyler Griffin          17    2    3    1   0   1/1   100.0     0/0   0.0
Luka Green             17    0    0    1   0   0/1     0.0     0/0   0.0
Tyrese Wade             7    0    2    1   0   0/1     0.0     0/0   0.0
Carmelo Ginobili        7    0    1    0   0   0/0     0.0     0/0   0.0

TEAM: FG: 10/19 (52.6%), 3PT: 2/4 (50.0%), REB: 13 (4 off, 9 def), AST: 5, TO: 3
TEAM FOULS: 3

================================================================================

================================================================================
                       3RD QUARTER - Team_081 vs Team_100                       
================================================================================

[12:00] Team_081 possession (Score: 50-46)
Vince Adebayo drives and kicks out. FOUL! Shooting foul on Luka Green. Bradley Sabonis to the line for 3 free throws. [Team fouls: 1] (Luka Green: 1 personal fouls)   FT 1/3: MISS   FT 2/3: MISS   FT 3/3: GOOD Bradley Sabonis makes 1/3 from the line.
Score: 51-46

[11:49] Team_100 possession (Score: 51-46)
FOUL! Shooting foul on Vince Adebayo. Luka Green to the line for 3 free throws. [Team fouls: 1] (Vince Adebayo: 1 personal fouls)   FT 1/3: GOOD   FT 2/3: GOOD   FT 3/3: GOOD Luka Green makes 3/3 from the line.
Score: 51-49

[11:38] Team_081 possession (Score: 51-49)
Vince Adebayo attempts a Midrange. Wide open! Tyler Griffin is 6.5 feet away. [MAN] VINCE ADEBAYO MAKES IT!
Score: 53-49

[11:21] Team_100 possession (Score: 53-49)
Tyler Griffin loses the ball! Stripped by Vince Adebayo! TURNOVER! (live ball)

[11:09] Team_081 possession (Score: 53-49)
Franz Antetokounmpo makes the Midrange and draws the foul on Chris Mobley! And-1! Franz Antetokounmpo to the line for 1. [Team fouls: 2] (Chris Mobley: 1 personal fouls)   FT 1/1: GOOD Franz Antetokounmpo makes 1/1 from the line.
Score: 56-49

[10:53] Team_100 possession (Score: 56-49)
Pau LaVine drives and kicks out. Luka Green attempts a Midrange. Contested by Vince Adebayo (3.2 feet, ZONE). Luka Green misses. FOUL! Loose ball foul on Vince Adebayo during the rebound battle. [Team fouls: 2] No free throws, side out. (Vince Adebayo: 2 personal fouls)

[10:41] Team_100 possession (Score: 56-49)
Luka Green drives, Julius Durant stays with him. Luka Green attempts a Dunk. Contested by Julius Durant (3.1 feet, MAN). LUKA GREEN MAKES IT! Assist: Pau LaVine
Score: 56-51

[10:27] Team_081 possession (Score: 56-51)
Franz Antetokounmpo drives, picks up Pau LaVine. Help arrives from Manu Ball! Franz Antetokounmpo attempts a Layup. Wide open! Manu Ball is 8.5 feet away. [ZONE] FRANZ ANTETOKOUNMPO MAKES IT! Assist: Bradley Leonard
Score: 58-51

[10:14] Team_100 possession (Score: 58-51)
Chris Mobley attempts a Layup. Contested by Franz Antetokounmpo (4.9 feet, MAN). CHRIS MOBLEY MAKES IT!
Score: 58-53

[10:02] Team_081 possession (Score: 58-53)
Bradley Leonard attempts a 3Pt. Contested by Manu Ball (5.6 feet, MAN). BRADLEY LEONARD MAKES IT! Assist: Julius Durant
Score: 61-53

[09:44] Team_100 possession (Score: 61-53)
Luka Green commits a violation (traveling/carry)! TURNOVER! (dead ball)

[09:28] Team_081 possession (Score: 61-53)
Vince Adebayo drives to the basket... Vince Adebayo throws a bad pass! Stolen by Pau LaVine! TURNOVER! (live ball)

[09:14] Team_100 possession (Score: 61-53)
FOUL! Reach-in foul on Bradley Sabonis during the drive. [Team fouls: 3] No free throws, side out. (Bradley Sabonis: 1 personal fouls)

[08:59] Team_100 possession (Score: 61-53)
FOUL! Reach-in foul on Franz Antetokounmpo during the drive. [Team fouls: 4] No free throws, side out. (Franz Antetokounmpo: 1 personal fouls)

[08:45] Team_100 possession (Score: 61-53)
Pau LaVine attempts a 3Pt. Contested by Vince Adebayo (2.2 feet, ZONE). Pau LaVine misses. FOUL! Loose ball foul on Vince Adebayo during the rebound battle. [IN THE BONUS! 5 team fouls] Pau LaVine to the line for 2 free throws. (Vince Adebayo: 3 personal fouls)   FT 1/2: GOOD   FT 2/2: GOOD Pau LaVine makes 2/2 from the line.
Score: 61-55

[08:34] Team_081 possession (Score: 61-55)
Franz Antetokounmpo drives and kicks out. Julius Durant attempts a 3Pt. Contested by Luka Green (5.5 feet, MAN). JULIUS DURANT MAKES IT! Assist: Bradley Sabonis
Score: 64-55

[08:24] Team_100 possession (Score: 64-55)
Tyler Griffin drives and kicks out. Chris Mobley attempts a 3Pt. Contested by Vince Adebayo (2.4 feet, ZONE). Chris Mobley misses. Rebound secured by Vince Adebayo.

[08:10] Team_081 possession (Score: 64-55)
Franz Antetokounmpo attempts a Midrange. Contested by Chris Mobley (5.0 feet, MAN). Franz Antetokounmpo misses. Rebound secured by Tyler Griffin.

[07:58] Team_100 possession (Score: 64-55)
FOUL! Reach-in foul on Julius Durant during the drive. [IN THE BONUS! 6 team fouls] Luka Green to the line for 2 free throws. (Julius Durant: 1 personal fouls)   FT 1/2: MISS   FT 2/2: GOOD Luka Green makes 1/2 from the line.
Score: 64-56

[07:43] Team_081 possession (Score: 64-56)
Bradley Leonard makes the Layup and draws the foul on Manu Ball! And-1! Bradley Leonard to the line for 1. [Team fouls: 3] (Manu Ball: 1 personal fouls)   FT 1/1: GOOD Bradley Leonard makes 1/1 from the line.
Score: 67-56

[07:32] Team_100 possession (Score: 67-56)
Luka Green drives to the basket... Luka Green throws a bad pass out of bounds! TURNOVER! (dead ball)

[07:20] Team_081 possession (Score: 67-56)
Bradley Sabonis drives and kicks out. Julius Durant attempts a 3Pt. Contested by Luka Green (3.3 feet, ZONE). Julius Durant misses. Rebound secured by Chris Mobley.

[07:04] Team_100 possession (Score: 67-56)
Chris Mobley attempts a Midrange. Contested by Franz Antetokounmpo (4.2 feet, MAN). CHRIS MOBLEY MAKES IT!
Score: 67-58

[06:49] Team_081 possession (Score: 67-58)
Vince Adebayo makes the Layup and draws the foul on Pau LaVine! And-1! Vince Adebayo to the line for 1. [Team fouls: 4] (Pau LaVine: 1 personal fouls)   FT 1/1: MISS Vince Adebayo makes 0/1 from the line. Rebound secured by Chris Mobley.
Score: 69-58

[06:36] Team_100 possession (Score: 69-58)
Pau LaVine attempts a Midrange. Contested by Bradley Sabonis (3.9 feet, MAN). PAU LAVINE MAKES IT!
Score: 69-60

[06:24] Team_081 possession (Score: 69-60)
Franz Antetokounmpo attempts a Layup. Wide open! Pau LaVine is 6.6 feet away. [ZONE] FRANZ ANTETOKOUNMPO MAKES IT! Assist: Bradley Leonard
Score: 71-60

[06:12] Team_100 possession (Score: 71-60)
Tyler Griffin attempts a 3Pt. Heavily contested by Vince Adebayo (0.5 feet, MAN)! Tyler Griffin misses. Offensive rebound by Pau LaVine! Pau LaVine kicks it out.

[05:57] Team_100 possession (Score: 71-60)
Tyler Griffin drives and kicks out. Tyler Griffin attempts a 3Pt. Contested by Vince Adebayo (3.4 feet, ZONE). Tyler Griffin misses. Rebound secured by Franz Antetokounmpo.

[05:44] Team_081 possession (Score: 71-60)
Vince Adebayo attempts a 3Pt. Wide open! Luka Green is 6.2 feet away. [ZONE] Vince Adebayo misses. Rebound secured by Pau LaVine.

[05:34] Team_100 possession (Score: 71-60)
Chris Mobley drives to the basket... Chris Mobley throws a bad pass out of bounds! TURNOVER! (dead ball)

[05:21] Team_081 possession (Score: 71-60)
Vince Adebayo attempts a 3Pt. Contested by Tyler Griffin (4.2 feet, MAN). Vince Adebayo misses. Rebound secured by Tyler Griffin.

[05:06] Team_100 possession (Score: 71-60)
Chris Mobley drives, Franz Antetokounmpo stays with him. Chris Mobley attempts a Layup. Contested by Franz Antetokounmpo (5.3 feet, MAN). CHRIS MOBLEY MAKES IT! Assist: Luka Green
Score: 71-62

[04:55] Team_081 possession (Score: 71-62)
Bradley Sabonis attempts a Midrange. Contested by Pau LaVine (5.6 feet, MAN). BRADLEY SABONIS MAKES IT!
Score: 73-62

[04:44] Team_100 possession (Score: 73-62)
Chris Mobley drives to the basket... Chris Mobley loses control! Ball rolls out of bounds! TURNOVER! (dead ball)

[04:32] Team_081 possession (Score: 73-62)
Vince Adebayo attempts a Midrange. Contested by Tyler Griffin (2.6 feet, MAN). VINCE ADEBAYO MAKES IT! Assist: Bradley Leonard
Score: 75-62

[04:15] Team_100 possession (Score: 75-62)
Tyler Griffin drives to the basket... Tyler Griffin throws a bad pass! Stolen by Vince Adebayo! TURNOVER! (live ball)

[04:02] Team_081 possession (Score: 75-62)
Vince Adebayo attempts a Midrange. Wide open! Tyler Griffin is 7.1 feet away. [ZONE] VINCE ADEBAYO MAKES IT! Assist: Bradley Leonard
Score: 77-62

[03:46] Team_100 possession (Score: 77-62)
Tyler Griffin drives and kicks out. Pau LaVine attempts a Midrange. Contested by Bradley Sabonis (3.4 feet, MAN). Pau LaVine misses. Rebound secured by Franz Antetokounmpo.

[03:32] Team_081 possession (Score: 77-62)
Julius Durant drives to the basket... Julius Durant commits a violation (traveling/carry)! TURNOVER! (dead ball)

[03:32] Substitution (Team_081): Vince Adebayo OUT → Larry Adebayo IN (stamina_rule2)

[03:32] Substitution (Team_100): Manu Ball OUT → Evan Butler IN (stamina_rule2)

[03:32] Substitution (Team_100): Tyler Griffin OUT → Tyrese Wade IN (stamina_rule2)

[03:32] Substitution (Team_100): Pau LaVine OUT → Carmelo Ginobili IN (stamina_rule2)

[03:32] Substitution (Team_100): Chris Mobley OUT → John Rozier IN (stamina_rule2)

[03:15] Team_100 possession (Score: 77-62)
John Rozier drives to the basket... John Rozier throws a bad pass! Stolen by Franz Antetokounmpo! TURNOVER! (live ball)

[03:01] Team_081 possession (Score: 77-62)
Julius Durant attempts a 3Pt. Contested by Luka Green (4.9 feet, MAN). Julius Durant misses. Rebound secured by Carmelo Ginobili.

[02:46] Team_100 possession (Score: 77-62)
FOUL! Reach-in foul on Franz Antetokounmpo during the drive. [IN THE BONUS! 7 team fouls] John Rozier to the line for 2 free throws. (Franz Antetokounmpo: 2 personal fouls)   FT 1/2: GOOD   FT 2/2: GOOD John Rozier makes 2/2 from the line.
Score: 77-64

[02:31] Team_081 possession (Score: 77-64)
FOUL! Shooting foul on Tyrese Wade. Larry Adebayo to the line for 2 free throws. [BONUS: 5 team fouls] (Tyrese Wade: 1 personal fouls)   FT 1/2: GOOD   FT 2/2: GOOD Larry Adebayo makes 2/2 from the line.
Score: 79-64

[02:19] Team_100 possession (Score: 79-64)
FOUL! Offensive foul on John Rozier! Franz Antetokounmpo drew the charge! [Team fouls: 6] (John Rozier: 1 personal fouls) TURNOVER! (dead ball)

[02:03] Team_081 possession (Score: 79-64)
FOUL! Holding foul on Tyrese Wade. [IN THE BONUS! 7 team fouls] Larry Adebayo to the line for 2 free throws. (Tyrese Wade: 2 personal fouls)   FT 1/2: GOOD   FT 2/2: GOOD Larry Adebayo makes 2/2 from the line.
Score: 81-64

[01:48] Team_100 possession (Score: 81-64)
Luka Green attempts a Midrange. Wide open! Larry Adebayo is 6.7 feet away. [ZONE] LUKA GREEN MAKES IT! Assist: Evan Butler
Score: 81-66

[01:33] Team_081 possession (Score: 81-66)
FOUL! Shooting foul on Tyrese Wade. Julius Durant to the line for 2 free throws. [BONUS: 8 team fouls] (Tyrese Wade: 3 personal fouls)   FT 1/2: GOOD   FT 2/2: GOOD Julius Durant makes 2/2 from the line.
Score: 83-66

[01:17] Team_100 possession (Score: 83-66)
Evan Butler drives and kicks out. Tyrese Wade attempts a 3Pt. Wide open! Bradley Leonard is 7.4 feet away. [ZONE] Tyrese Wade misses. Rebound secured by Bradley Sabonis.

[01:02] Team_081 possession (Score: 83-66)
Franz Antetokounmpo drives to the basket... Franz Antetokounmpo throws a bad pass out of bounds! TURNOVER! (dead ball)

[01:02] Substitution (Team_081): Julius Durant OUT → Dejounte Bane IN (stamina_rule2)

[01:02] Substitution (Team_081): Bradley Leonard OUT → Lamelo Wade IN (stamina_rule2)

[01:02] Substitution (Team_081): Bradley Sabonis OUT → Chris Holiday IN (stamina_rule2)

[01:02] Substitution (Team_081): Franz Antetokounmpo OUT → D'Angelo Markkanen IN (stamina_rule2)

[01:02] Substitution (Team_100): Luka Green OUT → Dirk Sabonis IN (stamina_rule2)

[00:48] Team_100 possession (Score: 83-66)
Carmelo Ginobili attempts a 3Pt. Contested by Chris Holiday (5.8 feet, MAN). CARMELO GINOBILI MAKES IT! Assist: Dirk Sabonis
Score: 83-69

[00:33] Team_081 possession (Score: 83-69)
FOUL! Holding foul on Dirk Sabonis. [IN THE BONUS! 9 team fouls] Dejounte Bane to the line for 2 free throws. (Dirk Sabonis: 1 personal fouls)   FT 1/2: GOOD   FT 2/2: GOOD Dejounte Bane makes 2/2 from the line.
Score: 85-69

[00:19] Team_100 possession (Score: 85-69)
John Rozier attempts a Midrange. Contested by Lamelo Wade (4.0 feet, ZONE). John Rozier misses. Rebound secured by Chris Holiday.

[00:03] Team_081 possession (Score: 85-69)
D'Angelo Markkanen attempts a Midrange. Contested by Evan Butler (4.8 feet, ZONE). D'Angelo Markkanen misses. Rebound secured by Carmelo Ginobili.

================================================================================
                              3RD QUARTER COMPLETE                              
================================================================================

3RD QUARTER SCORE: Team_081 35, Team_100 23

BOX SCORE:
================================================================================

Team_081
--------------------------------------------------------------------------------
Player                MIN  PTS  REB  AST  TO      FG   FG%      3P   3P%
--------------------------------------------------------------------------------
Franz Antetokounmpo    28    7    2    0   0   3/4    75.0     0/0   0.0
Vince Adebayo          26    6    1    0   0   3/6    50.0     0/0   0.0
Bradley Leonard        28    6    0    4   0   2/2   100.0     0/0   0.0
Julius Durant          28    5    0    1   0   2/3    66.7     0/0   0.0
Larry Adebayo          11    4    0    0   0   2/2   100.0     0/0   0.0
Bradley Sabonis        28    3    1    1   0   2/3    66.7     0/0   0.0
Dejounte Bane           8    2    0    0   0   1/1   100.0     0/0   0.0
Chris Holiday           8    0    1    0   0   0/0     0.0     0/0   0.0
D'Angelo Markkanen      8    0    0    0   0   0/1     0.0     0/0   0.0

TEAM: FG: 15/22 (68.2%), 3PT: 1/4 (25.0%), REB: 5 (0 off, 5 def), AST: 6, TO: 3
TEAM FOULS: 7 [Team_100 in BONUS]


Team_100
--------------------------------------------------------------------------------
Player                MIN  PTS  REB  AST  TO      FG   FG%      3P   3P%
--------------------------------------------------------------------------------
Luka Green             28    8    0    1   0   4/4   100.0     0/0   0.0
Chris Mobley           26    6    3    0   0   3/3   100.0     0/0   0.0
Pau LaVine             26    4    2    1   0   2/2   100.0     0/0   0.0
Carmelo Ginobili       11    3    2    0   0   1/1   100.0     0/0   0.0
John Rozier            11    2    0    0   0   1/2    50.0     0/0   0.0
Tyler Griffin          26    0    2    0   0   0/3     0.0     0/0   0.0
Evan Butler            11    0    0    1   0   0/1     0.0     0/0   0.0
Dirk Sabonis            8    0    0    1   0   0/0     0.0     0/0   0.0

TEAM: FG: 11/16 (68.8%), 3PT: 3/3 (100.0%), REB: 9 (2 off, 7 def), AST: 4, TO: 8
TEAM FOULS: 9 [Team_081 in BONUS]

================================================================================

================================================================================
                       4TH QUARTER - Team_081 vs Team_100                       
================================================================================

[12:00] Team_081 possession (Score: 85-69)
Julius Durant attempts a 3Pt. Contested by Luka Green (5.7 feet, ZONE). JULIUS DURANT MAKES IT! Assist: Vince Adebayo
Score: 88-69

[11:44] Team_100 possession (Score: 88-69)
Pau LaVine attempts a 3Pt. Contested by Vince Adebayo (2.8 feet, ZONE). Pau LaVine misses. Offensive rebound by Pau LaVine! Pau LaVine kicks it out.

[11:29] Team_100 possession (Score: 88-69)
Pau LaVine attempts a 3Pt. Contested by Vince Adebayo (3.5 feet, ZONE). Pau LaVine misses. Rebound secured by Bradley Sabonis.

[11:15] Team_081 possession (Score: 88-69)
Franz Antetokounmpo attempts a 3Pt. Contested by Pau LaVine (2.1 feet, ZONE). Franz Antetokounmpo misses. Rebound secured by Chris Mobley.

[11:00] Team_100 possession (Score: 88-69)
Manu Ball attempts a 3Pt. Contested by Bradley Leonard (5.2 feet, MAN). MANU BALL MAKES IT! Assist: Chris Mobley
Score: 88-72

[10:46] Team_081 possession (Score: 88-72)
Franz Antetokounmpo drives to the basket... Franz Antetokounmpo commits a violation (traveling/carry)! TURNOVER! (dead ball)

[10:46] Substitution (Team_081): Julius Durant OUT → Dejounte Bane IN (stamina_rule2)

[10:46] Substitution (Team_081): Bradley Leonard OUT → Lamelo Wade IN (stamina_rule2)

[10:46] Substitution (Team_081): Bradley Sabonis OUT → Chris Holiday IN (stamina_rule2)

[10:46] Substitution (Team_081): Franz Antetokounmpo OUT → D'Angelo Markkanen IN (stamina_rule2)

[10:30] Team_100 possession (Score: 88-72)
Manu Ball attempts a Midrange. BLOCKED BY LAMELO WADE! Ball is loose! Offensive rebound by Chris Mobley! Chris Mobley kicks it out.

[10:12] Team_100 possession (Score: 88-72)
FOUL! Offensive foul on Tyler Griffin! Vince Adebayo drew the charge! [Team fouls: 1] (Tyler Griffin: 1 personal fouls) TURNOVER! (dead ball)

[09:59] Team_081 possession (Score: 88-72)
D'Angelo Markkanen drives and kicks out. FOUL! Shooting foul on Luka Green. Dejounte Bane to the line for 2 free throws. [Team fouls: 2] (Luka Green: 1 personal fouls)   FT 1/2: GOOD   FT 2/2: GOOD Dejounte Bane makes 2/2 from the line.
Score: 90-72

[09:44] Team_100 possession (Score: 90-72)
Luka Green attempts a Midrange. Contested by Lamelo Wade (4.7 feet, ZONE). Luka Green misses. Rebound secured by Chris Holiday.

[09:29] Team_081 possession (Score: 90-72)
Dejounte Bane attempts a Layup. BLOCKED BY PAU LAVINE! Ball is loose! Rebound secured by Pau LaVine.

[09:12] Team_100 possession (Score: 90-72)
Pau LaVine throws a bad pass! Stolen by Chris Holiday! TURNOVER! (live ball)

[08:56] Team_081 possession (Score: 90-72)
D'Angelo Markkanen attempts a Layup. BLOCKED BY MANU BALL! Ball is loose! Rebound secured by Pau LaVine.

[08:38] Team_100 possession (Score: 90-72)
FOUL! Offensive foul on Manu Ball! Lamelo Wade drew the charge! [Team fouls: 3] (Manu Ball: 1 personal fouls) TURNOVER! (dead ball)

[08:28] Team_081 possession (Score: 90-72)
Vince Adebayo attempts a Layup. Contested by Tyler Griffin (5.3 feet, MAN). Vince Adebayo misses. Rebound secured by Chris Mobley.

[08:15] Team_100 possession (Score: 90-72)
Pau LaVine drives to the basket... Pau LaVine loses control! Ball rolls out of bounds! TURNOVER! (dead ball)

[08:15] Substitution (Team_081): Vince Adebayo OUT → Larry Adebayo IN (stamina_rule2)

[08:15] Substitution (Team_100): Luka Green OUT → Dirk Sabonis IN (stamina_rule2)

[08:15] Substitution (Team_100): Manu Ball OUT → Evan Butler IN (stamina_rule2)

[08:15] Substitution (Team_100): Tyler Griffin OUT → Tyrese Wade IN (stamina_rule2)

[08:15] Substitution (Team_100): Pau LaVine OUT → Carmelo Ginobili IN (stamina_rule2)

[08:15] Substitution (Team_100): Chris Mobley OUT → John Rozier IN (stamina_rule2)

[08:00] Team_081 possession (Score: 90-72)
D'Angelo Markkanen drives to the basket... D'Angelo Markkanen throws a bad pass! Stolen by John Rozier! TURNOVER! (live ball)

[07:47] Team_100 possession (Score: 90-72)
Tyrese Wade makes the Layup and draws the foul on Lamelo Wade! And-1! Tyrese Wade to the line for 1. [Team fouls: 2] (Lamelo Wade: 2 personal fouls)   FT 1/1: GOOD Tyrese Wade makes 1/1 from the line.
Score: 90-75

[07:38] Team_081 possession (Score: 90-75)
D'Angelo Markkanen attempts a Midrange. Wide open! Tyrese Wade is 6.2 feet away. [ZONE] D'ANGELO MARKKANEN MAKES IT! Assist: Dejounte Bane
Score: 92-75

[07:20] Team_100 possession (Score: 92-75)
Carmelo Ginobili attempts a 3Pt. Heavily contested by Chris Holiday (1.7 feet, ZONE)! CARMELO GINOBILI MAKES IT! Assist: John Rozier
Score: 92-78

[07:06] Team_081 possession (Score: 92-78)
Dejounte Bane attempts a 3Pt. Wide open! Dirk Sabonis is 6.9 feet away. [MAN] DEJOUNTE BANE MAKES IT! Assist: Lamelo Wade
Score: 95-78

[06:47] Team_100 possession (Score: 95-78)
FOUL! Holding foul on Chris Holiday. [Team fouls: 3] No free throws, side out. (Chris Holiday: 1 personal fouls)

[06:38] Team_100 possession (Score: 95-78)
John Rozier throws a bad pass! Stolen by Chris Holiday! TURNOVER! (live ball)

[06:24] Team_081 possession (Score: 95-78)
FOUL! Shooting foul on Evan Butler. Lamelo Wade to the line for 2 free throws. [Team fouls: 4] (Evan Butler: 1 personal fouls)   FT 1/2: GOOD   FT 2/2: GOOD Lamelo Wade makes 2/2 from the line.
Score: 97-78

[06:06] Team_100 possession (Score: 97-78)
Dirk Sabonis drives, picks up Dejounte Bane. Help arrives from Lamelo Wade! Dirk Sabonis attempts a Dunk. Contested by Lamelo Wade (3.7 feet, MAN). Dirk Sabonis misses. Offensive rebound by John Rozier! John Rozier's putback is no good. Rebound secured by Larry Adebayo.

[05:51] Team_081 possession (Score: 97-78)
Chris Holiday attempts a Midrange. Contested by Carmelo Ginobili (5.2 feet, MAN). Chris Holiday misses. Rebound secured by Carmelo Ginobili.

[05:32] Team_100 possession (Score: 97-78)
Dirk Sabonis drives to the basket... Dirk Sabonis throws a bad pass out of bounds! TURNOVER! (dead ball)

[05:18] Team_081 possession (Score: 97-78)
Lamelo Wade attempts a Midrange. Contested by Evan Butler (4.4 feet, MAN). Lamelo Wade misses. Rebound secured by Tyrese Wade.

[05:01] Team_100 possession (Score: 97-78)
Carmelo Ginobili attempts a Midrange. Contested by Lamelo Wade (5.2 feet, ZONE). CARMELO GINOBILI MAKES IT!
Score: 97-80

[04:49] Team_081 possession (Score: 97-80)
D'Angelo Markkanen makes the Dunk and draws the foul on Evan Butler! And-1! D'Angelo Markkanen to the line for 1. [BONUS: 5 team fouls] (Evan Butler: 2 personal fouls)   FT 1/1: GOOD D'Angelo Markkanen makes 1/1 from the line.
Score: 100-80

[04:37] Team_100 possession (Score: 100-80)
Dirk Sabonis drives, picks up Dejounte Bane. Help arrives from Lamelo Wade! Dirk Sabonis attempts a Dunk. Contested by Lamelo Wade (4.3 feet, MAN). DIRK SABONIS MAKES IT! Assist: John Rozier
Score: 100-82

[04:26] Team_081 possession (Score: 100-82)
Lamelo Wade attempts a Midrange. Contested by Evan Butler (5.3 feet, MAN). Lamelo Wade misses. Offensive rebound by Chris Holiday! Chris Holiday kicks it out.

[04:10] Team_081 possession (Score: 100-82)
D'Angelo Markkanen drives and kicks out. Larry Adebayo attempts a 3Pt. Contested by Carmelo Ginobili (5.1 feet, ZONE). Larry Adebayo misses. Rebound secured by John Rozier.

[03:53] Team_100 possession (Score: 100-82)
Carmelo Ginobili drives and kicks out. Evan Butler attempts a 3Pt. Contested by Chris Holiday (3.6 feet, ZONE). Evan Butler misses. Rebound secured by Chris Holiday.

[03:41] Team_081 possession (Score: 100-82)
Dejounte Bane attempts a 3Pt. Contested by Dirk Sabonis (5.3 feet, MAN). DEJOUNTE BANE MAKES IT! Assist: Chris Holiday
Score: 103-82

[03:26] Team_100 possession (Score: 103-82)
FOUL! Shooting foul on Chris Holiday. Carmelo Ginobili to the line for 3 free throws. [Team fouls: 4] (Chris Holiday: 2 personal fouls)   FT 1/3: MISS   FT 2/3: MISS   FT 3/3: GOOD Carmelo Ginobili makes 1/3 from the line.
Score: 103-83

[03:13] Team_081 possession (Score: 103-83)
Dejounte Bane makes the Layup and draws the foul on Dirk Sabonis! And-1! Dejounte Bane to the line for 1. [BONUS: 6 team fouls] (Dirk Sabonis: 1 personal fouls)   FT 1/1: GOOD Dejounte Bane makes 1/1 from the line.
Score: 106-83

[02:58] Team_100 possession (Score: 106-83)
Dirk Sabonis drives to the basket... Dirk Sabonis throws a bad pass out of bounds! TURNOVER! (dead ball)

[02:43] Team_081 possession (Score: 106-83)
Lamelo Wade attempts a 3Pt. Contested by Evan Butler (3.1 feet, MAN). Lamelo Wade misses. Offensive rebound by Chris Holiday! Chris Holiday kicks it out.

[02:24] Team_081 possession (Score: 106-83)
Chris Holiday attempts a 3Pt. Wide open! Carmelo Ginobili is 7.1 feet away. [MAN] CHRIS HOLIDAY MAKES IT! Assist: Lamelo Wade
Score: 109-83

[02:11] Team_100 possession (Score: 109-83)
FOUL! Holding foul on Chris Holiday. [IN THE BONUS! 5 team fouls] John Rozier to the line for 2 free throws. (Chris Holiday: 3 personal fouls)   FT 1/2: GOOD   FT 2/2: GOOD John Rozier makes 2/2 from the line.
Score: 109-85

[01:52] Team_081 possession (Score: 109-85)
Chris Holiday drives and kicks out. Larry Adebayo attempts a 3Pt. Contested by Tyrese Wade (3.5 feet, MAN). Larry Adebayo misses. Offensive rebound by Larry Adebayo! Larry Adebayo kicks it out.

[01:36] Team_081 possession (Score: 109-85)
Lamelo Wade drives and kicks out. Dejounte Bane attempts a 3Pt. Contested by Dirk Sabonis (5.2 feet, MAN). Dejounte Bane misses. Rebound secured by John Rozier.

[01:19] Team_100 possession (Score: 109-85)
FOUL! Offensive foul on John Rozier! Chris Holiday drew the charge! [Team fouls: 7] (John Rozier: 1 personal fouls) TURNOVER! (dead ball)

[01:10] Team_081 possession (Score: 109-85)
Dejounte Bane attempts a Layup. Heavily contested by John Rozier (1.3 feet, ZONE)! DEJOUNTE BANE MAKES IT! Assist: Lamelo Wade
Score: 111-85

[00:56] Team_100 possession (Score: 111-85)
FOUL! Offensive foul on Evan Butler! Lamelo Wade drew the charge! [Team fouls: 8] (Evan Butler: 3 personal fouls) TURNOVER! (dead ball)

[00:42] Team_081 possession (Score: 111-85)
Dejounte Bane attempts a Layup. BLOCKED BY JOHN ROZIER! Ball is loose! Rebound secured by Tyrese Wade.

[00:28] Team_100 possession (Score: 111-85)
Tyrese Wade attempts a 3Pt. Contested by Chris Holiday (3.3 feet, ZONE). Tyrese Wade misses. Rebound secured by Lamelo Wade.

[00:13] Team_081 possession (Score: 111-85)
Chris Holiday makes the Layup and draws the foul on Carmelo Ginobili! And-1! Chris Holiday to the line for 1. [BONUS: 9 team fouls] (Carmelo Ginobili: 1 personal fouls)   FT 1/1: MISS Chris Holiday makes 0/1 from the line. Rebound secured by Tyrese Wade.
Score: 113-85

================================================================================
                              4TH QUARTER COMPLETE                              
================================================================================

4TH QUARTER SCORE: Team_081 28, Team_100 16

BOX SCORE:
================================================================================

Team_081
--------------------------------------------------------------------------------
Player                MIN  PTS  REB  AST  TO      FG   FG%      3P   3P%
--------------------------------------------------------------------------------
Dejounte Bane          19   13    0    1   0   5/7    71.4     0/0   0.0
D'Angelo Markkanen     19    5    0    0   0   2/4    50.0     0/0   0.0
Julius Durant          29    3    0    0   0   1/1   100.0     0/0   0.0
Chris Holiday          19    3    4    1   0   1/3    33.3     0/0   0.0
Lamelo Wade            19    2    1    3   0   1/3    33.3     0/0   0.0
Vince Adebayo          30    0    0    1   0   0/1     0.0     0/0   0.0
Bradley Sabonis        29    0    1    0   0   0/0     0.0     0/0   0.0
Franz Antetokounmpo    29    0    0    0   0   0/1     0.0     0/0   0.0
Larry Adebayo          19    0    2    0   0   0/0     0.0     0/0   0.0

TEAM: FG: 10/20 (50.0%), 3PT: 4/5 (80.0%), REB: 7 (3 off, 4 def), AST: 6, TO: 2
TEAM FOULS: 5 [Team_100 in BONUS]


Team_100
--------------------------------------------------------------------------------
Player                MIN  PTS  REB  AST  TO      FG   FG%      3P   3P%
--------------------------------------------------------------------------------
Carmelo Ginobili       19    6    1    0   0   3/4    75.0     0/0   0.0
Manu Ball              30    3    0    0   0   1/1   100.0     0/0   0.0
Tyrese Wade            19    3    3    0   0   1/2    50.0     0/0   0.0
John Rozier            19    2    2    2   0   1/1   100.0     0/0   0.0
Dirk Sabonis           16    2    0    0   0   1/2    50.0     0/0   0.0
Pau LaVine             30    0    3    0   0   0/1     0.0     0/0   0.0
Chris Mobley           30    0    3    1   0   0/0     0.0     0/0   0.0
Luka Green             32    0    0    0   0   0/1     0.0     0/0   0.0

TEAM: FG: 7/12 (58.3%), 3PT: 3/5 (60.0%), REB: 13 (3 off, 10 def), AST: 3, TO: 9
TEAM FOULS: 9 [Team_081 in BONUS]

================================================================================

================================================================================
                               FULL GAME COMPLETE                               
================================================================================

FINAL SCORE: Team_081 113, Team_100 85

SCORING BY QUARTER:
--------------------------------------------------------------------------------
Team                     Q1     Q2     Q3     Q4    FINAL
--------------------------------------------------------------------------------
Team_081                 25     25     35     28      113
Team_100                 23     23     23     16       85
--------------------------------------------------------------------------------

FULL GAME BOX SCORE:
================================================================================

Team_081
--------------------------------------------------------------------------------
Player                MIN  PTS  REB  AST  TO      FG   FG%      3P   3P%      FT STL BLK
--------------------------------------------------------------------------------
Vince Adebayo          30   11    2    1   1   6/13   46.2   1/6    16.7   2/4     2   0
Julius Durant          29   14    0    4   4   5/8    62.5   4/7    57.1   2/2     1   0
Bradley Leonard        29   12    0    8   1   5/7    71.4   1/3    33.3   1/1     0   0
Bradley Sabonis        29    5   10    2   2   2/5    40.0   0/0     0.0   1/3     2   0
Franz Antetokounmpo    29   21   10    0   1   9/14   64.3   1/2    50.0   4/4     1   2
Dejounte Bane          19   22    0    2   0   7/11   63.6   3/3   100.0   5/5     0   0
Lamelo Wade            19    5    4    5   1   2/5    40.0   1/2    50.0   2/2     0   1
Chris Holiday          19    3    8    2   1   1/5    20.0   1/2    50.0   0/1     3   0
D'Angelo Markkanen     19   10    0    0   1   5/9    55.6   1/1   100.0   1/1     0   0
Larry Adebayo          19    4    4    2   0   1/1   100.0   0/0     0.0   4/4     0   0

TEAM: FG: 45/80 (56.2%), 3PT: 13/26 (50.0%), REB: 36 (8 off, 28 def), AST: 26, TO: 12


Team_100
--------------------------------------------------------------------------------
Player                MIN  PTS  REB  AST  TO      FG   FG%      3P   3P%      FT STL BLK
--------------------------------------------------------------------------------
Luka Green             32    8    0    2   2   4/8    50.0   1/2    50.0   5/7     0   0
Manu Ball              30   10    0    5   2   4/9    44.4   2/6    33.3   0/2     0   1
Tyler Griffin          30    8    6    1   3   3/7    42.9   2/2   100.0   0/0     0   0
Pau LaVine             30   15   13    2   5   6/8    75.0   3/4    75.0   3/5     1   1
Chris Mobley           30   13   10    2   1   7/9    77.8   0/0     0.0   3/4     0   0
Evan Butler            19    3    0    1   2   1/3    33.3   1/2    50.0   0/0     0   0
Tyrese Wade            19    3    5    1   1   1/4    25.0   0/2     0.0   1/1     0   0
Carmelo Ginobili       19    9    5    0   2   4/6    66.7   3/3   100.0   1/3     0   0
John Rozier            19    8    6    3   4   2/6    33.3   0/0     0.0   6/6     1   1
Dirk Sabonis           16    6    0    1   1   4/6    66.7   0/0     0.0   0/0     0   1

TEAM: FG: 37/67 (55.2%), 3PT: 12/21 (57.1%), REB: 47 (12 off, 35 def), AST: 18, TO: 23

================================================================================
