================================================================================
                        FULL GAME - Team_096 vs Team_067                        
================================================================================

================================================================================
                       1ST QUARTER - Team_096 vs Team_067                       
================================================================================

[12:00] Team_096 possession (Score: 0-0)
Cole Griffin loses the ball! Stripped by Desmond Simmons! TURNOVER! (live ball)

[11:50] Team_067 possession (Score: 0-0)
Malcolm Westbrook attempts a Layup. Contested by Kyrie Adebayo (2.7 feet, MAN). MALCOLM WESTBROOK MAKES IT! Assist: Ben Ball
Score: 0-2

[11:38] Team_096 possession (Score: 0-2)
Cole Griffin attempts a 3Pt. Wide open! Desmond Simmons is 7.7 feet away. [MAN] Cole Griffin misses. Rebound secured by Wendell Antetokounmpo.

[11:28] Team_067 possession (Score: 0-2)
Ben Ball drives, picks up Scottie Herro. Help arrives from Lamelo Quickley! Ben Ball attempts a Layup. Wide open! Lamelo Quickley is 7.9 feet away. [MAN] BEN BALL MAKES IT! Assist: Desmond Simmons
Score: 0-4

[11:10] Team_096 possession (Score: 0-4)
FOUL! Holding foul on Wendell Antetokounmpo. [Team fouls: 1] No free throws, side out. (Wendell Antetokounmpo: 1 personal fouls)

[10:54] Team_096 possession (Score: 0-4)
Cole Griffin drives and kicks out. Cole Griffin attempts a 3Pt. Contested by Desmond Simmons (4.8 feet, ZONE). Cole Griffin misses. Rebound secured by Wendell Antetokounmpo.

[10:41] Team_067 possession (Score: 0-4)
Ben Ball attempts a Midrange. Wide open! Scottie Herro is 6.7 feet away. [MAN] BEN BALL MAKES IT!
Score: 0-6

[10:29] Team_096 possession (Score: 0-6)
Cole Griffin attempts a 3Pt. Contested by Desmond Simmons (3.9 feet, ZONE). Cole Griffin misses. Rebound secured by Malcolm Westbrook.

[10:15] Team_067 possession (Score: 0-6)
FOUL! Reach-in foul on Kyrie Adebayo during the drive. [Team fouls: 1] No free throws, side out. (Kyrie Adebayo: 1 personal fouls)

[10:00] Team_067 possession (Score: 0-6)
Wendell Antetokounmpo loses the ball! Stripped by Lamelo Quickley! TURNOVER! (live ball)

[09:43] Team_096 possession (Score: 0-6)
Terry Mobley attempts a 3Pt. Wide open! Desmond Simmons is 9.2 feet away. [ZONE] Terry Mobley misses. Rebound secured by Desmond Simmons.

[09:28] Team_067 possession (Score: 0-6)
Wendell Antetokounmpo drives and kicks out. Manu Reaves attempts a 3Pt. Contested by Terry Mobley (4.5 feet, MAN). Manu Reaves misses. Rebound secured by Cole Griffin.

[09:12] Team_096 possession (Score: 0-6)
Cole Griffin drives and kicks out. Terry Mobley attempts a 3Pt. Contested by Desmond Simmons (3.8 feet, ZONE). Terry Mobley misses. Rebound secured by Wendell Antetokounmpo.

[09:01] Team_067 possession (Score: 0-6)
Ben Ball attempts a Layup. Contested by Kyrie Adebayo (4.9 feet, ZONE). Ben Ball misses. Rebound secured by Scottie Herro.

[08:47] Team_096 possession (Score: 0-6)
Kyrie Adebayo throws a bad pass out of bounds! TURNOVER! (dead ball)

[08:30] Team_067 possession (Score: 0-6)
FOUL! Shooting foul on Scottie Herro. Ben Ball to the line for 2 free throws. [Team fouls: 2] (Scottie Herro: 1 personal fouls)   FT 1/2: MISS   FT 2/2: GOOD Ben Ball makes 1/2 from the line.
Score: 0-7

[08:16] Team_096 possession (Score: 0-7)
Kyrie Adebayo drives, Malcolm Westbrook stays with him. Kyrie Adebayo attempts a Layup. Contested by Malcolm Westbrook (2.3 feet, MAN). Kyrie Adebayo misses. Rebound secured by Malcolm Westbrook.

[08:00] Team_067 possession (Score: 0-7)
Desmond Simmons attempts a 3Pt. Contested by Cole Griffin (4.2 feet, MAN). Desmond Simmons misses. Rebound secured by Kyrie Adebayo.

[07:43] Team_096 possession (Score: 0-7)
Terry Mobley throws a bad pass! Stolen by Manu Reaves! TURNOVER! (live ball)

[07:30] Team_067 possession (Score: 0-7)
Wendell Antetokounmpo attempts a Midrange. Contested by Cole Griffin (3.3 feet, ZONE). WENDELL ANTETOKOUNMPO MAKES IT!
Score: 0-9

[07:14] Team_096 possession (Score: 0-9)
Scottie Herro drives to the basket... Scottie Herro commits a violation (traveling/carry)! TURNOVER! (dead ball)

[07:01] Team_067 possession (Score: 0-9)
Desmond Simmons attempts a 3Pt. Wide open! Lamelo Quickley is 7.8 feet away. [ZONE] Desmond Simmons misses. Rebound secured by Cole Griffin.

[06:45] Team_096 possession (Score: 0-9)
Terry Mobley attempts a Midrange. Wide open! Manu Reaves is 8.2 feet away. [MAN] Terry Mobley misses. Rebound secured by Desmond Simmons.

[06:30] Team_067 possession (Score: 0-9)
Malcolm Westbrook drives and kicks out. Desmond Simmons attempts a 3Pt. Contested by Cole Griffin (3.8 feet, MAN). Desmond Simmons misses. Rebound secured by Kyrie Adebayo.

[06:15] Team_096 possession (Score: 0-9)
Scottie Herro attempts a Midrange. Heavily contested by Desmond Simmons (1.4 feet, ZONE)! SCOTTIE HERRO MAKES IT! Assist: Cole Griffin
Score: 2-9

[06:05] Team_067 possession (Score: 2-9)
Ben Ball attempts a 3Pt. Contested by Cole Griffin (3.9 feet, ZONE). BEN BALL MAKES IT! Assist: Wendell Antetokounmpo
Score: 2-12

[05:49] Team_096 possession (Score: 2-12)
Terry Mobley attempts a 3Pt. Contested by Desmond Simmons (5.4 feet, ZONE). Terry Mobley misses. Offensive rebound by Scottie Herro! Scottie Herro kicks it out.

[05:39] Team_096 possession (Score: 2-12)
Kyrie Adebayo attempts a Midrange. Contested by Malcolm Westbrook (5.4 feet, MAN). KYRIE ADEBAYO MAKES IT!
Score: 4-12

[05:23] Team_067 possession (Score: 4-12)
Wendell Antetokounmpo attempts a 3Pt. Contested by Lamelo Quickley (4.3 feet, ZONE). WENDELL ANTETOKOUNMPO MAKES IT! Assist: Malcolm Westbrook
Score: 4-15

[05:10] Team_096 possession (Score: 4-15)
Lamelo Quickley attempts a 3Pt. Contested by Wendell Antetokounmpo (5.5 feet, MAN). LAMELO QUICKLEY MAKES IT! Assist: Cole Griffin
Score: 7-15

[04:54] Team_067 possession (Score: 7-15)
Desmond Simmons drives, Cole Griffin stays with him. Desmond Simmons attempts a Layup. Heavily contested by Cole Griffin (1.1 feet, MAN)! DESMOND SIMMONS MAKES IT! Assist: Wendell Antetokounmpo
Score: 7-17

[04:39] Team_096 possession (Score: 7-17)
Cole Griffin drives to the basket... Cole Griffin loses control! Ball rolls out of bounds! TURNOVER! (dead ball)

[04:24] Team_067 possession (Score: 7-17)
Desmond Simmons drives to the basket... Desmond Simmons throws a bad pass out of bounds! TURNOVER! (dead ball)

[04:13] Team_096 possession (Score: 7-17)
FOUL! Holding foul on Malcolm Westbrook. [Team fouls: 2] No free throws, side out. (Malcolm Westbrook: 1 personal fouls)

[03:54] Team_096 possession (Score: 7-17)
Terry Mobley attempts a Layup. Heavily contested by Manu Reaves (1.4 feet, MAN)! TERRY MOBLEY MAKES IT! Assist: Cole Griffin
Score: 9-17

[03:39] Team_067 possession (Score: 9-17)
Ben Ball attempts a Midrange. Wide open! Scottie Herro is 6.8 feet away. [MAN] BEN BALL MAKES IT! Assist: Manu Reaves
Score: 9-19

[03:25] Team_096 possession (Score: 9-19)
Cole Griffin attempts a Midrange. Contested by Desmond Simmons (5.1 feet, MAN). Cole Griffin misses. Rebound secured by Desmond Simmons.

[03:13] Team_067 possession (Score: 9-19)
Manu Reaves drives, picks up Scottie Herro. Help arrives from Lamelo Quickley! Manu Reaves attempts a Layup. Wide open! Lamelo Quickley is 6.2 feet away. [ZONE] MANU REAVES MAKES IT!
Score: 9-21

[02:58] Team_096 possession (Score: 9-21)
Cole Griffin attempts a 3Pt. Contested by Desmond Simmons (5.1 feet, ZONE). Cole Griffin misses. Offensive rebound by Scottie Herro! Scottie Herro kicks it out.

[02:41] Team_096 possession (Score: 9-21)
Scottie Herro drives and kicks out. Kyrie Adebayo attempts a 3Pt. Contested by Malcolm Westbrook (3.6 feet, MAN). Kyrie Adebayo misses. Rebound secured by Manu Reaves.

[02:24] Team_067 possession (Score: 9-21)
Desmond Simmons attempts a 3Pt. Contested by Cole Griffin (2.2 feet, MAN). DESMOND SIMMONS MAKES IT! Assist: Ben Ball
Score: 9-24

[02:09] Team_096 possession (Score: 9-24)
Lamelo Quickley loses control! Ball rolls out of bounds! TURNOVER! (dead ball)

[02:09] Substitution (Team_096): Terry Mobley OUT → Cade Jokic IN (stamina_rule2)

[02:09] Substitution (Team_096): Lamelo Quickley OUT → Jarrett Markkanen IN (stamina_rule2)

[02:09] Substitution (Team_096): Scottie Herro OUT → Tyler Haliburton IN (stamina_rule2)

[02:09] Substitution (Team_067): Manu Reaves OUT → James Rozier IN (stamina_rule2)

[02:09] Substitution (Team_067): Wendell Antetokounmpo OUT → Anfernee Wagner IN (stamina_rule2)

[02:09] Substitution (Team_067): Ben Ball OUT → Kristaps Davis IN (stamina_rule2)

[02:09] Substitution (Team_067): Malcolm Westbrook OUT → Zach DeRozan IN (stamina_rule2)

[01:56] Team_067 possession (Score: 9-24)
Desmond Simmons drives, Kyrie Adebayo stays with him. Desmond Simmons attempts a Layup. Wide open! Kyrie Adebayo is 6.4 feet away. [ZONE] DESMOND SIMMONS MAKES IT! Assist: Kristaps Davis
Score: 9-26

[01:39] Team_096 possession (Score: 9-26)
Jarrett Markkanen attempts a 3Pt. Contested by Anfernee Wagner (4.3 feet, MAN). JARRETT MARKKANEN MAKES IT! Assist: Tyler Haliburton
Score: 12-26

[01:24] Team_067 possession (Score: 12-26)
Kristaps Davis attempts a 3Pt. Wide open! Tyler Haliburton is 6.7 feet away. [MAN] KRISTAPS DAVIS MAKES IT! Assist: Zach DeRozan
Score: 12-29

[01:08] Team_096 possession (Score: 12-29)
FOUL! Offensive foul on Kyrie Adebayo! Zach DeRozan drew the charge! [Team fouls: 3] (Kyrie Adebayo: 2 personal fouls) TURNOVER! (dead ball)

[00:59] Team_067 possession (Score: 12-29)
Kristaps Davis attempts a 3Pt. Wide open! Tyler Haliburton is 7.9 feet away. [MAN] KRISTAPS DAVIS MAKES IT! Assist: Desmond Simmons
Score: 12-32

[00:48] Team_096 possession (Score: 12-32)
Jarrett Markkanen attempts a 3Pt. Contested by Kristaps Davis (3.7 feet, ZONE). JARRETT MARKKANEN MAKES IT! Assist: Kyrie Adebayo
Score: 15-32

[00:38] Team_067 possession (Score: 15-32)
Zach DeRozan makes the Layup and draws the foul on Kyrie Adebayo! And-1! Zach DeRozan to the line for 1. [Team fouls: 4] (Kyrie Adebayo: 3 personal fouls)   FT 1/1: GOOD Zach DeRozan makes 1/1 from the line.
Score: 15-35

[00:27] Team_096 possession (Score: 15-35)
FOUL! Offensive foul on Cole Griffin! Desmond Simmons drew the charge! [Team fouls: 5] (Cole Griffin: 1 personal fouls) TURNOVER! (dead ball)

[00:13] Team_067 possession (Score: 15-35)
Anfernee Wagner drives to the basket... Anfernee Wagner loses the ball! Stripped by Kyrie Adebayo! TURNOVER! (live ball)

================================================================================
                              1ST QUARTER COMPLETE                              
================================================================================

1ST QUARTER SCORE: Team_096 15, Team_067 35

BOX SCORE:
================================================================================

Team_096
--------------------------------------------------------------------------------
Player                MIN  PTS  REB  AST  TO      FG   FG%      3P   3P%
--------------------------------------------------------------------------------
Jarrett Markkanen       2    6    0    0   0   2/2   100.0     0/0   0.0
Lamelo Quickley        10    3    0    0   0   1/1   100.0     0/0   0.0
Terry Mobley           10    2    0    0   0   1/3    33.3     0/0   0.0
Scottie Herro          10    2    3    0   0   1/2    50.0     0/0   0.0
Kyrie Adebayo          12    2    2    1   0   1/2    50.0     0/0   0.0
Cole Griffin           12    0    2    3   0   0/5     0.0     0/0   0.0
Tyler Haliburton        2    0    0    1   0   0/0     0.0     0/0   0.0

TEAM: FG: 6/15 (40.0%), 3PT: 3/6 (50.0%), REB: 7 (2 off, 5 def), AST: 5, TO: 8
TEAM FOULS: 5 [Team_067 in BONUS]


Team_067
--------------------------------------------------------------------------------
Player                MIN  PTS  REB  AST  TO      FG   FG%      3P   3P%
--------------------------------------------------------------------------------
Ben Ball               10   10    0    2   0   5/6    83.3     0/0   0.0
Desmond Simmons        12    7    3    2   0   3/5    60.0     0/0   0.0
Kristaps Davis          2    6    0    1   0   2/2   100.0     0/0   0.0
Wendell Antetokounmpo   10    5    3    2   0   2/3    66.7     0/0   0.0
Zach DeRozan            2    3    0    1   0   1/1   100.0     0/0   0.0
Malcolm Westbrook      10    2    2    1   0   1/2    50.0     0/0   0.0
Manu Reaves            10    2    1    1   0   1/1   100.0     0/0   0.0

TEAM: FG: 15/20 (75.0%), 3PT: 5/7 (71.4%), REB: 9 (0 off, 9 def), AST: 10, TO: 3
TEAM FOULS: 2

================================================================================

================================================================================
                       2ND QUARTER - Team_096 vs Team_067                       
================================================================================

[12:00] Team_096 possession (Score: 15-35)
Kyrie Adebayo drives to the basket... Kyrie Adebayo commits a violation (traveling/carry)! TURNOVER! (dead ball)

[11:48] Team_067 possession (Score: 15-35)
Wendell Antetokounmpo attempts a Layup. Contested by Lamelo Quickley (2.2 feet, MAN). Wendell Antetokounmpo misses. Rebound secured by Scottie Herro.

[11:30] Team_096 possession (Score: 15-35)
Cole Griffin attempts a Midrange. Contested by Desmond Simmons (4.6 feet, MAN). COLE GRIFFIN MAKES IT!
Score: 17-35

[11:16] Team_067 possession (Score: 17-35)
Malcolm Westbrook drives, picks up Kyrie Adebayo. Help arrives from Lamelo Quickley! Malcolm Westbrook attempts a Dunk. Heavily contested by Lamelo Quickley (1.5 feet, ZONE)! MALCOLM WESTBROOK MAKES IT!
Score: 17-37

[11:03] Team_096 possession (Score: 17-37)
Scottie Herro attempts a Layup. BLOCKED BY BEN BALL! Ball deflects out of bounds off Scottie Herro.

[10:46] Team_067 possession (Score: 17-37)
Ben Ball drives to the basket... Ben Ball loses control! Ball rolls out of bounds! TURNOVER! (dead ball)

[10:46] Substitution (Team_096): Cole Griffin OUT → Cole Holiday IN (stamina_rule2)

[10:46] Substitution (Team_096): Kyrie Adebayo OUT → Devin Griffin IN (stamina_rule2)

[10:46] Substitution (Team_067): Desmond Simmons OUT → Kyle Leonard IN (stamina_rule2)

[10:33] Team_096 possession (Score: 17-37)
Lamelo Quickley drives and kicks out. Devin Griffin attempts a 3Pt. Contested by Malcolm Westbrook (2.7 feet, MAN). Devin Griffin misses. Rebound secured by Malcolm Westbrook.

[10:20] Team_067 possession (Score: 17-37)
Wendell Antetokounmpo makes the Layup and draws the foul on Lamelo Quickley! And-1! Wendell Antetokounmpo to the line for 1. [Team fouls: 1] (Lamelo Quickley: 1 personal fouls)   FT 1/1: GOOD Wendell Antetokounmpo makes 1/1 from the line.
Score: 17-40

[10:04] Team_096 possession (Score: 17-40)
Devin Griffin attempts a 3Pt. Heavily contested by Malcolm Westbrook (1.4 feet, MAN)! Devin Griffin misses. Rebound secured by Malcolm Westbrook.

[09:48] Team_067 possession (Score: 17-40)
Ben Ball drives to the basket... Ben Ball loses control! Ball rolls out of bounds! TURNOVER! (dead ball)

[09:48] Substitution (Team_067): Manu Reaves OUT → James Rozier IN (stamina_rule2)

[09:48] Substitution (Team_067): Wendell Antetokounmpo OUT → Anfernee Wagner IN (stamina_rule2)

[09:48] Substitution (Team_067): Ben Ball OUT → Kristaps Davis IN (stamina_rule2)

[09:48] Substitution (Team_067): Malcolm Westbrook OUT → Zach DeRozan IN (stamina_rule2)

[09:32] Team_096 possession (Score: 17-40)
Lamelo Quickley makes the Dunk and draws the foul on Zach DeRozan! And-1! Lamelo Quickley to the line for 1. [Team fouls: 1] (Zach DeRozan: 1 personal fouls)   FT 1/1: MISS Lamelo Quickley makes 0/1 from the line. Rebound secured by Zach DeRozan.
Score: 19-40

[09:17] Team_067 possession (Score: 19-40)
James Rozier attempts a Midrange. Wide open! Terry Mobley is 7.2 feet away. [MAN] JAMES ROZIER MAKES IT!
Score: 19-42

[09:01] Team_096 possession (Score: 19-42)
Scottie Herro attempts a Layup. Contested by Kristaps Davis (3.9 feet, ZONE). SCOTTIE HERRO MAKES IT! Assist: Lamelo Quickley
Score: 21-42

[08:49] Team_067 possession (Score: 21-42)
Anfernee Wagner attempts a 3Pt. Contested by Terry Mobley (5.6 feet, ZONE). Anfernee Wagner misses. Rebound secured by Cole Holiday.

[08:37] Team_096 possession (Score: 21-42)
FOUL! Holding foul on James Rozier. [Team fouls: 2] No free throws, side out. (James Rozier: 1 personal fouls)

[08:27] Team_096 possession (Score: 21-42)
Devin Griffin attempts a Layup. Heavily contested by Zach DeRozan (0.5 feet, MAN)! DEVIN GRIFFIN MAKES IT! Assist: Scottie Herro
Score: 23-42

[08:14] Team_067 possession (Score: 23-42)
Zach DeRozan loses the ball! Stripped by Devin Griffin! TURNOVER! (live ball)

[08:00] Team_096 possession (Score: 23-42)
Cole Holiday attempts a 3Pt. Contested by Kyle Leonard (3.5 feet, MAN). COLE HOLIDAY MAKES IT! Assist: Terry Mobley
Score: 26-42

[07:46] Team_067 possession (Score: 26-42)
Kristaps Davis attempts a Midrange. Wide open! Scottie Herro is 7.9 feet away. [MAN] Kristaps Davis misses. Rebound secured by Devin Griffin.

[07:29] Team_096 possession (Score: 26-42)
FOUL! Reach-in foul on Anfernee Wagner during the drive. [Team fouls: 3] No free throws, side out. (Anfernee Wagner: 1 personal fouls)

[07:17] Team_096 possession (Score: 26-42)
Lamelo Quickley attempts a Midrange. Contested by Anfernee Wagner (5.0 feet, MAN). Lamelo Quickley misses. Rebound secured by Zach DeRozan.

[07:01] Team_067 possession (Score: 26-42)
Kyle Leonard attempts a 3Pt. Wide open! Scottie Herro is 8.1 feet away. [ZONE] Kyle Leonard misses. Rebound secured by Devin Griffin.

[06:49] Team_096 possession (Score: 26-42)
Lamelo Quickley attempts a Midrange. Contested by Anfernee Wagner (4.7 feet, MAN). LAMELO QUICKLEY MAKES IT! Assist: Cole Holiday
Score: 28-42

[06:39] Team_067 possession (Score: 28-42)
Kristaps Davis attempts a Midrange. Contested by Devin Griffin (5.2 feet, ZONE). Kristaps Davis misses. FOUL! Loose ball foul on Cole Holiday during the rebound battle. [Team fouls: 2] No free throws, side out. (Cole Holiday: 1 personal fouls)

[06:24] Team_067 possession (Score: 28-42)
FOUL! Holding foul on Devin Griffin. [Team fouls: 3] No free throws, side out. (Devin Griffin: 1 personal fouls)

[06:09] Team_067 possession (Score: 28-42)
Anfernee Wagner drives, picks up Scottie Herro. Help arrives from Lamelo Quickley! Anfernee Wagner attempts a Dunk. Contested by Lamelo Quickley (4.2 feet, ZONE). Anfernee Wagner misses. Rebound secured by Scottie Herro.

[05:54] Team_096 possession (Score: 28-42)
FOUL! Holding foul on Kyle Leonard. [Team fouls: 4] No free throws, side out. (Kyle Leonard: 1 personal fouls)

[05:37] Team_096 possession (Score: 28-42)
Terry Mobley attempts a 3Pt. Contested by James Rozier (4.2 feet, MAN). TERRY MOBLEY MAKES IT!
Score: 31-42

[05:20] Team_067 possession (Score: 31-42)
James Rozier attempts a Midrange. Contested by Terry Mobley (3.5 feet, MAN). JAMES ROZIER MAKES IT!
Score: 31-44

[05:03] Team_096 possession (Score: 31-44)
Cole Holiday attempts a 3Pt. Contested by Kyle Leonard (3.7 feet, MAN). Cole Holiday misses. Rebound secured by Zach DeRozan.

[04:47] Team_067 possession (Score: 31-44)
Kyle Leonard attempts a Midrange. Wide open! Lamelo Quickley is 6.1 feet away. [ZONE] KYLE LEONARD MAKES IT! Assist: James Rozier
Score: 31-46

[04:36] Team_096 possession (Score: 31-46)
Lamelo Quickley drives, Kristaps Davis stays with him. Lamelo Quickley attempts a Dunk. Contested by Kristaps Davis (5.1 feet, ZONE). LAMELO QUICKLEY MAKES IT! Assist: Terry Mobley
Score: 33-46

[04:24] Team_067 possession (Score: 33-46)
James Rozier attempts a 3Pt. Wide open! Terry Mobley is 8.1 feet away. [MAN] James Rozier misses. Rebound secured by Cole Holiday.

[04:07] Team_096 possession (Score: 33-46)
Terry Mobley drives and kicks out. Devin Griffin attempts a 3Pt. Contested by Zach DeRozan (4.6 feet, MAN). Devin Griffin misses. Rebound secured by Anfernee Wagner.

[03:51] Team_067 possession (Score: 33-46)
Anfernee Wagner attempts a Midrange. Wide open! Lamelo Quickley is 6.5 feet away. [MAN] Anfernee Wagner misses. Rebound secured by Scottie Herro.

[03:34] Team_096 possession (Score: 33-46)
Terry Mobley attempts a 3Pt. BLOCKED BY JAMES ROZIER! Ball is loose! Rebound secured by Anfernee Wagner.

[03:20] Team_067 possession (Score: 33-46)
Kristaps Davis attempts a 3Pt. Contested by Cole Holiday (4.6 feet, ZONE). KRISTAPS DAVIS MAKES IT! Assist: Zach DeRozan
Score: 33-49

[03:09] Team_096 possession (Score: 33-49)
Cole Holiday attempts a Midrange. Heavily contested by Kyle Leonard (1.9 feet, MAN)! COLE HOLIDAY MAKES IT! Assist: Lamelo Quickley
Score: 35-49

[02:58] Team_067 possession (Score: 35-49)
Kristaps Davis attempts a 3Pt. Contested by Cole Holiday (3.9 feet, ZONE). Kristaps Davis misses. Rebound secured by Scottie Herro.

[02:43] Team_096 possession (Score: 35-49)
FOUL! Shooting foul on Kyle Leonard. Lamelo Quickley to the line for 3 free throws. [BONUS: 5 team fouls] (Kyle Leonard: 2 personal fouls)   FT 1/3: GOOD   FT 2/3: GOOD   FT 3/3: MISS Lamelo Quickley makes 2/3 from the line. Rebound secured by Kyle Leonard.
Score: 37-49

[02:29] Team_067 possession (Score: 37-49)
Zach DeRozan throws a bad pass out of bounds! TURNOVER! (dead ball)

[02:29] Substitution (Team_096): Terry Mobley OUT → Cade Jokic IN (stamina_rule2)

[02:29] Substitution (Team_096): Lamelo Quickley OUT → Jarrett Markkanen IN (stamina_rule2)

[02:29] Substitution (Team_096): Scottie Herro OUT → Tyler Haliburton IN (stamina_rule2)

[02:16] Team_096 possession (Score: 37-49)
FOUL! Shooting foul on Kyle Leonard. Cole Holiday to the line for 2 free throws. [BONUS: 6 team fouls] (Kyle Leonard: 3 personal fouls)   FT 1/2: GOOD   FT 2/2: GOOD Cole Holiday makes 2/2 from the line.
Score: 39-49

[01:57] Team_067 possession (Score: 39-49)
James Rozier makes the Dunk and draws the foul on Tyler Haliburton! And-1! James Rozier to the line for 1. [Team fouls: 4] (Tyler Haliburton: 1 personal fouls)   FT 1/1: GOOD James Rozier makes 1/1 from the line.
Score: 39-52

[01:41] Team_096 possession (Score: 39-52)
Cole Holiday drives to the basket... Cole Holiday throws a bad pass out of bounds! TURNOVER! (dead ball)

[01:29] Team_067 possession (Score: 39-52)
Zach DeRozan attempts a Midrange. Contested by Jarrett Markkanen (5.1 feet, ZONE). ZACH DEROZAN MAKES IT!
Score: 39-54

[01:11] Team_096 possession (Score: 39-54)
Devin Griffin makes the Layup and draws the foul on Zach DeRozan! And-1! Devin Griffin to the line for 1. [BONUS: 7 team fouls] (Zach DeRozan: 2 personal fouls)   FT 1/1: GOOD Devin Griffin makes 1/1 from the line.
Score: 42-54

[00:56] Team_067 possession (Score: 42-54)
Kristaps Davis attempts a Midrange. Wide open! Tyler Haliburton is 6.7 feet away. [MAN] KRISTAPS DAVIS MAKES IT! Assist: Zach DeRozan
Score: 42-56

[00:44] Team_096 possession (Score: 42-56)
Tyler Haliburton throws a bad pass! Stolen by Kristaps Davis! TURNOVER! (live ball)

[00:32] Team_067 possession (Score: 42-56)
FOUL! Reach-in foul on Jarrett Markkanen during the drive. [IN THE BONUS! 5 team fouls] Anfernee Wagner to the line for 2 free throws. (Jarrett Markkanen: 1 personal fouls)   FT 1/2: MISS   FT 2/2: GOOD Anfernee Wagner makes 1/2 from the line.
Score: 42-57

[00:17] Team_096 possession (Score: 42-57)
Cade Jokic drives to the basket... Cade Jokic throws a bad pass out of bounds! TURNOVER! (dead ball)

[00:06] Team_067 possession (Score: 42-57)
Kyle Leonard drives to the basket... Kyle Leonard commits a violation (traveling/carry)! TURNOVER! (dead ball)

================================================================================
                              2ND QUARTER COMPLETE                              
================================================================================

2ND QUARTER SCORE: Team_096 27, Team_067 22

BOX SCORE:
================================================================================

Team_096
--------------------------------------------------------------------------------
Player                MIN  PTS  REB  AST  TO      FG   FG%      3P   3P%
--------------------------------------------------------------------------------
Cole Holiday           11    7    2    1   0   3/4    75.0     0/0   0.0
Devin Griffin          11    5    2    0   0   2/3    66.7     0/0   0.0
Lamelo Quickley        20    4    0    2   0   2/6    33.3     0/0   0.0
Terry Mobley           20    3    0    2   0   1/3    33.3     0/0   0.0
Scottie Herro          20    2    4    1   0   1/2    50.0     0/0   0.0
Cole Griffin           14    2    0    0   0   1/1   100.0     0/0   0.0

TEAM: FG: 10/19 (52.6%), 3PT: 2/6 (33.3%), REB: 8 (0 off, 8 def), AST: 6, TO: 4
TEAM FOULS: 5 [Team_067 in BONUS]


Team_067
--------------------------------------------------------------------------------
Player                MIN  PTS  REB  AST  TO      FG   FG%      3P   3P%
--------------------------------------------------------------------------------
James Rozier           12    7    0    1   0   3/4    75.0     0/0   0.0
Kristaps Davis         12    5    0    0   0   2/4    50.0     0/0   0.0
Wendell Antetokounmpo   13    3    0    0   0   1/2    50.0     0/0   0.0
Malcolm Westbrook      13    2    2    0   0   1/1   100.0     0/0   0.0
Zach DeRozan           12    2    4    2   0   1/1   100.0     0/0   0.0
Kyle Leonard           11    2    1    0   0   1/2    50.0     0/0   0.0
Anfernee Wagner        12    1    2    0   0   1/4    25.0     0/0   0.0

TEAM: FG: 10/18 (55.6%), 3PT: 1/5 (20.0%), REB: 9 (1 off, 8 def), AST: 3, TO: 5
TEAM FOULS: 7 [Team_096 in BONUS]

================================================================================

================================================================================
                       3RD QUARTER - Team_096 vs Team_067                       
================================================================================

[12:00] Team_096 possession (Score: 42-57)
Scottie Herro makes the Dunk and draws the foul on Ben Ball! And-1! Scottie Herro to the line for 1. [Team fouls: 1] (Ben Ball: 1 personal fouls)   FT 1/1: GOOD Scottie Herro makes 1/1 from the line.
Score: 45-57

[11:43] Team_067 possession (Score: 45-57)
Wendell Antetokounmpo attempts a 3Pt. Contested by Cole Griffin (4.0 feet, ZONE). Wendell Antetokounmpo misses. Rebound secured by Cole Griffin.

[11:32] Team_096 possession (Score: 45-57)
Kyrie Adebayo drives and kicks out. Terry Mobley attempts a 3Pt. Contested by Desmond Simmons (5.0 feet, ZONE). TERRY MOBLEY MAKES IT! Assist: Scottie Herro
Score: 48-57

[11:15] Team_067 possession (Score: 48-57)
Malcolm Westbrook attempts a 3Pt. Contested by Cole Griffin (3.9 feet, ZONE). Malcolm Westbrook misses. Rebound secured by Kyrie Adebayo.

[11:03] Team_096 possession (Score: 48-57)
Cole Griffin loses the ball! Stripped by Desmond Simmons! TURNOVER! (live ball)

[10:48] Team_067 possession (Score: 48-57)
Malcolm Westbrook attempts a Layup. BLOCKED BY KYRIE ADEBAYO! Ball is loose! Rebound secured by Scottie Herro.

[10:33] Team_096 possession (Score: 48-57)
Cole Griffin attempts a Midrange. Contested by Ben Ball (3.0 feet, ZONE). Cole Griffin misses. Rebound secured by Malcolm Westbrook.

[10:14] Team_067 possession (Score: 48-57)
Desmond Simmons attempts a 3Pt. Contested by Cole Griffin (3.3 feet, MAN). Desmond Simmons misses. Offensive rebound by Desmond Simmons! Desmond Simmons kicks it out.

[09:58] Team_067 possession (Score: 48-57)
Wendell Antetokounmpo attempts a 3Pt. Wide open! Lamelo Quickley is 8.1 feet away. [MAN] WENDELL ANTETOKOUNMPO MAKES IT! Assist: Manu Reaves
Score: 48-60

[09:44] Team_096 possession (Score: 48-60)
FOUL! Holding foul on Manu Reaves. [Team fouls: 2] No free throws, side out. (Manu Reaves: 1 personal fouls)

[09:30] Team_096 possession (Score: 48-60)
Scottie Herro drives, Malcolm Westbrook stays with him. Scottie Herro attempts a Layup. Contested by Malcolm Westbrook (3.0 feet, ZONE). Scottie Herro misses. Rebound secured by Wendell Antetokounmpo.

[09:17] Team_067 possession (Score: 48-60)
Desmond Simmons attempts a Midrange. Contested by Lamelo Quickley (4.9 feet, ZONE). DESMOND SIMMONS MAKES IT!
Score: 48-62

[09:01] Team_096 possession (Score: 48-62)
Terry Mobley drives and kicks out. Scottie Herro attempts a 3Pt. Wide open! Ben Ball is 8.7 feet away. [MAN] SCOTTIE HERRO MAKES IT! Assist: Terry Mobley
Score: 51-62

[08:47] Team_067 possession (Score: 51-62)
FOUL! Shooting foul on Kyrie Adebayo. Wendell Antetokounmpo to the line for 2 free throws. [Team fouls: 1] (Kyrie Adebayo: 1 personal fouls)   FT 1/2: GOOD   FT 2/2: GOOD Wendell Antetokounmpo makes 2/2 from the line.
Score: 51-64

[08:35] Team_096 possession (Score: 51-64)
FOUL! Shooting foul on Desmond Simmons. Scottie Herro to the line for 2 free throws. [Team fouls: 3] (Desmond Simmons: 1 personal fouls)   FT 1/2: GOOD   FT 2/2: GOOD Scottie Herro makes 2/2 from the line.
Score: 53-64

[08:18] Team_067 possession (Score: 53-64)
Manu Reaves attempts a 3Pt. Contested by Cole Griffin (4.9 feet, ZONE). MANU REAVES MAKES IT! Assist: Wendell Antetokounmpo
Score: 53-67

[08:05] Team_096 possession (Score: 53-67)
Lamelo Quickley attempts a 3Pt. Contested by Desmond Simmons (2.2 feet, ZONE). Lamelo Quickley misses. Rebound secured by Desmond Simmons.

[07:47] Team_067 possession (Score: 53-67)
Malcolm Westbrook attempts a Midrange. Contested by Kyrie Adebayo (3.9 feet, MAN). MALCOLM WESTBROOK MAKES IT!
Score: 53-69

[07:30] Team_096 possession (Score: 53-69)
Cole Griffin drives and kicks out. Scottie Herro attempts a 3Pt. Contested by Desmond Simmons (3.3 feet, ZONE). Scottie Herro misses. Rebound secured by Malcolm Westbrook.

[07:15] Team_067 possession (Score: 53-69)
FOUL! Shooting foul on Cole Griffin. Wendell Antetokounmpo to the line for 2 free throws. [Team fouls: 2] (Cole Griffin: 1 personal fouls)   FT 1/2: GOOD   FT 2/2: GOOD Wendell Antetokounmpo makes 2/2 from the line.
Score: 53-71

[07:04] Team_096 possession (Score: 53-71)
Terry Mobley attempts a Midrange. Contested by Manu Reaves (3.3 feet, MAN). TERRY MOBLEY MAKES IT! Assist: Scottie Herro
Score: 55-71

[06:50] Team_067 possession (Score: 55-71)
FOUL! Offensive foul on Ben Ball! Scottie Herro drew the charge! [Team fouls: 4] (Ben Ball: 2 personal fouls) TURNOVER! (dead ball)

[06:38] Team_096 possession (Score: 55-71)
FOUL! Reach-in foul on Wendell Antetokounmpo during the drive. [IN THE BONUS! 5 team fouls] Lamelo Quickley to the line for 2 free throws. (Wendell Antetokounmpo: 1 personal fouls)   FT 1/2: MISS   FT 2/2: GOOD Lamelo Quickley makes 1/2 from the line.
Score: 56-71

[06:23] Team_067 possession (Score: 56-71)
Wendell Antetokounmpo attempts a 3Pt. Contested by Lamelo Quickley (5.5 feet, MAN). WENDELL ANTETOKOUNMPO MAKES IT! Assist: Manu Reaves
Score: 56-74

[06:09] Team_096 possession (Score: 56-74)
Lamelo Quickley drives, Wendell Antetokounmpo stays with him. Lamelo Quickley attempts a Layup. Contested by Wendell Antetokounmpo (3.4 feet, MAN). Lamelo Quickley misses. Rebound secured by Malcolm Westbrook.

[05:52] Team_067 possession (Score: 56-74)
FOUL! Shooting foul on Scottie Herro. Wendell Antetokounmpo to the line for 2 free throws. [Team fouls: 3] (Scottie Herro: 1 personal fouls)   FT 1/2: GOOD   FT 2/2: MISS Wendell Antetokounmpo makes 1/2 from the line. Rebound secured by Kyrie Adebayo.
Score: 56-75

[05:37] Team_096 possession (Score: 56-75)
Lamelo Quickley makes the Layup and draws the foul on Wendell Antetokounmpo! And-1! Lamelo Quickley to the line for 1. [BONUS: 6 team fouls] (Wendell Antetokounmpo: 2 personal fouls)   FT 1/1: GOOD Lamelo Quickley makes 1/1 from the line.
Score: 59-75

[05:21] Team_067 possession (Score: 59-75)
FOUL! Shooting foul on Cole Griffin. Wendell Antetokounmpo to the line for 3 free throws. [Team fouls: 4] (Cole Griffin: 2 personal fouls)   FT 1/3: GOOD   FT 2/3: GOOD   FT 3/3: GOOD Wendell Antetokounmpo makes 3/3 from the line.
Score: 59-78

[05:07] Team_096 possession (Score: 59-78)
Cole Griffin drives to the basket... Cole Griffin loses the ball! Stripped by Malcolm Westbrook! TURNOVER! (live ball)

[04:49] Team_067 possession (Score: 59-78)
Wendell Antetokounmpo attempts a 3Pt. Contested by Terry Mobley (4.6 feet, ZONE). Wendell Antetokounmpo misses. Rebound secured by Kyrie Adebayo.

[04:35] Team_096 possession (Score: 59-78)
FOUL! Reach-in foul on Malcolm Westbrook during the drive. [IN THE BONUS! 7 team fouls] Kyrie Adebayo to the line for 2 free throws. (Malcolm Westbrook: 1 personal fouls)   FT 1/2: GOOD   FT 2/2: GOOD Kyrie Adebayo makes 2/2 from the line.
Score: 61-78

[04:18] Team_067 possession (Score: 61-78)
FOUL! Holding foul on Lamelo Quickley. [IN THE BONUS! 5 team fouls] Wendell Antetokounmpo to the line for 2 free throws. (Lamelo Quickley: 1 personal fouls)   FT 1/2: GOOD   FT 2/2: GOOD Wendell Antetokounmpo makes 2/2 from the line.
Score: 61-80

[04:04] Team_096 possession (Score: 61-80)
Kyrie Adebayo attempts a 3Pt. Contested by Desmond Simmons (4.6 feet, ZONE). KYRIE ADEBAYO MAKES IT! Assist: Cole Griffin
Score: 64-80

[03:45] Team_067 possession (Score: 64-80)
Wendell Antetokounmpo drives, Lamelo Quickley stays with him. Wendell Antetokounmpo attempts a Dunk. Wide open! Lamelo Quickley is 8.8 feet away. [MAN] Wendell Antetokounmpo misses. Rebound secured by Cole Griffin.

[03:34] Team_096 possession (Score: 64-80)
Cole Griffin drives to the basket... Cole Griffin throws a bad pass! Stolen by Malcolm Westbrook! TURNOVER! (live ball)

[03:22] Team_067 possession (Score: 64-80)
FOUL! Shooting foul on Kyrie Adebayo. Malcolm Westbrook to the line for 2 free throws. [BONUS: 6 team fouls] (Kyrie Adebayo: 2 personal fouls)   FT 1/2: GOOD   FT 2/2: GOOD Malcolm Westbrook makes 2/2 from the line.
Score: 64-82

[03:12] Team_096 possession (Score: 64-82)
Terry Mobley attempts a 3Pt. Contested by Manu Reaves (4.8 feet, MAN). Terry Mobley misses. Rebound secured by Malcolm Westbrook.

[02:59] Team_067 possession (Score: 64-82)
FOUL! Offensive foul on Manu Reaves! Terry Mobley drew the charge! [Team fouls: 8] (Manu Reaves: 2 personal fouls) TURNOVER! (dead ball)

[02:46] Team_096 possession (Score: 64-82)
FOUL! Shooting foul on Desmond Simmons. Cole Griffin to the line for 3 free throws. [BONUS: 9 team fouls] (Desmond Simmons: 2 personal fouls)   FT 1/3: GOOD   FT 2/3: GOOD   FT 3/3: GOOD Cole Griffin makes 3/3 from the line.
Score: 67-82

[02:28] Team_067 possession (Score: 67-82)
Ben Ball drives, Kyrie Adebayo stays with him. Ben Ball attempts a Dunk. Contested by Kyrie Adebayo (3.7 feet, ZONE). BEN BALL MAKES IT! Assist: Wendell Antetokounmpo
Score: 67-84

[02:18] Team_096 possession (Score: 67-84)
Scottie Herro makes the Layup and draws the foul on Ben Ball! And-1! Scottie Herro to the line for 1. [BONUS: 10 team fouls] (Ben Ball: 3 personal fouls)   FT 1/1: GOOD Scottie Herro makes 1/1 from the line.
Score: 70-84

[02:03] Team_067 possession (Score: 70-84)
Desmond Simmons drives, Kyrie Adebayo stays with him. Desmond Simmons attempts a Dunk. Contested by Kyrie Adebayo (3.2 feet, ZONE). DESMOND SIMMONS MAKES IT! Assist: Manu Reaves
Score: 70-86

[01:52] Team_096 possession (Score: 70-86)
FOUL! Shooting foul on Manu Reaves. Terry Mobley to the line for 2 free throws. [BONUS: 11 team fouls] (Manu Reaves: 3 personal fouls)   FT 1/2: GOOD   FT 2/2: GOOD Terry Mobley makes 2/2 from the line.
Score: 72-86

[01:39] Team_067 possession (Score: 72-86)
Wendell Antetokounmpo drives and kicks out. Wendell Antetokounmpo attempts a 3Pt. Wide open! Lamelo Quickley is 9.4 feet away. [MAN] Wendell Antetokounmpo misses. Offensive rebound by Desmond Simmons! Desmond Simmons kicks it out.

[01:26] Team_067 possession (Score: 72-86)
FOUL! Holding foul on Terry Mobley. [IN THE BONUS! 7 team fouls] Manu Reaves to the line for 2 free throws. (Terry Mobley: 1 personal fouls)   FT 1/2: GOOD   FT 2/2: GOOD Manu Reaves makes 2/2 from the line.
Score: 72-88

[01:09] Team_096 possession (Score: 72-88)
Scottie Herro attempts a Midrange. Contested by Ben Ball (4.7 feet, MAN). Scottie Herro misses. FOUL! Loose ball foul on Malcolm Westbrook during the rebound battle. [IN THE BONUS! 12 team fouls] Scottie Herro to the line for 2 free throws. (Malcolm Westbrook: 2 personal fouls)   FT 1/2: GOOD   FT 2/2: GOOD Scottie Herro makes 2/2 from the line.
Score: 74-88

[00:53] Team_067 possession (Score: 74-88)
Malcolm Westbrook makes the Midrange and draws the foul on Kyrie Adebayo! And-1! Malcolm Westbrook to the line for 1. [BONUS: 8 team fouls] (Kyrie Adebayo: 3 personal fouls)   FT 1/1: GOOD Malcolm Westbrook makes 1/1 from the line.
Score: 74-91

[00:38] Team_096 possession (Score: 74-91)
Kyrie Adebayo drives to the basket... Kyrie Adebayo throws a bad pass! Stolen by Malcolm Westbrook! TURNOVER! (live ball)

[00:24] Team_067 possession (Score: 74-91)
Desmond Simmons attempts a 3Pt. Wide open! Cole Griffin is 6.1 feet away. [ZONE] DESMOND SIMMONS MAKES IT! Assist: Ben Ball
Score: 74-94

[00:10] Team_096 possession (Score: 74-94)
Scottie Herro drives, picks up Ben Ball. Help arrives from Wendell Antetokounmpo! Scottie Herro attempts a Layup. Contested by Wendell Antetokounmpo (2.6 feet, MAN). SCOTTIE HERRO MAKES IT! Assist: Terry Mobley
Score: 76-94

================================================================================
                              3RD QUARTER COMPLETE                              
================================================================================

3RD QUARTER SCORE: Team_096 34, Team_067 37

BOX SCORE:
================================================================================

Team_096
--------------------------------------------------------------------------------
Player                MIN  PTS  REB  AST  TO      FG   FG%      3P   3P%
--------------------------------------------------------------------------------
Scottie Herro          32   15    1    2   0   6/7    85.7     0/0   0.0
Terry Mobley           32    7    0    2   0   3/4    75.0     0/0   0.0
Kyrie Adebayo          26    5    3    0   0   2/2   100.0     0/0   0.0
Lamelo Quickley        32    4    0    0   0   2/4    50.0     0/0   0.0
Cole Griffin           26    3    2    1   0   1/3    33.3     0/0   0.0

TEAM: FG: 14/20 (70.0%), 3PT: 2/4 (50.0%), REB: 6 (0 off, 6 def), AST: 5, TO: 4
TEAM FOULS: 8 [Team_067 in BONUS]


Team_067
--------------------------------------------------------------------------------
Player                MIN  PTS  REB  AST  TO      FG   FG%      3P   3P%
--------------------------------------------------------------------------------
Wendell Antetokounmpo   25   15    1    2   0   6/10   60.0     0/0   0.0
Malcolm Westbrook      25    7    4    0   0   3/5    60.0     0/0   0.0
Desmond Simmons        26    7    3    0   0   3/3   100.0     0/0   0.0
Manu Reaves            25    5    0    3   0   2/2   100.0     0/0   0.0
Ben Ball               25    2    0    1   0   1/1   100.0     0/0   0.0

TEAM: FG: 15/21 (71.4%), 3PT: 5/8 (62.5%), REB: 8 (2 off, 6 def), AST: 6, TO: 2
TEAM FOULS: 12 [Team_096 in BONUS]

================================================================================

================================================================================
                       4TH QUARTER - Team_096 vs Team_067                       
================================================================================

[12:00] Substitution (Team_096): Terry Mobley OUT (stamina: 69) → Cade Jokic IN (comeback_detected)

[12:00] Substitution (Team_067): Manu Reaves OUT (stamina: 67) → James Rozier IN (comeback_detected)

[12:00] Substitution (Team_096): Lamelo Quickley OUT → Jarrett Markkanen IN (stamina_rule2)

[12:00] Substitution (Team_096): Scottie Herro OUT → Tyler Haliburton IN (stamina_rule2)

[12:00] Substitution (Team_067): Wendell Antetokounmpo OUT → Anfernee Wagner IN (stamina_rule2)

[12:00] Substitution (Team_067): Ben Ball OUT → Kristaps Davis IN (stamina_rule2)

[12:00] Substitution (Team_067): Malcolm Westbrook OUT → Zach DeRozan IN (stamina_rule2)

[12:00] Team_096 possession (Score: 76-94)
Cade Jokic loses control! Ball rolls out of bounds! TURNOVER! (dead ball)

[11:47] Team_067 possession (Score: 76-94)
Anfernee Wagner drives to the basket... Anfernee Wagner throws a bad pass! Stolen by Jarrett Markkanen! TURNOVER! (live ball)

[11:32] Team_096 possession (Score: 76-94)
Jarrett Markkanen attempts a 3Pt. Contested by Anfernee Wagner (5.2 feet, ZONE). Jarrett Markkanen misses. Rebound secured by Kristaps Davis.

[11:15] Team_067 possession (Score: 76-94)
James Rozier drives, picks up Cade Jokic. Help arrives from Jarrett Markkanen! James Rozier attempts a Layup. Contested by Jarrett Markkanen (5.9 feet, MAN). JAMES ROZIER MAKES IT! Assist: Zach DeRozan
Score: 76-96

[11:03] Team_096 possession (Score: 76-96)
FOUL! Reach-in foul on Anfernee Wagner during the drive. [Team fouls: 1] No free throws, side out. (Anfernee Wagner: 1 personal fouls)

[10:47] Team_096 possession (Score: 76-96)
Cade Jokic attempts a 3Pt. Wide open! James Rozier is 6.9 feet away. [MAN] Cade Jokic misses. Rebound secured by Kristaps Davis.

[10:30] Team_067 possession (Score: 76-96)
Anfernee Wagner attempts a Midrange. Contested by Jarrett Markkanen (3.0 feet, MAN). Anfernee Wagner misses. Rebound secured by Kyrie Adebayo.

[10:19] Team_096 possession (Score: 76-96)
Cade Jokic attempts a 3Pt. Contested by James Rozier (5.9 feet, MAN). Cade Jokic misses. Rebound secured by Anfernee Wagner.

[10:01] Team_067 possession (Score: 76-96)
FOUL! Shooting foul on Tyler Haliburton. Kristaps Davis to the line for 2 free throws. [Team fouls: 1] (Tyler Haliburton: 1 personal fouls)   FT 1/2: GOOD   FT 2/2: GOOD Kristaps Davis makes 2/2 from the line.
Score: 76-98

[09:45] Team_096 possession (Score: 76-98)
FOUL! Offensive foul on Cade Jokic! James Rozier drew the charge! [Team fouls: 2] (Cade Jokic: 1 personal fouls) TURNOVER! (dead ball)

[09:30] Team_067 possession (Score: 76-98)
Kristaps Davis throws a bad pass! Stolen by Tyler Haliburton! TURNOVER! (live ball)

[09:15] Team_096 possession (Score: 76-98)
Kyrie Adebayo attempts a Layup. BLOCKED BY JAMES ROZIER! Ball is loose! Rebound secured by Kristaps Davis.

[09:01] Team_067 possession (Score: 76-98)
Desmond Simmons drives, picks up Kyrie Adebayo. Help arrives from Jarrett Markkanen! Desmond Simmons attempts a Dunk. Heavily contested by Jarrett Markkanen (1.4 feet, ZONE)! DESMOND SIMMONS MAKES IT! Assist: Anfernee Wagner
Score: 76-100

[08:44] Team_096 possession (Score: 76-100)
Cade Jokic drives and kicks out. Cole Griffin attempts a Midrange. Contested by Kristaps Davis (5.7 feet, ZONE). COLE GRIFFIN MAKES IT!
Score: 78-100

[08:34] Team_067 possession (Score: 78-100)
Desmond Simmons attempts a 3Pt. Contested by Cade Jokic (3.8 feet, ZONE). DESMOND SIMMONS MAKES IT! Assist: Kristaps Davis
Score: 78-103

[08:22] Team_096 possession (Score: 78-103)
Cole Griffin attempts a 3Pt. Contested by Anfernee Wagner (3.0 feet, ZONE). Cole Griffin misses. Rebound secured by Zach DeRozan.

[08:08] Team_067 possession (Score: 78-103)
Zach DeRozan attempts a Layup. BLOCKED BY KYRIE ADEBAYO! Ball is loose! Offensive rebound by Kristaps Davis! Kristaps Davis kicks it out.

[07:52] Team_067 possession (Score: 78-103)
Desmond Simmons drives, picks up Cole Griffin. Help arrives from Jarrett Markkanen! Desmond Simmons attempts a Layup. Contested by Jarrett Markkanen (2.8 feet, MAN). DESMOND SIMMONS MAKES IT! Assist: Kristaps Davis
Score: 78-105

[07:38] Team_096 possession (Score: 78-105)
Tyler Haliburton makes the Dunk and draws the foul on James Rozier! And-1! Tyler Haliburton to the line for 1. [Team fouls: 2] (James Rozier: 1 personal fouls)   FT 1/1: GOOD Tyler Haliburton makes 1/1 from the line.
Score: 81-105

[07:22] Team_067 possession (Score: 81-105)
James Rozier commits a violation (traveling/carry)! TURNOVER! (dead ball)

[07:22] Substitution (Team_096): Cole Griffin OUT → Cole Holiday IN (stamina_rule2)

[07:22] Substitution (Team_096): Kyrie Adebayo OUT → Devin Griffin IN (stamina_rule2)

[07:22] Substitution (Team_067): Desmond Simmons OUT → Kyle Leonard IN (stamina_rule2)

[07:07] Team_096 possession (Score: 81-105)
Cade Jokic attempts a Layup. Contested by Kristaps Davis (4.0 feet, ZONE). CADE JOKIC MAKES IT!
Score: 83-105

[06:51] Team_067 possession (Score: 83-105)
Kyle Leonard attempts a 3Pt. Wide open! Cade Jokic is 8.5 feet away. [ZONE] Kyle Leonard misses. Rebound secured by Jarrett Markkanen.

[06:39] Team_096 possession (Score: 83-105)
Cole Holiday drives, Kyle Leonard stays with him. Cole Holiday attempts a Layup. Wide open! Kyle Leonard is 6.4 feet away. [MAN] COLE HOLIDAY MAKES IT! Assist: Tyler Haliburton
Score: 85-105

[06:21] Team_067 possession (Score: 85-105)
Kristaps Davis attempts a Midrange. Wide open! Jarrett Markkanen is 7.5 feet away. [ZONE] Kristaps Davis misses. Rebound secured by Tyler Haliburton.

[06:02] Team_096 possession (Score: 85-105)
Cole Holiday commits a violation (traveling/carry)! TURNOVER! (dead ball)

[05:51] Team_067 possession (Score: 85-105)
Kristaps Davis attempts a 3Pt. Contested by Tyler Haliburton (5.0 feet, MAN). Kristaps Davis misses. Offensive rebound by Kristaps Davis! Kristaps Davis's putback is no good. Rebound secured by Devin Griffin.

[05:38] Team_096 possession (Score: 85-105)
Tyler Haliburton attempts a Midrange. Contested by Kristaps Davis (5.0 feet, ZONE). TYLER HALIBURTON MAKES IT! Assist: Devin Griffin
Score: 87-105

[05:23] Team_067 possession (Score: 87-105)
Kyle Leonard attempts a 3Pt. Contested by Cole Holiday (3.7 feet, MAN). Kyle Leonard misses. Offensive rebound by Zach DeRozan! Zach DeRozan kicks it out.

[05:09] Team_067 possession (Score: 87-105)
Zach DeRozan attempts a Layup. BLOCKED BY DEVIN GRIFFIN! Ball is loose! Offensive rebound by Kristaps Davis! Kristaps Davis kicks it out.

[04:51] Team_067 possession (Score: 87-105)
James Rozier attempts a Midrange. Wide open! Cade Jokic is 7.9 feet away. [MAN] James Rozier misses. Rebound secured by Tyler Haliburton.

[04:38] Team_096 possession (Score: 87-105)
Tyler Haliburton drives and kicks out. Jarrett Markkanen attempts a 3Pt. Contested by Anfernee Wagner (2.5 feet, MAN). Jarrett Markkanen misses. Offensive rebound by Tyler Haliburton! Tyler Haliburton kicks it out.

[04:24] Team_096 possession (Score: 87-105)
Tyler Haliburton drives to the basket... Tyler Haliburton throws a bad pass! Stolen by Kristaps Davis! TURNOVER! (live ball)

[04:09] Team_067 possession (Score: 87-105)
Zach DeRozan attempts a Midrange. Contested by Tyler Haliburton (5.8 feet, ZONE). ZACH DEROZAN MAKES IT!
Score: 87-107

[03:54] Team_096 possession (Score: 87-107)
Tyler Haliburton attempts a Midrange. Contested by Zach DeRozan (4.7 feet, ZONE). TYLER HALIBURTON MAKES IT!
Score: 89-107

[03:39] Team_067 possession (Score: 89-107)
Anfernee Wagner drives and kicks out. Kyle Leonard attempts a Midrange. Wide open! Jarrett Markkanen is 7.0 feet away. [ZONE] Kyle Leonard misses. Rebound secured by Tyler Haliburton.

[03:23] Team_096 possession (Score: 89-107)
Cole Holiday makes the Midrange and draws the foul on Kyle Leonard! And-1! Cole Holiday to the line for 1. [Team fouls: 3] (Kyle Leonard: 1 personal fouls)   FT 1/1: GOOD Cole Holiday makes 1/1 from the line.
Score: 92-107

[03:09] Team_067 possession (Score: 92-107)
Kristaps Davis drives, picks up Tyler Haliburton. Help arrives from Jarrett Markkanen! Kristaps Davis attempts a Layup. Wide open! Jarrett Markkanen is 6.4 feet away. [MAN] Kristaps Davis misses. Rebound secured by Cole Holiday.

[02:54] Team_096 possession (Score: 92-107)
Cade Jokic attempts a 3Pt. Wide open! Anfernee Wagner is 6.7 feet away. [ZONE] CADE JOKIC MAKES IT! Assist: Devin Griffin
Score: 95-107

[02:39] Team_067 possession (Score: 95-107)
Kristaps Davis attempts a Layup. Contested by Tyler Haliburton (3.6 feet, MAN). KRISTAPS DAVIS MAKES IT! Assist: Zach DeRozan
Score: 95-109

[02:25] Team_096 possession (Score: 95-109)
Cole Holiday attempts a 3Pt. Contested by Kyle Leonard (3.0 feet, MAN). Cole Holiday misses. Rebound secured by Kyle Leonard.

[02:09] Team_067 possession (Score: 95-109)
Kyle Leonard throws a bad pass out of bounds! TURNOVER! (dead ball)

[01:57] Team_096 possession (Score: 95-109)
Jarrett Markkanen makes the Dunk and draws the foul on Kristaps Davis! And-1! Jarrett Markkanen to the line for 1. [Team fouls: 4] (Kristaps Davis: 1 personal fouls)   FT 1/1: MISS Jarrett Markkanen makes 0/1 from the line. Rebound secured by Zach DeRozan.
Score: 97-109

[01:42] Team_067 possession (Score: 97-109)
James Rozier attempts a Midrange. Contested by Cole Holiday (3.9 feet, ZONE). JAMES ROZIER MAKES IT!
Score: 97-111

[01:28] Team_096 possession (Score: 97-111)
Devin Griffin drives, Kristaps Davis stays with him. Devin Griffin attempts a Dunk. Heavily contested by Kristaps Davis (1.8 feet, ZONE)! Devin Griffin misses. Rebound secured by Zach DeRozan.

[01:09] Team_067 possession (Score: 97-111)
James Rozier throws a bad pass out of bounds! TURNOVER! (dead ball)

[00:55] Team_096 possession (Score: 97-111)
Devin Griffin attempts a Midrange. Contested by Zach DeRozan (4.0 feet, MAN). Devin Griffin misses. Rebound secured by Zach DeRozan.

[00:43] Team_067 possession (Score: 97-111)
FOUL! Reach-in foul on Devin Griffin during the drive. [Team fouls: 3] No free throws, side out. (Devin Griffin: 1 personal fouls)

[00:32] Team_067 possession (Score: 97-111)
Kristaps Davis drives to the basket... Kristaps Davis throws a bad pass! Stolen by Devin Griffin! TURNOVER! (live ball)

[00:22] Team_096 possession (Score: 97-111)
Jarrett Markkanen attempts a 3Pt. Heavily contested by Kyle Leonard (1.3 feet, ZONE)! Jarrett Markkanen misses. Rebound secured by Kyle Leonard.

[00:09] Team_067 possession (Score: 97-111)
Kyle Leonard loses the ball! Stripped by Cole Holiday! TURNOVER! (live ball)

================================================================================
                              4TH QUARTER COMPLETE                              
================================================================================

4TH QUARTER SCORE: Team_096 21, Team_067 17

BOX SCORE:
================================================================================

Team_096
--------------------------------------------------------------------------------
Player                MIN  PTS  REB  AST  TO      FG   FG%      3P   3P%
--------------------------------------------------------------------------------
Tyler Haliburton       16    7    4    1   0   3/3   100.0     0/0   0.0
Cade Jokic             16    5    0    0   0   2/4    50.0     0/0   0.0
Cole Holiday           18    5    1    0   0   2/3    66.7     0/0   0.0
Cole Griffin           31    2    0    0   0   1/2    50.0     0/0   0.0
Jarrett Markkanen      16    0    1    0   0   0/3     0.0     0/0   0.0
Kyrie Adebayo          31    0    1    0   0   0/1     0.0     0/0   0.0
Devin Griffin          18    0    1    2   0   0/2     0.0     0/0   0.0

TEAM: FG: 8/18 (44.4%), 3PT: 1/7 (14.3%), REB: 7 (1 off, 6 def), AST: 3, TO: 4
TEAM FOULS: 3


Team_067
--------------------------------------------------------------------------------
Player                MIN  PTS  REB  AST  TO      FG   FG%      3P   3P%
--------------------------------------------------------------------------------
Desmond Simmons        31    7    0    0   0   3/3   100.0     0/0   0.0
Kristaps Davis         24    4    5    2   0   2/5    40.0     0/0   0.0
James Rozier           24    4    0    0   0   2/3    66.7     0/0   0.0
Zach DeRozan           24    2    5    2   0   1/1   100.0     0/0   0.0
Anfernee Wagner        24    0    1    1   0   0/2     0.0     0/0   0.0
Kyle Leonard           18    0    2    0   0   0/1     0.0     0/0   0.0

TEAM: FG: 8/15 (53.3%), 3PT: 1/3 (33.3%), REB: 14 (4 off, 10 def), AST: 5, TO: 7
TEAM FOULS: 4

================================================================================

================================================================================
                               FULL GAME COMPLETE                               
================================================================================

FINAL SCORE: Team_096 97, Team_067 111

SCORING BY QUARTER:
--------------------------------------------------------------------------------
Team                     Q1     Q2     Q3     Q4    FINAL
--------------------------------------------------------------------------------
Team_096                 15     27     34     21       97
Team_067                 35     22     37     17      111
--------------------------------------------------------------------------------

FULL GAME BOX SCORE:
================================================================================

Team_096
--------------------------------------------------------------------------------
Player                MIN  PTS  REB  AST  TO      FG   FG%      3P   3P%      FT STL BLK
--------------------------------------------------------------------------------
Lamelo Quickley        32   11    0    2   2   5/11   45.5   1/3    33.3   4/7     1   0
Scottie Herro          32   19    8    3   0   7/10   70.0   0/0     0.0   6/6     0   0
Terry Mobley           32   12    0    4   1   5/10   50.0   1/4    25.0   2/2     0   0
Cole Griffin           31    7    4    4   4   2/10   20.0   1/4    25.0   3/3     0   0
Kyrie Adebayo          31    7    6    1   6   4/6    66.7   1/1   100.0   2/2     1   2
Cole Holiday           18   12    3    1   1   5/7    71.4   1/3    33.3   3/3     1   0
Devin Griffin          18    5    3    2   1   2/5    40.0   0/1     0.0   1/1     2   1
Cade Jokic             16    5    0    0   4   3/5    60.0   1/3    33.3   0/0     0   0
Jarrett Markkanen      16    6    1    0   0   2/5    40.0   2/4    50.0   0/1     1   0
Tyler Haliburton       16    7    4    2   1   3/3   100.0   0/0     0.0   1/1     1   0

TEAM: FG: 38/72 (52.8%), 3PT: 8/23 (34.8%), REB: 28 (3 off, 25 def), AST: 19, TO: 20


Team_067
--------------------------------------------------------------------------------
Player                MIN  PTS  REB  AST  TO      FG   FG%      3P   3P%      FT STL BLK
--------------------------------------------------------------------------------
Desmond Simmons        31   21    6    2   0   9/11   81.8   3/5    60.0   0/0     2   0
Wendell Antetokounmpo   25   23    4    4   1   8/14   57.1   4/6    66.7  11/12    0   0
Ben Ball               25   12    0    3   1   6/7    85.7   1/1   100.0   1/2     0   1
Malcolm Westbrook      25   11    8    1   1   5/8    62.5   0/1     0.0   3/3     3   0
Manu Reaves            25    7    1    4   2   2/2   100.0   1/1   100.0   2/2     1   0
James Rozier           24   11    0    1   2   5/7    71.4   0/1     0.0   1/1     0   2
Anfernee Wagner        24    1    3    1   1   1/6    16.7   0/1     0.0   1/2     0   0
Kristaps Davis         24   15    5    3   1   6/11   54.5   3/5    60.0   2/2     2   0
Zach DeRozan           24    7    9    5   5   3/3   100.0   0/0     0.0   1/1     0   0
Kyle Leonard           18    2    3    0   3   1/3    33.3   0/2     0.0   0/0     0   0

TEAM: FG: 48/74 (64.9%), 3PT: 12/23 (52.2%), REB: 40 (7 off, 33 def), AST: 24, TO: 17

================================================================================
