================================================================================
                        FULL GAME - Team_035 vs Team_049                        
================================================================================

================================================================================
                       1ST QUARTER - Team_035 vs Team_049                       
================================================================================

[12:00] Team_035 possession (Score: 0-0)
Dwyane Johnson attempts a Midrange. Contested by De'Aaron Allen (2.8 feet, MAN). Dwyane Johnson misses. Offensive rebound by Magic Westbrook! Magic Westbrook kicks it out.

[11:46] Team_035 possession (Score: 0-0)
Shaquille Ginobili drives and kicks out. Shaquille Ginobili attempts a Midrange. Contested by Ja Oladipo (4.5 feet, MAN). Shaquille Ginobili misses. Rebound secured by De'Aaron Allen.

[11:34] Team_049 possession (Score: 0-0)
Shai Bird attempts a 3Pt. Contested by Domantas Green (4.5 feet, MAN). SHAI BIRD MAKES IT! Assist: Jimmy Griffin
Score: 0-3

[11:20] Team_035 possession (Score: 0-3)
FOUL! Shooting foul on Ja Oladipo. Magic Westbrook to the line for 2 free throws. [Team fouls: 1] (Ja Oladipo: 1 personal fouls)   FT 1/2: GOOD   FT 2/2: MISS Magic Westbrook makes 1/2 from the line. Offensive rebound by Magic Westbrook! Magic Westbrook kicks it out.
Score: 1-3

[11:06] Team_035 possession (Score: 1-3)
FOUL! Shooting foul on Ja Oladipo. Gary Johnson to the line for 2 free throws. [Team fouls: 2] (Ja Oladipo: 2 personal fouls)   FT 1/2: GOOD   FT 2/2: GOOD Gary Johnson makes 2/2 from the line.
Score: 3-3

[10:51] Team_049 possession (Score: 3-3)
De'Aaron Allen drives, Dwyane Johnson stays with him. De'Aaron Allen attempts a Dunk. Contested by Dwyane Johnson (3.0 feet, ZONE). DE'AARON ALLEN MAKES IT! Assist: Shai Mobley
Score: 3-5

[10:36] Team_035 possession (Score: 3-5)
Dwyane Johnson drives, De'Aaron Allen stays with him. Dwyane Johnson attempts a Layup. Contested by De'Aaron Allen (5.1 feet, MAN). DWYANE JOHNSON MAKES IT!
Score: 5-5

[10:24] Team_049 possession (Score: 5-5)
Shai Mobley attempts a Midrange. Contested by Magic Westbrook (6.0 feet, MAN). SHAI MOBLEY MAKES IT! Assist: De'Aaron Allen
Score: 5-7

[10:10] Team_035 possession (Score: 5-7)
Shaquille Ginobili drives and kicks out. Shaquille Ginobili attempts a 3Pt. Contested by Ja Oladipo (2.8 feet, MAN). Shaquille Ginobili misses. Offensive rebound by Magic Westbrook! Magic Westbrook kicks it out.

[10:01] Team_035 possession (Score: 5-7)
Dwyane Johnson drives, De'Aaron Allen stays with him. Dwyane Johnson attempts a Layup. Contested by De'Aaron Allen (3.8 feet, ZONE). Dwyane Johnson misses. Offensive rebound by Magic Westbrook! Magic Westbrook kicks it out.

[09:50] Team_035 possession (Score: 5-7)
Domantas Green attempts a 3Pt. Contested by Shai Bird (3.2 feet, MAN). Domantas Green misses. Rebound secured by De'Aaron Allen.

[09:38] Team_049 possession (Score: 5-7)
De'Aaron Allen attempts a Midrange. Heavily contested by Dwyane Johnson (1.8 feet, ZONE)! DE'AARON ALLEN MAKES IT!
Score: 5-9

[09:28] Team_035 possession (Score: 5-9)
Domantas Green makes the Dunk and draws the foul on Shai Bird! And-1! Domantas Green to the line for 1. [Team fouls: 3] (Shai Bird: 1 personal fouls)   FT 1/1: MISS Domantas Green makes 0/1 from the line. Rebound secured by Shai Mobley.
Score: 7-9

[09:13] Team_049 possession (Score: 7-9)
Shai Bird attempts a 3Pt. Heavily contested by Gary Johnson (1.7 feet, ZONE)! SHAI BIRD MAKES IT!
Score: 7-12

[09:02] Team_035 possession (Score: 7-12)
Shaquille Ginobili attempts a Layup. BLOCKED BY JA OLADIPO! Ball is loose! Rebound secured by Shai Mobley.

[08:48] Team_049 possession (Score: 7-12)
Ja Oladipo attempts a Midrange. Contested by Shaquille Ginobili (2.6 feet, MAN). JA OLADIPO MAKES IT!
Score: 7-14

[08:29] Team_035 possession (Score: 7-14)
Gary Johnson attempts a 3Pt. Contested by Jimmy Griffin (5.9 feet, MAN). Gary Johnson misses. Rebound secured by De'Aaron Allen.

[08:10] Team_049 possession (Score: 7-14)
Shai Bird attempts a Midrange. Heavily contested by Domantas Green (1.2 feet, MAN)! Shai Bird misses. Offensive rebound by Shai Mobley! Shai Mobley's putback is no good. Rebound secured by Gary Johnson.

[07:53] Team_035 possession (Score: 7-14)
Gary Johnson attempts a 3Pt. Contested by Ja Oladipo (4.6 feet, ZONE). GARY JOHNSON MAKES IT! Assist: Domantas Green
Score: 10-14

[07:43] Team_049 possession (Score: 10-14)
Shai Bird attempts a 3Pt. Contested by Domantas Green (4.7 feet, MAN). Shai Bird misses. Offensive rebound by Shai Mobley! Shai Mobley puts it back in!
Score: 10-16

[07:34] Team_035 possession (Score: 10-16)
Magic Westbrook attempts a Midrange. Contested by De'Aaron Allen (4.1 feet, ZONE). Magic Westbrook misses. Rebound secured by Jimmy Griffin.

[07:23] Team_049 possession (Score: 10-16)
FOUL! Holding foul on Magic Westbrook. [Team fouls: 1] No free throws, side out. (Magic Westbrook: 1 personal fouls)

[07:08] Team_049 possession (Score: 10-16)
Ja Oladipo attempts a 3Pt. Contested by Shaquille Ginobili (3.0 feet, ZONE). Ja Oladipo misses. Offensive rebound by Shai Mobley! Shai Mobley puts it back in!
Score: 10-18

[06:54] Team_035 possession (Score: 10-18)
Shaquille Ginobili attempts a Midrange. Contested by Ja Oladipo (2.3 feet, MAN). SHAQUILLE GINOBILI MAKES IT!
Score: 12-18

[06:38] Team_049 possession (Score: 12-18)
Shai Bird attempts a 3Pt. Wide open! Shaquille Ginobili is 7.3 feet away. [ZONE] SHAI BIRD MAKES IT! Assist: Shai Mobley
Score: 12-21

[06:23] Team_035 possession (Score: 12-21)
Magic Westbrook attempts a Midrange. Contested by Shai Bird (3.6 feet, ZONE). MAGIC WESTBROOK MAKES IT!
Score: 14-21

[06:08] Team_049 possession (Score: 14-21)
Shai Mobley attempts a Layup. Contested by Magic Westbrook (4.3 feet, MAN). SHAI MOBLEY MAKES IT! Assist: Shai Bird
Score: 14-23

[05:56] Team_035 possession (Score: 14-23)
Magic Westbrook drives and kicks out. Shaquille Ginobili attempts a Midrange. Wide open! Ja Oladipo is 6.6 feet away. [MAN] Shaquille Ginobili misses. Rebound secured by De'Aaron Allen.

[05:42] Team_049 possession (Score: 14-23)
Jimmy Griffin attempts a 3Pt. Contested by Shaquille Ginobili (4.4 feet, ZONE). Jimmy Griffin misses. Rebound secured by Dwyane Johnson.

[05:24] Team_035 possession (Score: 14-23)
Domantas Green attempts a 3Pt. Wide open! Shai Bird is 7.5 feet away. [MAN] DOMANTAS GREEN MAKES IT!
Score: 17-23

[05:12] Team_049 possession (Score: 17-23)
Shai Mobley drives and kicks out. Jimmy Griffin attempts a 3Pt. Heavily contested by Gary Johnson (0.8 feet, MAN)! Jimmy Griffin misses. Rebound secured by Gary Johnson.

[04:58] Team_035 possession (Score: 17-23)
Dwyane Johnson attempts a 3Pt. Contested by De'Aaron Allen (3.7 feet, MAN). Dwyane Johnson misses. Rebound secured by Shai Mobley.

[04:42] Team_049 possession (Score: 17-23)
Jimmy Griffin attempts a 3Pt. Wide open! Gary Johnson is 7.0 feet away. [MAN] Jimmy Griffin misses. Rebound secured by Gary Johnson.

[04:29] Team_035 possession (Score: 17-23)
Gary Johnson attempts a 3Pt. Contested by Jimmy Griffin (5.3 feet, MAN). Gary Johnson misses. Rebound secured by Shai Mobley.

[04:13] Team_049 possession (Score: 17-23)
Jimmy Griffin attempts a 3Pt. Contested by Shaquille Ginobili (4.1 feet, ZONE). Jimmy Griffin misses. Offensive rebound by De'Aaron Allen! De'Aaron Allen kicks it out.

[03:57] Team_049 possession (Score: 17-23)
FOUL! Shooting foul on Domantas Green. Shai Mobley to the line for 2 free throws. [Team fouls: 2] (Domantas Green: 1 personal fouls)   FT 1/2: GOOD   FT 2/2: GOOD Shai Mobley makes 2/2 from the line.
Score: 17-25

[03:42] Team_035 possession (Score: 17-25)
Domantas Green attempts a 3Pt. Heavily contested by Shai Bird (1.0 feet, ZONE)! Domantas Green misses. Rebound secured by De'Aaron Allen.

[03:29] Team_049 possession (Score: 17-25)
Ja Oladipo attempts a 3Pt. Heavily contested by Shaquille Ginobili (1.9 feet, MAN)! Ja Oladipo misses. Rebound secured by Dwyane Johnson.

[03:11] Team_035 possession (Score: 17-25)
Gary Johnson attempts a Midrange. Contested by Jimmy Griffin (4.9 feet, MAN). Gary Johnson misses. Rebound secured by Jimmy Griffin.

[02:57] Team_049 possession (Score: 17-25)
Shai Mobley attempts a Layup. Contested by Dwyane Johnson (2.4 feet, ZONE). Shai Mobley misses. Rebound secured by Gary Johnson.

[02:46] Team_035 possession (Score: 17-25)
Domantas Green attempts a 3Pt. Contested by Shai Bird (4.5 feet, MAN). Domantas Green misses. Offensive rebound by Dwyane Johnson! Dwyane Johnson's putback is no good. Offensive rebound by Magic Westbrook! Magic Westbrook kicks it out.

[02:29] Team_035 possession (Score: 17-25)
Domantas Green attempts a 3Pt. Contested by Shai Bird (4.1 feet, MAN). Domantas Green misses. Rebound secured by De'Aaron Allen.

[02:11] Team_049 possession (Score: 17-25)
Ja Oladipo attempts a Layup. BLOCKED BY SHAQUILLE GINOBILI! Ball is loose! Offensive rebound by Shai Mobley! Shai Mobley kicks it out.

[02:00] Team_049 possession (Score: 17-25)
Ja Oladipo commits a violation (traveling/carry)! TURNOVER! (dead ball)

[02:00] Substitution (Team_035): Domantas Green OUT → CJ LaVine IN (stamina_rule2)

[02:00] Substitution (Team_035): Shaquille Ginobili OUT → Cole George IN (stamina_rule2)

[02:00] Substitution (Team_035): Gary Johnson OUT → Malcolm Turner IN (stamina_rule2)

[02:00] Substitution (Team_035): Dwyane Johnson OUT → Tobias Jordan IN (stamina_rule2)

[02:00] Substitution (Team_035): Magic Westbrook OUT → John Durant IN (stamina_rule2)

[02:00] Substitution (Team_049): Shai Bird OUT → Shaquille Lillard IN (stamina_rule2)

[02:00] Substitution (Team_049): Ja Oladipo OUT → Shai Jordan IN (stamina_rule2)

[02:00] Substitution (Team_049): Jimmy Griffin OUT → Desmond Towns IN (stamina_rule2)

[02:00] Substitution (Team_049): De'Aaron Allen OUT → Giannis Anunoby IN (stamina_rule2)

[02:00] Substitution (Team_049): Shai Mobley OUT → Miles Jackson IN (stamina_rule2)

[01:50] Team_035 possession (Score: 17-25)
CJ LaVine attempts a Midrange. Contested by Desmond Towns (3.0 feet, ZONE). CJ LaVine misses. Rebound secured by Shai Jordan.

[01:35] Team_049 possession (Score: 17-25)
Shai Jordan drives, John Durant stays with him. Shai Jordan attempts a Layup. Contested by John Durant (4.1 feet, ZONE). SHAI JORDAN MAKES IT! Assist: Shaquille Lillard
Score: 17-27

[01:23] Team_035 possession (Score: 17-27)
Cole George drives and kicks out. Cole George attempts a Midrange. Contested by Shai Jordan (5.0 feet, MAN). Cole George misses. Offensive rebound by John Durant! John Durant kicks it out.

[01:09] Team_035 possession (Score: 17-27)
Cole George attempts a 3Pt. Wide open! Shai Jordan is 7.3 feet away. [MAN] COLE GEORGE MAKES IT! Assist: Malcolm Turner
Score: 20-27

[00:58] Team_049 possession (Score: 20-27)
Miles Jackson attempts a 3Pt. Contested by CJ LaVine (3.3 feet, ZONE). Miles Jackson misses. Rebound secured by Cole George.

[00:44] Team_035 possession (Score: 20-27)
FOUL! Shooting foul on Miles Jackson. Malcolm Turner to the line for 2 free throws. [Team fouls: 4] (Miles Jackson: 1 personal fouls)   FT 1/2: GOOD   FT 2/2: GOOD Malcolm Turner makes 2/2 from the line.
Score: 22-27

[00:29] Team_049 possession (Score: 22-27)
Shai Jordan attempts a 3Pt. Contested by Cole George (5.0 feet, MAN). Shai Jordan misses. Offensive rebound by Giannis Anunoby! Giannis Anunoby kicks it out.

[00:12] Team_049 possession (Score: 22-27)
Giannis Anunoby attempts a Midrange. Contested by Tobias Jordan (5.4 feet, MAN). Giannis Anunoby misses. Rebound secured by Cole George.

================================================================================
                              1ST QUARTER COMPLETE                              
================================================================================

1ST QUARTER SCORE: Team_035 22, Team_049 27

BOX SCORE:
================================================================================

Team_035
--------------------------------------------------------------------------------
Player                MIN  PTS  REB  AST  TO      FG   FG%      3P   3P%
--------------------------------------------------------------------------------
Gary Johnson           10    5    4    0   0   2/5    40.0     0/0   0.0
Domantas Green         10    3    0    1   0   1/5    20.0     0/0   0.0
Cole George             2    3    2    0   0   1/1   100.0     0/0   0.0
Magic Westbrook        10    2    5    0   0   1/3    33.3     0/0   0.0
Shaquille Ginobili     10    2    0    0   0   1/3    33.3     0/0   0.0
Dwyane Johnson         10    2    2    0   0   1/2    50.0     0/0   0.0
Malcolm Turner          2    2    0    1   0   1/1   100.0     0/0   0.0
CJ LaVine               2    0    0    0   0   0/1     0.0     0/0   0.0
John Durant             2    0    1    0   0   0/0     0.0     0/0   0.0

TEAM: FG: 8/21 (38.1%), 3PT: 3/9 (33.3%), REB: 13 (6 off, 7 def), AST: 2, TO: 0
TEAM FOULS: 2


Team_049
--------------------------------------------------------------------------------
Player                MIN  PTS  REB  AST  TO      FG   FG%      3P   3P%
--------------------------------------------------------------------------------
Shai Mobley            10   10    7    2   0   5/7    71.4     0/0   0.0
Shai Bird              10    9    0    1   0   3/4    75.0     0/0   0.0
De'Aaron Allen         10    4    7    1   0   2/2   100.0     0/0   0.0
Ja Oladipo             10    2    0    0   0   1/2    50.0     0/0   0.0
Shai Jordan             2    2    1    0   0   1/1   100.0     0/0   0.0
Jimmy Griffin          10    0    2    1   0   0/2     0.0     0/0   0.0
Shaquille Lillard       2    0    0    1   0   0/0     0.0     0/0   0.0
Miles Jackson           2    0    0    0   0   0/1     0.0     0/0   0.0
Giannis Anunoby         2    0    1    0   0   0/1     0.0     0/0   0.0

TEAM: FG: 12/20 (60.0%), 3PT: 5/9 (55.6%), REB: 19 (6 off, 13 def), AST: 6, TO: 1
TEAM FOULS: 4

================================================================================

================================================================================
                       2ND QUARTER - Team_035 vs Team_049                       
================================================================================

[12:00] Team_035 possession (Score: 22-27)
Dwyane Johnson attempts a Midrange. Wide open! De'Aaron Allen is 6.3 feet away. [MAN] Dwyane Johnson misses. Rebound secured by De'Aaron Allen.

[11:45] Team_049 possession (Score: 22-27)
FOUL! Holding foul on Dwyane Johnson. [Team fouls: 1] No free throws, side out. (Dwyane Johnson: 1 personal fouls)

[11:29] Team_049 possession (Score: 22-27)
Jimmy Griffin drives and kicks out. Shai Bird attempts a Midrange. Heavily contested by Magic Westbrook (1.9 feet, ZONE)! SHAI BIRD MAKES IT!
Score: 22-29

[11:18] Team_035 possession (Score: 22-29)
Domantas Green attempts a Layup. Heavily contested by De'Aaron Allen (1.9 feet, ZONE)! Domantas Green misses. Rebound secured by De'Aaron Allen.

[11:03] Team_049 possession (Score: 22-29)
De'Aaron Allen commits a violation (traveling/carry)! TURNOVER! (dead ball)

[10:49] Team_035 possession (Score: 22-29)
Dwyane Johnson attempts a Midrange. Wide open! De'Aaron Allen is 7.3 feet away. [MAN] Dwyane Johnson misses. Offensive rebound by Magic Westbrook! Magic Westbrook kicks it out.

[10:33] Team_035 possession (Score: 22-29)
Domantas Green attempts a 3Pt. Contested by Shai Bird (5.6 feet, MAN). DOMANTAS GREEN MAKES IT!
Score: 25-29

[10:20] Team_049 possession (Score: 25-29)
Shai Mobley attempts a Midrange. Contested by Magic Westbrook (5.3 feet, MAN). SHAI MOBLEY MAKES IT! Assist: Ja Oladipo
Score: 25-31

[10:08] Team_035 possession (Score: 25-31)
Shaquille Ginobili drives to the basket... FOUL! Offensive foul on Shaquille Ginobili! Ja Oladipo drew the charge! [Team fouls: 2] (Shaquille Ginobili: 1 personal fouls) TURNOVER! (dead ball)

[09:54] Team_049 possession (Score: 25-31)
De'Aaron Allen drives and kicks out. Shai Bird attempts a 3Pt. Contested by Domantas Green (5.5 feet, MAN). SHAI BIRD MAKES IT! Assist: Ja Oladipo
Score: 25-34

[09:39] Team_035 possession (Score: 25-34)
Shaquille Ginobili attempts a 3Pt. Wide open! Ja Oladipo is 6.4 feet away. [ZONE] Shaquille Ginobili misses. FOUL! Loose ball foul on Shai Mobley during the rebound battle. [Team fouls: 1] No free throws, side out. (Shai Mobley: 1 personal fouls)

[09:25] Team_035 possession (Score: 25-34)
Shaquille Ginobili attempts a Layup. Contested by Ja Oladipo (2.7 feet, MAN). Shaquille Ginobili misses. Rebound secured by De'Aaron Allen.

[09:13] Team_049 possession (Score: 25-34)
Ja Oladipo attempts a 3Pt. Contested by Shaquille Ginobili (3.6 feet, MAN). Ja Oladipo misses. Rebound secured by Gary Johnson.

[09:02] Team_035 possession (Score: 25-34)
Magic Westbrook drives to the basket... Magic Westbrook throws a bad pass! Stolen by Shai Mobley! TURNOVER! (live ball)

[08:48] Team_049 possession (Score: 25-34)
Jimmy Griffin attempts a 3Pt. Contested by Gary Johnson (5.8 feet, ZONE). JIMMY GRIFFIN MAKES IT!
Score: 25-37

[08:30] Team_035 possession (Score: 25-37)
Domantas Green attempts a 3Pt. Wide open! Shai Bird is 7.7 feet away. [MAN] DOMANTAS GREEN MAKES IT! Assist: Gary Johnson
Score: 28-37

[08:18] Team_049 possession (Score: 28-37)
Jimmy Griffin drives and kicks out. De'Aaron Allen attempts a Midrange. Contested by Gary Johnson (4.8 feet, ZONE). De'Aaron Allen misses. Offensive rebound by Shai Mobley! Shai Mobley puts it back in!
Score: 28-39

[08:01] Team_035 possession (Score: 28-39)
Dwyane Johnson attempts a 3Pt. Contested by Ja Oladipo (3.5 feet, ZONE). Dwyane Johnson misses. Rebound secured by Shai Mobley.

[07:47] Team_049 possession (Score: 28-39)
Shai Bird attempts a Midrange. Contested by Shaquille Ginobili (4.8 feet, ZONE). Shai Bird misses. Rebound secured by Magic Westbrook.

[07:35] Team_035 possession (Score: 28-39)
Magic Westbrook attempts a Layup. BLOCKED BY DE'AARON ALLEN! Ball is loose! Rebound secured by De'Aaron Allen.

[07:24] Team_049 possession (Score: 28-39)
Shai Mobley throws a bad pass out of bounds! TURNOVER! (dead ball)

[07:24] Substitution (Team_035): Domantas Green OUT → CJ LaVine IN (stamina_rule2)

[07:24] Substitution (Team_035): Shaquille Ginobili OUT → Cole George IN (stamina_rule2)

[07:24] Substitution (Team_035): Gary Johnson OUT → Malcolm Turner IN (stamina_rule2)

[07:24] Substitution (Team_035): Dwyane Johnson OUT → Tobias Jordan IN (stamina_rule2)

[07:24] Substitution (Team_035): Magic Westbrook OUT → John Durant IN (stamina_rule2)

[07:24] Substitution (Team_049): Shai Bird OUT → Shaquille Lillard IN (stamina_rule2)

[07:24] Substitution (Team_049): Ja Oladipo OUT → Shai Jordan IN (stamina_rule2)

[07:24] Substitution (Team_049): Jimmy Griffin OUT → Desmond Towns IN (stamina_rule2)

[07:24] Substitution (Team_049): De'Aaron Allen OUT → Giannis Anunoby IN (stamina_rule2)

[07:24] Substitution (Team_049): Shai Mobley OUT → Miles Jackson IN (stamina_rule2)

[07:12] Team_035 possession (Score: 28-39)
John Durant attempts a 3Pt. Contested by Shaquille Lillard (3.8 feet, ZONE). John Durant misses. Rebound secured by Shai Jordan.

[06:56] Team_049 possession (Score: 28-39)
Giannis Anunoby attempts a 3Pt. Wide open! Malcolm Turner is 6.5 feet away. [ZONE] GIANNIS ANUNOBY MAKES IT!
Score: 28-42

[06:42] Team_035 possession (Score: 28-42)
Malcolm Turner makes the Layup and draws the foul on Shai Jordan! And-1! Malcolm Turner to the line for 1. [Team fouls: 2] (Shai Jordan: 1 personal fouls)   FT 1/1: GOOD Malcolm Turner makes 1/1 from the line.
Score: 31-42

[06:27] Team_049 possession (Score: 31-42)
Shaquille Lillard attempts a 3Pt. Heavily contested by CJ LaVine (1.7 feet, MAN)! Shaquille Lillard misses. Offensive rebound by Giannis Anunoby! Giannis Anunoby kicks it out.

[06:08] Team_049 possession (Score: 31-42)
Miles Jackson attempts a Layup. Contested by John Durant (5.7 feet, ZONE). MILES JACKSON MAKES IT! Assist: Shai Jordan
Score: 31-44

[05:58] Team_035 possession (Score: 31-44)
Cole George attempts a Midrange. Contested by Shai Jordan (3.3 feet, ZONE). COLE GEORGE MAKES IT!
Score: 33-44

[05:48] Team_049 possession (Score: 33-44)
FOUL! Holding foul on CJ LaVine. [Team fouls: 3] No free throws, side out. (CJ LaVine: 1 personal fouls)

[05:32] Team_049 possession (Score: 33-44)
Shaquille Lillard attempts a 3Pt. Heavily contested by CJ LaVine (0.5 feet, MAN)! Shaquille Lillard misses. Offensive rebound by Giannis Anunoby! Giannis Anunoby kicks it out.

[05:17] Team_049 possession (Score: 33-44)
FOUL! Shooting foul on John Durant. Miles Jackson to the line for 2 free throws. [Team fouls: 4] (John Durant: 1 personal fouls)   FT 1/2: GOOD   FT 2/2: MISS Miles Jackson makes 1/2 from the line. Rebound secured by Tobias Jordan.
Score: 33-45

[05:03] Team_035 possession (Score: 33-45)
Malcolm Turner drives to the basket... Malcolm Turner throws a bad pass! Stolen by Desmond Towns! TURNOVER! (live ball)

[04:53] Team_049 possession (Score: 33-45)
FOUL! Holding foul on Malcolm Turner. [IN THE BONUS! 5 team fouls] Desmond Towns to the line for 2 free throws. (Malcolm Turner: 1 personal fouls)   FT 1/2: GOOD   FT 2/2: GOOD Desmond Towns makes 2/2 from the line.
Score: 33-47

[04:42] Team_035 possession (Score: 33-47)
Malcolm Turner attempts a 3Pt. Contested by Shaquille Lillard (4.4 feet, ZONE). Malcolm Turner misses. Rebound secured by Shai Jordan.

[04:27] Team_049 possession (Score: 33-47)
Giannis Anunoby attempts a 3Pt. Contested by Tobias Jordan (5.6 feet, MAN). GIANNIS ANUNOBY MAKES IT! Assist: Miles Jackson
Score: 33-50

[04:13] Team_035 possession (Score: 33-50)
John Durant drives to the basket... John Durant loses control! Ball rolls out of bounds! TURNOVER! (dead ball)

[04:00] Team_049 possession (Score: 33-50)
Shaquille Lillard attempts a Midrange. Wide open! CJ LaVine is 7.4 feet away. [ZONE] Shaquille Lillard misses. Rebound secured by Cole George.

[03:51] Team_035 possession (Score: 33-50)
Tobias Jordan throws a bad pass out of bounds! TURNOVER! (dead ball)

[03:35] Team_049 possession (Score: 33-50)
Miles Jackson throws a bad pass! Stolen by John Durant! TURNOVER! (live ball)

[03:17] Team_035 possession (Score: 33-50)
John Durant attempts a Layup. Contested by Miles Jackson (3.7 feet, MAN). John Durant misses. Rebound secured by Shai Jordan.

[03:04] Team_049 possession (Score: 33-50)
Desmond Towns attempts a Midrange. Contested by Malcolm Turner (5.5 feet, MAN). Desmond Towns misses. Rebound secured by John Durant.

[02:50] Team_035 possession (Score: 33-50)
Malcolm Turner attempts a 3Pt. Wide open! Shaquille Lillard is 6.4 feet away. [ZONE] Malcolm Turner misses. Offensive rebound by John Durant! John Durant kicks it out.

[02:41] Team_035 possession (Score: 33-50)
Malcolm Turner attempts a 3Pt. Heavily contested by Giannis Anunoby (1.6 feet, ZONE)! Malcolm Turner misses. Rebound secured by Miles Jackson.

[02:25] Team_049 possession (Score: 33-50)
Shaquille Lillard attempts a 3Pt. Wide open! CJ LaVine is 8.0 feet away. [MAN] SHAQUILLE LILLARD MAKES IT! Assist: Giannis Anunoby
Score: 33-53

[02:09] Team_035 possession (Score: 33-53)
Tobias Jordan attempts a Midrange. Wide open! Giannis Anunoby is 6.7 feet away. [MAN] TOBIAS JORDAN MAKES IT!
Score: 35-53

[01:51] Team_049 possession (Score: 35-53)
Miles Jackson attempts a Layup. BLOCKED BY JOHN DURANT! Ball is loose! Rebound secured by John Durant.

[01:31] Team_035 possession (Score: 35-53)
FOUL! Holding foul on Shaquille Lillard. [Team fouls: 3] No free throws, side out. (Shaquille Lillard: 1 personal fouls)

[01:12] Team_035 possession (Score: 35-53)
Cole George attempts a 3Pt. Wide open! Shaquille Lillard is 9.4 feet away. [ZONE] Cole George misses. Rebound secured by Giannis Anunoby.

[00:59] Team_049 possession (Score: 35-53)
Giannis Anunoby drives, Tobias Jordan stays with him. Giannis Anunoby attempts a Dunk. Contested by Tobias Jordan (3.7 feet, MAN). Giannis Anunoby misses. Rebound secured by John Durant.

[00:39] Team_035 possession (Score: 35-53)
CJ LaVine attempts a Midrange. Wide open! Giannis Anunoby is 6.7 feet away. [ZONE] CJ LaVine misses. Offensive rebound by Tobias Jordan! Tobias Jordan kicks it out.

[00:26] Team_035 possession (Score: 35-53)
Malcolm Turner drives, Desmond Towns stays with him. Malcolm Turner attempts a Layup. Wide open! Desmond Towns is 8.4 feet away. [MAN] Malcolm Turner misses. Offensive rebound by Tobias Jordan! Tobias Jordan kicks it out.

[00:12] Team_035 possession (Score: 35-53)
Cole George drives and kicks out. Malcolm Turner attempts a Midrange. Wide open! Desmond Towns is 6.6 feet away. [ZONE] MALCOLM TURNER MAKES IT! Assist: CJ LaVine
Score: 37-53

================================================================================
                              2ND QUARTER COMPLETE                              
================================================================================

2ND QUARTER SCORE: Team_035 15, Team_049 26

BOX SCORE:
================================================================================

Team_035
--------------------------------------------------------------------------------
Player                MIN  PTS  REB  AST  TO      FG   FG%      3P   3P%
--------------------------------------------------------------------------------
Domantas Green         15    6    0    0   0   2/3    66.7     0/0   0.0
Malcolm Turner          9    5    0    0   0   2/4    50.0     0/0   0.0
Cole George             9    2    1    0   0   1/2    50.0     0/0   0.0
Tobias Jordan           9    2    3    0   0   1/1   100.0     0/0   0.0
Dwyane Johnson         15    0    0    0   0   0/2     0.0     0/0   0.0
Magic Westbrook        15    0    3    0   0   0/1     0.0     0/0   0.0
Shaquille Ginobili     15    0    0    0   0   0/1     0.0     0/0   0.0
Gary Johnson           15    0    1    1   0   0/0     0.0     0/0   0.0
John Durant             9    0    4    0   0   0/2     0.0     0/0   0.0
CJ LaVine               9    0    0    1   0   0/0     0.0     0/0   0.0

TEAM: FG: 6/16 (37.5%), 3PT: 2/7 (28.6%), REB: 12 (5 off, 7 def), AST: 2, TO: 5
TEAM FOULS: 5 [Team_049 in BONUS]


Team_049
--------------------------------------------------------------------------------
Player                MIN  PTS  REB  AST  TO      FG   FG%      3P   3P%
--------------------------------------------------------------------------------
Giannis Anunoby         9    6    3    1   0   2/3    66.7     0/0   0.0
Shai Bird              15    5    0    0   0   2/3    66.7     0/0   0.0
Shai Mobley            15    4    2    0   0   2/2   100.0     0/0   0.0
Jimmy Griffin          15    3    0    0   0   1/1   100.0     0/0   0.0
Shaquille Lillard       9    3    0    0   0   1/2    50.0     0/0   0.0
Miles Jackson           9    2    1    1   0   1/3    33.3     0/0   0.0
Desmond Towns           9    2    0    0   0   1/2    50.0     0/0   0.0
De'Aaron Allen         15    0    4    0   0   0/0     0.0     0/0   0.0
Ja Oladipo             15    0    0    2   0   0/1     0.0     0/0   0.0
Shai Jordan             9    0    3    1   0   0/0     0.0     0/0   0.0

TEAM: FG: 10/17 (58.8%), 3PT: 4/5 (80.0%), REB: 13 (3 off, 10 def), AST: 5, TO: 3
TEAM FOULS: 3

================================================================================

================================================================================
                       3RD QUARTER - Team_035 vs Team_049                       
================================================================================

[12:00] Team_035 possession (Score: 37-53)
Dwyane Johnson attempts a 3Pt. Contested by Ja Oladipo (4.5 feet, ZONE). DWYANE JOHNSON MAKES IT! Assist: Shaquille Ginobili
Score: 40-53

[11:46] Team_049 possession (Score: 40-53)
Shai Mobley attempts a Midrange. Contested by Gary Johnson (3.3 feet, ZONE). Shai Mobley misses. Rebound secured by Dwyane Johnson.

[11:32] Team_035 possession (Score: 40-53)
FOUL! Shooting foul on De'Aaron Allen. Gary Johnson to the line for 2 free throws. [Team fouls: 1] (De'Aaron Allen: 1 personal fouls)   FT 1/2: GOOD   FT 2/2: GOOD Gary Johnson makes 2/2 from the line.
Score: 42-53

[11:14] Team_049 possession (Score: 42-53)
Jimmy Griffin attempts a 3Pt. Contested by Domantas Green (3.3 feet, ZONE). JIMMY GRIFFIN MAKES IT!
Score: 42-56

[11:04] Team_035 possession (Score: 42-56)
Gary Johnson attempts a Layup. Wide open! De'Aaron Allen is 8.5 feet away. [ZONE] GARY JOHNSON MAKES IT!
Score: 44-56

[10:54] Team_049 possession (Score: 44-56)
De'Aaron Allen attempts a 3Pt. Contested by Gary Johnson (2.2 feet, ZONE). De'Aaron Allen misses. Rebound secured by Dwyane Johnson.

[10:40] Team_035 possession (Score: 44-56)
Gary Johnson attempts a Layup. Contested by Jimmy Griffin (5.8 feet, MAN). GARY JOHNSON MAKES IT!
Score: 46-56

[10:23] Team_049 possession (Score: 46-56)
Jimmy Griffin attempts a Layup. Contested by Gary Johnson (2.6 feet, MAN). Jimmy Griffin misses. Rebound secured by Gary Johnson.

[10:08] Team_035 possession (Score: 46-56)
Gary Johnson attempts a 3Pt. Wide open! Jimmy Griffin is 7.3 feet away. [MAN] Gary Johnson misses. Rebound secured by Shai Mobley.

[09:51] Team_049 possession (Score: 46-56)
Shai Mobley throws a bad pass! Stolen by Magic Westbrook! TURNOVER! (live ball)

[09:33] Team_035 possession (Score: 46-56)
Domantas Green attempts a 3Pt. Contested by Ja Oladipo (3.8 feet, ZONE). DOMANTAS GREEN MAKES IT! Assist: Gary Johnson
Score: 49-56

[09:14] Team_049 possession (Score: 49-56)
Jimmy Griffin throws a bad pass! Stolen by Gary Johnson! TURNOVER! (live ball)

[09:01] Team_035 possession (Score: 49-56)
Magic Westbrook attempts a Layup. Contested by De'Aaron Allen (4.2 feet, ZONE). Magic Westbrook misses. Rebound secured by Shai Mobley.

[08:44] Team_049 possession (Score: 49-56)
FOUL! Shooting foul on Gary Johnson. Jimmy Griffin to the line for 3 free throws. [Team fouls: 1] (Gary Johnson: 1 personal fouls)   FT 1/3: GOOD   FT 2/3: GOOD   FT 3/3: GOOD Jimmy Griffin makes 3/3 from the line.
Score: 49-59

[08:33] Team_035 possession (Score: 49-59)
Domantas Green attempts a 3Pt. Wide open! Shai Bird is 6.6 feet away. [MAN] DOMANTAS GREEN MAKES IT! Assist: Shaquille Ginobili
Score: 52-59

[08:16] Team_049 possession (Score: 52-59)
Ja Oladipo attempts a 3Pt. Heavily contested by Shaquille Ginobili (1.4 feet, ZONE)! Ja Oladipo misses. Rebound secured by Dwyane Johnson.

[08:00] Team_035 possession (Score: 52-59)
FOUL! Holding foul on De'Aaron Allen. [Team fouls: 2] No free throws, side out. (De'Aaron Allen: 2 personal fouls)

[07:51] Team_035 possession (Score: 52-59)
Magic Westbrook throws a bad pass! Stolen by Shai Mobley! TURNOVER! (live ball)

[07:38] Team_049 possession (Score: 52-59)
Jimmy Griffin drives, picks up Gary Johnson. Help arrives from Domantas Green! Jimmy Griffin attempts a Dunk. Contested by Domantas Green (3.5 feet, MAN). JIMMY GRIFFIN MAKES IT! Assist: Shai Bird
Score: 52-61

[07:27] Team_035 possession (Score: 52-61)
Magic Westbrook attempts a Midrange. Wide open! De'Aaron Allen is 6.9 feet away. [ZONE] Magic Westbrook misses. Rebound secured by Jimmy Griffin.

[07:17] Team_049 possession (Score: 52-61)
Shai Mobley attempts a Layup. Contested by Magic Westbrook (4.7 feet, MAN). SHAI MOBLEY MAKES IT! Assist: Jimmy Griffin
Score: 52-63

[07:01] Team_035 possession (Score: 52-63)
Shaquille Ginobili loses the ball! Stripped by Ja Oladipo! TURNOVER! (live ball)

[06:44] Team_049 possession (Score: 52-63)
Shai Mobley drives, picks up Magic Westbrook. Help arrives from Domantas Green! Shai Mobley attempts a Dunk. Contested by Domantas Green (3.1 feet, MAN). SHAI MOBLEY MAKES IT! Assist: Jimmy Griffin
Score: 52-65

[06:26] Team_035 possession (Score: 52-65)
Magic Westbrook attempts a 3Pt. Contested by Ja Oladipo (3.6 feet, ZONE). Magic Westbrook misses. Rebound secured by Shai Mobley.

[06:08] Team_049 possession (Score: 52-65)
Shai Bird attempts a 3Pt. Wide open! Gary Johnson is 6.6 feet away. [ZONE] SHAI BIRD MAKES IT! Assist: Jimmy Griffin
Score: 52-68

[05:54] Team_035 possession (Score: 52-68)
Dwyane Johnson loses the ball! Stripped by De'Aaron Allen! TURNOVER! (live ball)

[05:39] Team_049 possession (Score: 52-68)
Jimmy Griffin attempts a Layup. Heavily contested by Gary Johnson (1.9 feet, MAN)! Jimmy Griffin misses. Offensive rebound by Shai Mobley! Shai Mobley puts it back in!
Score: 52-70

[05:29] Team_035 possession (Score: 52-70)
Domantas Green attempts a 3Pt. Contested by Shai Bird (3.1 feet, MAN). Domantas Green misses. Offensive rebound by Dwyane Johnson! Dwyane Johnson puts it back in!
Score: 54-70

[05:18] Team_049 possession (Score: 54-70)
Shai Mobley drives and kicks out. Shai Mobley attempts a 3Pt. Heavily contested by Shaquille Ginobili (1.1 feet, ZONE)! Shai Mobley misses. Offensive rebound by Shai Mobley! Shai Mobley's putback is no good. Rebound secured by Gary Johnson.

[05:04] Team_035 possession (Score: 54-70)
Shaquille Ginobili drives, picks up De'Aaron Allen. Help arrives from Ja Oladipo! Shaquille Ginobili attempts a Layup. Contested by Ja Oladipo (3.8 feet, ZONE). SHAQUILLE GINOBILI MAKES IT! Assist: Gary Johnson
Score: 56-70

[04:52] Team_049 possession (Score: 56-70)
Ja Oladipo attempts a 3Pt. Contested by Shaquille Ginobili (5.7 feet, MAN). Ja Oladipo misses. Rebound secured by Gary Johnson.

[04:36] Team_035 possession (Score: 56-70)
Dwyane Johnson attempts a Midrange. Contested by Jimmy Griffin (5.6 feet, ZONE). Dwyane Johnson misses. Rebound secured by Jimmy Griffin.

[04:22] Team_049 possession (Score: 56-70)
Shai Mobley attempts a 3Pt. Contested by Magic Westbrook (4.8 feet, MAN). Shai Mobley misses. Rebound secured by Dwyane Johnson.

[04:06] Team_035 possession (Score: 56-70)
Domantas Green attempts a 3Pt. Contested by Shai Bird (4.4 feet, MAN). Domantas Green misses. Rebound secured by Jimmy Griffin.

[03:55] Team_049 possession (Score: 56-70)
Jimmy Griffin attempts a Midrange. Wide open! Magic Westbrook is 9.1 feet away. [ZONE] Jimmy Griffin misses. Rebound secured by Dwyane Johnson.

[03:44] Team_035 possession (Score: 56-70)
Magic Westbrook drives, Shai Mobley stays with him. Magic Westbrook attempts a Dunk. Heavily contested by Shai Mobley (2.0 feet, MAN)! Magic Westbrook misses. Rebound secured by Shai Mobley.

[03:31] Team_049 possession (Score: 56-70)
Shai Bird throws a bad pass out of bounds! TURNOVER! (dead ball)

[03:14] Team_035 possession (Score: 56-70)
Shaquille Ginobili attempts a Midrange. Wide open! De'Aaron Allen is 7.9 feet away. [ZONE] SHAQUILLE GINOBILI MAKES IT! Assist: Gary Johnson
Score: 58-70

[02:57] Team_049 possession (Score: 58-70)
Shai Mobley attempts a Midrange. Heavily contested by Shaquille Ginobili (1.5 feet, ZONE)! Shai Mobley misses. Rebound secured by Dwyane Johnson.

[02:41] Team_035 possession (Score: 58-70)
Domantas Green attempts a 3Pt. Wide open! Shai Bird is 8.4 feet away. [MAN] Domantas Green misses. Offensive rebound by Magic Westbrook! Magic Westbrook kicks it out.

[02:28] Team_035 possession (Score: 58-70)
FOUL! Shooting foul on De'Aaron Allen. Domantas Green to the line for 2 free throws. [Team fouls: 3] (De'Aaron Allen: 3 personal fouls)   FT 1/2: GOOD   FT 2/2: GOOD Domantas Green makes 2/2 from the line.
Score: 60-70

[02:12] Team_049 possession (Score: 60-70)
Ja Oladipo drives and kicks out. Shai Bird attempts a 3Pt. Contested by Domantas Green (5.3 feet, MAN). Shai Bird misses. Offensive rebound by De'Aaron Allen! De'Aaron Allen kicks it out.

[01:57] Team_049 possession (Score: 60-70)
Jimmy Griffin drives, picks up Dwyane Johnson. Help arrives from Domantas Green! Jimmy Griffin attempts a Layup. Contested by Domantas Green (3.7 feet, ZONE). JIMMY GRIFFIN MAKES IT! Assist: Shai Bird
Score: 60-72

[01:45] Team_035 possession (Score: 60-72)
Domantas Green attempts a Midrange. Wide open! Shai Bird is 6.2 feet away. [MAN] DOMANTAS GREEN MAKES IT!
Score: 62-72

[01:30] Team_049 possession (Score: 62-72)
De'Aaron Allen drives to the basket... FOUL! Offensive foul on De'Aaron Allen! Dwyane Johnson drew the charge! [Team fouls: 4] (De'Aaron Allen: 4 personal fouls) TURNOVER! (dead ball)

[01:16] Team_035 possession (Score: 62-72)
Dwyane Johnson attempts a Midrange. Wide open! Jimmy Griffin is 6.7 feet away. [ZONE] DWYANE JOHNSON MAKES IT!
Score: 64-72

[01:01] Team_049 possession (Score: 64-72)
Shai Bird drives and kicks out. De'Aaron Allen attempts a 3Pt. Contested by Shaquille Ginobili (5.4 feet, ZONE). De'Aaron Allen misses. FOUL! Loose ball foul on Magic Westbrook during the rebound battle. [Team fouls: 2] No free throws, side out. (Magic Westbrook: 1 personal fouls)

[00:46] Team_049 possession (Score: 64-72)
Jimmy Griffin attempts a 3Pt. Wide open! Shaquille Ginobili is 7.5 feet away. [ZONE] Jimmy Griffin misses. FOUL! Loose ball foul on Gary Johnson during the rebound battle. [Team fouls: 3] No free throws, side out. (Gary Johnson: 2 personal fouls)

[00:34] Team_049 possession (Score: 64-72)
Jimmy Griffin attempts a Midrange. Wide open! Gary Johnson is 6.3 feet away. [MAN] Jimmy Griffin misses. Rebound secured by Magic Westbrook.

[00:20] Team_035 possession (Score: 64-72)
Dwyane Johnson drives, De'Aaron Allen stays with him. Dwyane Johnson attempts a Layup. Heavily contested by De'Aaron Allen (1.9 feet, ZONE)! Dwyane Johnson misses. Offensive rebound by Magic Westbrook! Magic Westbrook kicks it out.

[00:01] Team_035 possession (Score: 64-72)
Domantas Green attempts a Midrange. Heavily contested by Shai Bird (1.5 feet, MAN)! Domantas Green misses. Rebound secured by Shai Mobley.

================================================================================
                              3RD QUARTER COMPLETE                              
================================================================================

3RD QUARTER SCORE: Team_035 27, Team_049 19

BOX SCORE:
================================================================================

Team_035
--------------------------------------------------------------------------------
Player                MIN  PTS  REB  AST  TO      FG   FG%      3P   3P%
--------------------------------------------------------------------------------
Domantas Green         27   10    0    0   0   4/6    66.7     0/0   0.0
Dwyane Johnson         27    7    7    0   0   3/4    75.0     0/0   0.0
Gary Johnson           27    6    3    3   0   3/4    75.0     0/0   0.0
Shaquille Ginobili     27    4    0    2   0   2/2   100.0     0/0   0.0
Magic Westbrook        27    0    3    0   0   0/4     0.0     0/0   0.0

TEAM: FG: 12/20 (60.0%), 3PT: 4/7 (57.1%), REB: 12 (3 off, 9 def), AST: 5, TO: 3
TEAM FOULS: 3


Team_049
--------------------------------------------------------------------------------
Player                MIN  PTS  REB  AST  TO      FG   FG%      3P   3P%
--------------------------------------------------------------------------------
Jimmy Griffin          27   10    3    3   0   4/7    57.1     0/0   0.0
Shai Mobley            27    6    8    0   0   3/7    42.9     0/0   0.0
Shai Bird              27    3    0    2   0   1/1   100.0     0/0   0.0
De'Aaron Allen         27    0    1    0   0   0/1     0.0     0/0   0.0
Ja Oladipo             27    0    0    0   0   0/2     0.0     0/0   0.0

TEAM: FG: 8/18 (44.4%), 3PT: 3/7 (42.9%), REB: 13 (5 off, 8 def), AST: 5, TO: 4
TEAM FOULS: 4

================================================================================

================================================================================
                       4TH QUARTER - Team_035 vs Team_049                       
================================================================================

[12:00] Substitution (Team_035): Domantas Green OUT → CJ LaVine IN (stamina_rule2)

[12:00] Substitution (Team_035): Shaquille Ginobili OUT → Cole George IN (stamina_rule2)

[12:00] Substitution (Team_035): Dwyane Johnson OUT → Tobias Jordan IN (stamina_rule2)

[12:00] Substitution (Team_035): Magic Westbrook OUT → John Durant IN (stamina_rule2)

[12:00] Substitution (Team_049): Shai Bird OUT → Shaquille Lillard IN (stamina_rule2)

[12:00] Substitution (Team_049): Ja Oladipo OUT → Shai Jordan IN (stamina_rule2)

[12:00] Substitution (Team_049): Jimmy Griffin OUT → Desmond Towns IN (stamina_rule2)

[12:00] Substitution (Team_049): De'Aaron Allen OUT → Giannis Anunoby IN (stamina_rule2)

[12:00] Substitution (Team_049): Shai Mobley OUT → Miles Jackson IN (stamina_rule2)

[12:00] Team_035 possession (Score: 64-72)
Magic Westbrook drives to the basket... Magic Westbrook loses control! Ball rolls out of bounds! TURNOVER! (dead ball)

[11:49] Team_049 possession (Score: 64-72)
Desmond Towns drives to the basket... Desmond Towns throws a bad pass out of bounds! TURNOVER! (dead ball)

[11:49] Substitution (Team_035): Gary Johnson OUT → Malcolm Turner IN (stamina_rule2)

[11:33] Team_035 possession (Score: 64-72)
John Durant drives and kicks out. Malcolm Turner attempts a 3Pt. Contested by Desmond Towns (5.1 feet, MAN). Malcolm Turner misses. Rebound secured by Shai Jordan.

[11:23] Team_049 possession (Score: 64-72)
Miles Jackson drives, John Durant stays with him. Miles Jackson attempts a Layup. Contested by John Durant (4.4 feet, MAN). MILES JACKSON MAKES IT! Assist: Shaquille Lillard
Score: 64-74

[11:13] Team_035 possession (Score: 64-74)
Cole George attempts a 3Pt. Wide open! Shai Jordan is 8.3 feet away. [MAN] COLE GEORGE MAKES IT! Assist: Malcolm Turner
Score: 67-74

[10:57] Team_049 possession (Score: 67-74)
Shaquille Lillard makes the Layup and draws the foul on John Durant! And-1! Shaquille Lillard to the line for 1. [Team fouls: 1] (John Durant: 1 personal fouls)   FT 1/1: GOOD Shaquille Lillard makes 1/1 from the line.
Score: 67-77

[10:44] Team_035 possession (Score: 67-77)
John Durant drives and kicks out. CJ LaVine attempts a 3Pt. Contested by Shaquille Lillard (2.1 feet, ZONE). CJ LaVine misses. Offensive rebound by Tobias Jordan! Tobias Jordan kicks it out.

[10:29] Team_035 possession (Score: 67-77)
Malcolm Turner drives to the basket... Malcolm Turner throws a bad pass out of bounds! TURNOVER! (dead ball)

[10:16] Team_049 possession (Score: 67-77)
Shaquille Lillard attempts a 3Pt. Contested by CJ LaVine (4.8 feet, ZONE). SHAQUILLE LILLARD MAKES IT!
Score: 67-80

[10:02] Team_035 possession (Score: 67-80)
Tobias Jordan attempts a 3Pt. Wide open! Shaquille Lillard is 6.6 feet away. [ZONE] Tobias Jordan misses. Rebound secured by Giannis Anunoby.

[09:49] Team_049 possession (Score: 67-80)
Miles Jackson drives to the basket... FOUL! Offensive foul on Miles Jackson! John Durant drew the charge! [Team fouls: 1] (Miles Jackson: 1 personal fouls) TURNOVER! (dead ball)

[09:33] Team_035 possession (Score: 67-80)
CJ LaVine loses control! Ball rolls out of bounds! TURNOVER! (dead ball)

[09:19] Team_049 possession (Score: 67-80)
Desmond Towns drives to the basket... Desmond Towns loses the ball! Stripped by John Durant! TURNOVER! (live ball)

[09:05] Team_035 possession (Score: 67-80)
Malcolm Turner attempts a 3Pt. Contested by Desmond Towns (5.1 feet, MAN). Malcolm Turner misses. Rebound secured by Giannis Anunoby.

[08:49] Team_049 possession (Score: 67-80)
Giannis Anunoby attempts a Midrange. Contested by Cole George (5.4 feet, ZONE). Giannis Anunoby misses. Rebound secured by John Durant.

[08:40] Team_035 possession (Score: 67-80)
FOUL! Shooting foul on Miles Jackson. Malcolm Turner to the line for 2 free throws. [Team fouls: 2] (Miles Jackson: 2 personal fouls)   FT 1/2: MISS   FT 2/2: GOOD Malcolm Turner makes 1/2 from the line.
Score: 68-80

[08:25] Team_049 possession (Score: 68-80)
Giannis Anunoby attempts a 3Pt. Contested by CJ LaVine (2.5 feet, ZONE). Giannis Anunoby misses. Offensive rebound by Miles Jackson! Miles Jackson puts it back in!
Score: 68-82

[08:12] Team_035 possession (Score: 68-82)
CJ LaVine drives and kicks out. John Durant attempts a Midrange. Wide open! Miles Jackson is 7.2 feet away. [MAN] John Durant misses. Rebound secured by Shai Jordan.

[07:57] Team_049 possession (Score: 68-82)
Shaquille Lillard attempts a Midrange. Contested by CJ LaVine (2.6 feet, MAN). Shaquille Lillard misses. Offensive rebound by Miles Jackson! Miles Jackson puts it back in!
Score: 68-84

[07:43] Team_035 possession (Score: 68-84)
FOUL! Reach-in foul on Miles Jackson during the drive. [Team fouls: 3] No free throws, side out. (Miles Jackson: 3 personal fouls)

[07:30] Team_035 possession (Score: 68-84)
Malcolm Turner attempts a Layup. Wide open! Desmond Towns is 7.8 feet away. [MAN] MALCOLM TURNER MAKES IT!
Score: 70-84

[07:16] Team_049 possession (Score: 70-84)
Giannis Anunoby drives to the basket... Giannis Anunoby loses the ball! Stripped by Tobias Jordan! TURNOVER! (live ball)

[07:01] Team_035 possession (Score: 70-84)
Tobias Jordan attempts a 3Pt. Contested by Giannis Anunoby (4.9 feet, MAN). Tobias Jordan misses. Rebound secured by Shai Jordan.

[06:51] Team_049 possession (Score: 70-84)
Desmond Towns drives and kicks out. Desmond Towns attempts a Midrange. Wide open! Cole George is 6.1 feet away. [ZONE] Desmond Towns misses. Offensive rebound by Giannis Anunoby! Giannis Anunoby kicks it out.

[06:38] Team_049 possession (Score: 70-84)
Shai Jordan attempts a 3Pt. Contested by CJ LaVine (3.8 feet, ZONE). Shai Jordan misses. Rebound secured by John Durant.

[06:24] Team_035 possession (Score: 70-84)
Malcolm Turner commits a violation (traveling/carry)! TURNOVER! (dead ball)

[06:10] Team_049 possession (Score: 70-84)
Giannis Anunoby drives and kicks out. Giannis Anunoby attempts a 3Pt. Contested by Tobias Jordan (3.4 feet, MAN). Giannis Anunoby misses. Rebound secured by Tobias Jordan.

[05:59] Team_035 possession (Score: 70-84)
John Durant drives to the basket... John Durant loses the ball! Stripped by Miles Jackson! TURNOVER! (live ball)

[05:44] Team_049 possession (Score: 70-84)
Shaquille Lillard attempts a 3Pt. Contested by CJ LaVine (2.5 feet, MAN). Shaquille Lillard misses. Rebound secured by Tobias Jordan.

[05:30] Team_035 possession (Score: 70-84)
Tobias Jordan attempts a Midrange. Contested by Giannis Anunoby (3.9 feet, MAN). TOBIAS JORDAN MAKES IT!
Score: 72-84

[05:15] Team_049 possession (Score: 72-84)
Miles Jackson attempts a Layup. Contested by John Durant (4.5 feet, MAN). Miles Jackson misses. Rebound secured by John Durant.

[05:02] Team_035 possession (Score: 72-84)
CJ LaVine attempts a Midrange. Heavily contested by Shaquille Lillard (1.4 feet, ZONE)! CJ LaVine misses. Rebound secured by Giannis Anunoby.

[04:49] Team_049 possession (Score: 72-84)
Giannis Anunoby drives, John Durant stays with him. Giannis Anunoby attempts a Layup. Contested by John Durant (2.4 feet, ZONE). GIANNIS ANUNOBY MAKES IT! Assist: Shaquille Lillard
Score: 72-86

[04:33] Team_035 possession (Score: 72-86)
Cole George attempts a 3Pt. Contested by Shaquille Lillard (3.0 feet, ZONE). Cole George misses. Rebound secured by Miles Jackson.

[04:19] Team_049 possession (Score: 72-86)
Shaquille Lillard attempts a Layup. Contested by CJ LaVine (4.3 feet, MAN). SHAQUILLE LILLARD MAKES IT! Assist: Giannis Anunoby
Score: 72-88

[04:04] Team_035 possession (Score: 72-88)
Malcolm Turner attempts a 3Pt. Contested by Giannis Anunoby (4.5 feet, ZONE). Malcolm Turner misses. Rebound secured by Shai Jordan.

[03:54] Team_049 possession (Score: 72-88)
Shai Jordan attempts a 3Pt. Wide open! CJ LaVine is 6.1 feet away. [ZONE] SHAI JORDAN MAKES IT! Assist: Shaquille Lillard
Score: 72-91

[03:42] Team_035 possession (Score: 72-91)
Tobias Jordan attempts a 3Pt. Contested by Shaquille Lillard (5.2 feet, ZONE). Tobias Jordan misses. Rebound secured by Miles Jackson.

[03:32] Team_049 possession (Score: 72-91)
Miles Jackson drives, John Durant stays with him. Miles Jackson attempts a Layup. Contested by John Durant (5.3 feet, ZONE). MILES JACKSON MAKES IT!
Score: 72-93

[03:18] Team_035 possession (Score: 72-93)
CJ LaVine throws a bad pass! Stolen by Shaquille Lillard! TURNOVER! (live ball)

[03:03] Team_049 possession (Score: 72-93)
FOUL! Shooting foul on John Durant. Miles Jackson to the line for 2 free throws. [Team fouls: 2] (John Durant: 2 personal fouls)   FT 1/2: GOOD   FT 2/2: GOOD Miles Jackson makes 2/2 from the line.
Score: 72-95

[02:45] Team_035 possession (Score: 72-95)
Malcolm Turner attempts a 3Pt. Wide open! Shaquille Lillard is 7.2 feet away. [ZONE] MALCOLM TURNER MAKES IT! Assist: Cole George
Score: 75-95

[02:30] Team_049 possession (Score: 75-95)
Desmond Towns makes the Layup and draws the foul on Malcolm Turner! And-1! Desmond Towns to the line for 1. [Team fouls: 3] (Malcolm Turner: 1 personal fouls)   FT 1/1: MISS Desmond Towns makes 0/1 from the line. Rebound secured by Cole George.
Score: 75-97

[02:20] Team_035 possession (Score: 75-97)
Tobias Jordan attempts a Midrange. Wide open! Shaquille Lillard is 6.2 feet away. [ZONE] TOBIAS JORDAN MAKES IT!
Score: 77-97

[02:08] Team_049 possession (Score: 77-97)
Miles Jackson attempts a Midrange. Wide open! Cole George is 7.7 feet away. [ZONE] Miles Jackson misses. Rebound secured by Cole George.

[01:53] Team_035 possession (Score: 77-97)
Malcolm Turner attempts a 3Pt. Contested by Desmond Towns (5.7 feet, MAN). Malcolm Turner misses. Rebound secured by Shai Jordan.

[01:41] Team_049 possession (Score: 77-97)
Miles Jackson drives, John Durant stays with him. Miles Jackson attempts a Layup. Contested by John Durant (2.8 feet, MAN). Miles Jackson misses. Offensive rebound by Miles Jackson! Miles Jackson's putback is no good. Offensive rebound by Miles Jackson! Miles Jackson kicks it out.

[01:21] Team_049 possession (Score: 77-97)
Miles Jackson drives, John Durant stays with him. Miles Jackson attempts a Layup. Contested by John Durant (3.0 feet, MAN). MILES JACKSON MAKES IT! Assist: Desmond Towns
Score: 77-99

[01:07] Team_035 possession (Score: 77-99)
John Durant drives, Miles Jackson stays with him. John Durant attempts a Layup. Contested by Miles Jackson (5.0 feet, MAN). JOHN DURANT MAKES IT!
Score: 79-99

[00:51] Team_049 possession (Score: 79-99)
Shaquille Lillard attempts a 3Pt. Wide open! CJ LaVine is 6.9 feet away. [ZONE] Shaquille Lillard misses. Offensive rebound by Miles Jackson! Miles Jackson puts it back in!
Score: 79-101

[00:37] Team_035 possession (Score: 79-101)
Tobias Jordan attempts a 3Pt. Wide open! Desmond Towns is 6.9 feet away. [ZONE] Tobias Jordan misses. Rebound secured by Miles Jackson.

[00:21] Team_049 possession (Score: 79-101)
Miles Jackson drives, John Durant stays with him. Miles Jackson attempts a Layup. Contested by John Durant (5.2 feet, ZONE). Miles Jackson misses. Rebound secured by Tobias Jordan.

[00:06] Team_035 possession (Score: 79-101)
John Durant drives and kicks out. Cole George attempts a 3Pt. Wide open! Shai Jordan is 8.9 feet away. [MAN] Cole George misses. Rebound secured by Giannis Anunoby.

================================================================================
                              4TH QUARTER COMPLETE                              
================================================================================

4TH QUARTER SCORE: Team_035 15, Team_049 29

BOX SCORE:
================================================================================

Team_035
--------------------------------------------------------------------------------
Player                MIN  PTS  REB  AST  TO      FG   FG%      3P   3P%
--------------------------------------------------------------------------------
Malcolm Turner         21    6    0    1   0   3/6    50.0     0/0   0.0
Tobias Jordan          21    4    4    0   0   2/6    33.3     0/0   0.0
Cole George            21    3    2    1   0   1/2    50.0     0/0   0.0
John Durant            21    2    3    0   0   1/3    33.3     0/0   0.0
CJ LaVine              21    0    0    0   0   0/2     0.0     0/0   0.0

TEAM: FG: 7/19 (36.8%), 3PT: 2/10 (20.0%), REB: 9 (1 off, 8 def), AST: 2, TO: 6
TEAM FOULS: 4


Team_049
--------------------------------------------------------------------------------
Player                MIN  PTS  REB  AST  TO      FG   FG%      3P   3P%
--------------------------------------------------------------------------------
Miles Jackson          21   14    7    0   0   7/10   70.0     0/0   0.0
Shaquille Lillard      21    8    0    3   0   3/4    75.0     0/0   0.0
Shai Jordan            21    3    5    0   0   1/2    50.0     0/0   0.0
Giannis Anunoby        21    2    5    1   0   1/3    33.3     0/0   0.0
Desmond Towns          21    0    0    1   0   0/1     0.0     0/0   0.0

TEAM: FG: 12/20 (60.0%), 3PT: 4/6 (66.7%), REB: 17 (5 off, 12 def), AST: 5, TO: 4
TEAM FOULS: 3

================================================================================

================================================================================
                               FULL GAME COMPLETE                               
================================================================================

FINAL SCORE: Team_035 79, Team_049 101

SCORING BY QUARTER:
--------------------------------------------------------------------------------
Team                     Q1     Q2     Q3     Q4    FINAL
--------------------------------------------------------------------------------
Team_035                 22     15     27     15       79
Team_049                 27     26     19     29      101
--------------------------------------------------------------------------------

FULL GAME BOX SCORE:
================================================================================

Team_035
--------------------------------------------------------------------------------
Player                MIN  PTS  REB  AST  TO      FG   FG%      3P   3P%      FT STL BLK
--------------------------------------------------------------------------------
Gary Johnson           28   11    8    4   2   5/9    55.6   1/4    25.0   4/4     1   0
Domantas Green         27   19    0    1   1   8/15   53.3   6/10   60.0   2/3     0   0
Shaquille Ginobili     27    6    0    2   1   3/6    50.0   0/0     0.0   0/0     0   1
Dwyane Johnson         27    9    9    0   1   3/7    42.9   1/3    33.3   0/0     0   0
Magic Westbrook        27    2   11    0   1   1/8    12.5   0/1     0.0   1/2     1   0
CJ LaVine              21    0    0    1   3   0/3     0.0   0/0     0.0   0/0     0   0
Cole George            21    8    5    1   0   4/6    66.7   2/4    50.0   0/0     0   0
Tobias Jordan          21    6    7    0   2   3/7    42.9   0/4     0.0   0/0     1   0
John Durant            21    2    8    0   0   1/5    20.0   0/1     0.0   0/0     2   1
Malcolm Turner         21   13    0    2   3   5/10   50.0   1/6    16.7   4/5     0   0

TEAM: FG: 33/76 (43.4%), 3PT: 11/33 (33.3%), REB: 46 (15 off, 31 def), AST: 11, TO: 14


Team_049
--------------------------------------------------------------------------------
Player                MIN  PTS  REB  AST  TO      FG   FG%      3P   3P%      FT STL BLK
--------------------------------------------------------------------------------
Shai Bird              27   17    0    3   1   5/7    71.4   5/5   100.0   0/0     0   0
Ja Oladipo             27    2    0    2   1   2/6    33.3   1/5    20.0   0/0     1   1
Jimmy Griffin          27   13    5    4   1   8/13   61.5   3/5    60.0   3/3     0   0
De'Aaron Allen         27    4   12    1   1   3/4    75.0   0/1     0.0   0/0     1   1
Shai Mobley            27   20   17    2   3   6/12   50.0   0/1     0.0   2/2     2   0
Shaquille Lillard      21   11    0    4   1   6/8    75.0   3/4    75.0   1/1     1   0
Shai Jordan            21    5    9    1   1   2/3    66.7   1/2    50.0   0/0     0   0
Desmond Towns          21    2    0    1   2   0/2     0.0   0/0     0.0   2/3     1   0
Giannis Anunoby        21    8    9    2   0   4/8    50.0   3/3   100.0   0/0     0   0
Miles Jackson          21   16    8    1   1   5/11   45.5   0/1     0.0   3/4     1   0

TEAM: FG: 42/75 (56.0%), 3PT: 16/27 (59.3%), REB: 62 (19 off, 43 def), AST: 21, TO: 12

================================================================================
