================================================================================
                        FULL GAME - Team_030 vs Team_058                        
================================================================================

================================================================================
                       1ST QUARTER - Team_030 vs Team_058                       
================================================================================

[12:00] Team_030 possession (Score: 0-0)
Joel Anunoby attempts a Midrange. Wide open! Vince Hyland is 6.3 feet away. [MAN] JOEL ANUNOBY MAKES IT! Assist: Tyler Beal
Score: 2-0

[11:44] Team_058 possession (Score: 2-0)
Vince Hyland drives to the basket... Vince Hyland commits a violation (traveling/carry)! TURNOVER! (dead ball)

[11:28] Team_030 possession (Score: 2-0)
Jaren Green attempts a Midrange. Wide open! Stephen Haliburton is 6.5 feet away. [ZONE] Jaren Green misses. Rebound secured by Bradley Sexton.

[11:15] Team_058 possession (Score: 2-0)
Stephen Haliburton attempts a Midrange. Contested by Jordan Nowitzki (2.8 feet, MAN). STEPHEN HALIBURTON MAKES IT!
Score: 2-2

[10:56] Team_030 possession (Score: 2-2)
Jaren Green drives and kicks out. Tyler Beal attempts a Midrange. Heavily contested by Stephen Haliburton (1.6 feet, ZONE)! TYLER BEAL MAKES IT! Assist: Joel Anunoby
Score: 4-2

[10:43] Team_058 possession (Score: 4-2)
Stephen Haliburton attempts a Midrange. Contested by Joel Anunoby (5.4 feet, ZONE). STEPHEN HALIBURTON MAKES IT! Assist: Tyrese Doncic
Score: 4-4

[10:25] Team_030 possession (Score: 4-4)
Tim Barrett attempts a Midrange. BLOCKED BY KYLE WESTBROOK! Ball goes out off Kyle Westbrook. Tim Barrett's ball!

[10:12] Team_030 possession (Score: 4-4)
Joel Anunoby attempts a Layup. Contested by Vince Hyland (2.7 feet, MAN). Joel Anunoby misses. Rebound secured by Stephen Haliburton.

[10:02] Team_058 possession (Score: 4-4)
Vince Hyland attempts a 3Pt. Contested by Joel Anunoby (3.6 feet, MAN). Vince Hyland misses. Rebound secured by Joel Anunoby.

[09:50] Team_030 possession (Score: 4-4)
Joel Anunoby drives, Stephen Haliburton stays with him. Joel Anunoby attempts a Layup. Contested by Stephen Haliburton (4.0 feet, ZONE). JOEL ANUNOBY MAKES IT!
Score: 6-4

[09:31] Team_058 possession (Score: 6-4)
Stephen Haliburton throws a bad pass! Stolen by Jordan Nowitzki! TURNOVER! (live ball)

[09:19] Team_030 possession (Score: 6-4)
Tim Barrett drives, Stephen Haliburton stays with him. Tim Barrett attempts a Dunk. Heavily contested by Stephen Haliburton (1.6 feet, ZONE)! Tim Barrett misses. Rebound secured by Bradley Sexton.

[09:05] Team_058 possession (Score: 6-4)
Vince Hyland drives and kicks out. Stephen Haliburton attempts a 3Pt. Contested by Jordan Nowitzki (3.9 feet, MAN). STEPHEN HALIBURTON MAKES IT! Assist: Vince Hyland
Score: 6-7

[08:51] Team_030 possession (Score: 6-7)
Jaren Green attempts a Layup. Contested by Stephen Haliburton (5.0 feet, ZONE). Jaren Green misses. Offensive rebound by Jordan Nowitzki! Jordan Nowitzki puts it back in!
Score: 8-7

[08:37] Team_058 possession (Score: 8-7)
Stephen Haliburton attempts a Layup. Contested by Jaren Green (3.8 feet, ZONE). STEPHEN HALIBURTON MAKES IT! Assist: Kyle Westbrook
Score: 8-9

[08:24] Team_030 possession (Score: 8-9)
Tim Barrett attempts a 3Pt. Contested by Kyle Westbrook (5.2 feet, MAN). TIM BARRETT MAKES IT! Assist: Tyler Beal
Score: 11-9

[08:09] Team_058 possession (Score: 11-9)
FOUL! Holding foul on Tyler Beal. [Team fouls: 1] No free throws, side out. (Tyler Beal: 1 personal fouls)

[07:56] Team_058 possession (Score: 11-9)
Kyle Westbrook drives, Tim Barrett stays with him. Kyle Westbrook attempts a Layup. Contested by Tim Barrett (3.5 feet, MAN). KYLE WESTBROOK MAKES IT! Assist: Bradley Sexton
Score: 11-11

[07:42] Team_030 possession (Score: 11-11)
Tyler Beal drives, Stephen Haliburton stays with him. Tyler Beal attempts a Layup. Contested by Stephen Haliburton (5.2 feet, ZONE). TYLER BEAL MAKES IT!
Score: 13-11

[07:27] Team_058 possession (Score: 13-11)
Tyrese Doncic attempts a Midrange. Contested by Jordan Nowitzki (3.9 feet, ZONE). Tyrese Doncic misses. Offensive rebound by Tyrese Doncic! Tyrese Doncic kicks it out.

[07:16] Team_058 possession (Score: 13-11)
Kyle Westbrook attempts a 3Pt. Heavily contested by Tyler Beal (0.9 feet, ZONE)! KYLE WESTBROOK MAKES IT! Assist: Bradley Sexton
Score: 13-14

[07:05] Team_030 possession (Score: 13-14)
Tim Barrett drives and kicks out. Tyler Beal attempts a Midrange. Contested by Stephen Haliburton (4.3 feet, ZONE). Tyler Beal misses. Rebound secured by Stephen Haliburton.

[06:52] Team_058 possession (Score: 13-14)
Kyle Westbrook attempts a Midrange. Wide open! Tim Barrett is 7.5 feet away. [MAN] Kyle Westbrook misses. Rebound secured by Jordan Nowitzki.

[06:34] Team_030 possession (Score: 13-14)
Tim Barrett drives, Kyle Westbrook stays with him. Tim Barrett attempts a Layup. Contested by Kyle Westbrook (2.7 feet, MAN). Tim Barrett misses. Rebound secured by Stephen Haliburton.

[06:18] Team_058 possession (Score: 13-14)
Vince Hyland attempts a 3Pt. Contested by Joel Anunoby (3.0 feet, MAN). VINCE HYLAND MAKES IT! Assist: Kyle Westbrook
Score: 13-17

[05:59] Team_030 possession (Score: 13-17)
Tim Barrett attempts a 3Pt. Contested by Kyle Westbrook (2.1 feet, MAN). Tim Barrett misses. Rebound secured by Tyrese Doncic.

[05:45] Team_058 possession (Score: 13-17)
Vince Hyland attempts a 3Pt. Contested by Joel Anunoby (2.6 feet, MAN). Vince Hyland misses. Offensive rebound by Tyrese Doncic! Tyrese Doncic kicks it out.

[05:32] Team_058 possession (Score: 13-17)
Vince Hyland attempts a 3Pt. Contested by Joel Anunoby (4.8 feet, MAN). Vince Hyland misses. Rebound secured by Jaren Green.

[05:16] Team_030 possession (Score: 13-17)
Tyler Beal attempts a Midrange. Contested by Bradley Sexton (4.0 feet, MAN). TYLER BEAL MAKES IT! Assist: Jaren Green
Score: 15-17

[05:00] Team_058 possession (Score: 15-17)
Vince Hyland attempts a 3Pt. Wide open! Tyler Beal is 6.9 feet away. [ZONE] Vince Hyland misses. Rebound secured by Joel Anunoby.

[04:41] Team_030 possession (Score: 15-17)
Jordan Nowitzki loses the ball! Stripped by Stephen Haliburton! TURNOVER! (live ball)

[04:27] Team_058 possession (Score: 15-17)
Kyle Westbrook attempts a 3Pt. Contested by Tim Barrett (4.0 feet, MAN). Kyle Westbrook misses. Rebound secured by Jordan Nowitzki.

[04:12] Team_030 possession (Score: 15-17)
Tyler Beal attempts a 3Pt. Wide open! Bradley Sexton is 7.0 feet away. [MAN] Tyler Beal misses. Rebound secured by Stephen Haliburton.

[03:59] Team_058 possession (Score: 15-17)
Stephen Haliburton attempts a Layup. Contested by Jaren Green (4.4 feet, ZONE). STEPHEN HALIBURTON MAKES IT! Assist: Vince Hyland
Score: 15-19

[03:44] Team_030 possession (Score: 15-19)
Jordan Nowitzki drives, Stephen Haliburton stays with him. Jordan Nowitzki attempts a Dunk. Wide open! Stephen Haliburton is 6.9 feet away. [MAN] JORDAN NOWITZKI MAKES IT! Assist: Tyler Beal
Score: 17-19

[03:32] Team_058 possession (Score: 17-19)
Stephen Haliburton throws a bad pass out of bounds! TURNOVER! (dead ball)

[03:17] Team_030 possession (Score: 17-19)
Joel Anunoby attempts a 3Pt. Heavily contested by Bradley Sexton (1.7 feet, ZONE)! Joel Anunoby misses. Rebound secured by Bradley Sexton.

[03:02] Team_058 possession (Score: 17-19)
Stephen Haliburton drives, Jordan Nowitzki stays with him. Stephen Haliburton attempts a Dunk. Contested by Jordan Nowitzki (3.5 feet, MAN). STEPHEN HALIBURTON MAKES IT! Assist: Tyrese Doncic
Score: 17-21

[02:47] Team_030 possession (Score: 17-21)
FOUL! Shooting foul on Kyle Westbrook. Tim Barrett to the line for 2 free throws. [Team fouls: 1] (Kyle Westbrook: 1 personal fouls)   FT 1/2: GOOD   FT 2/2: GOOD Tim Barrett makes 2/2 from the line.
Score: 19-21

[02:33] Team_058 possession (Score: 19-21)
Vince Hyland attempts a 3Pt. Contested by Tyler Beal (3.8 feet, ZONE). Vince Hyland misses. Offensive rebound by Stephen Haliburton! Stephen Haliburton puts it back in!
Score: 19-23

[02:20] Team_030 possession (Score: 19-23)
Jordan Nowitzki makes the Midrange and draws the foul on Stephen Haliburton! And-1! Jordan Nowitzki to the line for 1. [Team fouls: 2] (Stephen Haliburton: 1 personal fouls)   FT 1/1: MISS Jordan Nowitzki makes 0/1 from the line. Offensive rebound by Joel Anunoby! Joel Anunoby kicks it out.
Score: 21-23

[02:05] Team_030 possession (Score: 21-23)
Tim Barrett makes the Layup and draws the foul on Kyle Westbrook! And-1! Tim Barrett to the line for 1. [Team fouls: 3] (Kyle Westbrook: 2 personal fouls)   FT 1/1: GOOD Tim Barrett makes 1/1 from the line.
Score: 24-23

[01:51] Team_058 possession (Score: 24-23)
FOUL! Holding foul on Joel Anunoby. [Team fouls: 2] No free throws, side out. (Joel Anunoby: 1 personal fouls)

[01:36] Team_058 possession (Score: 24-23)
FOUL! Shooting foul on Tim Barrett. Vince Hyland to the line for 2 free throws. [Team fouls: 3] (Tim Barrett: 1 personal fouls)   FT 1/2: GOOD   FT 2/2: GOOD Vince Hyland makes 2/2 from the line.
Score: 24-25

[01:18] Team_030 possession (Score: 24-25)
Tim Barrett throws a bad pass out of bounds! TURNOVER! (dead ball)

[01:18] Substitution (Team_030): Tyler Beal OUT → RJ Carter IN (stamina_rule2)

[01:18] Substitution (Team_030): Tim Barrett OUT → Josh Smith IN (stamina_rule2)

[01:18] Substitution (Team_030): Joel Anunoby OUT → Pau James IN (stamina_rule2)

[01:18] Substitution (Team_030): Jordan Nowitzki OUT → Damian Green IN (stamina_rule2)

[01:18] Substitution (Team_030): Jaren Green OUT → Franz Anunoby IN (stamina_rule2)

[01:18] Substitution (Team_058): Bradley Sexton OUT → Draymond Williamson IN (stamina_rule2)

[01:18] Substitution (Team_058): Kyle Westbrook OUT → Jordan Ingram IN (stamina_rule2)

[01:18] Substitution (Team_058): Vince Hyland OUT → Pascal Holiday IN (stamina_rule2)

[01:18] Substitution (Team_058): Stephen Haliburton OUT → Shai Lowry IN (stamina_rule2)

[01:18] Substitution (Team_058): Tyrese Doncic OUT → Jarrett Gilgeous-Alexander IN (stamina_rule2)

[01:05] Team_058 possession (Score: 24-25)
Jarrett Gilgeous-Alexander attempts a 3Pt. Wide open! RJ Carter is 9.0 feet away. [ZONE] JARRETT GILGEOUS-ALEXANDER MAKES IT! Assist: Jordan Ingram
Score: 24-28

[00:51] Team_030 possession (Score: 24-28)
Pau James makes the Dunk and draws the foul on Pascal Holiday! And-1! Pau James to the line for 1. [Team fouls: 4] (Pascal Holiday: 1 personal fouls)   FT 1/1: GOOD Pau James makes 1/1 from the line.
Score: 27-28

[00:38] Team_058 possession (Score: 27-28)
Pascal Holiday drives, Pau James stays with him. Pascal Holiday attempts a Dunk. Contested by Pau James (2.2 feet, MAN). PASCAL HOLIDAY MAKES IT!
Score: 27-30

[00:22] Team_030 possession (Score: 27-30)
Damian Green attempts a Midrange. Contested by Shai Lowry (3.6 feet, MAN). Damian Green misses. Rebound secured by Pascal Holiday.

[00:06] Team_058 possession (Score: 27-30)
Pascal Holiday makes the Layup and draws the foul on Pau James! And-1! Pascal Holiday to the line for 1. [Team fouls: 4] (Pau James: 1 personal fouls)   FT 1/1: MISS Pascal Holiday makes 0/1 from the line. Rebound secured by Damian Green.
Score: 27-32

================================================================================
                              1ST QUARTER COMPLETE                              
================================================================================

1ST QUARTER SCORE: Team_030 27, Team_058 32

BOX SCORE:
================================================================================

Team_030
--------------------------------------------------------------------------------
Player                MIN  PTS  REB  AST  TO      FG   FG%      3P   3P%
--------------------------------------------------------------------------------
Tim Barrett            11    8    0    0   0   3/7    42.9     0/0   0.0
Tyler Beal             11    6    0    3   0   3/4    75.0     0/0   0.0
Joel Anunoby           11    4    3    1   0   2/4    50.0     0/0   0.0
Jordan Nowitzki        11    4    3    0   0   2/2   100.0     0/0   0.0
Pau James               1    3    0    0   0   1/1   100.0     0/0   0.0
Jaren Green            11    0    1    1   0   0/1     0.0     0/0   0.0
Damian Green            1    0    1    0   0   0/1     0.0     0/0   0.0

TEAM: FG: 11/20 (55.0%), 3PT: 1/4 (25.0%), REB: 8 (2 off, 6 def), AST: 5, TO: 2
TEAM FOULS: 4


Team_058
--------------------------------------------------------------------------------
Player                MIN  PTS  REB  AST  TO      FG   FG%      3P   3P%
--------------------------------------------------------------------------------
Stephen Haliburton     11   15    5    0   0   7/7   100.0     0/0   0.0
Vince Hyland           11    5    0    2   0   2/5    40.0     0/0   0.0
Kyle Westbrook         11    5    0    2   0   2/4    50.0     0/0   0.0
Jarrett Gilgeous-Alexander    1    3    0    0   0   1/1   100.0     0/0   0.0
Pascal Holiday          1    2    1    0   0   1/2    50.0     0/0   0.0
Bradley Sexton         11    0    3    2   0   0/0     0.0     0/0   0.0
Tyrese Doncic          11    0    3    2   0   0/0     0.0     0/0   0.0
Jordan Ingram           1    0    0    1   0   0/0     0.0     0/0   0.0

TEAM: FG: 13/19 (68.4%), 3PT: 4/8 (50.0%), REB: 12 (3 off, 9 def), AST: 9, TO: 3
TEAM FOULS: 4

================================================================================

================================================================================
                       2ND QUARTER - Team_030 vs Team_058                       
================================================================================

[12:00] Team_030 possession (Score: 27-32)
Jordan Nowitzki attempts a 3Pt. Heavily contested by Stephen Haliburton (1.3 feet, MAN)! JORDAN NOWITZKI MAKES IT! Assist: Joel Anunoby
Score: 30-32

[11:46] Team_058 possession (Score: 30-32)
Kyle Westbrook attempts a Midrange. Contested by Tim Barrett (2.7 feet, MAN). Kyle Westbrook misses. Rebound secured by Jordan Nowitzki.

[11:28] Team_030 possession (Score: 30-32)
Tim Barrett attempts a 3Pt. Contested by Bradley Sexton (4.9 feet, ZONE). TIM BARRETT MAKES IT! Assist: Jaren Green
Score: 33-32

[11:13] Team_058 possession (Score: 33-32)
Stephen Haliburton attempts a Layup. BLOCKED BY JAREN GREEN! Ball is loose! Offensive rebound by Stephen Haliburton! Stephen Haliburton kicks it out.

[11:00] Team_058 possession (Score: 33-32)
Vince Hyland drives to the basket... Vince Hyland loses the ball! Stripped by Joel Anunoby! TURNOVER! (live ball)

[10:46] Team_030 possession (Score: 33-32)
Jordan Nowitzki attempts a 3Pt. Contested by Stephen Haliburton (3.9 feet, MAN). Jordan Nowitzki misses. Rebound secured by Bradley Sexton.

[10:30] Team_058 possession (Score: 33-32)
Vince Hyland drives, Jaren Green stays with him. Vince Hyland attempts a Dunk. Contested by Jaren Green (3.9 feet, ZONE). VINCE HYLAND MAKES IT! Assist: Bradley Sexton
Score: 33-34

[10:14] Team_030 possession (Score: 33-34)
Jordan Nowitzki makes the Layup and draws the foul on Stephen Haliburton! And-1! Jordan Nowitzki to the line for 1. [Team fouls: 1] (Stephen Haliburton: 1 personal fouls)   FT 1/1: MISS Jordan Nowitzki makes 0/1 from the line. Rebound secured by Bradley Sexton.
Score: 35-34

[09:57] Team_058 possession (Score: 35-34)
Kyle Westbrook attempts a 3Pt. Contested by Tim Barrett (2.5 feet, MAN). Kyle Westbrook misses. Rebound secured by Jordan Nowitzki.

[09:42] Team_030 possession (Score: 35-34)
Jordan Nowitzki loses the ball! Stripped by Stephen Haliburton! TURNOVER! (live ball)

[09:26] Team_058 possession (Score: 35-34)
Bradley Sexton attempts a 3Pt. Wide open! Jordan Nowitzki is 6.5 feet away. [ZONE] BRADLEY SEXTON MAKES IT! Assist: Stephen Haliburton
Score: 35-37

[09:11] Team_030 possession (Score: 35-37)
Tim Barrett attempts a Midrange. Contested by Kyle Westbrook (3.3 feet, MAN). Tim Barrett misses. Rebound secured by Tyrese Doncic.

[09:01] Team_058 possession (Score: 35-37)
FOUL! Reach-in foul on Jaren Green during the drive. [Team fouls: 1] No free throws, side out. (Jaren Green: 1 personal fouls)

[08:46] Team_058 possession (Score: 35-37)
Stephen Haliburton drives and kicks out. Stephen Haliburton attempts a 3Pt. Contested by Jordan Nowitzki (4.1 feet, MAN). Stephen Haliburton misses. Offensive rebound by Tyrese Doncic! Tyrese Doncic kicks it out.

[08:36] Team_058 possession (Score: 35-37)
Kyle Westbrook attempts a Midrange. Contested by Tim Barrett (5.0 feet, MAN). KYLE WESTBROOK MAKES IT! Assist: Tyrese Doncic
Score: 35-39

[08:23] Team_030 possession (Score: 35-39)
Jordan Nowitzki drives, Stephen Haliburton stays with him. Jordan Nowitzki attempts a Dunk. Contested by Stephen Haliburton (2.1 feet, ZONE). Jordan Nowitzki misses. Rebound secured by Stephen Haliburton.

[08:05] Team_058 possession (Score: 35-39)
Vince Hyland attempts a Midrange. Contested by Joel Anunoby (2.6 feet, MAN). Vince Hyland misses. FOUL! Loose ball foul on Jordan Nowitzki during the rebound battle. [Team fouls: 2] No free throws, side out. (Jordan Nowitzki: 1 personal fouls)

[07:51] Team_058 possession (Score: 35-39)
Vince Hyland attempts a Midrange. Wide open! Joel Anunoby is 8.4 feet away. [MAN] VINCE HYLAND MAKES IT!
Score: 35-41

[07:34] Team_030 possession (Score: 35-41)
Jaren Green attempts a Layup. BLOCKED BY TYRESE DONCIC! Ball is loose! Rebound secured by Bradley Sexton.

[07:18] Team_058 possession (Score: 35-41)
Bradley Sexton attempts a Layup. Contested by Tyler Beal (3.0 feet, MAN). BRADLEY SEXTON MAKES IT!
Score: 35-43

[07:01] Team_030 possession (Score: 35-43)
Jordan Nowitzki throws a bad pass! Stolen by Stephen Haliburton! TURNOVER! (live ball)

[06:45] Team_058 possession (Score: 35-43)
Tyrese Doncic attempts a 3Pt. Contested by Jaren Green (5.1 feet, MAN). TYRESE DONCIC MAKES IT!
Score: 35-46

[06:29] Team_030 possession (Score: 35-46)
Jaren Green attempts a Layup. BLOCKED BY TYRESE DONCIC! Ball is loose! Rebound secured by Stephen Haliburton.

[06:18] Team_058 possession (Score: 35-46)
Kyle Westbrook drives to the basket... Kyle Westbrook commits a violation (traveling/carry)! TURNOVER! (dead ball)

[06:18] Substitution (Team_030): Tyler Beal OUT → RJ Carter IN (stamina_rule2)

[06:18] Substitution (Team_030): Tim Barrett OUT → Josh Smith IN (stamina_rule2)

[06:18] Substitution (Team_030): Joel Anunoby OUT → Pau James IN (stamina_rule2)

[06:18] Substitution (Team_030): Jordan Nowitzki OUT → Damian Green IN (stamina_rule2)

[06:18] Substitution (Team_030): Jaren Green OUT → Franz Anunoby IN (stamina_rule2)

[06:18] Substitution (Team_058): Bradley Sexton OUT → Draymond Williamson IN (stamina_rule2)

[06:18] Substitution (Team_058): Kyle Westbrook OUT → Jordan Ingram IN (stamina_rule2)

[06:18] Substitution (Team_058): Vince Hyland OUT → Pascal Holiday IN (stamina_rule2)

[06:18] Substitution (Team_058): Stephen Haliburton OUT → Shai Lowry IN (stamina_rule2)

[06:18] Substitution (Team_058): Tyrese Doncic OUT → Jarrett Gilgeous-Alexander IN (stamina_rule2)

[06:01] Team_030 possession (Score: 35-46)
Damian Green drives to the basket... FOUL! Offensive foul on Damian Green! Shai Lowry drew the charge! [Team fouls: 3] (Damian Green: 1 personal fouls) TURNOVER! (dead ball)

[05:47] Team_058 possession (Score: 35-46)
Jordan Ingram attempts a 3Pt. Contested by RJ Carter (4.1 feet, ZONE). Jordan Ingram misses. Rebound secured by Franz Anunoby.

[05:33] Team_030 possession (Score: 35-46)
Pau James attempts a Midrange. Contested by Jordan Ingram (5.8 feet, ZONE). PAU JAMES MAKES IT! Assist: RJ Carter
Score: 37-46

[05:24] Team_058 possession (Score: 37-46)
Pascal Holiday attempts a 3Pt. Contested by RJ Carter (4.4 feet, ZONE). Pascal Holiday misses. Rebound secured by Damian Green.

[05:14] Team_030 possession (Score: 37-46)
Josh Smith attempts a Midrange. Contested by Jordan Ingram (2.8 feet, MAN). Josh Smith misses. Rebound secured by Shai Lowry.

[05:01] Team_058 possession (Score: 37-46)
Jarrett Gilgeous-Alexander drives to the basket... Jarrett Gilgeous-Alexander loses the ball! Stripped by Damian Green! TURNOVER! (live ball)

[04:47] Team_030 possession (Score: 37-46)
RJ Carter loses the ball! Stripped by Draymond Williamson! TURNOVER! (live ball)

[04:29] Team_058 possession (Score: 37-46)
FOUL! Shooting foul on Damian Green. Jordan Ingram to the line for 2 free throws. [Team fouls: 4] (Damian Green: 2 personal fouls)   FT 1/2: GOOD   FT 2/2: GOOD Jordan Ingram makes 2/2 from the line.
Score: 37-48

[04:12] Team_030 possession (Score: 37-48)
Franz Anunoby attempts a 3Pt. Wide open! Jarrett Gilgeous-Alexander is 6.0 feet away. [MAN] Franz Anunoby misses. FOUL! Loose ball foul on Shai Lowry during the rebound battle. [Team fouls: 2] No free throws, side out. (Shai Lowry: 1 personal fouls)

[03:53] Team_030 possession (Score: 37-48)
FOUL! Reach-in foul on Shai Lowry during the drive. [Team fouls: 3] No free throws, side out. (Shai Lowry: 2 personal fouls)

[03:40] Team_030 possession (Score: 37-48)
RJ Carter attempts a 3Pt. Wide open! Draymond Williamson is 8.6 feet away. [ZONE] RJ Carter misses. Rebound secured by Shai Lowry.

[03:24] Team_058 possession (Score: 37-48)
Jarrett Gilgeous-Alexander attempts a Midrange. Contested by Franz Anunoby (5.3 feet, MAN). Jarrett Gilgeous-Alexander misses. Rebound secured by Franz Anunoby.

[03:13] Team_030 possession (Score: 37-48)
Damian Green makes the Dunk and draws the foul on Shai Lowry! And-1! Damian Green to the line for 1. [Team fouls: 4] (Shai Lowry: 3 personal fouls)   FT 1/1: GOOD Damian Green makes 1/1 from the line.
Score: 40-48

[02:56] Team_058 possession (Score: 40-48)
Jarrett Gilgeous-Alexander attempts a Layup. Contested by Damian Green (3.4 feet, ZONE). Jarrett Gilgeous-Alexander misses. Rebound secured by Pau James.

[02:43] Team_030 possession (Score: 40-48)
Pau James attempts a Midrange. Wide open! Pascal Holiday is 9.6 feet away. [MAN] PAU JAMES MAKES IT!
Score: 42-48

[02:26] Team_058 possession (Score: 42-48)
Jordan Ingram attempts a Midrange. Wide open! Josh Smith is 6.2 feet away. [ZONE] Jordan Ingram misses. Rebound secured by Damian Green.

[02:11] Team_030 possession (Score: 42-48)
Pau James attempts a 3Pt. Heavily contested by Pascal Holiday (0.9 feet, MAN)! Pau James misses. Rebound secured by Pascal Holiday.

[01:55] Team_058 possession (Score: 42-48)
FOUL! Holding foul on Pau James. [IN THE BONUS! 5 team fouls] Pascal Holiday to the line for 2 free throws. (Pau James: 1 personal fouls)   FT 1/2: GOOD   FT 2/2: MISS Pascal Holiday makes 1/2 from the line. Rebound secured by Franz Anunoby.
Score: 42-49

[01:39] Team_030 possession (Score: 42-49)
RJ Carter drives to the basket... FOUL! Offensive foul on RJ Carter! Draymond Williamson drew the charge! [Team fouls: 6] (RJ Carter: 1 personal fouls) TURNOVER! (dead ball)

[01:22] Team_058 possession (Score: 42-49)
Jordan Ingram attempts a 3Pt. Contested by Josh Smith (5.2 feet, MAN). Jordan Ingram misses. FOUL! Loose ball foul on Pau James during the rebound battle. [IN THE BONUS! 7 team fouls] Shai Lowry to the line for 2 free throws. (Pau James: 2 personal fouls)   FT 1/2: GOOD   FT 2/2: GOOD Shai Lowry makes 2/2 from the line.
Score: 42-51

[01:11] Team_030 possession (Score: 42-51)
Damian Green attempts a Midrange. Heavily contested by Shai Lowry (1.6 feet, MAN)! Damian Green misses. Rebound secured by Pascal Holiday.

[00:58] Team_058 possession (Score: 42-51)
Jarrett Gilgeous-Alexander attempts a 3Pt. Wide open! Franz Anunoby is 6.1 feet away. [MAN] Jarrett Gilgeous-Alexander misses. Rebound secured by Franz Anunoby.

[00:44] Team_030 possession (Score: 42-51)
Franz Anunoby makes the Layup and draws the foul on Jarrett Gilgeous-Alexander! And-1! Franz Anunoby to the line for 1. [BONUS: 5 team fouls] (Jarrett Gilgeous-Alexander: 1 personal fouls)   FT 1/1: MISS Franz Anunoby makes 0/1 from the line. Rebound secured by Shai Lowry.
Score: 44-51

[00:28] Team_058 possession (Score: 44-51)
Pascal Holiday drives and kicks out. Draymond Williamson attempts a 3Pt. Contested by RJ Carter (5.8 feet, MAN). DRAYMOND WILLIAMSON MAKES IT! Assist: Shai Lowry
Score: 44-54

[00:14] Team_030 possession (Score: 44-54)
RJ Carter attempts a Midrange. Contested by Draymond Williamson (2.6 feet, MAN). RJ CARTER MAKES IT! Assist: Damian Green
Score: 46-54

[00:01] Team_058 possession (Score: 46-54)
Jarrett Gilgeous-Alexander attempts a Midrange. Contested by Josh Smith (4.3 feet, ZONE). JARRETT GILGEOUS-ALEXANDER MAKES IT! Assist: Draymond Williamson
Score: 46-56

================================================================================
                              2ND QUARTER COMPLETE                              
================================================================================

2ND QUARTER SCORE: Team_030 19, Team_058 24

BOX SCORE:
================================================================================

Team_030
--------------------------------------------------------------------------------
Player                MIN  PTS  REB  AST  TO      FG   FG%      3P   3P%
--------------------------------------------------------------------------------
Pau James               7    4    2    0   0   2/3    66.7     0/0   0.0
Jordan Nowitzki        17    3    2    0   0   1/4    25.0     0/0   0.0
Tim Barrett            17    3    0    0   0   1/2    50.0     0/0   0.0
Damian Green            7    3    2    1   0   1/2    50.0     0/0   0.0
RJ Carter               7    2    0    1   0   1/2    50.0     0/0   0.0
Joel Anunoby           17    0    0    1   0   0/0     0.0     0/0   0.0
Jaren Green            17    0    0    1   0   0/2     0.0     0/0   0.0
Franz Anunoby           7    0    4    0   0   0/1     0.0     0/0   0.0
Josh Smith              7    0    0    0   0   0/1     0.0     0/0   0.0

TEAM: FG: 6/17 (35.3%), 3PT: 2/5 (40.0%), REB: 10 (1 off, 9 def), AST: 4, TO: 5
TEAM FOULS: 7 [Team_058 in BONUS]


Team_058
--------------------------------------------------------------------------------
Player                MIN  PTS  REB  AST  TO      FG   FG%      3P   3P%
--------------------------------------------------------------------------------
Bradley Sexton         17    5    3    1   0   2/2   100.0     0/0   0.0
Vince Hyland           17    4    0    0   0   2/2   100.0     0/0   0.0
Tyrese Doncic          17    3    2    1   0   1/1   100.0     0/0   0.0
Draymond Williamson     7    3    0    1   0   1/1   100.0     0/0   0.0
Kyle Westbrook         17    2    0    0   0   1/3    33.3     0/0   0.0
Jordan Ingram           7    2    0    0   0   1/3    33.3     0/0   0.0
Shai Lowry              7    2    3    1   0   1/1   100.0     0/0   0.0
Jarrett Gilgeous-Alexander    7    2    0    0   0   1/4    25.0     0/0   0.0
Stephen Haliburton     17    0    4    1   0   0/0     0.0     0/0   0.0
Pascal Holiday          7    0    2    0   0   0/1     0.0     0/0   0.0

TEAM: FG: 10/19 (52.6%), 3PT: 3/7 (42.9%), REB: 14 (3 off, 11 def), AST: 5, TO: 3
TEAM FOULS: 5 [Team_030 in BONUS]

================================================================================

================================================================================
                       3RD QUARTER - Team_030 vs Team_058                       
================================================================================

[12:00] Team_030 possession (Score: 46-56)
Joel Anunoby drives and kicks out. Tyler Beal attempts a 3Pt. Contested by Bradley Sexton (4.2 feet, MAN). TYLER BEAL MAKES IT! Assist: Jaren Green
Score: 49-56

[11:41] Team_058 possession (Score: 49-56)
FOUL! Reach-in foul on Jaren Green during the drive. [Team fouls: 1] No free throws, side out. (Jaren Green: 1 personal fouls)

[11:28] Team_058 possession (Score: 49-56)
Tyrese Doncic attempts a 3Pt. Contested by Jaren Green (4.2 feet, MAN). TYRESE DONCIC MAKES IT! Assist: Bradley Sexton
Score: 49-59

[11:12] Team_030 possession (Score: 49-59)
Jordan Nowitzki attempts a Layup. Contested by Stephen Haliburton (4.8 feet, MAN). JORDAN NOWITZKI MAKES IT! Assist: Jaren Green
Score: 51-59

[11:01] Team_058 possession (Score: 51-59)
Tyrese Doncic makes the Midrange and draws the foul on Jaren Green! And-1! Tyrese Doncic to the line for 1. [Team fouls: 2] (Jaren Green: 2 personal fouls)   FT 1/1: GOOD Tyrese Doncic makes 1/1 from the line.
Score: 51-62

[10:51] Team_030 possession (Score: 51-62)
Jordan Nowitzki attempts a Midrange. Wide open! Vince Hyland is 6.1 feet away. [ZONE] Jordan Nowitzki misses. Rebound secured by Bradley Sexton.

[10:39] Team_058 possession (Score: 51-62)
Bradley Sexton attempts a 3Pt. Contested by Tyler Beal (5.4 feet, MAN). Bradley Sexton misses. Rebound secured by Jaren Green.

[10:23] Team_030 possession (Score: 51-62)
Jaren Green drives, Tyrese Doncic stays with him. Jaren Green attempts a Dunk. Contested by Tyrese Doncic (5.3 feet, MAN). JAREN GREEN MAKES IT! Assist: Tim Barrett
Score: 53-62

[10:09] Team_058 possession (Score: 53-62)
Stephen Haliburton attempts a Layup. BLOCKED BY JORDAN NOWITZKI! Ball is loose! Rebound secured by Jaren Green.

[09:52] Team_030 possession (Score: 53-62)
Tyler Beal attempts a Midrange. Wide open! Stephen Haliburton is 6.2 feet away. [ZONE] Tyler Beal misses. Rebound secured by Tyrese Doncic.

[09:39] Team_058 possession (Score: 53-62)
Stephen Haliburton attempts a Layup. Contested by Jordan Nowitzki (3.3 feet, MAN). STEPHEN HALIBURTON MAKES IT! Assist: Tyrese Doncic
Score: 53-64

[09:22] Team_030 possession (Score: 53-64)
Tyler Beal drives, Stephen Haliburton stays with him. Tyler Beal attempts a Dunk. Contested by Stephen Haliburton (2.2 feet, ZONE). TYLER BEAL MAKES IT! Assist: Joel Anunoby
Score: 55-64

[09:08] Team_058 possession (Score: 55-64)
Bradley Sexton attempts a 3Pt. Wide open! Tyler Beal is 6.2 feet away. [ZONE] BRADLEY SEXTON MAKES IT! Assist: Kyle Westbrook
Score: 55-67

[08:57] Team_030 possession (Score: 55-67)
Tyler Beal drives, Stephen Haliburton stays with him. Tyler Beal attempts a Layup. Contested by Stephen Haliburton (3.1 feet, ZONE). TYLER BEAL MAKES IT! Assist: Jaren Green
Score: 57-67

[08:43] Team_058 possession (Score: 57-67)
Vince Hyland drives and kicks out. Bradley Sexton attempts a 3Pt. Contested by Tyler Beal (5.3 feet, MAN). Bradley Sexton misses. Rebound secured by Jaren Green.

[08:29] Team_030 possession (Score: 57-67)
Joel Anunoby drives, picks up Tyrese Doncic. Help arrives from Bradley Sexton! Joel Anunoby attempts a Layup. Contested by Bradley Sexton (4.4 feet, ZONE). Joel Anunoby misses. Rebound secured by Stephen Haliburton.

[08:17] Team_058 possession (Score: 57-67)
Vince Hyland attempts a 3Pt. Heavily contested by Joel Anunoby (1.5 feet, ZONE)! Vince Hyland misses. Rebound secured by Jaren Green.

[08:02] Team_030 possession (Score: 57-67)
FOUL! Holding foul on Vince Hyland. [Team fouls: 1] No free throws, side out. (Vince Hyland: 1 personal fouls)

[07:49] Team_030 possession (Score: 57-67)
Jaren Green attempts a Midrange. Wide open! Tyrese Doncic is 6.3 feet away. [MAN] Jaren Green misses. Offensive rebound by Jordan Nowitzki! Jordan Nowitzki's putback is no good. Rebound secured by Tyrese Doncic.

[07:35] Team_058 possession (Score: 57-67)
FOUL! Offensive foul on Stephen Haliburton! Jordan Nowitzki drew the charge! [Team fouls: 2] (Stephen Haliburton: 1 personal fouls) TURNOVER! (dead ball)

[07:23] Team_030 possession (Score: 57-67)
Joel Anunoby attempts a Layup. Heavily contested by Vince Hyland (1.4 feet, MAN)! JOEL ANUNOBY MAKES IT! Assist: Tim Barrett
Score: 59-67

[07:09] Team_058 possession (Score: 59-67)
Bradley Sexton drives and kicks out. Vince Hyland attempts a 3Pt. Contested by Tyler Beal (4.9 feet, ZONE). Vince Hyland misses. Rebound secured by Jaren Green.

[06:52] Team_030 possession (Score: 59-67)
Jaren Green attempts a 3Pt. Contested by Bradley Sexton (5.0 feet, ZONE). JAREN GREEN MAKES IT! Assist: Joel Anunoby
Score: 62-67

[06:36] Team_058 possession (Score: 62-67)
FOUL! Holding foul on Jordan Nowitzki. [Team fouls: 3] No free throws, side out. (Jordan Nowitzki: 1 personal fouls)

[06:17] Team_058 possession (Score: 62-67)
Tyrese Doncic attempts a Midrange. Contested by Jaren Green (4.0 feet, MAN). TYRESE DONCIC MAKES IT!
Score: 62-69

[06:05] Team_030 possession (Score: 62-69)
FOUL! Shooting foul on Bradley Sexton. Tim Barrett to the line for 3 free throws. [Team fouls: 3] (Bradley Sexton: 1 personal fouls)   FT 1/3: GOOD   FT 2/3: GOOD   FT 3/3: GOOD Tim Barrett makes 3/3 from the line.
Score: 65-69

[05:54] Team_058 possession (Score: 65-69)
Vince Hyland makes the Dunk and draws the foul on Tyler Beal! And-1! Vince Hyland to the line for 1. [Team fouls: 4] (Tyler Beal: 1 personal fouls)   FT 1/1: MISS Vince Hyland makes 0/1 from the line. Rebound secured by Jaren Green.
Score: 65-71

[05:40] Team_030 possession (Score: 65-71)
Joel Anunoby attempts a 3Pt. Contested by Bradley Sexton (2.5 feet, ZONE). Joel Anunoby misses. Rebound secured by Tyrese Doncic.

[05:26] Team_058 possession (Score: 65-71)
Kyle Westbrook attempts a Midrange. Contested by Jordan Nowitzki (5.4 feet, ZONE). Kyle Westbrook misses. Rebound secured by Jaren Green.

[05:07] Team_030 possession (Score: 65-71)
Tim Barrett attempts a 3Pt. Heavily contested by Bradley Sexton (0.5 feet, ZONE)! Tim Barrett misses. Rebound secured by Stephen Haliburton.

[04:55] Team_058 possession (Score: 65-71)
Kyle Westbrook drives and kicks out. Stephen Haliburton attempts a Midrange. Wide open! Jordan Nowitzki is 7.1 feet away. [ZONE] Stephen Haliburton misses. Rebound secured by Jaren Green.

[04:38] Team_030 possession (Score: 65-71)
Jordan Nowitzki drives to the basket... Jordan Nowitzki commits a violation (traveling/carry)! TURNOVER! (dead ball)

[04:22] Team_058 possession (Score: 65-71)
Bradley Sexton attempts a 3Pt. Wide open! Tyler Beal is 7.7 feet away. [ZONE] BRADLEY SEXTON MAKES IT! Assist: Kyle Westbrook
Score: 65-74

[04:09] Team_030 possession (Score: 65-74)
FOUL! Shooting foul on Bradley Sexton. Joel Anunoby to the line for 2 free throws. [Team fouls: 4] (Bradley Sexton: 2 personal fouls)   FT 1/2: MISS   FT 2/2: GOOD Joel Anunoby makes 1/2 from the line.
Score: 66-74

[03:55] Team_058 possession (Score: 66-74)
FOUL! Reach-in foul on Tyler Beal during the drive. [IN THE BONUS! 5 team fouls] Bradley Sexton to the line for 2 free throws. (Tyler Beal: 2 personal fouls)   FT 1/2: GOOD   FT 2/2: GOOD Bradley Sexton makes 2/2 from the line.
Score: 66-76

[03:46] Team_030 possession (Score: 66-76)
FOUL! Shooting foul on Bradley Sexton. Tyler Beal to the line for 3 free throws. [BONUS: 5 team fouls] (Bradley Sexton: 3 personal fouls)   FT 1/3: GOOD   FT 2/3: MISS   FT 3/3: GOOD Tyler Beal makes 2/3 from the line.
Score: 68-76

[03:32] Team_058 possession (Score: 68-76)
Tyrese Doncic drives, Jaren Green stays with him. Tyrese Doncic attempts a Dunk. Contested by Jaren Green (4.3 feet, ZONE). TYRESE DONCIC MAKES IT!
Score: 68-78

[03:22] Team_030 possession (Score: 68-78)
FOUL! Reach-in foul on Stephen Haliburton during the drive. [IN THE BONUS! 6 team fouls] Joel Anunoby to the line for 2 free throws. (Stephen Haliburton: 2 personal fouls)   FT 1/2: GOOD   FT 2/2: GOOD Joel Anunoby makes 2/2 from the line.
Score: 70-78

[03:08] Team_058 possession (Score: 70-78)
Kyle Westbrook loses the ball! Stripped by Tim Barrett! TURNOVER! (live ball)

[02:55] Team_030 possession (Score: 70-78)
Jaren Green throws a bad pass! Stolen by Tyrese Doncic! TURNOVER! (live ball)

[02:41] Team_058 possession (Score: 70-78)
Kyle Westbrook attempts a Midrange. Wide open! Tim Barrett is 6.3 feet away. [MAN] KYLE WESTBROOK MAKES IT!
Score: 70-80

[02:26] Team_030 possession (Score: 70-80)
FOUL! Shooting foul on Vince Hyland. Joel Anunoby to the line for 2 free throws. [BONUS: 7 team fouls] (Vince Hyland: 2 personal fouls)   FT 1/2: GOOD   FT 2/2: GOOD Joel Anunoby makes 2/2 from the line.
Score: 72-80

[02:12] Team_058 possession (Score: 72-80)
Stephen Haliburton attempts a Layup. BLOCKED BY JAREN GREEN! Ball deflects out of bounds off Stephen Haliburton.

[01:55] Team_030 possession (Score: 72-80)
Joel Anunoby attempts a 3Pt. Wide open! Vince Hyland is 9.8 feet away. [MAN] Joel Anunoby misses. Rebound secured by Bradley Sexton.

[01:39] Team_058 possession (Score: 72-80)
Stephen Haliburton loses control! Ball rolls out of bounds! TURNOVER! (dead ball)

[01:39] Substitution (Team_030): Tyler Beal OUT → RJ Carter IN (stamina_rule2)

[01:39] Substitution (Team_030): Tim Barrett OUT → Josh Smith IN (stamina_rule2)

[01:39] Substitution (Team_030): Joel Anunoby OUT → Pau James IN (stamina_rule2)

[01:39] Substitution (Team_030): Jordan Nowitzki OUT → Damian Green IN (stamina_rule2)

[01:39] Substitution (Team_030): Jaren Green OUT → Franz Anunoby IN (stamina_rule2)

[01:39] Substitution (Team_058): Bradley Sexton OUT → Draymond Williamson IN (stamina_rule2)

[01:39] Substitution (Team_058): Kyle Westbrook OUT → Jordan Ingram IN (stamina_rule2)

[01:39] Substitution (Team_058): Vince Hyland OUT → Pascal Holiday IN (stamina_rule2)

[01:39] Substitution (Team_058): Stephen Haliburton OUT → Shai Lowry IN (stamina_rule2)

[01:39] Substitution (Team_058): Tyrese Doncic OUT → Jarrett Gilgeous-Alexander IN (stamina_rule2)

[01:23] Team_030 possession (Score: 72-80)
FOUL! Holding foul on Pascal Holiday. [IN THE BONUS! 8 team fouls] Pau James to the line for 2 free throws. (Pascal Holiday: 1 personal fouls)   FT 1/2: GOOD   FT 2/2: GOOD Pau James makes 2/2 from the line.
Score: 74-80

[01:11] Team_058 possession (Score: 74-80)
Pascal Holiday attempts a Midrange. Contested by Pau James (3.6 feet, ZONE). Pascal Holiday misses. Rebound secured by Franz Anunoby.

[00:52] Team_030 possession (Score: 74-80)
Pau James attempts a 3Pt. Heavily contested by Pascal Holiday (0.5 feet, MAN)! Pau James misses. FOUL! Loose ball foul on Jarrett Gilgeous-Alexander during the rebound battle. [IN THE BONUS! 9 team fouls] Pau James to the line for 2 free throws. (Jarrett Gilgeous-Alexander: 1 personal fouls)   FT 1/2: MISS   FT 2/2: GOOD Pau James makes 1/2 from the line.
Score: 75-80

[00:33] Team_058 possession (Score: 75-80)
Pascal Holiday attempts a 3Pt. Contested by RJ Carter (5.8 feet, ZONE). PASCAL HOLIDAY MAKES IT!
Score: 75-83

[00:20] Team_030 possession (Score: 75-83)
Damian Green attempts a 3Pt. Contested by Draymond Williamson (5.9 feet, ZONE). Damian Green misses. Rebound secured by Pascal Holiday.

[00:04] Team_058 possession (Score: 75-83)
Draymond Williamson attempts a 3Pt. Contested by RJ Carter (4.2 feet, MAN). Draymond Williamson misses. Rebound secured by Damian Green.

================================================================================
                              3RD QUARTER COMPLETE                              
================================================================================

3RD QUARTER SCORE: Team_030 29, Team_058 27

BOX SCORE:
================================================================================

Team_030
--------------------------------------------------------------------------------
Player                MIN  PTS  REB  AST  TO      FG   FG%      3P   3P%
--------------------------------------------------------------------------------
Tyler Beal             28    9    0    0   0   4/5    80.0     0/0   0.0
Joel Anunoby           28    7    0    2   0   4/7    57.1     0/0   0.0
Jaren Green            28    5    8    3   0   2/3    66.7     0/0   0.0
Tim Barrett            28    3    0    2   0   1/2    50.0     0/0   0.0
Pau James               9    3    0    0   0   2/2   100.0     0/0   0.0
Jordan Nowitzki        28    2    0    0   0   1/2    50.0     0/0   0.0
Franz Anunoby           9    0    1    0   0   0/0     0.0     0/0   0.0
Damian Green            9    0    1    0   0   0/1     0.0     0/0   0.0

TEAM: FG: 14/22 (63.6%), 3PT: 4/8 (50.0%), REB: 11 (1 off, 10 def), AST: 7, TO: 2
TEAM FOULS: 5 [Team_058 in BONUS]


Team_058
--------------------------------------------------------------------------------
Player                MIN  PTS  REB  AST  TO      FG   FG%      3P   3P%
--------------------------------------------------------------------------------
Tyrese Doncic          28   10    3    1   0   4/4   100.0     0/0   0.0
Bradley Sexton         28    8    2    1   0   3/5    60.0     0/0   0.0
Pascal Holiday          9    3    1    0   0   1/2    50.0     0/0   0.0
Stephen Haliburton     28    2    2    0   0   1/3    33.3     0/0   0.0
Kyle Westbrook         28    2    0    2   0   1/3    33.3     0/0   0.0
Vince Hyland           28    0    0    0   0   0/3     0.0     0/0   0.0
Draymond Williamson     9    0    0    0   0   0/1     0.0     0/0   0.0

TEAM: FG: 10/21 (47.6%), 3PT: 4/7 (57.1%), REB: 7 (0 off, 7 def), AST: 4, TO: 3
TEAM FOULS: 9 [Team_030 in BONUS]

================================================================================

================================================================================
                       4TH QUARTER - Team_030 vs Team_058                       
================================================================================

[12:00] Team_030 possession (Score: 75-83)
Tyler Beal attempts a Layup. Heavily contested by Stephen Haliburton (1.5 feet, ZONE)! TYLER BEAL MAKES IT!
Score: 77-83

[11:41] Team_058 possession (Score: 77-83)
Stephen Haliburton attempts a Midrange. Contested by Tim Barrett (5.7 feet, ZONE). Stephen Haliburton misses. Rebound secured by Jaren Green.

[11:27] Team_030 possession (Score: 77-83)
Jaren Green attempts a Midrange. Contested by Stephen Haliburton (2.5 feet, ZONE). JAREN GREEN MAKES IT!
Score: 79-83

[11:09] Team_058 possession (Score: 79-83)
Stephen Haliburton attempts a 3Pt. Wide open! Jordan Nowitzki is 6.5 feet away. [MAN] Stephen Haliburton misses. Rebound secured by Jaren Green.

[10:56] Team_030 possession (Score: 79-83)
Tim Barrett drives, picks up Stephen Haliburton. Help arrives from Bradley Sexton! Tim Barrett attempts a Layup. Contested by Bradley Sexton (4.7 feet, ZONE). TIM BARRETT MAKES IT! Assist: Jaren Green
Score: 81-83

[10:43] Team_058 possession (Score: 81-83)
FOUL! Holding foul on Jaren Green. [Team fouls: 1] No free throws, side out. (Jaren Green: 1 personal fouls)

[10:29] Team_058 possession (Score: 81-83)
Stephen Haliburton drives, Jaren Green stays with him. Stephen Haliburton attempts a Layup. Contested by Jaren Green (2.1 feet, ZONE). Stephen Haliburton misses. Rebound secured by Joel Anunoby.

[10:15] Team_030 possession (Score: 81-83)
Joel Anunoby attempts a Midrange. Contested by Vince Hyland (4.1 feet, MAN). JOEL ANUNOBY MAKES IT! Assist: Jaren Green
Score: 83-83

[10:04] Team_058 possession (Score: 83-83)
Vince Hyland attempts a Midrange. Heavily contested by Joel Anunoby (1.8 feet, MAN)! Vince Hyland misses. Offensive rebound by Stephen Haliburton! Stephen Haliburton's putback is no good. Rebound secured by Jordan Nowitzki.

[09:53] Team_030 possession (Score: 83-83)
Tim Barrett attempts a Midrange. Contested by Kyle Westbrook (4.5 feet, MAN). TIM BARRETT MAKES IT! Assist: Jordan Nowitzki
Score: 85-83

[09:44] Team_058 possession (Score: 85-83)
Vince Hyland attempts a 3Pt. Contested by Tyler Beal (3.1 feet, ZONE). VINCE HYLAND MAKES IT! Assist: Tyrese Doncic
Score: 85-86

[09:29] Team_030 possession (Score: 85-86)
FOUL! Shooting foul on Stephen Haliburton. Jordan Nowitzki to the line for 2 free throws. [Team fouls: 1] (Stephen Haliburton: 1 personal fouls)   FT 1/2: GOOD   FT 2/2: MISS Jordan Nowitzki makes 1/2 from the line. Rebound secured by Bradley Sexton.
Score: 86-86

[09:12] Team_058 possession (Score: 86-86)
Kyle Westbrook attempts a 3Pt. Contested by Tyler Beal (3.3 feet, ZONE). Kyle Westbrook misses. Offensive rebound by Tyrese Doncic! Tyrese Doncic kicks it out.

[08:59] Team_058 possession (Score: 86-86)
Vince Hyland attempts a Midrange. Contested by Joel Anunoby (3.4 feet, ZONE). Vince Hyland misses. Rebound secured by Joel Anunoby.

[08:40] Team_030 possession (Score: 86-86)
Jaren Green makes the Layup and draws the foul on Tyrese Doncic! And-1! Jaren Green to the line for 1. [Team fouls: 2] (Tyrese Doncic: 1 personal fouls)   FT 1/1: GOOD Jaren Green makes 1/1 from the line.
Score: 89-86

[08:23] Team_058 possession (Score: 89-86)
Stephen Haliburton attempts a Midrange. Contested by Jordan Nowitzki (2.6 feet, ZONE). Stephen Haliburton misses. Offensive rebound by Tyrese Doncic! Tyrese Doncic kicks it out.

[08:14] Team_058 possession (Score: 89-86)
Vince Hyland attempts a Midrange. Contested by Tim Barrett (5.2 feet, ZONE). VINCE HYLAND MAKES IT!
Score: 89-88

[07:59] Team_030 possession (Score: 89-88)
Jaren Green attempts a Midrange. Contested by Tyrese Doncic (5.6 feet, MAN). Jaren Green misses. Rebound secured by Tyrese Doncic.

[07:47] Team_058 possession (Score: 89-88)
Tyrese Doncic attempts a Midrange. Contested by Jaren Green (5.6 feet, ZONE). Tyrese Doncic misses. Offensive rebound by Tyrese Doncic! Tyrese Doncic kicks it out.

[07:27] Team_058 possession (Score: 89-88)
Vince Hyland attempts a Layup. Wide open! Jaren Green is 6.7 feet away. [ZONE] VINCE HYLAND MAKES IT!
Score: 89-90

[07:13] Team_030 possession (Score: 89-90)
Jordan Nowitzki attempts a Midrange. Contested by Stephen Haliburton (2.2 feet, MAN). Jordan Nowitzki misses. FOUL! Loose ball foul on Vince Hyland during the rebound battle. [Team fouls: 3] No free throws, side out. (Vince Hyland: 1 personal fouls)

[07:00] Team_030 possession (Score: 89-90)
Jaren Green drives to the basket... Jaren Green commits a violation (traveling/carry)! TURNOVER! (dead ball)

[07:00] Substitution (Team_030): Tyler Beal OUT → RJ Carter IN (stamina_rule2)

[07:00] Substitution (Team_030): Tim Barrett OUT → Josh Smith IN (stamina_rule2)

[07:00] Substitution (Team_030): Joel Anunoby OUT → Pau James IN (stamina_rule2)

[07:00] Substitution (Team_030): Jordan Nowitzki OUT → Damian Green IN (stamina_rule2)

[07:00] Substitution (Team_030): Jaren Green OUT → Franz Anunoby IN (stamina_rule2)

[07:00] Substitution (Team_058): Bradley Sexton OUT → Draymond Williamson IN (stamina_rule2)

[07:00] Substitution (Team_058): Kyle Westbrook OUT → Jordan Ingram IN (stamina_rule2)

[07:00] Substitution (Team_058): Vince Hyland OUT → Pascal Holiday IN (stamina_rule2)

[07:00] Substitution (Team_058): Stephen Haliburton OUT → Shai Lowry IN (stamina_rule2)

[07:00] Substitution (Team_058): Tyrese Doncic OUT → Jarrett Gilgeous-Alexander IN (stamina_rule2)

[06:42] Team_058 possession (Score: 89-90)
Jordan Ingram drives, Damian Green stays with him. Jordan Ingram attempts a Dunk. Contested by Damian Green (2.2 feet, ZONE). Jordan Ingram misses. Rebound secured by Franz Anunoby.

[06:29] Team_030 possession (Score: 89-90)
Franz Anunoby attempts a Midrange. Wide open! Jarrett Gilgeous-Alexander is 6.7 feet away. [MAN] Franz Anunoby misses. Rebound secured by Shai Lowry.

[06:12] Team_058 possession (Score: 89-90)
Draymond Williamson attempts a Layup. Contested by Franz Anunoby (2.7 feet, ZONE). DRAYMOND WILLIAMSON MAKES IT! Assist: Pascal Holiday
Score: 89-92

[05:55] Team_030 possession (Score: 89-92)
Damian Green drives, picks up Shai Lowry. Help arrives from Jordan Ingram! Damian Green attempts a Dunk. Heavily contested by Jordan Ingram (0.5 feet, MAN)! DAMIAN GREEN MAKES IT!
Score: 91-92

[05:40] Team_058 possession (Score: 91-92)
Jarrett Gilgeous-Alexander attempts a Layup. Contested by Damian Green (4.2 feet, ZONE). JARRETT GILGEOUS-ALEXANDER MAKES IT! Assist: Jordan Ingram
Score: 91-94

[05:24] Team_030 possession (Score: 91-94)
Damian Green drives to the basket... Damian Green throws a bad pass! Stolen by Shai Lowry! TURNOVER! (live ball)

[05:07] Team_058 possession (Score: 91-94)
Shai Lowry attempts a 3Pt. Contested by Damian Green (3.0 feet, MAN). SHAI LOWRY MAKES IT! Assist: Pascal Holiday
Score: 91-97

[04:52] Team_030 possession (Score: 91-97)
Pau James drives to the basket... FOUL! Offensive foul on Pau James! Pascal Holiday drew the charge! [Team fouls: 2] (Pau James: 1 personal fouls) TURNOVER! (dead ball)

[04:34] Team_058 possession (Score: 91-97)
Pascal Holiday drives, Damian Green stays with him. Pascal Holiday attempts a Dunk. Contested by Damian Green (2.6 feet, ZONE). Pascal Holiday misses. Offensive rebound by Shai Lowry! Shai Lowry kicks it out.

[04:16] Team_058 possession (Score: 91-97)
Draymond Williamson attempts a 3Pt. Wide open! RJ Carter is 6.9 feet away. [ZONE] DRAYMOND WILLIAMSON MAKES IT! Assist: Pascal Holiday
Score: 91-100

[04:01] Team_030 possession (Score: 91-100)
Pau James attempts a 3Pt. Contested by Draymond Williamson (6.0 feet, ZONE). PAU JAMES MAKES IT! Assist: Josh Smith
Score: 94-100

[03:47] Team_058 possession (Score: 94-100)
FOUL! Shooting foul on Damian Green. Jordan Ingram to the line for 2 free throws. [Team fouls: 3] (Damian Green: 1 personal fouls)   FT 1/2: GOOD   FT 2/2: GOOD Jordan Ingram makes 2/2 from the line.
Score: 94-102

[03:32] Team_030 possession (Score: 94-102)
Pau James drives and kicks out. Josh Smith attempts a 3Pt. Contested by Draymond Williamson (3.9 feet, ZONE). JOSH SMITH MAKES IT! Assist: Damian Green
Score: 97-102

[03:20] Team_058 possession (Score: 97-102)
Shai Lowry attempts a Layup. BLOCKED BY DAMIAN GREEN! Ball deflects out of bounds off Shai Lowry.

[03:07] Team_030 possession (Score: 97-102)
Josh Smith attempts a 3Pt. Wide open! Jordan Ingram is 7.0 feet away. [MAN] Josh Smith misses. FOUL! Loose ball foul on Shai Lowry during the rebound battle. [Team fouls: 4] No free throws, side out. (Shai Lowry: 1 personal fouls)

[02:50] Team_030 possession (Score: 97-102)
Pau James makes the Midrange and draws the foul on Pascal Holiday! And-1! Pau James to the line for 1. [BONUS: 5 team fouls] (Pascal Holiday: 1 personal fouls)   FT 1/1: GOOD Pau James makes 1/1 from the line.
Score: 100-102

[02:35] Team_058 possession (Score: 100-102)
Jordan Ingram attempts a 3Pt. Wide open! Josh Smith is 7.0 feet away. [ZONE] JORDAN INGRAM MAKES IT! Assist: Draymond Williamson
Score: 100-105

[02:18] Team_030 possession (Score: 100-105)
Josh Smith attempts a 3Pt. Wide open! Draymond Williamson is 6.1 feet away. [ZONE] Josh Smith misses. Rebound secured by Pascal Holiday.

[02:05] Team_058 possession (Score: 100-105)
Jarrett Gilgeous-Alexander drives and kicks out. Draymond Williamson attempts a 3Pt. Wide open! RJ Carter is 6.5 feet away. [ZONE] Draymond Williamson misses. Rebound secured by Damian Green.

[01:46] Team_030 possession (Score: 100-105)
Josh Smith attempts a 3Pt. Wide open! Jordan Ingram is 9.2 feet away. [MAN] Josh Smith misses. Offensive rebound by Pau James! Pau James kicks it out.

[01:35] Team_030 possession (Score: 100-105)
Damian Green attempts a Midrange. Wide open! Jordan Ingram is 6.5 feet away. [ZONE] DAMIAN GREEN MAKES IT! Assist: Josh Smith
Score: 102-105

[01:16] Team_058 possession (Score: 102-105)
Pascal Holiday attempts a 3Pt. Wide open! RJ Carter is 8.0 feet away. [ZONE] PASCAL HOLIDAY MAKES IT! Assist: Jordan Ingram
Score: 102-108

[01:03] Team_030 possession (Score: 102-108)
Pau James drives, Pascal Holiday stays with him. Pau James attempts a Layup. Heavily contested by Pascal Holiday (1.8 feet, MAN)! Pau James misses. Rebound secured by Pascal Holiday.

[00:50] Team_058 possession (Score: 102-108)
Draymond Williamson attempts a 3Pt. Contested by RJ Carter (5.9 feet, ZONE). Draymond Williamson misses. Rebound secured by Damian Green.

[00:34] Team_030 possession (Score: 102-108)
Damian Green attempts a Layup. Contested by Shai Lowry (2.6 feet, MAN). Damian Green misses. Rebound secured by Pascal Holiday.

[00:22] Team_058 possession (Score: 102-108)
Jordan Ingram attempts a Midrange. Wide open! Damian Green is 6.6 feet away. [ZONE] Jordan Ingram misses. Rebound secured by Franz Anunoby.

[00:07] Team_030 possession (Score: 102-108)
Franz Anunoby attempts a Midrange. Wide open! Jarrett Gilgeous-Alexander is 7.0 feet away. [MAN] Franz Anunoby misses. Rebound secured by Shai Lowry.

================================================================================
                              4TH QUARTER COMPLETE                              
================================================================================

4TH QUARTER SCORE: Team_030 27, Team_058 25

BOX SCORE:
================================================================================

Team_030
--------------------------------------------------------------------------------
Player                MIN  PTS  REB  AST  TO      FG   FG%      3P   3P%
--------------------------------------------------------------------------------
Pau James              16    6    1    0   0   2/3    66.7     0/0   0.0
Jaren Green            33    5    2    2   0   2/3    66.7     0/0   0.0
Tim Barrett            33    4    0    0   0   2/2   100.0     0/0   0.0
Damian Green           16    4    3    1   0   2/3    66.7     0/0   0.0
Josh Smith             16    3    0    2   0   1/2    50.0     0/0   0.0
Tyler Beal             33    2    0    0   0   1/1   100.0     0/0   0.0
Joel Anunoby           33    2    3    0   0   1/1   100.0     0/0   0.0
Jordan Nowitzki        33    0    1    1   0   0/1     0.0     0/0   0.0
Franz Anunoby          16    0    2    0   0   0/2     0.0     0/0   0.0

TEAM: FG: 11/18 (61.1%), 3PT: 1/2 (50.0%), REB: 11 (3 off, 8 def), AST: 6, TO: 3
TEAM FOULS: 3


Team_058
--------------------------------------------------------------------------------
Player                MIN  PTS  REB  AST  TO      FG   FG%      3P   3P%
--------------------------------------------------------------------------------
Vince Hyland           33    7    0    0   0   3/5    60.0     0/0   0.0
Jordan Ingram          16    5    0    2   0   2/4    50.0     0/0   0.0
Draymond Williamson    16    5    0    1   0   2/3    66.7     0/0   0.0
Shai Lowry             16    3    3    0   0   1/2    50.0     0/0   0.0
Pascal Holiday         16    3    3    3   0   1/1   100.0     0/0   0.0
Jarrett Gilgeous-Alexander   16    2    0    0   0   1/2    50.0     0/0   0.0
Stephen Haliburton     33    0    0    0   0   0/3     0.0     0/0   0.0
Tyrese Doncic          33    0    4    1   0   0/0     0.0     0/0   0.0
Bradley Sexton         33    0    1    0   0   0/0     0.0     0/0   0.0

TEAM: FG: 10/20 (50.0%), 3PT: 5/7 (71.4%), REB: 12 (5 off, 7 def), AST: 7, TO: 0
TEAM FOULS: 5 [Team_030 in BONUS]

================================================================================

================================================================================
                               FULL GAME COMPLETE                               
================================================================================

FINAL SCORE: Team_030 102, Team_058 108

SCORING BY QUARTER:
--------------------------------------------------------------------------------
Team                     Q1     Q2     Q3     Q4    FINAL
--------------------------------------------------------------------------------
Team_030                 27     19     29     27      102
Team_058                 32     24     27     25      108
--------------------------------------------------------------------------------

FULL GAME BOX SCORE:
================================================================================

Team_030
--------------------------------------------------------------------------------
Player                MIN  PTS  REB  AST  TO      FG   FG%      3P   3P%      FT STL BLK
--------------------------------------------------------------------------------
Tyler Beal             33   17    0    3   0   6/8    75.0   1/2    50.0   2/3     0   0
Tim Barrett            33   18    0    2   1   7/13   53.8   3/5    60.0   6/6     1   0
Joel Anunoby           33   13    6    4   0   8/13   61.5   0/3     0.0   5/6     1   0
Jordan Nowitzki        33    9    6    1   5   3/8    37.5   1/2    50.0   1/4     1   1
Jaren Green            33   10   11    7   1   6/11   54.5   1/1   100.0   1/1     0   2
RJ Carter              16    2    0    1   2   1/2    50.0   0/1     0.0   0/0     0   0
Josh Smith             16    3    0    2   0   0/2     0.0   0/1     0.0   0/0     0   0
Pau James              16   16    3    0   1   7/9    77.8   2/3    66.7   5/6     0   0
Damian Green           16    7    7    2   1   3/7    42.9   0/1     0.0   1/1     1   1
Franz Anunoby          16    0    7    0   1   0/3     0.0   0/0     0.0   0/1     0   0

TEAM: FG: 42/77 (54.5%), 3PT: 8/19 (42.1%), REB: 40 (7 off, 33 def), AST: 22, TO: 12


Team_058
--------------------------------------------------------------------------------
Player                MIN  PTS  REB  AST  TO      FG   FG%      3P   3P%      FT STL BLK
--------------------------------------------------------------------------------
Bradley Sexton         33   13    9    4   0   5/7    71.4   3/4    75.0   2/2     0   0
Kyle Westbrook         33    9    0    4   2   4/10   40.0   1/3    33.3   0/0     0   1
Vince Hyland           33   16    0    2   1   9/17   52.9   3/7    42.9   2/3     0   0
Stephen Haliburton     33   17   11    1   4   6/11   54.5   0/1     0.0   0/0     3   0
Tyrese Doncic          33   13   12    5   1   5/5   100.0   2/2   100.0   1/1     1   2
Draymond Williamson    16    8    0    2   0   2/4    50.0   1/3    33.3   0/0     1   0
Jordan Ingram          16    7    0    3   1   4/8    50.0   2/3    66.7   4/4     0   0
Pascal Holiday         16    8    7    3   0   4/7    57.1   2/3    66.7   1/3     0   0
Shai Lowry             16    5    6    1   0   1/2    50.0   1/1   100.0   2/2     1   0
Jarrett Gilgeous-Alexander   16    7    0    0   0   3/7    42.9   1/2    50.0   0/0     0   0

TEAM: FG: 43/79 (54.4%), 3PT: 16/29 (55.2%), REB: 45 (11 off, 34 def), AST: 25, TO: 9

================================================================================
