================================================================================
                        FULL GAME - Team_028 vs Team_088                        
================================================================================

================================================================================
                       1ST QUARTER - Team_028 vs Team_088                       
================================================================================

[12:00] Team_028 possession (Score: 0-0)
FOUL! Shooting foul on Giannis Smith. Kawhi Ball to the line for 2 free throws. [Team fouls: 1] (Giannis Smith: 1 personal fouls)   FT 1/2: GOOD   FT 2/2: GOOD Kawhi Ball makes 2/2 from the line.
Score: 2-0

[11:46] Team_088 possession (Score: 2-0)
Tobias Haliburton attempts a 3Pt. Wide open! Austin Russell is 6.3 feet away. [ZONE] Tobias Haliburton misses. Rebound secured by Carmelo Carter.

[11:35] Team_028 possession (Score: 2-0)
Austin Russell attempts a Midrange. Contested by Josh Duncan (5.7 feet, MAN). AUSTIN RUSSELL MAKES IT! Assist: Jimmy Brogdon
Score: 4-0

[11:22] Team_088 possession (Score: 4-0)
FOUL! Shooting foul on Myles Haliburton. Tyler Hyland to the line for 2 free throws. [Team fouls: 1] (Myles Haliburton: 1 personal fouls)   FT 1/2: GOOD   FT 2/2: MISS Tyler Hyland makes 1/2 from the line. Rebound secured by Carmelo Carter.
Score: 4-1

[11:08] Team_028 possession (Score: 4-1)
Jimmy Brogdon drives to the basket... Jimmy Brogdon loses the ball! Stripped by Allen Ming! TURNOVER! (live ball)

[10:54] Team_088 possession (Score: 4-1)
Tyler Hyland attempts a 3Pt. Contested by Myles Haliburton (5.9 feet, MAN). TYLER HYLAND MAKES IT! Assist: Josh Duncan
Score: 4-4

[10:41] Team_028 possession (Score: 4-4)
FOUL! Holding foul on Giannis Smith. [Team fouls: 2] No free throws, side out. (Giannis Smith: 2 personal fouls)

[10:29] Team_028 possession (Score: 4-4)
Kawhi Ball attempts a 3Pt. Wide open! Tobias Haliburton is 7.6 feet away. [ZONE] Kawhi Ball misses. Rebound secured by Giannis Smith.

[10:18] Team_088 possession (Score: 4-4)
Tobias Haliburton attempts a 3Pt. Contested by Carmelo Carter (4.7 feet, MAN). Tobias Haliburton misses. Rebound secured by Kawhi Ball.

[10:02] Team_028 possession (Score: 4-4)
Carmelo Carter attempts a Layup. Contested by Giannis Smith (4.0 feet, ZONE). Carmelo Carter misses. Offensive rebound by Jimmy Brogdon! Jimmy Brogdon kicks it out.

[09:48] Team_028 possession (Score: 4-4)
Myles Haliburton drives, Giannis Smith stays with him. Myles Haliburton attempts a Dunk. Heavily contested by Giannis Smith (1.5 feet, ZONE)! Myles Haliburton misses. Rebound secured by Allen Ming.

[09:34] Team_088 possession (Score: 4-4)
Giannis Smith drives, Kawhi Ball stays with him. Giannis Smith attempts a Layup. Heavily contested by Kawhi Ball (0.6 feet, ZONE)! Giannis Smith misses. Rebound secured by Kawhi Ball.

[09:24] Team_028 possession (Score: 4-4)
Kawhi Ball attempts a Layup. Contested by Giannis Smith (4.8 feet, MAN). KAWHI BALL MAKES IT! Assist: Carmelo Carter
Score: 6-4

[09:07] Team_088 possession (Score: 6-4)
Tobias Haliburton makes the Layup and draws the foul on Carmelo Carter! And-1! Tobias Haliburton to the line for 1. [Team fouls: 2] (Carmelo Carter: 1 personal fouls)   FT 1/1: GOOD Tobias Haliburton makes 1/1 from the line.
Score: 6-7

[08:55] Team_028 possession (Score: 6-7)
Jimmy Brogdon attempts a Midrange. Wide open! Allen Ming is 7.4 feet away. [MAN] JIMMY BROGDON MAKES IT! Assist: Kawhi Ball
Score: 8-7

[08:43] Team_088 possession (Score: 8-7)
Tobias Haliburton attempts a 3Pt. Contested by Austin Russell (3.0 feet, ZONE). TOBIAS HALIBURTON MAKES IT! Assist: Josh Duncan
Score: 8-10

[08:31] Team_028 possession (Score: 8-10)
Myles Haliburton attempts a Layup. Contested by Giannis Smith (4.1 feet, ZONE). MYLES HALIBURTON MAKES IT!
Score: 10-10

[08:17] Team_088 possession (Score: 10-10)
Allen Ming attempts a Midrange. Contested by Jimmy Brogdon (6.0 feet, MAN). Allen Ming misses. Rebound secured by Carmelo Carter.

[08:04] Team_028 possession (Score: 10-10)
Carmelo Carter attempts a 3Pt. Contested by Tobias Haliburton (3.5 feet, MAN). Carmelo Carter misses. Rebound secured by Tyler Hyland.

[07:51] Team_088 possession (Score: 10-10)
Tobias Haliburton attempts a Layup. BLOCKED BY CARMELO CARTER! Ball is loose! Offensive rebound by Allen Ming! Allen Ming kicks it out.

[07:39] Team_088 possession (Score: 10-10)
Josh Duncan attempts a Midrange. Contested by Austin Russell (4.0 feet, MAN). Josh Duncan misses. Rebound secured by Carmelo Carter.

[07:22] Team_028 possession (Score: 10-10)
Jimmy Brogdon makes the Dunk and draws the foul on Tobias Haliburton! And-1! Jimmy Brogdon to the line for 1. [Team fouls: 3] (Tobias Haliburton: 1 personal fouls)   FT 1/1: GOOD Jimmy Brogdon makes 1/1 from the line.
Score: 13-10

[07:08] Team_088 possession (Score: 13-10)
Tobias Haliburton attempts a 3Pt. Contested by Carmelo Carter (2.7 feet, MAN). Tobias Haliburton misses. Rebound secured by Kawhi Ball.

[06:57] Team_028 possession (Score: 13-10)
Austin Russell attempts a Midrange. Contested by Tobias Haliburton (4.0 feet, ZONE). Austin Russell misses. Offensive rebound by Jimmy Brogdon! Jimmy Brogdon kicks it out.

[06:40] Team_028 possession (Score: 13-10)
FOUL! Shooting foul on Tobias Haliburton. Kawhi Ball to the line for 2 free throws. [Team fouls: 4] (Tobias Haliburton: 2 personal fouls)   FT 1/2: MISS   FT 2/2: MISS Kawhi Ball makes 0/2 from the line. FOUL! Loose ball foul on Giannis Smith during the free throw rebound! [IN THE BONUS! 5 team fouls] Kawhi Ball to the line for 2 free throws. (Giannis Smith: 3 personal fouls)   FT 1/2: GOOD   FT 2/2: GOOD Kawhi Ball makes 2/2 from the line.
Score: 15-10

[06:26] Team_088 possession (Score: 15-10)
Tyler Hyland attempts a Layup. BLOCKED BY KAWHI BALL! Ball deflects out of bounds off Tyler Hyland.

[06:09] Team_028 possession (Score: 15-10)
Kawhi Ball attempts a 3Pt. Contested by Tobias Haliburton (3.9 feet, ZONE). Kawhi Ball misses. Rebound secured by Allen Ming.

[05:56] Team_088 possession (Score: 15-10)
FOUL! Offensive foul on Allen Ming! Jimmy Brogdon drew the charge! [Team fouls: 6] (Allen Ming: 1 personal fouls) TURNOVER! (dead ball)

[05:40] Team_028 possession (Score: 15-10)
Kawhi Ball drives and kicks out. Kawhi Ball attempts a 3Pt. Contested by Tobias Haliburton (5.0 feet, ZONE). Kawhi Ball misses. Offensive rebound by Jimmy Brogdon! Jimmy Brogdon kicks it out.

[05:27] Team_028 possession (Score: 15-10)
Kawhi Ball loses the ball! Stripped by Giannis Smith! TURNOVER! (live ball)

[05:14] Team_088 possession (Score: 15-10)
Tyler Hyland attempts a 3Pt. Wide open! Austin Russell is 7.6 feet away. [ZONE] TYLER HYLAND MAKES IT! Assist: Josh Duncan
Score: 15-13

[04:59] Team_028 possession (Score: 15-13)
Carmelo Carter drives, Tobias Haliburton stays with him. Carmelo Carter attempts a Layup. Heavily contested by Tobias Haliburton (1.8 feet, MAN)! Carmelo Carter misses. Rebound secured by Giannis Smith.

[04:44] Team_088 possession (Score: 15-13)
Giannis Smith attempts a 3Pt. Contested by Austin Russell (5.8 feet, ZONE). Giannis Smith misses. Offensive rebound by Allen Ming! Allen Ming puts it back in!
Score: 15-15

[04:32] Team_028 possession (Score: 15-15)
FOUL! Holding foul on Tyler Hyland. [IN THE BONUS! 7 team fouls] Myles Haliburton to the line for 2 free throws. (Tyler Hyland: 1 personal fouls)   FT 1/2: GOOD   FT 2/2: GOOD Myles Haliburton makes 2/2 from the line.
Score: 17-15

[04:18] Team_088 possession (Score: 17-15)
FOUL! Shooting foul on Austin Russell. Tyler Hyland to the line for 3 free throws. [Team fouls: 3] (Austin Russell: 1 personal fouls)   FT 1/3: GOOD   FT 2/3: MISS   FT 3/3: GOOD Tyler Hyland makes 2/3 from the line.
Score: 17-17

[04:02] Team_028 possession (Score: 17-17)
Kawhi Ball drives, picks up Giannis Smith. Help arrives from Tobias Haliburton! Kawhi Ball attempts a Dunk. Contested by Tobias Haliburton (5.9 feet, MAN). KAWHI BALL MAKES IT! Assist: Austin Russell
Score: 19-17

[03:49] Team_088 possession (Score: 19-17)
FOUL! Shooting foul on Austin Russell. Tyler Hyland to the line for 3 free throws. [Team fouls: 4] (Austin Russell: 2 personal fouls)   FT 1/3: GOOD   FT 2/3: GOOD   FT 3/3: GOOD Tyler Hyland makes 3/3 from the line.
Score: 19-20

[03:34] Team_028 possession (Score: 19-20)
Myles Haliburton attempts a Layup. Heavily contested by Giannis Smith (0.5 feet, ZONE)! Myles Haliburton misses. Rebound secured by Tyler Hyland.

[03:21] Team_088 possession (Score: 19-20)
Tobias Haliburton attempts a 3Pt. Heavily contested by Carmelo Carter (1.9 feet, MAN)! Tobias Haliburton misses. FOUL! Loose ball foul on Jimmy Brogdon during the rebound battle. [IN THE BONUS! 5 team fouls] Allen Ming to the line for 2 free throws. (Jimmy Brogdon: 1 personal fouls)   FT 1/2: GOOD   FT 2/2: GOOD Allen Ming makes 2/2 from the line.
Score: 19-22

[03:07] Team_028 possession (Score: 19-22)
Kawhi Ball drives, Giannis Smith stays with him. Kawhi Ball attempts a Dunk. Wide open! Giannis Smith is 7.8 feet away. [ZONE] KAWHI BALL MAKES IT!
Score: 21-22

[02:55] Team_088 possession (Score: 21-22)
Tobias Haliburton attempts a 3Pt. Contested by Carmelo Carter (4.7 feet, MAN). Tobias Haliburton misses. Offensive rebound by Allen Ming! Allen Ming puts it back in!
Score: 21-24

[02:41] Team_028 possession (Score: 21-24)
Austin Russell attempts a 3Pt. Wide open! Tobias Haliburton is 6.1 feet away. [ZONE] Austin Russell misses. Rebound secured by Giannis Smith.

[02:27] Team_088 possession (Score: 21-24)
Tobias Haliburton attempts a Midrange. Wide open! Carmelo Carter is 6.4 feet away. [ZONE] TOBIAS HALIBURTON MAKES IT!
Score: 21-26

[02:12] Team_028 possession (Score: 21-26)
Myles Haliburton drives, Giannis Smith stays with him. Myles Haliburton attempts a Dunk. Contested by Giannis Smith (3.6 feet, ZONE). Myles Haliburton misses. Offensive rebound by Kawhi Ball! Kawhi Ball kicks it out.

[02:01] Team_028 possession (Score: 21-26)
Myles Haliburton attempts a Layup. Contested by Tyler Hyland (4.4 feet, MAN). MYLES HALIBURTON MAKES IT!
Score: 23-26

[01:48] Team_088 possession (Score: 23-26)
Josh Duncan attempts a Midrange. Contested by Austin Russell (2.8 feet, MAN). Josh Duncan misses. Rebound secured by Jimmy Brogdon.

[01:36] Team_028 possession (Score: 23-26)
Austin Russell attempts a 3Pt. Wide open! Josh Duncan is 8.2 feet away. [MAN] Austin Russell misses. Rebound secured by Allen Ming.

[01:22] Team_088 possession (Score: 23-26)
Tyler Hyland drives, Kawhi Ball stays with him. Tyler Hyland attempts a Dunk. Heavily contested by Kawhi Ball (1.4 feet, ZONE)! Tyler Hyland misses. Rebound secured by Jimmy Brogdon.

[01:09] Team_028 possession (Score: 23-26)
Carmelo Carter attempts a Midrange. Contested by Giannis Smith (4.1 feet, ZONE). CARMELO CARTER MAKES IT!
Score: 25-26

[00:55] Team_088 possession (Score: 25-26)
Tyler Hyland loses the ball! Stripped by Myles Haliburton! TURNOVER! (live ball)

[00:35] Team_028 possession (Score: 25-26)
Myles Haliburton attempts a Midrange. Wide open! Allen Ming is 6.6 feet away. [ZONE] Myles Haliburton misses. Rebound secured by Allen Ming.

[00:20] Team_088 possession (Score: 25-26)
FOUL! Holding foul on Carmelo Carter. [IN THE BONUS! 6 team fouls] Tobias Haliburton to the line for 2 free throws. (Carmelo Carter: 2 personal fouls)   FT 1/2: MISS   FT 2/2: GOOD Tobias Haliburton makes 1/2 from the line.
Score: 25-27

[00:08] Team_028 possession (Score: 25-27)
Jimmy Brogdon attempts a Layup. Contested by Giannis Smith (5.3 feet, ZONE). Jimmy Brogdon misses. FOUL! Loose ball foul on Giannis Smith during the rebound battle. [IN THE BONUS! 8 team fouls] Jimmy Brogdon to the line for 2 free throws. (Giannis Smith: 4 personal fouls)   FT 1/2: GOOD   FT 2/2: MISS Jimmy Brogdon makes 1/2 from the line. Rebound secured by Giannis Smith.
Score: 26-27

================================================================================
                              1ST QUARTER COMPLETE                              
================================================================================

1ST QUARTER SCORE: Team_028 26, Team_088 27

BOX SCORE:
================================================================================

Team_028
--------------------------------------------------------------------------------
Player                MIN  PTS  REB  AST  TO      FG   FG%      3P   3P%
--------------------------------------------------------------------------------
Kawhi Ball             12   10    4    1   0   5/7    71.4     0/0   0.0
Myles Haliburton       12    6    0    0   0   3/6    50.0     0/0   0.0
Jimmy Brogdon          12    5    5    1   0   2/3    66.7     0/0   0.0
Carmelo Carter         12    2    4    1   0   1/3    33.3     0/0   0.0
Austin Russell         12    2    0    1   0   1/3    33.3     0/0   0.0
Giannis Smith          12    0    4    0   0   0/1     0.0     0/0   0.0

TEAM: FG: 12/22 (54.5%), 3PT: 0/5 (0.0%), REB: 14 (5 off, 9 def), AST: 4, TO: 2
TEAM FOULS: 6 [Team_088 in BONUS]


Team_088
--------------------------------------------------------------------------------
Player                MIN  PTS  REB  AST  TO      FG   FG%      3P   3P%
--------------------------------------------------------------------------------
Tyler Hyland           12   11    2    0   0   4/7    57.1     0/0   0.0
Tobias Haliburton      12    9    0    0   0   4/7    57.1     0/0   0.0
Allen Ming             12    6    7    0   0   3/4    75.0     0/0   0.0
Josh Duncan            12    0    0    3   0   0/2     0.0     0/0   0.0

TEAM: FG: 11/21 (52.4%), 3PT: 8/11 (72.7%), REB: 12 (3 off, 9 def), AST: 3, TO: 2
TEAM FOULS: 8 [Team_028 in BONUS]

================================================================================

================================================================================
                       2ND QUARTER - Team_028 vs Team_088                       
================================================================================

[12:00] Team_028 possession (Score: 26-27)
Austin Russell drives to the basket... Austin Russell loses the ball! Stripped by Giannis Smith! TURNOVER! (live ball)

[11:42] Team_088 possession (Score: 26-27)
Josh Duncan attempts a 3Pt. Contested by Austin Russell (2.6 feet, ZONE). JOSH DUNCAN MAKES IT! Assist: Tobias Haliburton
Score: 26-30

[11:32] Team_028 possession (Score: 26-30)
Kawhi Ball drives, picks up Giannis Smith. Help arrives from Tobias Haliburton! Kawhi Ball attempts a Dunk. Contested by Tobias Haliburton (5.2 feet, MAN). Kawhi Ball misses. Offensive rebound by Kawhi Ball! Kawhi Ball kicks it out.

[11:17] Team_028 possession (Score: 26-30)
Myles Haliburton attempts a 3Pt. Contested by Tobias Haliburton (2.3 feet, ZONE). MYLES HALIBURTON MAKES IT! Assist: Jimmy Brogdon
Score: 29-30

[10:59] Team_088 possession (Score: 29-30)
Tobias Haliburton attempts a 3Pt. Wide open! Austin Russell is 6.2 feet away. [ZONE] Tobias Haliburton misses. Rebound secured by Kawhi Ball.

[10:43] Team_028 possession (Score: 29-30)
Jimmy Brogdon attempts a Layup. Contested by Allen Ming (4.0 feet, MAN). JIMMY BROGDON MAKES IT! Assist: Carmelo Carter
Score: 31-30

[10:30] Team_088 possession (Score: 31-30)
Giannis Smith attempts a Layup. Heavily contested by Kawhi Ball (1.1 feet, MAN)! GIANNIS SMITH MAKES IT! Assist: Tyler Hyland
Score: 31-32

[10:17] Team_028 possession (Score: 31-32)
Austin Russell attempts a 3Pt. Wide open! Josh Duncan is 6.6 feet away. [MAN] Austin Russell misses. Rebound secured by Allen Ming.

[10:06] Team_088 possession (Score: 31-32)
Josh Duncan attempts a Layup. BLOCKED BY CARMELO CARTER! Ball is loose! Rebound secured by Jimmy Brogdon.

[09:50] Team_028 possession (Score: 31-32)
Jimmy Brogdon attempts a Midrange. Contested by Allen Ming (4.3 feet, MAN). JIMMY BROGDON MAKES IT!
Score: 33-32

[09:37] Team_088 possession (Score: 33-32)
Tyler Hyland attempts a Midrange. Wide open! Jimmy Brogdon is 8.0 feet away. [ZONE] Tyler Hyland misses. Offensive rebound by Giannis Smith! Giannis Smith kicks it out.

[09:26] Team_088 possession (Score: 33-32)
Allen Ming attempts a Midrange. Contested by Jimmy Brogdon (5.0 feet, MAN). ALLEN MING MAKES IT! Assist: Giannis Smith
Score: 33-34

[09:13] Team_028 possession (Score: 33-34)
Jimmy Brogdon attempts a Midrange. Contested by Allen Ming (6.0 feet, MAN). Jimmy Brogdon misses. Rebound secured by Tyler Hyland.

[08:56] Team_088 possession (Score: 33-34)
Allen Ming attempts a Layup. Contested by Jimmy Brogdon (5.1 feet, ZONE). Allen Ming misses. Offensive rebound by Allen Ming! Allen Ming kicks it out.

[08:41] Team_088 possession (Score: 33-34)
Allen Ming attempts a Midrange. Contested by Austin Russell (5.9 feet, ZONE). Allen Ming misses. Rebound secured by Kawhi Ball.

[08:23] Team_028 possession (Score: 33-34)
FOUL! Shooting foul on Tobias Haliburton. Kawhi Ball to the line for 3 free throws. [Team fouls: 1] (Tobias Haliburton: 1 personal fouls)   FT 1/3: GOOD   FT 2/3: MISS   FT 3/3: GOOD Kawhi Ball makes 2/3 from the line.
Score: 35-34

[08:09] Team_088 possession (Score: 35-34)
Tobias Haliburton commits a violation (traveling/carry)! TURNOVER! (dead ball)

[08:09] Substitution (Team_028): Austin Russell OUT → Scottie Ingram IN (stamina_rule2)

[08:09] Substitution (Team_028): Carmelo Carter OUT → Tyrese Quickley IN (stamina_rule2)

[08:09] Substitution (Team_028): Myles Haliburton OUT → Miles Booker IN (stamina_rule2)

[08:09] Substitution (Team_028): Kawhi Ball OUT → Bam Towns IN (stamina_rule2)

[08:09] Substitution (Team_028): Jimmy Brogdon OUT → Collin Bridges IN (stamina_rule2)

[08:09] Substitution (Team_088): Josh Duncan OUT → Klay Quickley IN (stamina_rule2)

[08:09] Substitution (Team_088): Tobias Haliburton OUT → Vince Carter IN (stamina_rule2)

[08:09] Substitution (Team_088): Tyler Hyland OUT → Pau Bird IN (stamina_rule2)

[08:09] Substitution (Team_088): Giannis Smith OUT → Zion Harris IN (stamina_rule2)

[08:09] Substitution (Team_088): Allen Ming OUT → Josh Embiid IN (stamina_rule2)

[07:53] Team_028 possession (Score: 35-34)
Miles Booker attempts a 3Pt. Contested by Pau Bird (4.5 feet, ZONE). MILES BOOKER MAKES IT! Assist: Scottie Ingram
Score: 38-34

[07:37] Team_088 possession (Score: 38-34)
Pau Bird throws a bad pass! Stolen by Miles Booker! TURNOVER! (live ball)

[07:21] Team_028 possession (Score: 38-34)
Scottie Ingram attempts a Midrange. BLOCKED BY KLAY QUICKLEY! Ball is loose! Rebound secured by Zion Harris.

[07:09] Team_088 possession (Score: 38-34)
Klay Quickley attempts a 3Pt. Contested by Scottie Ingram (5.4 feet, ZONE). Klay Quickley misses. Rebound secured by Collin Bridges.

[06:55] Team_028 possession (Score: 38-34)
Miles Booker drives to the basket... Miles Booker loses control! Ball rolls out of bounds! TURNOVER! (dead ball)

[06:43] Team_088 possession (Score: 38-34)
Pau Bird attempts a 3Pt. Wide open! Bam Towns is 6.9 feet away. [ZONE] PAU BIRD MAKES IT! Assist: Josh Embiid
Score: 38-37

[06:29] Team_028 possession (Score: 38-37)
Miles Booker attempts a Layup. Heavily contested by Pau Bird (0.8 feet, MAN)! MILES BOOKER MAKES IT!
Score: 40-37

[06:13] Team_088 possession (Score: 40-37)
Klay Quickley makes the 3Pt and draws the foul on Scottie Ingram! And-1! Klay Quickley to the line for 1. [Team fouls: 1] (Scottie Ingram: 1 personal fouls)   FT 1/1: GOOD Klay Quickley makes 1/1 from the line.
Score: 40-41

[06:01] Team_028 possession (Score: 40-41)
Miles Booker drives, picks up Josh Embiid. Help arrives from Klay Quickley! Miles Booker attempts a Dunk. Heavily contested by Klay Quickley (1.5 feet, ZONE)! MILES BOOKER MAKES IT! Assist: Tyrese Quickley
Score: 42-41

[05:46] Team_088 possession (Score: 42-41)
Zion Harris drives, Collin Bridges stays with him. Zion Harris attempts a Dunk. Heavily contested by Collin Bridges (1.1 feet, MAN)! ZION HARRIS MAKES IT!
Score: 42-43

[05:31] Team_028 possession (Score: 42-43)
Bam Towns attempts a Midrange. Wide open! Zion Harris is 9.7 feet away. [MAN] Bam Towns misses. Rebound secured by Pau Bird.

[05:14] Team_088 possession (Score: 42-43)
Pau Bird attempts a 3Pt. Wide open! Scottie Ingram is 8.4 feet away. [ZONE] Pau Bird misses. Rebound secured by Collin Bridges.

[05:01] Team_028 possession (Score: 42-43)
Collin Bridges drives and kicks out. Scottie Ingram attempts a 3Pt. Wide open! Klay Quickley is 6.5 feet away. [MAN] SCOTTIE INGRAM MAKES IT! Assist: Tyrese Quickley
Score: 45-43

[04:50] Team_088 possession (Score: 45-43)
Pau Bird attempts a Midrange. Wide open! Miles Booker is 6.7 feet away. [MAN] PAU BIRD MAKES IT!
Score: 45-45

[04:40] Team_028 possession (Score: 45-45)
Tyrese Quickley attempts a Midrange. Contested by Vince Carter (3.8 feet, MAN). Tyrese Quickley misses. Rebound secured by Zion Harris.

[04:30] Team_088 possession (Score: 45-45)
Vince Carter attempts a 3Pt. Contested by Tyrese Quickley (5.9 feet, MAN). Vince Carter misses. Rebound secured by Collin Bridges.

[04:14] Team_028 possession (Score: 45-45)
Scottie Ingram attempts a 3Pt. Contested by Klay Quickley (4.6 feet, MAN). SCOTTIE INGRAM MAKES IT! Assist: Collin Bridges
Score: 48-45

[04:02] Team_088 possession (Score: 48-45)
FOUL! Shooting foul on Collin Bridges. Pau Bird to the line for 2 free throws. [Team fouls: 2] (Collin Bridges: 1 personal fouls)   FT 1/2: GOOD   FT 2/2: GOOD Pau Bird makes 2/2 from the line.
Score: 48-47

[03:43] Team_028 possession (Score: 48-47)
Bam Towns attempts a 3Pt. Contested by Zion Harris (4.2 feet, MAN). Bam Towns misses. Rebound secured by Zion Harris.

[03:28] Team_088 possession (Score: 48-47)
Zion Harris makes the Layup and draws the foul on Collin Bridges! And-1! Zion Harris to the line for 1. [Team fouls: 3] (Collin Bridges: 2 personal fouls)   FT 1/1: GOOD Zion Harris makes 1/1 from the line.
Score: 48-50

[03:14] Team_028 possession (Score: 48-50)
Tyrese Quickley makes the Layup and draws the foul on Zion Harris! And-1! Tyrese Quickley to the line for 1. [Team fouls: 2] (Zion Harris: 1 personal fouls)   FT 1/1: GOOD Tyrese Quickley makes 1/1 from the line.
Score: 51-50

[03:01] Team_088 possession (Score: 51-50)
Vince Carter attempts a Midrange. Wide open! Tyrese Quickley is 6.7 feet away. [MAN] Vince Carter misses. Rebound secured by Tyrese Quickley.

[02:46] Team_028 possession (Score: 51-50)
Scottie Ingram attempts a 3Pt. Wide open! Klay Quickley is 10.0 feet away. [MAN] Scottie Ingram misses. Rebound secured by Zion Harris.

[02:28] Team_088 possession (Score: 51-50)
FOUL! Holding foul on Collin Bridges. [Team fouls: 4] No free throws, side out. (Collin Bridges: 3 personal fouls)

[02:12] Team_088 possession (Score: 51-50)
Vince Carter attempts a 3Pt. Contested by Tyrese Quickley (5.7 feet, MAN). Vince Carter misses. Rebound secured by Collin Bridges.

[01:55] Team_028 possession (Score: 51-50)
Tyrese Quickley attempts a Midrange. Contested by Vince Carter (3.0 feet, MAN). Tyrese Quickley misses. Offensive rebound by Collin Bridges! Collin Bridges kicks it out.

[01:45] Team_028 possession (Score: 51-50)
Bam Towns attempts a Layup. Wide open! Zion Harris is 6.5 feet away. [MAN] BAM TOWNS MAKES IT! Assist: Collin Bridges
Score: 53-50

[01:30] Team_088 possession (Score: 53-50)
Josh Embiid attempts a Layup. BLOCKED BY COLLIN BRIDGES! Ball is loose! Offensive rebound by Pau Bird! Pau Bird kicks it out.

[01:14] Team_088 possession (Score: 53-50)
Zion Harris attempts a Midrange. Wide open! Collin Bridges is 7.5 feet away. [MAN] ZION HARRIS MAKES IT! Assist: Vince Carter
Score: 53-52

[01:01] Team_028 possession (Score: 53-52)
Tyrese Quickley drives and kicks out. Miles Booker attempts a 3Pt. Contested by Pau Bird (3.4 feet, ZONE). Miles Booker misses. Rebound secured by Josh Embiid.

[00:48] Team_088 possession (Score: 53-52)
Klay Quickley drives and kicks out. Pau Bird attempts a Midrange. Contested by Tyrese Quickley (4.1 feet, ZONE). Pau Bird misses. Rebound secured by Tyrese Quickley.

[00:34] Team_028 possession (Score: 53-52)
Collin Bridges drives, Zion Harris stays with him. Collin Bridges attempts a Layup. Wide open! Zion Harris is 6.6 feet away. [ZONE] COLLIN BRIDGES MAKES IT! Assist: Miles Booker
Score: 55-52

[00:20] Team_088 possession (Score: 55-52)
FOUL! Reach-in foul on Miles Booker during the drive. [IN THE BONUS! 5 team fouls] Pau Bird to the line for 2 free throws. (Miles Booker: 1 personal fouls)   FT 1/2: GOOD   FT 2/2: GOOD Pau Bird makes 2/2 from the line.
Score: 55-54

[00:01] Team_028 possession (Score: 55-54)
Collin Bridges attempts a Layup. Contested by Josh Embiid (5.4 feet, MAN). Collin Bridges misses. Rebound secured by Pau Bird.

================================================================================
                              2ND QUARTER COMPLETE                              
================================================================================

2ND QUARTER SCORE: Team_028 29, Team_088 27

BOX SCORE:
================================================================================

Team_028
--------------------------------------------------------------------------------
Player                MIN  PTS  REB  AST  TO      FG   FG%      3P   3P%
--------------------------------------------------------------------------------
Miles Booker            8    7    0    1   0   3/3   100.0     0/0   0.0
Scottie Ingram          8    6    0    1   0   2/4    50.0     0/0   0.0
Jimmy Brogdon          16    4    1    1   0   2/3    66.7     0/0   0.0
Myles Haliburton       16    3    0    0   0   1/1   100.0     0/0   0.0
Tyrese Quickley         8    3    2    2   0   1/3    33.3     0/0   0.0
Kawhi Ball             16    2    3    0   0   1/1   100.0     0/0   0.0
Collin Bridges          8    2    5    2   0   1/2    50.0     0/0   0.0
Bam Towns               8    2    0    0   0   1/3    33.3     0/0   0.0
Carmelo Carter         16    0    0    1   0   0/0     0.0     0/0   0.0
Austin Russell         16    0    0    0   0   0/1     0.0     0/0   0.0

TEAM: FG: 12/21 (57.1%), 3PT: 4/7 (57.1%), REB: 11 (2 off, 9 def), AST: 8, TO: 2
TEAM FOULS: 5 [Team_088 in BONUS]


Team_088
--------------------------------------------------------------------------------
Player                MIN  PTS  REB  AST  TO      FG   FG%      3P   3P%
--------------------------------------------------------------------------------
Pau Bird                8    9    3    0   0   4/5    80.0     0/0   0.0
Zion Harris             8    7    4    0   0   3/3   100.0     0/0   0.0
Klay Quickley           8    4    0    0   0   1/3    33.3     0/0   0.0
Josh Duncan            16    3    0    0   0   1/2    50.0     0/0   0.0
Giannis Smith          16    2    1    1   0   1/1   100.0     0/0   0.0
Allen Ming             16    2    2    0   0   1/2    50.0     0/0   0.0
Tobias Haliburton      16    0    0    1   0   0/1     0.0     0/0   0.0
Tyler Hyland           16    0    1    1   0   0/0     0.0     0/0   0.0
Josh Embiid             8    0    1    1   0   0/0     0.0     0/0   0.0
Vince Carter            8    0    0    1   0   0/3     0.0     0/0   0.0

TEAM: FG: 11/20 (55.0%), 3PT: 3/8 (37.5%), REB: 12 (3 off, 9 def), AST: 5, TO: 2
TEAM FOULS: 2

================================================================================

================================================================================
                       3RD QUARTER - Team_028 vs Team_088                       
================================================================================

[12:00] Team_028 possession (Score: 55-54)
Kawhi Ball drives, picks up Giannis Smith. Help arrives from Tobias Haliburton! Kawhi Ball attempts a Layup. Contested by Tobias Haliburton (3.2 feet, ZONE). KAWHI BALL MAKES IT! Assist: Jimmy Brogdon
Score: 57-54

[11:44] Team_088 possession (Score: 57-54)
Tyler Hyland attempts a 3Pt. Contested by Austin Russell (2.4 feet, ZONE). Tyler Hyland misses. Rebound secured by Kawhi Ball.

[11:30] Team_028 possession (Score: 57-54)
Austin Russell attempts a 3Pt. Contested by Tobias Haliburton (2.0 feet, ZONE). Austin Russell misses. Offensive rebound by Jimmy Brogdon! Jimmy Brogdon kicks it out.

[11:16] Team_028 possession (Score: 57-54)
Jimmy Brogdon attempts a Layup. Heavily contested by Allen Ming (2.0 feet, MAN)! JIMMY BROGDON MAKES IT! Assist: Austin Russell
Score: 59-54

[11:00] Team_088 possession (Score: 59-54)
Allen Ming drives and kicks out. Josh Duncan attempts a 3Pt. Contested by Austin Russell (4.6 feet, ZONE). JOSH DUNCAN MAKES IT! Assist: Allen Ming
Score: 59-57

[10:47] Team_028 possession (Score: 59-57)
Kawhi Ball attempts a Midrange. Wide open! Tobias Haliburton is 7.4 feet away. [ZONE] Kawhi Ball misses. Rebound secured by Giannis Smith.

[10:35] Team_088 possession (Score: 59-57)
FOUL! Holding foul on Kawhi Ball. [Team fouls: 1] No free throws, side out. (Kawhi Ball: 1 personal fouls)

[10:22] Team_088 possession (Score: 59-57)
Giannis Smith loses the ball! Stripped by Kawhi Ball! TURNOVER! (live ball)

[10:10] Team_028 possession (Score: 59-57)
Kawhi Ball loses the ball! Stripped by Giannis Smith! TURNOVER! (live ball)

[09:56] Team_088 possession (Score: 59-57)
Tobias Haliburton attempts a Layup. BLOCKED BY MYLES HALIBURTON! Ball is loose! Offensive rebound by Allen Ming! Allen Ming kicks it out.

[09:36] Team_088 possession (Score: 59-57)
Giannis Smith attempts a Midrange. Contested by Kawhi Ball (2.0 feet, MAN). Giannis Smith misses. Rebound secured by Carmelo Carter.

[09:21] Team_028 possession (Score: 59-57)
Jimmy Brogdon drives, picks up Allen Ming. Help arrives from Tobias Haliburton! Jimmy Brogdon attempts a Layup. Contested by Tobias Haliburton (3.9 feet, MAN). JIMMY BROGDON MAKES IT!
Score: 61-57

[09:08] Team_088 possession (Score: 61-57)
Allen Ming makes the Layup and draws the foul on Jimmy Brogdon! And-1! Allen Ming to the line for 1. [Team fouls: 2] (Jimmy Brogdon: 1 personal fouls)   FT 1/1: GOOD Allen Ming makes 1/1 from the line.
Score: 61-60

[08:50] Team_028 possession (Score: 61-60)
FOUL! Shooting foul on Giannis Smith. Jimmy Brogdon to the line for 2 free throws. [Team fouls: 1] (Giannis Smith: 1 personal fouls)   FT 1/2: MISS   FT 2/2: MISS Jimmy Brogdon makes 0/2 from the line. Rebound secured by Giannis Smith.

[08:36] Team_088 possession (Score: 61-60)
Tobias Haliburton drives, Kawhi Ball stays with him. Tobias Haliburton attempts a Dunk. Contested by Kawhi Ball (5.3 feet, ZONE). TOBIAS HALIBURTON MAKES IT! Assist: Tyler Hyland
Score: 61-62

[08:23] Team_028 possession (Score: 61-62)
Austin Russell loses the ball! Stripped by Josh Duncan! TURNOVER! (live ball)

[08:06] Team_088 possession (Score: 61-62)
Giannis Smith attempts a 3Pt. Contested by Austin Russell (5.8 feet, ZONE). Giannis Smith misses. Rebound secured by Jimmy Brogdon.

[07:50] Team_028 possession (Score: 61-62)
Kawhi Ball attempts a 3Pt. Contested by Tobias Haliburton (6.0 feet, ZONE). Kawhi Ball misses. Rebound secured by Allen Ming.

[07:33] Team_088 possession (Score: 61-62)
FOUL! Reach-in foul on Kawhi Ball during the drive. [Team fouls: 3] No free throws, side out. (Kawhi Ball: 2 personal fouls)

[07:16] Team_088 possession (Score: 61-62)
Josh Duncan attempts a Midrange. Wide open! Kawhi Ball is 8.8 feet away. [ZONE] Josh Duncan misses. Rebound secured by Kawhi Ball.

[07:02] Team_028 possession (Score: 61-62)
Kawhi Ball attempts a 3Pt. Heavily contested by Giannis Smith (1.2 feet, MAN)! Kawhi Ball misses. Offensive rebound by Kawhi Ball! Kawhi Ball kicks it out.

[06:50] Team_028 possession (Score: 61-62)
Austin Russell throws a bad pass! Stolen by Josh Duncan! TURNOVER! (live ball)

[06:38] Team_088 possession (Score: 61-62)
Tyler Hyland attempts a 3Pt. Heavily contested by Myles Haliburton (1.0 feet, MAN)! Tyler Hyland misses. Rebound secured by Jimmy Brogdon.

[06:24] Team_028 possession (Score: 61-62)
Austin Russell attempts a 3Pt. Contested by Josh Duncan (6.0 feet, MAN). AUSTIN RUSSELL MAKES IT! Assist: Kawhi Ball
Score: 64-62

[06:05] Team_088 possession (Score: 64-62)
Tobias Haliburton drives to the basket... Tobias Haliburton throws a bad pass! Stolen by Carmelo Carter! TURNOVER! (live ball)

[05:51] Team_028 possession (Score: 64-62)
Myles Haliburton attempts a 3Pt. Contested by Tyler Hyland (4.9 feet, MAN). Myles Haliburton misses. Rebound secured by Allen Ming.

[05:33] Team_088 possession (Score: 64-62)
Giannis Smith drives and kicks out. Giannis Smith attempts a Midrange. Contested by Carmelo Carter (3.8 feet, ZONE). Giannis Smith misses. Rebound secured by Carmelo Carter.

[05:20] Team_028 possession (Score: 64-62)
Myles Haliburton makes the Layup and draws the foul on Tyler Hyland! And-1! Myles Haliburton to the line for 1. [Team fouls: 2] (Tyler Hyland: 1 personal fouls)   FT 1/1: GOOD Myles Haliburton makes 1/1 from the line.
Score: 67-62

[05:04] Team_088 possession (Score: 67-62)
Giannis Smith attempts a Midrange. Contested by Carmelo Carter (2.5 feet, ZONE). Giannis Smith misses. Offensive rebound by Giannis Smith! Giannis Smith's putback is no good. Offensive rebound by Allen Ming! Allen Ming kicks it out.

[04:50] Team_088 possession (Score: 67-62)
Allen Ming attempts a Midrange. Wide open! Jimmy Brogdon is 6.2 feet away. [MAN] Allen Ming misses. Rebound secured by Carmelo Carter.

[04:32] Team_028 possession (Score: 67-62)
Austin Russell drives, picks up Giannis Smith. Help arrives from Tobias Haliburton! Austin Russell attempts a Dunk. Contested by Tobias Haliburton (2.3 feet, ZONE). AUSTIN RUSSELL MAKES IT!
Score: 69-62

[04:20] Team_088 possession (Score: 69-62)
Tobias Haliburton attempts a 3Pt. Contested by Austin Russell (5.3 feet, ZONE). TOBIAS HALIBURTON MAKES IT! Assist: Josh Duncan
Score: 69-65

[04:03] Team_028 possession (Score: 69-65)
Jimmy Brogdon drives and kicks out. Kawhi Ball attempts a Midrange. Heavily contested by Giannis Smith (1.1 feet, MAN)! Kawhi Ball misses. Rebound secured by Allen Ming.

[03:51] Team_088 possession (Score: 69-65)
Josh Duncan attempts a 3Pt. Contested by Austin Russell (5.4 feet, MAN). Josh Duncan misses. Rebound secured by Kawhi Ball.

[03:40] Team_028 possession (Score: 69-65)
Austin Russell drives, Josh Duncan stays with him. Austin Russell attempts a Layup. Heavily contested by Josh Duncan (0.5 feet, MAN)! AUSTIN RUSSELL MAKES IT! Assist: Carmelo Carter
Score: 71-65

[03:31] Team_088 possession (Score: 71-65)
Giannis Smith attempts a 3Pt. Contested by Kawhi Ball (5.3 feet, MAN). GIANNIS SMITH MAKES IT! Assist: Josh Duncan
Score: 71-68

[03:18] Team_028 possession (Score: 71-68)
Carmelo Carter attempts a 3Pt. Wide open! Tobias Haliburton is 7.3 feet away. [MAN] CARMELO CARTER MAKES IT! Assist: Kawhi Ball
Score: 74-68

[03:02] Team_088 possession (Score: 74-68)
Allen Ming attempts a Midrange. Contested by Jimmy Brogdon (5.9 feet, MAN). ALLEN MING MAKES IT! Assist: Giannis Smith
Score: 74-70

[02:46] Team_028 possession (Score: 74-70)
Kawhi Ball makes the Midrange and draws the foul on Tyler Hyland! And-1! Kawhi Ball to the line for 1. [Team fouls: 3] (Tyler Hyland: 2 personal fouls)   FT 1/1: GOOD Kawhi Ball makes 1/1 from the line.
Score: 77-70

[02:28] Team_088 possession (Score: 77-70)
Tobias Haliburton attempts a 3Pt. Contested by Austin Russell (5.6 feet, ZONE). Tobias Haliburton misses. Rebound secured by Kawhi Ball.

[02:09] Team_028 possession (Score: 77-70)
Jimmy Brogdon attempts a Layup. Contested by Allen Ming (5.2 feet, MAN). Jimmy Brogdon misses. Rebound secured by Tyler Hyland.

[01:57] Team_088 possession (Score: 77-70)
Giannis Smith attempts a Midrange. Wide open! Kawhi Ball is 9.0 feet away. [MAN] GIANNIS SMITH MAKES IT! Assist: Tyler Hyland
Score: 77-72

[01:43] Team_028 possession (Score: 77-72)
Austin Russell attempts a 3Pt. Wide open! Tobias Haliburton is 6.9 feet away. [ZONE] Austin Russell misses. Rebound secured by Allen Ming.

[01:27] Team_088 possession (Score: 77-72)
Giannis Smith drives to the basket... Giannis Smith commits a violation (traveling/carry)! TURNOVER! (dead ball)

[01:27] Substitution (Team_028): Austin Russell OUT → Scottie Ingram IN (stamina_rule2)

[01:27] Substitution (Team_028): Carmelo Carter OUT → Tyrese Quickley IN (stamina_rule2)

[01:27] Substitution (Team_028): Myles Haliburton OUT → Miles Booker IN (stamina_rule2)

[01:27] Substitution (Team_028): Kawhi Ball OUT → Bam Towns IN (stamina_rule2)

[01:27] Substitution (Team_028): Jimmy Brogdon OUT → Collin Bridges IN (stamina_rule2)

[01:27] Substitution (Team_088): Josh Duncan OUT → Klay Quickley IN (stamina_rule2)

[01:27] Substitution (Team_088): Tobias Haliburton OUT → Vince Carter IN (stamina_rule2)

[01:27] Substitution (Team_088): Tyler Hyland OUT → Pau Bird IN (stamina_rule2)

[01:27] Substitution (Team_088): Giannis Smith OUT → Zion Harris IN (stamina_rule2)

[01:27] Substitution (Team_088): Allen Ming OUT → Josh Embiid IN (stamina_rule2)

[01:12] Team_028 possession (Score: 77-72)
Miles Booker makes the Layup and draws the foul on Pau Bird! And-1! Miles Booker to the line for 1. [Team fouls: 4] (Pau Bird: 1 personal fouls)   FT 1/1: GOOD Miles Booker makes 1/1 from the line.
Score: 80-72

[00:57] Team_088 possession (Score: 80-72)
Zion Harris attempts a Midrange. Contested by Tyrese Quickley (3.9 feet, ZONE). Zion Harris misses. Rebound secured by Tyrese Quickley.

[00:38] Team_028 possession (Score: 80-72)
Scottie Ingram drives and kicks out. Collin Bridges makes the Midrange and draws the foul on Pau Bird! And-1! Collin Bridges to the line for 1. [BONUS: 5 team fouls] (Pau Bird: 2 personal fouls)   FT 1/1: GOOD Collin Bridges makes 1/1 from the line.
Score: 83-72

[00:21] Team_088 possession (Score: 83-72)
Josh Embiid drives to the basket... FOUL! Offensive foul on Josh Embiid! Collin Bridges drew the charge! [Team fouls: 6] (Josh Embiid: 1 personal fouls) TURNOVER! (dead ball)

[00:07] Team_028 possession (Score: 83-72)
Miles Booker drives and kicks out. Miles Booker attempts a Midrange. Contested by Zion Harris (6.0 feet, ZONE). Miles Booker misses. Offensive rebound by Bam Towns! Bam Towns kicks it out.

================================================================================
                              3RD QUARTER COMPLETE                              
================================================================================

3RD QUARTER SCORE: Team_028 28, Team_088 18

BOX SCORE:
================================================================================

Team_028
--------------------------------------------------------------------------------
Player                MIN  PTS  REB  AST  TO      FG   FG%      3P   3P%
--------------------------------------------------------------------------------
Austin Russell         27    7    0    1   0   3/4    75.0     0/0   0.0
Kawhi Ball             27    5    5    2   0   2/4    50.0     0/0   0.0
Jimmy Brogdon          27    4    3    1   0   2/5    40.0     0/0   0.0
Carmelo Carter         27    3    3    1   0   1/1   100.0     0/0   0.0
Myles Haliburton       27    3    0    0   0   1/2    50.0     0/0   0.0
Miles Booker            9    3    0    0   0   1/1   100.0     0/0   0.0
Collin Bridges          9    3    0    0   0   1/1   100.0     0/0   0.0
Tyrese Quickley         9    0    1    0   0   0/0     0.0     0/0   0.0
Bam Towns               9    0    1    0   0   0/0     0.0     0/0   0.0

TEAM: FG: 11/18 (61.1%), 3PT: 2/5 (40.0%), REB: 13 (3 off, 10 def), AST: 5, TO: 3
TEAM FOULS: 3


Team_088
--------------------------------------------------------------------------------
Player                MIN  PTS  REB  AST  TO      FG   FG%      3P   3P%
--------------------------------------------------------------------------------
Allen Ming             27    5    6    1   0   2/3    66.7     0/0   0.0
Giannis Smith          27    5    2    1   0   2/5    40.0     0/0   0.0
Tobias Haliburton      27    5    0    0   0   2/3    66.7     0/0   0.0
Josh Duncan            27    3    0    2   0   1/3    33.3     0/0   0.0
Tyler Hyland           27    0    1    2   0   0/2     0.0     0/0   0.0
Zion Harris             9    0    0    0   0   0/1     0.0     0/0   0.0

TEAM: FG: 7/17 (41.2%), 3PT: 2/7 (28.6%), REB: 9 (2 off, 7 def), AST: 6, TO: 4
TEAM FOULS: 6 [Team_028 in BONUS]

================================================================================

================================================================================
                       4TH QUARTER - Team_028 vs Team_088                       
================================================================================

[12:00] Team_028 possession (Score: 83-72)
Jimmy Brogdon drives, Giannis Smith stays with him. Jimmy Brogdon attempts a Dunk. Heavily contested by Giannis Smith (1.8 feet, ZONE)! JIMMY BROGDON MAKES IT!
Score: 85-72

[11:44] Team_088 possession (Score: 85-72)
Josh Duncan attempts a 3Pt. Contested by Austin Russell (3.8 feet, ZONE). JOSH DUNCAN MAKES IT! Assist: Tobias Haliburton
Score: 85-75

[11:28] Team_028 possession (Score: 85-75)
Jimmy Brogdon makes the Layup and draws the foul on Allen Ming! And-1! Jimmy Brogdon to the line for 1. [Team fouls: 1] (Allen Ming: 1 personal fouls)   FT 1/1: GOOD Jimmy Brogdon makes 1/1 from the line.
Score: 88-75

[11:11] Team_088 possession (Score: 88-75)
Allen Ming attempts a Midrange. Contested by Myles Haliburton (2.5 feet, ZONE). ALLEN MING MAKES IT!
Score: 88-77

[10:55] Team_028 possession (Score: 88-77)
Austin Russell attempts a 3Pt. Wide open! Tobias Haliburton is 6.1 feet away. [ZONE] Austin Russell misses. Rebound secured by Allen Ming.

[10:41] Team_088 possession (Score: 88-77)
Allen Ming attempts a Layup. Wide open! Kawhi Ball is 7.0 feet away. [ZONE] Allen Ming misses. Offensive rebound by Giannis Smith! Giannis Smith's putback is no good. Rebound secured by Carmelo Carter.

[10:27] Team_028 possession (Score: 88-77)
Jimmy Brogdon drives and kicks out. Jimmy Brogdon attempts a 3Pt. Contested by Tyler Hyland (4.4 feet, ZONE). Jimmy Brogdon misses. Offensive rebound by Kawhi Ball! Kawhi Ball kicks it out.

[10:11] Team_028 possession (Score: 88-77)
Austin Russell loses the ball! Stripped by Josh Duncan! TURNOVER! (live ball)

[09:58] Team_088 possession (Score: 88-77)
Allen Ming drives, Kawhi Ball stays with him. Allen Ming attempts a Dunk. Contested by Kawhi Ball (3.2 feet, ZONE). Allen Ming misses. Rebound secured by Kawhi Ball.

[09:44] Team_028 possession (Score: 88-77)
Kawhi Ball attempts a Midrange. Wide open! Giannis Smith is 6.4 feet away. [MAN] KAWHI BALL MAKES IT!
Score: 90-77

[09:28] Team_088 possession (Score: 90-77)
Giannis Smith attempts a Layup. Contested by Kawhi Ball (5.5 feet, ZONE). GIANNIS SMITH MAKES IT!
Score: 90-79

[09:17] Team_028 possession (Score: 90-79)
Kawhi Ball drives to the basket... Kawhi Ball loses control! Ball rolls out of bounds! TURNOVER! (dead ball)

[09:17] Substitution (Team_028): Austin Russell OUT → Scottie Ingram IN (stamina_rule2)

[09:17] Substitution (Team_028): Carmelo Carter OUT → Tyrese Quickley IN (stamina_rule2)

[09:17] Substitution (Team_028): Myles Haliburton OUT → Miles Booker IN (stamina_rule2)

[09:17] Substitution (Team_028): Kawhi Ball OUT → Bam Towns IN (stamina_rule2)

[09:17] Substitution (Team_028): Jimmy Brogdon OUT → Collin Bridges IN (stamina_rule2)

[09:17] Substitution (Team_088): Josh Duncan OUT → Klay Quickley IN (stamina_rule2)

[09:17] Substitution (Team_088): Tobias Haliburton OUT → Vince Carter IN (stamina_rule2)

[09:17] Substitution (Team_088): Tyler Hyland OUT → Pau Bird IN (stamina_rule2)

[09:17] Substitution (Team_088): Giannis Smith OUT → Zion Harris IN (stamina_rule2)

[09:17] Substitution (Team_088): Allen Ming OUT → Josh Embiid IN (stamina_rule2)

[09:04] Team_088 possession (Score: 90-79)
Vince Carter attempts a Midrange. Wide open! Tyrese Quickley is 7.8 feet away. [MAN] Vince Carter misses. Offensive rebound by Pau Bird! Pau Bird kicks it out.

[08:49] Team_088 possession (Score: 90-79)
Pau Bird drives and kicks out. Vince Carter attempts a Midrange. Contested by Tyrese Quickley (3.1 feet, MAN). VINCE CARTER MAKES IT! Assist: Pau Bird
Score: 90-81

[08:40] Team_028 possession (Score: 90-81)
Scottie Ingram attempts a Midrange. Wide open! Klay Quickley is 8.4 feet away. [MAN] Scottie Ingram misses. Rebound secured by Josh Embiid.

[08:29] Team_088 possession (Score: 90-81)
FOUL! Holding foul on Scottie Ingram. [Team fouls: 1] No free throws, side out. (Scottie Ingram: 1 personal fouls)

[08:14] Team_088 possession (Score: 90-81)
Klay Quickley throws a bad pass out of bounds! TURNOVER! (dead ball)

[08:02] Team_028 possession (Score: 90-81)
Scottie Ingram attempts a Layup. Wide open! Zion Harris is 6.5 feet away. [ZONE] SCOTTIE INGRAM MAKES IT! Assist: Bam Towns
Score: 92-81

[07:51] Team_088 possession (Score: 92-81)
Josh Embiid attempts a Layup. Heavily contested by Collin Bridges (0.5 feet, ZONE)! Josh Embiid misses. Rebound secured by Bam Towns.

[07:37] Team_028 possession (Score: 92-81)
Collin Bridges drives and kicks out. Collin Bridges attempts a 3Pt. Contested by Pau Bird (5.2 feet, ZONE). Collin Bridges misses. Rebound secured by Pau Bird.

[07:22] Team_088 possession (Score: 92-81)
FOUL! Offensive foul on Zion Harris! Collin Bridges drew the charge! [Team fouls: 2] (Zion Harris: 1 personal fouls) TURNOVER! (dead ball)

[07:09] Team_028 possession (Score: 92-81)
Tyrese Quickley attempts a Midrange. Wide open! Vince Carter is 6.6 feet away. [MAN] Tyrese Quickley misses. Rebound secured by Zion Harris.

[06:54] Team_088 possession (Score: 92-81)
Josh Embiid attempts a Layup. BLOCKED BY COLLIN BRIDGES! Ball is loose! Rebound secured by Bam Towns.

[06:35] Team_028 possession (Score: 92-81)
Scottie Ingram attempts a 3Pt. Contested by Pau Bird (4.7 feet, ZONE). SCOTTIE INGRAM MAKES IT! Assist: Collin Bridges
Score: 95-81

[06:22] Team_088 possession (Score: 95-81)
Josh Embiid attempts a Layup. Heavily contested by Collin Bridges (1.5 feet, MAN)! JOSH EMBIID MAKES IT! Assist: Zion Harris
Score: 95-83

[06:08] Team_028 possession (Score: 95-83)
Tyrese Quickley attempts a Layup. Contested by Vince Carter (3.0 feet, MAN). Tyrese Quickley misses. Rebound secured by Pau Bird.

[05:49] Team_088 possession (Score: 95-83)
Zion Harris makes the Dunk and draws the foul on Collin Bridges! And-1! Zion Harris to the line for 1. [Team fouls: 2] (Collin Bridges: 1 personal fouls)   FT 1/1: GOOD Zion Harris makes 1/1 from the line.
Score: 95-86

[05:37] Team_028 possession (Score: 95-86)
Tyrese Quickley attempts a 3Pt. Contested by Vince Carter (3.2 feet, MAN). Tyrese Quickley misses. Rebound secured by Pau Bird.

[05:23] Team_088 possession (Score: 95-86)
Pau Bird attempts a 3Pt. Contested by Scottie Ingram (5.5 feet, ZONE). PAU BIRD MAKES IT! Assist: Zion Harris
Score: 95-89

[05:08] Team_028 possession (Score: 95-89)
Scottie Ingram attempts a 3Pt. Contested by Pau Bird (3.8 feet, ZONE). Scottie Ingram misses. Offensive rebound by Collin Bridges! Collin Bridges kicks it out.

[04:55] Team_028 possession (Score: 95-89)
Collin Bridges attempts a Midrange. Contested by Josh Embiid (5.4 feet, MAN). Collin Bridges misses. Offensive rebound by Bam Towns! Bam Towns kicks it out.

[04:40] Team_028 possession (Score: 95-89)
Tyrese Quickley attempts a 3Pt. Contested by Vince Carter (5.3 feet, MAN). Tyrese Quickley misses. Offensive rebound by Bam Towns! Bam Towns kicks it out.

[04:30] Team_028 possession (Score: 95-89)
Bam Towns attempts a Midrange. Contested by Vince Carter (6.0 feet, ZONE). Bam Towns misses. Offensive rebound by Bam Towns! Bam Towns kicks it out.

[04:13] Team_028 possession (Score: 95-89)
Tyrese Quickley attempts a 3Pt. Contested by Vince Carter (4.5 feet, ZONE). Tyrese Quickley misses. Rebound secured by Josh Embiid.

[03:54] Team_088 possession (Score: 95-89)
Klay Quickley attempts a Layup. Heavily contested by Collin Bridges (0.9 feet, ZONE)! KLAY QUICKLEY MAKES IT! Assist: Zion Harris
Score: 95-91

[03:38] Team_028 possession (Score: 95-91)
FOUL! Shooting foul on Pau Bird. Scottie Ingram to the line for 2 free throws. [Team fouls: 3] (Pau Bird: 1 personal fouls)   FT 1/2: MISS   FT 2/2: GOOD Scottie Ingram makes 1/2 from the line.
Score: 96-91

[03:22] Team_088 possession (Score: 96-91)
Zion Harris attempts a 3Pt. Wide open! Scottie Ingram is 8.7 feet away. [ZONE] Zion Harris misses. Rebound secured by Bam Towns.

[03:09] Team_028 possession (Score: 96-91)
Tyrese Quickley attempts a 3Pt. Wide open! Vince Carter is 7.3 feet away. [MAN] Tyrese Quickley misses. FOUL! Loose ball foul on Zion Harris during the rebound battle. [Team fouls: 4] No free throws, side out. (Zion Harris: 2 personal fouls)

[02:57] Team_028 possession (Score: 96-91)
Collin Bridges attempts a Midrange. Wide open! Josh Embiid is 9.2 feet away. [MAN] COLLIN BRIDGES MAKES IT!
Score: 98-91

[02:46] Team_088 possession (Score: 98-91)
Vince Carter attempts a 3Pt. Heavily contested by Scottie Ingram (0.6 feet, ZONE)! Vince Carter misses. Rebound secured by Collin Bridges.

[02:36] Team_028 possession (Score: 98-91)
FOUL! Offensive foul on Miles Booker! Pau Bird drew the charge! [Team fouls: 3] (Miles Booker: 1 personal fouls) TURNOVER! (dead ball)

[02:23] Team_088 possession (Score: 98-91)
FOUL! Reach-in foul on Collin Bridges during the drive. [Team fouls: 4] No free throws, side out. (Collin Bridges: 2 personal fouls)

[02:08] Team_088 possession (Score: 98-91)
Klay Quickley attempts a Midrange. Wide open! Scottie Ingram is 10.0 feet away. [MAN] Klay Quickley misses. Rebound secured by Tyrese Quickley.

[01:53] Team_028 possession (Score: 98-91)
Scottie Ingram loses the ball! Stripped by Klay Quickley! TURNOVER! (live ball)

[01:41] Team_088 possession (Score: 98-91)
Pau Bird drives and kicks out. Pau Bird attempts a Midrange. Wide open! Miles Booker is 7.6 feet away. [MAN] PAU BIRD MAKES IT! Assist: Vince Carter
Score: 98-93

[01:28] Team_028 possession (Score: 98-93)
Collin Bridges loses control! Ball rolls out of bounds! TURNOVER! (dead ball)

[01:10] Team_088 possession (Score: 98-93)
Zion Harris attempts a 3Pt. Wide open! Scottie Ingram is 7.5 feet away. [ZONE] ZION HARRIS MAKES IT! Assist: Josh Embiid
Score: 98-96

[00:55] Team_028 possession (Score: 98-96)
Miles Booker attempts a Layup. Contested by Pau Bird (4.9 feet, MAN). MILES BOOKER MAKES IT! Assist: Collin Bridges
Score: 100-96

[00:42] Team_088 possession (Score: 100-96)
Zion Harris attempts a Midrange. Wide open! Miles Booker is 9.8 feet away. [ZONE] ZION HARRIS MAKES IT!
Score: 100-98

[00:32] Team_028 possession (Score: 100-98)
Bam Towns attempts a 3Pt. Contested by Pau Bird (5.8 feet, ZONE). BAM TOWNS MAKES IT!
Score: 103-98

[00:18] Team_088 possession (Score: 103-98)
Josh Embiid drives to the basket... Josh Embiid throws a bad pass! Stolen by Bam Towns! TURNOVER! (live ball)

[00:04] Team_028 possession (Score: 103-98)
Collin Bridges attempts a 3Pt. BLOCKED BY PAU BIRD! Ball is loose! Offensive rebound by Collin Bridges! Collin Bridges kicks it out.

================================================================================
                              4TH QUARTER COMPLETE                              
================================================================================

4TH QUARTER SCORE: Team_028 20, Team_088 26

BOX SCORE:
================================================================================

Team_028
--------------------------------------------------------------------------------
Player                MIN  PTS  REB  AST  TO      FG   FG%      3P   3P%
--------------------------------------------------------------------------------
Scottie Ingram         19    6    0    0   0   3/4    75.0     0/0   0.0
Jimmy Brogdon          30    5    0    0   0   2/2   100.0     0/0   0.0
Bam Towns              19    3    7    1   0   1/1   100.0     0/0   0.0
Kawhi Ball             30    2    2    0   0   1/1   100.0     0/0   0.0
Collin Bridges         19    2    3    2   0   1/2    50.0     0/0   0.0
Miles Booker           19    2    0    0   0   1/1   100.0     0/0   0.0
Austin Russell         30    0    0    0   0   0/1     0.0     0/0   0.0
Tyrese Quickley        19    0    1    0   0   0/4     0.0     0/0   0.0

TEAM: FG: 9/16 (56.2%), 3PT: 2/5 (40.0%), REB: 13 (7 off, 6 def), AST: 3, TO: 5
TEAM FOULS: 4


Team_088
--------------------------------------------------------------------------------
Player                MIN  PTS  REB  AST  TO      FG   FG%      3P   3P%
--------------------------------------------------------------------------------
Zion Harris            19    8    1    3   0   3/4    75.0     0/0   0.0
Pau Bird               19    5    4    1   0   2/2   100.0     0/0   0.0
Josh Duncan            30    3    0    0   0   1/1   100.0     0/0   0.0
Allen Ming             30    2    1    0   0   1/3    33.3     0/0   0.0
Giannis Smith          30    2    0    0   0   1/1   100.0     0/0   0.0
Vince Carter           19    2    0    1   0   1/2    50.0     0/0   0.0
Josh Embiid            19    2    2    1   0   1/3    33.3     0/0   0.0
Klay Quickley          19    2    0    0   0   1/2    50.0     0/0   0.0
Tobias Haliburton      30    0    0    1   0   0/0     0.0     0/0   0.0
Carmelo Carter         30    0    1    0   0   0/0     0.0     0/0   0.0

TEAM: FG: 11/18 (61.1%), 3PT: 3/5 (60.0%), REB: 9 (2 off, 7 def), AST: 7, TO: 3
TEAM FOULS: 5 [Team_028 in BONUS]

================================================================================

================================================================================
                               FULL GAME COMPLETE                               
================================================================================

FINAL SCORE: Team_028 103, Team_088 98

SCORING BY QUARTER:
--------------------------------------------------------------------------------
Team                     Q1     Q2     Q3     Q4    FINAL
--------------------------------------------------------------------------------
Team_028                 26     29     28     20      103
Team_088                 27     27     18     26       98
--------------------------------------------------------------------------------

FULL GAME BOX SCORE:
================================================================================

Team_028
--------------------------------------------------------------------------------
Player                MIN  PTS  REB  AST  TO      FG   FG%      3P   3P%      FT STL BLK
--------------------------------------------------------------------------------
Austin Russell         30    9    0    2   3   4/9    44.4   1/6    16.7   0/0     0   0
Carmelo Carter         30    5    8    3   1   2/4    50.0   1/2    50.0   0/0     1   2
Myles Haliburton       30   12    0    0   0   4/8    50.0   1/2    50.0   3/3     1   1
Kawhi Ball             30   19   14    3   4   9/13   69.2   1/4    25.0   5/8     1   1
Jimmy Brogdon          30   18    9    3   0   8/13   61.5   0/0     0.0   3/6     0   0
Scottie Ingram         19   12    0    1   1   5/8    62.5   2/3    66.7   1/2     0   0
Tyrese Quickley        19    3    4    2   0   1/7    14.3   0/2     0.0   1/1     0   0
Miles Booker           19   12    0    1   2   5/5   100.0   1/1   100.0   1/1     1   0
Bam Towns              19    5    8    1   0   2/4    50.0   1/2    50.0   0/0     1   0
Collin Bridges         19    7    8    4   1   3/5    60.0   0/0     0.0   1/1     0   2

TEAM: FG: 44/77 (57.1%), 3PT: 8/22 (36.4%), REB: 51 (17 off, 34 def), AST: 20, TO: 12


Team_088
--------------------------------------------------------------------------------
Player                MIN  PTS  REB  AST  TO      FG   FG%      3P   3P%      FT STL BLK
--------------------------------------------------------------------------------
Josh Duncan            30    9    0    5   1   2/7    28.6   2/3    66.7   0/0     3   0
Tobias Haliburton      30   14    0    2   1   7/12   58.3   4/9    44.4   2/3     0   0
Tyler Hyland           30   11    4    3   2   4/9    44.4   4/6    66.7   6/8     0   0
Giannis Smith          30    9    7    2   1   5/9    55.6   2/3    66.7   0/0     3   0
Allen Ming             30   15   16    1   1   5/10   50.0   0/0     0.0   3/3     1   0
Klay Quickley          19    6    0    0   1   2/5    40.0   1/2    50.0   1/1     1   1
Vince Carter           19    2    0    2   0   0/4     0.0   0/3     0.0   0/0     0   0
Pau Bird               19   14    7    1   2   7/8    87.5   2/3    66.7   4/4     0   1
Zion Harris            19   15    5    3   1   6/8    75.0   1/2    50.0   2/2     0   0
Josh Embiid            19    2    3    2   1   1/3    33.3   0/0     0.0   0/0     0   0

TEAM: FG: 40/76 (52.6%), 3PT: 16/31 (51.6%), REB: 42 (10 off, 32 def), AST: 21, TO: 11

================================================================================
