================================================================================
                        FULL GAME - Team_086 vs Team_099                        
================================================================================

================================================================================
                       1ST QUARTER - Team_086 vs Team_099                       
================================================================================

[12:00] Team_086 possession (Score: 0-0)
Lauri Johnson attempts a 3Pt. Contested by Ayo Barrett (4.7 feet, MAN). Lauri Johnson misses. Rebound secured by Larry Wade.

[11:47] Team_099 possession (Score: 0-0)
Vince Lillard attempts a 3Pt. Contested by Lauri Johnson (4.5 feet, ZONE). Vince Lillard misses. Rebound secured by Miles Gobert.

[11:31] Team_086 possession (Score: 0-0)
FOUL! Reach-in foul on Ayo Barrett during the drive. [Team fouls: 1] No free throws, side out. (Ayo Barrett: 1 personal fouls)

[11:14] Team_086 possession (Score: 0-0)
Bones Ginobili attempts a 3Pt. Contested by Vince Lillard (4.9 feet, MAN). Bones Ginobili misses. Rebound secured by Vince Lillard.

[10:55] Team_099 possession (Score: 0-0)
Larry James attempts a 3Pt. Contested by Anfernee Harris (4.2 feet, MAN). Larry James misses. Rebound secured by Rudy Rose.

[10:38] Team_086 possession (Score: 0-0)
Lauri Johnson attempts a Midrange. Contested by Larry James (5.3 feet, ZONE). LAURI JOHNSON MAKES IT!
Score: 2-0

[10:22] Team_099 possession (Score: 2-0)
Ayo Barrett attempts a Midrange. Wide open! Lauri Johnson is 6.8 feet away. [MAN] AYO BARRETT MAKES IT! Assist: Larry Wade
Score: 2-2

[10:08] Team_086 possession (Score: 2-2)
Bones Ginobili attempts a Midrange. Contested by Larry James (4.0 feet, ZONE). Bones Ginobili misses. Offensive rebound by Rudy Rose! Rudy Rose's putback is no good. Rebound secured by Damian Ginobili.

[09:52] Team_099 possession (Score: 2-2)
Ayo Barrett attempts a 3Pt. Wide open! Lauri Johnson is 8.2 feet away. [ZONE] AYO BARRETT MAKES IT! Assist: Damian Ginobili
Score: 2-5

[09:33] Team_086 possession (Score: 2-5)
Rudy Rose attempts a 3Pt. Contested by Ayo Barrett (4.8 feet, ZONE). Rudy Rose misses. Rebound secured by Damian Ginobili.

[09:19] Team_099 possession (Score: 2-5)
Larry Wade attempts a Midrange. Wide open! Rudy Rose is 6.5 feet away. [MAN] LARRY WADE MAKES IT! Assist: Ayo Barrett
Score: 2-7

[09:05] Team_086 possession (Score: 2-7)
Miles Gobert drives to the basket... Miles Gobert loses the ball! Stripped by Vince Lillard! TURNOVER! (live ball)

[08:49] Team_099 possession (Score: 2-7)
Larry James drives to the basket... Larry James throws a bad pass! Stolen by Rudy Rose! TURNOVER! (live ball)

[08:29] Team_086 possession (Score: 2-7)
Anfernee Harris attempts a 3Pt. Contested by Ayo Barrett (4.2 feet, ZONE). ANFERNEE HARRIS MAKES IT! Assist: Bones Ginobili
Score: 5-7

[08:13] Team_099 possession (Score: 5-7)
Larry Wade drives, Rudy Rose stays with him. Larry Wade attempts a Dunk. Contested by Rudy Rose (3.0 feet, ZONE). LARRY WADE MAKES IT! Assist: Vince Lillard
Score: 5-9

[07:59] Team_086 possession (Score: 5-9)
Anfernee Harris throws a bad pass out of bounds! TURNOVER! (dead ball)

[07:48] Team_099 possession (Score: 5-9)
Damian Ginobili drives and kicks out. Vince Lillard attempts a 3Pt. Wide open! Lauri Johnson is 6.5 feet away. [ZONE] Vince Lillard misses. Rebound secured by Rudy Rose.

[07:35] Team_086 possession (Score: 5-9)
Miles Gobert attempts a 3Pt. Contested by Ayo Barrett (5.9 feet, ZONE). Miles Gobert misses. Rebound secured by Larry Wade.

[07:17] Team_099 possession (Score: 5-9)
Damian Ginobili drives, picks up Miles Gobert. Help arrives from Anfernee Harris! Damian Ginobili attempts a Layup. Heavily contested by Anfernee Harris (1.9 feet, MAN)! DAMIAN GINOBILI MAKES IT!
Score: 5-11

[07:00] Team_086 possession (Score: 5-11)
Rudy Rose drives to the basket... Rudy Rose throws a bad pass out of bounds! TURNOVER! (dead ball)

[06:49] Team_099 possession (Score: 5-11)
Ayo Barrett drives and kicks out. FOUL! Shooting foul on Bones Ginobili. Vince Lillard to the line for 2 free throws. [Team fouls: 1] (Bones Ginobili: 1 personal fouls)   FT 1/2: GOOD   FT 2/2: GOOD Vince Lillard makes 2/2 from the line.
Score: 5-13

[06:34] Team_086 possession (Score: 5-13)
FOUL! Shooting foul on Vince Lillard. Miles Gobert to the line for 2 free throws. [Team fouls: 2] (Vince Lillard: 1 personal fouls)   FT 1/2: GOOD   FT 2/2: GOOD Miles Gobert makes 2/2 from the line.
Score: 7-13

[06:17] Team_099 possession (Score: 7-13)
Damian Ginobili attempts a Layup. Contested by Rudy Rose (2.7 feet, ZONE). Damian Ginobili misses. Rebound secured by Bones Ginobili.

[06:05] Team_086 possession (Score: 7-13)
Rudy Rose attempts a 3Pt. Wide open! Larry Wade is 9.1 feet away. [MAN] Rudy Rose misses. Rebound secured by Larry Wade.

[05:51] Team_099 possession (Score: 7-13)
Vince Lillard drives, picks up Rudy Rose. Help arrives from Anfernee Harris! Vince Lillard attempts a Dunk. Contested by Anfernee Harris (2.3 feet, ZONE). VINCE LILLARD MAKES IT! Assist: Larry Wade
Score: 7-15

[05:34] Team_086 possession (Score: 7-15)
FOUL! Shooting foul on Vince Lillard. Rudy Rose to the line for 2 free throws. [Team fouls: 3] (Vince Lillard: 2 personal fouls)   FT 1/2: MISS   FT 2/2: GOOD Rudy Rose makes 1/2 from the line.
Score: 8-15

[05:19] Team_099 possession (Score: 8-15)
Larry James attempts a 3Pt. Heavily contested by Anfernee Harris (1.5 feet, MAN)! LARRY JAMES MAKES IT! Assist: Vince Lillard
Score: 8-18

[05:08] Team_086 possession (Score: 8-18)
Rudy Rose makes the Layup and draws the foul on Larry Wade! And-1! Rudy Rose to the line for 1. [Team fouls: 4] (Larry Wade: 1 personal fouls)   FT 1/1: GOOD Rudy Rose makes 1/1 from the line.
Score: 11-18

[04:50] Team_099 possession (Score: 11-18)
Ayo Barrett throws a bad pass out of bounds! TURNOVER! (dead ball)

[04:35] Team_086 possession (Score: 11-18)
FOUL! Shooting foul on Ayo Barrett. Lauri Johnson to the line for 2 free throws. [BONUS: 5 team fouls] (Ayo Barrett: 2 personal fouls)   FT 1/2: GOOD   FT 2/2: GOOD Lauri Johnson makes 2/2 from the line.
Score: 13-18

[04:18] Team_099 possession (Score: 13-18)
Vince Lillard attempts a Midrange. Contested by Anfernee Harris (5.5 feet, ZONE). VINCE LILLARD MAKES IT!
Score: 13-20

[04:03] Team_086 possession (Score: 13-20)
Bones Ginobili attempts a Midrange. Contested by Larry James (4.6 feet, ZONE). Bones Ginobili misses. Offensive rebound by Rudy Rose! Rudy Rose puts it back in!
Score: 15-20

[03:45] Team_099 possession (Score: 15-20)
Larry Wade attempts a Midrange. Contested by Rudy Rose (4.4 feet, MAN). Larry Wade misses. Rebound secured by Bones Ginobili.

[03:35] Team_086 possession (Score: 15-20)
Bones Ginobili attempts a 3Pt. Contested by Vince Lillard (3.5 feet, MAN). BONES GINOBILI MAKES IT! Assist: Lauri Johnson
Score: 18-20

[03:21] Team_099 possession (Score: 18-20)
Vince Lillard attempts a Midrange. Heavily contested by Miles Gobert (1.0 feet, ZONE)! Vince Lillard misses. Rebound secured by Miles Gobert.

[03:08] Team_086 possession (Score: 18-20)
Bones Ginobili drives, Vince Lillard stays with him. Bones Ginobili attempts a Layup. Contested by Vince Lillard (2.9 feet, MAN). BONES GINOBILI MAKES IT! Assist: Anfernee Harris
Score: 20-20

[02:56] Team_099 possession (Score: 20-20)
Larry James drives, picks up Rudy Rose. Help arrives from Anfernee Harris! Larry James attempts a Dunk. Wide open! Anfernee Harris is 6.9 feet away. [ZONE] Larry James misses. Rebound secured by Rudy Rose.

[02:42] Team_086 possession (Score: 20-20)
Lauri Johnson makes the Layup and draws the foul on Ayo Barrett! And-1! Lauri Johnson to the line for 1. [BONUS: 6 team fouls] (Ayo Barrett: 3 personal fouls)   FT 1/1: MISS Lauri Johnson makes 0/1 from the line. Rebound secured by Damian Ginobili.
Score: 22-20

[02:31] Team_099 possession (Score: 22-20)
Damian Ginobili attempts a 3Pt. Contested by Miles Gobert (2.7 feet, MAN). DAMIAN GINOBILI MAKES IT! Assist: Ayo Barrett
Score: 22-23

[02:13] Team_086 possession (Score: 22-23)
Lauri Johnson attempts a 3Pt. Heavily contested by Ayo Barrett (1.0 feet, ZONE)! LAURI JOHNSON MAKES IT! Assist: Miles Gobert
Score: 25-23

[01:57] Team_099 possession (Score: 25-23)
Damian Ginobili attempts a 3Pt. Contested by Miles Gobert (3.2 feet, MAN). Damian Ginobili misses. Rebound secured by Miles Gobert.

[01:48] Team_086 possession (Score: 25-23)
Miles Gobert attempts a Layup. BLOCKED BY VINCE LILLARD! Ball is loose! Offensive rebound by Miles Gobert! Miles Gobert kicks it out.

[01:33] Team_086 possession (Score: 25-23)
FOUL! Holding foul on Larry James. [IN THE BONUS! 7 team fouls] Anfernee Harris to the line for 2 free throws. (Larry James: 1 personal fouls)   FT 1/2: GOOD   FT 2/2: GOOD Anfernee Harris makes 2/2 from the line.
Score: 27-23

[01:21] Team_099 possession (Score: 27-23)
FOUL! Shooting foul on Anfernee Harris. Damian Ginobili to the line for 2 free throws. [Team fouls: 2] (Anfernee Harris: 1 personal fouls)   FT 1/2: GOOD   FT 2/2: MISS Damian Ginobili makes 1/2 from the line. Rebound secured by Miles Gobert.
Score: 27-24

[01:05] Team_086 possession (Score: 27-24)
FOUL! Holding foul on Larry Wade. [IN THE BONUS! 8 team fouls] Rudy Rose to the line for 2 free throws. (Larry Wade: 2 personal fouls)   FT 1/2: GOOD   FT 2/2: MISS Rudy Rose makes 1/2 from the line. Rebound secured by Damian Ginobili.
Score: 28-24

[00:51] Team_099 possession (Score: 28-24)
FOUL! Shooting foul on Rudy Rose. Ayo Barrett to the line for 2 free throws. [Team fouls: 3] (Rudy Rose: 1 personal fouls)   FT 1/2: GOOD   FT 2/2: MISS Ayo Barrett makes 1/2 from the line. Rebound secured by Miles Gobert.
Score: 28-25

[00:38] Team_086 possession (Score: 28-25)
Rudy Rose attempts a Layup. Wide open! Larry Wade is 6.2 feet away. [MAN] RUDY ROSE MAKES IT!
Score: 30-25

[00:25] Team_099 possession (Score: 30-25)
Ayo Barrett attempts a Midrange. Heavily contested by Bones Ginobili (0.5 feet, ZONE)! Ayo Barrett misses. Rebound secured by Bones Ginobili.

[00:13] Team_086 possession (Score: 30-25)
Anfernee Harris attempts a Midrange. Contested by Larry James (4.0 feet, ZONE). Anfernee Harris misses. Offensive rebound by Rudy Rose! Rudy Rose puts it back in!
Score: 32-25

================================================================================
                              1ST QUARTER COMPLETE                              
================================================================================

1ST QUARTER SCORE: Team_086 32, Team_099 25

BOX SCORE:
================================================================================

Team_086
--------------------------------------------------------------------------------
Player                MIN  PTS  REB  AST  TO      FG   FG%      3P   3P%
--------------------------------------------------------------------------------
Rudy Rose              12   10    5    0   0   5/7    71.4     0/0   0.0
Lauri Johnson          12    7    0    1   0   3/5    60.0     0/0   0.0
Bones Ginobili         12    5    3    1   0   2/4    50.0     0/0   0.0
Anfernee Harris        12    5    0    1   0   2/2   100.0     0/0   0.0
Miles Gobert           12    2    6    1   0   1/2    50.0     0/0   0.0

TEAM: FG: 13/21 (61.9%), 3PT: 3/8 (37.5%), REB: 15 (4 off, 11 def), AST: 4, TO: 3
TEAM FOULS: 3


Team_099
--------------------------------------------------------------------------------
Player                MIN  PTS  REB  AST  TO      FG   FG%      3P   3P%
--------------------------------------------------------------------------------
Vince Lillard          12    6    1    2   0   3/5    60.0     0/0   0.0
Ayo Barrett            12    5    0    2   0   2/4    50.0     0/0   0.0
Damian Ginobili        12    5    4    1   0   2/6    33.3     0/0   0.0
Larry Wade             12    4    3    2   0   2/3    66.7     0/0   0.0
Larry James            12    3    0    0   0   1/3    33.3     0/0   0.0

TEAM: FG: 10/21 (47.6%), 3PT: 3/6 (50.0%), REB: 7 (0 off, 7 def), AST: 7, TO: 2
TEAM FOULS: 8 [Team_086 in BONUS]

================================================================================

================================================================================
                       2ND QUARTER - Team_086 vs Team_099                       
================================================================================

[12:00] Team_086 possession (Score: 32-25)
Bones Ginobili attempts a 3Pt. Heavily contested by Ayo Barrett (1.9 feet, ZONE)! Bones Ginobili misses. Rebound secured by Larry Wade.

[11:49] Team_099 possession (Score: 32-25)
Larry Wade makes the Layup and draws the foul on Rudy Rose! And-1! Larry Wade to the line for 1. [Team fouls: 1] (Rudy Rose: 1 personal fouls)   FT 1/1: GOOD Larry Wade makes 1/1 from the line.
Score: 32-28

[11:34] Team_086 possession (Score: 32-28)
Anfernee Harris drives, Vince Lillard stays with him. Anfernee Harris attempts a Layup. Heavily contested by Vince Lillard (1.4 feet, ZONE)! Anfernee Harris misses. Offensive rebound by Rudy Rose! Rudy Rose's putback is no good. Rebound secured by Larry Wade.

[11:20] Team_099 possession (Score: 32-28)
Damian Ginobili attempts a Layup. Contested by Rudy Rose (3.1 feet, ZONE). DAMIAN GINOBILI MAKES IT!
Score: 32-30

[11:07] Team_086 possession (Score: 32-30)
Lauri Johnson attempts a 3Pt. Contested by Ayo Barrett (3.2 feet, ZONE). Lauri Johnson misses. Rebound secured by Vince Lillard.

[10:47] Team_099 possession (Score: 32-30)
Larry James attempts a 3Pt. Wide open! Lauri Johnson is 8.0 feet away. [ZONE] LARRY JAMES MAKES IT! Assist: Damian Ginobili
Score: 32-33

[10:34] Team_086 possession (Score: 32-33)
Miles Gobert drives to the basket... Miles Gobert commits a violation (traveling/carry)! TURNOVER! (dead ball)

[10:34] Substitution (Team_086): Lauri Johnson OUT → Anfernee Green IN (stamina_rule2)

[10:34] Substitution (Team_086): Anfernee Harris OUT → Anthony James IN (stamina_rule2)

[10:34] Substitution (Team_086): Miles Gobert OUT → Franz McGrady IN (stamina_rule2)

[10:34] Substitution (Team_086): Bones Ginobili OUT → Kyle McCollum IN (stamina_rule2)

[10:34] Substitution (Team_086): Rudy Rose OUT → Lamelo Towns IN (stamina_rule2)

[10:34] Substitution (Team_099): Ayo Barrett OUT → CJ Cunningham IN (stamina_rule2)

[10:34] Substitution (Team_099): Larry James OUT → Manu Johnson IN (stamina_rule2)

[10:34] Substitution (Team_099): Damian Ginobili OUT → Scottie Quickley IN (stamina_rule2)

[10:34] Substitution (Team_099): Vince Lillard OUT → Donovan Green IN (stamina_rule2)

[10:34] Substitution (Team_099): Larry Wade OUT → Jarrett Fox IN (stamina_rule2)

[10:19] Team_099 possession (Score: 32-33)
Scottie Quickley attempts a Midrange. Contested by Franz McGrady (3.4 feet, MAN). SCOTTIE QUICKLEY MAKES IT! Assist: Manu Johnson
Score: 32-35

[10:05] Team_086 possession (Score: 32-35)
Kyle McCollum attempts a 3Pt. Contested by Donovan Green (5.7 feet, MAN). KYLE MCCOLLUM MAKES IT! Assist: Anfernee Green
Score: 35-35

[09:50] Team_099 possession (Score: 35-35)
Scottie Quickley attempts a 3Pt. Wide open! Franz McGrady is 8.0 feet away. [MAN] Scottie Quickley misses. Rebound secured by Kyle McCollum.

[09:39] Team_086 possession (Score: 35-35)
Anfernee Green attempts a Midrange. Contested by CJ Cunningham (2.1 feet, MAN). ANFERNEE GREEN MAKES IT!
Score: 37-35

[09:26] Team_099 possession (Score: 37-35)
FOUL! Shooting foul on Anthony James. Manu Johnson to the line for 3 free throws. [Team fouls: 2] (Anthony James: 1 personal fouls)   FT 1/3: GOOD   FT 2/3: GOOD   FT 3/3: GOOD Manu Johnson makes 3/3 from the line.
Score: 37-38

[09:10] Team_086 possession (Score: 37-38)
Lamelo Towns attempts a Layup. Heavily contested by Jarrett Fox (0.5 feet, MAN)! LAMELO TOWNS MAKES IT! Assist: Anfernee Green
Score: 39-38

[08:56] Team_099 possession (Score: 39-38)
Donovan Green loses the ball! Stripped by Kyle McCollum! TURNOVER! (live ball)

[08:42] Team_086 possession (Score: 39-38)
Anfernee Green attempts a 3Pt. Contested by CJ Cunningham (2.0 feet, MAN). Anfernee Green misses. Rebound secured by Scottie Quickley.

[08:30] Team_099 possession (Score: 39-38)
Jarrett Fox drives, Lamelo Towns stays with him. Jarrett Fox attempts a Dunk. Wide open! Lamelo Towns is 7.6 feet away. [MAN] Jarrett Fox misses. Rebound secured by Anfernee Green.

[08:19] Team_086 possession (Score: 39-38)
Franz McGrady attempts a 3Pt. Contested by Scottie Quickley (2.4 feet, MAN). Franz McGrady misses. Rebound secured by Donovan Green.

[08:07] Team_099 possession (Score: 39-38)
Scottie Quickley attempts a Midrange. Contested by Franz McGrady (3.6 feet, ZONE). SCOTTIE QUICKLEY MAKES IT!
Score: 39-40

[07:53] Team_086 possession (Score: 39-40)
Franz McGrady attempts a 3Pt. Wide open! Manu Johnson is 8.9 feet away. [ZONE] FRANZ MCGRADY MAKES IT! Assist: Lamelo Towns
Score: 42-40

[07:37] Team_099 possession (Score: 42-40)
FOUL! Holding foul on Franz McGrady. [Team fouls: 3] No free throws, side out. (Franz McGrady: 1 personal fouls)

[07:22] Team_099 possession (Score: 42-40)
Manu Johnson attempts a 3Pt. Contested by Anthony James (4.2 feet, MAN). MANU JOHNSON MAKES IT! Assist: Scottie Quickley
Score: 42-43

[07:08] Team_086 possession (Score: 42-43)
Anthony James attempts a Layup. Contested by Jarrett Fox (2.7 feet, ZONE). Anthony James misses. Rebound secured by Donovan Green.

[06:57] Team_099 possession (Score: 42-43)
CJ Cunningham attempts a 3Pt. Heavily contested by Anfernee Green (1.6 feet, ZONE)! CJ CUNNINGHAM MAKES IT! Assist: Jarrett Fox
Score: 42-46

[06:43] Team_086 possession (Score: 42-46)
Anfernee Green drives, picks up CJ Cunningham. Help arrives from Scottie Quickley! Anfernee Green attempts a Dunk. Contested by Scottie Quickley (4.3 feet, MAN). ANFERNEE GREEN MAKES IT!
Score: 44-46

[06:31] Team_099 possession (Score: 44-46)
Jarrett Fox makes the Layup and draws the foul on Anfernee Green! And-1! Jarrett Fox to the line for 1. [Team fouls: 4] (Anfernee Green: 1 personal fouls)   FT 1/1: GOOD Jarrett Fox makes 1/1 from the line.
Score: 44-49

[06:20] Team_086 possession (Score: 44-49)
Franz McGrady attempts a 3Pt. Contested by Manu Johnson (4.8 feet, ZONE). Franz McGrady misses. Offensive rebound by Lamelo Towns! Lamelo Towns kicks it out.

[06:07] Team_086 possession (Score: 44-49)
Anthony James attempts a 3Pt. Wide open! Manu Johnson is 7.0 feet away. [MAN] Anthony James misses. Rebound secured by Jarrett Fox.

[05:55] Team_099 possession (Score: 44-49)
Manu Johnson drives to the basket... Manu Johnson throws a bad pass! Stolen by Anthony James! TURNOVER! (live ball)

[05:37] Team_086 possession (Score: 44-49)
Kyle McCollum attempts a Midrange. Contested by Donovan Green (5.2 feet, MAN). Kyle McCollum misses. Offensive rebound by Anfernee Green! Anfernee Green kicks it out.

[05:18] Team_086 possession (Score: 44-49)
Anthony James attempts a 3Pt. Wide open! Manu Johnson is 8.4 feet away. [MAN] ANTHONY JAMES MAKES IT! Assist: Lamelo Towns
Score: 47-49

[05:00] Team_099 possession (Score: 47-49)
CJ Cunningham drives and kicks out. CJ Cunningham attempts a 3Pt. Contested by Anfernee Green (5.9 feet, ZONE). CJ Cunningham misses. Rebound secured by Lamelo Towns.

[04:44] Team_086 possession (Score: 47-49)
Kyle McCollum attempts a 3Pt. Contested by Manu Johnson (3.6 feet, ZONE). Kyle McCollum misses. Rebound secured by Donovan Green.

[04:26] Team_099 possession (Score: 47-49)
Donovan Green loses the ball! Stripped by Kyle McCollum! TURNOVER! (live ball)

[04:11] Team_086 possession (Score: 47-49)
Lamelo Towns attempts a Layup. Heavily contested by Jarrett Fox (0.5 feet, MAN)! Lamelo Towns misses. Rebound secured by Jarrett Fox.

[03:57] Team_099 possession (Score: 47-49)
Donovan Green makes the Layup and draws the foul on Anfernee Green! And-1! Donovan Green to the line for 1. [BONUS: 5 team fouls] (Anfernee Green: 2 personal fouls)   FT 1/1: GOOD Donovan Green makes 1/1 from the line.
Score: 47-52

[03:42] Team_086 possession (Score: 47-52)
Anthony James attempts a 3Pt. Wide open! Manu Johnson is 6.1 feet away. [ZONE] Anthony James misses. Rebound secured by Jarrett Fox.

[03:24] Team_099 possession (Score: 47-52)
FOUL! Shooting foul on Kyle McCollum. Donovan Green to the line for 2 free throws. [BONUS: 6 team fouls] (Kyle McCollum: 1 personal fouls)   FT 1/2: GOOD   FT 2/2: MISS Donovan Green makes 1/2 from the line. Rebound secured by Lamelo Towns.
Score: 47-53

[03:10] Team_086 possession (Score: 47-53)
Kyle McCollum attempts a Midrange. Contested by Donovan Green (5.2 feet, MAN). Kyle McCollum misses. Rebound secured by Donovan Green.

[02:56] Team_099 possession (Score: 47-53)
CJ Cunningham attempts a Layup. Contested by Lamelo Towns (2.5 feet, ZONE). CJ CUNNINGHAM MAKES IT!
Score: 47-55

[02:40] Team_086 possession (Score: 47-55)
Anthony James drives, Manu Johnson stays with him. Anthony James attempts a Dunk. Wide open! Manu Johnson is 7.0 feet away. [MAN] ANTHONY JAMES MAKES IT!
Score: 49-55

[02:26] Team_099 possession (Score: 49-55)
Scottie Quickley attempts a 3Pt. Heavily contested by Franz McGrady (1.5 feet, MAN)! SCOTTIE QUICKLEY MAKES IT! Assist: Jarrett Fox
Score: 49-58

[02:10] Team_086 possession (Score: 49-58)
Anfernee Green makes the Dunk and draws the foul on Scottie Quickley! And-1! Anfernee Green to the line for 1. [Team fouls: 1] (Scottie Quickley: 1 personal fouls)   FT 1/1: GOOD Anfernee Green makes 1/1 from the line.
Score: 52-58

[01:55] Team_099 possession (Score: 52-58)
CJ Cunningham attempts a 3Pt. Contested by Anfernee Green (4.2 feet, MAN). CJ Cunningham misses. Rebound secured by Anfernee Green.

[01:37] Team_086 possession (Score: 52-58)
Anfernee Green attempts a 3Pt. Heavily contested by Manu Johnson (1.6 feet, ZONE)! Anfernee Green misses. Rebound secured by Jarrett Fox.

[01:21] Team_099 possession (Score: 52-58)
Manu Johnson attempts a Midrange. Contested by Anthony James (3.2 feet, ZONE). Manu Johnson misses. Rebound secured by Kyle McCollum.

[01:06] Team_086 possession (Score: 52-58)
Franz McGrady attempts a 3Pt. Contested by Scottie Quickley (5.4 feet, MAN). Franz McGrady misses. Rebound secured by Jarrett Fox.

[00:52] Team_099 possession (Score: 52-58)
Scottie Quickley drives and kicks out. CJ Cunningham attempts a 3Pt. Contested by Anfernee Green (2.8 feet, MAN). CJ Cunningham misses. FOUL! Loose ball foul on Kyle McCollum during the rebound battle. [IN THE BONUS! 7 team fouls] Jarrett Fox to the line for 2 free throws. (Kyle McCollum: 2 personal fouls)   FT 1/2: GOOD   FT 2/2: GOOD Jarrett Fox makes 2/2 from the line.
Score: 52-60

[00:37] Team_086 possession (Score: 52-60)
Kyle McCollum attempts a 3Pt. Contested by Donovan Green (5.4 feet, MAN). Kyle McCollum misses. Rebound secured by Scottie Quickley.

[00:24] Team_099 possession (Score: 52-60)
Scottie Quickley commits a violation (traveling/carry)! TURNOVER! (dead ball)

[00:12] Team_086 possession (Score: 52-60)
Kyle McCollum attempts a Midrange. Contested by Manu Johnson (4.2 feet, ZONE). KYLE MCCOLLUM MAKES IT!
Score: 54-60

================================================================================
                              2ND QUARTER COMPLETE                              
================================================================================

2ND QUARTER SCORE: Team_086 22, Team_099 35

BOX SCORE:
================================================================================

Team_086
--------------------------------------------------------------------------------
Player                MIN  PTS  REB  AST  TO      FG   FG%      3P   3P%
--------------------------------------------------------------------------------
Anfernee Green         10    7    3    2   0   3/5    60.0     0/0   0.0
Kyle McCollum          10    5    2    0   0   2/5    40.0     0/0   0.0
Anthony James          10    5    0    0   0   2/5    40.0     0/0   0.0
Larry Wade             14    3    2    0   0   1/1   100.0     0/0   0.0
Franz McGrady          10    3    0    0   0   1/3    33.3     0/0   0.0
Lamelo Towns           10    2    3    2   0   1/2    50.0     0/0   0.0
Bones Ginobili         14    0    0    0   0   0/1     0.0     0/0   0.0
Anfernee Harris        14    0    0    0   0   0/1     0.0     0/0   0.0
Lauri Johnson          14    0    0    0   0   0/1     0.0     0/0   0.0

TEAM: FG: 9/23 (39.1%), 3PT: 3/13 (23.1%), REB: 9 (3 off, 6 def), AST: 4, TO: 1
TEAM FOULS: 7 [Team_099 in BONUS]


Team_099
--------------------------------------------------------------------------------
Player                MIN  PTS  REB  AST  TO      FG   FG%      3P   3P%
--------------------------------------------------------------------------------
Scottie Quickley       10    7    2    1   0   3/4    75.0     0/0   0.0
Manu Johnson           10    6    0    1   0   2/3    66.7     0/0   0.0
Jarrett Fox            10    5    5    2   0   2/3    66.7     0/0   0.0
CJ Cunningham          10    5    0    0   0   2/4    50.0     0/0   0.0
Larry James            14    3    0    0   0   1/1   100.0     0/0   0.0
Donovan Green          10    3    4    0   0   1/2    50.0     0/0   0.0
Damian Ginobili        14    2    0    1   0   1/1   100.0     0/0   0.0
Vince Lillard          14    0    1    0   0   0/0     0.0     0/0   0.0

TEAM: FG: 13/19 (68.4%), 3PT: 5/7 (71.4%), REB: 13 (0 off, 13 def), AST: 5, TO: 4
TEAM FOULS: 1

================================================================================

================================================================================
                       3RD QUARTER - Team_086 vs Team_099                       
================================================================================

[12:00] Team_086 possession (Score: 54-60)
Rudy Rose drives and kicks out. Miles Gobert attempts a Midrange. Contested by Damian Ginobili (4.9 feet, MAN). MILES GOBERT MAKES IT!
Score: 56-60

[11:49] Team_099 possession (Score: 56-60)
Larry James makes the 3Pt and draws the foul on Lauri Johnson! And-1! Larry James to the line for 1. [Team fouls: 1] (Lauri Johnson: 1 personal fouls)   FT 1/1: GOOD Larry James makes 1/1 from the line.
Score: 56-64

[11:32] Team_086 possession (Score: 56-64)
Lauri Johnson attempts a 3Pt. Heavily contested by Ayo Barrett (0.5 feet, ZONE)! Lauri Johnson misses. Rebound secured by Damian Ginobili.

[11:13] Team_099 possession (Score: 56-64)
Vince Lillard drives, picks up Bones Ginobili. Help arrives from Anfernee Harris! Vince Lillard attempts a Layup. Contested by Anfernee Harris (2.2 feet, MAN). VINCE LILLARD MAKES IT! Assist: Larry Wade
Score: 56-66

[10:58] Team_086 possession (Score: 56-66)
Bones Ginobili attempts a Midrange. Contested by Damian Ginobili (3.4 feet, ZONE). Bones Ginobili misses. Rebound secured by Damian Ginobili.

[10:43] Team_099 possession (Score: 56-66)
Damian Ginobili attempts a Dunk. BLOCKED BY RUDY ROSE! Ball is loose! Rebound secured by Bones Ginobili.

[10:33] Team_086 possession (Score: 56-66)
Bones Ginobili attempts a 3Pt. Contested by Vince Lillard (2.2 feet, MAN). BONES GINOBILI MAKES IT!
Score: 59-66

[10:21] Team_099 possession (Score: 59-66)
Ayo Barrett attempts a Layup. Contested by Lauri Johnson (3.4 feet, MAN). AYO BARRETT MAKES IT! Assist: Vince Lillard
Score: 59-68

[10:04] Team_086 possession (Score: 59-68)
Rudy Rose drives, picks up Vince Lillard. Help arrives from Ayo Barrett! Rudy Rose attempts a Layup. Heavily contested by Ayo Barrett (1.1 feet, ZONE)! RUDY ROSE MAKES IT! Assist: Bones Ginobili
Score: 61-68

[09:46] Team_099 possession (Score: 61-68)
Damian Ginobili attempts a 3Pt. Contested by Miles Gobert (4.1 feet, MAN). Damian Ginobili misses. Rebound secured by Bones Ginobili.

[09:30] Team_086 possession (Score: 61-68)
Miles Gobert attempts a 3Pt. Contested by Damian Ginobili (3.9 feet, MAN). Miles Gobert misses. Rebound secured by Vince Lillard.

[09:17] Team_099 possession (Score: 61-68)
Vince Lillard throws a bad pass out of bounds! TURNOVER! (dead ball)

[09:03] Team_086 possession (Score: 61-68)
Rudy Rose drives and kicks out. Rudy Rose attempts a 3Pt. Contested by Ayo Barrett (4.2 feet, ZONE). RUDY ROSE MAKES IT! Assist: Lauri Johnson
Score: 64-68

[08:50] Team_099 possession (Score: 64-68)
Larry James attempts a Midrange. Contested by Anfernee Harris (5.5 feet, ZONE). Larry James misses. Offensive rebound by Larry Wade! Larry Wade's putback is no good. Offensive rebound by Larry Wade! Larry Wade kicks it out.

[08:38] Team_099 possession (Score: 64-68)
Vince Lillard drives, Rudy Rose stays with him. Vince Lillard attempts a Layup. Heavily contested by Rudy Rose (0.5 feet, ZONE)! VINCE LILLARD MAKES IT!
Score: 64-70

[08:25] Team_086 possession (Score: 64-70)
Rudy Rose attempts a Midrange. Contested by Larry James (4.9 feet, ZONE). Rudy Rose misses. Rebound secured by Damian Ginobili.

[08:07] Team_099 possession (Score: 64-70)
Ayo Barrett drives to the basket... Ayo Barrett loses the ball! Stripped by Rudy Rose! TURNOVER! (live ball)

[07:52] Team_086 possession (Score: 64-70)
Lauri Johnson attempts a Layup. Heavily contested by Vince Lillard (1.6 feet, ZONE)! Lauri Johnson misses. Rebound secured by Damian Ginobili.

[07:39] Team_099 possession (Score: 64-70)
Larry James attempts a 3Pt. Contested by Lauri Johnson (3.4 feet, ZONE). Larry James misses. Rebound secured by Miles Gobert.

[07:28] Team_086 possession (Score: 64-70)
Rudy Rose attempts a Layup. Contested by Larry Wade (4.3 feet, MAN). RUDY ROSE MAKES IT!
Score: 66-70

[07:12] Team_099 possession (Score: 66-70)
Vince Lillard attempts a Dunk. BLOCKED BY BONES GINOBILI! Ball is loose! Rebound secured by Rudy Rose.

[06:54] Team_086 possession (Score: 66-70)
Miles Gobert makes the Dunk and draws the foul on Vince Lillard! And-1! Miles Gobert to the line for 1. [Team fouls: 1] (Vince Lillard: 1 personal fouls)   FT 1/1: GOOD Miles Gobert makes 1/1 from the line.
Score: 69-70

[06:41] Team_099 possession (Score: 69-70)
Larry James attempts a Midrange. Heavily contested by Anfernee Harris (0.5 feet, MAN)! LARRY JAMES MAKES IT! Assist: Ayo Barrett
Score: 69-72

[06:30] Team_086 possession (Score: 69-72)
Miles Gobert attempts a 3Pt. Contested by Damian Ginobili (3.9 feet, MAN). Miles Gobert misses. Rebound secured by Larry Wade.

[06:16] Team_099 possession (Score: 69-72)
Larry James throws a bad pass out of bounds! TURNOVER! (dead ball)

[06:00] Team_086 possession (Score: 69-72)
Miles Gobert attempts a Layup. Contested by Damian Ginobili (3.6 feet, MAN). MILES GOBERT MAKES IT! Assist: Anfernee Harris
Score: 71-72

[05:43] Team_099 possession (Score: 71-72)
Damian Ginobili attempts a Midrange. Contested by Miles Gobert (3.0 feet, MAN). DAMIAN GINOBILI MAKES IT! Assist: Ayo Barrett
Score: 71-74

[05:31] Team_086 possession (Score: 71-74)
FOUL! Shooting foul on Vince Lillard. Lauri Johnson to the line for 2 free throws. [Team fouls: 2] (Vince Lillard: 2 personal fouls)   FT 1/2: GOOD   FT 2/2: GOOD Lauri Johnson makes 2/2 from the line.
Score: 73-74

[05:19] Team_099 possession (Score: 73-74)
Larry Wade drives and kicks out. Damian Ginobili attempts a Midrange. Contested by Bones Ginobili (4.4 feet, ZONE). Damian Ginobili misses. Rebound secured by Bones Ginobili.

[05:05] Team_086 possession (Score: 73-74)
Rudy Rose attempts a Midrange. Wide open! Larry Wade is 7.0 feet away. [MAN] Rudy Rose misses. FOUL! Loose ball foul on Damian Ginobili during the rebound battle. [Team fouls: 3] No free throws, side out. (Damian Ginobili: 1 personal fouls)

[04:49] Team_086 possession (Score: 73-74)
Bones Ginobili attempts a 3Pt. Contested by Vince Lillard (3.8 feet, MAN). Bones Ginobili misses. Rebound secured by Damian Ginobili.

[04:36] Team_099 possession (Score: 73-74)
Damian Ginobili drives, Miles Gobert stays with him. Damian Ginobili attempts a Dunk. Heavily contested by Miles Gobert (1.0 feet, MAN)! DAMIAN GINOBILI MAKES IT! Assist: Ayo Barrett
Score: 73-76

[04:20] Team_086 possession (Score: 73-76)
Miles Gobert drives to the basket... Miles Gobert loses the ball! Stripped by Vince Lillard! TURNOVER! (live ball)

[04:06] Team_099 possession (Score: 73-76)
Larry James attempts a Midrange. Wide open! Bones Ginobili is 6.0 feet away. [ZONE] LARRY JAMES MAKES IT!
Score: 73-78

[03:48] Team_086 possession (Score: 73-78)
FOUL! Shooting foul on Vince Lillard. Rudy Rose to the line for 2 free throws. [Team fouls: 4] (Vince Lillard: 3 personal fouls)   FT 1/2: GOOD   FT 2/2: GOOD Rudy Rose makes 2/2 from the line.
Score: 75-78

[03:37] Team_099 possession (Score: 75-78)
Vince Lillard attempts a Midrange. Contested by Bones Ginobili (4.2 feet, MAN). VINCE LILLARD MAKES IT! Assist: Larry Wade
Score: 75-80

[03:22] Team_086 possession (Score: 75-80)
Rudy Rose attempts a Layup. Contested by Larry Wade (3.6 feet, MAN). Rudy Rose misses. Offensive rebound by Rudy Rose! Rudy Rose puts it back in!
Score: 77-80

[03:04] Team_099 possession (Score: 77-80)
Ayo Barrett attempts a 3Pt. Wide open! Anfernee Harris is 6.0 feet away. [ZONE] AYO BARRETT MAKES IT! Assist: Vince Lillard
Score: 77-83

[02:50] Team_086 possession (Score: 77-83)
Anfernee Harris drives to the basket... Anfernee Harris throws a bad pass! Stolen by Larry James! TURNOVER! (live ball)

[02:36] Team_099 possession (Score: 77-83)
Vince Lillard attempts a 3Pt. Wide open! Lauri Johnson is 7.8 feet away. [ZONE] Vince Lillard misses. FOUL! Loose ball foul on Miles Gobert during the rebound battle. [Team fouls: 2] No free throws, side out. (Miles Gobert: 1 personal fouls)

[02:19] Team_099 possession (Score: 77-83)
Vince Lillard attempts a 3Pt. Wide open! Lauri Johnson is 7.1 feet away. [ZONE] VINCE LILLARD MAKES IT! Assist: Larry Wade
Score: 77-86

[02:06] Team_086 possession (Score: 77-86)
Lauri Johnson attempts a 3Pt. Contested by Ayo Barrett (3.8 feet, ZONE). Lauri Johnson misses. Rebound secured by Larry Wade.

[01:49] Team_099 possession (Score: 77-86)
Larry Wade attempts a 3Pt. Contested by Lauri Johnson (3.9 feet, ZONE). Larry Wade misses. Rebound secured by Miles Gobert.

[01:32] Team_086 possession (Score: 77-86)
Bones Ginobili attempts a 3Pt. Contested by Ayo Barrett (3.0 feet, ZONE). Bones Ginobili misses. Rebound secured by Larry Wade.

[01:21] Team_099 possession (Score: 77-86)
FOUL! Shooting foul on Lauri Johnson. Ayo Barrett to the line for 2 free throws. [Team fouls: 3] (Lauri Johnson: 2 personal fouls)   FT 1/2: GOOD   FT 2/2: GOOD Ayo Barrett makes 2/2 from the line.
Score: 77-88

[01:09] Team_086 possession (Score: 77-88)
Anfernee Harris throws a bad pass! Stolen by Larry James! TURNOVER! (live ball)

[00:59] Team_099 possession (Score: 77-88)
Larry James attempts a 3Pt. Contested by Lauri Johnson (5.9 feet, ZONE). LARRY JAMES MAKES IT! Assist: Damian Ginobili
Score: 77-91

[00:48] Team_086 possession (Score: 77-91)
Miles Gobert drives and kicks out. Rudy Rose attempts a 3Pt. Contested by Larry Wade (5.7 feet, MAN). Rudy Rose misses. Offensive rebound by Rudy Rose! Rudy Rose's putback is no good. Rebound secured by Larry Wade.

[00:34] Team_099 possession (Score: 77-91)
Ayo Barrett attempts a 3Pt. Heavily contested by Lauri Johnson (0.5 feet, ZONE)! AYO BARRETT MAKES IT! Assist: Larry Wade
Score: 77-94

[00:25] Team_086 possession (Score: 77-94)
Bones Ginobili attempts a Layup. BLOCKED BY VINCE LILLARD! Ball deflects out of bounds off Bones Ginobili.

[00:08] Team_099 possession (Score: 77-94)
Ayo Barrett attempts a Midrange. Contested by Anfernee Harris (3.1 feet, ZONE). Ayo Barrett misses. Rebound secured by Miles Gobert.

================================================================================
                              3RD QUARTER COMPLETE                              
================================================================================

3RD QUARTER SCORE: Team_086 23, Team_099 34

BOX SCORE:
================================================================================

Team_086
--------------------------------------------------------------------------------
Player                MIN  PTS  REB  AST  TO      FG   FG%      3P   3P%
--------------------------------------------------------------------------------
Rudy Rose              26   11    2    0   0   5/6    83.3     0/0   0.0
Miles Gobert           26    7    4    0   0   3/6    50.0     0/0   0.0
Bones Ginobili         26    3    3    1   0   1/5    20.0     0/0   0.0
Lauri Johnson          26    2    0    1   0   1/4    25.0     0/0   0.0
Anfernee Harris        26    0    0    1   0   0/0     0.0     0/0   0.0

TEAM: FG: 10/21 (47.6%), 3PT: 1/7 (14.3%), REB: 10 (3 off, 7 def), AST: 3, TO: 3
TEAM FOULS: 3


Team_099
--------------------------------------------------------------------------------
Player                MIN  PTS  REB  AST  TO      FG   FG%      3P   3P%
--------------------------------------------------------------------------------
Larry James            26   11    0    0   0   4/5    80.0     0/0   0.0
Ayo Barrett            26   10    0    3   0   4/5    80.0     0/0   0.0
Vince Lillard          26    9    2    2   0   4/5    80.0     0/0   0.0
Damian Ginobili        26    4    5    1   0   2/4    50.0     0/0   0.0
Larry Wade             26    0    5    4   0   0/2     0.0     0/0   0.0

TEAM: FG: 14/21 (66.7%), 3PT: 5/8 (62.5%), REB: 11 (2 off, 9 def), AST: 10, TO: 3
TEAM FOULS: 4

================================================================================

================================================================================
                       4TH QUARTER - Team_086 vs Team_099                       
================================================================================

[12:00] Substitution (Team_086): Lauri Johnson OUT (stamina: 70) → Anfernee Green IN (comeback_detected)

[12:00] Substitution (Team_099): Ayo Barrett OUT (stamina: 71) → CJ Cunningham IN (comeback_detected)

[12:00] Team_086 possession (Score: 77-94)
Anfernee Harris attempts a 3Pt. Wide open! Larry James is 6.1 feet away. [MAN] ANFERNEE HARRIS MAKES IT! Assist: Anfernee Green
Score: 80-94

[11:45] Team_099 possession (Score: 80-94)
Damian Ginobili commits a violation (traveling/carry)! TURNOVER! (dead ball)

[11:45] Substitution (Team_086): Anfernee Harris OUT → Anthony James IN (stamina_rule2)

[11:45] Substitution (Team_086): Miles Gobert OUT → Franz McGrady IN (stamina_rule2)

[11:45] Substitution (Team_086): Bones Ginobili OUT → Kyle McCollum IN (stamina_rule2)

[11:45] Substitution (Team_086): Rudy Rose OUT → Lamelo Towns IN (stamina_rule2)

[11:45] Substitution (Team_099): Larry James OUT → Manu Johnson IN (stamina_rule2)

[11:45] Substitution (Team_099): Damian Ginobili OUT → Scottie Quickley IN (stamina_rule2)

[11:45] Substitution (Team_099): Vince Lillard OUT → Donovan Green IN (stamina_rule2)

[11:45] Substitution (Team_099): Larry Wade OUT → Jarrett Fox IN (stamina_rule2)

[11:31] Team_086 possession (Score: 80-94)
Anthony James drives, Manu Johnson stays with him. Anthony James attempts a Layup. Contested by Manu Johnson (3.5 feet, MAN). ANTHONY JAMES MAKES IT! Assist: Franz McGrady
Score: 82-94

[11:17] Team_099 possession (Score: 82-94)
Jarrett Fox drives, Lamelo Towns stays with him. Jarrett Fox attempts a Layup. Wide open! Lamelo Towns is 6.4 feet away. [ZONE] JARRETT FOX MAKES IT! Assist: Manu Johnson
Score: 82-96

[11:03] Team_086 possession (Score: 82-96)
Anthony James loses control! Ball rolls out of bounds! TURNOVER! (dead ball)

[10:46] Team_099 possession (Score: 82-96)
Scottie Quickley attempts a 3Pt. Contested by Anfernee Green (4.8 feet, ZONE). Scottie Quickley misses. Rebound secured by Anfernee Green.

[10:33] Team_086 possession (Score: 82-96)
Kyle McCollum attempts a Layup. BLOCKED BY DONOVAN GREEN! Ball is loose! Rebound secured by Jarrett Fox.

[10:14] Team_099 possession (Score: 82-96)
Donovan Green attempts a 3Pt. Contested by Kyle McCollum (5.6 feet, MAN). Donovan Green misses. Rebound secured by Anfernee Green.

[10:02] Team_086 possession (Score: 82-96)
Lamelo Towns attempts a 3Pt. Contested by Scottie Quickley (2.5 feet, ZONE). Lamelo Towns misses. FOUL! Loose ball foul on Scottie Quickley during the rebound battle. [Team fouls: 1] No free throws, side out. (Scottie Quickley: 1 personal fouls)

[09:47] Team_086 possession (Score: 82-96)
Anfernee Green attempts a 3Pt. Contested by Manu Johnson (5.1 feet, ZONE). Anfernee Green misses. Rebound secured by Scottie Quickley.

[09:34] Team_099 possession (Score: 82-96)
Scottie Quickley attempts a 3Pt. Contested by Anfernee Green (5.3 feet, ZONE). SCOTTIE QUICKLEY MAKES IT!
Score: 82-99

[09:22] Team_086 possession (Score: 82-99)
Kyle McCollum attempts a Midrange. Contested by Donovan Green (5.4 feet, MAN). Kyle McCollum misses. Offensive rebound by Anfernee Green! Anfernee Green kicks it out.

[09:10] Team_086 possession (Score: 82-99)
Anthony James attempts a 3Pt. Wide open! Donovan Green is 6.4 feet away. [ZONE] Anthony James misses. Offensive rebound by Anfernee Green! Anfernee Green kicks it out.

[08:54] Team_086 possession (Score: 82-99)
Lamelo Towns attempts a Layup. BLOCKED BY JARRETT FOX! Ball is loose! Offensive rebound by Anfernee Green! Anfernee Green kicks it out.

[08:41] Team_086 possession (Score: 82-99)
Lamelo Towns drives and kicks out. Anthony James attempts a 3Pt. Wide open! Manu Johnson is 7.2 feet away. [MAN] Anthony James misses. Rebound secured by Donovan Green.

[08:25] Team_099 possession (Score: 82-99)
Donovan Green attempts a Midrange. Contested by Kyle McCollum (4.7 feet, MAN). DONOVAN GREEN MAKES IT!
Score: 82-101

[08:06] Team_086 possession (Score: 82-101)
Franz McGrady drives to the basket... Franz McGrady throws a bad pass! Stolen by Jarrett Fox! TURNOVER! (live ball)

[07:51] Team_099 possession (Score: 82-101)
Manu Johnson makes the Layup and draws the foul on Lamelo Towns! And-1! Manu Johnson to the line for 1. [Team fouls: 1] (Lamelo Towns: 1 personal fouls)   FT 1/1: GOOD Manu Johnson makes 1/1 from the line.
Score: 82-104

[07:38] Team_086 possession (Score: 82-104)
Kyle McCollum attempts a Midrange. Wide open! Donovan Green is 7.3 feet away. [MAN] Kyle McCollum misses. Rebound secured by Donovan Green.

[07:22] Team_099 possession (Score: 82-104)
Manu Johnson attempts a Layup. Heavily contested by Anthony James (0.5 feet, MAN)! Manu Johnson misses. Rebound secured by Anfernee Green.

[07:02] Team_086 possession (Score: 82-104)
Anthony James attempts a 3Pt. Wide open! Manu Johnson is 6.9 feet away. [ZONE] Anthony James misses. Rebound secured by Donovan Green.

[06:51] Team_099 possession (Score: 82-104)
Manu Johnson drives, picks up Kyle McCollum. Help arrives from Anfernee Green! Manu Johnson attempts a Layup. Contested by Anfernee Green (3.8 feet, ZONE). MANU JOHNSON MAKES IT!
Score: 82-106

[06:40] Team_086 possession (Score: 82-106)
Anfernee Green drives to the basket... Anfernee Green commits a violation (traveling/carry)! TURNOVER! (dead ball)

[06:26] Team_099 possession (Score: 82-106)
Jarrett Fox attempts a Layup. Wide open! Lamelo Towns is 7.3 feet away. [ZONE] JARRETT FOX MAKES IT! Assist: Manu Johnson
Score: 82-108

[06:10] Team_086 possession (Score: 82-108)
Anthony James loses control! Ball rolls out of bounds! TURNOVER! (dead ball)

[05:54] Team_099 possession (Score: 82-108)
CJ Cunningham drives and kicks out. CJ Cunningham attempts a Midrange. Contested by Kyle McCollum (4.3 feet, ZONE). CJ Cunningham misses. Rebound secured by Anfernee Green.

[05:41] Team_086 possession (Score: 82-108)
Anthony James attempts a 3Pt. Contested by Manu Johnson (3.9 feet, ZONE). ANTHONY JAMES MAKES IT! Assist: Franz McGrady
Score: 85-108

[05:27] Team_099 possession (Score: 85-108)
CJ Cunningham attempts a 3Pt. Contested by Anfernee Green (3.7 feet, MAN). CJ Cunningham misses. Rebound secured by Anfernee Green.

[05:13] Team_086 possession (Score: 85-108)
Anfernee Green attempts a Midrange. Wide open! Manu Johnson is 9.4 feet away. [ZONE] ANFERNEE GREEN MAKES IT!
Score: 87-108

[04:59] Team_099 possession (Score: 87-108)
Jarrett Fox drives and kicks out. Jarrett Fox attempts a Midrange. Wide open! Lamelo Towns is 8.3 feet away. [ZONE] Jarrett Fox misses. Rebound secured by Lamelo Towns.

[04:41] Team_086 possession (Score: 87-108)
FOUL! Reach-in foul on Donovan Green during the drive. [Team fouls: 2] No free throws, side out. (Donovan Green: 1 personal fouls)

[04:26] Team_086 possession (Score: 87-108)
Kyle McCollum drives to the basket... Kyle McCollum loses control! Ball rolls out of bounds! TURNOVER! (dead ball)

[04:09] Team_099 possession (Score: 87-108)
Jarrett Fox drives, Lamelo Towns stays with him. Jarrett Fox attempts a Dunk. Wide open! Lamelo Towns is 6.2 feet away. [MAN] Jarrett Fox misses. Rebound secured by Lamelo Towns.

[03:52] Team_086 possession (Score: 87-108)
Lamelo Towns attempts a Midrange. Contested by Jarrett Fox (3.1 feet, MAN). LAMELO TOWNS MAKES IT! Assist: Franz McGrady
Score: 89-108

[03:38] Team_099 possession (Score: 89-108)
Donovan Green drives to the basket... Donovan Green loses control! Ball rolls out of bounds! TURNOVER! (dead ball)

[03:22] Team_086 possession (Score: 89-108)
Franz McGrady drives and kicks out. Anthony James attempts a Midrange. Wide open! Scottie Quickley is 6.9 feet away. [ZONE] Anthony James misses. Rebound secured by Donovan Green.

[03:06] Team_099 possession (Score: 89-108)
FOUL! Shooting foul on Lamelo Towns. Scottie Quickley to the line for 2 free throws. [Team fouls: 2] (Lamelo Towns: 2 personal fouls)   FT 1/2: MISS   FT 2/2: GOOD Scottie Quickley makes 1/2 from the line.
Score: 89-109

[02:51] Team_086 possession (Score: 89-109)
FOUL! Shooting foul on Manu Johnson. Franz McGrady to the line for 3 free throws. [Team fouls: 3] (Manu Johnson: 1 personal fouls)   FT 1/3: MISS   FT 2/3: MISS   FT 3/3: MISS Franz McGrady makes 0/3 from the line. Rebound secured by Donovan Green.

[02:37] Team_099 possession (Score: 89-109)
Scottie Quickley attempts a 3Pt. Wide open! Anfernee Green is 6.9 feet away. [ZONE] SCOTTIE QUICKLEY MAKES IT! Assist: Donovan Green
Score: 89-112

[02:26] Team_086 possession (Score: 89-112)
Anthony James attempts a 3Pt. Wide open! Manu Johnson is 7.3 feet away. [ZONE] Anthony James misses. Offensive rebound by Anfernee Green! Anfernee Green kicks it out.

[02:09] Team_086 possession (Score: 89-112)
Anthony James attempts a Midrange. Wide open! Manu Johnson is 6.4 feet away. [MAN] Anthony James misses. Rebound secured by Jarrett Fox.

[01:53] Team_099 possession (Score: 89-112)
Manu Johnson attempts a Layup. Contested by Anthony James (3.4 feet, MAN). MANU JOHNSON MAKES IT!
Score: 89-114

[01:42] Team_086 possession (Score: 89-114)
Anthony James attempts a 3Pt. Contested by Manu Johnson (4.7 feet, ZONE). Anthony James misses. Rebound secured by Donovan Green.

[01:24] Team_099 possession (Score: 89-114)
Scottie Quickley drives to the basket... Scottie Quickley throws a bad pass! Stolen by Franz McGrady! TURNOVER! (live ball)

[01:12] Team_086 possession (Score: 89-114)
Lamelo Towns commits a violation (traveling/carry)! TURNOVER! (dead ball)

[00:57] Team_099 possession (Score: 89-114)
Manu Johnson drives to the basket... FOUL! Offensive foul on Manu Johnson! Anthony James drew the charge! [Team fouls: 4] (Manu Johnson: 2 personal fouls) TURNOVER! (dead ball)

[00:47] Team_086 possession (Score: 89-114)
Franz McGrady loses the ball! Stripped by Scottie Quickley! TURNOVER! (live ball)

[00:32] Team_099 possession (Score: 89-114)
Manu Johnson attempts a 3Pt. Contested by Anthony James (3.8 feet, MAN). MANU JOHNSON MAKES IT! Assist: CJ Cunningham
Score: 89-117

[00:20] Team_086 possession (Score: 89-117)
Franz McGrady attempts a 3Pt. Contested by Scottie Quickley (5.4 feet, MAN). Franz McGrady misses. Rebound secured by Scottie Quickley.

[00:11] Team_099 possession (Score: 89-117)
Jarrett Fox drives to the basket... Jarrett Fox loses control! Ball rolls out of bounds! TURNOVER! (dead ball)

================================================================================
                              4TH QUARTER COMPLETE                              
================================================================================

4TH QUARTER SCORE: Team_086 12, Team_099 23

BOX SCORE:
================================================================================

Team_086
--------------------------------------------------------------------------------
Player                MIN  PTS  REB  AST  TO      FG   FG%      3P   3P%
--------------------------------------------------------------------------------
Anthony James          22    5    0    0   0   2/5    40.0     0/0   0.0
Anfernee Harris        26    3    0    0   0   1/1   100.0     0/0   0.0
Anfernee Green         22    2   10    1   0   1/2    50.0     0/0   0.0
Lamelo Towns           22    2    2    0   0   1/2    50.0     0/0   0.0
Franz McGrady          22    0    0    3   0   0/3     0.0     0/0   0.0
Kyle McCollum          22    0    0    0   0   0/2     0.0     0/0   0.0

TEAM: FG: 5/15 (33.3%), 3PT: 2/7 (28.6%), REB: 12 (5 off, 7 def), AST: 4, TO: 7
TEAM FOULS: 2


Team_099
--------------------------------------------------------------------------------
Player                MIN  PTS  REB  AST  TO      FG   FG%      3P   3P%
--------------------------------------------------------------------------------
Manu Johnson           22   10    0    2   0   4/5    80.0     0/0   0.0
Scottie Quickley       22    7    2    0   0   3/4    75.0     0/0   0.0
Jarrett Fox            22    4    2    0   0   2/4    50.0     0/0   0.0
Donovan Green          22    2    6    1   0   1/2    50.0     0/0   0.0
CJ Cunningham          22    0    0    1   0   0/2     0.0     0/0   0.0

TEAM: FG: 10/17 (58.8%), 3PT: 3/6 (50.0%), REB: 10 (0 off, 10 def), AST: 4, TO: 5
TEAM FOULS: 4

================================================================================

================================================================================
                               FULL GAME COMPLETE                               
================================================================================

FINAL SCORE: Team_086 89, Team_099 117

SCORING BY QUARTER:
--------------------------------------------------------------------------------
Team                     Q1     Q2     Q3     Q4    FINAL
--------------------------------------------------------------------------------
Team_086                 32     22     23     12       89
Team_099                 25     35     34     23      117
--------------------------------------------------------------------------------

FULL GAME BOX SCORE:
================================================================================

Team_086
--------------------------------------------------------------------------------
Player                MIN  PTS  REB  AST  TO      FG   FG%      3P   3P%      FT STL BLK
--------------------------------------------------------------------------------
Anfernee Harris        26    8    0    2   2   3/4    75.0   2/2   100.0   2/2     0   0
Miles Gobert           26    9   10    1   0   3/7    42.9   0/3     0.0   3/3     0   0
Bones Ginobili         26    8    6    2   1   4/11   36.4   2/6    33.3   0/0     0   1
Rudy Rose              26   21    7    0   3   9/12   75.0   0/2     0.0   5/7     2   1
Lauri Johnson          26    9    0    2   1   4/10   40.0   1/5    20.0   4/5     0   0
Anfernee Green         22    9   13    3   1   4/7    57.1   0/3     0.0   1/1     0   0
Anthony James          22   10    0    0   3   4/10   40.0   2/6    33.3   0/0     1   0
Franz McGrady          22    3    0    3   1   1/6    16.7   1/5    20.0   0/3     1   0
Kyle McCollum          22    5    2    0   1   2/7    28.6   1/3    33.3   0/0     2   0
Lamelo Towns           22    4    5    2   1   2/4    50.0   0/0     0.0   0/0     0   0

TEAM: FG: 37/80 (46.2%), 3PT: 9/35 (25.7%), REB: 46 (15 off, 31 def), AST: 15, TO: 14


Team_099
--------------------------------------------------------------------------------
Player                MIN  PTS  REB  AST  TO      FG   FG%      3P   3P%      FT STL BLK
--------------------------------------------------------------------------------
Larry James            26   17    0    0   1   6/9    66.7   4/6    66.7   1/1     2   0
Damian Ginobili        26   11    9    3   1   5/11   45.5   1/3    33.3   1/2     0   0
Vince Lillard          26   15    4    4   2   6/9    66.7   1/2    50.0   2/2     2   2
Larry Wade             26    7   10    6   0   3/6    50.0   0/1     0.0   1/1     0   0
Ayo Barrett            26   15    0    5   2   7/10   70.0   3/3   100.0   3/4     0   0
CJ Cunningham          22    5    0    1   0   2/6    33.3   1/3    33.3   0/0     0   0
Manu Johnson           22   16    0    3   0   6/8    75.0   3/3   100.0   4/4     0   0
Scottie Quickley       22   14    4    1   2   7/9    77.8   3/5    60.0   1/2     1   0
Donovan Green          22    5   10    1   5   2/4    50.0   0/1     0.0   2/3     0   1
Jarrett Fox            22    9    7    2   1   3/6    50.0   0/0     0.0   3/3     1   1

TEAM: FG: 47/78 (60.3%), 3PT: 16/27 (59.3%), REB: 41 (2 off, 39 def), AST: 26, TO: 14

================================================================================
