================================================================================
                        FULL GAME - Team_068 vs Team_081                        
================================================================================

================================================================================
                       1ST QUARTER - Team_068 vs Team_081                       
================================================================================

[12:00] Team_068 possession (Score: 0-0)
Jaren Johnson attempts a 3Pt. Heavily contested by Vince Adebayo (1.4 feet, ZONE)! Jaren Johnson misses. Offensive rebound by Jaren Johnson! Jaren Johnson kicks it out.

[11:46] Team_068 possession (Score: 0-0)
Nikola Ginobili attempts a Layup. Contested by Franz Antetokounmpo (2.4 feet, MAN). NIKOLA GINOBILI MAKES IT! Assist: Zion Anunoby
Score: 2-0

[11:30] Team_081 possession (Score: 2-0)
Bradley Leonard attempts a 3Pt. Contested by Malcolm Herro (5.8 feet, ZONE). Bradley Leonard misses. Rebound secured by Nikola Ginobili.

[11:18] Team_068 possession (Score: 2-0)
Zion Anunoby attempts a 3Pt. Heavily contested by Vince Adebayo (1.6 feet, ZONE)! Zion Anunoby misses. Offensive rebound by Jaren Johnson! Jaren Johnson kicks it out.

[11:03] Team_068 possession (Score: 2-0)
Malcolm Herro drives to the basket... Malcolm Herro commits a violation (traveling/carry)! TURNOVER! (dead ball)

[10:52] Team_081 possession (Score: 2-0)
Bradley Sabonis attempts a Layup. Heavily contested by Gary Simons (1.3 feet, MAN)! Bradley Sabonis misses. Rebound secured by Jaren Johnson.

[10:37] Team_068 possession (Score: 2-0)
Gary Simons attempts a Midrange. Contested by Bradley Sabonis (3.0 feet, MAN). Gary Simons misses. Rebound secured by Vince Adebayo.

[10:22] Team_081 possession (Score: 2-0)
Bradley Leonard attempts a Midrange. Contested by Malcolm Herro (3.8 feet, MAN). BRADLEY LEONARD MAKES IT!
Score: 2-2

[10:05] Team_068 possession (Score: 2-2)
FOUL! Shooting foul on Franz Antetokounmpo. Zion Anunoby to the line for 2 free throws. [Team fouls: 1] (Franz Antetokounmpo: 1 personal fouls)   FT 1/2: GOOD   FT 2/2: GOOD Zion Anunoby makes 2/2 from the line.
Score: 4-2

[09:50] Team_081 possession (Score: 4-2)
Julius Durant attempts a 3Pt. Wide open! Zion Anunoby is 6.4 feet away. [ZONE] Julius Durant misses. Rebound secured by Jaren Johnson.

[09:31] Team_068 possession (Score: 4-2)
Gary Simons attempts a 3Pt. Contested by Bradley Sabonis (5.0 feet, MAN). Gary Simons misses. Rebound secured by Franz Antetokounmpo.

[09:16] Team_081 possession (Score: 4-2)
FOUL! Shooting foul on Jaren Johnson. Vince Adebayo to the line for 2 free throws. [Team fouls: 1] (Jaren Johnson: 1 personal fouls)   FT 1/2: GOOD   FT 2/2: MISS Vince Adebayo makes 1/2 from the line. Rebound secured by Jaren Johnson.
Score: 4-3

[08:59] Team_068 possession (Score: 4-3)
Jaren Johnson attempts a 3Pt. Heavily contested by Vince Adebayo (1.4 feet, ZONE)! JAREN JOHNSON MAKES IT! Assist: Malcolm Herro
Score: 7-3

[08:44] Team_081 possession (Score: 7-3)
Franz Antetokounmpo throws a bad pass out of bounds! TURNOVER! (dead ball)

[08:31] Team_068 possession (Score: 7-3)
Gary Simons throws a bad pass! Stolen by Bradley Sabonis! TURNOVER! (live ball)

[08:20] Team_081 possession (Score: 7-3)
FOUL! Holding foul on Zion Anunoby. [Team fouls: 2] No free throws, side out. (Zion Anunoby: 1 personal fouls)

[08:03] Team_081 possession (Score: 7-3)
FOUL! Reach-in foul on Malcolm Herro during the drive. [Team fouls: 3] No free throws, side out. (Malcolm Herro: 1 personal fouls)

[07:49] Team_081 possession (Score: 7-3)
Bradley Leonard attempts a 3Pt. Heavily contested by Zion Anunoby (1.0 feet, ZONE)! Bradley Leonard misses. Rebound secured by Nikola Ginobili.

[07:33] Team_068 possession (Score: 7-3)
Gary Simons attempts a 3Pt. Contested by Vince Adebayo (3.8 feet, ZONE). Gary Simons misses. Rebound secured by Franz Antetokounmpo.

[07:19] Team_081 possession (Score: 7-3)
Bradley Leonard drives to the basket... Bradley Leonard throws a bad pass! Stolen by Nikola Ginobili! TURNOVER! (live ball)

[07:03] Team_068 possession (Score: 7-3)
Zion Anunoby attempts a 3Pt. Contested by Vince Adebayo (3.6 feet, ZONE). Zion Anunoby misses. Rebound secured by Franz Antetokounmpo.

[06:48] Team_081 possession (Score: 7-3)
FOUL! Shooting foul on Gary Simons. Julius Durant to the line for 2 free throws. [Team fouls: 4] (Gary Simons: 1 personal fouls)   FT 1/2: GOOD   FT 2/2: GOOD Julius Durant makes 2/2 from the line.
Score: 7-5

[06:33] Team_068 possession (Score: 7-5)
Nikola Ginobili attempts a Midrange. Contested by Vince Adebayo (5.0 feet, ZONE). Nikola Ginobili misses. FOUL! Loose ball foul on Bradley Sabonis during the rebound battle. [Team fouls: 2] No free throws, side out. (Bradley Sabonis: 1 personal fouls)

[06:20] Team_068 possession (Score: 7-5)
Zion Anunoby drives and kicks out. Nikola Ginobili attempts a 3Pt. Contested by Franz Antetokounmpo (2.7 feet, MAN). NIKOLA GINOBILI MAKES IT! Assist: Jaren Johnson
Score: 10-5

[06:08] Team_081 possession (Score: 10-5)
FOUL! Holding foul on Nikola Ginobili. [IN THE BONUS! 5 team fouls] Franz Antetokounmpo to the line for 2 free throws. (Nikola Ginobili: 1 personal fouls)   FT 1/2: GOOD   FT 2/2: MISS Franz Antetokounmpo makes 1/2 from the line. Rebound secured by Gary Simons.
Score: 10-6

[05:56] Team_068 possession (Score: 10-6)
Gary Simons attempts a 3Pt. Contested by Vince Adebayo (4.0 feet, ZONE). GARY SIMONS MAKES IT! Assist: Zion Anunoby
Score: 13-6

[05:39] Team_081 possession (Score: 13-6)
Franz Antetokounmpo attempts a Midrange. Contested by Malcolm Herro (4.0 feet, ZONE). Franz Antetokounmpo misses. Rebound secured by Jaren Johnson.

[05:26] Team_068 possession (Score: 13-6)
Zion Anunoby drives, Franz Antetokounmpo stays with him. Zion Anunoby attempts a Layup. Contested by Franz Antetokounmpo (3.8 feet, ZONE). ZION ANUNOBY MAKES IT! Assist: Jaren Johnson
Score: 15-6

[05:10] Team_081 possession (Score: 15-6)
Franz Antetokounmpo attempts a Layup. Contested by Gary Simons (4.8 feet, ZONE). Franz Antetokounmpo misses. Rebound secured by Jaren Johnson.

[04:55] Team_068 possession (Score: 15-6)
Zion Anunoby drives and kicks out. Jaren Johnson attempts a 3Pt. Contested by Bradley Leonard (3.5 feet, ZONE). JAREN JOHNSON MAKES IT! Assist: Zion Anunoby
Score: 18-6

[04:41] Team_081 possession (Score: 18-6)
Bradley Sabonis drives to the basket... Bradley Sabonis commits a violation (traveling/carry)! TURNOVER! (dead ball)

[04:27] Team_068 possession (Score: 18-6)
Gary Simons attempts a Midrange. Wide open! Bradley Sabonis is 7.8 feet away. [MAN] Gary Simons misses. Rebound secured by Vince Adebayo.

[04:12] Team_081 possession (Score: 18-6)
Vince Adebayo attempts a Midrange. Contested by Malcolm Herro (2.4 feet, ZONE). VINCE ADEBAYO MAKES IT! Assist: Bradley Leonard
Score: 18-8

[04:00] Team_068 possession (Score: 18-8)
FOUL! Shooting foul on Bradley Leonard. Jaren Johnson to the line for 2 free throws. [Team fouls: 3] (Bradley Leonard: 1 personal fouls)   FT 1/2: GOOD   FT 2/2: GOOD Jaren Johnson makes 2/2 from the line.
Score: 20-8

[03:43] Team_081 possession (Score: 20-8)
Julius Durant attempts a 3Pt. Contested by Zion Anunoby (3.2 feet, ZONE). Julius Durant misses. Rebound secured by Nikola Ginobili.

[03:33] Team_068 possession (Score: 20-8)
Jaren Johnson makes the Layup and draws the foul on Vince Adebayo! And-1! Jaren Johnson to the line for 1. [Team fouls: 4] (Vince Adebayo: 1 personal fouls)   FT 1/1: GOOD Jaren Johnson makes 1/1 from the line.
Score: 23-8

[03:17] Team_081 possession (Score: 23-8)
FOUL! Shooting foul on Jaren Johnson. Vince Adebayo to the line for 2 free throws. [BONUS: 6 team fouls] (Jaren Johnson: 2 personal fouls)   FT 1/2: GOOD   FT 2/2: GOOD Vince Adebayo makes 2/2 from the line.
Score: 23-10

[03:06] Team_068 possession (Score: 23-10)
Malcolm Herro drives, picks up Bradley Leonard. Help arrives from Vince Adebayo! Malcolm Herro attempts a Layup. Contested by Vince Adebayo (2.9 feet, MAN). MALCOLM HERRO MAKES IT! Assist: Jaren Johnson
Score: 25-10

[02:48] Team_081 possession (Score: 25-10)
Bradley Sabonis drives, Gary Simons stays with him. Bradley Sabonis attempts a Layup. Heavily contested by Gary Simons (0.6 feet, ZONE)! Bradley Sabonis misses. Rebound secured by Gary Simons.

[02:33] Team_068 possession (Score: 25-10)
Gary Simons drives, picks up Bradley Sabonis. Help arrives from Bradley Leonard! Gary Simons attempts a Dunk. Heavily contested by Bradley Leonard (1.6 feet, MAN)! GARY SIMONS MAKES IT!
Score: 27-10

[02:22] Team_081 possession (Score: 27-10)
Bradley Leonard drives, Malcolm Herro stays with him. Bradley Leonard attempts a Dunk. Heavily contested by Malcolm Herro (1.3 feet, MAN)! BRADLEY LEONARD MAKES IT!
Score: 27-12

[02:06] Team_068 possession (Score: 27-12)
Jaren Johnson drives and kicks out. Gary Simons attempts a 3Pt. Contested by Bradley Sabonis (5.7 feet, MAN). GARY SIMONS MAKES IT! Assist: Jaren Johnson
Score: 30-12

[01:54] Team_081 possession (Score: 30-12)
Franz Antetokounmpo attempts a Layup. Contested by Nikola Ginobili (5.3 feet, MAN). FRANZ ANTETOKOUNMPO MAKES IT! Assist: Bradley Sabonis
Score: 30-14

[01:37] Team_068 possession (Score: 30-14)
Jaren Johnson attempts a 3Pt. Contested by Vince Adebayo (4.0 feet, MAN). Jaren Johnson misses. Rebound secured by Bradley Sabonis.

[01:22] Team_081 possession (Score: 30-14)
Franz Antetokounmpo attempts a 3Pt. Contested by Zion Anunoby (3.9 feet, ZONE). Franz Antetokounmpo misses. Rebound secured by Gary Simons.

[01:11] Team_068 possession (Score: 30-14)
Jaren Johnson drives, Vince Adebayo stays with him. Jaren Johnson attempts a Layup. Heavily contested by Vince Adebayo (1.4 feet, MAN)! JAREN JOHNSON MAKES IT! Assist: Nikola Ginobili
Score: 32-14

[00:55] Team_081 possession (Score: 32-14)
Bradley Leonard makes the 3Pt and draws the foul on Zion Anunoby! And-1! Bradley Leonard to the line for 1. [BONUS: 7 team fouls] (Zion Anunoby: 2 personal fouls)   FT 1/1: GOOD Bradley Leonard makes 1/1 from the line.
Score: 32-18

[00:43] Team_068 possession (Score: 32-18)
Gary Simons drives to the basket... Gary Simons loses control! Ball rolls out of bounds! TURNOVER! (dead ball)

[00:43] Substitution (Team_068): Zion Anunoby OUT → Cole Anthony IN (stamina_rule2)

[00:43] Substitution (Team_068): Malcolm Herro OUT → Ja Banchero IN (stamina_rule2)

[00:43] Substitution (Team_068): Jaren Johnson OUT → Miles Murray IN (stamina_rule2)

[00:43] Substitution (Team_068): Gary Simons OUT → Jarrett Oladipo IN (stamina_rule2)

[00:43] Substitution (Team_068): Nikola Ginobili OUT → Franz Curry IN (stamina_rule2)

[00:43] Substitution (Team_081): Julius Durant OUT → Dejounte Bane IN (stamina_rule2)

[00:43] Substitution (Team_081): Bradley Leonard OUT → Lamelo Wade IN (stamina_rule2)

[00:43] Substitution (Team_081): Vince Adebayo OUT → Larry Adebayo IN (stamina_rule2)

[00:43] Substitution (Team_081): Bradley Sabonis OUT → Chris Holiday IN (stamina_rule2)

[00:43] Substitution (Team_081): Franz Antetokounmpo OUT → D'Angelo Markkanen IN (stamina_rule2)

[00:29] Team_081 possession (Score: 32-18)
D'Angelo Markkanen attempts a 3Pt. Contested by Franz Curry (4.2 feet, MAN). D'Angelo Markkanen misses. Rebound secured by Ja Banchero.

[00:15] Team_068 possession (Score: 32-18)
Ja Banchero attempts a Layup. Heavily contested by Chris Holiday (0.6 feet, ZONE)! Ja Banchero misses. Offensive rebound by Jarrett Oladipo! Jarrett Oladipo kicks it out.

[00:01] Team_068 possession (Score: 32-18)
Franz Curry attempts a Midrange. Heavily contested by Chris Holiday (1.2 feet, MAN)! Franz Curry misses. Rebound secured by Larry Adebayo.

================================================================================
                              1ST QUARTER COMPLETE                              
================================================================================

1ST QUARTER SCORE: Team_068 32, Team_081 18

BOX SCORE:
================================================================================

Team_068
--------------------------------------------------------------------------------
Player                MIN  PTS  REB  AST  TO      FG   FG%      3P   3P%
--------------------------------------------------------------------------------
Jaren Johnson          12   13    7    4   0   5/6    83.3     0/0   0.0
Gary Simons            12    8    3    0   0   3/7    42.9     0/0   0.0
Nikola Ginobili        12    5    4    1   0   2/2   100.0     0/0   0.0
Zion Anunoby           12    4    0    3   0   2/3    66.7     0/0   0.0
Malcolm Herro          12    2    0    1   0   1/1   100.0     0/0   0.0
Ja Banchero             1    0    1    0   0   0/0     0.0     0/0   0.0
Jarrett Oladipo         1    0    1    0   0   0/0     0.0     0/0   0.0
Franz Curry             1    0    0    0   0   0/1     0.0     0/0   0.0

TEAM: FG: 13/20 (65.0%), 3PT: 2/6 (33.3%), REB: 16 (4 off, 12 def), AST: 9, TO: 3
TEAM FOULS: 7 [Team_081 in BONUS]


Team_081
--------------------------------------------------------------------------------
Player                MIN  PTS  REB  AST  TO      FG   FG%      3P   3P%
--------------------------------------------------------------------------------
Bradley Leonard        12    8    0    1   0   3/5    60.0     0/0   0.0
Vince Adebayo          12    4    2    0   0   2/3    66.7     0/0   0.0
Julius Durant          12    2    0    0   0   1/3    33.3     0/0   0.0
Franz Antetokounmpo    12    2    3    0   0   1/4    25.0     0/0   0.0
Bradley Sabonis        12    0    1    1   0   0/2     0.0     0/0   0.0
D'Angelo Markkanen      1    0    0    0   0   0/1     0.0     0/0   0.0
Larry Adebayo           1    0    1    0   0   0/0     0.0     0/0   0.0

TEAM: FG: 7/19 (36.8%), 3PT: 1/7 (14.3%), REB: 7 (0 off, 7 def), AST: 2, TO: 3
TEAM FOULS: 4

================================================================================

================================================================================
                       2ND QUARTER - Team_068 vs Team_081                       
================================================================================

[12:00] Substitution (Team_068): Gary Simons OUT → Jarrett Oladipo IN (stamina_rule2)

[12:00] Substitution (Team_068): Nikola Ginobili OUT → Franz Curry IN (stamina_rule2)

[12:00] Substitution (Team_081): Vince Adebayo OUT → Larry Adebayo IN (stamina_rule2)

[12:00] Team_068 possession (Score: 32-18)
Nikola Ginobili drives to the basket... Nikola Ginobili throws a bad pass out of bounds! TURNOVER! (dead ball)

[11:41] Team_081 possession (Score: 32-18)
Julius Durant attempts a 3Pt. Wide open! Zion Anunoby is 8.2 feet away. [MAN] JULIUS DURANT MAKES IT! Assist: Larry Adebayo
Score: 32-21

[11:25] Team_068 possession (Score: 32-21)
Jarrett Oladipo attempts a 3Pt. Wide open! Bradley Sabonis is 6.0 feet away. [MAN] Jarrett Oladipo misses. Offensive rebound by Franz Curry! Franz Curry's putback is no good. Offensive rebound by Franz Curry! Franz Curry kicks it out.

[11:10] Team_068 possession (Score: 32-21)
Jaren Johnson attempts a Layup. Contested by Franz Antetokounmpo (2.5 feet, ZONE). JAREN JOHNSON MAKES IT!
Score: 34-21

[10:55] Team_081 possession (Score: 34-21)
Larry Adebayo makes the Midrange and draws the foul on Jaren Johnson! And-1! Larry Adebayo to the line for 1. [Team fouls: 1] (Jaren Johnson: 1 personal fouls)   FT 1/1: GOOD Larry Adebayo makes 1/1 from the line.
Score: 34-24

[10:40] Team_068 possession (Score: 34-24)
FOUL! Shooting foul on Franz Antetokounmpo. Franz Curry to the line for 2 free throws. [Team fouls: 1] (Franz Antetokounmpo: 1 personal fouls)   FT 1/2: GOOD   FT 2/2: GOOD Franz Curry makes 2/2 from the line.
Score: 36-24

[10:21] Team_081 possession (Score: 36-24)
Larry Adebayo loses the ball! Stripped by Jaren Johnson! TURNOVER! (live ball)

[10:05] Team_068 possession (Score: 36-24)
Malcolm Herro attempts a Midrange. Contested by Bradley Leonard (5.5 feet, MAN). Malcolm Herro misses. Rebound secured by Franz Antetokounmpo.

[09:50] Team_081 possession (Score: 36-24)
Bradley Sabonis drives, picks up Jarrett Oladipo. Help arrives from Malcolm Herro! Bradley Sabonis attempts a Layup. Heavily contested by Malcolm Herro (0.5 feet, MAN)! BRADLEY SABONIS MAKES IT! Assist: Franz Antetokounmpo
Score: 36-26

[09:36] Team_068 possession (Score: 36-26)
Malcolm Herro drives, Franz Antetokounmpo stays with him. Malcolm Herro attempts a Dunk. Contested by Franz Antetokounmpo (3.3 feet, ZONE). MALCOLM HERRO MAKES IT!
Score: 38-26

[09:20] Team_081 possession (Score: 38-26)
Bradley Sabonis attempts a Midrange. Wide open! Jarrett Oladipo is 6.0 feet away. [MAN] Bradley Sabonis misses. Rebound secured by Franz Curry.

[09:06] Team_068 possession (Score: 38-26)
Malcolm Herro attempts a Midrange. Contested by Bradley Leonard (4.3 feet, MAN). Malcolm Herro misses. Rebound secured by Franz Antetokounmpo.

[08:53] Team_081 possession (Score: 38-26)
Larry Adebayo drives to the basket... Larry Adebayo loses the ball! Stripped by Jaren Johnson! TURNOVER! (live ball)

[08:36] Team_068 possession (Score: 38-26)
FOUL! Shooting foul on Bradley Sabonis. Jarrett Oladipo to the line for 3 free throws. [Team fouls: 2] (Bradley Sabonis: 1 personal fouls)   FT 1/3: GOOD   FT 2/3: GOOD   FT 3/3: GOOD Jarrett Oladipo makes 3/3 from the line.
Score: 41-26

[08:24] Team_081 possession (Score: 41-26)
Larry Adebayo attempts a Layup. Contested by Jaren Johnson (5.9 feet, MAN). Larry Adebayo misses. Rebound secured by Jaren Johnson.

[08:11] Team_068 possession (Score: 41-26)
Jarrett Oladipo drives and kicks out. Jarrett Oladipo attempts a Midrange. Contested by Bradley Sabonis (4.3 feet, MAN). Jarrett Oladipo misses. Offensive rebound by Franz Curry! Franz Curry's putback is no good. Rebound secured by Bradley Sabonis.

[07:57] Team_081 possession (Score: 41-26)
FOUL! Shooting foul on Jarrett Oladipo. Bradley Sabonis to the line for 2 free throws. [Team fouls: 2] (Jarrett Oladipo: 1 personal fouls)   FT 1/2: GOOD   FT 2/2: GOOD Bradley Sabonis makes 2/2 from the line.
Score: 41-28

[07:38] Team_068 possession (Score: 41-28)
Zion Anunoby drives and kicks out. Malcolm Herro attempts a 3Pt. Contested by Bradley Leonard (3.0 feet, ZONE). Malcolm Herro misses. Offensive rebound by Franz Curry! Franz Curry puts it back in!
Score: 43-28

[07:25] Team_081 possession (Score: 43-28)
FOUL! Shooting foul on Zion Anunoby. Bradley Sabonis to the line for 3 free throws. [Team fouls: 3] (Zion Anunoby: 1 personal fouls)   FT 1/3: GOOD   FT 2/3: GOOD   FT 3/3: GOOD Bradley Sabonis makes 3/3 from the line.
Score: 43-31

[07:09] Team_068 possession (Score: 43-31)
Zion Anunoby makes the Dunk and draws the foul on Bradley Leonard! And-1! Zion Anunoby to the line for 1. [Team fouls: 3] (Bradley Leonard: 1 personal fouls)   FT 1/1: GOOD Zion Anunoby makes 1/1 from the line.
Score: 46-31

[06:53] Team_081 possession (Score: 46-31)
Larry Adebayo attempts a Layup. Contested by Jaren Johnson (3.6 feet, MAN). LARRY ADEBAYO MAKES IT!
Score: 46-33

[06:39] Team_068 possession (Score: 46-33)
Jarrett Oladipo attempts a Layup. Contested by Bradley Sabonis (3.9 feet, MAN). Jarrett Oladipo misses. Rebound secured by Bradley Sabonis.

[06:24] Team_081 possession (Score: 46-33)
Larry Adebayo attempts a Layup. BLOCKED BY FRANZ CURRY! Ball goes out off Franz Curry. Larry Adebayo's ball!

[06:08] Team_081 possession (Score: 46-33)
Larry Adebayo drives and kicks out. Franz Antetokounmpo attempts a Midrange. BLOCKED BY FRANZ CURRY! Ball is loose! Rebound secured by Jaren Johnson.

[05:54] Team_068 possession (Score: 46-33)
Zion Anunoby attempts a 3Pt. Wide open! Bradley Leonard is 6.7 feet away. [ZONE] Zion Anunoby misses. Rebound secured by Larry Adebayo.

[05:42] Team_081 possession (Score: 46-33)
Julius Durant drives and kicks out. Julius Durant attempts a 3Pt. Contested by Zion Anunoby (3.7 feet, ZONE). Julius Durant misses. Rebound secured by Franz Curry.

[05:26] Team_068 possession (Score: 46-33)
Jarrett Oladipo attempts a Midrange. Wide open! Bradley Sabonis is 10.0 feet away. [MAN] Jarrett Oladipo misses. Offensive rebound by Jarrett Oladipo! Jarrett Oladipo kicks it out.

[05:13] Team_068 possession (Score: 46-33)
Jarrett Oladipo attempts a Midrange. Contested by Larry Adebayo (2.7 feet, ZONE). Jarrett Oladipo misses. Rebound secured by Bradley Sabonis.

[04:59] Team_081 possession (Score: 46-33)
Larry Adebayo drives, picks up Franz Curry. Help arrives from Malcolm Herro! Larry Adebayo attempts a Layup. Contested by Malcolm Herro (4.1 feet, ZONE). LARRY ADEBAYO MAKES IT! Assist: Julius Durant
Score: 46-35

[04:44] Team_068 possession (Score: 46-35)
Zion Anunoby attempts a 3Pt. Contested by Julius Durant (5.7 feet, MAN). Zion Anunoby misses. Rebound secured by Franz Antetokounmpo.

[04:30] Team_081 possession (Score: 46-35)
FOUL! Reach-in foul on Franz Curry during the drive. [Team fouls: 4] No free throws, side out. (Franz Curry: 1 personal fouls)

[04:10] Team_081 possession (Score: 46-35)
Bradley Sabonis drives and kicks out. Bradley Sabonis attempts a 3Pt. Wide open! Jarrett Oladipo is 6.4 feet away. [MAN] Bradley Sabonis misses. FOUL! Loose ball foul on Jaren Johnson during the rebound battle. [IN THE BONUS! 5 team fouls] Larry Adebayo to the line for 2 free throws. (Jaren Johnson: 2 personal fouls)   FT 1/2: GOOD   FT 2/2: GOOD Larry Adebayo makes 2/2 from the line.
Score: 46-37

[03:56] Team_068 possession (Score: 46-37)
Malcolm Herro makes the 3Pt and draws the foul on Bradley Leonard! And-1! Malcolm Herro to the line for 1. [Team fouls: 4] (Bradley Leonard: 2 personal fouls)   FT 1/1: GOOD Malcolm Herro makes 1/1 from the line.
Score: 50-37

[03:42] Team_081 possession (Score: 50-37)
Bradley Sabonis attempts a 3Pt. Wide open! Zion Anunoby is 6.6 feet away. [ZONE] BRADLEY SABONIS MAKES IT! Assist: Bradley Leonard
Score: 50-40

[03:29] Team_068 possession (Score: 50-40)
Jarrett Oladipo drives and kicks out. Jarrett Oladipo attempts a 3Pt. Wide open! Bradley Leonard is 7.3 feet away. [ZONE] JARRETT OLADIPO MAKES IT!
Score: 53-40

[03:12] Team_081 possession (Score: 53-40)
Larry Adebayo attempts a Midrange. Contested by Jaren Johnson (5.8 feet, MAN). Larry Adebayo misses. Rebound secured by Jarrett Oladipo.

[02:57] Team_068 possession (Score: 53-40)
Zion Anunoby drives and kicks out. Franz Curry attempts a Midrange. Wide open! Franz Antetokounmpo is 7.5 feet away. [MAN] Franz Curry misses. Rebound secured by Franz Antetokounmpo.

[02:42] Team_081 possession (Score: 53-40)
Bradley Leonard attempts a 3Pt. Wide open! Malcolm Herro is 6.8 feet away. [MAN] Bradley Leonard misses. Offensive rebound by Larry Adebayo! Larry Adebayo kicks it out.

[02:25] Team_081 possession (Score: 53-40)
Larry Adebayo attempts a Midrange. Wide open! Jaren Johnson is 7.2 feet away. [MAN] Larry Adebayo misses. Rebound secured by Jaren Johnson.

[02:08] Team_068 possession (Score: 53-40)
Malcolm Herro drives and kicks out. Jaren Johnson attempts a 3Pt. Contested by Larry Adebayo (5.6 feet, MAN). Jaren Johnson misses. Rebound secured by Bradley Sabonis.

[01:51] Team_081 possession (Score: 53-40)
Bradley Leonard drives and kicks out. Bradley Leonard attempts a 3Pt. Contested by Malcolm Herro (4.7 feet, MAN). Bradley Leonard misses. Rebound secured by Franz Curry.

[01:41] Team_068 possession (Score: 53-40)
Malcolm Herro drives, picks up Bradley Leonard. Help arrives from Larry Adebayo! Malcolm Herro attempts a Layup. Heavily contested by Larry Adebayo (0.9 feet, MAN)! Malcolm Herro misses. Rebound secured by Franz Antetokounmpo.

[01:27] Team_081 possession (Score: 53-40)
Bradley Sabonis attempts a Midrange. Heavily contested by Jarrett Oladipo (1.9 feet, MAN)! BRADLEY SABONIS MAKES IT!
Score: 53-42

[01:09] Team_068 possession (Score: 53-42)
Malcolm Herro attempts a Midrange. Wide open! Bradley Leonard is 6.4 feet away. [MAN] MALCOLM HERRO MAKES IT!
Score: 55-42

[00:55] Team_081 possession (Score: 55-42)
FOUL! Shooting foul on Jarrett Oladipo. Bradley Sabonis to the line for 2 free throws. [BONUS: 6 team fouls] (Jarrett Oladipo: 2 personal fouls)   FT 1/2: GOOD   FT 2/2: GOOD Bradley Sabonis makes 2/2 from the line.
Score: 55-44

[00:42] Team_068 possession (Score: 55-44)
Jaren Johnson drives, Larry Adebayo stays with him. Jaren Johnson attempts a Dunk. Wide open! Larry Adebayo is 8.7 feet away. [MAN] Jaren Johnson misses. Rebound secured by Bradley Sabonis.

[00:28] Team_081 possession (Score: 55-44)
Larry Adebayo attempts a 3Pt. Contested by Jaren Johnson (5.7 feet, MAN). Larry Adebayo misses. Rebound secured by Franz Curry.

[00:14] Team_068 possession (Score: 55-44)
Zion Anunoby drives, picks up Julius Durant. Help arrives from Larry Adebayo! Zion Anunoby attempts a Layup. Contested by Larry Adebayo (3.2 feet, MAN). ZION ANUNOBY MAKES IT!
Score: 57-44

================================================================================
                              2ND QUARTER COMPLETE                              
================================================================================

2ND QUARTER SCORE: Team_068 25, Team_081 26

BOX SCORE:
================================================================================

Team_068
--------------------------------------------------------------------------------
Player                MIN  PTS  REB  AST  TO      FG   FG%      3P   3P%
--------------------------------------------------------------------------------
Malcolm Herro          24    8    0    0   0   3/7    42.9     0/0   0.0
Jarrett Oladipo        12    6    2    0   0   2/5    40.0     0/0   0.0
Zion Anunoby           24    5    0    0   0   2/5    40.0     0/0   0.0
Franz Curry            12    4    6    0   0   2/2   100.0     0/0   0.0
Jaren Johnson          24    2    3    0   0   1/2    50.0     0/0   0.0

TEAM: FG: 10/21 (47.6%), 3PT: 2/4 (50.0%), REB: 12 (4 off, 8 def), AST: 0, TO: 1
TEAM FOULS: 6 [Team_081 in BONUS]


Team_081
--------------------------------------------------------------------------------
Player                MIN  PTS  REB  AST  TO      FG   FG%      3P   3P%
--------------------------------------------------------------------------------
Bradley Sabonis        24   14    5    0   0   6/7    85.7     0/0   0.0
Larry Adebayo          12    9    2    1   0   4/9    44.4     0/0   0.0
Julius Durant          24    3    0    1   0   1/2    50.0     0/0   0.0
Franz Antetokounmpo    24    0    5    1   0   0/0     0.0     0/0   0.0
Bradley Leonard        24    0    0    1   0   0/1     0.0     0/0   0.0

TEAM: FG: 11/19 (57.9%), 3PT: 3/4 (75.0%), REB: 11 (1 off, 10 def), AST: 4, TO: 2
TEAM FOULS: 4

================================================================================

================================================================================
                       3RD QUARTER - Team_068 vs Team_081                       
================================================================================

[12:00] Team_068 possession (Score: 57-44)
Malcolm Herro attempts a 3Pt. Contested by Vince Adebayo (4.9 feet, ZONE). Malcolm Herro misses. Rebound secured by Bradley Sabonis.

[11:49] Team_081 possession (Score: 57-44)
Vince Adebayo drives, Jaren Johnson stays with him. Vince Adebayo attempts a Layup. Contested by Jaren Johnson (2.2 feet, MAN). Vince Adebayo misses. Offensive rebound by Bradley Sabonis! Bradley Sabonis kicks it out.

[11:33] Team_081 possession (Score: 57-44)
Bradley Sabonis attempts a 3Pt. Wide open! Zion Anunoby is 6.7 feet away. [ZONE] Bradley Sabonis misses. Rebound secured by Nikola Ginobili.

[11:20] Team_068 possession (Score: 57-44)
Malcolm Herro attempts a Midrange. Contested by Bradley Leonard (5.5 feet, MAN). Malcolm Herro misses. Rebound secured by Bradley Sabonis.

[11:02] Team_081 possession (Score: 57-44)
FOUL! Offensive foul on Bradley Leonard! Malcolm Herro drew the charge! [Team fouls: 1] (Bradley Leonard: 1 personal fouls) TURNOVER! (dead ball)

[10:50] Team_068 possession (Score: 57-44)
FOUL! Reach-in foul on Bradley Sabonis during the drive. [Team fouls: 2] No free throws, side out. (Bradley Sabonis: 1 personal fouls)

[10:35] Team_068 possession (Score: 57-44)
Gary Simons drives and kicks out. Malcolm Herro attempts a Midrange. Contested by Bradley Leonard (4.5 feet, ZONE). Malcolm Herro misses. Rebound secured by Bradley Sabonis.

[10:21] Team_081 possession (Score: 57-44)
Bradley Leonard attempts a Midrange. Heavily contested by Gary Simons (0.5 feet, ZONE)! Bradley Leonard misses. Rebound secured by Jaren Johnson.

[10:08] Team_068 possession (Score: 57-44)
Nikola Ginobili drives, Franz Antetokounmpo stays with him. Nikola Ginobili attempts a Dunk. Contested by Franz Antetokounmpo (2.2 feet, MAN). Nikola Ginobili misses. Rebound secured by Franz Antetokounmpo.

[09:54] Team_081 possession (Score: 57-44)
Bradley Sabonis attempts a Midrange. Heavily contested by Gary Simons (1.5 feet, MAN)! Bradley Sabonis misses. Rebound secured by Jaren Johnson.

[09:40] Team_068 possession (Score: 57-44)
FOUL! Offensive foul on Malcolm Herro! Bradley Leonard drew the charge! [Team fouls: 1] (Malcolm Herro: 1 personal fouls) TURNOVER! (dead ball)

[09:27] Team_081 possession (Score: 57-44)
Vince Adebayo attempts a Layup. Heavily contested by Jaren Johnson (0.5 feet, MAN)! VINCE ADEBAYO MAKES IT!
Score: 57-46

[09:16] Team_068 possession (Score: 57-46)
Nikola Ginobili attempts a Layup. Contested by Franz Antetokounmpo (3.2 feet, ZONE). NIKOLA GINOBILI MAKES IT!
Score: 59-46

[08:57] Team_081 possession (Score: 59-46)
Bradley Sabonis attempts a 3Pt. Contested by Gary Simons (2.9 feet, MAN). Bradley Sabonis misses. Rebound secured by Nikola Ginobili.

[08:42] Team_068 possession (Score: 59-46)
Zion Anunoby drives to the basket... Zion Anunoby commits a violation (traveling/carry)! TURNOVER! (dead ball)

[08:27] Team_081 possession (Score: 59-46)
Franz Antetokounmpo drives, Nikola Ginobili stays with him. Franz Antetokounmpo attempts a Dunk. Contested by Nikola Ginobili (5.4 feet, MAN). Franz Antetokounmpo misses. Rebound secured by Jaren Johnson.

[08:08] Team_068 possession (Score: 59-46)
Malcolm Herro attempts a 3Pt. Contested by Bradley Leonard (3.8 feet, MAN). Malcolm Herro misses. Rebound secured by Vince Adebayo.

[07:54] Team_081 possession (Score: 59-46)
Bradley Sabonis drives to the basket... Bradley Sabonis throws a bad pass! Stolen by Gary Simons! TURNOVER! (live ball)

[07:38] Team_068 possession (Score: 59-46)
Jaren Johnson attempts a 3Pt. Contested by Vince Adebayo (5.9 feet, ZONE). Jaren Johnson misses. Rebound secured by Franz Antetokounmpo.

[07:26] Team_081 possession (Score: 59-46)
FOUL! Shooting foul on Malcolm Herro. Franz Antetokounmpo to the line for 2 free throws. [Team fouls: 2] (Malcolm Herro: 2 personal fouls)   FT 1/2: GOOD   FT 2/2: GOOD Franz Antetokounmpo makes 2/2 from the line.
Score: 59-48

[07:13] Team_068 possession (Score: 59-48)
Zion Anunoby attempts a 3Pt. Contested by Vince Adebayo (4.4 feet, ZONE). ZION ANUNOBY MAKES IT! Assist: Malcolm Herro
Score: 62-48

[06:58] Team_081 possession (Score: 62-48)
Bradley Leonard attempts a 3Pt. Contested by Malcolm Herro (4.3 feet, MAN). Bradley Leonard misses. Rebound secured by Jaren Johnson.

[06:42] Team_068 possession (Score: 62-48)
Nikola Ginobili throws a bad pass out of bounds! TURNOVER! (dead ball)

[06:31] Team_081 possession (Score: 62-48)
Franz Antetokounmpo attempts a Dunk. BLOCKED BY MALCOLM HERRO! Ball goes out off Malcolm Herro. Franz Antetokounmpo's ball!

[06:20] Team_081 possession (Score: 62-48)
FOUL! Shooting foul on Zion Anunoby. Franz Antetokounmpo to the line for 3 free throws. [Team fouls: 3] (Zion Anunoby: 1 personal fouls)   FT 1/3: GOOD   FT 2/3: GOOD   FT 3/3: GOOD Franz Antetokounmpo makes 3/3 from the line.
Score: 62-51

[06:04] Team_068 possession (Score: 62-51)
Gary Simons attempts a 3Pt. Contested by Bradley Sabonis (5.7 feet, MAN). Gary Simons misses. Rebound secured by Franz Antetokounmpo.

[05:49] Team_081 possession (Score: 62-51)
Julius Durant makes the Dunk and draws the foul on Zion Anunoby! And-1! Julius Durant to the line for 1. [Team fouls: 4] (Zion Anunoby: 2 personal fouls)   FT 1/1: GOOD Julius Durant makes 1/1 from the line.
Score: 62-54

[05:34] Team_068 possession (Score: 62-54)
FOUL! Reach-in foul on Franz Antetokounmpo during the drive. [Team fouls: 3] No free throws, side out. (Franz Antetokounmpo: 1 personal fouls)

[05:18] Team_068 possession (Score: 62-54)
Gary Simons attempts a Midrange. Contested by Bradley Sabonis (4.0 feet, MAN). Gary Simons misses. Rebound secured by Vince Adebayo.

[05:04] Team_081 possession (Score: 62-54)
Bradley Sabonis makes the Dunk and draws the foul on Malcolm Herro! And-1! Bradley Sabonis to the line for 1. [BONUS: 5 team fouls] (Malcolm Herro: 3 personal fouls)   FT 1/1: GOOD Bradley Sabonis makes 1/1 from the line.
Score: 62-57

[04:53] Team_068 possession (Score: 62-57)
Gary Simons makes the Midrange and draws the foul on Bradley Sabonis! And-1! Gary Simons to the line for 1. [Team fouls: 4] (Bradley Sabonis: 2 personal fouls)   FT 1/1: GOOD Gary Simons makes 1/1 from the line.
Score: 65-57

[04:40] Team_081 possession (Score: 65-57)
Vince Adebayo drives and kicks out. Franz Antetokounmpo attempts a 3Pt. Heavily contested by Jaren Johnson (1.4 feet, ZONE)! Franz Antetokounmpo misses. Rebound secured by Jaren Johnson.

[04:21] Team_068 possession (Score: 65-57)
Nikola Ginobili attempts a Layup. Heavily contested by Bradley Sabonis (0.5 feet, ZONE)! NIKOLA GINOBILI MAKES IT! Assist: Malcolm Herro
Score: 67-57

[04:10] Team_081 possession (Score: 67-57)
Bradley Leonard attempts a 3Pt. BLOCKED BY MALCOLM HERRO! Ball deflects out of bounds off Bradley Leonard.

[03:59] Team_068 possession (Score: 67-57)
Nikola Ginobili attempts a Layup. Heavily contested by Franz Antetokounmpo (1.5 feet, ZONE)! NIKOLA GINOBILI MAKES IT! Assist: Malcolm Herro
Score: 69-57

[03:49] Team_081 possession (Score: 69-57)
Bradley Leonard drives and kicks out. Bradley Leonard attempts a Midrange. Contested by Malcolm Herro (3.8 feet, MAN). Bradley Leonard misses. Offensive rebound by Franz Antetokounmpo! Franz Antetokounmpo's putback is no good. Rebound secured by Gary Simons.

[03:37] Team_068 possession (Score: 69-57)
Zion Anunoby drives, Julius Durant stays with him. Zion Anunoby attempts a Layup. Contested by Julius Durant (4.8 feet, MAN). ZION ANUNOBY MAKES IT! Assist: Gary Simons
Score: 71-57

[03:24] Team_081 possession (Score: 71-57)
Vince Adebayo attempts a Midrange. Wide open! Jaren Johnson is 6.1 feet away. [ZONE] Vince Adebayo misses. Offensive rebound by Franz Antetokounmpo! Franz Antetokounmpo puts it back in!
Score: 71-59

[03:11] Team_068 possession (Score: 71-59)
Jaren Johnson drives, picks up Franz Antetokounmpo. Help arrives from Bradley Leonard! Jaren Johnson attempts a Layup. Heavily contested by Bradley Leonard (0.5 feet, ZONE)! Jaren Johnson misses. Offensive rebound by Nikola Ginobili! Nikola Ginobili puts it back in!
Score: 73-59

[02:59] Team_081 possession (Score: 73-59)
Vince Adebayo makes the Midrange and draws the foul on Jaren Johnson! And-1! Vince Adebayo to the line for 1. [BONUS: 6 team fouls] (Jaren Johnson: 1 personal fouls)   FT 1/1: GOOD Vince Adebayo makes 1/1 from the line.
Score: 73-62

[02:44] Team_068 possession (Score: 73-62)
Jaren Johnson attempts a 3Pt. Contested by Bradley Leonard (4.5 feet, ZONE). JAREN JOHNSON MAKES IT! Assist: Malcolm Herro
Score: 76-62

[02:27] Team_081 possession (Score: 76-62)
Franz Antetokounmpo drives and kicks out. Bradley Sabonis attempts a 3Pt. Contested by Gary Simons (3.1 feet, MAN). Bradley Sabonis misses. FOUL! Loose ball foul on Jaren Johnson during the rebound battle. [IN THE BONUS! 7 team fouls] Franz Antetokounmpo to the line for 2 free throws. (Jaren Johnson: 2 personal fouls)   FT 1/2: GOOD   FT 2/2: MISS Franz Antetokounmpo makes 1/2 from the line. Rebound secured by Gary Simons.
Score: 76-63

[02:17] Team_068 possession (Score: 76-63)
Gary Simons attempts a Layup. Wide open! Bradley Sabonis is 7.7 feet away. [ZONE] GARY SIMONS MAKES IT!
Score: 78-63

[02:03] Team_081 possession (Score: 78-63)
Julius Durant drives, Gary Simons stays with him. Julius Durant attempts a Dunk. Wide open! Gary Simons is 6.2 feet away. [ZONE] Julius Durant misses. Offensive rebound by Franz Antetokounmpo! Franz Antetokounmpo's putback is no good. Rebound secured by Jaren Johnson.

[01:49] Team_068 possession (Score: 78-63)
Nikola Ginobili attempts a Midrange. Wide open! Franz Antetokounmpo is 8.1 feet away. [MAN] Nikola Ginobili misses. Offensive rebound by Jaren Johnson! Jaren Johnson kicks it out.

[01:38] Team_068 possession (Score: 78-63)
Nikola Ginobili attempts a 3Pt. Contested by Bradley Leonard (5.5 feet, ZONE). Nikola Ginobili misses. Rebound secured by Franz Antetokounmpo.

[01:27] Team_081 possession (Score: 78-63)
Franz Antetokounmpo drives and kicks out. Bradley Sabonis attempts a 3Pt. Contested by Gary Simons (4.2 feet, MAN). Bradley Sabonis misses. Rebound secured by Jaren Johnson.

[01:13] Team_068 possession (Score: 78-63)
Nikola Ginobili attempts a 3Pt. Contested by Franz Antetokounmpo (4.5 feet, MAN). Nikola Ginobili misses. Rebound secured by Bradley Sabonis.

[00:57] Team_081 possession (Score: 78-63)
Franz Antetokounmpo attempts a Midrange. Wide open! Nikola Ginobili is 7.4 feet away. [MAN] FRANZ ANTETOKOUNMPO MAKES IT! Assist: Julius Durant
Score: 78-65

[00:39] Team_068 possession (Score: 78-65)
Gary Simons attempts a Midrange. Contested by Vince Adebayo (3.7 feet, ZONE). Gary Simons misses. Rebound secured by Franz Antetokounmpo.

[00:23] Team_081 possession (Score: 78-65)
Franz Antetokounmpo attempts a Midrange. Contested by Malcolm Herro (4.0 feet, ZONE). FRANZ ANTETOKOUNMPO MAKES IT! Assist: Julius Durant
Score: 78-67

[00:13] Team_068 possession (Score: 78-67)
Nikola Ginobili attempts a 3Pt. Contested by Bradley Leonard (4.2 feet, ZONE). Nikola Ginobili misses. Rebound secured by Vince Adebayo.

================================================================================
                              3RD QUARTER COMPLETE                              
================================================================================

3RD QUARTER SCORE: Team_068 21, Team_081 23

BOX SCORE:
================================================================================

Team_068
--------------------------------------------------------------------------------
Player                MIN  PTS  REB  AST  TO      FG   FG%      3P   3P%
--------------------------------------------------------------------------------
Nikola Ginobili        24    8    3    0   0   4/8    50.0     0/0   0.0
Gary Simons            24    5    2    1   0   2/6    33.3     0/0   0.0
Zion Anunoby           36    5    0    0   0   2/2   100.0     0/0   0.0
Jaren Johnson          36    3    8    0   0   1/2    50.0     0/0   0.0
Malcolm Herro          36    0    0    4   0   0/3     0.0     0/0   0.0

TEAM: FG: 9/21 (42.9%), 3PT: 2/9 (22.2%), REB: 10 (2 off, 8 def), AST: 5, TO: 3
TEAM FOULS: 7 [Team_081 in BONUS]


Team_081
--------------------------------------------------------------------------------
Player                MIN  PTS  REB  AST  TO      FG   FG%      3P   3P%
--------------------------------------------------------------------------------
Franz Antetokounmpo    36   11    6    0   0   5/8    62.5     0/0   0.0
Vince Adebayo          24    5    3    0   0   2/3    66.7     0/0   0.0
Bradley Sabonis        36    3    5    0   0   1/4    25.0     0/0   0.0
Julius Durant          36    3    0    2   0   1/2    50.0     0/0   0.0
Bradley Leonard        36    0    0    0   0   0/4     0.0     0/0   0.0

TEAM: FG: 9/21 (42.9%), 3PT: 1/5 (20.0%), REB: 17 (5 off, 12 def), AST: 2, TO: 2
TEAM FOULS: 4

================================================================================

================================================================================
                       4TH QUARTER - Team_068 vs Team_081                       
================================================================================

[12:00] Team_068 possession (Score: 78-67)
Zion Anunoby drives and kicks out. Jaren Johnson attempts a 3Pt. Contested by Bradley Leonard (3.9 feet, ZONE). Jaren Johnson misses. Rebound secured by Franz Antetokounmpo.

[11:42] Team_081 possession (Score: 78-67)
Franz Antetokounmpo drives and kicks out. Franz Antetokounmpo attempts a 3Pt. Contested by Zion Anunoby (2.2 feet, ZONE). Franz Antetokounmpo misses. Rebound secured by Jaren Johnson.

[11:26] Team_068 possession (Score: 78-67)
Nikola Ginobili attempts a Midrange. Wide open! Franz Antetokounmpo is 7.9 feet away. [MAN] Nikola Ginobili misses. Rebound secured by Vince Adebayo.

[11:14] Team_081 possession (Score: 78-67)
Vince Adebayo attempts a Midrange. Contested by Jaren Johnson (5.6 feet, MAN). Vince Adebayo misses. Rebound secured by Gary Simons.

[10:59] Team_068 possession (Score: 78-67)
Gary Simons attempts a 3Pt. Contested by Bradley Sabonis (5.8 feet, MAN). Gary Simons misses. Offensive rebound by Nikola Ginobili! Nikola Ginobili's putback is no good. Rebound secured by Bradley Sabonis.

[10:46] Team_081 possession (Score: 78-67)
Vince Adebayo attempts a 3Pt. Contested by Zion Anunoby (5.9 feet, ZONE). VINCE ADEBAYO MAKES IT! Assist: Bradley Sabonis
Score: 78-70

[10:35] Team_068 possession (Score: 78-70)
Nikola Ginobili drives to the basket... Nikola Ginobili loses the ball! Stripped by Franz Antetokounmpo! TURNOVER! (live ball)

[10:17] Team_081 possession (Score: 78-70)
Franz Antetokounmpo attempts a Midrange. Wide open! Nikola Ginobili is 6.3 feet away. [MAN] Franz Antetokounmpo misses. Rebound secured by Gary Simons.

[10:03] Team_068 possession (Score: 78-70)
Malcolm Herro attempts a 3Pt. Contested by Bradley Leonard (4.5 feet, MAN). Malcolm Herro misses. Rebound secured by Vince Adebayo.

[09:50] Team_081 possession (Score: 78-70)
Bradley Sabonis attempts a Midrange. Contested by Zion Anunoby (2.4 feet, ZONE). Bradley Sabonis misses. Offensive rebound by Bradley Sabonis! Bradley Sabonis kicks it out.

[09:33] Team_081 possession (Score: 78-70)
Bradley Sabonis attempts a 3Pt. Contested by Gary Simons (4.6 feet, MAN). BRADLEY SABONIS MAKES IT!
Score: 78-73

[09:16] Team_068 possession (Score: 78-73)
Jaren Johnson loses control! Ball rolls out of bounds! TURNOVER! (dead ball)

[09:16] Substitution (Team_068): Zion Anunoby OUT → Cole Anthony IN (stamina_rule2)

[09:16] Substitution (Team_068): Malcolm Herro OUT → Ja Banchero IN (stamina_rule2)

[09:16] Substitution (Team_068): Jaren Johnson OUT → Miles Murray IN (stamina_rule2)

[09:16] Substitution (Team_068): Gary Simons OUT → Jarrett Oladipo IN (stamina_rule2)

[09:16] Substitution (Team_068): Nikola Ginobili OUT → Franz Curry IN (stamina_rule2)

[09:16] Substitution (Team_081): Julius Durant OUT → Dejounte Bane IN (stamina_rule2)

[09:16] Substitution (Team_081): Bradley Leonard OUT → Lamelo Wade IN (stamina_rule2)

[09:16] Substitution (Team_081): Vince Adebayo OUT → Larry Adebayo IN (stamina_rule2)

[09:16] Substitution (Team_081): Bradley Sabonis OUT → Chris Holiday IN (stamina_rule2)

[09:16] Substitution (Team_081): Franz Antetokounmpo OUT → D'Angelo Markkanen IN (stamina_rule2)

[08:59] Team_081 possession (Score: 78-73)
Dejounte Bane makes the Layup and draws the foul on Cole Anthony! And-1! Dejounte Bane to the line for 1. [Team fouls: 1] (Cole Anthony: 1 personal fouls)   FT 1/1: MISS Dejounte Bane makes 0/1 from the line. Rebound secured by Ja Banchero.
Score: 78-75

[08:42] Team_068 possession (Score: 78-75)
FOUL! Shooting foul on Dejounte Bane. Cole Anthony to the line for 2 free throws. [Team fouls: 1] (Dejounte Bane: 1 personal fouls)   FT 1/2: GOOD   FT 2/2: GOOD Cole Anthony makes 2/2 from the line.
Score: 80-75

[08:27] Team_081 possession (Score: 80-75)
Chris Holiday throws a bad pass out of bounds! TURNOVER! (dead ball)

[08:13] Team_068 possession (Score: 80-75)
Miles Murray makes the Layup and draws the foul on Larry Adebayo! And-1! Miles Murray to the line for 1. [Team fouls: 2] (Larry Adebayo: 1 personal fouls)   FT 1/1: GOOD Miles Murray makes 1/1 from the line.
Score: 83-75

[07:55] Team_081 possession (Score: 83-75)
Larry Adebayo commits a violation (traveling/carry)! TURNOVER! (dead ball)

[07:43] Team_068 possession (Score: 83-75)
Jarrett Oladipo attempts a Midrange. Wide open! Chris Holiday is 8.1 feet away. [MAN] Jarrett Oladipo misses. Rebound secured by Chris Holiday.

[07:23] Team_081 possession (Score: 83-75)
Larry Adebayo attempts a 3Pt. Wide open! Miles Murray is 6.3 feet away. [MAN] Larry Adebayo misses. Offensive rebound by Chris Holiday! Chris Holiday kicks it out.

[07:09] Team_081 possession (Score: 83-75)
Larry Adebayo attempts a Layup. Wide open! Miles Murray is 7.1 feet away. [MAN] LARRY ADEBAYO MAKES IT! Assist: Chris Holiday
Score: 83-77

[06:59] Team_068 possession (Score: 83-77)
Ja Banchero attempts a 3Pt. Contested by Lamelo Wade (4.0 feet, MAN). Ja Banchero misses. Offensive rebound by Jarrett Oladipo! Jarrett Oladipo kicks it out.

[06:48] Team_068 possession (Score: 83-77)
Cole Anthony attempts a 3Pt. Wide open! Larry Adebayo is 7.7 feet away. [ZONE] COLE ANTHONY MAKES IT! Assist: Jarrett Oladipo
Score: 86-77

[06:38] Team_081 possession (Score: 86-77)
D'Angelo Markkanen attempts a Midrange. Contested by Jarrett Oladipo (5.0 feet, ZONE). D'Angelo Markkanen misses. Offensive rebound by Chris Holiday! Chris Holiday kicks it out.

[06:23] Team_081 possession (Score: 86-77)
Larry Adebayo attempts a 3Pt. Contested by Miles Murray (5.2 feet, MAN). Larry Adebayo misses. Rebound secured by Franz Curry.

[06:05] Team_068 possession (Score: 86-77)
FOUL! Shooting foul on Lamelo Wade. Miles Murray to the line for 2 free throws. [Team fouls: 3] (Lamelo Wade: 1 personal fouls)   FT 1/2: MISS   FT 2/2: GOOD Miles Murray makes 1/2 from the line.
Score: 87-77

[05:47] Team_081 possession (Score: 87-77)
Lamelo Wade attempts a 3Pt. Wide open! Ja Banchero is 6.3 feet away. [ZONE] LAMELO WADE MAKES IT! Assist: Chris Holiday
Score: 87-80

[05:36] Team_068 possession (Score: 87-80)
FOUL! Holding foul on Chris Holiday. [Team fouls: 4] No free throws, side out. (Chris Holiday: 1 personal fouls)

[05:19] Team_068 possession (Score: 87-80)
FOUL! Shooting foul on Chris Holiday. Franz Curry to the line for 2 free throws. [BONUS: 5 team fouls] (Chris Holiday: 2 personal fouls)   FT 1/2: GOOD   FT 2/2: GOOD Franz Curry makes 2/2 from the line.
Score: 89-80

[05:08] Team_081 possession (Score: 89-80)
Dejounte Bane drives, picks up Franz Curry. Help arrives from Ja Banchero! Dejounte Bane attempts a Layup. Contested by Ja Banchero (3.5 feet, ZONE). DEJOUNTE BANE MAKES IT! Assist: D'Angelo Markkanen
Score: 89-82

[04:55] Team_068 possession (Score: 89-82)
Cole Anthony makes the Layup and draws the foul on Chris Holiday! And-1! Cole Anthony to the line for 1. [BONUS: 6 team fouls] (Chris Holiday: 3 personal fouls)   FT 1/1: GOOD Cole Anthony makes 1/1 from the line.
Score: 92-82

[04:41] Team_081 possession (Score: 92-82)
Lamelo Wade makes the Layup and draws the foul on Ja Banchero! And-1! Lamelo Wade to the line for 1. [Team fouls: 2] (Ja Banchero: 1 personal fouls)   FT 1/1: GOOD Lamelo Wade makes 1/1 from the line.
Score: 92-85

[04:27] Team_068 possession (Score: 92-85)
Miles Murray attempts a 3Pt. Wide open! Larry Adebayo is 6.3 feet away. [MAN] Miles Murray misses. Rebound secured by Lamelo Wade.

[04:09] Team_081 possession (Score: 92-85)
Dejounte Bane commits a violation (traveling/carry)! TURNOVER! (dead ball)

[03:52] Team_068 possession (Score: 92-85)
Cole Anthony drives to the basket... Cole Anthony throws a bad pass out of bounds! TURNOVER! (dead ball)

[03:38] Team_081 possession (Score: 92-85)
Chris Holiday attempts a 3Pt. Heavily contested by Jarrett Oladipo (0.5 feet, MAN)! Chris Holiday misses. Offensive rebound by Lamelo Wade! Lamelo Wade kicks it out.

[03:25] Team_081 possession (Score: 92-85)
Larry Adebayo attempts a 3Pt. Contested by Miles Murray (2.8 feet, MAN). Larry Adebayo misses. Rebound secured by Franz Curry.

[03:13] Team_068 possession (Score: 92-85)
Franz Curry attempts a Layup. Contested by Chris Holiday (2.6 feet, ZONE). FRANZ CURRY MAKES IT!
Score: 94-85

[02:56] Team_081 possession (Score: 94-85)
Chris Holiday throws a bad pass out of bounds! TURNOVER! (dead ball)

[02:38] Team_068 possession (Score: 94-85)
Franz Curry makes the Layup and draws the foul on Lamelo Wade! And-1! Franz Curry to the line for 1. [BONUS: 7 team fouls] (Lamelo Wade: 2 personal fouls)   FT 1/1: GOOD Franz Curry makes 1/1 from the line.
Score: 97-85

[02:21] Team_081 possession (Score: 97-85)
Chris Holiday attempts a 3Pt. Contested by Jarrett Oladipo (5.6 feet, MAN). Chris Holiday misses. Offensive rebound by Chris Holiday! Chris Holiday kicks it out.

[02:07] Team_081 possession (Score: 97-85)
Chris Holiday throws a bad pass! Stolen by Jarrett Oladipo! TURNOVER! (live ball)

[01:52] Team_068 possession (Score: 97-85)
Jarrett Oladipo attempts a 3Pt. Contested by Chris Holiday (4.0 feet, ZONE). Jarrett Oladipo misses. Offensive rebound by Jarrett Oladipo! Jarrett Oladipo kicks it out.

[01:40] Team_068 possession (Score: 97-85)
FOUL! Shooting foul on Dejounte Bane. Cole Anthony to the line for 2 free throws. [BONUS: 8 team fouls] (Dejounte Bane: 2 personal fouls)   FT 1/2: GOOD   FT 2/2: GOOD Cole Anthony makes 2/2 from the line.
Score: 99-85

[01:28] Team_081 possession (Score: 99-85)
FOUL! Reach-in foul on Cole Anthony during the drive. [Team fouls: 3] No free throws, side out. (Cole Anthony: 2 personal fouls)

[01:13] Team_081 possession (Score: 99-85)
Larry Adebayo attempts a 3Pt. Contested by Ja Banchero (4.9 feet, ZONE). Larry Adebayo misses. Offensive rebound by Lamelo Wade! Lamelo Wade kicks it out.

[01:03] Team_081 possession (Score: 99-85)
D'Angelo Markkanen attempts a Layup. Contested by Franz Curry (3.7 feet, ZONE). D'ANGELO MARKKANEN MAKES IT! Assist: Larry Adebayo
Score: 99-87

[00:47] Team_068 possession (Score: 99-87)
Ja Banchero attempts a Layup. Heavily contested by Lamelo Wade (1.5 feet, MAN)! Ja Banchero misses. Rebound secured by Lamelo Wade.

[00:33] Team_081 possession (Score: 99-87)
Chris Holiday attempts a Midrange. Contested by Jarrett Oladipo (3.4 feet, MAN). CHRIS HOLIDAY MAKES IT!
Score: 99-89

[00:16] Team_068 possession (Score: 99-89)
Miles Murray attempts a Layup. Contested by Larry Adebayo (4.0 feet, MAN). Miles Murray misses. Rebound secured by Larry Adebayo.

[00:01] Team_081 possession (Score: 99-89)
Larry Adebayo attempts a 3Pt. Contested by Jarrett Oladipo (2.5 feet, ZONE). Larry Adebayo misses. Rebound secured by Jarrett Oladipo.

================================================================================
                              4TH QUARTER COMPLETE                              
================================================================================

4TH QUARTER SCORE: Team_068 21, Team_081 22

BOX SCORE:
================================================================================

Team_068
--------------------------------------------------------------------------------
Player                MIN  PTS  REB  AST  TO      FG   FG%      3P   3P%
--------------------------------------------------------------------------------
Cole Anthony           10   10    0    0   0   4/4   100.0     0/0   0.0
Franz Curry            22    7    2    0   0   3/3   100.0     0/0   0.0
Miles Murray           10    4    0    0   0   2/4    50.0     0/0   0.0
Zion Anunoby           39    0    0    0   0   0/1     0.0     0/0   0.0
Jaren Johnson          39    0    1    0   0   0/0     0.0     0/0   0.0
Nikola Ginobili        27    0    0    0   0   0/1     0.0     0/0   0.0
Gary Simons            27    0    2    0   0   0/1     0.0     0/0   0.0
Malcolm Herro          39    0    0    0   0   0/1     0.0     0/0   0.0
Ja Banchero            10    0    1    0   0   0/1     0.0     0/0   0.0
Jarrett Oladipo        22    0    3    1   0   0/1     0.0     0/0   0.0

TEAM: FG: 9/17 (52.9%), 3PT: 1/4 (25.0%), REB: 10 (3 off, 7 def), AST: 1, TO: 3
TEAM FOULS: 3


Team_081
--------------------------------------------------------------------------------
Player                MIN  PTS  REB  AST  TO      FG   FG%      3P   3P%
--------------------------------------------------------------------------------
Lamelo Wade            10    6    4    0   0   2/2   100.0     0/0   0.0
Vince Adebayo          27    3    2    0   0   1/2    50.0     0/0   0.0
Bradley Sabonis        39    3    2    1   0   1/1   100.0     0/0   0.0
Dejounte Bane          10    2    0    0   0   1/2    50.0     0/0   0.0
Chris Holiday          10    2    4    2   0   1/1   100.0     0/0   0.0
Larry Adebayo          22    2    1    1   0   1/4    25.0     0/0   0.0
D'Angelo Markkanen     10    2    0    1   0   1/1   100.0     0/0   0.0
Franz Antetokounmpo    39    0    1    0   0   0/2     0.0     0/0   0.0

TEAM: FG: 8/15 (53.3%), 3PT: 3/6 (50.0%), REB: 13 (6 off, 7 def), AST: 5, TO: 5
TEAM FOULS: 8 [Team_068 in BONUS]

================================================================================

================================================================================
                               FULL GAME COMPLETE                               
================================================================================

FINAL SCORE: Team_068 99, Team_081 89

SCORING BY QUARTER:
--------------------------------------------------------------------------------
Team                     Q1     Q2     Q3     Q4    FINAL
--------------------------------------------------------------------------------
Team_068                 32     25     21     21       99
Team_081                 18     26     23     22       89
--------------------------------------------------------------------------------

FULL GAME BOX SCORE:
================================================================================

Team_068
--------------------------------------------------------------------------------
Player                MIN  PTS  REB  AST  TO      FG   FG%      3P   3P%      FT STL BLK
--------------------------------------------------------------------------------
Zion Anunoby           39   14    0    3   0   9/14   64.3   1/4    25.0   3/3     0   0
Malcolm Herro          39   10    0    5   3   4/12   33.3   1/4    25.0   1/1     0   2
Jaren Johnson          39   18   19    4   2   8/11   72.7   2/4    50.0   3/3     2   0
Gary Simons            27   13    7    1   2   4/13   30.8   1/5    20.0   1/1     1   0
Nikola Ginobili        27   13    7    1   2   4/9    44.4   0/3     0.0   0/0     1   0
Jarrett Oladipo        22    6    6    1   0   2/6    33.3   1/1   100.0   3/3     1   0
Franz Curry            22   11    8    0   0   4/5    80.0   0/0     0.0   5/5     0   2
Cole Anthony           10   10    0    0   0   4/4   100.0   1/1   100.0   5/5     0   0
Ja Banchero            10    0    2    0   1   0/1     0.0   0/0     0.0   0/0     0   0
Miles Murray           10    4    0    0   0   2/4    50.0   0/1     0.0   2/3     0   0

TEAM: FG: 41/79 (51.9%), 3PT: 7/23 (30.4%), REB: 48 (13 off, 35 def), AST: 15, TO: 10


Team_081
--------------------------------------------------------------------------------
Player                MIN  PTS  REB  AST  TO      FG   FG%      3P   3P%      FT STL BLK
--------------------------------------------------------------------------------
Julius Durant          39    8    0    3   2   3/7    42.9   1/3    33.3   3/3     0   0
Bradley Leonard        39    8    0    2   2   3/10   30.0   1/5    20.0   1/1     0   0
Bradley Sabonis        39   20   13    2   1   9/15   60.0   3/5    60.0   8/8     1   0
Franz Antetokounmpo    39   13   15    1   1   5/13   38.5   1/2    50.0   7/9     1   0
Vince Adebayo          27   12    7    0   0   6/9    66.7   1/1   100.0   4/5     0   0
Larry Adebayo          22   11    4    2   2   4/12   33.3   0/4     0.0   3/3     0   0
Dejounte Bane          10    2    0    0   1   1/2    50.0   0/0     0.0   0/1     0   0
Lamelo Wade            10    6    4    0   0   2/2   100.0   1/1   100.0   1/1     0   0
Chris Holiday          10    2    4    2   3   1/1   100.0   0/0     0.0   0/0     0   0
D'Angelo Markkanen     10    2    0    1   0   1/2    50.0   0/1     0.0   0/0     0   0

TEAM: FG: 35/74 (47.3%), 3PT: 8/22 (36.4%), REB: 48 (12 off, 36 def), AST: 13, TO: 12

================================================================================
