================================================================================
                        FULL GAME - Team_088 vs Team_063                        
================================================================================

================================================================================
                       1ST QUARTER - Team_088 vs Team_063                       
================================================================================

[12:00] Team_088 possession (Score: 0-0)
Allen Ming attempts a Dunk. BLOCKED BY TYLER HARRIS! Ball deflects out of bounds off Allen Ming.

[11:44] Team_063 possession (Score: 0-0)
Terry Reaves attempts a Midrange. Contested by Tyler Hyland (5.7 feet, MAN). TERRY REAVES MAKES IT! Assist: Tyler Harris
Score: 0-2

[11:35] Team_088 possession (Score: 0-2)
Tobias Haliburton attempts a Midrange. Contested by Dirk Reaves (3.0 feet, ZONE). Tobias Haliburton misses. Rebound secured by Tyler Harris.

[11:22] Team_063 possession (Score: 0-2)
Terry Reaves drives and kicks out. Malcolm Quickley attempts a 3Pt. Contested by Tobias Haliburton (3.4 feet, ZONE). Malcolm Quickley misses. Rebound secured by Giannis Smith.

[11:12] Team_088 possession (Score: 0-2)
Josh Duncan attempts a 3Pt. Contested by Malcolm Quickley (4.9 feet, ZONE). JOSH DUNCAN MAKES IT! Assist: Tyler Hyland
Score: 3-2

[10:59] Team_063 possession (Score: 3-2)
Terry Reaves throws a bad pass! Stolen by Tyler Hyland! TURNOVER! (live ball)

[10:43] Team_088 possession (Score: 3-2)
Tobias Haliburton attempts a 3Pt. Contested by Malcolm Quickley (2.9 feet, MAN). TOBIAS HALIBURTON MAKES IT! Assist: Tyler Hyland
Score: 6-2

[10:30] Team_063 possession (Score: 6-2)
Tyler Harris attempts a 3Pt. Contested by Allen Ming (2.3 feet, MAN). Tyler Harris misses. Rebound secured by Allen Ming.

[10:18] Team_088 possession (Score: 6-2)
Allen Ming attempts a Layup. Contested by Dirk Reaves (5.9 feet, ZONE). Allen Ming misses. Rebound secured by Malcolm Quickley.

[10:07] Team_063 possession (Score: 6-2)
Tyler Harris attempts a 3Pt. Heavily contested by Allen Ming (1.2 feet, MAN)! Tyler Harris misses. Rebound secured by Allen Ming.

[09:51] Team_088 possession (Score: 6-2)
Tyler Hyland attempts a 3Pt. Contested by Terry Reaves (4.2 feet, MAN). Tyler Hyland misses. Rebound secured by Malcolm Quickley.

[09:37] Team_063 possession (Score: 6-2)
Tyler Harris drives to the basket... Tyler Harris loses control! Ball rolls out of bounds! TURNOVER! (dead ball)

[09:23] Team_088 possession (Score: 6-2)
Tobias Haliburton attempts a 3Pt. Contested by Malcolm Quickley (5.9 feet, ZONE). Tobias Haliburton misses. Rebound secured by Malcolm Quickley.

[09:08] Team_063 possession (Score: 6-2)
Dirk Reaves makes the Layup and draws the foul on Giannis Smith! And-1! Dirk Reaves to the line for 1. [Team fouls: 1] (Giannis Smith: 1 personal fouls)   FT 1/1: GOOD Dirk Reaves makes 1/1 from the line.
Score: 6-5

[08:54] Team_088 possession (Score: 6-5)
Tobias Haliburton attempts a 3Pt. Heavily contested by Malcolm Quickley (0.5 feet, ZONE)! Tobias Haliburton misses. Rebound secured by Malcolm Quickley.

[08:41] Team_063 possession (Score: 6-5)
Dirk Reaves attempts a 3Pt. Contested by Tobias Haliburton (5.4 feet, ZONE). Dirk Reaves misses. Rebound secured by Giannis Smith.

[08:26] Team_088 possession (Score: 6-5)
Tobias Haliburton attempts a Layup. BLOCKED BY MALCOLM QUICKLEY! Ball is loose! Rebound secured by Tyler Harris.

[08:10] Team_063 possession (Score: 6-5)
FOUL! Holding foul on Tobias Haliburton. [Team fouls: 2] No free throws, side out. (Tobias Haliburton: 1 personal fouls)

[07:56] Team_063 possession (Score: 6-5)
Bradley Davis throws a bad pass out of bounds! TURNOVER! (dead ball)

[07:43] Team_088 possession (Score: 6-5)
Josh Duncan attempts a Midrange. Wide open! Bradley Davis is 6.6 feet away. [MAN] JOSH DUNCAN MAKES IT! Assist: Tyler Hyland
Score: 8-5

[07:26] Team_063 possession (Score: 8-5)
Terry Reaves attempts a 3Pt. Contested by Tobias Haliburton (4.7 feet, ZONE). TERRY REAVES MAKES IT! Assist: Bradley Davis
Score: 8-8

[07:09] Team_088 possession (Score: 8-8)
Josh Duncan attempts a 3Pt. Contested by Bradley Davis (3.5 feet, MAN). Josh Duncan misses. Rebound secured by Malcolm Quickley.

[06:54] Team_063 possession (Score: 8-8)
Tyler Harris attempts a Midrange. Wide open! Allen Ming is 8.9 feet away. [MAN] TYLER HARRIS MAKES IT!
Score: 8-10

[06:37] Team_088 possession (Score: 8-10)
Tobias Haliburton attempts a Layup. Wide open! Tyler Harris is 6.7 feet away. [ZONE] TOBIAS HALIBURTON MAKES IT!
Score: 10-10

[06:23] Team_063 possession (Score: 10-10)
FOUL! Reach-in foul on Giannis Smith during the drive. [Team fouls: 3] No free throws, side out. (Giannis Smith: 2 personal fouls)

[06:09] Team_063 possession (Score: 10-10)
Bradley Davis drives to the basket... FOUL! Offensive foul on Bradley Davis! Josh Duncan drew the charge! [Team fouls: 1] (Bradley Davis: 1 personal fouls) TURNOVER! (dead ball)

[05:56] Team_088 possession (Score: 10-10)
Tobias Haliburton attempts a Midrange. Heavily contested by Malcolm Quickley (0.5 feet, MAN)! Tobias Haliburton misses. Offensive rebound by Giannis Smith! Giannis Smith puts it back in!
Score: 12-10

[05:45] Team_063 possession (Score: 12-10)
Dirk Reaves drives and kicks out. Terry Reaves attempts a 3Pt. Contested by Tyler Hyland (3.2 feet, MAN). Terry Reaves misses. Rebound secured by Allen Ming.

[05:31] Team_088 possession (Score: 12-10)
FOUL! Offensive foul on Josh Duncan! Bradley Davis drew the charge! [Team fouls: 4] (Josh Duncan: 1 personal fouls) TURNOVER! (dead ball)

[05:13] Team_063 possession (Score: 12-10)
Tyler Harris attempts a Dunk. BLOCKED BY GIANNIS SMITH! Ball is loose! Rebound secured by Allen Ming.

[05:00] Team_088 possession (Score: 12-10)
Allen Ming drives, Tyler Harris stays with him. Allen Ming attempts a Dunk. Contested by Tyler Harris (3.7 feet, ZONE). ALLEN MING MAKES IT! Assist: Tyler Hyland
Score: 14-10

[04:47] Team_063 possession (Score: 14-10)
Bradley Davis attempts a 3Pt. Wide open! Josh Duncan is 10.0 feet away. [MAN] Bradley Davis misses. Rebound secured by Allen Ming.

[04:31] Team_088 possession (Score: 14-10)
Giannis Smith drives to the basket... Giannis Smith commits a violation (traveling/carry)! TURNOVER! (dead ball)

[04:16] Team_063 possession (Score: 14-10)
Bradley Davis attempts a 3Pt. Contested by Josh Duncan (5.8 feet, MAN). Bradley Davis misses. Rebound secured by Allen Ming.

[04:00] Team_088 possession (Score: 14-10)
Josh Duncan attempts a 3Pt. Contested by Malcolm Quickley (4.2 feet, ZONE). Josh Duncan misses. Rebound secured by Tyler Harris.

[03:44] Team_063 possession (Score: 14-10)
Terry Reaves attempts a 3Pt. Wide open! Tobias Haliburton is 6.9 feet away. [ZONE] TERRY REAVES MAKES IT!
Score: 14-13

[03:28] Team_088 possession (Score: 14-13)
Allen Ming attempts a Midrange. Contested by Malcolm Quickley (4.2 feet, ZONE). Allen Ming misses. Rebound secured by Dirk Reaves.

[03:16] Team_063 possession (Score: 14-13)
Malcolm Quickley drives to the basket... FOUL! Offensive foul on Malcolm Quickley! Giannis Smith drew the charge! [Team fouls: 2] (Malcolm Quickley: 1 personal fouls) TURNOVER! (dead ball)

[03:05] Team_088 possession (Score: 14-13)
Tobias Haliburton attempts a 3Pt. Heavily contested by Malcolm Quickley (0.7 feet, ZONE)! Tobias Haliburton misses. Rebound secured by Dirk Reaves.

[02:47] Team_063 possession (Score: 14-13)
Tyler Harris makes the Layup and draws the foul on Giannis Smith! And-1! Tyler Harris to the line for 1. [BONUS: 5 team fouls] (Giannis Smith: 3 personal fouls)   FT 1/1: GOOD Tyler Harris makes 1/1 from the line.
Score: 14-16

[02:28] Team_088 possession (Score: 14-16)
Tobias Haliburton attempts a Midrange. Wide open! Dirk Reaves is 6.6 feet away. [ZONE] TOBIAS HALIBURTON MAKES IT!
Score: 16-16

[02:11] Team_063 possession (Score: 16-16)
Dirk Reaves attempts a Midrange. Contested by Giannis Smith (4.1 feet, MAN). DIRK REAVES MAKES IT!
Score: 16-18

[01:56] Team_088 possession (Score: 16-18)
Tobias Haliburton attempts a Midrange. Wide open! Malcolm Quickley is 6.1 feet away. [MAN] Tobias Haliburton misses. Rebound secured by Malcolm Quickley.

[01:41] Team_063 possession (Score: 16-18)
Bradley Davis makes the Layup and draws the foul on Giannis Smith! And-1! Bradley Davis to the line for 1. [BONUS: 6 team fouls] (Giannis Smith: 4 personal fouls)   FT 1/1: GOOD Bradley Davis makes 1/1 from the line.
Score: 16-21

[01:31] Team_088 possession (Score: 16-21)
Allen Ming attempts a 3Pt. Wide open! Tyler Harris is 6.1 feet away. [MAN] Allen Ming misses. Rebound secured by Dirk Reaves.

[01:13] Team_063 possession (Score: 16-21)
FOUL! Holding foul on Tyler Hyland. [IN THE BONUS! 7 team fouls] Terry Reaves to the line for 2 free throws. (Tyler Hyland: 1 personal fouls)   FT 1/2: GOOD   FT 2/2: MISS Terry Reaves makes 1/2 from the line. Rebound secured by Allen Ming.
Score: 16-22

[01:02] Team_088 possession (Score: 16-22)
FOUL! Reach-in foul on Tyler Harris during the drive. [Team fouls: 3] No free throws, side out. (Tyler Harris: 1 personal fouls)

[00:46] Team_088 possession (Score: 16-22)
Allen Ming attempts a Layup. BLOCKED BY TYLER HARRIS! Ball is loose! Rebound secured by Malcolm Quickley.

[00:27] Team_063 possession (Score: 16-22)
FOUL! Shooting foul on Giannis Smith. Bradley Davis to the line for 2 free throws. [BONUS: 8 team fouls] (Giannis Smith: 5 personal fouls)   FT 1/2: GOOD   FT 2/2: GOOD Bradley Davis makes 2/2 from the line.
Score: 16-24

[00:16] Team_088 possession (Score: 16-24)
Tyler Hyland attempts a Layup. Contested by Terry Reaves (3.2 feet, MAN). Tyler Hyland misses. Rebound secured by Tyler Harris.

[00:02] Team_063 possession (Score: 16-24)
FOUL! Reach-in foul on Tyler Hyland during the drive. [IN THE BONUS! 9 team fouls] Terry Reaves to the line for 2 free throws. (Tyler Hyland: 2 personal fouls)   FT 1/2: GOOD   FT 2/2: GOOD Terry Reaves makes 2/2 from the line.
Score: 16-26

================================================================================
                              1ST QUARTER COMPLETE                              
================================================================================

1ST QUARTER SCORE: Team_088 16, Team_063 26

BOX SCORE:
================================================================================

Team_088
--------------------------------------------------------------------------------
Player                MIN  PTS  REB  AST  TO      FG   FG%      3P   3P%
--------------------------------------------------------------------------------
Tobias Haliburton      12    7    0    0   0   3/9    33.3     0/0   0.0
Josh Duncan            12    5    0    0   0   2/4    50.0     0/0   0.0
Allen Ming             12    2    7    0   0   1/6    16.7     0/0   0.0
Giannis Smith          12    2    3    0   0   1/1   100.0     0/0   0.0
Tyler Hyland           12    0    0    4   0   0/2     0.0     0/0   0.0

TEAM: FG: 7/22 (31.8%), 3PT: 2/9 (22.2%), REB: 10 (1 off, 9 def), AST: 4, TO: 2
TEAM FOULS: 9 [Team_063 in BONUS]


Team_063
--------------------------------------------------------------------------------
Player                MIN  PTS  REB  AST  TO      FG   FG%      3P   3P%
--------------------------------------------------------------------------------
Terry Reaves           12   10    0    0   0   4/5    80.0     0/0   0.0
Tyler Harris           12    5    4    1   0   2/5    40.0     0/0   0.0
Dirk Reaves            12    5    3    0   0   2/4    50.0     0/0   0.0
Bradley Davis          12    5    0    1   0   2/4    50.0     0/0   0.0
Malcolm Quickley       12    0    7    0   0   0/0     0.0     0/0   0.0

TEAM: FG: 10/19 (52.6%), 3PT: 2/7 (28.6%), REB: 14 (0 off, 14 def), AST: 2, TO: 5
TEAM FOULS: 3

================================================================================

================================================================================
                       2ND QUARTER - Team_088 vs Team_063                       
================================================================================

[12:00] Team_088 possession (Score: 16-26)
Allen Ming drives, Tyler Harris stays with him. Allen Ming attempts a Layup. Contested by Tyler Harris (3.2 feet, ZONE). ALLEN MING MAKES IT!
Score: 18-26

[11:46] Team_063 possession (Score: 18-26)
Tyler Harris drives, Giannis Smith stays with him. Tyler Harris attempts a Layup. Heavily contested by Giannis Smith (0.9 feet, ZONE)! TYLER HARRIS MAKES IT! Assist: Bradley Davis
Score: 18-28

[11:31] Team_088 possession (Score: 18-28)
Giannis Smith drives to the basket... Giannis Smith loses the ball! Stripped by Tyler Harris! TURNOVER! (live ball)

[11:16] Team_063 possession (Score: 18-28)
Terry Reaves drives, picks up Giannis Smith. Help arrives from Tobias Haliburton! Terry Reaves attempts a Layup. Wide open! Tobias Haliburton is 8.1 feet away. [ZONE] TERRY REAVES MAKES IT! Assist: Bradley Davis
Score: 18-30

[10:57] Team_088 possession (Score: 18-30)
Josh Duncan makes the Layup and draws the foul on Tyler Harris! And-1! Josh Duncan to the line for 1. [Team fouls: 1] (Tyler Harris: 1 personal fouls)   FT 1/1: GOOD Josh Duncan makes 1/1 from the line.
Score: 21-30

[10:47] Team_063 possession (Score: 21-30)
Tyler Harris attempts a Layup. Heavily contested by Allen Ming (1.6 feet, MAN)! TYLER HARRIS MAKES IT!
Score: 21-32

[10:33] Team_088 possession (Score: 21-32)
Josh Duncan attempts a Layup. Contested by Bradley Davis (5.1 feet, MAN). Josh Duncan misses. Rebound secured by Tyler Harris.

[10:20] Team_063 possession (Score: 21-32)
Malcolm Quickley attempts a Layup. Contested by Tobias Haliburton (3.5 feet, MAN). MALCOLM QUICKLEY MAKES IT! Assist: Terry Reaves
Score: 21-34

[10:08] Team_088 possession (Score: 21-34)
Tyler Hyland attempts a 3Pt. Contested by Terry Reaves (4.9 feet, MAN). Tyler Hyland misses. Offensive rebound by Giannis Smith! Giannis Smith kicks it out.

[09:51] Team_088 possession (Score: 21-34)
Josh Duncan attempts a 3Pt. Contested by Bradley Davis (4.6 feet, ZONE). Josh Duncan misses. Rebound secured by Malcolm Quickley.

[09:39] Team_063 possession (Score: 21-34)
Dirk Reaves makes the Layup and draws the foul on Giannis Smith! And-1! Dirk Reaves to the line for 1. [Team fouls: 1] (Giannis Smith: 1 personal fouls)   FT 1/1: GOOD Dirk Reaves makes 1/1 from the line.
Score: 21-37

[09:23] Team_088 possession (Score: 21-37)
Giannis Smith drives, picks up Dirk Reaves. Help arrives from Malcolm Quickley! Giannis Smith attempts a Dunk. Contested by Malcolm Quickley (4.2 feet, MAN). Giannis Smith misses. Rebound secured by Tyler Harris.

[09:13] Team_063 possession (Score: 21-37)
Terry Reaves makes the Layup and draws the foul on Giannis Smith! And-1! Terry Reaves to the line for 1. [Team fouls: 2] (Giannis Smith: 2 personal fouls)   FT 1/1: GOOD Terry Reaves makes 1/1 from the line.
Score: 21-40

[09:00] Team_088 possession (Score: 21-40)
Josh Duncan attempts a 3Pt. Heavily contested by Malcolm Quickley (0.8 feet, ZONE)! Josh Duncan misses. Rebound secured by Malcolm Quickley.

[08:47] Team_063 possession (Score: 21-40)
Terry Reaves attempts a Midrange. Contested by Giannis Smith (5.2 feet, ZONE). Terry Reaves misses. Offensive rebound by Dirk Reaves! Dirk Reaves kicks it out.

[08:34] Team_063 possession (Score: 21-40)
FOUL! Holding foul on Giannis Smith. [Team fouls: 3] No free throws, side out. (Giannis Smith: 3 personal fouls)

[08:21] Team_063 possession (Score: 21-40)
Dirk Reaves drives, Giannis Smith stays with him. Dirk Reaves attempts a Dunk. Contested by Giannis Smith (4.4 feet, ZONE). Dirk Reaves misses. Rebound secured by Giannis Smith.

[08:05] Team_088 possession (Score: 21-40)
FOUL! Reach-in foul on Dirk Reaves during the drive. [Team fouls: 2] No free throws, side out. (Dirk Reaves: 1 personal fouls)

[07:48] Team_088 possession (Score: 21-40)
Tobias Haliburton attempts a 3Pt. Contested by Malcolm Quickley (2.9 feet, MAN). Tobias Haliburton misses. Offensive rebound by Allen Ming! Allen Ming kicks it out.

[07:32] Team_088 possession (Score: 21-40)
FOUL! Reach-in foul on Tyler Harris during the drive. [Team fouls: 3] No free throws, side out. (Tyler Harris: 2 personal fouls)

[07:23] Team_088 possession (Score: 21-40)
Allen Ming drives, picks up Tyler Harris. Help arrives from Malcolm Quickley! Allen Ming attempts a Layup. Contested by Malcolm Quickley (5.3 feet, ZONE). ALLEN MING MAKES IT! Assist: Giannis Smith
Score: 23-40

[07:09] Team_063 possession (Score: 23-40)
Dirk Reaves commits a violation (traveling/carry)! TURNOVER! (dead ball)

[07:09] Substitution (Team_088): Josh Duncan OUT → Klay Quickley IN (stamina_rule2)

[07:09] Substitution (Team_088): Tobias Haliburton OUT → Vince Carter IN (stamina_rule2)

[07:09] Substitution (Team_088): Tyler Hyland OUT → Pau Bird IN (stamina_rule2)

[07:09] Substitution (Team_088): Giannis Smith OUT → Zion Harris IN (stamina_rule2)

[07:09] Substitution (Team_088): Allen Ming OUT → Josh Embiid IN (stamina_rule2)

[07:09] Substitution (Team_063): Bradley Davis OUT → DeMar Banchero IN (stamina_rule2)

[07:09] Substitution (Team_063): Malcolm Quickley OUT → Cole Durant IN (stamina_rule2)

[07:09] Substitution (Team_063): Terry Reaves OUT → Jaren James IN (stamina_rule2)

[07:09] Substitution (Team_063): Dirk Reaves OUT → Lamelo Ball IN (stamina_rule2)

[07:09] Substitution (Team_063): Tyler Harris OUT → Kyle Green IN (stamina_rule2)

[06:55] Team_088 possession (Score: 23-40)
Josh Embiid attempts a Layup. Contested by Kyle Green (3.4 feet, ZONE). JOSH EMBIID MAKES IT!
Score: 25-40

[06:42] Team_063 possession (Score: 25-40)
Cole Durant attempts a Midrange. Contested by Vince Carter (4.4 feet, MAN). COLE DURANT MAKES IT! Assist: Kyle Green
Score: 25-42

[06:25] Team_088 possession (Score: 25-42)
Pau Bird drives to the basket... Pau Bird loses control! Ball rolls out of bounds! TURNOVER! (dead ball)

[06:09] Team_063 possession (Score: 25-42)
Lamelo Ball attempts a Layup. Contested by Zion Harris (4.0 feet, ZONE). LAMELO BALL MAKES IT!
Score: 25-44

[05:58] Team_088 possession (Score: 25-44)
Pau Bird drives and kicks out. Josh Embiid attempts a 3Pt. Contested by Kyle Green (5.2 feet, MAN). Josh Embiid misses. Rebound secured by Kyle Green.

[05:45] Team_063 possession (Score: 25-44)
DeMar Banchero attempts a 3Pt. Contested by Pau Bird (2.5 feet, ZONE). DEMAR BANCHERO MAKES IT! Assist: Kyle Green
Score: 25-47

[05:33] Team_088 possession (Score: 25-47)
Vince Carter attempts a Layup. Heavily contested by Cole Durant (0.5 feet, MAN)! Vince Carter misses. Rebound secured by Lamelo Ball.

[05:19] Team_063 possession (Score: 25-47)
Cole Durant attempts a 3Pt. Contested by Vince Carter (5.4 feet, ZONE). Cole Durant misses. Rebound secured by Josh Embiid.

[05:08] Team_088 possession (Score: 25-47)
Klay Quickley throws a bad pass out of bounds! TURNOVER! (dead ball)

[04:53] Team_063 possession (Score: 25-47)
Cole Durant attempts a 3Pt. Contested by Vince Carter (3.1 feet, MAN). Cole Durant misses. Rebound secured by Josh Embiid.

[04:42] Team_088 possession (Score: 25-47)
Josh Embiid attempts a 3Pt. Wide open! Kyle Green is 6.7 feet away. [MAN] Josh Embiid misses. Rebound secured by Cole Durant.

[04:27] Team_063 possession (Score: 25-47)
DeMar Banchero drives, picks up Zion Harris. Help arrives from Klay Quickley! DeMar Banchero attempts a Dunk. Contested by Klay Quickley (4.0 feet, ZONE). DEMAR BANCHERO MAKES IT! Assist: Cole Durant
Score: 25-49

[04:15] Team_088 possession (Score: 25-49)
Josh Embiid drives, Kyle Green stays with him. Josh Embiid attempts a Layup. Contested by Kyle Green (3.3 feet, MAN). Josh Embiid misses. Rebound secured by Kyle Green.

[04:00] Team_063 possession (Score: 25-49)
Kyle Green attempts a Layup. Contested by Josh Embiid (3.7 feet, MAN). KYLE GREEN MAKES IT! Assist: Cole Durant
Score: 25-51

[03:46] Team_088 possession (Score: 25-51)
Vince Carter attempts a 3Pt. Contested by Cole Durant (4.1 feet, ZONE). Vince Carter misses. Rebound secured by Cole Durant.

[03:33] Team_063 possession (Score: 25-51)
Lamelo Ball drives and kicks out. Jaren James attempts a 3Pt. Wide open! Pau Bird is 6.5 feet away. [MAN] JAREN JAMES MAKES IT! Assist: DeMar Banchero
Score: 25-54

[03:17] Team_088 possession (Score: 25-54)
Vince Carter attempts a 3Pt. Heavily contested by DeMar Banchero (0.5 feet, ZONE)! VINCE CARTER MAKES IT! Assist: Pau Bird
Score: 28-54

[03:02] Team_063 possession (Score: 28-54)
Cole Durant attempts a Midrange. Heavily contested by Vince Carter (1.6 feet, ZONE)! Cole Durant misses. Rebound secured by Zion Harris.

[02:52] Team_088 possession (Score: 28-54)
Klay Quickley drives and kicks out. Klay Quickley attempts a 3Pt. Wide open! DeMar Banchero is 8.6 feet away. [MAN] Klay Quickley misses. Rebound secured by Cole Durant.

[02:42] Team_063 possession (Score: 28-54)
DeMar Banchero drives to the basket... DeMar Banchero throws a bad pass! Stolen by Zion Harris! TURNOVER! (live ball)

[02:32] Team_088 possession (Score: 28-54)
Klay Quickley drives to the basket... Klay Quickley loses control! Ball rolls out of bounds! TURNOVER! (dead ball)

[02:22] Team_063 possession (Score: 28-54)
DeMar Banchero attempts a 3Pt. Wide open! Pau Bird is 6.3 feet away. [ZONE] DeMar Banchero misses. Rebound secured by Pau Bird.

[02:08] Team_088 possession (Score: 28-54)
Vince Carter attempts a 3Pt. Contested by Cole Durant (5.7 feet, MAN). VINCE CARTER MAKES IT! Assist: Zion Harris
Score: 31-54

[01:55] Team_063 possession (Score: 31-54)
Lamelo Ball drives to the basket... Lamelo Ball loses control! Ball rolls out of bounds! TURNOVER! (dead ball)

[01:39] Team_088 possession (Score: 31-54)
FOUL! Offensive foul on Josh Embiid! Kyle Green drew the charge! [Team fouls: 4] (Josh Embiid: 1 personal fouls) TURNOVER! (dead ball)

[01:24] Team_063 possession (Score: 31-54)
Jaren James attempts a 3Pt. Contested by Pau Bird (4.3 feet, ZONE). Jaren James misses. Rebound secured by Josh Embiid.

[01:09] Team_088 possession (Score: 31-54)
FOUL! Offensive foul on Pau Bird! Jaren James drew the charge! [Team fouls: 5] (Pau Bird: 1 personal fouls) TURNOVER! (dead ball)

[00:54] Team_063 possession (Score: 31-54)
Lamelo Ball attempts a 3Pt. Wide open! Zion Harris is 10.0 feet away. [MAN] Lamelo Ball misses. Rebound secured by Pau Bird.

[00:41] Team_088 possession (Score: 31-54)
Klay Quickley attempts a 3Pt. Wide open! DeMar Banchero is 6.2 feet away. [MAN] Klay Quickley misses. Offensive rebound by Pau Bird! Pau Bird kicks it out.

[00:24] Team_088 possession (Score: 31-54)
Pau Bird drives, picks up Lamelo Ball. Help arrives from Cole Durant! Pau Bird attempts a Layup. Contested by Cole Durant (3.6 feet, ZONE). PAU BIRD MAKES IT! Assist: Zion Harris
Score: 33-54

[00:14] Team_063 possession (Score: 33-54)
DeMar Banchero drives, Klay Quickley stays with him. DeMar Banchero attempts a Dunk. Wide open! Klay Quickley is 8.0 feet away. [MAN] DEMAR BANCHERO MAKES IT! Assist: Cole Durant
Score: 33-56

================================================================================
                              2ND QUARTER COMPLETE                              
================================================================================

2ND QUARTER SCORE: Team_088 17, Team_063 30

BOX SCORE:
================================================================================

Team_088
--------------------------------------------------------------------------------
Player                MIN  PTS  REB  AST  TO      FG   FG%      3P   3P%
--------------------------------------------------------------------------------
Vince Carter            7    6    0    0   0   2/4    50.0     0/0   0.0
Allen Ming             17    4    1    0   0   2/2   100.0     0/0   0.0
Josh Duncan            17    3    0    0   0   1/4    25.0     0/0   0.0
Josh Embiid             7    2    3    0   0   1/3    33.3     0/0   0.0
Pau Bird                7    2    3    1   0   1/2    50.0     0/0   0.0
Giannis Smith          17    0    2    1   0   0/1     0.0     0/0   0.0
Zion Harris             7    0    1    2   0   0/0     0.0     0/0   0.0
Klay Quickley           7    0    0    0   0   0/1     0.0     0/0   0.0

TEAM: FG: 7/17 (41.2%), 3PT: 2/6 (33.3%), REB: 10 (3 off, 7 def), AST: 4, TO: 6
TEAM FOULS: 5 [Team_063 in BONUS]


Team_063
--------------------------------------------------------------------------------
Player                MIN  PTS  REB  AST  TO      FG   FG%      3P   3P%
--------------------------------------------------------------------------------
DeMar Banchero          7    7    0    1   0   3/4    75.0     0/0   0.0
Terry Reaves           17    5    0    1   0   2/2   100.0     0/0   0.0
Tyler Harris           17    4    2    0   0   2/2   100.0     0/0   0.0
Dirk Reaves            17    3    1    0   0   1/2    50.0     0/0   0.0
Jaren James             7    3    0    0   0   1/2    50.0     0/0   0.0
Malcolm Quickley       17    2    2    0   0   1/1   100.0     0/0   0.0
Cole Durant             7    2    3    3   0   1/4    25.0     0/0   0.0
Kyle Green              7    2    2    2   0   1/1   100.0     0/0   0.0
Lamelo Ball             7    2    1    0   0   1/2    50.0     0/0   0.0
Bradley Davis          17    0    0    2   0   0/0     0.0     0/0   0.0

TEAM: FG: 13/20 (65.0%), 3PT: 1/6 (16.7%), REB: 11 (1 off, 10 def), AST: 9, TO: 3
TEAM FOULS: 3

================================================================================

================================================================================
                       3RD QUARTER - Team_088 vs Team_063                       
================================================================================

[12:00] Team_088 possession (Score: 33-56)
FOUL! Reach-in foul on Tyler Harris during the drive. [Team fouls: 1] No free throws, side out. (Tyler Harris: 1 personal fouls)

[11:48] Team_088 possession (Score: 33-56)
Allen Ming drives and kicks out. Josh Duncan attempts a Midrange. Wide open! Malcolm Quickley is 6.5 feet away. [ZONE] JOSH DUNCAN MAKES IT! Assist: Giannis Smith
Score: 35-56

[11:37] Team_063 possession (Score: 35-56)
Tyler Harris attempts a Midrange. Contested by Allen Ming (2.7 feet, MAN). Tyler Harris misses. Rebound secured by Allen Ming.

[11:23] Team_088 possession (Score: 35-56)
Tobias Haliburton attempts a 3Pt. Contested by Malcolm Quickley (2.9 feet, MAN). Tobias Haliburton misses. Rebound secured by Malcolm Quickley.

[11:13] Team_063 possession (Score: 35-56)
Bradley Davis attempts a Midrange. Contested by Josh Duncan (4.4 feet, MAN). BRADLEY DAVIS MAKES IT!
Score: 35-58

[11:00] Team_088 possession (Score: 35-58)
Tobias Haliburton attempts a 3Pt. Wide open! Malcolm Quickley is 6.8 feet away. [ZONE] TOBIAS HALIBURTON MAKES IT! Assist: Tyler Hyland
Score: 38-58

[10:43] Team_063 possession (Score: 38-58)
Dirk Reaves drives, picks up Giannis Smith. Help arrives from Tobias Haliburton! Dirk Reaves attempts a Dunk. Wide open! Tobias Haliburton is 6.3 feet away. [MAN] Dirk Reaves misses. FOUL! Loose ball foul on Giannis Smith during the rebound battle. [Team fouls: 1] No free throws, side out. (Giannis Smith: 1 personal fouls)

[10:31] Team_063 possession (Score: 38-58)
Tyler Harris attempts a 3Pt. Contested by Tobias Haliburton (2.5 feet, ZONE). Tyler Harris misses. Rebound secured by Giannis Smith.

[10:14] Team_088 possession (Score: 38-58)
Allen Ming drives, picks up Tyler Harris. Help arrives from Malcolm Quickley! Allen Ming attempts a Layup. Contested by Malcolm Quickley (4.0 feet, ZONE). ALLEN MING MAKES IT!
Score: 40-58

[09:56] Team_063 possession (Score: 40-58)
Bradley Davis drives to the basket... Bradley Davis throws a bad pass! Stolen by Josh Duncan! TURNOVER! (live ball)

[09:43] Team_088 possession (Score: 40-58)
Tyler Hyland attempts a 3Pt. Contested by Malcolm Quickley (2.8 feet, ZONE). TYLER HYLAND MAKES IT! Assist: Tobias Haliburton
Score: 43-58

[09:29] Team_063 possession (Score: 43-58)
FOUL! Reach-in foul on Tyler Hyland during the drive. [Team fouls: 2] No free throws, side out. (Tyler Hyland: 1 personal fouls)

[09:11] Team_063 possession (Score: 43-58)
Tyler Harris attempts a Midrange. Contested by Allen Ming (4.3 feet, MAN). Tyler Harris misses. Rebound secured by Giannis Smith.

[08:56] Team_088 possession (Score: 43-58)
Tobias Haliburton attempts a 3Pt. Contested by Malcolm Quickley (3.7 feet, MAN). TOBIAS HALIBURTON MAKES IT! Assist: Allen Ming
Score: 46-58

[08:40] Team_063 possession (Score: 46-58)
Bradley Davis attempts a 3Pt. Contested by Tobias Haliburton (5.1 feet, ZONE). Bradley Davis misses. Rebound secured by Giannis Smith.

[08:22] Team_088 possession (Score: 46-58)
Tobias Haliburton attempts a Midrange. Contested by Malcolm Quickley (2.5 feet, ZONE). Tobias Haliburton misses. Offensive rebound by Giannis Smith! Giannis Smith puts it back in!
Score: 48-58

[08:06] Team_063 possession (Score: 48-58)
Tyler Harris drives, picks up Giannis Smith. Help arrives from Tobias Haliburton! Tyler Harris attempts a Layup. Contested by Tobias Haliburton (5.5 feet, ZONE). TYLER HARRIS MAKES IT!
Score: 48-60

[07:51] Team_088 possession (Score: 48-60)
Tobias Haliburton drives, picks up Malcolm Quickley. Help arrives from Bradley Davis! Tobias Haliburton attempts a Layup. Heavily contested by Bradley Davis (1.6 feet, MAN)! Tobias Haliburton misses. Offensive rebound by Allen Ming! Allen Ming's putback is no good. Rebound secured by Malcolm Quickley.

[07:35] Team_063 possession (Score: 48-60)
Terry Reaves attempts a 3Pt. Contested by Tobias Haliburton (5.3 feet, ZONE). TERRY REAVES MAKES IT! Assist: Malcolm Quickley
Score: 48-63

[07:26] Team_088 possession (Score: 48-63)
Tyler Hyland attempts a Layup. BLOCKED BY MALCOLM QUICKLEY! Ball is loose! Rebound secured by Malcolm Quickley.

[07:11] Team_063 possession (Score: 48-63)
FOUL! Offensive foul on Malcolm Quickley! Tobias Haliburton drew the charge! [Team fouls: 2] (Malcolm Quickley: 1 personal fouls) TURNOVER! (dead ball)

[06:52] Team_088 possession (Score: 48-63)
Tyler Hyland attempts a Layup. Contested by Terry Reaves (4.3 feet, MAN). Tyler Hyland misses. Rebound secured by Dirk Reaves.

[06:41] Team_063 possession (Score: 48-63)
Malcolm Quickley attempts a 3Pt. Contested by Tobias Haliburton (4.2 feet, ZONE). MALCOLM QUICKLEY MAKES IT! Assist: Bradley Davis
Score: 48-66

[06:26] Team_088 possession (Score: 48-66)
Tyler Hyland attempts a Layup. BLOCKED BY MALCOLM QUICKLEY! Ball goes out off Malcolm Quickley. Tyler Hyland's ball!

[06:10] Team_088 possession (Score: 48-66)
Allen Ming attempts a Midrange. BLOCKED BY TERRY REAVES! Ball goes out off Terry Reaves. Allen Ming's ball!

[05:51] Team_088 possession (Score: 48-66)
Tobias Haliburton attempts a 3Pt. Contested by Malcolm Quickley (4.8 feet, MAN). Tobias Haliburton misses. Offensive rebound by Allen Ming! Allen Ming puts it back in!
Score: 50-66

[05:34] Team_063 possession (Score: 50-66)
Terry Reaves attempts a Midrange. Contested by Tyler Hyland (3.4 feet, MAN). TERRY REAVES MAKES IT!
Score: 50-68

[05:20] Team_088 possession (Score: 50-68)
Tobias Haliburton drives to the basket... Tobias Haliburton throws a bad pass out of bounds! TURNOVER! (dead ball)

[05:04] Team_063 possession (Score: 50-68)
Dirk Reaves drives and kicks out. Terry Reaves attempts a Midrange. Contested by Tyler Hyland (4.8 feet, ZONE). Terry Reaves misses. Offensive rebound by Tyler Harris! Tyler Harris puts it back in!
Score: 50-70

[04:50] Team_088 possession (Score: 50-70)
Tobias Haliburton attempts a Midrange. Contested by Malcolm Quickley (4.1 feet, MAN). TOBIAS HALIBURTON MAKES IT! Assist: Giannis Smith
Score: 52-70

[04:34] Team_063 possession (Score: 52-70)
Malcolm Quickley drives and kicks out. Dirk Reaves attempts a 3Pt. Contested by Giannis Smith (4.5 feet, MAN). Dirk Reaves misses. Rebound secured by Allen Ming.

[04:18] Team_088 possession (Score: 52-70)
Giannis Smith attempts a Midrange. Wide open! Dirk Reaves is 6.7 feet away. [MAN] GIANNIS SMITH MAKES IT! Assist: Allen Ming
Score: 54-70

[04:04] Team_063 possession (Score: 54-70)
Malcolm Quickley attempts a 3Pt. Contested by Tobias Haliburton (4.6 feet, MAN). Malcolm Quickley misses. Offensive rebound by Tyler Harris! Tyler Harris's putback is no good. Rebound secured by Tyler Hyland.

[03:50] Team_088 possession (Score: 54-70)
Josh Duncan attempts a 3Pt. Contested by Malcolm Quickley (4.4 feet, ZONE). Josh Duncan misses. Rebound secured by Tyler Harris.

[03:35] Team_063 possession (Score: 54-70)
Terry Reaves drives, picks up Tyler Hyland. Help arrives from Tobias Haliburton! Terry Reaves attempts a Dunk. Contested by Tobias Haliburton (5.5 feet, MAN). TERRY REAVES MAKES IT! Assist: Bradley Davis
Score: 54-72

[03:23] Team_088 possession (Score: 54-72)
Tyler Hyland attempts a Midrange. Heavily contested by Malcolm Quickley (1.8 feet, ZONE)! TYLER HYLAND MAKES IT! Assist: Allen Ming
Score: 56-72

[03:10] Team_063 possession (Score: 56-72)
Terry Reaves attempts a Midrange. Wide open! Tobias Haliburton is 6.4 feet away. [ZONE] TERRY REAVES MAKES IT!
Score: 56-74

[02:56] Team_088 possession (Score: 56-74)
Tobias Haliburton attempts a 3Pt. Heavily contested by Malcolm Quickley (0.5 feet, ZONE)! TOBIAS HALIBURTON MAKES IT!
Score: 59-74

[02:38] Team_063 possession (Score: 59-74)
Tyler Harris drives, Allen Ming stays with him. Tyler Harris attempts a Layup. Heavily contested by Allen Ming (0.5 feet, MAN)! Tyler Harris misses. Rebound secured by Allen Ming.

[02:23] Team_088 possession (Score: 59-74)
Tobias Haliburton attempts a Layup. Contested by Malcolm Quickley (5.4 feet, MAN). TOBIAS HALIBURTON MAKES IT! Assist: Tyler Hyland
Score: 61-74

[02:09] Team_063 possession (Score: 61-74)
FOUL! Shooting foul on Allen Ming. Tyler Harris to the line for 2 free throws. [Team fouls: 3] (Allen Ming: 1 personal fouls)   FT 1/2: GOOD   FT 2/2: MISS Tyler Harris makes 1/2 from the line. Rebound secured by Tyler Hyland.
Score: 61-75

[01:58] Team_088 possession (Score: 61-75)
Giannis Smith attempts a Layup. Contested by Dirk Reaves (4.7 feet, MAN). GIANNIS SMITH MAKES IT! Assist: Josh Duncan
Score: 63-75

[01:45] Team_063 possession (Score: 63-75)
Dirk Reaves drives to the basket... Dirk Reaves throws a bad pass! Stolen by Giannis Smith! TURNOVER! (live ball)

[01:35] Team_088 possession (Score: 63-75)
Allen Ming drives and kicks out. Allen Ming attempts a 3Pt. Contested by Dirk Reaves (5.0 feet, ZONE). Allen Ming misses. Rebound secured by Tyler Harris.

[01:23] Team_063 possession (Score: 63-75)
Terry Reaves drives and kicks out. Bradley Davis attempts a Midrange. Wide open! Josh Duncan is 8.5 feet away. [MAN] Bradley Davis misses. Rebound secured by Tyler Hyland.

[01:08] Team_088 possession (Score: 63-75)
Tyler Hyland attempts a Midrange. Contested by Terry Reaves (5.4 feet, MAN). Tyler Hyland misses. Rebound secured by Tyler Harris.

[00:53] Team_063 possession (Score: 63-75)
Dirk Reaves attempts a 3Pt. Wide open! Giannis Smith is 6.3 feet away. [MAN] DIRK REAVES MAKES IT! Assist: Bradley Davis
Score: 63-78

[00:40] Team_088 possession (Score: 63-78)
Josh Duncan throws a bad pass out of bounds! TURNOVER! (dead ball)

[00:40] Substitution (Team_088): Josh Duncan OUT → Klay Quickley IN (stamina_rule2)

[00:40] Substitution (Team_088): Tobias Haliburton OUT → Vince Carter IN (stamina_rule2)

[00:40] Substitution (Team_088): Tyler Hyland OUT → Pau Bird IN (stamina_rule2)

[00:40] Substitution (Team_088): Giannis Smith OUT → Zion Harris IN (stamina_rule2)

[00:40] Substitution (Team_088): Allen Ming OUT → Josh Embiid IN (stamina_rule2)

[00:40] Substitution (Team_063): Bradley Davis OUT → DeMar Banchero IN (stamina_rule2)

[00:40] Substitution (Team_063): Malcolm Quickley OUT → Cole Durant IN (stamina_rule2)

[00:40] Substitution (Team_063): Terry Reaves OUT → Jaren James IN (stamina_rule2)

[00:40] Substitution (Team_063): Dirk Reaves OUT → Lamelo Ball IN (stamina_rule2)

[00:40] Substitution (Team_063): Tyler Harris OUT → Kyle Green IN (stamina_rule2)

[00:29] Team_063 possession (Score: 63-78)
DeMar Banchero drives and kicks out. Lamelo Ball attempts a 3Pt. Wide open! Zion Harris is 6.6 feet away. [MAN] Lamelo Ball misses. Rebound secured by Josh Embiid.

[00:17] Team_088 possession (Score: 63-78)
Zion Harris attempts a Layup. Contested by Kyle Green (3.7 feet, ZONE). ZION HARRIS MAKES IT! Assist: Klay Quickley
Score: 65-78

[00:03] Team_063 possession (Score: 65-78)
Jaren James drives and kicks out. Lamelo Ball attempts a 3Pt. Wide open! Zion Harris is 7.0 feet away. [MAN] LAMELO BALL MAKES IT! Assist: Cole Durant
Score: 65-81

================================================================================
                              3RD QUARTER COMPLETE                              
================================================================================

3RD QUARTER SCORE: Team_088 32, Team_063 25

BOX SCORE:
================================================================================

Team_088
--------------------------------------------------------------------------------
Player                MIN  PTS  REB  AST  TO      FG   FG%      3P   3P%
--------------------------------------------------------------------------------
Tobias Haliburton      29   13    0    1   0   5/7    71.4     0/0   0.0
Giannis Smith          29    6    4    2   0   3/3   100.0     0/0   0.0
Tyler Hyland           29    5    3    2   0   2/5    40.0     0/0   0.0
Allen Ming             29    4    4    3   0   2/3    66.7     0/0   0.0
Josh Duncan            29    2    0    1   0   1/2    50.0     0/0   0.0
Zion Harris             8    2    0    0   0   1/1   100.0     0/0   0.0
Josh Embiid             8    0    1    0   0   0/0     0.0     0/0   0.0
Klay Quickley           8    0    0    1   0   0/0     0.0     0/0   0.0

TEAM: FG: 14/21 (66.7%), 3PT: 5/7 (71.4%), REB: 12 (3 off, 9 def), AST: 10, TO: 2
TEAM FOULS: 3


Team_063
--------------------------------------------------------------------------------
Player                MIN  PTS  REB  AST  TO      FG   FG%      3P   3P%
--------------------------------------------------------------------------------
Terry Reaves           29    9    0    0   0   4/5    80.0     0/0   0.0
Tyler Harris           29    4    5    0   0   2/7    28.6     0/0   0.0
Malcolm Quickley       29    3    3    1   0   1/3    33.3     0/0   0.0
Dirk Reaves            29    3    1    0   0   1/1   100.0     0/0   0.0
Lamelo Ball             8    3    0    0   0   1/1   100.0     0/0   0.0
Bradley Davis          29    2    0    3   0   1/2    50.0     0/0   0.0
DeMar Banchero          8    0    0    0   0   0/1     0.0     0/0   0.0
Cole Durant             8    0    0    1   0   0/0     0.0     0/0   0.0

TEAM: FG: 10/20 (50.0%), 3PT: 3/6 (50.0%), REB: 9 (3 off, 6 def), AST: 5, TO: 3
TEAM FOULS: 2

================================================================================

================================================================================
                       4TH QUARTER - Team_088 vs Team_063                       
================================================================================

[12:00] Substitution (Team_088): Josh Duncan OUT (stamina: 69) → Klay Quickley IN (comeback_detected)

[12:00] Substitution (Team_063): Bradley Davis OUT (stamina: 73) → DeMar Banchero IN (comeback_detected)

[12:00] Team_088 possession (Score: 65-81)
FOUL! Holding foul on Malcolm Quickley. [Team fouls: 1] No free throws, side out. (Malcolm Quickley: 1 personal fouls)

[11:45] Team_088 possession (Score: 65-81)
Giannis Smith loses control! Ball rolls out of bounds! TURNOVER! (dead ball)

[11:45] Substitution (Team_088): Tobias Haliburton OUT → Vince Carter IN (stamina_rule2)

[11:45] Substitution (Team_088): Tyler Hyland OUT → Pau Bird IN (stamina_rule2)

[11:45] Substitution (Team_088): Giannis Smith OUT → Zion Harris IN (stamina_rule2)

[11:45] Substitution (Team_088): Allen Ming OUT → Josh Embiid IN (stamina_rule2)

[11:45] Substitution (Team_063): Terry Reaves OUT → Jaren James IN (stamina_rule2)

[11:45] Substitution (Team_063): Dirk Reaves OUT → Lamelo Ball IN (stamina_rule2)

[11:45] Substitution (Team_063): Tyler Harris OUT → Kyle Green IN (stamina_rule2)

[11:32] Team_063 possession (Score: 65-81)
FOUL! Offensive foul on DeMar Banchero! Klay Quickley drew the charge! [Team fouls: 2] (DeMar Banchero: 1 personal fouls) TURNOVER! (dead ball)

[11:21] Team_088 possession (Score: 65-81)
Vince Carter attempts a Midrange. Contested by Malcolm Quickley (3.3 feet, MAN). Vince Carter misses. Rebound secured by Lamelo Ball.

[11:07] Team_063 possession (Score: 65-81)
Lamelo Ball attempts a Layup. BLOCKED BY ZION HARRIS! Ball deflects out of bounds off Lamelo Ball.

[10:52] Team_088 possession (Score: 65-81)
Zion Harris drives and kicks out. Klay Quickley attempts a Midrange. Heavily contested by DeMar Banchero (1.4 feet, MAN)! Klay Quickley misses. Rebound secured by Lamelo Ball.

[10:33] Team_063 possession (Score: 65-81)
FOUL! Shooting foul on Pau Bird. Jaren James to the line for 2 free throws. [Team fouls: 1] (Pau Bird: 1 personal fouls)   FT 1/2: GOOD   FT 2/2: MISS Jaren James makes 1/2 from the line. Rebound secured by Zion Harris.
Score: 65-82

[10:21] Team_088 possession (Score: 65-82)
Zion Harris drives to the basket... Zion Harris loses the ball! Stripped by Lamelo Ball! TURNOVER! (live ball)

[10:08] Team_063 possession (Score: 65-82)
DeMar Banchero drives and kicks out. DeMar Banchero attempts a Midrange. Wide open! Pau Bird is 6.9 feet away. [ZONE] DEMAR BANCHERO MAKES IT! Assist: Lamelo Ball
Score: 65-84

[09:52] Team_088 possession (Score: 65-84)
Klay Quickley attempts a Layup. Heavily contested by Kyle Green (0.8 feet, ZONE)! Klay Quickley misses. Rebound secured by Malcolm Quickley.

[09:39] Team_063 possession (Score: 65-84)
Lamelo Ball loses control! Ball rolls out of bounds! TURNOVER! (dead ball)

[09:39] Substitution (Team_063): Malcolm Quickley OUT → Cole Durant IN (stamina_rule2)

[09:22] Team_088 possession (Score: 65-84)
Josh Embiid attempts a Midrange. Contested by Kyle Green (3.6 feet, MAN). Josh Embiid misses. FOUL! Loose ball foul on Kyle Green during the rebound battle. [Team fouls: 3] No free throws, side out. (Kyle Green: 1 personal fouls)

[09:07] Team_088 possession (Score: 65-84)
Zion Harris attempts a 3Pt. Wide open! Lamelo Ball is 7.6 feet away. [MAN] ZION HARRIS MAKES IT! Assist: Vince Carter
Score: 68-84

[08:57] Team_063 possession (Score: 68-84)
Kyle Green attempts a 3Pt. Wide open! Josh Embiid is 7.0 feet away. [MAN] Kyle Green misses. Rebound secured by Pau Bird.

[08:40] Team_088 possession (Score: 68-84)
Klay Quickley attempts a 3Pt. Contested by DeMar Banchero (4.1 feet, ZONE). Klay Quickley misses. Rebound secured by Lamelo Ball.

[08:26] Team_063 possession (Score: 68-84)
Kyle Green drives to the basket... Kyle Green loses the ball! Stripped by Josh Embiid! TURNOVER! (live ball)

[08:12] Team_088 possession (Score: 68-84)
Zion Harris attempts a Midrange. Contested by Lamelo Ball (2.6 feet, MAN). Zion Harris misses. Rebound secured by Lamelo Ball.

[07:53] Team_063 possession (Score: 68-84)
DeMar Banchero drives and kicks out. Kyle Green attempts a 3Pt. Contested by Pau Bird (5.3 feet, ZONE). Kyle Green misses. Rebound secured by Josh Embiid.

[07:39] Team_088 possession (Score: 68-84)
Vince Carter attempts a 3Pt. Wide open! Cole Durant is 6.2 feet away. [MAN] Vince Carter misses. Rebound secured by Kyle Green.

[07:29] Team_063 possession (Score: 68-84)
Kyle Green makes the Midrange and draws the foul on Josh Embiid! And-1! Kyle Green to the line for 1. [Team fouls: 2] (Josh Embiid: 1 personal fouls)   FT 1/1: GOOD Kyle Green makes 1/1 from the line.
Score: 68-87

[07:13] Team_088 possession (Score: 68-87)
Josh Embiid attempts a 3Pt. Contested by DeMar Banchero (4.9 feet, ZONE). Josh Embiid misses. Rebound secured by Lamelo Ball.

[06:57] Team_063 possession (Score: 68-87)
Cole Durant attempts a 3Pt. Wide open! Vince Carter is 8.7 feet away. [MAN] Cole Durant misses. Rebound secured by Josh Embiid.

[06:47] Team_088 possession (Score: 68-87)
Vince Carter attempts a 3Pt. Contested by DeMar Banchero (3.4 feet, ZONE). VINCE CARTER MAKES IT! Assist: Josh Embiid
Score: 71-87

[06:32] Team_063 possession (Score: 71-87)
DeMar Banchero makes the Layup and draws the foul on Klay Quickley! And-1! DeMar Banchero to the line for 1. [Team fouls: 3] (Klay Quickley: 1 personal fouls)   FT 1/1: GOOD DeMar Banchero makes 1/1 from the line.
Score: 71-90

[06:20] Team_088 possession (Score: 71-90)
Josh Embiid attempts a Layup. BLOCKED BY KYLE GREEN! Ball is loose! Rebound secured by Kyle Green.

[06:09] Team_063 possession (Score: 71-90)
Lamelo Ball drives to the basket... FOUL! Offensive foul on Lamelo Ball! Zion Harris drew the charge! [Team fouls: 4] (Lamelo Ball: 1 personal fouls) TURNOVER! (dead ball)

[05:54] Team_088 possession (Score: 71-90)
Vince Carter makes the Layup and draws the foul on Cole Durant! And-1! Vince Carter to the line for 1. [BONUS: 5 team fouls] (Cole Durant: 1 personal fouls)   FT 1/1: GOOD Vince Carter makes 1/1 from the line.
Score: 74-90

[05:39] Team_063 possession (Score: 74-90)
Cole Durant drives and kicks out. Kyle Green attempts a 3Pt. Wide open! Vince Carter is 6.1 feet away. [ZONE] Kyle Green misses. Rebound secured by Zion Harris.

[05:27] Team_088 possession (Score: 74-90)
FOUL! Reach-in foul on Kyle Green during the drive. [IN THE BONUS! 6 team fouls] Josh Embiid to the line for 2 free throws. (Kyle Green: 2 personal fouls)   FT 1/2: GOOD   FT 2/2: GOOD Josh Embiid makes 2/2 from the line.
Score: 76-90

[05:12] Team_063 possession (Score: 76-90)
Lamelo Ball attempts a Midrange. Contested by Vince Carter (2.7 feet, ZONE). LAMELO BALL MAKES IT! Assist: Kyle Green
Score: 76-92

[05:00] Team_088 possession (Score: 76-92)
Vince Carter makes the Dunk and draws the foul on Cole Durant! And-1! Vince Carter to the line for 1. [BONUS: 7 team fouls] (Cole Durant: 2 personal fouls)   FT 1/1: GOOD Vince Carter makes 1/1 from the line.
Score: 79-92

[04:44] Team_063 possession (Score: 79-92)
Lamelo Ball attempts a Midrange. Contested by Zion Harris (5.0 feet, MAN). LAMELO BALL MAKES IT!
Score: 79-94

[04:26] Team_088 possession (Score: 79-94)
Josh Embiid attempts a Midrange. Contested by Kyle Green (4.0 feet, MAN). JOSH EMBIID MAKES IT! Assist: Zion Harris
Score: 81-94

[04:10] Team_063 possession (Score: 81-94)
Lamelo Ball attempts a 3Pt. Contested by Zion Harris (3.9 feet, MAN). Lamelo Ball misses. Rebound secured by Josh Embiid.

[03:55] Team_088 possession (Score: 81-94)
Zion Harris makes the Midrange and draws the foul on Lamelo Ball! And-1! Zion Harris to the line for 1. [BONUS: 8 team fouls] (Lamelo Ball: 2 personal fouls)   FT 1/1: GOOD Zion Harris makes 1/1 from the line.
Score: 84-94

[03:39] Team_063 possession (Score: 84-94)
Kyle Green attempts a Midrange. Wide open! Vince Carter is 8.7 feet away. [ZONE] Kyle Green misses. Rebound secured by Zion Harris.

[03:25] Team_088 possession (Score: 84-94)
Josh Embiid drives and kicks out. Josh Embiid attempts a 3Pt. Contested by DeMar Banchero (4.6 feet, ZONE). Josh Embiid misses. Offensive rebound by Josh Embiid! Josh Embiid kicks it out.

[03:10] Team_088 possession (Score: 84-94)
Josh Embiid attempts a 3Pt. Contested by Cole Durant (2.4 feet, ZONE). Josh Embiid misses. Rebound secured by Cole Durant.

[02:56] Team_063 possession (Score: 84-94)
Lamelo Ball attempts a 3Pt. Contested by Pau Bird (3.4 feet, ZONE). Lamelo Ball misses. Offensive rebound by Kyle Green! Kyle Green puts it back in!
Score: 84-96

[02:42] Team_088 possession (Score: 84-96)
FOUL! Shooting foul on Kyle Green. Zion Harris to the line for 2 free throws. [BONUS: 9 team fouls] (Kyle Green: 3 personal fouls)   FT 1/2: MISS   FT 2/2: GOOD Zion Harris makes 1/2 from the line.
Score: 85-96

[02:29] Team_063 possession (Score: 85-96)
Cole Durant attempts a Midrange. Wide open! Vince Carter is 8.0 feet away. [ZONE] COLE DURANT MAKES IT! Assist: DeMar Banchero
Score: 85-98

[02:12] Team_088 possession (Score: 85-98)
Zion Harris attempts a Midrange. Contested by Jaren James (5.3 feet, ZONE). Zion Harris misses. Rebound secured by Lamelo Ball.

[02:01] Team_063 possession (Score: 85-98)
DeMar Banchero attempts a Layup. BLOCKED BY KLAY QUICKLEY! Ball is loose! Rebound secured by Josh Embiid.

[01:48] Team_088 possession (Score: 85-98)
Klay Quickley attempts a 3Pt. Wide open! DeMar Banchero is 6.4 feet away. [ZONE] KLAY QUICKLEY MAKES IT! Assist: Vince Carter
Score: 88-98

[01:34] Team_063 possession (Score: 88-98)
Cole Durant attempts a 3Pt. Contested by Vince Carter (5.2 feet, MAN). COLE DURANT MAKES IT! Assist: DeMar Banchero
Score: 88-101

[01:20] Team_088 possession (Score: 88-101)
Vince Carter drives, Cole Durant stays with him. Vince Carter attempts a Layup. Contested by Cole Durant (3.0 feet, MAN). VINCE CARTER MAKES IT! Assist: Zion Harris
Score: 90-101

[01:03] Team_063 possession (Score: 90-101)
DeMar Banchero attempts a Midrange. BLOCKED BY ZION HARRIS! Ball is loose! Rebound secured by Zion Harris.

[00:54] Team_088 possession (Score: 90-101)
Vince Carter drives and kicks out. FOUL! Shooting foul on Lamelo Ball. Zion Harris to the line for 2 free throws. [BONUS: 10 team fouls] (Lamelo Ball: 3 personal fouls)   FT 1/2: MISS   FT 2/2: GOOD Zion Harris makes 1/2 from the line.
Score: 91-101

[00:39] Team_063 possession (Score: 91-101)
Kyle Green attempts a Midrange. Wide open! Josh Embiid is 7.3 feet away. [MAN] KYLE GREEN MAKES IT! Assist: Jaren James
Score: 91-103

[00:26] Team_088 possession (Score: 91-103)
FOUL! Shooting foul on Jaren James. Pau Bird to the line for 2 free throws. [BONUS: 11 team fouls] (Jaren James: 1 personal fouls)   FT 1/2: MISS   FT 2/2: GOOD Pau Bird makes 1/2 from the line.
Score: 92-103

[00:15] Team_063 possession (Score: 92-103)
Lamelo Ball attempts a 3Pt. Contested by Zion Harris (5.8 feet, MAN). Lamelo Ball misses. Offensive rebound by Lamelo Ball! Lamelo Ball kicks it out.

================================================================================
                              4TH QUARTER COMPLETE                              
================================================================================

4TH QUARTER SCORE: Team_088 27, Team_063 22

BOX SCORE:
================================================================================

Team_088
--------------------------------------------------------------------------------
Player                MIN  PTS  REB  AST  TO      FG   FG%      3P   3P%
--------------------------------------------------------------------------------
Vince Carter           19   11    0    2   0   4/6    66.7     0/0   0.0
Zion Harris            19    8    4    2   0   4/7    57.1     0/0   0.0
Josh Embiid            19    4    5    1   0   2/5    40.0     0/0   0.0
Klay Quickley          20    3    0    0   0   1/3    33.3     0/0   0.0
Pau Bird               19    1    2    0   0   1/1   100.0     0/0   0.0

TEAM: FG: 12/22 (54.5%), 3PT: 3/7 (42.9%), REB: 11 (2 off, 9 def), AST: 5, TO: 2
TEAM FOULS: 3


Team_063
--------------------------------------------------------------------------------
Player                MIN  PTS  REB  AST  TO      FG   FG%      3P   3P%
--------------------------------------------------------------------------------
Kyle Green             19    7    3    1   0   3/5    60.0     0/0   0.0
DeMar Banchero         20    5    0    2   0   2/5    40.0     0/0   0.0
Cole Durant            17    5    1    0   0   2/4    50.0     0/0   0.0
Lamelo Ball            19    4    7    1   0   2/4    50.0     0/0   0.0
Jaren James            19    0    0    1   0   0/1     0.0     0/0   0.0
Malcolm Quickley       31    0    1    0   0   0/0     0.0     0/0   0.0

TEAM: FG: 9/19 (47.4%), 3PT: 2/5 (40.0%), REB: 12 (2 off, 10 def), AST: 5, TO: 4
TEAM FOULS: 11 [Team_088 in BONUS]

================================================================================

================================================================================
                               FULL GAME COMPLETE                               
================================================================================

FINAL SCORE: Team_088 92, Team_063 103

SCORING BY QUARTER:
--------------------------------------------------------------------------------
Team                     Q1     Q2     Q3     Q4    FINAL
--------------------------------------------------------------------------------
Team_088                 16     17     32     27       92
Team_063                 26     30     25     22      103
--------------------------------------------------------------------------------

FULL GAME BOX SCORE:
================================================================================

Team_088
--------------------------------------------------------------------------------
Player                MIN  PTS  REB  AST  TO      FG   FG%      3P   3P%      FT STL BLK
--------------------------------------------------------------------------------
Tobias Haliburton      29   20    0    1   0  11/19   57.9   5/9    55.6   0/0     0   0
Tyler Hyland           29    5    3    6   2   2/7    28.6   1/2    50.0   0/0     1   0
Giannis Smith          29    8    9    3   2   2/3    66.7   0/0     0.0   0/0     1   1
Allen Ming             29   10   12    3   0   5/11   45.5   0/1     0.0   0/0     0   0
Josh Duncan            29   10    0    1   2   3/9    33.3   1/6    16.7   1/1     1   0
Klay Quickley          20    3    0    1   1   1/4    25.0   1/2    50.0   0/0     0   1
Vince Carter           19   17    0    2   2   7/11   63.6   3/5    60.0   2/2     0   0
Pau Bird               19    3    5    1   1   2/3    66.7   0/0     0.0   1/2     0   0
Zion Harris            19   10    5    4   1   4/7    57.1   1/1   100.0   3/5     1   2
Josh Embiid            19    6    9    1   1   3/8    37.5   0/3     0.0   2/2     1   0

TEAM: FG: 40/82 (48.8%), 3PT: 12/29 (41.4%), REB: 43 (9 off, 34 def), AST: 23, TO: 12


Team_063
--------------------------------------------------------------------------------
Player                MIN  PTS  REB  AST  TO      FG   FG%      3P   3P%      FT STL BLK
--------------------------------------------------------------------------------
Malcolm Quickley       31    5   13    1   3   2/4    50.0   1/2    50.0   0/0     0   3
Terry Reaves           29   24    0    1   2  10/12   83.3   3/3   100.0   4/5     0   1
Dirk Reaves            29   11    5    0   1   5/8    62.5   1/2    50.0   2/2     0   0
Tyler Harris           29   13   11    1   2   5/13   38.5   0/3     0.0   2/3     1   2
Bradley Davis          29    7    0    6   1   3/6    50.0   0/3     0.0   3/3     0   0
DeMar Banchero         20   12    0    3   2   5/10   50.0   1/2    50.0   1/1     0   0
Jaren James            19    3    0    1   0   1/3    33.3   0/1     0.0   1/2     0   0
Lamelo Ball            19    9    8    1   2   5/8    62.5   1/3    33.3   0/0     1   0
Kyle Green             19    9    5    3   1   3/5    60.0   0/1     0.0   1/1     0   1
Cole Durant            17    7    4    4   1   3/8    37.5   1/4    25.0   0/0     0   0

TEAM: FG: 42/78 (53.8%), 3PT: 8/24 (33.3%), REB: 46 (6 off, 40 def), AST: 21, TO: 15

================================================================================
