================================================================================
                        FULL GAME - Team_002 vs Team_052                        
================================================================================

================================================================================
                       1ST QUARTER - Team_002 vs Team_052                       
================================================================================

[12:00] Team_002 possession (Score: 0-0)
Carmelo Lowry attempts a 3Pt. Contested by James Paul (5.0 feet, MAN). Carmelo Lowry misses. Rebound secured by James Paul.

[11:44] Team_052 possession (Score: 0-0)
Bones Morant attempts a 3Pt. Wide open! CJ Barrett is 6.3 feet away. [ZONE] Bones Morant misses. Offensive rebound by Bones Morant! Bones Morant kicks it out.

[11:32] Team_052 possession (Score: 0-0)
Josh Durant drives, CJ Barrett stays with him. Josh Durant attempts a Layup. Contested by CJ Barrett (4.5 feet, MAN). JOSH DURANT MAKES IT! Assist: James Paul
Score: 0-2

[11:20] Team_002 possession (Score: 0-2)
Jordan Green drives and kicks out. CJ Barrett attempts a 3Pt. Contested by Josh Durant (3.1 feet, MAN). CJ BARRETT MAKES IT! Assist: Jordan Green
Score: 3-2

[11:01] Team_052 possession (Score: 3-2)
James Paul attempts a Midrange. Wide open! Carmelo Lowry is 7.4 feet away. [MAN] James Paul misses. Rebound secured by Carmelo Lowry.

[10:46] Team_002 possession (Score: 3-2)
FOUL! Shooting foul on Carmelo Middleton. Tyler Porzingis to the line for 2 free throws. [Team fouls: 1] (Carmelo Middleton: 1 personal fouls)   FT 1/2: GOOD   FT 2/2: GOOD Tyler Porzingis makes 2/2 from the line.
Score: 5-2

[10:34] Team_052 possession (Score: 5-2)
Josh Durant drives and kicks out. Bones Morant makes the Midrange and draws the foul on Jordan Green! And-1! Bones Morant to the line for 1. [Team fouls: 1] (Jordan Green: 1 personal fouls)   FT 1/1: GOOD Bones Morant makes 1/1 from the line.
Score: 5-5

[10:17] Team_002 possession (Score: 5-5)
Jordan Green attempts a Midrange. Contested by Gary Gasol (3.7 feet, ZONE). Jordan Green misses. Rebound secured by James Paul.

[10:03] Team_052 possession (Score: 5-5)
Gary Gasol attempts a Midrange. Contested by Miles Bane (5.1 feet, MAN). GARY GASOL MAKES IT!
Score: 5-7

[09:49] Team_002 possession (Score: 5-7)
Tyler Porzingis drives and kicks out. Carmelo Lowry attempts a 3Pt. Wide open! Josh Durant is 6.1 feet away. [ZONE] Carmelo Lowry misses. Rebound secured by Carmelo Middleton.

[09:39] Team_052 possession (Score: 5-7)
Josh Durant makes the Dunk and draws the foul on Tyler Porzingis! And-1! Josh Durant to the line for 1. [Team fouls: 2] (Tyler Porzingis: 1 personal fouls)   FT 1/1: MISS Josh Durant makes 0/1 from the line. Rebound secured by Miles Bane.
Score: 5-9

[09:23] Team_002 possession (Score: 5-9)
Jordan Green attempts a 3Pt. Wide open! Bones Morant is 8.3 feet away. [ZONE] JORDAN GREEN MAKES IT! Assist: Carmelo Lowry
Score: 8-9

[09:06] Team_052 possession (Score: 8-9)
James Paul drives, Carmelo Lowry stays with him. James Paul attempts a Layup. Heavily contested by Carmelo Lowry (1.0 feet, MAN)! JAMES PAUL MAKES IT! Assist: Josh Durant
Score: 8-11

[08:52] Team_002 possession (Score: 8-11)
FOUL! Shooting foul on James Paul. Carmelo Lowry to the line for 2 free throws. [Team fouls: 2] (James Paul: 1 personal fouls)   FT 1/2: GOOD   FT 2/2: GOOD Carmelo Lowry makes 2/2 from the line.
Score: 10-11

[08:34] Team_052 possession (Score: 10-11)
Carmelo Middleton loses the ball! Stripped by Tyler Porzingis! TURNOVER! (live ball)

[08:20] Team_002 possession (Score: 10-11)
Jordan Green attempts a Midrange. Contested by Bones Morant (4.3 feet, MAN). Jordan Green misses. Rebound secured by James Paul.

[08:04] Team_052 possession (Score: 10-11)
Carmelo Middleton attempts a 3Pt. Contested by CJ Barrett (5.5 feet, ZONE). Carmelo Middleton misses. Offensive rebound by James Paul! James Paul puts it back in!
Score: 10-13

[07:48] Team_002 possession (Score: 10-13)
FOUL! Offensive foul on Tyler Porzingis! Carmelo Middleton drew the charge! [Team fouls: 3] (Tyler Porzingis: 2 personal fouls) TURNOVER! (dead ball)

[07:37] Team_052 possession (Score: 10-13)
FOUL! Reach-in foul on CJ Barrett during the drive. [Team fouls: 4] No free throws, side out. (CJ Barrett: 1 personal fouls)

[07:22] Team_052 possession (Score: 10-13)
Gary Gasol attempts a 3Pt. Contested by CJ Barrett (4.0 feet, ZONE). Gary Gasol misses. Rebound secured by Tyler Porzingis.

[07:08] Team_002 possession (Score: 10-13)
Tyler Porzingis loses control! Ball rolls out of bounds! TURNOVER! (dead ball)

[06:54] Team_052 possession (Score: 10-13)
James Paul attempts a Midrange. Contested by Carmelo Lowry (5.7 feet, MAN). JAMES PAUL MAKES IT! Assist: Bones Morant
Score: 10-15

[06:43] Team_002 possession (Score: 10-15)
Miles Bane drives and kicks out. Carmelo Lowry attempts a 3Pt. Heavily contested by Bones Morant (1.9 feet, ZONE)! Carmelo Lowry misses. Rebound secured by James Paul.

[06:25] Team_052 possession (Score: 10-15)
James Paul attempts a Midrange. Heavily contested by Carmelo Lowry (0.7 feet, ZONE)! James Paul misses. Offensive rebound by James Paul! James Paul's putback is no good. Rebound secured by Carmelo Lowry.

[06:11] Team_002 possession (Score: 10-15)
Tyler Porzingis drives to the basket... Tyler Porzingis throws a bad pass! Stolen by James Paul! TURNOVER! (live ball)

[05:55] Team_052 possession (Score: 10-15)
Josh Durant makes the Dunk and draws the foul on Tyler Porzingis! And-1! Josh Durant to the line for 1. [BONUS: 5 team fouls] (Tyler Porzingis: 3 personal fouls)   FT 1/1: GOOD Josh Durant makes 1/1 from the line.
Score: 10-18

[05:38] Team_002 possession (Score: 10-18)
Jordan Green drives and kicks out. CJ Barrett attempts a Midrange. Contested by Josh Durant (3.2 feet, MAN). CJ BARRETT MAKES IT!
Score: 12-18

[05:25] Team_052 possession (Score: 12-18)
FOUL! Holding foul on Jordan Green. [IN THE BONUS! 6 team fouls] Bones Morant to the line for 2 free throws. (Jordan Green: 2 personal fouls)   FT 1/2: GOOD   FT 2/2: GOOD Bones Morant makes 2/2 from the line.
Score: 12-20

[05:06] Team_002 possession (Score: 12-20)
CJ Barrett drives to the basket... FOUL! Offensive foul on CJ Barrett! James Paul drew the charge! [Team fouls: 7] (CJ Barrett: 2 personal fouls) TURNOVER! (dead ball)

[04:48] Team_052 possession (Score: 12-20)
Carmelo Middleton attempts a Layup. Heavily contested by Tyler Porzingis (0.5 feet, MAN)! Carmelo Middleton misses. Rebound secured by Tyler Porzingis.

[04:37] Team_002 possession (Score: 12-20)
Miles Bane attempts a 3Pt. Contested by Bones Morant (2.8 feet, ZONE). Miles Bane misses. Rebound secured by Carmelo Middleton.

[04:23] Team_052 possession (Score: 12-20)
James Paul drives and kicks out. Carmelo Middleton attempts a 3Pt. Contested by CJ Barrett (2.5 feet, ZONE). CARMELO MIDDLETON MAKES IT! Assist: Josh Durant
Score: 12-23

[04:08] Team_002 possession (Score: 12-23)
Carmelo Lowry drives to the basket... Carmelo Lowry throws a bad pass out of bounds! TURNOVER! (dead ball)

[03:56] Team_052 possession (Score: 12-23)
Carmelo Middleton drives to the basket... Carmelo Middleton throws a bad pass out of bounds! TURNOVER! (dead ball)

[03:37] Team_002 possession (Score: 12-23)
FOUL! Shooting foul on Gary Gasol. Miles Bane to the line for 2 free throws. [Team fouls: 3] (Gary Gasol: 1 personal fouls)   FT 1/2: GOOD   FT 2/2: GOOD Miles Bane makes 2/2 from the line.
Score: 14-23

[03:26] Team_052 possession (Score: 14-23)
Bones Morant drives, Jordan Green stays with him. Bones Morant attempts a Layup. Contested by Jordan Green (4.4 feet, MAN). BONES MORANT MAKES IT!
Score: 14-25

[03:12] Team_002 possession (Score: 14-25)
FOUL! Shooting foul on James Paul. Miles Bane to the line for 2 free throws. [Team fouls: 4] (James Paul: 2 personal fouls)   FT 1/2: GOOD   FT 2/2: GOOD Miles Bane makes 2/2 from the line.
Score: 16-25

[02:54] Team_052 possession (Score: 16-25)
Bones Morant attempts a Layup. Contested by Tyler Porzingis (2.1 feet, ZONE). BONES MORANT MAKES IT! Assist: Carmelo Middleton
Score: 16-27

[02:41] Team_002 possession (Score: 16-27)
Carmelo Lowry throws a bad pass out of bounds! TURNOVER! (dead ball)

[02:41] Substitution (Team_002): Carmelo Lowry OUT → Julius Curry IN (stamina_rule2)

[02:41] Substitution (Team_002): Tyler Porzingis OUT → Lamelo O'Neal IN (stamina_rule2)

[02:41] Substitution (Team_052): Carmelo Middleton OUT → Carmelo Beal IN (stamina_rule2)

[02:30] Team_052 possession (Score: 16-27)
Carmelo Beal attempts a 3Pt. Contested by CJ Barrett (4.0 feet, ZONE). Carmelo Beal misses. Offensive rebound by James Paul! James Paul's putback is no good. Rebound secured by Miles Bane.

[02:17] Team_002 possession (Score: 16-27)
Lamelo O'Neal attempts a Layup. Heavily contested by Carmelo Beal (1.8 feet, MAN)! LAMELO O'NEAL MAKES IT! Assist: CJ Barrett
Score: 18-27

[02:05] Team_052 possession (Score: 18-27)
Carmelo Beal drives to the basket... Carmelo Beal loses the ball! Stripped by Lamelo O'Neal! TURNOVER! (live ball)

[01:51] Team_002 possession (Score: 18-27)
CJ Barrett throws a bad pass! Stolen by Josh Durant! TURNOVER! (live ball)

[01:37] Team_052 possession (Score: 18-27)
James Paul drives, Lamelo O'Neal stays with him. James Paul attempts a Layup. Contested by Lamelo O'Neal (3.1 feet, ZONE). JAMES PAUL MAKES IT! Assist: Carmelo Beal
Score: 18-29

[01:24] Team_002 possession (Score: 18-29)
Jordan Green throws a bad pass! Stolen by Bones Morant! TURNOVER! (live ball)

[01:09] Team_052 possession (Score: 18-29)
Carmelo Beal attempts a Midrange. BLOCKED BY LAMELO O'NEAL! Ball is loose! Offensive rebound by James Paul! James Paul kicks it out.

[00:54] Team_052 possession (Score: 18-29)
Bones Morant attempts a 3Pt. Contested by Jordan Green (5.5 feet, MAN). Bones Morant misses. Rebound secured by CJ Barrett.

[00:40] Team_002 possession (Score: 18-29)
Julius Curry drives, picks up James Paul. Help arrives from Josh Durant! Julius Curry attempts a Dunk. Contested by Josh Durant (3.6 feet, ZONE). Julius Curry misses. Rebound secured by James Paul.

[00:26] Team_052 possession (Score: 18-29)
Gary Gasol attempts a Midrange. Wide open! Jordan Green is 6.3 feet away. [ZONE] GARY GASOL MAKES IT! Assist: James Paul
Score: 18-31

[00:16] Team_002 possession (Score: 18-31)
Julius Curry drives, Carmelo Beal stays with him. Julius Curry attempts a Dunk. Heavily contested by Carmelo Beal (0.8 feet, ZONE)! JULIUS CURRY MAKES IT!
Score: 20-31

[00:03] Team_052 possession (Score: 20-31)
Gary Gasol makes the Dunk and draws the foul on Miles Bane! And-1! Gary Gasol to the line for 1. [BONUS: 8 team fouls] (Miles Bane: 1 personal fouls)   FT 1/1: GOOD Gary Gasol makes 1/1 from the line.
Score: 20-34

================================================================================
                              1ST QUARTER COMPLETE                              
================================================================================

1ST QUARTER SCORE: Team_002 20, Team_052 34

BOX SCORE:
================================================================================

Team_002
--------------------------------------------------------------------------------
Player                MIN  PTS  REB  AST  TO      FG   FG%      3P   3P%
--------------------------------------------------------------------------------
CJ Barrett             12    5    1    1   0   2/2   100.0     0/0   0.0
Jordan Green           12    3    0    1   0   1/3    33.3     0/0   0.0
Tyler Porzingis        10    2    2    0   0   1/2    50.0     0/0   0.0
Lamelo O'Neal           3    2    0    0   0   1/1   100.0     0/0   0.0
Julius Curry            3    2    0    0   0   1/2    50.0     0/0   0.0

TEAM: FG: 9/16 (56.2%), 3PT: 1/3 (33.3%), REB: 5 (0 off, 5 def), AST: 3, TO: 8
TEAM FOULS: 8 [Team_052 in BONUS]


Team_052
--------------------------------------------------------------------------------
Player                MIN  PTS  REB  AST  TO      FG   FG%      3P   3P%
--------------------------------------------------------------------------------
Bones Morant           12    9    1    1   0   4/5    80.0     0/0   0.0
James Paul             12    8    7    2   0   4/6    66.7     0/0   0.0
Gary Gasol             12    7    0    0   0   3/4    75.0     0/0   0.0
Josh Durant            12    5    0    2   0   2/3    66.7     0/0   0.0
Miles Bane             12    4    2    0   0   2/4    50.0     0/0   0.0
Carmelo Middleton      10    3    2    1   0   1/2    50.0     0/0   0.0
Carmelo Lowry          10    2    2    1   0   1/2    50.0     0/0   0.0
Carmelo Beal            3    0    0    1   0   0/1     0.0     0/0   0.0

TEAM: FG: 14/21 (66.7%), 3PT: 1/4 (25.0%), REB: 12 (5 off, 7 def), AST: 7, TO: 3
TEAM FOULS: 4

================================================================================

================================================================================
                       2ND QUARTER - Team_002 vs Team_052                       
================================================================================

[12:00] Team_002 possession (Score: 20-34)
Miles Bane drives, Gary Gasol stays with him. Miles Bane attempts a Layup. Contested by Gary Gasol (2.1 feet, MAN). MILES BANE MAKES IT! Assist: Carmelo Lowry
Score: 22-34

[11:49] Team_052 possession (Score: 22-34)
Bones Morant attempts a 3Pt. Contested by Jordan Green (5.3 feet, MAN). Bones Morant misses. FOUL! Loose ball foul on Miles Bane during the rebound battle. [Team fouls: 1] No free throws, side out. (Miles Bane: 1 personal fouls)

[11:32] Team_052 possession (Score: 22-34)
FOUL! Reach-in foul on Tyler Porzingis during the drive. [Team fouls: 2] No free throws, side out. (Tyler Porzingis: 1 personal fouls)

[11:20] Team_052 possession (Score: 22-34)
Carmelo Middleton attempts a Midrange. Heavily contested by Tyler Porzingis (1.9 feet, MAN)! Carmelo Middleton misses. Rebound secured by Miles Bane.

[11:06] Team_002 possession (Score: 22-34)
Jordan Green makes the Layup and draws the foul on Josh Durant! And-1! Jordan Green to the line for 1. [Team fouls: 1] (Josh Durant: 1 personal fouls)   FT 1/1: GOOD Jordan Green makes 1/1 from the line.
Score: 25-34

[10:54] Team_052 possession (Score: 25-34)
Josh Durant drives and kicks out. Josh Durant attempts a Midrange. Wide open! CJ Barrett is 6.5 feet away. [MAN] JOSH DURANT MAKES IT!
Score: 25-36

[10:37] Team_002 possession (Score: 25-36)
Carmelo Lowry attempts a 3Pt. Wide open! Gary Gasol is 8.7 feet away. [ZONE] Carmelo Lowry misses. Rebound secured by Carmelo Middleton.

[10:21] Team_052 possession (Score: 25-36)
Carmelo Middleton drives to the basket... Carmelo Middleton throws a bad pass out of bounds! TURNOVER! (dead ball)

[10:21] Substitution (Team_002): Miles Bane OUT → John Duncan IN (stamina_rule2)

[10:21] Substitution (Team_002): CJ Barrett OUT → Dirk Middleton IN (stamina_rule2)

[10:21] Substitution (Team_002): Jordan Green OUT → Anfernee Sexton IN (stamina_rule2)

[10:21] Substitution (Team_052): Gary Gasol OUT → Jimmy Doncic IN (stamina_rule2)

[10:21] Substitution (Team_052): Josh Durant OUT → Carmelo Giddey IN (stamina_rule2)

[10:21] Substitution (Team_052): Bones Morant OUT → Donovan Stewart IN (stamina_rule2)

[10:21] Substitution (Team_052): James Paul OUT → Jalen Haliburton IN (stamina_rule2)

[10:05] Team_002 possession (Score: 25-36)
FOUL! Shooting foul on Jimmy Doncic. John Duncan to the line for 3 free throws. [Team fouls: 2] (Jimmy Doncic: 1 personal fouls)   FT 1/3: GOOD   FT 2/3: GOOD   FT 3/3: GOOD John Duncan makes 3/3 from the line.
Score: 28-36

[09:50] Team_052 possession (Score: 28-36)
Donovan Stewart attempts a Midrange. Contested by Carmelo Lowry (5.4 feet, ZONE). Donovan Stewart misses. Rebound secured by Tyler Porzingis.

[09:36] Team_002 possession (Score: 28-36)
Anfernee Sexton loses the ball! Stripped by Donovan Stewart! TURNOVER! (live ball)

[09:19] Team_052 possession (Score: 28-36)
Carmelo Giddey makes the Dunk and draws the foul on Dirk Middleton! And-1! Carmelo Giddey to the line for 1. [Team fouls: 3] (Dirk Middleton: 1 personal fouls)   FT 1/1: GOOD Carmelo Giddey makes 1/1 from the line.
Score: 28-39

[09:02] Team_002 possession (Score: 28-39)
Carmelo Lowry drives, picks up Jalen Haliburton. Help arrives from Carmelo Giddey! Carmelo Lowry attempts a Layup. Heavily contested by Carmelo Giddey (1.9 feet, ZONE)! CARMELO LOWRY MAKES IT! Assist: Dirk Middleton
Score: 30-39

[08:46] Team_052 possession (Score: 30-39)
Jalen Haliburton makes the Layup and draws the foul on Tyler Porzingis! And-1! Jalen Haliburton to the line for 1. [Team fouls: 4] (Tyler Porzingis: 2 personal fouls)   FT 1/1: MISS Jalen Haliburton makes 0/1 from the line. Rebound secured by Carmelo Lowry.
Score: 30-41

[08:32] Team_002 possession (Score: 30-41)
John Duncan attempts a 3Pt. Contested by Jimmy Doncic (2.4 feet, MAN). John Duncan misses. Rebound secured by Carmelo Middleton.

[08:20] Team_052 possession (Score: 30-41)
Jalen Haliburton commits a violation (traveling/carry)! TURNOVER! (dead ball)

[08:20] Substitution (Team_002): Carmelo Lowry OUT → Julius Curry IN (stamina_rule2)

[08:20] Substitution (Team_002): Tyler Porzingis OUT → Lamelo O'Neal IN (stamina_rule2)

[08:20] Substitution (Team_052): Carmelo Middleton OUT → Carmelo Beal IN (stamina_rule2)

[08:03] Team_002 possession (Score: 30-41)
Dirk Middleton attempts a 3Pt. Contested by Jalen Haliburton (5.2 feet, ZONE). DIRK MIDDLETON MAKES IT! Assist: John Duncan
Score: 33-41

[07:50] Team_052 possession (Score: 33-41)
Jimmy Doncic attempts a 3Pt. Wide open! Julius Curry is 9.3 feet away. [ZONE] Jimmy Doncic misses. Rebound secured by Anfernee Sexton.

[07:36] Team_002 possession (Score: 33-41)
John Duncan drives, picks up Jimmy Doncic. Help arrives from Carmelo Giddey! John Duncan attempts a Dunk. Contested by Carmelo Giddey (4.8 feet, MAN). John Duncan misses. Offensive rebound by Lamelo O'Neal! Lamelo O'Neal's putback is no good. Rebound secured by Donovan Stewart.

[07:23] Team_052 possession (Score: 33-41)
Jimmy Doncic drives and kicks out. Carmelo Giddey attempts a 3Pt. Heavily contested by Julius Curry (1.4 feet, ZONE)! Carmelo Giddey misses. Rebound secured by Anfernee Sexton.

[07:09] Team_002 possession (Score: 33-41)
Julius Curry drives and kicks out. John Duncan attempts a 3Pt. Contested by Jimmy Doncic (4.1 feet, MAN). John Duncan misses. Rebound secured by Carmelo Beal.

[06:59] Team_052 possession (Score: 33-41)
Carmelo Beal attempts a 3Pt. Wide open! Julius Curry is 7.6 feet away. [ZONE] Carmelo Beal misses. Offensive rebound by Jalen Haliburton! Jalen Haliburton kicks it out.

[06:44] Team_052 possession (Score: 33-41)
Carmelo Beal drives and kicks out. Carmelo Beal attempts a 3Pt. Wide open! Julius Curry is 7.3 feet away. [ZONE] CARMELO BEAL MAKES IT! Assist: Jimmy Doncic
Score: 33-44

[06:29] Team_002 possession (Score: 33-44)
Dirk Middleton attempts a Midrange. Wide open! Jalen Haliburton is 6.2 feet away. [ZONE] DIRK MIDDLETON MAKES IT! Assist: John Duncan
Score: 35-44

[06:14] Team_052 possession (Score: 35-44)
Carmelo Giddey drives to the basket... Carmelo Giddey loses the ball! Stripped by Lamelo O'Neal! TURNOVER! (live ball)

[05:57] Team_002 possession (Score: 35-44)
Dirk Middleton drives and kicks out. Dirk Middleton attempts a 3Pt. Contested by Carmelo Giddey (3.2 feet, MAN). DIRK MIDDLETON MAKES IT!
Score: 38-44

[05:45] Team_052 possession (Score: 38-44)
Carmelo Beal drives, Lamelo O'Neal stays with him. Carmelo Beal attempts a Dunk. Wide open! Lamelo O'Neal is 6.3 feet away. [ZONE] Carmelo Beal misses. Rebound secured by Julius Curry.

[05:32] Team_002 possession (Score: 38-44)
FOUL! Reach-in foul on Carmelo Beal during the drive. [Team fouls: 3] No free throws, side out. (Carmelo Beal: 1 personal fouls)

[05:18] Team_002 possession (Score: 38-44)
Julius Curry drives and kicks out. John Duncan attempts a Midrange. Contested by Donovan Stewart (4.6 feet, ZONE). JOHN DUNCAN MAKES IT!
Score: 40-44

[05:03] Team_052 possession (Score: 40-44)
Carmelo Beal attempts a 3Pt. Wide open! Lamelo O'Neal is 7.2 feet away. [MAN] Carmelo Beal misses. Rebound secured by Lamelo O'Neal.

[04:49] Team_002 possession (Score: 40-44)
Julius Curry attempts a Layup. BLOCKED BY JALEN HALIBURTON! Ball is loose! Rebound secured by Carmelo Beal.

[04:32] Team_052 possession (Score: 40-44)
Carmelo Giddey attempts a Layup. Wide open! Dirk Middleton is 7.8 feet away. [MAN] CARMELO GIDDEY MAKES IT! Assist: Carmelo Beal
Score: 40-46

[04:16] Team_002 possession (Score: 40-46)
Lamelo O'Neal attempts a Layup. Heavily contested by Carmelo Beal (0.7 feet, ZONE)! LAMELO O'NEAL MAKES IT! Assist: Dirk Middleton
Score: 42-46

[04:05] Team_052 possession (Score: 42-46)
Donovan Stewart attempts a 3Pt. Contested by Julius Curry (3.6 feet, ZONE). Donovan Stewart misses. Offensive rebound by Jalen Haliburton! Jalen Haliburton kicks it out.

[03:52] Team_052 possession (Score: 42-46)
Jimmy Doncic attempts a 3Pt. Heavily contested by Julius Curry (1.9 feet, ZONE)! JIMMY DONCIC MAKES IT!
Score: 42-49

[03:39] Team_002 possession (Score: 42-49)
Anfernee Sexton attempts a 3Pt. Contested by Jalen Haliburton (5.1 feet, ZONE). Anfernee Sexton misses. Rebound secured by Donovan Stewart.

[03:26] Team_052 possession (Score: 42-49)
Donovan Stewart drives to the basket... Donovan Stewart loses the ball! Stripped by Lamelo O'Neal! TURNOVER! (live ball)

[03:09] Team_002 possession (Score: 42-49)
Anfernee Sexton drives to the basket... Anfernee Sexton throws a bad pass! Stolen by Donovan Stewart! TURNOVER! (live ball)

[02:56] Team_052 possession (Score: 42-49)
Donovan Stewart attempts a 3Pt. Wide open! Julius Curry is 7.3 feet away. [ZONE] Donovan Stewart misses. Rebound secured by Lamelo O'Neal.

[02:40] Team_002 possession (Score: 42-49)
Lamelo O'Neal makes the Midrange and draws the foul on Donovan Stewart! And-1! Lamelo O'Neal to the line for 1. [Team fouls: 4] (Donovan Stewart: 1 personal fouls)   FT 1/1: GOOD Lamelo O'Neal makes 1/1 from the line.
Score: 45-49

[02:26] Team_052 possession (Score: 45-49)
Donovan Stewart attempts a 3Pt. Contested by Julius Curry (4.2 feet, ZONE). Donovan Stewart misses. FOUL! Loose ball foul on Julius Curry during the rebound battle. [IN THE BONUS! 5 team fouls] Jalen Haliburton to the line for 2 free throws. (Julius Curry: 1 personal fouls)   FT 1/2: GOOD   FT 2/2: MISS Jalen Haliburton makes 1/2 from the line. Rebound secured by Julius Curry.
Score: 45-50

[02:08] Team_002 possession (Score: 45-50)
Julius Curry drives, picks up Carmelo Beal. Help arrives from Carmelo Giddey! Julius Curry attempts a Dunk. Contested by Carmelo Giddey (4.3 feet, ZONE). Julius Curry misses. Rebound secured by Jalen Haliburton.

[01:55] Team_052 possession (Score: 45-50)
FOUL! Shooting foul on Lamelo O'Neal. Carmelo Beal to the line for 2 free throws. [BONUS: 6 team fouls] (Lamelo O'Neal: 1 personal fouls)   FT 1/2: GOOD   FT 2/2: GOOD Carmelo Beal makes 2/2 from the line.
Score: 45-52

[01:39] Team_002 possession (Score: 45-52)
John Duncan attempts a 3Pt. Contested by Jalen Haliburton (2.6 feet, ZONE). John Duncan misses. Offensive rebound by Anfernee Sexton! Anfernee Sexton kicks it out.

[01:26] Team_002 possession (Score: 45-52)
FOUL! Holding foul on Jalen Haliburton. [IN THE BONUS! 5 team fouls] Julius Curry to the line for 2 free throws. (Jalen Haliburton: 1 personal fouls)   FT 1/2: GOOD   FT 2/2: GOOD Julius Curry makes 2/2 from the line.
Score: 47-52

[01:11] Team_052 possession (Score: 47-52)
Jimmy Doncic attempts a 3Pt. Contested by John Duncan (5.3 feet, MAN). Jimmy Doncic misses. FOUL! Loose ball foul on Anfernee Sexton during the rebound battle. [IN THE BONUS! 7 team fouls] Carmelo Beal to the line for 2 free throws. (Anfernee Sexton: 1 personal fouls)   FT 1/2: GOOD   FT 2/2: MISS Carmelo Beal makes 1/2 from the line. Rebound secured by Julius Curry.
Score: 47-53

[00:57] Team_002 possession (Score: 47-53)
Anfernee Sexton throws a bad pass! Stolen by Donovan Stewart! TURNOVER! (live ball)

[00:40] Team_052 possession (Score: 47-53)
Carmelo Giddey attempts a Midrange. Wide open! Dirk Middleton is 8.8 feet away. [MAN] Carmelo Giddey misses. Offensive rebound by Donovan Stewart! Donovan Stewart kicks it out.

[00:27] Team_052 possession (Score: 47-53)
Carmelo Beal attempts a Midrange. Contested by Lamelo O'Neal (2.4 feet, MAN). CARMELO BEAL MAKES IT!
Score: 47-55

[00:17] Team_002 possession (Score: 47-55)
FOUL! Shooting foul on Carmelo Giddey. Julius Curry to the line for 2 free throws. [BONUS: 6 team fouls] (Carmelo Giddey: 1 personal fouls)   FT 1/2: MISS   FT 2/2: GOOD Julius Curry makes 1/2 from the line.
Score: 48-55

[00:03] Team_052 possession (Score: 48-55)
Carmelo Giddey attempts a 3Pt. Wide open! Julius Curry is 9.2 feet away. [ZONE] Carmelo Giddey misses. Rebound secured by Lamelo O'Neal.

================================================================================
                              2ND QUARTER COMPLETE                              
================================================================================

2ND QUARTER SCORE: Team_002 28, Team_052 21

BOX SCORE:
================================================================================

Team_002
--------------------------------------------------------------------------------
Player                MIN  PTS  REB  AST  TO      FG   FG%      3P   3P%
--------------------------------------------------------------------------------
Dirk Middleton         10    8    0    2   0   3/3   100.0     0/0   0.0
John Duncan            10    5    0    2   0   2/4    50.0     0/0   0.0
Lamelo O'Neal          11    5    3    0   0   2/2   100.0     0/0   0.0
Jordan Green           14    3    0    0   0   1/1   100.0     0/0   0.0
Julius Curry           11    3    3    0   0   2/5    40.0     0/0   0.0
Miles Bane             14    2    1    0   0   1/1   100.0     0/0   0.0
Carmelo Lowry          13    2    1    1   0   1/2    50.0     0/0   0.0
Tyler Porzingis        13    0    1    0   0   0/0     0.0     0/0   0.0
Anfernee Sexton        10    0    3    0   0   0/1     0.0     0/0   0.0

TEAM: FG: 12/19 (63.2%), 3PT: 2/5 (40.0%), REB: 11 (2 off, 9 def), AST: 5, TO: 3
TEAM FOULS: 7 [Team_052 in BONUS]


Team_052
--------------------------------------------------------------------------------
Player                MIN  PTS  REB  AST  TO      FG   FG%      3P   3P%
--------------------------------------------------------------------------------
Carmelo Beal           11    7    2    1   0   3/5    60.0     0/0   0.0
Carmelo Giddey         10    5    0    0   0   2/3    66.7     0/0   0.0
Jimmy Doncic           10    3    0    1   0   1/4    25.0     0/0   0.0
Josh Durant            14    2    0    0   0   1/1   100.0     0/0   0.0
James Paul             14    0    1    0   0   0/0     0.0     0/0   0.0
Carmelo Middleton      13    0    2    0   0   0/1     0.0     0/0   0.0
Donovan Stewart        10    0    3    0   0   0/3     0.0     0/0   0.0
Jalen Haliburton       10    0    3    0   0   0/1     0.0     0/0   0.0

TEAM: FG: 7/18 (38.9%), 3PT: 1/7 (14.3%), REB: 12 (6 off, 6 def), AST: 2, TO: 4
TEAM FOULS: 6 [Team_002 in BONUS]

================================================================================

================================================================================
                       3RD QUARTER - Team_002 vs Team_052                       
================================================================================

[12:00] Team_002 possession (Score: 48-55)
Jordan Green attempts a 3Pt. Heavily contested by Bones Morant (1.9 feet, MAN)! Jordan Green misses. Rebound secured by James Paul.

[11:43] Team_052 possession (Score: 48-55)
Carmelo Middleton attempts a Layup. Heavily contested by Tyler Porzingis (0.5 feet, MAN)! Carmelo Middleton misses. Offensive rebound by James Paul! James Paul's putback is no good. Rebound secured by Tyler Porzingis.

[11:34] Team_002 possession (Score: 48-55)
CJ Barrett attempts a 3Pt. Contested by Bones Morant (5.6 feet, ZONE). CJ BARRETT MAKES IT! Assist: Miles Bane
Score: 51-55

[11:19] Team_052 possession (Score: 51-55)
Josh Durant attempts a 3Pt. Contested by CJ Barrett (4.6 feet, MAN). JOSH DURANT MAKES IT!
Score: 51-58

[11:03] Team_002 possession (Score: 51-58)
CJ Barrett attempts a Midrange. Heavily contested by Carmelo Middleton (2.0 feet, ZONE)! CJ Barrett misses. Rebound secured by Bones Morant.

[10:46] Team_052 possession (Score: 51-58)
James Paul attempts a Layup. Contested by Carmelo Lowry (2.8 feet, MAN). James Paul misses. Rebound secured by Carmelo Lowry.

[10:30] Team_002 possession (Score: 51-58)
Tyler Porzingis drives and kicks out. Jordan Green attempts a 3Pt. Contested by Bones Morant (2.0 feet, MAN). Jordan Green misses. Rebound secured by James Paul.

[10:14] Team_052 possession (Score: 51-58)
Gary Gasol attempts a 3Pt. Contested by Miles Bane (5.3 feet, MAN). Gary Gasol misses. Offensive rebound by James Paul! James Paul's putback is no good. Rebound secured by Tyler Porzingis.

[09:58] Team_002 possession (Score: 51-58)
FOUL! Reach-in foul on James Paul during the drive. [Team fouls: 1] No free throws, side out. (James Paul: 1 personal fouls)

[09:41] Team_002 possession (Score: 51-58)
Jordan Green attempts a Midrange. Contested by Bones Morant (3.2 feet, ZONE). Jordan Green misses. Rebound secured by James Paul.

[09:26] Team_052 possession (Score: 51-58)
FOUL! Offensive foul on Carmelo Middleton! Tyler Porzingis drew the charge! [Team fouls: 2] (Carmelo Middleton: 1 personal fouls) TURNOVER! (dead ball)

[09:13] Team_002 possession (Score: 51-58)
CJ Barrett drives and kicks out. Carmelo Lowry attempts a 3Pt. Contested by Bones Morant (5.2 feet, ZONE). CARMELO LOWRY MAKES IT! Assist: Miles Bane
Score: 54-58

[09:00] Team_052 possession (Score: 54-58)
Carmelo Middleton attempts a Midrange. Contested by CJ Barrett (3.5 feet, ZONE). CARMELO MIDDLETON MAKES IT! Assist: Bones Morant
Score: 54-60

[08:44] Team_002 possession (Score: 54-60)
Jordan Green attempts a 3Pt. Contested by Bones Morant (4.4 feet, MAN). Jordan Green misses. Rebound secured by Bones Morant.

[08:31] Team_052 possession (Score: 54-60)
FOUL! Shooting foul on Carmelo Lowry. James Paul to the line for 2 free throws. [Team fouls: 1] (Carmelo Lowry: 1 personal fouls)   FT 1/2: GOOD   FT 2/2: GOOD James Paul makes 2/2 from the line.
Score: 54-62

[08:19] Team_002 possession (Score: 54-62)
Tyler Porzingis attempts a 3Pt. Contested by Carmelo Middleton (5.6 feet, MAN). Tyler Porzingis misses. Rebound secured by James Paul.

[08:02] Team_052 possession (Score: 54-62)
Gary Gasol attempts a 3Pt. Contested by Miles Bane (5.8 feet, MAN). Gary Gasol misses. Rebound secured by Carmelo Lowry.

[07:45] Team_002 possession (Score: 54-62)
Tyler Porzingis drives, Carmelo Middleton stays with him. Tyler Porzingis attempts a Dunk. Contested by Carmelo Middleton (3.4 feet, MAN). TYLER PORZINGIS MAKES IT! Assist: Jordan Green
Score: 56-62

[07:34] Team_052 possession (Score: 56-62)
Bones Morant drives and kicks out. Bones Morant attempts a 3Pt. Contested by Jordan Green (4.8 feet, MAN). BONES MORANT MAKES IT! Assist: James Paul
Score: 56-65

[07:20] Team_002 possession (Score: 56-65)
FOUL! Shooting foul on James Paul. Miles Bane to the line for 2 free throws. [Team fouls: 3] (James Paul: 2 personal fouls)   FT 1/2: GOOD   FT 2/2: MISS Miles Bane makes 1/2 from the line. Rebound secured by Carmelo Middleton.
Score: 57-65

[07:05] Team_052 possession (Score: 57-65)
Bones Morant commits a violation (traveling/carry)! TURNOVER! (dead ball)

[06:51] Team_002 possession (Score: 57-65)
FOUL! Shooting foul on Bones Morant. Jordan Green to the line for 2 free throws. [Team fouls: 4] (Bones Morant: 1 personal fouls)   FT 1/2: GOOD   FT 2/2: MISS Jordan Green makes 1/2 from the line. Rebound secured by Bones Morant.
Score: 58-65

[06:34] Team_052 possession (Score: 58-65)
Josh Durant drives, Tyler Porzingis stays with him. Josh Durant attempts a Dunk. Contested by Tyler Porzingis (5.1 feet, ZONE). JOSH DURANT MAKES IT!
Score: 58-67

[06:20] Team_002 possession (Score: 58-67)
FOUL! Shooting foul on James Paul. Carmelo Lowry to the line for 2 free throws. [BONUS: 5 team fouls] (James Paul: 3 personal fouls)   FT 1/2: GOOD   FT 2/2: GOOD Carmelo Lowry makes 2/2 from the line.
Score: 60-67

[06:02] Team_052 possession (Score: 60-67)
Bones Morant attempts a Midrange. Wide open! Jordan Green is 7.4 feet away. [MAN] BONES MORANT MAKES IT!
Score: 60-69

[05:44] Team_002 possession (Score: 60-69)
FOUL! Shooting foul on Bones Morant. Carmelo Lowry to the line for 3 free throws. [BONUS: 6 team fouls] (Bones Morant: 2 personal fouls)   FT 1/3: GOOD   FT 2/3: GOOD   FT 3/3: GOOD Carmelo Lowry makes 3/3 from the line.
Score: 63-69

[05:27] Team_052 possession (Score: 63-69)
Gary Gasol drives, Carmelo Lowry stays with him. Gary Gasol attempts a Dunk. Contested by Carmelo Lowry (3.1 feet, ZONE). GARY GASOL MAKES IT! Assist: Bones Morant
Score: 63-71

[05:15] Team_002 possession (Score: 63-71)
Tyler Porzingis attempts a Layup. Contested by James Paul (3.9 feet, ZONE). TYLER PORZINGIS MAKES IT!
Score: 65-71

[04:59] Team_052 possession (Score: 65-71)
Josh Durant drives, Tyler Porzingis stays with him. Josh Durant attempts a Dunk. Heavily contested by Tyler Porzingis (0.5 feet, ZONE)! JOSH DURANT MAKES IT!
Score: 65-73

[04:46] Team_002 possession (Score: 65-73)
CJ Barrett loses control! Ball rolls out of bounds! TURNOVER! (dead ball)

[04:31] Team_052 possession (Score: 65-73)
Gary Gasol makes the Midrange and draws the foul on Miles Bane! And-1! Gary Gasol to the line for 1. [Team fouls: 2] (Miles Bane: 1 personal fouls)   FT 1/1: MISS Gary Gasol makes 0/1 from the line. Rebound secured by Miles Bane.
Score: 65-75

[04:14] Team_002 possession (Score: 65-75)
Carmelo Lowry attempts a Layup. BLOCKED BY JOSH DURANT! Ball deflects out of bounds off Carmelo Lowry.

[04:00] Team_052 possession (Score: 65-75)
James Paul makes the Layup and draws the foul on Carmelo Lowry! And-1! James Paul to the line for 1. [Team fouls: 3] (Carmelo Lowry: 2 personal fouls)   FT 1/1: GOOD James Paul makes 1/1 from the line.
Score: 65-78

[03:45] Team_002 possession (Score: 65-78)
FOUL! Reach-in foul on Carmelo Middleton during the drive. [IN THE BONUS! 7 team fouls] Tyler Porzingis to the line for 2 free throws. (Carmelo Middleton: 2 personal fouls)   FT 1/2: GOOD   FT 2/2: GOOD Tyler Porzingis makes 2/2 from the line.
Score: 67-78

[03:29] Team_052 possession (Score: 67-78)
Bones Morant drives and kicks out. Josh Durant attempts a 3Pt. Contested by CJ Barrett (4.1 feet, ZONE). Josh Durant misses. Offensive rebound by James Paul! James Paul's putback is no good. Rebound secured by Miles Bane.

[03:16] Team_002 possession (Score: 67-78)
Jordan Green drives and kicks out. CJ Barrett attempts a 3Pt. Contested by Josh Durant (3.3 feet, MAN). CJ Barrett misses. Rebound secured by Carmelo Middleton.

[03:03] Team_052 possession (Score: 67-78)
Josh Durant attempts a Midrange. Wide open! CJ Barrett is 7.9 feet away. [MAN] Josh Durant misses. Rebound secured by Carmelo Lowry.

[02:44] Team_002 possession (Score: 67-78)
CJ Barrett attempts a 3Pt. Contested by Gary Gasol (5.8 feet, ZONE). CJ Barrett misses. Rebound secured by James Paul.

[02:26] Team_052 possession (Score: 67-78)
Josh Durant attempts a Layup. BLOCKED BY CJ BARRETT! Ball is loose! Rebound secured by Carmelo Lowry.

[02:13] Team_002 possession (Score: 67-78)
Jordan Green attempts a Midrange. Contested by Bones Morant (4.1 feet, MAN). Jordan Green misses. Offensive rebound by Tyler Porzingis! Tyler Porzingis's putback is no good. Rebound secured by Carmelo Middleton.

[02:03] Team_052 possession (Score: 67-78)
FOUL! Shooting foul on CJ Barrett. Carmelo Middleton to the line for 2 free throws. [Team fouls: 4] (CJ Barrett: 1 personal fouls)   FT 1/2: GOOD   FT 2/2: MISS Carmelo Middleton makes 1/2 from the line. Rebound secured by Carmelo Lowry.
Score: 67-79

[01:49] Team_002 possession (Score: 67-79)
Jordan Green drives to the basket... Jordan Green loses the ball! Stripped by Bones Morant! TURNOVER! (live ball)

[01:34] Team_052 possession (Score: 67-79)
Josh Durant attempts a Layup. Heavily contested by CJ Barrett (1.3 feet, MAN)! JOSH DURANT MAKES IT! Assist: James Paul
Score: 67-81

[01:19] Team_002 possession (Score: 67-81)
Tyler Porzingis attempts a Layup. Wide open! Carmelo Middleton is 6.6 feet away. [MAN] Tyler Porzingis misses. Rebound secured by Carmelo Middleton.

[01:07] Team_052 possession (Score: 67-81)
James Paul throws a bad pass out of bounds! TURNOVER! (dead ball)

[01:07] Substitution (Team_002): Miles Bane OUT → John Duncan IN (stamina_rule2)

[01:07] Substitution (Team_002): CJ Barrett OUT → Dirk Middleton IN (stamina_rule2)

[01:07] Substitution (Team_002): Jordan Green OUT → Anfernee Sexton IN (stamina_rule2)

[01:07] Substitution (Team_002): Carmelo Lowry OUT → Julius Curry IN (stamina_rule2)

[01:07] Substitution (Team_002): Tyler Porzingis OUT → Lamelo O'Neal IN (stamina_rule2)

[01:07] Substitution (Team_052): Gary Gasol OUT → Jimmy Doncic IN (stamina_rule2)

[01:07] Substitution (Team_052): Josh Durant OUT → Carmelo Giddey IN (stamina_rule2)

[01:07] Substitution (Team_052): Bones Morant OUT → Donovan Stewart IN (stamina_rule2)

[01:07] Substitution (Team_052): James Paul OUT → Jalen Haliburton IN (stamina_rule2)

[01:07] Substitution (Team_052): Carmelo Middleton OUT → Carmelo Beal IN (stamina_rule2)

[00:53] Team_002 possession (Score: 67-81)
Lamelo O'Neal drives, Carmelo Beal stays with him. Lamelo O'Neal attempts a Dunk. Contested by Carmelo Beal (2.3 feet, MAN). Lamelo O'Neal misses. Rebound secured by Donovan Stewart.

[00:36] Team_052 possession (Score: 67-81)
FOUL! Shooting foul on John Duncan. Jalen Haliburton to the line for 2 free throws. [BONUS: 5 team fouls] (John Duncan: 1 personal fouls)   FT 1/2: GOOD   FT 2/2: GOOD Jalen Haliburton makes 2/2 from the line.
Score: 67-83

[00:22] Team_002 possession (Score: 67-83)
John Duncan attempts a 3Pt. Contested by Jalen Haliburton (5.5 feet, ZONE). John Duncan misses. Offensive rebound by Lamelo O'Neal! Lamelo O'Neal puts it back in!
Score: 69-83

[00:09] Team_052 possession (Score: 69-83)
Carmelo Giddey drives, Dirk Middleton stays with him. Carmelo Giddey attempts a Layup. Contested by Dirk Middleton (3.0 feet, MAN). Carmelo Giddey misses. Rebound secured by Lamelo O'Neal.

================================================================================
                              3RD QUARTER COMPLETE                              
================================================================================

3RD QUARTER SCORE: Team_002 21, Team_052 28

BOX SCORE:
================================================================================

Team_002
--------------------------------------------------------------------------------
Player                MIN  PTS  REB  AST  TO      FG   FG%      3P   3P%
--------------------------------------------------------------------------------
Carmelo Lowry          25    8    5    0   0   3/4    75.0     0/0   0.0
Tyler Porzingis        25    6    2    0   0   3/6    50.0     0/0   0.0
CJ Barrett             25    3    0    0   0   1/3    33.3     0/0   0.0
Lamelo O'Neal          12    2    2    0   0   1/2    50.0     0/0   0.0
Jordan Green           25    0    0    1   0   0/6     0.0     0/0   0.0

TEAM: FG: 8/22 (36.4%), 3PT: 3/7 (42.9%), REB: 9 (2 off, 7 def), AST: 3, TO: 2
TEAM FOULS: 5 [Team_052 in BONUS]


Team_052
--------------------------------------------------------------------------------
Player                MIN  PTS  REB  AST  TO      FG   FG%      3P   3P%
--------------------------------------------------------------------------------
Josh Durant            25    9    0    0   0   4/6    66.7     0/0   0.0
James Paul             25    5    5    2   0   2/3    66.7     0/0   0.0
Bones Morant           25    5    3    2   0   2/3    66.7     0/0   0.0
Carmelo Middleton      25    2    4    0   0   1/3    33.3     0/0   0.0
Gary Gasol             25    2    0    0   0   1/4    25.0     0/0   0.0
Jalen Haliburton       11    2    0    0   0   1/1   100.0     0/0   0.0
Miles Bane             25    0    2    2   0   0/1     0.0     0/0   0.0
Donovan Stewart        11    0    1    0   0   0/0     0.0     0/0   0.0
Carmelo Giddey         11    0    0    0   0   0/1     0.0     0/0   0.0

TEAM: FG: 11/21 (52.4%), 3PT: 1/3 (33.3%), REB: 15 (3 off, 12 def), AST: 4, TO: 3
TEAM FOULS: 7 [Team_002 in BONUS]

================================================================================

================================================================================
                       4TH QUARTER - Team_002 vs Team_052                       
================================================================================

[12:00] Substitution (Team_002): Miles Bane OUT (stamina: 75) → John Duncan IN (comeback_detected)

[12:00] Substitution (Team_052): Gary Gasol OUT (stamina: 75) → Jimmy Doncic IN (comeback_detected)

[12:00] Team_002 possession (Score: 69-83)
John Duncan attempts a 3Pt. Wide open! Josh Durant is 8.2 feet away. [ZONE] John Duncan misses. Rebound secured by Carmelo Middleton.

[11:43] Team_052 possession (Score: 69-83)
Josh Durant attempts a 3Pt. Contested by CJ Barrett (5.9 feet, MAN). JOSH DURANT MAKES IT! Assist: James Paul
Score: 69-86

[11:26] Team_002 possession (Score: 69-86)
CJ Barrett attempts a 3Pt. Heavily contested by Josh Durant (1.7 feet, MAN)! CJ Barrett misses. Rebound secured by Bones Morant.

[11:10] Team_052 possession (Score: 69-86)
Jimmy Doncic drives, John Duncan stays with him. Jimmy Doncic attempts a Layup. Contested by John Duncan (4.5 feet, MAN). JIMMY DONCIC MAKES IT! Assist: Bones Morant
Score: 69-88

[10:56] Team_002 possession (Score: 69-88)
Tyler Porzingis drives, James Paul stays with him. Tyler Porzingis attempts a Dunk. Contested by James Paul (4.3 feet, ZONE). TYLER PORZINGIS MAKES IT!
Score: 71-88

[10:42] Team_052 possession (Score: 71-88)
Carmelo Middleton makes the Midrange and draws the foul on Tyler Porzingis! And-1! Carmelo Middleton to the line for 1. [Team fouls: 1] (Tyler Porzingis: 1 personal fouls)   FT 1/1: GOOD Carmelo Middleton makes 1/1 from the line.
Score: 71-91

[10:28] Team_002 possession (Score: 71-91)
Tyler Porzingis drives, Carmelo Middleton stays with him. Tyler Porzingis attempts a Dunk. Contested by Carmelo Middleton (4.8 feet, MAN). TYLER PORZINGIS MAKES IT!
Score: 73-91

[10:13] Team_052 possession (Score: 73-91)
Carmelo Middleton makes the Dunk and draws the foul on Tyler Porzingis! And-1! Carmelo Middleton to the line for 1. [Team fouls: 2] (Tyler Porzingis: 2 personal fouls)   FT 1/1: MISS Carmelo Middleton makes 0/1 from the line. Rebound secured by CJ Barrett.
Score: 73-93

[09:55] Team_002 possession (Score: 73-93)
John Duncan loses the ball! Stripped by Jimmy Doncic! TURNOVER! (live ball)

[09:37] Team_052 possession (Score: 73-93)
James Paul attempts a 3Pt. Contested by John Duncan (5.6 feet, ZONE). JAMES PAUL MAKES IT! Assist: Carmelo Middleton
Score: 73-96

[09:20] Team_002 possession (Score: 73-96)
Jordan Green drives, Bones Morant stays with him. Jordan Green attempts a Layup. Wide open! Bones Morant is 6.1 feet away. [MAN] JORDAN GREEN MAKES IT! Assist: Carmelo Lowry
Score: 75-96

[09:05] Team_052 possession (Score: 75-96)
FOUL! Offensive foul on Josh Durant! CJ Barrett drew the charge! [Team fouls: 1] (Josh Durant: 1 personal fouls) TURNOVER! (dead ball)

[08:50] Team_002 possession (Score: 75-96)
FOUL! Shooting foul on James Paul. Carmelo Lowry to the line for 2 free throws. [Team fouls: 2] (James Paul: 1 personal fouls)   FT 1/2: GOOD   FT 2/2: GOOD Carmelo Lowry makes 2/2 from the line.
Score: 77-96

[08:34] Team_052 possession (Score: 77-96)
Jimmy Doncic drives and kicks out. Josh Durant attempts a 3Pt. Contested by CJ Barrett (3.7 feet, MAN). Josh Durant misses. Rebound secured by Carmelo Lowry.

[08:17] Team_002 possession (Score: 77-96)
John Duncan attempts a Midrange. Wide open! Jimmy Doncic is 7.6 feet away. [MAN] JOHN DUNCAN MAKES IT!
Score: 79-96

[08:01] Team_052 possession (Score: 79-96)
Carmelo Middleton attempts a Midrange. Contested by Tyler Porzingis (3.8 feet, MAN). Carmelo Middleton misses. Rebound secured by Tyler Porzingis.

[07:48] Team_002 possession (Score: 79-96)
John Duncan attempts a Midrange. Contested by Jimmy Doncic (4.5 feet, MAN). John Duncan misses. Rebound secured by James Paul.

[07:31] Team_052 possession (Score: 79-96)
Carmelo Middleton attempts a 3Pt. Wide open! CJ Barrett is 8.0 feet away. [ZONE] Carmelo Middleton misses. Offensive rebound by Bones Morant! Bones Morant kicks it out.

[07:16] Team_052 possession (Score: 79-96)
Jimmy Doncic drives, Tyler Porzingis stays with him. Jimmy Doncic attempts a Dunk. Heavily contested by Tyler Porzingis (0.5 feet, ZONE)! JIMMY DONCIC MAKES IT!
Score: 79-98

[07:00] Team_002 possession (Score: 79-98)
John Duncan attempts a 3Pt. Contested by Bones Morant (4.0 feet, ZONE). John Duncan misses. Rebound secured by James Paul.

[06:43] Team_052 possession (Score: 79-98)
Carmelo Middleton drives, picks up Tyler Porzingis. Help arrives from CJ Barrett! Carmelo Middleton attempts a Layup. Wide open! CJ Barrett is 6.7 feet away. [ZONE] CARMELO MIDDLETON MAKES IT!
Score: 79-100

[06:27] Team_002 possession (Score: 79-100)
Carmelo Lowry attempts a Midrange. Contested by Josh Durant (2.4 feet, ZONE). CARMELO LOWRY MAKES IT! Assist: CJ Barrett
Score: 81-100

[06:16] Team_052 possession (Score: 81-100)
James Paul attempts a Layup. Contested by Tyler Porzingis (4.4 feet, ZONE). JAMES PAUL MAKES IT! Assist: Bones Morant
Score: 81-102

[06:04] Team_002 possession (Score: 81-102)
John Duncan attempts a 3Pt. Wide open! Jimmy Doncic is 9.1 feet away. [MAN] JOHN DUNCAN MAKES IT!
Score: 84-102

[05:50] Team_052 possession (Score: 84-102)
Josh Durant attempts a 3Pt. Contested by CJ Barrett (2.2 feet, ZONE). Josh Durant misses. Rebound secured by Carmelo Lowry.

[05:39] Team_002 possession (Score: 84-102)
Jordan Green drives, picks up James Paul. Help arrives from Josh Durant! Jordan Green attempts a Layup. Heavily contested by Josh Durant (1.9 feet, ZONE)! Jordan Green misses. Offensive rebound by Tyler Porzingis! Tyler Porzingis puts it back in!
Score: 86-102

[05:26] Team_052 possession (Score: 86-102)
Jimmy Doncic attempts a Layup. Contested by John Duncan (5.6 feet, MAN). JIMMY DONCIC MAKES IT!
Score: 86-104

[05:09] Team_002 possession (Score: 86-104)
John Duncan attempts a Midrange. Wide open! Jimmy Doncic is 6.6 feet away. [MAN] JOHN DUNCAN MAKES IT! Assist: CJ Barrett
Score: 88-104

[04:59] Team_052 possession (Score: 88-104)
FOUL! Holding foul on Carmelo Lowry. [Team fouls: 3] No free throws, side out. (Carmelo Lowry: 1 personal fouls)

[04:42] Team_052 possession (Score: 88-104)
Josh Durant drives and kicks out. Jimmy Doncic attempts a 3Pt. Wide open! John Duncan is 7.5 feet away. [MAN] JIMMY DONCIC MAKES IT! Assist: Bones Morant
Score: 88-107

[04:27] Team_002 possession (Score: 88-107)
Jordan Green commits a violation (traveling/carry)! TURNOVER! (dead ball)

[04:27] Substitution (Team_002): CJ Barrett OUT → Dirk Middleton IN (stamina_rule2)

[04:27] Substitution (Team_002): Jordan Green OUT → Anfernee Sexton IN (stamina_rule2)

[04:27] Substitution (Team_002): Carmelo Lowry OUT → Julius Curry IN (stamina_rule2)

[04:27] Substitution (Team_002): Tyler Porzingis OUT → Lamelo O'Neal IN (stamina_rule2)

[04:27] Substitution (Team_052): Josh Durant OUT → Carmelo Giddey IN (stamina_rule2)

[04:27] Substitution (Team_052): Bones Morant OUT → Donovan Stewart IN (stamina_rule2)

[04:27] Substitution (Team_052): James Paul OUT → Jalen Haliburton IN (stamina_rule2)

[04:27] Substitution (Team_052): Carmelo Middleton OUT → Carmelo Beal IN (stamina_rule2)

[04:13] Team_052 possession (Score: 88-107)
Carmelo Beal attempts a Midrange. Contested by Lamelo O'Neal (5.7 feet, MAN). Carmelo Beal misses. Rebound secured by Julius Curry.

[03:58] Team_002 possession (Score: 88-107)
Anfernee Sexton attempts a Midrange. Wide open! Donovan Stewart is 9.7 feet away. [ZONE] Anfernee Sexton misses. Rebound secured by Donovan Stewart.

[03:38] Team_052 possession (Score: 88-107)
Donovan Stewart drives to the basket... FOUL! Offensive foul on Donovan Stewart! Anfernee Sexton drew the charge! [Team fouls: 3] (Donovan Stewart: 1 personal fouls) TURNOVER! (dead ball)

[03:18] Team_002 possession (Score: 88-107)
Lamelo O'Neal drives to the basket... Lamelo O'Neal loses control! Ball rolls out of bounds! TURNOVER! (dead ball)

[03:04] Team_052 possession (Score: 88-107)
Carmelo Giddey drives, Dirk Middleton stays with him. Carmelo Giddey attempts a Layup. Heavily contested by Dirk Middleton (1.6 feet, MAN)! CARMELO GIDDEY MAKES IT! Assist: Jalen Haliburton
Score: 88-109

[02:47] Team_002 possession (Score: 88-109)
Julius Curry attempts a 3Pt. Heavily contested by Jalen Haliburton (0.5 feet, ZONE)! Julius Curry misses. Offensive rebound by Anfernee Sexton! Anfernee Sexton kicks it out.

[02:36] Team_002 possession (Score: 88-109)
FOUL! Holding foul on Carmelo Beal. [Team fouls: 4] No free throws, side out. (Carmelo Beal: 1 personal fouls)

[02:23] Team_002 possession (Score: 88-109)
Dirk Middleton attempts a Midrange. Wide open! Carmelo Giddey is 6.1 feet away. [MAN] Dirk Middleton misses. FOUL! Loose ball foul on Donovan Stewart during the rebound battle. [IN THE BONUS! 5 team fouls] Lamelo O'Neal to the line for 2 free throws. (Donovan Stewart: 2 personal fouls)   FT 1/2: MISS   FT 2/2: GOOD Lamelo O'Neal makes 1/2 from the line.
Score: 89-109

[02:10] Team_052 possession (Score: 89-109)
Donovan Stewart attempts a 3Pt. Wide open! Anfernee Sexton is 6.0 feet away. [MAN] Donovan Stewart misses. Rebound secured by Anfernee Sexton.

[01:56] Team_002 possession (Score: 89-109)
Dirk Middleton attempts a 3Pt. Contested by Carmelo Giddey (4.9 feet, MAN). DIRK MIDDLETON MAKES IT! Assist: Anfernee Sexton
Score: 92-109

[01:42] Team_052 possession (Score: 92-109)
Carmelo Giddey attempts a 3Pt. Contested by Dirk Middleton (4.3 feet, MAN). CARMELO GIDDEY MAKES IT!
Score: 92-112

[01:26] Team_002 possession (Score: 92-112)
Julius Curry attempts a 3Pt. Wide open! Jalen Haliburton is 6.1 feet away. [ZONE] JULIUS CURRY MAKES IT! Assist: John Duncan
Score: 95-112

[01:12] Team_052 possession (Score: 95-112)
Carmelo Giddey loses the ball! Stripped by Dirk Middleton! TURNOVER! (live ball)

[00:58] Team_002 possession (Score: 95-112)
Julius Curry drives to the basket... Julius Curry throws a bad pass! Stolen by Jalen Haliburton! TURNOVER! (live ball)

[00:41] Team_052 possession (Score: 95-112)
Carmelo Beal drives and kicks out. Donovan Stewart attempts a 3Pt. Contested by Julius Curry (4.3 feet, ZONE). Donovan Stewart misses. Rebound secured by Lamelo O'Neal.

[00:26] Team_002 possession (Score: 95-112)
Anfernee Sexton attempts a Midrange. Wide open! Donovan Stewart is 7.5 feet away. [MAN] Anfernee Sexton misses. Rebound secured by Jalen Haliburton.

[00:15] Team_052 possession (Score: 95-112)
FOUL! Reach-in foul on Julius Curry during the drive. [Team fouls: 4] No free throws, side out. (Julius Curry: 1 personal fouls)

[00:06] Team_052 possession (Score: 95-112)
Carmelo Giddey attempts a Midrange. Contested by Anfernee Sexton (2.7 feet, ZONE). CARMELO GIDDEY MAKES IT! Assist: Jalen Haliburton
Score: 95-114

================================================================================
                              4TH QUARTER COMPLETE                              
================================================================================

4TH QUARTER SCORE: Team_002 26, Team_052 31

BOX SCORE:
================================================================================

Team_002
--------------------------------------------------------------------------------
Player                MIN  PTS  REB  AST  TO      FG   FG%      3P   3P%
--------------------------------------------------------------------------------
John Duncan            23    7    0    1   0   3/6    50.0     0/0   0.0
Tyler Porzingis        32    6    2    0   0   3/3   100.0     0/0   0.0
Carmelo Lowry          32    4    2    1   0   2/2   100.0     0/0   0.0
Julius Curry           16    3    1    0   0   1/1   100.0     0/0   0.0
Dirk Middleton         16    3    0    0   0   1/1   100.0     0/0   0.0
Jordan Green           33    2    0    0   0   1/1   100.0     0/0   0.0
Lamelo O'Neal          16    1    1    0   0   1/1   100.0     0/0   0.0
CJ Barrett             33    0    1    2   0   0/1     0.0     0/0   0.0
Anfernee Sexton        16    0    2    1   0   0/2     0.0     0/0   0.0

TEAM: FG: 12/18 (66.7%), 3PT: 3/6 (50.0%), REB: 9 (2 off, 7 def), AST: 5, TO: 4
TEAM FOULS: 4


Team_052
--------------------------------------------------------------------------------
Player                MIN  PTS  REB  AST  TO      FG   FG%      3P   3P%
--------------------------------------------------------------------------------
Jimmy Doncic           23    9    0    0   0   4/5    80.0     0/0   0.0
Carmelo Giddey         16    7    0    0   0   3/3   100.0     0/0   0.0
Carmelo Middleton      32    5    1    1   0   2/4    50.0     0/0   0.0
James Paul             33    5    2    1   0   2/2   100.0     0/0   0.0
Josh Durant            33    3    0    0   0   1/2    50.0     0/0   0.0
Bones Morant           33    0    2    3   0   0/0     0.0     0/0   0.0
Carmelo Beal           16    0    0    0   0   0/2     0.0     0/0   0.0
Donovan Stewart        16    0    1    0   0   0/1     0.0     0/0   0.0
Jalen Haliburton       16    0    1    2   0   0/0     0.0     0/0   0.0

TEAM: FG: 12/19 (63.2%), 3PT: 3/5 (60.0%), REB: 7 (1 off, 6 def), AST: 7, TO: 3
TEAM FOULS: 5 [Team_002 in BONUS]

================================================================================

================================================================================
                               FULL GAME COMPLETE                               
================================================================================

FINAL SCORE: Team_002 95, Team_052 114

SCORING BY QUARTER:
--------------------------------------------------------------------------------
Team                     Q1     Q2     Q3     Q4    FINAL
--------------------------------------------------------------------------------
Team_002                 20     28     21     26       95
Team_052                 34     21     28     31      114
--------------------------------------------------------------------------------

FULL GAME BOX SCORE:
================================================================================

Team_002
--------------------------------------------------------------------------------
Player                MIN  PTS  REB  AST  TO      FG   FG%      3P   3P%      FT STL BLK
--------------------------------------------------------------------------------
CJ Barrett             33    8    2    3   3   2/5    40.0   1/3    33.3   0/0     0   1
Jordan Green           33    8    0    2   3   6/14   42.9   1/3    33.3   2/3     0   0
Carmelo Lowry          32   16   10    3   2   6/9    66.7   1/3    33.3   9/9     0   0
Tyler Porzingis        32   14    7    0   3   6/10   60.0   0/1     0.0   4/4     1   0
Miles Bane             25    6    5    2   0   3/6    50.0   0/1     0.0   5/6     0   0
John Duncan            23   12    0    3   2   5/10   50.0   3/6    50.0   3/3     0   0
Julius Curry           16    8    4    0   0   4/8    50.0   1/1   100.0   3/4     0   0
Lamelo O'Neal          16   10    6    0   2   3/4    75.0   0/0     0.0   2/3     3   1
Dirk Middleton         16   11    0    2   0   5/5   100.0   2/2   100.0   0/0     1   0
Anfernee Sexton        16    0    5    1   2   0/3     0.0   0/1     0.0   0/0     0   0

TEAM: FG: 41/75 (54.7%), 3PT: 9/21 (42.9%), REB: 34 (6 off, 28 def), AST: 16, TO: 17


Team_052
--------------------------------------------------------------------------------
Player                MIN  PTS  REB  AST  TO      FG   FG%      3P   3P%      FT STL BLK
--------------------------------------------------------------------------------
Josh Durant            33   19    0    2   1  10/14   71.4   2/3    66.7   1/2     1   1
Bones Morant           33   14    6    6   2   4/6    66.7   0/1     0.0   3/3     2   0
James Paul             33   18   15    5   2   8/11   72.7   1/1   100.0   3/3     1   0
Carmelo Middleton      32   10    9    2   3   4/10   40.0   1/1   100.0   2/4     0   0
Gary Gasol             25    9    0    0   0   4/8    50.0   0/3     0.0   1/2     0   0
Jimmy Doncic           23   12    0    1   0   4/8    50.0   1/3    33.3   0/0     1   0
Carmelo Beal           16    7    2    2   1   3/8    37.5   0/2     0.0   3/4     0   0
Carmelo Giddey         16   12    0    0   2   5/7    71.4   1/2    50.0   1/1     0   0
Donovan Stewart        16    0    5    0   0   0/4     0.0   0/3     0.0   0/0     3   0
Jalen Haliburton       16    2    4    2   2   1/2    50.0   0/0     0.0   3/5     1   1

TEAM: FG: 44/79 (55.7%), 3PT: 6/19 (31.6%), REB: 46 (15 off, 31 def), AST: 20, TO: 13

================================================================================
