================================================================================
                        FULL GAME - Team_046 vs Team_039                        
================================================================================

================================================================================
                       1ST QUARTER - Team_046 vs Team_039                       
================================================================================

[12:00] Team_046 possession (Score: 0-0)
D'Angelo O'Neal attempts a Midrange. Contested by Jrue Bridges (2.8 feet, ZONE). D'Angelo O'Neal misses. Rebound secured by Klay Wade.

[11:49] Team_039 possession (Score: 0-0)
Austin O'Neal attempts a Layup. Heavily contested by Lauri Carter (0.5 feet, MAN)! AUSTIN O'NEAL MAKES IT!
Score: 0-2

[11:32] Team_046 possession (Score: 0-2)
D'Angelo O'Neal loses the ball! Stripped by Jrue Bridges! TURNOVER! (live ball)

[11:16] Team_039 possession (Score: 0-2)
Jrue Bridges attempts a Midrange. Contested by Cade Wall (4.1 feet, ZONE). JRUE BRIDGES MAKES IT!
Score: 0-4

[11:02] Team_046 possession (Score: 0-4)
Kevin Allen drives, picks up Klay Wade. Help arrives from Donovan Markkanen! Kevin Allen attempts a Dunk. Contested by Donovan Markkanen (3.4 feet, ZONE). Kevin Allen misses. Rebound secured by Donovan Markkanen.

[10:46] Team_039 possession (Score: 0-4)
Jrue Bridges drives and kicks out. Jrue Bridges attempts a 3Pt. Contested by D'Angelo O'Neal (5.9 feet, MAN). Jrue Bridges misses. Rebound secured by Cade Wall.

[10:29] Team_046 possession (Score: 0-4)
D'Angelo O'Neal attempts a 3Pt. Contested by Jrue Bridges (5.6 feet, ZONE). D'Angelo O'Neal misses. Rebound secured by Austin O'Neal.

[10:16] Team_039 possession (Score: 0-4)
Jrue Bridges attempts a 3Pt. Contested by D'Angelo O'Neal (3.0 feet, MAN). Jrue Bridges misses. Rebound secured by Lauri Carter.

[10:01] Team_046 possession (Score: 0-4)
Cade Wall attempts a 3Pt. Wide open! Klay Wade is 8.8 feet away. [MAN] CADE WALL MAKES IT!
Score: 3-4

[09:47] Team_039 possession (Score: 3-4)
Austin O'Neal attempts a Midrange. Contested by Lauri Carter (5.4 feet, MAN). AUSTIN O'NEAL MAKES IT!
Score: 3-6

[09:31] Team_046 possession (Score: 3-6)
Victor Nowitzki attempts a 3Pt. Contested by Jrue Bridges (3.3 feet, ZONE). Victor Nowitzki misses. Rebound secured by Austin O'Neal.

[09:15] Team_039 possession (Score: 3-6)
FOUL! Holding foul on Victor Nowitzki. [Team fouls: 1] No free throws, side out. (Victor Nowitzki: 1 personal fouls)

[08:57] Team_039 possession (Score: 3-6)
Austin O'Neal loses control! Ball rolls out of bounds! TURNOVER! (dead ball)

[08:42] Team_046 possession (Score: 3-6)
Victor Nowitzki attempts a 3Pt. Contested by Jrue Bridges (3.5 feet, ZONE). Victor Nowitzki misses. Offensive rebound by Kevin Allen! Kevin Allen kicks it out.

[08:32] Team_046 possession (Score: 3-6)
Victor Nowitzki attempts a 3Pt. Heavily contested by Jrue Bridges (1.8 feet, ZONE)! Victor Nowitzki misses. Rebound secured by Klay Wade.

[08:19] Team_039 possession (Score: 3-6)
Donovan Markkanen attempts a Midrange. Wide open! Victor Nowitzki is 6.3 feet away. [MAN] Donovan Markkanen misses. Rebound secured by Kevin Allen.

[08:05] Team_046 possession (Score: 3-6)
D'Angelo O'Neal loses the ball! Stripped by Jrue Bridges! TURNOVER! (live ball)

[07:49] Team_039 possession (Score: 3-6)
FOUL! Holding foul on Cade Wall. [Team fouls: 2] No free throws, side out. (Cade Wall: 1 personal fouls)

[07:33] Team_039 possession (Score: 3-6)
Anfernee Carter drives, Kevin Allen stays with him. Anfernee Carter attempts a Dunk. Contested by Kevin Allen (4.7 feet, ZONE). ANFERNEE CARTER MAKES IT!
Score: 3-8

[07:17] Team_046 possession (Score: 3-8)
D'Angelo O'Neal drives, Jrue Bridges stays with him. D'Angelo O'Neal attempts a Layup. Contested by Jrue Bridges (2.4 feet, MAN). D'ANGELO O'NEAL MAKES IT!
Score: 5-8

[07:03] Team_039 possession (Score: 5-8)
Jrue Bridges drives, D'Angelo O'Neal stays with him. Jrue Bridges attempts a Dunk. Contested by D'Angelo O'Neal (4.7 feet, MAN). JRUE BRIDGES MAKES IT! Assist: Anfernee Carter
Score: 5-10

[06:51] Team_046 possession (Score: 5-10)
Victor Nowitzki attempts a Layup. Wide open! Klay Wade is 7.7 feet away. [ZONE] Victor Nowitzki misses. FOUL! Loose ball foul on Klay Wade during the rebound battle. [Team fouls: 1] No free throws, side out. (Klay Wade: 1 personal fouls)

[06:36] Team_046 possession (Score: 5-10)
Lauri Carter throws a bad pass! Stolen by Austin O'Neal! TURNOVER! (live ball)

[06:18] Team_039 possession (Score: 5-10)
Donovan Markkanen attempts a 3Pt. Contested by Victor Nowitzki (4.8 feet, MAN). Donovan Markkanen misses. Rebound secured by Cade Wall.

[06:00] Team_046 possession (Score: 5-10)
D'Angelo O'Neal attempts a 3Pt. Contested by Jrue Bridges (2.4 feet, MAN). D'Angelo O'Neal misses. Rebound secured by Austin O'Neal.

[05:46] Team_039 possession (Score: 5-10)
Donovan Markkanen attempts a Midrange. Contested by Victor Nowitzki (5.8 feet, ZONE). DONOVAN MARKKANEN MAKES IT!
Score: 5-12

[05:32] Team_046 possession (Score: 5-12)
Victor Nowitzki drives and kicks out. Kevin Allen attempts a 3Pt. Contested by Klay Wade (5.3 feet, MAN). Kevin Allen misses. Rebound secured by Klay Wade.

[05:15] Team_039 possession (Score: 5-12)
Anfernee Carter drives to the basket... Anfernee Carter loses the ball! Stripped by Cade Wall! TURNOVER! (live ball)

[05:02] Team_046 possession (Score: 5-12)
Cade Wall attempts a Layup. Contested by Klay Wade (5.5 feet, MAN). Cade Wall misses. Rebound secured by Austin O'Neal.

[04:50] Team_039 possession (Score: 5-12)
Klay Wade attempts a 3Pt. Contested by Lauri Carter (6.0 feet, ZONE). KLAY WADE MAKES IT! Assist: Jrue Bridges
Score: 5-15

[04:37] Team_046 possession (Score: 5-15)
Cade Wall drives, picks up Klay Wade. Help arrives from Donovan Markkanen! Cade Wall attempts a Layup. Contested by Donovan Markkanen (3.8 feet, MAN). Cade Wall misses. Rebound secured by Austin O'Neal.

[04:23] Team_039 possession (Score: 5-15)
Jrue Bridges drives, picks up D'Angelo O'Neal. Help arrives from Lauri Carter! Jrue Bridges attempts a Layup. Heavily contested by Lauri Carter (1.4 feet, MAN)! JRUE BRIDGES MAKES IT! Assist: Austin O'Neal
Score: 5-17

[04:08] Team_046 possession (Score: 5-17)
D'Angelo O'Neal drives, picks up Jrue Bridges. Help arrives from Austin O'Neal! D'Angelo O'Neal attempts a Dunk. Contested by Austin O'Neal (2.1 feet, MAN). D'Angelo O'Neal misses. Rebound secured by Austin O'Neal.

[03:53] Team_039 possession (Score: 5-17)
Jrue Bridges makes the Layup and draws the foul on Kevin Allen! And-1! Jrue Bridges to the line for 1. [Team fouls: 3] (Kevin Allen: 1 personal fouls)   FT 1/1: GOOD Jrue Bridges makes 1/1 from the line.
Score: 5-20

[03:37] Team_046 possession (Score: 5-20)
Cade Wall attempts a Midrange. Contested by Klay Wade (5.9 feet, MAN). Cade Wall misses. Rebound secured by Austin O'Neal.

[03:25] Team_039 possession (Score: 5-20)
Anfernee Carter drives to the basket... Anfernee Carter loses the ball! Stripped by Cade Wall! TURNOVER! (live ball)

[03:09] Team_046 possession (Score: 5-20)
Kevin Allen attempts a Layup. BLOCKED BY DONOVAN MARKKANEN! Ball is loose! Rebound secured by Austin O'Neal.

[02:53] Team_039 possession (Score: 5-20)
Donovan Markkanen attempts a 3Pt. Wide open! Victor Nowitzki is 7.3 feet away. [MAN] DONOVAN MARKKANEN MAKES IT! Assist: Austin O'Neal
Score: 5-23

[02:36] Team_046 possession (Score: 5-23)
D'Angelo O'Neal drives, Jrue Bridges stays with him. D'Angelo O'Neal attempts a Dunk. Heavily contested by Jrue Bridges (1.3 feet, MAN)! D'ANGELO O'NEAL MAKES IT! Assist: Kevin Allen
Score: 7-23

[02:18] Team_039 possession (Score: 7-23)
Anfernee Carter attempts a Midrange. Contested by Lauri Carter (2.3 feet, ZONE). Anfernee Carter misses. Offensive rebound by Austin O'Neal! Austin O'Neal kicks it out.

[02:05] Team_039 possession (Score: 7-23)
Klay Wade attempts a Midrange. Contested by Cade Wall (5.2 feet, ZONE). KLAY WADE MAKES IT!
Score: 7-25

[01:47] Team_046 possession (Score: 7-25)
Kevin Allen attempts a Midrange. Wide open! Anfernee Carter is 7.5 feet away. [ZONE] KEVIN ALLEN MAKES IT!
Score: 9-25

[01:34] Team_039 possession (Score: 9-25)
Donovan Markkanen attempts a Midrange. Heavily contested by Lauri Carter (1.3 feet, ZONE)! DONOVAN MARKKANEN MAKES IT!
Score: 9-27

[01:21] Team_046 possession (Score: 9-27)
Cade Wall attempts a 3Pt. Contested by Klay Wade (4.4 feet, MAN). Cade Wall misses. FOUL! Loose ball foul on Austin O'Neal during the rebound battle. [Team fouls: 2] No free throws, side out. (Austin O'Neal: 1 personal fouls)

[01:02] Team_046 possession (Score: 9-27)
Lauri Carter attempts a 3Pt. Contested by Jrue Bridges (4.0 feet, ZONE). LAURI CARTER MAKES IT! Assist: Cade Wall
Score: 12-27

[00:43] Team_039 possession (Score: 12-27)
Austin O'Neal attempts a 3Pt. Contested by Lauri Carter (4.2 feet, MAN). Austin O'Neal misses. Rebound secured by Kevin Allen.

[00:34] Team_046 possession (Score: 12-27)
Kevin Allen attempts a Layup. Contested by Klay Wade (4.7 feet, ZONE). KEVIN ALLEN MAKES IT! Assist: Cade Wall
Score: 14-27

[00:18] Team_039 possession (Score: 14-27)
Jrue Bridges attempts a 3Pt. Heavily contested by Lauri Carter (1.6 feet, ZONE)! Jrue Bridges misses. Offensive rebound by Austin O'Neal! Austin O'Neal kicks it out.

[00:02] Team_039 possession (Score: 14-27)
Anfernee Carter attempts a 3Pt. Contested by Cade Wall (3.7 feet, MAN). Anfernee Carter misses. Offensive rebound by Klay Wade! Klay Wade kicks it out.

================================================================================
                              1ST QUARTER COMPLETE                              
================================================================================

1ST QUARTER SCORE: Team_046 14, Team_039 27

BOX SCORE:
================================================================================

Team_046
--------------------------------------------------------------------------------
Player                MIN  PTS  REB  AST  TO      FG   FG%      3P   3P%
--------------------------------------------------------------------------------
D'Angelo O'Neal        12    4    0    0   0   2/6    33.3     0/0   0.0
Kevin Allen            12    4    4    1   0   2/4    50.0     0/0   0.0
Cade Wall              12    3    2    2   0   1/4    25.0     0/0   0.0
Lauri Carter           12    3    2    0   0   1/1   100.0     0/0   0.0
Victor Nowitzki        12    0    0    0   0   0/3     0.0     0/0   0.0

TEAM: FG: 6/18 (33.3%), 3PT: 2/6 (33.3%), REB: 8 (3 off, 5 def), AST: 3, TO: 3
TEAM FOULS: 3


Team_039
--------------------------------------------------------------------------------
Player                MIN  PTS  REB  AST  TO      FG   FG%      3P   3P%
--------------------------------------------------------------------------------
Jrue Bridges           12    9    0    1   0   4/6    66.7     0/0   0.0
Donovan Markkanen      12    7    1    0   0   3/5    60.0     0/0   0.0
Klay Wade              12    5    4    0   0   2/2   100.0     0/0   0.0
Austin O'Neal          12    4   10    2   0   2/3    66.7     0/0   0.0
Anfernee Carter        12    2    0    1   0   1/1   100.0     0/0   0.0

TEAM: FG: 12/17 (70.6%), 3PT: 2/5 (40.0%), REB: 15 (3 off, 12 def), AST: 4, TO: 3
TEAM FOULS: 2

================================================================================

================================================================================
                       2ND QUARTER - Team_046 vs Team_039                       
================================================================================

[12:00] Substitution (Team_046): D'Angelo O'Neal OUT → Collin Butler IN (stamina_rule2)

[12:00] Substitution (Team_046): Victor Nowitzki OUT → Manu Dosunmu IN (stamina_rule2)

[12:00] Substitution (Team_046): Lauri Carter OUT → Josh Barrett IN (stamina_rule2)

[12:00] Substitution (Team_046): Cade Wall OUT → Chris LaVine IN (stamina_rule2)

[12:00] Substitution (Team_046): Kevin Allen OUT → Paul DeRozan IN (stamina_rule2)

[12:00] Substitution (Team_039): Jrue Bridges OUT → Tracy Mitchell IN (stamina_rule2)

[12:00] Substitution (Team_039): Austin O'Neal OUT → Yao Carter IN (stamina_rule2)

[12:00] Substitution (Team_039): Anfernee Carter OUT → Victor Gasol IN (stamina_rule2)

[12:00] Substitution (Team_039): Klay Wade OUT → Bam Booker IN (stamina_rule2)

[12:00] Team_046 possession (Score: 14-27)
Victor Nowitzki drives to the basket... Victor Nowitzki throws a bad pass out of bounds! TURNOVER! (dead ball)

[11:44] Team_039 possession (Score: 14-27)
Victor Gasol attempts a 3Pt. Contested by Chris LaVine (4.9 feet, MAN). Victor Gasol misses. Rebound secured by Manu Dosunmu.

[11:31] Team_046 possession (Score: 14-27)
FOUL! Shooting foul on Victor Gasol. Josh Barrett to the line for 2 free throws. [Team fouls: 1] (Victor Gasol: 1 personal fouls)   FT 1/2: GOOD   FT 2/2: GOOD Josh Barrett makes 2/2 from the line.
Score: 16-27

[11:15] Team_039 possession (Score: 16-27)
FOUL! Reach-in foul on Collin Butler during the drive. [Team fouls: 1] No free throws, side out. (Collin Butler: 1 personal fouls)

[11:00] Team_039 possession (Score: 16-27)
Donovan Markkanen attempts a Layup. Contested by Manu Dosunmu (4.8 feet, MAN). Donovan Markkanen misses. Offensive rebound by Donovan Markkanen! Donovan Markkanen kicks it out.

[10:44] Team_039 possession (Score: 16-27)
Yao Carter attempts a 3Pt. Contested by Manu Dosunmu (5.6 feet, ZONE). YAO CARTER MAKES IT! Assist: Tracy Mitchell
Score: 16-30

[10:26] Team_046 possession (Score: 16-30)
Manu Dosunmu attempts a 3Pt. Contested by Tracy Mitchell (5.5 feet, ZONE). Manu Dosunmu misses. FOUL! Loose ball foul on Yao Carter during the rebound battle. [Team fouls: 2] No free throws, side out. (Yao Carter: 1 personal fouls)

[10:07] Team_046 possession (Score: 16-30)
FOUL! Holding foul on Tracy Mitchell. [Team fouls: 3] No free throws, side out. (Tracy Mitchell: 1 personal fouls)

[09:50] Team_046 possession (Score: 16-30)
Collin Butler attempts a 3Pt. Contested by Tracy Mitchell (4.7 feet, MAN). COLLIN BUTLER MAKES IT! Assist: Manu Dosunmu
Score: 19-30

[09:37] Team_039 possession (Score: 19-30)
Donovan Markkanen attempts a Layup. Heavily contested by Manu Dosunmu (1.9 feet, MAN)! Donovan Markkanen misses. Rebound secured by Manu Dosunmu.

[09:25] Team_046 possession (Score: 19-30)
Chris LaVine attempts a Layup. Heavily contested by Victor Gasol (0.6 feet, ZONE)! Chris LaVine misses. Rebound secured by Victor Gasol.

[09:11] Team_039 possession (Score: 19-30)
Victor Gasol throws a bad pass out of bounds! TURNOVER! (dead ball)

[09:11] Substitution (Team_039): Donovan Markkanen OUT → Jayson Cunningham IN (stamina_rule2)

[08:58] Team_046 possession (Score: 19-30)
Josh Barrett throws a bad pass out of bounds! TURNOVER! (dead ball)

[08:48] Team_039 possession (Score: 19-30)
Yao Carter attempts a Layup. Contested by Josh Barrett (3.7 feet, MAN). YAO CARTER MAKES IT!
Score: 19-32

[08:34] Team_046 possession (Score: 19-32)
Chris LaVine drives, picks up Bam Booker. Help arrives from Tracy Mitchell! Chris LaVine attempts a Dunk. Contested by Tracy Mitchell (5.9 feet, ZONE). CHRIS LAVINE MAKES IT! Assist: Paul DeRozan
Score: 21-32

[08:20] Team_039 possession (Score: 21-32)
Jayson Cunningham attempts a 3Pt. Contested by Collin Butler (3.8 feet, ZONE). Jayson Cunningham misses. Rebound secured by Chris LaVine.

[08:08] Team_046 possession (Score: 21-32)
Paul DeRozan drives to the basket... Paul DeRozan commits a violation (traveling/carry)! TURNOVER! (dead ball)

[07:58] Team_039 possession (Score: 21-32)
Tracy Mitchell attempts a 3Pt. Contested by Collin Butler (3.7 feet, ZONE). Tracy Mitchell misses. Rebound secured by Chris LaVine.

[07:42] Team_046 possession (Score: 21-32)
Collin Butler attempts a Midrange. Contested by Tracy Mitchell (4.9 feet, MAN). Collin Butler misses. Rebound secured by Victor Gasol.

[07:29] Team_039 possession (Score: 21-32)
Jayson Cunningham attempts a 3Pt. Contested by Chris LaVine (4.7 feet, ZONE). Jayson Cunningham misses. Rebound secured by Paul DeRozan.

[07:13] Team_046 possession (Score: 21-32)
Josh Barrett attempts a 3Pt. Contested by Yao Carter (5.0 feet, MAN). Josh Barrett misses. Rebound secured by Yao Carter.

[06:59] Team_039 possession (Score: 21-32)
Yao Carter attempts a Midrange. Heavily contested by Josh Barrett (1.1 feet, MAN)! Yao Carter misses. Rebound secured by Chris LaVine.

[06:43] Team_046 possession (Score: 21-32)
Josh Barrett attempts a 3Pt. Wide open! Yao Carter is 6.5 feet away. [MAN] Josh Barrett misses. FOUL! Loose ball foul on Yao Carter during the rebound battle. [Team fouls: 4] No free throws, side out. (Yao Carter: 2 personal fouls)

[06:28] Team_046 possession (Score: 21-32)
Collin Butler attempts a 3Pt. Wide open! Tracy Mitchell is 6.3 feet away. [MAN] COLLIN BUTLER MAKES IT! Assist: Paul DeRozan
Score: 24-32

[06:16] Team_039 possession (Score: 24-32)
Yao Carter drives to the basket... Yao Carter throws a bad pass out of bounds! TURNOVER! (dead ball)

[06:01] Team_046 possession (Score: 24-32)
Manu Dosunmu attempts a 3Pt. Wide open! Jayson Cunningham is 8.0 feet away. [MAN] Manu Dosunmu misses. Rebound secured by Yao Carter.

[05:49] Team_039 possession (Score: 24-32)
Jayson Cunningham drives, Manu Dosunmu stays with him. Jayson Cunningham attempts a Layup. Contested by Manu Dosunmu (5.3 feet, MAN). JAYSON CUNNINGHAM MAKES IT! Assist: Bam Booker
Score: 24-34

[05:31] Team_046 possession (Score: 24-34)
Chris LaVine makes the Layup and draws the foul on Victor Gasol! And-1! Chris LaVine to the line for 1. [BONUS: 5 team fouls] (Victor Gasol: 2 personal fouls)   FT 1/1: GOOD Chris LaVine makes 1/1 from the line.
Score: 27-34

[05:17] Team_039 possession (Score: 27-34)
Yao Carter attempts a Layup. Wide open! Josh Barrett is 7.8 feet away. [MAN] YAO CARTER MAKES IT! Assist: Victor Gasol
Score: 27-36

[05:05] Team_046 possession (Score: 27-36)
Collin Butler attempts a 3Pt. Wide open! Tracy Mitchell is 6.8 feet away. [MAN] Collin Butler misses. Offensive rebound by Paul DeRozan! Paul DeRozan puts it back in!
Score: 29-36

[04:49] Team_039 possession (Score: 29-36)
Victor Gasol drives and kicks out. Bam Booker attempts a Midrange. Contested by Chris LaVine (2.5 feet, MAN). Bam Booker misses. Rebound secured by Chris LaVine.

[04:35] Team_046 possession (Score: 29-36)
Chris LaVine makes the Layup and draws the foul on Victor Gasol! And-1! Chris LaVine to the line for 1. [BONUS: 6 team fouls] (Victor Gasol: 3 personal fouls)   FT 1/1: GOOD Chris LaVine makes 1/1 from the line.
Score: 32-36

[04:21] Team_039 possession (Score: 32-36)
Yao Carter drives, Chris LaVine stays with him. Yao Carter attempts a Dunk. Contested by Chris LaVine (5.3 feet, ZONE). Yao Carter misses. Offensive rebound by Yao Carter! Yao Carter kicks it out.

[04:07] Team_039 possession (Score: 32-36)
FOUL! Holding foul on Collin Butler. [Team fouls: 2] No free throws, side out. (Collin Butler: 2 personal fouls)

[03:55] Team_039 possession (Score: 32-36)
Yao Carter attempts a 3Pt. Contested by Collin Butler (2.4 feet, ZONE). YAO CARTER MAKES IT! Assist: Jayson Cunningham
Score: 32-39

[03:37] Team_046 possession (Score: 32-39)
Chris LaVine attempts a 3Pt. Wide open! Tracy Mitchell is 10.0 feet away. [ZONE] Chris LaVine misses. Offensive rebound by Paul DeRozan! Paul DeRozan puts it back in!
Score: 34-39

[03:25] Team_039 possession (Score: 34-39)
Tracy Mitchell attempts a 3Pt. Contested by Collin Butler (5.6 feet, MAN). Tracy Mitchell misses. Rebound secured by Chris LaVine.

[03:12] Team_046 possession (Score: 34-39)
Chris LaVine attempts a Layup. BLOCKED BY VICTOR GASOL! Ball deflects out of bounds off Chris LaVine.

[02:56] Team_039 possession (Score: 34-39)
Yao Carter attempts a 3Pt. Contested by Collin Butler (4.6 feet, ZONE). Yao Carter misses. Offensive rebound by Victor Gasol! Victor Gasol kicks it out.

[02:44] Team_039 possession (Score: 34-39)
Yao Carter makes the 3Pt and draws the foul on Collin Butler! And-1! Yao Carter to the line for 1. [Team fouls: 3] (Collin Butler: 3 personal fouls)   FT 1/1: GOOD Yao Carter makes 1/1 from the line.
Score: 34-43

[02:31] Team_046 possession (Score: 34-43)
Chris LaVine drives to the basket... Chris LaVine throws a bad pass out of bounds! TURNOVER! (dead ball)

[02:13] Team_039 possession (Score: 34-43)
FOUL! Holding foul on Collin Butler. [Team fouls: 4] No free throws, side out. (Collin Butler: 4 personal fouls)

[01:59] Team_039 possession (Score: 34-43)
Tracy Mitchell attempts a Midrange. Contested by Collin Butler (4.9 feet, MAN). TRACY MITCHELL MAKES IT! Assist: Victor Gasol
Score: 34-45

[01:47] Team_046 possession (Score: 34-45)
Chris LaVine attempts a 3Pt. Contested by Victor Gasol (5.0 feet, MAN). Chris LaVine misses. Rebound secured by Yao Carter.

[01:33] Team_039 possession (Score: 34-45)
Jayson Cunningham attempts a 3Pt. Contested by Manu Dosunmu (3.0 feet, MAN). Jayson Cunningham misses. Rebound secured by Paul DeRozan.

[01:17] Team_046 possession (Score: 34-45)
Paul DeRozan attempts a Layup. BLOCKED BY VICTOR GASOL! Ball is loose! Rebound secured by Yao Carter.

[01:08] Team_039 possession (Score: 34-45)
FOUL! Shooting foul on Chris LaVine. Bam Booker to the line for 2 free throws. [BONUS: 5 team fouls] (Chris LaVine: 1 personal fouls)   FT 1/2: MISS   FT 2/2: GOOD Bam Booker makes 1/2 from the line.
Score: 34-46

[00:56] Team_046 possession (Score: 34-46)
Josh Barrett attempts a Layup. BLOCKED BY VICTOR GASOL! Ball is loose! Rebound secured by Yao Carter.

[00:40] Team_039 possession (Score: 34-46)
Tracy Mitchell drives, picks up Chris LaVine. Help arrives from Manu Dosunmu! Tracy Mitchell attempts a Dunk. Contested by Manu Dosunmu (3.4 feet, ZONE). TRACY MITCHELL MAKES IT! Assist: Yao Carter
Score: 34-48

[00:30] Team_046 possession (Score: 34-48)
Paul DeRozan drives, Victor Gasol stays with him. Paul DeRozan attempts a Dunk. Heavily contested by Victor Gasol (0.5 feet, ZONE)! Paul DeRozan misses. Rebound secured by Yao Carter.

[00:15] Team_039 possession (Score: 34-48)
Bam Booker loses control! Ball rolls out of bounds! TURNOVER! (dead ball)

[00:02] Team_046 possession (Score: 34-48)
Josh Barrett loses control! Ball rolls out of bounds! TURNOVER! (dead ball)

================================================================================
                              2ND QUARTER COMPLETE                              
================================================================================

2ND QUARTER SCORE: Team_046 20, Team_039 21

BOX SCORE:
================================================================================

Team_046
--------------------------------------------------------------------------------
Player                MIN  PTS  REB  AST  TO      FG   FG%      3P   3P%
--------------------------------------------------------------------------------
Chris LaVine           12    8    5    0   0   3/6    50.0     0/0   0.0
Collin Butler          12    6    0    0   0   2/3    66.7     0/0   0.0
Paul DeRozan           12    4    6    2   0   2/4    50.0     0/0   0.0
Josh Barrett           12    2    0    0   0   1/3    33.3     0/0   0.0
Manu Dosunmu           12    0    2    1   0   0/1     0.0     0/0   0.0

TEAM: FG: 8/17 (47.1%), 3PT: 4/7 (57.1%), REB: 13 (4 off, 9 def), AST: 3, TO: 5
TEAM FOULS: 5 [Team_039 in BONUS]


Team_039
--------------------------------------------------------------------------------
Player                MIN  PTS  REB  AST  TO      FG   FG%      3P   3P%
--------------------------------------------------------------------------------
Yao Carter             12   14    7    1   0   5/6    83.3     0/0   0.0
Tracy Mitchell         12    4    0    1   0   2/4    50.0     0/0   0.0
Jayson Cunningham       9    2    0    1   0   1/4    25.0     0/0   0.0
Bam Booker             12    1    0    1   0   1/1   100.0     0/0   0.0
Victor Gasol           12    0    3    2   0   0/2     0.0     0/0   0.0
Donovan Markkanen      15    0    1    0   0   0/1     0.0     0/0   0.0

TEAM: FG: 9/18 (50.0%), 3PT: 3/9 (33.3%), REB: 11 (3 off, 8 def), AST: 6, TO: 3
TEAM FOULS: 6 [Team_046 in BONUS]

================================================================================

================================================================================
                       3RD QUARTER - Team_046 vs Team_039                       
================================================================================

[12:00] Team_046 possession (Score: 34-48)
Cade Wall attempts a 3Pt. Contested by Austin O'Neal (3.9 feet, ZONE). CADE WALL MAKES IT! Assist: Victor Nowitzki
Score: 37-48

[11:43] Team_039 possession (Score: 37-48)
Austin O'Neal attempts a Midrange. Wide open! Lauri Carter is 7.5 feet away. [ZONE] AUSTIN O'NEAL MAKES IT!
Score: 37-50

[11:30] Team_046 possession (Score: 37-50)
Cade Wall commits a violation (traveling/carry)! TURNOVER! (dead ball)

[11:20] Team_039 possession (Score: 37-50)
Jrue Bridges attempts a Layup. BLOCKED BY KEVIN ALLEN! Ball is loose! Rebound secured by Cade Wall.

[11:09] Team_046 possession (Score: 37-50)
Cade Wall throws a bad pass! Stolen by Klay Wade! TURNOVER! (live ball)

[10:51] Team_039 possession (Score: 37-50)
Austin O'Neal attempts a 3Pt. Contested by Lauri Carter (4.9 feet, MAN). Austin O'Neal misses. Rebound secured by Lauri Carter.

[10:36] Team_046 possession (Score: 37-50)
Victor Nowitzki attempts a 3Pt. Contested by Jrue Bridges (5.8 feet, ZONE). Victor Nowitzki misses. Offensive rebound by Cade Wall! Cade Wall kicks it out.

[10:21] Team_046 possession (Score: 37-50)
Victor Nowitzki attempts a Midrange. Contested by Donovan Markkanen (4.1 feet, MAN). Victor Nowitzki misses. Offensive rebound by Kevin Allen! Kevin Allen kicks it out.

[10:08] Team_046 possession (Score: 37-50)
Victor Nowitzki loses control! Ball rolls out of bounds! TURNOVER! (dead ball)

[09:54] Team_039 possession (Score: 37-50)
Anfernee Carter attempts a 3Pt. Contested by Cade Wall (2.5 feet, MAN). Anfernee Carter misses. Offensive rebound by Austin O'Neal! Austin O'Neal kicks it out.

[09:36] Team_039 possession (Score: 37-50)
Austin O'Neal attempts a 3Pt. Contested by Lauri Carter (3.9 feet, MAN). Austin O'Neal misses. Rebound secured by Lauri Carter.

[09:25] Team_046 possession (Score: 37-50)
Kevin Allen drives, picks up Klay Wade. Help arrives from Donovan Markkanen! Kevin Allen attempts a Dunk. Contested by Donovan Markkanen (4.3 feet, MAN). Kevin Allen misses. Rebound secured by Klay Wade.

[09:10] Team_039 possession (Score: 37-50)
Donovan Markkanen drives, picks up Victor Nowitzki. Help arrives from Lauri Carter! Donovan Markkanen attempts a Layup. Wide open! Lauri Carter is 8.1 feet away. [MAN] DONOVAN MARKKANEN MAKES IT!
Score: 37-52

[08:55] Team_046 possession (Score: 37-52)
Kevin Allen throws a bad pass out of bounds! TURNOVER! (dead ball)

[08:44] Team_039 possession (Score: 37-52)
Jrue Bridges drives, D'Angelo O'Neal stays with him. Jrue Bridges attempts a Dunk. Contested by D'Angelo O'Neal (3.0 feet, MAN). JRUE BRIDGES MAKES IT! Assist: Klay Wade
Score: 37-54

[08:30] Team_046 possession (Score: 37-54)
Kevin Allen attempts a Layup. Contested by Klay Wade (2.8 feet, MAN). KEVIN ALLEN MAKES IT! Assist: Victor Nowitzki
Score: 39-54

[08:17] Team_039 possession (Score: 39-54)
Klay Wade drives to the basket... Klay Wade commits a violation (traveling/carry)! TURNOVER! (dead ball)

[08:00] Team_046 possession (Score: 39-54)
Cade Wall drives and kicks out. D'Angelo O'Neal attempts a Midrange. Contested by Jrue Bridges (2.9 feet, MAN). D'ANGELO O'NEAL MAKES IT! Assist: Victor Nowitzki
Score: 41-54

[07:44] Team_039 possession (Score: 41-54)
Austin O'Neal drives, Kevin Allen stays with him. Austin O'Neal attempts a Layup. Contested by Kevin Allen (2.0 feet, ZONE). AUSTIN O'NEAL MAKES IT! Assist: Jrue Bridges
Score: 41-56

[07:27] Team_046 possession (Score: 41-56)
Cade Wall drives, Klay Wade stays with him. Cade Wall attempts a Layup. Contested by Klay Wade (4.4 feet, MAN). CADE WALL MAKES IT!
Score: 43-56

[07:14] Team_039 possession (Score: 43-56)
Jrue Bridges attempts a Layup. BLOCKED BY D'ANGELO O'NEAL! Ball goes out off D'Angelo O'Neal. Jrue Bridges's ball!

[06:58] Team_039 possession (Score: 43-56)
Donovan Markkanen attempts a Midrange. Contested by Victor Nowitzki (2.8 feet, MAN). Donovan Markkanen misses. Rebound secured by Lauri Carter.

[06:45] Team_046 possession (Score: 43-56)
Lauri Carter attempts a 3Pt. Contested by Austin O'Neal (2.9 feet, MAN). LAURI CARTER MAKES IT! Assist: Kevin Allen
Score: 46-56

[06:29] Team_039 possession (Score: 46-56)
Anfernee Carter attempts a 3Pt. Contested by Lauri Carter (3.0 feet, ZONE). Anfernee Carter misses. Offensive rebound by Klay Wade! Klay Wade kicks it out.

[06:12] Team_039 possession (Score: 46-56)
Klay Wade attempts a Dunk. BLOCKED BY KEVIN ALLEN! Ball is loose! Rebound secured by Kevin Allen.

[05:58] Team_046 possession (Score: 46-56)
Kevin Allen loses the ball! Stripped by Klay Wade! TURNOVER! (live ball)

[05:46] Team_039 possession (Score: 46-56)
Austin O'Neal attempts a Midrange. Wide open! Victor Nowitzki is 6.9 feet away. [ZONE] Austin O'Neal misses. Rebound secured by Kevin Allen.

[05:29] Team_046 possession (Score: 46-56)
Lauri Carter attempts a 3Pt. Contested by Austin O'Neal (3.0 feet, MAN). Lauri Carter misses. Offensive rebound by Kevin Allen! Kevin Allen kicks it out.

[05:16] Team_046 possession (Score: 46-56)
Cade Wall drives to the basket... FOUL! Offensive foul on Cade Wall! Klay Wade drew the charge! [Team fouls: 1] (Cade Wall: 1 personal fouls) TURNOVER! (dead ball)

[04:59] Team_039 possession (Score: 46-56)
FOUL! Holding foul on Victor Nowitzki. [Team fouls: 2] No free throws, side out. (Victor Nowitzki: 1 personal fouls)

[04:46] Team_039 possession (Score: 46-56)
FOUL! Offensive foul on Anfernee Carter! Cade Wall drew the charge! [Team fouls: 1] (Anfernee Carter: 1 personal fouls) TURNOVER! (dead ball)

[04:32] Team_046 possession (Score: 46-56)
D'Angelo O'Neal attempts a Midrange. Contested by Jrue Bridges (4.8 feet, MAN). D'ANGELO O'NEAL MAKES IT!
Score: 48-56

[04:19] Team_039 possession (Score: 48-56)
Austin O'Neal attempts a Midrange. Contested by Lauri Carter (5.0 feet, MAN). AUSTIN O'NEAL MAKES IT!
Score: 48-58

[04:01] Team_046 possession (Score: 48-58)
D'Angelo O'Neal attempts a 3Pt. Contested by Jrue Bridges (3.8 feet, MAN). D'Angelo O'Neal misses. Rebound secured by Klay Wade.

[03:47] Team_039 possession (Score: 48-58)
Donovan Markkanen drives, Victor Nowitzki stays with him. Donovan Markkanen attempts a Layup. Wide open! Victor Nowitzki is 6.1 feet away. [MAN] DONOVAN MARKKANEN MAKES IT! Assist: Jrue Bridges
Score: 48-60

[03:32] Team_046 possession (Score: 48-60)
D'Angelo O'Neal attempts a 3Pt. Contested by Jrue Bridges (2.1 feet, MAN). D'Angelo O'Neal misses. Offensive rebound by Cade Wall! Cade Wall kicks it out.

[03:16] Team_046 possession (Score: 48-60)
Cade Wall attempts a 3Pt. Wide open! Anfernee Carter is 6.5 feet away. [ZONE] CADE WALL MAKES IT! Assist: Lauri Carter
Score: 51-60

[03:01] Team_039 possession (Score: 51-60)
Anfernee Carter attempts a 3Pt. Contested by Cade Wall (2.5 feet, MAN). Anfernee Carter misses. Rebound secured by Cade Wall.

[02:48] Team_046 possession (Score: 51-60)
FOUL! Shooting foul on Klay Wade. Cade Wall to the line for 3 free throws. [Team fouls: 2] (Klay Wade: 1 personal fouls)   FT 1/3: GOOD   FT 2/3: GOOD   FT 3/3: GOOD Cade Wall makes 3/3 from the line.
Score: 54-60

[02:36] Team_039 possession (Score: 54-60)
FOUL! Reach-in foul on Kevin Allen during the drive. [Team fouls: 3] No free throws, side out. (Kevin Allen: 1 personal fouls)

[02:18] Team_039 possession (Score: 54-60)
FOUL! Reach-in foul on Kevin Allen during the drive. [Team fouls: 4] No free throws, side out. (Kevin Allen: 2 personal fouls)

[01:59] Team_039 possession (Score: 54-60)
Austin O'Neal throws a bad pass! Stolen by Lauri Carter! TURNOVER! (live ball)

[01:45] Team_046 possession (Score: 54-60)
FOUL! Shooting foul on Austin O'Neal. Victor Nowitzki to the line for 2 free throws. [Team fouls: 3] (Austin O'Neal: 1 personal fouls)   FT 1/2: GOOD   FT 2/2: GOOD Victor Nowitzki makes 2/2 from the line.
Score: 56-60

[01:28] Team_039 possession (Score: 56-60)
Jrue Bridges attempts a 3Pt. Wide open! D'Angelo O'Neal is 8.9 feet away. [MAN] JRUE BRIDGES MAKES IT! Assist: Klay Wade
Score: 56-63

[01:13] Team_046 possession (Score: 56-63)
D'Angelo O'Neal attempts a 3Pt. Contested by Jrue Bridges (2.1 feet, MAN). D'Angelo O'Neal misses. Rebound secured by Klay Wade.

[00:55] Team_039 possession (Score: 56-63)
FOUL! Reach-in foul on Kevin Allen during the drive. [IN THE BONUS! 5 team fouls] Donovan Markkanen to the line for 2 free throws. (Kevin Allen: 3 personal fouls)   FT 1/2: GOOD   FT 2/2: GOOD Donovan Markkanen makes 2/2 from the line.
Score: 56-65

[00:46] Team_046 possession (Score: 56-65)
Kevin Allen attempts a Layup. Heavily contested by Klay Wade (1.1 feet, ZONE)! Kevin Allen misses. Offensive rebound by Lauri Carter! Lauri Carter kicks it out.

[00:29] Team_046 possession (Score: 56-65)
Victor Nowitzki attempts a 3Pt. Contested by Jrue Bridges (4.8 feet, ZONE). Victor Nowitzki misses. Rebound secured by Donovan Markkanen.

[00:16] Team_039 possession (Score: 56-65)
Klay Wade drives, picks up Kevin Allen. Help arrives from D'Angelo O'Neal! Klay Wade attempts a Dunk. Contested by D'Angelo O'Neal (2.7 feet, ZONE). KLAY WADE MAKES IT! Assist: Jrue Bridges
Score: 56-67

================================================================================
                              3RD QUARTER COMPLETE                              
================================================================================

3RD QUARTER SCORE: Team_046 22, Team_039 19

BOX SCORE:
================================================================================

Team_046
--------------------------------------------------------------------------------
Player                MIN  PTS  REB  AST  TO      FG   FG%      3P   3P%
--------------------------------------------------------------------------------
Cade Wall              25   11    4    0   0   4/4   100.0     0/0   0.0
D'Angelo O'Neal        25    4    0    0   0   2/4    50.0     0/0   0.0
Lauri Carter           25    3    4    1   0   1/1   100.0     0/0   0.0
Victor Nowitzki        25    2    0    3   0   1/2    50.0     0/0   0.0
Kevin Allen            25    2    4    1   0   1/2    50.0     0/0   0.0

TEAM: FG: 9/13 (69.2%), 3PT: 4/7 (57.1%), REB: 12 (5 off, 7 def), AST: 5, TO: 6
TEAM FOULS: 5 [Team_039 in BONUS]


Team_039
--------------------------------------------------------------------------------
Player                MIN  PTS  REB  AST  TO      FG   FG%      3P   3P%
--------------------------------------------------------------------------------
Austin O'Neal          25    6    1    0   0   3/6    50.0     0/0   0.0
Donovan Markkanen      27    6    1    0   0   3/4    75.0     0/0   0.0
Jrue Bridges           25    5    0    3   0   2/3    66.7     0/0   0.0
Klay Wade              25    2    4    2   0   1/2    50.0     0/0   0.0
Anfernee Carter        25    0    0    0   0   0/1     0.0     0/0   0.0

TEAM: FG: 9/16 (56.2%), 3PT: 1/4 (25.0%), REB: 6 (2 off, 4 def), AST: 5, TO: 3
TEAM FOULS: 3

================================================================================

================================================================================
                       4TH QUARTER - Team_046 vs Team_039                       
================================================================================

[12:00] Substitution (Team_046): D'Angelo O'Neal OUT (stamina: 68) → Collin Butler IN (comeback_detected)

[12:00] Substitution (Team_039): Jrue Bridges OUT (stamina: 69) → Tracy Mitchell IN (comeback_detected)

[12:00] Team_046 possession (Score: 56-67)
Kevin Allen throws a bad pass! Stolen by Klay Wade! TURNOVER! (live ball)

[11:49] Team_039 possession (Score: 56-67)
Donovan Markkanen attempts a 3Pt. Contested by Lauri Carter (3.3 feet, ZONE). DONOVAN MARKKANEN MAKES IT! Assist: Tracy Mitchell
Score: 56-70

[11:32] Team_046 possession (Score: 56-70)
Victor Nowitzki attempts a Midrange. Contested by Donovan Markkanen (4.4 feet, ZONE). Victor Nowitzki misses. Rebound secured by Klay Wade.

[11:19] Team_039 possession (Score: 56-70)
FOUL! Shooting foul on Victor Nowitzki. Donovan Markkanen to the line for 2 free throws. [Team fouls: 1] (Victor Nowitzki: 1 personal fouls)   FT 1/2: GOOD   FT 2/2: GOOD Donovan Markkanen makes 2/2 from the line.
Score: 56-72

[11:07] Team_046 possession (Score: 56-72)
Kevin Allen attempts a Layup. Contested by Klay Wade (5.0 feet, ZONE). Kevin Allen misses. Rebound secured by Klay Wade.

[10:50] Team_039 possession (Score: 56-72)
FOUL! Holding foul on Cade Wall. [Team fouls: 2] No free throws, side out. (Cade Wall: 1 personal fouls)

[10:36] Team_039 possession (Score: 56-72)
Tracy Mitchell attempts a Layup. Wide open! Kevin Allen is 6.2 feet away. [ZONE] TRACY MITCHELL MAKES IT! Assist: Klay Wade
Score: 56-74

[10:23] Team_046 possession (Score: 56-74)
FOUL! Reach-in foul on Austin O'Neal during the drive. [Team fouls: 1] No free throws, side out. (Austin O'Neal: 1 personal fouls)

[10:06] Team_046 possession (Score: 56-74)
Victor Nowitzki attempts a Layup. Contested by Klay Wade (3.9 feet, ZONE). Victor Nowitzki misses. Rebound secured by Austin O'Neal.

[09:55] Team_039 possession (Score: 56-74)
Klay Wade drives, Kevin Allen stays with him. Klay Wade attempts a Layup. Heavily contested by Kevin Allen (1.9 feet, MAN)! KLAY WADE MAKES IT!
Score: 56-76

[09:40] Team_046 possession (Score: 56-76)
Cade Wall attempts a Midrange. BLOCKED BY KLAY WADE! Ball goes out off Klay Wade. Cade Wall's ball!

[09:25] Team_046 possession (Score: 56-76)
Lauri Carter attempts a Midrange. Wide open! Tracy Mitchell is 7.2 feet away. [ZONE] LAURI CARTER MAKES IT! Assist: Cade Wall
Score: 58-76

[09:09] Team_039 possession (Score: 58-76)
Anfernee Carter attempts a Midrange. Contested by Collin Butler (5.9 feet, ZONE). Anfernee Carter misses. Rebound secured by Lauri Carter.

[08:56] Team_046 possession (Score: 58-76)
Victor Nowitzki throws a bad pass! Stolen by Donovan Markkanen! TURNOVER! (live ball)

[08:46] Team_039 possession (Score: 58-76)
Austin O'Neal loses the ball! Stripped by Lauri Carter! TURNOVER! (live ball)

[08:31] Team_046 possession (Score: 58-76)
Lauri Carter attempts a 3Pt. Contested by Tracy Mitchell (5.5 feet, ZONE). LAURI CARTER MAKES IT! Assist: Kevin Allen
Score: 61-76

[08:13] Team_039 possession (Score: 61-76)
FOUL! Shooting foul on Cade Wall. Anfernee Carter to the line for 2 free throws. [Team fouls: 3] (Cade Wall: 2 personal fouls)   FT 1/2: GOOD   FT 2/2: GOOD Anfernee Carter makes 2/2 from the line.
Score: 61-78

[07:56] Team_046 possession (Score: 61-78)
Cade Wall attempts a 3Pt. Contested by Tracy Mitchell (3.8 feet, ZONE). Cade Wall misses. FOUL! Loose ball foul on Donovan Markkanen during the rebound battle. [Team fouls: 2] No free throws, side out. (Donovan Markkanen: 1 personal fouls)

[07:42] Team_046 possession (Score: 61-78)
Cade Wall attempts a Midrange. Wide open! Anfernee Carter is 10.0 feet away. [ZONE] CADE WALL MAKES IT! Assist: Victor Nowitzki
Score: 63-78

[07:26] Team_039 possession (Score: 63-78)
Anfernee Carter attempts a Midrange. Contested by Cade Wall (4.4 feet, MAN). Anfernee Carter misses. Rebound secured by Cade Wall.

[07:08] Team_046 possession (Score: 63-78)
Lauri Carter makes the Layup and draws the foul on Donovan Markkanen! And-1! Lauri Carter to the line for 1. [Team fouls: 3] (Donovan Markkanen: 2 personal fouls)   FT 1/1: GOOD Lauri Carter makes 1/1 from the line.
Score: 66-78

[06:52] Team_039 possession (Score: 66-78)
Tracy Mitchell drives, Cade Wall stays with him. Tracy Mitchell attempts a Layup. Contested by Cade Wall (2.3 feet, ZONE). TRACY MITCHELL MAKES IT! Assist: Klay Wade
Score: 66-80

[06:38] Team_046 possession (Score: 66-80)
Cade Wall attempts a Midrange. Contested by Austin O'Neal (3.0 feet, ZONE). Cade Wall misses. Rebound secured by Klay Wade.

[06:24] Team_039 possession (Score: 66-80)
Anfernee Carter attempts a Midrange. Contested by Lauri Carter (3.8 feet, ZONE). Anfernee Carter misses. Rebound secured by Collin Butler.

[06:10] Team_046 possession (Score: 66-80)
Kevin Allen attempts a Layup. Contested by Klay Wade (2.7 feet, MAN). Kevin Allen misses. Rebound secured by Austin O'Neal.

[05:56] Team_039 possession (Score: 66-80)
FOUL! Holding foul on Lauri Carter. [Team fouls: 4] No free throws, side out. (Lauri Carter: 1 personal fouls)

[05:43] Team_039 possession (Score: 66-80)
FOUL! Offensive foul on Anfernee Carter! Cade Wall drew the charge! [Team fouls: 4] (Anfernee Carter: 1 personal fouls) TURNOVER! (dead ball)

[05:27] Team_046 possession (Score: 66-80)
Cade Wall attempts a Midrange. Wide open! Klay Wade is 7.2 feet away. [MAN] CADE WALL MAKES IT! Assist: Kevin Allen
Score: 68-80

[05:12] Team_039 possession (Score: 68-80)
Anfernee Carter loses the ball! Stripped by Cade Wall! TURNOVER! (live ball)

[04:55] Team_046 possession (Score: 68-80)
FOUL! Reach-in foul on Klay Wade during the drive. [IN THE BONUS! 5 team fouls] Kevin Allen to the line for 2 free throws. (Klay Wade: 1 personal fouls)   FT 1/2: GOOD   FT 2/2: GOOD Kevin Allen makes 2/2 from the line.
Score: 70-80

[04:44] Team_039 possession (Score: 70-80)
Klay Wade attempts a Midrange. Wide open! Kevin Allen is 9.4 feet away. [MAN] KLAY WADE MAKES IT! Assist: Donovan Markkanen
Score: 70-82

[04:31] Team_046 possession (Score: 70-82)
Victor Nowitzki attempts a 3Pt. Wide open! Donovan Markkanen is 6.0 feet away. [MAN] Victor Nowitzki misses. Rebound secured by Donovan Markkanen.

[04:16] Team_039 possession (Score: 70-82)
Tracy Mitchell attempts a 3Pt. Contested by Collin Butler (5.7 feet, ZONE). TRACY MITCHELL MAKES IT! Assist: Klay Wade
Score: 70-85

[04:00] Team_046 possession (Score: 70-85)
Victor Nowitzki attempts a Layup. Contested by Klay Wade (2.1 feet, ZONE). VICTOR NOWITZKI MAKES IT! Assist: Cade Wall
Score: 72-85

[03:49] Team_039 possession (Score: 72-85)
Austin O'Neal attempts a 3Pt. Contested by Lauri Carter (5.3 feet, MAN). Austin O'Neal misses. Rebound secured by Cade Wall.

[03:33] Team_046 possession (Score: 72-85)
Collin Butler attempts a 3Pt. Contested by Tracy Mitchell (5.1 feet, MAN). Collin Butler misses. Rebound secured by Klay Wade.

[03:21] Team_039 possession (Score: 72-85)
Klay Wade drives, picks up Kevin Allen. Help arrives from Collin Butler! Klay Wade attempts a Layup. Wide open! Collin Butler is 6.1 feet away. [ZONE] Klay Wade misses. Rebound secured by Lauri Carter.

[03:10] Team_046 possession (Score: 72-85)
FOUL! Reach-in foul on Donovan Markkanen during the drive. [IN THE BONUS! 6 team fouls] Victor Nowitzki to the line for 2 free throws. (Donovan Markkanen: 3 personal fouls)   FT 1/2: GOOD   FT 2/2: GOOD Victor Nowitzki makes 2/2 from the line.
Score: 74-85

[02:53] Team_039 possession (Score: 74-85)
Austin O'Neal attempts a Midrange. Wide open! Lauri Carter is 7.6 feet away. [MAN] Austin O'Neal misses. Rebound secured by Cade Wall.

[02:39] Team_046 possession (Score: 74-85)
Lauri Carter attempts a 3Pt. Contested by Tracy Mitchell (4.7 feet, ZONE). Lauri Carter misses. Rebound secured by Donovan Markkanen.

[02:25] Team_039 possession (Score: 74-85)
Donovan Markkanen attempts a Midrange. Contested by Collin Butler (5.8 feet, MAN). DONOVAN MARKKANEN MAKES IT! Assist: Klay Wade
Score: 74-87

[02:13] Team_046 possession (Score: 74-87)
Cade Wall attempts a Midrange. Contested by Donovan Markkanen (5.5 feet, ZONE). Cade Wall misses. Rebound secured by Austin O'Neal.

[02:00] Team_039 possession (Score: 74-87)
Donovan Markkanen loses the ball! Stripped by Collin Butler! TURNOVER! (live ball)

[01:47] Team_046 possession (Score: 74-87)
Cade Wall attempts a Layup. Wide open! Klay Wade is 7.0 feet away. [ZONE] CADE WALL MAKES IT! Assist: Victor Nowitzki
Score: 76-87

[01:33] Team_039 possession (Score: 76-87)
Anfernee Carter attempts a 3Pt. Contested by Collin Butler (4.8 feet, ZONE). Anfernee Carter misses. Rebound secured by Lauri Carter.

[01:19] Team_046 possession (Score: 76-87)
Cade Wall attempts a Layup. BLOCKED BY KLAY WADE! Ball is loose! Rebound secured by Klay Wade.

[01:08] Team_039 possession (Score: 76-87)
Donovan Markkanen attempts a 3Pt. Wide open! Collin Butler is 6.2 feet away. [MAN] Donovan Markkanen misses. Offensive rebound by Klay Wade! Klay Wade kicks it out.

[00:55] Team_039 possession (Score: 76-87)
Donovan Markkanen attempts a 3Pt. Wide open! Collin Butler is 6.2 feet away. [ZONE] Donovan Markkanen misses. FOUL! Loose ball foul on Cade Wall during the rebound battle. [IN THE BONUS! 5 team fouls] Donovan Markkanen to the line for 2 free throws. (Cade Wall: 3 personal fouls)   FT 1/2: MISS   FT 2/2: GOOD Donovan Markkanen makes 1/2 from the line.
Score: 76-88

[00:38] Team_046 possession (Score: 76-88)
Collin Butler attempts a 3Pt. Contested by Tracy Mitchell (6.0 feet, ZONE). Collin Butler misses. Offensive rebound by Collin Butler! Collin Butler kicks it out.

[00:22] Team_046 possession (Score: 76-88)
Lauri Carter attempts a Layup. Wide open! Klay Wade is 6.1 feet away. [ZONE] LAURI CARTER MAKES IT!
Score: 78-88

[00:07] Team_039 possession (Score: 78-88)
Donovan Markkanen attempts a 3Pt. Contested by Collin Butler (4.0 feet, ZONE). DONOVAN MARKKANEN MAKES IT! Assist: Tracy Mitchell
Score: 78-91

================================================================================
                              4TH QUARTER COMPLETE                              
================================================================================

4TH QUARTER SCORE: Team_046 22, Team_039 24

BOX SCORE:
================================================================================

Team_046
--------------------------------------------------------------------------------
Player                MIN  PTS  REB  AST  TO      FG   FG%      3P   3P%
--------------------------------------------------------------------------------
Lauri Carter           37   10    3    0   0   4/5    80.0     0/0   0.0
Cade Wall              37    6    4    2   0   3/6    50.0     0/0   0.0
Victor Nowitzki        37    4    0    2   0   2/5    40.0     0/0   0.0
Kevin Allen            37    2    0    2   0   1/3    33.3     0/0   0.0
Collin Butler          24    0    2    0   0   0/1     0.0     0/0   0.0

TEAM: FG: 10/20 (50.0%), 3PT: 1/4 (25.0%), REB: 9 (2 off, 7 def), AST: 6, TO: 2
TEAM FOULS: 5 [Team_039 in BONUS]


Team_039
--------------------------------------------------------------------------------
Player                MIN  PTS  REB  AST  TO      FG   FG%      3P   3P%
--------------------------------------------------------------------------------
Donovan Markkanen      39   11    2    1   0   5/5   100.0     0/0   0.0
Tracy Mitchell         24    7    0    2   0   3/3   100.0     0/0   0.0
Klay Wade              37    4    6    4   0   2/3    66.7     0/0   0.0
Anfernee Carter        37    2    0    0   0   1/5    20.0     0/0   0.0
Austin O'Neal          37    0    3    0   0   0/2     0.0     0/0   0.0

TEAM: FG: 11/18 (61.1%), 3PT: 4/6 (66.7%), REB: 11 (1 off, 10 def), AST: 7, TO: 4
TEAM FOULS: 6 [Team_046 in BONUS]

================================================================================

================================================================================
                               FULL GAME COMPLETE                               
================================================================================

FINAL SCORE: Team_046 78, Team_039 91

SCORING BY QUARTER:
--------------------------------------------------------------------------------
Team                     Q1     Q2     Q3     Q4    FINAL
--------------------------------------------------------------------------------
Team_046                 14     20     22     22       78
Team_039                 27     21     19     24       91
--------------------------------------------------------------------------------

FULL GAME BOX SCORE:
================================================================================

Team_046
--------------------------------------------------------------------------------
Player                MIN  PTS  REB  AST  TO      FG   FG%      3P   3P%      FT STL BLK
--------------------------------------------------------------------------------
Victor Nowitzki        37    6    0    5   2   3/10   30.0   0/4     0.0   4/4     0   0
Lauri Carter           37   16    9    1   1   6/7    85.7   3/4    75.0   1/1     2   0
Cade Wall              37   20   10    4   3   9/15   60.0   4/4   100.0   3/3     3   0
Kevin Allen            37    8    8    4   4   4/9    44.4   0/0     0.0   2/2     0   2
D'Angelo O'Neal        25    8    0    0   2   3/9    33.3   0/4     0.0   0/0     0   1
Collin Butler          24    6    2    0   0   3/5    60.0   3/4    75.0   0/0     1   0
Manu Dosunmu           12    0    2    1   0   0/1     0.0   0/1     0.0   0/0     0   0
Josh Barrett           12    2    0    0   2   1/3    33.3   0/1     0.0   2/2     0   0
Chris LaVine           12    8    5    0   2   4/7    57.1   1/2    50.0   2/2     0   0
Paul DeRozan           12    4    6    2   0   0/2     0.0   0/0     0.0   0/0     0   0

TEAM: FG: 33/68 (48.5%), 3PT: 11/24 (45.8%), REB: 42 (14 off, 28 def), AST: 17, TO: 16


Team_039
--------------------------------------------------------------------------------
Player                MIN  PTS  REB  AST  TO      FG   FG%      3P   3P%      FT STL BLK
--------------------------------------------------------------------------------
Donovan Markkanen      39   24    5    1   1  11/15   73.3   4/5    80.0   5/6     1   1
Austin O'Neal          37   10   14    2   3   5/11   45.5   0/4     0.0   0/0     1   0
Anfernee Carter        37    4    0    1   3   2/7    28.6   0/2     0.0   2/2     0   0
Klay Wade              37   11   14    6   1   5/7    71.4   1/1   100.0   0/0     3   2
Jrue Bridges           25   14    0    4   2   6/9    66.7   1/2    50.0   1/1     2   0
Tracy Mitchell         24   11    0    3   0   5/7    71.4   1/3    33.3   0/0     0   0
Yao Carter             12   14    7    1   0   5/6    83.3   3/3   100.0   1/1     0   0
Victor Gasol           12    0    3    2   2   0/2     0.0   0/1     0.0   0/0     0   3
Bam Booker             12    1    0    1   1   1/1   100.0   0/0     0.0   1/2     0   0
Jayson Cunningham       9    2    0    1   0   1/4    25.0   0/3     0.0   0/0     0   0

TEAM: FG: 41/69 (59.4%), 3PT: 10/24 (41.7%), REB: 43 (9 off, 34 def), AST: 22, TO: 13

================================================================================
