================================================================================
                        FULL GAME - Team_021 vs Team_001                        
================================================================================

================================================================================
                       1ST QUARTER - Team_021 vs Team_001                       
================================================================================

[12:00] Team_021 possession (Score: 0-0)
Zach Carter attempts a Midrange. Contested by Dirk Young (4.4 feet, ZONE). ZACH CARTER MAKES IT! Assist: Kyrie Wagner
Score: 2-0

[11:49] Team_001 possession (Score: 2-0)
FOUL! Holding foul on Anthony Oladipo. [Team fouls: 1] No free throws, side out. (Anthony Oladipo: 1 personal fouls)

[11:38] Team_001 possession (Score: 2-0)
FOUL! Reach-in foul on Kyrie Wagner during the drive. [Team fouls: 2] No free throws, side out. (Kyrie Wagner: 1 personal fouls)

[11:20] Team_001 possession (Score: 2-0)
Miles Griffin attempts a 3Pt. Contested by Kyrie Wagner (6.0 feet, ZONE). Miles Griffin misses. Rebound secured by Zach Carter.

[11:09] Team_021 possession (Score: 2-0)
Anthony Oladipo drives, Miles Griffin stays with him. Anthony Oladipo attempts a Layup. Contested by Miles Griffin (3.2 feet, ZONE). ANTHONY OLADIPO MAKES IT! Assist: Zach Carter
Score: 4-0

[10:54] Team_001 possession (Score: 4-0)
Dejounte McCollum attempts a 3Pt. Contested by Kyrie Wagner (2.7 feet, ZONE). DEJOUNTE MCCOLLUM MAKES IT! Assist: Dirk Young
Score: 4-3

[10:39] Team_021 possession (Score: 4-3)
FOUL! Shooting foul on Cole Ball. Karl Bridges to the line for 3 free throws. [Team fouls: 1] (Cole Ball: 1 personal fouls)   FT 1/3: GOOD   FT 2/3: GOOD   FT 3/3: GOOD Karl Bridges makes 3/3 from the line.
Score: 7-3

[10:29] Team_001 possession (Score: 7-3)
Dejounte McCollum attempts a Layup. Contested by Zach Carter (2.7 feet, ZONE). DEJOUNTE MCCOLLUM MAKES IT! Assist: Klay Harden
Score: 7-5

[10:19] Team_021 possession (Score: 7-5)
Kyrie Leonard attempts a Midrange. Contested by Klay Harden (4.9 feet, MAN). KYRIE LEONARD MAKES IT! Assist: Zach Carter
Score: 9-5

[10:04] Team_001 possession (Score: 9-5)
Dirk Young makes the 3Pt and draws the foul on Kyrie Wagner! And-1! Dirk Young to the line for 1. [Team fouls: 3] (Kyrie Wagner: 2 personal fouls)   FT 1/1: GOOD Dirk Young makes 1/1 from the line.
Score: 9-9

[09:55] Team_021 possession (Score: 9-9)
Kyrie Leonard loses control! Ball rolls out of bounds! TURNOVER! (dead ball)

[09:39] Team_001 possession (Score: 9-9)
FOUL! Holding foul on Kyrie Leonard. [Team fouls: 4] No free throws, side out. (Kyrie Leonard: 1 personal fouls)

[09:25] Team_001 possession (Score: 9-9)
Cole Ball attempts a Layup. Contested by Zach Carter (3.4 feet, ZONE). COLE BALL MAKES IT! Assist: Klay Harden
Score: 9-11

[09:11] Team_021 possession (Score: 9-11)
Zach Carter drives and kicks out. Kyrie Leonard attempts a 3Pt. Contested by Klay Harden (3.3 feet, ZONE). Kyrie Leonard misses. Rebound secured by Dejounte McCollum.

[09:00] Team_001 possession (Score: 9-11)
Dejounte McCollum drives and kicks out. Klay Harden attempts a 3Pt. Wide open! Kyrie Wagner is 8.1 feet away. [ZONE] Klay Harden misses. Offensive rebound by Miles Griffin! Miles Griffin kicks it out.

[08:44] Team_001 possession (Score: 9-11)
Miles Griffin attempts a Midrange. Contested by Zach Carter (3.0 feet, MAN). Miles Griffin misses. Rebound secured by Zach Carter.

[08:35] Team_021 possession (Score: 9-11)
Kyrie Wagner attempts a Midrange. Contested by Cole Ball (5.7 feet, ZONE). KYRIE WAGNER MAKES IT! Assist: Anthony Oladipo
Score: 11-11

[08:19] Team_001 possession (Score: 11-11)
Klay Harden drives to the basket... Klay Harden throws a bad pass out of bounds! TURNOVER! (dead ball)

[08:04] Team_021 possession (Score: 11-11)
FOUL! Offensive foul on Zach Carter! Miles Griffin drew the charge! [Team fouls: 5] (Zach Carter: 1 personal fouls) TURNOVER! (dead ball)

[07:48] Team_001 possession (Score: 11-11)
Klay Harden throws a bad pass! Stolen by Kyrie Leonard! TURNOVER! (live ball)

[07:33] Team_021 possession (Score: 11-11)
Karl Bridges attempts a 3Pt. Contested by Klay Harden (3.6 feet, ZONE). Karl Bridges misses. Rebound secured by Miles Griffin.

[07:21] Team_001 possession (Score: 11-11)
Klay Harden drives to the basket... FOUL! Offensive foul on Klay Harden! Kyrie Leonard drew the charge! [Team fouls: 2] (Klay Harden: 1 personal fouls) TURNOVER! (dead ball)

[07:07] Team_021 possession (Score: 11-11)
Kyrie Leonard attempts a 3Pt. Heavily contested by Klay Harden (0.5 feet, MAN)! KYRIE LEONARD MAKES IT! Assist: Kyrie Wagner
Score: 14-11

[06:52] Team_001 possession (Score: 14-11)
Cole Ball drives, picks up Karl Bridges. Help arrives from Kyrie Leonard! Cole Ball attempts a Dunk. Contested by Kyrie Leonard (4.0 feet, MAN). COLE BALL MAKES IT! Assist: Klay Harden
Score: 14-13

[06:39] Team_021 possession (Score: 14-13)
Zach Carter attempts a Layup. Heavily contested by Miles Griffin (0.8 feet, ZONE)! Zach Carter misses. Offensive rebound by Zach Carter! Zach Carter kicks it out.

[06:24] Team_021 possession (Score: 14-13)
FOUL! Holding foul on Klay Harden. [Team fouls: 3] No free throws, side out. (Klay Harden: 2 personal fouls)

[06:10] Team_021 possession (Score: 14-13)
Zach Carter drives and kicks out. Karl Bridges attempts a Midrange. Heavily contested by Cole Ball (1.7 feet, ZONE)! KARL BRIDGES MAKES IT! Assist: Kyrie Wagner
Score: 16-13

[05:59] Team_001 possession (Score: 16-13)
Cole Ball attempts a 3Pt. Heavily contested by Kyrie Wagner (0.6 feet, ZONE)! Cole Ball misses. Rebound secured by Kyrie Leonard.

[05:44] Team_021 possession (Score: 16-13)
Kyrie Wagner makes the Layup and draws the foul on Dejounte McCollum! And-1! Kyrie Wagner to the line for 1. [Team fouls: 4] (Dejounte McCollum: 1 personal fouls)   FT 1/1: GOOD Kyrie Wagner makes 1/1 from the line.
Score: 19-13

[05:32] Team_001 possession (Score: 19-13)
Miles Griffin attempts a Midrange. Heavily contested by Zach Carter (1.5 feet, ZONE)! Miles Griffin misses. Rebound secured by Zach Carter.

[05:21] Team_021 possession (Score: 19-13)
Zach Carter drives, Miles Griffin stays with him. Zach Carter attempts a Layup. Heavily contested by Miles Griffin (0.5 feet, ZONE)! Zach Carter misses. Rebound secured by Dejounte McCollum.

[05:06] Team_001 possession (Score: 19-13)
Dejounte McCollum attempts a Layup. Contested by Kyrie Wagner (3.9 feet, MAN). DEJOUNTE MCCOLLUM MAKES IT!
Score: 19-15

[04:50] Team_021 possession (Score: 19-15)
Kyrie Wagner makes the 3Pt and draws the foul on Klay Harden! And-1! Kyrie Wagner to the line for 1. [BONUS: 5 team fouls] (Klay Harden: 3 personal fouls)   FT 1/1: MISS Kyrie Wagner makes 0/1 from the line. Rebound secured by Miles Griffin.
Score: 22-15

[04:34] Team_001 possession (Score: 22-15)
FOUL! Reach-in foul on Kyrie Leonard during the drive. [IN THE BONUS! 6 team fouls] Klay Harden to the line for 2 free throws. (Kyrie Leonard: 2 personal fouls)   FT 1/2: GOOD   FT 2/2: GOOD Klay Harden makes 2/2 from the line.
Score: 22-17

[04:19] Team_021 possession (Score: 22-17)
Anthony Oladipo makes the Midrange and draws the foul on Cole Ball! And-1! Anthony Oladipo to the line for 1. [BONUS: 6 team fouls] (Cole Ball: 2 personal fouls)   FT 1/1: GOOD Anthony Oladipo makes 1/1 from the line.
Score: 25-17

[04:02] Team_001 possession (Score: 25-17)
Cole Ball attempts a Midrange. Wide open! Karl Bridges is 6.7 feet away. [MAN] COLE BALL MAKES IT!
Score: 25-19

[03:46] Team_021 possession (Score: 25-19)
Anthony Oladipo attempts a 3Pt. Heavily contested by Klay Harden (1.8 feet, ZONE)! ANTHONY OLADIPO MAKES IT! Assist: Zach Carter
Score: 28-19

[03:30] Team_001 possession (Score: 28-19)
Dejounte McCollum attempts a 3Pt. Contested by Kyrie Wagner (4.3 feet, ZONE). Dejounte McCollum misses. Rebound secured by Zach Carter.

[03:14] Team_021 possession (Score: 28-19)
Kyrie Leonard attempts a 3Pt. Contested by Klay Harden (5.7 feet, MAN). Kyrie Leonard misses. Rebound secured by Cole Ball.

[03:04] Team_001 possession (Score: 28-19)
Miles Griffin attempts a 3Pt. Wide open! Zach Carter is 9.0 feet away. [MAN] Miles Griffin misses. Rebound secured by Kyrie Leonard.

[02:53] Team_021 possession (Score: 28-19)
Kyrie Leonard drives to the basket... Kyrie Leonard loses control! Ball rolls out of bounds! TURNOVER! (dead ball)

[02:53] Substitution (Team_021): Kyrie Leonard OUT → Joel LaVine IN (stamina_rule2)

[02:53] Substitution (Team_021): Karl Bridges OUT → Paul Allen IN (stamina_rule2)

[02:53] Substitution (Team_021): Kyrie Wagner OUT → Vince George IN (stamina_rule2)

[02:53] Substitution (Team_021): Zach Carter OUT → Magic Ingram IN (stamina_rule2)

[02:53] Substitution (Team_001): Klay Harden OUT → Ja Dosunmu IN (stamina_rule2)

[02:53] Substitution (Team_001): Dirk Young OUT → Rudy George IN (stamina_rule2)

[02:53] Substitution (Team_001): Miles Griffin OUT → Kristaps Ming IN (stamina_rule2)

[02:40] Team_001 possession (Score: 28-19)
Dejounte McCollum attempts a 3Pt. Contested by Vince George (5.3 feet, MAN). Dejounte McCollum misses. Rebound secured by Anthony Oladipo.

[02:25] Team_021 possession (Score: 28-19)
Anthony Oladipo throws a bad pass out of bounds! TURNOVER! (dead ball)

[02:25] Substitution (Team_021): Anthony Oladipo OUT → Victor Mitchell IN (stamina_rule2)

[02:25] Substitution (Team_001): Cole Ball OUT → Larry Trent IN (stamina_rule2)

[02:25] Substitution (Team_001): Dejounte McCollum OUT → Franz Bryant IN (stamina_rule2)

[02:11] Team_001 possession (Score: 28-19)
Rudy George loses the ball! Stripped by Victor Mitchell! TURNOVER! (live ball)

[01:55] Team_021 possession (Score: 28-19)
Magic Ingram loses the ball! Stripped by Kristaps Ming! TURNOVER! (live ball)

[01:41] Team_001 possession (Score: 28-19)
Kristaps Ming drives, picks up Magic Ingram. Help arrives from Victor Mitchell! Kristaps Ming attempts a Dunk. Wide open! Victor Mitchell is 6.2 feet away. [MAN] KRISTAPS MING MAKES IT! Assist: Ja Dosunmu
Score: 28-21

[01:30] Team_021 possession (Score: 28-21)
Magic Ingram makes the Layup and draws the foul on Kristaps Ming! And-1! Magic Ingram to the line for 1. [BONUS: 7 team fouls] (Kristaps Ming: 1 personal fouls)   FT 1/1: GOOD Magic Ingram makes 1/1 from the line.
Score: 31-21

[01:14] Team_001 possession (Score: 31-21)
FOUL! Holding foul on Joel LaVine. [IN THE BONUS! 7 team fouls] Ja Dosunmu to the line for 2 free throws. (Joel LaVine: 1 personal fouls)   FT 1/2: GOOD   FT 2/2: MISS Ja Dosunmu makes 1/2 from the line. Rebound secured by Magic Ingram.
Score: 31-22

[01:00] Team_021 possession (Score: 31-22)
Victor Mitchell attempts a 3Pt. Contested by Ja Dosunmu (6.0 feet, ZONE). Victor Mitchell misses. Offensive rebound by Magic Ingram! Magic Ingram kicks it out.

[00:44] Team_021 possession (Score: 31-22)
Joel LaVine drives and kicks out. Magic Ingram attempts a 3Pt. Wide open! Kristaps Ming is 6.1 feet away. [MAN] Magic Ingram misses. Rebound secured by Kristaps Ming.

[00:30] Team_001 possession (Score: 31-22)
Rudy George makes the Layup and draws the foul on Paul Allen! And-1! Rudy George to the line for 1. [BONUS: 8 team fouls] (Paul Allen: 1 personal fouls)   FT 1/1: GOOD Rudy George makes 1/1 from the line.
Score: 31-25

[00:16] Team_021 possession (Score: 31-25)
Joel LaVine attempts a 3Pt. Contested by Ja Dosunmu (4.7 feet, ZONE). Joel LaVine misses. Rebound secured by Larry Trent.

[00:02] Team_001 possession (Score: 31-25)
FOUL! Shooting foul on Vince George. Ja Dosunmu to the line for 2 free throws. [BONUS: 9 team fouls] (Vince George: 1 personal fouls)   FT 1/2: GOOD   FT 2/2: GOOD Ja Dosunmu makes 2/2 from the line.
Score: 31-27

================================================================================
                              1ST QUARTER COMPLETE                              
================================================================================

1ST QUARTER SCORE: Team_021 31, Team_001 27

BOX SCORE:
================================================================================

Team_021
--------------------------------------------------------------------------------
Player                MIN  PTS  REB  AST  TO      FG   FG%      3P   3P%
--------------------------------------------------------------------------------
Anthony Oladipo        10    8    1    1   0   3/3   100.0     0/0   0.0
Kyrie Wagner            9    5    0    3   0   2/3    66.7     0/0   0.0
Karl Bridges            9    5    0    0   0   2/3    66.7     0/0   0.0
Kyrie Leonard           9    5    2    0   0   2/3    66.7     0/0   0.0
Magic Ingram            3    3    2    0   0   1/1   100.0     0/0   0.0
Zach Carter             9    2    5    3   0   1/3    33.3     0/0   0.0
Joel LaVine             3    0    0    0   0   0/2     0.0     0/0   0.0

TEAM: FG: 11/18 (61.1%), 3PT: 3/7 (42.9%), REB: 10 (2 off, 8 def), AST: 7, TO: 5
TEAM FOULS: 9 [Team_001 in BONUS]


Team_001
--------------------------------------------------------------------------------
Player                MIN  PTS  REB  AST  TO      FG   FG%      3P   3P%
--------------------------------------------------------------------------------
Dejounte McCollum      10    7    2    0   0   3/5    60.0     0/0   0.0
Cole Ball              10    6    1    0   0   3/4    75.0     0/0   0.0
Dirk Young              9    4    0    1   0   1/1   100.0     0/0   0.0
Rudy George             3    3    0    0   0   1/1   100.0     0/0   0.0
Klay Harden             9    2    0    3   0   1/1   100.0     0/0   0.0
Kristaps Ming           3    2    1    0   0   1/1   100.0     0/0   0.0
Ja Dosunmu              3    2    0    1   0   1/1   100.0     0/0   0.0
Miles Griffin           9    0    3    0   0   0/4     0.0     0/0   0.0
Larry Trent             2    0    1    0   0   0/0     0.0     0/0   0.0

TEAM: FG: 11/19 (57.9%), 3PT: 2/7 (28.6%), REB: 8 (1 off, 7 def), AST: 5, TO: 4
TEAM FOULS: 7 [Team_021 in BONUS]

================================================================================

================================================================================
                       2ND QUARTER - Team_021 vs Team_001                       
================================================================================

[12:00] Team_021 possession (Score: 31-27)
Zach Carter throws a bad pass out of bounds! TURNOVER! (dead ball)

[11:43] Team_001 possession (Score: 31-27)
FOUL! Reach-in foul on Kyrie Leonard during the drive. [Team fouls: 1] No free throws, side out. (Kyrie Leonard: 1 personal fouls)

[11:25] Team_001 possession (Score: 31-27)
FOUL! Shooting foul on Anthony Oladipo. Dirk Young to the line for 3 free throws. [Team fouls: 2] (Anthony Oladipo: 1 personal fouls)   FT 1/3: GOOD   FT 2/3: GOOD   FT 3/3: GOOD Dirk Young makes 3/3 from the line.
Score: 31-30

[11:13] Team_021 possession (Score: 31-30)
FOUL! Holding foul on Cole Ball. [Team fouls: 1] No free throws, side out. (Cole Ball: 1 personal fouls)

[11:02] Team_021 possession (Score: 31-30)
Karl Bridges attempts a 3Pt. Wide open! Klay Harden is 6.6 feet away. [ZONE] KARL BRIDGES MAKES IT! Assist: Kyrie Wagner
Score: 34-30

[10:44] Team_001 possession (Score: 34-30)
Klay Harden drives and kicks out. Miles Griffin attempts a 3Pt. Heavily contested by Zach Carter (0.5 feet, MAN)! Miles Griffin misses. Rebound secured by Anthony Oladipo.

[10:28] Team_021 possession (Score: 34-30)
FOUL! Reach-in foul on Dejounte McCollum during the drive. [Team fouls: 2] No free throws, side out. (Dejounte McCollum: 1 personal fouls)

[10:15] Team_021 possession (Score: 34-30)
Zach Carter attempts a Midrange. Contested by Miles Griffin (3.7 feet, MAN). ZACH CARTER MAKES IT! Assist: Kyrie Leonard
Score: 36-30

[10:00] Team_001 possession (Score: 36-30)
Klay Harden attempts a 3Pt. Contested by Kyrie Leonard (5.1 feet, MAN). KLAY HARDEN MAKES IT!
Score: 36-33

[09:43] Team_021 possession (Score: 36-33)
Kyrie Wagner drives, Dejounte McCollum stays with him. Kyrie Wagner attempts a Layup. Heavily contested by Dejounte McCollum (1.8 feet, MAN)! Kyrie Wagner misses. Rebound secured by Cole Ball.

[09:33] Team_001 possession (Score: 36-33)
Miles Griffin drives, picks up Zach Carter. Help arrives from Kyrie Leonard! Miles Griffin attempts a Dunk. Contested by Kyrie Leonard (2.4 feet, ZONE). MILES GRIFFIN MAKES IT! Assist: Dirk Young
Score: 36-35

[09:19] Team_021 possession (Score: 36-35)
Kyrie Leonard attempts a 3Pt. Contested by Dirk Young (5.9 feet, ZONE). Kyrie Leonard misses. Rebound secured by Miles Griffin.

[09:02] Team_001 possession (Score: 36-35)
Klay Harden attempts a Midrange. Contested by Zach Carter (5.5 feet, ZONE). Klay Harden misses. Rebound secured by Zach Carter.

[08:48] Team_021 possession (Score: 36-35)
Kyrie Leonard drives and kicks out. Kyrie Wagner attempts a 3Pt. Contested by Dejounte McCollum (3.5 feet, MAN). Kyrie Wagner misses. Offensive rebound by Kyrie Leonard! Kyrie Leonard kicks it out.

[08:37] Team_021 possession (Score: 36-35)
Kyrie Wagner attempts a Midrange. Contested by Dejounte McCollum (3.2 feet, MAN). Kyrie Wagner misses. Offensive rebound by Kyrie Leonard! Kyrie Leonard kicks it out.

[08:28] Team_021 possession (Score: 36-35)
Karl Bridges drives, Cole Ball stays with him. Karl Bridges attempts a Dunk. Contested by Cole Ball (3.6 feet, MAN). KARL BRIDGES MAKES IT! Assist: Kyrie Leonard
Score: 38-35

[08:11] Team_001 possession (Score: 38-35)
Dejounte McCollum attempts a Layup. Contested by Kyrie Wagner (2.4 feet, MAN). DEJOUNTE MCCOLLUM MAKES IT! Assist: Miles Griffin
Score: 38-37

[08:00] Team_021 possession (Score: 38-37)
Karl Bridges attempts a 3Pt. Contested by Cole Ball (2.3 feet, MAN). Karl Bridges misses. Rebound secured by Cole Ball.

[07:47] Team_001 possession (Score: 38-37)
Dejounte McCollum throws a bad pass! Stolen by Kyrie Wagner! TURNOVER! (live ball)

[07:32] Team_021 possession (Score: 38-37)
Kyrie Wagner attempts a 3Pt. Contested by Klay Harden (3.8 feet, ZONE). Kyrie Wagner misses. Rebound secured by Miles Griffin.

[07:18] Team_001 possession (Score: 38-37)
Dejounte McCollum attempts a Midrange. Wide open! Kyrie Wagner is 6.7 feet away. [MAN] DEJOUNTE MCCOLLUM MAKES IT! Assist: Cole Ball
Score: 38-39

[07:02] Team_021 possession (Score: 38-39)
Karl Bridges commits a violation (traveling/carry)! TURNOVER! (dead ball)

[07:02] Substitution (Team_021): Kyrie Leonard OUT → Joel LaVine IN (stamina_rule2)

[07:02] Substitution (Team_021): Anthony Oladipo OUT → Victor Mitchell IN (stamina_rule2)

[07:02] Substitution (Team_021): Karl Bridges OUT → Paul Allen IN (stamina_rule2)

[07:02] Substitution (Team_021): Kyrie Wagner OUT → Vince George IN (stamina_rule2)

[07:02] Substitution (Team_021): Zach Carter OUT → Magic Ingram IN (stamina_rule2)

[07:02] Substitution (Team_001): Klay Harden OUT → Ja Dosunmu IN (stamina_rule2)

[07:02] Substitution (Team_001): Dirk Young OUT → Rudy George IN (stamina_rule2)

[07:02] Substitution (Team_001): Cole Ball OUT → Larry Trent IN (stamina_rule2)

[07:02] Substitution (Team_001): Dejounte McCollum OUT → Franz Bryant IN (stamina_rule2)

[07:02] Substitution (Team_001): Miles Griffin OUT → Kristaps Ming IN (stamina_rule2)

[06:48] Team_001 possession (Score: 38-39)
Larry Trent attempts a 3Pt. Wide open! Paul Allen is 8.6 feet away. [MAN] LARRY TRENT MAKES IT! Assist: Kristaps Ming
Score: 38-42

[06:35] Team_021 possession (Score: 38-42)
Magic Ingram attempts a Layup. Contested by Franz Bryant (3.3 feet, ZONE). MAGIC INGRAM MAKES IT! Assist: Paul Allen
Score: 40-42

[06:23] Team_001 possession (Score: 40-42)
Franz Bryant attempts a 3Pt. Wide open! Joel LaVine is 7.6 feet away. [ZONE] Franz Bryant misses. FOUL! Loose ball foul on Victor Mitchell during the rebound battle. [Team fouls: 3] No free throws, side out. (Victor Mitchell: 1 personal fouls)

[06:06] Team_001 possession (Score: 40-42)
Franz Bryant attempts a 3Pt. Contested by Vince George (5.2 feet, MAN). Franz Bryant misses. Offensive rebound by Larry Trent! Larry Trent kicks it out.

[05:49] Team_001 possession (Score: 40-42)
Larry Trent drives and kicks out. Kristaps Ming attempts a 3Pt. Contested by Magic Ingram (3.7 feet, MAN). Kristaps Ming misses. FOUL! Loose ball foul on Victor Mitchell during the rebound battle. [Team fouls: 4] No free throws, side out. (Victor Mitchell: 2 personal fouls)

[05:32] Team_001 possession (Score: 40-42)
Ja Dosunmu attempts a 3Pt. Contested by Victor Mitchell (2.8 feet, ZONE). JA DOSUNMU MAKES IT! Assist: Franz Bryant
Score: 40-45

[05:21] Team_021 possession (Score: 40-45)
Paul Allen loses the ball! Stripped by Larry Trent! TURNOVER! (live ball)

[05:07] Team_001 possession (Score: 40-45)
Ja Dosunmu attempts a Layup. Contested by Joel LaVine (4.7 feet, MAN). Ja Dosunmu misses. Offensive rebound by Larry Trent! Larry Trent kicks it out.

[04:57] Team_001 possession (Score: 40-45)
Larry Trent drives, picks up Paul Allen. Help arrives from Victor Mitchell! Larry Trent attempts a Dunk. Wide open! Victor Mitchell is 6.9 feet away. [MAN] LARRY TRENT MAKES IT! Assist: Ja Dosunmu
Score: 40-47

[04:43] Team_021 possession (Score: 40-47)
Paul Allen loses control! Ball rolls out of bounds! TURNOVER! (dead ball)

[04:27] Team_001 possession (Score: 40-47)
Larry Trent drives, Paul Allen stays with him. Larry Trent attempts a Layup. Contested by Paul Allen (2.6 feet, MAN). LARRY TRENT MAKES IT! Assist: Ja Dosunmu
Score: 40-49

[04:12] Team_021 possession (Score: 40-49)
Paul Allen attempts a 3Pt. Contested by Larry Trent (3.7 feet, MAN). PAUL ALLEN MAKES IT! Assist: Joel LaVine
Score: 43-49

[03:54] Team_001 possession (Score: 43-49)
Larry Trent drives, Paul Allen stays with him. Larry Trent attempts a Dunk. Wide open! Paul Allen is 8.0 feet away. [MAN] LARRY TRENT MAKES IT! Assist: Rudy George
Score: 43-51

[03:40] Team_021 possession (Score: 43-51)
Joel LaVine attempts a Layup. BLOCKED BY JA DOSUNMU! Ball is loose! Offensive rebound by Vince George! Vince George kicks it out.

[03:27] Team_021 possession (Score: 43-51)
Victor Mitchell attempts a Midrange. Contested by Larry Trent (3.9 feet, ZONE). Victor Mitchell misses. Rebound secured by Larry Trent.

[03:13] Team_001 possession (Score: 43-51)
Franz Bryant attempts a Midrange. Wide open! Vince George is 6.0 feet away. [MAN] Franz Bryant misses. FOUL! Loose ball foul on Victor Mitchell during the rebound battle. [IN THE BONUS! 5 team fouls] Larry Trent to the line for 2 free throws. (Victor Mitchell: 3 personal fouls)   FT 1/2: GOOD   FT 2/2: GOOD Larry Trent makes 2/2 from the line.
Score: 43-53

[02:59] Team_021 possession (Score: 43-53)
Victor Mitchell attempts a Midrange. Contested by Rudy George (5.8 feet, MAN). VICTOR MITCHELL MAKES IT!
Score: 45-53

[02:48] Team_001 possession (Score: 45-53)
Kristaps Ming makes the Dunk and draws the foul on Victor Mitchell! And-1! Kristaps Ming to the line for 1. [BONUS: 6 team fouls] (Victor Mitchell: 4 personal fouls)   FT 1/1: MISS Kristaps Ming makes 0/1 from the line. Rebound secured by Magic Ingram.
Score: 45-55

[02:33] Team_021 possession (Score: 45-55)
FOUL! Holding foul on Franz Bryant. [Team fouls: 3] No free throws, side out. (Franz Bryant: 1 personal fouls)

[02:18] Team_021 possession (Score: 45-55)
Joel LaVine attempts a 3Pt. Contested by Ja Dosunmu (3.3 feet, MAN). Joel LaVine misses. Rebound secured by Larry Trent.

[02:02] Team_001 possession (Score: 45-55)
Franz Bryant throws a bad pass! Stolen by Vince George! TURNOVER! (live ball)

[01:43] Team_021 possession (Score: 45-55)
Vince George drives and kicks out. Victor Mitchell attempts a 3Pt. Contested by Rudy George (4.7 feet, MAN). Victor Mitchell misses. Offensive rebound by Vince George! Vince George kicks it out.

[01:26] Team_021 possession (Score: 45-55)
Paul Allen attempts a 3Pt. Contested by Larry Trent (4.7 feet, MAN). PAUL ALLEN MAKES IT! Assist: Joel LaVine
Score: 48-55

[01:08] Team_001 possession (Score: 48-55)
Rudy George attempts a Midrange. Wide open! Magic Ingram is 6.9 feet away. [ZONE] RUDY GEORGE MAKES IT! Assist: Ja Dosunmu
Score: 48-57

[00:51] Team_021 possession (Score: 48-57)
Magic Ingram attempts a Midrange. Heavily contested by Franz Bryant (1.1 feet, ZONE)! MAGIC INGRAM MAKES IT!
Score: 50-57

[00:37] Team_001 possession (Score: 50-57)
Franz Bryant loses control! Ball rolls out of bounds! TURNOVER! (dead ball)

[00:26] Team_021 possession (Score: 50-57)
Victor Mitchell attempts a 3Pt. Contested by Rudy George (5.4 feet, MAN). Victor Mitchell misses. Rebound secured by Kristaps Ming.

[00:14] Team_001 possession (Score: 50-57)
Kristaps Ming attempts a Layup. BLOCKED BY MAGIC INGRAM! Ball is loose! Rebound secured by Vince George.

================================================================================
                              2ND QUARTER COMPLETE                              
================================================================================

2ND QUARTER SCORE: Team_021 19, Team_001 30

BOX SCORE:
================================================================================

Team_021
--------------------------------------------------------------------------------
Player                MIN  PTS  REB  AST  TO      FG   FG%      3P   3P%
--------------------------------------------------------------------------------
Paul Allen             10    6    0    1   0   2/2   100.0     0/0   0.0
Karl Bridges           15    5    0    0   0   2/3    66.7     0/0   0.0
Magic Ingram           10    4    1    0   0   2/2   100.0     0/0   0.0
Zach Carter            15    2    1    0   0   1/1   100.0     0/0   0.0
Victor Mitchell         9    2    0    0   0   1/3    33.3     0/0   0.0
Kyrie Wagner           15    0    0    1   0   0/2     0.0     0/0   0.0
Anthony Oladipo        15    0    1    0   0   0/0     0.0     0/0   0.0
Kyrie Leonard          15    0    2    2   0   0/1     0.0     0/0   0.0
Joel LaVine            10    0    0    2   0   0/1     0.0     0/0   0.0
Vince George           10    0    3    0   0   0/0     0.0     0/0   0.0

TEAM: FG: 8/15 (53.3%), 3PT: 3/8 (37.5%), REB: 8 (4 off, 4 def), AST: 6, TO: 4
TEAM FOULS: 6 [Team_001 in BONUS]


Team_001
--------------------------------------------------------------------------------
Player                MIN  PTS  REB  AST  TO      FG   FG%      3P   3P%
--------------------------------------------------------------------------------
Larry Trent             9   11    5    0   0   5/5   100.0     0/0   0.0
Dejounte McCollum      15    4    0    0   0   2/2   100.0     0/0   0.0
Dirk Young             15    3    0    1   0   1/1   100.0     0/0   0.0
Klay Harden            15    3    0    0   0   1/3    33.3     0/0   0.0
Ja Dosunmu             10    3    0    3   0   1/1   100.0     0/0   0.0
Miles Griffin          15    2    2    1   0   1/1   100.0     0/0   0.0
Rudy George            10    2    1    1   0   1/1   100.0     0/0   0.0
Cole Ball              15    0    2    1   0   0/0     0.0     0/0   0.0
Kristaps Ming          10    0    1    1   0   0/2     0.0     0/0   0.0
Franz Bryant            9    0    0    1   0   0/0     0.0     0/0   0.0

TEAM: FG: 12/16 (75.0%), 3PT: 4/4 (100.0%), REB: 11 (4 off, 7 def), AST: 9, TO: 3
TEAM FOULS: 3

================================================================================

================================================================================
                       3RD QUARTER - Team_021 vs Team_001                       
================================================================================

[12:00] Team_021 possession (Score: 50-57)
Kyrie Wagner attempts a Midrange. Heavily contested by Dirk Young (0.5 feet, ZONE)! KYRIE WAGNER MAKES IT! Assist: Zach Carter
Score: 52-57

[11:43] Team_001 possession (Score: 52-57)
Miles Griffin drives, Zach Carter stays with him. Miles Griffin attempts a Layup. Heavily contested by Zach Carter (1.7 feet, MAN)! MILES GRIFFIN MAKES IT! Assist: Klay Harden
Score: 52-59

[11:32] Team_021 possession (Score: 52-59)
Karl Bridges attempts a Layup. Heavily contested by Cole Ball (0.5 feet, MAN)! Karl Bridges misses. Rebound secured by Cole Ball.

[11:19] Team_001 possession (Score: 52-59)
FOUL! Holding foul on Karl Bridges. [Team fouls: 1] No free throws, side out. (Karl Bridges: 1 personal fouls)

[11:04] Team_001 possession (Score: 52-59)
Klay Harden drives to the basket... Klay Harden commits a violation (traveling/carry)! TURNOVER! (dead ball)

[10:48] Team_021 possession (Score: 52-59)
Kyrie Wagner makes the Layup and draws the foul on Dejounte McCollum! And-1! Kyrie Wagner to the line for 1. [Team fouls: 1] (Dejounte McCollum: 1 personal fouls)   FT 1/1: GOOD Kyrie Wagner makes 1/1 from the line.
Score: 55-59

[10:32] Team_001 possession (Score: 55-59)
Miles Griffin loses the ball! Stripped by Zach Carter! TURNOVER! (live ball)

[10:17] Team_021 possession (Score: 55-59)
Zach Carter drives to the basket... Zach Carter throws a bad pass out of bounds! TURNOVER! (dead ball)

[10:05] Team_001 possession (Score: 55-59)
Dejounte McCollum attempts a Midrange. Contested by Kyrie Wagner (5.4 feet, MAN). Dejounte McCollum misses. Rebound secured by Anthony Oladipo.

[09:50] Team_021 possession (Score: 55-59)
Zach Carter attempts a Midrange. Contested by Miles Griffin (6.0 feet, MAN). Zach Carter misses. Rebound secured by Dejounte McCollum.

[09:35] Team_001 possession (Score: 55-59)
FOUL! Shooting foul on Kyrie Leonard. Miles Griffin to the line for 2 free throws. [Team fouls: 2] (Kyrie Leonard: 1 personal fouls)   FT 1/2: GOOD   FT 2/2: GOOD Miles Griffin makes 2/2 from the line.
Score: 55-61

[09:17] Team_021 possession (Score: 55-61)
Kyrie Wagner drives, picks up Miles Griffin. Help arrives from Klay Harden! Kyrie Wagner attempts a Dunk. Contested by Klay Harden (2.0 feet, ZONE). KYRIE WAGNER MAKES IT! Assist: Karl Bridges
Score: 57-61

[09:00] Team_001 possession (Score: 57-61)
Cole Ball attempts a 3Pt. Contested by Kyrie Wagner (2.0 feet, ZONE). Cole Ball misses. Offensive rebound by Miles Griffin! Miles Griffin kicks it out.

[08:47] Team_001 possession (Score: 57-61)
Dirk Young commits a violation (traveling/carry)! TURNOVER! (dead ball)

[08:33] Team_021 possession (Score: 57-61)
Kyrie Wagner attempts a 3Pt. Contested by Dejounte McCollum (4.2 feet, MAN). Kyrie Wagner misses. Rebound secured by Cole Ball.

[08:19] Team_001 possession (Score: 57-61)
Cole Ball drives, picks up Karl Bridges. Help arrives from Kyrie Leonard! Cole Ball attempts a Dunk. Contested by Kyrie Leonard (4.4 feet, MAN). COLE BALL MAKES IT! Assist: Dejounte McCollum
Score: 57-63

[08:05] Team_021 possession (Score: 57-63)
Zach Carter drives and kicks out. Zach Carter attempts a 3Pt. Contested by Klay Harden (5.0 feet, ZONE). Zach Carter misses. FOUL! Loose ball foul on Dejounte McCollum during the rebound battle. [Team fouls: 2] No free throws, side out. (Dejounte McCollum: 2 personal fouls)

[07:52] Team_021 possession (Score: 57-63)
FOUL! Shooting foul on Dejounte McCollum. Kyrie Wagner to the line for 2 free throws. [Team fouls: 3] (Dejounte McCollum: 3 personal fouls)   FT 1/2: GOOD   FT 2/2: GOOD Kyrie Wagner makes 2/2 from the line.
Score: 59-63

[07:36] Team_001 possession (Score: 59-63)
FOUL! Offensive foul on Dirk Young! Anthony Oladipo drew the charge! [Team fouls: 4] (Dirk Young: 1 personal fouls) TURNOVER! (dead ball)

[07:19] Team_021 possession (Score: 59-63)
Anthony Oladipo drives to the basket... Anthony Oladipo throws a bad pass! Stolen by Dirk Young! TURNOVER! (live ball)

[07:07] Team_001 possession (Score: 59-63)
Cole Ball attempts a Layup. BLOCKED BY ZACH CARTER! Ball is loose! Rebound secured by Zach Carter.

[06:55] Team_021 possession (Score: 59-63)
Anthony Oladipo attempts a 3Pt. Contested by Dirk Young (5.3 feet, MAN). Anthony Oladipo misses. Rebound secured by Dejounte McCollum.

[06:39] Team_001 possession (Score: 59-63)
Dirk Young drives, Anthony Oladipo stays with him. Dirk Young attempts a Dunk. Wide open! Anthony Oladipo is 6.6 feet away. [MAN] Dirk Young misses. Rebound secured by Anthony Oladipo.

[06:23] Team_021 possession (Score: 59-63)
Karl Bridges attempts a 3Pt. Wide open! Cole Ball is 6.4 feet away. [MAN] Karl Bridges misses. Rebound secured by Miles Griffin.

[06:08] Team_001 possession (Score: 59-63)
Dirk Young makes the Layup and draws the foul on Zach Carter! And-1! Dirk Young to the line for 1. [Team fouls: 3] (Zach Carter: 1 personal fouls)   FT 1/1: GOOD Dirk Young makes 1/1 from the line.
Score: 59-66

[05:49] Team_021 possession (Score: 59-66)
Zach Carter attempts a 3Pt. Contested by Miles Griffin (3.1 feet, MAN). ZACH CARTER MAKES IT!
Score: 62-66

[05:38] Team_001 possession (Score: 62-66)
Dirk Young attempts a Midrange. Contested by Anthony Oladipo (4.0 feet, MAN). DIRK YOUNG MAKES IT!
Score: 62-68

[05:24] Team_021 possession (Score: 62-68)
Anthony Oladipo attempts a Midrange. Contested by Dirk Young (5.2 feet, MAN). Anthony Oladipo misses. Offensive rebound by Kyrie Leonard! Kyrie Leonard kicks it out.

[05:09] Team_021 possession (Score: 62-68)
FOUL! Reach-in foul on Cole Ball during the drive. [IN THE BONUS! 5 team fouls] Karl Bridges to the line for 2 free throws. (Cole Ball: 1 personal fouls)   FT 1/2: MISS   FT 2/2: GOOD Karl Bridges makes 1/2 from the line.
Score: 63-68

[04:58] Team_001 possession (Score: 63-68)
Klay Harden throws a bad pass out of bounds! TURNOVER! (dead ball)

[04:44] Team_021 possession (Score: 63-68)
Kyrie Wagner drives to the basket... Kyrie Wagner throws a bad pass! Stolen by Dejounte McCollum! TURNOVER! (live ball)

[04:31] Team_001 possession (Score: 63-68)
Miles Griffin attempts a Midrange. Contested by Zach Carter (4.6 feet, MAN). MILES GRIFFIN MAKES IT!
Score: 63-70

[04:17] Team_021 possession (Score: 63-70)
Kyrie Wagner attempts a Midrange. Contested by Dirk Young (4.5 feet, ZONE). KYRIE WAGNER MAKES IT!
Score: 65-70

[03:58] Team_001 possession (Score: 65-70)
Klay Harden attempts a 3Pt. Wide open! Kyrie Leonard is 6.5 feet away. [MAN] KLAY HARDEN MAKES IT!
Score: 65-73

[03:46] Team_021 possession (Score: 65-73)
Zach Carter attempts a Midrange. Wide open! Miles Griffin is 6.2 feet away. [MAN] ZACH CARTER MAKES IT!
Score: 67-73

[03:32] Team_001 possession (Score: 67-73)
FOUL! Holding foul on Kyrie Leonard. [Team fouls: 4] No free throws, side out. (Kyrie Leonard: 2 personal fouls)

[03:20] Team_001 possession (Score: 67-73)
Cole Ball attempts a 3Pt. Wide open! Karl Bridges is 7.3 feet away. [MAN] Cole Ball misses. Rebound secured by Kyrie Leonard.

[03:02] Team_021 possession (Score: 67-73)
Zach Carter drives to the basket... Zach Carter throws a bad pass out of bounds! TURNOVER! (dead ball)

[03:02] Substitution (Team_001): Miles Griffin OUT → Kristaps Ming IN (stamina_rule2)

[02:46] Team_001 possession (Score: 67-73)
Dejounte McCollum attempts a Midrange. Wide open! Anthony Oladipo is 7.9 feet away. [ZONE] Dejounte McCollum misses. Rebound secured by Kyrie Leonard.

[02:28] Team_021 possession (Score: 67-73)
Kyrie Leonard drives, Dejounte McCollum stays with him. Kyrie Leonard attempts a Layup. Contested by Dejounte McCollum (3.2 feet, ZONE). KYRIE LEONARD MAKES IT! Assist: Zach Carter
Score: 69-73

[02:17] Team_001 possession (Score: 69-73)
FOUL! Reach-in foul on Zach Carter during the drive. [IN THE BONUS! 5 team fouls] Dirk Young to the line for 2 free throws. (Zach Carter: 2 personal fouls)   FT 1/2: GOOD   FT 2/2: GOOD Dirk Young makes 2/2 from the line.
Score: 69-75

[02:06] Team_021 possession (Score: 69-75)
Kyrie Wagner attempts a 3Pt. Contested by Klay Harden (3.1 feet, ZONE). Kyrie Wagner misses. Rebound secured by Cole Ball.

[01:53] Team_001 possession (Score: 69-75)
Dirk Young drives and kicks out. Dejounte McCollum attempts a 3Pt. Wide open! Kyrie Wagner is 7.1 feet away. [MAN] DEJOUNTE MCCOLLUM MAKES IT! Assist: Cole Ball
Score: 69-78

[01:40] Team_021 possession (Score: 69-78)
Zach Carter attempts a Midrange. Contested by Dirk Young (5.3 feet, ZONE). Zach Carter misses. Rebound secured by Dejounte McCollum.

[01:23] Team_001 possession (Score: 69-78)
Kristaps Ming makes the Dunk and draws the foul on Zach Carter! And-1! Kristaps Ming to the line for 1. [BONUS: 6 team fouls] (Zach Carter: 3 personal fouls)   FT 1/1: MISS Kristaps Ming makes 0/1 from the line. Rebound secured by Zach Carter.
Score: 69-80

[01:11] Team_021 possession (Score: 69-80)
Kyrie Wagner attempts a 3Pt. Contested by Dejounte McCollum (5.1 feet, MAN). Kyrie Wagner misses. Rebound secured by Kristaps Ming.

[00:59] Team_001 possession (Score: 69-80)
FOUL! Shooting foul on Kyrie Leonard. Kristaps Ming to the line for 2 free throws. [BONUS: 7 team fouls] (Kyrie Leonard: 3 personal fouls)   FT 1/2: GOOD   FT 2/2: GOOD Kristaps Ming makes 2/2 from the line.
Score: 69-82

[00:46] Team_021 possession (Score: 69-82)
Karl Bridges drives to the basket... Karl Bridges loses the ball! Stripped by Dejounte McCollum! TURNOVER! (live ball)

[00:29] Team_001 possession (Score: 69-82)
Dejounte McCollum attempts a 3Pt. Wide open! Kyrie Wagner is 6.6 feet away. [ZONE] Dejounte McCollum misses. Rebound secured by Zach Carter.

[00:15] Team_021 possession (Score: 69-82)
Kyrie Leonard attempts a Layup. Contested by Klay Harden (2.0 feet, MAN). KYRIE LEONARD MAKES IT! Assist: Karl Bridges
Score: 71-82

================================================================================
                              3RD QUARTER COMPLETE                              
================================================================================

3RD QUARTER SCORE: Team_021 21, Team_001 25

BOX SCORE:
================================================================================

Team_021
--------------------------------------------------------------------------------
Player                MIN  PTS  REB  AST  TO      FG   FG%      3P   3P%
--------------------------------------------------------------------------------
Kyrie Wagner           27   11    0    0   0   5/8    62.5     0/0   0.0
Zach Carter            27    5    3    2   0   2/4    50.0     0/0   0.0
Kyrie Leonard          27    4    4    0   0   2/2   100.0     0/0   0.0
Karl Bridges           27    1    0    2   0   1/3    33.3     0/0   0.0
Anthony Oladipo        27    0    2    0   0   0/1     0.0     0/0   0.0

TEAM: FG: 10/18 (55.6%), 3PT: 1/6 (16.7%), REB: 9 (2 off, 7 def), AST: 4, TO: 5
TEAM FOULS: 7 [Team_001 in BONUS]


Team_001
--------------------------------------------------------------------------------
Player                MIN  PTS  REB  AST  TO      FG   FG%      3P   3P%
--------------------------------------------------------------------------------
Dirk Young             27    7    0    0   0   3/4    75.0     0/0   0.0
Miles Griffin          24    6    2    0   0   3/3   100.0     0/0   0.0
Klay Harden            27    3    0    1   0   1/1   100.0     0/0   0.0
Dejounte McCollum      27    3    3    1   0   1/4    25.0     0/0   0.0
Cole Ball              27    2    3    1   0   1/3    33.3     0/0   0.0
Kristaps Ming          12    2    1    0   0   1/2    50.0     0/0   0.0

TEAM: FG: 10/17 (58.8%), 3PT: 1/3 (33.3%), REB: 9 (1 off, 8 def), AST: 3, TO: 5
TEAM FOULS: 5 [Team_021 in BONUS]

================================================================================

================================================================================
                       4TH QUARTER - Team_021 vs Team_001                       
================================================================================

[12:00] Substitution (Team_021): Kyrie Leonard OUT (stamina: 70) → Joel LaVine IN (comeback_detected)

[12:00] Substitution (Team_001): Klay Harden OUT (stamina: 68) → Ja Dosunmu IN (comeback_detected)

[12:00] Team_021 possession (Score: 71-82)
Karl Bridges throws a bad pass! Stolen by Cole Ball! TURNOVER! (live ball)

[11:50] Team_001 possession (Score: 71-82)
Miles Griffin drives, Zach Carter stays with him. Miles Griffin attempts a Layup. Heavily contested by Zach Carter (0.5 feet, MAN)! MILES GRIFFIN MAKES IT!
Score: 71-84

[11:33] Team_021 possession (Score: 71-84)
Joel LaVine makes the Layup and draws the foul on Ja Dosunmu! And-1! Joel LaVine to the line for 1. [Team fouls: 1] (Ja Dosunmu: 1 personal fouls)   FT 1/1: GOOD Joel LaVine makes 1/1 from the line.
Score: 74-84

[11:18] Team_001 possession (Score: 74-84)
Cole Ball drives to the basket... Cole Ball loses control! Ball rolls out of bounds! TURNOVER! (dead ball)

[11:18] Substitution (Team_021): Anthony Oladipo OUT → Victor Mitchell IN (stamina_rule2)

[11:18] Substitution (Team_021): Karl Bridges OUT → Paul Allen IN (stamina_rule2)

[11:18] Substitution (Team_021): Kyrie Wagner OUT → Vince George IN (stamina_rule2)

[11:18] Substitution (Team_021): Zach Carter OUT → Magic Ingram IN (stamina_rule2)

[11:18] Substitution (Team_001): Dirk Young OUT → Rudy George IN (stamina_rule2)

[11:18] Substitution (Team_001): Cole Ball OUT → Larry Trent IN (stamina_rule2)

[11:18] Substitution (Team_001): Dejounte McCollum OUT → Franz Bryant IN (stamina_rule2)

[11:01] Team_021 possession (Score: 74-84)
Vince George drives to the basket... Vince George throws a bad pass! Stolen by Franz Bryant! TURNOVER! (live ball)

[10:47] Team_001 possession (Score: 74-84)
Larry Trent attempts a Midrange. Wide open! Paul Allen is 6.4 feet away. [MAN] LARRY TRENT MAKES IT! Assist: Franz Bryant
Score: 74-86

[10:31] Team_021 possession (Score: 74-86)
Magic Ingram attempts a Layup. Contested by Miles Griffin (2.8 feet, ZONE). MAGIC INGRAM MAKES IT! Assist: Joel LaVine
Score: 76-86

[10:11] Team_001 possession (Score: 76-86)
Franz Bryant drives and kicks out. Miles Griffin attempts a 3Pt. Contested by Magic Ingram (4.2 feet, MAN). MILES GRIFFIN MAKES IT! Assist: Ja Dosunmu
Score: 76-89

[09:52] Team_021 possession (Score: 76-89)
Vince George attempts a Layup. BLOCKED BY MILES GRIFFIN! Ball is loose! Rebound secured by Larry Trent.

[09:38] Team_001 possession (Score: 76-89)
Larry Trent attempts a Midrange. Contested by Vince George (4.7 feet, ZONE). LARRY TRENT MAKES IT! Assist: Miles Griffin
Score: 76-91

[09:22] Team_021 possession (Score: 76-91)
Joel LaVine makes the Layup and draws the foul on Miles Griffin! And-1! Joel LaVine to the line for 1. [Team fouls: 2] (Miles Griffin: 1 personal fouls)   FT 1/1: GOOD Joel LaVine makes 1/1 from the line.
Score: 79-91

[09:06] Team_001 possession (Score: 79-91)
Miles Griffin attempts a Layup. Contested by Magic Ingram (5.7 feet, ZONE). MILES GRIFFIN MAKES IT! Assist: Rudy George
Score: 79-93

[08:51] Team_021 possession (Score: 79-93)
Joel LaVine loses control! Ball rolls out of bounds! TURNOVER! (dead ball)

[08:51] Substitution (Team_001): Miles Griffin OUT → Kristaps Ming IN (stamina_rule2)

[08:35] Team_001 possession (Score: 79-93)
FOUL! Offensive foul on Kristaps Ming! Magic Ingram drew the charge! [Team fouls: 3] (Kristaps Ming: 1 personal fouls) TURNOVER! (dead ball)

[08:24] Team_021 possession (Score: 79-93)
Joel LaVine attempts a Midrange. Contested by Franz Bryant (3.4 feet, ZONE). Joel LaVine misses. Rebound secured by Rudy George.

[08:13] Team_001 possession (Score: 79-93)
FOUL! Holding foul on Joel LaVine. [Team fouls: 1] No free throws, side out. (Joel LaVine: 1 personal fouls)

[08:00] Team_001 possession (Score: 79-93)
Rudy George attempts a Layup. BLOCKED BY VICTOR MITCHELL! Ball deflects out of bounds off Rudy George.

[07:43] Team_021 possession (Score: 79-93)
Victor Mitchell drives, Franz Bryant stays with him. Victor Mitchell attempts a Layup. Heavily contested by Franz Bryant (1.1 feet, ZONE)! Victor Mitchell misses. Rebound secured by Rudy George.

[07:33] Team_001 possession (Score: 79-93)
Franz Bryant attempts a 3Pt. Wide open! Victor Mitchell is 6.6 feet away. [ZONE] FRANZ BRYANT MAKES IT!
Score: 79-96

[07:19] Team_021 possession (Score: 79-96)
Vince George makes the Layup and draws the foul on Rudy George! And-1! Vince George to the line for 1. [Team fouls: 4] (Rudy George: 1 personal fouls)   FT 1/1: GOOD Vince George makes 1/1 from the line.
Score: 82-96

[07:09] Team_001 possession (Score: 82-96)
Larry Trent drives, picks up Paul Allen. Help arrives from Victor Mitchell! Larry Trent attempts a Dunk. Contested by Victor Mitchell (5.1 feet, MAN). LARRY TRENT MAKES IT!
Score: 82-98

[06:54] Team_021 possession (Score: 82-98)
Magic Ingram attempts a Layup. Wide open! Kristaps Ming is 7.0 feet away. [MAN] MAGIC INGRAM MAKES IT! Assist: Vince George
Score: 84-98

[06:39] Team_001 possession (Score: 84-98)
Larry Trent attempts a 3Pt. Contested by Victor Mitchell (3.9 feet, ZONE). LARRY TRENT MAKES IT! Assist: Kristaps Ming
Score: 84-101

[06:26] Team_021 possession (Score: 84-101)
Joel LaVine attempts a Layup. Heavily contested by Ja Dosunmu (0.5 feet, MAN)! JOEL LAVINE MAKES IT! Assist: Paul Allen
Score: 86-101

[06:12] Team_001 possession (Score: 86-101)
Larry Trent drives, picks up Paul Allen. Help arrives from Victor Mitchell! Larry Trent attempts a Dunk. Wide open! Victor Mitchell is 7.1 feet away. [MAN] Larry Trent misses. Rebound secured by Victor Mitchell.

[05:57] Team_021 possession (Score: 86-101)
Victor Mitchell makes the Midrange and draws the foul on Rudy George! And-1! Victor Mitchell to the line for 1. [BONUS: 5 team fouls] (Rudy George: 2 personal fouls)   FT 1/1: GOOD Victor Mitchell makes 1/1 from the line.
Score: 89-101

[05:45] Team_001 possession (Score: 89-101)
Kristaps Ming drives to the basket... FOUL! Offensive foul on Kristaps Ming! Magic Ingram drew the charge! [Team fouls: 6] (Kristaps Ming: 2 personal fouls) TURNOVER! (dead ball)

[05:26] Team_021 possession (Score: 89-101)
FOUL! Reach-in foul on Franz Bryant during the drive. [IN THE BONUS! 7 team fouls] Vince George to the line for 2 free throws. (Franz Bryant: 1 personal fouls)   FT 1/2: GOOD   FT 2/2: GOOD Vince George makes 2/2 from the line.
Score: 91-101

[05:12] Team_001 possession (Score: 91-101)
Franz Bryant attempts a Midrange. Contested by Vince George (4.6 feet, MAN). Franz Bryant misses. Rebound secured by Magic Ingram.

[04:55] Team_021 possession (Score: 91-101)
Magic Ingram attempts a 3Pt. Wide open! Kristaps Ming is 10.0 feet away. [MAN] Magic Ingram misses. Rebound secured by Larry Trent.

[04:41] Team_001 possession (Score: 91-101)
Larry Trent attempts a 3Pt. Contested by Victor Mitchell (2.0 feet, ZONE). Larry Trent misses. Rebound secured by Vince George.

[04:26] Team_021 possession (Score: 91-101)
Joel LaVine attempts a 3Pt. Contested by Ja Dosunmu (2.9 feet, MAN). Joel LaVine misses. Offensive rebound by Vince George! Vince George kicks it out.

[04:10] Team_021 possession (Score: 91-101)
Magic Ingram attempts a Midrange. Contested by Larry Trent (4.1 feet, ZONE). MAGIC INGRAM MAKES IT! Assist: Vince George
Score: 93-101

[03:56] Team_001 possession (Score: 93-101)
Larry Trent attempts a 3Pt. Contested by Victor Mitchell (5.8 feet, ZONE). Larry Trent misses. Rebound secured by Victor Mitchell.

[03:45] Team_021 possession (Score: 93-101)
Victor Mitchell attempts a 3Pt. Contested by Ja Dosunmu (4.9 feet, ZONE). Victor Mitchell misses. Offensive rebound by Vince George! Vince George kicks it out.

[03:31] Team_021 possession (Score: 93-101)
Joel LaVine attempts a 3Pt. Contested by Ja Dosunmu (2.9 feet, MAN). JOEL LAVINE MAKES IT! Assist: Victor Mitchell
Score: 96-101

[03:17] Team_001 possession (Score: 96-101)
Ja Dosunmu drives and kicks out. Ja Dosunmu attempts a 3Pt. Contested by Victor Mitchell (4.4 feet, ZONE). JA DOSUNMU MAKES IT! Assist: Kristaps Ming
Score: 96-104

[03:05] Team_021 possession (Score: 96-104)
Vince George attempts a 3Pt. Wide open! Ja Dosunmu is 6.2 feet away. [ZONE] Vince George misses. FOUL! Loose ball foul on Rudy George during the rebound battle. [IN THE BONUS! 8 team fouls] Vince George to the line for 2 free throws. (Rudy George: 3 personal fouls)   FT 1/2: MISS   FT 2/2: GOOD Vince George makes 1/2 from the line.
Score: 97-104

[02:54] Team_001 possession (Score: 97-104)
FOUL! Shooting foul on Victor Mitchell. Rudy George to the line for 3 free throws. [Team fouls: 2] (Victor Mitchell: 1 personal fouls)   FT 1/3: GOOD   FT 2/3: GOOD   FT 3/3: GOOD Rudy George makes 3/3 from the line.
Score: 97-107

[02:41] Team_021 possession (Score: 97-107)
Joel LaVine drives to the basket... Joel LaVine throws a bad pass! Stolen by Ja Dosunmu! TURNOVER! (live ball)

[02:28] Team_001 possession (Score: 97-107)
Franz Bryant attempts a Midrange. Contested by Vince George (5.2 feet, MAN). Franz Bryant misses. Rebound secured by Magic Ingram.

[02:11] Team_021 possession (Score: 97-107)
FOUL! Reach-in foul on Franz Bryant during the drive. [IN THE BONUS! 9 team fouls] Vince George to the line for 2 free throws. (Franz Bryant: 2 personal fouls)   FT 1/2: GOOD   FT 2/2: GOOD Vince George makes 2/2 from the line.
Score: 99-107

[01:59] Team_001 possession (Score: 99-107)
Larry Trent makes the Layup and draws the foul on Victor Mitchell! And-1! Larry Trent to the line for 1. [Team fouls: 3] (Victor Mitchell: 2 personal fouls)   FT 1/1: GOOD Larry Trent makes 1/1 from the line.
Score: 99-110

[01:46] Team_021 possession (Score: 99-110)
Victor Mitchell attempts a 3Pt. Contested by Franz Bryant (5.9 feet, ZONE). Victor Mitchell misses. Rebound secured by Larry Trent.

[01:28] Team_001 possession (Score: 99-110)
Kristaps Ming drives, Magic Ingram stays with him. Kristaps Ming attempts a Layup. Wide open! Magic Ingram is 6.4 feet away. [MAN] KRISTAPS MING MAKES IT! Assist: Ja Dosunmu
Score: 99-112

[01:14] Team_021 possession (Score: 99-112)
Paul Allen attempts a 3Pt. Contested by Ja Dosunmu (2.3 feet, ZONE). PAUL ALLEN MAKES IT! Assist: Magic Ingram
Score: 102-112

[01:01] Team_001 possession (Score: 102-112)
Ja Dosunmu attempts a Midrange. Wide open! Joel LaVine is 10.0 feet away. [MAN] Ja Dosunmu misses. Rebound secured by Magic Ingram.

[00:48] Team_021 possession (Score: 102-112)
Victor Mitchell attempts a 3Pt. Contested by Rudy George (4.4 feet, MAN). Victor Mitchell misses. Rebound secured by Rudy George.

[00:37] Team_001 possession (Score: 102-112)
Larry Trent attempts a 3Pt. Wide open! Paul Allen is 8.0 feet away. [MAN] Larry Trent misses. FOUL! Loose ball foul on Vince George during the rebound battle. [Team fouls: 4] No free throws, side out. (Vince George: 1 personal fouls)

[00:24] Team_001 possession (Score: 102-112)
Franz Bryant attempts a Midrange. Contested by Vince George (4.6 feet, MAN). FRANZ BRYANT MAKES IT! Assist: Larry Trent
Score: 102-114

[00:12] Team_021 possession (Score: 102-114)
Victor Mitchell drives to the basket... Victor Mitchell loses the ball! Stripped by Franz Bryant! TURNOVER! (live ball)

================================================================================
                              4TH QUARTER COMPLETE                              
================================================================================

4TH QUARTER SCORE: Team_021 31, Team_001 32

BOX SCORE:
================================================================================

Team_021
--------------------------------------------------------------------------------
Player                MIN  PTS  REB  AST  TO      FG   FG%      3P   3P%
--------------------------------------------------------------------------------
Joel LaVine            22   11    0    1   0   4/5    80.0     0/0   0.0
Vince George           21    8    3    2   0   4/5    80.0     0/0   0.0
Magic Ingram           21    6    3    1   0   3/4    75.0     0/0   0.0
Victor Mitchell        20    3    2    1   0   1/4    25.0     0/0   0.0
Paul Allen             21    3    0    1   0   1/1   100.0     0/0   0.0

TEAM: FG: 13/19 (68.4%), 3PT: 3/6 (50.0%), REB: 8 (2 off, 6 def), AST: 6, TO: 5
TEAM FOULS: 4


Team_001
--------------------------------------------------------------------------------
Player                MIN  PTS  REB  AST  TO      FG   FG%      3P   3P%
--------------------------------------------------------------------------------
Larry Trent            20   12    4    1   0   5/8    62.5     0/0   0.0
Miles Griffin          27    7    0    1   0   3/3   100.0     0/0   0.0
Franz Bryant           20    5    0    1   0   2/4    50.0     0/0   0.0
Ja Dosunmu             22    3    0    2   0   1/2    50.0     0/0   0.0
Rudy George            21    3    3    1   0   1/2    50.0     0/0   0.0
Kristaps Ming          21    2    0    2   0   1/1   100.0     0/0   0.0

TEAM: FG: 13/20 (65.0%), 3PT: 3/5 (60.0%), REB: 7 (1 off, 6 def), AST: 8, TO: 3
TEAM FOULS: 9 [Team_021 in BONUS]

================================================================================

================================================================================
                               FULL GAME COMPLETE                               
================================================================================

FINAL SCORE: Team_021 102, Team_001 114

SCORING BY QUARTER:
--------------------------------------------------------------------------------
Team                     Q1     Q2     Q3     Q4    FINAL
--------------------------------------------------------------------------------
Team_021                 31     19     21     31      102
Team_001                 27     30     25     32      114
--------------------------------------------------------------------------------

FULL GAME BOX SCORE:
================================================================================

Team_021
--------------------------------------------------------------------------------
Player                MIN  PTS  REB  AST  TO      FG   FG%      3P   3P%      FT STL BLK
--------------------------------------------------------------------------------
Anthony Oladipo        28    8    4    1   1   3/4    75.0   1/2    50.0   1/1     0   0
Karl Bridges           28   11    0    2   3   4/8    50.0   2/5    40.0   4/5     0   0
Kyrie Wagner           28   16    0    4   1   7/13   53.8   0/5     0.0   4/5     1   0
Zach Carter            28    9    9    5   5   5/9    55.6   1/1   100.0   0/0     1   1
Kyrie Leonard          27    9    8    2   2   4/6    66.7   1/3    33.3   0/0     1   0
Joel LaVine            22   11    0    3   1   4/8    50.0   1/3    33.3   2/2     0   0
Paul Allen             21    9    0    2   2   3/3   100.0   3/3   100.0   0/0     0   0
Vince George           21    8    6    2   0   4/5    80.0   1/1   100.0   6/7     1   0
Magic Ingram           21   13    6    1   3   6/7    85.7   0/1     0.0   1/1     0   1
Victor Mitchell        20    5    2    1   1   2/7    28.6   0/3     0.0   1/1     1   1

TEAM: FG: 42/70 (60.0%), 3PT: 10/27 (37.0%), REB: 35 (10 off, 25 def), AST: 23, TO: 19


Team_001
--------------------------------------------------------------------------------
Player                MIN  PTS  REB  AST  TO      FG   FG%      3P   3P%      FT STL BLK
--------------------------------------------------------------------------------
Cole Ball              28    8    6    2   2   4/7    57.1   0/2     0.0   0/0     1   0
Dejounte McCollum      28   14    5    1   1   5/10   50.0   1/4    25.0   0/0     2   0
Dirk Young             28   14    0    2   3   6/7    85.7   2/2   100.0   7/7     1   0
Miles Griffin          27   15    7    2   2   6/10   60.0   0/2     0.0   2/2     0   1
Klay Harden            27    8    0    4   2   3/5    60.0   2/2   100.0   2/2     0   0
Ja Dosunmu             22    8    0    6   0   3/4    75.0   1/1   100.0   3/4     1   1
Kristaps Ming          21    6    3    3   1   3/6    50.0   0/0     0.0   2/4     1   0
Rudy George            21    8    4    2   1   3/4    75.0   1/1   100.0   4/4     0   0
Larry Trent            20   23   10    1   1   9/12   75.0   2/4    50.0   3/3     1   0
Franz Bryant           20    5    0    2   2   4/6    66.7   1/1   100.0   0/0     2   0

TEAM: FG: 46/72 (63.9%), 3PT: 10/19 (52.6%), REB: 35 (7 off, 28 def), AST: 25, TO: 15

================================================================================
