================================================================================
                        FULL GAME - Team_092 vs Team_066                        
================================================================================

================================================================================
                       1ST QUARTER - Team_092 vs Team_066                       
================================================================================

[12:00] Team_092 possession (Score: 0-0)
Immanuel Ingram drives, Kyle Wagner stays with him. Immanuel Ingram attempts a Layup. Contested by Kyle Wagner (3.3 feet, MAN). Immanuel Ingram misses. Rebound secured by Yao Brogdon.

[11:47] Team_066 possession (Score: 0-0)
Yao Brogdon makes the Dunk and draws the foul on Austin Bridges! And-1! Yao Brogdon to the line for 1. [Team fouls: 1] (Austin Bridges: 1 personal fouls)   FT 1/1: GOOD Yao Brogdon makes 1/1 from the line.
Score: 0-3

[11:35] Team_092 possession (Score: 0-3)
Immanuel Ingram drives, Kyle Wagner stays with him. Immanuel Ingram attempts a Layup. Contested by Kyle Wagner (3.1 feet, MAN). Immanuel Ingram misses. Rebound secured by Yao Brogdon.

[11:20] Team_066 possession (Score: 0-3)
Brandon Reaves attempts a 3Pt. Wide open! Austin Bridges is 7.8 feet away. [ZONE] BRANDON REAVES MAKES IT! Assist: Jimmy Davis
Score: 0-6

[11:06] Team_092 possession (Score: 0-6)
John Giddey attempts a Layup. Wide open! Yao Brogdon is 6.4 feet away. [MAN] John Giddey misses. Rebound secured by Kyle Wagner.

[10:50] Team_066 possession (Score: 0-6)
Kyle Wagner drives, picks up Immanuel Ingram. Help arrives from Austin Bridges! Kyle Wagner attempts a Layup. Heavily contested by Austin Bridges (1.9 feet, MAN)! KYLE WAGNER MAKES IT! Assist: Brandon Reaves
Score: 0-8

[10:39] Team_092 possession (Score: 0-8)
John Giddey attempts a Midrange. Contested by Yao Brogdon (4.8 feet, ZONE). John Giddey misses. Rebound secured by Brandon Reaves.

[10:24] Team_066 possession (Score: 0-8)
Jimmy Davis attempts a Layup. Contested by Austin Bridges (2.3 feet, MAN). JIMMY DAVIS MAKES IT! Assist: Pau Curry
Score: 0-10

[10:10] Team_092 possession (Score: 0-10)
Austin Bridges drives, Kyle Wagner stays with him. Austin Bridges attempts a Layup. Heavily contested by Kyle Wagner (0.5 feet, ZONE)! Austin Bridges misses. Rebound secured by Yao Brogdon.

[09:57] Team_066 possession (Score: 0-10)
FOUL! Reach-in foul on John Giddey during the drive. [Team fouls: 2] No free throws, side out. (John Giddey: 1 personal fouls)

[09:38] Team_066 possession (Score: 0-10)
FOUL! Reach-in foul on Austin Bridges during the drive. [Team fouls: 3] No free throws, side out. (Austin Bridges: 2 personal fouls)

[09:25] Team_066 possession (Score: 0-10)
Brandon Reaves attempts a 3Pt. Contested by John Giddey (3.0 feet, ZONE). BRANDON REAVES MAKES IT! Assist: Jimmy Davis
Score: 0-13

[09:09] Team_092 possession (Score: 0-13)
Immanuel Ingram attempts a Midrange. Wide open! Brandon Reaves is 6.3 feet away. [ZONE] IMMANUEL INGRAM MAKES IT!
Score: 2-13

[08:53] Team_066 possession (Score: 2-13)
Yao Brogdon attempts a Midrange. Contested by John Giddey (2.2 feet, MAN). Yao Brogdon misses. Offensive rebound by Kyle Wagner! Kyle Wagner kicks it out.

[08:41] Team_066 possession (Score: 2-13)
Jimmy Davis attempts a Layup. Contested by John Giddey (2.4 feet, ZONE). Jimmy Davis misses. Rebound secured by Paul James.

[08:25] Team_092 possession (Score: 2-13)
Immanuel Ingram drives, Kyle Wagner stays with him. Immanuel Ingram attempts a Dunk. Heavily contested by Kyle Wagner (0.5 feet, MAN)! IMMANUEL INGRAM MAKES IT!
Score: 4-13

[08:11] Team_066 possession (Score: 4-13)
Yao Brogdon loses the ball! Stripped by John Giddey! TURNOVER! (live ball)

[07:53] Team_092 possession (Score: 4-13)
John Giddey drives, Yao Brogdon stays with him. John Giddey attempts a Layup. Contested by Yao Brogdon (3.9 feet, MAN). John Giddey misses. Offensive rebound by Paul James! Paul James kicks it out.

[07:37] Team_092 possession (Score: 4-13)
Paul James attempts a 3Pt. Wide open! Pau Curry is 7.1 feet away. [ZONE] PAUL JAMES MAKES IT! Assist: Austin Bridges
Score: 7-13

[07:25] Team_066 possession (Score: 7-13)
FOUL! Shooting foul on Karl Gobert. Pau Curry to the line for 2 free throws. [Team fouls: 4] (Karl Gobert: 1 personal fouls)   FT 1/2: GOOD   FT 2/2: GOOD Pau Curry makes 2/2 from the line.
Score: 7-15

[07:16] Team_092 possession (Score: 7-15)
John Giddey attempts a 3Pt. Wide open! Pau Curry is 9.3 feet away. [ZONE] JOHN GIDDEY MAKES IT!
Score: 10-15

[07:02] Team_066 possession (Score: 10-15)
Brandon Reaves drives to the basket... Brandon Reaves throws a bad pass out of bounds! TURNOVER! (dead ball)

[06:50] Team_092 possession (Score: 10-15)
Austin Bridges attempts a Midrange. Contested by Brandon Reaves (5.4 feet, ZONE). AUSTIN BRIDGES MAKES IT! Assist: John Giddey
Score: 12-15

[06:39] Team_066 possession (Score: 12-15)
Yao Brogdon drives, picks up John Giddey. Help arrives from Austin Bridges! Yao Brogdon attempts a Dunk. Contested by Austin Bridges (3.5 feet, MAN). Yao Brogdon misses. Offensive rebound by Yao Brogdon! Yao Brogdon kicks it out.

[06:25] Team_066 possession (Score: 12-15)
Brandon Reaves drives and kicks out. Brandon Reaves attempts a Midrange. Contested by John Giddey (4.2 feet, ZONE). Brandon Reaves misses. Offensive rebound by Kyle Wagner! Kyle Wagner kicks it out.

[06:13] Team_066 possession (Score: 12-15)
Yao Brogdon attempts a Midrange. Contested by John Giddey (4.9 feet, MAN). Yao Brogdon misses. Rebound secured by Immanuel Ingram.

[06:00] Team_092 possession (Score: 12-15)
John Giddey attempts a Midrange. Contested by Yao Brogdon (3.3 feet, ZONE). John Giddey misses. Rebound secured by Brandon Reaves.

[05:45] Team_066 possession (Score: 12-15)
Brandon Reaves drives and kicks out. Kyle Wagner attempts a 3Pt. Contested by Immanuel Ingram (2.6 feet, MAN). Kyle Wagner misses. Rebound secured by Paul James.

[05:35] Team_092 possession (Score: 12-15)
Paul James drives and kicks out. John Giddey attempts a 3Pt. Heavily contested by Yao Brogdon (1.7 feet, MAN)! John Giddey misses. Rebound secured by Brandon Reaves.

[05:21] Team_066 possession (Score: 12-15)
Kyle Wagner attempts a Layup. BLOCKED BY JOHN GIDDEY! Ball is loose! Rebound secured by Immanuel Ingram.

[05:06] Team_092 possession (Score: 12-15)
Immanuel Ingram attempts a Layup. Contested by Kyle Wagner (4.9 feet, ZONE). Immanuel Ingram misses. Rebound secured by Yao Brogdon.

[04:54] Team_066 possession (Score: 12-15)
Yao Brogdon attempts a Midrange. Wide open! John Giddey is 7.1 feet away. [ZONE] Yao Brogdon misses. Rebound secured by John Giddey.

[04:40] Team_092 possession (Score: 12-15)
Immanuel Ingram attempts a 3Pt. Contested by Pau Curry (5.5 feet, ZONE). Immanuel Ingram misses. Rebound secured by Kyle Wagner.

[04:25] Team_066 possession (Score: 12-15)
Yao Brogdon attempts a 3Pt. Contested by John Giddey (3.4 feet, ZONE). Yao Brogdon misses. FOUL! Loose ball foul on Paul James during the rebound battle. [IN THE BONUS! 5 team fouls] Yao Brogdon to the line for 2 free throws. (Paul James: 1 personal fouls)   FT 1/2: GOOD   FT 2/2: GOOD Yao Brogdon makes 2/2 from the line.
Score: 12-17

[04:11] Team_092 possession (Score: 12-17)
Immanuel Ingram loses control! Ball rolls out of bounds! TURNOVER! (dead ball)

[03:54] Team_066 possession (Score: 12-17)
FOUL! Reach-in foul on Immanuel Ingram during the drive. [IN THE BONUS! 6 team fouls] Kyle Wagner to the line for 2 free throws. (Immanuel Ingram: 1 personal fouls)   FT 1/2: GOOD   FT 2/2: GOOD Kyle Wagner makes 2/2 from the line.
Score: 12-19

[03:39] Team_092 possession (Score: 12-19)
Paul James drives to the basket... Paul James commits a violation (traveling/carry)! TURNOVER! (dead ball)

[03:24] Team_066 possession (Score: 12-19)
Yao Brogdon drives, John Giddey stays with him. Yao Brogdon attempts a Dunk. Heavily contested by John Giddey (0.5 feet, MAN)! YAO BROGDON MAKES IT! Assist: Jimmy Davis
Score: 12-21

[03:09] Team_092 possession (Score: 12-21)
Austin Bridges drives, Jimmy Davis stays with him. Austin Bridges attempts a Dunk. Heavily contested by Jimmy Davis (1.1 feet, MAN)! AUSTIN BRIDGES MAKES IT! Assist: Immanuel Ingram
Score: 14-21

[02:56] Team_066 possession (Score: 14-21)
FOUL! Shooting foul on Austin Bridges. Kyle Wagner to the line for 2 free throws. [BONUS: 7 team fouls] (Austin Bridges: 3 personal fouls)   FT 1/2: GOOD   FT 2/2: GOOD Kyle Wagner makes 2/2 from the line.
Score: 14-23

[02:38] Team_092 possession (Score: 14-23)
John Giddey makes the Dunk and draws the foul on Yao Brogdon! And-1! John Giddey to the line for 1. [Team fouls: 1] (Yao Brogdon: 1 personal fouls)   FT 1/1: GOOD John Giddey makes 1/1 from the line.
Score: 17-23

[02:19] Team_066 possession (Score: 17-23)
Kyle Wagner attempts a Layup. BLOCKED BY JOHN GIDDEY! Ball is loose! Offensive rebound by Kyle Wagner! Kyle Wagner kicks it out.

[02:07] Team_066 possession (Score: 17-23)
Kyle Wagner drives, Immanuel Ingram stays with him. Kyle Wagner attempts a Dunk. Contested by Immanuel Ingram (2.9 feet, MAN). KYLE WAGNER MAKES IT! Assist: Pau Curry
Score: 17-25

[01:50] Team_092 possession (Score: 17-25)
Karl Gobert throws a bad pass out of bounds! TURNOVER! (dead ball)

[01:50] Substitution (Team_092): Austin Bridges OUT → Bones Giddey IN (stamina_rule2)

[01:50] Substitution (Team_092): Karl Gobert OUT → Shaquille Russell IN (stamina_rule2)

[01:50] Substitution (Team_092): Paul James OUT → Vince Harris IN (stamina_rule2)

[01:50] Substitution (Team_092): John Giddey OUT → Shaquille Paul IN (stamina_rule2)

[01:50] Substitution (Team_092): Immanuel Ingram OUT → Pau Reaves IN (stamina_rule2)

[01:50] Substitution (Team_066): Jimmy Davis OUT → Pascal Carter IN (stamina_rule2)

[01:50] Substitution (Team_066): Pau Curry OUT → Lauri LaVine IN (stamina_rule2)

[01:50] Substitution (Team_066): Brandon Reaves OUT → Brandon Middleton IN (stamina_rule2)

[01:50] Substitution (Team_066): Yao Brogdon OUT → Cole Morant IN (stamina_rule2)

[01:50] Substitution (Team_066): Kyle Wagner OUT → Donovan Simmons IN (stamina_rule2)

[01:32] Team_066 possession (Score: 17-25)
Brandon Middleton attempts a Midrange. Contested by Shaquille Paul (5.9 feet, ZONE). Brandon Middleton misses. Rebound secured by Shaquille Paul.

[01:15] Team_092 possession (Score: 17-25)
Pau Reaves attempts a Midrange. Contested by Cole Morant (4.2 feet, ZONE). PAU REAVES MAKES IT!
Score: 19-25

[01:02] Team_066 possession (Score: 19-25)
Brandon Middleton drives, Vince Harris stays with him. Brandon Middleton attempts a Layup. Heavily contested by Vince Harris (1.5 feet, MAN)! BRANDON MIDDLETON MAKES IT!
Score: 19-27

[00:49] Team_092 possession (Score: 19-27)
Bones Giddey drives and kicks out. Vince Harris attempts a 3Pt. Contested by Brandon Middleton (3.1 feet, MAN). VINCE HARRIS MAKES IT! Assist: Shaquille Russell
Score: 22-27

[00:35] Team_066 possession (Score: 22-27)
Brandon Middleton attempts a 3Pt. Contested by Bones Giddey (3.3 feet, ZONE). Brandon Middleton misses. Rebound secured by Shaquille Paul.

[00:17] Team_092 possession (Score: 22-27)
Shaquille Paul attempts a Layup. Contested by Cole Morant (3.3 feet, MAN). SHAQUILLE PAUL MAKES IT! Assist: Bones Giddey
Score: 24-27

================================================================================
                              1ST QUARTER COMPLETE                              
================================================================================

1ST QUARTER SCORE: Team_092 24, Team_066 27

BOX SCORE:
================================================================================

Team_092
--------------------------------------------------------------------------------
Player                MIN  PTS  REB  AST  TO      FG   FG%      3P   3P%
--------------------------------------------------------------------------------
John Giddey            10    6    1    1   0   2/5    40.0     0/0   0.0
Immanuel Ingram        10    4    2    1   0   2/6    33.3     0/0   0.0
Austin Bridges         10    4    0    1   0   2/3    66.7     0/0   0.0
Paul James             10    3    3    0   0   1/2    50.0     0/0   0.0
Vince Harris            2    3    0    0   0   1/1   100.0     0/0   0.0
Shaquille Paul          2    2    2    0   0   1/1   100.0     0/0   0.0
Pau Reaves              2    2    0    0   0   1/1   100.0     0/0   0.0
Shaquille Russell       2    0    0    1   0   0/0     0.0     0/0   0.0
Bones Giddey            2    0    0    1   0   0/0     0.0     0/0   0.0

TEAM: FG: 10/19 (52.6%), 3PT: 2/3 (66.7%), REB: 8 (1 off, 7 def), AST: 5, TO: 3
TEAM FOULS: 7 [Team_066 in BONUS]


Team_066
--------------------------------------------------------------------------------
Player                MIN  PTS  REB  AST  TO      FG   FG%      3P   3P%
--------------------------------------------------------------------------------
Kyle Wagner            10    8    5    0   0   4/5    80.0     0/0   0.0
Yao Brogdon            10    7    5    0   0   3/5    60.0     0/0   0.0
Brandon Reaves         10    6    3    1   0   2/3    66.7     0/0   0.0
Jimmy Davis            10    2    0    3   0   1/2    50.0     0/0   0.0
Pau Curry              10    2    0    2   0   1/1   100.0     0/0   0.0
Brandon Middleton       2    2    0    0   0   1/3    33.3     0/0   0.0

TEAM: FG: 12/19 (63.2%), 3PT: 3/4 (75.0%), REB: 13 (4 off, 9 def), AST: 6, TO: 2
TEAM FOULS: 1

================================================================================

================================================================================
                       2ND QUARTER - Team_092 vs Team_066                       
================================================================================

[12:00] Team_092 possession (Score: 24-27)
John Giddey attempts a 3Pt. Contested by Pau Curry (3.7 feet, ZONE). JOHN GIDDEY MAKES IT! Assist: Karl Gobert
Score: 27-27

[11:49] Team_066 possession (Score: 27-27)
Pau Curry attempts a Midrange. Contested by John Giddey (4.3 feet, ZONE). PAU CURRY MAKES IT!
Score: 27-29

[11:32] Team_092 possession (Score: 27-29)
FOUL! Holding foul on Brandon Reaves. [Team fouls: 1] No free throws, side out. (Brandon Reaves: 1 personal fouls)

[11:14] Team_092 possession (Score: 27-29)
Karl Gobert drives and kicks out. Karl Gobert makes the Midrange and draws the foul on Yao Brogdon! And-1! Karl Gobert to the line for 1. [Team fouls: 2] (Yao Brogdon: 1 personal fouls)   FT 1/1: GOOD Karl Gobert makes 1/1 from the line.
Score: 30-29

[10:55] Team_066 possession (Score: 30-29)
FOUL! Reach-in foul on Immanuel Ingram during the drive. [Team fouls: 1] No free throws, side out. (Immanuel Ingram: 1 personal fouls)

[10:37] Team_066 possession (Score: 30-29)
Yao Brogdon attempts a 3Pt. Wide open! John Giddey is 6.6 feet away. [MAN] Yao Brogdon misses. Rebound secured by Immanuel Ingram.

[10:23] Team_092 possession (Score: 30-29)
Austin Bridges attempts a 3Pt. Contested by Pau Curry (5.3 feet, ZONE). AUSTIN BRIDGES MAKES IT! Assist: Paul James
Score: 33-29

[10:09] Team_066 possession (Score: 33-29)
Brandon Reaves makes the Dunk and draws the foul on Austin Bridges! And-1! Brandon Reaves to the line for 1. [Team fouls: 2] (Austin Bridges: 1 personal fouls)   FT 1/1: GOOD Brandon Reaves makes 1/1 from the line.
Score: 33-32

[09:55] Team_092 possession (Score: 33-32)
Austin Bridges drives and kicks out. Paul James attempts a 3Pt. Contested by Brandon Reaves (3.1 feet, MAN). Paul James misses. Rebound secured by Yao Brogdon.

[09:39] Team_066 possession (Score: 33-32)
Jimmy Davis makes the 3Pt and draws the foul on Austin Bridges! And-1! Jimmy Davis to the line for 1. [Team fouls: 3] (Austin Bridges: 2 personal fouls)   FT 1/1: MISS Jimmy Davis makes 0/1 from the line. Rebound secured by Immanuel Ingram.
Score: 33-35

[09:27] Team_092 possession (Score: 33-35)
FOUL! Shooting foul on Pau Curry. Karl Gobert to the line for 3 free throws. [Team fouls: 3] (Pau Curry: 1 personal fouls)   FT 1/3: GOOD   FT 2/3: GOOD   FT 3/3: GOOD Karl Gobert makes 3/3 from the line.
Score: 36-35

[09:13] Team_066 possession (Score: 36-35)
Kyle Wagner attempts a Midrange. Contested by Karl Gobert (2.8 feet, ZONE). Kyle Wagner misses. FOUL! Loose ball foul on Immanuel Ingram during the rebound battle. [Team fouls: 4] No free throws, side out. (Immanuel Ingram: 2 personal fouls)

[08:59] Team_066 possession (Score: 36-35)
FOUL! Reach-in foul on John Giddey during the drive. [IN THE BONUS! 5 team fouls] Yao Brogdon to the line for 2 free throws. (John Giddey: 1 personal fouls)   FT 1/2: GOOD   FT 2/2: MISS Yao Brogdon makes 1/2 from the line. Rebound secured by Immanuel Ingram.
Score: 36-36

[08:44] Team_092 possession (Score: 36-36)
Karl Gobert attempts a 3Pt. Wide open! Brandon Reaves is 6.1 feet away. [ZONE] KARL GOBERT MAKES IT! Assist: Paul James
Score: 39-36

[08:32] Team_066 possession (Score: 39-36)
FOUL! Shooting foul on John Giddey. Yao Brogdon to the line for 2 free throws. [BONUS: 6 team fouls] (John Giddey: 2 personal fouls)   FT 1/2: GOOD   FT 2/2: GOOD Yao Brogdon makes 2/2 from the line.
Score: 39-38

[08:22] Team_092 possession (Score: 39-38)
Karl Gobert drives and kicks out. Paul James attempts a 3Pt. Contested by Pau Curry (4.9 feet, ZONE). PAUL JAMES MAKES IT! Assist: John Giddey
Score: 42-38

[08:10] Team_066 possession (Score: 42-38)
Brandon Reaves drives and kicks out. Pau Curry attempts a Midrange. Wide open! John Giddey is 8.7 feet away. [ZONE] Pau Curry misses. Rebound secured by John Giddey.

[07:53] Team_092 possession (Score: 42-38)
FOUL! Holding foul on Pau Curry. [Team fouls: 4] No free throws, side out. (Pau Curry: 2 personal fouls)

[07:40] Team_092 possession (Score: 42-38)
Karl Gobert attempts a 3Pt. Contested by Pau Curry (6.0 feet, ZONE). KARL GOBERT MAKES IT! Assist: Paul James
Score: 45-38

[07:29] Team_066 possession (Score: 45-38)
FOUL! Reach-in foul on Immanuel Ingram during the drive. [IN THE BONUS! 7 team fouls] Brandon Reaves to the line for 2 free throws. (Immanuel Ingram: 3 personal fouls)   FT 1/2: GOOD   FT 2/2: GOOD Brandon Reaves makes 2/2 from the line.
Score: 45-40

[07:15] Team_092 possession (Score: 45-40)
John Giddey drives and kicks out. John Giddey attempts a 3Pt. Wide open! Pau Curry is 9.4 feet away. [ZONE] John Giddey misses. Rebound secured by Brandon Reaves.

[06:57] Team_066 possession (Score: 45-40)
Pau Curry attempts a Midrange. Wide open! Karl Gobert is 7.2 feet away. [MAN] PAU CURRY MAKES IT! Assist: Kyle Wagner
Score: 45-42

[06:42] Team_092 possession (Score: 45-42)
Immanuel Ingram attempts a 3Pt. Contested by Kyle Wagner (3.9 feet, MAN). Immanuel Ingram misses. Rebound secured by Kyle Wagner.

[06:27] Team_066 possession (Score: 45-42)
Pau Curry attempts a 3Pt. Wide open! Karl Gobert is 6.1 feet away. [MAN] Pau Curry misses. Rebound secured by Immanuel Ingram.

[06:11] Team_092 possession (Score: 45-42)
Austin Bridges drives, picks up Kyle Wagner. Help arrives from Jimmy Davis! Austin Bridges attempts a Layup. Contested by Jimmy Davis (5.7 feet, ZONE). AUSTIN BRIDGES MAKES IT! Assist: Paul James
Score: 47-42

[05:59] Team_066 possession (Score: 47-42)
Yao Brogdon drives, picks up John Giddey. Help arrives from Austin Bridges! Yao Brogdon attempts a Dunk. Heavily contested by Austin Bridges (0.5 feet, MAN)! Yao Brogdon misses. Rebound secured by Paul James.

[05:45] Team_092 possession (Score: 47-42)
Immanuel Ingram attempts a Midrange. Wide open! Pau Curry is 6.8 feet away. [ZONE] Immanuel Ingram misses. Rebound secured by Yao Brogdon.

[05:29] Team_066 possession (Score: 47-42)
Jimmy Davis drives, John Giddey stays with him. Jimmy Davis attempts a Layup. Contested by John Giddey (4.2 feet, ZONE). Jimmy Davis misses. Rebound secured by John Giddey.

[05:16] Team_092 possession (Score: 47-42)
John Giddey drives and kicks out. Immanuel Ingram attempts a Midrange. Contested by Kyle Wagner (5.6 feet, MAN). IMMANUEL INGRAM MAKES IT! Assist: Paul James
Score: 49-42

[05:01] Team_066 possession (Score: 49-42)
Jimmy Davis attempts a 3Pt. Contested by Austin Bridges (5.0 feet, MAN). Jimmy Davis misses. Rebound secured by Immanuel Ingram.

[04:50] Team_092 possession (Score: 49-42)
John Giddey attempts a Layup. BLOCKED BY JIMMY DAVIS! Ball is loose! Offensive rebound by Paul James! Paul James kicks it out.

[04:36] Team_092 possession (Score: 49-42)
Austin Bridges attempts a 3Pt. Wide open! Pau Curry is 7.2 feet away. [ZONE] AUSTIN BRIDGES MAKES IT! Assist: Paul James
Score: 52-42

[04:17] Team_066 possession (Score: 52-42)
Yao Brogdon drives, John Giddey stays with him. Yao Brogdon attempts a Dunk. Contested by John Giddey (4.1 feet, ZONE). YAO BROGDON MAKES IT!
Score: 52-44

[04:00] Team_092 possession (Score: 52-44)
Immanuel Ingram makes the Midrange and draws the foul on Pau Curry! And-1! Immanuel Ingram to the line for 1. [BONUS: 5 team fouls] (Pau Curry: 3 personal fouls)   FT 1/1: GOOD Immanuel Ingram makes 1/1 from the line.
Score: 55-44

[03:42] Team_066 possession (Score: 55-44)
Brandon Reaves attempts a Layup. Contested by John Giddey (3.9 feet, ZONE). BRANDON REAVES MAKES IT! Assist: Yao Brogdon
Score: 55-46

[03:26] Team_092 possession (Score: 55-46)
FOUL! Offensive foul on Immanuel Ingram! Kyle Wagner drew the charge! [Team fouls: 8] (Immanuel Ingram: 4 personal fouls) TURNOVER! (dead ball)

[03:12] Team_066 possession (Score: 55-46)
Yao Brogdon drives, picks up John Giddey. Help arrives from Austin Bridges! Yao Brogdon attempts a Dunk. Contested by Austin Bridges (3.1 feet, MAN). YAO BROGDON MAKES IT! Assist: Pau Curry
Score: 55-48

[02:57] Team_092 possession (Score: 55-48)
FOUL! Holding foul on Yao Brogdon. [IN THE BONUS! 6 team fouls] John Giddey to the line for 2 free throws. (Yao Brogdon: 2 personal fouls)   FT 1/2: GOOD   FT 2/2: GOOD John Giddey makes 2/2 from the line.
Score: 57-48

[02:41] Team_066 possession (Score: 57-48)
Pau Curry attempts a 3Pt. Contested by John Giddey (2.5 feet, ZONE). Pau Curry misses. Rebound secured by Paul James.

[02:29] Team_092 possession (Score: 57-48)
Karl Gobert drives to the basket... Karl Gobert loses the ball! Stripped by Pau Curry! TURNOVER! (live ball)

[02:12] Team_066 possession (Score: 57-48)
Pau Curry drives to the basket... Pau Curry throws a bad pass! Stolen by John Giddey! TURNOVER! (live ball)

[01:57] Team_092 possession (Score: 57-48)
John Giddey attempts a Midrange. Wide open! Pau Curry is 8.7 feet away. [ZONE] John Giddey misses. FOUL! Loose ball foul on Brandon Reaves during the rebound battle. [IN THE BONUS! 7 team fouls] Immanuel Ingram to the line for 2 free throws. (Brandon Reaves: 2 personal fouls)   FT 1/2: GOOD   FT 2/2: GOOD Immanuel Ingram makes 2/2 from the line.
Score: 59-48

[01:44] Team_066 possession (Score: 59-48)
Yao Brogdon makes the 3Pt and draws the foul on John Giddey! And-1! Yao Brogdon to the line for 1. [BONUS: 9 team fouls] (John Giddey: 3 personal fouls)   FT 1/1: GOOD Yao Brogdon makes 1/1 from the line.
Score: 59-52

[01:28] Team_092 possession (Score: 59-52)
Immanuel Ingram attempts a Midrange. Contested by Brandon Reaves (5.1 feet, ZONE). IMMANUEL INGRAM MAKES IT! Assist: John Giddey
Score: 61-52

[01:16] Team_066 possession (Score: 61-52)
Yao Brogdon attempts a 3Pt. Wide open! John Giddey is 7.6 feet away. [ZONE] YAO BROGDON MAKES IT! Assist: Brandon Reaves
Score: 61-55

[01:05] Team_092 possession (Score: 61-55)
Karl Gobert drives and kicks out. Immanuel Ingram attempts a Midrange. Contested by Kyle Wagner (4.0 feet, MAN). IMMANUEL INGRAM MAKES IT! Assist: Austin Bridges
Score: 63-55

[00:51] Team_066 possession (Score: 63-55)
Kyle Wagner attempts a 3Pt. Contested by John Giddey (2.3 feet, ZONE). Kyle Wagner misses. Rebound secured by Paul James.

[00:36] Team_092 possession (Score: 63-55)
FOUL! Shooting foul on Jimmy Davis. Austin Bridges to the line for 2 free throws. [BONUS: 8 team fouls] (Jimmy Davis: 1 personal fouls)   FT 1/2: GOOD   FT 2/2: GOOD Austin Bridges makes 2/2 from the line.
Score: 65-55

[00:21] Team_066 possession (Score: 65-55)
Jimmy Davis attempts a 3Pt. Wide open! Austin Bridges is 8.4 feet away. [MAN] JIMMY DAVIS MAKES IT! Assist: Pau Curry
Score: 65-58

[00:07] Team_092 possession (Score: 65-58)
John Giddey attempts a 3Pt. Wide open! Yao Brogdon is 9.5 feet away. [MAN] JOHN GIDDEY MAKES IT! Assist: Karl Gobert
Score: 68-58

================================================================================
                              2ND QUARTER COMPLETE                              
================================================================================

2ND QUARTER SCORE: Team_092 44, Team_066 31

BOX SCORE:
================================================================================

Team_092
--------------------------------------------------------------------------------
Player                MIN  PTS  REB  AST  TO      FG   FG%      3P   3P%
--------------------------------------------------------------------------------
Karl Gobert            23   12    0    2   0   4/4   100.0     0/0   0.0
Immanuel Ingram        23   11    5    0   0   5/7    71.4     0/0   0.0
Austin Bridges         23   10    0    1   0   4/5    80.0     0/0   0.0
John Giddey            23    8    2    2   0   3/4    75.0     0/0   0.0
Paul James             23    3    4    6   0   1/1   100.0     0/0   0.0

TEAM: FG: 17/21 (81.0%), 3PT: 7/8 (87.5%), REB: 11 (1 off, 10 def), AST: 11, TO: 2
TEAM FOULS: 9 [Team_066 in BONUS]


Team_066
--------------------------------------------------------------------------------
Player                MIN  PTS  REB  AST  TO      FG   FG%      3P   3P%
--------------------------------------------------------------------------------
Yao Brogdon            23   13    3    1   0   5/8    62.5     0/0   0.0
Brandon Reaves         23    7    1    1   0   3/4    75.0     0/0   0.0
Pau Curry              23    4    0    2   0   2/4    50.0     0/0   0.0
Jimmy Davis            23    3    0    0   0   1/4    25.0     0/0   0.0
Kyle Wagner            23    0    1    1   0   0/1     0.0     0/0   0.0

TEAM: FG: 11/21 (52.4%), 3PT: 3/9 (33.3%), REB: 5 (1 off, 4 def), AST: 5, TO: 1
TEAM FOULS: 8 [Team_092 in BONUS]

================================================================================

================================================================================
                       3RD QUARTER - Team_092 vs Team_066                       
================================================================================

[12:00] Team_092 possession (Score: 68-58)
Immanuel Ingram makes the Layup and draws the foul on Kyle Wagner! And-1! Immanuel Ingram to the line for 1. [Team fouls: 1] (Kyle Wagner: 1 personal fouls)   FT 1/1: GOOD Immanuel Ingram makes 1/1 from the line.
Score: 71-58

[11:45] Team_066 possession (Score: 71-58)
FOUL! Holding foul on Paul James. [Team fouls: 1] No free throws, side out. (Paul James: 1 personal fouls)

[11:29] Team_066 possession (Score: 71-58)
Brandon Reaves drives and kicks out. Jimmy Davis attempts a Midrange. Contested by Karl Gobert (2.1 feet, ZONE). JIMMY DAVIS MAKES IT! Assist: Brandon Reaves
Score: 71-60

[11:14] Team_092 possession (Score: 71-60)
Paul James attempts a 3Pt. Wide open! Brandon Reaves is 6.2 feet away. [MAN] PAUL JAMES MAKES IT! Assist: Immanuel Ingram
Score: 74-60

[11:03] Team_066 possession (Score: 74-60)
Brandon Reaves attempts a Midrange. Contested by Paul James (4.7 feet, MAN). Brandon Reaves misses. Rebound secured by Immanuel Ingram.

[10:51] Team_092 possession (Score: 74-60)
Immanuel Ingram drives, picks up Kyle Wagner. Help arrives from Jimmy Davis! Immanuel Ingram attempts a Layup. Heavily contested by Jimmy Davis (1.3 feet, MAN)! IMMANUEL INGRAM MAKES IT!
Score: 76-60

[10:36] Team_066 possession (Score: 76-60)
Jimmy Davis attempts a Midrange. Contested by Austin Bridges (5.7 feet, MAN). Jimmy Davis misses. Rebound secured by Paul James.

[10:20] Team_092 possession (Score: 76-60)
Immanuel Ingram drives, picks up Kyle Wagner. Help arrives from Jimmy Davis! Immanuel Ingram attempts a Dunk. Contested by Jimmy Davis (2.7 feet, MAN). IMMANUEL INGRAM MAKES IT! Assist: Paul James
Score: 78-60

[10:10] Team_066 possession (Score: 78-60)
Yao Brogdon attempts a 3Pt. Wide open! Karl Gobert is 6.5 feet away. [ZONE] Yao Brogdon misses. Offensive rebound by Kyle Wagner! Kyle Wagner kicks it out.

[09:55] Team_066 possession (Score: 78-60)
Jimmy Davis drives to the basket... Jimmy Davis loses the ball! Stripped by Austin Bridges! TURNOVER! (live ball)

[09:44] Team_092 possession (Score: 78-60)
Austin Bridges drives, Kyle Wagner stays with him. Austin Bridges attempts a Layup. Contested by Kyle Wagner (2.4 feet, ZONE). Austin Bridges misses. Rebound secured by Yao Brogdon.

[09:30] Team_066 possession (Score: 78-60)
Jimmy Davis drives to the basket... Jimmy Davis throws a bad pass out of bounds! TURNOVER! (dead ball)

[09:14] Team_092 possession (Score: 78-60)
John Giddey attempts a 3Pt. Contested by Pau Curry (4.1 feet, ZONE). JOHN GIDDEY MAKES IT! Assist: Paul James
Score: 81-60

[08:59] Team_066 possession (Score: 81-60)
Pau Curry attempts a 3Pt. Contested by Karl Gobert (3.5 feet, MAN). Pau Curry misses. Rebound secured by Paul James.

[08:45] Team_092 possession (Score: 81-60)
John Giddey makes the Layup and draws the foul on Kyle Wagner! And-1! John Giddey to the line for 1. [Team fouls: 2] (Kyle Wagner: 2 personal fouls)   FT 1/1: GOOD John Giddey makes 1/1 from the line.
Score: 84-60

[08:35] Team_066 possession (Score: 84-60)
Kyle Wagner attempts a Layup. Contested by Immanuel Ingram (2.8 feet, MAN). Kyle Wagner misses. Rebound secured by Paul James.

[08:22] Team_092 possession (Score: 84-60)
Immanuel Ingram makes the Layup and draws the foul on Kyle Wagner! And-1! Immanuel Ingram to the line for 1. [Team fouls: 3] (Kyle Wagner: 3 personal fouls)   FT 1/1: GOOD Immanuel Ingram makes 1/1 from the line.
Score: 87-60

[08:10] Team_066 possession (Score: 87-60)
Pau Curry attempts a 3Pt. Contested by John Giddey (3.9 feet, ZONE). PAU CURRY MAKES IT! Assist: Yao Brogdon
Score: 87-63

[07:59] Team_092 possession (Score: 87-63)
Immanuel Ingram attempts a Midrange. Contested by Kyle Wagner (3.2 feet, MAN). Immanuel Ingram misses. Rebound secured by Brandon Reaves.

[07:46] Team_066 possession (Score: 87-63)
Kyle Wagner attempts a Midrange. Contested by Karl Gobert (4.6 feet, ZONE). KYLE WAGNER MAKES IT! Assist: Pau Curry
Score: 87-65

[07:28] Team_092 possession (Score: 87-65)
FOUL! Offensive foul on Paul James! Brandon Reaves drew the charge! [Team fouls: 2] (Paul James: 2 personal fouls) TURNOVER! (dead ball)

[07:13] Team_066 possession (Score: 87-65)
Brandon Reaves attempts a 3Pt. Contested by John Giddey (4.2 feet, ZONE). Brandon Reaves misses. Rebound secured by Immanuel Ingram.

[06:59] Team_092 possession (Score: 87-65)
John Giddey drives to the basket... John Giddey throws a bad pass! Stolen by Yao Brogdon! TURNOVER! (live ball)

[06:47] Team_066 possession (Score: 87-65)
Yao Brogdon attempts a 3Pt. Contested by Paul James (5.7 feet, ZONE). Yao Brogdon misses. Rebound secured by John Giddey.

[06:35] Team_092 possession (Score: 87-65)
Paul James drives to the basket... FOUL! Offensive foul on Paul James! Brandon Reaves drew the charge! [Team fouls: 3] (Paul James: 3 personal fouls) TURNOVER! (dead ball)

[06:22] Team_066 possession (Score: 87-65)
Yao Brogdon throws a bad pass! Stolen by John Giddey! TURNOVER! (live ball)

[06:09] Team_092 possession (Score: 87-65)
John Giddey throws a bad pass out of bounds! TURNOVER! (dead ball)

[05:52] Team_066 possession (Score: 87-65)
Pau Curry drives and kicks out. Jimmy Davis attempts a Midrange. Wide open! Austin Bridges is 6.3 feet away. [MAN] JIMMY DAVIS MAKES IT!
Score: 87-67

[05:39] Team_092 possession (Score: 87-67)
Austin Bridges drives to the basket... Austin Bridges throws a bad pass! Stolen by Kyle Wagner! TURNOVER! (live ball)

[05:27] Team_066 possession (Score: 87-67)
Jimmy Davis attempts a Midrange. Contested by Paul James (5.1 feet, ZONE). JIMMY DAVIS MAKES IT! Assist: Yao Brogdon
Score: 87-69

[05:11] Team_092 possession (Score: 87-69)
Immanuel Ingram attempts a 3Pt. Contested by Pau Curry (4.7 feet, ZONE). Immanuel Ingram misses. Rebound secured by Brandon Reaves.

[04:57] Team_066 possession (Score: 87-69)
Yao Brogdon attempts a 3Pt. Contested by John Giddey (5.4 feet, ZONE). YAO BROGDON MAKES IT!
Score: 87-72

[04:46] Team_092 possession (Score: 87-72)
Austin Bridges makes the Dunk and draws the foul on Jimmy Davis! And-1! Austin Bridges to the line for 1. [Team fouls: 4] (Jimmy Davis: 1 personal fouls)   FT 1/1: GOOD Austin Bridges makes 1/1 from the line.
Score: 90-72

[04:33] Team_066 possession (Score: 90-72)
Kyle Wagner drives to the basket... Kyle Wagner commits a violation (traveling/carry)! TURNOVER! (dead ball)

[04:23] Team_092 possession (Score: 90-72)
Immanuel Ingram attempts a Layup. BLOCKED BY KYLE WAGNER! Ball deflects out of bounds off Immanuel Ingram.

[04:09] Team_066 possession (Score: 90-72)
Brandon Reaves attempts a Midrange. Wide open! Paul James is 7.4 feet away. [MAN] BRANDON REAVES MAKES IT!
Score: 90-74

[03:56] Team_092 possession (Score: 90-74)
Paul James throws a bad pass! Stolen by Brandon Reaves! TURNOVER! (live ball)

[03:41] Team_066 possession (Score: 90-74)
Kyle Wagner drives, John Giddey stays with him. Kyle Wagner attempts a Layup. Contested by John Giddey (3.8 feet, ZONE). Kyle Wagner misses. Rebound secured by John Giddey.

[03:29] Team_092 possession (Score: 90-74)
Austin Bridges drives and kicks out. John Giddey attempts a Midrange. Contested by Yao Brogdon (5.7 feet, MAN). JOHN GIDDEY MAKES IT! Assist: Paul James
Score: 92-74

[03:10] Team_066 possession (Score: 92-74)
Yao Brogdon attempts a 3Pt. Wide open! John Giddey is 7.0 feet away. [ZONE] YAO BROGDON MAKES IT!
Score: 92-77

[02:56] Team_092 possession (Score: 92-77)
Austin Bridges attempts a 3Pt. Heavily contested by Pau Curry (1.3 feet, ZONE)! AUSTIN BRIDGES MAKES IT! Assist: Paul James
Score: 95-77

[02:39] Team_066 possession (Score: 95-77)
Jimmy Davis attempts a 3Pt. Wide open! John Giddey is 6.1 feet away. [ZONE] Jimmy Davis misses. Offensive rebound by Kyle Wagner! Kyle Wagner kicks it out.

[02:24] Team_066 possession (Score: 95-77)
Yao Brogdon attempts a 3Pt. Contested by John Giddey (2.1 feet, MAN). YAO BROGDON MAKES IT!
Score: 95-80

[02:12] Team_092 possession (Score: 95-80)
FOUL! Holding foul on Kyle Wagner. [IN THE BONUS! 5 team fouls] Immanuel Ingram to the line for 2 free throws. (Kyle Wagner: 4 personal fouls)   FT 1/2: GOOD   FT 2/2: GOOD Immanuel Ingram makes 2/2 from the line.
Score: 97-80

[01:56] Team_066 possession (Score: 97-80)
Jimmy Davis attempts a 3Pt. Contested by John Giddey (4.4 feet, ZONE). JIMMY DAVIS MAKES IT! Assist: Yao Brogdon
Score: 97-83

[01:42] Team_092 possession (Score: 97-83)
Karl Gobert drives, Yao Brogdon stays with him. Karl Gobert attempts a Layup. Contested by Yao Brogdon (3.6 feet, ZONE). KARL GOBERT MAKES IT! Assist: John Giddey
Score: 99-83

[01:31] Team_066 possession (Score: 99-83)
Brandon Reaves attempts a 3Pt. Heavily contested by John Giddey (1.2 feet, ZONE)! Brandon Reaves misses. Rebound secured by Paul James.

[01:15] Team_092 possession (Score: 99-83)
Immanuel Ingram attempts a Layup. Contested by Kyle Wagner (3.5 feet, MAN). IMMANUEL INGRAM MAKES IT! Assist: John Giddey
Score: 101-83

[00:57] Team_066 possession (Score: 101-83)
FOUL! Shooting foul on John Giddey. Brandon Reaves to the line for 2 free throws. [Team fouls: 4] (John Giddey: 1 personal fouls)   FT 1/2: MISS   FT 2/2: GOOD Brandon Reaves makes 1/2 from the line.
Score: 101-84

[00:42] Team_092 possession (Score: 101-84)
Paul James drives, Kyle Wagner stays with him. Paul James attempts a Layup. Contested by Kyle Wagner (3.0 feet, ZONE). Paul James misses. Rebound secured by Brandon Reaves.

[00:29] Team_066 possession (Score: 101-84)
Jimmy Davis attempts a Layup. Wide open! Austin Bridges is 6.5 feet away. [MAN] JIMMY DAVIS MAKES IT! Assist: Brandon Reaves
Score: 101-86

[00:16] Team_092 possession (Score: 101-86)
FOUL! Shooting foul on Jimmy Davis. Austin Bridges to the line for 2 free throws. [BONUS: 6 team fouls] (Jimmy Davis: 2 personal fouls)   FT 1/2: GOOD   FT 2/2: GOOD Austin Bridges makes 2/2 from the line.
Score: 103-86

[00:01] Team_066 possession (Score: 103-86)
Brandon Reaves attempts a Midrange. Contested by Karl Gobert (5.4 feet, ZONE). BRANDON REAVES MAKES IT!
Score: 103-88

================================================================================
                              3RD QUARTER COMPLETE                              
================================================================================

3RD QUARTER SCORE: Team_092 35, Team_066 30

BOX SCORE:
================================================================================

Team_092
--------------------------------------------------------------------------------
Player                MIN  PTS  REB  AST  TO      FG   FG%      3P   3P%
--------------------------------------------------------------------------------
Immanuel Ingram        35   14    2    1   0   6/9    66.7     0/0   0.0
Austin Bridges         35    8    0    0   0   3/4    75.0     0/0   0.0
John Giddey            35    8    2    2   0   3/3   100.0     0/0   0.0
Paul James             35    3    4    4   0   1/2    50.0     0/0   0.0
Karl Gobert            35    2    0    0   0   1/1   100.0     0/0   0.0

TEAM: FG: 14/19 (73.7%), 3PT: 3/4 (75.0%), REB: 8 (0 off, 8 def), AST: 7, TO: 6
TEAM FOULS: 4


Team_066
--------------------------------------------------------------------------------
Player                MIN  PTS  REB  AST  TO      FG   FG%      3P   3P%
--------------------------------------------------------------------------------
Jimmy Davis            35   11    0    0   0   5/6    83.3     0/0   0.0
Yao Brogdon            35    9    1    3   0   3/4    75.0     0/0   0.0
Brandon Reaves         35    5    3    2   0   3/6    50.0     0/0   0.0
Pau Curry              35    3    0    1   0   1/2    50.0     0/0   0.0
Kyle Wagner            35    2    2    0   0   1/3    33.3     0/0   0.0

TEAM: FG: 13/21 (61.9%), 3PT: 5/9 (55.6%), REB: 6 (2 off, 4 def), AST: 6, TO: 4
TEAM FOULS: 6 [Team_092 in BONUS]

================================================================================

================================================================================
                       4TH QUARTER - Team_092 vs Team_066                       
================================================================================

[12:00] Team_092 possession (Score: 103-88)
Karl Gobert attempts a Layup. BLOCKED BY YAO BROGDON! Ball is loose! Rebound secured by Kyle Wagner.

[11:48] Team_066 possession (Score: 103-88)
Yao Brogdon attempts a Layup. BLOCKED BY JOHN GIDDEY! Ball is loose! Offensive rebound by Kyle Wagner! Kyle Wagner kicks it out.

[11:35] Team_066 possession (Score: 103-88)
Brandon Reaves loses control! Ball rolls out of bounds! TURNOVER! (dead ball)

[11:35] Substitution (Team_092): Austin Bridges OUT → Bones Giddey IN (stamina_rule2)

[11:35] Substitution (Team_092): Karl Gobert OUT → Shaquille Russell IN (stamina_rule2)

[11:35] Substitution (Team_092): Paul James OUT → Vince Harris IN (stamina_rule2)

[11:35] Substitution (Team_092): John Giddey OUT → Shaquille Paul IN (stamina_rule2)

[11:35] Substitution (Team_092): Immanuel Ingram OUT → Pau Reaves IN (stamina_rule2)

[11:35] Substitution (Team_066): Jimmy Davis OUT → Pascal Carter IN (stamina_rule2)

[11:35] Substitution (Team_066): Pau Curry OUT → Lauri LaVine IN (stamina_rule2)

[11:35] Substitution (Team_066): Brandon Reaves OUT → Brandon Middleton IN (stamina_rule2)

[11:35] Substitution (Team_066): Yao Brogdon OUT → Cole Morant IN (stamina_rule2)

[11:35] Substitution (Team_066): Kyle Wagner OUT → Donovan Simmons IN (stamina_rule2)

[11:23] Team_092 possession (Score: 103-88)
Vince Harris attempts a Midrange. Contested by Cole Morant (6.0 feet, ZONE). VINCE HARRIS MAKES IT!
Score: 105-88

[11:09] Team_066 possession (Score: 105-88)
FOUL! Holding foul on Bones Giddey. [Team fouls: 1] No free throws, side out. (Bones Giddey: 1 personal fouls)

[10:55] Team_066 possession (Score: 105-88)
Brandon Middleton attempts a 3Pt. Contested by Vince Harris (5.6 feet, MAN). Brandon Middleton misses. Rebound secured by Pau Reaves.

[10:40] Team_092 possession (Score: 105-88)
Bones Giddey attempts a 3Pt. Wide open! Pascal Carter is 10.0 feet away. [MAN] Bones Giddey misses. Offensive rebound by Shaquille Paul! Shaquille Paul kicks it out.

[10:26] Team_092 possession (Score: 105-88)
Bones Giddey loses the ball! Stripped by Pascal Carter! TURNOVER! (live ball)

[10:10] Team_066 possession (Score: 105-88)
Pascal Carter attempts a 3Pt. Contested by Bones Giddey (3.9 feet, MAN). Pascal Carter misses. Rebound secured by Shaquille Paul.

[09:54] Team_092 possession (Score: 105-88)
Vince Harris attempts a Layup. Wide open! Brandon Middleton is 7.4 feet away. [MAN] Vince Harris misses. Rebound secured by Brandon Middleton.

[09:41] Team_066 possession (Score: 105-88)
Cole Morant attempts a Midrange. Wide open! Shaquille Russell is 7.9 feet away. [ZONE] Cole Morant misses. Rebound secured by Shaquille Paul.

[09:31] Team_092 possession (Score: 105-88)
Shaquille Paul attempts a 3Pt. Wide open! Cole Morant is 6.7 feet away. [MAN] Shaquille Paul misses. Rebound secured by Donovan Simmons.

[09:12] Team_066 possession (Score: 105-88)
Pascal Carter attempts a 3Pt. Heavily contested by Vince Harris (0.9 feet, ZONE)! Pascal Carter misses. Rebound secured by Shaquille Russell.

[09:01] Team_092 possession (Score: 105-88)
FOUL! Reach-in foul on Brandon Middleton during the drive. [Team fouls: 1] No free throws, side out. (Brandon Middleton: 1 personal fouls)

[08:44] Team_092 possession (Score: 105-88)
FOUL! Reach-in foul on Cole Morant during the drive. [Team fouls: 2] No free throws, side out. (Cole Morant: 1 personal fouls)

[08:32] Team_092 possession (Score: 105-88)
Vince Harris attempts a 3Pt. Wide open! Lauri LaVine is 8.5 feet away. [ZONE] Vince Harris misses. Offensive rebound by Shaquille Paul! Shaquille Paul kicks it out.

[08:18] Team_092 possession (Score: 105-88)
Bones Giddey drives and kicks out. Shaquille Paul attempts a Midrange. Heavily contested by Lauri LaVine (1.8 feet, ZONE)! SHAQUILLE PAUL MAKES IT!
Score: 107-88

[08:03] Team_066 possession (Score: 107-88)
Lauri LaVine drives, Pau Reaves stays with him. Lauri LaVine attempts a Dunk. Wide open! Pau Reaves is 6.3 feet away. [ZONE] LAURI LAVINE MAKES IT! Assist: Donovan Simmons
Score: 107-90

[07:47] Team_092 possession (Score: 107-90)
Shaquille Russell attempts a Midrange. Contested by Lauri LaVine (5.6 feet, ZONE). SHAQUILLE RUSSELL MAKES IT!
Score: 109-90

[07:29] Team_066 possession (Score: 109-90)
Donovan Simmons attempts a Midrange. Wide open! Pau Reaves is 7.3 feet away. [MAN] Donovan Simmons misses. Offensive rebound by Lauri LaVine! Lauri LaVine kicks it out.

[07:15] Team_066 possession (Score: 109-90)
Lauri LaVine attempts a 3Pt. Wide open! Shaquille Russell is 6.8 feet away. [MAN] Lauri LaVine misses. Rebound secured by Shaquille Paul.

[07:01] Team_092 possession (Score: 109-90)
Shaquille Russell attempts a Midrange. Contested by Lauri LaVine (5.0 feet, MAN). SHAQUILLE RUSSELL MAKES IT!
Score: 111-90

[06:50] Team_066 possession (Score: 111-90)
Brandon Middleton attempts a 3Pt. Contested by Vince Harris (4.5 feet, MAN). Brandon Middleton misses. Offensive rebound by Donovan Simmons! Donovan Simmons kicks it out.

[06:35] Team_066 possession (Score: 111-90)
Brandon Middleton attempts a 3Pt. Contested by Vince Harris (3.2 feet, MAN). Brandon Middleton misses. Rebound secured by Shaquille Paul.

[06:22] Team_092 possession (Score: 111-90)
Bones Giddey attempts a Midrange. Wide open! Cole Morant is 6.6 feet away. [ZONE] Bones Giddey misses. Rebound secured by Lauri LaVine.

[06:09] Team_066 possession (Score: 111-90)
Pascal Carter drives and kicks out. Cole Morant attempts a 3Pt. Contested by Bones Giddey (5.5 feet, ZONE). Cole Morant misses. Rebound secured by Shaquille Russell.

[05:51] Team_092 possession (Score: 111-90)
Shaquille Paul drives and kicks out. Pau Reaves attempts a Midrange. Contested by Brandon Middleton (3.9 feet, ZONE). PAU REAVES MAKES IT! Assist: Shaquille Paul
Score: 113-90

[05:38] Team_066 possession (Score: 113-90)
Cole Morant drives, Pau Reaves stays with him. Cole Morant attempts a Layup. Contested by Pau Reaves (4.5 feet, ZONE). COLE MORANT MAKES IT! Assist: Lauri LaVine
Score: 113-92

[05:22] Team_092 possession (Score: 113-92)
Vince Harris attempts a 3Pt. Contested by Lauri LaVine (4.8 feet, ZONE). VINCE HARRIS MAKES IT! Assist: Bones Giddey
Score: 116-92

[05:09] Team_066 possession (Score: 116-92)
Pascal Carter attempts a 3Pt. Contested by Bones Giddey (5.7 feet, MAN). Pascal Carter misses. Rebound secured by Shaquille Russell.

[04:51] Team_092 possession (Score: 116-92)
Pau Reaves attempts a 3Pt. Contested by Donovan Simmons (4.0 feet, MAN). Pau Reaves misses. Rebound secured by Lauri LaVine.

[04:36] Team_066 possession (Score: 116-92)
Pascal Carter drives, Pau Reaves stays with him. Pascal Carter attempts a Layup. Contested by Pau Reaves (2.2 feet, ZONE). PASCAL CARTER MAKES IT! Assist: Lauri LaVine
Score: 116-94

[04:21] Team_092 possession (Score: 116-94)
Shaquille Russell attempts a 3Pt. Contested by Lauri LaVine (5.3 feet, MAN). Shaquille Russell misses. Offensive rebound by Shaquille Paul! Shaquille Paul kicks it out.

[04:07] Team_092 possession (Score: 116-94)
Vince Harris drives, Donovan Simmons stays with him. Vince Harris attempts a Layup. Contested by Donovan Simmons (5.4 feet, ZONE). VINCE HARRIS MAKES IT! Assist: Bones Giddey
Score: 118-94

[03:50] Team_066 possession (Score: 118-94)
Lauri LaVine drives, Pau Reaves stays with him. Lauri LaVine attempts a Layup. Heavily contested by Pau Reaves (1.9 feet, ZONE)! LAURI LAVINE MAKES IT! Assist: Cole Morant
Score: 118-96

[03:35] Team_092 possession (Score: 118-96)
Vince Harris attempts a 3Pt. Wide open! Brandon Middleton is 6.2 feet away. [MAN] Vince Harris misses. Rebound secured by Brandon Middleton.

[03:25] Team_066 possession (Score: 118-96)
Donovan Simmons drives to the basket... Donovan Simmons throws a bad pass! Stolen by Pau Reaves! TURNOVER! (live ball)

[03:11] Team_092 possession (Score: 118-96)
Shaquille Russell drives and kicks out. Shaquille Paul attempts a 3Pt. Contested by Lauri LaVine (3.9 feet, ZONE). Shaquille Paul misses. Rebound secured by Donovan Simmons.

[03:02] Team_066 possession (Score: 118-96)
Cole Morant attempts a Layup. Heavily contested by Shaquille Paul (2.0 feet, MAN)! Cole Morant misses. Rebound secured by Pau Reaves.

[02:52] Team_092 possession (Score: 118-96)
Shaquille Russell throws a bad pass out of bounds! TURNOVER! (dead ball)

[02:38] Team_066 possession (Score: 118-96)
Donovan Simmons attempts a Layup. Heavily contested by Pau Reaves (0.7 feet, MAN)! DONOVAN SIMMONS MAKES IT! Assist: Pascal Carter
Score: 118-98

[02:20] Team_092 possession (Score: 118-98)
FOUL! Reach-in foul on Cole Morant during the drive. [Team fouls: 3] No free throws, side out. (Cole Morant: 2 personal fouls)

[02:06] Team_092 possession (Score: 118-98)
Shaquille Paul attempts a 3Pt. Wide open! Cole Morant is 6.7 feet away. [MAN] Shaquille Paul misses. FOUL! Loose ball foul on Donovan Simmons during the rebound battle. [Team fouls: 4] No free throws, side out. (Donovan Simmons: 1 personal fouls)

[01:55] Team_092 possession (Score: 118-98)
Vince Harris attempts a Midrange. Wide open! Brandon Middleton is 7.2 feet away. [ZONE] Vince Harris misses. Rebound secured by Donovan Simmons.

[01:44] Team_066 possession (Score: 118-98)
Donovan Simmons attempts a Layup. Contested by Pau Reaves (5.4 feet, ZONE). Donovan Simmons misses. Rebound secured by Shaquille Paul.

[01:33] Team_092 possession (Score: 118-98)
Pau Reaves drives to the basket... Pau Reaves loses the ball! Stripped by Donovan Simmons! TURNOVER! (live ball)

[01:17] Team_066 possession (Score: 118-98)
Pascal Carter attempts a Midrange. Contested by Bones Giddey (4.1 feet, MAN). PASCAL CARTER MAKES IT! Assist: Lauri LaVine
Score: 118-100

[01:04] Team_092 possession (Score: 118-100)
Shaquille Paul throws a bad pass! Stolen by Cole Morant! TURNOVER! (live ball)

[00:52] Team_066 possession (Score: 118-100)
FOUL! Holding foul on Vince Harris. [Team fouls: 2] No free throws, side out. (Vince Harris: 1 personal fouls)

[00:38] Team_066 possession (Score: 118-100)
Cole Morant attempts a Midrange. Contested by Shaquille Russell (4.7 feet, ZONE). COLE MORANT MAKES IT! Assist: Pascal Carter
Score: 118-102

[00:26] Team_092 possession (Score: 118-102)
Shaquille Paul attempts a Layup. Wide open! Cole Morant is 6.8 feet away. [MAN] Shaquille Paul misses. Rebound secured by Lauri LaVine.

[00:12] Team_066 possession (Score: 118-102)
Donovan Simmons attempts a Midrange. Wide open! Pau Reaves is 9.4 feet away. [MAN] DONOVAN SIMMONS MAKES IT! Assist: Cole Morant
Score: 118-104

================================================================================
                              4TH QUARTER COMPLETE                              
================================================================================

4TH QUARTER SCORE: Team_092 15, Team_066 16

BOX SCORE:
================================================================================

Team_092
--------------------------------------------------------------------------------
Player                MIN  PTS  REB  AST  TO      FG   FG%      3P   3P%
--------------------------------------------------------------------------------
Vince Harris           13    7    0    0   0   3/6    50.0     0/0   0.0
Shaquille Russell      13    4    3    0   0   2/3    66.7     0/0   0.0
Pau Reaves             13    2    3    0   0   1/2    50.0     0/0   0.0
Shaquille Paul         13    2    8    1   0   1/3    33.3     0/0   0.0
Karl Gobert            35    0    0    0   0   0/1     0.0     0/0   0.0
Bones Giddey           13    0    0    2   0   0/1     0.0     0/0   0.0

TEAM: FG: 7/16 (43.8%), 3PT: 1/4 (25.0%), REB: 14 (4 off, 10 def), AST: 3, TO: 4
TEAM FOULS: 2


Team_066
--------------------------------------------------------------------------------
Player                MIN  PTS  REB  AST  TO      FG   FG%      3P   3P%
--------------------------------------------------------------------------------
Pascal Carter          13    4    0    2   0   2/6    33.3     0/0   0.0
Cole Morant            13    4    0    2   0   2/4    50.0     0/0   0.0
Donovan Simmons        13    4    4    1   0   2/3    66.7     0/0   0.0
Lauri LaVine           13    4    4    3   0   2/3    66.7     0/0   0.0
Kyle Wagner            35    0    2    0   0   0/0     0.0     0/0   0.0
Brandon Middleton      13    0    2    0   0   0/2     0.0     0/0   0.0

TEAM: FG: 8/18 (44.4%), 3PT: 0/6 (0.0%), REB: 12 (3 off, 9 def), AST: 8, TO: 2
TEAM FOULS: 4

================================================================================

================================================================================
                               FULL GAME COMPLETE                               
================================================================================

FINAL SCORE: Team_092 118, Team_066 104

SCORING BY QUARTER:
--------------------------------------------------------------------------------
Team                     Q1     Q2     Q3     Q4    FINAL
--------------------------------------------------------------------------------
Team_092                 24     44     35     15      118
Team_066                 27     31     30     16      104
--------------------------------------------------------------------------------

FULL GAME BOX SCORE:
================================================================================

Team_092
--------------------------------------------------------------------------------
Player                MIN  PTS  REB  AST  TO      FG   FG%      3P   3P%      FT STL BLK
--------------------------------------------------------------------------------
Austin Bridges         35   22    0    2   1  10/13   76.9   3/3   100.0   5/5     1   0
Karl Gobert            35   14    0    2   2   7/8    87.5   3/3   100.0   4/4     0   0
Paul James             35    9   11   10   3   2/4    50.0   2/2   100.0   0/0     0   0
John Giddey            35   22    5    5   2   8/12   66.7   4/4   100.0   4/4     3   3
Immanuel Ingram        35   29    9    2   3   9/18   50.0   0/3     0.0   7/7     0   0
Bones Giddey           13    0    0    3   1   2/3    66.7   0/0     0.0   0/0     0   0
Shaquille Russell      13    4    3    1   2   2/3    66.7   0/0     0.0   0/0     0   0
Vince Harris           13   10    0    0   0   3/6    50.0   1/2    50.0   0/0     0   0
Shaquille Paul         13    4   10    1   1   2/4    50.0   0/1     0.0   0/0     0   0
Pau Reaves             13    4    3    0   0   1/2    50.0   0/1     0.0   0/0     1   0

TEAM: FG: 48/75 (64.0%), 3PT: 13/19 (68.4%), REB: 41 (6 off, 35 def), AST: 26, TO: 15


Team_066
--------------------------------------------------------------------------------
Player                MIN  PTS  REB  AST  TO      FG   FG%      3P   3P%      FT STL BLK
--------------------------------------------------------------------------------
Jimmy Davis            35   16    0    3   1   5/10   50.0   2/4    50.0   0/1     0   1
Pau Curry              35    9    0    5   3   5/8    62.5   1/4    25.0   2/2     1   0
Brandon Reaves         35   18    7    4   2   9/14   64.3   2/4    50.0   4/5     1   0
Yao Brogdon            35   29    9    4   2  11/17   64.7   6/8    75.0   7/8     1   1
Kyle Wagner            35   10   10    1   0   5/9    55.6   0/1     0.0   4/4     1   1
Pascal Carter          13    4    0    2   0   2/6    33.3   0/3     0.0   0/0     1   0
Lauri LaVine           13    4    4    3   0   2/3    66.7   0/1     0.0   0/0     0   0
Brandon Middleton      13    2    2    0   0   1/5    20.0   0/3     0.0   0/0     0   0
Cole Morant            13    4    0    2   1   2/4    50.0   0/0     0.0   0/0     1   0
Donovan Simmons        13    4    4    1   0   2/3    66.7   0/0     0.0   0/0     1   0

TEAM: FG: 44/79 (55.7%), 3PT: 11/28 (39.3%), REB: 36 (10 off, 26 def), AST: 25, TO: 9

================================================================================
