================================================================================
                        FULL GAME - Team_009 vs Team_049                        
================================================================================

================================================================================
                       1ST QUARTER - Team_009 vs Team_049                       
================================================================================

[12:00] Team_009 possession (Score: 0-0)
Desmond Harden makes the Layup and draws the foul on Ja Oladipo! And-1! Desmond Harden to the line for 1. [Team fouls: 1] (Ja Oladipo: 1 personal fouls)   FT 1/1: GOOD Desmond Harden makes 1/1 from the line.
Score: 3-0

[11:45] Team_049 possession (Score: 3-0)
Shai Bird attempts a 3Pt. Contested by Miles Sabonis (3.5 feet, MAN). Shai Bird misses. Rebound secured by Anfernee Anunoby.

[11:34] Team_009 possession (Score: 3-0)
Miles Sabonis attempts a 3Pt. Heavily contested by Ja Oladipo (1.9 feet, ZONE)! Miles Sabonis misses. Rebound secured by Shai Mobley.

[11:15] Team_049 possession (Score: 3-0)
Shai Bird attempts a 3Pt. Wide open! Miles Sabonis is 6.2 feet away. [ZONE] SHAI BIRD MAKES IT! Assist: De'Aaron Allen
Score: 3-3

[11:00] Team_009 possession (Score: 3-3)
Cole Mitchell drives and kicks out. Kyle Brogdon attempts a 3Pt. Wide open! Ja Oladipo is 7.0 feet away. [ZONE] KYLE BROGDON MAKES IT! Assist: Desmond Harden
Score: 6-3

[10:47] Team_049 possession (Score: 6-3)
Jimmy Griffin drives, picks up Anfernee Anunoby. Help arrives from Miles Sabonis! Jimmy Griffin attempts a Layup. Contested by Miles Sabonis (5.6 feet, MAN). JIMMY GRIFFIN MAKES IT!
Score: 6-5

[10:34] Team_009 possession (Score: 6-5)
Cole Mitchell attempts a Layup. BLOCKED BY SHAI MOBLEY! Ball is loose! Rebound secured by Shai Mobley.

[10:22] Team_049 possession (Score: 6-5)
Jimmy Griffin drives and kicks out. De'Aaron Allen attempts a 3Pt. Contested by Miles Sabonis (4.1 feet, ZONE). DE'AARON ALLEN MAKES IT! Assist: Ja Oladipo
Score: 6-8

[10:08] Team_009 possession (Score: 6-8)
Cole Mitchell attempts a 3Pt. Contested by De'Aaron Allen (3.8 feet, MAN). COLE MITCHELL MAKES IT! Assist: Desmond Harden
Score: 9-8

[09:53] Team_049 possession (Score: 9-8)
Shai Bird drives to the basket... Shai Bird loses control! Ball rolls out of bounds! TURNOVER! (dead ball)

[09:33] Team_009 possession (Score: 9-8)
Anfernee Anunoby attempts a Midrange. Contested by Jimmy Griffin (3.5 feet, ZONE). ANFERNEE ANUNOBY MAKES IT!
Score: 11-8

[09:23] Team_049 possession (Score: 11-8)
Shai Bird attempts a 3Pt. Wide open! Miles Sabonis is 8.0 feet away. [ZONE] SHAI BIRD MAKES IT! Assist: Ja Oladipo
Score: 11-11

[09:11] Team_009 possession (Score: 11-11)
Anfernee Anunoby drives and kicks out. Miles Sabonis attempts a Midrange. Contested by Shai Bird (4.5 feet, MAN). Miles Sabonis misses. Rebound secured by De'Aaron Allen.

[08:57] Team_049 possession (Score: 11-11)
De'Aaron Allen attempts a 3Pt. Contested by Miles Sabonis (5.9 feet, ZONE). DE'AARON ALLEN MAKES IT! Assist: Shai Bird
Score: 11-14

[08:44] Team_009 possession (Score: 11-14)
Miles Sabonis attempts a Layup. Contested by De'Aaron Allen (3.7 feet, ZONE). Miles Sabonis misses. Rebound secured by De'Aaron Allen.

[08:33] Team_049 possession (Score: 11-14)
Shai Bird throws a bad pass! Stolen by Miles Sabonis! TURNOVER! (live ball)

[08:19] Team_009 possession (Score: 11-14)
Miles Sabonis attempts a 3Pt. Contested by Shai Bird (2.7 feet, MAN). Miles Sabonis misses. Offensive rebound by Kyle Brogdon! Kyle Brogdon's putback is no good. Rebound secured by Jimmy Griffin.

[08:04] Team_049 possession (Score: 11-14)
Ja Oladipo drives and kicks out. Shai Mobley attempts a 3Pt. Wide open! Miles Sabonis is 7.4 feet away. [ZONE] Shai Mobley misses. Rebound secured by Anfernee Anunoby.

[07:47] Team_009 possession (Score: 11-14)
FOUL! Holding foul on Jimmy Griffin. [Team fouls: 2] No free throws, side out. (Jimmy Griffin: 1 personal fouls)

[07:32] Team_009 possession (Score: 11-14)
Cole Mitchell loses control! Ball rolls out of bounds! TURNOVER! (dead ball)

[07:16] Team_049 possession (Score: 11-14)
Jimmy Griffin attempts a 3Pt. BLOCKED BY MILES SABONIS! Ball is loose! Rebound secured by Cole Mitchell.

[07:02] Team_009 possession (Score: 11-14)
Miles Sabonis attempts a 3Pt. Wide open! Ja Oladipo is 6.9 feet away. [ZONE] MILES SABONIS MAKES IT! Assist: Cole Mitchell
Score: 14-14

[06:45] Team_049 possession (Score: 14-14)
Shai Bird attempts a Layup. BLOCKED BY MILES SABONIS! Ball is loose! Rebound secured by Cole Mitchell.

[06:33] Team_009 possession (Score: 14-14)
Cole Mitchell drives, picks up De'Aaron Allen. Help arrives from Ja Oladipo! Cole Mitchell attempts a Layup. Contested by Ja Oladipo (4.8 feet, MAN). COLE MITCHELL MAKES IT! Assist: Kyle Brogdon
Score: 16-14

[06:20] Team_049 possession (Score: 16-14)
Jimmy Griffin attempts a 3Pt. Contested by Miles Sabonis (4.5 feet, ZONE). Jimmy Griffin misses. Rebound secured by Cole Mitchell.

[06:09] Team_009 possession (Score: 16-14)
Miles Sabonis attempts a 3Pt. Contested by Ja Oladipo (2.7 feet, ZONE). Miles Sabonis misses. Rebound secured by Jimmy Griffin.

[05:57] Team_049 possession (Score: 16-14)
Shai Bird drives and kicks out. Shai Mobley attempts a 3Pt. Wide open! Anfernee Anunoby is 6.9 feet away. [ZONE] Shai Mobley misses. Rebound secured by Kyle Brogdon.

[05:44] Team_009 possession (Score: 16-14)
Anfernee Anunoby attempts a 3Pt. Contested by Jimmy Griffin (2.8 feet, MAN). Anfernee Anunoby misses. Rebound secured by De'Aaron Allen.

[05:29] Team_049 possession (Score: 16-14)
Ja Oladipo attempts a 3Pt. Contested by Miles Sabonis (3.4 feet, ZONE). Ja Oladipo misses. Offensive rebound by De'Aaron Allen! De'Aaron Allen kicks it out.

[05:13] Team_049 possession (Score: 16-14)
Jimmy Griffin attempts a Midrange. Contested by Anfernee Anunoby (4.7 feet, ZONE). Jimmy Griffin misses. Rebound secured by Kyle Brogdon.

[05:02] Team_009 possession (Score: 16-14)
Desmond Harden makes the Layup and draws the foul on De'Aaron Allen! And-1! Desmond Harden to the line for 1. [Team fouls: 3] (De'Aaron Allen: 1 personal fouls)   FT 1/1: GOOD Desmond Harden makes 1/1 from the line.
Score: 19-14

[04:53] Team_049 possession (Score: 19-14)
Jimmy Griffin attempts a Midrange. Contested by Anfernee Anunoby (3.5 feet, MAN). JIMMY GRIFFIN MAKES IT!
Score: 19-16

[04:39] Team_009 possession (Score: 19-16)
Miles Sabonis attempts a Layup. Contested by Shai Bird (5.7 feet, MAN). Miles Sabonis misses. Rebound secured by Jimmy Griffin.

[04:24] Team_049 possession (Score: 19-16)
Ja Oladipo drives, picks up Desmond Harden. Help arrives from Miles Sabonis! Ja Oladipo attempts a Layup. Wide open! Miles Sabonis is 6.2 feet away. [MAN] JA OLADIPO MAKES IT!
Score: 19-18

[04:08] Team_009 possession (Score: 19-18)
FOUL! Holding foul on Shai Mobley. [Team fouls: 4] No free throws, side out. (Shai Mobley: 1 personal fouls)

[03:52] Team_009 possession (Score: 19-18)
Miles Sabonis attempts a 3Pt. Contested by Shai Bird (3.0 feet, MAN). MILES SABONIS MAKES IT!
Score: 22-18

[03:36] Team_049 possession (Score: 22-18)
De'Aaron Allen makes the Midrange and draws the foul on Anfernee Anunoby! And-1! De'Aaron Allen to the line for 1. [Team fouls: 1] (Anfernee Anunoby: 1 personal fouls)   FT 1/1: GOOD De'Aaron Allen makes 1/1 from the line.
Score: 22-21

[03:19] Team_009 possession (Score: 22-21)
Miles Sabonis attempts a Layup. Contested by Shai Bird (4.7 feet, MAN). Miles Sabonis misses. Offensive rebound by Kyle Brogdon! Kyle Brogdon puts it back in!
Score: 24-21

[03:06] Team_049 possession (Score: 24-21)
Shai Mobley attempts a Midrange. Wide open! Kyle Brogdon is 7.2 feet away. [MAN] SHAI MOBLEY MAKES IT!
Score: 24-23

[02:50] Team_009 possession (Score: 24-23)
Cole Mitchell attempts a Layup. BLOCKED BY DE'AARON ALLEN! Ball is loose! Rebound secured by Shai Mobley.

[02:35] Team_049 possession (Score: 24-23)
Ja Oladipo attempts a 3Pt. Contested by Desmond Harden (2.2 feet, MAN). Ja Oladipo misses. Rebound secured by Cole Mitchell.

[02:18] Team_009 possession (Score: 24-23)
Kyle Brogdon attempts a Layup. Heavily contested by Shai Mobley (1.5 feet, MAN)! KYLE BROGDON MAKES IT! Assist: Desmond Harden
Score: 26-23

[02:06] Team_049 possession (Score: 26-23)
Ja Oladipo attempts a 3Pt. Wide open! Desmond Harden is 7.8 feet away. [MAN] Ja Oladipo misses. Rebound secured by Kyle Brogdon.

[01:53] Team_009 possession (Score: 26-23)
Anfernee Anunoby drives to the basket... FOUL! Offensive foul on Anfernee Anunoby! Jimmy Griffin drew the charge! [Team fouls: 2] (Anfernee Anunoby: 2 personal fouls) TURNOVER! (dead ball)

[01:42] Team_049 possession (Score: 26-23)
Shai Mobley drives to the basket... FOUL! Offensive foul on Shai Mobley! Kyle Brogdon drew the charge! [Team fouls: 5] (Shai Mobley: 2 personal fouls) TURNOVER! (dead ball)

[01:32] Team_009 possession (Score: 26-23)
Cole Mitchell attempts a Layup. Heavily contested by De'Aaron Allen (1.1 feet, MAN)! COLE MITCHELL MAKES IT! Assist: Kyle Brogdon
Score: 28-23

[01:18] Team_049 possession (Score: 28-23)
Shai Bird drives and kicks out. Shai Mobley attempts a Midrange. Wide open! Kyle Brogdon is 6.7 feet away. [MAN] Shai Mobley misses. Rebound secured by Cole Mitchell.

[01:01] Team_009 possession (Score: 28-23)
Kyle Brogdon attempts a Layup. Wide open! Shai Mobley is 6.1 feet away. [MAN] KYLE BROGDON MAKES IT! Assist: Miles Sabonis
Score: 30-23

[00:48] Team_049 possession (Score: 30-23)
De'Aaron Allen attempts a Layup. Heavily contested by Cole Mitchell (1.5 feet, ZONE)! De'Aaron Allen misses. Offensive rebound by De'Aaron Allen! De'Aaron Allen kicks it out.

[00:31] Team_049 possession (Score: 30-23)
De'Aaron Allen attempts a 3Pt. Contested by Cole Mitchell (4.6 feet, MAN). De'Aaron Allen misses. Offensive rebound by De'Aaron Allen! De'Aaron Allen kicks it out.

[00:17] Team_049 possession (Score: 30-23)
Shai Mobley drives, picks up Kyle Brogdon. Help arrives from Miles Sabonis! Shai Mobley attempts a Dunk. Wide open! Miles Sabonis is 6.7 feet away. [MAN] SHAI MOBLEY MAKES IT!
Score: 30-25

[00:05] Team_009 possession (Score: 30-25)
Anfernee Anunoby attempts a 3Pt. Contested by Ja Oladipo (5.5 feet, ZONE). Anfernee Anunoby misses. Rebound secured by Shai Mobley.

================================================================================
                              1ST QUARTER COMPLETE                              
================================================================================

1ST QUARTER SCORE: Team_009 30, Team_049 25

BOX SCORE:
================================================================================

Team_009
--------------------------------------------------------------------------------
Player                MIN  PTS  REB  AST  TO      FG   FG%      3P   3P%
--------------------------------------------------------------------------------
Kyle Brogdon           12    9    4    2   0   4/4   100.0     0/0   0.0
Cole Mitchell          12    7    5    1   0   3/5    60.0     0/0   0.0
Desmond Harden         12    6    0    3   0   2/2   100.0     0/0   0.0
Miles Sabonis          12    6    0    1   0   2/7    28.6     0/0   0.0
Anfernee Anunoby       12    2    2    0   0   1/4    25.0     0/0   0.0

TEAM: FG: 12/22 (54.5%), 3PT: 3/8 (37.5%), REB: 12 (2 off, 10 def), AST: 7, TO: 2
TEAM FOULS: 2


Team_049
--------------------------------------------------------------------------------
Player                MIN  PTS  REB  AST  TO      FG   FG%      3P   3P%
--------------------------------------------------------------------------------
De'Aaron Allen         12    9    6    1   0   3/3   100.0     0/0   0.0
Shai Bird              12    6    0    1   0   2/6    33.3     0/0   0.0
Shai Mobley            12    4    4    0   0   2/2   100.0     0/0   0.0
Jimmy Griffin          12    4    3    0   0   2/5    40.0     0/0   0.0
Ja Oladipo             12    2    0    2   0   1/4    25.0     0/0   0.0

TEAM: FG: 10/20 (50.0%), 3PT: 3/8 (37.5%), REB: 12 (3 off, 9 def), AST: 4, TO: 3
TEAM FOULS: 5 [Team_009 in BONUS]

================================================================================

================================================================================
                       2ND QUARTER - Team_009 vs Team_049                       
================================================================================

[12:00] Team_009 possession (Score: 30-25)
FOUL! Shooting foul on Shai Mobley. Kyle Brogdon to the line for 2 free throws. [Team fouls: 1] (Shai Mobley: 1 personal fouls)   FT 1/2: GOOD   FT 2/2: GOOD Kyle Brogdon makes 2/2 from the line.
Score: 32-25

[11:43] Team_049 possession (Score: 32-25)
Ja Oladipo drives, Kyle Brogdon stays with him. Ja Oladipo attempts a Layup. Contested by Kyle Brogdon (5.3 feet, ZONE). Ja Oladipo misses. Rebound secured by Kyle Brogdon.

[11:28] Team_009 possession (Score: 32-25)
Cole Mitchell attempts a 3Pt. Contested by Ja Oladipo (4.0 feet, ZONE). Cole Mitchell misses. Rebound secured by Jimmy Griffin.

[11:16] Team_049 possession (Score: 32-25)
Ja Oladipo drives, Kyle Brogdon stays with him. Ja Oladipo attempts a Dunk. Contested by Kyle Brogdon (2.3 feet, ZONE). Ja Oladipo misses. Rebound secured by Anfernee Anunoby.

[10:58] Team_009 possession (Score: 32-25)
Miles Sabonis drives and kicks out. Kyle Brogdon attempts a 3Pt. Wide open! Ja Oladipo is 6.3 feet away. [ZONE] Kyle Brogdon misses. Offensive rebound by Cole Mitchell! Cole Mitchell kicks it out.

[10:46] Team_009 possession (Score: 32-25)
FOUL! Offensive foul on Desmond Harden! Ja Oladipo drew the charge! [Team fouls: 1] (Desmond Harden: 1 personal fouls) TURNOVER! (dead ball)

[10:36] Team_049 possession (Score: 32-25)
Shai Mobley attempts a Midrange. Contested by Kyle Brogdon (5.1 feet, MAN). Shai Mobley misses. Rebound secured by Anfernee Anunoby.

[10:20] Team_009 possession (Score: 32-25)
Anfernee Anunoby attempts a 3Pt. Contested by Jimmy Griffin (5.6 feet, MAN). ANFERNEE ANUNOBY MAKES IT! Assist: Kyle Brogdon
Score: 35-25

[10:03] Team_049 possession (Score: 35-25)
Shai Bird attempts a 3Pt. Wide open! Miles Sabonis is 6.5 feet away. [ZONE] SHAI BIRD MAKES IT! Assist: Jimmy Griffin
Score: 35-28

[09:49] Team_009 possession (Score: 35-28)
Kyle Brogdon makes the Layup and draws the foul on De'Aaron Allen! And-1! Kyle Brogdon to the line for 1. [Team fouls: 2] (De'Aaron Allen: 1 personal fouls)   FT 1/1: GOOD Kyle Brogdon makes 1/1 from the line.
Score: 38-28

[09:31] Team_049 possession (Score: 38-28)
Jimmy Griffin attempts a 3Pt. Contested by Anfernee Anunoby (4.7 feet, MAN). Jimmy Griffin misses. Rebound secured by Anfernee Anunoby.

[09:17] Team_009 possession (Score: 38-28)
Cole Mitchell attempts a Midrange. Contested by De'Aaron Allen (2.1 feet, MAN). Cole Mitchell misses. Rebound secured by Jimmy Griffin.

[09:01] Team_049 possession (Score: 38-28)
FOUL! Shooting foul on Kyle Brogdon. Jimmy Griffin to the line for 2 free throws. [Team fouls: 2] (Kyle Brogdon: 1 personal fouls)   FT 1/2: GOOD   FT 2/2: MISS Jimmy Griffin makes 1/2 from the line. Offensive rebound by Shai Mobley! Shai Mobley puts it back in!
Score: 38-31

[08:49] Team_009 possession (Score: 38-31)
Cole Mitchell attempts a Midrange. Contested by De'Aaron Allen (2.5 feet, MAN). Cole Mitchell misses. FOUL! Loose ball foul on Shai Mobley during the rebound battle. [Team fouls: 3] No free throws, side out. (Shai Mobley: 2 personal fouls)

[08:39] Team_009 possession (Score: 38-31)
Miles Sabonis attempts a Midrange. Wide open! Shai Bird is 6.3 feet away. [MAN] MILES SABONIS MAKES IT! Assist: Desmond Harden
Score: 40-31

[08:26] Team_049 possession (Score: 40-31)
Shai Bird attempts a 3Pt. Wide open! Miles Sabonis is 7.3 feet away. [MAN] SHAI BIRD MAKES IT! Assist: Ja Oladipo
Score: 40-34

[08:15] Team_009 possession (Score: 40-34)
Cole Mitchell attempts a Midrange. Wide open! De'Aaron Allen is 6.9 feet away. [MAN] Cole Mitchell misses. Offensive rebound by Kyle Brogdon! Kyle Brogdon kicks it out.

[08:02] Team_009 possession (Score: 40-34)
Kyle Brogdon drives, De'Aaron Allen stays with him. Kyle Brogdon attempts a Layup. Heavily contested by De'Aaron Allen (1.4 feet, ZONE)! Kyle Brogdon misses. Rebound secured by Shai Mobley.

[07:46] Team_049 possession (Score: 40-34)
Jimmy Griffin attempts a 3Pt. Wide open! Anfernee Anunoby is 6.2 feet away. [MAN] Jimmy Griffin misses. Rebound secured by Kyle Brogdon.

[07:32] Team_009 possession (Score: 40-34)
FOUL! Holding foul on Ja Oladipo. [Team fouls: 4] No free throws, side out. (Ja Oladipo: 1 personal fouls)

[07:16] Team_009 possession (Score: 40-34)
Cole Mitchell attempts a Layup. Heavily contested by De'Aaron Allen (1.0 feet, ZONE)! COLE MITCHELL MAKES IT!
Score: 42-34

[06:57] Team_049 possession (Score: 42-34)
De'Aaron Allen attempts a Midrange. Contested by Cole Mitchell (4.2 feet, MAN). De'Aaron Allen misses. Rebound secured by Kyle Brogdon.

[06:40] Team_009 possession (Score: 42-34)
Kyle Brogdon attempts a Layup. Heavily contested by De'Aaron Allen (1.8 feet, ZONE)! KYLE BROGDON MAKES IT!
Score: 44-34

[06:30] Team_049 possession (Score: 44-34)
FOUL! Reach-in foul on Kyle Brogdon during the drive. [Team fouls: 3] No free throws, side out. (Kyle Brogdon: 2 personal fouls)

[06:14] Team_049 possession (Score: 44-34)
De'Aaron Allen attempts a 3Pt. Wide open! Cole Mitchell is 8.3 feet away. [ZONE] De'Aaron Allen misses. Offensive rebound by De'Aaron Allen! De'Aaron Allen kicks it out.

[06:00] Team_049 possession (Score: 44-34)
Jimmy Griffin attempts a 3Pt. Wide open! Miles Sabonis is 8.2 feet away. [ZONE] Jimmy Griffin misses. Rebound secured by Cole Mitchell.

[05:46] Team_009 possession (Score: 44-34)
Desmond Harden attempts a 3Pt. Contested by Ja Oladipo (5.1 feet, MAN). DESMOND HARDEN MAKES IT! Assist: Anfernee Anunoby
Score: 47-34

[05:36] Team_049 possession (Score: 47-34)
De'Aaron Allen makes the Midrange and draws the foul on Cole Mitchell! And-1! De'Aaron Allen to the line for 1. [Team fouls: 4] (Cole Mitchell: 1 personal fouls)   FT 1/1: GOOD De'Aaron Allen makes 1/1 from the line.
Score: 47-37

[05:19] Team_009 possession (Score: 47-37)
Cole Mitchell makes the Layup and draws the foul on De'Aaron Allen! And-1! Cole Mitchell to the line for 1. [BONUS: 5 team fouls] (De'Aaron Allen: 2 personal fouls)   FT 1/1: GOOD Cole Mitchell makes 1/1 from the line.
Score: 50-37

[05:06] Team_049 possession (Score: 50-37)
Ja Oladipo drives to the basket... Ja Oladipo throws a bad pass! Stolen by Kyle Brogdon! TURNOVER! (live ball)

[04:53] Team_009 possession (Score: 50-37)
Anfernee Anunoby attempts a Midrange. Contested by Jimmy Griffin (3.9 feet, MAN). ANFERNEE ANUNOBY MAKES IT!
Score: 52-37

[04:39] Team_049 possession (Score: 52-37)
Shai Bird attempts a 3Pt. Wide open! Miles Sabonis is 10.0 feet away. [ZONE] Shai Bird misses. Rebound secured by Cole Mitchell.

[04:22] Team_009 possession (Score: 52-37)
Anfernee Anunoby attempts a 3Pt. Wide open! Ja Oladipo is 7.2 feet away. [ZONE] ANFERNEE ANUNOBY MAKES IT! Assist: Kyle Brogdon
Score: 55-37

[04:12] Team_049 possession (Score: 55-37)
De'Aaron Allen attempts a Midrange. Wide open! Cole Mitchell is 6.4 feet away. [MAN] DE'AARON ALLEN MAKES IT!
Score: 55-39

[03:59] Team_009 possession (Score: 55-39)
Desmond Harden attempts a Midrange. Wide open! Ja Oladipo is 7.6 feet away. [MAN] Desmond Harden misses. Rebound secured by Shai Mobley.

[03:44] Team_049 possession (Score: 55-39)
De'Aaron Allen drives, picks up Kyle Brogdon. Help arrives from Miles Sabonis! De'Aaron Allen attempts a Layup. Contested by Miles Sabonis (3.3 feet, ZONE). De'Aaron Allen misses. Rebound secured by Anfernee Anunoby.

[03:30] Team_009 possession (Score: 55-39)
Anfernee Anunoby makes the Layup and draws the foul on Jimmy Griffin! And-1! Anfernee Anunoby to the line for 1. [BONUS: 6 team fouls] (Jimmy Griffin: 1 personal fouls)   FT 1/1: GOOD Anfernee Anunoby makes 1/1 from the line.
Score: 58-39

[03:13] Team_049 possession (Score: 58-39)
Shai Bird attempts a 3Pt. Wide open! Miles Sabonis is 8.5 feet away. [ZONE] Shai Bird misses. FOUL! Loose ball foul on Kyle Brogdon during the rebound battle. [IN THE BONUS! 5 team fouls] Shai Mobley to the line for 2 free throws. (Kyle Brogdon: 3 personal fouls)   FT 1/2: GOOD   FT 2/2: GOOD Shai Mobley makes 2/2 from the line.
Score: 58-41

[03:01] Team_009 possession (Score: 58-41)
Miles Sabonis attempts a 3Pt. Contested by Ja Oladipo (4.4 feet, ZONE). Miles Sabonis misses. Rebound secured by Jimmy Griffin.

[02:48] Team_049 possession (Score: 58-41)
De'Aaron Allen attempts a 3Pt. Contested by Cole Mitchell (2.6 feet, MAN). De'Aaron Allen misses. Rebound secured by Cole Mitchell.

[02:37] Team_009 possession (Score: 58-41)
Desmond Harden attempts a Midrange. Wide open! Jimmy Griffin is 6.2 feet away. [ZONE] DESMOND HARDEN MAKES IT!
Score: 60-41

[02:21] Team_049 possession (Score: 60-41)
Shai Mobley drives and kicks out. De'Aaron Allen attempts a 3Pt. Wide open! Cole Mitchell is 9.5 feet away. [MAN] De'Aaron Allen misses. Rebound secured by Cole Mitchell.

[02:07] Team_009 possession (Score: 60-41)
Kyle Brogdon attempts a Layup. BLOCKED BY SHAI MOBLEY! Ball is loose! Offensive rebound by Cole Mitchell! Cole Mitchell kicks it out.

[01:50] Team_009 possession (Score: 60-41)
Miles Sabonis attempts a 3Pt. Wide open! Shai Bird is 7.0 feet away. [MAN] Miles Sabonis misses. Offensive rebound by Kyle Brogdon! Kyle Brogdon kicks it out.

[01:40] Team_009 possession (Score: 60-41)
Miles Sabonis attempts a Layup. Wide open! De'Aaron Allen is 6.4 feet away. [ZONE] MILES SABONIS MAKES IT! Assist: Cole Mitchell
Score: 62-41

[01:23] Team_049 possession (Score: 62-41)
Ja Oladipo drives, picks up Kyle Brogdon. Help arrives from Miles Sabonis! Ja Oladipo attempts a Dunk. Contested by Miles Sabonis (6.0 feet, ZONE). JA OLADIPO MAKES IT! Assist: Shai Mobley
Score: 62-43

[01:12] Team_009 possession (Score: 62-43)
Desmond Harden loses the ball! Stripped by Ja Oladipo! TURNOVER! (live ball)

[00:59] Team_049 possession (Score: 62-43)
Shai Bird throws a bad pass out of bounds! TURNOVER! (dead ball)

[00:59] Substitution (Team_009): Miles Sabonis OUT → Paul Trent IN (stamina_rule2)

[00:59] Substitution (Team_009): Desmond Harden OUT → Evan Curry IN (stamina_rule2)

[00:59] Substitution (Team_009): Anfernee Anunoby OUT → RJ Jokic IN (stamina_rule2)

[00:59] Substitution (Team_009): Cole Mitchell OUT → Kawhi Herro IN (stamina_rule2)

[00:59] Substitution (Team_009): Kyle Brogdon OUT → Shaquille Green IN (stamina_rule2)

[00:59] Substitution (Team_049): Shai Bird OUT → Shaquille Lillard IN (stamina_rule2)

[00:59] Substitution (Team_049): Ja Oladipo OUT → Shai Jordan IN (stamina_rule2)

[00:59] Substitution (Team_049): Jimmy Griffin OUT → Desmond Towns IN (stamina_rule2)

[00:59] Substitution (Team_049): De'Aaron Allen OUT → Giannis Anunoby IN (stamina_rule2)

[00:59] Substitution (Team_049): Shai Mobley OUT → Miles Jackson IN (stamina_rule2)

[00:42] Team_009 possession (Score: 62-43)
Evan Curry attempts a 3Pt. Contested by Shai Jordan (5.4 feet, MAN). Evan Curry misses. Rebound secured by Giannis Anunoby.

[00:27] Team_049 possession (Score: 62-43)
Miles Jackson drives to the basket... Miles Jackson loses the ball! Stripped by Shaquille Green! TURNOVER! (live ball)

[00:16] Team_009 possession (Score: 62-43)
FOUL! Shooting foul on Shai Jordan. Evan Curry to the line for 2 free throws. [BONUS: 7 team fouls] (Shai Jordan: 1 personal fouls)   FT 1/2: GOOD   FT 2/2: GOOD Evan Curry makes 2/2 from the line.
Score: 64-43

[00:03] Team_049 possession (Score: 64-43)
Miles Jackson drives, Kawhi Herro stays with him. Miles Jackson attempts a Layup. Heavily contested by Kawhi Herro (0.5 feet, ZONE)! MILES JACKSON MAKES IT!
Score: 64-45

================================================================================
                              2ND QUARTER COMPLETE                              
================================================================================

2ND QUARTER SCORE: Team_009 34, Team_049 20

BOX SCORE:
================================================================================

Team_009
--------------------------------------------------------------------------------
Player                MIN  PTS  REB  AST  TO      FG   FG%      3P   3P%
--------------------------------------------------------------------------------
Anfernee Anunoby       23   11    4    1   0   4/4   100.0     0/0   0.0
Kyle Brogdon           23    7    5    2   0   3/4    75.0     0/0   0.0
Cole Mitchell          23    5    7    1   0   2/4    50.0     0/0   0.0
Desmond Harden         23    5    0    1   0   2/3    66.7     0/0   0.0
Miles Sabonis          23    4    0    0   0   2/3    66.7     0/0   0.0
Evan Curry              1    2    0    0   0   1/2    50.0     0/0   0.0

TEAM: FG: 14/20 (70.0%), 3PT: 3/6 (50.0%), REB: 16 (5 off, 11 def), AST: 5, TO: 2
TEAM FOULS: 5 [Team_049 in BONUS]


Team_049
--------------------------------------------------------------------------------
Player                MIN  PTS  REB  AST  TO      FG   FG%      3P   3P%
--------------------------------------------------------------------------------
Shai Bird              23    6    0    0   0   2/3    66.7     0/0   0.0
Shai Mobley            23    5    2    1   0   2/4    50.0     0/0   0.0
De'Aaron Allen         23    5    1    0   0   2/5    40.0     0/0   0.0
Ja Oladipo             23    2    0    1   0   1/3    33.3     0/0   0.0
Miles Jackson           1    2    0    0   0   1/1   100.0     0/0   0.0
Jimmy Griffin          23    0    3    1   0   0/3     0.0     0/0   0.0
Giannis Anunoby         1    0    1    0   0   0/0     0.0     0/0   0.0

TEAM: FG: 8/19 (42.1%), 3PT: 3/8 (37.5%), REB: 7 (1 off, 6 def), AST: 3, TO: 3
TEAM FOULS: 7 [Team_009 in BONUS]

================================================================================

================================================================================
                       3RD QUARTER - Team_009 vs Team_049                       
================================================================================

[12:00] Team_009 possession (Score: 64-45)
Miles Sabonis attempts a Midrange. Contested by Shai Bird (5.7 feet, MAN). Miles Sabonis misses. Rebound secured by De'Aaron Allen.

[11:47] Team_049 possession (Score: 64-45)
Shai Mobley attempts a Midrange. Contested by Anfernee Anunoby (5.2 feet, ZONE). Shai Mobley misses. Rebound secured by Cole Mitchell.

[11:37] Team_009 possession (Score: 64-45)
FOUL! Shooting foul on De'Aaron Allen. Kyle Brogdon to the line for 2 free throws. [Team fouls: 1] (De'Aaron Allen: 1 personal fouls)   FT 1/2: GOOD   FT 2/2: MISS Kyle Brogdon makes 1/2 from the line. Offensive rebound by Kyle Brogdon! Kyle Brogdon puts it back in!
Score: 67-45

[11:19] Team_049 possession (Score: 67-45)
Shai Bird attempts a 3Pt. Contested by Miles Sabonis (3.4 feet, MAN). Shai Bird misses. Rebound secured by Kyle Brogdon.

[11:09] Team_009 possession (Score: 67-45)
Cole Mitchell drives and kicks out. Anfernee Anunoby attempts a 3Pt. Wide open! Ja Oladipo is 8.4 feet away. [ZONE] Anfernee Anunoby misses. Rebound secured by Shai Mobley.

[10:59] Team_049 possession (Score: 67-45)
Shai Mobley attempts a 3Pt. Contested by Miles Sabonis (3.5 feet, ZONE). Shai Mobley misses. Rebound secured by Anfernee Anunoby.

[10:46] Team_009 possession (Score: 67-45)
Anfernee Anunoby makes the Layup and draws the foul on Jimmy Griffin! And-1! Anfernee Anunoby to the line for 1. [Team fouls: 2] (Jimmy Griffin: 1 personal fouls)   FT 1/1: GOOD Anfernee Anunoby makes 1/1 from the line.
Score: 70-45

[10:34] Team_049 possession (Score: 70-45)
Ja Oladipo attempts a Midrange. Wide open! Desmond Harden is 6.9 feet away. [MAN] JA OLADIPO MAKES IT!
Score: 70-47

[10:16] Team_009 possession (Score: 70-47)
Kyle Brogdon attempts a Midrange. Contested by Shai Mobley (3.9 feet, ZONE). Kyle Brogdon misses. Rebound secured by De'Aaron Allen.

[09:57] Team_049 possession (Score: 70-47)
De'Aaron Allen attempts a Layup. BLOCKED BY KYLE BROGDON! Ball is loose! Offensive rebound by Jimmy Griffin! Jimmy Griffin kicks it out.

[09:43] Team_049 possession (Score: 70-47)
Ja Oladipo attempts a Midrange. Contested by Desmond Harden (5.8 feet, ZONE). Ja Oladipo misses. Rebound secured by Cole Mitchell.

[09:29] Team_009 possession (Score: 70-47)
Cole Mitchell attempts a Midrange. Contested by Shai Bird (3.5 feet, ZONE). COLE MITCHELL MAKES IT! Assist: Desmond Harden
Score: 72-47

[09:14] Team_049 possession (Score: 72-47)
Shai Mobley makes the Layup and draws the foul on Kyle Brogdon! And-1! Shai Mobley to the line for 1. [Team fouls: 1] (Kyle Brogdon: 1 personal fouls)   FT 1/1: GOOD Shai Mobley makes 1/1 from the line.
Score: 72-50

[08:58] Team_009 possession (Score: 72-50)
Anfernee Anunoby attempts a 3Pt. Contested by Ja Oladipo (2.5 feet, ZONE). Anfernee Anunoby misses. Rebound secured by De'Aaron Allen.

[08:41] Team_049 possession (Score: 72-50)
Shai Mobley drives, Kyle Brogdon stays with him. Shai Mobley attempts a Layup. Contested by Kyle Brogdon (5.5 feet, MAN). Shai Mobley misses. Offensive rebound by Shai Mobley! Shai Mobley puts it back in!
Score: 72-52

[08:31] Team_009 possession (Score: 72-52)
Miles Sabonis attempts a 3Pt. Heavily contested by Ja Oladipo (1.7 feet, ZONE)! Miles Sabonis misses. Rebound secured by Jimmy Griffin.

[08:20] Team_049 possession (Score: 72-52)
Jimmy Griffin attempts a 3Pt. Wide open! Anfernee Anunoby is 7.4 feet away. [MAN] Jimmy Griffin misses. Rebound secured by Cole Mitchell.

[08:05] Team_009 possession (Score: 72-52)
FOUL! Reach-in foul on De'Aaron Allen during the drive. [Team fouls: 3] No free throws, side out. (De'Aaron Allen: 2 personal fouls)

[07:51] Team_009 possession (Score: 72-52)
Miles Sabonis drives and kicks out. Desmond Harden attempts a 3Pt. Contested by Ja Oladipo (4.5 feet, MAN). DESMOND HARDEN MAKES IT!
Score: 75-52

[07:38] Team_049 possession (Score: 75-52)
Jimmy Griffin attempts a Layup. Contested by Kyle Brogdon (5.4 feet, ZONE). JIMMY GRIFFIN MAKES IT! Assist: De'Aaron Allen
Score: 75-54

[07:23] Team_009 possession (Score: 75-54)
Kyle Brogdon attempts a Layup. Contested by Shai Mobley (5.0 feet, ZONE). Kyle Brogdon misses. Rebound secured by Jimmy Griffin.

[07:08] Team_049 possession (Score: 75-54)
Shai Mobley makes the Dunk and draws the foul on Kyle Brogdon! And-1! Shai Mobley to the line for 1. [Team fouls: 2] (Kyle Brogdon: 2 personal fouls)   FT 1/1: MISS Shai Mobley makes 0/1 from the line. Rebound secured by Kyle Brogdon.
Score: 75-56

[06:50] Team_009 possession (Score: 75-56)
FOUL! Shooting foul on De'Aaron Allen. Cole Mitchell to the line for 2 free throws. [Team fouls: 4] (De'Aaron Allen: 3 personal fouls)   FT 1/2: MISS   FT 2/2: MISS Cole Mitchell makes 0/2 from the line. Rebound secured by Jimmy Griffin.

[06:33] Team_049 possession (Score: 75-56)
Shai Mobley attempts a 3Pt. Contested by Miles Sabonis (4.9 feet, ZONE). SHAI MOBLEY MAKES IT! Assist: Jimmy Griffin
Score: 75-59

[06:20] Team_009 possession (Score: 75-59)
Kyle Brogdon attempts a Midrange. Contested by Shai Mobley (3.3 feet, MAN). Kyle Brogdon misses. Rebound secured by Shai Mobley.

[06:05] Team_049 possession (Score: 75-59)
Shai Bird attempts a Midrange. Wide open! Miles Sabonis is 7.8 feet away. [MAN] Shai Bird misses. Rebound secured by Cole Mitchell.

[05:47] Team_009 possession (Score: 75-59)
Miles Sabonis attempts a 3Pt. Contested by Ja Oladipo (4.6 feet, ZONE). Miles Sabonis misses. Rebound secured by De'Aaron Allen.

[05:34] Team_049 possession (Score: 75-59)
Jimmy Griffin attempts a Layup. Contested by Kyle Brogdon (3.1 feet, ZONE). Jimmy Griffin misses. Offensive rebound by Shai Mobley! Shai Mobley's putback is no good. Offensive rebound by Jimmy Griffin! Jimmy Griffin kicks it out.

[05:23] Team_049 possession (Score: 75-59)
Ja Oladipo attempts a 3Pt. Contested by Miles Sabonis (5.3 feet, ZONE). Ja Oladipo misses. Offensive rebound by Shai Mobley! Shai Mobley puts it back in!
Score: 75-61

[05:08] Team_009 possession (Score: 75-61)
FOUL! Reach-in foul on Shai Mobley during the drive. [IN THE BONUS! 5 team fouls] Kyle Brogdon to the line for 2 free throws. (Shai Mobley: 1 personal fouls)   FT 1/2: GOOD   FT 2/2: GOOD Kyle Brogdon makes 2/2 from the line.
Score: 77-61

[04:56] Team_049 possession (Score: 77-61)
De'Aaron Allen attempts a Midrange. Contested by Cole Mitchell (4.4 feet, MAN). De'Aaron Allen misses. Rebound secured by Anfernee Anunoby.

[04:42] Team_009 possession (Score: 77-61)
Desmond Harden attempts a 3Pt. Contested by Ja Oladipo (2.0 feet, ZONE). Desmond Harden misses. Rebound secured by Shai Mobley.

[04:28] Team_049 possession (Score: 77-61)
Shai Mobley drives to the basket... FOUL! Offensive foul on Shai Mobley! Kyle Brogdon drew the charge! [Team fouls: 6] (Shai Mobley: 2 personal fouls) TURNOVER! (dead ball)

[04:14] Team_009 possession (Score: 77-61)
Desmond Harden attempts a Layup. Wide open! Shai Mobley is 6.0 feet away. [ZONE] Desmond Harden misses. Rebound secured by De'Aaron Allen.

[03:57] Team_049 possession (Score: 77-61)
Shai Mobley loses the ball! Stripped by Kyle Brogdon! TURNOVER! (live ball)

[03:40] Team_009 possession (Score: 77-61)
Cole Mitchell throws a bad pass! Stolen by De'Aaron Allen! TURNOVER! (live ball)

[03:30] Team_049 possession (Score: 77-61)
Shai Mobley attempts a Layup. Wide open! Kyle Brogdon is 7.8 feet away. [MAN] SHAI MOBLEY MAKES IT!
Score: 77-63

[03:19] Team_009 possession (Score: 77-63)
Desmond Harden attempts a 3Pt. Wide open! Ja Oladipo is 9.3 feet away. [MAN] Desmond Harden misses. Offensive rebound by Kyle Brogdon! Kyle Brogdon puts it back in!
Score: 79-63

[03:08] Team_049 possession (Score: 79-63)
Jimmy Griffin attempts a 3Pt. Wide open! Anfernee Anunoby is 8.8 feet away. [ZONE] Jimmy Griffin misses. Rebound secured by Cole Mitchell.

[02:49] Team_009 possession (Score: 79-63)
Anfernee Anunoby attempts a 3Pt. Contested by Ja Oladipo (4.2 feet, ZONE). Anfernee Anunoby misses. Rebound secured by Jimmy Griffin.

[02:34] Team_049 possession (Score: 79-63)
De'Aaron Allen drives to the basket... De'Aaron Allen loses the ball! Stripped by Cole Mitchell! TURNOVER! (live ball)

[02:18] Team_009 possession (Score: 79-63)
Anfernee Anunoby drives, picks up Jimmy Griffin. Help arrives from Ja Oladipo! Anfernee Anunoby attempts a Dunk. Contested by Ja Oladipo (4.1 feet, MAN). ANFERNEE ANUNOBY MAKES IT! Assist: Miles Sabonis
Score: 81-63

[02:05] Team_049 possession (Score: 81-63)
Jimmy Griffin drives, Kyle Brogdon stays with him. Jimmy Griffin attempts a Layup. Contested by Kyle Brogdon (3.1 feet, ZONE). Jimmy Griffin misses. Rebound secured by Cole Mitchell.

[01:50] Team_009 possession (Score: 81-63)
Kyle Brogdon attempts a 3Pt. Wide open! Ja Oladipo is 6.9 feet away. [ZONE] KYLE BROGDON MAKES IT! Assist: Anfernee Anunoby
Score: 84-63

[01:39] Team_049 possession (Score: 84-63)
Shai Mobley drives and kicks out. Shai Bird attempts a Midrange. BLOCKED BY MILES SABONIS! Ball is loose! Rebound secured by Anfernee Anunoby.

[01:24] Team_009 possession (Score: 84-63)
Cole Mitchell attempts a Layup. Heavily contested by De'Aaron Allen (1.7 feet, ZONE)! Cole Mitchell misses. Rebound secured by De'Aaron Allen.

[01:09] Team_049 possession (Score: 84-63)
Shai Bird attempts a 3Pt. Contested by Miles Sabonis (2.0 feet, ZONE). SHAI BIRD MAKES IT! Assist: De'Aaron Allen
Score: 84-66

[01:00] Team_009 possession (Score: 84-66)
Anfernee Anunoby loses the ball! Stripped by Jimmy Griffin! TURNOVER! (live ball)

[00:42] Team_049 possession (Score: 84-66)
Shai Mobley attempts a Layup. Contested by Kyle Brogdon (4.2 feet, MAN). Shai Mobley misses. Rebound secured by Kyle Brogdon.

[00:30] Team_009 possession (Score: 84-66)
Cole Mitchell attempts a 3Pt. Contested by De'Aaron Allen (5.9 feet, MAN). Cole Mitchell misses. Rebound secured by Jimmy Griffin.

[00:14] Team_049 possession (Score: 84-66)
FOUL! Reach-in foul on Kyle Brogdon during the drive. [Team fouls: 3] No free throws, side out. (Kyle Brogdon: 3 personal fouls)

[00:01] Team_049 possession (Score: 84-66)
FOUL! Shooting foul on Cole Mitchell. De'Aaron Allen to the line for 2 free throws. [Team fouls: 4] (Cole Mitchell: 1 personal fouls)   FT 1/2: GOOD   FT 2/2: GOOD De'Aaron Allen makes 2/2 from the line.
Score: 84-68

================================================================================
                              3RD QUARTER COMPLETE                              
================================================================================

3RD QUARTER SCORE: Team_009 20, Team_049 23

BOX SCORE:
================================================================================

Team_009
--------------------------------------------------------------------------------
Player                MIN  PTS  REB  AST  TO      FG   FG%      3P   3P%
--------------------------------------------------------------------------------
Kyle Brogdon           36   10    4    0   0   4/7    57.1     0/0   0.0
Anfernee Anunoby       36    5    3    1   0   2/4    50.0     0/0   0.0
Desmond Harden         36    3    0    1   0   1/3    33.3     0/0   0.0
Cole Mitchell          36    2    6    0   0   1/5    20.0     0/0   0.0
Miles Sabonis          36    0    0    1   0   0/3     0.0     0/0   0.0

TEAM: FG: 8/22 (36.4%), 3PT: 2/8 (25.0%), REB: 13 (1 off, 12 def), AST: 3, TO: 2
TEAM FOULS: 4


Team_049
--------------------------------------------------------------------------------
Player                MIN  PTS  REB  AST  TO      FG   FG%      3P   3P%
--------------------------------------------------------------------------------
Shai Mobley            36   12    5    0   0   5/10   50.0     0/0   0.0
Shai Bird              36    3    0    0   0   1/3    33.3     0/0   0.0
De'Aaron Allen         36    2    6    2   0   1/2    50.0     0/0   0.0
Ja Oladipo             36    2    0    0   0   1/2    50.0     0/0   0.0
Jimmy Griffin          36    2    7    1   0   1/4    25.0     0/0   0.0

TEAM: FG: 9/21 (42.9%), 3PT: 3/7 (42.9%), REB: 18 (4 off, 14 def), AST: 3, TO: 3
TEAM FOULS: 6 [Team_009 in BONUS]

================================================================================

================================================================================
                       4TH QUARTER - Team_009 vs Team_049                       
================================================================================

[12:00] Team_009 possession (Score: 84-68)
Cole Mitchell attempts a Layup. Contested by De'Aaron Allen (3.0 feet, MAN). COLE MITCHELL MAKES IT! Assist: Desmond Harden
Score: 86-68

[11:48] Team_049 possession (Score: 86-68)
De'Aaron Allen drives, picks up Cole Mitchell. Help arrives from Miles Sabonis! De'Aaron Allen attempts a Dunk. Contested by Miles Sabonis (2.1 feet, MAN). DE'AARON ALLEN MAKES IT!
Score: 86-70

[11:31] Team_009 possession (Score: 86-70)
Anfernee Anunoby attempts a Layup. Contested by Jimmy Griffin (4.3 feet, MAN). Anfernee Anunoby misses. Offensive rebound by Kyle Brogdon! Kyle Brogdon kicks it out.

[11:12] Team_009 possession (Score: 86-70)
Kyle Brogdon attempts a 3Pt. Contested by Ja Oladipo (5.8 feet, ZONE). Kyle Brogdon misses. Rebound secured by De'Aaron Allen.

[10:57] Team_049 possession (Score: 86-70)
Jimmy Griffin attempts a Midrange. Contested by Anfernee Anunoby (2.9 feet, MAN). JIMMY GRIFFIN MAKES IT!
Score: 86-72

[10:46] Team_009 possession (Score: 86-72)
Cole Mitchell attempts a 3Pt. Contested by De'Aaron Allen (6.0 feet, MAN). Cole Mitchell misses. Rebound secured by Shai Mobley.

[10:31] Team_049 possession (Score: 86-72)
De'Aaron Allen drives and kicks out. De'Aaron Allen attempts a 3Pt. Contested by Miles Sabonis (5.6 feet, ZONE). DE'AARON ALLEN MAKES IT! Assist: Ja Oladipo
Score: 86-75

[10:15] Team_009 possession (Score: 86-75)
Miles Sabonis attempts a 3Pt. BLOCKED BY SHAI BIRD! Ball is loose! Rebound secured by De'Aaron Allen.

[10:00] Team_049 possession (Score: 86-75)
De'Aaron Allen attempts a Layup. Contested by Cole Mitchell (2.7 feet, ZONE). De'Aaron Allen misses. Rebound secured by Cole Mitchell.

[09:47] Team_009 possession (Score: 86-75)
Miles Sabonis commits a violation (traveling/carry)! TURNOVER! (dead ball)

[09:47] Substitution (Team_009): Miles Sabonis OUT → Paul Trent IN (stamina_rule2)

[09:47] Substitution (Team_009): Desmond Harden OUT → Evan Curry IN (stamina_rule2)

[09:47] Substitution (Team_009): Anfernee Anunoby OUT → RJ Jokic IN (stamina_rule2)

[09:47] Substitution (Team_009): Cole Mitchell OUT → Kawhi Herro IN (stamina_rule2)

[09:47] Substitution (Team_009): Kyle Brogdon OUT → Shaquille Green IN (stamina_rule2)

[09:47] Substitution (Team_049): Shai Bird OUT → Shaquille Lillard IN (stamina_rule2)

[09:47] Substitution (Team_049): Ja Oladipo OUT → Shai Jordan IN (stamina_rule2)

[09:47] Substitution (Team_049): Jimmy Griffin OUT → Desmond Towns IN (stamina_rule2)

[09:47] Substitution (Team_049): De'Aaron Allen OUT → Giannis Anunoby IN (stamina_rule2)

[09:47] Substitution (Team_049): Shai Mobley OUT → Miles Jackson IN (stamina_rule2)

[09:29] Team_049 possession (Score: 86-75)
Miles Jackson drives, picks up Kawhi Herro. Help arrives from Paul Trent! Miles Jackson attempts a Layup. Contested by Paul Trent (4.7 feet, ZONE). MILES JACKSON MAKES IT!
Score: 86-77

[09:16] Team_009 possession (Score: 86-77)
Paul Trent attempts a Midrange. Contested by Desmond Towns (2.9 feet, ZONE). Paul Trent misses. Offensive rebound by Kawhi Herro! Kawhi Herro's putback is no good. Rebound secured by Giannis Anunoby.

[08:57] Team_049 possession (Score: 86-77)
Desmond Towns attempts a Layup. Contested by Kawhi Herro (2.1 feet, ZONE). DESMOND TOWNS MAKES IT!
Score: 86-79

[08:43] Team_009 possession (Score: 86-79)
RJ Jokic attempts a 3Pt. Wide open! Desmond Towns is 8.3 feet away. [MAN] RJ Jokic misses. Rebound secured by Giannis Anunoby.

[08:27] Team_049 possession (Score: 86-79)
Miles Jackson attempts a Midrange. Contested by Kawhi Herro (4.9 feet, ZONE). MILES JACKSON MAKES IT! Assist: Desmond Towns
Score: 86-81

[08:13] Team_009 possession (Score: 86-81)
Evan Curry attempts a 3Pt. Wide open! Shaquille Lillard is 6.0 feet away. [ZONE] Evan Curry misses. Offensive rebound by Shaquille Green! Shaquille Green kicks it out.

[07:59] Team_009 possession (Score: 86-81)
Evan Curry drives to the basket... FOUL! Offensive foul on Evan Curry! Miles Jackson drew the charge! [Team fouls: 1] (Evan Curry: 1 personal fouls) TURNOVER! (dead ball)

[07:49] Team_049 possession (Score: 86-81)
Giannis Anunoby attempts a 3Pt. Wide open! Paul Trent is 9.3 feet away. [ZONE] Giannis Anunoby misses. Rebound secured by Kawhi Herro.

[07:35] Team_009 possession (Score: 86-81)
Paul Trent attempts a 3Pt. Contested by Shaquille Lillard (2.9 feet, ZONE). PAUL TRENT MAKES IT!
Score: 89-81

[07:24] Team_049 possession (Score: 89-81)
Desmond Towns drives and kicks out. Shaquille Lillard attempts a 3Pt. Contested by Paul Trent (5.4 feet, ZONE). Shaquille Lillard misses. Rebound secured by RJ Jokic.

[07:10] Team_009 possession (Score: 89-81)
Kawhi Herro makes the Layup and draws the foul on Miles Jackson! And-1! Kawhi Herro to the line for 1. [Team fouls: 1] (Miles Jackson: 1 personal fouls)   FT 1/1: MISS Kawhi Herro makes 0/1 from the line. Rebound secured by Miles Jackson.
Score: 91-81

[06:54] Team_049 possession (Score: 91-81)
FOUL! Offensive foul on Shai Jordan! Evan Curry drew the charge! [Team fouls: 2] (Shai Jordan: 1 personal fouls) TURNOVER! (dead ball)

[06:41] Team_009 possession (Score: 91-81)
Shaquille Green attempts a Midrange. Wide open! Shai Jordan is 6.3 feet away. [ZONE] Shaquille Green misses. Rebound secured by Giannis Anunoby.

[06:24] Team_049 possession (Score: 91-81)
Shaquille Lillard attempts a Midrange. Contested by RJ Jokic (4.0 feet, ZONE). SHAQUILLE LILLARD MAKES IT! Assist: Giannis Anunoby
Score: 91-83

[06:04] Team_009 possession (Score: 91-83)
RJ Jokic drives and kicks out. RJ Jokic attempts a Midrange. Wide open! Shai Jordan is 6.1 feet away. [ZONE] RJ JOKIC MAKES IT! Assist: Shaquille Green
Score: 93-83

[05:54] Team_049 possession (Score: 93-83)
Giannis Anunoby drives and kicks out. FOUL! Shooting foul on Evan Curry. Desmond Towns to the line for 2 free throws. [Team fouls: 2] (Evan Curry: 2 personal fouls)   FT 1/2: GOOD   FT 2/2: GOOD Desmond Towns makes 2/2 from the line.
Score: 93-85

[05:39] Team_009 possession (Score: 93-85)
Evan Curry attempts a Layup. Contested by Miles Jackson (3.9 feet, ZONE). EVAN CURRY MAKES IT! Assist: Kawhi Herro
Score: 95-85

[05:23] Team_049 possession (Score: 95-85)
FOUL! Holding foul on Kawhi Herro. [Team fouls: 3] No free throws, side out. (Kawhi Herro: 1 personal fouls)

[05:04] Team_049 possession (Score: 95-85)
Shaquille Lillard attempts a 3Pt. Wide open! Paul Trent is 8.0 feet away. [MAN] Shaquille Lillard misses. Rebound secured by Kawhi Herro.

[04:49] Team_009 possession (Score: 95-85)
Kawhi Herro drives and kicks out. Evan Curry attempts a Midrange. Wide open! Shai Jordan is 6.1 feet away. [MAN] Evan Curry misses. Rebound secured by Miles Jackson.

[04:30] Team_049 possession (Score: 95-85)
Miles Jackson attempts a Midrange. Wide open! Shaquille Green is 6.2 feet away. [MAN] Miles Jackson misses. Rebound secured by Kawhi Herro.

[04:14] Team_009 possession (Score: 95-85)
Evan Curry drives to the basket... Evan Curry loses control! Ball rolls out of bounds! TURNOVER! (dead ball)

[04:01] Team_049 possession (Score: 95-85)
Shai Jordan attempts a Layup. Wide open! Evan Curry is 7.6 feet away. [MAN] SHAI JORDAN MAKES IT! Assist: Shaquille Lillard
Score: 95-87

[03:45] Team_009 possession (Score: 95-87)
Shaquille Green attempts a 3Pt. Wide open! Miles Jackson is 6.2 feet away. [MAN] Shaquille Green misses. Rebound secured by Shai Jordan.

[03:32] Team_049 possession (Score: 95-87)
Shai Jordan attempts a 3Pt. Wide open! Paul Trent is 7.0 feet away. [ZONE] Shai Jordan misses. Rebound secured by Kawhi Herro.

[03:18] Team_009 possession (Score: 95-87)
Shaquille Green drives, Miles Jackson stays with him. Shaquille Green attempts a Dunk. Heavily contested by Miles Jackson (1.2 feet, MAN)! Shaquille Green misses. Rebound secured by Miles Jackson.

[03:05] Team_049 possession (Score: 95-87)
Shaquille Lillard attempts a Midrange. Wide open! Paul Trent is 6.2 feet away. [MAN] SHAQUILLE LILLARD MAKES IT! Assist: Miles Jackson
Score: 95-89

[02:49] Team_009 possession (Score: 95-89)
FOUL! Reach-in foul on Miles Jackson during the drive. [Team fouls: 3] No free throws, side out. (Miles Jackson: 2 personal fouls)

[02:36] Team_009 possession (Score: 95-89)
FOUL! Holding foul on Giannis Anunoby. [Team fouls: 4] No free throws, side out. (Giannis Anunoby: 1 personal fouls)

[02:21] Team_009 possession (Score: 95-89)
Shaquille Green makes the Dunk and draws the foul on Shai Jordan! And-1! Shaquille Green to the line for 1. [BONUS: 5 team fouls] (Shai Jordan: 2 personal fouls)   FT 1/1: GOOD Shaquille Green makes 1/1 from the line.
Score: 98-89

[02:02] Team_049 possession (Score: 98-89)
Shaquille Lillard attempts a 3Pt. Wide open! Paul Trent is 8.4 feet away. [ZONE] Shaquille Lillard misses. Rebound secured by RJ Jokic.

[01:46] Team_009 possession (Score: 98-89)
Shaquille Green attempts a Layup. Heavily contested by Miles Jackson (1.7 feet, ZONE)! Shaquille Green misses. Rebound secured by Miles Jackson.

[01:27] Team_049 possession (Score: 98-89)
Miles Jackson attempts a Layup. Contested by Shaquille Green (5.5 feet, MAN). MILES JACKSON MAKES IT!
Score: 98-91

[01:10] Team_009 possession (Score: 98-91)
Paul Trent loses the ball! Stripped by Shaquille Lillard! TURNOVER! (live ball)

[00:55] Team_049 possession (Score: 98-91)
Shai Jordan attempts a 3Pt. Contested by Evan Curry (2.4 feet, MAN). SHAI JORDAN MAKES IT! Assist: Desmond Towns
Score: 98-94

[00:36] Team_009 possession (Score: 98-94)
Paul Trent attempts a 3Pt. Contested by Shaquille Lillard (5.5 feet, MAN). PAUL TRENT MAKES IT! Assist: Kawhi Herro
Score: 101-94

[00:22] Team_049 possession (Score: 101-94)
Miles Jackson attempts a Midrange. Wide open! Shaquille Green is 6.3 feet away. [MAN] Miles Jackson misses. Rebound secured by Kawhi Herro.

[00:09] Team_009 possession (Score: 101-94)
FOUL! Reach-in foul on Shaquille Lillard during the drive. [IN THE BONUS! 6 team fouls] Paul Trent to the line for 2 free throws. (Shaquille Lillard: 1 personal fouls)   FT 1/2: MISS   FT 2/2: GOOD Paul Trent makes 1/2 from the line.
Score: 102-94

================================================================================
                              4TH QUARTER COMPLETE                              
================================================================================

4TH QUARTER SCORE: Team_009 18, Team_049 26

BOX SCORE:
================================================================================

Team_009
--------------------------------------------------------------------------------
Player                MIN  PTS  REB  AST  TO      FG   FG%      3P   3P%
--------------------------------------------------------------------------------
Paul Trent             10    7    0    0   0   3/4    75.0     0/0   0.0
Shaquille Green        10    3    1    1   0   1/5    20.0     0/0   0.0
Cole Mitchell          38    2    1    0   0   1/2    50.0     0/0   0.0
RJ Jokic               10    2    2    0   0   1/2    50.0     0/0   0.0
Evan Curry             10    2    0    0   0   1/1   100.0     0/0   0.0
Desmond Harden         38    0    0    1   0   0/0     0.0     0/0   0.0
Kyle Brogdon           38    0    1    0   0   0/1     0.0     0/0   0.0
Miles Sabonis          38    0    0    0   0   0/1     0.0     0/0   0.0
Kawhi Herro            10    0    5    2   0   0/2     0.0     0/0   0.0

TEAM: FG: 7/18 (38.9%), 3PT: 2/7 (28.6%), REB: 11 (3 off, 8 def), AST: 4, TO: 4
TEAM FOULS: 3


Team_049
--------------------------------------------------------------------------------
Player                MIN  PTS  REB  AST  TO      FG   FG%      3P   3P%
--------------------------------------------------------------------------------
Miles Jackson          10    6    4    1   0   3/5    60.0     0/0   0.0
De'Aaron Allen         38    5    2    0   0   2/3    66.7     0/0   0.0
Shai Jordan            10    5    1    0   0   2/3    66.7     0/0   0.0
Desmond Towns          10    4    0    2   0   2/3    66.7     0/0   0.0
Shaquille Lillard      10    4    0    1   0   2/4    50.0     0/0   0.0
Jimmy Griffin          38    2    0    0   0   1/1   100.0     0/0   0.0
Shai Mobley            38    0    1    0   0   0/0     0.0     0/0   0.0
Ja Oladipo             38    0    0    1   0   0/0     0.0     0/0   0.0
Giannis Anunoby        10    0    3    1   0   0/1     0.0     0/0   0.0

TEAM: FG: 12/20 (60.0%), 3PT: 1/5 (20.0%), REB: 10 (0 off, 10 def), AST: 6, TO: 1
TEAM FOULS: 6 [Team_009 in BONUS]

================================================================================

================================================================================
                               FULL GAME COMPLETE                               
================================================================================

FINAL SCORE: Team_009 102, Team_049 94

SCORING BY QUARTER:
--------------------------------------------------------------------------------
Team                     Q1     Q2     Q3     Q4    FINAL
--------------------------------------------------------------------------------
Team_009                 30     34     20     18      102
Team_049                 25     20     23     26       94
--------------------------------------------------------------------------------

FULL GAME BOX SCORE:
================================================================================

Team_009
--------------------------------------------------------------------------------
Player                MIN  PTS  REB  AST  TO      FG   FG%      3P   3P%      FT STL BLK
--------------------------------------------------------------------------------
Miles Sabonis          38   10    0    2   1   6/16   37.5   2/9    22.2   0/0     1   3
Desmond Harden         38   14    0    6   2   5/8    62.5   2/3    66.7   2/2     0   0
Anfernee Anunoby       38   18    9    2   2   7/12   58.3   2/6    33.3   2/2     0   0
Cole Mitchell          38   16   19    2   2   8/17   47.1   1/4    25.0   1/3     1   0
Kyle Brogdon           38   26   15    4   0   8/13   61.5   1/2    50.0   6/7     2   1
Paul Trent             10    7    0    0   1   3/4    75.0   2/2   100.0   1/2     0   0
Evan Curry             10    4    0    0   0   2/3    66.7   0/1     0.0   2/2     0   0
RJ Jokic               10    2    2    0   0   1/2    50.0   0/1     0.0   0/0     0   0
Kawhi Herro            10    0    5    2   2   0/2     0.0   0/0     0.0   0/1     0   0
Shaquille Green        10    3    1    1   0   1/5    20.0   0/1     0.0   1/1     1   0

TEAM: FG: 41/82 (50.0%), 3PT: 10/29 (34.5%), REB: 52 (11 off, 41 def), AST: 19, TO: 10


Team_049
--------------------------------------------------------------------------------
Player                MIN  PTS  REB  AST  TO      FG   FG%      3P   3P%      FT STL BLK
--------------------------------------------------------------------------------
Shai Bird              38   15    0    1   3   6/13   46.2   6/9    66.7   0/0     0   1
Ja Oladipo             38    6    0    4   0   4/10   40.0   1/3    33.3   0/0     1   0
Jimmy Griffin          38    8   13    2   0   6/15   40.0   0/7     0.0   1/2     1   0
De'Aaron Allen         38   21   15    3   2   7/12   58.3   1/2    50.0   4/4     1   1
Shai Mobley            38   21   13    1   3   6/13   46.2   1/2    50.0   3/4     0   2
Shaquille Lillard      10    4    0    1   1   2/4    50.0   0/2     0.0   0/0     1   0
Shai Jordan            10    5    1    0   1   2/3    66.7   1/2    50.0   0/0     0   0
Desmond Towns          10    4    0    2   0   1/2    50.0   0/0     0.0   2/2     0   0
Giannis Anunoby        10    0    4    1   0   1/2    50.0   0/1     0.0   0/0     0   0
Miles Jackson          10    8    4    1   0   4/6    66.7   0/0     0.0   0/0     0   0

TEAM: FG: 39/80 (48.8%), 3PT: 10/28 (35.7%), REB: 47 (8 off, 39 def), AST: 16, TO: 10

================================================================================
