================================================================================
                        FULL GAME - Team_097 vs Team_058                        
================================================================================

================================================================================
                       1ST QUARTER - Team_097 vs Team_058                       
================================================================================

[12:00] Team_097 possession (Score: 0-0)
Shai Poole attempts a 3Pt. Contested by Bradley Sexton (4.2 feet, ZONE). Shai Poole misses. Rebound secured by Tyrese Doncic.

[11:47] Team_058 possession (Score: 0-0)
Vince Hyland attempts a 3Pt. Contested by Shai Poole (2.7 feet, MAN). Vince Hyland misses. Rebound secured by Shai Poole.

[11:36] Team_097 possession (Score: 0-0)
Tyrese Stewart drives to the basket... Tyrese Stewart throws a bad pass out of bounds! TURNOVER! (dead ball)

[11:18] Team_058 possession (Score: 0-0)
Kyle Westbrook attempts a Layup. Contested by Anthony Haliburton (3.9 feet, ZONE). Kyle Westbrook misses. Rebound secured by Shai Poole.

[11:02] Team_097 possession (Score: 0-0)
Evan Brogdon attempts a Midrange. Contested by Stephen Haliburton (4.1 feet, ZONE). EVAN BROGDON MAKES IT!
Score: 2-0

[10:46] Team_058 possession (Score: 2-0)
Vince Hyland attempts a 3Pt. Contested by Shai Poole (2.7 feet, ZONE). Vince Hyland misses. Rebound secured by Shai Poole.

[10:31] Team_097 possession (Score: 2-0)
Jrue Haliburton attempts a Layup. Contested by Kyle Westbrook (4.8 feet, MAN). JRUE HALIBURTON MAKES IT!
Score: 4-0

[10:15] Team_058 possession (Score: 4-0)
Bradley Sexton drives, picks up Evan Brogdon. Help arrives from Shai Poole! Bradley Sexton attempts a Dunk. Heavily contested by Shai Poole (0.5 feet, MAN)! BRADLEY SEXTON MAKES IT! Assist: Stephen Haliburton
Score: 4-2

[10:00] Team_097 possession (Score: 4-2)
Shai Poole attempts a 3Pt. Wide open! Vince Hyland is 8.4 feet away. [MAN] SHAI POOLE MAKES IT! Assist: Evan Brogdon
Score: 7-2

[09:49] Team_058 possession (Score: 7-2)
Tyrese Doncic drives and kicks out. Kyle Westbrook attempts a Midrange. Contested by Jrue Haliburton (4.1 feet, MAN). KYLE WESTBROOK MAKES IT!
Score: 7-4

[09:38] Team_097 possession (Score: 7-4)
Anthony Haliburton attempts a Midrange. Contested by Stephen Haliburton (2.6 feet, MAN). Anthony Haliburton misses. Rebound secured by Stephen Haliburton.

[09:27] Team_058 possession (Score: 7-4)
Bradley Sexton attempts a 3Pt. Contested by Evan Brogdon (3.5 feet, MAN). BRADLEY SEXTON MAKES IT! Assist: Tyrese Doncic
Score: 7-7

[09:13] Team_097 possession (Score: 7-7)
Tyrese Stewart loses the ball! Stripped by Tyrese Doncic! TURNOVER! (live ball)

[08:57] Team_058 possession (Score: 7-7)
Tyrese Doncic attempts a 3Pt. Contested by Jrue Haliburton (4.4 feet, ZONE). TYRESE DONCIC MAKES IT! Assist: Bradley Sexton
Score: 7-10

[08:39] Team_097 possession (Score: 7-10)
Jrue Haliburton attempts a 3Pt. Wide open! Kyle Westbrook is 6.6 feet away. [MAN] JRUE HALIBURTON MAKES IT! Assist: Shai Poole
Score: 10-10

[08:24] Team_058 possession (Score: 10-10)
FOUL! Holding foul on Shai Poole. [Team fouls: 1] No free throws, side out. (Shai Poole: 1 personal fouls)

[08:04] Team_058 possession (Score: 10-10)
FOUL! Holding foul on Jrue Haliburton. [Team fouls: 2] No free throws, side out. (Jrue Haliburton: 1 personal fouls)

[07:45] Team_058 possession (Score: 10-10)
Vince Hyland throws a bad pass! Stolen by Shai Poole! TURNOVER! (live ball)

[07:27] Team_097 possession (Score: 10-10)
FOUL! Holding foul on Vince Hyland. [Team fouls: 1] No free throws, side out. (Vince Hyland: 1 personal fouls)

[07:14] Team_097 possession (Score: 10-10)
Evan Brogdon attempts a Midrange. Heavily contested by Bradley Sexton (0.5 feet, MAN)! Evan Brogdon misses. Offensive rebound by Tyrese Stewart! Tyrese Stewart kicks it out.

[06:59] Team_097 possession (Score: 10-10)
Anthony Haliburton makes the Layup and draws the foul on Stephen Haliburton! And-1! Anthony Haliburton to the line for 1. [Team fouls: 2] (Stephen Haliburton: 1 personal fouls)   FT 1/1: GOOD Anthony Haliburton makes 1/1 from the line.
Score: 13-10

[06:46] Team_058 possession (Score: 13-10)
Kyle Westbrook makes the Layup and draws the foul on Anthony Haliburton! And-1! Kyle Westbrook to the line for 1. [Team fouls: 3] (Anthony Haliburton: 1 personal fouls)   FT 1/1: MISS Kyle Westbrook makes 0/1 from the line. FOUL! Loose ball foul on Tyrese Stewart during the free throw rebound! [Team fouls: 4] No free throws, side out. (Tyrese Stewart: 1 personal fouls)
Score: 13-12

[06:27] Team_058 possession (Score: 13-12)
Tyrese Doncic attempts a Midrange. Contested by Anthony Haliburton (2.5 feet, MAN). Tyrese Doncic misses. Rebound secured by Tyrese Stewart.

[06:09] Team_097 possession (Score: 13-12)
Shai Poole attempts a Layup. BLOCKED BY VINCE HYLAND! Ball is loose! Rebound secured by Tyrese Doncic.

[05:58] Team_058 possession (Score: 13-12)
Bradley Sexton makes the 3Pt and draws the foul on Shai Poole! And-1! Bradley Sexton to the line for 1. [BONUS: 5 team fouls] (Shai Poole: 2 personal fouls)   FT 1/1: MISS Bradley Sexton makes 0/1 from the line. Offensive rebound by Tyrese Doncic! Tyrese Doncic kicks it out.
Score: 13-15

[05:44] Team_058 possession (Score: 13-15)
Bradley Sexton attempts a 3Pt. Wide open! Evan Brogdon is 8.7 feet away. [MAN] BRADLEY SEXTON MAKES IT! Assist: Vince Hyland
Score: 13-18

[05:31] Team_097 possession (Score: 13-18)
Anthony Haliburton throws a bad pass! Stolen by Stephen Haliburton! TURNOVER! (live ball)

[05:16] Team_058 possession (Score: 13-18)
FOUL! Reach-in foul on Anthony Haliburton during the drive. [IN THE BONUS! 6 team fouls] Bradley Sexton to the line for 2 free throws. (Anthony Haliburton: 2 personal fouls)   FT 1/2: GOOD   FT 2/2: GOOD Bradley Sexton makes 2/2 from the line.
Score: 13-20

[05:00] Team_097 possession (Score: 13-20)
Anthony Haliburton drives, Stephen Haliburton stays with him. Anthony Haliburton attempts a Dunk. Contested by Stephen Haliburton (2.6 feet, MAN). ANTHONY HALIBURTON MAKES IT! Assist: Jrue Haliburton
Score: 15-20

[04:41] Team_058 possession (Score: 15-20)
FOUL! Holding foul on Anthony Haliburton. [IN THE BONUS! 7 team fouls] Stephen Haliburton to the line for 2 free throws. (Anthony Haliburton: 3 personal fouls)   FT 1/2: GOOD   FT 2/2: GOOD Stephen Haliburton makes 2/2 from the line.
Score: 15-22

[04:26] Team_097 possession (Score: 15-22)
Shai Poole attempts a Midrange. Contested by Vince Hyland (4.8 feet, MAN). SHAI POOLE MAKES IT! Assist: Jrue Haliburton
Score: 17-22

[04:10] Team_058 possession (Score: 17-22)
FOUL! Holding foul on Anthony Haliburton. [IN THE BONUS! 8 team fouls] Tyrese Doncic to the line for 2 free throws. (Anthony Haliburton: 4 personal fouls)   FT 1/2: GOOD   FT 2/2: GOOD Tyrese Doncic makes 2/2 from the line.
Score: 17-24

[03:54] Team_097 possession (Score: 17-24)
Tyrese Stewart attempts a Layup. Wide open! Tyrese Doncic is 6.2 feet away. [MAN] TYRESE STEWART MAKES IT!
Score: 19-24

[03:42] Team_058 possession (Score: 19-24)
Tyrese Doncic drives, Anthony Haliburton stays with him. Tyrese Doncic attempts a Dunk. Contested by Anthony Haliburton (2.7 feet, MAN). TYRESE DONCIC MAKES IT!
Score: 19-26

[03:25] Team_097 possession (Score: 19-26)
FOUL! Reach-in foul on Stephen Haliburton during the drive. [Team fouls: 3] No free throws, side out. (Stephen Haliburton: 2 personal fouls)

[03:08] Team_097 possession (Score: 19-26)
Shai Poole attempts a Midrange. Wide open! Vince Hyland is 6.1 feet away. [MAN] SHAI POOLE MAKES IT!
Score: 21-26

[02:51] Team_058 possession (Score: 21-26)
Kyle Westbrook attempts a 3Pt. Contested by Shai Poole (5.5 feet, ZONE). Kyle Westbrook misses. Rebound secured by Shai Poole.

[02:35] Team_097 possession (Score: 21-26)
Shai Poole loses control! Ball rolls out of bounds! TURNOVER! (dead ball)

[02:35] Substitution (Team_058): Kyle Westbrook OUT → Jordan Ingram IN (stamina_rule2)

[02:20] Team_058 possession (Score: 21-26)
Tyrese Doncic attempts a Midrange. Heavily contested by Shai Poole (0.7 feet, ZONE)! Tyrese Doncic misses. Rebound secured by Tyrese Stewart.

[02:04] Team_097 possession (Score: 21-26)
Tyrese Stewart drives and kicks out. Evan Brogdon attempts a 3Pt. Contested by Bradley Sexton (4.4 feet, MAN). EVAN BROGDON MAKES IT! Assist: Anthony Haliburton
Score: 24-26

[01:49] Team_058 possession (Score: 24-26)
Vince Hyland attempts a 3Pt. Contested by Shai Poole (3.3 feet, MAN). Vince Hyland misses. Rebound secured by Tyrese Stewart.

[01:30] Team_097 possession (Score: 24-26)
Shai Poole attempts a 3Pt. Wide open! Vince Hyland is 9.5 feet away. [MAN] SHAI POOLE MAKES IT! Assist: Tyrese Stewart
Score: 27-26

[01:12] Team_058 possession (Score: 27-26)
Jordan Ingram attempts a Midrange. Contested by Jrue Haliburton (4.0 feet, MAN). JORDAN INGRAM MAKES IT! Assist: Bradley Sexton
Score: 27-28

[00:58] Team_097 possession (Score: 27-28)
Jrue Haliburton drives, picks up Stephen Haliburton. Help arrives from Bradley Sexton! Jrue Haliburton attempts a Dunk. Contested by Bradley Sexton (3.7 feet, ZONE). Jrue Haliburton misses. Rebound secured by Tyrese Doncic.

[00:43] Team_058 possession (Score: 27-28)
Vince Hyland drives and kicks out. Stephen Haliburton attempts a Midrange. Wide open! Evan Brogdon is 7.6 feet away. [ZONE] STEPHEN HALIBURTON MAKES IT! Assist: Tyrese Doncic
Score: 27-30

[00:28] Team_097 possession (Score: 27-30)
Anthony Haliburton attempts a 3Pt. Contested by Bradley Sexton (4.3 feet, ZONE). ANTHONY HALIBURTON MAKES IT! Assist: Shai Poole
Score: 30-30

[00:13] Team_058 possession (Score: 30-30)
Bradley Sexton attempts a 3Pt. Wide open! Evan Brogdon is 9.7 feet away. [MAN] BRADLEY SEXTON MAKES IT! Assist: Jordan Ingram
Score: 30-33

================================================================================
                              1ST QUARTER COMPLETE                              
================================================================================

1ST QUARTER SCORE: Team_097 30, Team_058 33

BOX SCORE:
================================================================================

Team_097
--------------------------------------------------------------------------------
Player                MIN  PTS  REB  AST  TO      FG   FG%      3P   3P%
--------------------------------------------------------------------------------
Shai Poole             12   10    4    2   0   4/6    66.7     0/0   0.0
Anthony Haliburton     12    8    0    1   0   3/4    75.0     0/0   0.0
Evan Brogdon           12    5    0    1   0   2/2   100.0     0/0   0.0
Jrue Haliburton        12    5    0    2   0   2/3    66.7     0/0   0.0
Tyrese Stewart         12    2    4    1   0   1/1   100.0     0/0   0.0

TEAM: FG: 12/16 (75.0%), 3PT: 4/5 (80.0%), REB: 8 (1 off, 7 def), AST: 7, TO: 4
TEAM FOULS: 8 [Team_058 in BONUS]


Team_058
--------------------------------------------------------------------------------
Player                MIN  PTS  REB  AST  TO      FG   FG%      3P   3P%
--------------------------------------------------------------------------------
Bradley Sexton         12   13    0    2   0   5/5   100.0     0/0   0.0
Tyrese Doncic          12    7    4    2   0   3/5    60.0     0/0   0.0
Stephen Haliburton     12    4    2    1   0   2/2   100.0     0/0   0.0
Kyle Westbrook         10    2    0    0   0   1/3    33.3     0/0   0.0
Jordan Ingram           2    2    0    1   0   1/1   100.0     0/0   0.0
Vince Hyland           12    0    0    1   0   0/3     0.0     0/0   0.0

TEAM: FG: 12/19 (63.2%), 3PT: 4/8 (50.0%), REB: 6 (2 off, 4 def), AST: 7, TO: 1
TEAM FOULS: 3

================================================================================

================================================================================
                       2ND QUARTER - Team_097 vs Team_058                       
================================================================================

[12:00] Team_097 possession (Score: 30-33)
Anthony Haliburton attempts a Midrange. Contested by Stephen Haliburton (3.6 feet, MAN). ANTHONY HALIBURTON MAKES IT! Assist: Tyrese Stewart
Score: 32-33

[11:43] Team_058 possession (Score: 32-33)
Stephen Haliburton attempts a Midrange. Contested by Anthony Haliburton (4.4 feet, MAN). Stephen Haliburton misses. Rebound secured by Tyrese Stewart.

[11:29] Team_097 possession (Score: 32-33)
Anthony Haliburton attempts a Midrange. Contested by Vince Hyland (5.7 feet, ZONE). ANTHONY HALIBURTON MAKES IT! Assist: Shai Poole
Score: 34-33

[11:14] Team_058 possession (Score: 34-33)
Bradley Sexton attempts a 3Pt. Contested by Shai Poole (4.1 feet, ZONE). BRADLEY SEXTON MAKES IT!
Score: 34-36

[11:02] Team_097 possession (Score: 34-36)
Evan Brogdon attempts a 3Pt. Contested by Kyle Westbrook (4.6 feet, ZONE). EVAN BROGDON MAKES IT! Assist: Anthony Haliburton
Score: 37-36

[10:47] Team_058 possession (Score: 37-36)
Kyle Westbrook attempts a 3Pt. Contested by Jrue Haliburton (3.6 feet, MAN). KYLE WESTBROOK MAKES IT! Assist: Tyrese Doncic
Score: 37-39

[10:37] Team_097 possession (Score: 37-39)
Jrue Haliburton drives to the basket... Jrue Haliburton loses control! Ball rolls out of bounds! TURNOVER! (dead ball)

[10:37] Substitution (Team_097): Evan Brogdon OUT → Gary Carter IN (stamina_rule2)

[10:37] Substitution (Team_097): Jrue Haliburton OUT → Dwyane Ginobili IN (stamina_rule2)

[10:37] Substitution (Team_097): Shai Poole OUT → Miles Dosunmu IN (stamina_rule2)

[10:37] Substitution (Team_097): Anthony Haliburton OUT → Joel Simons IN (stamina_rule2)

[10:37] Substitution (Team_097): Tyrese Stewart OUT → Miles Banchero IN (stamina_rule2)

[10:37] Substitution (Team_058): Bradley Sexton OUT → Draymond Williamson IN (stamina_rule2)

[10:37] Substitution (Team_058): Vince Hyland OUT → Pascal Holiday IN (stamina_rule2)

[10:37] Substitution (Team_058): Stephen Haliburton OUT → Shai Lowry IN (stamina_rule2)

[10:37] Substitution (Team_058): Tyrese Doncic OUT → Jarrett Gilgeous-Alexander IN (stamina_rule2)

[10:27] Team_058 possession (Score: 37-39)
Kyle Westbrook attempts a Layup. Contested by Dwyane Ginobili (4.3 feet, MAN). Kyle Westbrook misses. Rebound secured by Joel Simons.

[10:12] Team_097 possession (Score: 37-39)
Miles Dosunmu throws a bad pass out of bounds! TURNOVER! (dead ball)

[09:55] Team_058 possession (Score: 37-39)
Shai Lowry attempts a Midrange. Heavily contested by Joel Simons (1.5 feet, MAN)! Shai Lowry misses. Rebound secured by Joel Simons.

[09:40] Team_097 possession (Score: 37-39)
Joel Simons attempts a Midrange. Wide open! Shai Lowry is 6.7 feet away. [MAN] Joel Simons misses. Offensive rebound by Joel Simons! Joel Simons kicks it out.

[09:27] Team_097 possession (Score: 37-39)
Dwyane Ginobili attempts a 3Pt. Contested by Kyle Westbrook (4.5 feet, ZONE). DWYANE GINOBILI MAKES IT! Assist: Miles Dosunmu
Score: 40-39

[09:13] Team_058 possession (Score: 40-39)
FOUL! Holding foul on Gary Carter. [Team fouls: 1] No free throws, side out. (Gary Carter: 1 personal fouls)

[08:58] Team_058 possession (Score: 40-39)
Shai Lowry attempts a 3Pt. Contested by Joel Simons (5.9 feet, ZONE). SHAI LOWRY MAKES IT! Assist: Draymond Williamson
Score: 40-42

[08:46] Team_097 possession (Score: 40-42)
Dwyane Ginobili drives and kicks out. Joel Simons attempts a 3Pt. Wide open! Kyle Westbrook is 8.7 feet away. [ZONE] Joel Simons misses. Rebound secured by Shai Lowry.

[08:33] Team_058 possession (Score: 40-42)
Kyle Westbrook makes the Layup and draws the foul on Dwyane Ginobili! And-1! Kyle Westbrook to the line for 1. [Team fouls: 2] (Dwyane Ginobili: 1 personal fouls)   FT 1/1: GOOD Kyle Westbrook makes 1/1 from the line.
Score: 40-45

[08:19] Team_097 possession (Score: 40-45)
Gary Carter attempts a Midrange. Contested by Draymond Williamson (4.1 feet, MAN). Gary Carter misses. FOUL! Loose ball foul on Shai Lowry during the rebound battle. [Team fouls: 1] No free throws, side out. (Shai Lowry: 1 personal fouls)

[08:08] Team_097 possession (Score: 40-45)
Miles Banchero attempts a Midrange. Wide open! Jarrett Gilgeous-Alexander is 6.8 feet away. [MAN] Miles Banchero misses. Rebound secured by Jarrett Gilgeous-Alexander.

[07:54] Team_058 possession (Score: 40-45)
FOUL! Reach-in foul on Joel Simons during the drive. [Team fouls: 3] No free throws, side out. (Joel Simons: 1 personal fouls)

[07:40] Team_058 possession (Score: 40-45)
Jarrett Gilgeous-Alexander throws a bad pass! Stolen by Joel Simons! TURNOVER! (live ball)

[07:25] Team_097 possession (Score: 40-45)
Miles Dosunmu attempts a 3Pt. Wide open! Pascal Holiday is 8.4 feet away. [MAN] MILES DOSUNMU MAKES IT! Assist: Gary Carter
Score: 43-45

[07:11] Team_058 possession (Score: 43-45)
Kyle Westbrook drives, picks up Joel Simons. Help arrives from Dwyane Ginobili! Kyle Westbrook attempts a Layup. Contested by Dwyane Ginobili (4.2 feet, ZONE). Kyle Westbrook misses. Offensive rebound by Shai Lowry! Shai Lowry kicks it out.

[06:53] Team_058 possession (Score: 43-45)
Pascal Holiday attempts a Layup. Heavily contested by Miles Dosunmu (0.5 feet, MAN)! PASCAL HOLIDAY MAKES IT!
Score: 43-47

[06:35] Team_097 possession (Score: 43-47)
Dwyane Ginobili attempts a 3Pt. Wide open! Kyle Westbrook is 6.3 feet away. [MAN] Dwyane Ginobili misses. Rebound secured by Pascal Holiday.

[06:20] Team_058 possession (Score: 43-47)
Kyle Westbrook attempts a 3Pt. Wide open! Joel Simons is 6.2 feet away. [ZONE] KYLE WESTBROOK MAKES IT! Assist: Jarrett Gilgeous-Alexander
Score: 43-50

[06:05] Team_097 possession (Score: 43-50)
FOUL! Reach-in foul on Pascal Holiday during the drive. [Team fouls: 2] No free throws, side out. (Pascal Holiday: 1 personal fouls)

[05:51] Team_097 possession (Score: 43-50)
Dwyane Ginobili attempts a 3Pt. Contested by Kyle Westbrook (4.5 feet, MAN). Dwyane Ginobili misses. Rebound secured by Shai Lowry.

[05:37] Team_058 possession (Score: 43-50)
Shai Lowry loses the ball! Stripped by Joel Simons! TURNOVER! (live ball)

[05:25] Team_097 possession (Score: 43-50)
Miles Banchero attempts a 3Pt. Contested by Jarrett Gilgeous-Alexander (4.3 feet, MAN). Miles Banchero misses. Rebound secured by Jarrett Gilgeous-Alexander.

[05:08] Team_058 possession (Score: 43-50)
Shai Lowry attempts a Midrange. Wide open! Miles Banchero is 6.1 feet away. [ZONE] Shai Lowry misses. Rebound secured by Miles Dosunmu.

[04:55] Team_097 possession (Score: 43-50)
FOUL! Holding foul on Draymond Williamson. [Team fouls: 3] No free throws, side out. (Draymond Williamson: 1 personal fouls)

[04:41] Team_097 possession (Score: 43-50)
Joel Simons attempts a 3Pt. Contested by Shai Lowry (5.3 feet, MAN). Joel Simons misses. Rebound secured by Pascal Holiday.

[04:23] Team_058 possession (Score: 43-50)
Shai Lowry attempts a Layup. Contested by Joel Simons (3.1 feet, ZONE). SHAI LOWRY MAKES IT! Assist: Pascal Holiday
Score: 43-52

[04:06] Team_097 possession (Score: 43-52)
Miles Dosunmu drives and kicks out. Miles Dosunmu attempts a Midrange. Contested by Pascal Holiday (5.4 feet, MAN). Miles Dosunmu misses. Rebound secured by Jarrett Gilgeous-Alexander.

[03:52] Team_058 possession (Score: 43-52)
Draymond Williamson attempts a Midrange. Wide open! Dwyane Ginobili is 7.5 feet away. [ZONE] DRAYMOND WILLIAMSON MAKES IT! Assist: Jarrett Gilgeous-Alexander
Score: 43-54

[03:38] Team_097 possession (Score: 43-54)
Miles Dosunmu attempts a 3Pt. Contested by Pascal Holiday (3.1 feet, MAN). Miles Dosunmu misses. Offensive rebound by Miles Dosunmu! Miles Dosunmu kicks it out.

[03:24] Team_097 possession (Score: 43-54)
FOUL! Reach-in foul on Shai Lowry during the drive. [Team fouls: 4] No free throws, side out. (Shai Lowry: 2 personal fouls)

[03:09] Team_097 possession (Score: 43-54)
Dwyane Ginobili drives and kicks out. Dwyane Ginobili attempts a 3Pt. Contested by Draymond Williamson (5.2 feet, ZONE). DWYANE GINOBILI MAKES IT! Assist: Miles Dosunmu
Score: 46-54

[02:53] Team_058 possession (Score: 46-54)
Shai Lowry makes the Layup and draws the foul on Joel Simons! And-1! Shai Lowry to the line for 1. [Team fouls: 4] (Joel Simons: 2 personal fouls)   FT 1/1: GOOD Shai Lowry makes 1/1 from the line.
Score: 46-57

[02:38] Team_097 possession (Score: 46-57)
Joel Simons attempts a 3Pt. Contested by Draymond Williamson (4.6 feet, ZONE). Joel Simons misses. FOUL! Loose ball foul on Pascal Holiday during the rebound battle. [IN THE BONUS! 5 team fouls] Miles Dosunmu to the line for 2 free throws. (Pascal Holiday: 2 personal fouls)   FT 1/2: MISS   FT 2/2: GOOD Miles Dosunmu makes 1/2 from the line.
Score: 47-57

[02:23] Team_058 possession (Score: 47-57)
Pascal Holiday attempts a 3Pt. BLOCKED BY MILES DOSUNMU! Ball is loose! Rebound secured by Joel Simons.

[02:07] Team_097 possession (Score: 47-57)
Miles Dosunmu attempts a Midrange. Wide open! Pascal Holiday is 7.5 feet away. [MAN] MILES DOSUNMU MAKES IT!
Score: 49-57

[01:52] Team_058 possession (Score: 49-57)
Shai Lowry loses control! Ball rolls out of bounds! TURNOVER! (dead ball)

[01:52] Substitution (Team_058): Kyle Westbrook OUT → Jordan Ingram IN (stamina_rule2)

[01:35] Team_097 possession (Score: 49-57)
Gary Carter attempts a Layup. BLOCKED BY SHAI LOWRY! Ball deflects out of bounds off Gary Carter.

[01:21] Team_058 possession (Score: 49-57)
Jordan Ingram attempts a Midrange. Wide open! Dwyane Ginobili is 8.0 feet away. [MAN] JORDAN INGRAM MAKES IT! Assist: Jarrett Gilgeous-Alexander
Score: 49-59

[01:06] Team_097 possession (Score: 49-59)
Dwyane Ginobili drives to the basket... Dwyane Ginobili throws a bad pass! Stolen by Shai Lowry! TURNOVER! (live ball)

[00:54] Team_058 possession (Score: 49-59)
Pascal Holiday drives, picks up Miles Dosunmu. Help arrives from Dwyane Ginobili! Pascal Holiday attempts a Dunk. Contested by Dwyane Ginobili (3.9 feet, MAN). PASCAL HOLIDAY MAKES IT! Assist: Jordan Ingram
Score: 49-61

[00:36] Team_097 possession (Score: 49-61)
Miles Dosunmu attempts a Midrange. Wide open! Jordan Ingram is 7.4 feet away. [ZONE] MILES DOSUNMU MAKES IT! Assist: Miles Banchero
Score: 51-61

[00:19] Team_058 possession (Score: 51-61)
Jarrett Gilgeous-Alexander commits a violation (traveling/carry)! TURNOVER! (dead ball)

[00:08] Team_097 possession (Score: 51-61)
Dwyane Ginobili drives to the basket... Dwyane Ginobili throws a bad pass out of bounds! TURNOVER! (dead ball)

================================================================================
                              2ND QUARTER COMPLETE                              
================================================================================

2ND QUARTER SCORE: Team_097 21, Team_058 28

BOX SCORE:
================================================================================

Team_097
--------------------------------------------------------------------------------
Player                MIN  PTS  REB  AST  TO      FG   FG%      3P   3P%
--------------------------------------------------------------------------------
Miles Dosunmu          11    8    2    2   0   4/5    80.0     0/0   0.0
Dwyane Ginobili        11    6    0    0   0   2/5    40.0     0/0   0.0
Anthony Haliburton     14    4    0    1   0   2/2   100.0     0/0   0.0
Evan Brogdon           14    3    0    0   0   1/1   100.0     0/0   0.0
Tyrese Stewart         14    0    1    1   0   0/0     0.0     0/0   0.0
Shai Poole             14    0    0    1   0   0/0     0.0     0/0   0.0
Joel Simons            11    0    5    0   0   0/1     0.0     0/0   0.0
Miles Banchero         11    0    0    1   0   0/2     0.0     0/0   0.0
Gary Carter            11    0    0    1   0   0/1     0.0     0/0   0.0

TEAM: FG: 9/17 (52.9%), 3PT: 4/8 (50.0%), REB: 8 (3 off, 5 def), AST: 7, TO: 4
TEAM FOULS: 4


Team_058
--------------------------------------------------------------------------------
Player                MIN  PTS  REB  AST  TO      FG   FG%      3P   3P%
--------------------------------------------------------------------------------
Kyle Westbrook         20    9    0    0   0   3/4    75.0     0/0   0.0
Shai Lowry             11    8    3    0   0   3/5    60.0     0/0   0.0
Pascal Holiday         11    4    2    1   0   2/3    66.7     0/0   0.0
Bradley Sexton         14    3    0    0   0   1/1   100.0     0/0   0.0
Draymond Williamson    11    2    0    1   0   1/1   100.0     0/0   0.0
Jordan Ingram           4    2    0    1   0   1/1   100.0     0/0   0.0
Stephen Haliburton     14    0    0    0   0   0/1     0.0     0/0   0.0
Tyrese Doncic          14    0    0    1   0   0/0     0.0     0/0   0.0
Jarrett Gilgeous-Alexander   11    0    3    3   0   0/0     0.0     0/0   0.0

TEAM: FG: 11/16 (68.8%), 3PT: 4/5 (80.0%), REB: 8 (1 off, 7 def), AST: 7, TO: 4
TEAM FOULS: 5 [Team_097 in BONUS]

================================================================================

================================================================================
                       3RD QUARTER - Team_097 vs Team_058                       
================================================================================

[12:00] Team_097 possession (Score: 51-61)
Anthony Haliburton attempts a Dunk. BLOCKED BY STEPHEN HALIBURTON! Ball deflects out of bounds off Anthony Haliburton.

[11:42] Team_058 possession (Score: 51-61)
FOUL! Reach-in foul on Anthony Haliburton during the drive. [Team fouls: 1] No free throws, side out. (Anthony Haliburton: 1 personal fouls)

[11:29] Team_058 possession (Score: 51-61)
Bradley Sexton attempts a Layup. Wide open! Anthony Haliburton is 6.5 feet away. [ZONE] Bradley Sexton misses. Rebound secured by Anthony Haliburton.

[11:18] Team_097 possession (Score: 51-61)
Tyrese Stewart attempts a 3Pt. Contested by Bradley Sexton (5.5 feet, ZONE). Tyrese Stewart misses. Rebound secured by Bradley Sexton.

[11:06] Team_058 possession (Score: 51-61)
Tyrese Doncic attempts a Midrange. Contested by Anthony Haliburton (2.5 feet, MAN). Tyrese Doncic misses. Rebound secured by Anthony Haliburton.

[10:53] Team_097 possession (Score: 51-61)
FOUL! Holding foul on Bradley Sexton. [Team fouls: 1] No free throws, side out. (Bradley Sexton: 1 personal fouls)

[10:37] Team_097 possession (Score: 51-61)
Tyrese Stewart attempts a Midrange. Wide open! Tyrese Doncic is 6.3 feet away. [MAN] Tyrese Stewart misses. Rebound secured by Tyrese Doncic.

[10:19] Team_058 possession (Score: 51-61)
Bradley Sexton attempts a 3Pt. Wide open! Shai Poole is 7.0 feet away. [ZONE] BRADLEY SEXTON MAKES IT! Assist: Tyrese Doncic
Score: 51-64

[10:03] Team_097 possession (Score: 51-64)
Evan Brogdon attempts a 3Pt. Contested by Bradley Sexton (3.7 feet, ZONE). Evan Brogdon misses. FOUL! Loose ball foul on Stephen Haliburton during the rebound battle. [Team fouls: 2] No free throws, side out. (Stephen Haliburton: 1 personal fouls)

[09:48] Team_097 possession (Score: 51-64)
FOUL! Reach-in foul on Stephen Haliburton during the drive. [Team fouls: 3] No free throws, side out. (Stephen Haliburton: 2 personal fouls)

[09:37] Team_097 possession (Score: 51-64)
Jrue Haliburton attempts a Midrange. Wide open! Kyle Westbrook is 6.6 feet away. [MAN] JRUE HALIBURTON MAKES IT!
Score: 53-64

[09:24] Team_058 possession (Score: 53-64)
Vince Hyland attempts a Midrange. Contested by Anthony Haliburton (4.1 feet, ZONE). Vince Hyland misses. Rebound secured by Anthony Haliburton.

[09:09] Team_097 possession (Score: 53-64)
Tyrese Stewart drives, picks up Tyrese Doncic. Help arrives from Bradley Sexton! Tyrese Stewart attempts a Dunk. Wide open! Bradley Sexton is 8.1 feet away. [MAN] Tyrese Stewart misses. Offensive rebound by Anthony Haliburton! Anthony Haliburton's putback is no good. Rebound secured by Tyrese Doncic.

[08:56] Team_058 possession (Score: 53-64)
Bradley Sexton attempts a 3Pt. Heavily contested by Shai Poole (1.7 feet, ZONE)! BRADLEY SEXTON MAKES IT! Assist: Kyle Westbrook
Score: 53-67

[08:43] Team_097 possession (Score: 53-67)
Tyrese Stewart drives to the basket... Tyrese Stewart throws a bad pass! Stolen by Stephen Haliburton! TURNOVER! (live ball)

[08:26] Team_058 possession (Score: 53-67)
Tyrese Doncic loses the ball! Stripped by Anthony Haliburton! TURNOVER! (live ball)

[08:10] Team_097 possession (Score: 53-67)
Evan Brogdon attempts a 3Pt. Contested by Bradley Sexton (2.8 feet, ZONE). EVAN BROGDON MAKES IT! Assist: Jrue Haliburton
Score: 56-67

[07:56] Team_058 possession (Score: 56-67)
Kyle Westbrook attempts a Midrange. Wide open! Jrue Haliburton is 7.0 feet away. [ZONE] KYLE WESTBROOK MAKES IT!
Score: 56-69

[07:47] Team_097 possession (Score: 56-69)
Anthony Haliburton attempts a 3Pt. Contested by Bradley Sexton (2.8 feet, ZONE). ANTHONY HALIBURTON MAKES IT! Assist: Shai Poole
Score: 59-69

[07:37] Team_058 possession (Score: 59-69)
Tyrese Doncic attempts a Layup. Heavily contested by Anthony Haliburton (1.2 feet, MAN)! TYRESE DONCIC MAKES IT! Assist: Kyle Westbrook
Score: 59-71

[07:25] Team_097 possession (Score: 59-71)
Shai Poole attempts a 3Pt. Contested by Bradley Sexton (2.9 feet, ZONE). SHAI POOLE MAKES IT! Assist: Jrue Haliburton
Score: 62-71

[07:06] Team_058 possession (Score: 62-71)
Vince Hyland attempts a 3Pt. Contested by Shai Poole (5.9 feet, MAN). VINCE HYLAND MAKES IT! Assist: Kyle Westbrook
Score: 62-74

[06:51] Team_097 possession (Score: 62-74)
Tyrese Stewart attempts a Layup. BLOCKED BY TYRESE DONCIC! Ball is loose! Rebound secured by Stephen Haliburton.

[06:37] Team_058 possession (Score: 62-74)
Tyrese Doncic attempts a Midrange. Contested by Anthony Haliburton (2.2 feet, ZONE). Tyrese Doncic misses. Rebound secured by Tyrese Stewart.

[06:22] Team_097 possession (Score: 62-74)
Anthony Haliburton attempts a Layup. Heavily contested by Stephen Haliburton (1.3 feet, MAN)! ANTHONY HALIBURTON MAKES IT! Assist: Shai Poole
Score: 64-74

[06:04] Team_058 possession (Score: 64-74)
Kyle Westbrook attempts a 3Pt. Contested by Shai Poole (2.6 feet, ZONE). Kyle Westbrook misses. Rebound secured by Anthony Haliburton.

[05:49] Team_097 possession (Score: 64-74)
Anthony Haliburton attempts a Layup. Heavily contested by Stephen Haliburton (0.5 feet, MAN)! Anthony Haliburton misses. Offensive rebound by Tyrese Stewart! Tyrese Stewart kicks it out.

[05:38] Team_097 possession (Score: 64-74)
Anthony Haliburton attempts a Midrange. Contested by Stephen Haliburton (4.8 feet, MAN). Anthony Haliburton misses. Rebound secured by Stephen Haliburton.

[05:24] Team_058 possession (Score: 64-74)
Tyrese Doncic attempts a Midrange. Contested by Anthony Haliburton (2.4 feet, MAN). Tyrese Doncic misses. Rebound secured by Anthony Haliburton.

[05:12] Team_097 possession (Score: 64-74)
Tyrese Stewart attempts a Midrange. Wide open! Vince Hyland is 8.1 feet away. [ZONE] Tyrese Stewart misses. Rebound secured by Tyrese Doncic.

[04:55] Team_058 possession (Score: 64-74)
Tyrese Doncic attempts a Layup. BLOCKED BY ANTHONY HALIBURTON! Ball deflects out of bounds off Tyrese Doncic.

[04:41] Team_097 possession (Score: 64-74)
Tyrese Stewart drives and kicks out. Evan Brogdon attempts a 3Pt. Heavily contested by Bradley Sexton (0.5 feet, ZONE)! Evan Brogdon misses. Rebound secured by Bradley Sexton.

[04:25] Team_058 possession (Score: 64-74)
FOUL! Offensive foul on Vince Hyland! Shai Poole drew the charge! [Team fouls: 4] (Vince Hyland: 1 personal fouls) TURNOVER! (dead ball)

[04:08] Team_097 possession (Score: 64-74)
Jrue Haliburton attempts a Layup. Contested by Kyle Westbrook (5.2 feet, MAN). Jrue Haliburton misses. Rebound secured by Tyrese Doncic.

[03:55] Team_058 possession (Score: 64-74)
Tyrese Doncic drives to the basket... Tyrese Doncic throws a bad pass! Stolen by Anthony Haliburton! TURNOVER! (live ball)

[03:44] Team_097 possession (Score: 64-74)
FOUL! Holding foul on Bradley Sexton. [IN THE BONUS! 5 team fouls] Evan Brogdon to the line for 2 free throws. (Bradley Sexton: 2 personal fouls)   FT 1/2: GOOD   FT 2/2: MISS Evan Brogdon makes 1/2 from the line. Rebound secured by Bradley Sexton.
Score: 65-74

[03:33] Team_058 possession (Score: 65-74)
Kyle Westbrook attempts a 3Pt. Contested by Evan Brogdon (5.3 feet, ZONE). Kyle Westbrook misses. Rebound secured by Shai Poole.

[03:17] Team_097 possession (Score: 65-74)
FOUL! Holding foul on Stephen Haliburton. [IN THE BONUS! 6 team fouls] Anthony Haliburton to the line for 2 free throws. (Stephen Haliburton: 3 personal fouls)   FT 1/2: MISS   FT 2/2: GOOD Anthony Haliburton makes 1/2 from the line.
Score: 66-74

[03:02] Team_058 possession (Score: 66-74)
Tyrese Doncic attempts a Midrange. Heavily contested by Anthony Haliburton (1.9 feet, MAN)! Tyrese Doncic misses. FOUL! Loose ball foul on Tyrese Stewart during the rebound battle. [Team fouls: 2] No free throws, side out. (Tyrese Stewart: 1 personal fouls)

[02:51] Team_058 possession (Score: 66-74)
Vince Hyland attempts a 3Pt. Contested by Shai Poole (2.3 feet, ZONE). Vince Hyland misses. Rebound secured by Anthony Haliburton.

[02:38] Team_097 possession (Score: 66-74)
Anthony Haliburton drives, Stephen Haliburton stays with him. Anthony Haliburton attempts a Dunk. Contested by Stephen Haliburton (3.6 feet, ZONE). Anthony Haliburton misses. Rebound secured by Tyrese Doncic.

[02:21] Team_058 possession (Score: 66-74)
Bradley Sexton attempts a 3Pt. Wide open! Shai Poole is 8.1 feet away. [ZONE] Bradley Sexton misses. Rebound secured by Tyrese Stewart.

[02:07] Team_097 possession (Score: 66-74)
Shai Poole attempts a 3Pt. Contested by Vince Hyland (4.5 feet, MAN). SHAI POOLE MAKES IT! Assist: Jrue Haliburton
Score: 69-74

[01:52] Team_058 possession (Score: 69-74)
Stephen Haliburton attempts a Layup. BLOCKED BY ANTHONY HALIBURTON! Ball is loose! Rebound secured by Tyrese Stewart.

[01:35] Team_097 possession (Score: 69-74)
Anthony Haliburton drives and kicks out. Shai Poole attempts a 3Pt. Contested by Vince Hyland (4.4 feet, MAN). SHAI POOLE MAKES IT! Assist: Anthony Haliburton
Score: 72-74

[01:23] Team_058 possession (Score: 72-74)
Bradley Sexton drives to the basket... Bradley Sexton throws a bad pass! Stolen by Evan Brogdon! TURNOVER! (live ball)

[01:05] Team_097 possession (Score: 72-74)
Tyrese Stewart drives and kicks out. Evan Brogdon attempts a Midrange. Wide open! Vince Hyland is 7.3 feet away. [ZONE] Evan Brogdon misses. Rebound secured by Stephen Haliburton.

[00:51] Team_058 possession (Score: 72-74)
Bradley Sexton attempts a Layup. Contested by Evan Brogdon (5.6 feet, MAN). BRADLEY SEXTON MAKES IT!
Score: 72-76

[00:35] Team_097 possession (Score: 72-76)
Tyrese Stewart attempts a Layup. Contested by Tyrese Doncic (5.0 feet, MAN). Tyrese Stewart misses. Offensive rebound by Tyrese Stewart! Tyrese Stewart kicks it out.

[00:24] Team_097 possession (Score: 72-76)
Jrue Haliburton attempts a Midrange. Contested by Kyle Westbrook (4.1 feet, MAN). Jrue Haliburton misses. Rebound secured by Tyrese Doncic.

[00:06] Team_058 possession (Score: 72-76)
Stephen Haliburton attempts a Layup. Heavily contested by Anthony Haliburton (1.1 feet, ZONE)! Stephen Haliburton misses. Rebound secured by Tyrese Stewart.

================================================================================
                              3RD QUARTER COMPLETE                              
================================================================================

3RD QUARTER SCORE: Team_097 21, Team_058 15

BOX SCORE:
================================================================================

Team_097
--------------------------------------------------------------------------------
Player                MIN  PTS  REB  AST  TO      FG   FG%      3P   3P%
--------------------------------------------------------------------------------
Shai Poole             26    9    1    2   0   3/3   100.0     0/0   0.0
Anthony Haliburton     26    6    6    1   0   3/6    50.0     0/0   0.0
Evan Brogdon           26    3    0    0   0   1/1   100.0     0/0   0.0
Jrue Haliburton        26    2    0    3   0   1/3    33.3     0/0   0.0
Tyrese Stewart         26    0    7    0   0   0/7     0.0     0/0   0.0

TEAM: FG: 8/21 (38.1%), 3PT: 4/5 (80.0%), REB: 15 (4 off, 11 def), AST: 6, TO: 1
TEAM FOULS: 2


Team_058
--------------------------------------------------------------------------------
Player                MIN  PTS  REB  AST  TO      FG   FG%      3P   3P%
--------------------------------------------------------------------------------
Bradley Sexton         26    8    3    0   0   3/5    60.0     0/0   0.0
Vince Hyland           26    3    0    0   0   1/3    33.3     0/0   0.0
Tyrese Doncic          26    2    7    1   0   1/5    20.0     0/0   0.0
Kyle Westbrook         32    2    0    3   0   1/3    33.3     0/0   0.0
Stephen Haliburton     26    0    3    0   0   0/2     0.0     0/0   0.0

TEAM: FG: 6/18 (33.3%), 3PT: 3/7 (42.9%), REB: 12 (1 off, 11 def), AST: 4, TO: 4
TEAM FOULS: 6 [Team_097 in BONUS]

================================================================================

================================================================================
                       4TH QUARTER - Team_097 vs Team_058                       
================================================================================

[12:00] Team_097 possession (Score: 72-76)
Tyrese Stewart throws a bad pass! Stolen by Tyrese Doncic! TURNOVER! (live ball)

[11:47] Team_058 possession (Score: 72-76)
Kyle Westbrook attempts a Midrange. Contested by Anthony Haliburton (3.2 feet, ZONE). Kyle Westbrook misses. Rebound secured by Tyrese Stewart.

[11:36] Team_097 possession (Score: 72-76)
Evan Brogdon attempts a 3Pt. Wide open! Bradley Sexton is 6.5 feet away. [MAN] EVAN BROGDON MAKES IT! Assist: Jrue Haliburton
Score: 75-76

[11:22] Team_058 possession (Score: 75-76)
Kyle Westbrook drives and kicks out. Kyle Westbrook attempts a Midrange. Wide open! Jrue Haliburton is 7.7 feet away. [MAN] KYLE WESTBROOK MAKES IT!
Score: 75-78

[11:06] Team_097 possession (Score: 75-78)
Tyrese Stewart drives and kicks out. Evan Brogdon attempts a Midrange. Wide open! Bradley Sexton is 6.9 feet away. [MAN] Evan Brogdon misses. Offensive rebound by Anthony Haliburton! Anthony Haliburton kicks it out.

[10:52] Team_097 possession (Score: 75-78)
Shai Poole attempts a 3Pt. Contested by Vince Hyland (3.8 feet, MAN). SHAI POOLE MAKES IT! Assist: Anthony Haliburton
Score: 78-78

[10:41] Team_058 possession (Score: 78-78)
Stephen Haliburton attempts a Layup. Contested by Anthony Haliburton (3.5 feet, MAN). STEPHEN HALIBURTON MAKES IT! Assist: Vince Hyland
Score: 78-80

[10:25] Team_097 possession (Score: 78-80)
Evan Brogdon attempts a 3Pt. Contested by Stephen Haliburton (4.5 feet, ZONE). Evan Brogdon misses. Rebound secured by Bradley Sexton.

[10:09] Team_058 possession (Score: 78-80)
Kyle Westbrook attempts a 3Pt. Contested by Shai Poole (5.8 feet, ZONE). KYLE WESTBROOK MAKES IT!
Score: 78-83

[09:55] Team_097 possession (Score: 78-83)
Tyrese Stewart attempts a Midrange. Contested by Tyrese Doncic (4.8 feet, MAN). Tyrese Stewart misses. Rebound secured by Bradley Sexton.

[09:45] Team_058 possession (Score: 78-83)
Vince Hyland attempts a 3Pt. Contested by Shai Poole (5.6 feet, ZONE). VINCE HYLAND MAKES IT! Assist: Stephen Haliburton
Score: 78-86

[09:31] Team_097 possession (Score: 78-86)
Jrue Haliburton drives, Kyle Westbrook stays with him. Jrue Haliburton attempts a Dunk. Contested by Kyle Westbrook (3.5 feet, MAN). Jrue Haliburton misses. Offensive rebound by Tyrese Stewart! Tyrese Stewart kicks it out.

[09:18] Team_097 possession (Score: 78-86)
Shai Poole attempts a 3Pt. Wide open! Bradley Sexton is 6.3 feet away. [ZONE] Shai Poole misses. Rebound secured by Tyrese Doncic.

[09:05] Team_058 possession (Score: 78-86)
Bradley Sexton drives and kicks out. Kyle Westbrook attempts a Midrange. Contested by Evan Brogdon (4.5 feet, ZONE). KYLE WESTBROOK MAKES IT! Assist: Bradley Sexton
Score: 78-88

[08:49] Team_097 possession (Score: 78-88)
Shai Poole attempts a 3Pt. Wide open! Vince Hyland is 6.9 feet away. [MAN] Shai Poole misses. Rebound secured by Tyrese Doncic.

[08:35] Team_058 possession (Score: 78-88)
Vince Hyland attempts a 3Pt. Contested by Shai Poole (5.0 feet, ZONE). Vince Hyland misses. Rebound secured by Anthony Haliburton.

[08:22] Team_097 possession (Score: 78-88)
FOUL! Reach-in foul on Tyrese Doncic during the drive. [Team fouls: 1] No free throws, side out. (Tyrese Doncic: 1 personal fouls)

[08:08] Team_097 possession (Score: 78-88)
FOUL! Holding foul on Bradley Sexton. [Team fouls: 2] No free throws, side out. (Bradley Sexton: 1 personal fouls)

[07:51] Team_097 possession (Score: 78-88)
Shai Poole attempts a 3Pt. Contested by Vince Hyland (2.9 feet, MAN). SHAI POOLE MAKES IT! Assist: Tyrese Stewart
Score: 81-88

[07:39] Team_058 possession (Score: 81-88)
Vince Hyland attempts a Layup. Contested by Anthony Haliburton (4.3 feet, ZONE). VINCE HYLAND MAKES IT!
Score: 81-90

[07:24] Team_097 possession (Score: 81-90)
Tyrese Stewart attempts a Midrange. Contested by Tyrese Doncic (5.5 feet, MAN). Tyrese Stewart misses. Rebound secured by Stephen Haliburton.

[07:05] Team_058 possession (Score: 81-90)
Tyrese Doncic loses control! Ball rolls out of bounds! TURNOVER! (dead ball)

[07:05] Substitution (Team_097): Evan Brogdon OUT → Gary Carter IN (stamina_rule2)

[07:05] Substitution (Team_097): Jrue Haliburton OUT → Dwyane Ginobili IN (stamina_rule2)

[07:05] Substitution (Team_097): Shai Poole OUT → Miles Dosunmu IN (stamina_rule2)

[07:05] Substitution (Team_097): Anthony Haliburton OUT → Joel Simons IN (stamina_rule2)

[07:05] Substitution (Team_097): Tyrese Stewart OUT → Miles Banchero IN (stamina_rule2)

[07:05] Substitution (Team_058): Bradley Sexton OUT → Draymond Williamson IN (stamina_rule2)

[07:05] Substitution (Team_058): Kyle Westbrook OUT → Jordan Ingram IN (stamina_rule2)

[07:05] Substitution (Team_058): Vince Hyland OUT → Pascal Holiday IN (stamina_rule2)

[07:05] Substitution (Team_058): Stephen Haliburton OUT → Shai Lowry IN (stamina_rule2)

[07:05] Substitution (Team_058): Tyrese Doncic OUT → Jarrett Gilgeous-Alexander IN (stamina_rule2)

[06:52] Team_097 possession (Score: 81-90)
FOUL! Shooting foul on Draymond Williamson. Miles Banchero to the line for 3 free throws. [Team fouls: 3] (Draymond Williamson: 1 personal fouls)   FT 1/3: GOOD   FT 2/3: GOOD   FT 3/3: GOOD Miles Banchero makes 3/3 from the line.
Score: 84-90

[06:37] Team_058 possession (Score: 84-90)
FOUL! Holding foul on Miles Dosunmu. [Team fouls: 1] No free throws, side out. (Miles Dosunmu: 1 personal fouls)

[06:22] Team_058 possession (Score: 84-90)
Draymond Williamson attempts a 3Pt. Contested by Joel Simons (5.1 feet, ZONE). Draymond Williamson misses. Rebound secured by Miles Banchero.

[06:09] Team_097 possession (Score: 84-90)
FOUL! Shooting foul on Shai Lowry. Miles Dosunmu to the line for 2 free throws. [Team fouls: 4] (Shai Lowry: 1 personal fouls)   FT 1/2: GOOD   FT 2/2: GOOD Miles Dosunmu makes 2/2 from the line.
Score: 86-90

[05:51] Team_058 possession (Score: 86-90)
Pascal Holiday drives and kicks out. Jarrett Gilgeous-Alexander attempts a 3Pt. Contested by Joel Simons (5.7 feet, ZONE). Jarrett Gilgeous-Alexander misses. Offensive rebound by Pascal Holiday! Pascal Holiday puts it back in!
Score: 86-92

[05:39] Team_097 possession (Score: 86-92)
Miles Dosunmu loses the ball! Stripped by Pascal Holiday! TURNOVER! (live ball)

[05:25] Team_058 possession (Score: 86-92)
FOUL! Holding foul on Dwyane Ginobili. [Team fouls: 2] No free throws, side out. (Dwyane Ginobili: 1 personal fouls)

[05:13] Team_058 possession (Score: 86-92)
Pascal Holiday attempts a 3Pt. Contested by Joel Simons (2.6 feet, ZONE). PASCAL HOLIDAY MAKES IT! Assist: Jordan Ingram
Score: 86-95

[04:56] Team_097 possession (Score: 86-95)
Miles Dosunmu makes the Layup and draws the foul on Jordan Ingram! And-1! Miles Dosunmu to the line for 1. [BONUS: 5 team fouls] (Jordan Ingram: 1 personal fouls)   FT 1/1: MISS Miles Dosunmu makes 0/1 from the line. Rebound secured by Shai Lowry.
Score: 88-95

[04:40] Team_058 possession (Score: 88-95)
Shai Lowry drives to the basket... Shai Lowry throws a bad pass out of bounds! TURNOVER! (dead ball)

[04:25] Team_097 possession (Score: 88-95)
Gary Carter attempts a 3Pt. Contested by Draymond Williamson (3.1 feet, MAN). Gary Carter misses. Rebound secured by Jarrett Gilgeous-Alexander.

[04:11] Team_058 possession (Score: 88-95)
Jordan Ingram attempts a 3Pt. Wide open! Joel Simons is 6.2 feet away. [ZONE] JORDAN INGRAM MAKES IT! Assist: Pascal Holiday
Score: 88-98

[03:51] Team_097 possession (Score: 88-98)
Miles Banchero drives to the basket... Miles Banchero throws a bad pass! Stolen by Shai Lowry! TURNOVER! (live ball)

[03:38] Team_058 possession (Score: 88-98)
Jordan Ingram drives and kicks out. Pascal Holiday makes the Midrange and draws the foul on Dwyane Ginobili! And-1! Pascal Holiday to the line for 1. [Team fouls: 3] (Dwyane Ginobili: 2 personal fouls)   FT 1/1: GOOD Pascal Holiday makes 1/1 from the line.
Score: 88-101

[03:26] Team_097 possession (Score: 88-101)
Gary Carter attempts a 3Pt. Wide open! Draymond Williamson is 7.4 feet away. [ZONE] Gary Carter misses. Rebound secured by Pascal Holiday.

[03:10] Team_058 possession (Score: 88-101)
Jordan Ingram drives, Joel Simons stays with him. Jordan Ingram attempts a Dunk. Heavily contested by Joel Simons (1.1 feet, ZONE)! Jordan Ingram misses. Rebound secured by Miles Banchero.

[02:54] Team_097 possession (Score: 88-101)
FOUL! Shooting foul on Jarrett Gilgeous-Alexander. Miles Banchero to the line for 2 free throws. [BONUS: 6 team fouls] (Jarrett Gilgeous-Alexander: 1 personal fouls)   FT 1/2: GOOD   FT 2/2: GOOD Miles Banchero makes 2/2 from the line.
Score: 90-101

[02:42] Team_058 possession (Score: 90-101)
Jordan Ingram drives and kicks out. Jordan Ingram attempts a 3Pt. Contested by Dwyane Ginobili (3.4 feet, MAN). Jordan Ingram misses. Rebound secured by Joel Simons.

[02:28] Team_097 possession (Score: 90-101)
Dwyane Ginobili attempts a 3Pt. Wide open! Jordan Ingram is 8.7 feet away. [MAN] DWYANE GINOBILI MAKES IT! Assist: Miles Banchero
Score: 93-101

[02:12] Team_058 possession (Score: 93-101)
Jarrett Gilgeous-Alexander drives to the basket... Jarrett Gilgeous-Alexander throws a bad pass! Stolen by Joel Simons! TURNOVER! (live ball)

[01:57] Team_097 possession (Score: 93-101)
FOUL! Shooting foul on Shai Lowry. Dwyane Ginobili to the line for 2 free throws. [BONUS: 7 team fouls] (Shai Lowry: 2 personal fouls)   FT 1/2: GOOD   FT 2/2: GOOD Dwyane Ginobili makes 2/2 from the line.
Score: 95-101

[01:42] Team_058 possession (Score: 95-101)
Jarrett Gilgeous-Alexander attempts a Midrange. Heavily contested by Gary Carter (2.0 feet, ZONE)! Jarrett Gilgeous-Alexander misses. Rebound secured by Miles Dosunmu.

[01:31] Team_097 possession (Score: 95-101)
Joel Simons drives, picks up Shai Lowry. Help arrives from Jordan Ingram! Joel Simons attempts a Dunk. Contested by Jordan Ingram (5.2 feet, MAN). JOEL SIMONS MAKES IT!
Score: 97-101

[01:19] Team_058 possession (Score: 97-101)
Jordan Ingram attempts a 3Pt. Contested by Dwyane Ginobili (3.3 feet, MAN). Jordan Ingram misses. Rebound secured by Joel Simons.

[01:04] Team_097 possession (Score: 97-101)
Dwyane Ginobili attempts a 3Pt. Wide open! Jordan Ingram is 7.3 feet away. [MAN] DWYANE GINOBILI MAKES IT! Assist: Miles Banchero
Score: 100-101

[00:50] Team_058 possession (Score: 100-101)
Draymond Williamson drives to the basket... Draymond Williamson commits a violation (traveling/carry)! TURNOVER! (dead ball)

[00:33] Team_097 possession (Score: 100-101)
Gary Carter drives to the basket... FOUL! Offensive foul on Gary Carter! Shai Lowry drew the charge! [Team fouls: 4] (Gary Carter: 1 personal fouls) TURNOVER! (dead ball)

[00:23] Team_058 possession (Score: 100-101)
Shai Lowry attempts a Layup. BLOCKED BY JOEL SIMONS! Ball deflects out of bounds off Shai Lowry.

[00:06] Team_097 possession (Score: 100-101)
FOUL! Shooting foul on Shai Lowry. Miles Dosunmu to the line for 2 free throws. [BONUS: 8 team fouls] (Shai Lowry: 3 personal fouls)   FT 1/2: MISS   FT 2/2: GOOD Miles Dosunmu makes 1/2 from the line.
Score: 101-101

================================================================================
                              4TH QUARTER COMPLETE                              
================================================================================

4TH QUARTER SCORE: Team_097 29, Team_058 25

BOX SCORE:
================================================================================

Team_097
--------------------------------------------------------------------------------
Player                MIN  PTS  REB  AST  TO      FG   FG%      3P   3P%
--------------------------------------------------------------------------------
Dwyane Ginobili        18    8    0    0   0   3/3   100.0     0/0   0.0
Shai Poole             31    6    0    0   0   2/4    50.0     0/0   0.0
Miles Banchero         18    5    2    2   0   2/2   100.0     0/0   0.0
Evan Brogdon           31    3    0    0   0   1/2    50.0     0/0   0.0
Miles Dosunmu          18    3    1    0   0   2/3    66.7     0/0   0.0
Joel Simons            18    2    2    0   0   1/1   100.0     0/0   0.0
Tyrese Stewart         31    0    2    1   0   0/2     0.0     0/0   0.0
Jrue Haliburton        31    0    0    1   0   0/0     0.0     0/0   0.0
Anthony Haliburton     31    0    2    1   0   0/0     0.0     0/0   0.0
Gary Carter            18    0    0    0   0   0/2     0.0     0/0   0.0

TEAM: FG: 11/19 (57.9%), 3PT: 6/11 (54.5%), REB: 9 (2 off, 7 def), AST: 5, TO: 4
TEAM FOULS: 4


Team_058
--------------------------------------------------------------------------------
Player                MIN  PTS  REB  AST  TO      FG   FG%      3P   3P%
--------------------------------------------------------------------------------
Pascal Holiday         18    8    2    1   0   3/3   100.0     0/0   0.0
Kyle Westbrook         37    7    0    0   0   3/4    75.0     0/0   0.0
Vince Hyland           31    5    0    1   0   2/3    66.7     0/0   0.0
Jordan Ingram          11    3    0    1   0   1/4    25.0     0/0   0.0
Stephen Haliburton     31    2    1    1   0   1/1   100.0     0/0   0.0
Bradley Sexton         31    0    2    1   0   0/0     0.0     0/0   0.0
Tyrese Doncic          31    0    2    0   0   0/0     0.0     0/0   0.0
Draymond Williamson    18    0    0    0   0   0/1     0.0     0/0   0.0
Shai Lowry             18    0    1    0   0   0/1     0.0     0/0   0.0
Jarrett Gilgeous-Alexander   18    0    1    0   0   0/1     0.0     0/0   0.0

TEAM: FG: 10/18 (55.6%), 3PT: 4/7 (57.1%), REB: 9 (1 off, 8 def), AST: 5, TO: 4
TEAM FOULS: 8 [Team_097 in BONUS]

================================================================================

================================================================================
                               FULL GAME COMPLETE                               
================================================================================

FINAL SCORE: Team_097 101, Team_058 101

SCORING BY QUARTER:
--------------------------------------------------------------------------------
Team                     Q1     Q2     Q3     Q4    FINAL
--------------------------------------------------------------------------------
Team_097                 30     21     21     29      101
Team_058                 33     28     15     25      101
--------------------------------------------------------------------------------

FULL GAME BOX SCORE:
================================================================================

Team_097
--------------------------------------------------------------------------------
Player                MIN  PTS  REB  AST  TO      FG   FG%      3P   3P%      FT STL BLK
--------------------------------------------------------------------------------
Evan Brogdon           31   14    0    1   1   4/5    80.0   3/4    75.0   1/2     1   0
Jrue Haliburton        31    7    0    6   1   3/6    50.0   1/1   100.0   0/0     0   0
Shai Poole             31   25    5    5   2   8/12   66.7   6/9    66.7   0/0     1   0
Anthony Haliburton     31   18    8    4   1   8/12   66.7   2/2   100.0   2/3     2   2
Tyrese Stewart         31    2   14    3   2   2/11   18.2   0/1     0.0   0/0     0   0
Gary Carter            18    0    0    1   1   0/3     0.0   0/2     0.0   0/0     0   0
Dwyane Ginobili        18   14    0    0   1   5/8    62.5   3/5    60.0   2/2     0   0
Miles Dosunmu          18   11    3    2   3   5/7    71.4   1/1   100.0   4/7     0   1
Joel Simons            18    2    7    0   0   2/3    66.7   1/2    50.0   0/0     3   1
Miles Banchero         18    5    2    3   1   2/4    50.0   1/2    50.0   5/5     0   0

TEAM: FG: 40/73 (54.8%), 3PT: 18/29 (62.1%), REB: 40 (10 off, 30 def), AST: 25, TO: 13


Team_058
--------------------------------------------------------------------------------
Player                MIN  PTS  REB  AST  TO      FG   FG%      3P   3P%      FT STL BLK
--------------------------------------------------------------------------------
Kyle Westbrook         37   20    0    3   0   6/12   50.0   3/6    50.0   1/2     0   0
Bradley Sexton         31   24    5    3   0  10/12   83.3   6/7    85.7   2/3     0   0
Vince Hyland           31    8    0    2   3   4/10   40.0   2/7    28.6   0/0     0   1
Stephen Haliburton     31    6    6    2   0   1/4    25.0   0/0     0.0   2/2     2   1
Tyrese Doncic          31    9   13    4   3   4/10   40.0   1/1   100.0   2/2     2   1
Draymond Williamson    18    2    0    1   0   1/2    50.0   0/1     0.0   0/0     0   0
Pascal Holiday         18   12    4    2   1   4/5    80.0   1/2    50.0   1/1     1   0
Shai Lowry             18    8    4    0   2   3/6    50.0   1/1   100.0   1/1     2   1
Jarrett Gilgeous-Alexander   18    0    4    3   2   0/1     0.0   0/0     0.0   0/0     0   0
Jordan Ingram          11    7    0    3   2   4/7    57.1   1/2    50.0   0/0     0   0

TEAM: FG: 39/71 (54.9%), 3PT: 15/27 (55.6%), REB: 35 (5 off, 30 def), AST: 23, TO: 13

================================================================================
