================================================================================
                        FULL GAME - Team_046 vs Team_049                        
================================================================================

================================================================================
                       1ST QUARTER - Team_046 vs Team_049                       
================================================================================

[12:00] Team_046 possession (Score: 0-0)
Cade Wall attempts a 3Pt. Wide open! Ja Oladipo is 8.0 feet away. [ZONE] Cade Wall misses. Rebound secured by De'Aaron Allen.

[11:42] Team_049 possession (Score: 0-0)
Jimmy Griffin attempts a 3Pt. Contested by Lauri Carter (2.9 feet, ZONE). Jimmy Griffin misses. Rebound secured by Kevin Allen.

[11:29] Team_046 possession (Score: 0-0)
Cade Wall attempts a Layup. Contested by De'Aaron Allen (2.9 feet, MAN). Cade Wall misses. Rebound secured by Shai Mobley.

[11:17] Team_049 possession (Score: 0-0)
De'Aaron Allen drives, Kevin Allen stays with him. De'Aaron Allen attempts a Dunk. Contested by Kevin Allen (5.0 feet, ZONE). DE'AARON ALLEN MAKES IT!
Score: 0-2

[11:06] Team_046 possession (Score: 0-2)
Victor Nowitzki attempts a 3Pt. Contested by Ja Oladipo (5.9 feet, ZONE). VICTOR NOWITZKI MAKES IT! Assist: Kevin Allen
Score: 3-2

[10:49] Team_049 possession (Score: 3-2)
Shai Mobley attempts a Layup. Contested by Kevin Allen (4.9 feet, MAN). Shai Mobley misses. Offensive rebound by Jimmy Griffin! Jimmy Griffin kicks it out.

[10:32] Team_049 possession (Score: 3-2)
De'Aaron Allen attempts a 3Pt. Contested by Lauri Carter (3.8 feet, ZONE). De'Aaron Allen misses. Rebound secured by Kevin Allen.

[10:14] Team_046 possession (Score: 3-2)
Kevin Allen throws a bad pass! Stolen by Shai Mobley! TURNOVER! (live ball)

[09:59] Team_049 possession (Score: 3-2)
Ja Oladipo drives and kicks out. Shai Mobley attempts a Midrange. Contested by Lauri Carter (2.7 feet, ZONE). Shai Mobley misses. Rebound secured by Kevin Allen.

[09:44] Team_046 possession (Score: 3-2)
FOUL! Offensive foul on Victor Nowitzki! Ja Oladipo drew the charge! [Team fouls: 1] (Victor Nowitzki: 1 personal fouls) TURNOVER! (dead ball)

[09:31] Team_049 possession (Score: 3-2)
Ja Oladipo makes the Layup and draws the foul on Victor Nowitzki! And-1! Ja Oladipo to the line for 1. [Team fouls: 2] (Victor Nowitzki: 2 personal fouls)   FT 1/1: GOOD Ja Oladipo makes 1/1 from the line.
Score: 3-5

[09:18] Team_046 possession (Score: 3-5)
D'Angelo O'Neal attempts a 3Pt. Contested by Ja Oladipo (3.4 feet, ZONE). D'Angelo O'Neal misses. Rebound secured by De'Aaron Allen.

[09:03] Team_049 possession (Score: 3-5)
FOUL! Reach-in foul on Kevin Allen during the drive. [Team fouls: 3] No free throws, side out. (Kevin Allen: 1 personal fouls)

[08:46] Team_049 possession (Score: 3-5)
FOUL! Reach-in foul on Kevin Allen during the drive. [Team fouls: 4] No free throws, side out. (Kevin Allen: 2 personal fouls)

[08:30] Team_049 possession (Score: 3-5)
Shai Mobley drives and kicks out. De'Aaron Allen makes the Midrange and draws the foul on Cade Wall! And-1! De'Aaron Allen to the line for 1. [BONUS: 5 team fouls] (Cade Wall: 1 personal fouls)   FT 1/1: MISS De'Aaron Allen makes 0/1 from the line. Rebound secured by Lauri Carter.
Score: 3-7

[08:17] Team_046 possession (Score: 3-7)
Kevin Allen attempts a Midrange. Contested by Shai Mobley (3.5 feet, MAN). Kevin Allen misses. Rebound secured by Shai Mobley.

[08:07] Team_049 possession (Score: 3-7)
Shai Mobley attempts a Midrange. Wide open! Kevin Allen is 6.9 feet away. [MAN] Shai Mobley misses. Rebound secured by Cade Wall.

[07:50] Team_046 possession (Score: 3-7)
D'Angelo O'Neal drives, De'Aaron Allen stays with him. D'Angelo O'Neal attempts a Layup. Contested by De'Aaron Allen (2.9 feet, ZONE). D'ANGELO O'NEAL MAKES IT! Assist: Lauri Carter
Score: 5-7

[07:39] Team_049 possession (Score: 5-7)
Shai Mobley attempts a Midrange. Wide open! Victor Nowitzki is 6.5 feet away. [ZONE] SHAI MOBLEY MAKES IT! Assist: Shai Bird
Score: 5-9

[07:21] Team_046 possession (Score: 5-9)
Kevin Allen drives, De'Aaron Allen stays with him. Kevin Allen attempts a Dunk. Contested by De'Aaron Allen (2.3 feet, ZONE). KEVIN ALLEN MAKES IT!
Score: 7-9

[07:06] Team_049 possession (Score: 7-9)
Ja Oladipo throws a bad pass out of bounds! TURNOVER! (dead ball)

[06:54] Team_046 possession (Score: 7-9)
Victor Nowitzki attempts a 3Pt. Contested by Ja Oladipo (4.0 feet, MAN). VICTOR NOWITZKI MAKES IT! Assist: Cade Wall
Score: 10-9

[06:42] Team_049 possession (Score: 10-9)
Jimmy Griffin attempts a 3Pt. Wide open! Lauri Carter is 7.9 feet away. [ZONE] Jimmy Griffin misses. Rebound secured by Kevin Allen.

[06:27] Team_046 possession (Score: 10-9)
Victor Nowitzki attempts a 3Pt. Contested by Ja Oladipo (2.2 feet, MAN). Victor Nowitzki misses. Rebound secured by De'Aaron Allen.

[06:11] Team_049 possession (Score: 10-9)
Shai Bird attempts a 3Pt. Heavily contested by D'Angelo O'Neal (1.2 feet, MAN)! SHAI BIRD MAKES IT! Assist: De'Aaron Allen
Score: 10-12

[05:56] Team_046 possession (Score: 10-12)
D'Angelo O'Neal drives to the basket... D'Angelo O'Neal commits a violation (traveling/carry)! TURNOVER! (dead ball)

[05:43] Team_049 possession (Score: 10-12)
Shai Mobley drives and kicks out. De'Aaron Allen attempts a Midrange. Contested by Cade Wall (5.9 feet, MAN). DE'AARON ALLEN MAKES IT! Assist: Ja Oladipo
Score: 10-14

[05:30] Team_046 possession (Score: 10-14)
FOUL! Holding foul on Jimmy Griffin. [Team fouls: 1] No free throws, side out. (Jimmy Griffin: 1 personal fouls)

[05:14] Team_046 possession (Score: 10-14)
Kevin Allen throws a bad pass! Stolen by Shai Mobley! TURNOVER! (live ball)

[05:03] Team_049 possession (Score: 10-14)
FOUL! Holding foul on D'Angelo O'Neal. [IN THE BONUS! 6 team fouls] Shai Bird to the line for 2 free throws. (D'Angelo O'Neal: 1 personal fouls)   FT 1/2: GOOD   FT 2/2: GOOD Shai Bird makes 2/2 from the line.
Score: 10-16

[04:50] Team_046 possession (Score: 10-16)
Kevin Allen drives and kicks out. D'Angelo O'Neal attempts a 3Pt. Wide open! Ja Oladipo is 7.0 feet away. [ZONE] D'Angelo O'Neal misses. Offensive rebound by Kevin Allen! Kevin Allen kicks it out.

[04:36] Team_046 possession (Score: 10-16)
FOUL! Shooting foul on De'Aaron Allen. Cade Wall to the line for 2 free throws. [Team fouls: 2] (De'Aaron Allen: 1 personal fouls)   FT 1/2: GOOD   FT 2/2: GOOD Cade Wall makes 2/2 from the line.
Score: 12-16

[04:21] Team_049 possession (Score: 12-16)
FOUL! Reach-in foul on Lauri Carter during the drive. [IN THE BONUS! 7 team fouls] Jimmy Griffin to the line for 2 free throws. (Lauri Carter: 1 personal fouls)   FT 1/2: MISS   FT 2/2: GOOD Jimmy Griffin makes 1/2 from the line.
Score: 12-17

[04:05] Team_046 possession (Score: 12-17)
Cade Wall attempts a 3Pt. Contested by De'Aaron Allen (4.0 feet, MAN). Cade Wall misses. Offensive rebound by Cade Wall! Cade Wall kicks it out.

[03:48] Team_046 possession (Score: 12-17)
Victor Nowitzki attempts a Midrange. Contested by De'Aaron Allen (4.9 feet, ZONE). Victor Nowitzki misses. Offensive rebound by Cade Wall! Cade Wall kicks it out.

[03:33] Team_046 possession (Score: 12-17)
Lauri Carter attempts a 3Pt. Contested by Jimmy Griffin (4.3 feet, MAN). Lauri Carter misses. Rebound secured by Jimmy Griffin.

[03:22] Team_049 possession (Score: 12-17)
Shai Mobley attempts a Midrange. Contested by Kevin Allen (4.8 feet, MAN). Shai Mobley misses. Rebound secured by Cade Wall.

[03:10] Team_046 possession (Score: 12-17)
Kevin Allen attempts a Midrange. Contested by Jimmy Griffin (5.8 feet, ZONE). Kevin Allen misses. Rebound secured by De'Aaron Allen.

[02:57] Team_049 possession (Score: 12-17)
FOUL! Shooting foul on Victor Nowitzki. Ja Oladipo to the line for 2 free throws. [BONUS: 8 team fouls] (Victor Nowitzki: 3 personal fouls)   FT 1/2: GOOD   FT 2/2: GOOD Ja Oladipo makes 2/2 from the line.
Score: 12-19

[02:45] Team_046 possession (Score: 12-19)
Lauri Carter drives to the basket... Lauri Carter loses control! Ball rolls out of bounds! TURNOVER! (dead ball)

[02:45] Substitution (Team_046): D'Angelo O'Neal OUT → Collin Butler IN (stamina_rule2)

[02:45] Substitution (Team_046): Victor Nowitzki OUT → Manu Dosunmu IN (stamina_rule2)

[02:45] Substitution (Team_046): Cade Wall OUT → Chris LaVine IN (stamina_rule2)

[02:45] Substitution (Team_046): Kevin Allen OUT → Paul DeRozan IN (stamina_rule2)

[02:45] Substitution (Team_049): Shai Bird OUT → Shaquille Lillard IN (stamina_rule2)

[02:45] Substitution (Team_049): Jimmy Griffin OUT → Desmond Towns IN (stamina_rule2)

[02:34] Team_049 possession (Score: 12-19)
Shaquille Lillard drives, Collin Butler stays with him. Shaquille Lillard attempts a Layup. Contested by Collin Butler (2.7 feet, MAN). Shaquille Lillard misses. Rebound secured by Manu Dosunmu.

[02:20] Team_046 possession (Score: 12-19)
Collin Butler attempts a 3Pt. Wide open! Shaquille Lillard is 8.3 feet away. [MAN] Collin Butler misses. Rebound secured by De'Aaron Allen.

[02:03] Team_049 possession (Score: 12-19)
De'Aaron Allen attempts a 3Pt. Contested by Lauri Carter (2.9 feet, ZONE). DE'AARON ALLEN MAKES IT! Assist: Ja Oladipo
Score: 12-22

[01:48] Team_046 possession (Score: 12-22)
Chris LaVine attempts a Midrange. Wide open! Desmond Towns is 10.0 feet away. [ZONE] CHRIS LAVINE MAKES IT! Assist: Manu Dosunmu
Score: 14-22

[01:32] Team_049 possession (Score: 14-22)
De'Aaron Allen makes the Midrange and draws the foul on Chris LaVine! And-1! De'Aaron Allen to the line for 1. [BONUS: 9 team fouls] (Chris LaVine: 1 personal fouls)   FT 1/1: GOOD De'Aaron Allen makes 1/1 from the line.
Score: 14-25

[01:18] Team_046 possession (Score: 14-25)
Manu Dosunmu attempts a 3Pt. Contested by Ja Oladipo (5.8 feet, ZONE). MANU DOSUNMU MAKES IT! Assist: Collin Butler
Score: 17-25

[00:58] Team_049 possession (Score: 17-25)
Shai Mobley drives and kicks out. Shai Mobley attempts a Midrange. Contested by Chris LaVine (4.4 feet, ZONE). Shai Mobley misses. Offensive rebound by De'Aaron Allen! De'Aaron Allen kicks it out.

[00:44] Team_049 possession (Score: 17-25)
Desmond Towns attempts a 3Pt. Contested by Lauri Carter (4.6 feet, ZONE). DESMOND TOWNS MAKES IT!
Score: 17-28

[00:25] Team_046 possession (Score: 17-28)
Paul DeRozan attempts a Midrange. Contested by Shai Mobley (5.2 feet, MAN). Paul DeRozan misses. Rebound secured by Shai Mobley.

[00:09] Team_049 possession (Score: 17-28)
De'Aaron Allen attempts a 3Pt. Contested by Chris LaVine (4.9 feet, MAN). DE'AARON ALLEN MAKES IT! Assist: Desmond Towns
Score: 17-31

================================================================================
                              1ST QUARTER COMPLETE                              
================================================================================

1ST QUARTER SCORE: Team_046 17, Team_049 31

BOX SCORE:
================================================================================

Team_046
--------------------------------------------------------------------------------
Player                MIN  PTS  REB  AST  TO      FG   FG%      3P   3P%
--------------------------------------------------------------------------------
Victor Nowitzki         9    6    0    0   0   2/3    66.7     0/0   0.0
Manu Dosunmu            3    3    1    1   0   1/1   100.0     0/0   0.0
Cade Wall               9    2    4    1   0   1/3    33.3     0/0   0.0
Kevin Allen             9    2    5    1   0   1/3    33.3     0/0   0.0
D'Angelo O'Neal         9    2    0    0   0   1/2    50.0     0/0   0.0
Chris LaVine            3    2    0    0   0   1/1   100.0     0/0   0.0
Lauri Carter           12    0    1    1   0   0/1     0.0     0/0   0.0
Collin Butler           3    0    0    1   0   0/1     0.0     0/0   0.0
Paul DeRozan            3    0    0    0   0   0/1     0.0     0/0   0.0

TEAM: FG: 7/16 (43.8%), 3PT: 3/8 (37.5%), REB: 11 (3 off, 8 def), AST: 5, TO: 5
TEAM FOULS: 9 [Team_049 in BONUS]


Team_049
--------------------------------------------------------------------------------
Player                MIN  PTS  REB  AST  TO      FG   FG%      3P   3P%
--------------------------------------------------------------------------------
De'Aaron Allen         12   13    6    1   0   5/6    83.3     0/0   0.0
Ja Oladipo             12    5    0    2   0   2/3    66.7     0/0   0.0
Shai Bird               9    5    0    1   0   2/2   100.0     0/0   0.0
Desmond Towns           3    3    0    1   0   1/1   100.0     0/0   0.0
Shai Mobley            12    2    3    0   0   1/4    25.0     0/0   0.0
Jimmy Griffin           9    1    2    0   0   1/3    33.3     0/0   0.0
Shaquille Lillard       3    0    0    0   0   0/1     0.0     0/0   0.0

TEAM: FG: 12/20 (60.0%), 3PT: 4/7 (57.1%), REB: 11 (2 off, 9 def), AST: 5, TO: 1
TEAM FOULS: 2

================================================================================

================================================================================
                       2ND QUARTER - Team_046 vs Team_049                       
================================================================================

[12:00] Team_046 possession (Score: 17-31)
D'Angelo O'Neal attempts a 3Pt. Contested by Shai Bird (3.9 feet, MAN). D'Angelo O'Neal misses. Rebound secured by Shai Mobley.

[11:48] Team_049 possession (Score: 17-31)
Jimmy Griffin attempts a 3Pt. Wide open! Lauri Carter is 6.9 feet away. [MAN] Jimmy Griffin misses. Offensive rebound by Jimmy Griffin! Jimmy Griffin kicks it out.

[11:34] Team_049 possession (Score: 17-31)
Shai Bird drives and kicks out. Ja Oladipo attempts a 3Pt. Contested by D'Angelo O'Neal (3.0 feet, ZONE). Ja Oladipo misses. Rebound secured by Kevin Allen.

[11:19] Team_046 possession (Score: 17-31)
Cade Wall drives and kicks out. Kevin Allen attempts a Midrange. Contested by Ja Oladipo (4.9 feet, ZONE). KEVIN ALLEN MAKES IT!
Score: 19-31

[11:05] Team_049 possession (Score: 19-31)
FOUL! Reach-in foul on Cade Wall during the drive. [Team fouls: 1] No free throws, side out. (Cade Wall: 1 personal fouls)

[10:48] Team_049 possession (Score: 19-31)
De'Aaron Allen attempts a Midrange. Contested by Lauri Carter (4.3 feet, ZONE). De'Aaron Allen misses. Rebound secured by D'Angelo O'Neal.

[10:34] Team_046 possession (Score: 19-31)
Lauri Carter attempts a Midrange. Wide open! Jimmy Griffin is 7.6 feet away. [MAN] Lauri Carter misses. Rebound secured by Shai Mobley.

[10:21] Team_049 possession (Score: 19-31)
Shai Bird attempts a 3Pt. Wide open! D'Angelo O'Neal is 7.0 feet away. [MAN] Shai Bird misses. Offensive rebound by Jimmy Griffin! Jimmy Griffin kicks it out.

[10:05] Team_049 possession (Score: 19-31)
Ja Oladipo attempts a 3Pt. Contested by D'Angelo O'Neal (4.7 feet, ZONE). Ja Oladipo misses. Rebound secured by Cade Wall.

[09:51] Team_046 possession (Score: 19-31)
D'Angelo O'Neal attempts a Layup. Contested by De'Aaron Allen (2.6 feet, ZONE). D'ANGELO O'NEAL MAKES IT! Assist: Kevin Allen
Score: 21-31

[09:38] Team_049 possession (Score: 21-31)
FOUL! Holding foul on Cade Wall. [Team fouls: 2] No free throws, side out. (Cade Wall: 2 personal fouls)

[09:21] Team_049 possession (Score: 21-31)
Shai Bird attempts a 3Pt. Heavily contested by D'Angelo O'Neal (1.5 feet, ZONE)! SHAI BIRD MAKES IT! Assist: De'Aaron Allen
Score: 21-34

[09:05] Team_046 possession (Score: 21-34)
FOUL! Reach-in foul on Shai Bird during the drive. [Team fouls: 1] No free throws, side out. (Shai Bird: 1 personal fouls)

[08:48] Team_046 possession (Score: 21-34)
Lauri Carter attempts a 3Pt. Contested by Jimmy Griffin (3.8 feet, ZONE). LAURI CARTER MAKES IT! Assist: Victor Nowitzki
Score: 24-34

[08:35] Team_049 possession (Score: 24-34)
Shai Mobley attempts a Layup. Heavily contested by Kevin Allen (0.9 feet, MAN)! SHAI MOBLEY MAKES IT! Assist: Shai Bird
Score: 24-36

[08:21] Team_046 possession (Score: 24-36)
Cade Wall drives to the basket... Cade Wall loses the ball! Stripped by De'Aaron Allen! TURNOVER! (live ball)

[08:09] Team_049 possession (Score: 24-36)
Shai Bird attempts a Midrange. Wide open! D'Angelo O'Neal is 6.3 feet away. [MAN] SHAI BIRD MAKES IT!
Score: 24-38

[07:56] Team_046 possession (Score: 24-38)
Lauri Carter drives, Jimmy Griffin stays with him. Lauri Carter attempts a Layup. Contested by Jimmy Griffin (4.6 feet, MAN). LAURI CARTER MAKES IT! Assist: D'Angelo O'Neal
Score: 26-38

[07:45] Team_049 possession (Score: 26-38)
Ja Oladipo drives and kicks out. Shai Bird attempts a 3Pt. Contested by D'Angelo O'Neal (4.6 feet, ZONE). Shai Bird misses. Rebound secured by Kevin Allen.

[07:27] Team_046 possession (Score: 26-38)
Kevin Allen drives and kicks out. Kevin Allen attempts a 3Pt. Wide open! Jimmy Griffin is 7.6 feet away. [ZONE] KEVIN ALLEN MAKES IT! Assist: Victor Nowitzki
Score: 29-38

[07:09] Team_049 possession (Score: 29-38)
De'Aaron Allen drives, Cade Wall stays with him. De'Aaron Allen attempts a Dunk. Contested by Cade Wall (2.6 feet, MAN). DE'AARON ALLEN MAKES IT!
Score: 29-40

[06:53] Team_046 possession (Score: 29-40)
D'Angelo O'Neal attempts a 3Pt. Wide open! Jimmy Griffin is 6.2 feet away. [ZONE] D'Angelo O'Neal misses. Rebound secured by Shai Mobley.

[06:41] Team_049 possession (Score: 29-40)
Ja Oladipo attempts a Layup. Wide open! Victor Nowitzki is 9.4 feet away. [MAN] Ja Oladipo misses. Offensive rebound by Jimmy Griffin! Jimmy Griffin kicks it out.

[06:21] Team_049 possession (Score: 29-40)
Jimmy Griffin drives, Kevin Allen stays with him. Jimmy Griffin attempts a Layup. Contested by Kevin Allen (3.0 feet, ZONE). JIMMY GRIFFIN MAKES IT! Assist: De'Aaron Allen
Score: 29-42

[06:03] Team_046 possession (Score: 29-42)
Kevin Allen drives and kicks out. Victor Nowitzki attempts a 3Pt. Wide open! De'Aaron Allen is 6.8 feet away. [ZONE] Victor Nowitzki misses. Rebound secured by Shai Mobley.

[05:45] Team_049 possession (Score: 29-42)
Jimmy Griffin drives and kicks out. Shai Bird attempts a 3Pt. Wide open! D'Angelo O'Neal is 6.0 feet away. [MAN] Shai Bird misses. Rebound secured by Kevin Allen.

[05:33] Team_046 possession (Score: 29-42)
Kevin Allen drives, De'Aaron Allen stays with him. Kevin Allen attempts a Layup. Contested by De'Aaron Allen (4.3 feet, ZONE). KEVIN ALLEN MAKES IT!
Score: 31-42

[05:23] Team_049 possession (Score: 31-42)
Ja Oladipo attempts a 3Pt. Contested by D'Angelo O'Neal (5.4 feet, ZONE). Ja Oladipo misses. Rebound secured by Kevin Allen.

[05:13] Team_046 possession (Score: 31-42)
FOUL! Holding foul on Jimmy Griffin. [Team fouls: 2] No free throws, side out. (Jimmy Griffin: 1 personal fouls)

[05:03] Team_046 possession (Score: 31-42)
FOUL! Offensive foul on Cade Wall! De'Aaron Allen drew the charge! [Team fouls: 3] (Cade Wall: 3 personal fouls) TURNOVER! (dead ball)

[04:48] Team_049 possession (Score: 31-42)
Shai Mobley attempts a 3Pt. Wide open! Kevin Allen is 6.6 feet away. [MAN] Shai Mobley misses. Rebound secured by D'Angelo O'Neal.

[04:35] Team_046 possession (Score: 31-42)
D'Angelo O'Neal attempts a 3Pt. Contested by Shai Bird (5.4 feet, ZONE). D'ANGELO O'NEAL MAKES IT! Assist: Cade Wall
Score: 34-42

[04:23] Team_049 possession (Score: 34-42)
FOUL! Holding foul on Victor Nowitzki. [Team fouls: 4] No free throws, side out. (Victor Nowitzki: 1 personal fouls)

[04:09] Team_049 possession (Score: 34-42)
Shai Mobley attempts a Midrange. Wide open! Kevin Allen is 6.3 feet away. [MAN] Shai Mobley misses. Rebound secured by D'Angelo O'Neal.

[03:55] Team_046 possession (Score: 34-42)
Victor Nowitzki loses control! Ball rolls out of bounds! TURNOVER! (dead ball)

[03:55] Substitution (Team_046): D'Angelo O'Neal OUT → Collin Butler IN (stamina_rule2)

[03:55] Substitution (Team_046): Victor Nowitzki OUT → Manu Dosunmu IN (stamina_rule2)

[03:55] Substitution (Team_046): Lauri Carter OUT → Josh Barrett IN (stamina_rule2)

[03:55] Substitution (Team_046): Cade Wall OUT → Chris LaVine IN (stamina_rule2)

[03:55] Substitution (Team_046): Kevin Allen OUT → Paul DeRozan IN (stamina_rule2)

[03:55] Substitution (Team_049): Shai Bird OUT → Shaquille Lillard IN (stamina_rule2)

[03:55] Substitution (Team_049): Ja Oladipo OUT → Shai Jordan IN (stamina_rule2)

[03:55] Substitution (Team_049): Jimmy Griffin OUT → Desmond Towns IN (stamina_rule2)

[03:55] Substitution (Team_049): De'Aaron Allen OUT → Giannis Anunoby IN (stamina_rule2)

[03:55] Substitution (Team_049): Shai Mobley OUT → Miles Jackson IN (stamina_rule2)

[03:37] Team_049 possession (Score: 34-42)
Giannis Anunoby attempts a 3Pt. Contested by Chris LaVine (4.2 feet, MAN). Giannis Anunoby misses. Rebound secured by Paul DeRozan.

[03:27] Team_046 possession (Score: 34-42)
Josh Barrett attempts a Midrange. Wide open! Shai Jordan is 9.2 feet away. [ZONE] Josh Barrett misses. Rebound secured by Giannis Anunoby.

[03:09] Team_049 possession (Score: 34-42)
Miles Jackson attempts a Midrange. Contested by Manu Dosunmu (4.7 feet, ZONE). Miles Jackson misses. Rebound secured by Chris LaVine.

[02:53] Team_046 possession (Score: 34-42)
Paul DeRozan drives, picks up Miles Jackson. Help arrives from Shai Jordan! Paul DeRozan attempts a Dunk. Heavily contested by Shai Jordan (1.7 feet, MAN)! PAUL DEROZAN MAKES IT!
Score: 36-42

[02:35] Team_049 possession (Score: 36-42)
Shai Jordan attempts a 3Pt. Contested by Manu Dosunmu (4.1 feet, MAN). Shai Jordan misses. Rebound secured by Chris LaVine.

[02:20] Team_046 possession (Score: 36-42)
Paul DeRozan drives to the basket... Paul DeRozan loses the ball! Stripped by Miles Jackson! TURNOVER! (live ball)

[02:08] Team_049 possession (Score: 36-42)
Giannis Anunoby attempts a Layup. Contested by Chris LaVine (2.8 feet, MAN). GIANNIS ANUNOBY MAKES IT! Assist: Miles Jackson
Score: 36-44

[01:53] Team_046 possession (Score: 36-44)
Josh Barrett attempts a Layup. Contested by Miles Jackson (3.0 feet, ZONE). Josh Barrett misses. Rebound secured by Giannis Anunoby.

[01:42] Team_049 possession (Score: 36-44)
Giannis Anunoby drives, picks up Chris LaVine. Help arrives from Manu Dosunmu! Giannis Anunoby attempts a Dunk. Heavily contested by Manu Dosunmu (1.2 feet, MAN)! GIANNIS ANUNOBY MAKES IT!
Score: 36-46

[01:26] Team_046 possession (Score: 36-46)
Collin Butler makes the Dunk and draws the foul on Miles Jackson! And-1! Collin Butler to the line for 1. [Team fouls: 3] (Miles Jackson: 1 personal fouls)   FT 1/1: GOOD Collin Butler makes 1/1 from the line.
Score: 39-46

[01:09] Team_049 possession (Score: 39-46)
Shaquille Lillard attempts a Midrange. Contested by Josh Barrett (4.3 feet, ZONE). SHAQUILLE LILLARD MAKES IT! Assist: Giannis Anunoby
Score: 39-48

[00:58] Team_046 possession (Score: 39-48)
Josh Barrett attempts a Midrange. Wide open! Desmond Towns is 7.3 feet away. [ZONE] Josh Barrett misses. Offensive rebound by Chris LaVine! Chris LaVine kicks it out.

[00:42] Team_046 possession (Score: 39-48)
Collin Butler drives and kicks out. Collin Butler attempts a 3Pt. Contested by Shaquille Lillard (4.5 feet, ZONE). Collin Butler misses. Rebound secured by Miles Jackson.

[00:32] Team_049 possession (Score: 39-48)
Shai Jordan drives, Manu Dosunmu stays with him. Shai Jordan attempts a Dunk. Contested by Manu Dosunmu (2.2 feet, MAN). Shai Jordan misses. Rebound secured by Chris LaVine.

[00:19] Team_046 possession (Score: 39-48)
Josh Barrett makes the Layup and draws the foul on Desmond Towns! And-1! Josh Barrett to the line for 1. [Team fouls: 4] (Desmond Towns: 1 personal fouls)   FT 1/1: GOOD Josh Barrett makes 1/1 from the line.
Score: 42-48

[00:07] Team_049 possession (Score: 42-48)
Shai Jordan attempts a 3Pt. Contested by Collin Butler (4.7 feet, ZONE). Shai Jordan misses. Rebound secured by Chris LaVine.

================================================================================
                              2ND QUARTER COMPLETE                              
================================================================================

2ND QUARTER SCORE: Team_046 25, Team_049 17

BOX SCORE:
================================================================================

Team_046
--------------------------------------------------------------------------------
Player                MIN  PTS  REB  AST  TO      FG   FG%      3P   3P%
--------------------------------------------------------------------------------
Kevin Allen            18    7    4    1   0   3/4    75.0     0/0   0.0
D'Angelo O'Neal        18    5    3    1   0   2/4    50.0     0/0   0.0
Lauri Carter           20    5    0    0   0   2/3    66.7     0/0   0.0
Josh Barrett            4    3    0    0   0   1/3    33.3     0/0   0.0
Collin Butler           6    3    0    0   0   1/2    50.0     0/0   0.0
Paul DeRozan            6    2    1    0   0   1/1   100.0     0/0   0.0
Cade Wall              18    0    1    1   0   0/0     0.0     0/0   0.0
Victor Nowitzki        18    0    0    2   0   0/0     0.0     0/0   0.0
Chris LaVine            6    0    5    0   0   0/0     0.0     0/0   0.0

TEAM: FG: 10/17 (58.8%), 3PT: 2/4 (50.0%), REB: 14 (1 off, 13 def), AST: 5, TO: 4
TEAM FOULS: 4


Team_049
--------------------------------------------------------------------------------
Player                MIN  PTS  REB  AST  TO      FG   FG%      3P   3P%
--------------------------------------------------------------------------------
Shai Bird              18    5    0    1   0   2/3    66.7     0/0   0.0
Giannis Anunoby         4    4    2    1   0   2/3    66.7     0/0   0.0
Shai Mobley            20    2    4    0   0   1/3    33.3     0/0   0.0
Jimmy Griffin          18    2    3    0   0   1/2    50.0     0/0   0.0
De'Aaron Allen         20    2    0    2   0   1/2    50.0     0/0   0.0
Shaquille Lillard       6    2    0    0   0   1/1   100.0     0/0   0.0
Ja Oladipo             20    0    0    0   0   0/3     0.0     0/0   0.0
Miles Jackson           4    0    1    1   0   0/1     0.0     0/0   0.0
Shai Jordan             4    0    0    0   0   0/3     0.0     0/0   0.0

TEAM: FG: 8/21 (38.1%), 3PT: 1/7 (14.3%), REB: 10 (3 off, 7 def), AST: 5, TO: 0
TEAM FOULS: 4

================================================================================

================================================================================
                       3RD QUARTER - Team_046 vs Team_049                       
================================================================================

[12:00] Team_046 possession (Score: 42-48)
Lauri Carter attempts a 3Pt. Contested by Ja Oladipo (3.5 feet, ZONE). LAURI CARTER MAKES IT! Assist: Kevin Allen
Score: 45-48

[11:45] Team_049 possession (Score: 45-48)
Jimmy Griffin drives and kicks out. De'Aaron Allen attempts a 3Pt. Contested by Cade Wall (4.3 feet, MAN). De'Aaron Allen misses. Rebound secured by Kevin Allen.

[11:34] Team_046 possession (Score: 45-48)
Lauri Carter drives to the basket... Lauri Carter throws a bad pass! Stolen by De'Aaron Allen! TURNOVER! (live ball)

[11:17] Team_049 possession (Score: 45-48)
Ja Oladipo attempts a Midrange. Contested by Cade Wall (3.5 feet, ZONE). Ja Oladipo misses. Rebound secured by Cade Wall.

[10:59] Team_046 possession (Score: 45-48)
Kevin Allen attempts a Layup. Contested by De'Aaron Allen (3.2 feet, ZONE). KEVIN ALLEN MAKES IT! Assist: Cade Wall
Score: 47-48

[10:44] Team_049 possession (Score: 47-48)
De'Aaron Allen throws a bad pass! Stolen by Cade Wall! TURNOVER! (live ball)

[10:26] Team_046 possession (Score: 47-48)
D'Angelo O'Neal attempts a Layup. Contested by Shai Bird (3.0 feet, MAN). D'ANGELO O'NEAL MAKES IT! Assist: Kevin Allen
Score: 49-48

[10:11] Team_049 possession (Score: 49-48)
De'Aaron Allen attempts a Layup. BLOCKED BY KEVIN ALLEN! Ball is loose! Rebound secured by Lauri Carter.

[09:57] Team_046 possession (Score: 49-48)
D'Angelo O'Neal attempts a 3Pt. Contested by Ja Oladipo (5.8 feet, ZONE). D'Angelo O'Neal misses. Rebound secured by De'Aaron Allen.

[09:42] Team_049 possession (Score: 49-48)
Shai Bird drives to the basket... Shai Bird throws a bad pass! Stolen by D'Angelo O'Neal! TURNOVER! (live ball)

[09:28] Team_046 possession (Score: 49-48)
Cade Wall throws a bad pass! Stolen by De'Aaron Allen! TURNOVER! (live ball)

[09:14] Team_049 possession (Score: 49-48)
Ja Oladipo attempts a 3Pt. Wide open! Victor Nowitzki is 6.1 feet away. [MAN] Ja Oladipo misses. Offensive rebound by Shai Mobley! Shai Mobley's putback is no good. Rebound secured by Cade Wall.

[09:00] Team_046 possession (Score: 49-48)
Kevin Allen drives, Shai Mobley stays with him. Kevin Allen attempts a Layup. Heavily contested by Shai Mobley (0.5 feet, ZONE)! KEVIN ALLEN MAKES IT!
Score: 51-48

[08:46] Team_049 possession (Score: 51-48)
Jimmy Griffin makes the Dunk and draws the foul on D'Angelo O'Neal! And-1! Jimmy Griffin to the line for 1. [Team fouls: 1] (D'Angelo O'Neal: 1 personal fouls)   FT 1/1: GOOD Jimmy Griffin makes 1/1 from the line.
Score: 51-51

[08:35] Team_046 possession (Score: 51-51)
Cade Wall attempts a Midrange. Contested by Ja Oladipo (5.8 feet, ZONE). Cade Wall misses. Offensive rebound by Kevin Allen! Kevin Allen kicks it out.

[08:20] Team_046 possession (Score: 51-51)
Cade Wall drives, picks up De'Aaron Allen. Help arrives from Ja Oladipo! Cade Wall attempts a Layup. Contested by Ja Oladipo (4.4 feet, ZONE). CADE WALL MAKES IT!
Score: 53-51

[08:08] Team_049 possession (Score: 53-51)
FOUL! Holding foul on Kevin Allen. [Team fouls: 2] No free throws, side out. (Kevin Allen: 1 personal fouls)

[07:55] Team_049 possession (Score: 53-51)
FOUL! Shooting foul on Cade Wall. De'Aaron Allen to the line for 2 free throws. [Team fouls: 3] (Cade Wall: 1 personal fouls)   FT 1/2: GOOD   FT 2/2: GOOD De'Aaron Allen makes 2/2 from the line.
Score: 53-53

[07:40] Team_046 possession (Score: 53-53)
D'Angelo O'Neal attempts a 3Pt. Contested by Shai Bird (4.4 feet, ZONE). D'Angelo O'Neal misses. Rebound secured by Jimmy Griffin.

[07:30] Team_049 possession (Score: 53-53)
FOUL! Shooting foul on Lauri Carter. Ja Oladipo to the line for 2 free throws. [Team fouls: 4] (Lauri Carter: 1 personal fouls)   FT 1/2: GOOD   FT 2/2: GOOD Ja Oladipo makes 2/2 from the line.
Score: 53-55

[07:16] Team_046 possession (Score: 53-55)
Kevin Allen attempts a 3Pt. Contested by Shai Mobley (3.6 feet, MAN). KEVIN ALLEN MAKES IT! Assist: Cade Wall
Score: 56-55

[07:02] Team_049 possession (Score: 56-55)
Ja Oladipo attempts a Layup. Contested by Victor Nowitzki (5.3 feet, MAN). JA OLADIPO MAKES IT! Assist: Jimmy Griffin
Score: 56-57

[06:48] Team_046 possession (Score: 56-57)
Cade Wall attempts a 3Pt. Contested by Ja Oladipo (4.1 feet, ZONE). CADE WALL MAKES IT! Assist: Lauri Carter
Score: 59-57

[06:36] Team_049 possession (Score: 59-57)
Ja Oladipo attempts a Midrange. Wide open! Victor Nowitzki is 6.7 feet away. [MAN] Ja Oladipo misses. Offensive rebound by Jimmy Griffin! Jimmy Griffin kicks it out.

[06:24] Team_049 possession (Score: 59-57)
Jimmy Griffin attempts a Layup. Heavily contested by Lauri Carter (1.7 feet, MAN)! JIMMY GRIFFIN MAKES IT!
Score: 59-59

[06:13] Team_046 possession (Score: 59-59)
Victor Nowitzki attempts a 3Pt. Contested by Ja Oladipo (5.7 feet, MAN). VICTOR NOWITZKI MAKES IT!
Score: 62-59

[05:56] Team_049 possession (Score: 62-59)
Ja Oladipo attempts a 3Pt. Heavily contested by Lauri Carter (0.8 feet, ZONE)! JA OLADIPO MAKES IT! Assist: Shai Bird
Score: 62-62

[05:42] Team_046 possession (Score: 62-62)
Victor Nowitzki attempts a Layup. Contested by Ja Oladipo (4.1 feet, MAN). Victor Nowitzki misses. Rebound secured by Shai Mobley.

[05:27] Team_049 possession (Score: 62-62)
Ja Oladipo attempts a 3Pt. Contested by Victor Nowitzki (3.9 feet, MAN). Ja Oladipo misses. Rebound secured by Kevin Allen.

[05:11] Team_046 possession (Score: 62-62)
Cade Wall drives and kicks out. Victor Nowitzki attempts a 3Pt. Contested by Ja Oladipo (3.2 feet, ZONE). Victor Nowitzki misses. Offensive rebound by Kevin Allen! Kevin Allen kicks it out.

[04:58] Team_046 possession (Score: 62-62)
Kevin Allen throws a bad pass! Stolen by Shai Mobley! TURNOVER! (live ball)

[04:43] Team_049 possession (Score: 62-62)
Ja Oladipo attempts a Midrange. Contested by Victor Nowitzki (5.7 feet, ZONE). JA OLADIPO MAKES IT!
Score: 62-64

[04:32] Team_046 possession (Score: 62-64)
Kevin Allen attempts a Midrange. Heavily contested by Shai Mobley (0.5 feet, MAN)! Kevin Allen misses. Rebound secured by Jimmy Griffin.

[04:14] Team_049 possession (Score: 62-64)
De'Aaron Allen attempts a Layup. Contested by Cade Wall (4.8 feet, ZONE). De'Aaron Allen misses. Rebound secured by Kevin Allen.

[03:59] Team_046 possession (Score: 62-64)
Kevin Allen attempts a Layup. Heavily contested by Shai Mobley (0.5 feet, MAN)! Kevin Allen misses. Rebound secured by Jimmy Griffin.

[03:49] Team_049 possession (Score: 62-64)
Shai Bird attempts a 3Pt. Contested by D'Angelo O'Neal (3.1 feet, MAN). Shai Bird misses. FOUL! Loose ball foul on Lauri Carter during the rebound battle. [IN THE BONUS! 5 team fouls] Shai Mobley to the line for 2 free throws. (Lauri Carter: 2 personal fouls)   FT 1/2: GOOD   FT 2/2: MISS Shai Mobley makes 1/2 from the line. Rebound secured by Lauri Carter.
Score: 62-65

[03:34] Team_046 possession (Score: 62-65)
Cade Wall drives, picks up De'Aaron Allen. Help arrives from Ja Oladipo! Cade Wall attempts a Layup. Contested by Ja Oladipo (4.1 feet, MAN). Cade Wall misses. Rebound secured by Jimmy Griffin.

[03:22] Team_049 possession (Score: 62-65)
Ja Oladipo throws a bad pass out of bounds! TURNOVER! (dead ball)

[03:22] Substitution (Team_046): Kevin Allen OUT → Paul DeRozan IN (stamina_rule2)

[03:08] Team_046 possession (Score: 62-65)
D'Angelo O'Neal drives, De'Aaron Allen stays with him. D'Angelo O'Neal attempts a Dunk. Contested by De'Aaron Allen (4.4 feet, ZONE). D'Angelo O'Neal misses. Rebound secured by Shai Mobley.

[02:52] Team_049 possession (Score: 62-65)
Jimmy Griffin attempts a 3Pt. Contested by Lauri Carter (5.7 feet, MAN). Jimmy Griffin misses. Rebound secured by Lauri Carter.

[02:39] Team_046 possession (Score: 62-65)
D'Angelo O'Neal attempts a 3Pt. Contested by Shai Bird (5.9 feet, MAN). D'Angelo O'Neal misses. Offensive rebound by Paul DeRozan! Paul DeRozan puts it back in!
Score: 64-65

[02:24] Team_049 possession (Score: 64-65)
Ja Oladipo drives and kicks out. De'Aaron Allen attempts a 3Pt. Contested by Cade Wall (2.2 feet, MAN). De'Aaron Allen misses. Rebound secured by Lauri Carter.

[02:12] Team_046 possession (Score: 64-65)
D'Angelo O'Neal drives, picks up De'Aaron Allen. Help arrives from Ja Oladipo! D'Angelo O'Neal attempts a Layup. Contested by Ja Oladipo (5.3 feet, ZONE). D'ANGELO O'NEAL MAKES IT!
Score: 66-65

[01:58] Team_049 possession (Score: 66-65)
Ja Oladipo attempts a 3Pt. Contested by D'Angelo O'Neal (5.0 feet, ZONE). Ja Oladipo misses. Offensive rebound by Shai Mobley! Shai Mobley puts it back in!
Score: 66-67

[01:43] Team_046 possession (Score: 66-67)
FOUL! Shooting foul on Shai Bird. D'Angelo O'Neal to the line for 3 free throws. [Team fouls: 1] (Shai Bird: 1 personal fouls)   FT 1/3: MISS   FT 2/3: GOOD   FT 3/3: GOOD D'Angelo O'Neal makes 2/3 from the line.
Score: 68-67

[01:28] Team_049 possession (Score: 68-67)
Ja Oladipo makes the Midrange and draws the foul on Victor Nowitzki! And-1! Ja Oladipo to the line for 1. [BONUS: 6 team fouls] (Victor Nowitzki: 1 personal fouls)   FT 1/1: GOOD Ja Oladipo makes 1/1 from the line.
Score: 68-70

[01:14] Team_046 possession (Score: 68-70)
D'Angelo O'Neal makes the Layup and draws the foul on Shai Bird! And-1! D'Angelo O'Neal to the line for 1. [Team fouls: 2] (Shai Bird: 2 personal fouls)   FT 1/1: GOOD D'Angelo O'Neal makes 1/1 from the line.
Score: 71-70

[01:00] Team_049 possession (Score: 71-70)
Shai Bird attempts a 3Pt. Contested by D'Angelo O'Neal (5.0 feet, MAN). Shai Bird misses. Rebound secured by Lauri Carter.

[00:47] Team_046 possession (Score: 71-70)
Lauri Carter drives to the basket... Lauri Carter commits a violation (traveling/carry)! TURNOVER! (dead ball)

[00:47] Substitution (Team_046): D'Angelo O'Neal OUT → Collin Butler IN (stamina_rule2)

[00:47] Substitution (Team_046): Victor Nowitzki OUT → Manu Dosunmu IN (stamina_rule2)

[00:47] Substitution (Team_046): Lauri Carter OUT → Josh Barrett IN (stamina_rule2)

[00:47] Substitution (Team_046): Cade Wall OUT → Chris LaVine IN (stamina_rule2)

[00:47] Substitution (Team_049): Shai Bird OUT → Shaquille Lillard IN (stamina_rule2)

[00:47] Substitution (Team_049): Ja Oladipo OUT → Shai Jordan IN (stamina_rule2)

[00:47] Substitution (Team_049): Jimmy Griffin OUT → Desmond Towns IN (stamina_rule2)

[00:47] Substitution (Team_049): De'Aaron Allen OUT → Giannis Anunoby IN (stamina_rule2)

[00:47] Substitution (Team_049): Shai Mobley OUT → Miles Jackson IN (stamina_rule2)

[00:37] Team_049 possession (Score: 71-70)
Shaquille Lillard attempts a 3Pt. Contested by Collin Butler (5.1 feet, ZONE). Shaquille Lillard misses. Rebound secured by Paul DeRozan.

[00:26] Team_046 possession (Score: 71-70)
Collin Butler attempts a 3Pt. Contested by Shaquille Lillard (2.3 feet, MAN). COLLIN BUTLER MAKES IT! Assist: Chris LaVine
Score: 74-70

[00:12] Team_049 possession (Score: 74-70)
Giannis Anunoby attempts a Midrange. Contested by Chris LaVine (2.9 feet, MAN). Giannis Anunoby misses. Rebound secured by Paul DeRozan.

================================================================================
                              3RD QUARTER COMPLETE                              
================================================================================

3RD QUARTER SCORE: Team_046 32, Team_049 22

BOX SCORE:
================================================================================

Team_046
--------------------------------------------------------------------------------
Player                MIN  PTS  REB  AST  TO      FG   FG%      3P   3P%
--------------------------------------------------------------------------------
D'Angelo O'Neal        29    9    0    0   0   4/7    57.1     0/0   0.0
Kevin Allen            27    7    5    2   0   3/5    60.0     0/0   0.0
Cade Wall              29    5    2    2   0   2/3    66.7     0/0   0.0
Lauri Carter           32    3    5    1   0   1/1   100.0     0/0   0.0
Victor Nowitzki        29    3    0    0   0   1/2    50.0     0/0   0.0
Collin Butler           7    3    0    0   0   1/1   100.0     0/0   0.0
Paul DeRozan           10    2    3    0   0   1/1   100.0     0/0   0.0
Chris LaVine            7    0    0    1   0   0/0     0.0     0/0   0.0

TEAM: FG: 13/20 (65.0%), 3PT: 7/9 (77.8%), REB: 13 (3 off, 10 def), AST: 6, TO: 4
TEAM FOULS: 6 [Team_049 in BONUS]


Team_049
--------------------------------------------------------------------------------
Player                MIN  PTS  REB  AST  TO      FG   FG%      3P   3P%
--------------------------------------------------------------------------------
Ja Oladipo             32   12    0    0   0   5/9    55.6     0/0   0.0
Jimmy Griffin          29    5    5    1   0   2/4    50.0     0/0   0.0
De'Aaron Allen         32    2    1    0   0   1/3    33.3     0/0   0.0
Shai Mobley            32    2    3    0   0   1/1   100.0     0/0   0.0
Shai Bird              29    0    0    1   0   0/2     0.0     0/0   0.0
Shaquille Lillard       7    0    0    0   0   0/1     0.0     0/0   0.0
Giannis Anunoby         4    0    0    0   0   0/1     0.0     0/0   0.0

TEAM: FG: 9/21 (42.9%), 3PT: 2/8 (25.0%), REB: 11 (4 off, 7 def), AST: 2, TO: 3
TEAM FOULS: 2

================================================================================

================================================================================
                       4TH QUARTER - Team_046 vs Team_049                       
================================================================================

[12:00] Team_046 possession (Score: 74-70)
Kevin Allen drives and kicks out. Victor Nowitzki attempts a Midrange. Contested by Ja Oladipo (2.8 feet, MAN). Victor Nowitzki misses. Offensive rebound by Kevin Allen! Kevin Allen kicks it out.

[11:46] Team_046 possession (Score: 74-70)
Kevin Allen attempts a Layup. BLOCKED BY DE'AARON ALLEN! Ball is loose! Rebound secured by Jimmy Griffin.

[11:29] Team_049 possession (Score: 74-70)
Shai Bird attempts a Midrange. Contested by Lauri Carter (3.6 feet, ZONE). Shai Bird misses. Offensive rebound by De'Aaron Allen! De'Aaron Allen kicks it out.

[11:14] Team_049 possession (Score: 74-70)
Shai Bird drives, Kevin Allen stays with him. Shai Bird attempts a Dunk. Contested by Kevin Allen (4.1 feet, ZONE). SHAI BIRD MAKES IT! Assist: De'Aaron Allen
Score: 74-72

[10:55] Team_046 possession (Score: 74-72)
Cade Wall attempts a 3Pt. Contested by Ja Oladipo (3.5 feet, ZONE). CADE WALL MAKES IT! Assist: Kevin Allen
Score: 77-72

[10:43] Team_049 possession (Score: 77-72)
FOUL! Holding foul on Kevin Allen. [Team fouls: 1] No free throws, side out. (Kevin Allen: 1 personal fouls)

[10:29] Team_049 possession (Score: 77-72)
Shai Mobley throws a bad pass out of bounds! TURNOVER! (dead ball)

[10:29] Substitution (Team_046): D'Angelo O'Neal OUT → Collin Butler IN (stamina_rule2)

[10:29] Substitution (Team_046): Victor Nowitzki OUT → Manu Dosunmu IN (stamina_rule2)

[10:29] Substitution (Team_046): Lauri Carter OUT → Josh Barrett IN (stamina_rule2)

[10:29] Substitution (Team_046): Cade Wall OUT → Chris LaVine IN (stamina_rule2)

[10:29] Substitution (Team_049): Shai Bird OUT → Shaquille Lillard IN (stamina_rule2)

[10:29] Substitution (Team_049): Ja Oladipo OUT → Shai Jordan IN (stamina_rule2)

[10:29] Substitution (Team_049): Jimmy Griffin OUT → Desmond Towns IN (stamina_rule2)

[10:29] Substitution (Team_049): De'Aaron Allen OUT → Giannis Anunoby IN (stamina_rule2)

[10:29] Substitution (Team_049): Shai Mobley OUT → Miles Jackson IN (stamina_rule2)

[10:14] Team_046 possession (Score: 77-72)
Josh Barrett attempts a 3Pt. Wide open! Shaquille Lillard is 6.3 feet away. [ZONE] JOSH BARRETT MAKES IT! Assist: Collin Butler
Score: 80-72

[09:59] Team_049 possession (Score: 80-72)
Giannis Anunoby attempts a 3Pt. Wide open! Collin Butler is 7.4 feet away. [ZONE] Giannis Anunoby misses. Rebound secured by Chris LaVine.

[09:46] Team_046 possession (Score: 80-72)
Manu Dosunmu attempts a Midrange. Contested by Shai Jordan (5.7 feet, MAN). MANU DOSUNMU MAKES IT! Assist: Chris LaVine
Score: 82-72

[09:30] Team_049 possession (Score: 82-72)
Shaquille Lillard attempts a 3Pt. Contested by Collin Butler (3.4 feet, MAN). Shaquille Lillard misses. Offensive rebound by Giannis Anunoby! Giannis Anunoby kicks it out.

[09:15] Team_049 possession (Score: 82-72)
Miles Jackson commits a violation (traveling/carry)! TURNOVER! (dead ball)

[09:00] Team_046 possession (Score: 82-72)
Kevin Allen drives and kicks out. Josh Barrett attempts a Midrange. Contested by Desmond Towns (2.6 feet, MAN). JOSH BARRETT MAKES IT!
Score: 84-72

[08:46] Team_049 possession (Score: 84-72)
Giannis Anunoby attempts a 3Pt. Contested by Chris LaVine (3.7 feet, MAN). Giannis Anunoby misses. Rebound secured by Chris LaVine.

[08:35] Team_046 possession (Score: 84-72)
Kevin Allen attempts a Midrange. Contested by Miles Jackson (4.3 feet, MAN). Kevin Allen misses. Offensive rebound by Chris LaVine! Chris LaVine kicks it out.

[08:17] Team_046 possession (Score: 84-72)
Chris LaVine attempts a Layup. BLOCKED BY MILES JACKSON! Ball goes out off Miles Jackson. Chris LaVine's ball!

[08:06] Team_046 possession (Score: 84-72)
Collin Butler attempts a 3Pt. Contested by Shaquille Lillard (4.0 feet, ZONE). Collin Butler misses. Offensive rebound by Chris LaVine! Chris LaVine kicks it out.

[07:47] Team_046 possession (Score: 84-72)
FOUL! Holding foul on Shaquille Lillard. [Team fouls: 1] No free throws, side out. (Shaquille Lillard: 1 personal fouls)

[07:32] Team_046 possession (Score: 84-72)
Chris LaVine commits a violation (traveling/carry)! TURNOVER! (dead ball)

[07:32] Substitution (Team_046): Kevin Allen OUT → Paul DeRozan IN (stamina_rule2)

[07:20] Team_049 possession (Score: 84-72)
Desmond Towns attempts a Midrange. Heavily contested by Josh Barrett (1.8 feet, MAN)! DESMOND TOWNS MAKES IT!
Score: 84-74

[07:07] Team_046 possession (Score: 84-74)
Josh Barrett attempts a 3Pt. Contested by Shaquille Lillard (4.4 feet, ZONE). Josh Barrett misses. Offensive rebound by Paul DeRozan! Paul DeRozan puts it back in!
Score: 86-74

[06:54] Team_049 possession (Score: 86-74)
Shaquille Lillard drives and kicks out. Shaquille Lillard attempts a 3Pt. Wide open! Collin Butler is 9.7 feet away. [ZONE] SHAQUILLE LILLARD MAKES IT! Assist: Desmond Towns
Score: 86-77

[06:43] Team_046 possession (Score: 86-77)
FOUL! Reach-in foul on Giannis Anunoby during the drive. [Team fouls: 2] No free throws, side out. (Giannis Anunoby: 1 personal fouls)

[06:31] Team_046 possession (Score: 86-77)
Chris LaVine attempts a Layup. BLOCKED BY SHAI JORDAN! Ball is loose! Rebound secured by Miles Jackson.

[06:14] Team_049 possession (Score: 86-77)
Miles Jackson commits a violation (traveling/carry)! TURNOVER! (dead ball)

[05:57] Team_046 possession (Score: 86-77)
Josh Barrett attempts a 3Pt. Wide open! Shaquille Lillard is 6.6 feet away. [ZONE] JOSH BARRETT MAKES IT!
Score: 89-77

[05:39] Team_049 possession (Score: 89-77)
FOUL! Shooting foul on Collin Butler. Shai Jordan to the line for 2 free throws. [Team fouls: 2] (Collin Butler: 1 personal fouls)   FT 1/2: GOOD   FT 2/2: GOOD Shai Jordan makes 2/2 from the line.
Score: 89-79

[05:24] Team_046 possession (Score: 89-79)
Manu Dosunmu attempts a 3Pt. Contested by Shaquille Lillard (3.1 feet, ZONE). MANU DOSUNMU MAKES IT! Assist: Paul DeRozan
Score: 92-79

[05:13] Team_049 possession (Score: 92-79)
Miles Jackson attempts a Layup. Contested by Chris LaVine (4.8 feet, ZONE). Miles Jackson misses. Rebound secured by Chris LaVine.

[04:57] Team_046 possession (Score: 92-79)
Paul DeRozan attempts a Midrange. Contested by Miles Jackson (5.5 feet, ZONE). Paul DeRozan misses. Rebound secured by Shai Jordan.

[04:42] Team_049 possession (Score: 92-79)
FOUL! Shooting foul on Chris LaVine. Giannis Anunoby to the line for 2 free throws. [Team fouls: 3] (Chris LaVine: 1 personal fouls)   FT 1/2: GOOD   FT 2/2: GOOD Giannis Anunoby makes 2/2 from the line.
Score: 92-81

[04:30] Team_046 possession (Score: 92-81)
Paul DeRozan attempts a Layup. Heavily contested by Miles Jackson (0.5 feet, MAN)! PAUL DEROZAN MAKES IT! Assist: Manu Dosunmu
Score: 94-81

[04:15] Team_049 possession (Score: 94-81)
Desmond Towns attempts a 3Pt. Wide open! Collin Butler is 6.8 feet away. [ZONE] Desmond Towns misses. Rebound secured by Chris LaVine.

[04:03] Team_046 possession (Score: 94-81)
Josh Barrett commits a violation (traveling/carry)! TURNOVER! (dead ball)

[03:50] Team_049 possession (Score: 94-81)
Shaquille Lillard attempts a Midrange. Contested by Josh Barrett (4.6 feet, ZONE). Shaquille Lillard misses. Rebound secured by Paul DeRozan.

[03:34] Team_046 possession (Score: 94-81)
Chris LaVine makes the 3Pt and draws the foul on Giannis Anunoby! And-1! Chris LaVine to the line for 1. [Team fouls: 3] (Giannis Anunoby: 2 personal fouls)   FT 1/1: GOOD Chris LaVine makes 1/1 from the line.
Score: 98-81

[03:22] Team_049 possession (Score: 98-81)
Desmond Towns attempts a 3Pt. Wide open! Josh Barrett is 6.2 feet away. [MAN] Desmond Towns misses. FOUL! Loose ball foul on Chris LaVine during the rebound battle. [Team fouls: 4] No free throws, side out. (Chris LaVine: 2 personal fouls)

[03:05] Team_049 possession (Score: 98-81)
Shai Jordan drives and kicks out. Shai Jordan attempts a 3Pt. Wide open! Manu Dosunmu is 9.8 feet away. [ZONE] Shai Jordan misses. Rebound secured by Chris LaVine.

[02:49] Team_046 possession (Score: 98-81)
Chris LaVine attempts a Midrange. Contested by Giannis Anunoby (2.9 feet, MAN). Chris LaVine misses. Rebound secured by Miles Jackson.

[02:36] Team_049 possession (Score: 98-81)
Shai Jordan drives, Paul DeRozan stays with him. Shai Jordan attempts a Dunk. Contested by Paul DeRozan (5.2 feet, ZONE). SHAI JORDAN MAKES IT! Assist: Miles Jackson
Score: 98-83

[02:24] Team_046 possession (Score: 98-83)
Chris LaVine drives, Giannis Anunoby stays with him. Chris LaVine attempts a Dunk. Contested by Giannis Anunoby (2.6 feet, MAN). CHRIS LAVINE MAKES IT!
Score: 100-83

[02:10] Team_049 possession (Score: 100-83)
Shaquille Lillard throws a bad pass! Stolen by Collin Butler! TURNOVER! (live ball)

[01:59] Team_046 possession (Score: 100-83)
FOUL! Holding foul on Shaquille Lillard. [Team fouls: 4] No free throws, side out. (Shaquille Lillard: 2 personal fouls)

[01:47] Team_046 possession (Score: 100-83)
Collin Butler attempts a Layup. Contested by Shaquille Lillard (2.5 feet, MAN). Collin Butler misses. Rebound secured by Giannis Anunoby.

[01:34] Team_049 possession (Score: 100-83)
Giannis Anunoby attempts a Midrange. Contested by Chris LaVine (4.9 feet, MAN). Giannis Anunoby misses. Rebound secured by Manu Dosunmu.

[01:23] Team_046 possession (Score: 100-83)
Manu Dosunmu attempts a 3Pt. Wide open! Shai Jordan is 7.8 feet away. [MAN] MANU DOSUNMU MAKES IT! Assist: Paul DeRozan
Score: 103-83

[01:07] Team_049 possession (Score: 103-83)
Shaquille Lillard attempts a Midrange. Contested by Collin Butler (5.0 feet, MAN). Shaquille Lillard misses. Rebound secured by Manu Dosunmu.

[00:54] Team_046 possession (Score: 103-83)
Josh Barrett drives, picks up Miles Jackson. Help arrives from Shai Jordan! Josh Barrett attempts a Layup. Heavily contested by Shai Jordan (0.5 feet, ZONE)! Josh Barrett misses. Rebound secured by Shai Jordan.

[00:40] Team_049 possession (Score: 103-83)
Shaquille Lillard drives, Collin Butler stays with him. Shaquille Lillard attempts a Layup. Heavily contested by Collin Butler (1.5 feet, MAN)! SHAQUILLE LILLARD MAKES IT!
Score: 103-85

[00:29] Team_046 possession (Score: 103-85)
Manu Dosunmu attempts a Layup. Contested by Miles Jackson (4.2 feet, ZONE). MANU DOSUNMU MAKES IT! Assist: Paul DeRozan
Score: 105-85

[00:16] Team_049 possession (Score: 105-85)
FOUL! Reach-in foul on Chris LaVine during the drive. [IN THE BONUS! 5 team fouls] Giannis Anunoby to the line for 2 free throws. (Chris LaVine: 3 personal fouls)   FT 1/2: GOOD   FT 2/2: GOOD Giannis Anunoby makes 2/2 from the line.
Score: 105-87

================================================================================
                              4TH QUARTER COMPLETE                              
================================================================================

4TH QUARTER SCORE: Team_046 31, Team_049 17

BOX SCORE:
================================================================================

Team_046
--------------------------------------------------------------------------------
Player                MIN  PTS  REB  AST  TO      FG   FG%      3P   3P%
--------------------------------------------------------------------------------
Manu Dosunmu           17   10    2    1   0   4/4   100.0     0/0   0.0
Josh Barrett           15    8    0    0   0   3/4    75.0     0/0   0.0
Chris LaVine           17    6    7    1   0   2/4    50.0     0/0   0.0
Paul DeRozan           17    4    2    3   0   2/3    66.7     0/0   0.0
Cade Wall              31    3    0    0   0   1/1   100.0     0/0   0.0
Kevin Allen            31    0    1    1   0   0/1     0.0     0/0   0.0
Collin Butler          17    0    0    1   0   0/1     0.0     0/0   0.0

TEAM: FG: 12/18 (66.7%), 3PT: 7/7 (100.0%), REB: 12 (4 off, 8 def), AST: 7, TO: 2
TEAM FOULS: 5 [Team_049 in BONUS]


Team_049
--------------------------------------------------------------------------------
Player                MIN  PTS  REB  AST  TO      FG   FG%      3P   3P%
--------------------------------------------------------------------------------
Shaquille Lillard      17    5    0    0   0   2/4    50.0     0/0   0.0
Giannis Anunoby        15    4    3    0   0   2/5    40.0     0/0   0.0
Shai Jordan            15    4    2    0   0   2/3    66.7     0/0   0.0
Shai Bird              31    2    0    0   0   1/1   100.0     0/0   0.0
Desmond Towns          17    2    0    1   0   1/2    50.0     0/0   0.0
Jimmy Griffin          31    0    1    0   0   0/0     0.0     0/0   0.0
De'Aaron Allen         34    0    1    1   0   0/0     0.0     0/0   0.0
Miles Jackson          15    0    2    1   0   0/1     0.0     0/0   0.0

TEAM: FG: 8/16 (50.0%), 3PT: 0/3 (0.0%), REB: 9 (3 off, 6 def), AST: 3, TO: 4
TEAM FOULS: 4

================================================================================

================================================================================
                               FULL GAME COMPLETE                               
================================================================================

FINAL SCORE: Team_046 105, Team_049 87

SCORING BY QUARTER:
--------------------------------------------------------------------------------
Team                     Q1     Q2     Q3     Q4    FINAL
--------------------------------------------------------------------------------
Team_046                 17     25     32     31      105
Team_049                 31     17     22     17       87
--------------------------------------------------------------------------------

FULL GAME BOX SCORE:
================================================================================

Team_046
--------------------------------------------------------------------------------
Player                MIN  PTS  REB  AST  TO      FG   FG%      3P   3P%      FT STL BLK
--------------------------------------------------------------------------------
Lauri Carter           34    8    6    2   0   3/5    60.0   2/3    66.7   0/0     0   0
Kevin Allen            31   16   15    5   4   7/13   53.8   1/1   100.0   0/0     0   1
D'Angelo O'Neal        31   16    3    1   0   8/14   57.1   3/8    37.5   3/4     1   0
Victor Nowitzki        31    9    0    2   5   3/5    60.0   3/4    75.0   0/0     0   0
Cade Wall              31   10    7    4   3   5/8    62.5   2/3    66.7   2/2     1   0
Collin Butler          17    6    0    2   0   2/5    40.0   1/2    50.0   1/1     1   0
Manu Dosunmu           17   13    3    2   0   5/5   100.0   3/3   100.0   0/0     0   0
Chris LaVine           17    8   12    2   1   3/5    60.0   1/1   100.0   1/1     0   0
Paul DeRozan           17    8    6    3   1   2/4    50.0   0/0     0.0   0/0     0   0
Josh Barrett           15   11    0    0   1   4/7    57.1   3/3   100.0   1/1     0   0

TEAM: FG: 42/71 (59.2%), 3PT: 19/28 (67.9%), REB: 50 (11 off, 39 def), AST: 23, TO: 15


Team_049
--------------------------------------------------------------------------------
Player                MIN  PTS  REB  AST  TO      FG   FG%      3P   3P%      FT STL BLK
--------------------------------------------------------------------------------
Ja Oladipo             34   17    0    2   2   8/16   50.0   2/6    33.3   6/6     0   0
De'Aaron Allen         34   17    8    4   1   6/10   60.0   2/3    66.7   3/4     3   1
Shai Mobley            34    6   10    0   1   3/8    37.5   0/1     0.0   1/2     3   0
Shai Bird              31   12    0    3   0   4/7    57.1   2/4    50.0   2/2     0   0
Jimmy Griffin          31    8   11    1   1   4/9    44.4   0/3     0.0   2/3     0   0
Shaquille Lillard      17    7    0    0   1   3/7    42.9   0/1     0.0   0/0     0   0
Desmond Towns          17    5    0    2   0   2/3    66.7   1/2    50.0   0/0     0   0
Shai Jordan            15    4    2    0   0   2/6    33.3   0/2     0.0   2/2     0   1
Giannis Anunoby        15    8    5    1   0   4/9    44.4   0/3     0.0   4/4     0   0
Miles Jackson          15    0    3    2   2   0/2     0.0   0/0     0.0   0/0     1   1

TEAM: FG: 37/78 (47.4%), 3PT: 7/25 (28.0%), REB: 41 (12 off, 29 def), AST: 15, TO: 8

================================================================================
