================================================================================
                        FULL GAME - Team_047 vs Team_058                        
================================================================================

================================================================================
                       1ST QUARTER - Team_047 vs Team_058                       
================================================================================

[12:00] Team_047 possession (Score: 0-0)
Josh Harris attempts a Midrange. Contested by Stephen Haliburton (3.7 feet, MAN). Josh Harris misses. Rebound secured by Tyrese Doncic.

[11:49] Team_058 possession (Score: 0-0)
Bradley Sexton drives to the basket... Bradley Sexton throws a bad pass! Stolen by De'Aaron Rose! TURNOVER! (live ball)

[11:34] Team_047 possession (Score: 0-0)
Myles LaVine attempts a Layup. Contested by Tyrese Doncic (4.7 feet, MAN). MYLES LAVINE MAKES IT! Assist: De'Aaron Rose
Score: 2-0

[11:20] Team_058 possession (Score: 2-0)
Tyrese Doncic attempts a Midrange. Contested by Blake Jokic (5.0 feet, ZONE). TYRESE DONCIC MAKES IT!
Score: 2-2

[11:05] Team_047 possession (Score: 2-2)
FOUL! Shooting foul on Kyle Westbrook. Derrick Irving to the line for 3 free throws. [Team fouls: 1] (Kyle Westbrook: 1 personal fouls)   FT 1/3: GOOD   FT 2/3: GOOD   FT 3/3: MISS Derrick Irving makes 2/3 from the line. Rebound secured by Bradley Sexton.
Score: 4-2

[10:48] Team_058 possession (Score: 4-2)
Kyle Westbrook commits a violation (traveling/carry)! TURNOVER! (dead ball)

[10:32] Team_047 possession (Score: 4-2)
Blake Jokic attempts a 3Pt. Contested by Stephen Haliburton (4.0 feet, ZONE). Blake Jokic misses. Offensive rebound by Josh Harris! Josh Harris kicks it out.

[10:18] Team_047 possession (Score: 4-2)
Derrick Irving drives, picks up Kyle Westbrook. Help arrives from Bradley Sexton! Derrick Irving attempts a Dunk. Contested by Bradley Sexton (3.3 feet, MAN). DERRICK IRVING MAKES IT! Assist: Josh Harris
Score: 6-2

[10:04] Team_058 possession (Score: 6-2)
Bradley Sexton drives, De'Aaron Rose stays with him. Bradley Sexton attempts a Dunk. Contested by De'Aaron Rose (4.6 feet, MAN). BRADLEY SEXTON MAKES IT! Assist: Kyle Westbrook
Score: 6-4

[09:46] Team_047 possession (Score: 6-4)
Josh Harris drives and kicks out. Blake Jokic attempts a 3Pt. Contested by Vince Hyland (4.5 feet, MAN). Blake Jokic misses. Offensive rebound by Myles LaVine! Myles LaVine kicks it out.

[09:32] Team_047 possession (Score: 6-4)
De'Aaron Rose drives and kicks out. Myles LaVine attempts a Midrange. Wide open! Tyrese Doncic is 8.1 feet away. [MAN] Myles LaVine misses. Rebound secured by Stephen Haliburton.

[09:19] Team_058 possession (Score: 6-4)
Kyle Westbrook attempts a Midrange. Contested by Josh Harris (3.3 feet, ZONE). Kyle Westbrook misses. Offensive rebound by Tyrese Doncic! Tyrese Doncic kicks it out.

[09:02] Team_058 possession (Score: 6-4)
Tyrese Doncic attempts a Midrange. Heavily contested by Blake Jokic (0.5 feet, ZONE)! TYRESE DONCIC MAKES IT!
Score: 6-6

[08:49] Team_047 possession (Score: 6-6)
Myles LaVine attempts a Layup. Contested by Stephen Haliburton (4.0 feet, ZONE). MYLES LAVINE MAKES IT! Assist: Josh Harris
Score: 8-6

[08:35] Team_058 possession (Score: 8-6)
Bradley Sexton drives and kicks out. Vince Hyland attempts a 3Pt. Heavily contested by De'Aaron Rose (0.5 feet, ZONE)! VINCE HYLAND MAKES IT! Assist: Bradley Sexton
Score: 8-9

[08:16] Team_047 possession (Score: 8-9)
Derrick Irving attempts a 3Pt. Contested by Bradley Sexton (2.5 feet, ZONE). DERRICK IRVING MAKES IT! Assist: Myles LaVine
Score: 11-9

[07:57] Team_058 possession (Score: 11-9)
Vince Hyland makes the Layup and draws the foul on Blake Jokic! And-1! Vince Hyland to the line for 1. [Team fouls: 1] (Blake Jokic: 1 personal fouls)   FT 1/1: GOOD Vince Hyland makes 1/1 from the line.
Score: 11-12

[07:39] Team_047 possession (Score: 11-12)
Blake Jokic drives, Vince Hyland stays with him. Blake Jokic attempts a Layup. Contested by Vince Hyland (2.7 feet, MAN). BLAKE JOKIC MAKES IT! Assist: Josh Harris
Score: 13-12

[07:26] Team_058 possession (Score: 13-12)
Vince Hyland drives, Myles LaVine stays with him. Vince Hyland attempts a Dunk. Contested by Myles LaVine (3.7 feet, ZONE). Vince Hyland misses. FOUL! Loose ball foul on Josh Harris during the rebound battle. [Team fouls: 2] No free throws, side out. (Josh Harris: 1 personal fouls)

[07:15] Team_058 possession (Score: 13-12)
Tyrese Doncic attempts a Layup. Heavily contested by Josh Harris (1.4 feet, ZONE)! Tyrese Doncic misses. Rebound secured by Myles LaVine.

[07:02] Team_047 possession (Score: 13-12)
Blake Jokic attempts a 3Pt. Contested by Kyle Westbrook (3.1 feet, ZONE). Blake Jokic misses. Rebound secured by Stephen Haliburton.

[06:47] Team_058 possession (Score: 13-12)
Tyrese Doncic attempts a Layup. Contested by Myles LaVine (3.2 feet, MAN). TYRESE DONCIC MAKES IT!
Score: 13-14

[06:31] Team_047 possession (Score: 13-14)
Blake Jokic attempts a 3Pt. Heavily contested by Vince Hyland (1.9 feet, MAN)! Blake Jokic misses. Rebound secured by Tyrese Doncic.

[06:16] Team_058 possession (Score: 13-14)
Tyrese Doncic drives and kicks out. Kyle Westbrook attempts a 3Pt. Wide open! Derrick Irving is 7.4 feet away. [MAN] KYLE WESTBROOK MAKES IT! Assist: Vince Hyland
Score: 13-17

[06:01] Team_047 possession (Score: 13-17)
Myles LaVine attempts a Layup. Contested by Tyrese Doncic (4.2 feet, MAN). Myles LaVine misses. Offensive rebound by Myles LaVine! Myles LaVine kicks it out.

[05:49] Team_047 possession (Score: 13-17)
Josh Harris loses the ball! Stripped by Stephen Haliburton! TURNOVER! (live ball)

[05:36] Team_058 possession (Score: 13-17)
Bradley Sexton drives and kicks out. Stephen Haliburton attempts a 3Pt. Contested by Josh Harris (4.6 feet, MAN). Stephen Haliburton misses. Rebound secured by Josh Harris.

[05:18] Team_047 possession (Score: 13-17)
Josh Harris drives, Stephen Haliburton stays with him. Josh Harris attempts a Layup. Heavily contested by Stephen Haliburton (0.6 feet, ZONE)! Josh Harris misses. Rebound secured by Bradley Sexton.

[05:01] Team_058 possession (Score: 13-17)
Bradley Sexton attempts a Midrange. Wide open! De'Aaron Rose is 6.6 feet away. [MAN] Bradley Sexton misses. Rebound secured by Derrick Irving.

[04:48] Team_047 possession (Score: 13-17)
Blake Jokic attempts a Midrange. Contested by Vince Hyland (2.2 feet, MAN). BLAKE JOKIC MAKES IT!
Score: 15-17

[04:31] Team_058 possession (Score: 15-17)
Stephen Haliburton attempts a Midrange. Wide open! Blake Jokic is 6.5 feet away. [ZONE] Stephen Haliburton misses. Rebound secured by Josh Harris.

[04:17] Team_047 possession (Score: 15-17)
Josh Harris attempts a Layup. Contested by Stephen Haliburton (3.2 feet, ZONE). JOSH HARRIS MAKES IT! Assist: Myles LaVine
Score: 17-17

[04:02] Team_058 possession (Score: 17-17)
Bradley Sexton attempts a Midrange. Contested by De'Aaron Rose (5.1 feet, MAN). Bradley Sexton misses. Rebound secured by Derrick Irving.

[03:45] Team_047 possession (Score: 17-17)
De'Aaron Rose attempts a 3Pt. Heavily contested by Bradley Sexton (0.8 feet, ZONE)! De'Aaron Rose misses. Rebound secured by Stephen Haliburton.

[03:32] Team_058 possession (Score: 17-17)
Stephen Haliburton attempts a 3Pt. Contested by Josh Harris (2.1 feet, MAN). STEPHEN HALIBURTON MAKES IT!
Score: 17-20

[03:19] Team_047 possession (Score: 17-20)
FOUL! Holding foul on Kyle Westbrook. [Team fouls: 2] No free throws, side out. (Kyle Westbrook: 2 personal fouls)

[03:04] Team_047 possession (Score: 17-20)
Josh Harris attempts a Midrange. Contested by Stephen Haliburton (2.5 feet, MAN). JOSH HARRIS MAKES IT!
Score: 19-20

[02:50] Team_058 possession (Score: 19-20)
Kyle Westbrook attempts a Layup. Contested by Derrick Irving (4.3 feet, MAN). Kyle Westbrook misses. Rebound secured by Myles LaVine.

[02:34] Team_047 possession (Score: 19-20)
Derrick Irving attempts a 3Pt. Wide open! Bradley Sexton is 6.2 feet away. [ZONE] DERRICK IRVING MAKES IT! Assist: Josh Harris
Score: 22-20

[02:18] Team_058 possession (Score: 22-20)
Vince Hyland attempts a Midrange. Contested by Blake Jokic (4.6 feet, MAN). VINCE HYLAND MAKES IT!
Score: 22-22

[02:06] Team_047 possession (Score: 22-22)
Derrick Irving attempts a 3Pt. Wide open! Kyle Westbrook is 7.3 feet away. [MAN] Derrick Irving misses. Rebound secured by Bradley Sexton.

[01:55] Team_058 possession (Score: 22-22)
Stephen Haliburton attempts a 3Pt. Contested by Josh Harris (5.7 feet, MAN). Stephen Haliburton misses. Offensive rebound by Stephen Haliburton! Stephen Haliburton's putback is no good. Rebound secured by Derrick Irving.

[01:36] Team_047 possession (Score: 22-22)
Josh Harris attempts a Midrange. Heavily contested by Stephen Haliburton (0.5 feet, MAN)! JOSH HARRIS MAKES IT!
Score: 24-22

[01:23] Team_058 possession (Score: 24-22)
Stephen Haliburton attempts a 3Pt. Contested by Josh Harris (4.8 feet, MAN). Stephen Haliburton misses. Rebound secured by Josh Harris.

[01:08] Team_047 possession (Score: 24-22)
Josh Harris drives and kicks out. De'Aaron Rose attempts a 3Pt. Contested by Bradley Sexton (4.2 feet, ZONE). De'Aaron Rose misses. Rebound secured by Tyrese Doncic.

[00:50] Team_058 possession (Score: 24-22)
Bradley Sexton attempts a 3Pt. Wide open! De'Aaron Rose is 8.3 feet away. [MAN] BRADLEY SEXTON MAKES IT! Assist: Tyrese Doncic
Score: 24-25

[00:33] Team_047 possession (Score: 24-25)
Myles LaVine drives, Stephen Haliburton stays with him. Myles LaVine attempts a Dunk. Contested by Stephen Haliburton (3.2 feet, ZONE). Myles LaVine misses. Rebound secured by Tyrese Doncic.

[00:17] Team_058 possession (Score: 24-25)
Vince Hyland drives, picks up Josh Harris. Help arrives from Derrick Irving! Vince Hyland attempts a Layup. Contested by Derrick Irving (2.1 feet, ZONE). Vince Hyland misses. Rebound secured by Josh Harris.

================================================================================
                              1ST QUARTER COMPLETE                              
================================================================================

1ST QUARTER SCORE: Team_047 24, Team_058 25

BOX SCORE:
================================================================================

Team_047
--------------------------------------------------------------------------------
Player                MIN  PTS  REB  AST  TO      FG   FG%      3P   3P%
--------------------------------------------------------------------------------
Josh Harris            12    6    5    4   0   3/6    50.0     0/0   0.0
Myles LaVine           12    4    4    2   0   2/3    66.7     0/0   0.0
Blake Jokic            12    4    0    0   0   2/4    50.0     0/0   0.0
De'Aaron Rose          12    0    0    1   0   0/2     0.0     0/0   0.0

TEAM: FG: 10/20 (50.0%), 3PT: 2/7 (28.6%), REB: 11 (3 off, 8 def), AST: 7, TO: 1
TEAM FOULS: 2


Team_058
--------------------------------------------------------------------------------
Player                MIN  PTS  REB  AST  TO      FG   FG%      3P   3P%
--------------------------------------------------------------------------------
Derrick Irving         12    8    3    0   0   3/5    60.0     0/0   0.0
Vince Hyland           12    8    0    1   0   3/4    75.0     0/0   0.0
Tyrese Doncic          12    6    5    1   0   3/4    75.0     0/0   0.0
Bradley Sexton         12    5    3    1   0   2/5    40.0     0/0   0.0
Kyle Westbrook         12    3    0    1   0   1/2    50.0     0/0   0.0
Stephen Haliburton     12    3    4    0   0   1/4    25.0     0/0   0.0

TEAM: FG: 10/19 (52.6%), 3PT: 2/4 (50.0%), REB: 13 (3 off, 10 def), AST: 4, TO: 2
TEAM FOULS: 2

================================================================================

================================================================================
                       2ND QUARTER - Team_047 vs Team_058                       
================================================================================

[12:00] Team_047 possession (Score: 24-25)
Myles LaVine attempts a Layup. Contested by Stephen Haliburton (3.0 feet, ZONE). Myles LaVine misses. Offensive rebound by Josh Harris! Josh Harris kicks it out.

[11:42] Team_047 possession (Score: 24-25)
Derrick Irving attempts a Midrange. Wide open! Kyle Westbrook is 6.8 feet away. [MAN] Derrick Irving misses. Rebound secured by Stephen Haliburton.

[11:30] Team_058 possession (Score: 24-25)
Vince Hyland attempts a 3Pt. Wide open! De'Aaron Rose is 7.8 feet away. [ZONE] Vince Hyland misses. Offensive rebound by Tyrese Doncic! Tyrese Doncic kicks it out.

[11:19] Team_058 possession (Score: 24-25)
Bradley Sexton attempts a Midrange. Contested by De'Aaron Rose (5.6 feet, MAN). Bradley Sexton misses. Rebound secured by Derrick Irving.

[11:01] Team_047 possession (Score: 24-25)
Blake Jokic attempts a 3Pt. Contested by Bradley Sexton (4.3 feet, ZONE). Blake Jokic misses. Rebound secured by Bradley Sexton.

[10:48] Team_058 possession (Score: 24-25)
Bradley Sexton attempts a Midrange. Contested by Derrick Irving (5.2 feet, ZONE). BRADLEY SEXTON MAKES IT! Assist: Tyrese Doncic
Score: 24-27

[10:34] Team_047 possession (Score: 24-27)
Josh Harris attempts a 3Pt. Contested by Bradley Sexton (2.5 feet, ZONE). JOSH HARRIS MAKES IT! Assist: Derrick Irving
Score: 27-27

[10:16] Team_058 possession (Score: 27-27)
Bradley Sexton drives and kicks out. Kyle Westbrook attempts a 3Pt. Contested by Derrick Irving (2.0 feet, MAN). Kyle Westbrook misses. Rebound secured by Derrick Irving.

[10:00] Team_047 possession (Score: 27-27)
Myles LaVine attempts a Midrange. Wide open! Kyle Westbrook is 6.0 feet away. [ZONE] MYLES LAVINE MAKES IT! Assist: Derrick Irving
Score: 29-27

[09:46] Team_058 possession (Score: 29-27)
Stephen Haliburton attempts a Midrange. Contested by Josh Harris (5.5 feet, MAN). Stephen Haliburton misses. Rebound secured by Myles LaVine.

[09:34] Team_047 possession (Score: 29-27)
Derrick Irving attempts a Midrange. Wide open! Kyle Westbrook is 6.7 feet away. [MAN] Derrick Irving misses. Rebound secured by Bradley Sexton.

[09:21] Team_058 possession (Score: 29-27)
Tyrese Doncic attempts a Layup. Wide open! Josh Harris is 6.1 feet away. [ZONE] TYRESE DONCIC MAKES IT! Assist: Bradley Sexton
Score: 29-29

[09:07] Team_047 possession (Score: 29-29)
Blake Jokic attempts a Layup. Contested by Stephen Haliburton (6.0 feet, ZONE). Blake Jokic misses. Rebound secured by Tyrese Doncic.

[08:53] Team_058 possession (Score: 29-29)
Tyrese Doncic attempts a 3Pt. Wide open! De'Aaron Rose is 7.6 feet away. [ZONE] Tyrese Doncic misses. Rebound secured by Derrick Irving.

[08:43] Team_047 possession (Score: 29-29)
Blake Jokic drives to the basket... Blake Jokic throws a bad pass! Stolen by Stephen Haliburton! TURNOVER! (live ball)

[08:25] Team_058 possession (Score: 29-29)
Stephen Haliburton drives, picks up Josh Harris. Help arrives from Derrick Irving! Stephen Haliburton attempts a Dunk. Wide open! Derrick Irving is 6.3 feet away. [ZONE] Stephen Haliburton misses. Rebound secured by Josh Harris.

[08:11] Team_047 possession (Score: 29-29)
Myles LaVine throws a bad pass! Stolen by Tyrese Doncic! TURNOVER! (live ball)

[07:56] Team_058 possession (Score: 29-29)
Kyle Westbrook attempts a 3Pt. Contested by Derrick Irving (5.2 feet, MAN). Kyle Westbrook misses. Rebound secured by Josh Harris.

[07:40] Team_047 possession (Score: 29-29)
Myles LaVine commits a violation (traveling/carry)! TURNOVER! (dead ball)

[07:40] Substitution (Team_047): De'Aaron Rose OUT → Austin Giddey IN (stamina_rule2)

[07:40] Substitution (Team_047): Derrick Irving OUT → Donovan Iverson IN (stamina_rule2)

[07:40] Substitution (Team_047): Blake Jokic OUT → Blake Jackson IN (stamina_rule2)

[07:40] Substitution (Team_047): Josh Harris OUT → Tony Poole IN (stamina_rule2)

[07:40] Substitution (Team_047): Myles LaVine OUT → Zion Thompson IN (stamina_rule2)

[07:40] Substitution (Team_058): Bradley Sexton OUT → Draymond Williamson IN (stamina_rule2)

[07:40] Substitution (Team_058): Kyle Westbrook OUT → Jordan Ingram IN (stamina_rule2)

[07:40] Substitution (Team_058): Vince Hyland OUT → Pascal Holiday IN (stamina_rule2)

[07:40] Substitution (Team_058): Stephen Haliburton OUT → Shai Lowry IN (stamina_rule2)

[07:40] Substitution (Team_058): Tyrese Doncic OUT → Jarrett Gilgeous-Alexander IN (stamina_rule2)

[07:24] Team_058 possession (Score: 29-29)
Pascal Holiday drives, picks up Zion Thompson. Help arrives from Donovan Iverson! Pascal Holiday attempts a Dunk. Contested by Donovan Iverson (2.0 feet, ZONE). PASCAL HOLIDAY MAKES IT!
Score: 29-31

[07:14] Team_047 possession (Score: 29-31)
Zion Thompson attempts a Layup. BLOCKED BY SHAI LOWRY! Ball is loose! Offensive rebound by Blake Jackson! Blake Jackson kicks it out.

[06:57] Team_047 possession (Score: 29-31)
Donovan Iverson attempts a 3Pt. Contested by Draymond Williamson (5.5 feet, ZONE). Donovan Iverson misses. Rebound secured by Shai Lowry.

[06:45] Team_058 possession (Score: 29-31)
Shai Lowry attempts a Layup. Contested by Zion Thompson (5.4 feet, ZONE). SHAI LOWRY MAKES IT! Assist: Pascal Holiday
Score: 29-33

[06:33] Team_047 possession (Score: 29-33)
Austin Giddey attempts a Midrange. Contested by Draymond Williamson (4.3 feet, MAN). AUSTIN GIDDEY MAKES IT!
Score: 31-33

[06:15] Team_058 possession (Score: 31-33)
Jarrett Gilgeous-Alexander attempts a Layup. BLOCKED BY ZION THOMPSON! Ball deflects out of bounds off Jarrett Gilgeous-Alexander.

[05:56] Team_047 possession (Score: 31-33)
Blake Jackson attempts a 3Pt. Wide open! Pascal Holiday is 7.7 feet away. [MAN] Blake Jackson misses. Rebound secured by Jarrett Gilgeous-Alexander.

[05:46] Team_058 possession (Score: 31-33)
Pascal Holiday drives to the basket... FOUL! Offensive foul on Pascal Holiday! Zion Thompson drew the charge! [Team fouls: 1] (Pascal Holiday: 1 personal fouls) TURNOVER! (dead ball)

[05:33] Team_047 possession (Score: 31-33)
Austin Giddey throws a bad pass! Stolen by Draymond Williamson! TURNOVER! (live ball)

[05:20] Team_058 possession (Score: 31-33)
Draymond Williamson attempts a 3Pt. Contested by Austin Giddey (3.6 feet, MAN). Draymond Williamson misses. Rebound secured by Zion Thompson.

[05:01] Team_047 possession (Score: 31-33)
Tony Poole drives to the basket... Tony Poole throws a bad pass out of bounds! TURNOVER! (dead ball)

[04:46] Team_058 possession (Score: 31-33)
Pascal Holiday attempts a Midrange. Wide open! Donovan Iverson is 7.1 feet away. [ZONE] Pascal Holiday misses. Rebound secured by Blake Jackson.

[04:31] Team_047 possession (Score: 31-33)
FOUL! Shooting foul on Pascal Holiday. Blake Jackson to the line for 2 free throws. [Team fouls: 2] (Pascal Holiday: 2 personal fouls)   FT 1/2: MISS   FT 2/2: GOOD Blake Jackson makes 1/2 from the line.
Score: 32-33

[04:17] Team_058 possession (Score: 32-33)
FOUL! Holding foul on Austin Giddey. [Team fouls: 1] No free throws, side out. (Austin Giddey: 1 personal fouls)

[04:02] Team_058 possession (Score: 32-33)
Draymond Williamson drives, picks up Austin Giddey. Help arrives from Donovan Iverson! Draymond Williamson attempts a Layup. Contested by Donovan Iverson (5.6 feet, MAN). DRAYMOND WILLIAMSON MAKES IT! Assist: Pascal Holiday
Score: 32-35

[03:47] Team_047 possession (Score: 32-35)
Austin Giddey drives to the basket... Austin Giddey loses control! Ball rolls out of bounds! TURNOVER! (dead ball)

[03:32] Team_058 possession (Score: 32-35)
Shai Lowry attempts a Midrange. Heavily contested by Blake Jackson (1.4 feet, ZONE)! Shai Lowry misses. Rebound secured by Donovan Iverson.

[03:17] Team_047 possession (Score: 32-35)
Tony Poole makes the Midrange and draws the foul on Shai Lowry! And-1! Tony Poole to the line for 1. [Team fouls: 3] (Shai Lowry: 1 personal fouls)   FT 1/1: GOOD Tony Poole makes 1/1 from the line.
Score: 35-35

[03:05] Team_058 possession (Score: 35-35)
Shai Lowry attempts a 3Pt. Contested by Tony Poole (4.3 feet, MAN). Shai Lowry misses. Rebound secured by Zion Thompson.

[02:49] Team_047 possession (Score: 35-35)
Donovan Iverson attempts a Midrange. Contested by Pascal Holiday (4.2 feet, ZONE). Donovan Iverson misses. Rebound secured by Shai Lowry.

[02:37] Team_058 possession (Score: 35-35)
Jarrett Gilgeous-Alexander attempts a Midrange. Wide open! Tony Poole is 6.3 feet away. [ZONE] Jarrett Gilgeous-Alexander misses. FOUL! Loose ball foul on Donovan Iverson during the rebound battle. [Team fouls: 2] No free throws, side out. (Donovan Iverson: 1 personal fouls)

[02:22] Team_058 possession (Score: 35-35)
Jarrett Gilgeous-Alexander attempts a Midrange. Contested by Zion Thompson (3.9 feet, MAN). Jarrett Gilgeous-Alexander misses. Offensive rebound by Pascal Holiday! Pascal Holiday's putback is no good. Rebound secured by Blake Jackson.

[02:07] Team_047 possession (Score: 35-35)
Tony Poole throws a bad pass out of bounds! TURNOVER! (dead ball)

[01:54] Team_058 possession (Score: 35-35)
Jarrett Gilgeous-Alexander drives and kicks out. Jordan Ingram attempts a 3Pt. Heavily contested by Donovan Iverson (1.5 feet, MAN)! Jordan Ingram misses. Rebound secured by Zion Thompson.

[01:38] Team_047 possession (Score: 35-35)
Zion Thompson attempts a 3Pt. Contested by Draymond Williamson (4.6 feet, ZONE). Zion Thompson misses. Rebound secured by Pascal Holiday.

[01:21] Team_058 possession (Score: 35-35)
Pascal Holiday attempts a 3Pt. Wide open! Donovan Iverson is 7.1 feet away. [ZONE] Pascal Holiday misses. Rebound secured by Blake Jackson.

[01:08] Team_047 possession (Score: 35-35)
Blake Jackson attempts a 3Pt. Contested by Draymond Williamson (5.6 feet, ZONE). Blake Jackson misses. Rebound secured by Jarrett Gilgeous-Alexander.

[00:54] Team_058 possession (Score: 35-35)
Shai Lowry attempts a Midrange. Contested by Donovan Iverson (4.2 feet, ZONE). SHAI LOWRY MAKES IT! Assist: Draymond Williamson
Score: 35-37

[00:39] Team_047 possession (Score: 35-37)
Tony Poole attempts a 3Pt. Wide open! Draymond Williamson is 6.5 feet away. [ZONE] Tony Poole misses. Rebound secured by Jarrett Gilgeous-Alexander.

[00:23] Team_058 possession (Score: 35-37)
Jarrett Gilgeous-Alexander drives to the basket... Jarrett Gilgeous-Alexander loses the ball! Stripped by Zion Thompson! TURNOVER! (live ball)

[00:05] Team_047 possession (Score: 35-37)
FOUL! Offensive foul on Austin Giddey! Draymond Williamson drew the charge! [Team fouls: 3] (Austin Giddey: 2 personal fouls) TURNOVER! (dead ball)

================================================================================
                              2ND QUARTER COMPLETE                              
================================================================================

2ND QUARTER SCORE: Team_047 11, Team_058 12

BOX SCORE:
================================================================================

Team_047
--------------------------------------------------------------------------------
Player                MIN  PTS  REB  AST  TO      FG   FG%      3P   3P%
--------------------------------------------------------------------------------
Josh Harris            17    3    3    0   0   1/1   100.0     0/0   0.0
Tony Poole              8    3    0    0   0   1/2    50.0     0/0   0.0
Myles LaVine           17    2    1    0   0   1/1   100.0     0/0   0.0
Austin Giddey           8    2    0    0   0   1/1   100.0     0/0   0.0
Blake Jackson           8    1    4    0   0   1/3    33.3     0/0   0.0
Derrick Irving         17    0    3    2   0   0/2     0.0     0/0   0.0
Blake Jokic            17    0    0    0   0   0/2     0.0     0/0   0.0
Donovan Iverson         8    0    1    0   0   0/2     0.0     0/0   0.0
Zion Thompson           8    0    3    0   0   0/1     0.0     0/0   0.0

TEAM: FG: 5/15 (33.3%), 3PT: 1/7 (14.3%), REB: 14 (2 off, 12 def), AST: 2, TO: 8
TEAM FOULS: 3


Team_058
--------------------------------------------------------------------------------
Player                MIN  PTS  REB  AST  TO      FG   FG%      3P   3P%
--------------------------------------------------------------------------------
Shai Lowry              8    4    2    0   0   2/4    50.0     0/0   0.0
Tyrese Doncic          17    2    2    1   0   1/2    50.0     0/0   0.0
Bradley Sexton         17    2    2    1   0   1/3    33.3     0/0   0.0
Pascal Holiday          8    2    2    2   0   1/3    33.3     0/0   0.0
Draymond Williamson     8    2    0    1   0   1/2    50.0     0/0   0.0
Stephen Haliburton     17    0    1    0   0   0/2     0.0     0/0   0.0
Kyle Westbrook         17    0    0    0   0   0/1     0.0     0/0   0.0
Jarrett Gilgeous-Alexander    8    0    3    0   0   0/3     0.0     0/0   0.0

TEAM: FG: 6/20 (30.0%), 3PT: 0/5 (0.0%), REB: 13 (3 off, 10 def), AST: 5, TO: 2
TEAM FOULS: 3

================================================================================

================================================================================
                       3RD QUARTER - Team_047 vs Team_058                       
================================================================================

[12:00] Team_047 possession (Score: 35-37)
Josh Harris attempts a 3Pt. Contested by Bradley Sexton (4.7 feet, ZONE). Josh Harris misses. Rebound secured by Stephen Haliburton.

[11:43] Team_058 possession (Score: 35-37)
Stephen Haliburton attempts a 3Pt. Contested by De'Aaron Rose (4.9 feet, ZONE). STEPHEN HALIBURTON MAKES IT! Assist: Bradley Sexton
Score: 35-40

[11:27] Team_047 possession (Score: 35-40)
De'Aaron Rose drives, Stephen Haliburton stays with him. De'Aaron Rose attempts a Dunk. Contested by Stephen Haliburton (2.7 feet, ZONE). DE'AARON ROSE MAKES IT! Assist: Myles LaVine
Score: 37-40

[11:11] Team_058 possession (Score: 37-40)
Vince Hyland drives, Josh Harris stays with him. Vince Hyland attempts a Layup. Contested by Josh Harris (2.0 feet, ZONE). VINCE HYLAND MAKES IT!
Score: 37-42

[11:01] Team_047 possession (Score: 37-42)
De'Aaron Rose attempts a 3Pt. Wide open! Bradley Sexton is 6.0 feet away. [ZONE] De'Aaron Rose misses. Rebound secured by Bradley Sexton.

[10:49] Team_058 possession (Score: 37-42)
Vince Hyland attempts a 3Pt. Contested by Blake Jokic (5.8 feet, MAN). VINCE HYLAND MAKES IT! Assist: Tyrese Doncic
Score: 37-45

[10:38] Team_047 possession (Score: 37-45)
FOUL! Holding foul on Kyle Westbrook. [Team fouls: 1] No free throws, side out. (Kyle Westbrook: 1 personal fouls)

[10:24] Team_047 possession (Score: 37-45)
Josh Harris drives, picks up Stephen Haliburton. Help arrives from Bradley Sexton! Josh Harris attempts a Dunk. Contested by Bradley Sexton (2.8 feet, ZONE). JOSH HARRIS MAKES IT! Assist: Myles LaVine
Score: 39-45

[10:11] Team_058 possession (Score: 39-45)
Kyle Westbrook drives, picks up Derrick Irving. Help arrives from Blake Jokic! Kyle Westbrook attempts a Layup. Contested by Blake Jokic (5.4 feet, MAN). KYLE WESTBROOK MAKES IT! Assist: Tyrese Doncic
Score: 39-47

[09:55] Team_047 possession (Score: 39-47)
De'Aaron Rose attempts a Layup. BLOCKED BY KYLE WESTBROOK! Ball goes out off Kyle Westbrook. De'Aaron Rose's ball!

[09:39] Team_047 possession (Score: 39-47)
FOUL! Offensive foul on Blake Jokic! Vince Hyland drew the charge! [Team fouls: 1] (Blake Jokic: 1 personal fouls) TURNOVER! (dead ball)

[09:19] Team_058 possession (Score: 39-47)
Tyrese Doncic drives, Myles LaVine stays with him. Tyrese Doncic attempts a Dunk. Wide open! Myles LaVine is 7.6 feet away. [MAN] TYRESE DONCIC MAKES IT! Assist: Kyle Westbrook
Score: 39-49

[09:04] Team_047 possession (Score: 39-49)
Blake Jokic attempts a Layup. Contested by Stephen Haliburton (2.4 feet, ZONE). Blake Jokic misses. Rebound secured by Tyrese Doncic.

[08:51] Team_058 possession (Score: 39-49)
Kyle Westbrook attempts a Midrange. Contested by Josh Harris (5.0 feet, ZONE). KYLE WESTBROOK MAKES IT!
Score: 39-51

[08:39] Team_047 possession (Score: 39-51)
Blake Jokic drives, Vince Hyland stays with him. Blake Jokic attempts a Dunk. Contested by Vince Hyland (5.1 feet, MAN). BLAKE JOKIC MAKES IT! Assist: Myles LaVine
Score: 41-51

[08:26] Team_058 possession (Score: 41-51)
Bradley Sexton attempts a 3Pt. Wide open! De'Aaron Rose is 6.7 feet away. [ZONE] Bradley Sexton misses. Offensive rebound by Stephen Haliburton! Stephen Haliburton's putback is no good. Offensive rebound by Tyrese Doncic! Tyrese Doncic kicks it out.

[08:12] Team_058 possession (Score: 41-51)
Tyrese Doncic drives to the basket... Tyrese Doncic throws a bad pass! Stolen by Josh Harris! TURNOVER! (live ball)

[08:00] Team_047 possession (Score: 41-51)
Blake Jokic attempts a Midrange. Contested by Vince Hyland (2.5 feet, MAN). Blake Jokic misses. Rebound secured by Stephen Haliburton.

[07:44] Team_058 possession (Score: 41-51)
Stephen Haliburton attempts a Midrange. Contested by Josh Harris (5.8 feet, MAN). Stephen Haliburton misses. Rebound secured by Josh Harris.

[07:32] Team_047 possession (Score: 41-51)
De'Aaron Rose attempts a 3Pt. Heavily contested by Bradley Sexton (1.5 feet, ZONE)! De'Aaron Rose misses. Rebound secured by Stephen Haliburton.

[07:19] Team_058 possession (Score: 41-51)
Tyrese Doncic drives to the basket... Tyrese Doncic commits a violation (traveling/carry)! TURNOVER! (dead ball)

[07:05] Team_047 possession (Score: 41-51)
De'Aaron Rose attempts a Midrange. Contested by Bradley Sexton (3.1 feet, MAN). De'Aaron Rose misses. Rebound secured by Stephen Haliburton.

[06:49] Team_058 possession (Score: 41-51)
Tyrese Doncic makes the Layup and draws the foul on Myles LaVine! And-1! Tyrese Doncic to the line for 1. [Team fouls: 2] (Myles LaVine: 1 personal fouls)   FT 1/1: GOOD Tyrese Doncic makes 1/1 from the line.
Score: 41-54

[06:31] Team_047 possession (Score: 41-54)
De'Aaron Rose attempts a 3Pt. Contested by Bradley Sexton (2.2 feet, MAN). De'Aaron Rose misses. Rebound secured by Stephen Haliburton.

[06:17] Team_058 possession (Score: 41-54)
Bradley Sexton attempts a 3Pt. Contested by Blake Jokic (2.0 feet, ZONE). Bradley Sexton misses. Rebound secured by Derrick Irving.

[06:02] Team_047 possession (Score: 41-54)
De'Aaron Rose attempts a 3Pt. Contested by Bradley Sexton (4.5 feet, MAN). De'Aaron Rose misses. Rebound secured by Stephen Haliburton.

[05:49] Team_058 possession (Score: 41-54)
Vince Hyland drives to the basket... Vince Hyland loses the ball! Stripped by Blake Jokic! TURNOVER! (live ball)

[05:31] Team_047 possession (Score: 41-54)
FOUL! Shooting foul on Bradley Sexton. Derrick Irving to the line for 3 free throws. [Team fouls: 2] (Bradley Sexton: 1 personal fouls)   FT 1/3: GOOD   FT 2/3: MISS   FT 3/3: MISS Derrick Irving makes 1/3 from the line. Rebound secured by Stephen Haliburton.
Score: 42-54

[05:17] Team_058 possession (Score: 42-54)
Tyrese Doncic drives and kicks out. Stephen Haliburton attempts a 3Pt. Contested by De'Aaron Rose (3.3 feet, ZONE). Stephen Haliburton misses. Offensive rebound by Tyrese Doncic! Tyrese Doncic kicks it out.

[05:04] Team_058 possession (Score: 42-54)
Vince Hyland attempts a Layup. BLOCKED BY BLAKE JOKIC! Ball is loose! Offensive rebound by Tyrese Doncic! Tyrese Doncic kicks it out.

[04:49] Team_058 possession (Score: 42-54)
Stephen Haliburton attempts a Layup. Contested by Josh Harris (5.9 feet, ZONE). STEPHEN HALIBURTON MAKES IT! Assist: Tyrese Doncic
Score: 42-56

[04:35] Team_047 possession (Score: 42-56)
FOUL! Reach-in foul on Stephen Haliburton during the drive. [Team fouls: 3] No free throws, side out. (Stephen Haliburton: 1 personal fouls)

[04:24] Team_047 possession (Score: 42-56)
Josh Harris drives and kicks out. Derrick Irving attempts a Midrange. Contested by Kyle Westbrook (2.7 feet, MAN). Derrick Irving misses. Rebound secured by Stephen Haliburton.

[04:14] Team_058 possession (Score: 42-56)
Tyrese Doncic drives and kicks out. Bradley Sexton attempts a Midrange. Heavily contested by De'Aaron Rose (0.5 feet, MAN)! Bradley Sexton misses. Rebound secured by Josh Harris.

[03:55] Team_047 possession (Score: 42-56)
De'Aaron Rose drives and kicks out. De'Aaron Rose attempts a 3Pt. Contested by Bradley Sexton (4.7 feet, ZONE). De'Aaron Rose misses. Rebound secured by Bradley Sexton.

[03:40] Team_058 possession (Score: 42-56)
Stephen Haliburton drives, picks up Josh Harris. Help arrives from Derrick Irving! Stephen Haliburton attempts a Dunk. Contested by Derrick Irving (3.5 feet, MAN). STEPHEN HALIBURTON MAKES IT! Assist: Kyle Westbrook
Score: 42-58

[03:21] Team_047 possession (Score: 42-58)
Josh Harris attempts a Midrange. Contested by Stephen Haliburton (4.4 feet, MAN). Josh Harris misses. Offensive rebound by Myles LaVine! Myles LaVine kicks it out.

[03:04] Team_047 possession (Score: 42-58)
Myles LaVine attempts a Layup. BLOCKED BY TYRESE DONCIC! Ball is loose! Rebound secured by Stephen Haliburton.

[02:48] Team_058 possession (Score: 42-58)
Stephen Haliburton makes the Dunk and draws the foul on Josh Harris! And-1! Stephen Haliburton to the line for 1. [Team fouls: 3] (Josh Harris: 1 personal fouls)   FT 1/1: GOOD Stephen Haliburton makes 1/1 from the line.
Score: 42-61

[02:33] Team_047 possession (Score: 42-61)
De'Aaron Rose throws a bad pass! Stolen by Bradley Sexton! TURNOVER! (live ball)

[02:18] Team_058 possession (Score: 42-61)
Bradley Sexton makes the 3Pt and draws the foul on De'Aaron Rose! And-1! Bradley Sexton to the line for 1. [Team fouls: 4] (De'Aaron Rose: 1 personal fouls)   FT 1/1: GOOD Bradley Sexton makes 1/1 from the line.
Score: 42-65

[02:01] Team_047 possession (Score: 42-65)
Josh Harris attempts a Layup. Contested by Stephen Haliburton (4.9 feet, ZONE). Josh Harris misses. Rebound secured by Bradley Sexton.

[01:45] Team_058 possession (Score: 42-65)
Bradley Sexton attempts a 3Pt. Contested by De'Aaron Rose (5.5 feet, MAN). BRADLEY SEXTON MAKES IT!
Score: 42-68

[01:34] Team_047 possession (Score: 42-68)
De'Aaron Rose attempts a 3Pt. Wide open! Bradley Sexton is 7.9 feet away. [ZONE] De'Aaron Rose misses. Rebound secured by Tyrese Doncic.

[01:23] Team_058 possession (Score: 42-68)
Stephen Haliburton makes the Layup and draws the foul on Josh Harris! And-1! Stephen Haliburton to the line for 1. [BONUS: 5 team fouls] (Josh Harris: 2 personal fouls)   FT 1/1: GOOD Stephen Haliburton makes 1/1 from the line.
Score: 42-71

[01:11] Team_047 possession (Score: 42-71)
Josh Harris attempts a Midrange. Contested by Stephen Haliburton (4.2 feet, MAN). JOSH HARRIS MAKES IT! Assist: De'Aaron Rose
Score: 44-71

[00:57] Team_058 possession (Score: 44-71)
Kyle Westbrook drives to the basket... Kyle Westbrook loses the ball! Stripped by Josh Harris! TURNOVER! (live ball)

[00:48] Team_047 possession (Score: 44-71)
Derrick Irving attempts a 3Pt. Wide open! Kyle Westbrook is 7.1 feet away. [MAN] Derrick Irving misses. Rebound secured by Bradley Sexton.

[00:32] Team_058 possession (Score: 44-71)
Kyle Westbrook drives and kicks out. FOUL! Shooting foul on Blake Jokic. Vince Hyland to the line for 2 free throws. [BONUS: 6 team fouls] (Blake Jokic: 2 personal fouls)   FT 1/2: GOOD   FT 2/2: GOOD Vince Hyland makes 2/2 from the line.
Score: 44-73

[00:16] Team_047 possession (Score: 44-73)
Derrick Irving attempts a 3Pt. Contested by Kyle Westbrook (5.4 feet, MAN). Derrick Irving misses. Rebound secured by Bradley Sexton.

[00:01] Team_058 possession (Score: 44-73)
Stephen Haliburton attempts a Layup. BLOCKED BY JOSH HARRIS! Ball is loose! Rebound secured by Myles LaVine.

================================================================================
                              3RD QUARTER COMPLETE                              
================================================================================

3RD QUARTER SCORE: Team_047 9, Team_058 36

BOX SCORE:
================================================================================

Team_047
--------------------------------------------------------------------------------
Player                MIN  PTS  REB  AST  TO      FG   FG%      3P   3P%
--------------------------------------------------------------------------------
Josh Harris            29    4    2    0   0   2/5    40.0     0/0   0.0
De'Aaron Rose          29    2    0    1   0   1/8    12.5     0/0   0.0
Blake Jokic            29    2    0    0   0   1/3    33.3     0/0   0.0
Myles LaVine           29    0    2    3   0   0/1     0.0     0/0   0.0
Derrick Irving         29    0    1    0   0   0/3     0.0     0/0   0.0

TEAM: FG: 4/20 (20.0%), 3PT: 0/9 (0.0%), REB: 5 (1 off, 4 def), AST: 4, TO: 2
TEAM FOULS: 6 [Team_058 in BONUS]


Team_058
--------------------------------------------------------------------------------
Player                MIN  PTS  REB  AST  TO      FG   FG%      3P   3P%
--------------------------------------------------------------------------------
Stephen Haliburton     29   13    9    0   0   5/7    71.4     0/0   0.0
Bradley Sexton         29    7    5    1   0   2/3    66.7     0/0   0.0
Vince Hyland           29    7    0    0   0   3/3   100.0     0/0   0.0
Tyrese Doncic          29    5    5    3   0   2/3    66.7     0/0   0.0
Kyle Westbrook         29    4    0    2   0   2/2   100.0     0/0   0.0

TEAM: FG: 14/18 (77.8%), 3PT: 4/5 (80.0%), REB: 19 (3 off, 16 def), AST: 6, TO: 4
TEAM FOULS: 3

================================================================================

================================================================================
                       4TH QUARTER - Team_047 vs Team_058                       
================================================================================

[12:00] Substitution (Team_047): De'Aaron Rose OUT (stamina: 69) → Austin Giddey IN (comeback_detected)

[12:00] Substitution (Team_058): Bradley Sexton OUT (stamina: 69) → Draymond Williamson IN (comeback_detected)

[12:00] Team_047 possession (Score: 44-73)
Austin Giddey attempts a 3Pt. Contested by Draymond Williamson (5.9 feet, MAN). AUSTIN GIDDEY MAKES IT! Assist: Josh Harris
Score: 47-73

[11:44] Team_058 possession (Score: 47-73)
Stephen Haliburton attempts a Midrange. Wide open! Josh Harris is 6.1 feet away. [ZONE] STEPHEN HALIBURTON MAKES IT! Assist: Kyle Westbrook
Score: 47-75

[11:26] Team_047 possession (Score: 47-75)
Josh Harris attempts a Layup. BLOCKED BY STEPHEN HALIBURTON! Ball is loose! Rebound secured by Stephen Haliburton.

[11:11] Team_058 possession (Score: 47-75)
Stephen Haliburton attempts a 3Pt. Contested by Josh Harris (2.7 feet, MAN). STEPHEN HALIBURTON MAKES IT! Assist: Vince Hyland
Score: 47-78

[10:54] Team_047 possession (Score: 47-78)
Austin Giddey drives to the basket... FOUL! Offensive foul on Austin Giddey! Draymond Williamson drew the charge! [Team fouls: 1] (Austin Giddey: 1 personal fouls) TURNOVER! (dead ball)

[10:39] Team_058 possession (Score: 47-78)
Vince Hyland attempts a 3Pt. Contested by Blake Jokic (5.4 feet, MAN). VINCE HYLAND MAKES IT! Assist: Tyrese Doncic
Score: 47-81

[10:24] Team_047 possession (Score: 47-81)
Myles LaVine attempts a Midrange. Contested by Tyrese Doncic (5.0 feet, MAN). Myles LaVine misses. Rebound secured by Vince Hyland.

[10:11] Team_058 possession (Score: 47-81)
Stephen Haliburton attempts a Midrange. Contested by Blake Jokic (3.6 feet, ZONE). STEPHEN HALIBURTON MAKES IT!
Score: 47-83

[10:02] Team_047 possession (Score: 47-83)
Blake Jokic attempts a 3Pt. Contested by Vince Hyland (5.1 feet, MAN). Blake Jokic misses. Rebound secured by Tyrese Doncic.

[09:48] Team_058 possession (Score: 47-83)
Kyle Westbrook makes the Dunk and draws the foul on Josh Harris! And-1! Kyle Westbrook to the line for 1. [Team fouls: 2] (Josh Harris: 1 personal fouls)   FT 1/1: GOOD Kyle Westbrook makes 1/1 from the line.
Score: 47-86

[09:35] Team_047 possession (Score: 47-86)
Austin Giddey attempts a Layup. Contested by Stephen Haliburton (5.1 feet, ZONE). Austin Giddey misses. Offensive rebound by Myles LaVine! Myles LaVine kicks it out.

[09:25] Team_047 possession (Score: 47-86)
Derrick Irving attempts a Layup. Contested by Kyle Westbrook (5.1 feet, MAN). Derrick Irving misses. Rebound secured by Vince Hyland.

[09:11] Team_058 possession (Score: 47-86)
FOUL! Reach-in foul on Josh Harris during the drive. [Team fouls: 3] No free throws, side out. (Josh Harris: 2 personal fouls)

[08:57] Team_058 possession (Score: 47-86)
Stephen Haliburton drives to the basket... Stephen Haliburton commits a violation (traveling/carry)! TURNOVER! (dead ball)

[08:57] Substitution (Team_047): Derrick Irving OUT → Donovan Iverson IN (stamina_rule2)

[08:57] Substitution (Team_047): Blake Jokic OUT → Blake Jackson IN (stamina_rule2)

[08:57] Substitution (Team_047): Josh Harris OUT → Tony Poole IN (stamina_rule2)

[08:57] Substitution (Team_047): Myles LaVine OUT → Zion Thompson IN (stamina_rule2)

[08:57] Substitution (Team_058): Kyle Westbrook OUT → Jordan Ingram IN (stamina_rule2)

[08:57] Substitution (Team_058): Vince Hyland OUT → Pascal Holiday IN (stamina_rule2)

[08:57] Substitution (Team_058): Stephen Haliburton OUT → Shai Lowry IN (stamina_rule2)

[08:57] Substitution (Team_058): Tyrese Doncic OUT → Jarrett Gilgeous-Alexander IN (stamina_rule2)

[08:38] Team_047 possession (Score: 47-86)
Donovan Iverson attempts a Layup. Contested by Jordan Ingram (3.7 feet, MAN). Donovan Iverson misses. FOUL! Loose ball foul on Shai Lowry during the rebound battle. [Team fouls: 1] No free throws, side out. (Shai Lowry: 1 personal fouls)

[08:24] Team_047 possession (Score: 47-86)
Donovan Iverson throws a bad pass out of bounds! TURNOVER! (dead ball)

[08:08] Team_058 possession (Score: 47-86)
Jordan Ingram attempts a 3Pt. Contested by Donovan Iverson (2.2 feet, MAN). Jordan Ingram misses. Rebound secured by Blake Jackson.

[07:55] Team_047 possession (Score: 47-86)
Austin Giddey attempts a 3Pt. Wide open! Draymond Williamson is 8.3 feet away. [MAN] Austin Giddey misses. FOUL! Loose ball foul on Jarrett Gilgeous-Alexander during the rebound battle. [Team fouls: 2] No free throws, side out. (Jarrett Gilgeous-Alexander: 1 personal fouls)

[07:42] Team_047 possession (Score: 47-86)
Tony Poole drives, Shai Lowry stays with him. Tony Poole attempts a Layup. Contested by Shai Lowry (2.4 feet, MAN). Tony Poole misses. Rebound secured by Pascal Holiday.

[07:31] Team_058 possession (Score: 47-86)
Draymond Williamson makes the Layup and draws the foul on Donovan Iverson! And-1! Draymond Williamson to the line for 1. [Team fouls: 4] (Donovan Iverson: 1 personal fouls)   FT 1/1: GOOD Draymond Williamson makes 1/1 from the line.
Score: 47-89

[07:19] Team_047 possession (Score: 47-89)
Blake Jackson drives to the basket... Blake Jackson loses the ball! Stripped by Shai Lowry! TURNOVER! (live ball)

[07:07] Team_058 possession (Score: 47-89)
Pascal Holiday attempts a Midrange. Wide open! Blake Jackson is 6.1 feet away. [ZONE] Pascal Holiday misses. Rebound secured by Zion Thompson.

[06:52] Team_047 possession (Score: 47-89)
Austin Giddey attempts a 3Pt. Contested by Shai Lowry (3.0 feet, ZONE). AUSTIN GIDDEY MAKES IT! Assist: Tony Poole
Score: 50-89

[06:38] Team_058 possession (Score: 50-89)
Draymond Williamson attempts a 3Pt. Contested by Donovan Iverson (3.0 feet, ZONE). Draymond Williamson misses. Rebound secured by Zion Thompson.

[06:22] Team_047 possession (Score: 50-89)
Tony Poole drives, Shai Lowry stays with him. Tony Poole attempts a Dunk. Contested by Shai Lowry (3.4 feet, MAN). Tony Poole misses. Offensive rebound by Zion Thompson! Zion Thompson kicks it out.

[06:12] Team_047 possession (Score: 50-89)
Blake Jackson attempts a 3Pt. Contested by Shai Lowry (5.7 feet, ZONE). BLAKE JACKSON MAKES IT! Assist: Donovan Iverson
Score: 53-89

[05:57] Team_058 possession (Score: 53-89)
Jarrett Gilgeous-Alexander drives and kicks out. Jordan Ingram attempts a 3Pt. Heavily contested by Donovan Iverson (1.1 feet, ZONE)! Jordan Ingram misses. FOUL! Loose ball foul on Zion Thompson during the rebound battle. [IN THE BONUS! 5 team fouls] Pascal Holiday to the line for 2 free throws. (Zion Thompson: 1 personal fouls)   FT 1/2: GOOD   FT 2/2: GOOD Pascal Holiday makes 2/2 from the line.
Score: 53-91

[05:40] Team_047 possession (Score: 53-91)
Austin Giddey attempts a Midrange. Heavily contested by Jordan Ingram (1.6 feet, ZONE)! AUSTIN GIDDEY MAKES IT! Assist: Donovan Iverson
Score: 55-91

[05:26] Team_058 possession (Score: 55-91)
FOUL! Shooting foul on Donovan Iverson. Jarrett Gilgeous-Alexander to the line for 2 free throws. [BONUS: 6 team fouls] (Donovan Iverson: 2 personal fouls)   FT 1/2: GOOD   FT 2/2: GOOD Jarrett Gilgeous-Alexander makes 2/2 from the line.
Score: 55-93

[05:11] Team_047 possession (Score: 55-93)
FOUL! Shooting foul on Pascal Holiday. Zion Thompson to the line for 2 free throws. [Team fouls: 3] (Pascal Holiday: 1 personal fouls)   FT 1/2: GOOD   FT 2/2: GOOD Zion Thompson makes 2/2 from the line.
Score: 57-93

[04:57] Team_058 possession (Score: 57-93)
Jarrett Gilgeous-Alexander attempts a 3Pt. Contested by Tony Poole (4.0 feet, ZONE). JARRETT GILGEOUS-ALEXANDER MAKES IT! Assist: Shai Lowry
Score: 57-96

[04:38] Team_047 possession (Score: 57-96)
Zion Thompson drives to the basket... Zion Thompson commits a violation (traveling/carry)! TURNOVER! (dead ball)

[04:25] Team_058 possession (Score: 57-96)
Draymond Williamson attempts a 3Pt. Wide open! Donovan Iverson is 8.0 feet away. [ZONE] DRAYMOND WILLIAMSON MAKES IT!
Score: 57-99

[04:09] Team_047 possession (Score: 57-99)
Zion Thompson drives, picks up Jarrett Gilgeous-Alexander. Help arrives from Jordan Ingram! Zion Thompson attempts a Dunk. Heavily contested by Jordan Ingram (1.6 feet, MAN)! ZION THOMPSON MAKES IT!
Score: 59-99

[03:52] Team_058 possession (Score: 59-99)
Jordan Ingram throws a bad pass out of bounds! TURNOVER! (dead ball)

[03:41] Team_047 possession (Score: 59-99)
Austin Giddey attempts a Midrange. Wide open! Draymond Williamson is 8.7 feet away. [MAN] AUSTIN GIDDEY MAKES IT! Assist: Zion Thompson
Score: 61-99

[03:26] Team_058 possession (Score: 61-99)
Jarrett Gilgeous-Alexander drives, picks up Zion Thompson. Help arrives from Donovan Iverson! Jarrett Gilgeous-Alexander attempts a Dunk. Contested by Donovan Iverson (2.6 feet, ZONE). Jarrett Gilgeous-Alexander misses. Offensive rebound by Pascal Holiday! Pascal Holiday puts it back in!
Score: 61-101

[03:13] Team_047 possession (Score: 61-101)
Tony Poole drives to the basket... Tony Poole throws a bad pass! Stolen by Shai Lowry! TURNOVER! (live ball)

[03:01] Team_058 possession (Score: 61-101)
Shai Lowry attempts a Layup. Wide open! Zion Thompson is 6.5 feet away. [ZONE] SHAI LOWRY MAKES IT! Assist: Jarrett Gilgeous-Alexander
Score: 61-103

[02:44] Team_047 possession (Score: 61-103)
Donovan Iverson attempts a 3Pt. Wide open! Draymond Williamson is 9.0 feet away. [ZONE] DONOVAN IVERSON MAKES IT! Assist: Austin Giddey
Score: 64-103

[02:28] Team_058 possession (Score: 64-103)
Pascal Holiday attempts a Midrange. Contested by Blake Jackson (4.3 feet, MAN). Pascal Holiday misses. FOUL! Loose ball foul on Blake Jackson during the rebound battle. [IN THE BONUS! 7 team fouls] Pascal Holiday to the line for 2 free throws. (Blake Jackson: 1 personal fouls)   FT 1/2: GOOD   FT 2/2: GOOD Pascal Holiday makes 2/2 from the line.
Score: 64-105

[02:13] Team_047 possession (Score: 64-105)
Donovan Iverson drives to the basket... Donovan Iverson throws a bad pass! Stolen by Shai Lowry! TURNOVER! (live ball)

[01:57] Team_058 possession (Score: 64-105)
Jarrett Gilgeous-Alexander drives and kicks out. Jordan Ingram attempts a Midrange. Contested by Donovan Iverson (3.3 feet, MAN). JORDAN INGRAM MAKES IT! Assist: Jarrett Gilgeous-Alexander
Score: 64-107

[01:45] Team_047 possession (Score: 64-107)
Tony Poole attempts a Layup. Contested by Shai Lowry (2.6 feet, MAN). TONY POOLE MAKES IT! Assist: Austin Giddey
Score: 66-107

[01:32] Team_058 possession (Score: 66-107)
Pascal Holiday attempts a 3Pt. Wide open! Donovan Iverson is 7.5 feet away. [ZONE] Pascal Holiday misses. Rebound secured by Donovan Iverson.

[01:15] Team_047 possession (Score: 66-107)
Tony Poole throws a bad pass out of bounds! TURNOVER! (dead ball)

[01:03] Team_058 possession (Score: 66-107)
Pascal Holiday commits a violation (traveling/carry)! TURNOVER! (dead ball)

[00:50] Team_047 possession (Score: 66-107)
Blake Jackson attempts a Midrange. Contested by Pascal Holiday (3.0 feet, MAN). Blake Jackson misses. Rebound secured by Jarrett Gilgeous-Alexander.

[00:35] Team_058 possession (Score: 66-107)
Jarrett Gilgeous-Alexander attempts a Midrange. Wide open! Tony Poole is 6.7 feet away. [ZONE] Jarrett Gilgeous-Alexander misses. Rebound secured by Donovan Iverson.

[00:22] Team_047 possession (Score: 66-107)
Tony Poole drives, Shai Lowry stays with him. Tony Poole attempts a Layup. Heavily contested by Shai Lowry (1.5 feet, ZONE)! Tony Poole misses. FOUL! Loose ball foul on Shai Lowry during the rebound battle. [Team fouls: 4] No free throws, side out. (Shai Lowry: 2 personal fouls)

[00:10] Team_047 possession (Score: 66-107)
Austin Giddey drives and kicks out. Donovan Iverson attempts a Midrange. Contested by Shai Lowry (5.0 feet, ZONE). DONOVAN IVERSON MAKES IT! Assist: Austin Giddey
Score: 68-107

================================================================================
                              4TH QUARTER COMPLETE                              
================================================================================

4TH QUARTER SCORE: Team_047 24, Team_058 34

BOX SCORE:
================================================================================

Team_047
--------------------------------------------------------------------------------
Player                MIN  PTS  REB  AST  TO      FG   FG%      3P   3P%
--------------------------------------------------------------------------------
Austin Giddey          20   10    0    3   0   4/4   100.0     0/0   0.0
Donovan Iverson        16    5    3    2   0   2/2   100.0     0/0   0.0
Zion Thompson          16    4    4    1   0   2/2   100.0     0/0   0.0
Blake Jackson          16    3    2    0   0   1/2    50.0     0/0   0.0
Tony Poole             16    2    0    1   0   1/2    50.0     0/0   0.0
Josh Harris            32    0    0    1   0   0/1     0.0     0/0   0.0
Myles LaVine           32    0    1    0   0   0/1     0.0     0/0   0.0
Blake Jokic            32    0    0    0   0   0/1     0.0     0/0   0.0
Derrick Irving         32    0    0    0   0   0/1     0.0     0/0   0.0

TEAM: FG: 10/16 (62.5%), 3PT: 4/5 (80.0%), REB: 10 (5 off, 5 def), AST: 8, TO: 7
TEAM FOULS: 7 [Team_058 in BONUS]


Team_058
--------------------------------------------------------------------------------
Player                MIN  PTS  REB  AST  TO      FG   FG%      3P   3P%
--------------------------------------------------------------------------------
Stephen Haliburton     32    7    1    0   0   3/3   100.0     0/0   0.0
Pascal Holiday         16    6    2    0   0   3/5    60.0     0/0   0.0
Draymond Williamson    20    6    0    0   0   2/3    66.7     0/0   0.0
Jarrett Gilgeous-Alexander   16    5    1    2   0   2/3    66.7     0/0   0.0
Kyle Westbrook         32    3    0    1   0   1/1   100.0     0/0   0.0
Vince Hyland           32    3    2    1   0   1/1   100.0     0/0   0.0
Jordan Ingram          16    2    0    0   0   1/2    50.0     0/0   0.0
Shai Lowry             16    2    0    1   0   1/1   100.0     0/0   0.0
Tyrese Doncic          32    0    1    1   0   0/0     0.0     0/0   0.0

TEAM: FG: 14/19 (73.7%), 3PT: 4/7 (57.1%), REB: 7 (1 off, 6 def), AST: 6, TO: 3
TEAM FOULS: 4

================================================================================

================================================================================
                               FULL GAME COMPLETE                               
================================================================================

FINAL SCORE: Team_047 68, Team_058 107

SCORING BY QUARTER:
--------------------------------------------------------------------------------
Team                     Q1     Q2     Q3     Q4    FINAL
--------------------------------------------------------------------------------
Team_047                 24     11      9     24       68
Team_058                 25     12     36     34      107
--------------------------------------------------------------------------------

FULL GAME BOX SCORE:
================================================================================

Team_047
--------------------------------------------------------------------------------
Player                MIN  PTS  REB  AST  TO      FG   FG%      3P   3P%      FT STL BLK
--------------------------------------------------------------------------------
Derrick Irving         32    8    7    2   0   3/11   27.3   2/7    28.6   3/6     0   0
Blake Jokic            32    6    0    0   1   3/10   30.0   0/4     0.0   0/0     1   1
Josh Harris            32   13   10    5   2   6/13   46.2   1/2    50.0   0/0     2   1
Myles LaVine           32    6    8    5   3   3/6    50.0   0/0     0.0   0/0     0   0
De'Aaron Rose          29    2    0    2   1   1/10   10.0   0/6     0.0   0/0     1   0
Austin Giddey          20   12    0    3   3   6/6   100.0   2/2   100.0   0/0     0   0
Donovan Iverson        16    5    4    2   2   1/3    33.3   1/2    50.0   0/0     0   0
Blake Jackson          16    4    6    0   1   2/5    40.0   1/3    33.3   1/2     0   0
Tony Poole             16    5    0    1   5   2/4    50.0   0/1     0.0   1/1     0   0
Zion Thompson          16    4    7    1   0   2/3    66.7   0/1     0.0   2/2     1   1

TEAM: FG: 29/71 (40.8%), 3PT: 7/28 (25.0%), REB: 40 (11 off, 29 def), AST: 21, TO: 18


Team_058
--------------------------------------------------------------------------------
Player                MIN  PTS  REB  AST  TO      FG   FG%      3P   3P%      FT STL BLK
--------------------------------------------------------------------------------
Kyle Westbrook         32   10    0    4   3   4/6    66.7   0/1     0.0   1/1     0   1
Vince Hyland           32   18    2    2   0   5/6    83.3   2/2   100.0   3/3     0   0
Stephen Haliburton     32   23   15    0   0   9/16   56.2   3/5    60.0   2/2     2   1
Tyrese Doncic          32   13   13    6   2   7/10   70.0   0/1     0.0   1/1     1   1
Bradley Sexton         29   14   10    3   2   6/12   50.0   3/4    75.0   1/1     1   0
Draymond Williamson    20    8    0    1   0   3/5    60.0   1/3    33.3   1/1     1   0
Jordan Ingram          16    2    0    0   2   0/1     0.0   0/1     0.0   0/0     0   0
Pascal Holiday         16    8    4    2   1   2/6    33.3   0/2     0.0   4/4     0   0
Shai Lowry             16    6    2    1   1   3/5    60.0   0/1     0.0   0/0     3   1
Jarrett Gilgeous-Alexander   16    5    4    2   0   5/9    55.6   1/1   100.0   2/2     0   0

TEAM: FG: 44/76 (57.9%), 3PT: 10/21 (47.6%), REB: 52 (10 off, 42 def), AST: 21, TO: 11

================================================================================
