================================================================================
                        FULL GAME - Team_010 vs Team_036                        
================================================================================

================================================================================
                       1ST QUARTER - Team_010 vs Team_036                       
================================================================================

[12:00] Team_010 possession (Score: 0-0)
Michael Turner loses control! Ball rolls out of bounds! TURNOVER! (dead ball)

[11:45] Team_036 possession (Score: 0-0)
Terry Durant drives, Desmond Antetokounmpo stays with him. Terry Durant attempts a Layup. Wide open! Desmond Antetokounmpo is 6.4 feet away. [MAN] TERRY DURANT MAKES IT!
Score: 0-2

[11:27] Team_010 possession (Score: 0-2)
Desmond Antetokounmpo makes the Layup and draws the foul on Terry Durant! And-1! Desmond Antetokounmpo to the line for 1. [Team fouls: 1] (Terry Durant: 1 personal fouls)   FT 1/1: GOOD Desmond Antetokounmpo makes 1/1 from the line.
Score: 3-2

[11:09] Team_036 possession (Score: 3-2)
Giannis Booker drives, picks up Anthony Durant. Help arrives from Cade Morant! Giannis Booker attempts a Dunk. Contested by Cade Morant (2.3 feet, ZONE). GIANNIS BOOKER MAKES IT!
Score: 3-4

[10:55] Team_010 possession (Score: 3-4)
Anthony Durant attempts a 3Pt. Wide open! Michael Westbrook is 9.1 feet away. [ZONE] ANTHONY DURANT MAKES IT! Assist: Cade Morant
Score: 6-4

[10:36] Team_036 possession (Score: 6-4)
Kobe Simmons attempts a Midrange. Contested by Michael Turner (5.2 feet, ZONE). Kobe Simmons misses. Rebound secured by Desmond Antetokounmpo.

[10:17] Team_010 possession (Score: 6-4)
FOUL! Shooting foul on Kobe Simmons. Anthony Durant to the line for 2 free throws. [Team fouls: 2] (Kobe Simmons: 1 personal fouls)   FT 1/2: GOOD   FT 2/2: GOOD Anthony Durant makes 2/2 from the line.
Score: 8-4

[09:59] Team_036 possession (Score: 8-4)
Terry Durant attempts a Midrange. Contested by Michael Turner (3.5 feet, ZONE). Terry Durant misses. FOUL! Loose ball foul on Desmond Antetokounmpo during the rebound battle. [Team fouls: 1] No free throws, side out. (Desmond Antetokounmpo: 1 personal fouls)

[09:44] Team_036 possession (Score: 8-4)
Michael Westbrook attempts a 3Pt. Contested by Cade Morant (2.1 feet, MAN). Michael Westbrook misses. Offensive rebound by Kobe Simmons! Kobe Simmons's putback is no good. Offensive rebound by Kobe Simmons! Kobe Simmons kicks it out.

[09:29] Team_036 possession (Score: 8-4)
Anthony Poole drives, Anthony Durant stays with him. Anthony Poole attempts a Dunk. Contested by Anthony Durant (4.7 feet, ZONE). Anthony Poole misses. Rebound secured by Cade Morant.

[09:15] Team_010 possession (Score: 8-4)
FOUL! Holding foul on Giannis Booker. [Team fouls: 3] No free throws, side out. (Giannis Booker: 1 personal fouls)

[09:04] Team_010 possession (Score: 8-4)
Anthony Durant drives, picks up Kobe Simmons. Help arrives from Giannis Booker! Anthony Durant attempts a Dunk. Contested by Giannis Booker (2.2 feet, ZONE). Anthony Durant misses. Rebound secured by Terry Durant.

[08:49] Team_036 possession (Score: 8-4)
Michael Westbrook drives and kicks out. Anthony Poole attempts a 3Pt. Wide open! RJ Young is 7.2 feet away. [MAN] ANTHONY POOLE MAKES IT! Assist: Michael Westbrook
Score: 8-7

[08:36] Team_010 possession (Score: 8-7)
Michael Turner attempts a 3Pt. Contested by Giannis Booker (5.2 feet, MAN). Michael Turner misses. Offensive rebound by Anthony Durant! Anthony Durant kicks it out.

[08:24] Team_010 possession (Score: 8-7)
FOUL! Shooting foul on Kobe Simmons. Anthony Durant to the line for 2 free throws. [Team fouls: 4] (Kobe Simmons: 2 personal fouls)   FT 1/2: GOOD   FT 2/2: GOOD Anthony Durant makes 2/2 from the line.
Score: 10-7

[08:06] Team_036 possession (Score: 10-7)
Terry Durant commits a violation (traveling/carry)! TURNOVER! (dead ball)

[07:52] Team_010 possession (Score: 10-7)
FOUL! Holding foul on Kobe Simmons. [IN THE BONUS! 5 team fouls] Anthony Durant to the line for 2 free throws. (Kobe Simmons: 3 personal fouls)   FT 1/2: GOOD   FT 2/2: GOOD Anthony Durant makes 2/2 from the line.
Score: 12-7

[07:40] Team_036 possession (Score: 12-7)
Giannis Booker drives to the basket... Giannis Booker loses control! Ball rolls out of bounds! TURNOVER! (dead ball)

[07:26] Team_010 possession (Score: 12-7)
Desmond Antetokounmpo makes the Dunk and draws the foul on Giannis Booker! And-1! Desmond Antetokounmpo to the line for 1. [BONUS: 6 team fouls] (Giannis Booker: 2 personal fouls)   FT 1/1: GOOD Desmond Antetokounmpo makes 1/1 from the line.
Score: 15-7

[07:13] Team_036 possession (Score: 15-7)
Kobe Simmons attempts a Midrange. Contested by Cade Morant (3.5 feet, ZONE). Kobe Simmons misses. Rebound secured by Desmond Antetokounmpo.

[06:54] Team_010 possession (Score: 15-7)
Anthony Durant attempts a Layup. Heavily contested by Kobe Simmons (1.8 feet, MAN)! Anthony Durant misses. Rebound secured by Giannis Booker.

[06:38] Team_036 possession (Score: 15-7)
Giannis Booker commits a violation (traveling/carry)! TURNOVER! (dead ball)

[06:22] Team_010 possession (Score: 15-7)
FOUL! Offensive foul on Michael Turner! Giannis Booker drew the charge! [Team fouls: 2] (Michael Turner: 1 personal fouls) TURNOVER! (dead ball)

[06:09] Team_036 possession (Score: 15-7)
Kobe Simmons attempts a Midrange. Contested by Anthony Durant (3.5 feet, MAN). Kobe Simmons misses. Rebound secured by Desmond Antetokounmpo.

[05:51] Team_010 possession (Score: 15-7)
RJ Young drives, picks up Anthony Poole. Help arrives from Giannis Booker! RJ Young attempts a Dunk. Contested by Giannis Booker (4.9 feet, MAN). RJ YOUNG MAKES IT!
Score: 17-7

[05:38] Team_036 possession (Score: 17-7)
Giannis Booker throws a bad pass out of bounds! TURNOVER! (dead ball)

[05:21] Team_010 possession (Score: 17-7)
Michael Turner attempts a 3Pt. Wide open! Michael Westbrook is 10.0 feet away. [ZONE] Michael Turner misses. Rebound secured by Kobe Simmons.

[05:11] Team_036 possession (Score: 17-7)
Anthony Poole attempts a Midrange. Wide open! RJ Young is 6.9 feet away. [MAN] ANTHONY POOLE MAKES IT!
Score: 17-9

[04:53] Team_010 possession (Score: 17-9)
Anthony Durant drives, Kobe Simmons stays with him. Anthony Durant attempts a Dunk. Heavily contested by Kobe Simmons (1.2 feet, ZONE)! Anthony Durant misses. Offensive rebound by Cade Morant! Cade Morant kicks it out.

[04:41] Team_010 possession (Score: 17-9)
RJ Young attempts a 3Pt. Contested by Michael Westbrook (5.5 feet, ZONE). RJ YOUNG MAKES IT! Assist: Anthony Durant
Score: 20-9

[04:29] Team_036 possession (Score: 20-9)
Anthony Poole drives, RJ Young stays with him. Anthony Poole attempts a Layup. Contested by RJ Young (5.2 feet, MAN). ANTHONY POOLE MAKES IT!
Score: 20-11

[04:15] Team_010 possession (Score: 20-11)
FOUL! Shooting foul on Terry Durant. Desmond Antetokounmpo to the line for 3 free throws. [BONUS: 7 team fouls] (Terry Durant: 2 personal fouls)   FT 1/3: GOOD   FT 2/3: GOOD   FT 3/3: MISS Desmond Antetokounmpo makes 2/3 from the line. Rebound secured by Kobe Simmons.
Score: 22-11

[03:59] Team_036 possession (Score: 22-11)
Terry Durant attempts a Layup. Heavily contested by Anthony Durant (0.5 feet, ZONE)! TERRY DURANT MAKES IT!
Score: 22-13

[03:45] Team_010 possession (Score: 22-13)
Cade Morant attempts a 3Pt. Contested by Michael Westbrook (3.1 feet, MAN). CADE MORANT MAKES IT! Assist: Anthony Durant
Score: 25-13

[03:30] Team_036 possession (Score: 25-13)
Terry Durant attempts a Layup. Wide open! Desmond Antetokounmpo is 8.0 feet away. [MAN] Terry Durant misses. Rebound secured by Cade Morant.

[03:14] Team_010 possession (Score: 25-13)
Michael Turner attempts a 3Pt. Contested by Giannis Booker (4.3 feet, MAN). MICHAEL TURNER MAKES IT! Assist: Desmond Antetokounmpo
Score: 28-13

[03:02] Team_036 possession (Score: 28-13)
Anthony Poole attempts a Midrange. Contested by Desmond Antetokounmpo (5.1 feet, ZONE). ANTHONY POOLE MAKES IT! Assist: Kobe Simmons
Score: 28-15

[02:50] Team_010 possession (Score: 28-15)
Cade Morant attempts a 3Pt. Contested by Michael Westbrook (5.8 feet, ZONE). CADE MORANT MAKES IT! Assist: Anthony Durant
Score: 31-15

[02:40] Team_036 possession (Score: 31-15)
Michael Westbrook attempts a Midrange. BLOCKED BY CADE MORANT! Ball is loose! Rebound secured by Michael Turner.

[02:26] Team_010 possession (Score: 31-15)
Michael Turner attempts a Layup. BLOCKED BY GIANNIS BOOKER! Ball is loose! Rebound secured by Kobe Simmons.

[02:13] Team_036 possession (Score: 31-15)
Anthony Poole attempts a 3Pt. Contested by RJ Young (3.0 feet, MAN). Anthony Poole misses. Rebound secured by Cade Morant.

[01:58] Team_010 possession (Score: 31-15)
Anthony Durant makes the Layup and draws the foul on Kobe Simmons! And-1! Anthony Durant to the line for 1. [BONUS: 8 team fouls] (Kobe Simmons: 4 personal fouls)   FT 1/1: GOOD Anthony Durant makes 1/1 from the line.
Score: 34-15

[01:44] Team_036 possession (Score: 34-15)
Michael Westbrook attempts a Layup. Contested by Anthony Durant (4.1 feet, ZONE). MICHAEL WESTBROOK MAKES IT! Assist: Anthony Poole
Score: 34-17

[01:27] Team_010 possession (Score: 34-17)
RJ Young drives and kicks out. Cade Morant attempts a 3Pt. Wide open! Michael Westbrook is 7.4 feet away. [ZONE] CADE MORANT MAKES IT! Assist: Michael Turner
Score: 37-17

[01:11] Team_036 possession (Score: 37-17)
FOUL! Shooting foul on Desmond Antetokounmpo. Terry Durant to the line for 2 free throws. [Team fouls: 3] (Desmond Antetokounmpo: 2 personal fouls)   FT 1/2: MISS   FT 2/2: GOOD Terry Durant makes 1/2 from the line.
Score: 37-18

[00:55] Team_010 possession (Score: 37-18)
FOUL! Shooting foul on Kobe Simmons. Cade Morant to the line for 2 free throws. [BONUS: 9 team fouls] (Kobe Simmons: 5 personal fouls)   FT 1/2: MISS   FT 2/2: MISS Cade Morant makes 0/2 from the line. Rebound secured by Kobe Simmons.

[00:44] Team_036 possession (Score: 37-18)
Giannis Booker makes the Dunk and draws the foul on Desmond Antetokounmpo! And-1! Giannis Booker to the line for 1. [Team fouls: 4] (Desmond Antetokounmpo: 3 personal fouls)   FT 1/1: GOOD Giannis Booker makes 1/1 from the line.
Score: 37-21

[00:30] Team_010 possession (Score: 37-21)
Anthony Durant attempts a Midrange. BLOCKED BY ANTHONY POOLE! Ball deflects out of bounds off Anthony Durant.

[00:18] Team_036 possession (Score: 37-21)
Kobe Simmons attempts a Dunk. BLOCKED BY DESMOND ANTETOKOUNMPO! Ball goes out off Desmond Antetokounmpo. Kobe Simmons's ball!

[00:01] Team_036 possession (Score: 37-21)
Michael Westbrook attempts a 3Pt. Contested by Cade Morant (4.4 feet, ZONE). MICHAEL WESTBROOK MAKES IT! Assist: Kobe Simmons
Score: 37-24

================================================================================
                              1ST QUARTER COMPLETE                              
================================================================================

1ST QUARTER SCORE: Team_010 37, Team_036 24

BOX SCORE:
================================================================================

Team_010
--------------------------------------------------------------------------------
Player                MIN  PTS  REB  AST  TO      FG   FG%      3P   3P%
--------------------------------------------------------------------------------
Anthony Durant         12   12    1    3   0   5/8    62.5     0/0   0.0
Cade Morant            12    9    4    1   0   3/4    75.0     0/0   0.0
Desmond Antetokounmpo   12    6    3    1   0   2/3    66.7     0/0   0.0
RJ Young               12    5    0    0   0   2/2   100.0     0/0   0.0
Michael Turner         12    3    1    1   0   1/3    33.3     0/0   0.0

TEAM: FG: 13/20 (65.0%), 3PT: 5/7 (71.4%), REB: 9 (2 off, 7 def), AST: 6, TO: 2
TEAM FOULS: 4


Team_036
--------------------------------------------------------------------------------
Player                MIN  PTS  REB  AST  TO      FG   FG%      3P   3P%
--------------------------------------------------------------------------------
Anthony Poole          12    9    0    1   0   4/6    66.7     0/0   0.0
Terry Durant           12    5    1    0   0   3/4    75.0     0/0   0.0
Giannis Booker         12    5    1    0   0   2/2   100.0     0/0   0.0
Michael Westbrook      12    5    0    1   0   2/3    66.7     0/0   0.0
Kobe Simmons           12    0    6    2   0   0/3     0.0     0/0   0.0

TEAM: FG: 11/18 (61.1%), 3PT: 1/2 (50.0%), REB: 8 (2 off, 6 def), AST: 4, TO: 4
TEAM FOULS: 9 [Team_010 in BONUS]

================================================================================

================================================================================
                       2ND QUARTER - Team_010 vs Team_036                       
================================================================================

[12:00] Team_010 possession (Score: 37-24)
Anthony Durant attempts a Layup. BLOCKED BY KOBE SIMMONS! Ball is loose! Offensive rebound by Cade Morant! Cade Morant kicks it out.

[11:45] Team_010 possession (Score: 37-24)
RJ Young drives, picks up Anthony Poole. Help arrives from Giannis Booker! RJ Young attempts a Layup. Contested by Giannis Booker (3.0 feet, MAN). RJ YOUNG MAKES IT!
Score: 39-24

[11:33] Team_036 possession (Score: 39-24)
Anthony Poole attempts a Midrange. Wide open! RJ Young is 6.1 feet away. [ZONE] Anthony Poole misses. Rebound secured by Anthony Durant.

[11:20] Team_010 possession (Score: 39-24)
Michael Turner drives to the basket... Michael Turner throws a bad pass out of bounds! TURNOVER! (dead ball)

[11:20] Substitution (Team_010): Cade Morant OUT → Draymond Leonard IN (stamina_rule2)

[11:20] Substitution (Team_010): Michael Turner OUT → Blake Harden IN (stamina_rule2)

[11:20] Substitution (Team_010): RJ Young OUT → Ben Gilgeous-Alexander IN (stamina_rule2)

[11:20] Substitution (Team_010): Desmond Antetokounmpo OUT → Vince Ingram IN (stamina_rule2)

[11:20] Substitution (Team_010): Anthony Durant OUT → Paolo Wade IN (stamina_rule2)

[11:20] Substitution (Team_036): Michael Westbrook OUT → Dirk Anunoby IN (stamina_rule2)

[11:20] Substitution (Team_036): Giannis Booker OUT → Tobias Fox IN (stamina_rule2)

[11:20] Substitution (Team_036): Anthony Poole OUT → Pascal Antetokounmpo IN (stamina_rule2)

[11:20] Substitution (Team_036): Terry Durant OUT → Devin Simmons IN (stamina_rule2)

[11:20] Substitution (Team_036): Kobe Simmons OUT → Bradley Murray IN (stamina_rule2)

[11:01] Team_036 possession (Score: 39-24)
FOUL! Reach-in foul on Paolo Wade during the drive. [Team fouls: 1] No free throws, side out. (Paolo Wade: 1 personal fouls)

[10:44] Team_036 possession (Score: 39-24)
Devin Simmons attempts a Layup. Wide open! Paolo Wade is 6.2 feet away. [ZONE] Devin Simmons misses. Rebound secured by Paolo Wade.

[10:28] Team_010 possession (Score: 39-24)
Draymond Leonard drives to the basket... Draymond Leonard loses control! Ball rolls out of bounds! TURNOVER! (dead ball)

[10:18] Team_036 possession (Score: 39-24)
Devin Simmons attempts a Midrange. Wide open! Vince Ingram is 7.6 feet away. [MAN] Devin Simmons misses. Offensive rebound by Bradley Murray! Bradley Murray kicks it out.

[10:03] Team_036 possession (Score: 39-24)
Dirk Anunoby drives, Draymond Leonard stays with him. Dirk Anunoby attempts a Layup. Contested by Draymond Leonard (3.0 feet, MAN). DIRK ANUNOBY MAKES IT!
Score: 39-26

[09:47] Team_010 possession (Score: 39-26)
Vince Ingram attempts a Midrange. Wide open! Tobias Fox is 7.6 feet away. [ZONE] Vince Ingram misses. Rebound secured by Devin Simmons.

[09:36] Team_036 possession (Score: 39-26)
Bradley Murray makes the Layup and draws the foul on Paolo Wade! And-1! Bradley Murray to the line for 1. [Team fouls: 2] (Paolo Wade: 2 personal fouls)   FT 1/1: MISS Bradley Murray makes 0/1 from the line. Rebound secured by Paolo Wade.
Score: 39-28

[09:23] Team_010 possession (Score: 39-28)
Draymond Leonard drives, picks up Dirk Anunoby. Help arrives from Pascal Antetokounmpo! Draymond Leonard attempts a Dunk. Heavily contested by Pascal Antetokounmpo (1.6 feet, MAN)! DRAYMOND LEONARD MAKES IT!
Score: 41-28

[09:12] Team_036 possession (Score: 41-28)
FOUL! Holding foul on Blake Harden. [Team fouls: 3] No free throws, side out. (Blake Harden: 1 personal fouls)

[08:56] Team_036 possession (Score: 41-28)
Pascal Antetokounmpo attempts a 3Pt. Wide open! Draymond Leonard is 7.5 feet away. [ZONE] PASCAL ANTETOKOUNMPO MAKES IT! Assist: Tobias Fox
Score: 41-31

[08:43] Team_010 possession (Score: 41-31)
Draymond Leonard attempts a 3Pt. Contested by Tobias Fox (3.6 feet, ZONE). Draymond Leonard misses. Rebound secured by Bradley Murray.

[08:27] Team_036 possession (Score: 41-31)
Pascal Antetokounmpo attempts a 3Pt. Wide open! Ben Gilgeous-Alexander is 7.5 feet away. [MAN] PASCAL ANTETOKOUNMPO MAKES IT!
Score: 41-34

[08:12] Team_010 possession (Score: 41-34)
FOUL! Holding foul on Devin Simmons. [Team fouls: 1] No free throws, side out. (Devin Simmons: 1 personal fouls)

[08:00] Team_010 possession (Score: 41-34)
Blake Harden attempts a Midrange. Wide open! Tobias Fox is 6.3 feet away. [MAN] BLAKE HARDEN MAKES IT! Assist: Vince Ingram
Score: 43-34

[07:41] Team_036 possession (Score: 43-34)
FOUL! Reach-in foul on Paolo Wade during the drive. [Team fouls: 4] No free throws, side out. (Paolo Wade: 3 personal fouls)

[07:26] Team_036 possession (Score: 43-34)
Tobias Fox attempts a 3Pt. Contested by Blake Harden (4.4 feet, MAN). TOBIAS FOX MAKES IT! Assist: Pascal Antetokounmpo
Score: 43-37

[07:15] Team_010 possession (Score: 43-37)
Paolo Wade drives, picks up Bradley Murray. Help arrives from Dirk Anunoby! Paolo Wade attempts a Dunk. Heavily contested by Dirk Anunoby (1.7 feet, MAN)! PAOLO WADE MAKES IT! Assist: Draymond Leonard
Score: 45-37

[07:02] Team_036 possession (Score: 45-37)
Devin Simmons attempts a 3Pt. Contested by Draymond Leonard (2.9 feet, ZONE). DEVIN SIMMONS MAKES IT! Assist: Dirk Anunoby
Score: 45-40

[06:44] Team_010 possession (Score: 45-40)
Blake Harden attempts a 3Pt. Wide open! Tobias Fox is 6.2 feet away. [ZONE] Blake Harden misses. Offensive rebound by Blake Harden! Blake Harden kicks it out.

[06:30] Team_010 possession (Score: 45-40)
Ben Gilgeous-Alexander attempts a 3Pt. Contested by Tobias Fox (4.5 feet, ZONE). Ben Gilgeous-Alexander misses. Rebound secured by Devin Simmons.

[06:15] Team_036 possession (Score: 45-40)
FOUL! Offensive foul on Dirk Anunoby! Draymond Leonard drew the charge! [Team fouls: 2] (Dirk Anunoby: 1 personal fouls) TURNOVER! (dead ball)

[06:03] Team_010 possession (Score: 45-40)
Blake Harden drives to the basket... FOUL! Offensive foul on Blake Harden! Bradley Murray drew the charge! [Team fouls: 5] (Blake Harden: 2 personal fouls) TURNOVER! (dead ball)

[05:52] Team_036 possession (Score: 45-40)
Dirk Anunoby attempts a Layup. BLOCKED BY PAOLO WADE! Ball goes out off Paolo Wade. Dirk Anunoby's ball!

[05:36] Team_036 possession (Score: 45-40)
Pascal Antetokounmpo makes the Dunk and draws the foul on Blake Harden! And-1! Pascal Antetokounmpo to the line for 1. [BONUS: 6 team fouls] (Blake Harden: 3 personal fouls)   FT 1/1: MISS Pascal Antetokounmpo makes 0/1 from the line. Rebound secured by Blake Harden.
Score: 45-42

[05:26] Team_010 possession (Score: 45-42)
Draymond Leonard drives and kicks out. Paolo Wade attempts a 3Pt. Contested by Devin Simmons (4.3 feet, ZONE). PAOLO WADE MAKES IT! Assist: Ben Gilgeous-Alexander
Score: 48-42

[05:08] Team_036 possession (Score: 48-42)
Dirk Anunoby attempts a Midrange. Wide open! Ben Gilgeous-Alexander is 8.7 feet away. [ZONE] Dirk Anunoby misses. Offensive rebound by Bradley Murray! Bradley Murray kicks it out.

[04:53] Team_036 possession (Score: 48-42)
Devin Simmons attempts a Layup. BLOCKED BY VINCE INGRAM! Ball is loose! Rebound secured by Paolo Wade.

[04:43] Team_010 possession (Score: 48-42)
Draymond Leonard attempts a Layup. Wide open! Devin Simmons is 6.9 feet away. [ZONE] DRAYMOND LEONARD MAKES IT! Assist: Blake Harden
Score: 50-42

[04:29] Team_036 possession (Score: 50-42)
Pascal Antetokounmpo attempts a 3Pt. Contested by Draymond Leonard (5.4 feet, ZONE). Pascal Antetokounmpo misses. FOUL! Loose ball foul on Blake Harden during the rebound battle. [IN THE BONUS! 7 team fouls] Bradley Murray to the line for 2 free throws. (Blake Harden: 4 personal fouls)   FT 1/2: GOOD   FT 2/2: GOOD Bradley Murray makes 2/2 from the line.
Score: 50-44

[04:18] Team_010 possession (Score: 50-44)
Paolo Wade drives and kicks out. Blake Harden attempts a 3Pt. Wide open! Tobias Fox is 6.7 feet away. [ZONE] Blake Harden misses. Rebound secured by Devin Simmons.

[04:05] Team_036 possession (Score: 50-44)
FOUL! Holding foul on Draymond Leonard. [IN THE BONUS! 8 team fouls] Dirk Anunoby to the line for 2 free throws. (Draymond Leonard: 1 personal fouls)   FT 1/2: GOOD   FT 2/2: GOOD Dirk Anunoby makes 2/2 from the line.
Score: 50-46

[03:49] Team_010 possession (Score: 50-46)
FOUL! Holding foul on Devin Simmons. [Team fouls: 3] No free throws, side out. (Devin Simmons: 2 personal fouls)

[03:33] Team_010 possession (Score: 50-46)
Ben Gilgeous-Alexander attempts a 3Pt. Contested by Pascal Antetokounmpo (5.7 feet, MAN). Ben Gilgeous-Alexander misses. Rebound secured by Pascal Antetokounmpo.

[03:19] Team_036 possession (Score: 50-46)
Tobias Fox drives, Paolo Wade stays with him. Tobias Fox attempts a Dunk. Contested by Paolo Wade (3.2 feet, ZONE). Tobias Fox misses. Rebound secured by Ben Gilgeous-Alexander.

[03:05] Team_010 possession (Score: 50-46)
Ben Gilgeous-Alexander drives and kicks out. Ben Gilgeous-Alexander attempts a 3Pt. Contested by Pascal Antetokounmpo (4.9 feet, MAN). BEN GILGEOUS-ALEXANDER MAKES IT! Assist: Blake Harden
Score: 53-46

[02:49] Team_036 possession (Score: 53-46)
Bradley Murray loses the ball! Stripped by Paolo Wade! TURNOVER! (live ball)

[02:33] Team_010 possession (Score: 53-46)
Draymond Leonard drives, Devin Simmons stays with him. Draymond Leonard attempts a Dunk. Contested by Devin Simmons (3.4 feet, ZONE). DRAYMOND LEONARD MAKES IT! Assist: Paolo Wade
Score: 55-46

[02:20] Team_036 possession (Score: 55-46)
Pascal Antetokounmpo drives, picks up Ben Gilgeous-Alexander. Help arrives from Blake Harden! Pascal Antetokounmpo attempts a Dunk. Contested by Blake Harden (2.3 feet, MAN). PASCAL ANTETOKOUNMPO MAKES IT! Assist: Devin Simmons
Score: 55-48

[02:07] Team_010 possession (Score: 55-48)
Ben Gilgeous-Alexander attempts a 3Pt. Wide open! Tobias Fox is 8.7 feet away. [ZONE] BEN GILGEOUS-ALEXANDER MAKES IT! Assist: Draymond Leonard
Score: 58-48

[01:55] Team_036 possession (Score: 58-48)
Devin Simmons drives and kicks out. Pascal Antetokounmpo attempts a 3Pt. Heavily contested by Ben Gilgeous-Alexander (1.8 feet, MAN)! Pascal Antetokounmpo misses. Offensive rebound by Bradley Murray! Bradley Murray kicks it out.

[01:40] Team_036 possession (Score: 58-48)
Devin Simmons attempts a Layup. Contested by Paolo Wade (5.0 feet, ZONE). DEVIN SIMMONS MAKES IT!
Score: 58-50

[01:24] Team_010 possession (Score: 58-50)
Draymond Leonard drives, Bradley Murray stays with him. Draymond Leonard attempts a Layup. Contested by Bradley Murray (2.3 feet, ZONE). Draymond Leonard misses. Rebound secured by Devin Simmons.

[01:14] Team_036 possession (Score: 58-50)
Tobias Fox attempts a Midrange. Wide open! Blake Harden is 6.5 feet away. [MAN] Tobias Fox misses. Rebound secured by Blake Harden.

[00:58] Team_010 possession (Score: 58-50)
Blake Harden attempts a Layup. Contested by Tobias Fox (3.8 feet, MAN). BLAKE HARDEN MAKES IT!
Score: 60-50

[00:41] Team_036 possession (Score: 60-50)
Devin Simmons drives to the basket... Devin Simmons loses control! Ball rolls out of bounds! TURNOVER! (dead ball)

[00:28] Team_010 possession (Score: 60-50)
Vince Ingram drives to the basket... FOUL! Offensive foul on Vince Ingram! Devin Simmons drew the charge! [Team fouls: 9] (Vince Ingram: 1 personal fouls) TURNOVER! (dead ball)

[00:09] Team_036 possession (Score: 60-50)
Pascal Antetokounmpo attempts a Layup. Contested by Paolo Wade (3.0 feet, ZONE). PASCAL ANTETOKOUNMPO MAKES IT!
Score: 60-52

================================================================================
                              2ND QUARTER COMPLETE                              
================================================================================

2ND QUARTER SCORE: Team_010 23, Team_036 28

BOX SCORE:
================================================================================

Team_010
--------------------------------------------------------------------------------
Player                MIN  PTS  REB  AST  TO      FG   FG%      3P   3P%
--------------------------------------------------------------------------------
Draymond Leonard       11    6    0    2   0   3/5    60.0     0/0   0.0
Ben Gilgeous-Alexander   11    6    1    1   0   2/4    50.0     0/0   0.0
Paolo Wade             11    5    3    1   0   2/3    66.7     0/0   0.0
Blake Harden           11    4    3    2   0   2/2   100.0     0/0   0.0
RJ Young               13    2    0    0   0   1/1   100.0     0/0   0.0
Cade Morant            13    0    1    0   0   0/0     0.0     0/0   0.0
Anthony Durant         13    0    1    0   0   0/0     0.0     0/0   0.0
Vince Ingram           11    0    0    1   0   0/1     0.0     0/0   0.0

TEAM: FG: 10/16 (62.5%), 3PT: 1/4 (25.0%), REB: 9 (2 off, 7 def), AST: 7, TO: 4
TEAM FOULS: 9 [Team_036 in BONUS]


Team_036
--------------------------------------------------------------------------------
Player                MIN  PTS  REB  AST  TO      FG   FG%      3P   3P%
--------------------------------------------------------------------------------
Pascal Antetokounmpo   11   10    1    1   0   4/5    80.0     0/0   0.0
Devin Simmons          11    5    4    1   0   2/4    50.0     0/0   0.0
Dirk Anunoby           11    4    0    1   0   2/2   100.0     0/0   0.0
Tobias Fox             11    3    0    1   0   1/3    33.3     0/0   0.0
Bradley Murray         11    2    4    0   0   1/2    50.0     0/0   0.0
Anthony Poole          13    0    0    0   0   0/1     0.0     0/0   0.0

TEAM: FG: 10/17 (58.8%), 3PT: 5/5 (100.0%), REB: 9 (3 off, 6 def), AST: 4, TO: 3
TEAM FOULS: 3

================================================================================

================================================================================
                       3RD QUARTER - Team_010 vs Team_036                       
================================================================================

[12:00] Team_010 possession (Score: 60-52)
Michael Turner attempts a Midrange. Contested by Kobe Simmons (2.9 feet, ZONE). Michael Turner misses. Rebound secured by Kobe Simmons.

[11:46] Team_036 possession (Score: 60-52)
Kobe Simmons drives to the basket... FOUL! Offensive foul on Kobe Simmons! Anthony Durant drew the charge! [Team fouls: 1] (Kobe Simmons: 1 personal fouls) TURNOVER! (dead ball)

[11:32] Team_010 possession (Score: 60-52)
Anthony Durant drives and kicks out. Michael Turner attempts a 3Pt. Contested by Terry Durant (3.2 feet, ZONE). Michael Turner misses. Rebound secured by Terry Durant.

[11:15] Team_036 possession (Score: 60-52)
Michael Westbrook attempts a 3Pt. Heavily contested by Cade Morant (1.8 feet, MAN)! Michael Westbrook misses. Rebound secured by Anthony Durant.

[10:58] Team_010 possession (Score: 60-52)
Cade Morant drives and kicks out. Desmond Antetokounmpo attempts a 3Pt. Contested by Michael Westbrook (3.4 feet, ZONE). Desmond Antetokounmpo misses. Rebound secured by Terry Durant.

[10:40] Team_036 possession (Score: 60-52)
Kobe Simmons drives and kicks out. Terry Durant attempts a 3Pt. Contested by Cade Morant (2.8 feet, ZONE). TERRY DURANT MAKES IT! Assist: Anthony Poole
Score: 60-55

[10:25] Team_010 possession (Score: 60-55)
Cade Morant makes the Dunk and draws the foul on Giannis Booker! And-1! Cade Morant to the line for 1. [Team fouls: 2] (Giannis Booker: 1 personal fouls)   FT 1/1: GOOD Cade Morant makes 1/1 from the line.
Score: 63-55

[10:10] Team_036 possession (Score: 63-55)
Giannis Booker attempts a Layup. Contested by Michael Turner (3.2 feet, MAN). GIANNIS BOOKER MAKES IT! Assist: Kobe Simmons
Score: 63-57

[09:52] Team_010 possession (Score: 63-57)
Anthony Durant drives, picks up Kobe Simmons. Help arrives from Giannis Booker! Anthony Durant attempts a Dunk. Contested by Giannis Booker (3.9 feet, MAN). Anthony Durant misses. Rebound secured by Kobe Simmons.

[09:37] Team_036 possession (Score: 63-57)
FOUL! Holding foul on RJ Young. [Team fouls: 1] No free throws, side out. (RJ Young: 1 personal fouls)

[09:19] Team_036 possession (Score: 63-57)
Michael Westbrook attempts a Midrange. Heavily contested by Cade Morant (1.6 feet, MAN)! Michael Westbrook misses. Rebound secured by Anthony Durant.

[09:03] Team_010 possession (Score: 63-57)
RJ Young attempts a 3Pt. Contested by Michael Westbrook (4.4 feet, ZONE). RJ YOUNG MAKES IT! Assist: Anthony Durant
Score: 66-57

[08:46] Team_036 possession (Score: 66-57)
Kobe Simmons drives to the basket... Kobe Simmons loses control! Ball rolls out of bounds! TURNOVER! (dead ball)

[08:31] Team_010 possession (Score: 66-57)
Michael Turner makes the Layup and draws the foul on Giannis Booker! And-1! Michael Turner to the line for 1. [Team fouls: 3] (Giannis Booker: 2 personal fouls)   FT 1/1: GOOD Michael Turner makes 1/1 from the line.
Score: 69-57

[08:14] Team_036 possession (Score: 69-57)
Terry Durant attempts a 3Pt. Contested by Cade Morant (3.2 feet, ZONE). Terry Durant misses. Rebound secured by Desmond Antetokounmpo.

[07:59] Team_010 possession (Score: 69-57)
FOUL! Holding foul on Giannis Booker. [Team fouls: 4] No free throws, side out. (Giannis Booker: 3 personal fouls)

[07:46] Team_010 possession (Score: 69-57)
Anthony Durant attempts a Layup. Contested by Kobe Simmons (2.1 feet, ZONE). ANTHONY DURANT MAKES IT! Assist: Desmond Antetokounmpo
Score: 71-57

[07:29] Team_036 possession (Score: 71-57)
Michael Westbrook attempts a Layup. Heavily contested by Cade Morant (1.2 feet, MAN)! MICHAEL WESTBROOK MAKES IT! Assist: Terry Durant
Score: 71-59

[07:13] Team_010 possession (Score: 71-59)
Desmond Antetokounmpo makes the Layup and draws the foul on Terry Durant! And-1! Desmond Antetokounmpo to the line for 1. [BONUS: 5 team fouls] (Terry Durant: 1 personal fouls)   FT 1/1: MISS Desmond Antetokounmpo makes 0/1 from the line. Rebound secured by Giannis Booker.
Score: 73-59

[07:00] Team_036 possession (Score: 73-59)
Kobe Simmons drives and kicks out. Terry Durant attempts a 3Pt. Contested by Desmond Antetokounmpo (3.9 feet, MAN). Terry Durant misses. Rebound secured by Anthony Durant.

[06:44] Team_010 possession (Score: 73-59)
Desmond Antetokounmpo attempts a 3Pt. Contested by Michael Westbrook (4.3 feet, ZONE). DESMOND ANTETOKOUNMPO MAKES IT! Assist: RJ Young
Score: 76-59

[06:29] Team_036 possession (Score: 76-59)
Anthony Poole attempts a 3Pt. Wide open! Cade Morant is 6.6 feet away. [ZONE] Anthony Poole misses. Offensive rebound by Kobe Simmons! Kobe Simmons puts it back in!
Score: 76-61

[06:20] Team_010 possession (Score: 76-61)
Michael Turner attempts a 3Pt. Contested by Giannis Booker (5.4 feet, MAN). MICHAEL TURNER MAKES IT! Assist: Cade Morant
Score: 79-61

[06:06] Team_036 possession (Score: 79-61)
Michael Westbrook attempts a Layup. BLOCKED BY MICHAEL TURNER! Ball is loose! Rebound secured by Anthony Durant.

[05:54] Team_010 possession (Score: 79-61)
RJ Young attempts a 3Pt. Contested by Michael Westbrook (4.2 feet, ZONE). RJ YOUNG MAKES IT! Assist: Desmond Antetokounmpo
Score: 82-61

[05:41] Team_036 possession (Score: 82-61)
Kobe Simmons attempts a 3Pt. Heavily contested by Cade Morant (2.0 feet, ZONE)! KOBE SIMMONS MAKES IT! Assist: Michael Westbrook
Score: 82-64

[05:27] Team_010 possession (Score: 82-64)
Anthony Durant drives to the basket... Anthony Durant throws a bad pass! Stolen by Kobe Simmons! TURNOVER! (live ball)

[05:14] Team_036 possession (Score: 82-64)
Kobe Simmons attempts a 3Pt. Heavily contested by Anthony Durant (1.6 feet, MAN)! KOBE SIMMONS MAKES IT! Assist: Terry Durant
Score: 82-67

[04:58] Team_010 possession (Score: 82-67)
RJ Young attempts a 3Pt. Contested by Anthony Poole (3.7 feet, MAN). RJ Young misses. Rebound secured by Terry Durant.

[04:45] Team_036 possession (Score: 82-67)
Giannis Booker attempts a 3Pt. Wide open! Cade Morant is 7.8 feet away. [ZONE] Giannis Booker misses. Offensive rebound by Kobe Simmons! Kobe Simmons puts it back in!
Score: 82-69

[04:30] Team_010 possession (Score: 82-69)
FOUL! Reach-in foul on Michael Westbrook during the drive. [IN THE BONUS! 6 team fouls] Cade Morant to the line for 2 free throws. (Michael Westbrook: 1 personal fouls)   FT 1/2: MISS   FT 2/2: GOOD Cade Morant makes 1/2 from the line.
Score: 83-69

[04:13] Team_036 possession (Score: 83-69)
Anthony Poole drives, RJ Young stays with him. Anthony Poole attempts a Dunk. Contested by RJ Young (5.3 feet, MAN). ANTHONY POOLE MAKES IT! Assist: Terry Durant
Score: 83-71

[03:57] Team_010 possession (Score: 83-71)
Desmond Antetokounmpo makes the 3Pt and draws the foul on Michael Westbrook! And-1! Desmond Antetokounmpo to the line for 1. [BONUS: 7 team fouls] (Michael Westbrook: 2 personal fouls)   FT 1/1: GOOD Desmond Antetokounmpo makes 1/1 from the line.
Score: 87-71

[03:41] Team_036 possession (Score: 87-71)
Terry Durant throws a bad pass out of bounds! TURNOVER! (dead ball)

[03:31] Team_010 possession (Score: 87-71)
Cade Morant attempts a 3Pt. Contested by Michael Westbrook (5.7 feet, MAN). CADE MORANT MAKES IT! Assist: Anthony Durant
Score: 90-71

[03:14] Team_036 possession (Score: 90-71)
Michael Westbrook attempts a Layup. Contested by Anthony Durant (2.7 feet, ZONE). MICHAEL WESTBROOK MAKES IT! Assist: Terry Durant
Score: 90-73

[03:02] Team_010 possession (Score: 90-73)
Desmond Antetokounmpo attempts a Midrange. Wide open! Giannis Booker is 7.3 feet away. [ZONE] Desmond Antetokounmpo misses. Rebound secured by Kobe Simmons.

[02:44] Team_036 possession (Score: 90-73)
Giannis Booker attempts a Midrange. Contested by Michael Turner (2.8 feet, MAN). Giannis Booker misses. Rebound secured by Anthony Durant.

[02:34] Team_010 possession (Score: 90-73)
Michael Turner attempts a 3Pt. Wide open! Giannis Booker is 8.4 feet away. [MAN] Michael Turner misses. Rebound secured by Terry Durant.

[02:23] Team_036 possession (Score: 90-73)
Giannis Booker drives, Michael Turner stays with him. Giannis Booker attempts a Layup. Heavily contested by Michael Turner (1.8 feet, MAN)! Giannis Booker misses. Offensive rebound by Kobe Simmons! Kobe Simmons puts it back in!
Score: 90-75

[02:06] Team_010 possession (Score: 90-75)
Cade Morant makes the 3Pt and draws the foul on Michael Westbrook! And-1! Cade Morant to the line for 1. [BONUS: 8 team fouls] (Michael Westbrook: 3 personal fouls)   FT 1/1: GOOD Cade Morant makes 1/1 from the line.
Score: 94-75

[01:50] Team_036 possession (Score: 94-75)
Michael Westbrook makes the Layup and draws the foul on Cade Morant! And-1! Michael Westbrook to the line for 1. [Team fouls: 2] (Cade Morant: 1 personal fouls)   FT 1/1: GOOD Michael Westbrook makes 1/1 from the line.
Score: 94-78

[01:38] Team_010 possession (Score: 94-78)
RJ Young attempts a 3Pt. Contested by Anthony Poole (4.5 feet, MAN). RJ YOUNG MAKES IT!
Score: 97-78

[01:25] Team_036 possession (Score: 97-78)
FOUL! Reach-in foul on Anthony Durant during the drive. [Team fouls: 3] No free throws, side out. (Anthony Durant: 1 personal fouls)

[01:05] Team_036 possession (Score: 97-78)
Michael Westbrook attempts a 3Pt. Contested by Cade Morant (2.3 feet, ZONE). Michael Westbrook misses. Rebound secured by Anthony Durant.

[00:48] Team_010 possession (Score: 97-78)
Cade Morant drives and kicks out. Anthony Durant attempts a 3Pt. Contested by Kobe Simmons (4.5 feet, MAN). Anthony Durant misses. Rebound secured by Terry Durant.

[00:37] Team_036 possession (Score: 97-78)
Terry Durant attempts a 3Pt. Heavily contested by Cade Morant (1.3 feet, ZONE)! Terry Durant misses. Rebound secured by Michael Turner.

[00:22] Team_010 possession (Score: 97-78)
RJ Young attempts a 3Pt. Contested by Anthony Poole (2.7 feet, ZONE). RJ Young misses. Rebound secured by Terry Durant.

[00:03] Team_036 possession (Score: 97-78)
Terry Durant attempts a Midrange. Wide open! RJ Young is 7.2 feet away. [ZONE] Terry Durant misses. Rebound secured by Michael Turner.

================================================================================
                              3RD QUARTER COMPLETE                              
================================================================================

3RD QUARTER SCORE: Team_010 37, Team_036 26

BOX SCORE:
================================================================================

Team_010
--------------------------------------------------------------------------------
Player                MIN  PTS  REB  AST  TO      FG   FG%      3P   3P%
--------------------------------------------------------------------------------
Cade Morant            25   11    0    1   0   4/6    66.7     0/0   0.0
RJ Young               25    9    0    1   0   3/5    60.0     0/0   0.0
Desmond Antetokounmpo   25    7    1    2   0   2/4    50.0     0/0   0.0
Michael Turner         25    6    2    0   0   2/4    50.0     0/0   0.0
Anthony Durant         25    2    6    2   0   1/3    33.3     0/0   0.0

TEAM: FG: 12/22 (54.5%), 3PT: 8/11 (72.7%), REB: 9 (0 off, 9 def), AST: 6, TO: 1
TEAM FOULS: 3


Team_036
--------------------------------------------------------------------------------
Player                MIN  PTS  REB  AST  TO      FG   FG%      3P   3P%
--------------------------------------------------------------------------------
Kobe Simmons           25   12    6    1   0   5/6    83.3     0/0   0.0
Michael Westbrook      25    7    0    1   0   3/7    42.9     0/0   0.0
Terry Durant           25    3    6    4   0   1/4    25.0     0/0   0.0
Anthony Poole          25    2    0    1   0   1/1   100.0     0/0   0.0
Giannis Booker         25    2    1    0   0   1/2    50.0     0/0   0.0

TEAM: FG: 11/20 (55.0%), 3PT: 4/8 (50.0%), REB: 13 (3 off, 10 def), AST: 7, TO: 3
TEAM FOULS: 8 [Team_010 in BONUS]

================================================================================

================================================================================
                       4TH QUARTER - Team_010 vs Team_036                       
================================================================================

[12:00] Team_010 possession (Score: 97-78)
Desmond Antetokounmpo loses the ball! Stripped by Terry Durant! TURNOVER! (live ball)

[11:48] Team_036 possession (Score: 97-78)
Terry Durant drives to the basket... Terry Durant throws a bad pass! Stolen by Anthony Durant! TURNOVER! (live ball)

[11:35] Team_010 possession (Score: 97-78)
Desmond Antetokounmpo attempts a Layup. Contested by Kobe Simmons (4.2 feet, ZONE). Desmond Antetokounmpo misses. Rebound secured by Terry Durant.

[11:24] Team_036 possession (Score: 97-78)
Terry Durant makes the Dunk and draws the foul on Cade Morant! And-1! Terry Durant to the line for 1. [Team fouls: 1] (Cade Morant: 1 personal fouls)   FT 1/1: GOOD Terry Durant makes 1/1 from the line.
Score: 97-81

[11:09] Team_010 possession (Score: 97-81)
FOUL! Holding foul on Michael Westbrook. [Team fouls: 1] No free throws, side out. (Michael Westbrook: 1 personal fouls)

[10:58] Team_010 possession (Score: 97-81)
RJ Young attempts a 3Pt. Wide open! Anthony Poole is 6.7 feet away. [MAN] RJ Young misses. Offensive rebound by Anthony Durant! Anthony Durant kicks it out.

[10:48] Team_010 possession (Score: 97-81)
Desmond Antetokounmpo drives, Terry Durant stays with him. Desmond Antetokounmpo attempts a Layup. Contested by Terry Durant (3.0 feet, MAN). DESMOND ANTETOKOUNMPO MAKES IT!
Score: 99-81

[10:34] Team_036 possession (Score: 99-81)
Kobe Simmons attempts a Midrange. Contested by Michael Turner (4.5 feet, ZONE). Kobe Simmons misses. Offensive rebound by Kobe Simmons! Kobe Simmons's putback is no good. Rebound secured by Cade Morant.

[10:24] Team_010 possession (Score: 99-81)
Anthony Durant attempts a Midrange. Contested by Giannis Booker (5.1 feet, ZONE). Anthony Durant misses. Offensive rebound by Cade Morant! Cade Morant kicks it out.

[10:09] Team_010 possession (Score: 99-81)
FOUL! Reach-in foul on Kobe Simmons during the drive. [Team fouls: 2] No free throws, side out. (Kobe Simmons: 1 personal fouls)

[09:54] Team_010 possession (Score: 99-81)
Anthony Durant attempts a Midrange. Wide open! Anthony Poole is 9.1 feet away. [ZONE] Anthony Durant misses. Offensive rebound by Cade Morant! Cade Morant kicks it out.

[09:39] Team_010 possession (Score: 99-81)
Desmond Antetokounmpo drives, Terry Durant stays with him. Desmond Antetokounmpo attempts a Layup. Contested by Terry Durant (2.6 feet, MAN). DESMOND ANTETOKOUNMPO MAKES IT! Assist: RJ Young
Score: 101-81

[09:22] Team_036 possession (Score: 101-81)
Giannis Booker attempts a 3Pt. Wide open! Cade Morant is 8.2 feet away. [ZONE] GIANNIS BOOKER MAKES IT! Assist: Terry Durant
Score: 101-84

[09:07] Team_010 possession (Score: 101-84)
Desmond Antetokounmpo attempts a 3Pt. Contested by Michael Westbrook (5.1 feet, ZONE). Desmond Antetokounmpo misses. Rebound secured by Kobe Simmons.

[08:50] Team_036 possession (Score: 101-84)
FOUL! Holding foul on Michael Turner. [Team fouls: 2] No free throws, side out. (Michael Turner: 1 personal fouls)

[08:31] Team_036 possession (Score: 101-84)
Anthony Poole attempts a 3Pt. Wide open! RJ Young is 6.1 feet away. [MAN] Anthony Poole misses. Rebound secured by Cade Morant.

[08:19] Team_010 possession (Score: 101-84)
RJ Young attempts a 3Pt. Contested by Terry Durant (2.8 feet, ZONE). RJ YOUNG MAKES IT! Assist: Anthony Durant
Score: 104-84

[08:03] Team_036 possession (Score: 104-84)
Anthony Poole drives and kicks out. Michael Westbrook attempts a 3Pt. Wide open! Cade Morant is 8.1 feet away. [MAN] Michael Westbrook misses. Rebound secured by Anthony Durant.

[07:51] Team_010 possession (Score: 104-84)
FOUL! Reach-in foul on Kobe Simmons during the drive. [Team fouls: 3] No free throws, side out. (Kobe Simmons: 2 personal fouls)

[07:37] Team_010 possession (Score: 104-84)
Michael Turner attempts a 3Pt. Contested by Michael Westbrook (5.8 feet, ZONE). Michael Turner misses. Rebound secured by Giannis Booker.

[07:21] Team_036 possession (Score: 104-84)
FOUL! Reach-in foul on Michael Turner during the drive. [Team fouls: 3] No free throws, side out. (Michael Turner: 2 personal fouls)

[07:08] Team_036 possession (Score: 104-84)
Michael Westbrook attempts a Layup. BLOCKED BY MICHAEL TURNER! Ball is loose! Offensive rebound by Kobe Simmons! Kobe Simmons kicks it out.

[06:54] Team_036 possession (Score: 104-84)
Anthony Poole attempts a Midrange. Wide open! Desmond Antetokounmpo is 6.4 feet away. [ZONE] Anthony Poole misses. Rebound secured by Anthony Durant.

[06:40] Team_010 possession (Score: 104-84)
FOUL! Reach-in foul on Kobe Simmons during the drive. [Team fouls: 4] No free throws, side out. (Kobe Simmons: 3 personal fouls)

[06:29] Team_010 possession (Score: 104-84)
Anthony Durant drives, picks up Kobe Simmons. Help arrives from Giannis Booker! Anthony Durant attempts a Layup. Contested by Giannis Booker (5.5 feet, ZONE). Anthony Durant misses. Rebound secured by Terry Durant.

[06:12] Team_036 possession (Score: 104-84)
Giannis Booker attempts a 3Pt. Wide open! Michael Turner is 6.4 feet away. [MAN] Giannis Booker misses. Rebound secured by Cade Morant.

[05:59] Team_010 possession (Score: 104-84)
RJ Young throws a bad pass out of bounds! TURNOVER! (dead ball)

[05:59] Substitution (Team_010): Cade Morant OUT → Draymond Leonard IN (stamina_rule2)

[05:59] Substitution (Team_010): Michael Turner OUT → Blake Harden IN (stamina_rule2)

[05:59] Substitution (Team_010): RJ Young OUT → Ben Gilgeous-Alexander IN (stamina_rule2)

[05:59] Substitution (Team_010): Desmond Antetokounmpo OUT → Vince Ingram IN (stamina_rule2)

[05:59] Substitution (Team_010): Anthony Durant OUT → Paolo Wade IN (stamina_rule2)

[05:59] Substitution (Team_036): Michael Westbrook OUT → Dirk Anunoby IN (stamina_rule2)

[05:59] Substitution (Team_036): Giannis Booker OUT → Tobias Fox IN (stamina_rule2)

[05:59] Substitution (Team_036): Anthony Poole OUT → Pascal Antetokounmpo IN (stamina_rule2)

[05:59] Substitution (Team_036): Terry Durant OUT → Devin Simmons IN (stamina_rule2)

[05:59] Substitution (Team_036): Kobe Simmons OUT → Bradley Murray IN (stamina_rule2)

[05:43] Team_036 possession (Score: 104-84)
Pascal Antetokounmpo attempts a Layup. Contested by Ben Gilgeous-Alexander (4.6 feet, MAN). Pascal Antetokounmpo misses. Rebound secured by Blake Harden.

[05:30] Team_010 possession (Score: 104-84)
Paolo Wade drives, picks up Bradley Murray. Help arrives from Dirk Anunoby! Paolo Wade attempts a Layup. Contested by Dirk Anunoby (3.5 feet, MAN). Paolo Wade misses. Rebound secured by Bradley Murray.

[05:15] Team_036 possession (Score: 104-84)
Tobias Fox attempts a 3Pt. Wide open! Blake Harden is 6.5 feet away. [MAN] Tobias Fox misses. Rebound secured by Paolo Wade.

[04:57] Team_010 possession (Score: 104-84)
Ben Gilgeous-Alexander attempts a Midrange. Contested by Pascal Antetokounmpo (4.7 feet, MAN). Ben Gilgeous-Alexander misses. Rebound secured by Devin Simmons.

[04:43] Team_036 possession (Score: 104-84)
Dirk Anunoby attempts a 3Pt. Contested by Draymond Leonard (3.3 feet, MAN). Dirk Anunoby misses. Rebound secured by Paolo Wade.

[04:34] Team_010 possession (Score: 104-84)
Vince Ingram throws a bad pass! Stolen by Devin Simmons! TURNOVER! (live ball)

[04:20] Team_036 possession (Score: 104-84)
Tobias Fox attempts a 3Pt. Contested by Blake Harden (5.5 feet, ZONE). Tobias Fox misses. Rebound secured by Paolo Wade.

[04:04] Team_010 possession (Score: 104-84)
Paolo Wade drives to the basket... Paolo Wade loses the ball! Stripped by Devin Simmons! TURNOVER! (live ball)

[03:51] Team_036 possession (Score: 104-84)
Dirk Anunoby throws a bad pass! Stolen by Draymond Leonard! TURNOVER! (live ball)

[03:37] Team_010 possession (Score: 104-84)
Blake Harden attempts a 3Pt. Contested by Tobias Fox (4.2 feet, MAN). BLAKE HARDEN MAKES IT! Assist: Draymond Leonard
Score: 107-84

[03:26] Team_036 possession (Score: 107-84)
Tobias Fox attempts a 3Pt. Contested by Draymond Leonard (5.1 feet, ZONE). TOBIAS FOX MAKES IT! Assist: Pascal Antetokounmpo
Score: 107-87

[03:08] Team_010 possession (Score: 107-87)
Ben Gilgeous-Alexander attempts a 3Pt. Contested by Pascal Antetokounmpo (4.5 feet, MAN). Ben Gilgeous-Alexander misses. Rebound secured by Pascal Antetokounmpo.

[02:54] Team_036 possession (Score: 107-87)
Bradley Murray attempts a Midrange. Wide open! Paolo Wade is 6.7 feet away. [MAN] Bradley Murray misses. Rebound secured by Paolo Wade.

[02:42] Team_010 possession (Score: 107-87)
Vince Ingram attempts a Layup. Contested by Devin Simmons (3.9 feet, MAN). VINCE INGRAM MAKES IT! Assist: Blake Harden
Score: 109-87

[02:28] Team_036 possession (Score: 109-87)
FOUL! Holding foul on Draymond Leonard. [Team fouls: 4] No free throws, side out. (Draymond Leonard: 1 personal fouls)

[02:15] Team_036 possession (Score: 109-87)
Bradley Murray attempts a Layup. BLOCKED BY PAOLO WADE! Ball deflects out of bounds off Bradley Murray.

[02:03] Team_010 possession (Score: 109-87)
FOUL! Holding foul on Pascal Antetokounmpo. [IN THE BONUS! 5 team fouls] Ben Gilgeous-Alexander to the line for 2 free throws. (Pascal Antetokounmpo: 1 personal fouls)   FT 1/2: GOOD   FT 2/2: GOOD Ben Gilgeous-Alexander makes 2/2 from the line.
Score: 111-87

[01:51] Team_036 possession (Score: 111-87)
Bradley Murray attempts a Midrange. Contested by Paolo Wade (4.5 feet, MAN). Bradley Murray misses. FOUL! Loose ball foul on Paolo Wade during the rebound battle. [IN THE BONUS! 5 team fouls] Bradley Murray to the line for 2 free throws. (Paolo Wade: 1 personal fouls)   FT 1/2: GOOD   FT 2/2: GOOD Bradley Murray makes 2/2 from the line.
Score: 111-89

[01:36] Team_010 possession (Score: 111-89)
Blake Harden attempts a 3Pt. Contested by Tobias Fox (4.7 feet, ZONE). Blake Harden misses. Rebound secured by Bradley Murray.

[01:19] Team_036 possession (Score: 111-89)
FOUL! Holding foul on Paolo Wade. [IN THE BONUS! 6 team fouls] Bradley Murray to the line for 2 free throws. (Paolo Wade: 2 personal fouls)   FT 1/2: GOOD   FT 2/2: GOOD Bradley Murray makes 2/2 from the line.
Score: 111-91

[01:07] Team_010 possession (Score: 111-91)
Ben Gilgeous-Alexander attempts a Midrange. Contested by Tobias Fox (4.8 feet, ZONE). BEN GILGEOUS-ALEXANDER MAKES IT!
Score: 113-91

[00:50] Team_036 possession (Score: 113-91)
Devin Simmons drives and kicks out. Tobias Fox attempts a Midrange. Contested by Blake Harden (5.9 feet, MAN). Tobias Fox misses. Rebound secured by Paolo Wade.

[00:36] Team_010 possession (Score: 113-91)
FOUL! Offensive foul on Ben Gilgeous-Alexander! Pascal Antetokounmpo drew the charge! [Team fouls: 7] (Ben Gilgeous-Alexander: 1 personal fouls) TURNOVER! (dead ball)

[00:18] Team_036 possession (Score: 113-91)
Dirk Anunoby drives and kicks out. Tobias Fox attempts a Midrange. Wide open! Vince Ingram is 6.7 feet away. [ZONE] Tobias Fox misses. Rebound secured by Ben Gilgeous-Alexander.

[00:06] Team_010 possession (Score: 113-91)
Paolo Wade loses control! Ball rolls out of bounds! TURNOVER! (dead ball)

================================================================================
                              4TH QUARTER COMPLETE                              
================================================================================

4TH QUARTER SCORE: Team_010 16, Team_036 13

BOX SCORE:
================================================================================

Team_010
--------------------------------------------------------------------------------
Player                MIN  PTS  REB  AST  TO      FG   FG%      3P   3P%
--------------------------------------------------------------------------------
Desmond Antetokounmpo   32    4    0    0   0   2/4    50.0     0/0   0.0
Ben Gilgeous-Alexander   17    4    1    0   0   2/4    50.0     0/0   0.0
RJ Young               32    3    0    1   0   1/1   100.0     0/0   0.0
Blake Harden           17    3    1    1   0   1/2    50.0     0/0   0.0
Vince Ingram           17    2    0    0   0   1/1   100.0     0/0   0.0
Anthony Durant         32    0    3    1   0   0/1     0.0     0/0   0.0
Cade Morant            32    0    5    0   0   0/0     0.0     0/0   0.0
Michael Turner         32    0    0    0   0   0/1     0.0     0/0   0.0
Paolo Wade             17    0    5    0   0   0/1     0.0     0/0   0.0
Draymond Leonard       17    0    0    1   0   0/0     0.0     0/0   0.0

TEAM: FG: 7/15 (46.7%), 3PT: 2/6 (33.3%), REB: 14 (3 off, 11 def), AST: 4, TO: 6
TEAM FOULS: 7 [Team_036 in BONUS]


Team_036
--------------------------------------------------------------------------------
Player                MIN  PTS  REB  AST  TO      FG   FG%      3P   3P%
--------------------------------------------------------------------------------
Bradley Murray         17    4    2    0   0   2/4    50.0     0/0   0.0
Terry Durant           32    3    2    1   0   1/1   100.0     0/0   0.0
Giannis Booker         32    3    1    0   0   1/2    50.0     0/0   0.0
Tobias Fox             17    3    0    0   0   1/3    33.3     0/0   0.0
Kobe Simmons           32    0    2    0   0   0/1     0.0     0/0   0.0
Anthony Poole          32    0    0    0   0   0/3     0.0     0/0   0.0
Pascal Antetokounmpo   17    0    1    1   0   0/1     0.0     0/0   0.0
Devin Simmons          17    0    1    0   0   0/1     0.0     0/0   0.0
Dirk Anunoby           17    0    0    0   0   0/2     0.0     0/0   0.0

TEAM: FG: 5/18 (27.8%), 3PT: 2/7 (28.6%), REB: 10 (2 off, 8 def), AST: 2, TO: 2
TEAM FOULS: 5 [Team_010 in BONUS]

================================================================================

================================================================================
                               FULL GAME COMPLETE                               
================================================================================

FINAL SCORE: Team_010 113, Team_036 91

SCORING BY QUARTER:
--------------------------------------------------------------------------------
Team                     Q1     Q2     Q3     Q4    FINAL
--------------------------------------------------------------------------------
Team_010                 37     23     37     16      113
Team_036                 24     28     26     13       91
--------------------------------------------------------------------------------

FULL GAME BOX SCORE:
================================================================================

Team_010
--------------------------------------------------------------------------------
Player                MIN  PTS  REB  AST  TO      FG   FG%      3P   3P%      FT STL BLK
--------------------------------------------------------------------------------
Cade Morant            32   20   10    2   0   6/9    66.7   4/4   100.0   3/6     0   1
Michael Turner         32    9    3    1   3   3/8    37.5   2/5    40.0   1/1     0   2
RJ Young               32   19    0    2   2   8/10   80.0   5/7    71.4   0/0     0   0
Desmond Antetokounmpo   32   17    4    3   1   6/11   54.5   2/4    50.0   5/7     0   1
Anthony Durant         32   14   11    6   0   5/11   45.5   1/1   100.0   7/7     1   0
Draymond Leonard       17    6    0    3   1   4/6    66.7   0/1     0.0   0/0     1   0
Blake Harden           17    7    4    3   2   3/4    75.0   1/2    50.0   0/0     0   0
Ben Gilgeous-Alexander   17   10    2    1   2   3/7    42.9   1/4    25.0   2/2     0   0
Vince Ingram           17    2    0    1   1   1/2    50.0   0/0     0.0   0/0     0   1
Paolo Wade             17    5    8    1   1   1/3    33.3   0/0     0.0   0/0     1   2

TEAM: FG: 42/73 (57.5%), 3PT: 16/28 (57.1%), REB: 41 (7 off, 34 def), AST: 23, TO: 13


Team_036
--------------------------------------------------------------------------------
Player                MIN  PTS  REB  AST  TO      FG   FG%      3P   3P%      FT STL BLK
--------------------------------------------------------------------------------
Michael Westbrook      32   12    0    2   1   6/11   54.5   1/3    33.3   1/1     0   0
Giannis Booker         32   10    3    0   4   6/8    75.0   2/3    66.7   1/1     0   1
Anthony Poole          32   11    0    2   0   5/11   45.5   1/3    33.3   0/0     0   1
Terry Durant           32   11    9    5   2   4/8    50.0   0/2     0.0   2/3     1   0
Kobe Simmons           32   12   14    3   1   3/8    37.5   2/2   100.0   0/0     1   1
Dirk Anunoby           17    4    0    1   2   1/3    33.3   0/1     0.0   2/2     0   0
Tobias Fox             17    6    0    1   1   2/6    33.3   2/4    50.0   0/0     0   0
Pascal Antetokounmpo   17   10    2    2   0   5/7    71.4   3/3   100.0   0/1     0   0
Devin Simmons          17    5    5    1   0   2/5    40.0   1/1   100.0   0/0     2   0
Bradley Murray         17    6    6    0   1   1/4    25.0   0/0     0.0   6/7     0   0

TEAM: FG: 37/73 (50.7%), 3PT: 12/22 (54.5%), REB: 40 (10 off, 30 def), AST: 17, TO: 12

================================================================================
