================================================================================
                        FULL GAME - Team_061 vs Team_065                        
================================================================================

================================================================================
                       1ST QUARTER - Team_061 vs Team_065                       
================================================================================

[12:00] Team_061 possession (Score: 0-0)
Draymond Banchero attempts a Midrange. Contested by Paul Williamson (3.6 feet, ZONE). Draymond Banchero misses. Rebound secured by Manu McGrady.

[11:48] Team_065 possession (Score: 0-0)
Karl Booker throws a bad pass out of bounds! TURNOVER! (dead ball)

[11:35] Team_061 possession (Score: 0-0)
Brandon Russell attempts a 3Pt. Contested by RJ Harden (4.6 feet, ZONE). Brandon Russell misses. Offensive rebound by Draymond Banchero! Draymond Banchero's putback is no good. Rebound secured by Russell Wade.

[11:20] Team_065 possession (Score: 0-0)
Paul Williamson attempts a 3Pt. Contested by Brandon Russell (2.2 feet, ZONE). PAUL WILLIAMSON MAKES IT! Assist: Russell Wade
Score: 0-3

[11:02] Team_061 possession (Score: 0-3)
Jayson Holiday attempts a Layup. Heavily contested by Paul Williamson (1.1 feet, MAN)! Jayson Holiday misses. Rebound secured by RJ Harden.

[10:48] Team_065 possession (Score: 0-3)
Paul Williamson loses control! Ball rolls out of bounds! TURNOVER! (dead ball)

[10:32] Team_061 possession (Score: 0-3)
Michael Russell attempts a Layup. Wide open! Manu McGrady is 6.9 feet away. [MAN] MICHAEL RUSSELL MAKES IT! Assist: Bam Sexton
Score: 2-3

[10:21] Team_065 possession (Score: 2-3)
Russell Wade attempts a 3Pt. Contested by Brandon Russell (5.1 feet, ZONE). Russell Wade misses. Rebound secured by Draymond Banchero.

[10:05] Team_061 possession (Score: 2-3)
FOUL! Holding foul on Russell Wade. [Team fouls: 1] No free throws, side out. (Russell Wade: 1 personal fouls)

[09:49] Team_061 possession (Score: 2-3)
Brandon Russell drives and kicks out. Brandon Russell attempts a Midrange. Contested by RJ Harden (2.7 feet, MAN). BRANDON RUSSELL MAKES IT!
Score: 4-3

[09:36] Team_065 possession (Score: 4-3)
FOUL! Shooting foul on Bam Sexton. Manu McGrady to the line for 3 free throws. [Team fouls: 1] (Bam Sexton: 1 personal fouls)   FT 1/3: GOOD   FT 2/3: GOOD   FT 3/3: GOOD Manu McGrady makes 3/3 from the line.
Score: 4-6

[09:25] Team_061 possession (Score: 4-6)
Brandon Russell drives, picks up Russell Wade. Help arrives from Paul Williamson! Brandon Russell attempts a Layup. Contested by Paul Williamson (4.2 feet, ZONE). Brandon Russell misses. Offensive rebound by Michael Russell! Michael Russell's putback is no good. Rebound secured by RJ Harden.

[09:11] Team_065 possession (Score: 4-6)
Manu McGrady attempts a 3Pt. Heavily contested by Brandon Russell (1.8 feet, ZONE)! Manu McGrady misses. Rebound secured by Draymond Banchero.

[08:57] Team_061 possession (Score: 4-6)
Brandon Russell drives and kicks out. Brandon Russell attempts a Midrange. BLOCKED BY RJ HARDEN! Ball is loose! Rebound secured by Russell Wade.

[08:46] Team_065 possession (Score: 4-6)
Manu McGrady attempts a Midrange. Contested by Michael Russell (5.4 feet, MAN). Manu McGrady misses. Offensive rebound by Manu McGrady! Manu McGrady kicks it out.

[08:32] Team_065 possession (Score: 4-6)
FOUL! Shooting foul on Draymond Banchero. Paul Williamson to the line for 2 free throws. [Team fouls: 2] (Draymond Banchero: 1 personal fouls)   FT 1/2: GOOD   FT 2/2: GOOD Paul Williamson makes 2/2 from the line.
Score: 4-8

[08:13] Team_061 possession (Score: 4-8)
Michael Russell attempts a 3Pt. Wide open! Manu McGrady is 7.5 feet away. [MAN] Michael Russell misses. FOUL! Loose ball foul on RJ Harden during the rebound battle. [Team fouls: 2] No free throws, side out. (RJ Harden: 1 personal fouls)

[07:57] Team_061 possession (Score: 4-8)
Michael Russell drives, picks up Manu McGrady. Help arrives from Paul Williamson! Michael Russell attempts a Layup. Contested by Paul Williamson (5.8 feet, MAN). MICHAEL RUSSELL MAKES IT! Assist: Jayson Holiday
Score: 6-8

[07:45] Team_065 possession (Score: 6-8)
Manu McGrady makes the Layup and draws the foul on Michael Russell! And-1! Manu McGrady to the line for 1. [Team fouls: 3] (Michael Russell: 1 personal fouls)   FT 1/1: GOOD Manu McGrady makes 1/1 from the line.
Score: 6-11

[07:32] Team_061 possession (Score: 6-11)
Brandon Russell attempts a Midrange. Wide open! Russell Wade is 7.2 feet away. [ZONE] Brandon Russell misses. Rebound secured by RJ Harden.

[07:22] Team_065 possession (Score: 6-11)
Manu McGrady attempts a Layup. Heavily contested by Draymond Banchero (0.5 feet, ZONE)! MANU MCGRADY MAKES IT! Assist: RJ Harden
Score: 6-13

[07:10] Team_061 possession (Score: 6-13)
Michael Russell attempts a 3Pt. Contested by RJ Harden (3.2 feet, ZONE). Michael Russell misses. Rebound secured by Manu McGrady.

[06:59] Team_065 possession (Score: 6-13)
Manu McGrady attempts a Midrange. Contested by Michael Russell (6.0 feet, ZONE). MANU MCGRADY MAKES IT! Assist: Russell Wade
Score: 6-15

[06:46] Team_061 possession (Score: 6-15)
Draymond Banchero throws a bad pass out of bounds! TURNOVER! (dead ball)

[06:31] Team_065 possession (Score: 6-15)
Manu McGrady attempts a Midrange. Contested by Michael Russell (3.5 feet, ZONE). Manu McGrady misses. Rebound secured by Draymond Banchero.

[06:13] Team_061 possession (Score: 6-15)
Bam Sexton attempts a Midrange. Contested by Manu McGrady (5.8 feet, ZONE). BAM SEXTON MAKES IT!
Score: 8-15

[06:00] Team_065 possession (Score: 8-15)
Manu McGrady attempts a Midrange. Heavily contested by Michael Russell (1.0 feet, MAN)! MANU MCGRADY MAKES IT!
Score: 8-17

[05:46] Team_061 possession (Score: 8-17)
Draymond Banchero attempts a Midrange. Wide open! Manu McGrady is 9.8 feet away. [ZONE] Draymond Banchero misses. Rebound secured by Manu McGrady.

[05:28] Team_065 possession (Score: 8-17)
Russell Wade makes the Layup and draws the foul on Bam Sexton! And-1! Russell Wade to the line for 1. [Team fouls: 4] (Bam Sexton: 2 personal fouls)   FT 1/1: GOOD Russell Wade makes 1/1 from the line.
Score: 8-20

[05:13] Team_061 possession (Score: 8-20)
Jayson Holiday attempts a 3Pt. Contested by Paul Williamson (4.8 feet, MAN). Jayson Holiday misses. Rebound secured by Russell Wade.

[05:01] Team_065 possession (Score: 8-20)
Paul Williamson attempts a 3Pt. Contested by Brandon Russell (2.8 feet, ZONE). PAUL WILLIAMSON MAKES IT! Assist: Karl Booker
Score: 8-23

[04:43] Team_061 possession (Score: 8-23)
Brandon Russell drives and kicks out. Michael Russell attempts a 3Pt. Contested by Russell Wade (5.9 feet, ZONE). Michael Russell misses. Rebound secured by RJ Harden.

[04:31] Team_065 possession (Score: 8-23)
RJ Harden attempts a Midrange. Contested by Brandon Russell (5.1 feet, MAN). RJ Harden misses. FOUL! Loose ball foul on Bam Sexton during the rebound battle. [IN THE BONUS! 5 team fouls] Manu McGrady to the line for 2 free throws. (Bam Sexton: 3 personal fouls)   FT 1/2: GOOD   FT 2/2: GOOD Manu McGrady makes 2/2 from the line.
Score: 8-25

[04:18] Team_061 possession (Score: 8-25)
Draymond Banchero attempts a Midrange. Contested by Paul Williamson (4.0 feet, ZONE). DRAYMOND BANCHERO MAKES IT! Assist: Brandon Russell
Score: 10-25

[04:04] Team_065 possession (Score: 10-25)
Russell Wade attempts a Midrange. Contested by Bam Sexton (4.6 feet, ZONE). RUSSELL WADE MAKES IT! Assist: RJ Harden
Score: 10-27

[03:49] Team_061 possession (Score: 10-27)
Brandon Russell attempts a Layup. BLOCKED BY RUSSELL WADE! Ball is loose! Rebound secured by RJ Harden.

[03:37] Team_065 possession (Score: 10-27)
FOUL! Reach-in foul on Draymond Banchero during the drive. [IN THE BONUS! 6 team fouls] Karl Booker to the line for 2 free throws. (Draymond Banchero: 2 personal fouls)   FT 1/2: MISS   FT 2/2: GOOD Karl Booker makes 1/2 from the line.
Score: 10-28

[03:24] Team_061 possession (Score: 10-28)
Bam Sexton attempts a Layup. BLOCKED BY RUSSELL WADE! Ball deflects out of bounds off Bam Sexton.

[03:11] Team_065 possession (Score: 10-28)
Paul Williamson drives to the basket... Paul Williamson throws a bad pass! Stolen by Draymond Banchero! TURNOVER! (live ball)

[03:01] Team_061 possession (Score: 10-28)
Michael Russell makes the Layup and draws the foul on Manu McGrady! And-1! Michael Russell to the line for 1. [Team fouls: 3] (Manu McGrady: 1 personal fouls)   FT 1/1: MISS Michael Russell makes 0/1 from the line. Rebound secured by Russell Wade.
Score: 12-28

[02:42] Team_065 possession (Score: 12-28)
RJ Harden attempts a 3Pt. Contested by Brandon Russell (4.9 feet, MAN). RJ HARDEN MAKES IT! Assist: Manu McGrady
Score: 12-31

[02:30] Team_061 possession (Score: 12-31)
Draymond Banchero drives, picks up Russell Wade. Help arrives from Paul Williamson! Draymond Banchero attempts a Dunk. Heavily contested by Paul Williamson (1.0 feet, MAN)! DRAYMOND BANCHERO MAKES IT!
Score: 14-31

[02:15] Team_065 possession (Score: 14-31)
RJ Harden attempts a Midrange. Contested by Brandon Russell (5.5 feet, MAN). RJ Harden misses. Rebound secured by Bam Sexton.

[02:01] Team_061 possession (Score: 14-31)
Michael Russell drives and kicks out. Brandon Russell attempts a Midrange. Contested by Manu McGrady (3.7 feet, ZONE). Brandon Russell misses. FOUL! Loose ball foul on RJ Harden during the rebound battle. [Team fouls: 4] No free throws, side out. (RJ Harden: 2 personal fouls)

[01:49] Team_061 possession (Score: 14-31)
Jayson Holiday attempts a Layup. Contested by Paul Williamson (5.5 feet, MAN). Jayson Holiday misses. Rebound secured by RJ Harden.

[01:37] Team_065 possession (Score: 14-31)
RJ Harden makes the Layup and draws the foul on Draymond Banchero! And-1! RJ Harden to the line for 1. [BONUS: 7 team fouls] (Draymond Banchero: 3 personal fouls)   FT 1/1: MISS RJ Harden makes 0/1 from the line. Offensive rebound by Russell Wade! Russell Wade puts it back in!
Score: 14-35

[01:22] Team_061 possession (Score: 14-35)
Draymond Banchero loses the ball! Stripped by Russell Wade! TURNOVER! (live ball)

[01:08] Team_065 possession (Score: 14-35)
Manu McGrady attempts a 3Pt. Contested by Michael Russell (4.8 feet, MAN). Manu McGrady misses. Offensive rebound by Russell Wade! Russell Wade's putback is no good. Rebound secured by Draymond Banchero.

[00:50] Team_061 possession (Score: 14-35)
Michael Russell attempts a Layup. Heavily contested by Russell Wade (1.3 feet, ZONE)! Michael Russell misses. FOUL! Loose ball foul on Manu McGrady during the rebound battle. [IN THE BONUS! 5 team fouls] Michael Russell to the line for 2 free throws. (Manu McGrady: 2 personal fouls)   FT 1/2: GOOD   FT 2/2: GOOD Michael Russell makes 2/2 from the line.
Score: 16-35

[00:33] Team_065 possession (Score: 16-35)
Karl Booker attempts a Layup. Wide open! Draymond Banchero is 6.9 feet away. [ZONE] Karl Booker misses. Rebound secured by Draymond Banchero.

[00:16] Team_061 possession (Score: 16-35)
Brandon Russell attempts a 3Pt. Contested by RJ Harden (4.7 feet, MAN). BRANDON RUSSELL MAKES IT! Assist: Draymond Banchero
Score: 19-35

================================================================================
                              1ST QUARTER COMPLETE                              
================================================================================

1ST QUARTER SCORE: Team_061 19, Team_065 35

BOX SCORE:
================================================================================

Team_061
--------------------------------------------------------------------------------
Player                MIN  PTS  REB  AST  TO      FG   FG%      3P   3P%
--------------------------------------------------------------------------------
Michael Russell        12    6    2    0   0   3/5    60.0     0/0   0.0
Brandon Russell        12    5    0    1   0   2/8    25.0     0/0   0.0
Draymond Banchero      12    4    5    1   0   2/4    50.0     0/0   0.0
Bam Sexton             12    2    1    1   0   1/2    50.0     0/0   0.0
Jayson Holiday         12    0    0    1   0   0/3     0.0     0/0   0.0

TEAM: FG: 8/22 (36.4%), 3PT: 1/4 (25.0%), REB: 9 (4 off, 5 def), AST: 4, TO: 2
TEAM FOULS: 7 [Team_065 in BONUS]


Team_065
--------------------------------------------------------------------------------
Player                MIN  PTS  REB  AST  TO      FG   FG%      3P   3P%
--------------------------------------------------------------------------------
Manu McGrady           12   14    4    1   0   6/9    66.7     0/0   0.0
Russell Wade           12    9    4    2   0   3/4    75.0     0/0   0.0
Paul Williamson        12    8    0    0   0   3/3   100.0     0/0   0.0
RJ Harden              12    3    6    2   0   1/2    50.0     0/0   0.0
Karl Booker            12    1    0    1   0   1/2    50.0     0/0   0.0

TEAM: FG: 14/20 (70.0%), 3PT: 4/7 (57.1%), REB: 13 (2 off, 11 def), AST: 6, TO: 3
TEAM FOULS: 5 [Team_061 in BONUS]

================================================================================

================================================================================
                       2ND QUARTER - Team_061 vs Team_065                       
================================================================================

[12:00] Substitution (Team_061): Jayson Holiday OUT → Gary Fox IN (stamina_rule2)

[12:00] Substitution (Team_061): Michael Russell OUT → Desmond Morant IN (stamina_rule2)

[12:00] Substitution (Team_065): RJ Harden OUT → Paul Curry IN (stamina_rule2)

[12:00] Substitution (Team_065): Paul Williamson OUT → Derrick Poole IN (stamina_rule2)

[12:00] Substitution (Team_065): Manu McGrady OUT → D'Angelo Porzingis IN (stamina_rule2)

[12:00] Substitution (Team_065): Karl Booker OUT → Vince Mobley IN (stamina_rule2)

[12:00] Team_061 possession (Score: 19-35)
Michael Russell throws a bad pass out of bounds! TURNOVER! (dead ball)

[11:42] Team_065 possession (Score: 19-35)
D'Angelo Porzingis attempts a 3Pt. Heavily contested by Brandon Russell (1.8 feet, ZONE)! D'Angelo Porzingis misses. Rebound secured by Bam Sexton.

[11:24] Team_061 possession (Score: 19-35)
Draymond Banchero attempts a 3Pt. Heavily contested by Vince Mobley (0.5 feet, MAN)! Draymond Banchero misses. Rebound secured by Russell Wade.

[11:09] Team_065 possession (Score: 19-35)
Paul Curry attempts a 3Pt. Contested by Brandon Russell (3.7 feet, MAN). Paul Curry misses. Rebound secured by Draymond Banchero.

[10:58] Team_061 possession (Score: 19-35)
Desmond Morant attempts a Midrange. BLOCKED BY DERRICK POOLE! Ball deflects out of bounds off Desmond Morant.

[10:42] Team_065 possession (Score: 19-35)
D'Angelo Porzingis attempts a 3Pt. Wide open! Desmond Morant is 6.0 feet away. [MAN] D'ANGELO PORZINGIS MAKES IT! Assist: Russell Wade
Score: 19-38

[10:24] Team_061 possession (Score: 19-38)
Desmond Morant attempts a Midrange. Wide open! D'Angelo Porzingis is 6.1 feet away. [MAN] Desmond Morant misses. Rebound secured by Vince Mobley.

[10:10] Team_065 possession (Score: 19-38)
Paul Curry attempts a Layup. Contested by Draymond Banchero (3.2 feet, ZONE). Paul Curry misses. Rebound secured by Desmond Morant.

[09:55] Team_061 possession (Score: 19-38)
Draymond Banchero attempts a Midrange. Wide open! D'Angelo Porzingis is 8.2 feet away. [ZONE] DRAYMOND BANCHERO MAKES IT!
Score: 21-38

[09:41] Team_065 possession (Score: 21-38)
Vince Mobley attempts a Layup. Contested by Draymond Banchero (2.9 feet, MAN). VINCE MOBLEY MAKES IT!
Score: 21-40

[09:25] Team_061 possession (Score: 21-40)
FOUL! Offensive foul on Bam Sexton! Russell Wade drew the charge! [Team fouls: 1] (Bam Sexton: 1 personal fouls) TURNOVER! (dead ball)

[09:12] Team_065 possession (Score: 21-40)
Vince Mobley drives and kicks out. Derrick Poole attempts a 3Pt. Contested by Gary Fox (5.8 feet, MAN). DERRICK POOLE MAKES IT! Assist: D'Angelo Porzingis
Score: 21-43

[08:58] Team_061 possession (Score: 21-43)
Desmond Morant throws a bad pass! Stolen by D'Angelo Porzingis! TURNOVER! (live ball)

[08:45] Team_065 possession (Score: 21-43)
FOUL! Holding foul on Draymond Banchero. [Team fouls: 2] No free throws, side out. (Draymond Banchero: 1 personal fouls)

[08:31] Team_065 possession (Score: 21-43)
Paul Curry attempts a 3Pt. Contested by Brandon Russell (4.2 feet, ZONE). Paul Curry misses. Rebound secured by Bam Sexton.

[08:17] Team_061 possession (Score: 21-43)
Brandon Russell attempts a 3Pt. Contested by Russell Wade (2.5 feet, ZONE). Brandon Russell misses. Rebound secured by Vince Mobley.

[07:57] Team_065 possession (Score: 21-43)
Paul Curry attempts a 3Pt. Wide open! Brandon Russell is 7.3 feet away. [MAN] PAUL CURRY MAKES IT! Assist: D'Angelo Porzingis
Score: 21-46

[07:45] Team_061 possession (Score: 21-46)
Draymond Banchero drives and kicks out. Bam Sexton attempts a 3Pt. Contested by Russell Wade (2.2 feet, ZONE). Bam Sexton misses. Rebound secured by Russell Wade.

[07:26] Team_065 possession (Score: 21-46)
Paul Curry attempts a 3Pt. Wide open! Brandon Russell is 7.3 feet away. [ZONE] Paul Curry misses. FOUL! Loose ball foul on Desmond Morant during the rebound battle. [Team fouls: 3] No free throws, side out. (Desmond Morant: 1 personal fouls)

[07:09] Team_065 possession (Score: 21-46)
Paul Curry drives to the basket... Paul Curry loses control! Ball rolls out of bounds! TURNOVER! (dead ball)

[07:09] Substitution (Team_061): Brandon Russell OUT → Evan Rose IN (stamina_rule2)

[07:09] Substitution (Team_061): Bam Sexton OUT → Stephen Towns IN (stamina_rule2)

[07:09] Substitution (Team_061): Draymond Banchero OUT → Tim Durant IN (stamina_rule2)

[07:09] Substitution (Team_065): Russell Wade OUT → Karl Leonard IN (stamina_rule2)

[06:57] Team_061 possession (Score: 21-46)
Tim Durant attempts a Layup. Contested by Vince Mobley (4.3 feet, MAN). TIM DURANT MAKES IT! Assist: Evan Rose
Score: 23-46

[06:42] Team_065 possession (Score: 23-46)
Karl Leonard attempts a Layup. Contested by Tim Durant (3.7 feet, ZONE). Karl Leonard misses. Rebound secured by Desmond Morant.

[06:25] Team_061 possession (Score: 23-46)
Tim Durant drives to the basket... Tim Durant throws a bad pass out of bounds! TURNOVER! (dead ball)

[06:10] Team_065 possession (Score: 23-46)
Derrick Poole attempts a Layup. Heavily contested by Gary Fox (1.5 feet, MAN)! DERRICK POOLE MAKES IT!
Score: 23-48

[05:58] Team_061 possession (Score: 23-48)
Gary Fox attempts a 3Pt. Contested by Derrick Poole (3.0 feet, MAN). Gary Fox misses. Offensive rebound by Tim Durant! Tim Durant puts it back in!
Score: 25-48

[05:44] Team_065 possession (Score: 25-48)
Karl Leonard drives, Tim Durant stays with him. Karl Leonard attempts a Dunk. Contested by Tim Durant (2.3 feet, ZONE). Karl Leonard misses. Rebound secured by Tim Durant.

[05:29] Team_061 possession (Score: 25-48)
Desmond Morant drives, picks up D'Angelo Porzingis. Help arrives from Derrick Poole! Desmond Morant attempts a Layup. Contested by Derrick Poole (2.7 feet, MAN). DESMOND MORANT MAKES IT! Assist: Evan Rose
Score: 27-48

[05:14] Team_065 possession (Score: 27-48)
Paul Curry attempts a 3Pt. Contested by Desmond Morant (3.4 feet, ZONE). Paul Curry misses. Rebound secured by Tim Durant.

[04:59] Team_061 possession (Score: 27-48)
Evan Rose attempts a 3Pt. Wide open! Paul Curry is 7.6 feet away. [ZONE] Evan Rose misses. Rebound secured by Vince Mobley.

[04:45] Team_065 possession (Score: 27-48)
D'Angelo Porzingis attempts a Layup. Contested by Tim Durant (5.5 feet, ZONE). D'ANGELO PORZINGIS MAKES IT! Assist: Derrick Poole
Score: 27-50

[04:30] Team_061 possession (Score: 27-50)
Tim Durant attempts a 3Pt. Contested by D'Angelo Porzingis (5.4 feet, ZONE). Tim Durant misses. Rebound secured by Vince Mobley.

[04:16] Team_065 possession (Score: 27-50)
Vince Mobley drives, picks up Tim Durant. Help arrives from Evan Rose! Vince Mobley attempts a Layup. Contested by Evan Rose (3.7 feet, MAN). VINCE MOBLEY MAKES IT! Assist: Paul Curry
Score: 27-52

[04:01] Team_061 possession (Score: 27-52)
Stephen Towns drives, Vince Mobley stays with him. Stephen Towns attempts a Layup. Heavily contested by Vince Mobley (1.4 feet, ZONE)! Stephen Towns misses. Rebound secured by Vince Mobley.

[03:50] Team_065 possession (Score: 27-52)
Vince Mobley makes the Midrange and draws the foul on Tim Durant! And-1! Vince Mobley to the line for 1. [Team fouls: 4] (Tim Durant: 1 personal fouls)   FT 1/1: MISS Vince Mobley makes 0/1 from the line. Rebound secured by Stephen Towns.
Score: 27-54

[03:36] Team_061 possession (Score: 27-54)
Evan Rose attempts a Layup. BLOCKED BY D'ANGELO PORZINGIS! Ball is loose! Offensive rebound by Tim Durant! Tim Durant kicks it out.

[03:22] Team_061 possession (Score: 27-54)
Stephen Towns throws a bad pass out of bounds! TURNOVER! (dead ball)

[03:08] Team_065 possession (Score: 27-54)
Karl Leonard makes the Layup and draws the foul on Evan Rose! And-1! Karl Leonard to the line for 1. [BONUS: 5 team fouls] (Evan Rose: 1 personal fouls)   FT 1/1: GOOD Karl Leonard makes 1/1 from the line.
Score: 27-57

[02:57] Team_061 possession (Score: 27-57)
Desmond Morant attempts a Midrange. Contested by D'Angelo Porzingis (4.4 feet, MAN). DESMOND MORANT MAKES IT!
Score: 29-57

[02:39] Team_065 possession (Score: 29-57)
FOUL! Reach-in foul on Tim Durant during the drive. [IN THE BONUS! 6 team fouls] Derrick Poole to the line for 2 free throws. (Tim Durant: 2 personal fouls)   FT 1/2: GOOD   FT 2/2: GOOD Derrick Poole makes 2/2 from the line.
Score: 29-59

[02:24] Team_061 possession (Score: 29-59)
Evan Rose attempts a Layup. Contested by Vince Mobley (3.6 feet, ZONE). Evan Rose misses. Offensive rebound by Tim Durant! Tim Durant puts it back in!
Score: 31-59

[02:08] Team_065 possession (Score: 31-59)
D'Angelo Porzingis attempts a Midrange. Wide open! Stephen Towns is 6.6 feet away. [ZONE] D'ANGELO PORZINGIS MAKES IT!
Score: 31-61

[01:56] Team_061 possession (Score: 31-61)
Gary Fox attempts a Layup. BLOCKED BY DERRICK POOLE! Ball is loose! Rebound secured by Karl Leonard.

[01:39] Team_065 possession (Score: 31-61)
Paul Curry attempts a 3Pt. Contested by Stephen Towns (2.8 feet, ZONE). Paul Curry misses. Rebound secured by Stephen Towns.

[01:24] Team_061 possession (Score: 31-61)
Stephen Towns drives and kicks out. Gary Fox attempts a Midrange. Contested by Karl Leonard (5.5 feet, ZONE). GARY FOX MAKES IT!
Score: 33-61

[01:08] Team_065 possession (Score: 33-61)
Vince Mobley attempts a Midrange. Contested by Tim Durant (2.3 feet, MAN). Vince Mobley misses. FOUL! Loose ball foul on Tim Durant during the rebound battle. [IN THE BONUS! 7 team fouls] Karl Leonard to the line for 2 free throws. (Tim Durant: 3 personal fouls)   FT 1/2: GOOD   FT 2/2: GOOD Karl Leonard makes 2/2 from the line.
Score: 33-63

[00:52] Team_061 possession (Score: 33-63)
Gary Fox attempts a 3Pt. Wide open! Derrick Poole is 7.1 feet away. [MAN] Gary Fox misses. Offensive rebound by Tim Durant! Tim Durant's putback is no good. Rebound secured by D'Angelo Porzingis.

[00:36] Team_065 possession (Score: 33-63)
Derrick Poole attempts a 3Pt. Wide open! Gary Fox is 6.4 feet away. [MAN] Derrick Poole misses. Rebound secured by Stephen Towns.

[00:22] Team_061 possession (Score: 33-63)
Desmond Morant attempts a 3Pt. Heavily contested by D'Angelo Porzingis (1.5 feet, ZONE)! DESMOND MORANT MAKES IT! Assist: Tim Durant
Score: 36-63

[00:07] Team_065 possession (Score: 36-63)
Karl Leonard attempts a 3Pt. Contested by Stephen Towns (3.4 feet, MAN). Karl Leonard misses. FOUL! Loose ball foul on Stephen Towns during the rebound battle. [IN THE BONUS! 8 team fouls] Vince Mobley to the line for 2 free throws. (Stephen Towns: 1 personal fouls)   FT 1/2: MISS   FT 2/2: GOOD Vince Mobley makes 1/2 from the line.
Score: 36-64

================================================================================
                              2ND QUARTER COMPLETE                              
================================================================================

2ND QUARTER SCORE: Team_061 17, Team_065 29

BOX SCORE:
================================================================================

Team_061
--------------------------------------------------------------------------------
Player                MIN  PTS  REB  AST  TO      FG   FG%      3P   3P%
--------------------------------------------------------------------------------
D'Angelo Porzingis     12    7    1    2   0   3/4    75.0     0/0   0.0
Desmond Morant         12    7    2    0   0   3/5    60.0     0/0   0.0
Tim Durant              7    6    5    1   0   3/4    75.0     0/0   0.0
Draymond Banchero      17    2    1    0   0   1/3    33.3     0/0   0.0
Gary Fox               12    2    0    0   0   1/3    33.3     0/0   0.0
Bam Sexton             17    0    2    0   0   0/0     0.0     0/0   0.0
Brandon Russell        17    0    0    0   0   0/1     0.0     0/0   0.0
Evan Rose               7    0    0    2   0   0/1     0.0     0/0   0.0
Stephen Towns           7    0    3    0   0   0/1     0.0     0/0   0.0

TEAM: FG: 8/18 (44.4%), 3PT: 2/7 (28.6%), REB: 14 (4 off, 10 def), AST: 3, TO: 5
TEAM FOULS: 8 [Team_065 in BONUS]


Team_065
--------------------------------------------------------------------------------
Player                MIN  PTS  REB  AST  TO      FG   FG%      3P   3P%
--------------------------------------------------------------------------------
Derrick Poole          12    7    0    1   0   3/4    75.0     0/0   0.0
Vince Mobley           12    5    6    0   0   3/4    75.0     0/0   0.0
Karl Leonard            7    5    1    0   0   2/4    50.0     0/0   0.0
Paul Curry             12    3    0    1   0   1/6    16.7     0/0   0.0
Russell Wade           17    0    2    1   0   0/0     0.0     0/0   0.0

TEAM: FG: 12/22 (54.5%), 3PT: 3/9 (33.3%), REB: 9 (1 off, 8 def), AST: 5, TO: 1
TEAM FOULS: 0

================================================================================

================================================================================
                       3RD QUARTER - Team_061 vs Team_065                       
================================================================================

[12:00] Team_061 possession (Score: 36-64)
Bam Sexton attempts a Layup. Heavily contested by Russell Wade (1.8 feet, ZONE)! BAM SEXTON MAKES IT! Assist: Jayson Holiday
Score: 38-64

[11:47] Team_065 possession (Score: 38-64)
RJ Harden attempts a 3Pt. Contested by Brandon Russell (2.6 feet, ZONE). RJ HARDEN MAKES IT! Assist: Manu McGrady
Score: 38-67

[11:36] Team_061 possession (Score: 38-67)
Draymond Banchero attempts a Layup. Contested by Karl Booker (3.6 feet, ZONE). DRAYMOND BANCHERO MAKES IT! Assist: Jayson Holiday
Score: 40-67

[11:19] Team_065 possession (Score: 40-67)
RJ Harden makes the Dunk and draws the foul on Bam Sexton! And-1! RJ Harden to the line for 1. [Team fouls: 1] (Bam Sexton: 1 personal fouls)   FT 1/1: GOOD RJ Harden makes 1/1 from the line.
Score: 40-70

[11:05] Team_061 possession (Score: 40-70)
Brandon Russell makes the Dunk and draws the foul on Paul Williamson! And-1! Brandon Russell to the line for 1. [Team fouls: 1] (Paul Williamson: 1 personal fouls)   FT 1/1: GOOD Brandon Russell makes 1/1 from the line.
Score: 43-70

[10:54] Team_065 possession (Score: 43-70)
RJ Harden attempts a 3Pt. Heavily contested by Brandon Russell (0.9 feet, MAN)! RJ Harden misses. Rebound secured by Michael Russell.

[10:43] Team_061 possession (Score: 43-70)
Bam Sexton attempts a 3Pt. Contested by Russell Wade (3.9 feet, MAN). Bam Sexton misses. Rebound secured by Manu McGrady.

[10:27] Team_065 possession (Score: 43-70)
Manu McGrady attempts a 3Pt. Contested by Michael Russell (5.2 feet, MAN). Manu McGrady misses. Rebound secured by Draymond Banchero.

[10:16] Team_061 possession (Score: 43-70)
FOUL! Holding foul on Paul Williamson. [Team fouls: 2] No free throws, side out. (Paul Williamson: 2 personal fouls)

[10:00] Team_061 possession (Score: 43-70)
FOUL! Shooting foul on Russell Wade. Bam Sexton to the line for 2 free throws. [Team fouls: 3] (Russell Wade: 1 personal fouls)   FT 1/2: GOOD   FT 2/2: GOOD Bam Sexton makes 2/2 from the line.
Score: 45-70

[09:46] Team_065 possession (Score: 45-70)
RJ Harden drives, Draymond Banchero stays with him. RJ Harden attempts a Layup. Heavily contested by Draymond Banchero (0.5 feet, ZONE)! RJ Harden misses. Rebound secured by Bam Sexton.

[09:32] Team_061 possession (Score: 45-70)
FOUL! Reach-in foul on Russell Wade during the drive. [Team fouls: 4] No free throws, side out. (Russell Wade: 2 personal fouls)

[09:16] Team_061 possession (Score: 45-70)
Brandon Russell drives and kicks out. Draymond Banchero attempts a 3Pt. Contested by RJ Harden (2.7 feet, ZONE). Draymond Banchero misses. Rebound secured by Russell Wade.

[09:01] Team_065 possession (Score: 45-70)
Paul Williamson attempts a Layup. BLOCKED BY DRAYMOND BANCHERO! Ball is loose! Offensive rebound by Russell Wade! Russell Wade kicks it out.

[08:49] Team_065 possession (Score: 45-70)
Manu McGrady attempts a Layup. Contested by Michael Russell (3.3 feet, MAN). Manu McGrady misses. Rebound secured by Bam Sexton.

[08:38] Team_061 possession (Score: 45-70)
Brandon Russell attempts a Midrange. Contested by RJ Harden (5.4 feet, MAN). Brandon Russell misses. Rebound secured by Russell Wade.

[08:25] Team_065 possession (Score: 45-70)
RJ Harden attempts a 3Pt. Contested by Brandon Russell (2.6 feet, MAN). RJ Harden misses. Rebound secured by Bam Sexton.

[08:06] Team_061 possession (Score: 45-70)
FOUL! Reach-in foul on Russell Wade during the drive. [IN THE BONUS! 5 team fouls] Draymond Banchero to the line for 2 free throws. (Russell Wade: 3 personal fouls)   FT 1/2: GOOD   FT 2/2: GOOD Draymond Banchero makes 2/2 from the line.
Score: 47-70

[07:56] Team_065 possession (Score: 47-70)
Paul Williamson makes the Dunk and draws the foul on Jayson Holiday! And-1! Paul Williamson to the line for 1. [Team fouls: 2] (Jayson Holiday: 1 personal fouls)   FT 1/1: GOOD Paul Williamson makes 1/1 from the line.
Score: 47-73

[07:42] Team_061 possession (Score: 47-73)
Michael Russell drives to the basket... Michael Russell throws a bad pass out of bounds! TURNOVER! (dead ball)

[07:26] Team_065 possession (Score: 47-73)
FOUL! Reach-in foul on Draymond Banchero during the drive. [Team fouls: 3] No free throws, side out. (Draymond Banchero: 1 personal fouls)

[07:15] Team_065 possession (Score: 47-73)
RJ Harden drives and kicks out. Manu McGrady attempts a Midrange. Contested by Bam Sexton (3.4 feet, ZONE). Manu McGrady misses. Rebound secured by Bam Sexton.

[07:01] Team_061 possession (Score: 47-73)
Draymond Banchero drives to the basket... Draymond Banchero throws a bad pass out of bounds! TURNOVER! (dead ball)

[06:46] Team_065 possession (Score: 47-73)
FOUL! Offensive foul on Manu McGrady! Michael Russell drew the charge! [Team fouls: 6] (Manu McGrady: 1 personal fouls) TURNOVER! (dead ball)

[06:31] Team_061 possession (Score: 47-73)
FOUL! Shooting foul on Paul Williamson. Jayson Holiday to the line for 2 free throws. [BONUS: 7 team fouls] (Paul Williamson: 3 personal fouls)   FT 1/2: GOOD   FT 2/2: GOOD Jayson Holiday makes 2/2 from the line.
Score: 49-73

[06:18] Team_065 possession (Score: 49-73)
RJ Harden attempts a 3Pt. Contested by Brandon Russell (4.8 feet, MAN). RJ HARDEN MAKES IT! Assist: Paul Williamson
Score: 49-76

[06:05] Team_061 possession (Score: 49-76)
Brandon Russell attempts a Midrange. Contested by RJ Harden (4.1 feet, MAN). BRANDON RUSSELL MAKES IT!
Score: 51-76

[05:49] Team_065 possession (Score: 51-76)
Paul Williamson attempts a Midrange. Wide open! Michael Russell is 6.8 feet away. [ZONE] PAUL WILLIAMSON MAKES IT! Assist: Manu McGrady
Score: 51-78

[05:34] Team_061 possession (Score: 51-78)
FOUL! Offensive foul on Jayson Holiday! Paul Williamson drew the charge! [Team fouls: 4] (Jayson Holiday: 2 personal fouls) TURNOVER! (dead ball)

[05:18] Team_065 possession (Score: 51-78)
Russell Wade attempts a Midrange. Contested by Brandon Russell (3.4 feet, ZONE). Russell Wade misses. Rebound secured by Michael Russell.

[05:02] Team_061 possession (Score: 51-78)
Bam Sexton attempts a Midrange. Contested by Russell Wade (2.2 feet, MAN). BAM SEXTON MAKES IT!
Score: 53-78

[04:49] Team_065 possession (Score: 53-78)
Karl Booker drives and kicks out. Paul Williamson attempts a Midrange. Contested by Jayson Holiday (2.3 feet, MAN). Paul Williamson misses. Rebound secured by Michael Russell.

[04:38] Team_061 possession (Score: 53-78)
Michael Russell attempts a Midrange. Contested by Manu McGrady (5.0 feet, ZONE). MICHAEL RUSSELL MAKES IT! Assist: Bam Sexton
Score: 55-78

[04:25] Team_065 possession (Score: 55-78)
Karl Booker attempts a 3Pt. Contested by Brandon Russell (3.9 feet, ZONE). KARL BOOKER MAKES IT!
Score: 55-81

[04:06] Team_061 possession (Score: 55-81)
FOUL! Offensive foul on Michael Russell! Manu McGrady drew the charge! [Team fouls: 5] (Michael Russell: 1 personal fouls) TURNOVER! (dead ball)

[03:54] Team_065 possession (Score: 55-81)
Paul Williamson attempts a 3Pt. Contested by Jayson Holiday (4.4 feet, MAN). PAUL WILLIAMSON MAKES IT! Assist: Manu McGrady
Score: 55-84

[03:36] Team_061 possession (Score: 55-84)
Michael Russell makes the Layup and draws the foul on Russell Wade! And-1! Michael Russell to the line for 1. [BONUS: 8 team fouls] (Russell Wade: 4 personal fouls)   FT 1/1: MISS Michael Russell makes 0/1 from the line. Rebound secured by Russell Wade.
Score: 57-84

[03:20] Team_065 possession (Score: 57-84)
Russell Wade attempts a 3Pt. Contested by Brandon Russell (3.2 feet, ZONE). Russell Wade misses. Rebound secured by Michael Russell.

[03:05] Team_061 possession (Score: 57-84)
FOUL! Reach-in foul on Russell Wade during the drive. [IN THE BONUS! 9 team fouls] Jayson Holiday to the line for 2 free throws. (Russell Wade: 5 personal fouls)   FT 1/2: GOOD   FT 2/2: GOOD Jayson Holiday makes 2/2 from the line.
Score: 59-84

[02:45] Team_065 possession (Score: 59-84)
Karl Booker attempts a Midrange. Wide open! Bam Sexton is 7.1 feet away. [ZONE] Karl Booker misses. Rebound secured by Draymond Banchero.

[02:28] Team_061 possession (Score: 59-84)
Jayson Holiday attempts a 3Pt. Contested by RJ Harden (4.3 feet, ZONE). Jayson Holiday misses. Rebound secured by RJ Harden.

[02:14] Team_065 possession (Score: 59-84)
Russell Wade drives and kicks out. Russell Wade attempts a Midrange. Wide open! Michael Russell is 8.6 feet away. [ZONE] Russell Wade misses. Rebound secured by Michael Russell.

[02:03] Team_061 possession (Score: 59-84)
Brandon Russell attempts a Midrange. BLOCKED BY PAUL WILLIAMSON! Ball is loose! Rebound secured by Manu McGrady.

[01:51] Team_065 possession (Score: 59-84)
Russell Wade loses the ball! Stripped by Bam Sexton! TURNOVER! (live ball)

[01:32] Team_061 possession (Score: 59-84)
Michael Russell attempts a Layup. Wide open! Manu McGrady is 7.7 feet away. [MAN] MICHAEL RUSSELL MAKES IT! Assist: Draymond Banchero
Score: 61-84

[01:18] Team_065 possession (Score: 61-84)
FOUL! Shooting foul on Draymond Banchero. Karl Booker to the line for 2 free throws. [BONUS: 6 team fouls] (Draymond Banchero: 2 personal fouls)   FT 1/2: GOOD   FT 2/2: GOOD Karl Booker makes 2/2 from the line.
Score: 61-86

[01:06] Team_061 possession (Score: 61-86)
Brandon Russell attempts a 3Pt. Wide open! RJ Harden is 8.0 feet away. [ZONE] Brandon Russell misses. Rebound secured by RJ Harden.

[00:50] Team_065 possession (Score: 61-86)
Paul Williamson attempts a 3Pt. Contested by Jayson Holiday (4.5 feet, MAN). Paul Williamson misses. Rebound secured by Draymond Banchero.

[00:36] Team_061 possession (Score: 61-86)
Jayson Holiday loses the ball! Stripped by Paul Williamson! TURNOVER! (live ball)

[00:21] Team_065 possession (Score: 61-86)
Russell Wade drives and kicks out. Russell Wade attempts a Midrange. Wide open! Bam Sexton is 6.6 feet away. [MAN] Russell Wade misses. Offensive rebound by Manu McGrady! Manu McGrady kicks it out.

[00:07] Team_065 possession (Score: 61-86)
Russell Wade makes the Dunk and draws the foul on Bam Sexton! And-1! Russell Wade to the line for 1. [BONUS: 7 team fouls] (Bam Sexton: 2 personal fouls)   FT 1/1: GOOD Russell Wade makes 1/1 from the line.
Score: 61-89

================================================================================
                              3RD QUARTER COMPLETE                              
================================================================================

3RD QUARTER SCORE: Team_061 25, Team_065 25

BOX SCORE:
================================================================================

Team_061
--------------------------------------------------------------------------------
Player                MIN  PTS  REB  AST  TO      FG   FG%      3P   3P%
--------------------------------------------------------------------------------
Bam Sexton             29    6    4    1   0   3/4    75.0     0/0   0.0
Brandon Russell        29    5    0    0   0   2/6    33.3     0/0   0.0
Jayson Holiday         24    4    0    2   0   2/3    66.7     0/0   0.0
Draymond Banchero      29    4    3    1   0   2/2   100.0     0/0   0.0
Michael Russell        24    4    5    0   0   2/3    66.7     0/0   0.0

TEAM: FG: 11/18 (61.1%), 3PT: 0/3 (0.0%), REB: 12 (0 off, 12 def), AST: 4, TO: 5
TEAM FOULS: 7 [Team_065 in BONUS]


Team_065
--------------------------------------------------------------------------------
Player                MIN  PTS  REB  AST  TO      FG   FG%      3P   3P%
--------------------------------------------------------------------------------
RJ Harden              24    9    2    0   0   3/7    42.9     0/0   0.0
Paul Williamson        24    8    0    1   0   3/4    75.0     0/0   0.0
Karl Booker            24    5    0    0   0   2/4    50.0     0/0   0.0
Russell Wade           29    3    4    0   0   1/4    25.0     0/0   0.0
Manu McGrady           24    0    3    3   0   0/2     0.0     0/0   0.0

TEAM: FG: 9/21 (42.9%), 3PT: 4/9 (44.4%), REB: 9 (2 off, 7 def), AST: 4, TO: 2
TEAM FOULS: 9 [Team_061 in BONUS]

================================================================================

================================================================================
                       4TH QUARTER - Team_061 vs Team_065                       
================================================================================

[12:00] Substitution (Team_061): Brandon Russell OUT (stamina: 71) → Evan Rose IN (comeback_detected)

[12:00] Substitution (Team_065): RJ Harden OUT (stamina: 70) → Paul Curry IN (comeback_detected)

[12:00] Team_061 possession (Score: 61-89)
Jayson Holiday drives and kicks out. Evan Rose attempts a Midrange. Contested by Paul Williamson (4.3 feet, ZONE). Evan Rose misses. Rebound secured by Manu McGrady.

[11:46] Team_065 possession (Score: 61-89)
Paul Curry attempts a Layup. Contested by Bam Sexton (3.0 feet, ZONE). PAUL CURRY MAKES IT!
Score: 61-91

[11:36] Team_061 possession (Score: 61-91)
Evan Rose attempts a Layup. Contested by Paul Curry (5.0 feet, MAN). Evan Rose misses. Rebound secured by Russell Wade.

[11:23] Team_065 possession (Score: 61-91)
Paul Curry drives, picks up Evan Rose. Help arrives from Michael Russell! Paul Curry attempts a Layup. Contested by Michael Russell (2.0 feet, MAN). PAUL CURRY MAKES IT!
Score: 61-93

[11:10] Team_061 possession (Score: 61-93)
Jayson Holiday attempts a Midrange. Heavily contested by Paul Williamson (0.5 feet, MAN)! Jayson Holiday misses. Offensive rebound by Michael Russell! Michael Russell puts it back in!
Score: 63-93

[10:52] Team_065 possession (Score: 63-93)
Russell Wade attempts a Midrange. Contested by Michael Russell (4.3 feet, ZONE). RUSSELL WADE MAKES IT!
Score: 63-95

[10:40] Team_061 possession (Score: 63-95)
Michael Russell throws a bad pass out of bounds! TURNOVER! (dead ball)

[10:40] Substitution (Team_061): Jayson Holiday OUT → Gary Fox IN (stamina_rule2)

[10:40] Substitution (Team_061): Michael Russell OUT → Desmond Morant IN (stamina_rule2)

[10:40] Substitution (Team_061): Bam Sexton OUT → Stephen Towns IN (stamina_rule2)

[10:40] Substitution (Team_061): Draymond Banchero OUT → Tim Durant IN (stamina_rule2)

[10:40] Substitution (Team_065): Paul Williamson OUT → Derrick Poole IN (stamina_rule2)

[10:40] Substitution (Team_065): Manu McGrady OUT → D'Angelo Porzingis IN (stamina_rule2)

[10:40] Substitution (Team_065): Russell Wade OUT → Karl Leonard IN (stamina_rule2)

[10:40] Substitution (Team_065): Karl Booker OUT → Vince Mobley IN (stamina_rule2)

[10:25] Team_065 possession (Score: 63-95)
Derrick Poole attempts a Midrange. Wide open! Gary Fox is 8.4 feet away. [ZONE] DERRICK POOLE MAKES IT! Assist: Karl Leonard
Score: 63-97

[10:07] Team_061 possession (Score: 63-97)
Stephen Towns attempts a Midrange. Contested by Karl Leonard (2.6 feet, ZONE). STEPHEN TOWNS MAKES IT! Assist: Gary Fox
Score: 65-97

[09:51] Team_065 possession (Score: 65-97)
Derrick Poole attempts a Midrange. Wide open! Gary Fox is 6.1 feet away. [MAN] DERRICK POOLE MAKES IT!
Score: 65-99

[09:34] Team_061 possession (Score: 65-99)
FOUL! Shooting foul on Paul Curry. Evan Rose to the line for 2 free throws. [Team fouls: 1] (Paul Curry: 1 personal fouls)   FT 1/2: GOOD   FT 2/2: GOOD Evan Rose makes 2/2 from the line.
Score: 67-99

[09:24] Team_065 possession (Score: 67-99)
D'Angelo Porzingis attempts a 3Pt. Contested by Desmond Morant (5.1 feet, ZONE). D'ANGELO PORZINGIS MAKES IT!
Score: 67-102

[09:12] Team_061 possession (Score: 67-102)
Stephen Towns drives, Karl Leonard stays with him. Stephen Towns attempts a Layup. Contested by Karl Leonard (4.0 feet, MAN). Stephen Towns misses. Rebound secured by Karl Leonard.

[08:58] Team_065 possession (Score: 67-102)
Karl Leonard attempts a Midrange. Wide open! Stephen Towns is 8.6 feet away. [MAN] Karl Leonard misses. Offensive rebound by Vince Mobley! Vince Mobley puts it back in!
Score: 67-104

[08:46] Team_061 possession (Score: 67-104)
Desmond Morant attempts a 3Pt. Heavily contested by D'Angelo Porzingis (1.8 feet, MAN)! Desmond Morant misses. Rebound secured by D'Angelo Porzingis.

[08:32] Team_065 possession (Score: 67-104)
Derrick Poole throws a bad pass! Stolen by Gary Fox! TURNOVER! (live ball)

[08:16] Team_061 possession (Score: 67-104)
Evan Rose attempts a 3Pt. Wide open! Karl Leonard is 6.7 feet away. [ZONE] Evan Rose misses. Rebound secured by Vince Mobley.

[08:06] Team_065 possession (Score: 67-104)
Paul Curry attempts a 3Pt. Contested by Desmond Morant (3.7 feet, ZONE). Paul Curry misses. Offensive rebound by D'Angelo Porzingis! D'Angelo Porzingis kicks it out.

[07:53] Team_065 possession (Score: 67-104)
Paul Curry drives to the basket... Paul Curry throws a bad pass out of bounds! TURNOVER! (dead ball)

[07:38] Team_061 possession (Score: 67-104)
Gary Fox attempts a Midrange. Wide open! Derrick Poole is 8.0 feet away. [MAN] Gary Fox misses. Rebound secured by Vince Mobley.

[07:28] Team_065 possession (Score: 67-104)
Paul Curry attempts a 3Pt. Wide open! Desmond Morant is 6.4 feet away. [ZONE] Paul Curry misses. Rebound secured by Stephen Towns.

[07:12] Team_061 possession (Score: 67-104)
Gary Fox attempts a Midrange. Contested by Derrick Poole (4.5 feet, ZONE). Gary Fox misses. Rebound secured by D'Angelo Porzingis.

[07:00] Team_065 possession (Score: 67-104)
Karl Leonard drives and kicks out. Derrick Poole attempts a 3Pt. Wide open! Gary Fox is 8.8 feet away. [MAN] Derrick Poole misses. Rebound secured by Tim Durant.

[06:44] Team_061 possession (Score: 67-104)
Desmond Morant attempts a 3Pt. Wide open! D'Angelo Porzingis is 6.5 feet away. [MAN] Desmond Morant misses. Offensive rebound by Tim Durant! Tim Durant's putback is no good. Rebound secured by Karl Leonard.

[06:29] Team_065 possession (Score: 67-104)
FOUL! Shooting foul on Desmond Morant. D'Angelo Porzingis to the line for 2 free throws. [Team fouls: 1] (Desmond Morant: 1 personal fouls)   FT 1/2: GOOD   FT 2/2: GOOD D'Angelo Porzingis makes 2/2 from the line.
Score: 67-106

[06:15] Team_061 possession (Score: 67-106)
FOUL! Shooting foul on Paul Curry. Gary Fox to the line for 3 free throws. [Team fouls: 2] (Paul Curry: 2 personal fouls)   FT 1/3: GOOD   FT 2/3: GOOD   FT 3/3: MISS Gary Fox makes 2/3 from the line. Offensive rebound by Tim Durant! Tim Durant puts it back in!
Score: 71-106

[06:01] Team_065 possession (Score: 71-106)
D'Angelo Porzingis attempts a Midrange. Contested by Desmond Morant (2.7 feet, MAN). D'ANGELO PORZINGIS MAKES IT!
Score: 71-108

[05:48] Team_061 possession (Score: 71-108)
Gary Fox drives and kicks out. Gary Fox attempts a 3Pt. Heavily contested by D'Angelo Porzingis (0.5 feet, ZONE)! Gary Fox misses. Rebound secured by D'Angelo Porzingis.

[05:35] Team_065 possession (Score: 71-108)
D'Angelo Porzingis attempts a 3Pt. Contested by Desmond Morant (5.8 feet, ZONE). D'ANGELO PORZINGIS MAKES IT! Assist: Karl Leonard
Score: 71-111

[05:21] Team_061 possession (Score: 71-111)
Gary Fox attempts a 3Pt. Heavily contested by D'Angelo Porzingis (1.6 feet, ZONE)! Gary Fox misses. Rebound secured by Karl Leonard.

[05:05] Team_065 possession (Score: 71-111)
FOUL! Offensive foul on D'Angelo Porzingis! Desmond Morant drew the charge! [Team fouls: 3] (D'Angelo Porzingis: 1 personal fouls) TURNOVER! (dead ball)

[04:52] Team_061 possession (Score: 71-111)
Desmond Morant attempts a 3Pt. Contested by D'Angelo Porzingis (3.8 feet, ZONE). Desmond Morant misses. Rebound secured by Vince Mobley.

[04:39] Team_065 possession (Score: 71-111)
Derrick Poole attempts a 3Pt. Contested by Desmond Morant (5.2 feet, ZONE). Derrick Poole misses. Rebound secured by Tim Durant.

[04:26] Team_061 possession (Score: 71-111)
Desmond Morant loses control! Ball rolls out of bounds! TURNOVER! (dead ball)

[04:15] Team_065 possession (Score: 71-111)
FOUL! Offensive foul on Vince Mobley! Tim Durant drew the charge! [Team fouls: 4] (Vince Mobley: 1 personal fouls) TURNOVER! (dead ball)

[04:04] Team_061 possession (Score: 71-111)
Stephen Towns drives and kicks out. Stephen Towns attempts a Midrange. Wide open! Derrick Poole is 7.2 feet away. [ZONE] Stephen Towns misses. FOUL! Loose ball foul on D'Angelo Porzingis during the rebound battle. [IN THE BONUS! 5 team fouls] Tim Durant to the line for 2 free throws. (D'Angelo Porzingis: 2 personal fouls)   FT 1/2: GOOD   FT 2/2: GOOD Tim Durant makes 2/2 from the line.
Score: 73-111

[03:47] Team_065 possession (Score: 73-111)
D'Angelo Porzingis attempts a 3Pt. Heavily contested by Desmond Morant (2.0 feet, MAN)! D'ANGELO PORZINGIS MAKES IT! Assist: Karl Leonard
Score: 73-114

[03:32] Team_061 possession (Score: 73-114)
Gary Fox drives, Vince Mobley stays with him. Gary Fox attempts a Layup. Wide open! Vince Mobley is 6.3 feet away. [ZONE] GARY FOX MAKES IT! Assist: Tim Durant
Score: 75-114

[03:20] Team_065 possession (Score: 75-114)
Derrick Poole drives, Tim Durant stays with him. Derrick Poole attempts a Layup. Heavily contested by Tim Durant (0.5 feet, ZONE)! DERRICK POOLE MAKES IT! Assist: D'Angelo Porzingis
Score: 75-116

[03:05] Team_061 possession (Score: 75-116)
Evan Rose attempts a 3Pt. Contested by Paul Curry (2.2 feet, MAN). Evan Rose misses. Rebound secured by Karl Leonard.

[02:49] Team_065 possession (Score: 75-116)
Vince Mobley drives to the basket... Vince Mobley throws a bad pass out of bounds! TURNOVER! (dead ball)

[02:36] Team_061 possession (Score: 75-116)
Evan Rose attempts a 3Pt. Wide open! Paul Curry is 7.4 feet away. [MAN] Evan Rose misses. Rebound secured by Vince Mobley.

[02:20] Team_065 possession (Score: 75-116)
D'Angelo Porzingis drives to the basket... D'Angelo Porzingis commits a violation (traveling/carry)! TURNOVER! (dead ball)

[02:06] Team_061 possession (Score: 75-116)
Tim Durant attempts a Midrange. Contested by Derrick Poole (4.3 feet, ZONE). Tim Durant misses. Offensive rebound by Tim Durant! Tim Durant's putback is no good. Rebound secured by Karl Leonard.

[01:53] Team_065 possession (Score: 75-116)
D'Angelo Porzingis drives and kicks out. Karl Leonard attempts a Midrange. Heavily contested by Stephen Towns (1.2 feet, MAN)! Karl Leonard misses. Rebound secured by Desmond Morant.

[01:34] Team_061 possession (Score: 75-116)
Stephen Towns drives, Karl Leonard stays with him. Stephen Towns attempts a Dunk. Contested by Karl Leonard (4.3 feet, MAN). STEPHEN TOWNS MAKES IT!
Score: 77-116

[01:17] Team_065 possession (Score: 77-116)
Karl Leonard drives and kicks out. Vince Mobley attempts a Midrange. Contested by Desmond Morant (4.1 feet, ZONE). VINCE MOBLEY MAKES IT!
Score: 77-118

[01:05] Team_061 possession (Score: 77-118)
Stephen Towns attempts a 3Pt. Wide open! Karl Leonard is 6.7 feet away. [MAN] STEPHEN TOWNS MAKES IT! Assist: Tim Durant
Score: 80-118

[00:51] Team_065 possession (Score: 80-118)
FOUL! Offensive foul on Vince Mobley! Tim Durant drew the charge! [Team fouls: 6] (Vince Mobley: 2 personal fouls) TURNOVER! (dead ball)

[00:36] Team_061 possession (Score: 80-118)
Evan Rose attempts a 3Pt. Contested by D'Angelo Porzingis (5.4 feet, ZONE). Evan Rose misses. Rebound secured by D'Angelo Porzingis.

[00:18] Team_065 possession (Score: 80-118)
Derrick Poole drives to the basket... Derrick Poole throws a bad pass! Stolen by Gary Fox! TURNOVER! (live ball)

[00:06] Team_061 possession (Score: 80-118)
Gary Fox loses the ball! Stripped by Derrick Poole! TURNOVER! (live ball)

================================================================================
                              4TH QUARTER COMPLETE                              
================================================================================

4TH QUARTER SCORE: Team_061 19, Team_065 29

BOX SCORE:
================================================================================

Team_061
--------------------------------------------------------------------------------
Player                MIN  PTS  REB  AST  TO      FG   FG%      3P   3P%
--------------------------------------------------------------------------------
Stephen Towns          18    7    1    0   0   3/4    75.0     0/0   0.0
Tim Durant             18    6    2    2   0   2/3    66.7     0/0   0.0
Evan Rose              19    2    0    0   0   1/6    16.7     0/0   0.0
Michael Russell        26    2    1    0   0   1/1   100.0     0/0   0.0
Gary Fox               22    2    0    1   0   1/5    20.0     0/0   0.0
Jayson Holiday         26    0    0    0   0   0/1     0.0     0/0   0.0
Karl Leonard           18    0    5    3   0   0/1     0.0     0/0   0.0
Desmond Morant         22    0    1    0   0   0/3     0.0     0/0   0.0

TEAM: FG: 8/23 (34.8%), 3PT: 2/10 (20.0%), REB: 7 (3 off, 4 def), AST: 3, TO: 3
TEAM FOULS: 1


Team_065
--------------------------------------------------------------------------------
Player                MIN  PTS  REB  AST  TO      FG   FG%      3P   3P%
--------------------------------------------------------------------------------
D'Angelo Porzingis     22   13    5    1   0   5/6    83.3     0/0   0.0
Derrick Poole          22    6    0    0   0   3/4    75.0     0/0   0.0
Paul Curry             24    4    0    0   0   2/3    66.7     0/0   0.0
Vince Mobley           22    4    5    0   0   2/2   100.0     0/0   0.0
Russell Wade           31    2    1    0   0   1/1   100.0     0/0   0.0
Manu McGrady           26    0    1    0   0   0/0     0.0     0/0   0.0

TEAM: FG: 13/17 (76.5%), 3PT: 3/5 (60.0%), REB: 15 (2 off, 13 def), AST: 4, TO: 8
TEAM FOULS: 6 [Team_061 in BONUS]

================================================================================

================================================================================
                               FULL GAME COMPLETE                               
================================================================================

FINAL SCORE: Team_061 80, Team_065 118

SCORING BY QUARTER:
--------------------------------------------------------------------------------
Team                     Q1     Q2     Q3     Q4    FINAL
--------------------------------------------------------------------------------
Team_061                 19     17     25     19       80
Team_065                 35     29     25     29      118
--------------------------------------------------------------------------------

FULL GAME BOX SCORE:
================================================================================

Team_061
--------------------------------------------------------------------------------
Player                MIN  PTS  REB  AST  TO      FG   FG%      3P   3P%      FT STL BLK
--------------------------------------------------------------------------------
Bam Sexton             31    8    7    2   2   4/6    66.7   0/1     0.0   2/2     1   0
Draymond Banchero      31   10    9    2   2   5/9    55.6   0/1     0.0   2/2     1   1
Brandon Russell        29   10    0    1   0   4/15   26.7   1/4    25.0   1/1     0   0
Jayson Holiday         26    4    0    3   3   3/8    37.5   0/2     0.0   4/4     0   0
Michael Russell        26   12    8    0   3   5/8    62.5   0/1     0.0   2/4     0   0
Gary Fox               22    4    0    1   1   3/9    33.3   2/4    50.0   2/3     2   0
Desmond Morant         22    7    3    0   2   3/8    37.5   1/4    25.0   0/0     0   0
Evan Rose              19    2    0    2   0   2/8    25.0   0/5     0.0   2/2     0   0
Stephen Towns          18    7    4    0   2   5/7    71.4   1/1   100.0   0/0     0   0
Tim Durant             18   12    8    3   0   1/3    33.3   0/1     0.0   2/2     0   0

TEAM: FG: 35/81 (43.2%), 3PT: 5/24 (20.8%), REB: 42 (11 off, 31 def), AST: 14, TO: 15


Team_065
--------------------------------------------------------------------------------
Player                MIN  PTS  REB  AST  TO      FG   FG%      3P   3P%      FT STL BLK
--------------------------------------------------------------------------------
Russell Wade           31   14   12    3   1   4/8    50.0   0/2     0.0   2/2     1   2
Paul Williamson        26   16    0    1   2   6/7    85.7   3/4    75.0   3/3     1   1
Manu McGrady           26   14    8    4   1   5/10   50.0   1/4    25.0   6/6     0   0
Karl Booker            26    6    0    1   1   3/6    50.0   1/1   100.0   3/4     0   0
RJ Harden              24   12    8    2   0   6/11   54.5   3/5    60.0   1/2     0   1
Paul Curry             24    7    0    1   1   3/9    33.3   1/6    16.7   0/0     0   0
Derrick Poole          22   13    0    1   1   5/7    71.4   0/2     0.0   2/2     1   2
D'Angelo Porzingis     22   20    6    3   1   8/10   80.0   4/5    80.0   2/2     1   1
Vince Mobley           22    9   11    0   4   4/5    80.0   0/0     0.0   1/3     0   0
Karl Leonard           18    5    6    3   2   4/7    57.1   1/1   100.0   3/3     0   0

TEAM: FG: 48/80 (60.0%), 3PT: 14/30 (46.7%), REB: 46 (7 off, 39 def), AST: 19, TO: 14

================================================================================
