================================================================================
                        FULL GAME - Team_094 vs Team_100                        
================================================================================

================================================================================
                       1ST QUARTER - Team_094 vs Team_100                       
================================================================================

[12:00] Team_094 possession (Score: 0-0)
Kobe Wagner attempts a 3Pt. Wide open! Tyler Griffin is 8.2 feet away. [MAN] Kobe Wagner misses. Offensive rebound by Kobe Bryant! Kobe Bryant's putback is no good. Rebound secured by Pau LaVine.

[11:41] Team_100 possession (Score: 0-0)
Tyler Griffin drives to the basket... Tyler Griffin throws a bad pass out of bounds! TURNOVER! (dead ball)

[11:28] Team_094 possession (Score: 0-0)
Tim Russell attempts a 3Pt. Wide open! Pau LaVine is 7.4 feet away. [MAN] TIM RUSSELL MAKES IT!
Score: 3-0

[11:13] Team_100 possession (Score: 3-0)
Manu Ball attempts a 3Pt. Wide open! Kobe Wagner is 6.5 feet away. [ZONE] Manu Ball misses. Offensive rebound by Pau LaVine! Pau LaVine kicks it out.

[10:55] Team_100 possession (Score: 3-0)
Pau LaVine attempts a 3Pt. Contested by Tim Russell (5.2 feet, MAN). Pau LaVine misses. Rebound secured by Kobe Wagner.

[10:40] Team_094 possession (Score: 3-0)
Terry Ingram drives and kicks out. Lauri Thompson attempts a Midrange. Wide open! Pau LaVine is 6.8 feet away. [ZONE] Lauri Thompson misses. Rebound secured by Chris Mobley.

[10:30] Team_100 possession (Score: 3-0)
FOUL! Shooting foul on Lauri Thompson. Chris Mobley to the line for 2 free throws. [Team fouls: 1] (Lauri Thompson: 1 personal fouls)   FT 1/2: GOOD   FT 2/2: MISS Chris Mobley makes 1/2 from the line. FOUL! Loose ball foul on Kobe Wagner during the free throw rebound! [Team fouls: 2] No free throws, side out. (Kobe Wagner: 1 personal fouls)
Score: 3-1

[10:17] Team_100 possession (Score: 3-1)
Pau LaVine attempts a 3Pt. Contested by Kobe Wagner (3.6 feet, ZONE). Pau LaVine misses. Offensive rebound by Pau LaVine! Pau LaVine kicks it out.

[10:01] Team_100 possession (Score: 3-1)
Luka Green commits a violation (traveling/carry)! TURNOVER! (dead ball)

[09:46] Team_094 possession (Score: 3-1)
Kobe Bryant loses control! Ball rolls out of bounds! TURNOVER! (dead ball)

[09:31] Team_100 possession (Score: 3-1)
Tyler Griffin drives, Tim Russell stays with him. Tyler Griffin attempts a Layup. Contested by Tim Russell (3.9 feet, ZONE). TYLER GRIFFIN MAKES IT! Assist: Chris Mobley
Score: 3-3

[09:14] Team_094 possession (Score: 3-3)
Kobe Bryant drives, picks up Chris Mobley. Help arrives from Manu Ball! Kobe Bryant attempts a Layup. Contested by Manu Ball (2.9 feet, MAN). KOBE BRYANT MAKES IT! Assist: Terry Ingram
Score: 5-3

[09:00] Team_100 possession (Score: 5-3)
Luka Green attempts a 3Pt. Contested by Terry Ingram (4.8 feet, MAN). LUKA GREEN MAKES IT!
Score: 5-6

[08:45] Team_094 possession (Score: 5-6)
Tim Russell makes the Layup and draws the foul on Pau LaVine! And-1! Tim Russell to the line for 1. [Team fouls: 1] (Pau LaVine: 1 personal fouls)   FT 1/1: GOOD Tim Russell makes 1/1 from the line.
Score: 8-6

[08:35] Team_100 possession (Score: 8-6)
Chris Mobley attempts a Layup. BLOCKED BY TIM RUSSELL! Ball goes out off Tim Russell. Chris Mobley's ball!

[08:20] Team_100 possession (Score: 8-6)
Pau LaVine drives and kicks out. Chris Mobley attempts a Midrange. Heavily contested by Terry Ingram (1.5 feet, ZONE)! CHRIS MOBLEY MAKES IT!
Score: 8-8

[08:01] Team_094 possession (Score: 8-8)
FOUL! Shooting foul on Pau LaVine. Lauri Thompson to the line for 2 free throws. [Team fouls: 2] (Pau LaVine: 2 personal fouls)   FT 1/2: GOOD   FT 2/2: MISS Lauri Thompson makes 1/2 from the line. Rebound secured by Pau LaVine.
Score: 9-8

[07:44] Team_100 possession (Score: 9-8)
Manu Ball drives, picks up Lauri Thompson. Help arrives from Kobe Wagner! Manu Ball attempts a Layup. Heavily contested by Kobe Wagner (0.5 feet, MAN)! Manu Ball misses. Offensive rebound by Chris Mobley! Chris Mobley kicks it out.

[07:27] Team_100 possession (Score: 9-8)
Manu Ball attempts a Layup. Contested by Lauri Thompson (4.8 feet, MAN). Manu Ball misses. Offensive rebound by Pau LaVine! Pau LaVine kicks it out.

[07:10] Team_100 possession (Score: 9-8)
Tyler Griffin attempts a 3Pt. Heavily contested by Kobe Wagner (1.4 feet, ZONE)! TYLER GRIFFIN MAKES IT! Assist: Chris Mobley
Score: 9-11

[06:56] Team_094 possession (Score: 9-11)
Kobe Bryant drives, Pau LaVine stays with him. Kobe Bryant attempts a Dunk. Contested by Pau LaVine (2.7 feet, ZONE). KOBE BRYANT MAKES IT! Assist: Tim Russell
Score: 11-11

[06:42] Team_100 possession (Score: 11-11)
Manu Ball attempts a 3Pt. Contested by Kobe Wagner (5.0 feet, ZONE). Manu Ball misses. Rebound secured by Tim Russell.

[06:26] Team_094 possession (Score: 11-11)
Lauri Thompson attempts a Layup. BLOCKED BY PAU LAVINE! Ball is loose! Rebound secured by Tyler Griffin.

[06:10] Team_100 possession (Score: 11-11)
FOUL! Offensive foul on Chris Mobley! Kobe Bryant drew the charge! [Team fouls: 3] (Chris Mobley: 1 personal fouls) TURNOVER! (dead ball)

[05:57] Team_094 possession (Score: 11-11)
Tim Russell attempts a Midrange. Contested by Pau LaVine (4.2 feet, MAN). Tim Russell misses. Offensive rebound by Kobe Bryant! Kobe Bryant's putback is no good. Rebound secured by Tyler Griffin.

[05:45] Team_100 possession (Score: 11-11)
Pau LaVine drives and kicks out. Pau LaVine attempts a 3Pt. BLOCKED BY TIM RUSSELL! Ball is loose! Rebound secured by Kobe Bryant.

[05:35] Team_094 possession (Score: 11-11)
Lauri Thompson makes the Layup and draws the foul on Manu Ball! And-1! Lauri Thompson to the line for 1. [Team fouls: 4] (Manu Ball: 1 personal fouls)   FT 1/1: GOOD Lauri Thompson makes 1/1 from the line.
Score: 14-11

[05:21] Team_100 possession (Score: 14-11)
Pau LaVine attempts a 3Pt. Contested by Tim Russell (5.2 feet, MAN). Pau LaVine misses. Offensive rebound by Chris Mobley! Chris Mobley kicks it out.

[05:04] Team_100 possession (Score: 14-11)
Chris Mobley loses the ball! Stripped by Kobe Bryant! TURNOVER! (live ball)

[04:50] Team_094 possession (Score: 14-11)
Kobe Wagner attempts a 3Pt. Contested by Tyler Griffin (2.1 feet, MAN). Kobe Wagner misses. Offensive rebound by Kobe Bryant! Kobe Bryant's putback is no good. Rebound secured by Tyler Griffin.

[04:38] Team_100 possession (Score: 14-11)
Chris Mobley drives to the basket... FOUL! Offensive foul on Chris Mobley! Kobe Bryant drew the charge! [Team fouls: 5] (Chris Mobley: 2 personal fouls) TURNOVER! (dead ball)

[04:23] Team_094 possession (Score: 14-11)
Kobe Wagner attempts a Midrange. Contested by Tyler Griffin (5.7 feet, MAN). Kobe Wagner misses. Rebound secured by Pau LaVine.

[04:09] Team_100 possession (Score: 14-11)
Tyler Griffin loses control! Ball rolls out of bounds! TURNOVER! (dead ball)

[03:55] Team_094 possession (Score: 14-11)
Lauri Thompson attempts a Midrange. Wide open! Manu Ball is 9.8 feet away. [MAN] LAURI THOMPSON MAKES IT! Assist: Terry Ingram
Score: 16-11

[03:45] Team_100 possession (Score: 16-11)
Chris Mobley makes the Layup and draws the foul on Tim Russell! And-1! Chris Mobley to the line for 1. [Team fouls: 3] (Tim Russell: 1 personal fouls)   FT 1/1: GOOD Chris Mobley makes 1/1 from the line.
Score: 16-14

[03:33] Team_094 possession (Score: 16-14)
Kobe Bryant attempts a Midrange. Wide open! Tyler Griffin is 7.0 feet away. [ZONE] KOBE BRYANT MAKES IT! Assist: Tim Russell
Score: 18-14

[03:18] Team_100 possession (Score: 18-14)
FOUL! Reach-in foul on Kobe Bryant during the drive. [Team fouls: 4] No free throws, side out. (Kobe Bryant: 1 personal fouls)

[02:58] Team_100 possession (Score: 18-14)
FOUL! Reach-in foul on Tim Russell during the drive. [IN THE BONUS! 5 team fouls] Pau LaVine to the line for 2 free throws. (Tim Russell: 2 personal fouls)   FT 1/2: GOOD   FT 2/2: GOOD Pau LaVine makes 2/2 from the line.
Score: 18-16

[02:44] Team_094 possession (Score: 18-16)
Tim Russell attempts a Midrange. Contested by Pau LaVine (4.5 feet, ZONE). TIM RUSSELL MAKES IT! Assist: Lauri Thompson
Score: 20-16

[02:30] Team_100 possession (Score: 20-16)
Luka Green attempts a 3Pt. Heavily contested by Terry Ingram (2.0 feet, MAN)! LUKA GREEN MAKES IT! Assist: Chris Mobley
Score: 20-19

[02:13] Team_094 possession (Score: 20-19)
Kobe Bryant attempts a Layup. Heavily contested by Chris Mobley (1.9 feet, MAN)! KOBE BRYANT MAKES IT! Assist: Kobe Wagner
Score: 22-19

[02:03] Team_100 possession (Score: 22-19)
Chris Mobley attempts a 3Pt. Contested by Kobe Wagner (4.4 feet, ZONE). Chris Mobley misses. Offensive rebound by Pau LaVine! Pau LaVine kicks it out.

[01:51] Team_100 possession (Score: 22-19)
Tyler Griffin makes the Midrange and draws the foul on Lauri Thompson! And-1! Tyler Griffin to the line for 1. [BONUS: 6 team fouls] (Lauri Thompson: 2 personal fouls)   FT 1/1: GOOD Tyler Griffin makes 1/1 from the line.
Score: 22-22

[01:34] Team_094 possession (Score: 22-22)
Lauri Thompson attempts a 3Pt. Contested by Manu Ball (5.9 feet, MAN). Lauri Thompson misses. FOUL! Loose ball foul on Chris Mobley during the rebound battle. [IN THE BONUS! 6 team fouls] Tim Russell to the line for 2 free throws. (Chris Mobley: 3 personal fouls)   FT 1/2: MISS   FT 2/2: GOOD Tim Russell makes 1/2 from the line.
Score: 23-22

[01:19] Team_100 possession (Score: 23-22)
Tyler Griffin attempts a 3Pt. Wide open! Kobe Wagner is 6.5 feet away. [MAN] TYLER GRIFFIN MAKES IT! Assist: Chris Mobley
Score: 23-25

[01:05] Team_094 possession (Score: 23-25)
FOUL! Holding foul on Luka Green. [IN THE BONUS! 7 team fouls] Terry Ingram to the line for 2 free throws. (Luka Green: 1 personal fouls)   FT 1/2: MISS   FT 2/2: GOOD Terry Ingram makes 1/2 from the line.
Score: 24-25

[00:54] Team_100 possession (Score: 24-25)
Chris Mobley attempts a Midrange. Wide open! Kobe Bryant is 6.5 feet away. [MAN] CHRIS MOBLEY MAKES IT!
Score: 24-27

[00:41] Team_094 possession (Score: 24-27)
Tim Russell makes the Layup and draws the foul on Pau LaVine! And-1! Tim Russell to the line for 1. [BONUS: 8 team fouls] (Pau LaVine: 3 personal fouls)   FT 1/1: MISS Tim Russell makes 0/1 from the line. Rebound secured by Chris Mobley.
Score: 26-27

[00:29] Team_100 possession (Score: 26-27)
Pau LaVine attempts a 3Pt. Wide open! Tim Russell is 6.4 feet away. [MAN] Pau LaVine misses. Rebound secured by Tim Russell.

[00:14] Team_094 possession (Score: 26-27)
Kobe Bryant drives, picks up Chris Mobley. Help arrives from Manu Ball! Kobe Bryant attempts a Layup. Contested by Manu Ball (4.9 feet, MAN). KOBE BRYANT MAKES IT! Assist: Tim Russell
Score: 28-27

================================================================================
                              1ST QUARTER COMPLETE                              
================================================================================

1ST QUARTER SCORE: Team_094 28, Team_100 27

BOX SCORE:
================================================================================

Team_094
--------------------------------------------------------------------------------
Player                MIN  PTS  REB  AST  TO      FG   FG%      3P   3P%
--------------------------------------------------------------------------------
Kobe Bryant            12   10    1    0   0   5/5   100.0     0/0   0.0
Tim Russell            12    9    2    3   0   4/6    66.7     0/0   0.0
Lauri Thompson         12    5    0    1   0   2/4    50.0     0/0   0.0
Terry Ingram           12    1    0    2   0   1/2    50.0     0/0   0.0
Kobe Wagner            12    0    1    1   0   0/3     0.0     0/0   0.0

TEAM: FG: 12/20 (60.0%), 3PT: 2/4 (50.0%), REB: 7 (3 off, 4 def), AST: 7, TO: 1
TEAM FOULS: 6 [Team_100 in BONUS]


Team_100
--------------------------------------------------------------------------------
Player                MIN  PTS  REB  AST  TO      FG   FG%      3P   3P%
--------------------------------------------------------------------------------
Tyler Griffin          12   11    3    0   0   4/4   100.0     0/0   0.0
Chris Mobley           12    7    4    4   0   3/3   100.0     0/0   0.0
Luka Green             12    6    0    0   0   2/2   100.0     0/0   0.0
Pau LaVine             12    2    8    0   0   1/4    25.0     0/0   0.0
Manu Ball              12    0    0    0   0   0/1     0.0     0/0   0.0

TEAM: FG: 10/14 (71.4%), 3PT: 4/7 (57.1%), REB: 12 (7 off, 5 def), AST: 4, TO: 6
TEAM FOULS: 8 [Team_094 in BONUS]

================================================================================

================================================================================
                       2ND QUARTER - Team_094 vs Team_100                       
================================================================================

[12:00] Team_094 possession (Score: 28-27)
Terry Ingram attempts a 3Pt. Contested by Luka Green (4.8 feet, MAN). Terry Ingram misses. Rebound secured by Tyler Griffin.

[11:45] Team_100 possession (Score: 28-27)
Tyler Griffin attempts a 3Pt. Wide open! Kobe Wagner is 8.0 feet away. [MAN] Tyler Griffin misses. Rebound secured by Tim Russell.

[11:27] Team_094 possession (Score: 28-27)
Kobe Wagner attempts a 3Pt. Wide open! Luka Green is 6.1 feet away. [ZONE] Kobe Wagner misses. Rebound secured by Pau LaVine.

[11:10] Team_100 possession (Score: 28-27)
Luka Green attempts a Layup. Wide open! Terry Ingram is 7.9 feet away. [MAN] LUKA GREEN MAKES IT! Assist: Manu Ball
Score: 28-29

[10:53] Team_094 possession (Score: 28-29)
Lauri Thompson attempts a 3Pt. Contested by Manu Ball (5.8 feet, MAN). Lauri Thompson misses. Rebound secured by Tyler Griffin.

[10:40] Team_100 possession (Score: 28-29)
Tyler Griffin attempts a 3Pt. Wide open! Terry Ingram is 6.1 feet away. [ZONE] Tyler Griffin misses. Rebound secured by Tim Russell.

[10:25] Team_094 possession (Score: 28-29)
Kobe Wagner attempts a 3Pt. Contested by Tyler Griffin (2.7 feet, MAN). Kobe Wagner misses. FOUL! Loose ball foul on Chris Mobley during the rebound battle. [Team fouls: 1] No free throws, side out. (Chris Mobley: 1 personal fouls)

[10:09] Team_094 possession (Score: 28-29)
FOUL! Holding foul on Manu Ball. [Team fouls: 2] No free throws, side out. (Manu Ball: 1 personal fouls)

[09:55] Team_094 possession (Score: 28-29)
Terry Ingram attempts a 3Pt. Wide open! Luka Green is 7.4 feet away. [ZONE] Terry Ingram misses. Rebound secured by Pau LaVine.

[09:43] Team_100 possession (Score: 28-29)
Luka Green attempts a Midrange. Wide open! Tim Russell is 6.6 feet away. [ZONE] LUKA GREEN MAKES IT!
Score: 28-31

[09:29] Team_094 possession (Score: 28-31)
Kobe Wagner attempts a Layup. Contested by Pau LaVine (2.4 feet, ZONE). KOBE WAGNER MAKES IT! Assist: Terry Ingram
Score: 30-31

[09:15] Team_100 possession (Score: 30-31)
FOUL! Holding foul on Kobe Bryant. [Team fouls: 1] No free throws, side out. (Kobe Bryant: 1 personal fouls)

[09:01] Team_100 possession (Score: 30-31)
FOUL! Reach-in foul on Kobe Bryant during the drive. [Team fouls: 2] No free throws, side out. (Kobe Bryant: 2 personal fouls)

[08:44] Team_100 possession (Score: 30-31)
Luka Green attempts a Midrange. Contested by Terry Ingram (3.1 feet, MAN). Luka Green misses. Offensive rebound by Chris Mobley! Chris Mobley kicks it out.

[08:31] Team_100 possession (Score: 30-31)
Chris Mobley drives, Tim Russell stays with him. Chris Mobley attempts a Dunk. Contested by Tim Russell (4.1 feet, ZONE). CHRIS MOBLEY MAKES IT!
Score: 30-33

[08:16] Team_094 possession (Score: 30-33)
Terry Ingram attempts a Layup. Wide open! Pau LaVine is 6.0 feet away. [ZONE] TERRY INGRAM MAKES IT!
Score: 32-33

[08:01] Team_100 possession (Score: 32-33)
Tyler Griffin attempts a 3Pt. Contested by Kobe Wagner (5.0 feet, MAN). TYLER GRIFFIN MAKES IT! Assist: Chris Mobley
Score: 32-36

[07:45] Team_094 possession (Score: 32-36)
Kobe Bryant drives, picks up Chris Mobley. Help arrives from Manu Ball! Kobe Bryant attempts a Dunk. Wide open! Manu Ball is 6.8 feet away. [MAN] KOBE BRYANT MAKES IT! Assist: Tim Russell
Score: 34-36

[07:33] Team_100 possession (Score: 34-36)
Tyler Griffin loses control! Ball rolls out of bounds! TURNOVER! (dead ball)

[07:33] Substitution (Team_094): Terry Ingram OUT → Shaquille Bryant IN (stamina_rule2)

[07:33] Substitution (Team_094): Lauri Thompson OUT → Kevin Rozier IN (stamina_rule2)

[07:33] Substitution (Team_094): Kobe Wagner OUT → Ayo Gasol IN (stamina_rule2)

[07:33] Substitution (Team_094): Tim Russell OUT → Domantas Haliburton IN (stamina_rule2)

[07:33] Substitution (Team_094): Kobe Bryant OUT → Isaiah Quickley IN (stamina_rule2)

[07:33] Substitution (Team_100): Luka Green OUT → Dirk Sabonis IN (stamina_rule2)

[07:33] Substitution (Team_100): Manu Ball OUT → Evan Butler IN (stamina_rule2)

[07:33] Substitution (Team_100): Tyler Griffin OUT → Tyrese Wade IN (stamina_rule2)

[07:33] Substitution (Team_100): Pau LaVine OUT → Carmelo Ginobili IN (stamina_rule2)

[07:33] Substitution (Team_100): Chris Mobley OUT → John Rozier IN (stamina_rule2)

[07:16] Team_094 possession (Score: 34-36)
Shaquille Bryant drives, Dirk Sabonis stays with him. Shaquille Bryant attempts a Dunk. Wide open! Dirk Sabonis is 9.7 feet away. [MAN] Shaquille Bryant misses. Rebound secured by John Rozier.

[07:03] Team_100 possession (Score: 34-36)
John Rozier attempts a Layup. Contested by Isaiah Quickley (3.7 feet, ZONE). JOHN ROZIER MAKES IT!
Score: 34-38

[06:51] Team_094 possession (Score: 34-38)
Domantas Haliburton attempts a Layup. BLOCKED BY JOHN ROZIER! Ball is loose! Rebound secured by Carmelo Ginobili.

[06:39] Team_100 possession (Score: 34-38)
FOUL! Offensive foul on Carmelo Ginobili! Domantas Haliburton drew the charge! [Team fouls: 3] (Carmelo Ginobili: 1 personal fouls) TURNOVER! (dead ball)

[06:21] Team_094 possession (Score: 34-38)
Shaquille Bryant loses the ball! Stripped by Dirk Sabonis! TURNOVER! (live ball)

[06:09] Team_100 possession (Score: 34-38)
Evan Butler makes the Midrange and draws the foul on Kevin Rozier! And-1! Evan Butler to the line for 1. [Team fouls: 3] (Kevin Rozier: 1 personal fouls)   FT 1/1: GOOD Evan Butler makes 1/1 from the line.
Score: 34-41

[05:56] Team_094 possession (Score: 34-41)
Ayo Gasol attempts a 3Pt. Contested by Tyrese Wade (5.2 feet, MAN). Ayo Gasol misses. Offensive rebound by Isaiah Quickley! Isaiah Quickley kicks it out.

[05:38] Team_094 possession (Score: 34-41)
Shaquille Bryant attempts a 3Pt. Contested by Tyrese Wade (2.7 feet, ZONE). Shaquille Bryant misses. Rebound secured by Carmelo Ginobili.

[05:23] Team_100 possession (Score: 34-41)
Tyrese Wade drives to the basket... Tyrese Wade throws a bad pass! Stolen by Isaiah Quickley! TURNOVER! (live ball)

[05:10] Team_094 possession (Score: 34-41)
Kevin Rozier attempts a Layup. BLOCKED BY EVAN BUTLER! Ball goes out off Evan Butler. Kevin Rozier's ball!

[04:54] Team_094 possession (Score: 34-41)
Shaquille Bryant attempts a 3Pt. Contested by Dirk Sabonis (4.4 feet, MAN). Shaquille Bryant misses. Rebound secured by John Rozier.

[04:40] Team_100 possession (Score: 34-41)
Dirk Sabonis attempts a Layup. BLOCKED BY SHAQUILLE BRYANT! Ball is loose! Rebound secured by Isaiah Quickley.

[04:22] Team_094 possession (Score: 34-41)
Shaquille Bryant attempts a 3Pt. Contested by Dirk Sabonis (2.6 feet, MAN). Shaquille Bryant misses. Rebound secured by Carmelo Ginobili.

[04:10] Team_100 possession (Score: 34-41)
Carmelo Ginobili drives to the basket... Carmelo Ginobili loses the ball! Stripped by Domantas Haliburton! TURNOVER! (live ball)

[03:57] Team_094 possession (Score: 34-41)
Kevin Rozier drives, Evan Butler stays with him. Kevin Rozier attempts a Dunk. Wide open! Evan Butler is 6.7 feet away. [MAN] Kevin Rozier misses. Rebound secured by John Rozier.

[03:41] Team_100 possession (Score: 34-41)
FOUL! Shooting foul on Shaquille Bryant. Dirk Sabonis to the line for 2 free throws. [Team fouls: 4] (Shaquille Bryant: 1 personal fouls)   FT 1/2: GOOD   FT 2/2: GOOD Dirk Sabonis makes 2/2 from the line.
Score: 34-43

[03:26] Team_094 possession (Score: 34-43)
Domantas Haliburton attempts a Midrange. Contested by Carmelo Ginobili (5.6 feet, MAN). DOMANTAS HALIBURTON MAKES IT!
Score: 36-43

[03:11] Team_100 possession (Score: 36-43)
John Rozier drives and kicks out. Evan Butler attempts a 3Pt. Wide open! Domantas Haliburton is 9.2 feet away. [ZONE] Evan Butler misses. Rebound secured by Isaiah Quickley.

[02:55] Team_094 possession (Score: 36-43)
FOUL! Reach-in foul on Evan Butler during the drive. [Team fouls: 4] No free throws, side out. (Evan Butler: 1 personal fouls)

[02:41] Team_094 possession (Score: 36-43)
Shaquille Bryant attempts a 3Pt. Contested by Dirk Sabonis (2.8 feet, MAN). Shaquille Bryant misses. Rebound secured by Carmelo Ginobili.

[02:25] Team_100 possession (Score: 36-43)
Evan Butler attempts a 3Pt. Contested by Kevin Rozier (5.1 feet, MAN). Evan Butler misses. Rebound secured by Isaiah Quickley.

[02:14] Team_094 possession (Score: 36-43)
Domantas Haliburton attempts a Layup. Contested by John Rozier (2.5 feet, ZONE). DOMANTAS HALIBURTON MAKES IT!
Score: 38-43

[02:02] Team_100 possession (Score: 38-43)
Dirk Sabonis attempts a 3Pt. Wide open! Kevin Rozier is 6.5 feet away. [ZONE] Dirk Sabonis misses. Rebound secured by Domantas Haliburton.

[01:46] Team_094 possession (Score: 38-43)
FOUL! Shooting foul on Dirk Sabonis. Shaquille Bryant to the line for 2 free throws. [BONUS: 5 team fouls] (Dirk Sabonis: 1 personal fouls)   FT 1/2: GOOD   FT 2/2: GOOD Shaquille Bryant makes 2/2 from the line.
Score: 40-43

[01:27] Team_100 possession (Score: 40-43)
Evan Butler attempts a 3Pt. Contested by Domantas Haliburton (5.1 feet, ZONE). Evan Butler misses. Rebound secured by Ayo Gasol.

[01:13] Team_094 possession (Score: 40-43)
FOUL! Holding foul on Tyrese Wade. [IN THE BONUS! 6 team fouls] Ayo Gasol to the line for 2 free throws. (Tyrese Wade: 1 personal fouls)   FT 1/2: MISS   FT 2/2: GOOD Ayo Gasol makes 1/2 from the line.
Score: 41-43

[01:04] Team_100 possession (Score: 41-43)
John Rozier attempts a Midrange. Contested by Isaiah Quickley (4.9 feet, MAN). John Rozier misses. Rebound secured by Isaiah Quickley.

[00:51] Team_094 possession (Score: 41-43)
Kevin Rozier attempts a 3Pt. Contested by Tyrese Wade (4.5 feet, ZONE). KEVIN ROZIER MAKES IT! Assist: Ayo Gasol
Score: 44-43

[00:35] Team_100 possession (Score: 44-43)
Carmelo Ginobili attempts a Midrange. Wide open! Domantas Haliburton is 7.6 feet away. [MAN] Carmelo Ginobili misses. Rebound secured by Ayo Gasol.

[00:21] Team_094 possession (Score: 44-43)
Ayo Gasol attempts a Midrange. Contested by Tyrese Wade (4.6 feet, ZONE). AYO GASOL MAKES IT!
Score: 46-43

[00:09] Team_100 possession (Score: 46-43)
Carmelo Ginobili makes the Dunk and draws the foul on Kevin Rozier! And-1! Carmelo Ginobili to the line for 1. [BONUS: 5 team fouls] (Kevin Rozier: 2 personal fouls)   FT 1/1: MISS Carmelo Ginobili makes 0/1 from the line. Rebound secured by Isaiah Quickley.
Score: 46-45

================================================================================
                              2ND QUARTER COMPLETE                              
================================================================================

2ND QUARTER SCORE: Team_094 18, Team_100 18

BOX SCORE:
================================================================================

Team_094
--------------------------------------------------------------------------------
Player                MIN  PTS  REB  AST  TO      FG   FG%      3P   3P%
--------------------------------------------------------------------------------
Domantas Haliburton     7    4    1    0   0   2/3    66.7     0/0   0.0
Kevin Rozier            7    3    0    0   0   1/2    50.0     0/0   0.0
Ayo Gasol               7    3    2    1   0   2/2   100.0     0/0   0.0
Terry Ingram           17    2    0    1   0   1/3    33.3     0/0   0.0
Kobe Wagner            17    2    0    0   0   1/2    50.0     0/0   0.0
Kobe Bryant            17    2    0    0   0   1/1   100.0     0/0   0.0
Shaquille Bryant        7    2    0    0   0   1/6    16.7     0/0   0.0
Tim Russell            17    0    3    1   0   0/0     0.0     0/0   0.0
Lauri Thompson         17    0    0    0   0   0/1     0.0     0/0   0.0
Isaiah Quickley         7    0    6    0   0   0/0     0.0     0/0   0.0

TEAM: FG: 9/20 (45.0%), 3PT: 1/9 (11.1%), REB: 12 (2 off, 10 def), AST: 3, TO: 1
TEAM FOULS: 5 [Team_100 in BONUS]


Team_100
--------------------------------------------------------------------------------
Player                MIN  PTS  REB  AST  TO      FG   FG%      3P   3P%
--------------------------------------------------------------------------------
Luka Green             17    4    0    0   0   2/2   100.0     0/0   0.0
Tyler Griffin          17    3    2    0   0   1/3    33.3     0/0   0.0
Evan Butler             7    3    0    0   0   1/3    33.3     0/0   0.0
Chris Mobley           17    2    1    1   0   1/1   100.0     0/0   0.0
John Rozier             7    2    3    0   0   1/3    33.3     0/0   0.0
Dirk Sabonis            7    2    0    0   0   1/3    33.3     0/0   0.0
Pau LaVine             17    0    2    0   0   0/0     0.0     0/0   0.0
Manu Ball              17    0    0    1   0   0/0     0.0     0/0   0.0
Carmelo Ginobili        7    0    4    0   0   0/2     0.0     0/0   0.0

TEAM: FG: 7/17 (41.2%), 3PT: 1/6 (16.7%), REB: 12 (1 off, 11 def), AST: 2, TO: 4
TEAM FOULS: 6 [Team_094 in BONUS]

================================================================================

================================================================================
                       3RD QUARTER - Team_094 vs Team_100                       
================================================================================

[12:00] Team_094 possession (Score: 46-45)
Tim Russell attempts a Layup. Contested by Pau LaVine (2.3 feet, MAN). TIM RUSSELL MAKES IT!
Score: 48-45

[11:46] Team_100 possession (Score: 48-45)
FOUL! Reach-in foul on Terry Ingram during the drive. [Team fouls: 1] No free throws, side out. (Terry Ingram: 1 personal fouls)

[11:33] Team_100 possession (Score: 48-45)
Manu Ball attempts a 3Pt. Wide open! Kobe Wagner is 6.2 feet away. [ZONE] MANU BALL MAKES IT! Assist: Pau LaVine
Score: 48-48

[11:20] Team_094 possession (Score: 48-48)
Terry Ingram drives, Luka Green stays with him. Terry Ingram attempts a Dunk. Heavily contested by Luka Green (1.4 feet, MAN)! Terry Ingram misses. Offensive rebound by Tim Russell! Tim Russell kicks it out.

[11:08] Team_094 possession (Score: 48-48)
Kobe Bryant attempts a Midrange. Contested by Chris Mobley (5.5 feet, MAN). Kobe Bryant misses. Rebound secured by Pau LaVine.

[10:53] Team_100 possession (Score: 48-48)
Pau LaVine attempts a Layup. Contested by Tim Russell (5.5 feet, ZONE). PAU LAVINE MAKES IT!
Score: 48-50

[10:35] Team_094 possession (Score: 48-50)
Kobe Bryant attempts a Layup. Contested by Chris Mobley (4.2 feet, MAN). KOBE BRYANT MAKES IT!
Score: 50-50

[10:21] Team_100 possession (Score: 50-50)
Manu Ball drives and kicks out. Pau LaVine attempts a 3Pt. Contested by Kobe Wagner (2.5 feet, ZONE). PAU LAVINE MAKES IT! Assist: Manu Ball
Score: 50-53

[10:10] Team_094 possession (Score: 50-53)
Terry Ingram drives, Pau LaVine stays with him. Terry Ingram attempts a Layup. Wide open! Pau LaVine is 6.2 feet away. [ZONE] TERRY INGRAM MAKES IT!
Score: 52-53

[09:53] Team_100 possession (Score: 52-53)
Manu Ball attempts a Midrange. Contested by Lauri Thompson (5.1 feet, MAN). Manu Ball misses. Rebound secured by Kobe Wagner.

[09:44] Team_094 possession (Score: 52-53)
Tim Russell attempts a Midrange. Wide open! Pau LaVine is 6.2 feet away. [ZONE] Tim Russell misses. Offensive rebound by Tim Russell! Tim Russell kicks it out.

[09:31] Team_094 possession (Score: 52-53)
FOUL! Holding foul on Chris Mobley. [Team fouls: 1] No free throws, side out. (Chris Mobley: 1 personal fouls)

[09:14] Team_094 possession (Score: 52-53)
Kobe Wagner attempts a 3Pt. Wide open! Tyler Griffin is 6.0 feet away. [MAN] Kobe Wagner misses. Rebound secured by Pau LaVine.

[09:00] Team_100 possession (Score: 52-53)
Luka Green throws a bad pass out of bounds! TURNOVER! (dead ball)

[08:46] Team_094 possession (Score: 52-53)
Kobe Bryant attempts a Layup. BLOCKED BY CHRIS MOBLEY! Ball deflects out of bounds off Kobe Bryant.

[08:30] Team_100 possession (Score: 52-53)
Tyler Griffin attempts a 3Pt. Contested by Kobe Wagner (4.6 feet, ZONE). TYLER GRIFFIN MAKES IT! Assist: Chris Mobley
Score: 52-56

[08:16] Team_094 possession (Score: 52-56)
Lauri Thompson attempts a 3Pt. Wide open! Manu Ball is 6.2 feet away. [MAN] Lauri Thompson misses. Rebound secured by Tyler Griffin.

[08:05] Team_100 possession (Score: 52-56)
Tyler Griffin throws a bad pass! Stolen by Kobe Wagner! TURNOVER! (live ball)

[07:55] Team_094 possession (Score: 52-56)
Lauri Thompson attempts a 3Pt. Wide open! Manu Ball is 6.6 feet away. [MAN] LAURI THOMPSON MAKES IT!
Score: 55-56

[07:42] Team_100 possession (Score: 55-56)
Tyler Griffin attempts a 3Pt. Contested by Kobe Wagner (4.5 feet, ZONE). Tyler Griffin misses. Rebound secured by Kobe Wagner.

[07:24] Team_094 possession (Score: 55-56)
Tim Russell attempts a Midrange. Wide open! Manu Ball is 6.7 feet away. [ZONE] TIM RUSSELL MAKES IT! Assist: Terry Ingram
Score: 57-56

[07:07] Team_100 possession (Score: 57-56)
Tyler Griffin attempts a 3Pt. Contested by Tim Russell (5.7 feet, ZONE). Tyler Griffin misses. Rebound secured by Kobe Wagner.

[06:53] Team_094 possession (Score: 57-56)
Kobe Bryant drives and kicks out. Kobe Bryant attempts a 3Pt. Contested by Chris Mobley (2.9 feet, MAN). KOBE BRYANT MAKES IT! Assist: Tim Russell
Score: 60-56

[06:40] Team_100 possession (Score: 60-56)
Tyler Griffin attempts a 3Pt. Wide open! Lauri Thompson is 6.4 feet away. [ZONE] Tyler Griffin misses. Rebound secured by Kobe Bryant.

[06:25] Team_094 possession (Score: 60-56)
FOUL! Shooting foul on Pau LaVine. Kobe Bryant to the line for 2 free throws. [Team fouls: 2] (Pau LaVine: 1 personal fouls)   FT 1/2: MISS   FT 2/2: GOOD Kobe Bryant makes 1/2 from the line.
Score: 61-56

[06:13] Team_100 possession (Score: 61-56)
Luka Green makes the 3Pt and draws the foul on Kobe Wagner! And-1! Luka Green to the line for 1. [Team fouls: 2] (Kobe Wagner: 1 personal fouls)   FT 1/1: GOOD Luka Green makes 1/1 from the line.
Score: 61-60

[05:58] Team_094 possession (Score: 61-60)
Terry Ingram attempts a Midrange. Wide open! Manu Ball is 6.0 feet away. [ZONE] TERRY INGRAM MAKES IT! Assist: Tim Russell
Score: 63-60

[05:39] Team_100 possession (Score: 63-60)
Tyler Griffin attempts a 3Pt. Wide open! Kobe Wagner is 6.1 feet away. [ZONE] Tyler Griffin misses. Rebound secured by Tim Russell.

[05:22] Team_094 possession (Score: 63-60)
Kobe Bryant drives and kicks out. Kobe Wagner attempts a Midrange. Contested by Tyler Griffin (4.2 feet, MAN). KOBE WAGNER MAKES IT! Assist: Lauri Thompson
Score: 65-60

[05:11] Team_100 possession (Score: 65-60)
Manu Ball attempts a 3Pt. Contested by Kobe Wagner (5.7 feet, ZONE). Manu Ball misses. Offensive rebound by Chris Mobley! Chris Mobley kicks it out.

[04:59] Team_100 possession (Score: 65-60)
Manu Ball drives, Tim Russell stays with him. Manu Ball attempts a Dunk. Contested by Tim Russell (4.7 feet, ZONE). Manu Ball misses. Rebound secured by Tim Russell.

[04:43] Team_094 possession (Score: 65-60)
Lauri Thompson loses the ball! Stripped by Manu Ball! TURNOVER! (live ball)

[04:25] Team_100 possession (Score: 65-60)
Chris Mobley attempts a Midrange. Wide open! Kobe Bryant is 6.2 feet away. [MAN] Chris Mobley misses. Rebound secured by Tim Russell.

[04:12] Team_094 possession (Score: 65-60)
Kobe Bryant drives to the basket... Kobe Bryant throws a bad pass out of bounds! TURNOVER! (dead ball)

[03:59] Team_100 possession (Score: 65-60)
Luka Green drives to the basket... Luka Green loses control! Ball rolls out of bounds! TURNOVER! (dead ball)

[03:44] Team_094 possession (Score: 65-60)
Tim Russell attempts a Midrange. Wide open! Pau LaVine is 7.1 feet away. [MAN] TIM RUSSELL MAKES IT! Assist: Kobe Wagner
Score: 67-60

[03:31] Team_100 possession (Score: 67-60)
Pau LaVine attempts a Midrange. Contested by Tim Russell (4.2 feet, MAN). Pau LaVine misses. Rebound secured by Kobe Bryant.

[03:20] Team_094 possession (Score: 67-60)
Tim Russell attempts a Layup. Contested by Pau LaVine (5.0 feet, ZONE). TIM RUSSELL MAKES IT!
Score: 69-60

[03:02] Team_100 possession (Score: 69-60)
Pau LaVine attempts a 3Pt. Wide open! Tim Russell is 7.2 feet away. [ZONE] Pau LaVine misses. Rebound secured by Kobe Bryant.

[02:46] Team_094 possession (Score: 69-60)
Kobe Wagner attempts a 3Pt. Wide open! Luka Green is 7.8 feet away. [ZONE] Kobe Wagner misses. Offensive rebound by Kobe Bryant! Kobe Bryant puts it back in!
Score: 71-60

[02:29] Team_100 possession (Score: 71-60)
Pau LaVine attempts a Layup. Contested by Tim Russell (3.5 feet, MAN). PAU LAVINE MAKES IT!
Score: 71-62

[02:16] Team_094 possession (Score: 71-62)
FOUL! Holding foul on Pau LaVine. [Team fouls: 3] No free throws, side out. (Pau LaVine: 2 personal fouls)

[01:59] Team_094 possession (Score: 71-62)
Kobe Bryant loses the ball! Stripped by Chris Mobley! TURNOVER! (live ball)

[01:46] Team_100 possession (Score: 71-62)
Luka Green attempts a 3Pt. Wide open! Terry Ingram is 6.4 feet away. [MAN] Luka Green misses. Offensive rebound by Chris Mobley! Chris Mobley kicks it out.

[01:35] Team_100 possession (Score: 71-62)
Tyler Griffin makes the Dunk and draws the foul on Lauri Thompson! And-1! Tyler Griffin to the line for 1. [Team fouls: 3] (Lauri Thompson: 1 personal fouls)   FT 1/1: GOOD Tyler Griffin makes 1/1 from the line.
Score: 71-65

[01:16] Team_094 possession (Score: 71-65)
Tim Russell makes the Layup and draws the foul on Pau LaVine! And-1! Tim Russell to the line for 1. [Team fouls: 4] (Pau LaVine: 3 personal fouls)   FT 1/1: GOOD Tim Russell makes 1/1 from the line.
Score: 74-65

[01:03] Team_100 possession (Score: 74-65)
Pau LaVine drives and kicks out. Pau LaVine attempts a 3Pt. Wide open! Tim Russell is 6.2 feet away. [MAN] Pau LaVine misses. Rebound secured by Kobe Wagner.

[00:48] Team_094 possession (Score: 74-65)
Kobe Bryant attempts a Midrange. Contested by Tyler Griffin (4.8 feet, ZONE). Kobe Bryant misses. FOUL! Loose ball foul on Pau LaVine during the rebound battle. [IN THE BONUS! 5 team fouls] Tim Russell to the line for 2 free throws. (Pau LaVine: 4 personal fouls)   FT 1/2: GOOD   FT 2/2: GOOD Tim Russell makes 2/2 from the line.
Score: 76-65

[00:33] Team_100 possession (Score: 76-65)
Tyler Griffin attempts a 3Pt. Wide open! Terry Ingram is 7.4 feet away. [ZONE] Tyler Griffin misses. Rebound secured by Kobe Bryant.

[00:16] Team_094 possession (Score: 76-65)
Tim Russell attempts a 3Pt. Contested by Pau LaVine (4.0 feet, MAN). TIM RUSSELL MAKES IT! Assist: Lauri Thompson
Score: 79-65

[00:02] Team_100 possession (Score: 79-65)
Tyler Griffin drives to the basket... Tyler Griffin commits a violation (traveling/carry)! TURNOVER! (dead ball)

[00:02] Substitution (Team_094): Terry Ingram OUT → Shaquille Bryant IN (stamina_rule2)

[00:02] Substitution (Team_094): Lauri Thompson OUT → Kevin Rozier IN (stamina_rule2)

[00:02] Substitution (Team_094): Kobe Wagner OUT → Ayo Gasol IN (stamina_rule2)

[00:02] Substitution (Team_094): Tim Russell OUT → Domantas Haliburton IN (stamina_rule2)

[00:02] Substitution (Team_094): Kobe Bryant OUT → Isaiah Quickley IN (stamina_rule2)

[00:02] Substitution (Team_100): Luka Green OUT → Dirk Sabonis IN (stamina_rule2)

[00:02] Substitution (Team_100): Manu Ball OUT → Evan Butler IN (stamina_rule2)

[00:02] Substitution (Team_100): Tyler Griffin OUT → Tyrese Wade IN (stamina_rule2)

[00:02] Substitution (Team_100): Pau LaVine OUT → Carmelo Ginobili IN (stamina_rule2)

[00:02] Substitution (Team_100): Chris Mobley OUT → John Rozier IN (stamina_rule2)

================================================================================
                              3RD QUARTER COMPLETE                              
================================================================================

3RD QUARTER SCORE: Team_094 33, Team_100 20

BOX SCORE:
================================================================================

Team_094
--------------------------------------------------------------------------------
Player                MIN  PTS  REB  AST  TO      FG   FG%      3P   3P%
--------------------------------------------------------------------------------
Tim Russell            29   16    5    2   0   7/7   100.0     0/0   0.0
Kobe Bryant            29    8    5    0   0   4/6    66.7     0/0   0.0
Terry Ingram           29    4    0    1   0   2/2   100.0     0/0   0.0
Lauri Thompson         29    3    0    2   0   1/2    50.0     0/0   0.0
Kobe Wagner            29    2    4    1   0   1/2    50.0     0/0   0.0

TEAM: FG: 15/19 (78.9%), 3PT: 3/5 (60.0%), REB: 14 (3 off, 11 def), AST: 6, TO: 3
TEAM FOULS: 3


Team_100
--------------------------------------------------------------------------------
Player                MIN  PTS  REB  AST  TO      FG   FG%      3P   3P%
--------------------------------------------------------------------------------
Pau LaVine             29    7    2    1   0   3/6    50.0     0/0   0.0
Tyler Griffin          29    6    1    0   0   2/7    28.6     0/0   0.0
Luka Green             29    4    0    0   0   1/1   100.0     0/0   0.0
Manu Ball              29    3    0    1   0   1/3    33.3     0/0   0.0
Chris Mobley           29    0    2    1   0   0/1     0.0     0/0   0.0

TEAM: FG: 7/18 (38.9%), 3PT: 3/9 (33.3%), REB: 5 (2 off, 3 def), AST: 3, TO: 4
TEAM FOULS: 5 [Team_094 in BONUS]

================================================================================

================================================================================
                       4TH QUARTER - Team_094 vs Team_100                       
================================================================================

[12:00] Team_094 possession (Score: 79-65)
Tim Russell attempts a 3Pt. Wide open! Pau LaVine is 7.3 feet away. [MAN] Tim Russell misses. Rebound secured by Chris Mobley.

[11:45] Team_100 possession (Score: 79-65)
Luka Green attempts a 3Pt. Contested by Terry Ingram (3.8 feet, MAN). Luka Green misses. Rebound secured by Tim Russell.

[11:31] Team_094 possession (Score: 79-65)
Lauri Thompson attempts a Layup. BLOCKED BY MANU BALL! Ball goes out off Manu Ball. Lauri Thompson's ball!

[11:16] Team_094 possession (Score: 79-65)
Tim Russell throws a bad pass! Stolen by Pau LaVine! TURNOVER! (live ball)

[11:00] Team_100 possession (Score: 79-65)
FOUL! Offensive foul on Manu Ball! Lauri Thompson drew the charge! [Team fouls: 1] (Manu Ball: 1 personal fouls) TURNOVER! (dead ball)

[10:46] Team_094 possession (Score: 79-65)
Kobe Wagner attempts a 3Pt. Wide open! Tyler Griffin is 6.9 feet away. [MAN] Kobe Wagner misses. Rebound secured by Chris Mobley.

[10:32] Team_100 possession (Score: 79-65)
Tyler Griffin attempts a Layup. Wide open! Tim Russell is 9.0 feet away. [ZONE] Tyler Griffin misses. Rebound secured by Tim Russell.

[10:15] Team_094 possession (Score: 79-65)
Tim Russell attempts a Layup. BLOCKED BY PAU LAVINE! Ball is loose! Rebound secured by Chris Mobley.

[10:00] Team_100 possession (Score: 79-65)
Pau LaVine drives, Tim Russell stays with him. Pau LaVine attempts a Layup. Contested by Tim Russell (4.9 feet, ZONE). PAU LAVINE MAKES IT! Assist: Manu Ball
Score: 79-67

[09:46] Team_094 possession (Score: 79-67)
Tim Russell attempts a Midrange. Wide open! Tyler Griffin is 7.0 feet away. [ZONE] Tim Russell misses. Rebound secured by Chris Mobley.

[09:30] Team_100 possession (Score: 79-67)
FOUL! Offensive foul on Luka Green! Terry Ingram drew the charge! [Team fouls: 2] (Luka Green: 1 personal fouls) TURNOVER! (dead ball)

[09:16] Team_094 possession (Score: 79-67)
Tim Russell drives to the basket... Tim Russell loses the ball! Stripped by Chris Mobley! TURNOVER! (live ball)

[09:03] Team_100 possession (Score: 79-67)
Pau LaVine attempts a Midrange. Contested by Tim Russell (4.9 feet, MAN). Pau LaVine misses. Rebound secured by Kobe Bryant.

[08:49] Team_094 possession (Score: 79-67)
Kobe Bryant attempts a 3Pt. Wide open! Luka Green is 7.4 feet away. [ZONE] Kobe Bryant misses. Rebound secured by Chris Mobley.

[08:35] Team_100 possession (Score: 79-67)
Chris Mobley attempts a Layup. Wide open! Kobe Bryant is 9.1 feet away. [MAN] CHRIS MOBLEY MAKES IT! Assist: Manu Ball
Score: 79-69

[08:23] Team_094 possession (Score: 79-69)
Lauri Thompson attempts a 3Pt. Wide open! Pau LaVine is 6.7 feet away. [ZONE] LAURI THOMPSON MAKES IT! Assist: Kobe Wagner
Score: 82-69

[08:09] Team_100 possession (Score: 82-69)
Luka Green drives to the basket... Luka Green throws a bad pass out of bounds! TURNOVER! (dead ball)

[08:09] Substitution (Team_094): Terry Ingram OUT → Shaquille Bryant IN (stamina_rule2)

[08:09] Substitution (Team_094): Lauri Thompson OUT → Kevin Rozier IN (stamina_rule2)

[08:09] Substitution (Team_094): Kobe Wagner OUT → Ayo Gasol IN (stamina_rule2)

[08:09] Substitution (Team_094): Tim Russell OUT → Domantas Haliburton IN (stamina_rule2)

[08:09] Substitution (Team_094): Kobe Bryant OUT → Isaiah Quickley IN (stamina_rule2)

[08:09] Substitution (Team_100): Luka Green OUT → Dirk Sabonis IN (stamina_rule2)

[08:09] Substitution (Team_100): Manu Ball OUT → Evan Butler IN (stamina_rule2)

[08:09] Substitution (Team_100): Tyler Griffin OUT → Tyrese Wade IN (stamina_rule2)

[08:09] Substitution (Team_100): Pau LaVine OUT → Carmelo Ginobili IN (stamina_rule2)

[08:09] Substitution (Team_100): Chris Mobley OUT → John Rozier IN (stamina_rule2)

[07:52] Team_094 possession (Score: 82-69)
Isaiah Quickley attempts a Midrange. Contested by John Rozier (3.2 feet, MAN). Isaiah Quickley misses. Rebound secured by John Rozier.

[07:35] Team_100 possession (Score: 82-69)
Evan Butler attempts a 3Pt. Contested by Domantas Haliburton (5.7 feet, ZONE). EVAN BUTLER MAKES IT! Assist: Tyrese Wade
Score: 82-72

[07:23] Team_094 possession (Score: 82-72)
Ayo Gasol attempts a 3Pt. Wide open! Tyrese Wade is 7.4 feet away. [MAN] Ayo Gasol misses. Rebound secured by Carmelo Ginobili.

[07:12] Team_100 possession (Score: 82-72)
Dirk Sabonis drives and kicks out. Dirk Sabonis attempts a 3Pt. Contested by Shaquille Bryant (5.7 feet, MAN). Dirk Sabonis misses. Rebound secured by Domantas Haliburton.

[07:02] Team_094 possession (Score: 82-72)
Shaquille Bryant attempts a 3Pt. Wide open! Dirk Sabonis is 6.0 feet away. [MAN] Shaquille Bryant misses. Rebound secured by John Rozier.

[06:45] Team_100 possession (Score: 82-72)
Carmelo Ginobili attempts a Midrange. Contested by Ayo Gasol (4.3 feet, ZONE). Carmelo Ginobili misses. Rebound secured by Isaiah Quickley.

[06:30] Team_094 possession (Score: 82-72)
FOUL! Shooting foul on John Rozier. Isaiah Quickley to the line for 2 free throws. [Team fouls: 3] (John Rozier: 1 personal fouls)   FT 1/2: GOOD   FT 2/2: GOOD Isaiah Quickley makes 2/2 from the line.
Score: 84-72

[06:16] Team_100 possession (Score: 84-72)
Carmelo Ginobili drives, picks up Isaiah Quickley. Help arrives from Kevin Rozier! Carmelo Ginobili attempts a Dunk. Contested by Kevin Rozier (4.1 feet, ZONE). Carmelo Ginobili misses. Offensive rebound by Carmelo Ginobili! Carmelo Ginobili kicks it out.

[06:01] Team_100 possession (Score: 84-72)
Carmelo Ginobili drives, picks up Isaiah Quickley. Help arrives from Kevin Rozier! Carmelo Ginobili attempts a Layup. Wide open! Kevin Rozier is 6.5 feet away. [ZONE] CARMELO GINOBILI MAKES IT! Assist: John Rozier
Score: 84-74

[05:42] Team_094 possession (Score: 84-74)
Isaiah Quickley attempts a 3Pt. Contested by John Rozier (4.4 feet, MAN). Isaiah Quickley misses. Rebound secured by Tyrese Wade.

[05:28] Team_100 possession (Score: 84-74)
Tyrese Wade attempts a Layup. BLOCKED BY AYO GASOL! Ball is loose! Offensive rebound by Carmelo Ginobili! Carmelo Ginobili kicks it out.

[05:10] Team_100 possession (Score: 84-74)
John Rozier throws a bad pass! Stolen by Isaiah Quickley! TURNOVER! (live ball)

[04:53] Team_094 possession (Score: 84-74)
Domantas Haliburton attempts a Midrange. Wide open! Carmelo Ginobili is 6.4 feet away. [MAN] Domantas Haliburton misses. Offensive rebound by Isaiah Quickley! Isaiah Quickley kicks it out.

[04:40] Team_094 possession (Score: 84-74)
Kevin Rozier attempts a Midrange. Contested by Carmelo Ginobili (4.7 feet, ZONE). Kevin Rozier misses. Rebound secured by Carmelo Ginobili.

[04:25] Team_100 possession (Score: 84-74)
FOUL! Shooting foul on Domantas Haliburton. Carmelo Ginobili to the line for 2 free throws. [Team fouls: 1] (Domantas Haliburton: 1 personal fouls)   FT 1/2: MISS   FT 2/2: GOOD Carmelo Ginobili makes 1/2 from the line.
Score: 84-75

[04:10] Team_094 possession (Score: 84-75)
Isaiah Quickley attempts a 3Pt. Contested by Evan Butler (5.7 feet, ZONE). Isaiah Quickley misses. FOUL! Loose ball foul on Tyrese Wade during the rebound battle. [Team fouls: 4] No free throws, side out. (Tyrese Wade: 1 personal fouls)

[03:52] Team_094 possession (Score: 84-75)
Isaiah Quickley drives to the basket... Isaiah Quickley throws a bad pass out of bounds! TURNOVER! (dead ball)

[03:41] Team_100 possession (Score: 84-75)
Evan Butler attempts a Layup. Contested by Domantas Haliburton (3.8 feet, ZONE). Evan Butler misses. Rebound secured by Ayo Gasol.

[03:26] Team_094 possession (Score: 84-75)
Kevin Rozier attempts a 3Pt. Wide open! Evan Butler is 10.0 feet away. [MAN] Kevin Rozier misses. Rebound secured by John Rozier.

[03:15] Team_100 possession (Score: 84-75)
FOUL! Holding foul on Ayo Gasol. [Team fouls: 2] No free throws, side out. (Ayo Gasol: 1 personal fouls)

[03:03] Team_100 possession (Score: 84-75)
Dirk Sabonis drives to the basket... Dirk Sabonis commits a violation (traveling/carry)! TURNOVER! (dead ball)

[02:51] Team_094 possession (Score: 84-75)
Shaquille Bryant attempts a 3Pt. Contested by Dirk Sabonis (4.2 feet, MAN). Shaquille Bryant misses. Offensive rebound by Isaiah Quickley! Isaiah Quickley kicks it out.

[02:37] Team_094 possession (Score: 84-75)
FOUL! Offensive foul on Domantas Haliburton! Carmelo Ginobili drew the charge! [Team fouls: 3] (Domantas Haliburton: 2 personal fouls) TURNOVER! (dead ball)

[02:20] Team_100 possession (Score: 84-75)
Evan Butler drives, Isaiah Quickley stays with him. Evan Butler attempts a Dunk. Heavily contested by Isaiah Quickley (0.5 feet, ZONE)! EVAN BUTLER MAKES IT! Assist: Tyrese Wade
Score: 84-77

[02:07] Team_094 possession (Score: 84-77)
FOUL! Offensive foul on Isaiah Quickley! John Rozier drew the charge! [Team fouls: 4] (Isaiah Quickley: 1 personal fouls) TURNOVER! (dead ball)

[01:54] Team_100 possession (Score: 84-77)
FOUL! Holding foul on Shaquille Bryant. [IN THE BONUS! 5 team fouls] Dirk Sabonis to the line for 2 free throws. (Shaquille Bryant: 1 personal fouls)   FT 1/2: GOOD   FT 2/2: GOOD Dirk Sabonis makes 2/2 from the line.
Score: 84-79

[01:41] Team_094 possession (Score: 84-79)
Domantas Haliburton attempts a 3Pt. Contested by Tyrese Wade (2.4 feet, ZONE). Domantas Haliburton misses. Rebound secured by Carmelo Ginobili.

[01:27] Team_100 possession (Score: 84-79)
Carmelo Ginobili attempts a 3Pt. Contested by Domantas Haliburton (4.5 feet, ZONE). Carmelo Ginobili misses. Offensive rebound by John Rozier! John Rozier's putback is no good. Rebound secured by Domantas Haliburton.

[01:14] Team_094 possession (Score: 84-79)
Domantas Haliburton drives, picks up Carmelo Ginobili. Help arrives from Evan Butler! Domantas Haliburton attempts a Layup. Contested by Evan Butler (5.0 feet, MAN). DOMANTAS HALIBURTON MAKES IT! Assist: Kevin Rozier
Score: 86-79

[00:55] Team_100 possession (Score: 86-79)
Dirk Sabonis attempts a Midrange. Contested by Shaquille Bryant (3.6 feet, MAN). Dirk Sabonis misses. Rebound secured by Domantas Haliburton.

[00:42] Team_094 possession (Score: 86-79)
Domantas Haliburton attempts a 3Pt. Wide open! Tyrese Wade is 6.5 feet away. [ZONE] DOMANTAS HALIBURTON MAKES IT! Assist: Shaquille Bryant
Score: 89-79

[00:28] Team_100 possession (Score: 89-79)
Carmelo Ginobili attempts a Layup. Contested by Domantas Haliburton (4.5 feet, MAN). Carmelo Ginobili misses. Rebound secured by Domantas Haliburton.

[00:15] Team_094 possession (Score: 89-79)
Ayo Gasol attempts a Midrange. Wide open! Tyrese Wade is 8.5 feet away. [ZONE] Ayo Gasol misses. Rebound secured by John Rozier.

================================================================================
                              4TH QUARTER COMPLETE                              
================================================================================

4TH QUARTER SCORE: Team_094 10, Team_100 14

BOX SCORE:
================================================================================

Team_094
--------------------------------------------------------------------------------
Player                MIN  PTS  REB  AST  TO      FG   FG%      3P   3P%
--------------------------------------------------------------------------------
Domantas Haliburton    15    5    5    0   0   2/3    66.7     0/0   0.0
Lauri Thompson         33    3    0    0   0   1/1   100.0     0/0   0.0
Isaiah Quickley        15    2    3    0   0   1/3    33.3     0/0   0.0
Tim Russell            33    0    2    0   0   0/3     0.0     0/0   0.0
Kobe Wagner            33    0    0    1   0   0/1     0.0     0/0   0.0
Kobe Bryant            33    0    1    0   0   0/1     0.0     0/0   0.0
Ayo Gasol              15    0    1    0   0   0/2     0.0     0/0   0.0
Shaquille Bryant       15    0    0    1   0   0/1     0.0     0/0   0.0
Kevin Rozier           15    0    0    1   0   0/2     0.0     0/0   0.0

TEAM: FG: 4/17 (23.5%), 3PT: 2/10 (20.0%), REB: 11 (3 off, 8 def), AST: 3, TO: 5
TEAM FOULS: 5 [Team_100 in BONUS]


Team_100
--------------------------------------------------------------------------------
Player                MIN  PTS  REB  AST  TO      FG   FG%      3P   3P%
--------------------------------------------------------------------------------
Evan Butler            15    5    0    0   0   2/3    66.7     0/0   0.0
Carmelo Ginobili       15    3    5    0   0   2/5    40.0     0/0   0.0
Chris Mobley           33    2    5    0   0   1/1   100.0     0/0   0.0
Pau LaVine             33    2    0    0   0   1/2    50.0     0/0   0.0
Dirk Sabonis           15    2    0    0   0   1/3    33.3     0/0   0.0
Luka Green             33    0    0    0   0   0/1     0.0     0/0   0.0
Tyler Griffin          33    0    0    0   0   0/1     0.0     0/0   0.0
Manu Ball              33    0    0    2   0   0/0     0.0     0/0   0.0
John Rozier            15    0    4    1   0   0/0     0.0     0/0   0.0
Tyrese Wade            15    0    1    2   0   0/0     0.0     0/0   0.0

TEAM: FG: 7/16 (43.8%), 3PT: 1/3 (33.3%), REB: 16 (3 off, 13 def), AST: 5, TO: 5
TEAM FOULS: 4

================================================================================

================================================================================
                               FULL GAME COMPLETE                               
================================================================================

FINAL SCORE: Team_094 89, Team_100 79

SCORING BY QUARTER:
--------------------------------------------------------------------------------
Team                     Q1     Q2     Q3     Q4    FINAL
--------------------------------------------------------------------------------
Team_094                 28     18     33     10       89
Team_100                 27     18     20     14       79
--------------------------------------------------------------------------------

FULL GAME BOX SCORE:
================================================================================

Team_094
--------------------------------------------------------------------------------
Player                MIN  PTS  REB  AST  TO      FG   FG%      3P   3P%      FT STL BLK
--------------------------------------------------------------------------------
Terry Ingram           33    7    0    4   0   3/6    50.0   0/2     0.0   1/2     0   0
Lauri Thompson         33   11    0    3   2   5/9    55.6   3/5    60.0   2/3     0   0
Kobe Wagner            33    4    5    3   0   2/8    25.0   1/6    16.7   0/0     1   0
Tim Russell            33   25   12    6   2   9/14   64.3   2/3    66.7   5/7     0   2
Kobe Bryant            33   20    7    0   2  11/14   78.6   0/1     0.0   1/2     1   0
Shaquille Bryant       15    2    0    1   1   1/7    14.3   0/5     0.0   2/2     0   1
Kevin Rozier           15    3    0    1   0   1/4    25.0   1/2    50.0   0/0     0   0
Ayo Gasol              15    3    3    1   0   1/3    33.3   0/1     0.0   1/2     0   1
Domantas Haliburton    15    9    6    0   2   4/6    66.7   1/2    50.0   0/0     1   0
Isaiah Quickley        15    2    9    0   1   1/3    33.3   0/1     0.0   2/2     2   0

TEAM: FG: 40/76 (52.6%), 3PT: 8/28 (28.6%), REB: 44 (11 off, 33 def), AST: 19, TO: 10


Team_100
--------------------------------------------------------------------------------
Player                MIN  PTS  REB  AST  TO      FG   FG%      3P   3P%      FT STL BLK
--------------------------------------------------------------------------------
Luka Green             33   14    0    0   3   5/6    83.3   3/4    75.0   1/1     0   0
Manu Ball              33    3    0    4   2   2/5    40.0   1/2    50.0   0/0     1   1
Tyler Griffin          33   20    6    0   4   7/15   46.7   4/11   36.4   2/2     0   0
Pau LaVine             33   11   12    1   2   5/12   41.7   0/3     0.0   2/2     1   2
Chris Mobley           33   11   12    6   3   4/5    80.0   0/0     0.0   2/3     2   1
Dirk Sabonis           15    4    0    0   2   1/5    20.0   0/1     0.0   4/4     1   0
Evan Butler            15    8    0    0   0   3/6    50.0   1/3    33.3   1/1     0   1
Tyrese Wade            15    0    1    2   0   0/0     0.0   0/0     0.0   0/0     0   0
Carmelo Ginobili       15    3    9    0   2   2/7    28.6   0/1     0.0   1/3     0   0
John Rozier            15    2    7    1   1   1/3    33.3   0/0     0.0   0/0     0   1

TEAM: FG: 31/65 (47.7%), 3PT: 9/25 (36.0%), REB: 45 (13 off, 32 def), AST: 14, TO: 19

================================================================================
