================================================================================
                        FULL GAME - Team_051 vs Team_047                        
================================================================================

================================================================================
                       1ST QUARTER - Team_051 vs Team_047                       
================================================================================

[12:00] Team_051 possession (Score: 0-0)
Larry McGrady makes the Dunk and draws the foul on Blake Jokic! And-1! Larry McGrady to the line for 1. [Team fouls: 1] (Blake Jokic: 1 personal fouls)   FT 1/1: GOOD Larry McGrady makes 1/1 from the line.
Score: 3-0

[11:50] Team_047 possession (Score: 3-0)
Derrick Irving attempts a 3Pt. Contested by Austin Sexton (4.1 feet, ZONE). DERRICK IRVING MAKES IT! Assist: Blake Jokic
Score: 3-3

[11:37] Team_051 possession (Score: 3-3)
Shaquille Harden attempts a Layup. Wide open! Myles LaVine is 6.5 feet away. [MAN] SHAQUILLE HARDEN MAKES IT! Assist: OG Siakam
Score: 5-3

[11:19] Team_047 possession (Score: 5-3)
Josh Harris attempts a Midrange. Wide open! Franz Simmons is 6.1 feet away. [MAN] JOSH HARRIS MAKES IT! Assist: Derrick Irving
Score: 5-5

[11:04] Team_051 possession (Score: 5-5)
OG Siakam attempts a Layup. BLOCKED BY JOSH HARRIS! Ball is loose! Rebound secured by Myles LaVine.

[10:45] Team_047 possession (Score: 5-5)
Josh Harris attempts a Layup. BLOCKED BY FRANZ SIMMONS! Ball is loose! Rebound secured by Franz Simmons.

[10:31] Team_051 possession (Score: 5-5)
Austin Sexton drives, picks up De'Aaron Rose. Help arrives from Derrick Irving! Austin Sexton attempts a Layup. Contested by Derrick Irving (2.4 feet, MAN). AUSTIN SEXTON MAKES IT! Assist: Larry McGrady
Score: 7-5

[10:15] Team_047 possession (Score: 7-5)
FOUL! Holding foul on Austin Sexton. [Team fouls: 1] No free throws, side out. (Austin Sexton: 1 personal fouls)

[10:03] Team_047 possession (Score: 7-5)
Blake Jokic attempts a Midrange. BLOCKED BY OG SIAKAM! Ball is loose! Rebound secured by OG Siakam.

[09:50] Team_051 possession (Score: 7-5)
OG Siakam drives to the basket... OG Siakam loses the ball! Stripped by Blake Jokic! TURNOVER! (live ball)

[09:36] Team_047 possession (Score: 7-5)
Josh Harris drives to the basket... Josh Harris throws a bad pass out of bounds! TURNOVER! (dead ball)

[09:18] Team_051 possession (Score: 7-5)
Austin Sexton attempts a 3Pt. Contested by Blake Jokic (5.8 feet, ZONE). Austin Sexton misses. Rebound secured by Derrick Irving.

[09:06] Team_047 possession (Score: 7-5)
FOUL! Shooting foul on OG Siakam. Derrick Irving to the line for 2 free throws. [Team fouls: 2] (OG Siakam: 1 personal fouls)   FT 1/2: GOOD   FT 2/2: MISS Derrick Irving makes 1/2 from the line. Rebound secured by Franz Simmons.
Score: 7-6

[08:50] Team_051 possession (Score: 7-6)
Austin Sexton attempts a Midrange. Contested by De'Aaron Rose (3.9 feet, MAN). AUSTIN SEXTON MAKES IT!
Score: 9-6

[08:33] Team_047 possession (Score: 9-6)
Josh Harris attempts a Midrange. Contested by Franz Simmons (5.3 feet, ZONE). Josh Harris misses. Rebound secured by Shaquille Harden.

[08:14] Team_051 possession (Score: 9-6)
FOUL! Offensive foul on OG Siakam! Blake Jokic drew the charge! [Team fouls: 3] (OG Siakam: 2 personal fouls) TURNOVER! (dead ball)

[08:02] Team_047 possession (Score: 9-6)
Blake Jokic attempts a 3Pt. Contested by Austin Sexton (2.5 feet, ZONE). BLAKE JOKIC MAKES IT! Assist: Myles LaVine
Score: 9-9

[07:43] Team_051 possession (Score: 9-9)
FOUL! Holding foul on De'Aaron Rose. [Team fouls: 2] No free throws, side out. (De'Aaron Rose: 1 personal fouls)

[07:30] Team_051 possession (Score: 9-9)
Shaquille Harden makes the Dunk and draws the foul on Myles LaVine! And-1! Shaquille Harden to the line for 1. [Team fouls: 3] (Myles LaVine: 1 personal fouls)   FT 1/1: GOOD Shaquille Harden makes 1/1 from the line.
Score: 12-9

[07:14] Team_047 possession (Score: 12-9)
Derrick Irving attempts a 3Pt. Contested by Austin Sexton (2.9 feet, ZONE). DERRICK IRVING MAKES IT! Assist: Myles LaVine
Score: 12-12

[06:59] Team_051 possession (Score: 12-12)
Shaquille Harden drives to the basket... Shaquille Harden throws a bad pass out of bounds! TURNOVER! (dead ball)

[06:48] Team_047 possession (Score: 12-12)
Myles LaVine attempts a Midrange. BLOCKED BY LARRY MCGRADY! Ball is loose! Rebound secured by Franz Simmons.

[06:34] Team_051 possession (Score: 12-12)
FOUL! Reach-in foul on Josh Harris during the drive. [Team fouls: 4] No free throws, side out. (Josh Harris: 1 personal fouls)

[06:20] Team_051 possession (Score: 12-12)
OG Siakam drives and kicks out. OG Siakam attempts a 3Pt. Wide open! De'Aaron Rose is 6.4 feet away. [ZONE] OG Siakam misses. Rebound secured by Myles LaVine.

[06:03] Team_047 possession (Score: 12-12)
FOUL! Holding foul on Austin Sexton. [Team fouls: 4] No free throws, side out. (Austin Sexton: 2 personal fouls)

[05:51] Team_047 possession (Score: 12-12)
Myles LaVine attempts a Midrange. Contested by Shaquille Harden (5.1 feet, MAN). MYLES LAVINE MAKES IT! Assist: Derrick Irving
Score: 12-14

[05:40] Team_051 possession (Score: 12-14)
Franz Simmons drives and kicks out. Austin Sexton attempts a 3Pt. BLOCKED BY DE'AARON ROSE! Ball is loose! Offensive rebound by Franz Simmons! Franz Simmons kicks it out.

[05:24] Team_051 possession (Score: 12-14)
Larry McGrady attempts a 3Pt. Contested by De'Aaron Rose (2.9 feet, ZONE). Larry McGrady misses. Rebound secured by Josh Harris.

[05:09] Team_047 possession (Score: 12-14)
Blake Jokic drives to the basket... Blake Jokic throws a bad pass! Stolen by Franz Simmons! TURNOVER! (live ball)

[04:54] Team_051 possession (Score: 12-14)
Franz Simmons loses the ball! Stripped by Josh Harris! TURNOVER! (live ball)

[04:39] Team_047 possession (Score: 12-14)
Derrick Irving throws a bad pass out of bounds! TURNOVER! (dead ball)

[04:27] Team_051 possession (Score: 12-14)
Franz Simmons attempts a 3Pt. Contested by Josh Harris (4.2 feet, MAN). Franz Simmons misses. Offensive rebound by Shaquille Harden! Shaquille Harden's putback is no good. Rebound secured by Derrick Irving.

[04:08] Team_047 possession (Score: 12-14)
Derrick Irving attempts a 3Pt. Contested by Austin Sexton (5.0 feet, ZONE). DERRICK IRVING MAKES IT! Assist: Josh Harris
Score: 12-17

[03:55] Team_051 possession (Score: 12-17)
Larry McGrady attempts a Midrange. Wide open! Blake Jokic is 8.2 feet away. [ZONE] Larry McGrady misses. Rebound secured by Myles LaVine.

[03:44] Team_047 possession (Score: 12-17)
Derrick Irving attempts a 3Pt. Wide open! Austin Sexton is 6.4 feet away. [ZONE] Derrick Irving misses. Offensive rebound by Myles LaVine! Myles LaVine kicks it out.

[03:30] Team_047 possession (Score: 12-17)
Josh Harris attempts a Midrange. Contested by Franz Simmons (4.7 feet, MAN). JOSH HARRIS MAKES IT!
Score: 12-19

[03:13] Team_051 possession (Score: 12-19)
Franz Simmons drives, picks up Josh Harris. Help arrives from Derrick Irving! Franz Simmons attempts a Dunk. Wide open! Derrick Irving is 7.4 feet away. [ZONE] FRANZ SIMMONS MAKES IT! Assist: Shaquille Harden
Score: 14-19

[02:59] Team_047 possession (Score: 14-19)
FOUL! Shooting foul on OG Siakam. Blake Jokic to the line for 2 free throws. [BONUS: 5 team fouls] (OG Siakam: 3 personal fouls)   FT 1/2: MISS   FT 2/2: GOOD Blake Jokic makes 1/2 from the line.
Score: 14-20

[02:44] Team_051 possession (Score: 14-20)
OG Siakam drives and kicks out. Larry McGrady attempts a 3Pt. Contested by Derrick Irving (4.1 feet, MAN). Larry McGrady misses. Rebound secured by Derrick Irving.

[02:30] Team_047 possession (Score: 14-20)
Josh Harris attempts a 3Pt. Heavily contested by OG Siakam (0.5 feet, ZONE)! Josh Harris misses. Rebound secured by Shaquille Harden.

[02:19] Team_051 possession (Score: 14-20)
OG Siakam drives and kicks out. OG Siakam attempts a Midrange. Contested by Blake Jokic (4.8 feet, MAN). OG Siakam misses. Rebound secured by Myles LaVine.

[02:04] Team_047 possession (Score: 14-20)
Derrick Irving attempts a 3Pt. Contested by Larry McGrady (3.9 feet, MAN). Derrick Irving misses. Offensive rebound by Myles LaVine! Myles LaVine kicks it out.

[01:48] Team_047 possession (Score: 14-20)
De'Aaron Rose attempts a 3Pt. Contested by Austin Sexton (4.6 feet, ZONE). De'Aaron Rose misses. Rebound secured by Shaquille Harden.

[01:33] Team_051 possession (Score: 14-20)
Larry McGrady attempts a 3Pt. Contested by Derrick Irving (4.4 feet, ZONE). LARRY MCGRADY MAKES IT! Assist: Franz Simmons
Score: 17-20

[01:17] Team_047 possession (Score: 17-20)
Blake Jokic attempts a Midrange. Contested by OG Siakam (3.0 feet, MAN). Blake Jokic misses. Rebound secured by Franz Simmons.

[01:02] Team_051 possession (Score: 17-20)
Austin Sexton attempts a Midrange. Contested by Josh Harris (4.2 feet, ZONE). AUSTIN SEXTON MAKES IT!
Score: 19-20

[00:52] Team_047 possession (Score: 19-20)
Derrick Irving attempts a 3Pt. Contested by Larry McGrady (4.1 feet, MAN). DERRICK IRVING MAKES IT!
Score: 19-23

[00:38] Team_051 possession (Score: 19-23)
Austin Sexton throws a bad pass! Stolen by De'Aaron Rose! TURNOVER! (live ball)

[00:25] Team_047 possession (Score: 19-23)
FOUL! Shooting foul on Franz Simmons. Derrick Irving to the line for 2 free throws. [BONUS: 6 team fouls] (Franz Simmons: 1 personal fouls)   FT 1/2: GOOD   FT 2/2: GOOD Derrick Irving makes 2/2 from the line.
Score: 19-25

[00:14] Team_051 possession (Score: 19-25)
Austin Sexton attempts a Midrange. Contested by De'Aaron Rose (5.4 feet, MAN). Austin Sexton misses. Offensive rebound by Shaquille Harden! Shaquille Harden puts it back in!
Score: 21-25

================================================================================
                              1ST QUARTER COMPLETE                              
================================================================================

1ST QUARTER SCORE: Team_051 21, Team_047 25

BOX SCORE:
================================================================================

Team_051
--------------------------------------------------------------------------------
Player                MIN  PTS  REB  AST  TO      FG   FG%      3P   3P%
--------------------------------------------------------------------------------
Shaquille Harden       12    7    4    1   0   3/3   100.0     0/0   0.0
Larry McGrady          12    6    0    1   0   2/4    50.0     0/0   0.0
Austin Sexton          12    6    0    0   0   3/4    75.0     0/0   0.0
Franz Simmons          12    2    5    1   0   1/2    50.0     0/0   0.0
OG Siakam              12    0    1    1   0   0/4     0.0     0/0   0.0

TEAM: FG: 9/17 (52.9%), 3PT: 1/4 (25.0%), REB: 11 (3 off, 8 def), AST: 4, TO: 5
TEAM FOULS: 6 [Team_047 in BONUS]


Team_047
--------------------------------------------------------------------------------
Player                MIN  PTS  REB  AST  TO      FG   FG%      3P   3P%
--------------------------------------------------------------------------------
Derrick Irving         12   14    3    2   0   5/6    83.3     0/0   0.0
Blake Jokic            12    4    0    1   0   2/4    50.0     0/0   0.0
Josh Harris            12    4    1    1   0   2/5    40.0     0/0   0.0
Myles LaVine           12    2    6    2   0   1/2    50.0     0/0   0.0
De'Aaron Rose          12    0    0    0   0   0/1     0.0     0/0   0.0

TEAM: FG: 10/18 (55.6%), 3PT: 5/7 (71.4%), REB: 9 (2 off, 7 def), AST: 6, TO: 3
TEAM FOULS: 4

================================================================================

================================================================================
                       2ND QUARTER - Team_051 vs Team_047                       
================================================================================

[12:00] Team_051 possession (Score: 21-25)
OG Siakam drives and kicks out. Shaquille Harden attempts a Midrange. Contested by Myles LaVine (3.0 feet, MAN). SHAQUILLE HARDEN MAKES IT!
Score: 23-25

[11:44] Team_047 possession (Score: 23-25)
Josh Harris attempts a Layup. BLOCKED BY AUSTIN SEXTON! Ball goes out off Austin Sexton. Josh Harris's ball!

[11:34] Team_047 possession (Score: 23-25)
Blake Jokic attempts a Midrange. Wide open! Franz Simmons is 6.4 feet away. [ZONE] Blake Jokic misses. Rebound secured by Shaquille Harden.

[11:19] Team_051 possession (Score: 23-25)
Austin Sexton drives and kicks out. Austin Sexton attempts a 3Pt. Contested by De'Aaron Rose (3.4 feet, MAN). Austin Sexton misses. Rebound secured by Josh Harris.

[11:04] Team_047 possession (Score: 23-25)
Derrick Irving attempts a 3Pt. Wide open! Larry McGrady is 6.9 feet away. [MAN] DERRICK IRVING MAKES IT!
Score: 23-28

[10:49] Team_051 possession (Score: 23-28)
Franz Simmons attempts a Midrange. Contested by Josh Harris (3.9 feet, MAN). Franz Simmons misses. Rebound secured by Myles LaVine.

[10:33] Team_047 possession (Score: 23-28)
FOUL! Shooting foul on Larry McGrady. Derrick Irving to the line for 3 free throws. [Team fouls: 1] (Larry McGrady: 1 personal fouls)   FT 1/3: GOOD   FT 2/3: MISS   FT 3/3: GOOD Derrick Irving makes 2/3 from the line.
Score: 23-30

[10:17] Team_051 possession (Score: 23-30)
FOUL! Offensive foul on OG Siakam! Blake Jokic drew the charge! [Team fouls: 2] (OG Siakam: 1 personal fouls) TURNOVER! (dead ball)

[10:03] Team_047 possession (Score: 23-30)
Myles LaVine attempts a Midrange. Wide open! OG Siakam is 7.7 feet away. [ZONE] MYLES LAVINE MAKES IT!
Score: 23-32

[09:49] Team_051 possession (Score: 23-32)
Shaquille Harden makes the Dunk and draws the foul on Derrick Irving! And-1! Shaquille Harden to the line for 1. [Team fouls: 1] (Derrick Irving: 1 personal fouls)   FT 1/1: GOOD Shaquille Harden makes 1/1 from the line.
Score: 26-32

[09:37] Team_047 possession (Score: 26-32)
FOUL! Reach-in foul on Shaquille Harden during the drive. [Team fouls: 3] No free throws, side out. (Shaquille Harden: 1 personal fouls)

[09:21] Team_047 possession (Score: 26-32)
Blake Jokic attempts a 3Pt. Contested by OG Siakam (5.5 feet, MAN). Blake Jokic misses. Rebound secured by Franz Simmons.

[09:08] Team_051 possession (Score: 26-32)
Austin Sexton attempts a 3Pt. Heavily contested by De'Aaron Rose (0.5 feet, MAN)! Austin Sexton misses. Rebound secured by Derrick Irving.

[08:51] Team_047 possession (Score: 26-32)
Myles LaVine attempts a Layup. Contested by Shaquille Harden (4.2 feet, MAN). MYLES LAVINE MAKES IT! Assist: De'Aaron Rose
Score: 26-34

[08:39] Team_051 possession (Score: 26-34)
Shaquille Harden drives to the basket... Shaquille Harden loses the ball! Stripped by Josh Harris! TURNOVER! (live ball)

[08:26] Team_047 possession (Score: 26-34)
De'Aaron Rose attempts a 3Pt. Wide open! Austin Sexton is 8.8 feet away. [ZONE] De'Aaron Rose misses. Rebound secured by Shaquille Harden.

[08:08] Team_051 possession (Score: 26-34)
Franz Simmons throws a bad pass! Stolen by Josh Harris! TURNOVER! (live ball)

[07:53] Team_047 possession (Score: 26-34)
Derrick Irving makes the Dunk and draws the foul on Franz Simmons! And-1! Derrick Irving to the line for 1. [Team fouls: 4] (Franz Simmons: 1 personal fouls)   FT 1/1: GOOD Derrick Irving makes 1/1 from the line.
Score: 26-37

[07:36] Team_051 possession (Score: 26-37)
Austin Sexton drives to the basket... Austin Sexton commits a violation (traveling/carry)! TURNOVER! (dead ball)

[07:36] Substitution (Team_051): Austin Sexton OUT → Myles Harden IN (stamina_rule2)

[07:36] Substitution (Team_051): Larry McGrady OUT → Zion Morant IN (stamina_rule2)

[07:36] Substitution (Team_051): OG Siakam OUT → Jrue Carter IN (stamina_rule2)

[07:36] Substitution (Team_051): Franz Simmons OUT → Tobias Jokic IN (stamina_rule2)

[07:36] Substitution (Team_051): Shaquille Harden OUT → Pau Tatum IN (stamina_rule2)

[07:36] Substitution (Team_047): De'Aaron Rose OUT → Austin Giddey IN (stamina_rule2)

[07:36] Substitution (Team_047): Derrick Irving OUT → Donovan Iverson IN (stamina_rule2)

[07:36] Substitution (Team_047): Blake Jokic OUT → Blake Jackson IN (stamina_rule2)

[07:36] Substitution (Team_047): Josh Harris OUT → Tony Poole IN (stamina_rule2)

[07:36] Substitution (Team_047): Myles LaVine OUT → Zion Thompson IN (stamina_rule2)

[07:25] Team_047 possession (Score: 26-37)
Blake Jackson attempts a 3Pt. Wide open! Myles Harden is 6.9 feet away. [ZONE] Blake Jackson misses. Offensive rebound by Blake Jackson! Blake Jackson kicks it out.

[07:10] Team_047 possession (Score: 26-37)
Tony Poole makes the Layup and draws the foul on Tobias Jokic! And-1! Tony Poole to the line for 1. [BONUS: 5 team fouls] (Tobias Jokic: 1 personal fouls)   FT 1/1: GOOD Tony Poole makes 1/1 from the line.
Score: 26-40

[06:59] Team_051 possession (Score: 26-40)
FOUL! Holding foul on Zion Thompson. [Team fouls: 2] No free throws, side out. (Zion Thompson: 1 personal fouls)

[06:41] Team_051 possession (Score: 26-40)
Tobias Jokic attempts a 3Pt. Wide open! Donovan Iverson is 7.2 feet away. [ZONE] Tobias Jokic misses. Rebound secured by Zion Thompson.

[06:26] Team_047 possession (Score: 26-40)
Blake Jackson attempts a 3Pt. Contested by Myles Harden (4.5 feet, ZONE). BLAKE JACKSON MAKES IT! Assist: Donovan Iverson
Score: 26-43

[06:14] Team_051 possession (Score: 26-43)
Jrue Carter attempts a Midrange. Contested by Blake Jackson (5.7 feet, MAN). Jrue Carter misses. Rebound secured by Blake Jackson.

[05:58] Team_047 possession (Score: 26-43)
Austin Giddey attempts a 3Pt. Wide open! Zion Morant is 10.0 feet away. [ZONE] Austin Giddey misses. Rebound secured by Pau Tatum.

[05:41] Team_051 possession (Score: 26-43)
Zion Morant attempts a Midrange. Contested by Donovan Iverson (4.9 feet, MAN). Zion Morant misses. Rebound secured by Blake Jackson.

[05:24] Team_047 possession (Score: 26-43)
Tony Poole attempts a 3Pt. Wide open! Tobias Jokic is 6.0 feet away. [MAN] TONY POOLE MAKES IT! Assist: Blake Jackson
Score: 26-46

[05:11] Team_051 possession (Score: 26-46)
Zion Morant attempts a Layup. BLOCKED BY ZION THOMPSON! Ball is loose! Rebound secured by Donovan Iverson.

[04:59] Team_047 possession (Score: 26-46)
Zion Thompson drives, Pau Tatum stays with him. Zion Thompson attempts a Dunk. Heavily contested by Pau Tatum (1.8 feet, MAN)! Zion Thompson misses. Rebound secured by Tobias Jokic.

[04:43] Team_051 possession (Score: 26-46)
Tobias Jokic attempts a Midrange. Contested by Tony Poole (5.9 feet, MAN). TOBIAS JOKIC MAKES IT! Assist: Jrue Carter
Score: 28-46

[04:25] Team_047 possession (Score: 28-46)
Austin Giddey attempts a Layup. Contested by Myles Harden (2.2 feet, MAN). Austin Giddey misses. FOUL! Loose ball foul on Tobias Jokic during the rebound battle. [IN THE BONUS! 6 team fouls] Zion Thompson to the line for 2 free throws. (Tobias Jokic: 2 personal fouls)   FT 1/2: MISS   FT 2/2: MISS Zion Thompson makes 0/2 from the line. Rebound secured by Tobias Jokic.

[04:07] Team_051 possession (Score: 28-46)
FOUL! Reach-in foul on Austin Giddey during the drive. [Team fouls: 3] No free throws, side out. (Austin Giddey: 1 personal fouls)

[03:54] Team_051 possession (Score: 28-46)
Tobias Jokic drives, picks up Tony Poole. Help arrives from Donovan Iverson! Tobias Jokic attempts a Dunk. Contested by Donovan Iverson (2.1 feet, MAN). TOBIAS JOKIC MAKES IT! Assist: Jrue Carter
Score: 30-46

[03:41] Team_047 possession (Score: 30-46)
Tony Poole attempts a 3Pt. Wide open! Myles Harden is 6.8 feet away. [ZONE] TONY POOLE MAKES IT! Assist: Zion Thompson
Score: 30-49

[03:28] Team_051 possession (Score: 30-49)
Tobias Jokic attempts a Midrange. Contested by Tony Poole (2.1 feet, MAN). TOBIAS JOKIC MAKES IT!
Score: 32-49

[03:16] Team_047 possession (Score: 32-49)
Donovan Iverson attempts a 3Pt. Wide open! Zion Morant is 6.1 feet away. [MAN] Donovan Iverson misses. Rebound secured by Myles Harden.

[03:01] Team_051 possession (Score: 32-49)
FOUL! Reach-in foul on Zion Thompson during the drive. [Team fouls: 4] No free throws, side out. (Zion Thompson: 2 personal fouls)

[02:46] Team_051 possession (Score: 32-49)
Myles Harden attempts a 3Pt. Contested by Austin Giddey (4.3 feet, ZONE). Myles Harden misses. Offensive rebound by Pau Tatum! Pau Tatum puts it back in!
Score: 34-49

[02:31] Team_047 possession (Score: 34-49)
Austin Giddey attempts a 3Pt. Wide open! Zion Morant is 7.4 feet away. [ZONE] AUSTIN GIDDEY MAKES IT! Assist: Blake Jackson
Score: 34-52

[02:20] Team_051 possession (Score: 34-52)
Tobias Jokic attempts a 3Pt. Wide open! Donovan Iverson is 7.2 feet away. [ZONE] Tobias Jokic misses. Rebound secured by Donovan Iverson.

[02:04] Team_047 possession (Score: 34-52)
Donovan Iverson drives and kicks out. Tony Poole attempts a Midrange. Contested by Tobias Jokic (3.1 feet, MAN). TONY POOLE MAKES IT! Assist: Zion Thompson
Score: 34-54

[01:45] Team_051 possession (Score: 34-54)
FOUL! Shooting foul on Donovan Iverson. Myles Harden to the line for 2 free throws. [BONUS: 5 team fouls] (Donovan Iverson: 1 personal fouls)   FT 1/2: GOOD   FT 2/2: MISS Myles Harden makes 1/2 from the line. Rebound secured by Zion Thompson.
Score: 35-54

[01:33] Team_047 possession (Score: 35-54)
Tony Poole attempts a 3Pt. Contested by Myles Harden (5.0 feet, ZONE). TONY POOLE MAKES IT! Assist: Zion Thompson
Score: 35-57

[01:23] Team_051 possession (Score: 35-57)
Jrue Carter attempts a 3Pt. Contested by Blake Jackson (2.2 feet, MAN). Jrue Carter misses. Rebound secured by Donovan Iverson.

[01:11] Team_047 possession (Score: 35-57)
Austin Giddey attempts a 3Pt. Contested by Myles Harden (5.8 feet, ZONE). Austin Giddey misses. Rebound secured by Myles Harden.

[00:58] Team_051 possession (Score: 35-57)
Zion Morant commits a violation (traveling/carry)! TURNOVER! (dead ball)

[00:40] Team_047 possession (Score: 35-57)
Austin Giddey attempts a Layup. Contested by Myles Harden (2.0 feet, MAN). AUSTIN GIDDEY MAKES IT! Assist: Zion Thompson
Score: 35-59

[00:28] Team_051 possession (Score: 35-59)
Pau Tatum drives, picks up Zion Thompson. Help arrives from Donovan Iverson! Pau Tatum attempts a Dunk. Heavily contested by Donovan Iverson (0.5 feet, MAN)! PAU TATUM MAKES IT!
Score: 37-59

[00:09] Team_047 possession (Score: 37-59)
Austin Giddey attempts a 3Pt. Contested by Myles Harden (5.5 feet, ZONE). AUSTIN GIDDEY MAKES IT!
Score: 37-62

================================================================================
                              2ND QUARTER COMPLETE                              
================================================================================

2ND QUARTER SCORE: Team_051 16, Team_047 37

BOX SCORE:
================================================================================

Team_051
--------------------------------------------------------------------------------
Player                MIN  PTS  REB  AST  TO      FG   FG%      3P   3P%
--------------------------------------------------------------------------------
Tobias Jokic            7    6    2    0   0   3/5    60.0     0/0   0.0
Shaquille Harden       17    5    2    0   0   2/2   100.0     0/0   0.0
Pau Tatum               7    4    2    0   0   2/2   100.0     0/0   0.0
Austin Sexton          17    0    0    0   0   0/2     0.0     0/0   0.0
Franz Simmons          17    0    1    0   0   0/1     0.0     0/0   0.0
Jrue Carter             7    0    0    2   0   0/2     0.0     0/0   0.0
Zion Morant             7    0    0    0   0   0/2     0.0     0/0   0.0
Myles Harden            7    0    2    0   0   0/1     0.0     0/0   0.0

TEAM: FG: 7/17 (41.2%), 3PT: 1/5 (20.0%), REB: 8 (1 off, 7 def), AST: 2, TO: 5
TEAM FOULS: 6 [Team_047 in BONUS]


Team_047
--------------------------------------------------------------------------------
Player                MIN  PTS  REB  AST  TO      FG   FG%      3P   3P%
--------------------------------------------------------------------------------
Tony Poole              7   14    0    0   0   5/5   100.0     0/0   0.0
Derrick Irving         17    8    1    0   0   3/3   100.0     0/0   0.0
Austin Giddey           7    8    0    0   0   3/6    50.0     0/0   0.0
Myles LaVine           17    4    1    0   0   2/2   100.0     0/0   0.0
Blake Jackson           7    3    3    2   0   1/1   100.0     0/0   0.0
Blake Jokic            17    0    0    0   0   0/2     0.0     0/0   0.0
Josh Harris            17    0    1    0   0   0/0     0.0     0/0   0.0
De'Aaron Rose          17    0    0    1   0   0/1     0.0     0/0   0.0
Zion Thompson           7    0    2    4   0   0/1     0.0     0/0   0.0
Donovan Iverson         7    0    3    1   0   0/1     0.0     0/0   0.0

TEAM: FG: 14/22 (63.6%), 3PT: 8/13 (61.5%), REB: 12 (2 off, 10 def), AST: 8, TO: 0
TEAM FOULS: 5 [Team_051 in BONUS]

================================================================================

================================================================================
                       3RD QUARTER - Team_051 vs Team_047                       
================================================================================

[12:00] Team_051 possession (Score: 37-62)
FOUL! Shooting foul on De'Aaron Rose. Austin Sexton to the line for 3 free throws. [Team fouls: 1] (De'Aaron Rose: 1 personal fouls)   FT 1/3: GOOD   FT 2/3: GOOD   FT 3/3: GOOD Austin Sexton makes 3/3 from the line.
Score: 40-62

[11:46] Team_047 possession (Score: 40-62)
FOUL! Offensive foul on Myles LaVine! Shaquille Harden drew the charge! [Team fouls: 2] (Myles LaVine: 1 personal fouls) TURNOVER! (dead ball)

[11:33] Team_051 possession (Score: 40-62)
Shaquille Harden drives, picks up Josh Harris. Help arrives from Derrick Irving! Shaquille Harden attempts a Layup. Heavily contested by Derrick Irving (1.2 feet, ZONE)! SHAQUILLE HARDEN MAKES IT! Assist: Austin Sexton
Score: 42-62

[11:16] Team_047 possession (Score: 42-62)
Myles LaVine attempts a 3Pt. Wide open! Austin Sexton is 7.1 feet away. [ZONE] Myles LaVine misses. Rebound secured by Franz Simmons.

[11:00] Team_051 possession (Score: 42-62)
Larry McGrady attempts a 3Pt. Contested by Derrick Irving (2.1 feet, MAN). Larry McGrady misses. Offensive rebound by Shaquille Harden! Shaquille Harden's putback is no good. Rebound secured by Josh Harris.

[10:48] Team_047 possession (Score: 42-62)
Blake Jokic attempts a Midrange. Wide open! OG Siakam is 6.8 feet away. [MAN] BLAKE JOKIC MAKES IT!
Score: 42-64

[10:35] Team_051 possession (Score: 42-64)
Franz Simmons attempts a 3Pt. Wide open! Blake Jokic is 6.0 feet away. [ZONE] Franz Simmons misses. Rebound secured by Josh Harris.

[10:19] Team_047 possession (Score: 42-64)
Blake Jokic attempts a Midrange. Contested by OG Siakam (3.1 feet, MAN). Blake Jokic misses. Rebound secured by Franz Simmons.

[10:08] Team_051 possession (Score: 42-64)
Larry McGrady attempts a Midrange. Contested by Derrick Irving (5.0 feet, MAN). Larry McGrady misses. Rebound secured by Myles LaVine.

[09:52] Team_047 possession (Score: 42-64)
Blake Jokic drives, OG Siakam stays with him. Blake Jokic attempts a Layup. Contested by OG Siakam (3.1 feet, MAN). BLAKE JOKIC MAKES IT! Assist: De'Aaron Rose
Score: 42-66

[09:38] Team_051 possession (Score: 42-66)
Franz Simmons attempts a Layup. Heavily contested by Josh Harris (0.5 feet, MAN)! FRANZ SIMMONS MAKES IT! Assist: OG Siakam
Score: 44-66

[09:27] Team_047 possession (Score: 44-66)
Myles LaVine attempts a Midrange. Contested by Franz Simmons (5.1 feet, ZONE). MYLES LAVINE MAKES IT!
Score: 44-68

[09:13] Team_051 possession (Score: 44-68)
Austin Sexton attempts a 3Pt. Wide open! De'Aaron Rose is 6.2 feet away. [MAN] AUSTIN SEXTON MAKES IT! Assist: Shaquille Harden
Score: 47-68

[08:57] Team_047 possession (Score: 47-68)
Blake Jokic attempts a 3Pt. Contested by OG Siakam (3.4 feet, MAN). BLAKE JOKIC MAKES IT! Assist: Derrick Irving
Score: 47-71

[08:44] Team_051 possession (Score: 47-71)
OG Siakam drives to the basket... OG Siakam loses the ball! Stripped by Blake Jokic! TURNOVER! (live ball)

[08:34] Team_047 possession (Score: 47-71)
Derrick Irving attempts a 3Pt. Contested by Austin Sexton (3.2 feet, ZONE). Derrick Irving misses. Rebound secured by Shaquille Harden.

[08:20] Team_051 possession (Score: 47-71)
FOUL! Shooting foul on Derrick Irving. Larry McGrady to the line for 2 free throws. [Team fouls: 3] (Derrick Irving: 1 personal fouls)   FT 1/2: GOOD   FT 2/2: GOOD Larry McGrady makes 2/2 from the line.
Score: 49-71

[08:06] Team_047 possession (Score: 49-71)
De'Aaron Rose attempts a 3Pt. Wide open! Austin Sexton is 6.4 feet away. [ZONE] De'Aaron Rose misses. Offensive rebound by Myles LaVine! Myles LaVine kicks it out.

[07:51] Team_047 possession (Score: 49-71)
De'Aaron Rose attempts a 3Pt. Wide open! Austin Sexton is 7.2 feet away. [ZONE] De'Aaron Rose misses. Rebound secured by OG Siakam.

[07:36] Team_051 possession (Score: 49-71)
Franz Simmons drives, Josh Harris stays with him. Franz Simmons attempts a Dunk. Heavily contested by Josh Harris (0.5 feet, MAN)! FRANZ SIMMONS MAKES IT!
Score: 51-71

[07:25] Team_047 possession (Score: 51-71)
Derrick Irving attempts a 3Pt. Contested by Austin Sexton (5.3 feet, ZONE). Derrick Irving misses. Rebound secured by Franz Simmons.

[07:13] Team_051 possession (Score: 51-71)
Austin Sexton attempts a Midrange. Contested by De'Aaron Rose (5.4 feet, MAN). Austin Sexton misses. Offensive rebound by Franz Simmons! Franz Simmons kicks it out.

[07:03] Team_051 possession (Score: 51-71)
FOUL! Shooting foul on De'Aaron Rose. Austin Sexton to the line for 3 free throws. [Team fouls: 4] (De'Aaron Rose: 2 personal fouls)   FT 1/3: GOOD   FT 2/3: GOOD   FT 3/3: GOOD Austin Sexton makes 3/3 from the line.
Score: 54-71

[06:50] Team_047 possession (Score: 54-71)
Myles LaVine drives, Shaquille Harden stays with him. Myles LaVine attempts a Layup. Heavily contested by Shaquille Harden (1.4 feet, MAN)! Myles LaVine misses. Rebound secured by Shaquille Harden.

[06:37] Team_051 possession (Score: 54-71)
Shaquille Harden makes the Dunk and draws the foul on Josh Harris! And-1! Shaquille Harden to the line for 1. [BONUS: 5 team fouls] (Josh Harris: 1 personal fouls)   FT 1/1: GOOD Shaquille Harden makes 1/1 from the line.
Score: 57-71

[06:21] Team_047 possession (Score: 57-71)
FOUL! Holding foul on Austin Sexton. [Team fouls: 1] No free throws, side out. (Austin Sexton: 1 personal fouls)

[06:08] Team_047 possession (Score: 57-71)
FOUL! Shooting foul on Franz Simmons. Josh Harris to the line for 2 free throws. [Team fouls: 2] (Franz Simmons: 1 personal fouls)   FT 1/2: GOOD   FT 2/2: MISS Josh Harris makes 1/2 from the line. Rebound secured by Shaquille Harden.
Score: 57-72

[05:52] Team_051 possession (Score: 57-72)
Shaquille Harden makes the Dunk and draws the foul on Derrick Irving! And-1! Shaquille Harden to the line for 1. [BONUS: 6 team fouls] (Derrick Irving: 2 personal fouls)   FT 1/1: GOOD Shaquille Harden makes 1/1 from the line.
Score: 60-72

[05:38] Team_047 possession (Score: 60-72)
Myles LaVine attempts a Midrange. Contested by Larry McGrady (4.6 feet, ZONE). Myles LaVine misses. Rebound secured by Franz Simmons.

[05:19] Team_051 possession (Score: 60-72)
Shaquille Harden drives and kicks out. Franz Simmons attempts a 3Pt. Contested by De'Aaron Rose (4.5 feet, ZONE). Franz Simmons misses. Rebound secured by Derrick Irving.

[05:03] Team_047 possession (Score: 60-72)
De'Aaron Rose attempts a 3Pt. Contested by Austin Sexton (4.6 feet, ZONE). DE'AARON ROSE MAKES IT!
Score: 60-75

[04:48] Team_051 possession (Score: 60-75)
FOUL! Shooting foul on Derrick Irving. Franz Simmons to the line for 2 free throws. [BONUS: 7 team fouls] (Derrick Irving: 3 personal fouls)   FT 1/2: MISS   FT 2/2: GOOD Franz Simmons makes 1/2 from the line.
Score: 61-75

[04:35] Team_047 possession (Score: 61-75)
Myles LaVine drives and kicks out. Derrick Irving attempts a 3Pt. Contested by Austin Sexton (4.8 feet, ZONE). Derrick Irving misses. Rebound secured by Shaquille Harden.

[04:15] Team_051 possession (Score: 61-75)
Shaquille Harden attempts a 3Pt. Contested by De'Aaron Rose (2.9 feet, ZONE). Shaquille Harden misses. Rebound secured by Derrick Irving.

[03:59] Team_047 possession (Score: 61-75)
Derrick Irving drives to the basket... FOUL! Offensive foul on Derrick Irving! Shaquille Harden drew the charge! [Team fouls: 8] (Derrick Irving: 4 personal fouls) TURNOVER! (dead ball)

[03:41] Team_051 possession (Score: 61-75)
Larry McGrady drives and kicks out. OG Siakam attempts a 3Pt. Wide open! De'Aaron Rose is 6.7 feet away. [ZONE] OG Siakam misses. Rebound secured by Derrick Irving.

[03:23] Team_047 possession (Score: 61-75)
Josh Harris attempts a 3Pt. Contested by Franz Simmons (4.6 feet, MAN). JOSH HARRIS MAKES IT! Assist: Blake Jokic
Score: 61-78

[03:12] Team_051 possession (Score: 61-78)
Franz Simmons makes the Dunk and draws the foul on Josh Harris! And-1! Franz Simmons to the line for 1. [BONUS: 9 team fouls] (Josh Harris: 2 personal fouls)   FT 1/1: GOOD Franz Simmons makes 1/1 from the line.
Score: 64-78

[02:54] Team_047 possession (Score: 64-78)
Derrick Irving attempts a Layup. BLOCKED BY FRANZ SIMMONS! Ball is loose! Rebound secured by Shaquille Harden.

[02:35] Team_051 possession (Score: 64-78)
Franz Simmons attempts a Midrange. Heavily contested by Josh Harris (1.9 feet, ZONE)! Franz Simmons misses. Rebound secured by Josh Harris.

[02:22] Team_047 possession (Score: 64-78)
Josh Harris attempts a Midrange. BLOCKED BY FRANZ SIMMONS! Ball goes out off Franz Simmons. Josh Harris's ball!

[02:12] Team_047 possession (Score: 64-78)
Blake Jokic drives, Franz Simmons stays with him. Blake Jokic attempts a Dunk. Contested by Franz Simmons (3.8 feet, ZONE). Blake Jokic misses. Rebound secured by Shaquille Harden.

[01:56] Team_051 possession (Score: 64-78)
Larry McGrady attempts a 3Pt. Contested by Derrick Irving (6.0 feet, MAN). Larry McGrady misses. Rebound secured by Derrick Irving.

[01:44] Team_047 possession (Score: 64-78)
FOUL! Shooting foul on Shaquille Harden. Myles LaVine to the line for 2 free throws. [Team fouls: 3] (Shaquille Harden: 1 personal fouls)   FT 1/2: GOOD   FT 2/2: GOOD Myles LaVine makes 2/2 from the line.
Score: 64-80

[01:29] Team_051 possession (Score: 64-80)
Austin Sexton attempts a Midrange. Heavily contested by De'Aaron Rose (1.6 feet, MAN)! Austin Sexton misses. Rebound secured by Derrick Irving.

[01:14] Team_047 possession (Score: 64-80)
Josh Harris drives to the basket... FOUL! Offensive foul on Josh Harris! Franz Simmons drew the charge! [Team fouls: 10] (Josh Harris: 3 personal fouls) TURNOVER! (dead ball)

[01:01] Team_051 possession (Score: 64-80)
Austin Sexton drives to the basket... Austin Sexton throws a bad pass out of bounds! TURNOVER! (dead ball)

[01:01] Substitution (Team_051): Austin Sexton OUT → Myles Harden IN (stamina_rule2)

[01:01] Substitution (Team_051): Larry McGrady OUT → Zion Morant IN (stamina_rule2)

[01:01] Substitution (Team_051): OG Siakam OUT → Jrue Carter IN (stamina_rule2)

[01:01] Substitution (Team_051): Franz Simmons OUT → Tobias Jokic IN (stamina_rule2)

[01:01] Substitution (Team_051): Shaquille Harden OUT → Pau Tatum IN (stamina_rule2)

[01:01] Substitution (Team_047): De'Aaron Rose OUT → Austin Giddey IN (stamina_rule2)

[01:01] Substitution (Team_047): Derrick Irving OUT → Donovan Iverson IN (stamina_rule2)

[01:01] Substitution (Team_047): Blake Jokic OUT → Blake Jackson IN (stamina_rule2)

[01:01] Substitution (Team_047): Josh Harris OUT → Tony Poole IN (stamina_rule2)

[01:01] Substitution (Team_047): Myles LaVine OUT → Zion Thompson IN (stamina_rule2)

[00:45] Team_047 possession (Score: 64-80)
FOUL! Holding foul on Myles Harden. [Team fouls: 4] No free throws, side out. (Myles Harden: 1 personal fouls)

[00:33] Team_047 possession (Score: 64-80)
Tony Poole loses the ball! Stripped by Tobias Jokic! TURNOVER! (live ball)

[00:16] Team_051 possession (Score: 64-80)
Pau Tatum drives, Zion Thompson stays with him. Pau Tatum attempts a Dunk. Contested by Zion Thompson (4.1 feet, ZONE). PAU TATUM MAKES IT!
Score: 66-80

================================================================================
                              3RD QUARTER COMPLETE                              
================================================================================

3RD QUARTER SCORE: Team_051 29, Team_047 18

BOX SCORE:
================================================================================

Team_051
--------------------------------------------------------------------------------
Player                MIN  PTS  REB  AST  TO      FG   FG%      3P   3P%
--------------------------------------------------------------------------------
Austin Sexton          28    9    0    1   0   3/4    75.0     0/0   0.0
Shaquille Harden       28    8    6    1   0   3/5    60.0     0/0   0.0
Franz Simmons          28    8    5    0   0   4/6    66.7     0/0   0.0
Larry McGrady          28    2    0    0   0   1/5    20.0     0/0   0.0
Pau Tatum               8    2    0    0   0   1/1   100.0     0/0   0.0
OG Siakam              28    0    1    1   0   0/0     0.0     0/0   0.0

TEAM: FG: 12/21 (57.1%), 3PT: 3/7 (42.9%), REB: 13 (2 off, 11 def), AST: 3, TO: 2
TEAM FOULS: 4


Team_047
--------------------------------------------------------------------------------
Player                MIN  PTS  REB  AST  TO      FG   FG%      3P   3P%
--------------------------------------------------------------------------------
Blake Jokic            28    7    0    1   0   3/5    60.0     0/0   0.0
Myles LaVine           28    4    2    0   0   2/6    33.3     0/0   0.0
Josh Harris            28    3    3    0   0   1/2    50.0     0/0   0.0
De'Aaron Rose          28    3    0    1   0   1/2    50.0     0/0   0.0
Derrick Irving         28    0    5    1   0   0/3     0.0     0/0   0.0

TEAM: FG: 7/18 (38.9%), 3PT: 3/7 (42.9%), REB: 9 (1 off, 8 def), AST: 3, TO: 4
TEAM FOULS: 10 [Team_051 in BONUS]

================================================================================

================================================================================
                       4TH QUARTER - Team_051 vs Team_047                       
================================================================================

[12:00] Substitution (Team_051): Austin Sexton OUT (stamina: 74) → Myles Harden IN (comeback_detected)

[12:00] Substitution (Team_047): De'Aaron Rose OUT (stamina: 73) → Austin Giddey IN (comeback_detected)

[12:00] Team_051 possession (Score: 66-80)
OG Siakam attempts a Layup. Contested by Josh Harris (5.1 feet, ZONE). OG SIAKAM MAKES IT! Assist: Larry McGrady
Score: 68-80

[11:42] Team_047 possession (Score: 68-80)
Austin Giddey attempts a Layup. BLOCKED BY MYLES HARDEN! Ball is loose! Rebound secured by Shaquille Harden.

[11:28] Team_051 possession (Score: 68-80)
Myles Harden attempts a 3Pt. Contested by Austin Giddey (5.3 feet, ZONE). Myles Harden misses. Rebound secured by Myles LaVine.

[11:15] Team_047 possession (Score: 68-80)
Blake Jokic attempts a 3Pt. Heavily contested by OG Siakam (1.8 feet, MAN)! BLAKE JOKIC MAKES IT! Assist: Myles LaVine
Score: 68-83

[11:00] Team_051 possession (Score: 68-83)
Myles Harden attempts a 3Pt. Heavily contested by Austin Giddey (1.1 feet, ZONE)! Myles Harden misses. FOUL! Loose ball foul on Josh Harris during the rebound battle. [Team fouls: 1] No free throws, side out. (Josh Harris: 1 personal fouls)

[10:40] Team_051 possession (Score: 68-83)
Shaquille Harden drives, Josh Harris stays with him. Shaquille Harden attempts a Layup. Wide open! Josh Harris is 7.1 feet away. [ZONE] SHAQUILLE HARDEN MAKES IT! Assist: OG Siakam
Score: 70-83

[10:25] Team_047 possession (Score: 70-83)
Josh Harris attempts a Midrange. Contested by Franz Simmons (2.3 feet, MAN). JOSH HARRIS MAKES IT! Assist: Blake Jokic
Score: 70-85

[10:11] Team_051 possession (Score: 70-85)
Shaquille Harden drives and kicks out. Franz Simmons attempts a 3Pt. Contested by Derrick Irving (3.2 feet, ZONE). Franz Simmons misses. Rebound secured by Josh Harris.

[09:56] Team_047 possession (Score: 70-85)
Derrick Irving attempts a 3Pt. Wide open! Myles Harden is 8.0 feet away. [ZONE] DERRICK IRVING MAKES IT! Assist: Myles LaVine
Score: 70-88

[09:38] Team_051 possession (Score: 70-88)
Larry McGrady drives, picks up Derrick Irving. Help arrives from Blake Jokic! Larry McGrady attempts a Layup. Contested by Blake Jokic (2.3 feet, MAN). LARRY MCGRADY MAKES IT! Assist: Franz Simmons
Score: 72-88

[09:21] Team_047 possession (Score: 72-88)
Austin Giddey attempts a 3Pt. Wide open! Myles Harden is 6.1 feet away. [MAN] AUSTIN GIDDEY MAKES IT! Assist: Myles LaVine
Score: 72-91

[09:07] Team_051 possession (Score: 72-91)
Myles Harden attempts a Layup. Wide open! Josh Harris is 7.4 feet away. [ZONE] MYLES HARDEN MAKES IT! Assist: OG Siakam
Score: 74-91

[08:51] Team_047 possession (Score: 74-91)
Josh Harris loses control! Ball rolls out of bounds! TURNOVER! (dead ball)

[08:51] Substitution (Team_051): Larry McGrady OUT → Zion Morant IN (stamina_rule2)

[08:51] Substitution (Team_051): OG Siakam OUT → Jrue Carter IN (stamina_rule2)

[08:51] Substitution (Team_051): Franz Simmons OUT → Tobias Jokic IN (stamina_rule2)

[08:51] Substitution (Team_051): Shaquille Harden OUT → Pau Tatum IN (stamina_rule2)

[08:51] Substitution (Team_047): Derrick Irving OUT → Donovan Iverson IN (stamina_rule2)

[08:51] Substitution (Team_047): Blake Jokic OUT → Blake Jackson IN (stamina_rule2)

[08:51] Substitution (Team_047): Josh Harris OUT → Tony Poole IN (stamina_rule2)

[08:51] Substitution (Team_047): Myles LaVine OUT → Zion Thompson IN (stamina_rule2)

[08:39] Team_051 possession (Score: 74-91)
Zion Morant attempts a 3Pt. Contested by Donovan Iverson (4.9 feet, MAN). Zion Morant misses. Rebound secured by Donovan Iverson.

[08:27] Team_047 possession (Score: 74-91)
FOUL! Shooting foul on Myles Harden. Austin Giddey to the line for 3 free throws. [Team fouls: 1] (Myles Harden: 1 personal fouls)   FT 1/3: GOOD   FT 2/3: GOOD   FT 3/3: GOOD Austin Giddey makes 3/3 from the line.
Score: 74-94

[08:10] Team_051 possession (Score: 74-94)
Zion Morant loses the ball! Stripped by Donovan Iverson! TURNOVER! (live ball)

[07:54] Team_047 possession (Score: 74-94)
Zion Thompson commits a violation (traveling/carry)! TURNOVER! (dead ball)

[07:38] Team_051 possession (Score: 74-94)
Jrue Carter drives to the basket... FOUL! Offensive foul on Jrue Carter! Zion Thompson drew the charge! [Team fouls: 2] (Jrue Carter: 1 personal fouls) TURNOVER! (dead ball)

[07:19] Team_047 possession (Score: 74-94)
Donovan Iverson loses control! Ball rolls out of bounds! TURNOVER! (dead ball)

[07:04] Team_051 possession (Score: 74-94)
Myles Harden drives to the basket... Myles Harden throws a bad pass! Stolen by Austin Giddey! TURNOVER! (live ball)

[06:52] Team_047 possession (Score: 74-94)
Tony Poole attempts a Midrange. Wide open! Zion Morant is 6.7 feet away. [ZONE] Tony Poole misses. Rebound secured by Tobias Jokic.

[06:33] Team_051 possession (Score: 74-94)
Pau Tatum makes the Layup and draws the foul on Zion Thompson! And-1! Pau Tatum to the line for 1. [Team fouls: 2] (Zion Thompson: 1 personal fouls)   FT 1/1: GOOD Pau Tatum makes 1/1 from the line.
Score: 77-94

[06:16] Team_047 possession (Score: 77-94)
Austin Giddey drives to the basket... FOUL! Offensive foul on Austin Giddey! Pau Tatum drew the charge! [Team fouls: 3] (Austin Giddey: 1 personal fouls) TURNOVER! (dead ball)

[06:01] Team_051 possession (Score: 77-94)
Jrue Carter attempts a 3Pt. Contested by Blake Jackson (5.0 feet, MAN). Jrue Carter misses. Rebound secured by Blake Jackson.

[05:47] Team_047 possession (Score: 77-94)
Blake Jackson loses the ball! Stripped by Jrue Carter! TURNOVER! (live ball)

[05:32] Team_051 possession (Score: 77-94)
Myles Harden attempts a 3Pt. Contested by Austin Giddey (5.6 feet, MAN). MYLES HARDEN MAKES IT! Assist: Pau Tatum
Score: 80-94

[05:16] Team_047 possession (Score: 80-94)
Donovan Iverson attempts a Midrange. Contested by Zion Morant (5.4 feet, MAN). DONOVAN IVERSON MAKES IT! Assist: Tony Poole
Score: 80-96

[04:57] Team_051 possession (Score: 80-96)
Tobias Jokic attempts a Layup. Contested by Tony Poole (5.2 feet, ZONE). TOBIAS JOKIC MAKES IT! Assist: Jrue Carter
Score: 82-96

[04:39] Team_047 possession (Score: 82-96)
Donovan Iverson attempts a Midrange. Contested by Zion Morant (5.8 feet, MAN). DONOVAN IVERSON MAKES IT!
Score: 82-98

[04:27] Team_051 possession (Score: 82-98)
Tobias Jokic attempts a Midrange. Wide open! Donovan Iverson is 7.7 feet away. [ZONE] Tobias Jokic misses. Rebound secured by Zion Thompson.

[04:10] Team_047 possession (Score: 82-98)
Donovan Iverson attempts a 3Pt. Wide open! Zion Morant is 7.0 feet away. [MAN] Donovan Iverson misses. Rebound secured by Pau Tatum.

[03:56] Team_051 possession (Score: 82-98)
Zion Morant makes the Layup and draws the foul on Blake Jackson! And-1! Zion Morant to the line for 1. [Team fouls: 4] (Blake Jackson: 1 personal fouls)   FT 1/1: GOOD Zion Morant makes 1/1 from the line.
Score: 85-98

[03:38] Team_047 possession (Score: 85-98)
FOUL! Shooting foul on Myles Harden. Austin Giddey to the line for 3 free throws. [Team fouls: 3] (Myles Harden: 2 personal fouls)   FT 1/3: GOOD   FT 2/3: GOOD   FT 3/3: GOOD Austin Giddey makes 3/3 from the line.
Score: 85-101

[03:24] Team_051 possession (Score: 85-101)
Tobias Jokic attempts a Layup. BLOCKED BY DONOVAN IVERSON! Ball is loose! Offensive rebound by Tobias Jokic! Tobias Jokic kicks it out.

[03:11] Team_051 possession (Score: 85-101)
Tobias Jokic attempts a 3Pt. Contested by Tony Poole (5.9 feet, MAN). Tobias Jokic misses. Rebound secured by Zion Thompson.

[03:01] Team_047 possession (Score: 85-101)
FOUL! Reach-in foul on Pau Tatum during the drive. [Team fouls: 4] No free throws, side out. (Pau Tatum: 1 personal fouls)

[02:46] Team_047 possession (Score: 85-101)
Blake Jackson attempts a 3Pt. Contested by Myles Harden (3.8 feet, ZONE). Blake Jackson misses. Rebound secured by Jrue Carter.

[02:31] Team_051 possession (Score: 85-101)
FOUL! Holding foul on Zion Thompson. [IN THE BONUS! 5 team fouls] Pau Tatum to the line for 2 free throws. (Zion Thompson: 2 personal fouls)   FT 1/2: MISS   FT 2/2: GOOD Pau Tatum makes 1/2 from the line.
Score: 86-101

[02:17] Team_047 possession (Score: 86-101)
Zion Thompson attempts a Midrange. Heavily contested by Pau Tatum (1.8 feet, ZONE)! Zion Thompson misses. Rebound secured by Pau Tatum.

[02:00] Team_051 possession (Score: 86-101)
Zion Morant attempts a 3Pt. Contested by Donovan Iverson (3.9 feet, MAN). Zion Morant misses. Rebound secured by Donovan Iverson.

[01:47] Team_047 possession (Score: 86-101)
Donovan Iverson attempts a Midrange. Wide open! Zion Morant is 7.1 feet away. [MAN] Donovan Iverson misses. Rebound secured by Pau Tatum.

[01:37] Team_051 possession (Score: 86-101)
Pau Tatum throws a bad pass! Stolen by Zion Thompson! TURNOVER! (live ball)

[01:24] Team_047 possession (Score: 86-101)
Tony Poole attempts a 3Pt. Wide open! Myles Harden is 8.6 feet away. [ZONE] Tony Poole misses. Rebound secured by Pau Tatum.

[01:06] Team_051 possession (Score: 86-101)
Jrue Carter attempts a Midrange. Wide open! Blake Jackson is 8.8 feet away. [MAN] JRUE CARTER MAKES IT!
Score: 88-101

[00:54] Team_047 possession (Score: 88-101)
Tony Poole attempts a Midrange. BLOCKED BY TOBIAS JOKIC! Ball is loose! Rebound secured by Pau Tatum.

[00:36] Team_051 possession (Score: 88-101)
Myles Harden attempts a Midrange. Contested by Austin Giddey (5.8 feet, MAN). MYLES HARDEN MAKES IT! Assist: Zion Morant
Score: 90-101

[00:25] Team_047 possession (Score: 90-101)
Zion Thompson throws a bad pass! Stolen by Pau Tatum! TURNOVER! (live ball)

[00:11] Team_051 possession (Score: 90-101)
Myles Harden attempts a Layup. Heavily contested by Zion Thompson (1.0 feet, ZONE)! Myles Harden misses. Offensive rebound by Pau Tatum! Pau Tatum puts it back in!
Score: 92-101

[00:01] Team_047 possession (Score: 92-101)
Tony Poole attempts a Layup. Heavily contested by Pau Tatum (1.8 feet, ZONE)! Tony Poole misses. Rebound secured by Tobias Jokic.

================================================================================
                              4TH QUARTER COMPLETE                              
================================================================================

4TH QUARTER SCORE: Team_051 26, Team_047 21

BOX SCORE:
================================================================================

Team_051
--------------------------------------------------------------------------------
Player                MIN  PTS  REB  AST  TO      FG   FG%      3P   3P%
--------------------------------------------------------------------------------
Myles Harden           20    7    0    0   0   3/4    75.0     0/0   0.0
Pau Tatum              17    6    6    1   0   3/3   100.0     0/0   0.0
Zion Morant            17    3    0    1   0   1/3    33.3     0/0   0.0
OG Siakam              31    2    0    2   0   1/1   100.0     0/0   0.0
Larry McGrady          31    2    0    1   0   1/1   100.0     0/0   0.0
Shaquille Harden       31    2    2    0   0   1/2    50.0     0/0   0.0
Tobias Jokic           17    2    3    0   0   1/3    33.3     0/0   0.0
Jrue Carter            17    2    1    1   0   1/2    50.0     0/0   0.0
Franz Simmons          31    0    0    1   0   0/0     0.0     0/0   0.0

TEAM: FG: 12/19 (63.2%), 3PT: 1/6 (16.7%), REB: 12 (3 off, 9 def), AST: 7, TO: 4
TEAM FOULS: 4


Team_047
--------------------------------------------------------------------------------
Player                MIN  PTS  REB  AST  TO      FG   FG%      3P   3P%
--------------------------------------------------------------------------------
Austin Giddey          20    9    0    0   0   3/4    75.0     0/0   0.0
Donovan Iverson        17    4    2    0   0   2/4    50.0     0/0   0.0
Blake Jokic            31    3    0    1   0   1/1   100.0     0/0   0.0
Derrick Irving         31    3    0    0   0   1/1   100.0     0/0   0.0
Josh Harris            31    2    1    0   0   1/1   100.0     0/0   0.0
Myles LaVine           31    0    1    3   0   0/0     0.0     0/0   0.0
Tony Poole             17    0    0    1   0   0/4     0.0     0/0   0.0
Blake Jackson          17    0    1    0   0   0/1     0.0     0/0   0.0
Zion Thompson          17    0    2    0   0   0/1     0.0     0/0   0.0

TEAM: FG: 8/17 (47.1%), 3PT: 5/8 (62.5%), REB: 7 (0 off, 7 def), AST: 5, TO: 6
TEAM FOULS: 5 [Team_051 in BONUS]

================================================================================

================================================================================
                               FULL GAME COMPLETE                               
================================================================================

FINAL SCORE: Team_051 92, Team_047 101

SCORING BY QUARTER:
--------------------------------------------------------------------------------
Team                     Q1     Q2     Q3     Q4    FINAL
--------------------------------------------------------------------------------
Team_051                 21     16     29     26       92
Team_047                 25     37     18     21      101
--------------------------------------------------------------------------------

FULL GAME BOX SCORE:
================================================================================

Team_051
--------------------------------------------------------------------------------
Player                MIN  PTS  REB  AST  TO      FG   FG%      3P   3P%      FT STL BLK
--------------------------------------------------------------------------------
Larry McGrady          31   10    0    2   3   4/10   40.0   1/4    25.0   3/3     0   1
OG Siakam              31    2    2    4   2   2/6    33.3   0/0     0.0   0/0     0   1
Franz Simmons          31   10   11    2   3   5/9    55.6   0/2     0.0   2/3     1   3
Shaquille Harden       31   22   14    2   1   7/10   70.0   0/1     0.0   4/4     0   0
Austin Sexton          28   15    0    1   2   7/11   63.6   3/5    60.0   6/6     0   1
Myles Harden           20    7    2    0   0   5/7    71.4   2/3    66.7   1/2     0   1
Zion Morant            17    3    0    1   2   1/5    20.0   0/2     0.0   1/1     0   0
Jrue Carter            17    2    1    3   1   1/4    25.0   0/2     0.0   0/0     1   0
Tobias Jokic           17    8    5    0   1   4/8    50.0   0/3     0.0   0/0     1   1
Pau Tatum              17   12    8    1   1   3/3   100.0   0/0     0.0   2/3     1   0

TEAM: FG: 40/74 (54.1%), 3PT: 6/22 (27.3%), REB: 44 (9 off, 35 def), AST: 16, TO: 16


Team_047
--------------------------------------------------------------------------------
Player                MIN  PTS  REB  AST  TO      FG   FG%      3P   3P%      FT STL BLK
--------------------------------------------------------------------------------
Derrick Irving         31   25    9    3   1   9/13   69.2   7/9    77.8   6/8     0   0
Blake Jokic            31   14    0    3   1   6/12   50.0   3/4    75.0   1/2     2   0
Josh Harris            31    9    6    1   1   4/8    50.0   1/2    50.0   1/2     3   1
Myles LaVine           31   10   10    5   2   5/10   50.0   0/1     0.0   2/2     0   0
De'Aaron Rose          28    3    0    2   2   1/4    25.0   1/4    25.0   0/0     1   1
Austin Giddey          20   17    0    0   1   6/10   60.0   5/7    71.4   6/6     1   0
Donovan Iverson        17    4    5    1   1   3/6    50.0   0/2     0.0   0/0     1   1
Blake Jackson          17    3    4    2   1   1/2    50.0   1/2    50.0   0/0     0   0
Tony Poole             17   14    0    1   1   4/8    50.0   3/4    75.0   1/1     0   0
Zion Thompson          17    0    4    4   2   0/2     0.0   0/0     0.0   0/2     1   1

TEAM: FG: 39/75 (52.0%), 3PT: 21/35 (60.0%), REB: 37 (5 off, 32 def), AST: 22, TO: 13

================================================================================
