================================================================================
                        FULL GAME - Team_030 vs Team_055                        
================================================================================

================================================================================
                       1ST QUARTER - Team_030 vs Team_055                       
================================================================================

[12:00] Team_030 possession (Score: 0-0)
Jordan Nowitzki attempts a 3Pt. Contested by Kevin Bane (4.7 feet, ZONE). Jordan Nowitzki misses. Rebound secured by Chris Turner.

[11:48] Team_055 possession (Score: 0-0)
FOUL! Reach-in foul on Jaren Green during the drive. [Team fouls: 1] No free throws, side out. (Jaren Green: 1 personal fouls)

[11:34] Team_055 possession (Score: 0-0)
Jrue Sabonis drives and kicks out. Chris Turner attempts a 3Pt. Wide open! Jaren Green is 6.0 feet away. [MAN] CHRIS TURNER MAKES IT! Assist: Shaquille Herro
Score: 0-3

[11:20] Team_030 possession (Score: 0-3)
Joel Anunoby attempts a Layup. Heavily contested by Kevin Bane (0.8 feet, MAN)! JOEL ANUNOBY MAKES IT!
Score: 2-3

[11:04] Team_055 possession (Score: 2-3)
Shaquille Herro attempts a 3Pt. Wide open! Tyler Beal is 7.8 feet away. [ZONE] Shaquille Herro misses. Rebound secured by Jordan Nowitzki.

[10:47] Team_030 possession (Score: 2-3)
Jordan Nowitzki attempts a Layup. Contested by Chris Turner (2.1 feet, MAN). JORDAN NOWITZKI MAKES IT! Assist: Tim Barrett
Score: 4-3

[10:31] Team_055 possession (Score: 4-3)
Chris Turner attempts a Midrange. Wide open! Jaren Green is 9.5 feet away. [MAN] Chris Turner misses. Rebound secured by Jordan Nowitzki.

[10:15] Team_030 possession (Score: 4-3)
Joel Anunoby attempts a Midrange. Wide open! Kevin Bane is 7.0 feet away. [MAN] Joel Anunoby misses. FOUL! Loose ball foul on Chris Turner during the rebound battle. [Team fouls: 1] No free throws, side out. (Chris Turner: 1 personal fouls)

[10:00] Team_030 possession (Score: 4-3)
Joel Anunoby attempts a 3Pt. Contested by Kevin Bane (2.0 feet, ZONE). Joel Anunoby misses. Offensive rebound by Joel Anunoby! Joel Anunoby kicks it out.

[09:44] Team_030 possession (Score: 4-3)
Jaren Green drives, Chris Turner stays with him. Jaren Green attempts a Layup. Contested by Chris Turner (2.3 feet, ZONE). JAREN GREEN MAKES IT! Assist: Tyler Beal
Score: 6-3

[09:27] Team_055 possession (Score: 6-3)
Jrue Sabonis attempts a Layup. BLOCKED BY JAREN GREEN! Ball is loose! Rebound secured by Jaren Green.

[09:10] Team_030 possession (Score: 6-3)
FOUL! Holding foul on Chris Turner. [Team fouls: 2] No free throws, side out. (Chris Turner: 2 personal fouls)

[08:59] Team_030 possession (Score: 6-3)
Tim Barrett throws a bad pass! Stolen by Shaquille Herro! TURNOVER! (live ball)

[08:45] Team_055 possession (Score: 6-3)
Chris Turner commits a violation (traveling/carry)! TURNOVER! (dead ball)

[08:30] Team_030 possession (Score: 6-3)
Tyler Beal attempts a Layup. BLOCKED BY SHAQUILLE HERRO! Ball deflects out of bounds off Tyler Beal.

[08:14] Team_055 possession (Score: 6-3)
Devin Siakam attempts a 3Pt. Contested by Tyler Beal (5.0 feet, MAN). Devin Siakam misses. Rebound secured by Joel Anunoby.

[08:03] Team_030 possession (Score: 6-3)
Jaren Green makes the Layup and draws the foul on Chris Turner! And-1! Jaren Green to the line for 1. [Team fouls: 3] (Chris Turner: 3 personal fouls)   FT 1/1: GOOD Jaren Green makes 1/1 from the line.
Score: 9-3

[07:48] Team_055 possession (Score: 9-3)
Shaquille Herro drives, picks up Tim Barrett. Help arrives from Joel Anunoby! Shaquille Herro attempts a Layup. Contested by Joel Anunoby (2.5 feet, MAN). Shaquille Herro misses. Rebound secured by Jordan Nowitzki.

[07:30] Team_030 possession (Score: 9-3)
Tyler Beal attempts a Layup. Heavily contested by Chris Turner (1.4 feet, ZONE)! Tyler Beal misses. Rebound secured by Jrue Sabonis.

[07:14] Team_055 possession (Score: 9-3)
Devin Siakam drives to the basket... Devin Siakam loses control! Ball rolls out of bounds! TURNOVER! (dead ball)

[06:59] Team_030 possession (Score: 9-3)
Jordan Nowitzki attempts a 3Pt. Contested by Kevin Bane (3.1 feet, ZONE). Jordan Nowitzki misses. Offensive rebound by Jordan Nowitzki! Jordan Nowitzki's putback is no good. Offensive rebound by Jordan Nowitzki! Jordan Nowitzki kicks it out.

[06:44] Team_030 possession (Score: 9-3)
Jaren Green attempts a Midrange. Contested by Chris Turner (4.0 feet, MAN). Jaren Green misses. FOUL! Loose ball foul on Chris Turner during the rebound battle. [Team fouls: 4] No free throws, side out. (Chris Turner: 4 personal fouls)

[06:30] Team_030 possession (Score: 9-3)
Jordan Nowitzki attempts a Midrange. Contested by Chris Turner (4.6 feet, MAN). Jordan Nowitzki misses. Rebound secured by Kevin Bane.

[06:14] Team_055 possession (Score: 9-3)
Devin Siakam attempts a 3Pt. Wide open! Tyler Beal is 7.7 feet away. [MAN] Devin Siakam misses. Rebound secured by Joel Anunoby.

[05:57] Team_030 possession (Score: 9-3)
Tim Barrett attempts a 3Pt. Heavily contested by Shaquille Herro (0.8 feet, MAN)! Tim Barrett misses. Offensive rebound by Joel Anunoby! Joel Anunoby kicks it out.

[05:42] Team_030 possession (Score: 9-3)
Jaren Green loses the ball! Stripped by Chris Turner! TURNOVER! (live ball)

[05:28] Team_055 possession (Score: 9-3)
Shaquille Herro drives and kicks out. Jrue Sabonis attempts a 3Pt. Contested by Jordan Nowitzki (3.5 feet, MAN). Jrue Sabonis misses. Rebound secured by Joel Anunoby.

[05:12] Team_030 possession (Score: 9-3)
Jordan Nowitzki throws a bad pass out of bounds! TURNOVER! (dead ball)

[04:58] Team_055 possession (Score: 9-3)
Jrue Sabonis drives to the basket... Jrue Sabonis throws a bad pass! Stolen by Jordan Nowitzki! TURNOVER! (live ball)

[04:40] Team_030 possession (Score: 9-3)
Jaren Green commits a violation (traveling/carry)! TURNOVER! (dead ball)

[04:23] Team_055 possession (Score: 9-3)
Kevin Bane attempts a Layup. Contested by Joel Anunoby (2.8 feet, MAN). KEVIN BANE MAKES IT!
Score: 9-5

[04:12] Team_030 possession (Score: 9-5)
Tyler Beal attempts a 3Pt. Wide open! Devin Siakam is 6.2 feet away. [MAN] Tyler Beal misses. Rebound secured by Chris Turner.

[03:56] Team_055 possession (Score: 9-5)
Chris Turner drives, Jaren Green stays with him. Chris Turner attempts a Dunk. Wide open! Jaren Green is 6.2 feet away. [ZONE] CHRIS TURNER MAKES IT! Assist: Shaquille Herro
Score: 9-7

[03:44] Team_030 possession (Score: 9-7)
Tim Barrett drives, Shaquille Herro stays with him. Tim Barrett attempts a Dunk. Contested by Shaquille Herro (3.8 feet, MAN). Tim Barrett misses. Rebound secured by Kevin Bane.

[03:26] Team_055 possession (Score: 9-7)
Jrue Sabonis attempts a Midrange. Wide open! Jordan Nowitzki is 6.7 feet away. [MAN] JRUE SABONIS MAKES IT!
Score: 9-9

[03:08] Team_030 possession (Score: 9-9)
Jaren Green drives, picks up Chris Turner. Help arrives from Shaquille Herro! Jaren Green attempts a Dunk. Contested by Shaquille Herro (2.9 feet, MAN). JAREN GREEN MAKES IT!
Score: 11-9

[02:49] Team_055 possession (Score: 11-9)
Shaquille Herro drives and kicks out. Chris Turner attempts a 3Pt. Wide open! Tyler Beal is 6.3 feet away. [ZONE] Chris Turner misses. Rebound secured by Joel Anunoby.

[02:30] Team_030 possession (Score: 11-9)
Joel Anunoby attempts a Layup. Contested by Kevin Bane (3.0 feet, MAN). JOEL ANUNOBY MAKES IT! Assist: Tim Barrett
Score: 13-9

[02:14] Team_055 possession (Score: 13-9)
Shaquille Herro attempts a Layup. Contested by Jaren Green (4.6 feet, ZONE). SHAQUILLE HERRO MAKES IT! Assist: Kevin Bane
Score: 13-11

[01:58] Team_030 possession (Score: 13-11)
Tyler Beal makes the Layup and draws the foul on Shaquille Herro! And-1! Tyler Beal to the line for 1. [BONUS: 5 team fouls] (Shaquille Herro: 1 personal fouls)   FT 1/1: GOOD Tyler Beal makes 1/1 from the line.
Score: 16-11

[01:40] Team_055 possession (Score: 16-11)
Kevin Bane attempts a Layup. Contested by Jaren Green (4.2 feet, ZONE). Kevin Bane misses. Rebound secured by Jaren Green.

[01:29] Team_030 possession (Score: 16-11)
Tyler Beal attempts a Layup. BLOCKED BY SHAQUILLE HERRO! Ball deflects out of bounds off Tyler Beal.

[01:12] Team_055 possession (Score: 16-11)
FOUL! Holding foul on Jaren Green. [Team fouls: 2] No free throws, side out. (Jaren Green: 2 personal fouls)

[00:56] Team_055 possession (Score: 16-11)
Devin Siakam attempts a Layup. Contested by Jaren Green (2.6 feet, ZONE). DEVIN SIAKAM MAKES IT!
Score: 16-13

[00:39] Team_030 possession (Score: 16-13)
Tim Barrett attempts a 3Pt. Contested by Shaquille Herro (4.2 feet, MAN). Tim Barrett misses. Rebound secured by Jrue Sabonis.

[00:24] Team_055 possession (Score: 16-13)
Kevin Bane drives to the basket... Kevin Bane loses the ball! Stripped by Joel Anunoby! TURNOVER! (live ball)

[00:10] Team_030 possession (Score: 16-13)
Tim Barrett drives, Shaquille Herro stays with him. Tim Barrett attempts a Dunk. Contested by Shaquille Herro (3.2 feet, MAN). TIM BARRETT MAKES IT! Assist: Tyler Beal
Score: 18-13

================================================================================
                              1ST QUARTER COMPLETE                              
================================================================================

1ST QUARTER SCORE: Team_030 18, Team_055 13

BOX SCORE:
================================================================================

Team_030
--------------------------------------------------------------------------------
Player                MIN  PTS  REB  AST  TO      FG   FG%      3P   3P%
--------------------------------------------------------------------------------
Jaren Green            12    7    2    0   0   3/3   100.0     0/0   0.0
Joel Anunoby           12    4    7    0   0   2/2   100.0     0/0   0.0
Tyler Beal             12    3    0    2   0   1/5    20.0     0/0   0.0
Jordan Nowitzki        12    2    5    0   0   1/3    33.3     0/0   0.0
Tim Barrett            12    2    0    2   0   1/3    33.3     0/0   0.0

TEAM: FG: 8/16 (50.0%), 3PT: 0/3 (0.0%), REB: 14 (5 off, 9 def), AST: 4, TO: 4
TEAM FOULS: 2


Team_055
--------------------------------------------------------------------------------
Player                MIN  PTS  REB  AST  TO      FG   FG%      3P   3P%
--------------------------------------------------------------------------------
Chris Turner           12    5    2    0   0   2/3    66.7     0/0   0.0
Shaquille Herro        12    2    0    2   0   1/5    20.0     0/0   0.0
Jrue Sabonis           12    2    2    0   0   1/2    50.0     0/0   0.0
Devin Siakam           12    2    0    0   0   1/3    33.3     0/0   0.0
Kevin Bane             12    2    2    1   0   1/2    50.0     0/0   0.0

TEAM: FG: 6/15 (40.0%), 3PT: 0/3 (0.0%), REB: 6 (0 off, 6 def), AST: 3, TO: 4
TEAM FOULS: 5 [Team_030 in BONUS]

================================================================================

================================================================================
                       2ND QUARTER - Team_030 vs Team_055                       
================================================================================

[12:00] Team_030 possession (Score: 18-13)
Tyler Beal attempts a Midrange. Wide open! Jrue Sabonis is 6.6 feet away. [ZONE] TYLER BEAL MAKES IT!
Score: 20-13

[11:46] Team_055 possession (Score: 20-13)
Chris Turner attempts a Midrange. Wide open! Jaren Green is 6.5 feet away. [MAN] CHRIS TURNER MAKES IT!
Score: 20-15

[11:29] Team_030 possession (Score: 20-15)
Tyler Beal attempts a 3Pt. Contested by Devin Siakam (3.4 feet, MAN). TYLER BEAL MAKES IT! Assist: Jordan Nowitzki
Score: 23-15

[11:14] Team_055 possession (Score: 23-15)
Jrue Sabonis drives, Jaren Green stays with him. Jrue Sabonis attempts a Dunk. Contested by Jaren Green (5.0 feet, ZONE). JRUE SABONIS MAKES IT!
Score: 23-17

[10:59] Team_030 possession (Score: 23-17)
Jordan Nowitzki drives, Chris Turner stays with him. Jordan Nowitzki attempts a Layup. Contested by Chris Turner (2.5 feet, MAN). Jordan Nowitzki misses. Offensive rebound by Joel Anunoby! Joel Anunoby kicks it out.

[10:45] Team_030 possession (Score: 23-17)
FOUL! Holding foul on Chris Turner. [Team fouls: 1] No free throws, side out. (Chris Turner: 1 personal fouls)

[10:29] Team_030 possession (Score: 23-17)
Joel Anunoby attempts a 3Pt. Contested by Kevin Bane (4.7 feet, ZONE). Joel Anunoby misses. Rebound secured by Chris Turner.

[10:15] Team_055 possession (Score: 23-17)
Kevin Bane attempts a 3Pt. Contested by Tyler Beal (2.2 feet, ZONE). Kevin Bane misses. Offensive rebound by Chris Turner! Chris Turner puts it back in!
Score: 23-19

[09:56] Team_030 possession (Score: 23-19)
Joel Anunoby attempts a 3Pt. Contested by Kevin Bane (3.9 feet, ZONE). Joel Anunoby misses. Rebound secured by Jrue Sabonis.

[09:43] Team_055 possession (Score: 23-19)
Chris Turner attempts a Midrange. Contested by Joel Anunoby (5.8 feet, ZONE). CHRIS TURNER MAKES IT! Assist: Shaquille Herro
Score: 23-21

[09:26] Team_030 possession (Score: 23-21)
Joel Anunoby attempts a Midrange. Heavily contested by Kevin Bane (0.8 feet, MAN)! JOEL ANUNOBY MAKES IT! Assist: Jordan Nowitzki
Score: 25-21

[09:08] Team_055 possession (Score: 25-21)
Jrue Sabonis attempts a Layup. BLOCKED BY JORDAN NOWITZKI! Ball deflects out of bounds off Jrue Sabonis.

[08:54] Team_030 possession (Score: 25-21)
Jaren Green drives, Chris Turner stays with him. Jaren Green attempts a Dunk. Contested by Chris Turner (3.2 feet, ZONE). JAREN GREEN MAKES IT!
Score: 27-21

[08:43] Team_055 possession (Score: 27-21)
Chris Turner attempts a Layup. Wide open! Jaren Green is 6.8 feet away. [ZONE] Chris Turner misses. Rebound secured by Jaren Green.

[08:30] Team_030 possession (Score: 27-21)
Jordan Nowitzki drives, picks up Chris Turner. Help arrives from Shaquille Herro! Jordan Nowitzki attempts a Dunk. Contested by Shaquille Herro (4.3 feet, ZONE). JORDAN NOWITZKI MAKES IT! Assist: Tim Barrett
Score: 29-21

[08:15] Team_055 possession (Score: 29-21)
Kevin Bane makes the Layup and draws the foul on Jaren Green! And-1! Kevin Bane to the line for 1. [Team fouls: 1] (Jaren Green: 1 personal fouls)   FT 1/1: MISS Kevin Bane makes 0/1 from the line. Offensive rebound by Chris Turner! Chris Turner's putback is no good.
Score: 29-23

[08:04] Team_030 possession (Score: 29-23)
Tim Barrett attempts a 3Pt. BLOCKED BY SHAQUILLE HERRO! Ball is loose! Offensive rebound by Jordan Nowitzki! Jordan Nowitzki kicks it out.

[07:50] Team_030 possession (Score: 29-23)
FOUL! Holding foul on Devin Siakam. [Team fouls: 3] No free throws, side out. (Devin Siakam: 1 personal fouls)

[07:37] Team_030 possession (Score: 29-23)
Jaren Green throws a bad pass out of bounds! TURNOVER! (dead ball)

[07:37] Substitution (Team_030): Tyler Beal OUT → RJ Carter IN (stamina_rule2)

[07:37] Substitution (Team_030): Tim Barrett OUT → Josh Smith IN (stamina_rule2)

[07:37] Substitution (Team_030): Joel Anunoby OUT → Pau James IN (stamina_rule2)

[07:37] Substitution (Team_030): Jordan Nowitzki OUT → Damian Green IN (stamina_rule2)

[07:37] Substitution (Team_030): Jaren Green OUT → Franz Anunoby IN (stamina_rule2)

[07:37] Substitution (Team_055): Devin Siakam OUT → Luka Wall IN (stamina_rule2)

[07:37] Substitution (Team_055): Shaquille Herro OUT → Dirk Duncan IN (stamina_rule2)

[07:37] Substitution (Team_055): Kevin Bane OUT → Kyle Wall IN (stamina_rule2)

[07:37] Substitution (Team_055): Jrue Sabonis OUT → Malcolm Williamson IN (stamina_rule2)

[07:37] Substitution (Team_055): Chris Turner OUT → D'Angelo Antetokounmpo IN (stamina_rule2)

[07:24] Team_055 possession (Score: 29-23)
D'Angelo Antetokounmpo attempts a Midrange. Contested by Franz Anunoby (5.4 feet, ZONE). D'Angelo Antetokounmpo misses. Offensive rebound by Malcolm Williamson! Malcolm Williamson's putback is no good. Offensive rebound by Malcolm Williamson! Malcolm Williamson kicks it out.

[07:11] Team_055 possession (Score: 29-23)
D'Angelo Antetokounmpo attempts a 3Pt. Wide open! RJ Carter is 6.0 feet away. [ZONE] D'ANGELO ANTETOKOUNMPO MAKES IT! Assist: Luka Wall
Score: 29-26

[06:59] Team_030 possession (Score: 29-26)
FOUL! Reach-in foul on D'Angelo Antetokounmpo during the drive. [Team fouls: 4] No free throws, side out. (D'Angelo Antetokounmpo: 1 personal fouls)

[06:48] Team_030 possession (Score: 29-26)
FOUL! Shooting foul on Dirk Duncan. Franz Anunoby to the line for 2 free throws. [BONUS: 5 team fouls] (Dirk Duncan: 1 personal fouls)   FT 1/2: GOOD   FT 2/2: GOOD Franz Anunoby makes 2/2 from the line.
Score: 31-26

[06:29] Team_055 possession (Score: 31-26)
Luka Wall drives, picks up RJ Carter. Help arrives from Pau James! Luka Wall attempts a Dunk. Contested by Pau James (4.6 feet, MAN). LUKA WALL MAKES IT! Assist: Malcolm Williamson
Score: 31-28

[06:14] Team_030 possession (Score: 31-28)
Franz Anunoby drives, D'Angelo Antetokounmpo stays with him. Franz Anunoby attempts a Dunk. Contested by D'Angelo Antetokounmpo (4.2 feet, MAN). Franz Anunoby misses. Rebound secured by D'Angelo Antetokounmpo.

[05:57] Team_055 possession (Score: 31-28)
Luka Wall drives and kicks out. D'Angelo Antetokounmpo attempts a 3Pt. Wide open! RJ Carter is 8.0 feet away. [ZONE] D'Angelo Antetokounmpo misses. Rebound secured by Franz Anunoby.

[05:43] Team_030 possession (Score: 31-28)
RJ Carter attempts a 3Pt. Contested by Luka Wall (3.4 feet, MAN). RJ CARTER MAKES IT! Assist: Damian Green
Score: 34-28

[05:29] Team_055 possession (Score: 34-28)
Luka Wall attempts a Midrange. Wide open! Josh Smith is 6.2 feet away. [ZONE] LUKA WALL MAKES IT! Assist: Malcolm Williamson
Score: 34-30

[05:16] Team_030 possession (Score: 34-30)
Pau James attempts a 3Pt. Contested by Kyle Wall (4.0 feet, ZONE). Pau James misses. Rebound secured by D'Angelo Antetokounmpo.

[05:02] Team_055 possession (Score: 34-30)
Dirk Duncan attempts a Layup. Contested by Josh Smith (2.2 feet, MAN). Dirk Duncan misses. Rebound secured by Damian Green.

[04:48] Team_030 possession (Score: 34-30)
RJ Carter attempts a 3Pt. Wide open! Luka Wall is 6.4 feet away. [MAN] RJ CARTER MAKES IT! Assist: Damian Green
Score: 37-30

[04:32] Team_055 possession (Score: 37-30)
Kyle Wall makes the 3Pt and draws the foul on Pau James! And-1! Kyle Wall to the line for 1. [Team fouls: 2] (Pau James: 1 personal fouls)   FT 1/1: GOOD Kyle Wall makes 1/1 from the line.
Score: 37-34

[04:18] Team_030 possession (Score: 37-34)
Franz Anunoby attempts a Midrange. Wide open! D'Angelo Antetokounmpo is 6.7 feet away. [MAN] FRANZ ANUNOBY MAKES IT!
Score: 39-34

[04:05] Team_055 possession (Score: 39-34)
Luka Wall attempts a 3Pt. Wide open! RJ Carter is 8.1 feet away. [MAN] LUKA WALL MAKES IT! Assist: Dirk Duncan
Score: 39-37

[03:52] Team_030 possession (Score: 39-37)
Damian Green attempts a 3Pt. Contested by Kyle Wall (3.7 feet, ZONE). Damian Green misses. Rebound secured by Dirk Duncan.

[03:35] Team_055 possession (Score: 39-37)
Dirk Duncan attempts a 3Pt. Contested by Josh Smith (4.2 feet, MAN). DIRK DUNCAN MAKES IT! Assist: Malcolm Williamson
Score: 39-40

[03:19] Team_030 possession (Score: 39-40)
FOUL! Reach-in foul on Luka Wall during the drive. [IN THE BONUS! 6 team fouls] RJ Carter to the line for 2 free throws. (Luka Wall: 1 personal fouls)   FT 1/2: GOOD   FT 2/2: GOOD RJ Carter makes 2/2 from the line.
Score: 41-40

[03:01] Team_055 possession (Score: 41-40)
FOUL! Offensive foul on Dirk Duncan! Josh Smith drew the charge! [Team fouls: 7] (Dirk Duncan: 2 personal fouls) TURNOVER! (dead ball)

[02:44] Team_030 possession (Score: 41-40)
Josh Smith attempts a 3Pt. Wide open! Dirk Duncan is 6.6 feet away. [MAN] JOSH SMITH MAKES IT! Assist: RJ Carter
Score: 44-40

[02:26] Team_055 possession (Score: 44-40)
Malcolm Williamson attempts a 3Pt. Contested by Damian Green (4.5 feet, MAN). MALCOLM WILLIAMSON MAKES IT! Assist: Dirk Duncan
Score: 44-43

[02:15] Team_030 possession (Score: 44-43)
RJ Carter drives and kicks out. Pau James attempts a Midrange. Contested by Dirk Duncan (5.3 feet, ZONE). Pau James misses. Rebound secured by Dirk Duncan.

[01:59] Team_055 possession (Score: 44-43)
Luka Wall throws a bad pass! Stolen by RJ Carter! TURNOVER! (live ball)

[01:45] Team_030 possession (Score: 44-43)
Josh Smith attempts a 3Pt. Wide open! Kyle Wall is 7.5 feet away. [ZONE] JOSH SMITH MAKES IT! Assist: Franz Anunoby
Score: 47-43

[01:32] Team_055 possession (Score: 47-43)
FOUL! Offensive foul on Kyle Wall! Pau James drew the charge! [Team fouls: 8] (Kyle Wall: 1 personal fouls) TURNOVER! (dead ball)

[01:18] Team_030 possession (Score: 47-43)
RJ Carter attempts a 3Pt. Contested by Luka Wall (3.3 feet, MAN). RJ Carter misses. Offensive rebound by Damian Green! Damian Green kicks it out.

[01:04] Team_030 possession (Score: 47-43)
Josh Smith attempts a Midrange. Heavily contested by Kyle Wall (0.8 feet, ZONE)! JOSH SMITH MAKES IT! Assist: RJ Carter
Score: 49-43

[00:47] Team_055 possession (Score: 49-43)
Malcolm Williamson attempts a 3Pt. Contested by RJ Carter (5.7 feet, ZONE). Malcolm Williamson misses. Offensive rebound by Malcolm Williamson! Malcolm Williamson puts it back in!
Score: 49-45

[00:31] Team_030 possession (Score: 49-45)
Franz Anunoby drives, D'Angelo Antetokounmpo stays with him. Franz Anunoby attempts a Layup. Contested by D'Angelo Antetokounmpo (3.9 feet, MAN). Franz Anunoby misses. Rebound secured by Malcolm Williamson.

[00:21] Team_055 possession (Score: 49-45)
Malcolm Williamson attempts a Midrange. Contested by Damian Green (4.9 feet, MAN). MALCOLM WILLIAMSON MAKES IT!
Score: 49-47

[00:03] Team_030 possession (Score: 49-47)
Damian Green attempts a Layup. Contested by Malcolm Williamson (2.1 feet, MAN). DAMIAN GREEN MAKES IT!
Score: 51-47

================================================================================
                              2ND QUARTER COMPLETE                              
================================================================================

2ND QUARTER SCORE: Team_030 33, Team_055 34

BOX SCORE:
================================================================================

Team_030
--------------------------------------------------------------------------------
Player                MIN  PTS  REB  AST  TO      FG   FG%      3P   3P%
--------------------------------------------------------------------------------
RJ Carter               8    8    0    2   0   3/4    75.0     0/0   0.0
Josh Smith              8    8    0    0   0   3/3   100.0     0/0   0.0
Chris Turner           17    6    3    0   0   3/4    75.0     0/0   0.0
Tyler Beal             17    5    0    0   0   2/2   100.0     0/0   0.0
Franz Anunoby           8    4    1    1   0   2/4    50.0     0/0   0.0
Jordan Nowitzki        17    2    1    2   0   1/1   100.0     0/0   0.0
Joel Anunoby           17    2    1    0   0   1/3    33.3     0/0   0.0
Jaren Green            17    2    1    0   0   1/1   100.0     0/0   0.0
Damian Green            8    2    2    2   0   1/2    50.0     0/0   0.0
Tim Barrett            17    0    0    1   0   0/0     0.0     0/0   0.0
Pau James               8    0    0    0   0   0/1     0.0     0/0   0.0

TEAM: FG: 14/21 (66.7%), 3PT: 5/9 (55.6%), REB: 7 (3 off, 4 def), AST: 8, TO: 1
TEAM FOULS: 2


Team_055
--------------------------------------------------------------------------------
Player                MIN  PTS  REB  AST  TO      FG   FG%      3P   3P%
--------------------------------------------------------------------------------
Malcolm Williamson      8    7    3    3   0   3/3   100.0     0/0   0.0
Luka Wall               8    7    0    1   0   3/4    75.0     0/0   0.0
Kyle Wall               8    4    0    0   0   1/1   100.0     0/0   0.0
D'Angelo Antetokounmpo    8    3    2    0   0   1/1   100.0     0/0   0.0
Dirk Duncan             8    3    2    2   0   1/2    50.0     0/0   0.0
Jrue Sabonis           17    2    1    0   0   1/2    50.0     0/0   0.0
Shaquille Herro        17    0    0    1   0   0/0     0.0     0/0   0.0
Kevin Bane             17    0    0    0   0   0/1     0.0     0/0   0.0

TEAM: FG: 13/18 (72.2%), 3PT: 7/7 (100.0%), REB: 10 (3 off, 7 def), AST: 7, TO: 3
TEAM FOULS: 8 [Team_030 in BONUS]

================================================================================

================================================================================
                       3RD QUARTER - Team_030 vs Team_055                       
================================================================================

[12:00] Team_030 possession (Score: 51-47)
Tim Barrett attempts a 3Pt. Contested by Kevin Bane (3.0 feet, ZONE). Tim Barrett misses. Rebound secured by Chris Turner.

[11:48] Team_055 possession (Score: 51-47)
FOUL! Offensive foul on Jrue Sabonis! Jordan Nowitzki drew the charge! [Team fouls: 1] (Jrue Sabonis: 1 personal fouls) TURNOVER! (dead ball)

[11:31] Team_030 possession (Score: 51-47)
Jaren Green attempts a Midrange. Contested by Jrue Sabonis (5.5 feet, ZONE). Jaren Green misses. Offensive rebound by Jordan Nowitzki! Jordan Nowitzki puts it back in!
Score: 53-47

[11:14] Team_055 possession (Score: 53-47)
Shaquille Herro attempts a 3Pt. Contested by Tyler Beal (2.3 feet, ZONE). Shaquille Herro misses. Rebound secured by Jaren Green.

[10:55] Team_030 possession (Score: 53-47)
Jaren Green drives and kicks out. Jaren Green attempts a Midrange. Contested by Jrue Sabonis (5.2 feet, ZONE). JAREN GREEN MAKES IT!
Score: 55-47

[10:42] Team_055 possession (Score: 55-47)
Devin Siakam attempts a Midrange. Wide open! Tyler Beal is 9.2 feet away. [MAN] DEVIN SIAKAM MAKES IT! Assist: Chris Turner
Score: 55-49

[10:24] Team_030 possession (Score: 55-49)
Jordan Nowitzki makes the Dunk and draws the foul on Shaquille Herro! And-1! Jordan Nowitzki to the line for 1. [Team fouls: 2] (Shaquille Herro: 1 personal fouls)   FT 1/1: GOOD Jordan Nowitzki makes 1/1 from the line.
Score: 58-49

[10:10] Team_055 possession (Score: 58-49)
Chris Turner drives to the basket... Chris Turner commits a violation (traveling/carry)! TURNOVER! (dead ball)

[09:56] Team_030 possession (Score: 58-49)
FOUL! Shooting foul on Shaquille Herro. Jordan Nowitzki to the line for 2 free throws. [Team fouls: 3] (Shaquille Herro: 2 personal fouls)   FT 1/2: GOOD   FT 2/2: GOOD Jordan Nowitzki makes 2/2 from the line.
Score: 60-49

[09:44] Team_055 possession (Score: 60-49)
Jrue Sabonis attempts a Layup. Contested by Jaren Green (2.4 feet, ZONE). Jrue Sabonis misses. Rebound secured by Jordan Nowitzki.

[09:32] Team_030 possession (Score: 60-49)
Joel Anunoby attempts a Layup. Wide open! Kevin Bane is 6.1 feet away. [MAN] Joel Anunoby misses. Offensive rebound by Jordan Nowitzki! Jordan Nowitzki's putback is no good. Rebound secured by Chris Turner.

[09:16] Team_055 possession (Score: 60-49)
Jrue Sabonis drives and kicks out. Kevin Bane attempts a Midrange. Contested by Joel Anunoby (3.2 feet, ZONE). KEVIN BANE MAKES IT! Assist: Jrue Sabonis
Score: 60-51

[09:01] Team_030 possession (Score: 60-51)
FOUL! Shooting foul on Chris Turner. Tim Barrett to the line for 2 free throws. [Team fouls: 4] (Chris Turner: 1 personal fouls)   FT 1/2: GOOD   FT 2/2: MISS Tim Barrett makes 1/2 from the line. Rebound secured by Chris Turner.
Score: 61-51

[08:47] Team_055 possession (Score: 61-51)
Kevin Bane makes the 3Pt and draws the foul on Tyler Beal! And-1! Kevin Bane to the line for 1. [Team fouls: 1] (Tyler Beal: 1 personal fouls)   FT 1/1: GOOD Kevin Bane makes 1/1 from the line.
Score: 61-55

[08:34] Team_030 possession (Score: 61-55)
Jaren Green drives to the basket... FOUL! Offensive foul on Jaren Green! Chris Turner drew the charge! [Team fouls: 2] (Jaren Green: 1 personal fouls) TURNOVER! (dead ball)

[08:16] Team_055 possession (Score: 61-55)
Chris Turner drives, picks up Jaren Green. Help arrives from Tyler Beal! Chris Turner attempts a Dunk. Wide open! Tyler Beal is 6.0 feet away. [MAN] CHRIS TURNER MAKES IT!
Score: 61-57

[08:01] Team_030 possession (Score: 61-57)
Tim Barrett makes the Midrange and draws the foul on Shaquille Herro! And-1! Tim Barrett to the line for 1. [BONUS: 5 team fouls] (Shaquille Herro: 3 personal fouls)   FT 1/1: GOOD Tim Barrett makes 1/1 from the line.
Score: 64-57

[07:45] Team_055 possession (Score: 64-57)
Shaquille Herro attempts a Layup. Contested by Jordan Nowitzki (5.6 feet, ZONE). SHAQUILLE HERRO MAKES IT!
Score: 64-59

[07:32] Team_030 possession (Score: 64-59)
Joel Anunoby makes the 3Pt and draws the foul on Kevin Bane! And-1! Joel Anunoby to the line for 1. [BONUS: 6 team fouls] (Kevin Bane: 1 personal fouls)   FT 1/1: MISS Joel Anunoby makes 0/1 from the line. Offensive rebound by Joel Anunoby! Joel Anunoby kicks it out.
Score: 67-59

[07:19] Team_030 possession (Score: 67-59)
Joel Anunoby attempts a 3Pt. Heavily contested by Kevin Bane (0.5 feet, ZONE)! Joel Anunoby misses. Offensive rebound by Jordan Nowitzki! Jordan Nowitzki's putback is no good. Rebound secured by Kevin Bane.

[07:04] Team_055 possession (Score: 67-59)
Chris Turner makes the Dunk and draws the foul on Tyler Beal! And-1! Chris Turner to the line for 1. [Team fouls: 3] (Tyler Beal: 2 personal fouls)   FT 1/1: GOOD Chris Turner makes 1/1 from the line.
Score: 67-62

[06:48] Team_030 possession (Score: 67-62)
Tim Barrett throws a bad pass! Stolen by Shaquille Herro! TURNOVER! (live ball)

[06:32] Team_055 possession (Score: 67-62)
FOUL! Holding foul on Jaren Green. [Team fouls: 4] No free throws, side out. (Jaren Green: 2 personal fouls)

[06:21] Team_055 possession (Score: 67-62)
FOUL! Shooting foul on Tyler Beal. Devin Siakam to the line for 3 free throws. [BONUS: 5 team fouls] (Tyler Beal: 3 personal fouls)   FT 1/3: GOOD   FT 2/3: GOOD   FT 3/3: GOOD Devin Siakam makes 3/3 from the line.
Score: 67-65

[06:10] Team_030 possession (Score: 67-65)
Jordan Nowitzki attempts a 3Pt. Heavily contested by Chris Turner (1.7 feet, MAN)! Jordan Nowitzki misses. FOUL! Loose ball foul on Kevin Bane during the rebound battle. [IN THE BONUS! 7 team fouls] Jordan Nowitzki to the line for 2 free throws. (Kevin Bane: 2 personal fouls)   FT 1/2: GOOD   FT 2/2: GOOD Jordan Nowitzki makes 2/2 from the line.
Score: 69-65

[05:55] Team_055 possession (Score: 69-65)
FOUL! Shooting foul on Jaren Green. Chris Turner to the line for 2 free throws. [BONUS: 6 team fouls] (Jaren Green: 3 personal fouls)   FT 1/2: MISS   FT 2/2: GOOD Chris Turner makes 1/2 from the line.
Score: 69-66

[05:43] Team_030 possession (Score: 69-66)
Jordan Nowitzki drives, Chris Turner stays with him. Jordan Nowitzki attempts a Dunk. Heavily contested by Chris Turner (0.5 feet, MAN)! Jordan Nowitzki misses. Rebound secured by Kevin Bane.

[05:28] Team_055 possession (Score: 69-66)
Jrue Sabonis attempts a 3Pt. Wide open! Tyler Beal is 6.0 feet away. [ZONE] Jrue Sabonis misses. Offensive rebound by Chris Turner! Chris Turner's putback is no good. Rebound secured by Joel Anunoby.

[05:14] Team_030 possession (Score: 69-66)
Joel Anunoby attempts a 3Pt. Contested by Kevin Bane (5.0 feet, MAN). Joel Anunoby misses. Offensive rebound by Joel Anunoby! Joel Anunoby kicks it out.

[05:01] Team_030 possession (Score: 69-66)
Jordan Nowitzki attempts a Layup. Contested by Chris Turner (2.3 feet, MAN). Jordan Nowitzki misses. Rebound secured by Jrue Sabonis.

[04:48] Team_055 possession (Score: 69-66)
Shaquille Herro attempts a Layup. BLOCKED BY JOEL ANUNOBY! Ball is loose! Offensive rebound by Chris Turner! Chris Turner kicks it out.

[04:33] Team_055 possession (Score: 69-66)
Kevin Bane drives and kicks out. Shaquille Herro attempts a Midrange. Contested by Jordan Nowitzki (5.8 feet, ZONE). SHAQUILLE HERRO MAKES IT!
Score: 69-68

[04:18] Team_030 possession (Score: 69-68)
Jordan Nowitzki attempts a 3Pt. Wide open! Devin Siakam is 8.4 feet away. [ZONE] JORDAN NOWITZKI MAKES IT! Assist: Jaren Green
Score: 72-68

[04:06] Team_055 possession (Score: 72-68)
Kevin Bane attempts a 3Pt. Contested by Joel Anunoby (2.9 feet, MAN). Kevin Bane misses. Rebound secured by Jaren Green.

[03:51] Team_030 possession (Score: 72-68)
Tyler Beal loses control! Ball rolls out of bounds! TURNOVER! (dead ball)

[03:35] Team_055 possession (Score: 72-68)
Jrue Sabonis drives, picks up Jaren Green. Help arrives from Tyler Beal! Jrue Sabonis attempts a Dunk. Heavily contested by Tyler Beal (0.5 feet, ZONE)! Jrue Sabonis misses. Offensive rebound by Chris Turner! Chris Turner puts it back in!
Score: 72-70

[03:20] Team_030 possession (Score: 72-70)
Jordan Nowitzki drives, Chris Turner stays with him. Jordan Nowitzki attempts a Dunk. Heavily contested by Chris Turner (1.6 feet, ZONE)! JORDAN NOWITZKI MAKES IT! Assist: Tyler Beal
Score: 74-70

[03:09] Team_055 possession (Score: 74-70)
Chris Turner loses the ball! Stripped by Jaren Green! TURNOVER! (live ball)

[02:56] Team_030 possession (Score: 74-70)
Joel Anunoby attempts a 3Pt. Wide open! Kevin Bane is 6.1 feet away. [MAN] Joel Anunoby misses. Rebound secured by Chris Turner.

[02:41] Team_055 possession (Score: 74-70)
Chris Turner attempts a Layup. Contested by Jaren Green (3.7 feet, ZONE). CHRIS TURNER MAKES IT!
Score: 74-72

[02:27] Team_030 possession (Score: 74-72)
Jordan Nowitzki attempts a 3Pt. BLOCKED BY CHRIS TURNER! Ball deflects out of bounds off Jordan Nowitzki.

[02:13] Team_055 possession (Score: 74-72)
FOUL! Shooting foul on Joel Anunoby. Devin Siakam to the line for 2 free throws. [BONUS: 7 team fouls] (Joel Anunoby: 1 personal fouls)   FT 1/2: GOOD   FT 2/2: GOOD Devin Siakam makes 2/2 from the line.
Score: 74-74

[01:57] Team_030 possession (Score: 74-74)
Jordan Nowitzki drives, Chris Turner stays with him. Jordan Nowitzki attempts a Dunk. Contested by Chris Turner (5.9 feet, ZONE). Jordan Nowitzki misses. Rebound secured by Chris Turner.

[01:38] Team_055 possession (Score: 74-74)
Shaquille Herro attempts a 3Pt. Wide open! Tim Barrett is 6.1 feet away. [MAN] Shaquille Herro misses. Rebound secured by Joel Anunoby.

[01:24] Team_030 possession (Score: 74-74)
Tim Barrett attempts a Midrange. Contested by Chris Turner (2.7 feet, ZONE). Tim Barrett misses. Offensive rebound by Jordan Nowitzki! Jordan Nowitzki kicks it out.

[01:08] Team_030 possession (Score: 74-74)
Jordan Nowitzki makes the Layup and draws the foul on Chris Turner! And-1! Jordan Nowitzki to the line for 1. [BONUS: 8 team fouls] (Chris Turner: 2 personal fouls)   FT 1/1: GOOD Jordan Nowitzki makes 1/1 from the line.
Score: 77-74

[00:49] Team_055 possession (Score: 77-74)
Chris Turner attempts a 3Pt. Contested by Tyler Beal (3.3 feet, ZONE). CHRIS TURNER MAKES IT!
Score: 77-77

[00:30] Team_030 possession (Score: 77-77)
Jaren Green attempts a Dunk. BLOCKED BY SHAQUILLE HERRO! Ball deflects out of bounds off Jaren Green.

[00:17] Team_055 possession (Score: 77-77)
Devin Siakam attempts a Midrange. Wide open! Tyler Beal is 7.0 feet away. [MAN] Devin Siakam misses. Offensive rebound by Jrue Sabonis! Jrue Sabonis kicks it out.

[00:01] Team_055 possession (Score: 77-77)
FOUL! Offensive foul on Jrue Sabonis! Jordan Nowitzki drew the charge! [Team fouls: 9] (Jrue Sabonis: 2 personal fouls) TURNOVER! (dead ball)

================================================================================
                              3RD QUARTER COMPLETE                              
================================================================================

3RD QUARTER SCORE: Team_030 26, Team_055 30

BOX SCORE:
================================================================================

Team_030
--------------------------------------------------------------------------------
Player                MIN  PTS  REB  AST  TO      FG   FG%      3P   3P%
--------------------------------------------------------------------------------
Jordan Nowitzki        29   17    3    0   0   7/11   63.6     0/0   0.0
Tim Barrett            29    3    0    0   0   1/3    33.3     0/0   0.0
Jaren Green            29    2    2    1   0   1/2    50.0     0/0   0.0
Joel Anunoby           29    0    4    0   0   0/3     0.0     0/0   0.0
Tyler Beal             29    0    0    1   0   0/0     0.0     0/0   0.0

TEAM: FG: 9/19 (47.4%), 3PT: 2/6 (33.3%), REB: 10 (6 off, 4 def), AST: 2, TO: 3
TEAM FOULS: 7 [Team_055 in BONUS]


Team_055
--------------------------------------------------------------------------------
Player                MIN  PTS  REB  AST  TO      FG   FG%      3P   3P%
--------------------------------------------------------------------------------
Chris Turner           29   13    7    1   0   6/6   100.0     0/0   0.0
Devin Siakam           29    7    0    0   0   3/3   100.0     0/0   0.0
Kevin Bane             29    6    2    0   0   2/3    66.7     0/0   0.0
Shaquille Herro        29    4    0    0   0   2/4    50.0     0/0   0.0
Jrue Sabonis           29    0    2    1   0   0/2     0.0     0/0   0.0

TEAM: FG: 13/18 (72.2%), 3PT: 3/7 (42.9%), REB: 10 (4 off, 6 def), AST: 2, TO: 4
TEAM FOULS: 9 [Team_030 in BONUS]

================================================================================

================================================================================
                       4TH QUARTER - Team_030 vs Team_055                       
================================================================================

[12:00] Team_030 possession (Score: 77-77)
Jordan Nowitzki attempts a Midrange. Contested by Chris Turner (6.0 feet, MAN). JORDAN NOWITZKI MAKES IT! Assist: Tim Barrett
Score: 79-77

[11:46] Team_055 possession (Score: 79-77)
Jrue Sabonis attempts a Midrange. Contested by Tim Barrett (5.5 feet, ZONE). Jrue Sabonis misses. Rebound secured by Jordan Nowitzki.

[11:32] Team_030 possession (Score: 79-77)
Joel Anunoby attempts a 3Pt. Wide open! Kevin Bane is 7.1 feet away. [ZONE] Joel Anunoby misses. Rebound secured by Jrue Sabonis.

[11:14] Team_055 possession (Score: 79-77)
Jrue Sabonis attempts a Layup. Contested by Jaren Green (4.9 feet, ZONE). JRUE SABONIS MAKES IT! Assist: Shaquille Herro
Score: 79-79

[10:57] Team_030 possession (Score: 79-79)
Tyler Beal attempts a 3Pt. Wide open! Devin Siakam is 10.0 feet away. [MAN] TYLER BEAL MAKES IT! Assist: Jaren Green
Score: 82-79

[10:40] Team_055 possession (Score: 82-79)
Shaquille Herro attempts a 3Pt. Wide open! Tim Barrett is 6.2 feet away. [MAN] SHAQUILLE HERRO MAKES IT!
Score: 82-82

[10:23] Team_030 possession (Score: 82-82)
Joel Anunoby attempts a 3Pt. Wide open! Kevin Bane is 7.0 feet away. [ZONE] Joel Anunoby misses. FOUL! Loose ball foul on Jrue Sabonis during the rebound battle. [Team fouls: 1] No free throws, side out. (Jrue Sabonis: 1 personal fouls)

[10:10] Team_030 possession (Score: 82-82)
Tyler Beal attempts a Layup. Heavily contested by Devin Siakam (0.7 feet, MAN)! TYLER BEAL MAKES IT!
Score: 84-82

[09:50] Team_055 possession (Score: 84-82)
Chris Turner makes the Layup and draws the foul on Jaren Green! And-1! Chris Turner to the line for 1. [Team fouls: 1] (Jaren Green: 1 personal fouls)   FT 1/1: MISS Chris Turner makes 0/1 from the line. Rebound secured by Joel Anunoby.
Score: 84-84

[09:35] Team_030 possession (Score: 84-84)
Joel Anunoby drives and kicks out. Jordan Nowitzki attempts a Midrange. Contested by Chris Turner (4.1 feet, MAN). Jordan Nowitzki misses. Offensive rebound by Joel Anunoby! Joel Anunoby kicks it out.

[09:24] Team_030 possession (Score: 84-84)
FOUL! Holding foul on Kevin Bane. [Team fouls: 2] No free throws, side out. (Kevin Bane: 1 personal fouls)

[09:07] Team_030 possession (Score: 84-84)
Jordan Nowitzki makes the Midrange and draws the foul on Chris Turner! And-1! Jordan Nowitzki to the line for 1. [Team fouls: 3] (Chris Turner: 1 personal fouls)   FT 1/1: GOOD Jordan Nowitzki makes 1/1 from the line.
Score: 87-84

[08:51] Team_055 possession (Score: 87-84)
FOUL! Holding foul on Jordan Nowitzki. [Team fouls: 2] No free throws, side out. (Jordan Nowitzki: 1 personal fouls)

[08:35] Team_055 possession (Score: 87-84)
Jrue Sabonis attempts a 3Pt. Contested by Jordan Nowitzki (5.0 feet, MAN). Jrue Sabonis misses. Rebound secured by Joel Anunoby.

[08:21] Team_030 possession (Score: 87-84)
Tyler Beal attempts a 3Pt. Contested by Kevin Bane (4.2 feet, ZONE). Tyler Beal misses. Offensive rebound by Joel Anunoby! Joel Anunoby kicks it out.

[08:07] Team_030 possession (Score: 87-84)
Jordan Nowitzki drives to the basket... Jordan Nowitzki throws a bad pass! Stolen by Chris Turner! TURNOVER! (live ball)

[07:56] Team_055 possession (Score: 87-84)
Jrue Sabonis attempts a Layup. Wide open! Jaren Green is 7.3 feet away. [ZONE] JRUE SABONIS MAKES IT! Assist: Chris Turner
Score: 87-86

[07:42] Team_030 possession (Score: 87-86)
Tyler Beal attempts a Midrange. Wide open! Shaquille Herro is 6.3 feet away. [ZONE] TYLER BEAL MAKES IT!
Score: 89-86

[07:23] Team_055 possession (Score: 89-86)
Chris Turner drives, picks up Jaren Green. Help arrives from Tyler Beal! Chris Turner attempts a Dunk. Heavily contested by Tyler Beal (0.6 feet, MAN)! CHRIS TURNER MAKES IT!
Score: 89-88

[07:14] Team_030 possession (Score: 89-88)
Jaren Green drives and kicks out. Tim Barrett attempts a 3Pt. Wide open! Shaquille Herro is 6.1 feet away. [MAN] Tim Barrett misses. Rebound secured by Jrue Sabonis.

[07:00] Team_055 possession (Score: 89-88)
Shaquille Herro attempts a Layup. Contested by Tim Barrett (4.9 feet, MAN). SHAQUILLE HERRO MAKES IT! Assist: Kevin Bane
Score: 89-90

[06:47] Team_030 possession (Score: 89-90)
FOUL! Reach-in foul on Kevin Bane during the drive. [Team fouls: 4] No free throws, side out. (Kevin Bane: 2 personal fouls)

[06:35] Team_030 possession (Score: 89-90)
Tyler Beal drives and kicks out. Tim Barrett attempts a 3Pt. Wide open! Kevin Bane is 7.1 feet away. [ZONE] Tim Barrett misses. Rebound secured by Jrue Sabonis.

[06:22] Team_055 possession (Score: 89-90)
Jrue Sabonis attempts a 3Pt. Heavily contested by Tyler Beal (1.4 feet, ZONE)! Jrue Sabonis misses. Rebound secured by Jaren Green.

[06:05] Team_030 possession (Score: 89-90)
Tim Barrett attempts a Midrange. Wide open! Shaquille Herro is 8.1 feet away. [MAN] TIM BARRETT MAKES IT! Assist: Jordan Nowitzki
Score: 91-90

[05:50] Team_055 possession (Score: 91-90)
Shaquille Herro attempts a Layup. BLOCKED BY JAREN GREEN! Ball is loose! Rebound secured by Jordan Nowitzki.

[05:31] Team_030 possession (Score: 91-90)
Tyler Beal attempts a 3Pt. Wide open! Devin Siakam is 9.8 feet away. [ZONE] TYLER BEAL MAKES IT! Assist: Joel Anunoby
Score: 94-90

[05:14] Team_055 possession (Score: 94-90)
Devin Siakam attempts a 3Pt. Contested by Jordan Nowitzki (4.6 feet, ZONE). DEVIN SIAKAM MAKES IT! Assist: Kevin Bane
Score: 94-93

[04:59] Team_030 possession (Score: 94-93)
Tyler Beal attempts a 3Pt. Contested by Kevin Bane (3.3 feet, ZONE). Tyler Beal misses. Rebound secured by Chris Turner.

[04:46] Team_055 possession (Score: 94-93)
Devin Siakam attempts a 3Pt. Wide open! Tyler Beal is 7.5 feet away. [ZONE] Devin Siakam misses. Rebound secured by Joel Anunoby.

[04:30] Team_030 possession (Score: 94-93)
Jaren Green attempts a Midrange. Wide open! Kevin Bane is 7.7 feet away. [ZONE] JAREN GREEN MAKES IT! Assist: Jordan Nowitzki
Score: 96-93

[04:18] Team_055 possession (Score: 96-93)
Shaquille Herro drives and kicks out. Jrue Sabonis attempts a Midrange. Wide open! Jordan Nowitzki is 10.0 feet away. [MAN] Jrue Sabonis misses. Offensive rebound by Chris Turner! Chris Turner kicks it out.

[04:05] Team_055 possession (Score: 96-93)
FOUL! Reach-in foul on Tyler Beal during the drive. [Team fouls: 3] No free throws, side out. (Tyler Beal: 1 personal fouls)

[03:54] Team_055 possession (Score: 96-93)
Jrue Sabonis drives to the basket... Jrue Sabonis throws a bad pass! Stolen by Jordan Nowitzki! TURNOVER! (live ball)

[03:35] Team_030 possession (Score: 96-93)
Jordan Nowitzki attempts a 3Pt. Contested by Chris Turner (3.7 feet, MAN). Jordan Nowitzki misses. Rebound secured by Kevin Bane.

[03:23] Team_055 possession (Score: 96-93)
Devin Siakam attempts a 3Pt. Contested by Tyler Beal (4.5 feet, MAN). Devin Siakam misses. FOUL! Loose ball foul on Jordan Nowitzki during the rebound battle. [Team fouls: 4] No free throws, side out. (Jordan Nowitzki: 2 personal fouls)

[03:10] Team_055 possession (Score: 96-93)
Jrue Sabonis attempts a 3Pt. Contested by Tyler Beal (5.6 feet, ZONE). Jrue Sabonis misses. Rebound secured by Jordan Nowitzki.

[02:59] Team_030 possession (Score: 96-93)
Tim Barrett loses control! Ball rolls out of bounds! TURNOVER! (dead ball)

[02:59] Substitution (Team_030): Tyler Beal OUT → RJ Carter IN (stamina_rule2)

[02:59] Substitution (Team_030): Tim Barrett OUT → Josh Smith IN (stamina_rule2)

[02:59] Substitution (Team_030): Joel Anunoby OUT → Pau James IN (stamina_rule2)

[02:59] Substitution (Team_030): Jordan Nowitzki OUT → Damian Green IN (stamina_rule2)

[02:59] Substitution (Team_030): Jaren Green OUT → Franz Anunoby IN (stamina_rule2)

[02:59] Substitution (Team_055): Devin Siakam OUT → Luka Wall IN (stamina_rule2)

[02:59] Substitution (Team_055): Shaquille Herro OUT → Dirk Duncan IN (stamina_rule2)

[02:59] Substitution (Team_055): Kevin Bane OUT → Kyle Wall IN (stamina_rule2)

[02:59] Substitution (Team_055): Jrue Sabonis OUT → Malcolm Williamson IN (stamina_rule2)

[02:59] Substitution (Team_055): Chris Turner OUT → D'Angelo Antetokounmpo IN (stamina_rule2)

[02:46] Team_055 possession (Score: 96-93)
Luka Wall attempts a Midrange. Wide open! Damian Green is 7.5 feet away. [ZONE] Luka Wall misses. Rebound secured by Damian Green.

[02:30] Team_030 possession (Score: 96-93)
RJ Carter attempts a Layup. Contested by Luka Wall (4.9 feet, MAN). RJ CARTER MAKES IT! Assist: Franz Anunoby
Score: 98-93

[02:16] Team_055 possession (Score: 98-93)
FOUL! Offensive foul on Dirk Duncan! Josh Smith drew the charge! [Team fouls: 5] (Dirk Duncan: 1 personal fouls) TURNOVER! (dead ball)

[01:58] Team_030 possession (Score: 98-93)
Pau James throws a bad pass out of bounds! TURNOVER! (dead ball)

[01:44] Team_055 possession (Score: 98-93)
Dirk Duncan drives to the basket... Dirk Duncan loses control! Ball rolls out of bounds! TURNOVER! (dead ball)

[01:28] Team_030 possession (Score: 98-93)
Damian Green drives, picks up Malcolm Williamson. Help arrives from Dirk Duncan! Damian Green attempts a Dunk. Contested by Dirk Duncan (4.0 feet, ZONE). Damian Green misses. Offensive rebound by Damian Green! Damian Green kicks it out.

[01:15] Team_030 possession (Score: 98-93)
Franz Anunoby loses control! Ball rolls out of bounds! TURNOVER! (dead ball)

[01:00] Team_055 possession (Score: 98-93)
FOUL! Shooting foul on Franz Anunoby. D'Angelo Antetokounmpo to the line for 2 free throws. [BONUS: 5 team fouls] (Franz Anunoby: 1 personal fouls)   FT 1/2: GOOD   FT 2/2: MISS D'Angelo Antetokounmpo makes 1/2 from the line. Rebound secured by Franz Anunoby.
Score: 98-94

[00:46] Team_030 possession (Score: 98-94)
Josh Smith drives and kicks out. Josh Smith attempts a 3Pt. Wide open! Dirk Duncan is 6.3 feet away. [MAN] JOSH SMITH MAKES IT! Assist: Damian Green
Score: 101-94

[00:32] Team_055 possession (Score: 101-94)
Malcolm Williamson makes the Midrange and draws the foul on Damian Green! And-1! Malcolm Williamson to the line for 1. [BONUS: 6 team fouls] (Damian Green: 1 personal fouls)   FT 1/1: GOOD Malcolm Williamson makes 1/1 from the line.
Score: 101-97

[00:16] Team_030 possession (Score: 101-97)
Pau James attempts a 3Pt. Contested by Kyle Wall (3.4 feet, ZONE). Pau James misses. Offensive rebound by Pau James! Pau James kicks it out.

[00:05] Team_030 possession (Score: 101-97)
Josh Smith drives and kicks out. Josh Smith attempts a Midrange. Wide open! Dirk Duncan is 6.9 feet away. [MAN] JOSH SMITH MAKES IT!
Score: 103-97

================================================================================
                              4TH QUARTER COMPLETE                              
================================================================================

4TH QUARTER SCORE: Team_030 26, Team_055 20

BOX SCORE:
================================================================================

Team_030
--------------------------------------------------------------------------------
Player                MIN  PTS  REB  AST  TO      FG   FG%      3P   3P%
--------------------------------------------------------------------------------
Tyler Beal             38   10    0    0   0   4/6    66.7     0/0   0.0
Jordan Nowitzki        38    5    3    2   0   2/3    66.7     0/0   0.0
Josh Smith             11    5    0    0   0   2/2   100.0     0/0   0.0
Tim Barrett            38    2    0    1   0   1/1   100.0     0/0   0.0
Jaren Green            38    2    1    1   0   1/2    50.0     0/0   0.0
RJ Carter              11    2    0    0   0   1/1   100.0     0/0   0.0
Joel Anunoby           38    0    6    1   0   0/1     0.0     0/0   0.0
Damian Green           11    0    2    1   0   0/0     0.0     0/0   0.0
Franz Anunoby          11    0    1    1   0   0/0     0.0     0/0   0.0
Pau James              11    0    1    0   0   0/0     0.0     0/0   0.0

TEAM: FG: 11/16 (68.8%), 3PT: 2/5 (40.0%), REB: 14 (5 off, 9 def), AST: 7, TO: 4
TEAM FOULS: 6 [Team_055 in BONUS]


Team_055
--------------------------------------------------------------------------------
Player                MIN  PTS  REB  AST  TO      FG   FG%      3P   3P%
--------------------------------------------------------------------------------
Shaquille Herro        38    5    0    1   0   2/3    66.7     0/0   0.0
Jrue Sabonis           38    4    3    0   0   2/6    33.3     0/0   0.0
Devin Siakam           38    3    0    0   0   1/2    50.0     0/0   0.0
Malcolm Williamson     11    3    0    0   0   1/1   100.0     0/0   0.0
Chris Turner           38    2    2    1   0   1/2    50.0     0/0   0.0
Kevin Bane             38    0    2    2   0   0/0     0.0     0/0   0.0
Luka Wall              11    0    0    0   0   0/1     0.0     0/0   0.0
D'Angelo Antetokounmpo   11    0    0    0   0   0/1     0.0     0/0   0.0

TEAM: FG: 7/16 (43.8%), 3PT: 2/6 (33.3%), REB: 7 (2 off, 5 def), AST: 4, TO: 3
TEAM FOULS: 5 [Team_030 in BONUS]

================================================================================

================================================================================
                               FULL GAME COMPLETE                               
================================================================================

FINAL SCORE: Team_030 103, Team_055 97

SCORING BY QUARTER:
--------------------------------------------------------------------------------
Team                     Q1     Q2     Q3     Q4    FINAL
--------------------------------------------------------------------------------
Team_030                 18     33     26     26      103
Team_055                 13     34     30     20       97
--------------------------------------------------------------------------------

FULL GAME BOX SCORE:
================================================================================

Team_030
--------------------------------------------------------------------------------
Player                MIN  PTS  REB  AST  TO      FG   FG%      3P   3P%      FT STL BLK
--------------------------------------------------------------------------------
Tyler Beal             38   18    0    3   2   7/13   53.8   3/5    60.0   1/1     0   0
Tim Barrett            38    7    0    4   3   3/7    42.9   0/2     0.0   2/3     0   0
Joel Anunoby           38    6   18    1   1   3/9    33.3   0/5     0.0   0/1     1   1
Jordan Nowitzki        38   26   12    4   1  10/17   58.8   2/5    40.0   7/7     2   1
Jaren Green            38   13    6    2   3   7/9    77.8   0/0     0.0   1/1     1   2
RJ Carter              11   10    0    2   0   4/5    80.0   2/2   100.0   2/2     1   0
Josh Smith             11   13    0    0   0   5/5   100.0   2/2   100.0   0/0     0   0
Pau James              11    0    1    0   1   0/1     0.0   0/1     0.0   0/0     0   0
Damian Green           11    2    4    3   0   1/2    50.0   0/1     0.0   0/0     0   0
Franz Anunoby          11    4    2    2   1   2/4    50.0   0/0     0.0   2/2     0   0

TEAM: FG: 42/72 (58.3%), 3PT: 9/23 (39.1%), REB: 45 (19 off, 26 def), AST: 21, TO: 12


Team_055
--------------------------------------------------------------------------------
Player                MIN  PTS  REB  AST  TO      FG   FG%      3P   3P%      FT STL BLK
--------------------------------------------------------------------------------
Devin Siakam           38   12    0    0   0   5/8    62.5   2/5    40.0   5/5     0   0
Shaquille Herro        38   11    0    4   0   4/11   36.4   1/4    25.0   0/0     2   4
Kevin Bane             38    8    6    3   5   4/7    57.1   2/3    66.7   1/2     0   0
Jrue Sabonis           38    8    8    1   2   7/15   46.7   0/4     0.0   0/0     0   0
Chris Turner           38   26   14    2   2   9/12   75.0   1/1   100.0   2/4     2   1
Luka Wall              11    7    0    1   2   3/5    60.0   1/1   100.0   0/0     0   0
Dirk Duncan            11    3    2    2   2   1/2    50.0   1/1   100.0   0/0     0   0
Kyle Wall              11    4    0    0   1   1/1   100.0   1/1   100.0   1/1     0   0
Malcolm Williamson     11   10    3    3   0   4/4   100.0   2/2   100.0   1/1     0   0
D'Angelo Antetokounmpo   11    3    2    0   0   1/2    50.0   1/1   100.0   1/2     0   0

TEAM: FG: 39/67 (58.2%), 3PT: 12/23 (52.2%), REB: 33 (9 off, 24 def), AST: 16, TO: 14

================================================================================
