================================================================================
                        FULL GAME - Team_005 vs Team_027                        
================================================================================

================================================================================
                       1ST QUARTER - Team_005 vs Team_027                       
================================================================================

[12:00] Team_005 possession (Score: 0-0)
Anthony Rozier attempts a 3Pt. Heavily contested by Tony Doncic (0.7 feet, ZONE)! ANTHONY ROZIER MAKES IT! Assist: Cade Markkanen
Score: 3-0

[11:43] Team_027 possession (Score: 3-0)
Scottie Harden attempts a Midrange. Contested by Derrick Allen (5.5 feet, MAN). SCOTTIE HARDEN MAKES IT!
Score: 3-2

[11:29] Team_005 possession (Score: 3-2)
Brandon George drives and kicks out. Derrick Allen attempts a Midrange. Wide open! Bradley Dosunmu is 6.6 feet away. [ZONE] Derrick Allen misses. Rebound secured by Tony Doncic.

[11:16] Team_027 possession (Score: 3-2)
John Russell drives, picks up Cade Markkanen. Help arrives from Anthony Rozier! John Russell attempts a Layup. Heavily contested by Anthony Rozier (0.5 feet, ZONE)! JOHN RUSSELL MAKES IT!
Score: 3-4

[11:00] Team_005 possession (Score: 3-4)
Cade Markkanen attempts a Layup. Heavily contested by John Russell (0.5 feet, MAN)! CADE MARKKANEN MAKES IT! Assist: Jalen Rozier
Score: 5-4

[10:50] Team_027 possession (Score: 5-4)
Tony Doncic drives, Anthony Rozier stays with him. Tony Doncic attempts a Dunk. Heavily contested by Anthony Rozier (0.5 feet, MAN)! TONY DONCIC MAKES IT! Assist: John Russell
Score: 5-6

[10:36] Team_005 possession (Score: 5-6)
Anthony Rozier loses the ball! Stripped by Tony Doncic! TURNOVER! (live ball)

[10:22] Team_027 possession (Score: 5-6)
Scottie Harden attempts a 3Pt. Wide open! Derrick Allen is 7.4 feet away. [ZONE] Scottie Harden misses. Rebound secured by Jalen Rozier.

[10:05] Team_005 possession (Score: 5-6)
Cade Markkanen throws a bad pass! Stolen by John Russell! TURNOVER! (live ball)

[09:48] Team_027 possession (Score: 5-6)
Scottie Harden makes the Dunk and draws the foul on Cade Markkanen! And-1! Scottie Harden to the line for 1. [Team fouls: 1] (Cade Markkanen: 1 personal fouls)   FT 1/1: GOOD Scottie Harden makes 1/1 from the line.
Score: 5-9

[09:37] Team_005 possession (Score: 5-9)
FOUL! Reach-in foul on John Russell during the drive. [Team fouls: 1] No free throws, side out. (John Russell: 1 personal fouls)

[09:19] Team_005 possession (Score: 5-9)
Derrick Allen makes the Layup and draws the foul on Scottie Harden! And-1! Derrick Allen to the line for 1. [Team fouls: 2] (Scottie Harden: 1 personal fouls)   FT 1/1: GOOD Derrick Allen makes 1/1 from the line.
Score: 8-9

[09:03] Team_027 possession (Score: 8-9)
Scottie Harden makes the Midrange and draws the foul on Derrick Allen! And-1! Scottie Harden to the line for 1. [Team fouls: 2] (Derrick Allen: 1 personal fouls)   FT 1/1: GOOD Scottie Harden makes 1/1 from the line.
Score: 8-12

[08:46] Team_005 possession (Score: 8-12)
Cade Markkanen drives, John Russell stays with him. Cade Markkanen attempts a Layup. Contested by John Russell (4.6 feet, ZONE). CADE MARKKANEN MAKES IT! Assist: Anthony Rozier
Score: 10-12

[08:31] Team_027 possession (Score: 10-12)
Tim Johnson attempts a Midrange. Contested by Brandon George (5.1 feet, MAN). TIM JOHNSON MAKES IT!
Score: 10-14

[08:16] Team_005 possession (Score: 10-14)
Anthony Rozier commits a violation (traveling/carry)! TURNOVER! (dead ball)

[08:02] Team_027 possession (Score: 10-14)
Tim Johnson attempts a Midrange. Wide open! Jalen Rozier is 6.6 feet away. [ZONE] Tim Johnson misses. Rebound secured by Jalen Rozier.

[07:50] Team_005 possession (Score: 10-14)
Anthony Rozier makes the Dunk and draws the foul on John Russell! And-1! Anthony Rozier to the line for 1. [Team fouls: 3] (John Russell: 2 personal fouls)   FT 1/1: GOOD Anthony Rozier makes 1/1 from the line.
Score: 13-14

[07:33] Team_027 possession (Score: 13-14)
John Russell drives and kicks out. Tim Johnson attempts a 3Pt. Contested by Brandon George (5.3 feet, MAN). Tim Johnson misses. Rebound secured by Jalen Rozier.

[07:17] Team_005 possession (Score: 13-14)
Anthony Rozier throws a bad pass! Stolen by Tony Doncic! TURNOVER! (live ball)

[07:03] Team_027 possession (Score: 13-14)
Tim Johnson drives, picks up Brandon George. Help arrives from Anthony Rozier! Tim Johnson attempts a Layup. Heavily contested by Anthony Rozier (1.1 feet, MAN)! TIM JOHNSON MAKES IT! Assist: Scottie Harden
Score: 13-16

[06:48] Team_005 possession (Score: 13-16)
Derrick Allen attempts a 3Pt. Contested by Bradley Dosunmu (5.6 feet, ZONE). Derrick Allen misses. Rebound secured by Bradley Dosunmu.

[06:39] Team_027 possession (Score: 13-16)
John Russell attempts a Layup. Contested by Cade Markkanen (2.8 feet, ZONE). JOHN RUSSELL MAKES IT!
Score: 13-18

[06:25] Team_005 possession (Score: 13-18)
Jalen Rozier attempts a Midrange. Contested by Scottie Harden (5.7 feet, ZONE). Jalen Rozier misses. Offensive rebound by Cade Markkanen! Cade Markkanen's putback is no good. Rebound secured by Tony Doncic.

[06:14] Team_027 possession (Score: 13-18)
Scottie Harden attempts a Midrange. Contested by Derrick Allen (4.1 feet, MAN). SCOTTIE HARDEN MAKES IT!
Score: 13-20

[06:01] Team_005 possession (Score: 13-20)
Derrick Allen attempts a 3Pt. Contested by Scottie Harden (4.8 feet, MAN). Derrick Allen misses. Rebound secured by Tony Doncic.

[05:47] Team_027 possession (Score: 13-20)
FOUL! Shooting foul on Anthony Rozier. Bradley Dosunmu to the line for 2 free throws. [Team fouls: 3] (Anthony Rozier: 1 personal fouls)   FT 1/2: GOOD   FT 2/2: GOOD Bradley Dosunmu makes 2/2 from the line.
Score: 13-22

[05:34] Team_005 possession (Score: 13-22)
FOUL! Holding foul on Bradley Dosunmu. [Team fouls: 4] No free throws, side out. (Bradley Dosunmu: 1 personal fouls)

[05:22] Team_005 possession (Score: 13-22)
Derrick Allen attempts a 3Pt. Contested by Tim Johnson (4.9 feet, ZONE). Derrick Allen misses. Offensive rebound by Jalen Rozier! Jalen Rozier kicks it out.

[05:10] Team_005 possession (Score: 13-22)
Brandon George attempts a 3Pt. Wide open! Tim Johnson is 7.4 feet away. [MAN] BRANDON GEORGE MAKES IT! Assist: Anthony Rozier
Score: 16-22

[04:54] Team_027 possession (Score: 16-22)
Scottie Harden attempts a 3Pt. Contested by Derrick Allen (3.7 feet, ZONE). SCOTTIE HARDEN MAKES IT! Assist: Bradley Dosunmu
Score: 16-25

[04:38] Team_005 possession (Score: 16-25)
Derrick Allen drives, Scottie Harden stays with him. Derrick Allen attempts a Dunk. Contested by Scottie Harden (5.0 feet, MAN). DERRICK ALLEN MAKES IT! Assist: Cade Markkanen
Score: 18-25

[04:25] Team_027 possession (Score: 18-25)
Tony Doncic attempts a 3Pt. Contested by Derrick Allen (2.9 feet, ZONE). Tony Doncic misses. Rebound secured by Derrick Allen.

[04:07] Team_005 possession (Score: 18-25)
Brandon George attempts a Midrange. Contested by Tim Johnson (4.2 feet, MAN). BRANDON GEORGE MAKES IT! Assist: Derrick Allen
Score: 20-25

[03:52] Team_027 possession (Score: 20-25)
Tony Doncic attempts a 3Pt. Wide open! Derrick Allen is 7.0 feet away. [ZONE] Tony Doncic misses. Rebound secured by Derrick Allen.

[03:37] Team_005 possession (Score: 20-25)
Jalen Rozier attempts a Midrange. Wide open! Bradley Dosunmu is 7.4 feet away. [MAN] JALEN ROZIER MAKES IT! Assist: Anthony Rozier
Score: 22-25

[03:22] Team_027 possession (Score: 22-25)
Scottie Harden drives, Derrick Allen stays with him. Scottie Harden attempts a Dunk. Contested by Derrick Allen (4.2 feet, MAN). SCOTTIE HARDEN MAKES IT!
Score: 22-27

[03:08] Team_005 possession (Score: 22-27)
Cade Markkanen attempts a Midrange. Contested by John Russell (2.2 feet, MAN). Cade Markkanen misses. Rebound secured by Tony Doncic.

[02:54] Team_027 possession (Score: 22-27)
Bradley Dosunmu throws a bad pass! Stolen by Jalen Rozier! TURNOVER! (live ball)

[02:38] Team_005 possession (Score: 22-27)
Jalen Rozier attempts a 3Pt. Contested by Bradley Dosunmu (5.9 feet, MAN). JALEN ROZIER MAKES IT! Assist: Brandon George
Score: 25-27

[02:25] Team_027 possession (Score: 25-27)
Tony Doncic attempts a Midrange. Contested by Brandon George (5.2 feet, ZONE). Tony Doncic misses. Offensive rebound by John Russell! John Russell puts it back in!
Score: 25-29

[02:13] Team_005 possession (Score: 25-29)
Derrick Allen attempts a 3Pt. Wide open! Scottie Harden is 8.5 feet away. [MAN] DERRICK ALLEN MAKES IT! Assist: Brandon George
Score: 28-29

[02:01] Team_027 possession (Score: 28-29)
Bradley Dosunmu attempts a 3Pt. Wide open! Jalen Rozier is 8.2 feet away. [MAN] Bradley Dosunmu misses. FOUL! Loose ball foul on Derrick Allen during the rebound battle. [Team fouls: 4] No free throws, side out. (Derrick Allen: 2 personal fouls)

[01:46] Team_027 possession (Score: 28-29)
Bradley Dosunmu drives to the basket... Bradley Dosunmu throws a bad pass! Stolen by Cade Markkanen! TURNOVER! (live ball)

[01:32] Team_005 possession (Score: 28-29)
Anthony Rozier attempts a Layup. Contested by Tony Doncic (2.3 feet, MAN). Anthony Rozier misses. Offensive rebound by Cade Markkanen! Cade Markkanen kicks it out.

[01:18] Team_005 possession (Score: 28-29)
Brandon George attempts a Midrange. BLOCKED BY TIM JOHNSON! Ball is loose! Rebound secured by Tony Doncic.

[01:04] Team_027 possession (Score: 28-29)
John Russell throws a bad pass out of bounds! TURNOVER! (dead ball)

[01:04] Substitution (Team_005): Brandon George OUT → Blake O'Neal IN (stamina_rule2)

[01:04] Substitution (Team_005): Anthony Rozier OUT → Draymond Smith IN (stamina_rule2)

[01:04] Substitution (Team_005): Derrick Allen OUT → Lauri Wade IN (stamina_rule2)

[01:04] Substitution (Team_005): Jalen Rozier OUT → Isaiah Durant IN (stamina_rule2)

[01:04] Substitution (Team_005): Cade Markkanen OUT → Zion Parker IN (stamina_rule2)

[01:04] Substitution (Team_027): Tim Johnson OUT → CJ Green IN (stamina_rule2)

[01:04] Substitution (Team_027): Tony Doncic OUT → Dirk Lillard IN (stamina_rule2)

[01:04] Substitution (Team_027): Scottie Harden OUT → Rudy Quickley IN (stamina_rule2)

[01:04] Substitution (Team_027): Bradley Dosunmu OUT → LeBron Russell IN (stamina_rule2)

[01:04] Substitution (Team_027): John Russell OUT → Ben Stewart IN (stamina_rule2)

[00:47] Team_005 possession (Score: 28-29)
Blake O'Neal drives, CJ Green stays with him. Blake O'Neal attempts a Layup. Wide open! CJ Green is 6.5 feet away. [MAN] BLAKE O'NEAL MAKES IT! Assist: Draymond Smith
Score: 30-29

[00:32] Team_027 possession (Score: 30-29)
CJ Green attempts a Midrange. Contested by Blake O'Neal (2.3 feet, MAN). CJ Green misses. Offensive rebound by Dirk Lillard! Dirk Lillard kicks it out.

[00:22] Team_027 possession (Score: 30-29)
Dirk Lillard drives, picks up Zion Parker. Help arrives from Blake O'Neal! Dirk Lillard attempts a Dunk. Heavily contested by Blake O'Neal (1.6 feet, ZONE)! Dirk Lillard misses. Rebound secured by Draymond Smith.

[00:08] Team_005 possession (Score: 30-29)
Draymond Smith drives, Dirk Lillard stays with him. Draymond Smith attempts a Layup. Heavily contested by Dirk Lillard (1.5 feet, MAN)! DRAYMOND SMITH MAKES IT! Assist: Isaiah Durant
Score: 32-29

================================================================================
                              1ST QUARTER COMPLETE                              
================================================================================

1ST QUARTER SCORE: Team_005 32, Team_027 29

BOX SCORE:
================================================================================

Team_005
--------------------------------------------------------------------------------
Player                MIN  PTS  REB  AST  TO      FG   FG%      3P   3P%
--------------------------------------------------------------------------------
Derrick Allen          11    8    2    1   0   3/5    60.0     0/0   0.0
Anthony Rozier         11    6    0    3   0   2/2   100.0     0/0   0.0
Brandon George         11    5    0    2   0   2/4    50.0     0/0   0.0
Jalen Rozier           11    5    4    1   0   2/3    66.7     0/0   0.0
Cade Markkanen         11    4    1    2   0   2/3    66.7     0/0   0.0
Blake O'Neal            1    2    0    0   0   1/1   100.0     0/0   0.0
Draymond Smith          1    2    1    1   0   1/1   100.0     0/0   0.0
Isaiah Durant           1    0    0    1   0   0/0     0.0     0/0   0.0

TEAM: FG: 13/19 (68.4%), 3PT: 4/6 (66.7%), REB: 9 (3 off, 6 def), AST: 11, TO: 4
TEAM FOULS: 4


Team_027
--------------------------------------------------------------------------------
Player                MIN  PTS  REB  AST  TO      FG   FG%      3P   3P%
--------------------------------------------------------------------------------
Scottie Harden         11   15    0    1   0   6/7    85.7     0/0   0.0
John Russell           11    6    1    1   0   3/4    75.0     0/0   0.0
Tim Johnson            11    4    0    0   0   2/3    66.7     0/0   0.0
Tony Doncic            11    2    5    0   0   1/3    33.3     0/0   0.0
Bradley Dosunmu        11    2    2    1   0   1/1   100.0     0/0   0.0
Dirk Lillard            1    0    1    0   0   0/1     0.0     0/0   0.0

TEAM: FG: 13/19 (68.4%), 3PT: 1/4 (25.0%), REB: 8 (3 off, 5 def), AST: 3, TO: 3
TEAM FOULS: 4

================================================================================

================================================================================
                       2ND QUARTER - Team_005 vs Team_027                       
================================================================================

[12:00] Team_005 possession (Score: 32-29)
FOUL! Offensive foul on Anthony Rozier! Tony Doncic drew the charge! [Team fouls: 1] (Anthony Rozier: 1 personal fouls) TURNOVER! (dead ball)

[11:44] Team_027 possession (Score: 32-29)
Bradley Dosunmu throws a bad pass out of bounds! TURNOVER! (dead ball)

[11:44] Substitution (Team_005): Brandon George OUT → Blake O'Neal IN (stamina_rule2)

[11:44] Substitution (Team_005): Anthony Rozier OUT → Draymond Smith IN (stamina_rule2)

[11:44] Substitution (Team_005): Cade Markkanen OUT → Zion Parker IN (stamina_rule2)

[11:44] Substitution (Team_027): Scottie Harden OUT → Rudy Quickley IN (stamina_rule2)

[11:30] Team_005 possession (Score: 32-29)
Blake O'Neal attempts a 3Pt. Wide open! Tim Johnson is 6.9 feet away. [MAN] Blake O'Neal misses. Rebound secured by John Russell.

[11:18] Team_027 possession (Score: 32-29)
Bradley Dosunmu drives to the basket... Bradley Dosunmu loses control! Ball rolls out of bounds! TURNOVER! (dead ball)

[11:18] Substitution (Team_005): Jalen Rozier OUT → Isaiah Durant IN (stamina_rule2)

[11:18] Substitution (Team_027): Tim Johnson OUT → CJ Green IN (stamina_rule2)

[11:18] Substitution (Team_027): John Russell OUT → Ben Stewart IN (stamina_rule2)

[11:00] Team_005 possession (Score: 32-29)
Derrick Allen drives to the basket... Derrick Allen throws a bad pass! Stolen by Ben Stewart! TURNOVER! (live ball)

[10:42] Team_027 possession (Score: 32-29)
Tony Doncic attempts a 3Pt. Wide open! Draymond Smith is 7.1 feet away. [MAN] TONY DONCIC MAKES IT! Assist: Bradley Dosunmu
Score: 32-32

[10:27] Team_005 possession (Score: 32-32)
Isaiah Durant drives to the basket... Isaiah Durant throws a bad pass! Stolen by Ben Stewart! TURNOVER! (live ball)

[10:13] Team_027 possession (Score: 32-32)
Tony Doncic attempts a 3Pt. Contested by Draymond Smith (3.4 feet, MAN). TONY DONCIC MAKES IT! Assist: Bradley Dosunmu
Score: 32-35

[09:56] Team_005 possession (Score: 32-35)
Derrick Allen attempts a Midrange. Heavily contested by Rudy Quickley (1.6 feet, MAN)! Derrick Allen misses. Rebound secured by Bradley Dosunmu.

[09:44] Team_027 possession (Score: 32-35)
Rudy Quickley attempts a Midrange. Wide open! Zion Parker is 7.7 feet away. [ZONE] Rudy Quickley misses. Rebound secured by Zion Parker.

[09:29] Team_005 possession (Score: 32-35)
Zion Parker attempts a Midrange. Contested by Ben Stewart (4.8 feet, MAN). ZION PARKER MAKES IT!
Score: 34-35

[09:15] Team_027 possession (Score: 34-35)
Bradley Dosunmu attempts a Midrange. Contested by Derrick Allen (5.2 feet, ZONE). Bradley Dosunmu misses. Rebound secured by Draymond Smith.

[08:59] Team_005 possession (Score: 34-35)
Draymond Smith attempts a 3Pt. Contested by Tony Doncic (4.8 feet, ZONE). Draymond Smith misses. Rebound secured by Ben Stewart.

[08:47] Team_027 possession (Score: 34-35)
Ben Stewart drives and kicks out. CJ Green attempts a Midrange. Contested by Derrick Allen (4.6 feet, ZONE). CJ GREEN MAKES IT!
Score: 34-37

[08:31] Team_005 possession (Score: 34-37)
Isaiah Durant drives and kicks out. Zion Parker attempts a 3Pt. Contested by Ben Stewart (5.7 feet, MAN). Zion Parker misses. Rebound secured by Bradley Dosunmu.

[08:15] Team_027 possession (Score: 34-37)
Tony Doncic attempts a Layup. BLOCKED BY ZION PARKER! Ball deflects out of bounds off Tony Doncic.

[07:59] Team_005 possession (Score: 34-37)
Draymond Smith drives, Ben Stewart stays with him. Draymond Smith attempts a Dunk. Contested by Ben Stewart (2.6 feet, ZONE). Draymond Smith misses. Rebound secured by Tony Doncic.

[07:46] Team_027 possession (Score: 34-37)
CJ Green attempts a Midrange. Contested by Draymond Smith (2.9 feet, ZONE). CJ GREEN MAKES IT!
Score: 34-39

[07:32] Team_005 possession (Score: 34-39)
Blake O'Neal drives to the basket... FOUL! Offensive foul on Blake O'Neal! CJ Green drew the charge! [Team fouls: 2] (Blake O'Neal: 1 personal fouls) TURNOVER! (dead ball)

[07:22] Team_027 possession (Score: 34-39)
CJ Green attempts a Layup. Contested by Blake O'Neal (2.6 feet, MAN). CJ Green misses. Rebound secured by Blake O'Neal.

[07:10] Team_005 possession (Score: 34-39)
FOUL! Reach-in foul on Ben Stewart during the drive. [Team fouls: 1] No free throws, side out. (Ben Stewart: 1 personal fouls)

[06:53] Team_005 possession (Score: 34-39)
Draymond Smith attempts a 3Pt. Heavily contested by Rudy Quickley (0.6 feet, ZONE)! Draymond Smith misses. Rebound secured by Tony Doncic.

[06:43] Team_027 possession (Score: 34-39)
Tony Doncic attempts a Layup. Contested by Draymond Smith (4.7 feet, MAN). TONY DONCIC MAKES IT! Assist: CJ Green
Score: 34-41

[06:28] Team_005 possession (Score: 34-41)
Blake O'Neal attempts a 3Pt. Contested by Rudy Quickley (5.7 feet, ZONE). Blake O'Neal misses. Rebound secured by Bradley Dosunmu.

[06:16] Team_027 possession (Score: 34-41)
Tony Doncic drives and kicks out. Rudy Quickley attempts a Midrange. Wide open! Derrick Allen is 6.7 feet away. [MAN] RUDY QUICKLEY MAKES IT! Assist: CJ Green
Score: 34-43

[05:58] Team_005 possession (Score: 34-43)
Isaiah Durant drives, Bradley Dosunmu stays with him. Isaiah Durant attempts a Layup. Contested by Bradley Dosunmu (5.3 feet, MAN). ISAIAH DURANT MAKES IT! Assist: Derrick Allen
Score: 36-43

[05:45] Team_027 possession (Score: 36-43)
Rudy Quickley attempts a 3Pt. Contested by Blake O'Neal (5.0 feet, ZONE). Rudy Quickley misses. Rebound secured by Zion Parker.

[05:30] Team_005 possession (Score: 36-43)
Zion Parker attempts a Midrange. Heavily contested by Ben Stewart (0.5 feet, MAN)! Zion Parker misses. Offensive rebound by Zion Parker! Zion Parker puts it back in!
Score: 38-43

[05:18] Team_027 possession (Score: 38-43)
Bradley Dosunmu drives, picks up Zion Parker. Help arrives from Blake O'Neal! Bradley Dosunmu attempts a Dunk. Contested by Blake O'Neal (4.0 feet, ZONE). BRADLEY DOSUNMU MAKES IT! Assist: Rudy Quickley
Score: 38-45

[05:02] Team_005 possession (Score: 38-45)
Draymond Smith drives and kicks out. Draymond Smith makes the Midrange and draws the foul on Tony Doncic! And-1! Draymond Smith to the line for 1. [Team fouls: 2] (Tony Doncic: 1 personal fouls)   FT 1/1: GOOD Draymond Smith makes 1/1 from the line.
Score: 41-45

[04:44] Team_027 possession (Score: 41-45)
Rudy Quickley drives, picks up Zion Parker. Help arrives from Blake O'Neal! Rudy Quickley attempts a Dunk. Contested by Blake O'Neal (3.5 feet, ZONE). RUDY QUICKLEY MAKES IT! Assist: Tony Doncic
Score: 41-47

[04:28] Team_005 possession (Score: 41-47)
Zion Parker makes the Layup and draws the foul on Ben Stewart! And-1! Zion Parker to the line for 1. [Team fouls: 3] (Ben Stewart: 2 personal fouls)   FT 1/1: GOOD Zion Parker makes 1/1 from the line.
Score: 44-47

[04:11] Team_027 possession (Score: 44-47)
Rudy Quickley attempts a Midrange. Contested by Derrick Allen (3.1 feet, MAN). RUDY QUICKLEY MAKES IT!
Score: 44-49

[03:56] Team_005 possession (Score: 44-49)
Zion Parker makes the Layup and draws the foul on Ben Stewart! And-1! Zion Parker to the line for 1. [Team fouls: 4] (Ben Stewart: 3 personal fouls)   FT 1/1: GOOD Zion Parker makes 1/1 from the line.
Score: 47-49

[03:37] Team_027 possession (Score: 47-49)
Tony Doncic attempts a 3Pt. Wide open! Draymond Smith is 8.7 feet away. [MAN] Tony Doncic misses. Rebound secured by Draymond Smith.

[03:28] Team_005 possession (Score: 47-49)
Draymond Smith attempts a 3Pt. Contested by Rudy Quickley (5.2 feet, ZONE). Draymond Smith misses. Rebound secured by Bradley Dosunmu.

[03:14] Team_027 possession (Score: 47-49)
CJ Green attempts a Layup. Contested by Zion Parker (3.3 feet, ZONE). CJ GREEN MAKES IT! Assist: Tony Doncic
Score: 47-51

[03:04] Team_005 possession (Score: 47-51)
Blake O'Neal attempts a 3Pt. Wide open! Tony Doncic is 7.2 feet away. [ZONE] Blake O'Neal misses. Offensive rebound by Zion Parker! Zion Parker's putback is no good. Rebound secured by Ben Stewart.

[02:47] Team_027 possession (Score: 47-51)
Rudy Quickley attempts a Layup. Contested by Zion Parker (4.7 feet, ZONE). Rudy Quickley misses. Offensive rebound by Rudy Quickley! Rudy Quickley kicks it out.

[02:31] Team_027 possession (Score: 47-51)
FOUL! Shooting foul on Zion Parker. Tony Doncic to the line for 2 free throws. [Team fouls: 3] (Zion Parker: 1 personal fouls)   FT 1/2: GOOD   FT 2/2: GOOD Tony Doncic makes 2/2 from the line.
Score: 47-53

[02:20] Team_005 possession (Score: 47-53)
Blake O'Neal drives and kicks out. Zion Parker attempts a Midrange. Wide open! Ben Stewart is 6.1 feet away. [MAN] Zion Parker misses. Rebound secured by Ben Stewart.

[02:02] Team_027 possession (Score: 47-53)
CJ Green drives to the basket... CJ Green throws a bad pass! Stolen by Zion Parker! TURNOVER! (live ball)

[01:51] Team_005 possession (Score: 47-53)
Zion Parker drives and kicks out. Derrick Allen attempts a 3Pt. Heavily contested by Rudy Quickley (0.5 feet, ZONE)! Derrick Allen misses. Rebound secured by Ben Stewart.

[01:35] Team_027 possession (Score: 47-53)
CJ Green throws a bad pass! Stolen by Blake O'Neal! TURNOVER! (live ball)

[01:21] Team_005 possession (Score: 47-53)
Derrick Allen attempts a Midrange. Contested by Rudy Quickley (4.8 feet, MAN). Derrick Allen misses. Rebound secured by CJ Green.

[01:10] Team_027 possession (Score: 47-53)
Ben Stewart drives, Zion Parker stays with him. Ben Stewart attempts a Dunk. Heavily contested by Zion Parker (1.4 feet, ZONE)! BEN STEWART MAKES IT! Assist: Bradley Dosunmu
Score: 47-55

[00:51] Team_005 possession (Score: 47-55)
Isaiah Durant attempts a Layup. Contested by Ben Stewart (2.1 feet, ZONE). ISAIAH DURANT MAKES IT!
Score: 49-55

[00:36] Team_027 possession (Score: 49-55)
Bradley Dosunmu attempts a 3Pt. Contested by Isaiah Durant (4.5 feet, MAN). BRADLEY DOSUNMU MAKES IT! Assist: Rudy Quickley
Score: 49-58

[00:22] Team_005 possession (Score: 49-58)
FOUL! Shooting foul on Ben Stewart. Isaiah Durant to the line for 2 free throws. [BONUS: 5 team fouls] (Ben Stewart: 4 personal fouls)   FT 1/2: MISS   FT 2/2: MISS Isaiah Durant makes 0/2 from the line. FOUL! Loose ball foul on Ben Stewart during the free throw rebound! [IN THE BONUS! 6 team fouls] Zion Parker to the line for 2 free throws. (Ben Stewart: 5 personal fouls)   FT 1/2: GOOD   FT 2/2: MISS Zion Parker makes 1/2 from the line. Rebound secured by Ben Stewart.
Score: 50-58

[00:12] Team_027 possession (Score: 50-58)
Tony Doncic drives to the basket... Tony Doncic throws a bad pass! Stolen by Zion Parker! TURNOVER! (live ball)

================================================================================
                              2ND QUARTER COMPLETE                              
================================================================================

2ND QUARTER SCORE: Team_005 18, Team_027 29

BOX SCORE:
================================================================================

Team_005
--------------------------------------------------------------------------------
Player                MIN  PTS  REB  AST  TO      FG   FG%      3P   3P%
--------------------------------------------------------------------------------
Zion Parker            12   10    3    0   0   4/5    80.0     0/0   0.0
Isaiah Durant          12    4    0    0   0   2/4    50.0     0/0   0.0
Draymond Smith         12    3    2    0   0   1/5    20.0     0/0   0.0
Blake O'Neal           12    0    1    0   0   0/4     0.0     0/0   0.0
Derrick Allen          23    0    0    1   0   0/2     0.0     0/0   0.0

TEAM: FG: 7/20 (35.0%), 3PT: 0/6 (0.0%), REB: 7 (2 off, 5 def), AST: 1, TO: 4
TEAM FOULS: 3


Team_027
--------------------------------------------------------------------------------
Player                MIN  PTS  REB  AST  TO      FG   FG%      3P   3P%
--------------------------------------------------------------------------------
Tony Doncic            23   10    2    2   0   4/6    66.7     0/0   0.0
Rudy Quickley          12    6    1    2   0   3/5    60.0     0/0   0.0
CJ Green               12    6    1    2   0   3/4    75.0     0/0   0.0
Bradley Dosunmu        23    5    4    3   0   2/3    66.7     0/0   0.0
Ben Stewart            12    2    5    0   0   1/1   100.0     0/0   0.0
John Russell           12    0    1    0   0   0/0     0.0     0/0   0.0

TEAM: FG: 13/19 (68.4%), 3PT: 3/5 (60.0%), REB: 13 (1 off, 12 def), AST: 9, TO: 5
TEAM FOULS: 6 [Team_005 in BONUS]

================================================================================

================================================================================
                       3RD QUARTER - Team_005 vs Team_027                       
================================================================================

[12:00] Team_005 possession (Score: 50-58)
Anthony Rozier attempts a 3Pt. Contested by Tony Doncic (3.0 feet, MAN). Anthony Rozier misses. Rebound secured by Bradley Dosunmu.

[11:49] Team_027 possession (Score: 50-58)
Bradley Dosunmu attempts a Midrange. Contested by Cade Markkanen (2.6 feet, MAN). Bradley Dosunmu misses. Rebound secured by Cade Markkanen.

[11:35] Team_005 possession (Score: 50-58)
FOUL! Holding foul on Tim Johnson. [Team fouls: 1] No free throws, side out. (Tim Johnson: 1 personal fouls)

[11:22] Team_005 possession (Score: 50-58)
Cade Markkanen attempts a Dunk. BLOCKED BY JOHN RUSSELL! Ball deflects out of bounds off Cade Markkanen.

[11:12] Team_027 possession (Score: 50-58)
John Russell attempts a Layup. Contested by Cade Markkanen (5.1 feet, ZONE). JOHN RUSSELL MAKES IT! Assist: Bradley Dosunmu
Score: 50-60

[11:01] Team_005 possession (Score: 50-60)
Jalen Rozier attempts a Layup. BLOCKED BY JOHN RUSSELL! Ball is loose! Rebound secured by Tony Doncic.

[10:49] Team_027 possession (Score: 50-60)
Scottie Harden attempts a 3Pt. Contested by Derrick Allen (5.0 feet, ZONE). Scottie Harden misses. Rebound secured by Cade Markkanen.

[10:36] Team_005 possession (Score: 50-60)
Cade Markkanen attempts a Layup. Contested by John Russell (4.8 feet, ZONE). CADE MARKKANEN MAKES IT! Assist: Brandon George
Score: 52-60

[10:20] Team_027 possession (Score: 52-60)
Tim Johnson attempts a Layup. Heavily contested by Cade Markkanen (0.5 feet, ZONE)! Tim Johnson misses. Rebound secured by Jalen Rozier.

[10:01] Team_005 possession (Score: 52-60)
Cade Markkanen drives and kicks out. Derrick Allen attempts a Midrange. Contested by Scottie Harden (5.9 feet, MAN). DERRICK ALLEN MAKES IT!
Score: 54-60

[09:47] Team_027 possession (Score: 54-60)
Tim Johnson drives to the basket... Tim Johnson loses the ball! Stripped by Cade Markkanen! TURNOVER! (live ball)

[09:27] Team_005 possession (Score: 54-60)
Derrick Allen drives to the basket... FOUL! Offensive foul on Derrick Allen! Scottie Harden drew the charge! [Team fouls: 1] (Derrick Allen: 1 personal fouls) TURNOVER! (dead ball)

[09:12] Team_027 possession (Score: 54-60)
Tim Johnson loses the ball! Stripped by Brandon George! TURNOVER! (live ball)

[08:57] Team_005 possession (Score: 54-60)
Derrick Allen drives, John Russell stays with him. Derrick Allen attempts a Dunk. Contested by John Russell (5.6 feet, ZONE). Derrick Allen misses. Rebound secured by Bradley Dosunmu.

[08:45] Team_027 possession (Score: 54-60)
John Russell attempts a Midrange. Contested by Jalen Rozier (3.0 feet, ZONE). JOHN RUSSELL MAKES IT!
Score: 54-62

[08:25] Team_005 possession (Score: 54-62)
Derrick Allen attempts a 3Pt. Contested by Scottie Harden (5.5 feet, MAN). Derrick Allen misses. Rebound secured by John Russell.

[08:07] Team_027 possession (Score: 54-62)
FOUL! Shooting foul on Derrick Allen. Tim Johnson to the line for 3 free throws. [Team fouls: 2] (Derrick Allen: 2 personal fouls)   FT 1/3: GOOD   FT 2/3: GOOD   FT 3/3: GOOD Tim Johnson makes 3/3 from the line.
Score: 54-65

[07:55] Team_005 possession (Score: 54-65)
Anthony Rozier attempts a Layup. BLOCKED BY JOHN RUSSELL! Ball is loose! Rebound secured by John Russell.

[07:41] Team_027 possession (Score: 54-65)
Scottie Harden attempts a 3Pt. Contested by Derrick Allen (3.8 feet, MAN). Scottie Harden misses. Offensive rebound by John Russell! John Russell puts it back in!
Score: 54-67

[07:27] Team_005 possession (Score: 54-67)
Jalen Rozier attempts a 3Pt. Contested by Bradley Dosunmu (4.1 feet, MAN). Jalen Rozier misses. Rebound secured by Bradley Dosunmu.

[07:12] Team_027 possession (Score: 54-67)
Scottie Harden attempts a Midrange. Contested by Derrick Allen (5.0 feet, ZONE). Scottie Harden misses. Offensive rebound by Bradley Dosunmu! Bradley Dosunmu kicks it out.

[07:00] Team_027 possession (Score: 54-67)
John Russell drives, picks up Cade Markkanen. Help arrives from Anthony Rozier! John Russell attempts a Dunk. Contested by Anthony Rozier (3.7 feet, MAN). John Russell misses. Rebound secured by Cade Markkanen.

[06:48] Team_005 possession (Score: 54-67)
Cade Markkanen drives, picks up John Russell. Help arrives from Tony Doncic! Cade Markkanen attempts a Layup. Heavily contested by Tony Doncic (1.5 feet, MAN)! CADE MARKKANEN MAKES IT! Assist: Brandon George
Score: 56-67

[06:35] Team_027 possession (Score: 56-67)
Tony Doncic throws a bad pass! Stolen by Anthony Rozier! TURNOVER! (live ball)

[06:19] Team_005 possession (Score: 56-67)
Anthony Rozier attempts a Midrange. Contested by Scottie Harden (4.3 feet, ZONE). ANTHONY ROZIER MAKES IT! Assist: Jalen Rozier
Score: 58-67

[06:09] Team_027 possession (Score: 58-67)
John Russell drives and kicks out. Tony Doncic attempts a 3Pt. Contested by Anthony Rozier (5.3 feet, MAN). TONY DONCIC MAKES IT! Assist: John Russell
Score: 58-70

[05:58] Team_005 possession (Score: 58-70)
Derrick Allen attempts a 3Pt. Wide open! Tim Johnson is 8.3 feet away. [ZONE] Derrick Allen misses. Offensive rebound by Jalen Rozier! Jalen Rozier kicks it out.

[05:46] Team_005 possession (Score: 58-70)
Brandon George attempts a Midrange. Contested by Tim Johnson (3.8 feet, MAN). BRANDON GEORGE MAKES IT!
Score: 60-70

[05:34] Team_027 possession (Score: 60-70)
Scottie Harden attempts a 3Pt. Contested by Derrick Allen (4.5 feet, MAN). Scottie Harden misses. Rebound secured by Derrick Allen.

[05:19] Team_005 possession (Score: 60-70)
FOUL! Holding foul on Bradley Dosunmu. [Team fouls: 2] No free throws, side out. (Bradley Dosunmu: 1 personal fouls)

[05:04] Team_005 possession (Score: 60-70)
Cade Markkanen drives and kicks out. Anthony Rozier attempts a 3Pt. Contested by Tony Doncic (5.4 feet, MAN). Anthony Rozier misses. Rebound secured by Tony Doncic.

[04:49] Team_027 possession (Score: 60-70)
Bradley Dosunmu attempts a 3Pt. Contested by Derrick Allen (3.0 feet, ZONE). Bradley Dosunmu misses. Rebound secured by Derrick Allen.

[04:36] Team_005 possession (Score: 60-70)
Jalen Rozier attempts a 3Pt. Wide open! Tim Johnson is 6.7 feet away. [ZONE] Jalen Rozier misses. Offensive rebound by Jalen Rozier! Jalen Rozier kicks it out.

[04:17] Team_005 possession (Score: 60-70)
Jalen Rozier attempts a 3Pt. Contested by Tim Johnson (5.5 feet, ZONE). Jalen Rozier misses. Offensive rebound by Cade Markkanen! Cade Markkanen puts it back in!
Score: 62-70

[04:01] Team_027 possession (Score: 62-70)
John Russell attempts a Dunk. BLOCKED BY CADE MARKKANEN! Ball is loose! Rebound secured by Cade Markkanen.

[03:43] Team_005 possession (Score: 62-70)
Cade Markkanen attempts a Midrange. Contested by Bradley Dosunmu (4.6 feet, ZONE). Cade Markkanen misses. Rebound secured by Tony Doncic.

[03:28] Team_027 possession (Score: 62-70)
Tim Johnson attempts a 3Pt. Contested by Brandon George (5.2 feet, ZONE). TIM JOHNSON MAKES IT!
Score: 62-73

[03:13] Team_005 possession (Score: 62-73)
Brandon George attempts a Layup. Contested by Tim Johnson (5.1 feet, MAN). BRANDON GEORGE MAKES IT!
Score: 64-73

[02:59] Team_027 possession (Score: 64-73)
FOUL! Holding foul on Derrick Allen. [Team fouls: 3] No free throws, side out. (Derrick Allen: 3 personal fouls)

[02:45] Team_027 possession (Score: 64-73)
Bradley Dosunmu makes the Layup and draws the foul on Jalen Rozier! And-1! Bradley Dosunmu to the line for 1. [Team fouls: 4] (Jalen Rozier: 1 personal fouls)   FT 1/1: GOOD Bradley Dosunmu makes 1/1 from the line.
Score: 64-76

[02:33] Team_005 possession (Score: 64-76)
Cade Markkanen drives to the basket... Cade Markkanen loses the ball! Stripped by John Russell! TURNOVER! (live ball)

[02:13] Team_027 possession (Score: 64-76)
John Russell throws a bad pass! Stolen by Cade Markkanen! TURNOVER! (live ball)

[01:59] Team_005 possession (Score: 64-76)
FOUL! Reach-in foul on Bradley Dosunmu during the drive. [Team fouls: 3] No free throws, side out. (Bradley Dosunmu: 2 personal fouls)

[01:49] Team_005 possession (Score: 64-76)
Anthony Rozier loses the ball! Stripped by Tony Doncic! TURNOVER! (live ball)

[01:37] Team_027 possession (Score: 64-76)
Bradley Dosunmu attempts a 3Pt. Contested by Jalen Rozier (2.9 feet, MAN). Bradley Dosunmu misses. Offensive rebound by John Russell! John Russell's putback is no good. Offensive rebound by John Russell! John Russell kicks it out.

[01:25] Team_027 possession (Score: 64-76)
John Russell drives, picks up Cade Markkanen. Help arrives from Anthony Rozier! John Russell attempts a Dunk. Wide open! Anthony Rozier is 6.5 feet away. [MAN] JOHN RUSSELL MAKES IT! Assist: Bradley Dosunmu
Score: 64-78

[01:11] Team_005 possession (Score: 64-78)
Anthony Rozier attempts a Midrange. Wide open! Scottie Harden is 7.1 feet away. [ZONE] ANTHONY ROZIER MAKES IT! Assist: Jalen Rozier
Score: 66-78

[00:58] Team_027 possession (Score: 66-78)
Tony Doncic attempts a Midrange. Contested by Anthony Rozier (4.7 feet, MAN). Tony Doncic misses. Rebound secured by Derrick Allen.

[00:44] Team_005 possession (Score: 66-78)
Derrick Allen attempts a Midrange. Contested by Scottie Harden (4.9 feet, MAN). DERRICK ALLEN MAKES IT!
Score: 68-78

[00:29] Team_027 possession (Score: 68-78)
Scottie Harden attempts a Midrange. Contested by Derrick Allen (3.5 feet, MAN). SCOTTIE HARDEN MAKES IT! Assist: Bradley Dosunmu
Score: 68-80

[00:14] Team_005 possession (Score: 68-80)
Brandon George attempts a Layup. Contested by Tim Johnson (2.7 feet, MAN). BRANDON GEORGE MAKES IT!
Score: 70-80

================================================================================
                              3RD QUARTER COMPLETE                              
================================================================================

3RD QUARTER SCORE: Team_005 20, Team_027 22

BOX SCORE:
================================================================================

Team_005
--------------------------------------------------------------------------------
Player                MIN  PTS  REB  AST  TO      FG   FG%      3P   3P%
--------------------------------------------------------------------------------
Cade Markkanen         24    6    5    0   0   3/6    50.0     0/0   0.0
Brandon George         24    6    0    2   0   3/3   100.0     0/0   0.0
Anthony Rozier         24    4    0    0   0   2/4    50.0     0/0   0.0
Derrick Allen          35    4    3    0   0   2/4    50.0     0/0   0.0
Jalen Rozier           24    0    3    2   0   0/2     0.0     0/0   0.0

TEAM: FG: 10/19 (52.6%), 3PT: 1/4 (25.0%), REB: 11 (3 off, 8 def), AST: 4, TO: 3
TEAM FOULS: 5 [Team_027 in BONUS]


Team_027
--------------------------------------------------------------------------------
Player                MIN  PTS  REB  AST  TO      FG   FG%      3P   3P%
--------------------------------------------------------------------------------
John Russell           24    8    4    1   0   4/6    66.7     0/0   0.0
Tim Johnson            24    6    0    0   0   2/3    66.7     0/0   0.0
Bradley Dosunmu        35    3    4    3   0   1/3    33.3     0/0   0.0
Tony Doncic            35    3    3    0   0   1/2    50.0     0/0   0.0
Scottie Harden         24    2    0    0   0   1/3    33.3     0/0   0.0

TEAM: FG: 9/17 (52.9%), 3PT: 3/6 (50.0%), REB: 11 (3 off, 8 def), AST: 4, TO: 4
TEAM FOULS: 3

================================================================================

================================================================================
                       4TH QUARTER - Team_005 vs Team_027                       
================================================================================

[12:00] Substitution (Team_005): Brandon George OUT (stamina: 66) → Blake O'Neal IN (comeback_detected)

[12:00] Substitution (Team_027): Tim Johnson OUT (stamina: 67) → CJ Green IN (comeback_detected)

[12:00] Team_005 possession (Score: 70-80)
Cade Markkanen attempts a Midrange. Contested by John Russell (5.1 feet, MAN). Cade Markkanen misses. Rebound secured by Bradley Dosunmu.

[11:46] Team_027 possession (Score: 70-80)
CJ Green drives to the basket... FOUL! Offensive foul on CJ Green! Cade Markkanen drew the charge! [Team fouls: 1] (CJ Green: 1 personal fouls) TURNOVER! (dead ball)

[11:31] Team_005 possession (Score: 70-80)
Derrick Allen attempts a Midrange. Contested by Bradley Dosunmu (3.1 feet, ZONE). Derrick Allen misses. Rebound secured by Tony Doncic.

[11:21] Team_027 possession (Score: 70-80)
Scottie Harden attempts a 3Pt. Contested by Derrick Allen (4.5 feet, MAN). SCOTTIE HARDEN MAKES IT! Assist: Tony Doncic
Score: 70-83

[11:06] Team_005 possession (Score: 70-83)
Jalen Rozier attempts a Midrange. Wide open! Bradley Dosunmu is 6.9 feet away. [MAN] Jalen Rozier misses. Offensive rebound by Cade Markkanen! Cade Markkanen kicks it out.

[10:48] Team_005 possession (Score: 70-83)
Blake O'Neal attempts a Layup. Heavily contested by CJ Green (1.0 feet, MAN)! BLAKE O'NEAL MAKES IT! Assist: Cade Markkanen
Score: 72-83

[10:36] Team_027 possession (Score: 72-83)
Bradley Dosunmu attempts a Midrange. Contested by Jalen Rozier (5.3 feet, MAN). Bradley Dosunmu misses. Rebound secured by Derrick Allen.

[10:19] Team_005 possession (Score: 72-83)
Blake O'Neal attempts a 3Pt. Contested by Bradley Dosunmu (4.1 feet, ZONE). Blake O'Neal misses. Rebound secured by John Russell.

[10:07] Team_027 possession (Score: 72-83)
Scottie Harden drives and kicks out. Bradley Dosunmu attempts a 3Pt. Wide open! Blake O'Neal is 6.6 feet away. [ZONE] BRADLEY DOSUNMU MAKES IT! Assist: CJ Green
Score: 72-86

[09:54] Team_005 possession (Score: 72-86)
Blake O'Neal attempts a 3Pt. Contested by CJ Green (5.2 feet, MAN). Blake O'Neal misses. Offensive rebound by Derrick Allen! Derrick Allen kicks it out.

[09:40] Team_005 possession (Score: 72-86)
Jalen Rozier attempts a Midrange. Contested by Bradley Dosunmu (5.0 feet, MAN). Jalen Rozier misses. Rebound secured by Tony Doncic.

[09:23] Team_027 possession (Score: 72-86)
Tony Doncic attempts a Midrange. Contested by Anthony Rozier (2.9 feet, ZONE). Tony Doncic misses. Offensive rebound by Bradley Dosunmu! Bradley Dosunmu kicks it out.

[09:12] Team_027 possession (Score: 72-86)
CJ Green attempts a 3Pt. Wide open! Anthony Rozier is 6.4 feet away. [ZONE] CJ Green misses. Rebound secured by Cade Markkanen.

[08:58] Team_005 possession (Score: 72-86)
Anthony Rozier attempts a 3Pt. Contested by CJ Green (4.6 feet, ZONE). ANTHONY ROZIER MAKES IT! Assist: Jalen Rozier
Score: 75-86

[08:44] Team_027 possession (Score: 75-86)
FOUL! Shooting foul on Cade Markkanen. Scottie Harden to the line for 2 free throws. [Team fouls: 1] (Cade Markkanen: 1 personal fouls)   FT 1/2: GOOD   FT 2/2: GOOD Scottie Harden makes 2/2 from the line.
Score: 75-88

[08:27] Team_005 possession (Score: 75-88)
Derrick Allen attempts a Midrange. Contested by CJ Green (3.7 feet, ZONE). Derrick Allen misses. Rebound secured by Tony Doncic.

[08:13] Team_027 possession (Score: 75-88)
Scottie Harden drives, Cade Markkanen stays with him. Scottie Harden attempts a Dunk. Contested by Cade Markkanen (2.7 feet, ZONE). SCOTTIE HARDEN MAKES IT!
Score: 75-90

[07:58] Team_005 possession (Score: 75-90)
FOUL! Holding foul on Scottie Harden. [Team fouls: 2] No free throws, side out. (Scottie Harden: 1 personal fouls)

[07:46] Team_005 possession (Score: 75-90)
Blake O'Neal drives, picks up CJ Green. Help arrives from Tony Doncic! Blake O'Neal attempts a Layup. Contested by Tony Doncic (3.0 feet, MAN). BLAKE O'NEAL MAKES IT!
Score: 77-90

[07:32] Team_027 possession (Score: 77-90)
Tony Doncic drives and kicks out. John Russell attempts a Midrange. Heavily contested by Blake O'Neal (1.0 feet, ZONE)! JOHN RUSSELL MAKES IT! Assist: CJ Green
Score: 77-92

[07:17] Team_005 possession (Score: 77-92)
Anthony Rozier attempts a Midrange. Contested by Bradley Dosunmu (2.2 feet, ZONE). ANTHONY ROZIER MAKES IT!
Score: 79-92

[06:59] Team_027 possession (Score: 79-92)
John Russell drives to the basket... FOUL! Offensive foul on John Russell! Cade Markkanen drew the charge! [Team fouls: 3] (John Russell: 1 personal fouls) TURNOVER! (dead ball)

[06:42] Team_005 possession (Score: 79-92)
Derrick Allen throws a bad pass out of bounds! TURNOVER! (dead ball)

[06:42] Substitution (Team_005): Anthony Rozier OUT → Draymond Smith IN (stamina_rule2)

[06:42] Substitution (Team_005): Derrick Allen OUT → Lauri Wade IN (stamina_rule2)

[06:42] Substitution (Team_005): Jalen Rozier OUT → Isaiah Durant IN (stamina_rule2)

[06:42] Substitution (Team_005): Cade Markkanen OUT → Zion Parker IN (stamina_rule2)

[06:42] Substitution (Team_027): Tony Doncic OUT → Dirk Lillard IN (stamina_rule2)

[06:42] Substitution (Team_027): Scottie Harden OUT → Rudy Quickley IN (stamina_rule2)

[06:42] Substitution (Team_027): Bradley Dosunmu OUT → LeBron Russell IN (stamina_rule2)

[06:42] Substitution (Team_027): John Russell OUT → Ben Stewart IN (stamina_rule2)

[06:25] Team_027 possession (Score: 79-92)
FOUL! Reach-in foul on Blake O'Neal during the drive. [Team fouls: 2] No free throws, side out. (Blake O'Neal: 1 personal fouls)

[06:09] Team_027 possession (Score: 79-92)
CJ Green attempts a 3Pt. Wide open! Draymond Smith is 6.3 feet away. [ZONE] CJ GREEN MAKES IT! Assist: LeBron Russell
Score: 79-95

[05:57] Team_005 possession (Score: 79-95)
Zion Parker drives, picks up Ben Stewart. Help arrives from Dirk Lillard! Zion Parker attempts a Layup. Contested by Dirk Lillard (4.8 feet, MAN). ZION PARKER MAKES IT! Assist: Blake O'Neal
Score: 81-95

[05:43] Team_027 possession (Score: 81-95)
Rudy Quickley drives to the basket... Rudy Quickley throws a bad pass! Stolen by Zion Parker! TURNOVER! (live ball)

[05:26] Team_005 possession (Score: 81-95)
Lauri Wade drives and kicks out. Draymond Smith attempts a 3Pt. Contested by Rudy Quickley (3.8 feet, ZONE). Draymond Smith misses. Offensive rebound by Draymond Smith! Draymond Smith kicks it out.

[05:09] Team_005 possession (Score: 81-95)
Draymond Smith drives, Dirk Lillard stays with him. Draymond Smith attempts a Layup. Contested by Dirk Lillard (3.5 feet, MAN). Draymond Smith misses. Rebound secured by Dirk Lillard.

[04:55] Team_027 possession (Score: 81-95)
Dirk Lillard attempts a Midrange. Heavily contested by Draymond Smith (0.9 feet, MAN)! DIRK LILLARD MAKES IT! Assist: Rudy Quickley
Score: 81-97

[04:41] Team_005 possession (Score: 81-97)
Zion Parker attempts a Midrange. Wide open! Dirk Lillard is 9.5 feet away. [ZONE] Zion Parker misses. Rebound secured by Ben Stewart.

[04:28] Team_027 possession (Score: 81-97)
FOUL! Reach-in foul on Zion Parker during the drive. [Team fouls: 3] No free throws, side out. (Zion Parker: 1 personal fouls)

[04:12] Team_027 possession (Score: 81-97)
Dirk Lillard attempts a Midrange. Contested by Draymond Smith (4.6 feet, MAN). DIRK LILLARD MAKES IT! Assist: Ben Stewart
Score: 81-99

[03:59] Team_005 possession (Score: 81-99)
Lauri Wade drives to the basket... FOUL! Offensive foul on Lauri Wade! Rudy Quickley drew the charge! [Team fouls: 4] (Lauri Wade: 1 personal fouls) TURNOVER! (dead ball)

[03:48] Team_027 possession (Score: 81-99)
FOUL! Shooting foul on Zion Parker. Ben Stewart to the line for 2 free throws. [BONUS: 5 team fouls] (Zion Parker: 2 personal fouls)   FT 1/2: GOOD   FT 2/2: GOOD Ben Stewart makes 2/2 from the line.
Score: 81-101

[03:37] Team_005 possession (Score: 81-101)
Draymond Smith drives, Dirk Lillard stays with him. Draymond Smith attempts a Layup. Contested by Dirk Lillard (4.8 feet, MAN). DRAYMOND SMITH MAKES IT! Assist: Lauri Wade
Score: 83-101

[03:21] Team_027 possession (Score: 83-101)
FOUL! Shooting foul on Blake O'Neal. CJ Green to the line for 2 free throws. [BONUS: 6 team fouls] (Blake O'Neal: 2 personal fouls)   FT 1/2: GOOD   FT 2/2: GOOD CJ Green makes 2/2 from the line.
Score: 83-103

[03:04] Team_005 possession (Score: 83-103)
Zion Parker attempts a Midrange. Wide open! Ben Stewart is 8.0 feet away. [MAN] ZION PARKER MAKES IT! Assist: Draymond Smith
Score: 85-103

[02:50] Team_027 possession (Score: 85-103)
Rudy Quickley drives, Lauri Wade stays with him. Rudy Quickley attempts a Dunk. Contested by Lauri Wade (2.5 feet, MAN). Rudy Quickley misses. Rebound secured by Lauri Wade.

[02:35] Team_005 possession (Score: 85-103)
Lauri Wade attempts a Midrange. Heavily contested by Rudy Quickley (0.7 feet, MAN)! Lauri Wade misses. Rebound secured by LeBron Russell.

[02:15] Team_027 possession (Score: 85-103)
Rudy Quickley attempts a 3Pt. Contested by Blake O'Neal (4.2 feet, ZONE). RUDY QUICKLEY MAKES IT! Assist: CJ Green
Score: 85-106

[02:02] Team_005 possession (Score: 85-106)
Lauri Wade attempts a 3Pt. Contested by Rudy Quickley (3.0 feet, ZONE). Lauri Wade misses. Rebound secured by Dirk Lillard.

[01:47] Team_027 possession (Score: 85-106)
LeBron Russell throws a bad pass! Stolen by Isaiah Durant! TURNOVER! (live ball)

[01:35] Team_005 possession (Score: 85-106)
FOUL! Shooting foul on Ben Stewart. Zion Parker to the line for 2 free throws. [Team fouls: 4] (Ben Stewart: 1 personal fouls)   FT 1/2: GOOD   FT 2/2: GOOD Zion Parker makes 2/2 from the line.
Score: 87-106

[01:25] Team_027 possession (Score: 87-106)
FOUL! Reach-in foul on Lauri Wade during the drive. [IN THE BONUS! 7 team fouls] Rudy Quickley to the line for 2 free throws. (Lauri Wade: 2 personal fouls)   FT 1/2: GOOD   FT 2/2: GOOD Rudy Quickley makes 2/2 from the line.
Score: 87-108

[01:09] Team_005 possession (Score: 87-108)
Lauri Wade attempts a Layup. Heavily contested by Rudy Quickley (1.8 feet, MAN)! LAURI WADE MAKES IT! Assist: Blake O'Neal
Score: 89-108

[00:57] Team_027 possession (Score: 89-108)
Dirk Lillard attempts a 3Pt. Contested by Draymond Smith (5.4 feet, MAN). Dirk Lillard misses. Rebound secured by Draymond Smith.

[00:39] Team_005 possession (Score: 89-108)
Zion Parker attempts a Midrange. Contested by LeBron Russell (5.4 feet, ZONE). ZION PARKER MAKES IT! Assist: Isaiah Durant
Score: 91-108

[00:25] Team_027 possession (Score: 91-108)
FOUL! Shooting foul on Zion Parker. LeBron Russell to the line for 2 free throws. [BONUS: 8 team fouls] (Zion Parker: 3 personal fouls)   FT 1/2: GOOD   FT 2/2: GOOD LeBron Russell makes 2/2 from the line.
Score: 91-110

[00:12] Team_005 possession (Score: 91-110)
Draymond Smith attempts a 3Pt. Contested by Rudy Quickley (2.4 feet, ZONE). Draymond Smith misses. Rebound secured by Dirk Lillard.

================================================================================
                              4TH QUARTER COMPLETE                              
================================================================================

4TH QUARTER SCORE: Team_005 21, Team_027 30

BOX SCORE:
================================================================================

Team_005
--------------------------------------------------------------------------------
Player                MIN  PTS  REB  AST  TO      FG   FG%      3P   3P%
--------------------------------------------------------------------------------
Zion Parker            19    8    0    0   0   4/5    80.0     0/0   0.0
Anthony Rozier         29    5    0    0   0   2/2   100.0     0/0   0.0
Blake O'Neal           24    4    0    2   0   2/3    66.7     0/0   0.0
Draymond Smith         19    2    2    1   0   1/3    33.3     0/0   0.0
Lauri Wade              7    2    1    1   0   1/3    33.3     0/0   0.0
Cade Markkanen         29    0    2    1   0   0/1     0.0     0/0   0.0
Derrick Allen          41    0    2    0   0   0/2     0.0     0/0   0.0
Jalen Rozier           30    0    0    1   0   0/1     0.0     0/0   0.0
Isaiah Durant          18    0    0    1   0   0/0     0.0     0/0   0.0

TEAM: FG: 10/20 (50.0%), 3PT: 1/4 (25.0%), REB: 7 (3 off, 4 def), AST: 7, TO: 2
TEAM FOULS: 8 [Team_027 in BONUS]


Team_027
--------------------------------------------------------------------------------
Player                MIN  PTS  REB  AST  TO      FG   FG%      3P   3P%
--------------------------------------------------------------------------------
Scottie Harden         29    7    0    0   0   3/3   100.0     0/0   0.0
CJ Green               24    5    0    3   0   2/3    66.7     0/0   0.0
Rudy Quickley          19    5    0    1   0   2/3    66.7     0/0   0.0
Dirk Lillard            7    4    3    0   0   2/3    66.7     0/0   0.0
Bradley Dosunmu        41    3    2    0   0   1/2    50.0     0/0   0.0
John Russell           30    2    1    0   0   1/1   100.0     0/0   0.0
LeBron Russell          7    2    1    1   0   1/1   100.0     0/0   0.0
Ben Stewart            18    2    1    1   0   1/1   100.0     0/0   0.0
Tony Doncic            41    0    3    1   0   0/0     0.0     0/0   0.0

TEAM: FG: 13/17 (76.5%), 3PT: 3/5 (60.0%), REB: 11 (1 off, 10 def), AST: 7, TO: 4
TEAM FOULS: 4

================================================================================

================================================================================
                               FULL GAME COMPLETE                               
================================================================================

FINAL SCORE: Team_005 91, Team_027 110

SCORING BY QUARTER:
--------------------------------------------------------------------------------
Team                     Q1     Q2     Q3     Q4    FINAL
--------------------------------------------------------------------------------
Team_005                 32     18     20     21       91
Team_027                 29     29     22     30      110
--------------------------------------------------------------------------------

FULL GAME BOX SCORE:
================================================================================

Team_005
--------------------------------------------------------------------------------
Player                MIN  PTS  REB  AST  TO      FG   FG%      3P   3P%      FT STL BLK
--------------------------------------------------------------------------------
Derrick Allen          41   12    7    2   1   4/12   33.3   1/4    25.0   1/1     0   0
Jalen Rozier           30    5    7    4   1   3/7    42.9   2/3    66.7   0/0     1   0
Anthony Rozier         29   15    0    3   5   6/8    75.0   2/3    66.7   1/1     1   0
Cade Markkanen         29   10    8    3   1   5/10   50.0   0/0     0.0   0/0     3   1
Blake O'Neal           24    6    1    2   1   3/8    37.5   0/4     0.0   0/0     1   0
Brandon George         24   11    0    4   1   5/7    71.4   1/1   100.0   0/0     1   0
Draymond Smith         19    7    5    2   2   3/9    33.3   0/4     0.0   1/1     0   0
Zion Parker            19   18    3    0   1   8/10   80.0   0/0     0.0   4/4     3   1
Isaiah Durant          18    4    0    2   0   2/4    50.0   0/0     0.0   0/2     1   0
Lauri Wade              7    2    1    1   0   1/3    33.3   0/1     0.0   0/0     0   0

TEAM: FG: 40/78 (51.3%), 3PT: 6/20 (30.0%), REB: 34 (11 off, 23 def), AST: 23, TO: 13


Team_027
--------------------------------------------------------------------------------
Player                MIN  PTS  REB  AST  TO      FG   FG%      3P   3P%      FT STL BLK
--------------------------------------------------------------------------------
Tony Doncic            41   15   13    3   3   8/13   61.5   2/5    40.0   2/2     3   0
Bradley Dosunmu        41   13   12    7   2   4/8    50.0   1/2    50.0   3/3     0   0
John Russell           30   16    7    2   4   6/9    66.7   0/0     0.0   0/0     2   3
Scottie Harden         29   24    0    1   1  12/15   80.0   3/6    50.0   4/4     0   0
Tim Johnson            24   10    0    0   1   4/6    66.7   2/2   100.0   3/3     0   1
CJ Green               24   11    1    5   1   4/6    66.7   1/2    50.0   2/2     0   0
Rudy Quickley          19   11    1    3   3   4/7    57.1   1/2    50.0   2/2     0   0
Ben Stewart            18    4    6    1   0   3/3   100.0   0/0     0.0   2/2     2   0
Dirk Lillard            7    4    4    0   0   2/4    50.0   0/1     0.0   0/0     0   0
LeBron Russell          7    2    1    1   1   1/1   100.0   0/0     0.0   2/2     0   0

TEAM: FG: 48/72 (66.7%), 3PT: 10/20 (50.0%), REB: 43 (8 off, 35 def), AST: 23, TO: 16

================================================================================
