================================================================================
                        FULL GAME - Team_066 vs Team_048                        
================================================================================

================================================================================
                       1ST QUARTER - Team_066 vs Team_048                       
================================================================================

[12:00] Team_066 possession (Score: 0-0)
Brandon Reaves attempts a Midrange. Contested by Dejounte Sexton (3.9 feet, MAN). Brandon Reaves misses. Rebound secured by Kevin Fox.

[11:44] Team_048 possession (Score: 0-0)
Dejounte Sexton attempts a 3Pt. Contested by Brandon Reaves (5.9 feet, ZONE). DEJOUNTE SEXTON MAKES IT! Assist: Damian Mobley
Score: 0-3

[11:34] Team_066 possession (Score: 0-3)
Pau Curry drives to the basket... Pau Curry throws a bad pass! Stolen by Karl Johnson! TURNOVER! (live ball)

[11:20] Team_048 possession (Score: 0-3)
Damian Mobley throws a bad pass out of bounds! TURNOVER! (dead ball)

[11:02] Team_066 possession (Score: 0-3)
Brandon Reaves attempts a Midrange. Contested by Dejounte Sexton (4.3 feet, MAN). Brandon Reaves misses. Rebound secured by Kevin Fox.

[10:50] Team_048 possession (Score: 0-3)
Karl Johnson drives to the basket... FOUL! Offensive foul on Karl Johnson! Kyle Wagner drew the charge! [Team fouls: 1] (Karl Johnson: 1 personal fouls) TURNOVER! (dead ball)

[10:36] Team_066 possession (Score: 0-3)
Brandon Reaves attempts a 3Pt. Contested by Dejounte Sexton (4.7 feet, MAN). Brandon Reaves misses. Rebound secured by Damian Mobley.

[10:23] Team_048 possession (Score: 0-3)
Karl Johnson attempts a 3Pt. Wide open! Yao Brogdon is 7.0 feet away. [ZONE] KARL JOHNSON MAKES IT! Assist: Damian Mobley
Score: 0-6

[10:08] Team_066 possession (Score: 0-6)
Yao Brogdon attempts a Midrange. Contested by Kevin Fox (3.1 feet, MAN). YAO BROGDON MAKES IT! Assist: Brandon Reaves
Score: 2-6

[09:53] Team_048 possession (Score: 2-6)
Paolo Rozier drives to the basket... Paolo Rozier throws a bad pass out of bounds! TURNOVER! (dead ball)

[09:41] Team_066 possession (Score: 2-6)
Yao Brogdon drives, picks up Kevin Fox. Help arrives from Karl Johnson! Yao Brogdon attempts a Layup. Heavily contested by Karl Johnson (1.4 feet, ZONE)! Yao Brogdon misses. Rebound secured by Dejounte Sexton.

[09:22] Team_048 possession (Score: 2-6)
Kevin Fox makes the Dunk and draws the foul on Yao Brogdon! And-1! Kevin Fox to the line for 1. [Team fouls: 1] (Yao Brogdon: 1 personal fouls)   FT 1/1: GOOD Kevin Fox makes 1/1 from the line.
Score: 2-9

[09:05] Team_066 possession (Score: 2-9)
Jimmy Davis drives, Paolo Rozier stays with him. Jimmy Davis attempts a Layup. Wide open! Paolo Rozier is 6.3 feet away. [MAN] JIMMY DAVIS MAKES IT! Assist: Yao Brogdon
Score: 4-9

[08:48] Team_048 possession (Score: 4-9)
Damian Mobley drives, Kyle Wagner stays with him. Damian Mobley attempts a Dunk. Wide open! Kyle Wagner is 6.4 feet away. [ZONE] DAMIAN MOBLEY MAKES IT! Assist: Paolo Rozier
Score: 4-11

[08:33] Team_066 possession (Score: 4-11)
Yao Brogdon attempts a 3Pt. Contested by Kevin Fox (5.1 feet, MAN). Yao Brogdon misses. Rebound secured by Damian Mobley.

[08:18] Team_048 possession (Score: 4-11)
Karl Johnson drives and kicks out. Karl Johnson attempts a 3Pt. Contested by Pau Curry (4.6 feet, ZONE). Karl Johnson misses. Rebound secured by Yao Brogdon.

[08:03] Team_066 possession (Score: 4-11)
Brandon Reaves attempts a Midrange. Contested by Dejounte Sexton (4.7 feet, MAN). BRANDON REAVES MAKES IT!
Score: 6-11

[07:48] Team_048 possession (Score: 6-11)
Damian Mobley drives, Kyle Wagner stays with him. Damian Mobley attempts a Dunk. Contested by Kyle Wagner (3.3 feet, ZONE). DAMIAN MOBLEY MAKES IT! Assist: Paolo Rozier
Score: 6-13

[07:35] Team_066 possession (Score: 6-13)
Jimmy Davis makes the Dunk and draws the foul on Dejounte Sexton! And-1! Jimmy Davis to the line for 1. [Team fouls: 2] (Dejounte Sexton: 1 personal fouls)   FT 1/1: GOOD Jimmy Davis makes 1/1 from the line.
Score: 9-13

[07:21] Team_048 possession (Score: 9-13)
Karl Johnson attempts a 3Pt. Wide open! Brandon Reaves is 10.0 feet away. [ZONE] Karl Johnson misses. Rebound secured by Brandon Reaves.

[07:07] Team_066 possession (Score: 9-13)
Jimmy Davis attempts a 3Pt. Contested by Karl Johnson (2.3 feet, ZONE). Jimmy Davis misses. Rebound secured by Kevin Fox.

[06:52] Team_048 possession (Score: 9-13)
Damian Mobley drives to the basket... Damian Mobley throws a bad pass! Stolen by Kyle Wagner! TURNOVER! (live ball)

[06:41] Team_066 possession (Score: 9-13)
FOUL! Holding foul on Karl Johnson. [Team fouls: 3] No free throws, side out. (Karl Johnson: 2 personal fouls)

[06:26] Team_066 possession (Score: 9-13)
Pau Curry attempts a 3Pt. Contested by Karl Johnson (2.1 feet, MAN). Pau Curry misses. Rebound secured by Damian Mobley.

[06:10] Team_048 possession (Score: 9-13)
Damian Mobley attempts a Layup. Contested by Kyle Wagner (3.9 feet, MAN). DAMIAN MOBLEY MAKES IT! Assist: Paolo Rozier
Score: 9-15

[05:57] Team_066 possession (Score: 9-15)
Jimmy Davis makes the Dunk and draws the foul on Karl Johnson! And-1! Jimmy Davis to the line for 1. [Team fouls: 4] (Karl Johnson: 3 personal fouls)   FT 1/1: MISS Jimmy Davis makes 0/1 from the line. Offensive rebound by Kyle Wagner! Kyle Wagner kicks it out.
Score: 11-15

[05:41] Team_066 possession (Score: 11-15)
FOUL! Shooting foul on Dejounte Sexton. Jimmy Davis to the line for 2 free throws. [BONUS: 5 team fouls] (Dejounte Sexton: 2 personal fouls)   FT 1/2: GOOD   FT 2/2: GOOD Jimmy Davis makes 2/2 from the line.
Score: 13-15

[05:30] Team_048 possession (Score: 13-15)
Kevin Fox attempts a Midrange. Contested by Jimmy Davis (2.0 feet, ZONE). KEVIN FOX MAKES IT! Assist: Paolo Rozier
Score: 13-17

[05:16] Team_066 possession (Score: 13-17)
Jimmy Davis makes the Layup and draws the foul on Kevin Fox! And-1! Jimmy Davis to the line for 1. [BONUS: 6 team fouls] (Kevin Fox: 1 personal fouls)   FT 1/1: GOOD Jimmy Davis makes 1/1 from the line.
Score: 16-17

[05:01] Team_048 possession (Score: 16-17)
Paolo Rozier attempts a 3Pt. Wide open! Pau Curry is 9.3 feet away. [ZONE] Paolo Rozier misses. Rebound secured by Kyle Wagner.

[04:46] Team_066 possession (Score: 16-17)
Pau Curry attempts a 3Pt. Contested by Dejounte Sexton (5.1 feet, ZONE). Pau Curry misses. Offensive rebound by Yao Brogdon! Yao Brogdon kicks it out.

[04:27] Team_066 possession (Score: 16-17)
Kyle Wagner drives to the basket... Kyle Wagner loses control! Ball rolls out of bounds! TURNOVER! (dead ball)

[04:15] Team_048 possession (Score: 16-17)
Karl Johnson attempts a 3Pt. Wide open! Pau Curry is 10.0 feet away. [MAN] Karl Johnson misses. Rebound secured by Brandon Reaves.

[03:59] Team_066 possession (Score: 16-17)
Pau Curry attempts a 3Pt. Contested by Dejounte Sexton (5.6 feet, ZONE). Pau Curry misses. Rebound secured by Kevin Fox.

[03:45] Team_048 possession (Score: 16-17)
Karl Johnson attempts a Midrange. Wide open! Pau Curry is 8.4 feet away. [MAN] KARL JOHNSON MAKES IT!
Score: 16-19

[03:33] Team_066 possession (Score: 16-19)
Pau Curry attempts a 3Pt. Contested by Dejounte Sexton (4.8 feet, ZONE). Pau Curry misses. Rebound secured by Dejounte Sexton.

[03:17] Team_048 possession (Score: 16-19)
Dejounte Sexton attempts a 3Pt. Contested by Brandon Reaves (5.1 feet, ZONE). Dejounte Sexton misses. Offensive rebound by Kevin Fox! Kevin Fox kicks it out.

[02:59] Team_048 possession (Score: 16-19)
Dejounte Sexton drives, Brandon Reaves stays with him. Dejounte Sexton attempts a Dunk. Contested by Brandon Reaves (5.0 feet, MAN). DEJOUNTE SEXTON MAKES IT!
Score: 16-21

[02:46] Team_066 possession (Score: 16-21)
Brandon Reaves attempts a 3Pt. Wide open! Dejounte Sexton is 6.4 feet away. [ZONE] Brandon Reaves misses. Rebound secured by Dejounte Sexton.

[02:35] Team_048 possession (Score: 16-21)
Damian Mobley attempts a Layup. Contested by Kyle Wagner (5.6 feet, MAN). DAMIAN MOBLEY MAKES IT!
Score: 16-23

[02:23] Team_066 possession (Score: 16-23)
Kyle Wagner attempts a Midrange. Contested by Kevin Fox (4.8 feet, MAN). KYLE WAGNER MAKES IT! Assist: Yao Brogdon
Score: 18-23

[02:08] Team_048 possession (Score: 18-23)
Karl Johnson drives, Kyle Wagner stays with him. Karl Johnson attempts a Layup. Contested by Kyle Wagner (4.8 feet, ZONE). Karl Johnson misses. Offensive rebound by Damian Mobley! Damian Mobley puts it back in!
Score: 18-25

[01:53] Team_066 possession (Score: 18-25)
Pau Curry attempts a Midrange. Contested by Karl Johnson (4.2 feet, MAN). PAU CURRY MAKES IT! Assist: Brandon Reaves
Score: 20-25

[01:36] Team_048 possession (Score: 20-25)
Kevin Fox attempts a Midrange. Wide open! Yao Brogdon is 8.4 feet away. [MAN] Kevin Fox misses. Rebound secured by Brandon Reaves.

[01:24] Team_066 possession (Score: 20-25)
Brandon Reaves attempts a Layup. Heavily contested by Dejounte Sexton (0.5 feet, MAN)! Brandon Reaves misses. Rebound secured by Damian Mobley.

[01:15] Team_048 possession (Score: 20-25)
Dejounte Sexton throws a bad pass! Stolen by Brandon Reaves! TURNOVER! (live ball)

[01:00] Team_066 possession (Score: 20-25)
Brandon Reaves drives, picks up Kevin Fox. Help arrives from Karl Johnson! Brandon Reaves attempts a Layup. Contested by Karl Johnson (5.2 feet, ZONE). Brandon Reaves misses. Rebound secured by Dejounte Sexton.

[00:48] Team_048 possession (Score: 20-25)
Damian Mobley drives, picks up Kyle Wagner. Help arrives from Jimmy Davis! Damian Mobley attempts a Dunk. Heavily contested by Jimmy Davis (1.5 feet, ZONE)! DAMIAN MOBLEY MAKES IT! Assist: Dejounte Sexton
Score: 20-27

[00:36] Team_066 possession (Score: 20-27)
Brandon Reaves attempts a Layup. Contested by Dejounte Sexton (2.1 feet, MAN). BRANDON REAVES MAKES IT!
Score: 22-27

[00:21] Team_048 possession (Score: 22-27)
Damian Mobley attempts a Midrange. Wide open! Kyle Wagner is 6.6 feet away. [MAN] DAMIAN MOBLEY MAKES IT!
Score: 22-29

[00:10] Team_066 possession (Score: 22-29)
Kyle Wagner drives and kicks out. Jimmy Davis attempts a Midrange. Heavily contested by Dejounte Sexton (1.7 feet, ZONE)! Jimmy Davis misses. Offensive rebound by Kyle Wagner! Kyle Wagner kicks it out.

================================================================================
                              1ST QUARTER COMPLETE                              
================================================================================

1ST QUARTER SCORE: Team_066 22, Team_048 29

BOX SCORE:
================================================================================

Team_066
--------------------------------------------------------------------------------
Player                MIN  PTS  REB  AST  TO      FG   FG%      3P   3P%
--------------------------------------------------------------------------------
Jimmy Davis            12   10    0    0   0   4/5    80.0     0/0   0.0
Brandon Reaves         12    4    3    2   0   2/8    25.0     0/0   0.0
Yao Brogdon            12    2    2    2   0   1/3    33.3     0/0   0.0
Pau Curry              12    2    0    0   0   1/4    25.0     0/0   0.0
Kyle Wagner            12    2    3    0   0   1/1   100.0     0/0   0.0

TEAM: FG: 9/21 (42.9%), 3PT: 0/7 (0.0%), REB: 8 (3 off, 5 def), AST: 4, TO: 2
TEAM FOULS: 1


Team_048
--------------------------------------------------------------------------------
Player                MIN  PTS  REB  AST  TO      FG   FG%      3P   3P%
--------------------------------------------------------------------------------
Damian Mobley          12   14    5    2   0   7/7   100.0     0/0   0.0
Kevin Fox              12    5    5    0   0   2/3    66.7     0/0   0.0
Dejounte Sexton        12    5    4    1   0   2/2   100.0     0/0   0.0
Karl Johnson           12    5    0    0   0   2/5    40.0     0/0   0.0
Paolo Rozier           12    0    0    4   0   0/1     0.0     0/0   0.0

TEAM: FG: 13/18 (72.2%), 3PT: 2/5 (40.0%), REB: 14 (2 off, 12 def), AST: 7, TO: 5
TEAM FOULS: 6 [Team_066 in BONUS]

================================================================================

================================================================================
                       2ND QUARTER - Team_066 vs Team_048                       
================================================================================

[12:00] Team_066 possession (Score: 22-29)
Yao Brogdon attempts a 3Pt. Wide open! Dejounte Sexton is 7.2 feet away. [ZONE] Yao Brogdon misses. Rebound secured by Damian Mobley.

[11:47] Team_048 possession (Score: 22-29)
Damian Mobley makes the Layup and draws the foul on Kyle Wagner! And-1! Damian Mobley to the line for 1. [Team fouls: 1] (Kyle Wagner: 1 personal fouls)   FT 1/1: GOOD Damian Mobley makes 1/1 from the line.
Score: 22-32

[11:31] Team_066 possession (Score: 22-32)
Jimmy Davis attempts a 3Pt. Contested by Paolo Rozier (5.0 feet, MAN). Jimmy Davis misses. Rebound secured by Dejounte Sexton.

[11:14] Team_048 possession (Score: 22-32)
Paolo Rozier attempts a 3Pt. Wide open! Pau Curry is 6.3 feet away. [ZONE] Paolo Rozier misses. Rebound secured by Brandon Reaves.

[11:02] Team_066 possession (Score: 22-32)
Brandon Reaves attempts a 3Pt. Contested by Karl Johnson (6.0 feet, ZONE). Brandon Reaves misses. Rebound secured by Damian Mobley.

[10:47] Team_048 possession (Score: 22-32)
Damian Mobley attempts a Layup. BLOCKED BY KYLE WAGNER! Ball is loose! Offensive rebound by Kevin Fox! Kevin Fox kicks it out.

[10:35] Team_048 possession (Score: 22-32)
FOUL! Holding foul on Jimmy Davis. [Team fouls: 2] No free throws, side out. (Jimmy Davis: 1 personal fouls)

[10:17] Team_048 possession (Score: 22-32)
Karl Johnson attempts a 3Pt. Wide open! Pau Curry is 7.0 feet away. [ZONE] Karl Johnson misses. Rebound secured by Brandon Reaves.

[10:04] Team_066 possession (Score: 22-32)
Jimmy Davis attempts a Midrange. Contested by Kevin Fox (2.7 feet, ZONE). Jimmy Davis misses. Rebound secured by Kevin Fox.

[09:50] Team_048 possession (Score: 22-32)
Dejounte Sexton attempts a Midrange. Wide open! Brandon Reaves is 8.8 feet away. [MAN] Dejounte Sexton misses. Rebound secured by Kyle Wagner.

[09:39] Team_066 possession (Score: 22-32)
FOUL! Reach-in foul on Karl Johnson during the drive. [Team fouls: 1] No free throws, side out. (Karl Johnson: 1 personal fouls)

[09:26] Team_066 possession (Score: 22-32)
Pau Curry attempts a 3Pt. Contested by Dejounte Sexton (3.1 feet, ZONE). Pau Curry misses. Rebound secured by Kevin Fox.

[09:11] Team_048 possession (Score: 22-32)
FOUL! Reach-in foul on Kyle Wagner during the drive. [Team fouls: 3] No free throws, side out. (Kyle Wagner: 2 personal fouls)

[08:54] Team_048 possession (Score: 22-32)
Dejounte Sexton attempts a 3Pt. Contested by Pau Curry (5.5 feet, ZONE). Dejounte Sexton misses. Rebound secured by Yao Brogdon.

[08:38] Team_066 possession (Score: 22-32)
Brandon Reaves attempts a Midrange. Heavily contested by Dejounte Sexton (1.0 feet, ZONE)! Brandon Reaves misses. Rebound secured by Kevin Fox.

[08:26] Team_048 possession (Score: 22-32)
Karl Johnson attempts a Midrange. Wide open! Pau Curry is 7.8 feet away. [MAN] Karl Johnson misses. Rebound secured by Yao Brogdon.

[08:11] Team_066 possession (Score: 22-32)
Pau Curry drives and kicks out. Kyle Wagner attempts a 3Pt. BLOCKED BY DAMIAN MOBLEY! Ball is loose! Rebound secured by Kevin Fox.

[07:58] Team_048 possession (Score: 22-32)
Dejounte Sexton attempts a 3Pt. Wide open! Pau Curry is 8.3 feet away. [ZONE] Dejounte Sexton misses. Rebound secured by Brandon Reaves.

[07:47] Team_066 possession (Score: 22-32)
FOUL! Reach-in foul on Kevin Fox during the drive. [Team fouls: 2] No free throws, side out. (Kevin Fox: 1 personal fouls)

[07:27] Team_066 possession (Score: 22-32)
Kyle Wagner attempts a Layup. Contested by Damian Mobley (4.8 feet, MAN). KYLE WAGNER MAKES IT! Assist: Brandon Reaves
Score: 24-32

[07:14] Team_048 possession (Score: 24-32)
Damian Mobley drives to the basket... Damian Mobley throws a bad pass! Stolen by Kyle Wagner! TURNOVER! (live ball)

[06:57] Team_066 possession (Score: 24-32)
Pau Curry drives and kicks out. Brandon Reaves attempts a Midrange. Contested by Dejounte Sexton (3.4 feet, MAN). BRANDON REAVES MAKES IT! Assist: Jimmy Davis
Score: 26-32

[06:42] Team_048 possession (Score: 26-32)
Damian Mobley drives and kicks out. Damian Mobley attempts a Midrange. Contested by Kyle Wagner (6.0 feet, MAN). Damian Mobley misses. Rebound secured by Kyle Wagner.

[06:31] Team_066 possession (Score: 26-32)
Jimmy Davis attempts a 3Pt. Wide open! Paolo Rozier is 7.9 feet away. [MAN] Jimmy Davis misses. Offensive rebound by Kyle Wagner! Kyle Wagner kicks it out.

[06:15] Team_066 possession (Score: 26-32)
Kyle Wagner attempts a Midrange. Contested by Karl Johnson (5.9 feet, ZONE). Kyle Wagner misses. Rebound secured by Dejounte Sexton.

[06:01] Team_048 possession (Score: 26-32)
Karl Johnson commits a violation (traveling/carry)! TURNOVER! (dead ball)

[06:01] Substitution (Team_066): Jimmy Davis OUT → Pascal Carter IN (stamina_rule2)

[06:01] Substitution (Team_066): Pau Curry OUT → Lauri LaVine IN (stamina_rule2)

[06:01] Substitution (Team_066): Brandon Reaves OUT → Brandon Middleton IN (stamina_rule2)

[06:01] Substitution (Team_066): Yao Brogdon OUT → Cole Morant IN (stamina_rule2)

[06:01] Substitution (Team_066): Kyle Wagner OUT → Donovan Simmons IN (stamina_rule2)

[06:01] Substitution (Team_048): Paolo Rozier OUT → Lauri Curry IN (stamina_rule2)

[06:01] Substitution (Team_048): Karl Johnson OUT → Yao Booker IN (stamina_rule2)

[06:01] Substitution (Team_048): Dejounte Sexton OUT → Kyle Irving IN (stamina_rule2)

[06:01] Substitution (Team_048): Kevin Fox OUT → DeMar Hyland IN (stamina_rule2)

[06:01] Substitution (Team_048): Damian Mobley OUT → Gary Giddey IN (stamina_rule2)

[05:50] Team_066 possession (Score: 26-32)
FOUL! Shooting foul on DeMar Hyland. Donovan Simmons to the line for 2 free throws. [Team fouls: 3] (DeMar Hyland: 1 personal fouls)   FT 1/2: GOOD   FT 2/2: GOOD Donovan Simmons makes 2/2 from the line.
Score: 28-32

[05:36] Team_048 possession (Score: 28-32)
DeMar Hyland attempts a Layup. Wide open! Donovan Simmons is 6.1 feet away. [ZONE] DEMAR HYLAND MAKES IT! Assist: Yao Booker
Score: 28-34

[05:20] Team_066 possession (Score: 28-34)
Lauri LaVine throws a bad pass out of bounds! TURNOVER! (dead ball)

[05:07] Team_048 possession (Score: 28-34)
Kyle Irving attempts a Midrange. Wide open! Brandon Middleton is 7.7 feet away. [MAN] KYLE IRVING MAKES IT! Assist: DeMar Hyland
Score: 28-36

[04:50] Team_066 possession (Score: 28-36)
Lauri LaVine throws a bad pass out of bounds! TURNOVER! (dead ball)

[04:39] Team_048 possession (Score: 28-36)
Lauri Curry attempts a 3Pt. Contested by Lauri LaVine (3.5 feet, ZONE). LAURI CURRY MAKES IT! Assist: DeMar Hyland
Score: 28-39

[04:27] Team_066 possession (Score: 28-39)
FOUL! Shooting foul on Yao Booker. Donovan Simmons to the line for 2 free throws. [Team fouls: 4] (Yao Booker: 1 personal fouls)   FT 1/2: GOOD   FT 2/2: GOOD Donovan Simmons makes 2/2 from the line.
Score: 30-39

[04:13] Team_048 possession (Score: 30-39)
FOUL! Holding foul on Lauri LaVine. [Team fouls: 4] No free throws, side out. (Lauri LaVine: 1 personal fouls)

[03:57] Team_048 possession (Score: 30-39)
Gary Giddey drives, Donovan Simmons stays with him. Gary Giddey attempts a Layup. Contested by Donovan Simmons (5.6 feet, ZONE). GARY GIDDEY MAKES IT! Assist: DeMar Hyland
Score: 30-41

[03:40] Team_066 possession (Score: 30-41)
Cole Morant attempts a Midrange. Contested by DeMar Hyland (3.6 feet, MAN). Cole Morant misses. Rebound secured by Gary Giddey.

[03:27] Team_048 possession (Score: 30-41)
Gary Giddey drives, Donovan Simmons stays with him. Gary Giddey attempts a Layup. Wide open! Donovan Simmons is 6.4 feet away. [MAN] Gary Giddey misses. Rebound secured by Brandon Middleton.

[03:09] Team_066 possession (Score: 30-41)
Cole Morant throws a bad pass! Stolen by DeMar Hyland! TURNOVER! (live ball)

[02:51] Team_048 possession (Score: 30-41)
Gary Giddey attempts a Layup. Contested by Donovan Simmons (4.1 feet, ZONE). Gary Giddey misses. Offensive rebound by Kyle Irving! Kyle Irving's putback is no good. Rebound secured by Donovan Simmons.

[02:36] Team_066 possession (Score: 30-41)
FOUL! Reach-in foul on DeMar Hyland during the drive. [IN THE BONUS! 5 team fouls] Donovan Simmons to the line for 2 free throws. (DeMar Hyland: 2 personal fouls)   FT 1/2: GOOD   FT 2/2: GOOD Donovan Simmons makes 2/2 from the line.
Score: 32-41

[02:19] Team_048 possession (Score: 32-41)
DeMar Hyland attempts a Midrange. Wide open! Brandon Middleton is 6.8 feet away. [ZONE] DeMar Hyland misses. Offensive rebound by Kyle Irving! Kyle Irving's putback is no good. Offensive rebound by DeMar Hyland! DeMar Hyland kicks it out.

[02:04] Team_048 possession (Score: 32-41)
Yao Booker throws a bad pass out of bounds! TURNOVER! (dead ball)

[01:51] Team_066 possession (Score: 32-41)
Brandon Middleton attempts a Midrange. Wide open! Yao Booker is 6.2 feet away. [ZONE] BRANDON MIDDLETON MAKES IT!
Score: 34-41

[01:38] Team_048 possession (Score: 34-41)
Yao Booker makes the Dunk and draws the foul on Donovan Simmons! And-1! Yao Booker to the line for 1. [BONUS: 5 team fouls] (Donovan Simmons: 1 personal fouls)   FT 1/1: GOOD Yao Booker makes 1/1 from the line.
Score: 34-44

[01:21] Team_066 possession (Score: 34-44)
FOUL! Shooting foul on Kyle Irving. Donovan Simmons to the line for 2 free throws. [BONUS: 6 team fouls] (Kyle Irving: 1 personal fouls)   FT 1/2: GOOD   FT 2/2: MISS Donovan Simmons makes 1/2 from the line. Offensive rebound by Donovan Simmons! Donovan Simmons kicks it out.
Score: 35-44

[01:07] Team_066 possession (Score: 35-44)
Cole Morant attempts a 3Pt. Wide open! DeMar Hyland is 6.6 feet away. [MAN] COLE MORANT MAKES IT! Assist: Donovan Simmons
Score: 38-44

[00:52] Team_048 possession (Score: 38-44)
Kyle Irving attempts a 3Pt. Contested by Lauri LaVine (4.4 feet, ZONE). Kyle Irving misses. Rebound secured by Lauri LaVine.

[00:40] Team_066 possession (Score: 38-44)
Brandon Middleton attempts a Midrange. Wide open! Kyle Irving is 7.3 feet away. [MAN] BRANDON MIDDLETON MAKES IT!
Score: 40-44

[00:30] Team_048 possession (Score: 40-44)
Kyle Irving attempts a 3Pt. Contested by Brandon Middleton (5.3 feet, MAN). Kyle Irving misses. Rebound secured by Donovan Simmons.

[00:21] Team_066 possession (Score: 40-44)
Pascal Carter throws a bad pass out of bounds! TURNOVER! (dead ball)

[00:03] Team_048 possession (Score: 40-44)
Kyle Irving attempts a 3Pt. Heavily contested by Brandon Middleton (1.4 feet, MAN)! Kyle Irving misses. Rebound secured by Brandon Middleton.

================================================================================
                              2ND QUARTER COMPLETE                              
================================================================================

2ND QUARTER SCORE: Team_066 18, Team_048 15

BOX SCORE:
================================================================================

Team_066
--------------------------------------------------------------------------------
Player                MIN  PTS  REB  AST  TO      FG   FG%      3P   3P%
--------------------------------------------------------------------------------
Donovan Simmons         6    6    3    1   0   3/3   100.0     0/0   0.0
Brandon Middleton       6    4    2    0   0   2/2   100.0     0/0   0.0
Cole Morant             6    3    0    0   0   1/2    50.0     0/0   0.0
Brandon Reaves         18    2    3    1   0   1/3    33.3     0/0   0.0
Kyle Wagner            18    2    3    0   0   1/2    50.0     0/0   0.0
Yao Brogdon            18    0    2    0   0   0/1     0.0     0/0   0.0
Jimmy Davis            18    0    0    1   0   0/2     0.0     0/0   0.0
Pau Curry              18    0    0    0   0   0/2     0.0     0/0   0.0
Lauri LaVine            6    0    1    0   0   0/0     0.0     0/0   0.0

TEAM: FG: 8/17 (47.1%), 3PT: 1/5 (20.0%), REB: 13 (2 off, 11 def), AST: 3, TO: 4
TEAM FOULS: 5 [Team_048 in BONUS]


Team_048
--------------------------------------------------------------------------------
Player                MIN  PTS  REB  AST  TO      FG   FG%      3P   3P%
--------------------------------------------------------------------------------
Damian Mobley          18    3    2    0   0   1/2    50.0     0/0   0.0
Yao Booker              6    3    0    1   0   1/1   100.0     0/0   0.0
Lauri Curry             6    3    0    0   0   1/1   100.0     0/0   0.0
DeMar Hyland            6    2    1    3   0   1/1   100.0     0/0   0.0
Kyle Irving             6    2    0    0   0   1/4    25.0     0/0   0.0
Gary Giddey             6    2    1    0   0   1/3    33.3     0/0   0.0
Dejounte Sexton        18    0    2    0   0   0/3     0.0     0/0   0.0
Paolo Rozier           18    0    0    0   0   0/1     0.0     0/0   0.0
Kevin Fox              18    0    5    0   0   0/0     0.0     0/0   0.0
Karl Johnson           18    0    0    0   0   0/2     0.0     0/0   0.0

TEAM: FG: 6/18 (33.3%), 3PT: 1/8 (12.5%), REB: 12 (3 off, 9 def), AST: 4, TO: 3
TEAM FOULS: 6 [Team_066 in BONUS]

================================================================================

================================================================================
                       3RD QUARTER - Team_066 vs Team_048                       
================================================================================

[12:00] Team_066 possession (Score: 40-44)
Brandon Reaves attempts a 3Pt. Contested by Dejounte Sexton (3.7 feet, ZONE). Brandon Reaves misses. Rebound secured by Dejounte Sexton.

[11:43] Team_048 possession (Score: 40-44)
Karl Johnson attempts a Layup. Contested by Kyle Wagner (4.0 feet, ZONE). KARL JOHNSON MAKES IT! Assist: Paolo Rozier
Score: 40-46

[11:29] Team_066 possession (Score: 40-46)
Kyle Wagner attempts a Midrange. Contested by Kevin Fox (2.9 feet, MAN). Kyle Wagner misses. Rebound secured by Kevin Fox.

[11:17] Team_048 possession (Score: 40-46)
Paolo Rozier attempts a Midrange. Contested by Jimmy Davis (3.7 feet, MAN). PAOLO ROZIER MAKES IT! Assist: Damian Mobley
Score: 40-48

[11:00] Team_066 possession (Score: 40-48)
Yao Brogdon drives to the basket... FOUL! Offensive foul on Yao Brogdon! Kevin Fox drew the charge! [Team fouls: 1] (Yao Brogdon: 1 personal fouls) TURNOVER! (dead ball)

[10:46] Team_048 possession (Score: 40-48)
FOUL! Shooting foul on Jimmy Davis. Paolo Rozier to the line for 2 free throws. [Team fouls: 2] (Jimmy Davis: 1 personal fouls)   FT 1/2: GOOD   FT 2/2: GOOD Paolo Rozier makes 2/2 from the line.
Score: 40-50

[10:29] Team_066 possession (Score: 40-50)
Brandon Reaves attempts a 3Pt. Contested by Dejounte Sexton (3.5 feet, ZONE). Brandon Reaves misses. Rebound secured by Kevin Fox.

[10:14] Team_048 possession (Score: 40-50)
Dejounte Sexton drives, Brandon Reaves stays with him. Dejounte Sexton attempts a Dunk. Contested by Brandon Reaves (5.9 feet, MAN). DEJOUNTE SEXTON MAKES IT! Assist: Paolo Rozier
Score: 40-52

[10:04] Team_066 possession (Score: 40-52)
Yao Brogdon commits a violation (traveling/carry)! TURNOVER! (dead ball)

[09:47] Team_048 possession (Score: 40-52)
Karl Johnson attempts a 3Pt. Contested by Pau Curry (5.2 feet, MAN). Karl Johnson misses. Offensive rebound by Kevin Fox! Kevin Fox kicks it out.

[09:32] Team_048 possession (Score: 40-52)
Paolo Rozier attempts a 3Pt. Contested by Jimmy Davis (4.9 feet, MAN). Paolo Rozier misses. FOUL! Loose ball foul on Brandon Reaves during the rebound battle. [Team fouls: 3] No free throws, side out. (Brandon Reaves: 1 personal fouls)

[09:18] Team_048 possession (Score: 40-52)
Paolo Rozier makes the Layup and draws the foul on Jimmy Davis! And-1! Paolo Rozier to the line for 1. [Team fouls: 4] (Jimmy Davis: 2 personal fouls)   FT 1/1: MISS Paolo Rozier makes 0/1 from the line. Rebound secured by Brandon Reaves.
Score: 40-54

[09:02] Team_066 possession (Score: 40-54)
Yao Brogdon drives, Damian Mobley stays with him. Yao Brogdon attempts a Dunk. Heavily contested by Damian Mobley (0.5 feet, ZONE)! YAO BROGDON MAKES IT! Assist: Jimmy Davis
Score: 42-54

[08:49] Team_048 possession (Score: 42-54)
FOUL! Holding foul on Jimmy Davis. [IN THE BONUS! 5 team fouls] Paolo Rozier to the line for 2 free throws. (Jimmy Davis: 3 personal fouls)   FT 1/2: GOOD   FT 2/2: MISS Paolo Rozier makes 1/2 from the line. Rebound secured by Yao Brogdon.
Score: 42-55

[08:35] Team_066 possession (Score: 42-55)
FOUL! Shooting foul on Karl Johnson. Kyle Wagner to the line for 2 free throws. [Team fouls: 1] (Karl Johnson: 1 personal fouls)   FT 1/2: GOOD   FT 2/2: GOOD Kyle Wagner makes 2/2 from the line.
Score: 44-55

[08:20] Team_048 possession (Score: 44-55)
Dejounte Sexton loses the ball! Stripped by Brandon Reaves! TURNOVER! (live ball)

[08:06] Team_066 possession (Score: 44-55)
Kyle Wagner attempts a 3Pt. Wide open! Kevin Fox is 7.0 feet away. [MAN] Kyle Wagner misses. Rebound secured by Damian Mobley.

[07:55] Team_048 possession (Score: 44-55)
Dejounte Sexton attempts a Midrange. Contested by Pau Curry (2.6 feet, ZONE). Dejounte Sexton misses. Offensive rebound by Damian Mobley! Damian Mobley's putback is no good. Rebound secured by Brandon Reaves.

[07:43] Team_066 possession (Score: 44-55)
Jimmy Davis drives, picks up Paolo Rozier. Help arrives from Dejounte Sexton! Jimmy Davis attempts a Layup. Contested by Dejounte Sexton (3.9 feet, MAN). Jimmy Davis misses. Rebound secured by Damian Mobley.

[07:27] Team_048 possession (Score: 44-55)
Dejounte Sexton makes the Layup and draws the foul on Brandon Reaves! And-1! Dejounte Sexton to the line for 1. [BONUS: 6 team fouls] (Brandon Reaves: 2 personal fouls)   FT 1/1: MISS Dejounte Sexton makes 0/1 from the line. Offensive rebound by Kevin Fox! Kevin Fox kicks it out.
Score: 44-57

[07:12] Team_048 possession (Score: 44-57)
Dejounte Sexton makes the Layup and draws the foul on Kyle Wagner! And-1! Dejounte Sexton to the line for 1. [BONUS: 7 team fouls] (Kyle Wagner: 1 personal fouls)   FT 1/1: GOOD Dejounte Sexton makes 1/1 from the line.
Score: 44-60

[06:58] Team_066 possession (Score: 44-60)
Pau Curry drives to the basket... Pau Curry throws a bad pass out of bounds! TURNOVER! (dead ball)

[06:39] Team_048 possession (Score: 44-60)
Kevin Fox throws a bad pass! Stolen by Yao Brogdon! TURNOVER! (live ball)

[06:26] Team_066 possession (Score: 44-60)
Brandon Reaves attempts a Midrange. Contested by Dejounte Sexton (3.0 feet, MAN). BRANDON REAVES MAKES IT!
Score: 46-60

[06:09] Team_048 possession (Score: 46-60)
Kevin Fox attempts a Layup. Contested by Yao Brogdon (5.5 feet, MAN). KEVIN FOX MAKES IT!
Score: 46-62

[05:57] Team_066 possession (Score: 46-62)
Yao Brogdon attempts a Layup. BLOCKED BY KEVIN FOX! Ball is loose! Rebound secured by Kevin Fox.

[05:41] Team_048 possession (Score: 46-62)
Dejounte Sexton attempts a 3Pt. Wide open! Brandon Reaves is 7.6 feet away. [MAN] Dejounte Sexton misses. Offensive rebound by Damian Mobley! Damian Mobley's putback is no good. Rebound secured by Kyle Wagner.

[05:27] Team_066 possession (Score: 46-62)
FOUL! Shooting foul on Karl Johnson. Brandon Reaves to the line for 2 free throws. [Team fouls: 2] (Karl Johnson: 2 personal fouls)   FT 1/2: GOOD   FT 2/2: GOOD Brandon Reaves makes 2/2 from the line.
Score: 48-62

[05:13] Team_048 possession (Score: 48-62)
Paolo Rozier drives, picks up Kyle Wagner. Help arrives from Jimmy Davis! Paolo Rozier attempts a Layup. Contested by Jimmy Davis (3.5 feet, ZONE). Paolo Rozier misses. FOUL! Loose ball foul on Brandon Reaves during the rebound battle. [IN THE BONUS! 8 team fouls] Kevin Fox to the line for 2 free throws. (Brandon Reaves: 3 personal fouls)   FT 1/2: GOOD   FT 2/2: GOOD Kevin Fox makes 2/2 from the line.
Score: 48-64

[04:54] Team_066 possession (Score: 48-64)
Yao Brogdon attempts a 3Pt. Contested by Kevin Fox (3.2 feet, MAN). Yao Brogdon misses. Rebound secured by Kevin Fox.

[04:38] Team_048 possession (Score: 48-64)
Dejounte Sexton attempts a 3Pt. Wide open! Pau Curry is 9.5 feet away. [ZONE] DEJOUNTE SEXTON MAKES IT! Assist: Paolo Rozier
Score: 48-67

[04:25] Team_066 possession (Score: 48-67)
Yao Brogdon attempts a Midrange. Contested by Kevin Fox (4.6 feet, MAN). Yao Brogdon misses. Rebound secured by Dejounte Sexton.

[04:10] Team_048 possession (Score: 48-67)
Karl Johnson makes the 3Pt and draws the foul on Pau Curry! And-1! Karl Johnson to the line for 1. [BONUS: 9 team fouls] (Pau Curry: 1 personal fouls)   FT 1/1: GOOD Karl Johnson makes 1/1 from the line.
Score: 48-71

[03:58] Team_066 possession (Score: 48-71)
Brandon Reaves attempts a 3Pt. Contested by Dejounte Sexton (2.4 feet, MAN). BRANDON REAVES MAKES IT! Assist: Jimmy Davis
Score: 51-71

[03:44] Team_048 possession (Score: 51-71)
Damian Mobley makes the Layup and draws the foul on Kyle Wagner! And-1! Damian Mobley to the line for 1. [BONUS: 10 team fouls] (Kyle Wagner: 2 personal fouls)   FT 1/1: GOOD Damian Mobley makes 1/1 from the line.
Score: 51-74

[03:30] Team_066 possession (Score: 51-74)
Brandon Reaves attempts a 3Pt. Contested by Dejounte Sexton (3.5 feet, ZONE). BRANDON REAVES MAKES IT! Assist: Kyle Wagner
Score: 54-74

[03:20] Team_048 possession (Score: 54-74)
Dejounte Sexton attempts a 3Pt. Contested by Pau Curry (3.8 feet, ZONE). DEJOUNTE SEXTON MAKES IT! Assist: Karl Johnson
Score: 54-77

[03:06] Team_066 possession (Score: 54-77)
Jimmy Davis attempts a 3Pt. Contested by Dejounte Sexton (4.7 feet, ZONE). Jimmy Davis misses. Rebound secured by Dejounte Sexton.

[02:54] Team_048 possession (Score: 54-77)
Kevin Fox attempts a 3Pt. Contested by Yao Brogdon (3.2 feet, MAN). Kevin Fox misses. Offensive rebound by Damian Mobley! Damian Mobley's putback is no good. Rebound secured by Yao Brogdon.

[02:38] Team_066 possession (Score: 54-77)
Yao Brogdon drives and kicks out. Pau Curry attempts a Midrange. Contested by Kevin Fox (4.1 feet, ZONE). PAU CURRY MAKES IT!
Score: 56-77

[02:23] Team_048 possession (Score: 56-77)
Paolo Rozier attempts a Layup. Contested by Jimmy Davis (4.4 feet, MAN). PAOLO ROZIER MAKES IT! Assist: Kevin Fox
Score: 56-79

[02:07] Team_066 possession (Score: 56-79)
Pau Curry attempts a 3Pt. Heavily contested by Dejounte Sexton (0.5 feet, ZONE)! Pau Curry misses. Rebound secured by Dejounte Sexton.

[01:51] Team_048 possession (Score: 56-79)
Kevin Fox attempts a Midrange. Contested by Yao Brogdon (5.4 feet, MAN). Kevin Fox misses. Rebound secured by Brandon Reaves.

[01:34] Team_066 possession (Score: 56-79)
Yao Brogdon drives to the basket... Yao Brogdon loses the ball! Stripped by Kevin Fox! TURNOVER! (live ball)

[01:15] Team_048 possession (Score: 56-79)
Damian Mobley attempts a Layup. Wide open! Kyle Wagner is 6.2 feet away. [MAN] DAMIAN MOBLEY MAKES IT! Assist: Karl Johnson
Score: 56-81

[00:57] Team_066 possession (Score: 56-81)
Brandon Reaves attempts a 3Pt. Contested by Dejounte Sexton (2.7 feet, ZONE). BRANDON REAVES MAKES IT! Assist: Pau Curry
Score: 59-81

[00:44] Team_048 possession (Score: 59-81)
Dejounte Sexton attempts a Midrange. Wide open! Pau Curry is 7.3 feet away. [ZONE] Dejounte Sexton misses. Offensive rebound by Kevin Fox! Kevin Fox kicks it out.

[00:28] Team_048 possession (Score: 59-81)
FOUL! Offensive foul on Dejounte Sexton! Brandon Reaves drew the charge! [Team fouls: 3] (Dejounte Sexton: 1 personal fouls) TURNOVER! (dead ball)

[00:11] Team_066 possession (Score: 59-81)
Kyle Wagner attempts a Midrange. Contested by Damian Mobley (4.1 feet, ZONE). KYLE WAGNER MAKES IT! Assist: Pau Curry
Score: 61-81

================================================================================
                              3RD QUARTER COMPLETE                              
================================================================================

3RD QUARTER SCORE: Team_066 21, Team_048 37

BOX SCORE:
================================================================================

Team_066
--------------------------------------------------------------------------------
Player                MIN  PTS  REB  AST  TO      FG   FG%      3P   3P%
--------------------------------------------------------------------------------
Brandon Reaves         30   13    3    0   0   5/7    71.4     0/0   0.0
Kyle Wagner            30    4    1    1   0   2/4    50.0     0/0   0.0
Pau Curry              30    2    0    2   0   1/2    50.0     0/0   0.0
Jimmy Davis            30    0    0    2   0   0/2     0.0     0/0   0.0

TEAM: FG: 9/19 (47.4%), 3PT: 3/9 (33.3%), REB: 3 (0 off, 3 def), AST: 5, TO: 4
TEAM FOULS: 10 [Team_048 in BONUS]


Team_048
--------------------------------------------------------------------------------
Player                MIN  PTS  REB  AST  TO      FG   FG%      3P   3P%
--------------------------------------------------------------------------------
Dejounte Sexton        30   11    4    0   0   4/6    66.7     0/0   0.0
Karl Johnson           30    6    0    2   0   2/2   100.0     0/0   0.0
Paolo Rozier           30    6    0    3   0   3/4    75.0     0/0   0.0
Damian Mobley          30    5    3    1   0   2/2   100.0     0/0   0.0
Kevin Fox              30    4    7    1   0   2/4    50.0     0/0   0.0
Yao Brogdon            30    2    2    0   0   1/4    25.0     0/0   0.0

TEAM: FG: 13/19 (68.4%), 3PT: 3/5 (60.0%), REB: 17 (7 off, 10 def), AST: 7, TO: 3
TEAM FOULS: 3

================================================================================

================================================================================
                       4TH QUARTER - Team_066 vs Team_048                       
================================================================================

[12:00] Substitution (Team_066): Jimmy Davis OUT (stamina: 68) → Pascal Carter IN (comeback_detected)

[12:00] Substitution (Team_048): Paolo Rozier OUT (stamina: 69) → Lauri Curry IN (comeback_detected)

[12:00] Team_066 possession (Score: 61-81)
Brandon Reaves attempts a Midrange. Contested by Dejounte Sexton (3.9 feet, MAN). BRANDON REAVES MAKES IT!
Score: 63-81

[11:45] Team_048 possession (Score: 63-81)
Karl Johnson attempts a 3Pt. Wide open! Pau Curry is 8.8 feet away. [MAN] KARL JOHNSON MAKES IT! Assist: Dejounte Sexton
Score: 63-84

[11:34] Team_066 possession (Score: 63-84)
Yao Brogdon attempts a 3Pt. Heavily contested by Kevin Fox (0.7 feet, MAN)! Yao Brogdon misses. Rebound secured by Kevin Fox.

[11:22] Team_048 possession (Score: 63-84)
Kevin Fox throws a bad pass out of bounds! TURNOVER! (dead ball)

[11:22] Substitution (Team_066): Pau Curry OUT → Lauri LaVine IN (stamina_rule2)

[11:22] Substitution (Team_066): Brandon Reaves OUT → Brandon Middleton IN (stamina_rule2)

[11:22] Substitution (Team_066): Yao Brogdon OUT → Cole Morant IN (stamina_rule2)

[11:22] Substitution (Team_066): Kyle Wagner OUT → Donovan Simmons IN (stamina_rule2)

[11:22] Substitution (Team_048): Karl Johnson OUT → Yao Booker IN (stamina_rule2)

[11:22] Substitution (Team_048): Dejounte Sexton OUT → Kyle Irving IN (stamina_rule2)

[11:22] Substitution (Team_048): Kevin Fox OUT → DeMar Hyland IN (stamina_rule2)

[11:22] Substitution (Team_048): Damian Mobley OUT → Gary Giddey IN (stamina_rule2)

[11:05] Team_066 possession (Score: 63-84)
Cole Morant drives, DeMar Hyland stays with him. Cole Morant attempts a Dunk. Contested by DeMar Hyland (2.6 feet, MAN). Cole Morant misses. Rebound secured by DeMar Hyland.

[10:53] Team_048 possession (Score: 63-84)
Kyle Irving attempts a Layup. BLOCKED BY LAURI LAVINE! Ball goes out off Lauri LaVine. Kyle Irving's ball!

[10:36] Team_048 possession (Score: 63-84)
Yao Booker attempts a Midrange. Wide open! Lauri LaVine is 7.5 feet away. [ZONE] YAO BOOKER MAKES IT! Assist: Gary Giddey
Score: 63-86

[10:23] Team_066 possession (Score: 63-86)
Pascal Carter drives to the basket... FOUL! Offensive foul on Pascal Carter! Lauri Curry drew the charge! [Team fouls: 1] (Pascal Carter: 1 personal fouls) TURNOVER! (dead ball)

[10:08] Team_048 possession (Score: 63-86)
Yao Booker attempts a Layup. Contested by Donovan Simmons (4.9 feet, ZONE). YAO BOOKER MAKES IT!
Score: 63-88

[09:51] Team_066 possession (Score: 63-88)
Pascal Carter attempts a 3Pt. Contested by Lauri Curry (2.3 feet, MAN). Pascal Carter misses. Rebound secured by Gary Giddey.

[09:41] Team_048 possession (Score: 63-88)
DeMar Hyland attempts a Layup. Contested by Donovan Simmons (4.8 feet, ZONE). DEMAR HYLAND MAKES IT! Assist: Kyle Irving
Score: 63-90

[09:26] Team_066 possession (Score: 63-90)
FOUL! Shooting foul on Kyle Irving. Cole Morant to the line for 2 free throws. [Team fouls: 1] (Kyle Irving: 1 personal fouls)   FT 1/2: GOOD   FT 2/2: GOOD Cole Morant makes 2/2 from the line.
Score: 65-90

[09:12] Team_048 possession (Score: 65-90)
Gary Giddey attempts a Midrange. Contested by Donovan Simmons (3.0 feet, MAN). Gary Giddey misses. Rebound secured by Brandon Middleton.

[09:02] Team_066 possession (Score: 65-90)
Brandon Middleton makes the Dunk and draws the foul on Lauri Curry! And-1! Brandon Middleton to the line for 1. [Team fouls: 2] (Lauri Curry: 1 personal fouls)   FT 1/1: GOOD Brandon Middleton makes 1/1 from the line.
Score: 68-90

[08:48] Team_048 possession (Score: 68-90)
Kyle Irving attempts a 3Pt. Contested by Brandon Middleton (4.5 feet, MAN). Kyle Irving misses. Rebound secured by Lauri LaVine.

[08:32] Team_066 possession (Score: 68-90)
Pascal Carter drives, picks up DeMar Hyland. Help arrives from Lauri Curry! Pascal Carter attempts a Dunk. Heavily contested by Lauri Curry (1.0 feet, ZONE)! PASCAL CARTER MAKES IT! Assist: Brandon Middleton
Score: 70-90

[08:15] Team_048 possession (Score: 70-90)
Kyle Irving makes the Dunk and draws the foul on Lauri LaVine! And-1! Kyle Irving to the line for 1. [Team fouls: 2] (Lauri LaVine: 1 personal fouls)   FT 1/1: GOOD Kyle Irving makes 1/1 from the line.
Score: 70-93

[07:59] Team_066 possession (Score: 70-93)
Pascal Carter attempts a 3Pt. Wide open! Lauri Curry is 7.5 feet away. [MAN] PASCAL CARTER MAKES IT!
Score: 73-93

[07:43] Team_048 possession (Score: 73-93)
Yao Booker attempts a 3Pt. Contested by Lauri LaVine (3.7 feet, ZONE). Yao Booker misses. Rebound secured by Donovan Simmons.

[07:28] Team_066 possession (Score: 73-93)
FOUL! Shooting foul on DeMar Hyland. Cole Morant to the line for 2 free throws. [Team fouls: 3] (DeMar Hyland: 1 personal fouls)   FT 1/2: GOOD   FT 2/2: GOOD Cole Morant makes 2/2 from the line.
Score: 75-93

[07:16] Team_048 possession (Score: 75-93)
Lauri Curry attempts a Midrange. Contested by Cole Morant (2.3 feet, ZONE). LAURI CURRY MAKES IT!
Score: 75-95

[07:02] Team_066 possession (Score: 75-95)
Brandon Middleton attempts a Midrange. Contested by Kyle Irving (5.3 feet, MAN). Brandon Middleton misses. Rebound secured by Gary Giddey.

[06:47] Team_048 possession (Score: 75-95)
FOUL! Holding foul on Cole Morant. [Team fouls: 3] No free throws, side out. (Cole Morant: 1 personal fouls)

[06:29] Team_048 possession (Score: 75-95)
Gary Giddey drives, Donovan Simmons stays with him. Gary Giddey attempts a Dunk. Contested by Donovan Simmons (5.3 feet, ZONE). GARY GIDDEY MAKES IT!
Score: 75-97

[06:15] Team_066 possession (Score: 75-97)
Donovan Simmons drives to the basket... Donovan Simmons throws a bad pass! Stolen by DeMar Hyland! TURNOVER! (live ball)

[06:03] Team_048 possession (Score: 75-97)
Gary Giddey attempts a 3Pt. Contested by Lauri LaVine (5.9 feet, ZONE). Gary Giddey misses. FOUL! Loose ball foul on Brandon Middleton during the rebound battle. [Team fouls: 4] No free throws, side out. (Brandon Middleton: 1 personal fouls)

[05:50] Team_048 possession (Score: 75-97)
Gary Giddey attempts a Midrange. Contested by Lauri LaVine (4.5 feet, ZONE). Gary Giddey misses. Offensive rebound by Kyle Irving! Kyle Irving's putback is no good. Rebound secured by Lauri LaVine.

[05:36] Team_066 possession (Score: 75-97)
Pascal Carter attempts a Layup. Contested by Lauri Curry (3.2 feet, MAN). PASCAL CARTER MAKES IT!
Score: 77-97

[05:22] Team_048 possession (Score: 77-97)
Kyle Irving attempts a 3Pt. Wide open! Brandon Middleton is 8.6 feet away. [MAN] Kyle Irving misses. Rebound secured by Brandon Middleton.

[05:07] Team_066 possession (Score: 77-97)
Brandon Middleton attempts a Midrange. Contested by DeMar Hyland (4.4 feet, ZONE). BRANDON MIDDLETON MAKES IT!
Score: 79-97

[04:57] Team_048 possession (Score: 79-97)
Lauri Curry attempts a 3Pt. Wide open! Lauri LaVine is 7.2 feet away. [ZONE] Lauri Curry misses. Offensive rebound by Kyle Irving! Kyle Irving puts it back in!
Score: 79-99

[04:41] Team_066 possession (Score: 79-99)
Brandon Middleton attempts a 3Pt. Wide open! Kyle Irving is 8.9 feet away. [MAN] BRANDON MIDDLETON MAKES IT! Assist: Cole Morant
Score: 82-99

[04:28] Team_048 possession (Score: 82-99)
Gary Giddey loses control! Ball rolls out of bounds! TURNOVER! (dead ball)

[04:16] Team_066 possession (Score: 82-99)
Lauri LaVine makes the Layup and draws the foul on Yao Booker! And-1! Lauri LaVine to the line for 1. [Team fouls: 4] (Yao Booker: 1 personal fouls)   FT 1/1: GOOD Lauri LaVine makes 1/1 from the line.
Score: 85-99

[03:59] Team_048 possession (Score: 85-99)
Yao Booker attempts a Layup. Wide open! Cole Morant is 7.5 feet away. [ZONE] YAO BOOKER MAKES IT! Assist: DeMar Hyland
Score: 85-101

[03:44] Team_066 possession (Score: 85-101)
Donovan Simmons attempts a Midrange. Heavily contested by DeMar Hyland (1.4 feet, ZONE)! Donovan Simmons misses. FOUL! Loose ball foul on Kyle Irving during the rebound battle. [IN THE BONUS! 5 team fouls] Lauri LaVine to the line for 2 free throws. (Kyle Irving: 2 personal fouls)   FT 1/2: MISS   FT 2/2: GOOD Lauri LaVine makes 1/2 from the line.
Score: 86-101

[03:31] Team_048 possession (Score: 86-101)
Gary Giddey drives to the basket... FOUL! Offensive foul on Gary Giddey! Donovan Simmons drew the charge! [Team fouls: 6] (Gary Giddey: 1 personal fouls) TURNOVER! (dead ball)

[03:17] Team_066 possession (Score: 86-101)
Lauri LaVine attempts a 3Pt. Contested by Yao Booker (3.7 feet, MAN). Lauri LaVine misses. Rebound secured by DeMar Hyland.

[03:02] Team_048 possession (Score: 86-101)
Yao Booker attempts a 3Pt. Heavily contested by Lauri LaVine (1.1 feet, ZONE)! Yao Booker misses. Offensive rebound by Kyle Irving! Kyle Irving kicks it out.

[02:47] Team_048 possession (Score: 86-101)
Yao Booker attempts a 3Pt. Contested by Lauri LaVine (3.0 feet, ZONE). YAO BOOKER MAKES IT! Assist: DeMar Hyland
Score: 86-104

[02:30] Team_066 possession (Score: 86-104)
Lauri LaVine attempts a Layup. Contested by DeMar Hyland (3.4 feet, ZONE). LAURI LAVINE MAKES IT!
Score: 88-104

[02:14] Team_048 possession (Score: 88-104)
Lauri Curry attempts a 3Pt. Wide open! Pascal Carter is 9.3 feet away. [MAN] Lauri Curry misses. Rebound secured by Lauri LaVine.

[02:03] Team_066 possession (Score: 88-104)
Cole Morant drives, Gary Giddey stays with him. Cole Morant attempts a Layup. Wide open! Gary Giddey is 7.9 feet away. [ZONE] Cole Morant misses. Rebound secured by Gary Giddey.

[01:51] Team_048 possession (Score: 88-104)
Yao Booker attempts a Midrange. Contested by Lauri LaVine (4.6 feet, ZONE). YAO BOOKER MAKES IT!
Score: 88-106

[01:38] Team_066 possession (Score: 88-106)
Cole Morant attempts a Layup. BLOCKED BY DEMAR HYLAND! Ball is loose! Rebound secured by DeMar Hyland.

[01:22] Team_048 possession (Score: 88-106)
DeMar Hyland attempts a Midrange. Contested by Cole Morant (4.3 feet, MAN). DeMar Hyland misses. Rebound secured by Donovan Simmons.

[01:10] Team_066 possession (Score: 88-106)
FOUL! Offensive foul on Brandon Middleton! Kyle Irving drew the charge! [Team fouls: 5] (Brandon Middleton: 2 personal fouls) TURNOVER! (dead ball)

[00:56] Team_048 possession (Score: 88-106)
DeMar Hyland drives and kicks out. Yao Booker attempts a 3Pt. Contested by Brandon Middleton (2.3 feet, ZONE). Yao Booker misses. Offensive rebound by DeMar Hyland! DeMar Hyland kicks it out.

[00:43] Team_048 possession (Score: 88-106)
Gary Giddey attempts a 3Pt. Wide open! Lauri LaVine is 6.8 feet away. [ZONE] GARY GIDDEY MAKES IT! Assist: Yao Booker
Score: 88-109

[00:32] Team_066 possession (Score: 88-109)
FOUL! Shooting foul on DeMar Hyland. Brandon Middleton to the line for 2 free throws. [BONUS: 7 team fouls] (DeMar Hyland: 2 personal fouls)   FT 1/2: MISS   FT 2/2: GOOD Brandon Middleton makes 1/2 from the line.
Score: 89-109

[00:17] Team_048 possession (Score: 89-109)
Kyle Irving attempts a Midrange. Wide open! Lauri LaVine is 8.6 feet away. [ZONE] Kyle Irving misses. Rebound secured by Brandon Middleton.

================================================================================
                              4TH QUARTER COMPLETE                              
================================================================================

4TH QUARTER SCORE: Team_066 28, Team_048 28

BOX SCORE:
================================================================================

Team_066
--------------------------------------------------------------------------------
Player                MIN  PTS  REB  AST  TO      FG   FG%      3P   3P%
--------------------------------------------------------------------------------
Brandon Middleton      17    9    3    1   0   4/5    80.0     0/0   0.0
Pascal Carter          18    7    0    0   0   3/4    75.0     0/0   0.0
Lauri LaVine           17    6    3    0   0   3/4    75.0     0/0   0.0
Cole Morant            17    4    0    1   0   2/5    40.0     0/0   0.0
Brandon Reaves         31    2    0    0   0   1/1   100.0     0/0   0.0
Yao Brogdon            31    0    0    0   0   0/1     0.0     0/0   0.0
Donovan Simmons        17    0    2    0   0   0/0     0.0     0/0   0.0

TEAM: FG: 13/20 (65.0%), 3PT: 2/5 (40.0%), REB: 7 (0 off, 7 def), AST: 2, TO: 3
TEAM FOULS: 5 [Team_048 in BONUS]


Team_048
--------------------------------------------------------------------------------
Player                MIN  PTS  REB  AST  TO      FG   FG%      3P   3P%
--------------------------------------------------------------------------------
Yao Booker             17   11    0    1   0   5/6    83.3     0/0   0.0
Gary Giddey            17    5    3    1   0   2/4    50.0     0/0   0.0
Kyle Irving            17    5    2    1   0   2/5    40.0     0/0   0.0
Karl Johnson           31    3    0    0   0   1/1   100.0     0/0   0.0
DeMar Hyland           17    2    5    2   0   1/2    50.0     0/0   0.0
Lauri Curry            18    2    0    0   0   1/2    50.0     0/0   0.0
Dejounte Sexton        31    0    0    1   0   0/0     0.0     0/0   0.0
Kevin Fox              31    0    1    0   0   0/0     0.0     0/0   0.0

TEAM: FG: 12/20 (60.0%), 3PT: 4/8 (50.0%), REB: 12 (5 off, 7 def), AST: 6, TO: 3
TEAM FOULS: 7 [Team_066 in BONUS]

================================================================================

================================================================================
                               FULL GAME COMPLETE                               
================================================================================

FINAL SCORE: Team_066 89, Team_048 109

SCORING BY QUARTER:
--------------------------------------------------------------------------------
Team                     Q1     Q2     Q3     Q4    FINAL
--------------------------------------------------------------------------------
Team_066                 22     18     21     28       89
Team_048                 29     15     37     28      109
--------------------------------------------------------------------------------

FULL GAME BOX SCORE:
================================================================================

Team_066
--------------------------------------------------------------------------------
Player                MIN  PTS  REB  AST  TO      FG   FG%      3P   3P%      FT STL BLK
--------------------------------------------------------------------------------
Pau Curry              31    4    0    2   2   2/8    25.0   0/5     0.0   0/0     0   0
Brandon Reaves         31   21    9    3   1   8/18   44.4   3/8    37.5   2/2     2   0
Yao Brogdon            31    4    6    2   1   3/10   30.0   0/4     0.0   0/0     1   0
Kyle Wagner            31    8    7    1   0   4/7    57.1   0/1     0.0   2/2     2   1
Jimmy Davis            30   10    0    3   2   4/9    44.4   0/3     0.0   4/5     0   0
Pascal Carter          18    7    0    0   1   3/4    75.0   1/2    50.0   0/0     0   0
Lauri LaVine           17    6    4    0   3   2/3    66.7   0/1     0.0   2/3     0   1
Brandon Middleton      17   13    5    1   1   6/7    85.7   1/1   100.0   2/3     0   0
Cole Morant            17    7    0    1   1   3/7    42.9   1/1   100.0   4/4     0   0
Donovan Simmons        17    6    5    1   1   4/4   100.0   0/0     0.0   7/8     0   0

TEAM: FG: 39/77 (50.6%), 3PT: 6/26 (23.1%), REB: 31 (5 off, 26 def), AST: 14, TO: 13


Team_048
--------------------------------------------------------------------------------
Player                MIN  PTS  REB  AST  TO      FG   FG%      3P   3P%      FT STL BLK
--------------------------------------------------------------------------------
Karl Johnson           31   14    0    2   1   6/11   54.5   3/6    50.0   1/1     1   0
Dejounte Sexton        31   16   10    2   4   6/11   54.5   3/6    50.0   1/2     0   0
Kevin Fox              31    9   18    1   2   3/6    50.0   0/1     0.0   3/3     1   1
Damian Mobley          31   22   10    3   1   9/10   90.0   0/0     0.0   2/2     0   1
Paolo Rozier           30    6    0    7   3   4/7    57.1   0/2     0.0   3/5     0   0
Lauri Curry            18    5    0    0   0   3/4    75.0   2/3    66.7   0/0     0   0
Yao Booker             17   14    0    2   1   6/7    85.7   1/2    50.0   1/1     0   0
Kyle Irving            17    7    2    1   1   2/8    25.0   0/5     0.0   1/1     0   0
DeMar Hyland           17    4    6    5   0   2/3    66.7   0/0     0.0   0/0     2   1
Gary Giddey            17    7    4    1   1   3/7    42.9   1/1   100.0   0/0     0   0

TEAM: FG: 44/75 (58.7%), 3PT: 10/26 (38.5%), REB: 55 (17 off, 38 def), AST: 24, TO: 14

================================================================================
