================================================================================
                        FULL GAME - Team_034 vs Team_066                        
================================================================================

================================================================================
                       1ST QUARTER - Team_034 vs Team_066                       
================================================================================

[12:00] Team_034 possession (Score: 0-0)
Cole Antetokounmpo attempts a 3Pt. Contested by Brandon Reaves (5.3 feet, MAN). Cole Antetokounmpo misses. FOUL! Loose ball foul on Yao Brogdon during the rebound battle. [Team fouls: 1] No free throws, side out. (Yao Brogdon: 1 personal fouls)

[11:48] Team_034 possession (Score: 0-0)
Terry Doncic attempts a Midrange. Contested by Yao Brogdon (3.2 feet, MAN). TERRY DONCIC MAKES IT!
Score: 2-0

[11:33] Team_066 possession (Score: 2-0)
Jimmy Davis attempts a 3Pt. Contested by Devin Poole (5.4 feet, MAN). JIMMY DAVIS MAKES IT! Assist: Pau Curry
Score: 2-3

[11:20] Team_034 possession (Score: 2-3)
Cole Antetokounmpo drives, picks up Brandon Reaves. Help arrives from Jimmy Davis! Cole Antetokounmpo attempts a Layup. Wide open! Jimmy Davis is 7.5 feet away. [MAN] Cole Antetokounmpo misses. Rebound secured by Kyle Wagner.

[11:03] Team_066 possession (Score: 2-3)
Kyle Wagner attempts a Layup. BLOCKED BY BEN HYLAND! Ball is loose! Offensive rebound by Yao Brogdon! Yao Brogdon kicks it out.

[10:52] Team_066 possession (Score: 2-3)
Brandon Reaves attempts a 3Pt. Contested by Devin Poole (4.2 feet, ZONE). Brandon Reaves misses. Offensive rebound by Yao Brogdon! Yao Brogdon kicks it out.

[10:42] Team_066 possession (Score: 2-3)
Kyle Wagner throws a bad pass! Stolen by Anthony Bane! TURNOVER! (live ball)

[10:30] Team_034 possession (Score: 2-3)
Ben Hyland attempts a Layup. BLOCKED BY JIMMY DAVIS! Ball is loose! Rebound secured by Brandon Reaves.

[10:13] Team_066 possession (Score: 2-3)
Jimmy Davis attempts a 3Pt. Contested by Devin Poole (5.4 feet, MAN). Jimmy Davis misses. Rebound secured by Cole Antetokounmpo.

[09:57] Team_034 possession (Score: 2-3)
Cole Antetokounmpo attempts a 3Pt. Contested by Pau Curry (4.6 feet, ZONE). Cole Antetokounmpo misses. Rebound secured by Brandon Reaves.

[09:46] Team_066 possession (Score: 2-3)
Yao Brogdon attempts a 3Pt. Wide open! Cole Antetokounmpo is 7.5 feet away. [ZONE] YAO BROGDON MAKES IT! Assist: Jimmy Davis
Score: 2-6

[09:29] Team_034 possession (Score: 2-6)
Anthony Bane attempts a Midrange. Heavily contested by Kyle Wagner (1.6 feet, MAN)! ANTHONY BANE MAKES IT! Assist: Cole Antetokounmpo
Score: 4-6

[09:12] Team_066 possession (Score: 4-6)
Brandon Reaves attempts a 3Pt. Contested by Cole Antetokounmpo (5.4 feet, MAN). Brandon Reaves misses. Offensive rebound by Yao Brogdon! Yao Brogdon kicks it out.

[08:59] Team_066 possession (Score: 4-6)
Kyle Wagner attempts a Layup. Contested by Anthony Bane (3.9 feet, MAN). KYLE WAGNER MAKES IT! Assist: Jimmy Davis
Score: 4-8

[08:44] Team_034 possession (Score: 4-8)
Cole Antetokounmpo attempts a 3Pt. Contested by Pau Curry (5.8 feet, ZONE). COLE ANTETOKOUNMPO MAKES IT! Assist: Terry Doncic
Score: 7-8

[08:30] Team_066 possession (Score: 7-8)
FOUL! Reach-in foul on Terry Doncic during the drive. [Team fouls: 1] No free throws, side out. (Terry Doncic: 1 personal fouls)

[08:13] Team_066 possession (Score: 7-8)
Jimmy Davis attempts a Midrange. Contested by Terry Doncic (5.4 feet, ZONE). JIMMY DAVIS MAKES IT!
Score: 7-10

[07:57] Team_034 possession (Score: 7-10)
Terry Doncic attempts a Midrange. Wide open! Pau Curry is 6.7 feet away. [ZONE] TERRY DONCIC MAKES IT! Assist: Ben Hyland
Score: 9-10

[07:43] Team_066 possession (Score: 9-10)
Pau Curry attempts a Midrange. Contested by Ben Hyland (2.7 feet, MAN). PAU CURRY MAKES IT!
Score: 9-12

[07:28] Team_034 possession (Score: 9-12)
Anthony Bane attempts a Midrange. Contested by Brandon Reaves (4.3 feet, ZONE). Anthony Bane misses. Rebound secured by Kyle Wagner.

[07:12] Team_066 possession (Score: 9-12)
Pau Curry attempts a 3Pt. Wide open! Devin Poole is 6.5 feet away. [ZONE] Pau Curry misses. Rebound secured by Terry Doncic.

[07:02] Team_034 possession (Score: 9-12)
Cole Antetokounmpo attempts a 3Pt. Heavily contested by Pau Curry (1.5 feet, ZONE)! Cole Antetokounmpo misses. Offensive rebound by Anthony Bane! Anthony Bane kicks it out.

[06:49] Team_034 possession (Score: 9-12)
FOUL! Shooting foul on Kyle Wagner. Anthony Bane to the line for 2 free throws. [Team fouls: 2] (Kyle Wagner: 1 personal fouls)   FT 1/2: MISS   FT 2/2: GOOD Anthony Bane makes 1/2 from the line.
Score: 10-12

[06:36] Team_066 possession (Score: 10-12)
FOUL! Offensive foul on Yao Brogdon! Terry Doncic drew the charge! [Team fouls: 3] (Yao Brogdon: 2 personal fouls) TURNOVER! (dead ball)

[06:18] Team_034 possession (Score: 10-12)
Ben Hyland loses control! Ball rolls out of bounds! TURNOVER! (dead ball)

[06:08] Team_066 possession (Score: 10-12)
Jimmy Davis drives, Devin Poole stays with him. Jimmy Davis attempts a Dunk. Heavily contested by Devin Poole (0.8 feet, MAN)! Jimmy Davis misses. Rebound secured by Anthony Bane.

[05:52] Team_034 possession (Score: 10-12)
Anthony Bane attempts a Midrange. Contested by Kyle Wagner (5.3 feet, MAN). Anthony Bane misses. Rebound secured by Yao Brogdon.

[05:35] Team_066 possession (Score: 10-12)
Pau Curry attempts a 3Pt. Contested by Ben Hyland (4.5 feet, MAN). Pau Curry misses. Rebound secured by Anthony Bane.

[05:21] Team_034 possession (Score: 10-12)
Cole Antetokounmpo drives and kicks out. Ben Hyland attempts a 3Pt. Contested by Pau Curry (5.8 feet, ZONE). Ben Hyland misses. Rebound secured by Brandon Reaves.

[05:05] Team_066 possession (Score: 10-12)
Pau Curry drives and kicks out. Yao Brogdon attempts a 3Pt. Wide open! Terry Doncic is 6.9 feet away. [MAN] Yao Brogdon misses. Rebound secured by Terry Doncic.

[04:49] Team_034 possession (Score: 10-12)
Devin Poole attempts a 3Pt. Wide open! Pau Curry is 8.5 feet away. [ZONE] DEVIN POOLE MAKES IT! Assist: Anthony Bane
Score: 13-12

[04:35] Team_066 possession (Score: 13-12)
Yao Brogdon attempts a Layup. BLOCKED BY TERRY DONCIC! Ball is loose! Rebound secured by Terry Doncic.

[04:24] Team_034 possession (Score: 13-12)
FOUL! Shooting foul on Jimmy Davis. Devin Poole to the line for 2 free throws. [Team fouls: 4] (Jimmy Davis: 1 personal fouls)   FT 1/2: GOOD   FT 2/2: GOOD Devin Poole makes 2/2 from the line.
Score: 15-12

[04:11] Team_066 possession (Score: 15-12)
Jimmy Davis attempts a Layup. Wide open! Anthony Bane is 6.2 feet away. [ZONE] JIMMY DAVIS MAKES IT! Assist: Pau Curry
Score: 15-14

[03:58] Team_034 possession (Score: 15-14)
FOUL! Holding foul on Yao Brogdon. [IN THE BONUS! 5 team fouls] Terry Doncic to the line for 2 free throws. (Yao Brogdon: 3 personal fouls)   FT 1/2: GOOD   FT 2/2: GOOD Terry Doncic makes 2/2 from the line.
Score: 17-14

[03:43] Team_066 possession (Score: 17-14)
Pau Curry attempts a 3Pt. Contested by Devin Poole (4.8 feet, ZONE). Pau Curry misses. Rebound secured by Terry Doncic.

[03:27] Team_034 possession (Score: 17-14)
Devin Poole attempts a 3Pt. Contested by Pau Curry (3.4 feet, ZONE). Devin Poole misses. Rebound secured by Kyle Wagner.

[03:15] Team_066 possession (Score: 17-14)
Kyle Wagner loses control! Ball rolls out of bounds! TURNOVER! (dead ball)

[03:15] Substitution (Team_034): Devin Poole OUT → Manu Jokic IN (stamina_rule2)

[03:15] Substitution (Team_066): Jimmy Davis OUT → Pascal Carter IN (stamina_rule2)

[02:57] Team_034 possession (Score: 17-14)
Anthony Bane attempts a Layup. Contested by Kyle Wagner (3.3 feet, ZONE). ANTHONY BANE MAKES IT!
Score: 19-14

[02:41] Team_066 possession (Score: 19-14)
Brandon Reaves attempts a Midrange. Wide open! Cole Antetokounmpo is 6.8 feet away. [ZONE] Brandon Reaves misses. Rebound secured by Anthony Bane.

[02:24] Team_034 possession (Score: 19-14)
Manu Jokic drives and kicks out. Cole Antetokounmpo attempts a 3Pt. Wide open! Brandon Reaves is 7.2 feet away. [MAN] COLE ANTETOKOUNMPO MAKES IT! Assist: Anthony Bane
Score: 22-14

[02:12] Team_066 possession (Score: 22-14)
Kyle Wagner drives, picks up Terry Doncic. Help arrives from Ben Hyland! Kyle Wagner attempts a Layup. Wide open! Ben Hyland is 6.6 feet away. [ZONE] Kyle Wagner misses. Rebound secured by Cole Antetokounmpo.

[01:56] Team_034 possession (Score: 22-14)
Anthony Bane attempts a Layup. BLOCKED BY KYLE WAGNER! Ball deflects out of bounds off Anthony Bane.

[01:39] Team_066 possession (Score: 22-14)
Kyle Wagner drives to the basket... Kyle Wagner throws a bad pass out of bounds! TURNOVER! (dead ball)

[01:39] Substitution (Team_034): Ben Hyland OUT → Damian Turner IN (stamina_rule2)

[01:39] Substitution (Team_034): Cole Antetokounmpo OUT → Vince Paul IN (stamina_rule2)

[01:39] Substitution (Team_034): Terry Doncic OUT → Nikola Wagner IN (stamina_rule2)

[01:39] Substitution (Team_034): Anthony Bane OUT → Carmelo Anunoby IN (stamina_rule2)

[01:39] Substitution (Team_066): Pau Curry OUT → Lauri LaVine IN (stamina_rule2)

[01:39] Substitution (Team_066): Brandon Reaves OUT → Brandon Middleton IN (stamina_rule2)

[01:39] Substitution (Team_066): Yao Brogdon OUT → Cole Morant IN (stamina_rule2)

[01:39] Substitution (Team_066): Kyle Wagner OUT → Donovan Simmons IN (stamina_rule2)

[01:23] Team_034 possession (Score: 22-14)
Carmelo Anunoby drives and kicks out. Carmelo Anunoby attempts a 3Pt. Wide open! Donovan Simmons is 7.5 feet away. [MAN] Carmelo Anunoby misses. Offensive rebound by Carmelo Anunoby! Carmelo Anunoby kicks it out.

[01:10] Team_034 possession (Score: 22-14)
Nikola Wagner drives and kicks out. Vince Paul attempts a Midrange. Heavily contested by Lauri LaVine (1.8 feet, ZONE)! VINCE PAUL MAKES IT!
Score: 24-14

[00:58] Team_066 possession (Score: 24-14)
Pascal Carter attempts a Layup. Contested by Manu Jokic (4.4 feet, MAN). PASCAL CARTER MAKES IT! Assist: Lauri LaVine
Score: 24-16

[00:46] Team_034 possession (Score: 24-16)
Carmelo Anunoby attempts a 3Pt. Wide open! Donovan Simmons is 6.5 feet away. [MAN] Carmelo Anunoby misses. Rebound secured by Lauri LaVine.

[00:35] Team_066 possession (Score: 24-16)
Pascal Carter attempts a Midrange. Wide open! Manu Jokic is 7.2 feet away. [MAN] PASCAL CARTER MAKES IT!
Score: 24-18

[00:21] Team_034 possession (Score: 24-18)
Damian Turner attempts a Layup. Heavily contested by Donovan Simmons (0.5 feet, ZONE)! DAMIAN TURNER MAKES IT!
Score: 26-18

[00:05] Team_066 possession (Score: 26-18)
Pascal Carter attempts a Layup. Contested by Carmelo Anunoby (4.2 feet, ZONE). PASCAL CARTER MAKES IT!
Score: 26-20

================================================================================
                              1ST QUARTER COMPLETE                              
================================================================================

1ST QUARTER SCORE: Team_034 26, Team_066 20

BOX SCORE:
================================================================================

Team_034
--------------------------------------------------------------------------------
Player                MIN  PTS  REB  AST  TO      FG   FG%      3P   3P%
--------------------------------------------------------------------------------
Terry Doncic           11    6    5    1   0   3/3   100.0     0/0   0.0
Cole Antetokounmpo     11    6    2    1   0   2/5    40.0     0/0   0.0
Anthony Bane           11    5    4    2   0   3/6    50.0     0/0   0.0
Devin Poole             9    5    0    0   0   2/3    66.7     0/0   0.0
Vince Paul              1    2    0    0   0   1/1   100.0     0/0   0.0
Damian Turner           1    2    0    0   0   1/1   100.0     0/0   0.0
Ben Hyland             11    0    0    1   0   0/1     0.0     0/0   0.0
Carmelo Anunoby         1    0    1    0   0   0/1     0.0     0/0   0.0

TEAM: FG: 12/21 (57.1%), 3PT: 2/5 (40.0%), REB: 12 (3 off, 9 def), AST: 5, TO: 1
TEAM FOULS: 1


Team_066
--------------------------------------------------------------------------------
Player                MIN  PTS  REB  AST  TO      FG   FG%      3P   3P%
--------------------------------------------------------------------------------
Jimmy Davis             9    7    0    2   0   3/5    60.0     0/0   0.0
Pascal Carter           3    6    0    0   0   3/3   100.0     0/0   0.0
Yao Brogdon            11    3    4    0   0   1/2    50.0     0/0   0.0
Pau Curry              11    2    0    2   0   1/5    20.0     0/0   0.0
Kyle Wagner            11    2    3    0   0   1/2    50.0     0/0   0.0
Brandon Reaves         11    0    3    0   0   0/1     0.0     0/0   0.0
Lauri LaVine            1    0    1    1   0   0/0     0.0     0/0   0.0

TEAM: FG: 9/18 (50.0%), 3PT: 2/6 (33.3%), REB: 11 (3 off, 8 def), AST: 5, TO: 4
TEAM FOULS: 5 [Team_034 in BONUS]

================================================================================

================================================================================
                       2ND QUARTER - Team_034 vs Team_066                       
================================================================================

[12:00] Team_034 possession (Score: 26-20)
Cole Antetokounmpo drives, picks up Brandon Reaves. Help arrives from Jimmy Davis! Cole Antetokounmpo attempts a Dunk. Contested by Jimmy Davis (5.5 feet, MAN). Cole Antetokounmpo misses. Rebound secured by Yao Brogdon.

[11:45] Team_066 possession (Score: 26-20)
Jimmy Davis attempts a Midrange. Wide open! Devin Poole is 6.8 feet away. [MAN] JIMMY DAVIS MAKES IT! Assist: Kyle Wagner
Score: 26-22

[11:28] Team_034 possession (Score: 26-22)
Ben Hyland attempts a 3Pt. Wide open! Jimmy Davis is 6.9 feet away. [ZONE] BEN HYLAND MAKES IT! Assist: Devin Poole
Score: 29-22

[11:11] Team_066 possession (Score: 29-22)
Jimmy Davis attempts a 3Pt. Wide open! Devin Poole is 7.3 feet away. [MAN] JIMMY DAVIS MAKES IT!
Score: 29-25

[11:00] Team_034 possession (Score: 29-25)
Devin Poole attempts a 3Pt. Contested by Yao Brogdon (5.7 feet, ZONE). Devin Poole misses. Rebound secured by Yao Brogdon.

[10:45] Team_066 possession (Score: 29-25)
Yao Brogdon makes the Layup and draws the foul on Ben Hyland! And-1! Yao Brogdon to the line for 1. [Team fouls: 1] (Ben Hyland: 1 personal fouls)   FT 1/1: GOOD Yao Brogdon makes 1/1 from the line.
Score: 29-28

[10:31] Team_034 possession (Score: 29-28)
Anthony Bane attempts a Midrange. Wide open! Kyle Wagner is 7.6 feet away. [MAN] Anthony Bane misses. Rebound secured by Kyle Wagner.

[10:15] Team_066 possession (Score: 29-28)
Yao Brogdon attempts a Midrange. Contested by Devin Poole (3.3 feet, ZONE). Yao Brogdon misses. Rebound secured by Terry Doncic.

[09:57] Team_034 possession (Score: 29-28)
Ben Hyland attempts a Midrange. BLOCKED BY BRANDON REAVES! Ball deflects out of bounds off Ben Hyland.

[09:43] Team_066 possession (Score: 29-28)
Jimmy Davis attempts a 3Pt. Contested by Ben Hyland (3.0 feet, ZONE). Jimmy Davis misses. Rebound secured by Terry Doncic.

[09:29] Team_034 possession (Score: 29-28)
Anthony Bane attempts a Layup. BLOCKED BY KYLE WAGNER! Ball is loose! Rebound secured by Kyle Wagner.

[09:17] Team_066 possession (Score: 29-28)
Yao Brogdon attempts a Midrange. Contested by Ben Hyland (5.9 feet, ZONE). Yao Brogdon misses. Rebound secured by Cole Antetokounmpo.

[09:06] Team_034 possession (Score: 29-28)
Ben Hyland attempts a Midrange. Wide open! Pau Curry is 7.3 feet away. [MAN] BEN HYLAND MAKES IT! Assist: Anthony Bane
Score: 31-28

[08:54] Team_066 possession (Score: 31-28)
Yao Brogdon attempts a 3Pt. Wide open! Terry Doncic is 7.1 feet away. [MAN] Yao Brogdon misses. Offensive rebound by Yao Brogdon! Yao Brogdon kicks it out.

[08:35] Team_066 possession (Score: 31-28)
Brandon Reaves makes the Midrange and draws the foul on Cole Antetokounmpo! And-1! Brandon Reaves to the line for 1. [Team fouls: 2] (Cole Antetokounmpo: 1 personal fouls)   FT 1/1: MISS Brandon Reaves makes 0/1 from the line. Offensive rebound by Kyle Wagner! Kyle Wagner kicks it out.
Score: 31-30

[08:18] Team_066 possession (Score: 31-30)
Kyle Wagner drives to the basket... Kyle Wagner throws a bad pass out of bounds! TURNOVER! (dead ball)

[08:18] Substitution (Team_034): Devin Poole OUT → Manu Jokic IN (stamina_rule2)

[08:18] Substitution (Team_034): Ben Hyland OUT → Damian Turner IN (stamina_rule2)

[08:18] Substitution (Team_034): Cole Antetokounmpo OUT → Vince Paul IN (stamina_rule2)

[08:18] Substitution (Team_034): Terry Doncic OUT → Nikola Wagner IN (stamina_rule2)

[08:18] Substitution (Team_034): Anthony Bane OUT → Carmelo Anunoby IN (stamina_rule2)

[08:18] Substitution (Team_066): Jimmy Davis OUT → Pascal Carter IN (stamina_rule2)

[08:18] Substitution (Team_066): Pau Curry OUT → Lauri LaVine IN (stamina_rule2)

[08:18] Substitution (Team_066): Brandon Reaves OUT → Brandon Middleton IN (stamina_rule2)

[08:18] Substitution (Team_066): Yao Brogdon OUT → Cole Morant IN (stamina_rule2)

[08:18] Substitution (Team_066): Kyle Wagner OUT → Donovan Simmons IN (stamina_rule2)

[08:03] Team_034 possession (Score: 31-30)
Manu Jokic attempts a 3Pt. Contested by Pascal Carter (5.4 feet, MAN). Manu Jokic misses. Rebound secured by Brandon Middleton.

[07:53] Team_066 possession (Score: 31-30)
Lauri LaVine attempts a 3Pt. Contested by Vince Paul (4.8 feet, ZONE). Lauri LaVine misses. Rebound secured by Carmelo Anunoby.

[07:39] Team_034 possession (Score: 31-30)
Damian Turner attempts a 3Pt. Wide open! Lauri LaVine is 7.1 feet away. [MAN] Damian Turner misses. Offensive rebound by Carmelo Anunoby! Carmelo Anunoby kicks it out.

[07:23] Team_034 possession (Score: 31-30)
Nikola Wagner attempts a Layup. Contested by Cole Morant (4.4 feet, MAN). NIKOLA WAGNER MAKES IT! Assist: Vince Paul
Score: 33-30

[07:08] Team_066 possession (Score: 33-30)
Cole Morant attempts a Midrange. Wide open! Nikola Wagner is 7.6 feet away. [ZONE] Cole Morant misses. Rebound secured by Nikola Wagner.

[06:56] Team_034 possession (Score: 33-30)
Damian Turner makes the Dunk and draws the foul on Brandon Middleton! And-1! Damian Turner to the line for 1. [Team fouls: 1] (Brandon Middleton: 1 personal fouls)   FT 1/1: GOOD Damian Turner makes 1/1 from the line.
Score: 36-30

[06:44] Team_066 possession (Score: 36-30)
Cole Morant attempts a 3Pt. Contested by Vince Paul (5.7 feet, ZONE). Cole Morant misses. Rebound secured by Vince Paul.

[06:27] Team_034 possession (Score: 36-30)
Manu Jokic drives to the basket... Manu Jokic throws a bad pass! Stolen by Pascal Carter! TURNOVER! (live ball)

[06:12] Team_066 possession (Score: 36-30)
Brandon Middleton attempts a Midrange. Contested by Vince Paul (3.6 feet, MAN). Brandon Middleton misses. Rebound secured by Carmelo Anunoby.

[05:55] Team_034 possession (Score: 36-30)
Manu Jokic throws a bad pass! Stolen by Pascal Carter! TURNOVER! (live ball)

[05:37] Team_066 possession (Score: 36-30)
Pascal Carter attempts a Layup. BLOCKED BY DAMIAN TURNER! Ball is loose! Offensive rebound by Lauri LaVine! Lauri LaVine kicks it out.

[05:23] Team_066 possession (Score: 36-30)
Pascal Carter attempts a Midrange. Contested by Manu Jokic (3.4 feet, MAN). Pascal Carter misses. FOUL! Loose ball foul on Nikola Wagner during the rebound battle. [Team fouls: 3] No free throws, side out. (Nikola Wagner: 1 personal fouls)

[05:08] Team_066 possession (Score: 36-30)
Brandon Middleton attempts a 3Pt. Contested by Vince Paul (4.9 feet, MAN). Brandon Middleton misses. Offensive rebound by Donovan Simmons! Donovan Simmons kicks it out.

[04:56] Team_066 possession (Score: 36-30)
Donovan Simmons drives, picks up Carmelo Anunoby. Help arrives from Damian Turner! Donovan Simmons attempts a Layup. Contested by Damian Turner (4.7 feet, ZONE). DONOVAN SIMMONS MAKES IT!
Score: 36-32

[04:43] Team_034 possession (Score: 36-32)
Carmelo Anunoby attempts a Layup. Contested by Donovan Simmons (2.2 feet, MAN). CARMELO ANUNOBY MAKES IT!
Score: 38-32

[04:26] Team_066 possession (Score: 38-32)
Pascal Carter attempts a Midrange. Wide open! Nikola Wagner is 7.1 feet away. [ZONE] PASCAL CARTER MAKES IT!
Score: 38-34

[04:11] Team_034 possession (Score: 38-34)
Nikola Wagner attempts a 3Pt. Contested by Lauri LaVine (5.8 feet, ZONE). Nikola Wagner misses. Rebound secured by Brandon Middleton.

[03:54] Team_066 possession (Score: 38-34)
Donovan Simmons drives, picks up Carmelo Anunoby. Help arrives from Damian Turner! Donovan Simmons attempts a Dunk. Wide open! Damian Turner is 7.8 feet away. [ZONE] DONOVAN SIMMONS MAKES IT!
Score: 38-36

[03:40] Team_034 possession (Score: 38-36)
Carmelo Anunoby attempts a Layup. Contested by Donovan Simmons (3.6 feet, ZONE). Carmelo Anunoby misses. Offensive rebound by Carmelo Anunoby! Carmelo Anunoby kicks it out.

[03:24] Team_034 possession (Score: 38-36)
FOUL! Shooting foul on Lauri LaVine. Damian Turner to the line for 2 free throws. [Team fouls: 2] (Lauri LaVine: 1 personal fouls)   FT 1/2: MISS   FT 2/2: GOOD Damian Turner makes 1/2 from the line.
Score: 39-36

[03:10] Team_066 possession (Score: 39-36)
Lauri LaVine makes the Layup and draws the foul on Vince Paul! And-1! Lauri LaVine to the line for 1. [Team fouls: 4] (Vince Paul: 1 personal fouls)   FT 1/1: GOOD Lauri LaVine makes 1/1 from the line.
Score: 39-39

[02:56] Team_034 possession (Score: 39-39)
Vince Paul attempts a Midrange. Wide open! Lauri LaVine is 7.2 feet away. [ZONE] Vince Paul misses. Offensive rebound by Carmelo Anunoby! Carmelo Anunoby kicks it out.

[02:44] Team_034 possession (Score: 39-39)
FOUL! Reach-in foul on Donovan Simmons during the drive. [Team fouls: 3] No free throws, side out. (Donovan Simmons: 1 personal fouls)

[02:33] Team_034 possession (Score: 39-39)
Vince Paul attempts a Midrange. Contested by Brandon Middleton (4.1 feet, ZONE). VINCE PAUL MAKES IT! Assist: Manu Jokic
Score: 41-39

[02:20] Team_066 possession (Score: 41-39)
Lauri LaVine drives to the basket... FOUL! Offensive foul on Lauri LaVine! Carmelo Anunoby drew the charge! [Team fouls: 4] (Lauri LaVine: 2 personal fouls) TURNOVER! (dead ball)

[02:08] Team_034 possession (Score: 41-39)
Nikola Wagner attempts a Midrange. Contested by Cole Morant (5.6 feet, MAN). NIKOLA WAGNER MAKES IT! Assist: Damian Turner
Score: 43-39

[01:54] Team_066 possession (Score: 43-39)
Donovan Simmons drives to the basket... Donovan Simmons throws a bad pass! Stolen by Carmelo Anunoby! TURNOVER! (live ball)

[01:42] Team_034 possession (Score: 43-39)
Damian Turner drives and kicks out. Nikola Wagner attempts a 3Pt. Wide open! Cole Morant is 6.2 feet away. [MAN] NIKOLA WAGNER MAKES IT! Assist: Vince Paul
Score: 46-39

[01:27] Team_066 possession (Score: 46-39)
Pascal Carter drives and kicks out. Brandon Middleton attempts a 3Pt. Wide open! Nikola Wagner is 6.1 feet away. [ZONE] Brandon Middleton misses. Rebound secured by Carmelo Anunoby.

[01:11] Team_034 possession (Score: 46-39)
Manu Jokic attempts a Layup. Contested by Pascal Carter (4.1 feet, MAN). Manu Jokic misses. Rebound secured by Donovan Simmons.

[00:52] Team_066 possession (Score: 46-39)
Brandon Middleton drives, Carmelo Anunoby stays with him. Brandon Middleton attempts a Dunk. Contested by Carmelo Anunoby (2.5 feet, ZONE). Brandon Middleton misses. Rebound secured by Nikola Wagner.

[00:37] Team_034 possession (Score: 46-39)
Manu Jokic attempts a 3Pt. Wide open! Pascal Carter is 6.6 feet away. [MAN] MANU JOKIC MAKES IT! Assist: Carmelo Anunoby
Score: 49-39

[00:23] Team_066 possession (Score: 49-39)
Lauri LaVine attempts a Layup. Contested by Damian Turner (2.5 feet, MAN). Lauri LaVine misses. FOUL! Loose ball foul on Carmelo Anunoby during the rebound battle. [IN THE BONUS! 5 team fouls] Donovan Simmons to the line for 2 free throws. (Carmelo Anunoby: 1 personal fouls)   FT 1/2: GOOD   FT 2/2: MISS Donovan Simmons makes 1/2 from the line. FOUL! Loose ball foul on Nikola Wagner during the free throw rebound! [IN THE BONUS! 6 team fouls] Donovan Simmons to the line for 2 free throws. (Nikola Wagner: 2 personal fouls)   FT 1/2: MISS   FT 2/2: GOOD Donovan Simmons makes 1/2 from the line.
Score: 49-41

[00:08] Team_034 possession (Score: 49-41)
Manu Jokic attempts a 3Pt. Wide open! Pascal Carter is 7.0 feet away. [MAN] Manu Jokic misses. Offensive rebound by Carmelo Anunoby! Carmelo Anunoby kicks it out.

================================================================================
                              2ND QUARTER COMPLETE                              
================================================================================

2ND QUARTER SCORE: Team_034 23, Team_066 21

BOX SCORE:
================================================================================

Team_034
--------------------------------------------------------------------------------
Player                MIN  PTS  REB  AST  TO      FG   FG%      3P   3P%
--------------------------------------------------------------------------------
Nikola Wagner          10    7    2    0   0   3/4    75.0     0/0   0.0
Ben Hyland             15    5    0    0   0   2/3    66.7     0/0   0.0
Damian Turner          10    4    0    1   0   2/2   100.0     0/0   0.0
Manu Jokic             11    3    0    1   0   1/3    33.3     0/0   0.0
Carmelo Anunoby        10    2    7    1   0   1/1   100.0     0/0   0.0
Vince Paul             10    2    1    2   0   1/1   100.0     0/0   0.0
Cole Antetokounmpo     15    0    1    0   0   0/1     0.0     0/0   0.0
Devin Poole            13    0    0    1   0   0/1     0.0     0/0   0.0
Anthony Bane           15    0    0    1   0   0/2     0.0     0/0   0.0
Terry Doncic           15    0    2    0   0   0/0     0.0     0/0   0.0

TEAM: FG: 10/18 (55.6%), 3PT: 2/5 (40.0%), REB: 13 (4 off, 9 def), AST: 7, TO: 2
TEAM FOULS: 6 [Team_066 in BONUS]


Team_066
--------------------------------------------------------------------------------
Player                MIN  PTS  REB  AST  TO      FG   FG%      3P   3P%
--------------------------------------------------------------------------------
Donovan Simmons        10    6    2    0   0   3/3   100.0     0/0   0.0
Jimmy Davis            13    5    0    0   0   2/3    66.7     0/0   0.0
Yao Brogdon            15    3    3    0   0   1/3    33.3     0/0   0.0
Lauri LaVine           10    3    2    0   0   1/2    50.0     0/0   0.0
Pascal Carter          11    2    0    0   0   1/2    50.0     0/0   0.0
Kyle Wagner            15    0    3    1   0   0/0     0.0     0/0   0.0
Brandon Middleton      10    0    2    0   0   0/2     0.0     0/0   0.0
Cole Morant            10    0    0    0   0   0/2     0.0     0/0   0.0

TEAM: FG: 8/17 (47.1%), 3PT: 1/4 (25.0%), REB: 12 (5 off, 7 def), AST: 1, TO: 3
TEAM FOULS: 4

================================================================================

================================================================================
                       3RD QUARTER - Team_034 vs Team_066                       
================================================================================

[12:00] Team_034 possession (Score: 49-41)
Cole Antetokounmpo attempts a Midrange. Contested by Brandon Reaves (3.2 feet, MAN). Cole Antetokounmpo misses. Rebound secured by Brandon Reaves.

[11:48] Team_066 possession (Score: 49-41)
FOUL! Holding foul on Terry Doncic. [Team fouls: 1] No free throws, side out. (Terry Doncic: 1 personal fouls)

[11:36] Team_066 possession (Score: 49-41)
Kyle Wagner attempts a Midrange. Contested by Cole Antetokounmpo (5.1 feet, ZONE). KYLE WAGNER MAKES IT! Assist: Jimmy Davis
Score: 49-43

[11:23] Team_034 possession (Score: 49-43)
Devin Poole attempts a 3Pt. Contested by Jimmy Davis (2.9 feet, MAN). DEVIN POOLE MAKES IT! Assist: Ben Hyland
Score: 52-43

[11:08] Team_066 possession (Score: 52-43)
Yao Brogdon attempts a 3Pt. Heavily contested by Devin Poole (1.2 feet, ZONE)! Yao Brogdon misses. Rebound secured by Cole Antetokounmpo.

[10:55] Team_034 possession (Score: 52-43)
Terry Doncic drives and kicks out. Ben Hyland attempts a 3Pt. Contested by Pau Curry (5.3 feet, MAN). BEN HYLAND MAKES IT! Assist: Devin Poole
Score: 55-43

[10:44] Team_066 possession (Score: 55-43)
Pau Curry attempts a 3Pt. Contested by Ben Hyland (2.8 feet, MAN). Pau Curry misses. Rebound secured by Anthony Bane.

[10:27] Team_034 possession (Score: 55-43)
Cole Antetokounmpo attempts a 3Pt. Contested by Pau Curry (5.9 feet, ZONE). Cole Antetokounmpo misses. Rebound secured by Kyle Wagner.

[10:13] Team_066 possession (Score: 55-43)
Yao Brogdon attempts a Midrange. Contested by Terry Doncic (5.3 feet, ZONE). Yao Brogdon misses. Rebound secured by Anthony Bane.

[09:58] Team_034 possession (Score: 55-43)
Ben Hyland drives to the basket... Ben Hyland loses the ball! Stripped by Kyle Wagner! TURNOVER! (live ball)

[09:46] Team_066 possession (Score: 55-43)
FOUL! Reach-in foul on Terry Doncic during the drive. [Team fouls: 2] No free throws, side out. (Terry Doncic: 2 personal fouls)

[09:27] Team_066 possession (Score: 55-43)
Brandon Reaves attempts a Midrange. BLOCKED BY BEN HYLAND! Ball is loose! Rebound secured by Cole Antetokounmpo.

[09:13] Team_034 possession (Score: 55-43)
Anthony Bane makes the Layup and draws the foul on Kyle Wagner! And-1! Anthony Bane to the line for 1. [Team fouls: 1] (Kyle Wagner: 1 personal fouls)   FT 1/1: GOOD Anthony Bane makes 1/1 from the line.
Score: 58-43

[08:58] Team_066 possession (Score: 58-43)
FOUL! Reach-in foul on Terry Doncic during the drive. [Team fouls: 3] No free throws, side out. (Terry Doncic: 3 personal fouls)

[08:45] Team_066 possession (Score: 58-43)
Jimmy Davis drives to the basket... Jimmy Davis throws a bad pass! Stolen by Devin Poole! TURNOVER! (live ball)

[08:34] Team_034 possession (Score: 58-43)
Terry Doncic makes the Layup and draws the foul on Jimmy Davis! And-1! Terry Doncic to the line for 1. [Team fouls: 2] (Jimmy Davis: 1 personal fouls)   FT 1/1: GOOD Terry Doncic makes 1/1 from the line.
Score: 61-43

[08:19] Team_066 possession (Score: 61-43)
Brandon Reaves drives to the basket... Brandon Reaves loses the ball! Stripped by Cole Antetokounmpo! TURNOVER! (live ball)

[08:04] Team_034 possession (Score: 61-43)
Ben Hyland attempts a 3Pt. Contested by Pau Curry (4.1 feet, ZONE). Ben Hyland misses. Rebound secured by Brandon Reaves.

[07:48] Team_066 possession (Score: 61-43)
Yao Brogdon loses the ball! Stripped by Terry Doncic! TURNOVER! (live ball)

[07:35] Team_034 possession (Score: 61-43)
Ben Hyland attempts a Layup. Wide open! Pau Curry is 7.9 feet away. [MAN] Ben Hyland misses. Rebound secured by Yao Brogdon.

[07:19] Team_066 possession (Score: 61-43)
FOUL! Holding foul on Cole Antetokounmpo. [Team fouls: 4] No free throws, side out. (Cole Antetokounmpo: 1 personal fouls)

[07:05] Team_066 possession (Score: 61-43)
Jimmy Davis drives, Devin Poole stays with him. Jimmy Davis attempts a Dunk. Heavily contested by Devin Poole (0.5 feet, MAN)! JIMMY DAVIS MAKES IT! Assist: Kyle Wagner
Score: 61-45

[06:51] Team_034 possession (Score: 61-45)
Devin Poole attempts a 3Pt. Wide open! Pau Curry is 7.8 feet away. [ZONE] DEVIN POOLE MAKES IT! Assist: Anthony Bane
Score: 64-45

[06:34] Team_066 possession (Score: 64-45)
Kyle Wagner attempts a Midrange. Contested by Anthony Bane (4.6 feet, MAN). KYLE WAGNER MAKES IT!
Score: 64-47

[06:21] Team_034 possession (Score: 64-47)
Cole Antetokounmpo attempts a Midrange. Contested by Jimmy Davis (4.0 feet, ZONE). Cole Antetokounmpo misses. Rebound secured by Kyle Wagner.

[06:08] Team_066 possession (Score: 64-47)
Jimmy Davis drives, Devin Poole stays with him. Jimmy Davis attempts a Layup. Contested by Devin Poole (2.3 feet, MAN). Jimmy Davis misses. Rebound secured by Terry Doncic.

[05:53] Team_034 possession (Score: 64-47)
Devin Poole drives to the basket... Devin Poole commits a violation (traveling/carry)! TURNOVER! (dead ball)

[05:40] Team_066 possession (Score: 64-47)
Yao Brogdon drives to the basket... FOUL! Offensive foul on Yao Brogdon! Terry Doncic drew the charge! [Team fouls: 3] (Yao Brogdon: 1 personal fouls) TURNOVER! (dead ball)

[05:24] Team_034 possession (Score: 64-47)
FOUL! Shooting foul on Kyle Wagner. Anthony Bane to the line for 2 free throws. [Team fouls: 4] (Kyle Wagner: 2 personal fouls)   FT 1/2: GOOD   FT 2/2: GOOD Anthony Bane makes 2/2 from the line.
Score: 66-47

[05:07] Team_066 possession (Score: 66-47)
Yao Brogdon makes the Layup and draws the foul on Anthony Bane! And-1! Yao Brogdon to the line for 1. [BONUS: 5 team fouls] (Anthony Bane: 1 personal fouls)   FT 1/1: GOOD Yao Brogdon makes 1/1 from the line.
Score: 66-50

[04:54] Team_034 possession (Score: 66-50)
Anthony Bane drives to the basket... Anthony Bane throws a bad pass! Stolen by Yao Brogdon! TURNOVER! (live ball)

[04:42] Team_066 possession (Score: 66-50)
Brandon Reaves attempts a 3Pt. Contested by Cole Antetokounmpo (4.8 feet, MAN). BRANDON REAVES MAKES IT! Assist: Pau Curry
Score: 66-53

[04:27] Team_034 possession (Score: 66-53)
Terry Doncic makes the Dunk and draws the foul on Kyle Wagner! And-1! Terry Doncic to the line for 1. [BONUS: 5 team fouls] (Kyle Wagner: 3 personal fouls)   FT 1/1: MISS Terry Doncic makes 0/1 from the line. Rebound secured by Yao Brogdon.
Score: 68-53

[04:12] Team_066 possession (Score: 68-53)
Yao Brogdon attempts a 3Pt. Contested by Devin Poole (2.7 feet, ZONE). Yao Brogdon misses. Rebound secured by Cole Antetokounmpo.

[03:58] Team_034 possession (Score: 68-53)
Ben Hyland drives, Kyle Wagner stays with him. Ben Hyland attempts a Dunk. Contested by Kyle Wagner (3.1 feet, ZONE). Ben Hyland misses. Rebound secured by Brandon Reaves.

[03:41] Team_066 possession (Score: 68-53)
Pau Curry attempts a Midrange. Wide open! Ben Hyland is 7.8 feet away. [MAN] Pau Curry misses. Offensive rebound by Yao Brogdon! Yao Brogdon kicks it out.

[03:28] Team_066 possession (Score: 68-53)
Yao Brogdon drives and kicks out. Jimmy Davis attempts a 3Pt. Contested by Devin Poole (4.0 feet, MAN). JIMMY DAVIS MAKES IT! Assist: Pau Curry
Score: 68-56

[03:14] Team_034 possession (Score: 68-56)
Anthony Bane attempts a Layup. Contested by Kyle Wagner (2.5 feet, ZONE). Anthony Bane misses. Offensive rebound by Anthony Bane! Anthony Bane kicks it out.

[02:58] Team_034 possession (Score: 68-56)
Terry Doncic attempts a Layup. Heavily contested by Kyle Wagner (1.9 feet, ZONE)! TERRY DONCIC MAKES IT! Assist: Cole Antetokounmpo
Score: 70-56

[02:47] Team_066 possession (Score: 70-56)
Brandon Reaves attempts a Layup. BLOCKED BY TERRY DONCIC! Ball is loose! Rebound secured by Cole Antetokounmpo.

[02:33] Team_034 possession (Score: 70-56)
Terry Doncic attempts a Midrange. Contested by Yao Brogdon (5.2 feet, MAN). Terry Doncic misses. Rebound secured by Yao Brogdon.

[02:17] Team_066 possession (Score: 70-56)
Pau Curry drives to the basket... Pau Curry throws a bad pass! Stolen by Terry Doncic! TURNOVER! (live ball)

[02:04] Team_034 possession (Score: 70-56)
Cole Antetokounmpo makes the Layup and draws the foul on Brandon Reaves! And-1! Cole Antetokounmpo to the line for 1. [BONUS: 6 team fouls] (Brandon Reaves: 1 personal fouls)   FT 1/1: GOOD Cole Antetokounmpo makes 1/1 from the line.
Score: 73-56

[01:55] Team_066 possession (Score: 73-56)
Pau Curry attempts a 3Pt. Contested by Ben Hyland (5.2 feet, MAN). Pau Curry misses. Rebound secured by Terry Doncic.

[01:41] Team_034 possession (Score: 73-56)
Terry Doncic attempts a 3Pt. Heavily contested by Yao Brogdon (1.2 feet, ZONE)! Terry Doncic misses. Rebound secured by Brandon Reaves.

[01:27] Team_066 possession (Score: 73-56)
Jimmy Davis attempts a 3Pt. Heavily contested by Devin Poole (1.4 feet, ZONE)! Jimmy Davis misses. Rebound secured by Terry Doncic.

[01:11] Team_034 possession (Score: 73-56)
Ben Hyland attempts a 3Pt. Contested by Jimmy Davis (4.5 feet, ZONE). Ben Hyland misses. Rebound secured by Yao Brogdon.

[00:56] Team_066 possession (Score: 73-56)
Pau Curry drives and kicks out. Brandon Reaves attempts a Midrange. Contested by Ben Hyland (3.1 feet, ZONE). BRANDON REAVES MAKES IT!
Score: 73-58

[00:39] Team_034 possession (Score: 73-58)
Ben Hyland makes the Midrange and draws the foul on Pau Curry! And-1! Ben Hyland to the line for 1. [BONUS: 7 team fouls] (Pau Curry: 1 personal fouls)   FT 1/1: GOOD Ben Hyland makes 1/1 from the line.
Score: 76-58

[00:24] Team_066 possession (Score: 76-58)
Pau Curry attempts a Midrange. Contested by Ben Hyland (5.9 feet, MAN). PAU CURRY MAKES IT! Assist: Jimmy Davis
Score: 76-60

[00:10] Team_034 possession (Score: 76-60)
Cole Antetokounmpo attempts a Midrange. Wide open! Pau Curry is 7.7 feet away. [ZONE] COLE ANTETOKOUNMPO MAKES IT!
Score: 78-60

================================================================================
                              3RD QUARTER COMPLETE                              
================================================================================

3RD QUARTER SCORE: Team_034 29, Team_066 19

BOX SCORE:
================================================================================

Team_034
--------------------------------------------------------------------------------
Player                MIN  PTS  REB  AST  TO      FG   FG%      3P   3P%
--------------------------------------------------------------------------------
Devin Poole            25    6    0    1   0   2/2   100.0     0/0   0.0
Ben Hyland             27    6    0    1   0   2/6    33.3     0/0   0.0
Cole Antetokounmpo     27    5    4    1   0   2/5    40.0     0/0   0.0
Anthony Bane           27    5    3    1   0   2/2   100.0     0/0   0.0
Terry Doncic           27    5    3    0   0   2/5    40.0     0/0   0.0

TEAM: FG: 10/20 (50.0%), 3PT: 2/6 (33.3%), REB: 10 (1 off, 9 def), AST: 4, TO: 3
TEAM FOULS: 5 [Team_066 in BONUS]


Team_066
--------------------------------------------------------------------------------
Player                MIN  PTS  REB  AST  TO      FG   FG%      3P   3P%
--------------------------------------------------------------------------------
Brandon Reaves         27    5    4    0   0   2/4    50.0     0/0   0.0
Jimmy Davis            25    5    0    2   0   2/4    50.0     0/0   0.0
Kyle Wagner            27    4    2    1   0   2/2   100.0     0/0   0.0
Yao Brogdon            27    3    5    0   0   1/4    25.0     0/0   0.0
Pau Curry              27    2    0    2   0   1/3    33.3     0/0   0.0

TEAM: FG: 8/17 (47.1%), 3PT: 1/6 (16.7%), REB: 11 (1 off, 10 def), AST: 5, TO: 5
TEAM FOULS: 7 [Team_034 in BONUS]

================================================================================

================================================================================
                       4TH QUARTER - Team_034 vs Team_066                       
================================================================================

[12:00] Team_034 possession (Score: 78-60)
Cole Antetokounmpo drives to the basket... FOUL! Offensive foul on Cole Antetokounmpo! Brandon Reaves drew the charge! [Team fouls: 1] (Cole Antetokounmpo: 1 personal fouls) TURNOVER! (dead ball)

[11:47] Team_066 possession (Score: 78-60)
Pau Curry attempts a Midrange. Contested by Anthony Bane (4.1 feet, ZONE). PAU CURRY MAKES IT!
Score: 78-62

[11:33] Team_034 possession (Score: 78-62)
Devin Poole attempts a 3Pt. Wide open! Pau Curry is 8.1 feet away. [ZONE] DEVIN POOLE MAKES IT! Assist: Anthony Bane
Score: 81-62

[11:19] Team_066 possession (Score: 81-62)
Yao Brogdon attempts a 3Pt. Contested by Ben Hyland (3.4 feet, ZONE). Yao Brogdon misses. Rebound secured by Terry Doncic.

[11:08] Team_034 possession (Score: 81-62)
Cole Antetokounmpo loses control! Ball rolls out of bounds! TURNOVER! (dead ball)

[11:08] Substitution (Team_034): Devin Poole OUT → Manu Jokic IN (stamina_rule2)

[11:08] Substitution (Team_034): Ben Hyland OUT → Damian Turner IN (stamina_rule2)

[11:08] Substitution (Team_034): Cole Antetokounmpo OUT → Vince Paul IN (stamina_rule2)

[11:08] Substitution (Team_034): Terry Doncic OUT → Nikola Wagner IN (stamina_rule2)

[11:08] Substitution (Team_034): Anthony Bane OUT → Carmelo Anunoby IN (stamina_rule2)

[11:08] Substitution (Team_066): Jimmy Davis OUT → Pascal Carter IN (stamina_rule2)

[11:08] Substitution (Team_066): Pau Curry OUT → Lauri LaVine IN (stamina_rule2)

[11:08] Substitution (Team_066): Brandon Reaves OUT → Brandon Middleton IN (stamina_rule2)

[11:08] Substitution (Team_066): Yao Brogdon OUT → Cole Morant IN (stamina_rule2)

[11:08] Substitution (Team_066): Kyle Wagner OUT → Donovan Simmons IN (stamina_rule2)

[10:58] Team_066 possession (Score: 81-62)
Brandon Middleton attempts a 3Pt. Heavily contested by Vince Paul (1.2 feet, ZONE)! BRANDON MIDDLETON MAKES IT! Assist: Lauri LaVine
Score: 81-65

[10:44] Team_034 possession (Score: 81-65)
Manu Jokic drives and kicks out. Vince Paul attempts a 3Pt. Contested by Brandon Middleton (5.4 feet, MAN). VINCE PAUL MAKES IT! Assist: Nikola Wagner
Score: 84-65

[10:31] Team_066 possession (Score: 84-65)
Brandon Middleton attempts a 3Pt. Contested by Vince Paul (4.4 feet, MAN). BRANDON MIDDLETON MAKES IT! Assist: Pascal Carter
Score: 84-68

[10:17] Team_034 possession (Score: 84-68)
Vince Paul attempts a 3Pt. Contested by Brandon Middleton (5.8 feet, MAN). Vince Paul misses. Rebound secured by Donovan Simmons.

[10:02] Team_066 possession (Score: 84-68)
Donovan Simmons drives and kicks out. Lauri LaVine attempts a Midrange. Wide open! Damian Turner is 8.9 feet away. [MAN] Lauri LaVine misses. Offensive rebound by Lauri LaVine! Lauri LaVine kicks it out.

[09:50] Team_066 possession (Score: 84-68)
Lauri LaVine drives to the basket... FOUL! Offensive foul on Lauri LaVine! Damian Turner drew the charge! [Team fouls: 1] (Lauri LaVine: 1 personal fouls) TURNOVER! (dead ball)

[09:37] Team_034 possession (Score: 84-68)
Carmelo Anunoby attempts a Layup. Contested by Donovan Simmons (5.8 feet, MAN). CARMELO ANUNOBY MAKES IT! Assist: Damian Turner
Score: 86-68

[09:20] Team_066 possession (Score: 86-68)
Brandon Middleton attempts a Midrange. Contested by Vince Paul (4.3 feet, MAN). Brandon Middleton misses. Rebound secured by Nikola Wagner.

[09:04] Team_034 possession (Score: 86-68)
Damian Turner drives to the basket... Damian Turner throws a bad pass! Stolen by Lauri LaVine! TURNOVER! (live ball)

[08:54] Team_066 possession (Score: 86-68)
Donovan Simmons drives, Carmelo Anunoby stays with him. Donovan Simmons attempts a Dunk. Contested by Carmelo Anunoby (3.6 feet, ZONE). DONOVAN SIMMONS MAKES IT! Assist: Lauri LaVine
Score: 86-70

[08:40] Team_034 possession (Score: 86-70)
Vince Paul attempts a Midrange. Wide open! Brandon Middleton is 7.8 feet away. [MAN] VINCE PAUL MAKES IT! Assist: Nikola Wagner
Score: 88-70

[08:24] Team_066 possession (Score: 88-70)
FOUL! Offensive foul on Pascal Carter! Manu Jokic drew the charge! [Team fouls: 2] (Pascal Carter: 1 personal fouls) TURNOVER! (dead ball)

[08:10] Team_034 possession (Score: 88-70)
Carmelo Anunoby attempts a Midrange. Contested by Pascal Carter (3.6 feet, ZONE). Carmelo Anunoby misses. Rebound secured by Lauri LaVine.

[07:50] Team_066 possession (Score: 88-70)
FOUL! Shooting foul on Nikola Wagner. Cole Morant to the line for 2 free throws. [Team fouls: 2] (Nikola Wagner: 1 personal fouls)   FT 1/2: GOOD   FT 2/2: GOOD Cole Morant makes 2/2 from the line.
Score: 88-72

[07:34] Team_034 possession (Score: 88-72)
Nikola Wagner attempts a 3Pt. Contested by Cole Morant (4.9 feet, MAN). NIKOLA WAGNER MAKES IT! Assist: Damian Turner
Score: 91-72

[07:16] Team_066 possession (Score: 91-72)
Brandon Middleton attempts a 3Pt. Contested by Vince Paul (4.9 feet, ZONE). Brandon Middleton misses. Rebound secured by Vince Paul.

[07:03] Team_034 possession (Score: 91-72)
Carmelo Anunoby drives, Donovan Simmons stays with him. Carmelo Anunoby attempts a Layup. Contested by Donovan Simmons (3.8 feet, MAN). Carmelo Anunoby misses. Rebound secured by Brandon Middleton.

[06:47] Team_066 possession (Score: 91-72)
Pascal Carter attempts a 3Pt. Contested by Vince Paul (5.4 feet, ZONE). Pascal Carter misses. Rebound secured by Carmelo Anunoby.

[06:30] Team_034 possession (Score: 91-72)
Manu Jokic makes the Dunk and draws the foul on Lauri LaVine! And-1! Manu Jokic to the line for 1. [Team fouls: 3] (Lauri LaVine: 2 personal fouls)   FT 1/1: GOOD Manu Jokic makes 1/1 from the line.
Score: 94-72

[06:14] Team_066 possession (Score: 94-72)
Pascal Carter drives and kicks out. Cole Morant attempts a 3Pt. Contested by Vince Paul (4.6 feet, ZONE). Cole Morant misses. Rebound secured by Vince Paul.

[05:56] Team_034 possession (Score: 94-72)
Nikola Wagner attempts a 3Pt. Wide open! Cole Morant is 6.5 feet away. [MAN] NIKOLA WAGNER MAKES IT! Assist: Vince Paul
Score: 97-72

[05:40] Team_066 possession (Score: 97-72)
Donovan Simmons attempts a Layup. BLOCKED BY CARMELO ANUNOBY! Ball is loose! Rebound secured by Carmelo Anunoby.

[05:28] Team_034 possession (Score: 97-72)
Nikola Wagner commits a violation (traveling/carry)! TURNOVER! (dead ball)

[05:16] Team_066 possession (Score: 97-72)
Lauri LaVine attempts a 3Pt. Wide open! Vince Paul is 7.8 feet away. [ZONE] Lauri LaVine misses. Rebound secured by Carmelo Anunoby.

[04:58] Team_034 possession (Score: 97-72)
Nikola Wagner attempts a Layup. Contested by Donovan Simmons (5.3 feet, ZONE). Nikola Wagner misses. Offensive rebound by Carmelo Anunoby! Carmelo Anunoby kicks it out.

[04:44] Team_034 possession (Score: 97-72)
Carmelo Anunoby attempts a Midrange. Wide open! Cole Morant is 6.1 feet away. [ZONE] Carmelo Anunoby misses. Rebound secured by Lauri LaVine.

[04:34] Team_066 possession (Score: 97-72)
Pascal Carter attempts a 3Pt. Contested by Manu Jokic (5.3 feet, MAN). Pascal Carter misses. Rebound secured by Vince Paul.

[04:24] Team_034 possession (Score: 97-72)
Damian Turner attempts a 3Pt. Contested by Lauri LaVine (2.1 feet, MAN). Damian Turner misses. Rebound secured by Donovan Simmons.

[04:09] Team_066 possession (Score: 97-72)
Lauri LaVine makes the Dunk and draws the foul on Damian Turner! And-1! Lauri LaVine to the line for 1. [Team fouls: 3] (Damian Turner: 1 personal fouls)   FT 1/1: GOOD Lauri LaVine makes 1/1 from the line.
Score: 97-75

[03:55] Team_034 possession (Score: 97-75)
Nikola Wagner drives, Cole Morant stays with him. Nikola Wagner attempts a Layup. Contested by Cole Morant (3.1 feet, MAN). NIKOLA WAGNER MAKES IT! Assist: Carmelo Anunoby
Score: 99-75

[03:39] Team_066 possession (Score: 99-75)
Brandon Middleton attempts a 3Pt. Wide open! Vince Paul is 6.8 feet away. [MAN] Brandon Middleton misses. Rebound secured by Carmelo Anunoby.

[03:24] Team_034 possession (Score: 99-75)
FOUL! Reach-in foul on Donovan Simmons during the drive. [Team fouls: 4] No free throws, side out. (Donovan Simmons: 1 personal fouls)

[03:06] Team_034 possession (Score: 99-75)
Damian Turner attempts a Layup. Wide open! Lauri LaVine is 6.1 feet away. [MAN] Damian Turner misses. Rebound secured by Brandon Middleton.

[02:51] Team_066 possession (Score: 99-75)
Brandon Middleton attempts a Midrange. Wide open! Damian Turner is 7.2 feet away. [ZONE] Brandon Middleton misses. FOUL! Loose ball foul on Carmelo Anunoby during the rebound battle. [Team fouls: 4] No free throws, side out. (Carmelo Anunoby: 1 personal fouls)

[02:35] Team_066 possession (Score: 99-75)
Brandon Middleton loses control! Ball rolls out of bounds! TURNOVER! (dead ball)

[02:21] Team_034 possession (Score: 99-75)
Damian Turner drives to the basket... FOUL! Offensive foul on Damian Turner! Donovan Simmons drew the charge! [Team fouls: 5] (Damian Turner: 2 personal fouls) TURNOVER! (dead ball)

[02:11] Team_066 possession (Score: 99-75)
Brandon Middleton attempts a Midrange. Heavily contested by Vince Paul (1.3 feet, MAN)! BRANDON MIDDLETON MAKES IT! Assist: Pascal Carter
Score: 99-77

[01:55] Team_034 possession (Score: 99-77)
Carmelo Anunoby makes the Layup and draws the foul on Donovan Simmons! And-1! Carmelo Anunoby to the line for 1. [BONUS: 5 team fouls] (Donovan Simmons: 2 personal fouls)   FT 1/1: MISS Carmelo Anunoby makes 0/1 from the line. Rebound secured by Brandon Middleton.
Score: 101-77

[01:39] Team_066 possession (Score: 101-77)
Cole Morant attempts a 3Pt. Contested by Nikola Wagner (5.6 feet, MAN). COLE MORANT MAKES IT! Assist: Lauri LaVine
Score: 101-80

[01:25] Team_034 possession (Score: 101-80)
Manu Jokic drives, Donovan Simmons stays with him. Manu Jokic attempts a Layup. Heavily contested by Donovan Simmons (0.5 feet, ZONE)! Manu Jokic misses. Rebound secured by Lauri LaVine.

[01:10] Team_066 possession (Score: 101-80)
Cole Morant drives and kicks out. Donovan Simmons attempts a 3Pt. Contested by Manu Jokic (4.2 feet, ZONE). DONOVAN SIMMONS MAKES IT! Assist: Lauri LaVine
Score: 101-83

[00:52] Team_034 possession (Score: 101-83)
Nikola Wagner attempts a 3Pt. Contested by Pascal Carter (5.8 feet, ZONE). Nikola Wagner misses. Offensive rebound by Carmelo Anunoby! Carmelo Anunoby kicks it out.

[00:40] Team_034 possession (Score: 101-83)
Damian Turner attempts a 3Pt. Contested by Lauri LaVine (4.5 feet, MAN). Damian Turner misses. Rebound secured by Donovan Simmons.

[00:23] Team_066 possession (Score: 101-83)
Cole Morant attempts a 3Pt. Wide open! Vince Paul is 6.1 feet away. [ZONE] Cole Morant misses. Rebound secured by Nikola Wagner.

[00:11] Team_034 possession (Score: 101-83)
FOUL! Shooting foul on Donovan Simmons. Vince Paul to the line for 2 free throws. [BONUS: 6 team fouls] (Donovan Simmons: 3 personal fouls)   FT 1/2: MISS   FT 2/2: GOOD Vince Paul makes 1/2 from the line.
Score: 102-83

================================================================================
                              4TH QUARTER COMPLETE                              
================================================================================

4TH QUARTER SCORE: Team_034 24, Team_066 23

BOX SCORE:
================================================================================

Team_034
--------------------------------------------------------------------------------
Player                MIN  PTS  REB  AST  TO      FG   FG%      3P   3P%
--------------------------------------------------------------------------------
Nikola Wagner          21    8    2    2   0   3/3   100.0     0/0   0.0
Vince Paul             21    6    3    1   0   3/4    75.0     0/0   0.0
Devin Poole            26    3    0    0   0   1/1   100.0     0/0   0.0
Manu Jokic             22    3    0    0   0   1/2    50.0     0/0   0.0
Carmelo Anunoby        21    2    6    1   0   1/5    20.0     0/0   0.0
Anthony Bane           28    0    0    1   0   0/0     0.0     0/0   0.0
Terry Doncic           28    0    1    0   0   0/0     0.0     0/0   0.0
Damian Turner          21    0    0    2   0   0/3     0.0     0/0   0.0

TEAM: FG: 9/18 (50.0%), 3PT: 3/6 (50.0%), REB: 12 (2 off, 10 def), AST: 7, TO: 5
TEAM FOULS: 5 [Team_066 in BONUS]


Team_066
--------------------------------------------------------------------------------
Player                MIN  PTS  REB  AST  TO      FG   FG%      3P   3P%
--------------------------------------------------------------------------------
Brandon Middleton      21    8    3    0   0   3/6    50.0     0/0   0.0
Donovan Simmons        21    5    3    0   0   2/3    66.7     0/0   0.0
Cole Morant            21    5    0    0   0   2/3    66.7     0/0   0.0
Lauri LaVine           21    3    5    4   0   1/2    50.0     0/0   0.0
Pau Curry              28    2    0    0   0   1/1   100.0     0/0   0.0
Yao Brogdon            28    0    0    0   0   0/1     0.0     0/0   0.0
Pascal Carter          22    0    0    2   0   0/3     0.0     0/0   0.0

TEAM: FG: 9/19 (47.4%), 3PT: 3/10 (30.0%), REB: 11 (2 off, 9 def), AST: 6, TO: 3
TEAM FOULS: 6 [Team_034 in BONUS]

================================================================================

================================================================================
                               FULL GAME COMPLETE                               
================================================================================

FINAL SCORE: Team_034 102, Team_066 83

SCORING BY QUARTER:
--------------------------------------------------------------------------------
Team                     Q1     Q2     Q3     Q4    FINAL
--------------------------------------------------------------------------------
Team_034                 26     23     29     24      102
Team_066                 20     21     19     23       83
--------------------------------------------------------------------------------

FULL GAME BOX SCORE:
================================================================================

Team_034
--------------------------------------------------------------------------------
Player                MIN  PTS  REB  AST  TO      FG   FG%      3P   3P%      FT STL BLK
--------------------------------------------------------------------------------
Ben Hyland             28   11    0    2   2   3/9    33.3   1/3    33.3   1/1     0   2
Cole Antetokounmpo     28   11    7    2   2   3/10   30.0   1/3    33.3   1/1     1   0
Terry Doncic           28   11   11    1   1   5/8    62.5   0/1     0.0   3/4     2   2
Anthony Bane           28   10    7    5   0   5/10   50.0   0/0     0.0   4/5     1   0
Devin Poole            26   14    0    2   1   5/7    71.4   4/6    66.7   2/2     1   0
Manu Jokic             22    6    0    1   1   4/7    57.1   1/2    50.0   1/1     0   0
Damian Turner          21    6    0    3   0   4/7    57.1   0/2     0.0   2/3     0   1
Vince Paul             21   10    4    3   0   3/4    75.0   0/1     0.0   1/2     0   0
Nikola Wagner          21   15    4    2   2   6/7    85.7   2/3    66.7   0/0     0   0
Carmelo Anunoby        21    4   14    2   2   2/7    28.6   0/1     0.0   0/1     1   1

TEAM: FG: 41/77 (53.2%), 3PT: 9/22 (40.9%), REB: 47 (10 off, 37 def), AST: 23, TO: 11


Team_066
--------------------------------------------------------------------------------
Player                MIN  PTS  REB  AST  TO      FG   FG%      3P   3P%      FT STL BLK
--------------------------------------------------------------------------------
Pau Curry              28    6    0    4   2   4/10   40.0   0/5     0.0   0/0     0   0
Brandon Reaves         28    5    7    0   0   1/4    25.0   1/1   100.0   0/1     0   1
Yao Brogdon            28    9   12    0   3   4/11   36.4   1/4    25.0   2/2     1   0
Kyle Wagner            28    6    8    2   4   3/4    75.0   0/0     0.0   0/0     1   2
Jimmy Davis            26   17    0    4   1   6/11   54.5   2/5    40.0   0/0     0   1
Pascal Carter          22    8    0    2   2   4/8    50.0   0/2     0.0   0/0     2   0
Lauri LaVine           21    6    8    5   0   3/5    60.0   0/2     0.0   2/2     1   0
Brandon Middleton      21    8    5    0   1   3/8    37.5   2/4    50.0   0/0     0   0
Cole Morant            21    5    0    0   1   3/6    50.0   1/3    33.3   2/2     0   0
Donovan Simmons        21   11    5    0   1   3/4    75.0   0/0     0.0   1/2     0   0

TEAM: FG: 34/71 (47.9%), 3PT: 7/26 (26.9%), REB: 45 (11 off, 34 def), AST: 17, TO: 15

================================================================================
