================================================================================
                        FULL GAME - Team_012 vs Team_075                        
================================================================================

================================================================================
                       1ST QUARTER - Team_012 vs Team_075                       
================================================================================

[12:00] Team_012 possession (Score: 0-0)
RJ Nowitzki attempts a Layup. Contested by Derrick Stewart (4.4 feet, ZONE). RJ Nowitzki misses. Offensive rebound by RJ Nowitzki! RJ Nowitzki kicks it out.

[11:45] Team_012 possession (Score: 0-0)
Ayo McGrady attempts a Midrange. Heavily contested by Kawhi Ingram (2.0 feet, ZONE)! AYO MCGRADY MAKES IT! Assist: Paolo Durant
Score: 2-0

[11:34] Team_075 possession (Score: 2-0)
Klay Jokic attempts a Midrange. Wide open! Ayo McGrady is 6.9 feet away. [MAN] Klay Jokic misses. Offensive rebound by Derrick Stewart! Derrick Stewart kicks it out.

[11:19] Team_075 possession (Score: 2-0)
Larry McCollum attempts a 3Pt. Contested by Pascal Herro (5.6 feet, MAN). Larry McCollum misses. Offensive rebound by Kawhi Ingram! Kawhi Ingram kicks it out.

[11:09] Team_075 possession (Score: 2-0)
Klay Jokic commits a violation (traveling/carry)! TURNOVER! (dead ball)

[10:59] Team_012 possession (Score: 2-0)
Pascal Herro attempts a 3Pt. Contested by Larry McCollum (4.4 feet, MAN). Pascal Herro misses. Offensive rebound by RJ Nowitzki! RJ Nowitzki kicks it out.

[10:44] Team_012 possession (Score: 2-0)
Pascal Herro throws a bad pass out of bounds! TURNOVER! (dead ball)

[10:28] Team_075 possession (Score: 2-0)
Klay Jokic attempts a Midrange. Wide open! Ayo McGrady is 6.7 feet away. [MAN] KLAY JOKIC MAKES IT!
Score: 2-2

[10:14] Team_012 possession (Score: 2-2)
FOUL! Reach-in foul on Derrick Stewart during the drive. [Team fouls: 1] No free throws, side out. (Derrick Stewart: 1 personal fouls)

[10:02] Team_012 possession (Score: 2-2)
Pascal Herro attempts a 3Pt. Contested by Larry McCollum (3.9 feet, MAN). PASCAL HERRO MAKES IT! Assist: RJ Nowitzki
Score: 5-2

[09:49] Team_075 possession (Score: 5-2)
Derrick Stewart drives to the basket... Derrick Stewart commits a violation (traveling/carry)! TURNOVER! (dead ball)

[09:31] Team_012 possession (Score: 5-2)
Shaquille Booker attempts a 3Pt. Contested by Larry McCollum (4.6 feet, ZONE). SHAQUILLE BOOKER MAKES IT! Assist: Paolo Durant
Score: 8-2

[09:20] Team_075 possession (Score: 8-2)
FOUL! Reach-in foul on Shaquille Booker during the drive. [Team fouls: 1] No free throws, side out. (Shaquille Booker: 1 personal fouls)

[09:03] Team_075 possession (Score: 8-2)
Kawhi Ingram attempts a Midrange. Contested by Shaquille Booker (5.7 feet, ZONE). Kawhi Ingram misses. Rebound secured by RJ Nowitzki.

[08:51] Team_012 possession (Score: 8-2)
Ayo McGrady attempts a Layup. Heavily contested by Derrick Stewart (0.5 feet, ZONE)! AYO MCGRADY MAKES IT! Assist: Paolo Durant
Score: 10-2

[08:40] Team_075 possession (Score: 10-2)
Kawhi Ingram attempts a 3Pt. Contested by RJ Nowitzki (2.6 feet, MAN). Kawhi Ingram misses. Rebound secured by Paolo Durant.

[08:30] Team_012 possession (Score: 10-2)
Paolo Durant attempts a 3Pt. Heavily contested by Larry McCollum (1.5 feet, ZONE)! PAOLO DURANT MAKES IT! Assist: RJ Nowitzki
Score: 13-2

[08:20] Team_075 possession (Score: 13-2)
Larry McCollum attempts a 3Pt. Wide open! Pascal Herro is 6.8 feet away. [MAN] LARRY MCCOLLUM MAKES IT! Assist: Klay Jokic
Score: 13-5

[08:04] Team_012 possession (Score: 13-5)
Shaquille Booker attempts a 3Pt. Contested by Larry McCollum (4.9 feet, ZONE). Shaquille Booker misses. Offensive rebound by Paolo Durant! Paolo Durant puts it back in!
Score: 15-5

[07:53] Team_075 possession (Score: 15-5)
Kawhi Ingram attempts a Midrange. Contested by RJ Nowitzki (4.2 feet, MAN). KAWHI INGRAM MAKES IT! Assist: Myles Barrett
Score: 15-7

[07:41] Team_012 possession (Score: 15-7)
Paolo Durant attempts a Midrange. Contested by Derrick Stewart (2.8 feet, ZONE). Paolo Durant misses. Offensive rebound by RJ Nowitzki! RJ Nowitzki kicks it out.

[07:29] Team_012 possession (Score: 15-7)
Paolo Durant drives, picks up Derrick Stewart. Help arrives from Larry McCollum! Paolo Durant attempts a Dunk. Contested by Larry McCollum (4.6 feet, ZONE). Paolo Durant misses. Rebound secured by Klay Jokic.

[07:15] Team_075 possession (Score: 15-7)
Derrick Stewart drives, picks up Paolo Durant. Help arrives from RJ Nowitzki! Derrick Stewart attempts a Dunk. Contested by RJ Nowitzki (3.0 feet, MAN). DERRICK STEWART MAKES IT! Assist: Myles Barrett
Score: 15-9

[06:58] Team_012 possession (Score: 15-9)
Pascal Herro attempts a Midrange. Contested by Larry McCollum (4.1 feet, MAN). Pascal Herro misses. Rebound secured by Derrick Stewart.

[06:44] Team_075 possession (Score: 15-9)
Larry McCollum attempts a 3Pt. Contested by RJ Nowitzki (4.7 feet, ZONE). LARRY MCCOLLUM MAKES IT! Assist: Derrick Stewart
Score: 15-12

[06:27] Team_012 possession (Score: 15-12)
Paolo Durant throws a bad pass out of bounds! TURNOVER! (dead ball)

[06:17] Team_075 possession (Score: 15-12)
Kawhi Ingram attempts a Midrange. Contested by Paolo Durant (3.0 feet, ZONE). Kawhi Ingram misses. Rebound secured by Ayo McGrady.

[06:04] Team_012 possession (Score: 15-12)
Ayo McGrady drives to the basket... Ayo McGrady commits a violation (traveling/carry)! TURNOVER! (dead ball)

[05:51] Team_075 possession (Score: 15-12)
FOUL! Shooting foul on RJ Nowitzki. Kawhi Ingram to the line for 3 free throws. [Team fouls: 2] (RJ Nowitzki: 1 personal fouls)   FT 1/3: GOOD   FT 2/3: GOOD   FT 3/3: MISS Kawhi Ingram makes 2/3 from the line. Offensive rebound by Derrick Stewart! Derrick Stewart kicks it out.
Score: 15-14

[05:35] Team_075 possession (Score: 15-14)
FOUL! Reach-in foul on Pascal Herro during the drive. [Team fouls: 3] No free throws, side out. (Pascal Herro: 1 personal fouls)

[05:26] Team_075 possession (Score: 15-14)
Myles Barrett attempts a 3Pt. Contested by Shaquille Booker (5.6 feet, MAN). MYLES BARRETT MAKES IT! Assist: Larry McCollum
Score: 15-17

[05:11] Team_012 possession (Score: 15-17)
Ayo McGrady drives to the basket... Ayo McGrady throws a bad pass! Stolen by Klay Jokic! TURNOVER! (live ball)

[04:56] Team_075 possession (Score: 15-17)
Derrick Stewart attempts a 3Pt. Heavily contested by RJ Nowitzki (1.2 feet, ZONE)! Derrick Stewart misses. Rebound secured by RJ Nowitzki.

[04:37] Team_012 possession (Score: 15-17)
FOUL! Holding foul on Klay Jokic. [Team fouls: 2] No free throws, side out. (Klay Jokic: 1 personal fouls)

[04:18] Team_012 possession (Score: 15-17)
Paolo Durant drives and kicks out. RJ Nowitzki attempts a Midrange. Contested by Kawhi Ingram (3.8 feet, MAN). RJ NOWITZKI MAKES IT! Assist: Pascal Herro
Score: 17-17

[04:02] Team_075 possession (Score: 17-17)
FOUL! Shooting foul on Pascal Herro. Larry McCollum to the line for 3 free throws. [Team fouls: 4] (Pascal Herro: 2 personal fouls)   FT 1/3: GOOD   FT 2/3: GOOD   FT 3/3: MISS Larry McCollum makes 2/3 from the line. Rebound secured by Paolo Durant.
Score: 17-19

[03:45] Team_012 possession (Score: 17-19)
Ayo McGrady attempts a 3Pt. Wide open! Larry McCollum is 6.2 feet away. [ZONE] AYO MCGRADY MAKES IT! Assist: Pascal Herro
Score: 20-19

[03:32] Team_075 possession (Score: 20-19)
Larry McCollum drives and kicks out. Myles Barrett attempts a 3Pt. Wide open! RJ Nowitzki is 6.6 feet away. [ZONE] Myles Barrett misses. Rebound secured by RJ Nowitzki.

[03:15] Team_012 possession (Score: 20-19)
Pascal Herro attempts a 3Pt. Wide open! Larry McCollum is 7.7 feet away. [MAN] Pascal Herro misses. Rebound secured by Klay Jokic.

[03:01] Team_075 possession (Score: 20-19)
Derrick Stewart attempts a 3Pt. BLOCKED BY PAOLO DURANT! Ball is loose! Rebound secured by Ayo McGrady.

[02:46] Team_012 possession (Score: 20-19)
Ayo McGrady attempts a 3Pt. Contested by Klay Jokic (5.1 feet, MAN). Ayo McGrady misses. Offensive rebound by Paolo Durant! Paolo Durant's putback is no good. Offensive rebound by Paolo Durant! Paolo Durant kicks it out.

[02:32] Team_012 possession (Score: 20-19)
Shaquille Booker throws a bad pass out of bounds! TURNOVER! (dead ball)

[02:32] Substitution (Team_012): Pascal Herro OUT → Desmond Irving IN (stamina_rule2)

[02:32] Substitution (Team_012): RJ Nowitzki OUT → Jalen Barnes IN (stamina_rule2)

[02:32] Substitution (Team_012): Shaquille Booker OUT → Domantas Bird IN (stamina_rule2)

[02:32] Substitution (Team_012): Paolo Durant OUT → Jimmy Quickley IN (stamina_rule2)

[02:32] Substitution (Team_012): Ayo McGrady OUT → Karl Young IN (stamina_rule2)

[02:32] Substitution (Team_075): Larry McCollum OUT → D'Angelo Anunoby IN (stamina_rule2)

[02:32] Substitution (Team_075): Kawhi Ingram OUT → LeBron Ginobili IN (stamina_rule2)

[02:32] Substitution (Team_075): Myles Barrett OUT → Donovan Paul IN (stamina_rule2)

[02:32] Substitution (Team_075): Derrick Stewart OUT → Collin Duncan IN (stamina_rule2)

[02:32] Substitution (Team_075): Klay Jokic OUT → Kevin Towns IN (stamina_rule2)

[02:19] Team_075 possession (Score: 20-19)
LeBron Ginobili makes the Layup and draws the foul on Jalen Barnes! And-1! LeBron Ginobili to the line for 1. [BONUS: 5 team fouls] (Jalen Barnes: 1 personal fouls)   FT 1/1: MISS LeBron Ginobili makes 0/1 from the line. Rebound secured by Jimmy Quickley.
Score: 20-21

[02:07] Team_012 possession (Score: 20-21)
Desmond Irving attempts a 3Pt. Contested by D'Angelo Anunoby (6.0 feet, MAN). Desmond Irving misses. Rebound secured by Kevin Towns.

[01:56] Team_075 possession (Score: 20-21)
Collin Duncan drives to the basket... Collin Duncan throws a bad pass! Stolen by Jimmy Quickley! TURNOVER! (live ball)

[01:39] Team_012 possession (Score: 20-21)
FOUL! Reach-in foul on Collin Duncan during the drive. [Team fouls: 4] No free throws, side out. (Collin Duncan: 1 personal fouls)

[01:25] Team_012 possession (Score: 20-21)
Jalen Barnes drives to the basket... Jalen Barnes loses control! Ball rolls out of bounds! TURNOVER! (dead ball)

[01:09] Team_075 possession (Score: 20-21)
Kevin Towns attempts a 3Pt. Heavily contested by Karl Young (0.8 feet, MAN)! Kevin Towns misses. Offensive rebound by Collin Duncan! Collin Duncan kicks it out.

[00:51] Team_075 possession (Score: 20-21)
FOUL! Offensive foul on Donovan Paul! Domantas Bird drew the charge! [Team fouls: 5] (Donovan Paul: 1 personal fouls) TURNOVER! (dead ball)

[00:37] Team_012 possession (Score: 20-21)
Jalen Barnes attempts a 3Pt. Contested by LeBron Ginobili (3.1 feet, MAN). Jalen Barnes misses. Rebound secured by D'Angelo Anunoby.

[00:19] Team_075 possession (Score: 20-21)
LeBron Ginobili drives to the basket... LeBron Ginobili commits a violation (traveling/carry)! TURNOVER! (dead ball)

[00:03] Team_012 possession (Score: 20-21)
Desmond Irving drives, D'Angelo Anunoby stays with him. Desmond Irving attempts a Dunk. Contested by D'Angelo Anunoby (3.1 feet, MAN). Desmond Irving misses. Rebound secured by Kevin Towns.

================================================================================
                              1ST QUARTER COMPLETE                              
================================================================================

1ST QUARTER SCORE: Team_012 20, Team_075 21

BOX SCORE:
================================================================================

Team_012
--------------------------------------------------------------------------------
Player                MIN  PTS  REB  AST  TO      FG   FG%      3P   3P%
--------------------------------------------------------------------------------
Ayo McGrady            10    7    2    0   0   3/3   100.0     0/0   0.0
Paolo Durant           10    5    4    3   0   2/3    66.7     0/0   0.0
Pascal Herro           10    3    0    2   0   1/3    33.3     0/0   0.0
Shaquille Booker       10    3    0    0   0   1/1   100.0     0/0   0.0
RJ Nowitzki            10    2    6    2   0   1/1   100.0     0/0   0.0
Jimmy Quickley          2    0    1    0   0   0/0     0.0     0/0   0.0
Desmond Irving          2    0    0    0   0   0/2     0.0     0/0   0.0
Jalen Barnes            2    0    0    0   0   0/1     0.0     0/0   0.0

TEAM: FG: 8/14 (57.1%), 3PT: 5/8 (62.5%), REB: 13 (5 off, 8 def), AST: 7, TO: 6
TEAM FOULS: 5 [Team_075 in BONUS]


Team_075
--------------------------------------------------------------------------------
Player                MIN  PTS  REB  AST  TO      FG   FG%      3P   3P%
--------------------------------------------------------------------------------
Larry McCollum         10    6    0    1   0   2/4    50.0     0/0   0.0
Myles Barrett          10    3    0    2   0   1/1   100.0     0/0   0.0
Derrick Stewart        10    2    3    1   0   1/3    33.3     0/0   0.0
Kawhi Ingram           10    2    1    0   0   1/4    25.0     0/0   0.0
Klay Jokic             10    2    2    1   0   1/1   100.0     0/0   0.0
LeBron Ginobili         2    0    0    0   0   0/1     0.0     0/0   0.0
Kevin Towns             2    0    2    0   0   0/0     0.0     0/0   0.0
Collin Duncan           2    0    1    0   0   0/0     0.0     0/0   0.0
D'Angelo Anunoby        2    0    1    0   0   0/0     0.0     0/0   0.0

TEAM: FG: 6/14 (42.9%), 3PT: 3/7 (42.9%), REB: 10 (4 off, 6 def), AST: 5, TO: 5
TEAM FOULS: 5 [Team_012 in BONUS]

================================================================================

================================================================================
                       2ND QUARTER - Team_012 vs Team_075                       
================================================================================

[12:00] Team_012 possession (Score: 20-21)
Paolo Durant attempts a Midrange. Wide open! Derrick Stewart is 9.2 feet away. [MAN] Paolo Durant misses. Rebound secured by Kawhi Ingram.

[11:45] Team_075 possession (Score: 20-21)
Myles Barrett attempts a Midrange. Heavily contested by Shaquille Booker (1.9 feet, MAN)! MYLES BARRETT MAKES IT!
Score: 20-23

[11:30] Team_012 possession (Score: 20-23)
FOUL! Offensive foul on Shaquille Booker! Myles Barrett drew the charge! [Team fouls: 1] (Shaquille Booker: 1 personal fouls) TURNOVER! (dead ball)

[11:14] Team_075 possession (Score: 20-23)
Derrick Stewart drives, Paolo Durant stays with him. Derrick Stewart attempts a Dunk. Contested by Paolo Durant (4.5 feet, MAN). Derrick Stewart misses. Rebound secured by RJ Nowitzki.

[10:56] Team_012 possession (Score: 20-23)
Pascal Herro drives and kicks out. Shaquille Booker attempts a Midrange. Wide open! Myles Barrett is 6.8 feet away. [MAN] Shaquille Booker misses. Rebound secured by Klay Jokic.

[10:37] Team_075 possession (Score: 20-23)
Kawhi Ingram drives, Paolo Durant stays with him. Kawhi Ingram attempts a Layup. Contested by Paolo Durant (3.5 feet, ZONE). Kawhi Ingram misses. Rebound secured by Ayo McGrady.

[10:27] Team_012 possession (Score: 20-23)
FOUL! Shooting foul on Larry McCollum. Pascal Herro to the line for 2 free throws. [Team fouls: 1] (Larry McCollum: 1 personal fouls)   FT 1/2: GOOD   FT 2/2: GOOD Pascal Herro makes 2/2 from the line.
Score: 22-23

[10:10] Team_075 possession (Score: 22-23)
Derrick Stewart attempts a Midrange. Contested by Shaquille Booker (4.6 feet, ZONE). Derrick Stewart misses. Rebound secured by Ayo McGrady.

[09:56] Team_012 possession (Score: 22-23)
Ayo McGrady attempts a Midrange. Contested by Klay Jokic (5.7 feet, MAN). Ayo McGrady misses. Rebound secured by Derrick Stewart.

[09:40] Team_075 possession (Score: 22-23)
Klay Jokic drives and kicks out. FOUL! Shooting foul on RJ Nowitzki. Kawhi Ingram to the line for 2 free throws. [Team fouls: 2] (RJ Nowitzki: 1 personal fouls)   FT 1/2: GOOD   FT 2/2: GOOD Kawhi Ingram makes 2/2 from the line.
Score: 22-25

[09:22] Team_012 possession (Score: 22-25)
Ayo McGrady drives, picks up Klay Jokic. Help arrives from Larry McCollum! Ayo McGrady attempts a Layup. Wide open! Larry McCollum is 9.7 feet away. [ZONE] AYO MCGRADY MAKES IT! Assist: Pascal Herro
Score: 24-25

[09:07] Team_075 possession (Score: 24-25)
Larry McCollum attempts a Midrange. Contested by Pascal Herro (5.2 feet, MAN). LARRY MCCOLLUM MAKES IT!
Score: 24-27

[08:52] Team_012 possession (Score: 24-27)
Pascal Herro drives and kicks out. RJ Nowitzki attempts a 3Pt. Wide open! Kawhi Ingram is 7.5 feet away. [MAN] RJ Nowitzki misses. Rebound secured by Derrick Stewart.

[08:37] Team_075 possession (Score: 24-27)
Larry McCollum drives, picks up Pascal Herro. Help arrives from RJ Nowitzki! Larry McCollum attempts a Dunk. Contested by RJ Nowitzki (2.4 feet, MAN). LARRY MCCOLLUM MAKES IT!
Score: 24-29

[08:23] Team_012 possession (Score: 24-29)
FOUL! Holding foul on Larry McCollum. [Team fouls: 2] No free throws, side out. (Larry McCollum: 2 personal fouls)

[08:11] Team_012 possession (Score: 24-29)
RJ Nowitzki attempts a 3Pt. Wide open! Kawhi Ingram is 6.3 feet away. [MAN] RJ Nowitzki misses. FOUL! Loose ball foul on Derrick Stewart during the rebound battle. [Team fouls: 3] No free throws, side out. (Derrick Stewart: 1 personal fouls)

[07:54] Team_012 possession (Score: 24-29)
Shaquille Booker attempts a Midrange. Contested by Myles Barrett (4.9 feet, MAN). SHAQUILLE BOOKER MAKES IT!
Score: 26-29

[07:39] Team_075 possession (Score: 26-29)
Larry McCollum attempts a Layup. Contested by Pascal Herro (3.7 feet, MAN). Larry McCollum misses. Rebound secured by RJ Nowitzki.

[07:25] Team_012 possession (Score: 26-29)
FOUL! Holding foul on Kawhi Ingram. [Team fouls: 4] No free throws, side out. (Kawhi Ingram: 1 personal fouls)

[07:12] Team_012 possession (Score: 26-29)
FOUL! Reach-in foul on Klay Jokic during the drive. [IN THE BONUS! 5 team fouls] Ayo McGrady to the line for 2 free throws. (Klay Jokic: 1 personal fouls)   FT 1/2: GOOD   FT 2/2: GOOD Ayo McGrady makes 2/2 from the line.
Score: 28-29

[07:00] Team_075 possession (Score: 28-29)
Derrick Stewart attempts a Midrange. Contested by Paolo Durant (2.9 feet, MAN). Derrick Stewart misses. Rebound secured by Ayo McGrady.

[06:47] Team_012 possession (Score: 28-29)
Pascal Herro drives, Klay Jokic stays with him. Pascal Herro attempts a Dunk. Contested by Klay Jokic (4.0 feet, ZONE). Pascal Herro misses. Rebound secured by Klay Jokic.

[06:32] Team_075 possession (Score: 28-29)
Derrick Stewart attempts a Layup. Contested by Paolo Durant (3.6 feet, ZONE). DERRICK STEWART MAKES IT!
Score: 28-31

[06:19] Team_012 possession (Score: 28-31)
FOUL! Reach-in foul on Derrick Stewart during the drive. [IN THE BONUS! 6 team fouls] RJ Nowitzki to the line for 2 free throws. (Derrick Stewart: 2 personal fouls)   FT 1/2: GOOD   FT 2/2: MISS RJ Nowitzki makes 1/2 from the line. Rebound secured by Kawhi Ingram.
Score: 29-31

[06:05] Team_075 possession (Score: 29-31)
Kawhi Ingram attempts a 3Pt. Contested by RJ Nowitzki (3.1 feet, MAN). Kawhi Ingram misses. Rebound secured by RJ Nowitzki.

[05:55] Team_012 possession (Score: 29-31)
RJ Nowitzki attempts a 3Pt. Contested by Larry McCollum (5.8 feet, ZONE). RJ Nowitzki misses. Rebound secured by Kawhi Ingram.

[05:44] Team_075 possession (Score: 29-31)
Myles Barrett attempts a 3Pt. Heavily contested by RJ Nowitzki (1.6 feet, ZONE)! Myles Barrett misses. Offensive rebound by Derrick Stewart! Derrick Stewart kicks it out.

[05:28] Team_075 possession (Score: 29-31)
Myles Barrett attempts a Midrange. Wide open! Shaquille Booker is 6.6 feet away. [ZONE] Myles Barrett misses. Rebound secured by Paolo Durant.

[05:18] Team_012 possession (Score: 29-31)
Paolo Durant drives, Derrick Stewart stays with him. Paolo Durant attempts a Dunk. Wide open! Derrick Stewart is 6.1 feet away. [ZONE] PAOLO DURANT MAKES IT! Assist: RJ Nowitzki
Score: 31-31

[04:59] Team_075 possession (Score: 31-31)
Larry McCollum drives and kicks out. Derrick Stewart attempts a 3Pt. Contested by Paolo Durant (4.2 feet, MAN). Derrick Stewart misses. Rebound secured by RJ Nowitzki.

[04:43] Team_012 possession (Score: 31-31)
FOUL! Reach-in foul on Myles Barrett during the drive. [IN THE BONUS! 7 team fouls] Shaquille Booker to the line for 2 free throws. (Myles Barrett: 1 personal fouls)   FT 1/2: GOOD   FT 2/2: GOOD Shaquille Booker makes 2/2 from the line.
Score: 33-31

[04:25] Team_075 possession (Score: 33-31)
Larry McCollum attempts a Midrange. Contested by Pascal Herro (4.7 feet, MAN). LARRY MCCOLLUM MAKES IT! Assist: Derrick Stewart
Score: 33-33

[04:07] Team_012 possession (Score: 33-33)
Shaquille Booker drives, picks up Myles Barrett. Help arrives from Larry McCollum! Shaquille Booker attempts a Layup. Contested by Larry McCollum (4.6 feet, MAN). SHAQUILLE BOOKER MAKES IT!
Score: 35-33

[03:57] Team_075 possession (Score: 35-33)
FOUL! Shooting foul on Ayo McGrady. Klay Jokic to the line for 2 free throws. [Team fouls: 3] (Ayo McGrady: 1 personal fouls)   FT 1/2: GOOD   FT 2/2: GOOD Klay Jokic makes 2/2 from the line.
Score: 35-35

[03:46] Team_012 possession (Score: 35-35)
Shaquille Booker drives to the basket... Shaquille Booker loses the ball! Stripped by Derrick Stewart! TURNOVER! (live ball)

[03:30] Team_075 possession (Score: 35-35)
Klay Jokic makes the Layup and draws the foul on Ayo McGrady! And-1! Klay Jokic to the line for 1. [Team fouls: 4] (Ayo McGrady: 2 personal fouls)   FT 1/1: GOOD Klay Jokic makes 1/1 from the line.
Score: 35-38

[03:14] Team_012 possession (Score: 35-38)
Shaquille Booker makes the Layup and draws the foul on Derrick Stewart! And-1! Shaquille Booker to the line for 1. [BONUS: 8 team fouls] (Derrick Stewart: 3 personal fouls)   FT 1/1: GOOD Shaquille Booker makes 1/1 from the line.
Score: 38-38

[02:56] Team_075 possession (Score: 38-38)
Derrick Stewart attempts a Midrange. Wide open! Shaquille Booker is 6.5 feet away. [ZONE] DERRICK STEWART MAKES IT!
Score: 38-40

[02:40] Team_012 possession (Score: 38-40)
Ayo McGrady attempts a Layup. Contested by Derrick Stewart (4.1 feet, ZONE). AYO MCGRADY MAKES IT! Assist: RJ Nowitzki
Score: 40-40

[02:27] Team_075 possession (Score: 40-40)
Derrick Stewart attempts a Midrange. Contested by Shaquille Booker (3.8 feet, ZONE). Derrick Stewart misses. Offensive rebound by Kawhi Ingram! Kawhi Ingram kicks it out.

[02:16] Team_075 possession (Score: 40-40)
Klay Jokic attempts a Midrange. Contested by Paolo Durant (3.6 feet, ZONE). Klay Jokic misses. Rebound secured by RJ Nowitzki.

[02:01] Team_012 possession (Score: 40-40)
Ayo McGrady attempts a Midrange. Contested by Klay Jokic (4.4 feet, MAN). AYO MCGRADY MAKES IT! Assist: RJ Nowitzki
Score: 42-40

[01:47] Team_075 possession (Score: 42-40)
Larry McCollum attempts a 3Pt. Wide open! Pascal Herro is 9.7 feet away. [MAN] Larry McCollum misses. Rebound secured by Ayo McGrady.

[01:35] Team_012 possession (Score: 42-40)
Pascal Herro drives and kicks out. RJ Nowitzki attempts a Midrange. Wide open! Kawhi Ingram is 8.0 feet away. [ZONE] RJ NOWITZKI MAKES IT!
Score: 44-40

[01:22] Team_075 possession (Score: 44-40)
Derrick Stewart makes the Dunk and draws the foul on Paolo Durant! And-1! Derrick Stewart to the line for 1. [BONUS: 5 team fouls] (Paolo Durant: 1 personal fouls)   FT 1/1: GOOD Derrick Stewart makes 1/1 from the line.
Score: 44-43

[01:06] Team_012 possession (Score: 44-43)
Shaquille Booker attempts a 3Pt. Wide open! Myles Barrett is 10.0 feet away. [MAN] Shaquille Booker misses. Rebound secured by Klay Jokic.

[00:53] Team_075 possession (Score: 44-43)
Myles Barrett attempts a 3Pt. Contested by Shaquille Booker (4.3 feet, MAN). Myles Barrett misses. Rebound secured by Paolo Durant.

[00:38] Team_012 possession (Score: 44-43)
Pascal Herro attempts a Midrange. Wide open! Kawhi Ingram is 6.9 feet away. [ZONE] Pascal Herro misses. Rebound secured by Kawhi Ingram.

[00:28] Team_075 possession (Score: 44-43)
FOUL! Offensive foul on Larry McCollum! Pascal Herro drew the charge! [Team fouls: 9] (Larry McCollum: 3 personal fouls) TURNOVER! (dead ball)

[00:18] Team_012 possession (Score: 44-43)
RJ Nowitzki throws a bad pass out of bounds! TURNOVER! (dead ball)

[00:18] Substitution (Team_012): Pascal Herro OUT → Desmond Irving IN (stamina_rule2)

[00:18] Substitution (Team_012): RJ Nowitzki OUT → Jalen Barnes IN (stamina_rule2)

[00:18] Substitution (Team_012): Shaquille Booker OUT → Domantas Bird IN (stamina_rule2)

[00:18] Substitution (Team_012): Paolo Durant OUT → Jimmy Quickley IN (stamina_rule2)

[00:18] Substitution (Team_012): Ayo McGrady OUT → Karl Young IN (stamina_rule2)

[00:18] Substitution (Team_075): Larry McCollum OUT → D'Angelo Anunoby IN (stamina_rule2)

[00:18] Substitution (Team_075): Kawhi Ingram OUT → LeBron Ginobili IN (stamina_rule2)

[00:18] Substitution (Team_075): Myles Barrett OUT → Donovan Paul IN (stamina_rule2)

[00:18] Substitution (Team_075): Derrick Stewart OUT → Collin Duncan IN (stamina_rule2)

[00:18] Substitution (Team_075): Klay Jokic OUT → Kevin Towns IN (stamina_rule2)

[00:05] Team_075 possession (Score: 44-43)
LeBron Ginobili attempts a 3Pt. Wide open! Desmond Irving is 6.1 feet away. [ZONE] LeBron Ginobili misses. Offensive rebound by Collin Duncan! Collin Duncan kicks it out.

================================================================================
                              2ND QUARTER COMPLETE                              
================================================================================

2ND QUARTER SCORE: Team_012 24, Team_075 22

BOX SCORE:
================================================================================

Team_012
--------------------------------------------------------------------------------
Player                MIN  PTS  REB  AST  TO      FG   FG%      3P   3P%
--------------------------------------------------------------------------------
Shaquille Booker       22    9    0    0   0   4/5    80.0     0/0   0.0
Ayo McGrady            22    8    4    0   0   4/5    80.0     0/0   0.0
Paolo Durant           22    2    2    0   0   1/2    50.0     0/0   0.0
RJ Nowitzki            22    2    6    3   0   1/3    33.3     0/0   0.0
Pascal Herro           22    2    0    1   0   1/5    20.0     0/0   0.0

TEAM: FG: 11/20 (55.0%), 3PT: 0/2 (0.0%), REB: 12 (1 off, 11 def), AST: 4, TO: 3
TEAM FOULS: 5 [Team_075 in BONUS]


Team_075
--------------------------------------------------------------------------------
Player                MIN  PTS  REB  AST  TO      FG   FG%      3P   3P%
--------------------------------------------------------------------------------
Derrick Stewart        22    7    3    1   0   3/6    50.0     0/0   0.0
Larry McCollum         22    6    0    0   0   3/6    50.0     0/0   0.0
Klay Jokic             22    5    3    0   0   2/3    66.7     0/0   0.0
Kawhi Ingram           22    2    5    0   0   1/3    33.3     0/0   0.0
Myles Barrett          22    2    0    0   0   1/3    33.3     0/0   0.0
Collin Duncan           3    0    1    0   0   0/0     0.0     0/0   0.0

TEAM: FG: 10/21 (47.6%), 3PT: 0/3 (0.0%), REB: 12 (3 off, 9 def), AST: 1, TO: 1
TEAM FOULS: 9 [Team_012 in BONUS]

================================================================================

================================================================================
                       3RD QUARTER - Team_012 vs Team_075                       
================================================================================

[12:00] Team_012 possession (Score: 44-43)
Pascal Herro attempts a 3Pt. Contested by Larry McCollum (5.1 feet, ZONE). Pascal Herro misses. Offensive rebound by RJ Nowitzki! RJ Nowitzki kicks it out.

[11:47] Team_012 possession (Score: 44-43)
RJ Nowitzki attempts a Midrange. Wide open! Kawhi Ingram is 7.4 feet away. [MAN] RJ NOWITZKI MAKES IT!
Score: 46-43

[11:33] Team_075 possession (Score: 46-43)
Myles Barrett attempts a 3Pt. Contested by Shaquille Booker (5.4 feet, MAN). Myles Barrett misses. Rebound secured by Paolo Durant.

[11:16] Team_012 possession (Score: 46-43)
Paolo Durant attempts a 3Pt. Wide open! Larry McCollum is 7.9 feet away. [ZONE] Paolo Durant misses. Rebound secured by Klay Jokic.

[11:00] Team_075 possession (Score: 46-43)
Kawhi Ingram drives and kicks out. Larry McCollum attempts a 3Pt. Wide open! Pascal Herro is 6.3 feet away. [MAN] LARRY MCCOLLUM MAKES IT! Assist: Derrick Stewart
Score: 46-46

[10:45] Team_012 possession (Score: 46-46)
Ayo McGrady drives to the basket... Ayo McGrady loses control! Ball rolls out of bounds! TURNOVER! (dead ball)

[10:32] Team_075 possession (Score: 46-46)
Myles Barrett attempts a 3Pt. Contested by Shaquille Booker (4.6 feet, MAN). Myles Barrett misses. Offensive rebound by Kawhi Ingram! Kawhi Ingram kicks it out.

[10:17] Team_075 possession (Score: 46-46)
Kawhi Ingram drives and kicks out. Larry McCollum attempts a 3Pt. Contested by RJ Nowitzki (2.1 feet, ZONE). Larry McCollum misses. Rebound secured by Ayo McGrady.

[10:00] Team_012 possession (Score: 46-46)
FOUL! Reach-in foul on Derrick Stewart during the drive. [Team fouls: 1] No free throws, side out. (Derrick Stewart: 1 personal fouls)

[09:46] Team_012 possession (Score: 46-46)
Shaquille Booker drives, Derrick Stewart stays with him. Shaquille Booker attempts a Dunk. Contested by Derrick Stewart (4.4 feet, ZONE). SHAQUILLE BOOKER MAKES IT! Assist: RJ Nowitzki
Score: 48-46

[09:32] Team_075 possession (Score: 48-46)
Klay Jokic attempts a Midrange. Contested by Ayo McGrady (3.7 feet, MAN). Klay Jokic misses. Rebound secured by Ayo McGrady.

[09:17] Team_012 possession (Score: 48-46)
Paolo Durant attempts a Midrange. Contested by Kawhi Ingram (5.5 feet, ZONE). Paolo Durant misses. Offensive rebound by RJ Nowitzki! RJ Nowitzki kicks it out.

[09:03] Team_012 possession (Score: 48-46)
RJ Nowitzki drives, Derrick Stewart stays with him. RJ Nowitzki attempts a Dunk. Contested by Derrick Stewart (5.2 feet, ZONE). RJ NOWITZKI MAKES IT! Assist: Ayo McGrady
Score: 50-46

[08:52] Team_075 possession (Score: 50-46)
Derrick Stewart makes the Layup and draws the foul on Paolo Durant! And-1! Derrick Stewart to the line for 1. [Team fouls: 1] (Paolo Durant: 1 personal fouls)   FT 1/1: GOOD Derrick Stewart makes 1/1 from the line.
Score: 50-49

[08:36] Team_012 possession (Score: 50-49)
Ayo McGrady loses control! Ball rolls out of bounds! TURNOVER! (dead ball)

[08:22] Team_075 possession (Score: 50-49)
Kawhi Ingram attempts a Midrange. Contested by RJ Nowitzki (5.4 feet, MAN). Kawhi Ingram misses. Rebound secured by Paolo Durant.

[08:06] Team_012 possession (Score: 50-49)
Paolo Durant attempts a Midrange. Wide open! Derrick Stewart is 6.5 feet away. [MAN] Paolo Durant misses. Rebound secured by Kawhi Ingram.

[07:51] Team_075 possession (Score: 50-49)
Klay Jokic attempts a 3Pt. Contested by Ayo McGrady (5.4 feet, MAN). Klay Jokic misses. Rebound secured by Paolo Durant.

[07:39] Team_012 possession (Score: 50-49)
Pascal Herro attempts a Midrange. Contested by Kawhi Ingram (4.4 feet, ZONE). Pascal Herro misses. Rebound secured by Kawhi Ingram.

[07:26] Team_075 possession (Score: 50-49)
Larry McCollum attempts a 3Pt. Contested by Shaquille Booker (2.8 feet, ZONE). LARRY MCCOLLUM MAKES IT!
Score: 50-52

[07:10] Team_012 possession (Score: 50-52)
Paolo Durant attempts a Midrange. Wide open! Derrick Stewart is 6.7 feet away. [MAN] PAOLO DURANT MAKES IT!
Score: 52-52

[06:53] Team_075 possession (Score: 52-52)
Derrick Stewart attempts a Midrange. Contested by Paolo Durant (3.4 feet, MAN). Derrick Stewart misses. Offensive rebound by Kawhi Ingram! Kawhi Ingram kicks it out.

[06:37] Team_075 possession (Score: 52-52)
Kawhi Ingram drives to the basket... Kawhi Ingram throws a bad pass out of bounds! TURNOVER! (dead ball)

[06:18] Team_012 possession (Score: 52-52)
Paolo Durant drives, picks up Derrick Stewart. Help arrives from Larry McCollum! Paolo Durant attempts a Layup. Contested by Larry McCollum (3.0 feet, ZONE). PAOLO DURANT MAKES IT!
Score: 54-52

[06:05] Team_075 possession (Score: 54-52)
Klay Jokic makes the Midrange and draws the foul on Ayo McGrady! And-1! Klay Jokic to the line for 1. [Team fouls: 2] (Ayo McGrady: 1 personal fouls)   FT 1/1: MISS Klay Jokic makes 0/1 from the line. Rebound secured by Ayo McGrady.
Score: 54-54

[05:50] Team_012 possession (Score: 54-54)
Pascal Herro attempts a Midrange. Contested by Larry McCollum (6.0 feet, MAN). PASCAL HERRO MAKES IT! Assist: Ayo McGrady
Score: 56-54

[05:35] Team_075 possession (Score: 56-54)
Myles Barrett drives to the basket... Myles Barrett throws a bad pass out of bounds! TURNOVER! (dead ball)

[05:16] Team_012 possession (Score: 56-54)
RJ Nowitzki attempts a Layup. Wide open! Derrick Stewart is 6.1 feet away. [ZONE] RJ Nowitzki misses. Rebound secured by Klay Jokic.

[05:02] Team_075 possession (Score: 56-54)
Kawhi Ingram attempts a 3Pt. Contested by RJ Nowitzki (3.7 feet, MAN). Kawhi Ingram misses. Rebound secured by Paolo Durant.

[04:45] Team_012 possession (Score: 56-54)
Pascal Herro attempts a Layup. Contested by Derrick Stewart (3.5 feet, ZONE). Pascal Herro misses. Rebound secured by Kawhi Ingram.

[04:35] Team_075 possession (Score: 56-54)
Klay Jokic commits a violation (traveling/carry)! TURNOVER! (dead ball)

[04:17] Team_012 possession (Score: 56-54)
Shaquille Booker drives, picks up Derrick Stewart. Help arrives from Larry McCollum! Shaquille Booker attempts a Dunk. Contested by Larry McCollum (2.5 feet, ZONE). SHAQUILLE BOOKER MAKES IT!
Score: 58-54

[04:03] Team_075 possession (Score: 58-54)
Derrick Stewart attempts a 3Pt. Contested by Paolo Durant (4.2 feet, MAN). DERRICK STEWART MAKES IT! Assist: Klay Jokic
Score: 58-57

[03:50] Team_012 possession (Score: 58-57)
Shaquille Booker makes the Midrange and draws the foul on Myles Barrett! And-1! Shaquille Booker to the line for 1. [Team fouls: 2] (Myles Barrett: 1 personal fouls)   FT 1/1: MISS Shaquille Booker makes 0/1 from the line. Rebound secured by Klay Jokic.
Score: 60-57

[03:35] Team_075 possession (Score: 60-57)
Kawhi Ingram drives and kicks out. Klay Jokic attempts a Midrange. Contested by Pascal Herro (5.8 feet, ZONE). Klay Jokic misses. Rebound secured by Ayo McGrady.

[03:23] Team_012 possession (Score: 60-57)
Ayo McGrady attempts a Midrange. Wide open! Klay Jokic is 9.0 feet away. [MAN] Ayo McGrady misses. Rebound secured by Klay Jokic.

[03:09] Team_075 possession (Score: 60-57)
Myles Barrett drives and kicks out. Derrick Stewart attempts a Midrange. Contested by Paolo Durant (2.6 feet, MAN). Derrick Stewart misses. Offensive rebound by Kawhi Ingram! Kawhi Ingram kicks it out.

[02:58] Team_075 possession (Score: 60-57)
Derrick Stewart commits a violation (traveling/carry)! TURNOVER! (dead ball)

[02:58] Substitution (Team_012): Pascal Herro OUT → Desmond Irving IN (stamina_rule2)

[02:58] Substitution (Team_075): Kawhi Ingram OUT → LeBron Ginobili IN (stamina_rule2)

[02:40] Team_012 possession (Score: 60-57)
FOUL! Reach-in foul on Derrick Stewart during the drive. [Team fouls: 3] No free throws, side out. (Derrick Stewart: 2 personal fouls)

[02:25] Team_012 possession (Score: 60-57)
Shaquille Booker makes the Layup and draws the foul on Derrick Stewart! And-1! Shaquille Booker to the line for 1. [Team fouls: 4] (Derrick Stewart: 3 personal fouls)   FT 1/1: GOOD Shaquille Booker makes 1/1 from the line.
Score: 63-57

[02:13] Team_075 possession (Score: 63-57)
Myles Barrett attempts a 3Pt. Heavily contested by RJ Nowitzki (1.2 feet, ZONE)! Myles Barrett misses. Rebound secured by RJ Nowitzki.

[02:01] Team_012 possession (Score: 63-57)
RJ Nowitzki attempts a Layup. BLOCKED BY DERRICK STEWART! Ball goes out off Derrick Stewart. RJ Nowitzki's ball!

[01:47] Team_012 possession (Score: 63-57)
Desmond Irving drives, Derrick Stewart stays with him. Desmond Irving attempts a Dunk. Wide open! Derrick Stewart is 6.2 feet away. [ZONE] DESMOND IRVING MAKES IT! Assist: Ayo McGrady
Score: 65-57

[01:33] Team_075 possession (Score: 65-57)
LeBron Ginobili attempts a 3Pt. Wide open! RJ Nowitzki is 7.5 feet away. [ZONE] LEBRON GINOBILI MAKES IT! Assist: Larry McCollum
Score: 65-60

[01:18] Team_012 possession (Score: 65-60)
Paolo Durant drives to the basket... Paolo Durant throws a bad pass out of bounds! TURNOVER! (dead ball)

[01:18] Substitution (Team_012): RJ Nowitzki OUT → Jalen Barnes IN (stamina_rule2)

[01:18] Substitution (Team_012): Shaquille Booker OUT → Domantas Bird IN (stamina_rule2)

[01:18] Substitution (Team_012): Paolo Durant OUT → Jimmy Quickley IN (stamina_rule2)

[01:18] Substitution (Team_012): Ayo McGrady OUT → Karl Young IN (stamina_rule2)

[01:18] Substitution (Team_075): Larry McCollum OUT → D'Angelo Anunoby IN (stamina_rule2)

[01:18] Substitution (Team_075): Myles Barrett OUT → Donovan Paul IN (stamina_rule2)

[01:18] Substitution (Team_075): Derrick Stewart OUT → Collin Duncan IN (stamina_rule2)

[01:18] Substitution (Team_075): Klay Jokic OUT → Kevin Towns IN (stamina_rule2)

[01:05] Team_075 possession (Score: 65-60)
Collin Duncan attempts a 3Pt. Contested by Jimmy Quickley (5.8 feet, MAN). Collin Duncan misses. Rebound secured by Karl Young.

[00:48] Team_012 possession (Score: 65-60)
Jimmy Quickley attempts a Midrange. Contested by LeBron Ginobili (3.1 feet, ZONE). Jimmy Quickley misses. Rebound secured by Kevin Towns.

[00:33] Team_075 possession (Score: 65-60)
Donovan Paul attempts a 3Pt. Contested by Domantas Bird (5.1 feet, MAN). Donovan Paul misses. FOUL! Loose ball foul on Jimmy Quickley during the rebound battle. [Team fouls: 3] No free throws, side out. (Jimmy Quickley: 1 personal fouls)

[00:19] Team_075 possession (Score: 65-60)
LeBron Ginobili attempts a 3Pt. Contested by Desmond Irving (2.9 feet, ZONE). LeBron Ginobili misses. Rebound secured by Jimmy Quickley.

[00:07] Team_012 possession (Score: 65-60)
Jimmy Quickley attempts a Midrange. Wide open! Collin Duncan is 6.8 feet away. [MAN] JIMMY QUICKLEY MAKES IT!
Score: 67-60

================================================================================
                              3RD QUARTER COMPLETE                              
================================================================================

3RD QUARTER SCORE: Team_012 23, Team_075 17

BOX SCORE:
================================================================================

Team_012
--------------------------------------------------------------------------------
Player                MIN  PTS  REB  AST  TO      FG   FG%      3P   3P%
--------------------------------------------------------------------------------
Shaquille Booker       33    7    0    0   0   3/4    75.0     0/0   0.0
RJ Nowitzki            33    4    3    1   0   2/3    66.7     0/0   0.0
Paolo Durant           33    4    4    0   0   2/4    50.0     0/0   0.0
Pascal Herro           31    2    0    0   0   1/3    33.3     0/0   0.0
Desmond Irving          6    2    0    0   0   1/1   100.0     0/0   0.0
Jimmy Quickley          4    2    1    0   0   1/2    50.0     0/0   0.0
Ayo McGrady            33    0    4    3   0   0/1     0.0     0/0   0.0
Karl Young              4    0    1    0   0   0/0     0.0     0/0   0.0

TEAM: FG: 10/18 (55.6%), 3PT: 0/1 (0.0%), REB: 13 (2 off, 11 def), AST: 4, TO: 3
TEAM FOULS: 3


Team_075
--------------------------------------------------------------------------------
Player                MIN  PTS  REB  AST  TO      FG   FG%      3P   3P%
--------------------------------------------------------------------------------
Larry McCollum         33    6    0    1   0   2/2   100.0     0/0   0.0
Derrick Stewart        33    6    0    1   0   2/2   100.0     0/0   0.0
LeBron Ginobili         6    3    0    0   0   1/2    50.0     0/0   0.0
Myles Barrett          33    0    0    0   0   0/2     0.0     0/0   0.0
Klay Jokic             33    0    4    1   0   0/3     0.0     0/0   0.0
Kawhi Ingram           31    0    6    0   0   0/4     0.0     0/0   0.0
Collin Duncan           4    0    1    0   0   0/1     0.0     0/0   0.0
Kevin Towns             4    0    1    0   0   0/0     0.0     0/0   0.0

TEAM: FG: 5/16 (31.2%), 3PT: 3/9 (33.3%), REB: 12 (4 off, 8 def), AST: 3, TO: 4
TEAM FOULS: 4

================================================================================

================================================================================
                       4TH QUARTER - Team_012 vs Team_075                       
================================================================================

[12:00] Team_012 possession (Score: 67-60)
Paolo Durant drives to the basket... Paolo Durant loses the ball! Stripped by Derrick Stewart! TURNOVER! (live ball)

[11:45] Team_075 possession (Score: 67-60)
Derrick Stewart attempts a 3Pt. Contested by RJ Nowitzki (4.9 feet, ZONE). DERRICK STEWART MAKES IT! Assist: Myles Barrett
Score: 67-63

[11:32] Team_012 possession (Score: 67-63)
Paolo Durant attempts a Midrange. Wide open! Kawhi Ingram is 6.1 feet away. [ZONE] PAOLO DURANT MAKES IT!
Score: 69-63

[11:17] Team_075 possession (Score: 69-63)
Larry McCollum attempts a Midrange. Wide open! RJ Nowitzki is 7.7 feet away. [ZONE] Larry McCollum misses. Rebound secured by Paolo Durant.

[11:02] Team_012 possession (Score: 69-63)
FOUL! Holding foul on Derrick Stewart. [Team fouls: 1] No free throws, side out. (Derrick Stewart: 1 personal fouls)

[10:46] Team_012 possession (Score: 69-63)
Ayo McGrady throws a bad pass! Stolen by Klay Jokic! TURNOVER! (live ball)

[10:26] Team_075 possession (Score: 69-63)
FOUL! Shooting foul on Paolo Durant. Derrick Stewart to the line for 2 free throws. [Team fouls: 1] (Paolo Durant: 1 personal fouls)   FT 1/2: GOOD   FT 2/2: GOOD Derrick Stewart makes 2/2 from the line.
Score: 69-65

[10:12] Team_012 possession (Score: 69-65)
Shaquille Booker attempts a 3Pt. Wide open! Myles Barrett is 6.2 feet away. [MAN] SHAQUILLE BOOKER MAKES IT!
Score: 72-65

[09:56] Team_075 possession (Score: 72-65)
Larry McCollum attempts a Layup. Contested by Pascal Herro (3.2 feet, MAN). LARRY MCCOLLUM MAKES IT!
Score: 72-67

[09:42] Team_012 possession (Score: 72-67)
RJ Nowitzki attempts a 3Pt. Contested by Kawhi Ingram (4.2 feet, MAN). RJ Nowitzki misses. Rebound secured by Kawhi Ingram.

[09:28] Team_075 possession (Score: 72-67)
Kawhi Ingram attempts a Layup. Contested by Paolo Durant (4.8 feet, ZONE). KAWHI INGRAM MAKES IT! Assist: Klay Jokic
Score: 72-69

[09:14] Team_012 possession (Score: 72-69)
Pascal Herro drives, picks up Derrick Stewart. Help arrives from Larry McCollum! Pascal Herro attempts a Dunk. Contested by Larry McCollum (3.7 feet, ZONE). PASCAL HERRO MAKES IT! Assist: RJ Nowitzki
Score: 74-69

[09:02] Team_075 possession (Score: 74-69)
Myles Barrett attempts a Midrange. Contested by Ayo McGrady (5.7 feet, ZONE). MYLES BARRETT MAKES IT! Assist: Klay Jokic
Score: 74-71

[08:49] Team_012 possession (Score: 74-71)
Ayo McGrady attempts a Midrange. Contested by Klay Jokic (4.7 feet, MAN). Ayo McGrady misses. Rebound secured by Kawhi Ingram.

[08:30] Team_075 possession (Score: 74-71)
Derrick Stewart makes the Midrange and draws the foul on Paolo Durant! And-1! Derrick Stewart to the line for 1. [Team fouls: 2] (Paolo Durant: 2 personal fouls)   FT 1/1: GOOD Derrick Stewart makes 1/1 from the line.
Score: 74-74

[08:16] Team_012 possession (Score: 74-74)
Ayo McGrady drives to the basket... Ayo McGrady commits a violation (traveling/carry)! TURNOVER! (dead ball)

[08:16] Substitution (Team_012): Pascal Herro OUT → Desmond Irving IN (stamina_rule2)

[08:16] Substitution (Team_012): RJ Nowitzki OUT → Jalen Barnes IN (stamina_rule2)

[08:16] Substitution (Team_012): Shaquille Booker OUT → Domantas Bird IN (stamina_rule2)

[08:16] Substitution (Team_012): Paolo Durant OUT → Jimmy Quickley IN (stamina_rule2)

[08:16] Substitution (Team_012): Ayo McGrady OUT → Karl Young IN (stamina_rule2)

[08:16] Substitution (Team_075): Larry McCollum OUT → D'Angelo Anunoby IN (stamina_rule2)

[08:16] Substitution (Team_075): Kawhi Ingram OUT → LeBron Ginobili IN (stamina_rule2)

[08:16] Substitution (Team_075): Myles Barrett OUT → Donovan Paul IN (stamina_rule2)

[08:16] Substitution (Team_075): Derrick Stewart OUT → Collin Duncan IN (stamina_rule2)

[08:16] Substitution (Team_075): Klay Jokic OUT → Kevin Towns IN (stamina_rule2)

[08:00] Team_075 possession (Score: 74-74)
FOUL! Offensive foul on Collin Duncan! Jimmy Quickley drew the charge! [Team fouls: 2] (Collin Duncan: 1 personal fouls) TURNOVER! (dead ball)

[07:45] Team_012 possession (Score: 74-74)
FOUL! Shooting foul on Kevin Towns. Desmond Irving to the line for 2 free throws. [Team fouls: 3] (Kevin Towns: 1 personal fouls)   FT 1/2: GOOD   FT 2/2: GOOD Desmond Irving makes 2/2 from the line.
Score: 76-74

[07:32] Team_075 possession (Score: 76-74)
Kevin Towns attempts a Midrange. Contested by Karl Young (4.4 feet, MAN). Kevin Towns misses. Rebound secured by Karl Young.

[07:17] Team_012 possession (Score: 76-74)
Desmond Irving makes the Layup and draws the foul on Kevin Towns! And-1! Desmond Irving to the line for 1. [Team fouls: 4] (Kevin Towns: 2 personal fouls)   FT 1/1: GOOD Desmond Irving makes 1/1 from the line.
Score: 79-74

[06:59] Team_075 possession (Score: 79-74)
Kevin Towns makes the Layup and draws the foul on Karl Young! And-1! Kevin Towns to the line for 1. [Team fouls: 3] (Karl Young: 1 personal fouls)   FT 1/1: GOOD Kevin Towns makes 1/1 from the line.
Score: 79-77

[06:45] Team_012 possession (Score: 79-77)
Karl Young drives, picks up Kevin Towns. Help arrives from D'Angelo Anunoby! Karl Young attempts a Dunk. Contested by D'Angelo Anunoby (5.9 feet, MAN). Karl Young misses. Rebound secured by Collin Duncan.

[06:29] Team_075 possession (Score: 79-77)
LeBron Ginobili attempts a Midrange. Contested by Jalen Barnes (5.8 feet, MAN). LeBron Ginobili misses. Offensive rebound by Collin Duncan! Collin Duncan kicks it out.

[06:15] Team_075 possession (Score: 79-77)
Donovan Paul attempts a Layup. Contested by Domantas Bird (3.8 feet, MAN). DONOVAN PAUL MAKES IT!
Score: 79-79

[06:00] Team_012 possession (Score: 79-79)
Domantas Bird attempts a Midrange. Wide open! Donovan Paul is 6.6 feet away. [MAN] Domantas Bird misses. Rebound secured by D'Angelo Anunoby.

[05:47] Team_075 possession (Score: 79-79)
D'Angelo Anunoby attempts a Layup. Contested by Desmond Irving (2.6 feet, MAN). D'ANGELO ANUNOBY MAKES IT!
Score: 79-81

[05:29] Team_012 possession (Score: 79-81)
Domantas Bird attempts a Midrange. Wide open! Donovan Paul is 7.6 feet away. [MAN] DOMANTAS BIRD MAKES IT! Assist: Jimmy Quickley
Score: 81-81

[05:19] Team_075 possession (Score: 81-81)
LeBron Ginobili attempts a 3Pt. Wide open! Desmond Irving is 8.9 feet away. [ZONE] LeBron Ginobili misses. Rebound secured by Jimmy Quickley.

[05:06] Team_012 possession (Score: 81-81)
Jalen Barnes attempts a 3Pt. Wide open! LeBron Ginobili is 7.4 feet away. [MAN] JALEN BARNES MAKES IT! Assist: Domantas Bird
Score: 84-81

[04:51] Team_075 possession (Score: 84-81)
D'Angelo Anunoby throws a bad pass out of bounds! TURNOVER! (dead ball)

[04:34] Team_012 possession (Score: 84-81)
Jalen Barnes makes the Layup and draws the foul on Kevin Towns! And-1! Jalen Barnes to the line for 1. [BONUS: 5 team fouls] (Kevin Towns: 3 personal fouls)   FT 1/1: GOOD Jalen Barnes makes 1/1 from the line.
Score: 87-81

[04:19] Team_075 possession (Score: 87-81)
Kevin Towns attempts a 3Pt. Wide open! Desmond Irving is 7.9 feet away. [ZONE] Kevin Towns misses. Offensive rebound by Kevin Towns! Kevin Towns kicks it out.

[04:03] Team_075 possession (Score: 87-81)
FOUL! Shooting foul on Desmond Irving. D'Angelo Anunoby to the line for 2 free throws. [Team fouls: 4] (Desmond Irving: 1 personal fouls)   FT 1/2: MISS   FT 2/2: GOOD D'Angelo Anunoby makes 1/2 from the line.
Score: 87-82

[03:45] Team_012 possession (Score: 87-82)
Karl Young attempts a Midrange. Contested by Donovan Paul (4.1 feet, ZONE). Karl Young misses. Rebound secured by D'Angelo Anunoby.

[03:30] Team_075 possession (Score: 87-82)
D'Angelo Anunoby drives, Desmond Irving stays with him. D'Angelo Anunoby attempts a Layup. Contested by Desmond Irving (4.0 feet, MAN). D'Angelo Anunoby misses. Rebound secured by Jalen Barnes.

[03:17] Team_012 possession (Score: 87-82)
Domantas Bird attempts a Layup. Contested by Kevin Towns (4.3 feet, ZONE). DOMANTAS BIRD MAKES IT! Assist: Desmond Irving
Score: 89-82

[03:06] Team_075 possession (Score: 89-82)
LeBron Ginobili drives and kicks out. Kevin Towns attempts a 3Pt. Wide open! Karl Young is 7.4 feet away. [MAN] Kevin Towns misses. Rebound secured by Karl Young.

[02:53] Team_012 possession (Score: 89-82)
Karl Young attempts a Midrange. Contested by Donovan Paul (5.6 feet, ZONE). KARL YOUNG MAKES IT! Assist: Jimmy Quickley
Score: 91-82

[02:40] Team_075 possession (Score: 91-82)
Kevin Towns attempts a Midrange. Wide open! Jimmy Quickley is 8.8 feet away. [ZONE] Kevin Towns misses. Rebound secured by Karl Young.

[02:22] Team_012 possession (Score: 91-82)
Jimmy Quickley attempts a 3Pt. Contested by D'Angelo Anunoby (2.6 feet, ZONE). Jimmy Quickley misses. Rebound secured by Kevin Towns.

[02:08] Team_075 possession (Score: 91-82)
D'Angelo Anunoby attempts a 3Pt. Wide open! Desmond Irving is 6.3 feet away. [MAN] D'ANGELO ANUNOBY MAKES IT! Assist: Collin Duncan
Score: 91-85

[01:55] Team_012 possession (Score: 91-85)
Jimmy Quickley drives to the basket... FOUL! Offensive foul on Jimmy Quickley! Collin Duncan drew the charge! [Team fouls: 5] (Jimmy Quickley: 1 personal fouls) TURNOVER! (dead ball)

[01:42] Team_075 possession (Score: 91-85)
Donovan Paul attempts a 3Pt. Contested by Desmond Irving (2.5 feet, ZONE). Donovan Paul misses. Rebound secured by Karl Young.

[01:31] Team_012 possession (Score: 91-85)
Jimmy Quickley drives and kicks out. Jimmy Quickley attempts a 3Pt. Wide open! D'Angelo Anunoby is 6.2 feet away. [ZONE] JIMMY QUICKLEY MAKES IT! Assist: Jalen Barnes
Score: 94-85

[01:13] Team_075 possession (Score: 94-85)
D'Angelo Anunoby attempts a 3Pt. Contested by Desmond Irving (4.9 feet, MAN). D'Angelo Anunoby misses. Rebound secured by Karl Young.

[00:57] Team_012 possession (Score: 94-85)
Desmond Irving attempts a 3Pt. Contested by D'Angelo Anunoby (4.7 feet, ZONE). Desmond Irving misses. Rebound secured by Collin Duncan.

[00:45] Team_075 possession (Score: 94-85)
D'Angelo Anunoby drives, picks up Karl Young. Help arrives from Jalen Barnes! D'Angelo Anunoby attempts a Layup. Contested by Jalen Barnes (2.4 feet, ZONE). D'Angelo Anunoby misses. FOUL! Loose ball foul on Jalen Barnes during the rebound battle. [IN THE BONUS! 6 team fouls] Collin Duncan to the line for 2 free throws. (Jalen Barnes: 1 personal fouls)   FT 1/2: MISS   FT 2/2: GOOD Collin Duncan makes 1/2 from the line.
Score: 94-86

[00:27] Team_012 possession (Score: 94-86)
Karl Young drives, Kevin Towns stays with him. Karl Young attempts a Layup. Contested by Kevin Towns (4.2 feet, ZONE). KARL YOUNG MAKES IT! Assist: Domantas Bird
Score: 96-86

[00:11] Team_075 possession (Score: 96-86)
Donovan Paul attempts a Layup. Wide open! Domantas Bird is 9.9 feet away. [MAN] Donovan Paul misses. Rebound secured by Jalen Barnes.

================================================================================
                              4TH QUARTER COMPLETE                              
================================================================================

4TH QUARTER SCORE: Team_012 29, Team_075 26

BOX SCORE:
================================================================================

Team_012
--------------------------------------------------------------------------------
Player                MIN  PTS  REB  AST  TO      FG   FG%      3P   3P%
--------------------------------------------------------------------------------
Jalen Barnes           12    6    2    1   0   2/2   100.0     0/0   0.0
Desmond Irving         14    5    0    1   0   2/3    66.7     0/0   0.0
Karl Young             12    4    5    0   0   2/4    50.0     0/0   0.0
Domantas Bird          12    4    0    2   0   2/3    66.7     0/0   0.0
Shaquille Booker       37    3    0    0   0   1/1   100.0     0/0   0.0
Jimmy Quickley         12    3    1    2   0   1/2    50.0     0/0   0.0
Paolo Durant           37    2    1    0   0   1/1   100.0     0/0   0.0
Pascal Herro           35    2    0    0   0   1/1   100.0     0/0   0.0
RJ Nowitzki            37    0    0    1   0   0/1     0.0     0/0   0.0
Ayo McGrady            37    0    0    0   0   0/1     0.0     0/0   0.0

TEAM: FG: 12/19 (63.2%), 3PT: 2/5 (40.0%), REB: 9 (0 off, 9 def), AST: 7, TO: 4
TEAM FOULS: 6 [Team_075 in BONUS]


Team_075
--------------------------------------------------------------------------------
Player                MIN  PTS  REB  AST  TO      FG   FG%      3P   3P%
--------------------------------------------------------------------------------
Derrick Stewart        37    8    0    0   0   3/3   100.0     0/0   0.0
D'Angelo Anunoby       12    6    2    0   0   3/5    60.0     0/0   0.0
Kevin Towns            12    3    2    0   0   1/3    33.3     0/0   0.0
Myles Barrett          37    2    0    1   0   1/1   100.0     0/0   0.0
Larry McCollum         37    2    0    0   0   1/2    50.0     0/0   0.0
Kawhi Ingram           35    2    2    0   0   1/1   100.0     0/0   0.0
Donovan Paul           12    2    0    0   0   1/3    33.3     0/0   0.0
Collin Duncan          12    1    3    1   0   1/1   100.0     0/0   0.0
Klay Jokic             37    0    0    2   0   0/0     0.0     0/0   0.0
LeBron Ginobili        14    0    0    0   0   0/2     0.0     0/0   0.0

TEAM: FG: 12/21 (57.1%), 3PT: 2/5 (40.0%), REB: 9 (2 off, 7 def), AST: 4, TO: 2
TEAM FOULS: 5 [Team_012 in BONUS]

================================================================================

================================================================================
                               FULL GAME COMPLETE                               
================================================================================

FINAL SCORE: Team_012 96, Team_075 86

SCORING BY QUARTER:
--------------------------------------------------------------------------------
Team                     Q1     Q2     Q3     Q4    FINAL
--------------------------------------------------------------------------------
Team_012                 20     24     23     29       96
Team_075                 21     22     17     26       86
--------------------------------------------------------------------------------

FULL GAME BOX SCORE:
================================================================================

Team_012
--------------------------------------------------------------------------------
Player                MIN  PTS  REB  AST  TO      FG   FG%      3P   3P%      FT STL BLK
--------------------------------------------------------------------------------
RJ Nowitzki            37    8   15    7   1   2/6    33.3   0/2     0.0   1/2     0   0
Shaquille Booker       37   22    0    0   4  10/12   83.3   3/4    75.0   4/5     0   0
Paolo Durant           37   13   11    3   4   6/10   60.0   1/2    50.0   0/0     0   1
Ayo McGrady            37   15   10    3   3   7/10   70.0   1/1   100.0   2/2     0   0
Pascal Herro           35    9    0    3   1   5/13   38.5   1/2    50.0   2/2     0   0
Desmond Irving         14    7    0    1   3   3/6    50.0   0/2     0.0   3/3     0   0
Jalen Barnes           12    6    2    1   0   2/3    66.7   1/2    50.0   1/1     0   0
Domantas Bird          12    4    0    2   0   2/3    66.7   0/0     0.0   0/0     0   0
Jimmy Quickley         12    5    3    2   0   2/4    50.0   0/1     0.0   0/0     1   0
Karl Young             12    4    6    0   0   2/4    50.0   0/0     0.0   0/0     0   0

TEAM: FG: 41/71 (57.7%), 3PT: 7/16 (43.8%), REB: 47 (8 off, 39 def), AST: 22, TO: 16


Team_075
--------------------------------------------------------------------------------
Player                MIN  PTS  REB  AST  TO      FG   FG%      3P   3P%      FT STL BLK
--------------------------------------------------------------------------------
Larry McCollum         37   20    0    2   2   7/13   53.8   3/5    60.0   2/3     0   0
Myles Barrett          37    7    0    3   1   3/7    42.9   1/4    25.0   0/0     0   0
Derrick Stewart        37   23    6    3   1   9/14   64.3   2/4    50.0   5/5     2   1
Klay Jokic             37    7    9    4   3   4/8    50.0   0/1     0.0   3/4     2   0
Kawhi Ingram           35    6   14    0   0   3/12   25.0   0/3     0.0   4/5     0   0
LeBron Ginobili        14    3    0    0   1   1/5    20.0   1/3    33.3   0/1     0   0
D'Angelo Anunoby       12    6    3    0   2   4/6    66.7   1/2    50.0   1/2     0   0
Donovan Paul           12    2    0    0   1   1/3    33.3   0/1     0.0   0/0     0   0
Collin Duncan          12    1    6    1   1   0/1     0.0   0/1     0.0   1/2     0   0
Kevin Towns            12    3    5    0   0   1/3    33.3   0/0     0.0   1/1     0   0

TEAM: FG: 33/72 (45.8%), 3PT: 8/24 (33.3%), REB: 43 (13 off, 30 def), AST: 13, TO: 12

================================================================================
