================================================================================
                        FULL GAME - Team_078 vs Team_038                        
================================================================================

================================================================================
                       1ST QUARTER - Team_078 vs Team_038                       
================================================================================

[12:00] Team_078 possession (Score: 0-0)
Isaiah Simmons attempts a 3Pt. Wide open! DeMar Harris is 6.4 feet away. [MAN] ISAIAH SIMMONS MAKES IT! Assist: Kyrie Carter
Score: 3-0

[11:49] Team_038 possession (Score: 3-0)
Rudy Thompson attempts a 3Pt. Wide open! Jabari Barnes is 6.6 feet away. [MAN] Rudy Thompson misses. Rebound secured by Jabari Barrett.

[11:36] Team_078 possession (Score: 3-0)
Kyrie Carter drives and kicks out. Kyrie Carter attempts a Midrange. Contested by Malcolm Poole (5.0 feet, MAN). KYRIE CARTER MAKES IT!
Score: 5-0

[11:19] Team_038 possession (Score: 5-0)
Luka Barnes attempts a Layup. BLOCKED BY KYRIE CARTER! Ball is loose! Rebound secured by Jabari Barrett.

[11:05] Team_078 possession (Score: 5-0)
Jabari Barrett drives, Tracy LaVine stays with him. Jabari Barrett attempts a Dunk. Heavily contested by Tracy LaVine (1.9 feet, ZONE)! Jabari Barrett misses. Rebound secured by Luka Barnes.

[10:56] Team_038 possession (Score: 5-0)
Malcolm Poole attempts a 3Pt. Contested by Kyrie Carter (3.0 feet, MAN). Malcolm Poole misses. Rebound secured by Isaiah Simmons.

[10:39] Team_078 possession (Score: 5-0)
Jabari Barnes commits a violation (traveling/carry)! TURNOVER! (dead ball)

[10:24] Team_038 possession (Score: 5-0)
Tracy LaVine makes the Dunk and draws the foul on Jabari Barrett! And-1! Tracy LaVine to the line for 1. [Team fouls: 1] (Jabari Barrett: 1 personal fouls)   FT 1/1: MISS Tracy LaVine makes 0/1 from the line. Rebound secured by Jabari Barrett.
Score: 5-2

[10:07] Team_078 possession (Score: 5-2)
Isaiah Simmons attempts a 3Pt. Contested by Malcolm Poole (3.5 feet, ZONE). Isaiah Simmons misses. Offensive rebound by Jabari Barrett! Jabari Barrett kicks it out.

[09:55] Team_078 possession (Score: 5-2)
Isaiah Simmons attempts a Midrange. Contested by Tracy LaVine (5.5 feet, ZONE). ISAIAH SIMMONS MAKES IT!
Score: 7-2

[09:38] Team_038 possession (Score: 7-2)
Luka Barnes attempts a Midrange. Wide open! Jabari Barrett is 7.4 feet away. [MAN] LUKA BARNES MAKES IT!
Score: 7-4

[09:26] Team_078 possession (Score: 7-4)
Jabari Barnes attempts a Midrange. Contested by Tracy LaVine (5.7 feet, ZONE). JABARI BARNES MAKES IT! Assist: Ben Ginobili
Score: 9-4

[09:13] Team_038 possession (Score: 9-4)
Tracy LaVine attempts a 3Pt. Heavily contested by Isaiah Simmons (0.9 feet, ZONE)! TRACY LAVINE MAKES IT! Assist: DeMar Harris
Score: 9-7

[08:59] Team_078 possession (Score: 9-7)
Jabari Barrett throws a bad pass out of bounds! TURNOVER! (dead ball)

[08:46] Team_038 possession (Score: 9-7)
Malcolm Poole attempts a Layup. Contested by Jabari Barrett (3.3 feet, ZONE). Malcolm Poole misses. Rebound secured by Isaiah Simmons.

[08:29] Team_078 possession (Score: 9-7)
Isaiah Simmons drives, DeMar Harris stays with him. Isaiah Simmons attempts a Layup. Contested by DeMar Harris (3.4 feet, MAN). ISAIAH SIMMONS MAKES IT! Assist: Jabari Barnes
Score: 11-7

[08:15] Team_038 possession (Score: 11-7)
Rudy Thompson attempts a 3Pt. Contested by Isaiah Simmons (3.5 feet, ZONE). Rudy Thompson misses. Offensive rebound by Tracy LaVine! Tracy LaVine's putback is no good. Rebound secured by Isaiah Simmons.

[08:00] Team_078 possession (Score: 11-7)
Kyrie Carter attempts a 3Pt. Contested by Malcolm Poole (3.2 feet, MAN). Kyrie Carter misses. Rebound secured by Luka Barnes.

[07:48] Team_038 possession (Score: 11-7)
Luka Barnes attempts a Layup. Contested by Jabari Barrett (2.1 feet, MAN). Luka Barnes misses. Rebound secured by Jabari Barrett.

[07:37] Team_078 possession (Score: 11-7)
FOUL! Holding foul on Luka Barnes. [Team fouls: 1] No free throws, side out. (Luka Barnes: 1 personal fouls)

[07:23] Team_078 possession (Score: 11-7)
Ben Ginobili attempts a 3Pt. Contested by Rudy Thompson (2.5 feet, ZONE). Ben Ginobili misses. Offensive rebound by Jabari Barrett! Jabari Barrett kicks it out.

[07:07] Team_078 possession (Score: 11-7)
Jabari Barnes attempts a 3Pt. Contested by Rudy Thompson (2.7 feet, MAN). Jabari Barnes misses. Rebound secured by Tracy LaVine.

[06:52] Team_038 possession (Score: 11-7)
Rudy Thompson attempts a Layup. Heavily contested by Jabari Barnes (1.3 feet, MAN)! Rudy Thompson misses. Rebound secured by Ben Ginobili.

[06:35] Team_078 possession (Score: 11-7)
Ben Ginobili makes the Layup and draws the foul on Tracy LaVine! And-1! Ben Ginobili to the line for 1. [Team fouls: 2] (Tracy LaVine: 1 personal fouls)   FT 1/1: MISS Ben Ginobili makes 0/1 from the line. FOUL! Loose ball foul on Tracy LaVine during the free throw rebound! [Team fouls: 3] No free throws, side out. (Tracy LaVine: 2 personal fouls)
Score: 13-7

[06:17] Team_078 possession (Score: 13-7)
Isaiah Simmons attempts a 3Pt. Contested by DeMar Harris (4.0 feet, MAN). ISAIAH SIMMONS MAKES IT!
Score: 16-7

[06:03] Team_038 possession (Score: 16-7)
Rudy Thompson attempts a Midrange. Contested by Jabari Barnes (4.9 feet, MAN). Rudy Thompson misses. Offensive rebound by Tracy LaVine! Tracy LaVine's putback is no good. Rebound secured by Jabari Barrett.

[05:48] Team_078 possession (Score: 16-7)
Ben Ginobili attempts a 3Pt. Contested by Tracy LaVine (2.4 feet, MAN). BEN GINOBILI MAKES IT! Assist: Jabari Barnes
Score: 19-7

[05:35] Team_038 possession (Score: 19-7)
Rudy Thompson drives and kicks out. Tracy LaVine attempts a 3Pt. Contested by Ben Ginobili (4.7 feet, MAN). TRACY LAVINE MAKES IT! Assist: DeMar Harris
Score: 19-10

[05:18] Team_078 possession (Score: 19-10)
Jabari Barrett drives and kicks out. Jabari Barrett attempts a 3Pt. Contested by DeMar Harris (2.3 feet, ZONE). JABARI BARRETT MAKES IT! Assist: Isaiah Simmons
Score: 22-10

[05:06] Team_038 possession (Score: 22-10)
Tracy LaVine makes the Dunk and draws the foul on Ben Ginobili! And-1! Tracy LaVine to the line for 1. [Team fouls: 2] (Ben Ginobili: 1 personal fouls)   FT 1/1: GOOD Tracy LaVine makes 1/1 from the line.
Score: 22-13

[04:50] Team_078 possession (Score: 22-13)
Kyrie Carter attempts a 3Pt. Contested by Malcolm Poole (3.3 feet, MAN). KYRIE CARTER MAKES IT! Assist: Ben Ginobili
Score: 25-13

[04:35] Team_038 possession (Score: 25-13)
FOUL! Shooting foul on Jabari Barrett. Tracy LaVine to the line for 2 free throws. [Team fouls: 3] (Jabari Barrett: 2 personal fouls)   FT 1/2: GOOD   FT 2/2: MISS Tracy LaVine makes 1/2 from the line. Rebound secured by Ben Ginobili.
Score: 25-14

[04:20] Team_078 possession (Score: 25-14)
Kyrie Carter attempts a 3Pt. Heavily contested by DeMar Harris (1.4 feet, ZONE)! Kyrie Carter misses. Rebound secured by Luka Barnes.

[04:06] Team_038 possession (Score: 25-14)
Luka Barnes attempts a Layup. Wide open! Jabari Barrett is 6.6 feet away. [ZONE] LUKA BARNES MAKES IT!
Score: 25-16

[03:56] Team_078 possession (Score: 25-16)
Jabari Barrett attempts a Layup. Contested by Tracy LaVine (4.6 feet, ZONE). JABARI BARRETT MAKES IT! Assist: Jabari Barnes
Score: 27-16

[03:38] Team_038 possession (Score: 27-16)
Rudy Thompson attempts a Midrange. Contested by Isaiah Simmons (4.1 feet, ZONE). RUDY THOMPSON MAKES IT!
Score: 27-18

[03:19] Team_078 possession (Score: 27-18)
FOUL! Holding foul on Malcolm Poole. [Team fouls: 4] No free throws, side out. (Malcolm Poole: 1 personal fouls)

[03:05] Team_078 possession (Score: 27-18)
Jabari Barnes attempts a 3Pt. Contested by Rudy Thompson (5.6 feet, MAN). Jabari Barnes misses. Rebound secured by DeMar Harris.

[02:47] Team_038 possession (Score: 27-18)
Rudy Thompson attempts a 3Pt. Wide open! Jabari Barnes is 8.1 feet away. [MAN] RUDY THOMPSON MAKES IT! Assist: Malcolm Poole
Score: 27-21

[02:34] Team_078 possession (Score: 27-21)
Jabari Barrett drives and kicks out. Jabari Barrett attempts a Midrange. Wide open! Malcolm Poole is 6.9 feet away. [ZONE] JABARI BARRETT MAKES IT!
Score: 29-21

[02:22] Team_038 possession (Score: 29-21)
Rudy Thompson attempts a 3Pt. Wide open! Jabari Barnes is 7.6 feet away. [MAN] Rudy Thompson misses. Rebound secured by Ben Ginobili.

[02:07] Team_078 possession (Score: 29-21)
Kyrie Carter attempts a 3Pt. Wide open! Malcolm Poole is 10.0 feet away. [MAN] KYRIE CARTER MAKES IT! Assist: Isaiah Simmons
Score: 32-21

[01:52] Team_038 possession (Score: 32-21)
Malcolm Poole drives and kicks out. Luka Barnes attempts a Midrange. Heavily contested by Kyrie Carter (0.5 feet, ZONE)! Luka Barnes misses. Rebound secured by Ben Ginobili.

[01:32] Team_078 possession (Score: 32-21)
Isaiah Simmons attempts a 3Pt. Contested by Rudy Thompson (3.4 feet, ZONE). Isaiah Simmons misses. Rebound secured by Luka Barnes.

[01:18] Team_038 possession (Score: 32-21)
Tracy LaVine attempts a Midrange. Wide open! Ben Ginobili is 6.1 feet away. [MAN] TRACY LAVINE MAKES IT!
Score: 32-23

[01:05] Team_078 possession (Score: 32-23)
FOUL! Shooting foul on Tracy LaVine. Jabari Barrett to the line for 2 free throws. [BONUS: 5 team fouls] (Tracy LaVine: 3 personal fouls)   FT 1/2: GOOD   FT 2/2: GOOD Jabari Barrett makes 2/2 from the line.
Score: 34-23

[00:55] Team_038 possession (Score: 34-23)
Rudy Thompson drives, Jabari Barnes stays with him. Rudy Thompson attempts a Dunk. Heavily contested by Jabari Barnes (0.5 feet, MAN)! Rudy Thompson misses. Rebound secured by Isaiah Simmons.

[00:41] Team_078 possession (Score: 34-23)
Jabari Barrett drives, Tracy LaVine stays with him. Jabari Barrett attempts a Layup. Wide open! Tracy LaVine is 6.4 feet away. [ZONE] JABARI BARRETT MAKES IT! Assist: Ben Ginobili
Score: 36-23

[00:26] Team_038 possession (Score: 36-23)
DeMar Harris attempts a Layup. Contested by Isaiah Simmons (2.4 feet, MAN). DEMAR HARRIS MAKES IT! Assist: Luka Barnes
Score: 36-25

[00:10] Team_078 possession (Score: 36-25)
Jabari Barrett attempts a Midrange. Contested by Tracy LaVine (3.3 feet, ZONE). Jabari Barrett misses. Rebound secured by Tracy LaVine.

================================================================================
                              1ST QUARTER COMPLETE                              
================================================================================

1ST QUARTER SCORE: Team_078 36, Team_038 25

BOX SCORE:
================================================================================

Team_078
--------------------------------------------------------------------------------
Player                MIN  PTS  REB  AST  TO      FG   FG%      3P   3P%
--------------------------------------------------------------------------------
Jabari Barrett         12   11    8    0   0   5/7    71.4     0/0   0.0
Isaiah Simmons         12   10    4    2   0   4/5    80.0     0/0   0.0
Kyrie Carter           12    8    0    1   0   3/5    60.0     0/0   0.0
Ben Ginobili           12    3    4    3   0   1/1   100.0     0/0   0.0
Jabari Barnes          12    2    0    3   0   1/3    33.3     0/0   0.0

TEAM: FG: 14/21 (66.7%), 3PT: 5/10 (50.0%), REB: 14 (3 off, 11 def), AST: 9, TO: 2
TEAM FOULS: 3


Team_038
--------------------------------------------------------------------------------
Player                MIN  PTS  REB  AST  TO      FG   FG%      3P   3P%
--------------------------------------------------------------------------------
Tracy LaVine           12   11    2    0   0   4/6    66.7     0/0   0.0
Rudy Thompson          12    5    0    0   0   2/8    25.0     0/0   0.0
Luka Barnes            12    4    4    1   0   2/4    50.0     0/0   0.0
DeMar Harris           12    2    1    2   0   1/1   100.0     0/0   0.0
Malcolm Poole          12    0    0    1   0   0/3     0.0     0/0   0.0

TEAM: FG: 9/22 (40.9%), 3PT: 2/6 (33.3%), REB: 9 (2 off, 7 def), AST: 4, TO: 0
TEAM FOULS: 5 [Team_078 in BONUS]

================================================================================

================================================================================
                       2ND QUARTER - Team_078 vs Team_038                       
================================================================================

[12:00] Team_078 possession (Score: 36-25)
Ben Ginobili drives, Tracy LaVine stays with him. Ben Ginobili attempts a Dunk. Contested by Tracy LaVine (4.6 feet, MAN). BEN GINOBILI MAKES IT! Assist: Isaiah Simmons
Score: 38-25

[11:43] Team_038 possession (Score: 38-25)
Tracy LaVine drives, picks up Ben Ginobili. Help arrives from Kyrie Carter! Tracy LaVine attempts a Dunk. Wide open! Kyrie Carter is 6.8 feet away. [MAN] Tracy LaVine misses. Rebound secured by Jabari Barrett.

[11:30] Team_078 possession (Score: 38-25)
Jabari Barnes attempts a 3Pt. Wide open! Rudy Thompson is 8.4 feet away. [MAN] Jabari Barnes misses. Offensive rebound by Jabari Barrett! Jabari Barrett kicks it out.

[11:14] Team_078 possession (Score: 38-25)
Isaiah Simmons makes the Dunk and draws the foul on Malcolm Poole! And-1! Isaiah Simmons to the line for 1. [Team fouls: 1] (Malcolm Poole: 1 personal fouls)   FT 1/1: GOOD Isaiah Simmons makes 1/1 from the line.
Score: 41-25

[10:58] Team_038 possession (Score: 41-25)
Tracy LaVine attempts a Midrange. Wide open! Jabari Barrett is 7.6 feet away. [ZONE] TRACY LAVINE MAKES IT!
Score: 41-27

[10:48] Team_078 possession (Score: 41-27)
Ben Ginobili attempts a Midrange. Wide open! Tracy LaVine is 6.3 feet away. [MAN] BEN GINOBILI MAKES IT! Assist: Kyrie Carter
Score: 43-27

[10:33] Team_038 possession (Score: 43-27)
FOUL! Holding foul on Kyrie Carter. [Team fouls: 1] No free throws, side out. (Kyrie Carter: 1 personal fouls)

[10:18] Team_038 possession (Score: 43-27)
Rudy Thompson attempts a 3Pt. Heavily contested by Jabari Barnes (1.4 feet, MAN)! Rudy Thompson misses. Rebound secured by Jabari Barrett.

[10:00] Team_078 possession (Score: 43-27)
Kyrie Carter attempts a 3Pt. Contested by Malcolm Poole (5.7 feet, MAN). Kyrie Carter misses. Rebound secured by Tracy LaVine.

[09:46] Team_038 possession (Score: 43-27)
Luka Barnes attempts a 3Pt. Contested by Jabari Barrett (5.6 feet, MAN). Luka Barnes misses. Rebound secured by Isaiah Simmons.

[09:36] Team_078 possession (Score: 43-27)
Jabari Barnes attempts a 3Pt. Wide open! DeMar Harris is 7.6 feet away. [ZONE] JABARI BARNES MAKES IT! Assist: Isaiah Simmons
Score: 46-27

[09:18] Team_038 possession (Score: 46-27)
FOUL! Offensive foul on DeMar Harris! Isaiah Simmons drew the charge! [Team fouls: 2] (DeMar Harris: 1 personal fouls) TURNOVER! (dead ball)

[09:06] Team_078 possession (Score: 46-27)
Ben Ginobili drives, Tracy LaVine stays with him. Ben Ginobili attempts a Dunk. Contested by Tracy LaVine (2.4 feet, MAN). Ben Ginobili misses. Rebound secured by DeMar Harris.

[08:52] Team_038 possession (Score: 46-27)
Luka Barnes drives and kicks out. DeMar Harris attempts a 3Pt. Wide open! Isaiah Simmons is 6.6 feet away. [MAN] DeMar Harris misses. Rebound secured by Ben Ginobili.

[08:35] Team_078 possession (Score: 46-27)
FOUL! Shooting foul on Tracy LaVine. Isaiah Simmons to the line for 3 free throws. [Team fouls: 3] (Tracy LaVine: 1 personal fouls)   FT 1/3: GOOD   FT 2/3: GOOD   FT 3/3: GOOD Isaiah Simmons makes 3/3 from the line.
Score: 49-27

[08:17] Team_038 possession (Score: 49-27)
Luka Barnes drives to the basket... Luka Barnes loses the ball! Stripped by Jabari Barrett! TURNOVER! (live ball)

[08:03] Team_078 possession (Score: 49-27)
FOUL! Holding foul on Luka Barnes. [Team fouls: 4] No free throws, side out. (Luka Barnes: 1 personal fouls)

[07:45] Team_078 possession (Score: 49-27)
Ben Ginobili attempts a Layup. Contested by Tracy LaVine (3.7 feet, MAN). Ben Ginobili misses. Rebound secured by DeMar Harris.

[07:30] Team_038 possession (Score: 49-27)
Tracy LaVine attempts a Midrange. Wide open! Ben Ginobili is 7.0 feet away. [ZONE] TRACY LAVINE MAKES IT!
Score: 49-29

[07:13] Team_078 possession (Score: 49-29)
Kyrie Carter attempts a 3Pt. Wide open! Malcolm Poole is 6.6 feet away. [MAN] Kyrie Carter misses. Offensive rebound by Jabari Barrett! Jabari Barrett kicks it out.

[06:59] Team_078 possession (Score: 49-29)
Jabari Barnes attempts a Layup. BLOCKED BY TRACY LAVINE! Ball deflects out of bounds off Jabari Barnes.

[06:44] Team_038 possession (Score: 49-29)
Tracy LaVine drives to the basket... Tracy LaVine throws a bad pass out of bounds! TURNOVER! (dead ball)

[06:44] Substitution (Team_078): Jabari Barnes OUT → Magic Barrett IN (stamina_rule2)

[06:44] Substitution (Team_078): Kyrie Carter OUT → Damian Allen IN (stamina_rule2)

[06:44] Substitution (Team_078): Isaiah Simmons OUT → Malcolm Randle IN (stamina_rule2)

[06:44] Substitution (Team_078): Ben Ginobili OUT → Paul Ming IN (stamina_rule2)

[06:44] Substitution (Team_078): Jabari Barrett OUT → Draymond Irving IN (stamina_rule2)

[06:44] Substitution (Team_038): Rudy Thompson OUT → Jalen Hyland IN (stamina_rule2)

[06:44] Substitution (Team_038): Malcolm Poole OUT → Jaren Jokic IN (stamina_rule2)

[06:44] Substitution (Team_038): DeMar Harris OUT → Magic Dosunmu IN (stamina_rule2)

[06:44] Substitution (Team_038): Tracy LaVine OUT → Jabari Carter IN (stamina_rule2)

[06:44] Substitution (Team_038): Luka Barnes OUT → Ja Smith IN (stamina_rule2)

[06:32] Team_078 possession (Score: 49-29)
FOUL! Shooting foul on Magic Dosunmu. Paul Ming to the line for 2 free throws. [BONUS: 5 team fouls] (Magic Dosunmu: 1 personal fouls)   FT 1/2: GOOD   FT 2/2: GOOD Paul Ming makes 2/2 from the line.
Score: 51-29

[06:20] Team_038 possession (Score: 51-29)
Jabari Carter attempts a 3Pt. Wide open! Malcolm Randle is 9.7 feet away. [ZONE] Jabari Carter misses. FOUL! Loose ball foul on Paul Ming during the rebound battle. [Team fouls: 2] No free throws, side out. (Paul Ming: 1 personal fouls)

[06:06] Team_038 possession (Score: 51-29)
Ja Smith attempts a Layup. Wide open! Paul Ming is 7.2 feet away. [ZONE] JA SMITH MAKES IT! Assist: Jabari Carter
Score: 51-31

[05:49] Team_078 possession (Score: 51-31)
Malcolm Randle attempts a 3Pt. Contested by Magic Dosunmu (3.2 feet, MAN). Malcolm Randle misses. Rebound secured by Jalen Hyland.

[05:35] Team_038 possession (Score: 51-31)
Jalen Hyland attempts a 3Pt. Wide open! Magic Barrett is 6.6 feet away. [MAN] JALEN HYLAND MAKES IT! Assist: Magic Dosunmu
Score: 51-34

[05:20] Team_078 possession (Score: 51-34)
Paul Ming attempts a Layup. Contested by Jabari Carter (2.2 feet, MAN). PAUL MING MAKES IT! Assist: Draymond Irving
Score: 53-34

[05:05] Team_038 possession (Score: 53-34)
Jaren Jokic attempts a 3Pt. Contested by Damian Allen (5.0 feet, MAN). Jaren Jokic misses. Rebound secured by Draymond Irving.

[04:48] Team_078 possession (Score: 53-34)
Paul Ming drives to the basket... Paul Ming loses control! Ball rolls out of bounds! TURNOVER! (dead ball)

[04:33] Team_038 possession (Score: 53-34)
Jalen Hyland attempts a Layup. BLOCKED BY MAGIC BARRETT! Ball is loose! Rebound secured by Draymond Irving.

[04:20] Team_078 possession (Score: 53-34)
Damian Allen attempts a Midrange. Wide open! Jaren Jokic is 6.0 feet away. [MAN] Damian Allen misses. Rebound secured by Jalen Hyland.

[04:10] Team_038 possession (Score: 53-34)
Jalen Hyland attempts a 3Pt. Contested by Damian Allen (5.2 feet, ZONE). Jalen Hyland misses. Rebound secured by Paul Ming.

[04:00] Team_078 possession (Score: 53-34)
Malcolm Randle attempts a 3Pt. Contested by Magic Dosunmu (4.1 feet, MAN). MALCOLM RANDLE MAKES IT! Assist: Draymond Irving
Score: 56-34

[03:40] Team_038 possession (Score: 56-34)
Ja Smith throws a bad pass! Stolen by Draymond Irving! TURNOVER! (live ball)

[03:26] Team_078 possession (Score: 56-34)
Draymond Irving drives, picks up Ja Smith. Help arrives from Jalen Hyland! Draymond Irving attempts a Layup. Wide open! Jalen Hyland is 6.2 feet away. [MAN] DRAYMOND IRVING MAKES IT! Assist: Damian Allen
Score: 58-34

[03:10] Team_038 possession (Score: 58-34)
Jaren Jokic attempts a 3Pt. Contested by Damian Allen (5.7 feet, MAN). Jaren Jokic misses. Rebound secured by Paul Ming.

[02:53] Team_078 possession (Score: 58-34)
Paul Ming attempts a 3Pt. Wide open! Jalen Hyland is 6.3 feet away. [ZONE] Paul Ming misses. Offensive rebound by Paul Ming! Paul Ming kicks it out.

[02:38] Team_078 possession (Score: 58-34)
Draymond Irving attempts a Midrange. Contested by Jabari Carter (5.9 feet, ZONE). Draymond Irving misses. Offensive rebound by Paul Ming! Paul Ming kicks it out.

[02:27] Team_078 possession (Score: 58-34)
Magic Barrett drives, Jalen Hyland stays with him. Magic Barrett attempts a Layup. Wide open! Jalen Hyland is 6.8 feet away. [MAN] MAGIC BARRETT MAKES IT! Assist: Draymond Irving
Score: 60-34

[02:14] Team_038 possession (Score: 60-34)
Jalen Hyland attempts a 3Pt. Contested by Magic Barrett (4.1 feet, MAN). JALEN HYLAND MAKES IT! Assist: Magic Dosunmu
Score: 60-37

[02:00] Team_078 possession (Score: 60-37)
Paul Ming makes the Layup and draws the foul on Jalen Hyland! And-1! Paul Ming to the line for 1. [BONUS: 6 team fouls] (Jalen Hyland: 1 personal fouls)   FT 1/1: GOOD Paul Ming makes 1/1 from the line.
Score: 63-37

[01:46] Team_038 possession (Score: 63-37)
FOUL! Holding foul on Paul Ming. [Team fouls: 3] No free throws, side out. (Paul Ming: 2 personal fouls)

[01:31] Team_038 possession (Score: 63-37)
Jaren Jokic attempts a Layup. Contested by Damian Allen (4.2 feet, MAN). JAREN JOKIC MAKES IT! Assist: Magic Dosunmu
Score: 63-39

[01:13] Team_078 possession (Score: 63-39)
Draymond Irving drives and kicks out. Magic Barrett attempts a 3Pt. Contested by Jabari Carter (5.4 feet, ZONE). MAGIC BARRETT MAKES IT! Assist: Paul Ming
Score: 66-39

[00:55] Team_038 possession (Score: 66-39)
Magic Dosunmu attempts a Midrange. Wide open! Paul Ming is 10.0 feet away. [ZONE] Magic Dosunmu misses. Rebound secured by Malcolm Randle.

[00:36] Team_078 possession (Score: 66-39)
Draymond Irving drives to the basket... Draymond Irving commits a violation (traveling/carry)! TURNOVER! (dead ball)

[00:20] Team_038 possession (Score: 66-39)
Jaren Jokic drives and kicks out. Jalen Hyland attempts a Midrange. Wide open! Magic Barrett is 7.4 feet away. [MAN] Jalen Hyland misses. Offensive rebound by Ja Smith! Ja Smith puts it back in!
Score: 66-41

[00:06] Team_078 possession (Score: 66-41)
Draymond Irving drives to the basket... FOUL! Offensive foul on Draymond Irving! Ja Smith drew the charge! [Team fouls: 4] (Draymond Irving: 1 personal fouls) TURNOVER! (dead ball)

================================================================================
                              2ND QUARTER COMPLETE                              
================================================================================

2ND QUARTER SCORE: Team_078 30, Team_038 16

BOX SCORE:
================================================================================

Team_078
--------------------------------------------------------------------------------
Player                MIN  PTS  REB  AST  TO      FG   FG%      3P   3P%
--------------------------------------------------------------------------------
Paul Ming               7    7    4    1   0   3/3   100.0     0/0   0.0
Isaiah Simmons         18    6    1    2   0   2/2   100.0     0/0   0.0
Magic Barrett           7    5    0    0   0   2/2   100.0     0/0   0.0
Ben Ginobili           18    4    1    0   0   2/4    50.0     0/0   0.0
Jabari Barnes          18    3    0    0   0   1/2    50.0     0/0   0.0
Malcolm Randle          7    3    1    0   0   1/2    50.0     0/0   0.0
Draymond Irving         7    2    2    3   0   1/1   100.0     0/0   0.0
Jabari Barrett         18    0    4    0   0   0/0     0.0     0/0   0.0
Kyrie Carter           18    0    0    1   0   0/1     0.0     0/0   0.0
Damian Allen            7    0    0    1   0   0/1     0.0     0/0   0.0

TEAM: FG: 12/18 (66.7%), 3PT: 3/5 (60.0%), REB: 13 (4 off, 9 def), AST: 8, TO: 3
TEAM FOULS: 4


Team_038
--------------------------------------------------------------------------------
Player                MIN  PTS  REB  AST  TO      FG   FG%      3P   3P%
--------------------------------------------------------------------------------
Jalen Hyland            7    6    2    0   0   2/4    50.0     0/0   0.0
Tracy LaVine           18    4    1    0   0   2/3    66.7     0/0   0.0
Ja Smith                7    4    2    0   0   2/2   100.0     0/0   0.0
Jaren Jokic             7    2    0    0   0   1/3    33.3     0/0   0.0
Rudy Thompson          18    0    0    0   0   0/1     0.0     0/0   0.0
Luka Barnes            18    0    0    0   0   0/2     0.0     0/0   0.0
DeMar Harris           18    0    2    0   0   0/0     0.0     0/0   0.0
Jabari Carter           7    0    0    1   0   0/0     0.0     0/0   0.0
Magic Dosunmu           7    0    0    3   0   0/1     0.0     0/0   0.0

TEAM: FG: 7/16 (43.8%), 3PT: 2/7 (28.6%), REB: 7 (2 off, 5 def), AST: 4, TO: 4
TEAM FOULS: 6 [Team_078 in BONUS]

================================================================================

================================================================================
                       3RD QUARTER - Team_078 vs Team_038                       
================================================================================

[12:00] Team_078 possession (Score: 66-41)
Isaiah Simmons attempts a 3Pt. Contested by DeMar Harris (3.7 feet, MAN). ISAIAH SIMMONS MAKES IT! Assist: Ben Ginobili
Score: 69-41

[11:44] Team_038 possession (Score: 69-41)
FOUL! Shooting foul on Jabari Barrett. Luka Barnes to the line for 2 free throws. [Team fouls: 1] (Jabari Barrett: 1 personal fouls)   FT 1/2: MISS   FT 2/2: GOOD Luka Barnes makes 1/2 from the line.
Score: 69-42

[11:33] Team_078 possession (Score: 69-42)
FOUL! Shooting foul on Tracy LaVine. Ben Ginobili to the line for 2 free throws. [Team fouls: 1] (Tracy LaVine: 1 personal fouls)   FT 1/2: GOOD   FT 2/2: MISS Ben Ginobili makes 1/2 from the line. Rebound secured by Tracy LaVine.
Score: 70-42

[11:19] Team_038 possession (Score: 70-42)
Tracy LaVine attempts a 3Pt. Contested by Ben Ginobili (4.8 feet, MAN). TRACY LAVINE MAKES IT! Assist: Rudy Thompson
Score: 70-45

[11:03] Team_078 possession (Score: 70-45)
Jabari Barnes drives, Rudy Thompson stays with him. Jabari Barnes attempts a Layup. Contested by Rudy Thompson (3.2 feet, MAN). Jabari Barnes misses. Offensive rebound by Isaiah Simmons! Isaiah Simmons's putback is no good. Rebound secured by Tracy LaVine.

[10:51] Team_038 possession (Score: 70-45)
FOUL! Holding foul on Isaiah Simmons. [Team fouls: 2] No free throws, side out. (Isaiah Simmons: 1 personal fouls)

[10:39] Team_038 possession (Score: 70-45)
Rudy Thompson attempts a 3Pt. Heavily contested by Isaiah Simmons (1.5 feet, ZONE)! Rudy Thompson misses. Rebound secured by Ben Ginobili.

[10:26] Team_078 possession (Score: 70-45)
Kyrie Carter attempts a 3Pt. Contested by Malcolm Poole (3.1 feet, MAN). KYRIE CARTER MAKES IT! Assist: Jabari Barnes
Score: 73-45

[10:14] Team_038 possession (Score: 73-45)
FOUL! Reach-in foul on Jabari Barrett during the drive. [Team fouls: 3] No free throws, side out. (Jabari Barrett: 2 personal fouls)

[10:00] Team_038 possession (Score: 73-45)
DeMar Harris drives and kicks out. Luka Barnes attempts a 3Pt. Contested by Isaiah Simmons (5.1 feet, ZONE). Luka Barnes misses. Offensive rebound by Luka Barnes! Luka Barnes kicks it out.

[09:45] Team_038 possession (Score: 73-45)
Rudy Thompson attempts a Layup. BLOCKED BY JABARI BARNES! Ball is loose! Rebound secured by Jabari Barrett.

[09:27] Team_078 possession (Score: 73-45)
Ben Ginobili drives and kicks out. Ben Ginobili attempts a 3Pt. Contested by Tracy LaVine (4.9 feet, MAN). BEN GINOBILI MAKES IT! Assist: Jabari Barnes
Score: 76-45

[09:12] Team_038 possession (Score: 76-45)
Malcolm Poole drives to the basket... Malcolm Poole throws a bad pass! Stolen by Kyrie Carter! TURNOVER! (live ball)

[08:55] Team_078 possession (Score: 76-45)
Kyrie Carter attempts a 3Pt. Contested by DeMar Harris (2.2 feet, ZONE). KYRIE CARTER MAKES IT! Assist: Jabari Barrett
Score: 79-45

[08:41] Team_038 possession (Score: 79-45)
Luka Barnes attempts a 3Pt. Contested by Isaiah Simmons (3.7 feet, ZONE). Luka Barnes misses. Rebound secured by Jabari Barrett.

[08:27] Team_078 possession (Score: 79-45)
Jabari Barnes attempts a Layup. Contested by Tracy LaVine (4.7 feet, ZONE). Jabari Barnes misses. Offensive rebound by Jabari Barrett! Jabari Barrett kicks it out.

[08:16] Team_078 possession (Score: 79-45)
Kyrie Carter attempts a 3Pt. Contested by Tracy LaVine (3.4 feet, ZONE). KYRIE CARTER MAKES IT! Assist: Ben Ginobili
Score: 82-45

[08:01] Team_038 possession (Score: 82-45)
Luka Barnes drives and kicks out. Luka Barnes attempts a 3Pt. Contested by Jabari Barrett (5.8 feet, MAN). LUKA BARNES MAKES IT! Assist: DeMar Harris
Score: 82-48

[07:45] Team_078 possession (Score: 82-48)
Isaiah Simmons attempts a Midrange. Contested by Tracy LaVine (2.3 feet, ZONE). Isaiah Simmons misses. Rebound secured by Tracy LaVine.

[07:32] Team_038 possession (Score: 82-48)
Malcolm Poole drives to the basket... Malcolm Poole commits a violation (traveling/carry)! TURNOVER! (dead ball)

[07:16] Team_078 possession (Score: 82-48)
Isaiah Simmons attempts a 3Pt. Contested by DeMar Harris (3.8 feet, ZONE). Isaiah Simmons misses. Rebound secured by Tracy LaVine.

[07:01] Team_038 possession (Score: 82-48)
Tracy LaVine attempts a 3Pt. Contested by Ben Ginobili (5.3 feet, ZONE). Tracy LaVine misses. Rebound secured by Ben Ginobili.

[06:46] Team_078 possession (Score: 82-48)
Isaiah Simmons attempts a Dunk. BLOCKED BY DEMAR HARRIS! Ball is loose! Rebound secured by Tracy LaVine.

[06:33] Team_038 possession (Score: 82-48)
Rudy Thompson attempts a Midrange. Contested by Ben Ginobili (5.9 feet, ZONE). RUDY THOMPSON MAKES IT!
Score: 82-50

[06:17] Team_078 possession (Score: 82-50)
Ben Ginobili drives to the basket... Ben Ginobili commits a violation (traveling/carry)! TURNOVER! (dead ball)

[06:07] Team_038 possession (Score: 82-50)
FOUL! Shooting foul on Ben Ginobili. Tracy LaVine to the line for 2 free throws. [Team fouls: 4] (Ben Ginobili: 1 personal fouls)   FT 1/2: GOOD   FT 2/2: MISS Tracy LaVine makes 1/2 from the line. Rebound secured by Ben Ginobili.
Score: 82-51

[05:55] Team_078 possession (Score: 82-51)
Isaiah Simmons drives, picks up Tracy LaVine. Help arrives from Malcolm Poole! Isaiah Simmons attempts a Layup. Contested by Malcolm Poole (2.7 feet, ZONE). ISAIAH SIMMONS MAKES IT!
Score: 84-51

[05:41] Team_038 possession (Score: 84-51)
FOUL! Offensive foul on Luka Barnes! Jabari Barrett drew the charge! [Team fouls: 2] (Luka Barnes: 1 personal fouls) TURNOVER! (dead ball)

[05:30] Team_078 possession (Score: 84-51)
Jabari Barnes attempts a 3Pt. Contested by Rudy Thompson (4.2 feet, MAN). JABARI BARNES MAKES IT! Assist: Jabari Barrett
Score: 87-51

[05:21] Team_038 possession (Score: 87-51)
DeMar Harris drives and kicks out. Malcolm Poole attempts a 3Pt. Contested by Kyrie Carter (4.2 feet, MAN). MALCOLM POOLE MAKES IT! Assist: DeMar Harris
Score: 87-54

[05:08] Team_078 possession (Score: 87-54)
Jabari Barnes attempts a 3Pt. Contested by Rudy Thompson (5.1 feet, MAN). Jabari Barnes misses. Rebound secured by Luka Barnes.

[04:53] Team_038 possession (Score: 87-54)
Tracy LaVine attempts a Midrange. Contested by Ben Ginobili (3.6 feet, MAN). Tracy LaVine misses. Rebound secured by Jabari Barrett.

[04:42] Team_078 possession (Score: 87-54)
Kyrie Carter attempts a 3Pt. Contested by Malcolm Poole (4.6 feet, MAN). Kyrie Carter misses. Rebound secured by Luka Barnes.

[04:26] Team_038 possession (Score: 87-54)
FOUL! Shooting foul on Jabari Barrett. Malcolm Poole to the line for 2 free throws. [BONUS: 5 team fouls] (Jabari Barrett: 3 personal fouls)   FT 1/2: GOOD   FT 2/2: GOOD Malcolm Poole makes 2/2 from the line.
Score: 87-56

[04:09] Team_078 possession (Score: 87-56)
Jabari Barnes attempts a Midrange. Wide open! Rudy Thompson is 9.6 feet away. [MAN] Jabari Barnes misses. Rebound secured by Tracy LaVine.

[03:50] Team_038 possession (Score: 87-56)
Rudy Thompson attempts a Midrange. Contested by Kyrie Carter (5.1 feet, ZONE). RUDY THOMPSON MAKES IT! Assist: Malcolm Poole
Score: 87-58

[03:38] Team_078 possession (Score: 87-58)
Isaiah Simmons attempts a 3Pt. Wide open! DeMar Harris is 6.3 feet away. [MAN] Isaiah Simmons misses. Rebound secured by Luka Barnes.

[03:26] Team_038 possession (Score: 87-58)
Luka Barnes drives, Jabari Barrett stays with him. Luka Barnes attempts a Dunk. Contested by Jabari Barrett (4.1 feet, ZONE). Luka Barnes misses. Rebound secured by Ben Ginobili.

[03:17] Team_078 possession (Score: 87-58)
Jabari Barrett attempts a Layup. BLOCKED BY TRACY LAVINE! Ball is loose! Rebound secured by DeMar Harris.

[03:02] Team_038 possession (Score: 87-58)
Malcolm Poole attempts a 3Pt. Contested by Isaiah Simmons (3.6 feet, ZONE). MALCOLM POOLE MAKES IT! Assist: Tracy LaVine
Score: 87-61

[02:48] Team_078 possession (Score: 87-61)
FOUL! Offensive foul on Ben Ginobili! Tracy LaVine drew the charge! [Team fouls: 6] (Ben Ginobili: 2 personal fouls) TURNOVER! (dead ball)

[02:33] Team_038 possession (Score: 87-61)
Rudy Thompson drives to the basket... FOUL! Offensive foul on Rudy Thompson! Jabari Barrett drew the charge! [Team fouls: 3] (Rudy Thompson: 1 personal fouls) TURNOVER! (dead ball)

[02:16] Team_078 possession (Score: 87-61)
FOUL! Offensive foul on Jabari Barrett! Luka Barnes drew the charge! [Team fouls: 7] (Jabari Barrett: 4 personal fouls) TURNOVER! (dead ball)

[02:03] Team_038 possession (Score: 87-61)
Tracy LaVine throws a bad pass out of bounds! TURNOVER! (dead ball)

[02:03] Substitution (Team_078): Jabari Barnes OUT → Magic Barrett IN (stamina_rule2)

[02:03] Substitution (Team_078): Kyrie Carter OUT → Damian Allen IN (stamina_rule2)

[02:03] Substitution (Team_078): Isaiah Simmons OUT → Malcolm Randle IN (stamina_rule2)

[02:03] Substitution (Team_078): Ben Ginobili OUT → Paul Ming IN (stamina_rule2)

[02:03] Substitution (Team_078): Jabari Barrett OUT → Draymond Irving IN (stamina_rule2)

[02:03] Substitution (Team_038): Rudy Thompson OUT → Jalen Hyland IN (stamina_rule2)

[02:03] Substitution (Team_038): Malcolm Poole OUT → Jaren Jokic IN (stamina_rule2)

[02:03] Substitution (Team_038): DeMar Harris OUT → Magic Dosunmu IN (stamina_rule2)

[02:03] Substitution (Team_038): Tracy LaVine OUT → Jabari Carter IN (stamina_rule2)

[02:03] Substitution (Team_038): Luka Barnes OUT → Ja Smith IN (stamina_rule2)

[01:47] Team_078 possession (Score: 87-61)
Damian Allen attempts a Midrange. Contested by Jabari Carter (4.9 feet, ZONE). Damian Allen misses. Rebound secured by Ja Smith.

[01:37] Team_038 possession (Score: 87-61)
Jaren Jokic attempts a Midrange. Contested by Damian Allen (5.2 feet, MAN). JAREN JOKIC MAKES IT!
Score: 87-63

[01:23] Team_078 possession (Score: 87-63)
Magic Barrett attempts a 3Pt. Contested by Jalen Hyland (5.4 feet, MAN). MAGIC BARRETT MAKES IT! Assist: Damian Allen
Score: 90-63

[01:12] Team_038 possession (Score: 90-63)
Ja Smith attempts a Midrange. Contested by Draymond Irving (5.8 feet, ZONE). Ja Smith misses. Offensive rebound by Jabari Carter! Jabari Carter puts it back in!
Score: 90-65

[00:57] Team_078 possession (Score: 90-65)
Malcolm Randle attempts a 3Pt. Contested by Magic Dosunmu (4.7 feet, MAN). Malcolm Randle misses. Rebound secured by Ja Smith.

[00:42] Team_038 possession (Score: 90-65)
Jalen Hyland attempts a 3Pt. Wide open! Magic Barrett is 7.7 feet away. [MAN] Jalen Hyland misses. Rebound secured by Paul Ming.

[00:28] Team_078 possession (Score: 90-65)
Malcolm Randle drives and kicks out. Damian Allen attempts a 3Pt. Wide open! Jalen Hyland is 7.4 feet away. [ZONE] DAMIAN ALLEN MAKES IT! Assist: Paul Ming
Score: 93-65

[00:15] Team_038 possession (Score: 93-65)
Jaren Jokic attempts a 3Pt. Contested by Damian Allen (4.0 feet, ZONE). Jaren Jokic misses. Rebound secured by Malcolm Randle.

================================================================================
                              3RD QUARTER COMPLETE                              
================================================================================

3RD QUARTER SCORE: Team_078 27, Team_038 24

BOX SCORE:
================================================================================

Team_078
--------------------------------------------------------------------------------
Player                MIN  PTS  REB  AST  TO      FG   FG%      3P   3P%
--------------------------------------------------------------------------------
Kyrie Carter           28    9    0    0   0   3/4    75.0     0/0   0.0
Isaiah Simmons         28    5    0    0   0   2/6    33.3     0/0   0.0
Ben Ginobili           28    3    4    2   0   1/2    50.0     0/0   0.0
Jabari Barnes          28    3    0    2   0   1/4    25.0     0/0   0.0
Damian Allen            8    3    0    1   0   1/2    50.0     0/0   0.0
Magic Barrett           8    3    0    0   0   1/1   100.0     0/0   0.0
Jabari Barrett         28    0    4    2   0   0/1     0.0     0/0   0.0
Malcolm Randle          8    0    1    0   0   0/1     0.0     0/0   0.0
Paul Ming               8    0    1    1   0   0/0     0.0     0/0   0.0

TEAM: FG: 9/21 (42.9%), 3PT: 6/11 (54.5%), REB: 11 (2 off, 9 def), AST: 8, TO: 3
TEAM FOULS: 7 [Team_038 in BONUS]


Team_038
--------------------------------------------------------------------------------
Player                MIN  PTS  REB  AST  TO      FG   FG%      3P   3P%
--------------------------------------------------------------------------------
Malcolm Poole          28    8    0    1   0   3/3   100.0     0/0   0.0
Luka Barnes            28    4    4    0   0   2/4    50.0     0/0   0.0
Rudy Thompson          28    4    0    1   0   2/4    50.0     0/0   0.0
Tracy LaVine           28    3    6    1   0   1/4    25.0     0/0   0.0
Jaren Jokic             8    2    0    0   0   1/2    50.0     0/0   0.0
Jabari Carter           8    2    1    0   0   1/1   100.0     0/0   0.0
DeMar Harris           28    0    1    2   0   0/0     0.0     0/0   0.0
Ja Smith                8    0    2    0   0   0/0     0.0     0/0   0.0
Jalen Hyland            8    0    0    0   0   0/1     0.0     0/0   0.0

TEAM: FG: 10/19 (52.6%), 3PT: 2/7 (28.6%), REB: 13 (2 off, 11 def), AST: 5, TO: 5
TEAM FOULS: 3

================================================================================

================================================================================
                       4TH QUARTER - Team_078 vs Team_038                       
================================================================================

[12:00] Team_078 possession (Score: 93-65)
Jabari Barnes attempts a Midrange. BLOCKED BY TRACY LAVINE! Ball deflects out of bounds off Jabari Barnes.

[11:46] Team_038 possession (Score: 93-65)
Tracy LaVine attempts a Midrange. Contested by Ben Ginobili (5.0 feet, MAN). TRACY LAVINE MAKES IT!
Score: 93-67

[11:32] Team_078 possession (Score: 93-67)
FOUL! Holding foul on Luka Barnes. [Team fouls: 1] No free throws, side out. (Luka Barnes: 1 personal fouls)

[11:19] Team_078 possession (Score: 93-67)
Jabari Barnes throws a bad pass out of bounds! TURNOVER! (dead ball)

[11:03] Team_038 possession (Score: 93-67)
Tracy LaVine attempts a 3Pt. Contested by Ben Ginobili (3.3 feet, MAN). Tracy LaVine misses. Rebound secured by Jabari Barrett.

[10:48] Team_078 possession (Score: 93-67)
Ben Ginobili drives to the basket... FOUL! Offensive foul on Ben Ginobili! Tracy LaVine drew the charge! [Team fouls: 1] (Ben Ginobili: 1 personal fouls) TURNOVER! (dead ball)

[10:36] Team_038 possession (Score: 93-67)
FOUL! Reach-in foul on Ben Ginobili during the drive. [Team fouls: 2] No free throws, side out. (Ben Ginobili: 2 personal fouls)

[10:22] Team_038 possession (Score: 93-67)
DeMar Harris drives and kicks out. Luka Barnes attempts a Midrange. Contested by Kyrie Carter (3.2 feet, ZONE). Luka Barnes misses. Rebound secured by Ben Ginobili.

[10:05] Team_078 possession (Score: 93-67)
Jabari Barnes attempts a Midrange. Contested by Luka Barnes (4.4 feet, ZONE). JABARI BARNES MAKES IT!
Score: 95-67

[09:52] Team_038 possession (Score: 95-67)
Rudy Thompson drives, picks up Jabari Barnes. Help arrives from Isaiah Simmons! Rudy Thompson attempts a Layup. Wide open! Isaiah Simmons is 6.4 feet away. [MAN] Rudy Thompson misses. Rebound secured by Isaiah Simmons.

[09:37] Team_078 possession (Score: 95-67)
FOUL! Offensive foul on Jabari Barnes! Rudy Thompson drew the charge! [Team fouls: 3] (Jabari Barnes: 1 personal fouls) TURNOVER! (dead ball)

[09:26] Team_038 possession (Score: 95-67)
Rudy Thompson drives, Jabari Barrett stays with him. Rudy Thompson attempts a Dunk. Wide open! Jabari Barrett is 9.2 feet away. [ZONE] RUDY THOMPSON MAKES IT! Assist: Luka Barnes
Score: 95-69

[09:09] Team_078 possession (Score: 95-69)
Kyrie Carter drives to the basket... Kyrie Carter throws a bad pass out of bounds! TURNOVER! (dead ball)

[09:09] Substitution (Team_078): Jabari Barnes OUT → Magic Barrett IN (stamina_rule2)

[09:09] Substitution (Team_078): Kyrie Carter OUT → Damian Allen IN (stamina_rule2)

[09:09] Substitution (Team_078): Isaiah Simmons OUT → Malcolm Randle IN (stamina_rule2)

[09:09] Substitution (Team_078): Ben Ginobili OUT → Paul Ming IN (stamina_rule2)

[09:09] Substitution (Team_078): Jabari Barrett OUT → Draymond Irving IN (stamina_rule2)

[09:09] Substitution (Team_038): Rudy Thompson OUT → Jalen Hyland IN (stamina_rule2)

[09:09] Substitution (Team_038): Malcolm Poole OUT → Jaren Jokic IN (stamina_rule2)

[09:09] Substitution (Team_038): DeMar Harris OUT → Magic Dosunmu IN (stamina_rule2)

[09:09] Substitution (Team_038): Tracy LaVine OUT → Jabari Carter IN (stamina_rule2)

[09:09] Substitution (Team_038): Luka Barnes OUT → Ja Smith IN (stamina_rule2)

[08:51] Team_038 possession (Score: 95-69)
Jaren Jokic makes the Layup and draws the foul on Damian Allen! And-1! Jaren Jokic to the line for 1. [Team fouls: 4] (Damian Allen: 1 personal fouls)   FT 1/1: MISS Jaren Jokic makes 0/1 from the line. Rebound secured by Paul Ming.
Score: 95-71

[08:38] Team_078 possession (Score: 95-71)
Malcolm Randle attempts a 3Pt. Contested by Jalen Hyland (4.3 feet, ZONE). MALCOLM RANDLE MAKES IT! Assist: Damian Allen
Score: 98-71

[08:23] Team_038 possession (Score: 98-71)
Magic Dosunmu attempts a 3Pt. Wide open! Malcolm Randle is 7.6 feet away. [MAN] Magic Dosunmu misses. Offensive rebound by Jabari Carter! Jabari Carter puts it back in!
Score: 98-73

[08:11] Team_078 possession (Score: 98-73)
FOUL! Shooting foul on Ja Smith. Draymond Irving to the line for 2 free throws. [Team fouls: 2] (Ja Smith: 1 personal fouls)   FT 1/2: GOOD   FT 2/2: GOOD Draymond Irving makes 2/2 from the line.
Score: 100-73

[07:57] Team_038 possession (Score: 100-73)
FOUL! Reach-in foul on Draymond Irving during the drive. [IN THE BONUS! 5 team fouls] Ja Smith to the line for 2 free throws. (Draymond Irving: 1 personal fouls)   FT 1/2: GOOD   FT 2/2: GOOD Ja Smith makes 2/2 from the line.
Score: 100-75

[07:42] Team_078 possession (Score: 100-75)
Malcolm Randle attempts a Layup. Contested by Ja Smith (2.4 feet, ZONE). MALCOLM RANDLE MAKES IT!
Score: 102-75

[07:25] Team_038 possession (Score: 102-75)
Jaren Jokic loses control! Ball rolls out of bounds! TURNOVER! (dead ball)

[07:10] Team_078 possession (Score: 102-75)
Magic Barrett attempts a Midrange. Wide open! Jalen Hyland is 6.5 feet away. [MAN] MAGIC BARRETT MAKES IT!
Score: 104-75

[06:54] Team_038 possession (Score: 104-75)
Jaren Jokic drives, Paul Ming stays with him. Jaren Jokic attempts a Layup. Heavily contested by Paul Ming (0.5 feet, ZONE)! JAREN JOKIC MAKES IT! Assist: Ja Smith
Score: 104-77

[06:36] Team_078 possession (Score: 104-77)
Paul Ming attempts a Layup. BLOCKED BY JABARI CARTER! Ball is loose! Rebound secured by Jalen Hyland.

[06:21] Team_038 possession (Score: 104-77)
Jaren Jokic drives to the basket... Jaren Jokic throws a bad pass out of bounds! TURNOVER! (dead ball)

[06:08] Team_078 possession (Score: 104-77)
Paul Ming drives and kicks out. Malcolm Randle attempts a 3Pt. Contested by Magic Dosunmu (5.7 feet, MAN). Malcolm Randle misses. Rebound secured by Jabari Carter.

[05:56] Team_038 possession (Score: 104-77)
Jaren Jokic attempts a 3Pt. Contested by Damian Allen (5.5 feet, ZONE). Jaren Jokic misses. Rebound secured by Draymond Irving.

[05:42] Team_078 possession (Score: 104-77)
Damian Allen attempts a 3Pt. Contested by Jaren Jokic (4.4 feet, MAN). Damian Allen misses. Rebound secured by Jabari Carter.

[05:25] Team_038 possession (Score: 104-77)
Jalen Hyland attempts a 3Pt. Wide open! Magic Barrett is 6.6 feet away. [MAN] Jalen Hyland misses. Rebound secured by Paul Ming.

[05:09] Team_078 possession (Score: 104-77)
Magic Barrett attempts a 3Pt. BLOCKED BY JALEN HYLAND! Ball is loose! Rebound secured by Jalen Hyland.

[04:56] Team_038 possession (Score: 104-77)
Ja Smith attempts a 3Pt. Wide open! Draymond Irving is 6.9 feet away. [MAN] JA SMITH MAKES IT! Assist: Jalen Hyland
Score: 104-80

[04:42] Team_078 possession (Score: 104-80)
Malcolm Randle drives to the basket... Malcolm Randle commits a violation (traveling/carry)! TURNOVER! (dead ball)

[04:30] Team_038 possession (Score: 104-80)
Ja Smith attempts a 3Pt. Wide open! Draymond Irving is 8.4 feet away. [MAN] Ja Smith misses. Rebound secured by Draymond Irving.

[04:15] Team_078 possession (Score: 104-80)
Damian Allen drives to the basket... Damian Allen throws a bad pass out of bounds! TURNOVER! (dead ball)

[03:59] Team_038 possession (Score: 104-80)
FOUL! Offensive foul on Jabari Carter! Paul Ming drew the charge! [Team fouls: 3] (Jabari Carter: 1 personal fouls) TURNOVER! (dead ball)

[03:48] Team_078 possession (Score: 104-80)
Damian Allen drives to the basket... Damian Allen throws a bad pass! Stolen by Ja Smith! TURNOVER! (live ball)

[03:37] Team_038 possession (Score: 104-80)
Ja Smith drives, Draymond Irving stays with him. Ja Smith attempts a Dunk. Wide open! Draymond Irving is 7.6 feet away. [MAN] JA SMITH MAKES IT! Assist: Magic Dosunmu
Score: 104-82

[03:27] Team_078 possession (Score: 104-82)
Malcolm Randle attempts a 3Pt. Contested by Magic Dosunmu (2.9 feet, ZONE). Malcolm Randle misses. Rebound secured by Jabari Carter.

[03:13] Team_038 possession (Score: 104-82)
Jaren Jokic drives, Damian Allen stays with him. Jaren Jokic attempts a Layup. Contested by Damian Allen (5.6 feet, MAN). JAREN JOKIC MAKES IT!
Score: 104-84

[02:54] Team_078 possession (Score: 104-84)
Damian Allen attempts a 3Pt. Wide open! Jaren Jokic is 8.0 feet away. [MAN] Damian Allen misses. FOUL! Loose ball foul on Jabari Carter during the rebound battle. [Team fouls: 4] No free throws, side out. (Jabari Carter: 2 personal fouls)

[02:37] Team_078 possession (Score: 104-84)
Magic Barrett attempts a Midrange. Contested by Jalen Hyland (5.1 feet, MAN). Magic Barrett misses. Rebound secured by Jalen Hyland.

[02:20] Team_038 possession (Score: 104-84)
Magic Dosunmu attempts a 3Pt. Contested by Malcolm Randle (5.3 feet, MAN). Magic Dosunmu misses. Rebound secured by Draymond Irving.

[02:04] Team_078 possession (Score: 104-84)
Magic Barrett attempts a 3Pt. Wide open! Jalen Hyland is 6.1 feet away. [MAN] Magic Barrett misses. Rebound secured by Ja Smith.

[01:50] Team_038 possession (Score: 104-84)
Jaren Jokic drives to the basket... Jaren Jokic loses control! Ball rolls out of bounds! TURNOVER! (dead ball)

[01:32] Team_078 possession (Score: 104-84)
Malcolm Randle drives, Magic Dosunmu stays with him. Malcolm Randle attempts a Dunk. Heavily contested by Magic Dosunmu (0.8 feet, MAN)! MALCOLM RANDLE MAKES IT! Assist: Damian Allen
Score: 106-84

[01:13] Team_038 possession (Score: 106-84)
Jalen Hyland drives, Magic Barrett stays with him. Jalen Hyland attempts a Dunk. Wide open! Magic Barrett is 6.5 feet away. [MAN] JALEN HYLAND MAKES IT!
Score: 106-86

[00:54] Team_078 possession (Score: 106-86)
Malcolm Randle loses the ball! Stripped by Magic Dosunmu! TURNOVER! (live ball)

[00:39] Team_038 possession (Score: 106-86)
FOUL! Holding foul on Paul Ming. [IN THE BONUS! 6 team fouls] Jabari Carter to the line for 2 free throws. (Paul Ming: 1 personal fouls)   FT 1/2: MISS   FT 2/2: GOOD Jabari Carter makes 1/2 from the line.
Score: 106-87

[00:26] Team_078 possession (Score: 106-87)
Paul Ming attempts a Midrange. Wide open! Jabari Carter is 7.8 feet away. [MAN] PAUL MING MAKES IT!
Score: 108-87

[00:11] Team_038 possession (Score: 108-87)
Magic Dosunmu drives to the basket... FOUL! Offensive foul on Magic Dosunmu! Paul Ming drew the charge! [Team fouls: 5] (Magic Dosunmu: 1 personal fouls) TURNOVER! (dead ball)

================================================================================
                              4TH QUARTER COMPLETE                              
================================================================================

4TH QUARTER SCORE: Team_078 15, Team_038 22

BOX SCORE:
================================================================================

Team_078
--------------------------------------------------------------------------------
Player                MIN  PTS  REB  AST  TO      FG   FG%      3P   3P%
--------------------------------------------------------------------------------
Malcolm Randle         17    7    0    0   0   3/4    75.0     0/0   0.0
Jabari Barnes          31    2    0    0   0   1/2    50.0     0/0   0.0
Paul Ming              17    2    2    0   0   1/3    33.3     0/0   0.0
Draymond Irving        17    2    4    0   0   1/1   100.0     0/0   0.0
Magic Barrett          17    2    0    0   0   1/4    25.0     0/0   0.0
Jabari Barrett         31    0    1    0   0   0/0     0.0     0/0   0.0
Ben Ginobili           31    0    1    0   0   0/0     0.0     0/0   0.0
Isaiah Simmons         31    0    1    0   0   0/0     0.0     0/0   0.0
Damian Allen           17    0    0    2   0   0/1     0.0     0/0   0.0

TEAM: FG: 7/15 (46.7%), 3PT: 1/5 (20.0%), REB: 9 (1 off, 8 def), AST: 2, TO: 8
TEAM FOULS: 6 [Team_038 in BONUS]


Team_038
--------------------------------------------------------------------------------
Player                MIN  PTS  REB  AST  TO      FG   FG%      3P   3P%
--------------------------------------------------------------------------------
Ja Smith               17    7    1    1   0   3/4    75.0     0/0   0.0
Jaren Jokic            17    4    0    0   0   2/4    50.0     0/0   0.0
Jabari Carter          17    3    4    0   0   2/2   100.0     0/0   0.0
Tracy LaVine           31    2    0    0   0   1/2    50.0     0/0   0.0
Rudy Thompson          31    2    0    0   0   1/2    50.0     0/0   0.0
Jalen Hyland           17    2    3    1   0   1/2    50.0     0/0   0.0
DeMar Harris           31    0    0    0   0   0/1     0.0     0/0   0.0
Luka Barnes            31    0    0    1   0   0/0     0.0     0/0   0.0
Magic Dosunmu          17    0    0    1   0   0/1     0.0     0/0   0.0

TEAM: FG: 10/18 (55.6%), 3PT: 2/7 (28.6%), REB: 8 (1 off, 7 def), AST: 4, TO: 5
TEAM FOULS: 5 [Team_078 in BONUS]

================================================================================

================================================================================
                               FULL GAME COMPLETE                               
================================================================================

FINAL SCORE: Team_078 108, Team_038 87

SCORING BY QUARTER:
--------------------------------------------------------------------------------
Team                     Q1     Q2     Q3     Q4    FINAL
--------------------------------------------------------------------------------
Team_078                 36     30     27     15      108
Team_038                 25     16     24     22       87
--------------------------------------------------------------------------------

FULL GAME BOX SCORE:
================================================================================

Team_078
--------------------------------------------------------------------------------
Player                MIN  PTS  REB  AST  TO      FG   FG%      3P   3P%      FT STL BLK
--------------------------------------------------------------------------------
Jabari Barnes          31   10    0    5   4   4/11   36.4   2/5    40.0   0/0     0   1
Kyrie Carter           31   17    0    2   0   6/10   60.0   5/9    55.6   0/0     1   1
Isaiah Simmons         31   21    6    4   0   8/13   61.5   4/7    57.1   4/4     0   0
Ben Ginobili           31   10   10    5   2   4/7    57.1   1/1   100.0   1/3     0   0
Jabari Barrett         31   11   17    2   3   5/8    62.5   0/0     0.0   2/2     1   0
Magic Barrett          17   10    0    0   0   3/6    50.0   1/3    33.3   0/0     0   1
Damian Allen           17    3    0    4   1   0/3     0.0   0/1     0.0   0/0     0   0
Malcolm Randle         17   10    2    0   2   5/8    62.5   2/5    40.0   0/0     0   0
Paul Ming              17    9    7    2   3   4/6    66.7   0/0     0.0   3/3     0   0
Draymond Irving        17    4    6    3   1   3/3   100.0   0/0     0.0   2/2     1   0

TEAM: FG: 42/75 (56.0%), 3PT: 15/31 (48.4%), REB: 47 (10 off, 37 def), AST: 27, TO: 16


Team_038
--------------------------------------------------------------------------------
Player                MIN  PTS  REB  AST  TO      FG   FG%      3P   3P%      FT STL BLK
--------------------------------------------------------------------------------
Rudy Thompson          31   11    0    1   0   6/16   37.5   1/6    16.7   0/0     0   0
Malcolm Poole          31    8    0    2   0   2/5    40.0   1/2    50.0   2/2     0   0
DeMar Harris           31    2    4    4   2   2/3    66.7   0/0     0.0   0/0     0   1
Tracy LaVine           31   20    9    1   2   7/14   50.0   2/4    50.0   3/6     0   3
Luka Barnes            31    8    8    2   4   4/10   40.0   0/2     0.0   1/2     0   0
Jalen Hyland           17    8    5    1   0   3/7    42.9   2/5    40.0   0/0     0   1
Jaren Jokic            17    8    0    0   1   5/10   50.0   0/4     0.0   0/1     0   0
Magic Dosunmu          17    0    0    4   1   1/3    33.3   1/2    50.0   0/0     1   0
Jabari Carter          17    5    5    1   2   0/0     0.0   0/0     0.0   1/2     0   1
Ja Smith               17   11    5    1   2   5/6    83.3   1/2    50.0   2/2     1   0

TEAM: FG: 36/75 (48.0%), 3PT: 8/27 (29.6%), REB: 37 (7 off, 30 def), AST: 17, TO: 14

================================================================================
