================================================================================
                        FULL GAME - Team_054 vs Team_059                        
================================================================================

================================================================================
                       1ST QUARTER - Team_054 vs Team_059                       
================================================================================

[12:00] Team_054 possession (Score: 0-0)
Luka Brogdon drives to the basket... FOUL! Offensive foul on Luka Brogdon! Nikola Jokic drew the charge! [Team fouls: 1] (Luka Brogdon: 1 personal fouls) TURNOVER! (dead ball)

[11:48] Team_059 possession (Score: 0-0)
Nikola Jokic attempts a 3Pt. Heavily contested by Vince Ball (1.7 feet, ZONE)! Nikola Jokic misses. Offensive rebound by Jarrett Smith! Jarrett Smith kicks it out.

[11:32] Team_059 possession (Score: 0-0)
Jarrett Smith drives and kicks out. Nikola Jokic attempts a 3Pt. Contested by Luka Brogdon (5.3 feet, MAN). Nikola Jokic misses. Rebound secured by Lauri Irving.

[11:17] Team_054 possession (Score: 0-0)
Vince Ball attempts a 3Pt. Contested by John Iverson (3.8 feet, MAN). VINCE BALL MAKES IT! Assist: Blake Russell
Score: 3-0

[11:07] Team_059 possession (Score: 3-0)
Bam Wade throws a bad pass out of bounds! TURNOVER! (dead ball)

[10:48] Team_054 possession (Score: 3-0)
Malcolm Harden makes the Dunk and draws the foul on Jarrett Smith! And-1! Malcolm Harden to the line for 1. [Team fouls: 1] (Jarrett Smith: 1 personal fouls)   FT 1/1: GOOD Malcolm Harden makes 1/1 from the line.
Score: 6-0

[10:33] Team_059 possession (Score: 6-0)
Bam Wade attempts a 3Pt. Contested by Malcolm Harden (3.5 feet, MAN). BAM WADE MAKES IT! Assist: Nikola Jokic
Score: 6-3

[10:21] Team_054 possession (Score: 6-3)
Lauri Irving makes the Layup and draws the foul on Bam Wade! And-1! Lauri Irving to the line for 1. [Team fouls: 2] (Bam Wade: 1 personal fouls)   FT 1/1: GOOD Lauri Irving makes 1/1 from the line.
Score: 9-3

[10:04] Team_059 possession (Score: 9-3)
Blake Tatum throws a bad pass! Stolen by Lauri Irving! TURNOVER! (live ball)

[09:45] Team_054 possession (Score: 9-3)
Malcolm Harden drives, Bam Wade stays with him. Malcolm Harden attempts a Layup. Contested by Bam Wade (2.1 feet, MAN). Malcolm Harden misses. Offensive rebound by Luka Brogdon! Luka Brogdon kicks it out.

[09:30] Team_054 possession (Score: 9-3)
Malcolm Harden attempts a 3Pt. Contested by Bam Wade (3.1 feet, ZONE). Malcolm Harden misses. Rebound secured by Bam Wade.

[09:16] Team_059 possession (Score: 9-3)
John Iverson drives and kicks out. Blake Tatum attempts a 3Pt. Contested by Lauri Irving (4.2 feet, MAN). Blake Tatum misses. Offensive rebound by John Iverson! John Iverson kicks it out.

[08:59] Team_059 possession (Score: 9-3)
Bam Wade attempts a Midrange. Wide open! Luka Brogdon is 6.7 feet away. [ZONE] BAM WADE MAKES IT!
Score: 9-5

[08:49] Team_054 possession (Score: 9-5)
Malcolm Harden attempts a 3Pt. Contested by John Iverson (2.8 feet, ZONE). Malcolm Harden misses. Rebound secured by Jarrett Smith.

[08:37] Team_059 possession (Score: 9-5)
Nikola Jokic drives, Blake Russell stays with him. Nikola Jokic attempts a Dunk. Heavily contested by Blake Russell (1.7 feet, ZONE)! Nikola Jokic misses. Rebound secured by Luka Brogdon.

[08:24] Team_054 possession (Score: 9-5)
Luka Brogdon drives and kicks out. Lauri Irving attempts a 3Pt. Contested by Bam Wade (4.4 feet, ZONE). LAURI IRVING MAKES IT! Assist: Blake Russell
Score: 12-5

[08:07] Team_059 possession (Score: 12-5)
Jarrett Smith attempts a Midrange. Contested by Luka Brogdon (2.1 feet, ZONE). JARRETT SMITH MAKES IT!
Score: 12-7

[07:53] Team_054 possession (Score: 12-7)
Blake Russell drives, Jarrett Smith stays with him. Blake Russell attempts a Layup. Wide open! Jarrett Smith is 7.4 feet away. [ZONE] BLAKE RUSSELL MAKES IT!
Score: 14-7

[07:40] Team_059 possession (Score: 14-7)
Jarrett Smith drives to the basket... Jarrett Smith loses control! Ball rolls out of bounds! TURNOVER! (dead ball)

[07:22] Team_054 possession (Score: 14-7)
Vince Ball attempts a Midrange. Contested by John Iverson (4.9 feet, MAN). Vince Ball misses. Rebound secured by Bam Wade.

[07:04] Team_059 possession (Score: 14-7)
Bam Wade attempts a 3Pt. Contested by Lauri Irving (5.2 feet, ZONE). Bam Wade misses. Rebound secured by Lauri Irving.

[06:48] Team_054 possession (Score: 14-7)
Lauri Irving attempts a Midrange. Contested by John Iverson (3.8 feet, ZONE). Lauri Irving misses. Rebound secured by Jarrett Smith.

[06:33] Team_059 possession (Score: 14-7)
Blake Tatum attempts a 3Pt. Wide open! Lauri Irving is 6.2 feet away. [MAN] BLAKE TATUM MAKES IT! Assist: Bam Wade
Score: 14-10

[06:15] Team_054 possession (Score: 14-10)
Lauri Irving attempts a 3Pt. Wide open! Blake Tatum is 7.4 feet away. [MAN] Lauri Irving misses. Rebound secured by Bam Wade.

[06:03] Team_059 possession (Score: 14-10)
Nikola Jokic attempts a 3Pt. Wide open! Lauri Irving is 6.4 feet away. [ZONE] Nikola Jokic misses. Rebound secured by Blake Russell.

[05:51] Team_054 possession (Score: 14-10)
Lauri Irving attempts a 3Pt. Contested by Bam Wade (6.0 feet, ZONE). Lauri Irving misses. Rebound secured by John Iverson.

[05:33] Team_059 possession (Score: 14-10)
Nikola Jokic attempts a Midrange. Contested by Luka Brogdon (3.2 feet, MAN). Nikola Jokic misses. Rebound secured by Luka Brogdon.

[05:16] Team_054 possession (Score: 14-10)
FOUL! Offensive foul on Luka Brogdon! Nikola Jokic drew the charge! [Team fouls: 2] (Luka Brogdon: 2 personal fouls) TURNOVER! (dead ball)

[04:59] Team_059 possession (Score: 14-10)
Nikola Jokic attempts a 3Pt. Wide open! Lauri Irving is 7.4 feet away. [ZONE] Nikola Jokic misses. Rebound secured by Luka Brogdon.

[04:46] Team_054 possession (Score: 14-10)
Malcolm Harden drives to the basket... FOUL! Offensive foul on Malcolm Harden! Bam Wade drew the charge! [Team fouls: 3] (Malcolm Harden: 1 personal fouls) TURNOVER! (dead ball)

[04:29] Team_059 possession (Score: 14-10)
John Iverson attempts a 3Pt. Contested by Vince Ball (2.9 feet, MAN). John Iverson misses. Rebound secured by Blake Russell.

[04:13] Team_054 possession (Score: 14-10)
Vince Ball drives and kicks out. Luka Brogdon attempts a 3Pt. Contested by John Iverson (4.1 feet, ZONE). Luka Brogdon misses. Offensive rebound by Blake Russell! Blake Russell's putback is no good. Rebound secured by John Iverson.

[03:57] Team_059 possession (Score: 14-10)
John Iverson attempts a Layup. BLOCKED BY VINCE BALL! Ball is loose! Rebound secured by Blake Russell.

[03:38] Team_054 possession (Score: 14-10)
Lauri Irving attempts a 3Pt. Contested by Blake Tatum (2.4 feet, MAN). Lauri Irving misses. Rebound secured by Jarrett Smith.

[03:25] Team_059 possession (Score: 14-10)
Blake Tatum makes the Layup and draws the foul on Lauri Irving! And-1! Blake Tatum to the line for 1. [Team fouls: 4] (Lauri Irving: 1 personal fouls)   FT 1/1: GOOD Blake Tatum makes 1/1 from the line.
Score: 14-13

[03:10] Team_054 possession (Score: 14-13)
Vince Ball attempts a Layup. BLOCKED BY JARRETT SMITH! Ball is loose! Offensive rebound by Luka Brogdon! Luka Brogdon kicks it out.

[02:58] Team_054 possession (Score: 14-13)
Luka Brogdon attempts a Midrange. Wide open! Nikola Jokic is 6.6 feet away. [ZONE] LUKA BROGDON MAKES IT! Assist: Malcolm Harden
Score: 16-13

[02:39] Team_059 possession (Score: 16-13)
Bam Wade commits a violation (traveling/carry)! TURNOVER! (dead ball)

[02:39] Substitution (Team_059): John Iverson OUT → Allen Giddey IN (stamina_rule2)

[02:26] Team_054 possession (Score: 16-13)
Blake Russell makes the Dunk and draws the foul on Jarrett Smith! And-1! Blake Russell to the line for 1. [Team fouls: 3] (Jarrett Smith: 2 personal fouls)   FT 1/1: GOOD Blake Russell makes 1/1 from the line.
Score: 19-13

[02:07] Team_059 possession (Score: 19-13)
FOUL! Shooting foul on Vince Ball. Allen Giddey to the line for 3 free throws. [BONUS: 5 team fouls] (Vince Ball: 1 personal fouls)   FT 1/3: GOOD   FT 2/3: GOOD   FT 3/3: MISS Allen Giddey makes 2/3 from the line. Rebound secured by Luka Brogdon.
Score: 19-15

[01:54] Team_054 possession (Score: 19-15)
Lauri Irving attempts a 3Pt. Contested by Blake Tatum (4.6 feet, MAN). Lauri Irving misses. Rebound secured by Bam Wade.

[01:41] Team_059 possession (Score: 19-15)
Jarrett Smith drives, picks up Blake Russell. Help arrives from Lauri Irving! Jarrett Smith attempts a Dunk. Contested by Lauri Irving (5.3 feet, MAN). JARRETT SMITH MAKES IT!
Score: 19-17

[01:26] Team_054 possession (Score: 19-17)
Luka Brogdon attempts a Midrange. Wide open! Nikola Jokic is 7.0 feet away. [MAN] LUKA BROGDON MAKES IT! Assist: Lauri Irving
Score: 21-17

[01:12] Team_059 possession (Score: 21-17)
Nikola Jokic attempts a 3Pt. Contested by Luka Brogdon (3.4 feet, MAN). Nikola Jokic misses. Rebound secured by Luka Brogdon.

[00:57] Team_054 possession (Score: 21-17)
Vince Ball attempts a Layup. Contested by Allen Giddey (3.9 feet, MAN). VINCE BALL MAKES IT! Assist: Lauri Irving
Score: 23-17

[00:39] Team_059 possession (Score: 23-17)
Bam Wade attempts a 3Pt. Wide open! Lauri Irving is 10.0 feet away. [ZONE] Bam Wade misses. FOUL! Loose ball foul on Vince Ball during the rebound battle. [IN THE BONUS! 6 team fouls] Bam Wade to the line for 2 free throws. (Vince Ball: 2 personal fouls)   FT 1/2: GOOD   FT 2/2: GOOD Bam Wade makes 2/2 from the line.
Score: 23-19

[00:28] Team_054 possession (Score: 23-19)
Luka Brogdon attempts a 3Pt. Contested by Nikola Jokic (3.7 feet, MAN). LUKA BROGDON MAKES IT! Assist: Blake Russell
Score: 26-19

[00:13] Team_059 possession (Score: 26-19)
Nikola Jokic attempts a Layup. Heavily contested by Luka Brogdon (0.5 feet, MAN)! Nikola Jokic misses. Rebound secured by Blake Russell.

================================================================================
                              1ST QUARTER COMPLETE                              
================================================================================

1ST QUARTER SCORE: Team_054 26, Team_059 19

BOX SCORE:
================================================================================

Team_054
--------------------------------------------------------------------------------
Player                MIN  PTS  REB  AST  TO      FG   FG%      3P   3P%
--------------------------------------------------------------------------------
Luka Brogdon           12    7    7    0   0   3/3   100.0     0/0   0.0
Lauri Irving           12    6    2    2   0   2/7    28.6     0/0   0.0
Vince Ball             12    5    0    0   0   2/4    50.0     0/0   0.0
Blake Russell          12    5    4    3   0   2/2   100.0     0/0   0.0
Malcolm Harden         12    3    0    1   0   1/3    33.3     0/0   0.0

TEAM: FG: 10/19 (52.6%), 3PT: 2/8 (25.0%), REB: 14 (3 off, 11 def), AST: 6, TO: 3
TEAM FOULS: 6 [Team_059 in BONUS]


Team_059
--------------------------------------------------------------------------------
Player                MIN  PTS  REB  AST  TO      FG   FG%      3P   3P%
--------------------------------------------------------------------------------
Bam Wade               12    7    4    1   0   3/4    75.0     0/0   0.0
Blake Tatum            12    6    0    0   0   2/2   100.0     0/0   0.0
Jarrett Smith          12    4    4    0   0   2/3    66.7     0/0   0.0
Nikola Jokic           12    0    0    1   0   0/6     0.0     0/0   0.0
John Iverson           10    0    3    0   0   0/2     0.0     0/0   0.0
Allen Giddey            2    0    0    0   0   0/1     0.0     0/0   0.0

TEAM: FG: 7/18 (38.9%), 3PT: 3/9 (33.3%), REB: 10 (2 off, 8 def), AST: 2, TO: 4
TEAM FOULS: 3

================================================================================

================================================================================
                       2ND QUARTER - Team_054 vs Team_059                       
================================================================================

[12:00] Team_054 possession (Score: 26-19)
FOUL! Reach-in foul on Nikola Jokic during the drive. [Team fouls: 1] No free throws, side out. (Nikola Jokic: 1 personal fouls)

[11:46] Team_054 possession (Score: 26-19)
Vince Ball attempts a 3Pt. Contested by Bam Wade (3.6 feet, ZONE). VINCE BALL MAKES IT! Assist: Lauri Irving
Score: 29-19

[11:29] Team_059 possession (Score: 29-19)
Nikola Jokic drives and kicks out. Jarrett Smith attempts a Midrange. Wide open! Luka Brogdon is 6.1 feet away. [ZONE] Jarrett Smith misses. Rebound secured by Vince Ball.

[11:16] Team_054 possession (Score: 29-19)
Blake Russell attempts a Midrange. Contested by Nikola Jokic (3.9 feet, ZONE). Blake Russell misses. Offensive rebound by Luka Brogdon! Luka Brogdon kicks it out.

[11:00] Team_054 possession (Score: 29-19)
Lauri Irving attempts a 3Pt. Contested by Blake Tatum (3.8 feet, ZONE). LAURI IRVING MAKES IT! Assist: Blake Russell
Score: 32-19

[10:43] Team_059 possession (Score: 32-19)
Blake Tatum attempts a Midrange. Contested by Lauri Irving (4.1 feet, ZONE). Blake Tatum misses. Rebound secured by Blake Russell.

[10:29] Team_054 possession (Score: 32-19)
Luka Brogdon attempts a Layup. Wide open! Jarrett Smith is 6.5 feet away. [ZONE] Luka Brogdon misses. Rebound secured by Jarrett Smith.

[10:14] Team_059 possession (Score: 32-19)
FOUL! Shooting foul on Blake Russell. Jarrett Smith to the line for 2 free throws. [Team fouls: 1] (Blake Russell: 1 personal fouls)   FT 1/2: GOOD   FT 2/2: GOOD Jarrett Smith makes 2/2 from the line.
Score: 32-21

[09:56] Team_054 possession (Score: 32-21)
FOUL! Reach-in foul on John Iverson during the drive. [Team fouls: 2] No free throws, side out. (John Iverson: 1 personal fouls)

[09:46] Team_054 possession (Score: 32-21)
FOUL! Reach-in foul on Jarrett Smith during the drive. [Team fouls: 3] No free throws, side out. (Jarrett Smith: 1 personal fouls)

[09:32] Team_054 possession (Score: 32-21)
Luka Brogdon drives to the basket... Luka Brogdon loses the ball! Stripped by Jarrett Smith! TURNOVER! (live ball)

[09:18] Team_059 possession (Score: 32-21)
Blake Tatum attempts a 3Pt. Contested by Lauri Irving (5.4 feet, MAN). Blake Tatum misses. Rebound secured by Blake Russell.

[09:00] Team_054 possession (Score: 32-21)
Blake Russell makes the Layup and draws the foul on Bam Wade! And-1! Blake Russell to the line for 1. [Team fouls: 4] (Bam Wade: 1 personal fouls)   FT 1/1: GOOD Blake Russell makes 1/1 from the line.
Score: 35-21

[08:49] Team_059 possession (Score: 35-21)
Jarrett Smith attempts a Midrange. Wide open! Blake Russell is 6.2 feet away. [MAN] Jarrett Smith misses. Rebound secured by Luka Brogdon.

[08:37] Team_054 possession (Score: 35-21)
Blake Russell drives to the basket... Blake Russell throws a bad pass! Stolen by Jarrett Smith! TURNOVER! (live ball)

[08:22] Team_059 possession (Score: 35-21)
Jarrett Smith attempts a Layup. Contested by Blake Russell (5.1 feet, ZONE). JARRETT SMITH MAKES IT! Assist: John Iverson
Score: 35-23

[08:06] Team_054 possession (Score: 35-23)
Malcolm Harden attempts a Midrange. Contested by Nikola Jokic (5.2 feet, ZONE). Malcolm Harden misses. Rebound secured by John Iverson.

[07:53] Team_059 possession (Score: 35-23)
Blake Tatum attempts a Midrange. Contested by Blake Russell (4.7 feet, ZONE). BLAKE TATUM MAKES IT! Assist: John Iverson
Score: 35-25

[07:41] Team_054 possession (Score: 35-25)
Lauri Irving attempts a 3Pt. Contested by Blake Tatum (4.8 feet, MAN). LAURI IRVING MAKES IT! Assist: Blake Russell
Score: 38-25

[07:27] Team_059 possession (Score: 38-25)
Blake Tatum attempts a Midrange. Contested by Lauri Irving (3.7 feet, MAN). BLAKE TATUM MAKES IT! Assist: John Iverson
Score: 38-27

[07:14] Team_054 possession (Score: 38-27)
Malcolm Harden attempts a 3Pt. Wide open! Bam Wade is 6.8 feet away. [MAN] Malcolm Harden misses. Rebound secured by John Iverson.

[07:00] Team_059 possession (Score: 38-27)
Nikola Jokic drives and kicks out. John Iverson attempts a Midrange. Contested by Vince Ball (6.0 feet, MAN). John Iverson misses. Rebound secured by Blake Russell.

[06:45] Team_054 possession (Score: 38-27)
Malcolm Harden attempts a 3Pt. Wide open! Bam Wade is 7.4 feet away. [MAN] MALCOLM HARDEN MAKES IT! Assist: Lauri Irving
Score: 41-27

[06:28] Team_059 possession (Score: 41-27)
FOUL! Offensive foul on John Iverson! Vince Ball drew the charge! [Team fouls: 5] (John Iverson: 2 personal fouls) TURNOVER! (dead ball)

[06:13] Team_054 possession (Score: 41-27)
Luka Brogdon attempts a Layup. BLOCKED BY JARRETT SMITH! Ball is loose! Rebound secured by Jarrett Smith.

[06:03] Team_059 possession (Score: 41-27)
Blake Tatum makes the Dunk and draws the foul on Lauri Irving! And-1! Blake Tatum to the line for 1. [Team fouls: 2] (Lauri Irving: 1 personal fouls)   FT 1/1: GOOD Blake Tatum makes 1/1 from the line.
Score: 41-30

[05:47] Team_054 possession (Score: 41-30)
Vince Ball attempts a 3Pt. Contested by Bam Wade (2.9 feet, ZONE). Vince Ball misses. Offensive rebound by Blake Russell! Blake Russell kicks it out.

[05:34] Team_054 possession (Score: 41-30)
FOUL! Reach-in foul on Jarrett Smith during the drive. [IN THE BONUS! 6 team fouls] Luka Brogdon to the line for 2 free throws. (Jarrett Smith: 2 personal fouls)   FT 1/2: MISS   FT 2/2: GOOD Luka Brogdon makes 1/2 from the line.
Score: 42-30

[05:20] Team_059 possession (Score: 42-30)
Nikola Jokic attempts a Layup. Contested by Blake Russell (2.7 feet, ZONE). Nikola Jokic misses. Offensive rebound by Jarrett Smith! Jarrett Smith kicks it out.

[05:06] Team_059 possession (Score: 42-30)
Jarrett Smith drives to the basket... FOUL! Offensive foul on Jarrett Smith! Blake Russell drew the charge! [Team fouls: 7] (Jarrett Smith: 3 personal fouls) TURNOVER! (dead ball)

[04:48] Team_054 possession (Score: 42-30)
Blake Russell attempts a Midrange. Wide open! Blake Tatum is 6.8 feet away. [ZONE] BLAKE RUSSELL MAKES IT! Assist: Vince Ball
Score: 44-30

[04:33] Team_059 possession (Score: 44-30)
John Iverson attempts a 3Pt. Contested by Vince Ball (4.5 feet, MAN). John Iverson misses. Rebound secured by Luka Brogdon.

[04:18] Team_054 possession (Score: 44-30)
Luka Brogdon makes the Layup and draws the foul on Nikola Jokic! And-1! Luka Brogdon to the line for 1. [BONUS: 8 team fouls] (Nikola Jokic: 2 personal fouls)   FT 1/1: GOOD Luka Brogdon makes 1/1 from the line.
Score: 47-30

[04:00] Team_059 possession (Score: 47-30)
FOUL! Holding foul on Blake Russell. [Team fouls: 3] No free throws, side out. (Blake Russell: 2 personal fouls)

[03:44] Team_059 possession (Score: 47-30)
Jarrett Smith attempts a Layup. BLOCKED BY BLAKE RUSSELL! Ball is loose! Rebound secured by Luka Brogdon.

[03:30] Team_054 possession (Score: 47-30)
Blake Russell throws a bad pass out of bounds! TURNOVER! (dead ball)

[03:30] Substitution (Team_054): Malcolm Harden OUT → Shaquille Irving IN (stamina_rule2)

[03:30] Substitution (Team_054): Lauri Irving OUT → Bradley Quickley IN (stamina_rule2)

[03:30] Substitution (Team_054): Vince Ball OUT → Vince James IN (stamina_rule2)

[03:30] Substitution (Team_054): Luka Brogdon OUT → Tobias Nowitzki IN (stamina_rule2)

[03:30] Substitution (Team_054): Blake Russell OUT → Devin Jackson IN (stamina_rule2)

[03:30] Substitution (Team_059): Bam Wade OUT → Russell Quickley IN (stamina_rule2)

[03:30] Substitution (Team_059): Blake Tatum OUT → Scottie Ginobili IN (stamina_rule2)

[03:30] Substitution (Team_059): John Iverson OUT → Allen Giddey IN (stamina_rule2)

[03:30] Substitution (Team_059): Nikola Jokic OUT → Bones Middleton IN (stamina_rule2)

[03:30] Substitution (Team_059): Jarrett Smith OUT → LeBron Lowry IN (stamina_rule2)

[03:17] Team_059 possession (Score: 47-30)
FOUL! Holding foul on Vince James. [Team fouls: 4] No free throws, side out. (Vince James: 1 personal fouls)

[03:01] Team_059 possession (Score: 47-30)
Allen Giddey attempts a Layup. Heavily contested by Vince James (0.5 feet, MAN)! ALLEN GIDDEY MAKES IT!
Score: 47-32

[02:50] Team_054 possession (Score: 47-32)
Bradley Quickley attempts a Layup. Contested by Bones Middleton (3.6 feet, ZONE). Bradley Quickley misses. Offensive rebound by Vince James! Vince James kicks it out.

[02:38] Team_054 possession (Score: 47-32)
Tobias Nowitzki attempts a Midrange. Contested by Scottie Ginobili (3.4 feet, ZONE). Tobias Nowitzki misses. Rebound secured by LeBron Lowry.

[02:29] Team_059 possession (Score: 47-32)
Allen Giddey drives, picks up Tobias Nowitzki. Help arrives from Bradley Quickley! Allen Giddey attempts a Layup. Wide open! Bradley Quickley is 6.9 feet away. [ZONE] ALLEN GIDDEY MAKES IT!
Score: 47-34

[02:11] Team_054 possession (Score: 47-34)
Bradley Quickley attempts a 3Pt. Wide open! Scottie Ginobili is 6.2 feet away. [MAN] Bradley Quickley misses. Rebound secured by Bones Middleton.

[01:56] Team_059 possession (Score: 47-34)
Allen Giddey attempts a Midrange. Heavily contested by Tobias Nowitzki (1.3 feet, ZONE)! Allen Giddey misses. Offensive rebound by Scottie Ginobili! Scottie Ginobili kicks it out.

[01:43] Team_059 possession (Score: 47-34)
LeBron Lowry drives and kicks out. Russell Quickley attempts a 3Pt. Contested by Shaquille Irving (3.1 feet, ZONE). Russell Quickley misses. Rebound secured by Vince James.

[01:33] Team_054 possession (Score: 47-34)
Devin Jackson attempts a 3Pt. Wide open! Russell Quickley is 6.8 feet away. [ZONE] Devin Jackson misses. Rebound secured by LeBron Lowry.

[01:17] Team_059 possession (Score: 47-34)
LeBron Lowry drives, Devin Jackson stays with him. LeBron Lowry attempts a Layup. Contested by Devin Jackson (5.7 feet, ZONE). LeBron Lowry misses. Rebound secured by Vince James.

[01:03] Team_054 possession (Score: 47-34)
Tobias Nowitzki loses control! Ball rolls out of bounds! TURNOVER! (dead ball)

[00:51] Team_059 possession (Score: 47-34)
Bones Middleton attempts a Layup. BLOCKED BY TOBIAS NOWITZKI! Ball is loose! Rebound secured by Devin Jackson.

[00:38] Team_054 possession (Score: 47-34)
Devin Jackson drives, Bones Middleton stays with him. Devin Jackson attempts a Dunk. Wide open! Bones Middleton is 6.3 feet away. [ZONE] DEVIN JACKSON MAKES IT! Assist: Shaquille Irving
Score: 49-34

[00:25] Team_059 possession (Score: 49-34)
Bones Middleton attempts a 3Pt. Wide open! Tobias Nowitzki is 6.4 feet away. [MAN] Bones Middleton misses. Rebound secured by Vince James.

[00:08] Team_054 possession (Score: 49-34)
Shaquille Irving attempts a 3Pt. Contested by Russell Quickley (4.4 feet, ZONE). SHAQUILLE IRVING MAKES IT! Assist: Tobias Nowitzki
Score: 52-34

================================================================================
                              2ND QUARTER COMPLETE                              
================================================================================

2ND QUARTER SCORE: Team_054 26, Team_059 15

BOX SCORE:
================================================================================

Team_054
--------------------------------------------------------------------------------
Player                MIN  PTS  REB  AST  TO      FG   FG%      3P   3P%
--------------------------------------------------------------------------------
Lauri Irving           21    6    0    2   0   2/2   100.0     0/0   0.0
Blake Russell          21    5    4    2   0   2/2   100.0     0/0   0.0
Luka Brogdon           21    4    4    0   0   2/4    50.0     0/0   0.0
Vince Ball             21    3    1    1   0   1/1   100.0     0/0   0.0
Malcolm Harden         21    3    0    0   0   1/3    33.3     0/0   0.0
Shaquille Irving        3    3    0    1   0   1/1   100.0     0/0   0.0
Devin Jackson           3    2    1    0   0   1/2    50.0     0/0   0.0
Vince James             3    0    4    0   0   0/0     0.0     0/0   0.0
Tobias Nowitzki         3    0    0    1   0   0/1     0.0     0/0   0.0
Bradley Quickley        3    0    0    0   0   0/1     0.0     0/0   0.0

TEAM: FG: 10/17 (58.8%), 3PT: 5/8 (62.5%), REB: 14 (3 off, 11 def), AST: 7, TO: 4
TEAM FOULS: 4


Team_059
--------------------------------------------------------------------------------
Player                MIN  PTS  REB  AST  TO      FG   FG%      3P   3P%
--------------------------------------------------------------------------------
Blake Tatum            21    7    0    0   0   3/5    60.0     0/0   0.0
Jarrett Smith          21    4    3    0   0   2/4    50.0     0/0   0.0
Allen Giddey            6    4    0    0   0   2/2   100.0     0/0   0.0
Nikola Jokic           21    0    0    0   0   0/2     0.0     0/0   0.0
John Iverson           18    0    2    3   0   0/1     0.0     0/0   0.0
LeBron Lowry            3    0    2    0   0   0/2     0.0     0/0   0.0
Bones Middleton         3    0    1    0   0   0/2     0.0     0/0   0.0
Scottie Ginobili        3    0    1    0   0   0/0     0.0     0/0   0.0

TEAM: FG: 7/18 (38.9%), 3PT: 0/3 (0.0%), REB: 9 (2 off, 7 def), AST: 3, TO: 2
TEAM FOULS: 8 [Team_054 in BONUS]

================================================================================

================================================================================
                       3RD QUARTER - Team_054 vs Team_059                       
================================================================================

[12:00] Team_054 possession (Score: 52-34)
Blake Russell makes the Layup and draws the foul on Jarrett Smith! And-1! Blake Russell to the line for 1. [Team fouls: 1] (Jarrett Smith: 1 personal fouls)   FT 1/1: GOOD Blake Russell makes 1/1 from the line.
Score: 55-34

[11:44] Team_059 possession (Score: 55-34)
John Iverson attempts a 3Pt. Contested by Lauri Irving (2.9 feet, ZONE). JOHN IVERSON MAKES IT! Assist: Blake Tatum
Score: 55-37

[11:27] Team_054 possession (Score: 55-37)
Blake Russell attempts a Midrange. Contested by John Iverson (4.9 feet, ZONE). Blake Russell misses. Rebound secured by Bam Wade.

[11:11] Team_059 possession (Score: 55-37)
Jarrett Smith attempts a Layup. Contested by Blake Russell (4.0 feet, ZONE). JARRETT SMITH MAKES IT! Assist: Nikola Jokic
Score: 55-39

[10:56] Team_054 possession (Score: 55-39)
Luka Brogdon drives, Nikola Jokic stays with him. Luka Brogdon attempts a Dunk. Contested by Nikola Jokic (3.8 feet, MAN). LUKA BROGDON MAKES IT! Assist: Blake Russell
Score: 57-39

[10:40] Team_059 possession (Score: 57-39)
Blake Tatum attempts a 3Pt. Contested by Lauri Irving (2.8 feet, MAN). BLAKE TATUM MAKES IT! Assist: Jarrett Smith
Score: 57-42

[10:28] Team_054 possession (Score: 57-42)
Blake Russell drives, picks up Jarrett Smith. Help arrives from Bam Wade! Blake Russell attempts a Layup. Wide open! Bam Wade is 7.4 feet away. [MAN] BLAKE RUSSELL MAKES IT! Assist: Lauri Irving
Score: 59-42

[10:15] Team_059 possession (Score: 59-42)
Nikola Jokic loses control! Ball rolls out of bounds! TURNOVER! (dead ball)

[09:59] Team_054 possession (Score: 59-42)
Luka Brogdon attempts a Midrange. Wide open! John Iverson is 7.6 feet away. [ZONE] Luka Brogdon misses. Rebound secured by John Iverson.

[09:43] Team_059 possession (Score: 59-42)
John Iverson drives and kicks out. Bam Wade attempts a 3Pt. Contested by Lauri Irving (3.8 feet, ZONE). Bam Wade misses. FOUL! Loose ball foul on Blake Russell during the rebound battle. [Team fouls: 1] No free throws, side out. (Blake Russell: 1 personal fouls)

[09:29] Team_059 possession (Score: 59-42)
Blake Tatum attempts a Layup. Contested by Blake Russell (3.2 feet, ZONE). BLAKE TATUM MAKES IT!
Score: 59-44

[09:19] Team_054 possession (Score: 59-44)
Vince Ball attempts a 3Pt. Contested by John Iverson (3.7 feet, ZONE). VINCE BALL MAKES IT! Assist: Luka Brogdon
Score: 62-44

[09:06] Team_059 possession (Score: 62-44)
Bam Wade attempts a 3Pt. Contested by Lauri Irving (5.2 feet, ZONE). Bam Wade misses. Offensive rebound by Jarrett Smith! Jarrett Smith kicks it out.

[08:54] Team_059 possession (Score: 62-44)
John Iverson makes the Layup and draws the foul on Lauri Irving! And-1! John Iverson to the line for 1. [Team fouls: 2] (Lauri Irving: 1 personal fouls)   FT 1/1: MISS John Iverson makes 0/1 from the line. Rebound secured by Blake Russell.
Score: 62-46

[08:37] Team_054 possession (Score: 62-46)
Vince Ball drives, Jarrett Smith stays with him. Vince Ball attempts a Dunk. Contested by Jarrett Smith (3.2 feet, ZONE). VINCE BALL MAKES IT! Assist: Malcolm Harden
Score: 64-46

[08:21] Team_059 possession (Score: 64-46)
John Iverson throws a bad pass out of bounds! TURNOVER! (dead ball)

[08:01] Team_054 possession (Score: 64-46)
Lauri Irving makes the Midrange and draws the foul on Nikola Jokic! And-1! Lauri Irving to the line for 1. [Team fouls: 2] (Nikola Jokic: 1 personal fouls)   FT 1/1: GOOD Lauri Irving makes 1/1 from the line.
Score: 67-46

[07:47] Team_059 possession (Score: 67-46)
Blake Tatum drives and kicks out. Blake Tatum attempts a 3Pt. Heavily contested by Lauri Irving (0.5 feet, ZONE)! Blake Tatum misses. Offensive rebound by John Iverson! John Iverson kicks it out.

[07:35] Team_059 possession (Score: 67-46)
John Iverson attempts a 3Pt. Contested by Lauri Irving (4.1 feet, ZONE). John Iverson misses. Rebound secured by Blake Russell.

[07:20] Team_054 possession (Score: 67-46)
Blake Russell drives to the basket... Blake Russell loses control! Ball rolls out of bounds! TURNOVER! (dead ball)

[07:05] Team_059 possession (Score: 67-46)
FOUL! Shooting foul on Blake Russell. Blake Tatum to the line for 2 free throws. [Team fouls: 3] (Blake Russell: 2 personal fouls)   FT 1/2: MISS   FT 2/2: MISS Blake Tatum makes 0/2 from the line. Rebound secured by Blake Russell.

[06:53] Team_054 possession (Score: 67-46)
Blake Russell drives to the basket... Blake Russell loses the ball! Stripped by Jarrett Smith! TURNOVER! (live ball)

[06:42] Team_059 possession (Score: 67-46)
Jarrett Smith drives, Blake Russell stays with him. Jarrett Smith attempts a Layup. Contested by Blake Russell (3.2 feet, ZONE). JARRETT SMITH MAKES IT!
Score: 67-48

[06:27] Team_054 possession (Score: 67-48)
Malcolm Harden attempts a Layup. Heavily contested by Jarrett Smith (1.4 feet, ZONE)! MALCOLM HARDEN MAKES IT! Assist: Vince Ball
Score: 69-48

[06:10] Team_059 possession (Score: 69-48)
Nikola Jokic attempts a 3Pt. Contested by Luka Brogdon (3.0 feet, MAN). Nikola Jokic misses. Rebound secured by Lauri Irving.

[05:55] Team_054 possession (Score: 69-48)
Lauri Irving attempts a 3Pt. Wide open! Blake Tatum is 6.1 feet away. [MAN] Lauri Irving misses. Rebound secured by Bam Wade.

[05:38] Team_059 possession (Score: 69-48)
Blake Tatum attempts a 3Pt. Heavily contested by Lauri Irving (0.5 feet, MAN)! Blake Tatum misses. Rebound secured by Blake Russell.

[05:19] Team_054 possession (Score: 69-48)
Vince Ball attempts a 3Pt. Contested by Blake Tatum (3.8 feet, ZONE). Vince Ball misses. FOUL! Loose ball foul on Bam Wade during the rebound battle. [Team fouls: 3] No free throws, side out. (Bam Wade: 1 personal fouls)

[05:04] Team_054 possession (Score: 69-48)
FOUL! Reach-in foul on Jarrett Smith during the drive. [Team fouls: 4] No free throws, side out. (Jarrett Smith: 2 personal fouls)

[04:47] Team_054 possession (Score: 69-48)
Luka Brogdon attempts a Midrange. Wide open! Nikola Jokic is 7.8 feet away. [ZONE] Luka Brogdon misses. Offensive rebound by Luka Brogdon! Luka Brogdon kicks it out.

[04:33] Team_054 possession (Score: 69-48)
FOUL! Reach-in foul on Nikola Jokic during the drive. [IN THE BONUS! 5 team fouls] Luka Brogdon to the line for 2 free throws. (Nikola Jokic: 2 personal fouls)   FT 1/2: GOOD   FT 2/2: MISS Luka Brogdon makes 1/2 from the line. Rebound secured by Bam Wade.
Score: 70-48

[04:18] Team_059 possession (Score: 70-48)
Nikola Jokic loses the ball! Stripped by Luka Brogdon! TURNOVER! (live ball)

[04:02] Team_054 possession (Score: 70-48)
Malcolm Harden attempts a 3Pt. Contested by Bam Wade (4.6 feet, ZONE). Malcolm Harden misses. Rebound secured by Jarrett Smith.

[03:44] Team_059 possession (Score: 70-48)
Nikola Jokic attempts a Midrange. Contested by Luka Brogdon (3.2 feet, MAN). NIKOLA JOKIC MAKES IT!
Score: 70-50

[03:30] Team_054 possession (Score: 70-50)
Blake Russell drives, Jarrett Smith stays with him. Blake Russell attempts a Dunk. Contested by Jarrett Smith (5.0 feet, ZONE). BLAKE RUSSELL MAKES IT!
Score: 72-50

[03:12] Team_059 possession (Score: 72-50)
John Iverson attempts a 3Pt. Contested by Lauri Irving (2.6 feet, ZONE). John Iverson misses. Rebound secured by Vince Ball.

[02:58] Team_054 possession (Score: 72-50)
FOUL! Offensive foul on Blake Russell! Jarrett Smith drew the charge! [Team fouls: 4] (Blake Russell: 3 personal fouls) TURNOVER! (dead ball)

[02:47] Team_059 possession (Score: 72-50)
John Iverson attempts a 3Pt. Contested by Lauri Irving (3.5 feet, ZONE). John Iverson misses. Rebound secured by Blake Russell.

[02:30] Team_054 possession (Score: 72-50)
Blake Russell attempts a Midrange. Contested by Jarrett Smith (5.9 feet, MAN). BLAKE RUSSELL MAKES IT! Assist: Vince Ball
Score: 74-50

[02:16] Team_059 possession (Score: 74-50)
FOUL! Shooting foul on Lauri Irving. Nikola Jokic to the line for 3 free throws. [BONUS: 5 team fouls] (Lauri Irving: 2 personal fouls)   FT 1/3: GOOD   FT 2/3: GOOD   FT 3/3: MISS Nikola Jokic makes 2/3 from the line. Rebound secured by Blake Russell.
Score: 74-52

[02:03] Team_054 possession (Score: 74-52)
Malcolm Harden drives, Bam Wade stays with him. Malcolm Harden attempts a Layup. Contested by Bam Wade (2.7 feet, MAN). Malcolm Harden misses. Rebound secured by Bam Wade.

[01:50] Team_059 possession (Score: 74-52)
FOUL! Shooting foul on Luka Brogdon. Nikola Jokic to the line for 2 free throws. [BONUS: 6 team fouls] (Luka Brogdon: 1 personal fouls)   FT 1/2: GOOD   FT 2/2: GOOD Nikola Jokic makes 2/2 from the line.
Score: 74-54

[01:35] Team_054 possession (Score: 74-54)
Vince Ball drives, John Iverson stays with him. Vince Ball attempts a Layup. Contested by John Iverson (5.2 feet, MAN). Vince Ball misses. Rebound secured by Jarrett Smith.

[01:19] Team_059 possession (Score: 74-54)
Blake Tatum attempts a 3Pt. Contested by Lauri Irving (3.5 feet, MAN). BLAKE TATUM MAKES IT!
Score: 74-57

[01:06] Team_054 possession (Score: 74-57)
Lauri Irving loses the ball! Stripped by Blake Tatum! TURNOVER! (live ball)

[00:55] Team_059 possession (Score: 74-57)
Nikola Jokic attempts a Midrange. Contested by Luka Brogdon (2.1 feet, MAN). NIKOLA JOKIC MAKES IT!
Score: 74-59

[00:39] Team_054 possession (Score: 74-59)
Lauri Irving drives, Blake Tatum stays with him. Lauri Irving attempts a Layup. Contested by Blake Tatum (3.3 feet, MAN). LAURI IRVING MAKES IT! Assist: Blake Russell
Score: 76-59

[00:28] Team_059 possession (Score: 76-59)
Jarrett Smith attempts a Midrange. Contested by Blake Russell (4.6 feet, MAN). Jarrett Smith misses. Rebound secured by Blake Russell.

[00:15] Team_054 possession (Score: 76-59)
Vince Ball attempts a Midrange. Wide open! John Iverson is 7.6 feet away. [MAN] Vince Ball misses. Rebound secured by Jarrett Smith.

[00:02] Team_059 possession (Score: 76-59)
Jarrett Smith attempts a 3Pt. Heavily contested by Lauri Irving (1.3 feet, ZONE)! JARRETT SMITH MAKES IT! Assist: Blake Tatum
Score: 76-62

================================================================================
                              3RD QUARTER COMPLETE                              
================================================================================

3RD QUARTER SCORE: Team_054 24, Team_059 28

BOX SCORE:
================================================================================

Team_054
--------------------------------------------------------------------------------
Player                MIN  PTS  REB  AST  TO      FG   FG%      3P   3P%
--------------------------------------------------------------------------------
Blake Russell          33    9    8    2   0   4/5    80.0     0/0   0.0
Lauri Irving           33    5    1    1   0   2/3    66.7     0/0   0.0
Vince Ball             33    5    1    2   0   2/4    50.0     0/0   0.0
Luka Brogdon           33    2    1    1   0   1/3    33.3     0/0   0.0
Malcolm Harden         33    2    0    1   0   1/3    33.3     0/0   0.0

TEAM: FG: 10/18 (55.6%), 3PT: 1/3 (33.3%), REB: 11 (2 off, 9 def), AST: 7, TO: 4
TEAM FOULS: 6 [Team_059 in BONUS]


Team_059
--------------------------------------------------------------------------------
Player                MIN  PTS  REB  AST  TO      FG   FG%      3P   3P%
--------------------------------------------------------------------------------
Blake Tatum            33    8    0    2   0   3/5    60.0     0/0   0.0
Jarrett Smith          33    7    4    1   0   3/4    75.0     0/0   0.0
Nikola Jokic           33    6    0    1   0   3/5    60.0     0/0   0.0
John Iverson           30    3    3    0   0   1/5    20.0     0/0   0.0
Bam Wade               33    0    4    0   0   0/0     0.0     0/0   0.0

TEAM: FG: 10/19 (52.6%), 3PT: 4/10 (40.0%), REB: 11 (3 off, 8 def), AST: 4, TO: 3
TEAM FOULS: 5 [Team_054 in BONUS]

================================================================================

================================================================================
                       4TH QUARTER - Team_054 vs Team_059                       
================================================================================

[12:00] Team_054 possession (Score: 76-62)
Blake Russell drives and kicks out. FOUL! Shooting foul on Nikola Jokic. Blake Russell to the line for 2 free throws. [Team fouls: 1] (Nikola Jokic: 1 personal fouls)   FT 1/2: GOOD   FT 2/2: GOOD Blake Russell makes 2/2 from the line.
Score: 78-62

[11:46] Team_059 possession (Score: 78-62)
Bam Wade attempts a 3Pt. Contested by Malcolm Harden (4.9 feet, MAN). Bam Wade misses. Rebound secured by Blake Russell.

[11:32] Team_054 possession (Score: 78-62)
Vince Ball attempts a 3Pt. Contested by Bam Wade (3.1 feet, ZONE). Vince Ball misses. Rebound secured by John Iverson.

[11:20] Team_059 possession (Score: 78-62)
Nikola Jokic attempts a Layup. Heavily contested by Blake Russell (1.7 feet, ZONE)! NIKOLA JOKIC MAKES IT! Assist: Blake Tatum
Score: 78-64

[11:02] Team_054 possession (Score: 78-64)
Vince Ball throws a bad pass! Stolen by John Iverson! TURNOVER! (live ball)

[10:51] Team_059 possession (Score: 78-64)
Jarrett Smith drives and kicks out. Blake Tatum attempts a 3Pt. Contested by Lauri Irving (4.6 feet, MAN). Blake Tatum misses. Rebound secured by Blake Russell.

[10:35] Team_054 possession (Score: 78-64)
FOUL! Holding foul on Blake Tatum. [Team fouls: 2] No free throws, side out. (Blake Tatum: 1 personal fouls)

[10:22] Team_054 possession (Score: 78-64)
Vince Ball attempts a 3Pt. Wide open! Bam Wade is 7.7 feet away. [ZONE] VINCE BALL MAKES IT! Assist: Lauri Irving
Score: 81-64

[10:07] Team_059 possession (Score: 81-64)
Blake Tatum attempts a 3Pt. Heavily contested by Lauri Irving (1.7 feet, MAN)! Blake Tatum misses. Rebound secured by Vince Ball.

[09:57] Team_054 possession (Score: 81-64)
Vince Ball makes the Layup and draws the foul on Jarrett Smith! And-1! Vince Ball to the line for 1. [Team fouls: 3] (Jarrett Smith: 1 personal fouls)   FT 1/1: GOOD Vince Ball makes 1/1 from the line.
Score: 84-64

[09:46] Team_059 possession (Score: 84-64)
Nikola Jokic drives to the basket... Nikola Jokic loses the ball! Stripped by Blake Russell! TURNOVER! (live ball)

[09:33] Team_054 possession (Score: 84-64)
Malcolm Harden throws a bad pass out of bounds! TURNOVER! (dead ball)

[09:33] Substitution (Team_054): Malcolm Harden OUT → Shaquille Irving IN (stamina_rule2)

[09:33] Substitution (Team_054): Lauri Irving OUT → Bradley Quickley IN (stamina_rule2)

[09:33] Substitution (Team_054): Vince Ball OUT → Vince James IN (stamina_rule2)

[09:33] Substitution (Team_054): Luka Brogdon OUT → Tobias Nowitzki IN (stamina_rule2)

[09:33] Substitution (Team_054): Blake Russell OUT → Devin Jackson IN (stamina_rule2)

[09:33] Substitution (Team_059): Bam Wade OUT → Russell Quickley IN (stamina_rule2)

[09:33] Substitution (Team_059): Blake Tatum OUT → Scottie Ginobili IN (stamina_rule2)

[09:33] Substitution (Team_059): John Iverson OUT → Allen Giddey IN (stamina_rule2)

[09:33] Substitution (Team_059): Nikola Jokic OUT → Bones Middleton IN (stamina_rule2)

[09:33] Substitution (Team_059): Jarrett Smith OUT → LeBron Lowry IN (stamina_rule2)

[09:18] Team_059 possession (Score: 84-64)
Russell Quickley attempts a 3Pt. Wide open! Shaquille Irving is 7.1 feet away. [MAN] Russell Quickley misses. Offensive rebound by Bones Middleton! Bones Middleton kicks it out.

[09:07] Team_059 possession (Score: 84-64)
FOUL! Shooting foul on Shaquille Irving. Russell Quickley to the line for 2 free throws. [Team fouls: 1] (Shaquille Irving: 1 personal fouls)   FT 1/2: GOOD   FT 2/2: GOOD Russell Quickley makes 2/2 from the line.
Score: 84-66

[08:53] Team_054 possession (Score: 84-66)
Tobias Nowitzki drives and kicks out. Devin Jackson attempts a Midrange. Wide open! Allen Giddey is 8.5 feet away. [ZONE] Devin Jackson misses. Rebound secured by Scottie Ginobili.

[08:42] Team_059 possession (Score: 84-66)
LeBron Lowry throws a bad pass out of bounds! TURNOVER! (dead ball)

[08:29] Team_054 possession (Score: 84-66)
Devin Jackson drives, Bones Middleton stays with him. Devin Jackson attempts a Layup. Contested by Bones Middleton (3.5 feet, ZONE). Devin Jackson misses. Rebound secured by Bones Middleton.

[08:14] Team_059 possession (Score: 84-66)
Scottie Ginobili attempts a Midrange. Contested by Bradley Quickley (2.9 feet, MAN). Scottie Ginobili misses. Rebound secured by Devin Jackson.

[07:59] Team_054 possession (Score: 84-66)
Vince James attempts a 3Pt. Wide open! Allen Giddey is 7.3 feet away. [MAN] VINCE JAMES MAKES IT! Assist: Devin Jackson
Score: 87-66

[07:41] Team_059 possession (Score: 87-66)
Russell Quickley drives, Tobias Nowitzki stays with him. Russell Quickley attempts a Dunk. Wide open! Tobias Nowitzki is 6.4 feet away. [ZONE] RUSSELL QUICKLEY MAKES IT! Assist: Allen Giddey
Score: 87-68

[07:26] Team_054 possession (Score: 87-68)
Vince James throws a bad pass out of bounds! TURNOVER! (dead ball)

[07:09] Team_059 possession (Score: 87-68)
Allen Giddey attempts a 3Pt. Contested by Shaquille Irving (3.5 feet, ZONE). Allen Giddey misses. Offensive rebound by Bones Middleton! Bones Middleton kicks it out.

[06:55] Team_059 possession (Score: 87-68)
FOUL! Shooting foul on Tobias Nowitzki. Bones Middleton to the line for 2 free throws. [Team fouls: 2] (Tobias Nowitzki: 1 personal fouls)   FT 1/2: MISS   FT 2/2: GOOD Bones Middleton makes 1/2 from the line.
Score: 87-69

[06:37] Team_054 possession (Score: 87-69)
FOUL! Holding foul on Scottie Ginobili. [Team fouls: 4] No free throws, side out. (Scottie Ginobili: 1 personal fouls)

[06:22] Team_054 possession (Score: 87-69)
FOUL! Holding foul on Scottie Ginobili. [IN THE BONUS! 5 team fouls] Bradley Quickley to the line for 2 free throws. (Scottie Ginobili: 2 personal fouls)   FT 1/2: GOOD   FT 2/2: GOOD Bradley Quickley makes 2/2 from the line.
Score: 89-69

[06:08] Team_059 possession (Score: 89-69)
Allen Giddey attempts a 3Pt. Wide open! Shaquille Irving is 8.2 feet away. [ZONE] Allen Giddey misses. Rebound secured by Vince James.

[05:53] Team_054 possession (Score: 89-69)
Devin Jackson makes the 3Pt and draws the foul on Russell Quickley! And-1! Devin Jackson to the line for 1. [BONUS: 6 team fouls] (Russell Quickley: 1 personal fouls)   FT 1/1: GOOD Devin Jackson makes 1/1 from the line.
Score: 93-69

[05:36] Team_059 possession (Score: 93-69)
Scottie Ginobili drives to the basket... FOUL! Offensive foul on Scottie Ginobili! Devin Jackson drew the charge! [Team fouls: 7] (Scottie Ginobili: 3 personal fouls) TURNOVER! (dead ball)

[05:21] Team_054 possession (Score: 93-69)
FOUL! Shooting foul on Scottie Ginobili. Tobias Nowitzki to the line for 2 free throws. [BONUS: 8 team fouls] (Scottie Ginobili: 4 personal fouls)   FT 1/2: GOOD   FT 2/2: GOOD Tobias Nowitzki makes 2/2 from the line.
Score: 95-69

[05:03] Team_059 possession (Score: 95-69)
Bones Middleton drives to the basket... Bones Middleton loses control! Ball rolls out of bounds! TURNOVER! (dead ball)

[04:49] Team_054 possession (Score: 95-69)
Vince James drives and kicks out. Devin Jackson attempts a 3Pt. Contested by Russell Quickley (5.0 feet, ZONE). Devin Jackson misses. Rebound secured by Scottie Ginobili.

[04:36] Team_059 possession (Score: 95-69)
Scottie Ginobili drives, picks up Devin Jackson. Help arrives from Bradley Quickley! Scottie Ginobili attempts a Layup. Contested by Bradley Quickley (2.5 feet, ZONE). SCOTTIE GINOBILI MAKES IT!
Score: 95-71

[04:22] Team_054 possession (Score: 95-71)
Bradley Quickley attempts a Midrange. Contested by Scottie Ginobili (2.9 feet, MAN). Bradley Quickley misses. Rebound secured by Bones Middleton.

[04:11] Team_059 possession (Score: 95-71)
Bones Middleton attempts a 3Pt. Contested by Shaquille Irving (4.6 feet, ZONE). BONES MIDDLETON MAKES IT! Assist: Scottie Ginobili
Score: 95-74

[03:56] Team_054 possession (Score: 95-74)
Shaquille Irving attempts a 3Pt. Contested by Russell Quickley (2.1 feet, MAN). Shaquille Irving misses. Rebound secured by Scottie Ginobili.

[03:37] Team_059 possession (Score: 95-74)
Bones Middleton attempts a 3Pt. Wide open! Shaquille Irving is 7.6 feet away. [ZONE] Bones Middleton misses. FOUL! Loose ball foul on Tobias Nowitzki during the rebound battle. [Team fouls: 3] No free throws, side out. (Tobias Nowitzki: 2 personal fouls)

[03:22] Team_059 possession (Score: 95-74)
Bones Middleton attempts a Midrange. Wide open! Tobias Nowitzki is 8.4 feet away. [MAN] BONES MIDDLETON MAKES IT! Assist: Russell Quickley
Score: 95-76

[03:06] Team_054 possession (Score: 95-76)
Bradley Quickley attempts a 3Pt. Wide open! Russell Quickley is 6.2 feet away. [ZONE] Bradley Quickley misses. Rebound secured by Scottie Ginobili.

[02:49] Team_059 possession (Score: 95-76)
FOUL! Offensive foul on Allen Giddey! Vince James drew the charge! [Team fouls: 9] (Allen Giddey: 1 personal fouls) TURNOVER! (dead ball)

[02:35] Team_054 possession (Score: 95-76)
Bradley Quickley attempts a Midrange. Contested by Scottie Ginobili (4.3 feet, ZONE). Bradley Quickley misses. Rebound secured by LeBron Lowry.

[02:20] Team_059 possession (Score: 95-76)
FOUL! Offensive foul on LeBron Lowry! Devin Jackson drew the charge! [Team fouls: 10] (LeBron Lowry: 1 personal fouls) TURNOVER! (dead ball)

[02:07] Team_054 possession (Score: 95-76)
Bradley Quickley attempts a Layup. BLOCKED BY BONES MIDDLETON! Ball goes out off Bones Middleton. Bradley Quickley's ball!

[01:52] Team_054 possession (Score: 95-76)
FOUL! Holding foul on Russell Quickley. [IN THE BONUS! 11 team fouls] Shaquille Irving to the line for 2 free throws. (Russell Quickley: 2 personal fouls)   FT 1/2: MISS   FT 2/2: GOOD Shaquille Irving makes 1/2 from the line.
Score: 96-76

[01:37] Team_059 possession (Score: 96-76)
Bones Middleton makes the Midrange and draws the foul on Tobias Nowitzki! And-1! Bones Middleton to the line for 1. [Team fouls: 4] (Tobias Nowitzki: 3 personal fouls)   FT 1/1: GOOD Bones Middleton makes 1/1 from the line.
Score: 96-79

[01:21] Team_054 possession (Score: 96-79)
Bradley Quickley attempts a 3Pt. Wide open! Scottie Ginobili is 6.5 feet away. [MAN] Bradley Quickley misses. Rebound secured by Scottie Ginobili.

[01:09] Team_059 possession (Score: 96-79)
Scottie Ginobili attempts a Midrange. Contested by Bradley Quickley (3.4 feet, ZONE). Scottie Ginobili misses. Offensive rebound by Scottie Ginobili! Scottie Ginobili kicks it out.

[00:55] Team_059 possession (Score: 96-79)
LeBron Lowry attempts a Layup. Wide open! Devin Jackson is 6.8 feet away. [MAN] LEBRON LOWRY MAKES IT!
Score: 96-81

[00:43] Team_054 possession (Score: 96-81)
Devin Jackson throws a bad pass! Stolen by LeBron Lowry! TURNOVER! (live ball)

[00:29] Team_059 possession (Score: 96-81)
Scottie Ginobili loses control! Ball rolls out of bounds! TURNOVER! (dead ball)

[00:15] Team_054 possession (Score: 96-81)
Vince James attempts a Midrange. Wide open! Allen Giddey is 9.9 feet away. [MAN] Vince James misses. Rebound secured by Bones Middleton.

================================================================================
                              4TH QUARTER COMPLETE                              
================================================================================

4TH QUARTER SCORE: Team_054 20, Team_059 19

BOX SCORE:
================================================================================

Team_054
--------------------------------------------------------------------------------
Player                MIN  PTS  REB  AST  TO      FG   FG%      3P   3P%
--------------------------------------------------------------------------------
Vince Ball             36    6    1    0   0   2/3    66.7     0/0   0.0
Devin Jackson          13    4    1    1   0   1/2    50.0     0/0   0.0
Vince James            13    3    1    0   0   1/3    33.3     0/0   0.0
Blake Russell          36    2    2    0   0   1/1   100.0     0/0   0.0
Tobias Nowitzki        13    2    0    0   0   1/2    50.0     0/0   0.0
Bradley Quickley       13    2    0    0   0   1/5    20.0     0/0   0.0
Shaquille Irving       13    1    0    0   0   1/2    50.0     0/0   0.0
Lauri Irving           36    0    0    1   0   0/0     0.0     0/0   0.0

TEAM: FG: 8/18 (44.4%), 3PT: 3/7 (42.9%), REB: 5 (0 off, 5 def), AST: 2, TO: 4
TEAM FOULS: 4


Team_059
--------------------------------------------------------------------------------
Player                MIN  PTS  REB  AST  TO      FG   FG%      3P   3P%
--------------------------------------------------------------------------------
Bones Middleton        13    9    6    0   0   4/4   100.0     0/0   0.0
Russell Quickley       13    4    0    1   0   2/2   100.0     0/0   0.0
Nikola Jokic           36    2    0    0   0   1/1   100.0     0/0   0.0
Scottie Ginobili       13    2    6    1   0   1/2    50.0     0/0   0.0
LeBron Lowry           13    2    1    0   0   1/1   100.0     0/0   0.0
Bam Wade               36    0    0    0   0   0/1     0.0     0/0   0.0
John Iverson           33    0    1    0   0   0/0     0.0     0/0   0.0
Blake Tatum            36    0    0    1   0   0/1     0.0     0/0   0.0
Jarrett Smith          36    0    0    0   0   0/1     0.0     0/0   0.0
Allen Giddey           15    0    0    1   0   0/1     0.0     0/0   0.0

TEAM: FG: 9/14 (64.3%), 3PT: 1/4 (25.0%), REB: 14 (4 off, 10 def), AST: 4, TO: 7
TEAM FOULS: 11 [Team_054 in BONUS]

================================================================================

================================================================================
                               FULL GAME COMPLETE                               
================================================================================

FINAL SCORE: Team_054 96, Team_059 81

SCORING BY QUARTER:
--------------------------------------------------------------------------------
Team                     Q1     Q2     Q3     Q4    FINAL
--------------------------------------------------------------------------------
Team_054                 26     26     24     20       96
Team_059                 19     15     28     19       81
--------------------------------------------------------------------------------

FULL GAME BOX SCORE:
================================================================================

Team_054
--------------------------------------------------------------------------------
Player                MIN  PTS  REB  AST  TO      FG   FG%      3P   3P%      FT STL BLK
--------------------------------------------------------------------------------
Malcolm Harden         36    8    0    2   1   3/9    33.3   1/5    20.0   1/1     0   0
Lauri Irving           36   17    3    6   3   5/11   45.5   2/7    28.6   2/2     1   0
Vince Ball             36   19    3    3   2   7/12   58.3   4/5    80.0   1/1     0   1
Luka Brogdon           36   13   12    1   3   7/11   63.6   1/1   100.0   3/5     1   0
Blake Russell          36   21   18    7   3   9/10   90.0   0/0     0.0   5/5     1   1
Shaquille Irving       13    4    0    1   0   1/2    50.0   1/2    50.0   1/2     0   0
Bradley Quickley       13    2    0    0   0   0/5     0.0   0/3     0.0   2/2     0   0
Vince James            13    3    5    0   1   1/3    33.3   1/1   100.0   0/0     0   0
Tobias Nowitzki        13    2    0    1   1   1/3    33.3   0/0     0.0   2/2     0   1
Devin Jackson          13    6    2    1   1   2/4    50.0   1/2    50.0   1/1     0   0

TEAM: FG: 38/72 (52.8%), 3PT: 11/26 (42.3%), REB: 44 (8 off, 36 def), AST: 22, TO: 15


Team_059
--------------------------------------------------------------------------------
Player                MIN  PTS  REB  AST  TO      FG   FG%      3P   3P%      FT STL BLK
--------------------------------------------------------------------------------
Bam Wade               36    7    8    1   2   3/5    60.0   2/4    50.0   2/2     0   0
Blake Tatum            36   21    0    3   1   8/13   61.5   3/6    50.0   2/4     1   0
Nikola Jokic           36    8    0    2   3   4/14   28.6   0/5     0.0   4/5     0   0
Jarrett Smith          36   15   11    1   2   7/12   58.3   1/1   100.0   2/2     3   2
John Iverson           33    3    9    3   2   1/8    12.5   1/6    16.7   0/1     1   0
Allen Giddey           15    4    0    1   2   2/4    50.0   0/2     0.0   2/3     0   0
Russell Quickley       13    4    0    1   1   2/2   100.0   0/0     0.0   2/2     0   0
Scottie Ginobili       13    2    7    1   1   1/2    50.0   0/0     0.0   0/0     0   0
Bones Middleton        13    9    7    0   0   4/6    66.7   1/2    50.0   2/3     0   1
LeBron Lowry           13    2    3    0   2   1/3    33.3   0/0     0.0   0/0     1   0

TEAM: FG: 33/69 (47.8%), 3PT: 8/26 (30.8%), REB: 44 (11 off, 33 def), AST: 13, TO: 16

================================================================================
