================================================================================
                        FULL GAME - Team_064 vs Team_042                        
================================================================================

================================================================================
                       1ST QUARTER - Team_064 vs Team_042                       
================================================================================

[12:00] Team_064 possession (Score: 0-0)
Russell Simons attempts a 3Pt. Contested by Dejounte Butler (4.6 feet, MAN). RUSSELL SIMONS MAKES IT! Assist: Ja Mitchell
Score: 3-0

[11:43] Team_042 possession (Score: 3-0)
Jarrett Sabonis attempts a Layup. BLOCKED BY KAWHI IRVING! Ball is loose! Rebound secured by Russell Simons.

[11:31] Team_064 possession (Score: 3-0)
Jordan Mitchell attempts a 3Pt. Heavily contested by Tyler Barrett (1.0 feet, ZONE)! Jordan Mitchell misses. Rebound secured by Cade Dosunmu.

[11:13] Team_042 possession (Score: 3-0)
Kristaps Parker drives, Russell Simons stays with him. Kristaps Parker attempts a Dunk. Heavily contested by Russell Simons (0.5 feet, ZONE)! Kristaps Parker misses. Offensive rebound by Cade Dosunmu! Cade Dosunmu puts it back in!
Score: 3-2

[11:03] Team_064 possession (Score: 3-2)
Ja Mitchell throws a bad pass! Stolen by Tyler Barrett! TURNOVER! (live ball)

[10:49] Team_042 possession (Score: 3-2)
Tyler Barrett attempts a Midrange. Wide open! Kawhi Irving is 9.4 feet away. [ZONE] Tyler Barrett misses. FOUL! Loose ball foul on Kawhi Irving during the rebound battle. [Team fouls: 1] No free throws, side out. (Kawhi Irving: 1 personal fouls)

[10:35] Team_042 possession (Score: 3-2)
Dejounte Butler attempts a 3Pt. Heavily contested by Russell Simons (1.6 feet, MAN)! Dejounte Butler misses. Rebound secured by Shai Hyland.

[10:18] Team_064 possession (Score: 3-2)
Russell Simons drives, Cade Dosunmu stays with him. Russell Simons attempts a Dunk. Contested by Cade Dosunmu (4.9 feet, ZONE). RUSSELL SIMONS MAKES IT! Assist: Kawhi Irving
Score: 5-2

[10:04] Team_042 possession (Score: 5-2)
Kristaps Parker attempts a 3Pt. Contested by Jordan Mitchell (4.1 feet, MAN). Kristaps Parker misses. Rebound secured by Russell Simons.

[09:51] Team_064 possession (Score: 5-2)
Jordan Mitchell attempts a Layup. Contested by Cade Dosunmu (4.0 feet, ZONE). Jordan Mitchell misses. Rebound secured by Dejounte Butler.

[09:36] Team_042 possession (Score: 5-2)
Kristaps Parker drives, picks up Jordan Mitchell. Help arrives from Kawhi Irving! Kristaps Parker attempts a Dunk. Heavily contested by Kawhi Irving (1.2 feet, MAN)! KRISTAPS PARKER MAKES IT! Assist: Cade Dosunmu
Score: 5-4

[09:23] Team_064 possession (Score: 5-4)
Shai Hyland drives to the basket... FOUL! Offensive foul on Shai Hyland! Cade Dosunmu drew the charge! [Team fouls: 2] (Shai Hyland: 1 personal fouls) TURNOVER! (dead ball)

[09:11] Team_042 possession (Score: 5-4)
Kristaps Parker drives and kicks out. Cade Dosunmu attempts a Midrange. Contested by Shai Hyland (2.5 feet, MAN). Cade Dosunmu misses. FOUL! Loose ball foul on Russell Simons during the rebound battle. [Team fouls: 3] No free throws, side out. (Russell Simons: 1 personal fouls)

[08:52] Team_042 possession (Score: 5-4)
Kristaps Parker attempts a Midrange. Contested by Jordan Mitchell (4.2 feet, MAN). KRISTAPS PARKER MAKES IT! Assist: Dejounte Butler
Score: 5-6

[08:36] Team_064 possession (Score: 5-6)
Shai Hyland attempts a 3Pt. Wide open! Cade Dosunmu is 8.0 feet away. [MAN] Shai Hyland misses. Rebound secured by Cade Dosunmu.

[08:21] Team_042 possession (Score: 5-6)
Kristaps Parker drives, Jordan Mitchell stays with him. Kristaps Parker attempts a Layup. Contested by Jordan Mitchell (2.7 feet, MAN). KRISTAPS PARKER MAKES IT! Assist: Tyler Barrett
Score: 5-8

[08:07] Team_064 possession (Score: 5-8)
Ja Mitchell attempts a 3Pt. Wide open! Tyler Barrett is 7.9 feet away. [ZONE] Ja Mitchell misses. Rebound secured by Tyler Barrett.

[07:49] Team_042 possession (Score: 5-8)
Tyler Barrett attempts a 3Pt. Contested by Ja Mitchell (5.5 feet, MAN). TYLER BARRETT MAKES IT! Assist: Dejounte Butler
Score: 5-11

[07:30] Team_064 possession (Score: 5-11)
Ja Mitchell attempts a 3Pt. Contested by Tyler Barrett (5.9 feet, MAN). Ja Mitchell misses. Rebound secured by Cade Dosunmu.

[07:16] Team_042 possession (Score: 5-11)
Tyler Barrett commits a violation (traveling/carry)! TURNOVER! (dead ball)

[07:05] Team_064 possession (Score: 5-11)
Shai Hyland attempts a Midrange. Contested by Cade Dosunmu (5.6 feet, MAN). Shai Hyland misses. Rebound secured by Cade Dosunmu.

[06:52] Team_042 possession (Score: 5-11)
Dejounte Butler makes the Midrange and draws the foul on Kawhi Irving! And-1! Dejounte Butler to the line for 1. [Team fouls: 4] (Kawhi Irving: 2 personal fouls)   FT 1/1: GOOD Dejounte Butler makes 1/1 from the line.
Score: 5-14

[06:37] Team_064 possession (Score: 5-14)
FOUL! Holding foul on Cade Dosunmu. [Team fouls: 1] No free throws, side out. (Cade Dosunmu: 1 personal fouls)

[06:23] Team_064 possession (Score: 5-14)
Ja Mitchell drives and kicks out. Kawhi Irving attempts a 3Pt. Contested by Tyler Barrett (3.5 feet, ZONE). KAWHI IRVING MAKES IT! Assist: Shai Hyland
Score: 8-14

[06:09] Team_042 possession (Score: 8-14)
Kristaps Parker drives to the basket... Kristaps Parker loses the ball! Stripped by Jordan Mitchell! TURNOVER! (live ball)

[05:56] Team_064 possession (Score: 8-14)
Shai Hyland attempts a Layup. Contested by Cade Dosunmu (2.1 feet, ZONE). Shai Hyland misses. Offensive rebound by Kawhi Irving! Kawhi Irving kicks it out.

[05:42] Team_064 possession (Score: 8-14)
Shai Hyland loses the ball! Stripped by Cade Dosunmu! TURNOVER! (live ball)

[05:26] Team_042 possession (Score: 8-14)
Jarrett Sabonis attempts a 3Pt. Wide open! Kawhi Irving is 10.0 feet away. [MAN] Jarrett Sabonis misses. Rebound secured by Kawhi Irving.

[05:07] Team_064 possession (Score: 8-14)
Jordan Mitchell attempts a Midrange. Wide open! Kristaps Parker is 7.0 feet away. [MAN] JORDAN MITCHELL MAKES IT! Assist: Ja Mitchell
Score: 10-14

[04:56] Team_042 possession (Score: 10-14)
Kristaps Parker drives and kicks out. Jarrett Sabonis attempts a 3Pt. Contested by Russell Simons (4.9 feet, ZONE). Jarrett Sabonis misses. Rebound secured by Russell Simons.

[04:42] Team_064 possession (Score: 10-14)
Ja Mitchell drives, picks up Tyler Barrett. Help arrives from Jarrett Sabonis! Ja Mitchell attempts a Dunk. Contested by Jarrett Sabonis (3.4 feet, MAN). Ja Mitchell misses. Rebound secured by Dejounte Butler.

[04:26] Team_042 possession (Score: 10-14)
FOUL! Holding foul on Russell Simons. [IN THE BONUS! 5 team fouls] Dejounte Butler to the line for 2 free throws. (Russell Simons: 2 personal fouls)   FT 1/2: GOOD   FT 2/2: MISS Dejounte Butler makes 1/2 from the line. Rebound secured by Shai Hyland.
Score: 10-15

[04:17] Team_064 possession (Score: 10-15)
Kawhi Irving makes the Layup and draws the foul on Jarrett Sabonis! And-1! Kawhi Irving to the line for 1. [Team fouls: 2] (Jarrett Sabonis: 1 personal fouls)   FT 1/1: GOOD Kawhi Irving makes 1/1 from the line.
Score: 13-15

[04:07] Team_042 possession (Score: 13-15)
Cade Dosunmu drives to the basket... Cade Dosunmu throws a bad pass out of bounds! TURNOVER! (dead ball)

[03:50] Team_064 possession (Score: 13-15)
Shai Hyland loses the ball! Stripped by Cade Dosunmu! TURNOVER! (live ball)

[03:36] Team_042 possession (Score: 13-15)
Kristaps Parker attempts a 3Pt. Contested by Kawhi Irving (5.5 feet, ZONE). KRISTAPS PARKER MAKES IT! Assist: Jarrett Sabonis
Score: 13-18

[03:20] Team_064 possession (Score: 13-18)
Shai Hyland drives and kicks out. Kawhi Irving attempts a Midrange. Contested by Jarrett Sabonis (4.2 feet, MAN). KAWHI IRVING MAKES IT!
Score: 15-18

[03:08] Team_042 possession (Score: 15-18)
Dejounte Butler attempts a Layup. Contested by Russell Simons (5.8 feet, MAN). Dejounte Butler misses. Rebound secured by Russell Simons.

[02:52] Team_064 possession (Score: 15-18)
Jordan Mitchell attempts a Midrange. Wide open! Kristaps Parker is 7.2 feet away. [ZONE] Jordan Mitchell misses. Rebound secured by Dejounte Butler.

[02:40] Team_042 possession (Score: 15-18)
Dejounte Butler attempts a Layup. Heavily contested by Russell Simons (1.0 feet, MAN)! Dejounte Butler misses. Rebound secured by Russell Simons.

[02:27] Team_064 possession (Score: 15-18)
Kawhi Irving attempts a Midrange. Contested by Dejounte Butler (5.7 feet, ZONE). Kawhi Irving misses. Offensive rebound by Russell Simons! Russell Simons kicks it out.

[02:15] Team_064 possession (Score: 15-18)
Jordan Mitchell drives and kicks out. Ja Mitchell attempts a 3Pt. Contested by Tyler Barrett (3.7 feet, ZONE). Ja Mitchell misses. Rebound secured by Dejounte Butler.

[01:59] Team_042 possession (Score: 15-18)
Tyler Barrett attempts a 3Pt. Contested by Ja Mitchell (5.1 feet, ZONE). Tyler Barrett misses. Rebound secured by Kawhi Irving.

[01:46] Team_064 possession (Score: 15-18)
Russell Simons attempts a Midrange. Contested by Kristaps Parker (4.2 feet, ZONE). Russell Simons misses. Rebound secured by Cade Dosunmu.

[01:33] Team_042 possession (Score: 15-18)
Jarrett Sabonis attempts a 3Pt. Wide open! Ja Mitchell is 9.2 feet away. [ZONE] Jarrett Sabonis misses. Offensive rebound by Dejounte Butler! Dejounte Butler's putback is no good. Offensive rebound by Cade Dosunmu! Cade Dosunmu kicks it out.

[01:18] Team_042 possession (Score: 15-18)
Dejounte Butler attempts a 3Pt. Wide open! Russell Simons is 6.2 feet away. [MAN] Dejounte Butler misses. Rebound secured by Russell Simons.

[01:04] Team_064 possession (Score: 15-18)
Jordan Mitchell throws a bad pass out of bounds! TURNOVER! (dead ball)

[01:04] Substitution (Team_064): Ja Mitchell OUT → CJ Haliburton IN (stamina_rule2)

[01:04] Substitution (Team_064): Jordan Mitchell OUT → Ja Simmons IN (stamina_rule2)

[01:04] Substitution (Team_064): Kawhi Irving OUT → Tobias Herro IN (stamina_rule2)

[01:04] Substitution (Team_064): Russell Simons OUT → Austin Smith IN (stamina_rule2)

[01:04] Substitution (Team_064): Shai Hyland OUT → Devin Cunningham IN (stamina_rule2)

[01:04] Substitution (Team_042): Tyler Barrett OUT → Khris George IN (stamina_rule2)

[01:04] Substitution (Team_042): Kristaps Parker OUT → Isaiah Randle IN (stamina_rule2)

[01:04] Substitution (Team_042): Jarrett Sabonis OUT → Gary Jackson IN (stamina_rule2)

[01:04] Substitution (Team_042): Dejounte Butler OUT → Allen Towns IN (stamina_rule2)

[01:04] Substitution (Team_042): Cade Dosunmu OUT → Lamelo Stewart IN (stamina_rule2)

[00:48] Team_042 possession (Score: 15-18)
Allen Towns throws a bad pass! Stolen by Austin Smith! TURNOVER! (live ball)

[00:35] Team_064 possession (Score: 15-18)
Tobias Herro attempts a Midrange. Wide open! Isaiah Randle is 6.7 feet away. [ZONE] TOBIAS HERRO MAKES IT! Assist: CJ Haliburton
Score: 17-18

[00:23] Team_042 possession (Score: 17-18)
Khris George attempts a 3Pt. Wide open! Austin Smith is 8.2 feet away. [ZONE] Khris George misses. Rebound secured by Austin Smith.

[00:07] Team_064 possession (Score: 17-18)
FOUL! Shooting foul on Khris George. Austin Smith to the line for 3 free throws. [Team fouls: 3] (Khris George: 1 personal fouls)   FT 1/3: GOOD   FT 2/3: GOOD   FT 3/3: MISS Austin Smith makes 2/3 from the line. Rebound secured by Allen Towns.
Score: 19-18

================================================================================
                              1ST QUARTER COMPLETE                              
================================================================================

1ST QUARTER SCORE: Team_064 19, Team_042 18

BOX SCORE:
================================================================================

Team_064
--------------------------------------------------------------------------------
Player                MIN  PTS  REB  AST  TO      FG   FG%      3P   3P%
--------------------------------------------------------------------------------
Kawhi Irving           11    8    3    1   0   3/3   100.0     0/0   0.0
Russell Simons         11    5    7    0   0   2/3    66.7     0/0   0.0
Jordan Mitchell        11    2    0    0   0   1/5    20.0     0/0   0.0
Tobias Herro            1    2    0    0   0   1/1   100.0     0/0   0.0
Ja Mitchell            11    0    0    2   0   0/3     0.0     0/0   0.0
Shai Hyland            11    0    2    1   0   0/2     0.0     0/0   0.0
CJ Haliburton           1    0    0    1   0   0/0     0.0     0/0   0.0
Austin Smith            1    0    1    0   0   0/1     0.0     0/0   0.0

TEAM: FG: 7/18 (38.9%), 3PT: 1/6 (16.7%), REB: 13 (2 off, 11 def), AST: 5, TO: 5
TEAM FOULS: 5 [Team_042 in BONUS]


Team_042
--------------------------------------------------------------------------------
Player                MIN  PTS  REB  AST  TO      FG   FG%      3P   3P%
--------------------------------------------------------------------------------
Kristaps Parker        11    9    0    0   0   4/6    66.7     0/0   0.0
Dejounte Butler        11    3    5    2   0   1/5    20.0     0/0   0.0
Tyler Barrett          11    3    1    1   0   1/2    50.0     0/0   0.0
Cade Dosunmu           11    2    8    1   0   1/1   100.0     0/0   0.0
Jarrett Sabonis        11    0    0    1   0   0/2     0.0     0/0   0.0
Khris George            1    0    0    0   0   0/1     0.0     0/0   0.0
Allen Towns             1    0    1    0   0   0/0     0.0     0/0   0.0

TEAM: FG: 7/18 (38.9%), 3PT: 2/8 (25.0%), REB: 15 (4 off, 11 def), AST: 5, TO: 4
TEAM FOULS: 3

================================================================================

================================================================================
                       2ND QUARTER - Team_064 vs Team_042                       
================================================================================

[12:00] Team_064 possession (Score: 19-18)
FOUL! Shooting foul on Tyler Barrett. Kawhi Irving to the line for 2 free throws. [Team fouls: 1] (Tyler Barrett: 1 personal fouls)   FT 1/2: GOOD   FT 2/2: GOOD Kawhi Irving makes 2/2 from the line.
Score: 21-18

[11:43] Team_042 possession (Score: 21-18)
Jarrett Sabonis loses control! Ball rolls out of bounds! TURNOVER! (dead ball)

[11:43] Substitution (Team_064): Russell Simons OUT → Austin Smith IN (stamina_rule2)

[11:43] Substitution (Team_064): Shai Hyland OUT → Devin Cunningham IN (stamina_rule2)

[11:43] Substitution (Team_042): Cade Dosunmu OUT → Lamelo Stewart IN (stamina_rule2)

[11:25] Team_064 possession (Score: 21-18)
Ja Mitchell drives, Dejounte Butler stays with him. Ja Mitchell attempts a Layup. Wide open! Dejounte Butler is 7.1 feet away. [ZONE] JA MITCHELL MAKES IT! Assist: Devin Cunningham
Score: 23-18

[11:07] Team_042 possession (Score: 23-18)
Jarrett Sabonis attempts a Midrange. Contested by Kawhi Irving (5.3 feet, MAN). Jarrett Sabonis misses. Rebound secured by Austin Smith.

[10:53] Team_064 possession (Score: 23-18)
Ja Mitchell attempts a Layup. Contested by Tyler Barrett (2.4 feet, MAN). JA MITCHELL MAKES IT!
Score: 25-18

[10:40] Team_042 possession (Score: 25-18)
Kristaps Parker attempts a Midrange. Wide open! Jordan Mitchell is 6.7 feet away. [MAN] KRISTAPS PARKER MAKES IT! Assist: Dejounte Butler
Score: 25-20

[10:30] Team_064 possession (Score: 25-20)
FOUL! Holding foul on Kristaps Parker. [Team fouls: 2] No free throws, side out. (Kristaps Parker: 1 personal fouls)

[10:16] Team_064 possession (Score: 25-20)
Devin Cunningham attempts a Midrange. Contested by Jarrett Sabonis (5.6 feet, ZONE). Devin Cunningham misses. Rebound secured by Tyler Barrett.

[10:06] Team_042 possession (Score: 25-20)
Jarrett Sabonis attempts a Midrange. Contested by Kawhi Irving (5.3 feet, MAN). Jarrett Sabonis misses. Rebound secured by Austin Smith.

[09:51] Team_064 possession (Score: 25-20)
Devin Cunningham drives to the basket... Devin Cunningham loses the ball! Stripped by Dejounte Butler! TURNOVER! (live ball)

[09:37] Team_042 possession (Score: 25-20)
Kristaps Parker drives, picks up Jordan Mitchell. Help arrives from Kawhi Irving! Kristaps Parker attempts a Layup. Heavily contested by Kawhi Irving (1.6 feet, MAN)! Kristaps Parker misses. Offensive rebound by Lamelo Stewart! Lamelo Stewart kicks it out.

[09:21] Team_042 possession (Score: 25-20)
Dejounte Butler drives, picks up Austin Smith. Help arrives from Jordan Mitchell! Dejounte Butler attempts a Dunk. Contested by Jordan Mitchell (2.6 feet, MAN). DEJOUNTE BUTLER MAKES IT! Assist: Kristaps Parker
Score: 25-22

[09:04] Team_064 possession (Score: 25-22)
Jordan Mitchell attempts a 3Pt. Contested by Kristaps Parker (5.0 feet, MAN). Jordan Mitchell misses. Rebound secured by Tyler Barrett.

[08:53] Team_042 possession (Score: 25-22)
Kristaps Parker attempts a 3Pt. Contested by Jordan Mitchell (4.5 feet, MAN). Kristaps Parker misses. Rebound secured by Austin Smith.

[08:38] Team_064 possession (Score: 25-22)
Kawhi Irving drives and kicks out. Jordan Mitchell attempts a Midrange. Contested by Kristaps Parker (5.9 feet, ZONE). JORDAN MITCHELL MAKES IT!
Score: 27-22

[08:24] Team_042 possession (Score: 27-22)
Kristaps Parker attempts a 3Pt. Contested by Jordan Mitchell (4.0 feet, ZONE). Kristaps Parker misses. Rebound secured by Austin Smith.

[08:11] Team_064 possession (Score: 27-22)
Ja Mitchell attempts a 3Pt. Contested by Tyler Barrett (4.2 feet, ZONE). Ja Mitchell misses. Rebound secured by Tyler Barrett.

[07:56] Team_042 possession (Score: 27-22)
Tyler Barrett drives and kicks out. Jarrett Sabonis attempts a 3Pt. Wide open! Kawhi Irving is 8.7 feet away. [MAN] JARRETT SABONIS MAKES IT! Assist: Dejounte Butler
Score: 27-25

[07:41] Team_064 possession (Score: 27-25)
Jordan Mitchell throws a bad pass out of bounds! TURNOVER! (dead ball)

[07:41] Substitution (Team_064): Ja Mitchell OUT → CJ Haliburton IN (stamina_rule2)

[07:41] Substitution (Team_064): Jordan Mitchell OUT → Ja Simmons IN (stamina_rule2)

[07:41] Substitution (Team_064): Kawhi Irving OUT → Tobias Herro IN (stamina_rule2)

[07:41] Substitution (Team_042): Tyler Barrett OUT → Khris George IN (stamina_rule2)

[07:41] Substitution (Team_042): Kristaps Parker OUT → Isaiah Randle IN (stamina_rule2)

[07:41] Substitution (Team_042): Jarrett Sabonis OUT → Gary Jackson IN (stamina_rule2)

[07:41] Substitution (Team_042): Dejounte Butler OUT → Allen Towns IN (stamina_rule2)

[07:25] Team_042 possession (Score: 27-25)
Lamelo Stewart attempts a Layup. Contested by Austin Smith (3.1 feet, ZONE). LAMELO STEWART MAKES IT! Assist: Allen Towns
Score: 27-27

[07:10] Team_064 possession (Score: 27-27)
Tobias Herro attempts a 3Pt. Heavily contested by Gary Jackson (0.5 feet, MAN)! Tobias Herro misses. Rebound secured by Allen Towns.

[06:56] Team_042 possession (Score: 27-27)
Allen Towns attempts a Midrange. Contested by Austin Smith (3.8 feet, MAN). Allen Towns misses. FOUL! Loose ball foul on Ja Simmons during the rebound battle. [Team fouls: 1] No free throws, side out. (Ja Simmons: 1 personal fouls)

[06:44] Team_042 possession (Score: 27-27)
Lamelo Stewart drives and kicks out. Gary Jackson attempts a 3Pt. Contested by Austin Smith (4.4 feet, ZONE). GARY JACKSON MAKES IT! Assist: Khris George
Score: 27-30

[06:32] Team_064 possession (Score: 27-30)
FOUL! Holding foul on Isaiah Randle. [Team fouls: 3] No free throws, side out. (Isaiah Randle: 1 personal fouls)

[06:16] Team_064 possession (Score: 27-30)
Austin Smith drives to the basket... Austin Smith commits a violation (traveling/carry)! TURNOVER! (dead ball)

[06:05] Team_042 possession (Score: 27-30)
Lamelo Stewart attempts a Layup. Contested by Devin Cunningham (5.3 feet, MAN). LAMELO STEWART MAKES IT! Assist: Khris George
Score: 27-32

[05:48] Team_064 possession (Score: 27-32)
CJ Haliburton attempts a 3Pt. Contested by Khris George (4.2 feet, MAN). CJ Haliburton misses. Offensive rebound by Austin Smith! Austin Smith kicks it out.

[05:35] Team_064 possession (Score: 27-32)
CJ Haliburton attempts a 3Pt. Heavily contested by Khris George (1.7 feet, ZONE)! CJ Haliburton misses. Rebound secured by Gary Jackson.

[05:21] Team_042 possession (Score: 27-32)
Isaiah Randle attempts a 3Pt. Contested by Ja Simmons (4.4 feet, MAN). Isaiah Randle misses. Rebound secured by Austin Smith.

[05:08] Team_064 possession (Score: 27-32)
Austin Smith attempts a Layup. Contested by Allen Towns (3.8 feet, ZONE). Austin Smith misses. Rebound secured by Gary Jackson.

[04:57] Team_042 possession (Score: 27-32)
FOUL! Reach-in foul on Ja Simmons during the drive. [Team fouls: 2] No free throws, side out. (Ja Simmons: 2 personal fouls)

[04:40] Team_042 possession (Score: 27-32)
Allen Towns attempts a Midrange. Wide open! Austin Smith is 6.7 feet away. [ZONE] ALLEN TOWNS MAKES IT! Assist: Lamelo Stewart
Score: 27-34

[04:23] Team_064 possession (Score: 27-34)
Devin Cunningham drives to the basket... FOUL! Offensive foul on Devin Cunningham! Lamelo Stewart drew the charge! [Team fouls: 3] (Devin Cunningham: 1 personal fouls) TURNOVER! (dead ball)

[04:06] Team_042 possession (Score: 27-34)
Isaiah Randle drives and kicks out. Khris George attempts a 3Pt. Contested by CJ Haliburton (4.0 feet, MAN). Khris George misses. Rebound secured by Ja Simmons.

[03:52] Team_064 possession (Score: 27-34)
FOUL! Reach-in foul on Khris George during the drive. [Team fouls: 4] No free throws, side out. (Khris George: 1 personal fouls)

[03:35] Team_064 possession (Score: 27-34)
Ja Simmons makes the Layup and draws the foul on Allen Towns! And-1! Ja Simmons to the line for 1. [BONUS: 5 team fouls] (Allen Towns: 1 personal fouls)   FT 1/1: MISS Ja Simmons makes 0/1 from the line. Rebound secured by Allen Towns.
Score: 29-34

[03:22] Team_042 possession (Score: 29-34)
Gary Jackson drives, Austin Smith stays with him. Gary Jackson attempts a Dunk. Contested by Austin Smith (5.0 feet, ZONE). GARY JACKSON MAKES IT! Assist: Khris George
Score: 29-36

[03:11] Team_064 possession (Score: 29-36)
Devin Cunningham loses control! Ball rolls out of bounds! TURNOVER! (dead ball)

[03:00] Team_042 possession (Score: 29-36)
Allen Towns attempts a Midrange. Contested by Austin Smith (4.9 feet, MAN). ALLEN TOWNS MAKES IT!
Score: 29-38

[02:45] Team_064 possession (Score: 29-38)
Devin Cunningham makes the Layup and draws the foul on Lamelo Stewart! And-1! Devin Cunningham to the line for 1. [BONUS: 6 team fouls] (Lamelo Stewart: 1 personal fouls)   FT 1/1: GOOD Devin Cunningham makes 1/1 from the line.
Score: 32-38

[02:29] Team_042 possession (Score: 32-38)
Khris George attempts a 3Pt. Contested by CJ Haliburton (5.1 feet, ZONE). Khris George misses. Rebound secured by Austin Smith.

[02:12] Team_064 possession (Score: 32-38)
Devin Cunningham drives and kicks out. Devin Cunningham attempts a Midrange. Contested by Lamelo Stewart (3.2 feet, MAN). Devin Cunningham misses. Rebound secured by Allen Towns.

[02:00] Team_042 possession (Score: 32-38)
FOUL! Reach-in foul on Austin Smith during the drive. [Team fouls: 4] No free throws, side out. (Austin Smith: 1 personal fouls)

[01:46] Team_042 possession (Score: 32-38)
Isaiah Randle throws a bad pass out of bounds! TURNOVER! (dead ball)

[01:31] Team_064 possession (Score: 32-38)
Tobias Herro attempts a 3Pt. Contested by Khris George (2.4 feet, ZONE). Tobias Herro misses. Rebound secured by Allen Towns.

[01:16] Team_042 possession (Score: 32-38)
Gary Jackson attempts a 3Pt. Wide open! CJ Haliburton is 8.4 feet away. [ZONE] Gary Jackson misses. Rebound secured by Devin Cunningham.

[01:03] Team_064 possession (Score: 32-38)
Ja Simmons attempts a 3Pt. Contested by Khris George (3.9 feet, ZONE). JA SIMMONS MAKES IT! Assist: Austin Smith
Score: 35-38

[00:50] Team_042 possession (Score: 35-38)
Khris George attempts a Midrange. Wide open! Ja Simmons is 7.1 feet away. [ZONE] KHRIS GEORGE MAKES IT!
Score: 35-40

[00:31] Team_064 possession (Score: 35-40)
Devin Cunningham attempts a Layup. Contested by Allen Towns (2.9 feet, ZONE). DEVIN CUNNINGHAM MAKES IT!
Score: 37-40

[00:19] Team_042 possession (Score: 37-40)
Lamelo Stewart makes the Layup and draws the foul on Ja Simmons! And-1! Lamelo Stewart to the line for 1. [BONUS: 5 team fouls] (Ja Simmons: 3 personal fouls)   FT 1/1: GOOD Lamelo Stewart makes 1/1 from the line.
Score: 37-43

[00:04] Team_064 possession (Score: 37-43)
Austin Smith loses control! Ball rolls out of bounds! TURNOVER! (dead ball)

================================================================================
                              2ND QUARTER COMPLETE                              
================================================================================

2ND QUARTER SCORE: Team_064 18, Team_042 25

BOX SCORE:
================================================================================

Team_064
--------------------------------------------------------------------------------
Player                MIN  PTS  REB  AST  TO      FG   FG%      3P   3P%
--------------------------------------------------------------------------------
Devin Cunningham       13    5    1    1   0   2/4    50.0     0/0   0.0
Ja Mitchell            16    4    0    0   0   2/3    66.7     0/0   0.0
Ja Simmons              9    3    1    0   0   1/2    50.0     0/0   0.0
Kawhi Irving           16    2    0    0   0   1/1   100.0     0/0   0.0
Jordan Mitchell        16    2    0    0   0   1/2    50.0     0/0   0.0
Austin Smith           13    0    7    1   0   0/1     0.0     0/0   0.0
Tobias Herro            9    0    0    0   0   0/2     0.0     0/0   0.0
CJ Haliburton           9    0    0    0   0   0/1     0.0     0/0   0.0

TEAM: FG: 7/16 (43.8%), 3PT: 1/6 (16.7%), REB: 9 (1 off, 8 def), AST: 2, TO: 6
TEAM FOULS: 5 [Team_042 in BONUS]


Team_042
--------------------------------------------------------------------------------
Player                MIN  PTS  REB  AST  TO      FG   FG%      3P   3P%
--------------------------------------------------------------------------------
Lamelo Stewart         13    7    2    1   0   3/3   100.0     0/0   0.0
Gary Jackson            9    5    2    0   0   2/3    66.7     0/0   0.0
Allen Towns             9    4    4    1   0   2/2   100.0     0/0   0.0
Jarrett Sabonis        16    3    0    0   0   1/3    33.3     0/0   0.0
Kristaps Parker        16    2    0    1   0   1/3    33.3     0/0   0.0
Dejounte Butler        16    2    0    2   0   1/1   100.0     0/0   0.0
Khris George            9    2    0    3   0   1/2    50.0     0/0   0.0
Tyler Barrett          16    0    3    0   0   0/0     0.0     0/0   0.0
Isaiah Randle           9    0    0    0   0   0/2     0.0     0/0   0.0

TEAM: FG: 11/19 (57.9%), 3PT: 0/5 (0.0%), REB: 11 (2 off, 9 def), AST: 8, TO: 2
TEAM FOULS: 6 [Team_064 in BONUS]

================================================================================

================================================================================
                       3RD QUARTER - Team_064 vs Team_042                       
================================================================================

[12:00] Team_064 possession (Score: 37-43)
Ja Mitchell attempts a 3Pt. Heavily contested by Tyler Barrett (0.5 feet, ZONE)! Ja Mitchell misses. Rebound secured by Tyler Barrett.

[11:46] Team_042 possession (Score: 37-43)
Kristaps Parker attempts a 3Pt. Wide open! Jordan Mitchell is 10.0 feet away. [MAN] KRISTAPS PARKER MAKES IT! Assist: Cade Dosunmu
Score: 37-46

[11:33] Team_064 possession (Score: 37-46)
FOUL! Holding foul on Tyler Barrett. [Team fouls: 1] No free throws, side out. (Tyler Barrett: 1 personal fouls)

[11:19] Team_064 possession (Score: 37-46)
Ja Mitchell attempts a 3Pt. Wide open! Kristaps Parker is 6.2 feet away. [ZONE] JA MITCHELL MAKES IT! Assist: Shai Hyland
Score: 40-46

[11:03] Team_042 possession (Score: 40-46)
Cade Dosunmu attempts a Midrange. Contested by Shai Hyland (3.4 feet, MAN). CADE DOSUNMU MAKES IT! Assist: Kristaps Parker
Score: 40-48

[10:48] Team_064 possession (Score: 40-48)
Shai Hyland makes the Dunk and draws the foul on Cade Dosunmu! And-1! Shai Hyland to the line for 1. [Team fouls: 2] (Cade Dosunmu: 1 personal fouls)   FT 1/1: GOOD Shai Hyland makes 1/1 from the line.
Score: 43-48

[10:39] Team_042 possession (Score: 43-48)
Jarrett Sabonis commits a violation (traveling/carry)! TURNOVER! (dead ball)

[10:24] Team_064 possession (Score: 43-48)
FOUL! Shooting foul on Kristaps Parker. Jordan Mitchell to the line for 2 free throws. [Team fouls: 3] (Kristaps Parker: 1 personal fouls)   FT 1/2: GOOD   FT 2/2: GOOD Jordan Mitchell makes 2/2 from the line.
Score: 45-48

[10:07] Team_042 possession (Score: 45-48)
Jarrett Sabonis commits a violation (traveling/carry)! TURNOVER! (dead ball)

[09:51] Team_064 possession (Score: 45-48)
Ja Mitchell attempts a Midrange. Wide open! Tyler Barrett is 7.7 feet away. [MAN] Ja Mitchell misses. Rebound secured by Tyler Barrett.

[09:34] Team_042 possession (Score: 45-48)
Dejounte Butler drives and kicks out. Tyler Barrett attempts a 3Pt. Wide open! Ja Mitchell is 6.1 feet away. [ZONE] Tyler Barrett misses. Rebound secured by Russell Simons.

[09:16] Team_064 possession (Score: 45-48)
Shai Hyland attempts a Layup. Contested by Cade Dosunmu (3.3 feet, MAN). SHAI HYLAND MAKES IT!
Score: 47-48

[09:01] Team_042 possession (Score: 47-48)
Tyler Barrett drives, Russell Simons stays with him. Tyler Barrett attempts a Dunk. Heavily contested by Russell Simons (1.4 feet, ZONE)! Tyler Barrett misses. Rebound secured by Shai Hyland.

[08:50] Team_064 possession (Score: 47-48)
Ja Mitchell makes the Layup and draws the foul on Tyler Barrett! And-1! Ja Mitchell to the line for 1. [Team fouls: 4] (Tyler Barrett: 2 personal fouls)   FT 1/1: GOOD Ja Mitchell makes 1/1 from the line.
Score: 50-48

[08:36] Team_042 possession (Score: 50-48)
Kristaps Parker attempts a Layup. Heavily contested by Jordan Mitchell (0.5 feet, MAN)! KRISTAPS PARKER MAKES IT! Assist: Dejounte Butler
Score: 50-50

[08:21] Team_064 possession (Score: 50-50)
Shai Hyland attempts a 3Pt. Contested by Tyler Barrett (5.1 feet, ZONE). Shai Hyland misses. Rebound secured by Tyler Barrett.

[08:10] Team_042 possession (Score: 50-50)
Kristaps Parker attempts a 3Pt. Contested by Jordan Mitchell (5.6 feet, MAN). Kristaps Parker misses. Rebound secured by Russell Simons.

[07:51] Team_064 possession (Score: 50-50)
FOUL! Shooting foul on Tyler Barrett. Ja Mitchell to the line for 2 free throws. [BONUS: 5 team fouls] (Tyler Barrett: 3 personal fouls)   FT 1/2: GOOD   FT 2/2: GOOD Ja Mitchell makes 2/2 from the line.
Score: 52-50

[07:41] Team_042 possession (Score: 52-50)
Dejounte Butler drives, Russell Simons stays with him. Dejounte Butler attempts a Dunk. Heavily contested by Russell Simons (0.5 feet, ZONE)! DEJOUNTE BUTLER MAKES IT!
Score: 52-52

[07:30] Team_064 possession (Score: 52-52)
FOUL! Shooting foul on Cade Dosunmu. Jordan Mitchell to the line for 2 free throws. [BONUS: 6 team fouls] (Cade Dosunmu: 2 personal fouls)   FT 1/2: GOOD   FT 2/2: GOOD Jordan Mitchell makes 2/2 from the line.
Score: 54-52

[07:12] Team_042 possession (Score: 54-52)
Cade Dosunmu makes the Dunk and draws the foul on Russell Simons! And-1! Cade Dosunmu to the line for 1. [Team fouls: 1] (Russell Simons: 1 personal fouls)   FT 1/1: GOOD Cade Dosunmu makes 1/1 from the line.
Score: 54-55

[06:55] Team_064 possession (Score: 54-55)
Jordan Mitchell attempts a 3Pt. Contested by Kristaps Parker (5.1 feet, MAN). JORDAN MITCHELL MAKES IT!
Score: 57-55

[06:36] Team_042 possession (Score: 57-55)
FOUL! Shooting foul on Russell Simons. Tyler Barrett to the line for 2 free throws. [Team fouls: 2] (Russell Simons: 2 personal fouls)   FT 1/2: GOOD   FT 2/2: GOOD Tyler Barrett makes 2/2 from the line.
Score: 57-57

[06:18] Team_064 possession (Score: 57-57)
FOUL! Shooting foul on Tyler Barrett. Russell Simons to the line for 2 free throws. [BONUS: 7 team fouls] (Tyler Barrett: 4 personal fouls)   FT 1/2: GOOD   FT 2/2: MISS Russell Simons makes 1/2 from the line. Rebound secured by Dejounte Butler.
Score: 58-57

[06:07] Team_042 possession (Score: 58-57)
Dejounte Butler attempts a Midrange. Contested by Russell Simons (5.5 feet, MAN). Dejounte Butler misses. Offensive rebound by Dejounte Butler! Dejounte Butler puts it back in!
Score: 58-59

[05:53] Team_064 possession (Score: 58-59)
Shai Hyland attempts a Midrange. Contested by Cade Dosunmu (3.9 feet, MAN). Shai Hyland misses. Rebound secured by Dejounte Butler.

[05:41] Team_042 possession (Score: 58-59)
Cade Dosunmu attempts a Midrange. Wide open! Shai Hyland is 9.4 feet away. [ZONE] Cade Dosunmu misses. Rebound secured by Russell Simons.

[05:30] Team_064 possession (Score: 58-59)
FOUL! Shooting foul on Cade Dosunmu. Jordan Mitchell to the line for 2 free throws. [BONUS: 8 team fouls] (Cade Dosunmu: 3 personal fouls)   FT 1/2: GOOD   FT 2/2: GOOD Jordan Mitchell makes 2/2 from the line.
Score: 60-59

[05:15] Team_042 possession (Score: 60-59)
Dejounte Butler drives, Russell Simons stays with him. Dejounte Butler attempts a Layup. Contested by Russell Simons (5.1 feet, ZONE). Dejounte Butler misses. Offensive rebound by Dejounte Butler! Dejounte Butler puts it back in!
Score: 60-61

[05:00] Team_064 possession (Score: 60-61)
Russell Simons drives, Cade Dosunmu stays with him. Russell Simons attempts a Dunk. Heavily contested by Cade Dosunmu (0.5 feet, ZONE)! RUSSELL SIMONS MAKES IT! Assist: Ja Mitchell
Score: 62-61

[04:47] Team_042 possession (Score: 62-61)
Kristaps Parker attempts a 3Pt. Wide open! Ja Mitchell is 7.0 feet away. [ZONE] Kristaps Parker misses. Rebound secured by Kawhi Irving.

[04:37] Team_064 possession (Score: 62-61)
Kawhi Irving attempts a 3Pt. Heavily contested by Jarrett Sabonis (1.1 feet, MAN)! Kawhi Irving misses. Rebound secured by Dejounte Butler.

[04:26] Team_042 possession (Score: 62-61)
Tyler Barrett attempts a 3Pt. Wide open! Ja Mitchell is 8.0 feet away. [MAN] TYLER BARRETT MAKES IT! Assist: Dejounte Butler
Score: 62-64

[04:10] Team_064 possession (Score: 62-64)
Jordan Mitchell attempts a 3Pt. Contested by Kristaps Parker (5.3 feet, MAN). Jordan Mitchell misses. Rebound secured by Cade Dosunmu.

[03:59] Team_042 possession (Score: 62-64)
Tyler Barrett drives and kicks out. Cade Dosunmu attempts a 3Pt. Wide open! Shai Hyland is 6.8 feet away. [MAN] CADE DOSUNMU MAKES IT! Assist: Tyler Barrett
Score: 62-67

[03:45] Team_064 possession (Score: 62-67)
Russell Simons attempts a 3Pt. Contested by Dejounte Butler (3.4 feet, MAN). RUSSELL SIMONS MAKES IT! Assist: Shai Hyland
Score: 65-67

[03:30] Team_042 possession (Score: 65-67)
Tyler Barrett attempts a 3Pt. Contested by Ja Mitchell (5.7 feet, ZONE). Tyler Barrett misses. Rebound secured by Shai Hyland.

[03:16] Team_064 possession (Score: 65-67)
Shai Hyland attempts a Layup. Contested by Cade Dosunmu (5.5 feet, MAN). Shai Hyland misses. Rebound secured by Cade Dosunmu.

[02:58] Team_042 possession (Score: 65-67)
Dejounte Butler loses the ball! Stripped by Russell Simons! TURNOVER! (live ball)

[02:45] Team_064 possession (Score: 65-67)
Russell Simons attempts a 3Pt. Contested by Tyler Barrett (3.3 feet, ZONE). Russell Simons misses. Rebound secured by Tyler Barrett.

[02:32] Team_042 possession (Score: 65-67)
Kristaps Parker attempts a Layup. Contested by Russell Simons (3.8 feet, ZONE). KRISTAPS PARKER MAKES IT! Assist: Cade Dosunmu
Score: 65-69

[02:16] Team_064 possession (Score: 65-69)
Kawhi Irving attempts a Layup. Wide open! Cade Dosunmu is 7.6 feet away. [ZONE] KAWHI IRVING MAKES IT! Assist: Russell Simons
Score: 67-69

[01:59] Team_042 possession (Score: 67-69)
Kristaps Parker attempts a Layup. Contested by Shai Hyland (4.0 feet, ZONE). KRISTAPS PARKER MAKES IT! Assist: Dejounte Butler
Score: 67-71

[01:43] Team_064 possession (Score: 67-71)
Russell Simons attempts a 3Pt. Contested by Dejounte Butler (2.8 feet, MAN). Russell Simons misses. Rebound secured by Dejounte Butler.

[01:29] Team_042 possession (Score: 67-71)
FOUL! Shooting foul on Kawhi Irving. Jarrett Sabonis to the line for 2 free throws. [Team fouls: 3] (Kawhi Irving: 1 personal fouls)   FT 1/2: MISS   FT 2/2: GOOD Jarrett Sabonis makes 1/2 from the line.
Score: 67-72

[01:19] Team_064 possession (Score: 67-72)
Ja Mitchell drives and kicks out. Ja Mitchell attempts a Midrange. Contested by Dejounte Butler (5.5 feet, ZONE). Ja Mitchell misses. Rebound secured by Tyler Barrett.

[01:00] Team_042 possession (Score: 67-72)
Tyler Barrett attempts a Midrange. Wide open! Ja Mitchell is 7.4 feet away. [MAN] Tyler Barrett misses. Rebound secured by Kawhi Irving.

[00:49] Team_064 possession (Score: 67-72)
FOUL! Holding foul on Tyler Barrett. [IN THE BONUS! 9 team fouls] Ja Mitchell to the line for 2 free throws. (Tyler Barrett: 5 personal fouls)   FT 1/2: GOOD   FT 2/2: GOOD Ja Mitchell makes 2/2 from the line.
Score: 69-72

[00:36] Team_042 possession (Score: 69-72)
Jarrett Sabonis drives to the basket... FOUL! Offensive foul on Jarrett Sabonis! Russell Simons drew the charge! [Team fouls: 10] (Jarrett Sabonis: 1 personal fouls) TURNOVER! (dead ball)

[00:21] Team_064 possession (Score: 69-72)
Ja Mitchell throws a bad pass out of bounds! TURNOVER! (dead ball)

[00:21] Substitution (Team_064): Ja Mitchell OUT → CJ Haliburton IN (stamina_rule2)

[00:21] Substitution (Team_064): Jordan Mitchell OUT → Ja Simmons IN (stamina_rule2)

[00:21] Substitution (Team_064): Kawhi Irving OUT → Tobias Herro IN (stamina_rule2)

[00:21] Substitution (Team_064): Russell Simons OUT → Austin Smith IN (stamina_rule2)

[00:21] Substitution (Team_064): Shai Hyland OUT → Devin Cunningham IN (stamina_rule2)

[00:21] Substitution (Team_042): Tyler Barrett OUT → Khris George IN (stamina_rule2)

[00:21] Substitution (Team_042): Kristaps Parker OUT → Isaiah Randle IN (stamina_rule2)

[00:21] Substitution (Team_042): Jarrett Sabonis OUT → Gary Jackson IN (stamina_rule2)

[00:21] Substitution (Team_042): Dejounte Butler OUT → Allen Towns IN (stamina_rule2)

[00:21] Substitution (Team_042): Cade Dosunmu OUT → Lamelo Stewart IN (stamina_rule2)

[00:09] Team_042 possession (Score: 69-72)
Khris George drives, picks up CJ Haliburton. Help arrives from Tobias Herro! Khris George attempts a Dunk. Wide open! Tobias Herro is 7.4 feet away. [MAN] KHRIS GEORGE MAKES IT! Assist: Allen Towns
Score: 69-74

================================================================================
                              3RD QUARTER COMPLETE                              
================================================================================

3RD QUARTER SCORE: Team_064 32, Team_042 31

BOX SCORE:
================================================================================

Team_064
--------------------------------------------------------------------------------
Player                MIN  PTS  REB  AST  TO      FG   FG%      3P   3P%
--------------------------------------------------------------------------------
Ja Mitchell            28   10    0    1   0   4/7    57.1     0/0   0.0
Jordan Mitchell        28    9    0    0   0   4/5    80.0     0/0   0.0
Shai Hyland            24    5    2    2   0   2/5    40.0     0/0   0.0
Russell Simons         24    5    3    1   0   2/5    40.0     0/0   0.0
Kawhi Irving           28    2    2    0   0   1/2    50.0     0/0   0.0

TEAM: FG: 13/24 (54.2%), 3PT: 3/9 (33.3%), REB: 7 (0 off, 7 def), AST: 4, TO: 1
TEAM FOULS: 3


Team_042
--------------------------------------------------------------------------------
Player                MIN  PTS  REB  AST  TO      FG   FG%      3P   3P%
--------------------------------------------------------------------------------
Kristaps Parker        28    9    0    1   0   4/6    66.7     0/0   0.0
Cade Dosunmu           24    8    2    2   0   3/4    75.0     0/0   0.0
Dejounte Butler        28    6    6    3   0   3/4    75.0     0/0   0.0
Tyler Barrett          28    5    5    1   0   2/5    40.0     0/0   0.0
Khris George            9    2    0    0   0   1/1   100.0     0/0   0.0
Jarrett Sabonis        28    1    0    0   0   1/1   100.0     0/0   0.0
Allen Towns             9    0    0    1   0   0/0     0.0     0/0   0.0

TEAM: FG: 14/21 (66.7%), 3PT: 2/5 (40.0%), REB: 13 (2 off, 11 def), AST: 8, TO: 4
TEAM FOULS: 10 [Team_064 in BONUS]

================================================================================

================================================================================
                       4TH QUARTER - Team_064 vs Team_042                       
================================================================================

[12:00] Team_064 possession (Score: 69-74)
Kawhi Irving attempts a 3Pt. Contested by Jarrett Sabonis (4.9 feet, MAN). Kawhi Irving misses. Rebound secured by Cade Dosunmu.

[11:45] Team_042 possession (Score: 69-74)
Dejounte Butler attempts a 3Pt. Contested by Russell Simons (3.7 feet, MAN). Dejounte Butler misses. Rebound secured by Russell Simons.

[11:28] Team_064 possession (Score: 69-74)
Jordan Mitchell attempts a 3Pt. Contested by Kristaps Parker (3.1 feet, MAN). Jordan Mitchell misses. Rebound secured by Dejounte Butler.

[11:12] Team_042 possession (Score: 69-74)
Kristaps Parker attempts a Layup. Contested by Shai Hyland (4.3 feet, ZONE). Kristaps Parker misses. Rebound secured by Kawhi Irving.

[11:02] Team_064 possession (Score: 69-74)
Kawhi Irving attempts a 3Pt. Contested by Jarrett Sabonis (2.2 feet, MAN). Kawhi Irving misses. Rebound secured by Tyler Barrett.

[10:47] Team_042 possession (Score: 69-74)
FOUL! Shooting foul on Russell Simons. Kristaps Parker to the line for 2 free throws. [Team fouls: 1] (Russell Simons: 1 personal fouls)   FT 1/2: GOOD   FT 2/2: GOOD Kristaps Parker makes 2/2 from the line.
Score: 69-76

[10:32] Team_064 possession (Score: 69-76)
Ja Mitchell attempts a 3Pt. Contested by Tyler Barrett (5.7 feet, MAN). Ja Mitchell misses. Rebound secured by Tyler Barrett.

[10:18] Team_042 possession (Score: 69-76)
Dejounte Butler drives to the basket... Dejounte Butler throws a bad pass! Stolen by Russell Simons! TURNOVER! (live ball)

[10:02] Team_064 possession (Score: 69-76)
Shai Hyland attempts a Midrange. Contested by Dejounte Butler (5.0 feet, ZONE). Shai Hyland misses. Rebound secured by Tyler Barrett.

[09:51] Team_042 possession (Score: 69-76)
Dejounte Butler throws a bad pass out of bounds! TURNOVER! (dead ball)

[09:51] Substitution (Team_064): Ja Mitchell OUT → CJ Haliburton IN (stamina_rule2)

[09:51] Substitution (Team_064): Jordan Mitchell OUT → Ja Simmons IN (stamina_rule2)

[09:51] Substitution (Team_064): Kawhi Irving OUT → Tobias Herro IN (stamina_rule2)

[09:51] Substitution (Team_064): Russell Simons OUT → Austin Smith IN (stamina_rule2)

[09:51] Substitution (Team_064): Shai Hyland OUT → Devin Cunningham IN (stamina_rule2)

[09:51] Substitution (Team_042): Tyler Barrett OUT → Khris George IN (stamina_rule2)

[09:51] Substitution (Team_042): Kristaps Parker OUT → Isaiah Randle IN (stamina_rule2)

[09:51] Substitution (Team_042): Jarrett Sabonis OUT → Gary Jackson IN (stamina_rule2)

[09:51] Substitution (Team_042): Dejounte Butler OUT → Allen Towns IN (stamina_rule2)

[09:51] Substitution (Team_042): Cade Dosunmu OUT → Lamelo Stewart IN (stamina_rule2)

[09:38] Team_064 possession (Score: 69-76)
Ja Simmons attempts a 3Pt. Contested by Khris George (4.0 feet, ZONE). Ja Simmons misses. Rebound secured by Lamelo Stewart.

[09:26] Team_042 possession (Score: 69-76)
Allen Towns drives and kicks out. Gary Jackson attempts a 3Pt. Contested by Austin Smith (3.1 feet, ZONE). GARY JACKSON MAKES IT! Assist: Khris George
Score: 69-79

[09:08] Team_064 possession (Score: 69-79)
Tobias Herro makes the Layup and draws the foul on Khris George! And-1! Tobias Herro to the line for 1. [Team fouls: 1] (Khris George: 1 personal fouls)   FT 1/1: GOOD Tobias Herro makes 1/1 from the line.
Score: 72-79

[08:52] Team_042 possession (Score: 72-79)
Isaiah Randle attempts a 3Pt. Wide open! Ja Simmons is 6.3 feet away. [MAN] Isaiah Randle misses. Offensive rebound by Allen Towns! Allen Towns kicks it out.

[08:39] Team_042 possession (Score: 72-79)
Khris George attempts a 3Pt. Wide open! CJ Haliburton is 7.1 feet away. [MAN] Khris George misses. Rebound secured by Ja Simmons.

[08:26] Team_064 possession (Score: 72-79)
FOUL! Holding foul on Khris George. [Team fouls: 2] No free throws, side out. (Khris George: 2 personal fouls)

[08:12] Team_064 possession (Score: 72-79)
Tobias Herro attempts a Midrange. Heavily contested by Khris George (0.6 feet, ZONE)! TOBIAS HERRO MAKES IT! Assist: CJ Haliburton
Score: 74-79

[07:58] Team_042 possession (Score: 74-79)
Isaiah Randle drives, picks up Ja Simmons. Help arrives from Tobias Herro! Isaiah Randle attempts a Layup. Contested by Tobias Herro (2.3 feet, MAN). ISAIAH RANDLE MAKES IT! Assist: Khris George
Score: 74-81

[07:44] Team_064 possession (Score: 74-81)
Ja Simmons drives and kicks out. Devin Cunningham attempts a 3Pt. Wide open! Lamelo Stewart is 6.8 feet away. [MAN] Devin Cunningham misses. Rebound secured by Lamelo Stewart.

[07:28] Team_042 possession (Score: 74-81)
Allen Towns attempts a Midrange. Wide open! Austin Smith is 9.3 feet away. [MAN] Allen Towns misses. Offensive rebound by Allen Towns! Allen Towns kicks it out.

[07:10] Team_042 possession (Score: 74-81)
Gary Jackson attempts a 3Pt. Wide open! Tobias Herro is 8.4 feet away. [MAN] GARY JACKSON MAKES IT! Assist: Isaiah Randle
Score: 74-84

[06:53] Team_064 possession (Score: 74-84)
Austin Smith drives and kicks out. CJ Haliburton attempts a 3Pt. Contested by Khris George (2.9 feet, ZONE). CJ Haliburton misses. Rebound secured by Lamelo Stewart.

[06:36] Team_042 possession (Score: 74-84)
Khris George drives to the basket... FOUL! Offensive foul on Khris George! CJ Haliburton drew the charge! [Team fouls: 3] (Khris George: 3 personal fouls) TURNOVER! (dead ball)

[06:18] Team_064 possession (Score: 74-84)
FOUL! Holding foul on Gary Jackson. [Team fouls: 4] No free throws, side out. (Gary Jackson: 1 personal fouls)

[06:01] Team_064 possession (Score: 74-84)
Ja Simmons attempts a 3Pt. Contested by Khris George (4.6 feet, ZONE). Ja Simmons misses. Rebound secured by Allen Towns.

[05:45] Team_042 possession (Score: 74-84)
FOUL! Reach-in foul on Austin Smith during the drive. [Team fouls: 2] No free throws, side out. (Austin Smith: 1 personal fouls)

[05:33] Team_042 possession (Score: 74-84)
Isaiah Randle drives to the basket... FOUL! Offensive foul on Isaiah Randle! Austin Smith drew the charge! [Team fouls: 5] (Isaiah Randle: 1 personal fouls) TURNOVER! (dead ball)

[05:21] Team_064 possession (Score: 74-84)
Tobias Herro attempts a 3Pt. Heavily contested by Khris George (1.2 feet, ZONE)! Tobias Herro misses. Rebound secured by Lamelo Stewart.

[05:03] Team_042 possession (Score: 74-84)
Allen Towns drives and kicks out. Allen Towns attempts a 3Pt. Contested by Austin Smith (5.8 feet, MAN). Allen Towns misses. Rebound secured by Devin Cunningham.

[04:49] Team_064 possession (Score: 74-84)
Ja Simmons attempts a 3Pt. Contested by Isaiah Randle (5.9 feet, MAN). Ja Simmons misses. Rebound secured by Lamelo Stewart.

[04:33] Team_042 possession (Score: 74-84)
Lamelo Stewart attempts a Layup. Contested by Austin Smith (3.8 feet, ZONE). Lamelo Stewart misses. Rebound secured by Ja Simmons.

[04:18] Team_064 possession (Score: 74-84)
Austin Smith attempts a 3Pt. Contested by Allen Towns (2.4 feet, MAN). Austin Smith misses. Rebound secured by Lamelo Stewart.

[04:09] Team_042 possession (Score: 74-84)
Gary Jackson attempts a 3Pt. Wide open! Austin Smith is 9.2 feet away. [ZONE] Gary Jackson misses. Rebound secured by Austin Smith.

[03:50] Team_064 possession (Score: 74-84)
Devin Cunningham attempts a 3Pt. Contested by Khris George (2.6 feet, ZONE). Devin Cunningham misses. Rebound secured by Lamelo Stewart.

[03:31] Team_042 possession (Score: 74-84)
Khris George attempts a Midrange. Wide open! CJ Haliburton is 9.6 feet away. [MAN] KHRIS GEORGE MAKES IT! Assist: Lamelo Stewart
Score: 74-86

[03:18] Team_064 possession (Score: 74-86)
Tobias Herro drives, Allen Towns stays with him. Tobias Herro attempts a Dunk. Contested by Allen Towns (4.9 feet, ZONE). TOBIAS HERRO MAKES IT! Assist: CJ Haliburton
Score: 76-86

[03:05] Team_042 possession (Score: 76-86)
Allen Towns attempts a Layup. Wide open! Austin Smith is 7.5 feet away. [ZONE] ALLEN TOWNS MAKES IT!
Score: 76-88

[02:48] Team_064 possession (Score: 76-88)
CJ Haliburton attempts a Midrange. Contested by Gary Jackson (4.2 feet, ZONE). CJ HALIBURTON MAKES IT! Assist: Tobias Herro
Score: 78-88

[02:35] Team_042 possession (Score: 78-88)
Allen Towns loses control! Ball rolls out of bounds! TURNOVER! (dead ball)

[02:22] Team_064 possession (Score: 78-88)
Devin Cunningham attempts a Layup. BLOCKED BY KHRIS GEORGE! Ball is loose! Offensive rebound by Ja Simmons! Ja Simmons kicks it out.

[02:05] Team_064 possession (Score: 78-88)
Ja Simmons drives to the basket... Ja Simmons throws a bad pass! Stolen by Allen Towns! TURNOVER! (live ball)

[01:46] Team_042 possession (Score: 78-88)
Khris George attempts a 3Pt. Wide open! CJ Haliburton is 6.2 feet away. [MAN] Khris George misses. FOUL! Loose ball foul on Ja Simmons during the rebound battle. [Team fouls: 3] No free throws, side out. (Ja Simmons: 1 personal fouls)

[01:32] Team_042 possession (Score: 78-88)
Lamelo Stewart attempts a Midrange. Wide open! Devin Cunningham is 6.7 feet away. [MAN] Lamelo Stewart misses. Rebound secured by Austin Smith.

[01:18] Team_064 possession (Score: 78-88)
Devin Cunningham attempts a Layup. Contested by Lamelo Stewart (2.9 feet, MAN). Devin Cunningham misses. Rebound secured by Allen Towns.

[01:07] Team_042 possession (Score: 78-88)
Khris George attempts a Midrange. Wide open! CJ Haliburton is 7.3 feet away. [MAN] KHRIS GEORGE MAKES IT! Assist: Lamelo Stewart
Score: 78-90

[00:56] Team_064 possession (Score: 78-90)
CJ Haliburton attempts a 3Pt. Contested by Khris George (3.9 feet, MAN). CJ HALIBURTON MAKES IT! Assist: Tobias Herro
Score: 81-90

[00:41] Team_042 possession (Score: 81-90)
Isaiah Randle attempts a Layup. Wide open! Austin Smith is 6.5 feet away. [ZONE] ISAIAH RANDLE MAKES IT! Assist: Allen Towns
Score: 81-92

[00:26] Team_064 possession (Score: 81-92)
CJ Haliburton attempts a 3Pt. Contested by Khris George (4.7 feet, ZONE). CJ HALIBURTON MAKES IT! Assist: Tobias Herro
Score: 84-92

[00:09] Team_042 possession (Score: 84-92)
Allen Towns attempts a Layup. Contested by Austin Smith (3.7 feet, MAN). ALLEN TOWNS MAKES IT! Assist: Gary Jackson
Score: 84-94

================================================================================
                              4TH QUARTER COMPLETE                              
================================================================================

4TH QUARTER SCORE: Team_064 15, Team_042 20

BOX SCORE:
================================================================================

Team_064
--------------------------------------------------------------------------------
Player                MIN  PTS  REB  AST  TO      FG   FG%      3P   3P%
--------------------------------------------------------------------------------
CJ Haliburton          18    8    0    2   0   3/3   100.0     0/0   0.0
Tobias Herro           18    7    0    3   0   3/4    75.0     0/0   0.0
Kawhi Irving           30    0    1    0   0   0/2     0.0     0/0   0.0
Russell Simons         26    0    1    0   0   0/0     0.0     0/0   0.0
Jordan Mitchell        30    0    0    0   0   0/1     0.0     0/0   0.0
Ja Mitchell            30    0    0    0   0   0/1     0.0     0/0   0.0
Shai Hyland            26    0    0    0   0   0/1     0.0     0/0   0.0
Ja Simmons             18    0    3    0   0   0/4     0.0     0/0   0.0
Austin Smith           22    0    2    0   0   0/2     0.0     0/0   0.0
Devin Cunningham       22    0    1    0   0   0/2     0.0     0/0   0.0

TEAM: FG: 6/20 (30.0%), 3PT: 2/12 (16.7%), REB: 8 (1 off, 7 def), AST: 5, TO: 1
TEAM FOULS: 3


Team_042
--------------------------------------------------------------------------------
Player                MIN  PTS  REB  AST  TO      FG   FG%      3P   3P%
--------------------------------------------------------------------------------
Gary Jackson           18    6    0    1   0   2/3    66.7     0/0   0.0
Khris George           18    4    0    2   0   2/3    66.7     0/0   0.0
Allen Towns            18    4    4    1   0   2/3    66.7     0/0   0.0
Isaiah Randle          18    4    0    1   0   2/2   100.0     0/0   0.0
Kristaps Parker        30    2    0    0   0   1/2    50.0     0/0   0.0
Cade Dosunmu           26    0    1    0   0   0/0     0.0     0/0   0.0
Dejounte Butler        30    0    1    0   0   0/1     0.0     0/0   0.0
Tyler Barrett          30    0    3    0   0   0/0     0.0     0/0   0.0
Lamelo Stewart         22    0    8    2   0   0/2     0.0     0/0   0.0

TEAM: FG: 9/16 (56.2%), 3PT: 1/4 (25.0%), REB: 17 (3 off, 14 def), AST: 7, TO: 5
TEAM FOULS: 5 [Team_064 in BONUS]

================================================================================

================================================================================
                               FULL GAME COMPLETE                               
================================================================================

FINAL SCORE: Team_064 84, Team_042 94

SCORING BY QUARTER:
--------------------------------------------------------------------------------
Team                     Q1     Q2     Q3     Q4    FINAL
--------------------------------------------------------------------------------
Team_064                 19     18     32     15       84
Team_042                 18     25     31     20       94
--------------------------------------------------------------------------------

FULL GAME BOX SCORE:
================================================================================

Team_064
--------------------------------------------------------------------------------
Player                MIN  PTS  REB  AST  TO      FG   FG%      3P   3P%      FT STL BLK
--------------------------------------------------------------------------------
Ja Mitchell            30   14    0    3   2   6/14   42.9   1/6    16.7   5/5     0   0
Jordan Mitchell        30   13    0    0   3   5/12   41.7   1/5    20.0   6/6     1   0
Kawhi Irving           30   12    6    1   0   4/7    57.1   0/3     0.0   3/3     0   1
Russell Simons         26   10   11    1   0   4/8    50.0   2/4    50.0   1/2     2   0
Shai Hyland            26    5    4    3   2   3/9    33.3   0/2     0.0   1/1     0   0
Austin Smith           22    0   10    1   1   0/4     0.0   0/2     0.0   2/3     1   0
Devin Cunningham       22    5    2    1   4   2/6    33.3   0/1     0.0   1/1     0   0
CJ Haliburton          18    8    0    3   0   3/4    75.0   2/3    66.7   0/0     0   0
Ja Simmons             18    3    4    0   0   1/6    16.7   1/4    25.0   0/1     0   0
Tobias Herro           18    9    0    3   1   4/7    57.1   0/3     0.0   1/1     0   0

TEAM: FG: 33/78 (42.3%), 3PT: 7/33 (21.2%), REB: 37 (4 off, 33 def), AST: 16, TO: 13


Team_042
--------------------------------------------------------------------------------
Player                MIN  PTS  REB  AST  TO      FG   FG%      3P   3P%      FT STL BLK
--------------------------------------------------------------------------------
Tyler Barrett          30    8   12    2   3   5/9    55.6   2/4    50.0   2/2     1   0
Kristaps Parker        30   22    0    2   1  11/18   61.1   2/7    28.6   2/2     0   0
Jarrett Sabonis        30    4    0    1   4   1/5    20.0   0/1     0.0   1/2     0   0
Dejounte Butler        30   11   12    7   2   5/11   45.5   0/3     0.0   2/3     1   0
Cade Dosunmu           26   10   11    3   0   2/3    66.7   0/0     0.0   1/1     2   0
Lamelo Stewart         22    7   10    3   1   4/6    66.7   0/0     0.0   1/1     0   0
Khris George           18    8    0    5   0   4/7    57.1   0/3     0.0   0/0     0   1
Isaiah Randle          18    4    0    1   1   2/4    50.0   0/1     0.0   0/0     0   0
Gary Jackson           18   11    2    1   1   2/4    50.0   1/3    33.3   0/0     0   0
Allen Towns            18    8    9    3   2   5/6    83.3   0/0     0.0   0/0     1   0

TEAM: FG: 41/74 (55.4%), 3PT: 5/22 (22.7%), REB: 56 (11 off, 45 def), AST: 28, TO: 15

================================================================================
