================================================================================
                        FULL GAME - Team_097 vs Team_062                        
================================================================================

================================================================================
                       1ST QUARTER - Team_097 vs Team_062                       
================================================================================

[12:00] Team_097 possession (Score: 0-0)
Evan Brogdon attempts a 3Pt. Contested by RJ Williamson (5.5 feet, ZONE). Evan Brogdon misses. Rebound secured by Kawhi Thompson.

[11:48] Team_062 possession (Score: 0-0)
Chris Bird attempts a 3Pt. Contested by Jrue Haliburton (4.4 feet, ZONE). CHRIS BIRD MAKES IT! Assist: Kawhi Thompson
Score: 0-3

[11:31] Team_097 possession (Score: 0-3)
Evan Brogdon attempts a 3Pt. Contested by RJ Williamson (2.9 feet, ZONE). Evan Brogdon misses. Rebound secured by Jalen Reaves.

[11:20] Team_062 possession (Score: 0-3)
Kawhi Thompson attempts a 3Pt. Heavily contested by Shai Poole (0.5 feet, ZONE)! Kawhi Thompson misses. Rebound secured by Tyrese Stewart.

[11:08] Team_097 possession (Score: 0-3)
Anthony Haliburton drives and kicks out. Anthony Haliburton attempts a 3Pt. Wide open! RJ Williamson is 10.0 feet away. [ZONE] Anthony Haliburton misses. Rebound secured by Michael Hyland.

[10:49] Team_062 possession (Score: 0-3)
Michael Hyland drives to the basket... Michael Hyland commits a violation (traveling/carry)! TURNOVER! (dead ball)

[10:31] Team_097 possession (Score: 0-3)
Evan Brogdon drives, picks up Chris Bird. Help arrives from Michael Hyland! Evan Brogdon attempts a Layup. Heavily contested by Michael Hyland (1.0 feet, MAN)! Evan Brogdon misses. Rebound secured by Jalen Reaves.

[10:16] Team_062 possession (Score: 0-3)
RJ Williamson attempts a Layup. Contested by Anthony Haliburton (4.9 feet, ZONE). RJ WILLIAMSON MAKES IT! Assist: Kawhi Thompson
Score: 0-5

[10:03] Team_097 possession (Score: 0-5)
Evan Brogdon attempts a 3Pt. Contested by Chris Bird (5.3 feet, MAN). EVAN BROGDON MAKES IT! Assist: Anthony Haliburton
Score: 3-5

[09:47] Team_062 possession (Score: 3-5)
Chris Bird attempts a Midrange. Contested by Evan Brogdon (5.1 feet, MAN). Chris Bird misses. Rebound secured by Tyrese Stewart.

[09:31] Team_097 possession (Score: 3-5)
FOUL! Holding foul on Chris Bird. [Team fouls: 1] No free throws, side out. (Chris Bird: 1 personal fouls)

[09:19] Team_097 possession (Score: 3-5)
Evan Brogdon drives and kicks out. Evan Brogdon attempts a Midrange. Wide open! Michael Hyland is 7.2 feet away. [ZONE] Evan Brogdon misses. Offensive rebound by Anthony Haliburton! Anthony Haliburton puts it back in!
Score: 5-5

[09:09] Team_062 possession (Score: 5-5)
RJ Williamson attempts a 3Pt. Contested by Jrue Haliburton (3.6 feet, MAN). RJ Williamson misses. Rebound secured by Tyrese Stewart.

[08:58] Team_097 possession (Score: 5-5)
Tyrese Stewart attempts a Layup. BLOCKED BY CHRIS BIRD! Ball is loose! Rebound secured by Kawhi Thompson.

[08:43] Team_062 possession (Score: 5-5)
Chris Bird attempts a 3Pt. Wide open! Evan Brogdon is 7.2 feet away. [MAN] Chris Bird misses. Rebound secured by Shai Poole.

[08:29] Team_097 possession (Score: 5-5)
Anthony Haliburton drives and kicks out. Anthony Haliburton attempts a Midrange. Contested by Kawhi Thompson (3.7 feet, MAN). ANTHONY HALIBURTON MAKES IT!
Score: 7-5

[08:16] Team_062 possession (Score: 7-5)
Jalen Reaves makes the Layup and draws the foul on Anthony Haliburton! And-1! Jalen Reaves to the line for 1. [Team fouls: 1] (Anthony Haliburton: 1 personal fouls)   FT 1/1: GOOD Jalen Reaves makes 1/1 from the line.
Score: 7-8

[08:03] Team_097 possession (Score: 7-8)
Jrue Haliburton attempts a Layup. Wide open! Jalen Reaves is 6.2 feet away. [ZONE] JRUE HALIBURTON MAKES IT! Assist: Shai Poole
Score: 9-8

[07:51] Team_062 possession (Score: 9-8)
Jalen Reaves drives, picks up Anthony Haliburton. Help arrives from Jrue Haliburton! Jalen Reaves attempts a Dunk. Contested by Jrue Haliburton (2.3 feet, ZONE). JALEN REAVES MAKES IT! Assist: Michael Hyland
Score: 9-10

[07:40] Team_097 possession (Score: 9-10)
Anthony Haliburton attempts a 3Pt. Wide open! Kawhi Thompson is 6.0 feet away. [MAN] Anthony Haliburton misses. Rebound secured by Kawhi Thompson.

[07:23] Team_062 possession (Score: 9-10)
Kawhi Thompson attempts a 3Pt. Contested by Shai Poole (4.5 feet, ZONE). Kawhi Thompson misses. Rebound secured by Anthony Haliburton.

[07:08] Team_097 possession (Score: 9-10)
Jrue Haliburton attempts a 3Pt. Contested by RJ Williamson (5.2 feet, ZONE). Jrue Haliburton misses. Rebound secured by Jalen Reaves.

[06:55] Team_062 possession (Score: 9-10)
Jalen Reaves attempts a Midrange. Heavily contested by Shai Poole (0.5 feet, ZONE)! Jalen Reaves misses. Rebound secured by Tyrese Stewart.

[06:40] Team_097 possession (Score: 9-10)
FOUL! Holding foul on Jalen Reaves. [Team fouls: 2] No free throws, side out. (Jalen Reaves: 1 personal fouls)

[06:24] Team_097 possession (Score: 9-10)
Evan Brogdon attempts a 3Pt. Contested by Chris Bird (5.6 feet, MAN). Evan Brogdon misses. Offensive rebound by Tyrese Stewart! Tyrese Stewart kicks it out.

[06:09] Team_097 possession (Score: 9-10)
Shai Poole loses control! Ball rolls out of bounds! TURNOVER! (dead ball)

[05:55] Team_062 possession (Score: 9-10)
RJ Williamson attempts a 3Pt. Wide open! Jrue Haliburton is 6.9 feet away. [ZONE] RJ Williamson misses. Offensive rebound by Kawhi Thompson! Kawhi Thompson kicks it out.

[05:37] Team_062 possession (Score: 9-10)
Kawhi Thompson attempts a Dunk. BLOCKED BY ANTHONY HALIBURTON! Ball is loose! Rebound secured by Anthony Haliburton.

[05:24] Team_097 possession (Score: 9-10)
Evan Brogdon attempts a Layup. BLOCKED BY CHRIS BIRD! Ball is loose! Offensive rebound by Tyrese Stewart! Tyrese Stewart kicks it out.

[05:10] Team_097 possession (Score: 9-10)
Shai Poole drives and kicks out. Evan Brogdon attempts a Midrange. Wide open! Chris Bird is 8.2 feet away. [MAN] Evan Brogdon misses. Rebound secured by Michael Hyland.

[04:53] Team_062 possession (Score: 9-10)
Chris Bird attempts a Midrange. Heavily contested by Shai Poole (1.8 feet, ZONE)! Chris Bird misses. Rebound secured by Shai Poole.

[04:41] Team_097 possession (Score: 9-10)
Jrue Haliburton attempts a 3Pt. Contested by RJ Williamson (6.0 feet, ZONE). JRUE HALIBURTON MAKES IT! Assist: Shai Poole
Score: 12-10

[04:30] Team_062 possession (Score: 12-10)
Jalen Reaves drives, Anthony Haliburton stays with him. Jalen Reaves attempts a Layup. Heavily contested by Anthony Haliburton (1.3 feet, MAN)! Jalen Reaves misses. Rebound secured by Tyrese Stewart.

[04:13] Team_097 possession (Score: 12-10)
Evan Brogdon attempts a Layup. Contested by Chris Bird (5.4 feet, MAN). EVAN BROGDON MAKES IT! Assist: Shai Poole
Score: 14-10

[03:57] Team_062 possession (Score: 14-10)
Chris Bird attempts a 3Pt. Contested by Evan Brogdon (3.9 feet, MAN). Chris Bird misses. Rebound secured by Shai Poole.

[03:44] Team_097 possession (Score: 14-10)
Evan Brogdon attempts a 3Pt. Contested by Chris Bird (4.2 feet, MAN). Evan Brogdon misses. Rebound secured by Michael Hyland.

[03:32] Team_062 possession (Score: 14-10)
Michael Hyland drives to the basket... Michael Hyland loses the ball! Stripped by Anthony Haliburton! TURNOVER! (live ball)

[03:21] Team_097 possession (Score: 14-10)
Tyrese Stewart drives to the basket... Tyrese Stewart commits a violation (traveling/carry)! TURNOVER! (dead ball)

[03:21] Substitution (Team_062): Jalen Reaves OUT → Devin Young IN (stamina_rule2)

[03:06] Team_062 possession (Score: 14-10)
RJ Williamson attempts a Midrange. Contested by Jrue Haliburton (5.2 feet, MAN). RJ WILLIAMSON MAKES IT!
Score: 14-12

[02:52] Team_097 possession (Score: 14-12)
Jrue Haliburton attempts a Layup. Contested by Kawhi Thompson (5.2 feet, ZONE). JRUE HALIBURTON MAKES IT!
Score: 16-12

[02:42] Team_062 possession (Score: 16-12)
Devin Young drives to the basket... Devin Young throws a bad pass out of bounds! TURNOVER! (dead ball)

[02:42] Substitution (Team_097): Evan Brogdon OUT → Gary Carter IN (stamina_rule2)

[02:42] Substitution (Team_097): Shai Poole OUT → Miles Dosunmu IN (stamina_rule2)

[02:42] Substitution (Team_097): Anthony Haliburton OUT → Joel Simons IN (stamina_rule2)

[02:42] Substitution (Team_097): Tyrese Stewart OUT → Miles Banchero IN (stamina_rule2)

[02:42] Substitution (Team_062): Chris Bird OUT → Paolo McCollum IN (stamina_rule2)

[02:42] Substitution (Team_062): RJ Williamson OUT → Tony LaVine IN (stamina_rule2)

[02:42] Substitution (Team_062): Michael Hyland OUT → Paul Poole IN (stamina_rule2)

[02:42] Substitution (Team_062): Kawhi Thompson OUT → RJ Wall IN (stamina_rule2)

[02:28] Team_097 possession (Score: 16-12)
Miles Banchero attempts a Midrange. Wide open! Tony LaVine is 6.8 feet away. [ZONE] MILES BANCHERO MAKES IT!
Score: 18-12

[02:14] Team_062 possession (Score: 18-12)
Paul Poole attempts a 3Pt. Contested by Miles Dosunmu (4.5 feet, MAN). Paul Poole misses. Rebound secured by Miles Banchero.

[01:58] Team_097 possession (Score: 18-12)
Miles Banchero throws a bad pass out of bounds! TURNOVER! (dead ball)

[01:58] Substitution (Team_097): Jrue Haliburton OUT → Dwyane Ginobili IN (stamina_rule2)

[01:43] Team_062 possession (Score: 18-12)
Devin Young makes the Layup and draws the foul on Joel Simons! And-1! Devin Young to the line for 1. [Team fouls: 2] (Joel Simons: 1 personal fouls)   FT 1/1: GOOD Devin Young makes 1/1 from the line.
Score: 18-15

[01:28] Team_097 possession (Score: 18-15)
Gary Carter drives to the basket... Gary Carter loses control! Ball rolls out of bounds! TURNOVER! (dead ball)

[01:11] Team_062 possession (Score: 18-15)
Paolo McCollum attempts a 3Pt. Contested by Joel Simons (4.8 feet, ZONE). PAOLO MCCOLLUM MAKES IT! Assist: Devin Young
Score: 18-18

[00:56] Team_097 possession (Score: 18-18)
Joel Simons drives, RJ Wall stays with him. Joel Simons attempts a Layup. Contested by RJ Wall (3.7 feet, ZONE). JOEL SIMONS MAKES IT! Assist: Dwyane Ginobili
Score: 20-18

[00:46] Team_062 possession (Score: 20-18)
Devin Young attempts a Midrange. Contested by Joel Simons (2.5 feet, MAN). Devin Young misses. Rebound secured by Miles Banchero.

[00:34] Team_097 possession (Score: 20-18)
Miles Dosunmu attempts a Midrange. Wide open! Tony LaVine is 9.3 feet away. [ZONE] MILES DOSUNMU MAKES IT!
Score: 22-18

[00:22] Team_062 possession (Score: 22-18)
Tony LaVine attempts a 3Pt. Contested by Dwyane Ginobili (4.0 feet, MAN). Tony LaVine misses. Rebound secured by Joel Simons.

[00:09] Team_097 possession (Score: 22-18)
Miles Banchero drives, picks up RJ Wall. Help arrives from Paolo McCollum! Miles Banchero attempts a Layup. Contested by Paolo McCollum (3.2 feet, ZONE). Miles Banchero misses. Rebound secured by Paul Poole.

================================================================================
                              1ST QUARTER COMPLETE                              
================================================================================

1ST QUARTER SCORE: Team_097 22, Team_062 18

BOX SCORE:
================================================================================

Team_097
--------------------------------------------------------------------------------
Player                MIN  PTS  REB  AST  TO      FG   FG%      3P   3P%
--------------------------------------------------------------------------------
Jrue Haliburton        10    7    0    0   0   3/4    75.0     0/0   0.0
Evan Brogdon           10    5    0    0   0   2/6    33.3     0/0   0.0
Anthony Haliburton     10    4    3    1   0   2/4    50.0     0/0   0.0
Miles Banchero          2    2    2    0   0   1/2    50.0     0/0   0.0
Joel Simons             2    2    1    0   0   1/1   100.0     0/0   0.0
Miles Dosunmu           2    2    0    0   0   1/1   100.0     0/0   0.0
Tyrese Stewart         10    0    7    0   0   0/1     0.0     0/0   0.0
Shai Poole             10    0    3    3   0   0/1     0.0     0/0   0.0
Dwyane Ginobili         2    0    0    1   0   0/0     0.0     0/0   0.0

TEAM: FG: 10/20 (50.0%), 3PT: 2/7 (28.6%), REB: 16 (3 off, 13 def), AST: 5, TO: 4
TEAM FOULS: 2


Team_062
--------------------------------------------------------------------------------
Player                MIN  PTS  REB  AST  TO      FG   FG%      3P   3P%
--------------------------------------------------------------------------------
Jalen Reaves            9    5    3    0   0   2/4    50.0     0/0   0.0
RJ Williamson          10    4    0    0   0   2/3    66.7     0/0   0.0
Chris Bird             10    3    0    0   0   1/5    20.0     0/0   0.0
Devin Young             3    3    0    1   0   1/2    50.0     0/0   0.0
Paolo McCollum          2    3    0    0   0   1/1   100.0     0/0   0.0
Kawhi Thompson         10    0    4    2   0   0/3     0.0     0/0   0.0
Michael Hyland         10    0    3    1   0   0/0     0.0     0/0   0.0
Paul Poole              2    0    1    0   0   0/1     0.0     0/0   0.0
Tony LaVine             2    0    0    0   0   0/1     0.0     0/0   0.0

TEAM: FG: 7/20 (35.0%), 3PT: 2/9 (22.2%), REB: 11 (1 off, 10 def), AST: 4, TO: 3
TEAM FOULS: 2

================================================================================

================================================================================
                       2ND QUARTER - Team_097 vs Team_062                       
================================================================================

[12:00] Team_097 possession (Score: 22-18)
Evan Brogdon drives and kicks out. Jrue Haliburton attempts a 3Pt. Wide open! RJ Williamson is 7.8 feet away. [MAN] Jrue Haliburton misses. Rebound secured by Kawhi Thompson.

[11:43] Team_062 possession (Score: 22-18)
Jalen Reaves attempts a Midrange. Wide open! Anthony Haliburton is 7.4 feet away. [MAN] Jalen Reaves misses. Rebound secured by Tyrese Stewart.

[11:30] Team_097 possession (Score: 22-18)
Shai Poole drives, Michael Hyland stays with him. Shai Poole attempts a Dunk. Contested by Michael Hyland (5.9 feet, MAN). SHAI POOLE MAKES IT! Assist: Jrue Haliburton
Score: 24-18

[11:18] Team_062 possession (Score: 24-18)
RJ Williamson makes the Layup and draws the foul on Jrue Haliburton! And-1! RJ Williamson to the line for 1. [Team fouls: 1] (Jrue Haliburton: 1 personal fouls)   FT 1/1: GOOD RJ Williamson makes 1/1 from the line.
Score: 24-21

[11:03] Team_097 possession (Score: 24-21)
Evan Brogdon attempts a 3Pt. Wide open! RJ Williamson is 6.2 feet away. [ZONE] EVAN BROGDON MAKES IT! Assist: Tyrese Stewart
Score: 27-21

[10:47] Team_062 possession (Score: 27-21)
FOUL! Holding foul on Anthony Haliburton. [Team fouls: 2] No free throws, side out. (Anthony Haliburton: 1 personal fouls)

[10:33] Team_062 possession (Score: 27-21)
Chris Bird attempts a 3Pt. Contested by Shai Poole (5.9 feet, ZONE). CHRIS BIRD MAKES IT! Assist: RJ Williamson
Score: 27-24

[10:14] Team_097 possession (Score: 27-24)
Evan Brogdon drives, picks up Jalen Reaves. Help arrives from Chris Bird! Evan Brogdon attempts a Layup. Contested by Chris Bird (4.7 feet, ZONE). EVAN BROGDON MAKES IT! Assist: Jrue Haliburton
Score: 29-24

[09:59] Team_062 possession (Score: 29-24)
Kawhi Thompson attempts a 3Pt. Contested by Anthony Haliburton (2.8 feet, MAN). Kawhi Thompson misses. Rebound secured by Tyrese Stewart.

[09:44] Team_097 possession (Score: 29-24)
Evan Brogdon throws a bad pass out of bounds! TURNOVER! (dead ball)

[09:27] Team_062 possession (Score: 29-24)
RJ Williamson attempts a 3Pt. Contested by Shai Poole (4.7 feet, ZONE). RJ Williamson misses. Rebound secured by Anthony Haliburton.

[09:15] Team_097 possession (Score: 29-24)
Shai Poole attempts a 3Pt. Wide open! RJ Williamson is 6.7 feet away. [ZONE] SHAI POOLE MAKES IT! Assist: Evan Brogdon
Score: 32-24

[09:01] Team_062 possession (Score: 32-24)
Chris Bird attempts a 3Pt. Wide open! Anthony Haliburton is 7.4 feet away. [ZONE] Chris Bird misses. Rebound secured by Tyrese Stewart.

[08:46] Team_097 possession (Score: 32-24)
Shai Poole attempts a 3Pt. BLOCKED BY RJ WILLIAMSON! Ball is loose! Offensive rebound by Tyrese Stewart! Tyrese Stewart kicks it out.

[08:32] Team_097 possession (Score: 32-24)
Evan Brogdon attempts a Layup. Contested by Jalen Reaves (3.7 feet, ZONE). EVAN BROGDON MAKES IT! Assist: Shai Poole
Score: 34-24

[08:17] Team_062 possession (Score: 34-24)
Michael Hyland throws a bad pass out of bounds! TURNOVER! (dead ball)

[08:17] Substitution (Team_097): Evan Brogdon OUT → Gary Carter IN (stamina_rule2)

[08:17] Substitution (Team_097): Jrue Haliburton OUT → Dwyane Ginobili IN (stamina_rule2)

[08:17] Substitution (Team_097): Shai Poole OUT → Miles Dosunmu IN (stamina_rule2)

[08:17] Substitution (Team_097): Anthony Haliburton OUT → Joel Simons IN (stamina_rule2)

[08:17] Substitution (Team_097): Tyrese Stewart OUT → Miles Banchero IN (stamina_rule2)

[08:17] Substitution (Team_062): Chris Bird OUT → Paolo McCollum IN (stamina_rule2)

[08:17] Substitution (Team_062): RJ Williamson OUT → Tony LaVine IN (stamina_rule2)

[08:17] Substitution (Team_062): Michael Hyland OUT → Paul Poole IN (stamina_rule2)

[08:17] Substitution (Team_062): Kawhi Thompson OUT → RJ Wall IN (stamina_rule2)

[08:17] Substitution (Team_062): Jalen Reaves OUT → Devin Young IN (stamina_rule2)

[07:58] Team_097 possession (Score: 34-24)
Gary Carter attempts a 3Pt. Contested by Paolo McCollum (5.6 feet, ZONE). GARY CARTER MAKES IT! Assist: Dwyane Ginobili
Score: 37-24

[07:40] Team_062 possession (Score: 37-24)
Paul Poole attempts a 3Pt. Contested by Joel Simons (5.5 feet, ZONE). Paul Poole misses. Offensive rebound by RJ Wall! RJ Wall kicks it out.

[07:24] Team_062 possession (Score: 37-24)
Paul Poole drives and kicks out. Paul Poole attempts a Midrange. Contested by Miles Dosunmu (2.6 feet, MAN). Paul Poole misses. Rebound secured by Miles Banchero.

[07:09] Team_097 possession (Score: 37-24)
Miles Dosunmu loses control! Ball rolls out of bounds! TURNOVER! (dead ball)

[06:58] Team_062 possession (Score: 37-24)
Devin Young loses control! Ball rolls out of bounds! TURNOVER! (dead ball)

[06:46] Team_097 possession (Score: 37-24)
Miles Dosunmu attempts a 3Pt. Contested by Paolo McCollum (5.2 feet, ZONE). MILES DOSUNMU MAKES IT! Assist: Miles Banchero
Score: 40-24

[06:30] Team_062 possession (Score: 40-24)
Devin Young drives and kicks out. Tony LaVine attempts a 3Pt. Contested by Dwyane Ginobili (5.0 feet, MAN). Tony LaVine misses. Offensive rebound by RJ Wall! RJ Wall kicks it out.

[06:16] Team_062 possession (Score: 40-24)
FOUL! Holding foul on Dwyane Ginobili. [Team fouls: 3] No free throws, side out. (Dwyane Ginobili: 1 personal fouls)

[06:01] Team_062 possession (Score: 40-24)
Devin Young attempts a Midrange. Wide open! Miles Dosunmu is 6.7 feet away. [ZONE] DEVIN YOUNG MAKES IT! Assist: Paolo McCollum
Score: 40-26

[05:46] Team_097 possession (Score: 40-26)
Miles Dosunmu drives to the basket... Miles Dosunmu commits a violation (traveling/carry)! TURNOVER! (dead ball)

[05:32] Team_062 possession (Score: 40-26)
Paul Poole attempts a 3Pt. Contested by Miles Dosunmu (4.9 feet, MAN). Paul Poole misses. Rebound secured by Miles Banchero.

[05:15] Team_097 possession (Score: 40-26)
Dwyane Ginobili attempts a Midrange. Contested by Tony LaVine (4.9 feet, MAN). Dwyane Ginobili misses. Rebound secured by RJ Wall.

[05:02] Team_062 possession (Score: 40-26)
FOUL! Holding foul on Joel Simons. [Team fouls: 4] No free throws, side out. (Joel Simons: 1 personal fouls)

[04:43] Team_062 possession (Score: 40-26)
RJ Wall attempts a 3Pt. Contested by Joel Simons (3.9 feet, ZONE). RJ Wall misses. Rebound secured by Joel Simons.

[04:33] Team_097 possession (Score: 40-26)
Dwyane Ginobili makes the Dunk and draws the foul on RJ Wall! And-1! Dwyane Ginobili to the line for 1. [Team fouls: 2] (RJ Wall: 1 personal fouls)   FT 1/1: GOOD Dwyane Ginobili makes 1/1 from the line.
Score: 43-26

[04:18] Team_062 possession (Score: 43-26)
Devin Young makes the Layup and draws the foul on Dwyane Ginobili! And-1! Devin Young to the line for 1. [BONUS: 5 team fouls] (Dwyane Ginobili: 2 personal fouls)   FT 1/1: GOOD Devin Young makes 1/1 from the line.
Score: 43-29

[04:07] Team_097 possession (Score: 43-29)
FOUL! Holding foul on RJ Wall. [Team fouls: 3] No free throws, side out. (RJ Wall: 2 personal fouls)

[03:53] Team_097 possession (Score: 43-29)
Dwyane Ginobili attempts a 3Pt. Wide open! Tony LaVine is 6.3 feet away. [ZONE] Dwyane Ginobili misses. FOUL! Loose ball foul on Devin Young during the rebound battle. [Team fouls: 4] No free throws, side out. (Devin Young: 1 personal fouls)

[03:44] Team_097 possession (Score: 43-29)
Miles Dosunmu attempts a Midrange. Contested by Paul Poole (5.3 feet, MAN). Miles Dosunmu misses. Rebound secured by Paul Poole.

[03:35] Team_062 possession (Score: 43-29)
Paolo McCollum attempts a 3Pt. Contested by Gary Carter (4.2 feet, MAN). Paolo McCollum misses. Offensive rebound by RJ Wall! RJ Wall kicks it out.

[03:24] Team_062 possession (Score: 43-29)
FOUL! Reach-in foul on Joel Simons during the drive. [IN THE BONUS! 6 team fouls] Devin Young to the line for 2 free throws. (Joel Simons: 2 personal fouls)   FT 1/2: GOOD   FT 2/2: MISS Devin Young makes 1/2 from the line. Rebound secured by Joel Simons.
Score: 43-30

[03:11] Team_097 possession (Score: 43-30)
Joel Simons attempts a 3Pt. Contested by Paolo McCollum (4.8 feet, ZONE). Joel Simons misses. Offensive rebound by Miles Dosunmu! Miles Dosunmu kicks it out.

[02:57] Team_097 possession (Score: 43-30)
Miles Dosunmu makes the Dunk and draws the foul on Paul Poole! And-1! Miles Dosunmu to the line for 1. [BONUS: 5 team fouls] (Paul Poole: 1 personal fouls)   FT 1/1: GOOD Miles Dosunmu makes 1/1 from the line.
Score: 46-30

[02:39] Team_062 possession (Score: 46-30)
Paul Poole attempts a Midrange. Heavily contested by Miles Dosunmu (1.8 feet, ZONE)! Paul Poole misses. Rebound secured by Miles Dosunmu.

[02:20] Team_097 possession (Score: 46-30)
Miles Banchero makes the Layup and draws the foul on RJ Wall! And-1! Miles Banchero to the line for 1. [BONUS: 6 team fouls] (RJ Wall: 3 personal fouls)   FT 1/1: GOOD Miles Banchero makes 1/1 from the line.
Score: 49-30

[02:06] Team_062 possession (Score: 49-30)
RJ Wall attempts a Layup. BLOCKED BY JOEL SIMONS! Ball is loose! Rebound secured by Miles Banchero.

[01:50] Team_097 possession (Score: 49-30)
Miles Banchero attempts a Midrange. Wide open! Devin Young is 8.6 feet away. [MAN] Miles Banchero misses. Rebound secured by RJ Wall.

[01:36] Team_062 possession (Score: 49-30)
Devin Young attempts a Midrange. Wide open! Joel Simons is 6.0 feet away. [MAN] Devin Young misses. Rebound secured by Miles Banchero.

[01:22] Team_097 possession (Score: 49-30)
Joel Simons attempts a Midrange. Wide open! Tony LaVine is 9.8 feet away. [ZONE] Joel Simons misses. Rebound secured by Paul Poole.

[01:12] Team_062 possession (Score: 49-30)
Tony LaVine attempts a 3Pt. Wide open! Dwyane Ginobili is 7.8 feet away. [MAN] Tony LaVine misses. Rebound secured by Joel Simons.

[00:57] Team_097 possession (Score: 49-30)
FOUL! Holding foul on Devin Young. [IN THE BONUS! 7 team fouls] Miles Banchero to the line for 2 free throws. (Devin Young: 2 personal fouls)   FT 1/2: GOOD   FT 2/2: GOOD Miles Banchero makes 2/2 from the line.
Score: 51-30

[00:45] Team_062 possession (Score: 51-30)
Paolo McCollum attempts a 3Pt. Contested by Joel Simons (2.9 feet, ZONE). PAOLO MCCOLLUM MAKES IT! Assist: Tony LaVine
Score: 51-33

[00:30] Team_097 possession (Score: 51-33)
Gary Carter attempts a 3Pt. Wide open! Paolo McCollum is 7.8 feet away. [ZONE] GARY CARTER MAKES IT! Assist: Dwyane Ginobili
Score: 54-33

[00:15] Team_062 possession (Score: 54-33)
Paolo McCollum attempts a 3Pt. Contested by Gary Carter (4.4 feet, MAN). Paolo McCollum misses. Rebound secured by Miles Dosunmu.

================================================================================
                              2ND QUARTER COMPLETE                              
================================================================================

2ND QUARTER SCORE: Team_097 32, Team_062 15

BOX SCORE:
================================================================================

Team_097
--------------------------------------------------------------------------------
Player                MIN  PTS  REB  AST  TO      FG   FG%      3P   3P%
--------------------------------------------------------------------------------
Evan Brogdon           14    7    0    1   0   3/4    75.0     0/0   0.0
Gary Carter            10    6    0    0   0   2/2   100.0     0/0   0.0
Miles Dosunmu          10    6    3    0   0   2/3    66.7     0/0   0.0
Shai Poole             14    5    0    1   0   2/2   100.0     0/0   0.0
Miles Banchero         10    5    4    1   0   2/3    66.7     0/0   0.0
Dwyane Ginobili        10    3    0    2   0   1/2    50.0     0/0   0.0
Tyrese Stewart         14    0    4    1   0   0/0     0.0     0/0   0.0
Jrue Haliburton        14    0    0    2   0   0/0     0.0     0/0   0.0
Anthony Haliburton     14    0    1    0   0   0/0     0.0     0/0   0.0
Joel Simons            10    0    4    0   0   0/1     0.0     0/0   0.0

TEAM: FG: 12/17 (70.6%), 3PT: 5/5 (100.0%), REB: 16 (3 off, 13 def), AST: 8, TO: 3
TEAM FOULS: 6 [Team_062 in BONUS]


Team_062
--------------------------------------------------------------------------------
Player                MIN  PTS  REB  AST  TO      FG   FG%      3P   3P%
--------------------------------------------------------------------------------
Devin Young            11    5    0    0   0   2/4    50.0     0/0   0.0
RJ Williamson          14    3    0    1   0   1/2    50.0     0/0   0.0
Chris Bird             14    3    0    0   0   1/2    50.0     0/0   0.0
Paolo McCollum         10    3    0    1   0   1/2    50.0     0/0   0.0
Kawhi Thompson         14    0    1    0   0   0/1     0.0     0/0   0.0
Jalen Reaves           13    0    0    0   0   0/1     0.0     0/0   0.0
RJ Wall                10    0    5    0   0   0/2     0.0     0/0   0.0
Paul Poole             10    0    2    0   0   0/3     0.0     0/0   0.0
Tony LaVine            10    0    0    1   0   0/1     0.0     0/0   0.0

TEAM: FG: 5/18 (27.8%), 3PT: 2/9 (22.2%), REB: 8 (3 off, 5 def), AST: 3, TO: 2
TEAM FOULS: 7 [Team_097 in BONUS]

================================================================================

================================================================================
                       3RD QUARTER - Team_097 vs Team_062                       
================================================================================

[12:00] Team_097 possession (Score: 54-33)
Anthony Haliburton attempts a Dunk. BLOCKED BY JALEN REAVES! Ball is loose! Rebound secured by Kawhi Thompson.

[11:47] Team_062 possession (Score: 54-33)
RJ Williamson drives and kicks out. Kawhi Thompson attempts a 3Pt. Contested by Anthony Haliburton (4.8 feet, MAN). Kawhi Thompson misses. Rebound secured by Shai Poole.

[11:30] Team_097 possession (Score: 54-33)
Shai Poole attempts a 3Pt. Contested by RJ Williamson (3.4 feet, ZONE). Shai Poole misses. Offensive rebound by Anthony Haliburton! Anthony Haliburton puts it back in!
Score: 56-33

[11:15] Team_062 possession (Score: 56-33)
FOUL! Holding foul on Anthony Haliburton. [Team fouls: 1] No free throws, side out. (Anthony Haliburton: 1 personal fouls)

[11:04] Team_062 possession (Score: 56-33)
Michael Hyland attempts a Midrange. Wide open! Shai Poole is 6.5 feet away. [MAN] Michael Hyland misses. Rebound secured by Anthony Haliburton.

[10:48] Team_097 possession (Score: 56-33)
Anthony Haliburton makes the Layup and draws the foul on Chris Bird! And-1! Anthony Haliburton to the line for 1. [Team fouls: 1] (Chris Bird: 1 personal fouls)   FT 1/1: MISS Anthony Haliburton makes 0/1 from the line. Rebound secured by Jalen Reaves.
Score: 58-33

[10:29] Team_062 possession (Score: 58-33)
Chris Bird attempts a Midrange. Wide open! Evan Brogdon is 6.3 feet away. [MAN] CHRIS BIRD MAKES IT!
Score: 58-35

[10:17] Team_097 possession (Score: 58-35)
Evan Brogdon attempts a 3Pt. Wide open! RJ Williamson is 8.3 feet away. [ZONE] Evan Brogdon misses. Offensive rebound by Anthony Haliburton! Anthony Haliburton's putback is no good. Rebound secured by Jalen Reaves.

[10:01] Team_062 possession (Score: 58-35)
Kawhi Thompson drives, Anthony Haliburton stays with him. Kawhi Thompson attempts a Dunk. Heavily contested by Anthony Haliburton (0.5 feet, MAN)! KAWHI THOMPSON MAKES IT! Assist: Michael Hyland
Score: 58-37

[09:47] Team_097 possession (Score: 58-37)
FOUL! Holding foul on Kawhi Thompson. [Team fouls: 2] No free throws, side out. (Kawhi Thompson: 1 personal fouls)

[09:29] Team_097 possession (Score: 58-37)
Jrue Haliburton attempts a Midrange. BLOCKED BY KAWHI THOMPSON! Ball is loose! Rebound secured by Kawhi Thompson.

[09:14] Team_062 possession (Score: 58-37)
Chris Bird drives to the basket... Chris Bird loses control! Ball rolls out of bounds! TURNOVER! (dead ball)

[08:56] Team_097 possession (Score: 58-37)
Evan Brogdon attempts a 3Pt. Wide open! Chris Bird is 7.3 feet away. [MAN] EVAN BROGDON MAKES IT! Assist: Tyrese Stewart
Score: 61-37

[08:39] Team_062 possession (Score: 61-37)
RJ Williamson attempts a Layup. Heavily contested by Anthony Haliburton (0.5 feet, ZONE)! RJ Williamson misses. Rebound secured by Shai Poole.

[08:25] Team_097 possession (Score: 61-37)
Evan Brogdon attempts a 3Pt. Contested by Chris Bird (5.4 feet, MAN). Evan Brogdon misses. Rebound secured by Kawhi Thompson.

[08:13] Team_062 possession (Score: 61-37)
Jalen Reaves attempts a Midrange. Contested by Shai Poole (4.2 feet, ZONE). Jalen Reaves misses. Rebound secured by Anthony Haliburton.

[07:58] Team_097 possession (Score: 61-37)
Anthony Haliburton attempts a Midrange. Wide open! Kawhi Thompson is 7.6 feet away. [ZONE] Anthony Haliburton misses. Rebound secured by Kawhi Thompson.

[07:46] Team_062 possession (Score: 61-37)
FOUL! Reach-in foul on Anthony Haliburton during the drive. [Team fouls: 2] No free throws, side out. (Anthony Haliburton: 2 personal fouls)

[07:31] Team_062 possession (Score: 61-37)
Chris Bird attempts a Midrange. Wide open! Evan Brogdon is 7.7 feet away. [MAN] Chris Bird misses. Rebound secured by Shai Poole.

[07:16] Team_097 possession (Score: 61-37)
Tyrese Stewart drives and kicks out. Shai Poole attempts a Midrange. Wide open! Michael Hyland is 7.6 feet away. [MAN] Shai Poole misses. Rebound secured by Jalen Reaves.

[07:02] Team_062 possession (Score: 61-37)
Kawhi Thompson attempts a 3Pt. Heavily contested by Shai Poole (0.5 feet, ZONE)! Kawhi Thompson misses. Offensive rebound by Jalen Reaves! Jalen Reaves puts it back in!
Score: 61-39

[06:50] Team_097 possession (Score: 61-39)
Evan Brogdon drives to the basket... Evan Brogdon throws a bad pass out of bounds! TURNOVER! (dead ball)

[06:33] Team_062 possession (Score: 61-39)
Jalen Reaves drives, picks up Anthony Haliburton. Help arrives from Jrue Haliburton! Jalen Reaves attempts a Layup. Heavily contested by Jrue Haliburton (0.5 feet, ZONE)! JALEN REAVES MAKES IT! Assist: Michael Hyland
Score: 61-41

[06:18] Team_097 possession (Score: 61-41)
FOUL! Reach-in foul on Jalen Reaves during the drive. [Team fouls: 3] No free throws, side out. (Jalen Reaves: 1 personal fouls)

[06:05] Team_097 possession (Score: 61-41)
Tyrese Stewart attempts a 3Pt. Contested by Jalen Reaves (4.1 feet, MAN). TYRESE STEWART MAKES IT! Assist: Jrue Haliburton
Score: 64-41

[05:49] Team_062 possession (Score: 64-41)
Chris Bird makes the Layup and draws the foul on Anthony Haliburton! And-1! Chris Bird to the line for 1. [Team fouls: 3] (Anthony Haliburton: 3 personal fouls)   FT 1/1: GOOD Chris Bird makes 1/1 from the line.
Score: 64-44

[05:34] Team_097 possession (Score: 64-44)
Shai Poole attempts a Midrange. Contested by Michael Hyland (2.7 feet, MAN). Shai Poole misses. Rebound secured by Jalen Reaves.

[05:20] Team_062 possession (Score: 64-44)
Jalen Reaves attempts a 3Pt. Heavily contested by Shai Poole (1.4 feet, ZONE)! Jalen Reaves misses. Rebound secured by Shai Poole.

[05:07] Team_097 possession (Score: 64-44)
Jrue Haliburton attempts a Midrange. Contested by RJ Williamson (5.8 feet, MAN). Jrue Haliburton misses. Rebound secured by Kawhi Thompson.

[04:49] Team_062 possession (Score: 64-44)
Jalen Reaves throws a bad pass! Stolen by Anthony Haliburton! TURNOVER! (live ball)

[04:32] Team_097 possession (Score: 64-44)
Tyrese Stewart drives and kicks out. Anthony Haliburton attempts a 3Pt. Wide open! Kawhi Thompson is 6.7 feet away. [MAN] Anthony Haliburton misses. Offensive rebound by Tyrese Stewart! Tyrese Stewart kicks it out.

[04:23] Team_097 possession (Score: 64-44)
Jrue Haliburton attempts a 3Pt. Contested by RJ Williamson (3.4 feet, ZONE). Jrue Haliburton misses. Rebound secured by Jalen Reaves.

[04:10] Team_062 possession (Score: 64-44)
FOUL! Reach-in foul on Anthony Haliburton during the drive. [Team fouls: 4] No free throws, side out. (Anthony Haliburton: 4 personal fouls)

[03:55] Team_062 possession (Score: 64-44)
Jalen Reaves loses the ball! Stripped by Anthony Haliburton! TURNOVER! (live ball)

[03:43] Team_097 possession (Score: 64-44)
Shai Poole attempts a Midrange. Wide open! Michael Hyland is 6.5 feet away. [ZONE] Shai Poole misses. Rebound secured by Kawhi Thompson.

[03:30] Team_062 possession (Score: 64-44)
RJ Williamson drives and kicks out. Kawhi Thompson attempts a 3Pt. Heavily contested by Shai Poole (1.3 feet, ZONE)! Kawhi Thompson misses. Rebound secured by Tyrese Stewart.

[03:12] Team_097 possession (Score: 64-44)
Evan Brogdon attempts a Layup. Contested by Jalen Reaves (4.5 feet, ZONE). EVAN BROGDON MAKES IT!
Score: 66-44

[02:54] Team_062 possession (Score: 66-44)
Michael Hyland attempts a Midrange. Contested by Tyrese Stewart (2.6 feet, ZONE). MICHAEL HYLAND MAKES IT!
Score: 66-46

[02:44] Team_097 possession (Score: 66-46)
Anthony Haliburton throws a bad pass! Stolen by Kawhi Thompson! TURNOVER! (live ball)

[02:33] Team_062 possession (Score: 66-46)
Jalen Reaves attempts a Layup. Contested by Anthony Haliburton (4.7 feet, ZONE). JALEN REAVES MAKES IT! Assist: RJ Williamson
Score: 66-48

[02:16] Team_097 possession (Score: 66-48)
Anthony Haliburton drives and kicks out. Shai Poole attempts a 3Pt. Wide open! Michael Hyland is 7.3 feet away. [MAN] SHAI POOLE MAKES IT! Assist: Evan Brogdon
Score: 69-48

[02:03] Team_062 possession (Score: 69-48)
Chris Bird attempts a 3Pt. Contested by Evan Brogdon (5.8 feet, MAN). CHRIS BIRD MAKES IT! Assist: Kawhi Thompson
Score: 69-51

[01:48] Team_097 possession (Score: 69-51)
Tyrese Stewart attempts a 3Pt. Wide open! RJ Williamson is 6.1 feet away. [ZONE] Tyrese Stewart misses. Rebound secured by Jalen Reaves.

[01:35] Team_062 possession (Score: 69-51)
Kawhi Thompson drives and kicks out. Jalen Reaves attempts a Midrange. Contested by Jrue Haliburton (3.5 feet, ZONE). Jalen Reaves misses. Rebound secured by Tyrese Stewart.

[01:18] Team_097 possession (Score: 69-51)
Shai Poole drives, Jalen Reaves stays with him. Shai Poole attempts a Dunk. Contested by Jalen Reaves (3.2 feet, ZONE). SHAI POOLE MAKES IT!
Score: 71-51

[01:04] Team_062 possession (Score: 71-51)
FOUL! Offensive foul on RJ Williamson! Jrue Haliburton drew the charge! [Team fouls: 4] (RJ Williamson: 1 personal fouls) TURNOVER! (dead ball)

[00:46] Team_097 possession (Score: 71-51)
Anthony Haliburton attempts a 3Pt. Wide open! RJ Williamson is 7.9 feet away. [ZONE] ANTHONY HALIBURTON MAKES IT! Assist: Jrue Haliburton
Score: 74-51

[00:37] Team_062 possession (Score: 74-51)
FOUL! Reach-in foul on Anthony Haliburton during the drive. [IN THE BONUS! 5 team fouls] Jalen Reaves to the line for 2 free throws. (Anthony Haliburton: 5 personal fouls)   FT 1/2: GOOD   FT 2/2: MISS Jalen Reaves makes 1/2 from the line. Rebound secured by Anthony Haliburton.
Score: 74-52

[00:25] Team_097 possession (Score: 74-52)
Shai Poole drives and kicks out. Tyrese Stewart makes the Midrange and draws the foul on Chris Bird! And-1! Tyrese Stewart to the line for 1. [BONUS: 5 team fouls] (Chris Bird: 2 personal fouls)   FT 1/1: GOOD Tyrese Stewart makes 1/1 from the line.
Score: 77-52

[00:09] Team_062 possession (Score: 77-52)
Michael Hyland attempts a 3Pt. Contested by Shai Poole (5.9 feet, MAN). MICHAEL HYLAND MAKES IT! Assist: RJ Williamson
Score: 77-55

================================================================================
                              3RD QUARTER COMPLETE                              
================================================================================

3RD QUARTER SCORE: Team_097 23, Team_062 22

BOX SCORE:
================================================================================

Team_097
--------------------------------------------------------------------------------
Player                MIN  PTS  REB  AST  TO      FG   FG%      3P   3P%
--------------------------------------------------------------------------------
Tyrese Stewart         26    6    3    1   0   2/4    50.0     0/0   0.0
Anthony Haliburton     26    5    4    0   0   2/5    40.0     0/0   0.0
Shai Poole             26    5    4    0   0   2/4    50.0     0/0   0.0
Evan Brogdon           26    5    0    1   0   2/4    50.0     0/0   0.0
Jrue Haliburton        26    0    0    2   0   0/3     0.0     0/0   0.0

TEAM: FG: 8/20 (40.0%), 3PT: 4/8 (50.0%), REB: 12 (3 off, 9 def), AST: 4, TO: 2
TEAM FOULS: 5 [Team_062 in BONUS]


Team_062
--------------------------------------------------------------------------------
Player                MIN  PTS  REB  AST  TO      FG   FG%      3P   3P%
--------------------------------------------------------------------------------
Chris Bird             26    8    0    0   0   3/4    75.0     0/0   0.0
Jalen Reaves           25    6    7    0   0   3/6    50.0     0/0   0.0
Michael Hyland         26    5    0    2   0   2/3    66.7     0/0   0.0
Kawhi Thompson         26    2    6    1   0   1/2    50.0     0/0   0.0
RJ Williamson          26    0    0    2   0   0/3     0.0     0/0   0.0

TEAM: FG: 9/18 (50.0%), 3PT: 3/4 (75.0%), REB: 12 (1 off, 11 def), AST: 5, TO: 4
TEAM FOULS: 5 [Team_097 in BONUS]

================================================================================

================================================================================
                       4TH QUARTER - Team_097 vs Team_062                       
================================================================================

[12:00] Team_097 possession (Score: 77-55)
FOUL! Reach-in foul on Jalen Reaves during the drive. [Team fouls: 1] No free throws, side out. (Jalen Reaves: 1 personal fouls)

[11:47] Team_097 possession (Score: 77-55)
Anthony Haliburton attempts a Midrange. Contested by Kawhi Thompson (4.5 feet, MAN). Anthony Haliburton misses. Rebound secured by Kawhi Thompson.

[11:30] Team_062 possession (Score: 77-55)
RJ Williamson attempts a Layup. Contested by Anthony Haliburton (2.2 feet, ZONE). RJ WILLIAMSON MAKES IT!
Score: 77-57

[11:19] Team_097 possession (Score: 77-57)
Anthony Haliburton attempts a Midrange. Contested by Kawhi Thompson (5.8 feet, ZONE). Anthony Haliburton misses. FOUL! Loose ball foul on Michael Hyland during the rebound battle. [Team fouls: 2] No free throws, side out. (Michael Hyland: 1 personal fouls)

[11:06] Team_097 possession (Score: 77-57)
FOUL! Holding foul on RJ Williamson. [Team fouls: 3] No free throws, side out. (RJ Williamson: 1 personal fouls)

[10:53] Team_097 possession (Score: 77-57)
Tyrese Stewart attempts a 3Pt. Wide open! Jalen Reaves is 9.7 feet away. [MAN] Tyrese Stewart misses. Rebound secured by Jalen Reaves.

[10:40] Team_062 possession (Score: 77-57)
Michael Hyland attempts a 3Pt. Wide open! Shai Poole is 8.8 feet away. [MAN] Michael Hyland misses. Rebound secured by Shai Poole.

[10:27] Team_097 possession (Score: 77-57)
Evan Brogdon attempts a 3Pt. Contested by Chris Bird (5.9 feet, MAN). Evan Brogdon misses. Rebound secured by Jalen Reaves.

[10:08] Team_062 possession (Score: 77-57)
Michael Hyland attempts a Midrange. Contested by Shai Poole (4.9 feet, MAN). Michael Hyland misses. Rebound secured by Shai Poole.

[09:54] Team_097 possession (Score: 77-57)
Jrue Haliburton attempts a 3Pt. Wide open! RJ Williamson is 6.8 feet away. [MAN] Jrue Haliburton misses. Rebound secured by Jalen Reaves.

[09:42] Team_062 possession (Score: 77-57)
Kawhi Thompson attempts a Layup. Heavily contested by Anthony Haliburton (0.5 feet, ZONE)! KAWHI THOMPSON MAKES IT!
Score: 77-59

[09:26] Team_097 possession (Score: 77-59)
Shai Poole attempts a 3Pt. Contested by RJ Williamson (3.6 feet, ZONE). Shai Poole misses. Rebound secured by Kawhi Thompson.

[09:12] Team_062 possession (Score: 77-59)
FOUL! Holding foul on Jrue Haliburton. [Team fouls: 1] No free throws, side out. (Jrue Haliburton: 1 personal fouls)

[08:58] Team_062 possession (Score: 77-59)
RJ Williamson makes the Layup and draws the foul on Anthony Haliburton! And-1! RJ Williamson to the line for 1. [Team fouls: 2] (Anthony Haliburton: 1 personal fouls)   FT 1/1: GOOD RJ Williamson makes 1/1 from the line.
Score: 77-62

[08:47] Team_097 possession (Score: 77-62)
Tyrese Stewart drives and kicks out. Evan Brogdon attempts a Midrange. Heavily contested by Chris Bird (1.6 feet, MAN)! Evan Brogdon misses. Rebound secured by Michael Hyland.

[08:35] Team_062 possession (Score: 77-62)
RJ Williamson drives, picks up Jrue Haliburton. Help arrives from Shai Poole! RJ Williamson attempts a Dunk. Heavily contested by Shai Poole (0.5 feet, MAN)! RJ Williamson misses. Rebound secured by Shai Poole.

[08:19] Team_097 possession (Score: 77-62)
Tyrese Stewart drives, picks up Jalen Reaves. Help arrives from Chris Bird! Tyrese Stewart attempts a Dunk. Wide open! Chris Bird is 8.3 feet away. [MAN] TYRESE STEWART MAKES IT!
Score: 79-62

[08:04] Team_062 possession (Score: 79-62)
Kawhi Thompson drives and kicks out. RJ Williamson attempts a Midrange. Wide open! Anthony Haliburton is 7.3 feet away. [ZONE] RJ Williamson misses. Rebound secured by Tyrese Stewart.

[07:50] Team_097 possession (Score: 79-62)
FOUL! Shooting foul on Chris Bird. Evan Brogdon to the line for 3 free throws. [Team fouls: 4] (Chris Bird: 1 personal fouls)   FT 1/3: GOOD   FT 2/3: MISS   FT 3/3: GOOD Evan Brogdon makes 2/3 from the line.
Score: 81-62

[07:35] Team_062 possession (Score: 81-62)
FOUL! Shooting foul on Shai Poole. Michael Hyland to the line for 2 free throws. [Team fouls: 3] (Shai Poole: 1 personal fouls)   FT 1/2: GOOD   FT 2/2: MISS Michael Hyland makes 1/2 from the line. Offensive rebound by Kawhi Thompson! Kawhi Thompson kicks it out.
Score: 81-63

[07:19] Team_062 possession (Score: 81-63)
Michael Hyland attempts a 3Pt. Contested by Shai Poole (5.2 feet, ZONE). Michael Hyland misses. Offensive rebound by Jalen Reaves! Jalen Reaves kicks it out.

[07:04] Team_062 possession (Score: 81-63)
RJ Williamson attempts a Midrange. Wide open! Jrue Haliburton is 8.4 feet away. [ZONE] RJ WILLIAMSON MAKES IT!
Score: 81-65

[06:48] Team_097 possession (Score: 81-65)
Evan Brogdon attempts a 3Pt. Contested by Chris Bird (4.0 feet, MAN). Evan Brogdon misses. Rebound secured by Kawhi Thompson.

[06:35] Team_062 possession (Score: 81-65)
Chris Bird attempts a 3Pt. Wide open! Evan Brogdon is 6.5 feet away. [MAN] Chris Bird misses. FOUL! Loose ball foul on Anthony Haliburton during the rebound battle. [Team fouls: 4] No free throws, side out. (Anthony Haliburton: 2 personal fouls)

[06:20] Team_062 possession (Score: 81-65)
RJ Williamson attempts a Layup. BLOCKED BY ANTHONY HALIBURTON! Ball is loose! Rebound secured by Tyrese Stewart.

[06:06] Team_097 possession (Score: 81-65)
FOUL! Holding foul on Jalen Reaves. [IN THE BONUS! 5 team fouls] Tyrese Stewart to the line for 2 free throws. (Jalen Reaves: 2 personal fouls)   FT 1/2: MISS   FT 2/2: GOOD Tyrese Stewart makes 1/2 from the line.
Score: 82-65

[05:54] Team_062 possession (Score: 82-65)
FOUL! Holding foul on Jrue Haliburton. [IN THE BONUS! 5 team fouls] RJ Williamson to the line for 2 free throws. (Jrue Haliburton: 2 personal fouls)   FT 1/2: GOOD   FT 2/2: GOOD RJ Williamson makes 2/2 from the line.
Score: 82-67

[05:41] Team_097 possession (Score: 82-67)
Jrue Haliburton drives, Jalen Reaves stays with him. Jrue Haliburton attempts a Layup. Contested by Jalen Reaves (3.3 feet, ZONE). JRUE HALIBURTON MAKES IT!
Score: 84-67

[05:25] Team_062 possession (Score: 84-67)
Chris Bird drives and kicks out. Jalen Reaves attempts a Midrange. Contested by Tyrese Stewart (4.1 feet, MAN). Jalen Reaves misses. Rebound secured by Tyrese Stewart.

[05:13] Team_097 possession (Score: 84-67)
Anthony Haliburton drives to the basket... Anthony Haliburton throws a bad pass out of bounds! TURNOVER! (dead ball)

[05:13] Substitution (Team_097): Evan Brogdon OUT → Gary Carter IN (stamina_rule2)

[05:13] Substitution (Team_097): Jrue Haliburton OUT → Dwyane Ginobili IN (stamina_rule2)

[05:13] Substitution (Team_097): Shai Poole OUT → Miles Dosunmu IN (stamina_rule2)

[05:13] Substitution (Team_097): Anthony Haliburton OUT → Joel Simons IN (stamina_rule2)

[05:13] Substitution (Team_097): Tyrese Stewart OUT → Miles Banchero IN (stamina_rule2)

[05:13] Substitution (Team_062): Chris Bird OUT → Paolo McCollum IN (stamina_rule2)

[05:13] Substitution (Team_062): RJ Williamson OUT → Tony LaVine IN (stamina_rule2)

[05:13] Substitution (Team_062): Michael Hyland OUT → Paul Poole IN (stamina_rule2)

[05:13] Substitution (Team_062): Kawhi Thompson OUT → RJ Wall IN (stamina_rule2)

[05:13] Substitution (Team_062): Jalen Reaves OUT → Devin Young IN (stamina_rule2)

[05:03] Team_062 possession (Score: 84-67)
FOUL! Shooting foul on Dwyane Ginobili. Tony LaVine to the line for 2 free throws. [BONUS: 6 team fouls] (Dwyane Ginobili: 1 personal fouls)   FT 1/2: GOOD   FT 2/2: MISS Tony LaVine makes 1/2 from the line. Rebound secured by Joel Simons.
Score: 84-68

[04:44] Team_097 possession (Score: 84-68)
Miles Banchero drives, picks up Devin Young. Help arrives from Paolo McCollum! Miles Banchero attempts a Layup. Wide open! Paolo McCollum is 7.9 feet away. [MAN] MILES BANCHERO MAKES IT! Assist: Joel Simons
Score: 86-68

[04:27] Team_062 possession (Score: 86-68)
Paolo McCollum drives and kicks out. RJ Wall attempts a Midrange. Contested by Joel Simons (3.8 feet, ZONE). RJ Wall misses. Rebound secured by Miles Dosunmu.

[04:12] Team_097 possession (Score: 86-68)
Miles Dosunmu attempts a 3Pt. Wide open! Paul Poole is 7.3 feet away. [MAN] Miles Dosunmu misses. Rebound secured by Devin Young.

[03:55] Team_062 possession (Score: 86-68)
Devin Young makes the Layup and draws the foul on Joel Simons! And-1! Devin Young to the line for 1. [BONUS: 7 team fouls] (Joel Simons: 1 personal fouls)   FT 1/1: GOOD Devin Young makes 1/1 from the line.
Score: 86-71

[03:39] Team_097 possession (Score: 86-71)
Miles Banchero drives to the basket... Miles Banchero throws a bad pass! Stolen by Devin Young! TURNOVER! (live ball)

[03:24] Team_062 possession (Score: 86-71)
Tony LaVine throws a bad pass! Stolen by Dwyane Ginobili! TURNOVER! (live ball)

[03:10] Team_097 possession (Score: 86-71)
Miles Dosunmu drives and kicks out. Gary Carter attempts a Midrange. Wide open! Paolo McCollum is 6.4 feet away. [MAN] Gary Carter misses. Rebound secured by Devin Young.

[02:58] Team_062 possession (Score: 86-71)
FOUL! Shooting foul on Joel Simons. RJ Wall to the line for 2 free throws. [BONUS: 8 team fouls] (Joel Simons: 2 personal fouls)   FT 1/2: GOOD   FT 2/2: GOOD RJ Wall makes 2/2 from the line.
Score: 86-73

[02:46] Team_097 possession (Score: 86-73)
FOUL! Reach-in foul on RJ Wall during the drive. [IN THE BONUS! 6 team fouls] Joel Simons to the line for 2 free throws. (RJ Wall: 1 personal fouls)   FT 1/2: MISS   FT 2/2: GOOD Joel Simons makes 1/2 from the line.
Score: 87-73

[02:33] Team_062 possession (Score: 87-73)
Paolo McCollum drives and kicks out. Paul Poole attempts a 3Pt. Contested by Miles Dosunmu (5.4 feet, MAN). Paul Poole misses. Rebound secured by Miles Dosunmu.

[02:20] Team_097 possession (Score: 87-73)
Dwyane Ginobili drives, Tony LaVine stays with him. Dwyane Ginobili attempts a Layup. Contested by Tony LaVine (3.0 feet, MAN). Dwyane Ginobili misses. Rebound secured by Paul Poole.

[02:02] Team_062 possession (Score: 87-73)
Paolo McCollum attempts a Layup. Contested by Gary Carter (2.7 feet, MAN). PAOLO MCCOLLUM MAKES IT! Assist: Tony LaVine
Score: 87-75

[01:49] Team_097 possession (Score: 87-75)
FOUL! Holding foul on Tony LaVine. [IN THE BONUS! 7 team fouls] Dwyane Ginobili to the line for 2 free throws. (Tony LaVine: 1 personal fouls)   FT 1/2: GOOD   FT 2/2: GOOD Dwyane Ginobili makes 2/2 from the line.
Score: 89-75

[01:36] Team_062 possession (Score: 89-75)
Paolo McCollum attempts a 3Pt. Contested by Miles Dosunmu (5.4 feet, ZONE). Paolo McCollum misses. Rebound secured by Miles Dosunmu.

[01:23] Team_097 possession (Score: 89-75)
Dwyane Ginobili drives, RJ Wall stays with him. Dwyane Ginobili attempts a Layup. Wide open! RJ Wall is 7.5 feet away. [ZONE] DWYANE GINOBILI MAKES IT! Assist: Joel Simons
Score: 91-75

[01:04] Team_062 possession (Score: 91-75)
Paul Poole loses control! Ball rolls out of bounds! TURNOVER! (dead ball)

[00:48] Team_097 possession (Score: 91-75)
Dwyane Ginobili attempts a Midrange. Wide open! Tony LaVine is 6.4 feet away. [ZONE] Dwyane Ginobili misses. Rebound secured by Devin Young.

[00:31] Team_062 possession (Score: 91-75)
Devin Young commits a violation (traveling/carry)! TURNOVER! (dead ball)

[00:17] Team_097 possession (Score: 91-75)
Miles Dosunmu attempts a 3Pt. Wide open! Paolo McCollum is 7.4 feet away. [ZONE] MILES DOSUNMU MAKES IT! Assist: Gary Carter
Score: 94-75

[00:06] Team_062 possession (Score: 94-75)
Paul Poole attempts a 3Pt. Contested by Joel Simons (3.3 feet, ZONE). Paul Poole misses. Rebound secured by Joel Simons.

================================================================================
                              4TH QUARTER COMPLETE                              
================================================================================

4TH QUARTER SCORE: Team_097 17, Team_062 20

BOX SCORE:
================================================================================

Team_097
--------------------------------------------------------------------------------
Player                MIN  PTS  REB  AST  TO      FG   FG%      3P   3P%
--------------------------------------------------------------------------------
Dwyane Ginobili        15    4    0    0   0   2/4    50.0     0/0   0.0
Tyrese Stewart         33    3    3    0   0   2/4    50.0     0/0   0.0
Miles Dosunmu          16    3    3    0   0   1/3    33.3     0/0   0.0
Evan Brogdon           33    2    0    0   0   1/3    33.3     0/0   0.0
Jrue Haliburton        33    2    0    0   0   1/2    50.0     0/0   0.0
Miles Banchero         16    2    0    0   0   1/1   100.0     0/0   0.0
Joel Simons            16    1    2    2   0   1/1   100.0     0/0   0.0
Anthony Haliburton     33    0    1    0   0   0/1     0.0     0/0   0.0
Shai Poole             33    0    3    0   0   0/1     0.0     0/0   0.0
Gary Carter            16    0    0    1   0   0/0     0.0     0/0   0.0

TEAM: FG: 9/20 (45.0%), 3PT: 2/8 (25.0%), REB: 12 (1 off, 11 def), AST: 3, TO: 2
TEAM FOULS: 8 [Team_062 in BONUS]


Team_062
--------------------------------------------------------------------------------
Player                MIN  PTS  REB  AST  TO      FG   FG%      3P   3P%
--------------------------------------------------------------------------------
RJ Williamson          33    9    0    0   0   4/6    66.7     0/0   0.0
Devin Young            16    3    3    0   0   1/1   100.0     0/0   0.0
Kawhi Thompson         33    2    5    0   0   1/2    50.0     0/0   0.0
Paolo McCollum         16    2    0    0   0   1/4    25.0     0/0   0.0
RJ Wall                16    2    0    0   0   1/1   100.0     0/0   0.0
Jalen Reaves           32    0    4    0   0   0/0     0.0     0/0   0.0
Michael Hyland         33    0    1    0   0   0/2     0.0     0/0   0.0
Chris Bird             33    0    0    0   0   0/1     0.0     0/0   0.0
Tony LaVine            16    0    0    1   0   0/1     0.0     0/0   0.0
Paul Poole             16    0    1    0   0   0/1     0.0     0/0   0.0

TEAM: FG: 8/19 (42.1%), 3PT: 0/3 (0.0%), REB: 14 (3 off, 11 def), AST: 1, TO: 3
TEAM FOULS: 7 [Team_097 in BONUS]

================================================================================

================================================================================
                               FULL GAME COMPLETE                               
================================================================================

FINAL SCORE: Team_097 94, Team_062 75

SCORING BY QUARTER:
--------------------------------------------------------------------------------
Team                     Q1     Q2     Q3     Q4    FINAL
--------------------------------------------------------------------------------
Team_097                 22     32     23     17       94
Team_062                 18     15     22     20       75
--------------------------------------------------------------------------------

FULL GAME BOX SCORE:
================================================================================

Team_097
--------------------------------------------------------------------------------
Player                MIN  PTS  REB  AST  TO      FG   FG%      3P   3P%      FT STL BLK
--------------------------------------------------------------------------------
Jrue Haliburton        33    9    0    4   0   4/9    44.4   1/4    25.0   0/0     0   0
Evan Brogdon           33   19    0    2   3   9/18   50.0   4/11   36.4   2/3     0   0
Shai Poole             33   10   10    4   1   5/9    55.6   2/3    66.7   0/0     0   0
Anthony Haliburton     33    9    9    1   2   3/9    33.3   1/2    50.0   0/1     3   2
Tyrese Stewart         33    9   17    2   0   2/7    28.6   1/3    33.3   2/3     0   0
Gary Carter            16    6    0    1   1   2/2   100.0   2/2   100.0   0/0     0   0
Miles Dosunmu          16   11    6    0   1   4/7    57.1   2/3    66.7   1/1     0   0
Joel Simons            16    3    7    2   1   2/3    66.7   0/0     0.0   1/2     0   1
Miles Banchero         16    9    6    1   2   3/5    60.0   0/0     0.0   3/3     0   0
Dwyane Ginobili        15    7    0    3   0   2/5    40.0   0/0     0.0   3/3     1   0

TEAM: FG: 39/77 (50.6%), 3PT: 13/28 (46.4%), REB: 56 (10 off, 46 def), AST: 20, TO: 11


Team_062
--------------------------------------------------------------------------------
Player                MIN  PTS  REB  AST  TO      FG   FG%      3P   3P%      FT STL BLK
--------------------------------------------------------------------------------
Chris Bird             33   14    0    0   1   5/12   41.7   3/6    50.0   1/1     0   2
RJ Williamson          33   16    0    3   1   6/13   46.2   0/2     0.0   4/4     0   1
Michael Hyland         33    5    4    3   3   2/5    40.0   1/2    50.0   1/2     0   0
Kawhi Thompson         33    4   16    3   0   3/9    33.3   1/4    25.0   0/0     1   1
Jalen Reaves           32   11   14    0   3   4/10   40.0   0/1     0.0   2/3     0   1
Devin Young            16   11    3    1   2   4/7    57.1   0/0     0.0   4/5     1   0
Paolo McCollum         16    8    0    1   0   3/7    42.9   2/4    50.0   0/0     0   0
Tony LaVine            16    0    0    2   1   0/3     0.0   0/2     0.0   1/2     0   0
Paul Poole             16    0    4    0   1   0/5     0.0   0/3     0.0   0/0     0   0
RJ Wall                16    2    5    0   0   1/3    33.3   0/1     0.0   2/2     0   0

TEAM: FG: 29/75 (38.7%), 3PT: 7/25 (28.0%), REB: 45 (8 off, 37 def), AST: 13, TO: 12

================================================================================
