================================================================================
                        FULL GAME - Team_080 vs Team_090                        
================================================================================

================================================================================
                       1ST QUARTER - Team_080 vs Team_090                       
================================================================================

[12:00] Team_080 possession (Score: 0-0)
Khris Turner attempts a Midrange. Wide open! Larry Bridges is 6.0 feet away. [MAN] KHRIS TURNER MAKES IT! Assist: Lauri Dosunmu
Score: 2-0

[11:49] Team_090 possession (Score: 2-0)
Zach Wall attempts a 3Pt. Contested by Larry Paul (5.3 feet, MAN). Zach Wall misses. Rebound secured by Jaren Morant.

[11:35] Team_080 possession (Score: 2-0)
Khris Turner attempts a 3Pt. Contested by Derrick Mitchell (3.5 feet, ZONE). Khris Turner misses. Rebound secured by Gary Brogdon.

[11:19] Team_090 possession (Score: 2-0)
Gary Brogdon attempts a 3Pt. Contested by Jaren Morant (2.8 feet, MAN). Gary Brogdon misses. Rebound secured by Draymond Simons.

[11:05] Team_080 possession (Score: 2-0)
Lauri Dosunmu drives, Gary Brogdon stays with him. Lauri Dosunmu attempts a Dunk. Contested by Gary Brogdon (4.0 feet, ZONE). LAURI DOSUNMU MAKES IT! Assist: Draymond Simons
Score: 4-0

[10:50] Team_090 possession (Score: 4-0)
Zach Wall commits a violation (traveling/carry)! TURNOVER! (dead ball)

[10:38] Team_080 possession (Score: 4-0)
Lauri Dosunmu attempts a Layup. Contested by Gary Brogdon (4.4 feet, ZONE). Lauri Dosunmu misses. Rebound secured by Tracy Adebayo.

[10:26] Team_090 possession (Score: 4-0)
FOUL! Shooting foul on Jaren Morant. Gary Brogdon to the line for 3 free throws. [Team fouls: 1] (Jaren Morant: 1 personal fouls)   FT 1/3: GOOD   FT 2/3: GOOD   FT 3/3: GOOD Gary Brogdon makes 3/3 from the line.
Score: 4-3

[10:13] Team_080 possession (Score: 4-3)
Draymond Simons drives and kicks out. Draymond Simons attempts a Midrange. Contested by Tracy Adebayo (4.8 feet, ZONE). DRAYMOND SIMONS MAKES IT! Assist: Jaren Morant
Score: 6-3

[10:01] Team_090 possession (Score: 6-3)
FOUL! Shooting foul on Draymond Simons. Gary Brogdon to the line for 2 free throws. [Team fouls: 2] (Draymond Simons: 1 personal fouls)   FT 1/2: GOOD   FT 2/2: MISS Gary Brogdon makes 1/2 from the line. Rebound secured by Draymond Simons.
Score: 6-4

[09:44] Team_080 possession (Score: 6-4)
Jaren Morant attempts a 3Pt. Contested by Gary Brogdon (4.4 feet, MAN). Jaren Morant misses. Rebound secured by Zach Wall.

[09:27] Team_090 possession (Score: 6-4)
Zach Wall attempts a 3Pt. Heavily contested by Larry Paul (0.6 feet, MAN)! Zach Wall misses. Rebound secured by Jaren Morant.

[09:13] Team_080 possession (Score: 6-4)
Jaren Morant attempts a Layup. Contested by Gary Brogdon (4.4 feet, MAN). JAREN MORANT MAKES IT!
Score: 8-4

[08:54] Team_090 possession (Score: 8-4)
Larry Bridges attempts a 3Pt. Contested by Lauri Dosunmu (4.1 feet, ZONE). Larry Bridges misses. Rebound secured by Larry Paul.

[08:41] Team_080 possession (Score: 8-4)
Larry Paul attempts a 3Pt. Contested by Derrick Mitchell (2.6 feet, ZONE). Larry Paul misses. Offensive rebound by Draymond Simons! Draymond Simons's putback is no good. Rebound secured by Gary Brogdon.

[08:24] Team_090 possession (Score: 8-4)
Gary Brogdon drives to the basket... Gary Brogdon throws a bad pass! Stolen by Draymond Simons! TURNOVER! (live ball)

[08:12] Team_080 possession (Score: 8-4)
Draymond Simons attempts a Midrange. Contested by Larry Bridges (5.1 feet, ZONE). Draymond Simons misses. Rebound secured by Zach Wall.

[07:59] Team_090 possession (Score: 8-4)
Derrick Mitchell attempts a 3Pt. Contested by Lauri Dosunmu (2.0 feet, MAN). Derrick Mitchell misses. Offensive rebound by Tracy Adebayo! Tracy Adebayo kicks it out.

[07:40] Team_090 possession (Score: 8-4)
FOUL! Shooting foul on Larry Paul. Zach Wall to the line for 2 free throws. [Team fouls: 3] (Larry Paul: 1 personal fouls)   FT 1/2: GOOD   FT 2/2: GOOD Zach Wall makes 2/2 from the line.
Score: 8-6

[07:29] Team_080 possession (Score: 8-6)
Jaren Morant makes the Midrange and draws the foul on Gary Brogdon! And-1! Jaren Morant to the line for 1. [Team fouls: 1] (Gary Brogdon: 1 personal fouls)   FT 1/1: GOOD Jaren Morant makes 1/1 from the line.
Score: 11-6

[07:15] Team_090 possession (Score: 11-6)
FOUL! Shooting foul on Draymond Simons. Larry Bridges to the line for 2 free throws. [Team fouls: 4] (Draymond Simons: 2 personal fouls)   FT 1/2: GOOD   FT 2/2: GOOD Larry Bridges makes 2/2 from the line.
Score: 11-8

[07:01] Team_080 possession (Score: 11-8)
Lauri Dosunmu attempts a 3Pt. Contested by Derrick Mitchell (4.1 feet, ZONE). LAURI DOSUNMU MAKES IT! Assist: Draymond Simons
Score: 14-8

[06:47] Team_090 possession (Score: 14-8)
FOUL! Shooting foul on Lauri Dosunmu. Larry Bridges to the line for 3 free throws. [BONUS: 5 team fouls] (Lauri Dosunmu: 1 personal fouls)   FT 1/3: GOOD   FT 2/3: GOOD   FT 3/3: GOOD Larry Bridges makes 3/3 from the line.
Score: 14-11

[06:29] Team_080 possession (Score: 14-11)
Lauri Dosunmu attempts a 3Pt. Contested by Derrick Mitchell (5.3 feet, MAN). Lauri Dosunmu misses. Rebound secured by Tracy Adebayo.

[06:13] Team_090 possession (Score: 14-11)
Derrick Mitchell attempts a Layup. BLOCKED BY LAURI DOSUNMU! Ball is loose! Rebound secured by Larry Paul.

[06:02] Team_080 possession (Score: 14-11)
Jaren Morant attempts a Layup. Contested by Gary Brogdon (3.0 feet, ZONE). JAREN MORANT MAKES IT! Assist: Lauri Dosunmu
Score: 16-11

[05:47] Team_090 possession (Score: 16-11)
Gary Brogdon drives and kicks out. Larry Bridges attempts a 3Pt. Contested by Khris Turner (5.5 feet, MAN). Larry Bridges misses. Offensive rebound by Tracy Adebayo! Tracy Adebayo kicks it out.

[05:29] Team_090 possession (Score: 16-11)
Gary Brogdon attempts a Midrange. Wide open! Jaren Morant is 8.1 feet away. [ZONE] GARY BROGDON MAKES IT! Assist: Tracy Adebayo
Score: 16-13

[05:14] Team_080 possession (Score: 16-13)
Larry Paul drives to the basket... Larry Paul loses control! Ball rolls out of bounds! TURNOVER! (dead ball)

[05:03] Team_090 possession (Score: 16-13)
Larry Bridges attempts a Midrange. Contested by Khris Turner (4.9 feet, MAN). LARRY BRIDGES MAKES IT!
Score: 16-15

[04:49] Team_080 possession (Score: 16-15)
Lauri Dosunmu attempts a Layup. Contested by Gary Brogdon (3.3 feet, ZONE). Lauri Dosunmu misses. Offensive rebound by Jaren Morant! Jaren Morant kicks it out.

[04:34] Team_080 possession (Score: 16-15)
FOUL! Shooting foul on Derrick Mitchell. Draymond Simons to the line for 3 free throws. [Team fouls: 2] (Derrick Mitchell: 1 personal fouls)   FT 1/3: GOOD   FT 2/3: GOOD   FT 3/3: GOOD Draymond Simons makes 3/3 from the line.
Score: 19-15

[04:19] Team_090 possession (Score: 19-15)
Zach Wall drives and kicks out. Zach Wall attempts a Midrange. Contested by Larry Paul (4.8 feet, MAN). Zach Wall misses. Offensive rebound by Zach Wall! Zach Wall kicks it out.

[04:04] Team_090 possession (Score: 19-15)
Gary Brogdon attempts a 3Pt. Contested by Jaren Morant (3.3 feet, MAN). Gary Brogdon misses. Rebound secured by Jaren Morant.

[03:46] Team_080 possession (Score: 19-15)
Khris Turner attempts a 3Pt. Wide open! Larry Bridges is 7.1 feet away. [MAN] Khris Turner misses. Rebound secured by Tracy Adebayo.

[03:33] Team_090 possession (Score: 19-15)
Larry Bridges drives and kicks out. Derrick Mitchell attempts a Midrange. Contested by Khris Turner (4.3 feet, ZONE). Derrick Mitchell misses. Rebound secured by Draymond Simons.

[03:19] Team_080 possession (Score: 19-15)
Khris Turner drives, picks up Gary Brogdon. Help arrives from Larry Bridges! Khris Turner attempts a Layup. Contested by Larry Bridges (4.6 feet, ZONE). Khris Turner misses. Rebound secured by Tracy Adebayo.

[03:04] Team_090 possession (Score: 19-15)
Larry Bridges attempts a Layup. Contested by Khris Turner (2.6 feet, MAN). LARRY BRIDGES MAKES IT! Assist: Derrick Mitchell
Score: 19-17

[02:51] Team_080 possession (Score: 19-17)
Lauri Dosunmu drives, Derrick Mitchell stays with him. Lauri Dosunmu attempts a Layup. Contested by Derrick Mitchell (2.8 feet, MAN). LAURI DOSUNMU MAKES IT! Assist: Larry Paul
Score: 21-17

[02:36] Team_090 possession (Score: 21-17)
Gary Brogdon loses control! Ball rolls out of bounds! TURNOVER! (dead ball)

[02:36] Substitution (Team_080): Lauri Dosunmu OUT → Tony James IN (stamina_rule2)

[02:36] Substitution (Team_080): Jaren Morant OUT → Ja Cunningham IN (stamina_rule2)

[02:36] Substitution (Team_080): Draymond Simons OUT → Trae Brogdon IN (stamina_rule2)

[02:36] Substitution (Team_090): Gary Brogdon OUT → Derrick Nowitzki IN (stamina_rule2)

[02:36] Substitution (Team_090): Tracy Adebayo OUT → Tobias Tatum IN (stamina_rule2)

[02:20] Team_080 possession (Score: 21-17)
Trae Brogdon attempts a 3Pt. Heavily contested by Tobias Tatum (1.8 feet, MAN)! Trae Brogdon misses. FOUL! Loose ball foul on Tobias Tatum during the rebound battle. [Team fouls: 3] No free throws, side out. (Tobias Tatum: 1 personal fouls)

[02:04] Team_080 possession (Score: 21-17)
Tony James makes the Dunk and draws the foul on Zach Wall! And-1! Tony James to the line for 1. [Team fouls: 4] (Zach Wall: 1 personal fouls)   FT 1/1: MISS Tony James makes 0/1 from the line. Rebound secured by Tobias Tatum.
Score: 23-17

[01:50] Team_090 possession (Score: 23-17)
Tobias Tatum drives and kicks out. Larry Bridges attempts a 3Pt. Wide open! Khris Turner is 7.1 feet away. [MAN] Larry Bridges misses. Rebound secured by Trae Brogdon.

[01:31] Team_080 possession (Score: 23-17)
Trae Brogdon drives to the basket... Trae Brogdon loses control! Ball rolls out of bounds! TURNOVER! (dead ball)

[01:31] Substitution (Team_080): Khris Turner OUT → Larry Reaves IN (stamina_rule2)

[01:31] Substitution (Team_090): Derrick Mitchell OUT → OG Anunoby IN (stamina_rule2)

[01:31] Substitution (Team_090): Larry Bridges OUT → Josh Wall IN (stamina_rule2)

[01:31] Substitution (Team_090): Zach Wall OUT → Russell Smith IN (stamina_rule2)

[01:21] Team_090 possession (Score: 23-17)
FOUL! Holding foul on Larry Paul. [IN THE BONUS! 6 team fouls] Russell Smith to the line for 2 free throws. (Larry Paul: 2 personal fouls)   FT 1/2: GOOD   FT 2/2: GOOD Russell Smith makes 2/2 from the line.
Score: 23-19

[01:02] Team_080 possession (Score: 23-19)
Trae Brogdon attempts a 3Pt. Contested by Russell Smith (3.4 feet, ZONE). Trae Brogdon misses. Rebound secured by Russell Smith.

[00:49] Team_090 possession (Score: 23-19)
Josh Wall attempts a 3Pt. Wide open! Tony James is 7.5 feet away. [ZONE] JOSH WALL MAKES IT! Assist: Tobias Tatum
Score: 23-22

[00:33] Team_080 possession (Score: 23-22)
Larry Reaves drives, Josh Wall stays with him. Larry Reaves attempts a Dunk. Contested by Josh Wall (3.2 feet, MAN). LARRY REAVES MAKES IT!
Score: 25-22

[00:19] Team_090 possession (Score: 25-22)
Russell Smith attempts a Layup. Contested by Larry Paul (2.9 feet, MAN). RUSSELL SMITH MAKES IT! Assist: Josh Wall
Score: 25-24

[00:04] Team_080 possession (Score: 25-24)
Tony James drives, OG Anunoby stays with him. Tony James attempts a Layup. Contested by OG Anunoby (4.8 feet, MAN). TONY JAMES MAKES IT! Assist: Ja Cunningham
Score: 27-24

================================================================================
                              1ST QUARTER COMPLETE                              
================================================================================

1ST QUARTER SCORE: Team_080 27, Team_090 24

BOX SCORE:
================================================================================

Team_080
--------------------------------------------------------------------------------
Player                MIN  PTS  REB  AST  TO      FG   FG%      3P   3P%
--------------------------------------------------------------------------------
Lauri Dosunmu          10    7    0    2   0   3/5    60.0     0/0   0.0
Jaren Morant           10    7    4    1   0   3/4    75.0     0/0   0.0
Draymond Simons        10    5    3    2   0   2/3    66.7     0/0   0.0
Khris Turner           11    2    0    0   0   1/4    25.0     0/0   0.0
Tony James              2    2    0    0   0   1/2    50.0     0/0   0.0
Larry Reaves            2    2    0    0   0   1/1   100.0     0/0   0.0
Larry Paul             12    0    3    1   0   0/1     0.0     0/0   0.0
Trae Brogdon            2    0    1    0   0   0/1     0.0     0/0   0.0
Ja Cunningham           2    0    0    1   0   0/0     0.0     0/0   0.0

TEAM: FG: 11/21 (52.4%), 3PT: 2/8 (25.0%), REB: 12 (3 off, 9 def), AST: 7, TO: 2
TEAM FOULS: 6 [Team_090 in BONUS]


Team_090
--------------------------------------------------------------------------------
Player                MIN  PTS  REB  AST  TO      FG   FG%      3P   3P%
--------------------------------------------------------------------------------
Larry Bridges          11    9    0    0   0   4/6    66.7     0/0   0.0
Gary Brogdon           10    5    2    0   0   2/5    40.0     0/0   0.0
Russell Smith           2    4    1    0   0   2/2   100.0     0/0   0.0
Josh Wall               2    3    0    1   0   1/1   100.0     0/0   0.0
Zach Wall              11    2    3    0   0   1/3    33.3     0/0   0.0
Tracy Adebayo          10    0    6    1   0   0/0     0.0     0/0   0.0
Derrick Mitchell       11    0    0    1   0   0/1     0.0     0/0   0.0
Tobias Tatum            2    0    1    1   0   0/1     0.0     0/0   0.0

TEAM: FG: 10/19 (52.6%), 3PT: 3/8 (37.5%), REB: 12 (3 off, 9 def), AST: 4, TO: 3
TEAM FOULS: 4

================================================================================

================================================================================
                       2ND QUARTER - Team_080 vs Team_090                       
================================================================================

[12:00] Team_080 possession (Score: 27-24)
Lauri Dosunmu attempts a Layup. Contested by Gary Brogdon (4.5 feet, ZONE). LAURI DOSUNMU MAKES IT! Assist: Draymond Simons
Score: 29-24

[11:44] Team_090 possession (Score: 29-24)
FOUL! Shooting foul on Lauri Dosunmu. Derrick Mitchell to the line for 3 free throws. [Team fouls: 1] (Lauri Dosunmu: 1 personal fouls)   FT 1/3: GOOD   FT 2/3: GOOD   FT 3/3: GOOD Derrick Mitchell makes 3/3 from the line.
Score: 29-27

[11:28] Team_080 possession (Score: 29-27)
Lauri Dosunmu drives, picks up Derrick Mitchell. Help arrives from Zach Wall! Lauri Dosunmu attempts a Dunk. Contested by Zach Wall (4.3 feet, MAN). Lauri Dosunmu misses. Rebound secured by Gary Brogdon.

[11:14] Team_090 possession (Score: 29-27)
Zach Wall attempts a Midrange. Contested by Larry Paul (4.4 feet, MAN). ZACH WALL MAKES IT!
Score: 29-29

[11:01] Team_080 possession (Score: 29-29)
Larry Paul attempts a 3Pt. Contested by Zach Wall (4.8 feet, MAN). Larry Paul misses. Offensive rebound by Draymond Simons! Draymond Simons's putback is no good. Rebound secured by Gary Brogdon.

[10:47] Team_090 possession (Score: 29-29)
Derrick Mitchell attempts a 3Pt. Contested by Lauri Dosunmu (4.4 feet, ZONE). Derrick Mitchell misses. Rebound secured by Draymond Simons.

[10:31] Team_080 possession (Score: 29-29)
Khris Turner attempts a 3Pt. Contested by Derrick Mitchell (5.1 feet, ZONE). KHRIS TURNER MAKES IT! Assist: Draymond Simons
Score: 32-29

[10:20] Team_090 possession (Score: 32-29)
Gary Brogdon attempts a 3Pt. Heavily contested by Jaren Morant (1.8 feet, MAN)! Gary Brogdon misses. Rebound secured by Draymond Simons.

[10:09] Team_080 possession (Score: 32-29)
Draymond Simons drives, picks up Tracy Adebayo. Help arrives from Larry Bridges! Draymond Simons attempts a Layup. Contested by Larry Bridges (4.5 feet, ZONE). DRAYMOND SIMONS MAKES IT!
Score: 34-29

[09:59] Team_090 possession (Score: 34-29)
Gary Brogdon attempts a 3Pt. Contested by Lauri Dosunmu (5.6 feet, ZONE). Gary Brogdon misses. Rebound secured by Draymond Simons.

[09:41] Team_080 possession (Score: 34-29)
FOUL! Shooting foul on Gary Brogdon. Draymond Simons to the line for 2 free throws. [Team fouls: 1] (Gary Brogdon: 1 personal fouls)   FT 1/2: MISS   FT 2/2: GOOD Draymond Simons makes 1/2 from the line.
Score: 35-29

[09:28] Team_090 possession (Score: 35-29)
Derrick Mitchell attempts a Layup. BLOCKED BY LAURI DOSUNMU! Ball is loose! Rebound secured by Draymond Simons.

[09:12] Team_080 possession (Score: 35-29)
Draymond Simons drives and kicks out. Jaren Morant attempts a Midrange. Contested by Larry Bridges (5.2 feet, ZONE). Jaren Morant misses. Rebound secured by Zach Wall.

[08:55] Team_090 possession (Score: 35-29)
FOUL! Shooting foul on Jaren Morant. Gary Brogdon to the line for 2 free throws. [Team fouls: 2] (Jaren Morant: 1 personal fouls)   FT 1/2: GOOD   FT 2/2: GOOD Gary Brogdon makes 2/2 from the line.
Score: 35-31

[08:36] Team_080 possession (Score: 35-31)
Draymond Simons attempts a Dunk. BLOCKED BY TRACY ADEBAYO! Ball is loose! Rebound secured by Tracy Adebayo.

[08:24] Team_090 possession (Score: 35-31)
Larry Bridges attempts a 3Pt. Wide open! Khris Turner is 9.6 feet away. [MAN] LARRY BRIDGES MAKES IT! Assist: Derrick Mitchell
Score: 35-34

[08:09] Team_080 possession (Score: 35-34)
FOUL! Reach-in foul on Gary Brogdon during the drive. [Team fouls: 2] No free throws, side out. (Gary Brogdon: 2 personal fouls)

[07:53] Team_080 possession (Score: 35-34)
FOUL! Holding foul on Derrick Mitchell. [Team fouls: 3] No free throws, side out. (Derrick Mitchell: 1 personal fouls)

[07:38] Team_080 possession (Score: 35-34)
Draymond Simons throws a bad pass! Stolen by Tracy Adebayo! TURNOVER! (live ball)

[07:22] Team_090 possession (Score: 35-34)
FOUL! Holding foul on Larry Paul. [Team fouls: 3] No free throws, side out. (Larry Paul: 1 personal fouls)

[07:09] Team_090 possession (Score: 35-34)
Larry Bridges attempts a Midrange. Contested by Khris Turner (4.0 feet, MAN). Larry Bridges misses. Offensive rebound by Zach Wall! Zach Wall kicks it out.

[06:57] Team_090 possession (Score: 35-34)
Zach Wall drives, Larry Paul stays with him. Zach Wall attempts a Dunk. Heavily contested by Larry Paul (0.5 feet, MAN)! Zach Wall misses. Rebound secured by Draymond Simons.

[06:44] Team_080 possession (Score: 35-34)
Jaren Morant drives, Gary Brogdon stays with him. Jaren Morant attempts a Dunk. Contested by Gary Brogdon (5.8 feet, MAN). Jaren Morant misses. FOUL! Loose ball foul on Tracy Adebayo during the rebound battle. [Team fouls: 4] No free throws, side out. (Tracy Adebayo: 1 personal fouls)

[06:30] Team_080 possession (Score: 35-34)
Khris Turner attempts a 3Pt. Contested by Derrick Mitchell (3.9 feet, ZONE). Khris Turner misses. Offensive rebound by Draymond Simons! Draymond Simons's putback is no good. Rebound secured by Tracy Adebayo.

[06:14] Team_090 possession (Score: 35-34)
Tracy Adebayo throws a bad pass! Stolen by Draymond Simons! TURNOVER! (live ball)

[05:55] Team_080 possession (Score: 35-34)
Draymond Simons attempts a 3Pt. Contested by Derrick Mitchell (5.7 feet, ZONE). DRAYMOND SIMONS MAKES IT! Assist: Lauri Dosunmu
Score: 38-34

[05:39] Team_090 possession (Score: 38-34)
Larry Bridges makes the Layup and draws the foul on Draymond Simons! And-1! Larry Bridges to the line for 1. [Team fouls: 4] (Draymond Simons: 1 personal fouls)   FT 1/1: GOOD Larry Bridges makes 1/1 from the line.
Score: 38-37

[05:25] Team_080 possession (Score: 38-37)
Lauri Dosunmu attempts a 3Pt. Wide open! Derrick Mitchell is 6.7 feet away. [ZONE] LAURI DOSUNMU MAKES IT! Assist: Larry Paul
Score: 41-37

[05:15] Team_090 possession (Score: 41-37)
Larry Bridges commits a violation (traveling/carry)! TURNOVER! (dead ball)

[05:15] Substitution (Team_080): Lauri Dosunmu OUT → Tony James IN (stamina_rule2)

[05:15] Substitution (Team_080): Khris Turner OUT → Larry Reaves IN (stamina_rule2)

[05:15] Substitution (Team_080): Larry Paul OUT → Joel Bryant IN (stamina_rule2)

[05:15] Substitution (Team_080): Jaren Morant OUT → Ja Cunningham IN (stamina_rule2)

[05:15] Substitution (Team_080): Draymond Simons OUT → Trae Brogdon IN (stamina_rule2)

[05:15] Substitution (Team_090): Derrick Mitchell OUT → OG Anunoby IN (stamina_rule2)

[05:15] Substitution (Team_090): Larry Bridges OUT → Josh Wall IN (stamina_rule2)

[05:15] Substitution (Team_090): Zach Wall OUT → Russell Smith IN (stamina_rule2)

[05:15] Substitution (Team_090): Gary Brogdon OUT → Derrick Nowitzki IN (stamina_rule2)

[05:15] Substitution (Team_090): Tracy Adebayo OUT → Tobias Tatum IN (stamina_rule2)

[05:02] Team_080 possession (Score: 41-37)
Joel Bryant attempts a Layup. BLOCKED BY RUSSELL SMITH! Ball is loose! Offensive rebound by Larry Reaves! Larry Reaves kicks it out.

[04:48] Team_080 possession (Score: 41-37)
Larry Reaves drives to the basket... Larry Reaves throws a bad pass out of bounds! TURNOVER! (dead ball)

[04:35] Team_090 possession (Score: 41-37)
Russell Smith attempts a 3Pt. Contested by Joel Bryant (3.6 feet, ZONE). Russell Smith misses. Rebound secured by Ja Cunningham.

[04:23] Team_080 possession (Score: 41-37)
Joel Bryant attempts a 3Pt. Wide open! Derrick Nowitzki is 6.3 feet away. [ZONE] Joel Bryant misses. Rebound secured by Derrick Nowitzki.

[04:10] Team_090 possession (Score: 41-37)
Josh Wall attempts a 3Pt. Contested by Joel Bryant (3.7 feet, ZONE). Josh Wall misses. Rebound secured by Ja Cunningham.

[03:57] Team_080 possession (Score: 41-37)
Ja Cunningham attempts a 3Pt. Contested by Derrick Nowitzki (3.6 feet, ZONE). JA CUNNINGHAM MAKES IT!
Score: 44-37

[03:39] Team_090 possession (Score: 44-37)
Josh Wall attempts a 3Pt. Wide open! Larry Reaves is 7.6 feet away. [MAN] Josh Wall misses. Rebound secured by Ja Cunningham.

[03:24] Team_080 possession (Score: 44-37)
Tony James drives and kicks out. Joel Bryant attempts a 3Pt. Contested by Russell Smith (3.2 feet, MAN). Joel Bryant misses. Rebound secured by Russell Smith.

[03:06] Team_090 possession (Score: 44-37)
Russell Smith attempts a 3Pt. Contested by Joel Bryant (4.4 feet, ZONE). RUSSELL SMITH MAKES IT! Assist: OG Anunoby
Score: 44-40

[02:52] Team_080 possession (Score: 44-40)
Ja Cunningham attempts a 3Pt. Contested by Derrick Nowitzki (5.2 feet, MAN). Ja Cunningham misses. Offensive rebound by Ja Cunningham! Ja Cunningham kicks it out.

[02:39] Team_080 possession (Score: 44-40)
Tony James drives, Derrick Nowitzki stays with him. Tony James attempts a Layup. Heavily contested by Derrick Nowitzki (1.3 feet, ZONE)! Tony James misses. Rebound secured by Russell Smith.

[02:21] Team_090 possession (Score: 44-40)
Josh Wall attempts a 3Pt. Contested by Larry Reaves (5.5 feet, MAN). JOSH WALL MAKES IT!
Score: 44-43

[02:10] Team_080 possession (Score: 44-43)
FOUL! Offensive foul on Larry Reaves! Josh Wall drew the charge! [Team fouls: 5] (Larry Reaves: 1 personal fouls) TURNOVER! (dead ball)

[01:55] Team_090 possession (Score: 44-43)
Josh Wall attempts a Layup. Wide open! Larry Reaves is 6.4 feet away. [MAN] Josh Wall misses. Rebound secured by Ja Cunningham.

[01:39] Team_080 possession (Score: 44-43)
FOUL! Offensive foul on Joel Bryant! Russell Smith drew the charge! [Team fouls: 6] (Joel Bryant: 1 personal fouls) TURNOVER! (dead ball)

[01:21] Team_090 possession (Score: 44-43)
FOUL! Shooting foul on Ja Cunningham. Josh Wall to the line for 2 free throws. [BONUS: 7 team fouls] (Ja Cunningham: 1 personal fouls)   FT 1/2: MISS   FT 2/2: GOOD Josh Wall makes 1/2 from the line.
Score: 44-44

[01:08] Team_080 possession (Score: 44-44)
FOUL! Reach-in foul on Derrick Nowitzki during the drive. [IN THE BONUS! 5 team fouls] Ja Cunningham to the line for 2 free throws. (Derrick Nowitzki: 1 personal fouls)   FT 1/2: GOOD   FT 2/2: GOOD Ja Cunningham makes 2/2 from the line.
Score: 46-44

[00:55] Team_090 possession (Score: 46-44)
Josh Wall drives to the basket... Josh Wall throws a bad pass out of bounds! TURNOVER! (dead ball)

[00:41] Team_080 possession (Score: 46-44)
Joel Bryant drives, picks up Derrick Nowitzki. Help arrives from Josh Wall! Joel Bryant attempts a Layup. Contested by Josh Wall (2.8 feet, ZONE). Joel Bryant misses. Offensive rebound by Ja Cunningham! Ja Cunningham kicks it out.

[00:26] Team_080 possession (Score: 46-44)
FOUL! Shooting foul on Josh Wall. Larry Reaves to the line for 2 free throws. [BONUS: 6 team fouls] (Josh Wall: 1 personal fouls)   FT 1/2: MISS   FT 2/2: GOOD Larry Reaves makes 1/2 from the line.
Score: 47-44

[00:14] Team_090 possession (Score: 47-44)
FOUL! Shooting foul on Larry Reaves. Derrick Nowitzki to the line for 2 free throws. [BONUS: 8 team fouls] (Larry Reaves: 2 personal fouls)   FT 1/2: MISS   FT 2/2: GOOD Derrick Nowitzki makes 1/2 from the line.
Score: 47-45

================================================================================
                              2ND QUARTER COMPLETE                              
================================================================================

2ND QUARTER SCORE: Team_080 20, Team_090 21

BOX SCORE:
================================================================================

Team_080
--------------------------------------------------------------------------------
Player                MIN  PTS  REB  AST  TO      FG   FG%      3P   3P%
--------------------------------------------------------------------------------
Draymond Simons        17    6    5    2   0   3/5    60.0     0/0   0.0
Lauri Dosunmu          17    5    0    1   0   2/3    66.7     0/0   0.0
Ja Cunningham           8    5    6    0   0   2/2   100.0     0/0   0.0
Khris Turner           18    3    0    0   0   1/2    50.0     0/0   0.0
Larry Reaves            7    1    1    0   0   1/1   100.0     0/0   0.0
Larry Paul             19    0    0    1   0   0/1     0.0     0/0   0.0
Tracy Adebayo          17    0    2    0   0   0/0     0.0     0/0   0.0
Jaren Morant           17    0    1    0   0   0/0     0.0     0/0   0.0
Joel Bryant             5    0    0    0   0   0/1     0.0     0/0   0.0
Tony James              8    0    0    0   0   0/2     0.0     0/0   0.0

TEAM: FG: 9/17 (52.9%), 3PT: 4/7 (57.1%), REB: 15 (6 off, 9 def), AST: 4, TO: 4
TEAM FOULS: 8 [Team_090 in BONUS]


Team_090
--------------------------------------------------------------------------------
Player                MIN  PTS  REB  AST  TO      FG   FG%      3P   3P%
--------------------------------------------------------------------------------
Larry Bridges          18    6    0    0   0   2/2   100.0     0/0   0.0
Josh Wall               7    4    0    0   0   2/5    40.0     0/0   0.0
Derrick Mitchell       18    3    0    1   0   1/3    33.3     0/0   0.0
Russell Smith           7    3    2    0   0   1/2    50.0     0/0   0.0
Gary Brogdon           17    2    2    0   0   1/3    33.3     0/0   0.0
Zach Wall              18    2    2    0   0   1/2    50.0     0/0   0.0
Derrick Nowitzki        8    1    1    0   0   1/1   100.0     0/0   0.0
OG Anunoby              7    0    0    1   0   0/0     0.0     0/0   0.0

TEAM: FG: 9/18 (50.0%), 3PT: 4/10 (40.0%), REB: 7 (1 off, 6 def), AST: 2, TO: 3
TEAM FOULS: 6 [Team_080 in BONUS]

================================================================================

================================================================================
                       3RD QUARTER - Team_080 vs Team_090                       
================================================================================

[12:00] Team_080 possession (Score: 47-45)
Lauri Dosunmu attempts a Midrange. Contested by Gary Brogdon (5.4 feet, ZONE). LAURI DOSUNMU MAKES IT! Assist: Jaren Morant
Score: 49-45

[11:45] Team_090 possession (Score: 49-45)
Larry Bridges attempts a Midrange. Wide open! Larry Paul is 7.4 feet away. [ZONE] Larry Bridges misses. Rebound secured by Draymond Simons.

[11:32] Team_080 possession (Score: 49-45)
FOUL! Offensive foul on Larry Paul! Zach Wall drew the charge! [Team fouls: 1] (Larry Paul: 1 personal fouls) TURNOVER! (dead ball)

[11:18] Team_090 possession (Score: 49-45)
Derrick Mitchell attempts a 3Pt. Wide open! Lauri Dosunmu is 6.7 feet away. [ZONE] Derrick Mitchell misses. Rebound secured by Larry Paul.

[11:08] Team_080 possession (Score: 49-45)
Lauri Dosunmu attempts a Midrange. Wide open! Larry Bridges is 6.1 feet away. [ZONE] Lauri Dosunmu misses. Rebound secured by Gary Brogdon.

[10:56] Team_090 possession (Score: 49-45)
Zach Wall attempts a 3Pt. Contested by Lauri Dosunmu (4.1 feet, ZONE). Zach Wall misses. Offensive rebound by Gary Brogdon! Gary Brogdon kicks it out.

[10:40] Team_090 possession (Score: 49-45)
Derrick Mitchell throws a bad pass! Stolen by Lauri Dosunmu! TURNOVER! (live ball)

[10:30] Team_080 possession (Score: 49-45)
Larry Paul attempts a 3Pt. Contested by Derrick Mitchell (2.7 feet, ZONE). Larry Paul misses. Rebound secured by Zach Wall.

[10:18] Team_090 possession (Score: 49-45)
Derrick Mitchell attempts a Midrange. Wide open! Lauri Dosunmu is 7.2 feet away. [MAN] Derrick Mitchell misses. FOUL! Loose ball foul on Larry Paul during the rebound battle. [Team fouls: 2] No free throws, side out. (Larry Paul: 2 personal fouls)

[10:01] Team_090 possession (Score: 49-45)
Derrick Mitchell attempts a 3Pt. Contested by Lauri Dosunmu (5.2 feet, ZONE). Derrick Mitchell misses. Rebound secured by Draymond Simons.

[09:46] Team_080 possession (Score: 49-45)
FOUL! Offensive foul on Jaren Morant! Gary Brogdon drew the charge! [Team fouls: 3] (Jaren Morant: 1 personal fouls) TURNOVER! (dead ball)

[09:31] Team_090 possession (Score: 49-45)
Tracy Adebayo attempts a Midrange. Contested by Jaren Morant (3.6 feet, ZONE). TRACY ADEBAYO MAKES IT!
Score: 49-47

[09:17] Team_080 possession (Score: 49-47)
Larry Paul attempts a 3Pt. Wide open! Zach Wall is 6.6 feet away. [MAN] Larry Paul misses. Rebound secured by Zach Wall.

[09:04] Team_090 possession (Score: 49-47)
Larry Bridges drives, picks up Draymond Simons. Help arrives from Khris Turner! Larry Bridges attempts a Layup. Contested by Khris Turner (2.7 feet, ZONE). LARRY BRIDGES MAKES IT! Assist: Zach Wall
Score: 49-49

[08:53] Team_080 possession (Score: 49-49)
FOUL! Offensive foul on Larry Paul! Zach Wall drew the charge! [Team fouls: 4] (Larry Paul: 3 personal fouls) TURNOVER! (dead ball)

[08:35] Team_090 possession (Score: 49-49)
Tracy Adebayo attempts a Midrange. Contested by Lauri Dosunmu (4.8 feet, ZONE). TRACY ADEBAYO MAKES IT!
Score: 49-51

[08:24] Team_080 possession (Score: 49-51)
Jaren Morant attempts a 3Pt. Heavily contested by Derrick Mitchell (0.7 feet, ZONE)! JAREN MORANT MAKES IT! Assist: Lauri Dosunmu
Score: 52-51

[08:09] Team_090 possession (Score: 52-51)
Zach Wall attempts a 3Pt. Contested by Lauri Dosunmu (5.6 feet, ZONE). Zach Wall misses. Rebound secured by Jaren Morant.

[07:57] Team_080 possession (Score: 52-51)
Lauri Dosunmu drives, picks up Gary Brogdon. Help arrives from Larry Bridges! Lauri Dosunmu attempts a Layup. Wide open! Larry Bridges is 7.0 feet away. [ZONE] LAURI DOSUNMU MAKES IT!
Score: 54-51

[07:45] Team_090 possession (Score: 54-51)
Tracy Adebayo drives to the basket... Tracy Adebayo commits a violation (traveling/carry)! TURNOVER! (dead ball)

[07:28] Team_080 possession (Score: 54-51)
Lauri Dosunmu attempts a 3Pt. Contested by Derrick Mitchell (3.9 feet, MAN). Lauri Dosunmu misses. Rebound secured by Gary Brogdon.

[07:14] Team_090 possession (Score: 54-51)
Tracy Adebayo attempts a Layup. Contested by Draymond Simons (3.8 feet, ZONE). TRACY ADEBAYO MAKES IT! Assist: Larry Bridges
Score: 54-53

[06:58] Team_080 possession (Score: 54-53)
Lauri Dosunmu drives, Derrick Mitchell stays with him. Lauri Dosunmu attempts a Layup. Contested by Derrick Mitchell (2.7 feet, MAN). LAURI DOSUNMU MAKES IT! Assist: Jaren Morant
Score: 56-53

[06:45] Team_090 possession (Score: 56-53)
Zach Wall attempts a Layup. BLOCKED BY DRAYMOND SIMONS! Ball deflects out of bounds off Zach Wall.

[06:31] Team_080 possession (Score: 56-53)
Lauri Dosunmu throws a bad pass out of bounds! TURNOVER! (dead ball)

[06:17] Team_090 possession (Score: 56-53)
Tracy Adebayo drives, picks up Draymond Simons. Help arrives from Khris Turner! Tracy Adebayo attempts a Dunk. Contested by Khris Turner (2.3 feet, MAN). Tracy Adebayo misses. Offensive rebound by Tracy Adebayo! Tracy Adebayo kicks it out.

[06:02] Team_090 possession (Score: 56-53)
Zach Wall attempts a 3Pt. Wide open! Lauri Dosunmu is 6.6 feet away. [ZONE] ZACH WALL MAKES IT! Assist: Larry Bridges
Score: 56-56

[05:46] Team_080 possession (Score: 56-56)
Khris Turner attempts a 3Pt. Contested by Derrick Mitchell (4.8 feet, ZONE). KHRIS TURNER MAKES IT! Assist: Jaren Morant
Score: 59-56

[05:29] Team_090 possession (Score: 59-56)
Zach Wall drives, Larry Paul stays with him. Zach Wall attempts a Dunk. Contested by Larry Paul (3.6 feet, MAN). Zach Wall misses. Rebound secured by Draymond Simons.

[05:18] Team_080 possession (Score: 59-56)
Jaren Morant attempts a Layup. Heavily contested by Gary Brogdon (2.0 feet, MAN)! Jaren Morant misses. Rebound secured by Tracy Adebayo.

[05:03] Team_090 possession (Score: 59-56)
Derrick Mitchell attempts a 3Pt. Wide open! Lauri Dosunmu is 6.1 feet away. [ZONE] DERRICK MITCHELL MAKES IT!
Score: 59-59

[04:50] Team_080 possession (Score: 59-59)
Khris Turner attempts a 3Pt. Heavily contested by Derrick Mitchell (1.6 feet, ZONE)! Khris Turner misses. Rebound secured by Zach Wall.

[04:38] Team_090 possession (Score: 59-59)
Derrick Mitchell makes the Dunk and draws the foul on Lauri Dosunmu! And-1! Derrick Mitchell to the line for 1. [BONUS: 5 team fouls] (Lauri Dosunmu: 1 personal fouls)   FT 1/1: GOOD Derrick Mitchell makes 1/1 from the line.
Score: 59-62

[04:24] Team_080 possession (Score: 59-62)
Larry Paul attempts a Midrange. Wide open! Zach Wall is 6.5 feet away. [MAN] LARRY PAUL MAKES IT! Assist: Lauri Dosunmu
Score: 61-62

[04:08] Team_090 possession (Score: 61-62)
Derrick Mitchell attempts a 3Pt. Contested by Lauri Dosunmu (5.2 feet, ZONE). Derrick Mitchell misses. Rebound secured by Larry Paul.

[03:53] Team_080 possession (Score: 61-62)
Jaren Morant attempts a 3Pt. Contested by Derrick Mitchell (3.2 feet, ZONE). Jaren Morant misses. Rebound secured by Gary Brogdon.

[03:43] Team_090 possession (Score: 61-62)
Gary Brogdon attempts a Layup. Heavily contested by Jaren Morant (0.5 feet, MAN)! Gary Brogdon misses. Rebound secured by Draymond Simons.

[03:30] Team_080 possession (Score: 61-62)
Draymond Simons attempts a 3Pt. Contested by Tracy Adebayo (2.2 feet, MAN). Draymond Simons misses. Rebound secured by Tracy Adebayo.

[03:11] Team_090 possession (Score: 61-62)
Derrick Mitchell throws a bad pass out of bounds! TURNOVER! (dead ball)

[03:11] Substitution (Team_080): Jaren Morant OUT → Ja Cunningham IN (stamina_rule2)

[03:11] Substitution (Team_080): Draymond Simons OUT → Trae Brogdon IN (stamina_rule2)

[03:11] Substitution (Team_090): Gary Brogdon OUT → Derrick Nowitzki IN (stamina_rule2)

[03:11] Substitution (Team_090): Tracy Adebayo OUT → Tobias Tatum IN (stamina_rule2)

[02:56] Team_080 possession (Score: 61-62)
Ja Cunningham attempts a 3Pt. Contested by Derrick Nowitzki (4.6 feet, MAN). JA CUNNINGHAM MAKES IT!
Score: 64-62

[02:42] Team_090 possession (Score: 64-62)
Larry Bridges drives, Khris Turner stays with him. Larry Bridges attempts a Layup. Heavily contested by Khris Turner (2.0 feet, MAN)! LARRY BRIDGES MAKES IT! Assist: Derrick Mitchell
Score: 64-64

[02:26] Team_080 possession (Score: 64-64)
Trae Brogdon drives to the basket... Trae Brogdon loses the ball! Stripped by Derrick Nowitzki! TURNOVER! (live ball)

[02:11] Team_090 possession (Score: 64-64)
Zach Wall makes the Layup and draws the foul on Larry Paul! And-1! Zach Wall to the line for 1. [BONUS: 6 team fouls] (Larry Paul: 4 personal fouls)   FT 1/1: MISS Zach Wall makes 0/1 from the line. Rebound secured by Ja Cunningham.
Score: 64-66

[01:58] Team_080 possession (Score: 64-66)
Lauri Dosunmu attempts a 3Pt. Heavily contested by Zach Wall (0.5 feet, ZONE)! Lauri Dosunmu misses. Offensive rebound by Ja Cunningham! Ja Cunningham kicks it out.

[01:43] Team_080 possession (Score: 64-66)
Khris Turner makes the Dunk and draws the foul on Larry Bridges! And-1! Khris Turner to the line for 1. [Team fouls: 1] (Larry Bridges: 1 personal fouls)   FT 1/1: GOOD Khris Turner makes 1/1 from the line.
Score: 67-66

[01:31] Team_090 possession (Score: 67-66)
FOUL! Reach-in foul on Lauri Dosunmu during the drive. [IN THE BONUS! 7 team fouls] Derrick Mitchell to the line for 2 free throws. (Lauri Dosunmu: 2 personal fouls)   FT 1/2: GOOD   FT 2/2: MISS Derrick Mitchell makes 1/2 from the line. Offensive rebound by Tobias Tatum! Tobias Tatum kicks it out.
Score: 67-67

[01:17] Team_090 possession (Score: 67-67)
Zach Wall attempts a Layup. Contested by Larry Paul (3.8 feet, MAN). ZACH WALL MAKES IT! Assist: Tobias Tatum
Score: 67-69

[01:02] Team_080 possession (Score: 67-69)
Lauri Dosunmu makes the Dunk and draws the foul on Derrick Nowitzki! And-1! Lauri Dosunmu to the line for 1. [Team fouls: 2] (Derrick Nowitzki: 1 personal fouls)   FT 1/1: GOOD Lauri Dosunmu makes 1/1 from the line.
Score: 70-69

[00:49] Team_090 possession (Score: 70-69)
Derrick Mitchell attempts a 3Pt. Contested by Lauri Dosunmu (2.4 feet, ZONE). DERRICK MITCHELL MAKES IT! Assist: Derrick Nowitzki
Score: 70-72

[00:32] Team_080 possession (Score: 70-72)
Ja Cunningham commits a violation (traveling/carry)! TURNOVER! (dead ball)

[00:32] Substitution (Team_080): Lauri Dosunmu OUT → Tony James IN (stamina_rule2)

[00:32] Substitution (Team_080): Khris Turner OUT → Larry Reaves IN (stamina_rule2)

[00:32] Substitution (Team_080): Larry Paul OUT → Joel Bryant IN (stamina_rule2)

[00:32] Substitution (Team_090): Derrick Mitchell OUT → OG Anunoby IN (stamina_rule2)

[00:32] Substitution (Team_090): Larry Bridges OUT → Josh Wall IN (stamina_rule2)

[00:32] Substitution (Team_090): Zach Wall OUT → Russell Smith IN (stamina_rule2)

[00:19] Team_090 possession (Score: 70-72)
OG Anunoby loses the ball! Stripped by Tony James! TURNOVER! (live ball)

[00:04] Team_080 possession (Score: 70-72)
Larry Reaves throws a bad pass out of bounds! TURNOVER! (dead ball)

================================================================================
                              3RD QUARTER COMPLETE                              
================================================================================

3RD QUARTER SCORE: Team_080 23, Team_090 27

BOX SCORE:
================================================================================

Team_080
--------------------------------------------------------------------------------
Player                MIN  PTS  REB  AST  TO      FG   FG%      3P   3P%
--------------------------------------------------------------------------------
Lauri Dosunmu          28    9    0    2   0   4/6    66.7     0/0   0.0
Khris Turner           29    6    0    0   0   2/3    66.7     0/0   0.0
Jaren Morant           26    3    1    3   0   1/3    33.3     0/0   0.0
Ja Cunningham          11    3    2    0   0   1/1   100.0     0/0   0.0
Larry Paul             31    2    2    0   0   1/3    33.3     0/0   0.0
Draymond Simons        26    0    4    0   0   0/1     0.0     0/0   0.0

TEAM: FG: 9/17 (52.9%), 3PT: 3/9 (33.3%), REB: 9 (1 off, 8 def), AST: 5, TO: 7
TEAM FOULS: 7 [Team_090 in BONUS]


Team_090
--------------------------------------------------------------------------------
Player                MIN  PTS  REB  AST  TO      FG   FG%      3P   3P%
--------------------------------------------------------------------------------
Derrick Mitchell       29    9    0    1   0   3/6    50.0     0/0   0.0
Tracy Adebayo          26    6    4    0   0   3/3   100.0     0/0   0.0
Zach Wall              29    5    3    1   0   2/6    33.3     0/0   0.0
Larry Bridges          29    4    0    2   0   2/3    66.7     0/0   0.0
Gary Brogdon           26    0    4    0   0   0/1     0.0     0/0   0.0
Tobias Tatum           11    0    1    1   0   0/0     0.0     0/0   0.0
Derrick Nowitzki       11    0    0    1   0   0/0     0.0     0/0   0.0

TEAM: FG: 10/19 (52.6%), 3PT: 3/7 (42.9%), REB: 12 (4 off, 8 def), AST: 6, TO: 4
TEAM FOULS: 2

================================================================================

================================================================================
                       4TH QUARTER - Team_080 vs Team_090                       
================================================================================

[12:00] Substitution (Team_080): Lauri Dosunmu OUT → Tony James IN (stamina_rule2)

[12:00] Substitution (Team_080): Khris Turner OUT → Larry Reaves IN (stamina_rule2)

[12:00] Team_080 possession (Score: 70-72)
Larry Paul drives to the basket... Larry Paul throws a bad pass out of bounds! TURNOVER! (dead ball)

[11:47] Team_090 possession (Score: 70-72)
FOUL! Offensive foul on Gary Brogdon! Jaren Morant drew the charge! [Team fouls: 1] (Gary Brogdon: 1 personal fouls) TURNOVER! (dead ball)

[11:32] Team_080 possession (Score: 70-72)
Tony James attempts a 3Pt. Contested by Derrick Mitchell (3.4 feet, MAN). TONY JAMES MAKES IT! Assist: Jaren Morant
Score: 73-72

[11:20] Team_090 possession (Score: 73-72)
Tracy Adebayo makes the Layup and draws the foul on Draymond Simons! And-1! Tracy Adebayo to the line for 1. [Team fouls: 1] (Draymond Simons: 1 personal fouls)   FT 1/1: GOOD Tracy Adebayo makes 1/1 from the line.
Score: 73-75

[11:04] Team_080 possession (Score: 73-75)
Jaren Morant attempts a 3Pt. Contested by Gary Brogdon (5.9 feet, MAN). Jaren Morant misses. Rebound secured by Tracy Adebayo.

[10:48] Team_090 possession (Score: 73-75)
FOUL! Shooting foul on Tony James. Derrick Mitchell to the line for 3 free throws. [Team fouls: 2] (Tony James: 1 personal fouls)   FT 1/3: GOOD   FT 2/3: GOOD   FT 3/3: GOOD Derrick Mitchell makes 3/3 from the line.
Score: 73-78

[10:33] Team_080 possession (Score: 73-78)
Larry Paul attempts a Midrange. Contested by Zach Wall (3.1 feet, MAN). LARRY PAUL MAKES IT!
Score: 75-78

[10:20] Team_090 possession (Score: 75-78)
Zach Wall attempts a 3Pt. Contested by Larry Paul (4.8 feet, MAN). ZACH WALL MAKES IT!
Score: 75-81

[10:04] Team_080 possession (Score: 75-81)
Larry Paul attempts a 3Pt. Contested by Derrick Mitchell (4.9 feet, ZONE). Larry Paul misses. Rebound secured by Zach Wall.

[09:51] Team_090 possession (Score: 75-81)
Tracy Adebayo attempts a 3Pt. Contested by Tony James (4.5 feet, ZONE). TRACY ADEBAYO MAKES IT! Assist: Zach Wall
Score: 75-84

[09:37] Team_080 possession (Score: 75-84)
Tony James attempts a Midrange. Heavily contested by Derrick Mitchell (1.3 feet, MAN)! Tony James misses. Rebound secured by Tracy Adebayo.

[09:19] Team_090 possession (Score: 75-84)
Gary Brogdon attempts a 3Pt. Contested by Jaren Morant (4.2 feet, MAN). Gary Brogdon misses. Rebound secured by Jaren Morant.

[09:05] Team_080 possession (Score: 75-84)
Larry Paul attempts a 3Pt. Contested by Zach Wall (5.0 feet, MAN). Larry Paul misses. Offensive rebound by Draymond Simons! Draymond Simons puts it back in!
Score: 77-84

[08:51] Team_090 possession (Score: 77-84)
Gary Brogdon drives, picks up Jaren Morant. Help arrives from Larry Reaves! Gary Brogdon attempts a Layup. Contested by Larry Reaves (4.6 feet, MAN). Gary Brogdon misses. Rebound secured by Draymond Simons.

[08:39] Team_080 possession (Score: 77-84)
Larry Paul attempts a 3Pt. Contested by Derrick Mitchell (5.8 feet, ZONE). LARRY PAUL MAKES IT! Assist: Tony James
Score: 80-84

[08:25] Team_090 possession (Score: 80-84)
FOUL! Shooting foul on Jaren Morant. Tracy Adebayo to the line for 2 free throws. [Team fouls: 3] (Jaren Morant: 1 personal fouls)   FT 1/2: GOOD   FT 2/2: MISS Tracy Adebayo makes 1/2 from the line. Rebound secured by Larry Reaves.
Score: 80-85

[08:14] Team_080 possession (Score: 80-85)
Jaren Morant attempts a Midrange. Wide open! Gary Brogdon is 7.1 feet away. [ZONE] JAREN MORANT MAKES IT!
Score: 82-85

[07:57] Team_090 possession (Score: 82-85)
Tracy Adebayo attempts a Midrange. Contested by Draymond Simons (3.3 feet, MAN). Tracy Adebayo misses. Rebound secured by Jaren Morant.

[07:40] Team_080 possession (Score: 82-85)
Larry Paul attempts a 3Pt. Contested by Zach Wall (4.2 feet, MAN). LARRY PAUL MAKES IT! Assist: Larry Reaves
Score: 85-85

[07:27] Team_090 possession (Score: 85-85)
Tracy Adebayo throws a bad pass out of bounds! TURNOVER! (dead ball)

[07:27] Substitution (Team_080): Larry Paul OUT → Joel Bryant IN (stamina_rule2)

[07:27] Substitution (Team_080): Jaren Morant OUT → Ja Cunningham IN (stamina_rule2)

[07:27] Substitution (Team_080): Draymond Simons OUT → Trae Brogdon IN (stamina_rule2)

[07:27] Substitution (Team_090): Derrick Mitchell OUT → OG Anunoby IN (stamina_rule2)

[07:27] Substitution (Team_090): Larry Bridges OUT → Josh Wall IN (stamina_rule2)

[07:27] Substitution (Team_090): Zach Wall OUT → Russell Smith IN (stamina_rule2)

[07:27] Substitution (Team_090): Gary Brogdon OUT → Derrick Nowitzki IN (stamina_rule2)

[07:27] Substitution (Team_090): Tracy Adebayo OUT → Tobias Tatum IN (stamina_rule2)

[07:13] Team_080 possession (Score: 85-85)
Joel Bryant attempts a Midrange. Wide open! Russell Smith is 7.0 feet away. [MAN] JOEL BRYANT MAKES IT!
Score: 87-85

[06:59] Team_090 possession (Score: 87-85)
Josh Wall attempts a 3Pt. Contested by Larry Reaves (4.1 feet, MAN). Josh Wall misses. Rebound secured by Trae Brogdon.

[06:45] Team_080 possession (Score: 87-85)
Trae Brogdon drives, Derrick Nowitzki stays with him. Trae Brogdon attempts a Dunk. Contested by Derrick Nowitzki (5.7 feet, ZONE). TRAE BROGDON MAKES IT!
Score: 89-85

[06:32] Team_090 possession (Score: 89-85)
Russell Smith attempts a Layup. Contested by Ja Cunningham (3.5 feet, ZONE). RUSSELL SMITH MAKES IT! Assist: Derrick Nowitzki
Score: 89-87

[06:18] Team_080 possession (Score: 89-87)
Larry Reaves drives, Derrick Nowitzki stays with him. Larry Reaves attempts a Dunk. Wide open! Derrick Nowitzki is 6.0 feet away. [ZONE] LARRY REAVES MAKES IT! Assist: Trae Brogdon
Score: 91-87

[06:02] Team_090 possession (Score: 91-87)
FOUL! Offensive foul on Tobias Tatum! Trae Brogdon drew the charge! [Team fouls: 2] (Tobias Tatum: 1 personal fouls) TURNOVER! (dead ball)

[05:52] Team_080 possession (Score: 91-87)
Trae Brogdon attempts a Midrange. Heavily contested by Derrick Nowitzki (1.7 feet, ZONE)! Trae Brogdon misses. Rebound secured by Russell Smith.

[05:34] Team_090 possession (Score: 91-87)
Josh Wall attempts a 3Pt. Contested by Joel Bryant (3.9 feet, ZONE). JOSH WALL MAKES IT! Assist: Tobias Tatum
Score: 91-90

[05:17] Team_080 possession (Score: 91-90)
Larry Reaves attempts a 3Pt. Contested by Josh Wall (4.6 feet, MAN). LARRY REAVES MAKES IT! Assist: Trae Brogdon
Score: 94-90

[05:00] Team_090 possession (Score: 94-90)
FOUL! Shooting foul on Joel Bryant. Russell Smith to the line for 2 free throws. [Team fouls: 4] (Joel Bryant: 1 personal fouls)   FT 1/2: GOOD   FT 2/2: GOOD Russell Smith makes 2/2 from the line.
Score: 94-92

[04:43] Team_080 possession (Score: 94-92)
Trae Brogdon attempts a 3Pt. Contested by Russell Smith (4.9 feet, ZONE). Trae Brogdon misses. Offensive rebound by Ja Cunningham! Ja Cunningham kicks it out.

[04:28] Team_080 possession (Score: 94-92)
Tony James attempts a 3Pt. Wide open! OG Anunoby is 8.2 feet away. [MAN] Tony James misses. Offensive rebound by Larry Reaves! Larry Reaves kicks it out.

[04:14] Team_080 possession (Score: 94-92)
Larry Reaves attempts a 3Pt. Contested by Josh Wall (5.9 feet, MAN). Larry Reaves misses. Rebound secured by Tobias Tatum.

[03:55] Team_090 possession (Score: 94-92)
Tobias Tatum drives, picks up Trae Brogdon. Help arrives from Larry Reaves! Tobias Tatum attempts a Dunk. Contested by Larry Reaves (2.8 feet, MAN). TOBIAS TATUM MAKES IT! Assist: Derrick Nowitzki
Score: 94-94

[03:43] Team_080 possession (Score: 94-94)
Joel Bryant attempts a 3Pt. Wide open! Russell Smith is 7.5 feet away. [MAN] Joel Bryant misses. Rebound secured by Tobias Tatum.

[03:31] Team_090 possession (Score: 94-94)
OG Anunoby attempts a 3Pt. Contested by Joel Bryant (3.8 feet, ZONE). OG Anunoby misses. Offensive rebound by Tobias Tatum! Tobias Tatum kicks it out.

[03:15] Team_090 possession (Score: 94-94)
Russell Smith drives and kicks out. Derrick Nowitzki attempts a Midrange. Contested by Ja Cunningham (2.1 feet, ZONE). DERRICK NOWITZKI MAKES IT! Assist: OG Anunoby
Score: 94-96

[02:56] Team_080 possession (Score: 94-96)
Joel Bryant drives, picks up Derrick Nowitzki. Help arrives from Josh Wall! Joel Bryant attempts a Layup. Wide open! Josh Wall is 6.7 feet away. [ZONE] Joel Bryant misses. Rebound secured by Derrick Nowitzki.

[02:42] Team_090 possession (Score: 94-96)
Tobias Tatum drives and kicks out. Josh Wall attempts a 3Pt. Contested by Joel Bryant (4.6 feet, ZONE). Josh Wall misses. Rebound secured by Ja Cunningham.

[02:28] Team_080 possession (Score: 94-96)
FOUL! Shooting foul on Tobias Tatum. Trae Brogdon to the line for 2 free throws. [Team fouls: 3] (Tobias Tatum: 2 personal fouls)   FT 1/2: GOOD   FT 2/2: GOOD Trae Brogdon makes 2/2 from the line.
Score: 96-96

[02:13] Team_090 possession (Score: 96-96)
Derrick Nowitzki attempts a Midrange. Contested by Joel Bryant (3.6 feet, ZONE). DERRICK NOWITZKI MAKES IT! Assist: Tobias Tatum
Score: 96-98

[01:59] Team_080 possession (Score: 96-98)
Ja Cunningham attempts a 3Pt. Contested by Derrick Nowitzki (4.8 feet, MAN). Ja Cunningham misses. FOUL! Loose ball foul on Derrick Nowitzki during the rebound battle. [Team fouls: 4] No free throws, side out. (Derrick Nowitzki: 1 personal fouls)

[01:48] Team_080 possession (Score: 96-98)
Ja Cunningham drives, picks up Derrick Nowitzki. Help arrives from Josh Wall! Ja Cunningham attempts a Layup. Contested by Josh Wall (2.4 feet, ZONE). Ja Cunningham misses. Rebound secured by Derrick Nowitzki.

[01:34] Team_090 possession (Score: 96-98)
Josh Wall attempts a 3Pt. Wide open! Larry Reaves is 9.6 feet away. [MAN] JOSH WALL MAKES IT! Assist: OG Anunoby
Score: 96-101

[01:22] Team_080 possession (Score: 96-101)
Joel Bryant attempts a 3Pt. Wide open! Russell Smith is 7.2 feet away. [MAN] JOEL BRYANT MAKES IT! Assist: Trae Brogdon
Score: 99-101

[01:08] Team_090 possession (Score: 99-101)
Josh Wall attempts a Midrange. Wide open! Trae Brogdon is 9.2 feet away. [ZONE] Josh Wall misses. Rebound secured by Larry Reaves.

[00:51] Team_080 possession (Score: 99-101)
Tony James attempts a 3Pt. Contested by OG Anunoby (5.7 feet, MAN). Tony James misses. Rebound secured by Tobias Tatum.

[00:37] Team_090 possession (Score: 99-101)
FOUL! Reach-in foul on Ja Cunningham during the drive. [IN THE BONUS! 5 team fouls] Tobias Tatum to the line for 2 free throws. (Ja Cunningham: 1 personal fouls)   FT 1/2: GOOD   FT 2/2: MISS Tobias Tatum makes 1/2 from the line. Rebound secured by Larry Reaves.
Score: 99-102

[00:21] Team_080 possession (Score: 99-102)
Tony James attempts a Midrange. Contested by Russell Smith (5.5 feet, ZONE). Tony James misses. Rebound secured by Derrick Nowitzki.

[00:07] Team_090 possession (Score: 99-102)
OG Anunoby attempts a Midrange. Contested by Larry Reaves (5.8 feet, ZONE). OG ANUNOBY MAKES IT! Assist: Russell Smith
Score: 99-104

================================================================================
                              4TH QUARTER COMPLETE                              
================================================================================

4TH QUARTER SCORE: Team_080 29, Team_090 32

BOX SCORE:
================================================================================

Team_080
--------------------------------------------------------------------------------
Player                MIN  PTS  REB  AST  TO      FG   FG%      3P   3P%
--------------------------------------------------------------------------------
Larry Paul             36    8    0    0   0   3/4    75.0     0/0   0.0
Larry Reaves           19    5    5    1   0   2/3    66.7     0/0   0.0
Joel Bryant            13    5    0    0   0   2/4    50.0     0/0   0.0
Trae Brogdon           18    4    1    3   0   2/3    66.7     0/0   0.0
Tony James             20    3    0    1   0   1/4    25.0     0/0   0.0
Jaren Morant           30    2    2    1   0   1/2    50.0     0/0   0.0
Draymond Simons        30    2    2    0   0   1/1   100.0     0/0   0.0
Ja Cunningham          18    0    2    0   0   0/1     0.0     0/0   0.0

TEAM: FG: 12/22 (54.5%), 3PT: 6/11 (54.5%), REB: 12 (4 off, 8 def), AST: 6, TO: 1
TEAM FOULS: 5 [Team_090 in BONUS]


Team_090
--------------------------------------------------------------------------------
Player                MIN  PTS  REB  AST  TO      FG   FG%      3P   3P%
--------------------------------------------------------------------------------
Tracy Adebayo          30    6    2    0   0   2/4    50.0     0/0   0.0
Josh Wall              14    6    0    0   0   2/4    50.0     0/0   0.0
Russell Smith          14    4    1    1   0   2/2   100.0     0/0   0.0
Derrick Nowitzki       18    4    3    2   0   2/2   100.0     0/0   0.0
Derrick Mitchell       34    3    0    0   0   1/1   100.0     0/0   0.0
Zach Wall              34    3    1    1   0   1/1   100.0     0/0   0.0
Tobias Tatum           18    2    4    2   0   1/3    33.3     0/0   0.0
OG Anunoby             14    2    0    2   0   1/1   100.0     0/0   0.0
Gary Brogdon           30    0    0    0   0   0/2     0.0     0/0   0.0

TEAM: FG: 12/20 (60.0%), 3PT: 5/7 (71.4%), REB: 11 (1 off, 10 def), AST: 8, TO: 3
TEAM FOULS: 4

================================================================================

================================================================================
                               FULL GAME COMPLETE                               
================================================================================

FINAL SCORE: Team_080 99, Team_090 104

SCORING BY QUARTER:
--------------------------------------------------------------------------------
Team                     Q1     Q2     Q3     Q4    FINAL
--------------------------------------------------------------------------------
Team_080                 27     20     23     29       99
Team_090                 24     21     27     32      104
--------------------------------------------------------------------------------

FULL GAME BOX SCORE:
================================================================================

Team_080
--------------------------------------------------------------------------------
Player                MIN  PTS  REB  AST  TO      FG   FG%      3P   3P%      FT STL BLK
--------------------------------------------------------------------------------
Larry Paul             36   10    5    2   2   5/10   50.0   3/8    37.5   0/0     0   0
Jaren Morant           30   12    8    5   2   5/9    55.6   1/4    25.0   1/1     0   0
Draymond Simons        30   13   14    4   1   5/9    55.6   2/3    66.7   4/5     2   1
Khris Turner           30   11    0    0   1   4/9    44.4   2/6    33.3   1/1     0   0
Lauri Dosunmu          29   21    0    5   1   9/14   64.3   2/4    50.0   1/1     1   2
Tony James             20    5    0    1   0   2/8    25.0   1/2    50.0   0/1     1   0
Larry Reaves           19    8    6    1   2   4/5    80.0   1/2    50.0   1/2     0   0
Ja Cunningham          18    8   10    1   4   3/4    75.0   2/2   100.0   2/2     0   0
Trae Brogdon           18    4    2    3   0   2/4    50.0   0/1     0.0   2/2     0   0
Joel Bryant            13    5    0    0   1   2/5    40.0   1/3    33.3   0/0     0   0

TEAM: FG: 41/77 (53.2%), 3PT: 15/35 (42.9%), REB: 48 (14 off, 34 def), AST: 22, TO: 14


Team_090
--------------------------------------------------------------------------------
Player                MIN  PTS  REB  AST  TO      FG   FG%      3P   3P%      FT STL BLK
--------------------------------------------------------------------------------
Derrick Mitchell       34   15    0    3   2   5/11   45.5   4/8    50.0   8/9     0   0
Larry Bridges          34   19    0    2   3   8/11   72.7   2/3    66.7   6/6     0   0
Zach Wall              34   12    9    2   1   5/12   41.7   2/5    40.0   2/3     0   0
Gary Brogdon           30    7    8    0   2   3/11   27.3   1/6    16.7   6/7     0   0
Tracy Adebayo          30   12   14    1   2   5/7    71.4   1/1   100.0   2/3     1   1
Derrick Nowitzki       18    5    4    3   0   2/2   100.0   0/0     0.0   1/2     1   0
Tobias Tatum           18    2    6    4   2   1/4    25.0   0/0     0.0   1/2     0   0
OG Anunoby             14    2    0    3   1   1/1   100.0   0/0     0.0   0/0     0   0
Josh Wall              14   13    0    1   0   5/10   50.0   4/7    57.1   1/2     0   0
Russell Smith          14   11    4    1   0   5/6    83.3   1/2    50.0   4/4     0   1

TEAM: FG: 41/76 (53.9%), 3PT: 15/32 (46.9%), REB: 42 (9 off, 33 def), AST: 20, TO: 13

================================================================================
