================================================================================
                        FULL GAME - Team_090 vs Team_008                        
================================================================================

================================================================================
                       1ST QUARTER - Team_090 vs Team_008                       
================================================================================

[12:00] Team_090 possession (Score: 0-0)
Tracy Adebayo drives, Magic Young stays with him. Tracy Adebayo attempts a Layup. Heavily contested by Magic Young (0.5 feet, MAN)! Tracy Adebayo misses. Offensive rebound by Gary Brogdon! Gary Brogdon kicks it out.

[11:45] Team_090 possession (Score: 0-0)
Larry Bridges attempts a Layup. Heavily contested by Tyrese Thompson (0.5 feet, ZONE)! Larry Bridges misses. Rebound secured by Magic Young.

[11:26] Team_008 possession (Score: 0-0)
Magic Young attempts a 3Pt. Wide open! Tracy Adebayo is 8.6 feet away. [MAN] Magic Young misses. Offensive rebound by Tyrese Thompson! Tyrese Thompson kicks it out.

[11:09] Team_008 possession (Score: 0-0)
Jrue Harris drives and kicks out. Magic Young attempts a Midrange. Contested by Zach Wall (3.7 feet, ZONE). Magic Young misses. Rebound secured by Tracy Adebayo.

[10:53] Team_090 possession (Score: 0-0)
Larry Bridges drives, Jrue Harris stays with him. Larry Bridges attempts a Layup. Contested by Jrue Harris (2.9 feet, MAN). Larry Bridges misses. Rebound secured by Magic Young.

[10:37] Team_008 possession (Score: 0-0)
FOUL! Shooting foul on Gary Brogdon. Victor Leonard to the line for 2 free throws. [Team fouls: 1] (Gary Brogdon: 1 personal fouls)   FT 1/2: MISS   FT 2/2: GOOD Victor Leonard makes 1/2 from the line.
Score: 0-1

[10:21] Team_090 possession (Score: 0-1)
Tracy Adebayo drives, Tyrese Thompson stays with him. Tracy Adebayo attempts a Layup. Contested by Tyrese Thompson (2.3 feet, ZONE). Tracy Adebayo misses. Offensive rebound by Gary Brogdon! Gary Brogdon kicks it out.

[10:01] Team_090 possession (Score: 0-1)
Gary Brogdon throws a bad pass out of bounds! TURNOVER! (dead ball)

[09:45] Team_008 possession (Score: 0-1)
Victor Leonard drives and kicks out. Magic Young attempts a 3Pt. Wide open! Tracy Adebayo is 6.3 feet away. [MAN] Magic Young misses. Rebound secured by Tracy Adebayo.

[09:28] Team_090 possession (Score: 0-1)
Gary Brogdon attempts a Layup. Contested by Tyrese Thompson (5.3 feet, MAN). Gary Brogdon misses. Rebound secured by Tyrese Thompson.

[09:17] Team_008 possession (Score: 0-1)
Tyrese Thompson attempts a Layup. Heavily contested by Gary Brogdon (0.5 feet, MAN)! TYRESE THOMPSON MAKES IT! Assist: Khris Hyland
Score: 0-3

[09:02] Team_090 possession (Score: 0-3)
Larry Bridges drives to the basket... Larry Bridges loses control! Ball rolls out of bounds! TURNOVER! (dead ball)

[08:47] Team_008 possession (Score: 0-3)
FOUL! Holding foul on Larry Bridges. [Team fouls: 2] No free throws, side out. (Larry Bridges: 1 personal fouls)

[08:36] Team_008 possession (Score: 0-3)
Tyrese Thompson attempts a Midrange. Contested by Tracy Adebayo (4.1 feet, ZONE). TYRESE THOMPSON MAKES IT! Assist: Magic Young
Score: 0-5

[08:26] Team_090 possession (Score: 0-5)
FOUL! Holding foul on Victor Leonard. [Team fouls: 1] No free throws, side out. (Victor Leonard: 1 personal fouls)

[08:14] Team_090 possession (Score: 0-5)
Derrick Mitchell attempts a 3Pt. Wide open! Victor Leonard is 6.1 feet away. [ZONE] DERRICK MITCHELL MAKES IT! Assist: Tracy Adebayo
Score: 3-5

[07:58] Team_008 possession (Score: 3-5)
Jrue Harris attempts a Layup. Contested by Larry Bridges (2.9 feet, MAN). JRUE HARRIS MAKES IT!
Score: 3-7

[07:44] Team_090 possession (Score: 3-7)
Tracy Adebayo attempts a Midrange. Contested by Magic Young (3.6 feet, MAN). Tracy Adebayo misses. Offensive rebound by Tracy Adebayo! Tracy Adebayo kicks it out.

[07:33] Team_090 possession (Score: 3-7)
Zach Wall attempts a 3Pt. Contested by Victor Leonard (3.2 feet, ZONE). Zach Wall misses. Rebound secured by Khris Hyland.

[07:23] Team_008 possession (Score: 3-7)
Magic Young attempts a Midrange. Contested by Tracy Adebayo (4.9 feet, MAN). MAGIC YOUNG MAKES IT! Assist: Khris Hyland
Score: 3-9

[07:12] Team_090 possession (Score: 3-9)
Zach Wall loses control! Ball rolls out of bounds! TURNOVER! (dead ball)

[07:02] Team_008 possession (Score: 3-9)
FOUL! Holding foul on Tracy Adebayo. [Team fouls: 3] No free throws, side out. (Tracy Adebayo: 1 personal fouls)

[06:47] Team_008 possession (Score: 3-9)
Tyrese Thompson attempts a Midrange. Heavily contested by Gary Brogdon (1.1 feet, MAN)! Tyrese Thompson misses. Rebound secured by Gary Brogdon.

[06:33] Team_090 possession (Score: 3-9)
Zach Wall attempts a 3Pt. Wide open! Khris Hyland is 8.1 feet away. [MAN] ZACH WALL MAKES IT! Assist: Larry Bridges
Score: 6-9

[06:18] Team_008 possession (Score: 6-9)
Tyrese Thompson drives, Gary Brogdon stays with him. Tyrese Thompson attempts a Dunk. Contested by Gary Brogdon (4.7 feet, ZONE). TYRESE THOMPSON MAKES IT!
Score: 6-11

[06:06] Team_090 possession (Score: 6-11)
Gary Brogdon attempts a 3Pt. Wide open! Tyrese Thompson is 7.4 feet away. [MAN] Gary Brogdon misses. Offensive rebound by Tracy Adebayo! Tracy Adebayo kicks it out.

[05:55] Team_090 possession (Score: 6-11)
Gary Brogdon drives and kicks out. Derrick Mitchell attempts a 3Pt. Wide open! Victor Leonard is 8.4 feet away. [ZONE] Derrick Mitchell misses. Rebound secured by Magic Young.

[05:42] Team_008 possession (Score: 6-11)
Magic Young attempts a Midrange. Wide open! Tracy Adebayo is 6.5 feet away. [MAN] Magic Young misses. Rebound secured by Tracy Adebayo.

[05:29] Team_090 possession (Score: 6-11)
Derrick Mitchell attempts a 3Pt. Wide open! Victor Leonard is 6.2 feet away. [MAN] Derrick Mitchell misses. Rebound secured by Tyrese Thompson.

[05:10] Team_008 possession (Score: 6-11)
Magic Young attempts a Midrange. Wide open! Tracy Adebayo is 9.3 feet away. [MAN] Magic Young misses. Offensive rebound by Magic Young! Magic Young's putback is no good. Offensive rebound by Tyrese Thompson! Tyrese Thompson kicks it out.

[04:51] Team_008 possession (Score: 6-11)
Magic Young attempts a 3Pt. Heavily contested by Derrick Mitchell (1.4 feet, ZONE)! Magic Young misses. Rebound secured by Zach Wall.

[04:33] Team_090 possession (Score: 6-11)
Tracy Adebayo drives, Tyrese Thompson stays with him. Tracy Adebayo attempts a Dunk. Heavily contested by Tyrese Thompson (1.7 feet, ZONE)! TRACY ADEBAYO MAKES IT! Assist: Larry Bridges
Score: 8-11

[04:19] Team_008 possession (Score: 8-11)
Tyrese Thompson attempts a 3Pt. Wide open! Derrick Mitchell is 6.4 feet away. [ZONE] Tyrese Thompson misses. Offensive rebound by Magic Young! Magic Young puts it back in!
Score: 8-13

[04:05] Team_090 possession (Score: 8-13)
Tracy Adebayo attempts a Midrange. Contested by Magic Young (5.0 feet, MAN). Tracy Adebayo misses. Rebound secured by Khris Hyland.

[03:50] Team_008 possession (Score: 8-13)
Khris Hyland makes the Dunk and draws the foul on Zach Wall! And-1! Khris Hyland to the line for 1. [Team fouls: 4] (Zach Wall: 1 personal fouls)   FT 1/1: GOOD Khris Hyland makes 1/1 from the line.
Score: 8-16

[03:38] Team_090 possession (Score: 8-16)
Larry Bridges drives, Jrue Harris stays with him. Larry Bridges attempts a Dunk. Contested by Jrue Harris (3.9 feet, MAN). LARRY BRIDGES MAKES IT!
Score: 10-16

[03:23] Team_008 possession (Score: 10-16)
Jrue Harris attempts a Layup. Contested by Larry Bridges (4.7 feet, MAN). JRUE HARRIS MAKES IT!
Score: 10-18

[03:07] Team_090 possession (Score: 10-18)
Larry Bridges makes the Layup and draws the foul on Jrue Harris! And-1! Larry Bridges to the line for 1. [Team fouls: 2] (Jrue Harris: 1 personal fouls)   FT 1/1: GOOD Larry Bridges makes 1/1 from the line.
Score: 13-18

[02:53] Team_008 possession (Score: 13-18)
FOUL! Holding foul on Zach Wall. [IN THE BONUS! 5 team fouls] Khris Hyland to the line for 2 free throws. (Zach Wall: 2 personal fouls)   FT 1/2: GOOD   FT 2/2: MISS Khris Hyland makes 1/2 from the line. FOUL! Loose ball foul on Gary Brogdon during the free throw rebound! [IN THE BONUS! 6 team fouls] Magic Young to the line for 2 free throws. (Gary Brogdon: 2 personal fouls)   FT 1/2: GOOD   FT 2/2: MISS Magic Young makes 1/2 from the line. Offensive rebound by Magic Young! Magic Young kicks it out.
Score: 13-20

[02:37] Team_008 possession (Score: 13-20)
Khris Hyland attempts a Midrange. Heavily contested by Gary Brogdon (1.5 feet, ZONE)! Khris Hyland misses. Rebound secured by Tracy Adebayo.

[02:22] Team_090 possession (Score: 13-20)
Derrick Mitchell drives and kicks out. Derrick Mitchell attempts a 3Pt. Contested by Victor Leonard (4.0 feet, MAN). Derrick Mitchell misses. Rebound secured by Khris Hyland.

[02:09] Team_008 possession (Score: 13-20)
Victor Leonard drives, picks up Derrick Mitchell. Help arrives from Zach Wall! Victor Leonard attempts a Dunk. Contested by Zach Wall (4.3 feet, MAN). Victor Leonard misses. Offensive rebound by Tyrese Thompson! Tyrese Thompson kicks it out.

[01:56] Team_008 possession (Score: 13-20)
Khris Hyland loses control! Ball rolls out of bounds! TURNOVER! (dead ball)

[01:56] Substitution (Team_090): Larry Bridges OUT → Josh Wall IN (stamina_rule2)

[01:56] Substitution (Team_090): Gary Brogdon OUT → Derrick Nowitzki IN (stamina_rule2)

[01:56] Substitution (Team_090): Tracy Adebayo OUT → Tobias Tatum IN (stamina_rule2)

[01:56] Substitution (Team_008): Victor Leonard OUT → Blake Holiday IN (stamina_rule2)

[01:56] Substitution (Team_008): Jrue Harris OUT → Chris Griffin IN (stamina_rule2)

[01:56] Substitution (Team_008): Khris Hyland OUT → Immanuel Young IN (stamina_rule2)

[01:56] Substitution (Team_008): Tyrese Thompson OUT → Khris Giddey IN (stamina_rule2)

[01:56] Substitution (Team_008): Magic Young OUT → Lamelo Middleton IN (stamina_rule2)

[01:38] Team_090 possession (Score: 13-20)
Zach Wall drives to the basket... Zach Wall throws a bad pass! Stolen by Immanuel Young! TURNOVER! (live ball)

[01:24] Team_008 possession (Score: 13-20)
Khris Giddey drives to the basket... Khris Giddey commits a violation (traveling/carry)! TURNOVER! (dead ball)

[01:24] Substitution (Team_090): Derrick Mitchell OUT → OG Anunoby IN (stamina_rule2)

[01:24] Substitution (Team_090): Zach Wall OUT → Russell Smith IN (stamina_rule2)

[01:06] Team_090 possession (Score: 13-20)
OG Anunoby attempts a 3Pt. Contested by Khris Giddey (4.5 feet, ZONE). OG Anunoby misses. Rebound secured by Lamelo Middleton.

[00:50] Team_008 possession (Score: 13-20)
Lamelo Middleton drives, picks up Derrick Nowitzki. Help arrives from Josh Wall! Lamelo Middleton attempts a Layup. Heavily contested by Josh Wall (0.5 feet, ZONE)! LAMELO MIDDLETON MAKES IT! Assist: Immanuel Young
Score: 13-22

[00:32] Team_090 possession (Score: 13-22)
OG Anunoby attempts a 3Pt. Wide open! Blake Holiday is 8.2 feet away. [ZONE] OG Anunoby misses. Rebound secured by Lamelo Middleton.

[00:18] Team_008 possession (Score: 13-22)
Blake Holiday attempts a Midrange. Contested by OG Anunoby (5.5 feet, MAN). BLAKE HOLIDAY MAKES IT! Assist: Khris Giddey
Score: 13-24

[00:06] Team_090 possession (Score: 13-24)
Tobias Tatum drives, picks up Lamelo Middleton. Help arrives from Chris Griffin! Tobias Tatum attempts a Dunk. Wide open! Chris Griffin is 6.7 feet away. [MAN] TOBIAS TATUM MAKES IT!
Score: 15-24

================================================================================
                              1ST QUARTER COMPLETE                              
================================================================================

1ST QUARTER SCORE: Team_090 15, Team_008 24

BOX SCORE:
================================================================================

Team_090
--------------------------------------------------------------------------------
Player                MIN  PTS  REB  AST  TO      FG   FG%      3P   3P%
--------------------------------------------------------------------------------
Larry Bridges          10    5    0    2   0   2/4    50.0     0/0   0.0
Derrick Mitchell       11    3    0    0   0   1/3    33.3     0/0   0.0
Zach Wall              11    3    1    0   0   1/2    50.0     0/0   0.0
Tracy Adebayo          10    2    6    1   0   1/2    50.0     0/0   0.0
Tobias Tatum            2    2    0    0   0   1/1   100.0     0/0   0.0
Gary Brogdon           10    0    3    0   0   0/2     0.0     0/0   0.0
OG Anunoby              1    0    0    0   0   0/2     0.0     0/0   0.0

TEAM: FG: 6/16 (37.5%), 3PT: 2/6 (33.3%), REB: 10 (4 off, 6 def), AST: 3, TO: 4
TEAM FOULS: 6 [Team_008 in BONUS]


Team_008
--------------------------------------------------------------------------------
Player                MIN  PTS  REB  AST  TO      FG   FG%      3P   3P%
--------------------------------------------------------------------------------
Tyrese Thompson        10    6    5    0   0   3/4    75.0     0/0   0.0
Magic Young            10    4    5    1   0   2/4    50.0     0/0   0.0
Jrue Harris            10    4    0    0   0   2/3    66.7     0/0   0.0
Khris Hyland           10    3    3    2   0   1/2    50.0     0/0   0.0
Lamelo Middleton        2    2    2    0   0   1/1   100.0     0/0   0.0
Blake Holiday           2    2    0    0   0   1/1   100.0     0/0   0.0
Victor Leonard         10    1    0    0   0   1/2    50.0     0/0   0.0
Immanuel Young          2    0    0    1   0   0/0     0.0     0/0   0.0
Khris Giddey            2    0    0    1   0   0/0     0.0     0/0   0.0

TEAM: FG: 11/17 (64.7%), 3PT: 1/2 (50.0%), REB: 15 (5 off, 10 def), AST: 5, TO: 2
TEAM FOULS: 2

================================================================================

================================================================================
                       2ND QUARTER - Team_090 vs Team_008                       
================================================================================

[12:00] Team_090 possession (Score: 15-24)
Gary Brogdon attempts a 3Pt. Wide open! Victor Leonard is 6.6 feet away. [ZONE] Gary Brogdon misses. Rebound secured by Magic Young.

[11:48] Team_008 possession (Score: 15-24)
Khris Hyland attempts a 3Pt. Contested by Derrick Mitchell (2.0 feet, ZONE). KHRIS HYLAND MAKES IT! Assist: Jrue Harris
Score: 15-27

[11:33] Team_090 possession (Score: 15-27)
FOUL! Shooting foul on Magic Young. Tracy Adebayo to the line for 2 free throws. [Team fouls: 1] (Magic Young: 1 personal fouls)   FT 1/2: GOOD   FT 2/2: GOOD Tracy Adebayo makes 2/2 from the line.
Score: 17-27

[11:19] Team_008 possession (Score: 17-27)
FOUL! Shooting foul on Derrick Mitchell. Victor Leonard to the line for 3 free throws. [Team fouls: 1] (Derrick Mitchell: 1 personal fouls)   FT 1/3: MISS   FT 2/3: MISS   FT 3/3: GOOD Victor Leonard makes 1/3 from the line.
Score: 17-28

[11:05] Team_090 possession (Score: 17-28)
Zach Wall attempts a Midrange. Contested by Tyrese Thompson (3.3 feet, ZONE). ZACH WALL MAKES IT!
Score: 19-28

[10:52] Team_008 possession (Score: 19-28)
Tyrese Thompson attempts a Layup. Contested by Gary Brogdon (4.7 feet, MAN). Tyrese Thompson misses. Rebound secured by Tracy Adebayo.

[10:35] Team_090 possession (Score: 19-28)
Derrick Mitchell attempts a 3Pt. Contested by Victor Leonard (5.3 feet, MAN). DERRICK MITCHELL MAKES IT! Assist: Gary Brogdon
Score: 22-28

[10:18] Team_008 possession (Score: 22-28)
Khris Hyland attempts a 3Pt. Wide open! Zach Wall is 6.0 feet away. [MAN] KHRIS HYLAND MAKES IT!
Score: 22-31

[10:01] Team_090 possession (Score: 22-31)
Derrick Mitchell attempts a 3Pt. Contested by Victor Leonard (3.4 feet, MAN). Derrick Mitchell misses. Rebound secured by Tyrese Thompson.

[09:46] Team_008 possession (Score: 22-31)
Khris Hyland attempts a 3Pt. Contested by Derrick Mitchell (3.2 feet, ZONE). Khris Hyland misses. Offensive rebound by Magic Young! Magic Young kicks it out.

[09:26] Team_008 possession (Score: 22-31)
Jrue Harris attempts a Layup. Contested by Larry Bridges (4.9 feet, MAN). JRUE HARRIS MAKES IT!
Score: 22-33

[09:06] Team_090 possession (Score: 22-33)
Derrick Mitchell drives, Victor Leonard stays with him. Derrick Mitchell attempts a Dunk. Contested by Victor Leonard (5.4 feet, MAN). DERRICK MITCHELL MAKES IT! Assist: Gary Brogdon
Score: 24-33

[08:51] Team_008 possession (Score: 24-33)
Victor Leonard attempts a Midrange. Contested by Larry Bridges (3.8 feet, ZONE). VICTOR LEONARD MAKES IT!
Score: 24-35

[08:35] Team_090 possession (Score: 24-35)
Larry Bridges attempts a 3Pt. Wide open! Victor Leonard is 8.3 feet away. [ZONE] Larry Bridges misses. Rebound secured by Tyrese Thompson.

[08:22] Team_008 possession (Score: 24-35)
Magic Young attempts a Layup. Wide open! Tracy Adebayo is 6.3 feet away. [ZONE] MAGIC YOUNG MAKES IT! Assist: Khris Hyland
Score: 24-37

[08:09] Team_090 possession (Score: 24-37)
Derrick Mitchell attempts a 3Pt. Wide open! Victor Leonard is 8.5 feet away. [ZONE] Derrick Mitchell misses. Offensive rebound by Tracy Adebayo! Tracy Adebayo kicks it out.

[07:56] Team_090 possession (Score: 24-37)
Derrick Mitchell makes the Layup and draws the foul on Tyrese Thompson! And-1! Derrick Mitchell to the line for 1. [Team fouls: 2] (Tyrese Thompson: 1 personal fouls)   FT 1/1: GOOD Derrick Mitchell makes 1/1 from the line.
Score: 27-37

[07:44] Team_008 possession (Score: 27-37)
Khris Hyland attempts a 3Pt. Contested by Derrick Mitchell (5.9 feet, ZONE). Khris Hyland misses. Rebound secured by Zach Wall.

[07:27] Team_090 possession (Score: 27-37)
Tracy Adebayo drives to the basket... FOUL! Offensive foul on Tracy Adebayo! Tyrese Thompson drew the charge! [Team fouls: 2] (Tracy Adebayo: 1 personal fouls) TURNOVER! (dead ball)

[07:12] Team_008 possession (Score: 27-37)
FOUL! Holding foul on Larry Bridges. [Team fouls: 3] No free throws, side out. (Larry Bridges: 1 personal fouls)

[06:57] Team_008 possession (Score: 27-37)
FOUL! Shooting foul on Tracy Adebayo. Magic Young to the line for 2 free throws. [Team fouls: 4] (Tracy Adebayo: 2 personal fouls)   FT 1/2: GOOD   FT 2/2: GOOD Magic Young makes 2/2 from the line.
Score: 27-39

[06:46] Team_090 possession (Score: 27-39)
Larry Bridges attempts a Layup. Contested by Jrue Harris (4.7 feet, MAN). Larry Bridges misses. Rebound secured by Tyrese Thompson.

[06:31] Team_008 possession (Score: 27-39)
Jrue Harris attempts a 3Pt. Wide open! Derrick Mitchell is 6.8 feet away. [ZONE] Jrue Harris misses. Rebound secured by Tracy Adebayo.

[06:16] Team_090 possession (Score: 27-39)
Zach Wall attempts a 3Pt. Contested by Khris Hyland (4.0 feet, MAN). Zach Wall misses. Offensive rebound by Tracy Adebayo! Tracy Adebayo kicks it out.

[05:58] Team_090 possession (Score: 27-39)
Larry Bridges attempts a 3Pt. Wide open! Victor Leonard is 8.6 feet away. [ZONE] LARRY BRIDGES MAKES IT! Assist: Tracy Adebayo
Score: 30-39

[05:43] Team_008 possession (Score: 30-39)
Victor Leonard drives and kicks out. Tyrese Thompson attempts a Midrange. Contested by Zach Wall (4.0 feet, ZONE). Tyrese Thompson misses. Rebound secured by Zach Wall.

[05:30] Team_090 possession (Score: 30-39)
Derrick Mitchell attempts a 3Pt. Wide open! Victor Leonard is 6.9 feet away. [ZONE] DERRICK MITCHELL MAKES IT! Assist: Zach Wall
Score: 33-39

[05:17] Team_008 possession (Score: 33-39)
Khris Hyland commits a violation (traveling/carry)! TURNOVER! (dead ball)

[05:17] Substitution (Team_090): Derrick Mitchell OUT → OG Anunoby IN (stamina_rule2)

[05:17] Substitution (Team_090): Larry Bridges OUT → Josh Wall IN (stamina_rule2)

[05:17] Substitution (Team_090): Zach Wall OUT → Russell Smith IN (stamina_rule2)

[05:17] Substitution (Team_090): Gary Brogdon OUT → Derrick Nowitzki IN (stamina_rule2)

[05:17] Substitution (Team_090): Tracy Adebayo OUT → Tobias Tatum IN (stamina_rule2)

[05:17] Substitution (Team_008): Victor Leonard OUT → Blake Holiday IN (stamina_rule2)

[05:17] Substitution (Team_008): Jrue Harris OUT → Chris Griffin IN (stamina_rule2)

[05:17] Substitution (Team_008): Khris Hyland OUT → Immanuel Young IN (stamina_rule2)

[05:17] Substitution (Team_008): Tyrese Thompson OUT → Khris Giddey IN (stamina_rule2)

[05:17] Substitution (Team_008): Magic Young OUT → Lamelo Middleton IN (stamina_rule2)

[05:02] Team_090 possession (Score: 33-39)
Russell Smith attempts a Midrange. Contested by Khris Giddey (5.4 feet, ZONE). RUSSELL SMITH MAKES IT!
Score: 35-39

[04:43] Team_008 possession (Score: 35-39)
Lamelo Middleton attempts a Layup. Contested by Derrick Nowitzki (2.4 feet, ZONE). Lamelo Middleton misses. Rebound secured by Russell Smith.

[04:27] Team_090 possession (Score: 35-39)
Derrick Nowitzki attempts a Midrange. Contested by Khris Giddey (5.3 feet, MAN). Derrick Nowitzki misses. Rebound secured by Lamelo Middleton.

[04:08] Team_008 possession (Score: 35-39)
Immanuel Young attempts a 3Pt. Contested by Russell Smith (4.7 feet, ZONE). IMMANUEL YOUNG MAKES IT! Assist: Chris Griffin
Score: 35-42

[03:49] Team_090 possession (Score: 35-42)
Tobias Tatum attempts a Layup. BLOCKED BY LAMELO MIDDLETON! Ball is loose! Rebound secured by Chris Griffin.

[03:35] Team_008 possession (Score: 35-42)
Blake Holiday attempts a 3Pt. Wide open! Russell Smith is 7.2 feet away. [ZONE] BLAKE HOLIDAY MAKES IT! Assist: Lamelo Middleton
Score: 35-45

[03:18] Team_090 possession (Score: 35-45)
Tobias Tatum attempts a Layup. BLOCKED BY LAMELO MIDDLETON! Ball is loose! Rebound secured by Lamelo Middleton.

[03:04] Team_008 possession (Score: 35-45)
Immanuel Young attempts a Midrange. Contested by Russell Smith (3.9 feet, MAN). Immanuel Young misses. Offensive rebound by Khris Giddey! Khris Giddey kicks it out.

[02:49] Team_008 possession (Score: 35-45)
Immanuel Young attempts a Midrange. Heavily contested by Russell Smith (0.8 feet, MAN)! Immanuel Young misses. Offensive rebound by Lamelo Middleton! Lamelo Middleton's putback is no good. Rebound secured by Russell Smith.

[02:36] Team_090 possession (Score: 35-45)
Derrick Nowitzki attempts a Midrange. Contested by Khris Giddey (2.4 feet, MAN). Derrick Nowitzki misses. Rebound secured by Chris Griffin.

[02:20] Team_008 possession (Score: 35-45)
Immanuel Young makes the Layup and draws the foul on Josh Wall! And-1! Immanuel Young to the line for 1. [BONUS: 5 team fouls] (Josh Wall: 1 personal fouls)   FT 1/1: GOOD Immanuel Young makes 1/1 from the line.
Score: 35-48

[02:07] Team_090 possession (Score: 35-48)
Tobias Tatum loses the ball! Stripped by Lamelo Middleton! TURNOVER! (live ball)

[01:54] Team_008 possession (Score: 35-48)
FOUL! Shooting foul on Josh Wall. Immanuel Young to the line for 2 free throws. [BONUS: 6 team fouls] (Josh Wall: 2 personal fouls)   FT 1/2: GOOD   FT 2/2: GOOD Immanuel Young makes 2/2 from the line.
Score: 35-50

[01:44] Team_090 possession (Score: 35-50)
Derrick Nowitzki attempts a 3Pt. Contested by Khris Giddey (4.8 feet, MAN). Derrick Nowitzki misses. Rebound secured by Khris Giddey.

[01:32] Team_008 possession (Score: 35-50)
FOUL! Reach-in foul on Tobias Tatum during the drive. [IN THE BONUS! 7 team fouls] Lamelo Middleton to the line for 2 free throws. (Tobias Tatum: 1 personal fouls)   FT 1/2: GOOD   FT 2/2: GOOD Lamelo Middleton makes 2/2 from the line.
Score: 35-52

[01:21] Team_090 possession (Score: 35-52)
Josh Wall drives, picks up Lamelo Middleton. Help arrives from Chris Griffin! Josh Wall attempts a Layup. Wide open! Chris Griffin is 6.9 feet away. [ZONE] JOSH WALL MAKES IT!
Score: 37-52

[01:09] Team_008 possession (Score: 37-52)
Khris Giddey attempts a Layup. BLOCKED BY DERRICK NOWITZKI! Ball deflects out of bounds off Khris Giddey.

[01:00] Team_090 possession (Score: 37-52)
Derrick Nowitzki makes the Layup and draws the foul on Lamelo Middleton! And-1! Derrick Nowitzki to the line for 1. [Team fouls: 3] (Lamelo Middleton: 1 personal fouls)   FT 1/1: GOOD Derrick Nowitzki makes 1/1 from the line.
Score: 40-52

[00:41] Team_008 possession (Score: 40-52)
Khris Giddey drives, Derrick Nowitzki stays with him. Khris Giddey attempts a Layup. Wide open! Derrick Nowitzki is 6.2 feet away. [MAN] KHRIS GIDDEY MAKES IT!
Score: 40-54

[00:27] Team_090 possession (Score: 40-54)
Tobias Tatum drives, Lamelo Middleton stays with him. Tobias Tatum attempts a Layup. Heavily contested by Lamelo Middleton (1.2 feet, ZONE)! TOBIAS TATUM MAKES IT! Assist: Russell Smith
Score: 42-54

[00:14] Team_008 possession (Score: 42-54)
Blake Holiday attempts a 3Pt. Wide open! Russell Smith is 8.8 feet away. [ZONE] Blake Holiday misses. Offensive rebound by Khris Giddey! Khris Giddey kicks it out.

[00:01] Team_008 possession (Score: 42-54)
Chris Griffin attempts a 3Pt. Contested by Russell Smith (4.1 feet, ZONE). Chris Griffin misses. Offensive rebound by Lamelo Middleton! Lamelo Middleton puts it back in!
Score: 42-56

================================================================================
                              2ND QUARTER COMPLETE                              
================================================================================

2ND QUARTER SCORE: Team_090 27, Team_008 32

BOX SCORE:
================================================================================

Team_090
--------------------------------------------------------------------------------
Player                MIN  PTS  REB  AST  TO      FG   FG%      3P   3P%
--------------------------------------------------------------------------------
Derrick Mitchell       18   11    0    0   0   4/5    80.0     0/0   0.0
Larry Bridges          17    3    0    0   0   1/3    33.3     0/0   0.0
Derrick Nowitzki        7    3    0    0   0   1/4    25.0     0/0   0.0
Tracy Adebayo          17    2    4    1   0   1/1   100.0     0/0   0.0
Zach Wall              18    2    2    1   0   1/1   100.0     0/0   0.0
Russell Smith           7    2    2    1   0   1/1   100.0     0/0   0.0
Tobias Tatum            7    2    0    0   0   1/3    33.3     0/0   0.0
Josh Wall               7    2    0    0   0   1/1   100.0     0/0   0.0
Gary Brogdon           17    0    0    2   0   0/1     0.0     0/0   0.0

TEAM: FG: 11/20 (55.0%), 3PT: 3/7 (42.9%), REB: 7 (2 off, 5 def), AST: 5, TO: 2
TEAM FOULS: 7 [Team_008 in BONUS]


Team_008
--------------------------------------------------------------------------------
Player                MIN  PTS  REB  AST  TO      FG   FG%      3P   3P%
--------------------------------------------------------------------------------
Immanuel Young          7    8    0    0   0   3/4    75.0     0/0   0.0
Khris Hyland           17    6    0    1   0   2/3    66.7     0/0   0.0
Magic Young            17    4    2    0   0   2/2   100.0     0/0   0.0
Lamelo Middleton        7    4    3    1   0   2/3    66.7     0/0   0.0
Victor Leonard         17    3    0    0   0   2/3    66.7     0/0   0.0
Blake Holiday           7    3    0    0   0   1/1   100.0     0/0   0.0
Jrue Harris            17    2    0    1   0   1/2    50.0     0/0   0.0
Khris Giddey            7    2    3    0   0   1/2    50.0     0/0   0.0
Tyrese Thompson        17    0    3    0   0   0/1     0.0     0/0   0.0
Chris Griffin           7    0    2    1   0   0/0     0.0     0/0   0.0

TEAM: FG: 14/21 (66.7%), 3PT: 6/8 (75.0%), REB: 14 (5 off, 9 def), AST: 4, TO: 1
TEAM FOULS: 3

================================================================================

================================================================================
                       3RD QUARTER - Team_090 vs Team_008                       
================================================================================

[12:00] Team_090 possession (Score: 42-56)
Gary Brogdon throws a bad pass! Stolen by Tyrese Thompson! TURNOVER! (live ball)

[11:42] Team_008 possession (Score: 42-56)
Magic Young attempts a Layup. Contested by Gary Brogdon (4.0 feet, ZONE). Magic Young misses. Rebound secured by Tracy Adebayo.

[11:26] Team_090 possession (Score: 42-56)
FOUL! Shooting foul on Tyrese Thompson. Larry Bridges to the line for 2 free throws. [Team fouls: 1] (Tyrese Thompson: 1 personal fouls)   FT 1/2: GOOD   FT 2/2: MISS Larry Bridges makes 1/2 from the line. Rebound secured by Khris Hyland.
Score: 43-56

[11:13] Team_008 possession (Score: 43-56)
Khris Hyland attempts a 3Pt. Contested by Derrick Mitchell (4.5 feet, ZONE). Khris Hyland misses. Rebound secured by Gary Brogdon.

[10:57] Team_090 possession (Score: 43-56)
Tracy Adebayo drives and kicks out. FOUL! Shooting foul on Khris Hyland. Zach Wall to the line for 2 free throws. [Team fouls: 2] (Khris Hyland: 1 personal fouls)   FT 1/2: GOOD   FT 2/2: MISS Zach Wall makes 1/2 from the line. Rebound secured by Khris Hyland.
Score: 44-56

[10:46] Team_008 possession (Score: 44-56)
Victor Leonard drives to the basket... FOUL! Offensive foul on Victor Leonard! Gary Brogdon drew the charge! [Team fouls: 3] (Victor Leonard: 1 personal fouls) TURNOVER! (dead ball)

[10:31] Team_090 possession (Score: 44-56)
Larry Bridges attempts a 3Pt. Wide open! Victor Leonard is 7.2 feet away. [ZONE] Larry Bridges misses. Rebound secured by Khris Hyland.

[10:14] Team_008 possession (Score: 44-56)
Tyrese Thompson drives, Gary Brogdon stays with him. Tyrese Thompson attempts a Dunk. Heavily contested by Gary Brogdon (1.7 feet, MAN)! TYRESE THOMPSON MAKES IT!
Score: 44-58

[09:59] Team_090 possession (Score: 44-58)
Larry Bridges drives to the basket... Larry Bridges throws a bad pass out of bounds! TURNOVER! (dead ball)

[09:48] Team_008 possession (Score: 44-58)
Victor Leonard loses the ball! Stripped by Derrick Mitchell! TURNOVER! (live ball)

[09:34] Team_090 possession (Score: 44-58)
Derrick Mitchell attempts a 3Pt. Contested by Victor Leonard (2.5 feet, ZONE). DERRICK MITCHELL MAKES IT! Assist: Larry Bridges
Score: 47-58

[09:19] Team_008 possession (Score: 47-58)
Khris Hyland throws a bad pass! Stolen by Zach Wall! TURNOVER! (live ball)

[09:05] Team_090 possession (Score: 47-58)
Gary Brogdon drives, picks up Tyrese Thompson. Help arrives from Jrue Harris! Gary Brogdon attempts a Dunk. Wide open! Jrue Harris is 6.4 feet away. [ZONE] GARY BROGDON MAKES IT! Assist: Zach Wall
Score: 49-58

[08:54] Team_008 possession (Score: 49-58)
FOUL! Shooting foul on Gary Brogdon. Victor Leonard to the line for 2 free throws. [Team fouls: 1] (Gary Brogdon: 1 personal fouls)   FT 1/2: GOOD   FT 2/2: GOOD Victor Leonard makes 2/2 from the line.
Score: 49-60

[08:38] Team_090 possession (Score: 49-60)
Gary Brogdon attempts a Midrange. Contested by Tyrese Thompson (4.8 feet, ZONE). Gary Brogdon misses. Rebound secured by Tyrese Thompson.

[08:23] Team_008 possession (Score: 49-60)
Tyrese Thompson attempts a 3Pt. Heavily contested by Derrick Mitchell (0.6 feet, ZONE)! Tyrese Thompson misses. FOUL! Loose ball foul on Gary Brogdon during the rebound battle. [Team fouls: 2] No free throws, side out. (Gary Brogdon: 2 personal fouls)

[08:07] Team_008 possession (Score: 49-60)
Magic Young attempts a Midrange. Contested by Gary Brogdon (4.8 feet, ZONE). Magic Young misses. Rebound secured by Tracy Adebayo.

[07:52] Team_090 possession (Score: 49-60)
Gary Brogdon attempts a 3Pt. Contested by Tyrese Thompson (3.3 feet, MAN). GARY BROGDON MAKES IT! Assist: Tracy Adebayo
Score: 52-60

[07:35] Team_008 possession (Score: 52-60)
Jrue Harris attempts a 3Pt. Contested by Derrick Mitchell (3.8 feet, ZONE). Jrue Harris misses. FOUL! Loose ball foul on Gary Brogdon during the rebound battle. [Team fouls: 3] No free throws, side out. (Gary Brogdon: 3 personal fouls)

[07:19] Team_008 possession (Score: 52-60)
Jrue Harris attempts a Midrange. Wide open! Larry Bridges is 8.0 feet away. [ZONE] Jrue Harris misses. Offensive rebound by Tyrese Thompson! Tyrese Thompson kicks it out.

[07:05] Team_008 possession (Score: 52-60)
Magic Young drives and kicks out. Victor Leonard attempts a Midrange. Heavily contested by Derrick Mitchell (0.8 feet, MAN)! Victor Leonard misses. Rebound secured by Zach Wall.

[06:55] Team_090 possession (Score: 52-60)
Larry Bridges commits a violation (traveling/carry)! TURNOVER! (dead ball)

[06:41] Team_008 possession (Score: 52-60)
Tyrese Thompson drives, Gary Brogdon stays with him. Tyrese Thompson attempts a Layup. Wide open! Gary Brogdon is 6.1 feet away. [MAN] TYRESE THOMPSON MAKES IT! Assist: Victor Leonard
Score: 52-62

[06:26] Team_090 possession (Score: 52-62)
Tracy Adebayo attempts a 3Pt. Contested by Magic Young (4.0 feet, MAN). TRACY ADEBAYO MAKES IT! Assist: Derrick Mitchell
Score: 55-62

[06:10] Team_008 possession (Score: 55-62)
Khris Hyland attempts a 3Pt. Wide open! Derrick Mitchell is 7.9 feet away. [ZONE] Khris Hyland misses. Rebound secured by Tracy Adebayo.

[05:59] Team_090 possession (Score: 55-62)
Larry Bridges makes the Layup and draws the foul on Tyrese Thompson! And-1! Larry Bridges to the line for 1. [Team fouls: 4] (Tyrese Thompson: 2 personal fouls)   FT 1/1: GOOD Larry Bridges makes 1/1 from the line.
Score: 58-62

[05:47] Team_008 possession (Score: 58-62)
Victor Leonard attempts a 3Pt. Contested by Derrick Mitchell (4.1 feet, ZONE). Victor Leonard misses. FOUL! Loose ball foul on Tracy Adebayo during the rebound battle. [Team fouls: 4] No free throws, side out. (Tracy Adebayo: 1 personal fouls)

[05:31] Team_008 possession (Score: 58-62)
Jrue Harris attempts a Midrange. Contested by Larry Bridges (4.6 feet, MAN). JRUE HARRIS MAKES IT!
Score: 58-64

[05:18] Team_090 possession (Score: 58-64)
Gary Brogdon attempts a Midrange. Contested by Khris Hyland (3.2 feet, ZONE). Gary Brogdon misses. Rebound secured by Magic Young.

[05:07] Team_008 possession (Score: 58-64)
Tyrese Thompson attempts a 3Pt. Contested by Gary Brogdon (5.2 feet, MAN). Tyrese Thompson misses. Offensive rebound by Tyrese Thompson! Tyrese Thompson kicks it out.

[04:51] Team_008 possession (Score: 58-64)
FOUL! Shooting foul on Derrick Mitchell. Jrue Harris to the line for 3 free throws. [BONUS: 5 team fouls] (Derrick Mitchell: 1 personal fouls)   FT 1/3: MISS   FT 2/3: GOOD   FT 3/3: GOOD Jrue Harris makes 2/3 from the line.
Score: 58-66

[04:37] Team_090 possession (Score: 58-66)
Tracy Adebayo attempts a Midrange. Contested by Magic Young (3.7 feet, MAN). Tracy Adebayo misses. Offensive rebound by Zach Wall! Zach Wall kicks it out.

[04:19] Team_090 possession (Score: 58-66)
Larry Bridges drives, Jrue Harris stays with him. Larry Bridges attempts a Dunk. Heavily contested by Jrue Harris (1.2 feet, MAN)! Larry Bridges misses. Offensive rebound by Zach Wall! Zach Wall kicks it out.

[04:05] Team_090 possession (Score: 58-66)
Larry Bridges makes the Layup and draws the foul on Tyrese Thompson! And-1! Larry Bridges to the line for 1. [BONUS: 5 team fouls] (Tyrese Thompson: 3 personal fouls)   FT 1/1: GOOD Larry Bridges makes 1/1 from the line.
Score: 61-66

[03:54] Team_008 possession (Score: 61-66)
Jrue Harris loses the ball! Stripped by Larry Bridges! TURNOVER! (live ball)

[03:39] Team_090 possession (Score: 61-66)
Larry Bridges drives, picks up Tyrese Thompson. Help arrives from Jrue Harris! Larry Bridges attempts a Dunk. Contested by Jrue Harris (3.2 feet, ZONE). LARRY BRIDGES MAKES IT!
Score: 63-66

[03:24] Team_008 possession (Score: 63-66)
Victor Leonard drives, picks up Derrick Mitchell. Help arrives from Zach Wall! Victor Leonard attempts a Layup. Heavily contested by Zach Wall (1.6 feet, MAN)! VICTOR LEONARD MAKES IT! Assist: Magic Young
Score: 63-68

[03:11] Team_090 possession (Score: 63-68)
Larry Bridges attempts a Layup. BLOCKED BY TYRESE THOMPSON! Ball deflects out of bounds off Larry Bridges.

[02:57] Team_008 possession (Score: 63-68)
Magic Young attempts a Midrange. Wide open! Tracy Adebayo is 6.7 feet away. [MAN] Magic Young misses. Rebound secured by Tracy Adebayo.

[02:40] Team_090 possession (Score: 63-68)
Larry Bridges drives and kicks out. Larry Bridges attempts a 3Pt. Contested by Jrue Harris (2.2 feet, MAN). LARRY BRIDGES MAKES IT! Assist: Gary Brogdon
Score: 66-68

[02:28] Team_008 possession (Score: 66-68)
Khris Hyland drives and kicks out. Victor Leonard attempts a Midrange. Contested by Derrick Mitchell (2.8 feet, MAN). Victor Leonard misses. Offensive rebound by Magic Young! Magic Young kicks it out.

[02:13] Team_008 possession (Score: 66-68)
Victor Leonard attempts a 3Pt. Contested by Derrick Mitchell (3.8 feet, ZONE). VICTOR LEONARD MAKES IT! Assist: Magic Young
Score: 66-71

[02:01] Team_090 possession (Score: 66-71)
Gary Brogdon attempts a Midrange. Wide open! Jrue Harris is 7.8 feet away. [ZONE] Gary Brogdon misses. FOUL! Loose ball foul on Tyrese Thompson during the rebound battle. [IN THE BONUS! 6 team fouls] Tracy Adebayo to the line for 2 free throws. (Tyrese Thompson: 4 personal fouls)   FT 1/2: GOOD   FT 2/2: GOOD Tracy Adebayo makes 2/2 from the line.
Score: 68-71

[01:47] Team_008 possession (Score: 68-71)
Jrue Harris attempts a 3Pt. Contested by Derrick Mitchell (3.2 feet, ZONE). JRUE HARRIS MAKES IT! Assist: Victor Leonard
Score: 68-74

[01:35] Team_090 possession (Score: 68-74)
Larry Bridges attempts a 3Pt. Contested by Victor Leonard (6.0 feet, ZONE). Larry Bridges misses. Rebound secured by Khris Hyland.

[01:16] Team_008 possession (Score: 68-74)
Magic Young loses control! Ball rolls out of bounds! TURNOVER! (dead ball)

[01:16] Substitution (Team_090): Derrick Mitchell OUT → OG Anunoby IN (stamina_rule2)

[01:16] Substitution (Team_090): Larry Bridges OUT → Josh Wall IN (stamina_rule2)

[01:16] Substitution (Team_090): Zach Wall OUT → Russell Smith IN (stamina_rule2)

[01:16] Substitution (Team_090): Gary Brogdon OUT → Derrick Nowitzki IN (stamina_rule2)

[01:16] Substitution (Team_090): Tracy Adebayo OUT → Tobias Tatum IN (stamina_rule2)

[01:16] Substitution (Team_008): Victor Leonard OUT → Blake Holiday IN (stamina_rule2)

[01:16] Substitution (Team_008): Jrue Harris OUT → Chris Griffin IN (stamina_rule2)

[01:16] Substitution (Team_008): Khris Hyland OUT → Immanuel Young IN (stamina_rule2)

[01:16] Substitution (Team_008): Tyrese Thompson OUT → Khris Giddey IN (stamina_rule2)

[01:16] Substitution (Team_008): Magic Young OUT → Lamelo Middleton IN (stamina_rule2)

[01:01] Team_090 possession (Score: 68-74)
Tobias Tatum attempts a Layup. Contested by Lamelo Middleton (4.8 feet, MAN). Tobias Tatum misses. Offensive rebound by Tobias Tatum! Tobias Tatum kicks it out.

[00:45] Team_090 possession (Score: 68-74)
Russell Smith attempts a 3Pt. Contested by Immanuel Young (3.2 feet, MAN). Russell Smith misses. Rebound secured by Chris Griffin.

[00:28] Team_008 possession (Score: 68-74)
Lamelo Middleton commits a violation (traveling/carry)! TURNOVER! (dead ball)

[00:15] Team_090 possession (Score: 68-74)
Josh Wall attempts a 3Pt. Contested by Khris Giddey (5.9 feet, ZONE). JOSH WALL MAKES IT! Assist: Derrick Nowitzki
Score: 71-74

================================================================================
                              3RD QUARTER COMPLETE                              
================================================================================

3RD QUARTER SCORE: Team_090 29, Team_008 18

BOX SCORE:
================================================================================

Team_090
--------------------------------------------------------------------------------
Player                MIN  PTS  REB  AST  TO      FG   FG%      3P   3P%
--------------------------------------------------------------------------------
Larry Bridges          28   11    0    1   0   4/8    50.0     0/0   0.0
Tracy Adebayo          28    5    4    1   0   2/3    66.7     0/0   0.0
Gary Brogdon           28    5    1    1   0   2/4    50.0     0/0   0.0
Derrick Mitchell       29    3    0    1   0   1/1   100.0     0/0   0.0
Josh Wall               8    3    0    0   0   1/1   100.0     0/0   0.0
Zach Wall              29    0    3    1   0   0/0     0.0     0/0   0.0
Tobias Tatum            8    0    1    0   0   0/0     0.0     0/0   0.0
Russell Smith           8    0    0    0   0   0/1     0.0     0/0   0.0
Derrick Nowitzki        8    0    0    1   0   0/0     0.0     0/0   0.0

TEAM: FG: 10/18 (55.6%), 3PT: 4/7 (57.1%), REB: 9 (3 off, 6 def), AST: 6, TO: 3
TEAM FOULS: 5 [Team_008 in BONUS]


Team_008
--------------------------------------------------------------------------------
Player                MIN  PTS  REB  AST  TO      FG   FG%      3P   3P%
--------------------------------------------------------------------------------
Victor Leonard         28    7    0    2   0   3/3   100.0     0/0   0.0
Jrue Harris            28    7    0    0   0   3/3   100.0     0/0   0.0
Tyrese Thompson        28    4    4    0   0   2/2   100.0     0/0   0.0
Magic Young            28    0    4    2   0   0/4     0.0     0/0   0.0
Khris Hyland           28    0    4    0   0   0/2     0.0     0/0   0.0
Chris Griffin           8    0    1    0   0   0/0     0.0     0/0   0.0

TEAM: FG: 8/14 (57.1%), 3PT: 3/5 (60.0%), REB: 13 (6 off, 7 def), AST: 4, TO: 6
TEAM FOULS: 6 [Team_090 in BONUS]

================================================================================

================================================================================
                       4TH QUARTER - Team_090 vs Team_008                       
================================================================================

[12:00] Team_090 possession (Score: 71-74)
Larry Bridges drives to the basket... FOUL! Offensive foul on Larry Bridges! Jrue Harris drew the charge! [Team fouls: 1] (Larry Bridges: 1 personal fouls) TURNOVER! (dead ball)

[11:49] Team_008 possession (Score: 71-74)
Tyrese Thompson attempts a Midrange. Contested by Gary Brogdon (4.3 feet, MAN). Tyrese Thompson misses. Rebound secured by Tracy Adebayo.

[11:33] Team_090 possession (Score: 71-74)
Gary Brogdon attempts a Midrange. Contested by Tyrese Thompson (4.2 feet, MAN). Gary Brogdon misses. Rebound secured by Khris Hyland.

[11:22] Team_008 possession (Score: 71-74)
FOUL! Reach-in foul on Gary Brogdon during the drive. [Team fouls: 2] No free throws, side out. (Gary Brogdon: 1 personal fouls)

[11:09] Team_008 possession (Score: 71-74)
Magic Young drives, Gary Brogdon stays with him. Magic Young attempts a Dunk. Heavily contested by Gary Brogdon (1.1 feet, ZONE)! Magic Young misses. Rebound secured by Tracy Adebayo.

[10:54] Team_090 possession (Score: 71-74)
Zach Wall attempts a 3Pt. Heavily contested by Victor Leonard (1.9 feet, ZONE)! Zach Wall misses. Rebound secured by Tyrese Thompson.

[10:40] Team_008 possession (Score: 71-74)
Victor Leonard attempts a Midrange. Contested by Larry Bridges (5.4 feet, ZONE). Victor Leonard misses. Rebound secured by Gary Brogdon.

[10:26] Team_090 possession (Score: 71-74)
Gary Brogdon throws a bad pass! Stolen by Tyrese Thompson! TURNOVER! (live ball)

[10:11] Team_008 possession (Score: 71-74)
Jrue Harris attempts a Midrange. Contested by Larry Bridges (3.6 feet, MAN). JRUE HARRIS MAKES IT!
Score: 71-76

[09:56] Team_090 possession (Score: 71-76)
Zach Wall attempts a 3Pt. Wide open! Khris Hyland is 6.7 feet away. [MAN] ZACH WALL MAKES IT! Assist: Tracy Adebayo
Score: 74-76

[09:42] Team_008 possession (Score: 74-76)
Tyrese Thompson drives and kicks out. Khris Hyland attempts a 3Pt. Wide open! Derrick Mitchell is 6.5 feet away. [ZONE] Khris Hyland misses. Rebound secured by Gary Brogdon.

[09:29] Team_090 possession (Score: 74-76)
Zach Wall loses control! Ball rolls out of bounds! TURNOVER! (dead ball)

[09:29] Substitution (Team_090): Derrick Mitchell OUT → OG Anunoby IN (stamina_rule2)

[09:29] Substitution (Team_090): Larry Bridges OUT → Josh Wall IN (stamina_rule2)

[09:29] Substitution (Team_090): Zach Wall OUT → Russell Smith IN (stamina_rule2)

[09:29] Substitution (Team_090): Gary Brogdon OUT → Derrick Nowitzki IN (stamina_rule2)

[09:29] Substitution (Team_090): Tracy Adebayo OUT → Tobias Tatum IN (stamina_rule2)

[09:29] Substitution (Team_008): Victor Leonard OUT → Blake Holiday IN (stamina_rule2)

[09:29] Substitution (Team_008): Jrue Harris OUT → Chris Griffin IN (stamina_rule2)

[09:29] Substitution (Team_008): Khris Hyland OUT → Immanuel Young IN (stamina_rule2)

[09:29] Substitution (Team_008): Tyrese Thompson OUT → Khris Giddey IN (stamina_rule2)

[09:29] Substitution (Team_008): Magic Young OUT → Lamelo Middleton IN (stamina_rule2)

[09:11] Team_008 possession (Score: 74-76)
Chris Griffin attempts a 3Pt. Contested by Josh Wall (4.7 feet, MAN). Chris Griffin misses. Rebound secured by Derrick Nowitzki.

[08:59] Team_090 possession (Score: 74-76)
Russell Smith attempts a 3Pt. Contested by Khris Giddey (2.8 feet, ZONE). RUSSELL SMITH MAKES IT!
Score: 77-76

[08:42] Team_008 possession (Score: 77-76)
Chris Griffin attempts a Layup. Contested by Derrick Nowitzki (2.8 feet, ZONE). CHRIS GRIFFIN MAKES IT!
Score: 77-78

[08:27] Team_090 possession (Score: 77-78)
Tobias Tatum attempts a Layup. Contested by Lamelo Middleton (3.9 feet, ZONE). Tobias Tatum misses. Rebound secured by Lamelo Middleton.

[08:13] Team_008 possession (Score: 77-78)
Immanuel Young makes the Dunk and draws the foul on Derrick Nowitzki! And-1! Immanuel Young to the line for 1. [Team fouls: 3] (Derrick Nowitzki: 1 personal fouls)   FT 1/1: GOOD Immanuel Young makes 1/1 from the line.
Score: 77-81

[07:59] Team_090 possession (Score: 77-81)
Russell Smith attempts a 3Pt. Contested by Khris Giddey (5.7 feet, ZONE). Russell Smith misses. FOUL! Loose ball foul on Khris Giddey during the rebound battle. [Team fouls: 1] No free throws, side out. (Khris Giddey: 1 personal fouls)

[07:44] Team_090 possession (Score: 77-81)
Josh Wall drives, Chris Griffin stays with him. Josh Wall attempts a Dunk. Wide open! Chris Griffin is 7.5 feet away. [MAN] JOSH WALL MAKES IT! Assist: Russell Smith
Score: 79-81

[07:30] Team_008 possession (Score: 79-81)
Khris Giddey attempts a Layup. BLOCKED BY DERRICK NOWITZKI! Ball is loose! Rebound secured by Russell Smith.

[07:12] Team_090 possession (Score: 79-81)
OG Anunoby attempts a 3Pt. Contested by Khris Giddey (4.8 feet, ZONE). OG Anunoby misses. Rebound secured by Lamelo Middleton.

[07:01] Team_008 possession (Score: 79-81)
Immanuel Young drives and kicks out. Immanuel Young attempts a 3Pt. Contested by Russell Smith (4.9 feet, ZONE). IMMANUEL YOUNG MAKES IT! Assist: Lamelo Middleton
Score: 79-84

[06:46] Team_090 possession (Score: 79-84)
Josh Wall attempts a Layup. Contested by Lamelo Middleton (5.3 feet, ZONE). JOSH WALL MAKES IT! Assist: OG Anunoby
Score: 81-84

[06:32] Team_008 possession (Score: 81-84)
Lamelo Middleton drives, Derrick Nowitzki stays with him. Lamelo Middleton attempts a Dunk. Heavily contested by Derrick Nowitzki (0.5 feet, ZONE)! LAMELO MIDDLETON MAKES IT! Assist: Khris Giddey
Score: 81-86

[06:17] Team_090 possession (Score: 81-86)
Josh Wall attempts a 3Pt. Wide open! Chris Griffin is 7.8 feet away. [MAN] JOSH WALL MAKES IT! Assist: Derrick Nowitzki
Score: 84-86

[06:00] Team_008 possession (Score: 84-86)
Blake Holiday attempts a Layup. Contested by Derrick Nowitzki (4.3 feet, ZONE). Blake Holiday misses. Offensive rebound by Lamelo Middleton! Lamelo Middleton's putback is no good. Rebound secured by Derrick Nowitzki.

[05:48] Team_090 possession (Score: 84-86)
Josh Wall makes the Layup and draws the foul on Immanuel Young! And-1! Josh Wall to the line for 1. [Team fouls: 2] (Immanuel Young: 1 personal fouls)   FT 1/1: GOOD Josh Wall makes 1/1 from the line.
Score: 87-86

[05:31] Team_008 possession (Score: 87-86)
Blake Holiday drives to the basket... FOUL! Offensive foul on Blake Holiday! OG Anunoby drew the charge! [Team fouls: 3] (Blake Holiday: 1 personal fouls) TURNOVER! (dead ball)

[05:16] Team_090 possession (Score: 87-86)
Derrick Nowitzki attempts a 3Pt. Contested by Khris Giddey (3.8 feet, ZONE). Derrick Nowitzki misses. Rebound secured by Lamelo Middleton.

[05:02] Team_008 possession (Score: 87-86)
FOUL! Shooting foul on Josh Wall. Khris Giddey to the line for 2 free throws. [Team fouls: 4] (Josh Wall: 1 personal fouls)   FT 1/2: GOOD   FT 2/2: GOOD Khris Giddey makes 2/2 from the line.
Score: 87-88

[04:51] Team_090 possession (Score: 87-88)
Tobias Tatum drives and kicks out. FOUL! Shooting foul on Khris Giddey. OG Anunoby to the line for 3 free throws. [Team fouls: 4] (Khris Giddey: 2 personal fouls)   FT 1/3: GOOD   FT 2/3: GOOD   FT 3/3: GOOD OG Anunoby makes 3/3 from the line.
Score: 90-88

[04:35] Team_008 possession (Score: 90-88)
Chris Griffin attempts a 3Pt. Wide open! Josh Wall is 6.6 feet away. [MAN] Chris Griffin misses. Rebound secured by Tobias Tatum.

[04:23] Team_090 possession (Score: 90-88)
Tobias Tatum drives, picks up Lamelo Middleton. Help arrives from Chris Griffin! Tobias Tatum attempts a Dunk. Contested by Chris Griffin (2.9 feet, MAN). TOBIAS TATUM MAKES IT! Assist: OG Anunoby
Score: 92-88

[04:06] Team_008 possession (Score: 92-88)
Blake Holiday drives to the basket... Blake Holiday throws a bad pass! Stolen by OG Anunoby! TURNOVER! (live ball)

[03:51] Team_090 possession (Score: 92-88)
OG Anunoby attempts a 3Pt. Wide open! Blake Holiday is 7.8 feet away. [MAN] OG ANUNOBY MAKES IT! Assist: Tobias Tatum
Score: 95-88

[03:35] Team_008 possession (Score: 95-88)
Chris Griffin attempts a 3Pt. Contested by Josh Wall (5.3 feet, MAN). Chris Griffin misses. Rebound secured by Russell Smith.

[03:21] Team_090 possession (Score: 95-88)
Tobias Tatum drives, Lamelo Middleton stays with him. Tobias Tatum attempts a Layup. Contested by Lamelo Middleton (4.8 feet, MAN). Tobias Tatum misses. Rebound secured by Chris Griffin.

[03:02] Team_008 possession (Score: 95-88)
Khris Giddey attempts a Layup. Contested by Derrick Nowitzki (2.3 feet, ZONE). KHRIS GIDDEY MAKES IT!
Score: 95-90

[02:51] Team_090 possession (Score: 95-90)
Derrick Nowitzki attempts a 3Pt. Wide open! Khris Giddey is 6.2 feet away. [ZONE] DERRICK NOWITZKI MAKES IT! Assist: OG Anunoby
Score: 98-90

[02:37] Team_008 possession (Score: 98-90)
Khris Giddey throws a bad pass! Stolen by Derrick Nowitzki! TURNOVER! (live ball)

[02:23] Team_090 possession (Score: 98-90)
OG Anunoby attempts a Layup. Contested by Lamelo Middleton (3.1 feet, ZONE). OG Anunoby misses. Rebound secured by Khris Giddey.

[02:08] Team_008 possession (Score: 98-90)
Blake Holiday drives, picks up Derrick Nowitzki. Help arrives from Josh Wall! Blake Holiday attempts a Dunk. Contested by Josh Wall (3.0 feet, ZONE). BLAKE HOLIDAY MAKES IT!
Score: 98-92

[01:55] Team_090 possession (Score: 98-92)
Josh Wall attempts a Layup. BLOCKED BY CHRIS GRIFFIN! Ball is loose! Rebound secured by Lamelo Middleton.

[01:39] Team_008 possession (Score: 98-92)
Khris Giddey drives, picks up Derrick Nowitzki. Help arrives from Josh Wall! Khris Giddey attempts a Dunk. Contested by Josh Wall (5.2 feet, MAN). KHRIS GIDDEY MAKES IT!
Score: 98-94

[01:29] Team_090 possession (Score: 98-94)
OG Anunoby attempts a Midrange. Contested by Lamelo Middleton (3.9 feet, ZONE). OG ANUNOBY MAKES IT! Assist: Josh Wall
Score: 100-94

[01:15] Team_008 possession (Score: 100-94)
Blake Holiday attempts a 3Pt. Contested by OG Anunoby (5.4 feet, MAN). Blake Holiday misses. Rebound secured by Derrick Nowitzki.

[01:00] Team_090 possession (Score: 100-94)
OG Anunoby attempts a Midrange. Wide open! Blake Holiday is 6.9 feet away. [MAN] OG ANUNOBY MAKES IT! Assist: Derrick Nowitzki
Score: 102-94

[00:42] Team_008 possession (Score: 102-94)
FOUL! Reach-in foul on Tobias Tatum during the drive. [IN THE BONUS! 5 team fouls] Lamelo Middleton to the line for 2 free throws. (Tobias Tatum: 1 personal fouls)   FT 1/2: MISS   FT 2/2: GOOD Lamelo Middleton makes 1/2 from the line.
Score: 102-95

[00:25] Team_090 possession (Score: 102-95)
Tobias Tatum drives to the basket... Tobias Tatum loses the ball! Stripped by Lamelo Middleton! TURNOVER! (live ball)

[00:08] Team_008 possession (Score: 102-95)
Blake Holiday drives, picks up Derrick Nowitzki. Help arrives from Josh Wall! Blake Holiday attempts a Dunk. Heavily contested by Josh Wall (1.3 feet, ZONE)! BLAKE HOLIDAY MAKES IT! Assist: Khris Giddey
Score: 102-97

================================================================================
                              4TH QUARTER COMPLETE                              
================================================================================

4TH QUARTER SCORE: Team_090 31, Team_008 23

BOX SCORE:
================================================================================

Team_090
--------------------------------------------------------------------------------
Player                MIN  PTS  REB  AST  TO      FG   FG%      3P   3P%
--------------------------------------------------------------------------------
Josh Wall              17   10    0    1   0   4/5    80.0     0/0   0.0
OG Anunoby             17   10    0    3   0   4/6    66.7     0/0   0.0
Zach Wall              32    3    0    0   0   1/2    50.0     0/0   0.0
Derrick Nowitzki       17    3    3    2   0   1/2    50.0     0/0   0.0
Russell Smith          17    3    3    1   0   1/1   100.0     0/0   0.0
Tobias Tatum           17    2    1    1   0   1/3    33.3     0/0   0.0
Tracy Adebayo          31    0    2    1   0   0/0     0.0     0/0   0.0
Gary Brogdon           31    0    2    0   0   0/1     0.0     0/0   0.0

TEAM: FG: 12/20 (60.0%), 3PT: 5/8 (62.5%), REB: 10 (1 off, 9 def), AST: 9, TO: 4
TEAM FOULS: 5 [Team_008 in BONUS]


Team_008
--------------------------------------------------------------------------------
Player                MIN  PTS  REB  AST  TO      FG   FG%      3P   3P%
--------------------------------------------------------------------------------
Immanuel Young         17    6    0    0   0   2/2   100.0     0/0   0.0
Khris Giddey           17    6    1    2   0   3/4    75.0     0/0   0.0
Blake Holiday          17    4    0    0   0   2/4    50.0     0/0   0.0
Lamelo Middleton       17    3    4    1   0   2/2   100.0     0/0   0.0
Jrue Harris            31    2    0    0   0   1/1   100.0     0/0   0.0
Chris Griffin          17    2    1    0   0   1/4    25.0     0/0   0.0
Tyrese Thompson        31    0    1    0   0   0/2     0.0     0/0   0.0
Khris Hyland           31    0    1    0   0   0/0     0.0     0/0   0.0
Magic Young            31    0    0    0   0   0/1     0.0     0/0   0.0
Victor Leonard         31    0    0    0   0   0/1     0.0     0/0   0.0

TEAM: FG: 11/21 (52.4%), 3PT: 0/4 (0.0%), REB: 9 (1 off, 8 def), AST: 3, TO: 3
TEAM FOULS: 4

================================================================================

================================================================================
                               FULL GAME COMPLETE                               
================================================================================

FINAL SCORE: Team_090 102, Team_008 97

SCORING BY QUARTER:
--------------------------------------------------------------------------------
Team                     Q1     Q2     Q3     Q4    FINAL
--------------------------------------------------------------------------------
Team_090                 15     27     29     31      102
Team_008                 24     32     18     23       97
--------------------------------------------------------------------------------

FULL GAME BOX SCORE:
================================================================================

Team_090
--------------------------------------------------------------------------------
Player                MIN  PTS  REB  AST  TO      FG   FG%      3P   3P%      FT STL BLK
--------------------------------------------------------------------------------
Derrick Mitchell       32   17    0    1   0   6/9    66.7   4/6    66.7   1/1     1   0
Zach Wall              32    8    6    2   3   3/5    60.0   2/4    50.0   1/2     1   0
Larry Bridges          31   19    0    3   3   7/15   46.7   1/4    25.0   4/5     1   0
Gary Brogdon           31    5    6    3   4   3/9    33.3   1/2    50.0   0/0     0   0
Tracy Adebayo          31    9   16    4   0   3/5    60.0   1/1   100.0   4/4     0   0
Josh Wall              17   15    0    1   1   6/7    85.7   2/2   100.0   1/1     0   0
Derrick Nowitzki       17    6    3    3   0   2/6    33.3   1/3    33.3   1/1     1   2
Tobias Tatum           17    6    2    1   1   4/8    50.0   0/0     0.0   0/0     0   0
OG Anunoby             17   10    0    3   1   3/7    42.9   1/4    25.0   3/3     1   0
Russell Smith          17    5    5    2   0   2/3    66.7   1/2    50.0   0/0     0   0

TEAM: FG: 39/74 (52.7%), 3PT: 14/28 (50.0%), REB: 36 (10 off, 26 def), AST: 23, TO: 13


Team_008
--------------------------------------------------------------------------------
Player                MIN  PTS  REB  AST  TO      FG   FG%      3P   3P%      FT STL BLK
--------------------------------------------------------------------------------
Victor Leonard         31   11    0    2   2   6/9    66.7   2/2   100.0   4/7     0   0
Jrue Harris            31   15    0    1   1   7/9    77.8   2/3    66.7   2/3     0   0
Khris Hyland           31    9    8    3   3   3/7    42.9   2/5    40.0   2/3     0   0
Tyrese Thompson        31   10   13    0   0   6/10   60.0   1/1   100.0   0/0     2   1
Magic Young            31    8   11    3   1   3/10   30.0   0/1     0.0   2/2     0   0
Blake Holiday          17    9    0    0   0   4/6    66.7   1/2    50.0   0/0     0   0
Chris Griffin          17    2    4    1   2   2/5    40.0   1/4    25.0   0/0     0   1
Immanuel Young         17   14    0    1   0   5/6    83.3   1/1   100.0   4/4     1   0
Khris Giddey           17    8    4    3   1   4/6    66.7   0/0     0.0   2/2     0   0
Lamelo Middleton       17    9    9    2   2   4/5    80.0   0/0     0.0   3/4     2   2

TEAM: FG: 44/73 (60.3%), 3PT: 10/19 (52.6%), REB: 51 (17 off, 34 def), AST: 16, TO: 12

================================================================================
