================================================================================
                        FULL GAME - Team_059 vs Team_037                        
================================================================================

================================================================================
                       1ST QUARTER - Team_059 vs Team_037                       
================================================================================

[12:00] Team_059 possession (Score: 0-0)
Bam Wade attempts a 3Pt. Contested by RJ Mitchell (4.7 feet, MAN). Bam Wade misses. Offensive rebound by John Iverson! John Iverson kicks it out.

[11:43] Team_059 possession (Score: 0-0)
Nikola Jokic attempts a Layup. Contested by Scottie Jackson (5.8 feet, ZONE). NIKOLA JOKIC MAKES IT! Assist: John Iverson
Score: 2-0

[11:26] Team_037 possession (Score: 2-0)
Jarrett Tatum attempts a 3Pt. Wide open! John Iverson is 6.1 feet away. [MAN] JARRETT TATUM MAKES IT! Assist: Scottie Jackson
Score: 2-3

[11:13] Team_059 possession (Score: 2-3)
John Iverson attempts a 3Pt. Contested by Jarrett Tatum (4.3 feet, MAN). JOHN IVERSON MAKES IT! Assist: Nikola Jokic
Score: 5-3

[10:56] Team_037 possession (Score: 5-3)
FOUL! Holding foul on John Iverson. [Team fouls: 1] No free throws, side out. (John Iverson: 1 personal fouls)

[10:44] Team_037 possession (Score: 5-3)
Jarrett Tatum attempts a 3Pt. Contested by John Iverson (4.5 feet, MAN). Jarrett Tatum misses. Rebound secured by Jarrett Smith.

[10:28] Team_059 possession (Score: 5-3)
Nikola Jokic attempts a 3Pt. Contested by Scottie Jackson (2.4 feet, ZONE). Nikola Jokic misses. Rebound secured by Collin Young.

[10:16] Team_037 possession (Score: 5-3)
Jarrett Tatum drives and kicks out. Scottie Jackson attempts a 3Pt. Contested by Nikola Jokic (2.2 feet, MAN). Scottie Jackson misses. Rebound secured by Bam Wade.

[10:02] Team_059 possession (Score: 5-3)
Jarrett Smith drives and kicks out. Blake Tatum attempts a 3Pt. Contested by Giannis Middleton (3.9 feet, MAN). BLAKE TATUM MAKES IT!
Score: 8-3

[09:47] Team_037 possession (Score: 8-3)
Giannis Middleton attempts a 3Pt. Contested by Blake Tatum (3.8 feet, MAN). Giannis Middleton misses. Rebound secured by Jarrett Smith.

[09:37] Team_059 possession (Score: 8-3)
FOUL! Shooting foul on RJ Mitchell. Bam Wade to the line for 2 free throws. [Team fouls: 1] (RJ Mitchell: 1 personal fouls)   FT 1/2: MISS   FT 2/2: GOOD Bam Wade makes 1/2 from the line.
Score: 9-3

[09:22] Team_037 possession (Score: 9-3)
FOUL! Shooting foul on Blake Tatum. RJ Mitchell to the line for 2 free throws. [Team fouls: 2] (Blake Tatum: 1 personal fouls)   FT 1/2: GOOD   FT 2/2: MISS RJ Mitchell makes 1/2 from the line. Offensive rebound by Collin Young! Collin Young's putback is no good.
Score: 9-4

[09:10] Team_059 possession (Score: 9-4)
Jarrett Smith attempts a Midrange. BLOCKED BY COLLIN YOUNG! Ball goes out off Collin Young. Jarrett Smith's ball!

[08:53] Team_059 possession (Score: 9-4)
Jarrett Smith drives to the basket... Jarrett Smith loses the ball! Stripped by Collin Young! TURNOVER! (live ball)

[08:37] Team_037 possession (Score: 9-4)
RJ Mitchell commits a violation (traveling/carry)! TURNOVER! (dead ball)

[08:20] Team_059 possession (Score: 9-4)
Nikola Jokic attempts a 3Pt. Contested by Scottie Jackson (2.2 feet, ZONE). Nikola Jokic misses. Rebound secured by Scottie Jackson.

[08:07] Team_037 possession (Score: 9-4)
Collin Young drives and kicks out. RJ Mitchell attempts a Midrange. Heavily contested by Bam Wade (1.7 feet, MAN)! RJ Mitchell misses. Rebound secured by Bam Wade.

[07:56] Team_059 possession (Score: 9-4)
Jarrett Smith drives to the basket... Jarrett Smith throws a bad pass out of bounds! TURNOVER! (dead ball)

[07:39] Team_037 possession (Score: 9-4)
Scottie Jackson drives to the basket... FOUL! Offensive foul on Scottie Jackson! Nikola Jokic drew the charge! [Team fouls: 2] (Scottie Jackson: 1 personal fouls) TURNOVER! (dead ball)

[07:24] Team_059 possession (Score: 9-4)
Jarrett Smith attempts a Layup. Contested by Collin Young (3.5 feet, MAN). JARRETT SMITH MAKES IT!
Score: 11-4

[07:09] Team_037 possession (Score: 11-4)
Giannis Middleton attempts a 3Pt. Wide open! Blake Tatum is 6.4 feet away. [MAN] GIANNIS MIDDLETON MAKES IT! Assist: Scottie Jackson
Score: 11-7

[06:57] Team_059 possession (Score: 11-7)
Nikola Jokic attempts a 3Pt. Heavily contested by Scottie Jackson (1.7 feet, MAN)! Nikola Jokic misses. Offensive rebound by John Iverson! John Iverson kicks it out.

[06:44] Team_059 possession (Score: 11-7)
Jarrett Smith attempts a Layup. Contested by Scottie Jackson (5.9 feet, ZONE). JARRETT SMITH MAKES IT! Assist: Nikola Jokic
Score: 13-7

[06:31] Team_037 possession (Score: 13-7)
Collin Young attempts a Midrange. Contested by John Iverson (5.0 feet, ZONE). COLLIN YOUNG MAKES IT! Assist: Jarrett Tatum
Score: 13-9

[06:16] Team_059 possession (Score: 13-9)
Jarrett Smith drives, Scottie Jackson stays with him. Jarrett Smith attempts a Dunk. Contested by Scottie Jackson (3.9 feet, ZONE). JARRETT SMITH MAKES IT! Assist: John Iverson
Score: 15-9

[05:58] Team_037 possession (Score: 15-9)
Collin Young drives and kicks out. Scottie Jackson attempts a 3Pt. Contested by Bam Wade (3.0 feet, ZONE). Scottie Jackson misses. Rebound secured by Jarrett Smith.

[05:43] Team_059 possession (Score: 15-9)
FOUL! Reach-in foul on RJ Mitchell during the drive. [Team fouls: 3] No free throws, side out. (RJ Mitchell: 2 personal fouls)

[05:29] Team_059 possession (Score: 15-9)
Jarrett Smith makes the Layup and draws the foul on Scottie Jackson! And-1! Jarrett Smith to the line for 1. [Team fouls: 4] (Scottie Jackson: 2 personal fouls)   FT 1/1: GOOD Jarrett Smith makes 1/1 from the line.
Score: 18-9

[05:10] Team_037 possession (Score: 18-9)
Scottie Jackson attempts a Midrange. Contested by Nikola Jokic (2.5 feet, ZONE). Scottie Jackson misses. Rebound secured by Bam Wade.

[04:56] Team_059 possession (Score: 18-9)
Bam Wade attempts a 3Pt. Contested by RJ Mitchell (6.0 feet, MAN). Bam Wade misses. Rebound secured by Jarrett Tatum.

[04:43] Team_037 possession (Score: 18-9)
Collin Young attempts a Midrange. Contested by Jarrett Smith (3.5 feet, MAN). COLLIN YOUNG MAKES IT! Assist: Scottie Jackson
Score: 18-11

[04:32] Team_059 possession (Score: 18-11)
Jarrett Smith drives and kicks out. John Iverson attempts a Midrange. Heavily contested by Scottie Jackson (0.5 feet, ZONE)! John Iverson misses. Rebound secured by Scottie Jackson.

[04:18] Team_037 possession (Score: 18-11)
FOUL! Reach-in foul on Jarrett Smith during the drive. [Team fouls: 3] No free throws, side out. (Jarrett Smith: 1 personal fouls)

[04:05] Team_037 possession (Score: 18-11)
RJ Mitchell drives, picks up Nikola Jokic. Help arrives from Bam Wade! RJ Mitchell attempts a Layup. Wide open! Bam Wade is 6.7 feet away. [ZONE] RJ Mitchell misses. Rebound secured by John Iverson.

[03:51] Team_059 possession (Score: 18-11)
Blake Tatum attempts a 3Pt. Wide open! Giannis Middleton is 6.5 feet away. [MAN] BLAKE TATUM MAKES IT!
Score: 21-11

[03:40] Team_037 possession (Score: 21-11)
Jarrett Tatum drives, Jarrett Smith stays with him. Jarrett Tatum attempts a Layup. Heavily contested by Jarrett Smith (1.2 feet, ZONE)! Jarrett Tatum misses. Rebound secured by Jarrett Smith.

[03:28] Team_059 possession (Score: 21-11)
John Iverson drives and kicks out. Nikola Jokic attempts a 3Pt. Contested by Scottie Jackson (2.3 feet, MAN). Nikola Jokic misses. Offensive rebound by Jarrett Smith! Jarrett Smith kicks it out.

[03:13] Team_059 possession (Score: 21-11)
Blake Tatum commits a violation (traveling/carry)! TURNOVER! (dead ball)

[03:13] Substitution (Team_059): John Iverson OUT → Allen Giddey IN (stamina_rule2)

[03:13] Substitution (Team_037): Collin Young OUT → Wendell Herro IN (stamina_rule2)

[02:56] Team_037 possession (Score: 21-11)
RJ Mitchell attempts a Midrange. Wide open! Blake Tatum is 6.4 feet away. [ZONE] RJ Mitchell misses. Rebound secured by Nikola Jokic.

[02:40] Team_059 possession (Score: 21-11)
Allen Giddey drives to the basket... FOUL! Offensive foul on Allen Giddey! Scottie Jackson drew the charge! [Team fouls: 4] (Allen Giddey: 1 personal fouls) TURNOVER! (dead ball)

[02:24] Team_037 possession (Score: 21-11)
Scottie Jackson drives and kicks out. RJ Mitchell attempts a 3Pt. Contested by Bam Wade (5.0 feet, ZONE). RJ MITCHELL MAKES IT! Assist: Jarrett Tatum
Score: 21-14

[02:09] Team_059 possession (Score: 21-14)
Nikola Jokic attempts a Midrange. Contested by Scottie Jackson (3.2 feet, MAN). Nikola Jokic misses. Rebound secured by Scottie Jackson.

[01:55] Team_037 possession (Score: 21-14)
RJ Mitchell attempts a 3Pt. Contested by Bam Wade (4.3 feet, MAN). RJ Mitchell misses. Rebound secured by Nikola Jokic.

[01:39] Team_059 possession (Score: 21-14)
Jarrett Smith drives and kicks out. Nikola Jokic attempts a Midrange. Contested by Scottie Jackson (5.5 feet, MAN). Nikola Jokic misses. Rebound secured by Wendell Herro.

[01:26] Team_037 possession (Score: 21-14)
RJ Mitchell attempts a 3Pt. Contested by Bam Wade (4.1 feet, MAN). RJ Mitchell misses. Offensive rebound by Jarrett Tatum! Jarrett Tatum kicks it out.

[01:15] Team_037 possession (Score: 21-14)
Scottie Jackson drives to the basket... FOUL! Offensive foul on Scottie Jackson! Jarrett Smith drew the charge! [Team fouls: 5] (Scottie Jackson: 3 personal fouls) TURNOVER! (dead ball)

[00:59] Team_059 possession (Score: 21-14)
Nikola Jokic drives and kicks out. Jarrett Smith attempts a Midrange. Wide open! Wendell Herro is 6.4 feet away. [ZONE] JARRETT SMITH MAKES IT!
Score: 23-14

[00:47] Team_037 possession (Score: 23-14)
Scottie Jackson attempts a 3Pt. Wide open! Bam Wade is 6.2 feet away. [ZONE] Scottie Jackson misses. Rebound secured by Jarrett Smith.

[00:37] Team_059 possession (Score: 23-14)
Blake Tatum attempts a 3Pt. Contested by Giannis Middleton (5.2 feet, MAN). Blake Tatum misses. Rebound secured by Jarrett Tatum.

[00:22] Team_037 possession (Score: 23-14)
Scottie Jackson throws a bad pass out of bounds! TURNOVER! (dead ball)

[00:22] Substitution (Team_059): Bam Wade OUT → Russell Quickley IN (stamina_rule2)

[00:22] Substitution (Team_059): Blake Tatum OUT → Scottie Ginobili IN (stamina_rule2)

[00:22] Substitution (Team_059): Nikola Jokic OUT → Bones Middleton IN (stamina_rule2)

[00:22] Substitution (Team_059): Jarrett Smith OUT → LeBron Lowry IN (stamina_rule2)

[00:22] Substitution (Team_037): RJ Mitchell OUT → Jarrett Randle IN (stamina_rule2)

[00:22] Substitution (Team_037): Giannis Middleton OUT → Collin Trent IN (stamina_rule2)

[00:22] Substitution (Team_037): Jarrett Tatum OUT → Julius Bird IN (stamina_rule2)

[00:22] Substitution (Team_037): Scottie Jackson OUT → Russell Anthony IN (stamina_rule2)

[00:11] Team_059 possession (Score: 23-14)
Scottie Ginobili attempts a 3Pt. Wide open! Collin Trent is 6.6 feet away. [MAN] Scottie Ginobili misses. Rebound secured by Russell Anthony.

================================================================================
                              1ST QUARTER COMPLETE                              
================================================================================

1ST QUARTER SCORE: Team_059 23, Team_037 14

BOX SCORE:
================================================================================

Team_059
--------------------------------------------------------------------------------
Player                MIN  PTS  REB  AST  TO      FG   FG%      3P   3P%
--------------------------------------------------------------------------------
Jarrett Smith          12   11    6    0   0   5/7    71.4     0/0   0.0
Blake Tatum            12    6    0    0   0   2/3    66.7     0/0   0.0
John Iverson            9    3    3    2   0   1/1   100.0     0/0   0.0
Nikola Jokic           12    2    2    2   0   1/4    25.0     0/0   0.0
Bam Wade               12    1    3    0   0   1/2    50.0     0/0   0.0
Scottie Ginobili        0    0    0    0   0   0/1     0.0     0/0   0.0

TEAM: FG: 10/18 (55.6%), 3PT: 2/7 (28.6%), REB: 15 (3 off, 12 def), AST: 4, TO: 4
TEAM FOULS: 4


Team_037
--------------------------------------------------------------------------------
Player                MIN  PTS  REB  AST  TO      FG   FG%      3P   3P%
--------------------------------------------------------------------------------
Collin Young            9    4    2    0   0   2/4    50.0     0/0   0.0
Jarrett Tatum          12    3    3    2   0   1/4    25.0     0/0   0.0
Giannis Middleton      12    3    0    0   0   1/2    50.0     0/0   0.0
RJ Mitchell            12    3    0    0   0   1/5    20.0     0/0   0.0
Scottie Jackson        12    0    3    3   0   0/2     0.0     0/0   0.0
Wendell Herro           3    0    1    0   0   0/0     0.0     0/0   0.0
Russell Anthony         0    0    1    0   0   0/0     0.0     0/0   0.0

TEAM: FG: 5/17 (29.4%), 3PT: 2/6 (33.3%), REB: 9 (1 off, 8 def), AST: 5, TO: 4
TEAM FOULS: 5 [Team_059 in BONUS]

================================================================================

================================================================================
                       2ND QUARTER - Team_059 vs Team_037                       
================================================================================

[12:00] Substitution (Team_059): Bam Wade OUT → Russell Quickley IN (stamina_rule2)

[12:00] Substitution (Team_059): Blake Tatum OUT → Scottie Ginobili IN (stamina_rule2)

[12:00] Substitution (Team_037): RJ Mitchell OUT → Jarrett Randle IN (stamina_rule2)

[12:00] Substitution (Team_037): Jarrett Tatum OUT → Julius Bird IN (stamina_rule2)

[12:00] Team_059 possession (Score: 23-14)
Blake Tatum drives to the basket... Blake Tatum throws a bad pass out of bounds! TURNOVER! (dead ball)

[11:43] Team_037 possession (Score: 23-14)
Julius Bird attempts a Layup. Contested by John Iverson (4.1 feet, MAN). JULIUS BIRD MAKES IT!
Score: 23-16

[11:28] Team_059 possession (Score: 23-16)
Jarrett Smith drives to the basket... Jarrett Smith throws a bad pass out of bounds! TURNOVER! (dead ball)

[11:28] Substitution (Team_059): Nikola Jokic OUT → Bones Middleton IN (stamina_rule2)

[11:28] Substitution (Team_059): Jarrett Smith OUT → LeBron Lowry IN (stamina_rule2)

[11:28] Substitution (Team_037): Giannis Middleton OUT → Collin Trent IN (stamina_rule2)

[11:28] Substitution (Team_037): Scottie Jackson OUT → Russell Anthony IN (stamina_rule2)

[11:17] Team_037 possession (Score: 23-16)
Julius Bird attempts a Layup. BLOCKED BY JOHN IVERSON! Ball is loose! Rebound secured by Scottie Ginobili.

[11:03] Team_059 possession (Score: 23-16)
Russell Quickley attempts a 3Pt. Contested by Jarrett Randle (3.9 feet, MAN). Russell Quickley misses. Rebound secured by Collin Young.

[10:54] Team_037 possession (Score: 23-16)
Russell Anthony throws a bad pass out of bounds! TURNOVER! (dead ball)

[10:41] Team_059 possession (Score: 23-16)
FOUL! Holding foul on Russell Anthony. [Team fouls: 1] No free throws, side out. (Russell Anthony: 1 personal fouls)

[10:27] Team_059 possession (Score: 23-16)
Scottie Ginobili attempts a 3Pt. Wide open! Collin Trent is 6.4 feet away. [MAN] Scottie Ginobili misses. Rebound secured by Collin Young.

[10:13] Team_037 possession (Score: 23-16)
Collin Young attempts a 3Pt. Wide open! LeBron Lowry is 6.1 feet away. [MAN] Collin Young misses. Rebound secured by Bones Middleton.

[09:58] Team_059 possession (Score: 23-16)
LeBron Lowry attempts a Layup. Heavily contested by Collin Young (1.2 feet, MAN)! LeBron Lowry misses. Offensive rebound by Scottie Ginobili! Scottie Ginobili kicks it out.

[09:46] Team_059 possession (Score: 23-16)
Russell Quickley attempts a 3Pt. Contested by Jarrett Randle (4.7 feet, ZONE). Russell Quickley misses. Offensive rebound by Scottie Ginobili! Scottie Ginobili kicks it out.

[09:32] Team_059 possession (Score: 23-16)
LeBron Lowry attempts a Midrange. Contested by Collin Young (2.1 feet, MAN). LeBron Lowry misses. Rebound secured by Collin Young.

[09:15] Team_037 possession (Score: 23-16)
FOUL! Shooting foul on Bones Middleton. Russell Anthony to the line for 2 free throws. [Team fouls: 1] (Bones Middleton: 1 personal fouls)   FT 1/2: GOOD   FT 2/2: MISS Russell Anthony makes 1/2 from the line. Offensive rebound by Russell Anthony! Russell Anthony's putback is no good.
Score: 23-17

[09:05] Team_059 possession (Score: 23-17)
Russell Quickley throws a bad pass out of bounds! TURNOVER! (dead ball)

[09:05] Substitution (Team_059): John Iverson OUT → Allen Giddey IN (stamina_rule2)

[09:05] Substitution (Team_037): Collin Young OUT → Wendell Herro IN (stamina_rule2)

[08:49] Team_037 possession (Score: 23-17)
Jarrett Randle attempts a 3Pt. Contested by Russell Quickley (4.9 feet, MAN). Jarrett Randle misses. FOUL! Loose ball foul on Scottie Ginobili during the rebound battle. [Team fouls: 2] No free throws, side out. (Scottie Ginobili: 1 personal fouls)

[08:34] Team_037 possession (Score: 23-17)
Collin Trent drives, Scottie Ginobili stays with him. Collin Trent attempts a Layup. Contested by Scottie Ginobili (4.9 feet, MAN). COLLIN TRENT MAKES IT!
Score: 23-19

[08:20] Team_059 possession (Score: 23-19)
Scottie Ginobili drives, picks up Collin Trent. Help arrives from Julius Bird! Scottie Ginobili attempts a Dunk. Contested by Julius Bird (2.3 feet, MAN). Scottie Ginobili misses. Rebound secured by Julius Bird.

[08:10] Team_037 possession (Score: 23-19)
Wendell Herro attempts a Layup. Wide open! LeBron Lowry is 7.2 feet away. [MAN] WENDELL HERRO MAKES IT!
Score: 23-21

[07:56] Team_059 possession (Score: 23-21)
Scottie Ginobili attempts a Midrange. Contested by Collin Trent (5.7 feet, MAN). Scottie Ginobili misses. Rebound secured by Wendell Herro.

[07:44] Team_037 possession (Score: 23-21)
Jarrett Randle attempts a Midrange. Wide open! Bones Middleton is 7.9 feet away. [ZONE] JARRETT RANDLE MAKES IT! Assist: Julius Bird
Score: 23-23

[07:25] Team_059 possession (Score: 23-23)
LeBron Lowry attempts a 3Pt. Contested by Julius Bird (5.0 feet, ZONE). LeBron Lowry misses. Rebound secured by Wendell Herro.

[07:06] Team_037 possession (Score: 23-23)
Wendell Herro drives and kicks out. Collin Trent attempts a 3Pt. Contested by Russell Quickley (3.7 feet, ZONE). Collin Trent misses. Rebound secured by LeBron Lowry.

[06:56] Team_059 possession (Score: 23-23)
LeBron Lowry throws a bad pass! Stolen by Russell Anthony! TURNOVER! (live ball)

[06:43] Team_037 possession (Score: 23-23)
Julius Bird attempts a 3Pt. Contested by Russell Quickley (4.7 feet, ZONE). JULIUS BIRD MAKES IT! Assist: Collin Trent
Score: 23-26

[06:27] Team_059 possession (Score: 23-26)
Scottie Ginobili drives and kicks out. Bones Middleton attempts a Midrange. Contested by Russell Anthony (5.0 feet, MAN). Bones Middleton misses. Rebound secured by Russell Anthony.

[06:13] Team_037 possession (Score: 23-26)
Collin Trent loses the ball! Stripped by Scottie Ginobili! TURNOVER! (live ball)

[05:56] Team_059 possession (Score: 23-26)
Scottie Ginobili drives and kicks out. Allen Giddey attempts a Midrange. Contested by Julius Bird (3.2 feet, MAN). ALLEN GIDDEY MAKES IT!
Score: 25-26

[05:44] Team_037 possession (Score: 25-26)
Collin Trent drives and kicks out. Collin Trent attempts a 3Pt. Contested by Russell Quickley (3.3 feet, ZONE). Collin Trent misses. Offensive rebound by Julius Bird! Julius Bird kicks it out.

[05:28] Team_037 possession (Score: 25-26)
Collin Trent attempts a 3Pt. Contested by Scottie Ginobili (5.0 feet, MAN). Collin Trent misses. Rebound secured by Scottie Ginobili.

[05:15] Team_059 possession (Score: 25-26)
Scottie Ginobili attempts a Layup. Contested by Collin Trent (3.8 feet, MAN). SCOTTIE GINOBILI MAKES IT!
Score: 27-26

[05:00] Team_037 possession (Score: 27-26)
Jarrett Randle attempts a 3Pt. Contested by Russell Quickley (5.3 feet, ZONE). JARRETT RANDLE MAKES IT!
Score: 27-29

[04:48] Team_059 possession (Score: 27-29)
LeBron Lowry attempts a Layup. Heavily contested by Russell Anthony (1.3 feet, MAN)! LEBRON LOWRY MAKES IT! Assist: Allen Giddey
Score: 29-29

[04:32] Team_037 possession (Score: 29-29)
Collin Trent attempts a 3Pt. Contested by Russell Quickley (4.7 feet, ZONE). Collin Trent misses. Rebound secured by Scottie Ginobili.

[04:16] Team_059 possession (Score: 29-29)
LeBron Lowry drives and kicks out. Allen Giddey attempts a 3Pt. Contested by Jarrett Randle (2.7 feet, ZONE). Allen Giddey misses. Rebound secured by Russell Anthony.

[03:59] Team_037 possession (Score: 29-29)
Wendell Herro attempts a Layup. Wide open! Bones Middleton is 6.1 feet away. [ZONE] Wendell Herro misses. Offensive rebound by Julius Bird! Julius Bird kicks it out.

[03:45] Team_037 possession (Score: 29-29)
Wendell Herro drives, picks up Bones Middleton. Help arrives from Scottie Ginobili! Wendell Herro attempts a Layup. Contested by Scottie Ginobili (3.9 feet, ZONE). WENDELL HERRO MAKES IT!
Score: 29-31

[03:36] Team_059 possession (Score: 29-31)
Russell Quickley makes the Layup and draws the foul on Jarrett Randle! And-1! Russell Quickley to the line for 1. [Team fouls: 2] (Jarrett Randle: 1 personal fouls)   FT 1/1: GOOD Russell Quickley makes 1/1 from the line.
Score: 32-31

[03:23] Team_037 possession (Score: 32-31)
Jarrett Randle attempts a 3Pt. Contested by Russell Quickley (5.2 feet, ZONE). Jarrett Randle misses. Rebound secured by Scottie Ginobili.

[03:09] Team_059 possession (Score: 32-31)
Russell Quickley attempts a 3Pt. Heavily contested by Jarrett Randle (2.0 feet, MAN)! Russell Quickley misses. Offensive rebound by Bones Middleton! Bones Middleton kicks it out.

[02:51] Team_059 possession (Score: 32-31)
FOUL! Shooting foul on Russell Anthony. Scottie Ginobili to the line for 2 free throws. [Team fouls: 3] (Russell Anthony: 2 personal fouls)   FT 1/2: MISS   FT 2/2: GOOD Scottie Ginobili makes 1/2 from the line.
Score: 33-31

[02:34] Team_037 possession (Score: 33-31)
Jarrett Randle attempts a 3Pt. Contested by Russell Quickley (2.6 feet, MAN). Jarrett Randle misses. Rebound secured by Bones Middleton.

[02:16] Team_059 possession (Score: 33-31)
Bones Middleton drives and kicks out. Allen Giddey attempts a Midrange. Contested by Julius Bird (5.5 feet, MAN). Allen Giddey misses. Rebound secured by Julius Bird.

[02:01] Team_037 possession (Score: 33-31)
Russell Anthony makes the Layup and draws the foul on Bones Middleton! And-1! Russell Anthony to the line for 1. [Team fouls: 3] (Bones Middleton: 2 personal fouls)   FT 1/1: GOOD Russell Anthony makes 1/1 from the line.
Score: 33-34

[01:47] Team_059 possession (Score: 33-34)
Bones Middleton attempts a 3Pt. Contested by Russell Anthony (2.5 feet, MAN). Bones Middleton misses. Rebound secured by Russell Anthony.

[01:32] Team_037 possession (Score: 33-34)
Julius Bird attempts a 3Pt. Contested by Russell Quickley (4.1 feet, ZONE). Julius Bird misses. Rebound secured by Scottie Ginobili.

[01:18] Team_059 possession (Score: 33-34)
LeBron Lowry drives, picks up Russell Anthony. Help arrives from Collin Trent! LeBron Lowry attempts a Layup. Wide open! Collin Trent is 6.1 feet away. [MAN] LeBron Lowry misses. Rebound secured by Wendell Herro.

[01:03] Team_037 possession (Score: 33-34)
Russell Anthony drives and kicks out. Wendell Herro attempts a 3Pt. Contested by Russell Quickley (5.2 feet, ZONE). Wendell Herro misses. Rebound secured by Scottie Ginobili.

[00:47] Team_059 possession (Score: 33-34)
Scottie Ginobili attempts a Midrange. Contested by Julius Bird (3.7 feet, ZONE). Scottie Ginobili misses. Rebound secured by Julius Bird.

[00:33] Team_037 possession (Score: 33-34)
FOUL! Shooting foul on Scottie Ginobili. Russell Anthony to the line for 2 free throws. [Team fouls: 4] (Scottie Ginobili: 2 personal fouls)   FT 1/2: GOOD   FT 2/2: GOOD Russell Anthony makes 2/2 from the line.
Score: 33-36

[00:18] Team_059 possession (Score: 33-36)
Scottie Ginobili attempts a Layup. Contested by Collin Trent (4.7 feet, MAN). Scottie Ginobili misses. Rebound secured by Julius Bird.

[00:04] Team_037 possession (Score: 33-36)
FOUL! Shooting foul on Russell Quickley. Jarrett Randle to the line for 3 free throws. [BONUS: 5 team fouls] (Russell Quickley: 1 personal fouls)   FT 1/3: MISS   FT 2/3: GOOD   FT 3/3: MISS Jarrett Randle makes 1/3 from the line. Offensive rebound by Russell Anthony! Russell Anthony's putback is no good.
Score: 33-37

================================================================================
                              2ND QUARTER COMPLETE                              
================================================================================

2ND QUARTER SCORE: Team_059 10, Team_037 23

BOX SCORE:
================================================================================

Team_059
--------------------------------------------------------------------------------
Player                MIN  PTS  REB  AST  TO      FG   FG%      3P   3P%
--------------------------------------------------------------------------------
Russell Anthony        12    5    5    0   0   2/4    50.0     0/0   0.0
Scottie Ginobili       12    3    8    0   0   2/8    25.0     0/0   0.0
Russell Quickley       12    3    0    0   0   1/2    50.0     0/0   0.0
LeBron Lowry           12    2    1    0   0   1/5    20.0     0/0   0.0
Allen Giddey           12    2    0    1   0   1/1   100.0     0/0   0.0
Bones Middleton        12    0    3    0   0   0/2     0.0     0/0   0.0

TEAM: FG: 5/18 (27.8%), 3PT: 0/4 (0.0%), REB: 14 (3 off, 11 def), AST: 1, TO: 4
TEAM FOULS: 5 [Team_037 in BONUS]


Team_037
--------------------------------------------------------------------------------
Player                MIN  PTS  REB  AST  TO      FG   FG%      3P   3P%
--------------------------------------------------------------------------------
Julius Bird            12    5    7    1   0   2/4    50.0     0/0   0.0
Jarrett Randle         12    5    0    0   0   2/5    40.0     0/0   0.0
Wendell Herro          12    4    3    0   0   2/3    66.7     0/0   0.0
Collin Trent           12    2    0    1   0   1/3    33.3     0/0   0.0
Collin Young           12    0    3    0   0   0/1     0.0     0/0   0.0

TEAM: FG: 9/20 (45.0%), 3PT: 2/9 (22.2%), REB: 16 (3 off, 13 def), AST: 2, TO: 2
TEAM FOULS: 3

================================================================================

================================================================================
                       3RD QUARTER - Team_059 vs Team_037                       
================================================================================

[12:00] Team_059 possession (Score: 33-37)
Nikola Jokic attempts a 3Pt. Contested by Scottie Jackson (4.3 feet, ZONE). Nikola Jokic misses. Rebound secured by Collin Young.

[11:41] Team_037 possession (Score: 33-37)
Collin Young attempts a Layup. Heavily contested by Jarrett Smith (1.1 feet, ZONE)! COLLIN YOUNG MAKES IT! Assist: Scottie Jackson
Score: 33-39

[11:28] Team_059 possession (Score: 33-39)
Nikola Jokic attempts a Midrange. BLOCKED BY JARRETT TATUM! Ball is loose! Rebound secured by Collin Young.

[11:13] Team_037 possession (Score: 33-39)
Scottie Jackson attempts a Layup. BLOCKED BY JARRETT SMITH! Ball is loose! Rebound secured by Bam Wade.

[10:55] Team_059 possession (Score: 33-39)
Blake Tatum attempts a 3Pt. Contested by Scottie Jackson (3.0 feet, ZONE). Blake Tatum misses. Rebound secured by Scottie Jackson.

[10:43] Team_037 possession (Score: 33-39)
RJ Mitchell drives, Jarrett Smith stays with him. RJ Mitchell attempts a Layup. Contested by Jarrett Smith (3.0 feet, ZONE). RJ Mitchell misses. Rebound secured by Jarrett Smith.

[10:28] Team_059 possession (Score: 33-39)
Bam Wade drives, Scottie Jackson stays with him. Bam Wade attempts a Layup. Heavily contested by Scottie Jackson (0.5 feet, ZONE)! BAM WADE MAKES IT!
Score: 35-39

[10:13] Team_037 possession (Score: 35-39)
Giannis Middleton drives, Blake Tatum stays with him. Giannis Middleton attempts a Dunk. Contested by Blake Tatum (3.0 feet, MAN). Giannis Middleton misses. Rebound secured by Jarrett Smith.

[10:01] Team_059 possession (Score: 35-39)
Bam Wade makes the Dunk and draws the foul on Scottie Jackson! And-1! Bam Wade to the line for 1. [Team fouls: 1] (Scottie Jackson: 1 personal fouls)   FT 1/1: GOOD Bam Wade makes 1/1 from the line.
Score: 38-39

[09:49] Team_037 possession (Score: 38-39)
Scottie Jackson attempts a 3Pt. Contested by Bam Wade (3.2 feet, ZONE). Scottie Jackson misses. Rebound secured by John Iverson.

[09:36] Team_059 possession (Score: 38-39)
Blake Tatum attempts a Layup. Contested by Scottie Jackson (2.6 feet, ZONE). Blake Tatum misses. Rebound secured by Collin Young.

[09:20] Team_037 possession (Score: 38-39)
Scottie Jackson attempts a 3Pt. Wide open! Bam Wade is 7.1 feet away. [ZONE] SCOTTIE JACKSON MAKES IT!
Score: 38-42

[09:10] Team_059 possession (Score: 38-42)
Nikola Jokic attempts a Midrange. Contested by Giannis Middleton (4.4 feet, ZONE). Nikola Jokic misses. Rebound secured by Collin Young.

[08:54] Team_037 possession (Score: 38-42)
RJ Mitchell attempts a 3Pt. Wide open! John Iverson is 6.7 feet away. [ZONE] RJ MITCHELL MAKES IT! Assist: Jarrett Tatum
Score: 38-45

[08:40] Team_059 possession (Score: 38-45)
John Iverson attempts a 3Pt. Contested by Scottie Jackson (2.5 feet, ZONE). John Iverson misses. Offensive rebound by John Iverson! John Iverson kicks it out.

[08:22] Team_059 possession (Score: 38-45)
John Iverson attempts a Midrange. Wide open! Jarrett Tatum is 7.8 feet away. [MAN] John Iverson misses. Offensive rebound by John Iverson! John Iverson kicks it out.

[08:10] Team_059 possession (Score: 38-45)
Jarrett Smith attempts a Midrange. Contested by Jarrett Tatum (5.3 feet, ZONE). Jarrett Smith misses. Rebound secured by Collin Young.

[07:54] Team_037 possession (Score: 38-45)
Collin Young attempts a Midrange. BLOCKED BY JARRETT SMITH! Ball is loose! Rebound secured by Jarrett Smith.

[07:37] Team_059 possession (Score: 38-45)
FOUL! Reach-in foul on Scottie Jackson during the drive. [Team fouls: 2] No free throws, side out. (Scottie Jackson: 2 personal fouls)

[07:21] Team_059 possession (Score: 38-45)
John Iverson makes the Layup and draws the foul on Scottie Jackson! And-1! John Iverson to the line for 1. [Team fouls: 3] (Scottie Jackson: 3 personal fouls)   FT 1/1: GOOD John Iverson makes 1/1 from the line.
Score: 41-45

[07:06] Team_037 possession (Score: 41-45)
Scottie Jackson attempts a Midrange. Contested by Blake Tatum (2.8 feet, ZONE). Scottie Jackson misses. Rebound secured by Bam Wade.

[06:51] Team_059 possession (Score: 41-45)
John Iverson attempts a 3Pt. Contested by RJ Mitchell (4.1 feet, ZONE). John Iverson misses. Rebound secured by Jarrett Tatum.

[06:34] Team_037 possession (Score: 41-45)
FOUL! Shooting foul on Bam Wade. RJ Mitchell to the line for 2 free throws. [Team fouls: 1] (Bam Wade: 1 personal fouls)   FT 1/2: GOOD   FT 2/2: MISS RJ Mitchell makes 1/2 from the line. Offensive rebound by Scottie Jackson! Scottie Jackson puts it back in!
Score: 41-48

[06:21] Team_059 possession (Score: 41-48)
Nikola Jokic attempts a Layup. Contested by Scottie Jackson (3.2 feet, MAN). NIKOLA JOKIC MAKES IT!
Score: 43-48

[06:10] Team_037 possession (Score: 43-48)
FOUL! Holding foul on Nikola Jokic. [Team fouls: 2] No free throws, side out. (Nikola Jokic: 1 personal fouls)

[05:55] Team_037 possession (Score: 43-48)
RJ Mitchell attempts a Midrange. Contested by Blake Tatum (5.8 feet, ZONE). RJ MITCHELL MAKES IT! Assist: Scottie Jackson
Score: 43-50

[05:43] Team_059 possession (Score: 43-50)
John Iverson throws a bad pass! Stolen by Jarrett Tatum! TURNOVER! (live ball)

[05:30] Team_037 possession (Score: 43-50)
Collin Young attempts a Layup. BLOCKED BY BAM WADE! Ball is loose! Offensive rebound by Collin Young! Collin Young kicks it out.

[05:13] Team_037 possession (Score: 43-50)
Giannis Middleton attempts a 3Pt. Wide open! Blake Tatum is 7.2 feet away. [MAN] Giannis Middleton misses. Offensive rebound by Scottie Jackson! Scottie Jackson's putback is no good. Rebound secured by Jarrett Smith.

[04:58] Team_059 possession (Score: 43-50)
Jarrett Smith attempts a Midrange. Heavily contested by Scottie Jackson (1.9 feet, ZONE)! Jarrett Smith misses. Rebound secured by Scottie Jackson.

[04:45] Team_037 possession (Score: 43-50)
RJ Mitchell attempts a Midrange. Wide open! Bam Wade is 6.3 feet away. [ZONE] RJ Mitchell misses. Offensive rebound by Collin Young! Collin Young puts it back in!
Score: 43-52

[04:29] Team_059 possession (Score: 43-52)
Jarrett Smith drives, Collin Young stays with him. Jarrett Smith attempts a Layup. Contested by Collin Young (4.9 feet, MAN). JARRETT SMITH MAKES IT! Assist: Bam Wade
Score: 45-52

[04:14] Team_037 possession (Score: 45-52)
RJ Mitchell attempts a 3Pt. Wide open! Bam Wade is 7.1 feet away. [ZONE] RJ Mitchell misses. Rebound secured by Bam Wade.

[03:58] Team_059 possession (Score: 45-52)
FOUL! Shooting foul on Collin Young. Jarrett Smith to the line for 2 free throws. [Team fouls: 4] (Collin Young: 1 personal fouls)   FT 1/2: GOOD   FT 2/2: GOOD Jarrett Smith makes 2/2 from the line.
Score: 47-52

[03:48] Team_037 possession (Score: 47-52)
Jarrett Tatum drives, Jarrett Smith stays with him. Jarrett Tatum attempts a Layup. Wide open! Jarrett Smith is 6.5 feet away. [ZONE] Jarrett Tatum misses. Rebound secured by John Iverson.

[03:33] Team_059 possession (Score: 47-52)
Jarrett Smith attempts a Midrange. Wide open! Collin Young is 6.1 feet away. [MAN] JARRETT SMITH MAKES IT! Assist: Nikola Jokic
Score: 49-52

[03:17] Team_037 possession (Score: 49-52)
RJ Mitchell drives, Jarrett Smith stays with him. RJ Mitchell attempts a Dunk. Contested by Jarrett Smith (2.3 feet, ZONE). RJ Mitchell misses. Rebound secured by John Iverson.

[03:03] Team_059 possession (Score: 49-52)
Jarrett Smith attempts a Layup. Heavily contested by Scottie Jackson (0.5 feet, ZONE)! Jarrett Smith misses. Rebound secured by Collin Young.

[02:52] Team_037 possession (Score: 49-52)
Scottie Jackson attempts a Midrange. Wide open! Nikola Jokic is 6.4 feet away. [MAN] Scottie Jackson misses. Offensive rebound by Collin Young! Collin Young's putback is no good. Rebound secured by Bam Wade.

[02:35] Team_059 possession (Score: 49-52)
FOUL! Reach-in foul on Collin Young during the drive. [IN THE BONUS! 5 team fouls] Jarrett Smith to the line for 2 free throws. (Collin Young: 2 personal fouls)   FT 1/2: MISS   FT 2/2: GOOD Jarrett Smith makes 1/2 from the line.
Score: 50-52

[02:19] Team_037 possession (Score: 50-52)
Collin Young attempts a Midrange. Wide open! John Iverson is 6.9 feet away. [ZONE] Collin Young misses. Rebound secured by Jarrett Smith.

[02:09] Team_059 possession (Score: 50-52)
Jarrett Smith drives and kicks out. Jarrett Smith attempts a 3Pt. BLOCKED BY SCOTTIE JACKSON! Ball is loose! Offensive rebound by John Iverson! John Iverson kicks it out.

[01:56] Team_059 possession (Score: 50-52)
Bam Wade attempts a Midrange. Wide open! RJ Mitchell is 7.6 feet away. [MAN] BAM WADE MAKES IT! Assist: John Iverson
Score: 52-52

[01:37] Team_037 possession (Score: 52-52)
FOUL! Shooting foul on Jarrett Smith. Collin Young to the line for 2 free throws. [Team fouls: 3] (Jarrett Smith: 1 personal fouls)   FT 1/2: GOOD   FT 2/2: MISS Collin Young makes 1/2 from the line. Rebound secured by Jarrett Smith.
Score: 52-53

[01:26] Team_059 possession (Score: 52-53)
Bam Wade attempts a 3Pt. Contested by RJ Mitchell (4.4 feet, MAN). BAM WADE MAKES IT! Assist: John Iverson
Score: 55-53

[01:12] Team_037 possession (Score: 55-53)
Giannis Middleton attempts a Midrange. Wide open! Nikola Jokic is 9.1 feet away. [ZONE] GIANNIS MIDDLETON MAKES IT!
Score: 55-55

[00:59] Team_059 possession (Score: 55-55)
Nikola Jokic attempts a Midrange. Wide open! Scottie Jackson is 6.4 feet away. [MAN] Nikola Jokic misses. Offensive rebound by Jarrett Smith! Jarrett Smith kicks it out.

[00:43] Team_059 possession (Score: 55-55)
Jarrett Smith drives and kicks out. Nikola Jokic attempts a Midrange. Contested by Scottie Jackson (3.9 feet, MAN). Nikola Jokic misses. Rebound secured by Scottie Jackson.

[00:23] Team_037 possession (Score: 55-55)
RJ Mitchell attempts a 3Pt. Contested by Bam Wade (3.1 feet, MAN). RJ Mitchell misses. Rebound secured by John Iverson.

[00:09] Team_059 possession (Score: 55-55)
Blake Tatum attempts a Layup. Contested by Giannis Middleton (3.3 feet, MAN). BLAKE TATUM MAKES IT!
Score: 57-55

================================================================================
                              3RD QUARTER COMPLETE                              
================================================================================

3RD QUARTER SCORE: Team_059 24, Team_037 18

BOX SCORE:
================================================================================

Team_059
--------------------------------------------------------------------------------
Player                MIN  PTS  REB  AST  TO      FG   FG%      3P   3P%
--------------------------------------------------------------------------------
Bam Wade               24   10    4    1   0   4/4   100.0     0/0   0.0
Jarrett Smith          25    7    7    0   0   4/8    50.0     0/0   0.0
John Iverson           24    3    7    2   0   1/2    50.0     0/0   0.0
Nikola Jokic           25    2    0    1   0   1/4    25.0     0/0   0.0
Blake Tatum            24    2    0    0   0   1/3    33.3     0/0   0.0

TEAM: FG: 11/21 (52.4%), 3PT: 1/4 (25.0%), REB: 16 (4 off, 12 def), AST: 4, TO: 1
TEAM FOULS: 3


Team_037
--------------------------------------------------------------------------------
Player                MIN  PTS  REB  AST  TO      FG   FG%      3P   3P%
--------------------------------------------------------------------------------
Scottie Jackson        25    6    3    2   0   2/6    33.3     0/0   0.0
RJ Mitchell            24    5    0    0   0   2/6    33.3     0/0   0.0
Collin Young           24    4    8    0   0   2/5    40.0     0/0   0.0
Giannis Middleton      25    2    0    0   0   1/3    33.3     0/0   0.0
Jarrett Tatum          24    0    1    1   0   0/1     0.0     0/0   0.0

TEAM: FG: 7/21 (33.3%), 3PT: 2/6 (33.3%), REB: 14 (4 off, 10 def), AST: 3, TO: 0
TEAM FOULS: 6 [Team_059 in BONUS]

================================================================================

================================================================================
                       4TH QUARTER - Team_059 vs Team_037                       
================================================================================

[12:00] Team_059 possession (Score: 57-55)
Bam Wade attempts a 3Pt. Contested by RJ Mitchell (4.9 feet, MAN). Bam Wade misses. Offensive rebound by John Iverson! John Iverson kicks it out.

[11:45] Team_059 possession (Score: 57-55)
Blake Tatum throws a bad pass! Stolen by Giannis Middleton! TURNOVER! (live ball)

[11:29] Team_037 possession (Score: 57-55)
RJ Mitchell throws a bad pass! Stolen by Bam Wade! TURNOVER! (live ball)

[11:14] Team_059 possession (Score: 57-55)
Nikola Jokic attempts a 3Pt. Contested by Scottie Jackson (4.8 feet, ZONE). Nikola Jokic misses. Rebound secured by Jarrett Tatum.

[11:00] Team_037 possession (Score: 57-55)
RJ Mitchell throws a bad pass! Stolen by Bam Wade! TURNOVER! (live ball)

[10:48] Team_059 possession (Score: 57-55)
Blake Tatum drives to the basket... FOUL! Offensive foul on Blake Tatum! Scottie Jackson drew the charge! [Team fouls: 1] (Blake Tatum: 1 personal fouls) TURNOVER! (dead ball)

[10:33] Team_037 possession (Score: 57-55)
Giannis Middleton attempts a Midrange. Contested by Blake Tatum (5.6 feet, MAN). Giannis Middleton misses. Rebound secured by John Iverson.

[10:20] Team_059 possession (Score: 57-55)
Blake Tatum attempts a 3Pt. Contested by Scottie Jackson (3.2 feet, ZONE). Blake Tatum misses. Rebound secured by Collin Young.

[10:05] Team_037 possession (Score: 57-55)
Giannis Middleton drives and kicks out. Scottie Jackson attempts a 3Pt. Contested by Nikola Jokic (3.7 feet, MAN). Scottie Jackson misses. Rebound secured by Nikola Jokic.

[09:47] Team_059 possession (Score: 57-55)
Jarrett Smith makes the Layup and draws the foul on Collin Young! And-1! Jarrett Smith to the line for 1. [Team fouls: 1] (Collin Young: 1 personal fouls)   FT 1/1: GOOD Jarrett Smith makes 1/1 from the line.
Score: 60-55

[09:35] Team_037 possession (Score: 60-55)
Giannis Middleton attempts a Midrange. Wide open! Blake Tatum is 6.6 feet away. [MAN] GIANNIS MIDDLETON MAKES IT! Assist: Scottie Jackson
Score: 60-57

[09:23] Team_059 possession (Score: 60-57)
Blake Tatum drives to the basket... FOUL! Offensive foul on Blake Tatum! Giannis Middleton drew the charge! [Team fouls: 2] (Blake Tatum: 2 personal fouls) TURNOVER! (dead ball)

[09:10] Team_037 possession (Score: 60-57)
Scottie Jackson commits a violation (traveling/carry)! TURNOVER! (dead ball)

[09:10] Substitution (Team_059): Bam Wade OUT → Russell Quickley IN (stamina_rule2)

[09:10] Substitution (Team_059): Blake Tatum OUT → Scottie Ginobili IN (stamina_rule2)

[09:10] Substitution (Team_059): John Iverson OUT → Allen Giddey IN (stamina_rule2)

[09:10] Substitution (Team_059): Nikola Jokic OUT → Bones Middleton IN (stamina_rule2)

[09:10] Substitution (Team_059): Jarrett Smith OUT → LeBron Lowry IN (stamina_rule2)

[09:10] Substitution (Team_037): RJ Mitchell OUT → Jarrett Randle IN (stamina_rule2)

[09:10] Substitution (Team_037): Giannis Middleton OUT → Collin Trent IN (stamina_rule2)

[09:10] Substitution (Team_037): Jarrett Tatum OUT → Julius Bird IN (stamina_rule2)

[09:10] Substitution (Team_037): Scottie Jackson OUT → Russell Anthony IN (stamina_rule2)

[09:10] Substitution (Team_037): Collin Young OUT → Wendell Herro IN (stamina_rule2)

[08:53] Team_059 possession (Score: 60-57)
Scottie Ginobili attempts a Midrange. Wide open! Collin Trent is 6.2 feet away. [ZONE] Scottie Ginobili misses. Offensive rebound by Bones Middleton! Bones Middleton kicks it out.

[08:38] Team_059 possession (Score: 60-57)
Bones Middleton attempts a Layup. BLOCKED BY RUSSELL ANTHONY! Ball is loose! Rebound secured by Wendell Herro.

[08:23] Team_037 possession (Score: 60-57)
Wendell Herro makes the Layup and draws the foul on Bones Middleton! And-1! Wendell Herro to the line for 1. [Team fouls: 3] (Bones Middleton: 1 personal fouls)   FT 1/1: GOOD Wendell Herro makes 1/1 from the line.
Score: 60-60

[08:11] Team_059 possession (Score: 60-60)
Allen Giddey attempts a Layup. Contested by Julius Bird (2.3 feet, MAN). ALLEN GIDDEY MAKES IT!
Score: 62-60

[07:55] Team_037 possession (Score: 62-60)
Wendell Herro throws a bad pass out of bounds! TURNOVER! (dead ball)

[07:39] Team_059 possession (Score: 62-60)
Bones Middleton attempts a Layup. Contested by Russell Anthony (3.3 feet, ZONE). BONES MIDDLETON MAKES IT! Assist: Allen Giddey
Score: 64-60

[07:19] Team_037 possession (Score: 64-60)
Wendell Herro attempts a Layup. BLOCKED BY LEBRON LOWRY! Ball is loose! Offensive rebound by Russell Anthony! Russell Anthony kicks it out.

[07:07] Team_037 possession (Score: 64-60)
Jarrett Randle attempts a Midrange. Contested by Russell Quickley (4.5 feet, MAN). JARRETT RANDLE MAKES IT!
Score: 64-62

[06:51] Team_059 possession (Score: 64-62)
Allen Giddey loses control! Ball rolls out of bounds! TURNOVER! (dead ball)

[06:34] Team_037 possession (Score: 64-62)
Collin Trent attempts a 3Pt. Wide open! Russell Quickley is 6.6 feet away. [ZONE] COLLIN TRENT MAKES IT! Assist: Wendell Herro
Score: 64-65

[06:19] Team_059 possession (Score: 64-65)
Russell Quickley makes the Midrange and draws the foul on Julius Bird! And-1! Russell Quickley to the line for 1. [Team fouls: 2] (Julius Bird: 1 personal fouls)   FT 1/1: GOOD Russell Quickley makes 1/1 from the line.
Score: 67-65

[06:03] Team_037 possession (Score: 67-65)
Julius Bird drives and kicks out. FOUL! Shooting foul on Bones Middleton. Russell Anthony to the line for 3 free throws. [Team fouls: 4] (Bones Middleton: 2 personal fouls)   FT 1/3: GOOD   FT 2/3: GOOD   FT 3/3: GOOD Russell Anthony makes 3/3 from the line.
Score: 67-68

[05:47] Team_059 possession (Score: 67-68)
Bones Middleton attempts a 3Pt. Contested by Russell Anthony (3.2 feet, MAN). BONES MIDDLETON MAKES IT! Assist: Allen Giddey
Score: 70-68

[05:34] Team_037 possession (Score: 70-68)
Jarrett Randle drives and kicks out. Wendell Herro attempts a 3Pt. Contested by Russell Quickley (4.6 feet, ZONE). Wendell Herro misses. Rebound secured by LeBron Lowry.

[05:20] Team_059 possession (Score: 70-68)
Bones Middleton attempts a 3Pt. Wide open! Russell Anthony is 6.7 feet away. [MAN] Bones Middleton misses. Rebound secured by Julius Bird.

[05:04] Team_037 possession (Score: 70-68)
FOUL! Holding foul on Scottie Ginobili. [IN THE BONUS! 5 team fouls] Collin Trent to the line for 2 free throws. (Scottie Ginobili: 1 personal fouls)   FT 1/2: GOOD   FT 2/2: GOOD Collin Trent makes 2/2 from the line.
Score: 70-70

[04:47] Team_059 possession (Score: 70-70)
Scottie Ginobili attempts a Midrange. Contested by Julius Bird (4.0 feet, ZONE). SCOTTIE GINOBILI MAKES IT! Assist: Russell Quickley
Score: 72-70

[04:34] Team_037 possession (Score: 72-70)
Jarrett Randle attempts a 3Pt. Wide open! Russell Quickley is 8.0 feet away. [MAN] Jarrett Randle misses. Rebound secured by Bones Middleton.

[04:17] Team_059 possession (Score: 72-70)
Allen Giddey attempts a Midrange. Contested by Julius Bird (2.4 feet, MAN). ALLEN GIDDEY MAKES IT!
Score: 74-70

[04:04] Team_037 possession (Score: 74-70)
Wendell Herro attempts a Layup. BLOCKED BY LEBRON LOWRY! Ball goes out off LeBron Lowry. Wendell Herro's ball!

[03:51] Team_037 possession (Score: 74-70)
Russell Anthony drives, Bones Middleton stays with him. Russell Anthony attempts a Dunk. Contested by Bones Middleton (2.4 feet, MAN). RUSSELL ANTHONY MAKES IT! Assist: Jarrett Randle
Score: 74-72

[03:33] Team_059 possession (Score: 74-72)
Allen Giddey attempts a Midrange. Contested by Julius Bird (3.3 feet, MAN). ALLEN GIDDEY MAKES IT! Assist: LeBron Lowry
Score: 76-72

[03:19] Team_037 possession (Score: 76-72)
Russell Anthony attempts a Midrange. Contested by Bones Middleton (5.8 feet, ZONE). RUSSELL ANTHONY MAKES IT! Assist: Jarrett Randle
Score: 76-74

[03:04] Team_059 possession (Score: 76-74)
Bones Middleton attempts a Midrange. Wide open! Julius Bird is 6.1 feet away. [ZONE] BONES MIDDLETON MAKES IT! Assist: Allen Giddey
Score: 78-74

[02:49] Team_037 possession (Score: 78-74)
Russell Anthony attempts a Midrange. Contested by Bones Middleton (5.8 feet, MAN). RUSSELL ANTHONY MAKES IT! Assist: Julius Bird
Score: 78-76

[02:33] Team_059 possession (Score: 78-76)
Allen Giddey attempts a Midrange. Contested by Julius Bird (4.4 feet, MAN). ALLEN GIDDEY MAKES IT! Assist: LeBron Lowry
Score: 80-76

[02:17] Team_037 possession (Score: 80-76)
Julius Bird attempts a 3Pt. Wide open! Allen Giddey is 6.1 feet away. [MAN] Julius Bird misses. Rebound secured by Scottie Ginobili.

[02:05] Team_059 possession (Score: 80-76)
Russell Quickley drives to the basket... Russell Quickley loses control! Ball rolls out of bounds! TURNOVER! (dead ball)

[01:47] Team_037 possession (Score: 80-76)
Julius Bird attempts a 3Pt. Wide open! Allen Giddey is 7.1 feet away. [ZONE] Julius Bird misses. Rebound secured by LeBron Lowry.

[01:31] Team_059 possession (Score: 80-76)
Scottie Ginobili attempts a Midrange. Wide open! Collin Trent is 10.0 feet away. [MAN] Scottie Ginobili misses. Offensive rebound by Scottie Ginobili! Scottie Ginobili kicks it out.

[01:16] Team_059 possession (Score: 80-76)
Bones Middleton makes the Layup and draws the foul on Russell Anthony! And-1! Bones Middleton to the line for 1. [Team fouls: 3] (Russell Anthony: 1 personal fouls)   FT 1/1: MISS Bones Middleton makes 0/1 from the line. Rebound secured by Wendell Herro.
Score: 82-76

[01:00] Team_037 possession (Score: 82-76)
Julius Bird attempts a 3Pt. Wide open! Allen Giddey is 9.6 feet away. [MAN] Julius Bird misses. Rebound secured by Scottie Ginobili.

[00:43] Team_059 possession (Score: 82-76)
LeBron Lowry drives, Russell Anthony stays with him. LeBron Lowry attempts a Layup. Contested by Russell Anthony (5.8 feet, ZONE). LEBRON LOWRY MAKES IT! Assist: Bones Middleton
Score: 84-76

[00:28] Team_037 possession (Score: 84-76)
Collin Trent drives to the basket... Collin Trent throws a bad pass out of bounds! TURNOVER! (dead ball)

[00:12] Team_059 possession (Score: 84-76)
Scottie Ginobili attempts a 3Pt. Wide open! Jarrett Randle is 8.6 feet away. [ZONE] SCOTTIE GINOBILI MAKES IT! Assist: Allen Giddey
Score: 87-76

================================================================================
                              4TH QUARTER COMPLETE                              
================================================================================

4TH QUARTER SCORE: Team_059 30, Team_037 21

BOX SCORE:
================================================================================

Team_059
--------------------------------------------------------------------------------
Player                MIN  PTS  REB  AST  TO      FG   FG%      3P   3P%
--------------------------------------------------------------------------------
Allen Giddey           21    8    0    4   0   4/4   100.0     0/0   0.0
Bones Middleton        21    7    2    1   0   3/6    50.0     0/0   0.0
Scottie Ginobili       21    5    3    0   0   2/2   100.0     0/0   0.0
Jarrett Smith          28    3    0    0   0   1/1   100.0     0/0   0.0
Russell Quickley       21    3    0    1   0   1/1   100.0     0/0   0.0
LeBron Lowry           21    2    2    2   0   1/1   100.0     0/0   0.0
John Iverson           27    0    2    0   0   0/0     0.0     0/0   0.0
Nikola Jokic           28    0    1    0   0   0/1     0.0     0/0   0.0
Blake Tatum            27    0    0    0   0   0/1     0.0     0/0   0.0

TEAM: FG: 12/17 (70.6%), 3PT: 2/5 (40.0%), REB: 10 (3 off, 7 def), AST: 8, TO: 5
TEAM FOULS: 5 [Team_037 in BONUS]


Team_037
--------------------------------------------------------------------------------
Player                MIN  PTS  REB  AST  TO      FG   FG%      3P   3P%
--------------------------------------------------------------------------------
Russell Anthony        21    9    1    0   0   4/4   100.0     0/0   0.0
Collin Trent           21    5    0    0   0   2/2   100.0     0/0   0.0
Wendell Herro          21    3    2    1   0   1/1   100.0     0/0   0.0
Giannis Middleton      28    2    0    0   0   1/3    33.3     0/0   0.0
Jarrett Randle         21    2    0    2   0   1/3    33.3     0/0   0.0
Jarrett Tatum          27    0    1    0   0   0/0     0.0     0/0   0.0
Collin Young           27    0    1    0   0   0/0     0.0     0/0   0.0
Scottie Jackson        28    0    0    1   0   0/0     0.0     0/0   0.0
Julius Bird            21    0    1    1   0   0/3     0.0     0/0   0.0

TEAM: FG: 9/16 (56.2%), 3PT: 1/5 (20.0%), REB: 6 (1 off, 5 def), AST: 5, TO: 5
TEAM FOULS: 3

================================================================================

================================================================================
                               FULL GAME COMPLETE                               
================================================================================

FINAL SCORE: Team_059 87, Team_037 76

SCORING BY QUARTER:
--------------------------------------------------------------------------------
Team                     Q1     Q2     Q3     Q4    FINAL
--------------------------------------------------------------------------------
Team_059                 23     10     24     30       87
Team_037                 14     23     18     21       76
--------------------------------------------------------------------------------

FULL GAME BOX SCORE:
================================================================================

Team_059
--------------------------------------------------------------------------------
Player                MIN  PTS  REB  AST  TO      FG   FG%      3P   3P%      FT STL BLK
--------------------------------------------------------------------------------
Nikola Jokic           28    4    3    3   3   3/10   30.0   0/4     0.0   0/0     0   0
Jarrett Smith          28   21   13    0   1  10/16   62.5   0/0     0.0   5/6     0   2
John Iverson           27    6   12    4   1   2/3    66.7   1/2    50.0   1/1     0   1
Bam Wade               27   11    7    1   1   5/6    83.3   1/2    50.0   2/3     2   1
Blake Tatum            27    8    0    0   3   2/6    33.3   1/4    25.0   0/0     0   0
Russell Quickley       21    6    0    1   1   2/3    66.7   0/1     0.0   2/2     0   0
Scottie Ginobili       21    8   11    0   1   5/12   41.7   1/3    33.3   1/2     1   0
Allen Giddey           21   10    0    5   1   4/4   100.0   0/0     0.0   0/0     0   0
Bones Middleton        21    7    5    1   1   3/8    37.5   1/3    33.3   0/1     0   0
LeBron Lowry           21    4    3    2   1   2/6    33.3   0/1     0.0   0/0     0   2

TEAM: FG: 38/74 (51.4%), 3PT: 5/20 (25.0%), REB: 55 (13 off, 42 def), AST: 17, TO: 14


Team_037
--------------------------------------------------------------------------------
Player                MIN  PTS  REB  AST  TO      FG   FG%      3P   3P%      FT STL BLK
--------------------------------------------------------------------------------
Giannis Middleton      28    7    0    0   1   3/8    37.5   1/3    33.3   0/0     1   0
Scottie Jackson        28    6    7    6   2   2/8    25.0   1/3    33.3   0/0     0   1
Collin Young           27    8   14    0   0   3/9    33.3   0/1     0.0   1/2     1   1
RJ Mitchell            27    8    0    0   4   4/12   33.3   1/4    25.0   2/4     0   0
Jarrett Tatum          27    3    5    3   0   1/5    20.0   1/2    50.0   0/0     1   1
Jarrett Randle         21    7    0    2   0   3/8    37.5   1/5    20.0   1/3     0   0
Julius Bird            21    5    8    2   0   3/8    37.5   1/5    20.0   0/0     0   0
Wendell Herro          21    7    6    1   1   3/4    75.0   0/0     0.0   1/1     0   0
Collin Trent           21    7    0    1   1   2/4    50.0   1/3    33.3   2/2     0   0
Russell Anthony        21   14    7    0   2   5/7    71.4   0/0     0.0   7/8     1   1

TEAM: FG: 30/74 (40.5%), 3PT: 7/26 (26.9%), REB: 45 (9 off, 36 def), AST: 15, TO: 11

================================================================================
