================================================================================
                        FULL GAME - Team_022 vs Team_031                        
================================================================================

================================================================================
                       1ST QUARTER - Team_022 vs Team_031                       
================================================================================

[12:00] Team_022 possession (Score: 0-0)
Lamelo Dosunmu throws a bad pass out of bounds! TURNOVER! (dead ball)

[11:47] Team_031 possession (Score: 0-0)
FOUL! Reach-in foul on Lamelo Dosunmu during the drive. [Team fouls: 1] No free throws, side out. (Lamelo Dosunmu: 1 personal fouls)

[11:32] Team_031 possession (Score: 0-0)
Shai Durant attempts a 3Pt. Contested by Malcolm Allen (4.0 feet, MAN). Shai Durant misses. Rebound secured by Myles Anthony.

[11:20] Team_022 possession (Score: 0-0)
Michael Ginobili attempts a 3Pt. Contested by Gary Morant (4.7 feet, MAN). Michael Ginobili misses. Rebound secured by Gary Morant.

[11:04] Team_031 possession (Score: 0-0)
Gary Morant makes the Layup and draws the foul on Dirk Markkanen! And-1! Gary Morant to the line for 1. [Team fouls: 2] (Dirk Markkanen: 1 personal fouls)   FT 1/1: MISS Gary Morant makes 0/1 from the line. Offensive rebound by Immanuel James! Immanuel James puts it back in!
Score: 0-4

[10:48] Team_022 possession (Score: 0-4)
Dirk Markkanen attempts a Dunk. BLOCKED BY LUKA SABONIS! Ball deflects out of bounds off Dirk Markkanen.

[10:34] Team_031 possession (Score: 0-4)
FOUL! Shooting foul on Dirk Markkanen. Immanuel James to the line for 2 free throws. [Team fouls: 3] (Dirk Markkanen: 2 personal fouls)   FT 1/2: GOOD   FT 2/2: MISS Immanuel James makes 1/2 from the line. Rebound secured by Dirk Markkanen.
Score: 0-5

[10:22] Team_022 possession (Score: 0-5)
Malcolm Allen drives, picks up Shai Durant. Help arrives from Pau Irving! Malcolm Allen attempts a Layup. Contested by Pau Irving (3.8 feet, MAN). MALCOLM ALLEN MAKES IT!
Score: 2-5

[10:07] Team_031 possession (Score: 2-5)
Gary Morant makes the Midrange and draws the foul on Michael Ginobili! And-1! Gary Morant to the line for 1. [Team fouls: 4] (Michael Ginobili: 1 personal fouls)   FT 1/1: GOOD Gary Morant makes 1/1 from the line.
Score: 2-8

[09:56] Team_022 possession (Score: 2-8)
Dirk Markkanen loses control! Ball rolls out of bounds! TURNOVER! (dead ball)

[09:42] Team_031 possession (Score: 2-8)
FOUL! Holding foul on Dirk Markkanen. [IN THE BONUS! 5 team fouls] Luka Sabonis to the line for 2 free throws. (Dirk Markkanen: 3 personal fouls)   FT 1/2: GOOD   FT 2/2: MISS Luka Sabonis makes 1/2 from the line. Rebound secured by Dirk Markkanen.
Score: 2-9

[09:25] Team_022 possession (Score: 2-9)
Lamelo Dosunmu drives, Immanuel James stays with him. Lamelo Dosunmu attempts a Layup. Heavily contested by Immanuel James (1.2 feet, MAN)! LAMELO DOSUNMU MAKES IT!
Score: 4-9

[09:12] Team_031 possession (Score: 4-9)
Immanuel James attempts a 3Pt. Wide open! Michael Ginobili is 6.9 feet away. [ZONE] Immanuel James misses. Offensive rebound by Luka Sabonis! Luka Sabonis's putback is no good. Offensive rebound by Luka Sabonis! Luka Sabonis kicks it out.

[09:00] Team_031 possession (Score: 4-9)
Pau Irving attempts a 3Pt. Contested by Myles Anthony (3.7 feet, MAN). PAU IRVING MAKES IT! Assist: Luka Sabonis
Score: 4-12

[08:45] Team_022 possession (Score: 4-12)
Michael Ginobili attempts a Midrange. Contested by Gary Morant (3.7 feet, MAN). Michael Ginobili misses. Rebound secured by Luka Sabonis.

[08:26] Team_031 possession (Score: 4-12)
Luka Sabonis attempts a 3Pt. Contested by Dirk Markkanen (3.2 feet, MAN). Luka Sabonis misses. Rebound secured by Myles Anthony.

[08:12] Team_022 possession (Score: 4-12)
Michael Ginobili drives and kicks out. Malcolm Allen attempts a Midrange. Contested by Shai Durant (5.9 feet, ZONE). MALCOLM ALLEN MAKES IT! Assist: Lamelo Dosunmu
Score: 6-12

[08:00] Team_031 possession (Score: 6-12)
Gary Morant drives, Lamelo Dosunmu stays with him. Gary Morant attempts a Dunk. Wide open! Lamelo Dosunmu is 6.8 feet away. [ZONE] Gary Morant misses. Rebound secured by Myles Anthony.

[07:49] Team_022 possession (Score: 6-12)
Malcolm Allen makes the Dunk and draws the foul on Shai Durant! And-1! Malcolm Allen to the line for 1. [Team fouls: 1] (Shai Durant: 1 personal fouls)   FT 1/1: GOOD Malcolm Allen makes 1/1 from the line.
Score: 9-12

[07:33] Team_031 possession (Score: 9-12)
Pau Irving attempts a 3Pt. Contested by Myles Anthony (5.7 feet, MAN). PAU IRVING MAKES IT! Assist: Gary Morant
Score: 9-15

[07:16] Team_022 possession (Score: 9-15)
FOUL! Reach-in foul on Luka Sabonis during the drive. [Team fouls: 2] No free throws, side out. (Luka Sabonis: 1 personal fouls)

[07:04] Team_022 possession (Score: 9-15)
Michael Ginobili attempts a Midrange. Heavily contested by Immanuel James (1.7 feet, ZONE)! Michael Ginobili misses. Rebound secured by Luka Sabonis.

[06:46] Team_031 possession (Score: 9-15)
Luka Sabonis loses control! Ball rolls out of bounds! TURNOVER! (dead ball)

[06:33] Team_022 possession (Score: 9-15)
Michael Ginobili attempts a Layup. Contested by Immanuel James (2.8 feet, ZONE). MICHAEL GINOBILI MAKES IT!
Score: 11-15

[06:19] Team_031 possession (Score: 11-15)
Gary Morant drives and kicks out. Pau Irving attempts a 3Pt. Wide open! Myles Anthony is 6.6 feet away. [MAN] PAU IRVING MAKES IT! Assist: Gary Morant
Score: 11-18

[06:04] Team_022 possession (Score: 11-18)
Myles Anthony drives and kicks out. Michael Ginobili attempts a 3Pt. Contested by Gary Morant (2.5 feet, MAN). Michael Ginobili misses. Offensive rebound by Dirk Markkanen! Dirk Markkanen's putback is no good. Rebound secured by Gary Morant.

[05:48] Team_031 possession (Score: 11-18)
Shai Durant drives, Malcolm Allen stays with him. Shai Durant attempts a Dunk. Contested by Malcolm Allen (2.2 feet, MAN). SHAI DURANT MAKES IT! Assist: Immanuel James
Score: 11-20

[05:32] Team_022 possession (Score: 11-20)
Dirk Markkanen drives to the basket... Dirk Markkanen commits a violation (traveling/carry)! TURNOVER! (dead ball)

[05:15] Team_031 possession (Score: 11-20)
Shai Durant attempts a Midrange. Heavily contested by Malcolm Allen (1.5 feet, MAN)! SHAI DURANT MAKES IT! Assist: Immanuel James
Score: 11-22

[04:58] Team_022 possession (Score: 11-22)
Myles Anthony loses control! Ball rolls out of bounds! TURNOVER! (dead ball)

[04:43] Team_031 possession (Score: 11-22)
Pau Irving throws a bad pass out of bounds! TURNOVER! (dead ball)

[04:31] Team_022 possession (Score: 11-22)
Myles Anthony drives, picks up Pau Irving. Help arrives from Shai Durant! Myles Anthony attempts a Dunk. Contested by Shai Durant (2.8 feet, MAN). MYLES ANTHONY MAKES IT! Assist: Malcolm Allen
Score: 13-22

[04:13] Team_031 possession (Score: 13-22)
Pau Irving attempts a 3Pt. Contested by Myles Anthony (4.1 feet, MAN). Pau Irving misses. Rebound secured by Dirk Markkanen.

[04:01] Team_022 possession (Score: 13-22)
Michael Ginobili attempts a Layup. Contested by Gary Morant (2.7 feet, MAN). MICHAEL GINOBILI MAKES IT!
Score: 15-22

[03:48] Team_031 possession (Score: 15-22)
Pau Irving makes the Midrange and draws the foul on Myles Anthony! And-1! Pau Irving to the line for 1. [BONUS: 6 team fouls] (Myles Anthony: 1 personal fouls)   FT 1/1: GOOD Pau Irving makes 1/1 from the line.
Score: 15-25

[03:39] Team_022 possession (Score: 15-25)
Malcolm Allen attempts a 3Pt. Wide open! Shai Durant is 7.0 feet away. [MAN] Malcolm Allen misses. FOUL! Loose ball foul on Gary Morant during the rebound battle. [Team fouls: 3] No free throws, side out. (Gary Morant: 1 personal fouls)

[03:23] Team_022 possession (Score: 15-25)
Michael Ginobili makes the Layup and draws the foul on Immanuel James! And-1! Michael Ginobili to the line for 1. [Team fouls: 4] (Immanuel James: 1 personal fouls)   FT 1/1: GOOD Michael Ginobili makes 1/1 from the line.
Score: 18-25

[03:07] Team_031 possession (Score: 18-25)
Luka Sabonis drives and kicks out. Luka Sabonis attempts a Midrange. Contested by Lamelo Dosunmu (5.5 feet, ZONE). Luka Sabonis misses. Rebound secured by Dirk Markkanen.

[02:51] Team_022 possession (Score: 18-25)
Myles Anthony attempts a 3Pt. Wide open! Pau Irving is 7.6 feet away. [ZONE] Myles Anthony misses. Rebound secured by Immanuel James.

[02:39] Team_031 possession (Score: 18-25)
FOUL! Reach-in foul on Dirk Markkanen during the drive. [IN THE BONUS! 7 team fouls] Luka Sabonis to the line for 2 free throws. (Dirk Markkanen: 4 personal fouls)   FT 1/2: MISS   FT 2/2: GOOD Luka Sabonis makes 1/2 from the line.
Score: 18-26

[02:21] Team_022 possession (Score: 18-26)
Michael Ginobili attempts a 3Pt. Heavily contested by Gary Morant (1.6 feet, MAN)! Michael Ginobili misses. Rebound secured by Gary Morant.

[02:04] Team_031 possession (Score: 18-26)
Immanuel James drives, picks up Lamelo Dosunmu. Help arrives from Michael Ginobili! Immanuel James attempts a Layup. Contested by Michael Ginobili (5.2 feet, MAN). IMMANUEL JAMES MAKES IT!
Score: 18-28

[01:54] Team_022 possession (Score: 18-28)
Michael Ginobili attempts a 3Pt. Contested by Pau Irving (4.5 feet, ZONE). Michael Ginobili misses. Rebound secured by Luka Sabonis.

[01:44] Team_031 possession (Score: 18-28)
Shai Durant attempts a 3Pt. Contested by Michael Ginobili (3.1 feet, ZONE). SHAI DURANT MAKES IT! Assist: Immanuel James
Score: 18-31

[01:31] Team_022 possession (Score: 18-31)
Myles Anthony attempts a Midrange. Contested by Pau Irving (2.6 feet, MAN). Myles Anthony misses. Rebound secured by Immanuel James.

[01:16] Team_031 possession (Score: 18-31)
Immanuel James drives and kicks out. Gary Morant attempts a Midrange. Heavily contested by Michael Ginobili (1.4 feet, MAN)! GARY MORANT MAKES IT!
Score: 18-33

[01:01] Team_022 possession (Score: 18-33)
Myles Anthony makes the Layup and draws the foul on Immanuel James! And-1! Myles Anthony to the line for 1. [BONUS: 5 team fouls] (Immanuel James: 2 personal fouls)   FT 1/1: GOOD Myles Anthony makes 1/1 from the line.
Score: 21-33

[00:48] Team_031 possession (Score: 21-33)
Luka Sabonis attempts a Midrange. Contested by Lamelo Dosunmu (5.2 feet, ZONE). Luka Sabonis misses. Offensive rebound by Immanuel James! Immanuel James kicks it out.

[00:34] Team_031 possession (Score: 21-33)
Luka Sabonis attempts a Layup. Contested by Dirk Markkanen (3.3 feet, ZONE). LUKA SABONIS MAKES IT! Assist: Immanuel James
Score: 21-35

[00:18] Team_022 possession (Score: 21-35)
FOUL! Reach-in foul on Immanuel James during the drive. [IN THE BONUS! 6 team fouls] Dirk Markkanen to the line for 2 free throws. (Immanuel James: 3 personal fouls)   FT 1/2: MISS   FT 2/2: GOOD Dirk Markkanen makes 1/2 from the line.
Score: 22-35

[00:06] Team_031 possession (Score: 22-35)
Shai Durant drives, picks up Dirk Markkanen. Help arrives from Michael Ginobili! Shai Durant attempts a Layup. Contested by Michael Ginobili (3.0 feet, ZONE). Shai Durant misses. FOUL! Loose ball foul on Myles Anthony during the rebound battle. [IN THE BONUS! 8 team fouls] Immanuel James to the line for 2 free throws. (Myles Anthony: 2 personal fouls)   FT 1/2: GOOD   FT 2/2: GOOD Immanuel James makes 2/2 from the line.
Score: 22-37

================================================================================
                              1ST QUARTER COMPLETE                              
================================================================================

1ST QUARTER SCORE: Team_022 22, Team_031 37

BOX SCORE:
================================================================================

Team_022
--------------------------------------------------------------------------------
Player                MIN  PTS  REB  AST  TO      FG   FG%      3P   3P%
--------------------------------------------------------------------------------
Michael Ginobili       12    7    1    0   0   3/8    37.5     0/0   0.0
Malcolm Allen          12    7    0    1   0   3/3   100.0     0/0   0.0
Myles Anthony          12    5    3    0   0   2/5    40.0     0/0   0.0
Lamelo Dosunmu         12    2    0    1   0   1/1   100.0     0/0   0.0
Dirk Markkanen         12    1    4    0   0   1/2    50.0     0/0   0.0

TEAM: FG: 10/19 (52.6%), 3PT: 0/4 (0.0%), REB: 9 (2 off, 7 def), AST: 2, TO: 4
TEAM FOULS: 8 [Team_031 in BONUS]


Team_031
--------------------------------------------------------------------------------
Player                MIN  PTS  REB  AST  TO      FG   FG%      3P   3P%
--------------------------------------------------------------------------------
Pau Irving             12   12    0    0   0   4/5    80.0     0/0   0.0
Immanuel James         12    8    3    4   0   3/4    75.0     0/0   0.0
Shai Durant            12    7    0    0   0   3/4    75.0     0/0   0.0
Gary Morant            12    5    3    2   0   2/3    66.7     0/0   0.0
Luka Sabonis           12    3    4    1   0   2/4    50.0     0/0   0.0

TEAM: FG: 14/21 (66.7%), 3PT: 3/6 (50.0%), REB: 9 (2 off, 7 def), AST: 7, TO: 2
TEAM FOULS: 6 [Team_022 in BONUS]

================================================================================

================================================================================
                       2ND QUARTER - Team_022 vs Team_031                       
================================================================================

[12:00] Team_022 possession (Score: 22-37)
Lamelo Dosunmu attempts a 3Pt. Contested by Pau Irving (2.5 feet, ZONE). Lamelo Dosunmu misses. Offensive rebound by Michael Ginobili! Michael Ginobili kicks it out.

[11:47] Team_022 possession (Score: 22-37)
Dirk Markkanen attempts a 3Pt. Contested by Pau Irving (3.9 feet, ZONE). Dirk Markkanen misses. Offensive rebound by Dirk Markkanen! Dirk Markkanen puts it back in!
Score: 24-37

[11:31] Team_031 possession (Score: 24-37)
FOUL! Reach-in foul on Malcolm Allen during the drive. [Team fouls: 1] No free throws, side out. (Malcolm Allen: 1 personal fouls)

[11:12] Team_031 possession (Score: 24-37)
Gary Morant drives to the basket... FOUL! Offensive foul on Gary Morant! Michael Ginobili drew the charge! [Team fouls: 1] (Gary Morant: 1 personal fouls) TURNOVER! (dead ball)

[10:59] Team_022 possession (Score: 24-37)
Malcolm Allen drives, picks up Shai Durant. Help arrives from Pau Irving! Malcolm Allen attempts a Layup. Contested by Pau Irving (5.6 feet, MAN). Malcolm Allen misses. Offensive rebound by Dirk Markkanen! Dirk Markkanen puts it back in!
Score: 26-37

[10:43] Team_031 possession (Score: 26-37)
Luka Sabonis drives to the basket... FOUL! Offensive foul on Luka Sabonis! Dirk Markkanen drew the charge! [Team fouls: 2] (Luka Sabonis: 1 personal fouls) TURNOVER! (dead ball)

[10:29] Team_022 possession (Score: 26-37)
Lamelo Dosunmu throws a bad pass out of bounds! TURNOVER! (dead ball)

[10:29] Substitution (Team_022): Malcolm Allen OUT → DeMar Harden IN (stamina_rule2)

[10:29] Substitution (Team_022): Michael Ginobili OUT → Lauri Gobert IN (stamina_rule2)

[10:29] Substitution (Team_022): Myles Anthony OUT → Dejounte Towns IN (stamina_rule2)

[10:29] Substitution (Team_022): Lamelo Dosunmu OUT → Kawhi Russell IN (stamina_rule2)

[10:29] Substitution (Team_022): Dirk Markkanen OUT → Cole Iverson IN (stamina_rule2)

[10:29] Substitution (Team_031): Shai Durant OUT → Kevin Morant IN (stamina_rule2)

[10:29] Substitution (Team_031): Gary Morant OUT → Isaiah Ingram IN (stamina_rule2)

[10:29] Substitution (Team_031): Pau Irving OUT → Miles Stewart IN (stamina_rule2)

[10:29] Substitution (Team_031): Immanuel James OUT → Kobe Randle IN (stamina_rule2)

[10:29] Substitution (Team_031): Luka Sabonis OUT → Jimmy Poole IN (stamina_rule2)

[10:14] Team_031 possession (Score: 26-37)
Jimmy Poole throws a bad pass out of bounds! TURNOVER! (dead ball)

[10:00] Team_022 possession (Score: 26-37)
Lauri Gobert attempts a 3Pt. Contested by Isaiah Ingram (4.1 feet, MAN). Lauri Gobert misses. Rebound secured by Kobe Randle.

[09:48] Team_031 possession (Score: 26-37)
Kobe Randle drives, Kawhi Russell stays with him. Kobe Randle attempts a Dunk. Contested by Kawhi Russell (2.6 feet, ZONE). KOBE RANDLE MAKES IT! Assist: Jimmy Poole
Score: 26-39

[09:33] Team_022 possession (Score: 26-39)
FOUL! Offensive foul on DeMar Harden! Kevin Morant drew the charge! [Team fouls: 2] (DeMar Harden: 1 personal fouls) TURNOVER! (dead ball)

[09:15] Team_031 possession (Score: 26-39)
Kevin Morant attempts a 3Pt. Contested by DeMar Harden (5.7 feet, MAN). Kevin Morant misses. Rebound secured by Dejounte Towns.

[09:04] Team_022 possession (Score: 26-39)
Dejounte Towns attempts a Layup. Contested by Kobe Randle (4.4 feet, ZONE). DEJOUNTE TOWNS MAKES IT!
Score: 28-39

[08:49] Team_031 possession (Score: 28-39)
Jimmy Poole attempts a Midrange. Contested by Lauri Gobert (6.0 feet, ZONE). Jimmy Poole misses. Rebound secured by Dejounte Towns.

[08:35] Team_022 possession (Score: 28-39)
FOUL! Holding foul on Kevin Morant. [Team fouls: 3] No free throws, side out. (Kevin Morant: 1 personal fouls)

[08:24] Team_022 possession (Score: 28-39)
Lauri Gobert attempts a Layup. BLOCKED BY KEVIN MORANT! Ball is loose! Offensive rebound by Dejounte Towns! Dejounte Towns kicks it out.

[08:11] Team_022 possession (Score: 28-39)
Dejounte Towns loses control! Ball rolls out of bounds! TURNOVER! (dead ball)

[07:56] Team_031 possession (Score: 28-39)
Miles Stewart attempts a 3Pt. Wide open! Dejounte Towns is 6.7 feet away. [MAN] Miles Stewart misses. Offensive rebound by Isaiah Ingram! Isaiah Ingram kicks it out.

[07:43] Team_031 possession (Score: 28-39)
Jimmy Poole attempts a Midrange. Wide open! Lauri Gobert is 6.1 feet away. [ZONE] Jimmy Poole misses. Rebound secured by Kawhi Russell.

[07:30] Team_022 possession (Score: 28-39)
Dejounte Towns drives, picks up Miles Stewart. Help arrives from Isaiah Ingram! Dejounte Towns attempts a Layup. Heavily contested by Isaiah Ingram (0.5 feet, MAN)! DEJOUNTE TOWNS MAKES IT! Assist: Kawhi Russell
Score: 30-39

[07:14] Team_031 possession (Score: 30-39)
Miles Stewart drives and kicks out. Jimmy Poole attempts a Midrange. Wide open! Cole Iverson is 6.2 feet away. [MAN] JIMMY POOLE MAKES IT!
Score: 30-41

[06:58] Team_022 possession (Score: 30-41)
DeMar Harden drives and kicks out. Cole Iverson attempts a Midrange. Contested by Kevin Morant (4.1 feet, ZONE). Cole Iverson misses. Rebound secured by Kobe Randle.

[06:40] Team_031 possession (Score: 30-41)
Jimmy Poole throws a bad pass out of bounds! TURNOVER! (dead ball)

[06:25] Team_022 possession (Score: 30-41)
FOUL! Holding foul on Jimmy Poole. [Team fouls: 4] No free throws, side out. (Jimmy Poole: 1 personal fouls)

[06:10] Team_022 possession (Score: 30-41)
FOUL! Shooting foul on Isaiah Ingram. Lauri Gobert to the line for 2 free throws. [BONUS: 5 team fouls] (Isaiah Ingram: 1 personal fouls)   FT 1/2: GOOD   FT 2/2: MISS Lauri Gobert makes 1/2 from the line. Offensive rebound by Dejounte Towns! Dejounte Towns kicks it out.
Score: 31-41

[05:57] Team_022 possession (Score: 31-41)
Cole Iverson attempts a Midrange. Contested by Jimmy Poole (5.4 feet, MAN). COLE IVERSON MAKES IT! Assist: Kawhi Russell
Score: 33-41

[05:43] Team_031 possession (Score: 33-41)
Miles Stewart commits a violation (traveling/carry)! TURNOVER! (dead ball)

[05:25] Team_022 possession (Score: 33-41)
FOUL! Offensive foul on Lauri Gobert! Isaiah Ingram drew the charge! [Team fouls: 3] (Lauri Gobert: 1 personal fouls) TURNOVER! (dead ball)

[05:12] Team_031 possession (Score: 33-41)
Jimmy Poole attempts a Midrange. Contested by Cole Iverson (5.6 feet, MAN). Jimmy Poole misses. Rebound secured by Dejounte Towns.

[04:59] Team_022 possession (Score: 33-41)
Cole Iverson drives and kicks out. Cole Iverson attempts a 3Pt. Contested by Jimmy Poole (5.4 feet, MAN). Cole Iverson misses. Rebound secured by Kobe Randle.

[04:40] Team_031 possession (Score: 33-41)
Kevin Morant drives and kicks out. Miles Stewart attempts a Midrange. Contested by Dejounte Towns (5.4 feet, MAN). MILES STEWART MAKES IT!
Score: 33-43

[04:26] Team_022 possession (Score: 33-43)
Lauri Gobert attempts a 3Pt. Wide open! Miles Stewart is 7.2 feet away. [ZONE] LAURI GOBERT MAKES IT! Assist: Cole Iverson
Score: 36-43

[04:15] Team_031 possession (Score: 36-43)
Kevin Morant attempts a Midrange. Wide open! DeMar Harden is 7.7 feet away. [MAN] Kevin Morant misses. Rebound secured by Lauri Gobert.

[04:01] Team_022 possession (Score: 36-43)
FOUL! Reach-in foul on Kobe Randle during the drive. [IN THE BONUS! 6 team fouls] Kawhi Russell to the line for 2 free throws. (Kobe Randle: 1 personal fouls)   FT 1/2: GOOD   FT 2/2: GOOD Kawhi Russell makes 2/2 from the line.
Score: 38-43

[03:45] Team_031 possession (Score: 38-43)
Kobe Randle attempts a 3Pt. Contested by Kawhi Russell (5.6 feet, MAN). Kobe Randle misses. Rebound secured by Kawhi Russell.

[03:32] Team_022 possession (Score: 38-43)
FOUL! Shooting foul on Isaiah Ingram. DeMar Harden to the line for 2 free throws. [BONUS: 7 team fouls] (Isaiah Ingram: 2 personal fouls)   FT 1/2: MISS   FT 2/2: GOOD DeMar Harden makes 1/2 from the line.
Score: 39-43

[03:19] Team_031 possession (Score: 39-43)
Kobe Randle loses the ball! Stripped by Kawhi Russell! TURNOVER! (live ball)

[03:05] Team_022 possession (Score: 39-43)
DeMar Harden attempts a 3Pt. Contested by Kevin Morant (5.4 feet, MAN). DeMar Harden misses. Offensive rebound by Lauri Gobert! Lauri Gobert kicks it out.

[02:54] Team_022 possession (Score: 39-43)
Kawhi Russell attempts a Midrange. Wide open! Kobe Randle is 9.9 feet away. [MAN] KAWHI RUSSELL MAKES IT! Assist: Dejounte Towns
Score: 41-43

[02:41] Team_031 possession (Score: 41-43)
Kobe Randle attempts a 3Pt. Contested by Kawhi Russell (5.2 feet, ZONE). KOBE RANDLE MAKES IT! Assist: Miles Stewart
Score: 41-46

[02:30] Team_022 possession (Score: 41-46)
DeMar Harden throws a bad pass! Stolen by Kevin Morant! TURNOVER! (live ball)

[02:14] Team_031 possession (Score: 41-46)
Jimmy Poole drives to the basket... FOUL! Offensive foul on Jimmy Poole! Cole Iverson drew the charge! [Team fouls: 8] (Jimmy Poole: 2 personal fouls) TURNOVER! (dead ball)

[01:55] Team_022 possession (Score: 41-46)
Dejounte Towns attempts a Midrange. Contested by Miles Stewart (4.7 feet, ZONE). DEJOUNTE TOWNS MAKES IT!
Score: 43-46

[01:37] Team_031 possession (Score: 43-46)
Miles Stewart attempts a 3Pt. Contested by Dejounte Towns (5.7 feet, MAN). Miles Stewart misses. Rebound secured by Lauri Gobert.

[01:24] Team_022 possession (Score: 43-46)
DeMar Harden drives and kicks out. DeMar Harden attempts a Midrange. Wide open! Isaiah Ingram is 6.6 feet away. [ZONE] DeMar Harden misses. Rebound secured by Jimmy Poole.

[01:06] Team_031 possession (Score: 43-46)
Kobe Randle attempts a 3Pt. Contested by Kawhi Russell (5.3 feet, ZONE). Kobe Randle misses. Offensive rebound by Isaiah Ingram! Isaiah Ingram kicks it out.

[00:54] Team_031 possession (Score: 43-46)
Kobe Randle drives and kicks out. Kobe Randle attempts a Midrange. Contested by Kawhi Russell (2.1 feet, MAN). Kobe Randle misses. Offensive rebound by Jimmy Poole! Jimmy Poole kicks it out.

[00:43] Team_031 possession (Score: 43-46)
Jimmy Poole attempts a Midrange. BLOCKED BY COLE IVERSON! Ball is loose! Rebound secured by Lauri Gobert.

[00:25] Team_022 possession (Score: 43-46)
Lauri Gobert attempts a 3Pt. Wide open! Miles Stewart is 7.8 feet away. [ZONE] LAURI GOBERT MAKES IT! Assist: DeMar Harden
Score: 46-46

[00:06] Team_031 possession (Score: 46-46)
Kobe Randle attempts a 3Pt. Heavily contested by Kawhi Russell (1.5 feet, MAN)! KOBE RANDLE MAKES IT!
Score: 46-49

================================================================================
                              2ND QUARTER COMPLETE                              
================================================================================

2ND QUARTER SCORE: Team_022 24, Team_031 12

BOX SCORE:
================================================================================

Team_022
--------------------------------------------------------------------------------
Player                MIN  PTS  REB  AST  TO      FG   FG%      3P   3P%
--------------------------------------------------------------------------------
Lauri Gobert           10    6    4    0   0   2/3    66.7     0/0   0.0
Dejounte Towns         10    6    5    1   0   3/3   100.0     0/0   0.0
Dirk Markkanen         14    4    2    0   0   2/2   100.0     0/0   0.0
Kawhi Russell          10    4    2    2   0   2/2   100.0     0/0   0.0
Cole Iverson           10    2    0    1   0   1/2    50.0     0/0   0.0
DeMar Harden           10    1    0    1   0   1/3    33.3     0/0   0.0
Michael Ginobili       14    0    1    0   0   0/0     0.0     0/0   0.0

TEAM: FG: 11/15 (73.3%), 3PT: 3/4 (75.0%), REB: 14 (6 off, 8 def), AST: 5, TO: 5
TEAM FOULS: 3


Team_031
--------------------------------------------------------------------------------
Player                MIN  PTS  REB  AST  TO      FG   FG%      3P   3P%
--------------------------------------------------------------------------------
Kobe Randle            10    8    3    0   0   3/4    75.0     0/0   0.0
Jimmy Poole            10    2    2    1   0   1/5    20.0     0/0   0.0
Miles Stewart          10    2    0    1   0   1/2    50.0     0/0   0.0
Kevin Morant           10    0    0    0   0   0/2     0.0     0/0   0.0
Isaiah Ingram          10    0    2    0   0   0/0     0.0     0/0   0.0

TEAM: FG: 5/13 (38.5%), 3PT: 2/5 (40.0%), REB: 7 (3 off, 4 def), AST: 2, TO: 7
TEAM FOULS: 8 [Team_022 in BONUS]

================================================================================

================================================================================
                       3RD QUARTER - Team_022 vs Team_031                       
================================================================================

[12:00] Team_022 possession (Score: 46-49)
Michael Ginobili attempts a 3Pt. Contested by Pau Irving (2.3 feet, ZONE). Michael Ginobili misses. FOUL! Loose ball foul on Gary Morant during the rebound battle. [Team fouls: 1] No free throws, side out. (Gary Morant: 1 personal fouls)

[11:42] Team_022 possession (Score: 46-49)
Myles Anthony makes the Layup and draws the foul on Immanuel James! And-1! Myles Anthony to the line for 1. [Team fouls: 2] (Immanuel James: 1 personal fouls)   FT 1/1: MISS Myles Anthony makes 0/1 from the line. Rebound secured by Luka Sabonis.
Score: 48-49

[11:26] Team_031 possession (Score: 48-49)
Immanuel James attempts a 3Pt. Contested by Lamelo Dosunmu (3.5 feet, MAN). Immanuel James misses. Rebound secured by Myles Anthony.

[11:17] Team_022 possession (Score: 48-49)
Lamelo Dosunmu attempts a Layup. Contested by Immanuel James (2.5 feet, ZONE). Lamelo Dosunmu misses. Rebound secured by Immanuel James.

[11:05] Team_031 possession (Score: 48-49)
Pau Irving attempts a 3Pt. Contested by Michael Ginobili (5.0 feet, ZONE). Pau Irving misses. Rebound secured by Myles Anthony.

[10:51] Team_022 possession (Score: 48-49)
FOUL! Holding foul on Pau Irving. [Team fouls: 3] No free throws, side out. (Pau Irving: 1 personal fouls)

[10:38] Team_022 possession (Score: 48-49)
Michael Ginobili attempts a Layup. Heavily contested by Immanuel James (0.5 feet, ZONE)! MICHAEL GINOBILI MAKES IT!
Score: 50-49

[10:26] Team_031 possession (Score: 50-49)
Luka Sabonis attempts a Layup. Contested by Dirk Markkanen (4.5 feet, MAN). LUKA SABONIS MAKES IT!
Score: 50-51

[10:09] Team_022 possession (Score: 50-51)
Michael Ginobili drives to the basket... Michael Ginobili commits a violation (traveling/carry)! TURNOVER! (dead ball)

[09:58] Team_031 possession (Score: 50-51)
Shai Durant attempts a Midrange. Wide open! Myles Anthony is 9.3 feet away. [ZONE] Shai Durant misses. Rebound secured by Myles Anthony.

[09:45] Team_022 possession (Score: 50-51)
Lamelo Dosunmu attempts a Midrange. Wide open! Immanuel James is 6.8 feet away. [ZONE] Lamelo Dosunmu misses. Rebound secured by Gary Morant.

[09:31] Team_031 possession (Score: 50-51)
Pau Irving drives and kicks out. Shai Durant attempts a 3Pt. Contested by Malcolm Allen (4.5 feet, MAN). Shai Durant misses. Rebound secured by Myles Anthony.

[09:16] Team_022 possession (Score: 50-51)
Lamelo Dosunmu drives and kicks out. Malcolm Allen attempts a Midrange. Heavily contested by Immanuel James (0.5 feet, ZONE)! Malcolm Allen misses. Rebound secured by Luka Sabonis.

[09:04] Team_031 possession (Score: 50-51)
Pau Irving attempts a Midrange. Wide open! Myles Anthony is 6.6 feet away. [MAN] PAU IRVING MAKES IT!
Score: 50-53

[08:54] Team_022 possession (Score: 50-53)
Lamelo Dosunmu attempts a Layup. Contested by Immanuel James (3.4 feet, ZONE). Lamelo Dosunmu misses. Rebound secured by Gary Morant.

[08:43] Team_031 possession (Score: 50-53)
FOUL! Offensive foul on Pau Irving! Myles Anthony drew the charge! [Team fouls: 4] (Pau Irving: 2 personal fouls) TURNOVER! (dead ball)

[08:27] Team_022 possession (Score: 50-53)
Michael Ginobili attempts a Layup. Contested by Gary Morant (4.2 feet, MAN). Michael Ginobili misses. Rebound secured by Luka Sabonis.

[08:12] Team_031 possession (Score: 50-53)
Gary Morant attempts a Midrange. Contested by Michael Ginobili (4.9 feet, MAN). GARY MORANT MAKES IT!
Score: 50-55

[08:02] Team_022 possession (Score: 50-55)
Dirk Markkanen drives to the basket... Dirk Markkanen loses the ball! Stripped by Immanuel James! TURNOVER! (live ball)

[07:47] Team_031 possession (Score: 50-55)
Immanuel James drives to the basket... Immanuel James loses the ball! Stripped by Lamelo Dosunmu! TURNOVER! (live ball)

[07:33] Team_022 possession (Score: 50-55)
Dirk Markkanen attempts a Midrange. Contested by Luka Sabonis (2.4 feet, MAN). Dirk Markkanen misses. Offensive rebound by Michael Ginobili! Michael Ginobili kicks it out.

[07:16] Team_022 possession (Score: 50-55)
Myles Anthony attempts a 3Pt. Contested by Pau Irving (5.3 feet, ZONE). Myles Anthony misses. Rebound secured by Gary Morant.

[07:01] Team_031 possession (Score: 50-55)
Gary Morant attempts a 3Pt. Contested by Michael Ginobili (5.2 feet, ZONE). Gary Morant misses. Rebound secured by Michael Ginobili.

[06:46] Team_022 possession (Score: 50-55)
Michael Ginobili makes the Layup and draws the foul on Gary Morant! And-1! Michael Ginobili to the line for 1. [BONUS: 5 team fouls] (Gary Morant: 2 personal fouls)   FT 1/1: GOOD Michael Ginobili makes 1/1 from the line.
Score: 53-55

[06:32] Team_031 possession (Score: 53-55)
Gary Morant attempts a 3Pt. Contested by Michael Ginobili (2.4 feet, ZONE). GARY MORANT MAKES IT! Assist: Pau Irving
Score: 53-58

[06:17] Team_022 possession (Score: 53-58)
Malcolm Allen attempts a 3Pt. Contested by Pau Irving (2.6 feet, ZONE). Malcolm Allen misses. Offensive rebound by Dirk Markkanen! Dirk Markkanen puts it back in!
Score: 55-58

[06:04] Team_031 possession (Score: 55-58)
FOUL! Shooting foul on Myles Anthony. Gary Morant to the line for 2 free throws. [Team fouls: 1] (Myles Anthony: 1 personal fouls)   FT 1/2: GOOD   FT 2/2: GOOD Gary Morant makes 2/2 from the line.
Score: 55-60

[05:53] Team_022 possession (Score: 55-60)
Malcolm Allen drives, picks up Luka Sabonis. Help arrives from Shai Durant! Malcolm Allen attempts a Dunk. Contested by Shai Durant (3.1 feet, ZONE). MALCOLM ALLEN MAKES IT! Assist: Myles Anthony
Score: 57-60

[05:39] Team_031 possession (Score: 57-60)
Shai Durant attempts a Midrange. Wide open! Myles Anthony is 6.2 feet away. [ZONE] SHAI DURANT MAKES IT!
Score: 57-62

[05:23] Team_022 possession (Score: 57-62)
Malcolm Allen attempts a 3Pt. Contested by Pau Irving (3.9 feet, ZONE). MALCOLM ALLEN MAKES IT! Assist: Dirk Markkanen
Score: 60-62

[05:10] Team_031 possession (Score: 60-62)
Pau Irving drives, picks up Dirk Markkanen. Help arrives from Michael Ginobili! Pau Irving attempts a Dunk. Contested by Michael Ginobili (3.8 feet, ZONE). PAU IRVING MAKES IT! Assist: Shai Durant
Score: 60-64

[04:53] Team_022 possession (Score: 60-64)
Malcolm Allen drives to the basket... Malcolm Allen commits a violation (traveling/carry)! TURNOVER! (dead ball)

[04:43] Team_031 possession (Score: 60-64)
Gary Morant throws a bad pass! Stolen by Michael Ginobili! TURNOVER! (live ball)

[04:29] Team_022 possession (Score: 60-64)
Malcolm Allen attempts a 3Pt. Contested by Shai Durant (5.5 feet, MAN). Malcolm Allen misses. Rebound secured by Luka Sabonis.

[04:13] Team_031 possession (Score: 60-64)
Shai Durant attempts a 3Pt. Wide open! Lamelo Dosunmu is 8.4 feet away. [ZONE] Shai Durant misses. Rebound secured by Myles Anthony.

[03:58] Team_022 possession (Score: 60-64)
Myles Anthony attempts a 3Pt. Contested by Pau Irving (2.0 feet, ZONE). Myles Anthony misses. Rebound secured by Luka Sabonis.

[03:45] Team_031 possession (Score: 60-64)
Luka Sabonis attempts a Layup. Contested by Dirk Markkanen (3.2 feet, ZONE). LUKA SABONIS MAKES IT! Assist: Gary Morant
Score: 60-66

[03:32] Team_022 possession (Score: 60-66)
Lamelo Dosunmu loses the ball! Stripped by Immanuel James! TURNOVER! (live ball)

[03:20] Team_031 possession (Score: 60-66)
FOUL! Offensive foul on Immanuel James! Lamelo Dosunmu drew the charge! [Team fouls: 6] (Immanuel James: 2 personal fouls) TURNOVER! (dead ball)

[03:02] Team_022 possession (Score: 60-66)
FOUL! Holding foul on Pau Irving. [IN THE BONUS! 7 team fouls] Myles Anthony to the line for 2 free throws. (Pau Irving: 3 personal fouls)   FT 1/2: GOOD   FT 2/2: MISS Myles Anthony makes 1/2 from the line. Rebound secured by Luka Sabonis.
Score: 61-66

[02:48] Team_031 possession (Score: 61-66)
Luka Sabonis loses control! Ball rolls out of bounds! TURNOVER! (dead ball)

[02:48] Substitution (Team_022): Malcolm Allen OUT → DeMar Harden IN (stamina_rule2)

[02:48] Substitution (Team_022): Michael Ginobili OUT → Lauri Gobert IN (stamina_rule2)

[02:48] Substitution (Team_022): Myles Anthony OUT → Dejounte Towns IN (stamina_rule2)

[02:48] Substitution (Team_022): Lamelo Dosunmu OUT → Kawhi Russell IN (stamina_rule2)

[02:48] Substitution (Team_022): Dirk Markkanen OUT → Cole Iverson IN (stamina_rule2)

[02:48] Substitution (Team_031): Shai Durant OUT → Kevin Morant IN (stamina_rule2)

[02:48] Substitution (Team_031): Gary Morant OUT → Isaiah Ingram IN (stamina_rule2)

[02:48] Substitution (Team_031): Pau Irving OUT → Miles Stewart IN (stamina_rule2)

[02:48] Substitution (Team_031): Immanuel James OUT → Kobe Randle IN (stamina_rule2)

[02:48] Substitution (Team_031): Luka Sabonis OUT → Jimmy Poole IN (stamina_rule2)

[02:35] Team_022 possession (Score: 61-66)
Kawhi Russell attempts a Layup. BLOCKED BY KOBE RANDLE! Ball is loose! Rebound secured by Kobe Randle.

[02:15] Team_031 possession (Score: 61-66)
Jimmy Poole attempts a Layup. BLOCKED BY KAWHI RUSSELL! Ball deflects out of bounds off Jimmy Poole.

[02:01] Team_022 possession (Score: 61-66)
Kawhi Russell attempts a Midrange. Contested by Isaiah Ingram (4.2 feet, ZONE). Kawhi Russell misses. Offensive rebound by Lauri Gobert! Lauri Gobert kicks it out.

[01:46] Team_022 possession (Score: 61-66)
Kawhi Russell makes the Dunk and draws the foul on Kobe Randle! And-1! Kawhi Russell to the line for 1. [BONUS: 8 team fouls] (Kobe Randle: 1 personal fouls)   FT 1/1: GOOD Kawhi Russell makes 1/1 from the line.
Score: 64-66

[01:29] Team_031 possession (Score: 64-66)
Isaiah Ingram drives, Kawhi Russell stays with him. Isaiah Ingram attempts a Dunk. Heavily contested by Kawhi Russell (1.1 feet, ZONE)! ISAIAH INGRAM MAKES IT!
Score: 64-68

[01:17] Team_022 possession (Score: 64-68)
FOUL! Shooting foul on Kobe Randle. Cole Iverson to the line for 2 free throws. [BONUS: 9 team fouls] (Kobe Randle: 2 personal fouls)   FT 1/2: MISS   FT 2/2: GOOD Cole Iverson makes 1/2 from the line.
Score: 65-68

[01:02] Team_031 possession (Score: 65-68)
Kobe Randle attempts a Layup. Contested by Kawhi Russell (4.6 feet, ZONE). KOBE RANDLE MAKES IT!
Score: 65-70

[00:53] Team_022 possession (Score: 65-70)
DeMar Harden drives, picks up Kevin Morant. Help arrives from Isaiah Ingram! DeMar Harden attempts a Dunk. Contested by Isaiah Ingram (3.4 feet, MAN). DeMar Harden misses. Rebound secured by Isaiah Ingram.

[00:38] Team_031 possession (Score: 65-70)
Isaiah Ingram throws a bad pass! Stolen by Lauri Gobert! TURNOVER! (live ball)

[00:22] Team_022 possession (Score: 65-70)
DeMar Harden makes the Layup and draws the foul on Kevin Morant! And-1! DeMar Harden to the line for 1. [BONUS: 10 team fouls] (Kevin Morant: 1 personal fouls)   FT 1/1: GOOD DeMar Harden makes 1/1 from the line.
Score: 68-70

[00:08] Team_031 possession (Score: 68-70)
Isaiah Ingram attempts a 3Pt. Contested by Lauri Gobert (3.3 feet, MAN). Isaiah Ingram misses. Offensive rebound by Jimmy Poole! Jimmy Poole kicks it out.

================================================================================
                              3RD QUARTER COMPLETE                              
================================================================================

3RD QUARTER SCORE: Team_022 22, Team_031 21

BOX SCORE:
================================================================================

Team_022
--------------------------------------------------------------------------------
Player                MIN  PTS  REB  AST  TO      FG   FG%      3P   3P%
--------------------------------------------------------------------------------
Michael Ginobili       23    5    3    0   0   2/3    66.7     0/0   0.0
Malcolm Allen          23    5    0    0   0   2/3    66.7     0/0   0.0
Kawhi Russell          13    3    0    0   0   1/2    50.0     0/0   0.0
DeMar Harden           13    3    0    0   0   1/2    50.0     0/0   0.0
Dirk Markkanen         23    2    1    1   0   1/1   100.0     0/0   0.0
Cole Iverson           13    1    0    0   0   1/1   100.0     0/0   0.0
Myles Anthony          23    0    5    1   0   0/3     0.0     0/0   0.0
Lamelo Dosunmu         23    0    0    0   0   0/4     0.0     0/0   0.0
Lauri Gobert           13    0    1    0   0   0/0     0.0     0/0   0.0

TEAM: FG: 8/20 (40.0%), 3PT: 2/5 (40.0%), REB: 10 (4 off, 6 def), AST: 2, TO: 4
TEAM FOULS: 1


Team_031
--------------------------------------------------------------------------------
Player                MIN  PTS  REB  AST  TO      FG   FG%      3P   3P%
--------------------------------------------------------------------------------
Gary Morant            23    7    3    1   0   3/4    75.0     0/0   0.0
Luka Sabonis           23    4    6    0   0   2/2   100.0     0/0   0.0
Pau Irving             23    4    0    1   0   2/4    50.0     0/0   0.0
Shai Durant            23    2    0    1   0   1/3    33.3     0/0   0.0
Kobe Randle            13    2    1    0   0   1/1   100.0     0/0   0.0
Isaiah Ingram          13    2    1    0   0   1/1   100.0     0/0   0.0
Immanuel James         23    0    1    0   0   0/1     0.0     0/0   0.0
Jimmy Poole            13    0    1    0   0   0/1     0.0     0/0   0.0

TEAM: FG: 10/17 (58.8%), 3PT: 1/5 (20.0%), REB: 13 (1 off, 12 def), AST: 3, TO: 6
TEAM FOULS: 10 [Team_022 in BONUS]

================================================================================

================================================================================
                       4TH QUARTER - Team_022 vs Team_031                       
================================================================================

[12:00] Team_022 possession (Score: 68-70)
Myles Anthony makes the Midrange and draws the foul on Pau Irving! And-1! Myles Anthony to the line for 1. [Team fouls: 1] (Pau Irving: 1 personal fouls)   FT 1/1: GOOD Myles Anthony makes 1/1 from the line.
Score: 71-70

[11:46] Team_031 possession (Score: 71-70)
Shai Durant drives, Malcolm Allen stays with him. Shai Durant attempts a Layup. Contested by Malcolm Allen (2.6 feet, MAN). SHAI DURANT MAKES IT!
Score: 71-72

[11:31] Team_022 possession (Score: 71-72)
Michael Ginobili drives, picks up Gary Morant. Help arrives from Pau Irving! Michael Ginobili attempts a Layup. Contested by Pau Irving (3.4 feet, MAN). MICHAEL GINOBILI MAKES IT! Assist: Lamelo Dosunmu
Score: 73-72

[11:17] Team_031 possession (Score: 73-72)
Immanuel James attempts a 3Pt. Contested by Lamelo Dosunmu (2.6 feet, MAN). Immanuel James misses. Rebound secured by Michael Ginobili.

[11:02] Team_022 possession (Score: 73-72)
Malcolm Allen attempts a 3Pt. Wide open! Pau Irving is 8.2 feet away. [ZONE] MALCOLM ALLEN MAKES IT!
Score: 76-72

[10:49] Team_031 possession (Score: 76-72)
Luka Sabonis drives, picks up Dirk Markkanen. Help arrives from Michael Ginobili! Luka Sabonis attempts a Layup. Contested by Michael Ginobili (2.9 feet, ZONE). Luka Sabonis misses. Rebound secured by Michael Ginobili.

[10:33] Team_022 possession (Score: 76-72)
Myles Anthony attempts a Layup. BLOCKED BY PAU IRVING! Ball is loose! Rebound secured by Immanuel James.

[10:16] Team_031 possession (Score: 76-72)
Shai Durant drives and kicks out. Luka Sabonis attempts a Midrange. Wide open! Myles Anthony is 7.4 feet away. [ZONE] LUKA SABONIS MAKES IT!
Score: 76-74

[10:05] Team_022 possession (Score: 76-74)
FOUL! Shooting foul on Luka Sabonis. Dirk Markkanen to the line for 2 free throws. [Team fouls: 2] (Luka Sabonis: 1 personal fouls)   FT 1/2: MISS   FT 2/2: MISS Dirk Markkanen makes 0/2 from the line. Offensive rebound by Dirk Markkanen! Dirk Markkanen's putback is no good.

[09:48] Team_031 possession (Score: 76-74)
Shai Durant attempts a 3Pt. Wide open! Malcolm Allen is 6.5 feet away. [MAN] Shai Durant misses. Rebound secured by Dirk Markkanen.

[09:34] Team_022 possession (Score: 76-74)
Malcolm Allen drives, picks up Shai Durant. Help arrives from Pau Irving! Malcolm Allen attempts a Layup. Contested by Pau Irving (4.6 feet, MAN). Malcolm Allen misses. Rebound secured by Immanuel James.

[09:15] Team_031 possession (Score: 76-74)
Gary Morant attempts a 3Pt. Contested by Michael Ginobili (3.8 feet, ZONE). Gary Morant misses. Rebound secured by Michael Ginobili.

[09:03] Team_022 possession (Score: 76-74)
Dirk Markkanen attempts a Layup. Contested by Luka Sabonis (3.9 feet, MAN). Dirk Markkanen misses. FOUL! Loose ball foul on Gary Morant during the rebound battle. [Team fouls: 3] No free throws, side out. (Gary Morant: 1 personal fouls)

[08:52] Team_022 possession (Score: 76-74)
Malcolm Allen drives and kicks out. Michael Ginobili attempts a 3Pt. Contested by Pau Irving (4.8 feet, ZONE). MICHAEL GINOBILI MAKES IT! Assist: Malcolm Allen
Score: 79-74

[08:38] Team_031 possession (Score: 79-74)
Gary Morant makes the Layup and draws the foul on Michael Ginobili! And-1! Gary Morant to the line for 1. [Team fouls: 1] (Michael Ginobili: 1 personal fouls)   FT 1/1: GOOD Gary Morant makes 1/1 from the line.
Score: 79-77

[08:22] Team_022 possession (Score: 79-77)
Malcolm Allen attempts a 3Pt. Contested by Shai Durant (2.5 feet, MAN). MALCOLM ALLEN MAKES IT! Assist: Dirk Markkanen
Score: 82-77

[08:08] Team_031 possession (Score: 82-77)
Shai Durant attempts a 3Pt. Contested by Malcolm Allen (6.0 feet, MAN). SHAI DURANT MAKES IT! Assist: Immanuel James
Score: 82-80

[07:56] Team_022 possession (Score: 82-80)
Malcolm Allen attempts a Layup. Contested by Shai Durant (3.5 feet, MAN). Malcolm Allen misses. Rebound secured by Gary Morant.

[07:45] Team_031 possession (Score: 82-80)
Immanuel James attempts a Midrange. Wide open! Lamelo Dosunmu is 7.9 feet away. [MAN] Immanuel James misses. Rebound secured by Dirk Markkanen.

[07:32] Team_022 possession (Score: 82-80)
Dirk Markkanen makes the Layup and draws the foul on Immanuel James! And-1! Dirk Markkanen to the line for 1. [Team fouls: 4] (Immanuel James: 1 personal fouls)   FT 1/1: GOOD Dirk Markkanen makes 1/1 from the line.
Score: 85-80

[07:18] Team_031 possession (Score: 85-80)
Gary Morant drives, Michael Ginobili stays with him. Gary Morant attempts a Layup. Contested by Michael Ginobili (4.5 feet, MAN). Gary Morant misses. Offensive rebound by Luka Sabonis! Luka Sabonis puts it back in!
Score: 85-82

[07:05] Team_022 possession (Score: 85-82)
Michael Ginobili attempts a 3Pt. Contested by Gary Morant (5.3 feet, MAN). MICHAEL GINOBILI MAKES IT! Assist: Myles Anthony
Score: 88-82

[06:50] Team_031 possession (Score: 88-82)
Pau Irving drives and kicks out. Gary Morant attempts a 3Pt. Wide open! Michael Ginobili is 7.1 feet away. [MAN] Gary Morant misses. Rebound secured by Myles Anthony.

[06:36] Team_022 possession (Score: 88-82)
Dirk Markkanen attempts a Layup. Contested by Immanuel James (4.7 feet, ZONE). DIRK MARKKANEN MAKES IT!
Score: 90-82

[06:23] Team_031 possession (Score: 90-82)
Pau Irving attempts a Midrange. Heavily contested by Lamelo Dosunmu (1.3 feet, ZONE)! Pau Irving misses. Rebound secured by Dirk Markkanen.

[06:13] Team_022 possession (Score: 90-82)
Malcolm Allen drives, Immanuel James stays with him. Malcolm Allen attempts a Layup. Heavily contested by Immanuel James (0.5 feet, ZONE)! MALCOLM ALLEN MAKES IT!
Score: 92-82

[05:58] Team_031 possession (Score: 92-82)
Shai Durant attempts a 3Pt. Wide open! Malcolm Allen is 6.8 feet away. [ZONE] Shai Durant misses. Rebound secured by Dirk Markkanen.

[05:44] Team_022 possession (Score: 92-82)
FOUL! Offensive foul on Myles Anthony! Pau Irving drew the charge! [Team fouls: 2] (Myles Anthony: 1 personal fouls) TURNOVER! (dead ball)

[05:28] Team_031 possession (Score: 92-82)
FOUL! Shooting foul on Myles Anthony. Pau Irving to the line for 2 free throws. [Team fouls: 3] (Myles Anthony: 2 personal fouls)   FT 1/2: MISS   FT 2/2: GOOD Pau Irving makes 1/2 from the line.
Score: 92-83

[05:13] Team_022 possession (Score: 92-83)
Michael Ginobili attempts a 3Pt. Wide open! Gary Morant is 6.4 feet away. [MAN] Michael Ginobili misses. Rebound secured by Gary Morant.

[04:55] Team_031 possession (Score: 92-83)
Gary Morant drives, Michael Ginobili stays with him. Gary Morant attempts a Layup. Wide open! Michael Ginobili is 7.0 feet away. [MAN] Gary Morant misses. Rebound secured by Michael Ginobili.

[04:38] Team_022 possession (Score: 92-83)
Michael Ginobili attempts a Midrange. Contested by Gary Morant (5.1 feet, MAN). Michael Ginobili misses. Rebound secured by Immanuel James.

[04:23] Team_031 possession (Score: 92-83)
FOUL! Holding foul on Lamelo Dosunmu. [Team fouls: 4] No free throws, side out. (Lamelo Dosunmu: 1 personal fouls)

[04:09] Team_031 possession (Score: 92-83)
Gary Morant attempts a 3Pt. Wide open! Michael Ginobili is 6.1 feet away. [MAN] Gary Morant misses. Rebound secured by Dirk Markkanen.

[03:55] Team_022 possession (Score: 92-83)
Lamelo Dosunmu drives to the basket... Lamelo Dosunmu loses the ball! Stripped by Immanuel James! TURNOVER! (live ball)

[03:41] Team_031 possession (Score: 92-83)
Immanuel James loses control! Ball rolls out of bounds! TURNOVER! (dead ball)

[03:41] Substitution (Team_022): Malcolm Allen OUT → DeMar Harden IN (stamina_rule2)

[03:41] Substitution (Team_022): Michael Ginobili OUT → Lauri Gobert IN (stamina_rule2)

[03:41] Substitution (Team_022): Myles Anthony OUT → Dejounte Towns IN (stamina_rule2)

[03:41] Substitution (Team_022): Lamelo Dosunmu OUT → Kawhi Russell IN (stamina_rule2)

[03:41] Substitution (Team_022): Dirk Markkanen OUT → Cole Iverson IN (stamina_rule2)

[03:41] Substitution (Team_031): Shai Durant OUT → Kevin Morant IN (stamina_rule2)

[03:41] Substitution (Team_031): Gary Morant OUT → Isaiah Ingram IN (stamina_rule2)

[03:41] Substitution (Team_031): Pau Irving OUT → Miles Stewart IN (stamina_rule2)

[03:41] Substitution (Team_031): Immanuel James OUT → Kobe Randle IN (stamina_rule2)

[03:41] Substitution (Team_031): Luka Sabonis OUT → Jimmy Poole IN (stamina_rule2)

[03:24] Team_022 possession (Score: 92-83)
Lauri Gobert drives and kicks out. Cole Iverson attempts a 3Pt. Contested by Miles Stewart (5.8 feet, ZONE). COLE IVERSON MAKES IT! Assist: DeMar Harden
Score: 95-83

[03:08] Team_031 possession (Score: 95-83)
Kevin Morant attempts a 3Pt. Wide open! DeMar Harden is 6.2 feet away. [MAN] Kevin Morant misses. Rebound secured by Dejounte Towns.

[02:58] Team_022 possession (Score: 95-83)
DeMar Harden attempts a Midrange. Contested by Miles Stewart (5.5 feet, ZONE). DeMar Harden misses. Rebound secured by Kobe Randle.

[02:41] Team_031 possession (Score: 95-83)
Isaiah Ingram attempts a 3Pt. Contested by Kawhi Russell (3.7 feet, ZONE). Isaiah Ingram misses. Rebound secured by Dejounte Towns.

[02:26] Team_022 possession (Score: 95-83)
Cole Iverson attempts a Layup. Wide open! Jimmy Poole is 8.0 feet away. [MAN] Cole Iverson misses. FOUL! Loose ball foul on Kobe Randle during the rebound battle. [IN THE BONUS! 5 team fouls] Dejounte Towns to the line for 2 free throws. (Kobe Randle: 1 personal fouls)   FT 1/2: GOOD   FT 2/2: GOOD Dejounte Towns makes 2/2 from the line.
Score: 97-83

[02:09] Team_031 possession (Score: 97-83)
Miles Stewart attempts a 3Pt. Contested by Dejounte Towns (4.8 feet, MAN). MILES STEWART MAKES IT! Assist: Isaiah Ingram
Score: 97-86

[01:53] Team_022 possession (Score: 97-86)
Lauri Gobert attempts a Layup. BLOCKED BY ISAIAH INGRAM! Ball is loose! Offensive rebound by Dejounte Towns! Dejounte Towns kicks it out.

[01:39] Team_022 possession (Score: 97-86)
Kawhi Russell attempts a 3Pt. Wide open! Miles Stewart is 6.5 feet away. [ZONE] KAWHI RUSSELL MAKES IT! Assist: DeMar Harden
Score: 100-86

[01:28] Team_031 possession (Score: 100-86)
Isaiah Ingram attempts a 3Pt. Wide open! Lauri Gobert is 7.5 feet away. [MAN] Isaiah Ingram misses. Rebound secured by Lauri Gobert.

[01:12] Team_022 possession (Score: 100-86)
Lauri Gobert attempts a 3Pt. Wide open! Kevin Morant is 7.5 feet away. [ZONE] LAURI GOBERT MAKES IT! Assist: DeMar Harden
Score: 103-86

[00:55] Team_031 possession (Score: 103-86)
Kevin Morant attempts a 3Pt. Heavily contested by Kawhi Russell (1.3 feet, ZONE)! Kevin Morant misses. Rebound secured by Dejounte Towns.

[00:44] Team_022 possession (Score: 103-86)
Lauri Gobert attempts a Layup. Contested by Isaiah Ingram (3.9 feet, MAN). LAURI GOBERT MAKES IT!
Score: 105-86

[00:28] Team_031 possession (Score: 105-86)
Miles Stewart drives to the basket... Miles Stewart throws a bad pass! Stolen by Dejounte Towns! TURNOVER! (live ball)

[00:16] Team_022 possession (Score: 105-86)
FOUL! Holding foul on Miles Stewart. [IN THE BONUS! 6 team fouls] Dejounte Towns to the line for 2 free throws. (Miles Stewart: 1 personal fouls)   FT 1/2: GOOD   FT 2/2: MISS Dejounte Towns makes 1/2 from the line. Rebound secured by Jimmy Poole.
Score: 106-86

================================================================================
                              4TH QUARTER COMPLETE                              
================================================================================

4TH QUARTER SCORE: Team_022 38, Team_031 16

BOX SCORE:
================================================================================

Team_022
--------------------------------------------------------------------------------
Player                MIN  PTS  REB  AST  TO      FG   FG%      3P   3P%
--------------------------------------------------------------------------------
Michael Ginobili       32    8    4    0   0   3/5    60.0     0/0   0.0
Malcolm Allen          32    8    0    1   0   3/5    60.0     0/0   0.0
Dirk Markkanen         32    5    7    1   0   2/3    66.7     0/0   0.0
Lauri Gobert           16    5    1    0   0   2/2   100.0     0/0   0.0
Myles Anthony          32    3    1    1   0   1/2    50.0     0/0   0.0
Cole Iverson           16    3    0    0   0   1/1   100.0     0/0   0.0
Kawhi Russell          16    3    0    0   0   1/1   100.0     0/0   0.0
Dejounte Towns         16    2    4    0   0   1/1   100.0     0/0   0.0
Lamelo Dosunmu         32    0    0    1   0   0/0     0.0     0/0   0.0
DeMar Harden           16    0    0    3   0   0/1     0.0     0/0   0.0

TEAM: FG: 14/22 (63.6%), 3PT: 5/6 (83.3%), REB: 16 (2 off, 14 def), AST: 7, TO: 2
TEAM FOULS: 4


Team_031
--------------------------------------------------------------------------------
Player                MIN  PTS  REB  AST  TO      FG   FG%      3P   3P%
--------------------------------------------------------------------------------
Shai Durant            32    5    0    0   0   2/4    50.0     0/0   0.0
Luka Sabonis           32    4    1    0   0   2/3    66.7     0/0   0.0
Gary Morant            32    3    2    0   0   1/4    25.0     0/0   0.0
Miles Stewart          16    3    0    0   0   1/1   100.0     0/0   0.0
Pau Irving             32    1    0    0   0   1/3    33.3     0/0   0.0
Immanuel James         32    0    3    1   0   0/2     0.0     0/0   0.0
Kevin Morant           16    0    0    0   0   0/2     0.0     0/0   0.0
Kobe Randle            16    0    1    0   0   0/0     0.0     0/0   0.0
Isaiah Ingram          16    0    0    1   0   0/2     0.0     0/0   0.0
Jimmy Poole            16    0    1    0   0   0/0     0.0     0/0   0.0

TEAM: FG: 7/21 (33.3%), 3PT: 2/11 (18.2%), REB: 9 (1 off, 8 def), AST: 2, TO: 2
TEAM FOULS: 6 [Team_022 in BONUS]

================================================================================

================================================================================
                               FULL GAME COMPLETE                               
================================================================================

FINAL SCORE: Team_022 106, Team_031 86

SCORING BY QUARTER:
--------------------------------------------------------------------------------
Team                     Q1     Q2     Q3     Q4    FINAL
--------------------------------------------------------------------------------
Team_022                 22     24     22     38      106
Team_031                 37     12     21     16       86
--------------------------------------------------------------------------------

FULL GAME BOX SCORE:
================================================================================

Team_022
--------------------------------------------------------------------------------
Player                MIN  PTS  REB  AST  TO      FG   FG%      3P   3P%      FT STL BLK
--------------------------------------------------------------------------------
Malcolm Allen          32   20    0    2   1  10/13   76.9   4/5    80.0   1/1     0   0
Michael Ginobili       32   20    9    0   0   8/16   50.0   1/5    20.0   2/2     1   0
Myles Anthony          32    8    9    2   6   3/10   30.0   0/3     0.0   3/5     0   0
Lamelo Dosunmu         32    2    0    2   3   1/5    20.0   0/0     0.0   0/0     1   0
Dirk Markkanen         32   12   14    2   1   4/6    66.7   1/1   100.0   2/5     0   0
DeMar Harden           16    4    0    4   2   2/6    33.3   0/0     0.0   2/3     0   0
Lauri Gobert           16   11    6    0   1   5/6    83.3   3/4    75.0   1/2     1   0
Dejounte Towns         16    8    9    1   1   3/3   100.0   0/0     0.0   3/4     1   0
Kawhi Russell          16   10    2    2   0   4/5    80.0   1/1   100.0   3/3     1   1
Cole Iverson           16    6    0    1   0   3/4    75.0   0/0     0.0   1/2     0   1

TEAM: FG: 43/76 (56.6%), 3PT: 10/19 (52.6%), REB: 49 (14 off, 35 def), AST: 16, TO: 15


Team_031
--------------------------------------------------------------------------------
Player                MIN  PTS  REB  AST  TO      FG   FG%      3P   3P%      FT STL BLK
--------------------------------------------------------------------------------
Shai Durant            32   14    0    1   1   8/13   61.5   2/6    33.3   0/0     0   0
Gary Morant            32   15    8    3   1   8/13   61.5   1/4    25.0   4/5     0   0
Pau Irving             32   17    0    1   2   6/11   54.5   2/4    50.0   2/3     0   1
Immanuel James         32    8    8    5   3   2/6    33.3   0/2     0.0   3/4     3   0
Luka Sabonis           32   11   11    1   3   4/7    57.1   0/1     0.0   2/4     0   1
Kevin Morant           16    0    0    0   2   1/5    20.0   0/3     0.0   0/0     1   1
Isaiah Ingram          16    2    3    1   1   1/3    33.3   0/2     0.0   0/0     0   1
Miles Stewart          16    5    0    1   1   2/3    66.7   1/2    50.0   0/0     0   0
Kobe Randle            16   10    5    0   1   4/5    80.0   2/3    66.7   0/0     0   1
Jimmy Poole            16    2    4    1   2   0/5     0.0   0/0     0.0   0/0     0   0

TEAM: FG: 36/72 (50.0%), 3PT: 8/27 (29.6%), REB: 38 (7 off, 31 def), AST: 14, TO: 17

================================================================================
