================================================================================
                        FULL GAME - Team_028 vs Team_045                        
================================================================================

================================================================================
                       1ST QUARTER - Team_028 vs Team_045                       
================================================================================

[12:00] Team_028 possession (Score: 0-0)
Kawhi Ball throws a bad pass! Stolen by Zion Butler! TURNOVER! (live ball)

[11:42] Team_045 possession (Score: 0-0)
Trae Russell attempts a Layup. Contested by Carmelo Carter (4.6 feet, MAN). TRAE RUSSELL MAKES IT! Assist: Zion Butler
Score: 0-2

[11:26] Team_028 possession (Score: 0-2)
Myles Haliburton throws a bad pass! Stolen by Cole Simons! TURNOVER! (live ball)

[11:12] Team_045 possession (Score: 0-2)
Cole Simons attempts a 3Pt. Wide open! Myles Haliburton is 6.0 feet away. [MAN] Cole Simons misses. Rebound secured by Jimmy Brogdon.

[11:02] Team_028 possession (Score: 0-2)
FOUL! Shooting foul on Zion Butler. Kawhi Ball to the line for 2 free throws. [Team fouls: 1] (Zion Butler: 1 personal fouls)   FT 1/2: GOOD   FT 2/2: MISS Kawhi Ball makes 1/2 from the line. Rebound secured by Zion Butler.
Score: 1-2

[10:49] Team_045 possession (Score: 1-2)
DeMar Turner attempts a 3Pt. Wide open! Austin Russell is 6.4 feet away. [ZONE] DEMAR TURNER MAKES IT! Assist: Trae Russell
Score: 1-5

[10:32] Team_028 possession (Score: 1-5)
Carmelo Carter attempts a 3Pt. Contested by Cole Simons (2.1 feet, MAN). Carmelo Carter misses. Rebound secured by Zion Butler.

[10:18] Team_045 possession (Score: 1-5)
Rudy Antetokounmpo attempts a Midrange. Contested by Austin Russell (4.3 feet, MAN). Rudy Antetokounmpo misses. Rebound secured by Kawhi Ball.

[10:07] Team_028 possession (Score: 1-5)
Jimmy Brogdon drives, picks up Zion Butler. Help arrives from Rudy Antetokounmpo! Jimmy Brogdon attempts a Dunk. Contested by Rudy Antetokounmpo (3.7 feet, ZONE). JIMMY BROGDON MAKES IT! Assist: Austin Russell
Score: 3-5

[09:53] Team_045 possession (Score: 3-5)
Trae Russell drives and kicks out. Rudy Antetokounmpo attempts a 3Pt. Wide open! Myles Haliburton is 6.6 feet away. [ZONE] RUDY ANTETOKOUNMPO MAKES IT! Assist: Trae Russell
Score: 3-8

[09:36] Team_028 possession (Score: 3-8)
FOUL! Offensive foul on Myles Haliburton! Cole Simons drew the charge! [Team fouls: 1] (Myles Haliburton: 1 personal fouls) TURNOVER! (dead ball)

[09:18] Team_045 possession (Score: 3-8)
DeMar Turner attempts a 3Pt. Contested by Austin Russell (2.2 feet, ZONE). DeMar Turner misses. Rebound secured by Kawhi Ball.

[09:03] Team_028 possession (Score: 3-8)
Myles Haliburton attempts a 3Pt. Wide open! Cole Simons is 7.6 feet away. [MAN] Myles Haliburton misses. Rebound secured by DeMar Turner.

[08:51] Team_045 possession (Score: 3-8)
Trae Russell drives, Kawhi Ball stays with him. Trae Russell attempts a Layup. Contested by Kawhi Ball (5.2 feet, ZONE). TRAE RUSSELL MAKES IT! Assist: Rudy Antetokounmpo
Score: 3-10

[08:39] Team_028 possession (Score: 3-10)
Carmelo Carter drives and kicks out. Austin Russell attempts a Midrange. Contested by Cole Simons (4.6 feet, ZONE). Austin Russell misses. Rebound secured by Zion Butler.

[08:22] Team_045 possession (Score: 3-10)
FOUL! Reach-in foul on Jimmy Brogdon during the drive. [Team fouls: 2] No free throws, side out. (Jimmy Brogdon: 1 personal fouls)

[08:07] Team_045 possession (Score: 3-10)
Zion Butler attempts a Dunk. BLOCKED BY KAWHI BALL! Ball is loose! Rebound secured by Kawhi Ball.

[07:54] Team_028 possession (Score: 3-10)
Myles Haliburton drives, picks up Cole Simons. Help arrives from Rudy Antetokounmpo! Myles Haliburton attempts a Layup. Contested by Rudy Antetokounmpo (2.3 feet, MAN). MYLES HALIBURTON MAKES IT!
Score: 5-10

[07:36] Team_045 possession (Score: 5-10)
Trae Russell attempts a Layup. Contested by Carmelo Carter (4.5 feet, MAN). TRAE RUSSELL MAKES IT! Assist: Zion Butler
Score: 5-12

[07:19] Team_028 possession (Score: 5-12)
FOUL! Shooting foul on Cole Simons. Carmelo Carter to the line for 2 free throws. [Team fouls: 2] (Cole Simons: 1 personal fouls)   FT 1/2: GOOD   FT 2/2: MISS Carmelo Carter makes 1/2 from the line. Rebound secured by Zion Butler.
Score: 6-12

[07:03] Team_045 possession (Score: 6-12)
Rudy Antetokounmpo attempts a 3Pt. Contested by Austin Russell (5.2 feet, ZONE). RUDY ANTETOKOUNMPO MAKES IT! Assist: Cole Simons
Score: 6-15

[06:46] Team_028 possession (Score: 6-15)
Jimmy Brogdon drives and kicks out. Jimmy Brogdon attempts a Midrange. Contested by Zion Butler (3.6 feet, MAN). Jimmy Brogdon misses. Rebound secured by Cole Simons.

[06:35] Team_045 possession (Score: 6-15)
FOUL! Reach-in foul on Kawhi Ball during the drive. [Team fouls: 3] No free throws, side out. (Kawhi Ball: 1 personal fouls)

[06:23] Team_045 possession (Score: 6-15)
FOUL! Shooting foul on Kawhi Ball. Cole Simons to the line for 2 free throws. [Team fouls: 4] (Kawhi Ball: 2 personal fouls)   FT 1/2: GOOD   FT 2/2: MISS Cole Simons makes 1/2 from the line. Offensive rebound by DeMar Turner! DeMar Turner kicks it out.
Score: 6-16

[06:11] Team_045 possession (Score: 6-16)
DeMar Turner attempts a Midrange. Contested by Kawhi Ball (2.5 feet, ZONE). DEMAR TURNER MAKES IT! Assist: Rudy Antetokounmpo
Score: 6-18

[05:54] Team_028 possession (Score: 6-18)
Kawhi Ball attempts a Layup. Heavily contested by Zion Butler (1.9 feet, MAN)! KAWHI BALL MAKES IT! Assist: Austin Russell
Score: 8-18

[05:41] Team_045 possession (Score: 8-18)
Cole Simons attempts a 3Pt. Wide open! Myles Haliburton is 6.5 feet away. [MAN] COLE SIMONS MAKES IT! Assist: DeMar Turner
Score: 8-21

[05:26] Team_028 possession (Score: 8-21)
Carmelo Carter attempts a 3Pt. Wide open! Cole Simons is 6.6 feet away. [MAN] CARMELO CARTER MAKES IT! Assist: Kawhi Ball
Score: 11-21

[05:12] Team_045 possession (Score: 11-21)
Trae Russell drives to the basket... FOUL! Offensive foul on Trae Russell! Kawhi Ball drew the charge! [Team fouls: 3] (Trae Russell: 1 personal fouls) TURNOVER! (dead ball)

[05:02] Team_028 possession (Score: 11-21)
Carmelo Carter attempts a Midrange. Heavily contested by Cole Simons (1.4 feet, MAN)! Carmelo Carter misses. Rebound secured by DeMar Turner.

[04:46] Team_045 possession (Score: 11-21)
Cole Simons attempts a Midrange. Wide open! Myles Haliburton is 9.1 feet away. [MAN] Cole Simons misses. Rebound secured by Kawhi Ball.

[04:34] Team_028 possession (Score: 11-21)
Austin Russell drives to the basket... Austin Russell loses the ball! Stripped by Rudy Antetokounmpo! TURNOVER! (live ball)

[04:18] Team_045 possession (Score: 11-21)
DeMar Turner attempts a Midrange. Wide open! Carmelo Carter is 6.1 feet away. [ZONE] DEMAR TURNER MAKES IT! Assist: Trae Russell
Score: 11-23

[04:04] Team_028 possession (Score: 11-23)
Jimmy Brogdon attempts a 3Pt. Contested by Cole Simons (4.8 feet, ZONE). Jimmy Brogdon misses. Rebound secured by Zion Butler.

[03:49] Team_045 possession (Score: 11-23)
Cole Simons attempts a 3Pt. Contested by Myles Haliburton (5.8 feet, MAN). COLE SIMONS MAKES IT! Assist: Trae Russell
Score: 11-26

[03:35] Team_028 possession (Score: 11-26)
Jimmy Brogdon drives to the basket... Jimmy Brogdon commits a violation (traveling/carry)! TURNOVER! (dead ball)

[03:20] Team_045 possession (Score: 11-26)
Trae Russell attempts a 3Pt. Contested by Austin Russell (4.9 feet, ZONE). Trae Russell misses. Rebound secured by Kawhi Ball.

[03:08] Team_028 possession (Score: 11-26)
Jimmy Brogdon drives and kicks out. Carmelo Carter attempts a Midrange. Contested by Cole Simons (4.9 feet, MAN). CARMELO CARTER MAKES IT! Assist: Austin Russell
Score: 13-26

[02:54] Team_045 possession (Score: 13-26)
Cole Simons makes the Layup and draws the foul on Kawhi Ball! And-1! Cole Simons to the line for 1. [BONUS: 5 team fouls] (Kawhi Ball: 3 personal fouls)   FT 1/1: GOOD Cole Simons makes 1/1 from the line.
Score: 13-29

[02:38] Team_028 possession (Score: 13-29)
Kawhi Ball attempts a 3Pt. Contested by DeMar Turner (4.7 feet, MAN). Kawhi Ball misses. Rebound secured by DeMar Turner.

[02:28] Team_045 possession (Score: 13-29)
FOUL! Holding foul on Myles Haliburton. [IN THE BONUS! 6 team fouls] Cole Simons to the line for 2 free throws. (Myles Haliburton: 2 personal fouls)   FT 1/2: GOOD   FT 2/2: GOOD Cole Simons makes 2/2 from the line.
Score: 13-31

[02:14] Team_028 possession (Score: 13-31)
Kawhi Ball attempts a Midrange. Heavily contested by DeMar Turner (2.0 feet, ZONE)! KAWHI BALL MAKES IT! Assist: Carmelo Carter
Score: 15-31

[01:59] Team_045 possession (Score: 15-31)
FOUL! Shooting foul on Carmelo Carter. Cole Simons to the line for 2 free throws. [BONUS: 7 team fouls] (Carmelo Carter: 1 personal fouls)   FT 1/2: MISS   FT 2/2: MISS Cole Simons makes 0/2 from the line. Rebound secured by Carmelo Carter.

[01:44] Team_028 possession (Score: 15-31)
Carmelo Carter attempts a 3Pt. Heavily contested by Cole Simons (1.7 feet, ZONE)! CARMELO CARTER MAKES IT! Assist: Myles Haliburton
Score: 18-31

[01:28] Team_045 possession (Score: 18-31)
DeMar Turner drives to the basket... DeMar Turner throws a bad pass out of bounds! TURNOVER! (dead ball)

[01:28] Substitution (Team_028): Austin Russell OUT → Scottie Ingram IN (stamina_rule2)

[01:28] Substitution (Team_028): Carmelo Carter OUT → Tyrese Quickley IN (stamina_rule2)

[01:28] Substitution (Team_028): Myles Haliburton OUT → Miles Booker IN (stamina_rule2)

[01:28] Substitution (Team_028): Kawhi Ball OUT → Bam Towns IN (stamina_rule2)

[01:28] Substitution (Team_028): Jimmy Brogdon OUT → Collin Bridges IN (stamina_rule2)

[01:28] Substitution (Team_045): Rudy Antetokounmpo OUT → John Wagner IN (stamina_rule2)

[01:28] Substitution (Team_045): Trae Russell OUT → Julius James IN (stamina_rule2)

[01:28] Substitution (Team_045): Cole Simons OUT → Gary Towns IN (stamina_rule2)

[01:28] Substitution (Team_045): DeMar Turner OUT → Tim Sexton IN (stamina_rule2)

[01:28] Substitution (Team_045): Zion Butler OUT → Stephen Paul IN (stamina_rule2)

[01:13] Team_028 possession (Score: 18-31)
Miles Booker makes the Layup and draws the foul on Stephen Paul! And-1! Miles Booker to the line for 1. [Team fouls: 4] (Stephen Paul: 1 personal fouls)   FT 1/1: GOOD Miles Booker makes 1/1 from the line.
Score: 21-31

[00:59] Team_045 possession (Score: 21-31)
Stephen Paul attempts a Layup. Wide open! Collin Bridges is 7.0 feet away. [MAN] STEPHEN PAUL MAKES IT! Assist: Tim Sexton
Score: 21-33

[00:45] Team_028 possession (Score: 21-33)
FOUL! Shooting foul on Stephen Paul. Miles Booker to the line for 2 free throws. [BONUS: 5 team fouls] (Stephen Paul: 2 personal fouls)   FT 1/2: GOOD   FT 2/2: MISS Miles Booker makes 1/2 from the line. Rebound secured by Julius James.
Score: 22-33

[00:29] Team_045 possession (Score: 22-33)
Tim Sexton attempts a 3Pt. Contested by Tyrese Quickley (5.2 feet, ZONE). Tim Sexton misses. Rebound secured by Collin Bridges.

[00:16] Team_028 possession (Score: 22-33)
Collin Bridges attempts a Midrange. Wide open! Stephen Paul is 7.0 feet away. [MAN] Collin Bridges misses. Rebound secured by Julius James.

[00:03] Team_045 possession (Score: 22-33)
John Wagner attempts a 3Pt. Wide open! Scottie Ingram is 8.0 feet away. [ZONE] JOHN WAGNER MAKES IT! Assist: Gary Towns
Score: 22-36

================================================================================
                              1ST QUARTER COMPLETE                              
================================================================================

1ST QUARTER SCORE: Team_028 22, Team_045 36

BOX SCORE:
================================================================================

Team_028
--------------------------------------------------------------------------------
Player                MIN  PTS  REB  AST  TO      FG   FG%      3P   3P%
--------------------------------------------------------------------------------
Carmelo Carter         11    8    1    1   0   3/7    42.9     0/0   0.0
Kawhi Ball             11    4    5    1   0   2/4    50.0     0/0   0.0
Miles Booker            1    3    0    0   0   1/2    50.0     0/0   0.0
Jimmy Brogdon          11    2    1    0   0   1/3    33.3     0/0   0.0
Myles Haliburton       11    2    0    1   0   1/2    50.0     0/0   0.0
Austin Russell         11    0    0    3   0   0/0     0.0     0/0   0.0
Collin Bridges          1    0    1    0   0   0/1     0.0     0/0   0.0

TEAM: FG: 8/19 (42.1%), 3PT: 2/6 (33.3%), REB: 8 (0 off, 8 def), AST: 6, TO: 5
TEAM FOULS: 7 [Team_045 in BONUS]


Team_045
--------------------------------------------------------------------------------
Player                MIN  PTS  REB  AST  TO      FG   FG%      3P   3P%
--------------------------------------------------------------------------------
Cole Simons            11   11    1    1   0   4/7    57.1     0/0   0.0
DeMar Turner           11    7    4    1   0   3/4    75.0     0/0   0.0
Trae Russell           11    6    0    4   0   3/4    75.0     0/0   0.0
Rudy Antetokounmpo     11    6    0    2   0   2/3    66.7     0/0   0.0
John Wagner             1    3    0    0   0   1/1   100.0     0/0   0.0
Stephen Paul            1    2    0    0   0   1/1   100.0     0/0   0.0
Zion Butler            11    0    5    2   0   0/1     0.0     0/0   0.0
Tim Sexton              1    0    0    1   0   0/1     0.0     0/0   0.0
Julius James            1    0    2    0   0   0/0     0.0     0/0   0.0
Gary Towns              1    0    0    1   0   0/0     0.0     0/0   0.0

TEAM: FG: 14/22 (63.6%), 3PT: 5/9 (55.6%), REB: 12 (1 off, 11 def), AST: 12, TO: 2
TEAM FOULS: 5 [Team_028 in BONUS]

================================================================================

================================================================================
                       2ND QUARTER - Team_028 vs Team_045                       
================================================================================

[12:00] Team_028 possession (Score: 22-36)
Jimmy Brogdon drives to the basket... Jimmy Brogdon throws a bad pass! Stolen by Zion Butler! TURNOVER! (live ball)

[11:46] Team_045 possession (Score: 22-36)
Cole Simons attempts a Midrange. Contested by Myles Haliburton (3.0 feet, MAN). Cole Simons misses. Rebound secured by Jimmy Brogdon.

[11:31] Team_028 possession (Score: 22-36)
Austin Russell attempts a Layup. Contested by Rudy Antetokounmpo (3.8 feet, MAN). AUSTIN RUSSELL MAKES IT! Assist: Jimmy Brogdon
Score: 24-36

[11:20] Team_045 possession (Score: 24-36)
Zion Butler attempts a Midrange. Contested by Jimmy Brogdon (4.7 feet, MAN). Zion Butler misses. Rebound secured by Kawhi Ball.

[11:06] Team_028 possession (Score: 24-36)
Jimmy Brogdon attempts a Midrange. Wide open! Zion Butler is 6.4 feet away. [MAN] JIMMY BROGDON MAKES IT! Assist: Carmelo Carter
Score: 26-36

[10:50] Team_045 possession (Score: 26-36)
DeMar Turner attempts a Layup. Contested by Kawhi Ball (5.8 feet, ZONE). DeMar Turner misses. Rebound secured by Carmelo Carter.

[10:36] Team_028 possession (Score: 26-36)
Austin Russell loses control! Ball rolls out of bounds! TURNOVER! (dead ball)

[10:36] Substitution (Team_028): Kawhi Ball OUT → Bam Towns IN (stamina_rule2)

[10:36] Substitution (Team_028): Jimmy Brogdon OUT → Collin Bridges IN (stamina_rule2)

[10:36] Substitution (Team_045): Cole Simons OUT → Gary Towns IN (stamina_rule2)

[10:36] Substitution (Team_045): Zion Butler OUT → Stephen Paul IN (stamina_rule2)

[10:26] Team_045 possession (Score: 26-36)
FOUL! Shooting foul on Collin Bridges. DeMar Turner to the line for 2 free throws. [Team fouls: 1] (Collin Bridges: 1 personal fouls)   FT 1/2: GOOD   FT 2/2: GOOD DeMar Turner makes 2/2 from the line.
Score: 26-38

[10:08] Team_028 possession (Score: 26-38)
Carmelo Carter attempts a 3Pt. Contested by Rudy Antetokounmpo (5.0 feet, ZONE). CARMELO CARTER MAKES IT! Assist: Austin Russell
Score: 29-38

[09:57] Team_045 possession (Score: 29-38)
Stephen Paul attempts a Layup. BLOCKED BY COLLIN BRIDGES! Ball is loose! Offensive rebound by DeMar Turner! DeMar Turner kicks it out.

[09:39] Team_045 possession (Score: 29-38)
Gary Towns attempts a Midrange. Contested by Myles Haliburton (3.0 feet, ZONE). Gary Towns misses. Offensive rebound by Stephen Paul! Stephen Paul puts it back in!
Score: 29-40

[09:23] Team_028 possession (Score: 29-40)
FOUL! Shooting foul on Trae Russell. Bam Towns to the line for 2 free throws. [Team fouls: 1] (Trae Russell: 1 personal fouls)   FT 1/2: MISS   FT 2/2: GOOD Bam Towns makes 1/2 from the line.
Score: 30-40

[09:11] Team_045 possession (Score: 30-40)
DeMar Turner drives, picks up Collin Bridges. Help arrives from Carmelo Carter! DeMar Turner attempts a Dunk. Contested by Carmelo Carter (3.4 feet, ZONE). DeMar Turner misses. Rebound secured by Carmelo Carter.

[08:56] Team_028 possession (Score: 30-40)
Myles Haliburton attempts a Midrange. Contested by Trae Russell (4.0 feet, ZONE). MYLES HALIBURTON MAKES IT! Assist: Collin Bridges
Score: 32-40

[08:39] Team_045 possession (Score: 32-40)
Rudy Antetokounmpo attempts a 3Pt. Contested by Austin Russell (3.5 feet, MAN). Rudy Antetokounmpo misses. Rebound secured by Carmelo Carter.

[08:25] Team_028 possession (Score: 32-40)
Austin Russell attempts a 3Pt. Contested by Rudy Antetokounmpo (2.7 feet, MAN). Austin Russell misses. Rebound secured by Gary Towns.

[08:13] Team_045 possession (Score: 32-40)
Trae Russell drives to the basket... Trae Russell throws a bad pass out of bounds! TURNOVER! (dead ball)

[08:13] Substitution (Team_028): Austin Russell OUT → Scottie Ingram IN (stamina_rule2)

[08:13] Substitution (Team_028): Carmelo Carter OUT → Tyrese Quickley IN (stamina_rule2)

[08:13] Substitution (Team_028): Myles Haliburton OUT → Miles Booker IN (stamina_rule2)

[08:13] Substitution (Team_045): Rudy Antetokounmpo OUT → John Wagner IN (stamina_rule2)

[08:13] Substitution (Team_045): Trae Russell OUT → Julius James IN (stamina_rule2)

[08:13] Substitution (Team_045): DeMar Turner OUT → Tim Sexton IN (stamina_rule2)

[07:57] Team_028 possession (Score: 32-40)
Bam Towns drives to the basket... Bam Towns throws a bad pass! Stolen by Tim Sexton! TURNOVER! (live ball)

[07:43] Team_045 possession (Score: 32-40)
Stephen Paul attempts a Midrange. Wide open! Tyrese Quickley is 8.9 feet away. [ZONE] Stephen Paul misses. Rebound secured by Collin Bridges.

[07:31] Team_028 possession (Score: 32-40)
Scottie Ingram attempts a Layup. BLOCKED BY JULIUS JAMES! Ball is loose! Offensive rebound by Bam Towns! Bam Towns kicks it out.

[07:15] Team_028 possession (Score: 32-40)
Bam Towns attempts a Midrange. Heavily contested by Tim Sexton (0.5 feet, MAN)! Bam Towns misses. Offensive rebound by Bam Towns! Bam Towns kicks it out.

[07:02] Team_028 possession (Score: 32-40)
Tyrese Quickley drives, picks up Julius James. Help arrives from John Wagner! Tyrese Quickley attempts a Dunk. Contested by John Wagner (2.9 feet, MAN). Tyrese Quickley misses. Offensive rebound by Bam Towns! Bam Towns kicks it out.

[06:44] Team_028 possession (Score: 32-40)
Miles Booker attempts a Layup. BLOCKED BY JULIUS JAMES! Ball is loose! Rebound secured by Stephen Paul.

[06:28] Team_045 possession (Score: 32-40)
Stephen Paul attempts a Layup. Heavily contested by Collin Bridges (0.5 feet, MAN)! STEPHEN PAUL MAKES IT!
Score: 32-42

[06:13] Team_028 possession (Score: 32-42)
FOUL! Shooting foul on Julius James. Collin Bridges to the line for 2 free throws. [Team fouls: 2] (Julius James: 1 personal fouls)   FT 1/2: MISS   FT 2/2: MISS Collin Bridges makes 0/2 from the line. Rebound secured by Julius James.

[05:58] Team_045 possession (Score: 32-42)
Stephen Paul makes the Layup and draws the foul on Collin Bridges! And-1! Stephen Paul to the line for 1. [Team fouls: 2] (Collin Bridges: 2 personal fouls)   FT 1/1: GOOD Stephen Paul makes 1/1 from the line.
Score: 32-45

[05:46] Team_028 possession (Score: 32-45)
Tyrese Quickley attempts a 3Pt. Wide open! John Wagner is 7.8 feet away. [ZONE] TYRESE QUICKLEY MAKES IT! Assist: Collin Bridges
Score: 35-45

[05:30] Team_045 possession (Score: 35-45)
Gary Towns attempts a 3Pt. Contested by Miles Booker (3.0 feet, MAN). Gary Towns misses. Rebound secured by Collin Bridges.

[05:17] Team_028 possession (Score: 35-45)
Collin Bridges attempts a 3Pt. Wide open! Julius James is 6.9 feet away. [ZONE] Collin Bridges misses. Rebound secured by Stephen Paul.

[05:03] Team_045 possession (Score: 35-45)
Julius James drives and kicks out. Gary Towns attempts a 3Pt. Contested by Scottie Ingram (3.9 feet, ZONE). GARY TOWNS MAKES IT! Assist: John Wagner
Score: 35-48

[04:50] Team_028 possession (Score: 35-48)
Collin Bridges drives to the basket... FOUL! Offensive foul on Collin Bridges! Stephen Paul drew the charge! [Team fouls: 3] (Collin Bridges: 3 personal fouls) TURNOVER! (dead ball)

[04:40] Team_045 possession (Score: 35-48)
Julius James attempts a Midrange. Contested by Tyrese Quickley (4.7 feet, MAN). JULIUS JAMES MAKES IT! Assist: Stephen Paul
Score: 35-50

[04:24] Team_028 possession (Score: 35-50)
FOUL! Shooting foul on Julius James. Tyrese Quickley to the line for 2 free throws. [Team fouls: 3] (Julius James: 2 personal fouls)   FT 1/2: GOOD   FT 2/2: GOOD Tyrese Quickley makes 2/2 from the line.
Score: 37-50

[04:11] Team_045 possession (Score: 37-50)
Julius James drives to the basket... Julius James loses the ball! Stripped by Tyrese Quickley! TURNOVER! (live ball)

[03:55] Team_028 possession (Score: 37-50)
Scottie Ingram attempts a 3Pt. Wide open! John Wagner is 6.0 feet away. [ZONE] Scottie Ingram misses. Rebound secured by Stephen Paul.

[03:37] Team_045 possession (Score: 37-50)
Stephen Paul attempts a Layup. BLOCKED BY TYRESE QUICKLEY! Ball is loose! Rebound secured by Bam Towns.

[03:26] Team_028 possession (Score: 37-50)
Collin Bridges drives, picks up Stephen Paul. Help arrives from Julius James! Collin Bridges attempts a Dunk. Contested by Julius James (5.5 feet, MAN). COLLIN BRIDGES MAKES IT! Assist: Scottie Ingram
Score: 39-50

[03:17] Team_045 possession (Score: 39-50)
Julius James attempts a 3Pt. Contested by Tyrese Quickley (3.2 feet, MAN). Julius James misses. Rebound secured by Collin Bridges.

[03:04] Team_028 possession (Score: 39-50)
Collin Bridges attempts a Layup. Heavily contested by Stephen Paul (0.5 feet, MAN)! COLLIN BRIDGES MAKES IT!
Score: 41-50

[02:53] Team_045 possession (Score: 41-50)
John Wagner attempts a 3Pt. Contested by Scottie Ingram (3.0 feet, MAN). JOHN WAGNER MAKES IT! Assist: Stephen Paul
Score: 41-53

[02:35] Team_028 possession (Score: 41-53)
FOUL! Reach-in foul on Tim Sexton during the drive. [Team fouls: 4] No free throws, side out. (Tim Sexton: 1 personal fouls)

[02:23] Team_028 possession (Score: 41-53)
Collin Bridges attempts a Midrange. Wide open! Julius James is 9.8 feet away. [ZONE] COLLIN BRIDGES MAKES IT! Assist: Scottie Ingram
Score: 43-53

[02:10] Team_045 possession (Score: 43-53)
Tim Sexton throws a bad pass out of bounds! TURNOVER! (dead ball)

[01:54] Team_028 possession (Score: 43-53)
Bam Towns drives and kicks out. Miles Booker attempts a Midrange. Contested by Gary Towns (4.8 feet, MAN). Miles Booker misses. Rebound secured by Tim Sexton.

[01:36] Team_045 possession (Score: 43-53)
Tim Sexton drives to the basket... Tim Sexton throws a bad pass out of bounds! TURNOVER! (dead ball)

[01:20] Team_028 possession (Score: 43-53)
Scottie Ingram attempts a Midrange. Contested by Tim Sexton (3.7 feet, ZONE). Scottie Ingram misses. Rebound secured by Tim Sexton.

[01:08] Team_045 possession (Score: 43-53)
Stephen Paul attempts a Layup. BLOCKED BY COLLIN BRIDGES! Ball is loose! Rebound secured by Bam Towns.

[00:51] Team_028 possession (Score: 43-53)
Miles Booker drives, picks up Gary Towns. Help arrives from Julius James! Miles Booker attempts a Dunk. Wide open! Julius James is 6.9 feet away. [MAN] MILES BOOKER MAKES IT! Assist: Scottie Ingram
Score: 45-53

[00:37] Team_045 possession (Score: 45-53)
Stephen Paul attempts a Midrange. Contested by Collin Bridges (4.9 feet, MAN). Stephen Paul misses. Offensive rebound by Julius James! Julius James kicks it out.

[00:19] Team_045 possession (Score: 45-53)
FOUL! Shooting foul on Scottie Ingram. John Wagner to the line for 3 free throws. [Team fouls: 4] (Scottie Ingram: 1 personal fouls)   FT 1/3: GOOD   FT 2/3: MISS   FT 3/3: MISS John Wagner makes 1/3 from the line. Offensive rebound by Tim Sexton! Tim Sexton kicks it out.
Score: 45-54

[00:05] Team_045 possession (Score: 45-54)
Tim Sexton attempts a 3Pt. Wide open! Bam Towns is 9.7 feet away. [MAN] Tim Sexton misses. Rebound secured by Collin Bridges.

================================================================================
                              2ND QUARTER COMPLETE                              
================================================================================

2ND QUARTER SCORE: Team_028 23, Team_045 18

BOX SCORE:
================================================================================

Team_028
--------------------------------------------------------------------------------
Player                MIN  PTS  REB  AST  TO      FG   FG%      3P   3P%
--------------------------------------------------------------------------------
Collin Bridges         12    6    4    2   0   3/5    60.0     0/0   0.0
Tyrese Quickley        10    5    0    0   0   2/2   100.0     0/0   0.0
Carmelo Carter         15    3    3    1   0   1/1   100.0     0/0   0.0
Jimmy Brogdon          12    2    1    1   0   1/1   100.0     0/0   0.0
Austin Russell         15    2    0    1   0   1/2    50.0     0/0   0.0
Myles Haliburton       15    2    0    0   0   1/1   100.0     0/0   0.0
Miles Booker           10    2    0    0   0   1/2    50.0     0/0   0.0
Bam Towns              12    1    5    0   0   1/2    50.0     0/0   0.0
Kawhi Ball             12    0    1    0   0   0/0     0.0     0/0   0.0
Scottie Ingram         10    0    0    3   0   0/2     0.0     0/0   0.0

TEAM: FG: 11/18 (61.1%), 3PT: 2/5 (40.0%), REB: 14 (3 off, 11 def), AST: 8, TO: 4
TEAM FOULS: 4


Team_045
--------------------------------------------------------------------------------
Player                MIN  PTS  REB  AST  TO      FG   FG%      3P   3P%
--------------------------------------------------------------------------------
Stephen Paul           12    7    4    2   0   3/6    50.0     0/0   0.0
Gary Towns             12    3    1    0   0   1/2    50.0     0/0   0.0
John Wagner            10    3    0    1   0   1/1   100.0     0/0   0.0
DeMar Turner           15    2    1    0   0   1/3    33.3     0/0   0.0
Julius James           10    2    2    0   0   1/2    50.0     0/0   0.0
Cole Simons            12    0    0    0   0   0/1     0.0     0/0   0.0
Zion Butler            12    0    0    0   0   0/1     0.0     0/0   0.0
Rudy Antetokounmpo     15    0    0    0   0   0/1     0.0     0/0   0.0
Tim Sexton             10    0    3    0   0   0/1     0.0     0/0   0.0

TEAM: FG: 7/18 (38.9%), 3PT: 1/5 (20.0%), REB: 11 (4 off, 7 def), AST: 3, TO: 4
TEAM FOULS: 4

================================================================================

================================================================================
                       3RD QUARTER - Team_028 vs Team_045                       
================================================================================

[12:00] Team_028 possession (Score: 45-54)
Myles Haliburton attempts a 3Pt. Contested by Cole Simons (3.2 feet, ZONE). Myles Haliburton misses. Rebound secured by Zion Butler.

[11:46] Team_045 possession (Score: 45-54)
Trae Russell attempts a 3Pt. Heavily contested by Carmelo Carter (0.8 feet, MAN)! Trae Russell misses. Rebound secured by Jimmy Brogdon.

[11:33] Team_028 possession (Score: 45-54)
Kawhi Ball makes the Layup and draws the foul on DeMar Turner! And-1! Kawhi Ball to the line for 1. [Team fouls: 1] (DeMar Turner: 1 personal fouls)   FT 1/1: GOOD Kawhi Ball makes 1/1 from the line.
Score: 48-54

[11:21] Team_045 possession (Score: 48-54)
FOUL! Reach-in foul on Kawhi Ball during the drive. [Team fouls: 1] No free throws, side out. (Kawhi Ball: 1 personal fouls)

[11:10] Team_045 possession (Score: 48-54)
Rudy Antetokounmpo attempts a 3Pt. Wide open! Myles Haliburton is 7.3 feet away. [ZONE] RUDY ANTETOKOUNMPO MAKES IT! Assist: DeMar Turner
Score: 48-57

[10:54] Team_028 possession (Score: 48-57)
Jimmy Brogdon drives to the basket... Jimmy Brogdon throws a bad pass! Stolen by Zion Butler! TURNOVER! (live ball)

[10:38] Team_045 possession (Score: 48-57)
DeMar Turner attempts a 3Pt. Contested by Kawhi Ball (2.3 feet, MAN). DEMAR TURNER MAKES IT! Assist: Rudy Antetokounmpo
Score: 48-60

[10:22] Team_028 possession (Score: 48-60)
Carmelo Carter drives, Zion Butler stays with him. Carmelo Carter attempts a Dunk. Heavily contested by Zion Butler (1.8 feet, ZONE)! CARMELO CARTER MAKES IT! Assist: Austin Russell
Score: 50-60

[10:10] Team_045 possession (Score: 50-60)
FOUL! Offensive foul on Zion Butler! Jimmy Brogdon drew the charge! [Team fouls: 2] (Zion Butler: 1 personal fouls) TURNOVER! (dead ball)

[09:54] Team_028 possession (Score: 50-60)
Carmelo Carter attempts a 3Pt. Heavily contested by DeMar Turner (1.9 feet, ZONE)! Carmelo Carter misses. Rebound secured by Cole Simons.

[09:39] Team_045 possession (Score: 50-60)
Rudy Antetokounmpo attempts a 3Pt. Contested by Austin Russell (3.8 feet, MAN). Rudy Antetokounmpo misses. Offensive rebound by Zion Butler! Zion Butler puts it back in!
Score: 50-62

[09:26] Team_028 possession (Score: 50-62)
Jimmy Brogdon attempts a Layup. Heavily contested by Zion Butler (0.5 feet, MAN)! JIMMY BROGDON MAKES IT! Assist: Myles Haliburton
Score: 52-62

[09:09] Team_045 possession (Score: 52-62)
Rudy Antetokounmpo attempts a Midrange. Contested by Austin Russell (3.8 feet, MAN). RUDY ANTETOKOUNMPO MAKES IT!
Score: 52-64

[08:51] Team_028 possession (Score: 52-64)
Austin Russell attempts a 3Pt. Heavily contested by Cole Simons (0.9 feet, ZONE)! Austin Russell misses. Rebound secured by Zion Butler.

[08:35] Team_045 possession (Score: 52-64)
Rudy Antetokounmpo attempts a 3Pt. Contested by Austin Russell (2.9 feet, ZONE). Rudy Antetokounmpo misses. Offensive rebound by Zion Butler! Zion Butler's putback is no good. Rebound secured by Jimmy Brogdon.

[08:20] Team_028 possession (Score: 52-64)
Kawhi Ball loses the ball! Stripped by Zion Butler! TURNOVER! (live ball)

[08:02] Team_045 possession (Score: 52-64)
Zion Butler attempts a Midrange. Contested by Myles Haliburton (4.1 feet, ZONE). Zion Butler misses. Rebound secured by Carmelo Carter.

[07:43] Team_028 possession (Score: 52-64)
Austin Russell makes the Dunk and draws the foul on Cole Simons! And-1! Austin Russell to the line for 1. [Team fouls: 3] (Cole Simons: 1 personal fouls)   FT 1/1: GOOD Austin Russell makes 1/1 from the line.
Score: 55-64

[07:28] Team_045 possession (Score: 55-64)
Cole Simons drives, Kawhi Ball stays with him. Cole Simons attempts a Dunk. Contested by Kawhi Ball (4.6 feet, ZONE). Cole Simons misses. Rebound secured by Jimmy Brogdon.

[07:15] Team_028 possession (Score: 55-64)
Myles Haliburton drives and kicks out. FOUL! Shooting foul on Cole Simons. Austin Russell to the line for 3 free throws. [Team fouls: 4] (Cole Simons: 2 personal fouls)   FT 1/3: GOOD   FT 2/3: MISS   FT 3/3: GOOD Austin Russell makes 2/3 from the line.
Score: 57-64

[07:00] Team_045 possession (Score: 57-64)
Trae Russell attempts a Layup. Contested by Kawhi Ball (2.3 feet, ZONE). Trae Russell misses. Rebound secured by Jimmy Brogdon.

[06:46] Team_028 possession (Score: 57-64)
Austin Russell attempts a 3Pt. Contested by Rudy Antetokounmpo (3.7 feet, MAN). Austin Russell misses. Rebound secured by Cole Simons.

[06:32] Team_045 possession (Score: 57-64)
DeMar Turner attempts a 3Pt. Contested by Kawhi Ball (4.6 feet, MAN). DeMar Turner misses. Rebound secured by Kawhi Ball.

[06:20] Team_028 possession (Score: 57-64)
Austin Russell drives, picks up Rudy Antetokounmpo. Help arrives from Cole Simons! Austin Russell attempts a Layup. Heavily contested by Cole Simons (1.8 feet, MAN)! Austin Russell misses. Offensive rebound by Jimmy Brogdon! Jimmy Brogdon kicks it out.

[06:06] Team_028 possession (Score: 57-64)
Austin Russell drives to the basket... FOUL! Offensive foul on Austin Russell! Zion Butler drew the charge! [Team fouls: 2] (Austin Russell: 1 personal fouls) TURNOVER! (dead ball)

[05:54] Team_045 possession (Score: 57-64)
FOUL! Shooting foul on Kawhi Ball. DeMar Turner to the line for 2 free throws. [Team fouls: 3] (Kawhi Ball: 2 personal fouls)   FT 1/2: GOOD   FT 2/2: GOOD DeMar Turner makes 2/2 from the line.
Score: 57-66

[05:42] Team_028 possession (Score: 57-66)
Kawhi Ball attempts a 3Pt. Contested by Zion Butler (4.8 feet, MAN). Kawhi Ball misses. Rebound secured by Zion Butler.

[05:29] Team_045 possession (Score: 57-66)
Cole Simons drives and kicks out. Cole Simons attempts a 3Pt. Wide open! Austin Russell is 6.7 feet away. [ZONE] COLE SIMONS MAKES IT!
Score: 57-69

[05:17] Team_028 possession (Score: 57-69)
Myles Haliburton attempts a 3Pt. Contested by Cole Simons (2.7 feet, ZONE). Myles Haliburton misses. Offensive rebound by Kawhi Ball! Kawhi Ball kicks it out.

[04:57] Team_028 possession (Score: 57-69)
Austin Russell attempts a Midrange. Wide open! Rudy Antetokounmpo is 8.7 feet away. [MAN] Austin Russell misses. Offensive rebound by Jimmy Brogdon! Jimmy Brogdon kicks it out.

[04:43] Team_028 possession (Score: 57-69)
Jimmy Brogdon drives to the basket... Jimmy Brogdon loses control! Ball rolls out of bounds! TURNOVER! (dead ball)

[04:28] Team_045 possession (Score: 57-69)
Trae Russell attempts a Layup. Heavily contested by Carmelo Carter (1.8 feet, MAN)! TRAE RUSSELL MAKES IT! Assist: Zion Butler
Score: 57-71

[04:14] Team_028 possession (Score: 57-71)
Jimmy Brogdon drives, Zion Butler stays with him. Jimmy Brogdon attempts a Layup. Contested by Zion Butler (3.5 feet, MAN). JIMMY BROGDON MAKES IT!
Score: 59-71

[04:00] Team_045 possession (Score: 59-71)
Rudy Antetokounmpo attempts a 3Pt. Contested by Austin Russell (5.6 feet, MAN). Rudy Antetokounmpo misses. Offensive rebound by Zion Butler! Zion Butler puts it back in!
Score: 59-73

[03:43] Team_028 possession (Score: 59-73)
Myles Haliburton attempts a 3Pt. Contested by Cole Simons (5.0 feet, MAN). Myles Haliburton misses. Offensive rebound by Kawhi Ball! Kawhi Ball kicks it out.

[03:27] Team_028 possession (Score: 59-73)
Austin Russell attempts a Midrange. Contested by Trae Russell (5.3 feet, ZONE). AUSTIN RUSSELL MAKES IT!
Score: 61-73

[03:16] Team_045 possession (Score: 61-73)
Rudy Antetokounmpo attempts a 3Pt. Contested by Austin Russell (2.8 feet, MAN). Rudy Antetokounmpo misses. Offensive rebound by DeMar Turner! DeMar Turner kicks it out.

[03:00] Team_045 possession (Score: 61-73)
Rudy Antetokounmpo attempts a 3Pt. Contested by Austin Russell (4.8 feet, ZONE). RUDY ANTETOKOUNMPO MAKES IT! Assist: Trae Russell
Score: 61-76

[02:42] Team_028 possession (Score: 61-76)
FOUL! Reach-in foul on Zion Butler during the drive. [IN THE BONUS! 5 team fouls] Jimmy Brogdon to the line for 2 free throws. (Zion Butler: 2 personal fouls)   FT 1/2: GOOD   FT 2/2: GOOD Jimmy Brogdon makes 2/2 from the line.
Score: 63-76

[02:26] Team_045 possession (Score: 63-76)
DeMar Turner makes the Layup and draws the foul on Carmelo Carter! And-1! DeMar Turner to the line for 1. [Team fouls: 4] (Carmelo Carter: 1 personal fouls)   FT 1/1: MISS DeMar Turner makes 0/1 from the line. Rebound secured by Kawhi Ball.
Score: 63-78

[02:11] Team_028 possession (Score: 63-78)
Carmelo Carter attempts a Midrange. Contested by Cole Simons (5.0 feet, ZONE). Carmelo Carter misses. Rebound secured by DeMar Turner.

[01:57] Team_045 possession (Score: 63-78)
Trae Russell attempts a 3Pt. Wide open! Carmelo Carter is 8.0 feet away. [MAN] Trae Russell misses. Offensive rebound by DeMar Turner! DeMar Turner kicks it out.

[01:44] Team_045 possession (Score: 63-78)
Rudy Antetokounmpo makes the Dunk and draws the foul on Austin Russell! And-1! Rudy Antetokounmpo to the line for 1. [BONUS: 5 team fouls] (Austin Russell: 2 personal fouls)   FT 1/1: GOOD Rudy Antetokounmpo makes 1/1 from the line.
Score: 63-81

[01:32] Team_028 possession (Score: 63-81)
Kawhi Ball attempts a 3Pt. Wide open! Cole Simons is 7.7 feet away. [ZONE] Kawhi Ball misses. Rebound secured by Zion Butler.

[01:19] Team_045 possession (Score: 63-81)
Zion Butler drives and kicks out. DeMar Turner attempts a Midrange. Contested by Kawhi Ball (4.3 feet, MAN). DeMar Turner misses. Offensive rebound by Zion Butler! Zion Butler's putback is no good. Rebound secured by Kawhi Ball.

[01:06] Team_028 possession (Score: 63-81)
Myles Haliburton attempts a Midrange. Contested by Trae Russell (5.6 feet, ZONE). MYLES HALIBURTON MAKES IT!
Score: 65-81

[00:52] Team_045 possession (Score: 65-81)
DeMar Turner drives and kicks out. Trae Russell attempts a 3Pt. Contested by Myles Haliburton (3.3 feet, ZONE). Trae Russell misses. Offensive rebound by Zion Butler! Zion Butler puts it back in!
Score: 65-83

[00:40] Team_028 possession (Score: 65-83)
Jimmy Brogdon drives, Zion Butler stays with him. Jimmy Brogdon attempts a Layup. Contested by Zion Butler (2.2 feet, MAN). Jimmy Brogdon misses. Rebound secured by Zion Butler.

[00:23] Team_045 possession (Score: 65-83)
DeMar Turner throws a bad pass! Stolen by Kawhi Ball! TURNOVER! (live ball)

[00:05] Team_028 possession (Score: 65-83)
Jimmy Brogdon attempts a 3Pt. Contested by Cole Simons (5.5 feet, ZONE). JIMMY BROGDON MAKES IT! Assist: Myles Haliburton
Score: 68-83

================================================================================
                              3RD QUARTER COMPLETE                              
================================================================================

3RD QUARTER SCORE: Team_028 23, Team_045 29

BOX SCORE:
================================================================================

Team_028
--------------------------------------------------------------------------------
Player                MIN  PTS  REB  AST  TO      FG   FG%      3P   3P%
--------------------------------------------------------------------------------
Jimmy Brogdon          24    9    6    0   0   4/5    80.0     0/0   0.0
Austin Russell         27    7    0    1   0   3/5    60.0     0/0   0.0
Myles Haliburton       27    2    0    2   0   1/2    50.0     0/0   0.0
Carmelo Carter         27    2    1    0   0   1/3    33.3     0/0   0.0

TEAM: FG: 10/18 (55.6%), 3PT: 1/7 (14.3%), REB: 10 (4 off, 6 def), AST: 3, TO: 4
TEAM FOULS: 5 [Team_045 in BONUS]


Team_045
--------------------------------------------------------------------------------
Player                MIN  PTS  REB  AST  TO      FG   FG%      3P   3P%
--------------------------------------------------------------------------------
Rudy Antetokounmpo     27   11    0    1   0   4/5    80.0     0/0   0.0
Zion Butler            24    6    8    1   0   3/5    60.0     0/0   0.0
DeMar Turner           27    5    3    1   0   2/4    50.0     0/0   0.0
Kawhi Ball             24    3    5    0   0   1/3    33.3     0/0   0.0
Cole Simons            24    3    2    0   0   1/2    50.0     0/0   0.0
Trae Russell           27    2    0    1   0   1/3    33.3     0/0   0.0

TEAM: FG: 11/19 (57.9%), 3PT: 5/8 (62.5%), REB: 15 (7 off, 8 def), AST: 4, TO: 2
TEAM FOULS: 5 [Team_028 in BONUS]

================================================================================

================================================================================
                       4TH QUARTER - Team_028 vs Team_045                       
================================================================================

[12:00] Substitution (Team_028): Austin Russell OUT (stamina: 70) → Scottie Ingram IN (comeback_detected)

[12:00] Substitution (Team_045): Rudy Antetokounmpo OUT (stamina: 70) → John Wagner IN (comeback_detected)

[12:00] Team_028 possession (Score: 68-83)
Scottie Ingram attempts a 3Pt. Contested by Cole Simons (3.2 feet, ZONE). Scottie Ingram misses. Rebound secured by Zion Butler.

[11:46] Team_045 possession (Score: 68-83)
Trae Russell attempts a Midrange. Heavily contested by Kawhi Ball (1.8 feet, ZONE)! TRAE RUSSELL MAKES IT!
Score: 68-85

[11:34] Team_028 possession (Score: 68-85)
Kawhi Ball drives, Zion Butler stays with him. Kawhi Ball attempts a Layup. Contested by Zion Butler (2.3 feet, ZONE). Kawhi Ball misses. Rebound secured by Zion Butler.

[11:22] Team_045 possession (Score: 68-85)
John Wagner attempts a Midrange. Wide open! Scottie Ingram is 6.8 feet away. [MAN] John Wagner misses. Rebound secured by Carmelo Carter.

[11:08] Team_028 possession (Score: 68-85)
Myles Haliburton attempts a 3Pt. Contested by Cole Simons (2.3 feet, MAN). Myles Haliburton misses. Rebound secured by Zion Butler.

[10:57] Team_045 possession (Score: 68-85)
DeMar Turner drives, Kawhi Ball stays with him. DeMar Turner attempts a Layup. Contested by Kawhi Ball (2.2 feet, ZONE). DEMAR TURNER MAKES IT! Assist: Cole Simons
Score: 68-87

[10:43] Team_028 possession (Score: 68-87)
Myles Haliburton attempts a 3Pt. Heavily contested by Cole Simons (1.1 feet, MAN)! Myles Haliburton misses. FOUL! Loose ball foul on DeMar Turner during the rebound battle. [Team fouls: 1] No free throws, side out. (DeMar Turner: 1 personal fouls)

[10:30] Team_028 possession (Score: 68-87)
Jimmy Brogdon attempts a Layup. BLOCKED BY JOHN WAGNER! Ball is loose! Rebound secured by Cole Simons.

[10:16] Team_045 possession (Score: 68-87)
John Wagner drives, picks up Kawhi Ball. Help arrives from Carmelo Carter! John Wagner attempts a Dunk. Contested by Carmelo Carter (3.0 feet, ZONE). JOHN WAGNER MAKES IT!
Score: 68-89

[09:59] Team_028 possession (Score: 68-89)
Myles Haliburton makes the Layup and draws the foul on Cole Simons! And-1! Myles Haliburton to the line for 1. [Team fouls: 2] (Cole Simons: 1 personal fouls)   FT 1/1: GOOD Myles Haliburton makes 1/1 from the line.
Score: 71-89

[09:46] Team_045 possession (Score: 71-89)
Trae Russell drives, Kawhi Ball stays with him. Trae Russell attempts a Dunk. Heavily contested by Kawhi Ball (0.5 feet, ZONE)! TRAE RUSSELL MAKES IT!
Score: 71-91

[09:32] Team_028 possession (Score: 71-91)
Kawhi Ball makes the 3Pt and draws the foul on DeMar Turner! And-1! Kawhi Ball to the line for 1. [Team fouls: 3] (DeMar Turner: 2 personal fouls)   FT 1/1: GOOD Kawhi Ball makes 1/1 from the line.
Score: 75-91

[09:17] Team_045 possession (Score: 75-91)
Zion Butler loses the ball! Stripped by Jimmy Brogdon! TURNOVER! (live ball)

[08:58] Team_028 possession (Score: 75-91)
Myles Haliburton attempts a Midrange. Contested by Cole Simons (2.7 feet, MAN). Myles Haliburton misses. Rebound secured by Zion Butler.

[08:44] Team_045 possession (Score: 75-91)
Zion Butler attempts a Midrange. Contested by Kawhi Ball (4.3 feet, ZONE). Zion Butler misses. Offensive rebound by Zion Butler! Zion Butler puts it back in!
Score: 75-93

[08:30] Team_028 possession (Score: 75-93)
Carmelo Carter drives, picks up Zion Butler. Help arrives from John Wagner! Carmelo Carter attempts a Layup. Contested by John Wagner (2.9 feet, ZONE). Carmelo Carter misses. Rebound secured by Cole Simons.

[08:17] Team_045 possession (Score: 75-93)
DeMar Turner attempts a Midrange. Wide open! Kawhi Ball is 6.3 feet away. [MAN] DEMAR TURNER MAKES IT!
Score: 75-95

[08:01] Team_028 possession (Score: 75-95)
Kawhi Ball makes the Layup and draws the foul on John Wagner! And-1! Kawhi Ball to the line for 1. [Team fouls: 4] (John Wagner: 1 personal fouls)   FT 1/1: MISS Kawhi Ball makes 0/1 from the line. Rebound secured by Zion Butler.
Score: 77-95

[07:50] Team_045 possession (Score: 77-95)
DeMar Turner attempts a Midrange. Wide open! Myles Haliburton is 6.7 feet away. [ZONE] DeMar Turner misses. Rebound secured by Carmelo Carter.

[07:31] Team_028 possession (Score: 77-95)
Kawhi Ball attempts a 3Pt. Wide open! DeMar Turner is 6.6 feet away. [MAN] Kawhi Ball misses. FOUL! Loose ball foul on Cole Simons during the rebound battle. [IN THE BONUS! 5 team fouls] Jimmy Brogdon to the line for 2 free throws. (Cole Simons: 2 personal fouls)   FT 1/2: GOOD   FT 2/2: MISS Jimmy Brogdon makes 1/2 from the line. Offensive rebound by Kawhi Ball! Kawhi Ball kicks it out.
Score: 78-95

[07:13] Team_028 possession (Score: 78-95)
Myles Haliburton attempts a 3Pt. Contested by Cole Simons (5.1 feet, ZONE). MYLES HALIBURTON MAKES IT! Assist: Carmelo Carter
Score: 81-95

[06:58] Team_045 possession (Score: 81-95)
Cole Simons attempts a Layup. Contested by Myles Haliburton (3.2 feet, MAN). COLE SIMONS MAKES IT!
Score: 81-97

[06:43] Team_028 possession (Score: 81-97)
Jimmy Brogdon throws a bad pass! Stolen by Zion Butler! TURNOVER! (live ball)

[06:27] Team_045 possession (Score: 81-97)
DeMar Turner loses the ball! Stripped by Kawhi Ball! TURNOVER! (live ball)

[06:10] Team_028 possession (Score: 81-97)
FOUL! Reach-in foul on Cole Simons during the drive. [IN THE BONUS! 6 team fouls] Myles Haliburton to the line for 2 free throws. (Cole Simons: 3 personal fouls)   FT 1/2: GOOD   FT 2/2: GOOD Myles Haliburton makes 2/2 from the line.
Score: 83-97

[05:55] Team_045 possession (Score: 83-97)
Zion Butler drives, Jimmy Brogdon stays with him. Zion Butler attempts a Dunk. Contested by Jimmy Brogdon (3.4 feet, MAN). ZION BUTLER MAKES IT! Assist: John Wagner
Score: 83-99

[05:43] Team_028 possession (Score: 83-99)
Carmelo Carter attempts a Midrange. Wide open! DeMar Turner is 7.4 feet away. [ZONE] CARMELO CARTER MAKES IT!
Score: 85-99

[05:32] Team_045 possession (Score: 85-99)
Zion Butler drives, Jimmy Brogdon stays with him. Zion Butler attempts a Layup. Wide open! Jimmy Brogdon is 6.5 feet away. [MAN] Zion Butler misses. Offensive rebound by DeMar Turner! DeMar Turner kicks it out.

[05:13] Team_045 possession (Score: 85-99)
John Wagner drives, picks up Kawhi Ball. Help arrives from Carmelo Carter! John Wagner attempts a Dunk. Contested by Carmelo Carter (4.4 feet, ZONE). JOHN WAGNER MAKES IT! Assist: Trae Russell
Score: 85-101

[04:59] Team_028 possession (Score: 85-101)
Scottie Ingram attempts a 3Pt. Contested by John Wagner (3.0 feet, MAN). Scottie Ingram misses. Rebound secured by Zion Butler.

[04:48] Team_045 possession (Score: 85-101)
DeMar Turner attempts a Midrange. Wide open! Kawhi Ball is 6.5 feet away. [MAN] DEMAR TURNER MAKES IT!
Score: 85-103

[04:36] Team_028 possession (Score: 85-103)
FOUL! Shooting foul on Cole Simons. Kawhi Ball to the line for 3 free throws. [BONUS: 7 team fouls] (Cole Simons: 4 personal fouls)   FT 1/3: GOOD   FT 2/3: GOOD   FT 3/3: GOOD Kawhi Ball makes 3/3 from the line.
Score: 88-103

[04:22] Team_045 possession (Score: 88-103)
Cole Simons attempts a Layup. Wide open! Myles Haliburton is 6.2 feet away. [MAN] Cole Simons misses. Rebound secured by Kawhi Ball.

[04:08] Team_028 possession (Score: 88-103)
Scottie Ingram drives, Zion Butler stays with him. Scottie Ingram attempts a Dunk. Contested by Zion Butler (3.1 feet, ZONE). SCOTTIE INGRAM MAKES IT! Assist: Jimmy Brogdon
Score: 90-103

[03:53] Team_045 possession (Score: 90-103)
Cole Simons attempts a 3Pt. Contested by Myles Haliburton (5.8 feet, MAN). Cole Simons misses. Rebound secured by Kawhi Ball.

[03:37] Team_028 possession (Score: 90-103)
Jimmy Brogdon attempts a 3Pt. Contested by John Wagner (4.9 feet, ZONE). Jimmy Brogdon misses. Rebound secured by Zion Butler.

[03:19] Team_045 possession (Score: 90-103)
DeMar Turner attempts a 3Pt. Wide open! Scottie Ingram is 8.5 feet away. [ZONE] DeMar Turner misses. Offensive rebound by DeMar Turner! DeMar Turner kicks it out.

[03:02] Team_045 possession (Score: 90-103)
John Wagner attempts a 3Pt. Wide open! Scottie Ingram is 9.0 feet away. [ZONE] JOHN WAGNER MAKES IT! Assist: Zion Butler
Score: 90-106

[02:45] Team_028 possession (Score: 90-106)
Myles Haliburton attempts a Midrange. Contested by DeMar Turner (4.5 feet, ZONE). MYLES HALIBURTON MAKES IT!
Score: 92-106

[02:32] Team_045 possession (Score: 92-106)
Cole Simons drives to the basket... Cole Simons loses the ball! Stripped by Kawhi Ball! TURNOVER! (live ball)

[02:13] Team_028 possession (Score: 92-106)
Scottie Ingram attempts a 3Pt. Heavily contested by John Wagner (1.9 feet, ZONE)! Scottie Ingram misses. Rebound secured by DeMar Turner.

[01:59] Team_045 possession (Score: 92-106)
Zion Butler makes the Layup and draws the foul on Carmelo Carter! And-1! Zion Butler to the line for 1. [Team fouls: 1] (Carmelo Carter: 1 personal fouls)   FT 1/1: GOOD Zion Butler makes 1/1 from the line.
Score: 92-109

[01:47] Team_028 possession (Score: 92-109)
Scottie Ingram attempts a 3Pt. Contested by John Wagner (5.5 feet, MAN). SCOTTIE INGRAM MAKES IT!
Score: 95-109

[01:31] Team_045 possession (Score: 95-109)
Zion Butler attempts a Midrange. Wide open! Jimmy Brogdon is 7.9 feet away. [MAN] ZION BUTLER MAKES IT!
Score: 95-111

[01:15] Team_028 possession (Score: 95-111)
Jimmy Brogdon drives, Zion Butler stays with him. Jimmy Brogdon attempts a Dunk. Heavily contested by Zion Butler (1.1 feet, ZONE)! Jimmy Brogdon misses. Rebound secured by John Wagner.

[01:00] Team_045 possession (Score: 95-111)
Zion Butler attempts a 3Pt. Contested by Carmelo Carter (4.9 feet, ZONE). Zion Butler misses. Rebound secured by Carmelo Carter.

[00:42] Team_028 possession (Score: 95-111)
Jimmy Brogdon drives, picks up Zion Butler. Help arrives from John Wagner! Jimmy Brogdon attempts a Layup. Wide open! John Wagner is 6.7 feet away. [MAN] JIMMY BROGDON MAKES IT! Assist: Kawhi Ball
Score: 97-111

[00:29] Team_045 possession (Score: 97-111)
Trae Russell drives, Carmelo Carter stays with him. Trae Russell attempts a Dunk. Wide open! Carmelo Carter is 6.1 feet away. [MAN] TRAE RUSSELL MAKES IT! Assist: John Wagner
Score: 97-113

[00:12] Team_028 possession (Score: 97-113)
Scottie Ingram loses the ball! Stripped by John Wagner! TURNOVER! (live ball)

================================================================================
                              4TH QUARTER COMPLETE                              
================================================================================

4TH QUARTER SCORE: Team_028 29, Team_045 30

BOX SCORE:
================================================================================

Team_028
--------------------------------------------------------------------------------
Player                MIN  PTS  REB  AST  TO      FG   FG%      3P   3P%
--------------------------------------------------------------------------------
Myles Haliburton       39   10    0    0   0   4/6    66.7     0/0   0.0
Kawhi Ball             37    7    3    1   0   2/4    50.0     0/0   0.0
Scottie Ingram         22    5    0    0   0   2/5    40.0     0/0   0.0
Carmelo Carter         39    2    3    1   0   1/2    50.0     0/0   0.0
Jimmy Brogdon          37    2    1    1   0   1/4    25.0     0/0   0.0

TEAM: FG: 10/21 (47.6%), 3PT: 4/9 (44.4%), REB: 7 (2 off, 5 def), AST: 3, TO: 2
TEAM FOULS: 1


Team_045
--------------------------------------------------------------------------------
Player                MIN  PTS  REB  AST  TO      FG   FG%      3P   3P%
--------------------------------------------------------------------------------
Zion Butler            37    9    8    1   0   4/5    80.0     0/0   0.0
John Wagner            22    7    1    2   0   3/4    75.0     0/0   0.0
Trae Russell           39    6    0    1   0   3/3   100.0     0/0   0.0
DeMar Turner           39    6    3    0   0   3/4    75.0     0/0   0.0
Cole Simons            37    2    2    1   0   1/3    33.3     0/0   0.0

TEAM: FG: 14/19 (73.7%), 3PT: 1/3 (33.3%), REB: 14 (3 off, 11 def), AST: 5, TO: 3
TEAM FOULS: 7 [Team_028 in BONUS]

================================================================================

================================================================================
                               FULL GAME COMPLETE                               
================================================================================

FINAL SCORE: Team_028 97, Team_045 113

SCORING BY QUARTER:
--------------------------------------------------------------------------------
Team                     Q1     Q2     Q3     Q4    FINAL
--------------------------------------------------------------------------------
Team_028                 22     23     23     29       97
Team_045                 36     18     29     30      113
--------------------------------------------------------------------------------

FULL GAME BOX SCORE:
================================================================================

Team_028
--------------------------------------------------------------------------------
Player                MIN  PTS  REB  AST  TO      FG   FG%      3P   3P%      FT STL BLK
--------------------------------------------------------------------------------
Carmelo Carter         39   15    8    3   2   5/12   41.7   3/5    60.0   1/2     0   0
Myles Haliburton       39   16    0    3   3   8/12   66.7   1/4    25.0   3/3     0   0
Kawhi Ball             37   14   14    2   3   5/11   45.5   2/5    40.0   6/8     3   1
Jimmy Brogdon          37   15    9    2   1   8/14   57.1   1/3    33.3   3/4     1   0
Austin Russell         27    9    0    5   3   3/6    50.0   0/3     0.0   3/4     0   0
Scottie Ingram         22    5    0    3   2   2/7    28.6   1/5    20.0   0/0     0   0
Bam Towns              12    1    5    0   1   1/2    50.0   0/0     0.0   1/2     0   0
Collin Bridges         12    6    5    2   0   3/6    50.0   0/1     0.0   0/2     0   2
Tyrese Quickley        10    5    0    0   0   2/2   100.0   1/1   100.0   2/2     1   1
Miles Booker           10    5    0    0   0   2/4    50.0   0/0     0.0   2/3     0   0

TEAM: FG: 39/76 (51.3%), 3PT: 9/27 (33.3%), REB: 39 (9 off, 30 def), AST: 20, TO: 15


Team_045
--------------------------------------------------------------------------------
Player                MIN  PTS  REB  AST  TO      FG   FG%      3P   3P%      FT STL BLK
--------------------------------------------------------------------------------
Trae Russell           39   14    0    6   1   8/11   72.7   0/2     0.0   0/0     0   0
DeMar Turner           39   20   11    2   3  10/16   62.5   2/4    50.0   4/5     0   0
Cole Simons            37   16    5    2   0   5/12   41.7   2/4    50.0   4/7     1   0
Zion Butler            37   15   21    4   2   4/9    44.4   0/1     0.0   1/1     5   0
Rudy Antetokounmpo     27   17    0    3   2   7/10   70.0   5/7    71.4   1/1     1   0
John Wagner            22   13    1    3   1   5/6    83.3   3/3   100.0   1/3     1   1
Gary Towns             12    3    1    1   0   1/2    50.0   0/1     0.0   0/0     0   0
Stephen Paul           12    9    4    2   0   3/6    50.0   0/0     0.0   1/1     0   0
Julius James           10    2    4    0   0   2/3    66.7   0/1     0.0   0/0     0   2
Tim Sexton             10    0    3    1   2   0/2     0.0   0/2     0.0   0/0     1   0

TEAM: FG: 46/78 (59.0%), 3PT: 12/25 (48.0%), REB: 52 (15 off, 37 def), AST: 24, TO: 11

================================================================================
