================================================================================
                        FULL GAME - Team_026 vs Team_067                        
================================================================================

================================================================================
                       1ST QUARTER - Team_026 vs Team_067                       
================================================================================

[12:00] Team_026 possession (Score: 0-0)
Immanuel Hyland drives to the basket... Immanuel Hyland throws a bad pass out of bounds! TURNOVER! (dead ball)

[11:45] Team_067 possession (Score: 0-0)
FOUL! Offensive foul on Desmond Simmons! Klay Giddey drew the charge! [Team fouls: 1] (Desmond Simmons: 1 personal fouls) TURNOVER! (dead ball)

[11:30] Team_026 possession (Score: 0-0)
Kobe Booker drives to the basket... Kobe Booker throws a bad pass! Stolen by Malcolm Westbrook! TURNOVER! (live ball)

[11:13] Team_067 possession (Score: 0-0)
FOUL! Holding foul on Klay Giddey. [Team fouls: 1] No free throws, side out. (Klay Giddey: 1 personal fouls)

[10:59] Team_067 possession (Score: 0-0)
Ben Ball attempts a Midrange. Contested by Immanuel Hyland (5.0 feet, ZONE). BEN BALL MAKES IT!
Score: 0-2

[10:42] Team_026 possession (Score: 0-2)
Klay Giddey attempts a Midrange. Contested by Desmond Simmons (2.0 feet, MAN). KLAY GIDDEY MAKES IT! Assist: Kobe Booker
Score: 2-2

[10:29] Team_067 possession (Score: 2-2)
Ben Ball drives and kicks out. Ben Ball attempts a 3Pt. Contested by Immanuel Hyland (2.0 feet, ZONE). Ben Ball misses. FOUL! Loose ball foul on Shaquille Trent during the rebound battle. [Team fouls: 2] No free throws, side out. (Shaquille Trent: 1 personal fouls)

[10:17] Team_067 possession (Score: 2-2)
Malcolm Westbrook attempts a Layup. Wide open! Shaquille Trent is 6.8 feet away. [ZONE] MALCOLM WESTBROOK MAKES IT! Assist: Wendell Antetokounmpo
Score: 2-4

[10:02] Team_026 possession (Score: 2-4)
Kobe Booker makes the Dunk and draws the foul on Malcolm Westbrook! And-1! Kobe Booker to the line for 1. [Team fouls: 2] (Malcolm Westbrook: 1 personal fouls)   FT 1/1: GOOD Kobe Booker makes 1/1 from the line.
Score: 5-4

[09:49] Team_067 possession (Score: 5-4)
Wendell Antetokounmpo attempts a Midrange. Wide open! Immanuel Hyland is 7.8 feet away. [ZONE] Wendell Antetokounmpo misses. Offensive rebound by Desmond Simmons! Desmond Simmons kicks it out.

[09:40] Team_067 possession (Score: 5-4)
Desmond Simmons attempts a 3Pt. Contested by Klay Giddey (4.4 feet, MAN). DESMOND SIMMONS MAKES IT! Assist: Malcolm Westbrook
Score: 5-7

[09:23] Team_026 possession (Score: 5-7)
Kobe Booker attempts a Midrange. Contested by Malcolm Westbrook (5.0 feet, MAN). KOBE BOOKER MAKES IT!
Score: 7-7

[09:09] Team_067 possession (Score: 7-7)
Manu Reaves attempts a 3Pt. Contested by Immanuel Hyland (4.0 feet, ZONE). MANU REAVES MAKES IT! Assist: Desmond Simmons
Score: 7-10

[08:52] Team_026 possession (Score: 7-10)
Shaquille Trent attempts a Layup. Contested by Malcolm Westbrook (4.1 feet, ZONE). Shaquille Trent misses. Rebound secured by Malcolm Westbrook.

[08:37] Team_067 possession (Score: 7-10)
Manu Reaves loses control! Ball rolls out of bounds! TURNOVER! (dead ball)

[08:25] Team_026 possession (Score: 7-10)
Klay Giddey throws a bad pass out of bounds! TURNOVER! (dead ball)

[08:16] Team_067 possession (Score: 7-10)
Desmond Simmons drives to the basket... Desmond Simmons throws a bad pass! Stolen by Kobe Booker! TURNOVER! (live ball)

[07:59] Team_026 possession (Score: 7-10)
Immanuel Hyland attempts a 3Pt. Contested by Wendell Antetokounmpo (3.8 feet, MAN). Immanuel Hyland misses. Rebound secured by Desmond Simmons.

[07:42] Team_067 possession (Score: 7-10)
FOUL! Holding foul on Kobe Booker. [Team fouls: 3] No free throws, side out. (Kobe Booker: 1 personal fouls)

[07:29] Team_067 possession (Score: 7-10)
Malcolm Westbrook attempts a Midrange. Wide open! Kobe Booker is 7.6 feet away. [MAN] MALCOLM WESTBROOK MAKES IT!
Score: 7-12

[07:14] Team_026 possession (Score: 7-12)
Klay Giddey attempts a Midrange. Heavily contested by Desmond Simmons (0.7 feet, MAN)! Klay Giddey misses. Rebound secured by Wendell Antetokounmpo.

[06:59] Team_067 possession (Score: 7-12)
Desmond Simmons drives to the basket... Desmond Simmons loses control! Ball rolls out of bounds! TURNOVER! (dead ball)

[06:46] Team_026 possession (Score: 7-12)
Wendell Gasol attempts a Layup. BLOCKED BY MANU REAVES! Ball deflects out of bounds off Wendell Gasol.

[06:32] Team_067 possession (Score: 7-12)
Wendell Antetokounmpo attempts a Layup. Heavily contested by Kobe Booker (0.5 feet, ZONE)! WENDELL ANTETOKOUNMPO MAKES IT!
Score: 7-14

[06:16] Team_026 possession (Score: 7-14)
Kobe Booker attempts a Layup. Heavily contested by Malcolm Westbrook (1.8 feet, ZONE)! KOBE BOOKER MAKES IT!
Score: 9-14

[05:59] Team_067 possession (Score: 9-14)
Malcolm Westbrook drives to the basket... Malcolm Westbrook commits a violation (traveling/carry)! TURNOVER! (dead ball)

[05:44] Team_026 possession (Score: 9-14)
Kobe Booker attempts a Midrange. Contested by Ben Ball (4.9 feet, ZONE). KOBE BOOKER MAKES IT! Assist: Klay Giddey
Score: 11-14

[05:31] Team_067 possession (Score: 11-14)
FOUL! Offensive foul on Malcolm Westbrook! Kobe Booker drew the charge! [Team fouls: 3] (Malcolm Westbrook: 2 personal fouls) TURNOVER! (dead ball)

[05:19] Team_026 possession (Score: 11-14)
Immanuel Hyland attempts a 3Pt. Contested by Wendell Antetokounmpo (5.4 feet, MAN). Immanuel Hyland misses. Rebound secured by Wendell Antetokounmpo.

[05:04] Team_067 possession (Score: 11-14)
Ben Ball attempts a 3Pt. Contested by Shaquille Trent (5.9 feet, MAN). BEN BALL MAKES IT! Assist: Desmond Simmons
Score: 11-17

[04:47] Team_026 possession (Score: 11-17)
Immanuel Hyland attempts a Midrange. Contested by Malcolm Westbrook (4.1 feet, ZONE). IMMANUEL HYLAND MAKES IT!
Score: 13-17

[04:33] Team_067 possession (Score: 13-17)
Desmond Simmons attempts a Midrange. Contested by Immanuel Hyland (2.9 feet, ZONE). DESMOND SIMMONS MAKES IT!
Score: 13-19

[04:18] Team_026 possession (Score: 13-19)
FOUL! Reach-in foul on Malcolm Westbrook during the drive. [Team fouls: 4] No free throws, side out. (Malcolm Westbrook: 3 personal fouls)

[04:05] Team_026 possession (Score: 13-19)
Immanuel Hyland attempts a Layup. Wide open! Malcolm Westbrook is 6.4 feet away. [ZONE] Immanuel Hyland misses. FOUL! Loose ball foul on Desmond Simmons during the rebound battle. [IN THE BONUS! 5 team fouls] Kobe Booker to the line for 2 free throws. (Desmond Simmons: 2 personal fouls)   FT 1/2: GOOD   FT 2/2: GOOD Kobe Booker makes 2/2 from the line.
Score: 15-19

[03:48] Team_067 possession (Score: 15-19)
Wendell Antetokounmpo attempts a Midrange. Contested by Shaquille Trent (4.8 feet, ZONE). WENDELL ANTETOKOUNMPO MAKES IT! Assist: Ben Ball
Score: 15-21

[03:36] Team_026 possession (Score: 15-21)
Wendell Gasol drives to the basket... Wendell Gasol throws a bad pass out of bounds! TURNOVER! (dead ball)

[03:21] Team_067 possession (Score: 15-21)
Manu Reaves attempts a 3Pt. Contested by Wendell Gasol (5.2 feet, MAN). Manu Reaves misses. Rebound secured by Immanuel Hyland.

[03:05] Team_026 possession (Score: 15-21)
Immanuel Hyland attempts a 3Pt. Contested by Wendell Antetokounmpo (3.1 feet, MAN). IMMANUEL HYLAND MAKES IT! Assist: Wendell Gasol
Score: 18-21

[02:50] Team_067 possession (Score: 18-21)
Malcolm Westbrook throws a bad pass! Stolen by Kobe Booker! TURNOVER! (live ball)

[02:35] Team_026 possession (Score: 18-21)
FOUL! Shooting foul on Wendell Antetokounmpo. Wendell Gasol to the line for 2 free throws. [BONUS: 6 team fouls] (Wendell Antetokounmpo: 1 personal fouls)   FT 1/2: GOOD   FT 2/2: GOOD Wendell Gasol makes 2/2 from the line.
Score: 20-21

[02:21] Team_067 possession (Score: 20-21)
FOUL! Reach-in foul on Wendell Gasol during the drive. [Team fouls: 4] No free throws, side out. (Wendell Gasol: 1 personal fouls)

[02:06] Team_067 possession (Score: 20-21)
Wendell Antetokounmpo attempts a 3Pt. Contested by Immanuel Hyland (3.2 feet, MAN). Wendell Antetokounmpo misses. Rebound secured by Shaquille Trent.

[01:47] Team_026 possession (Score: 20-21)
Kobe Booker drives, Malcolm Westbrook stays with him. Kobe Booker attempts a Dunk. Contested by Malcolm Westbrook (5.0 feet, MAN). KOBE BOOKER MAKES IT! Assist: Immanuel Hyland
Score: 22-21

[01:31] Team_067 possession (Score: 22-21)
Desmond Simmons attempts a Layup. Contested by Klay Giddey (4.1 feet, MAN). DESMOND SIMMONS MAKES IT! Assist: Malcolm Westbrook
Score: 22-23

[01:16] Team_026 possession (Score: 22-23)
Klay Giddey attempts a Layup. Contested by Malcolm Westbrook (2.5 feet, ZONE). KLAY GIDDEY MAKES IT!
Score: 24-23

[01:00] Team_067 possession (Score: 24-23)
Malcolm Westbrook drives and kicks out. Wendell Antetokounmpo attempts a 3Pt. Wide open! Immanuel Hyland is 7.4 feet away. [MAN] Wendell Antetokounmpo misses. FOUL! Loose ball foul on Shaquille Trent during the rebound battle. [IN THE BONUS! 5 team fouls] Malcolm Westbrook to the line for 2 free throws. (Shaquille Trent: 2 personal fouls)   FT 1/2: MISS   FT 2/2: GOOD Malcolm Westbrook makes 1/2 from the line.
Score: 24-24

[00:46] Team_026 possession (Score: 24-24)
FOUL! Shooting foul on Manu Reaves. Immanuel Hyland to the line for 3 free throws. [BONUS: 7 team fouls] (Manu Reaves: 1 personal fouls)   FT 1/3: GOOD   FT 2/3: MISS   FT 3/3: GOOD Immanuel Hyland makes 2/3 from the line.
Score: 26-24

[00:30] Team_067 possession (Score: 26-24)
Ben Ball attempts a 3Pt. Contested by Shaquille Trent (4.1 feet, MAN). Ben Ball misses. Rebound secured by Kobe Booker.

[00:19] Team_026 possession (Score: 26-24)
Shaquille Trent attempts a 3Pt. Contested by Desmond Simmons (5.6 feet, ZONE). Shaquille Trent misses. Rebound secured by Desmond Simmons.

[00:04] Team_067 possession (Score: 26-24)
Malcolm Westbrook loses control! Ball rolls out of bounds! TURNOVER! (dead ball)

[00:04] Substitution (Team_026): Wendell Gasol OUT → Myles Tatum IN (stamina_rule2)

[00:04] Substitution (Team_026): Immanuel Hyland OUT → Karl Barrett IN (stamina_rule2)

[00:04] Substitution (Team_026): Klay Giddey OUT → Josh Simons IN (stamina_rule2)

[00:04] Substitution (Team_026): Shaquille Trent OUT → Damian Doncic IN (stamina_rule2)

[00:04] Substitution (Team_026): Kobe Booker OUT → Dirk Randle IN (stamina_rule2)

[00:04] Substitution (Team_067): Manu Reaves OUT → James Rozier IN (stamina_rule2)

[00:04] Substitution (Team_067): Wendell Antetokounmpo OUT → Anfernee Wagner IN (stamina_rule2)

[00:04] Substitution (Team_067): Desmond Simmons OUT → Kyle Leonard IN (stamina_rule2)

[00:04] Substitution (Team_067): Ben Ball OUT → Kristaps Davis IN (stamina_rule2)

[00:04] Substitution (Team_067): Malcolm Westbrook OUT → Zach DeRozan IN (stamina_rule2)

================================================================================
                              1ST QUARTER COMPLETE                              
================================================================================

1ST QUARTER SCORE: Team_026 26, Team_067 24

BOX SCORE:
================================================================================

Team_026
--------------------------------------------------------------------------------
Player                MIN  PTS  REB  AST  TO      FG   FG%      3P   3P%
--------------------------------------------------------------------------------
Kobe Booker            12   13    1    1   0   6/6   100.0     0/0   0.0
Immanuel Hyland        12    7    1    1   0   3/5    60.0     0/0   0.0
Klay Giddey            12    4    0    1   0   2/3    66.7     0/0   0.0
Wendell Gasol          12    2    0    1   0   1/2    50.0     0/0   0.0
Shaquille Trent        12    0    1    0   0   0/2     0.0     0/0   0.0

TEAM: FG: 12/18 (66.7%), 3PT: 2/5 (40.0%), REB: 3 (0 off, 3 def), AST: 4, TO: 4
TEAM FOULS: 5 [Team_067 in BONUS]


Team_067
--------------------------------------------------------------------------------
Player                MIN  PTS  REB  AST  TO      FG   FG%      3P   3P%
--------------------------------------------------------------------------------
Desmond Simmons        12    7    4    2   0   3/3   100.0     0/0   0.0
Ben Ball               12    5    0    1   0   2/3    66.7     0/0   0.0
Malcolm Westbrook      12    5    1    2   0   3/3   100.0     0/0   0.0
Wendell Antetokounmpo   12    4    2    1   0   2/3    66.7     0/0   0.0
Manu Reaves            12    3    0    0   0   1/2    50.0     0/0   0.0

TEAM: FG: 11/14 (78.6%), 3PT: 3/6 (50.0%), REB: 7 (2 off, 5 def), AST: 6, TO: 8
TEAM FOULS: 7 [Team_026 in BONUS]

================================================================================

================================================================================
                       2ND QUARTER - Team_026 vs Team_067                       
================================================================================

[12:00] Team_026 possession (Score: 26-24)
Shaquille Trent attempts a 3Pt. Contested by Ben Ball (5.7 feet, MAN). Shaquille Trent misses. Rebound secured by Malcolm Westbrook.

[11:44] Team_067 possession (Score: 26-24)
Desmond Simmons drives and kicks out. Malcolm Westbrook attempts a Midrange. Wide open! Kobe Booker is 7.0 feet away. [MAN] Malcolm Westbrook misses. Rebound secured by Kobe Booker.

[11:30] Team_026 possession (Score: 26-24)
FOUL! Holding foul on Desmond Simmons. [Team fouls: 1] No free throws, side out. (Desmond Simmons: 1 personal fouls)

[11:12] Team_026 possession (Score: 26-24)
Immanuel Hyland attempts a Midrange. Wide open! Desmond Simmons is 6.3 feet away. [ZONE] Immanuel Hyland misses. Rebound secured by Manu Reaves.

[10:58] Team_067 possession (Score: 26-24)
Desmond Simmons attempts a 3Pt. Contested by Immanuel Hyland (5.8 feet, ZONE). Desmond Simmons misses. Offensive rebound by Desmond Simmons! Desmond Simmons kicks it out.

[10:42] Team_067 possession (Score: 26-24)
Ben Ball attempts a 3Pt. Wide open! Shaquille Trent is 8.9 feet away. [MAN] BEN BALL MAKES IT! Assist: Manu Reaves
Score: 26-27

[10:28] Team_026 possession (Score: 26-27)
Wendell Gasol drives to the basket... Wendell Gasol commits a violation (traveling/carry)! TURNOVER! (dead ball)

[10:28] Substitution (Team_026): Wendell Gasol OUT → Myles Tatum IN (stamina_rule2)

[10:28] Substitution (Team_026): Immanuel Hyland OUT → Karl Barrett IN (stamina_rule2)

[10:28] Substitution (Team_026): Klay Giddey OUT → Josh Simons IN (stamina_rule2)

[10:28] Substitution (Team_026): Shaquille Trent OUT → Damian Doncic IN (stamina_rule2)

[10:28] Substitution (Team_026): Kobe Booker OUT → Dirk Randle IN (stamina_rule2)

[10:28] Substitution (Team_067): Manu Reaves OUT → James Rozier IN (stamina_rule2)

[10:28] Substitution (Team_067): Wendell Antetokounmpo OUT → Anfernee Wagner IN (stamina_rule2)

[10:28] Substitution (Team_067): Desmond Simmons OUT → Kyle Leonard IN (stamina_rule2)

[10:28] Substitution (Team_067): Ben Ball OUT → Kristaps Davis IN (stamina_rule2)

[10:28] Substitution (Team_067): Malcolm Westbrook OUT → Zach DeRozan IN (stamina_rule2)

[10:10] Team_067 possession (Score: 26-27)
Kyle Leonard attempts a 3Pt. Wide open! Josh Simons is 6.4 feet away. [MAN] KYLE LEONARD MAKES IT! Assist: Zach DeRozan
Score: 26-30

[09:53] Team_026 possession (Score: 26-30)
Damian Doncic attempts a Layup. Heavily contested by Kristaps Davis (1.5 feet, MAN)! DAMIAN DONCIC MAKES IT!
Score: 28-30

[09:41] Team_067 possession (Score: 28-30)
Anfernee Wagner loses control! Ball rolls out of bounds! TURNOVER! (dead ball)

[09:29] Team_026 possession (Score: 28-30)
FOUL! Reach-in foul on Kristaps Davis during the drive. [Team fouls: 2] No free throws, side out. (Kristaps Davis: 1 personal fouls)

[09:17] Team_026 possession (Score: 28-30)
Karl Barrett attempts a Midrange. Wide open! Kyle Leonard is 7.9 feet away. [ZONE] Karl Barrett misses. Rebound secured by Kristaps Davis.

[09:03] Team_067 possession (Score: 28-30)
Zach DeRozan drives and kicks out. James Rozier attempts a 3Pt. Wide open! Karl Barrett is 7.0 feet away. [ZONE] James Rozier misses. Rebound secured by Karl Barrett.

[08:48] Team_026 possession (Score: 28-30)
Josh Simons attempts a 3Pt. Heavily contested by Anfernee Wagner (1.7 feet, ZONE)! Josh Simons misses. Rebound secured by Kristaps Davis.

[08:31] Team_067 possession (Score: 28-30)
Kyle Leonard attempts a Layup. Contested by Josh Simons (4.0 feet, MAN). KYLE LEONARD MAKES IT! Assist: Anfernee Wagner
Score: 28-32

[08:17] Team_026 possession (Score: 28-32)
Josh Simons loses control! Ball rolls out of bounds! TURNOVER! (dead ball)

[08:06] Team_067 possession (Score: 28-32)
Anfernee Wagner attempts a 3Pt. Wide open! Karl Barrett is 6.1 feet away. [MAN] Anfernee Wagner misses. Offensive rebound by Zach DeRozan! Zach DeRozan kicks it out.

[07:51] Team_067 possession (Score: 28-32)
FOUL! Holding foul on Myles Tatum. [Team fouls: 1] No free throws, side out. (Myles Tatum: 1 personal fouls)

[07:35] Team_067 possession (Score: 28-32)
Anfernee Wagner attempts a 3Pt. Contested by Karl Barrett (3.4 feet, MAN). Anfernee Wagner misses. Rebound secured by Karl Barrett.

[07:16] Team_026 possession (Score: 28-32)
Karl Barrett attempts a 3Pt. Contested by Anfernee Wagner (2.8 feet, MAN). Karl Barrett misses. Rebound secured by Anfernee Wagner.

[07:01] Team_067 possession (Score: 28-32)
FOUL! Shooting foul on Karl Barrett. Zach DeRozan to the line for 2 free throws. [Team fouls: 2] (Karl Barrett: 1 personal fouls)   FT 1/2: GOOD   FT 2/2: MISS Zach DeRozan makes 1/2 from the line. Rebound secured by Damian Doncic.
Score: 28-33

[06:48] Team_026 possession (Score: 28-33)
Myles Tatum attempts a Midrange. Wide open! Kristaps Davis is 6.9 feet away. [ZONE] Myles Tatum misses. Rebound secured by Zach DeRozan.

[06:34] Team_067 possession (Score: 28-33)
Kyle Leonard attempts a 3Pt. Wide open! Karl Barrett is 6.4 feet away. [ZONE] Kyle Leonard misses. Rebound secured by Karl Barrett.

[06:23] Team_026 possession (Score: 28-33)
FOUL! Shooting foul on Anfernee Wagner. Myles Tatum to the line for 3 free throws. [Team fouls: 3] (Anfernee Wagner: 1 personal fouls)   FT 1/3: GOOD   FT 2/3: GOOD   FT 3/3: GOOD Myles Tatum makes 3/3 from the line.
Score: 31-33

[06:06] Team_067 possession (Score: 31-33)
James Rozier attempts a Layup. BLOCKED BY DAMIAN DONCIC! Ball deflects out of bounds off James Rozier.

[05:50] Team_026 possession (Score: 31-33)
Karl Barrett drives, Anfernee Wagner stays with him. Karl Barrett attempts a Layup. Heavily contested by Anfernee Wagner (0.5 feet, MAN)! Karl Barrett misses. FOUL! Loose ball foul on Anfernee Wagner during the rebound battle. [Team fouls: 4] No free throws, side out. (Anfernee Wagner: 2 personal fouls)

[05:34] Team_026 possession (Score: 31-33)
Karl Barrett attempts a Layup. Contested by Anfernee Wagner (3.4 feet, MAN). Karl Barrett misses. Rebound secured by Zach DeRozan.

[05:21] Team_067 possession (Score: 31-33)
Kyle Leonard attempts a 3Pt. Wide open! Josh Simons is 6.0 feet away. [MAN] Kyle Leonard misses. Offensive rebound by Kristaps Davis! Kristaps Davis puts it back in!
Score: 31-35

[05:05] Team_026 possession (Score: 31-35)
Karl Barrett attempts a Midrange. Heavily contested by Kristaps Davis (1.4 feet, ZONE)! KARL BARRETT MAKES IT!
Score: 33-35

[04:47] Team_067 possession (Score: 33-35)
Anfernee Wagner attempts a 3Pt. Contested by Karl Barrett (3.7 feet, MAN). Anfernee Wagner misses. Rebound secured by Damian Doncic.

[04:36] Team_026 possession (Score: 33-35)
Dirk Randle attempts a Midrange. Wide open! Kyle Leonard is 6.0 feet away. [ZONE] DIRK RANDLE MAKES IT!
Score: 35-35

[04:19] Team_067 possession (Score: 35-35)
FOUL! Offensive foul on Zach DeRozan! Dirk Randle drew the charge! [Team fouls: 5] (Zach DeRozan: 1 personal fouls) TURNOVER! (dead ball)

[04:04] Team_026 possession (Score: 35-35)
Damian Doncic attempts a Midrange. Contested by Anfernee Wagner (5.7 feet, ZONE). Damian Doncic misses. Rebound secured by Kristaps Davis.

[03:46] Team_067 possession (Score: 35-35)
Anfernee Wagner attempts a Midrange. Wide open! Karl Barrett is 6.3 feet away. [MAN] ANFERNEE WAGNER MAKES IT! Assist: Kristaps Davis
Score: 35-37

[03:28] Team_026 possession (Score: 35-37)
Damian Doncic makes the Dunk and draws the foul on James Rozier! And-1! Damian Doncic to the line for 1. [BONUS: 6 team fouls] (James Rozier: 1 personal fouls)   FT 1/1: GOOD Damian Doncic makes 1/1 from the line.
Score: 38-37

[03:14] Team_067 possession (Score: 38-37)
Kristaps Davis attempts a Midrange. Contested by Damian Doncic (5.8 feet, MAN). Kristaps Davis misses. Rebound secured by Josh Simons.

[02:57] Team_026 possession (Score: 38-37)
Dirk Randle attempts a 3Pt. Contested by Anfernee Wagner (4.5 feet, ZONE). Dirk Randle misses. Rebound secured by Zach DeRozan.

[02:44] Team_067 possession (Score: 38-37)
James Rozier attempts a 3Pt. Contested by Karl Barrett (3.3 feet, ZONE). James Rozier misses. Rebound secured by Damian Doncic.

[02:27] Team_026 possession (Score: 38-37)
Dirk Randle drives, Zach DeRozan stays with him. Dirk Randle attempts a Dunk. Wide open! Zach DeRozan is 6.5 feet away. [MAN] DIRK RANDLE MAKES IT!
Score: 40-37

[02:09] Team_067 possession (Score: 40-37)
FOUL! Reach-in foul on Dirk Randle during the drive. [Team fouls: 3] No free throws, side out. (Dirk Randle: 1 personal fouls)

[01:58] Team_067 possession (Score: 40-37)
Kyle Leonard drives and kicks out. Anfernee Wagner makes the Midrange and draws the foul on Karl Barrett! And-1! Anfernee Wagner to the line for 1. [Team fouls: 4] (Karl Barrett: 2 personal fouls)   FT 1/1: GOOD Anfernee Wagner makes 1/1 from the line.
Score: 40-40

[01:42] Team_026 possession (Score: 40-40)
Myles Tatum drives to the basket... Myles Tatum throws a bad pass out of bounds! TURNOVER! (dead ball)

[01:26] Team_067 possession (Score: 40-40)
Kristaps Davis attempts a Midrange. Wide open! Damian Doncic is 6.7 feet away. [MAN] Kristaps Davis misses. Rebound secured by Josh Simons.

[01:10] Team_026 possession (Score: 40-40)
Dirk Randle attempts a Layup. Heavily contested by Kristaps Davis (1.2 feet, ZONE)! DIRK RANDLE MAKES IT! Assist: Karl Barrett
Score: 42-40

[00:56] Team_067 possession (Score: 42-40)
Zach DeRozan makes the Dunk and draws the foul on Karl Barrett! And-1! Zach DeRozan to the line for 1. [BONUS: 5 team fouls] (Karl Barrett: 3 personal fouls)   FT 1/1: GOOD Zach DeRozan makes 1/1 from the line.
Score: 42-43

[00:43] Team_026 possession (Score: 42-43)
Karl Barrett attempts a 3Pt. Wide open! Anfernee Wagner is 6.8 feet away. [ZONE] Karl Barrett misses. Rebound secured by Anfernee Wagner.

[00:28] Team_067 possession (Score: 42-43)
Kristaps Davis attempts a Midrange. Wide open! Damian Doncic is 6.4 feet away. [MAN] KRISTAPS DAVIS MAKES IT!
Score: 42-45

[00:16] Team_026 possession (Score: 42-45)
Josh Simons attempts a 3Pt. Contested by Kyle Leonard (4.7 feet, MAN). JOSH SIMONS MAKES IT! Assist: Myles Tatum
Score: 45-45

[00:05] Team_067 possession (Score: 45-45)
Kyle Leonard attempts a Midrange. Wide open! Josh Simons is 8.1 feet away. [ZONE] Kyle Leonard misses. Rebound secured by Josh Simons.

================================================================================
                              2ND QUARTER COMPLETE                              
================================================================================

2ND QUARTER SCORE: Team_026 19, Team_067 21

BOX SCORE:
================================================================================

Team_026
--------------------------------------------------------------------------------
Player                MIN  PTS  REB  AST  TO      FG   FG%      3P   3P%
--------------------------------------------------------------------------------
Dirk Randle            10    6    0    0   0   3/4    75.0     0/0   0.0
Damian Doncic          10    5    3    0   0   2/3    66.7     0/0   0.0
Josh Simons            10    3    4    0   0   1/2    50.0     0/0   0.0
Myles Tatum            10    3    0    1   0   1/2    50.0     0/0   0.0
Karl Barrett           10    2    3    1   0   1/5    20.0     0/0   0.0
Shaquille Trent        14    0    0    0   0   0/1     0.0     0/0   0.0
Kobe Booker            14    0    1    0   0   0/0     0.0     0/0   0.0
Immanuel Hyland        14    0    0    0   0   0/1     0.0     0/0   0.0

TEAM: FG: 8/18 (44.4%), 3PT: 2/7 (28.6%), REB: 11 (1 off, 10 def), AST: 2, TO: 3
TEAM FOULS: 5 [Team_067 in BONUS]


Team_067
--------------------------------------------------------------------------------
Player                MIN  PTS  REB  AST  TO      FG   FG%      3P   3P%
--------------------------------------------------------------------------------
Kyle Leonard           10    5    0    0   0   2/4    50.0     0/0   0.0
Anfernee Wagner        10    5    2    1   0   2/4    50.0     0/0   0.0
Kristaps Davis         10    4    4    1   0   2/4    50.0     0/0   0.0
Ben Ball               14    3    0    0   0   1/1   100.0     0/0   0.0
Zach DeRozan           10    3    4    1   0   1/3    33.3     0/0   0.0
Malcolm Westbrook      14    0    1    0   0   0/0     0.0     0/0   0.0
Desmond Simmons        14    0    1    0   0   0/1     0.0     0/0   0.0
Manu Reaves            14    0    1    1   0   0/0     0.0     0/0   0.0
James Rozier           10    0    0    0   0   0/2     0.0     0/0   0.0

TEAM: FG: 8/19 (42.1%), 3PT: 3/7 (42.9%), REB: 13 (3 off, 10 def), AST: 4, TO: 2
TEAM FOULS: 6 [Team_026 in BONUS]

================================================================================

================================================================================
                       3RD QUARTER - Team_026 vs Team_067                       
================================================================================

[12:00] Team_026 possession (Score: 45-45)
Klay Giddey drives, Desmond Simmons stays with him. Klay Giddey attempts a Dunk. Contested by Desmond Simmons (2.6 feet, MAN). Klay Giddey misses. Offensive rebound by Shaquille Trent! Shaquille Trent kicks it out.

[11:43] Team_026 possession (Score: 45-45)
Klay Giddey drives and kicks out. Immanuel Hyland attempts a Midrange. Contested by Wendell Antetokounmpo (4.6 feet, MAN). Immanuel Hyland misses. FOUL! Loose ball foul on Malcolm Westbrook during the rebound battle. [Team fouls: 1] No free throws, side out. (Malcolm Westbrook: 1 personal fouls)

[11:34] Team_026 possession (Score: 45-45)
Immanuel Hyland throws a bad pass out of bounds! TURNOVER! (dead ball)

[11:20] Team_067 possession (Score: 45-45)
Manu Reaves attempts a 3Pt. Contested by Wendell Gasol (4.9 feet, MAN). Manu Reaves misses. Offensive rebound by Malcolm Westbrook! Malcolm Westbrook's putback is no good. Rebound secured by Immanuel Hyland.

[11:08] Team_026 possession (Score: 45-45)
Klay Giddey attempts a Midrange. Heavily contested by Desmond Simmons (1.9 feet, MAN)! Klay Giddey misses. Rebound secured by Malcolm Westbrook.

[10:55] Team_067 possession (Score: 45-45)
Wendell Antetokounmpo attempts a Midrange. Wide open! Immanuel Hyland is 7.0 feet away. [MAN] Wendell Antetokounmpo misses. Rebound secured by Shaquille Trent.

[10:38] Team_026 possession (Score: 45-45)
Kobe Booker drives and kicks out. Kobe Booker attempts a 3Pt. Heavily contested by Desmond Simmons (1.6 feet, ZONE)! Kobe Booker misses. Rebound secured by Malcolm Westbrook.

[10:23] Team_067 possession (Score: 45-45)
Desmond Simmons attempts a Layup. Contested by Kobe Booker (4.3 feet, ZONE). Desmond Simmons misses. Rebound secured by Shaquille Trent.

[10:11] Team_026 possession (Score: 45-45)
Wendell Gasol attempts a Layup. Heavily contested by Manu Reaves (0.5 feet, MAN)! WENDELL GASOL MAKES IT!
Score: 47-45

[09:56] Team_067 possession (Score: 47-45)
Wendell Antetokounmpo loses the ball! Stripped by Immanuel Hyland! TURNOVER! (live ball)

[09:44] Team_026 possession (Score: 47-45)
FOUL! Holding foul on Manu Reaves. [Team fouls: 2] No free throws, side out. (Manu Reaves: 1 personal fouls)

[09:31] Team_026 possession (Score: 47-45)
Klay Giddey drives to the basket... Klay Giddey throws a bad pass out of bounds! TURNOVER! (dead ball)

[09:16] Team_067 possession (Score: 47-45)
FOUL! Offensive foul on Desmond Simmons! Klay Giddey drew the charge! [Team fouls: 3] (Desmond Simmons: 1 personal fouls) TURNOVER! (dead ball)

[09:02] Team_026 possession (Score: 47-45)
Immanuel Hyland attempts a Layup. BLOCKED BY WENDELL ANTETOKOUNMPO! Ball is loose! Rebound secured by Malcolm Westbrook.

[08:53] Team_067 possession (Score: 47-45)
FOUL! Holding foul on Kobe Booker. [Team fouls: 1] No free throws, side out. (Kobe Booker: 1 personal fouls)

[08:37] Team_067 possession (Score: 47-45)
Ben Ball attempts a Midrange. Wide open! Shaquille Trent is 6.2 feet away. [MAN] BEN BALL MAKES IT! Assist: Desmond Simmons
Score: 47-47

[08:25] Team_026 possession (Score: 47-47)
Immanuel Hyland drives to the basket... Immanuel Hyland loses control! Ball rolls out of bounds! TURNOVER! (dead ball)

[08:15] Team_067 possession (Score: 47-47)
Manu Reaves attempts a 3Pt. Contested by Wendell Gasol (4.0 feet, MAN). Manu Reaves misses. Rebound secured by Shaquille Trent.

[07:57] Team_026 possession (Score: 47-47)
Wendell Gasol attempts a 3Pt. Contested by Manu Reaves (4.3 feet, MAN). WENDELL GASOL MAKES IT! Assist: Kobe Booker
Score: 50-47

[07:45] Team_067 possession (Score: 50-47)
Malcolm Westbrook drives to the basket... Malcolm Westbrook throws a bad pass! Stolen by Kobe Booker! TURNOVER! (live ball)

[07:33] Team_026 possession (Score: 50-47)
Shaquille Trent attempts a Layup. BLOCKED BY BEN BALL! Ball is loose! Rebound secured by Desmond Simmons.

[07:19] Team_067 possession (Score: 50-47)
FOUL! Reach-in foul on Shaquille Trent during the drive. [Team fouls: 2] No free throws, side out. (Shaquille Trent: 1 personal fouls)

[07:04] Team_067 possession (Score: 50-47)
Malcolm Westbrook attempts a 3Pt. Contested by Immanuel Hyland (3.3 feet, ZONE). MALCOLM WESTBROOK MAKES IT! Assist: Manu Reaves
Score: 50-50

[06:51] Team_026 possession (Score: 50-50)
Wendell Gasol attempts a Midrange. Contested by Manu Reaves (3.3 feet, MAN). WENDELL GASOL MAKES IT! Assist: Immanuel Hyland
Score: 52-50

[06:38] Team_067 possession (Score: 52-50)
Manu Reaves attempts a 3Pt. Contested by Wendell Gasol (5.0 feet, MAN). MANU REAVES MAKES IT! Assist: Malcolm Westbrook
Score: 52-53

[06:23] Team_026 possession (Score: 52-53)
Wendell Gasol attempts a Midrange. Contested by Manu Reaves (2.5 feet, MAN). WENDELL GASOL MAKES IT! Assist: Klay Giddey
Score: 54-53

[06:10] Team_067 possession (Score: 54-53)
Malcolm Westbrook attempts a Midrange. BLOCKED BY KOBE BOOKER! Ball deflects out of bounds off Malcolm Westbrook.

[05:55] Team_026 possession (Score: 54-53)
FOUL! Offensive foul on Immanuel Hyland! Wendell Antetokounmpo drew the charge! [Team fouls: 3] (Immanuel Hyland: 1 personal fouls) TURNOVER! (dead ball)

[05:44] Team_067 possession (Score: 54-53)
Malcolm Westbrook loses control! Ball rolls out of bounds! TURNOVER! (dead ball)

[05:30] Team_026 possession (Score: 54-53)
Shaquille Trent attempts a Layup. Contested by Malcolm Westbrook (4.6 feet, ZONE). Shaquille Trent misses. FOUL! Loose ball foul on Wendell Antetokounmpo during the rebound battle. [Team fouls: 4] No free throws, side out. (Wendell Antetokounmpo: 1 personal fouls)

[05:13] Team_026 possession (Score: 54-53)
Wendell Gasol attempts a Midrange. Wide open! Desmond Simmons is 6.1 feet away. [ZONE] WENDELL GASOL MAKES IT!
Score: 56-53

[04:58] Team_067 possession (Score: 56-53)
Desmond Simmons attempts a Midrange. Wide open! Klay Giddey is 7.6 feet away. [MAN] DESMOND SIMMONS MAKES IT!
Score: 56-55

[04:44] Team_026 possession (Score: 56-55)
Shaquille Trent attempts a Midrange. Wide open! Desmond Simmons is 6.2 feet away. [ZONE] SHAQUILLE TRENT MAKES IT! Assist: Wendell Gasol
Score: 58-55

[04:32] Team_067 possession (Score: 58-55)
Malcolm Westbrook makes the Layup and draws the foul on Kobe Booker! And-1! Malcolm Westbrook to the line for 1. [Team fouls: 4] (Kobe Booker: 2 personal fouls)   FT 1/1: GOOD Malcolm Westbrook makes 1/1 from the line.
Score: 58-58

[04:23] Team_026 possession (Score: 58-58)
Kobe Booker attempts a Midrange. Contested by Malcolm Westbrook (3.5 feet, MAN). Kobe Booker misses. Offensive rebound by Shaquille Trent! Shaquille Trent kicks it out.

[04:07] Team_026 possession (Score: 58-58)
FOUL! Shooting foul on Ben Ball. Shaquille Trent to the line for 2 free throws. [BONUS: 5 team fouls] (Ben Ball: 1 personal fouls)   FT 1/2: GOOD   FT 2/2: GOOD Shaquille Trent makes 2/2 from the line.
Score: 60-58

[03:52] Team_067 possession (Score: 60-58)
FOUL! Shooting foul on Immanuel Hyland. Desmond Simmons to the line for 2 free throws. [BONUS: 5 team fouls] (Immanuel Hyland: 2 personal fouls)   FT 1/2: GOOD   FT 2/2: GOOD Desmond Simmons makes 2/2 from the line.
Score: 60-60

[03:42] Team_026 possession (Score: 60-60)
FOUL! Reach-in foul on Malcolm Westbrook during the drive. [IN THE BONUS! 6 team fouls] Immanuel Hyland to the line for 2 free throws. (Malcolm Westbrook: 2 personal fouls)   FT 1/2: MISS   FT 2/2: GOOD Immanuel Hyland makes 1/2 from the line.
Score: 61-60

[03:26] Team_067 possession (Score: 61-60)
Ben Ball attempts a 3Pt. Contested by Shaquille Trent (4.3 feet, MAN). Ben Ball misses. Rebound secured by Immanuel Hyland.

[03:08] Team_026 possession (Score: 61-60)
FOUL! Reach-in foul on Wendell Antetokounmpo during the drive. [IN THE BONUS! 7 team fouls] Immanuel Hyland to the line for 2 free throws. (Wendell Antetokounmpo: 2 personal fouls)   FT 1/2: GOOD   FT 2/2: GOOD Immanuel Hyland makes 2/2 from the line.
Score: 63-60

[02:56] Team_067 possession (Score: 63-60)
Manu Reaves attempts a Layup. Contested by Wendell Gasol (2.5 feet, MAN). Manu Reaves misses. Rebound secured by Immanuel Hyland.

[02:43] Team_026 possession (Score: 63-60)
Klay Giddey drives to the basket... Klay Giddey throws a bad pass out of bounds! TURNOVER! (dead ball)

[02:43] Substitution (Team_026): Wendell Gasol OUT → Myles Tatum IN (stamina_rule2)

[02:43] Substitution (Team_026): Immanuel Hyland OUT → Karl Barrett IN (stamina_rule2)

[02:43] Substitution (Team_026): Klay Giddey OUT → Josh Simons IN (stamina_rule2)

[02:43] Substitution (Team_026): Shaquille Trent OUT → Damian Doncic IN (stamina_rule2)

[02:43] Substitution (Team_026): Kobe Booker OUT → Dirk Randle IN (stamina_rule2)

[02:43] Substitution (Team_067): Manu Reaves OUT → James Rozier IN (stamina_rule2)

[02:43] Substitution (Team_067): Wendell Antetokounmpo OUT → Anfernee Wagner IN (stamina_rule2)

[02:43] Substitution (Team_067): Ben Ball OUT → Kristaps Davis IN (stamina_rule2)

[02:43] Substitution (Team_067): Malcolm Westbrook OUT → Zach DeRozan IN (stamina_rule2)

[02:33] Team_067 possession (Score: 63-60)
James Rozier drives to the basket... James Rozier throws a bad pass! Stolen by Damian Doncic! TURNOVER! (live ball)

[02:17] Team_026 possession (Score: 63-60)
Myles Tatum attempts a 3Pt. Contested by James Rozier (5.0 feet, MAN). MYLES TATUM MAKES IT! Assist: Dirk Randle
Score: 66-60

[02:03] Team_067 possession (Score: 66-60)
James Rozier attempts a 3Pt. Wide open! Myles Tatum is 7.4 feet away. [MAN] James Rozier misses. Rebound secured by Josh Simons.

[01:50] Team_026 possession (Score: 66-60)
Josh Simons drives to the basket... Josh Simons loses control! Ball rolls out of bounds! TURNOVER! (dead ball)

[01:50] Substitution (Team_067): Desmond Simmons OUT → Kyle Leonard IN (stamina_rule2)

[01:37] Team_067 possession (Score: 66-60)
James Rozier attempts a Midrange. Contested by Myles Tatum (4.4 feet, ZONE). James Rozier misses. Offensive rebound by Kristaps Davis! Kristaps Davis puts it back in!
Score: 66-62

[01:20] Team_026 possession (Score: 66-62)
Damian Doncic drives and kicks out. Karl Barrett attempts a 3Pt. Wide open! Anfernee Wagner is 6.4 feet away. [ZONE] KARL BARRETT MAKES IT!
Score: 69-62

[01:02] Team_067 possession (Score: 69-62)
Kristaps Davis attempts a Midrange. Contested by Josh Simons (5.2 feet, ZONE). Kristaps Davis misses. Rebound secured by Josh Simons.

[00:49] Team_026 possession (Score: 69-62)
Damian Doncic makes the Dunk and draws the foul on Kristaps Davis! And-1! Damian Doncic to the line for 1. [BONUS: 8 team fouls] (Kristaps Davis: 1 personal fouls)   FT 1/1: GOOD Damian Doncic makes 1/1 from the line.
Score: 72-62

[00:35] Team_067 possession (Score: 72-62)
FOUL! Reach-in foul on Damian Doncic during the drive. [IN THE BONUS! 6 team fouls] Kristaps Davis to the line for 2 free throws. (Damian Doncic: 1 personal fouls)   FT 1/2: GOOD   FT 2/2: MISS Kristaps Davis makes 1/2 from the line. Rebound secured by Karl Barrett.
Score: 72-63

[00:25] Team_026 possession (Score: 72-63)
Myles Tatum attempts a 3Pt. Contested by James Rozier (5.6 feet, MAN). Myles Tatum misses. Rebound secured by Anfernee Wagner.

[00:09] Team_067 possession (Score: 72-63)
Kristaps Davis attempts a Midrange. Contested by Damian Doncic (5.0 feet, MAN). KRISTAPS DAVIS MAKES IT!
Score: 72-65

================================================================================
                              3RD QUARTER COMPLETE                              
================================================================================

3RD QUARTER SCORE: Team_026 27, Team_067 20

BOX SCORE:
================================================================================

Team_026
--------------------------------------------------------------------------------
Player                MIN  PTS  REB  AST  TO      FG   FG%      3P   3P%
--------------------------------------------------------------------------------
Wendell Gasol          23   11    0    1   0   5/5   100.0     0/0   0.0
Shaquille Trent        23    4    6    0   0   2/3    66.7     0/0   0.0
Immanuel Hyland        23    3    3    1   0   2/3    66.7     0/0   0.0
Myles Tatum            13    3    0    0   0   1/2    50.0     0/0   0.0
Karl Barrett           13    3    1    0   0   1/1   100.0     0/0   0.0
Damian Doncic          13    3    0    0   0   1/1   100.0     0/0   0.0
Kobe Booker            23    0    1    1   0   0/1     0.0     0/0   0.0
Klay Giddey            23    0    0    1   0   0/1     0.0     0/0   0.0
Dirk Randle            13    0    0    1   0   0/0     0.0     0/0   0.0
Josh Simons            13    0    2    0   0   0/0     0.0     0/0   0.0

TEAM: FG: 12/17 (70.6%), 3PT: 2/3 (66.7%), REB: 12 (4 off, 8 def), AST: 5, TO: 6
TEAM FOULS: 6 [Team_067 in BONUS]


Team_067
--------------------------------------------------------------------------------
Player                MIN  PTS  REB  AST  TO      FG   FG%      3P   3P%
--------------------------------------------------------------------------------
Malcolm Westbrook      23    6    3    1   0   2/3    66.7     0/0   0.0
Desmond Simmons        24    4    1    1   0   2/3    66.7     0/0   0.0
Kristaps Davis         13    4    1    0   0   2/4    50.0     0/0   0.0
Manu Reaves            23    3    0    1   0   1/4    25.0     0/0   0.0
Ben Ball               23    2    0    0   0   1/2    50.0     0/0   0.0
Wendell Antetokounmpo   23    0    0    0   0   0/1     0.0     0/0   0.0
James Rozier           13    0    0    0   0   0/1     0.0     0/0   0.0
Anfernee Wagner        13    0    1    0   0   0/0     0.0     0/0   0.0

TEAM: FG: 8/18 (44.4%), 3PT: 2/6 (33.3%), REB: 7 (2 off, 5 def), AST: 3, TO: 5
TEAM FOULS: 8 [Team_026 in BONUS]

================================================================================

================================================================================
                       4TH QUARTER - Team_026 vs Team_067                       
================================================================================

[12:00] Team_026 possession (Score: 72-65)
Wendell Gasol attempts a 3Pt. Contested by Desmond Simmons (2.9 feet, ZONE). WENDELL GASOL MAKES IT! Assist: Kobe Booker
Score: 75-65

[11:43] Team_067 possession (Score: 75-65)
Malcolm Westbrook drives to the basket... Malcolm Westbrook throws a bad pass! Stolen by Kobe Booker! TURNOVER! (live ball)

[11:27] Team_026 possession (Score: 75-65)
Shaquille Trent attempts a Midrange. Contested by Malcolm Westbrook (4.0 feet, ZONE). Shaquille Trent misses. Rebound secured by Desmond Simmons.

[11:11] Team_067 possession (Score: 75-65)
Desmond Simmons attempts a Midrange. Contested by Immanuel Hyland (5.3 feet, ZONE). Desmond Simmons misses. Offensive rebound by Desmond Simmons! Desmond Simmons kicks it out.

[10:52] Team_067 possession (Score: 75-65)
FOUL! Reach-in foul on Shaquille Trent during the drive. [Team fouls: 1] No free throws, side out. (Shaquille Trent: 1 personal fouls)

[10:40] Team_067 possession (Score: 75-65)
Manu Reaves drives to the basket... FOUL! Offensive foul on Manu Reaves! Kobe Booker drew the charge! [Team fouls: 1] (Manu Reaves: 1 personal fouls) TURNOVER! (dead ball)

[10:29] Team_026 possession (Score: 75-65)
Kobe Booker attempts a Layup. Wide open! Malcolm Westbrook is 6.1 feet away. [ZONE] KOBE BOOKER MAKES IT! Assist: Shaquille Trent
Score: 77-65

[10:14] Team_067 possession (Score: 77-65)
Malcolm Westbrook attempts a Layup. Contested by Kobe Booker (3.1 feet, ZONE). MALCOLM WESTBROOK MAKES IT! Assist: Manu Reaves
Score: 77-67

[10:00] Team_026 possession (Score: 77-67)
Klay Giddey attempts a 3Pt. Contested by Desmond Simmons (2.4 feet, MAN). Klay Giddey misses. Rebound secured by Malcolm Westbrook.

[09:47] Team_067 possession (Score: 77-67)
Malcolm Westbrook drives and kicks out. Malcolm Westbrook attempts a 3Pt. Contested by Wendell Gasol (4.2 feet, ZONE). Malcolm Westbrook misses. FOUL! Loose ball foul on Immanuel Hyland during the rebound battle. [Team fouls: 2] No free throws, side out. (Immanuel Hyland: 1 personal fouls)

[09:33] Team_067 possession (Score: 77-67)
Ben Ball attempts a 3Pt. Contested by Wendell Gasol (5.3 feet, ZONE). Ben Ball misses. Offensive rebound by Desmond Simmons! Desmond Simmons kicks it out.

[09:19] Team_067 possession (Score: 77-67)
Wendell Antetokounmpo attempts a Layup. Contested by Immanuel Hyland (2.1 feet, MAN). WENDELL ANTETOKOUNMPO MAKES IT! Assist: Ben Ball
Score: 77-69

[09:06] Team_026 possession (Score: 77-69)
Kobe Booker attempts a Midrange. BLOCKED BY WENDELL ANTETOKOUNMPO! Ball is loose! Rebound secured by Malcolm Westbrook.

[08:54] Team_067 possession (Score: 77-69)
Manu Reaves drives to the basket... Manu Reaves loses the ball! Stripped by Kobe Booker! TURNOVER! (live ball)

[08:41] Team_026 possession (Score: 77-69)
Kobe Booker drives to the basket... Kobe Booker throws a bad pass! Stolen by Malcolm Westbrook! TURNOVER! (live ball)

[08:23] Team_067 possession (Score: 77-69)
Desmond Simmons attempts a Midrange. Wide open! Shaquille Trent is 7.0 feet away. [ZONE] Desmond Simmons misses. Rebound secured by Immanuel Hyland.

[08:14] Team_026 possession (Score: 77-69)
Kobe Booker drives, picks up Malcolm Westbrook. Help arrives from Wendell Antetokounmpo! Kobe Booker attempts a Dunk. Contested by Wendell Antetokounmpo (3.3 feet, ZONE). KOBE BOOKER MAKES IT! Assist: Shaquille Trent
Score: 79-69

[07:58] Team_067 possession (Score: 79-69)
Ben Ball attempts a 3Pt. Contested by Immanuel Hyland (5.7 feet, ZONE). Ben Ball misses. Rebound secured by Immanuel Hyland.

[07:43] Team_026 possession (Score: 79-69)
Kobe Booker drives to the basket... Kobe Booker throws a bad pass out of bounds! TURNOVER! (dead ball)

[07:43] Substitution (Team_026): Wendell Gasol OUT → Myles Tatum IN (stamina_rule2)

[07:43] Substitution (Team_026): Immanuel Hyland OUT → Karl Barrett IN (stamina_rule2)

[07:43] Substitution (Team_026): Klay Giddey OUT → Josh Simons IN (stamina_rule2)

[07:43] Substitution (Team_026): Shaquille Trent OUT → Damian Doncic IN (stamina_rule2)

[07:43] Substitution (Team_026): Kobe Booker OUT → Dirk Randle IN (stamina_rule2)

[07:43] Substitution (Team_067): Manu Reaves OUT → James Rozier IN (stamina_rule2)

[07:43] Substitution (Team_067): Wendell Antetokounmpo OUT → Anfernee Wagner IN (stamina_rule2)

[07:43] Substitution (Team_067): Desmond Simmons OUT → Kyle Leonard IN (stamina_rule2)

[07:43] Substitution (Team_067): Ben Ball OUT → Kristaps Davis IN (stamina_rule2)

[07:43] Substitution (Team_067): Malcolm Westbrook OUT → Zach DeRozan IN (stamina_rule2)

[07:23] Team_067 possession (Score: 79-69)
Anfernee Wagner drives, picks up Dirk Randle. Help arrives from Karl Barrett! Anfernee Wagner attempts a Layup. Contested by Karl Barrett (3.2 feet, ZONE). Anfernee Wagner misses. Rebound secured by Josh Simons.

[07:11] Team_026 possession (Score: 79-69)
Myles Tatum attempts a 3Pt. Contested by Anfernee Wagner (4.2 feet, ZONE). Myles Tatum misses. Rebound secured by Zach DeRozan.

[06:57] Team_067 possession (Score: 79-69)
Anfernee Wagner drives, Karl Barrett stays with him. Anfernee Wagner attempts a Dunk. Contested by Karl Barrett (3.9 feet, MAN). Anfernee Wagner misses. Offensive rebound by Kristaps Davis! Kristaps Davis puts it back in!
Score: 79-71

[06:45] Team_026 possession (Score: 79-71)
Karl Barrett drives and kicks out. Josh Simons attempts a 3Pt. Contested by Kyle Leonard (4.3 feet, MAN). Josh Simons misses. Rebound secured by Anfernee Wagner.

[06:33] Team_067 possession (Score: 79-71)
James Rozier attempts a Midrange. Wide open! Myles Tatum is 7.3 feet away. [MAN] JAMES ROZIER MAKES IT!
Score: 79-73

[06:20] Team_026 possession (Score: 79-73)
Myles Tatum attempts a 3Pt. Contested by Anfernee Wagner (6.0 feet, ZONE). Myles Tatum misses. Offensive rebound by Damian Doncic! Damian Doncic kicks it out.

[06:03] Team_026 possession (Score: 79-73)
Josh Simons makes the Dunk and draws the foul on Kristaps Davis! And-1! Josh Simons to the line for 1. [Team fouls: 2] (Kristaps Davis: 1 personal fouls)   FT 1/1: GOOD Josh Simons makes 1/1 from the line.
Score: 82-73

[05:50] Team_067 possession (Score: 82-73)
James Rozier attempts a Layup. Wide open! Damian Doncic is 6.2 feet away. [ZONE] JAMES ROZIER MAKES IT! Assist: Anfernee Wagner
Score: 82-75

[05:35] Team_026 possession (Score: 82-75)
Myles Tatum drives and kicks out. Karl Barrett attempts a 3Pt. Contested by Anfernee Wagner (4.6 feet, ZONE). Karl Barrett misses. Offensive rebound by Damian Doncic! Damian Doncic kicks it out.

[05:25] Team_026 possession (Score: 82-75)
Myles Tatum attempts a Midrange. Contested by James Rozier (2.2 feet, MAN). Myles Tatum misses. FOUL! Loose ball foul on Anfernee Wagner during the rebound battle. [Team fouls: 3] No free throws, side out. (Anfernee Wagner: 1 personal fouls)

[05:09] Team_026 possession (Score: 82-75)
Josh Simons attempts a 3Pt. Heavily contested by Kyle Leonard (0.5 feet, MAN)! Josh Simons misses. Rebound secured by Kristaps Davis.

[04:52] Team_067 possession (Score: 82-75)
Zach DeRozan drives, picks up Dirk Randle. Help arrives from Karl Barrett! Zach DeRozan attempts a Dunk. Contested by Karl Barrett (2.8 feet, MAN). Zach DeRozan misses. Rebound secured by Damian Doncic.

[04:43] Team_026 possession (Score: 82-75)
Karl Barrett attempts a 3Pt. Contested by Anfernee Wagner (3.0 feet, MAN). KARL BARRETT MAKES IT! Assist: Josh Simons
Score: 85-75

[04:29] Team_067 possession (Score: 85-75)
Kristaps Davis attempts a 3Pt. Wide open! Damian Doncic is 8.1 feet away. [MAN] Kristaps Davis misses. Rebound secured by Karl Barrett.

[04:15] Team_026 possession (Score: 85-75)
Myles Tatum attempts a Midrange. Contested by James Rozier (2.9 feet, ZONE). MYLES TATUM MAKES IT! Assist: Dirk Randle
Score: 87-75

[03:55] Team_067 possession (Score: 87-75)
Zach DeRozan drives and kicks out. Anfernee Wagner attempts a Midrange. Contested by Karl Barrett (5.9 feet, MAN). Anfernee Wagner misses. Rebound secured by Karl Barrett.

[03:37] Team_026 possession (Score: 87-75)
Josh Simons attempts a 3Pt. Contested by Kyle Leonard (6.0 feet, ZONE). Josh Simons misses. Rebound secured by Kristaps Davis.

[03:18] Team_067 possession (Score: 87-75)
Zach DeRozan drives, picks up Dirk Randle. Help arrives from Karl Barrett! Zach DeRozan attempts a Layup. Contested by Karl Barrett (4.8 feet, MAN). ZACH DEROZAN MAKES IT!
Score: 87-77

[02:58] Team_026 possession (Score: 87-77)
Dirk Randle attempts a Layup. Wide open! Kristaps Davis is 6.7 feet away. [ZONE] Dirk Randle misses. Rebound secured by Anfernee Wagner.

[02:44] Team_067 possession (Score: 87-77)
Kristaps Davis attempts a Layup. Contested by Damian Doncic (3.2 feet, MAN). KRISTAPS DAVIS MAKES IT! Assist: Anfernee Wagner
Score: 87-79

[02:26] Team_026 possession (Score: 87-79)
FOUL! Shooting foul on Kristaps Davis. Myles Tatum to the line for 2 free throws. [Team fouls: 4] (Kristaps Davis: 2 personal fouls)   FT 1/2: GOOD   FT 2/2: MISS Myles Tatum makes 1/2 from the line. Rebound secured by Kristaps Davis.
Score: 88-79

[02:16] Team_067 possession (Score: 88-79)
Kyle Leonard attempts a 3Pt. Contested by Karl Barrett (4.8 feet, ZONE). KYLE LEONARD MAKES IT!
Score: 88-82

[01:59] Team_026 possession (Score: 88-82)
Josh Simons attempts a Midrange. Wide open! Kyle Leonard is 6.3 feet away. [MAN] JOSH SIMONS MAKES IT! Assist: Myles Tatum
Score: 90-82

[01:43] Team_067 possession (Score: 90-82)
Anfernee Wagner attempts a 3Pt. Contested by Karl Barrett (2.5 feet, ZONE). Anfernee Wagner misses. FOUL! Loose ball foul on Damian Doncic during the rebound battle. [Team fouls: 3] No free throws, side out. (Damian Doncic: 1 personal fouls)

[01:32] Team_067 possession (Score: 90-82)
Anfernee Wagner attempts a 3Pt. Contested by Karl Barrett (2.6 feet, ZONE). Anfernee Wagner misses. Rebound secured by Karl Barrett.

[01:18] Team_026 possession (Score: 90-82)
Myles Tatum drives and kicks out. Dirk Randle attempts a Midrange. Contested by Zach DeRozan (5.5 feet, MAN). Dirk Randle misses. Rebound secured by Anfernee Wagner.

[01:02] Team_067 possession (Score: 90-82)
Kristaps Davis throws a bad pass! Stolen by Damian Doncic! TURNOVER! (live ball)

[00:47] Team_026 possession (Score: 90-82)
Karl Barrett drives and kicks out. Myles Tatum attempts a 3Pt. Contested by James Rozier (3.3 feet, MAN). Myles Tatum misses. Rebound secured by Zach DeRozan.

[00:28] Team_067 possession (Score: 90-82)
Kristaps Davis attempts a Layup. Contested by Damian Doncic (5.3 feet, ZONE). KRISTAPS DAVIS MAKES IT!
Score: 90-84

[00:17] Team_026 possession (Score: 90-84)
Myles Tatum attempts a Layup. Wide open! Kristaps Davis is 6.5 feet away. [ZONE] MYLES TATUM MAKES IT! Assist: Josh Simons
Score: 92-84

[00:02] Team_067 possession (Score: 92-84)
Zach DeRozan drives, Dirk Randle stays with him. Zach DeRozan attempts a Dunk. Contested by Dirk Randle (4.0 feet, ZONE). ZACH DEROZAN MAKES IT! Assist: James Rozier
Score: 92-86

================================================================================
                              4TH QUARTER COMPLETE                              
================================================================================

4TH QUARTER SCORE: Team_026 20, Team_067 21

BOX SCORE:
================================================================================

Team_026
--------------------------------------------------------------------------------
Player                MIN  PTS  REB  AST  TO      FG   FG%      3P   3P%
--------------------------------------------------------------------------------
Josh Simons            21    5    1    2   0   2/4    50.0     0/0   0.0
Kobe Booker            28    4    0    1   0   2/3    66.7     0/0   0.0
Myles Tatum            21    4    0    1   0   2/5    40.0     0/0   0.0
Wendell Gasol          28    3    0    0   0   1/1   100.0     0/0   0.0
Karl Barrett           21    3    3    0   0   1/3    33.3     0/0   0.0
Shaquille Trent        28    0    0    2   0   0/1     0.0     0/0   0.0
Klay Giddey            28    0    0    0   0   0/1     0.0     0/0   0.0
Immanuel Hyland        28    0    2    0   0   0/0     0.0     0/0   0.0
Damian Doncic          21    0    4    0   0   0/0     0.0     0/0   0.0
Dirk Randle            21    0    0    1   0   0/1     0.0     0/0   0.0

TEAM: FG: 8/19 (42.1%), 3PT: 2/6 (33.3%), REB: 10 (3 off, 7 def), AST: 7, TO: 2
TEAM FOULS: 3


Team_067
--------------------------------------------------------------------------------
Player                MIN  PTS  REB  AST  TO      FG   FG%      3P   3P%
--------------------------------------------------------------------------------
Kristaps Davis         21    6    5    0   0   3/4    75.0     0/0   0.0
Zach DeRozan           21    4    2    0   0   2/4    50.0     0/0   0.0
James Rozier           21    4    0    1   0   2/2   100.0     0/0   0.0
Kyle Leonard           20    3    0    0   0   1/1   100.0     0/0   0.0
Malcolm Westbrook      28    2    2    0   0   1/1   100.0     0/0   0.0
Wendell Antetokounmpo   28    2    0    0   0   1/1   100.0     0/0   0.0
Desmond Simmons        29    0    4    0   0   0/1     0.0     0/0   0.0
Manu Reaves            28    0    0    1   0   0/0     0.0     0/0   0.0
Ben Ball               28    0    0    1   0   0/1     0.0     0/0   0.0
Anfernee Wagner        21    0    3    2   0   0/2     0.0     0/0   0.0

TEAM: FG: 10/17 (58.8%), 3PT: 1/4 (25.0%), REB: 16 (5 off, 11 def), AST: 5, TO: 4
TEAM FOULS: 4

================================================================================

================================================================================
                               FULL GAME COMPLETE                               
================================================================================

FINAL SCORE: Team_026 92, Team_067 86

SCORING BY QUARTER:
--------------------------------------------------------------------------------
Team                     Q1     Q2     Q3     Q4    FINAL
--------------------------------------------------------------------------------
Team_026                 26     19     27     20       92
Team_067                 24     21     20     21       86
--------------------------------------------------------------------------------

FULL GAME BOX SCORE:
================================================================================

Team_026
--------------------------------------------------------------------------------
Player                MIN  PTS  REB  AST  TO      FG   FG%      3P   3P%      FT STL BLK
--------------------------------------------------------------------------------
Wendell Gasol          28   16    0    2   4   7/8    87.5   2/2   100.0   2/2     0   0
Immanuel Hyland        28   10    6    2   2   6/10   60.0   2/4    50.0   5/7     1   0
Klay Giddey            28    4    0    2   4   2/5    40.0   0/1     0.0   0/0     0   0
Shaquille Trent        28    4    7    2   0   2/7    28.6   0/2     0.0   2/2     0   0
Kobe Booker            28   17    3    3   2   7/9    77.8   0/0     0.0   3/3     5   1
Myles Tatum            21   10    0    2   0   4/9    44.4   2/4    50.0   4/5     0   0
Karl Barrett           21    8    7    1   0   2/8    25.0   1/3    33.3   0/0     0   0
Josh Simons            21    8    7    2   1   3/6    50.0   1/4    25.0   1/1     0   0
Damian Doncic          21    8    7    0   2   4/5    80.0   0/0     0.0   2/2     2   1
Dirk Randle            21    6    0    2   0   3/5    60.0   0/1     0.0   0/0     0   0

TEAM: FG: 40/72 (55.6%), 3PT: 8/21 (38.1%), REB: 36 (8 off, 28 def), AST: 18, TO: 15


Team_067
--------------------------------------------------------------------------------
Player                MIN  PTS  REB  AST  TO      FG   FG%      3P   3P%      FT STL BLK
--------------------------------------------------------------------------------
Desmond Simmons        29   11   10    3   3   5/8    62.5   1/1   100.0   2/2     0   0
Manu Reaves            28    6    1    3   2   2/6    33.3   2/5    40.0   0/0     0   1
Wendell Antetokounmpo   28    6    2    1   2   3/5    60.0   0/1     0.0   0/0     0   2
Ben Ball               28   10    0    2   2   4/7    57.1   2/5    40.0   0/0     0   1
Malcolm Westbrook      28   13    7    3   7   6/7    85.7   1/1   100.0   2/3     2   0
James Rozier           21    4    0    1   0   3/6    50.0   0/2     0.0   0/0     0   0
Anfernee Wagner        21    5    6    3   1   2/6    33.3   0/3     0.0   1/1     0   0
Kristaps Davis         21   14   10    1   1   4/9    44.4   0/1     0.0   1/2     0   0
Zach DeRozan           21    7    6    1   1   3/7    42.9   0/0     0.0   2/3     0   0
Kyle Leonard           20    8    0    0   0   5/7    71.4   3/4    75.0   0/0     0   0

TEAM: FG: 37/68 (54.4%), 3PT: 9/23 (39.1%), REB: 43 (12 off, 31 def), AST: 18, TO: 19

================================================================================
