================================================================================
                        FULL GAME - Team_089 vs Team_038                        
================================================================================

================================================================================
                       1ST QUARTER - Team_089 vs Team_038                       
================================================================================

[12:00] Team_089 possession (Score: 0-0)
Terry Simmons attempts a Midrange. Contested by Tracy LaVine (3.8 feet, ZONE). TERRY SIMMONS MAKES IT!
Score: 2-0

[11:44] Team_038 possession (Score: 2-0)
Malcolm Poole attempts a 3Pt. Contested by Jordan Brogdon (4.4 feet, ZONE). Malcolm Poole misses. Rebound secured by Terry Simmons.

[11:29] Team_089 possession (Score: 2-0)
Terry Simmons attempts a Midrange. Wide open! Luka Barnes is 6.9 feet away. [MAN] Terry Simmons misses. Rebound secured by DeMar Harris.

[11:15] Team_038 possession (Score: 2-0)
Luka Barnes drives to the basket... Luka Barnes throws a bad pass! Stolen by Terry Simmons! TURNOVER! (live ball)

[10:59] Team_089 possession (Score: 2-0)
Jalen Jackson attempts a Layup. Heavily contested by Tracy LaVine (1.4 feet, ZONE)! Jalen Jackson misses. Rebound secured by DeMar Harris.

[10:45] Team_038 possession (Score: 2-0)
FOUL! Holding foul on Jordan Brogdon. [Team fouls: 1] No free throws, side out. (Jordan Brogdon: 1 personal fouls)

[10:34] Team_038 possession (Score: 2-0)
Luka Barnes drives, picks up Terry Simmons. Help arrives from Jalen Jackson! Luka Barnes attempts a Layup. Contested by Jalen Jackson (3.3 feet, MAN). LUKA BARNES MAKES IT! Assist: Malcolm Poole
Score: 2-2

[10:20] Team_089 possession (Score: 2-2)
Allen Mobley attempts a Midrange. Contested by Rudy Thompson (2.1 feet, ZONE). Allen Mobley misses. Rebound secured by Luka Barnes.

[10:04] Team_038 possession (Score: 2-2)
Rudy Thompson attempts a 3Pt. Contested by Jordan Brogdon (6.0 feet, ZONE). RUDY THOMPSON MAKES IT! Assist: Luka Barnes
Score: 2-5

[09:49] Team_089 possession (Score: 2-5)
Jalen Jackson attempts a 3Pt. Contested by DeMar Harris (5.4 feet, ZONE). JALEN JACKSON MAKES IT! Assist: Terry Simmons
Score: 5-5

[09:30] Team_038 possession (Score: 5-5)
Malcolm Poole attempts a 3Pt. Contested by Jalen Jackson (4.8 feet, MAN). Malcolm Poole misses. Rebound secured by Rudy Smith.

[09:14] Team_089 possession (Score: 5-5)
Jordan Brogdon drives, picks up Tracy LaVine. Help arrives from Malcolm Poole! Jordan Brogdon attempts a Dunk. Heavily contested by Malcolm Poole (1.7 feet, ZONE)! JORDAN BROGDON MAKES IT!
Score: 7-5

[09:01] Team_038 possession (Score: 7-5)
Tracy LaVine drives to the basket... Tracy LaVine throws a bad pass! Stolen by Terry Simmons! TURNOVER! (live ball)

[08:47] Team_089 possession (Score: 7-5)
Terry Simmons attempts a Midrange. Contested by Luka Barnes (5.5 feet, MAN). TERRY SIMMONS MAKES IT!
Score: 9-5

[08:33] Team_038 possession (Score: 9-5)
Luka Barnes attempts a Midrange. Wide open! Rudy Smith is 7.5 feet away. [ZONE] Luka Barnes misses. Rebound secured by Rudy Smith.

[08:20] Team_089 possession (Score: 9-5)
Jordan Brogdon attempts a 3Pt. Contested by DeMar Harris (4.8 feet, ZONE). Jordan Brogdon misses. Rebound secured by DeMar Harris.

[08:02] Team_038 possession (Score: 9-5)
FOUL! Holding foul on Jalen Jackson. [Team fouls: 2] No free throws, side out. (Jalen Jackson: 1 personal fouls)

[07:47] Team_038 possession (Score: 9-5)
FOUL! Shooting foul on Terry Simmons. Luka Barnes to the line for 2 free throws. [Team fouls: 3] (Terry Simmons: 1 personal fouls)   FT 1/2: MISS   FT 2/2: GOOD Luka Barnes makes 1/2 from the line.
Score: 9-6

[07:33] Team_089 possession (Score: 9-6)
Allen Mobley attempts a Midrange. Wide open! Malcolm Poole is 7.6 feet away. [ZONE] ALLEN MOBLEY MAKES IT! Assist: Jordan Brogdon
Score: 11-6

[07:22] Team_038 possession (Score: 11-6)
DeMar Harris makes the Layup and draws the foul on Jalen Jackson! And-1! DeMar Harris to the line for 1. [Team fouls: 4] (Jalen Jackson: 2 personal fouls)   FT 1/1: MISS DeMar Harris makes 0/1 from the line. Rebound secured by Jalen Jackson.
Score: 11-8

[07:08] Team_089 possession (Score: 11-8)
Jalen Jackson attempts a 3Pt. Contested by DeMar Harris (2.9 feet, ZONE). Jalen Jackson misses. Rebound secured by DeMar Harris.

[06:51] Team_038 possession (Score: 11-8)
Luka Barnes attempts a Midrange. Contested by Terry Simmons (5.1 feet, MAN). Luka Barnes misses. Rebound secured by Terry Simmons.

[06:36] Team_089 possession (Score: 11-8)
Jordan Brogdon drives and kicks out. Jordan Brogdon makes the Midrange and draws the foul on Rudy Thompson! And-1! Jordan Brogdon to the line for 1. [Team fouls: 1] (Rudy Thompson: 1 personal fouls)   FT 1/1: GOOD Jordan Brogdon makes 1/1 from the line.
Score: 14-8

[06:21] Team_038 possession (Score: 14-8)
Rudy Thompson drives, Jordan Brogdon stays with him. Rudy Thompson attempts a Dunk. Heavily contested by Jordan Brogdon (0.5 feet, MAN)! Rudy Thompson misses. Rebound secured by Terry Simmons.

[06:09] Team_089 possession (Score: 14-8)
Allen Mobley attempts a Midrange. Wide open! Malcolm Poole is 8.1 feet away. [ZONE] ALLEN MOBLEY MAKES IT! Assist: Terry Simmons
Score: 16-8

[05:53] Team_038 possession (Score: 16-8)
Tracy LaVine attempts a Midrange. Heavily contested by Rudy Smith (1.4 feet, MAN)! TRACY LAVINE MAKES IT!
Score: 16-10

[05:38] Team_089 possession (Score: 16-10)
Jordan Brogdon attempts a 3Pt. Contested by Rudy Thompson (3.2 feet, MAN). JORDAN BROGDON MAKES IT! Assist: Allen Mobley
Score: 19-10

[05:26] Team_038 possession (Score: 19-10)
Tracy LaVine attempts a Dunk. BLOCKED BY TERRY SIMMONS! Ball deflects out of bounds off Tracy LaVine.

[05:14] Team_089 possession (Score: 19-10)
Allen Mobley attempts a 3Pt. Heavily contested by DeMar Harris (1.0 feet, MAN)! Allen Mobley misses. Offensive rebound by Jalen Jackson! Jalen Jackson kicks it out.

[05:04] Team_089 possession (Score: 19-10)
Jordan Brogdon attempts a 3Pt. Contested by DeMar Harris (3.7 feet, ZONE). Jordan Brogdon misses. Rebound secured by Luka Barnes.

[04:53] Team_038 possession (Score: 19-10)
DeMar Harris attempts a 3Pt. Contested by Allen Mobley (4.5 feet, MAN). DeMar Harris misses. Rebound secured by Rudy Smith.

[04:38] Team_089 possession (Score: 19-10)
Jordan Brogdon attempts a 3Pt. Wide open! Malcolm Poole is 9.0 feet away. [ZONE] JORDAN BROGDON MAKES IT! Assist: Jalen Jackson
Score: 22-10

[04:26] Team_038 possession (Score: 22-10)
FOUL! Holding foul on Jalen Jackson. [IN THE BONUS! 5 team fouls] Malcolm Poole to the line for 2 free throws. (Jalen Jackson: 3 personal fouls)   FT 1/2: GOOD   FT 2/2: GOOD Malcolm Poole makes 2/2 from the line.
Score: 22-12

[04:15] Team_089 possession (Score: 22-12)
Terry Simmons attempts a Dunk. BLOCKED BY MALCOLM POOLE! Ball is loose! Offensive rebound by Terry Simmons! Terry Simmons kicks it out.

[04:00] Team_089 possession (Score: 22-12)
Rudy Smith attempts a Midrange. Wide open! Tracy LaVine is 6.9 feet away. [MAN] Rudy Smith misses. Rebound secured by DeMar Harris.

[03:45] Team_038 possession (Score: 22-12)
Tracy LaVine attempts a Midrange. Contested by Rudy Smith (2.8 feet, MAN). Tracy LaVine misses. Rebound secured by Jalen Jackson.

[03:27] Team_089 possession (Score: 22-12)
Jordan Brogdon throws a bad pass out of bounds! TURNOVER! (dead ball)

[03:09] Team_038 possession (Score: 22-12)
DeMar Harris attempts a 3Pt. Contested by Jordan Brogdon (2.8 feet, ZONE). DeMar Harris misses. Rebound secured by Terry Simmons.

[02:52] Team_089 possession (Score: 22-12)
Jordan Brogdon drives, picks up Rudy Thompson. Help arrives from DeMar Harris! Jordan Brogdon attempts a Layup. Heavily contested by DeMar Harris (0.5 feet, MAN)! Jordan Brogdon misses. Rebound secured by Tracy LaVine.

[02:34] Team_038 possession (Score: 22-12)
FOUL! Holding foul on Allen Mobley. [IN THE BONUS! 6 team fouls] DeMar Harris to the line for 2 free throws. (Allen Mobley: 1 personal fouls)   FT 1/2: GOOD   FT 2/2: MISS DeMar Harris makes 1/2 from the line. Offensive rebound by Tracy LaVine! Tracy LaVine kicks it out.
Score: 22-13

[02:23] Team_038 possession (Score: 22-13)
Luka Barnes drives, Terry Simmons stays with him. Luka Barnes attempts a Dunk. Contested by Terry Simmons (3.1 feet, ZONE). Luka Barnes misses. Offensive rebound by Luka Barnes! Luka Barnes kicks it out.

[02:11] Team_038 possession (Score: 22-13)
Rudy Thompson attempts a Midrange. Wide open! Allen Mobley is 6.2 feet away. [ZONE] Rudy Thompson misses. Rebound secured by Jalen Jackson.

[01:57] Team_089 possession (Score: 22-13)
Jordan Brogdon attempts a Midrange. Contested by Rudy Thompson (5.7 feet, MAN). Jordan Brogdon misses. Offensive rebound by Terry Simmons! Terry Simmons's putback is no good. Offensive rebound by Terry Simmons! Terry Simmons kicks it out.

[01:43] Team_089 possession (Score: 22-13)
Rudy Smith drives to the basket... Rudy Smith loses control! Ball rolls out of bounds! TURNOVER! (dead ball)

[01:43] Substitution (Team_089): Jordan Brogdon OUT → Tony Parker IN (stamina_rule2)

[01:43] Substitution (Team_089): Jalen Jackson OUT → Joel Barnes IN (stamina_rule2)

[01:43] Substitution (Team_089): Rudy Smith OUT → Devin Haliburton IN (stamina_rule2)

[01:43] Substitution (Team_089): Terry Simmons OUT → Evan Gasol IN (stamina_rule2)

[01:43] Substitution (Team_038): Rudy Thompson OUT → Jalen Hyland IN (stamina_rule2)

[01:43] Substitution (Team_038): Malcolm Poole OUT → Jaren Jokic IN (stamina_rule2)

[01:43] Substitution (Team_038): DeMar Harris OUT → Magic Dosunmu IN (stamina_rule2)

[01:43] Substitution (Team_038): Tracy LaVine OUT → Jabari Carter IN (stamina_rule2)

[01:43] Substitution (Team_038): Luka Barnes OUT → Ja Smith IN (stamina_rule2)

[01:26] Team_038 possession (Score: 22-13)
Ja Smith attempts a Midrange. Wide open! Evan Gasol is 6.4 feet away. [MAN] JA SMITH MAKES IT!
Score: 22-15

[01:15] Team_089 possession (Score: 22-15)
Devin Haliburton drives, Jabari Carter stays with him. Devin Haliburton attempts a Dunk. Wide open! Jabari Carter is 6.9 feet away. [MAN] Devin Haliburton misses. Rebound secured by Jabari Carter.

[01:04] Team_038 possession (Score: 22-15)
Magic Dosunmu drives, Allen Mobley stays with him. Magic Dosunmu attempts a Layup. Heavily contested by Allen Mobley (1.0 feet, MAN)! Magic Dosunmu misses. Offensive rebound by Ja Smith! Ja Smith's putback is no good. Offensive rebound by Ja Smith! Ja Smith kicks it out.

[00:48] Team_038 possession (Score: 22-15)
FOUL! Shooting foul on Joel Barnes. Jaren Jokic to the line for 2 free throws. [BONUS: 7 team fouls] (Joel Barnes: 1 personal fouls)   FT 1/2: GOOD   FT 2/2: GOOD Jaren Jokic makes 2/2 from the line.
Score: 22-17

[00:33] Team_089 possession (Score: 22-17)
Joel Barnes attempts a 3Pt. Wide open! Jaren Jokic is 7.2 feet away. [MAN] Joel Barnes misses. Rebound secured by Ja Smith.

[00:17] Team_038 possession (Score: 22-17)
Magic Dosunmu drives and kicks out. Jaren Jokic attempts a 3Pt. Contested by Devin Haliburton (4.4 feet, ZONE). Jaren Jokic misses. FOUL! Loose ball foul on Devin Haliburton during the rebound battle. [IN THE BONUS! 8 team fouls] Jabari Carter to the line for 2 free throws. (Devin Haliburton: 1 personal fouls)   FT 1/2: GOOD   FT 2/2: MISS Jabari Carter makes 1/2 from the line. Offensive rebound by Ja Smith! Ja Smith puts it back in!
Score: 22-20

[00:04] Team_089 possession (Score: 22-20)
FOUL! Offensive foul on Evan Gasol! Ja Smith drew the charge! [Team fouls: 9] (Evan Gasol: 1 personal fouls) TURNOVER! (dead ball)

================================================================================
                              1ST QUARTER COMPLETE                              
================================================================================

1ST QUARTER SCORE: Team_089 22, Team_038 20

BOX SCORE:
================================================================================

Team_089
--------------------------------------------------------------------------------
Player                MIN  PTS  REB  AST  TO      FG   FG%      3P   3P%
--------------------------------------------------------------------------------
Jordan Brogdon         11   11    0    1   0   4/7    57.1     0/0   0.0
Terry Simmons          11    4    6    2   0   2/3    66.7     0/0   0.0
Allen Mobley           12    4    0    1   0   2/3    66.7     0/0   0.0
Jalen Jackson          11    3    4    1   0   1/3    33.3     0/0   0.0
Rudy Smith             11    0    3    0   0   0/1     0.0     0/0   0.0
Devin Haliburton        2    0    0    0   0   0/1     0.0     0/0   0.0
Joel Barnes             2    0    0    0   0   0/1     0.0     0/0   0.0

TEAM: FG: 9/19 (47.4%), 3PT: 3/7 (42.9%), REB: 13 (3 off, 10 def), AST: 5, TO: 3
TEAM FOULS: 9 [Team_038 in BONUS]


Team_038
--------------------------------------------------------------------------------
Player                MIN  PTS  REB  AST  TO      FG   FG%      3P   3P%
--------------------------------------------------------------------------------
Ja Smith                2    5    3    0   0   2/2   100.0     0/0   0.0
Luka Barnes            11    3    3    1   0   2/4    50.0     0/0   0.0
Rudy Thompson          11    3    0    0   0   1/3    33.3     0/0   0.0
Malcolm Poole          11    2    0    1   0   1/3    33.3     0/0   0.0
Tracy LaVine           11    2    2    0   0   1/3    33.3     0/0   0.0
Jaren Jokic             2    2    0    0   0   1/1   100.0     0/0   0.0
DeMar Harris           11    0    5    0   0   0/3     0.0     0/0   0.0
Jabari Carter           2    0    1    0   0   0/0     0.0     0/0   0.0

TEAM: FG: 8/19 (42.1%), 3PT: 1/5 (20.0%), REB: 14 (4 off, 10 def), AST: 2, TO: 2
TEAM FOULS: 1

================================================================================

================================================================================
                       2ND QUARTER - Team_089 vs Team_038                       
================================================================================

[12:00] Team_089 possession (Score: 22-20)
Terry Simmons drives, Luka Barnes stays with him. Terry Simmons attempts a Dunk. Contested by Luka Barnes (2.4 feet, MAN). TERRY SIMMONS MAKES IT!
Score: 24-20

[11:45] Team_038 possession (Score: 24-20)
Tracy LaVine attempts a Layup. Contested by Rudy Smith (5.5 feet, MAN). Tracy LaVine misses. Rebound secured by Jalen Jackson.

[11:30] Team_089 possession (Score: 24-20)
Jordan Brogdon drives to the basket... Jordan Brogdon throws a bad pass! Stolen by Tracy LaVine! TURNOVER! (live ball)

[11:11] Team_038 possession (Score: 24-20)
DeMar Harris attempts a 3Pt. Contested by Jordan Brogdon (4.6 feet, ZONE). DeMar Harris misses. Rebound secured by Rudy Smith.

[10:56] Team_089 possession (Score: 24-20)
Rudy Smith attempts a 3Pt. Heavily contested by DeMar Harris (0.5 feet, ZONE)! Rudy Smith misses. Rebound secured by DeMar Harris.

[10:42] Team_038 possession (Score: 24-20)
Rudy Thompson attempts a Layup. Wide open! Terry Simmons is 6.5 feet away. [ZONE] RUDY THOMPSON MAKES IT! Assist: DeMar Harris
Score: 24-22

[10:25] Team_089 possession (Score: 24-22)
Jordan Brogdon drives and kicks out. Allen Mobley attempts a 3Pt. Heavily contested by DeMar Harris (1.1 feet, MAN)! ALLEN MOBLEY MAKES IT! Assist: Jordan Brogdon
Score: 27-22

[10:09] Team_038 possession (Score: 27-22)
DeMar Harris attempts a 3Pt. Wide open! Allen Mobley is 6.1 feet away. [MAN] DEMAR HARRIS MAKES IT! Assist: Malcolm Poole
Score: 27-25

[09:52] Team_089 possession (Score: 27-25)
Jalen Jackson attempts a 3Pt. Contested by Malcolm Poole (2.2 feet, MAN). Jalen Jackson misses. Rebound secured by Luka Barnes.

[09:42] Team_038 possession (Score: 27-25)
Rudy Thompson attempts a 3Pt. Contested by Jordan Brogdon (3.7 feet, ZONE). Rudy Thompson misses. Rebound secured by Jalen Jackson.

[09:28] Team_089 possession (Score: 27-25)
Jordan Brogdon attempts a 3Pt. Contested by DeMar Harris (4.3 feet, ZONE). Jordan Brogdon misses. Rebound secured by Luka Barnes.

[09:10] Team_038 possession (Score: 27-25)
Malcolm Poole attempts a 3Pt. Contested by Jordan Brogdon (2.7 feet, ZONE). Malcolm Poole misses. Rebound secured by Rudy Smith.

[08:58] Team_089 possession (Score: 27-25)
FOUL! Holding foul on Luka Barnes. [Team fouls: 1] No free throws, side out. (Luka Barnes: 1 personal fouls)

[08:42] Team_089 possession (Score: 27-25)
Terry Simmons drives and kicks out. Jalen Jackson attempts a 3Pt. Heavily contested by DeMar Harris (1.6 feet, ZONE)! JALEN JACKSON MAKES IT! Assist: Terry Simmons
Score: 30-25

[08:27] Team_038 possession (Score: 30-25)
Tracy LaVine attempts a 3Pt. Contested by Jordan Brogdon (2.1 feet, ZONE). Tracy LaVine misses. Rebound secured by Jalen Jackson.

[08:12] Team_089 possession (Score: 30-25)
Allen Mobley drives and kicks out. Allen Mobley makes the 3Pt and draws the foul on DeMar Harris! And-1! Allen Mobley to the line for 1. [Team fouls: 2] (DeMar Harris: 1 personal fouls)   FT 1/1: GOOD Allen Mobley makes 1/1 from the line.
Score: 34-25

[07:55] Team_038 possession (Score: 34-25)
Tracy LaVine drives and kicks out. Luka Barnes attempts a 3Pt. Contested by Terry Simmons (4.2 feet, MAN). LUKA BARNES MAKES IT! Assist: Rudy Thompson
Score: 34-28

[07:39] Team_089 possession (Score: 34-28)
Terry Simmons attempts a Midrange. Contested by DeMar Harris (3.8 feet, ZONE). Terry Simmons misses. Rebound secured by Luka Barnes.

[07:22] Team_038 possession (Score: 34-28)
Malcolm Poole drives to the basket... Malcolm Poole throws a bad pass out of bounds! TURNOVER! (dead ball)

[07:22] Substitution (Team_089): Jordan Brogdon OUT → Tony Parker IN (stamina_rule2)

[07:22] Substitution (Team_089): Jalen Jackson OUT → Joel Barnes IN (stamina_rule2)

[07:22] Substitution (Team_089): Allen Mobley OUT → Pascal Durant IN (stamina_rule2)

[07:22] Substitution (Team_089): Rudy Smith OUT → Devin Haliburton IN (stamina_rule2)

[07:22] Substitution (Team_089): Terry Simmons OUT → Evan Gasol IN (stamina_rule2)

[07:22] Substitution (Team_038): Rudy Thompson OUT → Jalen Hyland IN (stamina_rule2)

[07:22] Substitution (Team_038): Malcolm Poole OUT → Jaren Jokic IN (stamina_rule2)

[07:22] Substitution (Team_038): DeMar Harris OUT → Magic Dosunmu IN (stamina_rule2)

[07:22] Substitution (Team_038): Tracy LaVine OUT → Jabari Carter IN (stamina_rule2)

[07:22] Substitution (Team_038): Luka Barnes OUT → Ja Smith IN (stamina_rule2)

[07:04] Team_089 possession (Score: 34-28)
Joel Barnes attempts a 3Pt. Contested by Jalen Hyland (4.3 feet, ZONE). JOEL BARNES MAKES IT! Assist: Evan Gasol
Score: 37-28

[06:50] Team_038 possession (Score: 37-28)
Jalen Hyland attempts a 3Pt. Wide open! Joel Barnes is 9.1 feet away. [ZONE] Jalen Hyland misses. Rebound secured by Pascal Durant.

[06:33] Team_089 possession (Score: 37-28)
Joel Barnes loses control! Ball rolls out of bounds! TURNOVER! (dead ball)

[06:19] Team_038 possession (Score: 37-28)
Jaren Jokic attempts a 3Pt. Contested by Devin Haliburton (3.9 feet, ZONE). JAREN JOKIC MAKES IT! Assist: Magic Dosunmu
Score: 37-31

[06:04] Team_089 possession (Score: 37-31)
Tony Parker attempts a Midrange. Contested by Jabari Carter (3.8 feet, ZONE). TONY PARKER MAKES IT! Assist: Evan Gasol
Score: 39-31

[05:48] Team_038 possession (Score: 39-31)
Magic Dosunmu attempts a 3Pt. Contested by Pascal Durant (2.4 feet, ZONE). MAGIC DOSUNMU MAKES IT! Assist: Jalen Hyland
Score: 39-34

[05:31] Team_089 possession (Score: 39-34)
Tony Parker makes the Dunk and draws the foul on Ja Smith! And-1! Tony Parker to the line for 1. [Team fouls: 3] (Ja Smith: 1 personal fouls)   FT 1/1: GOOD Tony Parker makes 1/1 from the line.
Score: 42-34

[05:16] Team_038 possession (Score: 42-34)
Jabari Carter drives, Devin Haliburton stays with him. Jabari Carter attempts a Layup. Contested by Devin Haliburton (3.7 feet, MAN). JABARI CARTER MAKES IT!
Score: 42-36

[05:00] Team_089 possession (Score: 42-36)
Pascal Durant attempts a Layup. Contested by Magic Dosunmu (5.6 feet, MAN). PASCAL DURANT MAKES IT! Assist: Evan Gasol
Score: 44-36

[04:45] Team_038 possession (Score: 44-36)
Jabari Carter attempts a 3Pt. Wide open! Devin Haliburton is 6.9 feet away. [ZONE] Jabari Carter misses. Offensive rebound by Jabari Carter! Jabari Carter's putback is no good. Offensive rebound by Jabari Carter! Jabari Carter kicks it out.

[04:32] Team_038 possession (Score: 44-36)
Magic Dosunmu attempts a 3Pt. Contested by Pascal Durant (4.8 feet, ZONE). Magic Dosunmu misses. Rebound secured by Devin Haliburton.

[04:19] Team_089 possession (Score: 44-36)
Pascal Durant attempts a 3Pt. Contested by Jalen Hyland (5.0 feet, ZONE). Pascal Durant misses. Rebound secured by Ja Smith.

[04:04] Team_038 possession (Score: 44-36)
Ja Smith attempts a Midrange. Wide open! Evan Gasol is 8.1 feet away. [MAN] JA SMITH MAKES IT! Assist: Jabari Carter
Score: 44-38

[03:48] Team_089 possession (Score: 44-38)
Devin Haliburton attempts a 3Pt. Contested by Jalen Hyland (5.3 feet, ZONE). Devin Haliburton misses. Rebound secured by Ja Smith.

[03:38] Team_038 possession (Score: 44-38)
Jabari Carter attempts a 3Pt. Heavily contested by Pascal Durant (1.8 feet, ZONE)! JABARI CARTER MAKES IT! Assist: Magic Dosunmu
Score: 44-41

[03:22] Team_089 possession (Score: 44-41)
FOUL! Reach-in foul on Ja Smith during the drive. [Team fouls: 4] No free throws, side out. (Ja Smith: 2 personal fouls)

[03:11] Team_089 possession (Score: 44-41)
Devin Haliburton drives and kicks out. Devin Haliburton attempts a 3Pt. Contested by Jabari Carter (4.3 feet, ZONE). DEVIN HALIBURTON MAKES IT! Assist: Tony Parker
Score: 47-41

[02:58] Team_038 possession (Score: 47-41)
Magic Dosunmu makes the Layup and draws the foul on Devin Haliburton! And-1! Magic Dosunmu to the line for 1. [Team fouls: 2] (Devin Haliburton: 1 personal fouls)   FT 1/1: GOOD Magic Dosunmu makes 1/1 from the line.
Score: 47-44

[02:44] Team_089 possession (Score: 47-44)
Pascal Durant attempts a 3Pt. Wide open! Jalen Hyland is 6.2 feet away. [ZONE] PASCAL DURANT MAKES IT! Assist: Evan Gasol
Score: 50-44

[02:26] Team_038 possession (Score: 50-44)
Magic Dosunmu throws a bad pass out of bounds! TURNOVER! (dead ball)

[02:11] Team_089 possession (Score: 50-44)
Devin Haliburton attempts a Layup. BLOCKED BY JALEN HYLAND! Ball deflects out of bounds off Devin Haliburton.

[01:53] Team_038 possession (Score: 50-44)
Jalen Hyland attempts a 3Pt. Contested by Pascal Durant (5.9 feet, ZONE). JALEN HYLAND MAKES IT! Assist: Magic Dosunmu
Score: 50-47

[01:41] Team_089 possession (Score: 50-47)
Pascal Durant attempts a Midrange. Heavily contested by Magic Dosunmu (1.3 feet, MAN)! PASCAL DURANT MAKES IT!
Score: 52-47

[01:28] Team_038 possession (Score: 52-47)
Jabari Carter attempts a 3Pt. Wide open! Devin Haliburton is 7.6 feet away. [MAN] Jabari Carter misses. Rebound secured by Devin Haliburton.

[01:11] Team_089 possession (Score: 52-47)
Joel Barnes attempts a Layup. Heavily contested by Ja Smith (0.5 feet, ZONE)! Joel Barnes misses. Rebound secured by Jabari Carter.

[00:57] Team_038 possession (Score: 52-47)
Jabari Carter drives, picks up Devin Haliburton. Help arrives from Tony Parker! Jabari Carter attempts a Dunk. Wide open! Tony Parker is 7.1 feet away. [MAN] JABARI CARTER MAKES IT! Assist: Ja Smith
Score: 52-49

[00:46] Team_089 possession (Score: 52-49)
Tony Parker throws a bad pass! Stolen by Jalen Hyland! TURNOVER! (live ball)

[00:35] Team_038 possession (Score: 52-49)
Jalen Hyland attempts a 3Pt. Wide open! Tony Parker is 6.1 feet away. [MAN] Jalen Hyland misses. Rebound secured by Devin Haliburton.

[00:20] Team_089 possession (Score: 52-49)
Joel Barnes attempts a 3Pt. Wide open! Jaren Jokic is 7.0 feet away. [MAN] Joel Barnes misses. Rebound secured by Jabari Carter.

[00:08] Team_038 possession (Score: 52-49)
FOUL! Holding foul on Devin Haliburton. [Team fouls: 3] No free throws, side out. (Devin Haliburton: 2 personal fouls)

================================================================================
                              2ND QUARTER COMPLETE                              
================================================================================

2ND QUARTER SCORE: Team_089 30, Team_038 29

BOX SCORE:
================================================================================

Team_089
--------------------------------------------------------------------------------
Player                MIN  PTS  REB  AST  TO      FG   FG%      3P   3P%
--------------------------------------------------------------------------------
Allen Mobley           17    7    0    0   0   2/2   100.0     0/0   0.0
Pascal Durant           7    7    1    0   0   3/4    75.0     0/0   0.0
Tony Parker             9    5    0    1   0   2/2   100.0     0/0   0.0
Jalen Jackson          16    3    3    0   0   1/2    50.0     0/0   0.0
Joel Barnes             9    3    0    0   0   1/3    33.3     0/0   0.0
Devin Haliburton        9    3    3    0   0   1/3    33.3     0/0   0.0
Terry Simmons          16    2    0    1   0   1/2    50.0     0/0   0.0
Rudy Smith             16    0    2    0   0   0/1     0.0     0/0   0.0
Jordan Brogdon         16    0    0    1   0   0/1     0.0     0/0   0.0
Evan Gasol              9    0    0    4   0   0/0     0.0     0/0   0.0

TEAM: FG: 11/20 (55.0%), 3PT: 2/8 (25.0%), REB: 9 (0 off, 9 def), AST: 7, TO: 3
TEAM FOULS: 3


Team_038
--------------------------------------------------------------------------------
Player                MIN  PTS  REB  AST  TO      FG   FG%      3P   3P%
--------------------------------------------------------------------------------
Jabari Carter           9    7    3    1   0   3/4    75.0     0/0   0.0
Magic Dosunmu           9    6    0    3   0   2/3    66.7     0/0   0.0
DeMar Harris           16    3    1    1   0   1/2    50.0     0/0   0.0
Luka Barnes            16    3    3    0   0   1/1   100.0     0/0   0.0
Jalen Hyland            9    3    0    1   0   1/3    33.3     0/0   0.0
Jaren Jokic             9    3    0    0   0   1/1   100.0     0/0   0.0
Rudy Thompson          16    2    0    1   0   1/2    50.0     0/0   0.0
Ja Smith                9    2    2    1   0   1/1   100.0     0/0   0.0
Tracy LaVine           16    0    0    0   0   0/2     0.0     0/0   0.0
Malcolm Poole          16    0    0    1   0   0/1     0.0     0/0   0.0

TEAM: FG: 11/20 (55.0%), 3PT: 5/13 (38.5%), REB: 9 (1 off, 8 def), AST: 9, TO: 2
TEAM FOULS: 4

================================================================================

================================================================================
                       3RD QUARTER - Team_089 vs Team_038                       
================================================================================

[12:00] Team_089 possession (Score: 52-49)
Allen Mobley attempts a Layup. Heavily contested by DeMar Harris (0.5 feet, MAN)! ALLEN MOBLEY MAKES IT! Assist: Terry Simmons
Score: 54-49

[11:46] Team_038 possession (Score: 54-49)
DeMar Harris drives and kicks out. DeMar Harris attempts a Midrange. Contested by Allen Mobley (2.8 feet, MAN). DeMar Harris misses. Rebound secured by Rudy Smith.

[11:32] Team_089 possession (Score: 54-49)
Rudy Smith drives, Tracy LaVine stays with him. Rudy Smith attempts a Dunk. Heavily contested by Tracy LaVine (1.8 feet, MAN)! RUDY SMITH MAKES IT! Assist: Jordan Brogdon
Score: 56-49

[11:14] Team_038 possession (Score: 56-49)
DeMar Harris attempts a 3Pt. Contested by Jordan Brogdon (3.9 feet, ZONE). DEMAR HARRIS MAKES IT! Assist: Rudy Thompson
Score: 56-52

[11:01] Team_089 possession (Score: 56-52)
Terry Simmons drives, Luka Barnes stays with him. Terry Simmons attempts a Layup. Contested by Luka Barnes (3.3 feet, MAN). TERRY SIMMONS MAKES IT! Assist: Rudy Smith
Score: 58-52

[10:47] Team_038 possession (Score: 58-52)
Malcolm Poole attempts a 3Pt. Contested by Jordan Brogdon (4.6 feet, ZONE). Malcolm Poole misses. Rebound secured by Rudy Smith.

[10:28] Team_089 possession (Score: 58-52)
Jalen Jackson drives, Malcolm Poole stays with him. Jalen Jackson attempts a Dunk. Wide open! Malcolm Poole is 6.5 feet away. [MAN] JALEN JACKSON MAKES IT! Assist: Rudy Smith
Score: 60-52

[10:14] Team_038 possession (Score: 60-52)
Malcolm Poole attempts a 3Pt. Contested by Jordan Brogdon (4.0 feet, ZONE). Malcolm Poole misses. Offensive rebound by Tracy LaVine! Tracy LaVine puts it back in!
Score: 60-54

[09:54] Team_089 possession (Score: 60-54)
Jalen Jackson attempts a 3Pt. Contested by Malcolm Poole (5.0 feet, MAN). JALEN JACKSON MAKES IT!
Score: 63-54

[09:39] Team_038 possession (Score: 63-54)
Luka Barnes attempts a Midrange. Contested by Rudy Smith (5.6 feet, ZONE). Luka Barnes misses. Rebound secured by Rudy Smith.

[09:23] Team_089 possession (Score: 63-54)
FOUL! Shooting foul on Tracy LaVine. Rudy Smith to the line for 2 free throws. [Team fouls: 1] (Tracy LaVine: 1 personal fouls)   FT 1/2: GOOD   FT 2/2: GOOD Rudy Smith makes 2/2 from the line.
Score: 65-54

[09:10] Team_038 possession (Score: 65-54)
DeMar Harris attempts a Midrange. Contested by Allen Mobley (5.1 feet, MAN). DeMar Harris misses. Rebound secured by Terry Simmons.

[08:57] Team_089 possession (Score: 65-54)
Terry Simmons drives, picks up Tracy LaVine. Help arrives from Malcolm Poole! Terry Simmons attempts a Dunk. Contested by Malcolm Poole (3.7 feet, ZONE). Terry Simmons misses. Rebound secured by Luka Barnes.

[08:46] Team_038 possession (Score: 65-54)
FOUL! Shooting foul on Jordan Brogdon. Rudy Thompson to the line for 2 free throws. [Team fouls: 1] (Jordan Brogdon: 1 personal fouls)   FT 1/2: GOOD   FT 2/2: MISS Rudy Thompson makes 1/2 from the line. Rebound secured by Rudy Smith.
Score: 65-55

[08:35] Team_089 possession (Score: 65-55)
FOUL! Holding foul on Malcolm Poole. [Team fouls: 2] No free throws, side out. (Malcolm Poole: 1 personal fouls)

[08:23] Team_089 possession (Score: 65-55)
Jordan Brogdon drives, picks up Rudy Thompson. Help arrives from DeMar Harris! Jordan Brogdon attempts a Layup. Heavily contested by DeMar Harris (0.5 feet, MAN)! JORDAN BROGDON MAKES IT! Assist: Rudy Smith
Score: 67-55

[08:05] Team_038 possession (Score: 67-55)
Rudy Thompson attempts a Layup. BLOCKED BY JORDAN BROGDON! Ball is loose! Rebound secured by Jalen Jackson.

[07:48] Team_089 possession (Score: 67-55)
Terry Simmons drives to the basket... Terry Simmons throws a bad pass! Stolen by Tracy LaVine! TURNOVER! (live ball)

[07:32] Team_038 possession (Score: 67-55)
Luka Barnes drives, Terry Simmons stays with him. Luka Barnes attempts a Layup. Heavily contested by Terry Simmons (1.4 feet, ZONE)! LUKA BARNES MAKES IT! Assist: Tracy LaVine
Score: 67-57

[07:20] Team_089 possession (Score: 67-57)
FOUL! Offensive foul on Jordan Brogdon! Rudy Thompson drew the charge! [Team fouls: 2] (Jordan Brogdon: 2 personal fouls) TURNOVER! (dead ball)

[07:04] Team_038 possession (Score: 67-57)
Rudy Thompson attempts a Layup. Contested by Jordan Brogdon (2.0 feet, MAN). Rudy Thompson misses. Offensive rebound by Tracy LaVine! Tracy LaVine puts it back in!
Score: 67-59

[06:55] Team_089 possession (Score: 67-59)
Terry Simmons attempts a 3Pt. Contested by DeMar Harris (5.8 feet, ZONE). TERRY SIMMONS MAKES IT!
Score: 70-59

[06:41] Team_038 possession (Score: 70-59)
Malcolm Poole drives, Jalen Jackson stays with him. Malcolm Poole attempts a Layup. Contested by Jalen Jackson (4.5 feet, MAN). MALCOLM POOLE MAKES IT! Assist: DeMar Harris
Score: 70-61

[06:24] Team_089 possession (Score: 70-61)
Rudy Smith attempts a 3Pt. Wide open! Tracy LaVine is 6.6 feet away. [MAN] RUDY SMITH MAKES IT! Assist: Terry Simmons
Score: 73-61

[06:15] Team_038 possession (Score: 73-61)
Malcolm Poole drives to the basket... Malcolm Poole loses control! Ball rolls out of bounds! TURNOVER! (dead ball)

[05:55] Team_089 possession (Score: 73-61)
FOUL! Reach-in foul on Tracy LaVine during the drive. [Team fouls: 3] No free throws, side out. (Tracy LaVine: 2 personal fouls)

[05:38] Team_089 possession (Score: 73-61)
Jalen Jackson attempts a 3Pt. Contested by Malcolm Poole (5.6 feet, MAN). JALEN JACKSON MAKES IT! Assist: Jordan Brogdon
Score: 76-61

[05:23] Team_038 possession (Score: 76-61)
Malcolm Poole attempts a 3Pt. Contested by Jalen Jackson (2.5 feet, MAN). Malcolm Poole misses. FOUL! Loose ball foul on Terry Simmons during the rebound battle. [Team fouls: 3] No free throws, side out. (Terry Simmons: 1 personal fouls)

[05:12] Team_038 possession (Score: 76-61)
DeMar Harris attempts a 3Pt. Contested by Allen Mobley (4.7 feet, MAN). DeMar Harris misses. Rebound secured by Rudy Smith.

[04:57] Team_089 possession (Score: 76-61)
Jalen Jackson loses control! Ball rolls out of bounds! TURNOVER! (dead ball)

[04:39] Team_038 possession (Score: 76-61)
FOUL! Reach-in foul on Terry Simmons during the drive. [Team fouls: 4] No free throws, side out. (Terry Simmons: 2 personal fouls)

[04:25] Team_038 possession (Score: 76-61)
Tracy LaVine drives and kicks out. DeMar Harris attempts a 3Pt. Contested by Allen Mobley (3.4 feet, MAN). DEMAR HARRIS MAKES IT! Assist: Luka Barnes
Score: 76-64

[04:09] Team_089 possession (Score: 76-64)
Rudy Smith attempts a Midrange. Wide open! Malcolm Poole is 7.8 feet away. [ZONE] RUDY SMITH MAKES IT!
Score: 78-64

[03:55] Team_038 possession (Score: 78-64)
Luka Barnes throws a bad pass! Stolen by Terry Simmons! TURNOVER! (live ball)

[03:41] Team_089 possession (Score: 78-64)
Jalen Jackson attempts a 3Pt. Contested by Malcolm Poole (5.2 feet, MAN). JALEN JACKSON MAKES IT! Assist: Allen Mobley
Score: 81-64

[03:27] Team_038 possession (Score: 81-64)
Tracy LaVine attempts a 3Pt. Contested by Jordan Brogdon (4.8 feet, ZONE). TRACY LAVINE MAKES IT! Assist: DeMar Harris
Score: 81-67

[03:15] Team_089 possession (Score: 81-67)
FOUL! Shooting foul on Tracy LaVine. Jalen Jackson to the line for 2 free throws. [Team fouls: 4] (Tracy LaVine: 3 personal fouls)   FT 1/2: GOOD   FT 2/2: MISS Jalen Jackson makes 1/2 from the line. Rebound secured by Tracy LaVine.
Score: 82-67

[03:02] Team_038 possession (Score: 82-67)
Malcolm Poole attempts a Layup. BLOCKED BY ALLEN MOBLEY! Ball goes out off Allen Mobley. Malcolm Poole's ball!

[02:43] Team_038 possession (Score: 82-67)
Tracy LaVine throws a bad pass out of bounds! TURNOVER! (dead ball)

[02:43] Substitution (Team_038): Tracy LaVine OUT → Jabari Carter IN (stamina_rule2)

[02:26] Team_089 possession (Score: 82-67)
Allen Mobley throws a bad pass! Stolen by DeMar Harris! TURNOVER! (live ball)

[02:12] Team_038 possession (Score: 82-67)
Rudy Thompson attempts a 3Pt. Contested by Jordan Brogdon (3.5 feet, MAN). RUDY THOMPSON MAKES IT! Assist: DeMar Harris
Score: 82-70

[01:58] Team_089 possession (Score: 82-70)
Jalen Jackson attempts a 3Pt. Contested by DeMar Harris (3.9 feet, ZONE). Jalen Jackson misses. Rebound secured by DeMar Harris.

[01:39] Team_038 possession (Score: 82-70)
Luka Barnes attempts a Midrange. Contested by Terry Simmons (5.4 feet, MAN). Luka Barnes misses. Offensive rebound by Jabari Carter! Jabari Carter puts it back in!
Score: 82-72

[01:25] Team_089 possession (Score: 82-72)
Jordan Brogdon attempts a Layup. Heavily contested by Jabari Carter (0.5 feet, ZONE)! JORDAN BROGDON MAKES IT! Assist: Rudy Smith
Score: 84-72

[01:12] Team_038 possession (Score: 84-72)
Rudy Thompson attempts a Midrange. Contested by Jordan Brogdon (4.6 feet, MAN). RUDY THOMPSON MAKES IT! Assist: DeMar Harris
Score: 84-74

[01:02] Team_089 possession (Score: 84-74)
Jalen Jackson attempts a 3Pt. Wide open! Malcolm Poole is 8.3 feet away. [MAN] Jalen Jackson misses. Rebound secured by Jabari Carter.

[00:50] Team_038 possession (Score: 84-74)
Jabari Carter attempts a 3Pt. Wide open! Rudy Smith is 7.0 feet away. [MAN] JABARI CARTER MAKES IT!
Score: 84-77

[00:36] Team_089 possession (Score: 84-77)
Rudy Smith attempts a Midrange. Contested by Jabari Carter (5.0 feet, MAN). Rudy Smith misses. Rebound secured by DeMar Harris.

[00:21] Team_038 possession (Score: 84-77)
Jabari Carter attempts a 3Pt. Wide open! Rudy Smith is 6.3 feet away. [MAN] Jabari Carter misses. Rebound secured by Rudy Smith.

[00:03] Team_089 possession (Score: 84-77)
Terry Simmons drives, picks up Jabari Carter. Help arrives from Malcolm Poole! Terry Simmons attempts a Layup. Contested by Malcolm Poole (4.0 feet, ZONE). Terry Simmons misses. Rebound secured by Jabari Carter.

================================================================================
                              3RD QUARTER COMPLETE                              
================================================================================

3RD QUARTER SCORE: Team_089 32, Team_038 28

BOX SCORE:
================================================================================

Team_089
--------------------------------------------------------------------------------
Player                MIN  PTS  REB  AST  TO      FG   FG%      3P   3P%
--------------------------------------------------------------------------------
Jalen Jackson          28   11    1    0   0   4/7    57.1     0/0   0.0
Rudy Smith             28    9    6    4   0   4/5    80.0     0/0   0.0
Terry Simmons          28    5    1    2   0   2/4    50.0     0/0   0.0
Jordan Brogdon         28    4    0    2   0   2/2   100.0     0/0   0.0
Allen Mobley           29    2    0    1   0   1/1   100.0     0/0   0.0

TEAM: FG: 13/19 (68.4%), 3PT: 5/7 (71.4%), REB: 8 (0 off, 8 def), AST: 9, TO: 4
TEAM FOULS: 4


Team_038
--------------------------------------------------------------------------------
Player                MIN  PTS  REB  AST  TO      FG   FG%      3P   3P%
--------------------------------------------------------------------------------
Tracy LaVine           25    7    4    1   0   3/3   100.0     0/0   0.0
DeMar Harris           28    6    2    4   0   2/5    40.0     0/0   0.0
Rudy Thompson          28    5    0    1   0   2/4    50.0     0/0   0.0
Jabari Carter          11    5    3    0   0   2/3    66.7     0/0   0.0
Malcolm Poole          28    2    0    0   0   1/2    50.0     0/0   0.0
Luka Barnes            28    2    1    1   0   1/2    50.0     0/0   0.0

TEAM: FG: 11/19 (57.9%), 3PT: 5/8 (62.5%), REB: 10 (4 off, 6 def), AST: 7, TO: 3
TEAM FOULS: 4

================================================================================

================================================================================
                       4TH QUARTER - Team_089 vs Team_038                       
================================================================================

[12:00] Team_089 possession (Score: 84-77)
Terry Simmons attempts a Midrange. Contested by Tracy LaVine (4.6 feet, ZONE). Terry Simmons misses. Offensive rebound by Terry Simmons! Terry Simmons puts it back in!
Score: 86-77

[11:42] Team_038 possession (Score: 86-77)
Tracy LaVine loses the ball! Stripped by Rudy Smith! TURNOVER! (live ball)

[11:29] Team_089 possession (Score: 86-77)
Rudy Smith makes the Layup and draws the foul on Tracy LaVine! And-1! Rudy Smith to the line for 1. [Team fouls: 1] (Tracy LaVine: 1 personal fouls)   FT 1/1: MISS Rudy Smith makes 0/1 from the line. Rebound secured by DeMar Harris.
Score: 88-77

[11:17] Team_038 possession (Score: 88-77)
Malcolm Poole attempts a 3Pt. Wide open! Jordan Brogdon is 7.8 feet away. [ZONE] Malcolm Poole misses. Rebound secured by Rudy Smith.

[11:05] Team_089 possession (Score: 88-77)
Rudy Smith attempts a 3Pt. Contested by Tracy LaVine (4.2 feet, MAN). Rudy Smith misses. Rebound secured by Luka Barnes.

[10:52] Team_038 possession (Score: 88-77)
Malcolm Poole drives to the basket... FOUL! Offensive foul on Malcolm Poole! Terry Simmons drew the charge! [Team fouls: 2] (Malcolm Poole: 1 personal fouls) TURNOVER! (dead ball)

[10:38] Team_089 possession (Score: 88-77)
Terry Simmons drives, picks up Tracy LaVine. Help arrives from Malcolm Poole! Terry Simmons attempts a Layup. Contested by Malcolm Poole (4.4 feet, MAN). TERRY SIMMONS MAKES IT! Assist: Jalen Jackson
Score: 90-77

[10:21] Team_038 possession (Score: 90-77)
FOUL! Offensive foul on Rudy Thompson! Jordan Brogdon drew the charge! [Team fouls: 3] (Rudy Thompson: 1 personal fouls) TURNOVER! (dead ball)

[10:10] Team_089 possession (Score: 90-77)
Jordan Brogdon attempts a Midrange. Contested by Rudy Thompson (4.0 feet, MAN). JORDAN BROGDON MAKES IT!
Score: 92-77

[09:57] Team_038 possession (Score: 92-77)
DeMar Harris drives and kicks out. Malcolm Poole attempts a 3Pt. Contested by Allen Mobley (3.3 feet, ZONE). Malcolm Poole misses. Offensive rebound by Luka Barnes! Luka Barnes kicks it out.

[09:42] Team_038 possession (Score: 92-77)
Malcolm Poole drives and kicks out. Luka Barnes attempts a Midrange. Wide open! Terry Simmons is 6.2 feet away. [MAN] Luka Barnes misses. Offensive rebound by Tracy LaVine! Tracy LaVine kicks it out.

[09:27] Team_038 possession (Score: 92-77)
Malcolm Poole attempts a 3Pt. Heavily contested by Jordan Brogdon (0.9 feet, ZONE)! Malcolm Poole misses. Rebound secured by Jalen Jackson.

[09:08] Team_089 possession (Score: 92-77)
FOUL! Offensive foul on Allen Mobley! DeMar Harris drew the charge! [Team fouls: 1] (Allen Mobley: 1 personal fouls) TURNOVER! (dead ball)

[08:52] Team_038 possession (Score: 92-77)
Malcolm Poole attempts a 3Pt. Contested by Jordan Brogdon (5.1 feet, ZONE). MALCOLM POOLE MAKES IT! Assist: Rudy Thompson
Score: 92-80

[08:38] Team_089 possession (Score: 92-80)
Allen Mobley drives, DeMar Harris stays with him. Allen Mobley attempts a Layup. Contested by DeMar Harris (2.8 feet, MAN). Allen Mobley misses. Offensive rebound by Terry Simmons! Terry Simmons kicks it out.

[08:19] Team_089 possession (Score: 92-80)
Jordan Brogdon attempts a Midrange. Wide open! Tracy LaVine is 6.3 feet away. [ZONE] JORDAN BROGDON MAKES IT!
Score: 94-80

[08:06] Team_038 possession (Score: 94-80)
Malcolm Poole attempts a 3Pt. Contested by Jordan Brogdon (2.9 feet, ZONE). Malcolm Poole misses. Rebound secured by Jalen Jackson.

[07:51] Team_089 possession (Score: 94-80)
Jalen Jackson attempts a 3Pt. Wide open! Malcolm Poole is 6.8 feet away. [MAN] Jalen Jackson misses. Offensive rebound by Jalen Jackson! Jalen Jackson kicks it out.

[07:39] Team_089 possession (Score: 94-80)
Allen Mobley attempts a 3Pt. Contested by DeMar Harris (5.3 feet, MAN). ALLEN MOBLEY MAKES IT!
Score: 97-80

[07:28] Team_038 possession (Score: 97-80)
Tracy LaVine drives, Rudy Smith stays with him. Tracy LaVine attempts a Layup. Wide open! Rudy Smith is 8.1 feet away. [ZONE] Tracy LaVine misses. Offensive rebound by Luka Barnes! Luka Barnes kicks it out.

[07:12] Team_038 possession (Score: 97-80)
FOUL! Reach-in foul on Terry Simmons during the drive. [Team fouls: 2] No free throws, side out. (Terry Simmons: 1 personal fouls)

[06:58] Team_038 possession (Score: 97-80)
Luka Barnes drives, Terry Simmons stays with him. Luka Barnes attempts a Dunk. Contested by Terry Simmons (3.5 feet, MAN). Luka Barnes misses. Offensive rebound by Tracy LaVine! Tracy LaVine kicks it out.

[06:42] Team_038 possession (Score: 97-80)
Luka Barnes attempts a Layup. BLOCKED BY TERRY SIMMONS! Ball is loose! Offensive rebound by Luka Barnes! Luka Barnes kicks it out.

[06:28] Team_038 possession (Score: 97-80)
FOUL! Holding foul on Jalen Jackson. [Team fouls: 3] No free throws, side out. (Jalen Jackson: 1 personal fouls)

[06:14] Team_038 possession (Score: 97-80)
Luka Barnes attempts a Midrange. Contested by Terry Simmons (4.8 feet, MAN). Luka Barnes misses. Rebound secured by Jalen Jackson.

[06:00] Team_089 possession (Score: 97-80)
Jalen Jackson attempts a Midrange. Contested by DeMar Harris (4.6 feet, ZONE). Jalen Jackson misses. Rebound secured by DeMar Harris.

[05:41] Team_038 possession (Score: 97-80)
Luka Barnes attempts a Layup. BLOCKED BY TERRY SIMMONS! Ball deflects out of bounds off Luka Barnes.

[05:28] Team_089 possession (Score: 97-80)
Allen Mobley attempts a Midrange. Wide open! Malcolm Poole is 6.7 feet away. [ZONE] ALLEN MOBLEY MAKES IT! Assist: Jalen Jackson
Score: 99-80

[05:13] Team_038 possession (Score: 99-80)
FOUL! Shooting foul on Jordan Brogdon. Rudy Thompson to the line for 2 free throws. [Team fouls: 4] (Jordan Brogdon: 1 personal fouls)   FT 1/2: GOOD   FT 2/2: GOOD Rudy Thompson makes 2/2 from the line.
Score: 99-82

[04:55] Team_089 possession (Score: 99-82)
Terry Simmons drives to the basket... Terry Simmons loses the ball! Stripped by Tracy LaVine! TURNOVER! (live ball)

[04:42] Team_038 possession (Score: 99-82)
Rudy Thompson attempts a 3Pt. Contested by Jordan Brogdon (3.1 feet, ZONE). RUDY THOMPSON MAKES IT! Assist: Tracy LaVine
Score: 99-85

[04:30] Team_089 possession (Score: 99-85)
Jordan Brogdon throws a bad pass out of bounds! TURNOVER! (dead ball)

[04:30] Substitution (Team_089): Jordan Brogdon OUT → Tony Parker IN (stamina_rule2)

[04:30] Substitution (Team_089): Jalen Jackson OUT → Joel Barnes IN (stamina_rule2)

[04:30] Substitution (Team_089): Allen Mobley OUT → Pascal Durant IN (stamina_rule2)

[04:30] Substitution (Team_089): Rudy Smith OUT → Devin Haliburton IN (stamina_rule2)

[04:30] Substitution (Team_089): Terry Simmons OUT → Evan Gasol IN (stamina_rule2)

[04:30] Substitution (Team_038): Rudy Thompson OUT → Jalen Hyland IN (stamina_rule2)

[04:30] Substitution (Team_038): Malcolm Poole OUT → Jaren Jokic IN (stamina_rule2)

[04:30] Substitution (Team_038): DeMar Harris OUT → Magic Dosunmu IN (stamina_rule2)

[04:30] Substitution (Team_038): Tracy LaVine OUT → Jabari Carter IN (stamina_rule2)

[04:30] Substitution (Team_038): Luka Barnes OUT → Ja Smith IN (stamina_rule2)

[04:14] Team_038 possession (Score: 99-85)
Jabari Carter attempts a 3Pt. Contested by Joel Barnes (5.5 feet, ZONE). Jabari Carter misses. FOUL! Loose ball foul on Pascal Durant during the rebound battle. [IN THE BONUS! 5 team fouls] Ja Smith to the line for 2 free throws. (Pascal Durant: 1 personal fouls)   FT 1/2: GOOD   FT 2/2: MISS Ja Smith makes 1/2 from the line. Rebound secured by Evan Gasol.
Score: 99-86

[04:02] Team_089 possession (Score: 99-86)
Pascal Durant attempts a 3Pt. Heavily contested by Magic Dosunmu (1.4 feet, MAN)! Pascal Durant misses. Rebound secured by Ja Smith.

[03:46] Team_038 possession (Score: 99-86)
Jabari Carter attempts a Midrange. Wide open! Devin Haliburton is 8.0 feet away. [MAN] JABARI CARTER MAKES IT! Assist: Jalen Hyland
Score: 99-88

[03:33] Team_089 possession (Score: 99-88)
Devin Haliburton attempts a Midrange. Contested by Jabari Carter (4.3 feet, MAN). DEVIN HALIBURTON MAKES IT! Assist: Tony Parker
Score: 101-88

[03:16] Team_038 possession (Score: 101-88)
Magic Dosunmu drives and kicks out. Jabari Carter attempts a 3Pt. Contested by Pascal Durant (4.5 feet, ZONE). JABARI CARTER MAKES IT! Assist: Magic Dosunmu
Score: 101-91

[03:03] Team_089 possession (Score: 101-91)
Tony Parker attempts a Layup. BLOCKED BY MAGIC DOSUNMU! Ball deflects out of bounds off Tony Parker.

[02:50] Team_038 possession (Score: 101-91)
Jabari Carter commits a violation (traveling/carry)! TURNOVER! (dead ball)

[02:39] Team_089 possession (Score: 101-91)
Evan Gasol attempts a 3Pt. Contested by Jalen Hyland (4.0 feet, ZONE). Evan Gasol misses. Rebound secured by Jalen Hyland.

[02:27] Team_038 possession (Score: 101-91)
Jaren Jokic attempts a 3Pt. Wide open! Joel Barnes is 6.2 feet away. [MAN] JAREN JOKIC MAKES IT! Assist: Magic Dosunmu
Score: 101-94

[02:10] Team_089 possession (Score: 101-94)
FOUL! Holding foul on Jalen Hyland. [Team fouls: 4] No free throws, side out. (Jalen Hyland: 1 personal fouls)

[01:56] Team_089 possession (Score: 101-94)
FOUL! Offensive foul on Tony Parker! Jalen Hyland drew the charge! [Team fouls: 6] (Tony Parker: 1 personal fouls) TURNOVER! (dead ball)

[01:41] Team_038 possession (Score: 101-94)
Jabari Carter drives, picks up Devin Haliburton. Help arrives from Tony Parker! Jabari Carter attempts a Layup. Wide open! Tony Parker is 7.5 feet away. [ZONE] JABARI CARTER MAKES IT! Assist: Ja Smith
Score: 101-96

[01:23] Team_089 possession (Score: 101-96)
Evan Gasol attempts a Layup. Contested by Ja Smith (4.3 feet, MAN). EVAN GASOL MAKES IT!
Score: 103-96

[01:07] Team_038 possession (Score: 103-96)
Jalen Hyland attempts a 3Pt. Contested by Pascal Durant (4.2 feet, ZONE). Jalen Hyland misses. Rebound secured by Devin Haliburton.

[00:56] Team_089 possession (Score: 103-96)
Pascal Durant attempts a 3Pt. Wide open! Jalen Hyland is 6.4 feet away. [ZONE] Pascal Durant misses. Rebound secured by Jalen Hyland.

[00:43] Team_038 possession (Score: 103-96)
Ja Smith drives and kicks out. Jabari Carter attempts a 3Pt. Contested by Devin Haliburton (3.2 feet, MAN). Jabari Carter misses. Rebound secured by Pascal Durant.

[00:29] Team_089 possession (Score: 103-96)
Pascal Durant attempts a 3Pt. Heavily contested by Jalen Hyland (1.5 feet, ZONE)! Pascal Durant misses. Rebound secured by Jabari Carter.

[00:18] Team_038 possession (Score: 103-96)
Jaren Jokic makes the 3Pt and draws the foul on Pascal Durant! And-1! Jaren Jokic to the line for 1. [BONUS: 7 team fouls] (Pascal Durant: 2 personal fouls)   FT 1/1: GOOD Jaren Jokic makes 1/1 from the line.
Score: 103-100

[00:02] Team_089 possession (Score: 103-100)
Evan Gasol drives and kicks out. Tony Parker attempts a 3Pt. Wide open! Jalen Hyland is 7.1 feet away. [ZONE] Tony Parker misses. Rebound secured by Ja Smith.

================================================================================
                              4TH QUARTER COMPLETE                              
================================================================================

4TH QUARTER SCORE: Team_089 19, Team_038 23

BOX SCORE:
================================================================================

Team_089
--------------------------------------------------------------------------------
Player                MIN  PTS  REB  AST  TO      FG   FG%      3P   3P%
--------------------------------------------------------------------------------
Allen Mobley           37    5    0    0   0   2/2   100.0     0/0   0.0
Terry Simmons          35    4    2    0   0   2/2   100.0     0/0   0.0
Jordan Brogdon         35    4    0    0   0   2/2   100.0     0/0   0.0
Evan Gasol             13    2    1    0   0   1/3    33.3     0/0   0.0
Devin Haliburton       13    2    1    0   0   1/1   100.0     0/0   0.0
Rudy Smith             35    0    1    0   0   0/2     0.0     0/0   0.0
Jalen Jackson          35    0    4    2   0   0/1     0.0     0/0   0.0
Pascal Durant          12    0    1    0   0   0/3     0.0     0/0   0.0
Tony Parker            13    0    0    1   0   0/1     0.0     0/0   0.0

TEAM: FG: 8/17 (47.1%), 3PT: 1/6 (16.7%), REB: 9 (3 off, 6 def), AST: 3, TO: 4
TEAM FOULS: 7 [Team_038 in BONUS]


Team_038
--------------------------------------------------------------------------------
Player                MIN  PTS  REB  AST  TO      FG   FG%      3P   3P%
--------------------------------------------------------------------------------
Jabari Carter          16    7    1    0   0   3/4    75.0     0/0   0.0
Jaren Jokic            13    7    0    0   0   2/2   100.0     0/0   0.0
Rudy Thompson          35    5    0    1   0   2/2   100.0     0/0   0.0
Malcolm Poole          35    3    0    0   0   1/4    25.0     0/0   0.0
DeMar Harris           35    0    2    0   0   0/0     0.0     0/0   0.0
Luka Barnes            35    0    4    0   0   0/2     0.0     0/0   0.0
Tracy LaVine           33    0    2    1   0   0/0     0.0     0/0   0.0
Ja Smith               13    0    2    1   0   0/1     0.0     0/0   0.0
Jalen Hyland           13    0    2    1   0   0/1     0.0     0/0   0.0
Magic Dosunmu          13    0    0    2   0   0/0     0.0     0/0   0.0

TEAM: FG: 8/16 (50.0%), 3PT: 4/9 (44.4%), REB: 14 (6 off, 8 def), AST: 6, TO: 4
TEAM FOULS: 4

================================================================================

================================================================================
                               FULL GAME COMPLETE                               
================================================================================

FINAL SCORE: Team_089 103, Team_038 100

SCORING BY QUARTER:
--------------------------------------------------------------------------------
Team                     Q1     Q2     Q3     Q4    FINAL
--------------------------------------------------------------------------------
Team_089                 22     30     32     19      103
Team_038                 20     29     28     23      100
--------------------------------------------------------------------------------

FULL GAME BOX SCORE:
================================================================================

Team_089
--------------------------------------------------------------------------------
Player                MIN  PTS  REB  AST  TO      FG   FG%      3P   3P%      FT STL BLK
--------------------------------------------------------------------------------
Allen Mobley           37   18    0    2   3   6/7    85.7   1/1   100.0   1/1     0   1
Jordan Brogdon         35   19    0    4   3   9/13   69.2   2/5    40.0   1/1     0   1
Jalen Jackson          35   17   12    3   2   5/12   41.7   4/8    50.0   1/2     0   0
Rudy Smith             35    9   12    4   2   4/9    44.4   1/3    33.3   2/3     1   0
Terry Simmons          35   15    9    5   0   8/12   66.7   1/1   100.0   0/0     3   3
Tony Parker            13    5    0    2   2   2/3    66.7   0/0     0.0   1/1     0   0
Joel Barnes            13    3    0    0   1   1/4    25.0   1/3    33.3   0/0     0   0
Devin Haliburton       13    5    4    0   0   2/5    40.0   0/1     0.0   0/0     0   0
Evan Gasol             13    2    1    4   1   1/3    33.3   0/1     0.0   0/0     0   0
Pascal Durant          12    7    2    0   0   3/7    42.9   1/5    20.0   0/0     0   0

TEAM: FG: 41/75 (54.7%), 3PT: 11/28 (39.3%), REB: 39 (6 off, 33 def), AST: 24, TO: 14


Team_038
--------------------------------------------------------------------------------
Player                MIN  PTS  REB  AST  TO      FG   FG%      3P   3P%      FT STL BLK
--------------------------------------------------------------------------------
Rudy Thompson          35   15    0    3   1   7/12   58.3   3/4    75.0   3/4     0   0
Malcolm Poole          35    7    0    2   3   3/10   30.0   2/9    22.2   2/2     0   1
DeMar Harris           35    9   10    5   2   2/9    22.2   2/6    33.3   1/3     1   0
Luka Barnes            35    8   11    2   1   4/9    44.4   0/0     0.0   1/2     0   0
Tracy LaVine           33    9    8    2   2   4/8    50.0   1/2    50.0   0/0     3   0
Jabari Carter          16   19    8    1   1   6/9    66.7   2/5    40.0   1/2     0   0
Jalen Hyland           13    3    2    2   0   1/4    25.0   1/4    25.0   0/0     1   1
Jaren Jokic            13   12    0    0   0   4/4   100.0   3/3   100.0   3/3     0   0
Magic Dosunmu          13    6    0    5   1   4/5    80.0   1/2    50.0   1/1     0   1
Ja Smith               13    7    7    2   0   2/3    66.7   0/0     0.0   1/2     0   0

TEAM: FG: 38/74 (51.4%), 3PT: 15/35 (42.9%), REB: 47 (15 off, 32 def), AST: 24, TO: 11

================================================================================
