================================================================================
                        FULL GAME - Team_065 vs Team_020                        
================================================================================

================================================================================
                       1ST QUARTER - Team_065 vs Team_020                       
================================================================================

[12:00] Team_065 possession (Score: 0-0)
RJ Harden attempts a Midrange. Wide open! Jarrett McCollum is 6.9 feet away. [MAN] RJ Harden misses. Offensive rebound by Manu McGrady! Manu McGrady kicks it out.

[11:46] Team_065 possession (Score: 0-0)
Paul Williamson drives and kicks out. Paul Williamson attempts a 3Pt. Heavily contested by Bam Leonard (0.9 feet, ZONE)! Paul Williamson misses. FOUL! Loose ball foul on Terry Simons during the rebound battle. [Team fouls: 1] No free throws, side out. (Terry Simons: 1 personal fouls)

[11:32] Team_065 possession (Score: 0-0)
RJ Harden attempts a 3Pt. Wide open! Jarrett McCollum is 6.7 feet away. [MAN] RJ HARDEN MAKES IT! Assist: Russell Wade
Score: 3-0

[11:17] Team_020 possession (Score: 3-0)
Terry Simons attempts a 3Pt. Wide open! Manu McGrady is 8.1 feet away. [MAN] TERRY SIMONS MAKES IT! Assist: Bam Leonard
Score: 3-3

[11:06] Team_065 possession (Score: 3-3)
RJ Harden loses control! Ball rolls out of bounds! TURNOVER! (dead ball)

[10:51] Team_020 possession (Score: 3-3)
James Cunningham attempts a 3Pt. Contested by Paul Williamson (2.6 feet, ZONE). James Cunningham misses. Offensive rebound by Trae Curry! Trae Curry puts it back in!
Score: 3-5

[10:35] Team_065 possession (Score: 3-5)
Manu McGrady drives and kicks out. Manu McGrady attempts a Midrange. Contested by James Cunningham (6.0 feet, ZONE). Manu McGrady misses. Offensive rebound by Manu McGrady! Manu McGrady kicks it out.

[10:19] Team_065 possession (Score: 3-5)
RJ Harden attempts a Midrange. Contested by Jarrett McCollum (5.8 feet, MAN). RJ Harden misses. Offensive rebound by Russell Wade! Russell Wade's putback is no good. Offensive rebound by Russell Wade! Russell Wade kicks it out.

[10:05] Team_065 possession (Score: 3-5)
Manu McGrady attempts a Midrange. Wide open! Terry Simons is 6.0 feet away. [MAN] Manu McGrady misses. Rebound secured by Trae Curry.

[09:52] Team_020 possession (Score: 3-5)
Terry Simons attempts a 3Pt. Contested by Manu McGrady (5.7 feet, MAN). Terry Simons misses. Rebound secured by RJ Harden.

[09:39] Team_065 possession (Score: 3-5)
Karl Booker attempts a 3Pt. Contested by Bam Leonard (2.3 feet, ZONE). Karl Booker misses. Offensive rebound by Manu McGrady! Manu McGrady kicks it out.

[09:27] Team_065 possession (Score: 3-5)
Karl Booker attempts a Layup. BLOCKED BY BAM LEONARD! Ball is loose! Rebound secured by Terry Simons.

[09:13] Team_020 possession (Score: 3-5)
Trae Curry drives and kicks out. Trae Curry attempts a 3Pt. Heavily contested by Russell Wade (2.0 feet, MAN)! Trae Curry misses. Rebound secured by Russell Wade.

[08:58] Team_065 possession (Score: 3-5)
Paul Williamson attempts a 3Pt. Heavily contested by Bam Leonard (0.5 feet, ZONE)! Paul Williamson misses. Rebound secured by Trae Curry.

[08:40] Team_020 possession (Score: 3-5)
Terry Simons attempts a Midrange. Contested by Manu McGrady (5.0 feet, MAN). TERRY SIMONS MAKES IT! Assist: James Cunningham
Score: 3-7

[08:28] Team_065 possession (Score: 3-7)
FOUL! Shooting foul on Terry Simons. Manu McGrady to the line for 2 free throws. [Team fouls: 2] (Terry Simons: 2 personal fouls)   FT 1/2: GOOD   FT 2/2: GOOD Manu McGrady makes 2/2 from the line.
Score: 5-7

[08:13] Team_020 possession (Score: 5-7)
Bam Leonard attempts a Layup. Heavily contested by Russell Wade (1.6 feet, ZONE)! BAM LEONARD MAKES IT! Assist: Terry Simons
Score: 5-9

[08:00] Team_065 possession (Score: 5-9)
FOUL! Reach-in foul on Jarrett McCollum during the drive. [Team fouls: 3] No free throws, side out. (Jarrett McCollum: 1 personal fouls)

[07:44] Team_065 possession (Score: 5-9)
Paul Williamson attempts a Layup. Contested by James Cunningham (3.1 feet, MAN). PAUL WILLIAMSON MAKES IT! Assist: Manu McGrady
Score: 7-9

[07:34] Team_020 possession (Score: 7-9)
Trae Curry attempts a Midrange. Wide open! Manu McGrady is 7.2 feet away. [ZONE] TRAE CURRY MAKES IT! Assist: Bam Leonard
Score: 7-11

[07:20] Team_065 possession (Score: 7-11)
Karl Booker drives and kicks out. Russell Wade attempts a 3Pt. Wide open! Bam Leonard is 6.2 feet away. [ZONE] Russell Wade misses. Rebound secured by Bam Leonard.

[07:08] Team_020 possession (Score: 7-11)
Trae Curry drives and kicks out. Terry Simons attempts a 3Pt. Wide open! Manu McGrady is 7.7 feet away. [MAN] Terry Simons misses. Offensive rebound by Bam Leonard! Bam Leonard's putback is no good. Rebound secured by RJ Harden.

[06:49] Team_065 possession (Score: 7-11)
Paul Williamson attempts a 3Pt. Contested by James Cunningham (2.9 feet, MAN). Paul Williamson misses. Rebound secured by Terry Simons.

[06:37] Team_020 possession (Score: 7-11)
Terry Simons attempts a 3Pt. Wide open! Manu McGrady is 9.7 feet away. [MAN] Terry Simons misses. Rebound secured by Manu McGrady.

[06:22] Team_065 possession (Score: 7-11)
Russell Wade attempts a 3Pt. Contested by Bam Leonard (3.4 feet, ZONE). Russell Wade misses. Rebound secured by Trae Curry.

[06:05] Team_020 possession (Score: 7-11)
Trae Curry drives, Russell Wade stays with him. Trae Curry attempts a Dunk. Heavily contested by Russell Wade (1.5 feet, MAN)! TRAE CURRY MAKES IT!
Score: 7-13

[05:48] Team_065 possession (Score: 7-13)
Manu McGrady attempts a Layup. BLOCKED BY TRAE CURRY! Ball is loose! Rebound secured by Trae Curry.

[05:34] Team_020 possession (Score: 7-13)
Terry Simons attempts a Layup. BLOCKED BY RUSSELL WADE! Ball is loose! Rebound secured by RJ Harden.

[05:14] Team_065 possession (Score: 7-13)
RJ Harden attempts a 3Pt. Heavily contested by James Cunningham (0.7 feet, ZONE)! RJ Harden misses. Rebound secured by Terry Simons.

[04:55] Team_020 possession (Score: 7-13)
Terry Simons drives to the basket... Terry Simons commits a violation (traveling/carry)! TURNOVER! (dead ball)

[04:39] Team_065 possession (Score: 7-13)
FOUL! Reach-in foul on Bam Leonard during the drive. [Team fouls: 4] No free throws, side out. (Bam Leonard: 1 personal fouls)

[04:21] Team_065 possession (Score: 7-13)
Karl Booker attempts a Midrange. Contested by Bam Leonard (5.1 feet, MAN). Karl Booker misses. Rebound secured by Trae Curry.

[04:06] Team_020 possession (Score: 7-13)
Bam Leonard drives, picks up Russell Wade. Help arrives from Paul Williamson! Bam Leonard attempts a Layup. Heavily contested by Paul Williamson (0.8 feet, MAN)! Bam Leonard misses. Rebound secured by Manu McGrady.

[03:47] Team_065 possession (Score: 7-13)
FOUL! Holding foul on Bam Leonard. [IN THE BONUS! 5 team fouls] Russell Wade to the line for 2 free throws. (Bam Leonard: 2 personal fouls)   FT 1/2: MISS   FT 2/2: GOOD Russell Wade makes 1/2 from the line.
Score: 8-13

[03:36] Team_020 possession (Score: 8-13)
Terry Simons throws a bad pass! Stolen by Manu McGrady! TURNOVER! (live ball)

[03:20] Team_065 possession (Score: 8-13)
Manu McGrady attempts a 3Pt. Contested by Terry Simons (3.4 feet, MAN). Manu McGrady misses. Rebound secured by Terry Simons.

[03:05] Team_020 possession (Score: 8-13)
James Cunningham attempts a Layup. BLOCKED BY RUSSELL WADE! Ball is loose! Rebound secured by RJ Harden.

[02:52] Team_065 possession (Score: 8-13)
FOUL! Offensive foul on Paul Williamson! James Cunningham drew the charge! [Team fouls: 1] (Paul Williamson: 1 personal fouls) TURNOVER! (dead ball)

[02:33] Team_020 possession (Score: 8-13)
James Cunningham attempts a Layup. BLOCKED BY RUSSELL WADE! Ball goes out off Russell Wade. James Cunningham's ball!

[02:17] Team_020 possession (Score: 8-13)
Trae Curry attempts a 3Pt. Contested by RJ Harden (5.0 feet, ZONE). Trae Curry misses. Rebound secured by RJ Harden.

[02:01] Team_065 possession (Score: 8-13)
RJ Harden drives and kicks out. Russell Wade attempts a Midrange. Contested by Terry Simons (4.7 feet, ZONE). Russell Wade misses. Rebound secured by Bam Leonard.

[01:48] Team_020 possession (Score: 8-13)
Bam Leonard attempts a 3Pt. Contested by RJ Harden (2.6 feet, ZONE). Bam Leonard misses. Rebound secured by Russell Wade.

[01:35] Team_065 possession (Score: 8-13)
RJ Harden attempts a 3Pt. Contested by Bam Leonard (3.0 feet, ZONE). RJ Harden misses. Rebound secured by Terry Simons.

[01:17] Team_020 possession (Score: 8-13)
Terry Simons attempts a Midrange. Wide open! Manu McGrady is 6.5 feet away. [ZONE] Terry Simons misses. Rebound secured by Russell Wade.

[01:05] Team_065 possession (Score: 8-13)
Paul Williamson attempts a 3Pt. Wide open! James Cunningham is 7.0 feet away. [MAN] Paul Williamson misses. Rebound secured by Bam Leonard.

[00:47] Team_020 possession (Score: 8-13)
FOUL! Reach-in foul on RJ Harden during the drive. [Team fouls: 2] No free throws, side out. (RJ Harden: 1 personal fouls)

[00:30] Team_020 possession (Score: 8-13)
Trae Curry drives, picks up Russell Wade. Help arrives from Paul Williamson! Trae Curry attempts a Dunk. Heavily contested by Paul Williamson (1.4 feet, ZONE)! TRAE CURRY MAKES IT! Assist: Jarrett McCollum
Score: 8-15

[00:14] Team_065 possession (Score: 8-15)
Manu McGrady attempts a 3Pt. Wide open! Bam Leonard is 6.3 feet away. [ZONE] MANU MCGRADY MAKES IT! Assist: RJ Harden
Score: 11-15

================================================================================
                              1ST QUARTER COMPLETE                              
================================================================================

1ST QUARTER SCORE: Team_065 11, Team_020 15

BOX SCORE:
================================================================================

Team_065
--------------------------------------------------------------------------------
Player                MIN  PTS  REB  AST  TO      FG   FG%      3P   3P%
--------------------------------------------------------------------------------
Manu McGrady           12    5    5    1   0   2/5    40.0     0/0   0.0
RJ Harden              12    3    5    1   0   1/4    25.0     0/0   0.0
Paul Williamson        12    2    0    0   0   1/4    25.0     0/0   0.0
Russell Wade           12    1    5    1   0   1/2    50.0     0/0   0.0
Karl Booker            12    0    0    0   0   0/3     0.0     0/0   0.0

TEAM: FG: 5/18 (27.8%), 3PT: 2/9 (22.2%), REB: 14 (5 off, 9 def), AST: 3, TO: 2
TEAM FOULS: 2


Team_020
--------------------------------------------------------------------------------
Player                MIN  PTS  REB  AST  TO      FG   FG%      3P   3P%
--------------------------------------------------------------------------------
Trae Curry             12    8    6    0   0   4/7    57.1     0/0   0.0
Terry Simons           12    5    5    1   0   2/6    33.3     0/0   0.0
Bam Leonard            12    2    3    2   0   1/3    33.3     0/0   0.0
James Cunningham       12    0    0    1   0   0/1     0.0     0/0   0.0
Jarrett McCollum       12    0    0    1   0   0/0     0.0     0/0   0.0

TEAM: FG: 7/17 (41.2%), 3PT: 2/6 (33.3%), REB: 15 (2 off, 13 def), AST: 5, TO: 2
TEAM FOULS: 5 [Team_065 in BONUS]

================================================================================

================================================================================
                       2ND QUARTER - Team_065 vs Team_020                       
================================================================================

[12:00] Team_065 possession (Score: 11-15)
FOUL! Reach-in foul on Bam Leonard during the drive. [Team fouls: 1] No free throws, side out. (Bam Leonard: 1 personal fouls)

[11:47] Team_065 possession (Score: 11-15)
RJ Harden attempts a Layup. Heavily contested by Bam Leonard (1.6 feet, ZONE)! RJ Harden misses. Rebound secured by Trae Curry.

[11:32] Team_020 possession (Score: 11-15)
Trae Curry attempts a Layup. Contested by Russell Wade (3.6 feet, MAN). TRAE CURRY MAKES IT! Assist: Terry Simons
Score: 11-17

[11:16] Team_065 possession (Score: 11-17)
FOUL! Shooting foul on Terry Simons. Karl Booker to the line for 2 free throws. [Team fouls: 2] (Terry Simons: 1 personal fouls)   FT 1/2: GOOD   FT 2/2: MISS Karl Booker makes 1/2 from the line. Rebound secured by Bam Leonard.
Score: 12-17

[10:58] Team_020 possession (Score: 12-17)
FOUL! Offensive foul on Bam Leonard! Russell Wade drew the charge! [Team fouls: 3] (Bam Leonard: 2 personal fouls) TURNOVER! (dead ball)

[10:42] Team_065 possession (Score: 12-17)
Russell Wade drives to the basket... Russell Wade loses the ball! Stripped by Trae Curry! TURNOVER! (live ball)

[10:25] Team_020 possession (Score: 12-17)
FOUL! Reach-in foul on Russell Wade during the drive. [Team fouls: 1] No free throws, side out. (Russell Wade: 1 personal fouls)

[10:12] Team_020 possession (Score: 12-17)
James Cunningham attempts a 3Pt. Contested by RJ Harden (3.2 feet, ZONE). James Cunningham misses. Offensive rebound by Trae Curry! Trae Curry's putback is no good. Rebound secured by Russell Wade.

[09:58] Team_065 possession (Score: 12-17)
Russell Wade drives and kicks out. Manu McGrady attempts a Midrange. Contested by Terry Simons (3.5 feet, MAN). MANU MCGRADY MAKES IT! Assist: RJ Harden
Score: 14-17

[09:44] Team_020 possession (Score: 14-17)
James Cunningham attempts a Midrange. Contested by Manu McGrady (5.4 feet, ZONE). JAMES CUNNINGHAM MAKES IT! Assist: Bam Leonard
Score: 14-19

[09:34] Team_065 possession (Score: 14-19)
Russell Wade attempts a 3Pt. Heavily contested by Bam Leonard (1.4 feet, MAN)! Russell Wade misses. Rebound secured by Bam Leonard.

[09:21] Team_020 possession (Score: 14-19)
Bam Leonard attempts a 3Pt. Contested by Russell Wade (4.1 feet, MAN). Bam Leonard misses. Rebound secured by Manu McGrady.

[09:06] Team_065 possession (Score: 14-19)
Karl Booker drives to the basket... Karl Booker throws a bad pass! Stolen by Bam Leonard! TURNOVER! (live ball)

[08:51] Team_020 possession (Score: 14-19)
Trae Curry drives and kicks out. Bam Leonard attempts a 3Pt. Contested by Russell Wade (4.3 feet, MAN). Bam Leonard misses. Offensive rebound by Bam Leonard! Bam Leonard puts it back in!
Score: 14-21

[08:37] Team_065 possession (Score: 14-21)
RJ Harden attempts a 3Pt. Contested by Bam Leonard (3.8 feet, ZONE). RJ HARDEN MAKES IT! Assist: Karl Booker
Score: 17-21

[08:25] Team_020 possession (Score: 17-21)
Trae Curry attempts a Midrange. Contested by Russell Wade (3.8 feet, ZONE). TRAE CURRY MAKES IT! Assist: Terry Simons
Score: 17-23

[08:07] Team_065 possession (Score: 17-23)
FOUL! Reach-in foul on Trae Curry during the drive. [Team fouls: 4] No free throws, side out. (Trae Curry: 1 personal fouls)

[07:52] Team_065 possession (Score: 17-23)
RJ Harden attempts a 3Pt. Contested by Jarrett McCollum (2.9 feet, MAN). RJ Harden misses. Offensive rebound by Russell Wade! Russell Wade puts it back in!
Score: 19-23

[07:38] Team_020 possession (Score: 19-23)
Jarrett McCollum attempts a 3Pt. Contested by RJ Harden (4.2 feet, MAN). Jarrett McCollum misses. Rebound secured by Manu McGrady.

[07:28] Team_065 possession (Score: 19-23)
Russell Wade attempts a Layup. Contested by Bam Leonard (3.1 feet, MAN). Russell Wade misses. Rebound secured by Bam Leonard.

[07:09] Team_020 possession (Score: 19-23)
Trae Curry attempts a Midrange. BLOCKED BY RUSSELL WADE! Ball is loose! Offensive rebound by Trae Curry! Trae Curry kicks it out.

[06:57] Team_020 possession (Score: 19-23)
James Cunningham attempts a Midrange. Contested by Paul Williamson (3.1 feet, MAN). James Cunningham misses. Rebound secured by Manu McGrady.

[06:38] Team_065 possession (Score: 19-23)
Russell Wade attempts a Midrange. Wide open! James Cunningham is 7.4 feet away. [ZONE] Russell Wade misses. Rebound secured by Bam Leonard.

[06:20] Team_020 possession (Score: 19-23)
Jarrett McCollum drives and kicks out. Bam Leonard attempts a Midrange. Wide open! Russell Wade is 6.3 feet away. [MAN] BAM LEONARD MAKES IT!
Score: 19-25

[06:07] Team_065 possession (Score: 19-25)
Paul Williamson drives, James Cunningham stays with him. Paul Williamson attempts a Dunk. Contested by James Cunningham (2.8 feet, MAN). PAUL WILLIAMSON MAKES IT!
Score: 21-25

[05:52] Team_020 possession (Score: 21-25)
Jarrett McCollum drives to the basket... Jarrett McCollum loses control! Ball rolls out of bounds! TURNOVER! (dead ball)

[05:52] Substitution (Team_065): RJ Harden OUT → Paul Curry IN (stamina_rule2)

[05:52] Substitution (Team_065): Paul Williamson OUT → Derrick Poole IN (stamina_rule2)

[05:52] Substitution (Team_065): Manu McGrady OUT → D'Angelo Porzingis IN (stamina_rule2)

[05:52] Substitution (Team_065): Russell Wade OUT → Karl Leonard IN (stamina_rule2)

[05:52] Substitution (Team_065): Karl Booker OUT → Vince Mobley IN (stamina_rule2)

[05:52] Substitution (Team_020): Jarrett McCollum OUT → Franz Doncic IN (stamina_rule2)

[05:52] Substitution (Team_020): James Cunningham OUT → Stephen Parker IN (stamina_rule2)

[05:52] Substitution (Team_020): Terry Simons OUT → Victor Holiday IN (stamina_rule2)

[05:52] Substitution (Team_020): Bam Leonard OUT → Cole Barnes IN (stamina_rule2)

[05:52] Substitution (Team_020): Trae Curry OUT → Miles Siakam IN (stamina_rule2)

[05:43] Team_065 possession (Score: 21-25)
D'Angelo Porzingis drives and kicks out. Derrick Poole attempts a Midrange. Contested by Stephen Parker (5.3 feet, MAN). DERRICK POOLE MAKES IT! Assist: Karl Leonard
Score: 23-25

[05:26] Team_020 possession (Score: 23-25)
Miles Siakam drives, picks up Vince Mobley. Help arrives from Derrick Poole! Miles Siakam attempts a Layup. Contested by Derrick Poole (3.9 feet, MAN). MILES SIAKAM MAKES IT!
Score: 23-27

[05:10] Team_065 possession (Score: 23-27)
Karl Leonard drives and kicks out. D'Angelo Porzingis attempts a 3Pt. Contested by Victor Holiday (3.9 feet, MAN). D'ANGELO PORZINGIS MAKES IT! Assist: Vince Mobley
Score: 26-27

[04:55] Team_020 possession (Score: 26-27)
Stephen Parker attempts a 3Pt. Contested by Paul Curry (4.4 feet, ZONE). STEPHEN PARKER MAKES IT! Assist: Victor Holiday
Score: 26-30

[04:42] Team_065 possession (Score: 26-30)
FOUL! Shooting foul on Stephen Parker. Derrick Poole to the line for 2 free throws. [BONUS: 5 team fouls] (Stephen Parker: 1 personal fouls)   FT 1/2: MISS   FT 2/2: GOOD Derrick Poole makes 1/2 from the line.
Score: 27-30

[04:27] Team_020 possession (Score: 27-30)
Victor Holiday attempts a 3Pt. Contested by Paul Curry (3.6 feet, ZONE). VICTOR HOLIDAY MAKES IT! Assist: Cole Barnes
Score: 27-33

[04:12] Team_065 possession (Score: 27-33)
Derrick Poole attempts a 3Pt. Wide open! Stephen Parker is 7.0 feet away. [ZONE] Derrick Poole misses. Rebound secured by Miles Siakam.

[03:56] Team_020 possession (Score: 27-33)
Victor Holiday attempts a 3Pt. Contested by D'Angelo Porzingis (4.3 feet, MAN). Victor Holiday misses. FOUL! Loose ball foul on Vince Mobley during the rebound battle. [Team fouls: 2] No free throws, side out. (Vince Mobley: 1 personal fouls)

[03:41] Team_020 possession (Score: 27-33)
Miles Siakam attempts a Midrange. Contested by D'Angelo Porzingis (4.4 feet, ZONE). Miles Siakam misses. Rebound secured by Vince Mobley.

[03:25] Team_065 possession (Score: 27-33)
Paul Curry attempts a 3Pt. Contested by Franz Doncic (2.8 feet, MAN). PAUL CURRY MAKES IT! Assist: D'Angelo Porzingis
Score: 30-33

[03:12] Team_020 possession (Score: 30-33)
Miles Siakam attempts a 3Pt. Contested by Paul Curry (5.8 feet, ZONE). MILES SIAKAM MAKES IT!
Score: 30-36

[02:54] Team_065 possession (Score: 30-36)
D'Angelo Porzingis drives, picks up Victor Holiday. Help arrives from Franz Doncic! D'Angelo Porzingis attempts a Layup. Wide open! Franz Doncic is 6.9 feet away. [MAN] D'Angelo Porzingis misses. Rebound secured by Miles Siakam.

[02:40] Team_020 possession (Score: 30-36)
FOUL! Offensive foul on Cole Barnes! Karl Leonard drew the charge! [Team fouls: 6] (Cole Barnes: 1 personal fouls) TURNOVER! (dead ball)

[02:24] Team_065 possession (Score: 30-36)
Derrick Poole drives, picks up Miles Siakam. Help arrives from Franz Doncic! Derrick Poole attempts a Dunk. Heavily contested by Franz Doncic (1.0 feet, ZONE)! DERRICK POOLE MAKES IT! Assist: Vince Mobley
Score: 32-36

[02:10] Team_020 possession (Score: 32-36)
Miles Siakam attempts a Midrange. Wide open! Vince Mobley is 6.1 feet away. [MAN] Miles Siakam misses. Offensive rebound by Cole Barnes! Cole Barnes kicks it out.

[01:55] Team_020 possession (Score: 32-36)
Miles Siakam attempts a Midrange. Contested by Derrick Poole (5.1 feet, ZONE). MILES SIAKAM MAKES IT! Assist: Stephen Parker
Score: 32-38

[01:40] Team_065 possession (Score: 32-38)
Vince Mobley drives, Miles Siakam stays with him. Vince Mobley attempts a Layup. Heavily contested by Miles Siakam (1.4 feet, MAN)! VINCE MOBLEY MAKES IT!
Score: 34-38

[01:22] Team_020 possession (Score: 34-38)
Victor Holiday attempts a Layup. Heavily contested by D'Angelo Porzingis (0.8 feet, MAN)! VICTOR HOLIDAY MAKES IT! Assist: Stephen Parker
Score: 34-40

[01:04] Team_065 possession (Score: 34-40)
Paul Curry attempts a Midrange. Contested by Victor Holiday (3.7 feet, ZONE). PAUL CURRY MAKES IT!
Score: 36-40

[00:48] Team_020 possession (Score: 36-40)
Victor Holiday attempts a 3Pt. BLOCKED BY D'ANGELO PORZINGIS! Ball is loose! Rebound secured by Vince Mobley.

[00:35] Team_065 possession (Score: 36-40)
Derrick Poole drives and kicks out. Vince Mobley attempts a Midrange. Wide open! Miles Siakam is 6.2 feet away. [MAN] Vince Mobley misses. Rebound secured by Victor Holiday.

[00:21] Team_020 possession (Score: 36-40)
FOUL! Shooting foul on Vince Mobley. Miles Siakam to the line for 2 free throws. [Team fouls: 3] (Vince Mobley: 2 personal fouls)   FT 1/2: GOOD   FT 2/2: GOOD Miles Siakam makes 2/2 from the line.
Score: 36-42

[00:09] Team_065 possession (Score: 36-42)
Vince Mobley attempts a Layup. Contested by Miles Siakam (3.4 feet, MAN). VINCE MOBLEY MAKES IT! Assist: Paul Curry
Score: 38-42

================================================================================
                              2ND QUARTER COMPLETE                              
================================================================================

2ND QUARTER SCORE: Team_065 27, Team_020 27

BOX SCORE:
================================================================================

Team_065
--------------------------------------------------------------------------------
Player                MIN  PTS  REB  AST  TO      FG   FG%      3P   3P%
--------------------------------------------------------------------------------
Derrick Poole           6    5    0    0   0   3/5    60.0     0/0   0.0
Paul Curry              6    5    0    1   0   2/2   100.0     0/0   0.0
Vince Mobley            6    4    2    2   0   2/2   100.0     0/0   0.0
RJ Harden              18    3    0    1   0   1/2    50.0     0/0   0.0
D'Angelo Porzingis      6    3    0    1   0   1/2    50.0     0/0   0.0
Russell Wade           18    2    2    0   0   1/4    25.0     0/0   0.0
Manu McGrady           18    2    3    0   0   1/1   100.0     0/0   0.0
Paul Williamson        18    2    0    0   0   1/1   100.0     0/0   0.0
Karl Booker            18    0    0    1   0   0/1     0.0     0/0   0.0
Karl Leonard            6    0    0    1   0   0/0     0.0     0/0   0.0

TEAM: FG: 12/20 (60.0%), 3PT: 3/5 (60.0%), REB: 6 (1 off, 5 def), AST: 7, TO: 2
TEAM FOULS: 3


Team_020
--------------------------------------------------------------------------------
Player                MIN  PTS  REB  AST  TO      FG   FG%      3P   3P%
--------------------------------------------------------------------------------
Miles Siakam            6    9    3    0   0   4/5    80.0     0/0   0.0
Victor Holiday          6    5    1    1   0   2/3    66.7     0/0   0.0
Trae Curry             18    4    2    0   0   2/2   100.0     0/0   0.0
Bam Leonard            18    4    5    1   0   2/3    66.7     0/0   0.0
Stephen Parker          6    3    0    2   0   1/1   100.0     0/0   0.0
James Cunningham       18    2    0    0   0   1/3    33.3     0/0   0.0
Terry Simons           18    0    0    2   0   0/0     0.0     0/0   0.0
Jarrett McCollum       18    0    0    0   0   0/1     0.0     0/0   0.0
Cole Barnes             6    0    1    1   0   0/0     0.0     0/0   0.0

TEAM: FG: 12/18 (66.7%), 3PT: 3/7 (42.9%), REB: 13 (5 off, 8 def), AST: 7, TO: 3
TEAM FOULS: 6 [Team_065 in BONUS]

================================================================================

================================================================================
                       3RD QUARTER - Team_065 vs Team_020                       
================================================================================

[12:00] Team_065 possession (Score: 38-42)
Karl Booker attempts a Layup. BLOCKED BY TRAE CURRY! Ball deflects out of bounds off Karl Booker.

[11:45] Team_020 possession (Score: 38-42)
Terry Simons attempts a Layup. Contested by Manu McGrady (4.1 feet, MAN). TERRY SIMONS MAKES IT!
Score: 38-44

[11:28] Team_065 possession (Score: 38-44)
Russell Wade drives, Bam Leonard stays with him. Russell Wade attempts a Layup. Contested by Bam Leonard (2.2 feet, MAN). Russell Wade misses. Rebound secured by Bam Leonard.

[11:13] Team_020 possession (Score: 38-44)
Bam Leonard attempts a 3Pt. Contested by RJ Harden (5.4 feet, ZONE). Bam Leonard misses. Offensive rebound by Trae Curry! Trae Curry puts it back in!
Score: 38-46

[10:54] Team_065 possession (Score: 38-46)
Karl Booker attempts a 3Pt. Heavily contested by Bam Leonard (1.7 feet, ZONE)! Karl Booker misses. Rebound secured by Terry Simons.

[10:36] Team_020 possession (Score: 38-46)
Trae Curry drives and kicks out. Terry Simons attempts a Midrange. Wide open! Manu McGrady is 6.6 feet away. [MAN] Terry Simons misses. Rebound secured by Manu McGrady.

[10:22] Team_065 possession (Score: 38-46)
FOUL! Offensive foul on Manu McGrady! Terry Simons drew the charge! [Team fouls: 1] (Manu McGrady: 1 personal fouls) TURNOVER! (dead ball)

[10:07] Team_020 possession (Score: 38-46)
James Cunningham attempts a 3Pt. Contested by Paul Williamson (4.5 feet, MAN). James Cunningham misses. Offensive rebound by Bam Leonard! Bam Leonard's putback is no good. Rebound secured by Russell Wade.

[09:53] Team_065 possession (Score: 38-46)
Paul Williamson drives to the basket... Paul Williamson throws a bad pass! Stolen by Trae Curry! TURNOVER! (live ball)

[09:39] Team_020 possession (Score: 38-46)
Terry Simons attempts a Midrange. Contested by Russell Wade (3.1 feet, ZONE). Terry Simons misses. Rebound secured by Russell Wade.

[09:24] Team_065 possession (Score: 38-46)
Russell Wade drives to the basket... Russell Wade loses the ball! Stripped by Trae Curry! TURNOVER! (live ball)

[09:07] Team_020 possession (Score: 38-46)
FOUL! Offensive foul on Trae Curry! Russell Wade drew the charge! [Team fouls: 1] (Trae Curry: 1 personal fouls) TURNOVER! (dead ball)

[08:58] Team_065 possession (Score: 38-46)
RJ Harden attempts a Layup. BLOCKED BY JARRETT MCCOLLUM! Ball is loose! Offensive rebound by Russell Wade! Russell Wade kicks it out.

[08:45] Team_065 possession (Score: 38-46)
Karl Booker makes the Layup and draws the foul on Trae Curry! And-1! Karl Booker to the line for 1. [Team fouls: 2] (Trae Curry: 2 personal fouls)   FT 1/1: GOOD Karl Booker makes 1/1 from the line.
Score: 41-46

[08:34] Team_020 possession (Score: 41-46)
Trae Curry attempts a Layup. Contested by Russell Wade (5.8 feet, ZONE). TRAE CURRY MAKES IT! Assist: Jarrett McCollum
Score: 41-48

[08:20] Team_065 possession (Score: 41-48)
Karl Booker attempts a Layup. BLOCKED BY BAM LEONARD! Ball deflects out of bounds off Karl Booker.

[08:10] Team_020 possession (Score: 41-48)
James Cunningham attempts a 3Pt. Heavily contested by Paul Williamson (1.2 feet, MAN)! JAMES CUNNINGHAM MAKES IT! Assist: Bam Leonard
Score: 41-51

[07:59] Team_065 possession (Score: 41-51)
FOUL! Holding foul on Bam Leonard. [Team fouls: 3] No free throws, side out. (Bam Leonard: 1 personal fouls)

[07:48] Team_065 possession (Score: 41-51)
Manu McGrady drives, Trae Curry stays with him. Manu McGrady attempts a Dunk. Contested by Trae Curry (3.7 feet, ZONE). Manu McGrady misses. Rebound secured by Terry Simons.

[07:36] Team_020 possession (Score: 41-51)
James Cunningham attempts a Layup. BLOCKED BY PAUL WILLIAMSON! Ball is loose! Rebound secured by Russell Wade.

[07:17] Team_065 possession (Score: 41-51)
RJ Harden attempts a Layup. Contested by Jarrett McCollum (5.7 feet, MAN). RJ HARDEN MAKES IT!
Score: 43-51

[07:03] Team_020 possession (Score: 43-51)
James Cunningham drives to the basket... James Cunningham throws a bad pass! Stolen by Paul Williamson! TURNOVER! (live ball)

[06:51] Team_065 possession (Score: 43-51)
Russell Wade attempts a Midrange. Contested by Bam Leonard (5.0 feet, ZONE). Russell Wade misses. Rebound secured by Trae Curry.

[06:35] Team_020 possession (Score: 43-51)
Trae Curry drives and kicks out. Bam Leonard attempts a 3Pt. Contested by RJ Harden (4.4 feet, ZONE). Bam Leonard misses. Rebound secured by RJ Harden.

[06:18] Team_065 possession (Score: 43-51)
Manu McGrady attempts a Layup. Contested by Terry Simons (4.2 feet, MAN). Manu McGrady misses. Rebound secured by Trae Curry.

[06:01] Team_020 possession (Score: 43-51)
FOUL! Reach-in foul on RJ Harden during the drive. [Team fouls: 2] No free throws, side out. (RJ Harden: 1 personal fouls)

[05:51] Team_020 possession (Score: 43-51)
Jarrett McCollum drives and kicks out. Terry Simons attempts a 3Pt. Wide open! RJ Harden is 7.5 feet away. [ZONE] TERRY SIMONS MAKES IT! Assist: Bam Leonard
Score: 43-54

[05:40] Team_065 possession (Score: 43-54)
Russell Wade drives and kicks out. FOUL! Shooting foul on Bam Leonard. Russell Wade to the line for 3 free throws. [Team fouls: 4] (Bam Leonard: 2 personal fouls)   FT 1/3: MISS   FT 2/3: GOOD   FT 3/3: GOOD Russell Wade makes 2/3 from the line.
Score: 45-54

[05:30] Team_020 possession (Score: 45-54)
FOUL! Shooting foul on Paul Williamson. James Cunningham to the line for 2 free throws. [Team fouls: 3] (Paul Williamson: 1 personal fouls)   FT 1/2: GOOD   FT 2/2: GOOD James Cunningham makes 2/2 from the line.
Score: 45-56

[05:19] Team_065 possession (Score: 45-56)
FOUL! Holding foul on Bam Leonard. [IN THE BONUS! 5 team fouls] Russell Wade to the line for 2 free throws. (Bam Leonard: 3 personal fouls)   FT 1/2: GOOD   FT 2/2: GOOD Russell Wade makes 2/2 from the line.
Score: 47-56

[05:01] Team_020 possession (Score: 47-56)
Trae Curry attempts a 3Pt. Contested by Russell Wade (4.2 feet, MAN). Trae Curry misses. Rebound secured by Manu McGrady.

[04:45] Team_065 possession (Score: 47-56)
Russell Wade attempts a Midrange. Heavily contested by Bam Leonard (0.5 feet, MAN)! RUSSELL WADE MAKES IT! Assist: RJ Harden
Score: 49-56

[04:28] Team_020 possession (Score: 49-56)
James Cunningham drives to the basket... James Cunningham throws a bad pass out of bounds! TURNOVER! (dead ball)

[04:16] Team_065 possession (Score: 49-56)
Manu McGrady drives and kicks out. Karl Booker attempts a Midrange. Contested by Bam Leonard (2.4 feet, MAN). Karl Booker misses. Rebound secured by Trae Curry.

[04:04] Team_020 possession (Score: 49-56)
James Cunningham attempts a 3Pt. Contested by Paul Williamson (4.4 feet, MAN). James Cunningham misses. FOUL! Loose ball foul on Russell Wade during the rebound battle. [Team fouls: 4] No free throws, side out. (Russell Wade: 1 personal fouls)

[03:47] Team_020 possession (Score: 49-56)
Terry Simons attempts a Layup. Contested by Russell Wade (4.8 feet, ZONE). Terry Simons misses. Rebound secured by Russell Wade.

[03:37] Team_065 possession (Score: 49-56)
Paul Williamson attempts a 3Pt. Contested by James Cunningham (4.4 feet, MAN). Paul Williamson misses. Rebound secured by Trae Curry.

[03:24] Team_020 possession (Score: 49-56)
Trae Curry drives and kicks out. Trae Curry attempts a 3Pt. Heavily contested by Russell Wade (1.7 feet, MAN)! Trae Curry misses. FOUL! Loose ball foul on RJ Harden during the rebound battle. [IN THE BONUS! 5 team fouls] Trae Curry to the line for 2 free throws. (RJ Harden: 2 personal fouls)   FT 1/2: GOOD   FT 2/2: GOOD Trae Curry makes 2/2 from the line.
Score: 49-58

[03:06] Team_065 possession (Score: 49-58)
RJ Harden attempts a Midrange. Contested by Jarrett McCollum (3.6 feet, MAN). RJ HARDEN MAKES IT! Assist: Paul Williamson
Score: 51-58

[02:52] Team_020 possession (Score: 51-58)
James Cunningham attempts a 3Pt. Contested by Paul Williamson (3.6 feet, MAN). JAMES CUNNINGHAM MAKES IT! Assist: Terry Simons
Score: 51-61

[02:34] Team_065 possession (Score: 51-61)
Paul Williamson drives to the basket... Paul Williamson commits a violation (traveling/carry)! TURNOVER! (dead ball)

[02:34] Substitution (Team_065): Manu McGrady OUT → D'Angelo Porzingis IN (stamina_rule2)

[02:34] Substitution (Team_065): Karl Booker OUT → Vince Mobley IN (stamina_rule2)

[02:34] Substitution (Team_020): Jarrett McCollum OUT → Franz Doncic IN (stamina_rule2)

[02:34] Substitution (Team_020): James Cunningham OUT → Stephen Parker IN (stamina_rule2)

[02:34] Substitution (Team_020): Terry Simons OUT → Victor Holiday IN (stamina_rule2)

[02:34] Substitution (Team_020): Bam Leonard OUT → Cole Barnes IN (stamina_rule2)

[02:34] Substitution (Team_020): Trae Curry OUT → Miles Siakam IN (stamina_rule2)

[02:20] Team_020 possession (Score: 51-61)
Franz Doncic throws a bad pass! Stolen by RJ Harden! TURNOVER! (live ball)

[02:07] Team_065 possession (Score: 51-61)
RJ Harden attempts a Midrange. Contested by Cole Barnes (2.6 feet, ZONE). RJ HARDEN MAKES IT! Assist: Paul Williamson
Score: 53-61

[01:49] Team_020 possession (Score: 53-61)
Miles Siakam attempts a 3Pt. Contested by RJ Harden (6.0 feet, ZONE). MILES SIAKAM MAKES IT! Assist: Stephen Parker
Score: 53-64

[01:33] Team_065 possession (Score: 53-64)
FOUL! Reach-in foul on Miles Siakam during the drive. [IN THE BONUS! 6 team fouls] Vince Mobley to the line for 2 free throws. (Miles Siakam: 1 personal fouls)   FT 1/2: MISS   FT 2/2: GOOD Vince Mobley makes 1/2 from the line.
Score: 54-64

[01:19] Team_020 possession (Score: 54-64)
Victor Holiday attempts a 3Pt. Wide open! RJ Harden is 8.6 feet away. [ZONE] VICTOR HOLIDAY MAKES IT! Assist: Stephen Parker
Score: 54-67

[01:07] Team_065 possession (Score: 54-67)
Russell Wade drives and kicks out. D'Angelo Porzingis makes the 3Pt and draws the foul on Victor Holiday! And-1! D'Angelo Porzingis to the line for 1. [BONUS: 7 team fouls] (Victor Holiday: 1 personal fouls)   FT 1/1: GOOD D'Angelo Porzingis makes 1/1 from the line.
Score: 58-67

[00:52] Team_020 possession (Score: 58-67)
Cole Barnes drives to the basket... Cole Barnes throws a bad pass! Stolen by Russell Wade! TURNOVER! (live ball)

[00:39] Team_065 possession (Score: 58-67)
RJ Harden attempts a 3Pt. Wide open! Stephen Parker is 6.8 feet away. [ZONE] RJ HARDEN MAKES IT! Assist: D'Angelo Porzingis
Score: 61-67

[00:26] Team_020 possession (Score: 61-67)
Stephen Parker attempts a Midrange. Wide open! Paul Williamson is 6.3 feet away. [MAN] STEPHEN PARKER MAKES IT! Assist: Cole Barnes
Score: 61-69

[00:10] Team_065 possession (Score: 61-69)
Paul Williamson attempts a 3Pt. Wide open! Stephen Parker is 7.1 feet away. [ZONE] Paul Williamson misses. Rebound secured by Victor Holiday.

================================================================================
                              3RD QUARTER COMPLETE                              
================================================================================

3RD QUARTER SCORE: Team_065 23, Team_020 27

BOX SCORE:
================================================================================

Team_065
--------------------------------------------------------------------------------
Player                MIN  PTS  REB  AST  TO      FG   FG%      3P   3P%
--------------------------------------------------------------------------------
RJ Harden              30    9    1    1   0   4/4   100.0     0/0   0.0
Russell Wade           30    6    5    0   0   3/5    60.0     0/0   0.0
D'Angelo Porzingis      8    4    0    1   0   1/1   100.0     0/0   0.0
Karl Booker            28    3    0    0   0   1/4    25.0     0/0   0.0
Vince Mobley            8    1    0    0   0   1/1   100.0     0/0   0.0
Manu McGrady           28    0    2    0   0   0/3     0.0     0/0   0.0
Paul Williamson        30    0    0    2   0   0/2     0.0     0/0   0.0

TEAM: FG: 10/20 (50.0%), 3PT: 1/4 (25.0%), REB: 7 (1 off, 6 def), AST: 4, TO: 4
TEAM FOULS: 5 [Team_020 in BONUS]


Team_020
--------------------------------------------------------------------------------
Player                MIN  PTS  REB  AST  TO      FG   FG%      3P   3P%
--------------------------------------------------------------------------------
James Cunningham       28    8    0    0   0   3/5    60.0     0/0   0.0
Trae Curry             28    6    6    0   0   3/6    50.0     0/0   0.0
Terry Simons           28    5    2    1   0   2/4    50.0     0/0   0.0
Miles Siakam            8    3    0    0   0   1/1   100.0     0/0   0.0
Victor Holiday          8    3    1    0   0   1/1   100.0     0/0   0.0
Stephen Parker          8    2    0    2   0   1/1   100.0     0/0   0.0
Bam Leonard            28    0    1    2   0   0/0     0.0     0/0   0.0
Jarrett McCollum       28    0    0    1   0   0/0     0.0     0/0   0.0
Cole Barnes             8    0    0    1   0   0/0     0.0     0/0   0.0

TEAM: FG: 11/18 (61.1%), 3PT: 5/7 (71.4%), REB: 11 (3 off, 8 def), AST: 7, TO: 5
TEAM FOULS: 7 [Team_065 in BONUS]

================================================================================

================================================================================
                       4TH QUARTER - Team_065 vs Team_020                       
================================================================================

[12:00] Substitution (Team_065): RJ Harden OUT → Paul Curry IN (stamina_rule2)

[12:00] Substitution (Team_065): Paul Williamson OUT → Derrick Poole IN (stamina_rule2)

[12:00] Team_065 possession (Score: 61-69)
Paul Williamson loses control! Ball rolls out of bounds! TURNOVER! (dead ball)

[11:43] Team_020 possession (Score: 61-69)
Bam Leonard makes the Layup and draws the foul on Derrick Poole! And-1! Bam Leonard to the line for 1. [Team fouls: 1] (Derrick Poole: 1 personal fouls)   FT 1/1: GOOD Bam Leonard makes 1/1 from the line.
Score: 61-72

[11:31] Team_065 possession (Score: 61-72)
Derrick Poole attempts a Midrange. Contested by James Cunningham (4.8 feet, MAN). DERRICK POOLE MAKES IT!
Score: 63-72

[11:16] Team_020 possession (Score: 63-72)
Bam Leonard attempts a 3Pt. Contested by Russell Wade (3.7 feet, ZONE). Bam Leonard misses. Rebound secured by Karl Booker.

[11:02] Team_065 possession (Score: 63-72)
Russell Wade attempts a Layup. BLOCKED BY BAM LEONARD! Ball is loose! Rebound secured by Terry Simons.

[10:47] Team_020 possession (Score: 63-72)
Terry Simons drives to the basket... FOUL! Offensive foul on Terry Simons! Manu McGrady drew the charge! [Team fouls: 1] (Terry Simons: 1 personal fouls) TURNOVER! (dead ball)

[10:33] Team_065 possession (Score: 63-72)
Derrick Poole attempts a 3Pt. Contested by Jarrett McCollum (4.4 feet, ZONE). Derrick Poole misses. Rebound secured by Bam Leonard.

[10:21] Team_020 possession (Score: 63-72)
Terry Simons attempts a Layup. Contested by Russell Wade (3.4 feet, ZONE). Terry Simons misses. Offensive rebound by Bam Leonard! Bam Leonard's putback is no good. Rebound secured by Karl Booker.

[10:06] Team_065 possession (Score: 63-72)
Derrick Poole attempts a 3Pt. Heavily contested by Bam Leonard (1.1 feet, ZONE)! Derrick Poole misses. Offensive rebound by Manu McGrady! Manu McGrady kicks it out.

[09:52] Team_065 possession (Score: 63-72)
Karl Booker drives, Trae Curry stays with him. Karl Booker attempts a Dunk. Heavily contested by Trae Curry (0.6 feet, ZONE)! KARL BOOKER MAKES IT! Assist: Russell Wade
Score: 65-72

[09:42] Team_020 possession (Score: 65-72)
Terry Simons drives, picks up Manu McGrady. Help arrives from Derrick Poole! Terry Simons attempts a Dunk. Heavily contested by Derrick Poole (0.5 feet, MAN)! Terry Simons misses. Offensive rebound by Trae Curry! Trae Curry puts it back in!
Score: 65-74

[09:31] Team_065 possession (Score: 65-74)
Derrick Poole attempts a Midrange. Contested by Bam Leonard (5.3 feet, ZONE). Derrick Poole misses. Rebound secured by Trae Curry.

[09:17] Team_020 possession (Score: 65-74)
FOUL! Holding foul on Russell Wade. [Team fouls: 2] No free throws, side out. (Russell Wade: 1 personal fouls)

[09:01] Team_020 possession (Score: 65-74)
Bam Leonard attempts a Midrange. Contested by Russell Wade (3.3 feet, MAN). BAM LEONARD MAKES IT! Assist: Terry Simons
Score: 65-76

[08:46] Team_065 possession (Score: 65-76)
Karl Booker makes the Layup and draws the foul on Bam Leonard! And-1! Karl Booker to the line for 1. [Team fouls: 2] (Bam Leonard: 1 personal fouls)   FT 1/1: GOOD Karl Booker makes 1/1 from the line.
Score: 68-76

[08:32] Team_020 possession (Score: 68-76)
Trae Curry loses the ball! Stripped by Russell Wade! TURNOVER! (live ball)

[08:23] Team_065 possession (Score: 68-76)
Manu McGrady attempts a 3Pt. Wide open! Terry Simons is 7.6 feet away. [MAN] Manu McGrady misses. Rebound secured by Bam Leonard.

[08:12] Team_020 possession (Score: 68-76)
James Cunningham attempts a Layup. Contested by Derrick Poole (5.6 feet, MAN). James Cunningham misses. Offensive rebound by Bam Leonard! Bam Leonard puts it back in!
Score: 68-78

[07:54] Team_065 possession (Score: 68-78)
Paul Curry loses the ball! Stripped by Jarrett McCollum! TURNOVER! (live ball)

[07:36] Team_020 possession (Score: 68-78)
Jarrett McCollum attempts a Layup. Contested by Paul Curry (5.2 feet, MAN). JARRETT MCCOLLUM MAKES IT!
Score: 68-80

[07:20] Team_065 possession (Score: 68-80)
Paul Curry attempts a 3Pt. Contested by Bam Leonard (4.3 feet, ZONE). Paul Curry misses. Offensive rebound by Russell Wade! Russell Wade's putback is no good. Offensive rebound by Russell Wade! Russell Wade kicks it out.

[07:07] Team_065 possession (Score: 68-80)
Manu McGrady attempts a Midrange. Contested by Terry Simons (5.4 feet, MAN). Manu McGrady misses. Rebound secured by Bam Leonard.

[06:53] Team_020 possession (Score: 68-80)
Jarrett McCollum attempts a 3Pt. Wide open! Paul Curry is 6.8 feet away. [ZONE] Jarrett McCollum misses. Rebound secured by Manu McGrady.

[06:38] Team_065 possession (Score: 68-80)
Russell Wade attempts a 3Pt. Contested by Bam Leonard (4.3 feet, MAN). RUSSELL WADE MAKES IT! Assist: Paul Curry
Score: 71-80

[06:24] Team_020 possession (Score: 71-80)
Terry Simons attempts a Midrange. Wide open! Manu McGrady is 10.0 feet away. [MAN] TERRY SIMONS MAKES IT! Assist: Jarrett McCollum
Score: 71-82

[06:09] Team_065 possession (Score: 71-82)
Derrick Poole throws a bad pass! Stolen by James Cunningham! TURNOVER! (live ball)

[05:52] Team_020 possession (Score: 71-82)
Trae Curry attempts a Layup. Contested by Russell Wade (5.5 feet, MAN). TRAE CURRY MAKES IT! Assist: James Cunningham
Score: 71-84

[05:40] Team_065 possession (Score: 71-84)
Paul Curry drives to the basket... Paul Curry commits a violation (traveling/carry)! TURNOVER! (dead ball)

[05:40] Substitution (Team_065): Manu McGrady OUT → D'Angelo Porzingis IN (stamina_rule2)

[05:40] Substitution (Team_065): Russell Wade OUT → Karl Leonard IN (stamina_rule2)

[05:40] Substitution (Team_065): Karl Booker OUT → Vince Mobley IN (stamina_rule2)

[05:40] Substitution (Team_020): Jarrett McCollum OUT → Franz Doncic IN (stamina_rule2)

[05:40] Substitution (Team_020): James Cunningham OUT → Stephen Parker IN (stamina_rule2)

[05:40] Substitution (Team_020): Terry Simons OUT → Victor Holiday IN (stamina_rule2)

[05:40] Substitution (Team_020): Bam Leonard OUT → Cole Barnes IN (stamina_rule2)

[05:40] Substitution (Team_020): Trae Curry OUT → Miles Siakam IN (stamina_rule2)

[05:25] Team_020 possession (Score: 71-84)
Miles Siakam drives, Vince Mobley stays with him. Miles Siakam attempts a Layup. Contested by Vince Mobley (3.7 feet, MAN). Miles Siakam misses. Rebound secured by Vince Mobley.

[05:13] Team_065 possession (Score: 71-84)
Paul Curry attempts a Midrange. Contested by Stephen Parker (6.0 feet, ZONE). Paul Curry misses. Rebound secured by Victor Holiday.

[05:00] Team_020 possession (Score: 71-84)
Miles Siakam loses the ball! Stripped by Vince Mobley! TURNOVER! (live ball)

[04:50] Team_065 possession (Score: 71-84)
Derrick Poole attempts a 3Pt. Wide open! Stephen Parker is 7.4 feet away. [MAN] DERRICK POOLE MAKES IT! Assist: Karl Leonard
Score: 74-84

[04:38] Team_020 possession (Score: 74-84)
Miles Siakam attempts a Midrange. Contested by Vince Mobley (3.8 feet, MAN). MILES SIAKAM MAKES IT! Assist: Victor Holiday
Score: 74-86

[04:28] Team_065 possession (Score: 74-86)
FOUL! Shooting foul on Franz Doncic. D'Angelo Porzingis to the line for 2 free throws. [Team fouls: 3] (Franz Doncic: 1 personal fouls)   FT 1/2: GOOD   FT 2/2: GOOD D'Angelo Porzingis makes 2/2 from the line.
Score: 76-86

[04:15] Team_020 possession (Score: 76-86)
FOUL! Holding foul on Vince Mobley. [Team fouls: 3] No free throws, side out. (Vince Mobley: 1 personal fouls)

[03:57] Team_020 possession (Score: 76-86)
Stephen Parker attempts a 3Pt. Contested by Karl Leonard (3.3 feet, ZONE). Stephen Parker misses. Rebound secured by D'Angelo Porzingis.

[03:42] Team_065 possession (Score: 76-86)
FOUL! Shooting foul on Cole Barnes. Karl Leonard to the line for 2 free throws. [Team fouls: 4] (Cole Barnes: 1 personal fouls)   FT 1/2: GOOD   FT 2/2: GOOD Karl Leonard makes 2/2 from the line.
Score: 78-86

[03:26] Team_020 possession (Score: 78-86)
Miles Siakam attempts a Midrange. Wide open! Derrick Poole is 7.0 feet away. [ZONE] MILES SIAKAM MAKES IT! Assist: Cole Barnes
Score: 78-88

[03:13] Team_065 possession (Score: 78-88)
Vince Mobley attempts a Midrange. Contested by Victor Holiday (4.9 feet, ZONE). VINCE MOBLEY MAKES IT! Assist: Derrick Poole
Score: 80-88

[03:02] Team_020 possession (Score: 80-88)
Victor Holiday drives to the basket... Victor Holiday commits a violation (traveling/carry)! TURNOVER! (dead ball)

[02:48] Team_065 possession (Score: 80-88)
D'Angelo Porzingis drives and kicks out. Karl Leonard attempts a 3Pt. Wide open! Cole Barnes is 6.1 feet away. [MAN] KARL LEONARD MAKES IT! Assist: Derrick Poole
Score: 83-88

[02:29] Team_020 possession (Score: 83-88)
Franz Doncic drives, picks up Paul Curry. Help arrives from D'Angelo Porzingis! Franz Doncic attempts a Dunk. Contested by D'Angelo Porzingis (4.2 feet, MAN). Franz Doncic misses. Rebound secured by D'Angelo Porzingis.

[02:16] Team_065 possession (Score: 83-88)
Paul Curry makes the Midrange and draws the foul on Franz Doncic! And-1! Paul Curry to the line for 1. [BONUS: 5 team fouls] (Franz Doncic: 2 personal fouls)   FT 1/1: GOOD Paul Curry makes 1/1 from the line.
Score: 86-88

[02:02] Team_020 possession (Score: 86-88)
Stephen Parker drives and kicks out. Franz Doncic attempts a 3Pt. Contested by Paul Curry (3.2 feet, MAN). FRANZ DONCIC MAKES IT! Assist: Stephen Parker
Score: 86-91

[01:50] Team_065 possession (Score: 86-91)
Vince Mobley drives to the basket... Vince Mobley throws a bad pass! Stolen by Miles Siakam! TURNOVER! (live ball)

[01:39] Team_020 possession (Score: 86-91)
Cole Barnes drives and kicks out. Cole Barnes attempts a 3Pt. Contested by Karl Leonard (5.4 feet, MAN). Cole Barnes misses. Offensive rebound by Cole Barnes! Cole Barnes kicks it out.

[01:19] Team_020 possession (Score: 86-91)
Stephen Parker attempts a Layup. Contested by Vince Mobley (2.2 feet, ZONE). Stephen Parker misses. Rebound secured by Vince Mobley.

[01:05] Team_065 possession (Score: 86-91)
Derrick Poole throws a bad pass! Stolen by Stephen Parker! TURNOVER! (live ball)

[00:56] Team_020 possession (Score: 86-91)
Stephen Parker loses the ball! Stripped by Derrick Poole! TURNOVER! (live ball)

[00:43] Team_065 possession (Score: 86-91)
FOUL! Reach-in foul on Miles Siakam during the drive. [IN THE BONUS! 6 team fouls] Vince Mobley to the line for 2 free throws. (Miles Siakam: 1 personal fouls)   FT 1/2: GOOD   FT 2/2: GOOD Vince Mobley makes 2/2 from the line.
Score: 88-91

[00:28] Team_020 possession (Score: 88-91)
Franz Doncic attempts a 3Pt. Contested by D'Angelo Porzingis (5.9 feet, ZONE). Franz Doncic misses. Rebound secured by Vince Mobley.

[00:11] Team_065 possession (Score: 88-91)
Karl Leonard drives to the basket... FOUL! Offensive foul on Karl Leonard! Cole Barnes drew the charge! [Team fouls: 4] (Karl Leonard: 1 personal fouls) TURNOVER! (dead ball)

================================================================================
                              4TH QUARTER COMPLETE                              
================================================================================

4TH QUARTER SCORE: Team_065 27, Team_020 22

BOX SCORE:
================================================================================

Team_065
--------------------------------------------------------------------------------
Player                MIN  PTS  REB  AST  TO      FG   FG%      3P   3P%
--------------------------------------------------------------------------------
Derrick Poole          18    5    0    2   0   2/4    50.0     0/0   0.0
Karl Booker            35    5    2    0   0   2/2   100.0     0/0   0.0
Karl Leonard           11    5    0    1   0   2/2   100.0     0/0   0.0
Vince Mobley           14    4    3    0   0   2/2   100.0     0/0   0.0
Russell Wade           37    3    1    1   0   1/2    50.0     0/0   0.0
Paul Curry             18    3    0    1   0   1/2    50.0     0/0   0.0
D'Angelo Porzingis     14    2    2    0   0   1/1   100.0     0/0   0.0
Manu McGrady           35    0    2    0   0   0/2     0.0     0/0   0.0

TEAM: FG: 11/17 (64.7%), 3PT: 2/4 (50.0%), REB: 9 (2 off, 7 def), AST: 5, TO: 7
TEAM FOULS: 4


Team_020
--------------------------------------------------------------------------------
Player                MIN  PTS  REB  AST  TO      FG   FG%      3P   3P%
--------------------------------------------------------------------------------
Bam Leonard            35    7    4    0   0   3/4    75.0     0/0   0.0
Trae Curry             35    4    2    0   0   2/2   100.0     0/0   0.0
Miles Siakam           14    4    0    0   0   2/3    66.7     0/0   0.0
Franz Doncic           14    3    0    0   0   1/3    33.3     0/0   0.0
Terry Simons           35    2    1    1   0   1/2    50.0     0/0   0.0
Jarrett McCollum       35    2    0    1   0   1/2    50.0     0/0   0.0
James Cunningham       35    0    0    1   0   0/0     0.0     0/0   0.0
Victor Holiday         14    0    1    1   0   0/0     0.0     0/0   0.0
Stephen Parker         14    0    0    1   0   0/2     0.0     0/0   0.0
Cole Barnes            14    0    1    1   0   0/0     0.0     0/0   0.0

TEAM: FG: 10/18 (55.6%), 3PT: 0/4 (0.0%), REB: 10 (4 off, 6 def), AST: 6, TO: 5
TEAM FOULS: 6 [Team_065 in BONUS]

================================================================================

================================================================================
                               FULL GAME COMPLETE                               
================================================================================

FINAL SCORE: Team_065 88, Team_020 91

SCORING BY QUARTER:
--------------------------------------------------------------------------------
Team                     Q1     Q2     Q3     Q4    FINAL
--------------------------------------------------------------------------------
Team_065                 11     27     23     27       88
Team_020                 15     27     27     22       91
--------------------------------------------------------------------------------

FULL GAME BOX SCORE:
================================================================================

Team_065
--------------------------------------------------------------------------------
Player                MIN  PTS  REB  AST  TO      FG   FG%      3P   3P%      FT STL BLK
--------------------------------------------------------------------------------
Russell Wade           37   12   13    2   2   5/12   41.7   1/3    33.3   5/7     2   4
Manu McGrady           35    7   12    1   2   2/10   20.0   1/3    33.3   2/2     1   0
Karl Booker            35    8    2    1   0   3/10   30.0   0/1     0.0   3/4     0   0
RJ Harden              31   15    6    3   3   7/11   63.6   4/6    66.7   0/0     1   0
Paul Williamson        31    4    0    2   2   2/7    28.6   0/5     0.0   0/0     1   1
Paul Curry             18    8    0    2   3   3/4    75.0   1/1   100.0   1/1     0   0
Derrick Poole          18   10    0    2   2   4/8    50.0   1/3    33.3   1/2     1   0
D'Angelo Porzingis     14    9    2    2   1   3/4    75.0   0/0     0.0   3/3     0   1
Vince Mobley           14    9    5    2   0   5/5   100.0   0/0     0.0   3/4     1   0
Karl Leonard           11    5    0    2   0   2/2   100.0   0/0     0.0   2/2     0   0

TEAM: FG: 38/75 (50.7%), 3PT: 8/22 (36.4%), REB: 36 (9 off, 27 def), AST: 19, TO: 15


Team_020
--------------------------------------------------------------------------------
Player                MIN  PTS  REB  AST  TO      FG   FG%      3P   3P%      FT STL BLK
--------------------------------------------------------------------------------
Jarrett McCollum       35    2    0    3   1   3/5    60.0   0/2     0.0   0/0     1   1
James Cunningham       35   10    0    2   2   6/11   54.5   3/5    60.0   2/2     1   0
Terry Simons           35   12    8    5   2   5/12   41.7   1/3    33.3   0/0     0   0
Bam Leonard            35   13   13    5   1   4/8    50.0   1/4    25.0   1/1     1   3
Trae Curry             35   22   16    0   3   9/15   60.0   0/2     0.0   2/2     3   2
Franz Doncic           14    3    0    0   1   0/2     0.0   0/1     0.0   0/0     0   0
Stephen Parker         14    5    0    5   3   3/5    60.0   1/2    50.0   0/0     1   0
Victor Holiday         14    8    3    2   0   3/4    75.0   2/3    66.7   0/0     0   0
Cole Barnes            14    0    2    3   1   0/0     0.0   0/0     0.0   0/0     0   0
Miles Siakam           14   16    3    0   1   7/9    77.8   2/2   100.0   2/2     1   0

TEAM: FG: 40/71 (56.3%), 3PT: 10/24 (41.7%), REB: 49 (14 off, 35 def), AST: 25, TO: 15

================================================================================
