================================================================================
                        FULL GAME - Team_013 vs Team_019                        
================================================================================

================================================================================
                       1ST QUARTER - Team_013 vs Team_019                       
================================================================================

[12:00] Team_013 possession (Score: 0-0)
Manu Smith attempts a Layup. Wide open! DeMar James is 7.4 feet away. [ZONE] Manu Smith misses. Offensive rebound by Desmond Ginobili! Desmond Ginobili kicks it out.

[11:43] Team_013 possession (Score: 0-0)
Nikola Curry attempts a Midrange. Wide open! Tobias Hyland is 6.3 feet away. [ZONE] Nikola Curry misses. Rebound secured by D'Angelo Randle.

[11:30] Team_019 possession (Score: 0-0)
Brandon James drives, Pau Mobley stays with him. Brandon James attempts a Dunk. Heavily contested by Pau Mobley (0.5 feet, MAN)! BRANDON JAMES MAKES IT! Assist: DeMar James
Score: 0-2

[11:20] Team_013 possession (Score: 0-2)
FOUL! Shooting foul on Brandon James. Nikola Curry to the line for 2 free throws. [Team fouls: 1] (Brandon James: 1 personal fouls)   FT 1/2: GOOD   FT 2/2: GOOD Nikola Curry makes 2/2 from the line.
Score: 2-2

[11:05] Team_019 possession (Score: 2-2)
Brandon James makes the Layup and draws the foul on Pau Mobley! And-1! Brandon James to the line for 1. [Team fouls: 1] (Pau Mobley: 1 personal fouls)   FT 1/1: GOOD Brandon James makes 1/1 from the line.
Score: 2-5

[10:47] Team_013 possession (Score: 2-5)
Nikola Curry attempts a Layup. BLOCKED BY BRANDON JAMES! Ball is loose! Rebound secured by D'Angelo Randle.

[10:31] Team_019 possession (Score: 2-5)
Rudy Giddey attempts a 3Pt. Contested by Pau Mobley (6.0 feet, ZONE). Rudy Giddey misses. Rebound secured by Pau Mobley.

[10:14] Team_013 possession (Score: 2-5)
Desmond Ginobili drives to the basket... Desmond Ginobili loses the ball! Stripped by Tobias Hyland! TURNOVER! (live ball)

[10:01] Team_019 possession (Score: 2-5)
FOUL! Holding foul on Pau Mobley. [Team fouls: 2] No free throws, side out. (Pau Mobley: 2 personal fouls)

[09:48] Team_019 possession (Score: 2-5)
DeMar James attempts a 3Pt. Contested by Nikola Curry (2.9 feet, MAN). DEMAR JAMES MAKES IT! Assist: Rudy Giddey
Score: 2-8

[09:33] Team_013 possession (Score: 2-8)
FOUL! Shooting foul on DeMar James. Jayson Morant to the line for 2 free throws. [Team fouls: 2] (DeMar James: 1 personal fouls)   FT 1/2: MISS   FT 2/2: GOOD Jayson Morant makes 1/2 from the line.
Score: 3-8

[09:18] Team_019 possession (Score: 3-8)
DeMar James attempts a Midrange. Wide open! Jayson Morant is 6.2 feet away. [ZONE] DEMAR JAMES MAKES IT! Assist: Brandon James
Score: 3-10

[09:04] Team_013 possession (Score: 3-10)
Jayson Morant attempts a Midrange. Contested by Brandon James (5.5 feet, ZONE). Jayson Morant misses. Rebound secured by DeMar James.

[08:48] Team_019 possession (Score: 3-10)
Tobias Hyland attempts a 3Pt. Contested by Desmond Ginobili (2.7 feet, MAN). Tobias Hyland misses. Offensive rebound by D'Angelo Randle! D'Angelo Randle's putback is no good. Rebound secured by Pau Mobley.

[08:30] Team_013 possession (Score: 3-10)
Manu Smith drives to the basket... FOUL! Offensive foul on Manu Smith! DeMar James drew the charge! [Team fouls: 3] (Manu Smith: 1 personal fouls) TURNOVER! (dead ball)

[08:12] Team_019 possession (Score: 3-10)
DeMar James attempts a 3Pt. Contested by Nikola Curry (3.6 feet, MAN). DeMar James misses. Rebound secured by Pau Mobley.

[07:57] Team_013 possession (Score: 3-10)
Jayson Morant drives and kicks out. Jayson Morant attempts a 3Pt. Contested by D'Angelo Randle (3.8 feet, MAN). Jayson Morant misses. Rebound secured by D'Angelo Randle.

[07:45] Team_019 possession (Score: 3-10)
Tobias Hyland loses control! Ball rolls out of bounds! TURNOVER! (dead ball)

[07:31] Team_013 possession (Score: 3-10)
Jayson Morant drives, D'Angelo Randle stays with him. Jayson Morant attempts a Layup. Contested by D'Angelo Randle (4.3 feet, MAN). Jayson Morant misses. Rebound secured by Tobias Hyland.

[07:18] Team_019 possession (Score: 3-10)
Rudy Giddey attempts a Layup. Contested by Nikola Curry (4.3 feet, ZONE). RUDY GIDDEY MAKES IT!
Score: 3-12

[07:03] Team_013 possession (Score: 3-12)
Manu Smith drives to the basket... Manu Smith loses the ball! Stripped by DeMar James! TURNOVER! (live ball)

[06:53] Team_019 possession (Score: 3-12)
DeMar James attempts a Midrange. Heavily contested by Nikola Curry (0.5 feet, MAN)! DeMar James misses. Rebound secured by Desmond Ginobili.

[06:38] Team_013 possession (Score: 3-12)
Pau Mobley drives, DeMar James stays with him. Pau Mobley attempts a Layup. Contested by DeMar James (4.8 feet, ZONE). Pau Mobley misses. Offensive rebound by Nikola Curry! Nikola Curry kicks it out.

[06:21] Team_013 possession (Score: 3-12)
Jayson Morant attempts a 3Pt. Wide open! D'Angelo Randle is 6.8 feet away. [ZONE] JAYSON MORANT MAKES IT! Assist: Manu Smith
Score: 6-12

[06:04] Team_019 possession (Score: 6-12)
D'Angelo Randle drives, Jayson Morant stays with him. D'Angelo Randle attempts a Layup. Contested by Jayson Morant (5.1 feet, MAN). D'ANGELO RANDLE MAKES IT!
Score: 6-14

[05:52] Team_013 possession (Score: 6-14)
Desmond Ginobili drives to the basket... Desmond Ginobili commits a violation (traveling/carry)! TURNOVER! (dead ball)

[05:37] Team_019 possession (Score: 6-14)
Rudy Giddey attempts a 3Pt. Wide open! Manu Smith is 6.6 feet away. [MAN] RUDY GIDDEY MAKES IT! Assist: DeMar James
Score: 6-17

[05:21] Team_013 possession (Score: 6-17)
Manu Smith attempts a 3Pt. Contested by D'Angelo Randle (2.8 feet, ZONE). Manu Smith misses. Rebound secured by Tobias Hyland.

[05:04] Team_019 possession (Score: 6-17)
Rudy Giddey attempts a Midrange. Wide open! Manu Smith is 8.4 feet away. [MAN] Rudy Giddey misses. Rebound secured by Pau Mobley.

[04:51] Team_013 possession (Score: 6-17)
Pau Mobley drives, DeMar James stays with him. Pau Mobley attempts a Layup. Heavily contested by DeMar James (0.5 feet, ZONE)! PAU MOBLEY MAKES IT! Assist: Jayson Morant
Score: 8-17

[04:36] Team_019 possession (Score: 8-17)
Rudy Giddey attempts a 3Pt. Contested by Pau Mobley (2.2 feet, ZONE). Rudy Giddey misses. Rebound secured by Pau Mobley.

[04:23] Team_013 possession (Score: 8-17)
Pau Mobley attempts a Layup. Contested by Brandon James (3.2 feet, MAN). Pau Mobley misses. Rebound secured by DeMar James.

[04:10] Team_019 possession (Score: 8-17)
Brandon James loses control! Ball rolls out of bounds! TURNOVER! (dead ball)

[03:56] Team_013 possession (Score: 8-17)
FOUL! Shooting foul on D'Angelo Randle. Jayson Morant to the line for 2 free throws. [Team fouls: 3] (D'Angelo Randle: 1 personal fouls)   FT 1/2: GOOD   FT 2/2: MISS Jayson Morant makes 1/2 from the line. Rebound secured by Tobias Hyland.
Score: 9-17

[03:43] Team_019 possession (Score: 9-17)
Brandon James drives to the basket... Brandon James commits a violation (traveling/carry)! TURNOVER! (dead ball)

[03:31] Team_013 possession (Score: 9-17)
Manu Smith attempts a Layup. Contested by Rudy Giddey (4.8 feet, MAN). MANU SMITH MAKES IT!
Score: 11-17

[03:17] Team_019 possession (Score: 11-17)
Rudy Giddey makes the Dunk and draws the foul on Pau Mobley! And-1! Rudy Giddey to the line for 1. [Team fouls: 4] (Pau Mobley: 3 personal fouls)   FT 1/1: GOOD Rudy Giddey makes 1/1 from the line.
Score: 11-20

[03:00] Team_013 possession (Score: 11-20)
Nikola Curry drives, DeMar James stays with him. Nikola Curry attempts a Layup. Contested by DeMar James (3.6 feet, ZONE). Nikola Curry misses. Rebound secured by D'Angelo Randle.

[02:46] Team_019 possession (Score: 11-20)
FOUL! Reach-in foul on Jayson Morant during the drive. [IN THE BONUS! 5 team fouls] D'Angelo Randle to the line for 2 free throws. (Jayson Morant: 1 personal fouls)   FT 1/2: GOOD   FT 2/2: GOOD D'Angelo Randle makes 2/2 from the line.
Score: 11-22

[02:31] Team_013 possession (Score: 11-22)
Desmond Ginobili attempts a Layup. Contested by Tobias Hyland (4.0 feet, MAN). DESMOND GINOBILI MAKES IT! Assist: Manu Smith
Score: 13-22

[02:16] Team_019 possession (Score: 13-22)
FOUL! Holding foul on Manu Smith. [IN THE BONUS! 6 team fouls] Rudy Giddey to the line for 2 free throws. (Manu Smith: 2 personal fouls)   FT 1/2: GOOD   FT 2/2: GOOD Rudy Giddey makes 2/2 from the line.
Score: 13-24

[01:56] Team_013 possession (Score: 13-24)
Jayson Morant drives, D'Angelo Randle stays with him. Jayson Morant attempts a Layup. Contested by D'Angelo Randle (4.5 feet, MAN). JAYSON MORANT MAKES IT! Assist: Manu Smith
Score: 15-24

[01:45] Team_019 possession (Score: 15-24)
Rudy Giddey attempts a Midrange. Contested by Manu Smith (5.5 feet, MAN). RUDY GIDDEY MAKES IT! Assist: Tobias Hyland
Score: 15-26

[01:30] Team_013 possession (Score: 15-26)
Jayson Morant makes the Layup and draws the foul on D'Angelo Randle! And-1! Jayson Morant to the line for 1. [Team fouls: 4] (D'Angelo Randle: 2 personal fouls)   FT 1/1: GOOD Jayson Morant makes 1/1 from the line.
Score: 18-26

[01:13] Team_019 possession (Score: 18-26)
DeMar James drives, Nikola Curry stays with him. DeMar James attempts a Layup. Contested by Nikola Curry (2.8 feet, ZONE). DEMAR JAMES MAKES IT! Assist: Tobias Hyland
Score: 18-28

[00:55] Team_013 possession (Score: 18-28)
Pau Mobley attempts a Midrange. Contested by Brandon James (5.3 feet, ZONE). PAU MOBLEY MAKES IT!
Score: 20-28

[00:43] Team_019 possession (Score: 20-28)
D'Angelo Randle attempts a 3Pt. Contested by Pau Mobley (2.6 feet, ZONE). D'Angelo Randle misses. Rebound secured by Pau Mobley.

[00:30] Team_013 possession (Score: 20-28)
Manu Smith attempts a Midrange. Wide open! Tobias Hyland is 7.6 feet away. [ZONE] MANU SMITH MAKES IT!
Score: 22-28

[00:13] Team_019 possession (Score: 22-28)
D'Angelo Randle attempts a 3Pt. Contested by Jayson Morant (5.8 feet, MAN). D'Angelo Randle misses. Rebound secured by Nikola Curry.

================================================================================
                              1ST QUARTER COMPLETE                              
================================================================================

1ST QUARTER SCORE: Team_013 22, Team_019 28

BOX SCORE:
================================================================================

Team_013
--------------------------------------------------------------------------------
Player                MIN  PTS  REB  AST  TO      FG   FG%      3P   3P%
--------------------------------------------------------------------------------
Jayson Morant          12    9    0    1   0   4/8    50.0     0/0   0.0
Pau Mobley             12    4    6    0   0   2/3    66.7     0/0   0.0
Manu Smith             12    4    0    3   0   2/3    66.7     0/0   0.0
Desmond Ginobili       12    2    2    0   0   1/1   100.0     0/0   0.0
Nikola Curry           12    2    2    0   0   1/4    25.0     0/0   0.0

TEAM: FG: 10/19 (52.6%), 3PT: 1/2 (50.0%), REB: 9 (2 off, 7 def), AST: 4, TO: 4
TEAM FOULS: 6 [Team_019 in BONUS]


Team_019
--------------------------------------------------------------------------------
Player                MIN  PTS  REB  AST  TO      FG   FG%      3P   3P%
--------------------------------------------------------------------------------
Rudy Giddey            12   12    0    1   0   5/8    62.5     0/0   0.0
DeMar James            12    7    2    2   0   3/5    60.0     0/0   0.0
Brandon James          12    5    0    1   0   2/2   100.0     0/0   0.0
D'Angelo Randle        12    4    4    0   0   2/4    50.0     0/0   0.0
Tobias Hyland          12    0    3    2   0   0/1     0.0     0/0   0.0

TEAM: FG: 12/20 (60.0%), 3PT: 2/8 (25.0%), REB: 10 (1 off, 9 def), AST: 6, TO: 3
TEAM FOULS: 4

================================================================================

================================================================================
                       2ND QUARTER - Team_013 vs Team_019                       
================================================================================

[12:00] Team_013 possession (Score: 22-28)
Manu Smith drives, DeMar James stays with him. Manu Smith attempts a Dunk. Contested by DeMar James (2.7 feet, ZONE). MANU SMITH MAKES IT! Assist: Pau Mobley
Score: 24-28

[11:46] Team_019 possession (Score: 24-28)
D'Angelo Randle attempts a Layup. Heavily contested by Jayson Morant (1.6 feet, MAN)! D'ANGELO RANDLE MAKES IT!
Score: 24-30

[11:35] Team_013 possession (Score: 24-30)
Jayson Morant attempts a 3Pt. Contested by D'Angelo Randle (3.0 feet, ZONE). Jayson Morant misses. Rebound secured by Tobias Hyland.

[11:18] Team_019 possession (Score: 24-30)
DeMar James drives, picks up Desmond Ginobili. Help arrives from Pau Mobley! DeMar James attempts a Dunk. Contested by Pau Mobley (3.9 feet, ZONE). DEMAR JAMES MAKES IT!
Score: 24-32

[11:04] Team_013 possession (Score: 24-32)
Desmond Ginobili loses control! Ball rolls out of bounds! TURNOVER! (dead ball)

[11:04] Substitution (Team_013): Manu Smith OUT → Gary Iverson IN (stamina_rule2)

[11:04] Substitution (Team_013): Pau Mobley OUT → Chris Bryant IN (stamina_rule2)

[11:04] Substitution (Team_013): Jayson Morant OUT → Vince Nowitzki IN (stamina_rule2)

[11:04] Substitution (Team_013): Desmond Ginobili OUT → Dirk Booker IN (stamina_rule2)

[11:04] Substitution (Team_013): Nikola Curry OUT → Jayson Nowitzki IN (stamina_rule2)

[11:04] Substitution (Team_019): Rudy Giddey OUT → Gary Ginobili IN (stamina_rule2)

[11:04] Substitution (Team_019): Brandon James OUT → Jalen Turner IN (stamina_rule2)

[11:04] Substitution (Team_019): D'Angelo Randle OUT → Blake LaVine IN (stamina_rule2)

[11:04] Substitution (Team_019): Tobias Hyland OUT → Shai Ingram IN (stamina_rule2)

[11:04] Substitution (Team_019): DeMar James OUT → Tim Jordan IN (stamina_rule2)

[10:51] Team_019 possession (Score: 24-32)
Gary Ginobili attempts a Midrange. Contested by Vince Nowitzki (5.1 feet, ZONE). Gary Ginobili misses. Rebound secured by Chris Bryant.

[10:38] Team_013 possession (Score: 24-32)
Dirk Booker attempts a Midrange. Contested by Shai Ingram (5.0 feet, MAN). Dirk Booker misses. Rebound secured by Shai Ingram.

[10:24] Team_019 possession (Score: 24-32)
Shai Ingram attempts a 3Pt. Wide open! Dirk Booker is 8.0 feet away. [MAN] Shai Ingram misses. Rebound secured by Jayson Nowitzki.

[10:09] Team_013 possession (Score: 24-32)
Chris Bryant attempts a Midrange. Contested by Jalen Turner (3.8 feet, MAN). Chris Bryant misses. Rebound secured by Blake LaVine.

[09:56] Team_019 possession (Score: 24-32)
Shai Ingram loses control! Ball rolls out of bounds! TURNOVER! (dead ball)

[09:42] Team_013 possession (Score: 24-32)
FOUL! Shooting foul on Jalen Turner. Dirk Booker to the line for 2 free throws. [Team fouls: 1] (Jalen Turner: 1 personal fouls)   FT 1/2: GOOD   FT 2/2: GOOD Dirk Booker makes 2/2 from the line.
Score: 26-32

[09:25] Team_019 possession (Score: 26-32)
Blake LaVine throws a bad pass! Stolen by Vince Nowitzki! TURNOVER! (live ball)

[09:10] Team_013 possession (Score: 26-32)
Chris Bryant drives, picks up Shai Ingram. Help arrives from Jalen Turner! Chris Bryant attempts a Layup. Wide open! Jalen Turner is 6.6 feet away. [ZONE] Chris Bryant misses. Rebound secured by Shai Ingram.

[08:56] Team_019 possession (Score: 26-32)
Blake LaVine attempts a Midrange. Contested by Vince Nowitzki (3.1 feet, MAN). Blake LaVine misses. FOUL! Loose ball foul on Chris Bryant during the rebound battle. [Team fouls: 1] No free throws, side out. (Chris Bryant: 1 personal fouls)

[08:41] Team_019 possession (Score: 26-32)
FOUL! Shooting foul on Gary Iverson. Shai Ingram to the line for 2 free throws. [Team fouls: 2] (Gary Iverson: 1 personal fouls)   FT 1/2: GOOD   FT 2/2: GOOD Shai Ingram makes 2/2 from the line.
Score: 26-34

[08:27] Team_013 possession (Score: 26-34)
Jayson Nowitzki attempts a Midrange. Wide open! Gary Ginobili is 7.8 feet away. [ZONE] JAYSON NOWITZKI MAKES IT!
Score: 28-34

[08:13] Team_019 possession (Score: 28-34)
Blake LaVine attempts a 3Pt. Wide open! Vince Nowitzki is 6.6 feet away. [MAN] BLAKE LAVINE MAKES IT!
Score: 28-37

[08:00] Team_013 possession (Score: 28-37)
Chris Bryant loses the ball! Stripped by Jalen Turner! TURNOVER! (live ball)

[07:49] Team_019 possession (Score: 28-37)
Gary Ginobili attempts a Midrange. Wide open! Gary Iverson is 6.7 feet away. [MAN] Gary Ginobili misses. Offensive rebound by Tim Jordan! Tim Jordan kicks it out.

[07:36] Team_019 possession (Score: 28-37)
Tim Jordan drives and kicks out. Gary Ginobili attempts a Midrange. Contested by Chris Bryant (2.9 feet, ZONE). GARY GINOBILI MAKES IT!
Score: 28-39

[07:22] Team_013 possession (Score: 28-39)
Dirk Booker drives and kicks out. Vince Nowitzki attempts a Midrange. Contested by Blake LaVine (2.6 feet, ZONE). Vince Nowitzki misses. Rebound secured by Shai Ingram.

[07:07] Team_019 possession (Score: 28-39)
Gary Ginobili attempts a 3Pt. Wide open! Gary Iverson is 6.4 feet away. [MAN] Gary Ginobili misses. Offensive rebound by Shai Ingram! Shai Ingram kicks it out.

[06:52] Team_019 possession (Score: 28-39)
FOUL! Shooting foul on Chris Bryant. Blake LaVine to the line for 3 free throws. [Team fouls: 3] (Chris Bryant: 2 personal fouls)   FT 1/3: GOOD   FT 2/3: GOOD   FT 3/3: GOOD Blake LaVine makes 3/3 from the line.
Score: 28-42

[06:37] Team_013 possession (Score: 28-42)
Dirk Booker attempts a Midrange. Wide open! Shai Ingram is 6.2 feet away. [MAN] Dirk Booker misses. Rebound secured by Blake LaVine.

[06:24] Team_019 possession (Score: 28-42)
Shai Ingram attempts a Midrange. Contested by Gary Iverson (5.3 feet, ZONE). Shai Ingram misses. Offensive rebound by Shai Ingram! Shai Ingram kicks it out.

[06:07] Team_019 possession (Score: 28-42)
Gary Ginobili attempts a Layup. Wide open! Jayson Nowitzki is 6.4 feet away. [ZONE] GARY GINOBILI MAKES IT! Assist: Tim Jordan
Score: 28-44

[05:51] Team_013 possession (Score: 28-44)
Dirk Booker drives, Shai Ingram stays with him. Dirk Booker attempts a Dunk. Contested by Shai Ingram (4.9 feet, ZONE). Dirk Booker misses. Rebound secured by Shai Ingram.

[05:37] Team_019 possession (Score: 28-44)
Jalen Turner attempts a 3Pt. Contested by Chris Bryant (3.8 feet, MAN). JALEN TURNER MAKES IT! Assist: Gary Ginobili
Score: 28-47

[05:23] Team_013 possession (Score: 28-47)
Gary Iverson attempts a 3Pt. Contested by Gary Ginobili (3.6 feet, MAN). GARY IVERSON MAKES IT! Assist: Vince Nowitzki
Score: 31-47

[05:07] Team_019 possession (Score: 31-47)
Gary Ginobili attempts a 3Pt. Contested by Gary Iverson (4.1 feet, MAN). Gary Ginobili misses. Offensive rebound by Tim Jordan! Tim Jordan kicks it out.

[04:56] Team_019 possession (Score: 31-47)
Gary Ginobili attempts a Layup. BLOCKED BY JAYSON NOWITZKI! Ball is loose! Offensive rebound by Shai Ingram! Shai Ingram kicks it out.

[04:43] Team_019 possession (Score: 31-47)
Jalen Turner attempts a Midrange. Wide open! Chris Bryant is 7.8 feet away. [ZONE] JALEN TURNER MAKES IT! Assist: Shai Ingram
Score: 31-49

[04:26] Team_013 possession (Score: 31-49)
Chris Bryant drives and kicks out. Gary Iverson attempts a 3Pt. Contested by Gary Ginobili (5.0 feet, MAN). GARY IVERSON MAKES IT! Assist: Jayson Nowitzki
Score: 34-49

[04:11] Team_019 possession (Score: 34-49)
FOUL! Offensive foul on Gary Ginobili! Gary Iverson drew the charge! [Team fouls: 2] (Gary Ginobili: 1 personal fouls) TURNOVER! (dead ball)

[03:59] Team_013 possession (Score: 34-49)
Chris Bryant attempts a Midrange. Contested by Jalen Turner (5.0 feet, MAN). Chris Bryant misses. Offensive rebound by Dirk Booker! Dirk Booker kicks it out.

[03:42] Team_013 possession (Score: 34-49)
Dirk Booker drives, picks up Shai Ingram. Help arrives from Jalen Turner! Dirk Booker attempts a Dunk. Contested by Jalen Turner (4.4 feet, MAN). DIRK BOOKER MAKES IT! Assist: Jayson Nowitzki
Score: 36-49

[03:27] Team_019 possession (Score: 36-49)
Shai Ingram drives, Dirk Booker stays with him. Shai Ingram attempts a Dunk. Heavily contested by Dirk Booker (0.7 feet, MAN)! SHAI INGRAM MAKES IT! Assist: Gary Ginobili
Score: 36-51

[03:16] Team_013 possession (Score: 36-51)
Gary Iverson attempts a 3Pt. Contested by Blake LaVine (3.8 feet, ZONE). Gary Iverson misses. Rebound secured by Shai Ingram.

[03:04] Team_019 possession (Score: 36-51)
Blake LaVine attempts a 3Pt. Wide open! Vince Nowitzki is 9.3 feet away. [MAN] BLAKE LAVINE MAKES IT!
Score: 36-54

[02:51] Team_013 possession (Score: 36-54)
Chris Bryant drives and kicks out. Gary Iverson attempts a 3Pt. Contested by Blake LaVine (5.6 feet, ZONE). Gary Iverson misses. Rebound secured by Tim Jordan.

[02:35] Team_019 possession (Score: 36-54)
Shai Ingram makes the Layup and draws the foul on Dirk Booker! And-1! Shai Ingram to the line for 1. [Team fouls: 4] (Dirk Booker: 1 personal fouls)   FT 1/1: GOOD Shai Ingram makes 1/1 from the line.
Score: 36-57

[02:23] Team_013 possession (Score: 36-57)
Gary Iverson makes the Midrange and draws the foul on Blake LaVine! And-1! Gary Iverson to the line for 1. [Team fouls: 3] (Blake LaVine: 1 personal fouls)   FT 1/1: GOOD Gary Iverson makes 1/1 from the line.
Score: 39-57

[02:13] Team_019 possession (Score: 39-57)
Jalen Turner attempts a 3Pt. Contested by Gary Iverson (6.0 feet, ZONE). JALEN TURNER MAKES IT! Assist: Gary Ginobili
Score: 39-60

[02:00] Team_013 possession (Score: 39-60)
Dirk Booker drives to the basket... FOUL! Offensive foul on Dirk Booker! Shai Ingram drew the charge! [Team fouls: 5] (Dirk Booker: 2 personal fouls) TURNOVER! (dead ball)

[01:43] Team_019 possession (Score: 39-60)
Jalen Turner attempts a Midrange. Contested by Chris Bryant (5.1 feet, MAN). Jalen Turner misses. Rebound secured by Jayson Nowitzki.

[01:29] Team_013 possession (Score: 39-60)
Dirk Booker makes the Midrange and draws the foul on Blake LaVine! And-1! Dirk Booker to the line for 1. [Team fouls: 4] (Blake LaVine: 2 personal fouls)   FT 1/1: MISS Dirk Booker makes 0/1 from the line. Rebound secured by Tim Jordan.
Score: 41-60

[01:16] Team_019 possession (Score: 41-60)
Jalen Turner attempts a 3Pt. Wide open! Chris Bryant is 6.1 feet away. [MAN] JALEN TURNER MAKES IT! Assist: Shai Ingram
Score: 41-63

[01:01] Team_013 possession (Score: 41-63)
Gary Iverson drives to the basket... Gary Iverson throws a bad pass out of bounds! TURNOVER! (dead ball)

[00:45] Team_019 possession (Score: 41-63)
Gary Ginobili attempts a 3Pt. Wide open! Gary Iverson is 6.4 feet away. [MAN] GARY GINOBILI MAKES IT!
Score: 41-66

[00:32] Team_013 possession (Score: 41-66)
Chris Bryant makes the Layup and draws the foul on Shai Ingram! And-1! Chris Bryant to the line for 1. [BONUS: 5 team fouls] (Shai Ingram: 1 personal fouls)   FT 1/1: GOOD Chris Bryant makes 1/1 from the line.
Score: 44-66

[00:19] Team_019 possession (Score: 44-66)
Blake LaVine drives and kicks out. Blake LaVine attempts a 3Pt. Wide open! Vince Nowitzki is 9.2 feet away. [ZONE] BLAKE LAVINE MAKES IT! Assist: Tim Jordan
Score: 44-69

[00:06] Team_013 possession (Score: 44-69)
Chris Bryant commits a violation (traveling/carry)! TURNOVER! (dead ball)

================================================================================
                              2ND QUARTER COMPLETE                              
================================================================================

2ND QUARTER SCORE: Team_013 22, Team_019 41

BOX SCORE:
================================================================================

Team_013
--------------------------------------------------------------------------------
Player                MIN  PTS  REB  AST  TO      FG   FG%      3P   3P%
--------------------------------------------------------------------------------
Gary Iverson           11    9    0    0   0   3/4    75.0     0/0   0.0
Dirk Booker            11    4    1    0   0   2/7    28.6     0/0   0.0
Chris Bryant           11    3    1    0   0   1/4    25.0     0/0   0.0
Manu Smith             13    2    0    0   0   1/1   100.0     0/0   0.0
Jayson Nowitzki        11    2    2    2   0   1/1   100.0     0/0   0.0
Pau Mobley             13    0    0    1   0   0/0     0.0     0/0   0.0
Jayson Morant          13    0    0    0   0   0/1     0.0     0/0   0.0
Vince Nowitzki         11    0    0    1   0   0/0     0.0     0/0   0.0

TEAM: FG: 8/18 (44.4%), 3PT: 1/3 (33.3%), REB: 4 (1 off, 3 def), AST: 4, TO: 5
TEAM FOULS: 5 [Team_019 in BONUS]


Team_019
--------------------------------------------------------------------------------
Player                MIN  PTS  REB  AST  TO      FG   FG%      3P   3P%
--------------------------------------------------------------------------------
Blake LaVine           11   12    2    0   0   4/4   100.0     0/0   0.0
Jalen Turner           11   11    0    0   0   4/5    80.0     0/0   0.0
Gary Ginobili          11    7    0    3   0   3/4    75.0     0/0   0.0
Shai Ingram            11    7    9    2   0   3/4    75.0     0/0   0.0
D'Angelo Randle        13    2    0    0   0   1/1   100.0     0/0   0.0
DeMar James            13    2    0    0   0   1/1   100.0     0/0   0.0
Tobias Hyland          13    0    1    0   0   0/0     0.0     0/0   0.0
Tim Jordan             11    0    4    2   0   0/0     0.0     0/0   0.0

TEAM: FG: 16/19 (84.2%), 3PT: 7/8 (87.5%), REB: 16 (6 off, 10 def), AST: 7, TO: 3
TEAM FOULS: 5 [Team_013 in BONUS]

================================================================================

================================================================================
                       3RD QUARTER - Team_013 vs Team_019                       
================================================================================

[12:00] Team_013 possession (Score: 44-69)
Jayson Morant attempts a 3Pt. Contested by D'Angelo Randle (3.9 feet, MAN). Jayson Morant misses. Rebound secured by DeMar James.

[11:47] Team_019 possession (Score: 44-69)
DeMar James attempts a Midrange. Wide open! Nikola Curry is 6.7 feet away. [MAN] DEMAR JAMES MAKES IT!
Score: 44-71

[11:33] Team_013 possession (Score: 44-71)
Nikola Curry attempts a Midrange. Contested by DeMar James (3.4 feet, MAN). Nikola Curry misses. Rebound secured by DeMar James.

[11:15] Team_019 possession (Score: 44-71)
Rudy Giddey attempts a 3Pt. Contested by Manu Smith (4.5 feet, ZONE). Rudy Giddey misses. Rebound secured by Desmond Ginobili.

[11:01] Team_013 possession (Score: 44-71)
Pau Mobley attempts a 3Pt. Contested by D'Angelo Randle (5.4 feet, ZONE). Pau Mobley misses. Offensive rebound by Nikola Curry! Nikola Curry kicks it out.

[10:51] Team_013 possession (Score: 44-71)
Jayson Morant attempts a Layup. Contested by D'Angelo Randle (3.0 feet, MAN). JAYSON MORANT MAKES IT! Assist: Nikola Curry
Score: 46-71

[10:40] Team_019 possession (Score: 46-71)
Rudy Giddey drives and kicks out. Brandon James attempts a 3Pt. Contested by Desmond Ginobili (5.1 feet, ZONE). Brandon James misses. Rebound secured by Desmond Ginobili.

[10:23] Team_013 possession (Score: 46-71)
Desmond Ginobili attempts a 3Pt. Wide open! Tobias Hyland is 6.6 feet away. [MAN] DESMOND GINOBILI MAKES IT! Assist: Jayson Morant
Score: 49-71

[10:13] Team_019 possession (Score: 49-71)
DeMar James attempts a Midrange. Contested by Nikola Curry (5.0 feet, MAN). DEMAR JAMES MAKES IT!
Score: 49-73

[10:02] Team_013 possession (Score: 49-73)
Nikola Curry throws a bad pass out of bounds! TURNOVER! (dead ball)

[09:50] Team_019 possession (Score: 49-73)
D'Angelo Randle makes the Layup and draws the foul on Desmond Ginobili! And-1! D'Angelo Randle to the line for 1. [Team fouls: 1] (Desmond Ginobili: 1 personal fouls)   FT 1/1: GOOD D'Angelo Randle makes 1/1 from the line.
Score: 49-76

[09:35] Team_013 possession (Score: 49-76)
Desmond Ginobili attempts a Layup. Contested by DeMar James (4.8 feet, ZONE). Desmond Ginobili misses. Rebound secured by DeMar James.

[09:22] Team_019 possession (Score: 49-76)
Tobias Hyland drives, Desmond Ginobili stays with him. Tobias Hyland attempts a Layup. Contested by Desmond Ginobili (5.1 feet, MAN). TOBIAS HYLAND MAKES IT! Assist: DeMar James
Score: 49-78

[09:05] Team_013 possession (Score: 49-78)
Manu Smith drives to the basket... Manu Smith throws a bad pass out of bounds! TURNOVER! (dead ball)

[08:55] Team_019 possession (Score: 49-78)
DeMar James attempts a Layup. Contested by Nikola Curry (5.9 feet, MAN). DeMar James misses. Offensive rebound by D'Angelo Randle! D'Angelo Randle's putback is no good. Offensive rebound by D'Angelo Randle! D'Angelo Randle kicks it out.

[08:38] Team_019 possession (Score: 49-78)
DeMar James attempts a Layup. Wide open! Nikola Curry is 8.0 feet away. [MAN] DeMar James misses. Rebound secured by Desmond Ginobili.

[08:22] Team_013 possession (Score: 49-78)
Desmond Ginobili attempts a Midrange. Contested by D'Angelo Randle (3.3 feet, ZONE). Desmond Ginobili misses. Offensive rebound by Nikola Curry! Nikola Curry kicks it out.

[08:04] Team_013 possession (Score: 49-78)
Manu Smith attempts a 3Pt. Contested by D'Angelo Randle (5.6 feet, ZONE). Manu Smith misses. Rebound secured by DeMar James.

[07:49] Team_019 possession (Score: 49-78)
DeMar James drives, Desmond Ginobili stays with him. DeMar James attempts a Dunk. Contested by Desmond Ginobili (5.0 feet, ZONE). DEMAR JAMES MAKES IT! Assist: Tobias Hyland
Score: 49-80

[07:33] Team_013 possession (Score: 49-80)
Pau Mobley attempts a Midrange. Wide open! Brandon James is 6.8 feet away. [MAN] PAU MOBLEY MAKES IT! Assist: Nikola Curry
Score: 51-80

[07:16] Team_019 possession (Score: 51-80)
FOUL! Shooting foul on Jayson Morant. D'Angelo Randle to the line for 2 free throws. [Team fouls: 2] (Jayson Morant: 1 personal fouls)   FT 1/2: GOOD   FT 2/2: GOOD D'Angelo Randle makes 2/2 from the line.
Score: 51-82

[07:06] Team_013 possession (Score: 51-82)
Pau Mobley loses control! Ball rolls out of bounds! TURNOVER! (dead ball)

[06:53] Team_019 possession (Score: 51-82)
Brandon James attempts a Midrange. Contested by Pau Mobley (2.1 feet, MAN). Brandon James misses. Rebound secured by Pau Mobley.

[06:37] Team_013 possession (Score: 51-82)
Jayson Morant attempts a 3Pt. Contested by D'Angelo Randle (4.7 feet, MAN). Jayson Morant misses. Rebound secured by Tobias Hyland.

[06:26] Team_019 possession (Score: 51-82)
D'Angelo Randle attempts a Midrange. Contested by Jayson Morant (3.0 feet, MAN). D'Angelo Randle misses. Rebound secured by Nikola Curry.

[06:16] Team_013 possession (Score: 51-82)
Nikola Curry drives, DeMar James stays with him. Nikola Curry attempts a Dunk. Contested by DeMar James (3.4 feet, MAN). Nikola Curry misses. Rebound secured by Tobias Hyland.

[06:01] Team_019 possession (Score: 51-82)
Tobias Hyland attempts a 3Pt. Contested by Desmond Ginobili (5.5 feet, MAN). Tobias Hyland misses. Rebound secured by Pau Mobley.

[05:46] Team_013 possession (Score: 51-82)
Pau Mobley throws a bad pass out of bounds! TURNOVER! (dead ball)

[05:34] Team_019 possession (Score: 51-82)
FOUL! Reach-in foul on Manu Smith during the drive. [Team fouls: 3] No free throws, side out. (Manu Smith: 1 personal fouls)

[05:17] Team_019 possession (Score: 51-82)
Rudy Giddey attempts a Midrange. Heavily contested by Pau Mobley (1.0 feet, ZONE)! Rudy Giddey misses. Rebound secured by Desmond Ginobili.

[05:01] Team_013 possession (Score: 51-82)
Manu Smith attempts a 3Pt. Wide open! Rudy Giddey is 7.7 feet away. [MAN] Manu Smith misses. Rebound secured by D'Angelo Randle.

[04:43] Team_019 possession (Score: 51-82)
Brandon James attempts a Layup. Heavily contested by Pau Mobley (1.3 feet, MAN)! Brandon James misses. Rebound secured by Desmond Ginobili.

[04:29] Team_013 possession (Score: 51-82)
Desmond Ginobili attempts a 3Pt. Contested by Tobias Hyland (5.8 feet, MAN). Desmond Ginobili misses. Rebound secured by D'Angelo Randle.

[04:11] Team_019 possession (Score: 51-82)
DeMar James attempts a 3Pt. Contested by Pau Mobley (3.3 feet, ZONE). DEMAR JAMES MAKES IT! Assist: Rudy Giddey
Score: 51-85

[03:55] Team_013 possession (Score: 51-85)
Manu Smith attempts a 3Pt. Contested by Tobias Hyland (4.6 feet, ZONE). Manu Smith misses. Rebound secured by DeMar James.

[03:37] Team_019 possession (Score: 51-85)
Brandon James commits a violation (traveling/carry)! TURNOVER! (dead ball)

[03:27] Team_013 possession (Score: 51-85)
Manu Smith drives, picks up DeMar James. Help arrives from Brandon James! Manu Smith attempts a Dunk. Contested by Brandon James (4.2 feet, ZONE). MANU SMITH MAKES IT! Assist: Pau Mobley
Score: 53-85

[03:09] Team_019 possession (Score: 53-85)
Tobias Hyland attempts a 3Pt. Contested by Desmond Ginobili (5.4 feet, MAN). Tobias Hyland misses. Rebound secured by Nikola Curry.

[02:53] Team_013 possession (Score: 53-85)
Desmond Ginobili attempts a 3Pt. Contested by D'Angelo Randle (4.3 feet, ZONE). Desmond Ginobili misses. Rebound secured by Tobias Hyland.

[02:40] Team_019 possession (Score: 53-85)
D'Angelo Randle attempts a 3Pt. Wide open! Pau Mobley is 6.0 feet away. [ZONE] D'Angelo Randle misses. Rebound secured by Pau Mobley.

[02:23] Team_013 possession (Score: 53-85)
FOUL! Reach-in foul on Tobias Hyland during the drive. [Team fouls: 1] No free throws, side out. (Tobias Hyland: 1 personal fouls)

[02:07] Team_013 possession (Score: 53-85)
Desmond Ginobili attempts a 3Pt. Wide open! Tobias Hyland is 9.9 feet away. [MAN] Desmond Ginobili misses. Offensive rebound by Nikola Curry! Nikola Curry kicks it out.

[01:51] Team_013 possession (Score: 53-85)
Nikola Curry attempts a Midrange. Contested by D'Angelo Randle (4.5 feet, ZONE). Nikola Curry misses. Rebound secured by D'Angelo Randle.

[01:39] Team_019 possession (Score: 53-85)
Brandon James makes the Dunk and draws the foul on Pau Mobley! And-1! Brandon James to the line for 1. [Team fouls: 4] (Pau Mobley: 1 personal fouls)   FT 1/1: GOOD Brandon James makes 1/1 from the line.
Score: 53-88

[01:20] Team_013 possession (Score: 53-88)
Manu Smith drives to the basket... Manu Smith throws a bad pass out of bounds! TURNOVER! (dead ball)

[01:20] Substitution (Team_013): Manu Smith OUT → Gary Iverson IN (stamina_rule2)

[01:20] Substitution (Team_013): Pau Mobley OUT → Chris Bryant IN (stamina_rule2)

[01:20] Substitution (Team_013): Jayson Morant OUT → Vince Nowitzki IN (stamina_rule2)

[01:20] Substitution (Team_013): Desmond Ginobili OUT → Dirk Booker IN (stamina_rule2)

[01:20] Substitution (Team_013): Nikola Curry OUT → Jayson Nowitzki IN (stamina_rule2)

[01:20] Substitution (Team_019): Rudy Giddey OUT → Gary Ginobili IN (stamina_rule2)

[01:20] Substitution (Team_019): Brandon James OUT → Jalen Turner IN (stamina_rule2)

[01:20] Substitution (Team_019): D'Angelo Randle OUT → Blake LaVine IN (stamina_rule2)

[01:20] Substitution (Team_019): Tobias Hyland OUT → Shai Ingram IN (stamina_rule2)

[01:20] Substitution (Team_019): DeMar James OUT → Tim Jordan IN (stamina_rule2)

[01:09] Team_019 possession (Score: 53-88)
Shai Ingram attempts a 3Pt. Contested by Dirk Booker (5.7 feet, MAN). Shai Ingram misses. Offensive rebound by Tim Jordan! Tim Jordan kicks it out.

[00:55] Team_019 possession (Score: 53-88)
FOUL! Offensive foul on Jalen Turner! Chris Bryant drew the charge! [Team fouls: 2] (Jalen Turner: 1 personal fouls) TURNOVER! (dead ball)

[00:42] Team_013 possession (Score: 53-88)
Vince Nowitzki loses control! Ball rolls out of bounds! TURNOVER! (dead ball)

[00:28] Team_019 possession (Score: 53-88)
Jalen Turner attempts a Layup. Contested by Jayson Nowitzki (4.4 feet, ZONE). Jalen Turner misses. Rebound secured by Jayson Nowitzki.

[00:13] Team_013 possession (Score: 53-88)
Dirk Booker throws a bad pass! Stolen by Shai Ingram! TURNOVER! (live ball)

================================================================================
                              3RD QUARTER COMPLETE                              
================================================================================

3RD QUARTER SCORE: Team_013 9, Team_019 19

BOX SCORE:
================================================================================

Team_013
--------------------------------------------------------------------------------
Player                MIN  PTS  REB  AST  TO      FG   FG%      3P   3P%
--------------------------------------------------------------------------------
Desmond Ginobili       24    3    5    0   0   1/4    25.0     0/0   0.0
Jayson Morant          24    2    0    1   0   1/3    33.3     0/0   0.0
Manu Smith             24    2    0    0   0   1/4    25.0     0/0   0.0
Pau Mobley             24    2    3    1   0   1/1   100.0     0/0   0.0
Nikola Curry           24    0    5    2   0   0/3     0.0     0/0   0.0
Jayson Nowitzki        12    0    1    0   0   0/0     0.0     0/0   0.0

TEAM: FG: 4/15 (26.7%), 3PT: 1/8 (12.5%), REB: 14 (3 off, 11 def), AST: 4, TO: 7
TEAM FOULS: 4


Team_019
--------------------------------------------------------------------------------
Player                MIN  PTS  REB  AST  TO      FG   FG%      3P   3P%
--------------------------------------------------------------------------------
DeMar James            24    9    5    1   0   4/5    80.0     0/0   0.0
D'Angelo Randle        24    5    4    0   0   2/4    50.0     0/0   0.0
Brandon James          24    3    0    0   0   1/3    33.3     0/0   0.0
Tobias Hyland          24    2    3    1   0   1/3    33.3     0/0   0.0
Rudy Giddey            24    0    0    1   0   0/3     0.0     0/0   0.0
Tim Jordan             12    0    1    0   0   0/0     0.0     0/0   0.0
Jalen Turner           12    0    0    0   0   0/1     0.0     0/0   0.0

TEAM: FG: 8/19 (42.1%), 3PT: 1/5 (20.0%), REB: 13 (2 off, 11 def), AST: 3, TO: 2
TEAM FOULS: 2

================================================================================

================================================================================
                       4TH QUARTER - Team_013 vs Team_019                       
================================================================================

[12:00] Substitution (Team_013): Manu Smith OUT (stamina: 77) → Gary Iverson IN (comeback_detected)

[12:00] Substitution (Team_019): Rudy Giddey OUT (stamina: 75) → Gary Ginobili IN (comeback_detected)

[12:00] Team_013 possession (Score: 53-88)
Nikola Curry attempts a Midrange. Wide open! Tobias Hyland is 7.5 feet away. [ZONE] Nikola Curry misses. Offensive rebound by Nikola Curry! Nikola Curry kicks it out.

[11:46] Team_013 possession (Score: 53-88)
Pau Mobley attempts a 3Pt. Wide open! Brandon James is 7.5 feet away. [MAN] PAU MOBLEY MAKES IT!
Score: 56-88

[11:37] Team_019 possession (Score: 56-88)
D'Angelo Randle attempts a 3Pt. Contested by Jayson Morant (4.9 feet, MAN). D'Angelo Randle misses. Rebound secured by Pau Mobley.

[11:18] Team_013 possession (Score: 56-88)
Gary Iverson drives, DeMar James stays with him. Gary Iverson attempts a Layup. Wide open! DeMar James is 8.0 feet away. [ZONE] Gary Iverson misses. Rebound secured by DeMar James.

[11:01] Team_019 possession (Score: 56-88)
Gary Ginobili drives and kicks out. DeMar James attempts a Midrange. Contested by Nikola Curry (4.6 feet, MAN). DeMar James misses. Rebound secured by Nikola Curry.

[10:47] Team_013 possession (Score: 56-88)
Jayson Morant loses control! Ball rolls out of bounds! TURNOVER! (dead ball)

[10:47] Substitution (Team_013): Jayson Morant OUT → Vince Nowitzki IN (stamina_rule2)

[10:47] Substitution (Team_013): Desmond Ginobili OUT → Dirk Booker IN (stamina_rule2)

[10:47] Substitution (Team_013): Nikola Curry OUT → Jayson Nowitzki IN (stamina_rule2)

[10:47] Substitution (Team_019): Brandon James OUT → Jalen Turner IN (stamina_rule2)

[10:47] Substitution (Team_019): D'Angelo Randle OUT → Blake LaVine IN (stamina_rule2)

[10:47] Substitution (Team_019): Tobias Hyland OUT → Shai Ingram IN (stamina_rule2)

[10:47] Substitution (Team_019): DeMar James OUT → Tim Jordan IN (stamina_rule2)

[10:33] Team_019 possession (Score: 56-88)
Jalen Turner attempts a Midrange. Contested by Pau Mobley (3.7 feet, MAN). Jalen Turner misses. Offensive rebound by Shai Ingram! Shai Ingram kicks it out.

[10:16] Team_019 possession (Score: 56-88)
Blake LaVine attempts a Midrange. Contested by Dirk Booker (3.5 feet, ZONE). Blake LaVine misses. Rebound secured by Dirk Booker.

[10:02] Team_013 possession (Score: 56-88)
Vince Nowitzki drives and kicks out. Dirk Booker attempts a 3Pt. Contested by Shai Ingram (4.5 feet, MAN). Dirk Booker misses. Rebound secured by Shai Ingram.

[09:49] Team_019 possession (Score: 56-88)
FOUL! Shooting foul on Vince Nowitzki. Blake LaVine to the line for 2 free throws. [Team fouls: 1] (Vince Nowitzki: 1 personal fouls)   FT 1/2: MISS   FT 2/2: GOOD Blake LaVine makes 1/2 from the line.
Score: 56-89

[09:35] Team_013 possession (Score: 56-89)
Dirk Booker attempts a Midrange. Contested by Jalen Turner (3.5 feet, ZONE). Dirk Booker misses. Rebound secured by Tim Jordan.

[09:21] Team_019 possession (Score: 56-89)
Jalen Turner attempts a 3Pt. Contested by Pau Mobley (5.0 feet, ZONE). Jalen Turner misses. Rebound secured by Dirk Booker.

[09:10] Team_013 possession (Score: 56-89)
Dirk Booker throws a bad pass out of bounds! TURNOVER! (dead ball)

[09:10] Substitution (Team_013): Pau Mobley OUT → Chris Bryant IN (stamina_rule2)

[08:59] Team_019 possession (Score: 56-89)
FOUL! Shooting foul on Chris Bryant. Shai Ingram to the line for 3 free throws. [Team fouls: 2] (Chris Bryant: 1 personal fouls)   FT 1/3: GOOD   FT 2/3: GOOD   FT 3/3: MISS Shai Ingram makes 2/3 from the line. Offensive rebound by Shai Ingram! Shai Ingram kicks it out.
Score: 56-91

[08:45] Team_019 possession (Score: 56-91)
Shai Ingram makes the Layup and draws the foul on Dirk Booker! And-1! Shai Ingram to the line for 1. [Team fouls: 3] (Dirk Booker: 1 personal fouls)   FT 1/1: GOOD Shai Ingram makes 1/1 from the line.
Score: 56-94

[08:32] Team_013 possession (Score: 56-94)
Dirk Booker drives to the basket... Dirk Booker loses control! Ball rolls out of bounds! TURNOVER! (dead ball)

[08:15] Team_019 possession (Score: 56-94)
Shai Ingram attempts a 3Pt. Heavily contested by Dirk Booker (1.9 feet, MAN)! Shai Ingram misses. Offensive rebound by Shai Ingram! Shai Ingram kicks it out.

[08:01] Team_019 possession (Score: 56-94)
Gary Ginobili attempts a Midrange. Wide open! Gary Iverson is 7.3 feet away. [MAN] Gary Ginobili misses. Rebound secured by Dirk Booker.

[07:49] Team_013 possession (Score: 56-94)
Chris Bryant attempts a 3Pt. Contested by Jalen Turner (3.3 feet, MAN). Chris Bryant misses. Rebound secured by Shai Ingram.

[07:35] Team_019 possession (Score: 56-94)
FOUL! Holding foul on Gary Iverson. [Team fouls: 4] No free throws, side out. (Gary Iverson: 1 personal fouls)

[07:23] Team_019 possession (Score: 56-94)
Blake LaVine attempts a Layup. Wide open! Vince Nowitzki is 6.7 feet away. [MAN] BLAKE LAVINE MAKES IT! Assist: Jalen Turner
Score: 56-96

[07:07] Team_013 possession (Score: 56-96)
Dirk Booker attempts a 3Pt. Contested by Blake LaVine (5.0 feet, ZONE). Dirk Booker misses. Rebound secured by Shai Ingram.

[06:54] Team_019 possession (Score: 56-96)
Shai Ingram drives, picks up Dirk Booker. Help arrives from Gary Iverson! Shai Ingram attempts a Dunk. Contested by Gary Iverson (4.0 feet, MAN). SHAI INGRAM MAKES IT! Assist: Blake LaVine
Score: 56-98

[06:36] Team_013 possession (Score: 56-98)
Jayson Nowitzki attempts a 3Pt. Contested by Shai Ingram (4.6 feet, MAN). Jayson Nowitzki misses. Rebound secured by Shai Ingram.

[06:22] Team_019 possession (Score: 56-98)
Blake LaVine attempts a Midrange. Contested by Vince Nowitzki (5.9 feet, MAN). Blake LaVine misses. Offensive rebound by Tim Jordan! Tim Jordan kicks it out.

[06:04] Team_019 possession (Score: 56-98)
Jalen Turner drives, Chris Bryant stays with him. Jalen Turner attempts a Dunk. Contested by Chris Bryant (4.6 feet, MAN). Jalen Turner misses. Rebound secured by Jayson Nowitzki.

[05:52] Team_013 possession (Score: 56-98)
Chris Bryant attempts a 3Pt. Heavily contested by Blake LaVine (2.0 feet, ZONE)! Chris Bryant misses. Rebound secured by Blake LaVine.

[05:42] Team_019 possession (Score: 56-98)
Blake LaVine attempts a 3Pt. Contested by Vince Nowitzki (5.8 feet, MAN). Blake LaVine misses. Rebound secured by Dirk Booker.

[05:27] Team_013 possession (Score: 56-98)
Vince Nowitzki makes the Dunk and draws the foul on Shai Ingram! And-1! Vince Nowitzki to the line for 1. [Team fouls: 1] (Shai Ingram: 1 personal fouls)   FT 1/1: GOOD Vince Nowitzki makes 1/1 from the line.
Score: 59-98

[05:13] Team_019 possession (Score: 59-98)
Jalen Turner attempts a 3Pt. Contested by Chris Bryant (2.2 feet, MAN). Jalen Turner misses. Rebound secured by Chris Bryant.

[05:02] Team_013 possession (Score: 59-98)
Dirk Booker commits a violation (traveling/carry)! TURNOVER! (dead ball)

[04:44] Team_019 possession (Score: 59-98)
Gary Ginobili attempts a 3Pt. Wide open! Chris Bryant is 7.1 feet away. [ZONE] Gary Ginobili misses. Offensive rebound by Tim Jordan! Tim Jordan kicks it out.

[04:31] Team_019 possession (Score: 59-98)
Tim Jordan drives and kicks out. Tim Jordan attempts a 3Pt. Contested by Gary Iverson (6.0 feet, ZONE). Tim Jordan misses. FOUL! Loose ball foul on Jayson Nowitzki during the rebound battle. [IN THE BONUS! 5 team fouls] Tim Jordan to the line for 2 free throws. (Jayson Nowitzki: 1 personal fouls)   FT 1/2: GOOD   FT 2/2: GOOD Tim Jordan makes 2/2 from the line.
Score: 59-100

[04:13] Team_013 possession (Score: 59-100)
Jayson Nowitzki drives and kicks out. Dirk Booker attempts a Midrange. Contested by Shai Ingram (4.5 feet, MAN). Dirk Booker misses. Rebound secured by Shai Ingram.

[04:01] Team_019 possession (Score: 59-100)
Blake LaVine drives, picks up Vince Nowitzki. Help arrives from Chris Bryant! Blake LaVine attempts a Layup. Wide open! Chris Bryant is 6.7 feet away. [MAN] BLAKE LAVINE MAKES IT!
Score: 59-102

[03:45] Team_013 possession (Score: 59-102)
Gary Iverson attempts a 3Pt. Wide open! Gary Ginobili is 6.3 feet away. [MAN] Gary Iverson misses. Rebound secured by Tim Jordan.

[03:29] Team_019 possession (Score: 59-102)
Tim Jordan drives, Dirk Booker stays with him. Tim Jordan attempts a Layup. Contested by Dirk Booker (4.7 feet, MAN). Tim Jordan misses. Rebound secured by Chris Bryant.

[03:19] Team_013 possession (Score: 59-102)
Gary Iverson attempts a 3Pt. Contested by Blake LaVine (4.1 feet, ZONE). GARY IVERSON MAKES IT!
Score: 62-102

[03:03] Team_019 possession (Score: 62-102)
Tim Jordan attempts a Layup. Contested by Dirk Booker (3.1 feet, MAN). TIM JORDAN MAKES IT!
Score: 62-104

[02:49] Team_013 possession (Score: 62-104)
Gary Iverson attempts a 3Pt. Wide open! Blake LaVine is 7.4 feet away. [ZONE] Gary Iverson misses. Offensive rebound by Dirk Booker! Dirk Booker kicks it out.

[02:34] Team_013 possession (Score: 62-104)
Chris Bryant attempts a Layup. Contested by Shai Ingram (5.6 feet, ZONE). CHRIS BRYANT MAKES IT!
Score: 64-104

[02:19] Team_019 possession (Score: 64-104)
Tim Jordan drives, Jayson Nowitzki stays with him. Tim Jordan attempts a Dunk. Contested by Jayson Nowitzki (5.3 feet, ZONE). TIM JORDAN MAKES IT! Assist: Jalen Turner
Score: 64-106

[02:07] Team_013 possession (Score: 64-106)
Dirk Booker drives, Shai Ingram stays with him. Dirk Booker attempts a Dunk. Heavily contested by Shai Ingram (0.5 feet, MAN)! DIRK BOOKER MAKES IT!
Score: 66-106

[01:55] Team_019 possession (Score: 66-106)
Jalen Turner attempts a Layup. Contested by Jayson Nowitzki (5.5 feet, ZONE). JALEN TURNER MAKES IT! Assist: Gary Ginobili
Score: 66-108

[01:44] Team_013 possession (Score: 66-108)
Jayson Nowitzki drives to the basket... Jayson Nowitzki throws a bad pass! Stolen by Shai Ingram! TURNOVER! (live ball)

[01:31] Team_019 possession (Score: 66-108)
Tim Jordan drives and kicks out. Blake LaVine attempts a 3Pt. Contested by Chris Bryant (5.9 feet, ZONE). Blake LaVine misses. Rebound secured by Jayson Nowitzki.

[01:18] Team_013 possession (Score: 66-108)
Chris Bryant attempts a 3Pt. Contested by Blake LaVine (3.6 feet, ZONE). CHRIS BRYANT MAKES IT! Assist: Jayson Nowitzki
Score: 69-108

[01:06] Team_019 possession (Score: 69-108)
Shai Ingram attempts a Layup. BLOCKED BY JAYSON NOWITZKI! Ball goes out off Jayson Nowitzki. Shai Ingram's ball!

[00:52] Team_019 possession (Score: 69-108)
Tim Jordan attempts a 3Pt. Wide open! Chris Bryant is 6.3 feet away. [ZONE] Tim Jordan misses. Rebound secured by Dirk Booker.

[00:38] Team_013 possession (Score: 69-108)
Gary Iverson attempts a 3Pt. Wide open! Gary Ginobili is 9.8 feet away. [MAN] Gary Iverson misses. FOUL! Loose ball foul on Blake LaVine during the rebound battle. [Team fouls: 2] No free throws, side out. (Blake LaVine: 1 personal fouls)

[00:25] Team_013 possession (Score: 69-108)
FOUL! Holding foul on Gary Ginobili. [Team fouls: 3] No free throws, side out. (Gary Ginobili: 1 personal fouls)

[00:12] Team_013 possession (Score: 69-108)
Gary Iverson attempts a Layup. Contested by Gary Ginobili (4.2 feet, MAN). GARY IVERSON MAKES IT!
Score: 71-108

================================================================================
                              4TH QUARTER COMPLETE                              
================================================================================

4TH QUARTER SCORE: Team_013 18, Team_019 20

BOX SCORE:
================================================================================

Team_013
--------------------------------------------------------------------------------
Player                MIN  PTS  REB  AST  TO      FG   FG%      3P   3P%
--------------------------------------------------------------------------------
Gary Iverson           24    5    0    0   0   2/4    50.0     0/0   0.0
Chris Bryant           21    5    2    0   0   2/4    50.0     0/0   0.0
Pau Mobley             27    3    1    0   0   1/1   100.0     0/0   0.0
Vince Nowitzki         23    3    0    0   0   1/2    50.0     0/0   0.0
Dirk Booker            23    2    6    0   0   1/3    33.3     0/0   0.0
Nikola Curry           26    0    2    0   0   0/0     0.0     0/0   0.0
Jayson Nowitzki        23    0    3    1   0   0/2     0.0     0/0   0.0

TEAM: FG: 7/16 (43.8%), 3PT: 3/8 (37.5%), REB: 14 (3 off, 11 def), AST: 1, TO: 5
TEAM FOULS: 5 [Team_019 in BONUS]


Team_019
--------------------------------------------------------------------------------
Player                MIN  PTS  REB  AST  TO      FG   FG%      3P   3P%
--------------------------------------------------------------------------------
Tim Jordan             23    6    4    0   0   3/6    50.0     0/0   0.0
Shai Ingram            23    5    8    0   0   2/2   100.0     0/0   0.0
Blake LaVine           23    5    1    1   0   3/5    60.0     0/0   0.0
Jalen Turner           23    2    0    2   0   1/4    25.0     0/0   0.0
D'Angelo Randle        26    0    0    0   0   0/1     0.0     0/0   0.0
DeMar James            26    0    1    0   0   0/0     0.0     0/0   0.0
Gary Ginobili          24    0    0    1   0   0/2     0.0     0/0   0.0

TEAM: FG: 9/20 (45.0%), 3PT: 0/5 (0.0%), REB: 14 (5 off, 9 def), AST: 4, TO: 0
TEAM FOULS: 3

================================================================================

================================================================================
                               FULL GAME COMPLETE                               
================================================================================

FINAL SCORE: Team_013 71, Team_019 108

SCORING BY QUARTER:
--------------------------------------------------------------------------------
Team                     Q1     Q2     Q3     Q4    FINAL
--------------------------------------------------------------------------------
Team_013                 22     22      9     18       71
Team_019                 28     41     19     20      108
--------------------------------------------------------------------------------

FULL GAME BOX SCORE:
================================================================================

Team_013
--------------------------------------------------------------------------------
Player                MIN  PTS  REB  AST  TO      FG   FG%      3P   3P%      FT STL BLK
--------------------------------------------------------------------------------
Pau Mobley             27    9   10    2   3   4/5    80.0   1/1   100.0   0/0     0   0
Jayson Morant          26   11    0    2   1   5/12   41.7   1/4    25.0   3/5     0   0
Desmond Ginobili       26    5    7    0   3   2/5    40.0   1/3    33.3   0/0     0   0
Nikola Curry           26    2    9    2   1   1/7    14.3   0/0     0.0   2/2     0   0
Gary Iverson           24   14    0    0   1   4/7    57.1   2/4    50.0   1/1     0   0
Manu Smith             24    8    0    3   3   4/8    50.0   0/4     0.0   0/0     0   0
Vince Nowitzki         23    3    0    1   3   1/2    50.0   0/0     0.0   1/1     1   0
Dirk Booker            23    6    7    0   4   3/10   30.0   0/1     0.0   2/3     0   0
Jayson Nowitzki        23    2    6    3   0   1/3    33.3   0/1     0.0   0/0     0   2
Chris Bryant           21    8    3    0   2   4/9    44.4   1/3    33.3   1/1     0   0

TEAM: FG: 29/68 (42.6%), 3PT: 6/21 (28.6%), REB: 41 (9 off, 32 def), AST: 13, TO: 21


Team_019
--------------------------------------------------------------------------------
Player                MIN  PTS  REB  AST  TO      FG   FG%      3P   3P%      FT STL BLK
--------------------------------------------------------------------------------
Brandon James          26    8    0    1   3   3/5    60.0   0/0     0.0   2/2     0   1
D'Angelo Randle        26   11    8    0   0   5/10   50.0   0/4     0.0   5/5     0   0
Tobias Hyland          26    2    7    3   1   1/4    25.0   0/3     0.0   0/0     1   0
DeMar James            26   18    8    3   0   8/11   72.7   2/3    66.7   0/0     1   0
Gary Ginobili          24    7    0    4   1   2/5    40.0   1/1   100.0   0/0     0   0
Rudy Giddey            24   12    0    2   0   4/10   40.0   1/4    25.0   3/3     0   0
Jalen Turner           23   13    0    2   1   5/10   50.0   3/5    60.0   0/0     1   0
Blake LaVine           23   17    3    1   1   7/9    77.8   3/4    75.0   4/5     0   0
Shai Ingram            23   12   17    2   1   5/6    83.3   0/1     0.0   6/7     2   0
Tim Jordan             23    6    9    2   0   4/7    57.1   0/1     0.0   2/2     0   0

TEAM: FG: 45/78 (57.7%), 3PT: 10/26 (38.5%), REB: 53 (14 off, 39 def), AST: 20, TO: 8

================================================================================
