================================================================================
                        FULL GAME - Team_048 vs Team_065                        
================================================================================

================================================================================
                       1ST QUARTER - Team_048 vs Team_065                       
================================================================================

[12:00] Team_048 possession (Score: 0-0)
Karl Johnson attempts a Midrange. Contested by Paul Williamson (2.8 feet, MAN). Karl Johnson misses. Offensive rebound by Kevin Fox! Kevin Fox kicks it out.

[11:46] Team_048 possession (Score: 0-0)
Karl Johnson attempts a 3Pt. Contested by RJ Harden (6.0 feet, ZONE). KARL JOHNSON MAKES IT! Assist: Paolo Rozier
Score: 3-0

[11:31] Team_065 possession (Score: 3-0)
Karl Booker attempts a 3Pt. Heavily contested by Dejounte Sexton (0.9 feet, ZONE)! Karl Booker misses. Offensive rebound by Manu McGrady! Manu McGrady kicks it out.

[11:16] Team_065 possession (Score: 3-0)
Karl Booker drives to the basket... Karl Booker loses control! Ball rolls out of bounds! TURNOVER! (dead ball)

[11:05] Team_048 possession (Score: 3-0)
Dejounte Sexton attempts a Layup. Wide open! Karl Booker is 6.3 feet away. [ZONE] DEJOUNTE SEXTON MAKES IT! Assist: Paolo Rozier
Score: 5-0

[10:46] Team_065 possession (Score: 5-0)
Manu McGrady commits a violation (traveling/carry)! TURNOVER! (dead ball)

[10:32] Team_048 possession (Score: 5-0)
Karl Johnson attempts a 3Pt. Contested by Paul Williamson (3.4 feet, MAN). KARL JOHNSON MAKES IT! Assist: Damian Mobley
Score: 8-0

[10:18] Team_065 possession (Score: 8-0)
Manu McGrady drives and kicks out. RJ Harden attempts a 3Pt. Heavily contested by Paolo Rozier (0.5 feet, MAN)! RJ Harden misses. Rebound secured by Damian Mobley.

[10:01] Team_048 possession (Score: 8-0)
Dejounte Sexton attempts a 3Pt. Contested by Manu McGrady (5.9 feet, MAN). DEJOUNTE SEXTON MAKES IT! Assist: Kevin Fox
Score: 11-0

[09:48] Team_065 possession (Score: 11-0)
Paul Williamson drives, Kevin Fox stays with him. Paul Williamson attempts a Dunk. Heavily contested by Kevin Fox (1.2 feet, ZONE)! PAUL WILLIAMSON MAKES IT! Assist: Russell Wade
Score: 11-2

[09:32] Team_048 possession (Score: 11-2)
Paolo Rozier attempts a 3Pt. Contested by RJ Harden (3.6 feet, ZONE). Paolo Rozier misses. Rebound secured by Manu McGrady.

[09:15] Team_065 possession (Score: 11-2)
Paul Williamson attempts a 3Pt. Contested by Karl Johnson (3.7 feet, MAN). Paul Williamson misses. Offensive rebound by Russell Wade! Russell Wade puts it back in!
Score: 11-4

[09:00] Team_048 possession (Score: 11-4)
Dejounte Sexton attempts a 3Pt. Contested by RJ Harden (3.6 feet, ZONE). DEJOUNTE SEXTON MAKES IT! Assist: Damian Mobley
Score: 14-4

[08:42] Team_065 possession (Score: 14-4)
RJ Harden attempts a 3Pt. Contested by Dejounte Sexton (2.7 feet, ZONE). RJ HARDEN MAKES IT!
Score: 14-7

[08:28] Team_048 possession (Score: 14-7)
Damian Mobley drives and kicks out. Dejounte Sexton attempts a 3Pt. Wide open! Manu McGrady is 6.7 feet away. [MAN] Dejounte Sexton misses. FOUL! Loose ball foul on Manu McGrady during the rebound battle. [Team fouls: 1] No free throws, side out. (Manu McGrady: 1 personal fouls)

[08:09] Team_048 possession (Score: 14-7)
Kevin Fox attempts a Layup. Contested by Russell Wade (3.2 feet, ZONE). KEVIN FOX MAKES IT! Assist: Karl Johnson
Score: 16-7

[07:50] Team_065 possession (Score: 16-7)
Russell Wade attempts a Midrange. Wide open! Kevin Fox is 6.3 feet away. [ZONE] RUSSELL WADE MAKES IT!
Score: 16-9

[07:34] Team_048 possession (Score: 16-9)
FOUL! Reach-in foul on Russell Wade during the drive. [Team fouls: 2] No free throws, side out. (Russell Wade: 1 personal fouls)

[07:15] Team_048 possession (Score: 16-9)
Damian Mobley attempts a 3Pt. Contested by RJ Harden (3.6 feet, ZONE). DAMIAN MOBLEY MAKES IT! Assist: Karl Johnson
Score: 19-9

[07:02] Team_065 possession (Score: 19-9)
FOUL! Holding foul on Kevin Fox. [Team fouls: 1] No free throws, side out. (Kevin Fox: 1 personal fouls)

[06:49] Team_065 possession (Score: 19-9)
Manu McGrady attempts a Midrange. Contested by Dejounte Sexton (2.4 feet, MAN). MANU MCGRADY MAKES IT! Assist: RJ Harden
Score: 19-11

[06:35] Team_048 possession (Score: 19-11)
Paolo Rozier attempts a 3Pt. Contested by RJ Harden (3.8 feet, ZONE). Paolo Rozier misses. Rebound secured by Russell Wade.

[06:24] Team_065 possession (Score: 19-11)
Manu McGrady makes the Layup and draws the foul on Dejounte Sexton! And-1! Manu McGrady to the line for 1. [Team fouls: 2] (Dejounte Sexton: 1 personal fouls)   FT 1/1: GOOD Manu McGrady makes 1/1 from the line.
Score: 19-14

[06:11] Team_048 possession (Score: 19-14)
Paolo Rozier attempts a 3Pt. Contested by RJ Harden (4.7 feet, MAN). Paolo Rozier misses. Rebound secured by Russell Wade.

[05:59] Team_065 possession (Score: 19-14)
Karl Booker attempts a 3Pt. Contested by Dejounte Sexton (2.2 feet, ZONE). Karl Booker misses. Offensive rebound by Russell Wade! Russell Wade's putback is no good. Rebound secured by Dejounte Sexton.

[05:43] Team_048 possession (Score: 19-14)
Karl Johnson attempts a 3Pt. Heavily contested by RJ Harden (1.9 feet, ZONE)! Karl Johnson misses. Offensive rebound by Kevin Fox! Kevin Fox kicks it out.

[05:33] Team_048 possession (Score: 19-14)
Karl Johnson loses control! Ball rolls out of bounds! TURNOVER! (dead ball)

[05:18] Team_065 possession (Score: 19-14)
Russell Wade attempts a Layup. BLOCKED BY KEVIN FOX! Ball is loose! Rebound secured by Dejounte Sexton.

[05:06] Team_048 possession (Score: 19-14)
Damian Mobley drives to the basket... Damian Mobley loses the ball! Stripped by Russell Wade! TURNOVER! (live ball)

[04:53] Team_065 possession (Score: 19-14)
Karl Booker throws a bad pass out of bounds! TURNOVER! (dead ball)

[04:39] Team_048 possession (Score: 19-14)
Dejounte Sexton attempts a Layup. Heavily contested by Russell Wade (0.5 feet, ZONE)! DEJOUNTE SEXTON MAKES IT! Assist: Paolo Rozier
Score: 21-14

[04:25] Team_065 possession (Score: 21-14)
Manu McGrady attempts a 3Pt. Heavily contested by Dejounte Sexton (1.0 feet, ZONE)! Manu McGrady misses. Rebound secured by Damian Mobley.

[04:13] Team_048 possession (Score: 21-14)
Dejounte Sexton attempts a 3Pt. Contested by Manu McGrady (3.4 feet, MAN). Dejounte Sexton misses. Rebound secured by Russell Wade.

[04:00] Team_065 possession (Score: 21-14)
RJ Harden attempts a 3Pt. Contested by Dejounte Sexton (2.6 feet, ZONE). RJ Harden misses. Offensive rebound by Russell Wade! Russell Wade's putback is no good. Rebound secured by Dejounte Sexton.

[03:42] Team_048 possession (Score: 21-14)
Karl Johnson attempts a 3Pt. Contested by Paul Williamson (3.8 feet, MAN). Karl Johnson misses. Offensive rebound by Kevin Fox! Kevin Fox kicks it out.

[03:31] Team_048 possession (Score: 21-14)
Paolo Rozier commits a violation (traveling/carry)! TURNOVER! (dead ball)

[03:21] Team_065 possession (Score: 21-14)
Russell Wade attempts a Midrange. Wide open! Kevin Fox is 7.2 feet away. [MAN] Russell Wade misses. Offensive rebound by Russell Wade! Russell Wade puts it back in!
Score: 21-16

[03:06] Team_048 possession (Score: 21-16)
Dejounte Sexton drives to the basket... FOUL! Offensive foul on Dejounte Sexton! Manu McGrady drew the charge! [Team fouls: 3] (Dejounte Sexton: 2 personal fouls) TURNOVER! (dead ball)

[02:47] Team_065 possession (Score: 21-16)
FOUL! Shooting foul on Karl Johnson. Paul Williamson to the line for 3 free throws. [Team fouls: 4] (Karl Johnson: 1 personal fouls)   FT 1/3: GOOD   FT 2/3: GOOD   FT 3/3: GOOD Paul Williamson makes 3/3 from the line.
Score: 21-19

[02:36] Team_048 possession (Score: 21-19)
Damian Mobley attempts a Layup. Contested by Russell Wade (4.0 feet, MAN). DAMIAN MOBLEY MAKES IT! Assist: Kevin Fox
Score: 23-19

[02:19] Team_065 possession (Score: 23-19)
Paul Williamson throws a bad pass out of bounds! TURNOVER! (dead ball)

[02:19] Substitution (Team_048): Paolo Rozier OUT → Lauri Curry IN (stamina_rule2)

[02:19] Substitution (Team_048): Karl Johnson OUT → Yao Booker IN (stamina_rule2)

[02:19] Substitution (Team_048): Kevin Fox OUT → DeMar Hyland IN (stamina_rule2)

[02:19] Substitution (Team_048): Damian Mobley OUT → Gary Giddey IN (stamina_rule2)

[02:19] Substitution (Team_065): Manu McGrady OUT → D'Angelo Porzingis IN (stamina_rule2)

[02:19] Substitution (Team_065): Karl Booker OUT → Vince Mobley IN (stamina_rule2)

[02:00] Team_048 possession (Score: 23-19)
Yao Booker attempts a Layup. Contested by Russell Wade (2.0 feet, ZONE). Yao Booker misses. Rebound secured by Vince Mobley.

[01:46] Team_065 possession (Score: 23-19)
Paul Williamson attempts a 3Pt. Heavily contested by Dejounte Sexton (1.4 feet, ZONE)! Paul Williamson misses. Rebound secured by Gary Giddey.

[01:31] Team_048 possession (Score: 23-19)
Dejounte Sexton loses the ball! Stripped by D'Angelo Porzingis! TURNOVER! (live ball)

[01:17] Team_065 possession (Score: 23-19)
Vince Mobley loses the ball! Stripped by DeMar Hyland! TURNOVER! (live ball)

[01:07] Team_048 possession (Score: 23-19)
FOUL! Shooting foul on Paul Williamson. Yao Booker to the line for 2 free throws. [Team fouls: 3] (Paul Williamson: 1 personal fouls)   FT 1/2: GOOD   FT 2/2: GOOD Yao Booker makes 2/2 from the line.
Score: 25-19

[00:56] Team_065 possession (Score: 25-19)
Russell Wade attempts a Layup. Contested by DeMar Hyland (4.9 feet, ZONE). Russell Wade misses. Rebound secured by DeMar Hyland.

[00:40] Team_048 possession (Score: 25-19)
Gary Giddey throws a bad pass out of bounds! TURNOVER! (dead ball)

[00:40] Substitution (Team_048): Dejounte Sexton OUT → Kyle Irving IN (stamina_rule2)

[00:40] Substitution (Team_065): RJ Harden OUT → Paul Curry IN (stamina_rule2)

[00:40] Substitution (Team_065): Paul Williamson OUT → Derrick Poole IN (stamina_rule2)

[00:40] Substitution (Team_065): Russell Wade OUT → Karl Leonard IN (stamina_rule2)

[00:29] Team_065 possession (Score: 25-19)
Derrick Poole attempts a Midrange. Wide open! Yao Booker is 7.3 feet away. [MAN] DERRICK POOLE MAKES IT!
Score: 25-21

[00:14] Team_048 possession (Score: 25-21)
Lauri Curry attempts a Midrange. Contested by Derrick Poole (5.9 feet, ZONE). LAURI CURRY MAKES IT!
Score: 27-21

================================================================================
                              1ST QUARTER COMPLETE                              
================================================================================

1ST QUARTER SCORE: Team_048 27, Team_065 21

BOX SCORE:
================================================================================

Team_048
--------------------------------------------------------------------------------
Player                MIN  PTS  REB  AST  TO      FG   FG%      3P   3P%
--------------------------------------------------------------------------------
Karl Johnson           10    6    0    2   0   2/2   100.0     0/0   0.0
Damian Mobley          10    5    2    2   0   2/2   100.0     0/0   0.0
Kevin Fox              10    2    4    2   0   1/1   100.0     0/0   0.0
Yao Booker              2    2    0    0   0   1/2    50.0     0/0   0.0
Lauri Curry             2    2    0    0   0   1/1   100.0     0/0   0.0
Paolo Rozier           10    0    0    3   0   0/3     0.0     0/0   0.0
Gary Giddey             2    0    1    0   0   0/0     0.0     0/0   0.0
DeMar Hyland            2    0    1    0   0   0/0     0.0     0/0   0.0

TEAM: FG: 11/16 (68.8%), 3PT: 5/9 (55.6%), REB: 9 (4 off, 5 def), AST: 9, TO: 6
TEAM FOULS: 4


Team_065
--------------------------------------------------------------------------------
Player                MIN  PTS  REB  AST  TO      FG   FG%      3P   3P%
--------------------------------------------------------------------------------
Dejounte Sexton        12   10    3    0   0   4/5    80.0     0/0   0.0
Russell Wade           12    6    5    1   0   3/5    60.0     0/0   0.0
Manu McGrady           10    5    2    0   0   2/4    50.0     0/0   0.0
Paul Williamson        12    5    0    0   0   2/3    66.7     0/0   0.0
RJ Harden              12    3    0    1   0   1/2    50.0     0/0   0.0
Derrick Poole           1    2    0    0   0   1/1   100.0     0/0   0.0
Karl Booker            10    0    0    0   0   0/1     0.0     0/0   0.0
Vince Mobley            2    0    1    0   0   0/0     0.0     0/0   0.0

TEAM: FG: 9/16 (56.2%), 3PT: 3/7 (42.9%), REB: 10 (5 off, 5 def), AST: 2, TO: 5
TEAM FOULS: 3

================================================================================

================================================================================
                       2ND QUARTER - Team_048 vs Team_065                       
================================================================================

[12:00] Team_048 possession (Score: 27-21)
Paolo Rozier attempts a 3Pt. Contested by RJ Harden (3.2 feet, ZONE). Paolo Rozier misses. Offensive rebound by Damian Mobley! Damian Mobley puts it back in!
Score: 29-21

[11:46] Team_065 possession (Score: 29-21)
Karl Booker drives to the basket... Karl Booker loses the ball! Stripped by Kevin Fox! TURNOVER! (live ball)

[11:36] Team_048 possession (Score: 29-21)
Kevin Fox drives, Russell Wade stays with him. Kevin Fox attempts a Layup. Heavily contested by Russell Wade (0.5 feet, ZONE)! KEVIN FOX MAKES IT! Assist: Damian Mobley
Score: 31-21

[11:18] Team_065 possession (Score: 31-21)
Karl Booker drives and kicks out. Russell Wade attempts a 3Pt. Contested by Kevin Fox (2.6 feet, ZONE). Russell Wade misses. Rebound secured by Dejounte Sexton.

[11:02] Team_048 possession (Score: 31-21)
FOUL! Holding foul on Russell Wade. [Team fouls: 1] No free throws, side out. (Russell Wade: 1 personal fouls)

[10:48] Team_048 possession (Score: 31-21)
Karl Johnson loses the ball! Stripped by Paul Williamson! TURNOVER! (live ball)

[10:34] Team_065 possession (Score: 31-21)
Karl Booker drives and kicks out. RJ Harden attempts a 3Pt. Contested by Kevin Fox (2.7 feet, ZONE). RJ Harden misses. Rebound secured by Damian Mobley.

[10:20] Team_048 possession (Score: 31-21)
Damian Mobley commits a violation (traveling/carry)! TURNOVER! (dead ball)

[10:20] Substitution (Team_048): Dejounte Sexton OUT → Kyle Irving IN (stamina_rule2)

[10:20] Substitution (Team_065): RJ Harden OUT → Paul Curry IN (stamina_rule2)

[10:20] Substitution (Team_065): Paul Williamson OUT → Derrick Poole IN (stamina_rule2)

[10:20] Substitution (Team_065): Russell Wade OUT → Karl Leonard IN (stamina_rule2)

[10:10] Team_065 possession (Score: 31-21)
Manu McGrady attempts a 3Pt. Wide open! Kyle Irving is 6.7 feet away. [MAN] Manu McGrady misses. Rebound secured by Kevin Fox.

[09:53] Team_048 possession (Score: 31-21)
Kyle Irving commits a violation (traveling/carry)! TURNOVER! (dead ball)

[09:53] Substitution (Team_048): Karl Johnson OUT → Yao Booker IN (stamina_rule2)

[09:39] Team_065 possession (Score: 31-21)
Paul Curry attempts a Midrange. Wide open! Paolo Rozier is 6.6 feet away. [MAN] Paul Curry misses. Rebound secured by Kyle Irving.

[09:25] Team_048 possession (Score: 31-21)
Paolo Rozier attempts a 3Pt. Wide open! Paul Curry is 6.6 feet away. [ZONE] PAOLO ROZIER MAKES IT! Assist: Damian Mobley
Score: 34-21

[09:07] Team_065 possession (Score: 34-21)
Karl Booker attempts a Midrange. Wide open! Yao Booker is 7.6 feet away. [ZONE] Karl Booker misses. Rebound secured by Damian Mobley.

[08:50] Team_048 possession (Score: 34-21)
Yao Booker attempts a 3Pt. Contested by Paul Curry (4.6 feet, ZONE). Yao Booker misses. Rebound secured by Karl Leonard.

[08:36] Team_065 possession (Score: 34-21)
Karl Leonard attempts a Layup. BLOCKED BY KEVIN FOX! Ball is loose! Rebound secured by Damian Mobley.

[08:23] Team_048 possession (Score: 34-21)
Kevin Fox attempts a Midrange. Wide open! Karl Leonard is 8.3 feet away. [MAN] KEVIN FOX MAKES IT! Assist: Yao Booker
Score: 36-21

[08:06] Team_065 possession (Score: 36-21)
Karl Booker drives, Kevin Fox stays with him. Karl Booker attempts a Dunk. Contested by Kevin Fox (3.3 feet, MAN). Karl Booker misses. Offensive rebound by Karl Leonard! Karl Leonard kicks it out.

[07:52] Team_065 possession (Score: 36-21)
Paul Curry attempts a 3Pt. Contested by Paolo Rozier (3.9 feet, MAN). Paul Curry misses. Rebound secured by Kevin Fox.

[07:37] Team_048 possession (Score: 36-21)
Kyle Irving attempts a Midrange. Contested by Manu McGrady (5.8 feet, MAN). Kyle Irving misses. Offensive rebound by Damian Mobley! Damian Mobley puts it back in!
Score: 38-21

[07:26] Team_065 possession (Score: 38-21)
Karl Leonard attempts a 3Pt. Contested by Kevin Fox (3.3 feet, ZONE). KARL LEONARD MAKES IT!
Score: 38-24

[07:14] Team_048 possession (Score: 38-24)
Yao Booker attempts a Midrange. Wide open! Karl Leonard is 9.3 feet away. [ZONE] YAO BOOKER MAKES IT!
Score: 40-24

[07:03] Team_065 possession (Score: 40-24)
Manu McGrady attempts a 3Pt. Contested by Kevin Fox (5.3 feet, ZONE). Manu McGrady misses. Rebound secured by Kyle Irving.

[06:50] Team_048 possession (Score: 40-24)
Paolo Rozier attempts a Layup. Contested by Paul Curry (3.6 feet, MAN). PAOLO ROZIER MAKES IT!
Score: 42-24

[06:33] Team_065 possession (Score: 42-24)
Karl Leonard attempts a Midrange. Contested by Kevin Fox (2.4 feet, MAN). KARL LEONARD MAKES IT!
Score: 42-26

[06:17] Team_048 possession (Score: 42-26)
Yao Booker attempts a 3Pt. Wide open! Derrick Poole is 6.9 feet away. [MAN] Yao Booker misses. Offensive rebound by Damian Mobley! Damian Mobley's putback is no good. Offensive rebound by Damian Mobley! Damian Mobley kicks it out.

[06:01] Team_048 possession (Score: 42-26)
FOUL! Shooting foul on Karl Leonard. Kevin Fox to the line for 2 free throws. [Team fouls: 2] (Karl Leonard: 1 personal fouls)   FT 1/2: GOOD   FT 2/2: MISS Kevin Fox makes 1/2 from the line. Rebound secured by Karl Booker.
Score: 43-26

[05:44] Team_065 possession (Score: 43-26)
Paul Curry makes the Midrange and draws the foul on Damian Mobley! And-1! Paul Curry to the line for 1. [Team fouls: 1] (Damian Mobley: 1 personal fouls)   FT 1/1: GOOD Paul Curry makes 1/1 from the line.
Score: 43-29

[05:34] Team_048 possession (Score: 43-29)
Kevin Fox attempts a 3Pt. Contested by Paul Curry (3.0 feet, ZONE). KEVIN FOX MAKES IT! Assist: Paolo Rozier
Score: 46-29

[05:23] Team_065 possession (Score: 46-29)
Karl Leonard drives and kicks out. Karl Booker attempts a Midrange. Heavily contested by Damian Mobley (0.5 feet, MAN)! Karl Booker misses. Rebound secured by Damian Mobley.

[05:07] Team_048 possession (Score: 46-29)
Kyle Irving drives to the basket... Kyle Irving loses control! Ball rolls out of bounds! TURNOVER! (dead ball)

[05:07] Substitution (Team_048): Paolo Rozier OUT → Lauri Curry IN (stamina_rule2)

[05:07] Substitution (Team_048): Kevin Fox OUT → DeMar Hyland IN (stamina_rule2)

[05:07] Substitution (Team_048): Damian Mobley OUT → Gary Giddey IN (stamina_rule2)

[05:07] Substitution (Team_065): Manu McGrady OUT → D'Angelo Porzingis IN (stamina_rule2)

[05:07] Substitution (Team_065): Karl Booker OUT → Vince Mobley IN (stamina_rule2)

[04:51] Team_065 possession (Score: 46-29)
Vince Mobley loses control! Ball rolls out of bounds! TURNOVER! (dead ball)

[04:40] Team_048 possession (Score: 46-29)
Yao Booker attempts a 3Pt. Wide open! Derrick Poole is 6.4 feet away. [MAN] Yao Booker misses. Rebound secured by D'Angelo Porzingis.

[04:27] Team_065 possession (Score: 46-29)
D'Angelo Porzingis makes the Layup and draws the foul on Kyle Irving! And-1! D'Angelo Porzingis to the line for 1. [Team fouls: 2] (Kyle Irving: 1 personal fouls)   FT 1/1: MISS D'Angelo Porzingis makes 0/1 from the line. Rebound secured by Kyle Irving.
Score: 46-31

[04:15] Team_048 possession (Score: 46-31)
Lauri Curry makes the Layup and draws the foul on Paul Curry! And-1! Lauri Curry to the line for 1. [Team fouls: 3] (Paul Curry: 1 personal fouls)   FT 1/1: GOOD Lauri Curry makes 1/1 from the line.
Score: 49-31

[03:58] Team_065 possession (Score: 49-31)
D'Angelo Porzingis attempts a Midrange. Contested by Kyle Irving (5.3 feet, MAN). D'ANGELO PORZINGIS MAKES IT!
Score: 49-33

[03:43] Team_048 possession (Score: 49-33)
FOUL! Shooting foul on D'Angelo Porzingis. Lauri Curry to the line for 3 free throws. [Team fouls: 4] (D'Angelo Porzingis: 1 personal fouls)   FT 1/3: GOOD   FT 2/3: GOOD   FT 3/3: GOOD Lauri Curry makes 3/3 from the line.
Score: 52-33

[03:29] Team_065 possession (Score: 52-33)
D'Angelo Porzingis attempts a 3Pt. Contested by Kyle Irving (5.9 feet, MAN). D'Angelo Porzingis misses. Offensive rebound by D'Angelo Porzingis! D'Angelo Porzingis kicks it out.

[03:17] Team_065 possession (Score: 52-33)
Vince Mobley drives, DeMar Hyland stays with him. Vince Mobley attempts a Layup. Heavily contested by DeMar Hyland (1.3 feet, MAN)! VINCE MOBLEY MAKES IT! Assist: D'Angelo Porzingis
Score: 52-35

[03:07] Team_048 possession (Score: 52-35)
DeMar Hyland drives, Karl Leonard stays with him. DeMar Hyland attempts a Dunk. Contested by Karl Leonard (5.5 feet, MAN). DEMAR HYLAND MAKES IT!
Score: 54-35

[02:53] Team_065 possession (Score: 54-35)
Paul Curry attempts a 3Pt. Contested by Yao Booker (5.2 feet, ZONE). PAUL CURRY MAKES IT! Assist: Karl Leonard
Score: 54-38

[02:37] Team_048 possession (Score: 54-38)
Kyle Irving attempts a 3Pt. Contested by D'Angelo Porzingis (5.3 feet, MAN). Kyle Irving misses. Rebound secured by Karl Leonard.

[02:28] Team_065 possession (Score: 54-38)
Derrick Poole drives, DeMar Hyland stays with him. Derrick Poole attempts a Layup. Contested by DeMar Hyland (4.9 feet, ZONE). DERRICK POOLE MAKES IT! Assist: Vince Mobley
Score: 54-40

[02:11] Team_048 possession (Score: 54-40)
Kyle Irving attempts a Layup. Contested by Vince Mobley (2.1 feet, ZONE). KYLE IRVING MAKES IT!
Score: 56-40

[01:56] Team_065 possession (Score: 56-40)
Vince Mobley attempts a Layup. Contested by DeMar Hyland (4.0 feet, ZONE). VINCE MOBLEY MAKES IT! Assist: Derrick Poole
Score: 56-42

[01:40] Team_048 possession (Score: 56-42)
Lauri Curry attempts a 3Pt. Wide open! D'Angelo Porzingis is 6.3 feet away. [ZONE] Lauri Curry misses. Rebound secured by Vince Mobley.

[01:28] Team_065 possession (Score: 56-42)
Derrick Poole attempts a Midrange. Wide open! Yao Booker is 7.5 feet away. [MAN] DERRICK POOLE MAKES IT!
Score: 56-44

[01:13] Team_048 possession (Score: 56-44)
DeMar Hyland attempts a Midrange. Contested by Vince Mobley (3.5 feet, ZONE). DeMar Hyland misses. Rebound secured by Vince Mobley.

[00:58] Team_065 possession (Score: 56-44)
Paul Curry makes the Layup and draws the foul on Lauri Curry! And-1! Paul Curry to the line for 1. [Team fouls: 3] (Lauri Curry: 1 personal fouls)   FT 1/1: GOOD Paul Curry makes 1/1 from the line.
Score: 56-47

[00:42] Team_048 possession (Score: 56-47)
FOUL! Offensive foul on DeMar Hyland! Karl Leonard drew the charge! [Team fouls: 4] (DeMar Hyland: 1 personal fouls) TURNOVER! (dead ball)

[00:27] Team_065 possession (Score: 56-47)
Derrick Poole attempts a 3Pt. Contested by DeMar Hyland (3.4 feet, ZONE). Derrick Poole misses. Offensive rebound by D'Angelo Porzingis! D'Angelo Porzingis kicks it out.

[00:14] Team_065 possession (Score: 56-47)
Paul Curry attempts a 3Pt. Wide open! Lauri Curry is 6.3 feet away. [MAN] PAUL CURRY MAKES IT! Assist: Vince Mobley
Score: 56-50

[00:02] Team_048 possession (Score: 56-50)
DeMar Hyland attempts a 3Pt. Wide open! D'Angelo Porzingis is 7.0 feet away. [ZONE] DeMar Hyland misses. Rebound secured by Vince Mobley.

================================================================================
                              2ND QUARTER COMPLETE                              
================================================================================

2ND QUARTER SCORE: Team_048 29, Team_065 29

BOX SCORE:
================================================================================

Team_048
--------------------------------------------------------------------------------
Player                MIN  PTS  REB  AST  TO      FG   FG%      3P   3P%
--------------------------------------------------------------------------------
Kevin Fox              17    7    2    0   0   3/4    75.0     0/0   0.0
Lauri Curry             7    6    0    0   0   2/3    66.7     0/0   0.0
Paolo Rozier           17    5    0    1   0   2/2   100.0     0/0   0.0
Damian Mobley          17    4    7    2   0   2/2   100.0     0/0   0.0
Kyle Irving            11    2    3    0   0   1/2    50.0     0/0   0.0
Yao Booker             12    2    0    1   0   1/3    33.3     0/0   0.0
DeMar Hyland            7    2    0    0   0   1/3    33.3     0/0   0.0
Dejounte Sexton        13    0    1    0   0   0/0     0.0     0/0   0.0

TEAM: FG: 12/19 (63.2%), 3PT: 4/9 (44.4%), REB: 13 (3 off, 10 def), AST: 4, TO: 5
TEAM FOULS: 4


Team_065
--------------------------------------------------------------------------------
Player                MIN  PTS  REB  AST  TO      FG   FG%      3P   3P%
--------------------------------------------------------------------------------
Paul Curry             11   12    0    0   0   4/6    66.7     0/0   0.0
Karl Leonard           11    5    3    1   0   2/4    50.0     0/0   0.0
Vince Mobley            7    4    3    2   0   2/2   100.0     0/0   0.0
Derrick Poole          11    4    0    1   0   2/2   100.0     0/0   0.0
D'Angelo Porzingis      7    2    3    1   0   1/2    50.0     0/0   0.0
Karl Booker            17    0    1    0   0   0/3     0.0     0/0   0.0
Manu McGrady           17    0    0    0   0   0/2     0.0     0/0   0.0

TEAM: FG: 11/21 (52.4%), 3PT: 3/6 (50.0%), REB: 10 (3 off, 7 def), AST: 5, TO: 2
TEAM FOULS: 4

================================================================================

================================================================================
                       3RD QUARTER - Team_048 vs Team_065                       
================================================================================

[12:00] Team_048 possession (Score: 56-50)
Dejounte Sexton attempts a Layup. Heavily contested by Manu McGrady (1.4 feet, MAN)! DEJOUNTE SEXTON MAKES IT!
Score: 58-50

[11:42] Team_065 possession (Score: 58-50)
Paul Williamson drives to the basket... Paul Williamson throws a bad pass out of bounds! TURNOVER! (dead ball)

[11:25] Team_048 possession (Score: 58-50)
Kevin Fox makes the Layup and draws the foul on Russell Wade! And-1! Kevin Fox to the line for 1. [Team fouls: 1] (Russell Wade: 1 personal fouls)   FT 1/1: MISS Kevin Fox makes 0/1 from the line. Rebound secured by Russell Wade.
Score: 60-50

[11:10] Team_065 possession (Score: 60-50)
Karl Booker attempts a Midrange. Heavily contested by Dejounte Sexton (0.8 feet, ZONE)! Karl Booker misses. Rebound secured by Kevin Fox.

[10:55] Team_048 possession (Score: 60-50)
Karl Johnson attempts a 3Pt. Wide open! Paul Williamson is 7.2 feet away. [MAN] Karl Johnson misses. Rebound secured by Russell Wade.

[10:38] Team_065 possession (Score: 60-50)
Manu McGrady attempts a Layup. Heavily contested by Dejounte Sexton (1.5 feet, MAN)! Manu McGrady misses. Rebound secured by Kevin Fox.

[10:23] Team_048 possession (Score: 60-50)
FOUL! Shooting foul on Paul Williamson. Paolo Rozier to the line for 2 free throws. [Team fouls: 2] (Paul Williamson: 1 personal fouls)   FT 1/2: GOOD   FT 2/2: MISS Paolo Rozier makes 1/2 from the line. Rebound secured by RJ Harden.
Score: 61-50

[10:05] Team_065 possession (Score: 61-50)
RJ Harden attempts a 3Pt. Wide open! Paolo Rozier is 7.5 feet away. [MAN] RJ HARDEN MAKES IT! Assist: Russell Wade
Score: 61-53

[09:53] Team_048 possession (Score: 61-53)
Paolo Rozier attempts a 3Pt. Heavily contested by Russell Wade (1.1 feet, ZONE)! Paolo Rozier misses. FOUL! Loose ball foul on Manu McGrady during the rebound battle. [Team fouls: 3] No free throws, side out. (Manu McGrady: 1 personal fouls)

[09:42] Team_048 possession (Score: 61-53)
Damian Mobley drives, picks up Russell Wade. Help arrives from Paul Williamson! Damian Mobley attempts a Layup. Heavily contested by Paul Williamson (0.5 feet, MAN)! DAMIAN MOBLEY MAKES IT!
Score: 63-53

[09:29] Team_065 possession (Score: 63-53)
Russell Wade attempts a 3Pt. Heavily contested by Kevin Fox (0.7 feet, MAN)! Russell Wade misses. Rebound secured by Kevin Fox.

[09:10] Team_048 possession (Score: 63-53)
Damian Mobley makes the Layup and draws the foul on Paul Williamson! And-1! Damian Mobley to the line for 1. [Team fouls: 4] (Paul Williamson: 2 personal fouls)   FT 1/1: GOOD Damian Mobley makes 1/1 from the line.
Score: 66-53

[08:56] Team_065 possession (Score: 66-53)
Paul Williamson attempts a 3Pt. Wide open! Dejounte Sexton is 7.3 feet away. [ZONE] PAUL WILLIAMSON MAKES IT! Assist: Manu McGrady
Score: 66-56

[08:38] Team_048 possession (Score: 66-56)
Karl Johnson attempts a Layup. BLOCKED BY RUSSELL WADE! Ball is loose! Offensive rebound by Kevin Fox! Kevin Fox kicks it out.

[08:27] Team_048 possession (Score: 66-56)
Karl Johnson drives and kicks out. Dejounte Sexton attempts a 3Pt. Contested by RJ Harden (5.9 feet, ZONE). Dejounte Sexton misses. Rebound secured by Russell Wade.

[08:18] Team_065 possession (Score: 66-56)
FOUL! Shooting foul on Dejounte Sexton. Russell Wade to the line for 3 free throws. [Team fouls: 1] (Dejounte Sexton: 1 personal fouls)   FT 1/3: GOOD   FT 2/3: GOOD   FT 3/3: GOOD Russell Wade makes 3/3 from the line.
Score: 66-59

[08:06] Team_048 possession (Score: 66-59)
Karl Johnson attempts a 3Pt. Contested by RJ Harden (3.7 feet, ZONE). Karl Johnson misses. Rebound secured by Russell Wade.

[07:52] Team_065 possession (Score: 66-59)
Paul Williamson attempts a Midrange. Wide open! Kevin Fox is 6.8 feet away. [ZONE] Paul Williamson misses. Rebound secured by Dejounte Sexton.

[07:38] Team_048 possession (Score: 66-59)
Kevin Fox attempts a 3Pt. Contested by Russell Wade (5.0 feet, MAN). Kevin Fox misses. Rebound secured by Manu McGrady.

[07:24] Team_065 possession (Score: 66-59)
RJ Harden drives and kicks out. RJ Harden attempts a Midrange. Contested by Kevin Fox (5.6 feet, ZONE). RJ Harden misses. Offensive rebound by Russell Wade! Russell Wade puts it back in!
Score: 66-61

[07:11] Team_048 possession (Score: 66-61)
Karl Johnson attempts a Midrange. Contested by Paul Williamson (5.3 feet, MAN). Karl Johnson misses. FOUL! Loose ball foul on Russell Wade during the rebound battle. [IN THE BONUS! 5 team fouls] Damian Mobley to the line for 2 free throws. (Russell Wade: 2 personal fouls)   FT 1/2: GOOD   FT 2/2: MISS Damian Mobley makes 1/2 from the line. Rebound secured by RJ Harden.
Score: 67-61

[07:00] Team_065 possession (Score: 67-61)
RJ Harden attempts a Layup. Wide open! Paolo Rozier is 6.1 feet away. [MAN] RJ HARDEN MAKES IT!
Score: 67-63

[06:48] Team_048 possession (Score: 67-63)
Damian Mobley drives and kicks out. Dejounte Sexton attempts a Midrange. Wide open! Manu McGrady is 6.9 feet away. [MAN] DEJOUNTE SEXTON MAKES IT!
Score: 69-63

[06:35] Team_065 possession (Score: 69-63)
Karl Booker attempts a Layup. Heavily contested by Kevin Fox (0.5 feet, ZONE)! Karl Booker misses. Rebound secured by Damian Mobley.

[06:18] Team_048 possession (Score: 69-63)
FOUL! Shooting foul on Russell Wade. Kevin Fox to the line for 2 free throws. [BONUS: 6 team fouls] (Russell Wade: 3 personal fouls)   FT 1/2: GOOD   FT 2/2: GOOD Kevin Fox makes 2/2 from the line.
Score: 71-63

[06:01] Team_065 possession (Score: 71-63)
Paul Williamson attempts a 3Pt. Wide open! Karl Johnson is 8.0 feet away. [MAN] Paul Williamson misses. Rebound secured by Dejounte Sexton.

[05:46] Team_048 possession (Score: 71-63)
Paolo Rozier drives, picks up RJ Harden. Help arrives from Manu McGrady! Paolo Rozier attempts a Layup. Contested by Manu McGrady (5.3 feet, MAN). PAOLO ROZIER MAKES IT! Assist: Karl Johnson
Score: 73-63

[05:29] Team_065 possession (Score: 73-63)
Paul Williamson attempts a 3Pt. Contested by Kevin Fox (6.0 feet, ZONE). PAUL WILLIAMSON MAKES IT! Assist: Karl Booker
Score: 73-66

[05:15] Team_048 possession (Score: 73-66)
Kevin Fox makes the Layup and draws the foul on Russell Wade! And-1! Kevin Fox to the line for 1. [BONUS: 7 team fouls] (Russell Wade: 4 personal fouls)   FT 1/1: GOOD Kevin Fox makes 1/1 from the line.
Score: 76-66

[05:02] Team_065 possession (Score: 76-66)
Manu McGrady attempts a 3Pt. Contested by Dejounte Sexton (3.9 feet, ZONE). Manu McGrady misses. FOUL! Loose ball foul on Damian Mobley during the rebound battle. [Team fouls: 2] No free throws, side out. (Damian Mobley: 1 personal fouls)

[04:46] Team_065 possession (Score: 76-66)
Manu McGrady attempts a 3Pt. Heavily contested by Dejounte Sexton (0.5 feet, ZONE)! Manu McGrady misses. Rebound secured by Dejounte Sexton.

[04:34] Team_048 possession (Score: 76-66)
FOUL! Holding foul on Russell Wade. [IN THE BONUS! 8 team fouls] Kevin Fox to the line for 2 free throws. (Russell Wade: 5 personal fouls)   FT 1/2: GOOD   FT 2/2: GOOD Kevin Fox makes 2/2 from the line.
Score: 78-66

[04:16] Team_065 possession (Score: 78-66)
Manu McGrady attempts a 3Pt. Contested by Dejounte Sexton (3.0 feet, ZONE). Manu McGrady misses. Rebound secured by Damian Mobley.

[04:04] Team_048 possession (Score: 78-66)
Dejounte Sexton drives and kicks out. Karl Johnson attempts a Midrange. Contested by Paul Williamson (4.4 feet, MAN). Karl Johnson misses. Rebound secured by RJ Harden.

[03:52] Team_065 possession (Score: 78-66)
Russell Wade attempts a Layup. Heavily contested by Kevin Fox (0.7 feet, MAN)! RUSSELL WADE MAKES IT!
Score: 78-68

[03:40] Team_048 possession (Score: 78-68)
FOUL! Holding foul on Manu McGrady. [IN THE BONUS! 9 team fouls] Dejounte Sexton to the line for 2 free throws. (Manu McGrady: 2 personal fouls)   FT 1/2: GOOD   FT 2/2: MISS Dejounte Sexton makes 1/2 from the line. Rebound secured by Russell Wade.
Score: 79-68

[03:24] Team_065 possession (Score: 79-68)
Manu McGrady drives and kicks out. Russell Wade attempts a 3Pt. Contested by Kevin Fox (2.5 feet, MAN). RUSSELL WADE MAKES IT! Assist: Manu McGrady
Score: 79-71

[03:05] Team_048 possession (Score: 79-71)
FOUL! Shooting foul on Paul Williamson. Karl Johnson to the line for 2 free throws. [BONUS: 10 team fouls] (Paul Williamson: 3 personal fouls)   FT 1/2: GOOD   FT 2/2: MISS Karl Johnson makes 1/2 from the line. Offensive rebound by Kevin Fox! Kevin Fox kicks it out.
Score: 80-71

[02:47] Team_048 possession (Score: 80-71)
Paolo Rozier attempts a 3Pt. Wide open! Manu McGrady is 6.2 feet away. [ZONE] Paolo Rozier misses. Rebound secured by Manu McGrady.

[02:30] Team_065 possession (Score: 80-71)
Russell Wade attempts a 3Pt. Contested by Dejounte Sexton (4.5 feet, ZONE). Russell Wade misses. Rebound secured by Damian Mobley.

[02:20] Team_048 possession (Score: 80-71)
Dejounte Sexton attempts a 3Pt. Contested by Manu McGrady (5.2 feet, MAN). Dejounte Sexton misses. Rebound secured by RJ Harden.

[02:09] Team_065 possession (Score: 80-71)
RJ Harden attempts a 3Pt. Contested by Paolo Rozier (5.6 feet, MAN). RJ Harden misses. Rebound secured by Dejounte Sexton.

[01:58] Team_048 possession (Score: 80-71)
Paolo Rozier attempts a 3Pt. Wide open! Paul Williamson is 6.2 feet away. [ZONE] Paolo Rozier misses. Rebound secured by Russell Wade.

[01:43] Team_065 possession (Score: 80-71)
Russell Wade attempts a 3Pt. Contested by Kevin Fox (3.1 feet, ZONE). RUSSELL WADE MAKES IT!
Score: 80-74

[01:28] Team_048 possession (Score: 80-74)
Karl Johnson attempts a 3Pt. Contested by RJ Harden (3.7 feet, ZONE). Karl Johnson misses. Offensive rebound by Damian Mobley! Damian Mobley's putback is no good. Rebound secured by RJ Harden.

[01:11] Team_065 possession (Score: 80-74)
RJ Harden attempts a Midrange. Wide open! Paolo Rozier is 6.0 feet away. [MAN] RJ Harden misses. Rebound secured by Damian Mobley.

[01:00] Team_048 possession (Score: 80-74)
Karl Johnson attempts a Midrange. Wide open! Paul Williamson is 6.9 feet away. [MAN] Karl Johnson misses. Rebound secured by Manu McGrady.

[00:44] Team_065 possession (Score: 80-74)
Manu McGrady drives to the basket... Manu McGrady throws a bad pass out of bounds! TURNOVER! (dead ball)

[00:44] Substitution (Team_048): Paolo Rozier OUT → Lauri Curry IN (stamina_rule2)

[00:44] Substitution (Team_048): Karl Johnson OUT → Yao Booker IN (stamina_rule2)

[00:44] Substitution (Team_048): Dejounte Sexton OUT → Kyle Irving IN (stamina_rule2)

[00:44] Substitution (Team_048): Kevin Fox OUT → DeMar Hyland IN (stamina_rule2)

[00:44] Substitution (Team_048): Damian Mobley OUT → Gary Giddey IN (stamina_rule2)

[00:44] Substitution (Team_065): RJ Harden OUT → Paul Curry IN (stamina_rule2)

[00:44] Substitution (Team_065): Paul Williamson OUT → Derrick Poole IN (stamina_rule2)

[00:44] Substitution (Team_065): Manu McGrady OUT → D'Angelo Porzingis IN (stamina_rule2)

[00:44] Substitution (Team_065): Russell Wade OUT → Karl Leonard IN (stamina_rule2)

[00:44] Substitution (Team_065): Karl Booker OUT → Vince Mobley IN (stamina_rule2)

[00:29] Team_048 possession (Score: 80-74)
Gary Giddey drives, Vince Mobley stays with him. Gary Giddey attempts a Layup. Contested by Vince Mobley (3.3 feet, ZONE). GARY GIDDEY MAKES IT! Assist: Yao Booker
Score: 82-74

[00:12] Team_065 possession (Score: 82-74)
D'Angelo Porzingis makes the Dunk and draws the foul on DeMar Hyland! And-1! D'Angelo Porzingis to the line for 1. [Team fouls: 3] (DeMar Hyland: 1 personal fouls)   FT 1/1: GOOD D'Angelo Porzingis makes 1/1 from the line.
Score: 82-77

================================================================================
                              3RD QUARTER COMPLETE                              
================================================================================

3RD QUARTER SCORE: Team_048 26, Team_065 27

BOX SCORE:
================================================================================

Team_048
--------------------------------------------------------------------------------
Player                MIN  PTS  REB  AST  TO      FG   FG%      3P   3P%
--------------------------------------------------------------------------------
Kevin Fox              29    7    6    0   0   3/5    60.0     0/0   0.0
Damian Mobley          29    5    4    0   0   2/2   100.0     0/0   0.0
Dejounte Sexton        25    4    4    0   0   2/4    50.0     0/0   0.0
Paolo Rozier           29    2    0    0   0   1/4    25.0     0/0   0.0
Gary Giddey             8    2    0    0   0   1/1   100.0     0/0   0.0
Karl Johnson           24    0    0    1   0   0/6     0.0     0/0   0.0
Yao Booker             12    0    0    1   0   0/0     0.0     0/0   0.0

TEAM: FG: 9/23 (39.1%), 3PT: 0/7 (0.0%), REB: 16 (5 off, 11 def), AST: 2, TO: 0
TEAM FOULS: 3


Team_065
--------------------------------------------------------------------------------
Player                MIN  PTS  REB  AST  TO      FG   FG%      3P   3P%
--------------------------------------------------------------------------------
Russell Wade           25   13    8    1   0   5/7    71.4     0/0   0.0
Paul Williamson        25    6    0    0   0   2/4    50.0     0/0   0.0
RJ Harden              25    5    5    0   0   2/4    50.0     0/0   0.0
D'Angelo Porzingis      8    3    0    0   0   1/1   100.0     0/0   0.0
Karl Booker            29    0    0    1   0   0/2     0.0     0/0   0.0
Manu McGrady           29    0    3    2   0   0/3     0.0     0/0   0.0

TEAM: FG: 10/21 (47.6%), 3PT: 5/11 (45.5%), REB: 14 (2 off, 12 def), AST: 4, TO: 2
TEAM FOULS: 10 [Team_048 in BONUS]

================================================================================

================================================================================
                       4TH QUARTER - Team_048 vs Team_065                       
================================================================================

[12:00] Team_048 possession (Score: 82-77)
Dejounte Sexton attempts a 3Pt. Wide open! Manu McGrady is 6.1 feet away. [MAN] DEJOUNTE SEXTON MAKES IT! Assist: Karl Johnson
Score: 85-77

[11:48] Team_065 possession (Score: 85-77)
Russell Wade loses control! Ball rolls out of bounds! TURNOVER! (dead ball)

[11:48] Substitution (Team_048): Paolo Rozier OUT → Lauri Curry IN (stamina_rule2)

[11:48] Substitution (Team_048): Karl Johnson OUT → Yao Booker IN (stamina_rule2)

[11:48] Substitution (Team_048): Kevin Fox OUT → DeMar Hyland IN (stamina_rule2)

[11:48] Substitution (Team_048): Damian Mobley OUT → Gary Giddey IN (stamina_rule2)

[11:33] Team_048 possession (Score: 85-77)
Lauri Curry attempts a 3Pt. Contested by RJ Harden (3.7 feet, ZONE). LAURI CURRY MAKES IT! Assist: Yao Booker
Score: 88-77

[11:20] Team_065 possession (Score: 88-77)
Manu McGrady attempts a 3Pt. Contested by Dejounte Sexton (5.4 feet, MAN). Manu McGrady misses. Rebound secured by Dejounte Sexton.

[11:02] Team_048 possession (Score: 88-77)
Lauri Curry attempts a Midrange. Contested by RJ Harden (4.4 feet, MAN). Lauri Curry misses. Rebound secured by RJ Harden.

[10:51] Team_065 possession (Score: 88-77)
Russell Wade drives and kicks out. Russell Wade attempts a 3Pt. Heavily contested by Dejounte Sexton (0.5 feet, ZONE)! RUSSELL WADE MAKES IT! Assist: RJ Harden
Score: 88-80

[10:40] Team_048 possession (Score: 88-80)
Dejounte Sexton throws a bad pass out of bounds! TURNOVER! (dead ball)

[10:40] Substitution (Team_048): Dejounte Sexton OUT → Kyle Irving IN (stamina_rule2)

[10:40] Substitution (Team_065): RJ Harden OUT → Paul Curry IN (stamina_rule2)

[10:40] Substitution (Team_065): Paul Williamson OUT → Derrick Poole IN (stamina_rule2)

[10:40] Substitution (Team_065): Manu McGrady OUT → D'Angelo Porzingis IN (stamina_rule2)

[10:40] Substitution (Team_065): Russell Wade OUT → Karl Leonard IN (stamina_rule2)

[10:40] Substitution (Team_065): Karl Booker OUT → Vince Mobley IN (stamina_rule2)

[10:29] Team_065 possession (Score: 88-80)
Derrick Poole attempts a 3Pt. Contested by DeMar Hyland (4.5 feet, ZONE). Derrick Poole misses. Rebound secured by Kyle Irving.

[10:15] Team_048 possession (Score: 88-80)
Gary Giddey attempts a 3Pt. Contested by Paul Curry (5.4 feet, ZONE). Gary Giddey misses. Rebound secured by Karl Leonard.

[09:59] Team_065 possession (Score: 88-80)
D'Angelo Porzingis attempts a 3Pt. Wide open! DeMar Hyland is 7.7 feet away. [ZONE] D'Angelo Porzingis misses. Rebound secured by Gary Giddey.

[09:45] Team_048 possession (Score: 88-80)
Yao Booker attempts a Midrange. Contested by Paul Curry (4.7 feet, ZONE). Yao Booker misses. Rebound secured by Vince Mobley.

[09:27] Team_065 possession (Score: 88-80)
D'Angelo Porzingis makes the 3Pt and draws the foul on Kyle Irving! And-1! D'Angelo Porzingis to the line for 1. [Team fouls: 1] (Kyle Irving: 1 personal fouls)   FT 1/1: GOOD D'Angelo Porzingis makes 1/1 from the line.
Score: 88-84

[09:16] Team_048 possession (Score: 88-84)
Lauri Curry drives, Paul Curry stays with him. Lauri Curry attempts a Dunk. Contested by Paul Curry (3.3 feet, MAN). LAURI CURRY MAKES IT! Assist: Gary Giddey
Score: 90-84

[09:07] Team_065 possession (Score: 90-84)
Derrick Poole attempts a 3Pt. Heavily contested by Yao Booker (1.4 feet, MAN)! DERRICK POOLE MAKES IT! Assist: Paul Curry
Score: 90-87

[08:55] Team_048 possession (Score: 90-87)
DeMar Hyland attempts a Midrange. Contested by Karl Leonard (5.6 feet, MAN). DEMAR HYLAND MAKES IT! Assist: Yao Booker
Score: 92-87

[08:41] Team_065 possession (Score: 92-87)
Derrick Poole throws a bad pass! Stolen by Yao Booker! TURNOVER! (live ball)

[08:30] Team_048 possession (Score: 92-87)
Kyle Irving attempts a 3Pt. Contested by D'Angelo Porzingis (5.9 feet, MAN). Kyle Irving misses. Rebound secured by Vince Mobley.

[08:19] Team_065 possession (Score: 92-87)
Karl Leonard attempts a Midrange. Contested by DeMar Hyland (4.1 feet, MAN). Karl Leonard misses. Rebound secured by Kyle Irving.

[08:02] Team_048 possession (Score: 92-87)
DeMar Hyland attempts a Midrange. Contested by Karl Leonard (4.0 feet, MAN). DEMAR HYLAND MAKES IT!
Score: 94-87

[07:47] Team_065 possession (Score: 94-87)
Vince Mobley attempts a Midrange. Contested by DeMar Hyland (5.5 feet, MAN). Vince Mobley misses. Rebound secured by Gary Giddey.

[07:34] Team_048 possession (Score: 94-87)
Gary Giddey attempts a 3Pt. Heavily contested by Vince Mobley (0.5 feet, MAN)! Gary Giddey misses. Rebound secured by Karl Leonard.

[07:22] Team_065 possession (Score: 94-87)
FOUL! Offensive foul on Karl Leonard! DeMar Hyland drew the charge! [Team fouls: 1] (Karl Leonard: 1 personal fouls) TURNOVER! (dead ball)

[07:12] Team_048 possession (Score: 94-87)
Lauri Curry attempts a Layup. Wide open! Paul Curry is 6.3 feet away. [MAN] LAURI CURRY MAKES IT! Assist: DeMar Hyland
Score: 96-87

[06:55] Team_065 possession (Score: 96-87)
Derrick Poole drives, picks up DeMar Hyland. Help arrives from Lauri Curry! Derrick Poole attempts a Layup. Contested by Lauri Curry (2.8 feet, ZONE). Derrick Poole misses. Rebound secured by DeMar Hyland.

[06:39] Team_048 possession (Score: 96-87)
Kyle Irving drives, Vince Mobley stays with him. Kyle Irving attempts a Layup. Contested by Vince Mobley (5.1 feet, ZONE). Kyle Irving misses. Rebound secured by Vince Mobley.

[06:23] Team_065 possession (Score: 96-87)
Karl Leonard attempts a Midrange. Wide open! DeMar Hyland is 7.2 feet away. [MAN] Karl Leonard misses. Offensive rebound by Vince Mobley! Vince Mobley puts it back in!
Score: 96-89

[06:14] Team_048 possession (Score: 96-89)
Yao Booker attempts a 3Pt. Wide open! Paul Curry is 6.8 feet away. [ZONE] YAO BOOKER MAKES IT! Assist: Lauri Curry
Score: 99-89

[06:01] Team_065 possession (Score: 99-89)
Karl Leonard attempts a Midrange. Heavily contested by DeMar Hyland (1.6 feet, MAN)! Karl Leonard misses. Rebound secured by DeMar Hyland.

[05:46] Team_048 possession (Score: 99-89)
Yao Booker attempts a Midrange. Wide open! Paul Curry is 6.6 feet away. [ZONE] Yao Booker misses. Rebound secured by D'Angelo Porzingis.

[05:31] Team_065 possession (Score: 99-89)
Derrick Poole drives, Yao Booker stays with him. Derrick Poole attempts a Dunk. Contested by Yao Booker (4.2 feet, MAN). DERRICK POOLE MAKES IT!
Score: 99-91

[05:14] Team_048 possession (Score: 99-91)
Yao Booker loses control! Ball rolls out of bounds! TURNOVER! (dead ball)

[04:59] Team_065 possession (Score: 99-91)
Karl Leonard drives and kicks out. Karl Leonard attempts a 3Pt. Contested by DeMar Hyland (3.1 feet, ZONE). Karl Leonard misses. Rebound secured by DeMar Hyland.

[04:41] Team_048 possession (Score: 99-91)
FOUL! Offensive foul on Gary Giddey! Vince Mobley drew the charge! [Team fouls: 2] (Gary Giddey: 1 personal fouls) TURNOVER! (dead ball)

[04:26] Team_065 possession (Score: 99-91)
Derrick Poole attempts a 3Pt. Contested by Yao Booker (3.5 feet, MAN). DERRICK POOLE MAKES IT! Assist: Paul Curry
Score: 99-94

[04:14] Team_048 possession (Score: 99-94)
Gary Giddey makes the Layup and draws the foul on Vince Mobley! And-1! Gary Giddey to the line for 1. [Team fouls: 2] (Vince Mobley: 1 personal fouls)   FT 1/1: GOOD Gary Giddey makes 1/1 from the line.
Score: 102-94

[04:02] Team_065 possession (Score: 102-94)
Vince Mobley attempts a Layup. Contested by DeMar Hyland (5.8 feet, ZONE). Vince Mobley misses. Rebound secured by DeMar Hyland.

[03:51] Team_048 possession (Score: 102-94)
DeMar Hyland drives to the basket... DeMar Hyland throws a bad pass! Stolen by Karl Leonard! TURNOVER! (live ball)

[03:38] Team_065 possession (Score: 102-94)
FOUL! Offensive foul on Vince Mobley! DeMar Hyland drew the charge! [Team fouls: 3] (Vince Mobley: 2 personal fouls) TURNOVER! (dead ball)

[03:23] Team_048 possession (Score: 102-94)
Yao Booker commits a violation (traveling/carry)! TURNOVER! (dead ball)

[03:09] Team_065 possession (Score: 102-94)
Derrick Poole attempts a Midrange. Wide open! Kyle Irving is 6.4 feet away. [ZONE] Derrick Poole misses. Rebound secured by Kyle Irving.

[02:55] Team_048 possession (Score: 102-94)
Yao Booker attempts a Midrange. Wide open! Derrick Poole is 6.5 feet away. [MAN] YAO BOOKER MAKES IT! Assist: Gary Giddey
Score: 104-94

[02:43] Team_065 possession (Score: 104-94)
D'Angelo Porzingis attempts a 3Pt. Wide open! Kyle Irving is 6.6 feet away. [MAN] D'Angelo Porzingis misses. Rebound secured by DeMar Hyland.

[02:27] Team_048 possession (Score: 104-94)
DeMar Hyland attempts a Midrange. Contested by D'Angelo Porzingis (4.8 feet, ZONE). DeMar Hyland misses. Rebound secured by D'Angelo Porzingis.

[02:09] Team_065 possession (Score: 104-94)
FOUL! Shooting foul on DeMar Hyland. Vince Mobley to the line for 3 free throws. [Team fouls: 3] (DeMar Hyland: 1 personal fouls)   FT 1/3: GOOD   FT 2/3: GOOD   FT 3/3: MISS Vince Mobley makes 2/3 from the line. Offensive rebound by Vince Mobley! Vince Mobley puts it back in!
Score: 104-98

[01:51] Team_048 possession (Score: 104-98)
Kyle Irving drives, Vince Mobley stays with him. Kyle Irving attempts a Layup. Contested by Vince Mobley (4.4 feet, ZONE). KYLE IRVING MAKES IT!
Score: 106-98

[01:40] Team_065 possession (Score: 106-98)
Paul Curry attempts a 3Pt. Contested by Lauri Curry (5.3 feet, MAN). Paul Curry misses. Offensive rebound by Vince Mobley! Vince Mobley's putback is no good. Offensive rebound by D'Angelo Porzingis! D'Angelo Porzingis kicks it out.

[01:25] Team_065 possession (Score: 106-98)
FOUL! Shooting foul on DeMar Hyland. D'Angelo Porzingis to the line for 2 free throws. [BONUS: 5 team fouls] (DeMar Hyland: 2 personal fouls)   FT 1/2: MISS   FT 2/2: MISS D'Angelo Porzingis makes 0/2 from the line. FOUL! Loose ball foul on Kyle Irving during the free throw rebound! [IN THE BONUS! 6 team fouls] Vince Mobley to the line for 2 free throws. (Kyle Irving: 2 personal fouls)   FT 1/2: GOOD   FT 2/2: MISS Vince Mobley makes 1/2 from the line. Rebound secured by Gary Giddey.
Score: 106-99

[01:15] Team_048 possession (Score: 106-99)
Kyle Irving attempts a 3Pt. Wide open! Derrick Poole is 8.3 feet away. [ZONE] Kyle Irving misses. Rebound secured by Vince Mobley.

[01:04] Team_065 possession (Score: 106-99)
D'Angelo Porzingis attempts a Midrange. Contested by DeMar Hyland (3.8 feet, ZONE). D'ANGELO PORZINGIS MAKES IT! Assist: Derrick Poole
Score: 106-101

[00:49] Team_048 possession (Score: 106-101)
DeMar Hyland attempts a Midrange. Wide open! Karl Leonard is 8.1 feet away. [MAN] DEMAR HYLAND MAKES IT!
Score: 108-101

[00:34] Team_065 possession (Score: 108-101)
D'Angelo Porzingis throws a bad pass out of bounds! TURNOVER! (dead ball)

[00:19] Team_048 possession (Score: 108-101)
Lauri Curry attempts a Layup. Heavily contested by Vince Mobley (2.0 feet, ZONE)! LAURI CURRY MAKES IT!
Score: 110-101

[00:10] Team_065 possession (Score: 110-101)
Vince Mobley drives to the basket... FOUL! Offensive foul on Vince Mobley! DeMar Hyland drew the charge! [Team fouls: 4] (Vince Mobley: 3 personal fouls) TURNOVER! (dead ball)

================================================================================
                              4TH QUARTER COMPLETE                              
================================================================================

4TH QUARTER SCORE: Team_048 28, Team_065 24

BOX SCORE:
================================================================================

Team_048
--------------------------------------------------------------------------------
Player                MIN  PTS  REB  AST  TO      FG   FG%      3P   3P%
--------------------------------------------------------------------------------
Lauri Curry            19    9    0    1   0   4/5    80.0     0/0   0.0
DeMar Hyland           19    6    5    1   0   3/4    75.0     0/0   0.0
Yao Booker             24    5    0    2   0   2/4    50.0     0/0   0.0
Dejounte Sexton        26    3    1    0   0   1/1   100.0     0/0   0.0
Gary Giddey            19    3    3    2   0   1/3    33.3     0/0   0.0
Kyle Irving            22    2    3    0   0   1/4    25.0     0/0   0.0
Karl Johnson           24    0    0    1   0   0/0     0.0     0/0   0.0

TEAM: FG: 12/21 (57.1%), 3PT: 3/7 (42.9%), REB: 12 (0 off, 12 def), AST: 7, TO: 5
TEAM FOULS: 6 [Team_065 in BONUS]


Team_065
--------------------------------------------------------------------------------
Player                MIN  PTS  REB  AST  TO      FG   FG%      3P   3P%
--------------------------------------------------------------------------------
Derrick Poole          22    8    0    1   0   3/6    50.0     0/0   0.0
D'Angelo Porzingis     18    6    3    0   0   2/5    40.0     0/0   0.0
Vince Mobley           18    6    5    0   0   2/4    50.0     0/0   0.0
Russell Wade           26    3    0    0   0   1/1   100.0     0/0   0.0
Manu McGrady           30    0    0    0   0   0/1     0.0     0/0   0.0
RJ Harden              26    0    1    1   0   0/0     0.0     0/0   0.0
Karl Leonard           22    0    2    0   0   0/3     0.0     0/0   0.0
Paul Curry             22    0    0    2   0   0/0     0.0     0/0   0.0

TEAM: FG: 8/20 (40.0%), 3PT: 4/8 (50.0%), REB: 11 (2 off, 9 def), AST: 4, TO: 6
TEAM FOULS: 4

================================================================================

================================================================================
                               FULL GAME COMPLETE                               
================================================================================

FINAL SCORE: Team_048 110, Team_065 101

SCORING BY QUARTER:
--------------------------------------------------------------------------------
Team                     Q1     Q2     Q3     Q4    FINAL
--------------------------------------------------------------------------------
Team_048                 27     29     26     28      110
Team_065                 21     29     27     24      101
--------------------------------------------------------------------------------

FULL GAME BOX SCORE:
================================================================================

Team_048
--------------------------------------------------------------------------------
Player                MIN  PTS  REB  AST  TO      FG   FG%      3P   3P%      FT STL BLK
--------------------------------------------------------------------------------
Paolo Rozier           29    7    0    4   2   4/10   40.0   2/7    28.6   1/2     0   0
Kevin Fox              29   16   12    2   0   6/9    66.7   1/2    50.0   6/8     1   2
Damian Mobley          29   14   13    4   1   5/5   100.0   1/1   100.0   2/3     0   0
Dejounte Sexton        26   17    9    0   3   6/9    66.7   3/5    60.0   1/2     0   0
Karl Johnson           24    6    0    4   2   2/8    25.0   2/5    40.0   1/2     0   0
Yao Booker             24    9    0    4   3   4/9    44.4   1/3    33.3   2/2     1   0
Kyle Irving            22    4    6    0   2   3/7    42.9   0/3     0.0   0/0     0   0
Lauri Curry            19   17    0    1   0   7/9    77.8   2/3    66.7   4/4     0   0
DeMar Hyland           19    8    6    1   1   4/7    57.1   0/1     0.0   0/0     1   0
Gary Giddey            19    5    4    2   2   2/4    50.0   0/2     0.0   1/1     0   0

TEAM: FG: 44/79 (55.7%), 3PT: 12/32 (37.5%), REB: 50 (12 off, 38 def), AST: 22, TO: 16


Team_065
--------------------------------------------------------------------------------
Player                MIN  PTS  REB  AST  TO      FG   FG%      3P   3P%      FT STL BLK
--------------------------------------------------------------------------------
Manu McGrady           30    5    5    2   3   3/11   27.3   0/6     0.0   1/1     0   0
Karl Booker            30    0    1    1   2   0/6     0.0   0/1     0.0   0/0     0   0
RJ Harden              26    8    6    2   1   4/7    57.1   2/4    50.0   0/0     0   0
Paul Williamson        26   11    0    0   1   5/8    62.5   4/6    66.7   3/3     1   0
Russell Wade           26   22   13    2   1   6/10   60.0   2/4    50.0   3/3     1   1
Paul Curry             22   12    0    2   0   4/6    66.7   2/3    66.7   2/2     0   0
Derrick Poole          22   14    0    2   1   6/9    66.7   2/3    66.7   0/0     0   0
Karl Leonard           22    5    5    1   1   3/8    37.5   1/1   100.0   0/0     1   0
D'Angelo Porzingis     18   11    6    1   2   4/8    50.0   1/3    33.3   2/5     1   0
Vince Mobley           18   10   10    2   3   3/5    60.0   1/1   100.0   2/3     0   0

TEAM: FG: 38/78 (48.7%), 3PT: 15/32 (46.9%), REB: 45 (12 off, 33 def), AST: 15, TO: 15

================================================================================
