================================================================================
                        FULL GAME - Team_097 vs Team_100                        
================================================================================

================================================================================
                       1ST QUARTER - Team_097 vs Team_100                       
================================================================================

[12:00] Team_097 possession (Score: 0-0)
Tyrese Stewart drives, Chris Mobley stays with him. Tyrese Stewart attempts a Layup. Contested by Chris Mobley (4.1 feet, ZONE). TYRESE STEWART MAKES IT!
Score: 2-0

[11:43] Team_100 possession (Score: 2-0)
Pau LaVine commits a violation (traveling/carry)! TURNOVER! (dead ball)

[11:29] Team_097 possession (Score: 2-0)
Shai Poole attempts a Midrange. Wide open! Tyler Griffin is 7.4 feet away. [MAN] SHAI POOLE MAKES IT!
Score: 4-0

[11:10] Team_100 possession (Score: 4-0)
Pau LaVine attempts a 3Pt. Contested by Shai Poole (2.5 feet, ZONE). Pau LaVine misses. Rebound secured by Tyrese Stewart.

[11:01] Team_097 possession (Score: 4-0)
Jrue Haliburton drives to the basket... Jrue Haliburton loses the ball! Stripped by Pau LaVine! TURNOVER! (live ball)

[10:50] Team_100 possession (Score: 4-0)
Tyler Griffin attempts a Midrange. Contested by Anthony Haliburton (3.1 feet, ZONE). Tyler Griffin misses. Rebound secured by Anthony Haliburton.

[10:37] Team_097 possession (Score: 4-0)
FOUL! Shooting foul on Manu Ball. Tyrese Stewart to the line for 2 free throws. [Team fouls: 1] (Manu Ball: 1 personal fouls)   FT 1/2: GOOD   FT 2/2: GOOD Tyrese Stewart makes 2/2 from the line.
Score: 6-0

[10:19] Team_100 possession (Score: 6-0)
Chris Mobley drives to the basket... Chris Mobley throws a bad pass out of bounds! TURNOVER! (dead ball)

[10:05] Team_097 possession (Score: 6-0)
Tyrese Stewart makes the Layup and draws the foul on Chris Mobley! And-1! Tyrese Stewart to the line for 1. [Team fouls: 2] (Chris Mobley: 1 personal fouls)   FT 1/1: MISS Tyrese Stewart makes 0/1 from the line. Rebound secured by Tyler Griffin.
Score: 8-0

[09:48] Team_100 possession (Score: 8-0)
Luka Green commits a violation (traveling/carry)! TURNOVER! (dead ball)

[09:30] Team_097 possession (Score: 8-0)
Tyrese Stewart drives and kicks out. Tyrese Stewart attempts a 3Pt. Contested by Chris Mobley (2.2 feet, MAN). Tyrese Stewart misses. Rebound secured by Pau LaVine.

[09:19] Team_100 possession (Score: 8-0)
FOUL! Reach-in foul on Evan Brogdon during the drive. [Team fouls: 1] No free throws, side out. (Evan Brogdon: 1 personal fouls)

[09:03] Team_100 possession (Score: 8-0)
Pau LaVine attempts a Midrange. Contested by Jrue Haliburton (3.6 feet, ZONE). PAU LAVINE MAKES IT!
Score: 8-2

[08:52] Team_097 possession (Score: 8-2)
Shai Poole loses control! Ball rolls out of bounds! TURNOVER! (dead ball)

[08:41] Team_100 possession (Score: 8-2)
Tyler Griffin attempts a 3Pt. Contested by Shai Poole (2.1 feet, ZONE). Tyler Griffin misses. Rebound secured by Anthony Haliburton.

[08:29] Team_097 possession (Score: 8-2)
FOUL! Holding foul on Luka Green. [Team fouls: 3] No free throws, side out. (Luka Green: 1 personal fouls)

[08:16] Team_097 possession (Score: 8-2)
Jrue Haliburton attempts a Midrange. Wide open! Manu Ball is 8.6 feet away. [ZONE] JRUE HALIBURTON MAKES IT! Assist: Anthony Haliburton
Score: 10-2

[08:03] Team_100 possession (Score: 10-2)
Tyler Griffin makes the 3Pt and draws the foul on Evan Brogdon! And-1! Tyler Griffin to the line for 1. [Team fouls: 2] (Evan Brogdon: 2 personal fouls)   FT 1/1: GOOD Tyler Griffin makes 1/1 from the line.
Score: 10-6

[07:46] Team_097 possession (Score: 10-6)
Shai Poole drives and kicks out. Tyrese Stewart attempts a 3Pt. Contested by Chris Mobley (5.2 feet, MAN). Tyrese Stewart misses. Offensive rebound by Tyrese Stewart! Tyrese Stewart kicks it out.

[07:31] Team_097 possession (Score: 10-6)
Anthony Haliburton attempts a Midrange. Contested by Pau LaVine (3.7 feet, MAN). Anthony Haliburton misses. Rebound secured by Pau LaVine.

[07:17] Team_100 possession (Score: 10-6)
Chris Mobley makes the Dunk and draws the foul on Anthony Haliburton! And-1! Chris Mobley to the line for 1. [Team fouls: 3] (Anthony Haliburton: 1 personal fouls)   FT 1/1: GOOD Chris Mobley makes 1/1 from the line.
Score: 10-9

[07:04] Team_097 possession (Score: 10-9)
Tyrese Stewart makes the Layup and draws the foul on Chris Mobley! And-1! Tyrese Stewart to the line for 1. [Team fouls: 4] (Chris Mobley: 2 personal fouls)   FT 1/1: GOOD Tyrese Stewart makes 1/1 from the line.
Score: 13-9

[06:51] Team_100 possession (Score: 13-9)
Tyler Griffin attempts a Layup. Contested by Anthony Haliburton (2.3 feet, ZONE). TYLER GRIFFIN MAKES IT! Assist: Pau LaVine
Score: 13-11

[06:39] Team_097 possession (Score: 13-11)
Evan Brogdon attempts a 3Pt. Contested by Pau LaVine (3.2 feet, ZONE). Evan Brogdon misses. Rebound secured by Tyler Griffin.

[06:22] Team_100 possession (Score: 13-11)
Tyler Griffin attempts a Midrange. Contested by Shai Poole (2.8 feet, MAN). Tyler Griffin misses. Offensive rebound by Pau LaVine! Pau LaVine kicks it out.

[06:11] Team_100 possession (Score: 13-11)
Chris Mobley drives and kicks out. Tyler Griffin attempts a 3Pt. Contested by Shai Poole (5.3 feet, MAN). Tyler Griffin misses. Rebound secured by Anthony Haliburton.

[05:56] Team_097 possession (Score: 13-11)
FOUL! Offensive foul on Evan Brogdon! Luka Green drew the charge! [Team fouls: 4] (Evan Brogdon: 3 personal fouls) TURNOVER! (dead ball)

[05:42] Team_100 possession (Score: 13-11)
Luka Green attempts a Layup. BLOCKED BY EVAN BROGDON! Ball is loose! Rebound secured by Shai Poole.

[05:27] Team_097 possession (Score: 13-11)
Tyrese Stewart makes the Layup and draws the foul on Chris Mobley! And-1! Tyrese Stewart to the line for 1. [BONUS: 5 team fouls] (Chris Mobley: 3 personal fouls)   FT 1/1: GOOD Tyrese Stewart makes 1/1 from the line.
Score: 16-11

[05:07] Team_100 possession (Score: 16-11)
Tyler Griffin drives, Shai Poole stays with him. Tyler Griffin attempts a Layup. Contested by Shai Poole (4.6 feet, MAN). TYLER GRIFFIN MAKES IT! Assist: Pau LaVine
Score: 16-13

[04:51] Team_097 possession (Score: 16-13)
Anthony Haliburton attempts a Midrange. Contested by Chris Mobley (3.0 feet, ZONE). ANTHONY HALIBURTON MAKES IT! Assist: Shai Poole
Score: 18-13

[04:38] Team_100 possession (Score: 18-13)
Luka Green attempts a 3Pt. Contested by Shai Poole (5.3 feet, ZONE). Luka Green misses. Rebound secured by Tyrese Stewart.

[04:25] Team_097 possession (Score: 18-13)
Shai Poole attempts a 3Pt. Contested by Luka Green (3.9 feet, ZONE). Shai Poole misses. Rebound secured by Chris Mobley.

[04:13] Team_100 possession (Score: 18-13)
Luka Green attempts a 3Pt. Contested by Evan Brogdon (5.2 feet, MAN). Luka Green misses. Offensive rebound by Chris Mobley! Chris Mobley kicks it out.

[03:56] Team_100 possession (Score: 18-13)
Tyler Griffin drives and kicks out. Manu Ball attempts a Midrange. Wide open! Jrue Haliburton is 7.3 feet away. [ZONE] Manu Ball misses. Rebound secured by Anthony Haliburton.

[03:44] Team_097 possession (Score: 18-13)
FOUL! Reach-in foul on Pau LaVine during the drive. [IN THE BONUS! 6 team fouls] Anthony Haliburton to the line for 2 free throws. (Pau LaVine: 1 personal fouls)   FT 1/2: GOOD   FT 2/2: MISS Anthony Haliburton makes 1/2 from the line. Rebound secured by Pau LaVine.
Score: 19-13

[03:31] Team_100 possession (Score: 19-13)
Tyler Griffin attempts a 3Pt. Contested by Shai Poole (2.7 feet, ZONE). Tyler Griffin misses. Rebound secured by Shai Poole.

[03:17] Team_097 possession (Score: 19-13)
Tyrese Stewart drives and kicks out. Jrue Haliburton attempts a 3Pt. Contested by Manu Ball (5.4 feet, MAN). Jrue Haliburton misses. Rebound secured by Pau LaVine.

[03:00] Team_100 possession (Score: 19-13)
Chris Mobley makes the Dunk and draws the foul on Jrue Haliburton! And-1! Chris Mobley to the line for 1. [BONUS: 5 team fouls] (Jrue Haliburton: 1 personal fouls)   FT 1/1: GOOD Chris Mobley makes 1/1 from the line.
Score: 19-16

[02:46] Team_097 possession (Score: 19-16)
Anthony Haliburton attempts a Midrange. Contested by Tyler Griffin (5.1 feet, ZONE). Anthony Haliburton misses. Rebound secured by Tyler Griffin.

[02:28] Team_100 possession (Score: 19-16)
Luka Green drives, picks up Evan Brogdon. Help arrives from Shai Poole! Luka Green attempts a Dunk. Wide open! Shai Poole is 6.9 feet away. [MAN] LUKA GREEN MAKES IT! Assist: Tyler Griffin
Score: 19-18

[02:18] Team_097 possession (Score: 19-18)
Anthony Haliburton loses control! Ball rolls out of bounds! TURNOVER! (dead ball)

[02:18] Substitution (Team_097): Evan Brogdon OUT → Gary Carter IN (stamina_rule2)

[02:18] Substitution (Team_097): Shai Poole OUT → Miles Dosunmu IN (stamina_rule2)

[02:18] Substitution (Team_097): Anthony Haliburton OUT → Joel Simons IN (stamina_rule2)

[02:18] Substitution (Team_097): Tyrese Stewart OUT → Miles Banchero IN (stamina_rule2)

[02:18] Substitution (Team_100): Manu Ball OUT → Evan Butler IN (stamina_rule2)

[02:18] Substitution (Team_100): Tyler Griffin OUT → Tyrese Wade IN (stamina_rule2)

[02:18] Substitution (Team_100): Pau LaVine OUT → Carmelo Ginobili IN (stamina_rule2)

[02:18] Substitution (Team_100): Chris Mobley OUT → John Rozier IN (stamina_rule2)

[02:03] Team_100 possession (Score: 19-18)
FOUL! Shooting foul on Joel Simons. Carmelo Ginobili to the line for 2 free throws. [BONUS: 6 team fouls] (Joel Simons: 1 personal fouls)   FT 1/2: MISS   FT 2/2: GOOD Carmelo Ginobili makes 1/2 from the line.
Score: 19-19

[01:48] Team_097 possession (Score: 19-19)
Joel Simons drives, Carmelo Ginobili stays with him. Joel Simons attempts a Dunk. Contested by Carmelo Ginobili (4.3 feet, MAN). Joel Simons misses. Offensive rebound by Miles Dosunmu! Miles Dosunmu kicks it out.

[01:37] Team_097 possession (Score: 19-19)
Joel Simons attempts a Midrange. Wide open! Carmelo Ginobili is 6.9 feet away. [ZONE] JOEL SIMONS MAKES IT! Assist: Jrue Haliburton
Score: 21-19

[01:22] Team_100 possession (Score: 21-19)
Evan Butler attempts a 3Pt. Contested by Gary Carter (5.2 feet, ZONE). EVAN BUTLER MAKES IT! Assist: Luka Green
Score: 21-22

[01:07] Team_097 possession (Score: 21-22)
Joel Simons attempts a Layup. Contested by John Rozier (3.2 feet, ZONE). JOEL SIMONS MAKES IT! Assist: Gary Carter
Score: 23-22

[00:49] Team_100 possession (Score: 23-22)
John Rozier attempts a Midrange. Contested by Joel Simons (3.9 feet, MAN). John Rozier misses. Offensive rebound by Carmelo Ginobili! Carmelo Ginobili kicks it out.

[00:34] Team_100 possession (Score: 23-22)
FOUL! Shooting foul on Miles Dosunmu. Tyrese Wade to the line for 2 free throws. [BONUS: 7 team fouls] (Miles Dosunmu: 1 personal fouls)   FT 1/2: GOOD   FT 2/2: MISS Tyrese Wade makes 1/2 from the line. Rebound secured by Joel Simons.
Score: 23-23

[00:25] Team_097 possession (Score: 23-23)
Miles Dosunmu attempts a Midrange. Contested by Tyrese Wade (3.0 feet, ZONE). MILES DOSUNMU MAKES IT!
Score: 25-23

[00:09] Team_100 possession (Score: 25-23)
John Rozier makes the Layup and draws the foul on Miles Banchero! And-1! John Rozier to the line for 1. [BONUS: 8 team fouls] (Miles Banchero: 1 personal fouls)   FT 1/1: GOOD John Rozier makes 1/1 from the line.
Score: 25-26

================================================================================
                              1ST QUARTER COMPLETE                              
================================================================================

1ST QUARTER SCORE: Team_097 25, Team_100 26

BOX SCORE:
================================================================================

Team_097
--------------------------------------------------------------------------------
Player                MIN  PTS  REB  AST  TO      FG   FG%      3P   3P%
--------------------------------------------------------------------------------
Tyrese Stewart         10   10    3    0   0   4/7    57.1     0/0   0.0
Joel Simons             2    4    1    0   0   2/2   100.0     0/0   0.0
Shai Poole             10    2    2    1   0   1/2    50.0     0/0   0.0
Anthony Haliburton     10    2    4    1   0   1/4    25.0     0/0   0.0
Jrue Haliburton        12    2    0    1   0   1/1   100.0     0/0   0.0
Miles Dosunmu           2    2    1    0   0   1/1   100.0     0/0   0.0
Evan Brogdon           10    0    0    0   0   0/1     0.0     0/0   0.0
Gary Carter             2    0    0    1   0   0/0     0.0     0/0   0.0

TEAM: FG: 10/18 (55.6%), 3PT: 0/2 (0.0%), REB: 11 (2 off, 9 def), AST: 4, TO: 4
TEAM FOULS: 8 [Team_100 in BONUS]


Team_100
--------------------------------------------------------------------------------
Player                MIN  PTS  REB  AST  TO      FG   FG%      3P   3P%
--------------------------------------------------------------------------------
Tyler Griffin          10    8    3    1   0   3/7    42.9     0/0   0.0
Chris Mobley           10    6    2    0   0   2/3    66.7     0/0   0.0
Evan Butler             2    3    0    0   0   1/1   100.0     0/0   0.0
John Rozier             2    3    0    0   0   1/1   100.0     0/0   0.0
Pau LaVine             10    2    5    2   0   1/2    50.0     0/0   0.0
Luka Green             12    2    0    1   0   1/3    33.3     0/0   0.0
Carmelo Ginobili        2    1    1    0   0   1/1   100.0     0/0   0.0
Tyrese Wade             2    0    0    0   0   0/1     0.0     0/0   0.0

TEAM: FG: 10/19 (52.6%), 3PT: 2/6 (33.3%), REB: 11 (3 off, 8 def), AST: 4, TO: 3
TEAM FOULS: 6 [Team_097 in BONUS]

================================================================================

================================================================================
                       2ND QUARTER - Team_097 vs Team_100                       
================================================================================

[12:00] Team_097 possession (Score: 25-26)
Evan Brogdon attempts a Midrange. Wide open! Luka Green is 6.3 feet away. [MAN] EVAN BROGDON MAKES IT! Assist: Jrue Haliburton
Score: 27-26

[11:42] Team_100 possession (Score: 27-26)
Luka Green throws a bad pass! Stolen by Evan Brogdon! TURNOVER! (live ball)

[11:31] Team_097 possession (Score: 27-26)
Jrue Haliburton attempts a 3Pt. Wide open! Luka Green is 6.4 feet away. [ZONE] JRUE HALIBURTON MAKES IT! Assist: Anthony Haliburton
Score: 30-26

[11:18] Team_100 possession (Score: 30-26)
Pau LaVine attempts a Midrange. Contested by Anthony Haliburton (3.6 feet, MAN). Pau LaVine misses. Rebound secured by Shai Poole.

[11:01] Team_097 possession (Score: 30-26)
Shai Poole attempts a Layup. Contested by Pau LaVine (5.2 feet, ZONE). SHAI POOLE MAKES IT! Assist: Jrue Haliburton
Score: 32-26

[10:46] Team_100 possession (Score: 32-26)
Luka Green drives to the basket... Luka Green loses control! Ball rolls out of bounds! TURNOVER! (dead ball)

[10:46] Substitution (Team_097): Jrue Haliburton OUT → Dwyane Ginobili IN (stamina_rule2)

[10:46] Substitution (Team_100): Luka Green OUT → Dirk Sabonis IN (stamina_rule2)

[10:46] Substitution (Team_100): Chris Mobley OUT → John Rozier IN (stamina_rule2)

[10:33] Team_097 possession (Score: 32-26)
Shai Poole attempts a Midrange. Contested by Tyler Griffin (3.8 feet, MAN). Shai Poole misses. Rebound secured by Pau LaVine.

[10:18] Team_100 possession (Score: 32-26)
Pau LaVine attempts a Layup. BLOCKED BY ANTHONY HALIBURTON! Ball deflects out of bounds off Pau LaVine.

[10:02] Team_097 possession (Score: 32-26)
Evan Brogdon attempts a 3Pt. Wide open! Dirk Sabonis is 6.8 feet away. [MAN] EVAN BROGDON MAKES IT! Assist: Anthony Haliburton
Score: 35-26

[09:48] Team_100 possession (Score: 35-26)
Dirk Sabonis drives to the basket... Dirk Sabonis throws a bad pass out of bounds! TURNOVER! (dead ball)

[09:48] Substitution (Team_100): Manu Ball OUT → Evan Butler IN (stamina_rule2)

[09:48] Substitution (Team_100): Tyler Griffin OUT → Tyrese Wade IN (stamina_rule2)

[09:48] Substitution (Team_100): Pau LaVine OUT → Carmelo Ginobili IN (stamina_rule2)

[09:35] Team_097 possession (Score: 35-26)
Shai Poole throws a bad pass out of bounds! TURNOVER! (dead ball)

[09:35] Substitution (Team_097): Evan Brogdon OUT → Gary Carter IN (stamina_rule2)

[09:35] Substitution (Team_097): Anthony Haliburton OUT → Joel Simons IN (stamina_rule2)

[09:35] Substitution (Team_097): Tyrese Stewart OUT → Miles Banchero IN (stamina_rule2)

[09:17] Team_100 possession (Score: 35-26)
Evan Butler attempts a Midrange. Wide open! Dwyane Ginobili is 6.2 feet away. [MAN] Evan Butler misses. Offensive rebound by Carmelo Ginobili! Carmelo Ginobili kicks it out.

[09:01] Team_100 possession (Score: 35-26)
Dirk Sabonis attempts a 3Pt. Heavily contested by Joel Simons (1.7 feet, ZONE)! Dirk Sabonis misses. Rebound secured by Miles Banchero.

[08:45] Team_097 possession (Score: 35-26)
Joel Simons attempts a 3Pt. Contested by Carmelo Ginobili (5.8 feet, MAN). Joel Simons misses. FOUL! Loose ball foul on Carmelo Ginobili during the rebound battle. [Team fouls: 1] No free throws, side out. (Carmelo Ginobili: 1 personal fouls)

[08:30] Team_097 possession (Score: 35-26)
FOUL! Reach-in foul on Dirk Sabonis during the drive. [Team fouls: 2] No free throws, side out. (Dirk Sabonis: 1 personal fouls)

[08:16] Team_097 possession (Score: 35-26)
Joel Simons drives to the basket... Joel Simons throws a bad pass! Stolen by John Rozier! TURNOVER! (live ball)

[08:01] Team_100 possession (Score: 35-26)
Tyrese Wade attempts a 3Pt. Contested by Shai Poole (4.4 feet, MAN). Tyrese Wade misses. Rebound secured by Joel Simons.

[07:43] Team_097 possession (Score: 35-26)
Dwyane Ginobili attempts a 3Pt. Wide open! Evan Butler is 8.4 feet away. [MAN] Dwyane Ginobili misses. Rebound secured by John Rozier.

[07:30] Team_100 possession (Score: 35-26)
John Rozier drives, Joel Simons stays with him. John Rozier attempts a Layup. Contested by Joel Simons (3.1 feet, MAN). John Rozier misses. Rebound secured by Joel Simons.

[07:15] Team_097 possession (Score: 35-26)
Dwyane Ginobili attempts a 3Pt. Contested by Evan Butler (2.9 feet, MAN). DWYANE GINOBILI MAKES IT! Assist: Joel Simons
Score: 38-26

[06:57] Team_100 possession (Score: 38-26)
John Rozier makes the Layup and draws the foul on Joel Simons! And-1! John Rozier to the line for 1. [Team fouls: 1] (Joel Simons: 1 personal fouls)   FT 1/1: GOOD John Rozier makes 1/1 from the line.
Score: 38-29

[06:44] Team_097 possession (Score: 38-29)
Miles Banchero attempts a Layup. BLOCKED BY JOHN ROZIER! Ball goes out off John Rozier. Miles Banchero's ball!

[06:30] Team_097 possession (Score: 38-29)
Joel Simons attempts a Layup. BLOCKED BY JOHN ROZIER! Ball is loose! Offensive rebound by Joel Simons! Joel Simons kicks it out.

[06:18] Team_097 possession (Score: 38-29)
Gary Carter attempts a 3Pt. Contested by Tyrese Wade (4.8 feet, ZONE). Gary Carter misses. Rebound secured by Carmelo Ginobili.

[06:01] Team_100 possession (Score: 38-29)
Evan Butler makes the 3Pt and draws the foul on Dwyane Ginobili! And-1! Evan Butler to the line for 1. [Team fouls: 2] (Dwyane Ginobili: 1 personal fouls)   FT 1/1: GOOD Evan Butler makes 1/1 from the line.
Score: 38-33

[05:50] Team_097 possession (Score: 38-33)
Gary Carter attempts a 3Pt. Wide open! Tyrese Wade is 6.9 feet away. [ZONE] Gary Carter misses. FOUL! Loose ball foul on Tyrese Wade during the rebound battle. [Team fouls: 4] No free throws, side out. (Tyrese Wade: 1 personal fouls)

[05:39] Team_097 possession (Score: 38-33)
Dwyane Ginobili attempts a Midrange. Contested by Evan Butler (5.1 feet, MAN). DWYANE GINOBILI MAKES IT! Assist: Miles Banchero
Score: 40-33

[05:22] Team_100 possession (Score: 40-33)
FOUL! Shooting foul on Dwyane Ginobili. Carmelo Ginobili to the line for 2 free throws. [Team fouls: 3] (Dwyane Ginobili: 2 personal fouls)   FT 1/2: MISS   FT 2/2: GOOD Carmelo Ginobili makes 1/2 from the line.
Score: 40-34

[05:06] Team_097 possession (Score: 40-34)
Shai Poole attempts a Midrange. Contested by Evan Butler (3.7 feet, ZONE). SHAI POOLE MAKES IT!
Score: 42-34

[04:55] Team_100 possession (Score: 42-34)
Dirk Sabonis attempts a Layup. Heavily contested by Joel Simons (1.7 feet, ZONE)! DIRK SABONIS MAKES IT! Assist: Evan Butler
Score: 42-36

[04:40] Team_097 possession (Score: 42-36)
Miles Banchero attempts a 3Pt. Contested by John Rozier (3.6 feet, MAN). Miles Banchero misses. Rebound secured by Tyrese Wade.

[04:26] Team_100 possession (Score: 42-36)
John Rozier attempts a Midrange. Contested by Gary Carter (4.8 feet, ZONE). JOHN ROZIER MAKES IT!
Score: 42-38

[04:13] Team_097 possession (Score: 42-38)
Joel Simons attempts a Layup. BLOCKED BY EVAN BUTLER! Ball goes out off Evan Butler. Joel Simons's ball!

[04:00] Team_097 possession (Score: 42-38)
Gary Carter attempts a 3Pt. Contested by Dirk Sabonis (5.4 feet, ZONE). Gary Carter misses. Rebound secured by Tyrese Wade.

[03:42] Team_100 possession (Score: 42-38)
Carmelo Ginobili attempts a 3Pt. Contested by Joel Simons (2.6 feet, ZONE). Carmelo Ginobili misses. Rebound secured by Joel Simons.

[03:25] Team_097 possession (Score: 42-38)
FOUL! Shooting foul on Carmelo Ginobili. Joel Simons to the line for 2 free throws. [BONUS: 5 team fouls] (Carmelo Ginobili: 2 personal fouls)   FT 1/2: GOOD   FT 2/2: GOOD Joel Simons makes 2/2 from the line.
Score: 44-38

[03:14] Team_100 possession (Score: 44-38)
John Rozier attempts a 3Pt. Contested by Joel Simons (3.0 feet, MAN). John Rozier misses. Rebound secured by Dwyane Ginobili.

[02:54] Team_097 possession (Score: 44-38)
Gary Carter attempts a 3Pt. Heavily contested by Tyrese Wade (1.1 feet, ZONE)! Gary Carter misses. Rebound secured by Carmelo Ginobili.

[02:40] Team_100 possession (Score: 44-38)
Evan Butler attempts a 3Pt. Wide open! Dwyane Ginobili is 6.6 feet away. [MAN] EVAN BUTLER MAKES IT! Assist: Dirk Sabonis
Score: 44-41

[02:22] Team_097 possession (Score: 44-41)
Gary Carter attempts a Midrange. Contested by Dirk Sabonis (5.7 feet, MAN). GARY CARTER MAKES IT!
Score: 46-41

[02:10] Team_100 possession (Score: 46-41)
Carmelo Ginobili attempts a Layup. Heavily contested by Joel Simons (0.5 feet, ZONE)! Carmelo Ginobili misses. Rebound secured by Joel Simons.

[01:53] Team_097 possession (Score: 46-41)
Gary Carter attempts a 3Pt. Contested by Carmelo Ginobili (5.2 feet, ZONE). Gary Carter misses. Offensive rebound by Joel Simons! Joel Simons kicks it out.

[01:39] Team_097 possession (Score: 46-41)
Shai Poole attempts a 3Pt. Wide open! Tyrese Wade is 8.1 feet away. [ZONE] Shai Poole misses. Rebound secured by John Rozier.

[01:20] Team_100 possession (Score: 46-41)
John Rozier drives, Joel Simons stays with him. John Rozier attempts a Layup. Heavily contested by Joel Simons (1.6 feet, MAN)! John Rozier misses. Rebound secured by Miles Banchero.

[01:03] Team_097 possession (Score: 46-41)
Miles Banchero attempts a Layup. Contested by John Rozier (3.2 feet, ZONE). Miles Banchero misses. Rebound secured by John Rozier.

[00:47] Team_100 possession (Score: 46-41)
John Rozier attempts a Midrange. Contested by Joel Simons (5.3 feet, MAN). John Rozier misses. Rebound secured by Joel Simons.

[00:32] Team_097 possession (Score: 46-41)
Miles Banchero attempts a Layup. Contested by John Rozier (5.2 feet, MAN). MILES BANCHERO MAKES IT!
Score: 48-41

[00:15] Team_100 possession (Score: 48-41)
Dirk Sabonis attempts a 3Pt. Contested by Joel Simons (4.9 feet, ZONE). Dirk Sabonis misses. Rebound secured by Miles Banchero.

================================================================================
                              2ND QUARTER COMPLETE                              
================================================================================

2ND QUARTER SCORE: Team_097 23, Team_100 15

BOX SCORE:
================================================================================

Team_097
--------------------------------------------------------------------------------
Player                MIN  PTS  REB  AST  TO      FG   FG%      3P   3P%
--------------------------------------------------------------------------------
Evan Brogdon           13    5    0    0   0   2/2   100.0     0/0   0.0
Dwyane Ginobili        11    5    1    0   0   2/3    66.7     0/0   0.0
Shai Poole             22    4    1    0   0   2/4    50.0     0/0   0.0
Jrue Haliburton        14    3    0    2   0   1/1   100.0     0/0   0.0
Miles Banchero         11    2    4    1   0   1/3    33.3     0/0   0.0
Joel Simons            11    2    8    1   0   1/1   100.0     0/0   0.0
Gary Carter            11    2    0    0   0   1/4    25.0     0/0   0.0
Anthony Haliburton     13    0    0    2   0   0/0     0.0     0/0   0.0

TEAM: FG: 10/18 (55.6%), 3PT: 3/9 (33.3%), REB: 14 (4 off, 10 def), AST: 6, TO: 2
TEAM FOULS: 3


Team_100
--------------------------------------------------------------------------------
Player                MIN  PTS  REB  AST  TO      FG   FG%      3P   3P%
--------------------------------------------------------------------------------
Evan Butler            12    7    0    1   0   2/2   100.0     0/0   0.0
John Rozier            13    5    3    0   0   2/6    33.3     0/0   0.0
Dirk Sabonis           11    2    0    1   0   1/3    33.3     0/0   0.0
Carmelo Ginobili       12    1    3    0   0   1/3    33.3     0/0   0.0
Pau LaVine             12    0    1    0   0   0/2     0.0     0/0   0.0
Tyrese Wade            12    0    2    0   0   0/1     0.0     0/0   0.0

TEAM: FG: 6/17 (35.3%), 3PT: 2/7 (28.6%), REB: 9 (1 off, 8 def), AST: 2, TO: 3
TEAM FOULS: 5 [Team_097 in BONUS]

================================================================================

================================================================================
                       3RD QUARTER - Team_097 vs Team_100                       
================================================================================

[12:00] Team_097 possession (Score: 48-41)
Tyrese Stewart drives, Chris Mobley stays with him. Tyrese Stewart attempts a Dunk. Wide open! Chris Mobley is 6.8 feet away. [MAN] TYRESE STEWART MAKES IT!
Score: 50-41

[11:45] Team_100 possession (Score: 50-41)
FOUL! Holding foul on Shai Poole. [Team fouls: 1] No free throws, side out. (Shai Poole: 1 personal fouls)

[11:31] Team_100 possession (Score: 50-41)
FOUL! Holding foul on Anthony Haliburton. [Team fouls: 2] No free throws, side out. (Anthony Haliburton: 1 personal fouls)

[11:17] Team_100 possession (Score: 50-41)
Pau LaVine loses control! Ball rolls out of bounds! TURNOVER! (dead ball)

[11:03] Team_097 possession (Score: 50-41)
Jrue Haliburton attempts a Midrange. Wide open! Manu Ball is 9.6 feet away. [MAN] JRUE HALIBURTON MAKES IT! Assist: Tyrese Stewart
Score: 52-41

[10:47] Team_100 possession (Score: 52-41)
Luka Green loses control! Ball rolls out of bounds! TURNOVER! (dead ball)

[10:32] Team_097 possession (Score: 52-41)
Jrue Haliburton attempts a Layup. Contested by Pau LaVine (3.2 feet, ZONE). JRUE HALIBURTON MAKES IT! Assist: Evan Brogdon
Score: 54-41

[10:22] Team_100 possession (Score: 54-41)
Chris Mobley drives and kicks out. Chris Mobley attempts a Midrange. Contested by Jrue Haliburton (5.7 feet, ZONE). Chris Mobley misses. Rebound secured by Shai Poole.

[10:09] Team_097 possession (Score: 54-41)
Shai Poole attempts a Midrange. Contested by Pau LaVine (4.4 feet, ZONE). Shai Poole misses. Rebound secured by Chris Mobley.

[09:53] Team_100 possession (Score: 54-41)
Manu Ball attempts a Layup. Heavily contested by Jrue Haliburton (1.4 feet, MAN)! Manu Ball misses. Rebound secured by Anthony Haliburton.

[09:39] Team_097 possession (Score: 54-41)
Anthony Haliburton attempts a Midrange. Wide open! Pau LaVine is 6.9 feet away. [ZONE] ANTHONY HALIBURTON MAKES IT! Assist: Evan Brogdon
Score: 56-41

[09:23] Team_100 possession (Score: 56-41)
Chris Mobley drives and kicks out. Chris Mobley attempts a 3Pt. Contested by Anthony Haliburton (2.4 feet, MAN). Chris Mobley misses. Rebound secured by Shai Poole.

[09:09] Team_097 possession (Score: 56-41)
Shai Poole drives, picks up Tyler Griffin. Help arrives from Manu Ball! Shai Poole attempts a Layup. Contested by Manu Ball (2.4 feet, MAN). SHAI POOLE MAKES IT! Assist: Jrue Haliburton
Score: 58-41

[08:56] Team_100 possession (Score: 58-41)
FOUL! Shooting foul on Anthony Haliburton. Luka Green to the line for 2 free throws. [Team fouls: 3] (Anthony Haliburton: 2 personal fouls)   FT 1/2: GOOD   FT 2/2: GOOD Luka Green makes 2/2 from the line.
Score: 58-43

[08:44] Team_097 possession (Score: 58-43)
Tyrese Stewart attempts a Midrange. Contested by Chris Mobley (5.7 feet, MAN). Tyrese Stewart misses. Rebound secured by Chris Mobley.

[08:30] Team_100 possession (Score: 58-43)
Pau LaVine attempts a Midrange. Contested by Anthony Haliburton (4.9 feet, MAN). Pau LaVine misses. Rebound secured by Tyrese Stewart.

[08:16] Team_097 possession (Score: 58-43)
Tyrese Stewart attempts a Midrange. Wide open! Manu Ball is 10.0 feet away. [ZONE] Tyrese Stewart misses. Rebound secured by Tyler Griffin.

[08:01] Team_100 possession (Score: 58-43)
Pau LaVine drives to the basket... Pau LaVine loses control! Ball rolls out of bounds! TURNOVER! (dead ball)

[07:50] Team_097 possession (Score: 58-43)
Shai Poole drives, Tyler Griffin stays with him. Shai Poole attempts a Dunk. Contested by Tyler Griffin (4.8 feet, MAN). Shai Poole misses. Rebound secured by Tyler Griffin.

[07:36] Team_100 possession (Score: 58-43)
Pau LaVine attempts a 3Pt. Contested by Anthony Haliburton (4.6 feet, MAN). Pau LaVine misses. Offensive rebound by Pau LaVine! Pau LaVine kicks it out.

[07:21] Team_100 possession (Score: 58-43)
Pau LaVine drives, Anthony Haliburton stays with him. Pau LaVine attempts a Dunk. Contested by Anthony Haliburton (3.5 feet, MAN). Pau LaVine misses. Rebound secured by Anthony Haliburton.

[07:07] Team_097 possession (Score: 58-43)
FOUL! Holding foul on Manu Ball. [Team fouls: 1] No free throws, side out. (Manu Ball: 1 personal fouls)

[06:55] Team_097 possession (Score: 58-43)
Jrue Haliburton attempts a 3Pt. Wide open! Luka Green is 7.4 feet away. [ZONE] JRUE HALIBURTON MAKES IT! Assist: Evan Brogdon
Score: 61-43

[06:41] Team_100 possession (Score: 61-43)
Manu Ball attempts a Layup. Contested by Anthony Haliburton (2.7 feet, ZONE). MANU BALL MAKES IT!
Score: 61-45

[06:24] Team_097 possession (Score: 61-45)
Anthony Haliburton attempts a Dunk. BLOCKED BY PAU LAVINE! Ball goes out off Pau LaVine. Anthony Haliburton's ball!

[06:11] Team_097 possession (Score: 61-45)
Anthony Haliburton attempts a Layup. Contested by Chris Mobley (3.7 feet, ZONE). ANTHONY HALIBURTON MAKES IT! Assist: Shai Poole
Score: 63-45

[05:52] Team_100 possession (Score: 63-45)
Manu Ball attempts a 3Pt. Contested by Shai Poole (3.8 feet, ZONE). Manu Ball misses. FOUL! Loose ball foul on Shai Poole during the rebound battle. [Team fouls: 4] No free throws, side out. (Shai Poole: 2 personal fouls)

[05:41] Team_100 possession (Score: 63-45)
Chris Mobley drives and kicks out. Manu Ball attempts a Midrange. Contested by Jrue Haliburton (4.5 feet, MAN). Manu Ball misses. Rebound secured by Tyrese Stewart.

[05:25] Team_097 possession (Score: 63-45)
Shai Poole attempts a 3Pt. Wide open! Luka Green is 6.1 feet away. [ZONE] Shai Poole misses. Rebound secured by Tyler Griffin.

[05:11] Team_100 possession (Score: 63-45)
FOUL! Holding foul on Anthony Haliburton. [IN THE BONUS! 5 team fouls] Pau LaVine to the line for 2 free throws. (Anthony Haliburton: 3 personal fouls)   FT 1/2: MISS   FT 2/2: GOOD Pau LaVine makes 1/2 from the line.
Score: 63-46

[04:58] Team_097 possession (Score: 63-46)
Shai Poole drives and kicks out. Jrue Haliburton attempts a 3Pt. Wide open! Luka Green is 7.3 feet away. [ZONE] JRUE HALIBURTON MAKES IT! Assist: Anthony Haliburton
Score: 66-46

[04:41] Team_100 possession (Score: 66-46)
Manu Ball attempts a 3Pt. Contested by Jrue Haliburton (4.6 feet, MAN). MANU BALL MAKES IT! Assist: Luka Green
Score: 66-49

[04:29] Team_097 possession (Score: 66-49)
Evan Brogdon commits a violation (traveling/carry)! TURNOVER! (dead ball)

[04:12] Team_100 possession (Score: 66-49)
Manu Ball drives to the basket... Manu Ball loses the ball! Stripped by Anthony Haliburton! TURNOVER! (live ball)

[03:59] Team_097 possession (Score: 66-49)
Jrue Haliburton attempts a 3Pt. Contested by Luka Green (4.4 feet, ZONE). JRUE HALIBURTON MAKES IT! Assist: Evan Brogdon
Score: 69-49

[03:40] Team_100 possession (Score: 69-49)
Chris Mobley attempts a Layup. BLOCKED BY ANTHONY HALIBURTON! Ball is loose! Offensive rebound by Chris Mobley! Chris Mobley kicks it out.

[03:26] Team_100 possession (Score: 69-49)
Chris Mobley throws a bad pass! Stolen by Anthony Haliburton! TURNOVER! (live ball)

[03:08] Team_097 possession (Score: 69-49)
Jrue Haliburton attempts a Midrange. Contested by Tyler Griffin (5.2 feet, ZONE). JRUE HALIBURTON MAKES IT! Assist: Shai Poole
Score: 71-49

[02:57] Team_100 possession (Score: 71-49)
Manu Ball attempts a Midrange. Wide open! Jrue Haliburton is 6.9 feet away. [MAN] Manu Ball misses. Rebound secured by Shai Poole.

[02:44] Team_097 possession (Score: 71-49)
Shai Poole throws a bad pass! Stolen by Tyler Griffin! TURNOVER! (live ball)

[02:34] Team_100 possession (Score: 71-49)
Manu Ball attempts a 3Pt. Contested by Shai Poole (2.7 feet, ZONE). Manu Ball misses. Rebound secured by Tyrese Stewart.

[02:22] Team_097 possession (Score: 71-49)
Shai Poole drives, Tyler Griffin stays with him. Shai Poole attempts a Dunk. Contested by Tyler Griffin (2.2 feet, MAN). Shai Poole misses. Rebound secured by Pau LaVine.

[02:05] Team_100 possession (Score: 71-49)
Luka Green drives, Evan Brogdon stays with him. Luka Green attempts a Layup. Contested by Evan Brogdon (3.9 feet, MAN). LUKA GREEN MAKES IT! Assist: Pau LaVine
Score: 71-51

[01:52] Team_097 possession (Score: 71-51)
Evan Brogdon attempts a Midrange. Contested by Luka Green (5.1 feet, MAN). Evan Brogdon misses. Rebound secured by Tyler Griffin.

[01:35] Team_100 possession (Score: 71-51)
Pau LaVine attempts a Layup. Heavily contested by Anthony Haliburton (0.5 feet, ZONE)! PAU LAVINE MAKES IT! Assist: Manu Ball
Score: 71-53

[01:21] Team_097 possession (Score: 71-53)
Shai Poole attempts a 3Pt. Contested by Tyler Griffin (5.5 feet, MAN). Shai Poole misses. Rebound secured by Chris Mobley.

[01:06] Team_100 possession (Score: 71-53)
Chris Mobley drives, Anthony Haliburton stays with him. Chris Mobley attempts a Layup. Heavily contested by Anthony Haliburton (0.5 feet, MAN)! CHRIS MOBLEY MAKES IT!
Score: 71-55

[00:50] Team_097 possession (Score: 71-55)
Evan Brogdon attempts a 3Pt. Contested by Luka Green (4.6 feet, MAN). Evan Brogdon misses. Rebound secured by Tyler Griffin.

[00:34] Team_100 possession (Score: 71-55)
Tyler Griffin drives and kicks out. Tyler Griffin attempts a Midrange. Contested by Shai Poole (4.2 feet, MAN). Tyler Griffin misses. Offensive rebound by Chris Mobley! Chris Mobley kicks it out.

[00:23] Team_100 possession (Score: 71-55)
Chris Mobley drives, Anthony Haliburton stays with him. Chris Mobley attempts a Dunk. Contested by Anthony Haliburton (3.5 feet, MAN). CHRIS MOBLEY MAKES IT! Assist: Pau LaVine
Score: 71-57

[00:11] Team_097 possession (Score: 71-57)
Shai Poole attempts a Midrange. Contested by Luka Green (5.2 feet, ZONE). Shai Poole misses. FOUL! Loose ball foul on Pau LaVine during the rebound battle. [Team fouls: 2] No free throws, side out. (Pau LaVine: 1 personal fouls)

================================================================================
                              3RD QUARTER COMPLETE                              
================================================================================

3RD QUARTER SCORE: Team_097 23, Team_100 16

BOX SCORE:
================================================================================

Team_097
--------------------------------------------------------------------------------
Player                MIN  PTS  REB  AST  TO      FG   FG%      3P   3P%
--------------------------------------------------------------------------------
Jrue Haliburton        26   15    0    1   0   6/6   100.0     0/0   0.0
Anthony Haliburton     25    4    2    1   0   2/2   100.0     0/0   0.0
Tyrese Stewart         25    2    4    1   0   1/3    33.3     0/0   0.0
Shai Poole             34    2    3    2   0   1/6    16.7     0/0   0.0
Evan Brogdon           25    0    0    4   0   0/2     0.0     0/0   0.0

TEAM: FG: 10/19 (52.6%), 3PT: 2/5 (40.0%), REB: 9 (1 off, 8 def), AST: 9, TO: 2
TEAM FOULS: 5 [Team_100 in BONUS]


Team_100
--------------------------------------------------------------------------------
Player                MIN  PTS  REB  AST  TO      FG   FG%      3P   3P%
--------------------------------------------------------------------------------
Manu Ball              24    5    0    1   0   2/5    40.0     0/0   0.0
Chris Mobley           23    4    5    0   0   2/5    40.0     0/0   0.0
Luka Green             26    4    0    1   0   2/2   100.0     0/0   0.0
Pau LaVine             24    3    3    2   0   2/4    50.0     0/0   0.0
Tyler Griffin          24    0    5    0   0   0/0     0.0     0/0   0.0

TEAM: FG: 8/16 (50.0%), 3PT: 1/2 (50.0%), REB: 13 (4 off, 9 def), AST: 4, TO: 5
TEAM FOULS: 2

================================================================================

================================================================================
                       4TH QUARTER - Team_097 vs Team_100                       
================================================================================

[12:00] Team_097 possession (Score: 71-57)
Anthony Haliburton drives and kicks out. Evan Brogdon attempts a Midrange. Contested by Manu Ball (5.8 feet, ZONE). Evan Brogdon misses. Rebound secured by Tyler Griffin.

[11:42] Team_100 possession (Score: 71-57)
FOUL! Holding foul on Shai Poole. [Team fouls: 1] No free throws, side out. (Shai Poole: 1 personal fouls)

[11:23] Team_100 possession (Score: 71-57)
Chris Mobley attempts a 3Pt. Contested by Shai Poole (4.4 feet, ZONE). CHRIS MOBLEY MAKES IT! Assist: Tyler Griffin
Score: 71-60

[11:12] Team_097 possession (Score: 71-60)
Evan Brogdon attempts a 3Pt. Wide open! Tyler Griffin is 7.7 feet away. [ZONE] EVAN BROGDON MAKES IT! Assist: Tyrese Stewart
Score: 74-60

[10:59] Team_100 possession (Score: 74-60)
Pau LaVine attempts a Midrange. Contested by Anthony Haliburton (5.0 feet, MAN). Pau LaVine misses. Rebound secured by Shai Poole.

[10:48] Team_097 possession (Score: 74-60)
Anthony Haliburton attempts a Midrange. Wide open! Pau LaVine is 7.0 feet away. [ZONE] Anthony Haliburton misses. Rebound secured by Tyler Griffin.

[10:31] Team_100 possession (Score: 74-60)
Chris Mobley attempts a 3Pt. Contested by Anthony Haliburton (2.2 feet, ZONE). Chris Mobley misses. Rebound secured by Tyrese Stewart.

[10:17] Team_097 possession (Score: 74-60)
Jrue Haliburton attempts a Midrange. Contested by Tyler Griffin (4.4 feet, ZONE). Jrue Haliburton misses. Rebound secured by Pau LaVine.

[10:06] Team_100 possession (Score: 74-60)
Pau LaVine drives and kicks out. Manu Ball attempts a 3Pt. Heavily contested by Shai Poole (0.5 feet, ZONE)! Manu Ball misses. Rebound secured by Tyrese Stewart.

[09:49] Team_097 possession (Score: 74-60)
Shai Poole drives and kicks out. Anthony Haliburton attempts a Midrange. Wide open! Manu Ball is 6.8 feet away. [ZONE] ANTHONY HALIBURTON MAKES IT!
Score: 76-60

[09:31] Team_100 possession (Score: 76-60)
Pau LaVine drives, picks up Anthony Haliburton. Help arrives from Jrue Haliburton! Pau LaVine attempts a Layup. Contested by Jrue Haliburton (3.4 feet, MAN). Pau LaVine misses. Rebound secured by Shai Poole.

[09:16] Team_097 possession (Score: 76-60)
Shai Poole attempts a Midrange. Wide open! Manu Ball is 7.2 feet away. [ZONE] Shai Poole misses. Offensive rebound by Anthony Haliburton! Anthony Haliburton kicks it out.

[09:03] Team_097 possession (Score: 76-60)
Tyrese Stewart attempts a Layup. BLOCKED BY PAU LAVINE! Ball is loose! Rebound secured by Pau LaVine.

[08:51] Team_100 possession (Score: 76-60)
Tyler Griffin drives and kicks out. Chris Mobley attempts a Midrange. Contested by Jrue Haliburton (6.0 feet, ZONE). Chris Mobley misses. Rebound secured by Anthony Haliburton.

[08:37] Team_097 possession (Score: 76-60)
FOUL! Shooting foul on Chris Mobley. Jrue Haliburton to the line for 2 free throws. [Team fouls: 1] (Chris Mobley: 1 personal fouls)   FT 1/2: GOOD   FT 2/2: GOOD Jrue Haliburton makes 2/2 from the line.
Score: 78-60

[08:22] Team_100 possession (Score: 78-60)
Manu Ball attempts a 3Pt. Contested by Jrue Haliburton (4.1 feet, MAN). MANU BALL MAKES IT! Assist: Luka Green
Score: 78-63

[08:08] Team_097 possession (Score: 78-63)
Anthony Haliburton throws a bad pass! Stolen by Pau LaVine! TURNOVER! (live ball)

[07:58] Team_100 possession (Score: 78-63)
Tyler Griffin attempts a 3Pt. Contested by Shai Poole (5.2 feet, MAN). Tyler Griffin misses. FOUL! Loose ball foul on Shai Poole during the rebound battle. [Team fouls: 2] No free throws, side out. (Shai Poole: 2 personal fouls)

[07:43] Team_100 possession (Score: 78-63)
Manu Ball throws a bad pass! Stolen by Jrue Haliburton! TURNOVER! (live ball)

[07:30] Team_097 possession (Score: 78-63)
Anthony Haliburton drives, Pau LaVine stays with him. Anthony Haliburton attempts a Layup. Contested by Pau LaVine (5.7 feet, ZONE). Anthony Haliburton misses. Rebound secured by Tyler Griffin.

[07:17] Team_100 possession (Score: 78-63)
Tyler Griffin attempts a Midrange. Contested by Jrue Haliburton (3.7 feet, ZONE). TYLER GRIFFIN MAKES IT! Assist: Pau LaVine
Score: 78-65

[07:01] Team_097 possession (Score: 78-65)
Evan Brogdon drives and kicks out. Jrue Haliburton attempts a 3Pt. Contested by Manu Ball (5.2 feet, MAN). Jrue Haliburton misses. Rebound secured by Pau LaVine.

[06:44] Team_100 possession (Score: 78-65)
FOUL! Holding foul on Anthony Haliburton. [Team fouls: 3] No free throws, side out. (Anthony Haliburton: 1 personal fouls)

[06:32] Team_100 possession (Score: 78-65)
Tyler Griffin throws a bad pass! Stolen by Shai Poole! TURNOVER! (live ball)

[06:20] Team_097 possession (Score: 78-65)
Jrue Haliburton drives to the basket... Jrue Haliburton throws a bad pass out of bounds! TURNOVER! (dead ball)

[06:20] Substitution (Team_097): Evan Brogdon OUT → Gary Carter IN (stamina_rule2)

[06:20] Substitution (Team_097): Jrue Haliburton OUT → Dwyane Ginobili IN (stamina_rule2)

[06:20] Substitution (Team_097): Shai Poole OUT → Miles Dosunmu IN (stamina_rule2)

[06:20] Substitution (Team_097): Anthony Haliburton OUT → Joel Simons IN (stamina_rule2)

[06:20] Substitution (Team_097): Tyrese Stewart OUT → Miles Banchero IN (stamina_rule2)

[06:20] Substitution (Team_100): Luka Green OUT → Dirk Sabonis IN (stamina_rule2)

[06:20] Substitution (Team_100): Manu Ball OUT → Evan Butler IN (stamina_rule2)

[06:20] Substitution (Team_100): Tyler Griffin OUT → Tyrese Wade IN (stamina_rule2)

[06:20] Substitution (Team_100): Pau LaVine OUT → Carmelo Ginobili IN (stamina_rule2)

[06:20] Substitution (Team_100): Chris Mobley OUT → John Rozier IN (stamina_rule2)

[06:04] Team_100 possession (Score: 78-65)
John Rozier attempts a Midrange. BLOCKED BY JOEL SIMONS! Ball deflects out of bounds off John Rozier.

[05:53] Team_097 possession (Score: 78-65)
Miles Banchero drives, John Rozier stays with him. Miles Banchero attempts a Dunk. Contested by John Rozier (3.3 feet, MAN). Miles Banchero misses. Rebound secured by John Rozier.

[05:43] Team_100 possession (Score: 78-65)
Tyrese Wade drives, picks up Joel Simons. Help arrives from Dwyane Ginobili! Tyrese Wade attempts a Layup. Contested by Dwyane Ginobili (3.1 feet, ZONE). TYRESE WADE MAKES IT!
Score: 78-67

[05:28] Team_097 possession (Score: 78-67)
Gary Carter drives, picks up Dirk Sabonis. Help arrives from Tyrese Wade! Gary Carter attempts a Layup. Contested by Tyrese Wade (4.0 feet, MAN). Gary Carter misses. Rebound secured by Tyrese Wade.

[05:14] Team_100 possession (Score: 78-67)
Carmelo Ginobili attempts a Midrange. Heavily contested by Joel Simons (0.5 feet, ZONE)! Carmelo Ginobili misses. Rebound secured by Joel Simons.

[05:00] Team_097 possession (Score: 78-67)
Miles Dosunmu drives, picks up Tyrese Wade. Help arrives from Evan Butler! Miles Dosunmu attempts a Layup. Contested by Evan Butler (4.3 feet, MAN). MILES DOSUNMU MAKES IT!
Score: 80-67

[04:45] Team_100 possession (Score: 80-67)
Dirk Sabonis loses control! Ball rolls out of bounds! TURNOVER! (dead ball)

[04:32] Team_097 possession (Score: 80-67)
Joel Simons throws a bad pass! Stolen by Carmelo Ginobili! TURNOVER! (live ball)

[04:17] Team_100 possession (Score: 80-67)
Tyrese Wade attempts a Layup. Contested by Joel Simons (2.1 feet, ZONE). Tyrese Wade misses. Offensive rebound by John Rozier! John Rozier's putback is no good. Rebound secured by Miles Banchero.

[04:01] Team_097 possession (Score: 80-67)
Joel Simons drives and kicks out. Miles Dosunmu attempts a 3Pt. Wide open! Tyrese Wade is 6.3 feet away. [MAN] Miles Dosunmu misses. Rebound secured by Carmelo Ginobili.

[03:47] Team_100 possession (Score: 80-67)
Carmelo Ginobili attempts a Midrange. Contested by Miles Dosunmu (4.1 feet, ZONE). Carmelo Ginobili misses. Offensive rebound by John Rozier! John Rozier puts it back in!
Score: 80-69

[03:32] Team_097 possession (Score: 80-69)
Joel Simons attempts a Midrange. Wide open! Carmelo Ginobili is 6.3 feet away. [ZONE] JOEL SIMONS MAKES IT! Assist: Gary Carter
Score: 82-69

[03:20] Team_100 possession (Score: 82-69)
Dirk Sabonis attempts a 3Pt. Contested by Gary Carter (4.0 feet, MAN). Dirk Sabonis misses. Rebound secured by Joel Simons.

[03:02] Team_097 possession (Score: 82-69)
Joel Simons drives, Carmelo Ginobili stays with him. Joel Simons attempts a Layup. Wide open! Carmelo Ginobili is 7.1 feet away. [MAN] Joel Simons misses. Offensive rebound by Joel Simons! Joel Simons kicks it out.

[02:47] Team_097 possession (Score: 82-69)
Miles Banchero attempts a Midrange. Wide open! Tyrese Wade is 6.9 feet away. [ZONE] Miles Banchero misses. Rebound secured by Carmelo Ginobili.

[02:33] Team_100 possession (Score: 82-69)
Carmelo Ginobili attempts a 3Pt. Contested by Gary Carter (3.7 feet, ZONE). CARMELO GINOBILI MAKES IT! Assist: Evan Butler
Score: 82-72

[02:16] Team_097 possession (Score: 82-72)
Dwyane Ginobili loses control! Ball rolls out of bounds! TURNOVER! (dead ball)

[02:04] Team_100 possession (Score: 82-72)
Tyrese Wade attempts a 3Pt. Contested by Miles Dosunmu (5.2 feet, MAN). Tyrese Wade misses. Rebound secured by Miles Dosunmu.

[01:49] Team_097 possession (Score: 82-72)
Gary Carter attempts a Midrange. Contested by Dirk Sabonis (4.9 feet, MAN). Gary Carter misses. FOUL! Loose ball foul on Carmelo Ginobili during the rebound battle. [Team fouls: 2] No free throws, side out. (Carmelo Ginobili: 1 personal fouls)

[01:33] Team_097 possession (Score: 82-72)
Gary Carter attempts a 3Pt. Wide open! Dirk Sabonis is 6.2 feet away. [MAN] Gary Carter misses. Rebound secured by John Rozier.

[01:22] Team_100 possession (Score: 82-72)
Tyrese Wade attempts a 3Pt. Contested by Miles Dosunmu (4.4 feet, MAN). TYRESE WADE MAKES IT! Assist: Dirk Sabonis
Score: 82-75

[01:06] Team_097 possession (Score: 82-75)
Gary Carter attempts a 3Pt. Contested by Tyrese Wade (3.8 feet, ZONE). GARY CARTER MAKES IT! Assist: Dwyane Ginobili
Score: 85-75

[00:55] Team_100 possession (Score: 85-75)
Carmelo Ginobili attempts a Layup. BLOCKED BY JOEL SIMONS! Ball deflects out of bounds off Carmelo Ginobili.

[00:40] Team_097 possession (Score: 85-75)
Miles Banchero drives, picks up John Rozier. Help arrives from Evan Butler! Miles Banchero attempts a Dunk. Heavily contested by Evan Butler (0.5 feet, MAN)! Miles Banchero misses. Offensive rebound by Joel Simons! Joel Simons kicks it out.

[00:23] Team_097 possession (Score: 85-75)
Dwyane Ginobili attempts a Layup. Contested by John Rozier (4.2 feet, ZONE). DWYANE GINOBILI MAKES IT!
Score: 87-75

[00:04] Team_100 possession (Score: 87-75)
Evan Butler drives and kicks out. Dirk Sabonis attempts a 3Pt. Contested by Joel Simons (4.6 feet, ZONE). Dirk Sabonis misses. Rebound secured by Miles Dosunmu.

================================================================================
                              4TH QUARTER COMPLETE                              
================================================================================

4TH QUARTER SCORE: Team_097 16, Team_100 18

BOX SCORE:
================================================================================

Team_097
--------------------------------------------------------------------------------
Player                MIN  PTS  REB  AST  TO      FG   FG%      3P   3P%
--------------------------------------------------------------------------------
Evan Brogdon           31    3    0    0   0   1/2    50.0     0/0   0.0
Gary Carter            18    3    0    1   0   1/3    33.3     0/0   0.0
Anthony Haliburton     31    2    2    0   0   1/4    25.0     0/0   0.0
Jrue Haliburton        31    2    0    0   0   1/2    50.0     0/0   0.0
Joel Simons            18    2    5    0   0   1/2    50.0     0/0   0.0
Miles Dosunmu           8    2    2    0   0   1/1   100.0     0/0   0.0
Dwyane Ginobili        17    2    0    1   0   1/1   100.0     0/0   0.0
Tyrese Stewart         31    0    2    1   0   0/1     0.0     0/0   0.0
Shai Poole             40    0    2    0   0   0/0     0.0     0/0   0.0
Miles Banchero         18    0    1    0   0   0/2     0.0     0/0   0.0

TEAM: FG: 7/18 (38.9%), 3PT: 2/3 (66.7%), REB: 13 (4 off, 9 def), AST: 3, TO: 4
TEAM FOULS: 3


Team_100
--------------------------------------------------------------------------------
Player                MIN  PTS  REB  AST  TO      FG   FG%      3P   3P%
--------------------------------------------------------------------------------
Tyrese Wade            18    5    1    0   0   2/4    50.0     0/0   0.0
Chris Mobley           29    3    0    0   0   1/2    50.0     0/0   0.0
Manu Ball              30    3    0    0   0   1/1   100.0     0/0   0.0
Carmelo Ginobili       18    3    2    0   0   1/3    33.3     0/0   0.0
Tyler Griffin          30    2    3    1   0   1/2    50.0     0/0   0.0
John Rozier            19    2    3    0   0   1/2    50.0     0/0   0.0
Pau LaVine             30    0    4    1   0   0/3     0.0     0/0   0.0
Luka Green             31    0    0    1   0   0/0     0.0     0/0   0.0
Dirk Sabonis           17    0    0    1   0   0/1     0.0     0/0   0.0
Evan Butler            18    0    0    1   0   0/1     0.0     0/0   0.0

TEAM: FG: 7/19 (36.8%), 3PT: 4/7 (57.1%), REB: 14 (3 off, 11 def), AST: 5, TO: 3
TEAM FOULS: 2

================================================================================

================================================================================
                               FULL GAME COMPLETE                               
================================================================================

FINAL SCORE: Team_097 87, Team_100 75

SCORING BY QUARTER:
--------------------------------------------------------------------------------
Team                     Q1     Q2     Q3     Q4    FINAL
--------------------------------------------------------------------------------
Team_097                 25     23     23     16       87
Team_100                 26     15     16     18       75
--------------------------------------------------------------------------------

FULL GAME BOX SCORE:
================================================================================

Team_097
--------------------------------------------------------------------------------
Player                MIN  PTS  REB  AST  TO      FG   FG%      3P   3P%      FT STL BLK
--------------------------------------------------------------------------------
Shai Poole             40    8    8    3   3   6/14   42.9   0/4     0.0   0/0     1   0
Jrue Haliburton        31   22    0    4   0   8/9    88.9   3/3   100.0   2/2     1   0
Evan Brogdon           31    8    0    4   2   3/7    42.9   2/4    50.0   0/0     1   1
Anthony Haliburton     31    8    8    4   3   3/9    33.3   0/0     0.0   1/2     2   2
Tyrese Stewart         31   12    9    2   1   5/11   45.5   0/0     0.0   4/5     0   0
Gary Carter            18    5    0    2   0   2/7    28.6   1/5    20.0   0/0     0   0
Joel Simons            18    8   14    1   1   4/5    80.0   0/0     0.0   2/2     0   2
Miles Banchero         18    2    5    1   1   1/5    20.0   0/1     0.0   0/0     0   0
Dwyane Ginobili        17    7    1    1   1   3/4    75.0   1/2    50.0   0/0     0   0
Miles Dosunmu           8    4    3    0   0   2/2   100.0   0/0     0.0   0/0     0   0

TEAM: FG: 37/73 (50.7%), 3PT: 7/19 (36.8%), REB: 47 (11 off, 36 def), AST: 22, TO: 12


Team_100
--------------------------------------------------------------------------------
Player                MIN  PTS  REB  AST  TO      FG   FG%      3P   3P%      FT STL BLK
--------------------------------------------------------------------------------
Luka Green             31    6    0    3   3   3/5    60.0   0/1     0.0   2/2     0   0
Manu Ball              30    8    0    1   2   3/6    50.0   2/3    66.7   0/0     0   0
Tyler Griffin          30   10   11    2   3   4/9    44.4   1/3    33.3   1/1     1   0
Pau LaVine             30    5   13    5   2   2/10   20.0   0/1     0.0   1/2     2   2
Chris Mobley           29   13    7    0   3   5/10   50.0   1/2    50.0   2/2     0   0
John Rozier            19   10    6    0   0   3/8    37.5   0/1     0.0   2/2     1   2
Evan Butler            18   10    0    2   0   3/4    75.0   3/3   100.0   1/1     0   1
Tyrese Wade            18    5    3    0   0   2/6    33.3   1/3    33.3   1/2     0   0
Carmelo Ginobili       18    5    6    0   0   4/8    50.0   1/2    50.0   2/4     1   0
Dirk Sabonis           17    2    0    2   1   1/4    25.0   0/3     0.0   0/0     0   0

TEAM: FG: 31/71 (43.7%), 3PT: 9/22 (40.9%), REB: 47 (11 off, 36 def), AST: 15, TO: 14

================================================================================
