================================================================================
                        FULL GAME - Team_066 vs Team_005                        
================================================================================

================================================================================
                       1ST QUARTER - Team_066 vs Team_005                       
================================================================================

[12:00] Team_066 possession (Score: 0-0)
Yao Brogdon attempts a 3Pt. Wide open! Jalen Rozier is 7.2 feet away. [ZONE] YAO BROGDON MAKES IT! Assist: Brandon Reaves
Score: 3-0

[11:45] Team_005 possession (Score: 3-0)
Cade Markkanen makes the Midrange and draws the foul on Kyle Wagner! And-1! Cade Markkanen to the line for 1. [Team fouls: 1] (Kyle Wagner: 1 personal fouls)   FT 1/1: GOOD Cade Markkanen makes 1/1 from the line.
Score: 3-3

[11:26] Team_066 possession (Score: 3-3)
FOUL! Holding foul on Cade Markkanen. [Team fouls: 1] No free throws, side out. (Cade Markkanen: 1 personal fouls)

[11:12] Team_066 possession (Score: 3-3)
FOUL! Shooting foul on Anthony Rozier. Jimmy Davis to the line for 2 free throws. [Team fouls: 2] (Anthony Rozier: 1 personal fouls)   FT 1/2: GOOD   FT 2/2: GOOD Jimmy Davis makes 2/2 from the line.
Score: 5-3

[10:58] Team_005 possession (Score: 5-3)
Cade Markkanen attempts a Midrange. Wide open! Brandon Reaves is 8.6 feet away. [ZONE] Cade Markkanen misses. Rebound secured by Brandon Reaves.

[10:43] Team_066 possession (Score: 5-3)
Jimmy Davis attempts a Layup. Wide open! Brandon George is 7.5 feet away. [MAN] JIMMY DAVIS MAKES IT! Assist: Brandon Reaves
Score: 7-3

[10:30] Team_005 possession (Score: 7-3)
Cade Markkanen attempts a 3Pt. Contested by Pau Curry (4.6 feet, ZONE). CADE MARKKANEN MAKES IT! Assist: Anthony Rozier
Score: 7-6

[10:17] Team_066 possession (Score: 7-6)
Jimmy Davis drives and kicks out. FOUL! Shooting foul on Cade Markkanen. Kyle Wagner to the line for 2 free throws. [Team fouls: 3] (Cade Markkanen: 2 personal fouls)   FT 1/2: GOOD   FT 2/2: GOOD Kyle Wagner makes 2/2 from the line.
Score: 9-6

[10:00] Team_005 possession (Score: 9-6)
Derrick Allen attempts a 3Pt. Contested by Pau Curry (5.8 feet, ZONE). DERRICK ALLEN MAKES IT! Assist: Anthony Rozier
Score: 9-9

[09:44] Team_066 possession (Score: 9-9)
Jimmy Davis commits a violation (traveling/carry)! TURNOVER! (dead ball)

[09:30] Team_005 possession (Score: 9-9)
Anthony Rozier attempts a 3Pt. Contested by Pau Curry (4.6 feet, ZONE). ANTHONY ROZIER MAKES IT! Assist: Derrick Allen
Score: 9-12

[09:16] Team_066 possession (Score: 9-12)
FOUL! Shooting foul on Anthony Rozier. Yao Brogdon to the line for 2 free throws. [Team fouls: 4] (Anthony Rozier: 2 personal fouls)   FT 1/2: GOOD   FT 2/2: MISS Yao Brogdon makes 1/2 from the line. Rebound secured by Jalen Rozier.
Score: 10-12

[09:05] Team_005 possession (Score: 10-12)
Derrick Allen attempts a 3Pt. Contested by Pau Curry (3.1 feet, ZONE). Derrick Allen misses. Offensive rebound by Cade Markkanen! Cade Markkanen's putback is no good. Rebound secured by Kyle Wagner.

[08:52] Team_066 possession (Score: 10-12)
Jimmy Davis drives and kicks out. Jimmy Davis attempts a Midrange. Contested by Derrick Allen (4.7 feet, ZONE). JIMMY DAVIS MAKES IT! Assist: Brandon Reaves
Score: 12-12

[08:36] Team_005 possession (Score: 12-12)
Anthony Rozier drives, Pau Curry stays with him. Anthony Rozier attempts a Layup. Contested by Pau Curry (5.9 feet, MAN). ANTHONY ROZIER MAKES IT! Assist: Derrick Allen
Score: 12-14

[08:24] Team_066 possession (Score: 12-14)
Brandon Reaves attempts a 3Pt. Contested by Derrick Allen (2.6 feet, ZONE). Brandon Reaves misses. Rebound secured by Jalen Rozier.

[08:10] Team_005 possession (Score: 12-14)
Derrick Allen attempts a Midrange. Wide open! Brandon Reaves is 6.6 feet away. [MAN] Derrick Allen misses. Rebound secured by Kyle Wagner.

[07:52] Team_066 possession (Score: 12-14)
Brandon Reaves makes the Midrange and draws the foul on Derrick Allen! And-1! Brandon Reaves to the line for 1. [BONUS: 5 team fouls] (Derrick Allen: 1 personal fouls)   FT 1/1: GOOD Brandon Reaves makes 1/1 from the line.
Score: 15-14

[07:35] Team_005 possession (Score: 15-14)
Brandon George attempts a 3Pt. Contested by Jimmy Davis (5.9 feet, MAN). BRANDON GEORGE MAKES IT! Assist: Cade Markkanen
Score: 15-17

[07:18] Team_066 possession (Score: 15-17)
Kyle Wagner attempts a 3Pt. Wide open! Derrick Allen is 8.3 feet away. [ZONE] Kyle Wagner misses. Rebound secured by Jalen Rozier.

[07:01] Team_005 possession (Score: 15-17)
Jalen Rozier attempts a 3Pt. Wide open! Pau Curry is 7.5 feet away. [ZONE] Jalen Rozier misses. Rebound secured by Kyle Wagner.

[06:48] Team_066 possession (Score: 15-17)
Brandon Reaves drives and kicks out. Pau Curry attempts a 3Pt. Contested by Derrick Allen (3.0 feet, ZONE). PAU CURRY MAKES IT!
Score: 18-17

[06:38] Team_005 possession (Score: 18-17)
Derrick Allen makes the Layup and draws the foul on Brandon Reaves! And-1! Derrick Allen to the line for 1. [Team fouls: 2] (Brandon Reaves: 1 personal fouls)   FT 1/1: MISS Derrick Allen makes 0/1 from the line. FOUL! Loose ball foul on Brandon Reaves during the free throw rebound! [Team fouls: 3] No free throws, side out. (Brandon Reaves: 2 personal fouls)
Score: 18-19

[06:23] Team_005 possession (Score: 18-19)
Derrick Allen attempts a Layup. BLOCKED BY KYLE WAGNER! Ball is loose! Offensive rebound by Cade Markkanen! Cade Markkanen kicks it out.

[06:13] Team_005 possession (Score: 18-19)
Brandon George attempts a Layup. Contested by Jimmy Davis (4.3 feet, MAN). BRANDON GEORGE MAKES IT! Assist: Anthony Rozier
Score: 18-21

[05:57] Team_066 possession (Score: 18-21)
Jimmy Davis drives to the basket... Jimmy Davis throws a bad pass! Stolen by Cade Markkanen! TURNOVER! (live ball)

[05:41] Team_005 possession (Score: 18-21)
Anthony Rozier loses control! Ball rolls out of bounds! TURNOVER! (dead ball)

[05:28] Team_066 possession (Score: 18-21)
Jimmy Davis attempts a Layup. Wide open! Brandon George is 6.0 feet away. [MAN] Jimmy Davis misses. Rebound secured by Derrick Allen.

[05:16] Team_005 possession (Score: 18-21)
Brandon George drives and kicks out. Derrick Allen attempts a 3Pt. Wide open! Brandon Reaves is 7.6 feet away. [MAN] DERRICK ALLEN MAKES IT! Assist: Brandon George
Score: 18-24

[04:57] Team_066 possession (Score: 18-24)
Kyle Wagner drives and kicks out. Jimmy Davis attempts a 3Pt. Heavily contested by Derrick Allen (0.8 feet, ZONE)! Jimmy Davis misses. Rebound secured by Derrick Allen.

[04:44] Team_005 possession (Score: 18-24)
Anthony Rozier drives, Kyle Wagner stays with him. Anthony Rozier attempts a Dunk. Heavily contested by Kyle Wagner (0.5 feet, ZONE)! ANTHONY ROZIER MAKES IT!
Score: 18-26

[04:29] Team_066 possession (Score: 18-26)
Jimmy Davis drives to the basket... Jimmy Davis loses the ball! Stripped by Brandon George! TURNOVER! (live ball)

[04:19] Team_005 possession (Score: 18-26)
Cade Markkanen drives and kicks out. Derrick Allen attempts a 3Pt. Contested by Brandon Reaves (4.9 feet, MAN). Derrick Allen misses. Rebound secured by Brandon Reaves.

[04:08] Team_066 possession (Score: 18-26)
Pau Curry drives and kicks out. Brandon Reaves attempts a 3Pt. Contested by Derrick Allen (4.8 feet, ZONE). Brandon Reaves misses. Rebound secured by Cade Markkanen.

[03:51] Team_005 possession (Score: 18-26)
Cade Markkanen drives, picks up Kyle Wagner. Help arrives from Jimmy Davis! Cade Markkanen attempts a Layup. Heavily contested by Jimmy Davis (0.5 feet, MAN)! CADE MARKKANEN MAKES IT!
Score: 18-28

[03:37] Team_066 possession (Score: 18-28)
FOUL! Reach-in foul on Cade Markkanen during the drive. [IN THE BONUS! 6 team fouls] Kyle Wagner to the line for 2 free throws. (Cade Markkanen: 3 personal fouls)   FT 1/2: GOOD   FT 2/2: MISS Kyle Wagner makes 1/2 from the line. Rebound secured by Jalen Rozier.
Score: 19-28

[03:23] Team_005 possession (Score: 19-28)
Anthony Rozier attempts a 3Pt. Wide open! Yao Brogdon is 6.7 feet away. [ZONE] Anthony Rozier misses. Offensive rebound by Cade Markkanen! Cade Markkanen's putback is no good. Rebound secured by Yao Brogdon.

[03:06] Team_066 possession (Score: 19-28)
Yao Brogdon drives and kicks out. Jimmy Davis attempts a Midrange. Wide open! Jalen Rozier is 6.7 feet away. [ZONE] Jimmy Davis misses. Offensive rebound by Yao Brogdon! Yao Brogdon kicks it out.

[02:53] Team_066 possession (Score: 19-28)
Pau Curry attempts a 3Pt. Wide open! Anthony Rozier is 7.3 feet away. [MAN] Pau Curry misses. Rebound secured by Jalen Rozier.

[02:36] Team_005 possession (Score: 19-28)
Brandon George drives, Jimmy Davis stays with him. Brandon George attempts a Layup. Contested by Jimmy Davis (3.6 feet, MAN). BRANDON GEORGE MAKES IT!
Score: 19-30

[02:25] Team_066 possession (Score: 19-30)
Brandon Reaves attempts a Midrange. Contested by Derrick Allen (4.9 feet, ZONE). BRANDON REAVES MAKES IT! Assist: Jimmy Davis
Score: 21-30

[02:11] Team_005 possession (Score: 21-30)
Brandon George attempts a Layup. BLOCKED BY JIMMY DAVIS! Ball is loose! Rebound secured by Brandon Reaves.

[01:55] Team_066 possession (Score: 21-30)
Kyle Wagner drives to the basket... FOUL! Offensive foul on Kyle Wagner! Cade Markkanen drew the charge! [Team fouls: 4] (Kyle Wagner: 2 personal fouls) TURNOVER! (dead ball)

[01:36] Team_005 possession (Score: 21-30)
Jalen Rozier drives and kicks out. FOUL! Shooting foul on Kyle Wagner. Cade Markkanen to the line for 3 free throws. [BONUS: 5 team fouls] (Kyle Wagner: 3 personal fouls)   FT 1/3: GOOD   FT 2/3: MISS   FT 3/3: GOOD Cade Markkanen makes 2/3 from the line.
Score: 21-32

[01:19] Team_066 possession (Score: 21-32)
Yao Brogdon drives, Cade Markkanen stays with him. Yao Brogdon attempts a Dunk. Contested by Cade Markkanen (4.4 feet, ZONE). YAO BROGDON MAKES IT! Assist: Kyle Wagner
Score: 23-32

[01:06] Team_005 possession (Score: 23-32)
Cade Markkanen makes the Midrange and draws the foul on Kyle Wagner! And-1! Cade Markkanen to the line for 1. [BONUS: 6 team fouls] (Kyle Wagner: 4 personal fouls)   FT 1/1: GOOD Cade Markkanen makes 1/1 from the line.
Score: 23-35

[00:52] Team_066 possession (Score: 23-35)
Brandon Reaves attempts a Midrange. Contested by Derrick Allen (3.7 feet, MAN). Brandon Reaves misses. Offensive rebound by Kyle Wagner! Kyle Wagner kicks it out.

[00:34] Team_066 possession (Score: 23-35)
Jimmy Davis attempts a Midrange. Wide open! Brandon George is 7.7 feet away. [MAN] JIMMY DAVIS MAKES IT!
Score: 25-35

[00:21] Team_005 possession (Score: 25-35)
Anthony Rozier drives to the basket... FOUL! Offensive foul on Anthony Rozier! Pau Curry drew the charge! [Team fouls: 7] (Anthony Rozier: 3 personal fouls) TURNOVER! (dead ball)

[00:07] Team_066 possession (Score: 25-35)
Pau Curry attempts a 3Pt. Wide open! Anthony Rozier is 9.8 feet away. [MAN] PAU CURRY MAKES IT! Assist: Brandon Reaves
Score: 28-35

================================================================================
                              1ST QUARTER COMPLETE                              
================================================================================

1ST QUARTER SCORE: Team_066 28, Team_005 35

BOX SCORE:
================================================================================

Team_066
--------------------------------------------------------------------------------
Player                MIN  PTS  REB  AST  TO      FG   FG%      3P   3P%
--------------------------------------------------------------------------------
Jimmy Davis            12    8    0    1   0   4/5    80.0     0/0   0.0
Pau Curry              12    6    0    0   0   2/4    50.0     0/0   0.0
Yao Brogdon            12    5    2    0   0   2/3    66.7     0/0   0.0
Brandon Reaves         12    5    3    4   0   2/3    66.7     0/0   0.0
Kyle Wagner            12    2    4    1   0   1/4    25.0     0/0   0.0

TEAM: FG: 11/19 (57.9%), 3PT: 2/5 (40.0%), REB: 7 (2 off, 5 def), AST: 6, TO: 4
TEAM FOULS: 6 [Team_005 in BONUS]


Team_005
--------------------------------------------------------------------------------
Player                MIN  PTS  REB  AST  TO      FG   FG%      3P   3P%
--------------------------------------------------------------------------------
Cade Markkanen         12   13    2    1   0   5/7    71.4     0/0   0.0
Anthony Rozier         12    7    0    3   0   3/4    75.0     0/0   0.0
Brandon George         12    7    0    1   0   3/4    75.0     0/0   0.0
Derrick Allen          12    6    2    2   0   2/4    50.0     0/0   0.0
Jalen Rozier           12    0    6    0   0   0/1     0.0     0/0   0.0

TEAM: FG: 13/20 (65.0%), 3PT: 4/7 (57.1%), REB: 12 (4 off, 8 def), AST: 7, TO: 2
TEAM FOULS: 7 [Team_066 in BONUS]

================================================================================

================================================================================
                       2ND QUARTER - Team_066 vs Team_005                       
================================================================================

[12:00] Team_066 possession (Score: 28-35)
Yao Brogdon attempts a Layup. Contested by Cade Markkanen (2.9 feet, ZONE). Yao Brogdon misses. Offensive rebound by Yao Brogdon! Yao Brogdon kicks it out.

[11:46] Team_066 possession (Score: 28-35)
Kyle Wagner attempts a 3Pt. Contested by Cade Markkanen (2.5 feet, MAN). Kyle Wagner misses. Rebound secured by Jalen Rozier.

[11:33] Team_005 possession (Score: 28-35)
Cade Markkanen attempts a Midrange. Contested by Kyle Wagner (3.6 feet, MAN). Cade Markkanen misses. Rebound secured by Brandon Reaves.

[11:19] Team_066 possession (Score: 28-35)
Jimmy Davis attempts a 3Pt. Contested by Derrick Allen (5.3 feet, ZONE). Jimmy Davis misses. FOUL! Loose ball foul on Derrick Allen during the rebound battle. [Team fouls: 1] No free throws, side out. (Derrick Allen: 1 personal fouls)

[11:02] Team_066 possession (Score: 28-35)
Kyle Wagner attempts a 3Pt. Heavily contested by Derrick Allen (0.7 feet, ZONE)! Kyle Wagner misses. Rebound secured by Cade Markkanen.

[10:48] Team_005 possession (Score: 28-35)
Cade Markkanen attempts a Midrange. Contested by Brandon Reaves (5.5 feet, ZONE). CADE MARKKANEN MAKES IT!
Score: 28-37

[10:35] Team_066 possession (Score: 28-37)
Brandon Reaves attempts a Layup. BLOCKED BY CADE MARKKANEN! Ball is loose! Rebound secured by Cade Markkanen.

[10:19] Team_005 possession (Score: 28-37)
Brandon George attempts a 3Pt. Contested by Jimmy Davis (3.0 feet, MAN). BRANDON GEORGE MAKES IT! Assist: Anthony Rozier
Score: 28-40

[10:04] Team_066 possession (Score: 28-40)
Pau Curry throws a bad pass out of bounds! TURNOVER! (dead ball)

[10:04] Substitution (Team_066): Jimmy Davis OUT → Pascal Carter IN (stamina_rule2)

[10:04] Substitution (Team_066): Pau Curry OUT → Lauri LaVine IN (stamina_rule2)

[10:04] Substitution (Team_066): Brandon Reaves OUT → Brandon Middleton IN (stamina_rule2)

[10:04] Substitution (Team_066): Yao Brogdon OUT → Cole Morant IN (stamina_rule2)

[10:04] Substitution (Team_066): Kyle Wagner OUT → Donovan Simmons IN (stamina_rule2)

[10:04] Substitution (Team_005): Brandon George OUT → Blake O'Neal IN (stamina_rule2)

[10:04] Substitution (Team_005): Anthony Rozier OUT → Draymond Smith IN (stamina_rule2)

[10:04] Substitution (Team_005): Derrick Allen OUT → Lauri Wade IN (stamina_rule2)

[10:04] Substitution (Team_005): Jalen Rozier OUT → Isaiah Durant IN (stamina_rule2)

[10:04] Substitution (Team_005): Cade Markkanen OUT → Zion Parker IN (stamina_rule2)

[09:47] Team_005 possession (Score: 28-40)
FOUL! Reach-in foul on Donovan Simmons during the drive. [Team fouls: 1] No free throws, side out. (Donovan Simmons: 1 personal fouls)

[09:31] Team_005 possession (Score: 28-40)
Lauri Wade attempts a Midrange. Contested by Brandon Middleton (3.4 feet, MAN). LAURI WADE MAKES IT!
Score: 28-42

[09:16] Team_066 possession (Score: 28-42)
Lauri LaVine attempts a 3Pt. Wide open! Draymond Smith is 7.0 feet away. [ZONE] LAURI LAVINE MAKES IT! Assist: Pascal Carter
Score: 31-42

[09:01] Team_005 possession (Score: 31-42)
Lauri Wade drives, picks up Donovan Simmons. Help arrives from Lauri LaVine! Lauri Wade attempts a Dunk. Contested by Lauri LaVine (2.5 feet, ZONE). LAURI WADE MAKES IT! Assist: Draymond Smith
Score: 31-44

[08:45] Team_066 possession (Score: 31-44)
Brandon Middleton attempts a 3Pt. Heavily contested by Blake O'Neal (2.0 feet, ZONE)! Brandon Middleton misses. Rebound secured by Draymond Smith.

[08:32] Team_005 possession (Score: 31-44)
Draymond Smith attempts a 3Pt. Contested by Lauri LaVine (2.4 feet, MAN). Draymond Smith misses. Offensive rebound by Draymond Smith! Draymond Smith kicks it out.

[08:19] Team_005 possession (Score: 31-44)
Lauri Wade drives and kicks out. Blake O'Neal attempts a 3Pt. Wide open! Pascal Carter is 8.6 feet away. [MAN] BLAKE O'NEAL MAKES IT! Assist: Isaiah Durant
Score: 31-47

[08:02] Team_066 possession (Score: 31-47)
Pascal Carter attempts a 3Pt. Contested by Blake O'Neal (3.4 feet, MAN). PASCAL CARTER MAKES IT! Assist: Donovan Simmons
Score: 34-47

[07:49] Team_005 possession (Score: 34-47)
Zion Parker drives, Donovan Simmons stays with him. Zion Parker attempts a Layup. Heavily contested by Donovan Simmons (1.0 feet, MAN)! Zion Parker misses. Offensive rebound by Draymond Smith! Draymond Smith kicks it out.

[07:39] Team_005 possession (Score: 34-47)
Draymond Smith attempts a 3Pt. Contested by Lauri LaVine (4.8 feet, ZONE). Draymond Smith misses. Offensive rebound by Zion Parker! Zion Parker puts it back in!
Score: 34-49

[07:27] Team_066 possession (Score: 34-49)
Donovan Simmons drives, picks up Zion Parker. Help arrives from Blake O'Neal! Donovan Simmons attempts a Dunk. Contested by Blake O'Neal (5.1 feet, ZONE). DONOVAN SIMMONS MAKES IT! Assist: Cole Morant
Score: 36-49

[07:13] Team_005 possession (Score: 36-49)
Isaiah Durant attempts a 3Pt. Wide open! Cole Morant is 6.3 feet away. [MAN] ISAIAH DURANT MAKES IT! Assist: Draymond Smith
Score: 36-52

[06:57] Team_066 possession (Score: 36-52)
Brandon Middleton attempts a 3Pt. Contested by Blake O'Neal (3.5 feet, ZONE). Brandon Middleton misses. Rebound secured by Lauri Wade.

[06:44] Team_005 possession (Score: 36-52)
Zion Parker attempts a Layup. Contested by Donovan Simmons (2.7 feet, ZONE). Zion Parker misses. Rebound secured by Lauri LaVine.

[06:28] Team_066 possession (Score: 36-52)
Cole Morant attempts a Layup. Contested by Zion Parker (3.2 feet, ZONE). Cole Morant misses. Rebound secured by Lauri Wade.

[06:16] Team_005 possession (Score: 36-52)
Draymond Smith attempts a Midrange. Contested by Brandon Middleton (3.8 feet, ZONE). DRAYMOND SMITH MAKES IT! Assist: Zion Parker
Score: 36-54

[06:00] Team_066 possession (Score: 36-54)
Lauri LaVine makes the 3Pt and draws the foul on Blake O'Neal! And-1! Lauri LaVine to the line for 1. [Team fouls: 2] (Blake O'Neal: 1 personal fouls)   FT 1/1: GOOD Lauri LaVine makes 1/1 from the line.
Score: 40-54

[05:48] Team_005 possession (Score: 40-54)
Lauri Wade loses the ball! Stripped by Brandon Middleton! TURNOVER! (live ball)

[05:31] Team_066 possession (Score: 40-54)
Pascal Carter attempts a 3Pt. Wide open! Draymond Smith is 6.3 feet away. [ZONE] Pascal Carter misses. Offensive rebound by Lauri LaVine! Lauri LaVine kicks it out.

[05:15] Team_066 possession (Score: 40-54)
Lauri LaVine makes the Midrange and draws the foul on Draymond Smith! And-1! Lauri LaVine to the line for 1. [Team fouls: 3] (Draymond Smith: 1 personal fouls)   FT 1/1: MISS Lauri LaVine makes 0/1 from the line. Rebound secured by Lauri Wade.
Score: 42-54

[05:01] Team_005 possession (Score: 42-54)
Blake O'Neal drives to the basket... FOUL! Offensive foul on Blake O'Neal! Pascal Carter drew the charge! [Team fouls: 4] (Blake O'Neal: 2 personal fouls) TURNOVER! (dead ball)

[04:47] Team_066 possession (Score: 42-54)
Lauri LaVine attempts a 3Pt. Contested by Blake O'Neal (2.2 feet, ZONE). Lauri LaVine misses. Rebound secured by Lauri Wade.

[04:31] Team_005 possession (Score: 42-54)
Zion Parker drives and kicks out. Zion Parker attempts a 3Pt. Contested by Lauri LaVine (4.6 feet, ZONE). Zion Parker misses. Rebound secured by Brandon Middleton.

[04:13] Team_066 possession (Score: 42-54)
FOUL! Reach-in foul on Zion Parker during the drive. [IN THE BONUS! 5 team fouls] Cole Morant to the line for 2 free throws. (Zion Parker: 1 personal fouls)   FT 1/2: GOOD   FT 2/2: GOOD Cole Morant makes 2/2 from the line.
Score: 44-54

[03:59] Team_005 possession (Score: 44-54)
Zion Parker attempts a 3Pt. Contested by Donovan Simmons (5.8 feet, MAN). Zion Parker misses. Rebound secured by Donovan Simmons.

[03:44] Team_066 possession (Score: 44-54)
Cole Morant attempts a Midrange. Contested by Isaiah Durant (5.3 feet, ZONE). COLE MORANT MAKES IT! Assist: Pascal Carter
Score: 46-54

[03:30] Team_005 possession (Score: 46-54)
Isaiah Durant attempts a 3Pt. Contested by Cole Morant (4.4 feet, MAN). Isaiah Durant misses. Rebound secured by Brandon Middleton.

[03:13] Team_066 possession (Score: 46-54)
Pascal Carter attempts a Layup. BLOCKED BY BLAKE O'NEAL! Ball deflects out of bounds off Pascal Carter.

[02:59] Team_005 possession (Score: 46-54)
Draymond Smith drives to the basket... FOUL! Offensive foul on Draymond Smith! Lauri LaVine drew the charge! [Team fouls: 6] (Draymond Smith: 2 personal fouls) TURNOVER! (dead ball)

[02:45] Team_066 possession (Score: 46-54)
Pascal Carter drives to the basket... Pascal Carter throws a bad pass out of bounds! TURNOVER! (dead ball)

[02:26] Team_005 possession (Score: 46-54)
Draymond Smith attempts a 3Pt. Contested by Lauri LaVine (3.0 feet, MAN). Draymond Smith misses. Rebound secured by Lauri LaVine.

[02:13] Team_066 possession (Score: 46-54)
Donovan Simmons attempts a Layup. Contested by Zion Parker (3.5 feet, ZONE). Donovan Simmons misses. Rebound secured by Draymond Smith.

[02:00] Team_005 possession (Score: 46-54)
Isaiah Durant attempts a 3Pt. Wide open! Cole Morant is 7.4 feet away. [MAN] Isaiah Durant misses. Rebound secured by Lauri LaVine.

[01:45] Team_066 possession (Score: 46-54)
FOUL! Offensive foul on Cole Morant! Isaiah Durant drew the charge! [Team fouls: 2] (Cole Morant: 1 personal fouls) TURNOVER! (dead ball)

[01:29] Team_005 possession (Score: 46-54)
Draymond Smith makes the Layup and draws the foul on Donovan Simmons! And-1! Draymond Smith to the line for 1. [Team fouls: 3] (Donovan Simmons: 2 personal fouls)   FT 1/1: GOOD Draymond Smith makes 1/1 from the line.
Score: 46-57

[01:15] Team_066 possession (Score: 46-57)
Lauri LaVine attempts a 3Pt. Contested by Draymond Smith (2.9 feet, MAN). LAURI LAVINE MAKES IT! Assist: Cole Morant
Score: 49-57

[01:02] Team_005 possession (Score: 49-57)
Isaiah Durant makes the Dunk and draws the foul on Donovan Simmons! And-1! Isaiah Durant to the line for 1. [Team fouls: 4] (Donovan Simmons: 3 personal fouls)   FT 1/1: GOOD Isaiah Durant makes 1/1 from the line.
Score: 49-60

[00:46] Team_066 possession (Score: 49-60)
Brandon Middleton drives to the basket... Brandon Middleton loses the ball! Stripped by Zion Parker! TURNOVER! (live ball)

[00:31] Team_005 possession (Score: 49-60)
FOUL! Holding foul on Donovan Simmons. [IN THE BONUS! 5 team fouls] Zion Parker to the line for 2 free throws. (Donovan Simmons: 4 personal fouls)   FT 1/2: GOOD   FT 2/2: GOOD Zion Parker makes 2/2 from the line.
Score: 49-62

[00:18] Team_066 possession (Score: 49-62)
Pascal Carter attempts a 3Pt. Contested by Blake O'Neal (5.1 feet, MAN). Pascal Carter misses. Rebound secured by Lauri Wade.

[00:03] Team_005 possession (Score: 49-62)
Draymond Smith attempts a Layup. Heavily contested by Donovan Simmons (1.6 feet, ZONE)! DRAYMOND SMITH MAKES IT!
Score: 49-64

================================================================================
                              2ND QUARTER COMPLETE                              
================================================================================

2ND QUARTER SCORE: Team_066 21, Team_005 29

BOX SCORE:
================================================================================

Team_066
--------------------------------------------------------------------------------
Player                MIN  PTS  REB  AST  TO      FG   FG%      3P   3P%
--------------------------------------------------------------------------------
Lauri LaVine           10   10    4    0   0   3/5    60.0     0/0   0.0
Cole Morant            10    4    0    2   0   2/3    66.7     0/0   0.0
Pascal Carter          10    3    0    2   0   1/3    33.3     0/0   0.0
Donovan Simmons        10    2    1    1   0   1/2    50.0     0/0   0.0
Yao Brogdon            14    0    1    0   0   0/0     0.0     0/0   0.0
Kyle Wagner            14    0    1    0   0   0/2     0.0     0/0   0.0
Brandon Reaves         14    0    1    0   0   0/1     0.0     0/0   0.0
Brandon Middleton      10    0    2    0   0   0/2     0.0     0/0   0.0

TEAM: FG: 7/18 (38.9%), 3PT: 4/10 (40.0%), REB: 10 (3 off, 7 def), AST: 5, TO: 4
TEAM FOULS: 5 [Team_005 in BONUS]


Team_005
--------------------------------------------------------------------------------
Player                MIN  PTS  REB  AST  TO      FG   FG%      3P   3P%
--------------------------------------------------------------------------------
Draymond Smith         10    7    4    2   0   3/4    75.0     0/0   0.0
Isaiah Durant          10    6    0    1   0   2/4    50.0     0/0   0.0
Lauri Wade             10    4    5    0   0   2/2   100.0     0/0   0.0
Zion Parker            10    4    1    1   0   2/5    40.0     0/0   0.0
Brandon George         14    3    0    0   0   1/1   100.0     0/0   0.0
Blake O'Neal           10    3    0    0   0   1/1   100.0     0/0   0.0
Cade Markkanen         14    2    2    0   0   1/2    50.0     0/0   0.0
Jalen Rozier           14    0    1    0   0   0/0     0.0     0/0   0.0
Anthony Rozier         14    0    0    1   0   0/0     0.0     0/0   0.0

TEAM: FG: 12/19 (63.2%), 3PT: 3/7 (42.9%), REB: 13 (3 off, 10 def), AST: 5, TO: 3
TEAM FOULS: 6 [Team_066 in BONUS]

================================================================================

================================================================================
                       3RD QUARTER - Team_066 vs Team_005                       
================================================================================

[12:00] Team_066 possession (Score: 49-64)
FOUL! Offensive foul on Pau Curry! Anthony Rozier drew the charge! [Team fouls: 1] (Pau Curry: 1 personal fouls) TURNOVER! (dead ball)

[11:44] Team_005 possession (Score: 49-64)
FOUL! Shooting foul on Yao Brogdon. Anthony Rozier to the line for 2 free throws. [Team fouls: 2] (Yao Brogdon: 1 personal fouls)   FT 1/2: GOOD   FT 2/2: GOOD Anthony Rozier makes 2/2 from the line.
Score: 49-66

[11:30] Team_066 possession (Score: 49-66)
Yao Brogdon attempts a 3Pt. Contested by Derrick Allen (2.2 feet, ZONE). YAO BROGDON MAKES IT! Assist: Brandon Reaves
Score: 52-66

[11:15] Team_005 possession (Score: 52-66)
Jalen Rozier attempts a 3Pt. Wide open! Yao Brogdon is 6.9 feet away. [MAN] Jalen Rozier misses. Offensive rebound by Jalen Rozier! Jalen Rozier kicks it out.

[10:58] Team_005 possession (Score: 52-66)
Cade Markkanen attempts a 3Pt. Wide open! Pau Curry is 6.5 feet away. [ZONE] Cade Markkanen misses. Rebound secured by Yao Brogdon.

[10:43] Team_066 possession (Score: 52-66)
Yao Brogdon drives to the basket... Yao Brogdon loses the ball! Stripped by Cade Markkanen! TURNOVER! (live ball)

[10:28] Team_005 possession (Score: 52-66)
FOUL! Offensive foul on Brandon George! Jimmy Davis drew the charge! [Team fouls: 1] (Brandon George: 1 personal fouls) TURNOVER! (dead ball)

[10:12] Team_066 possession (Score: 52-66)
FOUL! Holding foul on Derrick Allen. [Team fouls: 2] No free throws, side out. (Derrick Allen: 1 personal fouls)

[09:57] Team_066 possession (Score: 52-66)
Kyle Wagner drives, picks up Cade Markkanen. Help arrives from Anthony Rozier! Kyle Wagner attempts a Layup. Heavily contested by Anthony Rozier (2.0 feet, MAN)! KYLE WAGNER MAKES IT!
Score: 54-66

[09:41] Team_005 possession (Score: 54-66)
Derrick Allen attempts a Midrange. Contested by Brandon Reaves (5.2 feet, MAN). Derrick Allen misses. Offensive rebound by Cade Markkanen! Cade Markkanen puts it back in!
Score: 54-68

[09:26] Team_066 possession (Score: 54-68)
Brandon Reaves drives, Derrick Allen stays with him. Brandon Reaves attempts a Dunk. Wide open! Derrick Allen is 6.3 feet away. [MAN] BRANDON REAVES MAKES IT! Assist: Kyle Wagner
Score: 56-68

[09:12] Team_005 possession (Score: 56-68)
Cade Markkanen makes the Dunk and draws the foul on Kyle Wagner! And-1! Cade Markkanen to the line for 1. [Team fouls: 3] (Kyle Wagner: 1 personal fouls)   FT 1/1: MISS Cade Markkanen makes 0/1 from the line. Offensive rebound by Cade Markkanen! Cade Markkanen's putback is no good.
Score: 56-70

[08:57] Team_066 possession (Score: 56-70)
Brandon Reaves commits a violation (traveling/carry)! TURNOVER! (dead ball)

[08:39] Team_005 possession (Score: 56-70)
Brandon George attempts a 3Pt. Contested by Jimmy Davis (5.6 feet, MAN). Brandon George misses. Rebound secured by Kyle Wagner.

[08:25] Team_066 possession (Score: 56-70)
Brandon Reaves attempts a Midrange. Wide open! Derrick Allen is 6.6 feet away. [MAN] Brandon Reaves misses. Offensive rebound by Kyle Wagner! Kyle Wagner kicks it out.

[08:11] Team_066 possession (Score: 56-70)
Kyle Wagner attempts a Midrange. Contested by Cade Markkanen (5.0 feet, MAN). Kyle Wagner misses. Rebound secured by Derrick Allen.

[07:57] Team_005 possession (Score: 56-70)
Anthony Rozier attempts a Midrange. Contested by Yao Brogdon (5.4 feet, ZONE). Anthony Rozier misses. Offensive rebound by Cade Markkanen! Cade Markkanen puts it back in!
Score: 56-72

[07:42] Team_066 possession (Score: 56-72)
Pau Curry loses control! Ball rolls out of bounds! TURNOVER! (dead ball)

[07:30] Team_005 possession (Score: 56-72)
Cade Markkanen makes the Layup and draws the foul on Kyle Wagner! And-1! Cade Markkanen to the line for 1. [Team fouls: 4] (Kyle Wagner: 2 personal fouls)   FT 1/1: GOOD Cade Markkanen makes 1/1 from the line.
Score: 56-75

[07:18] Team_066 possession (Score: 56-75)
Yao Brogdon attempts a Layup. BLOCKED BY CADE MARKKANEN! Ball is loose! Offensive rebound by Kyle Wagner! Kyle Wagner kicks it out.

[07:02] Team_066 possession (Score: 56-75)
Brandon Reaves drives, Derrick Allen stays with him. Brandon Reaves attempts a Layup. Heavily contested by Derrick Allen (1.4 feet, MAN)! Brandon Reaves misses. Rebound secured by Jalen Rozier.

[06:47] Team_005 possession (Score: 56-75)
FOUL! Reach-in foul on Kyle Wagner during the drive. [IN THE BONUS! 5 team fouls] Derrick Allen to the line for 2 free throws. (Kyle Wagner: 3 personal fouls)   FT 1/2: GOOD   FT 2/2: GOOD Derrick Allen makes 2/2 from the line.
Score: 56-77

[06:37] Team_066 possession (Score: 56-77)
Yao Brogdon drives to the basket... Yao Brogdon loses the ball! Stripped by Cade Markkanen! TURNOVER! (live ball)

[06:21] Team_005 possession (Score: 56-77)
FOUL! Holding foul on Brandon Reaves. [IN THE BONUS! 6 team fouls] Derrick Allen to the line for 2 free throws. (Brandon Reaves: 1 personal fouls)   FT 1/2: GOOD   FT 2/2: GOOD Derrick Allen makes 2/2 from the line.
Score: 56-79

[06:05] Team_066 possession (Score: 56-79)
Yao Brogdon attempts a Layup. Heavily contested by Cade Markkanen (0.5 feet, MAN)! YAO BROGDON MAKES IT! Assist: Pau Curry
Score: 58-79

[05:52] Team_005 possession (Score: 58-79)
Brandon George attempts a 3Pt. Contested by Pau Curry (4.9 feet, ZONE). Brandon George misses. Rebound secured by Yao Brogdon.

[05:41] Team_066 possession (Score: 58-79)
FOUL! Reach-in foul on Cade Markkanen during the drive. [Team fouls: 3] No free throws, side out. (Cade Markkanen: 1 personal fouls)

[05:29] Team_066 possession (Score: 58-79)
Jimmy Davis attempts a Layup. BLOCKED BY CADE MARKKANEN! Ball is loose! Rebound secured by Jalen Rozier.

[05:19] Team_005 possession (Score: 58-79)
Jalen Rozier loses the ball! Stripped by Yao Brogdon! TURNOVER! (live ball)

[05:07] Team_066 possession (Score: 58-79)
Pau Curry attempts a 3Pt. Contested by Derrick Allen (5.7 feet, ZONE). Pau Curry misses. Rebound secured by Derrick Allen.

[04:50] Team_005 possession (Score: 58-79)
Anthony Rozier throws a bad pass! Stolen by Pau Curry! TURNOVER! (live ball)

[04:32] Team_066 possession (Score: 58-79)
Yao Brogdon drives and kicks out. Yao Brogdon attempts a Midrange. Wide open! Brandon George is 6.6 feet away. [ZONE] Yao Brogdon misses. Rebound secured by Cade Markkanen.

[04:20] Team_005 possession (Score: 58-79)
Jalen Rozier attempts a Midrange. Wide open! Yao Brogdon is 7.1 feet away. [MAN] JALEN ROZIER MAKES IT! Assist: Derrick Allen
Score: 58-81

[04:04] Team_066 possession (Score: 58-81)
Yao Brogdon attempts a Midrange. Contested by Jalen Rozier (2.7 feet, MAN). YAO BROGDON MAKES IT!
Score: 60-81

[03:51] Team_005 possession (Score: 60-81)
Anthony Rozier attempts a Layup. Contested by Pau Curry (3.7 feet, MAN). ANTHONY ROZIER MAKES IT! Assist: Cade Markkanen
Score: 60-83

[03:39] Team_066 possession (Score: 60-83)
Kyle Wagner attempts a Layup. Contested by Cade Markkanen (2.2 feet, MAN). KYLE WAGNER MAKES IT! Assist: Jimmy Davis
Score: 62-83

[03:20] Team_005 possession (Score: 62-83)
Anthony Rozier attempts a Midrange. Wide open! Pau Curry is 9.3 feet away. [MAN] Anthony Rozier misses. Rebound secured by Brandon Reaves.

[03:08] Team_066 possession (Score: 62-83)
FOUL! Shooting foul on Anthony Rozier. Jimmy Davis to the line for 2 free throws. [Team fouls: 4] (Anthony Rozier: 1 personal fouls)   FT 1/2: GOOD   FT 2/2: GOOD Jimmy Davis makes 2/2 from the line.
Score: 64-83

[02:52] Team_005 possession (Score: 64-83)
Cade Markkanen drives, Kyle Wagner stays with him. Cade Markkanen attempts a Layup. Contested by Kyle Wagner (4.9 feet, MAN). CADE MARKKANEN MAKES IT! Assist: Jalen Rozier
Score: 64-85

[02:35] Team_066 possession (Score: 64-85)
Jimmy Davis attempts a Midrange. Contested by Brandon George (5.2 feet, MAN). Jimmy Davis misses. Rebound secured by Cade Markkanen.

[02:21] Team_005 possession (Score: 64-85)
Cade Markkanen attempts a 3Pt. Contested by Kyle Wagner (4.9 feet, MAN). Cade Markkanen misses. Offensive rebound by Cade Markkanen! Cade Markkanen kicks it out.

[02:02] Team_005 possession (Score: 64-85)
Brandon George attempts a Midrange. Heavily contested by Jimmy Davis (1.9 feet, MAN)! Brandon George misses. Rebound secured by Kyle Wagner.

[01:51] Team_066 possession (Score: 64-85)
Kyle Wagner drives and kicks out. Jimmy Davis attempts a Midrange. Contested by Brandon George (4.4 feet, MAN). JIMMY DAVIS MAKES IT! Assist: Pau Curry
Score: 66-85

[01:36] Team_005 possession (Score: 66-85)
Anthony Rozier loses control! Ball rolls out of bounds! TURNOVER! (dead ball)

[01:36] Substitution (Team_066): Jimmy Davis OUT → Pascal Carter IN (stamina_rule2)

[01:36] Substitution (Team_066): Pau Curry OUT → Lauri LaVine IN (stamina_rule2)

[01:36] Substitution (Team_066): Brandon Reaves OUT → Brandon Middleton IN (stamina_rule2)

[01:36] Substitution (Team_066): Yao Brogdon OUT → Cole Morant IN (stamina_rule2)

[01:36] Substitution (Team_066): Kyle Wagner OUT → Donovan Simmons IN (stamina_rule2)

[01:36] Substitution (Team_005): Brandon George OUT → Blake O'Neal IN (stamina_rule2)

[01:36] Substitution (Team_005): Anthony Rozier OUT → Draymond Smith IN (stamina_rule2)

[01:36] Substitution (Team_005): Derrick Allen OUT → Lauri Wade IN (stamina_rule2)

[01:36] Substitution (Team_005): Jalen Rozier OUT → Isaiah Durant IN (stamina_rule2)

[01:36] Substitution (Team_005): Cade Markkanen OUT → Zion Parker IN (stamina_rule2)

[01:24] Team_066 possession (Score: 66-85)
Cole Morant attempts a 3Pt. Wide open! Blake O'Neal is 7.1 feet away. [ZONE] COLE MORANT MAKES IT! Assist: Lauri LaVine
Score: 69-85

[01:08] Team_005 possession (Score: 69-85)
Draymond Smith drives to the basket... Draymond Smith loses control! Ball rolls out of bounds! TURNOVER! (dead ball)

[00:54] Team_066 possession (Score: 69-85)
FOUL! Shooting foul on Draymond Smith. Lauri LaVine to the line for 3 free throws. [BONUS: 5 team fouls] (Draymond Smith: 1 personal fouls)   FT 1/3: MISS   FT 2/3: MISS   FT 3/3: GOOD Lauri LaVine makes 1/3 from the line.
Score: 70-85

[00:37] Team_005 possession (Score: 70-85)
Draymond Smith attempts a Midrange. Contested by Brandon Middleton (2.8 feet, ZONE). Draymond Smith misses. Rebound secured by Donovan Simmons.

[00:23] Team_066 possession (Score: 70-85)
Cole Morant attempts a Layup. Contested by Zion Parker (2.6 feet, ZONE). Cole Morant misses. Rebound secured by Draymond Smith.

[00:11] Team_005 possession (Score: 70-85)
Draymond Smith drives, Cole Morant stays with him. Draymond Smith attempts a Dunk. Wide open! Cole Morant is 6.5 feet away. [ZONE] Draymond Smith misses. Rebound secured by Donovan Simmons.

================================================================================
                              3RD QUARTER COMPLETE                              
================================================================================

3RD QUARTER SCORE: Team_066 21, Team_005 21

BOX SCORE:
================================================================================

Team_066
--------------------------------------------------------------------------------
Player                MIN  PTS  REB  AST  TO      FG   FG%      3P   3P%
--------------------------------------------------------------------------------
Yao Brogdon            25    7    2    0   0   3/4    75.0     0/0   0.0
Kyle Wagner            25    4    4    1   0   2/3    66.7     0/0   0.0
Jimmy Davis            25    4    0    1   0   2/4    50.0     0/0   0.0
Cole Morant            11    3    0    0   0   1/2    50.0     0/0   0.0
Brandon Reaves         25    2    1    1   0   1/2    50.0     0/0   0.0
Lauri LaVine           11    1    0    1   0   1/1   100.0     0/0   0.0
Pau Curry              25    0    0    2   0   0/1     0.0     0/0   0.0
Donovan Simmons        11    0    2    0   0   0/0     0.0     0/0   0.0

TEAM: FG: 10/17 (58.8%), 3PT: 3/4 (75.0%), REB: 10 (2 off, 8 def), AST: 6, TO: 5
TEAM FOULS: 6 [Team_005 in BONUS]


Team_005
--------------------------------------------------------------------------------
Player                MIN  PTS  REB  AST  TO      FG   FG%      3P   3P%
--------------------------------------------------------------------------------
Cade Markkanen         25    9    6    1   0   4/6    66.7     0/0   0.0
Anthony Rozier         25    4    0    0   0   2/3    66.7     0/0   0.0
Derrick Allen          25    4    2    1   0   2/2   100.0     0/0   0.0
Jalen Rozier           25    2    3    1   0   1/1   100.0     0/0   0.0
Brandon George         25    0    0    0   0   0/3     0.0     0/0   0.0
Draymond Smith         11    0    1    0   0   0/2     0.0     0/0   0.0

TEAM: FG: 9/17 (52.9%), 3PT: 0/3 (0.0%), REB: 11 (4 off, 7 def), AST: 3, TO: 5
TEAM FOULS: 5 [Team_066 in BONUS]

================================================================================

================================================================================
                       4TH QUARTER - Team_066 vs Team_005                       
================================================================================

[12:00] Substitution (Team_066): Jimmy Davis OUT (stamina: 74) → Pascal Carter IN (comeback_detected)

[12:00] Substitution (Team_005): Brandon George OUT (stamina: 74) → Blake O'Neal IN (comeback_detected)

[12:00] Team_066 possession (Score: 70-85)
Kyle Wagner attempts a 3Pt. Contested by Cade Markkanen (5.0 feet, MAN). KYLE WAGNER MAKES IT! Assist: Pascal Carter
Score: 73-85

[11:43] Team_005 possession (Score: 73-85)
Derrick Allen attempts a 3Pt. Wide open! Brandon Reaves is 8.4 feet away. [MAN] DERRICK ALLEN MAKES IT!
Score: 73-88

[11:24] Team_066 possession (Score: 73-88)
Brandon Reaves loses control! Ball rolls out of bounds! TURNOVER! (dead ball)

[11:05] Team_005 possession (Score: 73-88)
Jalen Rozier attempts a Layup. Heavily contested by Kyle Wagner (1.1 feet, ZONE)! JALEN ROZIER MAKES IT! Assist: Anthony Rozier
Score: 73-90

[10:50] Team_066 possession (Score: 73-90)
Brandon Reaves attempts a 3Pt. Heavily contested by Blake O'Neal (0.5 feet, ZONE)! Brandon Reaves misses. Offensive rebound by Yao Brogdon! Yao Brogdon kicks it out.

[10:38] Team_066 possession (Score: 73-90)
Pascal Carter attempts a 3Pt. Wide open! Blake O'Neal is 7.5 feet away. [ZONE] Pascal Carter misses. Rebound secured by Cade Markkanen.

[10:23] Team_005 possession (Score: 73-90)
FOUL! Shooting foul on Kyle Wagner. Cade Markkanen to the line for 2 free throws. [Team fouls: 1] (Kyle Wagner: 1 personal fouls)   FT 1/2: MISS   FT 2/2: GOOD Cade Markkanen makes 1/2 from the line.
Score: 73-91

[10:11] Team_066 possession (Score: 73-91)
Yao Brogdon attempts a Midrange. Wide open! Jalen Rozier is 6.1 feet away. [ZONE] YAO BROGDON MAKES IT!
Score: 75-91

[09:55] Team_005 possession (Score: 75-91)
Derrick Allen attempts a 3Pt. Wide open! Pau Curry is 6.2 feet away. [ZONE] DERRICK ALLEN MAKES IT! Assist: Blake O'Neal
Score: 75-94

[09:40] Team_066 possession (Score: 75-94)
Brandon Reaves drives, Cade Markkanen stays with him. Brandon Reaves attempts a Dunk. Wide open! Cade Markkanen is 7.4 feet away. [ZONE] BRANDON REAVES MAKES IT! Assist: Yao Brogdon
Score: 77-94

[09:23] Team_005 possession (Score: 77-94)
Cade Markkanen attempts a Layup. Contested by Kyle Wagner (3.9 feet, MAN). CADE MARKKANEN MAKES IT! Assist: Blake O'Neal
Score: 77-96

[09:06] Team_066 possession (Score: 77-96)
FOUL! Offensive foul on Pau Curry! Anthony Rozier drew the charge! [Team fouls: 2] (Pau Curry: 1 personal fouls) TURNOVER! (dead ball)

[08:49] Team_005 possession (Score: 77-96)
Derrick Allen drives and kicks out. Blake O'Neal makes the Midrange and draws the foul on Pascal Carter! And-1! Blake O'Neal to the line for 1. [Team fouls: 3] (Pascal Carter: 1 personal fouls)   FT 1/1: GOOD Blake O'Neal makes 1/1 from the line.
Score: 77-99

[08:35] Team_066 possession (Score: 77-99)
Kyle Wagner drives and kicks out. Kyle Wagner attempts a Midrange. Wide open! Anthony Rozier is 6.4 feet away. [ZONE] KYLE WAGNER MAKES IT!
Score: 79-99

[08:22] Team_005 possession (Score: 79-99)
Derrick Allen attempts a 3Pt. Wide open! Pau Curry is 8.2 feet away. [ZONE] DERRICK ALLEN MAKES IT! Assist: Anthony Rozier
Score: 79-102

[08:04] Team_066 possession (Score: 79-102)
Yao Brogdon drives to the basket... Yao Brogdon commits a violation (traveling/carry)! TURNOVER! (dead ball)

[08:04] Substitution (Team_066): Pau Curry OUT → Lauri LaVine IN (stamina_rule2)

[08:04] Substitution (Team_066): Brandon Reaves OUT → Brandon Middleton IN (stamina_rule2)

[08:04] Substitution (Team_066): Yao Brogdon OUT → Cole Morant IN (stamina_rule2)

[08:04] Substitution (Team_066): Kyle Wagner OUT → Donovan Simmons IN (stamina_rule2)

[08:04] Substitution (Team_005): Anthony Rozier OUT → Draymond Smith IN (stamina_rule2)

[08:04] Substitution (Team_005): Derrick Allen OUT → Lauri Wade IN (stamina_rule2)

[08:04] Substitution (Team_005): Jalen Rozier OUT → Isaiah Durant IN (stamina_rule2)

[08:04] Substitution (Team_005): Cade Markkanen OUT → Zion Parker IN (stamina_rule2)

[07:48] Team_005 possession (Score: 79-102)
Draymond Smith drives and kicks out. Zion Parker attempts a 3Pt. Wide open! Donovan Simmons is 6.0 feet away. [MAN] Zion Parker misses. Rebound secured by Lauri LaVine.

[07:38] Team_066 possession (Score: 79-102)
Brandon Middleton drives to the basket... Brandon Middleton commits a violation (traveling/carry)! TURNOVER! (dead ball)

[07:26] Team_005 possession (Score: 79-102)
Zion Parker attempts a 3Pt. Wide open! Lauri LaVine is 7.9 feet away. [ZONE] Zion Parker misses. Rebound secured by Lauri LaVine.

[07:13] Team_066 possession (Score: 79-102)
Brandon Middleton attempts a Midrange. Wide open! Lauri Wade is 8.1 feet away. [MAN] BRANDON MIDDLETON MAKES IT! Assist: Pascal Carter
Score: 81-102

[06:59] Team_005 possession (Score: 81-102)
Lauri Wade attempts a 3Pt. Contested by Brandon Middleton (3.1 feet, MAN). LAURI WADE MAKES IT! Assist: Isaiah Durant
Score: 81-105

[06:49] Team_066 possession (Score: 81-105)
Brandon Middleton attempts a Midrange. Contested by Lauri Wade (2.6 feet, MAN). Brandon Middleton misses. Rebound secured by Zion Parker.

[06:33] Team_005 possession (Score: 81-105)
Zion Parker attempts a Midrange. Contested by Brandon Middleton (4.1 feet, ZONE). Zion Parker misses. Offensive rebound by Zion Parker! Zion Parker's putback is no good. Rebound secured by Lauri LaVine.

[06:23] Team_066 possession (Score: 81-105)
Pascal Carter attempts a 3Pt. Contested by Blake O'Neal (3.4 feet, MAN). Pascal Carter misses. Offensive rebound by Donovan Simmons! Donovan Simmons kicks it out.

[06:11] Team_066 possession (Score: 81-105)
Cole Morant drives to the basket... Cole Morant loses control! Ball rolls out of bounds! TURNOVER! (dead ball)

[06:01] Team_005 possession (Score: 81-105)
Draymond Smith throws a bad pass out of bounds! TURNOVER! (dead ball)

[05:44] Team_066 possession (Score: 81-105)
Pascal Carter attempts a 3Pt. Contested by Blake O'Neal (4.5 feet, MAN). Pascal Carter misses. Rebound secured by Draymond Smith.

[05:33] Team_005 possession (Score: 81-105)
FOUL! Reach-in foul on Donovan Simmons during the drive. [Team fouls: 4] No free throws, side out. (Donovan Simmons: 1 personal fouls)

[05:19] Team_005 possession (Score: 81-105)
Blake O'Neal loses the ball! Stripped by Pascal Carter! TURNOVER! (live ball)

[05:04] Team_066 possession (Score: 81-105)
Brandon Middleton attempts a 3Pt. Wide open! Blake O'Neal is 6.6 feet away. [ZONE] Brandon Middleton misses. Offensive rebound by Lauri LaVine! Lauri LaVine kicks it out.

[04:48] Team_066 possession (Score: 81-105)
Donovan Simmons drives, picks up Zion Parker. Help arrives from Blake O'Neal! Donovan Simmons attempts a Layup. Contested by Blake O'Neal (3.0 feet, ZONE). Donovan Simmons misses. Offensive rebound by Donovan Simmons! Donovan Simmons kicks it out.

[04:35] Team_066 possession (Score: 81-105)
Donovan Simmons drives and kicks out. Lauri LaVine attempts a 3Pt. Contested by Blake O'Neal (3.5 feet, ZONE). Lauri LaVine misses. Offensive rebound by Lauri LaVine! Lauri LaVine kicks it out.

[04:21] Team_066 possession (Score: 81-105)
Donovan Simmons makes the Midrange and draws the foul on Lauri Wade! And-1! Donovan Simmons to the line for 1. [Team fouls: 1] (Lauri Wade: 1 personal fouls)   FT 1/1: GOOD Donovan Simmons makes 1/1 from the line.
Score: 84-105

[04:05] Team_005 possession (Score: 84-105)
Zion Parker drives to the basket... Zion Parker commits a violation (traveling/carry)! TURNOVER! (dead ball)

[03:51] Team_066 possession (Score: 84-105)
Pascal Carter attempts a Midrange. Wide open! Blake O'Neal is 7.1 feet away. [MAN] PASCAL CARTER MAKES IT! Assist: Donovan Simmons
Score: 86-105

[03:37] Team_005 possession (Score: 86-105)
FOUL! Shooting foul on Donovan Simmons. Zion Parker to the line for 2 free throws. [BONUS: 5 team fouls] (Donovan Simmons: 2 personal fouls)   FT 1/2: GOOD   FT 2/2: GOOD Zion Parker makes 2/2 from the line.
Score: 86-107

[03:22] Team_066 possession (Score: 86-107)
Lauri LaVine attempts a Midrange. Contested by Draymond Smith (3.9 feet, MAN). Lauri LaVine misses. Rebound secured by Draymond Smith.

[03:08] Team_005 possession (Score: 86-107)
Blake O'Neal attempts a 3Pt. Contested by Lauri LaVine (4.4 feet, ZONE). Blake O'Neal misses. Rebound secured by Brandon Middleton.

[02:52] Team_066 possession (Score: 86-107)
Brandon Middleton drives and kicks out. Donovan Simmons attempts a Midrange. Wide open! Zion Parker is 6.4 feet away. [MAN] Donovan Simmons misses. Rebound secured by Lauri Wade.

[02:38] Team_005 possession (Score: 86-107)
Blake O'Neal attempts a 3Pt. Contested by Lauri LaVine (4.7 feet, ZONE). Blake O'Neal misses. Rebound secured by Lauri LaVine.

[02:25] Team_066 possession (Score: 86-107)
Donovan Simmons attempts a Midrange. Contested by Isaiah Durant (3.9 feet, ZONE). Donovan Simmons misses. Offensive rebound by Lauri LaVine! Lauri LaVine kicks it out.

[02:07] Team_066 possession (Score: 86-107)
Brandon Middleton drives, picks up Lauri Wade. Help arrives from Blake O'Neal! Brandon Middleton attempts a Layup. Contested by Blake O'Neal (3.7 feet, MAN). Brandon Middleton misses. Offensive rebound by Donovan Simmons! Donovan Simmons kicks it out.

[01:50] Team_066 possession (Score: 86-107)
Pascal Carter attempts a 3Pt. Wide open! Blake O'Neal is 8.5 feet away. [ZONE] Pascal Carter misses. Rebound secured by Draymond Smith.

[01:34] Team_005 possession (Score: 86-107)
Zion Parker drives, Donovan Simmons stays with him. Zion Parker attempts a Dunk. Contested by Donovan Simmons (5.4 feet, MAN). Zion Parker misses. Offensive rebound by Draymond Smith! Draymond Smith kicks it out.

[01:19] Team_005 possession (Score: 86-107)
Isaiah Durant attempts a 3Pt. Contested by Lauri LaVine (2.0 feet, ZONE). ISAIAH DURANT MAKES IT! Assist: Blake O'Neal
Score: 86-110

[01:03] Team_066 possession (Score: 86-110)
Donovan Simmons drives, Zion Parker stays with him. Donovan Simmons attempts a Layup. Heavily contested by Zion Parker (0.9 feet, MAN)! Donovan Simmons misses. Rebound secured by Lauri Wade.

[00:47] Team_005 possession (Score: 86-110)
Zion Parker drives, Donovan Simmons stays with him. Zion Parker attempts a Layup. Wide open! Donovan Simmons is 8.6 feet away. [ZONE] ZION PARKER MAKES IT!
Score: 86-112

[00:29] Team_066 possession (Score: 86-112)
Cole Morant drives and kicks out. Donovan Simmons attempts a Midrange. Wide open! Draymond Smith is 6.4 feet away. [ZONE] Donovan Simmons misses. Rebound secured by Draymond Smith.

[00:14] Team_005 possession (Score: 86-112)
FOUL! Shooting foul on Pascal Carter. Blake O'Neal to the line for 2 free throws. [BONUS: 6 team fouls] (Pascal Carter: 2 personal fouls)   FT 1/2: MISS   FT 2/2: GOOD Blake O'Neal makes 1/2 from the line.
Score: 86-113

================================================================================
                              4TH QUARTER COMPLETE                              
================================================================================

4TH QUARTER SCORE: Team_066 16, Team_005 28

BOX SCORE:
================================================================================

Team_066
--------------------------------------------------------------------------------
Player                MIN  PTS  REB  AST  TO      FG   FG%      3P   3P%
--------------------------------------------------------------------------------
Kyle Wagner            29    5    0    0   0   2/2   100.0     0/0   0.0
Donovan Simmons        19    3    3    1   0   1/2    50.0     0/0   0.0
Pascal Carter          23    2    0    2   0   1/4    25.0     0/0   0.0
Yao Brogdon            29    2    1    1   0   1/1   100.0     0/0   0.0
Brandon Reaves         29    2    0    0   0   1/1   100.0     0/0   0.0
Brandon Middleton      19    2    1    0   0   1/3    33.3     0/0   0.0
Lauri LaVine           19    0    7    0   0   0/1     0.0     0/0   0.0
Cole Morant            19    0    0    0   0   0/1     0.0     0/0   0.0

TEAM: FG: 7/15 (46.7%), 3PT: 1/4 (25.0%), REB: 11 (7 off, 4 def), AST: 4, TO: 5
TEAM FOULS: 6 [Team_005 in BONUS]


Team_005
--------------------------------------------------------------------------------
Player                MIN  PTS  REB  AST  TO      FG   FG%      3P   3P%
--------------------------------------------------------------------------------
Derrick Allen          29    9    0    0   0   3/3   100.0     0/0   0.0
Blake O'Neal           23    4    0    3   0   2/4    50.0     0/0   0.0
Zion Parker            19    4    1    0   0   2/4    50.0     0/0   0.0
Cade Markkanen         29    3    1    0   0   2/2   100.0     0/0   0.0
Lauri Wade             19    3    2    0   0   1/1   100.0     0/0   0.0
Isaiah Durant          19    3    0    1   0   1/1   100.0     0/0   0.0
Jalen Rozier           29    2    0    0   0   1/1   100.0     0/0   0.0
Anthony Rozier         29    0    0    2   0   0/0     0.0     0/0   0.0
Draymond Smith         19    0    5    0   0   0/1     0.0     0/0   0.0

TEAM: FG: 12/17 (70.6%), 3PT: 5/8 (62.5%), REB: 10 (2 off, 8 def), AST: 6, TO: 3
TEAM FOULS: 1

================================================================================

================================================================================
                               FULL GAME COMPLETE                               
================================================================================

FINAL SCORE: Team_066 86, Team_005 113

SCORING BY QUARTER:
--------------------------------------------------------------------------------
Team                     Q1     Q2     Q3     Q4    FINAL
--------------------------------------------------------------------------------
Team_066                 28     21     21     16       86
Team_005                 35     29     21     28      113
--------------------------------------------------------------------------------

FULL GAME BOX SCORE:
================================================================================

Team_066
--------------------------------------------------------------------------------
Player                MIN  PTS  REB  AST  TO      FG   FG%      3P   3P%      FT STL BLK
--------------------------------------------------------------------------------
Pau Curry              29    6    0    2   4   1/4    25.0   1/3    33.3   0/0     1   0
Brandon Reaves         29    9    5    5   4   5/8    62.5   0/1     0.0   1/1     0   0
Yao Brogdon            29   14    6    1   2   6/8    75.0   2/2   100.0   1/2     1   0
Kyle Wagner            29   11    9    2   1   5/11   45.5   1/4    25.0   3/4     0   1
Jimmy Davis            25   12    0    2   2   6/9    66.7   0/0     0.0   4/4     0   1
Pascal Carter          23    5    0    4   0   2/7    28.6   1/5    20.0   0/0     1   0
Lauri LaVine           19   11   11    1   0   4/7    57.1   4/5    80.0   2/5     0   0
Brandon Middleton      19    2    3    0   1   1/5    20.0   0/2     0.0   0/0     1   0
Cole Morant            19    7    0    2   3   3/6    50.0   1/1   100.0   2/2     0   0
Donovan Simmons        19    5    6    2   1   2/4    50.0   0/0     0.0   1/1     0   0

TEAM: FG: 35/69 (50.7%), 3PT: 10/23 (43.5%), REB: 38 (14 off, 24 def), AST: 21, TO: 18


Team_005
--------------------------------------------------------------------------------
Player                MIN  PTS  REB  AST  TO      FG   FG%      3P   3P%      FT STL BLK
--------------------------------------------------------------------------------
Anthony Rozier         29   11    0    6   3   6/8    75.0   1/2    50.0   2/2     0   0
Derrick Allen          29   19    4    3   0   7/9    77.8   4/5    80.0   4/5     0   0
Jalen Rozier           29    4   10    1   1   3/4    75.0   0/1     0.0   0/0     0   0
Cade Markkanen         29   27   11    2   1   9/14   64.3   1/2    50.0   6/9     3   3
Brandon George         25   10    0    1   1   5/9    55.6   2/4    50.0   0/0     1   0
Blake O'Neal           23    7    0    3   2   1/3    33.3   0/2     0.0   2/3     0   1
Draymond Smith         19    7   10    2   2   4/8    50.0   1/2    50.0   1/1     0   0
Lauri Wade             19    7    7    0   2   4/4   100.0   1/1   100.0   0/0     0   0
Isaiah Durant          19    9    0    2   1   3/5    60.0   2/4    50.0   1/1     0   0
Zion Parker            19    8    2    1   0   2/7    28.6   0/2     0.0   4/4     1   0

TEAM: FG: 46/73 (63.0%), 3PT: 12/25 (48.0%), REB: 46 (13 off, 33 def), AST: 21, TO: 13

================================================================================
