================================================================================
                        FULL GAME - Team_099 vs Team_079                        
================================================================================

================================================================================
                       1ST QUARTER - Team_099 vs Team_079                       
================================================================================

[12:00] Team_099 possession (Score: 0-0)
Larry James attempts a 3Pt. Contested by Trae Durant (4.0 feet, ZONE). Larry James misses. Rebound secured by Trae Durant.

[11:44] Team_079 possession (Score: 0-0)
Khris Embiid attempts a 3Pt. Heavily contested by Ayo Barrett (1.1 feet, MAN)! KHRIS EMBIID MAKES IT! Assist: Donovan Randle
Score: 0-3

[11:29] Team_099 possession (Score: 0-3)
Ayo Barrett drives and kicks out. Vince Lillard attempts a Midrange. Contested by Trae Durant (4.1 feet, MAN). Vince Lillard misses. Rebound secured by Donovan Randle.

[11:14] Team_079 possession (Score: 0-3)
Bam Randle attempts a Layup. BLOCKED BY DAMIAN GINOBILI! Ball deflects out of bounds off Bam Randle.

[11:00] Team_099 possession (Score: 0-3)
Larry James attempts a Layup. Contested by Donovan Randle (5.3 feet, ZONE). LARRY JAMES MAKES IT!
Score: 2-3

[10:47] Team_079 possession (Score: 2-3)
FOUL! Holding foul on Vince Lillard. [Team fouls: 1] No free throws, side out. (Vince Lillard: 1 personal fouls)

[10:35] Team_079 possession (Score: 2-3)
Bam Randle attempts a Midrange. Contested by Damian Ginobili (4.5 feet, MAN). BAM RANDLE MAKES IT!
Score: 2-5

[10:19] Team_099 possession (Score: 2-5)
Damian Ginobili makes the Layup and draws the foul on Donovan Randle! And-1! Damian Ginobili to the line for 1. [Team fouls: 1] (Donovan Randle: 1 personal fouls)   FT 1/1: GOOD Damian Ginobili makes 1/1 from the line.
Score: 5-5

[10:02] Team_079 possession (Score: 5-5)
Khris Embiid drives, Vince Lillard stays with him. Khris Embiid attempts a Layup. Contested by Vince Lillard (3.7 feet, ZONE). Khris Embiid misses. Rebound secured by Vince Lillard.

[09:49] Team_099 possession (Score: 5-5)
Larry James attempts a 3Pt. Wide open! Miles Ming is 6.7 feet away. [MAN] Larry James misses. Rebound secured by Trae Durant.

[09:34] Team_079 possession (Score: 5-5)
Donovan Randle throws a bad pass! Stolen by Larry Wade! TURNOVER! (live ball)

[09:22] Team_099 possession (Score: 5-5)
Damian Ginobili attempts a 3Pt. Heavily contested by Bam Randle (1.7 feet, MAN)! Damian Ginobili misses. Rebound secured by Trae Durant.

[09:07] Team_079 possession (Score: 5-5)
Khris Embiid drives and kicks out. Donovan Randle attempts a 3Pt. Wide open! Larry James is 6.8 feet away. [ZONE] DONOVAN RANDLE MAKES IT!
Score: 5-8

[08:54] Team_099 possession (Score: 5-8)
Vince Lillard drives to the basket... Vince Lillard loses control! Ball rolls out of bounds! TURNOVER! (dead ball)

[08:41] Team_079 possession (Score: 5-8)
Khris Embiid attempts a 3Pt. Contested by Ayo Barrett (2.9 feet, MAN). Khris Embiid misses. Rebound secured by Larry Wade.

[08:28] Team_099 possession (Score: 5-8)
Ayo Barrett attempts a 3Pt. Contested by Bam Randle (5.0 feet, ZONE). Ayo Barrett misses. Rebound secured by Trae Durant.

[08:12] Team_079 possession (Score: 5-8)
Donovan Randle attempts a Midrange. Wide open! Larry Wade is 6.4 feet away. [MAN] Donovan Randle misses. Rebound secured by Damian Ginobili.

[07:57] Team_099 possession (Score: 5-8)
Vince Lillard drives to the basket... Vince Lillard throws a bad pass! Stolen by Trae Durant! TURNOVER! (live ball)

[07:47] Team_079 possession (Score: 5-8)
Trae Durant attempts a 3Pt. Contested by Vince Lillard (5.3 feet, MAN). Trae Durant misses. Rebound secured by Larry Wade.

[07:31] Team_099 possession (Score: 5-8)
Larry James attempts a 3Pt. Contested by Trae Durant (5.3 feet, ZONE). LARRY JAMES MAKES IT! Assist: Damian Ginobili
Score: 8-8

[07:17] Team_079 possession (Score: 8-8)
Donovan Randle attempts a Midrange. Contested by Larry James (4.4 feet, ZONE). DONOVAN RANDLE MAKES IT!
Score: 8-10

[07:01] Team_099 possession (Score: 8-10)
Larry Wade attempts a 3Pt. Heavily contested by Trae Durant (1.9 feet, ZONE)! Larry Wade misses. Rebound secured by Trae Durant.

[06:47] Team_079 possession (Score: 8-10)
Khris Embiid attempts a 3Pt. Heavily contested by Ayo Barrett (1.3 feet, MAN)! Khris Embiid misses. Rebound secured by Vince Lillard.

[06:31] Team_099 possession (Score: 8-10)
Damian Ginobili attempts a 3Pt. Contested by Trae Durant (2.7 feet, ZONE). Damian Ginobili misses. Offensive rebound by Larry Wade! Larry Wade's putback is no good. Offensive rebound by Vince Lillard! Vince Lillard kicks it out.

[06:13] Team_099 possession (Score: 8-10)
Larry James attempts a Layup. Heavily contested by Miles Ming (1.2 feet, MAN)! Larry James misses. Offensive rebound by Vince Lillard! Vince Lillard's putback is no good. Offensive rebound by Larry Wade! Larry Wade kicks it out.

[05:55] Team_099 possession (Score: 8-10)
Vince Lillard attempts a Midrange. Wide open! Trae Durant is 6.8 feet away. [ZONE] Vince Lillard misses. Offensive rebound by Larry Wade! Larry Wade puts it back in!
Score: 10-10

[05:40] Team_079 possession (Score: 10-10)
Khris Embiid drives, Vince Lillard stays with him. Khris Embiid attempts a Layup. Heavily contested by Vince Lillard (1.4 feet, ZONE)! KHRIS EMBIID MAKES IT! Assist: Bam Randle
Score: 10-12

[05:28] Team_099 possession (Score: 10-12)
Larry Wade attempts a Midrange. Wide open! Bam Randle is 6.8 feet away. [ZONE] Larry Wade misses. Rebound secured by Trae Durant.

[05:10] Team_079 possession (Score: 10-12)
Trae Durant drives to the basket... Trae Durant loses control! Ball rolls out of bounds! TURNOVER! (dead ball)

[04:54] Team_099 possession (Score: 10-12)
Larry Wade drives to the basket... Larry Wade loses the ball! Stripped by Donovan Randle! TURNOVER! (live ball)

[04:40] Team_079 possession (Score: 10-12)
Bam Randle drives and kicks out. Bam Randle attempts a 3Pt. Contested by Ayo Barrett (4.7 feet, ZONE). Bam Randle misses. Rebound secured by Larry Wade.

[04:30] Team_099 possession (Score: 10-12)
Vince Lillard attempts a Layup. Heavily contested by Trae Durant (1.6 feet, MAN)! VINCE LILLARD MAKES IT! Assist: Larry Wade
Score: 12-12

[04:16] Team_079 possession (Score: 12-12)
Miles Ming attempts a 3Pt. Contested by Larry James (4.9 feet, MAN). MILES MING MAKES IT! Assist: Khris Embiid
Score: 12-15

[04:00] Team_099 possession (Score: 12-15)
Damian Ginobili drives, Bam Randle stays with him. Damian Ginobili attempts a Layup. Heavily contested by Bam Randle (1.5 feet, MAN)! DAMIAN GINOBILI MAKES IT!
Score: 14-15

[03:48] Team_079 possession (Score: 14-15)
Trae Durant commits a violation (traveling/carry)! TURNOVER! (dead ball)

[03:33] Team_099 possession (Score: 14-15)
Vince Lillard drives and kicks out. Ayo Barrett attempts a 3Pt. Wide open! Khris Embiid is 7.4 feet away. [MAN] AYO BARRETT MAKES IT! Assist: Larry Wade
Score: 17-15

[03:18] Team_079 possession (Score: 17-15)
Bam Randle drives and kicks out. Khris Embiid attempts a Midrange. Heavily contested by Damian Ginobili (1.1 feet, ZONE)! Khris Embiid misses. Rebound secured by Vince Lillard.

[03:02] Team_099 possession (Score: 17-15)
Damian Ginobili attempts a 3Pt. Wide open! Bam Randle is 8.3 feet away. [MAN] Damian Ginobili misses. Rebound secured by Donovan Randle.

[02:52] Team_079 possession (Score: 17-15)
Miles Ming attempts a 3Pt. Wide open! Larry James is 8.4 feet away. [MAN] MILES MING MAKES IT! Assist: Donovan Randle
Score: 17-18

[02:33] Team_099 possession (Score: 17-18)
Vince Lillard attempts a 3Pt. Contested by Trae Durant (4.6 feet, ZONE). Vince Lillard misses. Rebound secured by Trae Durant.

[02:19] Team_079 possession (Score: 17-18)
FOUL! Holding foul on Ayo Barrett. [Team fouls: 2] No free throws, side out. (Ayo Barrett: 1 personal fouls)

[02:05] Team_079 possession (Score: 17-18)
Donovan Randle drives to the basket... FOUL! Offensive foul on Donovan Randle! Vince Lillard drew the charge! [Team fouls: 2] (Donovan Randle: 2 personal fouls) TURNOVER! (dead ball)

[01:49] Team_099 possession (Score: 17-18)
Larry Wade attempts a 3Pt. Contested by Bam Randle (3.8 feet, ZONE). LARRY WADE MAKES IT! Assist: Vince Lillard
Score: 20-18

[01:35] Team_079 possession (Score: 20-18)
Bam Randle attempts a 3Pt. Wide open! Damian Ginobili is 6.8 feet away. [MAN] Bam Randle misses. Offensive rebound by Trae Durant! Trae Durant kicks it out.

[01:21] Team_079 possession (Score: 20-18)
FOUL! Reach-in foul on Vince Lillard during the drive. [Team fouls: 3] No free throws, side out. (Vince Lillard: 2 personal fouls)

[01:08] Team_079 possession (Score: 20-18)
Bam Randle attempts a 3Pt. Wide open! Damian Ginobili is 6.4 feet away. [MAN] BAM RANDLE MAKES IT! Assist: Donovan Randle
Score: 20-21

[00:54] Team_099 possession (Score: 20-21)
Ayo Barrett throws a bad pass! Stolen by Khris Embiid! TURNOVER! (live ball)

[00:39] Team_079 possession (Score: 20-21)
Trae Durant drives and kicks out. Miles Ming attempts a 3Pt. Contested by Larry James (4.0 feet, MAN). Miles Ming misses. Offensive rebound by Trae Durant! Trae Durant kicks it out.

[00:26] Team_079 possession (Score: 20-21)
Donovan Randle loses the ball! Stripped by Larry Wade! TURNOVER! (live ball)

[00:12] Team_099 possession (Score: 20-21)
Larry James drives, Trae Durant stays with him. Larry James attempts a Layup. Contested by Trae Durant (3.7 feet, ZONE). LARRY JAMES MAKES IT! Assist: Ayo Barrett
Score: 22-21

================================================================================
                              1ST QUARTER COMPLETE                              
================================================================================

1ST QUARTER SCORE: Team_099 22, Team_079 21

BOX SCORE:
================================================================================

Team_099
--------------------------------------------------------------------------------
Player                MIN  PTS  REB  AST  TO      FG   FG%      3P   3P%
--------------------------------------------------------------------------------
Larry James            12    7    0    0   0   3/5    60.0     0/0   0.0
Damian Ginobili        12    5    1    1   0   2/4    50.0     0/0   0.0
Larry Wade             12    5    5    2   0   2/4    50.0     0/0   0.0
Ayo Barrett            12    3    0    1   0   1/3    33.3     0/0   0.0
Vince Lillard          12    2    4    1   0   1/2    50.0     0/0   0.0

TEAM: FG: 9/18 (50.0%), 3PT: 2/9 (22.2%), REB: 10 (3 off, 7 def), AST: 5, TO: 4
TEAM FOULS: 3


Team_079
--------------------------------------------------------------------------------
Player                MIN  PTS  REB  AST  TO      FG   FG%      3P   3P%
--------------------------------------------------------------------------------
Miles Ming             12    6    0    0   0   2/2   100.0     0/0   0.0
Khris Embiid           12    5    0    1   0   2/5    40.0     0/0   0.0
Donovan Randle         12    5    2    3   0   2/3    66.7     0/0   0.0
Bam Randle             12    5    0    1   0   2/5    40.0     0/0   0.0
Trae Durant            12    0    9    0   0   0/1     0.0     0/0   0.0

TEAM: FG: 8/16 (50.0%), 3PT: 4/7 (57.1%), REB: 11 (2 off, 9 def), AST: 5, TO: 5
TEAM FOULS: 2

================================================================================

================================================================================
                       2ND QUARTER - Team_099 vs Team_079                       
================================================================================

[12:00] Substitution (Team_099): Damian Ginobili OUT → Scottie Quickley IN (stamina_rule2)

[12:00] Substitution (Team_099): Vince Lillard OUT → Donovan Green IN (stamina_rule2)

[12:00] Substitution (Team_099): Larry Wade OUT → Jarrett Fox IN (stamina_rule2)

[12:00] Substitution (Team_079): Khris Embiid OUT → Evan Mobley IN (stamina_rule2)

[12:00] Substitution (Team_079): Miles Ming OUT → Karl Ingram IN (stamina_rule2)

[12:00] Substitution (Team_079): Bam Randle OUT → Anthony Wade IN (stamina_rule2)

[12:00] Substitution (Team_079): Donovan Randle OUT → James LaVine IN (stamina_rule2)

[12:00] Team_099 possession (Score: 22-21)
Vince Lillard drives to the basket... Vince Lillard throws a bad pass out of bounds! TURNOVER! (dead ball)

[11:45] Team_079 possession (Score: 22-21)
Anthony Wade makes the Layup and draws the foul on Scottie Quickley! And-1! Anthony Wade to the line for 1. [Team fouls: 1] (Scottie Quickley: 1 personal fouls)   FT 1/1: GOOD Anthony Wade makes 1/1 from the line.
Score: 22-24

[11:33] Team_099 possession (Score: 22-24)
Larry James attempts a Layup. Contested by Karl Ingram (2.8 feet, MAN). LARRY JAMES MAKES IT! Assist: Ayo Barrett
Score: 24-24

[11:18] Team_079 possession (Score: 24-24)
FOUL! Holding foul on Jarrett Fox. [Team fouls: 2] No free throws, side out. (Jarrett Fox: 1 personal fouls)

[11:07] Team_079 possession (Score: 24-24)
FOUL! Shooting foul on Donovan Green. Trae Durant to the line for 2 free throws. [Team fouls: 3] (Donovan Green: 1 personal fouls)   FT 1/2: MISS   FT 2/2: MISS Trae Durant makes 0/2 from the line. Rebound secured by Donovan Green.

[10:51] Team_099 possession (Score: 24-24)
Scottie Quickley attempts a 3Pt. Wide open! Trae Durant is 7.5 feet away. [ZONE] Scottie Quickley misses. Rebound secured by Trae Durant.

[10:40] Team_079 possession (Score: 24-24)
FOUL! Reach-in foul on Jarrett Fox during the drive. [Team fouls: 4] No free throws, side out. (Jarrett Fox: 2 personal fouls)

[10:24] Team_079 possession (Score: 24-24)
Trae Durant attempts a Midrange. Heavily contested by Donovan Green (1.3 feet, MAN)! Trae Durant misses. Offensive rebound by James LaVine! James LaVine's putback is no good. Rebound secured by Jarrett Fox.

[10:13] Team_099 possession (Score: 24-24)
FOUL! Reach-in foul on Anthony Wade during the drive. [Team fouls: 1] No free throws, side out. (Anthony Wade: 1 personal fouls)

[09:55] Team_099 possession (Score: 24-24)
Ayo Barrett drives and kicks out. Scottie Quickley attempts a 3Pt. Wide open! Anthony Wade is 7.6 feet away. [MAN] SCOTTIE QUICKLEY MAKES IT! Assist: Jarrett Fox
Score: 27-24

[09:40] Team_079 possession (Score: 27-24)
Anthony Wade attempts a 3Pt. Contested by Ayo Barrett (4.0 feet, ZONE). ANTHONY WADE MAKES IT! Assist: Evan Mobley
Score: 27-27

[09:27] Team_099 possession (Score: 27-27)
Scottie Quickley drives to the basket... Scottie Quickley throws a bad pass out of bounds! TURNOVER! (dead ball)

[09:27] Substitution (Team_099): Ayo Barrett OUT → CJ Cunningham IN (stamina_rule2)

[09:27] Substitution (Team_099): Larry James OUT → Manu Johnson IN (stamina_rule2)

[09:27] Substitution (Team_079): Trae Durant OUT → Kobe Curry IN (stamina_rule2)

[09:10] Team_079 possession (Score: 27-27)
Evan Mobley loses control! Ball rolls out of bounds! TURNOVER! (dead ball)

[08:55] Team_099 possession (Score: 27-27)
Jarrett Fox attempts a Layup. Wide open! James LaVine is 6.4 feet away. [MAN] Jarrett Fox misses. Rebound secured by James LaVine.

[08:39] Team_079 possession (Score: 27-27)
Kobe Curry drives, Donovan Green stays with him. Kobe Curry attempts a Dunk. Heavily contested by Donovan Green (0.8 feet, MAN)! Kobe Curry misses. Rebound secured by Jarrett Fox.

[08:29] Team_099 possession (Score: 27-27)
Donovan Green drives and kicks out. Manu Johnson attempts a Midrange. Heavily contested by Anthony Wade (1.3 feet, ZONE)! Manu Johnson misses. Rebound secured by Kobe Curry.

[08:09] Team_079 possession (Score: 27-27)
FOUL! Reach-in foul on CJ Cunningham during the drive. [IN THE BONUS! 5 team fouls] Evan Mobley to the line for 2 free throws. (CJ Cunningham: 1 personal fouls)   FT 1/2: MISS   FT 2/2: GOOD Evan Mobley makes 1/2 from the line.
Score: 27-28

[07:59] Team_099 possession (Score: 27-28)
FOUL! Offensive foul on Donovan Green! Kobe Curry drew the charge! [Team fouls: 6] (Donovan Green: 2 personal fouls) TURNOVER! (dead ball)

[07:48] Team_079 possession (Score: 27-28)
Evan Mobley drives and kicks out. Anthony Wade attempts a Midrange. Contested by Scottie Quickley (3.6 feet, MAN). ANTHONY WADE MAKES IT!
Score: 27-30

[07:36] Team_099 possession (Score: 27-30)
FOUL! Shooting foul on Karl Ingram. Manu Johnson to the line for 2 free throws. [Team fouls: 2] (Karl Ingram: 1 personal fouls)   FT 1/2: MISS   FT 2/2: MISS Manu Johnson makes 0/2 from the line. Rebound secured by Kobe Curry.

[07:22] Team_079 possession (Score: 27-30)
FOUL! Reach-in foul on Donovan Green during the drive. [IN THE BONUS! 7 team fouls] Kobe Curry to the line for 2 free throws. (Donovan Green: 3 personal fouls)   FT 1/2: GOOD   FT 2/2: GOOD Kobe Curry makes 2/2 from the line.
Score: 27-32

[07:08] Team_099 possession (Score: 27-32)
Manu Johnson throws a bad pass! Stolen by Karl Ingram! TURNOVER! (live ball)

[06:50] Team_079 possession (Score: 27-32)
Anthony Wade drives and kicks out. Anthony Wade attempts a 3Pt. Heavily contested by Scottie Quickley (0.5 feet, MAN)! Anthony Wade misses. Offensive rebound by Kobe Curry! Kobe Curry kicks it out.

[06:37] Team_079 possession (Score: 27-32)
Evan Mobley attempts a Layup. BLOCKED BY SCOTTIE QUICKLEY! Ball deflects out of bounds off Evan Mobley.

[06:20] Team_099 possession (Score: 27-32)
Scottie Quickley throws a bad pass! Stolen by Anthony Wade! TURNOVER! (live ball)

[06:05] Team_079 possession (Score: 27-32)
Evan Mobley attempts a 3Pt. Wide open! Manu Johnson is 6.3 feet away. [ZONE] Evan Mobley misses. Rebound secured by Jarrett Fox.

[05:49] Team_099 possession (Score: 27-32)
Donovan Green loses the ball! Stripped by Kobe Curry! TURNOVER! (live ball)

[05:35] Team_079 possession (Score: 27-32)
FOUL! Reach-in foul on Manu Johnson during the drive. [IN THE BONUS! 8 team fouls] Karl Ingram to the line for 2 free throws. (Manu Johnson: 1 personal fouls)   FT 1/2: GOOD   FT 2/2: GOOD Karl Ingram makes 2/2 from the line.
Score: 27-34

[05:20] Team_099 possession (Score: 27-34)
Scottie Quickley attempts a 3Pt. Contested by Karl Ingram (3.6 feet, ZONE). Scottie Quickley misses. Offensive rebound by Donovan Green! Donovan Green kicks it out.

[05:04] Team_099 possession (Score: 27-34)
Scottie Quickley attempts a Layup. Contested by James LaVine (5.5 feet, ZONE). SCOTTIE QUICKLEY MAKES IT!
Score: 29-34

[04:45] Team_079 possession (Score: 29-34)
Anthony Wade drives to the basket... Anthony Wade throws a bad pass out of bounds! TURNOVER! (dead ball)

[04:29] Team_099 possession (Score: 29-34)
Manu Johnson throws a bad pass! Stolen by Karl Ingram! TURNOVER! (live ball)

[04:16] Team_079 possession (Score: 29-34)
Karl Ingram attempts a Midrange. Contested by Manu Johnson (5.9 feet, MAN). KARL INGRAM MAKES IT! Assist: Evan Mobley
Score: 29-36

[04:05] Team_099 possession (Score: 29-36)
Scottie Quickley drives, picks up Anthony Wade. Help arrives from Karl Ingram! Scottie Quickley attempts a Dunk. Contested by Karl Ingram (3.9 feet, MAN). Scottie Quickley misses. Rebound secured by Kobe Curry.

[03:52] Team_079 possession (Score: 29-36)
FOUL! Reach-in foul on Jarrett Fox during the drive. [IN THE BONUS! 9 team fouls] James LaVine to the line for 2 free throws. (Jarrett Fox: 3 personal fouls)   FT 1/2: MISS   FT 2/2: MISS James LaVine makes 0/2 from the line. Rebound secured by Scottie Quickley.

[03:38] Team_099 possession (Score: 29-36)
Manu Johnson attempts a 3Pt. Wide open! Karl Ingram is 8.7 feet away. [MAN] MANU JOHNSON MAKES IT! Assist: CJ Cunningham
Score: 32-36

[03:27] Team_079 possession (Score: 32-36)
Kobe Curry attempts a 3Pt. Contested by Manu Johnson (4.1 feet, ZONE). Kobe Curry misses. Rebound secured by Scottie Quickley.

[03:12] Team_099 possession (Score: 32-36)
Scottie Quickley attempts a 3Pt. Wide open! Anthony Wade is 7.8 feet away. [MAN] Scottie Quickley misses. Rebound secured by Kobe Curry.

[02:58] Team_079 possession (Score: 32-36)
Karl Ingram drives and kicks out. Evan Mobley attempts a Midrange. Wide open! Manu Johnson is 6.2 feet away. [ZONE] EVAN MOBLEY MAKES IT!
Score: 32-38

[02:43] Team_099 possession (Score: 32-38)
Scottie Quickley attempts a 3Pt. Heavily contested by Karl Ingram (1.7 feet, ZONE)! Scottie Quickley misses. Rebound secured by Kobe Curry.

[02:29] Team_079 possession (Score: 32-38)
Evan Mobley drives and kicks out. Anthony Wade attempts a 3Pt. Contested by Manu Johnson (3.0 feet, ZONE). Anthony Wade misses. Offensive rebound by Kobe Curry! Kobe Curry kicks it out.

[02:14] Team_079 possession (Score: 32-38)
James LaVine attempts a Midrange. Wide open! Jarrett Fox is 6.5 feet away. [MAN] James LaVine misses. Rebound secured by Donovan Green.

[01:57] Team_099 possession (Score: 32-38)
Scottie Quickley drives, James LaVine stays with him. Scottie Quickley attempts a Layup. Contested by James LaVine (2.6 feet, ZONE). SCOTTIE QUICKLEY MAKES IT! Assist: Manu Johnson
Score: 34-38

[01:43] Team_079 possession (Score: 34-38)
Anthony Wade attempts a Midrange. Contested by Donovan Green (3.9 feet, ZONE). ANTHONY WADE MAKES IT!
Score: 34-40

[01:25] Team_099 possession (Score: 34-40)
Donovan Green attempts a Midrange. Contested by Karl Ingram (5.4 feet, ZONE). Donovan Green misses. Offensive rebound by Jarrett Fox! Jarrett Fox's putback is no good. Rebound secured by Kobe Curry.

[01:12] Team_079 possession (Score: 34-40)
Karl Ingram attempts a 3Pt. Contested by Manu Johnson (3.3 feet, MAN). Karl Ingram misses. Rebound secured by Donovan Green.

[00:54] Team_099 possession (Score: 34-40)
CJ Cunningham drives, James LaVine stays with him. CJ Cunningham attempts a Dunk. Contested by James LaVine (5.7 feet, ZONE). CJ CUNNINGHAM MAKES IT! Assist: Donovan Green
Score: 36-40

[00:38] Team_079 possession (Score: 36-40)
Anthony Wade drives to the basket... Anthony Wade throws a bad pass! Stolen by Scottie Quickley! TURNOVER! (live ball)

[00:24] Team_099 possession (Score: 36-40)
Jarrett Fox makes the Layup and draws the foul on James LaVine! And-1! Jarrett Fox to the line for 1. [Team fouls: 3] (James LaVine: 1 personal fouls)   FT 1/1: GOOD Jarrett Fox makes 1/1 from the line.
Score: 39-40

[00:12] Team_079 possession (Score: 39-40)
Evan Mobley attempts a 3Pt. Contested by CJ Cunningham (5.9 feet, MAN). Evan Mobley misses. Rebound secured by Donovan Green.

================================================================================
                              2ND QUARTER COMPLETE                              
================================================================================

2ND QUARTER SCORE: Team_099 17, Team_079 19

BOX SCORE:
================================================================================

Team_099
--------------------------------------------------------------------------------
Player                MIN  PTS  REB  AST  TO      FG   FG%      3P   3P%
--------------------------------------------------------------------------------
Scottie Quickley       12    7    2    0   0   3/7    42.9     0/0   0.0
Jarrett Fox            12    3    3    1   0   1/2    50.0     0/0   0.0
Manu Johnson            9    3    0    1   0   1/2    50.0     0/0   0.0
Larry James            15    2    0    0   0   1/1   100.0     0/0   0.0
Kobe Curry              9    2    8    0   0   1/3    33.3     0/0   0.0
CJ Cunningham           9    2    0    1   0   1/1   100.0     0/0   0.0
Ayo Barrett            15    0    0    1   0   0/0     0.0     0/0   0.0
Donovan Green          12    0    5    1   0   0/2     0.0     0/0   0.0

TEAM: FG: 7/15 (46.7%), 3PT: 1/4 (25.0%), REB: 10 (2 off, 8 def), AST: 5, TO: 7
TEAM FOULS: 9 [Team_079 in BONUS]


Team_079
--------------------------------------------------------------------------------
Player                MIN  PTS  REB  AST  TO      FG   FG%      3P   3P%
--------------------------------------------------------------------------------
Anthony Wade           12   10    0    0   0   4/4   100.0     0/0   0.0
Karl Ingram            12    4    0    0   0   2/3    66.7     0/0   0.0
Evan Mobley            12    3    0    2   0   2/5    40.0     0/0   0.0
Trae Durant            15    0    1    0   0   0/2     0.0     0/0   0.0
James LaVine           12    0    1    0   0   0/2     0.0     0/0   0.0

TEAM: FG: 9/19 (47.4%), 3PT: 1/5 (20.0%), REB: 10 (3 off, 7 def), AST: 2, TO: 3
TEAM FOULS: 3

================================================================================

================================================================================
                       3RD QUARTER - Team_099 vs Team_079                       
================================================================================

[12:00] Team_099 possession (Score: 39-40)
Larry Wade makes the Midrange and draws the foul on Donovan Randle! And-1! Larry Wade to the line for 1. [Team fouls: 1] (Donovan Randle: 1 personal fouls)   FT 1/1: MISS Larry Wade makes 0/1 from the line. Rebound secured by Donovan Randle.
Score: 41-40

[11:47] Team_079 possession (Score: 41-40)
Donovan Randle attempts a Layup. Heavily contested by Vince Lillard (0.5 feet, ZONE)! Donovan Randle misses. Rebound secured by Larry Wade.

[11:34] Team_099 possession (Score: 41-40)
Ayo Barrett attempts a 3Pt. Contested by Khris Embiid (3.3 feet, MAN). Ayo Barrett misses. Rebound secured by Trae Durant.

[11:24] Team_079 possession (Score: 41-40)
Donovan Randle drives to the basket... Donovan Randle throws a bad pass! Stolen by Larry Wade! TURNOVER! (live ball)

[11:11] Team_099 possession (Score: 41-40)
Ayo Barrett attempts a 3Pt. Wide open! Khris Embiid is 6.2 feet away. [MAN] Ayo Barrett misses. Offensive rebound by Vince Lillard! Vince Lillard's putback is no good. Rebound secured by Trae Durant.

[10:58] Team_079 possession (Score: 41-40)
Trae Durant makes the Layup and draws the foul on Vince Lillard! And-1! Trae Durant to the line for 1. [Team fouls: 1] (Vince Lillard: 1 personal fouls)   FT 1/1: GOOD Trae Durant makes 1/1 from the line.
Score: 41-43

[10:41] Team_099 possession (Score: 41-43)
Larry James drives and kicks out. Ayo Barrett makes the Midrange and draws the foul on Khris Embiid! And-1! Ayo Barrett to the line for 1. [Team fouls: 2] (Khris Embiid: 1 personal fouls)   FT 1/1: GOOD Ayo Barrett makes 1/1 from the line.
Score: 44-43

[10:25] Team_079 possession (Score: 44-43)
Donovan Randle attempts a Layup. Heavily contested by Vince Lillard (0.5 feet, ZONE)! Donovan Randle misses. Rebound secured by Vince Lillard.

[10:11] Team_099 possession (Score: 44-43)
Damian Ginobili attempts a 3Pt. Wide open! Khris Embiid is 7.4 feet away. [ZONE] Damian Ginobili misses. Rebound secured by Donovan Randle.

[09:55] Team_079 possession (Score: 44-43)
Miles Ming attempts a 3Pt. Wide open! Larry James is 6.6 feet away. [MAN] MILES MING MAKES IT! Assist: Bam Randle
Score: 44-46

[09:43] Team_099 possession (Score: 44-46)
Ayo Barrett attempts a Layup. Contested by Trae Durant (3.7 feet, ZONE). Ayo Barrett misses. Rebound secured by Donovan Randle.

[09:26] Team_079 possession (Score: 44-46)
FOUL! Holding foul on Ayo Barrett. [Team fouls: 2] No free throws, side out. (Ayo Barrett: 1 personal fouls)

[09:16] Team_079 possession (Score: 44-46)
Miles Ming drives and kicks out. Bam Randle attempts a 3Pt. Contested by Damian Ginobili (2.9 feet, MAN). Bam Randle misses. Rebound secured by Larry Wade.

[09:06] Team_099 possession (Score: 44-46)
FOUL! Shooting foul on Trae Durant. Vince Lillard to the line for 2 free throws. [Team fouls: 3] (Trae Durant: 1 personal fouls)   FT 1/2: MISS   FT 2/2: GOOD Vince Lillard makes 1/2 from the line.
Score: 45-46

[08:48] Team_079 possession (Score: 45-46)
Trae Durant attempts a 3Pt. Contested by Ayo Barrett (3.3 feet, ZONE). Trae Durant misses. Rebound secured by Damian Ginobili.

[08:39] Team_099 possession (Score: 45-46)
Larry James attempts a 3Pt. Contested by Miles Ming (3.8 feet, MAN). LARRY JAMES MAKES IT! Assist: Ayo Barrett
Score: 48-46

[08:23] Team_079 possession (Score: 48-46)
Trae Durant attempts a Midrange. Contested by Damian Ginobili (4.6 feet, ZONE). TRAE DURANT MAKES IT! Assist: Miles Ming
Score: 48-48

[08:09] Team_099 possession (Score: 48-48)
Vince Lillard attempts a 3Pt. Contested by Trae Durant (2.4 feet, ZONE). Vince Lillard misses. FOUL! Loose ball foul on Trae Durant during the rebound battle. [Team fouls: 4] No free throws, side out. (Trae Durant: 2 personal fouls)

[07:55] Team_099 possession (Score: 48-48)
Vince Lillard attempts a Midrange. Contested by Bam Randle (4.4 feet, ZONE). Vince Lillard misses. Rebound secured by Bam Randle.

[07:38] Team_079 possession (Score: 48-48)
Bam Randle attempts a Midrange. Contested by Vince Lillard (4.3 feet, ZONE). Bam Randle misses. Offensive rebound by Trae Durant! Trae Durant puts it back in!
Score: 48-50

[07:22] Team_099 possession (Score: 48-50)
Vince Lillard drives, Trae Durant stays with him. Vince Lillard attempts a Layup. Heavily contested by Trae Durant (0.5 feet, ZONE)! VINCE LILLARD MAKES IT! Assist: Damian Ginobili
Score: 50-50

[07:04] Team_079 possession (Score: 50-50)
Trae Durant attempts a Midrange. Contested by Vince Lillard (2.7 feet, ZONE). Trae Durant misses. Offensive rebound by Donovan Randle! Donovan Randle kicks it out.

[06:48] Team_079 possession (Score: 50-50)
Trae Durant attempts a Midrange. Heavily contested by Vince Lillard (0.5 feet, MAN)! TRAE DURANT MAKES IT!
Score: 50-52

[06:36] Team_099 possession (Score: 50-52)
Damian Ginobili attempts a Midrange. Heavily contested by Trae Durant (1.4 feet, ZONE)! Damian Ginobili misses. Offensive rebound by Larry Wade! Larry Wade puts it back in!
Score: 52-52

[06:24] Team_079 possession (Score: 52-52)
Khris Embiid drives, Ayo Barrett stays with him. Khris Embiid attempts a Dunk. Contested by Ayo Barrett (3.0 feet, MAN). KHRIS EMBIID MAKES IT! Assist: Trae Durant
Score: 52-54

[06:09] Team_099 possession (Score: 52-54)
FOUL! Reach-in foul on Donovan Randle during the drive. [IN THE BONUS! 5 team fouls] Larry Wade to the line for 2 free throws. (Donovan Randle: 2 personal fouls)   FT 1/2: GOOD   FT 2/2: MISS Larry Wade makes 1/2 from the line. Rebound secured by Trae Durant.
Score: 53-54

[05:56] Team_079 possession (Score: 53-54)
Donovan Randle drives, Vince Lillard stays with him. Donovan Randle attempts a Layup. Heavily contested by Vince Lillard (1.8 feet, ZONE)! DONOVAN RANDLE MAKES IT!
Score: 53-56

[05:41] Team_099 possession (Score: 53-56)
Larry James drives and kicks out. Larry Wade attempts a 3Pt. Contested by Donovan Randle (4.4 feet, MAN). Larry Wade misses. Rebound secured by Donovan Randle.

[05:24] Team_079 possession (Score: 53-56)
Bam Randle attempts a 3Pt. Heavily contested by Damian Ginobili (0.6 feet, MAN)! BAM RANDLE MAKES IT! Assist: Miles Ming
Score: 53-59

[05:08] Team_099 possession (Score: 53-59)
Ayo Barrett attempts a 3Pt. Contested by Khris Embiid (3.8 feet, MAN). AYO BARRETT MAKES IT! Assist: Damian Ginobili
Score: 56-59

[04:57] Team_079 possession (Score: 56-59)
Donovan Randle attempts a Layup. BLOCKED BY VINCE LILLARD! Ball is loose! Rebound secured by Vince Lillard.

[04:42] Team_099 possession (Score: 56-59)
Damian Ginobili attempts a 3Pt. Contested by Trae Durant (2.6 feet, ZONE). Damian Ginobili misses. Offensive rebound by Larry Wade! Larry Wade's putback is no good. Rebound secured by Trae Durant.

[04:28] Team_079 possession (Score: 56-59)
Miles Ming drives and kicks out. Trae Durant attempts a 3Pt. Contested by Larry James (4.9 feet, ZONE). TRAE DURANT MAKES IT! Assist: Khris Embiid
Score: 56-62

[04:12] Team_099 possession (Score: 56-62)
Larry Wade drives and kicks out. Ayo Barrett makes the 3Pt and draws the foul on Khris Embiid! And-1! Ayo Barrett to the line for 1. [BONUS: 6 team fouls] (Khris Embiid: 2 personal fouls)   FT 1/1: GOOD Ayo Barrett makes 1/1 from the line.
Score: 60-62

[03:58] Team_079 possession (Score: 60-62)
Trae Durant attempts a 3Pt. Wide open! Ayo Barrett is 7.6 feet away. [ZONE] TRAE DURANT MAKES IT!
Score: 60-65

[03:46] Team_099 possession (Score: 60-65)
Larry Wade throws a bad pass out of bounds! TURNOVER! (dead ball)

[03:31] Team_079 possession (Score: 60-65)
Khris Embiid drives, Ayo Barrett stays with him. Khris Embiid attempts a Layup. Contested by Ayo Barrett (3.6 feet, MAN). Khris Embiid misses. Rebound secured by Larry Wade.

[03:16] Team_099 possession (Score: 60-65)
Vince Lillard drives to the basket... Vince Lillard loses the ball! Stripped by Trae Durant! TURNOVER! (live ball)

[03:03] Team_079 possession (Score: 60-65)
Bam Randle attempts a Midrange. Contested by Damian Ginobili (4.4 feet, MAN). BAM RANDLE MAKES IT! Assist: Khris Embiid
Score: 60-67

[02:47] Team_099 possession (Score: 60-67)
Larry Wade attempts a 3Pt. Contested by Trae Durant (5.3 feet, ZONE). Larry Wade misses. Rebound secured by Donovan Randle.

[02:29] Team_079 possession (Score: 60-67)
Khris Embiid attempts a Midrange. Contested by Ayo Barrett (4.6 feet, MAN). KHRIS EMBIID MAKES IT!
Score: 60-69

[02:12] Team_099 possession (Score: 60-69)
Larry Wade drives to the basket... Larry Wade throws a bad pass! Stolen by Trae Durant! TURNOVER! (live ball)

[01:57] Team_079 possession (Score: 60-69)
Miles Ming attempts a 3Pt. Wide open! Ayo Barrett is 6.1 feet away. [ZONE] Miles Ming misses. Rebound secured by Vince Lillard.

[01:45] Team_099 possession (Score: 60-69)
Ayo Barrett throws a bad pass out of bounds! TURNOVER! (dead ball)

[01:45] Substitution (Team_099): Ayo Barrett OUT → CJ Cunningham IN (stamina_rule2)

[01:45] Substitution (Team_099): Larry James OUT → Manu Johnson IN (stamina_rule2)

[01:45] Substitution (Team_099): Damian Ginobili OUT → Scottie Quickley IN (stamina_rule2)

[01:45] Substitution (Team_099): Vince Lillard OUT → Donovan Green IN (stamina_rule2)

[01:45] Substitution (Team_099): Larry Wade OUT → Jarrett Fox IN (stamina_rule2)

[01:45] Substitution (Team_079): Khris Embiid OUT → Evan Mobley IN (stamina_rule2)

[01:45] Substitution (Team_079): Miles Ming OUT → Karl Ingram IN (stamina_rule2)

[01:45] Substitution (Team_079): Bam Randle OUT → Anthony Wade IN (stamina_rule2)

[01:45] Substitution (Team_079): Trae Durant OUT → Kobe Curry IN (stamina_rule2)

[01:45] Substitution (Team_079): Donovan Randle OUT → James LaVine IN (stamina_rule2)

[01:30] Team_079 possession (Score: 60-69)
James LaVine drives, picks up Jarrett Fox. Help arrives from Manu Johnson! James LaVine attempts a Layup. Contested by Manu Johnson (2.7 feet, ZONE). James LaVine misses. Rebound secured by Scottie Quickley.

[01:18] Team_099 possession (Score: 60-69)
Scottie Quickley attempts a Layup. Contested by Anthony Wade (4.6 feet, MAN). SCOTTIE QUICKLEY MAKES IT! Assist: Manu Johnson
Score: 62-69

[01:03] Team_079 possession (Score: 62-69)
FOUL! Offensive foul on Anthony Wade! Scottie Quickley drew the charge! [Team fouls: 7] (Anthony Wade: 1 personal fouls) TURNOVER! (dead ball)

[00:51] Team_099 possession (Score: 62-69)
FOUL! Shooting foul on James LaVine. Manu Johnson to the line for 2 free throws. [BONUS: 8 team fouls] (James LaVine: 1 personal fouls)   FT 1/2: GOOD   FT 2/2: MISS Manu Johnson makes 1/2 from the line. Rebound secured by Anthony Wade.
Score: 63-69

[00:31] Team_079 possession (Score: 63-69)
Evan Mobley attempts a 3Pt. Wide open! CJ Cunningham is 6.1 feet away. [MAN] EVAN MOBLEY MAKES IT!
Score: 63-72

[00:17] Team_099 possession (Score: 63-72)
CJ Cunningham attempts a 3Pt. Wide open! Evan Mobley is 6.4 feet away. [ZONE] CJ CUNNINGHAM MAKES IT! Assist: Jarrett Fox
Score: 66-72

[00:01] Team_079 possession (Score: 66-72)
Kobe Curry attempts a Layup. Heavily contested by Jarrett Fox (1.2 feet, ZONE)! KOBE CURRY MAKES IT! Assist: Anthony Wade
Score: 66-74

================================================================================
                              3RD QUARTER COMPLETE                              
================================================================================

3RD QUARTER SCORE: Team_099 27, Team_079 34

BOX SCORE:
================================================================================

Team_099
--------------------------------------------------------------------------------
Player                MIN  PTS  REB  AST  TO      FG   FG%      3P   3P%
--------------------------------------------------------------------------------
Ayo Barrett            25   10    0    1   0   3/6    50.0     0/0   0.0
Vince Lillard          23    3    3    0   0   2/3    66.7     0/0   0.0
Larry James            25    3    0    0   0   1/2    50.0     0/0   0.0
CJ Cunningham          11    3    0    0   0   1/1   100.0     0/0   0.0
Larry Wade             23    2    5    0   0   1/4    25.0     0/0   0.0
Scottie Quickley       13    2    1    0   0   1/1   100.0     0/0   0.0
Damian Ginobili        23    0    1    2   0   0/2     0.0     0/0   0.0
Manu Johnson           11    0    0    1   0   0/1     0.0     0/0   0.0
Jarrett Fox            13    0    0    1   0   0/0     0.0     0/0   0.0

TEAM: FG: 9/20 (45.0%), 3PT: 3/8 (37.5%), REB: 12 (4 off, 8 def), AST: 5, TO: 4
TEAM FOULS: 2


Team_079
--------------------------------------------------------------------------------
Player                MIN  PTS  REB  AST  TO      FG   FG%      3P   3P%
--------------------------------------------------------------------------------
Trae Durant            25   15    5    1   0   6/7    85.7     0/0   0.0
Bam Randle             23    5    1    1   0   2/2   100.0     0/0   0.0
Khris Embiid           23    4    0    2   0   2/3    66.7     0/0   0.0
Miles Ming             23    3    0    2   0   1/3    33.3     0/0   0.0
Evan Mobley            13    3    0    0   0   1/1   100.0     0/0   0.0
Donovan Randle         23    2    6    0   0   1/4    25.0     0/0   0.0
Kobe Curry             11    2    0    0   0   1/1   100.0     0/0   0.0
James LaVine           13    0    0    0   0   0/1     0.0     0/0   0.0
Anthony Wade           13    0    1    1   0   0/0     0.0     0/0   0.0

TEAM: FG: 14/22 (63.6%), 3PT: 4/6 (66.7%), REB: 11 (2 off, 9 def), AST: 7, TO: 2
TEAM FOULS: 8 [Team_099 in BONUS]

================================================================================

================================================================================
                       4TH QUARTER - Team_099 vs Team_079                       
================================================================================

[12:00] Team_099 possession (Score: 66-74)
Ayo Barrett attempts a Midrange. Contested by Khris Embiid (6.0 feet, MAN). AYO BARRETT MAKES IT!
Score: 68-74

[11:42] Team_079 possession (Score: 68-74)
Trae Durant makes the Layup and draws the foul on Vince Lillard! And-1! Trae Durant to the line for 1. [Team fouls: 1] (Vince Lillard: 1 personal fouls)   FT 1/1: GOOD Trae Durant makes 1/1 from the line.
Score: 68-77

[11:24] Team_099 possession (Score: 68-77)
Larry James attempts a 3Pt. Contested by Trae Durant (4.5 feet, ZONE). Larry James misses. FOUL! Loose ball foul on Bam Randle during the rebound battle. [Team fouls: 1] No free throws, side out. (Bam Randle: 1 personal fouls)

[11:12] Team_099 possession (Score: 68-77)
Larry James makes the Midrange and draws the foul on Bam Randle! And-1! Larry James to the line for 1. [Team fouls: 2] (Bam Randle: 2 personal fouls)   FT 1/1: GOOD Larry James makes 1/1 from the line.
Score: 71-77

[10:54] Team_079 possession (Score: 71-77)
Donovan Randle attempts a Layup. BLOCKED BY VINCE LILLARD! Ball deflects out of bounds off Donovan Randle.

[10:34] Team_099 possession (Score: 71-77)
Larry Wade attempts a 3Pt. Contested by Khris Embiid (4.9 feet, ZONE). Larry Wade misses. Rebound secured by Bam Randle.

[10:20] Team_079 possession (Score: 71-77)
Miles Ming drives, Larry James stays with him. Miles Ming attempts a Layup. Wide open! Larry James is 7.7 feet away. [MAN] Miles Ming misses. Rebound secured by Damian Ginobili.

[10:00] Team_099 possession (Score: 71-77)
Damian Ginobili attempts a Midrange. Wide open! Bam Randle is 7.9 feet away. [MAN] DAMIAN GINOBILI MAKES IT! Assist: Vince Lillard
Score: 73-77

[09:48] Team_079 possession (Score: 73-77)
FOUL! Shooting foul on Larry Wade. Donovan Randle to the line for 3 free throws. [Team fouls: 2] (Larry Wade: 1 personal fouls)   FT 1/3: MISS   FT 2/3: GOOD   FT 3/3: MISS Donovan Randle makes 1/3 from the line. Offensive rebound by Donovan Randle! Donovan Randle kicks it out.
Score: 73-78

[09:33] Team_079 possession (Score: 73-78)
Miles Ming attempts a Layup. BLOCKED BY LARRY JAMES! Ball goes out off Larry James. Miles Ming's ball!

[09:21] Team_079 possession (Score: 73-78)
Trae Durant attempts a 3Pt. Contested by Ayo Barrett (5.5 feet, ZONE). TRAE DURANT MAKES IT! Assist: Miles Ming
Score: 73-81

[09:08] Team_099 possession (Score: 73-81)
Larry James attempts a Layup. BLOCKED BY TRAE DURANT! Ball is loose! Rebound secured by Bam Randle.

[08:54] Team_079 possession (Score: 73-81)
Donovan Randle makes the Layup and draws the foul on Vince Lillard! And-1! Donovan Randle to the line for 1. [Team fouls: 3] (Vince Lillard: 2 personal fouls)   FT 1/1: GOOD Donovan Randle makes 1/1 from the line.
Score: 73-84

[08:40] Team_099 possession (Score: 73-84)
Ayo Barrett attempts a Midrange. Heavily contested by Khris Embiid (1.1 feet, MAN)! AYO BARRETT MAKES IT! Assist: Larry Wade
Score: 75-84

[08:24] Team_079 possession (Score: 75-84)
Khris Embiid attempts a 3Pt. Contested by Ayo Barrett (4.3 feet, ZONE). Khris Embiid misses. Rebound secured by Damian Ginobili.

[08:09] Team_099 possession (Score: 75-84)
Ayo Barrett attempts a 3Pt. Contested by Trae Durant (2.4 feet, ZONE). AYO BARRETT MAKES IT! Assist: Larry James
Score: 78-84

[07:50] Team_079 possession (Score: 78-84)
Khris Embiid attempts a Midrange. Contested by Ayo Barrett (4.3 feet, MAN). Khris Embiid misses. Rebound secured by Vince Lillard.

[07:36] Team_099 possession (Score: 78-84)
Vince Lillard drives to the basket... Vince Lillard throws a bad pass out of bounds! TURNOVER! (dead ball)

[07:36] Substitution (Team_099): Ayo Barrett OUT → CJ Cunningham IN (stamina_rule2)

[07:36] Substitution (Team_099): Larry James OUT → Manu Johnson IN (stamina_rule2)

[07:36] Substitution (Team_099): Damian Ginobili OUT → Scottie Quickley IN (stamina_rule2)

[07:36] Substitution (Team_099): Vince Lillard OUT → Donovan Green IN (stamina_rule2)

[07:36] Substitution (Team_099): Larry Wade OUT → Jarrett Fox IN (stamina_rule2)

[07:36] Substitution (Team_079): Khris Embiid OUT → Evan Mobley IN (stamina_rule2)

[07:36] Substitution (Team_079): Miles Ming OUT → Karl Ingram IN (stamina_rule2)

[07:36] Substitution (Team_079): Bam Randle OUT → Anthony Wade IN (stamina_rule2)

[07:36] Substitution (Team_079): Trae Durant OUT → Kobe Curry IN (stamina_rule2)

[07:36] Substitution (Team_079): Donovan Randle OUT → James LaVine IN (stamina_rule2)

[07:21] Team_079 possession (Score: 78-84)
James LaVine drives, Jarrett Fox stays with him. James LaVine attempts a Layup. Heavily contested by Jarrett Fox (0.5 feet, MAN)! JAMES LAVINE MAKES IT! Assist: Evan Mobley
Score: 78-86

[07:10] Team_099 possession (Score: 78-86)
Scottie Quickley attempts a 3Pt. Contested by Anthony Wade (5.1 feet, MAN). SCOTTIE QUICKLEY MAKES IT! Assist: Donovan Green
Score: 81-86

[06:58] Team_079 possession (Score: 81-86)
Kobe Curry throws a bad pass! Stolen by Donovan Green! TURNOVER! (live ball)

[06:44] Team_099 possession (Score: 81-86)
CJ Cunningham attempts a Layup. Wide open! James LaVine is 6.7 feet away. [ZONE] CJ CUNNINGHAM MAKES IT! Assist: Donovan Green
Score: 83-86

[06:29] Team_079 possession (Score: 83-86)
James LaVine drives and kicks out. James LaVine attempts a 3Pt. Contested by Jarrett Fox (4.7 feet, MAN). James LaVine misses. Rebound secured by Jarrett Fox.

[06:14] Team_099 possession (Score: 83-86)
CJ Cunningham attempts a 3Pt. Contested by Evan Mobley (4.4 feet, MAN). CJ Cunningham misses. Rebound secured by Anthony Wade.

[06:02] Team_079 possession (Score: 83-86)
James LaVine throws a bad pass out of bounds! TURNOVER! (dead ball)

[05:52] Team_099 possession (Score: 83-86)
Jarrett Fox loses control! Ball rolls out of bounds! TURNOVER! (dead ball)

[05:37] Team_079 possession (Score: 83-86)
Kobe Curry attempts a 3Pt. Wide open! Manu Johnson is 6.9 feet away. [ZONE] Kobe Curry misses. FOUL! Loose ball foul on Scottie Quickley during the rebound battle. [Team fouls: 4] No free throws, side out. (Scottie Quickley: 1 personal fouls)

[05:25] Team_079 possession (Score: 83-86)
FOUL! Holding foul on Donovan Green. [IN THE BONUS! 5 team fouls] Kobe Curry to the line for 2 free throws. (Donovan Green: 1 personal fouls)   FT 1/2: MISS   FT 2/2: GOOD Kobe Curry makes 1/2 from the line.
Score: 83-87

[05:06] Team_099 possession (Score: 83-87)
Scottie Quickley attempts a Layup. Contested by James LaVine (3.2 feet, ZONE). SCOTTIE QUICKLEY MAKES IT! Assist: Donovan Green
Score: 85-87

[04:48] Team_079 possession (Score: 85-87)
Kobe Curry drives and kicks out. Karl Ingram attempts a 3Pt. Contested by Manu Johnson (4.7 feet, MAN). Karl Ingram misses. Rebound secured by Scottie Quickley.

[04:30] Team_099 possession (Score: 85-87)
CJ Cunningham attempts a 3Pt. Wide open! Evan Mobley is 8.3 feet away. [ZONE] CJ CUNNINGHAM MAKES IT! Assist: Jarrett Fox
Score: 88-87

[04:18] Team_079 possession (Score: 88-87)
Karl Ingram attempts a Layup. BLOCKED BY JARRETT FOX! Ball is loose! Rebound secured by Donovan Green.

[04:01] Team_099 possession (Score: 88-87)
FOUL! Shooting foul on James LaVine. Donovan Green to the line for 2 free throws. [Team fouls: 3] (James LaVine: 1 personal fouls)   FT 1/2: GOOD   FT 2/2: GOOD Donovan Green makes 2/2 from the line.
Score: 90-87

[03:49] Team_079 possession (Score: 90-87)
FOUL! Offensive foul on James LaVine! Jarrett Fox drew the charge! [Team fouls: 4] (James LaVine: 2 personal fouls) TURNOVER! (dead ball)

[03:37] Team_099 possession (Score: 90-87)
Jarrett Fox attempts a Midrange. Contested by Anthony Wade (3.1 feet, ZONE). Jarrett Fox misses. Rebound secured by James LaVine.

[03:23] Team_079 possession (Score: 90-87)
Anthony Wade attempts a Midrange. Contested by Scottie Quickley (5.0 feet, MAN). Anthony Wade misses. Rebound secured by Jarrett Fox.

[03:06] Team_099 possession (Score: 90-87)
Manu Johnson makes the Layup and draws the foul on James LaVine! And-1! Manu Johnson to the line for 1. [BONUS: 5 team fouls] (James LaVine: 3 personal fouls)   FT 1/1: GOOD Manu Johnson makes 1/1 from the line.
Score: 93-87

[02:51] Team_079 possession (Score: 93-87)
James LaVine attempts a Layup. Contested by Jarrett Fox (3.3 feet, MAN). JAMES LAVINE MAKES IT! Assist: Anthony Wade
Score: 93-89

[02:35] Team_099 possession (Score: 93-89)
FOUL! Reach-in foul on Kobe Curry during the drive. [IN THE BONUS! 6 team fouls] Donovan Green to the line for 2 free throws. (Kobe Curry: 1 personal fouls)   FT 1/2: MISS   FT 2/2: GOOD Donovan Green makes 1/2 from the line.
Score: 94-89

[02:25] Team_079 possession (Score: 94-89)
FOUL! Reach-in foul on Jarrett Fox during the drive. [IN THE BONUS! 6 team fouls] Evan Mobley to the line for 2 free throws. (Jarrett Fox: 1 personal fouls)   FT 1/2: GOOD   FT 2/2: GOOD Evan Mobley makes 2/2 from the line.
Score: 94-91

[02:07] Team_099 possession (Score: 94-91)
FOUL! Shooting foul on James LaVine. Donovan Green to the line for 2 free throws. [BONUS: 7 team fouls] (James LaVine: 4 personal fouls)   FT 1/2: GOOD   FT 2/2: GOOD Donovan Green makes 2/2 from the line.
Score: 96-91

[01:52] Team_079 possession (Score: 96-91)
Anthony Wade attempts a 3Pt. Contested by Scottie Quickley (2.2 feet, MAN). Anthony Wade misses. Rebound secured by Jarrett Fox.

[01:35] Team_099 possession (Score: 96-91)
Jarrett Fox attempts a 3Pt. Contested by Karl Ingram (4.8 feet, ZONE). Jarrett Fox misses. Rebound secured by Kobe Curry.

[01:20] Team_079 possession (Score: 96-91)
Anthony Wade attempts a Layup. Contested by Scottie Quickley (3.1 feet, MAN). Anthony Wade misses. Rebound secured by Donovan Green.

[01:04] Team_099 possession (Score: 96-91)
Manu Johnson throws a bad pass out of bounds! TURNOVER! (dead ball)

[00:48] Team_079 possession (Score: 96-91)
Kobe Curry attempts a Layup. Contested by Jarrett Fox (3.5 feet, ZONE). KOBE CURRY MAKES IT! Assist: James LaVine
Score: 96-93

[00:34] Team_099 possession (Score: 96-93)
Scottie Quickley attempts a 3Pt. Wide open! Anthony Wade is 7.4 feet away. [MAN] SCOTTIE QUICKLEY MAKES IT! Assist: Manu Johnson
Score: 99-93

[00:23] Team_079 possession (Score: 99-93)
James LaVine attempts a 3Pt. Contested by Manu Johnson (2.8 feet, ZONE). James LaVine misses. Rebound secured by Jarrett Fox.

[00:05] Team_099 possession (Score: 99-93)
Manu Johnson commits a violation (traveling/carry)! TURNOVER! (dead ball)

================================================================================
                              4TH QUARTER COMPLETE                              
================================================================================

4TH QUARTER SCORE: Team_099 33, Team_079 19

BOX SCORE:
================================================================================

Team_099
--------------------------------------------------------------------------------
Player                MIN  PTS  REB  AST  TO      FG   FG%      3P   3P%
--------------------------------------------------------------------------------
Scottie Quickley       21    8    1    0   0   3/3   100.0     0/0   0.0
Ayo Barrett            30    7    0    0   0   3/3   100.0     0/0   0.0
Donovan Green          21    5    2    3   0   3/3   100.0     0/0   0.0
CJ Cunningham          18    5    0    0   0   2/3    66.7     0/0   0.0
Larry James            30    3    0    1   0   1/2    50.0     0/0   0.0
Manu Johnson           18    3    0    1   0   1/1   100.0     0/0   0.0
Damian Ginobili        27    2    2    0   0   1/1   100.0     0/0   0.0
Larry Wade             27    0    1    1   0   0/1     0.0     0/0   0.0
Vince Lillard          27    0    1    1   0   0/0     0.0     0/0   0.0
Jarrett Fox            21    0    4    1   0   0/2     0.0     0/0   0.0

TEAM: FG: 14/19 (73.7%), 3PT: 4/7 (57.1%), REB: 11 (1 off, 10 def), AST: 8, TO: 4
TEAM FOULS: 6 [Team_079 in BONUS]


Team_079
--------------------------------------------------------------------------------
Player                MIN  PTS  REB  AST  TO      FG   FG%      3P   3P%
--------------------------------------------------------------------------------
Trae Durant            30    6    0    0   0   2/2   100.0     0/0   0.0
James LaVine           21    4    1    1   0   2/4    50.0     0/0   0.0
Donovan Randle         27    3    1    0   0   1/2    50.0     0/0   0.0
Kobe Curry             18    3    2    0   0   2/3    66.7     0/0   0.0
Evan Mobley            21    2    0    1   0   1/1   100.0     0/0   0.0
Bam Randle             27    0    2    0   0   0/0     0.0     0/0   0.0
Miles Ming             27    0    0    1   0   0/1     0.0     0/0   0.0
Khris Embiid           27    0    0    0   0   0/2     0.0     0/0   0.0
Anthony Wade           21    0    1    1   0   0/3     0.0     0/0   0.0
Karl Ingram            21    0    0    0   0   0/1     0.0     0/0   0.0

TEAM: FG: 8/19 (42.1%), 3PT: 1/4 (25.0%), REB: 7 (2 off, 5 def), AST: 4, TO: 3
TEAM FOULS: 7 [Team_099 in BONUS]

================================================================================

================================================================================
                               FULL GAME COMPLETE                               
================================================================================

FINAL SCORE: Team_099 99, Team_079 93

SCORING BY QUARTER:
--------------------------------------------------------------------------------
Team                     Q1     Q2     Q3     Q4    FINAL
--------------------------------------------------------------------------------
Team_099                 22     17     27     33       99
Team_079                 21     19     34     19       93
--------------------------------------------------------------------------------

FULL GAME BOX SCORE:
================================================================================

Team_099
--------------------------------------------------------------------------------
Player                MIN  PTS  REB  AST  TO      FG   FG%      3P   3P%      FT STL BLK
--------------------------------------------------------------------------------
Ayo Barrett            30   20    0    3   4   5/10   50.0   2/5    40.0   2/2     0   0
Larry James            30   15    0    1   3   7/11   63.6   2/4    50.0   1/1     0   1
Damian Ginobili        27    7    4    3   1   4/8    50.0   0/4     0.0   1/1     0   1
Vince Lillard          27    5    8    2   0   5/7    71.4   0/1     0.0   1/2     0   2
Larry Wade             27    7   11    3   2   2/8    25.0   1/4    25.0   1/3     3   0
Scottie Quickley       21   17    4    0   1   6/10   60.0   2/5    40.0   0/0     1   1
Donovan Green          21    5    7    4   2   3/5    60.0   0/0     0.0   5/6     1   0
Jarrett Fox            21    3    7    3   2   1/4    25.0   0/1     0.0   1/1     0   1
CJ Cunningham          18   10    0    1   0   4/5    80.0   2/3    66.7   0/0     0   0
Manu Johnson           18    6    0    3   4   2/4    50.0   1/1   100.0   2/5     0   0

TEAM: FG: 39/72 (54.2%), 3PT: 10/28 (35.7%), REB: 43 (10 off, 33 def), AST: 23, TO: 19


Team_079
--------------------------------------------------------------------------------
Player                MIN  PTS  REB  AST  TO      FG   FG%      3P   3P%      FT STL BLK
--------------------------------------------------------------------------------
Trae Durant            30   21   15    1   1   6/10   60.0   2/4    50.0   2/4     3   1
Khris Embiid           27    9    0    3   1   5/11   45.5   1/4    25.0   0/0     1   0
Miles Ming             27    9    0    3   0   4/7    57.1   3/4    75.0   0/0     0   0
Bam Randle             27   10    3    2   2   5/8    62.5   2/2   100.0   0/0     0   0
Donovan Randle         27   10    9    3   2   3/8    37.5   0/0     0.0   2/4     1   0
Evan Mobley            21    8    0    3   2   4/7    57.1   1/3    33.3   3/4     0   0
Karl Ingram            21    4    0    0   1   3/5    60.0   0/1     0.0   2/2     2   0
Anthony Wade           21   10    2    2   1   3/6    50.0   1/2    50.0   1/1     1   0
James LaVine           21    4    2    1   2   2/7    28.6   0/1     0.0   0/2     0   0
Kobe Curry             18    7   10    0   1   3/6    50.0   0/1     0.0   3/4     1   0

TEAM: FG: 39/76 (51.3%), 3PT: 10/22 (45.5%), REB: 39 (9 off, 30 def), AST: 18, TO: 13

================================================================================
