================================================================================
                        FULL GAME - Team_030 vs Team_093                        
================================================================================

================================================================================
                       1ST QUARTER - Team_030 vs Team_093                       
================================================================================

[12:00] Team_030 possession (Score: 0-0)
Jordan Nowitzki attempts a 3Pt. Contested by Carmelo Wagner (4.4 feet, ZONE). Jordan Nowitzki misses. FOUL! Loose ball foul on Carmelo Wagner during the rebound battle. [Team fouls: 1] No free throws, side out. (Carmelo Wagner: 1 personal fouls)

[11:45] Team_030 possession (Score: 0-0)
Tyler Beal attempts a Midrange. Contested by Trae Westbrook (2.0 feet, ZONE). TYLER BEAL MAKES IT!
Score: 2-0

[11:30] Team_093 possession (Score: 2-0)
Carmelo Wagner attempts a 3Pt. Contested by Tyler Beal (5.9 feet, ZONE). CARMELO WAGNER MAKES IT! Assist: Ben Cunningham
Score: 2-3

[11:17] Team_030 possession (Score: 2-3)
Joel Anunoby attempts a 3Pt. Wide open! Carmelo Wagner is 7.2 feet away. [ZONE] Joel Anunoby misses. Rebound secured by Vince Barnes.

[11:01] Team_093 possession (Score: 2-3)
Carmelo Wagner attempts a Midrange. Contested by Jordan Nowitzki (2.4 feet, ZONE). Carmelo Wagner misses. Rebound secured by Jordan Nowitzki.

[10:48] Team_030 possession (Score: 2-3)
Joel Anunoby makes the Midrange and draws the foul on Carmelo Wagner! And-1! Joel Anunoby to the line for 1. [Team fouls: 2] (Carmelo Wagner: 2 personal fouls)   FT 1/1: GOOD Joel Anunoby makes 1/1 from the line.
Score: 5-3

[10:33] Team_093 possession (Score: 5-3)
Carmelo Wagner loses the ball! Stripped by Joel Anunoby! TURNOVER! (live ball)

[10:19] Team_030 possession (Score: 5-3)
Joel Anunoby attempts a Midrange. Wide open! Vince Barnes is 6.0 feet away. [ZONE] Joel Anunoby misses. Offensive rebound by Joel Anunoby! Joel Anunoby kicks it out.

[10:04] Team_030 possession (Score: 5-3)
Tim Barrett attempts a Midrange. Contested by Vince Barnes (5.4 feet, ZONE). Tim Barrett misses. Rebound secured by Ben Cunningham.

[09:48] Team_093 possession (Score: 5-3)
Vince Barnes attempts a Layup. Heavily contested by Jordan Nowitzki (1.2 feet, MAN)! Vince Barnes misses. Rebound secured by Jaren Green.

[09:37] Team_030 possession (Score: 5-3)
Jordan Nowitzki drives and kicks out. Tim Barrett attempts a Midrange. Contested by Trae Westbrook (5.3 feet, MAN). TIM BARRETT MAKES IT!
Score: 7-3

[09:24] Team_093 possession (Score: 7-3)
Ben Cunningham attempts a Layup. Contested by Jaren Green (5.7 feet, MAN). BEN CUNNINGHAM MAKES IT! Assist: Damian Williamson
Score: 7-5

[09:08] Team_030 possession (Score: 7-5)
Jordan Nowitzki drives and kicks out. Jordan Nowitzki attempts a 3Pt. Heavily contested by Carmelo Wagner (1.9 feet, ZONE)! JORDAN NOWITZKI MAKES IT! Assist: Jaren Green
Score: 10-5

[08:55] Team_093 possession (Score: 10-5)
Damian Williamson throws a bad pass! Stolen by Tyler Beal! TURNOVER! (live ball)

[08:40] Team_030 possession (Score: 10-5)
Tyler Beal drives, picks up Damian Williamson. Help arrives from Carmelo Wagner! Tyler Beal attempts a Dunk. Wide open! Carmelo Wagner is 6.5 feet away. [MAN] TYLER BEAL MAKES IT! Assist: Jordan Nowitzki
Score: 12-5

[08:23] Team_093 possession (Score: 12-5)
Carmelo Wagner attempts a Midrange. Contested by Joel Anunoby (4.1 feet, MAN). Carmelo Wagner misses. Rebound secured by Jordan Nowitzki.

[08:06] Team_030 possession (Score: 12-5)
Tim Barrett attempts a 3Pt. Contested by Carmelo Wagner (5.5 feet, ZONE). Tim Barrett misses. Offensive rebound by Jordan Nowitzki! Jordan Nowitzki's putback is no good. Rebound secured by Carmelo Wagner.

[07:56] Team_093 possession (Score: 12-5)
Trae Westbrook drives to the basket... Trae Westbrook commits a violation (traveling/carry)! TURNOVER! (dead ball)

[07:45] Team_030 possession (Score: 12-5)
Jaren Green makes the Layup and draws the foul on Ben Cunningham! And-1! Jaren Green to the line for 1. [Team fouls: 3] (Ben Cunningham: 1 personal fouls)   FT 1/1: GOOD Jaren Green makes 1/1 from the line.
Score: 15-5

[07:27] Team_093 possession (Score: 15-5)
FOUL! Reach-in foul on Jordan Nowitzki during the drive. [Team fouls: 1] No free throws, side out. (Jordan Nowitzki: 1 personal fouls)

[07:12] Team_093 possession (Score: 15-5)
Carmelo Wagner attempts a 3Pt. Wide open! Joel Anunoby is 6.2 feet away. [MAN] Carmelo Wagner misses. Rebound secured by Joel Anunoby.

[06:55] Team_030 possession (Score: 15-5)
Tyler Beal throws a bad pass out of bounds! TURNOVER! (dead ball)

[06:43] Team_093 possession (Score: 15-5)
Trae Westbrook attempts a 3Pt. Contested by Tim Barrett (3.9 feet, MAN). Trae Westbrook misses. Offensive rebound by Ben Cunningham! Ben Cunningham kicks it out.

[06:29] Team_093 possession (Score: 15-5)
Trae Westbrook attempts a 3Pt. Contested by Tyler Beal (3.0 feet, ZONE). Trae Westbrook misses. Rebound secured by Joel Anunoby.

[06:14] Team_030 possession (Score: 15-5)
Jaren Green attempts a Midrange. Wide open! Ben Cunningham is 6.6 feet away. [MAN] Jaren Green misses. Rebound secured by Ben Cunningham.

[06:04] Team_093 possession (Score: 15-5)
FOUL! Shooting foul on Tyler Beal. Damian Williamson to the line for 3 free throws. [Team fouls: 2] (Tyler Beal: 1 personal fouls)   FT 1/3: MISS   FT 2/3: GOOD   FT 3/3: MISS Damian Williamson makes 1/3 from the line. FOUL! Loose ball foul on Jaren Green during the free throw rebound! [Team fouls: 3] No free throws, side out. (Jaren Green: 1 personal fouls)
Score: 15-6

[05:51] Team_093 possession (Score: 15-6)
Vince Barnes drives, Jordan Nowitzki stays with him. Vince Barnes attempts a Layup. Contested by Jordan Nowitzki (4.0 feet, MAN). Vince Barnes misses. Offensive rebound by Ben Cunningham! Ben Cunningham kicks it out.

[05:35] Team_093 possession (Score: 15-6)
Vince Barnes commits a violation (traveling/carry)! TURNOVER! (dead ball)

[05:19] Team_030 possession (Score: 15-6)
Jaren Green attempts a Dunk. BLOCKED BY BEN CUNNINGHAM! Ball is loose! Offensive rebound by Joel Anunoby! Joel Anunoby kicks it out.

[05:05] Team_030 possession (Score: 15-6)
Jaren Green drives and kicks out. Tim Barrett attempts a Midrange. Heavily contested by Carmelo Wagner (1.6 feet, ZONE)! TIM BARRETT MAKES IT! Assist: Jordan Nowitzki
Score: 17-6

[04:54] Team_093 possession (Score: 17-6)
Carmelo Wagner attempts a 3Pt. Contested by Joel Anunoby (3.5 feet, ZONE). Carmelo Wagner misses. Offensive rebound by Ben Cunningham! Ben Cunningham kicks it out.

[04:38] Team_093 possession (Score: 17-6)
FOUL! Holding foul on Tim Barrett. [Team fouls: 4] No free throws, side out. (Tim Barrett: 1 personal fouls)

[04:26] Team_093 possession (Score: 17-6)
Trae Westbrook attempts a 3Pt. Wide open! Tyler Beal is 6.6 feet away. [ZONE] Trae Westbrook misses. Rebound secured by Jordan Nowitzki.

[04:14] Team_030 possession (Score: 17-6)
Jordan Nowitzki makes the Layup and draws the foul on Vince Barnes! And-1! Jordan Nowitzki to the line for 1. [Team fouls: 4] (Vince Barnes: 1 personal fouls)   FT 1/1: GOOD Jordan Nowitzki makes 1/1 from the line.
Score: 20-6

[03:55] Team_093 possession (Score: 20-6)
Damian Williamson attempts a 3Pt. Contested by Tyler Beal (3.5 feet, ZONE). Damian Williamson misses. Rebound secured by Jaren Green.

[03:39] Team_030 possession (Score: 20-6)
Jaren Green attempts a Midrange. Contested by Ben Cunningham (4.3 feet, MAN). JAREN GREEN MAKES IT! Assist: Tyler Beal
Score: 22-6

[03:22] Team_093 possession (Score: 22-6)
Vince Barnes attempts a Midrange. Contested by Jordan Nowitzki (5.6 feet, MAN). Vince Barnes misses. Rebound secured by Joel Anunoby.

[03:09] Team_030 possession (Score: 22-6)
Tyler Beal attempts a 3Pt. Wide open! Damian Williamson is 6.5 feet away. [MAN] TYLER BEAL MAKES IT!
Score: 25-6

[02:57] Team_093 possession (Score: 25-6)
Vince Barnes drives, Jaren Green stays with him. Vince Barnes attempts a Layup. Contested by Jaren Green (2.7 feet, ZONE). Vince Barnes misses. Rebound secured by Joel Anunoby.

[02:47] Team_030 possession (Score: 25-6)
Tim Barrett drives and kicks out. Tyler Beal attempts a Midrange. Contested by Damian Williamson (2.9 feet, MAN). Tyler Beal misses. Rebound secured by Carmelo Wagner.

[02:32] Team_093 possession (Score: 25-6)
Ben Cunningham attempts a Layup. Heavily contested by Jordan Nowitzki (1.7 feet, ZONE)! Ben Cunningham misses. Rebound secured by Jordan Nowitzki.

[02:15] Team_030 possession (Score: 25-6)
Jaren Green attempts a Midrange. Contested by Carmelo Wagner (5.8 feet, ZONE). Jaren Green misses. Rebound secured by Vince Barnes.

[02:03] Team_093 possession (Score: 25-6)
Carmelo Wagner attempts a Layup. Contested by Jaren Green (5.0 feet, ZONE). CARMELO WAGNER MAKES IT! Assist: Damian Williamson
Score: 25-8

[01:46] Team_030 possession (Score: 25-8)
Tyler Beal attempts a Layup. BLOCKED BY DAMIAN WILLIAMSON! Ball is loose! Rebound secured by Vince Barnes.

[01:37] Team_093 possession (Score: 25-8)
Trae Westbrook attempts a Midrange. Wide open! Joel Anunoby is 7.0 feet away. [ZONE] TRAE WESTBROOK MAKES IT! Assist: Carmelo Wagner
Score: 25-10

[01:22] Team_030 possession (Score: 25-10)
Jordan Nowitzki loses the ball! Stripped by Vince Barnes! TURNOVER! (live ball)

[01:03] Team_093 possession (Score: 25-10)
FOUL! Holding foul on Jordan Nowitzki. [IN THE BONUS! 5 team fouls] Vince Barnes to the line for 2 free throws. (Jordan Nowitzki: 2 personal fouls)   FT 1/2: GOOD   FT 2/2: GOOD Vince Barnes makes 2/2 from the line.
Score: 25-12

[00:46] Team_030 possession (Score: 25-12)
Tyler Beal drives, Damian Williamson stays with him. Tyler Beal attempts a Dunk. Contested by Damian Williamson (3.1 feet, MAN). TYLER BEAL MAKES IT!
Score: 27-12

[00:34] Team_093 possession (Score: 27-12)
FOUL! Holding foul on Tim Barrett. [IN THE BONUS! 6 team fouls] Trae Westbrook to the line for 2 free throws. (Tim Barrett: 2 personal fouls)   FT 1/2: GOOD   FT 2/2: GOOD Trae Westbrook makes 2/2 from the line.
Score: 27-14

[00:18] Team_030 possession (Score: 27-14)
Joel Anunoby drives, Ben Cunningham stays with him. Joel Anunoby attempts a Dunk. Contested by Ben Cunningham (5.5 feet, ZONE). JOEL ANUNOBY MAKES IT!
Score: 29-14

[00:02] Team_093 possession (Score: 29-14)
Damian Williamson drives to the basket... FOUL! Offensive foul on Damian Williamson! Tyler Beal drew the charge! [Team fouls: 5] (Damian Williamson: 1 personal fouls) TURNOVER! (dead ball)

================================================================================
                              1ST QUARTER COMPLETE                              
================================================================================

1ST QUARTER SCORE: Team_030 29, Team_093 14

BOX SCORE:
================================================================================

Team_030
--------------------------------------------------------------------------------
Player                MIN  PTS  REB  AST  TO      FG   FG%      3P   3P%
--------------------------------------------------------------------------------
Tyler Beal             12    9    0    1   0   4/5    80.0     0/0   0.0
Jordan Nowitzki        12    6    5    2   0   2/2   100.0     0/0   0.0
Joel Anunoby           12    5    6    0   0   2/3    66.7     0/0   0.0
Jaren Green            12    5    2    1   0   2/4    50.0     0/0   0.0
Tim Barrett            12    4    0    0   0   2/5    40.0     0/0   0.0

TEAM: FG: 12/19 (63.2%), 3PT: 1/3 (33.3%), REB: 14 (4 off, 10 def), AST: 4, TO: 2
TEAM FOULS: 6 [Team_093 in BONUS]


Team_093
--------------------------------------------------------------------------------
Player                MIN  PTS  REB  AST  TO      FG   FG%      3P   3P%
--------------------------------------------------------------------------------
Carmelo Wagner         12    5    3    1   0   2/5    40.0     0/0   0.0
Trae Westbrook         12    4    0    0   0   2/4    50.0     0/0   0.0
Ben Cunningham         12    2    5    1   0   1/2    50.0     0/0   0.0
Vince Barnes           12    2    3    0   0   1/4    25.0     0/0   0.0
Damian Williamson      12    0    0    2   0   0/1     0.0     0/0   0.0

TEAM: FG: 6/16 (37.5%), 3PT: 1/5 (20.0%), REB: 10 (4 off, 6 def), AST: 4, TO: 5
TEAM FOULS: 5 [Team_030 in BONUS]

================================================================================

================================================================================
                       2ND QUARTER - Team_030 vs Team_093                       
================================================================================

[12:00] Substitution (Team_030): Tyler Beal OUT → RJ Carter IN (stamina_rule2)

[12:00] Substitution (Team_030): Tim Barrett OUT → Josh Smith IN (stamina_rule2)

[12:00] Substitution (Team_030): Joel Anunoby OUT → Pau James IN (stamina_rule2)

[12:00] Substitution (Team_030): Jordan Nowitzki OUT → Damian Green IN (stamina_rule2)

[12:00] Substitution (Team_030): Jaren Green OUT → Franz Anunoby IN (stamina_rule2)

[12:00] Substitution (Team_093): Damian Williamson OUT → Shaquille George IN (stamina_rule2)

[12:00] Substitution (Team_093): Trae Westbrook OUT → Immanuel Cunningham IN (stamina_rule2)

[12:00] Substitution (Team_093): Carmelo Wagner OUT → Lauri Parker IN (stamina_rule2)

[12:00] Substitution (Team_093): Vince Barnes OUT → Kobe Murray IN (stamina_rule2)

[12:00] Substitution (Team_093): Ben Cunningham OUT → Cade O'Neal IN (stamina_rule2)

[12:00] Team_030 possession (Score: 29-14)
Jordan Nowitzki throws a bad pass out of bounds! TURNOVER! (dead ball)

[11:42] Team_093 possession (Score: 29-14)
Shaquille George attempts a 3Pt. Wide open! RJ Carter is 6.2 feet away. [MAN] Shaquille George misses. Offensive rebound by Kobe Murray! Kobe Murray's putback is no good. Rebound secured by Franz Anunoby.

[11:28] Team_030 possession (Score: 29-14)
Josh Smith drives, picks up Immanuel Cunningham. Help arrives from Shaquille George! Josh Smith attempts a Dunk. Wide open! Shaquille George is 7.1 feet away. [MAN] JOSH SMITH MAKES IT!
Score: 31-14

[11:14] Team_093 possession (Score: 31-14)
Cade O'Neal attempts a Layup. Heavily contested by Franz Anunoby (1.4 feet, MAN)! Cade O'Neal misses. Offensive rebound by Cade O'Neal! Cade O'Neal kicks it out.

[10:56] Team_093 possession (Score: 31-14)
Cade O'Neal drives and kicks out. Kobe Murray attempts a Midrange. Wide open! Damian Green is 6.8 feet away. [MAN] Kobe Murray misses. Rebound secured by Damian Green.

[10:41] Team_030 possession (Score: 31-14)
Damian Green attempts a 3Pt. Heavily contested by Shaquille George (0.6 feet, ZONE)! Damian Green misses. Rebound secured by Kobe Murray.

[10:29] Team_093 possession (Score: 31-14)
Shaquille George drives to the basket... Shaquille George loses the ball! Stripped by RJ Carter! TURNOVER! (live ball)

[10:10] Team_030 possession (Score: 31-14)
Pau James attempts a 3Pt. Contested by Lauri Parker (4.3 feet, MAN). Pau James misses. Offensive rebound by Pau James! Pau James kicks it out.

[09:51] Team_030 possession (Score: 31-14)
RJ Carter attempts a 3Pt. Contested by Shaquille George (4.1 feet, MAN). RJ Carter misses. Rebound secured by Lauri Parker.

[09:34] Team_093 possession (Score: 31-14)
Immanuel Cunningham attempts a Midrange. Wide open! Pau James is 6.6 feet away. [ZONE] Immanuel Cunningham misses. Rebound secured by Franz Anunoby.

[09:18] Team_030 possession (Score: 31-14)
RJ Carter attempts a 3Pt. Contested by Shaquille George (4.2 feet, MAN). RJ Carter misses. Rebound secured by Cade O'Neal.

[09:06] Team_093 possession (Score: 31-14)
Immanuel Cunningham attempts a Midrange. Contested by RJ Carter (4.0 feet, ZONE). IMMANUEL CUNNINGHAM MAKES IT! Assist: Shaquille George
Score: 31-16

[08:51] Team_030 possession (Score: 31-16)
RJ Carter attempts a Midrange. Contested by Shaquille George (4.1 feet, MAN). RJ CARTER MAKES IT! Assist: Pau James
Score: 33-16

[08:38] Team_093 possession (Score: 33-16)
Immanuel Cunningham makes the Layup and draws the foul on Damian Green! And-1! Immanuel Cunningham to the line for 1. [Team fouls: 1] (Damian Green: 1 personal fouls)   FT 1/1: GOOD Immanuel Cunningham makes 1/1 from the line.
Score: 33-19

[08:24] Team_030 possession (Score: 33-19)
FOUL! Reach-in foul on Kobe Murray during the drive. [Team fouls: 1] No free throws, side out. (Kobe Murray: 1 personal fouls)

[08:10] Team_030 possession (Score: 33-19)
Josh Smith drives to the basket... FOUL! Offensive foul on Josh Smith! Kobe Murray drew the charge! [Team fouls: 2] (Josh Smith: 1 personal fouls) TURNOVER! (dead ball)

[07:54] Team_093 possession (Score: 33-19)
Immanuel Cunningham drives, picks up Damian Green. Help arrives from Josh Smith! Immanuel Cunningham attempts a Layup. Wide open! Josh Smith is 8.1 feet away. [ZONE] IMMANUEL CUNNINGHAM MAKES IT! Assist: Kobe Murray
Score: 33-21

[07:36] Team_030 possession (Score: 33-21)
Josh Smith attempts a Layup. Contested by Kobe Murray (4.3 feet, ZONE). JOSH SMITH MAKES IT! Assist: Pau James
Score: 35-21

[07:20] Team_093 possession (Score: 35-21)
Cade O'Neal throws a bad pass! Stolen by Franz Anunoby! TURNOVER! (live ball)

[07:02] Team_030 possession (Score: 35-21)
Josh Smith attempts a 3Pt. Contested by Shaquille George (2.4 feet, ZONE). Josh Smith misses. Offensive rebound by Pau James! Pau James kicks it out.

[06:47] Team_030 possession (Score: 35-21)
Franz Anunoby makes the Layup and draws the foul on Kobe Murray! And-1! Franz Anunoby to the line for 1. [Team fouls: 2] (Kobe Murray: 2 personal fouls)   FT 1/1: GOOD Franz Anunoby makes 1/1 from the line.
Score: 38-21

[06:32] Team_093 possession (Score: 38-21)
Cade O'Neal drives to the basket... Cade O'Neal loses control! Ball rolls out of bounds! TURNOVER! (dead ball)

[06:19] Team_030 possession (Score: 38-21)
RJ Carter attempts a Layup. Contested by Shaquille George (4.3 feet, MAN). RJ CARTER MAKES IT! Assist: Damian Green
Score: 40-21

[06:02] Team_093 possession (Score: 40-21)
Shaquille George attempts a 3Pt. Wide open! RJ Carter is 8.1 feet away. [ZONE] Shaquille George misses. Offensive rebound by Kobe Murray! Kobe Murray's putback is no good. Rebound secured by Pau James.

[05:52] Team_030 possession (Score: 40-21)
RJ Carter makes the Midrange and draws the foul on Shaquille George! And-1! RJ Carter to the line for 1. [Team fouls: 3] (Shaquille George: 1 personal fouls)   FT 1/1: GOOD RJ Carter makes 1/1 from the line.
Score: 43-21

[05:34] Team_093 possession (Score: 43-21)
Shaquille George attempts a 3Pt. Wide open! RJ Carter is 6.5 feet away. [ZONE] Shaquille George misses. Rebound secured by Pau James.

[05:24] Team_030 possession (Score: 43-21)
Josh Smith drives, picks up Immanuel Cunningham. Help arrives from Shaquille George! Josh Smith attempts a Layup. Heavily contested by Shaquille George (1.4 feet, MAN)! Josh Smith misses. Offensive rebound by Damian Green! Damian Green kicks it out.

[05:09] Team_030 possession (Score: 43-21)
RJ Carter attempts a 3Pt. Wide open! Shaquille George is 7.0 feet away. [MAN] RJ CARTER MAKES IT! Assist: Pau James
Score: 46-21

[04:53] Team_093 possession (Score: 46-21)
Lauri Parker attempts a 3Pt. Contested by Pau James (2.7 feet, MAN). LAURI PARKER MAKES IT! Assist: Immanuel Cunningham
Score: 46-24

[04:39] Team_030 possession (Score: 46-24)
Pau James drives to the basket... Pau James throws a bad pass out of bounds! TURNOVER! (dead ball)

[04:28] Team_093 possession (Score: 46-24)
Immanuel Cunningham throws a bad pass! Stolen by Josh Smith! TURNOVER! (live ball)

[04:13] Team_030 possession (Score: 46-24)
Damian Green attempts a Midrange. Contested by Immanuel Cunningham (3.1 feet, ZONE). DAMIAN GREEN MAKES IT! Assist: Josh Smith
Score: 48-24

[04:02] Team_093 possession (Score: 48-24)
Immanuel Cunningham attempts a Midrange. Wide open! Josh Smith is 7.7 feet away. [MAN] IMMANUEL CUNNINGHAM MAKES IT! Assist: Kobe Murray
Score: 48-26

[03:46] Team_030 possession (Score: 48-26)
FOUL! Offensive foul on RJ Carter! Shaquille George drew the charge! [Team fouls: 3] (RJ Carter: 1 personal fouls) TURNOVER! (dead ball)

[03:27] Team_093 possession (Score: 48-26)
Lauri Parker attempts a Layup. Contested by Damian Green (3.8 feet, ZONE). LAURI PARKER MAKES IT!
Score: 48-28

[03:13] Team_030 possession (Score: 48-28)
Josh Smith attempts a Midrange. Contested by Lauri Parker (5.0 feet, ZONE). JOSH SMITH MAKES IT! Assist: Damian Green
Score: 50-28

[02:56] Team_093 possession (Score: 50-28)
FOUL! Reach-in foul on Damian Green during the drive. [Team fouls: 4] No free throws, side out. (Damian Green: 2 personal fouls)

[02:42] Team_093 possession (Score: 50-28)
Kobe Murray attempts a Layup. BLOCKED BY DAMIAN GREEN! Ball is loose! Rebound secured by Franz Anunoby.

[02:30] Team_030 possession (Score: 50-28)
Pau James drives and kicks out. Franz Anunoby attempts a Midrange. Contested by Lauri Parker (2.6 feet, ZONE). FRANZ ANUNOBY MAKES IT! Assist: RJ Carter
Score: 52-28

[02:17] Team_093 possession (Score: 52-28)
Immanuel Cunningham drives and kicks out. Kobe Murray attempts a 3Pt. Contested by Josh Smith (4.0 feet, ZONE). Kobe Murray misses. Rebound secured by Pau James.

[02:01] Team_030 possession (Score: 52-28)
Pau James attempts a 3Pt. Contested by Lauri Parker (4.8 feet, MAN). Pau James misses. Offensive rebound by Pau James! Pau James kicks it out.

[01:45] Team_030 possession (Score: 52-28)
Damian Green attempts a 3Pt. Wide open! Shaquille George is 7.5 feet away. [ZONE] Damian Green misses. Rebound secured by Cade O'Neal.

[01:31] Team_093 possession (Score: 52-28)
Immanuel Cunningham attempts a Layup. BLOCKED BY JOSH SMITH! Ball is loose! Offensive rebound by Cade O'Neal! Cade O'Neal kicks it out.

[01:14] Team_093 possession (Score: 52-28)
Kobe Murray attempts a 3Pt. Wide open! RJ Carter is 6.6 feet away. [ZONE] Kobe Murray misses. Rebound secured by Pau James.

[01:00] Team_030 possession (Score: 52-28)
Pau James drives to the basket... Pau James loses control! Ball rolls out of bounds! TURNOVER! (dead ball)

[00:44] Team_093 possession (Score: 52-28)
FOUL! Reach-in foul on Damian Green during the drive. [IN THE BONUS! 5 team fouls] Kobe Murray to the line for 2 free throws. (Damian Green: 3 personal fouls)   FT 1/2: GOOD   FT 2/2: GOOD Kobe Murray makes 2/2 from the line.
Score: 52-30

[00:30] Team_030 possession (Score: 52-30)
Franz Anunoby attempts a Midrange. Contested by Kobe Murray (4.1 feet, MAN). Franz Anunoby misses. Rebound secured by Lauri Parker.

[00:16] Team_093 possession (Score: 52-30)
Kobe Murray drives, Damian Green stays with him. Kobe Murray attempts a Layup. Wide open! Damian Green is 7.1 feet away. [MAN] KOBE MURRAY MAKES IT! Assist: Lauri Parker
Score: 52-32

================================================================================
                              2ND QUARTER COMPLETE                              
================================================================================

2ND QUARTER SCORE: Team_030 23, Team_093 18

BOX SCORE:
================================================================================

Team_030
--------------------------------------------------------------------------------
Player                MIN  PTS  REB  AST  TO      FG   FG%      3P   3P%
--------------------------------------------------------------------------------
RJ Carter              12   10    0    1   0   4/6    66.7     0/0   0.0
Josh Smith             12    6    0    1   0   3/3   100.0     0/0   0.0
Franz Anunoby          12    5    3    0   0   2/3    66.7     0/0   0.0
Damian Green           12    2    2    2   0   1/3    33.3     0/0   0.0
Pau James              12    0    7    3   0   0/0     0.0     0/0   0.0

TEAM: FG: 10/15 (66.7%), 3PT: 1/5 (20.0%), REB: 10 (4 off, 6 def), AST: 7, TO: 5
TEAM FOULS: 5 [Team_093 in BONUS]


Team_093
--------------------------------------------------------------------------------
Player                MIN  PTS  REB  AST  TO      FG   FG%      3P   3P%
--------------------------------------------------------------------------------
Immanuel Cunningham    12    9    0    1   0   4/6    66.7     0/0   0.0
Lauri Parker           12    5    2    1   0   2/2   100.0     0/0   0.0
Kobe Murray            12    4    1    2   0   2/4    50.0     0/0   0.0
Shaquille George       12    0    0    1   0   0/3     0.0     0/0   0.0
Cade O'Neal            12    0    4    0   0   0/1     0.0     0/0   0.0

TEAM: FG: 8/16 (50.0%), 3PT: 1/5 (20.0%), REB: 9 (4 off, 5 def), AST: 5, TO: 4
TEAM FOULS: 3

================================================================================

================================================================================
                       3RD QUARTER - Team_030 vs Team_093                       
================================================================================

[12:00] Team_030 possession (Score: 52-32)
FOUL! Reach-in foul on Ben Cunningham during the drive. [Team fouls: 1] No free throws, side out. (Ben Cunningham: 1 personal fouls)

[11:47] Team_030 possession (Score: 52-32)
Jordan Nowitzki drives and kicks out. Tim Barrett attempts a Midrange. Contested by Trae Westbrook (2.5 feet, MAN). Tim Barrett misses. Rebound secured by Carmelo Wagner.

[11:33] Team_093 possession (Score: 52-32)
Damian Williamson drives and kicks out. Vince Barnes attempts a 3Pt. Wide open! Jordan Nowitzki is 6.8 feet away. [MAN] Vince Barnes misses. Rebound secured by Joel Anunoby.

[11:20] Team_030 possession (Score: 52-32)
Joel Anunoby attempts a 3Pt. Contested by Carmelo Wagner (5.9 feet, ZONE). Joel Anunoby misses. Rebound secured by Carmelo Wagner.

[11:04] Team_093 possession (Score: 52-32)
FOUL! Holding foul on Tyler Beal. [Team fouls: 1] No free throws, side out. (Tyler Beal: 1 personal fouls)

[10:47] Team_093 possession (Score: 52-32)
FOUL! Shooting foul on Tyler Beal. Damian Williamson to the line for 2 free throws. [Team fouls: 2] (Tyler Beal: 2 personal fouls)   FT 1/2: GOOD   FT 2/2: GOOD Damian Williamson makes 2/2 from the line.
Score: 52-34

[10:28] Team_030 possession (Score: 52-34)
Jordan Nowitzki attempts a Layup. Contested by Ben Cunningham (4.0 feet, ZONE). JORDAN NOWITZKI MAKES IT!
Score: 54-34

[10:14] Team_093 possession (Score: 54-34)
Carmelo Wagner attempts a 3Pt. Contested by Tyler Beal (5.7 feet, ZONE). CARMELO WAGNER MAKES IT! Assist: Ben Cunningham
Score: 54-37

[09:58] Team_030 possession (Score: 54-37)
Tyler Beal attempts a 3Pt. Contested by Damian Williamson (4.1 feet, MAN). Tyler Beal misses. Rebound secured by Vince Barnes.

[09:44] Team_093 possession (Score: 54-37)
Ben Cunningham attempts a Layup. Wide open! Jordan Nowitzki is 7.8 feet away. [ZONE] BEN CUNNINGHAM MAKES IT! Assist: Trae Westbrook
Score: 54-39

[09:33] Team_030 possession (Score: 54-39)
Jordan Nowitzki drives and kicks out. Tim Barrett attempts a 3Pt. Heavily contested by Carmelo Wagner (1.7 feet, ZONE)! Tim Barrett misses. Rebound secured by Carmelo Wagner.

[09:21] Team_093 possession (Score: 54-39)
Carmelo Wagner makes the 3Pt and draws the foul on Joel Anunoby! And-1! Carmelo Wagner to the line for 1. [Team fouls: 3] (Joel Anunoby: 1 personal fouls)   FT 1/1: GOOD Carmelo Wagner makes 1/1 from the line.
Score: 54-43

[09:09] Team_030 possession (Score: 54-43)
Tim Barrett attempts a Midrange. Heavily contested by Carmelo Wagner (0.5 feet, ZONE)! Tim Barrett misses. Rebound secured by Carmelo Wagner.

[08:58] Team_093 possession (Score: 54-43)
Vince Barnes attempts a Midrange. Contested by Jordan Nowitzki (3.5 feet, MAN). Vince Barnes misses. Rebound secured by Joel Anunoby.

[08:43] Team_030 possession (Score: 54-43)
Jaren Green drives, picks up Ben Cunningham. Help arrives from Trae Westbrook! Jaren Green attempts a Dunk. Contested by Trae Westbrook (2.8 feet, ZONE). JAREN GREEN MAKES IT!
Score: 56-43

[08:26] Team_093 possession (Score: 56-43)
Ben Cunningham attempts a Midrange. Heavily contested by Jaren Green (1.7 feet, MAN)! Ben Cunningham misses. Rebound secured by Jaren Green.

[08:12] Team_030 possession (Score: 56-43)
Joel Anunoby attempts a Layup. Heavily contested by Ben Cunningham (1.6 feet, ZONE)! Joel Anunoby misses. Rebound secured by Vince Barnes.

[07:57] Team_093 possession (Score: 56-43)
Damian Williamson attempts a 3Pt. Contested by Tyler Beal (4.5 feet, MAN). Damian Williamson misses. Rebound secured by Jaren Green.

[07:44] Team_030 possession (Score: 56-43)
Jordan Nowitzki attempts a 3Pt. Contested by Carmelo Wagner (5.1 feet, ZONE). Jordan Nowitzki misses. Rebound secured by Ben Cunningham.

[07:34] Team_093 possession (Score: 56-43)
FOUL! Shooting foul on Joel Anunoby. Damian Williamson to the line for 2 free throws. [Team fouls: 4] (Joel Anunoby: 2 personal fouls)   FT 1/2: MISS   FT 2/2: GOOD Damian Williamson makes 1/2 from the line.
Score: 56-44

[07:18] Team_030 possession (Score: 56-44)
Tim Barrett attempts a 3Pt. Contested by Carmelo Wagner (4.8 feet, ZONE). TIM BARRETT MAKES IT! Assist: Tyler Beal
Score: 59-44

[07:02] Team_093 possession (Score: 59-44)
Damian Williamson drives, Tyler Beal stays with him. Damian Williamson attempts a Layup. Contested by Tyler Beal (4.3 feet, MAN). DAMIAN WILLIAMSON MAKES IT!
Score: 59-46

[06:47] Team_030 possession (Score: 59-46)
Joel Anunoby drives and kicks out. Jordan Nowitzki attempts a Midrange. Contested by Vince Barnes (3.7 feet, MAN). Jordan Nowitzki misses. Offensive rebound by Jordan Nowitzki! Jordan Nowitzki's putback is no good. Offensive rebound by Joel Anunoby! Joel Anunoby kicks it out.

[06:30] Team_030 possession (Score: 59-46)
Jordan Nowitzki attempts a 3Pt. Heavily contested by Carmelo Wagner (1.8 feet, ZONE)! Jordan Nowitzki misses. Rebound secured by Carmelo Wagner.

[06:13] Team_093 possession (Score: 59-46)
Ben Cunningham attempts a 3Pt. Contested by Jaren Green (6.0 feet, MAN). Ben Cunningham misses. Rebound secured by Jordan Nowitzki.

[05:58] Team_030 possession (Score: 59-46)
Joel Anunoby attempts a 3Pt. Wide open! Carmelo Wagner is 6.3 feet away. [MAN] Joel Anunoby misses. Rebound secured by Carmelo Wagner.

[05:44] Team_093 possession (Score: 59-46)
Trae Westbrook attempts a Midrange. Heavily contested by Tim Barrett (1.8 feet, MAN)! Trae Westbrook misses. Rebound secured by Joel Anunoby.

[05:31] Team_030 possession (Score: 59-46)
Tim Barrett attempts a 3Pt. Wide open! Trae Westbrook is 7.8 feet away. [MAN] Tim Barrett misses. Offensive rebound by Jordan Nowitzki! Jordan Nowitzki puts it back in!
Score: 61-46

[05:19] Team_093 possession (Score: 61-46)
Carmelo Wagner attempts a 3Pt. Contested by Joel Anunoby (4.8 feet, MAN). Carmelo Wagner misses. Rebound secured by Jaren Green.

[05:00] Team_030 possession (Score: 61-46)
Tyler Beal attempts a Midrange. Contested by Vince Barnes (3.5 feet, ZONE). TYLER BEAL MAKES IT!
Score: 63-46

[04:45] Team_093 possession (Score: 63-46)
Trae Westbrook loses control! Ball rolls out of bounds! TURNOVER! (dead ball)

[04:31] Team_030 possession (Score: 63-46)
Tim Barrett attempts a 3Pt. Contested by Carmelo Wagner (4.2 feet, ZONE). TIM BARRETT MAKES IT! Assist: Jordan Nowitzki
Score: 66-46

[04:14] Team_093 possession (Score: 66-46)
Ben Cunningham attempts a 3Pt. Contested by Jaren Green (4.1 feet, MAN). Ben Cunningham misses. Rebound secured by Jaren Green.

[04:01] Team_030 possession (Score: 66-46)
FOUL! Holding foul on Vince Barnes. [Team fouls: 2] No free throws, side out. (Vince Barnes: 1 personal fouls)

[03:51] Team_030 possession (Score: 66-46)
Tyler Beal commits a violation (traveling/carry)! TURNOVER! (dead ball)

[03:38] Team_093 possession (Score: 66-46)
Carmelo Wagner drives, Jaren Green stays with him. Carmelo Wagner attempts a Layup. Wide open! Jaren Green is 6.9 feet away. [ZONE] CARMELO WAGNER MAKES IT!
Score: 66-48

[03:26] Team_030 possession (Score: 66-48)
Tim Barrett attempts a 3Pt. Wide open! Trae Westbrook is 7.8 feet away. [MAN] Tim Barrett misses. Rebound secured by Carmelo Wagner.

[03:06] Team_093 possession (Score: 66-48)
FOUL! Shooting foul on Jordan Nowitzki. Ben Cunningham to the line for 2 free throws. [BONUS: 5 team fouls] (Jordan Nowitzki: 1 personal fouls)   FT 1/2: GOOD   FT 2/2: GOOD Ben Cunningham makes 2/2 from the line.
Score: 66-50

[02:50] Team_030 possession (Score: 66-50)
Jordan Nowitzki drives to the basket... Jordan Nowitzki loses control! Ball rolls out of bounds! TURNOVER! (dead ball)

[02:50] Substitution (Team_093): Damian Williamson OUT → Shaquille George IN (stamina_rule2)

[02:50] Substitution (Team_093): Carmelo Wagner OUT → Lauri Parker IN (stamina_rule2)

[02:50] Substitution (Team_093): Ben Cunningham OUT → Cade O'Neal IN (stamina_rule2)

[02:38] Team_093 possession (Score: 66-50)
Lauri Parker drives, picks up Jaren Green. Help arrives from Tyler Beal! Lauri Parker attempts a Dunk. Contested by Tyler Beal (3.9 feet, ZONE). Lauri Parker misses. Rebound secured by Jaren Green.

[02:28] Team_030 possession (Score: 66-50)
Tim Barrett throws a bad pass! Stolen by Trae Westbrook! TURNOVER! (live ball)

[02:15] Team_093 possession (Score: 66-50)
Shaquille George attempts a 3Pt. Wide open! Tyler Beal is 6.5 feet away. [ZONE] Shaquille George misses. Rebound secured by Joel Anunoby.

[01:57] Team_030 possession (Score: 66-50)
Jordan Nowitzki drives to the basket... Jordan Nowitzki loses the ball! Stripped by Cade O'Neal! TURNOVER! (live ball)

[01:41] Team_093 possession (Score: 66-50)
FOUL! Shooting foul on Jordan Nowitzki. Vince Barnes to the line for 2 free throws. [BONUS: 6 team fouls] (Jordan Nowitzki: 2 personal fouls)   FT 1/2: MISS   FT 2/2: GOOD Vince Barnes makes 1/2 from the line.
Score: 66-51

[01:29] Team_030 possession (Score: 66-51)
Jordan Nowitzki drives, Vince Barnes stays with him. Jordan Nowitzki attempts a Dunk. Contested by Vince Barnes (2.5 feet, ZONE). JORDAN NOWITZKI MAKES IT! Assist: Tyler Beal
Score: 68-51

[01:10] Team_093 possession (Score: 68-51)
Trae Westbrook makes the Dunk and draws the foul on Jaren Green! And-1! Trae Westbrook to the line for 1. [BONUS: 7 team fouls] (Jaren Green: 1 personal fouls)   FT 1/1: GOOD Trae Westbrook makes 1/1 from the line.
Score: 68-54

[00:56] Team_030 possession (Score: 68-54)
Jordan Nowitzki attempts a 3Pt. Wide open! Vince Barnes is 8.2 feet away. [MAN] Jordan Nowitzki misses. Offensive rebound by Jordan Nowitzki! Jordan Nowitzki kicks it out.

[00:44] Team_030 possession (Score: 68-54)
Jordan Nowitzki attempts a 3Pt. Contested by Shaquille George (5.9 feet, ZONE). Jordan Nowitzki misses. Rebound secured by Vince Barnes.

[00:31] Team_093 possession (Score: 68-54)
Trae Westbrook attempts a 3Pt. Contested by Tyler Beal (3.6 feet, ZONE). TRAE WESTBROOK MAKES IT! Assist: Cade O'Neal
Score: 68-57

[00:19] Team_030 possession (Score: 68-57)
Tyler Beal attempts a 3Pt. Heavily contested by Shaquille George (1.6 feet, ZONE)! Tyler Beal misses. Rebound secured by Cade O'Neal.

[00:03] Team_093 possession (Score: 68-57)
Cade O'Neal attempts a Layup. BLOCKED BY TYLER BEAL! Ball is loose! Rebound secured by Jordan Nowitzki.

================================================================================
                              3RD QUARTER COMPLETE                              
================================================================================

3RD QUARTER SCORE: Team_030 16, Team_093 25

BOX SCORE:
================================================================================

Team_030
--------------------------------------------------------------------------------
Player                MIN  PTS  REB  AST  TO      FG   FG%      3P   3P%
--------------------------------------------------------------------------------
Jordan Nowitzki        25    6    4    1   0   3/8    37.5     0/0   0.0
Tim Barrett            25    6    0    0   0   2/4    50.0     0/0   0.0
Tyler Beal             25    2    0    2   0   1/3    33.3     0/0   0.0
Jaren Green            25    2    5    0   0   1/1   100.0     0/0   0.0
Joel Anunoby           25    0    5    0   0   0/3     0.0     0/0   0.0

TEAM: FG: 7/19 (36.8%), 3PT: 3/11 (27.3%), REB: 14 (3 off, 11 def), AST: 3, TO: 4
TEAM FOULS: 7 [Team_093 in BONUS]


Team_093
--------------------------------------------------------------------------------
Player                MIN  PTS  REB  AST  TO      FG   FG%      3P   3P%
--------------------------------------------------------------------------------
Carmelo Wagner         22    9    7    0   0   3/4    75.0     0/0   0.0
Trae Westbrook         25    6    0    1   0   2/3    66.7     0/0   0.0
Damian Williamson      22    5    0    0   0   3/5    60.0     0/0   0.0
Ben Cunningham         22    4    1    1   0   2/5    40.0     0/0   0.0
Vince Barnes           25    1    3    0   0   1/2    50.0     0/0   0.0
Lauri Parker           14    0    0    0   0   0/1     0.0     0/0   0.0
Shaquille George       14    0    0    0   0   0/1     0.0     0/0   0.0
Cade O'Neal            14    0    1    1   0   0/1     0.0     0/0   0.0

TEAM: FG: 11/22 (50.0%), 3PT: 3/8 (37.5%), REB: 12 (0 off, 12 def), AST: 3, TO: 1
TEAM FOULS: 2

================================================================================

================================================================================
                       4TH QUARTER - Team_030 vs Team_093                       
================================================================================

[12:00] Team_030 possession (Score: 68-57)
Tyler Beal makes the Dunk and draws the foul on Ben Cunningham! And-1! Tyler Beal to the line for 1. [Team fouls: 1] (Ben Cunningham: 1 personal fouls)   FT 1/1: GOOD Tyler Beal makes 1/1 from the line.
Score: 71-57

[11:46] Team_093 possession (Score: 71-57)
Carmelo Wagner attempts a Layup. Contested by Joel Anunoby (3.3 feet, MAN). CARMELO WAGNER MAKES IT!
Score: 71-59

[11:33] Team_030 possession (Score: 71-59)
Joel Anunoby attempts a Midrange. Contested by Carmelo Wagner (2.7 feet, MAN). JOEL ANUNOBY MAKES IT! Assist: Jordan Nowitzki
Score: 73-59

[11:21] Team_093 possession (Score: 73-59)
Vince Barnes drives to the basket... FOUL! Offensive foul on Vince Barnes! Jordan Nowitzki drew the charge! [Team fouls: 2] (Vince Barnes: 1 personal fouls) TURNOVER! (dead ball)

[11:08] Team_030 possession (Score: 73-59)
FOUL! Reach-in foul on Vince Barnes during the drive. [Team fouls: 3] No free throws, side out. (Vince Barnes: 2 personal fouls)

[10:51] Team_030 possession (Score: 73-59)
Tim Barrett attempts a 3Pt. Contested by Carmelo Wagner (4.3 feet, ZONE). Tim Barrett misses. Offensive rebound by Joel Anunoby! Joel Anunoby kicks it out.

[10:36] Team_030 possession (Score: 73-59)
Tim Barrett attempts a Midrange. Wide open! Ben Cunningham is 6.9 feet away. [ZONE] TIM BARRETT MAKES IT!
Score: 75-59

[10:19] Team_093 possession (Score: 75-59)
Carmelo Wagner makes the Dunk and draws the foul on Jaren Green! And-1! Carmelo Wagner to the line for 1. [Team fouls: 1] (Jaren Green: 1 personal fouls)   FT 1/1: GOOD Carmelo Wagner makes 1/1 from the line.
Score: 75-62

[10:03] Team_030 possession (Score: 75-62)
Jordan Nowitzki attempts a Midrange. Contested by Trae Westbrook (5.0 feet, ZONE). JORDAN NOWITZKI MAKES IT! Assist: Joel Anunoby
Score: 77-62

[09:48] Team_093 possession (Score: 77-62)
Trae Westbrook attempts a Layup. Contested by Jaren Green (2.3 feet, ZONE). TRAE WESTBROOK MAKES IT!
Score: 77-64

[09:33] Team_030 possession (Score: 77-64)
Tim Barrett attempts a 3Pt. Contested by Trae Westbrook (3.3 feet, MAN). Tim Barrett misses. Offensive rebound by Joel Anunoby! Joel Anunoby kicks it out.

[09:20] Team_030 possession (Score: 77-64)
Jaren Green drives, picks up Ben Cunningham. Help arrives from Trae Westbrook! Jaren Green attempts a Layup. Contested by Trae Westbrook (5.0 feet, MAN). JAREN GREEN MAKES IT!
Score: 79-64

[09:07] Team_093 possession (Score: 79-64)
Ben Cunningham attempts a Midrange. Contested by Jaren Green (5.5 feet, MAN). Ben Cunningham misses. Rebound secured by Jordan Nowitzki.

[08:53] Team_030 possession (Score: 79-64)
Joel Anunoby attempts a 3Pt. Contested by Carmelo Wagner (5.8 feet, MAN). JOEL ANUNOBY MAKES IT! Assist: Jordan Nowitzki
Score: 82-64

[08:34] Team_093 possession (Score: 82-64)
Ben Cunningham attempts a Midrange. Wide open! Jaren Green is 8.0 feet away. [MAN] Ben Cunningham misses. Rebound secured by Jaren Green.

[08:22] Team_030 possession (Score: 82-64)
Joel Anunoby attempts a 3Pt. Heavily contested by Carmelo Wagner (1.7 feet, ZONE)! Joel Anunoby misses. Rebound secured by Vince Barnes.

[08:08] Team_093 possession (Score: 82-64)
Vince Barnes attempts a Midrange. Wide open! Jordan Nowitzki is 9.7 feet away. [ZONE] Vince Barnes misses. Rebound secured by Jaren Green.

[07:53] Team_030 possession (Score: 82-64)
Tyler Beal attempts a 3Pt. Heavily contested by Carmelo Wagner (1.7 feet, ZONE)! TYLER BEAL MAKES IT! Assist: Joel Anunoby
Score: 85-64

[07:43] Team_093 possession (Score: 85-64)
Damian Williamson attempts a 3Pt. Contested by Joel Anunoby (2.5 feet, ZONE). Damian Williamson misses. Rebound secured by Jaren Green.

[07:30] Team_030 possession (Score: 85-64)
Tim Barrett attempts a 3Pt. Contested by Carmelo Wagner (2.4 feet, ZONE). Tim Barrett misses. Rebound secured by Vince Barnes.

[07:14] Team_093 possession (Score: 85-64)
Damian Williamson attempts a Midrange. Wide open! Jordan Nowitzki is 8.3 feet away. [ZONE] DAMIAN WILLIAMSON MAKES IT! Assist: Ben Cunningham
Score: 85-66

[07:02] Team_030 possession (Score: 85-66)
Tyler Beal attempts a Layup. BLOCKED BY DAMIAN WILLIAMSON! Ball is loose! Rebound secured by Carmelo Wagner.

[06:51] Team_093 possession (Score: 85-66)
Ben Cunningham attempts a Midrange. Wide open! Jaren Green is 8.0 feet away. [ZONE] BEN CUNNINGHAM MAKES IT!
Score: 85-68

[06:35] Team_030 possession (Score: 85-68)
Jordan Nowitzki attempts a Midrange. Wide open! Vince Barnes is 7.3 feet away. [MAN] Jordan Nowitzki misses. Rebound secured by Ben Cunningham.

[06:18] Team_093 possession (Score: 85-68)
Vince Barnes attempts a 3Pt. Contested by Tim Barrett (5.8 feet, ZONE). VINCE BARNES MAKES IT! Assist: Damian Williamson
Score: 85-71

[06:07] Team_030 possession (Score: 85-71)
Tim Barrett attempts a 3Pt. Contested by Carmelo Wagner (2.4 feet, ZONE). TIM BARRETT MAKES IT! Assist: Joel Anunoby
Score: 88-71

[05:52] Team_093 possession (Score: 88-71)
Vince Barnes drives to the basket... Vince Barnes commits a violation (traveling/carry)! TURNOVER! (dead ball)

[05:52] Substitution (Team_030): Tyler Beal OUT → RJ Carter IN (stamina_rule2)

[05:52] Substitution (Team_030): Tim Barrett OUT → Josh Smith IN (stamina_rule2)

[05:52] Substitution (Team_030): Joel Anunoby OUT → Pau James IN (stamina_rule2)

[05:52] Substitution (Team_030): Jordan Nowitzki OUT → Damian Green IN (stamina_rule2)

[05:52] Substitution (Team_030): Jaren Green OUT → Franz Anunoby IN (stamina_rule2)

[05:52] Substitution (Team_093): Damian Williamson OUT → Shaquille George IN (stamina_rule2)

[05:52] Substitution (Team_093): Trae Westbrook OUT → Immanuel Cunningham IN (stamina_rule2)

[05:52] Substitution (Team_093): Carmelo Wagner OUT → Lauri Parker IN (stamina_rule2)

[05:52] Substitution (Team_093): Vince Barnes OUT → Kobe Murray IN (stamina_rule2)

[05:52] Substitution (Team_093): Ben Cunningham OUT → Cade O'Neal IN (stamina_rule2)

[05:35] Team_030 possession (Score: 88-71)
Damian Green drives, Kobe Murray stays with him. Damian Green attempts a Dunk. Contested by Kobe Murray (2.0 feet, MAN). DAMIAN GREEN MAKES IT! Assist: Josh Smith
Score: 90-71

[05:20] Team_093 possession (Score: 90-71)
Lauri Parker attempts a 3Pt. Contested by RJ Carter (3.5 feet, ZONE). LAURI PARKER MAKES IT! Assist: Kobe Murray
Score: 90-74

[05:03] Team_030 possession (Score: 90-74)
RJ Carter attempts a Midrange. Contested by Shaquille George (3.6 feet, MAN). RJ Carter misses. Rebound secured by Kobe Murray.

[04:47] Team_093 possession (Score: 90-74)
Lauri Parker attempts a 3Pt. Wide open! Josh Smith is 7.8 feet away. [ZONE] Lauri Parker misses. Rebound secured by Franz Anunoby.

[04:33] Team_030 possession (Score: 90-74)
FOUL! Reach-in foul on Kobe Murray during the drive. [Team fouls: 4] No free throws, side out. (Kobe Murray: 1 personal fouls)

[04:19] Team_030 possession (Score: 90-74)
Franz Anunoby attempts a Layup. Contested by Kobe Murray (5.7 feet, MAN). Franz Anunoby misses. Offensive rebound by Pau James! Pau James kicks it out.

[04:07] Team_030 possession (Score: 90-74)
Pau James attempts a 3Pt. Contested by Lauri Parker (4.5 feet, MAN). PAU JAMES MAKES IT! Assist: Franz Anunoby
Score: 93-74

[03:53] Team_093 possession (Score: 93-74)
Kobe Murray attempts a Midrange. Contested by Damian Green (5.8 feet, MAN). KOBE MURRAY MAKES IT! Assist: Shaquille George
Score: 93-76

[03:36] Team_030 possession (Score: 93-76)
Franz Anunoby drives to the basket... Franz Anunoby loses the ball! Stripped by Kobe Murray! TURNOVER! (live ball)

[03:22] Team_093 possession (Score: 93-76)
Cade O'Neal makes the Layup and draws the foul on Franz Anunoby! And-1! Cade O'Neal to the line for 1. [Team fouls: 2] (Franz Anunoby: 1 personal fouls)   FT 1/1: GOOD Cade O'Neal makes 1/1 from the line.
Score: 93-79

[03:09] Team_030 possession (Score: 93-79)
Franz Anunoby attempts a Midrange. BLOCKED BY KOBE MURRAY! Ball is loose! Offensive rebound by Damian Green! Damian Green kicks it out.

[02:57] Team_030 possession (Score: 93-79)
Franz Anunoby attempts a Layup. Contested by Kobe Murray (3.1 feet, MAN). FRANZ ANUNOBY MAKES IT! Assist: Josh Smith
Score: 95-79

[02:45] Team_093 possession (Score: 95-79)
Shaquille George throws a bad pass! Stolen by RJ Carter! TURNOVER! (live ball)

[02:33] Team_030 possession (Score: 95-79)
RJ Carter attempts a 3Pt. Contested by Shaquille George (3.2 feet, ZONE). RJ Carter misses. Rebound secured by Cade O'Neal.

[02:18] Team_093 possession (Score: 95-79)
Cade O'Neal drives, Damian Green stays with him. Cade O'Neal attempts a Layup. Contested by Damian Green (2.8 feet, ZONE). CADE O'NEAL MAKES IT!
Score: 95-81

[02:00] Team_030 possession (Score: 95-81)
Josh Smith attempts a Layup. Contested by Immanuel Cunningham (3.6 feet, MAN). JOSH SMITH MAKES IT! Assist: Franz Anunoby
Score: 97-81

[01:42] Team_093 possession (Score: 97-81)
Kobe Murray attempts a Midrange. Contested by Damian Green (4.9 feet, MAN). KOBE MURRAY MAKES IT!
Score: 97-83

[01:29] Team_030 possession (Score: 97-83)
RJ Carter attempts a Midrange. Contested by Lauri Parker (5.5 feet, ZONE). RJ CARTER MAKES IT!
Score: 99-83

[01:15] Team_093 possession (Score: 99-83)
Kobe Murray attempts a Midrange. Contested by Damian Green (5.5 feet, ZONE). Kobe Murray misses. Offensive rebound by Kobe Murray! Kobe Murray puts it back in!
Score: 99-85

[01:01] Team_030 possession (Score: 99-85)
RJ Carter drives to the basket... FOUL! Offensive foul on RJ Carter! Kobe Murray drew the charge! [Team fouls: 3] (RJ Carter: 1 personal fouls) TURNOVER! (dead ball)

[00:46] Team_093 possession (Score: 99-85)
Shaquille George attempts a 3Pt. Contested by RJ Carter (5.6 feet, ZONE). SHAQUILLE GEORGE MAKES IT! Assist: Lauri Parker
Score: 99-88

[00:27] Team_030 possession (Score: 99-88)
Damian Green attempts a Midrange. Contested by Kobe Murray (5.7 feet, MAN). DAMIAN GREEN MAKES IT!
Score: 101-88

[00:10] Team_093 possession (Score: 101-88)
Lauri Parker attempts a Midrange. Wide open! Pau James is 6.2 feet away. [MAN] LAURI PARKER MAKES IT!
Score: 101-90

================================================================================
                              4TH QUARTER COMPLETE                              
================================================================================

4TH QUARTER SCORE: Team_030 33, Team_093 33

BOX SCORE:
================================================================================

Team_030
--------------------------------------------------------------------------------
Player                MIN  PTS  REB  AST  TO      FG   FG%      3P   3P%
--------------------------------------------------------------------------------
Tyler Beal             31    6    0    0   0   2/3    66.7     0/0   0.0
Joel Anunoby           31    5    2    3   0   2/3    66.7     0/0   0.0
Tim Barrett            31    5    0    0   0   2/3    66.7     0/0   0.0
Damian Green           17    4    1    0   0   2/2   100.0     0/0   0.0
Pau James              17    3    1    0   0   1/1   100.0     0/0   0.0
Jordan Nowitzki        31    2    1    2   0   1/2    50.0     0/0   0.0
Jaren Green            31    2    3    0   0   1/1   100.0     0/0   0.0
Josh Smith             17    2    0    2   0   1/1   100.0     0/0   0.0
RJ Carter              17    2    0    0   0   1/3    33.3     0/0   0.0
Franz Anunoby          17    2    1    2   0   1/1   100.0     0/0   0.0

TEAM: FG: 14/20 (70.0%), 3PT: 4/7 (57.1%), REB: 9 (4 off, 5 def), AST: 9, TO: 2
TEAM FOULS: 3


Team_093
--------------------------------------------------------------------------------
Player                MIN  PTS  REB  AST  TO      FG   FG%      3P   3P%
--------------------------------------------------------------------------------
Kobe Murray            17    6    2    1   0   3/3   100.0     0/0   0.0
Carmelo Wagner         28    5    1    0   0   2/2   100.0     0/0   0.0
Lauri Parker           20    5    0    1   0   2/3    66.7     0/0   0.0
Cade O'Neal            20    5    1    0   0   2/2   100.0     0/0   0.0
Vince Barnes           31    3    2    0   0   1/2    50.0     0/0   0.0
Shaquille George       20    3    0    1   0   1/1   100.0     0/0   0.0
Trae Westbrook         31    2    0    0   0   1/1   100.0     0/0   0.0
Ben Cunningham         28    2    1    1   0   1/3    33.3     0/0   0.0
Damian Williamson      28    2    0    1   0   1/2    50.0     0/0   0.0

TEAM: FG: 14/19 (73.7%), 3PT: 3/5 (60.0%), REB: 7 (1 off, 6 def), AST: 5, TO: 3
TEAM FOULS: 4

================================================================================

================================================================================
                               FULL GAME COMPLETE                               
================================================================================

FINAL SCORE: Team_030 101, Team_093 90

SCORING BY QUARTER:
--------------------------------------------------------------------------------
Team                     Q1     Q2     Q3     Q4    FINAL
--------------------------------------------------------------------------------
Team_030                 29     23     16     33      101
Team_093                 14     18     25     33       90
--------------------------------------------------------------------------------

FULL GAME BOX SCORE:
================================================================================

Team_030
--------------------------------------------------------------------------------
Player                MIN  PTS  REB  AST  TO      FG   FG%      3P   3P%      FT STL BLK
--------------------------------------------------------------------------------
Tyler Beal             31   17    0    3   2   7/11   63.6   2/4    50.0   1/1     1   1
Tim Barrett            31   15    0    0   1   5/11   45.5   4/7    57.1   0/0     0   0
Joel Anunoby           31   10   13    3   0   4/9    44.4   1/5    20.0   1/1     1   0
Jordan Nowitzki        31   14   10    5   4   6/12   50.0   0/3     0.0   1/1     0   0
Jaren Green            31    9   10    1   0   5/7    71.4   0/0     0.0   1/1     0   0
RJ Carter              17   12    0    1   4   5/9    55.6   1/4    25.0   1/1     2   0
Josh Smith             17    8    0    3   0   4/4   100.0   0/0     0.0   0/0     1   1
Pau James              17    3    8    3   1   2/2   100.0   1/1   100.0   0/0     0   0
Damian Green           17    6    3    2   1   3/5    60.0   0/2     0.0   0/0     0   1
Franz Anunoby          17    7    4    2   0   2/3    66.7   0/0     0.0   1/1     1   0

TEAM: FG: 43/73 (58.9%), 3PT: 9/26 (34.6%), REB: 47 (15 off, 32 def), AST: 23, TO: 13


Team_093
--------------------------------------------------------------------------------
Player                MIN  PTS  REB  AST  TO      FG   FG%      3P   3P%      FT STL BLK
--------------------------------------------------------------------------------
Trae Westbrook         31   12    0    1   2   4/7    57.1   1/3    33.3   3/3     1   0
Vince Barnes           31    6    8    0   1   2/7    28.6   1/1   100.0   3/4     1   0
Damian Williamson      28    7    0    3   2   4/8    50.0   0/3     0.0   4/7     0   2
Carmelo Wagner         28   19   11    1   1   7/11   63.6   3/5    60.0   2/2     0   0
Ben Cunningham         28    8    7    3   2   4/10   40.0   0/2     0.0   2/2     0   1
Shaquille George       20    3    0    2   1   1/5    20.0   1/5    20.0   0/0     0   0
Lauri Parker           20   10    2    2   0   4/6    66.7   2/3    66.7   0/0     0   0
Cade O'Neal            20    5    6    1   1   2/4    50.0   0/0     0.0   1/1     1   0
Immanuel Cunningham    17    9    0    1   3   4/6    66.7   0/0     0.0   1/1     0   0
Kobe Murray            17   10    3    3   0   5/7    71.4   0/1     0.0   2/2     1   1

TEAM: FG: 39/73 (53.4%), 3PT: 8/23 (34.8%), REB: 38 (9 off, 29 def), AST: 17, TO: 13

================================================================================
