================================================================================
                        FULL GAME - Team_059 vs Team_008                        
================================================================================

================================================================================
                       1ST QUARTER - Team_059 vs Team_008                       
================================================================================

[12:00] Team_059 possession (Score: 0-0)
Jarrett Smith attempts a Layup. Contested by Magic Young (2.3 feet, MAN). JARRETT SMITH MAKES IT! Assist: John Iverson
Score: 2-0

[11:48] Team_008 possession (Score: 2-0)
Khris Hyland attempts a 3Pt. Wide open! Bam Wade is 7.7 feet away. [ZONE] Khris Hyland misses. Rebound secured by Bam Wade.

[11:34] Team_059 possession (Score: 2-0)
Blake Tatum attempts a 3Pt. Contested by Victor Leonard (5.8 feet, ZONE). BLAKE TATUM MAKES IT! Assist: Nikola Jokic
Score: 5-0

[11:20] Team_008 possession (Score: 5-0)
Magic Young attempts a Midrange. Contested by Jarrett Smith (2.4 feet, MAN). Magic Young misses. Rebound secured by Bam Wade.

[11:05] Team_059 possession (Score: 5-0)
Bam Wade drives, Magic Young stays with him. Bam Wade attempts a Dunk. Contested by Magic Young (3.1 feet, ZONE). BAM WADE MAKES IT! Assist: John Iverson
Score: 7-0

[10:50] Team_008 possession (Score: 7-0)
Khris Hyland attempts a Midrange. Contested by John Iverson (5.4 feet, MAN). KHRIS HYLAND MAKES IT!
Score: 7-2

[10:37] Team_059 possession (Score: 7-2)
Blake Tatum attempts a 3Pt. Wide open! Victor Leonard is 8.2 feet away. [ZONE] BLAKE TATUM MAKES IT! Assist: Bam Wade
Score: 10-2

[10:23] Team_008 possession (Score: 10-2)
Tyrese Thompson attempts a 3Pt. Contested by Bam Wade (4.7 feet, ZONE). Tyrese Thompson misses. Rebound secured by Bam Wade.

[10:07] Team_059 possession (Score: 10-2)
John Iverson loses control! Ball rolls out of bounds! TURNOVER! (dead ball)

[09:52] Team_008 possession (Score: 10-2)
Khris Hyland drives and kicks out. Victor Leonard attempts a Midrange. Contested by Blake Tatum (5.4 feet, ZONE). VICTOR LEONARD MAKES IT!
Score: 10-4

[09:38] Team_059 possession (Score: 10-4)
John Iverson makes the Layup and draws the foul on Tyrese Thompson! And-1! John Iverson to the line for 1. [Team fouls: 1] (Tyrese Thompson: 1 personal fouls)   FT 1/1: GOOD John Iverson makes 1/1 from the line.
Score: 13-4

[09:22] Team_008 possession (Score: 13-4)
FOUL! Reach-in foul on Bam Wade during the drive. [Team fouls: 1] No free throws, side out. (Bam Wade: 1 personal fouls)

[09:04] Team_008 possession (Score: 13-4)
Khris Hyland attempts a 3Pt. Contested by Bam Wade (4.0 feet, ZONE). Khris Hyland misses. Rebound secured by John Iverson.

[08:49] Team_059 possession (Score: 13-4)
John Iverson attempts a Midrange. Contested by Khris Hyland (2.2 feet, MAN). JOHN IVERSON MAKES IT! Assist: Bam Wade
Score: 15-4

[08:38] Team_008 possession (Score: 15-4)
Jrue Harris makes the Layup and draws the foul on Bam Wade! And-1! Jrue Harris to the line for 1. [Team fouls: 2] (Bam Wade: 2 personal fouls)   FT 1/1: GOOD Jrue Harris makes 1/1 from the line.
Score: 15-7

[08:24] Team_059 possession (Score: 15-7)
Bam Wade drives, picks up Victor Leonard. Help arrives from Jrue Harris! Bam Wade attempts a Layup. Contested by Jrue Harris (2.9 feet, MAN). BAM WADE MAKES IT!
Score: 17-7

[08:10] Team_008 possession (Score: 17-7)
Victor Leonard attempts a 3Pt. Contested by Bam Wade (4.0 feet, MAN). Victor Leonard misses. Rebound secured by Jarrett Smith.

[08:00] Team_059 possession (Score: 17-7)
Bam Wade attempts a Midrange. Contested by Tyrese Thompson (5.7 feet, ZONE). BAM WADE MAKES IT! Assist: Blake Tatum
Score: 19-7

[07:43] Team_008 possession (Score: 19-7)
Magic Young throws a bad pass! Stolen by Jarrett Smith! TURNOVER! (live ball)

[07:25] Team_059 possession (Score: 19-7)
John Iverson makes the Layup and draws the foul on Khris Hyland! And-1! John Iverson to the line for 1. [Team fouls: 2] (Khris Hyland: 1 personal fouls)   FT 1/1: GOOD John Iverson makes 1/1 from the line.
Score: 22-7

[07:10] Team_008 possession (Score: 22-7)
Jrue Harris drives and kicks out. Khris Hyland attempts a 3Pt. Contested by John Iverson (4.8 feet, MAN). Khris Hyland misses. Rebound secured by Jarrett Smith.

[06:55] Team_059 possession (Score: 22-7)
John Iverson drives, Tyrese Thompson stays with him. John Iverson attempts a Layup. Wide open! Tyrese Thompson is 6.1 feet away. [ZONE] JOHN IVERSON MAKES IT!
Score: 24-7

[06:36] Team_008 possession (Score: 24-7)
Jrue Harris attempts a Layup. BLOCKED BY BLAKE TATUM! Ball deflects out of bounds off Jrue Harris.

[06:21] Team_059 possession (Score: 24-7)
Bam Wade drives to the basket... FOUL! Offensive foul on Bam Wade! Victor Leonard drew the charge! [Team fouls: 3] (Bam Wade: 3 personal fouls) TURNOVER! (dead ball)

[06:06] Team_008 possession (Score: 24-7)
Tyrese Thompson attempts a 3Pt. Heavily contested by Bam Wade (1.8 feet, ZONE)! TYRESE THOMPSON MAKES IT! Assist: Victor Leonard
Score: 24-10

[05:48] Team_059 possession (Score: 24-10)
Jarrett Smith attempts a Midrange. Contested by Tyrese Thompson (5.7 feet, ZONE). JARRETT SMITH MAKES IT!
Score: 26-10

[05:34] Team_008 possession (Score: 26-10)
FOUL! Shooting foul on Bam Wade. Victor Leonard to the line for 3 free throws. [Team fouls: 4] (Bam Wade: 4 personal fouls)   FT 1/3: GOOD   FT 2/3: GOOD   FT 3/3: GOOD Victor Leonard makes 3/3 from the line.
Score: 26-13

[05:21] Team_059 possession (Score: 26-13)
John Iverson attempts a Layup. Heavily contested by Khris Hyland (0.5 feet, MAN)! John Iverson misses. Rebound secured by Tyrese Thompson.

[05:09] Team_008 possession (Score: 26-13)
Khris Hyland drives and kicks out. Tyrese Thompson attempts a 3Pt. Wide open! Nikola Jokic is 6.9 feet away. [MAN] TYRESE THOMPSON MAKES IT! Assist: Jrue Harris
Score: 26-16

[04:56] Team_059 possession (Score: 26-16)
Jarrett Smith attempts a Layup. Wide open! Magic Young is 7.3 feet away. [MAN] JARRETT SMITH MAKES IT!
Score: 28-16

[04:42] Team_008 possession (Score: 28-16)
Tyrese Thompson makes the Layup and draws the foul on Jarrett Smith! And-1! Tyrese Thompson to the line for 1. [BONUS: 5 team fouls] (Jarrett Smith: 1 personal fouls)   FT 1/1: GOOD Tyrese Thompson makes 1/1 from the line.
Score: 28-19

[04:25] Team_059 possession (Score: 28-19)
Jarrett Smith throws a bad pass out of bounds! TURNOVER! (dead ball)

[04:10] Team_008 possession (Score: 28-19)
Magic Young drives and kicks out. Tyrese Thompson attempts a 3Pt. Contested by Nikola Jokic (4.7 feet, MAN). Tyrese Thompson misses. Rebound secured by Jarrett Smith.

[03:58] Team_059 possession (Score: 28-19)
Bam Wade drives and kicks out. Blake Tatum attempts a 3Pt. Wide open! Victor Leonard is 8.5 feet away. [ZONE] BLAKE TATUM MAKES IT! Assist: Jarrett Smith
Score: 31-19

[03:43] Team_008 possession (Score: 31-19)
Khris Hyland attempts a 3Pt. Wide open! John Iverson is 7.0 feet away. [MAN] KHRIS HYLAND MAKES IT! Assist: Jrue Harris
Score: 31-22

[03:26] Team_059 possession (Score: 31-22)
Nikola Jokic attempts a 3Pt. Contested by Victor Leonard (2.4 feet, ZONE). Nikola Jokic misses. Rebound secured by Magic Young.

[03:13] Team_008 possession (Score: 31-22)
Tyrese Thompson drives to the basket... Tyrese Thompson throws a bad pass out of bounds! TURNOVER! (dead ball)

[03:13] Substitution (Team_059): John Iverson OUT → Allen Giddey IN (stamina_rule2)

[03:13] Substitution (Team_008): Tyrese Thompson OUT → Khris Giddey IN (stamina_rule2)

[03:01] Team_059 possession (Score: 31-22)
Nikola Jokic attempts a Layup. BLOCKED BY KHRIS GIDDEY! Ball is loose! Rebound secured by Khris Giddey.

[02:46] Team_008 possession (Score: 31-22)
Jrue Harris attempts a 3Pt. Contested by Blake Tatum (4.0 feet, MAN). JRUE HARRIS MAKES IT! Assist: Khris Hyland
Score: 31-25

[02:30] Team_059 possession (Score: 31-25)
FOUL! Shooting foul on Jrue Harris. Allen Giddey to the line for 2 free throws. [Team fouls: 3] (Jrue Harris: 1 personal fouls)   FT 1/2: GOOD   FT 2/2: MISS Allen Giddey makes 1/2 from the line. Rebound secured by Khris Hyland.
Score: 32-25

[02:16] Team_008 possession (Score: 32-25)
Khris Giddey attempts a Midrange. Contested by Nikola Jokic (5.7 feet, ZONE). KHRIS GIDDEY MAKES IT! Assist: Magic Young
Score: 32-27

[02:02] Team_059 possession (Score: 32-27)
Bam Wade attempts a 3Pt. Contested by Victor Leonard (4.7 feet, MAN). Bam Wade misses. Rebound secured by Khris Giddey.

[01:47] Team_008 possession (Score: 32-27)
Jrue Harris attempts a 3Pt. Contested by Bam Wade (2.6 feet, ZONE). Jrue Harris misses. Rebound secured by Bam Wade.

[01:31] Team_059 possession (Score: 32-27)
Bam Wade drives to the basket... Bam Wade throws a bad pass out of bounds! TURNOVER! (dead ball)

[01:31] Substitution (Team_059): Bam Wade OUT → Russell Quickley IN (stamina_rule2)

[01:31] Substitution (Team_059): Blake Tatum OUT → Scottie Ginobili IN (stamina_rule2)

[01:31] Substitution (Team_059): Nikola Jokic OUT → Bones Middleton IN (stamina_rule2)

[01:31] Substitution (Team_059): Jarrett Smith OUT → LeBron Lowry IN (stamina_rule2)

[01:31] Substitution (Team_008): Victor Leonard OUT → Blake Holiday IN (stamina_rule2)

[01:31] Substitution (Team_008): Jrue Harris OUT → Chris Griffin IN (stamina_rule2)

[01:31] Substitution (Team_008): Khris Hyland OUT → Immanuel Young IN (stamina_rule2)

[01:31] Substitution (Team_008): Magic Young OUT → Lamelo Middleton IN (stamina_rule2)

[01:15] Team_008 possession (Score: 32-27)
FOUL! Holding foul on Allen Giddey. [IN THE BONUS! 6 team fouls] Immanuel Young to the line for 2 free throws. (Allen Giddey: 1 personal fouls)   FT 1/2: GOOD   FT 2/2: GOOD Immanuel Young makes 2/2 from the line.
Score: 32-29

[00:58] Team_059 possession (Score: 32-29)
Russell Quickley drives to the basket... Russell Quickley loses the ball! Stripped by Lamelo Middleton! TURNOVER! (live ball)

[00:43] Team_008 possession (Score: 32-29)
FOUL! Reach-in foul on Allen Giddey during the drive. [IN THE BONUS! 7 team fouls] Immanuel Young to the line for 2 free throws. (Allen Giddey: 2 personal fouls)   FT 1/2: GOOD   FT 2/2: MISS Immanuel Young makes 1/2 from the line. Rebound secured by Scottie Ginobili.
Score: 32-30

[00:27] Team_059 possession (Score: 32-30)
LeBron Lowry attempts a Midrange. Wide open! Immanuel Young is 6.1 feet away. [ZONE] LeBron Lowry misses. Offensive rebound by Scottie Ginobili! Scottie Ginobili kicks it out.

[00:12] Team_059 possession (Score: 32-30)
Scottie Ginobili attempts a Midrange. Contested by Chris Griffin (4.0 feet, MAN). SCOTTIE GINOBILI MAKES IT! Assist: Bones Middleton
Score: 34-30

================================================================================
                              1ST QUARTER COMPLETE                              
================================================================================

1ST QUARTER SCORE: Team_059 34, Team_008 30

BOX SCORE:
================================================================================

Team_059
--------------------------------------------------------------------------------
Player                MIN  PTS  REB  AST  TO      FG   FG%      3P   3P%
--------------------------------------------------------------------------------
John Iverson            9   10    1    2   0   4/5    80.0     0/0   0.0
Blake Tatum            11    9    0    1   0   3/3   100.0     0/0   0.0
Jarrett Smith          11    6    3    1   0   3/3   100.0     0/0   0.0
Bam Wade               11    6    4    2   0   3/4    75.0     0/0   0.0
Scottie Ginobili        1    2    2    0   0   1/1   100.0     0/0   0.0
Nikola Jokic           11    0    0    1   0   0/2     0.0     0/0   0.0
Allen Giddey            3    0    0    0   0   0/1     0.0     0/0   0.0
Bones Middleton         1    0    0    1   0   0/0     0.0     0/0   0.0

TEAM: FG: 14/19 (73.7%), 3PT: 2/4 (50.0%), REB: 10 (1 off, 9 def), AST: 8, TO: 5
TEAM FOULS: 7 [Team_008 in BONUS]


Team_008
--------------------------------------------------------------------------------
Player                MIN  PTS  REB  AST  TO      FG   FG%      3P   3P%
--------------------------------------------------------------------------------
Tyrese Thompson         9    9    1    0   0   3/4    75.0     0/0   0.0
Jrue Harris            11    6    0    2   0   2/5    40.0     0/0   0.0
Khris Hyland           11    5    1    1   0   2/4    50.0     0/0   0.0
Victor Leonard         11    5    0    1   0   2/3    66.7     0/0   0.0
Khris Giddey            3    2    2    0   0   1/1   100.0     0/0   0.0
Immanuel Young          1    2    0    0   0   1/2    50.0     0/0   0.0
Magic Young            11    0    1    1   0   0/2     0.0     0/0   0.0

TEAM: FG: 11/21 (52.4%), 3PT: 4/9 (44.4%), REB: 5 (0 off, 5 def), AST: 5, TO: 2
TEAM FOULS: 3

================================================================================

================================================================================
                       2ND QUARTER - Team_059 vs Team_008                       
================================================================================

[12:00] Team_059 possession (Score: 34-30)
John Iverson attempts a 3Pt. Contested by Victor Leonard (5.9 feet, ZONE). John Iverson misses. Rebound secured by Tyrese Thompson.

[11:45] Team_008 possession (Score: 34-30)
FOUL! Shooting foul on Bam Wade. Khris Hyland to the line for 2 free throws. [Team fouls: 1] (Bam Wade: 1 personal fouls)   FT 1/2: GOOD   FT 2/2: GOOD Khris Hyland makes 2/2 from the line.
Score: 34-32

[11:32] Team_059 possession (Score: 34-32)
Jarrett Smith attempts a Layup. Contested by Tyrese Thompson (3.6 feet, ZONE). JARRETT SMITH MAKES IT! Assist: Nikola Jokic
Score: 36-32

[11:21] Team_008 possession (Score: 36-32)
Victor Leonard drives and kicks out. Tyrese Thompson attempts a 3Pt. Contested by Bam Wade (2.8 feet, ZONE). Tyrese Thompson misses. Rebound secured by John Iverson.

[11:07] Team_059 possession (Score: 36-32)
Jarrett Smith attempts a Layup. Contested by Magic Young (5.7 feet, MAN). Jarrett Smith misses. Offensive rebound by John Iverson! John Iverson kicks it out.

[10:53] Team_059 possession (Score: 36-32)
John Iverson attempts a 3Pt. Wide open! Victor Leonard is 6.6 feet away. [ZONE] John Iverson misses. Rebound secured by Tyrese Thompson.

[10:41] Team_008 possession (Score: 36-32)
Jrue Harris drives and kicks out. Victor Leonard attempts a 3Pt. Heavily contested by Bam Wade (1.9 feet, ZONE)! Victor Leonard misses. Rebound secured by Bam Wade.

[10:29] Team_059 possession (Score: 36-32)
Bam Wade attempts a 3Pt. Wide open! Victor Leonard is 6.8 feet away. [ZONE] Bam Wade misses. Rebound secured by Khris Hyland.

[10:14] Team_008 possession (Score: 36-32)
Victor Leonard attempts a Midrange. Contested by Blake Tatum (5.5 feet, ZONE). VICTOR LEONARD MAKES IT! Assist: Jrue Harris
Score: 36-34

[10:01] Team_059 possession (Score: 36-34)
John Iverson attempts a Midrange. Wide open! Khris Hyland is 6.3 feet away. [MAN] John Iverson misses. Rebound secured by Khris Hyland.

[09:47] Team_008 possession (Score: 36-34)
Victor Leonard drives and kicks out. Magic Young attempts a Midrange. Heavily contested by Jarrett Smith (1.6 feet, MAN)! Magic Young misses. Rebound secured by John Iverson.

[09:35] Team_059 possession (Score: 36-34)
Bam Wade attempts a 3Pt. Wide open! Victor Leonard is 6.7 feet away. [ZONE] BAM WADE MAKES IT! Assist: Blake Tatum
Score: 39-34

[09:18] Team_008 possession (Score: 39-34)
Magic Young drives, picks up Jarrett Smith. Help arrives from Bam Wade! Magic Young attempts a Dunk. Contested by Bam Wade (3.4 feet, MAN). MAGIC YOUNG MAKES IT!
Score: 39-36

[09:01] Team_059 possession (Score: 39-36)
Jarrett Smith attempts a Layup. Wide open! Magic Young is 6.9 feet away. [MAN] JARRETT SMITH MAKES IT!
Score: 41-36

[08:44] Team_008 possession (Score: 41-36)
Tyrese Thompson attempts a 3Pt. Wide open! Nikola Jokic is 7.1 feet away. [MAN] TYRESE THOMPSON MAKES IT! Assist: Jrue Harris
Score: 41-39

[08:30] Team_059 possession (Score: 41-39)
Jarrett Smith attempts a Midrange. Wide open! Magic Young is 6.5 feet away. [MAN] JARRETT SMITH MAKES IT! Assist: John Iverson
Score: 43-39

[08:14] Team_008 possession (Score: 43-39)
Jrue Harris attempts a 3Pt. Contested by Blake Tatum (3.5 feet, MAN). JRUE HARRIS MAKES IT! Assist: Victor Leonard
Score: 43-42

[07:58] Team_059 possession (Score: 43-42)
Blake Tatum attempts a 3Pt. Wide open! Victor Leonard is 6.3 feet away. [ZONE] Blake Tatum misses. Rebound secured by Magic Young.

[07:44] Team_008 possession (Score: 43-42)
FOUL! Shooting foul on Jarrett Smith. Victor Leonard to the line for 2 free throws. [Team fouls: 2] (Jarrett Smith: 1 personal fouls)   FT 1/2: GOOD   FT 2/2: GOOD Victor Leonard makes 2/2 from the line.
Score: 43-44

[07:32] Team_059 possession (Score: 43-44)
FOUL! Holding foul on Victor Leonard. [Team fouls: 1] No free throws, side out. (Victor Leonard: 1 personal fouls)

[07:22] Team_059 possession (Score: 43-44)
Bam Wade makes the Layup and draws the foul on Victor Leonard! And-1! Bam Wade to the line for 1. [Team fouls: 2] (Victor Leonard: 2 personal fouls)   FT 1/1: GOOD Bam Wade makes 1/1 from the line.
Score: 46-44

[07:08] Team_008 possession (Score: 46-44)
Victor Leonard drives and kicks out. Jrue Harris makes the Midrange and draws the foul on Blake Tatum! And-1! Jrue Harris to the line for 1. [Team fouls: 3] (Blake Tatum: 1 personal fouls)   FT 1/1: GOOD Jrue Harris makes 1/1 from the line.
Score: 46-47

[06:53] Team_059 possession (Score: 46-47)
Bam Wade attempts a 3Pt. Contested by Victor Leonard (3.3 feet, MAN). Bam Wade misses. FOUL! Loose ball foul on Khris Hyland during the rebound battle. [Team fouls: 3] No free throws, side out. (Khris Hyland: 1 personal fouls)

[06:34] Team_059 possession (Score: 46-47)
Jarrett Smith drives and kicks out. Jarrett Smith attempts a 3Pt. Wide open! Magic Young is 7.0 feet away. [MAN] Jarrett Smith misses. Rebound secured by Magic Young.

[06:20] Team_008 possession (Score: 46-47)
FOUL! Reach-in foul on Nikola Jokic during the drive. [Team fouls: 4] No free throws, side out. (Nikola Jokic: 1 personal fouls)

[06:04] Team_008 possession (Score: 46-47)
Magic Young commits a violation (traveling/carry)! TURNOVER! (dead ball)

[06:04] Substitution (Team_059): Bam Wade OUT → Russell Quickley IN (stamina_rule2)

[06:04] Substitution (Team_059): Blake Tatum OUT → Scottie Ginobili IN (stamina_rule2)

[06:04] Substitution (Team_059): John Iverson OUT → Allen Giddey IN (stamina_rule2)

[06:04] Substitution (Team_059): Nikola Jokic OUT → Bones Middleton IN (stamina_rule2)

[06:04] Substitution (Team_059): Jarrett Smith OUT → LeBron Lowry IN (stamina_rule2)

[06:04] Substitution (Team_008): Victor Leonard OUT → Blake Holiday IN (stamina_rule2)

[06:04] Substitution (Team_008): Jrue Harris OUT → Chris Griffin IN (stamina_rule2)

[06:04] Substitution (Team_008): Khris Hyland OUT → Immanuel Young IN (stamina_rule2)

[06:04] Substitution (Team_008): Tyrese Thompson OUT → Khris Giddey IN (stamina_rule2)

[06:04] Substitution (Team_008): Magic Young OUT → Lamelo Middleton IN (stamina_rule2)

[05:49] Team_059 possession (Score: 46-47)
Bones Middleton drives, Khris Giddey stays with him. Bones Middleton attempts a Layup. Contested by Khris Giddey (4.8 feet, MAN). Bones Middleton misses. Rebound secured by Lamelo Middleton.

[05:31] Team_008 possession (Score: 46-47)
Blake Holiday attempts a 3Pt. Contested by Russell Quickley (4.4 feet, ZONE). Blake Holiday misses. Rebound secured by Scottie Ginobili.

[05:17] Team_059 possession (Score: 46-47)
LeBron Lowry attempts a Midrange. Wide open! Lamelo Middleton is 6.5 feet away. [MAN] LeBron Lowry misses. Rebound secured by Khris Giddey.

[05:03] Team_008 possession (Score: 46-47)
Immanuel Young attempts a Layup. Heavily contested by Bones Middleton (0.5 feet, ZONE)! IMMANUEL YOUNG MAKES IT! Assist: Blake Holiday
Score: 46-49

[04:49] Team_059 possession (Score: 46-49)
FOUL! Shooting foul on Chris Griffin. LeBron Lowry to the line for 2 free throws. [Team fouls: 4] (Chris Griffin: 1 personal fouls)   FT 1/2: GOOD   FT 2/2: GOOD LeBron Lowry makes 2/2 from the line.
Score: 48-49

[04:37] Team_008 possession (Score: 48-49)
Khris Giddey attempts a Midrange. Wide open! Scottie Ginobili is 7.4 feet away. [ZONE] KHRIS GIDDEY MAKES IT!
Score: 48-51

[04:23] Team_059 possession (Score: 48-51)
Russell Quickley attempts a Midrange. Contested by Immanuel Young (3.6 feet, ZONE). Russell Quickley misses. Offensive rebound by Bones Middleton! Bones Middleton kicks it out.

[04:07] Team_059 possession (Score: 48-51)
Allen Giddey attempts a 3Pt. Heavily contested by Khris Giddey (1.9 feet, ZONE)! Allen Giddey misses. Offensive rebound by Scottie Ginobili! Scottie Ginobili kicks it out.

[03:56] Team_059 possession (Score: 48-51)
Bones Middleton attempts a 3Pt. Contested by Khris Giddey (5.7 feet, ZONE). Bones Middleton misses. Rebound secured by Chris Griffin.

[03:38] Team_008 possession (Score: 48-51)
Lamelo Middleton attempts a 3Pt. Contested by LeBron Lowry (2.4 feet, MAN). Lamelo Middleton misses. Rebound secured by Bones Middleton.

[03:24] Team_059 possession (Score: 48-51)
Allen Giddey drives to the basket... Allen Giddey loses control! Ball rolls out of bounds! TURNOVER! (dead ball)

[03:14] Team_008 possession (Score: 48-51)
Khris Giddey attempts a Midrange. Contested by Bones Middleton (3.4 feet, MAN). Khris Giddey misses. Offensive rebound by Khris Giddey! Khris Giddey kicks it out.

[03:01] Team_008 possession (Score: 48-51)
Immanuel Young drives and kicks out. Chris Griffin attempts a 3Pt. Wide open! Scottie Ginobili is 6.3 feet away. [MAN] CHRIS GRIFFIN MAKES IT! Assist: Blake Holiday
Score: 48-54

[02:46] Team_059 possession (Score: 48-54)
Allen Giddey attempts a 3Pt. Contested by Blake Holiday (5.6 feet, ZONE). Allen Giddey misses. Rebound secured by Khris Giddey.

[02:30] Team_008 possession (Score: 48-54)
Lamelo Middleton attempts a Layup. Heavily contested by LeBron Lowry (1.1 feet, MAN)! Lamelo Middleton misses. Offensive rebound by Lamelo Middleton! Lamelo Middleton puts it back in!
Score: 48-56

[02:17] Team_059 possession (Score: 48-56)
Bones Middleton attempts a 3Pt. Contested by Khris Giddey (3.7 feet, ZONE). Bones Middleton misses. Rebound secured by Khris Giddey.

[02:08] Team_008 possession (Score: 48-56)
Khris Giddey attempts a Layup. Wide open! Bones Middleton is 7.7 feet away. [ZONE] KHRIS GIDDEY MAKES IT! Assist: Lamelo Middleton
Score: 48-58

[01:54] Team_059 possession (Score: 48-58)
Russell Quickley drives and kicks out. Scottie Ginobili attempts a 3Pt. Contested by Chris Griffin (4.8 feet, MAN). Scottie Ginobili misses. Rebound secured by Khris Giddey.

[01:43] Team_008 possession (Score: 48-58)
Immanuel Young attempts a 3Pt. Contested by Russell Quickley (4.4 feet, ZONE). Immanuel Young misses. Rebound secured by LeBron Lowry.

[01:29] Team_059 possession (Score: 48-58)
Russell Quickley attempts a Midrange. Wide open! Blake Holiday is 6.6 feet away. [MAN] RUSSELL QUICKLEY MAKES IT! Assist: Allen Giddey
Score: 50-58

[01:14] Team_008 possession (Score: 50-58)
Blake Holiday drives and kicks out. Khris Giddey attempts a 3Pt. Wide open! Russell Quickley is 7.7 feet away. [ZONE] Khris Giddey misses. Rebound secured by LeBron Lowry.

[00:55] Team_059 possession (Score: 50-58)
Allen Giddey attempts a 3Pt. Contested by Immanuel Young (3.3 feet, MAN). ALLEN GIDDEY MAKES IT! Assist: Scottie Ginobili
Score: 53-58

[00:39] Team_008 possession (Score: 53-58)
Lamelo Middleton attempts a Layup. Wide open! LeBron Lowry is 6.3 feet away. [MAN] Lamelo Middleton misses. Rebound secured by Bones Middleton.

[00:20] Team_059 possession (Score: 53-58)
FOUL! Holding foul on Khris Giddey. [IN THE BONUS! 5 team fouls] Bones Middleton to the line for 2 free throws. (Khris Giddey: 1 personal fouls)   FT 1/2: GOOD   FT 2/2: GOOD Bones Middleton makes 2/2 from the line.
Score: 55-58

[00:08] Team_008 possession (Score: 55-58)
Lamelo Middleton drives, Bones Middleton stays with him. Lamelo Middleton attempts a Dunk. Contested by Bones Middleton (4.1 feet, ZONE). Lamelo Middleton misses. Offensive rebound by Lamelo Middleton! Lamelo Middleton's putback is no good. Offensive rebound by Lamelo Middleton! Lamelo Middleton kicks it out.

================================================================================
                              2ND QUARTER COMPLETE                              
================================================================================

2ND QUARTER SCORE: Team_059 21, Team_008 28

BOX SCORE:
================================================================================

Team_059
--------------------------------------------------------------------------------
Player                MIN  PTS  REB  AST  TO      FG   FG%      3P   3P%
--------------------------------------------------------------------------------
Jarrett Smith          17    6    0    0   0   3/4    75.0     0/0   0.0
Bam Wade               17    6    1    0   0   2/3    66.7     0/0   0.0
Allen Giddey            9    3    0    1   0   1/2    50.0     0/0   0.0
Bones Middleton         7    2    3    0   0   1/4    25.0     0/0   0.0
LeBron Lowry            7    2    2    0   0   1/2    50.0     0/0   0.0
Russell Quickley        7    2    0    0   0   1/2    50.0     0/0   0.0
John Iverson           15    0    4    1   0   0/3     0.0     0/0   0.0
Nikola Jokic           17    0    0    1   0   0/0     0.0     0/0   0.0
Blake Tatum            17    0    0    1   0   0/1     0.0     0/0   0.0
Scottie Ginobili        7    0    2    1   0   0/0     0.0     0/0   0.0

TEAM: FG: 9/21 (42.9%), 3PT: 2/9 (22.2%), REB: 12 (4 off, 8 def), AST: 5, TO: 1
TEAM FOULS: 4


Team_008
--------------------------------------------------------------------------------
Player                MIN  PTS  REB  AST  TO      FG   FG%      3P   3P%
--------------------------------------------------------------------------------
Jrue Harris            17    6    0    2   0   2/3    66.7     0/0   0.0
Victor Leonard         17    4    0    1   0   2/4    50.0     0/0   0.0
Khris Giddey            9    4    5    0   0   2/2   100.0     0/0   0.0
Tyrese Thompson        15    3    2    0   0   1/1   100.0     0/0   0.0
Chris Griffin           7    3    1    0   0   1/1   100.0     0/0   0.0
Khris Hyland           17    2    2    0   0   1/1   100.0     0/0   0.0
Magic Young            17    2    2    0   0   1/1   100.0     0/0   0.0
Lamelo Middleton        7    2    3    1   0   1/3    33.3     0/0   0.0
Immanuel Young          7    2    0    0   0   1/2    50.0     0/0   0.0
Blake Holiday           7    0    0    2   0   0/2     0.0     0/0   0.0

TEAM: FG: 12/20 (60.0%), 3PT: 2/5 (40.0%), REB: 15 (3 off, 12 def), AST: 6, TO: 1
TEAM FOULS: 5 [Team_059 in BONUS]

================================================================================

================================================================================
                       3RD QUARTER - Team_059 vs Team_008                       
================================================================================

[12:00] Team_059 possession (Score: 55-58)
Blake Tatum attempts a 3Pt. Wide open! Victor Leonard is 7.0 feet away. [ZONE] Blake Tatum misses. Rebound secured by Khris Hyland.

[11:48] Team_008 possession (Score: 55-58)
Magic Young drives to the basket... Magic Young throws a bad pass! Stolen by Jarrett Smith! TURNOVER! (live ball)

[11:36] Team_059 possession (Score: 55-58)
Jarrett Smith attempts a Midrange. Wide open! Magic Young is 6.5 feet away. [MAN] JARRETT SMITH MAKES IT! Assist: Blake Tatum
Score: 57-58

[11:20] Team_008 possession (Score: 57-58)
Victor Leonard attempts a Midrange. Contested by Bam Wade (5.0 feet, MAN). Victor Leonard misses. FOUL! Loose ball foul on John Iverson during the rebound battle. [Team fouls: 1] No free throws, side out. (John Iverson: 1 personal fouls)

[11:09] Team_008 possession (Score: 57-58)
Jrue Harris attempts a 3Pt. Contested by Blake Tatum (2.8 feet, MAN). Jrue Harris misses. Rebound secured by Bam Wade.

[10:55] Team_059 possession (Score: 57-58)
Bam Wade attempts a 3Pt. Contested by Victor Leonard (3.8 feet, ZONE). Bam Wade misses. Rebound secured by Magic Young.

[10:41] Team_008 possession (Score: 57-58)
FOUL! Holding foul on Jarrett Smith. [Team fouls: 2] No free throws, side out. (Jarrett Smith: 1 personal fouls)

[10:27] Team_008 possession (Score: 57-58)
Tyrese Thompson attempts a 3Pt. Contested by Bam Wade (5.6 feet, ZONE). Tyrese Thompson misses. Rebound secured by Jarrett Smith.

[10:13] Team_059 possession (Score: 57-58)
Nikola Jokic attempts a 3Pt. Wide open! Victor Leonard is 7.0 feet away. [ZONE] Nikola Jokic misses. Rebound secured by Khris Hyland.

[10:00] Team_008 possession (Score: 57-58)
Victor Leonard attempts a 3Pt. Wide open! John Iverson is 7.6 feet away. [ZONE] Victor Leonard misses. Offensive rebound by Magic Young! Magic Young's putback is no good. Rebound secured by Bam Wade.

[09:48] Team_059 possession (Score: 57-58)
Jarrett Smith attempts a Midrange. Contested by Tyrese Thompson (5.5 feet, ZONE). JARRETT SMITH MAKES IT!
Score: 59-58

[09:35] Team_008 possession (Score: 59-58)
Khris Hyland attempts a Midrange. Contested by Nikola Jokic (4.6 feet, ZONE). KHRIS HYLAND MAKES IT!
Score: 59-60

[09:25] Team_059 possession (Score: 59-60)
Blake Tatum loses control! Ball rolls out of bounds! TURNOVER! (dead ball)

[09:14] Team_008 possession (Score: 59-60)
Victor Leonard drives, picks up Jarrett Smith. Help arrives from Bam Wade! Victor Leonard attempts a Layup. Heavily contested by Bam Wade (0.9 feet, ZONE)! VICTOR LEONARD MAKES IT!
Score: 59-62

[08:59] Team_059 possession (Score: 59-62)
Bam Wade attempts a 3Pt. Contested by Victor Leonard (4.1 feet, ZONE). Bam Wade misses. Rebound secured by Magic Young.

[08:40] Team_008 possession (Score: 59-62)
Magic Young attempts a Midrange. Wide open! Nikola Jokic is 6.0 feet away. [ZONE] Magic Young misses. Rebound secured by John Iverson.

[08:26] Team_059 possession (Score: 59-62)
Bam Wade attempts a 3Pt. Contested by Victor Leonard (2.4 feet, MAN). BAM WADE MAKES IT! Assist: Nikola Jokic
Score: 62-62

[08:10] Team_008 possession (Score: 62-62)
Magic Young drives to the basket... Magic Young loses control! Ball rolls out of bounds! TURNOVER! (dead ball)

[07:54] Team_059 possession (Score: 62-62)
John Iverson drives, Khris Hyland stays with him. John Iverson attempts a Layup. Contested by Khris Hyland (3.1 feet, MAN). John Iverson misses. Rebound secured by Tyrese Thompson.

[07:39] Team_008 possession (Score: 62-62)
Khris Hyland drives, John Iverson stays with him. Khris Hyland attempts a Layup. Wide open! John Iverson is 6.8 feet away. [MAN] Khris Hyland misses. Offensive rebound by Magic Young! Magic Young puts it back in!
Score: 62-64

[07:27] Team_059 possession (Score: 62-64)
John Iverson attempts a 3Pt. Contested by Khris Hyland (2.0 feet, MAN). John Iverson misses. Rebound secured by Khris Hyland.

[07:15] Team_008 possession (Score: 62-64)
Magic Young drives, picks up Jarrett Smith. Help arrives from Bam Wade! Magic Young attempts a Layup. Contested by Bam Wade (2.8 feet, MAN). MAGIC YOUNG MAKES IT! Assist: Tyrese Thompson
Score: 62-66

[06:57] Team_059 possession (Score: 62-66)
Bam Wade attempts a Layup. BLOCKED BY JRUE HARRIS! Ball goes out off Jrue Harris. Bam Wade's ball!

[06:43] Team_059 possession (Score: 62-66)
Bam Wade attempts a Midrange. Contested by Tyrese Thompson (5.9 feet, ZONE). BAM WADE MAKES IT!
Score: 64-66

[06:30] Team_008 possession (Score: 64-66)
Khris Hyland attempts a Midrange. Contested by John Iverson (5.3 feet, MAN). Khris Hyland misses. Rebound secured by John Iverson.

[06:15] Team_059 possession (Score: 64-66)
John Iverson attempts a 3Pt. Wide open! Victor Leonard is 6.0 feet away. [ZONE] JOHN IVERSON MAKES IT! Assist: Jarrett Smith
Score: 67-66

[06:00] Team_008 possession (Score: 67-66)
Victor Leonard drives to the basket... Victor Leonard commits a violation (traveling/carry)! TURNOVER! (dead ball)

[05:45] Team_059 possession (Score: 67-66)
Jarrett Smith attempts a Layup. Heavily contested by Tyrese Thompson (0.8 feet, ZONE)! JARRETT SMITH MAKES IT! Assist: John Iverson
Score: 69-66

[05:32] Team_008 possession (Score: 69-66)
Magic Young attempts a Layup. Contested by Jarrett Smith (4.1 feet, ZONE). Magic Young misses. Rebound secured by Jarrett Smith.

[05:18] Team_059 possession (Score: 69-66)
Jarrett Smith drives and kicks out. Blake Tatum attempts a 3Pt. Contested by Victor Leonard (2.3 feet, ZONE). BLAKE TATUM MAKES IT! Assist: John Iverson
Score: 72-66

[04:59] Team_008 possession (Score: 72-66)
Khris Hyland attempts a 3Pt. Contested by John Iverson (4.8 feet, MAN). KHRIS HYLAND MAKES IT! Assist: Jrue Harris
Score: 72-69

[04:45] Team_059 possession (Score: 72-69)
Nikola Jokic loses the ball! Stripped by Tyrese Thompson! TURNOVER! (live ball)

[04:32] Team_008 possession (Score: 72-69)
Magic Young attempts a Midrange. Wide open! Jarrett Smith is 7.5 feet away. [MAN] Magic Young misses. Rebound secured by Bam Wade.

[04:18] Team_059 possession (Score: 72-69)
Bam Wade attempts a Midrange. Wide open! Jrue Harris is 6.3 feet away. [ZONE] BAM WADE MAKES IT!
Score: 74-69

[04:04] Team_008 possession (Score: 74-69)
Magic Young attempts a Midrange. Wide open! Jarrett Smith is 7.2 feet away. [MAN] Magic Young misses. Rebound secured by John Iverson.

[03:46] Team_059 possession (Score: 74-69)
Bam Wade attempts a 3Pt. Contested by Victor Leonard (2.9 feet, ZONE). Bam Wade misses. Rebound secured by Khris Hyland.

[03:33] Team_008 possession (Score: 74-69)
FOUL! Reach-in foul on Nikola Jokic during the drive. [Team fouls: 3] No free throws, side out. (Nikola Jokic: 1 personal fouls)

[03:14] Team_008 possession (Score: 74-69)
Magic Young drives and kicks out. Tyrese Thompson attempts a Midrange. Contested by Bam Wade (4.8 feet, ZONE). TYRESE THOMPSON MAKES IT! Assist: Jrue Harris
Score: 74-71

[02:55] Team_059 possession (Score: 74-71)
Blake Tatum drives and kicks out. Jarrett Smith attempts a Midrange. Wide open! Victor Leonard is 7.4 feet away. [ZONE] Jarrett Smith misses. Offensive rebound by Jarrett Smith! Jarrett Smith kicks it out.

[02:36] Team_059 possession (Score: 74-71)
FOUL! Holding foul on Magic Young. [Team fouls: 1] No free throws, side out. (Magic Young: 1 personal fouls)

[02:24] Team_059 possession (Score: 74-71)
Bam Wade attempts a 3Pt. Wide open! Victor Leonard is 9.2 feet away. [MAN] Bam Wade misses. Offensive rebound by Jarrett Smith! Jarrett Smith kicks it out.

[02:09] Team_059 possession (Score: 74-71)
John Iverson attempts a 3Pt. Wide open! Khris Hyland is 8.0 feet away. [MAN] John Iverson misses. FOUL! Loose ball foul on Khris Hyland during the rebound battle. [Team fouls: 2] No free throws, side out. (Khris Hyland: 1 personal fouls)

[01:56] Team_059 possession (Score: 74-71)
Jarrett Smith attempts a 3Pt. Contested by Khris Hyland (4.6 feet, ZONE). JARRETT SMITH MAKES IT!
Score: 77-71

[01:41] Team_008 possession (Score: 77-71)
Jrue Harris attempts a 3Pt. Contested by Blake Tatum (5.0 feet, MAN). JRUE HARRIS MAKES IT! Assist: Tyrese Thompson
Score: 77-74

[01:26] Team_059 possession (Score: 77-74)
Nikola Jokic attempts a 3Pt. Wide open! Victor Leonard is 7.2 feet away. [ZONE] Nikola Jokic misses. Rebound secured by Magic Young.

[01:09] Team_008 possession (Score: 77-74)
Victor Leonard attempts a Midrange. Wide open! Bam Wade is 6.8 feet away. [MAN] Victor Leonard misses. Rebound secured by John Iverson.

[00:55] Team_059 possession (Score: 77-74)
Jarrett Smith attempts a Layup. Contested by Tyrese Thompson (2.9 feet, ZONE). Jarrett Smith misses. Rebound secured by Magic Young.

[00:40] Team_008 possession (Score: 77-74)
FOUL! Offensive foul on Tyrese Thompson! Nikola Jokic drew the charge! [Team fouls: 3] (Tyrese Thompson: 1 personal fouls) TURNOVER! (dead ball)

[00:24] Team_059 possession (Score: 77-74)
John Iverson drives to the basket... John Iverson throws a bad pass! Stolen by Khris Hyland! TURNOVER! (live ball)

[00:11] Team_008 possession (Score: 77-74)
Jrue Harris attempts a Midrange. Contested by John Iverson (4.2 feet, ZONE). Jrue Harris misses. Rebound secured by Jarrett Smith.

================================================================================
                              3RD QUARTER COMPLETE                              
================================================================================

3RD QUARTER SCORE: Team_059 22, Team_008 16

BOX SCORE:
================================================================================

Team_059
--------------------------------------------------------------------------------
Player                MIN  PTS  REB  AST  TO      FG   FG%      3P   3P%
--------------------------------------------------------------------------------
Jarrett Smith          29    9    5    1   0   4/5    80.0     0/0   0.0
Bam Wade               29    7    3    0   0   3/6    50.0     0/0   0.0
Blake Tatum            29    3    0    1   0   1/2    50.0     0/0   0.0
John Iverson           27    3    5    2   0   1/3    33.3     0/0   0.0
Nikola Jokic           29    0    0    1   0   0/2     0.0     0/0   0.0

TEAM: FG: 9/18 (50.0%), 3PT: 3/10 (30.0%), REB: 12 (3 off, 9 def), AST: 5, TO: 3
TEAM FOULS: 3


Team_008
--------------------------------------------------------------------------------
Player                MIN  PTS  REB  AST  TO      FG   FG%      3P   3P%
--------------------------------------------------------------------------------
Khris Hyland           29    5    4    0   0   2/3    66.7     0/0   0.0
Magic Young            29    4    5    0   0   2/6    33.3     0/0   0.0
Jrue Harris            29    3    0    2   0   1/3    33.3     0/0   0.0
Tyrese Thompson        27    2    2    2   0   1/2    50.0     0/0   0.0
Victor Leonard         29    2    0    0   0   1/3    33.3     0/0   0.0

TEAM: FG: 7/17 (41.2%), 3PT: 2/5 (40.0%), REB: 12 (3 off, 9 def), AST: 4, TO: 4
TEAM FOULS: 3

================================================================================

================================================================================
                       4TH QUARTER - Team_059 vs Team_008                       
================================================================================

[12:00] Team_059 possession (Score: 77-74)
John Iverson attempts a 3Pt. Wide open! Khris Hyland is 7.1 feet away. [MAN] JOHN IVERSON MAKES IT!
Score: 80-74

[11:49] Team_008 possession (Score: 80-74)
Jrue Harris attempts a 3Pt. Wide open! John Iverson is 6.5 feet away. [ZONE] Jrue Harris misses. Rebound secured by Jarrett Smith.

[11:34] Team_059 possession (Score: 80-74)
Blake Tatum attempts a 3Pt. Wide open! Jrue Harris is 8.9 feet away. [MAN] Blake Tatum misses. Rebound secured by Khris Hyland.

[11:22] Team_008 possession (Score: 80-74)
Tyrese Thompson drives, picks up Nikola Jokic. Help arrives from Bam Wade! Tyrese Thompson attempts a Dunk. Wide open! Bam Wade is 6.1 feet away. [MAN] TYRESE THOMPSON MAKES IT!
Score: 80-76

[11:08] Team_059 possession (Score: 80-76)
Jarrett Smith drives, Tyrese Thompson stays with him. Jarrett Smith attempts a Layup. Heavily contested by Tyrese Thompson (1.6 feet, ZONE)! Jarrett Smith misses. FOUL! Loose ball foul on Tyrese Thompson during the rebound battle. [Team fouls: 1] No free throws, side out. (Tyrese Thompson: 1 personal fouls)

[10:51] Team_059 possession (Score: 80-76)
Blake Tatum attempts a 3Pt. Contested by Jrue Harris (4.0 feet, MAN). Blake Tatum misses. Offensive rebound by Jarrett Smith! Jarrett Smith kicks it out.

[10:35] Team_059 possession (Score: 80-76)
FOUL! Shooting foul on Magic Young. Jarrett Smith to the line for 2 free throws. [Team fouls: 2] (Magic Young: 1 personal fouls)   FT 1/2: GOOD   FT 2/2: GOOD Jarrett Smith makes 2/2 from the line.
Score: 82-76

[10:17] Team_008 possession (Score: 82-76)
Victor Leonard attempts a Layup. Heavily contested by Jarrett Smith (0.5 feet, ZONE)! Victor Leonard misses. Offensive rebound by Magic Young! Magic Young kicks it out.

[09:59] Team_008 possession (Score: 82-76)
Jrue Harris attempts a 3Pt. Contested by Bam Wade (5.8 feet, ZONE). Jrue Harris misses. Rebound secured by Nikola Jokic.

[09:49] Team_059 possession (Score: 82-76)
John Iverson attempts a 3Pt. Contested by Khris Hyland (5.7 feet, MAN). John Iverson misses. Offensive rebound by Jarrett Smith! Jarrett Smith kicks it out.

[09:35] Team_059 possession (Score: 82-76)
Jarrett Smith drives to the basket... Jarrett Smith loses the ball! Stripped by Magic Young! TURNOVER! (live ball)

[09:19] Team_008 possession (Score: 82-76)
Tyrese Thompson drives to the basket... FOUL! Offensive foul on Tyrese Thompson! Nikola Jokic drew the charge! [Team fouls: 3] (Tyrese Thompson: 2 personal fouls) TURNOVER! (dead ball)

[09:04] Team_059 possession (Score: 82-76)
Blake Tatum attempts a 3Pt. Heavily contested by Victor Leonard (1.7 feet, ZONE)! BLAKE TATUM MAKES IT! Assist: Bam Wade
Score: 85-76

[08:50] Team_008 possession (Score: 85-76)
Tyrese Thompson drives to the basket... Tyrese Thompson commits a violation (traveling/carry)! TURNOVER! (dead ball)

[08:50] Substitution (Team_059): Bam Wade OUT → Russell Quickley IN (stamina_rule2)

[08:50] Substitution (Team_059): Blake Tatum OUT → Scottie Ginobili IN (stamina_rule2)

[08:50] Substitution (Team_059): John Iverson OUT → Allen Giddey IN (stamina_rule2)

[08:50] Substitution (Team_059): Nikola Jokic OUT → Bones Middleton IN (stamina_rule2)

[08:50] Substitution (Team_059): Jarrett Smith OUT → LeBron Lowry IN (stamina_rule2)

[08:50] Substitution (Team_008): Victor Leonard OUT → Blake Holiday IN (stamina_rule2)

[08:50] Substitution (Team_008): Jrue Harris OUT → Chris Griffin IN (stamina_rule2)

[08:50] Substitution (Team_008): Khris Hyland OUT → Immanuel Young IN (stamina_rule2)

[08:50] Substitution (Team_008): Tyrese Thompson OUT → Khris Giddey IN (stamina_rule2)

[08:50] Substitution (Team_008): Magic Young OUT → Lamelo Middleton IN (stamina_rule2)

[08:37] Team_059 possession (Score: 85-76)
Allen Giddey drives to the basket... Allen Giddey loses control! Ball rolls out of bounds! TURNOVER! (dead ball)

[08:19] Team_008 possession (Score: 85-76)
Khris Giddey attempts a 3Pt. Wide open! Bones Middleton is 6.2 feet away. [MAN] Khris Giddey misses. Offensive rebound by Khris Giddey! Khris Giddey kicks it out.

[08:06] Team_008 possession (Score: 85-76)
Chris Griffin attempts a 3Pt. Contested by Russell Quickley (5.8 feet, ZONE). Chris Griffin misses. Offensive rebound by Lamelo Middleton! Lamelo Middleton's putback is no good. Rebound secured by LeBron Lowry.

[07:51] Team_059 possession (Score: 85-76)
LeBron Lowry attempts a Layup. BLOCKED BY CHRIS GRIFFIN! Ball is loose! Offensive rebound by Bones Middleton! Bones Middleton kicks it out.

[07:35] Team_059 possession (Score: 85-76)
Russell Quickley drives, Khris Giddey stays with him. Russell Quickley attempts a Dunk. Wide open! Khris Giddey is 6.2 feet away. [ZONE] RUSSELL QUICKLEY MAKES IT!
Score: 87-76

[07:21] Team_008 possession (Score: 87-76)
Lamelo Middleton attempts a 3Pt. Contested by Russell Quickley (5.9 feet, ZONE). Lamelo Middleton misses. Rebound secured by Bones Middleton.

[07:07] Team_059 possession (Score: 87-76)
Russell Quickley throws a bad pass! Stolen by Blake Holiday! TURNOVER! (live ball)

[06:54] Team_008 possession (Score: 87-76)
Khris Giddey attempts a Midrange. Contested by Bones Middleton (5.0 feet, MAN). KHRIS GIDDEY MAKES IT!
Score: 87-78

[06:36] Team_059 possession (Score: 87-78)
Russell Quickley throws a bad pass! Stolen by Blake Holiday! TURNOVER! (live ball)

[06:20] Team_008 possession (Score: 87-78)
Immanuel Young attempts a 3Pt. Contested by Russell Quickley (3.4 feet, ZONE). Immanuel Young misses. Rebound secured by Bones Middleton.

[06:07] Team_059 possession (Score: 87-78)
Allen Giddey attempts a Layup. Contested by Lamelo Middleton (3.7 feet, ZONE). Allen Giddey misses. Rebound secured by Khris Giddey.

[05:49] Team_008 possession (Score: 87-78)
Blake Holiday attempts a 3Pt. Wide open! Russell Quickley is 6.8 feet away. [ZONE] Blake Holiday misses. Rebound secured by Bones Middleton.

[05:38] Team_059 possession (Score: 87-78)
Allen Giddey attempts a 3Pt. Contested by Immanuel Young (3.2 feet, MAN). Allen Giddey misses. Offensive rebound by Bones Middleton! Bones Middleton kicks it out.

[05:22] Team_059 possession (Score: 87-78)
LeBron Lowry drives and kicks out. Allen Giddey attempts a Midrange. Contested by Immanuel Young (4.7 feet, MAN). Allen Giddey misses. Rebound secured by Chris Griffin.

[05:05] Team_008 possession (Score: 87-78)
Khris Giddey drives to the basket... FOUL! Offensive foul on Khris Giddey! Bones Middleton drew the charge! [Team fouls: 4] (Khris Giddey: 1 personal fouls) TURNOVER! (dead ball)

[04:50] Team_059 possession (Score: 87-78)
Bones Middleton throws a bad pass out of bounds! TURNOVER! (dead ball)

[04:40] Team_008 possession (Score: 87-78)
Khris Giddey attempts a Midrange. Heavily contested by Bones Middleton (0.5 feet, MAN)! Khris Giddey misses. Offensive rebound by Khris Giddey! Khris Giddey kicks it out.

[04:27] Team_008 possession (Score: 87-78)
Blake Holiday drives, Bones Middleton stays with him. Blake Holiday attempts a Layup. Contested by Bones Middleton (3.4 feet, ZONE). BLAKE HOLIDAY MAKES IT! Assist: Chris Griffin
Score: 87-80

[04:09] Team_059 possession (Score: 87-80)
FOUL! Holding foul on Chris Griffin. [IN THE BONUS! 5 team fouls] Scottie Ginobili to the line for 2 free throws. (Chris Griffin: 1 personal fouls)   FT 1/2: GOOD   FT 2/2: GOOD Scottie Ginobili makes 2/2 from the line.
Score: 89-80

[03:52] Team_008 possession (Score: 89-80)
Blake Holiday drives to the basket... Blake Holiday throws a bad pass out of bounds! TURNOVER! (dead ball)

[03:37] Team_059 possession (Score: 89-80)
Bones Middleton attempts a 3Pt. Contested by Khris Giddey (5.4 feet, MAN). Bones Middleton misses. Rebound secured by Khris Giddey.

[03:25] Team_008 possession (Score: 89-80)
Immanuel Young attempts a 3Pt. Contested by Russell Quickley (3.4 feet, ZONE). Immanuel Young misses. Rebound secured by LeBron Lowry.

[03:13] Team_059 possession (Score: 89-80)
Allen Giddey attempts a Midrange. Heavily contested by Immanuel Young (1.1 feet, ZONE)! Allen Giddey misses. Rebound secured by Lamelo Middleton.

[02:59] Team_008 possession (Score: 89-80)
Immanuel Young attempts a 3Pt. Contested by Russell Quickley (2.4 feet, ZONE). IMMANUEL YOUNG MAKES IT! Assist: Khris Giddey
Score: 89-83

[02:47] Team_059 possession (Score: 89-83)
FOUL! Holding foul on Khris Giddey. [IN THE BONUS! 6 team fouls] Bones Middleton to the line for 2 free throws. (Khris Giddey: 2 personal fouls)   FT 1/2: MISS   FT 2/2: GOOD Bones Middleton makes 1/2 from the line.
Score: 90-83

[02:35] Team_008 possession (Score: 90-83)
Khris Giddey attempts a 3Pt. Contested by Russell Quickley (2.3 feet, ZONE). Khris Giddey misses. Offensive rebound by Lamelo Middleton! Lamelo Middleton puts it back in!
Score: 90-85

[02:20] Team_059 possession (Score: 90-85)
LeBron Lowry drives to the basket... LeBron Lowry throws a bad pass! Stolen by Lamelo Middleton! TURNOVER! (live ball)

[02:05] Team_008 possession (Score: 90-85)
Chris Griffin attempts a 3Pt. Contested by Russell Quickley (2.5 feet, ZONE). CHRIS GRIFFIN MAKES IT! Assist: Khris Giddey
Score: 90-88

[01:50] Team_059 possession (Score: 90-88)
Scottie Ginobili attempts a Midrange. Wide open! Chris Griffin is 8.9 feet away. [ZONE] SCOTTIE GINOBILI MAKES IT! Assist: Russell Quickley
Score: 92-88

[01:37] Team_008 possession (Score: 92-88)
Blake Holiday throws a bad pass! Stolen by Russell Quickley! TURNOVER! (live ball)

[01:24] Team_059 possession (Score: 92-88)
FOUL! Reach-in foul on Lamelo Middleton during the drive. [IN THE BONUS! 7 team fouls] LeBron Lowry to the line for 2 free throws. (Lamelo Middleton: 1 personal fouls)   FT 1/2: GOOD   FT 2/2: MISS LeBron Lowry makes 1/2 from the line. Rebound secured by Chris Griffin.
Score: 93-88

[01:10] Team_008 possession (Score: 93-88)
Blake Holiday attempts a Midrange. Contested by Russell Quickley (5.8 feet, MAN). BLAKE HOLIDAY MAKES IT! Assist: Lamelo Middleton
Score: 93-90

[00:56] Team_059 possession (Score: 93-90)
LeBron Lowry attempts a Midrange. Contested by Khris Giddey (3.4 feet, ZONE). LeBron Lowry misses. Rebound secured by Khris Giddey.

[00:45] Team_008 possession (Score: 93-90)
Lamelo Middleton attempts a Midrange. Wide open! Scottie Ginobili is 7.1 feet away. [ZONE] Lamelo Middleton misses. Rebound secured by Bones Middleton.

[00:32] Team_059 possession (Score: 93-90)
FOUL! Reach-in foul on Chris Griffin during the drive. [IN THE BONUS! 8 team fouls] Scottie Ginobili to the line for 2 free throws. (Chris Griffin: 2 personal fouls)   FT 1/2: GOOD   FT 2/2: GOOD Scottie Ginobili makes 2/2 from the line.
Score: 95-90

[00:20] Team_008 possession (Score: 95-90)
Immanuel Young attempts a 3Pt. Wide open! Allen Giddey is 8.6 feet away. [MAN] Immanuel Young misses. Offensive rebound by Khris Giddey! Khris Giddey kicks it out.

[00:07] Team_008 possession (Score: 95-90)
Khris Giddey drives and kicks out. Lamelo Middleton attempts a Midrange. Wide open! LeBron Lowry is 8.4 feet away. [MAN] Lamelo Middleton misses. Rebound secured by Scottie Ginobili.

================================================================================
                              4TH QUARTER COMPLETE                              
================================================================================

4TH QUARTER SCORE: Team_059 18, Team_008 16

BOX SCORE:
================================================================================

Team_059
--------------------------------------------------------------------------------
Player                MIN  PTS  REB  AST  TO      FG   FG%      3P   3P%
--------------------------------------------------------------------------------
Scottie Ginobili       16    6    1    0   0   3/3   100.0     0/0   0.0
John Iverson           31    3    0    0   0   1/1   100.0     0/0   0.0
Blake Tatum            32    3    0    0   0   1/2    50.0     0/0   0.0
Jarrett Smith          32    2    4    0   0   1/1   100.0     0/0   0.0
Russell Quickley       16    2    0    1   0   1/1   100.0     0/0   0.0
Bones Middleton        16    1    6    0   0   1/2    50.0     0/0   0.0
Nikola Jokic           32    0    1    0   0   0/0     0.0     0/0   0.0
Bam Wade               32    0    0    1   0   0/0     0.0     0/0   0.0
LeBron Lowry           16    0    2    0   0   0/3     0.0     0/0   0.0
Allen Giddey           18    0    0    0   0   0/2     0.0     0/0   0.0

TEAM: FG: 8/15 (53.3%), 3PT: 2/4 (50.0%), REB: 13 (5 off, 8 def), AST: 2, TO: 6
TEAM FOULS: 0


Team_008
--------------------------------------------------------------------------------
Player                MIN  PTS  REB  AST  TO      FG   FG%      3P   3P%
--------------------------------------------------------------------------------
Blake Holiday          16    4    0    0   0   2/3    66.7     0/0   0.0
Chris Griffin          16    3    2    1   0   1/2    50.0     0/0   0.0
Immanuel Young         16    3    0    0   0   1/3    33.3     0/0   0.0
Tyrese Thompson        31    2    0    0   0   1/1   100.0     0/0   0.0
Khris Giddey           18    2    6    2   0   1/2    50.0     0/0   0.0
Lamelo Middleton       16    2    2    1   0   1/3    33.3     0/0   0.0
Jrue Harris            32    0    0    0   0   0/2     0.0     0/0   0.0
Khris Hyland           32    0    1    0   0   0/0     0.0     0/0   0.0
Magic Young            32    0    1    0   0   0/0     0.0     0/0   0.0

TEAM: FG: 7/16 (43.8%), 3PT: 3/10 (30.0%), REB: 13 (6 off, 7 def), AST: 4, TO: 5
TEAM FOULS: 8 [Team_059 in BONUS]

================================================================================

================================================================================
                               FULL GAME COMPLETE                               
================================================================================

FINAL SCORE: Team_059 95, Team_008 90

SCORING BY QUARTER:
--------------------------------------------------------------------------------
Team                     Q1     Q2     Q3     Q4    FINAL
--------------------------------------------------------------------------------
Team_059                 34     21     22     18       95
Team_008                 30     28     16     16       90
--------------------------------------------------------------------------------

FULL GAME BOX SCORE:
================================================================================

Team_059
--------------------------------------------------------------------------------
Player                MIN  PTS  REB  AST  TO      FG   FG%      3P   3P%      FT STL BLK
--------------------------------------------------------------------------------
Bam Wade               32   19    8    3   0   9/14   64.3   2/7    28.6   1/1     0   0
Blake Tatum            32   15    0    3   4   3/6    50.0   3/6    50.0   0/0     0   1
Nikola Jokic           32    0    1    3   1   0/4     0.0   0/3     0.0   0/0     0   0
Jarrett Smith          32   23   12    2   1  12/14   85.7   1/1   100.0   2/2     2   0
John Iverson           31   16   10    5   2   6/12   50.0   2/5    40.0   2/2     0   0
Allen Giddey           18    3    0    1   0   1/5    20.0   1/2    50.0   1/2     0   0
Russell Quickley       16    4    0    1   4   2/3    66.7   0/0     0.0   0/0     1   0
Scottie Ginobili       16    8    5    1   0   3/3   100.0   0/0     0.0   4/4     0   0
Bones Middleton        16    3    9    1   2   0/4     0.0   0/3     0.0   3/4     0   0
LeBron Lowry           16    2    4    0   1   1/5    20.0   0/0     0.0   3/4     0   0

TEAM: FG: 40/73 (54.8%), 3PT: 9/27 (33.3%), REB: 47 (13 off, 34 def), AST: 20, TO: 15


Team_008
--------------------------------------------------------------------------------
Player                MIN  PTS  REB  AST  TO      FG   FG%      3P   3P%      FT STL BLK
--------------------------------------------------------------------------------
Victor Leonard         32   11    0    2   1   5/10   50.0   1/3    33.3   5/5     0   0
Jrue Harris            32   15    0    6   0   4/12   33.3   3/7    42.9   2/2     0   1
Khris Hyland           32   12    8    1   1   8/11   72.7   2/4    50.0   2/2     1   0
Magic Young            32    6    9    1   3   3/9    33.3   0/0     0.0   0/0     1   0
Tyrese Thompson        31   16    5    2   4   4/6    66.7   2/4    50.0   1/1     1   0
Khris Giddey           18    8   13    2   0   5/6    83.3   1/1   100.0   0/0     0   1
Blake Holiday          16    4    0    2   2   2/5    40.0   0/2     0.0   0/0     2   0
Chris Griffin          16    6    3    1   1   1/2    50.0   1/2    50.0   0/0     0   1
Immanuel Young         16    7    0    0   0   3/7    42.9   1/4    25.0   3/4     0   0
Lamelo Middleton       16    4    5    2   0   1/5    20.0   0/2     0.0   0/0     2   0

TEAM: FG: 37/74 (50.0%), 3PT: 11/29 (37.9%), REB: 45 (12 off, 33 def), AST: 19, TO: 12

================================================================================
