================================================================================
                        FULL GAME - Team_010 vs Team_014                        
================================================================================

================================================================================
                       1ST QUARTER - Team_010 vs Team_014                       
================================================================================

[12:00] Team_010 possession (Score: 0-0)
Desmond Antetokounmpo attempts a Midrange. Contested by DeMar Adebayo (4.0 feet, MAN). Desmond Antetokounmpo misses. Rebound secured by Ayo Murray.

[11:49] Team_014 possession (Score: 0-0)
Ayo Murray attempts a Midrange. Wide open! Anthony Durant is 7.4 feet away. [MAN] Ayo Murray misses. Rebound secured by Anthony Durant.

[11:35] Team_010 possession (Score: 0-0)
Anthony Durant drives, Ayo Murray stays with him. Anthony Durant attempts a Layup. Contested by Ayo Murray (4.9 feet, MAN). ANTHONY DURANT MAKES IT! Assist: Cade Morant
Score: 2-0

[11:20] Team_014 possession (Score: 2-0)
Jordan Anunoby attempts a 3Pt. Contested by Michael Turner (5.1 feet, MAN). Jordan Anunoby misses. Offensive rebound by Ayo Murray! Ayo Murray kicks it out.

[11:06] Team_014 possession (Score: 2-0)
DeMar Adebayo attempts a 3Pt. Contested by Desmond Antetokounmpo (5.3 feet, MAN). DeMar Adebayo misses. Offensive rebound by DeMar Adebayo! DeMar Adebayo kicks it out.

[10:52] Team_014 possession (Score: 2-0)
Ayo Murray attempts a Layup. Heavily contested by Anthony Durant (1.0 feet, MAN)! Ayo Murray misses. Rebound secured by Cade Morant.

[10:40] Team_010 possession (Score: 2-0)
FOUL! Holding foul on Jordan Anunoby. [Team fouls: 1] No free throws, side out. (Jordan Anunoby: 1 personal fouls)

[10:28] Team_010 possession (Score: 2-0)
Anthony Durant drives, Ayo Murray stays with him. Anthony Durant attempts a Layup. Contested by Ayo Murray (5.5 feet, MAN). Anthony Durant misses. Rebound secured by DeMar Adebayo.

[10:13] Team_014 possession (Score: 2-0)
Lamelo Simmons attempts a Midrange. Contested by RJ Young (4.7 feet, MAN). LAMELO SIMMONS MAKES IT!
Score: 2-2

[09:55] Team_010 possession (Score: 2-2)
Desmond Antetokounmpo attempts a 3Pt. Wide open! Jordan Anunoby is 7.5 feet away. [ZONE] DESMOND ANTETOKOUNMPO MAKES IT! Assist: Cade Morant
Score: 5-2

[09:40] Team_014 possession (Score: 5-2)
Lamelo Simmons commits a violation (traveling/carry)! TURNOVER! (dead ball)

[09:23] Team_010 possession (Score: 5-2)
Cade Morant attempts a 3Pt. Contested by Jordan Anunoby (4.7 feet, ZONE). Cade Morant misses. Rebound secured by DeMar Adebayo.

[09:13] Team_014 possession (Score: 5-2)
Jordan Anunoby attempts a Midrange. Wide open! Michael Turner is 7.0 feet away. [MAN] Jordan Anunoby misses. Offensive rebound by Ayo Murray! Ayo Murray kicks it out.

[08:59] Team_014 possession (Score: 5-2)
FOUL! Shooting foul on Anthony Durant. Ayo Murray to the line for 2 free throws. [Team fouls: 1] (Anthony Durant: 1 personal fouls)   FT 1/2: GOOD   FT 2/2: MISS Ayo Murray makes 1/2 from the line. Rebound secured by Anthony Durant.
Score: 5-3

[08:45] Team_010 possession (Score: 5-3)
Anthony Durant attempts a Midrange. Contested by DeMar Adebayo (3.5 feet, ZONE). Anthony Durant misses. Offensive rebound by Anthony Durant! Anthony Durant kicks it out.

[08:29] Team_010 possession (Score: 5-3)
Anthony Durant commits a violation (traveling/carry)! TURNOVER! (dead ball)

[08:13] Team_014 possession (Score: 5-3)
Michael Cunningham attempts a Layup. BLOCKED BY CADE MORANT! Ball deflects out of bounds off Michael Cunningham.

[07:58] Team_010 possession (Score: 5-3)
Desmond Antetokounmpo attempts a Layup. Contested by DeMar Adebayo (5.4 feet, ZONE). DESMOND ANTETOKOUNMPO MAKES IT! Assist: Michael Turner
Score: 7-3

[07:44] Team_014 possession (Score: 7-3)
DeMar Adebayo drives to the basket... DeMar Adebayo throws a bad pass! Stolen by Desmond Antetokounmpo! TURNOVER! (live ball)

[07:30] Team_010 possession (Score: 7-3)
Anthony Durant drives to the basket... Anthony Durant throws a bad pass! Stolen by DeMar Adebayo! TURNOVER! (live ball)

[07:16] Team_014 possession (Score: 7-3)
Michael Cunningham attempts a 3Pt. Heavily contested by Cade Morant (0.9 feet, ZONE)! Michael Cunningham misses. Rebound secured by Desmond Antetokounmpo.

[07:02] Team_010 possession (Score: 7-3)
Michael Turner attempts a 3Pt. Wide open! Jordan Anunoby is 6.3 feet away. [MAN] MICHAEL TURNER MAKES IT! Assist: Cade Morant
Score: 10-3

[06:48] Team_014 possession (Score: 10-3)
Michael Cunningham drives and kicks out. Michael Cunningham attempts a Midrange. Wide open! Cade Morant is 7.1 feet away. [MAN] MICHAEL CUNNINGHAM MAKES IT!
Score: 10-5

[06:31] Team_010 possession (Score: 10-5)
RJ Young attempts a 3Pt. Contested by Lamelo Simmons (3.3 feet, MAN). RJ Young misses. Rebound secured by DeMar Adebayo.

[06:13] Team_014 possession (Score: 10-5)
Ayo Murray attempts a Midrange. Contested by Desmond Antetokounmpo (5.4 feet, ZONE). AYO MURRAY MAKES IT! Assist: Lamelo Simmons
Score: 10-7

[06:02] Team_010 possession (Score: 10-7)
Desmond Antetokounmpo attempts a Midrange. Wide open! Lamelo Simmons is 8.3 feet away. [ZONE] DESMOND ANTETOKOUNMPO MAKES IT! Assist: Cade Morant
Score: 12-7

[05:43] Team_014 possession (Score: 12-7)
Lamelo Simmons makes the Midrange and draws the foul on RJ Young! And-1! Lamelo Simmons to the line for 1. [Team fouls: 2] (RJ Young: 1 personal fouls)   FT 1/1: GOOD Lamelo Simmons makes 1/1 from the line.
Score: 12-10

[05:26] Team_010 possession (Score: 12-10)
Michael Turner drives and kicks out. Michael Turner attempts a 3Pt. Contested by Jordan Anunoby (4.7 feet, ZONE). Michael Turner misses. Rebound secured by Ayo Murray.

[05:12] Team_014 possession (Score: 12-10)
DeMar Adebayo attempts a Midrange. Contested by Desmond Antetokounmpo (3.2 feet, MAN). DeMar Adebayo misses. Rebound secured by Cade Morant.

[04:56] Team_010 possession (Score: 12-10)
Desmond Antetokounmpo attempts a Midrange. Contested by Jordan Anunoby (5.1 feet, ZONE). DESMOND ANTETOKOUNMPO MAKES IT! Assist: Michael Turner
Score: 14-10

[04:45] Team_014 possession (Score: 14-10)
Ayo Murray drives and kicks out. DeMar Adebayo attempts a 3Pt. Wide open! Cade Morant is 7.9 feet away. [ZONE] DeMar Adebayo misses. Rebound secured by Cade Morant.

[04:34] Team_010 possession (Score: 14-10)
Anthony Durant drives and kicks out. Cade Morant attempts a Midrange. Contested by Michael Cunningham (5.8 feet, MAN). Cade Morant misses. Rebound secured by Ayo Murray.

[04:17] Team_014 possession (Score: 14-10)
Lamelo Simmons attempts a 3Pt. Contested by RJ Young (2.2 feet, MAN). LAMELO SIMMONS MAKES IT! Assist: Michael Cunningham
Score: 14-13

[03:58] Team_010 possession (Score: 14-13)
Cade Morant attempts a Midrange. Wide open! DeMar Adebayo is 6.4 feet away. [ZONE] CADE MORANT MAKES IT! Assist: Michael Turner
Score: 16-13

[03:45] Team_014 possession (Score: 16-13)
Lamelo Simmons drives and kicks out. Jordan Anunoby attempts a 3Pt. Wide open! Michael Turner is 6.8 feet away. [MAN] JORDAN ANUNOBY MAKES IT! Assist: Lamelo Simmons
Score: 16-16

[03:29] Team_010 possession (Score: 16-16)
Michael Turner attempts a 3Pt. Contested by Jordan Anunoby (5.2 feet, MAN). Michael Turner misses. Offensive rebound by Cade Morant! Cade Morant kicks it out.

[03:14] Team_010 possession (Score: 16-16)
Michael Turner attempts a 3Pt. Contested by Jordan Anunoby (5.3 feet, ZONE). Michael Turner misses. Rebound secured by DeMar Adebayo.

[02:58] Team_014 possession (Score: 16-16)
Jordan Anunoby attempts a 3Pt. Heavily contested by Cade Morant (0.5 feet, ZONE)! Jordan Anunoby misses. Offensive rebound by Ayo Murray! Ayo Murray kicks it out.

[02:42] Team_014 possession (Score: 16-16)
Jordan Anunoby attempts a 3Pt. Contested by Michael Turner (2.3 feet, MAN). JORDAN ANUNOBY MAKES IT! Assist: Michael Cunningham
Score: 16-19

[02:25] Team_010 possession (Score: 16-19)
Desmond Antetokounmpo attempts a Layup. BLOCKED BY DEMAR ADEBAYO! Ball is loose! Rebound secured by Michael Cunningham.

[02:12] Team_014 possession (Score: 16-19)
Ayo Murray attempts a Midrange. Contested by Anthony Durant (2.9 feet, MAN). Ayo Murray misses. Rebound secured by Michael Turner.

[01:58] Team_010 possession (Score: 16-19)
Cade Morant attempts a 3Pt. Contested by Michael Cunningham (3.1 feet, MAN). Cade Morant misses. Rebound secured by DeMar Adebayo.

[01:46] Team_014 possession (Score: 16-19)
Ayo Murray drives and kicks out. Michael Cunningham attempts a 3Pt. Wide open! Cade Morant is 6.1 feet away. [ZONE] Michael Cunningham misses. Rebound secured by Michael Turner.

[01:32] Team_010 possession (Score: 16-19)
Anthony Durant drives to the basket... Anthony Durant throws a bad pass out of bounds! TURNOVER! (dead ball)

[01:32] Substitution (Team_010): Cade Morant OUT → Draymond Leonard IN (stamina_rule2)

[01:32] Substitution (Team_010): Michael Turner OUT → Blake Harden IN (stamina_rule2)

[01:32] Substitution (Team_010): RJ Young OUT → Ben Gilgeous-Alexander IN (stamina_rule2)

[01:32] Substitution (Team_010): Desmond Antetokounmpo OUT → Vince Ingram IN (stamina_rule2)

[01:32] Substitution (Team_010): Anthony Durant OUT → Paolo Wade IN (stamina_rule2)

[01:32] Substitution (Team_014): Michael Cunningham OUT → Jalen Booker IN (stamina_rule2)

[01:32] Substitution (Team_014): Jordan Anunoby OUT → Bones Quickley IN (stamina_rule2)

[01:32] Substitution (Team_014): Lamelo Simmons OUT → Tracy Westbrook IN (stamina_rule2)

[01:32] Substitution (Team_014): DeMar Adebayo OUT → Nikola James IN (stamina_rule2)

[01:32] Substitution (Team_014): Ayo Murray OUT → Collin Gasol IN (stamina_rule2)

[01:16] Team_014 possession (Score: 16-19)
Collin Gasol attempts a Midrange. Wide open! Vince Ingram is 8.9 feet away. [ZONE] COLLIN GASOL MAKES IT! Assist: Jalen Booker
Score: 16-21

[01:01] Team_010 possession (Score: 16-21)
Vince Ingram attempts a Layup. Contested by Nikola James (4.9 feet, MAN). Vince Ingram misses. Rebound secured by Tracy Westbrook.

[00:45] Team_014 possession (Score: 16-21)
Collin Gasol attempts a 3Pt. Contested by Paolo Wade (5.3 feet, MAN). Collin Gasol misses. Rebound secured by Ben Gilgeous-Alexander.

[00:31] Team_010 possession (Score: 16-21)
Ben Gilgeous-Alexander drives to the basket... FOUL! Offensive foul on Ben Gilgeous-Alexander! Collin Gasol drew the charge! [Team fouls: 3] (Ben Gilgeous-Alexander: 1 personal fouls) TURNOVER! (dead ball)

[00:14] Team_014 possession (Score: 16-21)
Collin Gasol attempts a 3Pt. Contested by Draymond Leonard (3.5 feet, ZONE). COLLIN GASOL MAKES IT!
Score: 16-24

================================================================================
                              1ST QUARTER COMPLETE                              
================================================================================

1ST QUARTER SCORE: Team_010 16, Team_014 24

BOX SCORE:
================================================================================

Team_010
--------------------------------------------------------------------------------
Player                MIN  PTS  REB  AST  TO      FG   FG%      3P   3P%
--------------------------------------------------------------------------------
Desmond Antetokounmpo   11    9    1    0   0   4/6    66.7     0/0   0.0
Michael Turner         11    3    2    3   0   1/3    33.3     0/0   0.0
Anthony Durant         11    2    3    0   0   1/3    33.3     0/0   0.0
Cade Morant            11    2    4    4   0   1/3    33.3     0/0   0.0
RJ Young               11    0    0    0   0   0/1     0.0     0/0   0.0
Vince Ingram            1    0    0    0   0   0/1     0.0     0/0   0.0
Ben Gilgeous-Alexander    1    0    1    0   0   0/0     0.0     0/0   0.0

TEAM: FG: 7/17 (41.2%), 3PT: 2/6 (33.3%), REB: 11 (2 off, 9 def), AST: 7, TO: 4
TEAM FOULS: 3


Team_014
--------------------------------------------------------------------------------
Player                MIN  PTS  REB  AST  TO      FG   FG%      3P   3P%
--------------------------------------------------------------------------------
Lamelo Simmons         11    8    0    2   0   3/3   100.0     0/0   0.0
Jordan Anunoby         11    6    0    0   0   2/2   100.0     0/0   0.0
Collin Gasol            1    5    0    0   0   2/3    66.7     0/0   0.0
Ayo Murray             11    2    6    0   0   1/7    14.3     0/0   0.0
Michael Cunningham     11    2    1    2   0   1/3    33.3     0/0   0.0
DeMar Adebayo          11    0    6    0   0   0/1     0.0     0/0   0.0
Jalen Booker            1    0    0    1   0   0/0     0.0     0/0   0.0
Tracy Westbrook         1    0    1    0   0   0/0     0.0     0/0   0.0

TEAM: FG: 9/19 (47.4%), 3PT: 3/5 (60.0%), REB: 14 (4 off, 10 def), AST: 5, TO: 2
TEAM FOULS: 1

================================================================================

================================================================================
                       2ND QUARTER - Team_010 vs Team_014                       
================================================================================

[12:00] Team_010 possession (Score: 16-24)
Michael Turner drives and kicks out. Desmond Antetokounmpo attempts a 3Pt. Contested by DeMar Adebayo (5.3 feet, MAN). Desmond Antetokounmpo misses. Rebound secured by Ayo Murray.

[11:43] Team_014 possession (Score: 16-24)
FOUL! Reach-in foul on Desmond Antetokounmpo during the drive. [Team fouls: 1] No free throws, side out. (Desmond Antetokounmpo: 1 personal fouls)

[11:27] Team_014 possession (Score: 16-24)
FOUL! Offensive foul on Michael Cunningham! Cade Morant drew the charge! [Team fouls: 1] (Michael Cunningham: 1 personal fouls) TURNOVER! (dead ball)

[11:09] Team_010 possession (Score: 16-24)
RJ Young makes the Layup and draws the foul on DeMar Adebayo! And-1! RJ Young to the line for 1. [Team fouls: 2] (DeMar Adebayo: 1 personal fouls)   FT 1/1: MISS RJ Young makes 0/1 from the line. Rebound secured by Michael Cunningham.
Score: 18-24

[10:54] Team_014 possession (Score: 18-24)
Ayo Murray attempts a Layup. BLOCKED BY ANTHONY DURANT! Ball is loose! Rebound secured by Michael Turner.

[10:37] Team_010 possession (Score: 18-24)
RJ Young attempts a 3Pt. Contested by Lamelo Simmons (3.7 feet, MAN). RJ Young misses. Rebound secured by Ayo Murray.

[10:26] Team_014 possession (Score: 18-24)
FOUL! Shooting foul on RJ Young. Ayo Murray to the line for 2 free throws. [Team fouls: 2] (RJ Young: 1 personal fouls)   FT 1/2: GOOD   FT 2/2: GOOD Ayo Murray makes 2/2 from the line.
Score: 18-26

[10:13] Team_010 possession (Score: 18-26)
Michael Turner attempts a 3Pt. Wide open! Jordan Anunoby is 6.3 feet away. [ZONE] Michael Turner misses. Offensive rebound by Anthony Durant! Anthony Durant kicks it out.

[10:00] Team_010 possession (Score: 18-26)
Michael Turner attempts a 3Pt. Wide open! Jordan Anunoby is 6.1 feet away. [ZONE] MICHAEL TURNER MAKES IT! Assist: Cade Morant
Score: 21-26

[09:46] Team_014 possession (Score: 21-26)
DeMar Adebayo drives, Desmond Antetokounmpo stays with him. DeMar Adebayo attempts a Layup. Contested by Desmond Antetokounmpo (2.8 feet, MAN). DEMAR ADEBAYO MAKES IT!
Score: 21-28

[09:26] Team_010 possession (Score: 21-28)
Michael Turner attempts a Midrange. Contested by Jordan Anunoby (3.8 feet, MAN). Michael Turner misses. Rebound secured by Michael Cunningham.

[09:15] Team_014 possession (Score: 21-28)
Lamelo Simmons attempts a 3Pt. Contested by Cade Morant (4.9 feet, ZONE). LAMELO SIMMONS MAKES IT! Assist: Ayo Murray
Score: 21-31

[08:56] Team_010 possession (Score: 21-31)
Cade Morant attempts a 3Pt. Wide open! Jordan Anunoby is 6.7 feet away. [ZONE] Cade Morant misses. Rebound secured by DeMar Adebayo.

[08:42] Team_014 possession (Score: 21-31)
Jordan Anunoby attempts a Midrange. Heavily contested by RJ Young (1.1 feet, ZONE)! Jordan Anunoby misses. Rebound secured by Cade Morant.

[08:31] Team_010 possession (Score: 21-31)
Anthony Durant drives and kicks out. Desmond Antetokounmpo attempts a 3Pt. Contested by DeMar Adebayo (4.3 feet, MAN). Desmond Antetokounmpo misses. Rebound secured by Ayo Murray.

[08:13] Team_014 possession (Score: 21-31)
DeMar Adebayo drives and kicks out. Jordan Anunoby attempts a Midrange. Wide open! Michael Turner is 6.8 feet away. [MAN] Jordan Anunoby misses. Rebound secured by Cade Morant.

[07:59] Team_010 possession (Score: 21-31)
FOUL! Reach-in foul on DeMar Adebayo during the drive. [Team fouls: 3] No free throws, side out. (DeMar Adebayo: 2 personal fouls)

[07:48] Team_010 possession (Score: 21-31)
RJ Young drives to the basket... FOUL! Offensive foul on RJ Young! Lamelo Simmons drew the charge! [Team fouls: 3] (RJ Young: 2 personal fouls) TURNOVER! (dead ball)

[07:35] Team_014 possession (Score: 21-31)
Lamelo Simmons throws a bad pass out of bounds! TURNOVER! (dead ball)

[07:35] Substitution (Team_010): Cade Morant OUT → Draymond Leonard IN (stamina_rule2)

[07:35] Substitution (Team_010): Michael Turner OUT → Blake Harden IN (stamina_rule2)

[07:35] Substitution (Team_010): RJ Young OUT → Ben Gilgeous-Alexander IN (stamina_rule2)

[07:35] Substitution (Team_010): Desmond Antetokounmpo OUT → Vince Ingram IN (stamina_rule2)

[07:35] Substitution (Team_010): Anthony Durant OUT → Paolo Wade IN (stamina_rule2)

[07:35] Substitution (Team_014): Michael Cunningham OUT → Jalen Booker IN (stamina_rule2)

[07:35] Substitution (Team_014): Jordan Anunoby OUT → Bones Quickley IN (stamina_rule2)

[07:35] Substitution (Team_014): Lamelo Simmons OUT → Tracy Westbrook IN (stamina_rule2)

[07:35] Substitution (Team_014): DeMar Adebayo OUT → Nikola James IN (stamina_rule2)

[07:35] Substitution (Team_014): Ayo Murray OUT → Collin Gasol IN (stamina_rule2)

[07:22] Team_010 possession (Score: 21-31)
Paolo Wade attempts a Midrange. Wide open! Collin Gasol is 8.1 feet away. [MAN] Paolo Wade misses. Rebound secured by Collin Gasol.

[07:10] Team_014 possession (Score: 21-31)
Collin Gasol attempts a 3Pt. Wide open! Paolo Wade is 10.0 feet away. [MAN] Collin Gasol misses. Rebound secured by Ben Gilgeous-Alexander.

[06:57] Team_010 possession (Score: 21-31)
Draymond Leonard attempts a Midrange. Contested by Tracy Westbrook (4.3 feet, ZONE). DRAYMOND LEONARD MAKES IT!
Score: 23-31

[06:43] Team_014 possession (Score: 23-31)
Collin Gasol attempts a 3Pt. Contested by Draymond Leonard (5.0 feet, ZONE). Collin Gasol misses. Offensive rebound by Nikola James! Nikola James kicks it out.

[06:25] Team_014 possession (Score: 23-31)
Tracy Westbrook attempts a Midrange. Contested by Paolo Wade (3.9 feet, ZONE). TRACY WESTBROOK MAKES IT! Assist: Bones Quickley
Score: 23-33

[06:07] Team_010 possession (Score: 23-33)
Draymond Leonard drives and kicks out. Blake Harden attempts a Midrange. Contested by Bones Quickley (5.5 feet, MAN). BLAKE HARDEN MAKES IT! Assist: Ben Gilgeous-Alexander
Score: 25-33

[05:51] Team_014 possession (Score: 25-33)
FOUL! Shooting foul on Paolo Wade. Collin Gasol to the line for 2 free throws. [Team fouls: 4] (Paolo Wade: 1 personal fouls)   FT 1/2: MISS   FT 2/2: GOOD Collin Gasol makes 1/2 from the line.
Score: 25-34

[05:36] Team_010 possession (Score: 25-34)
Blake Harden attempts a Layup. Wide open! Bones Quickley is 6.8 feet away. [MAN] Blake Harden misses. Rebound secured by Nikola James.

[05:20] Team_014 possession (Score: 25-34)
Collin Gasol drives, Paolo Wade stays with him. Collin Gasol attempts a Dunk. Contested by Paolo Wade (5.0 feet, MAN). Collin Gasol misses. Rebound secured by Blake Harden.

[05:04] Team_010 possession (Score: 25-34)
Vince Ingram attempts a 3Pt. Wide open! Nikola James is 8.1 feet away. [MAN] Vince Ingram misses. Rebound secured by Tracy Westbrook.

[04:50] Team_014 possession (Score: 25-34)
Collin Gasol drives and kicks out. Bones Quickley attempts a 3Pt. Contested by Blake Harden (2.1 feet, MAN). Bones Quickley misses. Rebound secured by Ben Gilgeous-Alexander.

[04:38] Team_010 possession (Score: 25-34)
Ben Gilgeous-Alexander attempts a 3Pt. Contested by Nikola James (5.1 feet, ZONE). BEN GILGEOUS-ALEXANDER MAKES IT! Assist: Paolo Wade
Score: 28-34

[04:24] Team_014 possession (Score: 28-34)
Nikola James attempts a Layup. Contested by Paolo Wade (3.9 feet, ZONE). NIKOLA JAMES MAKES IT!
Score: 28-36

[04:08] Team_010 possession (Score: 28-36)
Blake Harden attempts a 3Pt. Heavily contested by Bones Quickley (2.0 feet, MAN)! BLAKE HARDEN MAKES IT! Assist: Vince Ingram
Score: 31-36

[03:58] Team_014 possession (Score: 31-36)
Bones Quickley attempts a Layup. Wide open! Blake Harden is 6.9 feet away. [MAN] BONES QUICKLEY MAKES IT!
Score: 31-38

[03:48] Team_010 possession (Score: 31-38)
Draymond Leonard attempts a 3Pt. Wide open! Jalen Booker is 6.7 feet away. [MAN] Draymond Leonard misses. Rebound secured by Collin Gasol.

[03:36] Team_014 possession (Score: 31-38)
Collin Gasol attempts a Layup. BLOCKED BY PAOLO WADE! Ball is loose! Rebound secured by Paolo Wade.

[03:23] Team_010 possession (Score: 31-38)
Blake Harden attempts a 3Pt. Contested by Jalen Booker (4.3 feet, ZONE). BLAKE HARDEN MAKES IT! Assist: Paolo Wade
Score: 34-38

[03:06] Team_014 possession (Score: 34-38)
Bones Quickley attempts a Layup. BLOCKED BY BEN GILGEOUS-ALEXANDER! Ball deflects out of bounds off Bones Quickley.

[02:50] Team_010 possession (Score: 34-38)
Blake Harden attempts a 3Pt. Contested by Jalen Booker (5.2 feet, ZONE). BLAKE HARDEN MAKES IT! Assist: Draymond Leonard
Score: 37-38

[02:33] Team_014 possession (Score: 37-38)
FOUL! Shooting foul on Paolo Wade. Jalen Booker to the line for 2 free throws. [BONUS: 5 team fouls] (Paolo Wade: 2 personal fouls)   FT 1/2: GOOD   FT 2/2: GOOD Jalen Booker makes 2/2 from the line.
Score: 37-40

[02:18] Team_010 possession (Score: 37-40)
Blake Harden attempts a 3Pt. Contested by Bones Quickley (3.6 feet, MAN). BLAKE HARDEN MAKES IT! Assist: Draymond Leonard
Score: 40-40

[02:04] Team_014 possession (Score: 40-40)
FOUL! Shooting foul on Paolo Wade. Collin Gasol to the line for 2 free throws. [BONUS: 6 team fouls] (Paolo Wade: 3 personal fouls)   FT 1/2: GOOD   FT 2/2: GOOD Collin Gasol makes 2/2 from the line.
Score: 40-42

[01:51] Team_010 possession (Score: 40-42)
Ben Gilgeous-Alexander attempts a Midrange. Contested by Tracy Westbrook (3.3 feet, MAN). Ben Gilgeous-Alexander misses. Rebound secured by Tracy Westbrook.

[01:36] Team_014 possession (Score: 40-42)
Jalen Booker attempts a 3Pt. Heavily contested by Draymond Leonard (1.5 feet, MAN)! Jalen Booker misses. Offensive rebound by Collin Gasol! Collin Gasol puts it back in!
Score: 40-44

[01:20] Team_010 possession (Score: 40-44)
Blake Harden drives, picks up Bones Quickley. Help arrives from Tracy Westbrook! Blake Harden attempts a Layup. Heavily contested by Tracy Westbrook (0.5 feet, MAN)! BLAKE HARDEN MAKES IT!
Score: 42-44

[01:06] Team_014 possession (Score: 42-44)
Nikola James attempts a Midrange. Contested by Vince Ingram (5.2 feet, MAN). NIKOLA JAMES MAKES IT! Assist: Tracy Westbrook
Score: 42-46

[00:52] Team_010 possession (Score: 42-46)
Draymond Leonard attempts a Midrange. Contested by Bones Quickley (5.6 feet, ZONE). Draymond Leonard misses. Offensive rebound by Blake Harden! Blake Harden kicks it out.

[00:34] Team_010 possession (Score: 42-46)
FOUL! Shooting foul on Jalen Booker. Vince Ingram to the line for 2 free throws. [Team fouls: 4] (Jalen Booker: 1 personal fouls)   FT 1/2: GOOD   FT 2/2: GOOD Vince Ingram makes 2/2 from the line.
Score: 44-46

[00:22] Team_014 possession (Score: 44-46)
Nikola James attempts a Layup. Contested by Paolo Wade (5.0 feet, ZONE). NIKOLA JAMES MAKES IT! Assist: Collin Gasol
Score: 44-48

[00:06] Team_010 possession (Score: 44-48)
Blake Harden attempts a Midrange. Wide open! Bones Quickley is 6.7 feet away. [MAN] Blake Harden misses. Rebound secured by Collin Gasol.

================================================================================
                              2ND QUARTER COMPLETE                              
================================================================================

2ND QUARTER SCORE: Team_010 28, Team_014 24

BOX SCORE:
================================================================================

Team_010
--------------------------------------------------------------------------------
Player                MIN  PTS  REB  AST  TO      FG   FG%      3P   3P%
--------------------------------------------------------------------------------
Blake Harden            9   16    2    0   0   6/8    75.0     0/0   0.0
Michael Turner         15    3    1    0   0   1/3    33.3     0/0   0.0
Ben Gilgeous-Alexander    9    3    2    1   0   1/2    50.0     0/0   0.0
Draymond Leonard        9    2    0    2   0   1/2    50.0     0/0   0.0
Vince Ingram            9    2    0    1   0   1/2    50.0     0/0   0.0
RJ Young               15    0    0    0   0   0/2     0.0     0/0   0.0
Anthony Durant         15    0    1    0   0   0/1     0.0     0/0   0.0
Cade Morant            15    0    2    1   0   0/1     0.0     0/0   0.0
Paolo Wade              9    0    1    2   0   0/1     0.0     0/0   0.0

TEAM: FG: 10/22 (45.5%), 3PT: 6/10 (60.0%), REB: 9 (2 off, 7 def), AST: 7, TO: 1
TEAM FOULS: 6 [Team_014 in BONUS]


Team_014
--------------------------------------------------------------------------------
Player                MIN  PTS  REB  AST  TO      FG   FG%      3P   3P%
--------------------------------------------------------------------------------
Nikola James            9    6    2    0   0   3/3   100.0     0/0   0.0
Collin Gasol            9    5    4    1   0   3/7    42.9     0/0   0.0
Lamelo Simmons         15    3    0    0   0   1/1   100.0     0/0   0.0
Ayo Murray             15    2    3    1   0   1/2    50.0     0/0   0.0
DeMar Adebayo          15    2    1    0   0   1/2    50.0     0/0   0.0
Tracy Westbrook         9    2    2    1   0   1/1   100.0     0/0   0.0
Bones Quickley          9    2    0    1   0   1/2    50.0     0/0   0.0
Jalen Booker            9    2    0    0   0   1/1   100.0     0/0   0.0
Michael Cunningham     15    0    2    0   0   0/0     0.0     0/0   0.0
Jordan Anunoby         15    0    0    0   0   0/1     0.0     0/0   0.0

TEAM: FG: 12/20 (60.0%), 3PT: 2/3 (66.7%), REB: 14 (2 off, 12 def), AST: 4, TO: 2
TEAM FOULS: 4

================================================================================

================================================================================
                       3RD QUARTER - Team_010 vs Team_014                       
================================================================================

[12:00] Team_010 possession (Score: 44-48)
RJ Young drives and kicks out. Michael Turner attempts a 3Pt. Contested by Jordan Anunoby (5.0 feet, MAN). Michael Turner misses. Rebound secured by Ayo Murray.

[11:47] Team_014 possession (Score: 44-48)
Lamelo Simmons attempts a 3Pt. Wide open! Cade Morant is 8.1 feet away. [ZONE] Lamelo Simmons misses. Rebound secured by Anthony Durant.

[11:30] Team_010 possession (Score: 44-48)
Michael Turner loses control! Ball rolls out of bounds! TURNOVER! (dead ball)

[11:12] Team_014 possession (Score: 44-48)
DeMar Adebayo drives to the basket... DeMar Adebayo throws a bad pass out of bounds! TURNOVER! (dead ball)

[10:56] Team_010 possession (Score: 44-48)
Michael Turner makes the Layup and draws the foul on DeMar Adebayo! And-1! Michael Turner to the line for 1. [Team fouls: 1] (DeMar Adebayo: 1 personal fouls)   FT 1/1: GOOD Michael Turner makes 1/1 from the line.
Score: 47-48

[10:46] Team_014 possession (Score: 47-48)
Lamelo Simmons attempts a Midrange. Wide open! RJ Young is 6.6 feet away. [MAN] LAMELO SIMMONS MAKES IT!
Score: 47-50

[10:30] Team_010 possession (Score: 47-50)
RJ Young attempts a 3Pt. Contested by Lamelo Simmons (5.2 feet, MAN). RJ Young misses. Rebound secured by DeMar Adebayo.

[10:13] Team_014 possession (Score: 47-50)
FOUL! Reach-in foul on RJ Young during the drive. [Team fouls: 1] No free throws, side out. (RJ Young: 1 personal fouls)

[10:01] Team_014 possession (Score: 47-50)
Lamelo Simmons throws a bad pass! Stolen by RJ Young! TURNOVER! (live ball)

[09:50] Team_010 possession (Score: 47-50)
RJ Young drives, picks up Lamelo Simmons. Help arrives from Michael Cunningham! RJ Young attempts a Layup. Contested by Michael Cunningham (5.2 feet, MAN). RJ Young misses. Offensive rebound by Anthony Durant! Anthony Durant kicks it out.

[09:37] Team_010 possession (Score: 47-50)
RJ Young attempts a 3Pt. Wide open! Jordan Anunoby is 7.7 feet away. [ZONE] RJ Young misses. Offensive rebound by Cade Morant! Cade Morant kicks it out.

[09:24] Team_010 possession (Score: 47-50)
Anthony Durant drives, picks up Ayo Murray. Help arrives from Michael Cunningham! Anthony Durant attempts a Dunk. Contested by Michael Cunningham (3.3 feet, MAN). Anthony Durant misses. Rebound secured by Ayo Murray.

[09:10] Team_014 possession (Score: 47-50)
Lamelo Simmons loses the ball! Stripped by RJ Young! TURNOVER! (live ball)

[08:53] Team_010 possession (Score: 47-50)
FOUL! Shooting foul on Michael Cunningham. RJ Young to the line for 2 free throws. [Team fouls: 2] (Michael Cunningham: 1 personal fouls)   FT 1/2: GOOD   FT 2/2: GOOD RJ Young makes 2/2 from the line.
Score: 49-50

[08:38] Team_014 possession (Score: 49-50)
Ayo Murray drives and kicks out. Ayo Murray attempts a 3Pt. Heavily contested by Anthony Durant (0.7 feet, MAN)! Ayo Murray misses. Rebound secured by Anthony Durant.

[08:23] Team_010 possession (Score: 49-50)
FOUL! Shooting foul on DeMar Adebayo. Desmond Antetokounmpo to the line for 3 free throws. [Team fouls: 3] (DeMar Adebayo: 2 personal fouls)   FT 1/3: GOOD   FT 2/3: GOOD   FT 3/3: GOOD Desmond Antetokounmpo makes 3/3 from the line.
Score: 52-50

[08:10] Team_014 possession (Score: 52-50)
FOUL! Offensive foul on Lamelo Simmons! RJ Young drew the charge! [Team fouls: 4] (Lamelo Simmons: 1 personal fouls) TURNOVER! (dead ball)

[07:55] Team_010 possession (Score: 52-50)
RJ Young attempts a 3Pt. Contested by Jordan Anunoby (3.3 feet, ZONE). RJ Young misses. Offensive rebound by Cade Morant! Cade Morant kicks it out.

[07:44] Team_010 possession (Score: 52-50)
Desmond Antetokounmpo attempts a Midrange. Contested by DeMar Adebayo (4.6 feet, MAN). DESMOND ANTETOKOUNMPO MAKES IT!
Score: 54-50

[07:28] Team_014 possession (Score: 54-50)
FOUL! Shooting foul on Michael Turner. Jordan Anunoby to the line for 2 free throws. [Team fouls: 2] (Michael Turner: 1 personal fouls)   FT 1/2: GOOD   FT 2/2: GOOD Jordan Anunoby makes 2/2 from the line.
Score: 54-52

[07:16] Team_010 possession (Score: 54-52)
Michael Turner commits a violation (traveling/carry)! TURNOVER! (dead ball)

[06:59] Team_014 possession (Score: 54-52)
Michael Cunningham attempts a 3Pt. Contested by Cade Morant (5.1 feet, MAN). Michael Cunningham misses. Rebound secured by Anthony Durant.

[06:45] Team_010 possession (Score: 54-52)
Desmond Antetokounmpo attempts a Midrange. Contested by DeMar Adebayo (2.9 feet, MAN). DESMOND ANTETOKOUNMPO MAKES IT!
Score: 56-52

[06:33] Team_014 possession (Score: 56-52)
FOUL! Shooting foul on Anthony Durant. Ayo Murray to the line for 2 free throws. [Team fouls: 3] (Anthony Durant: 1 personal fouls)   FT 1/2: GOOD   FT 2/2: GOOD Ayo Murray makes 2/2 from the line.
Score: 56-54

[06:23] Team_010 possession (Score: 56-54)
Cade Morant attempts a 3Pt. Wide open! Jordan Anunoby is 7.1 feet away. [ZONE] CADE MORANT MAKES IT! Assist: Desmond Antetokounmpo
Score: 59-54

[06:09] Team_014 possession (Score: 59-54)
FOUL! Reach-in foul on Anthony Durant during the drive. [Team fouls: 4] No free throws, side out. (Anthony Durant: 2 personal fouls)

[05:58] Team_014 possession (Score: 59-54)
DeMar Adebayo makes the Layup and draws the foul on Desmond Antetokounmpo! And-1! DeMar Adebayo to the line for 1. [BONUS: 5 team fouls] (Desmond Antetokounmpo: 1 personal fouls)   FT 1/1: MISS DeMar Adebayo makes 0/1 from the line. Rebound secured by Cade Morant.
Score: 59-56

[05:45] Team_010 possession (Score: 59-56)
FOUL! Shooting foul on Michael Cunningham. Desmond Antetokounmpo to the line for 2 free throws. [BONUS: 5 team fouls] (Michael Cunningham: 2 personal fouls)   FT 1/2: GOOD   FT 2/2: GOOD Desmond Antetokounmpo makes 2/2 from the line.
Score: 61-56

[05:30] Team_014 possession (Score: 61-56)
DeMar Adebayo loses control! Ball rolls out of bounds! TURNOVER! (dead ball)

[05:15] Team_010 possession (Score: 61-56)
Michael Turner attempts a Layup. Contested by Jordan Anunoby (4.4 feet, MAN). MICHAEL TURNER MAKES IT!
Score: 63-56

[04:58] Team_014 possession (Score: 63-56)
Jordan Anunoby attempts a 3Pt. Contested by Michael Turner (4.0 feet, MAN). JORDAN ANUNOBY MAKES IT! Assist: Michael Cunningham
Score: 63-59

[04:44] Team_010 possession (Score: 63-59)
Cade Morant attempts a Layup. Contested by Michael Cunningham (3.6 feet, MAN). Cade Morant misses. Rebound secured by Ayo Murray.

[04:29] Team_014 possession (Score: 63-59)
DeMar Adebayo loses the ball! Stripped by Desmond Antetokounmpo! TURNOVER! (live ball)

[04:18] Team_010 possession (Score: 63-59)
Anthony Durant loses the ball! Stripped by Ayo Murray! TURNOVER! (live ball)

[04:08] Team_014 possession (Score: 63-59)
FOUL! Shooting foul on Desmond Antetokounmpo. Lamelo Simmons to the line for 2 free throws. [BONUS: 6 team fouls] (Desmond Antetokounmpo: 2 personal fouls)   FT 1/2: GOOD   FT 2/2: GOOD Lamelo Simmons makes 2/2 from the line.
Score: 63-61

[03:50] Team_010 possession (Score: 63-61)
Michael Turner makes the Dunk and draws the foul on DeMar Adebayo! And-1! Michael Turner to the line for 1. [BONUS: 6 team fouls] (DeMar Adebayo: 3 personal fouls)   FT 1/1: MISS Michael Turner makes 0/1 from the line. Rebound secured by DeMar Adebayo.
Score: 65-61

[03:33] Team_014 possession (Score: 65-61)
Ayo Murray drives to the basket... FOUL! Offensive foul on Ayo Murray! Anthony Durant drew the charge! [Team fouls: 7] (Ayo Murray: 1 personal fouls) TURNOVER! (dead ball)

[03:18] Team_010 possession (Score: 65-61)
Anthony Durant drives to the basket... Anthony Durant commits a violation (traveling/carry)! TURNOVER! (dead ball)

[03:18] Substitution (Team_014): Lamelo Simmons OUT → Tracy Westbrook IN (stamina_rule2)

[03:04] Team_014 possession (Score: 65-61)
Ayo Murray drives, Anthony Durant stays with him. Ayo Murray attempts a Layup. Contested by Anthony Durant (2.3 feet, MAN). Ayo Murray misses. Rebound secured by Michael Turner.

[02:52] Team_010 possession (Score: 65-61)
Desmond Antetokounmpo attempts a 3Pt. Contested by DeMar Adebayo (5.9 feet, MAN). Desmond Antetokounmpo misses. Rebound secured by Michael Cunningham.

[02:33] Team_014 possession (Score: 65-61)
Tracy Westbrook attempts a 3Pt. Heavily contested by Cade Morant (0.8 feet, ZONE)! Tracy Westbrook misses. Offensive rebound by Ayo Murray! Ayo Murray kicks it out.

[02:19] Team_014 possession (Score: 65-61)
Jordan Anunoby attempts a Midrange. Contested by Michael Turner (2.3 feet, MAN). JORDAN ANUNOBY MAKES IT! Assist: Ayo Murray
Score: 65-63

[02:03] Team_010 possession (Score: 65-63)
Cade Morant drives and kicks out. Anthony Durant attempts a 3Pt. Contested by Ayo Murray (3.3 feet, MAN). Anthony Durant misses. Rebound secured by Michael Cunningham.

[01:46] Team_014 possession (Score: 65-63)
Michael Cunningham attempts a 3Pt. Contested by Cade Morant (4.3 feet, MAN). Michael Cunningham misses. Rebound secured by Anthony Durant.

[01:31] Team_010 possession (Score: 65-63)
RJ Young attempts a 3Pt. Wide open! Tracy Westbrook is 6.9 feet away. [MAN] RJ Young misses. Offensive rebound by Anthony Durant! Anthony Durant kicks it out.

[01:17] Team_010 possession (Score: 65-63)
RJ Young attempts a 3Pt. Contested by Jordan Anunoby (2.2 feet, ZONE). RJ YOUNG MAKES IT! Assist: Desmond Antetokounmpo
Score: 68-63

[01:02] Team_014 possession (Score: 68-63)
Michael Cunningham attempts a 3Pt. Contested by Cade Morant (5.3 feet, ZONE). Michael Cunningham misses. Offensive rebound by DeMar Adebayo! DeMar Adebayo kicks it out.

[00:51] Team_014 possession (Score: 68-63)
Ayo Murray throws a bad pass out of bounds! TURNOVER! (dead ball)

[00:51] Substitution (Team_010): Cade Morant OUT → Draymond Leonard IN (stamina_rule2)

[00:51] Substitution (Team_010): Michael Turner OUT → Blake Harden IN (stamina_rule2)

[00:51] Substitution (Team_010): RJ Young OUT → Ben Gilgeous-Alexander IN (stamina_rule2)

[00:51] Substitution (Team_010): Desmond Antetokounmpo OUT → Vince Ingram IN (stamina_rule2)

[00:51] Substitution (Team_010): Anthony Durant OUT → Paolo Wade IN (stamina_rule2)

[00:51] Substitution (Team_014): Michael Cunningham OUT → Jalen Booker IN (stamina_rule2)

[00:51] Substitution (Team_014): Jordan Anunoby OUT → Bones Quickley IN (stamina_rule2)

[00:51] Substitution (Team_014): DeMar Adebayo OUT → Nikola James IN (stamina_rule2)

[00:51] Substitution (Team_014): Ayo Murray OUT → Collin Gasol IN (stamina_rule2)

[00:35] Team_010 possession (Score: 68-63)
FOUL! Holding foul on Collin Gasol. [IN THE BONUS! 8 team fouls] Paolo Wade to the line for 2 free throws. (Collin Gasol: 1 personal fouls)   FT 1/2: GOOD   FT 2/2: GOOD Paolo Wade makes 2/2 from the line.
Score: 70-63

[00:18] Team_014 possession (Score: 70-63)
Jalen Booker drives, picks up Draymond Leonard. Help arrives from Ben Gilgeous-Alexander! Jalen Booker attempts a Dunk. Contested by Ben Gilgeous-Alexander (4.2 feet, MAN). JALEN BOOKER MAKES IT!
Score: 70-65

[00:04] Team_010 possession (Score: 70-65)
Draymond Leonard attempts a Midrange. Wide open! Jalen Booker is 8.9 feet away. [MAN] Draymond Leonard misses. Rebound secured by Nikola James.

================================================================================
                              3RD QUARTER COMPLETE                              
================================================================================

3RD QUARTER SCORE: Team_010 26, Team_014 17

BOX SCORE:
================================================================================

Team_010
--------------------------------------------------------------------------------
Player                MIN  PTS  REB  AST  TO      FG   FG%      3P   3P%
--------------------------------------------------------------------------------
Desmond Antetokounmpo   27    9    0    2   0   4/5    80.0     0/0   0.0
RJ Young               27    5    0    0   0   2/4    50.0     0/0   0.0
Michael Turner         27    5    1    0   0   2/3    66.7     0/0   0.0
Cade Morant            27    3    3    0   0   1/3    33.3     0/0   0.0
Paolo Wade             10    2    0    0   0   1/1   100.0     0/0   0.0
Anthony Durant         27    0    6    0   0   0/1     0.0     0/0   0.0
Draymond Leonard       10    0    0    0   0   0/1     0.0     0/0   0.0

TEAM: FG: 10/18 (55.6%), 3PT: 3/5 (60.0%), REB: 10 (4 off, 6 def), AST: 2, TO: 4
TEAM FOULS: 6 [Team_014 in BONUS]


Team_014
--------------------------------------------------------------------------------
Player                MIN  PTS  REB  AST  TO      FG   FG%      3P   3P%
--------------------------------------------------------------------------------
Jordan Anunoby         27    7    0    0   0   3/3   100.0     0/0   0.0
Lamelo Simmons         24    4    0    0   0   2/3    66.7     0/0   0.0
Ayo Murray             27    2    4    1   0   1/3    33.3     0/0   0.0
Jalen Booker           10    2    0    0   0   1/1   100.0     0/0   0.0
DeMar Adebayo          27    0    3    0   0   0/1     0.0     0/0   0.0
Michael Cunningham     27    0    2    1   0   0/2     0.0     0/0   0.0
Nikola James           10    0    1    0   0   0/0     0.0     0/0   0.0

TEAM: FG: 7/13 (53.8%), 3PT: 1/4 (25.0%), REB: 10 (2 off, 8 def), AST: 2, TO: 8
TEAM FOULS: 8 [Team_010 in BONUS]

================================================================================

================================================================================
                       4TH QUARTER - Team_010 vs Team_014                       
================================================================================

[12:00] Team_010 possession (Score: 70-65)
Michael Turner attempts a 3Pt. Contested by Jordan Anunoby (5.4 feet, ZONE). MICHAEL TURNER MAKES IT! Assist: Cade Morant
Score: 73-65

[11:47] Team_014 possession (Score: 73-65)
Lamelo Simmons drives to the basket... FOUL! Offensive foul on Lamelo Simmons! Anthony Durant drew the charge! [Team fouls: 1] (Lamelo Simmons: 1 personal fouls) TURNOVER! (dead ball)

[11:37] Team_010 possession (Score: 73-65)
Anthony Durant drives and kicks out. Anthony Durant attempts a 3Pt. Heavily contested by Jordan Anunoby (1.7 feet, ZONE)! ANTHONY DURANT MAKES IT!
Score: 76-65

[11:19] Team_014 possession (Score: 76-65)
Lamelo Simmons attempts a Layup. Contested by Anthony Durant (2.5 feet, ZONE). Lamelo Simmons misses. Rebound secured by Anthony Durant.

[11:05] Team_010 possession (Score: 76-65)
Desmond Antetokounmpo drives, picks up DeMar Adebayo. Help arrives from Michael Cunningham! Desmond Antetokounmpo attempts a Dunk. Heavily contested by Michael Cunningham (1.6 feet, MAN)! DESMOND ANTETOKOUNMPO MAKES IT! Assist: RJ Young
Score: 78-65

[10:50] Team_014 possession (Score: 78-65)
Ayo Murray attempts a Layup. Contested by Anthony Durant (3.2 feet, MAN). Ayo Murray misses. Rebound secured by Michael Turner.

[10:34] Team_010 possession (Score: 78-65)
RJ Young attempts a Midrange. Contested by Lamelo Simmons (3.3 feet, MAN). RJ YOUNG MAKES IT!
Score: 80-65

[10:22] Team_014 possession (Score: 80-65)
DeMar Adebayo loses control! Ball rolls out of bounds! TURNOVER! (dead ball)

[10:22] Substitution (Team_010): Cade Morant OUT → Draymond Leonard IN (stamina_rule2)

[10:22] Substitution (Team_010): Michael Turner OUT → Blake Harden IN (stamina_rule2)

[10:22] Substitution (Team_010): RJ Young OUT → Ben Gilgeous-Alexander IN (stamina_rule2)

[10:22] Substitution (Team_010): Desmond Antetokounmpo OUT → Vince Ingram IN (stamina_rule2)

[10:22] Substitution (Team_010): Anthony Durant OUT → Paolo Wade IN (stamina_rule2)

[10:22] Substitution (Team_014): Michael Cunningham OUT → Jalen Booker IN (stamina_rule2)

[10:22] Substitution (Team_014): Jordan Anunoby OUT → Bones Quickley IN (stamina_rule2)

[10:22] Substitution (Team_014): DeMar Adebayo OUT → Nikola James IN (stamina_rule2)

[10:22] Substitution (Team_014): Ayo Murray OUT → Collin Gasol IN (stamina_rule2)

[10:06] Team_010 possession (Score: 80-65)
Blake Harden attempts a Midrange. Contested by Bones Quickley (4.3 feet, MAN). Blake Harden misses. Rebound secured by Collin Gasol.

[09:51] Team_014 possession (Score: 80-65)
FOUL! Reach-in foul on Paolo Wade during the drive. [Team fouls: 1] No free throws, side out. (Paolo Wade: 1 personal fouls)

[09:41] Team_014 possession (Score: 80-65)
Jalen Booker attempts a Layup. Contested by Paolo Wade (4.0 feet, ZONE). JALEN BOOKER MAKES IT!
Score: 80-67

[09:29] Team_010 possession (Score: 80-67)
Paolo Wade attempts a Midrange. BLOCKED BY COLLIN GASOL! Ball deflects out of bounds off Paolo Wade.

[09:11] Team_014 possession (Score: 80-67)
Collin Gasol drives and kicks out. Jalen Booker attempts a Midrange. Contested by Draymond Leonard (4.5 feet, MAN). Jalen Booker misses. Rebound secured by Blake Harden.

[08:53] Team_010 possession (Score: 80-67)
Paolo Wade drives, Collin Gasol stays with him. Paolo Wade attempts a Layup. Contested by Collin Gasol (4.6 feet, MAN). Paolo Wade misses. Offensive rebound by Blake Harden! Blake Harden kicks it out.

[08:41] Team_010 possession (Score: 80-67)
FOUL! Reach-in foul on Collin Gasol during the drive. [Team fouls: 2] No free throws, side out. (Collin Gasol: 1 personal fouls)

[08:26] Team_010 possession (Score: 80-67)
Paolo Wade drives and kicks out. Paolo Wade attempts a 3Pt. Wide open! Collin Gasol is 6.3 feet away. [MAN] Paolo Wade misses. Rebound secured by Lamelo Simmons.

[08:14] Team_014 possession (Score: 80-67)
Nikola James attempts a 3Pt. Wide open! Vince Ingram is 7.2 feet away. [MAN] NIKOLA JAMES MAKES IT! Assist: Jalen Booker
Score: 80-70

[08:00] Team_010 possession (Score: 80-70)
Draymond Leonard drives and kicks out. Vince Ingram attempts a 3Pt. Wide open! Jalen Booker is 7.2 feet away. [ZONE] Vince Ingram misses. Rebound secured by Lamelo Simmons.

[07:40] Team_014 possession (Score: 80-70)
Jalen Booker attempts a 3Pt. Contested by Draymond Leonard (3.7 feet, MAN). Jalen Booker misses. Offensive rebound by Nikola James! Nikola James kicks it out.

[07:25] Team_014 possession (Score: 80-70)
Collin Gasol attempts a 3Pt. Wide open! Paolo Wade is 6.9 feet away. [MAN] Collin Gasol misses. Rebound secured by Ben Gilgeous-Alexander.

[07:11] Team_010 possession (Score: 80-70)
Blake Harden attempts a Midrange. Wide open! Bones Quickley is 7.4 feet away. [MAN] Blake Harden misses. Offensive rebound by Paolo Wade! Paolo Wade kicks it out.

[07:01] Team_010 possession (Score: 80-70)
FOUL! Offensive foul on Paolo Wade! Collin Gasol drew the charge! [Team fouls: 2] (Paolo Wade: 2 personal fouls) TURNOVER! (dead ball)

[06:48] Team_014 possession (Score: 80-70)
Nikola James attempts a Midrange. Contested by Paolo Wade (2.8 feet, ZONE). NIKOLA JAMES MAKES IT! Assist: Jalen Booker
Score: 80-72

[06:31] Team_010 possession (Score: 80-72)
Draymond Leonard attempts a 3Pt. Contested by Jalen Booker (4.1 feet, ZONE). Draymond Leonard misses. FOUL! Loose ball foul on Lamelo Simmons during the rebound battle. [Team fouls: 3] No free throws, side out. (Lamelo Simmons: 2 personal fouls)

[06:19] Team_010 possession (Score: 80-72)
Ben Gilgeous-Alexander attempts a 3Pt. Heavily contested by Jalen Booker (1.7 feet, ZONE)! Ben Gilgeous-Alexander misses. Rebound secured by Nikola James.

[06:05] Team_014 possession (Score: 80-72)
Bones Quickley commits a violation (traveling/carry)! TURNOVER! (dead ball)

[06:05] Substitution (Team_014): Lamelo Simmons OUT → Tracy Westbrook IN (stamina_rule2)

[05:46] Team_010 possession (Score: 80-72)
Paolo Wade attempts a Layup. Contested by Collin Gasol (5.1 feet, MAN). Paolo Wade misses. Rebound secured by Nikola James.

[05:31] Team_014 possession (Score: 80-72)
Tracy Westbrook drives, picks up Paolo Wade. Help arrives from Blake Harden! Tracy Westbrook attempts a Dunk. Contested by Blake Harden (3.2 feet, ZONE). TRACY WESTBROOK MAKES IT!
Score: 80-74

[05:13] Team_010 possession (Score: 80-74)
Paolo Wade attempts a Midrange. Contested by Collin Gasol (5.3 feet, MAN). Paolo Wade misses. Rebound secured by Tracy Westbrook.

[04:58] Team_014 possession (Score: 80-74)
Nikola James attempts a Midrange. Wide open! Ben Gilgeous-Alexander is 6.9 feet away. [ZONE] NIKOLA JAMES MAKES IT! Assist: Jalen Booker
Score: 80-76

[04:45] Team_010 possession (Score: 80-76)
Paolo Wade attempts a Layup. Heavily contested by Collin Gasol (1.3 feet, MAN)! PAOLO WADE MAKES IT! Assist: Vince Ingram
Score: 82-76

[04:30] Team_014 possession (Score: 82-76)
Tracy Westbrook loses the ball! Stripped by Ben Gilgeous-Alexander! TURNOVER! (live ball)

[04:16] Team_010 possession (Score: 82-76)
Draymond Leonard attempts a 3Pt. Wide open! Jalen Booker is 7.0 feet away. [MAN] DRAYMOND LEONARD MAKES IT! Assist: Ben Gilgeous-Alexander
Score: 85-76

[04:02] Team_014 possession (Score: 85-76)
Bones Quickley attempts a 3Pt. Contested by Blake Harden (3.3 feet, MAN). Bones Quickley misses. Offensive rebound by Collin Gasol! Collin Gasol's putback is no good. Rebound secured by Blake Harden.

[03:48] Team_010 possession (Score: 85-76)
Draymond Leonard attempts a 3Pt. Contested by Jalen Booker (4.3 feet, MAN). DRAYMOND LEONARD MAKES IT! Assist: Blake Harden
Score: 88-76

[03:34] Team_014 possession (Score: 88-76)
Jalen Booker drives, picks up Paolo Wade. Help arrives from Blake Harden! Jalen Booker attempts a Layup. Wide open! Blake Harden is 6.0 feet away. [ZONE] JALEN BOOKER MAKES IT! Assist: Collin Gasol
Score: 88-78

[03:21] Team_010 possession (Score: 88-78)
Paolo Wade drives, Collin Gasol stays with him. Paolo Wade attempts a Layup. Contested by Collin Gasol (4.3 feet, MAN). Paolo Wade misses. Rebound secured by Nikola James.

[03:02] Team_014 possession (Score: 88-78)
Jalen Booker drives, picks up Paolo Wade. Help arrives from Blake Harden! Jalen Booker attempts a Dunk. Heavily contested by Blake Harden (0.5 feet, ZONE)! JALEN BOOKER MAKES IT! Assist: Nikola James
Score: 88-80

[02:49] Team_010 possession (Score: 88-80)
Draymond Leonard attempts a Midrange. Wide open! Bones Quickley is 10.0 feet away. [ZONE] DRAYMOND LEONARD MAKES IT!
Score: 90-80

[02:34] Team_014 possession (Score: 90-80)
Jalen Booker attempts a Midrange. Wide open! Draymond Leonard is 7.4 feet away. [MAN] Jalen Booker misses. Offensive rebound by Collin Gasol! Collin Gasol puts it back in!
Score: 90-82

[02:20] Team_010 possession (Score: 90-82)
Draymond Leonard attempts a Midrange. Wide open! Tracy Westbrook is 8.2 feet away. [ZONE] Draymond Leonard misses. Rebound secured by Nikola James.

[02:07] Team_014 possession (Score: 90-82)
Nikola James drives, Vince Ingram stays with him. Nikola James attempts a Dunk. Heavily contested by Vince Ingram (0.8 feet, MAN)! NIKOLA JAMES MAKES IT!
Score: 90-84

[01:52] Team_010 possession (Score: 90-84)
Ben Gilgeous-Alexander attempts a 3Pt. Wide open! Jalen Booker is 7.0 feet away. [ZONE] Ben Gilgeous-Alexander misses. Rebound secured by Tracy Westbrook.

[01:35] Team_014 possession (Score: 90-84)
Nikola James attempts a Layup. Contested by Vince Ingram (4.2 feet, ZONE). Nikola James misses. Offensive rebound by Nikola James! Nikola James kicks it out.

[01:21] Team_014 possession (Score: 90-84)
Jalen Booker drives and kicks out. Jalen Booker attempts a 3Pt. Wide open! Draymond Leonard is 6.9 feet away. [MAN] JALEN BOOKER MAKES IT! Assist: Bones Quickley
Score: 90-87

[01:06] Team_010 possession (Score: 90-87)
Vince Ingram attempts a 3Pt. Contested by Jalen Booker (4.4 feet, ZONE). VINCE INGRAM MAKES IT! Assist: Blake Harden
Score: 93-87

[00:55] Team_014 possession (Score: 93-87)
Nikola James drives, Paolo Wade stays with him. Nikola James attempts a Dunk. Contested by Paolo Wade (3.1 feet, ZONE). Nikola James misses. Offensive rebound by Nikola James! Nikola James kicks it out.

[00:37] Team_014 possession (Score: 93-87)
Nikola James throws a bad pass out of bounds! TURNOVER! (dead ball)

[00:24] Team_010 possession (Score: 93-87)
FOUL! Reach-in foul on Collin Gasol during the drive. [Team fouls: 4] No free throws, side out. (Collin Gasol: 2 personal fouls)

[00:05] Team_010 possession (Score: 93-87)
Paolo Wade attempts a Layup. Wide open! Collin Gasol is 7.0 feet away. [ZONE] PAOLO WADE MAKES IT! Assist: Draymond Leonard
Score: 95-87

================================================================================
                              4TH QUARTER COMPLETE                              
================================================================================

4TH QUARTER SCORE: Team_010 25, Team_014 22

BOX SCORE:
================================================================================

Team_010
--------------------------------------------------------------------------------
Player                MIN  PTS  REB  AST  TO      FG   FG%      3P   3P%
--------------------------------------------------------------------------------
Draymond Leonard       20    8    0    1   0   3/5    60.0     0/0   0.0
Paolo Wade             20    4    2    0   0   2/7    28.6     0/0   0.0
Michael Turner         29    3    1    0   0   1/1   100.0     0/0   0.0
Anthony Durant         29    3    1    0   0   1/1   100.0     0/0   0.0
Vince Ingram           20    3    0    1   0   1/1   100.0     0/0   0.0
Desmond Antetokounmpo   29    2    0    0   0   1/1   100.0     0/0   0.0
RJ Young               29    2    0    1   0   1/1   100.0     0/0   0.0
Cade Morant            29    0    0    1   0   0/0     0.0     0/0   0.0
Blake Harden           20    0    3    2   0   0/1     0.0     0/0   0.0
Ben Gilgeous-Alexander   20    0    1    1   0   0/2     0.0     0/0   0.0

TEAM: FG: 10/20 (50.0%), 3PT: 4/6 (66.7%), REB: 7 (3 off, 4 def), AST: 7, TO: 1
TEAM FOULS: 2


Team_014
--------------------------------------------------------------------------------
Player                MIN  PTS  REB  AST  TO      FG   FG%      3P   3P%
--------------------------------------------------------------------------------
Jalen Booker           20    9    0    3   0   4/4   100.0     0/0   0.0
Nikola James           20    9    7    1   0   4/4   100.0     0/0   0.0
Collin Gasol           20    2    2    1   0   1/3    33.3     0/0   0.0
Tracy Westbrook        18    2    2    0   0   1/1   100.0     0/0   0.0
Lamelo Simmons         31    0    2    0   0   0/1     0.0     0/0   0.0
Ayo Murray             29    0    0    0   0   0/1     0.0     0/0   0.0
Bones Quickley         20    0    0    1   0   0/1     0.0     0/0   0.0

TEAM: FG: 10/15 (66.7%), 3PT: 1/3 (33.3%), REB: 14 (5 off, 9 def), AST: 6, TO: 5
TEAM FOULS: 4

================================================================================

================================================================================
                               FULL GAME COMPLETE                               
================================================================================

FINAL SCORE: Team_010 95, Team_014 87

SCORING BY QUARTER:
--------------------------------------------------------------------------------
Team                     Q1     Q2     Q3     Q4    FINAL
--------------------------------------------------------------------------------
Team_010                 16     28     26     25       95
Team_014                 24     24     17     22       87
--------------------------------------------------------------------------------

FULL GAME BOX SCORE:
================================================================================

Team_010
--------------------------------------------------------------------------------
Player                MIN  PTS  REB  AST  TO      FG   FG%      3P   3P%      FT STL BLK
--------------------------------------------------------------------------------
Cade Morant            29    5    9    6   1   2/7    28.6   1/4    25.0   0/0     0   1
Michael Turner         29   14    5    3   4   5/10   50.0   3/4    75.0   1/2     0   0
RJ Young               29    7    0    1   1   3/8    37.5   1/4    25.0   2/3     2   0
Desmond Antetokounmpo   29   20    1    2   0   9/12   75.0   2/3    66.7   5/5     2   0
Anthony Durant         29    5   11    0   2   2/6    33.3   0/0     0.0   0/0     0   1
Draymond Leonard       20   10    0    3   0   5/9    55.6   2/3    66.7   0/0     0   0
Blake Harden           20   16    5    2   0   5/8    62.5   4/4   100.0   0/0     0   0
Ben Gilgeous-Alexander   20    3    4    2   0   1/4    25.0   1/3    33.3   0/0     1   1
Vince Ingram           20    5    0    2   0   2/4    50.0   1/2    50.0   2/2     0   0
Paolo Wade             20    6    3    2   2   2/8    25.0   0/0     0.0   2/2     0   1

TEAM: FG: 37/77 (48.1%), 3PT: 15/27 (55.6%), REB: 37 (11 off, 26 def), AST: 23, TO: 10


Team_014
--------------------------------------------------------------------------------
Player                MIN  PTS  REB  AST  TO      FG   FG%      3P   3P%      FT STL BLK
--------------------------------------------------------------------------------
Lamelo Simmons         31   15    2    2   6   7/9    77.8   2/3    66.7   3/3     0   0
Michael Cunningham     29    2    5    3   2   1/5    20.0   0/3     0.0   0/0     0   0
Jordan Anunoby         29   13    0    0   1   4/5    80.0   2/2   100.0   2/2     0   0
DeMar Adebayo          29    2   10    0   4   1/4    25.0   0/0     0.0   0/1     1   1
Ayo Murray             29    6   13    2   1   3/13   23.1   0/0     0.0   5/6     1   0
Jalen Booker           20   13    0    4   0   8/8   100.0   1/1   100.0   2/2     0   0
Bones Quickley         20    2    0    2   1   1/3    33.3   0/1     0.0   0/0     0   0
Nikola James           20   15   10    1   1   7/7   100.0   1/1   100.0   0/0     0   0
Collin Gasol           20   12    6    2   0   4/11   36.4   1/4    25.0   3/4     0   1
Tracy Westbrook        18    4    5    1   1   2/2   100.0   0/0     0.0   0/0     0   0

TEAM: FG: 38/67 (56.7%), 3PT: 7/15 (46.7%), REB: 52 (13 off, 39 def), AST: 17, TO: 17

================================================================================
