================================================================================
                        FULL GAME - Team_062 vs Team_068                        
================================================================================

================================================================================
                       1ST QUARTER - Team_062 vs Team_068                       
================================================================================

[12:00] Team_062 possession (Score: 0-0)
Jalen Reaves drives, Gary Simons stays with him. Jalen Reaves attempts a Layup. Heavily contested by Gary Simons (0.8 feet, ZONE)! Jalen Reaves misses. Rebound secured by Jaren Johnson.

[11:49] Team_068 possession (Score: 0-0)
Nikola Ginobili attempts a Layup. Contested by Jalen Reaves (4.6 feet, ZONE). Nikola Ginobili misses. Rebound secured by Michael Hyland.

[11:37] Team_062 possession (Score: 0-0)
Jalen Reaves attempts a Layup. BLOCKED BY GARY SIMONS! Ball is loose! Rebound secured by Gary Simons.

[11:22] Team_068 possession (Score: 0-0)
Jaren Johnson attempts a 3Pt. Wide open! Michael Hyland is 7.2 feet away. [MAN] Jaren Johnson misses. Rebound secured by Michael Hyland.

[11:12] Team_062 possession (Score: 0-0)
FOUL! Reach-in foul on Gary Simons during the drive. [Team fouls: 1] No free throws, side out. (Gary Simons: 1 personal fouls)

[10:58] Team_062 possession (Score: 0-0)
Chris Bird drives, Gary Simons stays with him. Chris Bird attempts a Layup. Heavily contested by Gary Simons (1.3 feet, ZONE)! Chris Bird misses. Rebound secured by Gary Simons.

[10:43] Team_068 possession (Score: 0-0)
FOUL! Shooting foul on Jalen Reaves. Malcolm Herro to the line for 2 free throws. [Team fouls: 1] (Jalen Reaves: 1 personal fouls)   FT 1/2: MISS   FT 2/2: GOOD Malcolm Herro makes 1/2 from the line.
Score: 0-1

[10:28] Team_062 possession (Score: 0-1)
Kawhi Thompson attempts a 3Pt. Wide open! Jaren Johnson is 7.2 feet away. [ZONE] KAWHI THOMPSON MAKES IT!
Score: 3-1

[10:12] Team_068 possession (Score: 3-1)
Nikola Ginobili attempts a Midrange. Contested by Jalen Reaves (3.2 feet, MAN). NIKOLA GINOBILI MAKES IT! Assist: Jaren Johnson
Score: 3-3

[09:55] Team_062 possession (Score: 3-3)
Chris Bird attempts a 3Pt. Wide open! Zion Anunoby is 8.1 feet away. [ZONE] Chris Bird misses. Rebound secured by Nikola Ginobili.

[09:37] Team_068 possession (Score: 3-3)
Malcolm Herro attempts a 3Pt. Contested by RJ Williamson (4.1 feet, MAN). Malcolm Herro misses. Rebound secured by Kawhi Thompson.

[09:21] Team_062 possession (Score: 3-3)
Chris Bird attempts a 3Pt. Contested by Zion Anunoby (4.7 feet, MAN). Chris Bird misses. Rebound secured by Gary Simons.

[09:04] Team_068 possession (Score: 3-3)
Jaren Johnson attempts a 3Pt. Contested by Michael Hyland (5.1 feet, MAN). Jaren Johnson misses. Rebound secured by Kawhi Thompson.

[08:52] Team_062 possession (Score: 3-3)
Kawhi Thompson makes the Midrange and draws the foul on Gary Simons! And-1! Kawhi Thompson to the line for 1. [Team fouls: 2] (Gary Simons: 2 personal fouls)   FT 1/1: GOOD Kawhi Thompson makes 1/1 from the line.
Score: 6-3

[08:42] Team_068 possession (Score: 6-3)
Jaren Johnson attempts a Midrange. Contested by Michael Hyland (4.7 feet, MAN). JAREN JOHNSON MAKES IT!
Score: 6-5

[08:29] Team_062 possession (Score: 6-5)
Michael Hyland drives and kicks out. RJ Williamson attempts a Midrange. Contested by Malcolm Herro (3.4 feet, MAN). RJ WILLIAMSON MAKES IT!
Score: 8-5

[08:11] Team_068 possession (Score: 8-5)
Malcolm Herro attempts a 3Pt. Wide open! RJ Williamson is 6.4 feet away. [MAN] MALCOLM HERRO MAKES IT! Assist: Gary Simons
Score: 8-8

[07:54] Team_062 possession (Score: 8-8)
RJ Williamson attempts a 3Pt. Contested by Malcolm Herro (3.9 feet, MAN). RJ Williamson misses. Rebound secured by Gary Simons.

[07:43] Team_068 possession (Score: 8-8)
FOUL! Reach-in foul on Jalen Reaves during the drive. [Team fouls: 2] No free throws, side out. (Jalen Reaves: 2 personal fouls)

[07:26] Team_068 possession (Score: 8-8)
Nikola Ginobili attempts a Midrange. Wide open! Jalen Reaves is 6.4 feet away. [MAN] Nikola Ginobili misses. Rebound secured by Jalen Reaves.

[07:08] Team_062 possession (Score: 8-8)
RJ Williamson attempts a 3Pt. Wide open! Malcolm Herro is 6.0 feet away. [MAN] RJ WILLIAMSON MAKES IT!
Score: 11-8

[06:51] Team_068 possession (Score: 11-8)
Gary Simons drives, picks up Jalen Reaves. Help arrives from Chris Bird! Gary Simons attempts a Layup. Contested by Chris Bird (4.7 feet, ZONE). Gary Simons misses. Offensive rebound by Jaren Johnson! Jaren Johnson kicks it out.

[06:39] Team_068 possession (Score: 11-8)
Jaren Johnson attempts a 3Pt. Contested by Kawhi Thompson (2.8 feet, ZONE). Jaren Johnson misses. Rebound secured by Jalen Reaves.

[06:26] Team_062 possession (Score: 11-8)
Chris Bird drives to the basket... Chris Bird throws a bad pass! Stolen by Zion Anunoby! TURNOVER! (live ball)

[06:13] Team_068 possession (Score: 11-8)
Jaren Johnson drives to the basket... FOUL! Offensive foul on Jaren Johnson! Michael Hyland drew the charge! [Team fouls: 3] (Jaren Johnson: 1 personal fouls) TURNOVER! (dead ball)

[05:55] Team_062 possession (Score: 11-8)
RJ Williamson attempts a Layup. BLOCKED BY MALCOLM HERRO! Ball is loose! Rebound secured by Jaren Johnson.

[05:45] Team_068 possession (Score: 11-8)
Malcolm Herro attempts a 3Pt. Contested by RJ Williamson (4.0 feet, MAN). Malcolm Herro misses. Rebound secured by Kawhi Thompson.

[05:31] Team_062 possession (Score: 11-8)
FOUL! Shooting foul on Nikola Ginobili. Jalen Reaves to the line for 2 free throws. [Team fouls: 4] (Nikola Ginobili: 1 personal fouls)   FT 1/2: GOOD   FT 2/2: GOOD Jalen Reaves makes 2/2 from the line.
Score: 13-8

[05:14] Team_068 possession (Score: 13-8)
Zion Anunoby attempts a Midrange. Contested by Kawhi Thompson (4.1 feet, ZONE). Zion Anunoby misses. Rebound secured by Jalen Reaves.

[05:03] Team_062 possession (Score: 13-8)
Chris Bird makes the Layup and draws the foul on Zion Anunoby! And-1! Chris Bird to the line for 1. [BONUS: 5 team fouls] (Zion Anunoby: 1 personal fouls)   FT 1/1: GOOD Chris Bird makes 1/1 from the line.
Score: 16-8

[04:49] Team_068 possession (Score: 16-8)
Zion Anunoby attempts a 3Pt. Contested by Michael Hyland (5.9 feet, ZONE). Zion Anunoby misses. Offensive rebound by Nikola Ginobili! Nikola Ginobili puts it back in!
Score: 16-10

[04:33] Team_062 possession (Score: 16-10)
Chris Bird attempts a Midrange. Wide open! Zion Anunoby is 8.1 feet away. [MAN] CHRIS BIRD MAKES IT! Assist: RJ Williamson
Score: 18-10

[04:16] Team_068 possession (Score: 18-10)
Malcolm Herro drives and kicks out. Malcolm Herro attempts a 3Pt. Wide open! RJ Williamson is 8.0 feet away. [MAN] MALCOLM HERRO MAKES IT! Assist: Gary Simons
Score: 18-13

[03:59] Team_062 possession (Score: 18-13)
Chris Bird drives and kicks out. RJ Williamson attempts a 3Pt. Contested by Zion Anunoby (5.3 feet, ZONE). RJ Williamson misses. Rebound secured by Jaren Johnson.

[03:42] Team_068 possession (Score: 18-13)
Jaren Johnson makes the 3Pt and draws the foul on Michael Hyland! And-1! Jaren Johnson to the line for 1. [Team fouls: 3] (Michael Hyland: 1 personal fouls)   FT 1/1: GOOD Jaren Johnson makes 1/1 from the line.
Score: 18-17

[03:29] Team_062 possession (Score: 18-17)
FOUL! Reach-in foul on Gary Simons during the drive. [IN THE BONUS! 6 team fouls] Jalen Reaves to the line for 2 free throws. (Gary Simons: 3 personal fouls)   FT 1/2: GOOD   FT 2/2: GOOD Jalen Reaves makes 2/2 from the line.
Score: 20-17

[03:14] Team_068 possession (Score: 20-17)
Zion Anunoby attempts a Midrange. Wide open! Kawhi Thompson is 7.1 feet away. [ZONE] ZION ANUNOBY MAKES IT! Assist: Gary Simons
Score: 20-19

[02:58] Team_062 possession (Score: 20-19)
FOUL! Shooting foul on Nikola Ginobili. Jalen Reaves to the line for 2 free throws. [BONUS: 7 team fouls] (Nikola Ginobili: 2 personal fouls)   FT 1/2: GOOD   FT 2/2: MISS Jalen Reaves makes 1/2 from the line. Offensive rebound by Jalen Reaves! Jalen Reaves kicks it out.
Score: 21-19

[02:46] Team_062 possession (Score: 21-19)
RJ Williamson drives and kicks out. Chris Bird attempts a Midrange. Contested by Zion Anunoby (2.7 feet, MAN). Chris Bird misses. Rebound secured by Jaren Johnson.

[02:30] Team_068 possession (Score: 21-19)
Malcolm Herro throws a bad pass out of bounds! TURNOVER! (dead ball)

[02:30] Substitution (Team_062): RJ Williamson OUT → Tony LaVine IN (stamina_rule2)

[02:30] Substitution (Team_062): Michael Hyland OUT → Paul Poole IN (stamina_rule2)

[02:30] Substitution (Team_062): Kawhi Thompson OUT → RJ Wall IN (stamina_rule2)

[02:30] Substitution (Team_062): Jalen Reaves OUT → Devin Young IN (stamina_rule2)

[02:30] Substitution (Team_068): Malcolm Herro OUT → Ja Banchero IN (stamina_rule2)

[02:30] Substitution (Team_068): Gary Simons OUT → Jarrett Oladipo IN (stamina_rule2)

[02:30] Substitution (Team_068): Nikola Ginobili OUT → Franz Curry IN (stamina_rule2)

[02:19] Team_062 possession (Score: 21-19)
Chris Bird attempts a 3Pt. Contested by Zion Anunoby (6.0 feet, MAN). CHRIS BIRD MAKES IT!
Score: 24-19

[02:05] Team_068 possession (Score: 24-19)
Franz Curry attempts a 3Pt. Wide open! Devin Young is 8.1 feet away. [MAN] Franz Curry misses. Offensive rebound by Jaren Johnson! Jaren Johnson kicks it out.

[01:51] Team_068 possession (Score: 24-19)
Franz Curry attempts a Midrange. Wide open! Tony LaVine is 6.4 feet away. [ZONE] FRANZ CURRY MAKES IT!
Score: 24-21

[01:39] Team_062 possession (Score: 24-21)
Chris Bird attempts a 3Pt. Contested by Zion Anunoby (5.0 feet, MAN). Chris Bird misses. Rebound secured by Jarrett Oladipo.

[01:22] Team_068 possession (Score: 24-21)
Zion Anunoby makes the Midrange and draws the foul on Chris Bird! And-1! Zion Anunoby to the line for 1. [Team fouls: 4] (Chris Bird: 1 personal fouls)   FT 1/1: GOOD Zion Anunoby makes 1/1 from the line.
Score: 24-24

[01:09] Team_062 possession (Score: 24-24)
Paul Poole throws a bad pass! Stolen by Jaren Johnson! TURNOVER! (live ball)

[00:59] Team_068 possession (Score: 24-24)
Zion Anunoby attempts a 3Pt. Wide open! Chris Bird is 6.7 feet away. [MAN] Zion Anunoby misses. FOUL! Loose ball foul on RJ Wall during the rebound battle. [IN THE BONUS! 5 team fouls] Franz Curry to the line for 2 free throws. (RJ Wall: 1 personal fouls)   FT 1/2: MISS   FT 2/2: MISS Franz Curry makes 0/2 from the line. Offensive rebound by Franz Curry! Franz Curry puts it back in!
Score: 24-26

[00:43] Team_062 possession (Score: 24-26)
Tony LaVine attempts a 3Pt. Wide open! Zion Anunoby is 7.6 feet away. [ZONE] Tony LaVine misses. Rebound secured by Jaren Johnson.

[00:25] Team_068 possession (Score: 24-26)
Jaren Johnson drives and kicks out. Ja Banchero attempts a 3Pt. Contested by Chris Bird (4.1 feet, ZONE). Ja Banchero misses. Offensive rebound by Franz Curry! Franz Curry puts it back in!
Score: 24-28

[00:10] Team_062 possession (Score: 24-28)
Chris Bird attempts a 3Pt. Wide open! Zion Anunoby is 8.6 feet away. [MAN] Chris Bird misses. Rebound secured by Franz Curry.

================================================================================
                              1ST QUARTER COMPLETE                              
================================================================================

1ST QUARTER SCORE: Team_062 24, Team_068 28

BOX SCORE:
================================================================================

Team_062
--------------------------------------------------------------------------------
Player                MIN  PTS  REB  AST  TO      FG   FG%      3P   3P%
--------------------------------------------------------------------------------
Chris Bird             12    8    0    0   0   3/9    33.3     0/0   0.0
Kawhi Thompson         10    6    3    0   0   2/2   100.0     0/0   0.0
RJ Williamson          10    5    0    1   0   2/5    40.0     0/0   0.0
Jalen Reaves           10    4    4    0   0   2/4    50.0     0/0   0.0
Michael Hyland         10    0    2    0   0   0/0     0.0     0/0   0.0
Tony LaVine             2    0    0    0   0   0/1     0.0     0/0   0.0

TEAM: FG: 9/21 (42.9%), 3PT: 3/9 (33.3%), REB: 9 (1 off, 8 def), AST: 1, TO: 2
TEAM FOULS: 5 [Team_068 in BONUS]


Team_068
--------------------------------------------------------------------------------
Player                MIN  PTS  REB  AST  TO      FG   FG%      3P   3P%
--------------------------------------------------------------------------------
Malcolm Herro          10    7    0    0   0   3/5    60.0     0/0   0.0
Jaren Johnson          12    6    7    1   0   2/5    40.0     0/0   0.0
Franz Curry             2    6    3    0   0   3/3   100.0     0/0   0.0
Zion Anunoby           12    5    0    0   0   2/3    66.7     0/0   0.0
Nikola Ginobili        10    4    2    0   0   2/4    50.0     0/0   0.0
Gary Simons            10    0    4    3   0   0/0     0.0     0/0   0.0
Jarrett Oladipo         2    0    1    0   0   0/0     0.0     0/0   0.0

TEAM: FG: 12/20 (60.0%), 3PT: 4/9 (44.4%), REB: 17 (5 off, 12 def), AST: 4, TO: 2
TEAM FOULS: 7 [Team_062 in BONUS]

================================================================================

================================================================================
                       2ND QUARTER - Team_062 vs Team_068                       
================================================================================

[12:00] Team_062 possession (Score: 24-28)
Jalen Reaves attempts a Layup. Heavily contested by Gary Simons (0.5 feet, ZONE)! Jalen Reaves misses. Offensive rebound by Jalen Reaves! Jalen Reaves puts it back in!
Score: 26-28

[11:49] Team_068 possession (Score: 26-28)
Gary Simons makes the Midrange and draws the foul on Michael Hyland! And-1! Gary Simons to the line for 1. [Team fouls: 1] (Michael Hyland: 1 personal fouls)   FT 1/1: MISS Gary Simons makes 0/1 from the line. Rebound secured by Jalen Reaves.
Score: 26-30

[11:38] Team_062 possession (Score: 26-30)
FOUL! Reach-in foul on Gary Simons during the drive. [Team fouls: 1] No free throws, side out. (Gary Simons: 1 personal fouls)

[11:20] Team_062 possession (Score: 26-30)
Michael Hyland attempts a Midrange. Wide open! Jaren Johnson is 6.3 feet away. [MAN] MICHAEL HYLAND MAKES IT! Assist: RJ Williamson
Score: 28-30

[11:06] Team_068 possession (Score: 28-30)
Zion Anunoby drives and kicks out. Malcolm Herro attempts a 3Pt. Wide open! RJ Williamson is 8.6 feet away. [MAN] MALCOLM HERRO MAKES IT! Assist: Gary Simons
Score: 28-33

[10:53] Team_062 possession (Score: 28-33)
RJ Williamson drives, Malcolm Herro stays with him. RJ Williamson attempts a Layup. Contested by Malcolm Herro (5.6 feet, MAN). RJ WILLIAMSON MAKES IT! Assist: Michael Hyland
Score: 30-33

[10:37] Team_068 possession (Score: 30-33)
Gary Simons drives, Jalen Reaves stays with him. Gary Simons attempts a Layup. Heavily contested by Jalen Reaves (1.8 feet, ZONE)! GARY SIMONS MAKES IT! Assist: Nikola Ginobili
Score: 30-35

[10:18] Team_062 possession (Score: 30-35)
Jalen Reaves attempts a Layup. BLOCKED BY MALCOLM HERRO! Ball is loose! Rebound secured by Malcolm Herro.

[10:09] Team_068 possession (Score: 30-35)
FOUL! Reach-in foul on Michael Hyland during the drive. [Team fouls: 2] No free throws, side out. (Michael Hyland: 2 personal fouls)

[09:56] Team_068 possession (Score: 30-35)
Gary Simons attempts a Midrange. Contested by Kawhi Thompson (4.5 feet, MAN). GARY SIMONS MAKES IT!
Score: 30-37

[09:40] Team_062 possession (Score: 30-37)
FOUL! Reach-in foul on Zion Anunoby during the drive. [Team fouls: 2] No free throws, side out. (Zion Anunoby: 1 personal fouls)

[09:27] Team_062 possession (Score: 30-37)
Kawhi Thompson drives and kicks out. Chris Bird attempts a Midrange. Contested by Jaren Johnson (2.6 feet, ZONE). Chris Bird misses. Offensive rebound by Kawhi Thompson! Kawhi Thompson kicks it out.

[09:10] Team_062 possession (Score: 30-37)
FOUL! Holding foul on Nikola Ginobili. [Team fouls: 3] No free throws, side out. (Nikola Ginobili: 1 personal fouls)

[08:52] Team_062 possession (Score: 30-37)
FOUL! Shooting foul on Malcolm Herro. Jalen Reaves to the line for 2 free throws. [Team fouls: 4] (Malcolm Herro: 1 personal fouls)   FT 1/2: GOOD   FT 2/2: GOOD Jalen Reaves makes 2/2 from the line.
Score: 32-37

[08:37] Team_068 possession (Score: 32-37)
Jaren Johnson attempts a 3Pt. Contested by RJ Williamson (4.7 feet, ZONE). JAREN JOHNSON MAKES IT! Assist: Malcolm Herro
Score: 32-40

[08:21] Team_062 possession (Score: 32-40)
Kawhi Thompson makes the Dunk and draws the foul on Gary Simons! And-1! Kawhi Thompson to the line for 1. [BONUS: 5 team fouls] (Gary Simons: 2 personal fouls)   FT 1/1: MISS Kawhi Thompson makes 0/1 from the line. Offensive rebound by Jalen Reaves! Jalen Reaves kicks it out.
Score: 34-40

[08:07] Team_062 possession (Score: 34-40)
Chris Bird drives to the basket... Chris Bird throws a bad pass! Stolen by Gary Simons! TURNOVER! (live ball)

[07:51] Team_068 possession (Score: 34-40)
Zion Anunoby attempts a 3Pt. Contested by RJ Williamson (3.5 feet, ZONE). ZION ANUNOBY MAKES IT! Assist: Gary Simons
Score: 34-43

[07:40] Team_062 possession (Score: 34-43)
RJ Williamson attempts a 3Pt. Contested by Zion Anunoby (5.8 feet, ZONE). RJ WILLIAMSON MAKES IT! Assist: Kawhi Thompson
Score: 37-43

[07:22] Team_068 possession (Score: 37-43)
Malcolm Herro attempts a 3Pt. Wide open! Michael Hyland is 7.5 feet away. [ZONE] Malcolm Herro misses. Rebound secured by Kawhi Thompson.

[07:06] Team_062 possession (Score: 37-43)
Jalen Reaves attempts a Layup. Contested by Gary Simons (2.3 feet, ZONE). Jalen Reaves misses. Rebound secured by Nikola Ginobili.

[06:50] Team_068 possession (Score: 37-43)
Gary Simons attempts a Midrange. Contested by Kawhi Thompson (3.5 feet, MAN). GARY SIMONS MAKES IT! Assist: Jaren Johnson
Score: 37-45

[06:36] Team_062 possession (Score: 37-45)
Jalen Reaves commits a violation (traveling/carry)! TURNOVER! (dead ball)

[06:36] Substitution (Team_062): Chris Bird OUT → Paolo McCollum IN (stamina_rule2)

[06:36] Substitution (Team_062): RJ Williamson OUT → Tony LaVine IN (stamina_rule2)

[06:36] Substitution (Team_062): Michael Hyland OUT → Paul Poole IN (stamina_rule2)

[06:36] Substitution (Team_062): Kawhi Thompson OUT → RJ Wall IN (stamina_rule2)

[06:36] Substitution (Team_062): Jalen Reaves OUT → Devin Young IN (stamina_rule2)

[06:36] Substitution (Team_068): Zion Anunoby OUT → Cole Anthony IN (stamina_rule2)

[06:36] Substitution (Team_068): Malcolm Herro OUT → Ja Banchero IN (stamina_rule2)

[06:36] Substitution (Team_068): Jaren Johnson OUT → Miles Murray IN (stamina_rule2)

[06:36] Substitution (Team_068): Gary Simons OUT → Jarrett Oladipo IN (stamina_rule2)

[06:36] Substitution (Team_068): Nikola Ginobili OUT → Franz Curry IN (stamina_rule2)

[06:24] Team_068 possession (Score: 37-45)
Ja Banchero attempts a 3Pt. Wide open! Paolo McCollum is 9.2 feet away. [ZONE] Ja Banchero misses. Rebound secured by RJ Wall.

[06:12] Team_062 possession (Score: 37-45)
RJ Wall drives and kicks out. RJ Wall attempts a 3Pt. Contested by Jarrett Oladipo (4.3 feet, MAN). RJ Wall misses. Rebound secured by Franz Curry.

[05:57] Team_068 possession (Score: 37-45)
FOUL! Offensive foul on Jarrett Oladipo! RJ Wall drew the charge! [Team fouls: 6] (Jarrett Oladipo: 1 personal fouls) TURNOVER! (dead ball)

[05:42] Team_062 possession (Score: 37-45)
Paul Poole loses the ball! Stripped by Miles Murray! TURNOVER! (live ball)

[05:29] Team_068 possession (Score: 37-45)
Cole Anthony attempts a 3Pt. Contested by Paolo McCollum (4.5 feet, MAN). COLE ANTHONY MAKES IT! Assist: Jarrett Oladipo
Score: 37-48

[05:18] Team_062 possession (Score: 37-48)
Devin Young drives to the basket... Devin Young loses the ball! Stripped by Franz Curry! TURNOVER! (live ball)

[05:05] Team_068 possession (Score: 37-48)
Franz Curry attempts a Midrange. Contested by Paolo McCollum (5.5 feet, ZONE). Franz Curry misses. Rebound secured by RJ Wall.

[04:52] Team_062 possession (Score: 37-48)
Devin Young attempts a Midrange. Wide open! Franz Curry is 7.9 feet away. [MAN] Devin Young misses. Rebound secured by Franz Curry.

[04:35] Team_068 possession (Score: 37-48)
Franz Curry makes the Layup and draws the foul on Devin Young! And-1! Franz Curry to the line for 1. [Team fouls: 3] (Devin Young: 1 personal fouls)   FT 1/1: GOOD Franz Curry makes 1/1 from the line.
Score: 37-51

[04:19] Team_062 possession (Score: 37-51)
RJ Wall drives and kicks out. Devin Young attempts a Midrange. Contested by Franz Curry (3.8 feet, MAN). Devin Young misses. Rebound secured by Ja Banchero.

[04:10] Team_068 possession (Score: 37-51)
Ja Banchero drives, picks up RJ Wall. Help arrives from Paolo McCollum! Ja Banchero attempts a Dunk. Contested by Paolo McCollum (4.1 feet, ZONE). JA BANCHERO MAKES IT! Assist: Cole Anthony
Score: 37-53

[03:52] Team_062 possession (Score: 37-53)
Paul Poole makes the 3Pt and draws the foul on Ja Banchero! And-1! Paul Poole to the line for 1. [BONUS: 7 team fouls] (Ja Banchero: 1 personal fouls)   FT 1/1: GOOD Paul Poole makes 1/1 from the line.
Score: 41-53

[03:40] Team_068 possession (Score: 41-53)
Ja Banchero drives to the basket... FOUL! Offensive foul on Ja Banchero! RJ Wall drew the charge! [Team fouls: 8] (Ja Banchero: 2 personal fouls) TURNOVER! (dead ball)

[03:26] Team_062 possession (Score: 41-53)
Paolo McCollum makes the Layup and draws the foul on Cole Anthony! And-1! Paolo McCollum to the line for 1. [BONUS: 9 team fouls] (Cole Anthony: 1 personal fouls)   FT 1/1: MISS Paolo McCollum makes 0/1 from the line. Rebound secured by Franz Curry.
Score: 43-53

[03:11] Team_068 possession (Score: 43-53)
Cole Anthony attempts a 3Pt. Contested by Paolo McCollum (2.7 feet, MAN). COLE ANTHONY MAKES IT! Assist: Franz Curry
Score: 43-56

[02:55] Team_062 possession (Score: 43-56)
RJ Wall attempts a Layup. Heavily contested by Franz Curry (1.0 feet, ZONE)! RJ Wall misses. Offensive rebound by RJ Wall! RJ Wall kicks it out.

[02:39] Team_062 possession (Score: 43-56)
Paolo McCollum drives and kicks out. Devin Young attempts a Midrange. Contested by Ja Banchero (5.2 feet, ZONE). Devin Young misses. Rebound secured by Franz Curry.

[02:26] Team_068 possession (Score: 43-56)
Cole Anthony attempts a 3Pt. Contested by Paolo McCollum (5.5 feet, MAN). COLE ANTHONY MAKES IT! Assist: Jarrett Oladipo
Score: 43-59

[02:15] Team_062 possession (Score: 43-59)
FOUL! Reach-in foul on Miles Murray during the drive. [IN THE BONUS! 10 team fouls] Paul Poole to the line for 2 free throws. (Miles Murray: 1 personal fouls)   FT 1/2: MISS   FT 2/2: MISS Paul Poole makes 0/2 from the line. Rebound secured by Franz Curry.

[02:02] Team_068 possession (Score: 43-59)
Franz Curry loses the ball! Stripped by Devin Young! TURNOVER! (live ball)

[01:53] Team_062 possession (Score: 43-59)
RJ Wall attempts a Layup. BLOCKED BY JA BANCHERO! Ball deflects out of bounds off RJ Wall.

[01:39] Team_068 possession (Score: 43-59)
Cole Anthony drives to the basket... Cole Anthony loses the ball! Stripped by Paolo McCollum! TURNOVER! (live ball)

[01:26] Team_062 possession (Score: 43-59)
Tony LaVine attempts a 3Pt. Contested by Ja Banchero (5.8 feet, MAN). Tony LaVine misses. Offensive rebound by Devin Young! Devin Young kicks it out.

[01:07] Team_062 possession (Score: 43-59)
Paul Poole drives to the basket... FOUL! Offensive foul on Paul Poole! Miles Murray drew the charge! [Team fouls: 4] (Paul Poole: 1 personal fouls) TURNOVER! (dead ball)

[00:49] Team_068 possession (Score: 43-59)
Ja Banchero attempts a 3Pt. Wide open! Paolo McCollum is 6.1 feet away. [ZONE] JA BANCHERO MAKES IT!
Score: 43-62

[00:32] Team_062 possession (Score: 43-62)
Paolo McCollum attempts a 3Pt. Wide open! Ja Banchero is 6.5 feet away. [ZONE] Paolo McCollum misses. Rebound secured by Jarrett Oladipo.

[00:17] Team_068 possession (Score: 43-62)
Ja Banchero drives and kicks out. Miles Murray attempts a Midrange. Contested by Paul Poole (4.4 feet, MAN). Miles Murray misses. Rebound secured by RJ Wall.

[00:04] Team_062 possession (Score: 43-62)
RJ Wall attempts a Midrange. Contested by Jarrett Oladipo (3.2 feet, MAN). RJ WALL MAKES IT!
Score: 45-62

================================================================================
                              2ND QUARTER COMPLETE                              
================================================================================

2ND QUARTER SCORE: Team_062 21, Team_068 34

BOX SCORE:
================================================================================

Team_062
--------------------------------------------------------------------------------
Player                MIN  PTS  REB  AST  TO      FG   FG%      3P   3P%
--------------------------------------------------------------------------------
RJ Williamson          15    5    0    1   0   2/2   100.0     0/0   0.0
Jalen Reaves           15    4    3    0   0   2/4    50.0     0/0   0.0
Paul Poole              9    4    0    0   0   1/2    50.0     0/0   0.0
Michael Hyland         15    2    0    1   0   1/1   100.0     0/0   0.0
RJ Wall                 9    2    4    0   0   1/4    25.0     0/0   0.0
Kawhi Thompson         15    0    2    1   0   0/0     0.0     0/0   0.0
Devin Young             9    0    1    0   0   0/1     0.0     0/0   0.0
Paolo McCollum          7    0    0    0   0   0/3     0.0     0/0   0.0

TEAM: FG: 7/17 (41.2%), 3PT: 2/3 (66.7%), REB: 10 (5 off, 5 def), AST: 3, TO: 5
TEAM FOULS: 4


Team_068
--------------------------------------------------------------------------------
Player                MIN  PTS  REB  AST  TO      FG   FG%      3P   3P%
--------------------------------------------------------------------------------
Cole Anthony            7    9    0    1   0   3/3   100.0     0/0   0.0
Gary Simons            15    6    0    2   0   3/4    75.0     0/0   0.0
Ja Banchero             9    5    1    0   0   2/4    50.0     0/0   0.0
Malcolm Herro          15    3    1    1   0   1/2    50.0     0/0   0.0
Jaren Johnson          18    3    0    1   0   1/1   100.0     0/0   0.0
Zion Anunoby           18    3    0    0   0   1/1   100.0     0/0   0.0
Franz Curry             9    3    5    1   0   1/2    50.0     0/0   0.0
Nikola Ginobili        15    0    1    1   0   0/0     0.0     0/0   0.0
Jarrett Oladipo         9    0    1    2   0   0/0     0.0     0/0   0.0

TEAM: FG: 12/17 (70.6%), 3PT: 6/8 (75.0%), REB: 9 (0 off, 9 def), AST: 9, TO: 4
TEAM FOULS: 10 [Team_062 in BONUS]

================================================================================

================================================================================
                       3RD QUARTER - Team_062 vs Team_068                       
================================================================================

[12:00] Team_062 possession (Score: 45-62)
RJ Williamson drives to the basket... RJ Williamson throws a bad pass out of bounds! TURNOVER! (dead ball)

[11:45] Team_068 possession (Score: 45-62)
Jaren Johnson attempts a Midrange. Contested by Michael Hyland (4.5 feet, MAN). JAREN JOHNSON MAKES IT! Assist: Zion Anunoby
Score: 45-64

[11:31] Team_062 possession (Score: 45-64)
Chris Bird attempts a Midrange. Contested by Zion Anunoby (2.7 feet, MAN). Chris Bird misses. Rebound secured by Jaren Johnson.

[11:21] Team_068 possession (Score: 45-64)
Zion Anunoby drives, Chris Bird stays with him. Zion Anunoby attempts a Layup. Contested by Chris Bird (3.2 feet, MAN). ZION ANUNOBY MAKES IT! Assist: Gary Simons
Score: 45-66

[11:02] Team_062 possession (Score: 45-66)
Chris Bird attempts a Midrange. Contested by Gary Simons (3.3 feet, ZONE). CHRIS BIRD MAKES IT!
Score: 47-66

[10:47] Team_068 possession (Score: 47-66)
Malcolm Herro makes the Layup and draws the foul on RJ Williamson! And-1! Malcolm Herro to the line for 1. [Team fouls: 1] (RJ Williamson: 1 personal fouls)   FT 1/1: GOOD Malcolm Herro makes 1/1 from the line.
Score: 47-69

[10:30] Team_062 possession (Score: 47-69)
RJ Williamson attempts a 3Pt. Heavily contested by Jaren Johnson (0.9 feet, ZONE)! RJ Williamson misses. Offensive rebound by Jalen Reaves! Jalen Reaves puts it back in!
Score: 49-69

[10:18] Team_068 possession (Score: 49-69)
Jaren Johnson attempts a Layup. Contested by Michael Hyland (3.0 feet, MAN). Jaren Johnson misses. Rebound secured by Jalen Reaves.

[10:04] Team_062 possession (Score: 49-69)
Michael Hyland commits a violation (traveling/carry)! TURNOVER! (dead ball)

[09:52] Team_068 possession (Score: 49-69)
Malcolm Herro drives and kicks out. Nikola Ginobili attempts a Midrange. Contested by Jalen Reaves (3.1 feet, MAN). Nikola Ginobili misses. Rebound secured by Michael Hyland.

[09:40] Team_062 possession (Score: 49-69)
Chris Bird attempts a Layup. Heavily contested by Gary Simons (0.5 feet, ZONE)! Chris Bird misses. Rebound secured by Jaren Johnson.

[09:27] Team_068 possession (Score: 49-69)
Malcolm Herro attempts a 3Pt. Contested by RJ Williamson (3.8 feet, MAN). Malcolm Herro misses. Rebound secured by Kawhi Thompson.

[09:09] Team_062 possession (Score: 49-69)
Kawhi Thompson drives to the basket... Kawhi Thompson commits a violation (traveling/carry)! TURNOVER! (dead ball)

[08:55] Team_068 possession (Score: 49-69)
Zion Anunoby attempts a Midrange. Wide open! Jalen Reaves is 6.9 feet away. [ZONE] ZION ANUNOBY MAKES IT!
Score: 49-71

[08:37] Team_062 possession (Score: 49-71)
Michael Hyland attempts a 3Pt. Contested by Jaren Johnson (3.0 feet, ZONE). Michael Hyland misses. Rebound secured by Gary Simons.

[08:19] Team_068 possession (Score: 49-71)
Malcolm Herro attempts a 3Pt. Heavily contested by RJ Williamson (1.4 feet, ZONE)! Malcolm Herro misses. Rebound secured by Kawhi Thompson.

[08:05] Team_062 possession (Score: 49-71)
Chris Bird drives and kicks out. Kawhi Thompson attempts a Midrange. Wide open! Gary Simons is 7.0 feet away. [MAN] Kawhi Thompson misses. Rebound secured by Gary Simons.

[07:52] Team_068 possession (Score: 49-71)
Gary Simons attempts a 3Pt. Wide open! Kawhi Thompson is 6.2 feet away. [MAN] Gary Simons misses. Rebound secured by Michael Hyland.

[07:41] Team_062 possession (Score: 49-71)
Michael Hyland attempts a Midrange. Contested by Jaren Johnson (4.1 feet, MAN). Michael Hyland misses. Offensive rebound by Jalen Reaves! Jalen Reaves puts it back in!
Score: 51-71

[07:28] Team_068 possession (Score: 51-71)
Jaren Johnson attempts a Midrange. Contested by Michael Hyland (2.4 feet, MAN). JAREN JOHNSON MAKES IT! Assist: Zion Anunoby
Score: 51-73

[07:14] Team_062 possession (Score: 51-73)
Chris Bird loses control! Ball rolls out of bounds! TURNOVER! (dead ball)

[06:58] Team_068 possession (Score: 51-73)
Nikola Ginobili attempts a Layup. Contested by Jalen Reaves (5.3 feet, MAN). Nikola Ginobili misses. Offensive rebound by Nikola Ginobili! Nikola Ginobili's putback is no good. Rebound secured by Michael Hyland.

[06:44] Team_062 possession (Score: 51-73)
Kawhi Thompson attempts a 3Pt. Contested by Gary Simons (4.3 feet, MAN). Kawhi Thompson misses. Rebound secured by Jaren Johnson.

[06:28] Team_068 possession (Score: 51-73)
Jaren Johnson drives and kicks out. Nikola Ginobili attempts a 3Pt. Contested by RJ Williamson (3.0 feet, ZONE). Nikola Ginobili misses. Rebound secured by Michael Hyland.

[06:10] Team_062 possession (Score: 51-73)
Jalen Reaves attempts a Layup. BLOCKED BY NIKOLA GINOBILI! Ball deflects out of bounds off Jalen Reaves.

[05:56] Team_068 possession (Score: 51-73)
Zion Anunoby attempts a Midrange. Wide open! RJ Williamson is 6.4 feet away. [ZONE] Zion Anunoby misses. Offensive rebound by Jaren Johnson! Jaren Johnson kicks it out.

[05:39] Team_068 possession (Score: 51-73)
FOUL! Holding foul on Kawhi Thompson. [Team fouls: 2] No free throws, side out. (Kawhi Thompson: 1 personal fouls)

[05:23] Team_068 possession (Score: 51-73)
Jaren Johnson attempts a 3Pt. Contested by RJ Williamson (3.4 feet, ZONE). Jaren Johnson misses. Offensive rebound by Jaren Johnson! Jaren Johnson kicks it out.

[05:10] Team_068 possession (Score: 51-73)
Gary Simons attempts a 3Pt. Wide open! Kawhi Thompson is 6.2 feet away. [MAN] GARY SIMONS MAKES IT! Assist: Jaren Johnson
Score: 51-76

[04:55] Team_062 possession (Score: 51-76)
Kawhi Thompson throws a bad pass! Stolen by Gary Simons! TURNOVER! (live ball)

[04:39] Team_068 possession (Score: 51-76)
Nikola Ginobili makes the Layup and draws the foul on Jalen Reaves! And-1! Nikola Ginobili to the line for 1. [Team fouls: 3] (Jalen Reaves: 1 personal fouls)   FT 1/1: GOOD Nikola Ginobili makes 1/1 from the line.
Score: 51-79

[04:26] Team_062 possession (Score: 51-79)
RJ Williamson attempts a 3Pt. Contested by Malcolm Herro (2.6 feet, MAN). RJ Williamson misses. Rebound secured by Gary Simons.

[04:13] Team_068 possession (Score: 51-79)
Jaren Johnson attempts a Midrange. Wide open! Michael Hyland is 8.3 feet away. [MAN] JAREN JOHNSON MAKES IT! Assist: Nikola Ginobili
Score: 51-81

[03:59] Team_062 possession (Score: 51-81)
FOUL! Shooting foul on Zion Anunoby. Chris Bird to the line for 3 free throws. [Team fouls: 1] (Zion Anunoby: 1 personal fouls)   FT 1/3: GOOD   FT 2/3: GOOD   FT 3/3: GOOD Chris Bird makes 3/3 from the line.
Score: 54-81

[03:45] Team_068 possession (Score: 54-81)
Zion Anunoby drives and kicks out. Malcolm Herro attempts a Midrange. Contested by RJ Williamson (6.0 feet, MAN). Malcolm Herro misses. Offensive rebound by Nikola Ginobili! Nikola Ginobili's putback is no good. Rebound secured by Kawhi Thompson.

[03:30] Team_062 possession (Score: 54-81)
RJ Williamson attempts a 3Pt. Contested by Zion Anunoby (4.8 feet, ZONE). RJ WILLIAMSON MAKES IT! Assist: Michael Hyland
Score: 57-81

[03:16] Team_068 possession (Score: 57-81)
Zion Anunoby attempts a 3Pt. Wide open! RJ Williamson is 6.4 feet away. [ZONE] ZION ANUNOBY MAKES IT! Assist: Jaren Johnson
Score: 57-84

[03:07] Team_062 possession (Score: 57-84)
Michael Hyland attempts a 3Pt. Heavily contested by Zion Anunoby (2.0 feet, ZONE)! Michael Hyland misses. Rebound secured by Gary Simons.

[02:50] Team_068 possession (Score: 57-84)
Gary Simons drives and kicks out. Malcolm Herro attempts a 3Pt. Wide open! RJ Williamson is 7.4 feet away. [ZONE] MALCOLM HERRO MAKES IT! Assist: Nikola Ginobili
Score: 57-87

[02:31] Team_062 possession (Score: 57-87)
Kawhi Thompson attempts a 3Pt. Contested by Zion Anunoby (2.2 feet, ZONE). Kawhi Thompson misses. Rebound secured by Gary Simons.

[02:18] Team_068 possession (Score: 57-87)
Malcolm Herro attempts a 3Pt. Contested by RJ Williamson (3.7 feet, MAN). MALCOLM HERRO MAKES IT! Assist: Nikola Ginobili
Score: 57-90

[02:06] Team_062 possession (Score: 57-90)
Michael Hyland attempts a 3Pt. Wide open! Jaren Johnson is 6.2 feet away. [MAN] Michael Hyland misses. Rebound secured by Jaren Johnson.

[01:54] Team_068 possession (Score: 57-90)
Malcolm Herro drives, Jalen Reaves stays with him. Malcolm Herro attempts a Dunk. Contested by Jalen Reaves (4.5 feet, ZONE). MALCOLM HERRO MAKES IT!
Score: 57-92

[01:40] Team_062 possession (Score: 57-92)
RJ Williamson attempts a Midrange. Contested by Malcolm Herro (5.8 feet, MAN). RJ Williamson misses. Rebound secured by Nikola Ginobili.

[01:25] Team_068 possession (Score: 57-92)
Gary Simons attempts a 3Pt. Wide open! RJ Williamson is 10.0 feet away. [ZONE] GARY SIMONS MAKES IT! Assist: Zion Anunoby
Score: 57-95

[01:10] Team_062 possession (Score: 57-95)
Kawhi Thompson makes the Layup and draws the foul on Gary Simons! And-1! Kawhi Thompson to the line for 1. [Team fouls: 2] (Gary Simons: 1 personal fouls)   FT 1/1: MISS Kawhi Thompson makes 0/1 from the line. FOUL! Loose ball foul on Gary Simons during the free throw rebound! [Team fouls: 3] No free throws, side out. (Gary Simons: 2 personal fouls)
Score: 59-95

[00:59] Team_062 possession (Score: 59-95)
FOUL! Shooting foul on Malcolm Herro. Michael Hyland to the line for 2 free throws. [Team fouls: 4] (Malcolm Herro: 1 personal fouls)   FT 1/2: GOOD   FT 2/2: GOOD Michael Hyland makes 2/2 from the line.
Score: 61-95

[00:48] Team_068 possession (Score: 61-95)
FOUL! Reach-in foul on Jalen Reaves during the drive. [Team fouls: 4] No free throws, side out. (Jalen Reaves: 2 personal fouls)

[00:37] Team_068 possession (Score: 61-95)
Zion Anunoby attempts a Midrange. Wide open! Chris Bird is 8.8 feet away. [MAN] ZION ANUNOBY MAKES IT!
Score: 61-97

[00:20] Team_062 possession (Score: 61-97)
Chris Bird attempts a 3Pt. Wide open! Zion Anunoby is 6.6 feet away. [ZONE] Chris Bird misses. Rebound secured by Nikola Ginobili.

[00:02] Team_068 possession (Score: 61-97)
Nikola Ginobili drives, picks up Jalen Reaves. Help arrives from Chris Bird! Nikola Ginobili attempts a Layup. Contested by Chris Bird (3.3 feet, ZONE). NIKOLA GINOBILI MAKES IT! Assist: Zion Anunoby
Score: 61-99

================================================================================
                              3RD QUARTER COMPLETE                              
================================================================================

3RD QUARTER SCORE: Team_062 16, Team_068 37

BOX SCORE:
================================================================================

Team_062
--------------------------------------------------------------------------------
Player                MIN  PTS  REB  AST  TO      FG   FG%      3P   3P%
--------------------------------------------------------------------------------
Chris Bird             30    5    0    0   0   2/6    33.3     0/0   0.0
Jalen Reaves           28    4    3    0   0   2/3    66.7     0/0   0.0
RJ Williamson          28    3    0    0   0   1/3    33.3     0/0   0.0
Michael Hyland         28    2    4    1   0   1/4    25.0     0/0   0.0
Kawhi Thompson         28    0    4    0   0   0/2     0.0     0/0   0.0

TEAM: FG: 6/18 (33.3%), 3PT: 3/10 (30.0%), REB: 9 (3 off, 6 def), AST: 1, TO: 5
TEAM FOULS: 4


Team_068
--------------------------------------------------------------------------------
Player                MIN  PTS  REB  AST  TO      FG   FG%      3P   3P%
--------------------------------------------------------------------------------
Malcolm Herro          28   11    0    0   0   4/7    57.1     0/0   0.0
Zion Anunoby           30    9    0    4   0   4/5    80.0     0/0   0.0
Jaren Johnson          30    6    6    2   0   3/5    60.0     0/0   0.0
Gary Simons            28    6    5    1   0   2/3    66.7     0/0   0.0
Nikola Ginobili        28    5    2    3   0   2/3    66.7     0/0   0.0

TEAM: FG: 15/23 (65.2%), 3PT: 4/7 (57.1%), REB: 15 (4 off, 11 def), AST: 10, TO: 0
TEAM FOULS: 4

================================================================================

================================================================================
                       4TH QUARTER - Team_062 vs Team_068                       
================================================================================

[12:00] Substitution (Team_062): Chris Bird OUT (stamina: 69) → Paolo McCollum IN (comeback_detected)

[12:00] Substitution (Team_068): Zion Anunoby OUT (stamina: 70) → Cole Anthony IN (comeback_detected)

[12:00] Team_062 possession (Score: 61-99)
Michael Hyland drives and kicks out. RJ Williamson attempts a Midrange. Contested by Malcolm Herro (4.9 feet, ZONE). RJ Williamson misses. FOUL! Loose ball foul on Jaren Johnson during the rebound battle. [Team fouls: 1] No free throws, side out. (Jaren Johnson: 1 personal fouls)

[11:45] Team_062 possession (Score: 61-99)
FOUL! Reach-in foul on Malcolm Herro during the drive. [Team fouls: 2] No free throws, side out. (Malcolm Herro: 1 personal fouls)

[11:32] Team_062 possession (Score: 61-99)
Paolo McCollum attempts a 3Pt. Wide open! Cole Anthony is 6.8 feet away. [MAN] Paolo McCollum misses. Rebound secured by Jaren Johnson.

[11:18] Team_068 possession (Score: 61-99)
FOUL! Shooting foul on Paolo McCollum. Cole Anthony to the line for 3 free throws. [Team fouls: 1] (Paolo McCollum: 1 personal fouls)   FT 1/3: GOOD   FT 2/3: GOOD   FT 3/3: GOOD Cole Anthony makes 3/3 from the line.
Score: 61-102

[11:03] Team_062 possession (Score: 61-102)
Michael Hyland attempts a 3Pt. Heavily contested by Jaren Johnson (0.5 feet, MAN)! MICHAEL HYLAND MAKES IT! Assist: Paolo McCollum
Score: 64-102

[10:45] Team_068 possession (Score: 64-102)
Jaren Johnson attempts a Layup. Heavily contested by Michael Hyland (1.1 feet, MAN)! JAREN JOHNSON MAKES IT! Assist: Malcolm Herro
Score: 64-104

[10:31] Team_062 possession (Score: 64-104)
FOUL! Reach-in foul on Cole Anthony during the drive. [Team fouls: 3] No free throws, side out. (Cole Anthony: 1 personal fouls)

[10:19] Team_062 possession (Score: 64-104)
Michael Hyland attempts a 3Pt. Heavily contested by Malcolm Herro (1.3 feet, ZONE)! Michael Hyland misses. Rebound secured by Jaren Johnson.

[10:04] Team_068 possession (Score: 64-104)
Cole Anthony throws a bad pass! Stolen by Paolo McCollum! TURNOVER! (live ball)

[09:48] Team_062 possession (Score: 64-104)
RJ Williamson drives, Gary Simons stays with him. RJ Williamson attempts a Layup. Heavily contested by Gary Simons (1.1 feet, ZONE)! RJ WILLIAMSON MAKES IT! Assist: Kawhi Thompson
Score: 66-104

[09:35] Team_068 possession (Score: 66-104)
Jaren Johnson attempts a Midrange. Contested by Michael Hyland (4.1 feet, MAN). Jaren Johnson misses. Offensive rebound by Nikola Ginobili! Nikola Ginobili puts it back in!
Score: 66-106

[09:21] Team_062 possession (Score: 66-106)
Michael Hyland attempts a Layup. Contested by Gary Simons (2.7 feet, ZONE). MICHAEL HYLAND MAKES IT!
Score: 68-106

[09:06] Team_068 possession (Score: 68-106)
FOUL! Holding foul on Michael Hyland. [Team fouls: 2] No free throws, side out. (Michael Hyland: 1 personal fouls)

[08:54] Team_068 possession (Score: 68-106)
Nikola Ginobili drives, Jalen Reaves stays with him. Nikola Ginobili attempts a Layup. Wide open! Jalen Reaves is 7.4 feet away. [ZONE] Nikola Ginobili misses. Rebound secured by Jalen Reaves.

[08:37] Team_062 possession (Score: 68-106)
FOUL! Shooting foul on Cole Anthony. RJ Williamson to the line for 3 free throws. [Team fouls: 4] (Cole Anthony: 2 personal fouls)   FT 1/3: GOOD   FT 2/3: MISS   FT 3/3: MISS RJ Williamson makes 1/3 from the line. Rebound secured by Nikola Ginobili.
Score: 69-106

[08:23] Team_068 possession (Score: 69-106)
Nikola Ginobili drives to the basket... FOUL! Offensive foul on Nikola Ginobili! Jalen Reaves drew the charge! [Team fouls: 5] (Nikola Ginobili: 1 personal fouls) TURNOVER! (dead ball)

[08:11] Team_062 possession (Score: 69-106)
Michael Hyland drives to the basket... Michael Hyland throws a bad pass! Stolen by Jaren Johnson! TURNOVER! (live ball)

[07:57] Team_068 possession (Score: 69-106)
Jaren Johnson attempts a 3Pt. Wide open! Paolo McCollum is 10.0 feet away. [ZONE] JAREN JOHNSON MAKES IT! Assist: Nikola Ginobili
Score: 69-109

[07:41] Team_062 possession (Score: 69-109)
Paolo McCollum attempts a 3Pt. Wide open! Cole Anthony is 7.1 feet away. [MAN] Paolo McCollum misses. Offensive rebound by Kawhi Thompson! Kawhi Thompson kicks it out.

[07:30] Team_062 possession (Score: 69-109)
Jalen Reaves drives and kicks out. Jalen Reaves attempts a 3Pt. Wide open! Cole Anthony is 7.3 feet away. [ZONE] Jalen Reaves misses. Rebound secured by Nikola Ginobili.

[07:16] Team_068 possession (Score: 69-109)
Jaren Johnson makes the Layup and draws the foul on Paolo McCollum! And-1! Jaren Johnson to the line for 1. [Team fouls: 3] (Paolo McCollum: 2 personal fouls)   FT 1/1: GOOD Jaren Johnson makes 1/1 from the line.
Score: 69-112

[06:57] Team_062 possession (Score: 69-112)
FOUL! Offensive foul on Jalen Reaves! Nikola Ginobili drew the charge! [Team fouls: 4] (Jalen Reaves: 1 personal fouls) TURNOVER! (dead ball)

[06:40] Team_068 possession (Score: 69-112)
Cole Anthony commits a violation (traveling/carry)! TURNOVER! (dead ball)

[06:40] Substitution (Team_062): RJ Williamson OUT → Tony LaVine IN (stamina_rule2)

[06:40] Substitution (Team_062): Michael Hyland OUT → Paul Poole IN (stamina_rule2)

[06:40] Substitution (Team_062): Kawhi Thompson OUT → RJ Wall IN (stamina_rule2)

[06:40] Substitution (Team_062): Jalen Reaves OUT → Devin Young IN (stamina_rule2)

[06:40] Substitution (Team_068): Malcolm Herro OUT → Ja Banchero IN (stamina_rule2)

[06:40] Substitution (Team_068): Jaren Johnson OUT → Miles Murray IN (stamina_rule2)

[06:40] Substitution (Team_068): Gary Simons OUT → Jarrett Oladipo IN (stamina_rule2)

[06:40] Substitution (Team_068): Nikola Ginobili OUT → Franz Curry IN (stamina_rule2)

[06:26] Team_062 possession (Score: 69-112)
FOUL! Reach-in foul on Franz Curry during the drive. [IN THE BONUS! 6 team fouls] Devin Young to the line for 2 free throws. (Franz Curry: 1 personal fouls)   FT 1/2: GOOD   FT 2/2: GOOD Devin Young makes 2/2 from the line.
Score: 71-112

[06:10] Team_068 possession (Score: 71-112)
Cole Anthony attempts a 3Pt. Wide open! Paolo McCollum is 8.1 feet away. [ZONE] COLE ANTHONY MAKES IT! Assist: Ja Banchero
Score: 71-115

[05:59] Team_062 possession (Score: 71-115)
Tony LaVine attempts a Layup. BLOCKED BY JA BANCHERO! Ball is loose! Offensive rebound by RJ Wall! RJ Wall kicks it out.

[05:43] Team_062 possession (Score: 71-115)
Tony LaVine attempts a 3Pt. Wide open! Ja Banchero is 6.9 feet away. [MAN] TONY LAVINE MAKES IT! Assist: RJ Wall
Score: 74-115

[05:25] Team_068 possession (Score: 74-115)
Miles Murray attempts a 3Pt. Wide open! Paolo McCollum is 6.9 feet away. [ZONE] Miles Murray misses. Rebound secured by Devin Young.

[05:10] Team_062 possession (Score: 74-115)
FOUL! Shooting foul on Ja Banchero. Paul Poole to the line for 3 free throws. [BONUS: 7 team fouls] (Ja Banchero: 1 personal fouls)   FT 1/3: GOOD   FT 2/3: GOOD   FT 3/3: MISS Paul Poole makes 2/3 from the line. Rebound secured by Ja Banchero.
Score: 76-115

[04:54] Team_068 possession (Score: 76-115)
Miles Murray attempts a 3Pt. Wide open! Paul Poole is 8.6 feet away. [MAN] MILES MURRAY MAKES IT! Assist: Franz Curry
Score: 76-118

[04:42] Team_062 possession (Score: 76-118)
Tony LaVine attempts a Layup. Wide open! Ja Banchero is 9.0 feet away. [MAN] TONY LAVINE MAKES IT! Assist: Devin Young
Score: 78-118

[04:28] Team_068 possession (Score: 78-118)
Jarrett Oladipo attempts a Midrange. Wide open! RJ Wall is 8.6 feet away. [MAN] JARRETT OLADIPO MAKES IT!
Score: 78-120

[04:17] Team_062 possession (Score: 78-120)
Devin Young commits a violation (traveling/carry)! TURNOVER! (dead ball)

[04:01] Team_068 possession (Score: 78-120)
Ja Banchero attempts a Layup. Contested by Tony LaVine (5.7 feet, MAN). JA BANCHERO MAKES IT! Assist: Cole Anthony
Score: 78-122

[03:47] Team_062 possession (Score: 78-122)
RJ Wall drives and kicks out. Paolo McCollum attempts a 3Pt. Heavily contested by Ja Banchero (1.0 feet, ZONE)! PAOLO MCCOLLUM MAKES IT! Assist: RJ Wall
Score: 81-122

[03:32] Team_068 possession (Score: 81-122)
Jarrett Oladipo drives to the basket... Jarrett Oladipo throws a bad pass out of bounds! TURNOVER! (dead ball)

[03:18] Team_062 possession (Score: 81-122)
Paul Poole attempts a 3Pt. Wide open! Miles Murray is 7.3 feet away. [MAN] PAUL POOLE MAKES IT! Assist: Tony LaVine
Score: 84-122

[03:06] Team_068 possession (Score: 84-122)
Jarrett Oladipo attempts a 3Pt. Contested by Paolo McCollum (5.8 feet, ZONE). Jarrett Oladipo misses. Rebound secured by Devin Young.

[02:53] Team_062 possession (Score: 84-122)
FOUL! Reach-in foul on Cole Anthony during the drive. [IN THE BONUS! 8 team fouls] Paolo McCollum to the line for 2 free throws. (Cole Anthony: 3 personal fouls)   FT 1/2: GOOD   FT 2/2: GOOD Paolo McCollum makes 2/2 from the line.
Score: 86-122

[02:41] Team_068 possession (Score: 86-122)
Ja Banchero drives and kicks out. Miles Murray attempts a Midrange. Contested by Paul Poole (3.8 feet, MAN). MILES MURRAY MAKES IT! Assist: Franz Curry
Score: 86-124

[02:26] Team_062 possession (Score: 86-124)
Paul Poole attempts a Layup. BLOCKED BY MILES MURRAY! Ball deflects out of bounds off Paul Poole.

[02:11] Team_068 possession (Score: 86-124)
Ja Banchero throws a bad pass out of bounds! TURNOVER! (dead ball)

[01:56] Team_062 possession (Score: 86-124)
Devin Young makes the Midrange and draws the foul on Franz Curry! And-1! Devin Young to the line for 1. [BONUS: 9 team fouls] (Franz Curry: 2 personal fouls)   FT 1/1: MISS Devin Young makes 0/1 from the line. Rebound secured by Ja Banchero.
Score: 88-124

[01:41] Team_068 possession (Score: 88-124)
Cole Anthony attempts a Midrange. Wide open! Paolo McCollum is 8.7 feet away. [MAN] Cole Anthony misses. Offensive rebound by Jarrett Oladipo! Jarrett Oladipo kicks it out.

[01:26] Team_068 possession (Score: 88-124)
Jarrett Oladipo attempts a Midrange. Contested by RJ Wall (4.4 feet, MAN). Jarrett Oladipo misses. Rebound secured by RJ Wall.

[01:10] Team_062 possession (Score: 88-124)
Devin Young drives to the basket... Devin Young loses the ball! Stripped by Franz Curry! TURNOVER! (live ball)

[00:56] Team_068 possession (Score: 88-124)
Jarrett Oladipo drives to the basket... Jarrett Oladipo loses the ball! Stripped by RJ Wall! TURNOVER! (live ball)

[00:43] Team_062 possession (Score: 88-124)
Devin Young makes the Midrange and draws the foul on Franz Curry! And-1! Devin Young to the line for 1. [BONUS: 10 team fouls] (Franz Curry: 3 personal fouls)   FT 1/1: GOOD Devin Young makes 1/1 from the line.
Score: 91-124

[00:30] Team_068 possession (Score: 91-124)
Jarrett Oladipo attempts a 3Pt. Contested by Paolo McCollum (2.5 feet, ZONE). Jarrett Oladipo misses. Offensive rebound by Jarrett Oladipo! Jarrett Oladipo kicks it out.

[00:10] Team_068 possession (Score: 91-124)
Ja Banchero attempts a Midrange. Contested by Tony LaVine (5.8 feet, MAN). JA BANCHERO MAKES IT!
Score: 91-126

================================================================================
                              4TH QUARTER COMPLETE                              
================================================================================

4TH QUARTER SCORE: Team_062 30, Team_068 27

BOX SCORE:
================================================================================

Team_062
--------------------------------------------------------------------------------
Player                MIN  PTS  REB  AST  TO      FG   FG%      3P   3P%
--------------------------------------------------------------------------------
Paolo McCollum         19    5    0    1   0   2/3    66.7     0/0   0.0
Michael Hyland         33    5    0    0   0   2/3    66.7     0/0   0.0
Devin Young            15    5    2    1   0   2/3    66.7     0/0   0.0
Tony LaVine            15    5    0    1   0   2/2   100.0     0/0   0.0
Paul Poole             15    3    0    0   0   1/3    33.3     0/0   0.0
RJ Williamson          33    2    0    0   0   1/2    50.0     0/0   0.0
Jalen Reaves           33    0    2    0   0   0/1     0.0     0/0   0.0
Kawhi Thompson         33    0    1    1   0   0/0     0.0     0/0   0.0
RJ Wall                15    0    2    2   0   0/0     0.0     0/0   0.0

TEAM: FG: 10/17 (58.8%), 3PT: 3/7 (42.9%), REB: 7 (3 off, 4 def), AST: 6, TO: 4
TEAM FOULS: 4


Team_068
--------------------------------------------------------------------------------
Player                MIN  PTS  REB  AST  TO      FG   FG%      3P   3P%
--------------------------------------------------------------------------------
Jaren Johnson          35    8    2    0   0   3/3   100.0     0/0   0.0
Cole Anthony           19    6    0    1   0   2/2   100.0     0/0   0.0
Miles Murray           13    5    0    0   0   2/3    66.7     0/0   0.0
Ja Banchero            15    4    2    1   0   2/2   100.0     0/0   0.0
Nikola Ginobili        33    2    3    1   0   1/2    50.0     0/0   0.0
Jarrett Oladipo        15    2    2    0   0   1/3    33.3     0/0   0.0
Malcolm Herro          33    0    0    1   0   0/0     0.0     0/0   0.0
Franz Curry            15    0    0    2   0   0/0     0.0     0/0   0.0

TEAM: FG: 11/15 (73.3%), 3PT: 4/6 (66.7%), REB: 9 (3 off, 6 def), AST: 6, TO: 6
TEAM FOULS: 10 [Team_062 in BONUS]

================================================================================

================================================================================
                               FULL GAME COMPLETE                               
================================================================================

FINAL SCORE: Team_062 91, Team_068 126

SCORING BY QUARTER:
--------------------------------------------------------------------------------
Team                     Q1     Q2     Q3     Q4    FINAL
--------------------------------------------------------------------------------
Team_062                 24     21     16     30       91
Team_068                 28     34     37     27      126
--------------------------------------------------------------------------------

FULL GAME BOX SCORE:
================================================================================

Team_062
--------------------------------------------------------------------------------
Player                MIN  PTS  REB  AST  TO      FG   FG%      3P   3P%      FT STL BLK
--------------------------------------------------------------------------------
RJ Williamson          33   15    0    2   1   6/12   50.0   4/7    57.1   1/3     0   0
Michael Hyland         33    9    6    2   2   6/10   60.0   1/5    20.0   2/2     0   0
Kawhi Thompson         33    6   10    2   3   2/4    50.0   1/3    33.3   1/3     0   0
Jalen Reaves           33   12   12    0   2   4/10   40.0   0/0     0.0   7/8     0   0
Chris Bird             30   13    0    0   2   5/15   33.3   2/7    28.6   4/4     0   0
Paolo McCollum         19    5    0    1   2   1/5    20.0   0/2     0.0   2/3     2   0
Tony LaVine            15    5    0    1   0   2/3    66.7   1/2    50.0   0/0     0   0
Paul Poole             15    7    0    0   3   2/5    40.0   2/3    66.7   3/6     0   0
RJ Wall                15    2    6    2   0   2/5    40.0   0/0     0.0   0/0     1   0
Devin Young            15    5    3    1   1   2/4    50.0   0/0     0.0   3/4     1   0

TEAM: FG: 32/73 (43.8%), 3PT: 11/29 (37.9%), REB: 35 (12 off, 23 def), AST: 11, TO: 16


Team_068
--------------------------------------------------------------------------------
Player                MIN  PTS  REB  AST  TO      FG   FG%      3P   3P%      FT STL BLK
--------------------------------------------------------------------------------
Jaren Johnson          35   23   15    4   0  11/16   68.8   3/6    50.0   2/2     2   0
Malcolm Herro          33   21    1    2   1   6/12   50.0   2/7    28.6   2/3     0   2
Gary Simons            33   12    9    6   2   6/8    75.0   2/3    66.7   0/1     2   1
Nikola Ginobili        33   11    8    5   0   3/7    42.9   0/0     0.0   1/1     0   1
Zion Anunoby           30   17    0    4   0  10/12   83.3   4/4   100.0   1/1     1   0
Cole Anthony           19   15    0    2   3   5/5   100.0   5/5   100.0   3/3     0   0
Ja Banchero            15    9    3    1   1   5/7    71.4   1/2    50.0   0/0     0   2
Jarrett Oladipo        15    2    4    2   3   1/3    33.3   0/1     0.0   0/0     0   0
Franz Curry            15    9    8    3   2   2/3    66.7   0/0     0.0   1/3     2   0
Miles Murray           13    5    0    0   0   1/2    50.0   1/2    50.0   0/0     1   1

TEAM: FG: 50/75 (66.7%), 3PT: 18/30 (60.0%), REB: 50 (12 off, 38 def), AST: 29, TO: 12

================================================================================
