================================================================================
                        FULL GAME - Team_078 vs Team_060                        
================================================================================

================================================================================
                       1ST QUARTER - Team_078 vs Team_060                       
================================================================================

[12:00] Team_078 possession (Score: 0-0)
Ben Ginobili drives to the basket... Ben Ginobili throws a bad pass out of bounds! TURNOVER! (dead ball)

[11:47] Team_060 possession (Score: 0-0)
Jaren George drives and kicks out. FOUL! Shooting foul on Isaiah Simmons. Immanuel Ming to the line for 3 free throws. [Team fouls: 1] (Isaiah Simmons: 1 personal fouls)   FT 1/3: MISS   FT 2/3: GOOD   FT 3/3: GOOD Immanuel Ming makes 2/3 from the line.
Score: 0-2

[11:31] Team_078 possession (Score: 0-2)
Jabari Barrett attempts a Midrange. Contested by Jaren George (3.3 feet, MAN). JABARI BARRETT MAKES IT! Assist: Isaiah Simmons
Score: 2-2

[11:15] Team_060 possession (Score: 2-2)
Immanuel Ming attempts a Midrange. Contested by Isaiah Simmons (4.1 feet, MAN). Immanuel Ming misses. Rebound secured by Jabari Barrett.

[10:56] Team_078 possession (Score: 2-2)
Ben Ginobili attempts a 3Pt. Wide open! Julius Green is 6.3 feet away. [ZONE] Ben Ginobili misses. Rebound secured by Larry Westbrook.

[10:42] Team_060 possession (Score: 2-2)
Julius Green attempts a 3Pt. Contested by Kyrie Carter (3.0 feet, MAN). JULIUS GREEN MAKES IT! Assist: Larry Westbrook
Score: 2-5

[10:25] Team_078 possession (Score: 2-5)
Isaiah Simmons attempts a 3Pt. Contested by Julius Green (3.6 feet, ZONE). ISAIAH SIMMONS MAKES IT! Assist: Ben Ginobili
Score: 5-5

[10:08] Team_060 possession (Score: 5-5)
Immanuel Ming attempts a 3Pt. Contested by Isaiah Simmons (4.6 feet, MAN). Immanuel Ming misses. Rebound secured by Isaiah Simmons.

[09:50] Team_078 possession (Score: 5-5)
Jabari Barrett attempts a 3Pt. Heavily contested by Julius Green (1.5 feet, ZONE)! Jabari Barrett misses. Rebound secured by Larry Westbrook.

[09:35] Team_060 possession (Score: 5-5)
Immanuel Ming attempts a Layup. Contested by Jabari Barrett (4.8 feet, ZONE). Immanuel Ming misses. Rebound secured by Jabari Barrett.

[09:26] Team_078 possession (Score: 5-5)
Kyrie Carter attempts a 3Pt. Contested by Julius Green (2.0 feet, MAN). KYRIE CARTER MAKES IT!
Score: 8-5

[09:13] Team_060 possession (Score: 8-5)
Jaren George commits a violation (traveling/carry)! TURNOVER! (dead ball)

[09:00] Team_078 possession (Score: 8-5)
Isaiah Simmons drives to the basket... Isaiah Simmons throws a bad pass out of bounds! TURNOVER! (dead ball)

[08:42] Team_060 possession (Score: 8-5)
Larry Westbrook attempts a Midrange. Wide open! Ben Ginobili is 7.3 feet away. [MAN] Larry Westbrook misses. Rebound secured by Jabari Barrett.

[08:26] Team_078 possession (Score: 8-5)
Jabari Barrett drives to the basket... FOUL! Offensive foul on Jabari Barrett! Jaren George drew the charge! [Team fouls: 2] (Jabari Barrett: 1 personal fouls) TURNOVER! (dead ball)

[08:08] Team_060 possession (Score: 8-5)
Julius Green attempts a Layup. Contested by Jabari Barrett (5.1 feet, ZONE). JULIUS GREEN MAKES IT! Assist: Larry Westbrook
Score: 8-7

[07:55] Team_078 possession (Score: 8-7)
Jabari Barnes attempts a Midrange. Wide open! Joel Morant is 8.5 feet away. [MAN] Jabari Barnes misses. Rebound secured by Jaren George.

[07:38] Team_060 possession (Score: 8-7)
Immanuel Ming drives to the basket... Immanuel Ming throws a bad pass! Stolen by Ben Ginobili! TURNOVER! (live ball)

[07:23] Team_078 possession (Score: 8-7)
Jabari Barnes attempts a Midrange. Contested by Joel Morant (4.3 feet, MAN). Jabari Barnes misses. Rebound secured by Immanuel Ming.

[07:08] Team_060 possession (Score: 8-7)
Joel Morant attempts a Midrange. Heavily contested by Jabari Barnes (1.9 feet, MAN)! Joel Morant misses. Rebound secured by Ben Ginobili.

[06:50] Team_078 possession (Score: 8-7)
FOUL! Shooting foul on Julius Green. Jabari Barnes to the line for 3 free throws. [Team fouls: 1] (Julius Green: 1 personal fouls)   FT 1/3: GOOD   FT 2/3: GOOD   FT 3/3: GOOD Jabari Barnes makes 3/3 from the line.
Score: 11-7

[06:39] Team_060 possession (Score: 11-7)
Julius Green attempts a 3Pt. Contested by Kyrie Carter (4.9 feet, MAN). JULIUS GREEN MAKES IT! Assist: Jaren George
Score: 11-10

[06:25] Team_078 possession (Score: 11-10)
Jabari Barrett attempts a Layup. Contested by Jaren George (5.5 feet, ZONE). Jabari Barrett misses. Rebound secured by Immanuel Ming.

[06:09] Team_060 possession (Score: 11-10)
Immanuel Ming drives to the basket... FOUL! Offensive foul on Immanuel Ming! Jabari Barrett drew the charge! [Team fouls: 2] (Immanuel Ming: 1 personal fouls) TURNOVER! (dead ball)

[05:56] Team_078 possession (Score: 11-10)
FOUL! Offensive foul on Jabari Barrett! Jaren George drew the charge! [Team fouls: 3] (Jabari Barrett: 2 personal fouls) TURNOVER! (dead ball)

[05:40] Team_060 possession (Score: 11-10)
Joel Morant attempts a 3Pt. Contested by Isaiah Simmons (3.3 feet, ZONE). Joel Morant misses. Rebound secured by Ben Ginobili.

[05:23] Team_078 possession (Score: 11-10)
Jabari Barnes attempts a 3Pt. Wide open! Joel Morant is 8.4 feet away. [MAN] Jabari Barnes misses. Rebound secured by Immanuel Ming.

[05:12] Team_060 possession (Score: 11-10)
Immanuel Ming commits a violation (traveling/carry)! TURNOVER! (dead ball)

[04:57] Team_078 possession (Score: 11-10)
Jabari Barnes attempts a 3Pt. Contested by Julius Green (4.4 feet, ZONE). Jabari Barnes misses. Rebound secured by Jaren George.

[04:45] Team_060 possession (Score: 11-10)
Jaren George drives, Jabari Barrett stays with him. Jaren George attempts a Dunk. Wide open! Jabari Barrett is 7.1 feet away. [MAN] JAREN GEORGE MAKES IT!
Score: 11-12

[04:30] Team_078 possession (Score: 11-12)
Isaiah Simmons attempts a 3Pt. Contested by Julius Green (4.7 feet, ZONE). ISAIAH SIMMONS MAKES IT! Assist: Jabari Barrett
Score: 14-12

[04:18] Team_060 possession (Score: 14-12)
Larry Westbrook attempts a Midrange. Contested by Ben Ginobili (5.7 feet, MAN). Larry Westbrook misses. Offensive rebound by Jaren George! Jaren George's putback is no good. Rebound secured by Isaiah Simmons.

[04:05] Team_078 possession (Score: 14-12)
Isaiah Simmons drives, Larry Westbrook stays with him. Isaiah Simmons attempts a Layup. Contested by Larry Westbrook (4.2 feet, ZONE). Isaiah Simmons misses. Offensive rebound by Jabari Barrett! Jabari Barrett kicks it out.

[03:48] Team_078 possession (Score: 14-12)
FOUL! Shooting foul on Jaren George. Jabari Barrett to the line for 2 free throws. [Team fouls: 3] (Jaren George: 1 personal fouls)   FT 1/2: MISS   FT 2/2: GOOD Jabari Barrett makes 1/2 from the line.
Score: 15-12

[03:31] Team_060 possession (Score: 15-12)
Jaren George drives, Jabari Barrett stays with him. Jaren George attempts a Dunk. Contested by Jabari Barrett (3.3 feet, MAN). Jaren George misses. Offensive rebound by Jaren George! Jaren George's putback is no good. Rebound secured by Isaiah Simmons.

[03:19] Team_078 possession (Score: 15-12)
Jabari Barrett makes the Layup and draws the foul on Jaren George! And-1! Jabari Barrett to the line for 1. [Team fouls: 4] (Jaren George: 2 personal fouls)   FT 1/1: MISS Jabari Barrett makes 0/1 from the line. Rebound secured by Jaren George.
Score: 17-12

[03:03] Team_060 possession (Score: 17-12)
Larry Westbrook attempts a Layup. Contested by Ben Ginobili (2.7 feet, MAN). Larry Westbrook misses. Rebound secured by Jabari Barrett.

[02:46] Team_078 possession (Score: 17-12)
Kyrie Carter drives, Julius Green stays with him. Kyrie Carter attempts a Dunk. Heavily contested by Julius Green (0.5 feet, MAN)! KYRIE CARTER MAKES IT! Assist: Ben Ginobili
Score: 19-12

[02:34] Team_060 possession (Score: 19-12)
Joel Morant attempts a 3Pt. BLOCKED BY JABARI BARNES! Ball is loose! Offensive rebound by Jaren George! Jaren George kicks it out.

[02:23] Team_060 possession (Score: 19-12)
Immanuel Ming attempts a 3Pt. Contested by Isaiah Simmons (2.1 feet, MAN). IMMANUEL MING MAKES IT! Assist: Julius Green
Score: 19-15

[02:12] Team_078 possession (Score: 19-15)
Kyrie Carter attempts a Layup. Heavily contested by Julius Green (1.4 feet, MAN)! Kyrie Carter misses. Offensive rebound by Isaiah Simmons! Isaiah Simmons's putback is no good. Rebound secured by Immanuel Ming.

[01:59] Team_060 possession (Score: 19-15)
Immanuel Ming drives, Isaiah Simmons stays with him. Immanuel Ming attempts a Dunk. Contested by Isaiah Simmons (2.3 feet, MAN). IMMANUEL MING MAKES IT!
Score: 19-17

[01:43] Team_078 possession (Score: 19-17)
Kyrie Carter attempts a 3Pt. Contested by Julius Green (5.2 feet, MAN). Kyrie Carter misses. Rebound secured by Immanuel Ming.

[01:29] Team_060 possession (Score: 19-17)
Jaren George drives and kicks out. Julius Green attempts a 3Pt. Contested by Isaiah Simmons (4.0 feet, ZONE). JULIUS GREEN MAKES IT! Assist: Immanuel Ming
Score: 19-20

[01:13] Team_078 possession (Score: 19-20)
Kyrie Carter attempts a 3Pt. Heavily contested by Julius Green (1.1 feet, ZONE)! Kyrie Carter misses. Rebound secured by Larry Westbrook.

[01:00] Team_060 possession (Score: 19-20)
Jaren George attempts a Midrange. Contested by Jabari Barrett (5.3 feet, MAN). Jaren George misses. Rebound secured by Isaiah Simmons.

[00:43] Team_078 possession (Score: 19-20)
Kyrie Carter attempts a 3Pt. Contested by Julius Green (3.7 feet, ZONE). Kyrie Carter misses. FOUL! Loose ball foul on Jaren George during the rebound battle. [IN THE BONUS! 5 team fouls] Jabari Barrett to the line for 2 free throws. (Jaren George: 3 personal fouls)   FT 1/2: GOOD   FT 2/2: MISS Jabari Barrett makes 1/2 from the line. Offensive rebound by Jabari Barrett! Jabari Barrett kicks it out.
Score: 20-20

[00:28] Team_078 possession (Score: 20-20)
Jabari Barrett drives, Jaren George stays with him. Jabari Barrett attempts a Dunk. Contested by Jaren George (3.8 feet, MAN). Jabari Barrett misses. Rebound secured by Larry Westbrook.

[00:14] Team_060 possession (Score: 20-20)
Jaren George attempts a Layup. Contested by Jabari Barrett (3.2 feet, MAN). Jaren George misses. Offensive rebound by Immanuel Ming! Immanuel Ming kicks it out.

================================================================================
                              1ST QUARTER COMPLETE                              
================================================================================

1ST QUARTER SCORE: Team_078 20, Team_060 20

BOX SCORE:
================================================================================

Team_078
--------------------------------------------------------------------------------
Player                MIN  PTS  REB  AST  TO      FG   FG%      3P   3P%
--------------------------------------------------------------------------------
Isaiah Simmons         12    6    4    1   0   2/2   100.0     0/0   0.0
Kyrie Carter           12    5    0    0   0   2/5    40.0     0/0   0.0
Jabari Barrett         12    3    6    1   0   2/6    33.3     0/0   0.0
Jabari Barnes          12    3    0    0   0   1/5    20.0     0/0   0.0
Ben Ginobili           12    0    2    2   0   0/1     0.0     0/0   0.0

TEAM: FG: 7/19 (36.8%), 3PT: 4/10 (40.0%), REB: 11 (3 off, 8 def), AST: 4, TO: 4
TEAM FOULS: 3


Team_060
--------------------------------------------------------------------------------
Player                MIN  PTS  REB  AST  TO      FG   FG%      3P   3P%
--------------------------------------------------------------------------------
Julius Green           12   11    0    1   0   4/4   100.0     0/0   0.0
Immanuel Ming          12    7    6    1   0   3/6    50.0     0/0   0.0
Jaren George           12    2    4    1   0   1/3    33.3     0/0   0.0
Larry Westbrook        12    0    4    2   0   0/3     0.0     0/0   0.0
Joel Morant            12    0    0    0   0   0/2     0.0     0/0   0.0

TEAM: FG: 8/18 (44.4%), 3PT: 3/5 (60.0%), REB: 15 (4 off, 11 def), AST: 5, TO: 4
TEAM FOULS: 5 [Team_078 in BONUS]

================================================================================

================================================================================
                       2ND QUARTER - Team_078 vs Team_060                       
================================================================================

[12:00] Team_078 possession (Score: 20-20)
Jabari Barrett attempts a Midrange. Contested by Jaren George (5.4 feet, MAN). JABARI BARRETT MAKES IT! Assist: Ben Ginobili
Score: 22-20

[11:50] Team_060 possession (Score: 22-20)
Jaren George makes the Midrange and draws the foul on Isaiah Simmons! And-1! Jaren George to the line for 1. [Team fouls: 1] (Isaiah Simmons: 1 personal fouls)   FT 1/1: MISS Jaren George makes 0/1 from the line. Rebound secured by Jabari Barrett.
Score: 22-22

[11:36] Team_078 possession (Score: 22-22)
Isaiah Simmons throws a bad pass out of bounds! TURNOVER! (dead ball)

[11:36] Substitution (Team_078): Jabari Barnes OUT → Magic Barrett IN (stamina_rule2)

[11:36] Substitution (Team_078): Kyrie Carter OUT → Damian Allen IN (stamina_rule2)

[11:36] Substitution (Team_078): Isaiah Simmons OUT → Malcolm Randle IN (stamina_rule2)

[11:36] Substitution (Team_078): Ben Ginobili OUT → Paul Ming IN (stamina_rule2)

[11:36] Substitution (Team_078): Jabari Barrett OUT → Draymond Irving IN (stamina_rule2)

[11:36] Substitution (Team_060): Joel Morant OUT → Domantas Barnes IN (stamina_rule2)

[11:36] Substitution (Team_060): Julius Green OUT → Rudy Ginobili IN (stamina_rule2)

[11:36] Substitution (Team_060): Larry Westbrook OUT → Yao Tatum IN (stamina_rule2)

[11:36] Substitution (Team_060): Jaren George OUT → Klay Haliburton IN (stamina_rule2)

[11:22] Team_060 possession (Score: 22-22)
Rudy Ginobili drives, Damian Allen stays with him. Rudy Ginobili attempts a Layup. Contested by Damian Allen (2.9 feet, MAN). Rudy Ginobili misses. Offensive rebound by Immanuel Ming! Immanuel Ming kicks it out.

[11:12] Team_060 possession (Score: 22-22)
Domantas Barnes makes the 3Pt and draws the foul on Damian Allen! And-1! Domantas Barnes to the line for 1. [Team fouls: 2] (Damian Allen: 1 personal fouls)   FT 1/1: GOOD Domantas Barnes makes 1/1 from the line.
Score: 22-26

[11:01] Team_078 possession (Score: 22-26)
Magic Barrett attempts a 3Pt. Contested by Domantas Barnes (5.5 feet, MAN). Magic Barrett misses. Rebound secured by Klay Haliburton.

[10:44] Team_060 possession (Score: 22-26)
Immanuel Ming loses the ball! Stripped by Malcolm Randle! TURNOVER! (live ball)

[10:33] Team_078 possession (Score: 22-26)
Damian Allen drives, picks up Klay Haliburton. Help arrives from Domantas Barnes! Damian Allen attempts a Layup. Contested by Domantas Barnes (3.9 feet, ZONE). Damian Allen misses. Rebound secured by Domantas Barnes.

[10:14] Team_060 possession (Score: 22-26)
Rudy Ginobili drives and kicks out. Immanuel Ming attempts a 3Pt. Contested by Malcolm Randle (5.3 feet, MAN). Immanuel Ming misses. Offensive rebound by Klay Haliburton! Klay Haliburton's putback is no good. Rebound secured by Draymond Irving.

[09:59] Team_078 possession (Score: 22-26)
FOUL! Reach-in foul on Klay Haliburton during the drive. [Team fouls: 1] No free throws, side out. (Klay Haliburton: 1 personal fouls)

[09:46] Team_078 possession (Score: 22-26)
Magic Barrett makes the Dunk and draws the foul on Domantas Barnes! And-1! Magic Barrett to the line for 1. [Team fouls: 2] (Domantas Barnes: 1 personal fouls)   FT 1/1: GOOD Magic Barrett makes 1/1 from the line.
Score: 25-26

[09:33] Team_060 possession (Score: 25-26)
Rudy Ginobili drives, picks up Paul Ming. Help arrives from Damian Allen! Rudy Ginobili attempts a Dunk. Contested by Damian Allen (4.7 feet, ZONE). Rudy Ginobili misses. Rebound secured by Malcolm Randle.

[09:20] Team_078 possession (Score: 25-26)
Damian Allen throws a bad pass out of bounds! TURNOVER! (dead ball)

[09:20] Substitution (Team_060): Immanuel Ming OUT → Jarrett Wagner IN (stamina_rule2)

[09:03] Team_060 possession (Score: 25-26)
Yao Tatum makes the Midrange and draws the foul on Draymond Irving! And-1! Yao Tatum to the line for 1. [Team fouls: 3] (Draymond Irving: 1 personal fouls)   FT 1/1: GOOD Yao Tatum makes 1/1 from the line.
Score: 25-29

[08:47] Team_078 possession (Score: 25-29)
Damian Allen attempts a 3Pt. Wide open! Rudy Ginobili is 8.3 feet away. [MAN] Damian Allen misses. Rebound secured by Rudy Ginobili.

[08:30] Team_060 possession (Score: 25-29)
Yao Tatum attempts a Layup. Contested by Paul Ming (2.0 feet, MAN). YAO TATUM MAKES IT! Assist: Rudy Ginobili
Score: 25-31

[08:18] Team_078 possession (Score: 25-31)
Magic Barrett attempts a 3Pt. Wide open! Domantas Barnes is 7.9 feet away. [ZONE] Magic Barrett misses. Offensive rebound by Paul Ming! Paul Ming kicks it out.

[08:03] Team_078 possession (Score: 25-31)
Damian Allen attempts a 3Pt. Contested by Domantas Barnes (4.3 feet, ZONE). Damian Allen misses. Rebound secured by Klay Haliburton.

[07:47] Team_060 possession (Score: 25-31)
FOUL! Offensive foul on Rudy Ginobili! Damian Allen drew the charge! [Team fouls: 3] (Rudy Ginobili: 1 personal fouls) TURNOVER! (dead ball)

[07:30] Team_078 possession (Score: 25-31)
FOUL! Holding foul on Klay Haliburton. [Team fouls: 4] No free throws, side out. (Klay Haliburton: 2 personal fouls)

[07:14] Team_078 possession (Score: 25-31)
Magic Barrett attempts a 3Pt. Contested by Domantas Barnes (4.6 feet, MAN). Magic Barrett misses. Rebound secured by Klay Haliburton.

[06:59] Team_060 possession (Score: 25-31)
Jarrett Wagner attempts a Midrange. Contested by Paul Ming (4.0 feet, ZONE). JARRETT WAGNER MAKES IT!
Score: 25-33

[06:46] Team_078 possession (Score: 25-33)
Paul Ming attempts a Midrange. Wide open! Yao Tatum is 7.8 feet away. [ZONE] Paul Ming misses. Offensive rebound by Draymond Irving! Draymond Irving kicks it out.

[06:28] Team_078 possession (Score: 25-33)
Damian Allen attempts a Layup. BLOCKED BY RUDY GINOBILI! Ball is loose! Offensive rebound by Paul Ming! Paul Ming kicks it out.

[06:12] Team_078 possession (Score: 25-33)
FOUL! Reach-in foul on Domantas Barnes during the drive. [IN THE BONUS! 5 team fouls] Magic Barrett to the line for 2 free throws. (Domantas Barnes: 2 personal fouls)   FT 1/2: GOOD   FT 2/2: MISS Magic Barrett makes 1/2 from the line. Rebound secured by Klay Haliburton.
Score: 26-33

[05:54] Team_060 possession (Score: 26-33)
Domantas Barnes attempts a 3Pt. Contested by Damian Allen (5.8 feet, ZONE). Domantas Barnes misses. Rebound secured by Draymond Irving.

[05:40] Team_078 possession (Score: 26-33)
Malcolm Randle loses control! Ball rolls out of bounds! TURNOVER! (dead ball)

[05:22] Team_060 possession (Score: 26-33)
Domantas Barnes attempts a 3Pt. Contested by Magic Barrett (4.5 feet, MAN). Domantas Barnes misses. Rebound secured by Malcolm Randle.

[05:10] Team_078 possession (Score: 26-33)
Draymond Irving attempts a Midrange. Contested by Klay Haliburton (4.6 feet, ZONE). DRAYMOND IRVING MAKES IT!
Score: 28-33

[04:58] Team_060 possession (Score: 28-33)
Domantas Barnes attempts a Midrange. Wide open! Draymond Irving is 7.0 feet away. [ZONE] DOMANTAS BARNES MAKES IT! Assist: Klay Haliburton
Score: 28-35

[04:44] Team_078 possession (Score: 28-35)
FOUL! Holding foul on Klay Haliburton. [IN THE BONUS! 6 team fouls] Draymond Irving to the line for 2 free throws. (Klay Haliburton: 3 personal fouls)   FT 1/2: GOOD   FT 2/2: MISS Draymond Irving makes 1/2 from the line. FOUL! Loose ball foul on Rudy Ginobili during the free throw rebound! [IN THE BONUS! 7 team fouls] Paul Ming to the line for 2 free throws. (Rudy Ginobili: 2 personal fouls)   FT 1/2: GOOD   FT 2/2: GOOD Paul Ming makes 2/2 from the line.
Score: 31-35

[04:29] Team_060 possession (Score: 31-35)
Domantas Barnes attempts a 3Pt. Contested by Damian Allen (5.8 feet, ZONE). Domantas Barnes misses. Rebound secured by Draymond Irving.

[04:13] Team_078 possession (Score: 31-35)
FOUL! Holding foul on Yao Tatum. [IN THE BONUS! 8 team fouls] Paul Ming to the line for 2 free throws. (Yao Tatum: 1 personal fouls)   FT 1/2: GOOD   FT 2/2: GOOD Paul Ming makes 2/2 from the line.
Score: 33-35

[04:02] Team_060 possession (Score: 33-35)
Klay Haliburton attempts a Midrange. Wide open! Paul Ming is 7.0 feet away. [ZONE] KLAY HALIBURTON MAKES IT!
Score: 33-37

[03:49] Team_078 possession (Score: 33-37)
Magic Barrett attempts a 3Pt. Wide open! Domantas Barnes is 6.1 feet away. [ZONE] Magic Barrett misses. Rebound secured by Rudy Ginobili.

[03:39] Team_060 possession (Score: 33-37)
Yao Tatum attempts a Midrange. Heavily contested by Damian Allen (0.5 feet, ZONE)! YAO TATUM MAKES IT! Assist: Rudy Ginobili
Score: 33-39

[03:25] Team_078 possession (Score: 33-39)
Draymond Irving attempts a 3Pt. Contested by Domantas Barnes (3.6 feet, ZONE). Draymond Irving misses. Rebound secured by Rudy Ginobili.

[03:09] Team_060 possession (Score: 33-39)
Domantas Barnes attempts a 3Pt. Wide open! Damian Allen is 7.5 feet away. [ZONE] Domantas Barnes misses. FOUL! Loose ball foul on Paul Ming during the rebound battle. [Team fouls: 4] No free throws, side out. (Paul Ming: 1 personal fouls)

[02:52] Team_060 possession (Score: 33-39)
FOUL! Shooting foul on Paul Ming. Rudy Ginobili to the line for 2 free throws. [BONUS: 5 team fouls] (Paul Ming: 2 personal fouls)   FT 1/2: GOOD   FT 2/2: GOOD Rudy Ginobili makes 2/2 from the line.
Score: 33-41

[02:36] Team_078 possession (Score: 33-41)
FOUL! Holding foul on Jarrett Wagner. [IN THE BONUS! 9 team fouls] Malcolm Randle to the line for 2 free throws. (Jarrett Wagner: 1 personal fouls)   FT 1/2: GOOD   FT 2/2: GOOD Malcolm Randle makes 2/2 from the line.
Score: 35-41

[02:21] Team_060 possession (Score: 35-41)
Domantas Barnes attempts a Midrange. Wide open! Magic Barrett is 7.3 feet away. [MAN] Domantas Barnes misses. Offensive rebound by Klay Haliburton! Klay Haliburton puts it back in!
Score: 35-43

[02:03] Team_078 possession (Score: 35-43)
Damian Allen attempts a 3Pt. Contested by Domantas Barnes (3.7 feet, ZONE). DAMIAN ALLEN MAKES IT! Assist: Draymond Irving
Score: 38-43

[01:50] Team_060 possession (Score: 38-43)
Domantas Barnes attempts a 3Pt. Wide open! Magic Barrett is 6.1 feet away. [ZONE] DOMANTAS BARNES MAKES IT! Assist: Jarrett Wagner
Score: 38-46

[01:37] Team_078 possession (Score: 38-46)
Paul Ming attempts a 3Pt. Contested by Domantas Barnes (4.6 feet, ZONE). Paul Ming misses. Offensive rebound by Paul Ming! Paul Ming kicks it out.

[01:22] Team_078 possession (Score: 38-46)
Damian Allen drives and kicks out. Magic Barrett attempts a 3Pt. Contested by Domantas Barnes (3.7 feet, ZONE). MAGIC BARRETT MAKES IT!
Score: 41-46

[01:09] Team_060 possession (Score: 41-46)
Rudy Ginobili drives, picks up Damian Allen. Help arrives from Malcolm Randle! Rudy Ginobili attempts a Layup. Heavily contested by Malcolm Randle (1.5 feet, MAN)! Rudy Ginobili misses. Rebound secured by Paul Ming.

[00:59] Team_078 possession (Score: 41-46)
Paul Ming drives and kicks out. Damian Allen attempts a 3Pt. Wide open! Domantas Barnes is 6.1 feet away. [ZONE] DAMIAN ALLEN MAKES IT! Assist: Malcolm Randle
Score: 44-46

[00:43] Team_060 possession (Score: 44-46)
FOUL! Offensive foul on Rudy Ginobili! Damian Allen drew the charge! [Team fouls: 10] (Rudy Ginobili: 3 personal fouls) TURNOVER! (dead ball)

[00:30] Team_078 possession (Score: 44-46)
FOUL! Shooting foul on Domantas Barnes. Paul Ming to the line for 3 free throws. [BONUS: 11 team fouls] (Domantas Barnes: 3 personal fouls)   FT 1/3: GOOD   FT 2/3: GOOD   FT 3/3: MISS Paul Ming makes 2/3 from the line. Rebound secured by Domantas Barnes.
Score: 46-46

[00:16] Team_060 possession (Score: 46-46)
Rudy Ginobili attempts a 3Pt. Contested by Damian Allen (2.6 feet, ZONE). Rudy Ginobili misses. Rebound secured by Draymond Irving.

[00:02] Team_078 possession (Score: 46-46)
Paul Ming attempts a Midrange. Wide open! Klay Haliburton is 6.8 feet away. [ZONE] Paul Ming misses. Rebound secured by Klay Haliburton.

================================================================================
                              2ND QUARTER COMPLETE                              
================================================================================

2ND QUARTER SCORE: Team_078 26, Team_060 26

BOX SCORE:
================================================================================

Team_078
--------------------------------------------------------------------------------
Player                MIN  PTS  REB  AST  TO      FG   FG%      3P   3P%
--------------------------------------------------------------------------------
Magic Barrett          12    6    0    0   0   2/6    33.3     0/0   0.0
Damian Allen           12    6    0    0   0   2/5    40.0     0/0   0.0
Paul Ming              12    5    4    0   0   2/4    50.0     0/0   0.0
Jabari Barrett         13    2    1    0   0   1/1   100.0     0/0   0.0
Draymond Irving        12    2    5    1   0   1/2    50.0     0/0   0.0
Malcolm Randle         12    2    2    1   0   1/1   100.0     0/0   0.0
Ben Ginobili           13    0    0    1   0   0/0     0.0     0/0   0.0

TEAM: FG: 9/19 (47.4%), 3PT: 1/8 (12.5%), REB: 11 (4 off, 7 def), AST: 3, TO: 3
TEAM FOULS: 5 [Team_060 in BONUS]


Team_060
--------------------------------------------------------------------------------
Player                MIN  PTS  REB  AST  TO      FG   FG%      3P   3P%
--------------------------------------------------------------------------------
Domantas Barnes        12    9    2    0   0   3/6    50.0     0/0   0.0
Yao Tatum              12    7    0    0   0   3/3   100.0     0/0   0.0
Klay Haliburton        12    4    7    1   0   2/2   100.0     0/0   0.0
Rudy Ginobili          12    2    3    2   0   1/5    20.0     0/0   0.0
Jarrett Wagner          9    2    0    1   0   1/1   100.0     0/0   0.0
Jaren George           13    0    0    0   0   0/1     0.0     0/0   0.0
Immanuel Ming          15    0    1    0   0   0/0     0.0     0/0   0.0

TEAM: FG: 10/18 (55.6%), 3PT: 2/6 (33.3%), REB: 14 (4 off, 10 def), AST: 4, TO: 3
TEAM FOULS: 11 [Team_078 in BONUS]

================================================================================

================================================================================
                       3RD QUARTER - Team_078 vs Team_060                       
================================================================================

[12:00] Team_078 possession (Score: 46-46)
Isaiah Simmons makes the Layup and draws the foul on Julius Green! And-1! Isaiah Simmons to the line for 1. [Team fouls: 1] (Julius Green: 1 personal fouls)   FT 1/1: GOOD Isaiah Simmons makes 1/1 from the line.
Score: 49-46

[11:42] Team_060 possession (Score: 49-46)
Julius Green throws a bad pass! Stolen by Kyrie Carter! TURNOVER! (live ball)

[11:29] Team_078 possession (Score: 49-46)
Isaiah Simmons attempts a 3Pt. Heavily contested by Immanuel Ming (0.8 feet, MAN)! Isaiah Simmons misses. Rebound secured by Jaren George.

[11:14] Team_060 possession (Score: 49-46)
Joel Morant attempts a Midrange. Contested by Jabari Barnes (4.0 feet, MAN). JOEL MORANT MAKES IT! Assist: Larry Westbrook
Score: 49-48

[11:04] Team_078 possession (Score: 49-48)
Isaiah Simmons attempts a 3Pt. Wide open! Julius Green is 6.9 feet away. [ZONE] Isaiah Simmons misses. Rebound secured by Jaren George.

[10:48] Team_060 possession (Score: 49-48)
Immanuel Ming attempts a 3Pt. Wide open! Ben Ginobili is 6.3 feet away. [ZONE] Immanuel Ming misses. Rebound secured by Jabari Barrett.

[10:38] Team_078 possession (Score: 49-48)
Ben Ginobili drives, picks up Larry Westbrook. Help arrives from Julius Green! Ben Ginobili attempts a Layup. Contested by Julius Green (3.9 feet, MAN). BEN GINOBILI MAKES IT! Assist: Jabari Barrett
Score: 51-48

[10:25] Team_060 possession (Score: 51-48)
FOUL! Reach-in foul on Jabari Barnes during the drive. [Team fouls: 1] No free throws, side out. (Jabari Barnes: 1 personal fouls)

[10:10] Team_060 possession (Score: 51-48)
Jaren George attempts a Midrange. Wide open! Jabari Barrett is 6.4 feet away. [MAN] Jaren George misses. Rebound secured by Jabari Barrett.

[09:52] Team_078 possession (Score: 51-48)
Isaiah Simmons attempts a Midrange. Wide open! Immanuel Ming is 6.1 feet away. [MAN] Isaiah Simmons misses. Offensive rebound by Isaiah Simmons! Isaiah Simmons puts it back in!
Score: 53-48

[09:39] Team_060 possession (Score: 53-48)
Jaren George attempts a 3Pt. Contested by Isaiah Simmons (3.4 feet, ZONE). JAREN GEORGE MAKES IT! Assist: Joel Morant
Score: 53-51

[09:27] Team_078 possession (Score: 53-51)
Ben Ginobili attempts a 3Pt. Contested by Larry Westbrook (4.1 feet, MAN). Ben Ginobili misses. Offensive rebound by Jabari Barrett! Jabari Barrett kicks it out.

[09:14] Team_078 possession (Score: 53-51)
FOUL! Shooting foul on Immanuel Ming. Isaiah Simmons to the line for 3 free throws. [Team fouls: 2] (Immanuel Ming: 1 personal fouls)   FT 1/3: GOOD   FT 2/3: GOOD   FT 3/3: GOOD Isaiah Simmons makes 3/3 from the line.
Score: 56-51

[08:57] Team_060 possession (Score: 56-51)
Joel Morant attempts a 3Pt. Heavily contested by Jabari Barnes (1.8 feet, MAN)! Joel Morant misses. Rebound secured by Ben Ginobili.

[08:38] Team_078 possession (Score: 56-51)
Kyrie Carter attempts a 3Pt. Wide open! Julius Green is 6.2 feet away. [MAN] Kyrie Carter misses. Rebound secured by Jaren George.

[08:20] Team_060 possession (Score: 56-51)
Julius Green drives, picks up Kyrie Carter. Help arrives from Isaiah Simmons! Julius Green attempts a Dunk. Heavily contested by Isaiah Simmons (1.7 feet, MAN)! JULIUS GREEN MAKES IT! Assist: Joel Morant
Score: 56-53

[08:01] Team_078 possession (Score: 56-53)
Isaiah Simmons throws a bad pass! Stolen by Immanuel Ming! TURNOVER! (live ball)

[07:46] Team_060 possession (Score: 56-53)
FOUL! Offensive foul on Joel Morant! Jabari Barnes drew the charge! [Team fouls: 3] (Joel Morant: 1 personal fouls) TURNOVER! (dead ball)

[07:27] Team_078 possession (Score: 56-53)
Kyrie Carter attempts a Midrange. Contested by Julius Green (3.6 feet, MAN). Kyrie Carter misses. Rebound secured by Larry Westbrook.

[07:07] Team_060 possession (Score: 56-53)
Larry Westbrook attempts a 3Pt. Contested by Isaiah Simmons (4.6 feet, ZONE). Larry Westbrook misses. Rebound secured by Ben Ginobili.

[06:51] Team_078 possession (Score: 56-53)
Kyrie Carter drives, picks up Jaren George. Help arrives from Julius Green! Kyrie Carter attempts a Layup. Contested by Julius Green (3.4 feet, ZONE). KYRIE CARTER MAKES IT!
Score: 58-53

[06:35] Team_060 possession (Score: 58-53)
Immanuel Ming attempts a 3Pt. Contested by Isaiah Simmons (3.6 feet, ZONE). Immanuel Ming misses. Rebound secured by Jabari Barrett.

[06:21] Team_078 possession (Score: 58-53)
Isaiah Simmons drives to the basket... Isaiah Simmons throws a bad pass! Stolen by Jaren George! TURNOVER! (live ball)

[06:03] Team_060 possession (Score: 58-53)
Immanuel Ming drives and kicks out. Julius Green attempts a Midrange. Contested by Kyrie Carter (3.6 feet, ZONE). Julius Green misses. Rebound secured by Isaiah Simmons.

[05:47] Team_078 possession (Score: 58-53)
Kyrie Carter drives and kicks out. Jabari Barnes attempts a 3Pt. Contested by Joel Morant (4.1 feet, MAN). JABARI BARNES MAKES IT! Assist: Ben Ginobili
Score: 61-53

[05:33] Team_060 possession (Score: 61-53)
Immanuel Ming attempts a 3Pt. Wide open! Isaiah Simmons is 6.8 feet away. [MAN] Immanuel Ming misses. Offensive rebound by Jaren George! Jaren George's putback is no good. Rebound secured by Isaiah Simmons.

[05:17] Team_078 possession (Score: 61-53)
Kyrie Carter attempts a 3Pt. Wide open! Julius Green is 6.2 feet away. [ZONE] Kyrie Carter misses. Rebound secured by Larry Westbrook.

[05:01] Team_060 possession (Score: 61-53)
FOUL! Shooting foul on Jabari Barrett. Julius Green to the line for 2 free throws. [Team fouls: 2] (Jabari Barrett: 1 personal fouls)   FT 1/2: MISS   FT 2/2: GOOD Julius Green makes 1/2 from the line.
Score: 61-54

[04:46] Team_078 possession (Score: 61-54)
Kyrie Carter attempts a 3Pt. Wide open! Julius Green is 6.7 feet away. [ZONE] Kyrie Carter misses. Rebound secured by Immanuel Ming.

[04:30] Team_060 possession (Score: 61-54)
Immanuel Ming makes the Dunk and draws the foul on Jabari Barrett! And-1! Immanuel Ming to the line for 1. [Team fouls: 3] (Jabari Barrett: 2 personal fouls)   FT 1/1: GOOD Immanuel Ming makes 1/1 from the line.
Score: 61-57

[04:19] Team_078 possession (Score: 61-57)
FOUL! Reach-in foul on Jaren George during the drive. [Team fouls: 4] No free throws, side out. (Jaren George: 1 personal fouls)

[04:00] Team_078 possession (Score: 61-57)
FOUL! Reach-in foul on Jaren George during the drive. [IN THE BONUS! 5 team fouls] Jabari Barnes to the line for 2 free throws. (Jaren George: 2 personal fouls)   FT 1/2: MISS   FT 2/2: MISS Jabari Barnes makes 0/2 from the line. Rebound secured by Immanuel Ming.

[03:50] Team_060 possession (Score: 61-57)
Jaren George drives, Jabari Barrett stays with him. Jaren George attempts a Layup. Contested by Jabari Barrett (5.4 feet, MAN). JAREN GEORGE MAKES IT! Assist: Julius Green
Score: 61-59

[03:37] Team_078 possession (Score: 61-59)
Jabari Barrett attempts a Midrange. Contested by Jaren George (4.4 feet, MAN). Jabari Barrett misses. Rebound secured by Larry Westbrook.

[03:18] Team_060 possession (Score: 61-59)
FOUL! Shooting foul on Isaiah Simmons. Joel Morant to the line for 3 free throws. [Team fouls: 4] (Isaiah Simmons: 1 personal fouls)   FT 1/3: GOOD   FT 2/3: GOOD   FT 3/3: GOOD Joel Morant makes 3/3 from the line.
Score: 61-62

[03:04] Team_078 possession (Score: 61-62)
Isaiah Simmons attempts a 3Pt. Wide open! Julius Green is 7.0 feet away. [ZONE] ISAIAH SIMMONS MAKES IT! Assist: Ben Ginobili
Score: 64-62

[02:53] Team_060 possession (Score: 64-62)
Joel Morant attempts a Layup. BLOCKED BY ISAIAH SIMMONS! Ball is loose! Rebound secured by Jabari Barrett.

[02:43] Team_078 possession (Score: 64-62)
Jabari Barnes attempts a 3Pt. Wide open! Joel Morant is 6.7 feet away. [MAN] JABARI BARNES MAKES IT! Assist: Isaiah Simmons
Score: 67-62

[02:28] Team_060 possession (Score: 67-62)
Jaren George attempts a Midrange. Contested by Jabari Barrett (3.3 feet, MAN). JAREN GEORGE MAKES IT!
Score: 67-64

[02:14] Team_078 possession (Score: 67-64)
Jabari Barnes drives to the basket... Jabari Barnes loses the ball! Stripped by Jaren George! TURNOVER! (live ball)

[02:01] Team_060 possession (Score: 67-64)
Joel Morant attempts a 3Pt. Heavily contested by Isaiah Simmons (1.4 feet, ZONE)! JOEL MORANT MAKES IT! Assist: Immanuel Ming
Score: 67-67

[01:48] Team_078 possession (Score: 67-67)
Jabari Barrett makes the Layup and draws the foul on Jaren George! And-1! Jabari Barrett to the line for 1. [BONUS: 6 team fouls] (Jaren George: 3 personal fouls)   FT 1/1: GOOD Jabari Barrett makes 1/1 from the line.
Score: 70-67

[01:35] Team_060 possession (Score: 70-67)
Immanuel Ming attempts a 3Pt. Contested by Isaiah Simmons (5.3 feet, MAN). Immanuel Ming misses. Offensive rebound by Jaren George! Jaren George's putback is no good. Offensive rebound by Immanuel Ming! Immanuel Ming kicks it out.

[01:23] Team_060 possession (Score: 70-67)
Larry Westbrook attempts a Layup. BLOCKED BY BEN GINOBILI! Ball is loose! Rebound secured by Isaiah Simmons.

[01:06] Team_078 possession (Score: 70-67)
Jabari Barnes drives and kicks out. Isaiah Simmons attempts a Midrange. Contested by Immanuel Ming (3.7 feet, MAN). Isaiah Simmons misses. FOUL! Loose ball foul on Jaren George during the rebound battle. [IN THE BONUS! 7 team fouls] Isaiah Simmons to the line for 2 free throws. (Jaren George: 4 personal fouls)   FT 1/2: GOOD   FT 2/2: GOOD Isaiah Simmons makes 2/2 from the line.
Score: 72-67

[00:53] Team_060 possession (Score: 72-67)
Larry Westbrook throws a bad pass out of bounds! TURNOVER! (dead ball)

[00:53] Substitution (Team_078): Jabari Barnes OUT → Magic Barrett IN (stamina_rule2)

[00:53] Substitution (Team_078): Kyrie Carter OUT → Damian Allen IN (stamina_rule2)

[00:53] Substitution (Team_078): Isaiah Simmons OUT → Malcolm Randle IN (stamina_rule2)

[00:53] Substitution (Team_078): Ben Ginobili OUT → Paul Ming IN (stamina_rule2)

[00:53] Substitution (Team_078): Jabari Barrett OUT → Draymond Irving IN (stamina_rule2)

[00:53] Substitution (Team_060): Joel Morant OUT → Domantas Barnes IN (stamina_rule2)

[00:53] Substitution (Team_060): Julius Green OUT → Rudy Ginobili IN (stamina_rule2)

[00:53] Substitution (Team_060): Immanuel Ming OUT → Jarrett Wagner IN (stamina_rule2)

[00:53] Substitution (Team_060): Larry Westbrook OUT → Yao Tatum IN (stamina_rule2)

[00:53] Substitution (Team_060): Jaren George OUT → Klay Haliburton IN (stamina_rule2)

[00:41] Team_078 possession (Score: 72-67)
Malcolm Randle attempts a Layup. Contested by Jarrett Wagner (5.2 feet, MAN). Malcolm Randle misses. Rebound secured by Klay Haliburton.

[00:30] Team_060 possession (Score: 72-67)
Yao Tatum drives, Paul Ming stays with him. Yao Tatum attempts a Layup. Wide open! Paul Ming is 6.2 feet away. [ZONE] YAO TATUM MAKES IT! Assist: Domantas Barnes
Score: 72-69

[00:14] Team_078 possession (Score: 72-69)
Damian Allen attempts a Layup. BLOCKED BY KLAY HALIBURTON! Ball is loose! Offensive rebound by Paul Ming! Paul Ming kicks it out.

[00:02] Team_078 possession (Score: 72-69)
FOUL! Reach-in foul on Klay Haliburton during the drive. [IN THE BONUS! 8 team fouls] Draymond Irving to the line for 2 free throws. (Klay Haliburton: 1 personal fouls)   FT 1/2: MISS   FT 2/2: GOOD Draymond Irving makes 1/2 from the line.
Score: 73-69

================================================================================
                              3RD QUARTER COMPLETE                              
================================================================================

3RD QUARTER SCORE: Team_078 27, Team_060 23

BOX SCORE:
================================================================================

Team_078
--------------------------------------------------------------------------------
Player                MIN  PTS  REB  AST  TO      FG   FG%      3P   3P%
--------------------------------------------------------------------------------
Isaiah Simmons         24   13    4    1   0   5/7    71.4     0/0   0.0
Jabari Barnes          24    6    0    0   0   2/3    66.7     0/0   0.0
Jabari Barrett         24    3    5    1   0   1/2    50.0     0/0   0.0
Ben Ginobili           24    2    2    2   0   1/1   100.0     0/0   0.0
Kyrie Carter           24    2    0    0   0   1/5    20.0     0/0   0.0
Draymond Irving        13    1    0    0   0   1/1   100.0     0/0   0.0
Malcolm Randle         13    0    0    0   0   0/1     0.0     0/0   0.0
Paul Ming              13    0    1    0   0   0/0     0.0     0/0   0.0

TEAM: FG: 11/20 (55.0%), 3PT: 3/8 (37.5%), REB: 11 (3 off, 8 def), AST: 4, TO: 3
TEAM FOULS: 5 [Team_060 in BONUS]


Team_060
--------------------------------------------------------------------------------
Player                MIN  PTS  REB  AST  TO      FG   FG%      3P   3P%
--------------------------------------------------------------------------------
Joel Morant            24    8    0    2   0   3/5    60.0     0/0   0.0
Jaren George           24    7    3    0   0   3/4    75.0     0/0   0.0
Immanuel Ming          26    3    3    1   0   1/5    20.0     0/0   0.0
Julius Green           24    3    0    1   0   2/2   100.0     0/0   0.0
Yao Tatum              13    2    0    0   0   1/1   100.0     0/0   0.0
Larry Westbrook        24    0    3    1   0   0/2     0.0     0/0   0.0
Klay Haliburton        13    0    1    0   0   0/0     0.0     0/0   0.0
Domantas Barnes        13    0    0    1   0   0/0     0.0     0/0   0.0

TEAM: FG: 10/19 (52.6%), 3PT: 3/8 (37.5%), REB: 11 (2 off, 9 def), AST: 6, TO: 3
TEAM FOULS: 8 [Team_078 in BONUS]

================================================================================

================================================================================
                       4TH QUARTER - Team_078 vs Team_060                       
================================================================================

[12:00] Team_078 possession (Score: 73-69)
Jabari Barrett attempts a Midrange. Contested by Larry Westbrook (2.5 feet, ZONE). Jabari Barrett misses. Rebound secured by Jaren George.

[11:47] Team_060 possession (Score: 73-69)
Immanuel Ming attempts a 3Pt. Contested by Ben Ginobili (4.6 feet, ZONE). IMMANUEL MING MAKES IT! Assist: Larry Westbrook
Score: 73-72

[11:31] Team_078 possession (Score: 73-72)
Ben Ginobili attempts a Midrange. Wide open! Larry Westbrook is 10.0 feet away. [MAN] Ben Ginobili misses. Offensive rebound by Isaiah Simmons! Isaiah Simmons's putback is no good. Rebound secured by Jaren George.

[11:12] Team_060 possession (Score: 73-72)
FOUL! Shooting foul on Jabari Barrett. Julius Green to the line for 2 free throws. [Team fouls: 1] (Jabari Barrett: 1 personal fouls)   FT 1/2: GOOD   FT 2/2: GOOD Julius Green makes 2/2 from the line.
Score: 73-74

[10:58] Team_078 possession (Score: 73-74)
Jabari Barrett attempts a 3Pt. Wide open! Jaren George is 6.7 feet away. [MAN] Jabari Barrett misses. Rebound secured by Immanuel Ming.

[10:43] Team_060 possession (Score: 73-74)
Julius Green attempts a 3Pt. Heavily contested by Jabari Barnes (1.9 feet, ZONE)! Julius Green misses. Rebound secured by Jabari Barrett.

[10:31] Team_078 possession (Score: 73-74)
Isaiah Simmons drives, Immanuel Ming stays with him. Isaiah Simmons attempts a Layup. Contested by Immanuel Ming (3.3 feet, MAN). ISAIAH SIMMONS MAKES IT! Assist: Ben Ginobili
Score: 75-74

[10:15] Team_060 possession (Score: 75-74)
Immanuel Ming drives and kicks out. Julius Green attempts a 3Pt. Contested by Isaiah Simmons (3.3 feet, ZONE). JULIUS GREEN MAKES IT! Assist: Immanuel Ming
Score: 75-77

[10:04] Team_078 possession (Score: 75-77)
Jabari Barnes attempts a Midrange. Contested by Julius Green (3.6 feet, ZONE). Jabari Barnes misses. Rebound secured by Immanuel Ming.

[09:45] Team_060 possession (Score: 75-77)
Julius Green drives, Kyrie Carter stays with him. Julius Green attempts a Layup. Heavily contested by Kyrie Carter (0.5 feet, MAN)! JULIUS GREEN MAKES IT! Assist: Jaren George
Score: 75-79

[09:29] Team_078 possession (Score: 75-79)
Jabari Barrett drives and kicks out. Kyrie Carter attempts a 3Pt. Wide open! Julius Green is 6.7 feet away. [ZONE] Kyrie Carter misses. Rebound secured by Larry Westbrook.

[09:16] Team_060 possession (Score: 75-79)
FOUL! Reach-in foul on Jabari Barrett during the drive. [Team fouls: 2] No free throws, side out. (Jabari Barrett: 2 personal fouls)

[09:03] Team_060 possession (Score: 75-79)
Larry Westbrook drives and kicks out. Jaren George attempts a 3Pt. Contested by Jabari Barrett (4.5 feet, MAN). Jaren George misses. FOUL! Loose ball foul on Jabari Barrett during the rebound battle. [Team fouls: 3] No free throws, side out. (Jabari Barrett: 3 personal fouls)

[08:50] Team_060 possession (Score: 75-79)
Larry Westbrook attempts a Midrange. Wide open! Ben Ginobili is 6.9 feet away. [ZONE] LARRY WESTBROOK MAKES IT! Assist: Jaren George
Score: 75-81

[08:37] Team_078 possession (Score: 75-81)
Jabari Barrett attempts a Midrange. Wide open! Jaren George is 7.2 feet away. [MAN] JABARI BARRETT MAKES IT!
Score: 77-81

[08:23] Team_060 possession (Score: 77-81)
Joel Morant attempts a 3Pt. Contested by Isaiah Simmons (4.4 feet, ZONE). Joel Morant misses. Rebound secured by Ben Ginobili.

[08:08] Team_078 possession (Score: 77-81)
Ben Ginobili attempts a Midrange. Contested by Julius Green (3.9 feet, ZONE). Ben Ginobili misses. Offensive rebound by Jabari Barrett! Jabari Barrett kicks it out.

[07:59] Team_078 possession (Score: 77-81)
Kyrie Carter makes the Dunk and draws the foul on Jaren George! And-1! Kyrie Carter to the line for 1. [Team fouls: 1] (Jaren George: 1 personal fouls)   FT 1/1: GOOD Kyrie Carter makes 1/1 from the line.
Score: 80-81

[07:44] Team_060 possession (Score: 80-81)
FOUL! Shooting foul on Kyrie Carter. Julius Green to the line for 2 free throws. [Team fouls: 4] (Kyrie Carter: 1 personal fouls)   FT 1/2: MISS   FT 2/2: MISS Julius Green makes 0/2 from the line. Rebound secured by Ben Ginobili.

[07:31] Team_078 possession (Score: 80-81)
Ben Ginobili attempts a 3Pt. Wide open! Julius Green is 7.1 feet away. [ZONE] Ben Ginobili misses. Rebound secured by Larry Westbrook.

[07:16] Team_060 possession (Score: 80-81)
Julius Green attempts a Layup. Wide open! Jabari Barrett is 6.6 feet away. [ZONE] Julius Green misses. Rebound secured by Ben Ginobili.

[07:00] Team_078 possession (Score: 80-81)
Ben Ginobili attempts a 3Pt. Wide open! Julius Green is 6.3 feet away. [ZONE] Ben Ginobili misses. Rebound secured by Immanuel Ming.

[06:45] Team_060 possession (Score: 80-81)
Immanuel Ming attempts a 3Pt. Wide open! Isaiah Simmons is 7.7 feet away. [ZONE] Immanuel Ming misses. Rebound secured by Jabari Barrett.

[06:34] Team_078 possession (Score: 80-81)
Isaiah Simmons attempts a 3Pt. Contested by Julius Green (3.0 feet, ZONE). Isaiah Simmons misses. Rebound secured by Immanuel Ming.

[06:17] Team_060 possession (Score: 80-81)
Larry Westbrook attempts a Midrange. Contested by Ben Ginobili (5.5 feet, MAN). Larry Westbrook misses. Offensive rebound by Immanuel Ming! Immanuel Ming kicks it out.

[06:07] Team_060 possession (Score: 80-81)
Joel Morant attempts a 3Pt. Wide open! Jabari Barnes is 6.3 feet away. [MAN] Joel Morant misses. Rebound secured by Jabari Barrett.

[05:56] Team_078 possession (Score: 80-81)
FOUL! Shooting foul on Jaren George. Jabari Barrett to the line for 2 free throws. [Team fouls: 2] (Jaren George: 2 personal fouls)   FT 1/2: MISS   FT 2/2: GOOD Jabari Barrett makes 1/2 from the line.
Score: 81-81

[05:42] Team_060 possession (Score: 81-81)
Jaren George attempts a Layup. Contested by Jabari Barrett (3.4 feet, MAN). JAREN GEORGE MAKES IT! Assist: Immanuel Ming
Score: 81-83

[05:25] Team_078 possession (Score: 81-83)
Kyrie Carter drives and kicks out. Kyrie Carter attempts a 3Pt. Contested by Julius Green (4.2 feet, MAN). Kyrie Carter misses. Rebound secured by Jaren George.

[05:09] Team_060 possession (Score: 81-83)
FOUL! Reach-in foul on Jabari Barnes during the drive. [IN THE BONUS! 5 team fouls] Joel Morant to the line for 2 free throws. (Jabari Barnes: 1 personal fouls)   FT 1/2: GOOD   FT 2/2: MISS Joel Morant makes 1/2 from the line. Rebound secured by Jabari Barrett.
Score: 81-84

[04:58] Team_078 possession (Score: 81-84)
Jabari Barrett attempts a 3Pt. Wide open! Immanuel Ming is 6.5 feet away. [ZONE] Jabari Barrett misses. Rebound secured by Jaren George.

[04:46] Team_060 possession (Score: 81-84)
Joel Morant attempts a 3Pt. Contested by Isaiah Simmons (3.8 feet, ZONE). JOEL MORANT MAKES IT! Assist: Immanuel Ming
Score: 81-87

[04:31] Team_078 possession (Score: 81-87)
Jabari Barnes drives, Larry Westbrook stays with him. Jabari Barnes attempts a Dunk. Wide open! Larry Westbrook is 7.0 feet away. [ZONE] JABARI BARNES MAKES IT! Assist: Ben Ginobili
Score: 83-87

[04:16] Team_060 possession (Score: 83-87)
Joel Morant attempts a 3Pt. Wide open! Jabari Barnes is 8.1 feet away. [MAN] Joel Morant misses. Rebound secured by Isaiah Simmons.

[04:00] Team_078 possession (Score: 83-87)
FOUL! Reach-in foul on Jaren George during the drive. [Team fouls: 3] No free throws, side out. (Jaren George: 3 personal fouls)

[03:41] Team_078 possession (Score: 83-87)
Jabari Barrett drives, Jaren George stays with him. Jabari Barrett attempts a Dunk. Wide open! Jaren George is 6.6 feet away. [MAN] JABARI BARRETT MAKES IT! Assist: Kyrie Carter
Score: 85-87

[03:28] Team_060 possession (Score: 85-87)
Joel Morant attempts a 3Pt. Contested by Isaiah Simmons (2.1 feet, ZONE). Joel Morant misses. Rebound secured by Jabari Barrett.

[03:08] Team_078 possession (Score: 85-87)
FOUL! Shooting foul on Larry Westbrook. Ben Ginobili to the line for 2 free throws. [Team fouls: 4] (Larry Westbrook: 1 personal fouls)   FT 1/2: GOOD   FT 2/2: GOOD Ben Ginobili makes 2/2 from the line.
Score: 87-87

[02:57] Team_060 possession (Score: 87-87)
Joel Morant attempts a Midrange. Wide open! Jabari Barnes is 7.2 feet away. [MAN] Joel Morant misses. Offensive rebound by Immanuel Ming! Immanuel Ming kicks it out.

[02:40] Team_060 possession (Score: 87-87)
Jaren George attempts a Midrange. Wide open! Ben Ginobili is 8.1 feet away. [ZONE] JAREN GEORGE MAKES IT! Assist: Julius Green
Score: 87-89

[02:30] Team_078 possession (Score: 87-89)
Kyrie Carter drives, picks up Julius Green. Help arrives from Immanuel Ming! Kyrie Carter attempts a Dunk. Heavily contested by Immanuel Ming (1.1 feet, MAN)! Kyrie Carter misses. Rebound secured by Larry Westbrook.

[02:17] Team_060 possession (Score: 87-89)
Julius Green loses the ball! Stripped by Kyrie Carter! TURNOVER! (live ball)

[02:04] Team_078 possession (Score: 87-89)
FOUL! Shooting foul on Julius Green. Ben Ginobili to the line for 2 free throws. [BONUS: 5 team fouls] (Julius Green: 1 personal fouls)   FT 1/2: GOOD   FT 2/2: GOOD Ben Ginobili makes 2/2 from the line.
Score: 89-89

[01:49] Team_060 possession (Score: 89-89)
Jaren George attempts a Layup. Wide open! Jabari Barrett is 7.9 feet away. [ZONE] Jaren George misses. Rebound secured by Isaiah Simmons.

[01:34] Team_078 possession (Score: 89-89)
Jabari Barnes attempts a 3Pt. Wide open! Immanuel Ming is 7.1 feet away. [ZONE] JABARI BARNES MAKES IT! Assist: Isaiah Simmons
Score: 92-89

[01:19] Team_060 possession (Score: 92-89)
Julius Green throws a bad pass! Stolen by Kyrie Carter! TURNOVER! (live ball)

[01:02] Team_078 possession (Score: 92-89)
Jabari Barnes drives and kicks out. Jabari Barnes attempts a 3Pt. Wide open! Joel Morant is 7.0 feet away. [MAN] Jabari Barnes misses. Offensive rebound by Jabari Barrett! Jabari Barrett kicks it out.

[00:46] Team_078 possession (Score: 92-89)
Jabari Barnes attempts a Layup. Wide open! Joel Morant is 8.4 feet away. [MAN] JABARI BARNES MAKES IT! Assist: Isaiah Simmons
Score: 94-89

[00:29] Team_060 possession (Score: 94-89)
Joel Morant throws a bad pass! Stolen by Jabari Barnes! TURNOVER! (live ball)

[00:19] Team_078 possession (Score: 94-89)
Kyrie Carter attempts a Midrange. Wide open! Immanuel Ming is 6.8 feet away. [ZONE] Kyrie Carter misses. Rebound secured by Larry Westbrook.

[00:04] Team_060 possession (Score: 94-89)
Immanuel Ming loses control! Ball rolls out of bounds! TURNOVER! (dead ball)

[00:04] Substitution (Team_078): Jabari Barnes OUT → Magic Barrett IN (stamina_rule2)

[00:04] Substitution (Team_078): Kyrie Carter OUT → Damian Allen IN (stamina_rule2)

[00:04] Substitution (Team_078): Isaiah Simmons OUT → Malcolm Randle IN (stamina_rule2)

[00:04] Substitution (Team_078): Ben Ginobili OUT → Paul Ming IN (stamina_rule2)

[00:04] Substitution (Team_078): Jabari Barrett OUT → Draymond Irving IN (stamina_rule2)

[00:04] Substitution (Team_060): Joel Morant OUT → Domantas Barnes IN (stamina_rule2)

[00:04] Substitution (Team_060): Julius Green OUT → Rudy Ginobili IN (stamina_rule2)

[00:04] Substitution (Team_060): Immanuel Ming OUT → Jarrett Wagner IN (stamina_rule2)

[00:04] Substitution (Team_060): Larry Westbrook OUT → Yao Tatum IN (stamina_rule2)

[00:04] Substitution (Team_060): Jaren George OUT → Klay Haliburton IN (stamina_rule2)

================================================================================
                              4TH QUARTER COMPLETE                              
================================================================================

4TH QUARTER SCORE: Team_078 21, Team_060 20

BOX SCORE:
================================================================================

Team_078
--------------------------------------------------------------------------------
Player                MIN  PTS  REB  AST  TO      FG   FG%      3P   3P%
--------------------------------------------------------------------------------
Jabari Barnes          36    7    0    0   0   3/4    75.0     0/0   0.0
Jabari Barrett         36    5    7    0   0   3/7    42.9     0/0   0.0
Ben Ginobili           36    4    3    2   0   2/5    40.0     0/0   0.0
Kyrie Carter           36    3    0    1   0   1/4    25.0     0/0   0.0
Isaiah Simmons         36    2    2    2   0   1/2    50.0     0/0   0.0

TEAM: FG: 10/22 (45.5%), 3PT: 1/6 (16.7%), REB: 13 (3 off, 10 def), AST: 5, TO: 0
TEAM FOULS: 5 [Team_060 in BONUS]


Team_060
--------------------------------------------------------------------------------
Player                MIN  PTS  REB  AST  TO      FG   FG%      3P   3P%
--------------------------------------------------------------------------------
Julius Green           36    7    0    1   0   3/6    50.0     0/0   0.0
Jaren George           36    4    4    2   0   2/3    66.7     0/0   0.0
Immanuel Ming          38    3    7    3   0   1/2    50.0     0/0   0.0
Joel Morant            36    3    0    0   0   1/6    16.7     0/0   0.0
Larry Westbrook        36    2    4    1   0   1/1   100.0     0/0   0.0

TEAM: FG: 8/18 (44.4%), 3PT: 2/8 (25.0%), REB: 14 (3 off, 11 def), AST: 7, TO: 4
TEAM FOULS: 5 [Team_078 in BONUS]

================================================================================

================================================================================
                               FULL GAME COMPLETE                               
================================================================================

FINAL SCORE: Team_078 94, Team_060 89

SCORING BY QUARTER:
--------------------------------------------------------------------------------
Team                     Q1     Q2     Q3     Q4    FINAL
--------------------------------------------------------------------------------
Team_078                 20     26     27     21       94
Team_060                 20     26     23     20       89
--------------------------------------------------------------------------------

FULL GAME BOX SCORE:
================================================================================

Team_078
--------------------------------------------------------------------------------
Player                MIN  PTS  REB  AST  TO      FG   FG%      3P   3P%      FT STL BLK
--------------------------------------------------------------------------------
Jabari Barnes          36   16    0    0   1   6/12   50.0   3/5    60.0   3/5     1   1
Kyrie Carter           36   10    0    1   3   5/15   33.3   1/6    16.7   1/1     3   0
Isaiah Simmons         36   21   10    4   2   7/10   70.0   4/7    57.1   6/6     0   1
Ben Ginobili           36    6    7    7   0   3/7    42.9   0/3     0.0   4/4     1   1
Jabari Barrett         36   13   19    2   2   7/16   43.8   0/3     0.0   4/8     0   0
Magic Barrett          13    6    0    0   0   1/5    20.0   0/3     0.0   2/3     0   0
Damian Allen           13    6    0    0   1   2/5    40.0   1/3    33.3   0/0     0   0
Malcolm Randle         13    2    2    1   1   0/1     0.0   0/0     0.0   2/2     1   0
Paul Ming              13    5    5    0   0   1/3    33.3   0/1     0.0   4/5     0   0
Draymond Irving        13    3    5    1   0   2/3    66.7   0/1     0.0   2/4     0   0

TEAM: FG: 37/80 (46.2%), 3PT: 9/32 (28.1%), REB: 46 (13 off, 33 def), AST: 16, TO: 10


Team_060
--------------------------------------------------------------------------------
Player                MIN  PTS  REB  AST  TO      FG   FG%      3P   3P%      FT STL BLK
--------------------------------------------------------------------------------
Immanuel Ming          38   13   17    5   3   5/13   38.5   2/7    28.6   3/4     1   0
Joel Morant            36   11    0    2   3   4/13   30.8   3/9    33.3   4/5     0   0
Julius Green           36   21    0    3   4   7/10   70.0   2/3    66.7   3/6     0   0
Larry Westbrook        36    2   11    4   1   1/6    16.7   0/1     0.0   0/0     0   0
Jaren George           36   13   11    3   1   8/13   61.5   1/1   100.0   0/1     2   0
Domantas Barnes        13    9    2    1   0   4/7    57.1   2/5    40.0   1/1     0   0
Rudy Ginobili          13    2    3    2   2   1/5    20.0   0/1     0.0   2/2     0   1
Yao Tatum              13    9    0    0   0   4/4   100.0   0/0     0.0   1/1     0   0
Klay Haliburton        13    4    8    1   0   1/1   100.0   0/0     0.0   0/0     0   1
Jarrett Wagner         10    2    0    1   0   1/1   100.0   0/0     0.0   0/0     0   0

TEAM: FG: 36/73 (49.3%), 3PT: 10/27 (37.0%), REB: 54 (13 off, 41 def), AST: 22, TO: 14

================================================================================
