================================================================================
                        FULL GAME - Team_060 vs Team_081                        
================================================================================

================================================================================
                       1ST QUARTER - Team_060 vs Team_081                       
================================================================================

[12:00] Team_060 possession (Score: 0-0)
Immanuel Ming attempts a 3Pt. Contested by Vince Adebayo (3.9 feet, ZONE). Immanuel Ming misses. Rebound secured by Bradley Sabonis.

[11:49] Team_081 possession (Score: 0-0)
Bradley Sabonis attempts a Midrange. Contested by Larry Westbrook (5.5 feet, MAN). BRADLEY SABONIS MAKES IT! Assist: Julius Durant
Score: 0-2

[11:35] Team_060 possession (Score: 0-2)
Jaren George throws a bad pass out of bounds! TURNOVER! (dead ball)

[11:25] Team_081 possession (Score: 0-2)
FOUL! Shooting foul on Joel Morant. Bradley Sabonis to the line for 2 free throws. [Team fouls: 1] (Joel Morant: 1 personal fouls)   FT 1/2: MISS   FT 2/2: GOOD Bradley Sabonis makes 1/2 from the line.
Score: 0-3

[11:11] Team_060 possession (Score: 0-3)
Larry Westbrook attempts a 3Pt. Contested by Vince Adebayo (3.4 feet, ZONE). Larry Westbrook misses. Rebound secured by Vince Adebayo.

[10:59] Team_081 possession (Score: 0-3)
Bradley Leonard attempts a 3Pt. Contested by Julius Green (2.1 feet, MAN). Bradley Leonard misses. Rebound secured by Larry Westbrook.

[10:45] Team_060 possession (Score: 0-3)
Immanuel Ming drives, Vince Adebayo stays with him. Immanuel Ming attempts a Layup. Heavily contested by Vince Adebayo (1.2 feet, MAN)! Immanuel Ming misses. Rebound secured by Bradley Sabonis.

[10:31] Team_081 possession (Score: 0-3)
FOUL! Shooting foul on Joel Morant. Julius Durant to the line for 3 free throws. [Team fouls: 2] (Joel Morant: 2 personal fouls)   FT 1/3: GOOD   FT 2/3: MISS   FT 3/3: GOOD Julius Durant makes 2/3 from the line.
Score: 0-5

[10:12] Team_060 possession (Score: 0-5)
Jaren George attempts a Midrange. Heavily contested by Bradley Sabonis (1.4 feet, ZONE)! JAREN GEORGE MAKES IT!
Score: 2-5

[10:00] Team_081 possession (Score: 2-5)
Bradley Leonard attempts a 3Pt. Contested by Julius Green (3.8 feet, ZONE). Bradley Leonard misses. Rebound secured by Larry Westbrook.

[09:49] Team_060 possession (Score: 2-5)
Jaren George drives, Franz Antetokounmpo stays with him. Jaren George attempts a Dunk. Contested by Franz Antetokounmpo (2.0 feet, MAN). Jaren George misses. Rebound secured by Vince Adebayo.

[09:30] Team_081 possession (Score: 2-5)
Bradley Sabonis attempts a Layup. Contested by Larry Westbrook (5.7 feet, MAN). BRADLEY SABONIS MAKES IT! Assist: Franz Antetokounmpo
Score: 2-7

[09:17] Team_060 possession (Score: 2-7)
Jaren George makes the Layup and draws the foul on Franz Antetokounmpo! And-1! Jaren George to the line for 1. [Team fouls: 1] (Franz Antetokounmpo: 1 personal fouls)   FT 1/1: MISS Jaren George makes 0/1 from the line. Rebound secured by Franz Antetokounmpo.
Score: 4-7

[09:01] Team_081 possession (Score: 4-7)
Franz Antetokounmpo drives to the basket... Franz Antetokounmpo throws a bad pass out of bounds! TURNOVER! (dead ball)

[08:44] Team_060 possession (Score: 4-7)
Jaren George makes the Layup and draws the foul on Bradley Leonard! And-1! Jaren George to the line for 1. [Team fouls: 2] (Bradley Leonard: 1 personal fouls)   FT 1/1: MISS Jaren George makes 0/1 from the line. Rebound secured by Franz Antetokounmpo.
Score: 6-7

[08:25] Team_081 possession (Score: 6-7)
FOUL! Shooting foul on Jaren George. Bradley Sabonis to the line for 2 free throws. [Team fouls: 3] (Jaren George: 1 personal fouls)   FT 1/2: MISS   FT 2/2: GOOD Bradley Sabonis makes 1/2 from the line.
Score: 6-8

[08:06] Team_060 possession (Score: 6-8)
Larry Westbrook attempts a Midrange. Contested by Bradley Sabonis (2.7 feet, ZONE). LARRY WESTBROOK MAKES IT! Assist: Joel Morant
Score: 8-8

[07:50] Team_081 possession (Score: 8-8)
Franz Antetokounmpo attempts a Midrange. Wide open! Larry Westbrook is 7.7 feet away. [ZONE] FRANZ ANTETOKOUNMPO MAKES IT! Assist: Bradley Sabonis
Score: 8-10

[07:35] Team_060 possession (Score: 8-10)
Larry Westbrook attempts a Midrange. Contested by Bradley Sabonis (4.2 feet, MAN). Larry Westbrook misses. Rebound secured by Vince Adebayo.

[07:21] Team_081 possession (Score: 8-10)
Bradley Sabonis attempts a Layup. Contested by Larry Westbrook (4.2 feet, MAN). Bradley Sabonis misses. Offensive rebound by Bradley Sabonis! Bradley Sabonis kicks it out.

[07:10] Team_081 possession (Score: 8-10)
Julius Durant drives, picks up Jaren George. Help arrives from Julius Green! Julius Durant attempts a Layup. Contested by Julius Green (5.1 feet, ZONE). Julius Durant misses. Rebound secured by Jaren George.

[06:55] Team_060 possession (Score: 8-10)
Larry Westbrook makes the Layup and draws the foul on Franz Antetokounmpo! And-1! Larry Westbrook to the line for 1. [Team fouls: 3] (Franz Antetokounmpo: 2 personal fouls)   FT 1/1: GOOD Larry Westbrook makes 1/1 from the line.
Score: 11-10

[06:41] Team_081 possession (Score: 11-10)
Bradley Sabonis attempts a 3Pt. Wide open! Julius Green is 6.2 feet away. [ZONE] Bradley Sabonis misses. FOUL! Loose ball foul on Immanuel Ming during the rebound battle. [Team fouls: 4] No free throws, side out. (Immanuel Ming: 1 personal fouls)

[06:27] Team_081 possession (Score: 11-10)
Vince Adebayo attempts a 3Pt. Contested by Julius Green (3.0 feet, ZONE). Vince Adebayo misses. Offensive rebound by Franz Antetokounmpo! Franz Antetokounmpo puts it back in!
Score: 11-12

[06:09] Team_060 possession (Score: 11-12)
Joel Morant drives to the basket... Joel Morant throws a bad pass out of bounds! TURNOVER! (dead ball)

[05:57] Team_081 possession (Score: 11-12)
Vince Adebayo drives, picks up Immanuel Ming. Help arrives from Julius Green! Vince Adebayo attempts a Dunk. Contested by Julius Green (4.2 feet, MAN). Vince Adebayo misses. Offensive rebound by Bradley Sabonis! Bradley Sabonis kicks it out.

[05:46] Team_081 possession (Score: 11-12)
Bradley Leonard attempts a 3Pt. Contested by Julius Green (3.3 feet, MAN). Bradley Leonard misses. Offensive rebound by Bradley Sabonis! Bradley Sabonis kicks it out.

[05:31] Team_081 possession (Score: 11-12)
Franz Antetokounmpo attempts a Layup. Contested by Jaren George (4.5 feet, MAN). FRANZ ANTETOKOUNMPO MAKES IT!
Score: 11-14

[05:16] Team_060 possession (Score: 11-14)
FOUL! Shooting foul on Julius Durant. Joel Morant to the line for 3 free throws. [Team fouls: 4] (Julius Durant: 1 personal fouls)   FT 1/3: GOOD   FT 2/3: GOOD   FT 3/3: GOOD Joel Morant makes 3/3 from the line.
Score: 14-14

[04:57] Team_081 possession (Score: 14-14)
Bradley Sabonis loses the ball! Stripped by Larry Westbrook! TURNOVER! (live ball)

[04:41] Team_060 possession (Score: 14-14)
Jaren George throws a bad pass! Stolen by Franz Antetokounmpo! TURNOVER! (live ball)

[04:25] Team_081 possession (Score: 14-14)
Franz Antetokounmpo drives to the basket... Franz Antetokounmpo throws a bad pass out of bounds! TURNOVER! (dead ball)

[04:15] Team_060 possession (Score: 14-14)
Joel Morant attempts a Midrange. Contested by Julius Durant (4.8 feet, MAN). JOEL MORANT MAKES IT!
Score: 16-14

[04:04] Team_081 possession (Score: 16-14)
Bradley Leonard attempts a 3Pt. Wide open! Julius Green is 6.0 feet away. [ZONE] BRADLEY LEONARD MAKES IT!
Score: 16-17

[03:49] Team_060 possession (Score: 16-17)
Joel Morant drives to the basket... Joel Morant throws a bad pass! Stolen by Julius Durant! TURNOVER! (live ball)

[03:32] Team_081 possession (Score: 16-17)
Bradley Leonard drives to the basket... Bradley Leonard throws a bad pass out of bounds! TURNOVER! (dead ball)

[03:18] Team_060 possession (Score: 16-17)
Immanuel Ming attempts a Midrange. Contested by Vince Adebayo (2.4 feet, MAN). Immanuel Ming misses. Rebound secured by Vince Adebayo.

[03:07] Team_081 possession (Score: 16-17)
Julius Durant drives, Joel Morant stays with him. Julius Durant attempts a Dunk. Contested by Joel Morant (6.0 feet, MAN). Julius Durant misses. Rebound secured by Immanuel Ming.

[02:50] Team_060 possession (Score: 16-17)
Immanuel Ming drives to the basket... FOUL! Offensive foul on Immanuel Ming! Franz Antetokounmpo drew the charge! [Team fouls: 5] (Immanuel Ming: 2 personal fouls) TURNOVER! (dead ball)

[02:40] Team_081 possession (Score: 16-17)
Julius Durant attempts a Midrange. Contested by Joel Morant (3.4 feet, MAN). JULIUS DURANT MAKES IT! Assist: Bradley Leonard
Score: 16-19

[02:27] Team_060 possession (Score: 16-19)
Larry Westbrook attempts a Midrange. Contested by Bradley Sabonis (4.9 feet, MAN). Larry Westbrook misses. Rebound secured by Franz Antetokounmpo.

[02:09] Team_081 possession (Score: 16-19)
Franz Antetokounmpo attempts a 3Pt. Contested by Jaren George (3.0 feet, MAN). Franz Antetokounmpo misses. Rebound secured by Jaren George.

[01:55] Team_060 possession (Score: 16-19)
Julius Green attempts a Layup. BLOCKED BY BRADLEY LEONARD! Ball is loose! Rebound secured by Vince Adebayo.

[01:41] Team_081 possession (Score: 16-19)
Julius Durant attempts a Layup. Contested by Jaren George (5.5 feet, ZONE). JULIUS DURANT MAKES IT! Assist: Bradley Sabonis
Score: 16-21

[01:31] Team_060 possession (Score: 16-21)
Immanuel Ming drives and kicks out. Immanuel Ming attempts a 3Pt. Contested by Bradley Leonard (3.9 feet, ZONE). Immanuel Ming misses. FOUL! Loose ball foul on Vince Adebayo during the rebound battle. [IN THE BONUS! 5 team fouls] Immanuel Ming to the line for 2 free throws. (Vince Adebayo: 1 personal fouls)   FT 1/2: GOOD   FT 2/2: GOOD Immanuel Ming makes 2/2 from the line.
Score: 18-21

[01:15] Team_081 possession (Score: 18-21)
Julius Durant commits a violation (traveling/carry)! TURNOVER! (dead ball)

[01:15] Substitution (Team_060): Joel Morant OUT → Domantas Barnes IN (stamina_rule2)

[01:15] Substitution (Team_060): Julius Green OUT → Rudy Ginobili IN (stamina_rule2)

[01:15] Substitution (Team_060): Immanuel Ming OUT → Jarrett Wagner IN (stamina_rule2)

[01:15] Substitution (Team_060): Larry Westbrook OUT → Yao Tatum IN (stamina_rule2)

[01:15] Substitution (Team_060): Jaren George OUT → Klay Haliburton IN (stamina_rule2)

[01:15] Substitution (Team_081): Julius Durant OUT → Dejounte Bane IN (stamina_rule2)

[01:15] Substitution (Team_081): Bradley Leonard OUT → Lamelo Wade IN (stamina_rule2)

[01:15] Substitution (Team_081): Vince Adebayo OUT → Larry Adebayo IN (stamina_rule2)

[01:15] Substitution (Team_081): Bradley Sabonis OUT → Chris Holiday IN (stamina_rule2)

[01:15] Substitution (Team_081): Franz Antetokounmpo OUT → D'Angelo Markkanen IN (stamina_rule2)

[01:01] Team_060 possession (Score: 18-21)
Klay Haliburton drives, Chris Holiday stays with him. Klay Haliburton attempts a Layup. Contested by Chris Holiday (2.5 feet, ZONE). KLAY HALIBURTON MAKES IT! Assist: Yao Tatum
Score: 20-21

[00:46] Team_081 possession (Score: 20-21)
Larry Adebayo attempts a 3Pt. Wide open! Jarrett Wagner is 6.4 feet away. [MAN] Larry Adebayo misses. Rebound secured by Rudy Ginobili.

[00:32] Team_060 possession (Score: 20-21)
Domantas Barnes attempts a 3Pt. Contested by Dejounte Bane (5.5 feet, MAN). Domantas Barnes misses. Rebound secured by Lamelo Wade.

[00:19] Team_081 possession (Score: 20-21)
Chris Holiday attempts a Midrange. Contested by Domantas Barnes (3.9 feet, ZONE). Chris Holiday misses. Rebound secured by Domantas Barnes.

[00:03] Team_060 possession (Score: 20-21)
Jarrett Wagner attempts a 3Pt. Wide open! Larry Adebayo is 7.3 feet away. [MAN] JARRETT WAGNER MAKES IT! Assist: Yao Tatum
Score: 23-21

================================================================================
                              1ST QUARTER COMPLETE                              
================================================================================

1ST QUARTER SCORE: Team_060 23, Team_081 21

BOX SCORE:
================================================================================

Team_060
--------------------------------------------------------------------------------
Player                MIN  PTS  REB  AST  TO      FG   FG%      3P   3P%
--------------------------------------------------------------------------------
Larry Westbrook        11    5    2    0   0   2/5    40.0     0/0   0.0
Joel Morant            11    5    0    1   0   2/2   100.0     0/0   0.0
Jarrett Wagner          1    3    0    0   0   1/1   100.0     0/0   0.0
Immanuel Ming          11    2    1    0   0   1/4    25.0     0/0   0.0
Jaren George           11    2    2    0   0   1/4    25.0     0/0   0.0
Klay Haliburton         1    2    0    0   0   1/1   100.0     0/0   0.0
Julius Green           11    0    0    0   0   0/1     0.0     0/0   0.0
Yao Tatum               1    0    0    2   0   0/0     0.0     0/0   0.0
Rudy Ginobili           1    0    1    0   0   0/0     0.0     0/0   0.0
Domantas Barnes         1    0    1    0   0   0/1     0.0     0/0   0.0

TEAM: FG: 8/19 (42.1%), 3PT: 2/5 (40.0%), REB: 7 (0 off, 7 def), AST: 3, TO: 5
TEAM FOULS: 5 [Team_081 in BONUS]


Team_081
--------------------------------------------------------------------------------
Player                MIN  PTS  REB  AST  TO      FG   FG%      3P   3P%
--------------------------------------------------------------------------------
Bradley Sabonis        11    6    6    2   0   4/4   100.0     0/0   0.0
Julius Durant          11    6    0    1   0   3/5    60.0     0/0   0.0
Franz Antetokounmpo    11    6    4    1   0   3/4    75.0     0/0   0.0
Bradley Leonard        11    3    0    1   0   1/3    33.3     0/0   0.0
Vince Adebayo          11    0    5    0   0   0/0     0.0     0/0   0.0
Larry Adebayo           1    0    0    0   0   0/1     0.0     0/0   0.0
Lamelo Wade             1    0    1    0   0   0/0     0.0     0/0   0.0
Chris Holiday           1    0    0    0   0   0/1     0.0     0/0   0.0

TEAM: FG: 11/18 (61.1%), 3PT: 3/7 (42.9%), REB: 16 (5 off, 11 def), AST: 5, TO: 5
TEAM FOULS: 5 [Team_060 in BONUS]

================================================================================

================================================================================
                       2ND QUARTER - Team_060 vs Team_081                       
================================================================================

[12:00] Team_060 possession (Score: 23-21)
FOUL! Shooting foul on Vince Adebayo. Immanuel Ming to the line for 2 free throws. [Team fouls: 1] (Vince Adebayo: 1 personal fouls)   FT 1/2: MISS   FT 2/2: GOOD Immanuel Ming makes 1/2 from the line.
Score: 24-21

[11:43] Team_081 possession (Score: 24-21)
Julius Durant attempts a Midrange. Wide open! Larry Westbrook is 6.1 feet away. [ZONE] Julius Durant misses. Rebound secured by Immanuel Ming.

[11:24] Team_060 possession (Score: 24-21)
Jaren George drives, Franz Antetokounmpo stays with him. Jaren George attempts a Dunk. Contested by Franz Antetokounmpo (3.0 feet, MAN). Jaren George misses. Offensive rebound by Immanuel Ming! Immanuel Ming kicks it out.

[11:06] Team_060 possession (Score: 24-21)
Larry Westbrook commits a violation (traveling/carry)! TURNOVER! (dead ball)

[11:06] Substitution (Team_060): Joel Morant OUT → Domantas Barnes IN (stamina_rule2)

[11:06] Substitution (Team_060): Larry Westbrook OUT → Yao Tatum IN (stamina_rule2)

[11:06] Substitution (Team_060): Jaren George OUT → Klay Haliburton IN (stamina_rule2)

[11:06] Substitution (Team_081): Vince Adebayo OUT → Larry Adebayo IN (stamina_rule2)

[10:54] Team_081 possession (Score: 24-21)
Bradley Sabonis attempts a Midrange. Contested by Yao Tatum (4.8 feet, ZONE). BRADLEY SABONIS MAKES IT! Assist: Franz Antetokounmpo
Score: 24-23

[10:40] Team_060 possession (Score: 24-23)
Domantas Barnes attempts a Midrange. Contested by Bradley Leonard (5.5 feet, ZONE). Domantas Barnes misses. Rebound secured by Larry Adebayo.

[10:21] Team_081 possession (Score: 24-23)
Bradley Sabonis attempts a 3Pt. Contested by Domantas Barnes (3.0 feet, ZONE). BRADLEY SABONIS MAKES IT! Assist: Bradley Leonard
Score: 24-26

[10:03] Team_060 possession (Score: 24-26)
Julius Green attempts a Midrange. Contested by Bradley Leonard (4.0 feet, MAN). Julius Green misses. Offensive rebound by Immanuel Ming! Immanuel Ming kicks it out.

[09:48] Team_060 possession (Score: 24-26)
Yao Tatum attempts a Layup. Contested by Bradley Sabonis (2.8 feet, MAN). YAO TATUM MAKES IT! Assist: Domantas Barnes
Score: 26-26

[09:32] Team_081 possession (Score: 26-26)
Bradley Sabonis attempts a Midrange. Contested by Klay Haliburton (2.7 feet, ZONE). Bradley Sabonis misses. Offensive rebound by Franz Antetokounmpo! Franz Antetokounmpo puts it back in!
Score: 26-28

[09:21] Team_060 possession (Score: 26-28)
Immanuel Ming attempts a 3Pt. Wide open! Bradley Leonard is 6.6 feet away. [ZONE] Immanuel Ming misses. Rebound secured by Franz Antetokounmpo.

[09:05] Team_081 possession (Score: 26-28)
Bradley Sabonis attempts a Layup. BLOCKED BY YAO TATUM! Ball is loose! Rebound secured by Immanuel Ming.

[08:49] Team_060 possession (Score: 26-28)
Yao Tatum drives and kicks out. Domantas Barnes attempts a Midrange. Wide open! Julius Durant is 6.0 feet away. [MAN] Domantas Barnes misses. Offensive rebound by Immanuel Ming! Immanuel Ming kicks it out.

[08:35] Team_060 possession (Score: 26-28)
Klay Haliburton attempts a 3Pt. Contested by Bradley Sabonis (3.1 feet, ZONE). KLAY HALIBURTON MAKES IT! Assist: Yao Tatum
Score: 29-28

[08:25] Team_081 possession (Score: 29-28)
Larry Adebayo attempts a Layup. Heavily contested by Immanuel Ming (0.5 feet, MAN)! Larry Adebayo misses. Rebound secured by Domantas Barnes.

[08:11] Team_060 possession (Score: 29-28)
FOUL! Reach-in foul on Larry Adebayo during the drive. [Team fouls: 2] No free throws, side out. (Larry Adebayo: 1 personal fouls)

[07:53] Team_060 possession (Score: 29-28)
Julius Green drives, Bradley Leonard stays with him. Julius Green attempts a Dunk. Heavily contested by Bradley Leonard (1.9 feet, MAN)! Julius Green misses. Rebound secured by Bradley Sabonis.

[07:40] Team_081 possession (Score: 29-28)
Franz Antetokounmpo attempts a Layup. Heavily contested by Klay Haliburton (0.5 feet, MAN)! FRANZ ANTETOKOUNMPO MAKES IT! Assist: Larry Adebayo
Score: 29-30

[07:25] Team_060 possession (Score: 29-30)
Immanuel Ming attempts a 3Pt. Contested by Larry Adebayo (5.0 feet, MAN). Immanuel Ming misses. FOUL! Loose ball foul on Franz Antetokounmpo during the rebound battle. [Team fouls: 3] No free throws, side out. (Franz Antetokounmpo: 1 personal fouls)

[07:14] Team_060 possession (Score: 29-30)
Domantas Barnes attempts a 3Pt. Contested by Bradley Leonard (3.5 feet, ZONE). Domantas Barnes misses. Rebound secured by Franz Antetokounmpo.

[07:03] Team_081 possession (Score: 29-30)
Larry Adebayo attempts a 3Pt. Contested by Domantas Barnes (5.2 feet, ZONE). Larry Adebayo misses. Rebound secured by Immanuel Ming.

[06:48] Team_060 possession (Score: 29-30)
Julius Green attempts a Midrange. Contested by Bradley Leonard (3.7 feet, MAN). Julius Green misses. Rebound secured by Larry Adebayo.

[06:33] Team_081 possession (Score: 29-30)
Bradley Leonard throws a bad pass out of bounds! TURNOVER! (dead ball)

[06:33] Substitution (Team_060): Julius Green OUT → Rudy Ginobili IN (stamina_rule2)

[06:33] Substitution (Team_060): Immanuel Ming OUT → Jarrett Wagner IN (stamina_rule2)

[06:33] Substitution (Team_081): Julius Durant OUT → Dejounte Bane IN (stamina_rule2)

[06:33] Substitution (Team_081): Bradley Leonard OUT → Lamelo Wade IN (stamina_rule2)

[06:33] Substitution (Team_081): Bradley Sabonis OUT → Chris Holiday IN (stamina_rule2)

[06:33] Substitution (Team_081): Franz Antetokounmpo OUT → D'Angelo Markkanen IN (stamina_rule2)

[06:23] Team_060 possession (Score: 29-30)
FOUL! Offensive foul on Rudy Ginobili! Lamelo Wade drew the charge! [Team fouls: 1] (Rudy Ginobili: 1 personal fouls) TURNOVER! (dead ball)

[06:13] Team_081 possession (Score: 29-30)
FOUL! Reach-in foul on Klay Haliburton during the drive. [Team fouls: 2] No free throws, side out. (Klay Haliburton: 1 personal fouls)

[06:00] Team_081 possession (Score: 29-30)
Chris Holiday attempts a 3Pt. Wide open! Domantas Barnes is 9.3 feet away. [ZONE] CHRIS HOLIDAY MAKES IT! Assist: D'Angelo Markkanen
Score: 29-33

[05:43] Team_060 possession (Score: 29-33)
FOUL! Shooting foul on Lamelo Wade. Rudy Ginobili to the line for 2 free throws. [Team fouls: 4] (Lamelo Wade: 1 personal fouls)   FT 1/2: GOOD   FT 2/2: GOOD Rudy Ginobili makes 2/2 from the line.
Score: 31-33

[05:29] Team_081 possession (Score: 31-33)
Lamelo Wade drives, Klay Haliburton stays with him. Lamelo Wade attempts a Dunk. Contested by Klay Haliburton (3.5 feet, ZONE). Lamelo Wade misses. Rebound secured by Rudy Ginobili.

[05:15] Team_060 possession (Score: 31-33)
Jarrett Wagner attempts a Midrange. Contested by Larry Adebayo (5.3 feet, MAN). JARRETT WAGNER MAKES IT!
Score: 33-33

[05:06] Team_081 possession (Score: 33-33)
Lamelo Wade attempts a 3Pt. Contested by Rudy Ginobili (5.3 feet, MAN). LAMELO WADE MAKES IT! Assist: Larry Adebayo
Score: 33-36

[04:46] Team_060 possession (Score: 33-36)
Jarrett Wagner drives, picks up Larry Adebayo. Help arrives from Lamelo Wade! Jarrett Wagner attempts a Dunk. Wide open! Lamelo Wade is 6.4 feet away. [MAN] JARRETT WAGNER MAKES IT!
Score: 35-36

[04:27] Team_081 possession (Score: 35-36)
Chris Holiday attempts a 3Pt. Contested by Yao Tatum (5.1 feet, MAN). Chris Holiday misses. Rebound secured by Domantas Barnes.

[04:12] Team_060 possession (Score: 35-36)
Yao Tatum attempts a 3Pt. Contested by Chris Holiday (2.4 feet, MAN). Yao Tatum misses. Rebound secured by Chris Holiday.

[04:00] Team_081 possession (Score: 35-36)
D'Angelo Markkanen attempts a Midrange. Wide open! Klay Haliburton is 7.0 feet away. [ZONE] D'Angelo Markkanen misses. Offensive rebound by Chris Holiday! Chris Holiday kicks it out.

[03:45] Team_081 possession (Score: 35-36)
Chris Holiday attempts a 3Pt. Wide open! Yao Tatum is 7.8 feet away. [MAN] Chris Holiday misses. Rebound secured by Klay Haliburton.

[03:28] Team_060 possession (Score: 35-36)
FOUL! Holding foul on Larry Adebayo. [IN THE BONUS! 5 team fouls] Jarrett Wagner to the line for 2 free throws. (Larry Adebayo: 2 personal fouls)   FT 1/2: GOOD   FT 2/2: GOOD Jarrett Wagner makes 2/2 from the line.
Score: 37-36

[03:13] Team_081 possession (Score: 37-36)
Larry Adebayo drives, Klay Haliburton stays with him. Larry Adebayo attempts a Dunk. Heavily contested by Klay Haliburton (1.0 feet, ZONE)! Larry Adebayo misses. Offensive rebound by Lamelo Wade! Lamelo Wade kicks it out.

[02:59] Team_081 possession (Score: 37-36)
Lamelo Wade drives and kicks out. Larry Adebayo attempts a 3Pt. Wide open! Domantas Barnes is 7.6 feet away. [ZONE] Larry Adebayo misses. Rebound secured by Klay Haliburton.

[02:44] Team_060 possession (Score: 37-36)
FOUL! Holding foul on Chris Holiday. [IN THE BONUS! 6 team fouls] Yao Tatum to the line for 2 free throws. (Chris Holiday: 1 personal fouls)   FT 1/2: GOOD   FT 2/2: MISS Yao Tatum makes 1/2 from the line. Rebound secured by D'Angelo Markkanen.
Score: 38-36

[02:28] Team_081 possession (Score: 38-36)
Larry Adebayo attempts a 3Pt. Contested by Domantas Barnes (5.4 feet, ZONE). Larry Adebayo misses. Rebound secured by Domantas Barnes.

[02:11] Team_060 possession (Score: 38-36)
FOUL! Offensive foul on Domantas Barnes! Dejounte Bane drew the charge! [Team fouls: 3] (Domantas Barnes: 1 personal fouls) TURNOVER! (dead ball)

[02:01] Team_081 possession (Score: 38-36)
D'Angelo Markkanen drives, picks up Klay Haliburton. Help arrives from Domantas Barnes! D'Angelo Markkanen attempts a Dunk. Heavily contested by Domantas Barnes (1.1 feet, ZONE)! D'ANGELO MARKKANEN MAKES IT!
Score: 38-38

[01:49] Team_060 possession (Score: 38-38)
Yao Tatum attempts a 3Pt. Wide open! Chris Holiday is 9.7 feet away. [ZONE] Yao Tatum misses. Rebound secured by Lamelo Wade.

[01:38] Team_081 possession (Score: 38-38)
Dejounte Bane attempts a Midrange. Contested by Rudy Ginobili (2.4 feet, ZONE). DEJOUNTE BANE MAKES IT!
Score: 38-40

[01:20] Team_060 possession (Score: 38-40)
Domantas Barnes attempts a Layup. Contested by Dejounte Bane (5.8 feet, MAN). DOMANTAS BARNES MAKES IT! Assist: Klay Haliburton
Score: 40-40

[01:09] Team_081 possession (Score: 40-40)
Larry Adebayo attempts a Layup. Heavily contested by Klay Haliburton (1.7 feet, ZONE)! LARRY ADEBAYO MAKES IT!
Score: 40-42

[00:54] Team_060 possession (Score: 40-42)
Yao Tatum attempts a 3Pt. Contested by Chris Holiday (4.6 feet, ZONE). Yao Tatum misses. Rebound secured by Lamelo Wade.

[00:39] Team_081 possession (Score: 40-42)
D'Angelo Markkanen attempts a Midrange. Wide open! Yao Tatum is 6.1 feet away. [ZONE] D'Angelo Markkanen misses. Rebound secured by Rudy Ginobili.

[00:28] Team_060 possession (Score: 40-42)
FOUL! Holding foul on Lamelo Wade. [IN THE BONUS! 7 team fouls] Rudy Ginobili to the line for 2 free throws. (Lamelo Wade: 2 personal fouls)   FT 1/2: GOOD   FT 2/2: GOOD Rudy Ginobili makes 2/2 from the line.
Score: 42-42

[00:18] Team_081 possession (Score: 42-42)
Chris Holiday attempts a 3Pt. Contested by Domantas Barnes (5.9 feet, ZONE). Chris Holiday misses. Rebound secured by Klay Haliburton.

[00:05] Team_060 possession (Score: 42-42)
Yao Tatum attempts a 3Pt. Contested by Chris Holiday (4.0 feet, MAN). Yao Tatum misses. Rebound secured by Chris Holiday.

================================================================================
                              2ND QUARTER COMPLETE                              
================================================================================

2ND QUARTER SCORE: Team_060 19, Team_081 21

BOX SCORE:
================================================================================

Team_060
--------------------------------------------------------------------------------
Player                MIN  PTS  REB  AST  TO      FG   FG%      3P   3P%
--------------------------------------------------------------------------------
Jarrett Wagner          8    6    0    0   0   3/3   100.0     0/0   0.0
Rudy Ginobili           8    4    2    0   0   2/2   100.0     0/0   0.0
Klay Haliburton        12    3    3    1   0   1/1   100.0     0/0   0.0
Domantas Barnes        12    2    3    1   0   1/3    33.3     0/0   0.0
Yao Tatum              12    2    0    1   0   1/5    20.0     0/0   0.0
Immanuel Ming          17    1    7    0   0   1/2    50.0     0/0   0.0
Julius Green           17    0    0    0   0   0/2     0.0     0/0   0.0

TEAM: FG: 9/19 (47.4%), 3PT: 1/7 (14.3%), REB: 15 (4 off, 11 def), AST: 3, TO: 3
TEAM FOULS: 3


Team_081
--------------------------------------------------------------------------------
Player                MIN  PTS  REB  AST  TO      FG   FG%      3P   3P%
--------------------------------------------------------------------------------
Bradley Sabonis        17    5    1    0   0   2/3    66.7     0/0   0.0
Franz Antetokounmpo    17    4    3    1   0   2/2   100.0     0/0   0.0
Chris Holiday           8    3    3    0   0   1/4    25.0     0/0   0.0
Lamelo Wade             8    3    3    0   0   1/3    33.3     0/0   0.0
Larry Adebayo          12    2    2    2   0   1/4    25.0     0/0   0.0
D'Angelo Markkanen      8    2    1    1   0   1/2    50.0     0/0   0.0
Dejounte Bane           8    2    0    0   0   1/1   100.0     0/0   0.0
Julius Durant          17    0    0    0   0   0/1     0.0     0/0   0.0
Bradley Leonard        17    0    0    1   0   0/0     0.0     0/0   0.0

TEAM: FG: 9/20 (45.0%), 3PT: 3/8 (37.5%), REB: 13 (3 off, 10 def), AST: 5, TO: 1
TEAM FOULS: 7 [Team_060 in BONUS]

================================================================================

================================================================================
                       3RD QUARTER - Team_060 vs Team_081                       
================================================================================

[12:00] Team_060 possession (Score: 42-42)
Joel Morant attempts a 3Pt. Heavily contested by Julius Durant (1.8 feet, MAN)! JOEL MORANT MAKES IT! Assist: Julius Green
Score: 45-42

[11:44] Team_081 possession (Score: 45-42)
FOUL! Shooting foul on Jaren George. Franz Antetokounmpo to the line for 2 free throws. [Team fouls: 1] (Jaren George: 1 personal fouls)   FT 1/2: GOOD   FT 2/2: GOOD Franz Antetokounmpo makes 2/2 from the line.
Score: 45-44

[11:26] Team_060 possession (Score: 45-44)
Immanuel Ming attempts a 3Pt. Contested by Vince Adebayo (2.9 feet, MAN). IMMANUEL MING MAKES IT! Assist: Joel Morant
Score: 48-44

[11:09] Team_081 possession (Score: 48-44)
Bradley Leonard attempts a 3Pt. Contested by Julius Green (2.7 feet, ZONE). BRADLEY LEONARD MAKES IT! Assist: Julius Durant
Score: 48-47

[10:57] Team_060 possession (Score: 48-47)
Joel Morant attempts a 3Pt. Contested by Julius Durant (4.0 feet, MAN). Joel Morant misses. Rebound secured by Franz Antetokounmpo.

[10:44] Team_081 possession (Score: 48-47)
Bradley Sabonis attempts a Midrange. Wide open! Larry Westbrook is 6.6 feet away. [MAN] Bradley Sabonis misses. Rebound secured by Immanuel Ming.

[10:32] Team_060 possession (Score: 48-47)
Immanuel Ming attempts a 3Pt. Contested by Julius Durant (4.1 feet, ZONE). Immanuel Ming misses. Rebound secured by Bradley Sabonis.

[10:14] Team_081 possession (Score: 48-47)
Franz Antetokounmpo attempts a Layup. Contested by Jaren George (4.2 feet, ZONE). FRANZ ANTETOKOUNMPO MAKES IT! Assist: Bradley Leonard
Score: 48-49

[09:58] Team_060 possession (Score: 48-49)
Joel Morant attempts a 3Pt. Heavily contested by Julius Durant (0.5 feet, MAN)! Joel Morant misses. Rebound secured by Bradley Sabonis.

[09:43] Team_081 possession (Score: 48-49)
Bradley Leonard attempts a 3Pt. Contested by Julius Green (5.5 feet, ZONE). BRADLEY LEONARD MAKES IT! Assist: Bradley Sabonis
Score: 48-52

[09:31] Team_060 possession (Score: 48-52)
Joel Morant attempts a Midrange. Wide open! Julius Durant is 6.1 feet away. [MAN] Joel Morant misses. Rebound secured by Franz Antetokounmpo.

[09:16] Team_081 possession (Score: 48-52)
Vince Adebayo attempts a Layup. Contested by Jaren George (4.9 feet, ZONE). Vince Adebayo misses. Rebound secured by Jaren George.

[09:01] Team_060 possession (Score: 48-52)
Immanuel Ming drives to the basket... Immanuel Ming throws a bad pass out of bounds! TURNOVER! (dead ball)

[08:49] Team_081 possession (Score: 48-52)
Bradley Leonard attempts a Midrange. Contested by Larry Westbrook (5.8 feet, ZONE). BRADLEY LEONARD MAKES IT! Assist: Vince Adebayo
Score: 48-54

[08:34] Team_060 possession (Score: 48-54)
Julius Green attempts a Midrange. Contested by Bradley Leonard (2.3 feet, MAN). JULIUS GREEN MAKES IT!
Score: 50-54

[08:19] Team_081 possession (Score: 50-54)
Bradley Sabonis attempts a 3Pt. Contested by Julius Green (3.1 feet, ZONE). BRADLEY SABONIS MAKES IT! Assist: Bradley Leonard
Score: 50-57

[08:00] Team_060 possession (Score: 50-57)
Larry Westbrook attempts a 3Pt. Contested by Vince Adebayo (3.2 feet, ZONE). Larry Westbrook misses. Rebound secured by Vince Adebayo.

[07:50] Team_081 possession (Score: 50-57)
Bradley Leonard attempts a 3Pt. Contested by Joel Morant (5.2 feet, ZONE). Bradley Leonard misses. FOUL! Loose ball foul on Larry Westbrook during the rebound battle. [Team fouls: 2] No free throws, side out. (Larry Westbrook: 1 personal fouls)

[07:35] Team_081 possession (Score: 50-57)
FOUL! Shooting foul on Jaren George. Vince Adebayo to the line for 2 free throws. [Team fouls: 3] (Jaren George: 2 personal fouls)   FT 1/2: MISS   FT 2/2: GOOD Vince Adebayo makes 1/2 from the line.
Score: 50-58

[07:17] Team_060 possession (Score: 50-58)
Larry Westbrook attempts a Layup. Contested by Bradley Sabonis (3.2 feet, MAN). LARRY WESTBROOK MAKES IT!
Score: 52-58

[07:02] Team_081 possession (Score: 52-58)
Vince Adebayo attempts a 3Pt. Contested by Immanuel Ming (5.9 feet, MAN). Vince Adebayo misses. Offensive rebound by Bradley Sabonis! Bradley Sabonis kicks it out.

[06:43] Team_081 possession (Score: 52-58)
Bradley Sabonis drives, Jaren George stays with him. Bradley Sabonis attempts a Dunk. Contested by Jaren George (4.4 feet, ZONE). Bradley Sabonis misses. Offensive rebound by Franz Antetokounmpo! Franz Antetokounmpo's putback is no good. Rebound secured by Immanuel Ming.

[06:30] Team_060 possession (Score: 52-58)
Larry Westbrook attempts a 3Pt. Heavily contested by Bradley Sabonis (1.2 feet, MAN)! Larry Westbrook misses. Rebound secured by Bradley Sabonis.

[06:16] Team_081 possession (Score: 52-58)
FOUL! Holding foul on Joel Morant. [Team fouls: 4] No free throws, side out. (Joel Morant: 1 personal fouls)

[06:03] Team_081 possession (Score: 52-58)
FOUL! Shooting foul on Julius Green. Bradley Sabonis to the line for 2 free throws. [BONUS: 5 team fouls] (Julius Green: 1 personal fouls)   FT 1/2: GOOD   FT 2/2: GOOD Bradley Sabonis makes 2/2 from the line.
Score: 52-60

[05:49] Team_060 possession (Score: 52-60)
FOUL! Shooting foul on Franz Antetokounmpo. Immanuel Ming to the line for 2 free throws. [Team fouls: 1] (Franz Antetokounmpo: 1 personal fouls)   FT 1/2: GOOD   FT 2/2: GOOD Immanuel Ming makes 2/2 from the line.
Score: 54-60

[05:36] Team_081 possession (Score: 54-60)
Bradley Leonard throws a bad pass! Stolen by Julius Green! TURNOVER! (live ball)

[05:27] Team_060 possession (Score: 54-60)
FOUL! Offensive foul on Julius Green! Bradley Leonard drew the charge! [Team fouls: 6] (Julius Green: 2 personal fouls) TURNOVER! (dead ball)

[05:16] Team_081 possession (Score: 54-60)
Franz Antetokounmpo drives, Jaren George stays with him. Franz Antetokounmpo attempts a Dunk. Heavily contested by Jaren George (1.6 feet, ZONE)! Franz Antetokounmpo misses. Rebound secured by Immanuel Ming.

[05:06] Team_060 possession (Score: 54-60)
Julius Green attempts a Layup. Contested by Bradley Leonard (4.4 feet, MAN). JULIUS GREEN MAKES IT! Assist: Jaren George
Score: 56-60

[04:52] Team_081 possession (Score: 56-60)
FOUL! Shooting foul on Julius Green. Franz Antetokounmpo to the line for 2 free throws. [BONUS: 7 team fouls] (Julius Green: 3 personal fouls)   FT 1/2: GOOD   FT 2/2: GOOD Franz Antetokounmpo makes 2/2 from the line.
Score: 56-62

[04:34] Team_060 possession (Score: 56-62)
Immanuel Ming attempts a 3Pt. Contested by Vince Adebayo (3.4 feet, MAN). Immanuel Ming misses. Rebound secured by Franz Antetokounmpo.

[04:15] Team_081 possession (Score: 56-62)
Julius Durant loses control! Ball rolls out of bounds! TURNOVER! (dead ball)

[04:05] Team_060 possession (Score: 56-62)
FOUL! Holding foul on Franz Antetokounmpo. [Team fouls: 2] No free throws, side out. (Franz Antetokounmpo: 2 personal fouls)

[03:48] Team_060 possession (Score: 56-62)
Immanuel Ming drives to the basket... Immanuel Ming commits a violation (traveling/carry)! TURNOVER! (dead ball)

[03:33] Team_081 possession (Score: 56-62)
Bradley Leonard attempts a 3Pt. Wide open! Julius Green is 6.1 feet away. [MAN] BRADLEY LEONARD MAKES IT! Assist: Franz Antetokounmpo
Score: 56-65

[03:17] Team_060 possession (Score: 56-65)
Immanuel Ming loses the ball! Stripped by Vince Adebayo! TURNOVER! (live ball)

[03:00] Team_081 possession (Score: 56-65)
FOUL! Offensive foul on Franz Antetokounmpo! Jaren George drew the charge! [Team fouls: 3] (Franz Antetokounmpo: 3 personal fouls) TURNOVER! (dead ball)

[02:46] Team_060 possession (Score: 56-65)
FOUL! Shooting foul on Bradley Leonard. Larry Westbrook to the line for 3 free throws. [Team fouls: 4] (Bradley Leonard: 1 personal fouls)   FT 1/3: GOOD   FT 2/3: MISS   FT 3/3: GOOD Larry Westbrook makes 2/3 from the line.
Score: 58-65

[02:30] Team_081 possession (Score: 58-65)
Vince Adebayo attempts a 3Pt. Contested by Immanuel Ming (3.3 feet, MAN). Vince Adebayo misses. FOUL! Loose ball foul on Larry Westbrook during the rebound battle. [IN THE BONUS! 8 team fouls] Bradley Sabonis to the line for 2 free throws. (Larry Westbrook: 2 personal fouls)   FT 1/2: GOOD   FT 2/2: GOOD Bradley Sabonis makes 2/2 from the line.
Score: 58-67

[02:17] Team_060 possession (Score: 58-67)
Julius Green attempts a 3Pt. Wide open! Bradley Leonard is 6.7 feet away. [MAN] Julius Green misses. Rebound secured by Franz Antetokounmpo.

[02:01] Team_081 possession (Score: 58-67)
FOUL! Reach-in foul on Larry Westbrook during the drive. [IN THE BONUS! 9 team fouls] Bradley Sabonis to the line for 2 free throws. (Larry Westbrook: 3 personal fouls)   FT 1/2: GOOD   FT 2/2: GOOD Bradley Sabonis makes 2/2 from the line.
Score: 58-69

[01:44] Team_060 possession (Score: 58-69)
Immanuel Ming attempts a 3Pt. Wide open! Vince Adebayo is 7.6 feet away. [MAN] Immanuel Ming misses. Offensive rebound by Immanuel Ming! Immanuel Ming kicks it out.

[01:28] Team_060 possession (Score: 58-69)
Joel Morant attempts a Midrange. Contested by Julius Durant (2.7 feet, MAN). JOEL MORANT MAKES IT!
Score: 60-69

[01:14] Team_081 possession (Score: 60-69)
Vince Adebayo attempts a Midrange. Wide open! Larry Westbrook is 8.9 feet away. [ZONE] Vince Adebayo misses. Rebound secured by Larry Westbrook.

[01:04] Team_060 possession (Score: 60-69)
Julius Green attempts a Midrange. Contested by Bradley Leonard (4.0 feet, MAN). Julius Green misses. Rebound secured by Bradley Sabonis.

[00:50] Team_081 possession (Score: 60-69)
Julius Durant drives, Jaren George stays with him. Julius Durant attempts a Layup. Contested by Jaren George (4.4 feet, ZONE). Julius Durant misses. Rebound secured by Jaren George.

[00:38] Team_060 possession (Score: 60-69)
Joel Morant attempts a Layup. Heavily contested by Julius Durant (0.5 feet, MAN)! JOEL MORANT MAKES IT! Assist: Jaren George
Score: 62-69

[00:22] Team_081 possession (Score: 62-69)
Franz Antetokounmpo drives, Jaren George stays with him. Franz Antetokounmpo attempts a Dunk. Contested by Jaren George (4.3 feet, ZONE). FRANZ ANTETOKOUNMPO MAKES IT! Assist: Bradley Sabonis
Score: 62-71

[00:06] Team_060 possession (Score: 62-71)
FOUL! Shooting foul on Bradley Leonard. Julius Green to the line for 2 free throws. [BONUS: 5 team fouls] (Bradley Leonard: 2 personal fouls)   FT 1/2: GOOD   FT 2/2: GOOD Julius Green makes 2/2 from the line.
Score: 64-71

================================================================================
                              3RD QUARTER COMPLETE                              
================================================================================

3RD QUARTER SCORE: Team_060 22, Team_081 29

BOX SCORE:
================================================================================

Team_060
--------------------------------------------------------------------------------
Player                MIN  PTS  REB  AST  TO      FG   FG%      3P   3P%
--------------------------------------------------------------------------------
Joel Morant            24    7    0    1   0   3/6    50.0     0/0   0.0
Julius Green           29    6    0    1   0   3/5    60.0     0/0   0.0
Immanuel Ming          29    5    4    0   0   2/4    50.0     0/0   0.0
Larry Westbrook        24    4    1    0   0   2/4    50.0     0/0   0.0
Jaren George           24    0    2    2   0   0/0     0.0     0/0   0.0

TEAM: FG: 10/19 (52.6%), 3PT: 3/10 (30.0%), REB: 6 (1 off, 5 def), AST: 4, TO: 4
TEAM FOULS: 9 [Team_081 in BONUS]


Team_081
--------------------------------------------------------------------------------
Player                MIN  PTS  REB  AST  TO      FG   FG%      3P   3P%
--------------------------------------------------------------------------------
Bradley Leonard        29   11    0    2   0   4/4   100.0     0/0   0.0
Bradley Sabonis        29    9    6    2   0   4/6    66.7     0/0   0.0
Franz Antetokounmpo    29    8    4    1   0   4/5    80.0     0/0   0.0
Vince Adebayo          24    1    1    1   0   1/3    33.3     0/0   0.0
Julius Durant          29    0    0    1   0   0/1     0.0     0/0   0.0

TEAM: FG: 13/19 (68.4%), 3PT: 5/5 (100.0%), REB: 12 (3 off, 9 def), AST: 7, TO: 3
TEAM FOULS: 5 [Team_060 in BONUS]

================================================================================

================================================================================
                       4TH QUARTER - Team_060 vs Team_081                       
================================================================================

[12:00] Team_060 possession (Score: 64-71)
Julius Green drives and kicks out. Immanuel Ming attempts a 3Pt. Wide open! Vince Adebayo is 7.1 feet away. [MAN] Immanuel Ming misses. Offensive rebound by Jaren George! Jaren George's putback is no good. Rebound secured by Franz Antetokounmpo.

[11:47] Team_081 possession (Score: 64-71)
Vince Adebayo drives, picks up Jaren George. Help arrives from Julius Green! Vince Adebayo attempts a Dunk. Contested by Julius Green (4.8 feet, ZONE). VINCE ADEBAYO MAKES IT!
Score: 64-73

[11:33] Team_060 possession (Score: 64-73)
Julius Green attempts a 3Pt. Contested by Bradley Leonard (5.5 feet, ZONE). Julius Green misses. Offensive rebound by Jaren George! Jaren George puts it back in!
Score: 66-73

[11:21] Team_081 possession (Score: 66-73)
Vince Adebayo drives to the basket... Vince Adebayo throws a bad pass out of bounds! TURNOVER! (dead ball)

[11:21] Substitution (Team_060): Joel Morant OUT → Domantas Barnes IN (stamina_rule2)

[11:21] Substitution (Team_060): Julius Green OUT → Rudy Ginobili IN (stamina_rule2)

[11:21] Substitution (Team_060): Immanuel Ming OUT → Jarrett Wagner IN (stamina_rule2)

[11:21] Substitution (Team_060): Larry Westbrook OUT → Yao Tatum IN (stamina_rule2)

[11:21] Substitution (Team_060): Jaren George OUT → Klay Haliburton IN (stamina_rule2)

[11:21] Substitution (Team_081): Julius Durant OUT → Dejounte Bane IN (stamina_rule2)

[11:21] Substitution (Team_081): Bradley Leonard OUT → Lamelo Wade IN (stamina_rule2)

[11:21] Substitution (Team_081): Vince Adebayo OUT → Larry Adebayo IN (stamina_rule2)

[11:21] Substitution (Team_081): Bradley Sabonis OUT → Chris Holiday IN (stamina_rule2)

[11:21] Substitution (Team_081): Franz Antetokounmpo OUT → D'Angelo Markkanen IN (stamina_rule2)

[11:10] Team_060 possession (Score: 66-73)
FOUL! Shooting foul on Chris Holiday. Rudy Ginobili to the line for 3 free throws. [Team fouls: 1] (Chris Holiday: 1 personal fouls)   FT 1/3: GOOD   FT 2/3: GOOD   FT 3/3: MISS Rudy Ginobili makes 2/3 from the line. Offensive rebound by Klay Haliburton! Klay Haliburton's putback is no good.
Score: 68-73

[10:54] Team_081 possession (Score: 68-73)
Dejounte Bane attempts a 3Pt. Wide open! Yao Tatum is 9.0 feet away. [ZONE] Dejounte Bane misses. FOUL! Loose ball foul on Domantas Barnes during the rebound battle. [Team fouls: 1] No free throws, side out. (Domantas Barnes: 1 personal fouls)

[10:42] Team_081 possession (Score: 68-73)
Larry Adebayo drives to the basket... FOUL! Offensive foul on Larry Adebayo! Jarrett Wagner drew the charge! [Team fouls: 2] (Larry Adebayo: 1 personal fouls) TURNOVER! (dead ball)

[10:29] Team_060 possession (Score: 68-73)
Jarrett Wagner drives, picks up Larry Adebayo. Help arrives from Lamelo Wade! Jarrett Wagner attempts a Layup. Contested by Lamelo Wade (5.0 feet, MAN). JARRETT WAGNER MAKES IT! Assist: Domantas Barnes
Score: 70-73

[10:16] Team_081 possession (Score: 70-73)
D'Angelo Markkanen attempts a 3Pt. Contested by Klay Haliburton (4.2 feet, MAN). D'Angelo Markkanen misses. Rebound secured by Rudy Ginobili.

[09:58] Team_060 possession (Score: 70-73)
Domantas Barnes attempts a 3Pt. Contested by Dejounte Bane (5.3 feet, MAN). DOMANTAS BARNES MAKES IT! Assist: Jarrett Wagner
Score: 73-73

[09:48] Team_081 possession (Score: 73-73)
Larry Adebayo attempts a Midrange. Contested by Rudy Ginobili (3.7 feet, ZONE). Larry Adebayo misses. Rebound secured by Klay Haliburton.

[09:32] Team_060 possession (Score: 73-73)
Domantas Barnes loses control! Ball rolls out of bounds! TURNOVER! (dead ball)

[09:17] Team_081 possession (Score: 73-73)
D'Angelo Markkanen attempts a Layup. Wide open! Klay Haliburton is 8.2 feet away. [ZONE] D'ANGELO MARKKANEN MAKES IT! Assist: Dejounte Bane
Score: 73-75

[08:59] Team_060 possession (Score: 73-75)
FOUL! Holding foul on Larry Adebayo. [Team fouls: 3] No free throws, side out. (Larry Adebayo: 2 personal fouls)

[08:45] Team_060 possession (Score: 73-75)
Domantas Barnes attempts a Midrange. Wide open! Dejounte Bane is 6.2 feet away. [MAN] Domantas Barnes misses. Rebound secured by Chris Holiday.

[08:29] Team_081 possession (Score: 73-75)
Dejounte Bane attempts a 3Pt. Contested by Domantas Barnes (4.5 feet, MAN). Dejounte Bane misses. Offensive rebound by Lamelo Wade! Lamelo Wade kicks it out.

[08:17] Team_081 possession (Score: 73-75)
FOUL! Reach-in foul on Klay Haliburton during the drive. [Team fouls: 2] No free throws, side out. (Klay Haliburton: 1 personal fouls)

[08:02] Team_081 possession (Score: 73-75)
Lamelo Wade attempts a 3Pt. Contested by Rudy Ginobili (6.0 feet, MAN). LAMELO WADE MAKES IT! Assist: Dejounte Bane
Score: 73-78

[07:46] Team_060 possession (Score: 73-78)
Domantas Barnes makes the Layup and draws the foul on Dejounte Bane! And-1! Domantas Barnes to the line for 1. [Team fouls: 4] (Dejounte Bane: 1 personal fouls)   FT 1/1: GOOD Domantas Barnes makes 1/1 from the line.
Score: 76-78

[07:32] Team_081 possession (Score: 76-78)
Lamelo Wade attempts a 3Pt. Contested by Rudy Ginobili (2.6 feet, ZONE). Lamelo Wade misses. Rebound secured by Domantas Barnes.

[07:19] Team_060 possession (Score: 76-78)
Rudy Ginobili attempts a Layup. Wide open! D'Angelo Markkanen is 9.2 feet away. [ZONE] Rudy Ginobili misses. Rebound secured by Lamelo Wade.

[07:00] Team_081 possession (Score: 76-78)
Chris Holiday drives to the basket... Chris Holiday loses the ball! Stripped by Yao Tatum! TURNOVER! (live ball)

[06:49] Team_060 possession (Score: 76-78)
FOUL! Reach-in foul on Chris Holiday during the drive. [IN THE BONUS! 5 team fouls] Klay Haliburton to the line for 2 free throws. (Chris Holiday: 2 personal fouls)   FT 1/2: GOOD   FT 2/2: GOOD Klay Haliburton makes 2/2 from the line.
Score: 78-78

[06:30] Team_081 possession (Score: 78-78)
D'Angelo Markkanen drives, Klay Haliburton stays with him. D'Angelo Markkanen attempts a Dunk. Heavily contested by Klay Haliburton (0.5 feet, ZONE)! D'ANGELO MARKKANEN MAKES IT! Assist: Chris Holiday
Score: 78-80

[06:13] Team_060 possession (Score: 78-80)
Rudy Ginobili makes the Layup and draws the foul on Larry Adebayo! And-1! Rudy Ginobili to the line for 1. [BONUS: 6 team fouls] (Larry Adebayo: 3 personal fouls)   FT 1/1: GOOD Rudy Ginobili makes 1/1 from the line.
Score: 81-80

[06:02] Team_081 possession (Score: 81-80)
Larry Adebayo attempts a 3Pt. Contested by Jarrett Wagner (4.1 feet, MAN). Larry Adebayo misses. FOUL! Loose ball foul on Rudy Ginobili during the rebound battle. [Team fouls: 3] No free throws, side out. (Rudy Ginobili: 1 personal fouls)

[05:48] Team_081 possession (Score: 81-80)
Dejounte Bane attempts a Midrange. Contested by Yao Tatum (5.9 feet, ZONE). Dejounte Bane misses. Rebound secured by Rudy Ginobili.

[05:30] Team_060 possession (Score: 81-80)
Jarrett Wagner attempts a Layup. Heavily contested by D'Angelo Markkanen (0.5 feet, ZONE)! Jarrett Wagner misses. Rebound secured by Chris Holiday.

[05:16] Team_081 possession (Score: 81-80)
Larry Adebayo makes the Dunk and draws the foul on Klay Haliburton! And-1! Larry Adebayo to the line for 1. [Team fouls: 4] (Klay Haliburton: 2 personal fouls)   FT 1/1: GOOD Larry Adebayo makes 1/1 from the line.
Score: 81-83

[05:01] Team_060 possession (Score: 81-83)
Yao Tatum attempts a 3Pt. Contested by Chris Holiday (3.4 feet, MAN). Yao Tatum misses. Rebound secured by Lamelo Wade.

[04:50] Team_081 possession (Score: 81-83)
D'Angelo Markkanen attempts a Midrange. Contested by Klay Haliburton (4.7 feet, MAN). D'ANGELO MARKKANEN MAKES IT! Assist: Dejounte Bane
Score: 81-85

[04:37] Team_060 possession (Score: 81-85)
FOUL! Holding foul on Dejounte Bane. [IN THE BONUS! 7 team fouls] Domantas Barnes to the line for 2 free throws. (Dejounte Bane: 2 personal fouls)   FT 1/2: GOOD   FT 2/2: GOOD Domantas Barnes makes 2/2 from the line.
Score: 83-85

[04:18] Team_081 possession (Score: 83-85)
D'Angelo Markkanen attempts a Layup. BLOCKED BY KLAY HALIBURTON! Ball is loose! Rebound secured by Rudy Ginobili.

[04:08] Team_060 possession (Score: 83-85)
Klay Haliburton attempts a 3Pt. Contested by Chris Holiday (5.7 feet, ZONE). KLAY HALIBURTON MAKES IT!
Score: 86-85

[03:52] Team_081 possession (Score: 86-85)
Dejounte Bane attempts a Midrange. Contested by Domantas Barnes (3.9 feet, MAN). Dejounte Bane misses. Rebound secured by Klay Haliburton.

[03:38] Team_060 possession (Score: 86-85)
Klay Haliburton attempts a Midrange. Contested by Chris Holiday (5.2 feet, MAN). KLAY HALIBURTON MAKES IT! Assist: Domantas Barnes
Score: 88-85

[03:24] Team_081 possession (Score: 88-85)
D'Angelo Markkanen attempts a Midrange. Contested by Klay Haliburton (4.0 feet, MAN). D'Angelo Markkanen misses. Rebound secured by Rudy Ginobili.

[03:11] Team_060 possession (Score: 88-85)
Jarrett Wagner attempts a Layup. BLOCKED BY CHRIS HOLIDAY! Ball goes out off Chris Holiday. Jarrett Wagner's ball!

[02:53] Team_060 possession (Score: 88-85)
Domantas Barnes drives and kicks out. Yao Tatum attempts a 3Pt. Contested by Lamelo Wade (5.2 feet, ZONE). Yao Tatum misses. Rebound secured by Chris Holiday.

[02:41] Team_081 possession (Score: 88-85)
Larry Adebayo attempts a Midrange. Heavily contested by Rudy Ginobili (0.5 feet, ZONE)! LARRY ADEBAYO MAKES IT! Assist: D'Angelo Markkanen
Score: 88-87

[02:23] Team_060 possession (Score: 88-87)
Rudy Ginobili drives, picks up Chris Holiday. Help arrives from Lamelo Wade! Rudy Ginobili attempts a Dunk. Contested by Lamelo Wade (4.9 feet, ZONE). RUDY GINOBILI MAKES IT! Assist: Jarrett Wagner
Score: 90-87

[02:09] Team_081 possession (Score: 90-87)
Larry Adebayo throws a bad pass! Stolen by Jarrett Wagner! TURNOVER! (live ball)

[01:55] Team_060 possession (Score: 90-87)
Rudy Ginobili attempts a 3Pt. Contested by Lamelo Wade (5.7 feet, MAN). Rudy Ginobili misses. Offensive rebound by Klay Haliburton! Klay Haliburton's putback is no good. Rebound secured by Chris Holiday.

[01:42] Team_081 possession (Score: 90-87)
D'Angelo Markkanen attempts a Midrange. Wide open! Jarrett Wagner is 7.3 feet away. [ZONE] D'ANGELO MARKKANEN MAKES IT! Assist: Lamelo Wade
Score: 90-89

[01:26] Team_060 possession (Score: 90-89)
Domantas Barnes drives and kicks out. Domantas Barnes attempts a Midrange. Wide open! Dejounte Bane is 9.7 feet away. [MAN] Domantas Barnes misses. Rebound secured by Chris Holiday.

[01:13] Team_081 possession (Score: 90-89)
FOUL! Shooting foul on Domantas Barnes. Dejounte Bane to the line for 3 free throws. [BONUS: 5 team fouls] (Domantas Barnes: 2 personal fouls)   FT 1/3: GOOD   FT 2/3: MISS   FT 3/3: GOOD Dejounte Bane makes 2/3 from the line.
Score: 90-91

[00:59] Team_060 possession (Score: 90-91)
Domantas Barnes drives and kicks out. Klay Haliburton attempts a Midrange. Contested by Lamelo Wade (3.9 feet, ZONE). KLAY HALIBURTON MAKES IT! Assist: Domantas Barnes
Score: 92-91

[00:44] Team_081 possession (Score: 92-91)
Lamelo Wade attempts a Layup. Heavily contested by Rudy Ginobili (2.0 feet, MAN)! Lamelo Wade misses. Offensive rebound by Lamelo Wade! Lamelo Wade kicks it out.

[00:30] Team_081 possession (Score: 92-91)
Lamelo Wade throws a bad pass out of bounds! TURNOVER! (dead ball)

[00:17] Team_060 possession (Score: 92-91)
Klay Haliburton attempts a Midrange. Wide open! Chris Holiday is 10.0 feet away. [MAN] KLAY HALIBURTON MAKES IT!
Score: 94-91

[00:05] Team_081 possession (Score: 94-91)
D'Angelo Markkanen loses control! Ball rolls out of bounds! TURNOVER! (dead ball)

================================================================================
                              4TH QUARTER COMPLETE                              
================================================================================

4TH QUARTER SCORE: Team_060 30, Team_081 20

BOX SCORE:
================================================================================

Team_060
--------------------------------------------------------------------------------
Player                MIN  PTS  REB  AST  TO      FG   FG%      3P   3P%
--------------------------------------------------------------------------------
Klay Haliburton        24   11    3    0   0   5/5   100.0     0/0   0.0
Domantas Barnes        24    8    1    3   0   3/6    50.0     0/0   0.0
Rudy Ginobili          19    5    4    0   0   2/5    40.0     0/0   0.0
Jaren George           25    2    1    0   0   1/1   100.0     0/0   0.0
Jarrett Wagner         19    2    0    2   0   1/2    50.0     0/0   0.0
Julius Green           30    0    0    0   0   0/1     0.0     0/0   0.0
Franz Antetokounmpo    30    0    1    0   0   0/0     0.0     0/0   0.0
Yao Tatum              24    0    0    0   0   0/1     0.0     0/0   0.0

TEAM: FG: 12/21 (57.1%), 3PT: 3/6 (50.0%), REB: 10 (3 off, 7 def), AST: 5, TO: 1
TEAM FOULS: 5 [Team_081 in BONUS]


Team_081
--------------------------------------------------------------------------------
Player                MIN  PTS  REB  AST  TO      FG   FG%      3P   3P%
--------------------------------------------------------------------------------
D'Angelo Markkanen     19    8    0    1   0   4/7    57.1     0/0   0.0
Larry Adebayo          24    5    0    0   0   2/3    66.7     0/0   0.0
Lamelo Wade            19    3    4    1   0   1/2    50.0     0/0   0.0
Vince Adebayo          25    2    0    0   0   1/1   100.0     0/0   0.0
Dejounte Bane          19    2    0    3   0   1/3    33.3     0/0   0.0
Chris Holiday          19    0    7    1   0   0/0     0.0     0/0   0.0

TEAM: FG: 9/16 (56.2%), 3PT: 2/4 (50.0%), REB: 11 (4 off, 7 def), AST: 6, TO: 6
TEAM FOULS: 7 [Team_060 in BONUS]

================================================================================

================================================================================
                               FULL GAME COMPLETE                               
================================================================================

FINAL SCORE: Team_060 94, Team_081 91

SCORING BY QUARTER:
--------------------------------------------------------------------------------
Team                     Q1     Q2     Q3     Q4    FINAL
--------------------------------------------------------------------------------
Team_060                 23     19     22     30       94
Team_081                 21     21     29     20       91
--------------------------------------------------------------------------------

FULL GAME BOX SCORE:
================================================================================

Team_060
--------------------------------------------------------------------------------
Player                MIN  PTS  REB  AST  TO      FG   FG%      3P   3P%      FT STL BLK
--------------------------------------------------------------------------------
Julius Green           30    6    0    1   3   4/10   40.0   1/2    50.0   2/2     1   0
Immanuel Ming          30    8   12    0   1   4/10   40.0   1/5    20.0   5/6     0   0
Joel Morant            25   12    0    2   1   5/8    62.5   2/4    50.0   3/3     0   0
Larry Westbrook        25    9    3    0   3   4/9    44.4   1/4    25.0   3/4     1   0
Jaren George           25    4    5    2   2   1/4    25.0   0/0     0.0   0/2     0   0
Domantas Barnes        24   10    5    4   2   4/10   40.0   1/3    33.3   3/3     0   0
Yao Tatum              24    2    0    3   0   1/6    16.7   0/5     0.0   1/2     1   1
Klay Haliburton        24   16    6    1   0   6/6   100.0   2/2   100.0   2/2     0   1
Rudy Ginobili          19    9    7    0   1   3/6    50.0   0/2     0.0   7/8     0   0
Jarrett Wagner         19   11    0    2   0   4/5    80.0   1/1   100.0   2/2     1   0

TEAM: FG: 39/78 (50.0%), 3PT: 9/28 (32.1%), REB: 38 (8 off, 30 def), AST: 15, TO: 13


Team_081
--------------------------------------------------------------------------------
Player                MIN  PTS  REB  AST  TO      FG   FG%      3P   3P%      FT STL BLK
--------------------------------------------------------------------------------
Julius Durant          30    6    0    2   3   3/7    42.9   1/1   100.0   2/3     1   0
Bradley Leonard        30   14    0    4   3   5/7    71.4   4/6    66.7   0/0     0   1
Bradley Sabonis        30   20   13    4   2  10/13   76.9   2/2   100.0   8/10    0   0
Franz Antetokounmpo    30   18   12    3   2   7/9    77.8   0/1     0.0   4/4     1   0
Vince Adebayo          25    3    6    1   0   4/6    66.7   2/2   100.0   1/2     1   0
Larry Adebayo          24    7    2    2   1   3/8    37.5   0/3     0.0   1/1     0   0
Dejounte Bane          19    4    0    3   0   2/4    50.0   1/1   100.0   2/3     0   0
Lamelo Wade            19    6    8    1   1   2/5    40.0   2/3    66.7   0/0     0   0
Chris Holiday          19    3   10    1   2   1/5    20.0   1/4    25.0   0/0     0   1
D'Angelo Markkanen     19   10    1    2   1   5/9    55.6   0/1     0.0   0/0     0   0

TEAM: FG: 42/73 (57.5%), 3PT: 13/24 (54.2%), REB: 52 (15 off, 37 def), AST: 23, TO: 15

================================================================================
