================================================================================
                        FULL GAME - Team_036 vs Team_082                        
================================================================================

================================================================================
                       1ST QUARTER - Team_036 vs Team_082                       
================================================================================

[12:00] Team_036 possession (Score: 0-0)
Terry Durant attempts a 3Pt. Contested by Jrue Green (4.2 feet, MAN). Terry Durant misses. Rebound secured by Jrue Green.

[11:44] Team_082 possession (Score: 0-0)
Kristaps Fox attempts a 3Pt. BLOCKED BY ANTHONY POOLE! Ball is loose! Rebound secured by Kobe Simmons.

[11:33] Team_036 possession (Score: 0-0)
Kobe Simmons attempts a Layup. Wide open! Julius Carter is 6.0 feet away. [MAN] KOBE SIMMONS MAKES IT!
Score: 2-0

[11:18] Team_082 possession (Score: 2-0)
FOUL! Shooting foul on Giannis Booker. Dwyane O'Neal to the line for 2 free throws. [Team fouls: 1] (Giannis Booker: 1 personal fouls)   FT 1/2: GOOD   FT 2/2: GOOD Dwyane O'Neal makes 2/2 from the line.
Score: 2-2

[11:06] Team_036 possession (Score: 2-2)
Giannis Booker drives to the basket... Giannis Booker throws a bad pass! Stolen by Jrue Green! TURNOVER! (live ball)

[10:51] Team_082 possession (Score: 2-2)
Dwyane O'Neal drives, Kobe Simmons stays with him. Dwyane O'Neal attempts a Dunk. Heavily contested by Kobe Simmons (1.1 feet, ZONE)! DWYANE O'NEAL MAKES IT! Assist: Julius Carter
Score: 2-4

[10:34] Team_036 possession (Score: 2-4)
Giannis Booker attempts a 3Pt. Heavily contested by Dwyane O'Neal (1.3 feet, MAN)! GIANNIS BOOKER MAKES IT! Assist: Anthony Poole
Score: 5-4

[10:20] Team_082 possession (Score: 5-4)
FOUL! Reach-in foul on Kobe Simmons during the drive. [Team fouls: 2] No free throws, side out. (Kobe Simmons: 1 personal fouls)

[10:03] Team_082 possession (Score: 5-4)
Julius Carter attempts a Midrange. Heavily contested by Kobe Simmons (1.1 feet, MAN)! Julius Carter misses. Rebound secured by Kobe Simmons.

[09:45] Team_036 possession (Score: 5-4)
Terry Durant throws a bad pass out of bounds! TURNOVER! (dead ball)

[09:29] Team_082 possession (Score: 5-4)
FOUL! Shooting foul on Giannis Booker. Dwyane O'Neal to the line for 2 free throws. [Team fouls: 3] (Giannis Booker: 2 personal fouls)   FT 1/2: GOOD   FT 2/2: GOOD Dwyane O'Neal makes 2/2 from the line.
Score: 5-6

[09:12] Team_036 possession (Score: 5-6)
Kobe Simmons drives, picks up Jrue Green. Help arrives from Dwyane O'Neal! Kobe Simmons attempts a Dunk. Heavily contested by Dwyane O'Neal (1.8 feet, ZONE)! KOBE SIMMONS MAKES IT! Assist: Giannis Booker
Score: 7-6

[08:59] Team_082 possession (Score: 7-6)
Julius Anthony attempts a Layup. BLOCKED BY KOBE SIMMONS! Ball is loose! Offensive rebound by Julius Carter! Julius Carter kicks it out.

[08:41] Team_082 possession (Score: 7-6)
FOUL! Shooting foul on Kobe Simmons. Julius Anthony to the line for 2 free throws. [Team fouls: 4] (Kobe Simmons: 2 personal fouls)   FT 1/2: GOOD   FT 2/2: MISS Julius Anthony makes 1/2 from the line. Offensive rebound by Jrue Green! Jrue Green kicks it out.
Score: 7-7

[08:27] Team_082 possession (Score: 7-7)
Dwyane O'Neal attempts a Midrange. Contested by Terry Durant (5.6 feet, ZONE). Dwyane O'Neal misses. Rebound secured by Terry Durant.

[08:16] Team_036 possession (Score: 7-7)
Michael Westbrook attempts a Layup. BLOCKED BY JRUE GREEN! Ball deflects out of bounds off Michael Westbrook.

[08:02] Team_082 possession (Score: 7-7)
Julius Anthony attempts a 3Pt. Wide open! Michael Westbrook is 6.2 feet away. [MAN] Julius Anthony misses. Rebound secured by Terry Durant.

[07:46] Team_036 possession (Score: 7-7)
FOUL! Shooting foul on Dwyane O'Neal. Giannis Booker to the line for 2 free throws. [Team fouls: 1] (Dwyane O'Neal: 1 personal fouls)   FT 1/2: GOOD   FT 2/2: GOOD Giannis Booker makes 2/2 from the line.
Score: 9-7

[07:31] Team_082 possession (Score: 9-7)
Julius Carter attempts a Midrange. Wide open! Terry Durant is 10.0 feet away. [ZONE] JULIUS CARTER MAKES IT! Assist: Kristaps Fox
Score: 9-9

[07:21] Team_036 possession (Score: 9-9)
Michael Westbrook drives to the basket... Michael Westbrook throws a bad pass! Stolen by Jrue Green! TURNOVER! (live ball)

[07:05] Team_082 possession (Score: 9-9)
FOUL! Shooting foul on Anthony Poole. Kristaps Fox to the line for 3 free throws. [BONUS: 5 team fouls] (Anthony Poole: 1 personal fouls)   FT 1/3: GOOD   FT 2/3: GOOD   FT 3/3: GOOD Kristaps Fox makes 3/3 from the line.
Score: 9-12

[06:50] Team_036 possession (Score: 9-12)
Anthony Poole attempts a 3Pt. Wide open! Julius Anthony is 7.3 feet away. [ZONE] Anthony Poole misses. Offensive rebound by Terry Durant! Terry Durant puts it back in!
Score: 11-12

[06:34] Team_082 possession (Score: 11-12)
Jrue Green drives and kicks out. Dwyane O'Neal attempts a 3Pt. Heavily contested by Giannis Booker (1.9 feet, MAN)! DWYANE O'NEAL MAKES IT! Assist: Kristaps Fox
Score: 11-15

[06:22] Team_036 possession (Score: 11-15)
Kobe Simmons attempts a 3Pt. Contested by Julius Carter (4.6 feet, MAN). Kobe Simmons misses. Rebound secured by Julius Carter.

[06:06] Team_082 possession (Score: 11-15)
Julius Anthony attempts a Midrange. Wide open! Michael Westbrook is 6.2 feet away. [MAN] JULIUS ANTHONY MAKES IT! Assist: Dwyane O'Neal
Score: 11-17

[05:52] Team_036 possession (Score: 11-17)
Giannis Booker attempts a Midrange. Contested by Jrue Green (4.2 feet, ZONE). Giannis Booker misses. Offensive rebound by Terry Durant! Terry Durant's putback is no good. Rebound secured by Jrue Green.

[05:35] Team_082 possession (Score: 11-17)
Jrue Green drives, picks up Kobe Simmons. Help arrives from Giannis Booker! Jrue Green attempts a Layup. Heavily contested by Giannis Booker (0.8 feet, ZONE)! Jrue Green misses. Rebound secured by Kobe Simmons.

[05:21] Team_036 possession (Score: 11-17)
FOUL! Reach-in foul on Kristaps Fox during the drive. [Team fouls: 2] No free throws, side out. (Kristaps Fox: 1 personal fouls)

[05:10] Team_036 possession (Score: 11-17)
Michael Westbrook makes the Midrange and draws the foul on Julius Anthony! And-1! Michael Westbrook to the line for 1. [Team fouls: 3] (Julius Anthony: 1 personal fouls)   FT 1/1: GOOD Michael Westbrook makes 1/1 from the line.
Score: 14-17

[04:55] Team_082 possession (Score: 14-17)
Julius Carter attempts a 3Pt. Contested by Michael Westbrook (5.6 feet, ZONE). Julius Carter misses. Rebound secured by Terry Durant.

[04:36] Team_036 possession (Score: 14-17)
Kobe Simmons attempts a Layup. Contested by Julius Carter (4.9 feet, MAN). KOBE SIMMONS MAKES IT! Assist: Giannis Booker
Score: 16-17

[04:22] Team_082 possession (Score: 16-17)
Dwyane O'Neal attempts a Layup. Contested by Giannis Booker (5.6 feet, MAN). Dwyane O'Neal misses. Rebound secured by Kobe Simmons.

[04:08] Team_036 possession (Score: 16-17)
Giannis Booker attempts a 3Pt. Wide open! Dwyane O'Neal is 6.5 feet away. [ZONE] Giannis Booker misses. Rebound secured by Julius Carter.

[03:58] Team_082 possession (Score: 16-17)
Jrue Green attempts a Midrange. Wide open! Terry Durant is 6.6 feet away. [MAN] Jrue Green misses. Rebound secured by Giannis Booker.

[03:42] Team_036 possession (Score: 16-17)
Anthony Poole attempts a 3Pt. Wide open! Kristaps Fox is 6.4 feet away. [MAN] ANTHONY POOLE MAKES IT! Assist: Michael Westbrook
Score: 19-17

[03:31] Team_082 possession (Score: 19-17)
Julius Anthony attempts a Layup. Contested by Michael Westbrook (4.4 feet, MAN). Julius Anthony misses. Rebound secured by Giannis Booker.

[03:17] Team_036 possession (Score: 19-17)
Giannis Booker attempts a Midrange. Contested by Dwyane O'Neal (4.2 feet, MAN). GIANNIS BOOKER MAKES IT! Assist: Terry Durant
Score: 21-17

[03:08] Team_082 possession (Score: 21-17)
Kristaps Fox attempts a Layup. Contested by Kobe Simmons (2.1 feet, ZONE). KRISTAPS FOX MAKES IT! Assist: Jrue Green
Score: 21-19

[02:52] Team_036 possession (Score: 21-19)
Terry Durant attempts a 3Pt. Wide open! Jrue Green is 7.2 feet away. [MAN] Terry Durant misses. Rebound secured by Dwyane O'Neal.

[02:36] Team_082 possession (Score: 21-19)
Dwyane O'Neal attempts a Layup. Contested by Kobe Simmons (3.1 feet, ZONE). DWYANE O'NEAL MAKES IT!
Score: 21-21

[02:18] Team_036 possession (Score: 21-21)
Giannis Booker attempts a 3Pt. Wide open! Dwyane O'Neal is 6.5 feet away. [MAN] GIANNIS BOOKER MAKES IT! Assist: Kobe Simmons
Score: 24-21

[02:06] Team_082 possession (Score: 24-21)
FOUL! Reach-in foul on Terry Durant during the drive. [IN THE BONUS! 6 team fouls] Jrue Green to the line for 2 free throws. (Terry Durant: 1 personal fouls)   FT 1/2: GOOD   FT 2/2: MISS Jrue Green makes 1/2 from the line. Offensive rebound by Julius Carter! Julius Carter kicks it out.
Score: 24-22

[01:51] Team_082 possession (Score: 24-22)
Julius Carter attempts a Midrange. Wide open! Kobe Simmons is 6.1 feet away. [MAN] Julius Carter misses. Rebound secured by Kobe Simmons.

[01:39] Team_036 possession (Score: 24-22)
Kobe Simmons drives, Jrue Green stays with him. Kobe Simmons attempts a Dunk. Contested by Jrue Green (2.7 feet, ZONE). KOBE SIMMONS MAKES IT!
Score: 26-22

[01:22] Team_082 possession (Score: 26-22)
Kristaps Fox attempts a 3Pt. Wide open! Anthony Poole is 6.9 feet away. [ZONE] KRISTAPS FOX MAKES IT! Assist: Jrue Green
Score: 26-25

[01:10] Team_036 possession (Score: 26-25)
Giannis Booker loses control! Ball rolls out of bounds! TURNOVER! (dead ball)

[01:10] Substitution (Team_036): Michael Westbrook OUT → Dirk Anunoby IN (stamina_rule2)

[01:10] Substitution (Team_036): Giannis Booker OUT → Tobias Fox IN (stamina_rule2)

[01:10] Substitution (Team_036): Anthony Poole OUT → Pascal Antetokounmpo IN (stamina_rule2)

[01:10] Substitution (Team_036): Terry Durant OUT → Devin Simmons IN (stamina_rule2)

[01:10] Substitution (Team_036): Kobe Simmons OUT → Bradley Murray IN (stamina_rule2)

[01:10] Substitution (Team_082): Julius Anthony OUT → Jordan Rozier IN (stamina_rule2)

[01:10] Substitution (Team_082): Dwyane O'Neal OUT → Kawhi Poole IN (stamina_rule2)

[01:10] Substitution (Team_082): Kristaps Fox OUT → Shaquille Griffin IN (stamina_rule2)

[01:10] Substitution (Team_082): Jrue Green OUT → Tony Jokic IN (stamina_rule2)

[01:10] Substitution (Team_082): Julius Carter OUT → D'Angelo Parker IN (stamina_rule2)

[00:59] Team_082 possession (Score: 26-25)
D'Angelo Parker attempts a Midrange. Contested by Bradley Murray (2.6 feet, MAN). D'ANGELO PARKER MAKES IT!
Score: 26-27

[00:40] Team_036 possession (Score: 26-27)
FOUL! Shooting foul on Kawhi Poole. Devin Simmons to the line for 2 free throws. [Team fouls: 4] (Kawhi Poole: 1 personal fouls)   FT 1/2: GOOD   FT 2/2: GOOD Devin Simmons makes 2/2 from the line.
Score: 28-27

[00:26] Team_082 possession (Score: 28-27)
FOUL! Holding foul on Bradley Murray. [IN THE BONUS! 7 team fouls] D'Angelo Parker to the line for 2 free throws. (Bradley Murray: 1 personal fouls)   FT 1/2: GOOD   FT 2/2: GOOD D'Angelo Parker makes 2/2 from the line.
Score: 28-29

[00:12] Team_036 possession (Score: 28-29)
Dirk Anunoby attempts a Midrange. Wide open! Jordan Rozier is 8.6 feet away. [MAN] Dirk Anunoby misses. Offensive rebound by Bradley Murray! Bradley Murray kicks it out.

================================================================================
                              1ST QUARTER COMPLETE                              
================================================================================

1ST QUARTER SCORE: Team_036 28, Team_082 29

BOX SCORE:
================================================================================

Team_036
--------------------------------------------------------------------------------
Player                MIN  PTS  REB  AST  TO      FG   FG%      3P   3P%
--------------------------------------------------------------------------------
Giannis Booker         11   10    2    2   0   4/6    66.7     0/0   0.0
Kobe Simmons           11    8    5    1   0   4/5    80.0     0/0   0.0
Anthony Poole          11    3    0    1   0   1/1   100.0     0/0   0.0
Michael Westbrook      11    3    0    1   0   1/2    50.0     0/0   0.0
Terry Durant           11    2    4    1   0   1/3    33.3     0/0   0.0
Devin Simmons           1    2    0    0   0   1/1   100.0     0/0   0.0
Bradley Murray          1    0    1    0   0   0/0     0.0     0/0   0.0

TEAM: FG: 12/18 (66.7%), 3PT: 4/8 (50.0%), REB: 13 (3 off, 10 def), AST: 6, TO: 4
TEAM FOULS: 7 [Team_082 in BONUS]


Team_082
--------------------------------------------------------------------------------
Player                MIN  PTS  REB  AST  TO      FG   FG%      3P   3P%
--------------------------------------------------------------------------------
Dwyane O'Neal          11   11    1    1   0   5/7    71.4     0/0   0.0
Kristaps Fox           11    8    0    2   0   3/4    75.0     0/0   0.0
D'Angelo Parker         1    4    0    0   0   2/2   100.0     0/0   0.0
Julius Carter          11    2    4    1   0   1/4    25.0     0/0   0.0
Julius Anthony         11    2    0    0   0   1/3    33.3     0/0   0.0
Jrue Green             11    0    3    2   0   0/2     0.0     0/0   0.0

TEAM: FG: 12/22 (54.5%), 3PT: 2/5 (40.0%), REB: 7 (3 off, 4 def), AST: 6, TO: 0
TEAM FOULS: 4

================================================================================

================================================================================
                       2ND QUARTER - Team_036 vs Team_082                       
================================================================================

[12:00] Team_036 possession (Score: 28-29)
Michael Westbrook attempts a 3Pt. Contested by Julius Anthony (2.4 feet, MAN). Michael Westbrook misses. Rebound secured by Jrue Green.

[11:41] Team_082 possession (Score: 28-29)
Dwyane O'Neal attempts a 3Pt. Contested by Michael Westbrook (4.8 feet, ZONE). DWYANE O'NEAL MAKES IT! Assist: Julius Anthony
Score: 28-32

[11:26] Team_036 possession (Score: 28-32)
Terry Durant drives, Jrue Green stays with him. Terry Durant attempts a Layup. Wide open! Jrue Green is 7.8 feet away. [MAN] TERRY DURANT MAKES IT!
Score: 30-32

[11:10] Team_082 possession (Score: 30-32)
Julius Anthony attempts a 3Pt. Contested by Michael Westbrook (3.9 feet, ZONE). Julius Anthony misses. Rebound secured by Terry Durant.

[10:57] Team_036 possession (Score: 30-32)
Kobe Simmons makes the Layup and draws the foul on Julius Carter! And-1! Kobe Simmons to the line for 1. [Team fouls: 1] (Julius Carter: 1 personal fouls)   FT 1/1: MISS Kobe Simmons makes 0/1 from the line. Rebound secured by Jrue Green.
Score: 32-32

[10:43] Team_082 possession (Score: 32-32)
Jrue Green attempts a Layup. Heavily contested by Terry Durant (0.8 feet, MAN)! JRUE GREEN MAKES IT!
Score: 32-34

[10:28] Team_036 possession (Score: 32-34)
Giannis Booker attempts a 3Pt. Contested by Dwyane O'Neal (4.0 feet, MAN). Giannis Booker misses. Offensive rebound by Terry Durant! Terry Durant's putback is no good. Offensive rebound by Terry Durant! Terry Durant kicks it out.

[10:13] Team_036 possession (Score: 32-34)
Terry Durant attempts a 3Pt. Wide open! Dwyane O'Neal is 7.0 feet away. [ZONE] Terry Durant misses. Rebound secured by Julius Carter.

[10:01] Team_082 possession (Score: 32-34)
Dwyane O'Neal drives to the basket... Dwyane O'Neal loses the ball! Stripped by Kobe Simmons! TURNOVER! (live ball)

[09:44] Team_036 possession (Score: 32-34)
Anthony Poole attempts a 3Pt. Contested by Dwyane O'Neal (5.1 feet, ZONE). Anthony Poole misses. Rebound secured by Dwyane O'Neal.

[09:28] Team_082 possession (Score: 32-34)
Julius Anthony attempts a Layup. BLOCKED BY KOBE SIMMONS! Ball is loose! Rebound secured by Terry Durant.

[09:11] Team_036 possession (Score: 32-34)
Terry Durant drives, Jrue Green stays with him. Terry Durant attempts a Dunk. Heavily contested by Jrue Green (1.9 feet, ZONE)! TERRY DURANT MAKES IT! Assist: Kobe Simmons
Score: 34-34

[08:55] Team_082 possession (Score: 34-34)
Julius Anthony attempts a Midrange. Wide open! Michael Westbrook is 6.8 feet away. [MAN] Julius Anthony misses. Offensive rebound by Julius Carter! Julius Carter kicks it out.

[08:40] Team_082 possession (Score: 34-34)
FOUL! Offensive foul on Dwyane O'Neal! Giannis Booker drew the charge! [Team fouls: 2] (Dwyane O'Neal: 1 personal fouls) TURNOVER! (dead ball)

[08:22] Team_036 possession (Score: 34-34)
Giannis Booker makes the Layup and draws the foul on Kristaps Fox! And-1! Giannis Booker to the line for 1. [Team fouls: 3] (Kristaps Fox: 1 personal fouls)   FT 1/1: GOOD Giannis Booker makes 1/1 from the line.
Score: 37-34

[08:05] Team_082 possession (Score: 37-34)
Kristaps Fox drives and kicks out. Julius Anthony attempts a Midrange. Wide open! Anthony Poole is 6.4 feet away. [ZONE] JULIUS ANTHONY MAKES IT! Assist: Jrue Green
Score: 37-36

[07:49] Team_036 possession (Score: 37-36)
Michael Westbrook attempts a Midrange. Heavily contested by Kristaps Fox (1.6 feet, ZONE)! Michael Westbrook misses. Rebound secured by Julius Carter.

[07:38] Team_082 possession (Score: 37-36)
Dwyane O'Neal attempts a Layup. BLOCKED BY KOBE SIMMONS! Ball is loose! Rebound secured by Kobe Simmons.

[07:26] Team_036 possession (Score: 37-36)
Anthony Poole attempts a 3Pt. Contested by Dwyane O'Neal (5.9 feet, ZONE). ANTHONY POOLE MAKES IT! Assist: Michael Westbrook
Score: 40-36

[07:12] Team_082 possession (Score: 40-36)
Julius Anthony attempts a Midrange. Contested by Terry Durant (4.8 feet, ZONE). Julius Anthony misses. Rebound secured by Kobe Simmons.

[06:58] Team_036 possession (Score: 40-36)
Anthony Poole attempts a Midrange. Heavily contested by Jrue Green (1.4 feet, ZONE)! Anthony Poole misses. Rebound secured by Jrue Green.

[06:43] Team_082 possession (Score: 40-36)
Julius Anthony makes the Layup and draws the foul on Michael Westbrook! And-1! Julius Anthony to the line for 1. [Team fouls: 1] (Michael Westbrook: 1 personal fouls)   FT 1/1: GOOD Julius Anthony makes 1/1 from the line.
Score: 40-39

[06:24] Team_036 possession (Score: 40-39)
Anthony Poole drives, picks up Jrue Green. Help arrives from Dwyane O'Neal! Anthony Poole attempts a Layup. Wide open! Dwyane O'Neal is 7.7 feet away. [ZONE] ANTHONY POOLE MAKES IT! Assist: Giannis Booker
Score: 42-39

[06:12] Team_082 possession (Score: 42-39)
Dwyane O'Neal attempts a 3Pt. Contested by Giannis Booker (5.4 feet, MAN). DWYANE O'NEAL MAKES IT! Assist: Julius Carter
Score: 42-42

[05:55] Team_036 possession (Score: 42-42)
Anthony Poole throws a bad pass! Stolen by Kristaps Fox! TURNOVER! (live ball)

[05:39] Team_082 possession (Score: 42-42)
Julius Anthony throws a bad pass! Stolen by Michael Westbrook! TURNOVER! (live ball)

[05:26] Team_036 possession (Score: 42-42)
Terry Durant attempts a Midrange. Contested by Dwyane O'Neal (3.0 feet, ZONE). Terry Durant misses. Rebound secured by Dwyane O'Neal.

[05:09] Team_082 possession (Score: 42-42)
Jrue Green attempts a Midrange. Contested by Terry Durant (5.4 feet, MAN). Jrue Green misses. Rebound secured by Kobe Simmons.

[04:58] Team_036 possession (Score: 42-42)
Anthony Poole attempts a Midrange. Contested by Kristaps Fox (2.8 feet, ZONE). Anthony Poole misses. Offensive rebound by Terry Durant! Terry Durant kicks it out.

[04:41] Team_036 possession (Score: 42-42)
Giannis Booker attempts a 3Pt. Contested by Dwyane O'Neal (5.9 feet, ZONE). Giannis Booker misses. Rebound secured by Jrue Green.

[04:28] Team_082 possession (Score: 42-42)
Julius Carter drives, Kobe Simmons stays with him. Julius Carter attempts a Dunk. Contested by Kobe Simmons (4.8 feet, ZONE). JULIUS CARTER MAKES IT! Assist: Kristaps Fox
Score: 42-44

[04:17] Team_036 possession (Score: 42-44)
Michael Westbrook attempts a 3Pt. Contested by Dwyane O'Neal (5.2 feet, ZONE). Michael Westbrook misses. Rebound secured by Dwyane O'Neal.

[04:03] Team_082 possession (Score: 42-44)
FOUL! Holding foul on Kobe Simmons. [Team fouls: 2] No free throws, side out. (Kobe Simmons: 1 personal fouls)

[03:51] Team_082 possession (Score: 42-44)
Jrue Green attempts a Layup. Wide open! Kobe Simmons is 7.1 feet away. [ZONE] JRUE GREEN MAKES IT! Assist: Kristaps Fox
Score: 42-46

[03:40] Team_036 possession (Score: 42-46)
Kobe Simmons drives to the basket... Kobe Simmons loses control! Ball rolls out of bounds! TURNOVER! (dead ball)

[03:40] Substitution (Team_036): Michael Westbrook OUT → Dirk Anunoby IN (stamina_rule2)

[03:40] Substitution (Team_036): Giannis Booker OUT → Tobias Fox IN (stamina_rule2)

[03:40] Substitution (Team_036): Anthony Poole OUT → Pascal Antetokounmpo IN (stamina_rule2)

[03:40] Substitution (Team_036): Terry Durant OUT → Devin Simmons IN (stamina_rule2)

[03:40] Substitution (Team_036): Kobe Simmons OUT → Bradley Murray IN (stamina_rule2)

[03:40] Substitution (Team_082): Julius Anthony OUT → Jordan Rozier IN (stamina_rule2)

[03:40] Substitution (Team_082): Dwyane O'Neal OUT → Kawhi Poole IN (stamina_rule2)

[03:40] Substitution (Team_082): Kristaps Fox OUT → Shaquille Griffin IN (stamina_rule2)

[03:40] Substitution (Team_082): Jrue Green OUT → Tony Jokic IN (stamina_rule2)

[03:40] Substitution (Team_082): Julius Carter OUT → D'Angelo Parker IN (stamina_rule2)

[03:24] Team_082 possession (Score: 42-46)
FOUL! Holding foul on Dirk Anunoby. [Team fouls: 3] No free throws, side out. (Dirk Anunoby: 1 personal fouls)

[03:06] Team_082 possession (Score: 42-46)
Kawhi Poole drives to the basket... Kawhi Poole throws a bad pass! Stolen by Devin Simmons! TURNOVER! (live ball)

[02:48] Team_036 possession (Score: 42-46)
Devin Simmons drives, Tony Jokic stays with him. Devin Simmons attempts a Dunk. Contested by Tony Jokic (2.9 feet, MAN). Devin Simmons misses. Rebound secured by Shaquille Griffin.

[02:37] Team_082 possession (Score: 42-46)
Tony Jokic attempts a 3Pt. Contested by Tobias Fox (5.7 feet, ZONE). Tony Jokic misses. Rebound secured by Bradley Murray.

[02:26] Team_036 possession (Score: 42-46)
Dirk Anunoby attempts a 3Pt. Contested by Kawhi Poole (5.9 feet, ZONE). Dirk Anunoby misses. Rebound secured by Tony Jokic.

[02:11] Team_082 possession (Score: 42-46)
Tony Jokic makes the Layup and draws the foul on Devin Simmons! And-1! Tony Jokic to the line for 1. [Team fouls: 4] (Devin Simmons: 1 personal fouls)   FT 1/1: GOOD Tony Jokic makes 1/1 from the line.
Score: 42-49

[01:57] Team_036 possession (Score: 42-49)
Bradley Murray drives to the basket... Bradley Murray loses control! Ball rolls out of bounds! TURNOVER! (dead ball)

[01:41] Team_082 possession (Score: 42-49)
Kawhi Poole attempts a 3Pt. Contested by Tobias Fox (5.0 feet, MAN). Kawhi Poole misses. Offensive rebound by Shaquille Griffin! Shaquille Griffin kicks it out.

[01:24] Team_082 possession (Score: 42-49)
D'Angelo Parker drives, picks up Devin Simmons. Help arrives from Dirk Anunoby! D'Angelo Parker attempts a Dunk. Contested by Dirk Anunoby (4.2 feet, ZONE). D'ANGELO PARKER MAKES IT! Assist: Tony Jokic
Score: 42-51

[01:10] Team_036 possession (Score: 42-51)
Devin Simmons attempts a 3Pt. Wide open! Kawhi Poole is 8.5 feet away. [ZONE] Devin Simmons misses. Offensive rebound by Devin Simmons! Devin Simmons kicks it out.

[00:57] Team_036 possession (Score: 42-51)
Dirk Anunoby attempts a Midrange. Contested by Jordan Rozier (5.6 feet, MAN). DIRK ANUNOBY MAKES IT!
Score: 44-51

[00:43] Team_082 possession (Score: 44-51)
Shaquille Griffin drives and kicks out. Jordan Rozier attempts a 3Pt. Contested by Tobias Fox (5.4 feet, ZONE). Jordan Rozier misses. Offensive rebound by Tony Jokic! Tony Jokic kicks it out.

[00:25] Team_082 possession (Score: 44-51)
D'Angelo Parker drives and kicks out. Shaquille Griffin attempts a 3Pt. Contested by Pascal Antetokounmpo (4.3 feet, MAN). Shaquille Griffin misses. Rebound secured by Pascal Antetokounmpo.

[00:12] Team_036 possession (Score: 44-51)
Pascal Antetokounmpo attempts a 3Pt. Wide open! Shaquille Griffin is 6.5 feet away. [MAN] PASCAL ANTETOKOUNMPO MAKES IT!
Score: 47-51

================================================================================
                              2ND QUARTER COMPLETE                              
================================================================================

2ND QUARTER SCORE: Team_036 19, Team_082 22

BOX SCORE:
================================================================================

Team_036
--------------------------------------------------------------------------------
Player                MIN  PTS  REB  AST  TO      FG   FG%      3P   3P%
--------------------------------------------------------------------------------
Anthony Poole          20    5    0    0   0   2/4    50.0     0/0   0.0
Terry Durant           20    4    4    0   0   2/4    50.0     0/0   0.0
Giannis Booker         20    3    0    1   0   1/2    50.0     0/0   0.0
Pascal Antetokounmpo    4    3    1    0   0   1/1   100.0     0/0   0.0
Dirk Anunoby            4    2    0    0   0   1/2    50.0     0/0   0.0
Michael Westbrook      20    0    0    1   0   0/3     0.0     0/0   0.0
Kobe Simmons           20    0    3    1   0   0/1     0.0     0/0   0.0
Devin Simmons           4    0    1    0   0   0/1     0.0     0/0   0.0
Bradley Murray          4    0    1    0   0   0/0     0.0     0/0   0.0

TEAM: FG: 7/18 (38.9%), 3PT: 2/8 (25.0%), REB: 10 (3 off, 7 def), AST: 3, TO: 3
TEAM FOULS: 4


Team_082
--------------------------------------------------------------------------------
Player                MIN  PTS  REB  AST  TO      FG   FG%      3P   3P%
--------------------------------------------------------------------------------
Dwyane O'Neal          20    6    3    0   0   2/3    66.7     0/0   0.0
Julius Anthony         20    5    0    1   0   2/5    40.0     0/0   0.0
Jrue Green             20    4    4    1   0   2/3    66.7     0/0   0.0
Tony Jokic              4    3    2    1   0   1/2    50.0     0/0   0.0
Julius Carter          20    2    3    1   0   1/1   100.0     0/0   0.0
D'Angelo Parker         4    2    0    0   0   1/2    50.0     0/0   0.0
Kristaps Fox           20    0    0    2   0   0/0     0.0     0/0   0.0
Shaquille Griffin       4    0    2    0   0   0/0     0.0     0/0   0.0

TEAM: FG: 9/16 (56.2%), 3PT: 2/4 (50.0%), REB: 14 (3 off, 11 def), AST: 6, TO: 4
TEAM FOULS: 3

================================================================================

================================================================================
                       3RD QUARTER - Team_036 vs Team_082                       
================================================================================

[12:00] Team_036 possession (Score: 47-51)
Terry Durant attempts a Layup. Contested by Jrue Green (4.6 feet, ZONE). TERRY DURANT MAKES IT!
Score: 49-51

[11:45] Team_082 possession (Score: 49-51)
Julius Carter drives, Kobe Simmons stays with him. Julius Carter attempts a Layup. Contested by Kobe Simmons (5.0 feet, MAN). JULIUS CARTER MAKES IT! Assist: Dwyane O'Neal
Score: 49-53

[11:33] Team_036 possession (Score: 49-53)
Anthony Poole attempts a Midrange. Wide open! Jrue Green is 7.3 feet away. [ZONE] Anthony Poole misses. Rebound secured by Julius Carter.

[11:18] Team_082 possession (Score: 49-53)
Jrue Green attempts a Midrange. Contested by Anthony Poole (5.2 feet, ZONE). JRUE GREEN MAKES IT! Assist: Kristaps Fox
Score: 49-55

[11:04] Team_036 possession (Score: 49-55)
Kobe Simmons attempts a Midrange. Contested by Julius Carter (3.3 feet, MAN). Kobe Simmons misses. Rebound secured by Jrue Green.

[10:54] Team_082 possession (Score: 49-55)
Kristaps Fox drives to the basket... FOUL! Offensive foul on Kristaps Fox! Anthony Poole drew the charge! [Team fouls: 1] (Kristaps Fox: 1 personal fouls) TURNOVER! (dead ball)

[10:41] Team_036 possession (Score: 49-55)
Anthony Poole drives, Jrue Green stays with him. Anthony Poole attempts a Dunk. Heavily contested by Jrue Green (1.5 feet, ZONE)! Anthony Poole misses. Offensive rebound by Kobe Simmons! Kobe Simmons's putback is no good. Offensive rebound by Kobe Simmons! Kobe Simmons kicks it out.

[10:27] Team_036 possession (Score: 49-55)
Terry Durant attempts a Midrange. Contested by Jrue Green (4.1 feet, MAN). Terry Durant misses. Rebound secured by Dwyane O'Neal.

[10:12] Team_082 possession (Score: 49-55)
Julius Anthony attempts a Midrange. Contested by Terry Durant (3.6 feet, ZONE). Julius Anthony misses. Rebound secured by Terry Durant.

[10:01] Team_036 possession (Score: 49-55)
Giannis Booker drives to the basket... Giannis Booker throws a bad pass out of bounds! TURNOVER! (dead ball)

[09:47] Team_082 possession (Score: 49-55)
Julius Carter makes the Layup and draws the foul on Kobe Simmons! And-1! Julius Carter to the line for 1. [Team fouls: 1] (Kobe Simmons: 1 personal fouls)   FT 1/1: GOOD Julius Carter makes 1/1 from the line.
Score: 49-58

[09:33] Team_036 possession (Score: 49-58)
Terry Durant attempts a Midrange. Wide open! Dwyane O'Neal is 7.0 feet away. [ZONE] Terry Durant misses. Rebound secured by Julius Carter.

[09:18] Team_082 possession (Score: 49-58)
Dwyane O'Neal attempts a Layup. Wide open! Giannis Booker is 7.7 feet away. [MAN] DWYANE O'NEAL MAKES IT! Assist: Julius Anthony
Score: 49-60

[09:04] Team_036 possession (Score: 49-60)
Giannis Booker attempts a 3Pt. Wide open! Dwyane O'Neal is 6.3 feet away. [MAN] Giannis Booker misses. Rebound secured by Jrue Green.

[08:50] Team_082 possession (Score: 49-60)
FOUL! Shooting foul on Kobe Simmons. Julius Carter to the line for 2 free throws. [Team fouls: 2] (Kobe Simmons: 2 personal fouls)   FT 1/2: GOOD   FT 2/2: GOOD Julius Carter makes 2/2 from the line.
Score: 49-62

[08:34] Team_036 possession (Score: 49-62)
Giannis Booker attempts a 3Pt. Contested by Dwyane O'Neal (4.1 feet, MAN). Giannis Booker misses. Rebound secured by Dwyane O'Neal.

[08:19] Team_082 possession (Score: 49-62)
Jrue Green drives, picks up Kobe Simmons. Help arrives from Giannis Booker! Jrue Green attempts a Layup. Contested by Giannis Booker (2.7 feet, ZONE). JRUE GREEN MAKES IT!
Score: 49-64

[08:07] Team_036 possession (Score: 49-64)
Michael Westbrook attempts a 3Pt. Contested by Julius Anthony (2.1 feet, MAN). Michael Westbrook misses. Rebound secured by Dwyane O'Neal.

[07:50] Team_082 possession (Score: 49-64)
Julius Anthony attempts a 3Pt. Contested by Michael Westbrook (4.9 feet, MAN). Julius Anthony misses. Rebound secured by Kobe Simmons.

[07:34] Team_036 possession (Score: 49-64)
FOUL! Shooting foul on Dwyane O'Neal. Giannis Booker to the line for 3 free throws. [Team fouls: 3] (Dwyane O'Neal: 1 personal fouls)   FT 1/3: GOOD   FT 2/3: GOOD   FT 3/3: GOOD Giannis Booker makes 3/3 from the line.
Score: 52-64

[07:20] Team_082 possession (Score: 52-64)
Kristaps Fox drives and kicks out. Julius Anthony attempts a 3Pt. Contested by Michael Westbrook (5.4 feet, MAN). Julius Anthony misses. Rebound secured by Terry Durant.

[07:08] Team_036 possession (Score: 52-64)
FOUL! Shooting foul on Dwyane O'Neal. Michael Westbrook to the line for 2 free throws. [Team fouls: 4] (Dwyane O'Neal: 2 personal fouls)   FT 1/2: GOOD   FT 2/2: GOOD Michael Westbrook makes 2/2 from the line.
Score: 54-64

[06:56] Team_082 possession (Score: 54-64)
Julius Carter attempts a Midrange. Contested by Kobe Simmons (3.5 feet, MAN). JULIUS CARTER MAKES IT!
Score: 54-66

[06:45] Team_036 possession (Score: 54-66)
Terry Durant attempts a Layup. Contested by Julius Carter (5.6 feet, ZONE). TERRY DURANT MAKES IT! Assist: Anthony Poole
Score: 56-66

[06:27] Team_082 possession (Score: 56-66)
Dwyane O'Neal loses the ball! Stripped by Giannis Booker! TURNOVER! (live ball)

[06:13] Team_036 possession (Score: 56-66)
FOUL! Holding foul on Dwyane O'Neal. [IN THE BONUS! 5 team fouls] Giannis Booker to the line for 2 free throws. (Dwyane O'Neal: 3 personal fouls)   FT 1/2: GOOD   FT 2/2: GOOD Giannis Booker makes 2/2 from the line.
Score: 58-66

[05:59] Team_082 possession (Score: 58-66)
Julius Anthony drives and kicks out. Jrue Green attempts a Midrange. Contested by Terry Durant (4.4 feet, MAN). Jrue Green misses. Rebound secured by Terry Durant.

[05:43] Team_036 possession (Score: 58-66)
Terry Durant drives and kicks out. FOUL! Shooting foul on Jrue Green. Terry Durant to the line for 2 free throws. [BONUS: 6 team fouls] (Jrue Green: 1 personal fouls)   FT 1/2: GOOD   FT 2/2: GOOD Terry Durant makes 2/2 from the line.
Score: 60-66

[05:31] Team_082 possession (Score: 60-66)
Jrue Green attempts a Midrange. Contested by Terry Durant (4.4 feet, MAN). Jrue Green misses. Offensive rebound by Jrue Green! Jrue Green kicks it out.

[05:13] Team_082 possession (Score: 60-66)
Kristaps Fox attempts a 3Pt. Wide open! Michael Westbrook is 6.4 feet away. [ZONE] KRISTAPS FOX MAKES IT! Assist: Dwyane O'Neal
Score: 60-69

[04:59] Team_036 possession (Score: 60-69)
Michael Westbrook attempts a 3Pt. Wide open! Dwyane O'Neal is 6.4 feet away. [ZONE] MICHAEL WESTBROOK MAKES IT! Assist: Terry Durant
Score: 63-69

[04:40] Team_082 possession (Score: 63-69)
Kristaps Fox attempts a Midrange. Contested by Giannis Booker (2.0 feet, ZONE). Kristaps Fox misses. Offensive rebound by Jrue Green! Jrue Green kicks it out.

[04:26] Team_082 possession (Score: 63-69)
Julius Carter drives and kicks out. Julius Carter attempts a Midrange. Heavily contested by Kobe Simmons (1.7 feet, MAN)! Julius Carter misses. Offensive rebound by Julius Carter! Julius Carter kicks it out.

[04:12] Team_082 possession (Score: 63-69)
Kristaps Fox loses control! Ball rolls out of bounds! TURNOVER! (dead ball)

[03:58] Team_036 possession (Score: 63-69)
Kobe Simmons attempts a 3Pt. Contested by Julius Carter (4.9 feet, MAN). Kobe Simmons misses. Rebound secured by Jrue Green.

[03:47] Team_082 possession (Score: 63-69)
FOUL! Reach-in foul on Kobe Simmons during the drive. [Team fouls: 3] No free throws, side out. (Kobe Simmons: 3 personal fouls)

[03:31] Team_082 possession (Score: 63-69)
Dwyane O'Neal attempts a 3Pt. Wide open! Giannis Booker is 6.7 feet away. [ZONE] DWYANE O'NEAL MAKES IT! Assist: Julius Anthony
Score: 63-72

[03:16] Team_036 possession (Score: 63-72)
FOUL! Reach-in foul on Jrue Green during the drive. [IN THE BONUS! 7 team fouls] Giannis Booker to the line for 2 free throws. (Jrue Green: 2 personal fouls)   FT 1/2: GOOD   FT 2/2: GOOD Giannis Booker makes 2/2 from the line.
Score: 65-72

[03:00] Team_082 possession (Score: 65-72)
Julius Carter drives, picks up Kobe Simmons. Help arrives from Giannis Booker! Julius Carter attempts a Dunk. Contested by Giannis Booker (3.5 feet, ZONE). JULIUS CARTER MAKES IT! Assist: Kristaps Fox
Score: 65-74

[02:46] Team_036 possession (Score: 65-74)
Terry Durant attempts a Dunk. BLOCKED BY JRUE GREEN! Ball is loose! Offensive rebound by Terry Durant! Terry Durant kicks it out.

[02:32] Team_036 possession (Score: 65-74)
FOUL! Offensive foul on Michael Westbrook! Julius Anthony drew the charge! [Team fouls: 4] (Michael Westbrook: 1 personal fouls) TURNOVER! (dead ball)

[02:17] Team_082 possession (Score: 65-74)
Julius Carter drives to the basket... Julius Carter throws a bad pass out of bounds! TURNOVER! (dead ball)

[02:17] Substitution (Team_036): Michael Westbrook OUT → Dirk Anunoby IN (stamina_rule2)

[02:17] Substitution (Team_036): Anthony Poole OUT → Pascal Antetokounmpo IN (stamina_rule2)

[02:17] Substitution (Team_036): Terry Durant OUT → Devin Simmons IN (stamina_rule2)

[02:17] Substitution (Team_036): Kobe Simmons OUT → Bradley Murray IN (stamina_rule2)

[02:17] Substitution (Team_082): Julius Anthony OUT → Jordan Rozier IN (stamina_rule2)

[02:17] Substitution (Team_082): Dwyane O'Neal OUT → Kawhi Poole IN (stamina_rule2)

[02:17] Substitution (Team_082): Kristaps Fox OUT → Shaquille Griffin IN (stamina_rule2)

[02:17] Substitution (Team_082): Jrue Green OUT → Tony Jokic IN (stamina_rule2)

[02:17] Substitution (Team_082): Julius Carter OUT → D'Angelo Parker IN (stamina_rule2)

[02:05] Team_036 possession (Score: 65-74)
Devin Simmons drives to the basket... Devin Simmons loses the ball! Stripped by D'Angelo Parker! TURNOVER! (live ball)

[01:51] Team_082 possession (Score: 65-74)
D'Angelo Parker attempts a Midrange. Contested by Devin Simmons (4.9 feet, ZONE). D'ANGELO PARKER MAKES IT!
Score: 65-76

[01:37] Team_036 possession (Score: 65-76)
Bradley Murray drives to the basket... Bradley Murray loses control! Ball rolls out of bounds! TURNOVER! (dead ball)

[01:37] Substitution (Team_036): Giannis Booker OUT → Tobias Fox IN (stamina_rule2)

[01:23] Team_082 possession (Score: 65-76)
Jordan Rozier attempts a 3Pt. Wide open! Devin Simmons is 8.7 feet away. [ZONE] Jordan Rozier misses. Rebound secured by Pascal Antetokounmpo.

[01:08] Team_036 possession (Score: 65-76)
Devin Simmons makes the Layup and draws the foul on Tony Jokic! And-1! Devin Simmons to the line for 1. [BONUS: 8 team fouls] (Tony Jokic: 1 personal fouls)   FT 1/1: GOOD Devin Simmons makes 1/1 from the line.
Score: 68-76

[00:57] Team_082 possession (Score: 68-76)
D'Angelo Parker attempts a Layup. Contested by Devin Simmons (5.0 feet, ZONE). D'ANGELO PARKER MAKES IT! Assist: Tony Jokic
Score: 68-78

[00:40] Team_036 possession (Score: 68-78)
Pascal Antetokounmpo drives, picks up Shaquille Griffin. Help arrives from Kawhi Poole! Pascal Antetokounmpo attempts a Layup. Contested by Kawhi Poole (2.6 feet, MAN). PASCAL ANTETOKOUNMPO MAKES IT! Assist: Tobias Fox
Score: 70-78

[00:24] Team_082 possession (Score: 70-78)
Jordan Rozier throws a bad pass out of bounds! TURNOVER! (dead ball)

[00:13] Team_036 possession (Score: 70-78)
Pascal Antetokounmpo attempts a Midrange. Wide open! Tony Jokic is 6.4 feet away. [ZONE] Pascal Antetokounmpo misses. Rebound secured by Shaquille Griffin.

================================================================================
                              3RD QUARTER COMPLETE                              
================================================================================

3RD QUARTER SCORE: Team_036 23, Team_082 27

BOX SCORE:
================================================================================

Team_036
--------------------------------------------------------------------------------
Player                MIN  PTS  REB  AST  TO      FG   FG%      3P   3P%
--------------------------------------------------------------------------------
Giannis Booker         30    7    0    0   0   3/5    60.0     0/0   0.0
Terry Durant           30    6    4    1   0   3/5    60.0     0/0   0.0
Michael Westbrook      30    5    0    0   0   2/3    66.7     0/0   0.0
Devin Simmons           7    3    0    0   0   1/1   100.0     0/0   0.0
Pascal Antetokounmpo    7    2    1    0   0   1/2    50.0     0/0   0.0
Anthony Poole          30    0    0    1   0   0/1     0.0     0/0   0.0
Kobe Simmons           30    0    2    0   0   0/2     0.0     0/0   0.0
Tobias Fox              6    0    0    1   0   0/0     0.0     0/0   0.0

TEAM: FG: 10/19 (52.6%), 3PT: 2/6 (33.3%), REB: 7 (2 off, 5 def), AST: 3, TO: 4
TEAM FOULS: 4


Team_082
--------------------------------------------------------------------------------
Player                MIN  PTS  REB  AST  TO      FG   FG%      3P   3P%
--------------------------------------------------------------------------------
Julius Carter          30   11    3    0   0   5/5   100.0     0/0   0.0
Dwyane O'Neal          30    5    3    2   0   2/2   100.0     0/0   0.0
Jrue Green             30    4    5    0   0   2/2   100.0     0/0   0.0
D'Angelo Parker         7    4    0    0   0   2/2   100.0     0/0   0.0
Kristaps Fox           30    3    0    2   0   1/2    50.0     0/0   0.0
Julius Anthony         30    0    0    2   0   0/3     0.0     0/0   0.0
Jordan Rozier           7    0    0    0   0   0/1     0.0     0/0   0.0
Tony Jokic              7    0    0    1   0   0/0     0.0     0/0   0.0
Shaquille Griffin       7    0    1    0   0   0/0     0.0     0/0   0.0

TEAM: FG: 12/17 (70.6%), 3PT: 2/4 (50.0%), REB: 12 (3 off, 9 def), AST: 7, TO: 5
TEAM FOULS: 8 [Team_036 in BONUS]

================================================================================

================================================================================
                       4TH QUARTER - Team_036 vs Team_082                       
================================================================================

[12:00] Team_036 possession (Score: 70-78)
Michael Westbrook attempts a 3Pt. Contested by Julius Anthony (5.1 feet, MAN). MICHAEL WESTBROOK MAKES IT! Assist: Terry Durant
Score: 73-78

[11:49] Team_082 possession (Score: 73-78)
Dwyane O'Neal attempts a 3Pt. Wide open! Michael Westbrook is 6.9 feet away. [ZONE] DWYANE O'NEAL MAKES IT! Assist: Jrue Green
Score: 73-81

[11:36] Team_036 possession (Score: 73-81)
Giannis Booker attempts a 3Pt. Contested by Dwyane O'Neal (3.9 feet, ZONE). Giannis Booker misses. Rebound secured by Dwyane O'Neal.

[11:18] Team_082 possession (Score: 73-81)
Julius Carter attempts a 3Pt. Contested by Kobe Simmons (2.8 feet, MAN). Julius Carter misses. Rebound secured by Terry Durant.

[11:04] Team_036 possession (Score: 73-81)
Giannis Booker drives and kicks out. Giannis Booker attempts a 3Pt. Contested by Dwyane O'Neal (5.3 feet, MAN). Giannis Booker misses. Rebound secured by Dwyane O'Neal.

[10:48] Team_082 possession (Score: 73-81)
Julius Carter drives and kicks out. Dwyane O'Neal attempts a 3Pt. Wide open! Michael Westbrook is 6.7 feet away. [ZONE] DWYANE O'NEAL MAKES IT! Assist: Kristaps Fox
Score: 73-84

[10:31] Team_036 possession (Score: 73-84)
Anthony Poole attempts a Midrange. Contested by Kristaps Fox (3.7 feet, MAN). Anthony Poole misses. Offensive rebound by Kobe Simmons! Kobe Simmons puts it back in!
Score: 75-84

[10:18] Team_082 possession (Score: 75-84)
Kristaps Fox drives, Anthony Poole stays with him. Kristaps Fox attempts a Dunk. Heavily contested by Anthony Poole (0.6 feet, MAN)! KRISTAPS FOX MAKES IT! Assist: Jrue Green
Score: 75-86

[10:03] Team_036 possession (Score: 75-86)
Terry Durant makes the Midrange and draws the foul on Jrue Green! And-1! Terry Durant to the line for 1. [Team fouls: 1] (Jrue Green: 1 personal fouls)   FT 1/1: MISS Terry Durant makes 0/1 from the line. Offensive rebound by Kobe Simmons! Kobe Simmons puts it back in!
Score: 79-86

[09:46] Team_082 possession (Score: 79-86)
FOUL! Reach-in foul on Kobe Simmons during the drive. [Team fouls: 1] No free throws, side out. (Kobe Simmons: 1 personal fouls)

[09:34] Team_082 possession (Score: 79-86)
Kristaps Fox attempts a 3Pt. Wide open! Michael Westbrook is 7.3 feet away. [ZONE] Kristaps Fox misses. Rebound secured by Anthony Poole.

[09:23] Team_036 possession (Score: 79-86)
Terry Durant drives to the basket... Terry Durant commits a violation (traveling/carry)! TURNOVER! (dead ball)

[09:23] Substitution (Team_036): Michael Westbrook OUT → Dirk Anunoby IN (stamina_rule2)

[09:23] Substitution (Team_036): Giannis Booker OUT → Tobias Fox IN (stamina_rule2)

[09:23] Substitution (Team_036): Terry Durant OUT → Devin Simmons IN (stamina_rule2)

[09:23] Substitution (Team_036): Kobe Simmons OUT → Bradley Murray IN (stamina_rule2)

[09:23] Substitution (Team_082): Julius Anthony OUT → Jordan Rozier IN (stamina_rule2)

[09:23] Substitution (Team_082): Dwyane O'Neal OUT → Kawhi Poole IN (stamina_rule2)

[09:23] Substitution (Team_082): Kristaps Fox OUT → Shaquille Griffin IN (stamina_rule2)

[09:23] Substitution (Team_082): Jrue Green OUT → Tony Jokic IN (stamina_rule2)

[09:23] Substitution (Team_082): Julius Carter OUT → D'Angelo Parker IN (stamina_rule2)

[09:06] Team_082 possession (Score: 79-86)
Jordan Rozier attempts a 3Pt. Wide open! Devin Simmons is 9.0 feet away. [ZONE] JORDAN ROZIER MAKES IT! Assist: Kawhi Poole
Score: 79-89

[08:51] Team_036 possession (Score: 79-89)
FOUL! Shooting foul on Shaquille Griffin. Anthony Poole to the line for 2 free throws. [Team fouls: 2] (Shaquille Griffin: 1 personal fouls)   FT 1/2: GOOD   FT 2/2: GOOD Anthony Poole makes 2/2 from the line.
Score: 81-89

[08:37] Team_082 possession (Score: 81-89)
Jordan Rozier attempts a Midrange. Contested by Tobias Fox (5.3 feet, ZONE). JORDAN ROZIER MAKES IT!
Score: 81-91

[08:21] Team_036 possession (Score: 81-91)
Anthony Poole attempts a 3Pt. Contested by Kawhi Poole (5.7 feet, ZONE). ANTHONY POOLE MAKES IT! Assist: Devin Simmons
Score: 84-91

[08:05] Team_082 possession (Score: 84-91)
FOUL! Reach-in foul on Devin Simmons during the drive. [Team fouls: 2] No free throws, side out. (Devin Simmons: 1 personal fouls)

[07:50] Team_082 possession (Score: 84-91)
Tony Jokic attempts a 3Pt. Wide open! Tobias Fox is 7.1 feet away. [ZONE] TONY JOKIC MAKES IT! Assist: Jordan Rozier
Score: 84-94

[07:35] Team_036 possession (Score: 84-94)
Anthony Poole attempts a 3Pt. Contested by Kawhi Poole (4.3 feet, ZONE). Anthony Poole misses. Rebound secured by Tony Jokic.

[07:23] Team_082 possession (Score: 84-94)
Jordan Rozier attempts a 3Pt. Contested by Dirk Anunoby (4.3 feet, MAN). Jordan Rozier misses. Rebound secured by Bradley Murray.

[07:11] Team_036 possession (Score: 84-94)
Dirk Anunoby attempts a Midrange. Contested by D'Angelo Parker (5.9 feet, ZONE). DIRK ANUNOBY MAKES IT! Assist: Tobias Fox
Score: 86-94

[06:59] Team_082 possession (Score: 86-94)
Shaquille Griffin attempts a 3Pt. Contested by Tobias Fox (3.9 feet, ZONE). Shaquille Griffin misses. Rebound secured by Anthony Poole.

[06:43] Team_036 possession (Score: 86-94)
FOUL! Reach-in foul on D'Angelo Parker during the drive. [Team fouls: 3] No free throws, side out. (D'Angelo Parker: 1 personal fouls)

[06:31] Team_036 possession (Score: 86-94)
FOUL! Reach-in foul on Tony Jokic during the drive. [Team fouls: 4] No free throws, side out. (Tony Jokic: 1 personal fouls)

[06:14] Team_036 possession (Score: 86-94)
Anthony Poole attempts a 3Pt. Contested by Shaquille Griffin (3.6 feet, MAN). Anthony Poole misses. Rebound secured by Tony Jokic.

[06:03] Team_082 possession (Score: 86-94)
Shaquille Griffin attempts a 3Pt. Wide open! Tobias Fox is 7.8 feet away. [ZONE] Shaquille Griffin misses. Rebound secured by Bradley Murray.

[05:51] Team_036 possession (Score: 86-94)
Dirk Anunoby attempts a 3Pt. Contested by Jordan Rozier (4.8 feet, MAN). Dirk Anunoby misses. Rebound secured by D'Angelo Parker.

[05:38] Team_082 possession (Score: 86-94)
D'Angelo Parker attempts a Midrange. BLOCKED BY TOBIAS FOX! Ball is loose! Rebound secured by Devin Simmons.

[05:27] Team_036 possession (Score: 86-94)
FOUL! Holding foul on Tony Jokic. [IN THE BONUS! 5 team fouls] Devin Simmons to the line for 2 free throws. (Tony Jokic: 2 personal fouls)   FT 1/2: GOOD   FT 2/2: GOOD Devin Simmons makes 2/2 from the line.
Score: 88-94

[05:16] Team_082 possession (Score: 88-94)
Jordan Rozier attempts a Layup. Contested by Devin Simmons (4.7 feet, ZONE). Jordan Rozier misses. Rebound secured by Bradley Murray.

[05:03] Team_036 possession (Score: 88-94)
Devin Simmons commits a violation (traveling/carry)! TURNOVER! (dead ball)

[05:03] Substitution (Team_036): Anthony Poole OUT → Pascal Antetokounmpo IN (stamina_rule2)

[04:50] Team_082 possession (Score: 88-94)
Shaquille Griffin attempts a Midrange. Contested by Devin Simmons (5.5 feet, ZONE). Shaquille Griffin misses. Rebound secured by Devin Simmons.

[04:34] Team_036 possession (Score: 88-94)
FOUL! Reach-in foul on D'Angelo Parker during the drive. [IN THE BONUS! 6 team fouls] Bradley Murray to the line for 2 free throws. (D'Angelo Parker: 2 personal fouls)   FT 1/2: GOOD   FT 2/2: GOOD Bradley Murray makes 2/2 from the line.
Score: 90-94

[04:19] Team_082 possession (Score: 90-94)
Jordan Rozier attempts a 3Pt. Wide open! Dirk Anunoby is 6.7 feet away. [MAN] Jordan Rozier misses. Rebound secured by Devin Simmons.

[04:04] Team_036 possession (Score: 90-94)
FOUL! Shooting foul on D'Angelo Parker. Bradley Murray to the line for 2 free throws. [BONUS: 7 team fouls] (D'Angelo Parker: 3 personal fouls)   FT 1/2: GOOD   FT 2/2: GOOD Bradley Murray makes 2/2 from the line.
Score: 92-94

[03:46] Team_082 possession (Score: 92-94)
Shaquille Griffin attempts a 3Pt. Contested by Tobias Fox (5.9 feet, ZONE). SHAQUILLE GRIFFIN MAKES IT! Assist: Tony Jokic
Score: 92-97

[03:30] Team_036 possession (Score: 92-97)
FOUL! Holding foul on Tony Jokic. [IN THE BONUS! 8 team fouls] Devin Simmons to the line for 2 free throws. (Tony Jokic: 3 personal fouls)   FT 1/2: GOOD   FT 2/2: MISS Devin Simmons makes 1/2 from the line. Rebound secured by Shaquille Griffin.
Score: 93-97

[03:14] Team_082 possession (Score: 93-97)
D'Angelo Parker makes the Layup and draws the foul on Dirk Anunoby! And-1! D'Angelo Parker to the line for 1. [Team fouls: 3] (Dirk Anunoby: 1 personal fouls)   FT 1/1: GOOD D'Angelo Parker makes 1/1 from the line.
Score: 93-100

[02:59] Team_036 possession (Score: 93-100)
Dirk Anunoby attempts a Midrange. Wide open! Jordan Rozier is 10.0 feet away. [MAN] Dirk Anunoby misses. Rebound secured by D'Angelo Parker.

[02:44] Team_082 possession (Score: 93-100)
Shaquille Griffin attempts a 3Pt. Wide open! Tobias Fox is 8.0 feet away. [ZONE] Shaquille Griffin misses. Offensive rebound by D'Angelo Parker! D'Angelo Parker kicks it out.

[02:30] Team_082 possession (Score: 93-100)
Shaquille Griffin drives, picks up Devin Simmons. Help arrives from Dirk Anunoby! Shaquille Griffin attempts a Dunk. Wide open! Dirk Anunoby is 7.4 feet away. [ZONE] SHAQUILLE GRIFFIN MAKES IT!
Score: 93-102

[02:16] Team_036 possession (Score: 93-102)
Devin Simmons attempts a 3Pt. Wide open! Tony Jokic is 6.8 feet away. [MAN] DEVIN SIMMONS MAKES IT! Assist: Bradley Murray
Score: 96-102

[02:01] Team_082 possession (Score: 96-102)
D'Angelo Parker drives, Bradley Murray stays with him. D'Angelo Parker attempts a Layup. Contested by Bradley Murray (4.5 feet, MAN). D'ANGELO PARKER MAKES IT! Assist: Shaquille Griffin
Score: 96-104

[01:47] Team_036 possession (Score: 96-104)
Pascal Antetokounmpo drives to the basket... Pascal Antetokounmpo throws a bad pass! Stolen by Shaquille Griffin! TURNOVER! (live ball)

[01:32] Team_082 possession (Score: 96-104)
Shaquille Griffin attempts a 3Pt. Contested by Pascal Antetokounmpo (5.2 feet, MAN). Shaquille Griffin misses. Rebound secured by Devin Simmons.

[01:16] Team_036 possession (Score: 96-104)
FOUL! Holding foul on Jordan Rozier. [IN THE BONUS! 9 team fouls] Dirk Anunoby to the line for 2 free throws. (Jordan Rozier: 1 personal fouls)   FT 1/2: MISS   FT 2/2: GOOD Dirk Anunoby makes 1/2 from the line.
Score: 97-104

[01:01] Team_082 possession (Score: 97-104)
D'Angelo Parker attempts a 3Pt. Wide open! Tobias Fox is 8.0 feet away. [ZONE] D'Angelo Parker misses. FOUL! Loose ball foul on Pascal Antetokounmpo during the rebound battle. [Team fouls: 4] No free throws, side out. (Pascal Antetokounmpo: 1 personal fouls)

[00:48] Team_082 possession (Score: 97-104)
Shaquille Griffin drives and kicks out. D'Angelo Parker attempts a Midrange. Wide open! Tobias Fox is 7.1 feet away. [ZONE] D'Angelo Parker misses. Rebound secured by Bradley Murray.

[00:35] Team_036 possession (Score: 97-104)
Bradley Murray attempts a Midrange. BLOCKED BY D'ANGELO PARKER! Ball deflects out of bounds off Bradley Murray.

[00:22] Team_082 possession (Score: 97-104)
FOUL! Shooting foul on Pascal Antetokounmpo. Jordan Rozier to the line for 2 free throws. [BONUS: 5 team fouls] (Pascal Antetokounmpo: 2 personal fouls)   FT 1/2: MISS   FT 2/2: GOOD Jordan Rozier makes 1/2 from the line.
Score: 97-105

[00:06] Team_036 possession (Score: 97-105)
Dirk Anunoby attempts a 3Pt. Wide open! Tony Jokic is 7.2 feet away. [ZONE] Dirk Anunoby misses. Rebound secured by Shaquille Griffin.

================================================================================
                              4TH QUARTER COMPLETE                              
================================================================================

4TH QUARTER SCORE: Team_036 27, Team_082 27

BOX SCORE:
================================================================================

Team_036
--------------------------------------------------------------------------------
Player                MIN  PTS  REB  AST  TO      FG   FG%      3P   3P%
--------------------------------------------------------------------------------
Kobe Simmons           32    6    1    0   0   2/2   100.0     0/0   0.0
Anthony Poole          37    5    2    0   0   2/4    50.0     0/0   0.0
Devin Simmons          16    5    4    1   0   2/2   100.0     0/0   0.0
Bradley Murray         16    4    4    1   0   2/3    66.7     0/0   0.0
Michael Westbrook      32    3    0    0   0   1/1   100.0     0/0   0.0
Dirk Anunoby           16    3    0    0   0   2/5    40.0     0/0   0.0
Terry Durant           32    0    1    1   0   0/0     0.0     0/0   0.0
Giannis Booker         33    0    0    0   0   0/2     0.0     0/0   0.0
Tobias Fox             15    0    0    1   0   0/0     0.0     0/0   0.0

TEAM: FG: 11/20 (55.0%), 3PT: 3/8 (37.5%), REB: 12 (1 off, 11 def), AST: 4, TO: 3
TEAM FOULS: 5 [Team_082 in BONUS]


Team_082
--------------------------------------------------------------------------------
Player                MIN  PTS  REB  AST  TO      FG   FG%      3P   3P%
--------------------------------------------------------------------------------
Dwyane O'Neal          32    6    2    0   0   2/2   100.0     0/0   0.0
Jordan Rozier          16    6    0    1   0   3/6    50.0     0/0   0.0
Shaquille Griffin      16    5    2    1   0   2/7    28.6     0/0   0.0
D'Angelo Parker        16    5    3    0   0   2/3    66.7     0/0   0.0
Tony Jokic             16    3    3    1   0   1/1   100.0     0/0   0.0
Kristaps Fox           32    2    0    1   0   1/2    50.0     0/0   0.0
Jrue Green             32    0    0    2   0   0/0     0.0     0/0   0.0
Julius Carter          32    0    0    0   0   0/1     0.0     0/0   0.0
Kawhi Poole            16    0    0    1   0   0/0     0.0     0/0   0.0

TEAM: FG: 11/22 (50.0%), 3PT: 4/11 (36.4%), REB: 10 (2 off, 8 def), AST: 7, TO: 0
TEAM FOULS: 9 [Team_036 in BONUS]

================================================================================

================================================================================
                               FULL GAME COMPLETE                               
================================================================================

FINAL SCORE: Team_036 97, Team_082 105

SCORING BY QUARTER:
--------------------------------------------------------------------------------
Team                     Q1     Q2     Q3     Q4    FINAL
--------------------------------------------------------------------------------
Team_036                 28     19     23     27       97
Team_082                 29     22     27     27      105
--------------------------------------------------------------------------------

FULL GAME BOX SCORE:
================================================================================

Team_036
--------------------------------------------------------------------------------
Player                MIN  PTS  REB  AST  TO      FG   FG%      3P   3P%      FT STL BLK
--------------------------------------------------------------------------------
Anthony Poole          37   13    2    2   3   7/12   58.3   4/7    57.1   2/2     0   1
Giannis Booker         33   20    2    3   3   7/14   50.0   3/8    37.5  10/10    1   0
Michael Westbrook      32   11    0    2   2   4/9    44.4   2/5    40.0   3/3     1   0
Terry Durant           32   12   13    3   2   6/12   50.0   0/3     0.0   2/3     0   0
Kobe Simmons           32   14   12    2   0   4/8    50.0   0/2     0.0   0/1     1   3
Dirk Anunoby           16    5    0    0   3   2/6    33.3   0/3     0.0   1/2     0   0
Devin Simmons          16   10    5    1   1   3/4    75.0   1/1   100.0   6/7     1   0
Bradley Murray         16    4    6    1   0   2/3    66.7   0/0     0.0   4/4     0   0
Tobias Fox             15    0    0    2   0   0/0     0.0   0/0     0.0   0/0     0   1
Pascal Antetokounmpo   12    5    2    0   0   2/3    66.7   1/1   100.0   0/0     0   0

TEAM: FG: 40/75 (53.3%), 3PT: 11/30 (36.7%), REB: 42 (9 off, 33 def), AST: 16, TO: 14


Team_082
--------------------------------------------------------------------------------
Player                MIN  PTS  REB  AST  TO      FG   FG%      3P   3P%      FT STL BLK
--------------------------------------------------------------------------------
Julius Anthony         32    7    0    3   1   2/10   20.0   0/3     0.0   2/3     0   0
Dwyane O'Neal          32   28    9    3   2   9/12   75.0   4/4   100.0   4/4     0   0
Kristaps Fox           32   13    0    7   1   6/9    66.7   3/5    60.0   3/3     1   0
Jrue Green             32    8   12    5   1   5/8    62.5   0/0     0.0   1/2     2   2
Julius Carter          32   15   10    2   2   8/12   66.7   0/2     0.0   3/3     0   0
Jordan Rozier          16    6    0    1   1   3/7    42.9   1/4    25.0   1/2     0   0
Kawhi Poole            16    0    0    1   1   0/0     0.0   0/0     0.0   0/0     0   0
Shaquille Griffin      16    5    5    1   0   2/7    28.6   1/4    25.0   0/0     1   0
Tony Jokic             16    6    5    3   0   2/3    66.7   1/2    50.0   1/1     0   0
D'Angelo Parker        16   15    3    0   0   6/8    75.0   0/0     0.0   3/3     1   1

TEAM: FG: 44/77 (57.1%), 3PT: 10/24 (41.7%), REB: 43 (11 off, 32 def), AST: 26, TO: 9

================================================================================
