================================================================================
                        FULL GAME - Team_040 vs Team_016                        
================================================================================

================================================================================
                       1ST QUARTER - Team_040 vs Team_016                       
================================================================================

[12:00] Team_040 possession (Score: 0-0)
Shaquille Bane throws a bad pass! Stolen by Giannis Ginobili! TURNOVER! (live ball)

[11:46] Team_016 possession (Score: 0-0)
Ben Barrett attempts a 3Pt. Contested by Ayo Rose (5.0 feet, ZONE). Ben Barrett misses. Rebound secured by Dirk Johnson.

[11:33] Team_040 possession (Score: 0-0)
Bam Gobert drives, Vince Duncan stays with him. Bam Gobert attempts a Dunk. Heavily contested by Vince Duncan (1.8 feet, MAN)! BAM GOBERT MAKES IT!
Score: 2-0

[11:14] Team_016 possession (Score: 2-0)
FOUL! Reach-in foul on Ayo Rose during the drive. [Team fouls: 1] No free throws, side out. (Ayo Rose: 1 personal fouls)

[10:59] Team_016 possession (Score: 2-0)
Vince Duncan attempts a Layup. Contested by Bam Gobert (3.0 feet, MAN). VINCE DUNCAN MAKES IT!
Score: 2-2

[10:47] Team_040 possession (Score: 2-2)
Dirk Johnson attempts a Midrange. Heavily contested by Ben Barrett (2.0 feet, ZONE)! Dirk Johnson misses. Offensive rebound by Bam Gobert! Bam Gobert kicks it out.

[10:28] Team_040 possession (Score: 2-2)
Ayo Rose attempts a Layup. Contested by Collin Barnes (2.2 feet, MAN). Ayo Rose misses. Rebound secured by Vince Quickley.

[10:17] Team_016 possession (Score: 2-2)
Vince Quickley throws a bad pass out of bounds! TURNOVER! (dead ball)

[10:05] Team_040 possession (Score: 2-2)
Carmelo Murray attempts a 3Pt. Contested by Collin Barnes (4.6 feet, ZONE). CARMELO MURRAY MAKES IT! Assist: Bam Gobert
Score: 5-2

[09:49] Team_016 possession (Score: 5-2)
Ben Barrett attempts a 3Pt. Wide open! Ayo Rose is 6.2 feet away. [ZONE] BEN BARRETT MAKES IT! Assist: Vince Quickley
Score: 5-5

[09:37] Team_040 possession (Score: 5-5)
Bam Gobert attempts a Midrange. Contested by Vince Duncan (4.0 feet, MAN). Bam Gobert misses. Rebound secured by Vince Quickley.

[09:22] Team_016 possession (Score: 5-5)
Vince Duncan drives, Bam Gobert stays with him. Vince Duncan attempts a Layup. Heavily contested by Bam Gobert (0.5 feet, ZONE)! VINCE DUNCAN MAKES IT!
Score: 5-7

[09:06] Team_040 possession (Score: 5-7)
Shaquille Bane throws a bad pass! Stolen by Giannis Ginobili! TURNOVER! (live ball)

[08:55] Team_016 possession (Score: 5-7)
Ben Barrett loses control! Ball rolls out of bounds! TURNOVER! (dead ball)

[08:38] Team_040 possession (Score: 5-7)
Bam Gobert attempts a Layup. Contested by Vince Duncan (3.5 feet, MAN). BAM GOBERT MAKES IT! Assist: Dirk Johnson
Score: 7-7

[08:21] Team_016 possession (Score: 7-7)
Collin Barnes attempts a Midrange. Wide open! Ayo Rose is 6.3 feet away. [MAN] Collin Barnes misses. FOUL! Loose ball foul on Bam Gobert during the rebound battle. [Team fouls: 2] No free throws, side out. (Bam Gobert: 1 personal fouls)

[08:05] Team_016 possession (Score: 7-7)
FOUL! Holding foul on Dirk Johnson. [Team fouls: 3] No free throws, side out. (Dirk Johnson: 1 personal fouls)

[07:51] Team_016 possession (Score: 7-7)
Vince Quickley drives and kicks out. Vince Duncan attempts a Midrange. Wide open! Bam Gobert is 9.9 feet away. [MAN] Vince Duncan misses. Rebound secured by Shaquille Bane.

[07:33] Team_040 possession (Score: 7-7)
Bam Gobert attempts a Midrange. Contested by Vince Duncan (4.6 feet, MAN). Bam Gobert misses. FOUL! Loose ball foul on Vince Duncan during the rebound battle. [Team fouls: 1] No free throws, side out. (Vince Duncan: 1 personal fouls)

[07:16] Team_040 possession (Score: 7-7)
Shaquille Bane throws a bad pass! Stolen by Giannis Ginobili! TURNOVER! (live ball)

[07:00] Team_016 possession (Score: 7-7)
Vince Duncan attempts a 3Pt. Contested by Ayo Rose (2.8 feet, ZONE). Vince Duncan misses. Rebound secured by Shaquille Bane.

[06:47] Team_040 possession (Score: 7-7)
Ayo Rose attempts a Layup. Contested by Ben Barrett (5.8 feet, ZONE). AYO ROSE MAKES IT! Assist: Dirk Johnson
Score: 9-7

[06:32] Team_016 possession (Score: 9-7)
Vince Duncan drives and kicks out. Giannis Ginobili attempts a 3Pt. Wide open! Shaquille Bane is 8.2 feet away. [MAN] GIANNIS GINOBILI MAKES IT! Assist: Vince Quickley
Score: 9-10

[06:17] Team_040 possession (Score: 9-10)
Dirk Johnson attempts a Layup. Heavily contested by Ben Barrett (1.4 feet, MAN)! Dirk Johnson misses. Rebound secured by Vince Duncan.

[06:04] Team_016 possession (Score: 9-10)
Giannis Ginobili throws a bad pass! Stolen by Shaquille Bane! TURNOVER! (live ball)

[05:45] Team_040 possession (Score: 9-10)
FOUL! Holding foul on Collin Barnes. [Team fouls: 2] No free throws, side out. (Collin Barnes: 1 personal fouls)

[05:26] Team_040 possession (Score: 9-10)
Carmelo Murray drives and kicks out. Carmelo Murray attempts a Midrange. Contested by Ben Barrett (3.6 feet, ZONE). CARMELO MURRAY MAKES IT! Assist: Dirk Johnson
Score: 11-10

[05:07] Team_016 possession (Score: 11-10)
Giannis Ginobili drives and kicks out. Collin Barnes attempts a Midrange. Contested by Ayo Rose (4.7 feet, MAN). Collin Barnes misses. Rebound secured by Dirk Johnson.

[04:58] Team_040 possession (Score: 11-10)
Carmelo Murray attempts a 3Pt. Wide open! Vince Quickley is 8.4 feet away. [MAN] Carmelo Murray misses. Rebound secured by Vince Duncan.

[04:44] Team_016 possession (Score: 11-10)
Ben Barrett attempts a 3Pt. Contested by Ayo Rose (5.5 feet, ZONE). Ben Barrett misses. FOUL! Loose ball foul on Shaquille Bane during the rebound battle. [Team fouls: 4] No free throws, side out. (Shaquille Bane: 1 personal fouls)

[04:27] Team_016 possession (Score: 11-10)
Giannis Ginobili loses control! Ball rolls out of bounds! TURNOVER! (dead ball)

[04:18] Team_040 possession (Score: 11-10)
Shaquille Bane attempts a 3Pt. Wide open! Giannis Ginobili is 6.8 feet away. [MAN] Shaquille Bane misses. Rebound secured by Vince Duncan.

[04:03] Team_016 possession (Score: 11-10)
FOUL! Shooting foul on Carmelo Murray. Vince Quickley to the line for 3 free throws. [BONUS: 5 team fouls] (Carmelo Murray: 1 personal fouls)   FT 1/3: GOOD   FT 2/3: GOOD   FT 3/3: GOOD Vince Quickley makes 3/3 from the line.
Score: 11-13

[03:48] Team_040 possession (Score: 11-13)
Bam Gobert attempts a 3Pt. Contested by Collin Barnes (5.2 feet, ZONE). Bam Gobert misses. Offensive rebound by Dirk Johnson! Dirk Johnson kicks it out.

[03:35] Team_040 possession (Score: 11-13)
Shaquille Bane attempts a Midrange. Contested by Vince Quickley (4.8 feet, ZONE). Shaquille Bane misses. Offensive rebound by Dirk Johnson! Dirk Johnson kicks it out.

[03:22] Team_040 possession (Score: 11-13)
Dirk Johnson attempts a Midrange. Contested by Ben Barrett (2.2 feet, MAN). DIRK JOHNSON MAKES IT! Assist: Bam Gobert
Score: 13-13

[03:10] Team_016 possession (Score: 13-13)
Giannis Ginobili attempts a 3Pt. Contested by Shaquille Bane (4.5 feet, MAN). Giannis Ginobili misses. Rebound secured by Dirk Johnson.

[02:52] Team_040 possession (Score: 13-13)
Carmelo Murray attempts a 3Pt. Contested by Vince Quickley (5.8 feet, MAN). Carmelo Murray misses. Rebound secured by Vince Duncan.

[02:41] Team_016 possession (Score: 13-13)
Giannis Ginobili attempts a 3Pt. Contested by Ayo Rose (5.8 feet, ZONE). GIANNIS GINOBILI MAKES IT! Assist: Collin Barnes
Score: 13-16

[02:28] Team_040 possession (Score: 13-16)
Shaquille Bane attempts a Layup. Contested by Vince Duncan (3.4 feet, ZONE). SHAQUILLE BANE MAKES IT! Assist: Bam Gobert
Score: 15-16

[02:18] Team_016 possession (Score: 15-16)
Vince Duncan throws a bad pass out of bounds! TURNOVER! (dead ball)

[02:18] Substitution (Team_040): Ayo Rose OUT → Cole O'Neal IN (stamina_rule2)

[02:18] Substitution (Team_040): Shaquille Bane OUT → Tracy Middleton IN (stamina_rule2)

[02:18] Substitution (Team_040): Carmelo Murray OUT → Klay Leonard IN (stamina_rule2)

[02:18] Substitution (Team_040): Dirk Johnson OUT → RJ Curry IN (stamina_rule2)

[02:18] Substitution (Team_040): Bam Gobert OUT → Josh Banchero IN (stamina_rule2)

[02:18] Substitution (Team_016): Collin Barnes OUT → Lamelo Herro IN (stamina_rule2)

[02:18] Substitution (Team_016): Ben Barrett OUT → Giannis Doncic IN (stamina_rule2)

[02:18] Substitution (Team_016): Vince Duncan OUT → Trae Barnes IN (stamina_rule2)

[02:02] Team_040 possession (Score: 15-16)
Cole O'Neal attempts a Layup. Contested by Lamelo Herro (4.0 feet, MAN). Cole O'Neal misses. Rebound secured by Trae Barnes.

[01:50] Team_016 possession (Score: 15-16)
Lamelo Herro attempts a 3Pt. Wide open! Cole O'Neal is 9.5 feet away. [MAN] LAMELO HERRO MAKES IT! Assist: Vince Quickley
Score: 15-19

[01:37] Team_040 possession (Score: 15-19)
RJ Curry attempts a Midrange. Contested by Giannis Ginobili (4.2 feet, ZONE). RJ Curry misses. Offensive rebound by Josh Banchero! Josh Banchero kicks it out.

[01:23] Team_040 possession (Score: 15-19)
Tracy Middleton attempts a Midrange. Wide open! Giannis Doncic is 8.9 feet away. [ZONE] TRACY MIDDLETON MAKES IT! Assist: RJ Curry
Score: 17-19

[01:08] Team_016 possession (Score: 17-19)
Giannis Ginobili attempts a 3Pt. Contested by RJ Curry (6.0 feet, ZONE). Giannis Ginobili misses. Rebound secured by Klay Leonard.

[00:51] Team_040 possession (Score: 17-19)
Klay Leonard attempts a 3Pt. Heavily contested by Lamelo Herro (0.9 feet, ZONE)! KLAY LEONARD MAKES IT! Assist: RJ Curry
Score: 20-19

[00:35] Team_016 possession (Score: 20-19)
Giannis Doncic drives, RJ Curry stays with him. Giannis Doncic attempts a Layup. Contested by RJ Curry (5.8 feet, MAN). GIANNIS DONCIC MAKES IT! Assist: Lamelo Herro
Score: 20-21

[00:17] Team_040 possession (Score: 20-21)
RJ Curry drives to the basket... RJ Curry throws a bad pass out of bounds! TURNOVER! (dead ball)

[00:17] Substitution (Team_016): Giannis Ginobili OUT → Immanuel Nowitzki IN (stamina_rule2)

[00:17] Substitution (Team_016): Vince Quickley OUT → Kevin Butler IN (stamina_rule2)

[00:04] Team_016 possession (Score: 20-21)
Trae Barnes attempts a Layup. Contested by Josh Banchero (4.3 feet, ZONE). TRAE BARNES MAKES IT!
Score: 20-23

================================================================================
                              1ST QUARTER COMPLETE                              
================================================================================

1ST QUARTER SCORE: Team_040 20, Team_016 23

BOX SCORE:
================================================================================

Team_040
--------------------------------------------------------------------------------
Player                MIN  PTS  REB  AST  TO      FG   FG%      3P   3P%
--------------------------------------------------------------------------------
Carmelo Murray         10    5    0    0   0   2/4    50.0     0/0   0.0
Bam Gobert             10    4    2    3   0   2/3    66.7     0/0   0.0
Klay Leonard            2    3    1    0   0   1/1   100.0     0/0   0.0
Dirk Johnson           10    2    5    3   0   1/2    50.0     0/0   0.0
Ayo Rose               10    2    0    0   0   1/2    50.0     0/0   0.0
Shaquille Bane         10    2    2    0   0   1/2    50.0     0/0   0.0
Tracy Middleton         2    2    0    0   0   1/1   100.0     0/0   0.0
Cole O'Neal             2    0    0    0   0   0/1     0.0     0/0   0.0
Josh Banchero           2    0    1    0   0   0/0     0.0     0/0   0.0
RJ Curry                2    0    0    2   0   0/0     0.0     0/0   0.0

TEAM: FG: 9/16 (56.2%), 3PT: 2/5 (40.0%), REB: 11 (5 off, 6 def), AST: 8, TO: 4
TEAM FOULS: 5 [Team_016 in BONUS]


Team_016
--------------------------------------------------------------------------------
Player                MIN  PTS  REB  AST  TO      FG   FG%      3P   3P%
--------------------------------------------------------------------------------
Giannis Ginobili       12    6    0    0   0   2/5    40.0     0/0   0.0
Vince Duncan           10    4    6    0   0   2/3    66.7     0/0   0.0
Ben Barrett            10    3    0    0   0   1/2    50.0     0/0   0.0
Vince Quickley         12    3    2    3   0   1/2    50.0     0/0   0.0
Lamelo Herro            2    3    0    1   0   1/1   100.0     0/0   0.0
Trae Barnes             2    2    1    0   0   1/1   100.0     0/0   0.0
Giannis Doncic          2    2    0    0   0   1/1   100.0     0/0   0.0
Collin Barnes          10    0    0    1   0   0/0     0.0     0/0   0.0

TEAM: FG: 9/15 (60.0%), 3PT: 4/8 (50.0%), REB: 9 (2 off, 7 def), AST: 5, TO: 5
TEAM FOULS: 2

================================================================================

================================================================================
                       2ND QUARTER - Team_040 vs Team_016                       
================================================================================

[12:00] Team_040 possession (Score: 20-23)
Bam Gobert drives to the basket... Bam Gobert loses the ball! Stripped by Vince Duncan! TURNOVER! (live ball)

[11:42] Team_016 possession (Score: 20-23)
Giannis Ginobili attempts a Midrange. Contested by Shaquille Bane (4.5 feet, MAN). Giannis Ginobili misses. FOUL! Loose ball foul on Bam Gobert during the rebound battle. [Team fouls: 1] No free throws, side out. (Bam Gobert: 1 personal fouls)

[11:27] Team_016 possession (Score: 20-23)
Ben Barrett attempts a 3Pt. Contested by Ayo Rose (4.8 feet, ZONE). Ben Barrett misses. Rebound secured by Bam Gobert.

[11:12] Team_040 possession (Score: 20-23)
Shaquille Bane attempts a 3Pt. Contested by Collin Barnes (3.9 feet, ZONE). Shaquille Bane misses. Rebound secured by Vince Duncan.

[11:00] Team_016 possession (Score: 20-23)
Collin Barnes drives and kicks out. Giannis Ginobili attempts a Midrange. Contested by Shaquille Bane (3.6 feet, MAN). GIANNIS GINOBILI MAKES IT!
Score: 20-25

[10:44] Team_040 possession (Score: 20-25)
Carmelo Murray attempts a 3Pt. Wide open! Collin Barnes is 8.8 feet away. [ZONE] CARMELO MURRAY MAKES IT! Assist: Ayo Rose
Score: 23-25

[10:31] Team_016 possession (Score: 23-25)
Vince Duncan attempts a Midrange. Contested by Bam Gobert (5.7 feet, MAN). VINCE DUNCAN MAKES IT! Assist: Collin Barnes
Score: 23-27

[10:12] Team_040 possession (Score: 23-27)
Ayo Rose drives, picks up Collin Barnes. Help arrives from Vince Quickley! Ayo Rose attempts a Layup. Contested by Vince Quickley (3.0 feet, MAN). AYO ROSE MAKES IT! Assist: Carmelo Murray
Score: 25-27

[09:55] Team_016 possession (Score: 25-27)
Giannis Ginobili attempts a 3Pt. Contested by Dirk Johnson (5.4 feet, ZONE). Giannis Ginobili misses. Rebound secured by Shaquille Bane.

[09:36] Team_040 possession (Score: 25-27)
Dirk Johnson throws a bad pass out of bounds! TURNOVER! (dead ball)

[09:36] Substitution (Team_040): Ayo Rose OUT → Cole O'Neal IN (stamina_rule2)

[09:36] Substitution (Team_016): Giannis Ginobili OUT → Immanuel Nowitzki IN (stamina_rule2)

[09:36] Substitution (Team_016): Vince Quickley OUT → Kevin Butler IN (stamina_rule2)

[09:21] Team_016 possession (Score: 25-27)
Kevin Butler drives to the basket... FOUL! Offensive foul on Kevin Butler! Bam Gobert drew the charge! [Team fouls: 1] (Kevin Butler: 1 personal fouls) TURNOVER! (dead ball)

[09:07] Team_040 possession (Score: 25-27)
Bam Gobert attempts a 3Pt. Contested by Vince Duncan (3.9 feet, MAN). BAM GOBERT MAKES IT! Assist: Shaquille Bane
Score: 28-27

[08:54] Team_016 possession (Score: 28-27)
Immanuel Nowitzki attempts a Layup. BLOCKED BY BAM GOBERT! Ball is loose! Rebound secured by Shaquille Bane.

[08:39] Team_040 possession (Score: 28-27)
Shaquille Bane attempts a 3Pt. Contested by Immanuel Nowitzki (5.7 feet, MAN). Shaquille Bane misses. Rebound secured by Ben Barrett.

[08:21] Team_016 possession (Score: 28-27)
Collin Barnes throws a bad pass! Stolen by Cole O'Neal! TURNOVER! (live ball)

[08:08] Team_040 possession (Score: 28-27)
Bam Gobert attempts a Layup. Wide open! Vince Duncan is 6.0 feet away. [MAN] Bam Gobert misses. Rebound secured by Ben Barrett.

[07:52] Team_016 possession (Score: 28-27)
Immanuel Nowitzki loses the ball! Stripped by Shaquille Bane! TURNOVER! (live ball)

[07:39] Team_040 possession (Score: 28-27)
Bam Gobert attempts a Midrange. Contested by Vince Duncan (2.4 feet, MAN). BAM GOBERT MAKES IT! Assist: Dirk Johnson
Score: 30-27

[07:24] Team_016 possession (Score: 30-27)
Immanuel Nowitzki attempts a 3Pt. Wide open! Shaquille Bane is 6.6 feet away. [MAN] Immanuel Nowitzki misses. FOUL! Loose ball foul on Bam Gobert during the rebound battle. [Team fouls: 2] No free throws, side out. (Bam Gobert: 2 personal fouls)

[07:13] Team_016 possession (Score: 30-27)
Collin Barnes attempts a 3Pt. Wide open! Dirk Johnson is 7.2 feet away. [ZONE] Collin Barnes misses. Rebound secured by Dirk Johnson.

[06:59] Team_040 possession (Score: 30-27)
Bam Gobert attempts a Midrange. Contested by Vince Duncan (3.0 feet, MAN). BAM GOBERT MAKES IT!
Score: 32-27

[06:45] Team_016 possession (Score: 32-27)
Kevin Butler attempts a 3Pt. Wide open! Carmelo Murray is 8.3 feet away. [MAN] KEVIN BUTLER MAKES IT! Assist: Immanuel Nowitzki
Score: 32-30

[06:34] Team_040 possession (Score: 32-30)
Shaquille Bane attempts a Layup. Contested by Immanuel Nowitzki (3.0 feet, MAN). SHAQUILLE BANE MAKES IT! Assist: Bam Gobert
Score: 34-30

[06:19] Team_016 possession (Score: 34-30)
Collin Barnes attempts a Layup. Wide open! Cole O'Neal is 6.1 feet away. [MAN] COLLIN BARNES MAKES IT!
Score: 34-32

[06:05] Team_040 possession (Score: 34-32)
FOUL! Holding foul on Vince Duncan. [Team fouls: 2] No free throws, side out. (Vince Duncan: 1 personal fouls)

[05:50] Team_040 possession (Score: 34-32)
Shaquille Bane attempts a 3Pt. Wide open! Immanuel Nowitzki is 6.3 feet away. [MAN] Shaquille Bane misses. Rebound secured by Immanuel Nowitzki.

[05:37] Team_016 possession (Score: 34-32)
Immanuel Nowitzki drives to the basket... Immanuel Nowitzki loses control! Ball rolls out of bounds! TURNOVER! (dead ball)

[05:37] Substitution (Team_040): Shaquille Bane OUT → Tracy Middleton IN (stamina_rule2)

[05:37] Substitution (Team_040): Carmelo Murray OUT → Klay Leonard IN (stamina_rule2)

[05:37] Substitution (Team_040): Dirk Johnson OUT → RJ Curry IN (stamina_rule2)

[05:37] Substitution (Team_040): Bam Gobert OUT → Josh Banchero IN (stamina_rule2)

[05:37] Substitution (Team_016): Collin Barnes OUT → Lamelo Herro IN (stamina_rule2)

[05:37] Substitution (Team_016): Ben Barrett OUT → Giannis Doncic IN (stamina_rule2)

[05:37] Substitution (Team_016): Vince Duncan OUT → Trae Barnes IN (stamina_rule2)

[05:25] Team_040 possession (Score: 34-32)
Tracy Middleton attempts a 3Pt. Contested by Lamelo Herro (2.1 feet, ZONE). TRACY MIDDLETON MAKES IT!
Score: 37-32

[05:13] Team_016 possession (Score: 37-32)
Kevin Butler attempts a Midrange. Contested by Klay Leonard (4.5 feet, ZONE). Kevin Butler misses. Rebound secured by Josh Banchero.

[04:56] Team_040 possession (Score: 37-32)
Klay Leonard drives, Giannis Doncic stays with him. Klay Leonard attempts a Layup. Contested by Giannis Doncic (5.8 feet, ZONE). Klay Leonard misses. Rebound secured by Trae Barnes.

[04:43] Team_016 possession (Score: 37-32)
Immanuel Nowitzki throws a bad pass! Stolen by Tracy Middleton! TURNOVER! (live ball)

[04:30] Team_040 possession (Score: 37-32)
Klay Leonard attempts a 3Pt. Heavily contested by Lamelo Herro (1.9 feet, ZONE)! KLAY LEONARD MAKES IT! Assist: RJ Curry
Score: 40-32

[04:19] Team_016 possession (Score: 40-32)
Kevin Butler drives and kicks out. Trae Barnes attempts a 3Pt. Wide open! Josh Banchero is 6.7 feet away. [MAN] TRAE BARNES MAKES IT! Assist: Immanuel Nowitzki
Score: 40-35

[04:09] Team_040 possession (Score: 40-35)
FOUL! Holding foul on Trae Barnes. [Team fouls: 3] No free throws, side out. (Trae Barnes: 1 personal fouls)

[03:54] Team_040 possession (Score: 40-35)
RJ Curry makes the Layup and draws the foul on Giannis Doncic! And-1! RJ Curry to the line for 1. [Team fouls: 4] (Giannis Doncic: 1 personal fouls)   FT 1/1: GOOD RJ Curry makes 1/1 from the line.
Score: 43-35

[03:38] Team_016 possession (Score: 43-35)
Giannis Doncic drives and kicks out. Immanuel Nowitzki attempts a 3Pt. Contested by Tracy Middleton (4.7 feet, MAN). Immanuel Nowitzki misses. Rebound secured by Klay Leonard.

[03:23] Team_040 possession (Score: 43-35)
Cole O'Neal attempts a Midrange. Wide open! Lamelo Herro is 6.6 feet away. [MAN] COLE O'NEAL MAKES IT! Assist: Josh Banchero
Score: 45-35

[03:06] Team_016 possession (Score: 45-35)
Trae Barnes drives, Josh Banchero stays with him. Trae Barnes attempts a Dunk. Wide open! Josh Banchero is 7.0 feet away. [MAN] Trae Barnes misses. Rebound secured by RJ Curry.

[02:55] Team_040 possession (Score: 45-35)
Josh Banchero attempts a 3Pt. Contested by Immanuel Nowitzki (5.1 feet, ZONE). Josh Banchero misses. Rebound secured by Giannis Doncic.

[02:40] Team_016 possession (Score: 45-35)
Immanuel Nowitzki attempts a Layup. Wide open! Tracy Middleton is 8.4 feet away. [MAN] Immanuel Nowitzki misses. Rebound secured by Klay Leonard.

[02:25] Team_040 possession (Score: 45-35)
Klay Leonard attempts a 3Pt. Wide open! Kevin Butler is 8.4 feet away. [MAN] KLAY LEONARD MAKES IT! Assist: Cole O'Neal
Score: 48-35

[02:11] Team_016 possession (Score: 48-35)
Trae Barnes attempts a Midrange. Contested by Josh Banchero (3.9 feet, MAN). Trae Barnes misses. Rebound secured by Josh Banchero.

[01:58] Team_040 possession (Score: 48-35)
Cole O'Neal attempts a Layup. BLOCKED BY GIANNIS DONCIC! Ball is loose! Rebound secured by Giannis Doncic.

[01:42] Team_016 possession (Score: 48-35)
Trae Barnes drives and kicks out. Kevin Butler attempts a Midrange. Contested by Klay Leonard (2.8 feet, MAN). KEVIN BUTLER MAKES IT!
Score: 48-37

[01:25] Team_040 possession (Score: 48-37)
Tracy Middleton attempts a Midrange. Wide open! Immanuel Nowitzki is 6.5 feet away. [MAN] TRACY MIDDLETON MAKES IT!
Score: 50-37

[01:14] Team_016 possession (Score: 50-37)
Lamelo Herro drives and kicks out. Lamelo Herro attempts a Midrange. Contested by RJ Curry (2.6 feet, ZONE). Lamelo Herro misses. Rebound secured by RJ Curry.

[00:57] Team_040 possession (Score: 50-37)
Tracy Middleton attempts a 3Pt. Contested by Immanuel Nowitzki (4.5 feet, MAN). Tracy Middleton misses. Offensive rebound by RJ Curry! RJ Curry kicks it out.

[00:45] Team_040 possession (Score: 50-37)
Klay Leonard attempts a 3Pt. Wide open! Kevin Butler is 6.7 feet away. [MAN] KLAY LEONARD MAKES IT! Assist: RJ Curry
Score: 53-37

[00:28] Team_016 possession (Score: 53-37)
FOUL! Shooting foul on RJ Curry. Giannis Doncic to the line for 2 free throws. [Team fouls: 3] (RJ Curry: 1 personal fouls)   FT 1/2: GOOD   FT 2/2: GOOD Giannis Doncic makes 2/2 from the line.
Score: 53-39

[00:11] Team_040 possession (Score: 53-39)
Klay Leonard drives and kicks out. Klay Leonard attempts a 3Pt. Contested by Kevin Butler (2.0 feet, MAN). Klay Leonard misses. Rebound secured by Giannis Doncic.

================================================================================
                              2ND QUARTER COMPLETE                              
================================================================================

2ND QUARTER SCORE: Team_040 33, Team_016 16

BOX SCORE:
================================================================================

Team_040
--------------------------------------------------------------------------------
Player                MIN  PTS  REB  AST  TO      FG   FG%      3P   3P%
--------------------------------------------------------------------------------
Klay Leonard            8    9    2    0   0   3/5    60.0     0/0   0.0
Bam Gobert             17    7    1    1   0   3/4    75.0     0/0   0.0
Tracy Middleton         8    5    0    0   0   2/2   100.0     0/0   0.0
Carmelo Murray         17    3    0    1   0   1/1   100.0     0/0   0.0
RJ Curry                8    3    3    2   0   1/1   100.0     0/0   0.0
Shaquille Bane         17    2    2    1   0   1/4    25.0     0/0   0.0
Ayo Rose               13    2    0    1   0   1/1   100.0     0/0   0.0
Cole O'Neal            12    2    0    1   0   1/2    50.0     0/0   0.0
Dirk Johnson           17    0    1    1   0   0/0     0.0     0/0   0.0
Josh Banchero           8    0    2    1   0   0/1     0.0     0/0   0.0

TEAM: FG: 13/21 (61.9%), 3PT: 6/10 (60.0%), REB: 11 (1 off, 10 def), AST: 9, TO: 2
TEAM FOULS: 3


Team_016
--------------------------------------------------------------------------------
Player                MIN  PTS  REB  AST  TO      FG   FG%      3P   3P%
--------------------------------------------------------------------------------
Kevin Butler           10    5    0    0   0   2/3    66.7     0/0   0.0
Trae Barnes             8    3    1    0   0   1/3    33.3     0/0   0.0
Vince Duncan           17    2    3    0   0   1/1   100.0     0/0   0.0
Giannis Ginobili       15    2    0    0   0   1/2    50.0     0/0   0.0
Collin Barnes          17    2    0    1   0   1/2    50.0     0/0   0.0
Giannis Doncic          8    2    3    0   0   1/2    50.0     0/0   0.0
Ben Barrett            17    0    2    0   0   0/1     0.0     0/0   0.0
Immanuel Nowitzki      10    0    1    2   0   0/2     0.0     0/0   0.0
Lamelo Herro            8    0    0    0   0   0/1     0.0     0/0   0.0

TEAM: FG: 7/17 (41.2%), 3PT: 1/4 (25.0%), REB: 10 (2 off, 8 def), AST: 3, TO: 5
TEAM FOULS: 4

================================================================================

================================================================================
                       3RD QUARTER - Team_040 vs Team_016                       
================================================================================

[12:00] Team_040 possession (Score: 53-39)
Bam Gobert drives, Vince Duncan stays with him. Bam Gobert attempts a Dunk. Heavily contested by Vince Duncan (1.3 feet, MAN)! BAM GOBERT MAKES IT! Assist: Dirk Johnson
Score: 55-39

[11:47] Team_016 possession (Score: 55-39)
Vince Duncan attempts a Midrange. Wide open! Dirk Johnson is 9.1 feet away. [ZONE] VINCE DUNCAN MAKES IT!
Score: 55-41

[11:31] Team_040 possession (Score: 55-41)
Carmelo Murray drives to the basket... Carmelo Murray commits a violation (traveling/carry)! TURNOVER! (dead ball)

[11:14] Team_016 possession (Score: 55-41)
Vince Duncan drives to the basket... Vince Duncan throws a bad pass out of bounds! TURNOVER! (dead ball)

[11:02] Team_040 possession (Score: 55-41)
Dirk Johnson attempts a 3Pt. Contested by Ben Barrett (4.0 feet, MAN). Dirk Johnson misses. Rebound secured by Ben Barrett.

[10:47] Team_016 possession (Score: 55-41)
Vince Duncan attempts a Layup. Contested by Bam Gobert (5.7 feet, MAN). Vince Duncan misses. Offensive rebound by Ben Barrett! Ben Barrett's putback is no good. Offensive rebound by Vince Duncan! Vince Duncan kicks it out.

[10:31] Team_016 possession (Score: 55-41)
Collin Barnes makes the Layup and draws the foul on Ayo Rose! And-1! Collin Barnes to the line for 1. [Team fouls: 1] (Ayo Rose: 1 personal fouls)   FT 1/1: GOOD Collin Barnes makes 1/1 from the line.
Score: 55-44

[10:16] Team_040 possession (Score: 55-44)
Dirk Johnson attempts a Layup. Heavily contested by Ben Barrett (1.5 feet, MAN)! DIRK JOHNSON MAKES IT!
Score: 57-44

[10:02] Team_016 possession (Score: 57-44)
Collin Barnes attempts a Layup. BLOCKED BY SHAQUILLE BANE! Ball is loose! Rebound secured by Bam Gobert.

[09:48] Team_040 possession (Score: 57-44)
Bam Gobert commits a violation (traveling/carry)! TURNOVER! (dead ball)

[09:33] Team_016 possession (Score: 57-44)
Collin Barnes attempts a 3Pt. Contested by Ayo Rose (6.0 feet, MAN). Collin Barnes misses. Rebound secured by Dirk Johnson.

[09:22] Team_040 possession (Score: 57-44)
Ayo Rose commits a violation (traveling/carry)! TURNOVER! (dead ball)

[09:08] Team_016 possession (Score: 57-44)
FOUL! Reach-in foul on Carmelo Murray during the drive. [Team fouls: 2] No free throws, side out. (Carmelo Murray: 1 personal fouls)

[08:51] Team_016 possession (Score: 57-44)
Vince Quickley loses the ball! Stripped by Carmelo Murray! TURNOVER! (live ball)

[08:35] Team_040 possession (Score: 57-44)
Bam Gobert attempts a Midrange. Wide open! Giannis Ginobili is 6.3 feet away. [ZONE] BAM GOBERT MAKES IT!
Score: 59-44

[08:20] Team_016 possession (Score: 59-44)
Vince Quickley attempts a Midrange. Contested by Carmelo Murray (4.9 feet, MAN). Vince Quickley misses. Rebound secured by Shaquille Bane.

[08:03] Team_040 possession (Score: 59-44)
Dirk Johnson attempts a Midrange. Wide open! Giannis Ginobili is 8.2 feet away. [ZONE] DIRK JOHNSON MAKES IT!
Score: 61-44

[07:49] Team_016 possession (Score: 61-44)
Giannis Ginobili makes the Dunk and draws the foul on Shaquille Bane! And-1! Giannis Ginobili to the line for 1. [Team fouls: 3] (Shaquille Bane: 1 personal fouls)   FT 1/1: GOOD Giannis Ginobili makes 1/1 from the line.
Score: 61-47

[07:31] Team_040 possession (Score: 61-47)
Dirk Johnson drives to the basket... Dirk Johnson throws a bad pass! Stolen by Ben Barrett! TURNOVER! (live ball)

[07:19] Team_016 possession (Score: 61-47)
Collin Barnes attempts a 3Pt. Contested by Shaquille Bane (4.0 feet, ZONE). Collin Barnes misses. Rebound secured by Dirk Johnson.

[07:01] Team_040 possession (Score: 61-47)
Shaquille Bane attempts a 3Pt. Wide open! Collin Barnes is 7.5 feet away. [ZONE] Shaquille Bane misses. Rebound secured by Vince Quickley.

[06:45] Team_016 possession (Score: 61-47)
Vince Quickley attempts a Midrange. Contested by Shaquille Bane (3.1 feet, ZONE). VINCE QUICKLEY MAKES IT! Assist: Collin Barnes
Score: 61-49

[06:31] Team_040 possession (Score: 61-49)
FOUL! Shooting foul on Collin Barnes. Ayo Rose to the line for 3 free throws. [Team fouls: 1] (Collin Barnes: 1 personal fouls)   FT 1/3: GOOD   FT 2/3: GOOD   FT 3/3: GOOD Ayo Rose makes 3/3 from the line.
Score: 64-49

[06:21] Team_016 possession (Score: 64-49)
Vince Quickley attempts a Midrange. Wide open! Dirk Johnson is 9.6 feet away. [ZONE] Vince Quickley misses. Offensive rebound by Ben Barrett! Ben Barrett puts it back in!
Score: 64-51

[06:05] Team_040 possession (Score: 64-51)
Dirk Johnson attempts a 3Pt. Contested by Collin Barnes (3.3 feet, ZONE). DIRK JOHNSON MAKES IT! Assist: Ayo Rose
Score: 67-51

[05:51] Team_016 possession (Score: 67-51)
Vince Quickley drives to the basket... Vince Quickley loses the ball! Stripped by Carmelo Murray! TURNOVER! (live ball)

[05:36] Team_040 possession (Score: 67-51)
Carmelo Murray attempts a Midrange. Contested by Vince Quickley (3.8 feet, MAN). Carmelo Murray misses. Offensive rebound by Bam Gobert! Bam Gobert kicks it out.

[05:17] Team_040 possession (Score: 67-51)
FOUL! Shooting foul on Giannis Ginobili. Ayo Rose to the line for 2 free throws. [Team fouls: 2] (Giannis Ginobili: 1 personal fouls)   FT 1/2: GOOD   FT 2/2: GOOD Ayo Rose makes 2/2 from the line.
Score: 69-51

[05:01] Team_016 possession (Score: 69-51)
Ben Barrett attempts a 3Pt. Contested by Ayo Rose (3.3 feet, ZONE). BEN BARRETT MAKES IT! Assist: Vince Duncan
Score: 69-54

[04:43] Team_040 possession (Score: 69-54)
Shaquille Bane attempts a Layup. Contested by Giannis Ginobili (2.7 feet, MAN). Shaquille Bane misses. Rebound secured by Vince Quickley.

[04:28] Team_016 possession (Score: 69-54)
Ben Barrett attempts a 3Pt. Wide open! Dirk Johnson is 7.8 feet away. [MAN] Ben Barrett misses. Rebound secured by Dirk Johnson.

[04:11] Team_040 possession (Score: 69-54)
Carmelo Murray attempts a Midrange. Wide open! Vince Quickley is 8.4 feet away. [ZONE] Carmelo Murray misses. Rebound secured by Ben Barrett.

[03:51] Team_016 possession (Score: 69-54)
Vince Duncan attempts a Layup. Contested by Bam Gobert (4.4 feet, MAN). VINCE DUNCAN MAKES IT! Assist: Collin Barnes
Score: 69-56

[03:40] Team_040 possession (Score: 69-56)
Carmelo Murray loses the ball! Stripped by Vince Quickley! TURNOVER! (live ball)

[03:25] Team_016 possession (Score: 69-56)
Vince Duncan attempts a Layup. Heavily contested by Bam Gobert (0.6 feet, ZONE)! VINCE DUNCAN MAKES IT! Assist: Vince Quickley
Score: 69-58

[03:11] Team_040 possession (Score: 69-58)
Carmelo Murray attempts a Midrange. Wide open! Vince Quickley is 6.0 feet away. [ZONE] Carmelo Murray misses. Rebound secured by Vince Quickley.

[02:57] Team_016 possession (Score: 69-58)
Collin Barnes attempts a 3Pt. Wide open! Ayo Rose is 7.7 feet away. [MAN] Collin Barnes misses. Rebound secured by Shaquille Bane.

[02:48] Team_040 possession (Score: 69-58)
Dirk Johnson attempts a Layup. Heavily contested by Ben Barrett (2.0 feet, MAN)! DIRK JOHNSON MAKES IT! Assist: Bam Gobert
Score: 71-58

[02:34] Team_016 possession (Score: 71-58)
Ben Barrett attempts a Layup. Contested by Bam Gobert (3.2 feet, ZONE). BEN BARRETT MAKES IT! Assist: Vince Duncan
Score: 71-60

[02:15] Team_040 possession (Score: 71-60)
Shaquille Bane commits a violation (traveling/carry)! TURNOVER! (dead ball)

[02:15] Substitution (Team_040): Ayo Rose OUT → Cole O'Neal IN (stamina_rule2)

[02:15] Substitution (Team_040): Shaquille Bane OUT → Tracy Middleton IN (stamina_rule2)

[02:15] Substitution (Team_040): Carmelo Murray OUT → Klay Leonard IN (stamina_rule2)

[02:15] Substitution (Team_040): Dirk Johnson OUT → RJ Curry IN (stamina_rule2)

[02:15] Substitution (Team_040): Bam Gobert OUT → Josh Banchero IN (stamina_rule2)

[02:15] Substitution (Team_016): Collin Barnes OUT → Lamelo Herro IN (stamina_rule2)

[02:15] Substitution (Team_016): Ben Barrett OUT → Giannis Doncic IN (stamina_rule2)

[02:15] Substitution (Team_016): Vince Duncan OUT → Trae Barnes IN (stamina_rule2)

[02:00] Team_016 possession (Score: 71-60)
Trae Barnes drives, picks up Josh Banchero. Help arrives from Tracy Middleton! Trae Barnes attempts a Dunk. Heavily contested by Tracy Middleton (2.0 feet, ZONE)! Trae Barnes misses. Rebound secured by Josh Banchero.

[01:47] Team_040 possession (Score: 71-60)
Tracy Middleton attempts a Midrange. Contested by Giannis Doncic (5.2 feet, ZONE). TRACY MIDDLETON MAKES IT!
Score: 73-60

[01:33] Team_016 possession (Score: 73-60)
Giannis Ginobili attempts a 3Pt. Contested by Tracy Middleton (4.8 feet, MAN). GIANNIS GINOBILI MAKES IT! Assist: Trae Barnes
Score: 73-63

[01:17] Team_040 possession (Score: 73-63)
Cole O'Neal commits a violation (traveling/carry)! TURNOVER! (dead ball)

[01:17] Substitution (Team_016): Giannis Ginobili OUT → Immanuel Nowitzki IN (stamina_rule2)

[01:17] Substitution (Team_016): Vince Quickley OUT → Kevin Butler IN (stamina_rule2)

[01:01] Team_016 possession (Score: 73-63)
Kevin Butler attempts a Midrange. Wide open! Klay Leonard is 7.4 feet away. [MAN] KEVIN BUTLER MAKES IT!
Score: 73-65

[00:44] Team_040 possession (Score: 73-65)
Cole O'Neal attempts a Layup. Heavily contested by Giannis Doncic (0.5 feet, ZONE)! Cole O'Neal misses. FOUL! Loose ball foul on Trae Barnes during the rebound battle. [Team fouls: 3] No free throws, side out. (Trae Barnes: 1 personal fouls)

[00:28] Team_040 possession (Score: 73-65)
Cole O'Neal drives, Giannis Doncic stays with him. Cole O'Neal attempts a Dunk. Contested by Giannis Doncic (2.4 feet, ZONE). Cole O'Neal misses. Rebound secured by Giannis Doncic.

[00:14] Team_016 possession (Score: 73-65)
Lamelo Herro drives, Josh Banchero stays with him. Lamelo Herro attempts a Layup. Wide open! Josh Banchero is 7.4 feet away. [ZONE] LAMELO HERRO MAKES IT! Assist: Immanuel Nowitzki
Score: 73-67

[00:01] Team_040 possession (Score: 73-67)
Cole O'Neal attempts a 3Pt. Contested by Lamelo Herro (5.3 feet, MAN). Cole O'Neal misses. Rebound secured by Giannis Doncic.

================================================================================
                              3RD QUARTER COMPLETE                              
================================================================================

3RD QUARTER SCORE: Team_040 20, Team_016 28

BOX SCORE:
================================================================================

Team_040
--------------------------------------------------------------------------------
Player                MIN  PTS  REB  AST  TO      FG   FG%      3P   3P%
--------------------------------------------------------------------------------
Dirk Johnson           27    9    3    1   0   4/5    80.0     0/0   0.0
Ayo Rose               23    5    0    1   0   2/2   100.0     0/0   0.0
Bam Gobert             27    4    2    1   0   2/2   100.0     0/0   0.0
Tracy Middleton        10    2    0    0   0   1/1   100.0     0/0   0.0
Shaquille Bane         27    0    2    0   0   0/2     0.0     0/0   0.0
Carmelo Murray         27    0    0    0   0   0/2     0.0     0/0   0.0
Josh Banchero          10    0    1    0   0   0/0     0.0     0/0   0.0
RJ Curry               10    0    1    0   0   0/0     0.0     0/0   0.0
Cole O'Neal            14    0    0    0   0   0/2     0.0     0/0   0.0

TEAM: FG: 9/16 (56.2%), 3PT: 2/5 (40.0%), REB: 9 (2 off, 7 def), AST: 3, TO: 7
TEAM FOULS: 3


Team_016
--------------------------------------------------------------------------------
Player                MIN  PTS  REB  AST  TO      FG   FG%      3P   3P%
--------------------------------------------------------------------------------
Ben Barrett            27    7    3    0   0   3/4    75.0     0/0   0.0
Vince Duncan           27    6    1    2   0   3/3   100.0     0/0   0.0
Giannis Ginobili       26    6    0    0   0   2/2   100.0     0/0   0.0
Collin Barnes          27    3    0    2   0   1/5    20.0     0/0   0.0
Vince Quickley         26    2    3    1   0   1/2    50.0     0/0   0.0
Kevin Butler           11    2    0    0   0   1/1   100.0     0/0   0.0
Lamelo Herro           10    2    0    0   0   1/1   100.0     0/0   0.0
Trae Barnes            10    0    0    1   0   0/1     0.0     0/0   0.0
Giannis Doncic         10    0    2    0   0   0/0     0.0     0/0   0.0
Immanuel Nowitzki      11    0    0    1   0   0/0     0.0     0/0   0.0

TEAM: FG: 12/19 (63.2%), 3PT: 2/6 (33.3%), REB: 9 (2 off, 7 def), AST: 7, TO: 3
TEAM FOULS: 3

================================================================================

================================================================================
                       4TH QUARTER - Team_040 vs Team_016                       
================================================================================

[12:00] Team_040 possession (Score: 73-67)
Carmelo Murray attempts a Midrange. Contested by Vince Quickley (3.6 feet, MAN). Carmelo Murray misses. Rebound secured by Ben Barrett.

[11:41] Team_016 possession (Score: 73-67)
Collin Barnes attempts a Midrange. Contested by Dirk Johnson (3.0 feet, ZONE). Collin Barnes misses. Rebound secured by Shaquille Bane.

[11:24] Team_040 possession (Score: 73-67)
Ayo Rose attempts a 3Pt. Wide open! Collin Barnes is 6.9 feet away. [ZONE] Ayo Rose misses. Rebound secured by Vince Quickley.

[11:09] Team_016 possession (Score: 73-67)
Ben Barrett attempts a 3Pt. Contested by Ayo Rose (4.3 feet, ZONE). Ben Barrett misses. Rebound secured by Bam Gobert.

[10:50] Team_040 possession (Score: 73-67)
Shaquille Bane attempts a 3Pt. Contested by Ben Barrett (2.7 feet, ZONE). Shaquille Bane misses. Rebound secured by Vince Quickley.

[10:40] Team_016 possession (Score: 73-67)
Giannis Ginobili drives, picks up Bam Gobert. Help arrives from Shaquille Bane! Giannis Ginobili attempts a Dunk. Contested by Shaquille Bane (2.0 feet, ZONE). GIANNIS GINOBILI MAKES IT! Assist: Ben Barrett
Score: 73-69

[10:25] Team_040 possession (Score: 73-69)
Bam Gobert drives to the basket... Bam Gobert throws a bad pass out of bounds! TURNOVER! (dead ball)

[10:10] Team_016 possession (Score: 73-69)
Vince Quickley drives to the basket... Vince Quickley throws a bad pass out of bounds! TURNOVER! (dead ball)

[09:59] Team_040 possession (Score: 73-69)
Ayo Rose attempts a 3Pt. Wide open! Collin Barnes is 9.9 feet away. [MAN] Ayo Rose misses. Rebound secured by Vince Quickley.

[09:43] Team_016 possession (Score: 73-69)
Ben Barrett attempts a 3Pt. Contested by Ayo Rose (5.7 feet, ZONE). Ben Barrett misses. Rebound secured by Shaquille Bane.

[09:27] Team_040 possession (Score: 73-69)
Bam Gobert makes the Layup and draws the foul on Collin Barnes! And-1! Bam Gobert to the line for 1. [Team fouls: 1] (Collin Barnes: 1 personal fouls)   FT 1/1: GOOD Bam Gobert makes 1/1 from the line.
Score: 76-69

[09:15] Team_016 possession (Score: 76-69)
Giannis Ginobili attempts a Midrange. Contested by Shaquille Bane (4.8 feet, MAN). Giannis Ginobili misses. Rebound secured by Shaquille Bane.

[08:58] Team_040 possession (Score: 76-69)
Carmelo Murray attempts a 3Pt. Wide open! Collin Barnes is 7.2 feet away. [ZONE] Carmelo Murray misses. Rebound secured by Vince Quickley.

[08:42] Team_016 possession (Score: 76-69)
Ben Barrett attempts a 3Pt. Wide open! Dirk Johnson is 10.0 feet away. [MAN] BEN BARRETT MAKES IT! Assist: Collin Barnes
Score: 76-72

[08:27] Team_040 possession (Score: 76-72)
Ayo Rose commits a violation (traveling/carry)! TURNOVER! (dead ball)

[08:27] Substitution (Team_040): Ayo Rose OUT → Cole O'Neal IN (stamina_rule2)

[08:27] Substitution (Team_040): Shaquille Bane OUT → Tracy Middleton IN (stamina_rule2)

[08:27] Substitution (Team_040): Carmelo Murray OUT → Klay Leonard IN (stamina_rule2)

[08:27] Substitution (Team_040): Dirk Johnson OUT → RJ Curry IN (stamina_rule2)

[08:27] Substitution (Team_040): Bam Gobert OUT → Josh Banchero IN (stamina_rule2)

[08:27] Substitution (Team_016): Collin Barnes OUT → Lamelo Herro IN (stamina_rule2)

[08:27] Substitution (Team_016): Giannis Ginobili OUT → Immanuel Nowitzki IN (stamina_rule2)

[08:27] Substitution (Team_016): Vince Quickley OUT → Kevin Butler IN (stamina_rule2)

[08:27] Substitution (Team_016): Ben Barrett OUT → Giannis Doncic IN (stamina_rule2)

[08:27] Substitution (Team_016): Vince Duncan OUT → Trae Barnes IN (stamina_rule2)

[08:15] Team_016 possession (Score: 76-72)
Kevin Butler loses the ball! Stripped by Klay Leonard! TURNOVER! (live ball)

[08:01] Team_040 possession (Score: 76-72)
Tracy Middleton drives, picks up Giannis Doncic. Help arrives from Lamelo Herro! Tracy Middleton attempts a Layup. Contested by Lamelo Herro (2.2 feet, ZONE). Tracy Middleton misses. Rebound secured by Trae Barnes.

[07:48] Team_016 possession (Score: 76-72)
Giannis Doncic drives, picks up RJ Curry. Help arrives from Tracy Middleton! Giannis Doncic attempts a Dunk. Contested by Tracy Middleton (5.3 feet, MAN). Giannis Doncic misses. Rebound secured by Josh Banchero.

[07:31] Team_040 possession (Score: 76-72)
Josh Banchero drives to the basket... Josh Banchero throws a bad pass out of bounds! TURNOVER! (dead ball)

[07:18] Team_016 possession (Score: 76-72)
FOUL! Shooting foul on Josh Banchero. Immanuel Nowitzki to the line for 2 free throws. [Team fouls: 1] (Josh Banchero: 1 personal fouls)   FT 1/2: GOOD   FT 2/2: GOOD Immanuel Nowitzki makes 2/2 from the line.
Score: 76-74

[07:01] Team_040 possession (Score: 76-74)
Josh Banchero attempts a Layup. Contested by Giannis Doncic (3.5 feet, ZONE). JOSH BANCHERO MAKES IT! Assist: Klay Leonard
Score: 78-74

[06:43] Team_016 possession (Score: 78-74)
Kevin Butler attempts a 3Pt. Contested by RJ Curry (4.5 feet, ZONE). Kevin Butler misses. Offensive rebound by Trae Barnes! Trae Barnes kicks it out.

[06:30] Team_016 possession (Score: 78-74)
Kevin Butler drives and kicks out. Giannis Doncic attempts a 3Pt. Contested by RJ Curry (4.1 feet, MAN). GIANNIS DONCIC MAKES IT!
Score: 78-77

[06:15] Team_040 possession (Score: 78-77)
RJ Curry makes the Layup and draws the foul on Giannis Doncic! And-1! RJ Curry to the line for 1. [Team fouls: 2] (Giannis Doncic: 1 personal fouls)   FT 1/1: GOOD RJ Curry makes 1/1 from the line.
Score: 81-77

[06:03] Team_016 possession (Score: 81-77)
FOUL! Shooting foul on RJ Curry. Giannis Doncic to the line for 2 free throws. [Team fouls: 2] (RJ Curry: 1 personal fouls)   FT 1/2: GOOD   FT 2/2: GOOD Giannis Doncic makes 2/2 from the line.
Score: 81-79

[05:54] Team_040 possession (Score: 81-79)
RJ Curry makes the Layup and draws the foul on Lamelo Herro! And-1! RJ Curry to the line for 1. [Team fouls: 3] (Lamelo Herro: 1 personal fouls)   FT 1/1: MISS RJ Curry makes 0/1 from the line. Rebound secured by Giannis Doncic.
Score: 83-79

[05:38] Team_016 possession (Score: 83-79)
Kevin Butler attempts a 3Pt. Contested by Klay Leonard (2.4 feet, MAN). KEVIN BUTLER MAKES IT! Assist: Trae Barnes
Score: 83-82

[05:26] Team_040 possession (Score: 83-82)
Josh Banchero attempts a 3Pt. Contested by Lamelo Herro (5.7 feet, ZONE). Josh Banchero misses. Rebound secured by Lamelo Herro.

[05:15] Team_016 possession (Score: 83-82)
Giannis Doncic attempts a 3Pt. Contested by RJ Curry (4.3 feet, ZONE). Giannis Doncic misses. Rebound secured by Klay Leonard.

[05:00] Team_040 possession (Score: 83-82)
RJ Curry attempts a Layup. BLOCKED BY GIANNIS DONCIC! Ball deflects out of bounds off RJ Curry.

[04:44] Team_016 possession (Score: 83-82)
Lamelo Herro drives and kicks out. Immanuel Nowitzki attempts a 3Pt. Wide open! Tracy Middleton is 7.8 feet away. [MAN] Immanuel Nowitzki misses. Rebound secured by Klay Leonard.

[04:29] Team_040 possession (Score: 83-82)
Tracy Middleton attempts a Layup. Contested by Giannis Doncic (3.0 feet, ZONE). TRACY MIDDLETON MAKES IT!
Score: 85-82

[04:16] Team_016 possession (Score: 85-82)
Giannis Doncic drives and kicks out. Giannis Doncic attempts a 3Pt. Contested by RJ Curry (4.7 feet, MAN). Giannis Doncic misses. Rebound secured by Klay Leonard.

[04:02] Team_040 possession (Score: 85-82)
Tracy Middleton drives, Giannis Doncic stays with him. Tracy Middleton attempts a Layup. Heavily contested by Giannis Doncic (1.7 feet, ZONE)! TRACY MIDDLETON MAKES IT! Assist: Klay Leonard
Score: 87-82

[03:50] Team_016 possession (Score: 87-82)
FOUL! Offensive foul on Trae Barnes! Josh Banchero drew the charge! [Team fouls: 4] (Trae Barnes: 1 personal fouls) TURNOVER! (dead ball)

[03:33] Team_040 possession (Score: 87-82)
Klay Leonard drives, picks up Kevin Butler. Help arrives from Lamelo Herro! Klay Leonard attempts a Layup. Heavily contested by Lamelo Herro (0.7 feet, MAN)! Klay Leonard misses. Offensive rebound by RJ Curry! RJ Curry kicks it out.

[03:19] Team_040 possession (Score: 87-82)
Josh Banchero drives, Trae Barnes stays with him. Josh Banchero attempts a Dunk. Contested by Trae Barnes (5.7 feet, MAN). Josh Banchero misses. Rebound secured by Lamelo Herro.

[03:06] Team_016 possession (Score: 87-82)
Giannis Doncic attempts a 3Pt. Contested by RJ Curry (4.1 feet, MAN). Giannis Doncic misses. Rebound secured by Josh Banchero.

[02:55] Team_040 possession (Score: 87-82)
Josh Banchero attempts a 3Pt. Wide open! Trae Barnes is 6.6 feet away. [MAN] Josh Banchero misses. Rebound secured by Lamelo Herro.

[02:43] Team_016 possession (Score: 87-82)
Kevin Butler loses the ball! Stripped by Klay Leonard! TURNOVER! (live ball)

[02:27] Team_040 possession (Score: 87-82)
Klay Leonard drives, picks up Giannis Doncic. Help arrives from Lamelo Herro! Klay Leonard attempts a Dunk. Contested by Lamelo Herro (5.3 feet, ZONE). Klay Leonard misses. Rebound secured by Giannis Doncic.

[02:12] Team_016 possession (Score: 87-82)
Lamelo Herro attempts a 3Pt. Wide open! Cole O'Neal is 8.6 feet away. [MAN] LAMELO HERRO MAKES IT! Assist: Immanuel Nowitzki
Score: 87-85

[01:59] Team_040 possession (Score: 87-85)
Klay Leonard drives and kicks out. Cole O'Neal attempts a 3Pt. Heavily contested by Lamelo Herro (1.0 feet, MAN)! Cole O'Neal misses. Rebound secured by Lamelo Herro.

[01:49] Team_016 possession (Score: 87-85)
Immanuel Nowitzki attempts a 3Pt. Wide open! Cole O'Neal is 9.2 feet away. [ZONE] IMMANUEL NOWITZKI MAKES IT!
Score: 87-88

[01:33] Team_040 possession (Score: 87-88)
Cole O'Neal attempts a 3Pt. Contested by Giannis Doncic (4.8 feet, ZONE). COLE O'NEAL MAKES IT! Assist: Josh Banchero
Score: 90-88

[01:20] Team_016 possession (Score: 90-88)
Lamelo Herro attempts a 3Pt. Wide open! RJ Curry is 9.5 feet away. [ZONE] Lamelo Herro misses. Rebound secured by RJ Curry.

[01:08] Team_040 possession (Score: 90-88)
RJ Curry attempts a Midrange. Contested by Giannis Doncic (4.9 feet, ZONE). RJ CURRY MAKES IT! Assist: Cole O'Neal
Score: 92-88

[00:51] Team_016 possession (Score: 92-88)
Kevin Butler throws a bad pass out of bounds! TURNOVER! (dead ball)

[00:39] Team_040 possession (Score: 92-88)
Cole O'Neal drives and kicks out. RJ Curry attempts a 3Pt. Heavily contested by Giannis Doncic (1.8 feet, MAN)! RJ Curry misses. Rebound secured by Giannis Doncic.

[00:20] Team_016 possession (Score: 92-88)
Kevin Butler drives, picks up Josh Banchero. Help arrives from Tracy Middleton! Kevin Butler attempts a Layup. Contested by Tracy Middleton (3.7 feet, ZONE). KEVIN BUTLER MAKES IT! Assist: Trae Barnes
Score: 92-90

[00:08] Team_040 possession (Score: 92-90)
FOUL! Offensive foul on Cole O'Neal! Lamelo Herro drew the charge! [Team fouls: 3] (Cole O'Neal: 1 personal fouls) TURNOVER! (dead ball)

================================================================================
                              4TH QUARTER COMPLETE                              
================================================================================

4TH QUARTER SCORE: Team_040 19, Team_016 23

BOX SCORE:
================================================================================

Team_040
--------------------------------------------------------------------------------
Player                MIN  PTS  REB  AST  TO      FG   FG%      3P   3P%
--------------------------------------------------------------------------------
RJ Curry               18    5    2    0   0   2/4    50.0     0/0   0.0
Tracy Middleton        18    4    0    0   0   2/3    66.7     0/0   0.0
Bam Gobert             30    3    1    0   0   1/1   100.0     0/0   0.0
Cole O'Neal            22    3    0    1   0   1/2    50.0     0/0   0.0
Josh Banchero          18    2    2    1   0   1/4    25.0     0/0   0.0
Carmelo Murray         30    0    0    0   0   0/2     0.0     0/0   0.0
Shaquille Bane         30    0    3    0   0   0/1     0.0     0/0   0.0
Ayo Rose               26    0    0    0   0   0/2     0.0     0/0   0.0
Klay Leonard           18    0    3    2   0   0/2     0.0     0/0   0.0

TEAM: FG: 7/21 (33.3%), 3PT: 1/7 (14.3%), REB: 11 (1 off, 10 def), AST: 4, TO: 4
TEAM FOULS: 3


Team_016
--------------------------------------------------------------------------------
Player                MIN  PTS  REB  AST  TO      FG   FG%      3P   3P%
--------------------------------------------------------------------------------
Giannis Doncic         18    5    3    0   0   2/6    33.3     0/0   0.0
Immanuel Nowitzki      19    5    0    1   0   2/2   100.0     0/0   0.0
Kevin Butler           19    5    0    0   0   2/2   100.0     0/0   0.0
Ben Barrett            30    3    1    1   0   1/3    33.3     0/0   0.0
Lamelo Herro           18    3    4    0   0   1/3    33.3     0/0   0.0
Giannis Ginobili       29    2    0    0   0   1/2    50.0     0/0   0.0
Collin Barnes          30    0    0    1   0   0/1     0.0     0/0   0.0
Vince Quickley         29    0    4    0   0   0/0     0.0     0/0   0.0
Trae Barnes            18    0    2    2   0   0/0     0.0     0/0   0.0

TEAM: FG: 9/19 (47.4%), 3PT: 4/9 (44.4%), REB: 14 (1 off, 13 def), AST: 5, TO: 5
TEAM FOULS: 4

================================================================================

================================================================================
                               FULL GAME COMPLETE                               
================================================================================

FINAL SCORE: Team_040 92, Team_016 90

SCORING BY QUARTER:
--------------------------------------------------------------------------------
Team                     Q1     Q2     Q3     Q4    FINAL
--------------------------------------------------------------------------------
Team_040                 20     33     20     19       92
Team_016                 23     16     28     23       90
--------------------------------------------------------------------------------

FULL GAME BOX SCORE:
================================================================================

Team_040
--------------------------------------------------------------------------------
Player                MIN  PTS  REB  AST  TO      FG   FG%      3P   3P%      FT STL BLK
--------------------------------------------------------------------------------
Shaquille Bane         30    4    9    1   4   2/9    22.2   0/6     0.0   0/0     2   1
Carmelo Murray         30    8    0    1   1   3/9    33.3   2/5    40.0   0/0     2   0
Dirk Johnson           30   11    9    5   2   5/7    71.4   1/2    50.0   0/0     0   0
Bam Gobert             30   18    6    5   1   8/10   80.0   1/1   100.0   1/1     0   1
Ayo Rose               26    9    0    2   5   4/7    57.1   1/3    33.3   5/5     0   0
Cole O'Neal            22    5    0    2   2   2/7    28.6   1/2    50.0   0/0     1   0
Tracy Middleton        18   13    0    0   1   6/7    85.7   1/1   100.0   0/0     1   0
Klay Leonard           18   12    6    2   0   4/8    50.0   4/4   100.0   0/0     2   0
RJ Curry               18    8    6    4   0   3/5    60.0   0/0     0.0   2/3     0   0
Josh Banchero          18    2    6    2   1   1/5    20.0   0/3     0.0   0/0     0   0

TEAM: FG: 38/74 (51.4%), 3PT: 11/27 (40.7%), REB: 42 (9 off, 33 def), AST: 24, TO: 17


Team_016
--------------------------------------------------------------------------------
Player                MIN  PTS  REB  AST  TO      FG   FG%      3P   3P%      FT STL BLK
--------------------------------------------------------------------------------
Collin Barnes          30    5    0    5   1   3/9    33.3   0/4     0.0   1/1     0   0
Ben Barrett            30   13    6    1   2   4/9    44.4   3/8    37.5   0/0     1   0
Vince Duncan           30   12   10    2   3   7/8    87.5   0/1     0.0   0/0     1   0
Giannis Ginobili       29   16    0    0   3   4/9    44.4   2/5    40.0   1/1     3   0
Vince Quickley         29    5    9    4   2   3/5    60.0   1/1   100.0   3/3     1   0
Immanuel Nowitzki      19    5    1    4   2   2/4    50.0   1/1   100.0   2/2     0   0
Kevin Butler           19   12    0    0   4   6/7    85.7   2/2   100.0   0/0     0   0
Lamelo Herro           18    8    4    1   0   3/6    50.0   2/3    66.7   0/0     0   0
Giannis Doncic         18    9    8    0   0   3/8    37.5   0/2     0.0   4/4     0   2
Trae Barnes            18    5    4    3   1   2/5    40.0   0/0     0.0   0/0     0   0

TEAM: FG: 37/70 (52.9%), 3PT: 11/27 (40.7%), REB: 42 (7 off, 35 def), AST: 20, TO: 18

================================================================================
