================================================================================
                        FULL GAME - Team_009 vs Team_086                        
================================================================================

================================================================================
                       1ST QUARTER - Team_009 vs Team_086                       
================================================================================

[12:00] Team_009 possession (Score: 0-0)
Miles Sabonis attempts a Midrange. Contested by Anfernee Harris (4.3 feet, ZONE). MILES SABONIS MAKES IT!
Score: 2-0

[11:47] Team_086 possession (Score: 2-0)
Rudy Rose attempts a Midrange. Contested by Kyle Brogdon (5.4 feet, MAN). Rudy Rose misses. Rebound secured by Anfernee Anunoby.

[11:37] Team_009 possession (Score: 2-0)
Anfernee Anunoby attempts a 3Pt. Contested by Lauri Johnson (2.5 feet, ZONE). ANFERNEE ANUNOBY MAKES IT! Assist: Miles Sabonis
Score: 5-0

[11:22] Team_086 possession (Score: 5-0)
Rudy Rose drives to the basket... Rudy Rose throws a bad pass out of bounds! TURNOVER! (dead ball)

[11:08] Team_009 possession (Score: 5-0)
Kyle Brogdon attempts a 3Pt. Contested by Rudy Rose (3.9 feet, MAN). Kyle Brogdon misses. Rebound secured by Bones Ginobili.

[10:56] Team_086 possession (Score: 5-0)
Rudy Rose attempts a Midrange. Contested by Kyle Brogdon (3.1 feet, MAN). RUDY ROSE MAKES IT!
Score: 5-2

[10:43] Team_009 possession (Score: 5-2)
Miles Sabonis attempts a 3Pt. Wide open! Lauri Johnson is 6.9 feet away. [ZONE] Miles Sabonis misses. FOUL! Loose ball foul on Rudy Rose during the rebound battle. [Team fouls: 1] No free throws, side out. (Rudy Rose: 1 personal fouls)

[10:24] Team_009 possession (Score: 5-2)
Miles Sabonis attempts a 3Pt. Wide open! Miles Gobert is 7.6 feet away. [ZONE] MILES SABONIS MAKES IT! Assist: Desmond Harden
Score: 8-2

[10:09] Team_086 possession (Score: 8-2)
FOUL! Holding foul on Miles Sabonis. [Team fouls: 1] No free throws, side out. (Miles Sabonis: 1 personal fouls)

[09:54] Team_086 possession (Score: 8-2)
Anfernee Harris attempts a Midrange. Contested by Anfernee Anunoby (4.4 feet, ZONE). Anfernee Harris misses. Rebound secured by Cole Mitchell.

[09:36] Team_009 possession (Score: 8-2)
FOUL! Reach-in foul on Rudy Rose during the drive. [Team fouls: 2] No free throws, side out. (Rudy Rose: 2 personal fouls)

[09:20] Team_009 possession (Score: 8-2)
Desmond Harden attempts a Layup. BLOCKED BY BONES GINOBILI! Ball is loose! Offensive rebound by Cole Mitchell! Cole Mitchell kicks it out.

[09:07] Team_009 possession (Score: 8-2)
FOUL! Shooting foul on Rudy Rose. Miles Sabonis to the line for 2 free throws. [Team fouls: 3] (Rudy Rose: 3 personal fouls)   FT 1/2: GOOD   FT 2/2: GOOD Miles Sabonis makes 2/2 from the line.
Score: 10-2

[08:52] Team_086 possession (Score: 10-2)
Anfernee Harris attempts a Layup. BLOCKED BY KYLE BROGDON! Ball is loose! Rebound secured by Cole Mitchell.

[08:36] Team_009 possession (Score: 10-2)
Desmond Harden attempts a 3Pt. Contested by Lauri Johnson (4.9 feet, ZONE). Desmond Harden misses. Offensive rebound by Kyle Brogdon! Kyle Brogdon puts it back in!
Score: 12-2

[08:22] Team_086 possession (Score: 12-2)
Lauri Johnson drives to the basket... Lauri Johnson throws a bad pass! Stolen by Miles Sabonis! TURNOVER! (live ball)

[08:08] Team_009 possession (Score: 12-2)
Cole Mitchell attempts a 3Pt. Contested by Lauri Johnson (4.2 feet, ZONE). COLE MITCHELL MAKES IT! Assist: Desmond Harden
Score: 15-2

[07:53] Team_086 possession (Score: 15-2)
Miles Gobert attempts a Layup. Contested by Kyle Brogdon (4.3 feet, ZONE). MILES GOBERT MAKES IT! Assist: Anfernee Harris
Score: 15-4

[07:42] Team_009 possession (Score: 15-4)
Cole Mitchell throws a bad pass out of bounds! TURNOVER! (dead ball)

[07:32] Team_086 possession (Score: 15-4)
Miles Gobert attempts a 3Pt. Wide open! Miles Sabonis is 7.3 feet away. [ZONE] Miles Gobert misses. Rebound secured by Cole Mitchell.

[07:19] Team_009 possession (Score: 15-4)
Cole Mitchell attempts a 3Pt. Contested by Lauri Johnson (4.8 feet, ZONE). COLE MITCHELL MAKES IT! Assist: Miles Sabonis
Score: 18-4

[07:01] Team_086 possession (Score: 18-4)
Bones Ginobili attempts a Midrange. Contested by Cole Mitchell (4.5 feet, ZONE). BONES GINOBILI MAKES IT!
Score: 18-6

[06:51] Team_009 possession (Score: 18-6)
Kyle Brogdon makes the Layup and draws the foul on Bones Ginobili! And-1! Kyle Brogdon to the line for 1. [Team fouls: 4] (Bones Ginobili: 1 personal fouls)   FT 1/1: GOOD Kyle Brogdon makes 1/1 from the line.
Score: 21-6

[06:37] Team_086 possession (Score: 21-6)
Bones Ginobili drives to the basket... Bones Ginobili throws a bad pass out of bounds! TURNOVER! (dead ball)

[06:21] Team_009 possession (Score: 21-6)
FOUL! Shooting foul on Rudy Rose. Kyle Brogdon to the line for 2 free throws. [BONUS: 5 team fouls] (Rudy Rose: 4 personal fouls)   FT 1/2: MISS   FT 2/2: GOOD Kyle Brogdon makes 1/2 from the line.
Score: 22-6

[06:03] Team_086 possession (Score: 22-6)
Anfernee Harris attempts a Midrange. Contested by Desmond Harden (5.3 feet, MAN). Anfernee Harris misses. Rebound secured by Cole Mitchell.

[05:47] Team_009 possession (Score: 22-6)
Desmond Harden throws a bad pass out of bounds! TURNOVER! (dead ball)

[05:31] Team_086 possession (Score: 22-6)
Rudy Rose attempts a Midrange. Wide open! Anfernee Anunoby is 6.6 feet away. [ZONE] Rudy Rose misses. Rebound secured by Kyle Brogdon.

[05:21] Team_009 possession (Score: 22-6)
Kyle Brogdon attempts a Layup. BLOCKED BY RUDY ROSE! Ball is loose! Rebound secured by Rudy Rose.

[05:04] Team_086 possession (Score: 22-6)
Rudy Rose loses control! Ball rolls out of bounds! TURNOVER! (dead ball)

[04:50] Team_009 possession (Score: 22-6)
Miles Sabonis loses the ball! Stripped by Lauri Johnson! TURNOVER! (live ball)

[04:38] Team_086 possession (Score: 22-6)
Rudy Rose drives, Kyle Brogdon stays with him. Rudy Rose attempts a Dunk. Wide open! Kyle Brogdon is 6.3 feet away. [ZONE] RUDY ROSE MAKES IT! Assist: Bones Ginobili
Score: 22-8

[04:23] Team_009 possession (Score: 22-8)
Miles Sabonis attempts a Layup. Wide open! Lauri Johnson is 7.6 feet away. [MAN] Miles Sabonis misses. Rebound secured by Miles Gobert.

[04:09] Team_086 possession (Score: 22-8)
Bones Ginobili attempts a 3Pt. Contested by Cole Mitchell (3.8 feet, MAN). BONES GINOBILI MAKES IT! Assist: Anfernee Harris
Score: 22-11

[03:56] Team_009 possession (Score: 22-11)
Anfernee Anunoby attempts a 3Pt. Heavily contested by Lauri Johnson (1.5 feet, ZONE)! Anfernee Anunoby misses. Rebound secured by Rudy Rose.

[03:42] Team_086 possession (Score: 22-11)
Rudy Rose attempts a Midrange. Contested by Kyle Brogdon (3.0 feet, MAN). RUDY ROSE MAKES IT!
Score: 22-13

[03:29] Team_009 possession (Score: 22-13)
Kyle Brogdon attempts a Midrange. Wide open! Bones Ginobili is 8.1 feet away. [ZONE] Kyle Brogdon misses. Rebound secured by Miles Gobert.

[03:18] Team_086 possession (Score: 22-13)
Lauri Johnson attempts a 3Pt. Contested by Miles Sabonis (4.9 feet, ZONE). Lauri Johnson misses. Rebound secured by Cole Mitchell.

[03:01] Team_009 possession (Score: 22-13)
Miles Sabonis attempts a 3Pt. Contested by Lauri Johnson (3.6 feet, MAN). Miles Sabonis misses. Rebound secured by Miles Gobert.

[02:42] Team_086 possession (Score: 22-13)
Rudy Rose attempts a Midrange. Contested by Kyle Brogdon (4.3 feet, MAN). Rudy Rose misses. Offensive rebound by Miles Gobert! Miles Gobert kicks it out.

[02:29] Team_086 possession (Score: 22-13)
Lauri Johnson attempts a Midrange. Wide open! Miles Sabonis is 7.6 feet away. [MAN] Lauri Johnson misses. Rebound secured by Anfernee Anunoby.

[02:16] Team_009 possession (Score: 22-13)
Anfernee Anunoby makes the Layup and draws the foul on Miles Gobert! And-1! Anfernee Anunoby to the line for 1. [BONUS: 6 team fouls] (Miles Gobert: 1 personal fouls)   FT 1/1: GOOD Anfernee Anunoby makes 1/1 from the line.
Score: 25-13

[02:02] Team_086 possession (Score: 25-13)
Rudy Rose attempts a Midrange. Wide open! Anfernee Anunoby is 7.6 feet away. [ZONE] Rudy Rose misses. Rebound secured by Cole Mitchell.

[01:48] Team_009 possession (Score: 25-13)
Cole Mitchell drives, Bones Ginobili stays with him. Cole Mitchell attempts a Dunk. Contested by Bones Ginobili (3.1 feet, MAN). COLE MITCHELL MAKES IT! Assist: Kyle Brogdon
Score: 27-13

[01:30] Team_086 possession (Score: 27-13)
Miles Gobert attempts a 3Pt. Wide open! Miles Sabonis is 6.4 feet away. [ZONE] Miles Gobert misses. FOUL! Loose ball foul on Anfernee Anunoby during the rebound battle. [Team fouls: 2] No free throws, side out. (Anfernee Anunoby: 1 personal fouls)

[01:18] Team_086 possession (Score: 27-13)
Anfernee Harris attempts a Midrange. Wide open! Anfernee Anunoby is 8.4 feet away. [ZONE] ANFERNEE HARRIS MAKES IT!
Score: 27-15

[01:04] Team_009 possession (Score: 27-15)
FOUL! Shooting foul on Lauri Johnson. Cole Mitchell to the line for 3 free throws. [BONUS: 7 team fouls] (Lauri Johnson: 1 personal fouls)   FT 1/3: GOOD   FT 2/3: GOOD   FT 3/3: GOOD Cole Mitchell makes 3/3 from the line.
Score: 30-15

[00:50] Team_086 possession (Score: 30-15)
FOUL! Offensive foul on Bones Ginobili! Cole Mitchell drew the charge! [Team fouls: 8] (Bones Ginobili: 2 personal fouls) TURNOVER! (dead ball)

[00:35] Team_009 possession (Score: 30-15)
Cole Mitchell attempts a Midrange. Contested by Anfernee Harris (4.6 feet, ZONE). COLE MITCHELL MAKES IT!
Score: 32-15

[00:18] Team_086 possession (Score: 32-15)
Miles Gobert attempts a Layup. Contested by Kyle Brogdon (2.5 feet, ZONE). Miles Gobert misses. Rebound secured by Anfernee Anunoby.

[00:03] Team_009 possession (Score: 32-15)
FOUL! Reach-in foul on Rudy Rose during the drive. [IN THE BONUS! 9 team fouls] Desmond Harden to the line for 2 free throws. (Rudy Rose: 5 personal fouls)   FT 1/2: MISS   FT 2/2: GOOD Desmond Harden makes 1/2 from the line.
Score: 33-15

================================================================================
                              1ST QUARTER COMPLETE                              
================================================================================

1ST QUARTER SCORE: Team_009 33, Team_086 15

BOX SCORE:
================================================================================

Team_009
--------------------------------------------------------------------------------
Player                MIN  PTS  REB  AST  TO      FG   FG%      3P   3P%
--------------------------------------------------------------------------------
Cole Mitchell          12   13    8    0   0   5/5   100.0     0/0   0.0
Miles Sabonis          12    7    0    2   0   3/5    60.0     0/0   0.0
Anfernee Anunoby       12    6    3    0   0   2/3    66.7     0/0   0.0
Kyle Brogdon           12    6    2    1   0   3/6    50.0     0/0   0.0
Desmond Harden         12    1    0    2   0   1/1   100.0     0/0   0.0

TEAM: FG: 14/20 (70.0%), 3PT: 6/9 (66.7%), REB: 13 (3 off, 10 def), AST: 5, TO: 3
TEAM FOULS: 2


Team_086
--------------------------------------------------------------------------------
Player                MIN  PTS  REB  AST  TO      FG   FG%      3P   3P%
--------------------------------------------------------------------------------
Rudy Rose              12    6    2    0   0   3/6    50.0     0/0   0.0
Bones Ginobili         12    5    1    1   0   2/2   100.0     0/0   0.0
Anfernee Harris        12    2    0    2   0   1/4    25.0     0/0   0.0
Miles Gobert           12    2    5    0   0   1/3    33.3     0/0   0.0
Lauri Johnson          12    0    0    0   0   0/2     0.0     0/0   0.0

TEAM: FG: 7/17 (41.2%), 3PT: 1/3 (33.3%), REB: 8 (2 off, 6 def), AST: 3, TO: 5
TEAM FOULS: 9 [Team_009 in BONUS]

================================================================================

================================================================================
                       2ND QUARTER - Team_009 vs Team_086                       
================================================================================

[12:00] Team_009 possession (Score: 33-15)
Kyle Brogdon attempts a Layup. Contested by Rudy Rose (4.2 feet, ZONE). Kyle Brogdon misses. Rebound secured by Miles Gobert.

[11:45] Team_086 possession (Score: 33-15)
Bones Ginobili makes the Dunk and draws the foul on Cole Mitchell! And-1! Bones Ginobili to the line for 1. [Team fouls: 1] (Cole Mitchell: 1 personal fouls)   FT 1/1: GOOD Bones Ginobili makes 1/1 from the line.
Score: 33-18

[11:31] Team_009 possession (Score: 33-18)
Anfernee Anunoby attempts a 3Pt. Contested by Miles Gobert (3.7 feet, MAN). ANFERNEE ANUNOBY MAKES IT! Assist: Miles Sabonis
Score: 36-18

[11:20] Team_086 possession (Score: 36-18)
Rudy Rose attempts a Midrange. Contested by Miles Sabonis (4.2 feet, ZONE). Rudy Rose misses. FOUL! Loose ball foul on Cole Mitchell during the rebound battle. [Team fouls: 2] No free throws, side out. (Cole Mitchell: 2 personal fouls)

[11:03] Team_086 possession (Score: 36-18)
Rudy Rose attempts a Layup. Contested by Kyle Brogdon (3.2 feet, ZONE). Rudy Rose misses. Rebound secured by Anfernee Anunoby.

[10:48] Team_009 possession (Score: 36-18)
Anfernee Anunoby attempts a 3Pt. Heavily contested by Lauri Johnson (0.5 feet, ZONE)! Anfernee Anunoby misses. Offensive rebound by Cole Mitchell! Cole Mitchell kicks it out.

[10:33] Team_009 possession (Score: 36-18)
Desmond Harden drives, Rudy Rose stays with him. Desmond Harden attempts a Dunk. Wide open! Rudy Rose is 7.3 feet away. [ZONE] Desmond Harden misses. FOUL! Loose ball foul on Miles Gobert during the rebound battle. [Team fouls: 1] No free throws, side out. (Miles Gobert: 1 personal fouls)

[10:20] Team_009 possession (Score: 36-18)
Miles Sabonis drives and kicks out. Cole Mitchell attempts a Midrange. Wide open! Bones Ginobili is 6.1 feet away. [MAN] COLE MITCHELL MAKES IT! Assist: Kyle Brogdon
Score: 38-18

[10:04] Team_086 possession (Score: 38-18)
Rudy Rose makes the Dunk and draws the foul on Miles Sabonis! And-1! Rudy Rose to the line for 1. [Team fouls: 3] (Miles Sabonis: 1 personal fouls)   FT 1/1: GOOD Rudy Rose makes 1/1 from the line.
Score: 38-21

[09:48] Team_009 possession (Score: 38-21)
Miles Sabonis attempts a Midrange. Contested by Lauri Johnson (5.4 feet, MAN). Miles Sabonis misses. Rebound secured by Bones Ginobili.

[09:34] Team_086 possession (Score: 38-21)
Lauri Johnson attempts a Midrange. Contested by Miles Sabonis (4.1 feet, MAN). LAURI JOHNSON MAKES IT! Assist: Bones Ginobili
Score: 38-23

[09:19] Team_009 possession (Score: 38-23)
Cole Mitchell attempts a Midrange. Wide open! Bones Ginobili is 9.5 feet away. [MAN] COLE MITCHELL MAKES IT! Assist: Miles Sabonis
Score: 40-23

[09:02] Team_086 possession (Score: 40-23)
Rudy Rose attempts a Layup. Contested by Kyle Brogdon (5.6 feet, ZONE). RUDY ROSE MAKES IT!
Score: 40-25

[08:47] Team_009 possession (Score: 40-25)
Cole Mitchell attempts a Layup. Contested by Rudy Rose (5.1 feet, ZONE). COLE MITCHELL MAKES IT! Assist: Miles Sabonis
Score: 42-25

[08:30] Team_086 possession (Score: 42-25)
Anfernee Harris attempts a 3Pt. Wide open! Desmond Harden is 10.0 feet away. [MAN] Anfernee Harris misses. Rebound secured by Kyle Brogdon.

[08:16] Team_009 possession (Score: 42-25)
Cole Mitchell makes the 3Pt and draws the foul on Bones Ginobili! And-1! Cole Mitchell to the line for 1. [Team fouls: 2] (Bones Ginobili: 1 personal fouls)   FT 1/1: GOOD Cole Mitchell makes 1/1 from the line.
Score: 46-25

[08:00] Team_086 possession (Score: 46-25)
Lauri Johnson attempts a 3Pt. Wide open! Miles Sabonis is 6.1 feet away. [ZONE] Lauri Johnson misses. Offensive rebound by Miles Gobert! Miles Gobert kicks it out.

[07:44] Team_086 possession (Score: 46-25)
FOUL! Shooting foul on Kyle Brogdon. Lauri Johnson to the line for 2 free throws. [Team fouls: 4] (Kyle Brogdon: 1 personal fouls)   FT 1/2: GOOD   FT 2/2: MISS Lauri Johnson makes 1/2 from the line. Rebound secured by Kyle Brogdon.
Score: 46-26

[07:32] Team_009 possession (Score: 46-26)
Desmond Harden drives and kicks out. Anfernee Anunoby attempts a 3Pt. Contested by Miles Gobert (4.0 feet, MAN). Anfernee Anunoby misses. Rebound secured by Rudy Rose.

[07:19] Team_086 possession (Score: 46-26)
Bones Ginobili attempts a 3Pt. Contested by Miles Sabonis (2.8 feet, ZONE). Bones Ginobili misses. Rebound secured by Kyle Brogdon.

[07:01] Team_009 possession (Score: 46-26)
FOUL! Shooting foul on Anfernee Harris. Anfernee Anunoby to the line for 2 free throws. [Team fouls: 3] (Anfernee Harris: 1 personal fouls)   FT 1/2: GOOD   FT 2/2: MISS Anfernee Anunoby makes 1/2 from the line. Rebound secured by Rudy Rose.
Score: 47-26

[06:45] Team_086 possession (Score: 47-26)
Bones Ginobili attempts a Midrange. Contested by Cole Mitchell (2.8 feet, ZONE). BONES GINOBILI MAKES IT! Assist: Anfernee Harris
Score: 47-28

[06:27] Team_009 possession (Score: 47-28)
FOUL! Shooting foul on Bones Ginobili. Cole Mitchell to the line for 2 free throws. [Team fouls: 4] (Bones Ginobili: 2 personal fouls)   FT 1/2: GOOD   FT 2/2: MISS Cole Mitchell makes 1/2 from the line. Rebound secured by Rudy Rose.
Score: 48-28

[06:11] Team_086 possession (Score: 48-28)
Lauri Johnson attempts a 3Pt. Wide open! Miles Sabonis is 8.0 feet away. [MAN] LAURI JOHNSON MAKES IT! Assist: Miles Gobert
Score: 48-31

[05:56] Team_009 possession (Score: 48-31)
Kyle Brogdon attempts a Midrange. Contested by Miles Gobert (4.4 feet, ZONE). Kyle Brogdon misses. Rebound secured by Rudy Rose.

[05:42] Team_086 possession (Score: 48-31)
Anfernee Harris attempts a Layup. Contested by Kyle Brogdon (5.4 feet, ZONE). Anfernee Harris misses. Offensive rebound by Rudy Rose! Rudy Rose puts it back in!
Score: 48-33

[05:24] Team_009 possession (Score: 48-33)
Desmond Harden drives, Anfernee Harris stays with him. Desmond Harden attempts a Layup. Wide open! Anfernee Harris is 6.9 feet away. [MAN] DESMOND HARDEN MAKES IT!
Score: 50-33

[05:13] Team_086 possession (Score: 50-33)
Rudy Rose attempts a Midrange. Wide open! Kyle Brogdon is 6.3 feet away. [MAN] Rudy Rose misses. Offensive rebound by Miles Gobert! Miles Gobert kicks it out.

[04:59] Team_086 possession (Score: 50-33)
Lauri Johnson drives, picks up Miles Sabonis. Help arrives from Anfernee Anunoby! Lauri Johnson attempts a Layup. Wide open! Anfernee Anunoby is 6.6 feet away. [MAN] LAURI JOHNSON MAKES IT! Assist: Bones Ginobili
Score: 50-35

[04:47] Team_009 possession (Score: 50-35)
Anfernee Anunoby attempts a 3Pt. Contested by Lauri Johnson (4.3 feet, ZONE). Anfernee Anunoby misses. Rebound secured by Miles Gobert.

[04:35] Team_086 possession (Score: 50-35)
Rudy Rose attempts a Midrange. Wide open! Anfernee Anunoby is 8.3 feet away. [ZONE] Rudy Rose misses. Rebound secured by Kyle Brogdon.

[04:17] Team_009 possession (Score: 50-35)
FOUL! Reach-in foul on Bones Ginobili during the drive. [IN THE BONUS! 5 team fouls] Cole Mitchell to the line for 2 free throws. (Bones Ginobili: 3 personal fouls)   FT 1/2: GOOD   FT 2/2: GOOD Cole Mitchell makes 2/2 from the line.
Score: 52-35

[04:01] Team_086 possession (Score: 52-35)
Bones Ginobili attempts a Midrange. Wide open! Cole Mitchell is 7.8 feet away. [MAN] BONES GINOBILI MAKES IT!
Score: 52-37

[03:50] Team_009 possession (Score: 52-37)
Cole Mitchell attempts a Layup. Wide open! Bones Ginobili is 6.8 feet away. [MAN] COLE MITCHELL MAKES IT! Assist: Anfernee Anunoby
Score: 54-37

[03:34] Team_086 possession (Score: 54-37)
Lauri Johnson attempts a Midrange. Contested by Miles Sabonis (5.7 feet, MAN). Lauri Johnson misses. Rebound secured by Cole Mitchell.

[03:15] Team_009 possession (Score: 54-37)
Kyle Brogdon attempts a Layup. BLOCKED BY RUDY ROSE! Ball deflects out of bounds off Kyle Brogdon.

[03:01] Team_086 possession (Score: 54-37)
Lauri Johnson attempts a Midrange. Wide open! Anfernee Anunoby is 8.7 feet away. [ZONE] Lauri Johnson misses. Rebound secured by Kyle Brogdon.

[02:49] Team_009 possession (Score: 54-37)
Anfernee Anunoby attempts a 3Pt. Contested by Lauri Johnson (4.6 feet, ZONE). Anfernee Anunoby misses. FOUL! Loose ball foul on Rudy Rose during the rebound battle. [IN THE BONUS! 6 team fouls] Kyle Brogdon to the line for 2 free throws. (Rudy Rose: 1 personal fouls)   FT 1/2: GOOD   FT 2/2: GOOD Kyle Brogdon makes 2/2 from the line.
Score: 56-37

[02:35] Team_086 possession (Score: 56-37)
Lauri Johnson attempts a 3Pt. Contested by Miles Sabonis (5.6 feet, MAN). LAURI JOHNSON MAKES IT! Assist: Miles Gobert
Score: 56-40

[02:24] Team_009 possession (Score: 56-40)
Anfernee Anunoby attempts a 3Pt. Contested by Miles Gobert (5.0 feet, MAN). Anfernee Anunoby misses. Rebound secured by Miles Gobert.

[02:08] Team_086 possession (Score: 56-40)
Anfernee Harris drives to the basket... Anfernee Harris throws a bad pass! Stolen by Desmond Harden! TURNOVER! (live ball)

[01:57] Team_009 possession (Score: 56-40)
Cole Mitchell drives and kicks out. Miles Sabonis attempts a 3Pt. Contested by Lauri Johnson (3.3 feet, MAN). MILES SABONIS MAKES IT! Assist: Kyle Brogdon
Score: 59-40

[01:45] Team_086 possession (Score: 59-40)
Bones Ginobili drives and kicks out. Lauri Johnson attempts a Midrange. Contested by Miles Sabonis (5.3 feet, MAN). LAURI JOHNSON MAKES IT!
Score: 59-42

[01:29] Team_009 possession (Score: 59-42)
Cole Mitchell attempts a Midrange. Contested by Bones Ginobili (5.7 feet, MAN). COLE MITCHELL MAKES IT! Assist: Anfernee Anunoby
Score: 61-42

[01:13] Team_086 possession (Score: 61-42)
Lauri Johnson attempts a Midrange. Contested by Miles Sabonis (5.7 feet, MAN). LAURI JOHNSON MAKES IT!
Score: 61-44

[00:56] Team_009 possession (Score: 61-44)
Anfernee Anunoby attempts a 3Pt. Contested by Miles Gobert (5.1 feet, MAN). Anfernee Anunoby misses. Rebound secured by Miles Gobert.

[00:42] Team_086 possession (Score: 61-44)
Rudy Rose attempts a Midrange. Contested by Kyle Brogdon (5.7 feet, MAN). Rudy Rose misses. Rebound secured by Kyle Brogdon.

[00:24] Team_009 possession (Score: 61-44)
Cole Mitchell attempts a Midrange. Wide open! Bones Ginobili is 8.5 feet away. [MAN] Cole Mitchell misses. Rebound secured by Bones Ginobili.

[00:10] Team_086 possession (Score: 61-44)
Lauri Johnson attempts a 3Pt. Wide open! Anfernee Anunoby is 7.5 feet away. [ZONE] Lauri Johnson misses. Offensive rebound by Miles Gobert! Miles Gobert kicks it out.

================================================================================
                              2ND QUARTER COMPLETE                              
================================================================================

2ND QUARTER SCORE: Team_009 28, Team_086 29

BOX SCORE:
================================================================================

Team_009
--------------------------------------------------------------------------------
Player                MIN  PTS  REB  AST  TO      FG   FG%      3P   3P%
--------------------------------------------------------------------------------
Cole Mitchell          24   16    3    0   0   7/9    77.8     0/0   0.0
Anfernee Anunoby       24    3    1    2   0   1/5    20.0     0/0   0.0
Miles Sabonis          24    3    0    3   0   1/2    50.0     0/0   0.0
Kyle Brogdon           24    2    6    2   0   1/4    25.0     0/0   0.0
Desmond Harden         24    2    0    0   0   1/2    50.0     0/0   0.0

TEAM: FG: 11/22 (50.0%), 3PT: 3/6 (50.0%), REB: 10 (2 off, 8 def), AST: 7, TO: 0
TEAM FOULS: 4


Team_086
--------------------------------------------------------------------------------
Player                MIN  PTS  REB  AST  TO      FG   FG%      3P   3P%
--------------------------------------------------------------------------------
Lauri Johnson          24   14    0    0   0   6/9    66.7     0/0   0.0
Bones Ginobili         24    7    2    2   0   3/4    75.0     0/0   0.0
Rudy Rose              24    7    6    0   0   3/6    50.0     0/0   0.0
Miles Gobert           24    0    7    2   0   0/0     0.0     0/0   0.0
Anfernee Harris        24    0    0    1   0   0/1     0.0     0/0   0.0

TEAM: FG: 12/20 (60.0%), 3PT: 2/4 (50.0%), REB: 15 (5 off, 10 def), AST: 5, TO: 1
TEAM FOULS: 6 [Team_009 in BONUS]

================================================================================

================================================================================
                       3RD QUARTER - Team_009 vs Team_086                       
================================================================================

[12:00] Team_009 possession (Score: 61-44)
Cole Mitchell attempts a Layup. Heavily contested by Rudy Rose (1.4 feet, ZONE)! Cole Mitchell misses. Rebound secured by Miles Gobert.

[11:49] Team_086 possession (Score: 61-44)
Bones Ginobili drives, Cole Mitchell stays with him. Bones Ginobili attempts a Layup. Heavily contested by Cole Mitchell (0.5 feet, MAN)! BONES GINOBILI MAKES IT! Assist: Lauri Johnson
Score: 61-46

[11:38] Team_009 possession (Score: 61-46)
Anfernee Anunoby throws a bad pass! Stolen by Miles Gobert! TURNOVER! (live ball)

[11:27] Team_086 possession (Score: 61-46)
Rudy Rose drives, picks up Kyle Brogdon. Help arrives from Miles Sabonis! Rudy Rose attempts a Layup. Wide open! Miles Sabonis is 6.1 feet away. [ZONE] RUDY ROSE MAKES IT!
Score: 61-48

[11:13] Team_009 possession (Score: 61-48)
Anfernee Anunoby attempts a Midrange. Contested by Miles Gobert (2.9 feet, MAN). ANFERNEE ANUNOBY MAKES IT! Assist: Cole Mitchell
Score: 63-48

[11:02] Team_086 possession (Score: 63-48)
Anfernee Harris attempts a Midrange. Wide open! Desmond Harden is 9.0 feet away. [ZONE] Anfernee Harris misses. Offensive rebound by Rudy Rose! Rudy Rose's putback is no good. Offensive rebound by Miles Gobert! Miles Gobert kicks it out.

[10:47] Team_086 possession (Score: 63-48)
Lauri Johnson loses control! Ball rolls out of bounds! TURNOVER! (dead ball)

[10:32] Team_009 possession (Score: 63-48)
Cole Mitchell attempts a Layup. Contested by Bones Ginobili (3.0 feet, MAN). COLE MITCHELL MAKES IT! Assist: Kyle Brogdon
Score: 65-48

[10:17] Team_086 possession (Score: 65-48)
Miles Gobert attempts a Layup. Contested by Anfernee Anunoby (2.9 feet, MAN). MILES GOBERT MAKES IT!
Score: 65-50

[10:00] Team_009 possession (Score: 65-50)
Anfernee Anunoby attempts a 3Pt. Contested by Miles Gobert (4.0 feet, MAN). Anfernee Anunoby misses. Offensive rebound by Cole Mitchell! Cole Mitchell kicks it out.

[09:46] Team_009 possession (Score: 65-50)
Anfernee Anunoby attempts a Layup. BLOCKED BY RUDY ROSE! Ball is loose! Rebound secured by Rudy Rose.

[09:32] Team_086 possession (Score: 65-50)
Anfernee Harris attempts a Midrange. Contested by Desmond Harden (4.4 feet, MAN). ANFERNEE HARRIS MAKES IT!
Score: 65-52

[09:19] Team_009 possession (Score: 65-52)
Kyle Brogdon makes the Dunk and draws the foul on Anfernee Harris! And-1! Kyle Brogdon to the line for 1. [Team fouls: 1] (Anfernee Harris: 1 personal fouls)   FT 1/1: GOOD Kyle Brogdon makes 1/1 from the line.
Score: 68-52

[09:06] Team_086 possession (Score: 68-52)
Miles Gobert attempts a Layup. Contested by Kyle Brogdon (3.6 feet, ZONE). MILES GOBERT MAKES IT! Assist: Lauri Johnson
Score: 68-54

[08:51] Team_009 possession (Score: 68-54)
Cole Mitchell drives, picks up Bones Ginobili. Help arrives from Anfernee Harris! Cole Mitchell attempts a Dunk. Contested by Anfernee Harris (4.0 feet, MAN). COLE MITCHELL MAKES IT! Assist: Kyle Brogdon
Score: 70-54

[08:36] Team_086 possession (Score: 70-54)
Anfernee Harris loses the ball! Stripped by Desmond Harden! TURNOVER! (live ball)

[08:22] Team_009 possession (Score: 70-54)
Cole Mitchell makes the Layup and draws the foul on Bones Ginobili! And-1! Cole Mitchell to the line for 1. [Team fouls: 2] (Bones Ginobili: 1 personal fouls)   FT 1/1: MISS Cole Mitchell makes 0/1 from the line. Offensive rebound by Cole Mitchell! Cole Mitchell kicks it out.
Score: 72-54

[08:07] Team_009 possession (Score: 72-54)
FOUL! Shooting foul on Rudy Rose. Kyle Brogdon to the line for 2 free throws. [Team fouls: 3] (Rudy Rose: 1 personal fouls)   FT 1/2: GOOD   FT 2/2: GOOD Kyle Brogdon makes 2/2 from the line.
Score: 74-54

[07:50] Team_086 possession (Score: 74-54)
Lauri Johnson drives to the basket... FOUL! Offensive foul on Lauri Johnson! Miles Sabonis drew the charge! [Team fouls: 4] (Lauri Johnson: 1 personal fouls) TURNOVER! (dead ball)

[07:35] Team_009 possession (Score: 74-54)
Miles Sabonis attempts a 3Pt. Wide open! Lauri Johnson is 6.4 feet away. [MAN] Miles Sabonis misses. Offensive rebound by Kyle Brogdon! Kyle Brogdon's putback is no good. Rebound secured by Rudy Rose.

[07:19] Team_086 possession (Score: 74-54)
Bones Ginobili attempts a Layup. Contested by Cole Mitchell (2.8 feet, MAN). BONES GINOBILI MAKES IT! Assist: Anfernee Harris
Score: 74-56

[07:06] Team_009 possession (Score: 74-56)
Desmond Harden drives and kicks out. Cole Mitchell attempts a 3Pt. Contested by Bones Ginobili (2.4 feet, MAN). COLE MITCHELL MAKES IT!
Score: 77-56

[06:53] Team_086 possession (Score: 77-56)
Bones Ginobili attempts a Midrange. Contested by Desmond Harden (5.3 feet, ZONE). Bones Ginobili misses. Rebound secured by Cole Mitchell.

[06:41] Team_009 possession (Score: 77-56)
Miles Sabonis attempts a Midrange. Wide open! Lauri Johnson is 8.8 feet away. [MAN] Miles Sabonis misses. Rebound secured by Miles Gobert.

[06:26] Team_086 possession (Score: 77-56)
Lauri Johnson attempts a Layup. Contested by Kyle Brogdon (3.3 feet, ZONE). LAURI JOHNSON MAKES IT! Assist: Rudy Rose
Score: 77-58

[06:10] Team_009 possession (Score: 77-58)
Anfernee Anunoby attempts a 3Pt. Contested by Lauri Johnson (4.4 feet, ZONE). ANFERNEE ANUNOBY MAKES IT! Assist: Miles Sabonis
Score: 80-58

[05:56] Team_086 possession (Score: 80-58)
Miles Gobert attempts a 3Pt. Wide open! Anfernee Anunoby is 7.9 feet away. [MAN] Miles Gobert misses. FOUL! Loose ball foul on Kyle Brogdon during the rebound battle. [Team fouls: 1] No free throws, side out. (Kyle Brogdon: 1 personal fouls)

[05:38] Team_086 possession (Score: 80-58)
Rudy Rose attempts a 3Pt. Wide open! Miles Sabonis is 7.9 feet away. [ZONE] Rudy Rose misses. Rebound secured by Kyle Brogdon.

[05:25] Team_009 possession (Score: 80-58)
Kyle Brogdon drives, Rudy Rose stays with him. Kyle Brogdon attempts a Dunk. Heavily contested by Rudy Rose (0.5 feet, MAN)! Kyle Brogdon misses. Rebound secured by Rudy Rose.

[05:11] Team_086 possession (Score: 80-58)
Anfernee Harris drives to the basket... Anfernee Harris loses the ball! Stripped by Desmond Harden! TURNOVER! (live ball)

[04:54] Team_009 possession (Score: 80-58)
Cole Mitchell makes the Layup and draws the foul on Bones Ginobili! And-1! Cole Mitchell to the line for 1. [BONUS: 5 team fouls] (Bones Ginobili: 2 personal fouls)   FT 1/1: GOOD Cole Mitchell makes 1/1 from the line.
Score: 83-58

[04:37] Team_086 possession (Score: 83-58)
Lauri Johnson loses control! Ball rolls out of bounds! TURNOVER! (dead ball)

[04:18] Team_009 possession (Score: 83-58)
Kyle Brogdon attempts a Midrange. Contested by Rudy Rose (2.8 feet, MAN). Kyle Brogdon misses. Offensive rebound by Cole Mitchell! Cole Mitchell kicks it out.

[04:01] Team_009 possession (Score: 83-58)
Anfernee Anunoby drives, Rudy Rose stays with him. Anfernee Anunoby attempts a Layup. Contested by Rudy Rose (4.3 feet, ZONE). ANFERNEE ANUNOBY MAKES IT! Assist: Kyle Brogdon
Score: 85-58

[03:44] Team_086 possession (Score: 85-58)
Miles Gobert attempts a 3Pt. Wide open! Anfernee Anunoby is 6.6 feet away. [MAN] Miles Gobert misses. Rebound secured by Anfernee Anunoby.

[03:30] Team_009 possession (Score: 85-58)
Kyle Brogdon drives and kicks out. Miles Sabonis attempts a Midrange. Contested by Anfernee Harris (3.9 feet, ZONE). MILES SABONIS MAKES IT!
Score: 87-58

[03:16] Team_086 possession (Score: 87-58)
Rudy Rose attempts a 3Pt. Wide open! Miles Sabonis is 8.2 feet away. [ZONE] RUDY ROSE MAKES IT! Assist: Anfernee Harris
Score: 87-61

[03:02] Team_009 possession (Score: 87-61)
Miles Sabonis attempts a 3Pt. Contested by Miles Gobert (4.3 feet, ZONE). Miles Sabonis misses. Offensive rebound by Kyle Brogdon! Kyle Brogdon puts it back in!
Score: 89-61

[02:50] Team_086 possession (Score: 89-61)
Rudy Rose attempts a Layup. BLOCKED BY KYLE BROGDON! Ball deflects out of bounds off Rudy Rose.

[02:34] Team_009 possession (Score: 89-61)
Cole Mitchell attempts a Layup. Contested by Bones Ginobili (3.6 feet, MAN). COLE MITCHELL MAKES IT! Assist: Desmond Harden
Score: 91-61

[02:19] Team_086 possession (Score: 91-61)
Miles Gobert drives and kicks out. Anfernee Harris attempts a 3Pt. Contested by Desmond Harden (3.1 feet, MAN). ANFERNEE HARRIS MAKES IT! Assist: Lauri Johnson
Score: 91-64

[02:03] Team_009 possession (Score: 91-64)
FOUL! Reach-in foul on Anfernee Harris during the drive. [IN THE BONUS! 6 team fouls] Desmond Harden to the line for 2 free throws. (Anfernee Harris: 2 personal fouls)   FT 1/2: MISS   FT 2/2: GOOD Desmond Harden makes 1/2 from the line.
Score: 92-64

[01:48] Team_086 possession (Score: 92-64)
Bones Ginobili attempts a Midrange. Wide open! Cole Mitchell is 6.6 feet away. [ZONE] Bones Ginobili misses. Offensive rebound by Miles Gobert! Miles Gobert kicks it out.

[01:29] Team_086 possession (Score: 92-64)
Lauri Johnson attempts a 3Pt. Contested by Miles Sabonis (4.7 feet, ZONE). LAURI JOHNSON MAKES IT! Assist: Rudy Rose
Score: 92-67

[01:15] Team_009 possession (Score: 92-67)
Kyle Brogdon drives and kicks out. Miles Sabonis attempts a 3Pt. Contested by Lauri Johnson (4.5 feet, ZONE). MILES SABONIS MAKES IT! Assist: Desmond Harden
Score: 95-67

[01:01] Team_086 possession (Score: 95-67)
FOUL! Holding foul on Cole Mitchell. [Team fouls: 2] No free throws, side out. (Cole Mitchell: 1 personal fouls)

[00:50] Team_086 possession (Score: 95-67)
Lauri Johnson attempts a 3Pt. Contested by Miles Sabonis (3.4 feet, ZONE). Lauri Johnson misses. FOUL! Loose ball foul on Anfernee Anunoby during the rebound battle. [Team fouls: 3] No free throws, side out. (Anfernee Anunoby: 1 personal fouls)

[00:37] Team_086 possession (Score: 95-67)
Miles Gobert attempts a 3Pt. Wide open! Miles Sabonis is 6.9 feet away. [ZONE] Miles Gobert misses. Rebound secured by Cole Mitchell.

[00:23] Team_009 possession (Score: 95-67)
Cole Mitchell makes the Layup and draws the foul on Rudy Rose! And-1! Cole Mitchell to the line for 1. [BONUS: 7 team fouls] (Rudy Rose: 2 personal fouls)   FT 1/1: GOOD Cole Mitchell makes 1/1 from the line.
Score: 98-67

[00:06] Team_086 possession (Score: 98-67)
Miles Gobert drives and kicks out. Bones Ginobili attempts a 3Pt. Wide open! Miles Sabonis is 6.3 feet away. [ZONE] Bones Ginobili misses. Offensive rebound by Miles Gobert! Miles Gobert kicks it out.

================================================================================
                              3RD QUARTER COMPLETE                              
================================================================================

3RD QUARTER SCORE: Team_009 37, Team_086 23

BOX SCORE:
================================================================================

Team_009
--------------------------------------------------------------------------------
Player                MIN  PTS  REB  AST  TO      FG   FG%      3P   3P%
--------------------------------------------------------------------------------
Cole Mitchell          36   15    5    1   0   6/7    85.7     0/0   0.0
Anfernee Anunoby       36    7    1    0   0   3/4    75.0     0/0   0.0
Kyle Brogdon           36    7    2    3   0   3/4    75.0     0/0   0.0
Miles Sabonis          36    5    0    1   0   2/4    50.0     0/0   0.0
Desmond Harden         36    1    0    2   0   1/1   100.0     0/0   0.0

TEAM: FG: 15/20 (75.0%), 3PT: 2/3 (66.7%), REB: 9 (5 off, 4 def), AST: 7, TO: 1
TEAM FOULS: 3


Team_086
--------------------------------------------------------------------------------
Player                MIN  PTS  REB  AST  TO      FG   FG%      3P   3P%
--------------------------------------------------------------------------------
Lauri Johnson          36    5    0    3   0   2/2   100.0     0/0   0.0
Rudy Rose              36    5    5    2   0   2/4    50.0     0/0   0.0
Anfernee Harris        36    5    0    2   0   2/2   100.0     0/0   0.0
Miles Gobert           36    4    5    0   0   2/4    50.0     0/0   0.0
Bones Ginobili         36    4    0    0   0   2/3    66.7     0/0   0.0

TEAM: FG: 10/15 (66.7%), 3PT: 2/5 (40.0%), REB: 9 (5 off, 4 def), AST: 7, TO: 5
TEAM FOULS: 7 [Team_009 in BONUS]

================================================================================

================================================================================
                       4TH QUARTER - Team_009 vs Team_086                       
================================================================================

[12:00] Team_009 possession (Score: 98-67)
Kyle Brogdon attempts a Midrange. Contested by Rudy Rose (2.2 feet, MAN). Kyle Brogdon misses. Rebound secured by Miles Gobert.

[11:50] Team_086 possession (Score: 98-67)
Rudy Rose drives to the basket... Rudy Rose commits a violation (traveling/carry)! TURNOVER! (dead ball)

[11:50] Substitution (Team_009): Miles Sabonis OUT → Paul Trent IN (stamina_rule2)

[11:50] Substitution (Team_009): Desmond Harden OUT → Evan Curry IN (stamina_rule2)

[11:50] Substitution (Team_009): Anfernee Anunoby OUT → RJ Jokic IN (stamina_rule2)

[11:50] Substitution (Team_009): Cole Mitchell OUT → Kawhi Herro IN (stamina_rule2)

[11:50] Substitution (Team_009): Kyle Brogdon OUT → Shaquille Green IN (stamina_rule2)

[11:50] Substitution (Team_086): Lauri Johnson OUT → Anfernee Green IN (stamina_rule2)

[11:50] Substitution (Team_086): Anfernee Harris OUT → Anthony James IN (stamina_rule2)

[11:50] Substitution (Team_086): Bones Ginobili OUT → Kyle McCollum IN (stamina_rule2)

[11:50] Substitution (Team_086): Rudy Rose OUT → Lamelo Towns IN (stamina_rule2)

[11:36] Team_009 possession (Score: 98-67)
Shaquille Green attempts a 3Pt. Wide open! Lamelo Towns is 10.0 feet away. [MAN] Shaquille Green misses. Rebound secured by Miles Gobert.

[11:21] Team_086 possession (Score: 98-67)
Lamelo Towns drives to the basket... Lamelo Towns throws a bad pass out of bounds! TURNOVER! (dead ball)

[11:21] Substitution (Team_086): Miles Gobert OUT → Franz McGrady IN (stamina_rule2)

[11:06] Team_009 possession (Score: 98-67)
Paul Trent attempts a Layup. Contested by Lamelo Towns (5.1 feet, ZONE). Paul Trent misses. Rebound secured by Lamelo Towns.

[10:52] Team_086 possession (Score: 98-67)
Franz McGrady attempts a Layup. Contested by Kawhi Herro (2.4 feet, ZONE). Franz McGrady misses. FOUL! Loose ball foul on Kawhi Herro during the rebound battle. [Team fouls: 1] No free throws, side out. (Kawhi Herro: 1 personal fouls)

[10:39] Team_086 possession (Score: 98-67)
Kyle McCollum attempts a Midrange. Contested by Kawhi Herro (3.5 feet, MAN). Kyle McCollum misses. Rebound secured by Kawhi Herro.

[10:25] Team_009 possession (Score: 98-67)
Evan Curry attempts a Layup. BLOCKED BY ANFERNEE GREEN! Ball is loose! Rebound secured by Kyle McCollum.

[10:15] Team_086 possession (Score: 98-67)
Kyle McCollum attempts a Midrange. Contested by RJ Jokic (3.9 feet, ZONE). KYLE MCCOLLUM MAKES IT!
Score: 98-69

[10:00] Team_009 possession (Score: 98-69)
Kawhi Herro loses control! Ball rolls out of bounds! TURNOVER! (dead ball)

[09:45] Team_086 possession (Score: 98-69)
FOUL! Shooting foul on Kawhi Herro. Anthony James to the line for 2 free throws. [Team fouls: 2] (Kawhi Herro: 2 personal fouls)   FT 1/2: GOOD   FT 2/2: GOOD Anthony James makes 2/2 from the line.
Score: 98-71

[09:31] Team_009 possession (Score: 98-71)
Kawhi Herro drives, picks up Lamelo Towns. Help arrives from Anfernee Green! Kawhi Herro attempts a Layup. Wide open! Anfernee Green is 6.6 feet away. [ZONE] Kawhi Herro misses. Rebound secured by Lamelo Towns.

[09:17] Team_086 possession (Score: 98-71)
Franz McGrady attempts a 3Pt. Contested by Paul Trent (4.2 feet, ZONE). FRANZ MCGRADY MAKES IT! Assist: Anfernee Green
Score: 98-74

[09:00] Team_009 possession (Score: 98-74)
Shaquille Green drives to the basket... Shaquille Green loses the ball! Stripped by Lamelo Towns! TURNOVER! (live ball)

[08:47] Team_086 possession (Score: 98-74)
Anthony James attempts a Midrange. Wide open! Evan Curry is 7.0 feet away. [MAN] Anthony James misses. FOUL! Loose ball foul on Kawhi Herro during the rebound battle. [Team fouls: 3] No free throws, side out. (Kawhi Herro: 3 personal fouls)

[08:37] Team_086 possession (Score: 98-74)
Lamelo Towns attempts a Layup. Contested by Shaquille Green (2.8 feet, MAN). LAMELO TOWNS MAKES IT! Assist: Franz McGrady
Score: 98-76

[08:24] Team_009 possession (Score: 98-76)
FOUL! Shooting foul on Lamelo Towns. Kawhi Herro to the line for 2 free throws. [Team fouls: 1] (Lamelo Towns: 1 personal fouls)   FT 1/2: GOOD   FT 2/2: GOOD Kawhi Herro makes 2/2 from the line.
Score: 100-76

[08:10] Team_086 possession (Score: 100-76)
Anthony James attempts a 3Pt. Wide open! Paul Trent is 8.1 feet away. [ZONE] Anthony James misses. Rebound secured by Kawhi Herro.

[07:58] Team_009 possession (Score: 100-76)
Kawhi Herro drives, Lamelo Towns stays with him. Kawhi Herro attempts a Layup. Contested by Lamelo Towns (5.1 feet, ZONE). KAWHI HERRO MAKES IT! Assist: Paul Trent
Score: 102-76

[07:44] Team_086 possession (Score: 102-76)
Anfernee Green attempts a 3Pt. Wide open! Paul Trent is 9.2 feet away. [ZONE] Anfernee Green misses. Rebound secured by Kawhi Herro.

[07:28] Team_009 possession (Score: 102-76)
Evan Curry drives, Lamelo Towns stays with him. Evan Curry attempts a Dunk. Contested by Lamelo Towns (2.7 feet, ZONE). EVAN CURRY MAKES IT!
Score: 104-76

[07:15] Team_086 possession (Score: 104-76)
Anthony James attempts a Layup. Wide open! Evan Curry is 9.8 feet away. [MAN] ANTHONY JAMES MAKES IT! Assist: Anfernee Green
Score: 104-78

[07:00] Team_009 possession (Score: 104-78)
Shaquille Green attempts a 3Pt. Contested by Lamelo Towns (5.3 feet, MAN). SHAQUILLE GREEN MAKES IT! Assist: Kawhi Herro
Score: 107-78

[06:45] Team_086 possession (Score: 107-78)
Franz McGrady attempts a Layup. Contested by RJ Jokic (2.2 feet, MAN). FRANZ MCGRADY MAKES IT!
Score: 107-80

[06:34] Team_009 possession (Score: 107-80)
Evan Curry attempts a 3Pt. Contested by Anfernee Green (5.0 feet, ZONE). Evan Curry misses. Rebound secured by Anfernee Green.

[06:19] Team_086 possession (Score: 107-80)
Franz McGrady attempts a 3Pt. Wide open! RJ Jokic is 7.6 feet away. [MAN] FRANZ MCGRADY MAKES IT! Assist: Kyle McCollum
Score: 107-83

[06:00] Team_009 possession (Score: 107-83)
Evan Curry attempts a Midrange. Wide open! Anthony James is 6.2 feet away. [MAN] EVAN CURRY MAKES IT! Assist: Kawhi Herro
Score: 109-83

[05:48] Team_086 possession (Score: 109-83)
Lamelo Towns drives, Kawhi Herro stays with him. Lamelo Towns attempts a Layup. Contested by Kawhi Herro (2.8 feet, ZONE). Lamelo Towns misses. Offensive rebound by Anfernee Green! Anfernee Green kicks it out.

[05:34] Team_086 possession (Score: 109-83)
Anthony James attempts a 3Pt. Contested by Paul Trent (5.9 feet, ZONE). Anthony James misses. Rebound secured by Shaquille Green.

[05:18] Team_009 possession (Score: 109-83)
Kawhi Herro attempts a 3Pt. Contested by Anfernee Green (3.4 feet, ZONE). Kawhi Herro misses. Rebound secured by Anfernee Green.

[05:05] Team_086 possession (Score: 109-83)
Lamelo Towns drives and kicks out. Franz McGrady attempts a Midrange. Contested by RJ Jokic (5.6 feet, MAN). Franz McGrady misses. Offensive rebound by Lamelo Towns! Lamelo Towns kicks it out.

[04:53] Team_086 possession (Score: 109-83)
Franz McGrady attempts a Midrange. Contested by RJ Jokic (5.7 feet, MAN). Franz McGrady misses. Rebound secured by Shaquille Green.

[04:36] Team_009 possession (Score: 109-83)
Paul Trent attempts a 3Pt. Contested by Anfernee Green (2.7 feet, MAN). PAUL TRENT MAKES IT! Assist: Evan Curry
Score: 112-83

[04:25] Team_086 possession (Score: 112-83)
Franz McGrady attempts a Layup. BLOCKED BY RJ JOKIC! Ball deflects out of bounds off Franz McGrady.

[04:10] Team_009 possession (Score: 112-83)
FOUL! Holding foul on Franz McGrady. [Team fouls: 2] No free throws, side out. (Franz McGrady: 1 personal fouls)

[03:58] Team_009 possession (Score: 112-83)
Paul Trent makes the Layup and draws the foul on Anfernee Green! And-1! Paul Trent to the line for 1. [Team fouls: 3] (Anfernee Green: 1 personal fouls)   FT 1/1: GOOD Paul Trent makes 1/1 from the line.
Score: 115-83

[03:47] Team_086 possession (Score: 115-83)
Anthony James attempts a 3Pt. Wide open! Paul Trent is 7.2 feet away. [ZONE] ANTHONY JAMES MAKES IT! Assist: Anfernee Green
Score: 115-86

[03:38] Team_009 possession (Score: 115-86)
Evan Curry drives, picks up Lamelo Towns. Help arrives from Anfernee Green! Evan Curry attempts a Dunk. Contested by Anfernee Green (5.3 feet, ZONE). EVAN CURRY MAKES IT!
Score: 117-86

[03:20] Team_086 possession (Score: 117-86)
Franz McGrady attempts a 3Pt. Wide open! RJ Jokic is 6.0 feet away. [MAN] FRANZ MCGRADY MAKES IT! Assist: Kyle McCollum
Score: 117-89

[03:06] Team_009 possession (Score: 117-89)
Shaquille Green attempts a Layup. Contested by Lamelo Towns (5.7 feet, MAN). Shaquille Green misses. Rebound secured by Lamelo Towns.

[02:52] Team_086 possession (Score: 117-89)
Anfernee Green drives and kicks out. Anthony James attempts a 3Pt. Contested by Evan Curry (4.0 feet, MAN). ANTHONY JAMES MAKES IT! Assist: Lamelo Towns
Score: 117-92

[02:37] Team_009 possession (Score: 117-92)
Paul Trent drives and kicks out. Paul Trent attempts a 3Pt. Contested by Anfernee Green (5.6 feet, ZONE). Paul Trent misses. Rebound secured by Anfernee Green.

[02:23] Team_086 possession (Score: 117-92)
Lamelo Towns attempts a 3Pt. Contested by Shaquille Green (3.3 feet, MAN). Lamelo Towns misses. Rebound secured by Shaquille Green.

[02:10] Team_009 possession (Score: 117-92)
RJ Jokic drives and kicks out. Evan Curry attempts a 3Pt. Contested by Anfernee Green (4.5 feet, ZONE). Evan Curry misses. Rebound secured by Kyle McCollum.

[01:53] Team_086 possession (Score: 117-92)
Lamelo Towns drives, picks up Shaquille Green. Help arrives from Paul Trent! Lamelo Towns attempts a Layup. Contested by Paul Trent (2.3 feet, MAN). LAMELO TOWNS MAKES IT! Assist: Kyle McCollum
Score: 117-94

[01:42] Team_009 possession (Score: 117-94)
Evan Curry drives, Lamelo Towns stays with him. Evan Curry attempts a Dunk. Contested by Lamelo Towns (5.9 feet, ZONE). Evan Curry misses. Offensive rebound by Shaquille Green! Shaquille Green kicks it out.

[01:27] Team_009 possession (Score: 117-94)
RJ Jokic attempts a Midrange. Wide open! Franz McGrady is 6.9 feet away. [MAN] RJ Jokic misses. Offensive rebound by Shaquille Green! Shaquille Green kicks it out.

[01:10] Team_009 possession (Score: 117-94)
Shaquille Green attempts a Midrange. Contested by Lamelo Towns (4.4 feet, MAN). Shaquille Green misses. Rebound secured by Anfernee Green.

[00:56] Team_086 possession (Score: 117-94)
Anfernee Green attempts a Midrange. Wide open! Evan Curry is 6.4 feet away. [ZONE] ANFERNEE GREEN MAKES IT! Assist: Anthony James
Score: 117-96

[00:41] Team_009 possession (Score: 117-96)
Kawhi Herro attempts a 3Pt. Wide open! Kyle McCollum is 7.4 feet away. [MAN] Kawhi Herro misses. Rebound secured by Lamelo Towns.

[00:27] Team_086 possession (Score: 117-96)
Lamelo Towns attempts a Midrange. Wide open! Evan Curry is 8.0 feet away. [ZONE] Lamelo Towns misses. FOUL! Loose ball foul on Shaquille Green during the rebound battle. [Team fouls: 4] No free throws, side out. (Shaquille Green: 1 personal fouls)

[00:16] Team_086 possession (Score: 117-96)
Lamelo Towns makes the Layup and draws the foul on Shaquille Green! And-1! Lamelo Towns to the line for 1. [BONUS: 5 team fouls] (Shaquille Green: 2 personal fouls)   FT 1/1: GOOD Lamelo Towns makes 1/1 from the line.
Score: 117-99

================================================================================
                              4TH QUARTER COMPLETE                              
================================================================================

4TH QUARTER SCORE: Team_009 19, Team_086 32

BOX SCORE:
================================================================================

Team_009
--------------------------------------------------------------------------------
Player                MIN  PTS  REB  AST  TO      FG   FG%      3P   3P%
--------------------------------------------------------------------------------
Paul Trent             12    6    0    1   0   2/4    50.0     0/0   0.0
Evan Curry             12    6    0    1   0   3/5    60.0     0/0   0.0
Kawhi Herro            12    4    3    2   0   2/5    40.0     0/0   0.0
Shaquille Green        12    3    5    0   0   1/4    25.0     0/0   0.0
Kyle Brogdon           37    0    0    0   0   0/1     0.0     0/0   0.0
RJ Jokic               12    0    0    0   0   0/1     0.0     0/0   0.0

TEAM: FG: 8/20 (40.0%), 3PT: 2/6 (33.3%), REB: 8 (2 off, 6 def), AST: 4, TO: 2
TEAM FOULS: 5 [Team_086 in BONUS]


Team_086
--------------------------------------------------------------------------------
Player                MIN  PTS  REB  AST  TO      FG   FG%      3P   3P%
--------------------------------------------------------------------------------
Franz McGrady          11   11    0    1   0   4/6    66.7     0/0   0.0
Anthony James          12   10    0    1   0   4/6    66.7     0/0   0.0
Lamelo Towns           12    7    6    1   0   3/4    75.0     0/0   0.0
Anfernee Green         12    2    7    3   0   1/2    50.0     0/0   0.0
Kyle McCollum          12    2    2    3   0   1/2    50.0     0/0   0.0
Miles Gobert           37    0    2    0   0   0/0     0.0     0/0   0.0

TEAM: FG: 13/20 (65.0%), 3PT: 4/8 (50.0%), REB: 17 (5 off, 12 def), AST: 9, TO: 2
TEAM FOULS: 3

================================================================================

================================================================================
                               FULL GAME COMPLETE                               
================================================================================

FINAL SCORE: Team_009 117, Team_086 99

SCORING BY QUARTER:
--------------------------------------------------------------------------------
Team                     Q1     Q2     Q3     Q4    FINAL
--------------------------------------------------------------------------------
Team_009                 33     28     37     19      117
Team_086                 15     29     23     32       99
--------------------------------------------------------------------------------

FULL GAME BOX SCORE:
================================================================================

Team_009
--------------------------------------------------------------------------------
Player                MIN  PTS  REB  AST  TO      FG   FG%      3P   3P%      FT STL BLK
--------------------------------------------------------------------------------
Miles Sabonis          37   15    0    6   1   5/10   50.0   2/4    50.0   2/2     1   0
Desmond Harden         37    4    0    4   1   5/6    83.3   1/1   100.0   2/4     3   0
Anfernee Anunoby       37   16    5    2   1   7/13   53.8   4/8    50.0   2/3     0   0
Cole Mitchell          37   44   16    1   1  17/20   85.0   4/4   100.0   9/11    0   0
Kyle Brogdon           37   15   10    6   0   6/14   42.9   0/1     0.0   7/8     0   2
Paul Trent             12    6    0    1   0   2/4    50.0   1/1   100.0   1/1     0   0
Evan Curry             12    6    0    1   1   3/5    60.0   0/1     0.0   0/0     0   0
RJ Jokic               12    0    0    0   0   0/1     0.0   0/0     0.0   0/0     0   1
Kawhi Herro            12    4    3    2   1   2/5    40.0   0/2     0.0   2/2     0   0
Shaquille Green        12    3    5    0   0   1/4    25.0   1/2    50.0   0/0     0   0

TEAM: FG: 48/82 (58.5%), 3PT: 13/24 (54.2%), REB: 40 (12 off, 28 def), AST: 23, TO: 6


Team_086
--------------------------------------------------------------------------------
Player                MIN  PTS  REB  AST  TO      FG   FG%      3P   3P%      FT STL BLK
--------------------------------------------------------------------------------
Miles Gobert           37    6   19    2   0   4/8    50.0   0/3     0.0   0/0     1   0
Lauri Johnson          37   19    0    3   5   7/12   58.3   3/4    75.0   1/2     1   0
Anfernee Harris        37    7    0    5   1   3/7    42.9   0/1     0.0   0/0     0   0
Bones Ginobili         37   16    3    3   4   8/10   80.0   1/2    50.0   1/1     0   1
Rudy Rose              37   18   13    2   2   7/15   46.7   1/2    50.0   1/1     0   3
Anfernee Green         12    2    7    3   1   2/3    66.7   0/1     0.0   0/0     0   1
Anthony James          12   10    0    1   0   3/5    60.0   1/3    33.3   2/2     0   0
Kyle McCollum          12    2    2    3   0   1/2    50.0   0/0     0.0   0/0     0   0
Lamelo Towns           12    7    6    1   0   3/4    75.0   0/1     0.0   1/1     1   0
Franz McGrady          11   11    0    1   0   4/6    66.7   3/3   100.0   0/0     0   0

TEAM: FG: 42/72 (58.3%), 3PT: 9/20 (45.0%), REB: 49 (17 off, 32 def), AST: 24, TO: 13

================================================================================
