================================================================================
                        FULL GAME - Team_038 vs Team_091                        
================================================================================

================================================================================
                       1ST QUARTER - Team_038 vs Team_091                       
================================================================================

[12:00] Team_038 possession (Score: 0-0)
Luka Barnes drives, picks up Kevin Simons. Help arrives from Kyrie Rozier! Luka Barnes attempts a Dunk. Contested by Kyrie Rozier (4.4 feet, MAN). LUKA BARNES MAKES IT! Assist: DeMar Harris
Score: 2-0

[11:48] Team_091 possession (Score: 2-0)
Rudy Bridges commits a violation (traveling/carry)! TURNOVER! (dead ball)

[11:36] Team_038 possession (Score: 2-0)
FOUL! Reach-in foul on Kevin Simons during the drive. [Team fouls: 1] No free throws, side out. (Kevin Simons: 1 personal fouls)

[11:24] Team_038 possession (Score: 2-0)
DeMar Harris makes the Dunk and draws the foul on Rudy Bridges! And-1! DeMar Harris to the line for 1. [Team fouls: 2] (Rudy Bridges: 1 personal fouls)   FT 1/1: GOOD DeMar Harris makes 1/1 from the line.
Score: 5-0

[11:12] Team_091 possession (Score: 5-0)
D'Angelo Ingram attempts a 3Pt. Contested by DeMar Harris (2.9 feet, ZONE). D'Angelo Ingram misses. Rebound secured by DeMar Harris.

[10:57] Team_038 possession (Score: 5-0)
FOUL! Shooting foul on Isaiah Siakam. Malcolm Poole to the line for 3 free throws. [Team fouls: 3] (Isaiah Siakam: 1 personal fouls)   FT 1/3: GOOD   FT 2/3: GOOD   FT 3/3: GOOD Malcolm Poole makes 3/3 from the line.
Score: 8-0

[10:43] Team_091 possession (Score: 8-0)
Rudy Bridges drives, picks up DeMar Harris. Help arrives from Malcolm Poole! Rudy Bridges attempts a Dunk. Heavily contested by Malcolm Poole (0.5 feet, MAN)! Rudy Bridges misses. Rebound secured by DeMar Harris.

[10:27] Team_038 possession (Score: 8-0)
Rudy Thompson attempts a 3Pt. Contested by Kyrie Rozier (2.3 feet, MAN). RUDY THOMPSON MAKES IT! Assist: Malcolm Poole
Score: 11-0

[10:12] Team_091 possession (Score: 11-0)
Kevin Simons drives, Tracy LaVine stays with him. Kevin Simons attempts a Dunk. Heavily contested by Tracy LaVine (0.5 feet, ZONE)! KEVIN SIMONS MAKES IT! Assist: Isaiah Siakam
Score: 11-2

[09:59] Team_038 possession (Score: 11-2)
Tracy LaVine attempts a Midrange. BLOCKED BY D'ANGELO INGRAM! Ball deflects out of bounds off Tracy LaVine.

[09:44] Team_091 possession (Score: 11-2)
FOUL! Offensive foul on Isaiah Siakam! Malcolm Poole drew the charge! [Team fouls: 4] (Isaiah Siakam: 2 personal fouls) TURNOVER! (dead ball)

[09:28] Team_038 possession (Score: 11-2)
Rudy Thompson attempts a 3Pt. Contested by Kyrie Rozier (3.8 feet, MAN). Rudy Thompson misses. Rebound secured by Kyrie Rozier.

[09:13] Team_091 possession (Score: 11-2)
Rudy Bridges attempts a 3Pt. Heavily contested by DeMar Harris (1.6 feet, ZONE)! Rudy Bridges misses. Rebound secured by Tracy LaVine.

[08:56] Team_038 possession (Score: 11-2)
Malcolm Poole attempts a Layup. Wide open! Kevin Simons is 6.1 feet away. [ZONE] MALCOLM POOLE MAKES IT!
Score: 13-2

[08:44] Team_091 possession (Score: 13-2)
Kevin Simons drives to the basket... Kevin Simons loses the ball! Stripped by Luka Barnes! TURNOVER! (live ball)

[08:31] Team_038 possession (Score: 13-2)
Malcolm Poole drives, picks up Isaiah Siakam. Help arrives from Rudy Bridges! Malcolm Poole attempts a Dunk. Wide open! Rudy Bridges is 8.1 feet away. [MAN] MALCOLM POOLE MAKES IT!
Score: 15-2

[08:12] Team_091 possession (Score: 15-2)
Kevin Simons drives, picks up Tracy LaVine. Help arrives from Malcolm Poole! Kevin Simons attempts a Dunk. Heavily contested by Malcolm Poole (1.6 feet, ZONE)! KEVIN SIMONS MAKES IT! Assist: Isaiah Siakam
Score: 15-4

[08:00] Team_038 possession (Score: 15-4)
Rudy Thompson attempts a 3Pt. Contested by Kyrie Rozier (3.0 feet, MAN). RUDY THOMPSON MAKES IT! Assist: DeMar Harris
Score: 18-4

[07:49] Team_091 possession (Score: 18-4)
Kyrie Rozier attempts a 3Pt. Contested by Rudy Thompson (4.6 feet, MAN). KYRIE ROZIER MAKES IT! Assist: Isaiah Siakam
Score: 18-7

[07:38] Team_038 possession (Score: 18-7)
Rudy Thompson attempts a Midrange. Heavily contested by Kyrie Rozier (0.9 feet, MAN)! RUDY THOMPSON MAKES IT!
Score: 20-7

[07:21] Team_091 possession (Score: 20-7)
Kyrie Rozier makes the Dunk and draws the foul on Rudy Thompson! And-1! Kyrie Rozier to the line for 1. [Team fouls: 1] (Rudy Thompson: 1 personal fouls)   FT 1/1: GOOD Kyrie Rozier makes 1/1 from the line.
Score: 20-10

[07:06] Team_038 possession (Score: 20-10)
Rudy Thompson attempts a 3Pt. Contested by Kyrie Rozier (5.1 feet, MAN). RUDY THOMPSON MAKES IT! Assist: Tracy LaVine
Score: 23-10

[06:50] Team_091 possession (Score: 23-10)
Kevin Simons drives, Luka Barnes stays with him. Kevin Simons attempts a Dunk. Contested by Luka Barnes (4.3 feet, MAN). Kevin Simons misses. Offensive rebound by Rudy Bridges! Rudy Bridges kicks it out.

[06:40] Team_091 possession (Score: 23-10)
D'Angelo Ingram drives, Tracy LaVine stays with him. D'Angelo Ingram attempts a Dunk. Contested by Tracy LaVine (3.3 feet, MAN). D'ANGELO INGRAM MAKES IT! Assist: Kyrie Rozier
Score: 23-12

[06:21] Team_038 possession (Score: 23-12)
Malcolm Poole attempts a Layup. Contested by Kevin Simons (5.5 feet, ZONE). MALCOLM POOLE MAKES IT! Assist: DeMar Harris
Score: 25-12

[06:07] Team_091 possession (Score: 25-12)
Rudy Bridges drives, Tracy LaVine stays with him. Rudy Bridges attempts a Dunk. Contested by Tracy LaVine (2.2 feet, ZONE). RUDY BRIDGES MAKES IT!
Score: 25-14

[05:54] Team_038 possession (Score: 25-14)
Rudy Thompson attempts a Layup. Wide open! Kyrie Rozier is 6.4 feet away. [MAN] RUDY THOMPSON MAKES IT! Assist: Malcolm Poole
Score: 27-14

[05:36] Team_091 possession (Score: 27-14)
Rudy Bridges drives to the basket... Rudy Bridges throws a bad pass! Stolen by Tracy LaVine! TURNOVER! (live ball)

[05:20] Team_038 possession (Score: 27-14)
Rudy Thompson drives and kicks out. DeMar Harris attempts a Midrange. Contested by D'Angelo Ingram (2.3 feet, ZONE). DeMar Harris misses. Rebound secured by Kyrie Rozier.

[05:06] Team_091 possession (Score: 27-14)
Kevin Simons attempts a Midrange. Contested by DeMar Harris (2.4 feet, ZONE). KEVIN SIMONS MAKES IT! Assist: Rudy Bridges
Score: 27-16

[04:52] Team_038 possession (Score: 27-16)
Luka Barnes drives to the basket... Luka Barnes commits a violation (traveling/carry)! TURNOVER! (dead ball)

[04:36] Team_091 possession (Score: 27-16)
Isaiah Siakam drives to the basket... Isaiah Siakam throws a bad pass! Stolen by Malcolm Poole! TURNOVER! (live ball)

[04:23] Team_038 possession (Score: 27-16)
Tracy LaVine drives, D'Angelo Ingram stays with him. Tracy LaVine attempts a Layup. Heavily contested by D'Angelo Ingram (0.9 feet, MAN)! TRACY LAVINE MAKES IT! Assist: Rudy Thompson
Score: 29-16

[04:11] Team_091 possession (Score: 29-16)
FOUL! Holding foul on DeMar Harris. [Team fouls: 2] No free throws, side out. (DeMar Harris: 1 personal fouls)

[03:53] Team_091 possession (Score: 29-16)
Isaiah Siakam drives and kicks out. Isaiah Siakam attempts a Midrange. Contested by Malcolm Poole (5.3 feet, MAN). Isaiah Siakam misses. Offensive rebound by Rudy Bridges! Rudy Bridges kicks it out.

[03:40] Team_091 possession (Score: 29-16)
Kevin Simons attempts a 3Pt. Wide open! Malcolm Poole is 9.1 feet away. [ZONE] Kevin Simons misses. Rebound secured by DeMar Harris.

[03:23] Team_038 possession (Score: 29-16)
Malcolm Poole attempts a 3Pt. Contested by Kyrie Rozier (3.3 feet, ZONE). Malcolm Poole misses. Offensive rebound by Tracy LaVine! Tracy LaVine kicks it out.

[03:13] Team_038 possession (Score: 29-16)
DeMar Harris attempts a 3Pt. Heavily contested by Kyrie Rozier (1.5 feet, ZONE)! DeMar Harris misses. Rebound secured by Kyrie Rozier.

[02:58] Team_091 possession (Score: 29-16)
Rudy Bridges attempts a Midrange. Heavily contested by DeMar Harris (0.5 feet, MAN)! Rudy Bridges misses. Rebound secured by Tracy LaVine.

[02:42] Team_038 possession (Score: 29-16)
Tracy LaVine drives and kicks out. Tracy LaVine attempts a Midrange. Wide open! D'Angelo Ingram is 6.0 feet away. [MAN] Tracy LaVine misses. Rebound secured by Kevin Simons.

[02:27] Team_091 possession (Score: 29-16)
Kyrie Rozier drives, Tracy LaVine stays with him. Kyrie Rozier attempts a Dunk. Heavily contested by Tracy LaVine (0.7 feet, ZONE)! KYRIE ROZIER MAKES IT!
Score: 29-18

[02:13] Team_038 possession (Score: 29-18)
FOUL! Reach-in foul on Rudy Bridges during the drive. [IN THE BONUS! 5 team fouls] DeMar Harris to the line for 2 free throws. (Rudy Bridges: 2 personal fouls)   FT 1/2: GOOD   FT 2/2: GOOD DeMar Harris makes 2/2 from the line.
Score: 31-18

[01:57] Team_091 possession (Score: 31-18)
Kevin Simons drives to the basket... FOUL! Offensive foul on Kevin Simons! Tracy LaVine drew the charge! [Team fouls: 6] (Kevin Simons: 2 personal fouls) TURNOVER! (dead ball)

[01:40] Team_038 possession (Score: 31-18)
Luka Barnes attempts a Midrange. Wide open! Kevin Simons is 6.2 feet away. [MAN] Luka Barnes misses. FOUL! Loose ball foul on Kyrie Rozier during the rebound battle. [IN THE BONUS! 7 team fouls] Tracy LaVine to the line for 2 free throws. (Kyrie Rozier: 1 personal fouls)   FT 1/2: GOOD   FT 2/2: GOOD Tracy LaVine makes 2/2 from the line.
Score: 33-18

[01:30] Team_091 possession (Score: 33-18)
Kyrie Rozier attempts a 3Pt. Contested by Rudy Thompson (3.5 feet, MAN). KYRIE ROZIER MAKES IT! Assist: Isaiah Siakam
Score: 33-21

[01:13] Team_038 possession (Score: 33-21)
Luka Barnes attempts a Midrange. Contested by Kevin Simons (4.0 feet, MAN). Luka Barnes misses. Rebound secured by Kyrie Rozier.

[01:01] Team_091 possession (Score: 33-21)
Kevin Simons drives to the basket... Kevin Simons throws a bad pass! Stolen by Luka Barnes! TURNOVER! (live ball)

[00:49] Team_038 possession (Score: 33-21)
Rudy Thompson attempts a 3Pt. Contested by Kyrie Rozier (3.2 feet, ZONE). Rudy Thompson misses. Rebound secured by Kyrie Rozier.

[00:38] Team_091 possession (Score: 33-21)
D'Angelo Ingram drives, Tracy LaVine stays with him. D'Angelo Ingram attempts a Dunk. Contested by Tracy LaVine (3.7 feet, MAN). D'ANGELO INGRAM MAKES IT!
Score: 33-23

[00:21] Team_038 possession (Score: 33-23)
Rudy Thompson drives, picks up Kevin Simons. Help arrives from Kyrie Rozier! Rudy Thompson attempts a Layup. Contested by Kyrie Rozier (4.5 feet, ZONE). Rudy Thompson misses. Offensive rebound by Tracy LaVine! Tracy LaVine kicks it out.

[00:01] Team_038 possession (Score: 33-23)
Malcolm Poole loses control! Ball rolls out of bounds! TURNOVER! (dead ball)

[00:01] Substitution (Team_038): Rudy Thompson OUT → Jalen Hyland IN (stamina_rule2)

[00:01] Substitution (Team_038): Malcolm Poole OUT → Jaren Jokic IN (stamina_rule2)

[00:01] Substitution (Team_038): DeMar Harris OUT → Magic Dosunmu IN (stamina_rule2)

[00:01] Substitution (Team_038): Tracy LaVine OUT → Jabari Carter IN (stamina_rule2)

[00:01] Substitution (Team_038): Luka Barnes OUT → Ja Smith IN (stamina_rule2)

[00:01] Substitution (Team_091): Kyrie Rozier OUT → Karl Morant IN (stamina_rule2)

[00:01] Substitution (Team_091): Isaiah Siakam OUT → Julius Barnes IN (stamina_rule2)

[00:01] Substitution (Team_091): Rudy Bridges OUT → Tim Antetokounmpo IN (stamina_rule2)

[00:01] Substitution (Team_091): D'Angelo Ingram OUT → Zion Mitchell IN (stamina_rule2)

[00:01] Substitution (Team_091): Kevin Simons OUT → Ja George IN (stamina_rule2)

================================================================================
                              1ST QUARTER COMPLETE                              
================================================================================

1ST QUARTER SCORE: Team_038 33, Team_091 23

BOX SCORE:
================================================================================

Team_038
--------------------------------------------------------------------------------
Player                MIN  PTS  REB  AST  TO      FG   FG%      3P   3P%
--------------------------------------------------------------------------------
Rudy Thompson          12   13    0    1   0   5/8    62.5     0/0   0.0
Malcolm Poole          12    9    0    2   0   4/4   100.0     0/0   0.0
DeMar Harris           12    5    3    3   0   2/3    66.7     0/0   0.0
Tracy LaVine           12    4    4    1   0   2/4    50.0     0/0   0.0
Luka Barnes            12    2    0    0   0   1/2    50.0     0/0   0.0

TEAM: FG: 14/21 (66.7%), 3PT: 4/7 (57.1%), REB: 7 (2 off, 5 def), AST: 7, TO: 2
TEAM FOULS: 2


Team_091
--------------------------------------------------------------------------------
Player                MIN  PTS  REB  AST  TO      FG   FG%      3P   3P%
--------------------------------------------------------------------------------
Kyrie Rozier           12   11    5    1   0   4/4   100.0     0/0   0.0
Kevin Simons           12    6    1    0   0   3/4    75.0     0/0   0.0
D'Angelo Ingram        12    4    0    0   0   2/3    66.7     0/0   0.0
Rudy Bridges           12    2    2    1   0   1/4    25.0     0/0   0.0
Isaiah Siakam          12    0    0    4   0   0/0     0.0     0/0   0.0

TEAM: FG: 10/15 (66.7%), 3PT: 2/5 (40.0%), REB: 8 (2 off, 6 def), AST: 6, TO: 7
TEAM FOULS: 7 [Team_038 in BONUS]

================================================================================

================================================================================
                       2ND QUARTER - Team_038 vs Team_091                       
================================================================================

[12:00] Team_038 possession (Score: 33-23)
FOUL! Holding foul on Kyrie Rozier. [Team fouls: 1] No free throws, side out. (Kyrie Rozier: 1 personal fouls)

[11:48] Team_038 possession (Score: 33-23)
Luka Barnes attempts a Midrange. Contested by Rudy Bridges (3.9 feet, ZONE). Luka Barnes misses. Rebound secured by Rudy Bridges.

[11:33] Team_091 possession (Score: 33-23)
Kyrie Rozier attempts a Midrange. Contested by Rudy Thompson (6.0 feet, MAN). KYRIE ROZIER MAKES IT! Assist: Isaiah Siakam
Score: 33-25

[11:20] Team_038 possession (Score: 33-25)
FOUL! Holding foul on D'Angelo Ingram. [Team fouls: 2] No free throws, side out. (D'Angelo Ingram: 1 personal fouls)

[11:07] Team_038 possession (Score: 33-25)
Tracy LaVine attempts a Layup. Contested by Kevin Simons (5.1 feet, ZONE). TRACY LAVINE MAKES IT!
Score: 35-25

[10:51] Team_091 possession (Score: 35-25)
Kyrie Rozier attempts a Midrange. Wide open! Rudy Thompson is 7.6 feet away. [MAN] KYRIE ROZIER MAKES IT!
Score: 35-27

[10:36] Team_038 possession (Score: 35-27)
Luka Barnes attempts a 3Pt. Contested by Kevin Simons (2.5 feet, MAN). Luka Barnes misses. Offensive rebound by Luka Barnes! Luka Barnes kicks it out.

[10:22] Team_038 possession (Score: 35-27)
Rudy Thompson attempts a 3Pt. Contested by Kyrie Rozier (5.5 feet, ZONE). RUDY THOMPSON MAKES IT! Assist: DeMar Harris
Score: 38-27

[10:08] Team_091 possession (Score: 38-27)
Kyrie Rozier loses control! Ball rolls out of bounds! TURNOVER! (dead ball)

[10:08] Substitution (Team_038): Rudy Thompson OUT → Jalen Hyland IN (stamina_rule2)

[10:08] Substitution (Team_038): Malcolm Poole OUT → Jaren Jokic IN (stamina_rule2)

[10:08] Substitution (Team_038): DeMar Harris OUT → Magic Dosunmu IN (stamina_rule2)

[10:08] Substitution (Team_038): Tracy LaVine OUT → Jabari Carter IN (stamina_rule2)

[10:08] Substitution (Team_038): Luka Barnes OUT → Ja Smith IN (stamina_rule2)

[10:08] Substitution (Team_091): Kyrie Rozier OUT → Karl Morant IN (stamina_rule2)

[10:08] Substitution (Team_091): Isaiah Siakam OUT → Julius Barnes IN (stamina_rule2)

[10:08] Substitution (Team_091): Rudy Bridges OUT → Tim Antetokounmpo IN (stamina_rule2)

[10:08] Substitution (Team_091): D'Angelo Ingram OUT → Zion Mitchell IN (stamina_rule2)

[10:08] Substitution (Team_091): Kevin Simons OUT → Ja George IN (stamina_rule2)

[09:52] Team_038 possession (Score: 38-27)
Magic Dosunmu attempts a Midrange. Wide open! Tim Antetokounmpo is 8.8 feet away. [ZONE] Magic Dosunmu misses. Rebound secured by Zion Mitchell.

[09:41] Team_091 possession (Score: 38-27)
Ja George attempts a Layup. Contested by Ja Smith (6.0 feet, ZONE). JA GEORGE MAKES IT!
Score: 38-29

[09:25] Team_038 possession (Score: 38-29)
Jaren Jokic attempts a Midrange. Wide open! Tim Antetokounmpo is 7.6 feet away. [ZONE] JAREN JOKIC MAKES IT!
Score: 40-29

[09:11] Team_091 possession (Score: 40-29)
Julius Barnes attempts a Layup. Contested by Jaren Jokic (3.1 feet, MAN). JULIUS BARNES MAKES IT! Assist: Tim Antetokounmpo
Score: 40-31

[08:59] Team_038 possession (Score: 40-31)
Jabari Carter attempts a Midrange. Contested by Zion Mitchell (5.3 feet, MAN). Jabari Carter misses. Rebound secured by Ja George.

[08:46] Team_091 possession (Score: 40-31)
Julius Barnes throws a bad pass! Stolen by Jaren Jokic! TURNOVER! (live ball)

[08:33] Team_038 possession (Score: 40-31)
Jaren Jokic drives and kicks out. Jabari Carter attempts a Midrange. Wide open! Zion Mitchell is 8.2 feet away. [MAN] JABARI CARTER MAKES IT!
Score: 42-31

[08:14] Team_091 possession (Score: 42-31)
Karl Morant attempts a 3Pt. Wide open! Jalen Hyland is 6.7 feet away. [MAN] Karl Morant misses. Rebound secured by Ja Smith.

[07:59] Team_038 possession (Score: 42-31)
FOUL! Holding foul on Julius Barnes. [Team fouls: 3] No free throws, side out. (Julius Barnes: 1 personal fouls)

[07:42] Team_038 possession (Score: 42-31)
Magic Dosunmu drives and kicks out. Magic Dosunmu attempts a 3Pt. Heavily contested by Tim Antetokounmpo (1.4 feet, MAN)! Magic Dosunmu misses. Rebound secured by Ja George.

[07:24] Team_091 possession (Score: 42-31)
Ja George attempts a 3Pt. Contested by Jalen Hyland (2.8 feet, ZONE). Ja George misses. Rebound secured by Jalen Hyland.

[07:07] Team_038 possession (Score: 42-31)
Jaren Jokic attempts a Midrange. Contested by Julius Barnes (4.2 feet, MAN). Jaren Jokic misses. Rebound secured by Tim Antetokounmpo.

[06:47] Team_091 possession (Score: 42-31)
Karl Morant attempts a Layup. Heavily contested by Ja Smith (0.7 feet, ZONE)! KARL MORANT MAKES IT! Assist: Ja George
Score: 42-33

[06:35] Team_038 possession (Score: 42-33)
Jalen Hyland drives to the basket... Jalen Hyland loses the ball! Stripped by Karl Morant! TURNOVER! (live ball)

[06:20] Team_091 possession (Score: 42-33)
Tim Antetokounmpo attempts a 3Pt. Heavily contested by Magic Dosunmu (1.7 feet, MAN)! Tim Antetokounmpo misses. Offensive rebound by Ja George! Ja George kicks it out.

[06:07] Team_091 possession (Score: 42-33)
Ja George drives and kicks out. Karl Morant attempts a 3Pt. Wide open! Jalen Hyland is 6.8 feet away. [ZONE] Karl Morant misses. Offensive rebound by Zion Mitchell! Zion Mitchell kicks it out.

[05:50] Team_091 possession (Score: 42-33)
FOUL! Holding foul on Ja Smith. [Team fouls: 1] No free throws, side out. (Ja Smith: 1 personal fouls)

[05:33] Team_091 possession (Score: 42-33)
Ja George commits a violation (traveling/carry)! TURNOVER! (dead ball)

[05:20] Team_038 possession (Score: 42-33)
Magic Dosunmu drives to the basket... Magic Dosunmu throws a bad pass out of bounds! TURNOVER! (dead ball)

[05:02] Team_091 possession (Score: 42-33)
Tim Antetokounmpo attempts a Midrange. Contested by Magic Dosunmu (4.7 feet, MAN). TIM ANTETOKOUNMPO MAKES IT!
Score: 42-35

[04:44] Team_038 possession (Score: 42-35)
Magic Dosunmu attempts a Midrange. Wide open! Tim Antetokounmpo is 7.6 feet away. [MAN] MAGIC DOSUNMU MAKES IT!
Score: 44-35

[04:26] Team_091 possession (Score: 44-35)
Zion Mitchell attempts a Midrange. BLOCKED BY JABARI CARTER! Ball is loose! Rebound secured by Ja Smith.

[04:08] Team_038 possession (Score: 44-35)
Jabari Carter drives and kicks out. Jaren Jokic attempts a Midrange. Wide open! Julius Barnes is 8.2 feet away. [MAN] JAREN JOKIC MAKES IT! Assist: Jabari Carter
Score: 46-35

[03:55] Team_091 possession (Score: 46-35)
Ja George drives, picks up Ja Smith. Help arrives from Jalen Hyland! Ja George attempts a Dunk. Heavily contested by Jalen Hyland (0.5 feet, ZONE)! Ja George misses. Rebound secured by Jalen Hyland.

[03:44] Team_038 possession (Score: 46-35)
Jalen Hyland attempts a Midrange. Contested by Julius Barnes (4.5 feet, ZONE). JALEN HYLAND MAKES IT!
Score: 48-35

[03:29] Team_091 possession (Score: 48-35)
Karl Morant attempts a Layup. Wide open! Jalen Hyland is 6.6 feet away. [MAN] KARL MORANT MAKES IT! Assist: Tim Antetokounmpo
Score: 48-37

[03:15] Team_038 possession (Score: 48-37)
Ja Smith drives to the basket... Ja Smith commits a violation (traveling/carry)! TURNOVER! (dead ball)

[03:02] Team_091 possession (Score: 48-37)
Ja George attempts a Midrange. Wide open! Magic Dosunmu is 6.2 feet away. [ZONE] Ja George misses. FOUL! Loose ball foul on Ja Smith during the rebound battle. [Team fouls: 2] No free throws, side out. (Ja Smith: 2 personal fouls)

[02:49] Team_091 possession (Score: 48-37)
Karl Morant attempts a Layup. Heavily contested by Ja Smith (1.8 feet, ZONE)! Karl Morant misses. Rebound secured by Jalen Hyland.

[02:35] Team_038 possession (Score: 48-37)
Jalen Hyland attempts a 3Pt. Heavily contested by Karl Morant (1.0 feet, ZONE)! Jalen Hyland misses. Rebound secured by Ja George.

[02:20] Team_091 possession (Score: 48-37)
Julius Barnes drives, picks up Jaren Jokic. Help arrives from Jalen Hyland! Julius Barnes attempts a Layup. Heavily contested by Jalen Hyland (1.6 feet, MAN)! JULIUS BARNES MAKES IT!
Score: 48-39

[02:09] Team_038 possession (Score: 48-39)
Jabari Carter drives to the basket... Jabari Carter commits a violation (traveling/carry)! TURNOVER! (dead ball)

[01:55] Team_091 possession (Score: 48-39)
Tim Antetokounmpo attempts a Midrange. Contested by Magic Dosunmu (2.6 feet, MAN). TIM ANTETOKOUNMPO MAKES IT!
Score: 48-41

[01:44] Team_038 possession (Score: 48-41)
Jabari Carter drives, Zion Mitchell stays with him. Jabari Carter attempts a Dunk. Contested by Zion Mitchell (4.7 feet, MAN). Jabari Carter misses. Rebound secured by Ja George.

[01:31] Team_091 possession (Score: 48-41)
Ja George attempts a Midrange. Contested by Jaren Jokic (5.0 feet, ZONE). JA GEORGE MAKES IT!
Score: 48-43

[01:18] Team_038 possession (Score: 48-43)
FOUL! Reach-in foul on Zion Mitchell during the drive. [Team fouls: 4] No free throws, side out. (Zion Mitchell: 1 personal fouls)

[01:04] Team_038 possession (Score: 48-43)
Jalen Hyland attempts a Layup. Contested by Karl Morant (5.8 feet, MAN). JALEN HYLAND MAKES IT! Assist: Ja Smith
Score: 50-43

[00:50] Team_091 possession (Score: 50-43)
Julius Barnes attempts a Layup. BLOCKED BY JALEN HYLAND! Ball is loose! Rebound secured by Ja Smith.

[00:34] Team_038 possession (Score: 50-43)
Ja Smith attempts a 3Pt. Contested by Karl Morant (4.3 feet, ZONE). Ja Smith misses. Rebound secured by Ja George.

[00:18] Team_091 possession (Score: 50-43)
Ja George makes the Layup and draws the foul on Ja Smith! And-1! Ja George to the line for 1. [Team fouls: 3] (Ja Smith: 3 personal fouls)   FT 1/1: GOOD Ja George makes 1/1 from the line.
Score: 50-46

[00:06] Team_038 possession (Score: 50-46)
Jalen Hyland attempts a 3Pt. Contested by Karl Morant (5.7 feet, MAN). Jalen Hyland misses. Offensive rebound by Jabari Carter! Jabari Carter's putback is no good. Offensive rebound by Jabari Carter! Jabari Carter kicks it out.

================================================================================
                              2ND QUARTER COMPLETE                              
================================================================================

2ND QUARTER SCORE: Team_038 17, Team_091 23

BOX SCORE:
================================================================================

Team_038
--------------------------------------------------------------------------------
Player                MIN  PTS  REB  AST  TO      FG   FG%      3P   3P%
--------------------------------------------------------------------------------
Jaren Jokic            10    4    0    0   0   2/3    66.7     0/0   0.0
Jalen Hyland           10    4    3    0   0   2/3    66.7     0/0   0.0
Rudy Thompson          14    3    0    0   0   1/1   100.0     0/0   0.0
Tracy LaVine           14    2    0    0   0   1/1   100.0     0/0   0.0
Magic Dosunmu          10    2    0    0   0   1/3    33.3     0/0   0.0
Jabari Carter          10    2    1    1   0   1/3    33.3     0/0   0.0
Luka Barnes            14    0    1    0   0   0/1     0.0     0/0   0.0
DeMar Harris           14    0    0    1   0   0/0     0.0     0/0   0.0
Ja Smith               10    0    3    1   0   0/1     0.0     0/0   0.0

TEAM: FG: 8/16 (50.0%), 3PT: 1/3 (33.3%), REB: 8 (2 off, 6 def), AST: 3, TO: 4
TEAM FOULS: 3


Team_091
--------------------------------------------------------------------------------
Player                MIN  PTS  REB  AST  TO      FG   FG%      3P   3P%
--------------------------------------------------------------------------------
Ja George              10    7    7    1   0   3/5    60.0     0/0   0.0
Kyrie Rozier           14    4    0    0   0   2/2   100.0     0/0   0.0
Julius Barnes          10    4    0    0   0   2/3    66.7     0/0   0.0
Tim Antetokounmpo      10    4    1    2   0   2/2   100.0     0/0   0.0
Karl Morant            10    4    0    0   0   2/4    50.0     0/0   0.0
Rudy Bridges           14    0    1    0   0   0/0     0.0     0/0   0.0
Isaiah Siakam          14    0    0    1   0   0/0     0.0     0/0   0.0
Zion Mitchell          10    0    2    0   0   0/1     0.0     0/0   0.0

TEAM: FG: 11/17 (64.7%), 3PT: 0/2 (0.0%), REB: 11 (3 off, 8 def), AST: 4, TO: 3
TEAM FOULS: 4

================================================================================

================================================================================
                       3RD QUARTER - Team_038 vs Team_091                       
================================================================================

[12:00] Team_038 possession (Score: 50-46)
Rudy Thompson attempts a 3Pt. Contested by Kyrie Rozier (3.8 feet, ZONE). RUDY THOMPSON MAKES IT! Assist: DeMar Harris
Score: 53-46

[11:44] Team_091 possession (Score: 53-46)
Kyrie Rozier attempts a 3Pt. Heavily contested by DeMar Harris (0.5 feet, ZONE)! Kyrie Rozier misses. Rebound secured by Luka Barnes.

[11:28] Team_038 possession (Score: 53-46)
DeMar Harris attempts a 3Pt. Contested by Kyrie Rozier (5.3 feet, ZONE). DEMAR HARRIS MAKES IT! Assist: Rudy Thompson
Score: 56-46

[11:08] Team_091 possession (Score: 56-46)
Kyrie Rozier attempts a 3Pt. Contested by DeMar Harris (3.1 feet, ZONE). Kyrie Rozier misses. Rebound secured by Luka Barnes.

[10:55] Team_038 possession (Score: 56-46)
Tracy LaVine attempts a Midrange. Contested by D'Angelo Ingram (5.1 feet, MAN). TRACY LAVINE MAKES IT! Assist: Rudy Thompson
Score: 58-46

[10:42] Team_091 possession (Score: 58-46)
D'Angelo Ingram attempts a 3Pt. Heavily contested by Tracy LaVine (1.2 feet, MAN)! D'Angelo Ingram misses. Offensive rebound by Kevin Simons! Kevin Simons puts it back in!
Score: 58-48

[10:28] Team_038 possession (Score: 58-48)
Luka Barnes drives to the basket... Luka Barnes throws a bad pass! Stolen by Kevin Simons! TURNOVER! (live ball)

[10:15] Team_091 possession (Score: 58-48)
Isaiah Siakam attempts a Midrange. BLOCKED BY MALCOLM POOLE! Ball is loose! Offensive rebound by Kevin Simons! Kevin Simons kicks it out.

[09:59] Team_091 possession (Score: 58-48)
Rudy Bridges attempts a Midrange. Wide open! Luka Barnes is 7.5 feet away. [ZONE] Rudy Bridges misses. Offensive rebound by Rudy Bridges! Rudy Bridges kicks it out.

[09:48] Team_091 possession (Score: 58-48)
Kevin Simons drives, Luka Barnes stays with him. Kevin Simons attempts a Dunk. Contested by Luka Barnes (2.9 feet, MAN). KEVIN SIMONS MAKES IT! Assist: Isaiah Siakam
Score: 58-50

[09:30] Team_038 possession (Score: 58-50)
Malcolm Poole attempts a Midrange. Wide open! Isaiah Siakam is 7.3 feet away. [ZONE] Malcolm Poole misses. Rebound secured by Kevin Simons.

[09:17] Team_091 possession (Score: 58-50)
Kyrie Rozier attempts a Midrange. Contested by Rudy Thompson (3.9 feet, MAN). KYRIE ROZIER MAKES IT!
Score: 58-52

[09:06] Team_038 possession (Score: 58-52)
DeMar Harris drives, Kevin Simons stays with him. DeMar Harris attempts a Layup. Contested by Kevin Simons (4.9 feet, ZONE). DEMAR HARRIS MAKES IT! Assist: Luka Barnes
Score: 60-52

[08:53] Team_091 possession (Score: 60-52)
FOUL! Shooting foul on DeMar Harris. Isaiah Siakam to the line for 3 free throws. [Team fouls: 1] (DeMar Harris: 1 personal fouls)   FT 1/3: GOOD   FT 2/3: GOOD   FT 3/3: GOOD Isaiah Siakam makes 3/3 from the line.
Score: 60-55

[08:43] Team_038 possession (Score: 60-55)
Tracy LaVine drives and kicks out. Luka Barnes attempts a Midrange. Wide open! Isaiah Siakam is 9.9 feet away. [ZONE] LUKA BARNES MAKES IT!
Score: 62-55

[08:28] Team_091 possession (Score: 62-55)
Kyrie Rozier attempts a 3Pt. Contested by Rudy Thompson (4.8 feet, MAN). Kyrie Rozier misses. Offensive rebound by Kevin Simons! Kevin Simons's putback is no good. Rebound secured by DeMar Harris.

[08:12] Team_038 possession (Score: 62-55)
Malcolm Poole attempts a 3Pt. Contested by Isaiah Siakam (5.5 feet, MAN). MALCOLM POOLE MAKES IT!
Score: 65-55

[07:58] Team_091 possession (Score: 65-55)
Isaiah Siakam drives, picks up Malcolm Poole. Help arrives from DeMar Harris! Isaiah Siakam attempts a Dunk. Contested by DeMar Harris (3.1 feet, MAN). ISAIAH SIAKAM MAKES IT!
Score: 65-57

[07:43] Team_038 possession (Score: 65-57)
DeMar Harris drives and kicks out. Malcolm Poole attempts a Midrange. Contested by Isaiah Siakam (4.8 feet, ZONE). MALCOLM POOLE MAKES IT! Assist: DeMar Harris
Score: 67-57

[07:30] Team_091 possession (Score: 67-57)
Isaiah Siakam makes the Dunk and draws the foul on Tracy LaVine! And-1! Isaiah Siakam to the line for 1. [Team fouls: 2] (Tracy LaVine: 1 personal fouls)   FT 1/1: GOOD Isaiah Siakam makes 1/1 from the line.
Score: 67-60

[07:13] Team_038 possession (Score: 67-60)
Rudy Thompson drives, Kyrie Rozier stays with him. Rudy Thompson attempts a Dunk. Wide open! Kyrie Rozier is 6.6 feet away. [MAN] RUDY THOMPSON MAKES IT!
Score: 69-60

[06:58] Team_091 possession (Score: 69-60)
Isaiah Siakam attempts a 3Pt. Heavily contested by DeMar Harris (0.5 feet, ZONE)! Isaiah Siakam misses. Rebound secured by Luka Barnes.

[06:42] Team_038 possession (Score: 69-60)
Luka Barnes attempts a 3Pt. Wide open! Isaiah Siakam is 6.7 feet away. [ZONE] Luka Barnes misses. Rebound secured by Kevin Simons.

[06:28] Team_091 possession (Score: 69-60)
Kyrie Rozier attempts a 3Pt. Contested by DeMar Harris (2.2 feet, ZONE). Kyrie Rozier misses. FOUL! Loose ball foul on Luka Barnes during the rebound battle. [Team fouls: 3] No free throws, side out. (Luka Barnes: 1 personal fouls)

[06:14] Team_091 possession (Score: 69-60)
Rudy Bridges attempts a Dunk. BLOCKED BY TRACY LAVINE! Ball is loose! Offensive rebound by Rudy Bridges! Rudy Bridges kicks it out.

[05:59] Team_091 possession (Score: 69-60)
Rudy Bridges attempts a Midrange. Contested by DeMar Harris (4.4 feet, MAN). Rudy Bridges misses. Offensive rebound by Rudy Bridges! Rudy Bridges kicks it out.

[05:50] Team_091 possession (Score: 69-60)
Isaiah Siakam makes the Midrange and draws the foul on Malcolm Poole! And-1! Isaiah Siakam to the line for 1. [Team fouls: 4] (Malcolm Poole: 1 personal fouls)   FT 1/1: GOOD Isaiah Siakam makes 1/1 from the line.
Score: 69-63

[05:36] Team_038 possession (Score: 69-63)
DeMar Harris drives and kicks out. Luka Barnes attempts a 3Pt. Contested by Kyrie Rozier (3.1 feet, ZONE). Luka Barnes misses. Rebound secured by Kyrie Rozier.

[05:24] Team_091 possession (Score: 69-63)
Kevin Simons makes the Layup and draws the foul on Luka Barnes! And-1! Kevin Simons to the line for 1. [BONUS: 5 team fouls] (Luka Barnes: 2 personal fouls)   FT 1/1: GOOD Kevin Simons makes 1/1 from the line.
Score: 69-66

[05:09] Team_038 possession (Score: 69-66)
DeMar Harris drives and kicks out. DeMar Harris attempts a 3Pt. Contested by Rudy Bridges (5.8 feet, MAN). DeMar Harris misses. Rebound secured by Kyrie Rozier.

[04:55] Team_091 possession (Score: 69-66)
Rudy Bridges loses the ball! Stripped by DeMar Harris! TURNOVER! (live ball)

[04:43] Team_038 possession (Score: 69-66)
DeMar Harris attempts a 3Pt. Wide open! Rudy Bridges is 6.3 feet away. [MAN] DeMar Harris misses. Rebound secured by Rudy Bridges.

[04:31] Team_091 possession (Score: 69-66)
FOUL! Reach-in foul on Tracy LaVine during the drive. [IN THE BONUS! 6 team fouls] Kevin Simons to the line for 2 free throws. (Tracy LaVine: 2 personal fouls)   FT 1/2: GOOD   FT 2/2: GOOD Kevin Simons makes 2/2 from the line.
Score: 69-68

[04:19] Team_038 possession (Score: 69-68)
Malcolm Poole drives, Kevin Simons stays with him. Malcolm Poole attempts a Dunk. Heavily contested by Kevin Simons (1.0 feet, ZONE)! MALCOLM POOLE MAKES IT! Assist: DeMar Harris
Score: 71-68

[04:04] Team_091 possession (Score: 71-68)
Rudy Bridges drives and kicks out. Kevin Simons attempts a 3Pt. Contested by Luka Barnes (5.1 feet, MAN). Kevin Simons misses. Rebound secured by Luka Barnes.

[03:45] Team_038 possession (Score: 71-68)
Tracy LaVine attempts a Layup. Contested by D'Angelo Ingram (4.8 feet, MAN). Tracy LaVine misses. Rebound secured by Kyrie Rozier.

[03:31] Team_091 possession (Score: 71-68)
D'Angelo Ingram attempts a Layup. Heavily contested by Tracy LaVine (0.5 feet, ZONE)! D'ANGELO INGRAM MAKES IT! Assist: Isaiah Siakam
Score: 71-70

[03:13] Team_038 possession (Score: 71-70)
FOUL! Reach-in foul on Isaiah Siakam during the drive. [Team fouls: 1] No free throws, side out. (Isaiah Siakam: 1 personal fouls)

[03:00] Team_038 possession (Score: 71-70)
Rudy Thompson drives to the basket... Rudy Thompson loses the ball! Stripped by Kyrie Rozier! TURNOVER! (live ball)

[02:43] Team_091 possession (Score: 71-70)
Kevin Simons drives to the basket... FOUL! Offensive foul on Kevin Simons! Luka Barnes drew the charge! [Team fouls: 2] (Kevin Simons: 1 personal fouls) TURNOVER! (dead ball)

[02:26] Team_038 possession (Score: 71-70)
Tracy LaVine attempts a 3Pt. Contested by D'Angelo Ingram (2.4 feet, MAN). Tracy LaVine misses. Rebound secured by Kevin Simons.

[02:13] Team_091 possession (Score: 71-70)
FOUL! Holding foul on Luka Barnes. [IN THE BONUS! 7 team fouls] Kevin Simons to the line for 2 free throws. (Luka Barnes: 3 personal fouls)   FT 1/2: MISS   FT 2/2: GOOD Kevin Simons makes 1/2 from the line.
Score: 71-71

[01:59] Team_038 possession (Score: 71-71)
Malcolm Poole drives, Kevin Simons stays with him. Malcolm Poole attempts a Dunk. Contested by Kevin Simons (2.0 feet, ZONE). MALCOLM POOLE MAKES IT! Assist: DeMar Harris
Score: 73-71

[01:44] Team_091 possession (Score: 73-71)
Kyrie Rozier drives and kicks out. Rudy Bridges makes the Midrange and draws the foul on DeMar Harris! And-1! Rudy Bridges to the line for 1. [BONUS: 8 team fouls] (DeMar Harris: 2 personal fouls)   FT 1/1: MISS Rudy Bridges makes 0/1 from the line. Rebound secured by Tracy LaVine.
Score: 73-73

[01:29] Team_038 possession (Score: 73-73)
FOUL! Reach-in foul on Kevin Simons during the drive. [Team fouls: 3] No free throws, side out. (Kevin Simons: 2 personal fouls)

[01:12] Team_038 possession (Score: 73-73)
DeMar Harris attempts a Layup. Wide open! Rudy Bridges is 7.6 feet away. [MAN] DeMar Harris misses. Rebound secured by Rudy Bridges.

[00:58] Team_091 possession (Score: 73-73)
Rudy Bridges attempts a 3Pt. Contested by DeMar Harris (3.9 feet, ZONE). Rudy Bridges misses. Rebound secured by Luka Barnes.

[00:46] Team_038 possession (Score: 73-73)
Luka Barnes attempts a Midrange. Contested by Kevin Simons (5.0 feet, ZONE). LUKA BARNES MAKES IT! Assist: Rudy Thompson
Score: 75-73

[00:34] Team_091 possession (Score: 75-73)
Isaiah Siakam attempts a 3Pt. Wide open! Tracy LaVine is 7.3 feet away. [ZONE] Isaiah Siakam misses. Rebound secured by Tracy LaVine.

[00:16] Team_038 possession (Score: 75-73)
FOUL! Shooting foul on Kyrie Rozier. Rudy Thompson to the line for 3 free throws. [Team fouls: 4] (Kyrie Rozier: 1 personal fouls)   FT 1/3: GOOD   FT 2/3: GOOD   FT 3/3: GOOD Rudy Thompson makes 3/3 from the line.
Score: 78-73

[00:01] Team_091 possession (Score: 78-73)
D'Angelo Ingram drives, Tracy LaVine stays with him. D'Angelo Ingram attempts a Dunk. Contested by Tracy LaVine (3.6 feet, MAN). D'ANGELO INGRAM MAKES IT! Assist: Isaiah Siakam
Score: 78-75

================================================================================
                              3RD QUARTER COMPLETE                              
================================================================================

3RD QUARTER SCORE: Team_038 28, Team_091 29

BOX SCORE:
================================================================================

Team_038
--------------------------------------------------------------------------------
Player                MIN  PTS  REB  AST  TO      FG   FG%      3P   3P%
--------------------------------------------------------------------------------
Malcolm Poole          27    9    0    0   0   4/5    80.0     0/0   0.0
Rudy Thompson          27    8    0    3   0   3/3   100.0     0/0   0.0
DeMar Harris           27    5    1    4   0   2/6    33.3     0/0   0.0
Luka Barnes            27    4    5    1   0   2/3    66.7     0/0   0.0
Tracy LaVine           27    2    2    0   0   1/3    33.3     0/0   0.0

TEAM: FG: 12/20 (60.0%), 3PT: 4/7 (57.1%), REB: 7 (0 off, 7 def), AST: 8, TO: 2
TEAM FOULS: 8 [Team_091 in BONUS]


Team_091
--------------------------------------------------------------------------------
Player                MIN  PTS  REB  AST  TO      FG   FG%      3P   3P%
--------------------------------------------------------------------------------
Isaiah Siakam          27   11    0    3   0   4/6    66.7     0/0   0.0
Kevin Simons           27   10    6    0   0   5/5   100.0     0/0   0.0
D'Angelo Ingram        27    4    0    0   0   2/2   100.0     0/0   0.0
Kyrie Rozier           27    2    3    0   0   1/5    20.0     0/0   0.0
Rudy Bridges           27    0    5    0   0   0/2     0.0     0/0   0.0

TEAM: FG: 12/20 (60.0%), 3PT: 2/8 (25.0%), REB: 15 (7 off, 8 def), AST: 3, TO: 2
TEAM FOULS: 4

================================================================================

================================================================================
                       4TH QUARTER - Team_038 vs Team_091                       
================================================================================

[12:00] Team_038 possession (Score: 78-75)
Rudy Thompson attempts a 3Pt. Contested by Kyrie Rozier (3.7 feet, MAN). RUDY THOMPSON MAKES IT! Assist: Tracy LaVine
Score: 81-75

[11:49] Team_091 possession (Score: 81-75)
Rudy Bridges attempts a 3Pt. Heavily contested by DeMar Harris (0.5 feet, ZONE)! Rudy Bridges misses. Rebound secured by Luka Barnes.

[11:32] Team_038 possession (Score: 81-75)
DeMar Harris attempts a 3Pt. Contested by Rudy Bridges (4.6 feet, MAN). DEMAR HARRIS MAKES IT! Assist: Luka Barnes
Score: 84-75

[11:20] Team_091 possession (Score: 84-75)
Rudy Bridges drives, picks up DeMar Harris. Help arrives from Malcolm Poole! Rudy Bridges attempts a Dunk. Contested by Malcolm Poole (4.8 feet, MAN). RUDY BRIDGES MAKES IT!
Score: 84-77

[11:08] Team_038 possession (Score: 84-77)
Tracy LaVine attempts a Layup. Heavily contested by Kevin Simons (0.5 feet, ZONE)! TRACY LAVINE MAKES IT!
Score: 86-77

[10:53] Team_091 possession (Score: 86-77)
Isaiah Siakam attempts a 3Pt. Wide open! Malcolm Poole is 6.6 feet away. [MAN] Isaiah Siakam misses. FOUL! Loose ball foul on DeMar Harris during the rebound battle. [Team fouls: 1] No free throws, side out. (DeMar Harris: 1 personal fouls)

[10:35] Team_091 possession (Score: 86-77)
Kevin Simons drives, picks up Luka Barnes. Help arrives from Malcolm Poole! Kevin Simons attempts a Layup. Wide open! Malcolm Poole is 7.3 feet away. [ZONE] KEVIN SIMONS MAKES IT!
Score: 86-79

[10:21] Team_038 possession (Score: 86-79)
Luka Barnes drives, Kevin Simons stays with him. Luka Barnes attempts a Layup. Contested by Kevin Simons (3.8 feet, ZONE). LUKA BARNES MAKES IT!
Score: 88-79

[10:08] Team_091 possession (Score: 88-79)
D'Angelo Ingram drives, Tracy LaVine stays with him. D'Angelo Ingram attempts a Dunk. Wide open! Tracy LaVine is 7.1 feet away. [ZONE] D'Angelo Ingram misses. Rebound secured by Tracy LaVine.

[09:54] Team_038 possession (Score: 88-79)
Luka Barnes drives, Kevin Simons stays with him. Luka Barnes attempts a Layup. Contested by Kevin Simons (3.0 feet, MAN). Luka Barnes misses. Rebound secured by Kevin Simons.

[09:37] Team_091 possession (Score: 88-79)
Rudy Bridges attempts a 3Pt. Wide open! DeMar Harris is 6.2 feet away. [MAN] RUDY BRIDGES MAKES IT! Assist: Kevin Simons
Score: 88-82

[09:25] Team_038 possession (Score: 88-82)
Rudy Thompson attempts a Midrange. Contested by Isaiah Siakam (5.9 feet, ZONE). RUDY THOMPSON MAKES IT!
Score: 90-82

[09:11] Team_091 possession (Score: 90-82)
Kevin Simons throws a bad pass! Stolen by Luka Barnes! TURNOVER! (live ball)

[08:57] Team_038 possession (Score: 90-82)
DeMar Harris attempts a Layup. Wide open! Rudy Bridges is 6.1 feet away. [MAN] DEMAR HARRIS MAKES IT!
Score: 92-82

[08:38] Team_091 possession (Score: 92-82)
Rudy Bridges attempts a Midrange. Contested by Tracy LaVine (3.5 feet, ZONE). Rudy Bridges misses. Rebound secured by Tracy LaVine.

[08:22] Team_038 possession (Score: 92-82)
Malcolm Poole attempts a 3Pt. Wide open! Kyrie Rozier is 6.3 feet away. [ZONE] Malcolm Poole misses. Rebound secured by Kevin Simons.

[08:08] Team_091 possession (Score: 92-82)
FOUL! Holding foul on DeMar Harris. [Team fouls: 2] No free throws, side out. (DeMar Harris: 2 personal fouls)

[07:49] Team_091 possession (Score: 92-82)
D'Angelo Ingram attempts a Midrange. Wide open! Tracy LaVine is 7.4 feet away. [ZONE] D'Angelo Ingram misses. Rebound secured by DeMar Harris.

[07:34] Team_038 possession (Score: 92-82)
Rudy Thompson attempts a 3Pt. Contested by Kyrie Rozier (4.6 feet, ZONE). RUDY THOMPSON MAKES IT! Assist: Tracy LaVine
Score: 95-82

[07:21] Team_091 possession (Score: 95-82)
Kyrie Rozier attempts a 3Pt. Wide open! Rudy Thompson is 9.5 feet away. [MAN] KYRIE ROZIER MAKES IT! Assist: Rudy Bridges
Score: 95-85

[07:08] Team_038 possession (Score: 95-85)
Malcolm Poole loses control! Ball rolls out of bounds! TURNOVER! (dead ball)

[07:08] Substitution (Team_038): Rudy Thompson OUT → Jalen Hyland IN (stamina_rule2)

[07:08] Substitution (Team_038): Malcolm Poole OUT → Jaren Jokic IN (stamina_rule2)

[07:08] Substitution (Team_038): DeMar Harris OUT → Magic Dosunmu IN (stamina_rule2)

[07:08] Substitution (Team_038): Tracy LaVine OUT → Jabari Carter IN (stamina_rule2)

[07:08] Substitution (Team_038): Luka Barnes OUT → Ja Smith IN (stamina_rule2)

[07:08] Substitution (Team_091): Kyrie Rozier OUT → Karl Morant IN (stamina_rule2)

[07:08] Substitution (Team_091): Isaiah Siakam OUT → Julius Barnes IN (stamina_rule2)

[07:08] Substitution (Team_091): Rudy Bridges OUT → Tim Antetokounmpo IN (stamina_rule2)

[07:08] Substitution (Team_091): D'Angelo Ingram OUT → Zion Mitchell IN (stamina_rule2)

[07:08] Substitution (Team_091): Kevin Simons OUT → Ja George IN (stamina_rule2)

[06:53] Team_091 possession (Score: 95-85)
Zion Mitchell drives, Ja Smith stays with him. Zion Mitchell attempts a Layup. Wide open! Ja Smith is 6.3 feet away. [ZONE] ZION MITCHELL MAKES IT! Assist: Julius Barnes
Score: 95-87

[06:40] Team_038 possession (Score: 95-87)
Jalen Hyland attempts a 3Pt. Contested by Karl Morant (4.4 feet, MAN). Jalen Hyland misses. Rebound secured by Ja George.

[06:26] Team_091 possession (Score: 95-87)
Tim Antetokounmpo drives and kicks out. Julius Barnes attempts a 3Pt. Contested by Jalen Hyland (3.7 feet, ZONE). Julius Barnes misses. Offensive rebound by Ja George! Ja George kicks it out.

[06:11] Team_091 possession (Score: 95-87)
FOUL! Holding foul on Jaren Jokic. [Team fouls: 3] No free throws, side out. (Jaren Jokic: 1 personal fouls)

[06:00] Team_091 possession (Score: 95-87)
Ja George attempts a Midrange. Heavily contested by Ja Smith (1.6 feet, MAN)! Ja George misses. Offensive rebound by Zion Mitchell! Zion Mitchell kicks it out.

[05:45] Team_091 possession (Score: 95-87)
Julius Barnes attempts a 3Pt. Heavily contested by Jalen Hyland (1.5 feet, ZONE)! Julius Barnes misses. Rebound secured by Ja Smith.

[05:28] Team_038 possession (Score: 95-87)
Jalen Hyland attempts a Midrange. Contested by Tim Antetokounmpo (5.7 feet, ZONE). Jalen Hyland misses. Offensive rebound by Ja Smith! Ja Smith puts it back in!
Score: 97-87

[05:17] Team_091 possession (Score: 97-87)
Julius Barnes drives, picks up Ja Smith. Help arrives from Jalen Hyland! Julius Barnes attempts a Layup. Heavily contested by Jalen Hyland (0.5 feet, ZONE)! Julius Barnes misses. Rebound secured by Jalen Hyland.

[05:04] Team_038 possession (Score: 97-87)
Magic Dosunmu attempts a Midrange. Contested by Tim Antetokounmpo (5.4 feet, MAN). MAGIC DOSUNMU MAKES IT! Assist: Jaren Jokic
Score: 99-87

[04:46] Team_091 possession (Score: 99-87)
Tim Antetokounmpo drives, picks up Magic Dosunmu. Help arrives from Jalen Hyland! Tim Antetokounmpo attempts a Layup. Contested by Jalen Hyland (5.3 feet, MAN). Tim Antetokounmpo misses. Rebound secured by Jalen Hyland.

[04:32] Team_038 possession (Score: 99-87)
Jalen Hyland attempts a Midrange. Contested by Karl Morant (2.2 feet, MAN). Jalen Hyland misses. Rebound secured by Zion Mitchell.

[04:22] Team_091 possession (Score: 99-87)
FOUL! Offensive foul on Julius Barnes! Jaren Jokic drew the charge! [Team fouls: 1] (Julius Barnes: 1 personal fouls) TURNOVER! (dead ball)

[04:06] Team_038 possession (Score: 99-87)
Magic Dosunmu drives and kicks out. Jaren Jokic attempts a 3Pt. Wide open! Julius Barnes is 6.7 feet away. [MAN] JAREN JOKIC MAKES IT! Assist: Ja Smith
Score: 102-87

[03:51] Team_091 possession (Score: 102-87)
Ja George attempts a Midrange. Contested by Ja Smith (5.2 feet, ZONE). JA GEORGE MAKES IT! Assist: Karl Morant
Score: 102-89

[03:37] Team_038 possession (Score: 102-89)
Jalen Hyland makes the Dunk and draws the foul on Zion Mitchell! And-1! Jalen Hyland to the line for 1. [Team fouls: 2] (Zion Mitchell: 1 personal fouls)   FT 1/1: GOOD Jalen Hyland makes 1/1 from the line.
Score: 105-89

[03:25] Team_091 possession (Score: 105-89)
Ja George attempts a Layup. Contested by Ja Smith (3.7 feet, ZONE). Ja George misses. Offensive rebound by Ja George! Ja George kicks it out.

[03:07] Team_091 possession (Score: 105-89)
Julius Barnes attempts a 3Pt. Contested by Jaren Jokic (4.9 feet, MAN). JULIUS BARNES MAKES IT! Assist: Karl Morant
Score: 105-92

[02:53] Team_038 possession (Score: 105-92)
Magic Dosunmu drives, Tim Antetokounmpo stays with him. Magic Dosunmu attempts a Dunk. Wide open! Tim Antetokounmpo is 7.3 feet away. [MAN] Magic Dosunmu misses. Rebound secured by Ja George.

[02:39] Team_091 possession (Score: 105-92)
Julius Barnes drives to the basket... FOUL! Offensive foul on Julius Barnes! Ja Smith drew the charge! [Team fouls: 3] (Julius Barnes: 2 personal fouls) TURNOVER! (dead ball)

[02:28] Team_038 possession (Score: 105-92)
Jaren Jokic attempts a Layup. BLOCKED BY TIM ANTETOKOUNMPO! Ball goes out off Tim Antetokounmpo. Jaren Jokic's ball!

[02:11] Team_038 possession (Score: 105-92)
FOUL! Shooting foul on Zion Mitchell. Jabari Carter to the line for 3 free throws. [Team fouls: 4] (Zion Mitchell: 2 personal fouls)   FT 1/3: GOOD   FT 2/3: GOOD   FT 3/3: GOOD Jabari Carter makes 3/3 from the line.
Score: 108-92

[01:59] Team_091 possession (Score: 108-92)
Zion Mitchell drives, Jabari Carter stays with him. Zion Mitchell attempts a Dunk. Contested by Jabari Carter (2.7 feet, MAN). ZION MITCHELL MAKES IT!
Score: 108-94

[01:43] Team_038 possession (Score: 108-94)
FOUL! Shooting foul on Karl Morant. Jalen Hyland to the line for 3 free throws. [BONUS: 5 team fouls] (Karl Morant: 1 personal fouls)   FT 1/3: GOOD   FT 2/3: GOOD   FT 3/3: MISS Jalen Hyland makes 2/3 from the line. Rebound secured by Tim Antetokounmpo.
Score: 110-94

[01:28] Team_091 possession (Score: 110-94)
Tim Antetokounmpo attempts a Layup. BLOCKED BY MAGIC DOSUNMU! Ball is loose! Rebound secured by Ja Smith.

[01:12] Team_038 possession (Score: 110-94)
Jabari Carter drives, picks up Zion Mitchell. Help arrives from Karl Morant! Jabari Carter attempts a Dunk. Contested by Karl Morant (5.0 feet, MAN). Jabari Carter misses. Rebound secured by Zion Mitchell.

[00:55] Team_091 possession (Score: 110-94)
Tim Antetokounmpo drives to the basket... Tim Antetokounmpo loses control! Ball rolls out of bounds! TURNOVER! (dead ball)

[00:39] Team_038 possession (Score: 110-94)
Magic Dosunmu makes the 3Pt and draws the foul on Karl Morant! And-1! Magic Dosunmu to the line for 1. [BONUS: 6 team fouls] (Karl Morant: 2 personal fouls)   FT 1/1: GOOD Magic Dosunmu makes 1/1 from the line.
Score: 114-94

[00:20] Team_091 possession (Score: 114-94)
FOUL! Holding foul on Jaren Jokic. [Team fouls: 4] No free throws, side out. (Jaren Jokic: 2 personal fouls)

[00:06] Team_091 possession (Score: 114-94)
Julius Barnes attempts a 3Pt. Wide open! Jaren Jokic is 6.0 feet away. [MAN] Julius Barnes misses. FOUL! Loose ball foul on Jabari Carter during the rebound battle. [IN THE BONUS! 5 team fouls] Zion Mitchell to the line for 2 free throws. (Jabari Carter: 1 personal fouls)   FT 1/2: GOOD   FT 2/2: GOOD Zion Mitchell makes 2/2 from the line.
Score: 114-96

================================================================================
                              4TH QUARTER COMPLETE                              
================================================================================

4TH QUARTER SCORE: Team_038 36, Team_091 21

BOX SCORE:
================================================================================

Team_038
--------------------------------------------------------------------------------
Player                MIN  PTS  REB  AST  TO      FG   FG%      3P   3P%
--------------------------------------------------------------------------------
Rudy Thompson          32    8    0    0   0   3/3   100.0     0/0   0.0
Magic Dosunmu          17    6    0    0   0   2/3    66.7     0/0   0.0
DeMar Harris           32    5    1    0   0   2/2   100.0     0/0   0.0
Jalen Hyland           17    3    2    0   0   1/4    25.0     0/0   0.0
Jaren Jokic            17    3    0    1   0   1/1   100.0     0/0   0.0
Jabari Carter          17    3    0    0   0   1/2    50.0     0/0   0.0
Tracy LaVine           32    2    2    2   0   1/1   100.0     0/0   0.0
Luka Barnes            32    2    1    1   0   1/2    50.0     0/0   0.0
Ja Smith               17    2    3    1   0   1/1   100.0     0/0   0.0
Malcolm Poole          32    0    0    0   0   0/1     0.0     0/0   0.0

TEAM: FG: 13/20 (65.0%), 3PT: 5/8 (62.5%), REB: 9 (1 off, 8 def), AST: 5, TO: 1
TEAM FOULS: 5 [Team_091 in BONUS]


Team_091
--------------------------------------------------------------------------------
Player                MIN  PTS  REB  AST  TO      FG   FG%      3P   3P%
--------------------------------------------------------------------------------
Zion Mitchell          17    6    3    0   0   3/3   100.0     0/0   0.0
Rudy Bridges           32    5    1    1   0   2/4    50.0     0/0   0.0
Kyrie Rozier           32    3    0    0   0   1/1   100.0     0/0   0.0
Julius Barnes          17    3    0    1   0   1/3    33.3     0/0   0.0
Kevin Simons           32    2    2    1   0   1/1   100.0     0/0   0.0
Ja George              17    2    4    0   0   1/1   100.0     0/0   0.0
D'Angelo Ingram        32    0    0    0   0   0/2     0.0     0/0   0.0
Tim Antetokounmpo      17    0    1    0   0   0/2     0.0     0/0   0.0
Karl Morant            17    0    0    2   0   0/0     0.0     0/0   0.0

TEAM: FG: 9/17 (52.9%), 3PT: 4/6 (66.7%), REB: 11 (4 off, 7 def), AST: 5, TO: 4
TEAM FOULS: 6 [Team_038 in BONUS]

================================================================================

================================================================================
                               FULL GAME COMPLETE                               
================================================================================

FINAL SCORE: Team_038 114, Team_091 96

SCORING BY QUARTER:
--------------------------------------------------------------------------------
Team                     Q1     Q2     Q3     Q4    FINAL
--------------------------------------------------------------------------------
Team_038                 33     17     28     36      114
Team_091                 23     23     29     21       96
--------------------------------------------------------------------------------

FULL GAME BOX SCORE:
================================================================================

Team_038
--------------------------------------------------------------------------------
Player                MIN  PTS  REB  AST  TO      FG   FG%      3P   3P%      FT STL BLK
--------------------------------------------------------------------------------
Rudy Thompson          32   32    0    4   0  12/15   80.0   8/10   80.0   3/3     0   0
Malcolm Poole          32   18    0    2   4   7/9    77.8   2/3    66.7   3/3     1   1
DeMar Harris           32   15    5    8   0   7/12   58.3   2/4    50.0   3/3     1   0
Tracy LaVine           32   10    8    3   1   5/9    55.6   0/1     0.0   2/2     1   1
Luka Barnes            32    8    7    2   0   4/8    50.0   0/1     0.0   0/0     3   0
Jalen Hyland           17    7    5    0   1   4/8    50.0   0/3     0.0   3/4     0   1
Jaren Jokic            17    7    0    1   1   2/3    66.7   0/0     0.0   0/0     1   0
Magic Dosunmu          17    8    0    0   0   4/7    57.1   1/1   100.0   1/1     0   1
Jabari Carter          17    5    1    1   2   2/5    40.0   1/1   100.0   3/3     0   1
Ja Smith               17    2    6    2   0   0/1     0.0   0/1     0.0   0/0     0   0

TEAM: FG: 47/77 (61.0%), 3PT: 14/25 (56.0%), REB: 31 (5 off, 26 def), AST: 23, TO: 9


Team_091
--------------------------------------------------------------------------------
Player                MIN  PTS  REB  AST  TO      FG   FG%      3P   3P%      FT STL BLK
--------------------------------------------------------------------------------
Kyrie Rozier           32   20    8    1   2   8/12   66.7   3/6    50.0   1/1     1   0
Isaiah Siakam          32   11    0    8   3   4/6    66.7   1/3    33.3   5/5     0   0
Rudy Bridges           32    7    9    2   4   3/10   30.0   1/4    25.0   0/1     0   0
D'Angelo Ingram        32    8    0    0   1   5/8    62.5   1/2    50.0   0/0     0   1
Kevin Simons           32   18    9    1   1   7/8    87.5   0/1     0.0   4/5     1   0
Karl Morant            17    4    0    2   0   2/4    50.0   0/1     0.0   0/0     1   0
Julius Barnes          17    7    0    1   2   4/7    57.1   2/3    66.7   0/0     0   0
Tim Antetokounmpo      17    4    2    2   1   2/4    50.0   0/0     0.0   0/0     0   1
Zion Mitchell          17    6    5    0   0   2/3    66.7   0/0     0.0   2/2     0   0
Ja George              17    9   11    1   2   4/6    66.7   0/1     0.0   1/1     0   0

TEAM: FG: 42/69 (60.9%), 3PT: 8/21 (38.1%), REB: 45 (16 off, 29 def), AST: 18, TO: 16

================================================================================
