================================================================================
                        FULL GAME - Team_045 vs Team_057                        
================================================================================

================================================================================
                       1ST QUARTER - Team_045 vs Team_057                       
================================================================================

[12:00] Team_045 possession (Score: 0-0)
FOUL! Reach-in foul on Ben Adebayo during the drive. [Team fouls: 1] No free throws, side out. (Ben Adebayo: 1 personal fouls)

[11:50] Team_045 possession (Score: 0-0)
Cole Simons attempts a Midrange. Wide open! Anfernee Adebayo is 6.9 feet away. [MAN] Cole Simons misses. Rebound secured by Miles Middleton.

[11:39] Team_057 possession (Score: 0-0)
Anfernee Adebayo attempts a 3Pt. Contested by Cole Simons (6.0 feet, ZONE). Anfernee Adebayo misses. Rebound secured by DeMar Turner.

[11:19] Team_045 possession (Score: 0-0)
Cole Simons attempts a 3Pt. Wide open! Anfernee Adebayo is 6.1 feet away. [MAN] Cole Simons misses. Rebound secured by Ben Adebayo.

[11:02] Team_057 possession (Score: 0-0)
Kobe Ming throws a bad pass out of bounds! TURNOVER! (dead ball)

[10:45] Team_045 possession (Score: 0-0)
Zion Butler makes the Layup and draws the foul on Ben Adebayo! And-1! Zion Butler to the line for 1. [Team fouls: 2] (Ben Adebayo: 2 personal fouls)   FT 1/1: GOOD Zion Butler makes 1/1 from the line.
Score: 3-0

[10:28] Team_057 possession (Score: 3-0)
Kobe Ming attempts a 3Pt. Contested by Rudy Antetokounmpo (5.9 feet, MAN). Kobe Ming misses. Rebound secured by Zion Butler.

[10:13] Team_045 possession (Score: 3-0)
Rudy Antetokounmpo loses control! Ball rolls out of bounds! TURNOVER! (dead ball)

[10:02] Team_057 possession (Score: 3-0)
Kobe Ming drives to the basket... Kobe Ming loses control! Ball rolls out of bounds! TURNOVER! (dead ball)

[09:48] Team_045 possession (Score: 3-0)
Trae Russell attempts a Midrange. Contested by Anfernee Adebayo (4.3 feet, ZONE). TRAE RUSSELL MAKES IT! Assist: Rudy Antetokounmpo
Score: 5-0

[09:35] Team_057 possession (Score: 5-0)
Anfernee Adebayo attempts a Layup. Heavily contested by Cole Simons (0.5 feet, MAN)! Anfernee Adebayo misses. FOUL! Loose ball foul on DeMar Turner during the rebound battle. [Team fouls: 1] No free throws, side out. (DeMar Turner: 1 personal fouls)

[09:21] Team_057 possession (Score: 5-0)
FOUL! Reach-in foul on Cole Simons during the drive. [Team fouls: 2] No free throws, side out. (Cole Simons: 1 personal fouls)

[09:06] Team_057 possession (Score: 5-0)
Miles Middleton drives, Zion Butler stays with him. Miles Middleton attempts a Layup. Contested by Zion Butler (5.1 feet, MAN). MILES MIDDLETON MAKES IT! Assist: Kobe Ming
Score: 5-2

[08:48] Team_045 possession (Score: 5-2)
FOUL! Reach-in foul on Ben Adebayo during the drive. [Team fouls: 3] No free throws, side out. (Ben Adebayo: 3 personal fouls)

[08:35] Team_045 possession (Score: 5-2)
Zion Butler attempts a 3Pt. Contested by Miles Middleton (3.0 feet, MAN). Zion Butler misses. Rebound secured by Miles Middleton.

[08:21] Team_057 possession (Score: 5-2)
Ben Adebayo makes the Dunk and draws the foul on Zion Butler! And-1! Ben Adebayo to the line for 1. [Team fouls: 3] (Zion Butler: 1 personal fouls)   FT 1/1: GOOD Ben Adebayo makes 1/1 from the line.
Score: 5-5

[08:05] Team_045 possession (Score: 5-5)
Trae Russell attempts a Midrange. Wide open! Ben Adebayo is 6.5 feet away. [ZONE] Trae Russell misses. Rebound secured by Anfernee Adebayo.

[07:50] Team_057 possession (Score: 5-5)
Ben Adebayo drives and kicks out. Anfernee Adebayo attempts a Midrange. Contested by Trae Russell (5.0 feet, ZONE). ANFERNEE ADEBAYO MAKES IT! Assist: Ben Adebayo
Score: 5-7

[07:32] Team_045 possession (Score: 5-7)
Zion Butler loses control! Ball rolls out of bounds! TURNOVER! (dead ball)

[07:20] Team_057 possession (Score: 5-7)
Kobe Ming attempts a 3Pt. Contested by Rudy Antetokounmpo (3.2 feet, MAN). Kobe Ming misses. Rebound secured by DeMar Turner.

[07:08] Team_045 possession (Score: 5-7)
Cole Simons attempts a Midrange. Contested by Anfernee Adebayo (3.8 feet, MAN). Cole Simons misses. Rebound secured by Anfernee Adebayo.

[06:53] Team_057 possession (Score: 5-7)
FOUL! Shooting foul on Zion Butler. Ben Adebayo to the line for 2 free throws. [Team fouls: 4] (Zion Butler: 2 personal fouls)   FT 1/2: GOOD   FT 2/2: GOOD Ben Adebayo makes 2/2 from the line.
Score: 5-9

[06:43] Team_045 possession (Score: 5-9)
FOUL! Offensive foul on Trae Russell! Klay Rozier drew the charge! [Team fouls: 5] (Trae Russell: 1 personal fouls) TURNOVER! (dead ball)

[06:28] Team_057 possession (Score: 5-9)
Ben Adebayo throws a bad pass out of bounds! TURNOVER! (dead ball)

[06:12] Team_045 possession (Score: 5-9)
Cole Simons attempts a Midrange. Contested by Ben Adebayo (4.6 feet, ZONE). Cole Simons misses. Rebound secured by Miles Middleton.

[05:58] Team_057 possession (Score: 5-9)
Kobe Ming drives and kicks out. Anfernee Adebayo attempts a 3Pt. Contested by Cole Simons (2.3 feet, MAN). Anfernee Adebayo misses. Rebound secured by Cole Simons.

[05:44] Team_045 possession (Score: 5-9)
DeMar Turner attempts a 3Pt. Contested by Kobe Ming (5.9 feet, ZONE). DeMar Turner misses. FOUL! Loose ball foul on Ben Adebayo during the rebound battle. [Team fouls: 4] No free throws, side out. (Ben Adebayo: 4 personal fouls)

[05:30] Team_045 possession (Score: 5-9)
DeMar Turner attempts a Midrange. Contested by Ben Adebayo (5.2 feet, MAN). DEMAR TURNER MAKES IT!
Score: 7-9

[05:15] Team_057 possession (Score: 7-9)
Ben Adebayo drives, DeMar Turner stays with him. Ben Adebayo attempts a Dunk. Contested by DeMar Turner (4.4 feet, MAN). BEN ADEBAYO MAKES IT! Assist: Miles Middleton
Score: 7-11

[04:56] Team_045 possession (Score: 7-11)
Cole Simons attempts a Midrange. Contested by Anfernee Adebayo (5.9 feet, MAN). COLE SIMONS MAKES IT! Assist: Zion Butler
Score: 9-11

[04:43] Team_057 possession (Score: 9-11)
Kobe Ming throws a bad pass! Stolen by Rudy Antetokounmpo! TURNOVER! (live ball)

[04:33] Team_045 possession (Score: 9-11)
Rudy Antetokounmpo drives, Kobe Ming stays with him. Rudy Antetokounmpo attempts a Layup. Heavily contested by Kobe Ming (1.9 feet, MAN)! Rudy Antetokounmpo misses. Rebound secured by Ben Adebayo.

[04:15] Team_057 possession (Score: 9-11)
Ben Adebayo attempts a 3Pt. Heavily contested by Cole Simons (1.2 feet, ZONE)! Ben Adebayo misses. Rebound secured by Cole Simons.

[04:00] Team_045 possession (Score: 9-11)
DeMar Turner attempts a Midrange. Wide open! Klay Rozier is 8.6 feet away. [ZONE] DEMAR TURNER MAKES IT!
Score: 11-11

[03:46] Team_057 possession (Score: 11-11)
FOUL! Holding foul on Cole Simons. [IN THE BONUS! 6 team fouls] Klay Rozier to the line for 2 free throws. (Cole Simons: 2 personal fouls)   FT 1/2: GOOD   FT 2/2: GOOD Klay Rozier makes 2/2 from the line.
Score: 11-13

[03:36] Team_045 possession (Score: 11-13)
FOUL! Shooting foul on Klay Rozier. DeMar Turner to the line for 2 free throws. [BONUS: 5 team fouls] (Klay Rozier: 1 personal fouls)   FT 1/2: GOOD   FT 2/2: GOOD DeMar Turner makes 2/2 from the line.
Score: 13-13

[03:18] Team_057 possession (Score: 13-13)
Kobe Ming attempts a 3Pt. Contested by Rudy Antetokounmpo (5.7 feet, MAN). Kobe Ming misses. Rebound secured by Cole Simons.

[03:07] Team_045 possession (Score: 13-13)
FOUL! Holding foul on Miles Middleton. [IN THE BONUS! 6 team fouls] Zion Butler to the line for 2 free throws. (Miles Middleton: 1 personal fouls)   FT 1/2: GOOD   FT 2/2: GOOD Zion Butler makes 2/2 from the line.
Score: 15-13

[02:57] Team_057 possession (Score: 15-13)
Anfernee Adebayo attempts a 3Pt. Contested by Cole Simons (2.4 feet, ZONE). ANFERNEE ADEBAYO MAKES IT! Assist: Klay Rozier
Score: 15-16

[02:45] Team_045 possession (Score: 15-16)
Rudy Antetokounmpo attempts a 3Pt. Contested by Kobe Ming (5.5 feet, ZONE). Rudy Antetokounmpo misses. Rebound secured by Anfernee Adebayo.

[02:30] Team_057 possession (Score: 15-16)
Ben Adebayo throws a bad pass! Stolen by DeMar Turner! TURNOVER! (live ball)

[02:19] Team_045 possession (Score: 15-16)
Cole Simons attempts a Layup. BLOCKED BY BEN ADEBAYO! Ball deflects out of bounds off Cole Simons.

[02:01] Team_057 possession (Score: 15-16)
Ben Adebayo attempts a Midrange. Contested by Rudy Antetokounmpo (5.4 feet, ZONE). Ben Adebayo misses. Rebound secured by Zion Butler.

[01:51] Team_045 possession (Score: 15-16)
Trae Russell makes the Midrange and draws the foul on Ben Adebayo! And-1! Trae Russell to the line for 1. [BONUS: 7 team fouls] (Ben Adebayo: 5 personal fouls)   FT 1/1: GOOD Trae Russell makes 1/1 from the line.
Score: 18-16

[01:36] Team_057 possession (Score: 18-16)
Kobe Ming drives and kicks out. Ben Adebayo attempts a 3Pt. Wide open! DeMar Turner is 8.6 feet away. [MAN] BEN ADEBAYO MAKES IT! Assist: Miles Middleton
Score: 18-19

[01:20] Team_045 possession (Score: 18-19)
DeMar Turner attempts a 3Pt. Wide open! Ben Adebayo is 6.3 feet away. [MAN] DeMar Turner misses. Rebound secured by Anfernee Adebayo.

[01:09] Team_057 possession (Score: 18-19)
Anfernee Adebayo drives to the basket... Anfernee Adebayo throws a bad pass out of bounds! TURNOVER! (dead ball)

[01:09] Substitution (Team_045): Rudy Antetokounmpo OUT → John Wagner IN (stamina_rule2)

[01:09] Substitution (Team_045): Trae Russell OUT → Julius James IN (stamina_rule2)

[01:09] Substitution (Team_045): Cole Simons OUT → Gary Towns IN (stamina_rule2)

[01:09] Substitution (Team_045): DeMar Turner OUT → Tim Sexton IN (stamina_rule2)

[01:09] Substitution (Team_045): Zion Butler OUT → Stephen Paul IN (stamina_rule2)

[01:09] Substitution (Team_057): Kobe Ming OUT → Scottie Johnson IN (stamina_rule2)

[01:09] Substitution (Team_057): Klay Rozier OUT → Bradley Ginobili IN (stamina_rule2)

[01:09] Substitution (Team_057): Anfernee Adebayo OUT → Joel Wade IN (stamina_rule2)

[01:09] Substitution (Team_057): Ben Adebayo OUT → Lamelo Irving IN (stamina_rule2)

[01:09] Substitution (Team_057): Miles Middleton OUT → Zion Lillard IN (stamina_rule2)

[00:50] Team_045 possession (Score: 18-19)
John Wagner attempts a 3Pt. Contested by Scottie Johnson (3.8 feet, MAN). John Wagner misses. FOUL! Loose ball foul on Joel Wade during the rebound battle. [IN THE BONUS! 8 team fouls] Julius James to the line for 2 free throws. (Joel Wade: 1 personal fouls)   FT 1/2: GOOD   FT 2/2: GOOD Julius James makes 2/2 from the line.
Score: 20-19

[00:32] Team_057 possession (Score: 20-19)
Lamelo Irving drives and kicks out. Bradley Ginobili attempts a Midrange. Contested by John Wagner (5.8 feet, ZONE). Bradley Ginobili misses. Rebound secured by Tim Sexton.

[00:19] Team_045 possession (Score: 20-19)
John Wagner attempts a Midrange. Wide open! Scottie Johnson is 7.1 feet away. [MAN] John Wagner misses. Offensive rebound by Tim Sexton! Tim Sexton kicks it out.

[00:07] Team_045 possession (Score: 20-19)
Tim Sexton throws a bad pass out of bounds! TURNOVER! (dead ball)

================================================================================
                              1ST QUARTER COMPLETE                              
================================================================================

1ST QUARTER SCORE: Team_045 20, Team_057 19

BOX SCORE:
================================================================================

Team_045
--------------------------------------------------------------------------------
Player                MIN  PTS  REB  AST  TO      FG   FG%      3P   3P%
--------------------------------------------------------------------------------
DeMar Turner           11    6    2    0   0   3/4    75.0     0/0   0.0
Zion Butler            11    5    3    1   0   2/3    66.7     0/0   0.0
Trae Russell           11    5    0    0   0   2/3    66.7     0/0   0.0
Cole Simons            11    2    3    0   0   1/6    16.7     0/0   0.0
Julius James            1    2    0    0   0   1/1   100.0     0/0   0.0
Rudy Antetokounmpo     11    0    0    1   0   0/2     0.0     0/0   0.0
Tim Sexton              1    0    2    0   0   0/0     0.0     0/0   0.0

TEAM: FG: 9/19 (47.4%), 3PT: 1/5 (20.0%), REB: 10 (2 off, 8 def), AST: 2, TO: 4
TEAM FOULS: 6 [Team_057 in BONUS]


Team_057
--------------------------------------------------------------------------------
Player                MIN  PTS  REB  AST  TO      FG   FG%      3P   3P%
--------------------------------------------------------------------------------
Ben Adebayo            11   10    3    1   0   4/6    66.7     0/0   0.0
Anfernee Adebayo       11    5    4    0   0   2/3    66.7     0/0   0.0
Miles Middleton        11    2    3    2   0   1/1   100.0     0/0   0.0
Klay Rozier            11    2    0    1   0   1/1   100.0     0/0   0.0
Kobe Ming              11    0    0    1   0   0/4     0.0     0/0   0.0
Lamelo Irving           1    0    0    0   0   0/1     0.0     0/0   0.0

TEAM: FG: 8/16 (50.0%), 3PT: 1/6 (16.7%), REB: 10 (1 off, 9 def), AST: 5, TO: 6
TEAM FOULS: 8 [Team_045 in BONUS]

================================================================================

================================================================================
                       2ND QUARTER - Team_045 vs Team_057                       
================================================================================

[12:00] Team_045 possession (Score: 20-19)
DeMar Turner makes the Layup and draws the foul on Klay Rozier! And-1! DeMar Turner to the line for 1. [Team fouls: 1] (Klay Rozier: 1 personal fouls)   FT 1/1: GOOD DeMar Turner makes 1/1 from the line.
Score: 23-19

[11:42] Team_057 possession (Score: 23-19)
Miles Middleton attempts a Layup. Contested by Zion Butler (3.4 feet, MAN). MILES MIDDLETON MAKES IT! Assist: Anfernee Adebayo
Score: 23-21

[11:31] Team_045 possession (Score: 23-21)
Zion Butler drives, Ben Adebayo stays with him. Zion Butler attempts a Layup. Wide open! Ben Adebayo is 6.2 feet away. [ZONE] Zion Butler misses. Rebound secured by Ben Adebayo.

[11:13] Team_057 possession (Score: 23-21)
Anfernee Adebayo attempts a Layup. Heavily contested by Zion Butler (0.6 feet, ZONE)! ANFERNEE ADEBAYO MAKES IT! Assist: Klay Rozier
Score: 23-23

[11:01] Team_045 possession (Score: 23-23)
Zion Butler drives, picks up Ben Adebayo. Help arrives from Klay Rozier! Zion Butler attempts a Layup. Contested by Klay Rozier (2.9 feet, ZONE). Zion Butler misses. Rebound secured by Anfernee Adebayo.

[10:52] Team_057 possession (Score: 23-23)
Miles Middleton drives, picks up Zion Butler. Help arrives from Rudy Antetokounmpo! Miles Middleton attempts a Layup. Heavily contested by Rudy Antetokounmpo (0.6 feet, MAN)! MILES MIDDLETON MAKES IT! Assist: Klay Rozier
Score: 23-25

[10:38] Team_045 possession (Score: 23-25)
Trae Russell attempts a 3Pt. Contested by Kobe Ming (4.6 feet, ZONE). Trae Russell misses. Rebound secured by Ben Adebayo.

[10:21] Team_057 possession (Score: 23-25)
Miles Middleton attempts a Layup. Contested by Zion Butler (3.3 feet, MAN). MILES MIDDLETON MAKES IT! Assist: Kobe Ming
Score: 23-27

[10:07] Team_045 possession (Score: 23-27)
Cole Simons attempts a 3Pt. Contested by Kobe Ming (5.9 feet, ZONE). Cole Simons misses. Rebound secured by Ben Adebayo.

[09:50] Team_057 possession (Score: 23-27)
Miles Middleton drives and kicks out. Miles Middleton attempts a Midrange. Contested by Cole Simons (3.4 feet, ZONE). Miles Middleton misses. Rebound secured by Cole Simons.

[09:32] Team_045 possession (Score: 23-27)
Trae Russell attempts a Midrange. Heavily contested by Klay Rozier (1.3 feet, MAN)! Trae Russell misses. Offensive rebound by Zion Butler! Zion Butler's putback is no good. Offensive rebound by DeMar Turner! DeMar Turner kicks it out.

[09:20] Team_045 possession (Score: 23-27)
Rudy Antetokounmpo attempts a Midrange. Contested by Kobe Ming (2.8 feet, MAN). Rudy Antetokounmpo misses. Rebound secured by Ben Adebayo.

[09:04] Team_057 possession (Score: 23-27)
Klay Rozier attempts a Midrange. Contested by DeMar Turner (3.9 feet, ZONE). KLAY ROZIER MAKES IT! Assist: Kobe Ming
Score: 23-29

[08:51] Team_045 possession (Score: 23-29)
Trae Russell attempts a 3Pt. Contested by Klay Rozier (5.7 feet, MAN). Trae Russell misses. Offensive rebound by DeMar Turner! DeMar Turner kicks it out.

[08:37] Team_045 possession (Score: 23-29)
DeMar Turner attempts a 3Pt. Contested by Ben Adebayo (5.5 feet, MAN). DeMar Turner misses. Rebound secured by Ben Adebayo.

[08:22] Team_057 possession (Score: 23-29)
Kobe Ming attempts a 3Pt. Contested by Rudy Antetokounmpo (4.5 feet, MAN). Kobe Ming misses. Rebound secured by Zion Butler.

[08:07] Team_045 possession (Score: 23-29)
FOUL! Reach-in foul on Ben Adebayo during the drive. [Team fouls: 2] No free throws, side out. (Ben Adebayo: 1 personal fouls)

[07:53] Team_045 possession (Score: 23-29)
Rudy Antetokounmpo makes the Dunk and draws the foul on Klay Rozier! And-1! Rudy Antetokounmpo to the line for 1. [Team fouls: 3] (Klay Rozier: 2 personal fouls)   FT 1/1: GOOD Rudy Antetokounmpo makes 1/1 from the line.
Score: 26-29

[07:39] Team_057 possession (Score: 26-29)
Miles Middleton attempts a Layup. Contested by Zion Butler (3.3 feet, MAN). MILES MIDDLETON MAKES IT!
Score: 26-31

[07:29] Team_045 possession (Score: 26-31)
Trae Russell attempts a Midrange. Contested by Klay Rozier (5.4 feet, MAN). Trae Russell misses. Rebound secured by Ben Adebayo.

[07:16] Team_057 possession (Score: 26-31)
Anfernee Adebayo drives to the basket... FOUL! Offensive foul on Anfernee Adebayo! Cole Simons drew the charge! [Team fouls: 4] (Anfernee Adebayo: 1 personal fouls) TURNOVER! (dead ball)

[07:02] Team_045 possession (Score: 26-31)
Trae Russell drives to the basket... Trae Russell throws a bad pass! Stolen by Klay Rozier! TURNOVER! (live ball)

[06:45] Team_057 possession (Score: 26-31)
Kobe Ming attempts a Layup. BLOCKED BY ZION BUTLER! Ball is loose! Offensive rebound by Miles Middleton! Miles Middleton kicks it out.

[06:29] Team_057 possession (Score: 26-31)
Anfernee Adebayo attempts a Midrange. Contested by Cole Simons (4.2 feet, MAN). ANFERNEE ADEBAYO MAKES IT! Assist: Ben Adebayo
Score: 26-33

[06:18] Team_045 possession (Score: 26-33)
Trae Russell attempts a 3Pt. Wide open! Klay Rozier is 6.1 feet away. [MAN] TRAE RUSSELL MAKES IT!
Score: 29-33

[06:07] Team_057 possession (Score: 29-33)
Kobe Ming attempts a 3Pt. Contested by Cole Simons (4.2 feet, ZONE). Kobe Ming misses. Rebound secured by DeMar Turner.

[05:53] Team_045 possession (Score: 29-33)
DeMar Turner attempts a Layup. BLOCKED BY KLAY ROZIER! Ball is loose! Offensive rebound by Zion Butler! Zion Butler kicks it out.

[05:38] Team_045 possession (Score: 29-33)
Rudy Antetokounmpo loses the ball! Stripped by Kobe Ming! TURNOVER! (live ball)

[05:24] Team_057 possession (Score: 29-33)
Klay Rozier attempts a Midrange. Wide open! Trae Russell is 6.5 feet away. [MAN] Klay Rozier misses. FOUL! Loose ball foul on Cole Simons during the rebound battle. [Team fouls: 1] No free throws, side out. (Cole Simons: 1 personal fouls)

[05:08] Team_057 possession (Score: 29-33)
Ben Adebayo drives, DeMar Turner stays with him. Ben Adebayo attempts a Layup. Contested by DeMar Turner (3.3 feet, MAN). BEN ADEBAYO MAKES IT!
Score: 29-35

[04:53] Team_045 possession (Score: 29-35)
DeMar Turner attempts a 3Pt. Contested by Ben Adebayo (5.7 feet, MAN). DEMAR TURNER MAKES IT!
Score: 32-35

[04:36] Team_057 possession (Score: 32-35)
FOUL! Shooting foul on Zion Butler. Anfernee Adebayo to the line for 2 free throws. [Team fouls: 2] (Zion Butler: 1 personal fouls)   FT 1/2: MISS   FT 2/2: MISS Anfernee Adebayo makes 0/2 from the line. Rebound secured by DeMar Turner.

[04:24] Team_045 possession (Score: 32-35)
Zion Butler attempts a Layup. Contested by Miles Middleton (4.8 feet, MAN). ZION BUTLER MAKES IT!
Score: 34-35

[04:10] Team_057 possession (Score: 34-35)
Anfernee Adebayo attempts a Layup. Heavily contested by Cole Simons (1.2 feet, MAN)! Anfernee Adebayo misses. Rebound secured by DeMar Turner.

[03:50] Team_045 possession (Score: 34-35)
Zion Butler attempts a Midrange. Wide open! Miles Middleton is 8.5 feet away. [MAN] ZION BUTLER MAKES IT! Assist: Trae Russell
Score: 36-35

[03:35] Team_057 possession (Score: 36-35)
FOUL! Shooting foul on Trae Russell. Klay Rozier to the line for 2 free throws. [Team fouls: 3] (Trae Russell: 1 personal fouls)   FT 1/2: GOOD   FT 2/2: GOOD Klay Rozier makes 2/2 from the line.
Score: 36-37

[03:22] Team_045 possession (Score: 36-37)
Cole Simons makes the Layup and draws the foul on Anfernee Adebayo! And-1! Cole Simons to the line for 1. [BONUS: 5 team fouls] (Anfernee Adebayo: 2 personal fouls)   FT 1/1: GOOD Cole Simons makes 1/1 from the line.
Score: 39-37

[03:06] Team_057 possession (Score: 39-37)
Miles Middleton attempts a 3Pt. Heavily contested by Cole Simons (0.5 feet, ZONE)! Miles Middleton misses. FOUL! Loose ball foul on Cole Simons during the rebound battle. [Team fouls: 4] No free throws, side out. (Cole Simons: 2 personal fouls)

[02:49] Team_057 possession (Score: 39-37)
Kobe Ming attempts a 3Pt. Contested by Cole Simons (3.2 feet, ZONE). Kobe Ming misses. Rebound secured by Cole Simons.

[02:35] Team_045 possession (Score: 39-37)
Trae Russell drives and kicks out. DeMar Turner attempts a Midrange. Wide open! Anfernee Adebayo is 7.2 feet away. [ZONE] DeMar Turner misses. Rebound secured by Miles Middleton.

[02:22] Team_057 possession (Score: 39-37)
FOUL! Offensive foul on Anfernee Adebayo! Cole Simons drew the charge! [Team fouls: 6] (Anfernee Adebayo: 3 personal fouls) TURNOVER! (dead ball)

[02:08] Team_045 possession (Score: 39-37)
Trae Russell attempts a Midrange. Contested by Klay Rozier (2.9 feet, MAN). Trae Russell misses. Rebound secured by Ben Adebayo.

[01:54] Team_057 possession (Score: 39-37)
Ben Adebayo attempts a Midrange. Wide open! Cole Simons is 7.4 feet away. [ZONE] Ben Adebayo misses. Rebound secured by Zion Butler.

[01:40] Team_045 possession (Score: 39-37)
DeMar Turner drives to the basket... DeMar Turner loses the ball! Stripped by Ben Adebayo! TURNOVER! (live ball)

[01:24] Team_057 possession (Score: 39-37)
Ben Adebayo attempts a Layup. Wide open! DeMar Turner is 6.2 feet away. [MAN] Ben Adebayo misses. Offensive rebound by Ben Adebayo! Ben Adebayo kicks it out.

[01:09] Team_057 possession (Score: 39-37)
Anfernee Adebayo throws a bad pass out of bounds! TURNOVER! (dead ball)

[01:09] Substitution (Team_045): Rudy Antetokounmpo OUT → John Wagner IN (stamina_rule2)

[01:09] Substitution (Team_045): Trae Russell OUT → Julius James IN (stamina_rule2)

[01:09] Substitution (Team_045): Cole Simons OUT → Gary Towns IN (stamina_rule2)

[01:09] Substitution (Team_045): DeMar Turner OUT → Tim Sexton IN (stamina_rule2)

[01:09] Substitution (Team_045): Zion Butler OUT → Stephen Paul IN (stamina_rule2)

[01:09] Substitution (Team_057): Kobe Ming OUT → Scottie Johnson IN (stamina_rule2)

[01:09] Substitution (Team_057): Klay Rozier OUT → Bradley Ginobili IN (stamina_rule2)

[01:09] Substitution (Team_057): Anfernee Adebayo OUT → Joel Wade IN (stamina_rule2)

[01:09] Substitution (Team_057): Ben Adebayo OUT → Lamelo Irving IN (stamina_rule2)

[01:09] Substitution (Team_057): Miles Middleton OUT → Zion Lillard IN (stamina_rule2)

[00:54] Team_045 possession (Score: 39-37)
Julius James makes the Layup and draws the foul on Bradley Ginobili! And-1! Julius James to the line for 1. [BONUS: 7 team fouls] (Bradley Ginobili: 1 personal fouls)   FT 1/1: GOOD Julius James makes 1/1 from the line.
Score: 42-37

[00:36] Team_057 possession (Score: 42-37)
FOUL! Reach-in foul on Stephen Paul during the drive. [IN THE BONUS! 5 team fouls] Lamelo Irving to the line for 2 free throws. (Stephen Paul: 1 personal fouls)   FT 1/2: GOOD   FT 2/2: GOOD Lamelo Irving makes 2/2 from the line.
Score: 42-39

[00:19] Team_045 possession (Score: 42-39)
John Wagner attempts a Midrange. Contested by Scottie Johnson (4.7 feet, MAN). JOHN WAGNER MAKES IT!
Score: 44-39

================================================================================
                              2ND QUARTER COMPLETE                              
================================================================================

2ND QUARTER SCORE: Team_045 24, Team_057 20

BOX SCORE:
================================================================================

Team_045
--------------------------------------------------------------------------------
Player                MIN  PTS  REB  AST  TO      FG   FG%      3P   3P%
--------------------------------------------------------------------------------
DeMar Turner           22    6    5    0   0   2/3    66.7     0/0   0.0
Zion Butler            22    4    3    0   0   2/4    50.0     0/0   0.0
Trae Russell           22    3    0    1   0   1/5    20.0     0/0   0.0
Cole Simons            22    3    2    0   0   1/2    50.0     0/0   0.0
Rudy Antetokounmpo     22    3    0    0   0   1/2    50.0     0/0   0.0
Julius James            2    3    0    0   0   1/1   100.0     0/0   0.0
John Wagner             2    2    0    0   0   1/1   100.0     0/0   0.0

TEAM: FG: 9/18 (50.0%), 3PT: 2/5 (40.0%), REB: 10 (3 off, 7 def), AST: 1, TO: 3
TEAM FOULS: 5 [Team_057 in BONUS]


Team_057
--------------------------------------------------------------------------------
Player                MIN  PTS  REB  AST  TO      FG   FG%      3P   3P%
--------------------------------------------------------------------------------
Miles Middleton        22    8    2    0   0   4/5    80.0     0/0   0.0
Anfernee Adebayo       22    4    1    1   0   2/4    50.0     0/0   0.0
Klay Rozier            22    4    0    2   0   2/2   100.0     0/0   0.0
Ben Adebayo            22    2   10    1   0   1/2    50.0     0/0   0.0
Lamelo Irving           2    2    0    0   0   1/1   100.0     0/0   0.0
Kobe Ming              22    0    0    2   0   0/3     0.0     0/0   0.0

TEAM: FG: 10/17 (58.8%), 3PT: 0/3 (0.0%), REB: 13 (4 off, 9 def), AST: 6, TO: 3
TEAM FOULS: 7 [Team_045 in BONUS]

================================================================================

================================================================================
                       3RD QUARTER - Team_045 vs Team_057                       
================================================================================

[12:00] Team_045 possession (Score: 44-39)
Trae Russell attempts a 3Pt. Wide open! Kobe Ming is 6.7 feet away. [ZONE] TRAE RUSSELL MAKES IT! Assist: Rudy Antetokounmpo
Score: 47-39

[11:43] Team_057 possession (Score: 47-39)
Klay Rozier loses control! Ball rolls out of bounds! TURNOVER! (dead ball)

[11:31] Team_045 possession (Score: 47-39)
Zion Butler drives to the basket... Zion Butler throws a bad pass! Stolen by Miles Middleton! TURNOVER! (live ball)

[11:18] Team_057 possession (Score: 47-39)
Klay Rozier attempts a Midrange. Contested by Cole Simons (3.2 feet, MAN). Klay Rozier misses. Rebound secured by DeMar Turner.

[11:07] Team_045 possession (Score: 47-39)
DeMar Turner attempts a Midrange. Wide open! Ben Adebayo is 6.9 feet away. [ZONE] DEMAR TURNER MAKES IT! Assist: Trae Russell
Score: 49-39

[10:52] Team_057 possession (Score: 49-39)
Kobe Ming drives to the basket... Kobe Ming throws a bad pass! Stolen by Rudy Antetokounmpo! TURNOVER! (live ball)

[10:36] Team_045 possession (Score: 49-39)
DeMar Turner attempts a Midrange. Contested by Ben Adebayo (3.9 feet, MAN). DeMar Turner misses. Rebound secured by Miles Middleton.

[10:25] Team_057 possession (Score: 49-39)
FOUL! Shooting foul on Cole Simons. Klay Rozier to the line for 2 free throws. [Team fouls: 1] (Cole Simons: 1 personal fouls)   FT 1/2: GOOD   FT 2/2: MISS Klay Rozier makes 1/2 from the line. Rebound secured by Zion Butler.
Score: 49-40

[10:11] Team_045 possession (Score: 49-40)
Rudy Antetokounmpo makes the Layup and draws the foul on Ben Adebayo! And-1! Rudy Antetokounmpo to the line for 1. [Team fouls: 1] (Ben Adebayo: 1 personal fouls)   FT 1/1: MISS Rudy Antetokounmpo makes 0/1 from the line. Offensive rebound by Zion Butler! Zion Butler's putback is no good.
Score: 51-40

[09:58] Team_057 possession (Score: 51-40)
FOUL! Offensive foul on Klay Rozier! Cole Simons drew the charge! [Team fouls: 2] (Klay Rozier: 1 personal fouls) TURNOVER! (dead ball)

[09:44] Team_045 possession (Score: 51-40)
Trae Russell attempts a 3Pt. Heavily contested by Klay Rozier (1.0 feet, MAN)! Trae Russell misses. Rebound secured by Ben Adebayo.

[09:32] Team_057 possession (Score: 51-40)
Kobe Ming attempts a 3Pt. Wide open! Cole Simons is 6.4 feet away. [ZONE] Kobe Ming misses. Rebound secured by Zion Butler.

[09:18] Team_045 possession (Score: 51-40)
Zion Butler attempts a Dunk. BLOCKED BY BEN ADEBAYO! Ball is loose! Rebound secured by Miles Middleton.

[09:04] Team_057 possession (Score: 51-40)
Anfernee Adebayo attempts a Layup. Contested by Cole Simons (4.6 feet, MAN). ANFERNEE ADEBAYO MAKES IT!
Score: 51-42

[08:49] Team_045 possession (Score: 51-42)
Cole Simons attempts a Midrange. Wide open! Anfernee Adebayo is 7.1 feet away. [ZONE] Cole Simons misses. Rebound secured by Anfernee Adebayo.

[08:37] Team_057 possession (Score: 51-42)
Miles Middleton attempts a Layup. Contested by Zion Butler (3.6 feet, ZONE). MILES MIDDLETON MAKES IT! Assist: Anfernee Adebayo
Score: 51-44

[08:21] Team_045 possession (Score: 51-44)
DeMar Turner attempts a 3Pt. Wide open! Kobe Ming is 6.3 feet away. [ZONE] DeMar Turner misses. Rebound secured by Ben Adebayo.

[08:08] Team_057 possession (Score: 51-44)
FOUL! Offensive foul on Miles Middleton! Zion Butler drew the charge! [Team fouls: 3] (Miles Middleton: 1 personal fouls) TURNOVER! (dead ball)

[07:59] Team_045 possession (Score: 51-44)
Rudy Antetokounmpo attempts a 3Pt. Contested by Kobe Ming (3.7 feet, ZONE). Rudy Antetokounmpo misses. Offensive rebound by Zion Butler! Zion Butler puts it back in!
Score: 53-44

[07:41] Team_057 possession (Score: 53-44)
FOUL! Shooting foul on Cole Simons. Klay Rozier to the line for 3 free throws. [Team fouls: 2] (Cole Simons: 2 personal fouls)   FT 1/3: GOOD   FT 2/3: GOOD   FT 3/3: GOOD Klay Rozier makes 3/3 from the line.
Score: 53-47

[07:28] Team_045 possession (Score: 53-47)
Cole Simons attempts a 3Pt. Wide open! Kobe Ming is 6.9 feet away. [ZONE] COLE SIMONS MAKES IT! Assist: DeMar Turner
Score: 56-47

[07:14] Team_057 possession (Score: 56-47)
Ben Adebayo attempts a Layup. Heavily contested by Zion Butler (0.5 feet, ZONE)! Ben Adebayo misses. Rebound secured by Cole Simons.

[07:02] Team_045 possession (Score: 56-47)
DeMar Turner attempts a Midrange. Wide open! Ben Adebayo is 7.1 feet away. [MAN] DeMar Turner misses. Rebound secured by Miles Middleton.

[06:44] Team_057 possession (Score: 56-47)
Klay Rozier loses the ball! Stripped by Cole Simons! TURNOVER! (live ball)

[06:29] Team_045 possession (Score: 56-47)
Zion Butler attempts a 3Pt. Contested by Miles Middleton (3.9 feet, MAN). Zion Butler misses. Rebound secured by Miles Middleton.

[06:16] Team_057 possession (Score: 56-47)
Anfernee Adebayo attempts a 3Pt. Contested by Cole Simons (3.6 feet, ZONE). Anfernee Adebayo misses. Rebound secured by Cole Simons.

[06:05] Team_045 possession (Score: 56-47)
Zion Butler attempts a 3Pt. Contested by Miles Middleton (5.3 feet, MAN). Zion Butler misses. Rebound secured by Miles Middleton.

[05:50] Team_057 possession (Score: 56-47)
Miles Middleton attempts a Midrange. Contested by Cole Simons (4.1 feet, ZONE). MILES MIDDLETON MAKES IT! Assist: Ben Adebayo
Score: 56-49

[05:35] Team_045 possession (Score: 56-49)
DeMar Turner attempts a Layup. BLOCKED BY BEN ADEBAYO! Ball is loose! Offensive rebound by Zion Butler! Zion Butler kicks it out.

[05:26] Team_045 possession (Score: 56-49)
Rudy Antetokounmpo attempts a Midrange. Wide open! Kobe Ming is 8.3 feet away. [MAN] RUDY ANTETOKOUNMPO MAKES IT!
Score: 58-49

[05:14] Team_057 possession (Score: 58-49)
Klay Rozier drives, picks up Cole Simons. Help arrives from Rudy Antetokounmpo! Klay Rozier attempts a Layup. Contested by Rudy Antetokounmpo (3.2 feet, MAN). Klay Rozier misses. Rebound secured by DeMar Turner.

[05:01] Team_045 possession (Score: 58-49)
Rudy Antetokounmpo makes the Dunk and draws the foul on Ben Adebayo! And-1! Rudy Antetokounmpo to the line for 1. [BONUS: 5 team fouls] (Ben Adebayo: 2 personal fouls)   FT 1/1: GOOD Rudy Antetokounmpo makes 1/1 from the line.
Score: 61-49

[04:47] Team_057 possession (Score: 61-49)
Ben Adebayo drives and kicks out. Klay Rozier attempts a 3Pt. Heavily contested by Cole Simons (1.1 feet, ZONE)! Klay Rozier misses. Rebound secured by Cole Simons.

[04:29] Team_045 possession (Score: 61-49)
DeMar Turner drives, Ben Adebayo stays with him. DeMar Turner attempts a Layup. Contested by Ben Adebayo (4.0 feet, MAN). DEMAR TURNER MAKES IT! Assist: Trae Russell
Score: 63-49

[04:15] Team_057 possession (Score: 63-49)
Miles Middleton drives, picks up Zion Butler. Help arrives from Rudy Antetokounmpo! Miles Middleton attempts a Dunk. Wide open! Rudy Antetokounmpo is 6.5 feet away. [ZONE] MILES MIDDLETON MAKES IT! Assist: Ben Adebayo
Score: 63-51

[04:00] Team_045 possession (Score: 63-51)
Trae Russell attempts a Midrange. Contested by Klay Rozier (5.6 feet, MAN). Trae Russell misses. Rebound secured by Anfernee Adebayo.

[03:47] Team_057 possession (Score: 63-51)
Ben Adebayo attempts a Layup. Contested by DeMar Turner (4.0 feet, MAN). BEN ADEBAYO MAKES IT!
Score: 63-53

[03:35] Team_045 possession (Score: 63-53)
Trae Russell attempts a 3Pt. Wide open! Kobe Ming is 6.6 feet away. [ZONE] Trae Russell misses. Rebound secured by Anfernee Adebayo.

[03:18] Team_057 possession (Score: 63-53)
Anfernee Adebayo attempts a Midrange. Wide open! DeMar Turner is 7.1 feet away. [ZONE] Anfernee Adebayo misses. Rebound secured by DeMar Turner.

[03:03] Team_045 possession (Score: 63-53)
Rudy Antetokounmpo drives and kicks out. Rudy Antetokounmpo attempts a Midrange. Wide open! Kobe Ming is 6.3 feet away. [ZONE] RUDY ANTETOKOUNMPO MAKES IT! Assist: DeMar Turner
Score: 65-53

[02:52] Team_057 possession (Score: 65-53)
Ben Adebayo attempts a 3Pt. Contested by DeMar Turner (5.7 feet, MAN). Ben Adebayo misses. Rebound secured by DeMar Turner.

[02:35] Team_045 possession (Score: 65-53)
Trae Russell loses control! Ball rolls out of bounds! TURNOVER! (dead ball)

[02:35] Substitution (Team_045): Rudy Antetokounmpo OUT → John Wagner IN (stamina_rule2)

[02:35] Substitution (Team_045): Trae Russell OUT → Julius James IN (stamina_rule2)

[02:35] Substitution (Team_045): Cole Simons OUT → Gary Towns IN (stamina_rule2)

[02:35] Substitution (Team_045): DeMar Turner OUT → Tim Sexton IN (stamina_rule2)

[02:35] Substitution (Team_045): Zion Butler OUT → Stephen Paul IN (stamina_rule2)

[02:35] Substitution (Team_057): Kobe Ming OUT → Scottie Johnson IN (stamina_rule2)

[02:35] Substitution (Team_057): Klay Rozier OUT → Bradley Ginobili IN (stamina_rule2)

[02:35] Substitution (Team_057): Anfernee Adebayo OUT → Joel Wade IN (stamina_rule2)

[02:35] Substitution (Team_057): Ben Adebayo OUT → Lamelo Irving IN (stamina_rule2)

[02:35] Substitution (Team_057): Miles Middleton OUT → Zion Lillard IN (stamina_rule2)

[02:18] Team_057 possession (Score: 65-53)
Bradley Ginobili loses the ball! Stripped by Julius James! TURNOVER! (live ball)

[02:09] Team_045 possession (Score: 65-53)
Gary Towns drives, picks up Lamelo Irving. Help arrives from Bradley Ginobili! Gary Towns attempts a Dunk. Heavily contested by Bradley Ginobili (0.5 feet, ZONE)! Gary Towns misses. Rebound secured by Zion Lillard.

[01:54] Team_057 possession (Score: 65-53)
Bradley Ginobili attempts a Layup. Contested by Stephen Paul (5.4 feet, ZONE). Bradley Ginobili misses. Rebound secured by Stephen Paul.

[01:39] Team_045 possession (Score: 65-53)
Tim Sexton attempts a 3Pt. Contested by Lamelo Irving (5.7 feet, MAN). Tim Sexton misses. Rebound secured by Zion Lillard.

[01:20] Team_057 possession (Score: 65-53)
Joel Wade attempts a 3Pt. Wide open! Gary Towns is 7.3 feet away. [MAN] JOEL WADE MAKES IT! Assist: Bradley Ginobili
Score: 65-56

[01:05] Team_045 possession (Score: 65-56)
Stephen Paul attempts a Layup. Contested by Lamelo Irving (3.7 feet, ZONE). STEPHEN PAUL MAKES IT! Assist: Tim Sexton
Score: 67-56

[00:49] Team_057 possession (Score: 67-56)
Bradley Ginobili throws a bad pass out of bounds! TURNOVER! (dead ball)

[00:37] Team_045 possession (Score: 67-56)
Tim Sexton makes the Layup and draws the foul on Bradley Ginobili! And-1! Tim Sexton to the line for 1. [BONUS: 6 team fouls] (Bradley Ginobili: 1 personal fouls)   FT 1/1: GOOD Tim Sexton makes 1/1 from the line.
Score: 70-56

[00:26] Team_057 possession (Score: 70-56)
FOUL! Shooting foul on Stephen Paul. Scottie Johnson to the line for 2 free throws. [Team fouls: 3] (Stephen Paul: 1 personal fouls)   FT 1/2: MISS   FT 2/2: GOOD Scottie Johnson makes 1/2 from the line.
Score: 70-57

[00:12] Team_045 possession (Score: 70-57)
John Wagner attempts a Layup. BLOCKED BY BRADLEY GINOBILI! Ball is loose! Rebound secured by Joel Wade.

================================================================================
                              3RD QUARTER COMPLETE                              
================================================================================

3RD QUARTER SCORE: Team_045 26, Team_057 18

BOX SCORE:
================================================================================

Team_045
--------------------------------------------------------------------------------
Player                MIN  PTS  REB  AST  TO      FG   FG%      3P   3P%
--------------------------------------------------------------------------------
Rudy Antetokounmpo     32    7    0    1   0   3/4    75.0     0/0   0.0
DeMar Turner           32    4    4    2   0   2/5    40.0     0/0   0.0
Trae Russell           32    3    0    2   0   1/4    25.0     0/0   0.0
Cole Simons            32    3    3    0   0   1/2    50.0     0/0   0.0
Tim Sexton              4    3    0    1   0   1/2    50.0     0/0   0.0
Zion Butler            32    2    5    0   0   1/4    25.0     0/0   0.0
Stephen Paul            4    2    1    0   0   1/1   100.0     0/0   0.0
Gary Towns              4    0    0    0   0   0/1     0.0     0/0   0.0
John Wagner             4    0    0    0   0   0/1     0.0     0/0   0.0

TEAM: FG: 10/24 (41.7%), 3PT: 3/9 (33.3%), REB: 12 (2 off, 10 def), AST: 6, TO: 2
TEAM FOULS: 3


Team_057
--------------------------------------------------------------------------------
Player                MIN  PTS  REB  AST  TO      FG   FG%      3P   3P%
--------------------------------------------------------------------------------
Miles Middleton        32    6    5    0   0   3/3   100.0     0/0   0.0
Klay Rozier            32    3    0    0   0   1/4    25.0     0/0   0.0
Joel Wade               4    3    1    0   0   1/1   100.0     0/0   0.0
Ben Adebayo            32    2    2    2   0   1/4    25.0     0/0   0.0
Anfernee Adebayo       32    2    3    1   0   1/3    33.3     0/0   0.0
Scottie Johnson         4    1    0    0   0   1/1   100.0     0/0   0.0
Kobe Ming              32    0    0    0   0   0/1     0.0     0/0   0.0
Zion Lillard            4    0    2    0   0   0/0     0.0     0/0   0.0
Bradley Ginobili        4    0    0    1   0   0/1     0.0     0/0   0.0

TEAM: FG: 8/18 (44.4%), 3PT: 2/5 (40.0%), REB: 14 (0 off, 14 def), AST: 4, TO: 7
TEAM FOULS: 6 [Team_045 in BONUS]

================================================================================

================================================================================
                       4TH QUARTER - Team_045 vs Team_057                       
================================================================================

[12:00] Team_045 possession (Score: 70-57)
Rudy Antetokounmpo drives and kicks out. Zion Butler attempts a 3Pt. Contested by Ben Adebayo (4.5 feet, ZONE). Zion Butler misses. Rebound secured by Miles Middleton.

[11:45] Team_057 possession (Score: 70-57)
Klay Rozier attempts a Midrange. Wide open! Trae Russell is 6.1 feet away. [ZONE] KLAY ROZIER MAKES IT!
Score: 70-59

[11:31] Team_045 possession (Score: 70-59)
DeMar Turner drives, Ben Adebayo stays with him. DeMar Turner attempts a Dunk. Contested by Ben Adebayo (2.6 feet, ZONE). DeMar Turner misses. Rebound secured by Anfernee Adebayo.

[11:14] Team_057 possession (Score: 70-59)
Kobe Ming throws a bad pass out of bounds! TURNOVER! (dead ball)

[10:59] Team_045 possession (Score: 70-59)
DeMar Turner attempts a 3Pt. Contested by Ben Adebayo (5.5 feet, MAN). DeMar Turner misses. Rebound secured by Anfernee Adebayo.

[10:50] Team_057 possession (Score: 70-59)
Ben Adebayo attempts a Midrange. Contested by DeMar Turner (2.9 feet, ZONE). Ben Adebayo misses. Rebound secured by DeMar Turner.

[10:37] Team_045 possession (Score: 70-59)
Trae Russell attempts a 3Pt. Wide open! Klay Rozier is 8.3 feet away. [MAN] Trae Russell misses. Rebound secured by Miles Middleton.

[10:25] Team_057 possession (Score: 70-59)
Klay Rozier drives, Zion Butler stays with him. Klay Rozier attempts a Layup. Wide open! Zion Butler is 6.2 feet away. [ZONE] KLAY ROZIER MAKES IT! Assist: Anfernee Adebayo
Score: 70-61

[10:11] Team_045 possession (Score: 70-61)
DeMar Turner attempts a 3Pt. Contested by Ben Adebayo (3.2 feet, MAN). DeMar Turner misses. Rebound secured by Miles Middleton.

[09:55] Team_057 possession (Score: 70-61)
Klay Rozier attempts a 3Pt. Contested by Cole Simons (2.8 feet, ZONE). Klay Rozier misses. Rebound secured by Zion Butler.

[09:39] Team_045 possession (Score: 70-61)
Cole Simons attempts a 3Pt. Contested by Anfernee Adebayo (3.6 feet, MAN). Cole Simons misses. Rebound secured by Ben Adebayo.

[09:22] Team_057 possession (Score: 70-61)
FOUL! Shooting foul on DeMar Turner. Miles Middleton to the line for 2 free throws. [Team fouls: 1] (DeMar Turner: 1 personal fouls)   FT 1/2: MISS   FT 2/2: GOOD Miles Middleton makes 1/2 from the line.
Score: 70-62

[09:03] Team_045 possession (Score: 70-62)
Rudy Antetokounmpo attempts a 3Pt. Wide open! Kobe Ming is 7.7 feet away. [ZONE] Rudy Antetokounmpo misses. Rebound secured by Ben Adebayo.

[08:52] Team_057 possession (Score: 70-62)
Klay Rozier drives, picks up Cole Simons. Help arrives from Rudy Antetokounmpo! Klay Rozier attempts a Dunk. Contested by Rudy Antetokounmpo (5.5 feet, MAN). KLAY ROZIER MAKES IT!
Score: 70-64

[08:39] Team_045 possession (Score: 70-64)
Trae Russell throws a bad pass out of bounds! TURNOVER! (dead ball)

[08:39] Substitution (Team_045): Rudy Antetokounmpo OUT → John Wagner IN (stamina_rule2)

[08:39] Substitution (Team_045): Trae Russell OUT → Julius James IN (stamina_rule2)

[08:39] Substitution (Team_045): Cole Simons OUT → Gary Towns IN (stamina_rule2)

[08:39] Substitution (Team_045): DeMar Turner OUT → Tim Sexton IN (stamina_rule2)

[08:39] Substitution (Team_045): Zion Butler OUT → Stephen Paul IN (stamina_rule2)

[08:39] Substitution (Team_057): Kobe Ming OUT → Scottie Johnson IN (stamina_rule2)

[08:39] Substitution (Team_057): Klay Rozier OUT → Bradley Ginobili IN (stamina_rule2)

[08:39] Substitution (Team_057): Anfernee Adebayo OUT → Joel Wade IN (stamina_rule2)

[08:39] Substitution (Team_057): Ben Adebayo OUT → Lamelo Irving IN (stamina_rule2)

[08:39] Substitution (Team_057): Miles Middleton OUT → Zion Lillard IN (stamina_rule2)

[08:25] Team_057 possession (Score: 70-64)
Bradley Ginobili drives, Julius James stays with him. Bradley Ginobili attempts a Layup. Contested by Julius James (5.4 feet, MAN). BRADLEY GINOBILI MAKES IT!
Score: 70-66

[08:10] Team_045 possession (Score: 70-66)
John Wagner attempts a Layup. Contested by Scottie Johnson (5.3 feet, MAN). John Wagner misses. Rebound secured by Zion Lillard.

[08:01] Team_057 possession (Score: 70-66)
Lamelo Irving attempts a Layup. BLOCKED BY JULIUS JAMES! Ball is loose! Rebound secured by Tim Sexton.

[07:48] Team_045 possession (Score: 70-66)
John Wagner attempts a Midrange. Contested by Scottie Johnson (4.3 feet, MAN). John Wagner misses. Offensive rebound by Julius James! Julius James kicks it out.

[07:38] Team_045 possession (Score: 70-66)
Stephen Paul attempts a Midrange. Contested by Zion Lillard (4.6 feet, MAN). Stephen Paul misses. Offensive rebound by Julius James! Julius James kicks it out.

[07:21] Team_045 possession (Score: 70-66)
Stephen Paul attempts a Layup. Wide open! Lamelo Irving is 7.1 feet away. [ZONE] Stephen Paul misses. Rebound secured by Lamelo Irving.

[07:02] Team_057 possession (Score: 70-66)
Bradley Ginobili drives, Julius James stays with him. Bradley Ginobili attempts a Layup. Contested by Julius James (2.1 feet, MAN). BRADLEY GINOBILI MAKES IT!
Score: 70-68

[06:50] Team_045 possession (Score: 70-68)
Julius James attempts a Midrange. Wide open! Joel Wade is 7.3 feet away. [ZONE] Julius James misses. Rebound secured by Joel Wade.

[06:38] Team_057 possession (Score: 70-68)
Lamelo Irving attempts a Midrange. Wide open! Tim Sexton is 9.2 feet away. [ZONE] LAMELO IRVING MAKES IT!
Score: 70-70

[06:25] Team_045 possession (Score: 70-70)
FOUL! Shooting foul on Lamelo Irving. John Wagner to the line for 2 free throws. [Team fouls: 1] (Lamelo Irving: 1 personal fouls)   FT 1/2: MISS   FT 2/2: MISS John Wagner makes 0/2 from the line. Offensive rebound by Tim Sexton! Tim Sexton kicks it out.

[06:12] Team_045 possession (Score: 70-70)
FOUL! Offensive foul on Stephen Paul! Zion Lillard drew the charge! [Team fouls: 2] (Stephen Paul: 1 personal fouls) TURNOVER! (dead ball)

[06:01] Team_057 possession (Score: 70-70)
Scottie Johnson drives, John Wagner stays with him. Scottie Johnson attempts a Layup. Wide open! John Wagner is 7.2 feet away. [MAN] SCOTTIE JOHNSON MAKES IT! Assist: Bradley Ginobili
Score: 70-72

[05:51] Team_045 possession (Score: 70-72)
Stephen Paul drives, Zion Lillard stays with him. Stephen Paul attempts a Dunk. Heavily contested by Zion Lillard (2.0 feet, MAN)! STEPHEN PAUL MAKES IT! Assist: John Wagner
Score: 72-72

[05:36] Team_057 possession (Score: 72-72)
Zion Lillard attempts a 3Pt. Wide open! John Wagner is 8.8 feet away. [ZONE] ZION LILLARD MAKES IT! Assist: Lamelo Irving
Score: 72-75

[05:22] Team_045 possession (Score: 72-75)
Gary Towns drives and kicks out. Tim Sexton attempts a 3Pt. Wide open! Lamelo Irving is 10.0 feet away. [MAN] TIM SEXTON MAKES IT! Assist: Gary Towns
Score: 75-75

[05:05] Team_057 possession (Score: 75-75)
Scottie Johnson drives, John Wagner stays with him. Scottie Johnson attempts a Dunk. Contested by John Wagner (3.0 feet, MAN). SCOTTIE JOHNSON MAKES IT! Assist: Bradley Ginobili
Score: 75-77

[04:51] Team_045 possession (Score: 75-77)
Tim Sexton attempts a Layup. Contested by Lamelo Irving (3.4 feet, ZONE). TIM SEXTON MAKES IT!
Score: 77-77

[04:36] Team_057 possession (Score: 77-77)
Bradley Ginobili drives and kicks out. Lamelo Irving attempts a 3Pt. Contested by Gary Towns (5.9 feet, ZONE). LAMELO IRVING MAKES IT! Assist: Scottie Johnson
Score: 77-80

[04:23] Team_045 possession (Score: 77-80)
Stephen Paul drives to the basket... FOUL! Offensive foul on Stephen Paul! Zion Lillard drew the charge! [Team fouls: 3] (Stephen Paul: 2 personal fouls) TURNOVER! (dead ball)

[04:13] Team_057 possession (Score: 77-80)
Bradley Ginobili makes the Layup and draws the foul on Julius James! And-1! Bradley Ginobili to the line for 1. [Team fouls: 4] (Julius James: 1 personal fouls)   FT 1/1: GOOD Bradley Ginobili makes 1/1 from the line.
Score: 77-83

[03:58] Team_045 possession (Score: 77-83)
Tim Sexton drives and kicks out. Gary Towns attempts a 3Pt. Wide open! Joel Wade is 6.5 feet away. [MAN] GARY TOWNS MAKES IT! Assist: John Wagner
Score: 80-83

[03:46] Team_057 possession (Score: 80-83)
FOUL! Offensive foul on Bradley Ginobili! Julius James drew the charge! [Team fouls: 2] (Bradley Ginobili: 1 personal fouls) TURNOVER! (dead ball)

[03:31] Team_045 possession (Score: 80-83)
John Wagner drives and kicks out. Gary Towns attempts a Midrange. Contested by Joel Wade (5.8 feet, ZONE). GARY TOWNS MAKES IT!
Score: 82-83

[03:19] Team_057 possession (Score: 82-83)
Lamelo Irving attempts a Midrange. Wide open! Tim Sexton is 6.1 feet away. [ZONE] Lamelo Irving misses. Offensive rebound by Zion Lillard! Zion Lillard puts it back in!
Score: 82-85

[03:04] Team_045 possession (Score: 82-85)
Stephen Paul makes the Dunk and draws the foul on Zion Lillard! And-1! Stephen Paul to the line for 1. [Team fouls: 3] (Zion Lillard: 1 personal fouls)   FT 1/1: MISS Stephen Paul makes 0/1 from the line. Offensive rebound by Tim Sexton! Tim Sexton kicks it out.
Score: 84-85

[02:50] Team_045 possession (Score: 84-85)
Tim Sexton attempts a Midrange. Wide open! Lamelo Irving is 6.3 feet away. [MAN] TIM SEXTON MAKES IT! Assist: John Wagner
Score: 86-85

[02:40] Team_057 possession (Score: 86-85)
Zion Lillard drives, Stephen Paul stays with him. Zion Lillard attempts a Dunk. Contested by Stephen Paul (3.1 feet, ZONE). Zion Lillard misses. Rebound secured by Julius James.

[02:29] Team_045 possession (Score: 86-85)
Tim Sexton attempts a 3Pt. Contested by Scottie Johnson (3.2 feet, ZONE). Tim Sexton misses. Rebound secured by Zion Lillard.

[02:14] Team_057 possession (Score: 86-85)
Joel Wade makes the Layup and draws the foul on Stephen Paul! And-1! Joel Wade to the line for 1. [BONUS: 5 team fouls] (Stephen Paul: 3 personal fouls)   FT 1/1: GOOD Joel Wade makes 1/1 from the line.
Score: 86-88

[01:57] Team_045 possession (Score: 86-88)
Gary Towns makes the Layup and draws the foul on Lamelo Irving! And-1! Gary Towns to the line for 1. [Team fouls: 4] (Lamelo Irving: 2 personal fouls)   FT 1/1: GOOD Gary Towns makes 1/1 from the line.
Score: 89-88

[01:46] Team_057 possession (Score: 89-88)
Scottie Johnson attempts a 3Pt. Contested by John Wagner (2.3 feet, ZONE). Scottie Johnson misses. Rebound secured by Stephen Paul.

[01:29] Team_045 possession (Score: 89-88)
Julius James attempts a 3Pt. Contested by Scottie Johnson (5.7 feet, ZONE). JULIUS JAMES MAKES IT! Assist: Tim Sexton
Score: 92-88

[01:16] Team_057 possession (Score: 92-88)
Scottie Johnson attempts a 3Pt. Contested by John Wagner (4.8 feet, ZONE). SCOTTIE JOHNSON MAKES IT! Assist: Bradley Ginobili
Score: 92-91

[01:04] Team_045 possession (Score: 92-91)
John Wagner attempts a Midrange. Contested by Scottie Johnson (5.5 feet, MAN). John Wagner misses. Offensive rebound by Julius James! Julius James kicks it out.

[00:48] Team_045 possession (Score: 92-91)
Julius James attempts a 3Pt. Contested by Scottie Johnson (4.0 feet, ZONE). JULIUS JAMES MAKES IT! Assist: Stephen Paul
Score: 95-91

[00:30] Team_057 possession (Score: 95-91)
Scottie Johnson throws a bad pass out of bounds! TURNOVER! (dead ball)

[00:14] Team_045 possession (Score: 95-91)
John Wagner drives to the basket... John Wagner throws a bad pass! Stolen by Scottie Johnson! TURNOVER! (live ball)

================================================================================
                              4TH QUARTER COMPLETE                              
================================================================================

4TH QUARTER SCORE: Team_045 25, Team_057 34

BOX SCORE:
================================================================================

Team_045
--------------------------------------------------------------------------------
Player                MIN  PTS  REB  AST  TO      FG   FG%      3P   3P%
--------------------------------------------------------------------------------
Gary Towns             13    8    0    1   0   3/3   100.0     0/0   0.0
Tim Sexton             13    7    3    1   0   3/4    75.0     0/0   0.0
Julius James           13    6    4    0   0   2/3    66.7     0/0   0.0
Stephen Paul           13    2    1    1   0   1/2    50.0     0/0   0.0
Rudy Antetokounmpo     36    0    0    0   0   0/2     0.0     0/0   0.0
DeMar Turner           36    0    1    0   0   0/3     0.0     0/0   0.0
Trae Russell           36    0    0    0   0   0/1     0.0     0/0   0.0
Zion Butler            36    0    1    0   0   0/0     0.0     0/0   0.0
Cole Simons            36    0    0    0   0   0/1     0.0     0/0   0.0
John Wagner            13    0    0    3   0   0/1     0.0     0/0   0.0

TEAM: FG: 9/20 (45.0%), 3PT: 2/8 (25.0%), REB: 10 (5 off, 5 def), AST: 6, TO: 4
TEAM FOULS: 5 [Team_057 in BONUS]


Team_057
--------------------------------------------------------------------------------
Player                MIN  PTS  REB  AST  TO      FG   FG%      3P   3P%
--------------------------------------------------------------------------------
Bradley Ginobili       13    7    0    3   0   3/3   100.0     0/0   0.0
Scottie Johnson        13    7    0    1   0   3/4    75.0     0/0   0.0
Klay Rozier            36    6    0    0   0   3/4    75.0     0/0   0.0
Zion Lillard           13    5    3    0   0   2/3    66.7     0/0   0.0
Lamelo Irving          13    5    1    1   0   2/3    66.7     0/0   0.0
Joel Wade              13    3    1    0   0   1/1   100.0     0/0   0.0
Miles Middleton        36    1    3    0   0   1/1   100.0     0/0   0.0
Anfernee Adebayo       36    0    2    1   0   0/0     0.0     0/0   0.0
Ben Adebayo            36    0    2    0   0   0/1     0.0     0/0   0.0

TEAM: FG: 15/20 (75.0%), 3PT: 2/4 (50.0%), REB: 12 (1 off, 11 def), AST: 6, TO: 3
TEAM FOULS: 4

================================================================================

================================================================================
                               FULL GAME COMPLETE                               
================================================================================

FINAL SCORE: Team_045 95, Team_057 91

SCORING BY QUARTER:
--------------------------------------------------------------------------------
Team                     Q1     Q2     Q3     Q4    FINAL
--------------------------------------------------------------------------------
Team_045                 20     24     26     25       95
Team_057                 19     20     18     34       91
--------------------------------------------------------------------------------

FULL GAME BOX SCORE:
================================================================================

Team_045
--------------------------------------------------------------------------------
Player                MIN  PTS  REB  AST  TO      FG   FG%      3P   3P%      FT STL BLK
--------------------------------------------------------------------------------
Rudy Antetokounmpo     36   10    0    2   3   5/11   45.5   1/3    33.3   2/3     2   0
Trae Russell           36   11    0    3   4   4/13   30.8   2/6    33.3   1/1     0   0
Cole Simons            36    8    8    0   0   3/11   27.3   1/4    25.0   1/1     1   0
DeMar Turner           36   16   12    2   1   7/15   46.7   1/6    16.7   3/3     1   0
Zion Butler            36   11   12    1   1   3/9    33.3   0/3     0.0   3/3     0   1
John Wagner            13    2    0    3   1   3/5    60.0   1/1   100.0   0/2     0   0
Julius James           13   11    4    0   1   3/4    75.0   2/2   100.0   3/3     1   1
Gary Towns             13    8    0    1   0   2/3    66.7   0/0     0.0   1/1     0   0
Tim Sexton             13   10    5    2   1   4/6    66.7   0/2     0.0   1/1     0   0
Stephen Paul           13    4    2    1   1   2/3    66.7   0/0     0.0   0/1     0   0

TEAM: FG: 37/81 (45.7%), 3PT: 8/27 (29.6%), REB: 42 (12 off, 30 def), AST: 15, TO: 13


Team_057
--------------------------------------------------------------------------------
Player                MIN  PTS  REB  AST  TO      FG   FG%      3P   3P%      FT STL BLK
--------------------------------------------------------------------------------
Kobe Ming              36    0    0    3   4   1/9    11.1   0/7     0.0   0/0     1   0
Klay Rozier            36   15    0    3   4   6/10   60.0   1/2    50.0   8/9     1   1
Anfernee Adebayo       36   11   10    3   3   4/9    44.4   1/3    33.3   0/2     0   0
Ben Adebayo            36   14   17    4   3   6/13   46.2   0/2     0.0   3/3     1   3
Miles Middleton        36   17   13    2   1   9/10   90.0   0/0     0.0   1/2     1   0
Scottie Johnson        13    8    0    1   1   4/5    80.0   1/2    50.0   1/2     1   0
Bradley Ginobili       13    7    0    4   3   4/5    80.0   0/0     0.0   1/1     0   1
Joel Wade              13    6    2    0   0   2/2   100.0   1/1   100.0   1/1     0   0
Lamelo Irving          13    7    1    1   0   3/5    60.0   0/0     0.0   2/2     0   0
Zion Lillard           13    5    5    0   0   1/2    50.0   1/1   100.0   0/0     0   0

TEAM: FG: 41/71 (57.7%), 3PT: 5/18 (27.8%), REB: 49 (6 off, 43 def), AST: 21, TO: 19

================================================================================
