================================================================================
                        FULL GAME - Team_081 vs Team_010                        
================================================================================

================================================================================
                       1ST QUARTER - Team_081 vs Team_010                       
================================================================================

[12:00] Team_081 possession (Score: 0-0)
Julius Durant attempts a Layup. BLOCKED BY CADE MORANT! Ball goes out off Cade Morant. Julius Durant's ball!

[11:46] Team_081 possession (Score: 0-0)
Vince Adebayo attempts a Midrange. Wide open! RJ Young is 6.7 feet away. [MAN] VINCE ADEBAYO MAKES IT! Assist: Bradley Leonard
Score: 2-0

[11:31] Team_010 possession (Score: 2-0)
Desmond Antetokounmpo drives, Franz Antetokounmpo stays with him. Desmond Antetokounmpo attempts a Layup. Contested by Franz Antetokounmpo (2.7 feet, ZONE). DESMOND ANTETOKOUNMPO MAKES IT!
Score: 2-2

[11:19] Team_081 possession (Score: 2-2)
Bradley Leonard drives and kicks out. Bradley Sabonis attempts a Midrange. Contested by Anthony Durant (2.8 feet, ZONE). Bradley Sabonis misses. Offensive rebound by Franz Antetokounmpo! Franz Antetokounmpo's putback is no good. Offensive rebound by Bradley Sabonis! Bradley Sabonis kicks it out.

[11:09] Team_081 possession (Score: 2-2)
Bradley Leonard attempts a 3Pt. Heavily contested by Michael Turner (1.8 feet, MAN)! BRADLEY LEONARD MAKES IT! Assist: Vince Adebayo
Score: 5-2

[10:57] Team_010 possession (Score: 5-2)
Anthony Durant drives and kicks out. Cade Morant attempts a Midrange. Contested by Vince Adebayo (4.9 feet, ZONE). Cade Morant misses. Rebound secured by Vince Adebayo.

[10:40] Team_081 possession (Score: 5-2)
FOUL! Offensive foul on Bradley Leonard! Michael Turner drew the charge! [Team fouls: 1] (Bradley Leonard: 1 personal fouls) TURNOVER! (dead ball)

[10:24] Team_010 possession (Score: 5-2)
Cade Morant attempts a Layup. Contested by Franz Antetokounmpo (5.9 feet, ZONE). CADE MORANT MAKES IT!
Score: 5-4

[10:07] Team_081 possession (Score: 5-4)
Bradley Sabonis drives, Desmond Antetokounmpo stays with him. Bradley Sabonis attempts a Layup. Contested by Desmond Antetokounmpo (5.3 feet, MAN). Bradley Sabonis misses. Rebound secured by Anthony Durant.

[09:50] Team_010 possession (Score: 5-4)
Michael Turner attempts a 3Pt. Contested by Bradley Leonard (4.8 feet, MAN). MICHAEL TURNER MAKES IT! Assist: RJ Young
Score: 5-7

[09:33] Team_081 possession (Score: 5-7)
Bradley Sabonis attempts a 3Pt. Contested by Cade Morant (4.2 feet, ZONE). BRADLEY SABONIS MAKES IT! Assist: Franz Antetokounmpo
Score: 8-7

[09:18] Team_010 possession (Score: 8-7)
RJ Young throws a bad pass out of bounds! TURNOVER! (dead ball)

[09:02] Team_081 possession (Score: 8-7)
Franz Antetokounmpo attempts a 3Pt. Contested by Cade Morant (5.9 feet, ZONE). FRANZ ANTETOKOUNMPO MAKES IT!
Score: 11-7

[08:50] Team_010 possession (Score: 11-7)
Desmond Antetokounmpo attempts a 3Pt. Contested by Julius Durant (4.1 feet, ZONE). Desmond Antetokounmpo misses. Rebound secured by Bradley Sabonis.

[08:34] Team_081 possession (Score: 11-7)
Vince Adebayo attempts a 3Pt. Contested by RJ Young (5.2 feet, MAN). Vince Adebayo misses. Rebound secured by Desmond Antetokounmpo.

[08:23] Team_010 possession (Score: 11-7)
Anthony Durant drives and kicks out. Cade Morant attempts a 3Pt. Contested by Julius Durant (3.7 feet, MAN). CADE MORANT MAKES IT! Assist: Desmond Antetokounmpo
Score: 11-10

[08:08] Team_081 possession (Score: 11-10)
Bradley Sabonis attempts a Layup. Heavily contested by Anthony Durant (0.7 feet, ZONE)! BRADLEY SABONIS MAKES IT!
Score: 13-10

[07:56] Team_010 possession (Score: 13-10)
Cade Morant attempts a 3Pt. Contested by Julius Durant (4.2 feet, MAN). CADE MORANT MAKES IT! Assist: Michael Turner
Score: 13-13

[07:44] Team_081 possession (Score: 13-13)
Bradley Leonard commits a violation (traveling/carry)! TURNOVER! (dead ball)

[07:27] Team_010 possession (Score: 13-13)
RJ Young attempts a 3Pt. Contested by Vince Adebayo (2.6 feet, ZONE). RJ Young misses. Rebound secured by Bradley Sabonis.

[07:10] Team_081 possession (Score: 13-13)
Bradley Sabonis drives and kicks out. Bradley Leonard attempts a 3Pt. Contested by Michael Turner (2.7 feet, MAN). Bradley Leonard misses. FOUL! Loose ball foul on Cade Morant during the rebound battle. [Team fouls: 1] No free throws, side out. (Cade Morant: 1 personal fouls)

[06:57] Team_081 possession (Score: 13-13)
Bradley Sabonis makes the Layup and draws the foul on Anthony Durant! And-1! Bradley Sabonis to the line for 1. [Team fouls: 2] (Anthony Durant: 1 personal fouls)   FT 1/1: GOOD Bradley Sabonis makes 1/1 from the line.
Score: 16-13

[06:40] Team_010 possession (Score: 16-13)
RJ Young attempts a 3Pt. Contested by Vince Adebayo (2.6 feet, MAN). RJ Young misses. Offensive rebound by Anthony Durant! Anthony Durant kicks it out.

[06:30] Team_010 possession (Score: 16-13)
RJ Young attempts a 3Pt. Contested by Vince Adebayo (3.4 feet, MAN). RJ Young misses. Rebound secured by Vince Adebayo.

[06:20] Team_081 possession (Score: 16-13)
Franz Antetokounmpo attempts a Midrange. Contested by Desmond Antetokounmpo (4.9 feet, ZONE). Franz Antetokounmpo misses. Offensive rebound by Franz Antetokounmpo! Franz Antetokounmpo puts it back in!
Score: 18-13

[06:06] Team_010 possession (Score: 18-13)
Anthony Durant attempts a Layup. BLOCKED BY FRANZ ANTETOKOUNMPO! Ball deflects out of bounds off Anthony Durant.

[05:50] Team_081 possession (Score: 18-13)
Bradley Leonard makes the 3Pt and draws the foul on Michael Turner! And-1! Bradley Leonard to the line for 1. [Team fouls: 3] (Michael Turner: 1 personal fouls)   FT 1/1: GOOD Bradley Leonard makes 1/1 from the line.
Score: 22-13

[05:39] Team_010 possession (Score: 22-13)
RJ Young attempts a Layup. BLOCKED BY VINCE ADEBAYO! Ball is loose! Offensive rebound by Cade Morant! Cade Morant kicks it out.

[05:25] Team_010 possession (Score: 22-13)
Anthony Durant attempts a 3Pt. Heavily contested by Vince Adebayo (1.6 feet, ZONE)! Anthony Durant misses. Rebound secured by Franz Antetokounmpo.

[05:11] Team_081 possession (Score: 22-13)
Bradley Leonard attempts a Midrange. Contested by RJ Young (5.8 feet, ZONE). Bradley Leonard misses. Rebound secured by Michael Turner.

[04:57] Team_010 possession (Score: 22-13)
RJ Young makes the Layup and draws the foul on Vince Adebayo! And-1! RJ Young to the line for 1. [Team fouls: 2] (Vince Adebayo: 1 personal fouls)   FT 1/1: MISS RJ Young makes 0/1 from the line. FOUL! Loose ball foul on Bradley Sabonis during the free throw rebound! [Team fouls: 3] No free throws, side out. (Bradley Sabonis: 1 personal fouls)
Score: 22-15

[04:45] Team_010 possession (Score: 22-15)
Michael Turner attempts a 3Pt. Contested by Bradley Leonard (2.9 feet, MAN). Michael Turner misses. Rebound secured by Vince Adebayo.

[04:33] Team_081 possession (Score: 22-15)
FOUL! Reach-in foul on Anthony Durant during the drive. [Team fouls: 4] No free throws, side out. (Anthony Durant: 2 personal fouls)

[04:19] Team_081 possession (Score: 22-15)
FOUL! Holding foul on Michael Turner. [IN THE BONUS! 5 team fouls] Bradley Leonard to the line for 2 free throws. (Michael Turner: 2 personal fouls)   FT 1/2: MISS   FT 2/2: GOOD Bradley Leonard makes 1/2 from the line.
Score: 23-15

[04:06] Team_010 possession (Score: 23-15)
Michael Turner attempts a 3Pt. Contested by Bradley Leonard (5.6 feet, MAN). Michael Turner misses. Rebound secured by Bradley Sabonis.

[03:51] Team_081 possession (Score: 23-15)
Julius Durant drives, Anthony Durant stays with him. Julius Durant attempts a Dunk. Heavily contested by Anthony Durant (0.5 feet, ZONE)! Julius Durant misses. Rebound secured by Michael Turner.

[03:36] Team_010 possession (Score: 23-15)
RJ Young drives, picks up Vince Adebayo. Help arrives from Bradley Leonard! RJ Young attempts a Dunk. Contested by Bradley Leonard (3.3 feet, MAN). RJ YOUNG MAKES IT! Assist: Michael Turner
Score: 23-17

[03:22] Team_081 possession (Score: 23-17)
FOUL! Reach-in foul on Anthony Durant during the drive. [IN THE BONUS! 6 team fouls] Bradley Leonard to the line for 2 free throws. (Anthony Durant: 3 personal fouls)   FT 1/2: MISS   FT 2/2: GOOD Bradley Leonard makes 1/2 from the line.
Score: 24-17

[03:05] Team_010 possession (Score: 24-17)
Desmond Antetokounmpo makes the Dunk and draws the foul on Bradley Leonard! And-1! Desmond Antetokounmpo to the line for 1. [Team fouls: 4] (Bradley Leonard: 2 personal fouls)   FT 1/1: GOOD Desmond Antetokounmpo makes 1/1 from the line.
Score: 24-20

[02:51] Team_081 possession (Score: 24-20)
Bradley Sabonis throws a bad pass! Stolen by Desmond Antetokounmpo! TURNOVER! (live ball)

[02:41] Team_010 possession (Score: 24-20)
Desmond Antetokounmpo drives and kicks out. Desmond Antetokounmpo attempts a 3Pt. Wide open! Bradley Leonard is 6.1 feet away. [ZONE] DESMOND ANTETOKOUNMPO MAKES IT! Assist: Cade Morant
Score: 24-23

[02:28] Team_081 possession (Score: 24-23)
Franz Antetokounmpo drives and kicks out. Bradley Leonard attempts a Midrange. Contested by RJ Young (5.1 feet, ZONE). Bradley Leonard misses. Rebound secured by Michael Turner.

[02:17] Team_010 possession (Score: 24-23)
Michael Turner attempts a 3Pt. Contested by Bradley Leonard (2.7 feet, MAN). MICHAEL TURNER MAKES IT! Assist: Anthony Durant
Score: 24-26

[02:07] Team_081 possession (Score: 24-26)
FOUL! Shooting foul on Cade Morant. Julius Durant to the line for 3 free throws. [BONUS: 7 team fouls] (Cade Morant: 2 personal fouls)   FT 1/3: GOOD   FT 2/3: GOOD   FT 3/3: MISS Julius Durant makes 2/3 from the line. Rebound secured by Anthony Durant.
Score: 26-26

[01:51] Team_010 possession (Score: 26-26)
Desmond Antetokounmpo attempts a Midrange. Contested by Bradley Sabonis (4.3 feet, MAN). DESMOND ANTETOKOUNMPO MAKES IT! Assist: RJ Young
Score: 26-28

[01:38] Team_081 possession (Score: 26-28)
Bradley Sabonis drives and kicks out. Vince Adebayo attempts a 3Pt. Wide open! Michael Turner is 7.3 feet away. [ZONE] VINCE ADEBAYO MAKES IT!
Score: 29-28

[01:22] Team_010 possession (Score: 29-28)
Desmond Antetokounmpo drives to the basket... Desmond Antetokounmpo throws a bad pass! Stolen by Bradley Sabonis! TURNOVER! (live ball)

[01:10] Team_081 possession (Score: 29-28)
Bradley Leonard drives, picks up Michael Turner. Help arrives from Cade Morant! Bradley Leonard attempts a Dunk. Contested by Cade Morant (2.7 feet, MAN). Bradley Leonard misses. Rebound secured by Anthony Durant.

[00:54] Team_010 possession (Score: 29-28)
RJ Young drives, Vince Adebayo stays with him. RJ Young attempts a Layup. Contested by Vince Adebayo (5.1 feet, MAN). RJ YOUNG MAKES IT! Assist: Desmond Antetokounmpo
Score: 29-30

[00:39] Team_081 possession (Score: 29-30)
Julius Durant attempts a Midrange. Wide open! Cade Morant is 6.4 feet away. [MAN] JULIUS DURANT MAKES IT! Assist: Bradley Leonard
Score: 31-30

[00:24] Team_010 possession (Score: 31-30)
Desmond Antetokounmpo attempts a 3Pt. Contested by Bradley Leonard (2.9 feet, ZONE). Desmond Antetokounmpo misses. Offensive rebound by Cade Morant! Cade Morant kicks it out.

[00:09] Team_010 possession (Score: 31-30)
Michael Turner drives, Bradley Leonard stays with him. Michael Turner attempts a Dunk. Contested by Bradley Leonard (2.2 feet, MAN). Michael Turner misses. Rebound secured by Franz Antetokounmpo.

================================================================================
                              1ST QUARTER COMPLETE                              
================================================================================

1ST QUARTER SCORE: Team_081 31, Team_010 30

BOX SCORE:
================================================================================

Team_081
--------------------------------------------------------------------------------
Player                MIN  PTS  REB  AST  TO      FG   FG%      3P   3P%
--------------------------------------------------------------------------------
Bradley Leonard        12    9    0    2   0   4/6    66.7     0/0   0.0
Bradley Sabonis        12    8    4    0   0   3/4    75.0     0/0   0.0
Vince Adebayo          12    5    3    1   0   2/3    66.7     0/0   0.0
Franz Antetokounmpo    12    5    4    1   0   2/3    66.7     0/0   0.0
Julius Durant          12    2    0    0   0   1/3    33.3     0/0   0.0

TEAM: FG: 12/19 (63.2%), 3PT: 4/6 (66.7%), REB: 11 (3 off, 8 def), AST: 4, TO: 3
TEAM FOULS: 4


Team_010
--------------------------------------------------------------------------------
Player                MIN  PTS  REB  AST  TO      FG   FG%      3P   3P%
--------------------------------------------------------------------------------
Desmond Antetokounmpo   12   10    1    2   0   4/5    80.0     0/0   0.0
Cade Morant            12    8    2    1   0   3/3   100.0     0/0   0.0
Michael Turner         12    6    3    2   0   2/5    40.0     0/0   0.0
RJ Young               12    4    0    2   0   2/4    50.0     0/0   0.0
Anthony Durant         12    0    5    1   0   0/3     0.0     0/0   0.0

TEAM: FG: 11/20 (55.0%), 3PT: 3/9 (33.3%), REB: 11 (4 off, 7 def), AST: 8, TO: 2
TEAM FOULS: 7 [Team_081 in BONUS]

================================================================================

================================================================================
                       2ND QUARTER - Team_081 vs Team_010                       
================================================================================

[12:00] Team_081 possession (Score: 31-30)
Bradley Sabonis drives and kicks out. Bradley Leonard attempts a Midrange. Contested by Michael Turner (5.0 feet, MAN). BRADLEY LEONARD MAKES IT! Assist: Franz Antetokounmpo
Score: 33-30

[11:43] Team_010 possession (Score: 33-30)
Anthony Durant attempts a Midrange. Contested by Franz Antetokounmpo (2.1 feet, MAN). Anthony Durant misses. Rebound secured by Bradley Sabonis.

[11:31] Team_081 possession (Score: 33-30)
Bradley Sabonis attempts a Layup. Heavily contested by Anthony Durant (1.8 feet, ZONE)! BRADLEY SABONIS MAKES IT! Assist: Vince Adebayo
Score: 35-30

[11:15] Team_010 possession (Score: 35-30)
Anthony Durant drives and kicks out. Michael Turner attempts a Midrange. Contested by Bradley Sabonis (3.9 feet, ZONE). Michael Turner misses. Rebound secured by Bradley Sabonis.

[11:05] Team_081 possession (Score: 35-30)
Bradley Leonard attempts a 3Pt. Contested by Michael Turner (4.0 feet, MAN). Bradley Leonard misses. Rebound secured by Cade Morant.

[10:47] Team_010 possession (Score: 35-30)
Desmond Antetokounmpo attempts a 3Pt. Contested by Bradley Sabonis (5.7 feet, MAN). Desmond Antetokounmpo misses. Offensive rebound by Cade Morant! Cade Morant kicks it out.

[10:29] Team_010 possession (Score: 35-30)
Michael Turner attempts a 3Pt. Contested by Bradley Leonard (4.5 feet, MAN). Michael Turner misses. Offensive rebound by Anthony Durant! Anthony Durant kicks it out.

[10:13] Team_010 possession (Score: 35-30)
Anthony Durant attempts a Midrange. Wide open! Julius Durant is 10.0 feet away. [ZONE] ANTHONY DURANT MAKES IT! Assist: Cade Morant
Score: 35-32

[09:59] Team_081 possession (Score: 35-32)
Bradley Sabonis drives, picks up Desmond Antetokounmpo. Help arrives from Cade Morant! Bradley Sabonis attempts a Dunk. Heavily contested by Cade Morant (1.9 feet, MAN)! BRADLEY SABONIS MAKES IT! Assist: Julius Durant
Score: 37-32

[09:49] Team_010 possession (Score: 37-32)
Anthony Durant attempts a Layup. Contested by Franz Antetokounmpo (3.6 feet, MAN). Anthony Durant misses. Rebound secured by Vince Adebayo.

[09:40] Team_081 possession (Score: 37-32)
Franz Antetokounmpo attempts a Dunk. BLOCKED BY ANTHONY DURANT! Ball deflects out of bounds off Franz Antetokounmpo.

[09:24] Team_010 possession (Score: 37-32)
Desmond Antetokounmpo attempts a Midrange. Contested by Bradley Sabonis (4.8 feet, MAN). Desmond Antetokounmpo misses. Rebound secured by Vince Adebayo.

[09:07] Team_081 possession (Score: 37-32)
FOUL! Holding foul on Cade Morant. [Team fouls: 1] No free throws, side out. (Cade Morant: 1 personal fouls)

[08:50] Team_081 possession (Score: 37-32)
Bradley Leonard attempts a Layup. BLOCKED BY CADE MORANT! Ball is loose! Rebound secured by Anthony Durant.

[08:38] Team_010 possession (Score: 37-32)
Cade Morant attempts a Layup. Contested by Julius Durant (3.8 feet, MAN). CADE MORANT MAKES IT! Assist: RJ Young
Score: 37-34

[08:22] Team_081 possession (Score: 37-34)
Bradley Sabonis drives to the basket... Bradley Sabonis loses control! Ball rolls out of bounds! TURNOVER! (dead ball)

[08:22] Substitution (Team_081): Julius Durant OUT → Dejounte Bane IN (stamina_rule2)

[08:22] Substitution (Team_081): Bradley Leonard OUT → Lamelo Wade IN (stamina_rule2)

[08:22] Substitution (Team_081): Vince Adebayo OUT → Larry Adebayo IN (stamina_rule2)

[08:22] Substitution (Team_081): Bradley Sabonis OUT → Chris Holiday IN (stamina_rule2)

[08:22] Substitution (Team_081): Franz Antetokounmpo OUT → D'Angelo Markkanen IN (stamina_rule2)

[08:22] Substitution (Team_010): Cade Morant OUT → Draymond Leonard IN (stamina_rule2)

[08:22] Substitution (Team_010): Michael Turner OUT → Blake Harden IN (stamina_rule2)

[08:22] Substitution (Team_010): RJ Young OUT → Ben Gilgeous-Alexander IN (stamina_rule2)

[08:22] Substitution (Team_010): Desmond Antetokounmpo OUT → Vince Ingram IN (stamina_rule2)

[08:22] Substitution (Team_010): Anthony Durant OUT → Paolo Wade IN (stamina_rule2)

[08:04] Team_010 possession (Score: 37-34)
Ben Gilgeous-Alexander attempts a Midrange. Wide open! Larry Adebayo is 9.1 feet away. [MAN] Ben Gilgeous-Alexander misses. Rebound secured by Chris Holiday.

[07:47] Team_081 possession (Score: 37-34)
Chris Holiday attempts a Midrange. Contested by Ben Gilgeous-Alexander (5.6 feet, ZONE). Chris Holiday misses. Rebound secured by Blake Harden.

[07:32] Team_010 possession (Score: 37-34)
Paolo Wade attempts a Layup. Contested by Chris Holiday (2.9 feet, ZONE). Paolo Wade misses. Rebound secured by Larry Adebayo.

[07:20] Team_081 possession (Score: 37-34)
Dejounte Bane attempts a 3Pt. Contested by Draymond Leonard (5.1 feet, MAN). DEJOUNTE BANE MAKES IT! Assist: Larry Adebayo
Score: 40-34

[07:03] Team_010 possession (Score: 40-34)
Draymond Leonard attempts a Midrange. Contested by Lamelo Wade (2.5 feet, ZONE). Draymond Leonard misses. Rebound secured by Lamelo Wade.

[06:52] Team_081 possession (Score: 40-34)
Chris Holiday attempts a Layup. Contested by Vince Ingram (2.5 feet, MAN). CHRIS HOLIDAY MAKES IT! Assist: Lamelo Wade
Score: 42-34

[06:41] Team_010 possession (Score: 42-34)
Draymond Leonard attempts a 3Pt. Wide open! Dejounte Bane is 6.3 feet away. [MAN] DRAYMOND LEONARD MAKES IT! Assist: Vince Ingram
Score: 42-37

[06:28] Team_081 possession (Score: 42-37)
Lamelo Wade attempts a 3Pt. Contested by Blake Harden (4.4 feet, MAN). Lamelo Wade misses. Rebound secured by Ben Gilgeous-Alexander.

[06:16] Team_010 possession (Score: 42-37)
Ben Gilgeous-Alexander drives and kicks out. Draymond Leonard attempts a 3Pt. Contested by Chris Holiday (5.5 feet, ZONE). DRAYMOND LEONARD MAKES IT! Assist: Vince Ingram
Score: 42-40

[06:05] Team_081 possession (Score: 42-40)
Chris Holiday throws a bad pass! Stolen by Vince Ingram! TURNOVER! (live ball)

[05:55] Team_010 possession (Score: 42-40)
Blake Harden attempts a 3Pt. Heavily contested by Lamelo Wade (1.3 feet, MAN)! Blake Harden misses. Rebound secured by Larry Adebayo.

[05:38] Team_081 possession (Score: 42-40)
Lamelo Wade attempts a 3Pt. Wide open! Blake Harden is 7.2 feet away. [MAN] LAMELO WADE MAKES IT! Assist: Larry Adebayo
Score: 45-40

[05:26] Team_010 possession (Score: 45-40)
Blake Harden attempts a Layup. Wide open! D'Angelo Markkanen is 6.1 feet away. [ZONE] BLAKE HARDEN MAKES IT!
Score: 45-42

[05:15] Team_081 possession (Score: 45-42)
Lamelo Wade drives, picks up Blake Harden. Help arrives from Ben Gilgeous-Alexander! Lamelo Wade attempts a Dunk. Contested by Ben Gilgeous-Alexander (4.6 feet, MAN). LAMELO WADE MAKES IT! Assist: Larry Adebayo
Score: 47-42

[05:01] Team_010 possession (Score: 47-42)
Vince Ingram drives to the basket... Vince Ingram commits a violation (traveling/carry)! TURNOVER! (dead ball)

[04:47] Team_081 possession (Score: 47-42)
Chris Holiday drives, Paolo Wade stays with him. Chris Holiday attempts a Dunk. Contested by Paolo Wade (4.1 feet, ZONE). CHRIS HOLIDAY MAKES IT!
Score: 49-42

[04:33] Team_010 possession (Score: 49-42)
Blake Harden attempts a Midrange. Wide open! D'Angelo Markkanen is 7.5 feet away. [ZONE] BLAKE HARDEN MAKES IT!
Score: 49-44

[04:22] Team_081 possession (Score: 49-44)
D'Angelo Markkanen drives, picks up Paolo Wade. Help arrives from Blake Harden! D'Angelo Markkanen attempts a Dunk. Heavily contested by Blake Harden (0.5 feet, ZONE)! D'Angelo Markkanen misses. Rebound secured by Ben Gilgeous-Alexander.

[04:05] Team_010 possession (Score: 49-44)
Blake Harden attempts a Midrange. Contested by Larry Adebayo (4.4 feet, ZONE). BLAKE HARDEN MAKES IT!
Score: 49-46

[03:50] Team_081 possession (Score: 49-46)
D'Angelo Markkanen makes the Dunk and draws the foul on Paolo Wade! And-1! D'Angelo Markkanen to the line for 1. [Team fouls: 2] (Paolo Wade: 1 personal fouls)   FT 1/1: GOOD D'Angelo Markkanen makes 1/1 from the line.
Score: 52-46

[03:40] Team_010 possession (Score: 52-46)
Draymond Leonard throws a bad pass! Stolen by Dejounte Bane! TURNOVER! (live ball)

[03:30] Team_081 possession (Score: 52-46)
Chris Holiday attempts a 3Pt. Contested by Draymond Leonard (2.3 feet, ZONE). Chris Holiday misses. Rebound secured by Blake Harden.

[03:18] Team_010 possession (Score: 52-46)
Ben Gilgeous-Alexander loses the ball! Stripped by Larry Adebayo! TURNOVER! (live ball)

[03:05] Team_081 possession (Score: 52-46)
Dejounte Bane attempts a 3Pt. Contested by Vince Ingram (2.4 feet, ZONE). DEJOUNTE BANE MAKES IT! Assist: D'Angelo Markkanen
Score: 55-46

[02:49] Team_010 possession (Score: 55-46)
Vince Ingram drives and kicks out. Blake Harden attempts a 3Pt. Contested by Chris Holiday (4.9 feet, ZONE). BLAKE HARDEN MAKES IT! Assist: Draymond Leonard
Score: 55-49

[02:32] Team_081 possession (Score: 55-49)
Larry Adebayo makes the Layup and draws the foul on Paolo Wade! And-1! Larry Adebayo to the line for 1. [Team fouls: 3] (Paolo Wade: 2 personal fouls)   FT 1/1: GOOD Larry Adebayo makes 1/1 from the line.
Score: 58-49

[02:17] Team_010 possession (Score: 58-49)
Ben Gilgeous-Alexander makes the Layup and draws the foul on Chris Holiday! And-1! Ben Gilgeous-Alexander to the line for 1. [Team fouls: 1] (Chris Holiday: 1 personal fouls)   FT 1/1: MISS Ben Gilgeous-Alexander makes 0/1 from the line. Rebound secured by Lamelo Wade.
Score: 58-51

[02:05] Team_081 possession (Score: 58-51)
Larry Adebayo attempts a 3Pt. Heavily contested by Draymond Leonard (1.7 feet, ZONE)! Larry Adebayo misses. Offensive rebound by Lamelo Wade! Lamelo Wade kicks it out.

[01:49] Team_081 possession (Score: 58-51)
Larry Adebayo drives and kicks out. Dejounte Bane attempts a Midrange. Contested by Vince Ingram (5.7 feet, ZONE). DEJOUNTE BANE MAKES IT! Assist: Larry Adebayo
Score: 60-51

[01:39] Team_010 possession (Score: 60-51)
Blake Harden attempts a Midrange. Wide open! D'Angelo Markkanen is 9.6 feet away. [ZONE] BLAKE HARDEN MAKES IT! Assist: Draymond Leonard
Score: 60-53

[01:20] Team_081 possession (Score: 60-53)
Larry Adebayo attempts a Midrange. Contested by Ben Gilgeous-Alexander (4.0 feet, MAN). Larry Adebayo misses. Rebound secured by Ben Gilgeous-Alexander.

[01:06] Team_010 possession (Score: 60-53)
Draymond Leonard drives, picks up Dejounte Bane. Help arrives from Lamelo Wade! Draymond Leonard attempts a Dunk. Contested by Lamelo Wade (3.2 feet, MAN). DRAYMOND LEONARD MAKES IT! Assist: Blake Harden
Score: 60-55

[00:51] Team_081 possession (Score: 60-55)
Lamelo Wade drives to the basket... Lamelo Wade throws a bad pass out of bounds! TURNOVER! (dead ball)

[00:36] Team_010 possession (Score: 60-55)
Ben Gilgeous-Alexander drives, picks up Larry Adebayo. Help arrives from Lamelo Wade! Ben Gilgeous-Alexander attempts a Layup. Wide open! Lamelo Wade is 6.2 feet away. [MAN] BEN GILGEOUS-ALEXANDER MAKES IT! Assist: Vince Ingram
Score: 60-57

[00:19] Team_081 possession (Score: 60-57)
Larry Adebayo attempts a Layup. Contested by Ben Gilgeous-Alexander (3.7 feet, MAN). LARRY ADEBAYO MAKES IT! Assist: D'Angelo Markkanen
Score: 62-57

[00:02] Team_010 possession (Score: 62-57)
Paolo Wade attempts a Layup. Wide open! Chris Holiday is 6.8 feet away. [ZONE] Paolo Wade misses. Rebound secured by Chris Holiday.

================================================================================
                              2ND QUARTER COMPLETE                              
================================================================================

2ND QUARTER SCORE: Team_081 31, Team_010 27

BOX SCORE:
================================================================================

Team_081
--------------------------------------------------------------------------------
Player                MIN  PTS  REB  AST  TO      FG   FG%      3P   3P%
--------------------------------------------------------------------------------
Dejounte Bane           8    8    0    0   0   3/3   100.0     0/0   0.0
Larry Adebayo           8    5    2    4   0   2/3    66.7     0/0   0.0
Lamelo Wade             8    5    3    1   0   2/3    66.7     0/0   0.0
Bradley Sabonis        16    4    2    0   0   2/2   100.0     0/0   0.0
Chris Holiday           8    4    2    0   0   2/4    50.0     0/0   0.0
D'Angelo Markkanen      8    3    0    2   0   1/2    50.0     0/0   0.0
Bradley Leonard        16    2    0    0   0   1/3    33.3     0/0   0.0
Franz Antetokounmpo    16    0    0    1   0   0/1     0.0     0/0   0.0
Vince Adebayo          16    0    2    1   0   0/0     0.0     0/0   0.0
Julius Durant          16    0    0    1   0   0/0     0.0     0/0   0.0

TEAM: FG: 13/21 (61.9%), 3PT: 3/6 (50.0%), REB: 11 (1 off, 10 def), AST: 10, TO: 3
TEAM FOULS: 1


Team_010
--------------------------------------------------------------------------------
Player                MIN  PTS  REB  AST  TO      FG   FG%      3P   3P%
--------------------------------------------------------------------------------
Blake Harden            8   11    2    1   0   5/6    83.3     0/0   0.0
Draymond Leonard        8    8    0    2   0   3/4    75.0     0/0   0.0
Anthony Durant         16    2    2    0   0   1/4    25.0     0/0   0.0
Cade Morant            16    2    2    1   0   1/1   100.0     0/0   0.0
Ben Gilgeous-Alexander    8    2    3    0   0   1/3    33.3     0/0   0.0
Desmond Antetokounmpo   16    0    0    0   0   0/1     0.0     0/0   0.0
RJ Young               16    0    0    1   0   0/0     0.0     0/0   0.0
Paolo Wade              8    0    0    0   0   0/2     0.0     0/0   0.0
Vince Ingram            8    0    0    3   0   0/0     0.0     0/0   0.0

TEAM: FG: 11/21 (52.4%), 3PT: 1/2 (50.0%), REB: 9 (2 off, 7 def), AST: 8, TO: 3
TEAM FOULS: 3

================================================================================

================================================================================
                       3RD QUARTER - Team_081 vs Team_010                       
================================================================================

[12:00] Team_081 possession (Score: 62-57)
FOUL! Holding foul on RJ Young. [Team fouls: 1] No free throws, side out. (RJ Young: 1 personal fouls)

[11:42] Team_081 possession (Score: 62-57)
Bradley Leonard attempts a 3Pt. Contested by Cade Morant (2.4 feet, ZONE). Bradley Leonard misses. Rebound secured by Anthony Durant.

[11:29] Team_010 possession (Score: 62-57)
Michael Turner attempts a 3Pt. Contested by Bradley Leonard (3.3 feet, MAN). Michael Turner misses. Rebound secured by Vince Adebayo.

[11:13] Team_081 possession (Score: 62-57)
Franz Antetokounmpo drives, picks up Anthony Durant. Help arrives from Cade Morant! Franz Antetokounmpo attempts a Layup. Contested by Cade Morant (3.1 feet, ZONE). FRANZ ANTETOKOUNMPO MAKES IT!
Score: 64-57

[11:00] Team_010 possession (Score: 64-57)
Anthony Durant drives, Franz Antetokounmpo stays with him. Anthony Durant attempts a Dunk. Contested by Franz Antetokounmpo (2.1 feet, MAN). ANTHONY DURANT MAKES IT!
Score: 64-59

[10:44] Team_081 possession (Score: 64-59)
FOUL! Offensive foul on Franz Antetokounmpo! Anthony Durant drew the charge! [Team fouls: 1] (Franz Antetokounmpo: 1 personal fouls) TURNOVER! (dead ball)

[10:30] Team_010 possession (Score: 64-59)
Michael Turner attempts a 3Pt. Heavily contested by Vince Adebayo (1.4 feet, ZONE)! Michael Turner misses. Rebound secured by Franz Antetokounmpo.

[10:14] Team_081 possession (Score: 64-59)
Bradley Leonard attempts a Midrange. Heavily contested by Michael Turner (1.7 feet, MAN)! Bradley Leonard misses. Rebound secured by Desmond Antetokounmpo.

[10:02] Team_010 possession (Score: 64-59)
Desmond Antetokounmpo drives and kicks out. RJ Young attempts a 3Pt. Wide open! Vince Adebayo is 6.8 feet away. [MAN] RJ Young misses. Rebound secured by Vince Adebayo.

[09:47] Team_081 possession (Score: 64-59)
Julius Durant attempts a Layup. BLOCKED BY CADE MORANT! Ball is loose! Rebound secured by Desmond Antetokounmpo.

[09:34] Team_010 possession (Score: 64-59)
Cade Morant attempts a 3Pt. Contested by Vince Adebayo (2.8 feet, ZONE). Cade Morant misses. Rebound secured by Vince Adebayo.

[09:22] Team_081 possession (Score: 64-59)
Julius Durant attempts a 3Pt. Contested by Cade Morant (3.7 feet, MAN). Julius Durant misses. Offensive rebound by Bradley Sabonis! Bradley Sabonis kicks it out.

[09:11] Team_081 possession (Score: 64-59)
Bradley Sabonis attempts a Layup. BLOCKED BY DESMOND ANTETOKOUNMPO! Ball is loose! Rebound secured by Desmond Antetokounmpo.

[08:57] Team_010 possession (Score: 64-59)
Anthony Durant attempts a Midrange. Contested by Julius Durant (3.1 feet, ZONE). Anthony Durant misses. Rebound secured by Bradley Sabonis.

[08:43] Team_081 possession (Score: 64-59)
Julius Durant attempts a 3Pt. Wide open! Cade Morant is 7.6 feet away. [MAN] Julius Durant misses. Rebound secured by Anthony Durant.

[08:34] Team_010 possession (Score: 64-59)
FOUL! Holding foul on Bradley Leonard. [Team fouls: 2] No free throws, side out. (Bradley Leonard: 1 personal fouls)

[08:22] Team_010 possession (Score: 64-59)
Michael Turner attempts a Midrange. Contested by Bradley Leonard (5.2 feet, ZONE). MICHAEL TURNER MAKES IT!
Score: 64-61

[08:10] Team_081 possession (Score: 64-61)
Bradley Leonard attempts a 3Pt. Contested by Cade Morant (4.0 feet, ZONE). Bradley Leonard misses. Rebound secured by Anthony Durant.

[07:55] Team_010 possession (Score: 64-61)
Desmond Antetokounmpo attempts a Layup. Heavily contested by Bradley Sabonis (1.1 feet, MAN)! Desmond Antetokounmpo misses. Rebound secured by Vince Adebayo.

[07:36] Team_081 possession (Score: 64-61)
Bradley Sabonis attempts a 3Pt. Wide open! Desmond Antetokounmpo is 6.0 feet away. [MAN] BRADLEY SABONIS MAKES IT!
Score: 67-61

[07:19] Team_010 possession (Score: 67-61)
Cade Morant drives, Franz Antetokounmpo stays with him. Cade Morant attempts a Dunk. Contested by Franz Antetokounmpo (2.2 feet, ZONE). Cade Morant misses. Rebound secured by Vince Adebayo.

[07:03] Team_081 possession (Score: 67-61)
Franz Antetokounmpo drives to the basket... Franz Antetokounmpo throws a bad pass! Stolen by Anthony Durant! TURNOVER! (live ball)

[06:49] Team_010 possession (Score: 67-61)
Cade Morant drives and kicks out. Cade Morant attempts a 3Pt. Heavily contested by Julius Durant (1.9 feet, MAN)! Cade Morant misses. Rebound secured by Bradley Sabonis.

[06:34] Team_081 possession (Score: 67-61)
Julius Durant attempts a Midrange. Wide open! Cade Morant is 6.8 feet away. [MAN] JULIUS DURANT MAKES IT! Assist: Franz Antetokounmpo
Score: 69-61

[06:18] Team_010 possession (Score: 69-61)
Michael Turner attempts a 3Pt. Contested by Julius Durant (3.4 feet, ZONE). MICHAEL TURNER MAKES IT! Assist: RJ Young
Score: 69-64

[06:01] Team_081 possession (Score: 69-64)
Bradley Leonard attempts a Midrange. Contested by Desmond Antetokounmpo (3.1 feet, ZONE). BRADLEY LEONARD MAKES IT!
Score: 71-64

[05:47] Team_010 possession (Score: 71-64)
RJ Young attempts a Midrange. Wide open! Vince Adebayo is 6.2 feet away. [ZONE] RJ YOUNG MAKES IT!
Score: 71-66

[05:29] Team_081 possession (Score: 71-66)
Bradley Sabonis throws a bad pass! Stolen by Desmond Antetokounmpo! TURNOVER! (live ball)

[05:16] Team_010 possession (Score: 71-66)
Michael Turner attempts a 3Pt. Contested by Bradley Leonard (4.1 feet, MAN). Michael Turner misses. Rebound secured by Vince Adebayo.

[05:02] Team_081 possession (Score: 71-66)
Franz Antetokounmpo attempts a Dunk. BLOCKED BY ANTHONY DURANT! Ball is loose! Offensive rebound by Bradley Sabonis! Bradley Sabonis kicks it out.

[04:48] Team_081 possession (Score: 71-66)
Franz Antetokounmpo attempts a Midrange. BLOCKED BY ANTHONY DURANT! Ball is loose! Rebound secured by Cade Morant.

[04:35] Team_010 possession (Score: 71-66)
Cade Morant attempts a 3Pt. Wide open! Bradley Leonard is 6.5 feet away. [ZONE] Cade Morant misses. Rebound secured by Franz Antetokounmpo.

[04:22] Team_081 possession (Score: 71-66)
Bradley Leonard drives and kicks out. Bradley Sabonis attempts a 3Pt. Contested by Desmond Antetokounmpo (3.1 feet, MAN). Bradley Sabonis misses. Rebound secured by Anthony Durant.

[04:07] Team_010 possession (Score: 71-66)
Michael Turner attempts a 3Pt. Contested by Bradley Leonard (4.9 feet, ZONE). Michael Turner misses. Rebound secured by Bradley Sabonis.

[03:52] Team_081 possession (Score: 71-66)
Bradley Sabonis makes the Layup and draws the foul on Anthony Durant! And-1! Bradley Sabonis to the line for 1. [Team fouls: 2] (Anthony Durant: 1 personal fouls)   FT 1/1: MISS Bradley Sabonis makes 0/1 from the line. Rebound secured by Michael Turner.
Score: 73-66

[03:40] Team_010 possession (Score: 73-66)
FOUL! Shooting foul on Franz Antetokounmpo. RJ Young to the line for 2 free throws. [Team fouls: 3] (Franz Antetokounmpo: 2 personal fouls)   FT 1/2: GOOD   FT 2/2: GOOD RJ Young makes 2/2 from the line.
Score: 73-68

[03:23] Team_081 possession (Score: 73-68)
Bradley Sabonis attempts a Midrange. Wide open! Desmond Antetokounmpo is 8.1 feet away. [MAN] Bradley Sabonis misses. Rebound secured by Cade Morant.

[03:12] Team_010 possession (Score: 73-68)
Cade Morant throws a bad pass out of bounds! TURNOVER! (dead ball)

[02:59] Team_081 possession (Score: 73-68)
Vince Adebayo attempts a 3Pt. Contested by Cade Morant (3.9 feet, ZONE). Vince Adebayo misses. Rebound secured by Cade Morant.

[02:43] Team_010 possession (Score: 73-68)
Michael Turner drives, Bradley Leonard stays with him. Michael Turner attempts a Dunk. Contested by Bradley Leonard (3.5 feet, MAN). Michael Turner misses. Rebound secured by Bradley Sabonis.

[02:28] Team_081 possession (Score: 73-68)
Julius Durant attempts a 3Pt. Wide open! Cade Morant is 6.2 feet away. [ZONE] JULIUS DURANT MAKES IT! Assist: Franz Antetokounmpo
Score: 76-68

[02:09] Team_010 possession (Score: 76-68)
FOUL! Reach-in foul on Bradley Leonard during the drive. [Team fouls: 4] No free throws, side out. (Bradley Leonard: 2 personal fouls)

[01:56] Team_010 possession (Score: 76-68)
Desmond Antetokounmpo attempts a 3Pt. Contested by Bradley Leonard (4.4 feet, ZONE). DESMOND ANTETOKOUNMPO MAKES IT! Assist: Anthony Durant
Score: 76-71

[01:45] Team_081 possession (Score: 76-71)
Vince Adebayo attempts a 3Pt. Contested by RJ Young (4.7 feet, MAN). VINCE ADEBAYO MAKES IT! Assist: Franz Antetokounmpo
Score: 79-71

[01:31] Team_010 possession (Score: 79-71)
Desmond Antetokounmpo drives to the basket... FOUL! Offensive foul on Desmond Antetokounmpo! Franz Antetokounmpo drew the charge! [Team fouls: 3] (Desmond Antetokounmpo: 1 personal fouls) TURNOVER! (dead ball)

[01:17] Team_081 possession (Score: 79-71)
Bradley Sabonis attempts a 3Pt. Wide open! Desmond Antetokounmpo is 7.1 feet away. [MAN] Bradley Sabonis misses. Rebound secured by Michael Turner.

[01:05] Team_010 possession (Score: 79-71)
Michael Turner loses control! Ball rolls out of bounds! TURNOVER! (dead ball)

[01:05] Substitution (Team_081): Julius Durant OUT → Dejounte Bane IN (stamina_rule2)

[01:05] Substitution (Team_081): Bradley Leonard OUT → Lamelo Wade IN (stamina_rule2)

[01:05] Substitution (Team_081): Vince Adebayo OUT → Larry Adebayo IN (stamina_rule2)

[01:05] Substitution (Team_081): Bradley Sabonis OUT → Chris Holiday IN (stamina_rule2)

[01:05] Substitution (Team_081): Franz Antetokounmpo OUT → D'Angelo Markkanen IN (stamina_rule2)

[01:05] Substitution (Team_010): Cade Morant OUT → Draymond Leonard IN (stamina_rule2)

[01:05] Substitution (Team_010): Michael Turner OUT → Blake Harden IN (stamina_rule2)

[01:05] Substitution (Team_010): RJ Young OUT → Ben Gilgeous-Alexander IN (stamina_rule2)

[01:05] Substitution (Team_010): Desmond Antetokounmpo OUT → Vince Ingram IN (stamina_rule2)

[01:05] Substitution (Team_010): Anthony Durant OUT → Paolo Wade IN (stamina_rule2)

[00:51] Team_081 possession (Score: 79-71)
Larry Adebayo makes the 3Pt and draws the foul on Ben Gilgeous-Alexander! And-1! Larry Adebayo to the line for 1. [Team fouls: 4] (Ben Gilgeous-Alexander: 1 personal fouls)   FT 1/1: GOOD Larry Adebayo makes 1/1 from the line.
Score: 83-71

[00:33] Team_010 possession (Score: 83-71)
Ben Gilgeous-Alexander attempts a 3Pt. Contested by Larry Adebayo (4.0 feet, MAN). Ben Gilgeous-Alexander misses. Offensive rebound by Blake Harden! Blake Harden kicks it out.

[00:21] Team_010 possession (Score: 83-71)
Vince Ingram attempts a 3Pt. Contested by Chris Holiday (5.7 feet, ZONE). Vince Ingram misses. Rebound secured by Larry Adebayo.

[00:04] Team_081 possession (Score: 83-71)
Dejounte Bane loses control! Ball rolls out of bounds! TURNOVER! (dead ball)

================================================================================
                              3RD QUARTER COMPLETE                              
================================================================================

3RD QUARTER SCORE: Team_081 21, Team_010 14

BOX SCORE:
================================================================================

Team_081
--------------------------------------------------------------------------------
Player                MIN  PTS  REB  AST  TO      FG   FG%      3P   3P%
--------------------------------------------------------------------------------
Julius Durant          27    5    0    0   0   2/4    50.0     0/0   0.0
Larry Adebayo           9    4    1    0   0   1/1   100.0     0/0   0.0
Vince Adebayo          27    3    6    0   0   1/2    50.0     0/0   0.0
Bradley Sabonis        27    3    6    0   0   1/5    20.0     0/0   0.0
Bradley Leonard        27    2    0    0   0   1/5    20.0     0/0   0.0
Franz Antetokounmpo    27    2    2    3   0   1/2    50.0     0/0   0.0

TEAM: FG: 7/19 (36.8%), 3PT: 4/9 (44.4%), REB: 15 (2 off, 13 def), AST: 3, TO: 4
TEAM FOULS: 4


Team_010
--------------------------------------------------------------------------------
Player                MIN  PTS  REB  AST  TO      FG   FG%      3P   3P%
--------------------------------------------------------------------------------
Michael Turner         27    5    2    0   0   2/7    28.6     0/0   0.0
RJ Young               27    4    0    1   0   2/2   100.0     0/0   0.0
Desmond Antetokounmpo   27    3    3    0   0   1/3    33.3     0/0   0.0
Anthony Durant         27    2    4    1   0   1/2    50.0     0/0   0.0
Cade Morant            27    0    3    0   0   0/4     0.0     0/0   0.0
Blake Harden            9    0    1    0   0   0/0     0.0     0/0   0.0
Vince Ingram            9    0    0    0   0   0/1     0.0     0/0   0.0

TEAM: FG: 6/19 (31.6%), 3PT: 2/9 (22.2%), REB: 13 (1 off, 12 def), AST: 2, TO: 3
TEAM FOULS: 4

================================================================================

================================================================================
                       4TH QUARTER - Team_081 vs Team_010                       
================================================================================

[12:00] Team_081 possession (Score: 83-71)
Franz Antetokounmpo attempts a Layup. Heavily contested by Anthony Durant (0.5 feet, MAN)! Franz Antetokounmpo misses. Rebound secured by Michael Turner.

[11:44] Team_010 possession (Score: 83-71)
Anthony Durant attempts a Midrange. Contested by Franz Antetokounmpo (4.5 feet, MAN). ANTHONY DURANT MAKES IT!
Score: 83-73

[11:25] Team_081 possession (Score: 83-73)
Bradley Leonard attempts a Midrange. Contested by Michael Turner (3.2 feet, MAN). BRADLEY LEONARD MAKES IT! Assist: Vince Adebayo
Score: 85-73

[11:13] Team_010 possession (Score: 85-73)
RJ Young drives, picks up Vince Adebayo. Help arrives from Bradley Leonard! RJ Young attempts a Dunk. Heavily contested by Bradley Leonard (1.6 feet, MAN)! RJ Young misses. Offensive rebound by Cade Morant! Cade Morant kicks it out.

[10:57] Team_010 possession (Score: 85-73)
Anthony Durant makes the Layup and draws the foul on Franz Antetokounmpo! And-1! Anthony Durant to the line for 1. [Team fouls: 1] (Franz Antetokounmpo: 1 personal fouls)   FT 1/1: GOOD Anthony Durant makes 1/1 from the line.
Score: 85-76

[10:45] Team_081 possession (Score: 85-76)
Vince Adebayo attempts a 3Pt. Wide open! Cade Morant is 6.9 feet away. [ZONE] Vince Adebayo misses. Rebound secured by Anthony Durant.

[10:29] Team_010 possession (Score: 85-76)
FOUL! Reach-in foul on Julius Durant during the drive. [Team fouls: 2] No free throws, side out. (Julius Durant: 1 personal fouls)

[10:13] Team_010 possession (Score: 85-76)
Desmond Antetokounmpo drives, Franz Antetokounmpo stays with him. Desmond Antetokounmpo attempts a Layup. Heavily contested by Franz Antetokounmpo (0.5 feet, ZONE)! DESMOND ANTETOKOUNMPO MAKES IT!
Score: 85-78

[09:58] Team_081 possession (Score: 85-78)
Bradley Leonard attempts a 3Pt. Wide open! Desmond Antetokounmpo is 6.2 feet away. [ZONE] BRADLEY LEONARD MAKES IT! Assist: Franz Antetokounmpo
Score: 88-78

[09:43] Team_010 possession (Score: 88-78)
Desmond Antetokounmpo attempts a Layup. BLOCKED BY FRANZ ANTETOKOUNMPO! Ball is loose! Rebound secured by Franz Antetokounmpo.

[09:29] Team_081 possession (Score: 88-78)
Vince Adebayo drives, picks up Anthony Durant. Help arrives from Cade Morant! Vince Adebayo attempts a Layup. Heavily contested by Cade Morant (0.5 feet, ZONE)! VINCE ADEBAYO MAKES IT! Assist: Franz Antetokounmpo
Score: 90-78

[09:17] Team_010 possession (Score: 90-78)
RJ Young drives, Franz Antetokounmpo stays with him. RJ Young attempts a Dunk. Heavily contested by Franz Antetokounmpo (0.5 feet, ZONE)! RJ YOUNG MAKES IT!
Score: 90-80

[09:00] Team_081 possession (Score: 90-80)
Julius Durant attempts a 3Pt. Contested by Cade Morant (4.1 feet, ZONE). Julius Durant misses. Rebound secured by Anthony Durant.

[08:41] Team_010 possession (Score: 90-80)
Michael Turner attempts a 3Pt. Contested by Bradley Leonard (5.5 feet, ZONE). Michael Turner misses. Rebound secured by Franz Antetokounmpo.

[08:29] Team_081 possession (Score: 90-80)
Bradley Sabonis loses the ball! Stripped by Desmond Antetokounmpo! TURNOVER! (live ball)

[08:12] Team_010 possession (Score: 90-80)
FOUL! Holding foul on Bradley Leonard. [Team fouls: 3] No free throws, side out. (Bradley Leonard: 1 personal fouls)

[07:53] Team_010 possession (Score: 90-80)
Desmond Antetokounmpo attempts a 3Pt. Contested by Bradley Leonard (5.9 feet, ZONE). Desmond Antetokounmpo misses. Offensive rebound by Cade Morant! Cade Morant kicks it out.

[07:39] Team_010 possession (Score: 90-80)
Anthony Durant attempts a 3Pt. Contested by Bradley Leonard (3.7 feet, ZONE). ANTHONY DURANT MAKES IT! Assist: Cade Morant
Score: 90-83

[07:26] Team_081 possession (Score: 90-83)
Franz Antetokounmpo drives to the basket... Franz Antetokounmpo throws a bad pass out of bounds! TURNOVER! (dead ball)

[07:26] Substitution (Team_081): Julius Durant OUT → Dejounte Bane IN (stamina_rule2)

[07:26] Substitution (Team_081): Bradley Leonard OUT → Lamelo Wade IN (stamina_rule2)

[07:26] Substitution (Team_081): Vince Adebayo OUT → Larry Adebayo IN (stamina_rule2)

[07:26] Substitution (Team_081): Bradley Sabonis OUT → Chris Holiday IN (stamina_rule2)

[07:26] Substitution (Team_081): Franz Antetokounmpo OUT → D'Angelo Markkanen IN (stamina_rule2)

[07:26] Substitution (Team_010): Cade Morant OUT → Draymond Leonard IN (stamina_rule2)

[07:26] Substitution (Team_010): Michael Turner OUT → Blake Harden IN (stamina_rule2)

[07:26] Substitution (Team_010): RJ Young OUT → Ben Gilgeous-Alexander IN (stamina_rule2)

[07:26] Substitution (Team_010): Desmond Antetokounmpo OUT → Vince Ingram IN (stamina_rule2)

[07:26] Substitution (Team_010): Anthony Durant OUT → Paolo Wade IN (stamina_rule2)

[07:14] Team_010 possession (Score: 90-83)
Blake Harden attempts a 3Pt. Heavily contested by Lamelo Wade (1.4 feet, MAN)! Blake Harden misses. Rebound secured by Lamelo Wade.

[07:01] Team_081 possession (Score: 90-83)
Lamelo Wade attempts a 3Pt. Contested by Blake Harden (5.7 feet, MAN). LAMELO WADE MAKES IT! Assist: Chris Holiday
Score: 93-83

[06:46] Team_010 possession (Score: 93-83)
FOUL! Holding foul on Chris Holiday. [Team fouls: 4] No free throws, side out. (Chris Holiday: 1 personal fouls)

[06:31] Team_010 possession (Score: 93-83)
FOUL! Reach-in foul on Chris Holiday during the drive. [IN THE BONUS! 5 team fouls] Ben Gilgeous-Alexander to the line for 2 free throws. (Chris Holiday: 2 personal fouls)   FT 1/2: MISS   FT 2/2: MISS Ben Gilgeous-Alexander makes 0/2 from the line. Rebound secured by Larry Adebayo.

[06:18] Team_081 possession (Score: 93-83)
Lamelo Wade attempts a 3Pt. Wide open! Vince Ingram is 6.2 feet away. [ZONE] LAMELO WADE MAKES IT! Assist: Larry Adebayo
Score: 96-83

[06:06] Team_010 possession (Score: 96-83)
Vince Ingram attempts a Midrange. Wide open! Chris Holiday is 6.7 feet away. [MAN] Vince Ingram misses. Offensive rebound by Blake Harden! Blake Harden kicks it out.

[05:49] Team_010 possession (Score: 96-83)
Draymond Leonard attempts a Midrange. Wide open! Lamelo Wade is 6.5 feet away. [ZONE] Draymond Leonard misses. Rebound secured by Chris Holiday.

[05:32] Team_081 possession (Score: 96-83)
Dejounte Bane throws a bad pass out of bounds! TURNOVER! (dead ball)

[05:17] Team_010 possession (Score: 96-83)
FOUL! Reach-in foul on Chris Holiday during the drive. [IN THE BONUS! 6 team fouls] Vince Ingram to the line for 2 free throws. (Chris Holiday: 3 personal fouls)   FT 1/2: MISS   FT 2/2: GOOD Vince Ingram makes 1/2 from the line.
Score: 96-84

[05:03] Team_081 possession (Score: 96-84)
D'Angelo Markkanen attempts a Layup. Contested by Paolo Wade (5.6 feet, MAN). D'ANGELO MARKKANEN MAKES IT! Assist: Larry Adebayo
Score: 98-84

[04:52] Team_010 possession (Score: 98-84)
Ben Gilgeous-Alexander drives and kicks out. Vince Ingram attempts a Midrange. Wide open! Chris Holiday is 6.7 feet away. [ZONE] Vince Ingram misses. Rebound secured by Chris Holiday.

[04:35] Team_081 possession (Score: 98-84)
Lamelo Wade attempts a 3Pt. Wide open! Blake Harden is 6.8 feet away. [MAN] Lamelo Wade misses. Rebound secured by Ben Gilgeous-Alexander.

[04:21] Team_010 possession (Score: 98-84)
Blake Harden makes the Midrange and draws the foul on Lamelo Wade! And-1! Blake Harden to the line for 1. [BONUS: 7 team fouls] (Lamelo Wade: 1 personal fouls)   FT 1/1: MISS Blake Harden makes 0/1 from the line. Rebound secured by Chris Holiday.
Score: 98-86

[04:07] Team_081 possession (Score: 98-86)
FOUL! Offensive foul on Lamelo Wade! Blake Harden drew the charge! [Team fouls: 8] (Lamelo Wade: 2 personal fouls) TURNOVER! (dead ball)

[03:55] Team_010 possession (Score: 98-86)
Paolo Wade drives and kicks out. Vince Ingram attempts a Midrange. Contested by Lamelo Wade (5.4 feet, ZONE). Vince Ingram misses. Offensive rebound by Blake Harden! Blake Harden kicks it out.

[03:43] Team_010 possession (Score: 98-86)
Paolo Wade throws a bad pass! Stolen by Chris Holiday! TURNOVER! (live ball)

[03:31] Team_081 possession (Score: 98-86)
Chris Holiday attempts a 3Pt. Contested by Blake Harden (5.9 feet, ZONE). Chris Holiday misses. Rebound secured by Blake Harden.

[03:13] Team_010 possession (Score: 98-86)
Paolo Wade attempts a Midrange. Heavily contested by Chris Holiday (1.2 feet, ZONE)! Paolo Wade misses. Offensive rebound by Paolo Wade! Paolo Wade kicks it out.

[03:00] Team_010 possession (Score: 98-86)
Draymond Leonard drives, picks up Dejounte Bane. Help arrives from Lamelo Wade! Draymond Leonard attempts a Layup. Contested by Lamelo Wade (4.4 feet, MAN). DRAYMOND LEONARD MAKES IT! Assist: Blake Harden
Score: 98-88

[02:48] Team_081 possession (Score: 98-88)
D'Angelo Markkanen attempts a 3Pt. Wide open! Vince Ingram is 8.6 feet away. [ZONE] D'ANGELO MARKKANEN MAKES IT!
Score: 101-88

[02:33] Team_010 possession (Score: 101-88)
Draymond Leonard attempts a 3Pt. Contested by Dejounte Bane (5.9 feet, MAN). DRAYMOND LEONARD MAKES IT!
Score: 101-91

[02:21] Team_081 possession (Score: 101-91)
FOUL! Reach-in foul on Draymond Leonard during the drive. [Team fouls: 1] No free throws, side out. (Draymond Leonard: 1 personal fouls)

[02:07] Team_081 possession (Score: 101-91)
FOUL! Shooting foul on Ben Gilgeous-Alexander. Larry Adebayo to the line for 2 free throws. [Team fouls: 2] (Ben Gilgeous-Alexander: 1 personal fouls)   FT 1/2: MISS   FT 2/2: GOOD Larry Adebayo makes 1/2 from the line.
Score: 102-91

[01:56] Team_010 possession (Score: 102-91)
Vince Ingram attempts a Midrange. Heavily contested by Chris Holiday (1.8 feet, MAN)! Vince Ingram misses. Rebound secured by Larry Adebayo.

[01:43] Team_081 possession (Score: 102-91)
Larry Adebayo attempts a 3Pt. Contested by Ben Gilgeous-Alexander (6.0 feet, MAN). Larry Adebayo misses. Rebound secured by Ben Gilgeous-Alexander.

[01:32] Team_010 possession (Score: 102-91)
Ben Gilgeous-Alexander attempts a 3Pt. Contested by Larry Adebayo (3.4 feet, MAN). BEN GILGEOUS-ALEXANDER MAKES IT! Assist: Vince Ingram
Score: 102-94

[01:17] Team_081 possession (Score: 102-94)
Chris Holiday loses the ball! Stripped by Vince Ingram! TURNOVER! (live ball)

[01:04] Team_010 possession (Score: 102-94)
FOUL! Reach-in foul on Dejounte Bane during the drive. [IN THE BONUS! 9 team fouls] Draymond Leonard to the line for 2 free throws. (Dejounte Bane: 1 personal fouls)   FT 1/2: GOOD   FT 2/2: GOOD Draymond Leonard makes 2/2 from the line.
Score: 102-96

[00:46] Team_081 possession (Score: 102-96)
Larry Adebayo throws a bad pass out of bounds! TURNOVER! (dead ball)

[00:30] Team_010 possession (Score: 102-96)
Blake Harden attempts a Midrange. Wide open! Lamelo Wade is 8.0 feet away. [MAN] BLAKE HARDEN MAKES IT! Assist: Draymond Leonard
Score: 102-98

[00:16] Team_081 possession (Score: 102-98)
Dejounte Bane drives and kicks out. Dejounte Bane attempts a Midrange. Contested by Draymond Leonard (3.2 feet, MAN). DEJOUNTE BANE MAKES IT! Assist: Larry Adebayo
Score: 104-98

================================================================================
                              4TH QUARTER COMPLETE                              
================================================================================

4TH QUARTER SCORE: Team_081 21, Team_010 27

BOX SCORE:
================================================================================

Team_081
--------------------------------------------------------------------------------
Player                MIN  PTS  REB  AST  TO      FG   FG%      3P   3P%
--------------------------------------------------------------------------------
Lamelo Wade            16    6    1    0   0   2/3    66.7     0/0   0.0
Bradley Leonard        32    5    0    0   0   2/2   100.0     0/0   0.0
D'Angelo Markkanen     16    5    0    0   0   2/2   100.0     0/0   0.0
Vince Adebayo          32    2    0    1   0   1/2    50.0     0/0   0.0
Dejounte Bane          16    2    0    0   0   1/1   100.0     0/0   0.0
Larry Adebayo          16    1    2    3   0   1/2    50.0     0/0   0.0
Franz Antetokounmpo    32    0    2    2   0   0/1     0.0     0/0   0.0
Julius Durant          32    0    0    0   0   0/1     0.0     0/0   0.0
Chris Holiday          16    0    3    1   0   0/1     0.0     0/0   0.0

TEAM: FG: 9/15 (60.0%), 3PT: 4/9 (44.4%), REB: 8 (0 off, 8 def), AST: 7, TO: 6
TEAM FOULS: 9 [Team_010 in BONUS]


Team_010
--------------------------------------------------------------------------------
Player                MIN  PTS  REB  AST  TO      FG   FG%      3P   3P%
--------------------------------------------------------------------------------
Anthony Durant         32    8    2    0   0   3/3   100.0     0/0   0.0
Draymond Leonard       16    7    0    1   0   3/4    75.0     0/0   0.0
Ben Gilgeous-Alexander   16    3    2    0   0   1/3    33.3     0/0   0.0
Desmond Antetokounmpo   32    2    0    0   0   1/2    50.0     0/0   0.0
RJ Young               32    2    0    0   0   1/1   100.0     0/0   0.0
Blake Harden           16    2    3    1   0   1/3    33.3     0/0   0.0
Vince Ingram           16    1    0    1   0   1/2    50.0     0/0   0.0
Michael Turner         32    0    1    0   0   0/1     0.0     0/0   0.0
Cade Morant            32    0    2    1   0   0/0     0.0     0/0   0.0
Paolo Wade             16    0    1    0   0   0/0     0.0     0/0   0.0

TEAM: FG: 11/19 (57.9%), 3PT: 3/5 (60.0%), REB: 11 (5 off, 6 def), AST: 4, TO: 1
TEAM FOULS: 2

================================================================================

================================================================================
                               FULL GAME COMPLETE                               
================================================================================

FINAL SCORE: Team_081 104, Team_010 98

SCORING BY QUARTER:
--------------------------------------------------------------------------------
Team                     Q1     Q2     Q3     Q4    FINAL
--------------------------------------------------------------------------------
Team_081                 31     31     21     21      104
Team_010                 30     27     14     27       98
--------------------------------------------------------------------------------

FULL GAME BOX SCORE:
================================================================================

Team_081
--------------------------------------------------------------------------------
Player                MIN  PTS  REB  AST  TO      FG   FG%      3P   3P%      FT STL BLK
--------------------------------------------------------------------------------
Julius Durant          32    7    0    1   0   3/8    37.5   1/4    25.0   2/3     0   0
Bradley Leonard        32   18    0    2   3   6/14   42.9   3/6    50.0   3/5     0   0
Vince Adebayo          32   10   11    3   0   3/6    50.0   1/4    25.0   0/0     0   1
Bradley Sabonis        32   15   12    0   4   8/13   61.5   2/3    66.7   1/2     1   0
Franz Antetokounmpo    32    7    8    7   2   3/7    42.9   1/1   100.0   0/0     0   2
Dejounte Bane          16   10    0    0   2   3/3   100.0   2/2   100.0   0/0     1   0
Lamelo Wade            16   11    4    1   1   4/6    66.7   3/5    60.0   0/0     0   0
Larry Adebayo          16   10    5    7   1   5/7    71.4   1/2    50.0   3/4     1   0
Chris Holiday          16    4    5    1   3   2/5    40.0   0/2     0.0   0/0     1   0
D'Angelo Markkanen     16    8    0    2   0   3/4    75.0   1/1   100.0   1/1     0   0

TEAM: FG: 41/74 (55.4%), 3PT: 15/30 (50.0%), REB: 45 (6 off, 39 def), AST: 24, TO: 16


Team_010
--------------------------------------------------------------------------------
Player                MIN  PTS  REB  AST  TO      FG   FG%      3P   3P%      FT STL BLK
--------------------------------------------------------------------------------
Cade Morant            32   10    9    3   2   3/7    42.9   1/3    33.3   0/0     0   3
Michael Turner         32   11    6    2   1   4/13   30.8   3/10   30.0   0/0     0   0
RJ Young               32   10    0    4   2   5/7    71.4   0/2     0.0   2/3     0   0
Desmond Antetokounmpo   32   15    4    2   0   6/11   54.5   1/2    50.0   1/1     3   1
Anthony Durant         32   12   13    2   0   6/13   46.2   1/2    50.0   1/1     1   3
Draymond Leonard       16   15    0    3   1   5/7    71.4   2/2   100.0   2/2     0   0
Blake Harden           16   13    6    2   0   5/8    62.5   0/2     0.0   0/1     0   0
Ben Gilgeous-Alexander   16    5    5    0   1   3/7    42.9   1/1   100.0   0/3     0   0
Vince Ingram           16    1    0    4   0   2/4    50.0   0/1     0.0   1/2     2   0
Paolo Wade             16    0    1    0   2   0/2     0.0   0/0     0.0   0/0     0   0

TEAM: FG: 39/79 (49.4%), 3PT: 9/25 (36.0%), REB: 44 (12 off, 32 def), AST: 22, TO: 9

================================================================================
