================================================================================
                        FULL GAME - Team_019 vs Team_059                        
================================================================================

================================================================================
                       1ST QUARTER - Team_019 vs Team_059                       
================================================================================

[12:00] Team_019 possession (Score: 0-0)
DeMar James drives to the basket... DeMar James throws a bad pass out of bounds! TURNOVER! (dead ball)

[11:48] Team_059 possession (Score: 0-0)
FOUL! Shooting foul on DeMar James. Blake Tatum to the line for 2 free throws. [Team fouls: 1] (DeMar James: 1 personal fouls)   FT 1/2: GOOD   FT 2/2: GOOD Blake Tatum makes 2/2 from the line.
Score: 0-2

[11:36] Team_019 possession (Score: 0-2)
DeMar James attempts a Midrange. Heavily contested by Jarrett Smith (0.5 feet, MAN)! DeMar James misses. Rebound secured by John Iverson.

[11:22] Team_059 possession (Score: 0-2)
Jarrett Smith attempts a Layup. Heavily contested by DeMar James (1.7 feet, MAN)! JARRETT SMITH MAKES IT! Assist: John Iverson
Score: 0-4

[11:05] Team_019 possession (Score: 0-4)
Rudy Giddey loses the ball! Stripped by Bam Wade! TURNOVER! (live ball)

[10:50] Team_059 possession (Score: 0-4)
Nikola Jokic throws a bad pass out of bounds! TURNOVER! (dead ball)

[10:34] Team_019 possession (Score: 0-4)
Tobias Hyland drives to the basket... Tobias Hyland throws a bad pass! Stolen by Jarrett Smith! TURNOVER! (live ball)

[10:23] Team_059 possession (Score: 0-4)
John Iverson attempts a Midrange. Contested by D'Angelo Randle (3.1 feet, MAN). JOHN IVERSON MAKES IT! Assist: Bam Wade
Score: 0-6

[10:11] Team_019 possession (Score: 0-6)
Brandon James makes the Layup and draws the foul on Bam Wade! And-1! Brandon James to the line for 1. [Team fouls: 1] (Bam Wade: 1 personal fouls)   FT 1/1: GOOD Brandon James makes 1/1 from the line.
Score: 3-6

[09:58] Team_059 possession (Score: 3-6)
Nikola Jokic attempts a Midrange. Wide open! Tobias Hyland is 10.0 feet away. [MAN] Nikola Jokic misses. Rebound secured by Tobias Hyland.

[09:49] Team_019 possession (Score: 3-6)
D'Angelo Randle attempts a 3Pt. Wide open! John Iverson is 7.7 feet away. [MAN] D'ANGELO RANDLE MAKES IT! Assist: Rudy Giddey
Score: 6-6

[09:34] Team_059 possession (Score: 6-6)
Blake Tatum attempts a 3Pt. Wide open! D'Angelo Randle is 6.9 feet away. [ZONE] Blake Tatum misses. FOUL! Loose ball foul on D'Angelo Randle during the rebound battle. [Team fouls: 2] No free throws, side out. (D'Angelo Randle: 1 personal fouls)

[09:22] Team_059 possession (Score: 6-6)
Jarrett Smith attempts a Midrange. Wide open! DeMar James is 7.6 feet away. [ZONE] Jarrett Smith misses. Rebound secured by Tobias Hyland.

[09:06] Team_019 possession (Score: 6-6)
Rudy Giddey attempts a 3Pt. Wide open! Bam Wade is 7.8 feet away. [ZONE] RUDY GIDDEY MAKES IT! Assist: Tobias Hyland
Score: 9-6

[08:52] Team_059 possession (Score: 9-6)
Bam Wade attempts a Midrange. Contested by Rudy Giddey (5.8 feet, ZONE). BAM WADE MAKES IT!
Score: 9-8

[08:41] Team_019 possession (Score: 9-8)
Rudy Giddey attempts a 3Pt. Contested by Bam Wade (3.7 feet, ZONE). Rudy Giddey misses. Offensive rebound by DeMar James! DeMar James puts it back in!
Score: 11-8

[08:25] Team_059 possession (Score: 11-8)
Bam Wade attempts a Midrange. Wide open! Rudy Giddey is 6.3 feet away. [MAN] BAM WADE MAKES IT! Assist: Blake Tatum
Score: 11-10

[08:13] Team_019 possession (Score: 11-10)
Brandon James throws a bad pass! Stolen by Blake Tatum! TURNOVER! (live ball)

[07:58] Team_059 possession (Score: 11-10)
Nikola Jokic drives, DeMar James stays with him. Nikola Jokic attempts a Dunk. Contested by DeMar James (3.1 feet, ZONE). NIKOLA JOKIC MAKES IT! Assist: John Iverson
Score: 11-12

[07:43] Team_019 possession (Score: 11-12)
Tobias Hyland makes the Midrange and draws the foul on Jarrett Smith! And-1! Tobias Hyland to the line for 1. [Team fouls: 2] (Jarrett Smith: 1 personal fouls)   FT 1/1: GOOD Tobias Hyland makes 1/1 from the line.
Score: 14-12

[07:29] Team_059 possession (Score: 14-12)
Blake Tatum attempts a 3Pt. Wide open! Brandon James is 7.0 feet away. [MAN] BLAKE TATUM MAKES IT! Assist: Bam Wade
Score: 14-15

[07:16] Team_019 possession (Score: 14-15)
FOUL! Holding foul on Blake Tatum. [Team fouls: 3] No free throws, side out. (Blake Tatum: 1 personal fouls)

[07:03] Team_019 possession (Score: 14-15)
Brandon James attempts a Midrange. Wide open! Blake Tatum is 6.6 feet away. [MAN] Brandon James misses. Rebound secured by Bam Wade.

[06:48] Team_059 possession (Score: 14-15)
John Iverson attempts a 3Pt. Contested by D'Angelo Randle (2.9 feet, ZONE). John Iverson misses. Rebound secured by Tobias Hyland.

[06:35] Team_019 possession (Score: 14-15)
D'Angelo Randle drives, picks up John Iverson. Help arrives from Bam Wade! D'Angelo Randle attempts a Layup. Contested by Bam Wade (4.8 feet, MAN). D'Angelo Randle misses. Rebound secured by Bam Wade.

[06:19] Team_059 possession (Score: 14-15)
FOUL! Shooting foul on Brandon James. Blake Tatum to the line for 2 free throws. [Team fouls: 3] (Brandon James: 1 personal fouls)   FT 1/2: GOOD   FT 2/2: GOOD Blake Tatum makes 2/2 from the line.
Score: 14-17

[06:07] Team_019 possession (Score: 14-17)
FOUL! Shooting foul on Bam Wade. DeMar James to the line for 2 free throws. [Team fouls: 4] (Bam Wade: 2 personal fouls)   FT 1/2: MISS   FT 2/2: GOOD DeMar James makes 1/2 from the line.
Score: 15-17

[05:54] Team_059 possession (Score: 15-17)
Bam Wade attempts a 3Pt. Contested by Rudy Giddey (5.1 feet, MAN). Bam Wade misses. Offensive rebound by John Iverson! John Iverson kicks it out.

[05:35] Team_059 possession (Score: 15-17)
FOUL! Holding foul on D'Angelo Randle. [Team fouls: 4] No free throws, side out. (D'Angelo Randle: 2 personal fouls)

[05:17] Team_059 possession (Score: 15-17)
Nikola Jokic attempts a Midrange. Wide open! Tobias Hyland is 6.1 feet away. [MAN] NIKOLA JOKIC MAKES IT! Assist: Bam Wade
Score: 15-19

[05:02] Team_019 possession (Score: 15-19)
Brandon James attempts a Midrange. Wide open! Blake Tatum is 6.1 feet away. [MAN] Brandon James misses. Rebound secured by John Iverson.

[04:43] Team_059 possession (Score: 15-19)
Blake Tatum attempts a Midrange. Heavily contested by DeMar James (1.9 feet, ZONE)! Blake Tatum misses. Rebound secured by DeMar James.

[04:27] Team_019 possession (Score: 15-19)
Tobias Hyland attempts a Midrange. Wide open! Jarrett Smith is 6.5 feet away. [ZONE] TOBIAS HYLAND MAKES IT! Assist: D'Angelo Randle
Score: 17-19

[04:12] Team_059 possession (Score: 17-19)
FOUL! Offensive foul on John Iverson! D'Angelo Randle drew the charge! [Team fouls: 5] (John Iverson: 1 personal fouls) TURNOVER! (dead ball)

[03:57] Team_019 possession (Score: 17-19)
Rudy Giddey drives, Jarrett Smith stays with him. Rudy Giddey attempts a Layup. Wide open! Jarrett Smith is 6.2 feet away. [ZONE] Rudy Giddey misses. Offensive rebound by D'Angelo Randle! D'Angelo Randle kicks it out.

[03:41] Team_019 possession (Score: 17-19)
DeMar James drives and kicks out. Brandon James attempts a 3Pt. Contested by Bam Wade (5.7 feet, ZONE). BRANDON JAMES MAKES IT! Assist: Tobias Hyland
Score: 20-19

[03:29] Team_059 possession (Score: 20-19)
Bam Wade attempts a Midrange. Contested by D'Angelo Randle (4.6 feet, ZONE). BAM WADE MAKES IT!
Score: 20-21

[03:14] Team_019 possession (Score: 20-21)
D'Angelo Randle drives to the basket... D'Angelo Randle commits a violation (traveling/carry)! TURNOVER! (dead ball)

[03:14] Substitution (Team_019): Tobias Hyland OUT → Shai Ingram IN (stamina_rule2)

[03:14] Substitution (Team_019): DeMar James OUT → Tim Jordan IN (stamina_rule2)

[03:14] Substitution (Team_059): John Iverson OUT → Allen Giddey IN (stamina_rule2)

[02:59] Team_059 possession (Score: 20-21)
FOUL! Holding foul on Shai Ingram. [IN THE BONUS! 5 team fouls] Jarrett Smith to the line for 2 free throws. (Shai Ingram: 1 personal fouls)   FT 1/2: GOOD   FT 2/2: GOOD Jarrett Smith makes 2/2 from the line.
Score: 20-23

[02:41] Team_019 possession (Score: 20-23)
FOUL! Shooting foul on Jarrett Smith. Tim Jordan to the line for 2 free throws. [BONUS: 6 team fouls] (Jarrett Smith: 2 personal fouls)   FT 1/2: GOOD   FT 2/2: GOOD Tim Jordan makes 2/2 from the line.
Score: 22-23

[02:29] Team_059 possession (Score: 22-23)
FOUL! Shooting foul on Shai Ingram. Allen Giddey to the line for 2 free throws. [BONUS: 6 team fouls] (Shai Ingram: 2 personal fouls)   FT 1/2: MISS   FT 2/2: MISS Allen Giddey makes 0/2 from the line. Offensive rebound by Bam Wade! Bam Wade kicks it out.

[02:15] Team_059 possession (Score: 22-23)
Bam Wade attempts a 3Pt. Wide open! Rudy Giddey is 6.9 feet away. [MAN] Bam Wade misses. Rebound secured by Shai Ingram.

[02:00] Team_019 possession (Score: 22-23)
FOUL! Shooting foul on Jarrett Smith. Rudy Giddey to the line for 2 free throws. [BONUS: 7 team fouls] (Jarrett Smith: 3 personal fouls)   FT 1/2: GOOD   FT 2/2: MISS Rudy Giddey makes 1/2 from the line. Rebound secured by Jarrett Smith.
Score: 23-23

[01:44] Team_059 possession (Score: 23-23)
Blake Tatum drives, Shai Ingram stays with him. Blake Tatum attempts a Layup. Contested by Shai Ingram (4.3 feet, ZONE). BLAKE TATUM MAKES IT! Assist: Nikola Jokic
Score: 23-25

[01:27] Team_019 possession (Score: 23-25)
Rudy Giddey throws a bad pass out of bounds! TURNOVER! (dead ball)

[01:27] Substitution (Team_019): Rudy Giddey OUT → Gary Ginobili IN (stamina_rule2)

[01:27] Substitution (Team_019): Brandon James OUT → Jalen Turner IN (stamina_rule2)

[01:27] Substitution (Team_019): D'Angelo Randle OUT → Blake LaVine IN (stamina_rule2)

[01:27] Substitution (Team_059): Bam Wade OUT → Russell Quickley IN (stamina_rule2)

[01:27] Substitution (Team_059): Blake Tatum OUT → Scottie Ginobili IN (stamina_rule2)

[01:27] Substitution (Team_059): Nikola Jokic OUT → Bones Middleton IN (stamina_rule2)

[01:27] Substitution (Team_059): Jarrett Smith OUT → LeBron Lowry IN (stamina_rule2)

[01:11] Team_059 possession (Score: 23-25)
Russell Quickley attempts a 3Pt. Contested by Gary Ginobili (3.8 feet, MAN). RUSSELL QUICKLEY MAKES IT! Assist: Allen Giddey
Score: 23-28

[00:58] Team_019 possession (Score: 23-28)
Jalen Turner attempts a Midrange. Wide open! Allen Giddey is 6.7 feet away. [ZONE] JALEN TURNER MAKES IT! Assist: Gary Ginobili
Score: 25-28

[00:44] Team_059 possession (Score: 25-28)
Bones Middleton attempts a Midrange. Contested by Shai Ingram (5.0 feet, MAN). Bones Middleton misses. FOUL! Loose ball foul on Shai Ingram during the rebound battle. [IN THE BONUS! 7 team fouls] Scottie Ginobili to the line for 2 free throws. (Shai Ingram: 3 personal fouls)   FT 1/2: MISS   FT 2/2: MISS Scottie Ginobili makes 0/2 from the line. Rebound secured by Tim Jordan.

[00:31] Team_019 possession (Score: 25-28)
Shai Ingram attempts a Midrange. Contested by Bones Middleton (4.6 feet, MAN). SHAI INGRAM MAKES IT! Assist: Jalen Turner
Score: 27-28

[00:19] Team_059 possession (Score: 27-28)
Bones Middleton drives, picks up Shai Ingram. Help arrives from Jalen Turner! Bones Middleton attempts a Layup. Contested by Jalen Turner (4.2 feet, MAN). Bones Middleton misses. Offensive rebound by Bones Middleton! Bones Middleton kicks it out.

[00:09] Team_059 possession (Score: 27-28)
Allen Giddey attempts a Midrange. Wide open! Jalen Turner is 7.1 feet away. [ZONE] ALLEN GIDDEY MAKES IT! Assist: LeBron Lowry
Score: 27-30

================================================================================
                              1ST QUARTER COMPLETE                              
================================================================================

1ST QUARTER SCORE: Team_019 27, Team_059 30

BOX SCORE:
================================================================================

Team_019
--------------------------------------------------------------------------------
Player                MIN  PTS  REB  AST  TO      FG   FG%      3P   3P%
--------------------------------------------------------------------------------
Brandon James          11    6    0    0   0   2/4    50.0     0/0   0.0
Tobias Hyland           9    5    3    2   0   2/2   100.0     0/0   0.0
DeMar James             9    3    2    0   0   2/3    66.7     0/0   0.0
D'Angelo Randle        11    3    1    1   0   1/2    50.0     0/0   0.0
Rudy Giddey            11    3    0    1   0   1/2    50.0     0/0   0.0
Shai Ingram             3    2    1    0   0   1/1   100.0     0/0   0.0
Jalen Turner            1    2    0    1   0   1/1   100.0     0/0   0.0
Gary Ginobili           1    0    0    1   0   0/0     0.0     0/0   0.0

TEAM: FG: 11/16 (68.8%), 3PT: 3/3 (100.0%), REB: 7 (2 off, 5 def), AST: 6, TO: 6
TEAM FOULS: 7 [Team_059 in BONUS]


Team_059
--------------------------------------------------------------------------------
Player                MIN  PTS  REB  AST  TO      FG   FG%      3P   3P%
--------------------------------------------------------------------------------
Blake Tatum            11    9    0    1   0   4/5    80.0     0/0   0.0
Bam Wade               11    6    3    3   0   3/4    75.0     0/0   0.0
Jarrett Smith          11    4    1    0   0   2/3    66.7     0/0   0.0
Nikola Jokic           11    4    0    1   0   2/3    66.7     0/0   0.0
Russell Quickley        1    3    0    0   0   1/1   100.0     0/0   0.0
John Iverson            9    2    4    2   0   1/2    50.0     0/0   0.0
Tim Jordan              3    2    1    0   0   1/1   100.0     0/0   0.0
Allen Giddey            3    2    0    1   0   1/1   100.0     0/0   0.0
Bones Middleton         1    0    1    0   0   0/1     0.0     0/0   0.0
LeBron Lowry            1    0    0    1   0   0/0     0.0     0/0   0.0

TEAM: FG: 14/20 (70.0%), 3PT: 2/4 (50.0%), REB: 10 (5 off, 5 def), AST: 9, TO: 2
TEAM FOULS: 7 [Team_019 in BONUS]

================================================================================

================================================================================
                       2ND QUARTER - Team_019 vs Team_059                       
================================================================================

[12:00] Team_019 possession (Score: 27-30)
DeMar James attempts a Midrange. Contested by Blake Tatum (3.8 feet, ZONE). DeMar James misses. Rebound secured by Jarrett Smith.

[11:48] Team_059 possession (Score: 27-30)
Blake Tatum drives, DeMar James stays with him. Blake Tatum attempts a Dunk. Contested by DeMar James (2.1 feet, ZONE). BLAKE TATUM MAKES IT! Assist: Bam Wade
Score: 27-32

[11:33] Team_019 possession (Score: 27-32)
D'Angelo Randle attempts a 3Pt. Contested by John Iverson (5.3 feet, MAN). D'Angelo Randle misses. Offensive rebound by Tobias Hyland! Tobias Hyland kicks it out.

[11:19] Team_019 possession (Score: 27-32)
FOUL! Holding foul on Nikola Jokic. [Team fouls: 1] No free throws, side out. (Nikola Jokic: 1 personal fouls)

[11:06] Team_019 possession (Score: 27-32)
FOUL! Reach-in foul on Blake Tatum during the drive. [Team fouls: 2] No free throws, side out. (Blake Tatum: 1 personal fouls)

[10:53] Team_019 possession (Score: 27-32)
Brandon James loses the ball! Stripped by Blake Tatum! TURNOVER! (live ball)

[10:38] Team_059 possession (Score: 27-32)
John Iverson attempts a Midrange. Contested by D'Angelo Randle (4.1 feet, ZONE). JOHN IVERSON MAKES IT! Assist: Blake Tatum
Score: 27-34

[10:24] Team_019 possession (Score: 27-34)
FOUL! Reach-in foul on Blake Tatum during the drive. [Team fouls: 3] No free throws, side out. (Blake Tatum: 2 personal fouls)

[10:13] Team_019 possession (Score: 27-34)
FOUL! Reach-in foul on Jarrett Smith during the drive. [Team fouls: 4] No free throws, side out. (Jarrett Smith: 1 personal fouls)

[09:54] Team_019 possession (Score: 27-34)
D'Angelo Randle attempts a Midrange. Contested by John Iverson (4.0 feet, MAN). D'Angelo Randle misses. Rebound secured by Jarrett Smith.

[09:40] Team_059 possession (Score: 27-34)
FOUL! Reach-in foul on Tobias Hyland during the drive. [Team fouls: 1] No free throws, side out. (Tobias Hyland: 1 personal fouls)

[09:27] Team_059 possession (Score: 27-34)
Jarrett Smith drives to the basket... Jarrett Smith loses the ball! Stripped by DeMar James! TURNOVER! (live ball)

[09:12] Team_019 possession (Score: 27-34)
Tobias Hyland loses control! Ball rolls out of bounds! TURNOVER! (dead ball)

[09:12] Substitution (Team_019): Rudy Giddey OUT → Gary Ginobili IN (stamina_rule2)

[09:12] Substitution (Team_019): Brandon James OUT → Jalen Turner IN (stamina_rule2)

[09:12] Substitution (Team_019): D'Angelo Randle OUT → Blake LaVine IN (stamina_rule2)

[09:12] Substitution (Team_019): Tobias Hyland OUT → Shai Ingram IN (stamina_rule2)

[09:12] Substitution (Team_059): Bam Wade OUT → Russell Quickley IN (stamina_rule2)

[09:12] Substitution (Team_059): Blake Tatum OUT → Scottie Ginobili IN (stamina_rule2)

[09:12] Substitution (Team_059): John Iverson OUT → Allen Giddey IN (stamina_rule2)

[09:12] Substitution (Team_059): Nikola Jokic OUT → Bones Middleton IN (stamina_rule2)

[09:12] Substitution (Team_059): Jarrett Smith OUT → LeBron Lowry IN (stamina_rule2)

[09:00] Team_059 possession (Score: 27-34)
LeBron Lowry drives to the basket... LeBron Lowry commits a violation (traveling/carry)! TURNOVER! (dead ball)

[09:00] Substitution (Team_019): DeMar James OUT → Tim Jordan IN (stamina_rule2)

[08:44] Team_019 possession (Score: 27-34)
Gary Ginobili drives and kicks out. Gary Ginobili attempts a Midrange. Contested by Russell Quickley (5.0 feet, MAN). GARY GINOBILI MAKES IT!
Score: 29-34

[08:30] Team_059 possession (Score: 29-34)
Bones Middleton drives to the basket... Bones Middleton commits a violation (traveling/carry)! TURNOVER! (dead ball)

[08:16] Team_019 possession (Score: 29-34)
Tim Jordan drives, LeBron Lowry stays with him. Tim Jordan attempts a Dunk. Contested by LeBron Lowry (2.4 feet, MAN). TIM JORDAN MAKES IT! Assist: Gary Ginobili
Score: 31-34

[07:59] Team_059 possession (Score: 31-34)
Bones Middleton attempts a Layup. BLOCKED BY SHAI INGRAM! Ball is loose! Offensive rebound by Bones Middleton! Bones Middleton kicks it out.

[07:44] Team_059 possession (Score: 31-34)
Bones Middleton attempts a 3Pt. Contested by Shai Ingram (5.6 feet, MAN). Bones Middleton misses. Offensive rebound by Bones Middleton! Bones Middleton kicks it out.

[07:30] Team_059 possession (Score: 31-34)
FOUL! Shooting foul on Shai Ingram. LeBron Lowry to the line for 2 free throws. [Team fouls: 2] (Shai Ingram: 1 personal fouls)   FT 1/2: GOOD   FT 2/2: MISS LeBron Lowry makes 1/2 from the line. Rebound secured by Shai Ingram.
Score: 31-35

[07:15] Team_019 possession (Score: 31-35)
Tim Jordan attempts a Midrange. Contested by LeBron Lowry (4.9 feet, MAN). Tim Jordan misses. Offensive rebound by Tim Jordan! Tim Jordan kicks it out.

[07:01] Team_019 possession (Score: 31-35)
Blake LaVine attempts a 3Pt. Wide open! Allen Giddey is 6.8 feet away. [MAN] BLAKE LAVINE MAKES IT! Assist: Tim Jordan
Score: 34-35

[06:47] Team_059 possession (Score: 34-35)
Scottie Ginobili drives to the basket... FOUL! Offensive foul on Scottie Ginobili! Jalen Turner drew the charge! [Team fouls: 5] (Scottie Ginobili: 1 personal fouls) TURNOVER! (dead ball)

[06:32] Team_019 possession (Score: 34-35)
Blake LaVine attempts a Layup. Contested by Allen Giddey (4.3 feet, MAN). BLAKE LAVINE MAKES IT!
Score: 36-35

[06:21] Team_059 possession (Score: 36-35)
Bones Middleton drives to the basket... FOUL! Offensive foul on Bones Middleton! Shai Ingram drew the charge! [Team fouls: 6] (Bones Middleton: 1 personal fouls) TURNOVER! (dead ball)

[06:07] Team_019 possession (Score: 36-35)
Jalen Turner drives to the basket... Jalen Turner throws a bad pass! Stolen by Bones Middleton! TURNOVER! (live ball)

[05:51] Team_059 possession (Score: 36-35)
Bones Middleton attempts a 3Pt. Wide open! Blake LaVine is 6.9 feet away. [ZONE] Bones Middleton misses. Offensive rebound by Scottie Ginobili! Scottie Ginobili kicks it out.

[05:37] Team_059 possession (Score: 36-35)
Scottie Ginobili drives and kicks out. LeBron Lowry attempts a Midrange. Contested by Shai Ingram (3.1 feet, MAN). LeBron Lowry misses. Rebound secured by Tim Jordan.

[05:21] Team_019 possession (Score: 36-35)
Blake LaVine drives, Allen Giddey stays with him. Blake LaVine attempts a Dunk. Contested by Allen Giddey (3.7 feet, MAN). BLAKE LAVINE MAKES IT!
Score: 38-35

[05:08] Team_059 possession (Score: 38-35)
Bones Middleton attempts a 3Pt. Contested by Blake LaVine (5.2 feet, ZONE). Bones Middleton misses. FOUL! Loose ball foul on Blake LaVine during the rebound battle. [Team fouls: 3] No free throws, side out. (Blake LaVine: 1 personal fouls)

[04:48] Team_059 possession (Score: 38-35)
Scottie Ginobili makes the Dunk and draws the foul on Shai Ingram! And-1! Scottie Ginobili to the line for 1. [Team fouls: 4] (Shai Ingram: 2 personal fouls)   FT 1/1: GOOD Scottie Ginobili makes 1/1 from the line.
Score: 38-38

[04:37] Team_019 possession (Score: 38-38)
Gary Ginobili attempts a Midrange. Contested by Russell Quickley (3.5 feet, MAN). Gary Ginobili misses. Rebound secured by LeBron Lowry.

[04:21] Team_059 possession (Score: 38-38)
Allen Giddey attempts a Midrange. Contested by Blake LaVine (5.6 feet, MAN). Allen Giddey misses. Rebound secured by Tim Jordan.

[04:09] Team_019 possession (Score: 38-38)
FOUL! Holding foul on LeBron Lowry. [IN THE BONUS! 7 team fouls] Tim Jordan to the line for 2 free throws. (LeBron Lowry: 1 personal fouls)   FT 1/2: GOOD   FT 2/2: GOOD Tim Jordan makes 2/2 from the line.
Score: 40-38

[03:52] Team_059 possession (Score: 40-38)
FOUL! Reach-in foul on Jalen Turner during the drive. [IN THE BONUS! 5 team fouls] Scottie Ginobili to the line for 2 free throws. (Jalen Turner: 1 personal fouls)   FT 1/2: GOOD   FT 2/2: GOOD Scottie Ginobili makes 2/2 from the line.
Score: 40-40

[03:35] Team_019 possession (Score: 40-40)
Tim Jordan drives and kicks out. Blake LaVine attempts a 3Pt. Wide open! Allen Giddey is 6.2 feet away. [MAN] BLAKE LAVINE MAKES IT! Assist: Jalen Turner
Score: 43-40

[03:23] Team_059 possession (Score: 43-40)
Russell Quickley drives, Gary Ginobili stays with him. Russell Quickley attempts a Layup. Contested by Gary Ginobili (4.3 feet, MAN). RUSSELL QUICKLEY MAKES IT! Assist: Bones Middleton
Score: 43-42

[03:07] Team_019 possession (Score: 43-42)
FOUL! Shooting foul on Bones Middleton. Shai Ingram to the line for 2 free throws. [BONUS: 8 team fouls] (Bones Middleton: 2 personal fouls)   FT 1/2: GOOD   FT 2/2: MISS Shai Ingram makes 1/2 from the line. Rebound secured by Scottie Ginobili.
Score: 44-42

[02:50] Team_059 possession (Score: 44-42)
Allen Giddey drives and kicks out. Allen Giddey attempts a Midrange. Contested by Blake LaVine (4.1 feet, MAN). Allen Giddey misses. Rebound secured by Blake LaVine.

[02:34] Team_019 possession (Score: 44-42)
FOUL! Offensive foul on Shai Ingram! Bones Middleton drew the charge! [Team fouls: 6] (Shai Ingram: 3 personal fouls) TURNOVER! (dead ball)

[02:20] Team_059 possession (Score: 44-42)
FOUL! Offensive foul on Russell Quickley! Gary Ginobili drew the charge! [Team fouls: 9] (Russell Quickley: 1 personal fouls) TURNOVER! (dead ball)

[02:10] Team_019 possession (Score: 44-42)
Gary Ginobili attempts a Midrange. Wide open! Allen Giddey is 6.9 feet away. [ZONE] GARY GINOBILI MAKES IT!
Score: 46-42

[01:52] Team_059 possession (Score: 46-42)
Russell Quickley attempts a 3Pt. Contested by Gary Ginobili (4.0 feet, MAN). Russell Quickley misses. Rebound secured by Shai Ingram.

[01:37] Team_019 possession (Score: 46-42)
Gary Ginobili attempts a Layup. Heavily contested by Russell Quickley (2.0 feet, MAN)! GARY GINOBILI MAKES IT! Assist: Tim Jordan
Score: 48-42

[01:22] Team_059 possession (Score: 48-42)
LeBron Lowry makes the Layup and draws the foul on Jalen Turner! And-1! LeBron Lowry to the line for 1. [BONUS: 7 team fouls] (Jalen Turner: 2 personal fouls)   FT 1/1: GOOD LeBron Lowry makes 1/1 from the line.
Score: 48-45

[01:08] Team_019 possession (Score: 48-45)
Jalen Turner drives and kicks out. Blake LaVine attempts a 3Pt. Wide open! Allen Giddey is 7.4 feet away. [ZONE] BLAKE LAVINE MAKES IT! Assist: Shai Ingram
Score: 51-45

[00:54] Team_059 possession (Score: 51-45)
Bones Middleton drives, Shai Ingram stays with him. Bones Middleton attempts a Layup. Contested by Shai Ingram (2.3 feet, ZONE). Bones Middleton misses. Rebound secured by Tim Jordan.

[00:41] Team_019 possession (Score: 51-45)
Shai Ingram attempts a 3Pt. Contested by Bones Middleton (3.6 feet, MAN). Shai Ingram misses. Offensive rebound by Shai Ingram! Shai Ingram kicks it out.

[00:23] Team_019 possession (Score: 51-45)
Blake LaVine drives and kicks out. Gary Ginobili attempts a 3Pt. Wide open! Russell Quickley is 6.5 feet away. [ZONE] Gary Ginobili misses. Rebound secured by Bones Middleton.

[00:06] Team_059 possession (Score: 51-45)
LeBron Lowry attempts a Layup. Contested by Shai Ingram (4.1 feet, MAN). LeBron Lowry misses. Rebound secured by Tim Jordan.

================================================================================
                              2ND QUARTER COMPLETE                              
================================================================================

2ND QUARTER SCORE: Team_019 24, Team_059 15

BOX SCORE:
================================================================================

Team_019
--------------------------------------------------------------------------------
Player                MIN  PTS  REB  AST  TO      FG   FG%      3P   3P%
--------------------------------------------------------------------------------
Blake LaVine           10   13    1    0   0   5/6    83.3     0/0   0.0
Gary Ginobili          10    6    0    1   0   3/4    75.0     0/0   0.0
Tim Jordan             12    4    5    2   0   2/2   100.0     0/0   0.0
DeMar James            12    0    0    0   0   0/1     0.0     0/0   0.0
Tobias Hyland          12    0    1    0   0   0/0     0.0     0/0   0.0
D'Angelo Randle        14    0    0    0   0   0/1     0.0     0/0   0.0
Shai Ingram            12    0    3    1   0   0/1     0.0     0/0   0.0
Jalen Turner           10    0    0    1   0   0/0     0.0     0/0   0.0

TEAM: FG: 10/15 (66.7%), 3PT: 1/1 (100.0%), REB: 10 (3 off, 7 def), AST: 5, TO: 4
TEAM FOULS: 7 [Team_059 in BONUS]


Team_059
--------------------------------------------------------------------------------
Player                MIN  PTS  REB  AST  TO      FG   FG%      3P   3P%
--------------------------------------------------------------------------------
Scottie Ginobili       10    5    3    0   0   2/3    66.7     0/0   0.0
LeBron Lowry           10    3    1    0   0   1/3    33.3     0/0   0.0
Blake Tatum            14    2    0    1   0   1/1   100.0     0/0   0.0
John Iverson           12    2    0    0   0   1/1   100.0     0/0   0.0
Russell Quickley       10    2    0    0   0   1/2    50.0     0/0   0.0
Jarrett Smith          14    0    2    0   0   0/0     0.0     0/0   0.0
Bam Wade               14    0    0    1   0   0/0     0.0     0/0   0.0
Bones Middleton        10    0    3    1   0   0/1     0.0     0/0   0.0
Allen Giddey           12    0    0    0   0   0/2     0.0     0/0   0.0

TEAM: FG: 6/13 (46.2%), 3PT: 0/1 (0.0%), REB: 9 (4 off, 5 def), AST: 3, TO: 6
TEAM FOULS: 9 [Team_019 in BONUS]

================================================================================

================================================================================
                       3RD QUARTER - Team_019 vs Team_059                       
================================================================================

[12:00] Team_019 possession (Score: 51-45)
Brandon James attempts a Midrange. Wide open! John Iverson is 7.2 feet away. [ZONE] Brandon James misses. Rebound secured by Jarrett Smith.

[11:44] Team_059 possession (Score: 51-45)
Jarrett Smith attempts a Midrange. Wide open! Tobias Hyland is 10.0 feet away. [ZONE] Jarrett Smith misses. Rebound secured by D'Angelo Randle.

[11:35] Team_019 possession (Score: 51-45)
Brandon James drives and kicks out. Tobias Hyland attempts a 3Pt. Wide open! Nikola Jokic is 6.4 feet away. [ZONE] Tobias Hyland misses. Rebound secured by Jarrett Smith.

[11:22] Team_059 possession (Score: 51-45)
Nikola Jokic drives to the basket... FOUL! Offensive foul on Nikola Jokic! Tobias Hyland drew the charge! [Team fouls: 1] (Nikola Jokic: 1 personal fouls) TURNOVER! (dead ball)

[11:07] Team_019 possession (Score: 51-45)
Tobias Hyland attempts a Midrange. Contested by Blake Tatum (5.8 feet, ZONE). TOBIAS HYLAND MAKES IT! Assist: Brandon James
Score: 53-45

[10:56] Team_059 possession (Score: 53-45)
John Iverson attempts a Layup. Contested by DeMar James (3.6 feet, ZONE). JOHN IVERSON MAKES IT! Assist: Bam Wade
Score: 53-47

[10:41] Team_019 possession (Score: 53-47)
Brandon James attempts a Layup. BLOCKED BY BLAKE TATUM! Ball is loose! Rebound secured by Jarrett Smith.

[10:31] Team_059 possession (Score: 53-47)
Bam Wade attempts a 3Pt. Heavily contested by D'Angelo Randle (2.0 feet, ZONE)! Bam Wade misses. Rebound secured by DeMar James.

[10:16] Team_019 possession (Score: 53-47)
D'Angelo Randle attempts a Layup. Contested by Jarrett Smith (3.7 feet, ZONE). D'Angelo Randle misses. Rebound secured by Jarrett Smith.

[09:58] Team_059 possession (Score: 53-47)
FOUL! Shooting foul on D'Angelo Randle. John Iverson to the line for 2 free throws. [Team fouls: 1] (D'Angelo Randle: 1 personal fouls)   FT 1/2: MISS   FT 2/2: GOOD John Iverson makes 1/2 from the line.
Score: 53-48

[09:44] Team_019 possession (Score: 53-48)
Rudy Giddey attempts a 3Pt. Contested by Bam Wade (5.5 feet, MAN). Rudy Giddey misses. Offensive rebound by DeMar James! DeMar James puts it back in!
Score: 55-48

[09:28] Team_059 possession (Score: 55-48)
John Iverson attempts a Layup. Heavily contested by D'Angelo Randle (1.5 feet, MAN)! JOHN IVERSON MAKES IT!
Score: 55-50

[09:18] Team_019 possession (Score: 55-50)
Tobias Hyland attempts a Midrange. Contested by Nikola Jokic (4.8 feet, ZONE). Tobias Hyland misses. Rebound secured by Jarrett Smith.

[09:02] Team_059 possession (Score: 55-50)
Jarrett Smith attempts a Midrange. Contested by D'Angelo Randle (5.2 feet, ZONE). JARRETT SMITH MAKES IT! Assist: Blake Tatum
Score: 55-52

[08:48] Team_019 possession (Score: 55-52)
Rudy Giddey attempts a Midrange. Contested by John Iverson (5.5 feet, ZONE). RUDY GIDDEY MAKES IT!
Score: 57-52

[08:37] Team_059 possession (Score: 57-52)
FOUL! Shooting foul on DeMar James. Bam Wade to the line for 2 free throws. [Team fouls: 2] (DeMar James: 1 personal fouls)   FT 1/2: GOOD   FT 2/2: GOOD Bam Wade makes 2/2 from the line.
Score: 57-54

[08:22] Team_019 possession (Score: 57-54)
DeMar James attempts a Midrange. Contested by John Iverson (5.1 feet, ZONE). DeMar James misses. Rebound secured by John Iverson.

[08:05] Team_059 possession (Score: 57-54)
Nikola Jokic attempts a 3Pt. Contested by Tobias Hyland (4.4 feet, MAN). Nikola Jokic misses. Rebound secured by Tobias Hyland.

[07:47] Team_019 possession (Score: 57-54)
DeMar James makes the Midrange and draws the foul on Jarrett Smith! And-1! DeMar James to the line for 1. [Team fouls: 2] (Jarrett Smith: 1 personal fouls)   FT 1/1: GOOD DeMar James makes 1/1 from the line.
Score: 60-54

[07:37] Team_059 possession (Score: 60-54)
John Iverson attempts a Layup. Contested by D'Angelo Randle (2.1 feet, MAN). JOHN IVERSON MAKES IT! Assist: Bam Wade
Score: 60-56

[07:21] Team_019 possession (Score: 60-56)
Brandon James attempts a 3Pt. Wide open! Bam Wade is 6.1 feet away. [ZONE] Brandon James misses. Rebound secured by John Iverson.

[07:08] Team_059 possession (Score: 60-56)
Nikola Jokic attempts a 3Pt. Wide open! Tobias Hyland is 8.3 feet away. [MAN] NIKOLA JOKIC MAKES IT! Assist: Blake Tatum
Score: 60-59

[06:53] Team_019 possession (Score: 60-59)
DeMar James makes the Layup and draws the foul on Jarrett Smith! And-1! DeMar James to the line for 1. [Team fouls: 3] (Jarrett Smith: 2 personal fouls)   FT 1/1: GOOD DeMar James makes 1/1 from the line.
Score: 63-59

[06:34] Team_059 possession (Score: 63-59)
FOUL! Reach-in foul on D'Angelo Randle during the drive. [Team fouls: 3] No free throws, side out. (D'Angelo Randle: 2 personal fouls)

[06:17] Team_059 possession (Score: 63-59)
Nikola Jokic drives and kicks out. Jarrett Smith attempts a 3Pt. Contested by DeMar James (2.7 feet, MAN). Jarrett Smith misses. Rebound secured by D'Angelo Randle.

[06:07] Team_019 possession (Score: 63-59)
D'Angelo Randle drives, picks up Jarrett Smith. Help arrives from Bam Wade! D'Angelo Randle attempts a Layup. Contested by Bam Wade (3.5 feet, ZONE). D'ANGELO RANDLE MAKES IT! Assist: Rudy Giddey
Score: 65-59

[05:53] Team_059 possession (Score: 65-59)
Nikola Jokic throws a bad pass! Stolen by Tobias Hyland! TURNOVER! (live ball)

[05:42] Team_019 possession (Score: 65-59)
D'Angelo Randle drives, John Iverson stays with him. D'Angelo Randle attempts a Dunk. Contested by John Iverson (4.1 feet, MAN). D'Angelo Randle misses. Rebound secured by Bam Wade.

[05:23] Team_059 possession (Score: 65-59)
Nikola Jokic attempts a Layup. Contested by DeMar James (3.9 feet, ZONE). Nikola Jokic misses. Rebound secured by DeMar James.

[05:08] Team_019 possession (Score: 65-59)
Rudy Giddey attempts a Layup. BLOCKED BY BAM WADE! Ball is loose! Offensive rebound by D'Angelo Randle! D'Angelo Randle kicks it out.

[04:52] Team_019 possession (Score: 65-59)
D'Angelo Randle drives to the basket... D'Angelo Randle throws a bad pass! Stolen by John Iverson! TURNOVER! (live ball)

[04:40] Team_059 possession (Score: 65-59)
Blake Tatum attempts a 3Pt. Contested by D'Angelo Randle (3.1 feet, ZONE). Blake Tatum misses. Rebound secured by D'Angelo Randle.

[04:23] Team_019 possession (Score: 65-59)
Brandon James loses control! Ball rolls out of bounds! TURNOVER! (dead ball)

[04:10] Team_059 possession (Score: 65-59)
Jarrett Smith drives, picks up DeMar James. Help arrives from Brandon James! Jarrett Smith attempts a Dunk. Contested by Brandon James (3.7 feet, ZONE). JARRETT SMITH MAKES IT!
Score: 65-61

[03:53] Team_019 possession (Score: 65-61)
D'Angelo Randle throws a bad pass out of bounds! TURNOVER! (dead ball)

[03:34] Team_059 possession (Score: 65-61)
Bam Wade drives and kicks out. Jarrett Smith attempts a Midrange. Contested by DeMar James (3.5 feet, MAN). JARRETT SMITH MAKES IT! Assist: Bam Wade
Score: 65-63

[03:19] Team_019 possession (Score: 65-63)
DeMar James drives and kicks out. Rudy Giddey attempts a Midrange. Contested by Bam Wade (5.9 feet, MAN). Rudy Giddey misses. Rebound secured by Jarrett Smith.

[03:02] Team_059 possession (Score: 65-63)
Blake Tatum throws a bad pass out of bounds! TURNOVER! (dead ball)

[03:02] Substitution (Team_019): Tobias Hyland OUT → Shai Ingram IN (stamina_rule2)

[03:02] Substitution (Team_019): DeMar James OUT → Tim Jordan IN (stamina_rule2)

[03:02] Substitution (Team_059): John Iverson OUT → Allen Giddey IN (stamina_rule2)

[02:48] Team_019 possession (Score: 65-63)
Brandon James attempts a Midrange. Contested by Blake Tatum (3.8 feet, ZONE). Brandon James misses. Rebound secured by Bam Wade.

[02:35] Team_059 possession (Score: 65-63)
Allen Giddey attempts a Midrange. Wide open! Shai Ingram is 6.2 feet away. [ZONE] Allen Giddey misses. Rebound secured by Tim Jordan.

[02:22] Team_019 possession (Score: 65-63)
Brandon James attempts a Midrange. Contested by Blake Tatum (2.6 feet, MAN). Brandon James misses. Rebound secured by Bam Wade.

[02:05] Team_059 possession (Score: 65-63)
FOUL! Shooting foul on Rudy Giddey. Bam Wade to the line for 2 free throws. [Team fouls: 4] (Rudy Giddey: 1 personal fouls)   FT 1/2: GOOD   FT 2/2: GOOD Bam Wade makes 2/2 from the line.
Score: 65-65

[01:48] Team_019 possession (Score: 65-65)
D'Angelo Randle attempts a 3Pt. Contested by Bam Wade (3.0 feet, ZONE). D'ANGELO RANDLE MAKES IT! Assist: Shai Ingram
Score: 68-65

[01:34] Team_059 possession (Score: 68-65)
Blake Tatum attempts a 3Pt. Contested by D'Angelo Randle (5.0 feet, ZONE). Blake Tatum misses. Rebound secured by Tim Jordan.

[01:15] Team_019 possession (Score: 68-65)
Shai Ingram attempts a 3Pt. Contested by Blake Tatum (3.6 feet, ZONE). Shai Ingram misses. Offensive rebound by D'Angelo Randle! D'Angelo Randle kicks it out.

[00:57] Team_019 possession (Score: 68-65)
Brandon James attempts a Midrange. Contested by Nikola Jokic (5.9 feet, ZONE). Brandon James misses. Rebound secured by Jarrett Smith.

[00:39] Team_059 possession (Score: 68-65)
Blake Tatum attempts a Midrange. Wide open! Brandon James is 7.1 feet away. [MAN] BLAKE TATUM MAKES IT! Assist: Nikola Jokic
Score: 68-67

[00:23] Team_019 possession (Score: 68-67)
Tim Jordan attempts a Midrange. Wide open! Nikola Jokic is 6.5 feet away. [ZONE] Tim Jordan misses. Rebound secured by Jarrett Smith.

[00:12] Team_059 possession (Score: 68-67)
FOUL! Shooting foul on Shai Ingram. Nikola Jokic to the line for 2 free throws. [BONUS: 5 team fouls] (Shai Ingram: 1 personal fouls)   FT 1/2: GOOD   FT 2/2: MISS Nikola Jokic makes 1/2 from the line. Rebound secured by Tim Jordan.
Score: 68-68

================================================================================
                              3RD QUARTER COMPLETE                              
================================================================================

3RD QUARTER SCORE: Team_019 17, Team_059 23

BOX SCORE:
================================================================================

Team_019
--------------------------------------------------------------------------------
Player                MIN  PTS  REB  AST  TO      FG   FG%      3P   3P%
--------------------------------------------------------------------------------
DeMar James            21    8    3    0   0   3/5    60.0     0/0   0.0
D'Angelo Randle        26    5    5    0   0   2/4    50.0     0/0   0.0
Tobias Hyland          21    2    1    0   0   1/2    50.0     0/0   0.0
Rudy Giddey            26    2    0    1   0   1/1   100.0     0/0   0.0
Brandon James          26    0    0    1   0   0/7     0.0     0/0   0.0
Tim Jordan             15    0    3    0   0   0/1     0.0     0/0   0.0
Shai Ingram            15    0    0    1   0   0/0     0.0     0/0   0.0

TEAM: FG: 7/20 (35.0%), 3PT: 2/3 (66.7%), REB: 12 (3 off, 9 def), AST: 3, TO: 3
TEAM FOULS: 5 [Team_059 in BONUS]


Team_059
--------------------------------------------------------------------------------
Player                MIN  PTS  REB  AST  TO      FG   FG%      3P   3P%
--------------------------------------------------------------------------------
John Iverson           21    7    2    0   0   4/4   100.0     0/0   0.0
Jarrett Smith          26    6    8    0   0   3/4    75.0     0/0   0.0
Bam Wade               26    4    3    3   0   2/3    66.7     0/0   0.0
Nikola Jokic           26    3    0    1   0   1/5    20.0     0/0   0.0
Blake Tatum            26    2    0    2   0   1/3    33.3     0/0   0.0
Allen Giddey           15    0    0    0   0   0/1     0.0     0/0   0.0

TEAM: FG: 11/20 (55.0%), 3PT: 1/5 (20.0%), REB: 13 (0 off, 13 def), AST: 6, TO: 3
TEAM FOULS: 3

================================================================================

================================================================================
                       4TH QUARTER - Team_019 vs Team_059                       
================================================================================

[12:00] Team_019 possession (Score: 68-68)
Rudy Giddey drives and kicks out. Tobias Hyland attempts a Midrange. Contested by Nikola Jokic (4.2 feet, MAN). Tobias Hyland misses. Rebound secured by Jarrett Smith.

[11:41] Team_059 possession (Score: 68-68)
Blake Tatum attempts a 3Pt. Contested by Brandon James (4.0 feet, MAN). BLAKE TATUM MAKES IT! Assist: John Iverson
Score: 68-71

[11:28] Team_019 possession (Score: 68-71)
Brandon James drives, Blake Tatum stays with him. Brandon James attempts a Layup. Heavily contested by Blake Tatum (1.5 feet, MAN)! Brandon James misses. Rebound secured by John Iverson.

[11:09] Team_059 possession (Score: 68-71)
Bam Wade attempts a Layup. Contested by Rudy Giddey (4.7 feet, MAN). BAM WADE MAKES IT! Assist: John Iverson
Score: 68-73

[10:54] Team_019 possession (Score: 68-73)
DeMar James makes the Dunk and draws the foul on Jarrett Smith! And-1! DeMar James to the line for 1. [Team fouls: 1] (Jarrett Smith: 1 personal fouls)   FT 1/1: GOOD DeMar James makes 1/1 from the line.
Score: 71-73

[10:35] Team_059 possession (Score: 71-73)
Jarrett Smith attempts a Layup. Contested by DeMar James (2.7 feet, MAN). JARRETT SMITH MAKES IT!
Score: 71-75

[10:19] Team_019 possession (Score: 71-75)
Tobias Hyland makes the Layup and draws the foul on Jarrett Smith! And-1! Tobias Hyland to the line for 1. [Team fouls: 2] (Jarrett Smith: 2 personal fouls)   FT 1/1: MISS Tobias Hyland makes 0/1 from the line. Rebound secured by Jarrett Smith.
Score: 73-75

[10:01] Team_059 possession (Score: 73-75)
Bam Wade attempts a 3Pt. Wide open! Rudy Giddey is 9.2 feet away. [MAN] BAM WADE MAKES IT! Assist: Nikola Jokic
Score: 73-78

[09:48] Team_019 possession (Score: 73-78)
DeMar James drives, Jarrett Smith stays with him. DeMar James attempts a Layup. Contested by Jarrett Smith (4.4 feet, ZONE). DEMAR JAMES MAKES IT!
Score: 75-78

[09:33] Team_059 possession (Score: 75-78)
John Iverson drives to the basket... John Iverson loses control! Ball rolls out of bounds! TURNOVER! (dead ball)

[09:33] Substitution (Team_019): Rudy Giddey OUT → Gary Ginobili IN (stamina_rule2)

[09:33] Substitution (Team_019): Brandon James OUT → Jalen Turner IN (stamina_rule2)

[09:33] Substitution (Team_019): D'Angelo Randle OUT → Blake LaVine IN (stamina_rule2)

[09:33] Substitution (Team_059): Bam Wade OUT → Russell Quickley IN (stamina_rule2)

[09:33] Substitution (Team_059): Blake Tatum OUT → Scottie Ginobili IN (stamina_rule2)

[09:33] Substitution (Team_059): Nikola Jokic OUT → Bones Middleton IN (stamina_rule2)

[09:33] Substitution (Team_059): Jarrett Smith OUT → LeBron Lowry IN (stamina_rule2)

[09:16] Team_019 possession (Score: 75-78)
Gary Ginobili attempts a Midrange. Contested by Russell Quickley (4.1 feet, MAN). Gary Ginobili misses. Rebound secured by Bones Middleton.

[09:04] Team_059 possession (Score: 75-78)
John Iverson attempts a 3Pt. Contested by Blake LaVine (4.7 feet, ZONE). John Iverson misses. Rebound secured by Blake LaVine.

[08:49] Team_019 possession (Score: 75-78)
Tobias Hyland attempts a 3Pt. Wide open! Russell Quickley is 7.9 feet away. [ZONE] TOBIAS HYLAND MAKES IT!
Score: 78-78

[08:32] Team_059 possession (Score: 78-78)
LeBron Lowry loses the ball! Stripped by DeMar James! TURNOVER! (live ball)

[08:18] Team_019 possession (Score: 78-78)
Gary Ginobili drives to the basket... Gary Ginobili commits a violation (traveling/carry)! TURNOVER! (dead ball)

[08:18] Substitution (Team_019): Tobias Hyland OUT → Shai Ingram IN (stamina_rule2)

[08:18] Substitution (Team_019): DeMar James OUT → Tim Jordan IN (stamina_rule2)

[08:18] Substitution (Team_059): John Iverson OUT → Allen Giddey IN (stamina_rule2)

[08:03] Team_059 possession (Score: 78-78)
Russell Quickley attempts a Layup. Contested by Gary Ginobili (5.9 feet, MAN). RUSSELL QUICKLEY MAKES IT! Assist: Allen Giddey
Score: 78-80

[07:52] Team_019 possession (Score: 78-80)
Blake LaVine attempts a 3Pt. Heavily contested by Russell Quickley (1.2 feet, ZONE)! Blake LaVine misses. Offensive rebound by Tim Jordan! Tim Jordan kicks it out.

[07:41] Team_019 possession (Score: 78-80)
Tim Jordan attempts a 3Pt. Wide open! Allen Giddey is 6.3 feet away. [ZONE] TIM JORDAN MAKES IT! Assist: Shai Ingram
Score: 81-80

[07:27] Team_059 possession (Score: 81-80)
LeBron Lowry attempts a Midrange. Contested by Shai Ingram (3.6 feet, MAN). LEBRON LOWRY MAKES IT! Assist: Allen Giddey
Score: 81-82

[07:09] Team_019 possession (Score: 81-82)
Shai Ingram attempts a 3Pt. Contested by Bones Middleton (4.5 feet, ZONE). Shai Ingram misses. Rebound secured by Scottie Ginobili.

[06:54] Team_059 possession (Score: 81-82)
Russell Quickley attempts a 3Pt. Wide open! Gary Ginobili is 9.0 feet away. [MAN] Russell Quickley misses. Rebound secured by Tim Jordan.

[06:39] Team_019 possession (Score: 81-82)
Tim Jordan attempts a Midrange. Contested by LeBron Lowry (5.6 feet, MAN). Tim Jordan misses. Rebound secured by Scottie Ginobili.

[06:25] Team_059 possession (Score: 81-82)
Russell Quickley attempts a 3Pt. Contested by Gary Ginobili (4.9 feet, MAN). RUSSELL QUICKLEY MAKES IT! Assist: Allen Giddey
Score: 81-85

[06:08] Team_019 possession (Score: 81-85)
Shai Ingram attempts a 3Pt. Contested by Russell Quickley (3.3 feet, ZONE). Shai Ingram misses. Rebound secured by Scottie Ginobili.

[05:56] Team_059 possession (Score: 81-85)
LeBron Lowry drives, Shai Ingram stays with him. LeBron Lowry attempts a Layup. Heavily contested by Shai Ingram (0.5 feet, MAN)! LeBron Lowry misses. Rebound secured by Blake LaVine.

[05:44] Team_019 possession (Score: 81-85)
Gary Ginobili attempts a 3Pt. Wide open! Russell Quickley is 7.6 feet away. [ZONE] Gary Ginobili misses. Rebound secured by Bones Middleton.

[05:31] Team_059 possession (Score: 81-85)
Allen Giddey attempts a Layup. Contested by Blake LaVine (3.0 feet, MAN). ALLEN GIDDEY MAKES IT!
Score: 81-87

[05:13] Team_019 possession (Score: 81-87)
FOUL! Holding foul on Scottie Ginobili. [Team fouls: 3] No free throws, side out. (Scottie Ginobili: 1 personal fouls)

[05:00] Team_019 possession (Score: 81-87)
Blake LaVine attempts a 3Pt. Wide open! Allen Giddey is 8.5 feet away. [MAN] Blake LaVine misses. Rebound secured by Bones Middleton.

[04:46] Team_059 possession (Score: 81-87)
LeBron Lowry drives and kicks out. Russell Quickley attempts a Midrange. Contested by Gary Ginobili (4.9 feet, MAN). Russell Quickley misses. Rebound secured by Shai Ingram.

[04:32] Team_019 possession (Score: 81-87)
FOUL! Holding foul on Allen Giddey. [Team fouls: 4] No free throws, side out. (Allen Giddey: 1 personal fouls)

[04:16] Team_019 possession (Score: 81-87)
Gary Ginobili attempts a Midrange. Wide open! Allen Giddey is 7.9 feet away. [ZONE] Gary Ginobili misses. FOUL! Loose ball foul on LeBron Lowry during the rebound battle. [IN THE BONUS! 5 team fouls] Tim Jordan to the line for 2 free throws. (LeBron Lowry: 1 personal fouls)   FT 1/2: GOOD   FT 2/2: GOOD Tim Jordan makes 2/2 from the line.
Score: 83-87

[04:02] Team_059 possession (Score: 83-87)
LeBron Lowry throws a bad pass out of bounds! TURNOVER! (dead ball)

[03:49] Team_019 possession (Score: 83-87)
Tim Jordan attempts a Midrange. Contested by Scottie Ginobili (2.2 feet, ZONE). Tim Jordan misses. Rebound secured by LeBron Lowry.

[03:33] Team_059 possession (Score: 83-87)
Scottie Ginobili throws a bad pass out of bounds! TURNOVER! (dead ball)

[03:16] Team_019 possession (Score: 83-87)
FOUL! Shooting foul on Bones Middleton. Shai Ingram to the line for 2 free throws. [BONUS: 6 team fouls] (Bones Middleton: 1 personal fouls)   FT 1/2: GOOD   FT 2/2: MISS Shai Ingram makes 1/2 from the line. Rebound secured by Bones Middleton.
Score: 84-87

[03:02] Team_059 possession (Score: 84-87)
FOUL! Holding foul on Jalen Turner. [Team fouls: 1] No free throws, side out. (Jalen Turner: 1 personal fouls)

[02:45] Team_059 possession (Score: 84-87)
Scottie Ginobili attempts a 3Pt. Wide open! Blake LaVine is 8.6 feet away. [ZONE] Scottie Ginobili misses. Rebound secured by Blake LaVine.

[02:29] Team_019 possession (Score: 84-87)
FOUL! Shooting foul on Bones Middleton. Jalen Turner to the line for 2 free throws. [BONUS: 7 team fouls] (Bones Middleton: 2 personal fouls)   FT 1/2: MISS   FT 2/2: MISS Jalen Turner makes 0/2 from the line. Offensive rebound by Tim Jordan! Tim Jordan kicks it out.

[02:12] Team_019 possession (Score: 84-87)
Tim Jordan attempts a Layup. BLOCKED BY LEBRON LOWRY! Ball is loose! Offensive rebound by Shai Ingram! Shai Ingram kicks it out.

[02:00] Team_019 possession (Score: 84-87)
Tim Jordan attempts a Layup. Contested by LeBron Lowry (3.7 feet, MAN). Tim Jordan misses. Offensive rebound by Shai Ingram! Shai Ingram kicks it out.

[01:45] Team_019 possession (Score: 84-87)
Tim Jordan drives to the basket... Tim Jordan throws a bad pass! Stolen by LeBron Lowry! TURNOVER! (live ball)

[01:29] Team_059 possession (Score: 84-87)
Scottie Ginobili attempts a 3Pt. Contested by Jalen Turner (3.9 feet, MAN). Scottie Ginobili misses. Rebound secured by Tim Jordan.

[01:13] Team_019 possession (Score: 84-87)
Gary Ginobili drives, picks up Bones Middleton. Help arrives from Scottie Ginobili! Gary Ginobili attempts a Dunk. Contested by Scottie Ginobili (5.2 feet, ZONE). Gary Ginobili misses. Rebound secured by Bones Middleton.

[01:00] Team_059 possession (Score: 84-87)
Bones Middleton attempts a 3Pt. Wide open! Jalen Turner is 6.9 feet away. [ZONE] Bones Middleton misses. Rebound secured by Blake LaVine.

[00:45] Team_019 possession (Score: 84-87)
Shai Ingram attempts a 3Pt. Heavily contested by Bones Middleton (1.3 feet, MAN)! Shai Ingram misses. Rebound secured by Scottie Ginobili.

[00:31] Team_059 possession (Score: 84-87)
Allen Giddey drives to the basket... Allen Giddey loses control! Ball rolls out of bounds! TURNOVER! (dead ball)

[00:14] Team_019 possession (Score: 84-87)
Gary Ginobili drives and kicks out. Jalen Turner attempts a 3Pt. Contested by Russell Quickley (4.5 feet, ZONE). Jalen Turner misses. Rebound secured by Scottie Ginobili.

================================================================================
                              4TH QUARTER COMPLETE                              
================================================================================

4TH QUARTER SCORE: Team_019 16, Team_059 19

BOX SCORE:
================================================================================

Team_019
--------------------------------------------------------------------------------
Player                MIN  PTS  REB  AST  TO      FG   FG%      3P   3P%
--------------------------------------------------------------------------------
DeMar James            25    5    0    0   0   2/2   100.0     0/0   0.0
Tim Jordan             23    5    4    0   0   2/4    50.0     0/0   0.0
Tobias Hyland          25    3    0    0   0   1/2    50.0     0/0   0.0
Rudy Giddey            29    0    0    0   0   0/1     0.0     0/0   0.0
Brandon James          29    0    0    0   0   0/1     0.0     0/0   0.0
Gary Ginobili          20    0    0    0   0   0/4     0.0     0/0   0.0
Blake LaVine           20    0    4    0   0   0/1     0.0     0/0   0.0
Shai Ingram            23    0    3    1   0   0/4     0.0     0/0   0.0

TEAM: FG: 5/19 (26.3%), 3PT: 2/7 (28.6%), REB: 11 (4 off, 7 def), AST: 1, TO: 2
TEAM FOULS: 1


Team_059
--------------------------------------------------------------------------------
Player                MIN  PTS  REB  AST  TO      FG   FG%      3P   3P%
--------------------------------------------------------------------------------
Bam Wade               29    5    0    0   0   2/2   100.0     0/0   0.0
Russell Quickley       20    5    0    0   0   2/3    66.7     0/0   0.0
Blake Tatum            29    3    0    0   0   1/1   100.0     0/0   0.0
Jarrett Smith          29    2    2    0   0   1/1   100.0     0/0   0.0
Allen Giddey           23    2    0    3   0   1/1   100.0     0/0   0.0
LeBron Lowry           20    2    1    0   0   1/3    33.3     0/0   0.0
John Iverson           25    0    1    2   0   0/1     0.0     0/0   0.0
Nikola Jokic           29    0    0    1   0   0/0     0.0     0/0   0.0
Bones Middleton        20    0    5    0   0   0/1     0.0     0/0   0.0
Scottie Ginobili       20    0    5    0   0   0/2     0.0     0/0   0.0

TEAM: FG: 8/15 (53.3%), 3PT: 3/8 (37.5%), REB: 14 (0 off, 14 def), AST: 6, TO: 5
TEAM FOULS: 7 [Team_019 in BONUS]

================================================================================

================================================================================
                               FULL GAME COMPLETE                               
================================================================================

FINAL SCORE: Team_019 84, Team_059 87

SCORING BY QUARTER:
--------------------------------------------------------------------------------
Team                     Q1     Q2     Q3     Q4    FINAL
--------------------------------------------------------------------------------
Team_019                 27     24     17     16       84
Team_059                 30     15     23     19       87
--------------------------------------------------------------------------------

FULL GAME BOX SCORE:
================================================================================

Team_019
--------------------------------------------------------------------------------
Player                MIN  PTS  REB  AST  TO      FG   FG%      3P   3P%      FT STL BLK
--------------------------------------------------------------------------------
Rudy Giddey            29    5    0    2   2   4/6    66.7   3/3   100.0   1/2     0   0
Brandon James          29    6    0    1   5   1/11    9.1   0/1     0.0   1/1     0   0
D'Angelo Randle        29    8    6    1   3   3/7    42.9   2/2   100.0   0/0     0   0
DeMar James            25   16    5    0   1   6/10   60.0   0/0     0.0   4/5     2   0
Tobias Hyland          25   10    5    2   1   4/6    66.7   1/1   100.0   1/2     1   0
Shai Ingram            23    2    7    3   1   1/6    16.7   0/3     0.0   2/4     0   1
Tim Jordan             23   11   13    2   0   4/7    57.1   1/1   100.0   6/6     0   0
Gary Ginobili          20    6    0    2   1   4/9    44.4   0/1     0.0   0/0     0   0
Jalen Turner           20    2    0    2   1   2/2   100.0   0/0     0.0   0/2     0   0
Blake LaVine           20   13    5    0   0   3/5    60.0   1/2    50.0   0/0     0   0

TEAM: FG: 33/70 (47.1%), 3PT: 8/14 (57.1%), REB: 40 (12 off, 28 def), AST: 15, TO: 15


Team_059
--------------------------------------------------------------------------------
Player                MIN  PTS  REB  AST  TO      FG   FG%      3P   3P%      FT STL BLK
--------------------------------------------------------------------------------
Bam Wade               29   15    6    7   0   8/10   80.0   1/3    33.3   4/4     1   1
Blake Tatum            29   16    0    4   1   7/10   70.0   2/4    50.0   4/4     2   1
Nikola Jokic           29    7    0    3   4   3/8    37.5   1/2    50.0   1/2     0   0
Jarrett Smith          29   12   13    0   1   4/6    66.7   0/0     0.0   2/2     1   0
John Iverson           25   11    7    4   1   6/8    75.0   0/2     0.0   1/2     1   0
Allen Giddey           23    4    0    4   1   2/5    40.0   0/0     0.0   0/2     0   0
Russell Quickley       20   10    0    0   3   4/6    66.7   2/4    50.0   0/0     0   0
Scottie Ginobili       20    5    8    0   3   2/5    40.0   0/2     0.0   3/5     0   0
Bones Middleton        20    0    9    1   0   0/3     0.0   0/1     0.0   0/0     1   0
LeBron Lowry           20    5    2    1   2   2/6    33.3   0/0     0.0   2/3     1   1

TEAM: FG: 39/68 (57.4%), 3PT: 6/18 (33.3%), REB: 46 (9 off, 37 def), AST: 24, TO: 16

================================================================================
