================================================================================
                        FULL GAME - Team_060 vs Team_021                        
================================================================================

================================================================================
                       1ST QUARTER - Team_060 vs Team_021                       
================================================================================

[12:00] Team_060 possession (Score: 0-0)
Immanuel Ming attempts a Midrange. Contested by Anthony Oladipo (3.3 feet, ZONE). Immanuel Ming misses. Rebound secured by Zach Carter.

[11:50] Team_021 possession (Score: 0-0)
Zach Carter drives and kicks out. Anthony Oladipo attempts a 3Pt. Heavily contested by Julius Green (1.6 feet, MAN)! Anthony Oladipo misses. Rebound secured by Larry Westbrook.

[11:37] Team_060 possession (Score: 0-0)
Julius Green attempts a Midrange. Wide open! Karl Bridges is 6.6 feet away. [ZONE] Julius Green misses. Offensive rebound by Immanuel Ming! Immanuel Ming kicks it out.

[11:25] Team_060 possession (Score: 0-0)
Larry Westbrook attempts a 3Pt. Contested by Kyrie Wagner (5.3 feet, ZONE). Larry Westbrook misses. Rebound secured by Zach Carter.

[11:14] Team_021 possession (Score: 0-0)
Zach Carter attempts a Layup. Wide open! Jaren George is 6.1 feet away. [MAN] ZACH CARTER MAKES IT! Assist: Kyrie Wagner
Score: 0-2

[10:58] Team_060 possession (Score: 0-2)
Larry Westbrook attempts a Layup. Heavily contested by Zach Carter (1.9 feet, ZONE)! Larry Westbrook misses. Offensive rebound by Immanuel Ming! Immanuel Ming kicks it out.

[10:48] Team_060 possession (Score: 0-2)
Larry Westbrook attempts a Midrange. Contested by Kyrie Wagner (5.0 feet, MAN). Larry Westbrook misses. Rebound secured by Zach Carter.

[10:32] Team_021 possession (Score: 0-2)
Anthony Oladipo attempts a 3Pt. Heavily contested by Julius Green (0.8 feet, MAN)! ANTHONY OLADIPO MAKES IT!
Score: 0-5

[10:15] Team_060 possession (Score: 0-5)
FOUL! Offensive foul on Julius Green! Anthony Oladipo drew the charge! [Team fouls: 1] (Julius Green: 1 personal fouls) TURNOVER! (dead ball)

[10:01] Team_021 possession (Score: 0-5)
Kyrie Leonard attempts a 3Pt. Contested by Julius Green (4.6 feet, ZONE). KYRIE LEONARD MAKES IT!
Score: 0-8

[09:48] Team_060 possession (Score: 0-8)
Julius Green attempts a 3Pt. Heavily contested by Kyrie Wagner (0.6 feet, ZONE)! Julius Green misses. Rebound secured by Kyrie Leonard.

[09:34] Team_021 possession (Score: 0-8)
Kyrie Leonard attempts a Layup. BLOCKED BY JAREN GEORGE! Ball is loose! Rebound secured by Larry Westbrook.

[09:20] Team_060 possession (Score: 0-8)
FOUL! Holding foul on Kyrie Wagner. [Team fouls: 1] No free throws, side out. (Kyrie Wagner: 1 personal fouls)

[09:04] Team_060 possession (Score: 0-8)
Julius Green attempts a 3Pt. Contested by Anthony Oladipo (5.4 feet, MAN). JULIUS GREEN MAKES IT! Assist: Jaren George
Score: 3-8

[08:49] Team_021 possession (Score: 3-8)
Karl Bridges drives, Jaren George stays with him. Karl Bridges attempts a Layup. Wide open! Jaren George is 8.2 feet away. [ZONE] KARL BRIDGES MAKES IT! Assist: Kyrie Leonard
Score: 3-10

[08:37] Team_060 possession (Score: 3-10)
Larry Westbrook attempts a Midrange. Contested by Kyrie Wagner (3.9 feet, MAN). Larry Westbrook misses. Offensive rebound by Immanuel Ming! Immanuel Ming kicks it out.

[08:19] Team_060 possession (Score: 3-10)
Julius Green drives, picks up Anthony Oladipo. Help arrives from Kyrie Leonard! Julius Green attempts a Dunk. Contested by Kyrie Leonard (5.6 feet, MAN). JULIUS GREEN MAKES IT! Assist: Immanuel Ming
Score: 5-10

[08:01] Team_021 possession (Score: 5-10)
FOUL! Shooting foul on Jaren George. Anthony Oladipo to the line for 2 free throws. [Team fouls: 2] (Jaren George: 1 personal fouls)   FT 1/2: GOOD   FT 2/2: GOOD Anthony Oladipo makes 2/2 from the line.
Score: 5-12

[07:45] Team_060 possession (Score: 5-12)
Immanuel Ming attempts a 3Pt. Wide open! Karl Bridges is 7.2 feet away. [MAN] Immanuel Ming misses. Offensive rebound by Jaren George! Jaren George's putback is no good. Offensive rebound by Immanuel Ming! Immanuel Ming kicks it out.

[07:33] Team_060 possession (Score: 5-12)
Larry Westbrook attempts a 3Pt. Wide open! Kyrie Wagner is 6.8 feet away. [MAN] LARRY WESTBROOK MAKES IT! Assist: Julius Green
Score: 8-12

[07:20] Team_021 possession (Score: 8-12)
Anthony Oladipo throws a bad pass! Stolen by Julius Green! TURNOVER! (live ball)

[07:08] Team_060 possession (Score: 8-12)
Jaren George drives, Zach Carter stays with him. Jaren George attempts a Layup. Heavily contested by Zach Carter (1.0 feet, MAN)! JAREN GEORGE MAKES IT! Assist: Julius Green
Score: 10-12

[06:52] Team_021 possession (Score: 10-12)
Anthony Oladipo throws a bad pass! Stolen by Julius Green! TURNOVER! (live ball)

[06:36] Team_060 possession (Score: 10-12)
FOUL! Shooting foul on Zach Carter. Jaren George to the line for 2 free throws. [Team fouls: 2] (Zach Carter: 1 personal fouls)   FT 1/2: GOOD   FT 2/2: GOOD Jaren George makes 2/2 from the line.
Score: 12-12

[06:19] Team_021 possession (Score: 12-12)
Kyrie Leonard drives, Jaren George stays with him. Kyrie Leonard attempts a Dunk. Contested by Jaren George (4.8 feet, ZONE). KYRIE LEONARD MAKES IT! Assist: Kyrie Wagner
Score: 12-14

[06:05] Team_060 possession (Score: 12-14)
Julius Green attempts a Layup. Contested by Zach Carter (2.9 feet, ZONE). JULIUS GREEN MAKES IT!
Score: 14-14

[05:48] Team_021 possession (Score: 14-14)
Anthony Oladipo makes the Midrange and draws the foul on Julius Green! And-1! Anthony Oladipo to the line for 1. [Team fouls: 3] (Julius Green: 2 personal fouls)   FT 1/1: GOOD Anthony Oladipo makes 1/1 from the line.
Score: 14-17

[05:35] Team_060 possession (Score: 14-17)
Joel Morant attempts a 3Pt. Wide open! Kyrie Leonard is 6.4 feet away. [MAN] Joel Morant misses. Rebound secured by Anthony Oladipo.

[05:20] Team_021 possession (Score: 14-17)
Kyrie Leonard attempts a 3Pt. Heavily contested by Joel Morant (1.7 feet, ZONE)! Kyrie Leonard misses. Offensive rebound by Zach Carter! Zach Carter kicks it out.

[05:07] Team_021 possession (Score: 14-17)
Zach Carter drives and kicks out. Karl Bridges attempts a 3Pt. Heavily contested by Julius Green (1.5 feet, ZONE)! Karl Bridges misses. Rebound secured by Immanuel Ming.

[04:55] Team_060 possession (Score: 14-17)
Julius Green attempts a 3Pt. Contested by Kyrie Wagner (2.3 feet, ZONE). Julius Green misses. Rebound secured by Anthony Oladipo.

[04:37] Team_021 possession (Score: 14-17)
Anthony Oladipo makes the Dunk and draws the foul on Julius Green! And-1! Anthony Oladipo to the line for 1. [Team fouls: 4] (Julius Green: 3 personal fouls)   FT 1/1: GOOD Anthony Oladipo makes 1/1 from the line.
Score: 14-20

[04:24] Team_060 possession (Score: 14-20)
Joel Morant drives to the basket... Joel Morant loses the ball! Stripped by Kyrie Leonard! TURNOVER! (live ball)

[04:08] Team_021 possession (Score: 14-20)
Zach Carter drives, Jaren George stays with him. Zach Carter attempts a Layup. Contested by Jaren George (5.1 feet, ZONE). ZACH CARTER MAKES IT! Assist: Karl Bridges
Score: 14-22

[03:51] Team_060 possession (Score: 14-22)
FOUL! Shooting foul on Karl Bridges. Immanuel Ming to the line for 3 free throws. [Team fouls: 3] (Karl Bridges: 1 personal fouls)   FT 1/3: GOOD   FT 2/3: MISS   FT 3/3: GOOD Immanuel Ming makes 2/3 from the line.
Score: 16-22

[03:37] Team_021 possession (Score: 16-22)
Kyrie Wagner attempts a Midrange. Wide open! Julius Green is 6.1 feet away. [ZONE] KYRIE WAGNER MAKES IT! Assist: Kyrie Leonard
Score: 16-24

[03:21] Team_060 possession (Score: 16-24)
FOUL! Shooting foul on Kyrie Wagner. Jaren George to the line for 2 free throws. [Team fouls: 4] (Kyrie Wagner: 2 personal fouls)   FT 1/2: MISS   FT 2/2: GOOD Jaren George makes 1/2 from the line.
Score: 17-24

[03:03] Team_021 possession (Score: 17-24)
FOUL! Shooting foul on Julius Green. Karl Bridges to the line for 3 free throws. [BONUS: 5 team fouls] (Julius Green: 4 personal fouls)   FT 1/3: GOOD   FT 2/3: GOOD   FT 3/3: GOOD Karl Bridges makes 3/3 from the line.
Score: 17-27

[02:46] Team_060 possession (Score: 17-27)
Julius Green attempts a 3Pt. Contested by Kyrie Wagner (3.3 feet, ZONE). Julius Green misses. Rebound secured by Kyrie Leonard.

[02:30] Team_021 possession (Score: 17-27)
Karl Bridges attempts a Layup. Wide open! Larry Westbrook is 7.4 feet away. [ZONE] KARL BRIDGES MAKES IT! Assist: Kyrie Wagner
Score: 17-29

[02:16] Team_060 possession (Score: 17-29)
Larry Westbrook attempts a Layup. Heavily contested by Kyrie Wagner (1.6 feet, MAN)! LARRY WESTBROOK MAKES IT!
Score: 19-29

[02:01] Team_021 possession (Score: 19-29)
FOUL! Shooting foul on Julius Green. Zach Carter to the line for 2 free throws. [BONUS: 6 team fouls] (Julius Green: 5 personal fouls)   FT 1/2: GOOD   FT 2/2: GOOD Zach Carter makes 2/2 from the line.
Score: 19-31

[01:47] Team_060 possession (Score: 19-31)
Larry Westbrook throws a bad pass! Stolen by Kyrie Wagner! TURNOVER! (live ball)

[01:32] Team_021 possession (Score: 19-31)
Kyrie Wagner drives, Jaren George stays with him. Kyrie Wagner attempts a Layup. Contested by Jaren George (5.2 feet, ZONE). KYRIE WAGNER MAKES IT! Assist: Kyrie Leonard
Score: 19-33

[01:20] Team_060 possession (Score: 19-33)
Joel Morant attempts a Midrange. Contested by Karl Bridges (4.2 feet, ZONE). JOEL MORANT MAKES IT! Assist: Immanuel Ming
Score: 21-33

[01:02] Team_021 possession (Score: 21-33)
Kyrie Wagner attempts a 3Pt. Contested by Julius Green (5.5 feet, ZONE). Kyrie Wagner misses. Offensive rebound by Kyrie Leonard! Kyrie Leonard kicks it out.

[00:45] Team_021 possession (Score: 21-33)
Kyrie Leonard attempts a 3Pt. Contested by Julius Green (4.9 feet, ZONE). Kyrie Leonard misses. Rebound secured by Immanuel Ming.

[00:34] Team_060 possession (Score: 21-33)
Larry Westbrook drives, Kyrie Wagner stays with him. Larry Westbrook attempts a Layup. Contested by Kyrie Wagner (3.3 feet, MAN). LARRY WESTBROOK MAKES IT!
Score: 23-33

[00:18] Team_021 possession (Score: 23-33)
Zach Carter attempts a Layup. BLOCKED BY JAREN GEORGE! Ball deflects out of bounds off Zach Carter.

[00:08] Team_060 possession (Score: 23-33)
Immanuel Ming drives, Zach Carter stays with him. Immanuel Ming attempts a Dunk. Contested by Zach Carter (2.7 feet, ZONE). IMMANUEL MING MAKES IT! Assist: Jaren George
Score: 25-33

================================================================================
                              1ST QUARTER COMPLETE                              
================================================================================

1ST QUARTER SCORE: Team_060 25, Team_021 33

BOX SCORE:
================================================================================

Team_060
--------------------------------------------------------------------------------
Player                MIN  PTS  REB  AST  TO      FG   FG%      3P   3P%
--------------------------------------------------------------------------------
Larry Westbrook        12    7    2    0   0   3/5    60.0     0/0   0.0
Julius Green           12    7    0    2   0   3/6    50.0     0/0   0.0
Jaren George           12    5    0    2   0   3/3   100.0     0/0   0.0
Immanuel Ming          12    4    6    2   0   2/3    66.7     0/0   0.0
Joel Morant            12    2    0    0   0   1/2    50.0     0/0   0.0

TEAM: FG: 12/19 (63.2%), 3PT: 3/8 (37.5%), REB: 8 (4 off, 4 def), AST: 6, TO: 3
TEAM FOULS: 6 [Team_021 in BONUS]


Team_021
--------------------------------------------------------------------------------
Player                MIN  PTS  REB  AST  TO      FG   FG%      3P   3P%
--------------------------------------------------------------------------------
Anthony Oladipo        12   11    2    0   0   4/4   100.0     0/0   0.0
Karl Bridges           12    7    0    1   0   3/3   100.0     0/0   0.0
Zach Carter            12    6    4    0   0   3/6    50.0     0/0   0.0
Kyrie Leonard          12    5    3    3   0   2/4    50.0     0/0   0.0
Kyrie Wagner           12    4    0    3   0   2/2   100.0     0/0   0.0

TEAM: FG: 14/19 (73.7%), 3PT: 3/4 (75.0%), REB: 9 (2 off, 7 def), AST: 7, TO: 2
TEAM FOULS: 4

================================================================================

================================================================================
                       2ND QUARTER - Team_060 vs Team_021                       
================================================================================

[12:00] Team_060 possession (Score: 25-33)
Joel Morant attempts a Midrange. Contested by Kyrie Wagner (5.9 feet, ZONE). Joel Morant misses. Rebound secured by Zach Carter.

[11:46] Team_021 possession (Score: 25-33)
Karl Bridges drives, Jaren George stays with him. Karl Bridges attempts a Dunk. Wide open! Jaren George is 6.7 feet away. [ZONE] KARL BRIDGES MAKES IT!
Score: 25-35

[11:31] Team_060 possession (Score: 25-35)
Immanuel Ming drives and kicks out. Jaren George attempts a 3Pt. Contested by Zach Carter (4.4 feet, MAN). JAREN GEORGE MAKES IT! Assist: Immanuel Ming
Score: 28-35

[11:18] Team_021 possession (Score: 28-35)
Kyrie Leonard attempts a 3Pt. Contested by Julius Green (3.5 feet, ZONE). Kyrie Leonard misses. Rebound secured by Jaren George.

[11:04] Team_060 possession (Score: 28-35)
Immanuel Ming drives and kicks out. Jaren George attempts a Midrange. Contested by Zach Carter (5.9 feet, MAN). Jaren George misses. Rebound secured by Zach Carter.

[10:53] Team_021 possession (Score: 28-35)
Kyrie Leonard attempts a 3Pt. Contested by Joel Morant (4.0 feet, MAN). Kyrie Leonard misses. FOUL! Loose ball foul on Larry Westbrook during the rebound battle. [Team fouls: 1] No free throws, side out. (Larry Westbrook: 1 personal fouls)

[10:35] Team_021 possession (Score: 28-35)
Zach Carter attempts a 3Pt. Contested by Jaren George (4.0 feet, MAN). Zach Carter misses. Rebound secured by Larry Westbrook.

[10:25] Team_060 possession (Score: 28-35)
Julius Green drives and kicks out. Jaren George attempts a Midrange. Wide open! Karl Bridges is 6.2 feet away. [ZONE] Jaren George misses. Rebound secured by Kyrie Leonard.

[10:09] Team_021 possession (Score: 28-35)
Kyrie Leonard attempts a 3Pt. Contested by Immanuel Ming (2.9 feet, ZONE). KYRIE LEONARD MAKES IT! Assist: Kyrie Wagner
Score: 28-38

[09:57] Team_060 possession (Score: 28-38)
Joel Morant attempts a 3Pt. Contested by Kyrie Wagner (4.0 feet, ZONE). JOEL MORANT MAKES IT! Assist: Jaren George
Score: 31-38

[09:41] Team_021 possession (Score: 31-38)
Kyrie Leonard attempts a 3Pt. Wide open! Joel Morant is 6.1 feet away. [MAN] Kyrie Leonard misses. Offensive rebound by Zach Carter! Zach Carter kicks it out.

[09:23] Team_021 possession (Score: 31-38)
Kyrie Leonard drives and kicks out. Anthony Oladipo attempts a 3Pt. Heavily contested by Julius Green (0.8 feet, ZONE)! Anthony Oladipo misses. Rebound secured by Larry Westbrook.

[09:09] Team_060 possession (Score: 31-38)
Larry Westbrook drives to the basket... Larry Westbrook throws a bad pass out of bounds! TURNOVER! (dead ball)

[09:09] Substitution (Team_060): Joel Morant OUT → Domantas Barnes IN (stamina_rule2)

[09:09] Substitution (Team_060): Julius Green OUT → Rudy Ginobili IN (stamina_rule2)

[09:09] Substitution (Team_060): Immanuel Ming OUT → Jarrett Wagner IN (stamina_rule2)

[09:09] Substitution (Team_060): Larry Westbrook OUT → Yao Tatum IN (stamina_rule2)

[09:09] Substitution (Team_060): Jaren George OUT → Klay Haliburton IN (stamina_rule2)

[09:09] Substitution (Team_021): Kyrie Leonard OUT → Joel LaVine IN (stamina_rule2)

[09:09] Substitution (Team_021): Anthony Oladipo OUT → Victor Mitchell IN (stamina_rule2)

[09:09] Substitution (Team_021): Karl Bridges OUT → Paul Allen IN (stamina_rule2)

[09:09] Substitution (Team_021): Kyrie Wagner OUT → Vince George IN (stamina_rule2)

[09:09] Substitution (Team_021): Zach Carter OUT → Magic Ingram IN (stamina_rule2)

[08:55] Team_021 possession (Score: 31-38)
Joel LaVine makes the Layup and draws the foul on Domantas Barnes! And-1! Joel LaVine to the line for 1. [Team fouls: 2] (Domantas Barnes: 1 personal fouls)   FT 1/1: GOOD Joel LaVine makes 1/1 from the line.
Score: 31-41

[08:37] Team_060 possession (Score: 31-41)
Klay Haliburton attempts a 3Pt. Wide open! Joel LaVine is 8.2 feet away. [ZONE] Klay Haliburton misses. Offensive rebound by Klay Haliburton! Klay Haliburton's putback is no good. Rebound secured by Vince George.

[08:25] Team_021 possession (Score: 31-41)
Victor Mitchell attempts a 3Pt. Contested by Rudy Ginobili (5.1 feet, MAN). VICTOR MITCHELL MAKES IT! Assist: Joel LaVine
Score: 31-44

[08:11] Team_060 possession (Score: 31-44)
Klay Haliburton drives and kicks out. Jarrett Wagner attempts a 3Pt. Wide open! Victor Mitchell is 6.1 feet away. [ZONE] Jarrett Wagner misses. Rebound secured by Victor Mitchell.

[07:57] Team_021 possession (Score: 31-44)
FOUL! Reach-in foul on Klay Haliburton during the drive. [Team fouls: 3] No free throws, side out. (Klay Haliburton: 1 personal fouls)

[07:46] Team_021 possession (Score: 31-44)
FOUL! Holding foul on Yao Tatum. [Team fouls: 4] No free throws, side out. (Yao Tatum: 1 personal fouls)

[07:34] Team_021 possession (Score: 31-44)
Paul Allen attempts a 3Pt. Contested by Domantas Barnes (4.2 feet, ZONE). Paul Allen misses. FOUL! Loose ball foul on Rudy Ginobili during the rebound battle. [IN THE BONUS! 5 team fouls] Magic Ingram to the line for 2 free throws. (Rudy Ginobili: 1 personal fouls)   FT 1/2: GOOD   FT 2/2: MISS Magic Ingram makes 1/2 from the line. FOUL! Loose ball foul on Domantas Barnes during the free throw rebound! [IN THE BONUS! 6 team fouls] Magic Ingram to the line for 2 free throws. (Domantas Barnes: 2 personal fouls)   FT 1/2: GOOD   FT 2/2: GOOD Magic Ingram makes 2/2 from the line.
Score: 31-47

[07:23] Team_060 possession (Score: 31-47)
Klay Haliburton drives to the basket... Klay Haliburton throws a bad pass out of bounds! TURNOVER! (dead ball)

[07:09] Team_021 possession (Score: 31-47)
Joel LaVine throws a bad pass! Stolen by Domantas Barnes! TURNOVER! (live ball)

[06:57] Team_060 possession (Score: 31-47)
Yao Tatum drives, Vince George stays with him. Yao Tatum attempts a Layup. Contested by Vince George (4.2 feet, MAN). YAO TATUM MAKES IT! Assist: Rudy Ginobili
Score: 33-47

[06:43] Team_021 possession (Score: 33-47)
Vince George attempts a Midrange. Wide open! Rudy Ginobili is 7.5 feet away. [ZONE] Vince George misses. Rebound secured by Rudy Ginobili.

[06:27] Team_060 possession (Score: 33-47)
Klay Haliburton attempts a Layup. Contested by Magic Ingram (3.5 feet, ZONE). Klay Haliburton misses. Rebound secured by Magic Ingram.

[06:13] Team_021 possession (Score: 33-47)
Joel LaVine attempts a 3Pt. Contested by Domantas Barnes (4.4 feet, ZONE). Joel LaVine misses. Rebound secured by Klay Haliburton.

[05:56] Team_060 possession (Score: 33-47)
Domantas Barnes attempts a 3Pt. Contested by Vince George (2.9 feet, ZONE). DOMANTAS BARNES MAKES IT! Assist: Rudy Ginobili
Score: 36-47

[05:43] Team_021 possession (Score: 36-47)
FOUL! Shooting foul on Klay Haliburton. Magic Ingram to the line for 2 free throws. [BONUS: 7 team fouls] (Klay Haliburton: 2 personal fouls)   FT 1/2: GOOD   FT 2/2: GOOD Magic Ingram makes 2/2 from the line.
Score: 36-49

[05:23] Team_060 possession (Score: 36-49)
Klay Haliburton drives and kicks out. Domantas Barnes attempts a Midrange. Wide open! Joel LaVine is 7.2 feet away. [MAN] DOMANTAS BARNES MAKES IT! Assist: Klay Haliburton
Score: 38-49

[05:09] Team_021 possession (Score: 38-49)
Victor Mitchell attempts a Midrange. Contested by Rudy Ginobili (3.4 feet, MAN). Victor Mitchell misses. Offensive rebound by Vince George! Vince George kicks it out.

[04:54] Team_021 possession (Score: 38-49)
Victor Mitchell attempts a 3Pt. Heavily contested by Rudy Ginobili (1.9 feet, MAN)! Victor Mitchell misses. FOUL! Loose ball foul on Klay Haliburton during the rebound battle. [IN THE BONUS! 8 team fouls] Vince George to the line for 2 free throws. (Klay Haliburton: 3 personal fouls)   FT 1/2: GOOD   FT 2/2: GOOD Vince George makes 2/2 from the line.
Score: 38-51

[04:43] Team_060 possession (Score: 38-51)
FOUL! Shooting foul on Victor Mitchell. Rudy Ginobili to the line for 2 free throws. [Team fouls: 1] (Victor Mitchell: 1 personal fouls)   FT 1/2: GOOD   FT 2/2: GOOD Rudy Ginobili makes 2/2 from the line.
Score: 40-51

[04:31] Team_021 possession (Score: 40-51)
FOUL! Shooting foul on Yao Tatum. Vince George to the line for 2 free throws. [BONUS: 9 team fouls] (Yao Tatum: 2 personal fouls)   FT 1/2: GOOD   FT 2/2: GOOD Vince George makes 2/2 from the line.
Score: 40-53

[04:16] Team_060 possession (Score: 40-53)
Klay Haliburton drives and kicks out. Rudy Ginobili attempts a Midrange. Wide open! Victor Mitchell is 6.7 feet away. [MAN] RUDY GINOBILI MAKES IT!
Score: 42-53

[04:00] Team_021 possession (Score: 42-53)
Magic Ingram drives and kicks out. Paul Allen attempts a Midrange. Wide open! Jarrett Wagner is 7.3 feet away. [MAN] PAUL ALLEN MAKES IT!
Score: 42-55

[03:44] Team_060 possession (Score: 42-55)
Klay Haliburton makes the Layup and draws the foul on Magic Ingram! And-1! Klay Haliburton to the line for 1. [Team fouls: 2] (Magic Ingram: 1 personal fouls)   FT 1/1: MISS Klay Haliburton makes 0/1 from the line. Rebound secured by Magic Ingram.
Score: 44-55

[03:25] Team_021 possession (Score: 44-55)
Paul Allen drives and kicks out. Magic Ingram attempts a Midrange. Contested by Rudy Ginobili (4.4 feet, ZONE). Magic Ingram misses. Rebound secured by Rudy Ginobili.

[03:12] Team_060 possession (Score: 44-55)
Rudy Ginobili drives, picks up Vince George. Help arrives from Victor Mitchell! Rudy Ginobili attempts a Layup. Contested by Victor Mitchell (5.9 feet, ZONE). Rudy Ginobili misses. Rebound secured by Victor Mitchell.

[02:58] Team_021 possession (Score: 44-55)
Paul Allen attempts a Midrange. Contested by Jarrett Wagner (3.8 feet, MAN). PAUL ALLEN MAKES IT! Assist: Victor Mitchell
Score: 44-57

[02:42] Team_060 possession (Score: 44-57)
Jarrett Wagner attempts a Layup. Contested by Magic Ingram (3.2 feet, ZONE). JARRETT WAGNER MAKES IT! Assist: Klay Haliburton
Score: 46-57

[02:25] Team_021 possession (Score: 46-57)
Victor Mitchell attempts a 3Pt. Contested by Rudy Ginobili (3.7 feet, MAN). Victor Mitchell misses. Rebound secured by Rudy Ginobili.

[02:14] Team_060 possession (Score: 46-57)
Domantas Barnes drives to the basket... Domantas Barnes loses control! Ball rolls out of bounds! TURNOVER! (dead ball)

[01:57] Team_021 possession (Score: 46-57)
Vince George drives, Yao Tatum stays with him. Vince George attempts a Layup. Contested by Yao Tatum (4.9 feet, MAN). Vince George misses. FOUL! Loose ball foul on Klay Haliburton during the rebound battle. [IN THE BONUS! 10 team fouls] Vince George to the line for 2 free throws. (Klay Haliburton: 4 personal fouls)   FT 1/2: GOOD   FT 2/2: GOOD Vince George makes 2/2 from the line.
Score: 46-59

[01:41] Team_060 possession (Score: 46-59)
Rudy Ginobili attempts a Midrange. Contested by Victor Mitchell (4.5 feet, MAN). Rudy Ginobili misses. Rebound secured by Vince George.

[01:27] Team_021 possession (Score: 46-59)
Magic Ingram makes the Layup and draws the foul on Klay Haliburton! And-1! Magic Ingram to the line for 1. [BONUS: 11 team fouls] (Klay Haliburton: 5 personal fouls)   FT 1/1: GOOD Magic Ingram makes 1/1 from the line.
Score: 46-62

[01:10] Team_060 possession (Score: 46-62)
Yao Tatum drives to the basket... Yao Tatum loses control! Ball rolls out of bounds! TURNOVER! (dead ball)

[00:56] Team_021 possession (Score: 46-62)
Joel LaVine drives, Klay Haliburton stays with him. Joel LaVine attempts a Dunk. Contested by Klay Haliburton (5.1 feet, ZONE). Joel LaVine misses. Rebound secured by Rudy Ginobili.

[00:42] Team_060 possession (Score: 46-62)
Yao Tatum attempts a Midrange. Contested by Paul Allen (6.0 feet, ZONE). YAO TATUM MAKES IT!
Score: 48-62

[00:27] Team_021 possession (Score: 48-62)
Magic Ingram attempts a Layup. Contested by Klay Haliburton (4.3 feet, MAN). Magic Ingram misses. Rebound secured by Klay Haliburton.

[00:13] Team_060 possession (Score: 48-62)
Klay Haliburton attempts a Layup. Heavily contested by Magic Ingram (0.5 feet, ZONE)! Klay Haliburton misses. Rebound secured by Victor Mitchell.

================================================================================
                              2ND QUARTER COMPLETE                              
================================================================================

2ND QUARTER SCORE: Team_060 23, Team_021 29

BOX SCORE:
================================================================================

Team_060
--------------------------------------------------------------------------------
Player                MIN  PTS  REB  AST  TO      FG   FG%      3P   3P%
--------------------------------------------------------------------------------
Domantas Barnes         9    5    0    0   0   2/2   100.0     0/0   0.0
Yao Tatum               9    4    0    0   0   2/2   100.0     0/0   0.0
Rudy Ginobili           9    4    4    2   0   2/4    50.0     0/0   0.0
Joel Morant            15    3    0    0   0   1/2    50.0     0/0   0.0
Jaren George           15    3    1    1   0   1/1   100.0     0/0   0.0
Jarrett Wagner          9    2    0    0   0   1/1   100.0     0/0   0.0
Immanuel Ming          15    0    0    1   0   0/1     0.0     0/0   0.0
Larry Westbrook        15    0    2    0   0   0/0     0.0     0/0   0.0
Julius Green           15    0    0    0   0   0/1     0.0     0/0   0.0
Klay Haliburton         9    0    2    2   0   0/5     0.0     0/0   0.0

TEAM: FG: 9/19 (47.4%), 3PT: 2/3 (66.7%), REB: 10 (1 off, 9 def), AST: 6, TO: 4
TEAM FOULS: 11 [Team_021 in BONUS]


Team_021
--------------------------------------------------------------------------------
Player                MIN  PTS  REB  AST  TO      FG   FG%      3P   3P%
--------------------------------------------------------------------------------
Magic Ingram            9    8    2    0   0   3/4    75.0     0/0   0.0
Vince George            9    6    3    0   0   3/4    75.0     0/0   0.0
Paul Allen              9    4    0    0   0   2/3    66.7     0/0   0.0
Kyrie Leonard          15    3    2    0   0   1/3    33.3     0/0   0.0
Joel LaVine             9    3    0    1   0   1/3    33.3     0/0   0.0
Victor Mitchell         9    3    3    1   0   1/2    50.0     0/0   0.0
Karl Bridges           15    2    0    0   0   1/1   100.0     0/0   0.0
Zach Carter            15    0    3    0   0   0/1     0.0     0/0   0.0
Kyrie Wagner           15    0    0    1   0   0/0     0.0     0/0   0.0

TEAM: FG: 12/21 (57.1%), 3PT: 4/8 (50.0%), REB: 12 (3 off, 9 def), AST: 3, TO: 1
TEAM FOULS: 2

================================================================================

================================================================================
                       3RD QUARTER - Team_060 vs Team_021                       
================================================================================

[12:00] Team_060 possession (Score: 48-62)
FOUL! Shooting foul on Zach Carter. Jaren George to the line for 2 free throws. [Team fouls: 1] (Zach Carter: 1 personal fouls)   FT 1/2: GOOD   FT 2/2: GOOD Jaren George makes 2/2 from the line.
Score: 50-62

[11:43] Team_021 possession (Score: 50-62)
Anthony Oladipo attempts a 3Pt. Wide open! Julius Green is 7.0 feet away. [MAN] Anthony Oladipo misses. Rebound secured by Jaren George.

[11:29] Team_060 possession (Score: 50-62)
Jaren George attempts a Midrange. Contested by Zach Carter (2.1 feet, MAN). JAREN GEORGE MAKES IT! Assist: Larry Westbrook
Score: 52-62

[11:14] Team_021 possession (Score: 52-62)
Kyrie Wagner attempts a 3Pt. Contested by Larry Westbrook (5.0 feet, MAN). Kyrie Wagner misses. Rebound secured by Immanuel Ming.

[11:00] Team_060 possession (Score: 52-62)
Joel Morant attempts a 3Pt. Heavily contested by Kyrie Wagner (0.5 feet, ZONE)! JOEL MORANT MAKES IT!
Score: 55-62

[10:46] Team_021 possession (Score: 55-62)
Zach Carter drives and kicks out. Kyrie Leonard attempts a Midrange. Heavily contested by Joel Morant (0.5 feet, MAN)! Kyrie Leonard misses. Rebound secured by Jaren George.

[10:33] Team_060 possession (Score: 55-62)
Julius Green attempts a 3Pt. Contested by Kyrie Wagner (3.9 feet, ZONE). Julius Green misses. Offensive rebound by Jaren George! Jaren George's putback is no good. Rebound secured by Zach Carter.

[10:15] Team_021 possession (Score: 55-62)
Karl Bridges drives to the basket... Karl Bridges throws a bad pass out of bounds! TURNOVER! (dead ball)

[09:58] Team_060 possession (Score: 55-62)
Joel Morant attempts a Midrange. Heavily contested by Kyrie Leonard (1.3 feet, ZONE)! JOEL MORANT MAKES IT! Assist: Jaren George
Score: 57-62

[09:44] Team_021 possession (Score: 57-62)
Karl Bridges drives and kicks out. Kyrie Leonard attempts a 3Pt. Contested by Joel Morant (4.6 feet, MAN). KYRIE LEONARD MAKES IT! Assist: Kyrie Wagner
Score: 57-65

[09:26] Team_060 possession (Score: 57-65)
Immanuel Ming attempts a 3Pt. Wide open! Kyrie Leonard is 7.2 feet away. [ZONE] Immanuel Ming misses. Rebound secured by Zach Carter.

[09:17] Team_021 possession (Score: 57-65)
Anthony Oladipo attempts a Midrange. Wide open! Immanuel Ming is 7.2 feet away. [ZONE] ANTHONY OLADIPO MAKES IT!
Score: 57-67

[09:05] Team_060 possession (Score: 57-67)
Jaren George attempts a 3Pt. Contested by Kyrie Wagner (5.0 feet, ZONE). Jaren George misses. Rebound secured by Anthony Oladipo.

[08:47] Team_021 possession (Score: 57-67)
Zach Carter throws a bad pass! Stolen by Jaren George! TURNOVER! (live ball)

[08:33] Team_060 possession (Score: 57-67)
Immanuel Ming attempts a Midrange. Wide open! Karl Bridges is 6.3 feet away. [MAN] Immanuel Ming misses. Offensive rebound by Jaren George! Jaren George puts it back in!
Score: 59-67

[08:18] Team_021 possession (Score: 59-67)
Zach Carter attempts a Layup. Heavily contested by Jaren George (1.7 feet, MAN)! Zach Carter misses. Rebound secured by Jaren George.

[08:04] Team_060 possession (Score: 59-67)
Jaren George drives, picks up Zach Carter. Help arrives from Kyrie Leonard! Jaren George attempts a Dunk. Contested by Kyrie Leonard (3.1 feet, MAN). JAREN GEORGE MAKES IT!
Score: 61-67

[07:53] Team_021 possession (Score: 61-67)
Karl Bridges attempts a 3Pt. Contested by Julius Green (5.8 feet, ZONE). Karl Bridges misses. Rebound secured by Immanuel Ming.

[07:43] Team_060 possession (Score: 61-67)
Immanuel Ming makes the Layup and draws the foul on Karl Bridges! And-1! Immanuel Ming to the line for 1. [Team fouls: 2] (Karl Bridges: 1 personal fouls)   FT 1/1: GOOD Immanuel Ming makes 1/1 from the line.
Score: 64-67

[07:27] Team_021 possession (Score: 64-67)
Zach Carter drives and kicks out. Zach Carter attempts a 3Pt. Contested by Jaren George (3.8 feet, MAN). Zach Carter misses. Rebound secured by Larry Westbrook.

[07:10] Team_060 possession (Score: 64-67)
Joel Morant throws a bad pass out of bounds! TURNOVER! (dead ball)

[06:56] Team_021 possession (Score: 64-67)
Kyrie Leonard attempts a Layup. Contested by Jaren George (3.3 feet, ZONE). KYRIE LEONARD MAKES IT! Assist: Zach Carter
Score: 64-69

[06:37] Team_060 possession (Score: 64-69)
Larry Westbrook attempts a 3Pt. Wide open! Kyrie Wagner is 6.1 feet away. [MAN] Larry Westbrook misses. Rebound secured by Anthony Oladipo.

[06:24] Team_021 possession (Score: 64-69)
Kyrie Leonard attempts a 3Pt. Wide open! Joel Morant is 6.6 feet away. [MAN] Kyrie Leonard misses. Rebound secured by Jaren George.

[06:13] Team_060 possession (Score: 64-69)
Joel Morant drives to the basket... Joel Morant throws a bad pass! Stolen by Zach Carter! TURNOVER! (live ball)

[05:59] Team_021 possession (Score: 64-69)
Anthony Oladipo drives, Julius Green stays with him. Anthony Oladipo attempts a Layup. Heavily contested by Julius Green (1.8 feet, MAN)! Anthony Oladipo misses. Offensive rebound by Zach Carter! Zach Carter kicks it out.

[05:41] Team_021 possession (Score: 64-69)
Zach Carter makes the Layup and draws the foul on Larry Westbrook! And-1! Zach Carter to the line for 1. [Team fouls: 1] (Larry Westbrook: 1 personal fouls)   FT 1/1: GOOD Zach Carter makes 1/1 from the line.
Score: 64-72

[05:26] Team_060 possession (Score: 64-72)
Immanuel Ming loses control! Ball rolls out of bounds! TURNOVER! (dead ball)

[05:15] Team_021 possession (Score: 64-72)
Anthony Oladipo drives, Julius Green stays with him. Anthony Oladipo attempts a Dunk. Contested by Julius Green (2.7 feet, MAN). Anthony Oladipo misses. Rebound secured by Immanuel Ming.

[05:01] Team_060 possession (Score: 64-72)
Jaren George attempts a Layup. Contested by Zach Carter (3.2 feet, ZONE). Jaren George misses. Rebound secured by Kyrie Leonard.

[04:43] Team_021 possession (Score: 64-72)
Anthony Oladipo attempts a Layup. BLOCKED BY JAREN GEORGE! Ball is loose! Rebound secured by Larry Westbrook.

[04:28] Team_060 possession (Score: 64-72)
FOUL! Holding foul on Kyrie Leonard. [Team fouls: 3] No free throws, side out. (Kyrie Leonard: 1 personal fouls)

[04:12] Team_060 possession (Score: 64-72)
Immanuel Ming drives and kicks out. Jaren George attempts a 3Pt. Contested by Kyrie Wagner (3.3 feet, ZONE). JAREN GEORGE MAKES IT! Assist: Immanuel Ming
Score: 67-72

[03:59] Team_021 possession (Score: 67-72)
Karl Bridges attempts a 3Pt. Contested by Julius Green (2.0 feet, ZONE). Karl Bridges misses. Rebound secured by Larry Westbrook.

[03:40] Team_060 possession (Score: 67-72)
Julius Green attempts a 3Pt. Contested by Anthony Oladipo (2.5 feet, MAN). Julius Green misses. Rebound secured by Kyrie Leonard.

[03:27] Team_021 possession (Score: 67-72)
Zach Carter attempts a 3Pt. Wide open! Julius Green is 6.9 feet away. [ZONE] Zach Carter misses. Rebound secured by Larry Westbrook.

[03:13] Team_060 possession (Score: 67-72)
Joel Morant makes the 3Pt and draws the foul on Kyrie Leonard! And-1! Joel Morant to the line for 1. [Team fouls: 4] (Kyrie Leonard: 2 personal fouls)   FT 1/1: GOOD Joel Morant makes 1/1 from the line.
Score: 71-72

[02:58] Team_021 possession (Score: 71-72)
Zach Carter drives, Jaren George stays with him. Zach Carter attempts a Dunk. Contested by Jaren George (5.9 feet, ZONE). ZACH CARTER MAKES IT!
Score: 71-74

[02:41] Team_060 possession (Score: 71-74)
Immanuel Ming attempts a 3Pt. Contested by Kyrie Wagner (2.5 feet, ZONE). Immanuel Ming misses. Rebound secured by Zach Carter.

[02:28] Team_021 possession (Score: 71-74)
Anthony Oladipo attempts a 3Pt. Wide open! Julius Green is 6.3 feet away. [ZONE] Anthony Oladipo misses. Rebound secured by Larry Westbrook.

[02:15] Team_060 possession (Score: 71-74)
Joel Morant attempts a Midrange. Wide open! Kyrie Leonard is 7.7 feet away. [MAN] JOEL MORANT MAKES IT! Assist: Larry Westbrook
Score: 73-74

[01:57] Team_021 possession (Score: 73-74)
Karl Bridges attempts a 3Pt. Contested by Julius Green (5.5 feet, ZONE). Karl Bridges misses. Rebound secured by Larry Westbrook.

[01:41] Team_060 possession (Score: 73-74)
Larry Westbrook drives to the basket... Larry Westbrook loses the ball! Stripped by Kyrie Wagner! TURNOVER! (live ball)

[01:29] Team_021 possession (Score: 73-74)
FOUL! Offensive foul on Kyrie Wagner! Larry Westbrook drew the charge! [Team fouls: 5] (Kyrie Wagner: 1 personal fouls) TURNOVER! (dead ball)

[01:15] Team_060 possession (Score: 73-74)
Immanuel Ming attempts a 3Pt. Wide open! Karl Bridges is 8.3 feet away. [MAN] IMMANUEL MING MAKES IT!
Score: 76-74

[01:05] Team_021 possession (Score: 76-74)
Anthony Oladipo attempts a 3Pt. Contested by Julius Green (4.1 feet, ZONE). ANTHONY OLADIPO MAKES IT! Assist: Karl Bridges
Score: 76-77

[00:47] Team_060 possession (Score: 76-77)
Larry Westbrook attempts a 3Pt. Contested by Kyrie Wagner (3.9 feet, MAN). Larry Westbrook misses. Rebound secured by Kyrie Leonard.

[00:30] Team_021 possession (Score: 76-77)
Anthony Oladipo drives to the basket... Anthony Oladipo loses control! Ball rolls out of bounds! TURNOVER! (dead ball)

[00:30] Substitution (Team_060): Joel Morant OUT → Domantas Barnes IN (stamina_rule2)

[00:30] Substitution (Team_060): Julius Green OUT → Rudy Ginobili IN (stamina_rule2)

[00:30] Substitution (Team_060): Immanuel Ming OUT → Jarrett Wagner IN (stamina_rule2)

[00:30] Substitution (Team_060): Larry Westbrook OUT → Yao Tatum IN (stamina_rule2)

[00:30] Substitution (Team_060): Jaren George OUT → Klay Haliburton IN (stamina_rule2)

[00:30] Substitution (Team_021): Kyrie Leonard OUT → Joel LaVine IN (stamina_rule2)

[00:30] Substitution (Team_021): Anthony Oladipo OUT → Victor Mitchell IN (stamina_rule2)

[00:30] Substitution (Team_021): Karl Bridges OUT → Paul Allen IN (stamina_rule2)

[00:30] Substitution (Team_021): Kyrie Wagner OUT → Vince George IN (stamina_rule2)

[00:30] Substitution (Team_021): Zach Carter OUT → Magic Ingram IN (stamina_rule2)

[00:15] Team_060 possession (Score: 76-77)
FOUL! Reach-in foul on Magic Ingram during the drive. [IN THE BONUS! 6 team fouls] Domantas Barnes to the line for 2 free throws. (Magic Ingram: 1 personal fouls)   FT 1/2: GOOD   FT 2/2: GOOD Domantas Barnes makes 2/2 from the line.
Score: 78-77

================================================================================
                              3RD QUARTER COMPLETE                              
================================================================================

3RD QUARTER SCORE: Team_060 30, Team_021 15

BOX SCORE:
================================================================================

Team_060
--------------------------------------------------------------------------------
Player                MIN  PTS  REB  AST  TO      FG   FG%      3P   3P%
--------------------------------------------------------------------------------
Jaren George           27   11    5    1   0   5/7    71.4     0/0   0.0
Joel Morant            27   11    0    0   0   4/4   100.0     0/0   0.0
Immanuel Ming          27    6    3    1   0   2/4    50.0     0/0   0.0
Domantas Barnes         9    2    0    0   0   1/1   100.0     0/0   0.0
Larry Westbrook        27    0    6    2   0   0/2     0.0     0/0   0.0
Julius Green           27    0    0    0   0   0/2     0.0     0/0   0.0

TEAM: FG: 12/20 (60.0%), 3PT: 3/10 (30.0%), REB: 15 (2 off, 13 def), AST: 4, TO: 4
TEAM FOULS: 1


Team_021
--------------------------------------------------------------------------------
Player                MIN  PTS  REB  AST  TO      FG   FG%      3P   3P%
--------------------------------------------------------------------------------
Anthony Oladipo        27    5    2    0   0   2/6    33.3     0/0   0.0
Zach Carter            27    5    4    1   0   2/6    33.3     0/0   0.0
Kyrie Leonard          27    5    3    0   0   2/3    66.7     0/0   0.0
Kyrie Wagner           27    0    0    1   0   0/1     0.0     0/0   0.0
Karl Bridges           27    0    0    1   0   0/3     0.0     0/0   0.0

TEAM: FG: 6/19 (31.6%), 3PT: 1/9 (11.1%), REB: 8 (1 off, 7 def), AST: 3, TO: 4
TEAM FOULS: 6 [Team_060 in BONUS]

================================================================================

================================================================================
                       4TH QUARTER - Team_060 vs Team_021                       
================================================================================

[12:00] Team_060 possession (Score: 78-77)
FOUL! Holding foul on Anthony Oladipo. [Team fouls: 1] No free throws, side out. (Anthony Oladipo: 1 personal fouls)

[11:45] Team_060 possession (Score: 78-77)
FOUL! Shooting foul on Karl Bridges. Immanuel Ming to the line for 2 free throws. [Team fouls: 2] (Karl Bridges: 1 personal fouls)   FT 1/2: GOOD   FT 2/2: GOOD Immanuel Ming makes 2/2 from the line.
Score: 80-77

[11:34] Team_021 possession (Score: 80-77)
Kyrie Wagner attempts a Midrange. Heavily contested by Julius Green (1.4 feet, ZONE)! KYRIE WAGNER MAKES IT!
Score: 80-79

[11:17] Team_060 possession (Score: 80-79)
Larry Westbrook throws a bad pass out of bounds! TURNOVER! (dead ball)

[11:17] Substitution (Team_060): Joel Morant OUT → Domantas Barnes IN (stamina_rule2)

[11:17] Substitution (Team_060): Julius Green OUT → Rudy Ginobili IN (stamina_rule2)

[11:17] Substitution (Team_060): Larry Westbrook OUT → Yao Tatum IN (stamina_rule2)

[11:17] Substitution (Team_060): Jaren George OUT → Klay Haliburton IN (stamina_rule2)

[11:17] Substitution (Team_021): Kyrie Leonard OUT → Joel LaVine IN (stamina_rule2)

[11:17] Substitution (Team_021): Anthony Oladipo OUT → Victor Mitchell IN (stamina_rule2)

[11:17] Substitution (Team_021): Karl Bridges OUT → Paul Allen IN (stamina_rule2)

[11:17] Substitution (Team_021): Kyrie Wagner OUT → Vince George IN (stamina_rule2)

[11:17] Substitution (Team_021): Zach Carter OUT → Magic Ingram IN (stamina_rule2)

[11:06] Team_021 possession (Score: 80-79)
Vince George attempts a Layup. Contested by Yao Tatum (3.2 feet, MAN). VINCE GEORGE MAKES IT! Assist: Magic Ingram
Score: 80-81

[10:50] Team_060 possession (Score: 80-81)
Immanuel Ming attempts a Midrange. Contested by Paul Allen (3.7 feet, MAN). IMMANUEL MING MAKES IT! Assist: Domantas Barnes
Score: 82-81

[10:37] Team_021 possession (Score: 82-81)
Victor Mitchell attempts a 3Pt. Contested by Rudy Ginobili (4.7 feet, MAN). VICTOR MITCHELL MAKES IT! Assist: Joel LaVine
Score: 82-84

[10:19] Team_060 possession (Score: 82-84)
Rudy Ginobili attempts a 3Pt. Contested by Victor Mitchell (4.7 feet, ZONE). Rudy Ginobili misses. Rebound secured by Magic Ingram.

[10:06] Team_021 possession (Score: 82-84)
Paul Allen attempts a 3Pt. Wide open! Immanuel Ming is 8.2 feet away. [MAN] PAUL ALLEN MAKES IT! Assist: Victor Mitchell
Score: 82-87

[09:56] Team_060 possession (Score: 82-87)
Immanuel Ming throws a bad pass! Stolen by Paul Allen! TURNOVER! (live ball)

[09:42] Team_021 possession (Score: 82-87)
Vince George attempts a 3Pt. Wide open! Yao Tatum is 6.5 feet away. [MAN] Vince George misses. Rebound secured by Immanuel Ming.

[09:27] Team_060 possession (Score: 82-87)
Immanuel Ming attempts a 3Pt. Heavily contested by Victor Mitchell (1.3 feet, ZONE)! Immanuel Ming misses. Offensive rebound by Klay Haliburton! Klay Haliburton's putback is no good. Offensive rebound by Klay Haliburton! Klay Haliburton kicks it out.

[09:09] Team_060 possession (Score: 82-87)
Yao Tatum attempts a Layup. Contested by Vince George (2.6 feet, MAN). YAO TATUM MAKES IT!
Score: 84-87

[08:55] Team_021 possession (Score: 84-87)
Victor Mitchell drives and kicks out. Victor Mitchell attempts a 3Pt. Wide open! Domantas Barnes is 7.2 feet away. [ZONE] VICTOR MITCHELL MAKES IT! Assist: Magic Ingram
Score: 84-90

[08:42] Team_060 possession (Score: 84-90)
Rudy Ginobili attempts a 3Pt. Contested by Victor Mitchell (5.7 feet, MAN). RUDY GINOBILI MAKES IT! Assist: Klay Haliburton
Score: 87-90

[08:29] Team_021 possession (Score: 87-90)
Vince George attempts a 3Pt. Wide open! Domantas Barnes is 6.3 feet away. [ZONE] Vince George misses. Rebound secured by Immanuel Ming.

[08:13] Team_060 possession (Score: 87-90)
Klay Haliburton attempts a Midrange. Contested by Magic Ingram (5.8 feet, MAN). Klay Haliburton misses. Offensive rebound by Klay Haliburton! Klay Haliburton puts it back in!
Score: 89-90

[08:00] Team_021 possession (Score: 89-90)
FOUL! Offensive foul on Joel LaVine! Domantas Barnes drew the charge! [Team fouls: 3] (Joel LaVine: 1 personal fouls) TURNOVER! (dead ball)

[07:49] Team_060 possession (Score: 89-90)
Yao Tatum makes the Midrange and draws the foul on Vince George! And-1! Yao Tatum to the line for 1. [Team fouls: 4] (Vince George: 1 personal fouls)   FT 1/1: GOOD Yao Tatum makes 1/1 from the line.
Score: 92-90

[07:32] Team_021 possession (Score: 92-90)
Paul Allen attempts a 3Pt. Contested by Immanuel Ming (2.8 feet, MAN). PAUL ALLEN MAKES IT! Assist: Vince George
Score: 92-93

[07:21] Team_060 possession (Score: 92-93)
Rudy Ginobili attempts a Midrange. Wide open! Victor Mitchell is 6.3 feet away. [MAN] RUDY GINOBILI MAKES IT!
Score: 94-93

[07:04] Team_021 possession (Score: 94-93)
Magic Ingram attempts a Midrange. Wide open! Domantas Barnes is 6.6 feet away. [ZONE] MAGIC INGRAM MAKES IT! Assist: Vince George
Score: 94-95

[06:52] Team_060 possession (Score: 94-95)
Rudy Ginobili attempts a 3Pt. Wide open! Victor Mitchell is 8.2 feet away. [MAN] Rudy Ginobili misses. Rebound secured by Victor Mitchell.

[06:36] Team_021 possession (Score: 94-95)
Paul Allen attempts a 3Pt. Contested by Immanuel Ming (4.6 feet, ZONE). Paul Allen misses. Rebound secured by Immanuel Ming.

[06:19] Team_060 possession (Score: 94-95)
Domantas Barnes attempts a 3Pt. Contested by Vince George (5.6 feet, ZONE). DOMANTAS BARNES MAKES IT! Assist: Klay Haliburton
Score: 97-95

[06:06] Team_021 possession (Score: 97-95)
Vince George attempts a 3Pt. Contested by Domantas Barnes (3.4 feet, ZONE). VINCE GEORGE MAKES IT!
Score: 97-98

[05:54] Team_060 possession (Score: 97-98)
Domantas Barnes attempts a Midrange. Wide open! Joel LaVine is 7.2 feet away. [MAN] DOMANTAS BARNES MAKES IT!
Score: 99-98

[05:39] Team_021 possession (Score: 99-98)
Paul Allen attempts a 3Pt. Contested by Immanuel Ming (3.3 feet, MAN). Paul Allen misses. Rebound secured by Klay Haliburton.

[05:24] Team_060 possession (Score: 99-98)
Rudy Ginobili attempts a 3Pt. Contested by Victor Mitchell (3.2 feet, MAN). Rudy Ginobili misses. Rebound secured by Magic Ingram.

[05:07] Team_021 possession (Score: 99-98)
Joel LaVine attempts a 3Pt. Contested by Domantas Barnes (5.4 feet, ZONE). Joel LaVine misses. Rebound secured by Klay Haliburton.

[04:55] Team_060 possession (Score: 99-98)
Rudy Ginobili drives, picks up Magic Ingram. Help arrives from Victor Mitchell! Rudy Ginobili attempts a Layup. Heavily contested by Victor Mitchell (1.0 feet, ZONE)! Rudy Ginobili misses. Offensive rebound by Klay Haliburton! Klay Haliburton puts it back in!
Score: 101-98

[04:40] Team_021 possession (Score: 101-98)
Vince George loses control! Ball rolls out of bounds! TURNOVER! (dead ball)

[04:40] Substitution (Team_060): Immanuel Ming OUT → Jarrett Wagner IN (stamina_rule2)

[04:25] Team_060 possession (Score: 101-98)
Yao Tatum makes the Layup and draws the foul on Vince George! And-1! Yao Tatum to the line for 1. [BONUS: 5 team fouls] (Vince George: 2 personal fouls)   FT 1/1: GOOD Yao Tatum makes 1/1 from the line.
Score: 104-98

[04:11] Team_021 possession (Score: 104-98)
FOUL! Reach-in foul on Klay Haliburton during the drive. [Team fouls: 1] No free throws, side out. (Klay Haliburton: 1 personal fouls)

[03:54] Team_021 possession (Score: 104-98)
Paul Allen attempts a 3Pt. Wide open! Domantas Barnes is 6.9 feet away. [ZONE] Paul Allen misses. Rebound secured by Klay Haliburton.

[03:35] Team_060 possession (Score: 104-98)
Yao Tatum attempts a Midrange. Contested by Vince George (2.7 feet, MAN). YAO TATUM MAKES IT!
Score: 106-98

[03:26] Team_021 possession (Score: 106-98)
Paul Allen drives, Jarrett Wagner stays with him. Paul Allen attempts a Dunk. Contested by Jarrett Wagner (4.9 feet, MAN). PAUL ALLEN MAKES IT!
Score: 106-100

[03:13] Team_060 possession (Score: 106-100)
Klay Haliburton attempts a 3Pt. Contested by Victor Mitchell (5.4 feet, ZONE). KLAY HALIBURTON MAKES IT! Assist: Yao Tatum
Score: 109-100

[03:00] Team_021 possession (Score: 109-100)
Magic Ingram drives and kicks out. Vince George attempts a 3Pt. Contested by Yao Tatum (4.9 feet, MAN). Vince George misses. Rebound secured by Rudy Ginobili.

[02:48] Team_060 possession (Score: 109-100)
FOUL! Shooting foul on Victor Mitchell. Jarrett Wagner to the line for 3 free throws. [BONUS: 6 team fouls] (Victor Mitchell: 1 personal fouls)   FT 1/3: GOOD   FT 2/3: MISS   FT 3/3: GOOD Jarrett Wagner makes 2/3 from the line.
Score: 111-100

[02:30] Team_021 possession (Score: 111-100)
Magic Ingram attempts a Midrange. Wide open! Yao Tatum is 7.7 feet away. [ZONE] Magic Ingram misses. Rebound secured by Domantas Barnes.

[02:16] Team_060 possession (Score: 111-100)
Klay Haliburton attempts a 3Pt. Contested by Victor Mitchell (3.7 feet, ZONE). Klay Haliburton misses. Rebound secured by Vince George.

[02:02] Team_021 possession (Score: 111-100)
FOUL! Shooting foul on Yao Tatum. Vince George to the line for 2 free throws. [Team fouls: 2] (Yao Tatum: 1 personal fouls)   FT 1/2: GOOD   FT 2/2: GOOD Vince George makes 2/2 from the line.
Score: 111-102

[01:47] Team_060 possession (Score: 111-102)
Yao Tatum attempts a 3Pt. Contested by Victor Mitchell (3.0 feet, ZONE). Yao Tatum misses. Rebound secured by Victor Mitchell.

[01:30] Team_021 possession (Score: 111-102)
Joel LaVine attempts a Layup. Heavily contested by Klay Haliburton (1.5 feet, ZONE)! JOEL LAVINE MAKES IT! Assist: Paul Allen
Score: 111-104

[01:15] Team_060 possession (Score: 111-104)
Domantas Barnes attempts a Layup. Contested by Magic Ingram (2.5 feet, ZONE). DOMANTAS BARNES MAKES IT!
Score: 113-104

[01:04] Team_021 possession (Score: 113-104)
Joel LaVine attempts a Midrange. Contested by Domantas Barnes (5.4 feet, MAN). JOEL LAVINE MAKES IT! Assist: Victor Mitchell
Score: 113-106

[00:48] Team_060 possession (Score: 113-106)
Rudy Ginobili drives, Victor Mitchell stays with him. Rudy Ginobili attempts a Dunk. Contested by Victor Mitchell (2.4 feet, MAN). RUDY GINOBILI MAKES IT!
Score: 115-106

[00:31] Team_021 possession (Score: 115-106)
Joel LaVine attempts a 3Pt. Wide open! Domantas Barnes is 8.7 feet away. [ZONE] Joel LaVine misses. Offensive rebound by Vince George! Vince George kicks it out.

[00:14] Team_021 possession (Score: 115-106)
Victor Mitchell attempts a Midrange. Contested by Rudy Ginobili (4.8 feet, ZONE). Victor Mitchell misses. Rebound secured by Klay Haliburton.

================================================================================
                              4TH QUARTER COMPLETE                              
================================================================================

4TH QUARTER SCORE: Team_060 37, Team_021 29

BOX SCORE:
================================================================================

Team_060
--------------------------------------------------------------------------------
Player                MIN  PTS  REB  AST  TO      FG   FG%      3P   3P%
--------------------------------------------------------------------------------
Yao Tatum              20   10    0    1   0   4/5    80.0     0/0   0.0
Domantas Barnes        20    7    1    1   0   3/3   100.0     0/0   0.0
Rudy Ginobili          20    7    1    0   0   3/6    50.0     0/0   0.0
Klay Haliburton        20    7    7    2   0   3/4    75.0     0/0   0.0
Immanuel Ming          35    4    3    0   0   2/2   100.0     0/0   0.0
Jarrett Wagner         14    2    0    0   0   1/1   100.0     0/0   0.0

TEAM: FG: 16/21 (76.2%), 3PT: 4/9 (44.4%), REB: 12 (3 off, 9 def), AST: 4, TO: 2
TEAM FOULS: 2


Team_021
--------------------------------------------------------------------------------
Player                MIN  PTS  REB  AST  TO      FG   FG%      3P   3P%
--------------------------------------------------------------------------------
Paul Allen             20    8    0    1   0   3/6    50.0     0/0   0.0
Vince George           20    7    2    2   0   3/5    60.0     0/0   0.0
Victor Mitchell        20    6    2    2   0   2/3    66.7     0/0   0.0
Joel LaVine            20    4    0    1   0   2/3    66.7     0/0   0.0
Kyrie Wagner           28    2    0    0   0   1/1   100.0     0/0   0.0
Magic Ingram           20    2    2    2   0   1/3    33.3     0/0   0.0

TEAM: FG: 12/21 (57.1%), 3PT: 4/10 (40.0%), REB: 6 (1 off, 5 def), AST: 8, TO: 2
TEAM FOULS: 6 [Team_060 in BONUS]

================================================================================

================================================================================
                               FULL GAME COMPLETE                               
================================================================================

FINAL SCORE: Team_060 115, Team_021 106

SCORING BY QUARTER:
--------------------------------------------------------------------------------
Team                     Q1     Q2     Q3     Q4    FINAL
--------------------------------------------------------------------------------
Team_060                 25     23     30     37      115
Team_021                 33     29     15     29      106
--------------------------------------------------------------------------------

FULL GAME BOX SCORE:
================================================================================

Team_060
--------------------------------------------------------------------------------
Player                MIN  PTS  REB  AST  TO      FG   FG%      3P   3P%      FT STL BLK
--------------------------------------------------------------------------------
Immanuel Ming          35   14   12    4   3   9/13   69.2   2/4    50.0   5/6     0   0
Joel Morant            28   16    0    0   2   6/8    75.0   3/4    75.0   1/1     0   0
Julius Green           28    7    0    2   2   3/9    33.3   1/6    16.7   0/0     2   0
Larry Westbrook        28    7   10    2   3   3/7    42.9   1/4    25.0   0/0     0   0
Jaren George           28   19    6    4   0   6/8    75.0   0/1     0.0   5/6     1   3
Domantas Barnes        20   14    1    1   2   5/5   100.0   2/2   100.0   2/2     1   0
Rudy Ginobili          20   11    5    2   0   5/10   50.0   1/4    25.0   2/2     0   0
Yao Tatum              20   14    0    1   0   6/7    85.7   0/1     0.0   2/2     0   0
Klay Haliburton        20    7    9    4   0   4/10   40.0   1/3    33.3   0/1     0   0
Jarrett Wagner         14    4    0    0   1   2/2   100.0   1/1   100.0   2/3     0   0

TEAM: FG: 49/79 (62.0%), 3PT: 12/30 (40.0%), REB: 45 (10 off, 35 def), AST: 20, TO: 13


Team_021
--------------------------------------------------------------------------------
Player                MIN  PTS  REB  AST  TO      FG   FG%      3P   3P%      FT STL BLK
--------------------------------------------------------------------------------
Kyrie Leonard          28   13    8    3   0   4/9    44.4   2/5    40.0   0/0     1   0
Anthony Oladipo        28   16    4    0   4   6/10   60.0   2/4    50.0   4/4     0   0
Karl Bridges           28    9    0    2   0   5/8    62.5   1/4    25.0   3/3     0   0
Kyrie Wagner           28    6    0    5   1   3/4    75.0   0/1     0.0   0/0     2   0
Zach Carter            28   11   11    1   1   5/13   38.5   0/2     0.0   3/3     1   0
Joel LaVine            20    7    0    2   2   3/6    50.0   0/2     0.0   1/1     0   0
Victor Mitchell        20    9    5    3   0   4/6    66.7   3/4    75.0   0/0     0   0
Paul Allen             20   12    0    1   0   5/9    55.6   3/6    50.0   0/0     1   0
Vince George           20   13    5    2   1   5/8    62.5   1/3    33.3   8/8     0   0
Magic Ingram           20   10    4    2   0   4/7    57.1   0/0     0.0   4/5     0   0

TEAM: FG: 44/80 (55.0%), 3PT: 12/31 (38.7%), REB: 35 (7 off, 28 def), AST: 21, TO: 9

================================================================================
