================================================================================
                        FULL GAME - Team_097 vs Team_089                        
================================================================================

================================================================================
                       1ST QUARTER - Team_097 vs Team_089                       
================================================================================

[12:00] Team_097 possession (Score: 0-0)
Tyrese Stewart attempts a Layup. Contested by Terry Simmons (3.6 feet, ZONE). TYRESE STEWART MAKES IT!
Score: 2-0

[11:45] Team_089 possession (Score: 2-0)
Allen Mobley attempts a 3Pt. Contested by Shai Poole (3.1 feet, ZONE). Allen Mobley misses. Rebound secured by Anthony Haliburton.

[11:32] Team_097 possession (Score: 2-0)
Evan Brogdon attempts a Midrange. Wide open! Jordan Brogdon is 6.6 feet away. [MAN] Evan Brogdon misses. Rebound secured by Rudy Smith.

[11:17] Team_089 possession (Score: 2-0)
FOUL! Reach-in foul on Evan Brogdon during the drive. [Team fouls: 1] No free throws, side out. (Evan Brogdon: 1 personal fouls)

[10:59] Team_089 possession (Score: 2-0)
Jalen Jackson attempts a 3Pt. Contested by Jrue Haliburton (3.7 feet, MAN). Jalen Jackson misses. Rebound secured by Shai Poole.

[10:45] Team_097 possession (Score: 2-0)
Jrue Haliburton drives and kicks out. FOUL! Shooting foul on Terry Simmons. Tyrese Stewart to the line for 2 free throws. [Team fouls: 1] (Terry Simmons: 1 personal fouls)   FT 1/2: MISS   FT 2/2: GOOD Tyrese Stewart makes 1/2 from the line.
Score: 3-0

[10:33] Team_089 possession (Score: 3-0)
Allen Mobley drives, Shai Poole stays with him. Allen Mobley attempts a Dunk. Heavily contested by Shai Poole (0.5 feet, MAN)! Allen Mobley misses. Rebound secured by Shai Poole.

[10:16] Team_097 possession (Score: 3-0)
Tyrese Stewart drives and kicks out. Jrue Haliburton attempts a 3Pt. Contested by Jordan Brogdon (4.4 feet, ZONE). Jrue Haliburton misses. Rebound secured by Rudy Smith.

[10:02] Team_089 possession (Score: 3-0)
Terry Simmons drives, Anthony Haliburton stays with him. Terry Simmons attempts a Layup. Contested by Anthony Haliburton (4.7 feet, ZONE). TERRY SIMMONS MAKES IT!
Score: 3-2

[09:47] Team_097 possession (Score: 3-2)
FOUL! Reach-in foul on Terry Simmons during the drive. [Team fouls: 2] No free throws, side out. (Terry Simmons: 2 personal fouls)

[09:33] Team_097 possession (Score: 3-2)
FOUL! Holding foul on Rudy Smith. [Team fouls: 3] No free throws, side out. (Rudy Smith: 1 personal fouls)

[09:16] Team_097 possession (Score: 3-2)
Anthony Haliburton attempts a Midrange. Contested by Rudy Smith (4.4 feet, ZONE). Anthony Haliburton misses. Offensive rebound by Anthony Haliburton! Anthony Haliburton puts it back in!
Score: 5-2

[09:03] Team_089 possession (Score: 5-2)
Jordan Brogdon attempts a 3Pt. Contested by Shai Poole (4.9 feet, ZONE). Jordan Brogdon misses. Rebound secured by Tyrese Stewart.

[08:53] Team_097 possession (Score: 5-2)
FOUL! Holding foul on Rudy Smith. [Team fouls: 4] No free throws, side out. (Rudy Smith: 2 personal fouls)

[08:42] Team_097 possession (Score: 5-2)
Evan Brogdon attempts a 3Pt. Wide open! Jalen Jackson is 7.8 feet away. [ZONE] EVAN BROGDON MAKES IT! Assist: Anthony Haliburton
Score: 8-2

[08:25] Team_089 possession (Score: 8-2)
Jordan Brogdon drives, picks up Anthony Haliburton. Help arrives from Jrue Haliburton! Jordan Brogdon attempts a Dunk. Heavily contested by Jrue Haliburton (1.6 feet, ZONE)! JORDAN BROGDON MAKES IT!
Score: 8-4

[08:11] Team_097 possession (Score: 8-4)
Jrue Haliburton loses the ball! Stripped by Jalen Jackson! TURNOVER! (live ball)

[08:00] Team_089 possession (Score: 8-4)
Allen Mobley throws a bad pass! Stolen by Shai Poole! TURNOVER! (live ball)

[07:43] Team_097 possession (Score: 8-4)
Tyrese Stewart attempts a Midrange. Contested by Terry Simmons (3.5 feet, MAN). TYRESE STEWART MAKES IT! Assist: Anthony Haliburton
Score: 10-4

[07:29] Team_089 possession (Score: 10-4)
Jordan Brogdon drives, picks up Evan Brogdon. Help arrives from Shai Poole! Jordan Brogdon attempts a Layup. Contested by Shai Poole (4.8 feet, MAN). Jordan Brogdon misses. Rebound secured by Anthony Haliburton.

[07:14] Team_097 possession (Score: 10-4)
Tyrese Stewart makes the Layup and draws the foul on Terry Simmons! And-1! Tyrese Stewart to the line for 1. [BONUS: 5 team fouls] (Terry Simmons: 3 personal fouls)   FT 1/1: MISS Tyrese Stewart makes 0/1 from the line. Rebound secured by Terry Simmons.
Score: 12-4

[06:59] Team_089 possession (Score: 12-4)
Terry Simmons drives to the basket... Terry Simmons loses the ball! Stripped by Anthony Haliburton! TURNOVER! (live ball)

[06:41] Team_097 possession (Score: 12-4)
FOUL! Shooting foul on Terry Simmons. Tyrese Stewart to the line for 2 free throws. [BONUS: 6 team fouls] (Terry Simmons: 4 personal fouls)   FT 1/2: GOOD   FT 2/2: MISS Tyrese Stewart makes 1/2 from the line. Rebound secured by Jalen Jackson.
Score: 13-4

[06:26] Team_089 possession (Score: 13-4)
FOUL! Offensive foul on Jalen Jackson! Jrue Haliburton drew the charge! [Team fouls: 7] (Jalen Jackson: 1 personal fouls) TURNOVER! (dead ball)

[06:09] Team_097 possession (Score: 13-4)
Anthony Haliburton attempts a 3Pt. Wide open! Rudy Smith is 6.8 feet away. [MAN] Anthony Haliburton misses. Rebound secured by Terry Simmons.

[05:56] Team_089 possession (Score: 13-4)
Terry Simmons drives and kicks out. Terry Simmons attempts a 3Pt. Heavily contested by Shai Poole (0.8 feet, ZONE)! Terry Simmons misses. Rebound secured by Tyrese Stewart.

[05:37] Team_097 possession (Score: 13-4)
FOUL! Shooting foul on Terry Simmons. Jrue Haliburton to the line for 2 free throws. [BONUS: 8 team fouls] (Terry Simmons: 5 personal fouls)   FT 1/2: GOOD   FT 2/2: MISS Jrue Haliburton makes 1/2 from the line. Offensive rebound by Tyrese Stewart! Tyrese Stewart kicks it out.
Score: 14-4

[05:23] Team_097 possession (Score: 14-4)
Tyrese Stewart drives to the basket... Tyrese Stewart throws a bad pass! Stolen by Terry Simmons! TURNOVER! (live ball)

[05:08] Team_089 possession (Score: 14-4)
Terry Simmons attempts a Midrange. Contested by Anthony Haliburton (2.0 feet, MAN). Terry Simmons misses. Rebound secured by Tyrese Stewart.

[04:56] Team_097 possession (Score: 14-4)
Anthony Haliburton attempts a Midrange. Contested by Rudy Smith (5.2 feet, MAN). ANTHONY HALIBURTON MAKES IT! Assist: Jrue Haliburton
Score: 16-4

[04:39] Team_089 possession (Score: 16-4)
Jalen Jackson attempts a 3Pt. Contested by Shai Poole (5.0 feet, ZONE). Jalen Jackson misses. Rebound secured by Tyrese Stewart.

[04:28] Team_097 possession (Score: 16-4)
Shai Poole drives and kicks out. Tyrese Stewart attempts a 3Pt. Wide open! Jordan Brogdon is 6.3 feet away. [ZONE] Tyrese Stewart misses. Rebound secured by Rudy Smith.

[04:13] Team_089 possession (Score: 16-4)
Terry Simmons drives to the basket... Terry Simmons loses the ball! Stripped by Anthony Haliburton! TURNOVER! (live ball)

[04:04] Team_097 possession (Score: 16-4)
Shai Poole loses control! Ball rolls out of bounds! TURNOVER! (dead ball)

[03:46] Team_089 possession (Score: 16-4)
FOUL! Holding foul on Anthony Haliburton. [Team fouls: 2] No free throws, side out. (Anthony Haliburton: 1 personal fouls)

[03:35] Team_089 possession (Score: 16-4)
Allen Mobley attempts a Midrange. Heavily contested by Shai Poole (1.9 feet, ZONE)! Allen Mobley misses. Rebound secured by Tyrese Stewart.

[03:18] Team_097 possession (Score: 16-4)
Anthony Haliburton drives and kicks out. Jrue Haliburton attempts a 3Pt. Contested by Jalen Jackson (2.6 feet, MAN). Jrue Haliburton misses. Rebound secured by Rudy Smith.

[03:04] Team_089 possession (Score: 16-4)
Terry Simmons attempts a Midrange. Contested by Anthony Haliburton (5.3 feet, ZONE). Terry Simmons misses. Rebound secured by Shai Poole.

[02:47] Team_097 possession (Score: 16-4)
Shai Poole attempts a Midrange. Contested by Rudy Smith (4.5 feet, ZONE). SHAI POOLE MAKES IT! Assist: Jrue Haliburton
Score: 18-4

[02:37] Team_089 possession (Score: 18-4)
Terry Simmons makes the Dunk and draws the foul on Anthony Haliburton! And-1! Terry Simmons to the line for 1. [Team fouls: 3] (Anthony Haliburton: 2 personal fouls)   FT 1/1: GOOD Terry Simmons makes 1/1 from the line.
Score: 18-7

[02:23] Team_097 possession (Score: 18-7)
Jrue Haliburton drives, picks up Terry Simmons. Help arrives from Jalen Jackson! Jrue Haliburton attempts a Dunk. Heavily contested by Jalen Jackson (1.1 feet, ZONE)! JRUE HALIBURTON MAKES IT!
Score: 20-7

[02:08] Team_089 possession (Score: 20-7)
Jordan Brogdon attempts a 3Pt. Contested by Shai Poole (3.9 feet, ZONE). Jordan Brogdon misses. Rebound secured by Tyrese Stewart.

[01:52] Team_097 possession (Score: 20-7)
Shai Poole drives and kicks out. Jrue Haliburton attempts a 3Pt. Contested by Jordan Brogdon (3.6 feet, ZONE). Jrue Haliburton misses. Rebound secured by Terry Simmons.

[01:40] Team_089 possession (Score: 20-7)
Jalen Jackson attempts a 3Pt. Contested by Jrue Haliburton (5.8 feet, MAN). Jalen Jackson misses. Rebound secured by Tyrese Stewart.

[01:21] Team_097 possession (Score: 20-7)
Anthony Haliburton attempts a Layup. Contested by Rudy Smith (5.0 feet, MAN). ANTHONY HALIBURTON MAKES IT!
Score: 22-7

[01:04] Team_089 possession (Score: 22-7)
Terry Simmons drives to the basket... Terry Simmons loses the ball! Stripped by Anthony Haliburton! TURNOVER! (live ball)

[00:45] Team_097 possession (Score: 22-7)
Tyrese Stewart throws a bad pass! Stolen by Terry Simmons! TURNOVER! (live ball)

[00:30] Team_089 possession (Score: 22-7)
Jordan Brogdon attempts a Midrange. Contested by Anthony Haliburton (4.9 feet, ZONE). JORDAN BROGDON MAKES IT!
Score: 22-9

[00:20] Team_097 possession (Score: 22-9)
Shai Poole attempts a Midrange. Wide open! Rudy Smith is 7.3 feet away. [ZONE] Shai Poole misses. Rebound secured by Terry Simmons.

[00:04] Team_089 possession (Score: 22-9)
Jordan Brogdon attempts a 3Pt. Heavily contested by Evan Brogdon (2.0 feet, MAN)! Jordan Brogdon misses. Offensive rebound by Jalen Jackson! Jalen Jackson kicks it out.

================================================================================
                              1ST QUARTER COMPLETE                              
================================================================================

1ST QUARTER SCORE: Team_097 22, Team_089 9

BOX SCORE:
================================================================================

Team_097
--------------------------------------------------------------------------------
Player                MIN  PTS  REB  AST  TO      FG   FG%      3P   3P%
--------------------------------------------------------------------------------
Anthony Haliburton     12    6    3    2   0   3/5    60.0     0/0   0.0
Tyrese Stewart         12    5    8    0   0   3/6    50.0     0/0   0.0
Evan Brogdon           12    3    0    0   0   1/2    50.0     0/0   0.0
Shai Poole             12    2    3    0   0   1/4    25.0     0/0   0.0
Jrue Haliburton        12    2    0    2   0   1/1   100.0     0/0   0.0

TEAM: FG: 9/18 (50.0%), 3PT: 1/2 (50.0%), REB: 14 (2 off, 12 def), AST: 4, TO: 4
TEAM FOULS: 3


Team_089
--------------------------------------------------------------------------------
Player                MIN  PTS  REB  AST  TO      FG   FG%      3P   3P%
--------------------------------------------------------------------------------
Terry Simmons          12    5    4    0   0   2/5    40.0     0/0   0.0
Jordan Brogdon         12    4    0    0   0   2/5    40.0     0/0   0.0
Allen Mobley           12    0    0    0   0   0/3     0.0     0/0   0.0
Rudy Smith             12    0    4    0   0   0/0     0.0     0/0   0.0
Jalen Jackson          12    0    2    0   0   0/3     0.0     0/0   0.0

TEAM: FG: 4/16 (25.0%), 3PT: 0/6 (0.0%), REB: 10 (1 off, 9 def), AST: 0, TO: 5
TEAM FOULS: 8 [Team_097 in BONUS]

================================================================================

================================================================================
                       2ND QUARTER - Team_097 vs Team_089                       
================================================================================

[12:00] Team_097 possession (Score: 22-9)
Anthony Haliburton attempts a Midrange. Contested by Rudy Smith (5.7 feet, MAN). Anthony Haliburton misses. Rebound secured by Jalen Jackson.

[11:45] Team_089 possession (Score: 22-9)
Jordan Brogdon makes the Layup and draws the foul on Jrue Haliburton! And-1! Jordan Brogdon to the line for 1. [Team fouls: 1] (Jrue Haliburton: 1 personal fouls)   FT 1/1: GOOD Jordan Brogdon makes 1/1 from the line.
Score: 22-12

[11:29] Team_097 possession (Score: 22-12)
Jrue Haliburton attempts a 3Pt. Wide open! Jalen Jackson is 7.2 feet away. [MAN] Jrue Haliburton misses. Rebound secured by Terry Simmons.

[11:19] Team_089 possession (Score: 22-12)
Allen Mobley attempts a 3Pt. Contested by Shai Poole (4.9 feet, ZONE). ALLEN MOBLEY MAKES IT! Assist: Rudy Smith
Score: 22-15

[11:09] Team_097 possession (Score: 22-15)
FOUL! Shooting foul on Jalen Jackson. Anthony Haliburton to the line for 2 free throws. [Team fouls: 1] (Jalen Jackson: 1 personal fouls)   FT 1/2: GOOD   FT 2/2: GOOD Anthony Haliburton makes 2/2 from the line.
Score: 24-15

[10:58] Team_089 possession (Score: 24-15)
FOUL! Reach-in foul on Anthony Haliburton during the drive. [Team fouls: 2] No free throws, side out. (Anthony Haliburton: 1 personal fouls)

[10:41] Team_089 possession (Score: 24-15)
Allen Mobley attempts a Midrange. Heavily contested by Shai Poole (0.7 feet, MAN)! ALLEN MOBLEY MAKES IT! Assist: Rudy Smith
Score: 24-17

[10:26] Team_097 possession (Score: 24-17)
Jrue Haliburton drives and kicks out. Shai Poole attempts a 3Pt. Heavily contested by Jordan Brogdon (0.5 feet, ZONE)! Shai Poole misses. Offensive rebound by Tyrese Stewart! Tyrese Stewart kicks it out.

[10:12] Team_097 possession (Score: 24-17)
Anthony Haliburton attempts a 3Pt. Contested by Jordan Brogdon (3.5 feet, ZONE). Anthony Haliburton misses. Rebound secured by Jalen Jackson.

[10:02] Team_089 possession (Score: 24-17)
Rudy Smith makes the Layup and draws the foul on Anthony Haliburton! And-1! Rudy Smith to the line for 1. [Team fouls: 3] (Anthony Haliburton: 2 personal fouls)   FT 1/1: GOOD Rudy Smith makes 1/1 from the line.
Score: 24-20

[09:48] Team_097 possession (Score: 24-20)
Evan Brogdon attempts a Midrange. Wide open! Allen Mobley is 10.0 feet away. [ZONE] Evan Brogdon misses. Rebound secured by Terry Simmons.

[09:35] Team_089 possession (Score: 24-20)
Jordan Brogdon makes the 3Pt and draws the foul on Evan Brogdon! And-1! Jordan Brogdon to the line for 1. [Team fouls: 4] (Evan Brogdon: 1 personal fouls)   FT 1/1: GOOD Jordan Brogdon makes 1/1 from the line.
Score: 24-24

[09:18] Team_097 possession (Score: 24-24)
Tyrese Stewart drives and kicks out. Tyrese Stewart attempts a Midrange. Contested by Terry Simmons (4.4 feet, MAN). Tyrese Stewart misses. Offensive rebound by Anthony Haliburton! Anthony Haliburton kicks it out.

[09:02] Team_097 possession (Score: 24-24)
Anthony Haliburton attempts a Midrange. Contested by Rudy Smith (5.6 feet, MAN). Anthony Haliburton misses. Offensive rebound by Anthony Haliburton! Anthony Haliburton kicks it out.

[08:48] Team_097 possession (Score: 24-24)
FOUL! Reach-in foul on Allen Mobley during the drive. [Team fouls: 2] No free throws, side out. (Allen Mobley: 1 personal fouls)

[08:33] Team_097 possession (Score: 24-24)
Jrue Haliburton attempts a Layup. Wide open! Jalen Jackson is 7.5 feet away. [MAN] Jrue Haliburton misses. Rebound secured by Jalen Jackson.

[08:17] Team_089 possession (Score: 24-24)
FOUL! Offensive foul on Rudy Smith! Anthony Haliburton drew the charge! [Team fouls: 3] (Rudy Smith: 1 personal fouls) TURNOVER! (dead ball)

[08:00] Team_097 possession (Score: 24-24)
Tyrese Stewart attempts a Layup. Wide open! Rudy Smith is 7.9 feet away. [ZONE] TYRESE STEWART MAKES IT!
Score: 26-24

[07:49] Team_089 possession (Score: 26-24)
Terry Simmons attempts a Layup. Wide open! Tyrese Stewart is 7.4 feet away. [MAN] TERRY SIMMONS MAKES IT!
Score: 26-26

[07:39] Team_097 possession (Score: 26-26)
Shai Poole loses the ball! Stripped by Allen Mobley! TURNOVER! (live ball)

[07:25] Team_089 possession (Score: 26-26)
Rudy Smith attempts a 3Pt. Wide open! Shai Poole is 9.2 feet away. [ZONE] RUDY SMITH MAKES IT! Assist: Terry Simmons
Score: 26-29

[07:10] Team_097 possession (Score: 26-29)
Anthony Haliburton drives and kicks out. Shai Poole attempts a 3Pt. Contested by Jordan Brogdon (2.5 feet, ZONE). SHAI POOLE MAKES IT! Assist: Evan Brogdon
Score: 29-29

[06:55] Team_089 possession (Score: 29-29)
Jalen Jackson attempts a Midrange. Wide open! Shai Poole is 6.3 feet away. [ZONE] JALEN JACKSON MAKES IT!
Score: 29-31

[06:41] Team_097 possession (Score: 29-31)
Jrue Haliburton attempts a 3Pt. Contested by Rudy Smith (4.1 feet, ZONE). JRUE HALIBURTON MAKES IT! Assist: Shai Poole
Score: 32-31

[06:27] Team_089 possession (Score: 32-31)
Rudy Smith makes the Midrange and draws the foul on Shai Poole! And-1! Rudy Smith to the line for 1. [BONUS: 5 team fouls] (Shai Poole: 1 personal fouls)   FT 1/1: GOOD Rudy Smith makes 1/1 from the line.
Score: 32-34

[06:11] Team_097 possession (Score: 32-34)
Shai Poole drives to the basket... FOUL! Offensive foul on Shai Poole! Terry Simmons drew the charge! [Team fouls: 6] (Shai Poole: 2 personal fouls) TURNOVER! (dead ball)

[05:55] Team_089 possession (Score: 32-34)
Jordan Brogdon drives and kicks out. Rudy Smith attempts a 3Pt. Contested by Shai Poole (3.7 feet, ZONE). RUDY SMITH MAKES IT! Assist: Allen Mobley
Score: 32-37

[05:41] Team_097 possession (Score: 32-37)
Tyrese Stewart attempts a 3Pt. Contested by Terry Simmons (3.7 feet, MAN). Tyrese Stewart misses. FOUL! Loose ball foul on Terry Simmons during the rebound battle. [Team fouls: 4] No free throws, side out. (Terry Simmons: 1 personal fouls)

[05:23] Team_097 possession (Score: 32-37)
Tyrese Stewart attempts a Midrange. Wide open! Rudy Smith is 8.1 feet away. [ZONE] Tyrese Stewart misses. Rebound secured by Jalen Jackson.

[05:10] Team_089 possession (Score: 32-37)
Terry Simmons attempts a Midrange. Contested by Tyrese Stewart (6.0 feet, MAN). Terry Simmons misses. Rebound secured by Shai Poole.

[04:55] Team_097 possession (Score: 32-37)
Evan Brogdon attempts a 3Pt. Contested by Jordan Brogdon (5.3 feet, ZONE). Evan Brogdon misses. Rebound secured by Allen Mobley.

[04:38] Team_089 possession (Score: 32-37)
Jalen Jackson attempts a Layup. Heavily contested by Anthony Haliburton (0.7 feet, ZONE)! JALEN JACKSON MAKES IT! Assist: Terry Simmons
Score: 32-39

[04:25] Team_097 possession (Score: 32-39)
Tyrese Stewart attempts a Midrange. Wide open! Terry Simmons is 7.0 feet away. [MAN] TYRESE STEWART MAKES IT!
Score: 34-39

[04:08] Team_089 possession (Score: 34-39)
Terry Simmons attempts a Midrange. Contested by Anthony Haliburton (5.6 feet, ZONE). Terry Simmons misses. Rebound secured by Anthony Haliburton.

[03:50] Team_097 possession (Score: 34-39)
Shai Poole attempts a Midrange. Wide open! Allen Mobley is 7.8 feet away. [ZONE] SHAI POOLE MAKES IT! Assist: Anthony Haliburton
Score: 36-39

[03:37] Team_089 possession (Score: 36-39)
Terry Simmons drives, picks up Tyrese Stewart. Help arrives from Jrue Haliburton! Terry Simmons attempts a Dunk. Wide open! Jrue Haliburton is 7.8 feet away. [MAN] TERRY SIMMONS MAKES IT! Assist: Rudy Smith
Score: 36-41

[03:22] Team_097 possession (Score: 36-41)
Tyrese Stewart drives, picks up Terry Simmons. Help arrives from Jalen Jackson! Tyrese Stewart attempts a Dunk. Contested by Jalen Jackson (4.5 feet, MAN). TYRESE STEWART MAKES IT! Assist: Evan Brogdon
Score: 38-41

[03:08] Team_089 possession (Score: 38-41)
Terry Simmons attempts a Midrange. Wide open! Tyrese Stewart is 7.0 feet away. [MAN] TERRY SIMMONS MAKES IT! Assist: Allen Mobley
Score: 38-43

[02:49] Team_097 possession (Score: 38-43)
Shai Poole attempts a 3Pt. Wide open! Rudy Smith is 6.7 feet away. [ZONE] Shai Poole misses. Rebound secured by Terry Simmons.

[02:32] Team_089 possession (Score: 38-43)
Jordan Brogdon attempts a Midrange. Contested by Jrue Haliburton (5.1 feet, ZONE). JORDAN BROGDON MAKES IT! Assist: Allen Mobley
Score: 38-45

[02:17] Team_097 possession (Score: 38-45)
Tyrese Stewart drives, Terry Simmons stays with him. Tyrese Stewart attempts a Layup. Contested by Terry Simmons (4.4 feet, MAN). TYRESE STEWART MAKES IT!
Score: 40-45

[02:02] Team_089 possession (Score: 40-45)
Jalen Jackson attempts a 3Pt. Wide open! Shai Poole is 7.6 feet away. [ZONE] Jalen Jackson misses. Offensive rebound by Jalen Jackson! Jalen Jackson kicks it out.

[01:48] Team_089 possession (Score: 40-45)
Allen Mobley attempts a 3Pt. Wide open! Shai Poole is 8.3 feet away. [MAN] ALLEN MOBLEY MAKES IT! Assist: Jordan Brogdon
Score: 40-48

[01:35] Team_097 possession (Score: 40-48)
Tyrese Stewart makes the Layup and draws the foul on Rudy Smith! And-1! Tyrese Stewart to the line for 1. [BONUS: 5 team fouls] (Rudy Smith: 2 personal fouls)   FT 1/1: GOOD Tyrese Stewart makes 1/1 from the line.
Score: 43-48

[01:21] Team_089 possession (Score: 43-48)
Rudy Smith attempts a 3Pt. Contested by Shai Poole (5.1 feet, ZONE). RUDY SMITH MAKES IT! Assist: Terry Simmons
Score: 43-51

[01:06] Team_097 possession (Score: 43-51)
Anthony Haliburton attempts a Midrange. Wide open! Rudy Smith is 6.1 feet away. [MAN] ANTHONY HALIBURTON MAKES IT! Assist: Tyrese Stewart
Score: 45-51

[00:53] Team_089 possession (Score: 45-51)
Allen Mobley attempts a Layup. Wide open! Anthony Haliburton is 6.9 feet away. [ZONE] Allen Mobley misses. Rebound secured by Shai Poole.

[00:38] Team_097 possession (Score: 45-51)
Tyrese Stewart attempts a 3Pt. Contested by Terry Simmons (5.9 feet, MAN). Tyrese Stewart misses. Rebound secured by Allen Mobley.

[00:25] Team_089 possession (Score: 45-51)
Jalen Jackson drives to the basket... FOUL! Offensive foul on Jalen Jackson! Anthony Haliburton drew the charge! [Team fouls: 6] (Jalen Jackson: 2 personal fouls) TURNOVER! (dead ball)

[00:13] Team_097 possession (Score: 45-51)
Shai Poole attempts a Midrange. Contested by Allen Mobley (5.8 feet, MAN). Shai Poole misses. Rebound secured by Jalen Jackson.

[00:01] Team_089 possession (Score: 45-51)
Jordan Brogdon attempts a Layup. Heavily contested by Anthony Haliburton (0.5 feet, ZONE)! JORDAN BROGDON MAKES IT! Assist: Terry Simmons
Score: 45-53

================================================================================
                              2ND QUARTER COMPLETE                              
================================================================================

2ND QUARTER SCORE: Team_097 23, Team_089 44

BOX SCORE:
================================================================================

Team_097
--------------------------------------------------------------------------------
Player                MIN  PTS  REB  AST  TO      FG   FG%      3P   3P%
--------------------------------------------------------------------------------
Tyrese Stewart         24   11    2    1   0   5/7    71.4     0/0   0.0
Shai Poole             24    5    2    1   0   2/4    50.0     0/0   0.0
Anthony Haliburton     24    4    3    1   0   2/4    50.0     0/0   0.0
Jrue Haliburton        24    3    0    0   0   1/3    33.3     0/0   0.0
Evan Brogdon           24    0    0    2   0   0/2     0.0     0/0   0.0

TEAM: FG: 10/20 (50.0%), 3PT: 1/6 (16.7%), REB: 7 (4 off, 3 def), AST: 5, TO: 2
TEAM FOULS: 6 [Team_089 in BONUS]


Team_089
--------------------------------------------------------------------------------
Player                MIN  PTS  REB  AST  TO      FG   FG%      3P   3P%
--------------------------------------------------------------------------------
Rudy Smith             24   15    0    3   0   5/5   100.0     0/0   0.0
Jordan Brogdon         24   11    0    1   0   4/4   100.0     0/0   0.0
Allen Mobley           24    8    2    3   0   3/4    75.0     0/0   0.0
Terry Simmons          24    6    3    4   0   3/5    60.0     0/0   0.0
Jalen Jackson          24    4    6    0   0   2/2   100.0     0/0   0.0

TEAM: FG: 17/20 (85.0%), 3PT: 5/5 (100.0%), REB: 11 (1 off, 10 def), AST: 11, TO: 2
TEAM FOULS: 6 [Team_097 in BONUS]

================================================================================

================================================================================
                       3RD QUARTER - Team_097 vs Team_089                       
================================================================================

[12:00] Team_097 possession (Score: 45-53)
Evan Brogdon drives to the basket... Evan Brogdon throws a bad pass out of bounds! TURNOVER! (dead ball)

[11:49] Team_089 possession (Score: 45-53)
Jalen Jackson drives, Jrue Haliburton stays with him. Jalen Jackson attempts a Dunk. Contested by Jrue Haliburton (5.4 feet, MAN). JALEN JACKSON MAKES IT! Assist: Rudy Smith
Score: 45-55

[11:33] Team_097 possession (Score: 45-55)
Shai Poole attempts a Layup. BLOCKED BY ALLEN MOBLEY! Ball goes out off Allen Mobley. Shai Poole's ball!

[11:17] Team_097 possession (Score: 45-55)
FOUL! Reach-in foul on Allen Mobley during the drive. [Team fouls: 1] No free throws, side out. (Allen Mobley: 1 personal fouls)

[11:02] Team_097 possession (Score: 45-55)
Jrue Haliburton drives and kicks out. Jrue Haliburton attempts a 3Pt. Contested by Jalen Jackson (4.5 feet, MAN). JRUE HALIBURTON MAKES IT! Assist: Shai Poole
Score: 48-55

[10:47] Team_089 possession (Score: 48-55)
Terry Simmons drives to the basket... Terry Simmons throws a bad pass! Stolen by Anthony Haliburton! TURNOVER! (live ball)

[10:33] Team_097 possession (Score: 48-55)
Tyrese Stewart attempts a Layup. Contested by Terry Simmons (5.9 feet, MAN). Tyrese Stewart misses. Rebound secured by Rudy Smith.

[10:20] Team_089 possession (Score: 48-55)
Terry Simmons drives, Anthony Haliburton stays with him. Terry Simmons attempts a Dunk. Contested by Anthony Haliburton (4.5 feet, ZONE). TERRY SIMMONS MAKES IT!
Score: 48-57

[10:07] Team_097 possession (Score: 48-57)
Shai Poole attempts a 3Pt. Contested by Allen Mobley (4.3 feet, MAN). Shai Poole misses. Offensive rebound by Tyrese Stewart! Tyrese Stewart kicks it out.

[09:53] Team_097 possession (Score: 48-57)
Tyrese Stewart drives, Terry Simmons stays with him. Tyrese Stewart attempts a Dunk. Contested by Terry Simmons (2.2 feet, MAN). TYRESE STEWART MAKES IT! Assist: Evan Brogdon
Score: 50-57

[09:43] Team_089 possession (Score: 50-57)
Jalen Jackson drives, Jrue Haliburton stays with him. Jalen Jackson attempts a Layup. Contested by Jrue Haliburton (3.3 feet, MAN). JALEN JACKSON MAKES IT!
Score: 50-59

[09:29] Team_097 possession (Score: 50-59)
Shai Poole drives, picks up Allen Mobley. Help arrives from Jalen Jackson! Shai Poole attempts a Layup. Wide open! Jalen Jackson is 6.0 feet away. [MAN] SHAI POOLE MAKES IT!
Score: 52-59

[09:16] Team_089 possession (Score: 52-59)
Rudy Smith attempts a 3Pt. Contested by Anthony Haliburton (3.9 feet, MAN). Rudy Smith misses. Rebound secured by Anthony Haliburton.

[09:02] Team_097 possession (Score: 52-59)
Anthony Haliburton makes the Layup and draws the foul on Jalen Jackson! And-1! Anthony Haliburton to the line for 1. [Team fouls: 2] (Jalen Jackson: 1 personal fouls)   FT 1/1: GOOD Anthony Haliburton makes 1/1 from the line.
Score: 55-59

[08:46] Team_089 possession (Score: 55-59)
Jordan Brogdon attempts a 3Pt. Contested by Evan Brogdon (4.7 feet, MAN). Jordan Brogdon misses. Rebound secured by Anthony Haliburton.

[08:30] Team_097 possession (Score: 55-59)
Evan Brogdon attempts a 3Pt. Contested by Jordan Brogdon (2.8 feet, ZONE). Evan Brogdon misses. Rebound secured by Jalen Jackson.

[08:17] Team_089 possession (Score: 55-59)
Jordan Brogdon attempts a Midrange. Contested by Evan Brogdon (5.6 feet, MAN). JORDAN BROGDON MAKES IT! Assist: Terry Simmons
Score: 55-61

[08:03] Team_097 possession (Score: 55-61)
FOUL! Shooting foul on Jalen Jackson. Jrue Haliburton to the line for 2 free throws. [Team fouls: 3] (Jalen Jackson: 2 personal fouls)   FT 1/2: GOOD   FT 2/2: GOOD Jrue Haliburton makes 2/2 from the line.
Score: 57-61

[07:49] Team_089 possession (Score: 57-61)
Jalen Jackson drives to the basket... Jalen Jackson loses the ball! Stripped by Anthony Haliburton! TURNOVER! (live ball)

[07:35] Team_097 possession (Score: 57-61)
Jrue Haliburton attempts a 3Pt. Contested by Jordan Brogdon (5.6 feet, ZONE). JRUE HALIBURTON MAKES IT! Assist: Tyrese Stewart
Score: 60-61

[07:25] Team_089 possession (Score: 60-61)
Rudy Smith attempts a 3Pt. Contested by Shai Poole (5.0 feet, ZONE). Rudy Smith misses. Rebound secured by Tyrese Stewart.

[07:12] Team_097 possession (Score: 60-61)
Tyrese Stewart drives to the basket... Tyrese Stewart commits a violation (traveling/carry)! TURNOVER! (dead ball)

[06:56] Team_089 possession (Score: 60-61)
FOUL! Shooting foul on Jrue Haliburton. Terry Simmons to the line for 2 free throws. [Team fouls: 1] (Jrue Haliburton: 1 personal fouls)   FT 1/2: GOOD   FT 2/2: GOOD Terry Simmons makes 2/2 from the line.
Score: 60-63

[06:41] Team_097 possession (Score: 60-63)
Tyrese Stewart drives to the basket... Tyrese Stewart commits a violation (traveling/carry)! TURNOVER! (dead ball)

[06:26] Team_089 possession (Score: 60-63)
Terry Simmons drives, Anthony Haliburton stays with him. Terry Simmons attempts a Layup. Heavily contested by Anthony Haliburton (0.8 feet, ZONE)! TERRY SIMMONS MAKES IT! Assist: Allen Mobley
Score: 60-65

[06:12] Team_097 possession (Score: 60-65)
Evan Brogdon attempts a Midrange. Wide open! Allen Mobley is 9.0 feet away. [ZONE] EVAN BROGDON MAKES IT!
Score: 62-65

[05:57] Team_089 possession (Score: 62-65)
Rudy Smith attempts a 3Pt. Wide open! Jrue Haliburton is 8.1 feet away. [ZONE] Rudy Smith misses. Rebound secured by Tyrese Stewart.

[05:40] Team_097 possession (Score: 62-65)
FOUL! Offensive foul on Jrue Haliburton! Jalen Jackson drew the charge! [Team fouls: 2] (Jrue Haliburton: 2 personal fouls) TURNOVER! (dead ball)

[05:26] Team_089 possession (Score: 62-65)
Jordan Brogdon drives, picks up Anthony Haliburton. Help arrives from Jrue Haliburton! Jordan Brogdon attempts a Dunk. Contested by Jrue Haliburton (4.3 feet, ZONE). JORDAN BROGDON MAKES IT! Assist: Terry Simmons
Score: 62-67

[05:15] Team_097 possession (Score: 62-67)
FOUL! Shooting foul on Jordan Brogdon. Evan Brogdon to the line for 3 free throws. [Team fouls: 4] (Jordan Brogdon: 1 personal fouls)   FT 1/3: MISS   FT 2/3: GOOD   FT 3/3: GOOD Evan Brogdon makes 2/3 from the line.
Score: 64-67

[05:02] Team_089 possession (Score: 64-67)
Terry Simmons drives, Anthony Haliburton stays with him. Terry Simmons attempts a Dunk. Heavily contested by Anthony Haliburton (0.5 feet, ZONE)! TERRY SIMMONS MAKES IT!
Score: 64-69

[04:48] Team_097 possession (Score: 64-69)
Tyrese Stewart attempts a 3Pt. Contested by Jordan Brogdon (5.8 feet, ZONE). Tyrese Stewart misses. Offensive rebound by Anthony Haliburton! Anthony Haliburton puts it back in!
Score: 66-69

[04:31] Team_089 possession (Score: 66-69)
Jalen Jackson drives and kicks out. Jalen Jackson attempts a Midrange. Contested by Anthony Haliburton (2.9 feet, ZONE). JALEN JACKSON MAKES IT! Assist: Terry Simmons
Score: 66-71

[04:20] Team_097 possession (Score: 66-71)
Anthony Haliburton attempts a 3Pt. Contested by Jordan Brogdon (4.0 feet, ZONE). ANTHONY HALIBURTON MAKES IT! Assist: Jrue Haliburton
Score: 69-71

[04:02] Team_089 possession (Score: 69-71)
Rudy Smith attempts a 3Pt. Wide open! Shai Poole is 9.1 feet away. [ZONE] Rudy Smith misses. Rebound secured by Shai Poole.

[03:47] Team_097 possession (Score: 69-71)
Evan Brogdon attempts a 3Pt. Contested by Jordan Brogdon (3.8 feet, MAN). Evan Brogdon misses. Rebound secured by Rudy Smith.

[03:30] Team_089 possession (Score: 69-71)
Jordan Brogdon attempts a Midrange. Contested by Anthony Haliburton (4.9 feet, ZONE). Jordan Brogdon misses. Rebound secured by Tyrese Stewart.

[03:15] Team_097 possession (Score: 69-71)
Anthony Haliburton attempts a 3Pt. Contested by Jordan Brogdon (5.6 feet, ZONE). Anthony Haliburton misses. FOUL! Loose ball foul on Rudy Smith during the rebound battle. [IN THE BONUS! 5 team fouls] Tyrese Stewart to the line for 2 free throws. (Rudy Smith: 1 personal fouls)   FT 1/2: GOOD   FT 2/2: GOOD Tyrese Stewart makes 2/2 from the line.
Score: 71-71

[03:00] Team_089 possession (Score: 71-71)
Jordan Brogdon attempts a Midrange. Contested by Shai Poole (4.7 feet, ZONE). JORDAN BROGDON MAKES IT!
Score: 71-73

[02:47] Team_097 possession (Score: 71-73)
FOUL! Holding foul on Terry Simmons. [IN THE BONUS! 6 team fouls] Tyrese Stewart to the line for 2 free throws. (Terry Simmons: 1 personal fouls)   FT 1/2: GOOD   FT 2/2: GOOD Tyrese Stewart makes 2/2 from the line.
Score: 73-73

[02:35] Team_089 possession (Score: 73-73)
Terry Simmons drives and kicks out. Jalen Jackson attempts a Midrange. Contested by Anthony Haliburton (3.8 feet, ZONE). Jalen Jackson misses. Rebound secured by Tyrese Stewart.

[02:18] Team_097 possession (Score: 73-73)
Jrue Haliburton attempts a 3Pt. Contested by Jordan Brogdon (5.4 feet, ZONE). Jrue Haliburton misses. Offensive rebound by Tyrese Stewart! Tyrese Stewart kicks it out.

[02:01] Team_097 possession (Score: 73-73)
Jrue Haliburton loses control! Ball rolls out of bounds! TURNOVER! (dead ball)

[02:01] Substitution (Team_097): Evan Brogdon OUT → Gary Carter IN (stamina_rule2)

[02:01] Substitution (Team_097): Jrue Haliburton OUT → Dwyane Ginobili IN (stamina_rule2)

[02:01] Substitution (Team_097): Shai Poole OUT → Miles Dosunmu IN (stamina_rule2)

[02:01] Substitution (Team_097): Anthony Haliburton OUT → Joel Simons IN (stamina_rule2)

[02:01] Substitution (Team_097): Tyrese Stewart OUT → Miles Banchero IN (stamina_rule2)

[02:01] Substitution (Team_089): Jordan Brogdon OUT → Tony Parker IN (stamina_rule2)

[02:01] Substitution (Team_089): Jalen Jackson OUT → Joel Barnes IN (stamina_rule2)

[02:01] Substitution (Team_089): Rudy Smith OUT → Devin Haliburton IN (stamina_rule2)

[02:01] Substitution (Team_089): Terry Simmons OUT → Evan Gasol IN (stamina_rule2)

[01:48] Team_089 possession (Score: 73-73)
Evan Gasol drives to the basket... Evan Gasol commits a violation (traveling/carry)! TURNOVER! (dead ball)

[01:29] Team_097 possession (Score: 73-73)
Dwyane Ginobili attempts a Layup. Contested by Joel Barnes (4.4 feet, MAN). DWYANE GINOBILI MAKES IT! Assist: Gary Carter
Score: 75-73

[01:12] Team_089 possession (Score: 75-73)
Devin Haliburton attempts a Layup. BLOCKED BY JOEL SIMONS! Ball is loose! Offensive rebound by Devin Haliburton! Devin Haliburton kicks it out.

[00:54] Team_089 possession (Score: 75-73)
Evan Gasol attempts a 3Pt. Heavily contested by Joel Simons (0.6 feet, ZONE)! Evan Gasol misses. Rebound secured by Miles Banchero.

[00:40] Team_097 possession (Score: 75-73)
Miles Dosunmu attempts a Midrange. Contested by Joel Barnes (5.9 feet, ZONE). Miles Dosunmu misses. Rebound secured by Evan Gasol.

[00:27] Team_089 possession (Score: 75-73)
FOUL! Holding foul on Dwyane Ginobili. [Team fouls: 3] No free throws, side out. (Dwyane Ginobili: 1 personal fouls)

[00:12] Team_089 possession (Score: 75-73)
Devin Haliburton drives to the basket... Devin Haliburton throws a bad pass! Stolen by Joel Simons! TURNOVER! (live ball)

================================================================================
                              3RD QUARTER COMPLETE                              
================================================================================

3RD QUARTER SCORE: Team_097 30, Team_089 20

BOX SCORE:
================================================================================

Team_097
--------------------------------------------------------------------------------
Player                MIN  PTS  REB  AST  TO      FG   FG%      3P   3P%
--------------------------------------------------------------------------------
Jrue Haliburton        35    8    0    1   0   3/3   100.0     0/0   0.0
Anthony Haliburton     35    8    3    0   0   3/3   100.0     0/0   0.0
Tyrese Stewart         35    6    6    1   0   3/4    75.0     0/0   0.0
Evan Brogdon           35    4    0    1   0   2/4    50.0     0/0   0.0
Shai Poole             35    2    1    1   0   1/1   100.0     0/0   0.0
Dwyane Ginobili         2    2    0    0   0   1/1   100.0     0/0   0.0
Gary Carter             2    0    0    1   0   0/0     0.0     0/0   0.0
Miles Banchero          2    0    1    0   0   0/0     0.0     0/0   0.0
Miles Dosunmu           2    0    0    0   0   0/1     0.0     0/0   0.0

TEAM: FG: 13/17 (76.5%), 3PT: 5/7 (71.4%), REB: 11 (3 off, 8 def), AST: 5, TO: 5
TEAM FOULS: 3


Team_089
--------------------------------------------------------------------------------
Player                MIN  PTS  REB  AST  TO      FG   FG%      3P   3P%
--------------------------------------------------------------------------------
Terry Simmons          35    8    0    3   0   4/5    80.0     0/0   0.0
Jalen Jackson          35    6    1    0   0   3/3   100.0     0/0   0.0
Jordan Brogdon         35    6    0    0   0   3/5    60.0     0/0   0.0
Rudy Smith             35    0    2    1   0   0/4     0.0     0/0   0.0
Allen Mobley           36    0    0    1   0   0/0     0.0     0/0   0.0
Devin Haliburton        2    0    1    0   0   0/0     0.0     0/0   0.0
Evan Gasol              2    0    1    0   0   0/1     0.0     0/0   0.0

TEAM: FG: 10/18 (55.6%), 3PT: 0/6 (0.0%), REB: 5 (1 off, 4 def), AST: 5, TO: 4
TEAM FOULS: 6 [Team_097 in BONUS]

================================================================================

================================================================================
                       4TH QUARTER - Team_097 vs Team_089                       
================================================================================

[12:00] Team_097 possession (Score: 75-73)
Evan Brogdon makes the 3Pt and draws the foul on Jordan Brogdon! And-1! Evan Brogdon to the line for 1. [Team fouls: 1] (Jordan Brogdon: 1 personal fouls)   FT 1/1: GOOD Evan Brogdon makes 1/1 from the line.
Score: 79-73

[11:41] Team_089 possession (Score: 79-73)
Allen Mobley drives to the basket... Allen Mobley throws a bad pass! Stolen by Anthony Haliburton! TURNOVER! (live ball)

[11:28] Team_097 possession (Score: 79-73)
Evan Brogdon attempts a 3Pt. Contested by Jordan Brogdon (4.0 feet, ZONE). Evan Brogdon misses. Rebound secured by Jalen Jackson.

[11:13] Team_089 possession (Score: 79-73)
Jordan Brogdon attempts a 3Pt. Contested by Evan Brogdon (5.0 feet, MAN). Jordan Brogdon misses. Rebound secured by Tyrese Stewart.

[11:01] Team_097 possession (Score: 79-73)
Anthony Haliburton throws a bad pass! Stolen by Rudy Smith! TURNOVER! (live ball)

[10:46] Team_089 possession (Score: 79-73)
Jalen Jackson drives and kicks out. FOUL! Shooting foul on Shai Poole. Allen Mobley to the line for 2 free throws. [Team fouls: 1] (Shai Poole: 1 personal fouls)   FT 1/2: GOOD   FT 2/2: GOOD Allen Mobley makes 2/2 from the line.
Score: 79-75

[10:31] Team_097 possession (Score: 79-75)
Shai Poole throws a bad pass out of bounds! TURNOVER! (dead ball)

[10:31] Substitution (Team_089): Allen Mobley OUT → Pascal Durant IN (stamina_rule2)

[10:15] Team_089 possession (Score: 79-75)
Pascal Durant throws a bad pass! Stolen by Shai Poole! TURNOVER! (live ball)

[10:01] Team_097 possession (Score: 79-75)
Tyrese Stewart drives to the basket... Tyrese Stewart throws a bad pass out of bounds! TURNOVER! (dead ball)

[10:01] Substitution (Team_089): Jordan Brogdon OUT → Tony Parker IN (stamina_rule2)

[10:01] Substitution (Team_089): Terry Simmons OUT → Evan Gasol IN (stamina_rule2)

[09:47] Team_089 possession (Score: 79-75)
Rudy Smith attempts a 3Pt. Wide open! Anthony Haliburton is 6.2 feet away. [MAN] Rudy Smith misses. Rebound secured by Shai Poole.

[09:37] Team_097 possession (Score: 79-75)
Anthony Haliburton attempts a 3Pt. Wide open! Rudy Smith is 7.1 feet away. [MAN] Anthony Haliburton misses. FOUL! Loose ball foul on Rudy Smith during the rebound battle. [Team fouls: 2] No free throws, side out. (Rudy Smith: 1 personal fouls)

[09:21] Team_097 possession (Score: 79-75)
Tyrese Stewart throws a bad pass out of bounds! TURNOVER! (dead ball)

[09:21] Substitution (Team_097): Evan Brogdon OUT → Gary Carter IN (stamina_rule2)

[09:21] Substitution (Team_097): Shai Poole OUT → Miles Dosunmu IN (stamina_rule2)

[09:21] Substitution (Team_097): Anthony Haliburton OUT → Joel Simons IN (stamina_rule2)

[09:21] Substitution (Team_097): Tyrese Stewart OUT → Miles Banchero IN (stamina_rule2)

[09:21] Substitution (Team_089): Jalen Jackson OUT → Joel Barnes IN (stamina_rule2)

[09:21] Substitution (Team_089): Rudy Smith OUT → Devin Haliburton IN (stamina_rule2)

[09:07] Team_089 possession (Score: 79-75)
Evan Gasol attempts a Layup. BLOCKED BY JOEL SIMONS! Ball goes out off Joel Simons. Evan Gasol's ball!

[08:51] Team_089 possession (Score: 79-75)
Tony Parker attempts a 3Pt. Wide open! Gary Carter is 7.9 feet away. [MAN] Tony Parker misses. Rebound secured by Joel Simons.

[08:36] Team_097 possession (Score: 79-75)
Miles Dosunmu attempts a 3Pt. Contested by Pascal Durant (4.6 feet, MAN). Miles Dosunmu misses. Rebound secured by Evan Gasol.

[08:23] Team_089 possession (Score: 79-75)
Joel Barnes attempts a Midrange. Wide open! Jrue Haliburton is 6.9 feet away. [MAN] JOEL BARNES MAKES IT!
Score: 79-77

[08:05] Team_097 possession (Score: 79-77)
Joel Simons drives to the basket... FOUL! Offensive foul on Joel Simons! Devin Haliburton drew the charge! [Team fouls: 2] (Joel Simons: 1 personal fouls) TURNOVER! (dead ball)

[07:48] Team_089 possession (Score: 79-77)
Evan Gasol makes the Dunk and draws the foul on Joel Simons! And-1! Evan Gasol to the line for 1. [Team fouls: 3] (Joel Simons: 2 personal fouls)   FT 1/1: GOOD Evan Gasol makes 1/1 from the line.
Score: 79-80

[07:34] Team_097 possession (Score: 79-80)
FOUL! Holding foul on Pascal Durant. [Team fouls: 3] No free throws, side out. (Pascal Durant: 1 personal fouls)

[07:21] Team_097 possession (Score: 79-80)
Jrue Haliburton attempts a 3Pt. Contested by Joel Barnes (4.6 feet, MAN). JRUE HALIBURTON MAKES IT! Assist: Joel Simons
Score: 82-80

[07:05] Team_089 possession (Score: 82-80)
Tony Parker attempts a Layup. Contested by Gary Carter (2.6 feet, MAN). TONY PARKER MAKES IT! Assist: Devin Haliburton
Score: 82-82

[06:51] Team_097 possession (Score: 82-82)
Gary Carter loses control! Ball rolls out of bounds! TURNOVER! (dead ball)

[06:51] Substitution (Team_097): Jrue Haliburton OUT → Dwyane Ginobili IN (stamina_rule2)

[06:34] Team_089 possession (Score: 82-82)
Devin Haliburton drives to the basket... Devin Haliburton loses the ball! Stripped by Joel Simons! TURNOVER! (live ball)

[06:21] Team_097 possession (Score: 82-82)
Miles Banchero drives and kicks out. Dwyane Ginobili attempts a 3Pt. Wide open! Pascal Durant is 6.2 feet away. [ZONE] Dwyane Ginobili misses. Offensive rebound by Miles Dosunmu! Miles Dosunmu kicks it out.

[06:08] Team_097 possession (Score: 82-82)
FOUL! Offensive foul on Dwyane Ginobili! Joel Barnes drew the charge! [Team fouls: 4] (Dwyane Ginobili: 1 personal fouls) TURNOVER! (dead ball)

[05:54] Team_089 possession (Score: 82-82)
Tony Parker attempts a 3Pt. Contested by Gary Carter (3.1 feet, MAN). TONY PARKER MAKES IT! Assist: Joel Barnes
Score: 82-85

[05:43] Team_097 possession (Score: 82-85)
FOUL! Offensive foul on Miles Dosunmu! Pascal Durant drew the charge! [Team fouls: 5] (Miles Dosunmu: 1 personal fouls) TURNOVER! (dead ball)

[05:31] Team_089 possession (Score: 82-85)
Devin Haliburton drives to the basket... Devin Haliburton loses control! Ball rolls out of bounds! TURNOVER! (dead ball)

[05:16] Team_097 possession (Score: 82-85)
Miles Banchero attempts a 3Pt. Wide open! Evan Gasol is 6.9 feet away. [MAN] MILES BANCHERO MAKES IT! Assist: Dwyane Ginobili
Score: 85-85

[05:03] Team_089 possession (Score: 85-85)
FOUL! Shooting foul on Joel Simons. Evan Gasol to the line for 2 free throws. [BONUS: 6 team fouls] (Joel Simons: 3 personal fouls)   FT 1/2: GOOD   FT 2/2: GOOD Evan Gasol makes 2/2 from the line.
Score: 85-87

[04:45] Team_097 possession (Score: 85-87)
Joel Simons attempts a Layup. BLOCKED BY DEVIN HALIBURTON! Ball deflects out of bounds off Joel Simons.

[04:27] Team_089 possession (Score: 85-87)
Evan Gasol drives and kicks out. Joel Barnes attempts a 3Pt. Contested by Dwyane Ginobili (4.1 feet, MAN). Joel Barnes misses. Rebound secured by Miles Dosunmu.

[04:11] Team_097 possession (Score: 85-87)
Dwyane Ginobili attempts a 3Pt. BLOCKED BY PASCAL DURANT! Ball is loose! Offensive rebound by Miles Dosunmu! Miles Dosunmu kicks it out.

[03:58] Team_097 possession (Score: 85-87)
Dwyane Ginobili attempts a Layup. Contested by Joel Barnes (5.1 feet, MAN). DWYANE GINOBILI MAKES IT!
Score: 87-87

[03:45] Team_089 possession (Score: 87-87)
Joel Barnes drives and kicks out. Joel Barnes attempts a 3Pt. Contested by Dwyane Ginobili (5.8 feet, MAN). Joel Barnes misses. Offensive rebound by Devin Haliburton! Devin Haliburton kicks it out.

[03:32] Team_089 possession (Score: 87-87)
Joel Barnes attempts a 3Pt. Contested by Dwyane Ginobili (5.3 feet, MAN). Joel Barnes misses. Offensive rebound by Evan Gasol! Evan Gasol kicks it out.

[03:18] Team_089 possession (Score: 87-87)
Tony Parker attempts a 3Pt. Contested by Gary Carter (3.9 feet, MAN). Tony Parker misses. Rebound secured by Miles Banchero.

[03:01] Team_097 possession (Score: 87-87)
Dwyane Ginobili attempts a 3Pt. Wide open! Joel Barnes is 7.3 feet away. [MAN] DWYANE GINOBILI MAKES IT! Assist: Miles Dosunmu
Score: 90-87

[02:48] Team_089 possession (Score: 90-87)
Joel Barnes attempts a 3Pt. Contested by Gary Carter (5.3 feet, ZONE). Joel Barnes misses. Offensive rebound by Devin Haliburton! Devin Haliburton kicks it out.

[02:35] Team_089 possession (Score: 90-87)
Pascal Durant attempts a 3Pt. Contested by Joel Simons (3.6 feet, ZONE). Pascal Durant misses. Rebound secured by Miles Dosunmu.

[02:19] Team_097 possession (Score: 90-87)
Joel Simons attempts a Midrange. Wide open! Pascal Durant is 6.7 feet away. [ZONE] Joel Simons misses. Rebound secured by Pascal Durant.

[02:02] Team_089 possession (Score: 90-87)
Evan Gasol attempts a Layup. Contested by Joel Simons (2.4 feet, ZONE). Evan Gasol misses. Rebound secured by Joel Simons.

[01:46] Team_097 possession (Score: 90-87)
Miles Dosunmu attempts a Midrange. Wide open! Pascal Durant is 6.5 feet away. [MAN] MILES DOSUNMU MAKES IT! Assist: Dwyane Ginobili
Score: 92-87

[01:37] Team_089 possession (Score: 92-87)
Joel Barnes attempts a 3Pt. Contested by Dwyane Ginobili (4.4 feet, MAN). Joel Barnes misses. FOUL! Loose ball foul on Miles Banchero during the rebound battle. [IN THE BONUS! 7 team fouls] Devin Haliburton to the line for 2 free throws. (Miles Banchero: 1 personal fouls)   FT 1/2: MISS   FT 2/2: GOOD Devin Haliburton makes 1/2 from the line.
Score: 92-88

[01:23] Team_097 possession (Score: 92-88)
Dwyane Ginobili attempts a Layup. Contested by Joel Barnes (3.1 feet, MAN). DWYANE GINOBILI MAKES IT! Assist: Miles Dosunmu
Score: 94-88

[01:06] Team_089 possession (Score: 94-88)
Evan Gasol attempts a 3Pt. Contested by Joel Simons (4.1 feet, ZONE). EVAN GASOL MAKES IT! Assist: Joel Barnes
Score: 94-91

[00:50] Team_097 possession (Score: 94-91)
Gary Carter attempts a 3Pt. Wide open! Tony Parker is 7.6 feet away. [MAN] GARY CARTER MAKES IT! Assist: Joel Simons
Score: 97-91

[00:34] Team_089 possession (Score: 97-91)
Joel Barnes drives to the basket... Joel Barnes loses control! Ball rolls out of bounds! TURNOVER! (dead ball)

[00:20] Team_097 possession (Score: 97-91)
Dwyane Ginobili attempts a Midrange. Contested by Joel Barnes (3.8 feet, MAN). DWYANE GINOBILI MAKES IT! Assist: Gary Carter
Score: 99-91

[00:05] Team_089 possession (Score: 99-91)
Devin Haliburton attempts a 3Pt. Wide open! Joel Simons is 6.0 feet away. [MAN] Devin Haliburton misses. Rebound secured by Joel Simons.

================================================================================
                              4TH QUARTER COMPLETE                              
================================================================================

4TH QUARTER SCORE: Team_097 24, Team_089 18

BOX SCORE:
================================================================================

Team_097
--------------------------------------------------------------------------------
Player                MIN  PTS  REB  AST  TO      FG   FG%      3P   3P%
--------------------------------------------------------------------------------
Dwyane Ginobili         9    9    0    2   0   4/4   100.0     0/0   0.0
Evan Brogdon           38    4    0    0   0   1/2    50.0     0/0   0.0
Jrue Haliburton        40    3    0    0   0   1/1   100.0     0/0   0.0
Miles Banchero         11    3    1    0   0   1/1   100.0     0/0   0.0
Gary Carter            11    3    0    1   0   1/1   100.0     0/0   0.0
Miles Dosunmu          11    2    4    2   0   1/2    50.0     0/0   0.0
Tyrese Stewart         38    0    2    0   0   0/0     0.0     0/0   0.0
Shai Poole             38    0    1    0   0   0/0     0.0     0/0   0.0
Joel Simons            11    0    3    2   0   0/2     0.0     0/0   0.0

TEAM: FG: 9/13 (69.2%), 3PT: 5/7 (71.4%), REB: 11 (3 off, 8 def), AST: 7, TO: 8
TEAM FOULS: 7 [Team_089 in BONUS]


Team_089
--------------------------------------------------------------------------------
Player                MIN  PTS  REB  AST  TO      FG   FG%      3P   3P%
--------------------------------------------------------------------------------
Evan Gasol             12    8    2    0   0   3/5    60.0     0/0   0.0
Tony Parker            12    5    0    0   0   2/4    50.0     0/0   0.0
Allen Mobley           38    2    0    0   0   1/1   100.0     0/0   0.0
Joel Barnes            11    2    0    2   0   1/1   100.0     0/0   0.0
Devin Haliburton       11    1    2    1   0   1/2    50.0     0/0   0.0
Jalen Jackson          38    0    1    0   0   0/0     0.0     0/0   0.0
Jordan Brogdon         37    0    0    0   0   0/1     0.0     0/0   0.0
Rudy Smith             38    0    0    0   0   0/1     0.0     0/0   0.0
Pascal Durant          10    0    1    0   0   0/1     0.0     0/0   0.0

TEAM: FG: 8/16 (50.0%), 3PT: 3/9 (33.3%), REB: 6 (3 off, 3 def), AST: 3, TO: 5
TEAM FOULS: 3

================================================================================

================================================================================
                               FULL GAME COMPLETE                               
================================================================================

FINAL SCORE: Team_097 99, Team_089 91

SCORING BY QUARTER:
--------------------------------------------------------------------------------
Team                     Q1     Q2     Q3     Q4    FINAL
--------------------------------------------------------------------------------
Team_097                 22     23     30     24       99
Team_089                  9     44     20     18       91
--------------------------------------------------------------------------------

FULL GAME BOX SCORE:
================================================================================

Team_097
--------------------------------------------------------------------------------
Player                MIN  PTS  REB  AST  TO      FG   FG%      3P   3P%      FT STL BLK
--------------------------------------------------------------------------------
Jrue Haliburton        40   16    0    3   3   7/9    77.8   3/4    75.0   3/4     0   0
Evan Brogdon           38   11    0    3   1   4/10   40.0   3/7    42.9   3/4     0   0
Shai Poole             38    9    7    2   5   3/8    37.5   0/1     0.0   0/0     2   0
Anthony Haliburton     38   18    9    3   4   9/13   69.2   2/4    50.0   3/3     6   0
Tyrese Stewart         38   22   18    2   2   9/15   60.0   1/2    50.0   7/10    0   0
Gary Carter            11    3    0    2   1   1/1   100.0   1/1   100.0   0/0     0   0
Miles Dosunmu          11    2    4    2   2   1/3    33.3   0/1     0.0   0/0     0   0
Joel Simons            11    0    3    2   0   0/2     0.0   0/0     0.0   0/0     2   2
Miles Banchero         11    3    2    0   0   1/1   100.0   1/1   100.0   0/0     0   0
Dwyane Ginobili         9   11    0    2   1   5/5   100.0   1/1   100.0   0/0     0   0

TEAM: FG: 41/68 (60.3%), 3PT: 12/22 (54.5%), REB: 43 (12 off, 31 def), AST: 21, TO: 19


Team_089
--------------------------------------------------------------------------------
Player                MIN  PTS  REB  AST  TO      FG   FG%      3P   3P%      FT STL BLK
--------------------------------------------------------------------------------
Allen Mobley           38   10    2    4   2   3/7    42.9   2/3    66.7   2/2     1   1
Jalen Jackson          38   10   10    0   2   6/9    66.7   0/3     0.0   0/0     1   0
Rudy Smith             38   15    6    4   1   4/9    44.4   2/7    28.6   2/2     1   0
Jordan Brogdon         37   21    0    1   2  10/16   62.5   1/5    20.0   2/2     0   0
Terry Simmons          37   19    7    7   3   9/15   60.0   0/0     0.0   3/3     2   0
Tony Parker            12    5    0    0   0   2/4    50.0   1/3    33.3   0/0     0   0
Evan Gasol             12    8    3    0   3   3/6    50.0   1/2    50.0   3/3     0   0
Joel Barnes            11    2    0    2   1   2/2   100.0   1/1   100.0   0/0     0   0
Devin Haliburton       11    1    3    1   1   0/1     0.0   0/1     0.0   1/2     0   1
Pascal Durant          10    0    1    0   1   0/1     0.0   0/1     0.0   0/0     0   1

TEAM: FG: 39/70 (55.7%), 3PT: 8/26 (30.8%), REB: 32 (6 off, 26 def), AST: 19, TO: 16

================================================================================
