================================================================================
                        FULL GAME - Team_043 vs Team_100                        
================================================================================

================================================================================
                       1ST QUARTER - Team_043 vs Team_100                       
================================================================================

[12:00] Team_043 possession (Score: 0-0)
FOUL! Reach-in foul on Tyler Griffin during the drive. [Team fouls: 1] No free throws, side out. (Tyler Griffin: 1 personal fouls)

[11:49] Team_043 possession (Score: 0-0)
D'Angelo Iverson attempts a Midrange. Wide open! Manu Ball is 7.3 feet away. [ZONE] D'ANGELO IVERSON MAKES IT! Assist: Magic Durant
Score: 2-0

[11:32] Team_100 possession (Score: 2-0)
Chris Mobley drives and kicks out. Luka Green attempts a Midrange. Contested by Manu Carter (2.4 feet, ZONE). Luka Green misses. Offensive rebound by Pau LaVine! Pau LaVine kicks it out.

[11:21] Team_100 possession (Score: 2-0)
Pau LaVine makes the Dunk and draws the foul on Manu Carter! And-1! Pau LaVine to the line for 1. [Team fouls: 1] (Manu Carter: 1 personal fouls)   FT 1/1: GOOD Pau LaVine makes 1/1 from the line.
Score: 2-3

[11:03] Team_043 possession (Score: 2-3)
D'Angelo Iverson attempts a 3Pt. Contested by Tyler Griffin (3.8 feet, MAN). D'Angelo Iverson misses. Rebound secured by Chris Mobley.

[10:50] Team_100 possession (Score: 2-3)
Tyler Griffin attempts a Layup. Contested by Manu Carter (4.5 feet, ZONE). TYLER GRIFFIN MAKES IT!
Score: 2-5

[10:32] Team_043 possession (Score: 2-5)
Dwyane Dosunmu attempts a Midrange. Contested by Chris Mobley (2.4 feet, MAN). Dwyane Dosunmu misses. Rebound secured by Tyler Griffin.

[10:16] Team_100 possession (Score: 2-5)
Manu Ball drives, picks up Magic Durant. Help arrives from D'Angelo Iverson! Manu Ball attempts a Layup. Heavily contested by D'Angelo Iverson (0.5 feet, MAN)! MANU BALL MAKES IT! Assist: Luka Green
Score: 2-7

[10:04] Team_043 possession (Score: 2-7)
Dwyane Dosunmu drives, Chris Mobley stays with him. Dwyane Dosunmu attempts a Layup. Heavily contested by Chris Mobley (0.5 feet, MAN)! DWYANE DOSUNMU MAKES IT! Assist: Manu Carter
Score: 4-7

[09:48] Team_100 possession (Score: 4-7)
Chris Mobley attempts a Layup. Contested by Manu Carter (2.8 feet, ZONE). Chris Mobley misses. Offensive rebound by Chris Mobley! Chris Mobley kicks it out.

[09:34] Team_100 possession (Score: 4-7)
Chris Mobley drives and kicks out. Luka Green makes the Midrange and draws the foul on Manu Carter! And-1! Luka Green to the line for 1. [Team fouls: 2] (Manu Carter: 2 personal fouls)   FT 1/1: GOOD Luka Green makes 1/1 from the line.
Score: 4-10

[09:24] Team_043 possession (Score: 4-10)
Malcolm Murray drives to the basket... Malcolm Murray loses control! Ball rolls out of bounds! TURNOVER! (dead ball)

[09:07] Team_100 possession (Score: 4-10)
Manu Ball attempts a 3Pt. Contested by Magic Durant (4.5 feet, MAN). MANU BALL MAKES IT! Assist: Tyler Griffin
Score: 4-13

[08:52] Team_043 possession (Score: 4-13)
D'Angelo Iverson attempts a Midrange. Contested by Tyler Griffin (2.6 feet, MAN). D'Angelo Iverson misses. Rebound secured by Tyler Griffin.

[08:36] Team_100 possession (Score: 4-13)
Tyler Griffin attempts a 3Pt. Contested by D'Angelo Iverson (3.9 feet, ZONE). Tyler Griffin misses. Offensive rebound by Pau LaVine! Pau LaVine kicks it out.

[08:22] Team_100 possession (Score: 4-13)
Manu Ball attempts a 3Pt. Wide open! Manu Carter is 6.2 feet away. [ZONE] Manu Ball misses. Rebound secured by D'Angelo Iverson.

[08:09] Team_043 possession (Score: 4-13)
Dwyane Dosunmu attempts a Layup. Contested by Chris Mobley (4.0 feet, MAN). DWYANE DOSUNMU MAKES IT! Assist: Manu Carter
Score: 6-13

[07:55] Team_100 possession (Score: 6-13)
FOUL! Shooting foul on Manu Carter. Chris Mobley to the line for 2 free throws. [Team fouls: 3] (Manu Carter: 3 personal fouls)   FT 1/2: GOOD   FT 2/2: GOOD Chris Mobley makes 2/2 from the line.
Score: 6-15

[07:41] Team_043 possession (Score: 6-15)
Dwyane Dosunmu throws a bad pass! Stolen by Chris Mobley! TURNOVER! (live ball)

[07:30] Team_100 possession (Score: 6-15)
Luka Green makes the Midrange and draws the foul on Manu Carter! And-1! Luka Green to the line for 1. [Team fouls: 4] (Manu Carter: 4 personal fouls)   FT 1/1: GOOD Luka Green makes 1/1 from the line.
Score: 6-18

[07:16] Team_043 possession (Score: 6-18)
Manu Carter drives to the basket... FOUL! Offensive foul on Manu Carter! Pau LaVine drew the charge! [Team fouls: 5] (Manu Carter: 5 personal fouls) TURNOVER! (dead ball)

[06:59] Team_100 possession (Score: 6-18)
FOUL! Offensive foul on Manu Ball! Magic Durant drew the charge! [Team fouls: 2] (Manu Ball: 1 personal fouls) TURNOVER! (dead ball)

[06:45] Team_043 possession (Score: 6-18)
Magic Durant drives, Pau LaVine stays with him. Magic Durant attempts a Layup. Heavily contested by Pau LaVine (1.1 feet, ZONE)! Magic Durant misses. Rebound secured by Tyler Griffin.

[06:31] Team_100 possession (Score: 6-18)
Chris Mobley attempts a 3Pt. Contested by D'Angelo Iverson (3.2 feet, ZONE). Chris Mobley misses. Offensive rebound by Chris Mobley! Chris Mobley kicks it out.

[06:14] Team_100 possession (Score: 6-18)
Tyler Griffin attempts a 3Pt. Contested by D'Angelo Iverson (3.2 feet, MAN). Tyler Griffin misses. Rebound secured by D'Angelo Iverson.

[06:03] Team_043 possession (Score: 6-18)
Magic Durant drives and kicks out. Magic Durant attempts a Midrange. Wide open! Manu Ball is 9.1 feet away. [MAN] Magic Durant misses. Offensive rebound by Manu Carter! Manu Carter kicks it out.

[05:50] Team_043 possession (Score: 6-18)
Manu Carter drives and kicks out. Dwyane Dosunmu attempts a Midrange. Wide open! Manu Ball is 7.8 feet away. [ZONE] Dwyane Dosunmu misses. Rebound secured by Chris Mobley.

[05:34] Team_100 possession (Score: 6-18)
Chris Mobley drives to the basket... FOUL! Offensive foul on Chris Mobley! Manu Carter drew the charge! [Team fouls: 3] (Chris Mobley: 1 personal fouls) TURNOVER! (dead ball)

[05:22] Team_043 possession (Score: 6-18)
FOUL! Offensive foul on D'Angelo Iverson! Tyler Griffin drew the charge! [Team fouls: 6] (D'Angelo Iverson: 1 personal fouls) TURNOVER! (dead ball)

[05:10] Team_100 possession (Score: 6-18)
Luka Green attempts a 3Pt. Heavily contested by D'Angelo Iverson (1.9 feet, ZONE)! Luka Green misses. Rebound secured by Manu Carter.

[04:54] Team_043 possession (Score: 6-18)
Manu Carter attempts a 3Pt. Wide open! Luka Green is 7.2 feet away. [ZONE] Manu Carter misses. Offensive rebound by D'Angelo Iverson! D'Angelo Iverson kicks it out.

[04:38] Team_043 possession (Score: 6-18)
Malcolm Murray attempts a 3Pt. Contested by Luka Green (4.9 feet, ZONE). Malcolm Murray misses. Rebound secured by Pau LaVine.

[04:23] Team_100 possession (Score: 6-18)
Pau LaVine drives, Manu Carter stays with him. Pau LaVine attempts a Layup. Contested by Manu Carter (3.0 feet, MAN). PAU LAVINE MAKES IT!
Score: 6-20

[04:12] Team_043 possession (Score: 6-20)
Manu Carter drives and kicks out. Manu Carter attempts a 3Pt. Contested by Pau LaVine (5.5 feet, ZONE). Manu Carter misses. Rebound secured by Tyler Griffin.

[03:58] Team_100 possession (Score: 6-20)
Tyler Griffin attempts a 3Pt. Heavily contested by D'Angelo Iverson (0.5 feet, MAN)! Tyler Griffin misses. Rebound secured by Dwyane Dosunmu.

[03:45] Team_043 possession (Score: 6-20)
Dwyane Dosunmu throws a bad pass out of bounds! TURNOVER! (dead ball)

[03:45] Substitution (Team_100): Chris Mobley OUT → John Rozier IN (stamina_rule2)

[03:30] Team_100 possession (Score: 6-20)
Manu Ball attempts a 3Pt. Contested by Magic Durant (2.0 feet, MAN). Manu Ball misses. Rebound secured by D'Angelo Iverson.

[03:20] Team_043 possession (Score: 6-20)
Malcolm Murray attempts a 3Pt. Contested by Luka Green (4.8 feet, ZONE). MALCOLM MURRAY MAKES IT! Assist: Manu Carter
Score: 9-20

[03:06] Team_100 possession (Score: 9-20)
FOUL! Reach-in foul on Manu Carter during the drive. [IN THE BONUS! 7 team fouls] John Rozier to the line for 2 free throws. (Manu Carter: 6 personal fouls) Manu Carter FOULS OUT!   FT 1/2: GOOD   FT 2/2: GOOD John Rozier makes 2/2 from the line.
Score: 9-22

[03:06] Substitution (Team_043): Manu Carter OUT (stamina: 70) → Jabari Holiday IN (foul_out)

[02:53] Team_043 possession (Score: 9-22)
Jabari Holiday attempts a Midrange. Wide open! Pau LaVine is 7.2 feet away. [ZONE] Jabari Holiday misses. Rebound secured by John Rozier.

[02:36] Team_100 possession (Score: 9-22)
Manu Ball attempts a 3Pt. Wide open! D'Angelo Iverson is 8.9 feet away. [ZONE] Manu Ball misses. Rebound secured by Dwyane Dosunmu.

[02:22] Team_043 possession (Score: 9-22)
Dwyane Dosunmu makes the Layup and draws the foul on Manu Ball! And-1! Dwyane Dosunmu to the line for 1. [Team fouls: 4] (Manu Ball: 2 personal fouls)   FT 1/1: GOOD Dwyane Dosunmu makes 1/1 from the line.
Score: 12-22

[02:03] Team_100 possession (Score: 12-22)
FOUL! Reach-in foul on Malcolm Murray during the drive. [IN THE BONUS! 8 team fouls] Luka Green to the line for 2 free throws. (Malcolm Murray: 1 personal fouls)   FT 1/2: GOOD   FT 2/2: MISS Luka Green makes 1/2 from the line. Rebound secured by Dwyane Dosunmu.
Score: 12-23

[01:49] Team_043 possession (Score: 12-23)
D'Angelo Iverson attempts a 3Pt. Wide open! Luka Green is 7.4 feet away. [ZONE] D'ANGELO IVERSON MAKES IT! Assist: Magic Durant
Score: 15-23

[01:35] Team_100 possession (Score: 15-23)
Tyler Griffin attempts a Midrange. Heavily contested by D'Angelo Iverson (0.7 feet, MAN)! TYLER GRIFFIN MAKES IT! Assist: Manu Ball
Score: 15-25

[01:18] Team_043 possession (Score: 15-25)
FOUL! Offensive foul on Dwyane Dosunmu! John Rozier drew the charge! [Team fouls: 9] (Dwyane Dosunmu: 1 personal fouls) TURNOVER! (dead ball)

[01:09] Team_100 possession (Score: 15-25)
Luka Green makes the 3Pt and draws the foul on D'Angelo Iverson! And-1! Luka Green to the line for 1. [BONUS: 10 team fouls] (D'Angelo Iverson: 2 personal fouls)   FT 1/1: GOOD Luka Green makes 1/1 from the line.
Score: 15-29

[00:53] Team_043 possession (Score: 15-29)
FOUL! Holding foul on John Rozier. [IN THE BONUS! 5 team fouls] Dwyane Dosunmu to the line for 2 free throws. (John Rozier: 1 personal fouls)   FT 1/2: GOOD   FT 2/2: GOOD Dwyane Dosunmu makes 2/2 from the line.
Score: 17-29

[00:37] Team_100 possession (Score: 17-29)
John Rozier makes the Layup and draws the foul on Dwyane Dosunmu! And-1! John Rozier to the line for 1. [BONUS: 11 team fouls] (Dwyane Dosunmu: 2 personal fouls)   FT 1/1: GOOD John Rozier makes 1/1 from the line.
Score: 17-32

[00:23] Team_043 possession (Score: 17-32)
Jabari Holiday attempts a 3Pt. Contested by Luka Green (5.7 feet, ZONE). JABARI HOLIDAY MAKES IT! Assist: Dwyane Dosunmu
Score: 20-32

[00:14] Team_100 possession (Score: 20-32)
Manu Ball attempts a Layup. Contested by Magic Durant (2.5 feet, MAN). MANU BALL MAKES IT! Assist: Tyler Griffin
Score: 20-34

[00:01] Team_043 possession (Score: 20-34)
Magic Durant drives to the basket... FOUL! Offensive foul on Magic Durant! Pau LaVine drew the charge! [Team fouls: 12] (Magic Durant: 1 personal fouls) TURNOVER! (dead ball)

================================================================================
                              1ST QUARTER COMPLETE                              
================================================================================

1ST QUARTER SCORE: Team_043 20, Team_100 34

BOX SCORE:
================================================================================

Team_043
--------------------------------------------------------------------------------
Player                MIN  PTS  REB  AST  TO      FG   FG%      3P   3P%
--------------------------------------------------------------------------------
Dwyane Dosunmu         12    9    3    1   0   4/5    80.0     0/0   0.0
D'Angelo Iverson       12    5    4    0   0   2/4    50.0     0/0   0.0
Malcolm Murray         12    3    0    0   0   1/2    50.0     0/0   0.0
Jabari Holiday          3    3    0    0   0   1/2    50.0     0/0   0.0
Magic Durant           12    0    0    2   0   0/1     0.0     0/0   0.0
Manu Carter             9    0    2    3   0   0/2     0.0     0/0   0.0

TEAM: FG: 8/16 (50.0%), 3PT: 3/5 (60.0%), REB: 9 (2 off, 7 def), AST: 6, TO: 7
TEAM FOULS: 12 [Team_100 in BONUS]


Team_100
--------------------------------------------------------------------------------
Player                MIN  PTS  REB  AST  TO      FG   FG%      3P   3P%
--------------------------------------------------------------------------------
Luka Green             12   10    0    1   0   3/5    60.0     0/0   0.0
Manu Ball              12    7    0    1   0   3/6    50.0     0/0   0.0
Pau LaVine             12    5    3    0   0   2/2   100.0     0/0   0.0
John Rozier             4    5    1    0   0   2/2   100.0     0/0   0.0
Tyler Griffin          12    4    4    2   0   2/4    50.0     0/0   0.0
Chris Mobley            8    2    4    0   0   1/1   100.0     0/0   0.0

TEAM: FG: 13/20 (65.0%), 3PT: 2/8 (25.0%), REB: 12 (4 off, 8 def), AST: 4, TO: 2
TEAM FOULS: 5 [Team_043 in BONUS]

================================================================================

================================================================================
                       2ND QUARTER - Team_043 vs Team_100                       
================================================================================

[12:00] Team_043 possession (Score: 20-34)
Malcolm Murray makes the Layup and draws the foul on Luka Green! And-1! Malcolm Murray to the line for 1. [Team fouls: 1] (Luka Green: 1 personal fouls)   FT 1/1: GOOD Malcolm Murray makes 1/1 from the line.
Score: 23-34

[11:48] Team_100 possession (Score: 23-34)
Luka Green makes the Layup and draws the foul on Manu Carter! And-1! Luka Green to the line for 1. [Team fouls: 1] (Manu Carter: 1 personal fouls)   FT 1/1: GOOD Luka Green makes 1/1 from the line.
Score: 23-37

[11:34] Team_043 possession (Score: 23-37)
D'Angelo Iverson drives, picks up Tyler Griffin. Help arrives from Manu Ball! D'Angelo Iverson attempts a Layup. Wide open! Manu Ball is 7.1 feet away. [MAN] D'ANGELO IVERSON MAKES IT!
Score: 25-37

[11:21] Team_100 possession (Score: 25-37)
Pau LaVine attempts a 3Pt. Contested by Manu Carter (5.4 feet, MAN). Pau LaVine misses. Rebound secured by D'Angelo Iverson.

[11:04] Team_043 possession (Score: 25-37)
Dwyane Dosunmu attempts a Layup. BLOCKED BY CHRIS MOBLEY! Ball goes out off Chris Mobley. Dwyane Dosunmu's ball!

[10:52] Team_043 possession (Score: 25-37)
Manu Carter attempts a Midrange. Wide open! Pau LaVine is 8.2 feet away. [MAN] Manu Carter misses. Offensive rebound by D'Angelo Iverson! D'Angelo Iverson kicks it out.

[10:36] Team_043 possession (Score: 25-37)
FOUL! Reach-in foul on Pau LaVine during the drive. [Team fouls: 2] No free throws, side out. (Pau LaVine: 1 personal fouls)

[10:27] Team_043 possession (Score: 25-37)
Dwyane Dosunmu attempts a Midrange. Wide open! Chris Mobley is 8.7 feet away. [MAN] Dwyane Dosunmu misses. Rebound secured by Pau LaVine.

[10:13] Team_100 possession (Score: 25-37)
FOUL! Offensive foul on Pau LaVine! Manu Carter drew the charge! [Team fouls: 3] (Pau LaVine: 2 personal fouls) TURNOVER! (dead ball)

[09:58] Team_043 possession (Score: 25-37)
Malcolm Murray attempts a 3Pt. Contested by Luka Green (5.2 feet, MAN). MALCOLM MURRAY MAKES IT! Assist: Manu Carter
Score: 28-37

[09:45] Team_100 possession (Score: 28-37)
Pau LaVine drives, Manu Carter stays with him. Pau LaVine attempts a Dunk. Contested by Manu Carter (2.3 feet, MAN). Pau LaVine misses. Rebound secured by Manu Carter.

[09:31] Team_043 possession (Score: 28-37)
Magic Durant attempts a 3Pt. Wide open! Manu Ball is 7.8 feet away. [ZONE] Magic Durant misses. Rebound secured by Chris Mobley.

[09:14] Team_100 possession (Score: 28-37)
Manu Ball attempts a 3Pt. Heavily contested by D'Angelo Iverson (0.5 feet, ZONE)! MANU BALL MAKES IT! Assist: Chris Mobley
Score: 28-40

[09:02] Team_043 possession (Score: 28-40)
Manu Carter attempts a Midrange. Contested by Pau LaVine (4.5 feet, MAN). MANU CARTER MAKES IT!
Score: 30-40

[08:48] Team_100 possession (Score: 30-40)
Tyler Griffin drives, D'Angelo Iverson stays with him. Tyler Griffin attempts a Layup. Contested by D'Angelo Iverson (3.4 feet, MAN). TYLER GRIFFIN MAKES IT! Assist: Chris Mobley
Score: 30-42

[08:35] Team_043 possession (Score: 30-42)
Manu Carter drives to the basket... Manu Carter throws a bad pass out of bounds! TURNOVER! (dead ball)

[08:35] Substitution (Team_043): Malcolm Murray OUT → Jabari Holiday IN (stamina_rule2)

[08:35] Substitution (Team_043): Magic Durant OUT → Ben LaVine IN (stamina_rule2)

[08:35] Substitution (Team_043): D'Angelo Iverson OUT → Dirk Herro IN (stamina_rule2)

[08:35] Substitution (Team_043): Manu Carter OUT → Joel Murray IN (stamina_rule2)

[08:35] Substitution (Team_043): Dwyane Dosunmu OUT → Terry Randle IN (stamina_rule2)

[08:35] Substitution (Team_100): Luka Green OUT → Dirk Sabonis IN (stamina_rule2)

[08:35] Substitution (Team_100): Manu Ball OUT → Evan Butler IN (stamina_rule2)

[08:35] Substitution (Team_100): Tyler Griffin OUT → Tyrese Wade IN (stamina_rule2)

[08:35] Substitution (Team_100): Pau LaVine OUT → Carmelo Ginobili IN (stamina_rule2)

[08:35] Substitution (Team_100): Chris Mobley OUT → John Rozier IN (stamina_rule2)

[08:22] Team_100 possession (Score: 30-42)
Carmelo Ginobili attempts a Midrange. Contested by Joel Murray (4.6 feet, MAN). Carmelo Ginobili misses. FOUL! Loose ball foul on Terry Randle during the rebound battle. [Team fouls: 2] No free throws, side out. (Terry Randle: 1 personal fouls)

[08:08] Team_100 possession (Score: 30-42)
Carmelo Ginobili throws a bad pass! Stolen by Joel Murray! TURNOVER! (live ball)

[07:52] Team_043 possession (Score: 30-42)
Joel Murray attempts a Midrange. Wide open! Evan Butler is 7.1 feet away. [ZONE] JOEL MURRAY MAKES IT!
Score: 32-42

[07:37] Team_100 possession (Score: 32-42)
Dirk Sabonis attempts a 3Pt. Wide open! Dirk Herro is 8.1 feet away. [ZONE] Dirk Sabonis misses. Rebound secured by Terry Randle.

[07:22] Team_043 possession (Score: 32-42)
Joel Murray drives, picks up Carmelo Ginobili. Help arrives from Evan Butler! Joel Murray attempts a Layup. Contested by Evan Butler (5.3 feet, MAN). JOEL MURRAY MAKES IT! Assist: Dirk Herro
Score: 34-42

[07:12] Team_100 possession (Score: 34-42)
Dirk Sabonis attempts a 3Pt. Contested by Dirk Herro (5.2 feet, ZONE). Dirk Sabonis misses. Rebound secured by Dirk Herro.

[07:00] Team_043 possession (Score: 34-42)
Terry Randle attempts a 3Pt. Wide open! John Rozier is 7.0 feet away. [MAN] Terry Randle misses. Offensive rebound by Terry Randle! Terry Randle kicks it out.

[06:44] Team_043 possession (Score: 34-42)
Terry Randle drives to the basket... Terry Randle loses control! Ball rolls out of bounds! TURNOVER! (dead ball)

[06:29] Team_100 possession (Score: 34-42)
Dirk Sabonis attempts a 3Pt. Contested by Jabari Holiday (5.8 feet, MAN). Dirk Sabonis misses. Rebound secured by Dirk Herro.

[06:17] Team_043 possession (Score: 34-42)
Joel Murray attempts a Midrange. Wide open! Carmelo Ginobili is 6.3 feet away. [MAN] JOEL MURRAY MAKES IT! Assist: Ben LaVine
Score: 36-42

[06:08] Team_100 possession (Score: 36-42)
Tyrese Wade attempts a 3Pt. Contested by Dirk Herro (4.7 feet, MAN). Tyrese Wade misses. Rebound secured by Ben LaVine.

[05:53] Team_043 possession (Score: 36-42)
Dirk Herro drives to the basket... Dirk Herro loses control! Ball rolls out of bounds! TURNOVER! (dead ball)

[05:39] Team_100 possession (Score: 36-42)
FOUL! Holding foul on Ben LaVine. [Team fouls: 3] No free throws, side out. (Ben LaVine: 1 personal fouls)

[05:25] Team_100 possession (Score: 36-42)
John Rozier drives, Terry Randle stays with him. John Rozier attempts a Dunk. Contested by Terry Randle (2.2 feet, ZONE). John Rozier misses. FOUL! Loose ball foul on Dirk Herro during the rebound battle. [Team fouls: 4] No free throws, side out. (Dirk Herro: 1 personal fouls)

[05:12] Team_100 possession (Score: 36-42)
FOUL! Reach-in foul on Dirk Herro during the drive. [IN THE BONUS! 5 team fouls] Tyrese Wade to the line for 2 free throws. (Dirk Herro: 2 personal fouls)   FT 1/2: MISS   FT 2/2: GOOD Tyrese Wade makes 1/2 from the line.
Score: 36-43

[04:55] Team_043 possession (Score: 36-43)
Dirk Herro makes the Layup and draws the foul on Tyrese Wade! And-1! Dirk Herro to the line for 1. [Team fouls: 4] (Tyrese Wade: 1 personal fouls)   FT 1/1: GOOD Dirk Herro makes 1/1 from the line.
Score: 39-43

[04:41] Team_100 possession (Score: 39-43)
FOUL! Reach-in foul on Terry Randle during the drive. [IN THE BONUS! 6 team fouls] Carmelo Ginobili to the line for 2 free throws. (Terry Randle: 2 personal fouls)   FT 1/2: GOOD   FT 2/2: GOOD Carmelo Ginobili makes 2/2 from the line.
Score: 39-45

[04:23] Team_043 possession (Score: 39-45)
Terry Randle makes the Layup and draws the foul on John Rozier! And-1! Terry Randle to the line for 1. [BONUS: 5 team fouls] (John Rozier: 1 personal fouls)   FT 1/1: GOOD Terry Randle makes 1/1 from the line.
Score: 42-45

[04:06] Team_100 possession (Score: 42-45)
John Rozier attempts a Midrange. Wide open! Terry Randle is 6.1 feet away. [MAN] John Rozier misses. Rebound secured by Terry Randle.

[03:54] Team_043 possession (Score: 42-45)
Ben LaVine attempts a Midrange. Contested by Evan Butler (4.4 feet, MAN). BEN LAVINE MAKES IT! Assist: Jabari Holiday
Score: 44-45

[03:36] Team_100 possession (Score: 44-45)
FOUL! Holding foul on Jabari Holiday. [IN THE BONUS! 7 team fouls] Dirk Sabonis to the line for 2 free throws. (Jabari Holiday: 1 personal fouls)   FT 1/2: GOOD   FT 2/2: GOOD Dirk Sabonis makes 2/2 from the line.
Score: 44-47

[03:24] Team_043 possession (Score: 44-47)
Terry Randle loses control! Ball rolls out of bounds! TURNOVER! (dead ball)

[03:10] Team_100 possession (Score: 44-47)
FOUL! Reach-in foul on Joel Murray during the drive. [IN THE BONUS! 8 team fouls] Carmelo Ginobili to the line for 2 free throws. (Joel Murray: 1 personal fouls)   FT 1/2: MISS   FT 2/2: GOOD Carmelo Ginobili makes 1/2 from the line.
Score: 44-48

[02:55] Team_043 possession (Score: 44-48)
FOUL! Shooting foul on Evan Butler. Ben LaVine to the line for 2 free throws. [BONUS: 6 team fouls] (Evan Butler: 1 personal fouls)   FT 1/2: MISS   FT 2/2: MISS Ben LaVine makes 0/2 from the line. Offensive rebound by Dirk Herro! Dirk Herro puts it back in!
Score: 46-48

[02:43] Team_100 possession (Score: 46-48)
Evan Butler attempts a 3Pt. Contested by Dirk Herro (2.5 feet, ZONE). EVAN BUTLER MAKES IT! Assist: Dirk Sabonis
Score: 46-51

[02:28] Team_043 possession (Score: 46-51)
Jabari Holiday drives to the basket... Jabari Holiday throws a bad pass out of bounds! TURNOVER! (dead ball)

[02:16] Team_100 possession (Score: 46-51)
Dirk Sabonis attempts a 3Pt. Contested by Dirk Herro (2.3 feet, ZONE). Dirk Sabonis misses. Rebound secured by Terry Randle.

[01:59] Team_043 possession (Score: 46-51)
Terry Randle attempts a Midrange. Contested by John Rozier (2.7 feet, MAN). Terry Randle misses. Rebound secured by Carmelo Ginobili.

[01:44] Team_100 possession (Score: 46-51)
Evan Butler drives to the basket... Evan Butler throws a bad pass out of bounds! TURNOVER! (dead ball)

[01:32] Team_043 possession (Score: 46-51)
Jabari Holiday attempts a Layup. Contested by John Rozier (5.1 feet, ZONE). JABARI HOLIDAY MAKES IT!
Score: 48-51

[01:19] Team_100 possession (Score: 48-51)
Tyrese Wade attempts a 3Pt. Contested by Dirk Herro (3.8 feet, ZONE). Tyrese Wade misses. Offensive rebound by John Rozier! John Rozier puts it back in!
Score: 48-53

[01:05] Team_043 possession (Score: 48-53)
Joel Murray attempts a Midrange. Contested by Carmelo Ginobili (4.6 feet, ZONE). Joel Murray misses. Offensive rebound by Terry Randle! Terry Randle kicks it out.

[00:53] Team_043 possession (Score: 48-53)
Dirk Herro attempts a 3Pt. Wide open! Tyrese Wade is 6.4 feet away. [ZONE] Dirk Herro misses. Rebound secured by John Rozier.

[00:35] Team_100 possession (Score: 48-53)
John Rozier attempts a Layup. Contested by Terry Randle (4.5 feet, MAN). JOHN ROZIER MAKES IT!
Score: 48-55

[00:20] Team_043 possession (Score: 48-55)
Ben LaVine makes the Layup and draws the foul on John Rozier! And-1! Ben LaVine to the line for 1. [BONUS: 7 team fouls] (John Rozier: 2 personal fouls)   FT 1/1: GOOD Ben LaVine makes 1/1 from the line.
Score: 51-55

[00:05] Team_100 possession (Score: 51-55)
FOUL! Shooting foul on Dirk Herro. Tyrese Wade to the line for 3 free throws. [BONUS: 9 team fouls] (Dirk Herro: 3 personal fouls)   FT 1/3: MISS   FT 2/3: GOOD   FT 3/3: GOOD Tyrese Wade makes 2/3 from the line.
Score: 51-57

================================================================================
                              2ND QUARTER COMPLETE                              
================================================================================

2ND QUARTER SCORE: Team_043 31, Team_100 23

BOX SCORE:
================================================================================

Team_043
--------------------------------------------------------------------------------
Player                MIN  PTS  REB  AST  TO      FG   FG%      3P   3P%
--------------------------------------------------------------------------------
Malcolm Murray         16    6    0    0   0   2/2   100.0     0/0   0.0
Joel Murray             8    6    0    0   0   3/3   100.0     0/0   0.0
Dirk Herro              8    5    2    1   0   2/3    66.7     0/0   0.0
Ben LaVine              8    5    1    1   0   2/2   100.0     0/0   0.0
Terry Randle            8    3    5    0   0   1/2    50.0     0/0   0.0
D'Angelo Iverson       16    2    2    0   0   1/1   100.0     0/0   0.0
Manu Carter            13    2    1    1   0   1/1   100.0     0/0   0.0
Jabari Holiday         12    2    0    1   0   1/1   100.0     0/0   0.0
Dwyane Dosunmu         16    0    0    0   0   0/1     0.0     0/0   0.0
Magic Durant           16    0    0    0   0   0/1     0.0     0/0   0.0

TEAM: FG: 13/17 (76.5%), 3PT: 1/3 (33.3%), REB: 11 (3 off, 8 def), AST: 4, TO: 5
TEAM FOULS: 9 [Team_100 in BONUS]


Team_100
--------------------------------------------------------------------------------
Player                MIN  PTS  REB  AST  TO      FG   FG%      3P   3P%
--------------------------------------------------------------------------------
John Rozier            12    4    4    0   0   2/3    66.7     0/0   0.0
Luka Green             16    3    0    0   0   1/1   100.0     0/0   0.0
Manu Ball              16    3    0    0   0   1/1   100.0     0/0   0.0
Tyrese Wade             8    3    0    0   0   2/3    66.7     0/0   0.0
Carmelo Ginobili        8    3    1    0   0   2/2   100.0     0/0   0.0
Evan Butler             8    3    0    0   0   1/1   100.0     0/0   0.0
Tyler Griffin          16    2    0    0   0   1/1   100.0     0/0   0.0
Dirk Sabonis            8    2    0    1   0   1/5    20.0     0/0   0.0
Pau LaVine             16    0    1    0   0   0/2     0.0     0/0   0.0
Chris Mobley           12    0    1    2   0   0/0     0.0     0/0   0.0

TEAM: FG: 11/19 (57.9%), 3PT: 4/10 (40.0%), REB: 7 (3 off, 4 def), AST: 3, TO: 3
TEAM FOULS: 7 [Team_043 in BONUS]

================================================================================

================================================================================
                       3RD QUARTER - Team_043 vs Team_100                       
================================================================================

[12:00] Team_043 possession (Score: 51-57)
D'Angelo Iverson attempts a Midrange. Contested by Tyler Griffin (4.8 feet, ZONE). D'ANGELO IVERSON MAKES IT! Assist: Manu Carter
Score: 53-57

[11:49] Team_100 possession (Score: 53-57)
Pau LaVine attempts a Layup. BLOCKED BY MANU CARTER! Ball is loose! Rebound secured by Dwyane Dosunmu.

[11:31] Team_043 possession (Score: 53-57)
Malcolm Murray drives, picks up Pau LaVine. Help arrives from Manu Ball! Malcolm Murray attempts a Dunk. Contested by Manu Ball (3.0 feet, ZONE). MALCOLM MURRAY MAKES IT! Assist: Magic Durant
Score: 55-57

[11:16] Team_100 possession (Score: 55-57)
Chris Mobley attempts a Midrange. Contested by Manu Carter (5.1 feet, ZONE). Chris Mobley misses. Rebound secured by Manu Carter.

[11:03] Team_043 possession (Score: 55-57)
Magic Durant drives, Pau LaVine stays with him. Magic Durant attempts a Layup. Contested by Pau LaVine (3.7 feet, ZONE). MAGIC DURANT MAKES IT! Assist: Manu Carter
Score: 57-57

[10:43] Team_100 possession (Score: 57-57)
Tyler Griffin attempts a 3Pt. Wide open! D'Angelo Iverson is 6.9 feet away. [ZONE] Tyler Griffin misses. Rebound secured by D'Angelo Iverson.

[10:30] Team_043 possession (Score: 57-57)
D'Angelo Iverson attempts a Midrange. Contested by Manu Ball (4.8 feet, ZONE). D'Angelo Iverson misses. Rebound secured by Chris Mobley.

[10:16] Team_100 possession (Score: 57-57)
Manu Ball makes the Layup and draws the foul on Manu Carter! And-1! Manu Ball to the line for 1. [Team fouls: 1] (Manu Carter: 1 personal fouls)   FT 1/1: MISS Manu Ball makes 0/1 from the line. Rebound secured by D'Angelo Iverson.
Score: 57-59

[10:01] Team_043 possession (Score: 57-59)
FOUL! Reach-in foul on Pau LaVine during the drive. [Team fouls: 1] No free throws, side out. (Pau LaVine: 1 personal fouls)

[09:48] Team_043 possession (Score: 57-59)
Dwyane Dosunmu attempts a 3Pt. Contested by Chris Mobley (3.4 feet, MAN). Dwyane Dosunmu misses. Rebound secured by Chris Mobley.

[09:36] Team_100 possession (Score: 57-59)
FOUL! Shooting foul on D'Angelo Iverson. Tyler Griffin to the line for 2 free throws. [Team fouls: 2] (D'Angelo Iverson: 1 personal fouls)   FT 1/2: GOOD   FT 2/2: GOOD Tyler Griffin makes 2/2 from the line.
Score: 57-61

[09:23] Team_043 possession (Score: 57-61)
Magic Durant makes the Layup and draws the foul on Tyler Griffin! And-1! Magic Durant to the line for 1. [Team fouls: 2] (Tyler Griffin: 1 personal fouls)   FT 1/1: GOOD Magic Durant makes 1/1 from the line.
Score: 60-61

[09:08] Team_100 possession (Score: 60-61)
Pau LaVine drives to the basket... Pau LaVine loses control! Ball rolls out of bounds! TURNOVER! (dead ball)

[08:56] Team_043 possession (Score: 60-61)
D'Angelo Iverson attempts a 3Pt. Contested by Luka Green (5.5 feet, ZONE). D'Angelo Iverson misses. Rebound secured by Chris Mobley.

[08:45] Team_100 possession (Score: 60-61)
Chris Mobley loses control! Ball rolls out of bounds! TURNOVER! (dead ball)

[08:30] Team_043 possession (Score: 60-61)
Magic Durant commits a violation (traveling/carry)! TURNOVER! (dead ball)

[08:13] Team_100 possession (Score: 60-61)
Manu Ball attempts a 3Pt. Wide open! Magic Durant is 7.1 feet away. [MAN] Manu Ball misses. Rebound secured by D'Angelo Iverson.

[08:00] Team_043 possession (Score: 60-61)
Manu Carter drives to the basket... Manu Carter throws a bad pass out of bounds! TURNOVER! (dead ball)

[07:46] Team_100 possession (Score: 60-61)
Pau LaVine attempts a Midrange. Wide open! Manu Carter is 6.3 feet away. [MAN] Pau LaVine misses. Offensive rebound by Chris Mobley! Chris Mobley kicks it out.

[07:30] Team_100 possession (Score: 60-61)
Chris Mobley attempts a Midrange. Contested by Manu Carter (4.2 feet, MAN). CHRIS MOBLEY MAKES IT!
Score: 60-63

[07:13] Team_043 possession (Score: 60-63)
Manu Carter drives, Pau LaVine stays with him. Manu Carter attempts a Dunk. Wide open! Pau LaVine is 8.7 feet away. [MAN] MANU CARTER MAKES IT! Assist: Malcolm Murray
Score: 62-63

[07:01] Team_100 possession (Score: 62-63)
Tyler Griffin drives, picks up D'Angelo Iverson. Help arrives from Malcolm Murray! Tyler Griffin attempts a Dunk. Heavily contested by Malcolm Murray (0.8 feet, MAN)! Tyler Griffin misses. Rebound secured by D'Angelo Iverson.

[06:46] Team_043 possession (Score: 62-63)
Manu Carter attempts a Layup. Wide open! Pau LaVine is 6.8 feet away. [ZONE] MANU CARTER MAKES IT!
Score: 64-63

[06:36] Team_100 possession (Score: 64-63)
Manu Ball attempts a 3Pt. Contested by Magic Durant (3.4 feet, MAN). MANU BALL MAKES IT! Assist: Tyler Griffin
Score: 64-66

[06:21] Team_043 possession (Score: 64-66)
Magic Durant attempts a Midrange. Contested by Tyler Griffin (2.6 feet, ZONE). MAGIC DURANT MAKES IT!
Score: 66-66

[06:08] Team_100 possession (Score: 66-66)
Luka Green attempts a 3Pt. Contested by Malcolm Murray (3.8 feet, MAN). LUKA GREEN MAKES IT! Assist: Tyler Griffin
Score: 66-69

[05:55] Team_043 possession (Score: 66-69)
Magic Durant drives and kicks out. Malcolm Murray attempts a Midrange. Heavily contested by Luka Green (0.5 feet, MAN)! Malcolm Murray misses. Rebound secured by Pau LaVine.

[05:42] Team_100 possession (Score: 66-69)
Luka Green attempts a 3Pt. Heavily contested by D'Angelo Iverson (0.6 feet, ZONE)! Luka Green misses. Rebound secured by Manu Carter.

[05:27] Team_043 possession (Score: 66-69)
Malcolm Murray attempts a 3Pt. Heavily contested by Luka Green (1.8 feet, MAN)! Malcolm Murray misses. Offensive rebound by Manu Carter! Manu Carter kicks it out.

[05:14] Team_043 possession (Score: 66-69)
Magic Durant attempts a Midrange. Wide open! Manu Ball is 6.3 feet away. [ZONE] MAGIC DURANT MAKES IT!
Score: 68-69

[05:00] Team_100 possession (Score: 68-69)
Chris Mobley attempts a Layup. Heavily contested by Manu Carter (1.7 feet, MAN)! CHRIS MOBLEY MAKES IT! Assist: Tyler Griffin
Score: 68-71

[04:44] Team_043 possession (Score: 68-71)
Manu Carter attempts a 3Pt. Contested by Pau LaVine (4.4 feet, MAN). MANU CARTER MAKES IT! Assist: Malcolm Murray
Score: 71-71

[04:27] Team_100 possession (Score: 71-71)
FOUL! Holding foul on Magic Durant. [Team fouls: 3] No free throws, side out. (Magic Durant: 1 personal fouls)

[04:18] Team_100 possession (Score: 71-71)
Chris Mobley attempts a Midrange. Contested by Manu Carter (2.9 feet, ZONE). Chris Mobley misses. Offensive rebound by Pau LaVine! Pau LaVine kicks it out.

[04:03] Team_100 possession (Score: 71-71)
Pau LaVine attempts a 3Pt. Heavily contested by D'Angelo Iverson (1.6 feet, ZONE)! Pau LaVine misses. FOUL! Loose ball foul on Manu Carter during the rebound battle. [Team fouls: 4] No free throws, side out. (Manu Carter: 2 personal fouls)

[03:47] Team_100 possession (Score: 71-71)
Tyler Griffin attempts a Midrange. Contested by Manu Carter (3.9 feet, ZONE). TYLER GRIFFIN MAKES IT! Assist: Pau LaVine
Score: 71-73

[03:35] Team_043 possession (Score: 71-73)
D'Angelo Iverson attempts a 3Pt. Wide open! Luka Green is 6.2 feet away. [ZONE] D'Angelo Iverson misses. Offensive rebound by D'Angelo Iverson! D'Angelo Iverson kicks it out.

[03:17] Team_043 possession (Score: 71-73)
Malcolm Murray attempts a 3Pt. Wide open! Luka Green is 6.2 feet away. [MAN] MALCOLM MURRAY MAKES IT! Assist: Magic Durant
Score: 74-73

[03:07] Team_100 possession (Score: 74-73)
Tyler Griffin makes the Layup and draws the foul on D'Angelo Iverson! And-1! Tyler Griffin to the line for 1. [BONUS: 5 team fouls] (D'Angelo Iverson: 2 personal fouls)   FT 1/1: GOOD Tyler Griffin makes 1/1 from the line.
Score: 74-76

[02:48] Team_043 possession (Score: 74-76)
FOUL! Reach-in foul on Chris Mobley during the drive. [Team fouls: 3] No free throws, side out. (Chris Mobley: 1 personal fouls)

[02:36] Team_043 possession (Score: 74-76)
Malcolm Murray drives, Luka Green stays with him. Malcolm Murray attempts a Dunk. Contested by Luka Green (3.5 feet, MAN). Malcolm Murray misses. Rebound secured by Tyler Griffin.

[02:20] Team_100 possession (Score: 74-76)
Chris Mobley drives to the basket... Chris Mobley loses the ball! Stripped by Manu Carter! TURNOVER! (live ball)

[02:07] Team_043 possession (Score: 74-76)
D'Angelo Iverson attempts a 3Pt. Heavily contested by Luka Green (2.0 feet, ZONE)! D'ANGELO IVERSON MAKES IT!
Score: 77-76

[01:56] Team_100 possession (Score: 77-76)
Chris Mobley makes the Midrange and draws the foul on Magic Durant! And-1! Chris Mobley to the line for 1. [BONUS: 6 team fouls] (Magic Durant: 2 personal fouls)   FT 1/1: GOOD Chris Mobley makes 1/1 from the line.
Score: 77-79

[01:39] Team_043 possession (Score: 77-79)
Malcolm Murray attempts a 3Pt. Contested by Luka Green (4.3 feet, ZONE). MALCOLM MURRAY MAKES IT! Assist: Magic Durant
Score: 80-79

[01:26] Team_100 possession (Score: 80-79)
Luka Green drives and kicks out. Pau LaVine attempts a Midrange. Contested by Manu Carter (4.8 feet, MAN). PAU LAVINE MAKES IT! Assist: Chris Mobley
Score: 80-81

[01:11] Team_043 possession (Score: 80-81)
FOUL! Holding foul on Chris Mobley. [Team fouls: 4] No free throws, side out. (Chris Mobley: 2 personal fouls)

[00:55] Team_043 possession (Score: 80-81)
Dwyane Dosunmu attempts a Midrange. Wide open! Chris Mobley is 8.1 feet away. [ZONE] Dwyane Dosunmu misses. Rebound secured by Pau LaVine.

[00:42] Team_100 possession (Score: 80-81)
Manu Ball attempts a 3Pt. Contested by D'Angelo Iverson (4.2 feet, ZONE). Manu Ball misses. Rebound secured by Manu Carter.

[00:24] Team_043 possession (Score: 80-81)
D'Angelo Iverson attempts a Midrange. Wide open! Tyler Griffin is 6.3 feet away. [MAN] D'Angelo Iverson misses. Rebound secured by Chris Mobley.

[00:08] Team_100 possession (Score: 80-81)
Chris Mobley loses control! Ball rolls out of bounds! TURNOVER! (dead ball)

[00:08] Substitution (Team_043): Malcolm Murray OUT → Jabari Holiday IN (stamina_rule2)

[00:08] Substitution (Team_043): Magic Durant OUT → Ben LaVine IN (stamina_rule2)

[00:08] Substitution (Team_043): D'Angelo Iverson OUT → Dirk Herro IN (stamina_rule2)

[00:08] Substitution (Team_043): Manu Carter OUT → Joel Murray IN (stamina_rule2)

[00:08] Substitution (Team_043): Dwyane Dosunmu OUT → Terry Randle IN (stamina_rule2)

[00:08] Substitution (Team_100): Luka Green OUT → Dirk Sabonis IN (stamina_rule2)

[00:08] Substitution (Team_100): Manu Ball OUT → Evan Butler IN (stamina_rule2)

[00:08] Substitution (Team_100): Tyler Griffin OUT → Tyrese Wade IN (stamina_rule2)

[00:08] Substitution (Team_100): Pau LaVine OUT → Carmelo Ginobili IN (stamina_rule2)

[00:08] Substitution (Team_100): Chris Mobley OUT → John Rozier IN (stamina_rule2)

================================================================================
                              3RD QUARTER COMPLETE                              
================================================================================

3RD QUARTER SCORE: Team_043 29, Team_100 24

BOX SCORE:
================================================================================

Team_043
--------------------------------------------------------------------------------
Player                MIN  PTS  REB  AST  TO      FG   FG%      3P   3P%
--------------------------------------------------------------------------------
Magic Durant           28    9    0    3   0   4/5    80.0     0/0   0.0
Malcolm Murray         28    8    0    2   0   3/4    75.0     0/0   0.0
Manu Carter            25    7    4    2   0   3/3   100.0     0/0   0.0
D'Angelo Iverson       28    5    5    0   0   2/5    40.0     0/0   0.0
Dwyane Dosunmu         28    0    1    0   0   0/2     0.0     0/0   0.0

TEAM: FG: 12/19 (63.2%), 3PT: 4/6 (66.7%), REB: 10 (2 off, 8 def), AST: 7, TO: 2
TEAM FOULS: 6 [Team_100 in BONUS]


Team_100
--------------------------------------------------------------------------------
Player                MIN  PTS  REB  AST  TO      FG   FG%      3P   3P%
--------------------------------------------------------------------------------
Chris Mobley           24    7    5    1   0   3/4    75.0     0/0   0.0
Tyler Griffin          28    7    1    3   0   3/5    60.0     0/0   0.0
Manu Ball              28    3    0    0   0   1/4    25.0     0/0   0.0
Luka Green             28    3    0    0   0   1/2    50.0     0/0   0.0
Pau LaVine             28    2    4    1   0   1/2    50.0     0/0   0.0

TEAM: FG: 9/17 (52.9%), 3PT: 2/6 (33.3%), REB: 10 (3 off, 7 def), AST: 5, TO: 4
TEAM FOULS: 4

================================================================================

================================================================================
                       4TH QUARTER - Team_043 vs Team_100                       
================================================================================

[12:00] Team_043 possession (Score: 80-81)
Malcolm Murray drives, Luka Green stays with him. Malcolm Murray attempts a Dunk. Wide open! Luka Green is 6.0 feet away. [MAN] MALCOLM MURRAY MAKES IT! Assist: Magic Durant
Score: 82-81

[11:48] Team_100 possession (Score: 82-81)
Luka Green attempts a 3Pt. Contested by Malcolm Murray (2.1 feet, MAN). Luka Green misses. Rebound secured by D'Angelo Iverson.

[11:32] Team_043 possession (Score: 82-81)
FOUL! Shooting foul on Manu Ball. D'Angelo Iverson to the line for 2 free throws. [Team fouls: 1] (Manu Ball: 1 personal fouls)   FT 1/2: GOOD   FT 2/2: MISS D'Angelo Iverson makes 1/2 from the line. Rebound secured by Pau LaVine.
Score: 83-81

[11:15] Team_100 possession (Score: 83-81)
Tyler Griffin attempts a 3Pt. Contested by D'Angelo Iverson (2.5 feet, ZONE). Tyler Griffin misses. Rebound secured by D'Angelo Iverson.

[10:56] Team_043 possession (Score: 83-81)
Magic Durant attempts a Layup. Wide open! Pau LaVine is 6.6 feet away. [ZONE] MAGIC DURANT MAKES IT! Assist: D'Angelo Iverson
Score: 85-81

[10:38] Team_100 possession (Score: 85-81)
Pau LaVine commits a violation (traveling/carry)! TURNOVER! (dead ball)

[10:38] Substitution (Team_043): Malcolm Murray OUT → Jabari Holiday IN (stamina_rule2)

[10:38] Substitution (Team_043): Magic Durant OUT → Ben LaVine IN (stamina_rule2)

[10:38] Substitution (Team_043): D'Angelo Iverson OUT → Dirk Herro IN (stamina_rule2)

[10:38] Substitution (Team_043): Manu Carter OUT → Joel Murray IN (stamina_rule2)

[10:38] Substitution (Team_043): Dwyane Dosunmu OUT → Terry Randle IN (stamina_rule2)

[10:38] Substitution (Team_100): Luka Green OUT → Dirk Sabonis IN (stamina_rule2)

[10:38] Substitution (Team_100): Manu Ball OUT → Evan Butler IN (stamina_rule2)

[10:38] Substitution (Team_100): Tyler Griffin OUT → Tyrese Wade IN (stamina_rule2)

[10:38] Substitution (Team_100): Pau LaVine OUT → Carmelo Ginobili IN (stamina_rule2)

[10:38] Substitution (Team_100): Chris Mobley OUT → John Rozier IN (stamina_rule2)

[10:23] Team_043 possession (Score: 85-81)
Ben LaVine attempts a 3Pt. Wide open! Carmelo Ginobili is 6.1 feet away. [ZONE] Ben LaVine misses. Rebound secured by John Rozier.

[10:06] Team_100 possession (Score: 85-81)
John Rozier makes the Layup and draws the foul on Terry Randle! And-1! John Rozier to the line for 1. [Team fouls: 1] (Terry Randle: 1 personal fouls)   FT 1/1: GOOD John Rozier makes 1/1 from the line.
Score: 85-84

[09:52] Team_043 possession (Score: 85-84)
Jabari Holiday attempts a Layup. Contested by Dirk Sabonis (3.5 feet, MAN). JABARI HOLIDAY MAKES IT!
Score: 87-84

[09:38] Team_100 possession (Score: 87-84)
Carmelo Ginobili drives, Joel Murray stays with him. Carmelo Ginobili attempts a Dunk. Contested by Joel Murray (4.0 feet, MAN). CARMELO GINOBILI MAKES IT! Assist: Dirk Sabonis
Score: 87-86

[09:23] Team_043 possession (Score: 87-86)
Joel Murray makes the Layup and draws the foul on Carmelo Ginobili! And-1! Joel Murray to the line for 1. [Team fouls: 2] (Carmelo Ginobili: 1 personal fouls)   FT 1/1: GOOD Joel Murray makes 1/1 from the line.
Score: 90-86

[09:09] Team_100 possession (Score: 90-86)
Carmelo Ginobili attempts a Midrange. Contested by Joel Murray (2.5 feet, MAN). Carmelo Ginobili misses. Offensive rebound by Carmelo Ginobili! Carmelo Ginobili kicks it out.

[08:51] Team_100 possession (Score: 90-86)
Dirk Sabonis drives, Terry Randle stays with him. Dirk Sabonis attempts a Layup. Heavily contested by Terry Randle (1.9 feet, ZONE)! Dirk Sabonis misses. Rebound secured by Terry Randle.

[08:33] Team_043 possession (Score: 90-86)
Joel Murray attempts a 3Pt. Wide open! Tyrese Wade is 7.6 feet away. [ZONE] JOEL MURRAY MAKES IT! Assist: Ben LaVine
Score: 93-86

[08:18] Team_100 possession (Score: 93-86)
Evan Butler attempts a 3Pt. Wide open! Ben LaVine is 7.4 feet away. [MAN] EVAN BUTLER MAKES IT!
Score: 93-89

[08:03] Team_043 possession (Score: 93-89)
FOUL! Shooting foul on John Rozier. Joel Murray to the line for 2 free throws. [Team fouls: 3] (John Rozier: 1 personal fouls)   FT 1/2: GOOD   FT 2/2: GOOD Joel Murray makes 2/2 from the line.
Score: 95-89

[07:52] Team_100 possession (Score: 95-89)
Evan Butler attempts a Midrange. Wide open! Dirk Herro is 9.0 feet away. [ZONE] EVAN BUTLER MAKES IT!
Score: 95-91

[07:37] Team_043 possession (Score: 95-91)
Joel Murray attempts a Layup. Contested by Carmelo Ginobili (5.0 feet, MAN). JOEL MURRAY MAKES IT! Assist: Dirk Herro
Score: 97-91

[07:22] Team_100 possession (Score: 97-91)
Carmelo Ginobili commits a violation (traveling/carry)! TURNOVER! (dead ball)

[07:11] Team_043 possession (Score: 97-91)
Ben LaVine attempts a Layup. Contested by John Rozier (3.4 feet, ZONE). Ben LaVine misses. Rebound secured by Carmelo Ginobili.

[06:54] Team_100 possession (Score: 97-91)
Carmelo Ginobili loses the ball! Stripped by Joel Murray! TURNOVER! (live ball)

[06:38] Team_043 possession (Score: 97-91)
Ben LaVine attempts a 3Pt. Contested by Evan Butler (4.8 feet, MAN). BEN LAVINE MAKES IT! Assist: Joel Murray
Score: 100-91

[06:21] Team_100 possession (Score: 100-91)
Dirk Sabonis drives and kicks out. John Rozier makes the 3Pt and draws the foul on Dirk Herro! And-1! John Rozier to the line for 1. [Team fouls: 2] (Dirk Herro: 1 personal fouls)   FT 1/1: GOOD John Rozier makes 1/1 from the line.
Score: 100-95

[06:06] Team_043 possession (Score: 100-95)
Jabari Holiday attempts a Midrange. Wide open! Dirk Sabonis is 7.5 feet away. [MAN] JABARI HOLIDAY MAKES IT!
Score: 102-95

[05:52] Team_100 possession (Score: 102-95)
Tyrese Wade attempts a 3Pt. Contested by Dirk Herro (5.3 feet, ZONE). Tyrese Wade misses. Rebound secured by Ben LaVine.

[05:40] Team_043 possession (Score: 102-95)
Joel Murray attempts a 3Pt. Contested by Tyrese Wade (2.9 feet, ZONE). Joel Murray misses. Rebound secured by Carmelo Ginobili.

[05:25] Team_100 possession (Score: 102-95)
Tyrese Wade attempts a 3Pt. Contested by Dirk Herro (4.7 feet, ZONE). TYRESE WADE MAKES IT! Assist: Evan Butler
Score: 102-98

[05:06] Team_043 possession (Score: 102-98)
Ben LaVine attempts a Midrange. Contested by Evan Butler (5.7 feet, MAN). BEN LAVINE MAKES IT! Assist: Jabari Holiday
Score: 104-98

[04:55] Team_100 possession (Score: 104-98)
Dirk Sabonis attempts a 3Pt. Contested by Jabari Holiday (4.5 feet, MAN). Dirk Sabonis misses. Rebound secured by Dirk Herro.

[04:41] Team_043 possession (Score: 104-98)
Terry Randle attempts a Midrange. Contested by Carmelo Ginobili (3.5 feet, ZONE). Terry Randle misses. Rebound secured by John Rozier.

[04:27] Team_100 possession (Score: 104-98)
Tyrese Wade attempts a 3Pt. Contested by Dirk Herro (2.4 feet, ZONE). Tyrese Wade misses. Rebound secured by Dirk Herro.

[04:12] Team_043 possession (Score: 104-98)
Joel Murray makes the Midrange and draws the foul on Carmelo Ginobili! And-1! Joel Murray to the line for 1. [Team fouls: 4] (Carmelo Ginobili: 2 personal fouls)   FT 1/1: GOOD Joel Murray makes 1/1 from the line.
Score: 107-98

[03:58] Team_100 possession (Score: 107-98)
Evan Butler attempts a Midrange. Contested by Ben LaVine (2.6 feet, ZONE). EVAN BUTLER MAKES IT! Assist: Tyrese Wade
Score: 107-100

[03:45] Team_043 possession (Score: 107-100)
Dirk Herro drives to the basket... Dirk Herro throws a bad pass out of bounds! TURNOVER! (dead ball)

[03:26] Team_100 possession (Score: 107-100)
Carmelo Ginobili makes the Layup and draws the foul on Joel Murray! And-1! Carmelo Ginobili to the line for 1. [Team fouls: 3] (Joel Murray: 1 personal fouls)   FT 1/1: GOOD Carmelo Ginobili makes 1/1 from the line.
Score: 107-103

[03:11] Team_043 possession (Score: 107-103)
Joel Murray drives and kicks out. Ben LaVine attempts a 3Pt. Wide open! Evan Butler is 6.7 feet away. [MAN] Ben LaVine misses. Rebound secured by Carmelo Ginobili.

[02:56] Team_100 possession (Score: 107-103)
Tyrese Wade makes the Midrange and draws the foul on Dirk Herro! And-1! Tyrese Wade to the line for 1. [Team fouls: 4] (Dirk Herro: 2 personal fouls)   FT 1/1: GOOD Tyrese Wade makes 1/1 from the line.
Score: 107-106

[02:41] Team_043 possession (Score: 107-106)
Dirk Herro drives and kicks out. Joel Murray attempts a 3Pt. Contested by Carmelo Ginobili (4.1 feet, MAN). Joel Murray misses. Rebound secured by Tyrese Wade.

[02:28] Team_100 possession (Score: 107-106)
Carmelo Ginobili attempts a Midrange. Wide open! Joel Murray is 6.1 feet away. [MAN] CARMELO GINOBILI MAKES IT! Assist: Evan Butler
Score: 107-108

[02:12] Team_043 possession (Score: 107-108)
Ben LaVine attempts a Midrange. Wide open! Carmelo Ginobili is 7.7 feet away. [ZONE] BEN LAVINE MAKES IT!
Score: 109-108

[01:55] Team_100 possession (Score: 109-108)
Tyrese Wade attempts a 3Pt. Contested by Dirk Herro (4.7 feet, MAN). Tyrese Wade misses. Rebound secured by Terry Randle.

[01:42] Team_043 possession (Score: 109-108)
Dirk Herro attempts a 3Pt. Contested by Tyrese Wade (5.4 feet, MAN). Dirk Herro misses. Rebound secured by Carmelo Ginobili.

[01:33] Team_100 possession (Score: 109-108)
Dirk Sabonis attempts a 3Pt. Wide open! Jabari Holiday is 6.7 feet away. [MAN] Dirk Sabonis misses. FOUL! Loose ball foul on Dirk Herro during the rebound battle. [IN THE BONUS! 5 team fouls] Carmelo Ginobili to the line for 2 free throws. (Dirk Herro: 3 personal fouls)   FT 1/2: GOOD   FT 2/2: GOOD Carmelo Ginobili makes 2/2 from the line.
Score: 109-110

[01:16] Team_043 possession (Score: 109-110)
Joel Murray attempts a 3Pt. Contested by Tyrese Wade (5.9 feet, ZONE). Joel Murray misses. Rebound secured by Carmelo Ginobili.

[01:02] Team_100 possession (Score: 109-110)
FOUL! Shooting foul on Terry Randle. John Rozier to the line for 2 free throws. [BONUS: 6 team fouls] (Terry Randle: 2 personal fouls)   FT 1/2: GOOD   FT 2/2: GOOD John Rozier makes 2/2 from the line.
Score: 109-112

[00:45] Team_043 possession (Score: 109-112)
Dirk Herro attempts a Layup. Contested by Carmelo Ginobili (5.1 feet, ZONE). DIRK HERRO MAKES IT! Assist: Joel Murray
Score: 111-112

[00:32] Team_100 possession (Score: 111-112)
Evan Butler attempts a 3Pt. Contested by Ben LaVine (5.5 feet, MAN). EVAN BUTLER MAKES IT!
Score: 111-115

[00:17] Team_043 possession (Score: 111-115)
FOUL! Offensive foul on Terry Randle! John Rozier drew the charge! [Team fouls: 7] (Terry Randle: 3 personal fouls) TURNOVER! (dead ball)

[00:01] Team_100 possession (Score: 111-115)
Carmelo Ginobili throws a bad pass out of bounds! TURNOVER! (dead ball)

================================================================================
                              4TH QUARTER COMPLETE                              
================================================================================

4TH QUARTER SCORE: Team_043 31, Team_100 34

BOX SCORE:
================================================================================

Team_043
--------------------------------------------------------------------------------
Player                MIN  PTS  REB  AST  TO      FG   FG%      3P   3P%
--------------------------------------------------------------------------------
Joel Murray            19   13    0    2   0   5/8    62.5     0/0   0.0
Ben LaVine             19    7    1    1   0   3/5    60.0     0/0   0.0
Jabari Holiday         22    4    0    1   0   2/2   100.0     0/0   0.0
Malcolm Murray         30    2    0    0   0   1/1   100.0     0/0   0.0
Magic Durant           30    2    0    1   0   1/1   100.0     0/0   0.0
Dirk Herro             19    2    2    1   0   1/3    33.3     0/0   0.0
D'Angelo Iverson       30    0    2    1   0   0/1     0.0     0/0   0.0
Terry Randle           19    0    2    0   0   0/1     0.0     0/0   0.0

TEAM: FG: 13/22 (59.1%), 3PT: 2/6 (33.3%), REB: 7 (0 off, 7 def), AST: 7, TO: 2
TEAM FOULS: 7 [Team_100 in BONUS]


Team_100
--------------------------------------------------------------------------------
Player                MIN  PTS  REB  AST  TO      FG   FG%      3P   3P%
--------------------------------------------------------------------------------
Evan Butler            19   10    0    2   0   4/4   100.0     0/0   0.0
John Rozier            23    9    2    0   0   3/3   100.0     0/0   0.0
Carmelo Ginobili       19    9    6    0   0   4/4   100.0     0/0   0.0
Tyrese Wade            19    6    1    1   0   2/5    40.0     0/0   0.0
Luka Green             30    0    0    0   0   0/1     0.0     0/0   0.0
Pau LaVine             30    0    1    0   0   0/0     0.0     0/0   0.0
Tyler Griffin          30    0    0    0   0   0/1     0.0     0/0   0.0
Dirk Sabonis           19    0    0    1   0   0/2     0.0     0/0   0.0

TEAM: FG: 13/20 (65.0%), 3PT: 4/10 (40.0%), REB: 10 (1 off, 9 def), AST: 4, TO: 4
TEAM FOULS: 4

================================================================================

================================================================================
                               FULL GAME COMPLETE                               
================================================================================

FINAL SCORE: Team_043 111, Team_100 115

SCORING BY QUARTER:
--------------------------------------------------------------------------------
Team                     Q1     Q2     Q3     Q4    FINAL
--------------------------------------------------------------------------------
Team_043                 20     31     29     31      111
Team_100                 34     23     24     34      115
--------------------------------------------------------------------------------

FULL GAME BOX SCORE:
================================================================================

Team_043
--------------------------------------------------------------------------------
Player                MIN  PTS  REB  AST  TO      FG   FG%      3P   3P%      FT STL BLK
--------------------------------------------------------------------------------
Malcolm Murray         30   19    0    2   0   7/9    77.8   4/5    80.0   1/1     0   0
Magic Durant           30   11    0    6   1   5/8    62.5   0/1     0.0   1/1     0   0
D'Angelo Iverson       30   12   13    1   4   5/11   45.5   2/4    50.0   1/2     0   0
Dwyane Dosunmu         30    9    4    1   3   3/7    42.9   0/1     0.0   3/3     0   0
Manu Carter            26    9    7    6   2   4/6    66.7   1/1   100.0   0/0     1   1
Jabari Holiday         22    9    0    2   1   4/5    80.0   1/1   100.0   0/0     0   0
Ben LaVine             19   12    2    2   2   6/8    75.0   1/2    50.0   1/3     0   0
Dirk Herro             19    7    5    2   1   2/5    40.0   0/2     0.0   1/1     0   0
Joel Murray            19   19    0    2   0   8/11   72.7   1/3    33.3   4/4     2   0
Terry Randle           19    3    7    0   2   1/3    33.3   0/0     0.0   1/1     0   0

TEAM: FG: 46/74 (62.2%), 3PT: 10/20 (50.0%), REB: 37 (7 off, 30 def), AST: 24, TO: 16


Team_100
--------------------------------------------------------------------------------
Player                MIN  PTS  REB  AST  TO      FG   FG%      3P   3P%      FT STL BLK
--------------------------------------------------------------------------------
Luka Green             30   16    0    1   0   5/9    55.6   2/5    40.0   5/6     0   0
Manu Ball              30   13    0    1   2   5/11   45.5   3/8    37.5   0/1     0   0
Tyler Griffin          30   13    5    5   1   6/11   54.5   0/4     0.0   3/3     0   0
Pau LaVine             30    7    9    1   2   2/5    40.0   0/1     0.0   1/1     0   0
Chris Mobley           26    9   10    3   3   5/6    83.3   0/0     0.0   3/3     1   1
John Rozier            23   18    7    0   0   5/6    83.3   0/0     0.0   7/7     0   0
Dirk Sabonis           19    2    0    2   0   2/8    25.0   1/6    16.7   2/2     0   0
Evan Butler            19   13    0    2   0   5/5   100.0   3/3   100.0   0/0     0   0
Tyrese Wade            19    9    1    1   0   5/9    55.6   3/7    42.9   4/6     0   0
Carmelo Ginobili       19   12    7    0   5   5/5   100.0   0/0     0.0   6/7     0   0

TEAM: FG: 46/76 (60.5%), 3PT: 12/34 (35.3%), REB: 39 (11 off, 28 def), AST: 16, TO: 13

================================================================================
